number,value,datetime_start,datetime_complete,duration,params_bootstrap,params_criterion,params_max_depth,params_max_features,params_min_samples_leaf,params_min_samples_split,params_n_estimators,system_attrs_auto:sampler,state
1275,0.4083484200858072,2025-04-24 22:22:21.403856,2025-04-24 22:22:26.372794,0 days 00:00:04.968938,True,squared_error,31,,2,7,909,TPESampler,COMPLETE
1276,0.4934296481998035,2025-04-24 22:22:24.308605,2025-04-24 22:22:29.009980,0 days 00:00:04.701375,True,squared_error,25,,3,18,989,TPESampler,COMPLETE
1277,0.40513541599177677,2025-04-24 22:22:25.333658,2025-04-24 22:22:31.571234,0 days 00:00:06.237576,True,squared_error,34,,1,5,924,TPESampler,COMPLETE
1278,0.43970948212418065,2025-04-24 22:22:26.561839,2025-04-24 22:22:30.003616,0 days 00:00:03.441777,True,squared_error,41,,4,4,803,TPESampler,COMPLETE
1279,0.4022106936717879,2025-04-24 22:22:29.286790,2025-04-24 22:22:35.005622,0 days 00:00:05.718832,True,squared_error,49,,2,3,972,TPESampler,COMPLETE
1280,0.4164067281377336,2025-04-24 22:22:30.491555,2025-04-24 22:22:35.088428,0 days 00:00:04.596873,True,squared_error,27,,3,4,983,TPESampler,COMPLETE
1281,0.4053197547965421,2025-04-24 22:22:31.755793,2025-04-24 22:23:11.336495,0 days 00:00:39.580702,True,absolute_error,37,,2,5,923,TPESampler,COMPLETE
1282,0.40218194661575374,2025-04-24 22:22:35.166468,2025-04-24 22:22:40.708017,0 days 00:00:05.541549,True,squared_error,39,,2,3,985,TPESampler,COMPLETE
1283,0.43965163595953727,2025-04-24 22:22:35.296933,2025-04-24 22:22:39.607824,0 days 00:00:04.310891,True,squared_error,37,,4,6,991,TPESampler,COMPLETE
1284,0.40870762192193216,2025-04-24 22:22:39.801415,2025-04-24 22:22:45.659425,0 days 00:00:05.858010,True,squared_error,30,,1,4,898,TPESampler,COMPLETE
1285,1.2294795463495294,2025-04-24 22:22:40.913018,2025-04-24 22:22:42.808115,0 days 00:00:01.895097,True,squared_error,32,log2,2,2,996,TPESampler,COMPLETE
1286,0.44729079843912595,2025-04-24 22:22:42.984219,2025-04-24 22:22:48.434284,0 days 00:00:05.450065,False,squared_error,27,,4,3,976,TPESampler,COMPLETE
1287,0.4164281099935114,2025-04-24 22:22:45.872030,2025-04-24 22:22:50.704829,0 days 00:00:04.832799,True,squared_error,25,,3,2,990,TPESampler,COMPLETE
1288,1.384074020904311,2025-04-24 22:22:48.609368,2025-04-24 22:22:49.588406,0 days 00:00:00.979038,False,absolute_error,8,log2,9,5,208,TPESampler,COMPLETE
1289,0.8637838974451361,2025-04-24 22:22:49.806407,2025-04-24 22:23:12.909082,0 days 00:00:23.102675,True,absolute_error,31,,2,48,576,TPESampler,COMPLETE
1290,1.2813310524535257,2025-04-24 22:22:50.906813,2025-04-24 22:22:52.093180,0 days 00:00:01.186367,False,squared_error,30,log2,4,11,572,TPESampler,COMPLETE
1291,0.4023823341478071,2025-04-24 22:22:52.520767,2025-04-24 22:22:56.593416,0 days 00:00:04.072649,True,squared_error,46,,2,4,841,TPESampler,COMPLETE
1292,1.2933802549003233,2025-04-24 22:22:56.782911,2025-04-24 22:22:57.990605,0 days 00:00:01.207694,True,squared_error,8,log2,3,2,479,TPESampler,COMPLETE
1293,0.4022358403679246,2025-04-24 22:22:58.178152,2025-04-24 22:23:02.818387,0 days 00:00:04.640235,True,squared_error,31,,2,3,983,TPESampler,COMPLETE
1294,1.2493371511947464,2025-04-24 22:23:03.018248,2025-04-24 22:23:03.874242,0 days 00:00:00.855994,False,squared_error,44,sqrt,12,4,371,TPESampler,COMPLETE
1295,0.40225661789919487,2025-04-24 22:23:04.052764,2025-04-24 22:23:08.744617,0 days 00:00:04.691853,True,squared_error,29,,2,4,996,TPESampler,COMPLETE
1296,1.2263328311094615,2025-04-24 22:23:08.928209,2025-04-24 22:23:10.314339,0 days 00:00:01.386130,True,squared_error,35,sqrt,7,13,718,TPESampler,COMPLETE
1297,0.8239264398872581,2025-04-24 22:23:10.499638,2025-04-24 22:23:21.200325,0 days 00:00:10.700687,True,absolute_error,27,sqrt,1,14,753,TPESampler,COMPLETE
1298,0.4159702073907226,2025-04-24 22:23:11.519986,2025-04-24 22:23:15.643911,0 days 00:00:04.123925,True,squared_error,36,,3,3,842,TPESampler,COMPLETE
1299,0.41866388873708155,2025-04-24 22:23:13.102868,2025-04-24 22:23:19.720728,0 days 00:00:06.617860,True,squared_error,45,,1,3,989,TPESampler,COMPLETE
1300,1.1454889096640606,2025-04-24 22:23:15.837941,2025-04-24 22:23:17.451644,0 days 00:00:01.613703,True,squared_error,32,sqrt,5,4,783,TPESampler,COMPLETE
1301,0.42625721937447664,2025-04-24 22:23:17.631983,2025-04-24 22:23:24.076304,0 days 00:00:06.444321,True,squared_error,34,,1,2,851,TPESampler,COMPLETE
1302,0.4159364344123085,2025-04-24 22:23:19.902632,2025-04-24 22:23:24.142307,0 days 00:00:04.239675,True,squared_error,44,,3,2,841,TPESampler,COMPLETE
1303,0.5137805567960555,2025-04-24 22:23:21.392288,2025-04-24 22:23:24.859172,0 days 00:00:03.466884,True,squared_error,45,sqrt,1,3,990,TPESampler,COMPLETE
1304,0.6135115115265619,2025-04-24 22:23:24.245095,2025-04-24 22:23:28.071500,0 days 00:00:03.826405,True,squared_error,47,log2,1,2,775,TPESampler,COMPLETE
1305,0.4023745103445129,2025-04-24 22:23:24.296914,2025-04-24 22:23:31.107042,0 days 00:00:06.810128,True,squared_error,47,,2,3,998,TPESampler,COMPLETE
1306,0.43965618716663735,2025-04-24 22:23:25.115446,2025-04-24 22:23:30.234954,0 days 00:00:05.119508,True,squared_error,35,,4,4,999,TPESampler,COMPLETE
1307,1.347841307797681,2025-04-24 22:23:28.262473,2025-04-24 22:23:29.709319,0 days 00:00:01.446846,False,absolute_error,15,sqrt,14,3,443,TPESampler,COMPLETE
1308,0.9898623513855681,2025-04-24 22:23:29.906020,2025-04-24 22:23:32.069433,0 days 00:00:02.163413,True,squared_error,21,sqrt,3,5,562,TPESampler,COMPLETE
1309,0.41651152129787683,2025-04-24 22:23:30.443555,2025-04-24 22:23:35.967880,0 days 00:00:05.524325,True,squared_error,34,,3,4,996,TPESampler,COMPLETE
1310,0.42346407430819916,2025-04-24 22:23:31.332401,2025-04-24 22:23:37.752048,0 days 00:00:06.419647,True,squared_error,27,,1,2,824,TPESampler,COMPLETE
1311,1.1799232958649992,2025-04-24 22:23:32.499934,2025-04-24 22:23:33.700126,0 days 00:00:01.200192,True,absolute_error,26,sqrt,4,2,164,TPESampler,COMPLETE
1312,0.402871470092138,2025-04-24 22:23:33.877588,2025-04-24 22:23:40.330542,0 days 00:00:06.452954,False,squared_error,40,,2,4,857,TPESampler,COMPLETE
1313,1.2426500926955033,2025-04-24 22:23:36.152457,2025-04-24 22:23:37.623176,0 days 00:00:01.470719,True,squared_error,46,log2,2,5,675,TPESampler,COMPLETE
1314,0.5128173253340663,2025-04-24 22:23:37.805077,2025-04-24 22:23:55.642650,0 days 00:00:17.837573,False,absolute_error,8,,2,4,255,TPESampler,COMPLETE
1315,0.402708524540764,2025-04-24 22:23:37.996597,2025-04-24 22:23:42.733592,0 days 00:00:04.736995,True,squared_error,37,,2,3,873,TPESampler,COMPLETE
1316,0.4021609178211452,2025-04-24 22:23:40.530619,2025-04-24 22:23:45.569811,0 days 00:00:05.039192,True,squared_error,42,,2,3,970,TPESampler,COMPLETE
1317,0.4397794625342369,2025-04-24 22:23:42.924955,2025-04-24 22:23:47.131423,0 days 00:00:04.206468,True,squared_error,38,,4,2,979,TPESampler,COMPLETE
1318,1.3566931222638225,2025-04-24 22:23:45.765498,2025-04-24 22:23:47.142303,0 days 00:00:01.376805,True,absolute_error,13,log2,3,12,366,TPESampler,COMPLETE
1319,0.6717824858192409,2025-04-24 22:23:47.295859,2025-04-24 22:23:53.969154,0 days 00:00:06.673295,True,absolute_error,9,,9,7,508,TPESampler,COMPLETE
1320,0.41905111673568124,2025-04-24 22:23:47.347051,2025-04-24 22:23:53.737871,0 days 00:00:06.390820,True,squared_error,29,,1,3,999,TPESampler,COMPLETE
1321,0.9510337463279452,2025-04-24 22:23:53.928992,2025-04-24 22:24:06.336338,0 days 00:00:12.407346,False,absolute_error,32,log2,1,12,726,TPESampler,COMPLETE
1322,0.40550009857827163,2025-04-24 22:23:54.189906,2025-04-24 22:23:59.240613,0 days 00:00:05.050707,True,squared_error,45,,2,6,998,TPESampler,COMPLETE
1323,0.41578238186648064,2025-04-24 22:23:55.837666,2025-04-24 22:25:10.952038,0 days 00:01:15.114372,True,absolute_error,38,,1,4,992,TPESampler,COMPLETE
1324,0.40221102155262484,2025-04-24 22:23:59.413803,2025-04-24 22:24:03.931144,0 days 00:00:04.517341,True,squared_error,41,,2,4,968,TPESampler,COMPLETE
1325,0.4025025645153774,2025-04-24 22:24:04.099002,2025-04-24 22:24:08.452890,0 days 00:00:04.353888,True,squared_error,31,,2,2,834,TPESampler,COMPLETE
1326,0.40254511286107825,2025-04-24 22:24:06.529224,2025-04-24 22:24:10.974404,0 days 00:00:04.445180,True,squared_error,34,,2,4,865,TPESampler,COMPLETE
1327,0.4862312048402338,2025-04-24 22:24:08.636142,2025-04-24 22:25:29.988465,0 days 00:01:21.352323,False,absolute_error,11,,1,2,768,TPESampler,COMPLETE
1328,1.3952952677134611,2025-04-24 22:24:11.159690,2025-04-24 22:24:12.208231,0 days 00:00:01.048541,True,absolute_error,6,log2,10,28,374,TPESampler,COMPLETE
1329,0.40781618827997074,2025-04-24 22:24:12.397008,2025-04-24 22:24:16.989701,0 days 00:00:04.592693,True,squared_error,34,,1,4,830,TPESampler,COMPLETE
1330,0.4031491611751251,2025-04-24 22:24:17.176914,2025-04-24 22:24:20.928752,0 days 00:00:03.751838,True,squared_error,43,,2,4,748,TPESampler,COMPLETE
1331,1.3516478100011053,2025-04-24 22:24:21.109126,2025-04-24 22:24:22.323585,0 days 00:00:01.214459,True,absolute_error,47,sqrt,10,18,254,TPESampler,COMPLETE
1332,0.43973919642736004,2025-04-24 22:24:22.513945,2025-04-24 22:24:26.296799,0 days 00:00:03.782854,True,squared_error,27,,4,4,986,TPESampler,COMPLETE
1333,0.6861866100536935,2025-04-24 22:24:26.488995,2025-04-24 22:24:28.784324,0 days 00:00:02.295329,True,squared_error,43,log2,1,4,989,TPESampler,COMPLETE
1334,0.5389423644468354,2025-04-24 22:24:28.973574,2025-04-24 22:24:30.844831,0 days 00:00:01.871257,False,squared_error,43,sqrt,1,5,634,TPESampler,COMPLETE
1335,0.4023745103445129,2025-04-24 22:24:31.033498,2025-04-24 22:24:35.690290,0 days 00:00:04.656792,True,squared_error,40,,2,3,998,TPESampler,COMPLETE
1336,1.3647388285533208,2025-04-24 22:24:35.873861,2025-04-24 22:24:37.789313,0 days 00:00:01.915452,True,absolute_error,37,log2,3,24,679,TPESampler,COMPLETE
1337,0.5529622962869412,2025-04-24 22:24:37.975726,2025-04-24 22:25:43.324489,0 days 00:01:05.348763,True,absolute_error,46,,1,23,888,TPESampler,COMPLETE
1338,0.40254478689538375,2025-04-24 22:25:11.138560,2025-04-24 22:25:15.733676,0 days 00:00:04.595116,True,squared_error,27,,2,3,981,TPESampler,COMPLETE
1339,0.4024421747469148,2025-04-24 22:25:15.941953,2025-04-24 22:25:20.667546,0 days 00:00:04.725593,True,squared_error,30,,2,2,1000,TPESampler,COMPLETE
1340,1.1061037731898278,2025-04-24 22:25:20.851519,2025-04-24 22:25:22.778732,0 days 00:00:01.927213,True,absolute_error,12,sqrt,1,40,151,TPESampler,COMPLETE
1341,0.40648007977286393,2025-04-24 22:25:22.963085,2025-04-24 22:25:27.881371,0 days 00:00:04.918286,True,squared_error,40,,1,6,952,TPESampler,COMPLETE
1342,0.7092712069361707,2025-04-24 22:25:28.069760,2025-04-24 22:25:30.001122,0 days 00:00:01.931362,True,absolute_error,48,log2,1,2,122,TPESampler,COMPLETE
1343,0.40539459203029493,2025-04-24 22:25:30.165273,2025-04-24 22:25:35.128519,0 days 00:00:04.963246,True,squared_error,31,,2,6,986,TPESampler,COMPLETE
1344,0.4052170128109645,2025-04-24 22:25:30.216191,2025-04-24 22:26:09.672345,0 days 00:00:39.456154,True,absolute_error,27,,2,5,889,TPESampler,COMPLETE
1345,0.40227141669353933,2025-04-24 22:25:35.308657,2025-04-24 22:25:39.988351,0 days 00:00:04.679694,True,squared_error,28,,2,2,994,TPESampler,COMPLETE
1346,0.4043834442575073,2025-04-24 22:25:40.189557,2025-04-24 22:25:45.721513,0 days 00:00:05.531956,True,squared_error,37,,1,5,990,TPESampler,COMPLETE
1347,0.8678097804174403,2025-04-24 22:25:43.507001,2025-04-24 22:25:49.474754,0 days 00:00:05.967753,True,absolute_error,25,,8,47,443,TPESampler,COMPLETE
1348,0.40287975309412966,2025-04-24 22:25:45.909407,2025-04-24 22:26:21.936053,0 days 00:00:36.026646,True,absolute_error,40,,2,3,839,TPESampler,COMPLETE
1349,1.3209604477031822,2025-04-24 22:25:49.652132,2025-04-24 22:25:51.102083,0 days 00:00:01.449951,True,squared_error,23,log2,5,44,801,TPESampler,COMPLETE
1350,0.40303260928301576,2025-04-24 22:25:51.327281,2025-04-24 22:25:55.082631,0 days 00:00:03.755350,True,squared_error,37,,2,5,809,TPESampler,COMPLETE
1351,0.4160481293243465,2025-04-24 22:25:55.269928,2025-04-24 22:25:58.951979,0 days 00:00:03.682051,True,squared_error,40,,3,4,865,TPESampler,COMPLETE
1352,0.439816120184411,2025-04-24 22:25:59.128882,2025-04-24 22:26:02.391219,0 days 00:00:03.262337,True,squared_error,33,,4,2,809,TPESampler,COMPLETE
1353,0.8519317611095996,2025-04-24 22:26:02.577305,2025-04-24 22:26:04.290955,0 days 00:00:01.713650,True,squared_error,33,sqrt,2,3,753,TPESampler,COMPLETE
1354,0.4023317497502402,2025-04-24 22:26:04.466569,2025-04-24 22:26:08.678454,0 days 00:00:04.211885,True,squared_error,38,,2,3,839,TPESampler,COMPLETE
1355,1.1097910145372543,2025-04-24 22:26:08.861947,2025-04-24 22:26:13.599164,0 days 00:00:04.737217,True,absolute_error,20,log2,1,11,574,TPESampler,COMPLETE
1356,0.4165170038975512,2025-04-24 22:26:09.864754,2025-04-24 22:26:14.178026,0 days 00:00:04.313272,True,squared_error,40,,3,4,1000,TPESampler,COMPLETE
1357,0.43547425382737665,2025-04-24 22:26:13.782697,2025-04-24 22:26:17.636301,0 days 00:00:03.853604,False,squared_error,50,,3,14,634,TPESampler,COMPLETE
1358,0.42527579394959814,2025-04-24 22:26:14.454949,2025-04-24 22:26:21.305456,0 days 00:00:06.850507,True,squared_error,29,,1,2,998,TPESampler,COMPLETE
1359,0.4022755972412948,2025-04-24 22:26:17.827509,2025-04-24 22:26:23.339436,0 days 00:00:05.511927,True,squared_error,35,,2,4,966,TPESampler,COMPLETE
1360,0.40232016788019725,2025-04-24 22:26:21.555719,2025-04-24 22:26:27.128937,0 days 00:00:05.573218,True,squared_error,34,,2,3,997,TPESampler,COMPLETE
1361,0.4073195552065971,2025-04-24 22:26:22.133931,2025-04-24 22:26:27.858309,0 days 00:00:05.724378,True,squared_error,47,,1,4,835,TPESampler,COMPLETE
1362,0.4023259613133283,2025-04-24 22:26:23.535884,2025-04-24 22:26:28.825617,0 days 00:00:05.289733,True,squared_error,41,,2,2,999,TPESampler,COMPLETE
1363,0.40313720573597933,2025-04-24 22:26:27.317982,2025-04-24 22:27:08.924917,0 days 00:00:41.606935,True,absolute_error,41,,2,3,996,TPESampler,COMPLETE
1364,0.4026359831458069,2025-04-24 22:26:28.294162,2025-04-24 22:26:32.947696,0 days 00:00:04.653534,True,squared_error,35,,2,2,872,TPESampler,COMPLETE
1365,0.41656452493670876,2025-04-24 22:26:29.239795,2025-04-24 22:26:33.620288,0 days 00:00:04.380493,True,squared_error,20,,3,2,993,TPESampler,COMPLETE
1366,1.1867448008321044,2025-04-24 22:26:33.139398,2025-04-24 22:26:39.447438,0 days 00:00:06.308040,False,absolute_error,7,sqrt,1,2,549,TPESampler,COMPLETE
1367,0.4246752683837759,2025-04-24 22:26:33.988437,2025-04-24 22:26:40.579741,0 days 00:00:06.591304,True,squared_error,35,,1,2,989,TPESampler,COMPLETE
1368,0.4397562097779646,2025-04-24 22:26:39.629984,2025-04-24 22:26:43.943097,0 days 00:00:04.313113,True,squared_error,34,,4,2,985,TPESampler,COMPLETE
1369,0.4160315529120845,2025-04-24 22:26:40.757561,2025-04-24 22:26:44.523499,0 days 00:00:03.765938,True,squared_error,33,,3,3,845,TPESampler,COMPLETE
1370,0.4118652781167856,2025-04-24 22:26:44.134248,2025-04-24 22:26:53.923510,0 days 00:00:09.789262,True,absolute_error,28,,1,6,136,TPESampler,COMPLETE
1371,0.8491673991787901,2025-04-24 22:26:44.762175,2025-04-24 22:26:46.666627,0 days 00:00:01.904452,True,squared_error,38,sqrt,2,4,908,TPESampler,COMPLETE
1372,0.4021761942590767,2025-04-24 22:26:46.835421,2025-04-24 22:26:51.333704,0 days 00:00:04.498283,True,squared_error,43,,2,4,979,TPESampler,COMPLETE
1373,0.4163048980850881,2025-04-24 22:26:51.523273,2025-04-24 22:26:55.758093,0 days 00:00:04.234820,True,squared_error,46,,3,6,913,TPESampler,COMPLETE
1374,0.43968344036167484,2025-04-24 22:26:54.105205,2025-04-24 22:26:58.337144,0 days 00:00:04.231939,True,squared_error,43,,4,3,966,TPESampler,COMPLETE
1375,0.4208040695751177,2025-04-24 22:26:55.938532,2025-04-24 22:26:59.536255,0 days 00:00:03.597723,True,squared_error,43,,2,11,738,TPESampler,COMPLETE
1376,0.40237950731325994,2025-04-24 22:26:58.531994,2025-04-24 22:27:03.455274,0 days 00:00:04.923280,True,squared_error,49,,2,3,842,TPESampler,COMPLETE
1377,1.2896581354572036,2025-04-24 22:26:59.944657,2025-04-24 22:27:01.636313,0 days 00:00:01.691656,True,squared_error,34,log2,3,4,887,TPESampler,COMPLETE
1378,0.40303260928301576,2025-04-24 22:27:01.819725,2025-04-24 22:27:06.113912,0 days 00:00:04.294187,True,squared_error,44,,2,5,809,TPESampler,COMPLETE
1379,0.40235850277112256,2025-04-24 22:27:03.638054,2025-04-24 22:27:08.530741,0 days 00:00:04.892687,True,squared_error,39,,2,4,955,TPESampler,COMPLETE
1380,0.405576389011545,2025-04-24 22:27:06.306656,2025-04-24 22:27:11.007981,0 days 00:00:04.701325,True,squared_error,42,,2,6,858,TPESampler,COMPLETE
1381,0.6660061958448258,2025-04-24 22:27:08.714657,2025-04-24 22:27:27.153929,0 days 00:00:18.439272,False,absolute_error,40,,10,50,784,TPESampler,COMPLETE
1382,0.40860207023158585,2025-04-24 22:27:09.131312,2025-04-24 22:27:14.249180,0 days 00:00:05.117868,True,squared_error,48,,2,7,935,TPESampler,COMPLETE
1383,1.3234467465142767,2025-04-24 22:27:11.213669,2025-04-24 22:27:12.596992,0 days 00:00:01.383323,True,squared_error,19,log2,5,5,648,TPESampler,COMPLETE
1384,0.417565013149435,2025-04-24 22:27:12.783057,2025-04-24 22:27:18.388880,0 days 00:00:05.605823,True,squared_error,48,,1,3,874,TPESampler,COMPLETE
1385,0.41623843134865524,2025-04-24 22:27:14.478824,2025-04-24 22:27:18.292571,0 days 00:00:03.813747,True,squared_error,47,,3,5,899,TPESampler,COMPLETE
1386,1.1220960650802874,2025-04-24 22:27:18.441921,2025-04-24 22:27:20.540968,0 days 00:00:02.099047,False,absolute_error,12,sqrt,2,35,123,TPESampler,COMPLETE
1387,0.4023669865949129,2025-04-24 22:27:18.561876,2025-04-24 22:27:23.635130,0 days 00:00:05.073254,True,squared_error,43,,2,3,959,TPESampler,COMPLETE
1388,0.4022324925345733,2025-04-24 22:27:20.741059,2025-04-24 22:27:25.714077,0 days 00:00:04.973018,True,squared_error,41,,2,2,989,TPESampler,COMPLETE
1389,0.4026207304982902,2025-04-24 22:27:23.822223,2025-04-24 22:27:29.032878,0 days 00:00:05.210655,True,squared_error,44,,2,4,913,TPESampler,COMPLETE
1390,0.40698959385981964,2025-04-24 22:27:25.907943,2025-04-24 22:27:31.901796,0 days 00:00:05.993853,True,squared_error,50,,1,6,999,TPESampler,COMPLETE
1391,0.40260019939144015,2025-04-24 22:27:27.347351,2025-04-24 22:27:31.773351,0 days 00:00:04.426000,True,squared_error,39,,2,2,811,TPESampler,COMPLETE
1392,0.9150698728856244,2025-04-24 22:27:29.257654,2025-04-24 22:27:37.076338,0 days 00:00:07.818684,True,absolute_error,32,log2,1,5,739,TPESampler,COMPLETE
1393,0.40230045900355177,2025-04-24 22:27:31.952481,2025-04-24 22:27:37.222162,0 days 00:00:05.269681,True,squared_error,40,,2,4,996,TPESampler,COMPLETE
1394,0.4164280246538695,2025-04-24 22:27:32.133802,2025-04-24 22:27:36.813946,0 days 00:00:04.680144,True,squared_error,47,,3,5,984,TPESampler,COMPLETE
1395,0.4081129688185379,2025-04-24 22:27:37.000718,2025-04-24 22:27:43.633289,0 days 00:00:06.632571,True,squared_error,32,,1,4,992,TPESampler,COMPLETE
1396,0.40222022381018935,2025-04-24 22:27:37.307725,2025-04-24 22:27:42.811816,0 days 00:00:05.504091,True,squared_error,44,,2,3,988,TPESampler,COMPLETE
1397,0.402320512372665,2025-04-24 22:27:37.448720,2025-04-24 22:27:42.896999,0 days 00:00:05.448279,True,squared_error,41,,2,2,997,TPESampler,COMPLETE
1398,0.4198387330314453,2025-04-24 22:27:42.972830,2025-04-24 22:27:50.662665,0 days 00:00:07.689835,True,squared_error,40,,1,3,991,TPESampler,COMPLETE
1399,0.41162082344448886,2025-04-24 22:27:43.095513,2025-04-24 22:27:48.277993,0 days 00:00:05.182480,True,squared_error,39,,2,8,980,TPESampler,COMPLETE
1400,0.41596634493608226,2025-04-24 22:27:43.901770,2025-04-24 22:27:48.276457,0 days 00:00:04.374687,True,squared_error,27,,3,2,843,TPESampler,COMPLETE
1401,0.428919962322453,2025-04-24 22:27:48.445821,2025-04-24 22:27:55.424413,0 days 00:00:06.978592,False,squared_error,44,,3,2,984,TPESampler,COMPLETE
1402,0.40252263507166036,2025-04-24 22:27:48.490210,2025-04-24 22:27:53.743415,0 days 00:00:05.253205,True,squared_error,41,,2,3,832,TPESampler,COMPLETE
1403,0.40245725534050375,2025-04-24 22:27:50.923995,2025-04-24 22:27:55.466711,0 days 00:00:04.542716,True,squared_error,34,,2,4,847,TPESampler,COMPLETE
1404,0.42548162725601973,2025-04-24 22:27:53.938597,2025-04-24 22:28:00.346717,0 days 00:00:06.408120,True,squared_error,33,,1,2,838,TPESampler,COMPLETE
1405,1.2560257234529484,2025-04-24 22:27:55.586533,2025-04-24 22:27:56.594190,0 days 00:00:01.007657,True,squared_error,21,log2,2,24,115,TPESampler,COMPLETE
1406,0.40295130125884254,2025-04-24 22:27:55.625006,2025-04-24 22:28:00.830988,0 days 00:00:05.205982,True,squared_error,27,,2,4,900,TPESampler,COMPLETE
1407,0.4027183739465553,2025-04-24 22:27:56.922541,2025-04-24 22:28:02.179037,0 days 00:00:05.256496,True,squared_error,43,,2,5,988,TPESampler,COMPLETE
1408,0.41604824352906616,2025-04-24 22:28:00.537412,2025-04-24 22:28:05.193789,0 days 00:00:04.656377,True,squared_error,46,,3,2,848,TPESampler,COMPLETE
1409,0.6995731120343067,2025-04-24 22:28:01.035617,2025-04-24 22:28:02.826356,0 days 00:00:01.790739,False,squared_error,14,,11,35,228,TPESampler,COMPLETE
1410,1.1074228847452396,2025-04-24 22:28:02.367799,2025-04-24 22:28:15.157784,0 days 00:00:12.789985,False,absolute_error,11,sqrt,1,34,829,TPESampler,COMPLETE
1411,0.40213781993433156,2025-04-24 22:28:03.246518,2025-04-24 22:28:08.368487,0 days 00:00:05.121969,True,squared_error,29,,2,2,985,TPESampler,COMPLETE
1412,0.4182078211448313,2025-04-24 22:28:05.377246,2025-04-24 22:28:09.502618,0 days 00:00:04.125372,True,squared_error,19,,3,7,876,TPESampler,COMPLETE
1413,0.4163048980850881,2025-04-24 22:28:08.548641,2025-04-24 22:28:13.244395,0 days 00:00:04.695754,True,squared_error,29,,3,2,913,TPESampler,COMPLETE
1414,1.322862034343818,2025-04-24 22:28:09.680522,2025-04-24 22:28:10.825935,0 days 00:00:01.145413,False,squared_error,50,log2,8,2,712,TPESampler,COMPLETE
1415,0.40288495081314346,2025-04-24 22:28:11.012282,2025-04-24 22:28:16.540355,0 days 00:00:05.528073,True,squared_error,25,,2,3,927,TPESampler,COMPLETE
