number,value,datetime_start,datetime_complete,duration,params_bootstrap,params_criterion,params_max_depth,params_max_features,params_min_samples_leaf,params_min_samples_split,params_n_estimators,system_attrs_auto:sampler,state
2122,0.40850510612950364,2025-04-24 22:54:58.274299,2025-04-24 22:55:03.583613,0 days 00:00:05.309314,True,squared_error,31,,2,7,987,TPESampler,COMPLETE
2123,0.5817052299578855,2025-04-24 22:55:00.401973,2025-04-24 22:55:03.625405,0 days 00:00:03.223432,True,squared_error,28,,8,4,748,TPESampler,COMPLETE
2124,0.4038943387055016,2025-04-24 22:55:01.856156,2025-04-24 22:55:06.079561,0 days 00:00:04.223405,True,squared_error,36,,2,3,659,TPESampler,COMPLETE
2125,0.4025235407352295,2025-04-24 22:55:03.747693,2025-04-24 22:55:08.773505,0 days 00:00:05.025812,True,squared_error,39,,2,3,877,TPESampler,COMPLETE
2126,0.40220373140675525,2025-04-24 22:55:03.785726,2025-04-24 22:55:09.444059,0 days 00:00:05.658333,True,squared_error,42,,2,2,980,TPESampler,COMPLETE
2127,0.4030471417959206,2025-04-24 22:55:06.282860,2025-04-24 22:55:10.633715,0 days 00:00:04.350855,True,squared_error,40,,2,5,822,TPESampler,COMPLETE
2128,0.6272627297713896,2025-04-24 22:55:08.964907,2025-04-24 22:55:15.681580,0 days 00:00:06.716673,False,absolute_error,28,,6,24,189,TPESampler,COMPLETE
2129,1.4062153648665394,2025-04-24 22:55:09.707900,2025-04-24 22:55:10.546853,0 days 00:00:00.838953,True,absolute_error,31,log2,12,4,161,TPESampler,COMPLETE
2130,1.3294090946522263,2025-04-24 22:55:10.713143,2025-04-24 22:55:12.378796,0 days 00:00:01.665653,False,squared_error,27,log2,10,24,825,TPESampler,COMPLETE
2131,0.4227528821446932,2025-04-24 22:55:10.841688,2025-04-24 22:55:16.976713,0 days 00:00:06.135025,True,squared_error,28,,1,2,800,TPESampler,COMPLETE
2132,0.4022936022957746,2025-04-24 22:55:12.582410,2025-04-24 22:55:17.844684,0 days 00:00:05.262274,True,squared_error,40,,2,2,1000,TPESampler,COMPLETE
2133,1.3278415629814888,2025-04-24 22:55:15.867566,2025-04-24 22:55:18.212989,0 days 00:00:02.345423,False,absolute_error,10,log2,3,4,438,TPESampler,COMPLETE
2134,0.42892022188906953,2025-04-24 22:55:17.165774,2025-04-24 22:55:23.334533,0 days 00:00:06.168759,False,squared_error,41,,3,4,928,TPESampler,COMPLETE
2135,1.3913855004269902,2025-04-24 22:55:18.171963,2025-04-24 22:55:20.277774,0 days 00:00:02.105811,False,absolute_error,23,log2,12,2,928,TPESampler,COMPLETE
2136,0.6730991059706548,2025-04-24 22:55:18.514633,2025-04-24 22:55:22.128684,0 days 00:00:03.614051,True,squared_error,47,,4,42,803,TPESampler,COMPLETE
2137,0.41603955135277726,2025-04-24 22:55:20.464525,2025-04-24 22:55:25.085397,0 days 00:00:04.620872,True,squared_error,35,,3,2,864,TPESampler,COMPLETE
2138,0.40497733566562416,2025-04-24 22:55:22.324732,2025-04-24 22:55:29.660755,0 days 00:00:07.336023,False,squared_error,28,,2,4,993,TPESampler,COMPLETE
2139,0.4023778394759672,2025-04-24 22:55:23.527256,2025-04-24 22:55:28.085690,0 days 00:00:04.558434,True,squared_error,22,,2,2,849,TPESampler,COMPLETE
2140,0.5803568438616216,2025-04-24 22:55:25.500086,2025-04-24 22:55:29.432946,0 days 00:00:03.932860,True,squared_error,35,,8,4,987,TPESampler,COMPLETE
2141,0.4163927830094299,2025-04-24 22:55:28.272268,2025-04-24 22:55:33.870447,0 days 00:00:05.598179,True,squared_error,29,,3,3,988,TPESampler,COMPLETE
2142,1.3187715890967993,2025-04-24 22:55:29.619306,2025-04-24 22:55:31.825561,0 days 00:00:02.206255,True,squared_error,42,log2,5,2,903,TPESampler,COMPLETE
2143,0.4261767908000853,2025-04-24 22:55:29.958668,2025-04-24 22:55:37.261336,0 days 00:00:07.302668,True,squared_error,34,,1,2,864,TPESampler,COMPLETE
2144,0.7993104057048499,2025-04-24 22:55:32.011445,2025-04-24 22:55:33.611840,0 days 00:00:01.600395,False,squared_error,28,sqrt,2,2,679,TPESampler,COMPLETE
2145,0.41909195889320267,2025-04-24 22:55:33.798882,2025-04-24 22:55:40.928624,0 days 00:00:07.129742,True,squared_error,33,,1,3,999,TPESampler,COMPLETE
2146,0.42495108466497233,2025-04-24 22:55:34.144219,2025-04-24 22:55:38.910207,0 days 00:00:04.765988,True,squared_error,39,,3,9,988,TPESampler,COMPLETE
2147,0.40938300465433547,2025-04-24 22:55:37.446914,2025-04-24 22:55:43.708006,0 days 00:00:06.261092,True,squared_error,22,,1,4,993,TPESampler,COMPLETE
2148,0.7278408278229546,2025-04-24 22:55:39.094230,2025-04-24 22:55:39.932078,0 days 00:00:00.837848,True,squared_error,34,sqrt,1,24,122,TPESampler,COMPLETE
2149,0.40243554872201365,2025-04-24 22:55:40.115566,2025-04-24 22:55:45.139790,0 days 00:00:05.024224,True,squared_error,41,,2,4,830,TPESampler,COMPLETE
2150,0.4888014906459011,2025-04-24 22:55:41.119125,2025-04-24 22:56:48.959218,0 days 00:01:07.840093,False,absolute_error,10,,2,2,967,TPESampler,COMPLETE
2151,1.2289033232483162,2025-04-24 22:55:43.897299,2025-04-24 22:55:45.651598,0 days 00:00:01.754299,True,squared_error,36,log2,2,3,816,TPESampler,COMPLETE
2152,0.4163856497417495,2025-04-24 22:55:45.335558,2025-04-24 22:55:50.336928,0 days 00:00:05.001370,True,squared_error,26,,3,2,985,TPESampler,COMPLETE
2153,1.2440593403588716,2025-04-24 22:55:45.860679,2025-04-24 22:55:47.493453,0 days 00:00:01.632774,False,squared_error,38,log2,3,18,978,TPESampler,COMPLETE
2154,0.40240470269938466,2025-04-24 22:55:47.672524,2025-04-24 22:55:52.200404,0 days 00:00:04.527880,True,squared_error,41,,2,3,853,TPESampler,COMPLETE
2155,0.42339507141465693,2025-04-24 22:55:50.521280,2025-04-24 22:55:57.633583,0 days 00:00:07.112303,True,squared_error,40,,1,2,1000,TPESampler,COMPLETE
2156,0.4026053458633828,2025-04-24 22:55:52.385987,2025-04-24 22:55:56.494805,0 days 00:00:04.108818,True,squared_error,31,,2,2,859,TPESampler,COMPLETE
2157,1.1373547351290496,2025-04-24 22:55:56.680013,2025-04-24 22:55:58.355965,0 days 00:00:01.675952,False,squared_error,32,log2,2,2,940,TPESampler,COMPLETE
2158,0.41591469225299166,2025-04-24 22:55:57.827163,2025-04-24 22:56:01.942545,0 days 00:00:04.115382,True,squared_error,21,,3,4,849,TPESampler,COMPLETE
2159,0.40289114042556756,2025-04-24 22:55:58.762554,2025-04-24 22:56:03.347443,0 days 00:00:04.584889,True,squared_error,27,,2,3,862,TPESampler,COMPLETE
2160,0.40247494165605235,2025-04-24 22:56:02.128641,2025-04-24 22:56:07.217953,0 days 00:00:05.089312,True,squared_error,30,,2,2,999,TPESampler,COMPLETE
2161,0.4066766195615002,2025-04-24 22:56:03.535778,2025-04-24 22:56:09.415782,0 days 00:00:05.880004,True,squared_error,41,,1,4,996,TPESampler,COMPLETE
2162,0.6327322272872307,2025-04-24 22:56:07.408378,2025-04-24 22:56:23.182340,0 days 00:00:15.773962,False,absolute_error,9,,11,8,784,TPESampler,COMPLETE
2163,0.40337417447762874,2025-04-24 22:56:09.597423,2025-04-24 22:56:13.346771,0 days 00:00:03.749348,True,squared_error,25,,2,5,816,TPESampler,COMPLETE
2164,1.2302462306210618,2025-04-24 22:56:13.531760,2025-04-24 22:56:15.236902,0 days 00:00:01.705142,True,squared_error,41,log2,2,2,991,TPESampler,COMPLETE
2165,0.402320512372665,2025-04-24 22:56:15.421184,2025-04-24 22:56:20.037094,0 days 00:00:04.615910,True,squared_error,41,,2,4,997,TPESampler,COMPLETE
2166,0.40272610482406634,2025-04-24 22:56:20.226182,2025-04-24 22:56:25.127069,0 days 00:00:04.900887,True,squared_error,30,,2,5,965,TPESampler,COMPLETE
2167,0.4023575818007951,2025-04-24 22:56:23.375266,2025-04-24 22:56:28.560088,0 days 00:00:05.184822,True,squared_error,33,,2,3,998,TPESampler,COMPLETE
2168,0.4022834925753519,2025-04-24 22:56:25.315894,2025-04-24 22:56:30.321301,0 days 00:00:05.005407,True,squared_error,33,,2,2,996,TPESampler,COMPLETE
2169,0.4160679605227207,2025-04-24 22:56:28.743430,2025-04-24 22:56:32.845390,0 days 00:00:04.101960,True,squared_error,38,,3,2,854,TPESampler,COMPLETE
2170,0.4397168641254447,2025-04-24 22:56:30.501260,2025-04-24 22:56:34.835495,0 days 00:00:04.334235,True,squared_error,38,,4,6,996,TPESampler,COMPLETE
2171,0.4027299224581176,2025-04-24 22:56:33.030408,2025-04-24 22:56:37.560172,0 days 00:00:04.529764,True,squared_error,31,,2,5,850,TPESampler,COMPLETE
2172,0.8512084158732414,2025-04-24 22:56:35.022796,2025-04-24 22:56:36.863417,0 days 00:00:01.840621,True,squared_error,32,sqrt,2,4,795,TPESampler,COMPLETE
2173,1.0495673752649162,2025-04-24 22:56:37.054705,2025-04-24 22:56:42.321477,0 days 00:00:05.266772,True,absolute_error,41,sqrt,2,35,639,TPESampler,COMPLETE
2174,0.40221763668222793,2025-04-24 22:56:37.879797,2025-04-24 22:56:42.445805,0 days 00:00:04.566008,True,squared_error,28,,2,4,983,TPESampler,COMPLETE
2175,0.40230011429068296,2025-04-24 22:56:42.513965,2025-04-24 22:56:48.248295,0 days 00:00:05.734330,True,squared_error,34,,2,4,996,TPESampler,COMPLETE
2176,1.238869608531778,2025-04-24 22:56:42.636325,2025-04-24 22:56:44.862616,0 days 00:00:02.226291,True,squared_error,19,log2,2,10,982,TPESampler,COMPLETE
2177,0.43971006033309706,2025-04-24 22:56:45.047698,2025-04-24 22:56:49.429402,0 days 00:00:04.381704,True,squared_error,29,,4,6,995,TPESampler,COMPLETE
2178,0.4165021727708187,2025-04-24 22:56:48.432067,2025-04-24 22:56:53.439665,0 days 00:00:05.007598,True,squared_error,41,,3,3,993,TPESampler,COMPLETE
2179,0.4495631003503455,2025-04-24 22:56:49.388418,2025-04-24 22:57:20.229047,0 days 00:00:30.840629,True,absolute_error,21,,2,10,745,TPESampler,COMPLETE
2180,0.4022936022957746,2025-04-24 22:56:49.732848,2025-04-24 22:56:55.055790,0 days 00:00:05.322942,True,squared_error,42,,2,2,1000,TPESampler,COMPLETE
2181,0.4023317497502402,2025-04-24 22:56:53.625070,2025-04-24 22:56:58.062334,0 days 00:00:04.437264,True,squared_error,36,,2,3,839,TPESampler,COMPLETE
2182,0.402362550962546,2025-04-24 22:56:55.250119,2025-04-24 22:57:00.287719,0 days 00:00:05.037600,True,squared_error,28,,2,3,998,TPESampler,COMPLETE
2183,0.4026348956469661,2025-04-24 22:56:58.260509,2025-04-24 22:57:03.133987,0 days 00:00:04.873478,True,squared_error,37,,2,2,871,TPESampler,COMPLETE
2184,1.3388567549380772,2025-04-24 22:57:00.484610,2025-04-24 22:57:01.516615,0 days 00:00:01.032005,False,squared_error,31,log2,13,5,566,TPESampler,COMPLETE
2185,0.41817141299023713,2025-04-24 22:57:01.707891,2025-04-24 22:57:07.024641,0 days 00:00:05.316750,True,squared_error,39,,1,3,830,TPESampler,COMPLETE
2186,0.4028704237267159,2025-04-24 22:57:03.312564,2025-04-24 22:57:09.562218,0 days 00:00:06.249654,False,squared_error,42,,2,2,910,TPESampler,COMPLETE
2187,0.40229496321871033,2025-04-24 22:57:07.226713,2025-04-24 22:57:12.331280,0 days 00:00:05.104567,True,squared_error,36,,2,2,992,TPESampler,COMPLETE
2188,0.4395769277008678,2025-04-24 22:57:09.761862,2025-04-24 22:57:13.873256,0 days 00:00:04.111394,True,squared_error,36,,4,3,903,TPESampler,COMPLETE
2189,0.4199914609402884,2025-04-24 22:57:12.528487,2025-04-24 22:57:18.566926,0 days 00:00:06.038439,True,squared_error,26,,1,3,854,TPESampler,COMPLETE
2190,1.3092743846401544,2025-04-24 22:57:14.057164,2025-04-24 22:57:15.847146,0 days 00:00:01.789982,True,squared_error,33,log2,4,2,982,TPESampler,COMPLETE
2191,1.0793619387266533,2025-04-24 22:57:16.044180,2025-04-24 22:57:17.927127,0 days 00:00:01.882947,True,squared_error,25,sqrt,4,7,989,TPESampler,COMPLETE
2192,0.43969894267763593,2025-04-24 22:57:18.124370,2025-04-24 22:57:23.000064,0 days 00:00:04.875694,True,squared_error,32,,4,2,994,TPESampler,COMPLETE
2193,0.4026224011374268,2025-04-24 22:57:18.833871,2025-04-24 22:57:24.087662,0 days 00:00:05.253791,True,squared_error,43,,2,2,862,TPESampler,COMPLETE
2194,0.40304555821472815,2025-04-24 22:57:20.427219,2025-04-24 22:57:25.591459,0 days 00:00:05.164240,True,squared_error,26,,2,2,893,TPESampler,COMPLETE
2195,0.4244633906882883,2025-04-24 22:57:23.206773,2025-04-24 22:57:30.436092,0 days 00:00:07.229319,True,squared_error,27,,1,2,984,TPESampler,COMPLETE
2196,0.40541010286817997,2025-04-24 22:57:24.274395,2025-04-24 22:57:28.481060,0 days 00:00:04.206665,True,squared_error,32,,2,6,833,TPESampler,COMPLETE
2197,0.4274815969998487,2025-04-24 22:57:25.776068,2025-04-24 22:57:47.335381,0 days 00:00:21.559313,True,absolute_error,37,,3,4,699,TPESampler,COMPLETE
2198,0.4024313994175976,2025-04-24 22:57:28.689697,2025-04-24 22:57:33.270719,0 days 00:00:04.581022,True,squared_error,31,,2,4,852,TPESampler,COMPLETE
2199,1.3146662917164413,2025-04-24 22:57:30.624312,2025-04-24 22:57:32.950352,0 days 00:00:02.326040,True,absolute_error,31,sqrt,7,2,851,TPESampler,COMPLETE
2200,0.43967472978608757,2025-04-24 22:57:33.150647,2025-04-24 22:57:36.756179,0 days 00:00:03.605532,True,squared_error,30,,4,2,835,TPESampler,COMPLETE
2201,0.4034138775656723,2025-04-24 22:57:33.515866,2025-04-24 22:58:12.003787,0 days 00:00:38.487921,True,absolute_error,30,,2,2,845,TPESampler,COMPLETE
2202,0.4160481293243465,2025-04-24 22:57:36.945134,2025-04-24 22:57:40.558817,0 days 00:00:03.613683,True,squared_error,29,,3,2,865,TPESampler,COMPLETE
2203,0.4026978853782508,2025-04-24 22:57:40.773996,2025-04-24 22:57:45.405865,0 days 00:00:04.631869,True,squared_error,27,,2,4,998,TPESampler,COMPLETE
2204,0.41651152129787683,2025-04-24 22:57:45.599539,2025-04-24 22:57:50.233038,0 days 00:00:04.633499,True,squared_error,31,,3,2,996,TPESampler,COMPLETE
2205,0.4164941683800708,2025-04-24 22:57:47.520758,2025-04-24 22:57:52.337302,0 days 00:00:04.816544,True,squared_error,42,,3,5,994,TPESampler,COMPLETE
2206,1.097927976807697,2025-04-24 22:57:50.441010,2025-04-24 22:57:52.365691,0 days 00:00:01.924681,True,squared_error,7,sqrt,2,7,959,TPESampler,COMPLETE
2207,0.40252434088730826,2025-04-24 22:57:52.493287,2025-04-24 22:57:57.061955,0 days 00:00:04.568668,True,squared_error,43,,2,4,857,TPESampler,COMPLETE
2208,0.41872237499867504,2025-04-24 22:57:52.533159,2025-04-24 22:58:56.670715,0 days 00:01:04.137556,True,absolute_error,30,,1,4,865,TPESampler,COMPLETE
2209,0.40848546080730674,2025-04-24 22:57:57.236305,2025-04-24 22:58:01.838253,0 days 00:00:04.601948,True,squared_error,32,,1,4,833,TPESampler,COMPLETE
2210,0.49854019718733755,2025-04-24 22:58:02.022910,2025-04-24 22:58:05.234430,0 days 00:00:03.211520,True,squared_error,42,sqrt,1,2,978,TPESampler,COMPLETE
2211,0.41651183820046933,2025-04-24 22:58:05.425812,2025-04-24 22:58:09.546198,0 days 00:00:04.120386,True,squared_error,31,,3,4,999,TPESampler,COMPLETE
2212,0.4022936022957746,2025-04-24 22:58:09.731014,2025-04-24 22:58:14.823148,0 days 00:00:05.092134,True,squared_error,39,,2,2,1000,TPESampler,COMPLETE
2213,0.4099671096062936,2025-04-24 22:58:12.183059,2025-04-24 22:58:16.862769,0 days 00:00:04.679710,True,squared_error,36,,1,7,838,TPESampler,COMPLETE
2214,0.402216389485944,2025-04-24 22:58:15.004387,2025-04-24 22:58:20.009802,0 days 00:00:05.005415,True,squared_error,39,,2,4,981,TPESampler,COMPLETE
2215,0.41717097368244144,2025-04-24 22:58:17.050667,2025-04-24 22:58:22.551484,0 days 00:00:05.500817,True,squared_error,41,,1,3,860,TPESampler,COMPLETE
2216,0.42666844248500185,2025-04-24 22:58:20.195632,2025-04-24 22:58:26.064911,0 days 00:00:05.869279,True,squared_error,30,,1,2,877,TPESampler,COMPLETE
2217,0.4724964331166044,2025-04-24 22:58:22.742132,2025-04-24 22:58:30.598804,0 days 00:00:07.856672,False,squared_error,44,,1,4,993,TPESampler,COMPLETE
2218,0.4025035798886413,2025-04-24 22:58:26.459929,2025-04-24 22:58:30.576986,0 days 00:00:04.117057,True,squared_error,28,,2,2,865,TPESampler,COMPLETE
2219,0.8485567496077197,2025-04-24 22:58:30.730149,2025-04-24 22:58:33.376708,0 days 00:00:02.646559,True,squared_error,41,sqrt,2,3,980,TPESampler,COMPLETE
2220,0.4254975383396808,2025-04-24 22:58:30.769996,2025-04-24 22:58:38.024428,0 days 00:00:07.254432,True,squared_error,33,,1,2,985,TPESampler,COMPLETE
2221,0.6964848231134485,2025-04-24 22:58:33.561487,2025-04-24 22:58:35.391282,0 days 00:00:01.829795,False,squared_error,43,,1,25,257,TPESampler,COMPLETE
2222,0.4158925867512453,2025-04-24 22:58:35.570702,2025-04-24 22:58:39.591271,0 days 00:00:04.020569,True,squared_error,38,,3,3,839,TPESampler,COMPLETE
2223,0.8315321709363513,2025-04-24 22:58:38.219473,2025-04-24 22:58:41.058299,0 days 00:00:02.838826,True,squared_error,28,log2,1,3,866,TPESampler,COMPLETE
2224,0.6903996032123111,2025-04-24 22:58:39.782383,2025-04-24 22:58:59.065220,0 days 00:00:19.282837,True,absolute_error,50,,5,36,968,TPESampler,COMPLETE
2225,0.43969140621827035,2025-04-24 22:58:41.242791,2025-04-24 22:58:45.082534,0 days 00:00:03.839743,True,squared_error,35,,4,2,998,TPESampler,COMPLETE
2226,0.4162397931205952,2025-04-24 22:58:45.265013,2025-04-24 22:58:48.893067,0 days 00:00:03.628054,True,squared_error,25,,3,4,858,TPESampler,COMPLETE
2227,0.4023745103445129,2025-04-24 22:58:49.080821,2025-04-24 22:58:53.751217,0 days 00:00:04.670396,True,squared_error,44,,2,2,998,TPESampler,COMPLETE
2228,0.4024421747469148,2025-04-24 22:58:53.931948,2025-04-24 22:58:59.040625,0 days 00:00:05.108677,True,squared_error,30,,2,2,1000,TPESampler,COMPLETE
2229,0.402457634095767,2025-04-24 22:58:56.864223,2025-04-24 22:59:02.427145,0 days 00:00:05.562922,True,squared_error,35,,2,3,847,TPESampler,COMPLETE
2230,1.399773810590063,2025-04-24 22:58:59.203447,2025-04-24 22:59:00.574239,0 days 00:00:01.370792,True,absolute_error,26,log2,13,34,181,TPESampler,COMPLETE
2231,1.0745117793209438,2025-04-24 22:58:59.250601,2025-04-24 22:59:02.089658,0 days 00:00:02.839057,True,squared_error,41,sqrt,4,2,813,TPESampler,COMPLETE
2232,1.2131919424886235,2025-04-24 22:59:00.782009,2025-04-24 22:59:02.633993,0 days 00:00:01.851984,True,squared_error,7,log2,1,4,603,TPESampler,COMPLETE
2233,0.4025021197310513,2025-04-24 22:59:02.293019,2025-04-24 22:59:07.236788,0 days 00:00:04.943769,True,squared_error,33,,2,3,832,TPESampler,COMPLETE
2234,0.4228777645503539,2025-04-24 22:59:02.689649,2025-04-24 22:59:09.589756,0 days 00:00:06.900107,True,squared_error,45,,1,2,875,TPESampler,COMPLETE
2235,0.41819449041689616,2025-04-24 22:59:03.059115,2025-04-24 22:59:09.885889,0 days 00:00:06.826774,True,squared_error,41,,1,3,993,TPESampler,COMPLETE
2236,0.46186598561151104,2025-04-24 22:59:07.422158,2025-04-24 23:00:22.697816,0 days 00:01:15.275658,False,absolute_error,23,,2,2,990,TPESampler,COMPLETE
2237,0.40814930695175755,2025-04-24 22:59:09.770265,2025-04-24 22:59:14.846793,0 days 00:00:05.076528,True,squared_error,31,,1,4,879,TPESampler,COMPLETE
2238,0.4067816798759185,2025-04-24 22:59:10.135416,2025-04-24 22:59:16.426854,0 days 00:00:06.291438,False,squared_error,26,,2,2,907,TPESampler,COMPLETE
2239,0.4472907984391303,2025-04-24 22:59:15.041527,2025-04-24 22:59:19.383724,0 days 00:00:04.342197,False,squared_error,33,,4,4,752,TPESampler,COMPLETE
2240,0.4160362317037751,2025-04-24 22:59:16.612781,2025-04-24 22:59:20.561530,0 days 00:00:03.948749,True,squared_error,38,,3,4,849,TPESampler,COMPLETE
2241,1.3390938753999302,2025-04-24 22:59:19.589711,2025-04-24 22:59:21.939710,0 days 00:00:02.349999,False,absolute_error,50,sqrt,12,4,704,TPESampler,COMPLETE
2242,0.6485353588422351,2025-04-24 22:59:20.742538,2025-04-24 22:59:31.749243,0 days 00:00:11.006705,True,absolute_error,43,,8,9,837,TPESampler,COMPLETE
2243,0.423600230596113,2025-04-24 22:59:22.119065,2025-04-24 22:59:27.598334,0 days 00:00:05.479269,False,squared_error,33,,2,9,936,TPESampler,COMPLETE
2244,1.3785964407187998,2025-04-24 22:59:27.787230,2025-04-24 22:59:29.076877,0 days 00:00:01.289647,False,absolute_error,49,log2,6,28,449,TPESampler,COMPLETE
2245,0.40260019939144015,2025-04-24 22:59:29.254209,2025-04-24 22:59:33.579654,0 days 00:00:04.325445,True,squared_error,48,,2,2,811,TPESampler,COMPLETE
2246,0.40526526862378714,2025-04-24 22:59:31.937071,2025-04-24 22:59:36.862908,0 days 00:00:04.925837,True,squared_error,28,,2,6,997,TPESampler,COMPLETE
2247,0.4026850644386286,2025-04-24 22:59:33.765057,2025-04-24 22:59:38.430550,0 days 00:00:04.665493,True,squared_error,35,,2,2,895,TPESampler,COMPLETE
2248,0.40286951015086947,2025-04-24 22:59:37.054032,2025-04-24 22:59:42.245173,0 days 00:00:05.191141,True,squared_error,24,,2,3,984,TPESampler,COMPLETE
2249,1.2440413886660273,2025-04-24 22:59:38.610486,2025-04-24 22:59:39.417539,0 days 00:00:00.807053,True,squared_error,24,sqrt,7,42,171,TPESampler,COMPLETE
2250,0.40222022381018935,2025-04-24 22:59:39.605200,2025-04-24 22:59:44.638135,0 days 00:00:05.032935,True,squared_error,35,,2,3,988,TPESampler,COMPLETE
2251,0.41597634721810867,2025-04-24 22:59:42.429847,2025-04-24 22:59:46.642594,0 days 00:00:04.212747,True,squared_error,43,,3,3,835,TPESampler,COMPLETE
2252,0.41649459025198,2025-04-24 22:59:44.817709,2025-04-24 22:59:49.392521,0 days 00:00:04.574812,True,squared_error,35,,3,2,995,TPESampler,COMPLETE
2253,0.40283687525631107,2025-04-24 22:59:46.832505,2025-04-24 23:00:26.542728,0 days 00:00:39.710223,True,absolute_error,38,,2,3,970,TPESampler,COMPLETE
2254,1.3603747812721994,2025-04-24 22:59:49.579343,2025-04-24 22:59:51.880183,0 days 00:00:02.300840,True,absolute_error,20,log2,3,36,826,TPESampler,COMPLETE
2255,0.4191113655370582,2025-04-24 22:59:52.068800,2025-04-24 22:59:57.712152,0 days 00:00:05.643352,True,squared_error,33,,1,3,998,TPESampler,COMPLETE
2256,0.42284929719063064,2025-04-24 22:59:58.116386,2025-04-24 23:00:03.312135,0 days 00:00:05.195749,True,squared_error,18,,1,3,990,TPESampler,COMPLETE
2257,0.4023102674636061,2025-04-24 23:00:03.518807,2025-04-24 23:00:07.512431,0 days 00:00:03.993624,True,squared_error,34,,2,2,840,TPESampler,COMPLETE
2258,0.43971006033309706,2025-04-24 23:00:07.698112,2025-04-24 23:00:11.468849,0 days 00:00:03.770737,True,squared_error,39,,4,5,995,TPESampler,COMPLETE
2259,0.41170868551105044,2025-04-24 23:00:11.652775,2025-04-24 23:00:15.822473,0 days 00:00:04.169698,True,squared_error,39,,2,8,996,TPESampler,COMPLETE
2260,0.40246136343630007,2025-04-24 23:00:16.011979,2025-04-24 23:00:20.536411,0 days 00:00:04.524432,True,squared_error,21,,2,2,992,TPESampler,COMPLETE
2261,1.0118621881850363,2025-04-24 23:00:20.721717,2025-04-24 23:00:22.021877,0 days 00:00:01.300160,False,squared_error,9,sqrt,1,18,761,TPESampler,COMPLETE
2262,0.4026789780134796,2025-04-24 23:00:22.210026,2025-04-24 23:00:26.873380,0 days 00:00:04.663354,True,squared_error,42,,2,3,892,TPESampler,COMPLETE
