number,value,datetime_start,datetime_complete,duration,params_bootstrap,params_criterion,params_max_depth,params_max_features,params_min_samples_leaf,params_min_samples_split,params_n_estimators,system_attrs_auto:sampler,state
851,0.40717319780942896,2025-04-24 22:06:06.020365,2025-04-24 22:06:11.446727,0 days 00:00:05.426362,False,squared_error,19,,2,2,790,TPESampler,COMPLETE
852,0.4024043247803118,2025-04-24 22:06:06.579636,2025-04-24 22:06:11.198572,0 days 00:00:04.618936,True,squared_error,34,,2,2,853,TPESampler,COMPLETE
853,0.4265976079756295,2025-04-24 22:06:07.069999,2025-04-24 22:06:34.491529,0 days 00:00:27.421530,True,absolute_error,41,,3,5,893,TPESampler,COMPLETE
854,1.151506426299875,2025-04-24 22:06:11.378760,2025-04-24 22:06:12.212293,0 days 00:00:00.833533,False,squared_error,43,sqrt,7,31,199,TPESampler,COMPLETE
855,0.4428743843908322,2025-04-24 22:06:11.665492,2025-04-24 22:06:15.984112,0 days 00:00:04.318620,True,squared_error,49,,3,13,1000,TPESampler,COMPLETE
856,0.42550507541916244,2025-04-24 22:06:12.669937,2025-04-24 22:06:18.419180,0 days 00:00:05.749243,True,squared_error,26,,1,2,861,TPESampler,COMPLETE
857,0.41682342851770215,2025-04-24 22:06:16.161354,2025-04-24 22:06:18.941604,0 days 00:00:02.780250,True,squared_error,40,,3,4,583,TPESampler,COMPLETE
858,0.9708613967787575,2025-04-24 22:06:18.600724,2025-04-24 22:06:20.901429,0 days 00:00:02.300705,True,squared_error,34,sqrt,3,6,943,TPESampler,COMPLETE
859,0.43979388571543515,2025-04-24 22:06:19.145323,2025-04-24 22:06:23.050589,0 days 00:00:03.905266,True,squared_error,47,,4,3,807,TPESampler,COMPLETE
860,0.7180175248851335,2025-04-24 22:06:21.083171,2025-04-24 22:06:23.276075,0 days 00:00:02.192904,True,squared_error,18,,14,2,552,TPESampler,COMPLETE
861,0.4160667988032841,2025-04-24 22:06:23.233292,2025-04-24 22:06:27.226558,0 days 00:00:03.993266,True,squared_error,25,,3,2,854,TPESampler,COMPLETE
862,0.40272853966008226,2025-04-24 22:06:23.507077,2025-04-24 22:06:28.906890,0 days 00:00:05.399813,True,squared_error,25,,2,2,996,TPESampler,COMPLETE
863,0.40222116043429706,2025-04-24 22:06:27.415451,2025-04-24 22:06:33.246767,0 days 00:00:05.831316,True,squared_error,46,,2,2,987,TPESampler,COMPLETE
864,1.3149376756742688,2025-04-24 22:06:29.087863,2025-04-24 22:06:30.394398,0 days 00:00:01.306535,False,squared_error,26,log2,7,7,957,TPESampler,COMPLETE
865,1.229818779571371,2025-04-24 22:06:30.580594,2025-04-24 22:06:32.281264,0 days 00:00:01.700670,True,squared_error,37,log2,2,2,886,TPESampler,COMPLETE
866,0.4078394319203531,2025-04-24 22:06:32.456749,2025-04-24 22:06:37.720868,0 days 00:00:05.264119,True,squared_error,33,,1,4,795,TPESampler,COMPLETE
867,0.4025827911166676,2025-04-24 22:06:33.447077,2025-04-24 22:06:37.947727,0 days 00:00:04.500650,True,squared_error,42,,2,3,806,TPESampler,COMPLETE
868,0.41601657019288935,2025-04-24 22:06:34.677564,2025-04-24 22:06:38.927082,0 days 00:00:04.249518,True,squared_error,37,,3,2,869,TPESampler,COMPLETE
869,0.6608198517060495,2025-04-24 22:06:37.903589,2025-04-24 22:06:39.510550,0 days 00:00:01.606961,True,squared_error,46,sqrt,1,14,296,TPESampler,COMPLETE
870,0.41843225762646163,2025-04-24 22:06:38.158750,2025-04-24 22:06:43.344309,0 days 00:00:05.185559,True,squared_error,36,,3,7,956,TPESampler,COMPLETE
871,0.404451262668982,2025-04-24 22:06:39.279996,2025-04-24 22:06:45.363245,0 days 00:00:06.083249,True,squared_error,49,,1,5,974,TPESampler,COMPLETE
872,1.1457855437480697,2025-04-24 22:06:39.733704,2025-04-24 22:06:41.077907,0 days 00:00:01.344203,False,squared_error,19,log2,2,2,473,TPESampler,COMPLETE
873,0.4725208262574897,2025-04-24 22:06:41.253185,2025-04-24 22:06:46.925352,0 days 00:00:05.672167,False,squared_error,39,,1,4,666,TPESampler,COMPLETE
874,0.5191656818314305,2025-04-24 22:06:43.527884,2025-04-24 22:07:21.272594,0 days 00:00:37.744710,False,absolute_error,7,,3,8,731,TPESampler,COMPLETE
875,1.0153645803797853,2025-04-24 22:06:45.535413,2025-04-24 22:06:59.489743,0 days 00:00:13.954330,False,absolute_error,22,log2,1,2,970,TPESampler,COMPLETE
876,1.3606663928533504,2025-04-24 22:06:47.112334,2025-04-24 22:06:48.714668,0 days 00:00:01.602334,True,absolute_error,43,sqrt,12,17,758,TPESampler,COMPLETE
877,1.3647311211845023,2025-04-24 22:06:48.879736,2025-04-24 22:06:50.136734,0 days 00:00:01.256998,True,absolute_error,7,sqrt,13,9,510,TPESampler,COMPLETE
878,0.40252434088730826,2025-04-24 22:06:50.335663,2025-04-24 22:06:54.404795,0 days 00:00:04.069132,True,squared_error,36,,2,3,857,TPESampler,COMPLETE
879,1.27329037920576,2025-04-24 22:06:54.582602,2025-04-24 22:06:58.881941,0 days 00:00:04.299339,False,absolute_error,45,sqrt,8,5,932,TPESampler,COMPLETE
880,0.47854074428527227,2025-04-24 22:06:59.064762,2025-04-24 22:07:14.443632,0 days 00:00:15.378870,True,absolute_error,29,,4,7,667,TPESampler,COMPLETE
881,0.4185031258900291,2025-04-24 22:06:59.854980,2025-04-24 22:07:05.202189,0 days 00:00:05.347209,True,squared_error,36,,1,3,933,TPESampler,COMPLETE
882,0.6875661035633264,2025-04-24 22:07:05.384264,2025-04-24 22:07:09.817532,0 days 00:00:04.433268,False,squared_error,17,,1,50,997,TPESampler,COMPLETE
883,0.6112913502523963,2025-04-24 22:07:09.992543,2025-04-24 22:07:12.158731,0 days 00:00:02.166188,True,squared_error,33,sqrt,1,6,959,TPESampler,COMPLETE
884,0.4397699167562421,2025-04-24 22:07:12.330602,2025-04-24 22:07:16.547635,0 days 00:00:04.217033,True,squared_error,29,,4,3,972,TPESampler,COMPLETE
885,0.4164941683800708,2025-04-24 22:07:14.624195,2025-04-24 22:07:19.180284,0 days 00:00:04.556089,True,squared_error,31,,3,2,994,TPESampler,COMPLETE
886,0.42544921505195893,2025-04-24 22:07:16.727407,2025-04-24 22:07:23.775378,0 days 00:00:07.047971,True,squared_error,33,,1,2,978,TPESampler,COMPLETE
887,0.43965271813880824,2025-04-24 22:07:19.361152,2025-04-24 22:07:24.074479,0 days 00:00:04.713327,True,squared_error,45,,4,3,1000,TPESampler,COMPLETE
888,0.41649459025198,2025-04-24 22:07:21.507567,2025-04-24 22:07:26.296196,0 days 00:00:04.788629,True,squared_error,39,,3,2,995,TPESampler,COMPLETE
889,0.8388487603983058,2025-04-24 22:07:24.200248,2025-04-24 22:07:40.978747,0 days 00:00:16.778499,True,absolute_error,40,,1,47,262,TPESampler,COMPLETE
890,0.402445233672541,2025-04-24 22:07:24.315591,2025-04-24 22:07:28.807924,0 days 00:00:04.492333,True,squared_error,49,,2,4,783,TPESampler,COMPLETE
891,0.4027563147729549,2025-04-24 22:07:26.472903,2025-04-24 22:07:30.770648,0 days 00:00:04.297745,True,squared_error,37,,2,5,842,TPESampler,COMPLETE
892,0.4025971904926444,2025-04-24 22:07:29.123935,2025-04-24 22:07:33.414917,0 days 00:00:04.290982,True,squared_error,42,,2,2,824,TPESampler,COMPLETE
893,0.40240470269938466,2025-04-24 22:07:30.944610,2025-04-24 22:07:35.352121,0 days 00:00:04.407511,True,squared_error,50,,2,2,853,TPESampler,COMPLETE
894,0.40215893871525615,2025-04-24 22:07:33.620862,2025-04-24 22:07:38.924473,0 days 00:00:05.303611,True,squared_error,33,,2,2,979,TPESampler,COMPLETE
895,0.6983179143901211,2025-04-24 22:07:35.530514,2025-04-24 22:07:37.441048,0 days 00:00:01.910534,True,squared_error,38,,13,2,506,TPESampler,COMPLETE
896,0.4028830902950196,2025-04-24 22:07:37.634394,2025-04-24 22:07:42.970462,0 days 00:00:05.336068,True,squared_error,38,,2,5,998,TPESampler,COMPLETE
897,0.4026548829355945,2025-04-24 22:07:39.103240,2025-04-24 22:07:44.190159,0 days 00:00:05.086919,True,squared_error,25,,2,3,951,TPESampler,COMPLETE
898,0.40235560514198254,2025-04-24 22:07:41.161583,2025-04-24 22:07:46.278726,0 days 00:00:05.117143,True,squared_error,30,,2,2,980,TPESampler,COMPLETE
899,0.4345289041810753,2025-04-24 22:07:43.146407,2025-04-24 22:07:46.960992,0 days 00:00:03.814585,True,absolute_error,17,,3,8,113,TPESampler,COMPLETE
900,0.4021183685163276,2025-04-24 22:07:44.392426,2025-04-24 22:07:49.912097,0 days 00:00:05.519671,True,squared_error,29,,2,2,976,TPESampler,COMPLETE
901,0.4030291853579902,2025-04-24 22:07:46.453123,2025-04-24 22:07:51.371671,0 days 00:00:04.918548,True,squared_error,28,,2,5,869,TPESampler,COMPLETE
902,0.42548471718080116,2025-04-24 22:07:47.350148,2025-04-24 22:07:54.388640,0 days 00:00:07.038492,True,squared_error,31,,1,2,993,TPESampler,COMPLETE
903,0.4025298709796297,2025-04-24 22:07:50.105148,2025-04-24 22:07:54.494815,0 days 00:00:04.389667,True,squared_error,29,,2,2,800,TPESampler,COMPLETE
904,0.416371567611845,2025-04-24 22:07:51.554336,2025-04-24 22:07:56.630803,0 days 00:00:05.076467,True,squared_error,22,,3,2,979,TPESampler,COMPLETE
905,0.40284552263400014,2025-04-24 22:07:54.560328,2025-04-24 22:07:59.810266,0 days 00:00:05.249938,True,squared_error,26,,2,2,906,TPESampler,COMPLETE
906,0.4022060874182134,2025-04-24 22:07:54.729666,2025-04-24 22:08:00.287236,0 days 00:00:05.557570,True,squared_error,29,,2,2,978,TPESampler,COMPLETE
907,0.4160671599307743,2025-04-24 22:07:56.811341,2025-04-24 22:08:01.733707,0 days 00:00:04.922366,True,squared_error,30,,3,4,873,TPESampler,COMPLETE
908,1.3371998514888768,2025-04-24 22:07:59.998287,2025-04-24 22:08:01.710152,0 days 00:00:01.711865,False,squared_error,45,log2,15,8,948,TPESampler,COMPLETE
909,0.4090158078432413,2025-04-24 22:08:00.464268,2025-04-24 22:08:06.090061,0 days 00:00:05.625793,True,squared_error,25,,1,4,798,TPESampler,COMPLETE
910,0.4163606551772285,2025-04-24 22:08:01.862838,2025-04-24 22:08:06.849645,0 days 00:00:04.986807,True,squared_error,28,,3,3,980,TPESampler,COMPLETE
911,0.40262116202538517,2025-04-24 22:08:01.904455,2025-04-24 22:08:07.810827,0 days 00:00:05.906372,True,squared_error,23,,2,3,988,TPESampler,COMPLETE
912,0.40249785707668806,2025-04-24 22:08:06.261942,2025-04-24 22:08:11.075596,0 days 00:00:04.813654,True,squared_error,33,,2,2,807,TPESampler,COMPLETE
913,0.4022702319630751,2025-04-24 22:08:07.175481,2025-04-24 22:08:12.306821,0 days 00:00:05.131340,True,squared_error,29,,2,2,943,TPESampler,COMPLETE
914,0.4025867284960312,2025-04-24 22:08:08.229757,2025-04-24 22:08:12.607427,0 days 00:00:04.377670,True,squared_error,33,,2,3,870,TPESampler,COMPLETE
915,1.1039731257296777,2025-04-24 22:08:11.287412,2025-04-24 22:08:12.529393,0 days 00:00:01.241981,True,absolute_error,44,sqrt,3,4,148,TPESampler,COMPLETE
916,0.4242076880406992,2025-04-24 22:08:12.478633,2025-04-24 22:08:20.203088,0 days 00:00:07.724455,True,squared_error,49,,1,2,982,TPESampler,COMPLETE
917,0.40238358978212857,2025-04-24 22:08:12.819310,2025-04-24 22:08:17.700340,0 days 00:00:04.881030,True,squared_error,29,,2,3,846,TPESampler,COMPLETE
918,0.40225588206846336,2025-04-24 22:08:12.864402,2025-04-24 22:08:18.286949,0 days 00:00:05.422547,True,squared_error,36,,2,4,965,TPESampler,COMPLETE
919,0.40280304580928356,2025-04-24 22:08:17.872614,2025-04-24 22:08:56.834855,0 days 00:00:38.962241,True,absolute_error,34,,2,3,942,TPESampler,COMPLETE
920,0.4160449381208938,2025-04-24 22:08:18.716895,2025-04-24 22:08:22.638584,0 days 00:00:03.921689,True,squared_error,50,,3,6,855,TPESampler,COMPLETE
921,0.41644700863622386,2025-04-24 22:08:20.443868,2025-04-24 22:08:21.996716,0 days 00:00:01.552848,True,squared_error,33,,3,2,266,TPESampler,COMPLETE
922,0.4026714069856485,2025-04-24 22:08:22.181179,2025-04-24 22:08:26.684380,0 days 00:00:04.503201,True,squared_error,50,,2,4,880,TPESampler,COMPLETE
923,0.8365301753935591,2025-04-24 22:08:23.039500,2025-04-24 22:08:38.113941,0 days 00:00:15.074441,False,absolute_error,48,log2,1,13,810,TPESampler,COMPLETE
924,0.41651152129787683,2025-04-24 22:08:26.856283,2025-04-24 22:08:30.938133,0 days 00:00:04.081850,True,squared_error,33,,3,4,996,TPESampler,COMPLETE
925,0.43969781098389726,2025-04-24 22:08:31.107426,2025-04-24 22:08:34.644408,0 days 00:00:03.536982,True,squared_error,30,,4,2,923,TPESampler,COMPLETE
926,0.4021609178211452,2025-04-24 22:08:34.815827,2025-04-24 22:08:39.728486,0 days 00:00:04.912659,True,squared_error,39,,2,4,970,TPESampler,COMPLETE
927,0.4088657406309949,2025-04-24 22:08:38.309015,2025-04-24 22:08:43.933638,0 days 00:00:05.624623,True,squared_error,28,,1,4,1000,TPESampler,COMPLETE
928,0.9041862533275143,2025-04-24 22:08:39.914696,2025-04-24 22:08:52.232250,0 days 00:00:12.317554,False,absolute_error,32,sqrt,1,45,548,TPESampler,COMPLETE
929,0.42608116305217486,2025-04-24 22:08:44.106684,2025-04-24 22:08:49.868085,0 days 00:00:05.761401,True,squared_error,22,,1,2,972,TPESampler,COMPLETE
930,0.6017681458593267,2025-04-24 22:08:50.056643,2025-04-24 22:09:01.664882,0 days 00:00:11.608239,True,absolute_error,39,sqrt,1,3,782,TPESampler,COMPLETE
931,0.40767095525681185,2025-04-24 22:08:52.405099,2025-04-24 22:08:58.179826,0 days 00:00:05.774727,True,squared_error,40,,1,4,988,TPESampler,COMPLETE
932,0.4164941683800708,2025-04-24 22:08:57.014300,2025-04-24 22:09:01.581888,0 days 00:00:04.567588,True,squared_error,31,,3,2,994,TPESampler,COMPLETE
933,0.4029153035446955,2025-04-24 22:08:58.359082,2025-04-24 22:09:03.268757,0 days 00:00:04.909675,True,squared_error,36,,2,5,827,TPESampler,COMPLETE
934,0.6682682558709622,2025-04-24 22:09:01.736758,2025-04-24 22:09:05.487260,0 days 00:00:03.750502,True,squared_error,40,log2,1,2,991,TPESampler,COMPLETE
935,0.4225609326215943,2025-04-24 22:09:01.813158,2025-04-24 22:09:09.948012,0 days 00:00:08.134854,False,squared_error,33,,1,5,981,TPESampler,COMPLETE
936,0.4027493143289596,2025-04-24 22:09:03.438089,2025-04-24 22:09:08.159550,0 days 00:00:04.721461,True,squared_error,36,,2,3,890,TPESampler,COMPLETE
937,0.41637552845619474,2025-04-24 22:09:05.664066,2025-04-24 22:09:10.223797,0 days 00:00:04.559731,True,squared_error,36,,3,3,976,TPESampler,COMPLETE
938,0.40222116043429706,2025-04-24 22:09:08.336043,2025-04-24 22:09:13.684049,0 days 00:00:05.348006,True,squared_error,35,,2,3,987,TPESampler,COMPLETE
939,0.4025309373561724,2025-04-24 22:09:10.145119,2025-04-24 22:09:15.429579,0 days 00:00:05.284460,True,squared_error,27,,2,4,986,TPESampler,COMPLETE
940,0.6497886924151235,2025-04-24 22:09:10.426286,2025-04-24 22:09:28.580154,0 days 00:00:18.153868,True,absolute_error,6,,4,33,837,TPESampler,COMPLETE
941,0.41411766785111387,2025-04-24 22:09:13.876957,2025-04-24 22:09:18.873618,0 days 00:00:04.996661,True,squared_error,35,,2,9,982,TPESampler,COMPLETE
942,0.4594375177487076,2025-04-24 22:09:15.613987,2025-04-24 22:09:16.934281,0 days 00:00:01.320294,False,squared_error,14,,2,18,173,TPESampler,COMPLETE
943,1.4010800261855572,2025-04-24 22:09:17.116502,2025-04-24 22:09:18.981107,0 days 00:00:01.864605,True,absolute_error,29,log2,15,29,971,TPESampler,COMPLETE
944,0.41172893372853675,2025-04-24 22:09:19.063961,2025-04-24 22:09:23.950670,0 days 00:00:04.886709,True,squared_error,40,,2,8,998,TPESampler,COMPLETE
945,0.4025294158551159,2025-04-24 22:09:19.138891,2025-04-24 22:09:24.341429,0 days 00:00:05.202538,True,squared_error,26,,2,2,980,TPESampler,COMPLETE
946,0.9702427336282744,2025-04-24 22:09:24.135693,2025-04-24 22:09:26.108932,0 days 00:00:01.973239,False,squared_error,48,sqrt,4,5,901,TPESampler,COMPLETE
947,0.4234957374916506,2025-04-24 22:09:24.557971,2025-04-24 22:09:32.293349,0 days 00:00:07.735378,True,squared_error,37,,1,2,1000,TPESampler,COMPLETE
948,1.2276576472624474,2025-04-24 22:09:26.309978,2025-04-24 22:09:27.278371,0 days 00:00:00.968393,False,squared_error,6,log2,1,46,461,TPESampler,COMPLETE
949,0.4289234254307321,2025-04-24 22:09:27.455196,2025-04-24 22:09:30.328349,0 days 00:00:02.873153,False,squared_error,42,,3,5,409,TPESampler,COMPLETE
950,0.4025795354605384,2025-04-24 22:09:28.770413,2025-04-24 22:09:33.584341,0 days 00:00:04.813928,True,squared_error,37,,2,4,817,TPESampler,COMPLETE
951,0.4742702298122099,2025-04-24 22:09:30.502230,2025-04-24 22:10:09.188208,0 days 00:00:38.685978,True,absolute_error,35,,2,12,945,TPESampler,COMPLETE
952,0.8583147436083058,2025-04-24 22:09:32.474859,2025-04-24 22:09:35.000684,0 days 00:00:02.525825,True,squared_error,27,sqrt,2,2,994,TPESampler,COMPLETE
953,1.1841676291342567,2025-04-24 22:09:33.776367,2025-04-24 22:09:40.142792,0 days 00:00:06.366425,True,absolute_error,7,sqrt,1,13,942,TPESampler,COMPLETE
954,0.40875674476538726,2025-04-24 22:09:35.180308,2025-04-24 22:09:40.083809,0 days 00:00:04.903501,True,squared_error,36,,1,4,873,TPESampler,COMPLETE
955,0.4396398731425136,2025-04-24 22:09:40.236912,2025-04-24 22:09:44.079713,0 days 00:00:03.842801,True,squared_error,38,,4,4,822,TPESampler,COMPLETE
956,0.40254795879434646,2025-04-24 22:09:40.305800,2025-04-24 22:09:45.469571,0 days 00:00:05.163771,True,squared_error,34,,2,3,878,TPESampler,COMPLETE
957,0.4023259613133283,2025-04-24 22:09:44.294116,2025-04-24 22:09:49.308221,0 days 00:00:05.014105,True,squared_error,38,,2,2,999,TPESampler,COMPLETE
958,0.4022324925345733,2025-04-24 22:09:45.647578,2025-04-24 22:09:50.641928,0 days 00:00:04.994350,True,squared_error,39,,2,2,989,TPESampler,COMPLETE
959,0.40267587831578155,2025-04-24 22:09:49.483341,2025-04-24 22:09:54.003549,0 days 00:00:04.520208,True,squared_error,34,,2,2,899,TPESampler,COMPLETE
960,0.6061009743570411,2025-04-24 22:09:50.819858,2025-04-24 22:10:08.970518,0 days 00:00:18.150660,False,absolute_error,39,sqrt,1,7,732,TPESampler,COMPLETE
961,0.4067845158360659,2025-04-24 22:09:54.173075,2025-04-24 22:10:00.451703,0 days 00:00:06.278628,False,squared_error,26,,2,2,988,TPESampler,COMPLETE
962,0.402333740056822,2025-04-24 22:10:00.631970,2025-04-24 22:10:05.119006,0 days 00:00:04.487036,True,squared_error,39,,2,3,957,TPESampler,COMPLETE
963,1.0358104615577368,2025-04-24 22:10:05.300420,2025-04-24 22:10:06.031665,0 days 00:00:00.731245,False,squared_error,12,log2,1,2,142,TPESampler,COMPLETE
964,0.4397770353736771,2025-04-24 22:10:06.202394,2025-04-24 22:10:09.446121,0 days 00:00:03.243727,True,squared_error,34,,4,2,796,TPESampler,COMPLETE
965,0.4641151656080078,2025-04-24 22:10:09.151954,2025-04-24 22:11:05.489281,0 days 00:00:56.337327,True,absolute_error,7,,1,2,985,TPESampler,COMPLETE
966,0.40516683472092974,2025-04-24 22:10:09.410792,2025-04-24 22:10:15.459383,0 days 00:00:06.048591,True,squared_error,35,,1,5,999,TPESampler,COMPLETE
967,0.4523415235953171,2025-04-24 22:10:09.734889,2025-04-24 22:10:14.793142,0 days 00:00:05.058253,False,squared_error,18,,7,9,975,TPESampler,COMPLETE
968,0.4163856497417495,2025-04-24 22:10:14.962761,2025-04-24 22:10:19.529669,0 days 00:00:04.566908,True,squared_error,30,,3,6,985,TPESampler,COMPLETE
969,0.4022161280750829,2025-04-24 22:10:15.878246,2025-04-24 22:10:20.840784,0 days 00:00:04.962538,True,squared_error,28,,2,3,967,TPESampler,COMPLETE
970,0.40223870887214347,2025-04-24 22:10:19.712199,2025-04-24 22:10:24.758427,0 days 00:00:05.046228,True,squared_error,31,,2,2,989,TPESampler,COMPLETE
971,0.4314477942442185,2025-04-24 22:10:21.019583,2025-04-24 22:11:34.207762,0 days 00:01:13.188179,True,absolute_error,44,,1,2,980,TPESampler,COMPLETE
972,1.4006216645590956,2025-04-24 22:10:24.933093,2025-04-24 22:10:25.983792,0 days 00:00:01.050699,True,absolute_error,38,log2,11,5,409,TPESampler,COMPLETE
973,1.3373706810988468,2025-04-24 22:10:26.154920,2025-04-24 22:10:27.124301,0 days 00:00:00.969381,True,absolute_error,19,log2,2,48,162,TPESampler,COMPLETE
974,0.42496815693548085,2025-04-24 22:10:27.301185,2025-04-24 22:10:32.139000,0 days 00:00:04.837815,True,squared_error,30,,1,2,779,TPESampler,COMPLETE
975,0.4023218971307515,2025-04-24 22:10:32.317121,2025-04-24 22:10:36.856941,0 days 00:00:04.539820,True,squared_error,40,,2,3,995,TPESampler,COMPLETE
976,0.41948022256312933,2025-04-24 22:10:37.028055,2025-04-24 22:10:41.909671,0 days 00:00:04.881616,True,squared_error,30,,1,3,856,TPESampler,COMPLETE
977,0.4160648712180159,2025-04-24 22:10:42.084033,2025-04-24 22:10:45.502042,0 days 00:00:03.418009,True,squared_error,43,,3,2,807,TPESampler,COMPLETE
978,0.4397804718357272,2025-04-24 22:10:45.673481,2025-04-24 22:10:49.434209,0 days 00:00:03.760728,True,squared_error,38,,4,3,983,TPESampler,COMPLETE
979,0.40259427607234954,2025-04-24 22:10:49.614073,2025-04-24 22:10:53.558727,0 days 00:00:03.944654,True,squared_error,29,,2,5,855,TPESampler,COMPLETE
980,0.40222022381018935,2025-04-24 22:10:53.731845,2025-04-24 22:10:58.339595,0 days 00:00:04.607750,True,squared_error,42,,2,2,988,TPESampler,COMPLETE
981,0.4022712520510593,2025-04-24 22:10:58.515092,2025-04-24 22:11:03.131007,0 days 00:00:04.615915,True,squared_error,31,,2,3,982,TPESampler,COMPLETE
982,0.4024334180298199,2025-04-24 22:11:03.304598,2025-04-24 22:11:08.310221,0 days 00:00:05.005623,True,squared_error,30,,2,3,994,TPESampler,COMPLETE
983,1.2090236904463931,2025-04-24 22:11:05.664480,2025-04-24 22:11:09.856075,0 days 00:00:04.191595,True,absolute_error,45,sqrt,4,3,944,TPESampler,COMPLETE
984,0.4269081052811106,2025-04-24 22:11:08.488530,2025-04-24 22:11:38.357523,0 days 00:00:29.868993,True,absolute_error,28,,3,3,1000,TPESampler,COMPLETE
985,0.43971006033309706,2025-04-24 22:11:10.028911,2025-04-24 22:11:13.905092,0 days 00:00:03.876181,True,squared_error,39,,4,5,995,TPESampler,COMPLETE
986,0.466996492640045,2025-04-24 22:11:14.326586,2025-04-24 22:11:21.467431,0 days 00:00:07.140845,False,squared_error,45,,1,2,782,TPESampler,COMPLETE
987,0.4021878060183394,2025-04-24 22:11:21.646518,2025-04-24 22:11:26.188000,0 days 00:00:04.541482,True,squared_error,37,,2,4,975,TPESampler,COMPLETE
988,0.4397477381673025,2025-04-24 22:11:26.358479,2025-04-24 22:11:30.149689,0 days 00:00:03.791210,True,squared_error,47,,4,2,982,TPESampler,COMPLETE
989,0.4250573430409538,2025-04-24 22:11:30.334295,2025-04-24 22:11:35.890912,0 days 00:00:05.556617,True,squared_error,36,,1,2,813,TPESampler,COMPLETE
990,0.4256563855589461,2025-04-24 22:11:34.399928,2025-04-24 22:11:41.471081,0 days 00:00:07.071153,True,squared_error,31,,1,2,985,TPESampler,COMPLETE
991,1.3821671504722777,2025-04-24 22:11:36.074478,2025-04-24 22:11:38.149529,0 days 00:00:02.075051,True,absolute_error,8,log2,5,14,978,TPESampler,COMPLETE
992,1.3144589448037534,2025-04-24 22:11:38.326214,2025-04-24 22:11:41.776971,0 days 00:00:03.450757,True,absolute_error,44,log2,2,14,975,TPESampler,COMPLETE
