number,value,datetime_start,datetime_complete,duration,params_bootstrap,params_criterion,params_max_depth,params_max_features,params_min_samples_leaf,params_min_samples_split,params_n_estimators,system_attrs_auto:sampler,state
1134,0.4026359831458069,2025-04-24 22:16:50.540696,2025-04-24 22:16:54.984094,0 days 00:00:04.443398,True,squared_error,36,,2,2,872,TPESampler,COMPLETE
1135,0.40385312985488864,2025-04-24 22:16:53.227626,2025-04-24 22:16:57.189668,0 days 00:00:03.962042,True,squared_error,20,,2,2,759,TPESampler,COMPLETE
1136,0.40359572256643395,2025-04-24 22:16:55.160330,2025-04-24 22:16:59.753872,0 days 00:00:04.593542,True,squared_error,19,,2,2,916,TPESampler,COMPLETE
1137,0.42577053731602604,2025-04-24 22:16:57.364162,2025-04-24 22:17:03.358638,0 days 00:00:05.994476,True,squared_error,22,,1,2,951,TPESampler,COMPLETE
1138,0.40231413738219285,2025-04-24 22:16:59.935023,2025-04-24 22:17:04.946606,0 days 00:00:05.011583,True,squared_error,28,,2,2,999,TPESampler,COMPLETE
1139,0.4026919955718998,2025-04-24 22:17:03.538799,2025-04-24 22:17:08.257133,0 days 00:00:04.718334,True,squared_error,31,,2,2,895,TPESampler,COMPLETE
1140,0.4165160135540393,2025-04-24 22:17:05.132223,2025-04-24 22:17:09.719324,0 days 00:00:04.587101,True,squared_error,25,,3,2,1000,TPESampler,COMPLETE
1141,0.40277248907619134,2025-04-24 22:17:08.450291,2025-04-24 22:17:12.707309,0 days 00:00:04.257018,True,squared_error,30,,2,4,789,TPESampler,COMPLETE
1142,0.4029216819464991,2025-04-24 22:17:09.908665,2025-04-24 22:17:15.022483,0 days 00:00:05.113818,True,squared_error,22,,2,5,1000,TPESampler,COMPLETE
1143,0.40306070638359665,2025-04-24 22:17:12.890167,2025-04-24 22:17:17.167256,0 days 00:00:04.277089,True,squared_error,24,,2,2,864,TPESampler,COMPLETE
1144,0.45431693285553554,2025-04-24 22:17:15.200645,2025-04-24 22:17:47.885957,0 days 00:00:32.685312,False,absolute_error,33,,1,7,268,TPESampler,COMPLETE
1145,0.402240654477862,2025-04-24 22:17:17.345431,2025-04-24 22:17:21.919071,0 days 00:00:04.573640,True,squared_error,41,,2,3,993,TPESampler,COMPLETE
1146,1.3590807175676887,2025-04-24 22:17:22.099120,2025-04-24 22:17:23.980903,0 days 00:00:01.881783,True,absolute_error,10,log2,3,4,715,TPESampler,COMPLETE
1147,0.42206915878557527,2025-04-24 22:17:24.154887,2025-04-24 22:17:29.814892,0 days 00:00:05.660005,False,squared_error,44,,2,8,958,TPESampler,COMPLETE
1148,0.7769616981742753,2025-04-24 22:17:29.993434,2025-04-24 22:17:31.921107,0 days 00:00:01.927673,False,squared_error,42,sqrt,2,2,966,TPESampler,COMPLETE
1149,0.40247159951256745,2025-04-24 22:17:32.102905,2025-04-24 22:17:36.684829,0 days 00:00:04.581924,True,squared_error,30,,2,2,995,TPESampler,COMPLETE
1150,1.3105594204531659,2025-04-24 22:17:36.870682,2025-04-24 22:17:39.742972,0 days 00:00:02.872290,True,absolute_error,21,log2,2,2,853,TPESampler,COMPLETE
1151,0.4051632733974039,2025-04-24 22:17:39.917382,2025-04-24 22:18:08.858649,0 days 00:00:28.941267,True,absolute_error,21,,2,2,691,TPESampler,COMPLETE
1152,0.6732292297150336,2025-04-24 22:17:44.996214,2025-04-24 22:17:47.836872,0 days 00:00:02.840658,True,squared_error,40,,12,5,815,TPESampler,COMPLETE
1153,1.227608297031857,2025-04-24 22:17:47.997286,2025-04-24 22:17:50.812839,0 days 00:00:02.815553,True,squared_error,49,log2,2,2,952,TPESampler,COMPLETE
1154,1.3197422118596343,2025-04-24 22:17:48.050495,2025-04-24 22:17:50.709735,0 days 00:00:02.659240,True,squared_error,25,log2,5,2,855,TPESampler,COMPLETE
1155,0.7643510691576867,2025-04-24 22:17:50.881268,2025-04-24 22:17:52.644395,0 days 00:00:01.763127,False,squared_error,48,sqrt,2,3,334,TPESampler,COMPLETE
1156,0.40228844639697,2025-04-24 22:17:51.106734,2025-04-24 22:17:57.126677,0 days 00:00:06.019943,True,squared_error,28,,2,3,996,TPESampler,COMPLETE
1157,0.7430175610602318,2025-04-24 22:17:52.838366,2025-04-24 22:17:55.766466,0 days 00:00:02.928100,True,squared_error,14,,13,50,947,TPESampler,COMPLETE
1158,1.401611501548041,2025-04-24 22:17:55.961530,2025-04-24 22:17:57.713754,0 days 00:00:01.752224,True,absolute_error,22,log2,15,6,761,TPESampler,COMPLETE
1159,0.4233202405957772,2025-04-24 22:17:57.319467,2025-04-24 22:18:03.480133,0 days 00:00:06.160666,True,squared_error,40,,1,2,861,TPESampler,COMPLETE
1160,1.219918758970234,2025-04-24 22:17:58.158894,2025-04-24 22:17:59.316057,0 days 00:00:01.157163,True,absolute_error,8,sqrt,4,5,187,TPESampler,COMPLETE
1161,0.4160481293243465,2025-04-24 22:17:59.505117,2025-04-24 22:18:03.261454,0 days 00:00:03.756337,True,squared_error,41,,3,2,865,TPESampler,COMPLETE
1162,0.46668340883557236,2025-04-24 22:18:03.439329,2025-04-24 22:18:06.802290,0 days 00:00:03.362961,True,squared_error,33,,5,2,791,TPESampler,COMPLETE
1163,0.42445648158919536,2025-04-24 22:18:03.723853,2025-04-24 22:18:10.835724,0 days 00:00:07.111871,True,squared_error,35,,1,2,992,TPESampler,COMPLETE
1164,0.4396120211159689,2025-04-24 22:18:06.983321,2025-04-24 22:18:11.121515,0 days 00:00:04.138194,True,squared_error,33,,4,2,959,TPESampler,COMPLETE
1165,0.4289150022052402,2025-04-24 22:18:09.051163,2025-04-24 22:18:10.825790,0 days 00:00:01.774627,False,squared_error,49,,3,2,227,TPESampler,COMPLETE
1166,0.4233484833740548,2025-04-24 22:18:11.031881,2025-04-24 22:19:13.828794,0 days 00:01:02.796913,True,absolute_error,26,,1,3,902,TPESampler,COMPLETE
1167,0.8955356089370126,2025-04-24 22:18:11.087475,2025-04-24 22:18:14.150955,0 days 00:00:03.063480,True,squared_error,23,log2,1,2,746,TPESampler,COMPLETE
1168,1.3528328564428258,2025-04-24 22:18:11.339904,2025-04-24 22:18:13.654813,0 days 00:00:02.314909,True,absolute_error,50,log2,3,2,455,TPESampler,COMPLETE
1169,1.3056153808955115,2025-04-24 22:18:13.840679,2025-04-24 22:18:16.555489,0 days 00:00:02.714810,True,absolute_error,7,log2,1,20,475,TPESampler,COMPLETE
1170,0.40237173978803037,2025-04-24 22:18:14.365546,2025-04-24 22:18:19.973012,0 days 00:00:05.607466,True,squared_error,30,,2,2,987,TPESampler,COMPLETE
1171,1.3829403482024962,2025-04-24 22:18:16.730905,2025-04-24 22:18:18.511421,0 days 00:00:01.780516,False,absolute_error,13,log2,7,26,756,TPESampler,COMPLETE
1172,0.42527579394959814,2025-04-24 22:18:18.705071,2025-04-24 22:18:25.407398,0 days 00:00:06.702327,True,squared_error,29,,1,2,998,TPESampler,COMPLETE
1173,0.4022936022957746,2025-04-24 22:18:20.154535,2025-04-24 22:18:24.867071,0 days 00:00:04.712536,True,squared_error,39,,2,2,1000,TPESampler,COMPLETE
1174,0.7635579686009742,2025-04-24 22:18:25.052470,2025-04-24 22:18:27.372544,0 days 00:00:02.320074,False,squared_error,34,log2,1,6,923,TPESampler,COMPLETE
1175,0.439827891900037,2025-04-24 22:18:25.595841,2025-04-24 22:18:29.412239,0 days 00:00:03.816398,True,squared_error,31,,4,4,766,TPESampler,COMPLETE
1176,0.46024693350316914,2025-04-24 22:18:27.558747,2025-04-24 22:19:40.343542,0 days 00:01:12.784795,False,absolute_error,24,,2,7,950,TPESampler,COMPLETE
1177,0.4397301230270905,2025-04-24 22:18:29.600876,2025-04-24 22:18:33.387283,0 days 00:00:03.786407,True,squared_error,31,,4,2,987,TPESampler,COMPLETE
1178,0.40222116043429706,2025-04-24 22:18:33.583061,2025-04-24 22:18:38.204477,0 days 00:00:04.621416,True,squared_error,46,,2,4,987,TPESampler,COMPLETE
1179,0.41617709972215444,2025-04-24 22:18:38.385566,2025-04-24 22:18:41.957996,0 days 00:00:03.572430,True,squared_error,39,,3,2,860,TPESampler,COMPLETE
1180,0.4396373420646938,2025-04-24 22:18:42.134104,2025-04-24 22:18:45.766681,0 days 00:00:03.632577,True,squared_error,42,,4,2,958,TPESampler,COMPLETE
1181,0.4023759016793659,2025-04-24 22:18:45.947815,2025-04-24 22:18:49.954731,0 days 00:00:04.006916,True,squared_error,41,,2,3,844,TPESampler,COMPLETE
1182,0.40914626048883623,2025-04-24 22:18:50.132945,2025-04-24 22:19:28.820868,0 days 00:00:38.687923,True,absolute_error,46,,2,6,982,TPESampler,COMPLETE
1183,1.28528827389212,2025-04-24 22:19:14.002156,2025-04-24 22:19:15.115899,0 days 00:00:01.113743,True,squared_error,42,sqrt,11,49,478,TPESampler,COMPLETE
1184,0.4394782227066694,2025-04-24 22:19:15.300849,2025-04-24 22:19:18.653544,0 days 00:00:03.352695,True,squared_error,21,,4,4,868,TPESampler,COMPLETE
1185,0.40229496321871033,2025-04-24 22:19:18.832961,2025-04-24 22:19:23.419474,0 days 00:00:04.586513,True,squared_error,38,,2,2,992,TPESampler,COMPLETE
1186,1.3496989163575572,2025-04-24 22:19:23.596078,2025-04-24 22:19:24.965037,0 days 00:00:01.368959,True,squared_error,37,log2,15,3,790,TPESampler,COMPLETE
1187,0.40664894161416487,2025-04-24 22:19:25.146178,2025-04-24 22:19:30.028899,0 days 00:00:04.882721,True,squared_error,39,,1,4,790,TPESampler,COMPLETE
1188,0.40218956984207155,2025-04-24 22:19:29.002683,2025-04-24 22:19:33.954443,0 days 00:00:04.951760,True,squared_error,29,,2,2,990,TPESampler,COMPLETE
1189,0.4025619622711552,2025-04-24 22:19:30.219343,2025-04-24 22:19:33.953505,0 days 00:00:03.734162,True,squared_error,28,,2,2,775,TPESampler,COMPLETE
1190,0.4755767146205389,2025-04-24 22:19:34.109484,2025-04-24 22:19:42.546455,0 days 00:00:08.436971,False,squared_error,28,,1,3,997,TPESampler,COMPLETE
1191,0.40222022381018935,2025-04-24 22:19:34.152093,2025-04-24 22:19:39.234963,0 days 00:00:05.082870,True,squared_error,40,,2,3,988,TPESampler,COMPLETE
1192,0.40239644092606763,2025-04-24 22:19:39.418963,2025-04-24 22:19:44.744818,0 days 00:00:05.325855,True,squared_error,22,,2,2,1000,TPESampler,COMPLETE
1193,0.5448654770115674,2025-04-24 22:19:40.526699,2025-04-24 22:19:59.211395,0 days 00:00:18.684696,True,absolute_error,49,,3,17,594,TPESampler,COMPLETE
1194,0.4078003024041882,2025-04-24 22:19:42.734816,2025-04-24 22:19:47.535726,0 days 00:00:04.800910,True,squared_error,26,,1,6,866,TPESampler,COMPLETE
1195,0.4024117544624723,2025-04-24 22:19:44.926317,2025-04-24 22:19:49.493070,0 days 00:00:04.566753,True,squared_error,31,,2,3,853,TPESampler,COMPLETE
1196,0.4072438879095526,2025-04-24 22:19:47.719883,2025-04-24 22:19:53.692164,0 days 00:00:05.972281,True,squared_error,44,,1,4,995,TPESampler,COMPLETE
1197,0.4038004572174628,2025-04-24 22:19:49.675771,2025-04-24 22:20:33.047908,0 days 00:00:43.372137,True,absolute_error,25,,2,2,993,TPESampler,COMPLETE
1198,1.2877444257926742,2025-04-24 22:19:53.873316,2025-04-24 22:19:54.882290,0 days 00:00:01.008974,True,squared_error,33,log2,3,9,400,TPESampler,COMPLETE
1199,0.933323243218631,2025-04-24 22:19:55.051307,2025-04-24 22:19:56.248332,0 days 00:00:01.197025,True,squared_error,21,sqrt,2,48,469,TPESampler,COMPLETE
1200,1.1753929374982761,2025-04-24 22:19:56.437373,2025-04-24 22:20:00.861623,0 days 00:00:04.424250,True,absolute_error,8,sqrt,1,42,538,TPESampler,COMPLETE
1201,0.48179749694172735,2025-04-24 22:19:59.395032,2025-04-24 22:20:04.944806,0 days 00:00:05.549774,False,squared_error,26,,1,15,951,TPESampler,COMPLETE
1202,1.0098009106822032,2025-04-24 22:20:01.048466,2025-04-24 22:20:09.145243,0 days 00:00:08.096777,True,absolute_error,22,sqrt,2,2,976,TPESampler,COMPLETE
1203,1.1999637050648162,2025-04-24 22:20:05.132811,2025-04-24 22:20:06.374529,0 days 00:00:01.241718,False,squared_error,44,sqrt,9,12,623,TPESampler,COMPLETE
1204,0.42307369439564185,2025-04-24 22:20:06.540284,2025-04-24 22:20:12.374404,0 days 00:00:05.834120,True,squared_error,38,,1,2,833,TPESampler,COMPLETE
1205,0.41641695308756965,2025-04-24 22:20:09.329049,2025-04-24 22:20:13.929855,0 days 00:00:04.600806,True,squared_error,42,,3,2,989,TPESampler,COMPLETE
1206,0.402216389485944,2025-04-24 22:20:12.563803,2025-04-24 22:20:18.056297,0 days 00:00:05.492494,True,squared_error,39,,2,2,981,TPESampler,COMPLETE
1207,1.3569199487150028,2025-04-24 22:20:14.160151,2025-04-24 22:20:16.612554,0 days 00:00:02.452403,False,absolute_error,21,log2,4,3,702,TPESampler,COMPLETE
1208,1.083954079910274,2025-04-24 22:20:16.821659,2025-04-24 22:20:17.835852,0 days 00:00:01.014193,False,squared_error,32,sqrt,5,34,419,TPESampler,COMPLETE
1209,0.4026850644386286,2025-04-24 22:20:18.019737,2025-04-24 22:20:22.854552,0 days 00:00:04.834815,True,squared_error,38,,2,4,895,TPESampler,COMPLETE
1210,1.2253006711663235,2025-04-24 22:20:18.274787,2025-04-24 22:20:19.528728,0 days 00:00:01.253941,True,squared_error,7,log2,1,39,290,TPESampler,COMPLETE
1211,0.40265868034526514,2025-04-24 22:20:19.721721,2025-04-24 22:20:24.119564,0 days 00:00:04.397843,True,squared_error,30,,2,2,857,TPESampler,COMPLETE
1212,0.40281774624459343,2025-04-24 22:20:23.036463,2025-04-24 22:20:26.263922,0 days 00:00:03.227459,True,squared_error,38,,2,2,549,TPESampler,COMPLETE
1213,0.40229480858071254,2025-04-24 22:20:24.293057,2025-04-24 22:20:29.412171,0 days 00:00:05.119114,True,squared_error,35,,2,3,991,TPESampler,COMPLETE
1214,0.5242413786525323,2025-04-24 22:20:26.441196,2025-04-24 22:20:29.331694,0 days 00:00:02.890498,True,squared_error,34,sqrt,1,2,877,TPESampler,COMPLETE
1215,0.4023218971307515,2025-04-24 22:20:29.497672,2025-04-24 22:20:35.455373,0 days 00:00:05.957701,True,squared_error,40,,2,2,995,TPESampler,COMPLETE
1216,1.2481183296565053,2025-04-24 22:20:29.624797,2025-04-24 22:20:33.660331,0 days 00:00:04.035534,True,absolute_error,6,sqrt,3,5,779,TPESampler,COMPLETE
1217,0.40286787100063465,2025-04-24 22:20:33.242257,2025-04-24 22:20:40.589277,0 days 00:00:07.347020,False,squared_error,34,,2,2,960,TPESampler,COMPLETE
1218,0.439924438858515,2025-04-24 22:20:33.886910,2025-04-24 22:20:37.716202,0 days 00:00:03.829292,True,squared_error,50,,4,4,785,TPESampler,COMPLETE
1219,0.4030094568065499,2025-04-24 22:20:35.682306,2025-04-24 22:20:40.532386,0 days 00:00:04.850080,True,squared_error,26,,2,4,821,TPESampler,COMPLETE
1220,1.266074121261456,2025-04-24 22:20:37.908654,2025-04-24 22:20:39.025383,0 days 00:00:01.116729,False,squared_error,31,sqrt,15,4,582,TPESampler,COMPLETE
1221,0.8535727085560044,2025-04-24 22:20:39.210913,2025-04-24 22:20:42.323774,0 days 00:00:03.112861,True,squared_error,33,sqrt,2,2,968,TPESampler,COMPLETE
1222,0.40726588757760673,2025-04-24 22:20:40.693966,2025-04-24 22:20:47.999830,0 days 00:00:07.305864,True,squared_error,42,,1,4,1000,TPESampler,COMPLETE
1223,0.4165119353507597,2025-04-24 22:20:40.744421,2025-04-24 22:20:46.254371,0 days 00:00:05.509950,True,squared_error,44,,3,4,997,TPESampler,COMPLETE
1224,1.352557045098542,2025-04-24 22:20:42.516251,2025-04-24 22:20:43.752354,0 days 00:00:01.236103,True,absolute_error,24,sqrt,12,2,357,TPESampler,COMPLETE
1225,0.4398062248893364,2025-04-24 22:20:43.944252,2025-04-24 22:20:48.511020,0 days 00:00:04.566768,True,squared_error,33,,4,3,977,TPESampler,COMPLETE
1226,0.4041549279282254,2025-04-24 22:20:46.447755,2025-04-24 22:20:51.911940,0 days 00:00:05.464185,True,squared_error,18,,2,3,1000,TPESampler,COMPLETE
1227,0.41589421606157206,2025-04-24 22:20:48.197391,2025-04-24 22:20:52.530793,0 days 00:00:04.333402,True,squared_error,27,,3,4,831,TPESampler,COMPLETE
1228,0.41591373190288533,2025-04-24 22:20:48.718418,2025-04-24 22:20:53.620277,0 days 00:00:04.901859,True,squared_error,30,,3,2,834,TPESampler,COMPLETE
1229,1.2276735189888566,2025-04-24 22:20:52.112054,2025-04-24 22:20:54.677041,0 days 00:00:02.564987,True,squared_error,38,log2,2,3,951,TPESampler,COMPLETE
1230,0.4184211862508018,2025-04-24 22:20:52.762956,2025-04-24 22:20:59.269974,0 days 00:00:06.507018,True,squared_error,31,,1,3,875,TPESampler,COMPLETE
1231,0.4247477201888472,2025-04-24 22:20:54.113202,2025-04-24 22:21:02.182095,0 days 00:00:08.068893,True,squared_error,42,,1,2,993,TPESampler,COMPLETE
1232,0.4023320812796236,2025-04-24 22:20:55.137490,2025-04-24 22:21:00.646160,0 days 00:00:05.508670,True,squared_error,31,,2,4,999,TPESampler,COMPLETE
1233,1.3201872214020884,2025-04-24 22:20:59.457824,2025-04-24 22:21:00.615870,0 days 00:00:01.158046,False,squared_error,13,log2,6,35,662,TPESampler,COMPLETE
1234,0.41649459025198,2025-04-24 22:21:00.773775,2025-04-24 22:21:05.915022,0 days 00:00:05.141247,True,squared_error,35,,3,2,995,TPESampler,COMPLETE
1235,0.40248494252339606,2025-04-24 22:21:00.826600,2025-04-24 22:21:05.815697,0 days 00:00:04.989097,True,squared_error,39,,2,2,829,TPESampler,COMPLETE
1236,0.402320512372665,2025-04-24 22:21:02.375440,2025-04-24 22:21:07.973461,0 days 00:00:05.598021,True,squared_error,37,,2,2,997,TPESampler,COMPLETE
1237,0.41651152129787683,2025-04-24 22:21:05.988787,2025-04-24 22:21:11.296736,0 days 00:00:05.307949,True,squared_error,41,,3,3,996,TPESampler,COMPLETE
1238,0.40559769268079887,2025-04-24 22:21:06.067688,2025-04-24 22:21:11.050320,0 days 00:00:04.982632,True,squared_error,42,,2,6,884,TPESampler,COMPLETE
1239,0.4211476754146494,2025-04-24 22:21:08.166130,2025-04-24 22:21:14.943033,0 days 00:00:06.776903,True,squared_error,21,,1,3,981,TPESampler,COMPLETE
1240,0.46626843437962373,2025-04-24 22:21:11.252781,2025-04-24 22:21:15.628813,0 days 00:00:04.376032,True,squared_error,21,,5,2,874,TPESampler,COMPLETE
1241,1.3382473377987663,2025-04-24 22:21:11.566863,2025-04-24 22:21:13.162859,0 days 00:00:01.595996,False,squared_error,7,log2,14,13,901,TPESampler,COMPLETE
1242,0.46715948804064045,2025-04-24 22:21:13.363485,2025-04-24 22:21:23.467013,0 days 00:00:10.103528,False,squared_error,43,,1,2,993,TPESampler,COMPLETE
1243,0.40249967141258275,2025-04-24 22:21:15.138235,2025-04-24 22:21:20.199452,0 days 00:00:05.061217,True,squared_error,29,,2,2,867,TPESampler,COMPLETE
1244,1.1288893347842202,2025-04-24 22:21:16.083643,2025-04-24 22:21:17.513135,0 days 00:00:01.429492,False,squared_error,6,sqrt,2,48,878,TPESampler,COMPLETE
1245,0.40252462965979363,2025-04-24 22:21:17.710797,2025-04-24 22:21:22.498914,0 days 00:00:04.788117,True,squared_error,43,,2,4,868,TPESampler,COMPLETE
1246,1.3125731901389552,2025-04-24 22:21:20.404800,2025-04-24 22:21:21.774563,0 days 00:00:01.369763,False,squared_error,37,log2,6,3,988,TPESampler,COMPLETE
1247,0.40240712248832106,2025-04-24 22:21:21.968832,2025-04-24 22:21:26.850697,0 days 00:00:04.881865,True,squared_error,38,,2,2,850,TPESampler,COMPLETE
1248,0.4237210009873212,2025-04-24 22:21:22.947635,2025-04-24 22:21:30.899045,0 days 00:00:07.951410,True,squared_error,39,,1,2,998,TPESampler,COMPLETE
1249,0.4025585602924721,2025-04-24 22:21:23.702657,2025-04-24 22:21:29.082604,0 days 00:00:05.379947,True,squared_error,27,,2,2,990,TPESampler,COMPLETE
1250,0.40251897710039974,2025-04-24 22:21:27.039480,2025-04-24 22:21:31.826635,0 days 00:00:04.787155,True,squared_error,42,,2,2,836,TPESampler,COMPLETE
1251,1.3700006797439697,2025-04-24 22:21:29.273503,2025-04-24 22:21:31.461652,0 days 00:00:02.188149,True,absolute_error,16,sqrt,15,2,936,TPESampler,COMPLETE
1252,0.4026437010006071,2025-04-24 22:21:31.102081,2025-04-24 22:21:35.753233,0 days 00:00:04.651152,True,squared_error,31,,2,3,804,TPESampler,COMPLETE
1253,0.40245387511511854,2025-04-24 22:21:31.679255,2025-04-24 22:21:36.475557,0 days 00:00:04.796302,True,squared_error,28,,2,4,856,TPESampler,COMPLETE
1254,0.4021609178211452,2025-04-24 22:21:32.150557,2025-04-24 22:21:37.480782,0 days 00:00:05.330225,True,squared_error,35,,2,4,970,TPESampler,COMPLETE
1255,0.49218984184436854,2025-04-24 22:21:35.937112,2025-04-24 22:22:13.334507,0 days 00:00:37.397395,False,absolute_error,44,,3,3,644,TPESampler,COMPLETE
1256,0.47725301282265903,2025-04-24 22:21:36.840082,2025-04-24 22:21:55.690127,0 days 00:00:18.850045,True,absolute_error,26,,4,2,814,TPESampler,COMPLETE
1257,0.41632984885200436,2025-04-24 22:21:37.763168,2025-04-24 22:21:42.186851,0 days 00:00:04.423683,True,squared_error,29,,1,9,963,TPESampler,COMPLETE
1258,0.43951719788504806,2025-04-24 22:21:42.361811,2025-04-24 22:21:45.767401,0 days 00:00:03.405590,True,squared_error,30,,4,4,871,TPESampler,COMPLETE
1259,0.40300615938949413,2025-04-24 22:21:45.954949,2025-04-24 22:21:50.093423,0 days 00:00:04.138474,True,squared_error,25,,2,4,881,TPESampler,COMPLETE
1260,0.4396208845136054,2025-04-24 22:21:50.265440,2025-04-24 22:21:53.826508,0 days 00:00:03.561068,True,squared_error,34,,4,7,927,TPESampler,COMPLETE
1261,0.41195504660799825,2025-04-24 22:21:53.999974,2025-04-24 22:21:57.851513,0 days 00:00:03.851539,True,squared_error,33,,2,8,769,TPESampler,COMPLETE
1262,0.402704902593455,2025-04-24 22:21:55.878247,2025-04-24 22:22:00.702122,0 days 00:00:04.823875,True,squared_error,37,,2,5,972,TPESampler,COMPLETE
1263,1.12006894902088,2025-04-24 22:21:58.056682,2025-04-24 22:22:03.650897,0 days 00:00:05.594215,True,absolute_error,29,sqrt,3,6,994,TPESampler,COMPLETE
1264,0.40220186622695797,2025-04-24 22:22:00.902747,2025-04-24 22:22:05.999426,0 days 00:00:05.096679,True,squared_error,32,,2,4,972,TPESampler,COMPLETE
1265,0.41186343845797446,2025-04-24 22:22:03.847856,2025-04-24 22:22:07.891655,0 days 00:00:04.043799,True,squared_error,50,,1,8,679,TPESampler,COMPLETE
1266,0.812984408366211,2025-04-24 22:22:06.193342,2025-04-24 22:22:08.665811,0 days 00:00:02.472469,True,squared_error,29,log2,1,3,973,TPESampler,COMPLETE
1267,0.4029957177412139,2025-04-24 22:22:08.097873,2025-04-24 22:22:12.607354,0 days 00:00:04.509481,True,squared_error,40,,2,5,875,TPESampler,COMPLETE
1268,0.40264478812992216,2025-04-24 22:22:09.089055,2025-04-24 22:22:13.662029,0 days 00:00:04.572974,True,squared_error,35,,2,4,883,TPESampler,COMPLETE
1269,0.416605981148076,2025-04-24 22:22:12.787497,2025-04-24 22:22:18.764057,0 days 00:00:05.976560,True,squared_error,43,,1,3,825,TPESampler,COMPLETE
1270,0.4054002171624643,2025-04-24 22:22:13.728871,2025-04-24 22:22:18.595960,0 days 00:00:04.867089,True,squared_error,39,,2,6,972,TPESampler,COMPLETE
1271,0.41616767733343124,2025-04-24 22:22:13.963586,2025-04-24 22:22:18.565117,0 days 00:00:04.601531,True,squared_error,41,,3,4,947,TPESampler,COMPLETE
1272,1.3472599771205798,2025-04-24 22:22:18.727414,2025-04-24 22:22:21.210947,0 days 00:00:02.483533,False,absolute_error,19,sqrt,13,48,616,TPESampler,COMPLETE
1273,0.40265215974004337,2025-04-24 22:22:18.762723,2025-04-24 22:22:24.113745,0 days 00:00:05.351022,True,squared_error,43,,2,2,822,TPESampler,COMPLETE
1274,0.402320512372665,2025-04-24 22:22:18.975020,2025-04-24 22:22:24.970160,0 days 00:00:05.995140,True,squared_error,37,,2,3,997,TPESampler,COMPLETE
