number,value,datetime_start,datetime_complete,duration,params_bootstrap,params_criterion,params_max_depth,params_max_features,params_min_samples_leaf,params_min_samples_split,params_n_estimators,system_attrs_auto:sampler,state
2263,0.4029035915496061,2025-04-24 23:00:23.089152,2025-04-24 23:00:28.236981,0 days 00:00:05.147829,True,squared_error,26,,2,4,860,TPESampler,COMPLETE
2264,0.41613925492546433,2025-04-24 23:00:26.730266,2025-04-24 23:00:31.681727,0 days 00:00:04.951461,True,squared_error,27,,3,3,856,TPESampler,COMPLETE
2265,0.40271562377166137,2025-04-24 23:00:27.107142,2025-04-24 23:00:32.844201,0 days 00:00:05.737059,True,squared_error,31,,2,2,873,TPESampler,COMPLETE
2266,0.6442868193297004,2025-04-24 23:00:28.425479,2025-04-24 23:00:29.930692,0 days 00:00:01.505213,True,squared_error,6,,2,34,336,TPESampler,COMPLETE
2267,0.4022236332866672,2025-04-24 23:00:30.138320,2025-04-24 23:00:35.785731,0 days 00:00:05.647411,True,squared_error,33,,2,3,993,TPESampler,COMPLETE
2268,0.4054358908149653,2025-04-24 23:00:31.864546,2025-04-24 23:00:37.309138,0 days 00:00:05.444592,True,squared_error,30,,2,6,997,TPESampler,COMPLETE
2269,0.40229496321871033,2025-04-24 23:00:33.029620,2025-04-24 23:00:38.475053,0 days 00:00:05.445433,True,squared_error,43,,2,2,992,TPESampler,COMPLETE
2270,0.42198558045941387,2025-04-24 23:00:35.972405,2025-04-24 23:00:42.235206,0 days 00:00:06.262801,True,squared_error,37,,1,2,799,TPESampler,COMPLETE
2271,0.4038943387055016,2025-04-24 23:00:37.491881,2025-04-24 23:00:41.347029,0 days 00:00:03.855148,True,squared_error,43,,2,2,659,TPESampler,COMPLETE
2272,0.4165119353507597,2025-04-24 23:00:38.659901,2025-04-24 23:00:43.915665,0 days 00:00:05.255764,True,squared_error,31,,3,4,997,TPESampler,COMPLETE
2273,0.4022936022957746,2025-04-24 23:00:41.550568,2025-04-24 23:00:47.325446,0 days 00:00:05.774878,True,squared_error,35,,2,3,1000,TPESampler,COMPLETE
2274,0.41639038991305977,2025-04-24 23:00:42.574679,2025-04-24 23:00:47.346037,0 days 00:00:04.771358,True,squared_error,40,,3,4,981,TPESampler,COMPLETE
2275,0.4246133656469857,2025-04-24 23:00:44.101311,2025-04-24 23:00:51.338421,0 days 00:00:07.237110,True,squared_error,32,,1,2,997,TPESampler,COMPLETE
2276,0.4181424079431889,2025-04-24 23:00:47.482353,2025-04-24 23:00:54.758841,0 days 00:00:07.276488,True,squared_error,49,,1,3,999,TPESampler,COMPLETE
2277,0.4023259613133283,2025-04-24 23:00:47.523934,2025-04-24 23:00:53.304918,0 days 00:00:05.780984,True,squared_error,42,,2,2,999,TPESampler,COMPLETE
2278,0.42092901787665854,2025-04-24 23:00:51.530467,2025-04-24 23:00:58.123613,0 days 00:00:06.593146,True,squared_error,26,,1,3,985,TPESampler,COMPLETE
2279,0.40249709918333465,2025-04-24 23:00:53.502671,2025-04-24 23:00:58.249286,0 days 00:00:04.746615,True,squared_error,34,,2,2,866,TPESampler,COMPLETE
2280,0.40666031676864545,2025-04-24 23:00:54.949120,2025-04-24 23:01:01.013443,0 days 00:00:06.064323,True,squared_error,37,,1,6,996,TPESampler,COMPLETE
2281,0.42188983795014645,2025-04-24 23:00:58.301871,2025-04-24 23:01:02.378099,0 days 00:00:04.076228,True,squared_error,42,,3,8,729,TPESampler,COMPLETE
2282,0.40238063126610984,2025-04-24 23:00:58.520390,2025-04-24 23:01:04.550075,0 days 00:00:06.029685,True,squared_error,31,,2,4,998,TPESampler,COMPLETE
2283,0.4026931732806265,2025-04-24 23:01:01.202686,2025-04-24 23:01:06.986094,0 days 00:00:05.783408,True,squared_error,37,,2,5,986,TPESampler,COMPLETE
2284,0.40915993189448796,2025-04-24 23:01:02.566730,2025-04-24 23:01:07.705411,0 days 00:00:05.138681,True,squared_error,43,,1,7,841,TPESampler,COMPLETE
2285,0.579738684055672,2025-04-24 23:01:04.741081,2025-04-24 23:01:09.100419,0 days 00:00:04.359338,True,squared_error,44,,8,2,946,TPESampler,COMPLETE
2286,0.41654865514404654,2025-04-24 23:01:07.186047,2025-04-24 23:01:12.438722,0 days 00:00:05.252675,True,squared_error,23,,3,3,999,TPESampler,COMPLETE
2287,0.4396435220553189,2025-04-24 23:01:08.145993,2025-04-24 23:01:12.162189,0 days 00:00:04.016196,True,squared_error,39,,4,2,823,TPESampler,COMPLETE
2288,0.402320512372665,2025-04-24 23:01:09.305311,2025-04-24 23:01:15.124725,0 days 00:00:05.819414,True,squared_error,37,,2,2,997,TPESampler,COMPLETE
2289,0.41614234590718224,2025-04-24 23:01:12.361611,2025-04-24 23:01:17.500040,0 days 00:00:05.138429,True,squared_error,23,,3,3,852,TPESampler,COMPLETE
2290,1.2301365543487968,2025-04-24 23:01:12.735302,2025-04-24 23:01:15.064578,0 days 00:00:02.329276,True,squared_error,33,log2,2,4,995,TPESampler,COMPLETE
2291,1.3450307803459256,2025-04-24 23:01:15.225708,2025-04-24 23:01:16.803777,0 days 00:00:01.578069,False,absolute_error,43,sqrt,12,35,122,TPESampler,COMPLETE
2292,0.4022333352922416,2025-04-24 23:01:15.354790,2025-04-24 23:01:21.814454,0 days 00:00:06.459664,True,squared_error,39,,2,4,990,TPESampler,COMPLETE
2293,0.4397679739479614,2025-04-24 23:01:16.996738,2025-04-24 23:01:20.642176,0 days 00:00:03.645438,True,squared_error,29,,4,6,735,TPESampler,COMPLETE
2294,0.4026159173557522,2025-04-24 23:01:17.914674,2025-04-24 23:01:23.220326,0 days 00:00:05.305652,True,squared_error,30,,2,2,851,TPESampler,COMPLETE
2295,0.40549663704643957,2025-04-24 23:01:20.836294,2025-04-24 23:01:26.184927,0 days 00:00:05.348633,True,squared_error,33,,2,6,857,TPESampler,COMPLETE
2296,1.3168671688941935,2025-04-24 23:01:22.015075,2025-04-24 23:01:23.270601,0 days 00:00:01.255526,False,squared_error,6,log2,7,5,720,TPESampler,COMPLETE
2297,0.40231189923759736,2025-04-24 23:01:23.382610,2025-04-24 23:01:29.148646,0 days 00:00:05.766036,True,squared_error,32,,2,3,997,TPESampler,COMPLETE
2298,0.4026234296805454,2025-04-24 23:01:23.426326,2025-04-24 23:01:28.736510,0 days 00:00:05.310184,True,squared_error,44,,2,3,902,TPESampler,COMPLETE
2299,0.4022384775259526,2025-04-24 23:01:26.374444,2025-04-24 23:01:31.837815,0 days 00:00:05.463371,True,squared_error,28,,2,2,978,TPESampler,COMPLETE
2300,0.4046361858687609,2025-04-24 23:01:28.926970,2025-04-24 23:01:34.305911,0 days 00:00:05.378941,True,squared_error,17,,2,4,945,TPESampler,COMPLETE
2301,0.43962407689020166,2025-04-24 23:01:29.389848,2025-04-24 23:01:33.618530,0 days 00:00:04.228682,True,squared_error,31,,4,3,841,TPESampler,COMPLETE
2302,1.227098475631921,2025-04-24 23:01:32.026619,2025-04-24 23:01:35.105863,0 days 00:00:03.079244,True,absolute_error,6,sqrt,2,4,531,TPESampler,COMPLETE
2303,0.46327888368660036,2025-04-24 23:01:33.804542,2025-04-24 23:01:44.510634,0 days 00:00:10.706092,False,absolute_error,17,,2,2,135,TPESampler,COMPLETE
2304,0.4026359831458069,2025-04-24 23:01:34.560236,2025-04-24 23:01:39.186275,0 days 00:00:04.626039,True,squared_error,41,,2,4,872,TPESampler,COMPLETE
2305,0.41931131684697703,2025-04-24 23:01:35.482994,2025-04-24 23:01:41.508793,0 days 00:00:06.025799,True,squared_error,33,,1,3,990,TPESampler,COMPLETE
2306,0.9435869393447062,2025-04-24 23:01:39.368110,2025-04-24 23:01:57.529501,0 days 00:00:18.161391,False,absolute_error,26,sqrt,1,46,858,TPESampler,COMPLETE
2307,0.4025982041194393,2025-04-24 23:01:41.692488,2025-04-24 23:01:46.181966,0 days 00:00:04.489478,True,squared_error,34,,2,2,858,TPESampler,COMPLETE
2308,0.43963272492679945,2025-04-24 23:01:44.702430,2025-04-24 23:01:48.453513,0 days 00:00:03.751083,True,squared_error,49,,4,2,838,TPESampler,COMPLETE
2309,0.4233115160982843,2025-04-24 23:01:46.373131,2025-04-24 23:01:51.010230,0 days 00:00:04.637099,True,squared_error,23,,1,2,668,TPESampler,COMPLETE
2310,0.40228191646322264,2025-04-24 23:01:48.637715,2025-04-24 23:01:53.786059,0 days 00:00:05.148344,True,squared_error,28,,2,2,1000,TPESampler,COMPLETE
2311,0.4394901664335175,2025-04-24 23:01:51.196614,2025-04-24 23:01:55.114859,0 days 00:00:03.918245,True,squared_error,36,,4,4,858,TPESampler,COMPLETE
2312,0.41649074544032433,2025-04-24 23:01:53.974176,2025-04-24 23:01:59.408311,0 days 00:00:05.434135,True,squared_error,35,,3,2,991,TPESampler,COMPLETE
2313,0.6795522184077268,2025-04-24 23:01:55.304748,2025-04-24 23:01:57.636968,0 days 00:00:02.332220,True,squared_error,30,,5,41,622,TPESampler,COMPLETE
2314,0.4054654259739755,2025-04-24 23:01:57.703954,2025-04-24 23:02:03.237381,0 days 00:00:05.533427,True,squared_error,33,,2,6,993,TPESampler,COMPLETE
2315,0.4105369024001727,2025-04-24 23:01:57.829190,2025-04-24 23:02:03.273066,0 days 00:00:05.443876,True,squared_error,23,,1,4,813,TPESampler,COMPLETE
2316,0.4160245114743443,2025-04-24 23:01:59.597222,2025-04-24 23:02:03.917357,0 days 00:00:04.320135,True,squared_error,44,,3,2,877,TPESampler,COMPLETE
2317,0.4070992431719832,2025-04-24 23:02:03.387336,2025-04-24 23:02:09.218875,0 days 00:00:05.831539,True,squared_error,39,,1,4,834,TPESampler,COMPLETE
2318,1.091172140579803,2025-04-24 23:02:03.430191,2025-04-24 23:02:13.157760,0 days 00:00:09.727569,False,absolute_error,19,log2,1,5,714,TPESampler,COMPLETE
2319,0.40364312599399044,2025-04-24 23:02:04.162057,2025-04-24 23:02:08.016292,0 days 00:00:03.854235,True,squared_error,32,,2,3,694,TPESampler,COMPLETE
2320,0.42389063699765445,2025-04-24 23:02:08.197779,2025-04-24 23:02:14.752696,0 days 00:00:06.554917,True,squared_error,39,,1,2,853,TPESampler,COMPLETE
2321,0.5020114972299294,2025-04-24 23:02:09.436237,2025-04-24 23:02:11.331225,0 days 00:00:01.894988,True,squared_error,40,,1,21,355,TPESampler,COMPLETE
2322,0.4163962738985066,2025-04-24 23:02:11.541276,2025-04-24 23:02:16.600867,0 days 00:00:05.059591,True,squared_error,43,,3,3,975,TPESampler,COMPLETE
2323,0.40281325255401706,2025-04-24 23:02:13.356753,2025-04-24 23:02:18.496273,0 days 00:00:05.139520,True,squared_error,27,,2,2,865,TPESampler,COMPLETE
2324,0.42414222928508954,2025-04-24 23:02:14.942676,2025-04-24 23:02:21.616641,0 days 00:00:06.673965,True,squared_error,32,,1,2,875,TPESampler,COMPLETE
2325,0.8564393645887247,2025-04-24 23:02:16.789616,2025-04-24 23:02:17.682753,0 days 00:00:00.893137,True,squared_error,39,sqrt,2,2,153,TPESampler,COMPLETE
2326,0.40253679597275294,2025-04-24 23:02:17.870517,2025-04-24 23:02:23.055821,0 days 00:00:05.185304,True,squared_error,32,,2,4,865,TPESampler,COMPLETE
2327,0.43967422053529476,2025-04-24 23:02:18.852374,2025-04-24 23:02:23.462949,0 days 00:00:04.610575,True,squared_error,26,,4,4,992,TPESampler,COMPLETE
2328,0.41651478322053054,2025-04-24 23:02:21.809289,2025-04-24 23:02:27.045688,0 days 00:00:05.236399,True,squared_error,24,,3,2,998,TPESampler,COMPLETE
2329,0.4022324925345733,2025-04-24 23:02:23.247630,2025-04-24 23:02:28.831522,0 days 00:00:05.583892,True,squared_error,45,,2,3,989,TPESampler,COMPLETE
2330,0.9953402273681565,2025-04-24 23:02:23.695100,2025-04-24 23:02:31.958127,0 days 00:00:08.263027,True,absolute_error,37,sqrt,2,4,932,TPESampler,COMPLETE
2331,0.42515013893168896,2025-04-24 23:02:27.234975,2025-04-24 23:02:34.563714,0 days 00:00:07.328739,True,squared_error,42,,1,2,988,TPESampler,COMPLETE
2332,0.4099200917704549,2025-04-24 23:02:29.017288,2025-04-24 23:02:35.209069,0 days 00:00:06.191781,True,squared_error,26,,1,4,1000,TPESampler,COMPLETE
2333,0.402497475706624,2025-04-24 23:02:32.149104,2025-04-24 23:02:37.256200,0 days 00:00:05.107096,True,squared_error,40,,2,4,866,TPESampler,COMPLETE
2334,0.4165170038975512,2025-04-24 23:02:34.753796,2025-04-24 23:02:40.326954,0 days 00:00:05.573158,True,squared_error,35,,3,4,1000,TPESampler,COMPLETE
2335,1.368547974783366,2025-04-24 23:02:35.475258,2025-04-24 23:02:37.179840,0 days 00:00:01.704582,True,absolute_error,40,log2,4,6,472,TPESampler,COMPLETE
2336,0.4289265958073851,2025-04-24 23:02:37.344088,2025-04-24 23:02:41.042026,0 days 00:00:03.697938,False,squared_error,24,,3,6,429,TPESampler,COMPLETE
2337,1.380976902617578,2025-04-24 23:02:37.474011,2025-04-24 23:02:39.923174,0 days 00:00:02.449163,True,absolute_error,35,log2,5,11,889,TPESampler,COMPLETE
2338,0.4266268307636946,2025-04-24 23:02:40.111750,2025-04-24 23:03:08.922133,0 days 00:00:28.810383,True,absolute_error,26,,3,2,935,TPESampler,COMPLETE
2339,0.40248494252339606,2025-04-24 23:02:40.566828,2025-04-24 23:02:45.792154,0 days 00:00:05.225326,True,squared_error,35,,2,3,829,TPESampler,COMPLETE
2340,1.2642386933805356,2025-04-24 23:02:41.275638,2025-04-24 23:02:42.447915,0 days 00:00:01.172277,False,squared_error,21,sqrt,13,2,416,TPESampler,COMPLETE
2341,0.8585637707793881,2025-04-24 23:02:42.635367,2025-04-24 23:02:44.897254,0 days 00:00:02.261887,True,squared_error,28,sqrt,2,2,877,TPESampler,COMPLETE
2342,0.40261750640808514,2025-04-24 23:02:45.094493,2025-04-24 23:02:50.204252,0 days 00:00:05.109759,True,squared_error,26,,2,2,1000,TPESampler,COMPLETE
2343,0.40253100911949263,2025-04-24 23:02:46.155136,2025-04-24 23:02:50.203281,0 days 00:00:04.048145,True,squared_error,39,,2,2,813,TPESampler,COMPLETE
2344,0.41589421606157206,2025-04-24 23:02:50.406845,2025-04-24 23:02:55.063072,0 days 00:00:04.656227,True,squared_error,33,,3,6,831,TPESampler,COMPLETE
2345,0.9726246916392124,2025-04-24 23:02:50.453469,2025-04-24 23:02:53.023417,0 days 00:00:02.569948,True,squared_error,35,sqrt,3,3,993,TPESampler,COMPLETE
2346,0.4040902002441907,2025-04-24 23:02:53.218871,2025-04-24 23:02:57.061833,0 days 00:00:03.842962,True,squared_error,22,,2,4,679,TPESampler,COMPLETE
2347,0.41602092938151025,2025-04-24 23:02:55.251288,2025-04-24 23:02:59.521269,0 days 00:00:04.269981,True,squared_error,34,,3,2,846,TPESampler,COMPLETE
2348,1.0174585855857117,2025-04-24 23:02:57.250182,2025-04-24 23:02:58.812011,0 days 00:00:01.561829,False,squared_error,15,log2,1,2,685,TPESampler,COMPLETE
2349,0.4023173743517606,2025-04-24 23:02:59.003974,2025-04-24 23:03:04.365451,0 days 00:00:05.361477,True,squared_error,32,,2,3,999,TPESampler,COMPLETE
2350,0.4022822657456002,2025-04-24 23:02:59.962951,2025-04-24 23:03:04.616758,0 days 00:00:04.653807,True,squared_error,29,,2,2,999,TPESampler,COMPLETE
2351,0.4084800047400745,2025-04-24 23:03:04.557999,2025-04-24 23:03:11.059713,0 days 00:00:06.501714,True,squared_error,33,,1,4,998,TPESampler,COMPLETE
2352,0.8336845058489214,2025-04-24 23:03:04.920182,2025-04-24 23:03:06.285167,0 days 00:00:01.364985,True,squared_error,17,sqrt,1,11,294,TPESampler,COMPLETE
2353,0.40228293825053507,2025-04-24 23:03:06.476994,2025-04-24 23:03:11.861548,0 days 00:00:05.384554,True,squared_error,34,,2,2,994,TPESampler,COMPLETE
2354,0.40237662031300964,2025-04-24 23:03:09.109086,2025-04-24 23:03:14.105423,0 days 00:00:04.996337,True,squared_error,39,,2,3,849,TPESampler,COMPLETE
2355,0.40269576763565085,2025-04-24 23:03:11.247246,2025-04-24 23:03:16.390578,0 days 00:00:05.143332,True,squared_error,22,,2,4,899,TPESampler,COMPLETE
2356,0.4027169815257213,2025-04-24 23:03:12.257563,2025-04-24 23:03:17.078703,0 days 00:00:04.821140,True,squared_error,39,,2,2,874,TPESampler,COMPLETE
2357,0.4117792294914919,2025-04-24 23:03:14.320887,2025-04-24 23:03:19.033297,0 days 00:00:04.712410,True,squared_error,40,,2,8,821,TPESampler,COMPLETE
2358,1.3090139531656533,2025-04-24 23:03:16.585895,2025-04-24 23:03:20.805350,0 days 00:00:04.219455,True,absolute_error,38,log2,2,2,869,TPESampler,COMPLETE
2359,0.4021761942590767,2025-04-24 23:03:17.524272,2025-04-24 23:03:23.550306,0 days 00:00:06.026034,True,squared_error,43,,2,3,979,TPESampler,COMPLETE
2360,1.3571173818981754,2025-04-24 23:03:19.222049,2025-04-24 23:03:22.249627,0 days 00:00:03.027578,True,absolute_error,23,log2,3,7,853,TPESampler,COMPLETE
2361,0.40250132943925315,2025-04-24 23:03:21.008631,2025-04-24 23:03:25.857609,0 days 00:00:04.848978,True,squared_error,37,,2,4,828,TPESampler,COMPLETE
2362,1.1254708555731987,2025-04-24 23:03:22.434822,2025-04-24 23:03:28.689899,0 days 00:00:06.255077,False,absolute_error,11,sqrt,2,13,572,TPESampler,COMPLETE
2363,0.4030290764950002,2025-04-24 23:03:23.739098,2025-04-24 23:03:28.578253,0 days 00:00:04.839155,True,squared_error,26,,2,4,918,TPESampler,COMPLETE
2364,0.43975178259853526,2025-04-24 23:03:26.050841,2025-04-24 23:03:30.824601,0 days 00:00:04.773760,True,squared_error,37,,4,2,974,TPESampler,COMPLETE
2365,0.40268166255088256,2025-04-24 23:03:28.752353,2025-04-24 23:03:33.846181,0 days 00:00:05.093828,True,squared_error,30,,2,3,833,TPESampler,COMPLETE
2366,0.4238164231076812,2025-04-24 23:03:28.897467,2025-04-24 23:03:36.590111,0 days 00:00:07.692644,True,squared_error,38,,1,2,989,TPESampler,COMPLETE
2367,0.40220373140675525,2025-04-24 23:03:31.013274,2025-04-24 23:03:36.204126,0 days 00:00:05.190852,True,squared_error,47,,2,2,980,TPESampler,COMPLETE
2368,0.7350181281941809,2025-04-24 23:03:34.253063,2025-04-24 23:03:36.452027,0 days 00:00:02.198964,True,squared_error,38,log2,1,4,817,TPESampler,COMPLETE
2369,0.40270071919145006,2025-04-24 23:03:36.409115,2025-04-24 23:03:42.068336,0 days 00:00:05.659221,True,squared_error,23,,2,3,996,TPESampler,COMPLETE
2370,0.4064389163117109,2025-04-24 23:03:36.734749,2025-04-24 23:03:42.814069,0 days 00:00:06.079320,True,squared_error,41,,1,4,876,TPESampler,COMPLETE
2371,0.402365906620394,2025-04-24 23:03:36.994967,2025-04-24 23:03:42.496316,0 days 00:00:05.501349,True,squared_error,32,,2,2,998,TPESampler,COMPLETE
2372,0.4023682948532668,2025-04-24 23:03:42.263749,2025-04-24 23:03:47.439596,0 days 00:00:05.175847,True,squared_error,33,,2,3,854,TPESampler,COMPLETE
2373,0.4242838391730474,2025-04-24 23:03:42.866482,2025-04-24 23:04:53.222623,0 days 00:01:10.356141,True,absolute_error,35,,1,3,999,TPESampler,COMPLETE
2374,0.40283164100280094,2025-04-24 23:03:43.321188,2025-04-24 23:03:48.812709,0 days 00:00:05.491521,True,squared_error,40,,2,5,995,TPESampler,COMPLETE
2375,0.4023745103445129,2025-04-24 23:03:47.619093,2025-04-24 23:03:52.665872,0 days 00:00:05.046779,True,squared_error,41,,2,3,998,TPESampler,COMPLETE
2376,0.40259164822194715,2025-04-24 23:03:49.225500,2025-04-24 23:03:53.842356,0 days 00:00:04.616856,True,squared_error,39,,2,2,879,TPESampler,COMPLETE
2377,0.4165119353507597,2025-04-24 23:03:52.863868,2025-04-24 23:03:57.520513,0 days 00:00:04.656645,True,squared_error,35,,3,4,997,TPESampler,COMPLETE
2378,0.40229496321871033,2025-04-24 23:03:54.036057,2025-04-24 23:03:59.168851,0 days 00:00:05.132794,True,squared_error,37,,2,2,992,TPESampler,COMPLETE
2379,0.40267833591262486,2025-04-24 23:03:57.709548,2025-04-24 23:04:02.351322,0 days 00:00:04.641774,True,squared_error,28,,2,2,882,TPESampler,COMPLETE
2380,0.4396707930327006,2025-04-24 23:03:59.359748,2025-04-24 23:04:02.863134,0 days 00:00:03.503386,True,squared_error,28,,4,3,825,TPESampler,COMPLETE
2381,0.42401512783829187,2025-04-24 23:04:02.544190,2025-04-24 23:04:09.533065,0 days 00:00:06.988875,True,squared_error,28,,1,2,1000,TPESampler,COMPLETE
2382,0.402799804951234,2025-04-24 23:04:03.087386,2025-04-24 23:04:07.875515,0 days 00:00:04.788129,True,squared_error,31,,2,5,994,TPESampler,COMPLETE
2383,0.40506193386493927,2025-04-24 23:04:08.056436,2025-04-24 23:04:13.611750,0 days 00:00:05.555314,True,squared_error,31,,1,5,991,TPESampler,COMPLETE
2384,0.4028695419165801,2025-04-24 23:04:09.721920,2025-04-24 23:04:16.757898,0 days 00:00:07.035978,False,squared_error,41,,2,2,993,TPESampler,COMPLETE
2385,0.8465768176719437,2025-04-24 23:04:13.797037,2025-04-24 23:04:15.647717,0 days 00:00:01.850680,True,squared_error,37,sqrt,2,2,827,TPESampler,COMPLETE
2386,0.4042385442884295,2025-04-24 23:04:15.834650,2025-04-24 23:04:20.077719,0 days 00:00:04.243069,True,squared_error,18,,2,2,807,TPESampler,COMPLETE
2387,0.4160038789901904,2025-04-24 23:04:16.948216,2025-04-24 23:04:21.190539,0 days 00:00:04.242323,True,squared_error,43,,3,4,868,TPESampler,COMPLETE
2388,0.49218964495718864,2025-04-24 23:04:20.264828,2025-04-24 23:05:08.226913,0 days 00:00:47.962085,False,absolute_error,34,,3,2,828,TPESampler,COMPLETE
2389,1.2283313412128993,2025-04-24 23:04:21.375545,2025-04-24 23:04:23.061863,0 days 00:00:01.686318,True,squared_error,32,log2,2,2,965,TPESampler,COMPLETE
2390,0.7123393541101132,2025-04-24 23:04:23.244491,2025-04-24 23:04:25.890523,0 days 00:00:02.646032,False,squared_error,9,,1,25,596,TPESampler,COMPLETE
2391,0.4732865226709505,2025-04-24 23:04:26.076985,2025-04-24 23:04:30.781138,0 days 00:00:04.704153,False,squared_error,50,,1,3,545,TPESampler,COMPLETE
2392,0.410766197611762,2025-04-24 23:04:30.968098,2025-04-24 23:04:35.686125,0 days 00:00:04.718027,True,squared_error,25,,1,7,996,TPESampler,COMPLETE
2393,0.40247494165605235,2025-04-24 23:04:35.875331,2025-04-24 23:04:40.493257,0 days 00:00:04.617926,True,squared_error,30,,2,2,999,TPESampler,COMPLETE
2394,0.40242976261666225,2025-04-24 23:04:40.676596,2025-04-24 23:04:44.667149,0 days 00:00:03.990553,True,squared_error,45,,2,2,846,TPESampler,COMPLETE
2395,0.4238638754374682,2025-04-24 23:04:44.852134,2025-04-24 23:04:51.125280,0 days 00:00:06.273146,True,squared_error,39,,1,2,1000,TPESampler,COMPLETE
2396,1.3495039391138886,2025-04-24 23:04:51.309408,2025-04-24 23:04:52.913850,0 days 00:00:01.604442,True,absolute_error,26,sqrt,9,5,637,TPESampler,COMPLETE
2397,1.4008568246832047,2025-04-24 23:04:53.103279,2025-04-24 23:04:54.252394,0 days 00:00:01.149115,True,absolute_error,14,log2,13,13,286,TPESampler,COMPLETE
2398,0.41649074544032433,2025-04-24 23:04:53.480154,2025-04-24 23:04:58.449882,0 days 00:00:04.969728,True,squared_error,47,,3,2,991,TPESampler,COMPLETE
2399,0.4907726626543945,2025-04-24 23:04:54.661621,2025-04-24 23:04:56.386195,0 days 00:00:01.724574,False,squared_error,8,,4,23,325,TPESampler,COMPLETE
2400,0.40216292785949864,2025-04-24 23:04:56.581840,2025-04-24 23:05:01.576269,0 days 00:00:04.994429,True,squared_error,38,,2,4,976,TPESampler,COMPLETE
2401,0.4024487769291716,2025-04-24 23:04:58.639700,2025-04-24 23:05:03.106231,0 days 00:00:04.466531,True,squared_error,32,,2,3,847,TPESampler,COMPLETE
2402,0.4025409613161658,2025-04-24 23:05:01.766004,2025-04-24 23:05:06.179400,0 days 00:00:04.413396,True,squared_error,30,,2,4,850,TPESampler,COMPLETE
2403,0.4037080178491935,2025-04-24 23:05:03.294447,2025-04-24 23:05:06.819019,0 days 00:00:03.524572,True,squared_error,31,,2,2,670,TPESampler,COMPLETE
2404,0.40544940439525745,2025-04-24 23:05:06.371239,2025-04-24 23:05:12.382559,0 days 00:00:06.011320,True,squared_error,33,,1,5,834,TPESampler,COMPLETE
