number,value,datetime_start,datetime_complete,duration,params_bootstrap,params_criterion,params_max_depth,params_max_features,params_min_samples_leaf,params_min_samples_split,params_n_estimators,system_attrs_auto:sampler,state
993,0.6123887988576973,2025-04-24 22:11:38.535616,2025-04-24 22:12:01.058158,0 days 00:00:22.522542,False,absolute_error,39,,1,24,188,TPESampler,COMPLETE
994,1.2319639176517694,2025-04-24 22:11:41.650975,2025-04-24 22:11:43.547822,0 days 00:00:01.896847,True,squared_error,38,log2,2,7,975,TPESampler,COMPLETE
995,0.4258095534138486,2025-04-24 22:11:41.989858,2025-04-24 22:12:02.191929,0 days 00:00:20.202071,True,absolute_error,47,,1,2,271,TPESampler,COMPLETE
996,0.5830421652226867,2025-04-24 22:11:43.723449,2025-04-24 22:11:45.815660,0 days 00:00:02.092211,True,squared_error,17,,8,8,565,TPESampler,COMPLETE
997,0.4026931732806265,2025-04-24 22:11:46.002325,2025-04-24 22:11:50.455986,0 days 00:00:04.453661,True,squared_error,41,,2,5,986,TPESampler,COMPLETE
998,0.40326085736930517,2025-04-24 22:11:50.630046,2025-04-24 22:11:54.661301,0 days 00:00:04.031255,True,squared_error,20,,2,2,858,TPESampler,COMPLETE
999,0.4024818209716682,2025-04-24 22:11:54.981010,2025-04-24 22:11:58.988603,0 days 00:00:04.007593,True,squared_error,39,,2,2,851,TPESampler,COMPLETE
1000,0.8498366269733111,2025-04-24 22:11:59.169122,2025-04-24 22:12:01.005124,0 days 00:00:01.836002,True,squared_error,38,sqrt,2,2,905,TPESampler,COMPLETE
1001,0.4165132721545429,2025-04-24 22:12:01.149936,2025-04-24 22:12:06.370780,0 days 00:00:05.220844,True,squared_error,37,,3,2,998,TPESampler,COMPLETE
1002,1.1117403775246664,2025-04-24 22:12:01.266009,2025-04-24 22:12:02.479251,0 days 00:00:01.213242,False,squared_error,14,sqrt,5,25,172,TPESampler,COMPLETE
1003,0.402247792404315,2025-04-24 22:12:02.432040,2025-04-24 22:12:07.783539,0 days 00:00:05.351499,True,squared_error,33,,2,2,982,TPESampler,COMPLETE
1004,1.2680292963551991,2025-04-24 22:12:02.728514,2025-04-24 22:12:07.648612,0 days 00:00:04.920098,False,absolute_error,5,sqrt,3,3,784,TPESampler,COMPLETE
1005,1.2456891602499702,2025-04-24 22:12:06.563502,2025-04-24 22:12:07.629119,0 days 00:00:01.065617,True,squared_error,50,log2,2,40,358,TPESampler,COMPLETE
1006,0.4289203096480677,2025-04-24 22:12:07.747491,2025-04-24 22:12:13.723753,0 days 00:00:05.976262,False,squared_error,34,,3,5,943,TPESampler,COMPLETE
1007,0.4159352199751578,2025-04-24 22:12:07.781970,2025-04-24 22:12:12.211947,0 days 00:00:04.429977,True,squared_error,37,,3,4,829,TPESampler,COMPLETE
1008,0.6828679126371301,2025-04-24 22:12:08.063276,2025-04-24 22:12:58.560718,0 days 00:00:50.497442,True,absolute_error,17,,1,38,805,TPESampler,COMPLETE
1009,0.40354687526054245,2025-04-24 22:12:12.398820,2025-04-24 22:12:15.577420,0 days 00:00:03.178600,True,squared_error,26,,2,2,563,TPESampler,COMPLETE
1010,0.40247486633039964,2025-04-24 22:12:13.907594,2025-04-24 22:12:18.308657,0 days 00:00:04.401063,True,squared_error,41,,2,3,796,TPESampler,COMPLETE
1011,0.8878040422693613,2025-04-24 22:12:15.756400,2025-04-24 22:12:17.680021,0 days 00:00:01.923621,True,squared_error,22,sqrt,2,8,926,TPESampler,COMPLETE
1012,0.4165132721545429,2025-04-24 22:12:17.870134,2025-04-24 22:12:22.451610,0 days 00:00:04.581476,True,squared_error,44,,3,4,998,TPESampler,COMPLETE
1013,0.4023745103445129,2025-04-24 22:12:18.730931,2025-04-24 22:12:23.900736,0 days 00:00:05.169805,True,squared_error,45,,2,3,998,TPESampler,COMPLETE
1014,1.1577971237277331,2025-04-24 22:12:22.655972,2025-04-24 22:12:24.124002,0 days 00:00:01.468030,False,squared_error,20,log2,2,6,966,TPESampler,COMPLETE
1015,0.41712186477426993,2025-04-24 22:12:24.086920,2025-04-24 22:12:29.716857,0 days 00:00:05.629937,True,squared_error,41,,1,3,854,TPESampler,COMPLETE
1016,0.4194209347441199,2025-04-24 22:12:24.356759,2025-04-24 22:12:28.184675,0 days 00:00:03.827916,True,squared_error,37,,1,10,746,TPESampler,COMPLETE
1017,0.4021761942590767,2025-04-24 22:12:28.366249,2025-04-24 22:12:33.379017,0 days 00:00:05.012768,True,squared_error,38,,2,2,979,TPESampler,COMPLETE
1018,0.4026499864781384,2025-04-24 22:12:29.900369,2025-04-24 22:12:34.897986,0 days 00:00:04.997617,True,squared_error,26,,2,3,999,TPESampler,COMPLETE
1019,0.40259075454077287,2025-04-24 22:12:33.563046,2025-04-24 22:12:37.819495,0 days 00:00:04.256449,True,squared_error,31,,2,2,790,TPESampler,COMPLETE
1020,0.6949504389735044,2025-04-24 22:12:35.083962,2025-04-24 22:12:37.935962,0 days 00:00:02.852000,True,squared_error,36,,13,25,869,TPESampler,COMPLETE
1021,0.4022264489985849,2025-04-24 22:12:37.992405,2025-04-24 22:12:42.684523,0 days 00:00:04.692118,True,squared_error,31,,2,2,988,TPESampler,COMPLETE
1022,0.5737146603116428,2025-04-24 22:12:38.157310,2025-04-24 22:12:43.794443,0 days 00:00:05.637133,False,absolute_error,13,,6,8,146,TPESampler,COMPLETE
1023,0.4032801017164567,2025-04-24 22:12:42.864232,2025-04-24 22:13:16.490237,0 days 00:00:33.626005,True,absolute_error,35,,2,3,760,TPESampler,COMPLETE
1024,1.3403110499803244,2025-04-24 22:12:43.984497,2025-04-24 22:12:46.121121,0 days 00:00:02.136624,False,absolute_error,45,sqrt,12,40,746,TPESampler,COMPLETE
1025,0.40223200932255093,2025-04-24 22:12:46.320264,2025-04-24 22:12:51.026458,0 days 00:00:04.706194,True,squared_error,32,,2,2,993,TPESampler,COMPLETE
1026,0.4226926136781984,2025-04-24 22:12:51.243683,2025-04-24 22:12:56.864423,0 days 00:00:05.620740,True,squared_error,44,,1,2,857,TPESampler,COMPLETE
1027,0.40229496321871033,2025-04-24 22:12:57.050554,2025-04-24 22:13:02.636812,0 days 00:00:05.586258,True,squared_error,38,,2,2,992,TPESampler,COMPLETE
1028,1.2222356156333078,2025-04-24 22:12:58.737531,2025-04-24 22:13:00.437418,0 days 00:00:01.699887,True,squared_error,30,sqrt,7,2,878,TPESampler,COMPLETE
1029,0.4022936022957746,2025-04-24 22:13:00.623825,2025-04-24 22:13:06.221323,0 days 00:00:05.597498,True,squared_error,41,,2,2,1000,TPESampler,COMPLETE
1030,1.3491851502428585,2025-04-24 22:13:02.820770,2025-04-24 22:13:04.427472,0 days 00:00:01.606702,True,squared_error,44,log2,15,14,882,TPESampler,COMPLETE
1031,1.2308357013648767,2025-04-24 22:13:04.615737,2025-04-24 22:13:06.222319,0 days 00:00:01.606582,True,squared_error,32,log2,2,3,786,TPESampler,COMPLETE
1032,0.5412433084408732,2025-04-24 22:13:06.375776,2025-04-24 22:13:08.541156,0 days 00:00:02.165380,False,squared_error,6,,11,8,391,TPESampler,COMPLETE
1033,0.41642911018344403,2025-04-24 22:13:06.420270,2025-04-24 22:13:11.730191,0 days 00:00:05.309921,True,squared_error,38,,3,2,990,TPESampler,COMPLETE
1034,1.0897331460876731,2025-04-24 22:13:08.725753,2025-04-24 22:13:10.628623,0 days 00:00:01.902870,True,squared_error,8,sqrt,3,2,965,TPESampler,COMPLETE
1035,0.40258873957308916,2025-04-24 22:13:10.821265,2025-04-24 22:13:15.098895,0 days 00:00:04.277630,True,squared_error,49,,2,2,800,TPESampler,COMPLETE
1036,0.42496884215644354,2025-04-24 22:13:11.912697,2025-04-24 22:13:18.904212,0 days 00:00:06.991515,True,squared_error,42,,1,2,982,TPESampler,COMPLETE
1037,0.4026224011374268,2025-04-24 22:13:15.277929,2025-04-24 22:13:20.254153,0 days 00:00:04.976224,True,squared_error,40,,2,2,862,TPESampler,COMPLETE
1038,0.4165821039080185,2025-04-24 22:13:16.680765,2025-04-24 22:13:20.592926,0 days 00:00:03.912161,True,squared_error,27,,3,5,761,TPESampler,COMPLETE
1039,0.41811332762948067,2025-04-24 22:13:19.103526,2025-04-24 22:13:25.984445,0 days 00:00:06.880919,True,squared_error,38,,1,3,978,TPESampler,COMPLETE
1040,0.5736131781083792,2025-04-24 22:13:20.446539,2025-04-24 22:13:23.097681,0 days 00:00:02.651142,False,squared_error,5,,2,5,606,TPESampler,COMPLETE
1041,0.4052988441722027,2025-04-24 22:13:20.798078,2025-04-24 22:13:25.934962,0 days 00:00:05.136884,True,squared_error,28,,2,6,992,TPESampler,COMPLETE
1042,0.40353079947833603,2025-04-24 22:13:23.288246,2025-04-24 22:13:27.901387,0 days 00:00:04.613141,True,squared_error,19,,2,4,796,TPESampler,COMPLETE
1043,0.4023259613133283,2025-04-24 22:13:26.088920,2025-04-24 22:13:32.056263,0 days 00:00:05.967343,True,squared_error,38,,2,3,999,TPESampler,COMPLETE
1044,0.41600993434466343,2025-04-24 22:13:26.129087,2025-04-24 22:13:30.905128,0 days 00:00:04.776041,True,squared_error,25,,3,2,875,TPESampler,COMPLETE
1045,0.4025565501301357,2025-04-24 22:13:28.090673,2025-04-24 22:13:33.257554,0 days 00:00:05.166881,True,squared_error,50,,2,2,932,TPESampler,COMPLETE
1046,0.42363049697608596,2025-04-24 22:13:31.086633,2025-04-24 22:13:37.489617,0 days 00:00:06.402984,True,squared_error,28,,1,2,868,TPESampler,COMPLETE
1047,1.0043652251301527,2025-04-24 22:13:32.279240,2025-04-24 22:13:33.228392,0 days 00:00:00.949152,True,squared_error,32,sqrt,3,11,217,TPESampler,COMPLETE
1048,0.40234751704321575,2025-04-24 22:13:33.377251,2025-04-24 22:13:38.131957,0 days 00:00:04.754706,True,squared_error,40,,2,2,838,TPESampler,COMPLETE
1049,0.4026932456936165,2025-04-24 22:13:33.429659,2025-04-24 22:13:38.068668,0 days 00:00:04.639009,True,squared_error,34,,2,2,820,TPESampler,COMPLETE
1050,0.42445648158919536,2025-04-24 22:13:37.676697,2025-04-24 22:13:45.200107,0 days 00:00:07.523410,True,squared_error,35,,1,2,992,TPESampler,COMPLETE
1051,0.9249999780046161,2025-04-24 22:13:38.562171,2025-04-24 22:13:42.784744,0 days 00:00:04.222573,False,absolute_error,35,sqrt,2,5,259,TPESampler,COMPLETE
1052,0.402598338941663,2025-04-24 22:13:38.610147,2025-04-24 22:13:43.049769,0 days 00:00:04.439622,True,squared_error,36,,2,4,859,TPESampler,COMPLETE
1053,0.4022936022957746,2025-04-24 22:13:42.967795,2025-04-24 22:13:48.712007,0 days 00:00:05.744212,True,squared_error,43,,2,2,1000,TPESampler,COMPLETE
1054,0.41589421606157206,2025-04-24 22:13:43.278319,2025-04-24 22:13:47.574294,0 days 00:00:04.295975,True,squared_error,35,,3,2,831,TPESampler,COMPLETE
1055,0.5177430122127027,2025-04-24 22:13:45.384772,2025-04-24 22:14:07.455854,0 days 00:00:22.071082,False,absolute_error,44,sqrt,1,2,826,TPESampler,COMPLETE
1056,0.4026205170932362,2025-04-24 22:13:47.753896,2025-04-24 22:13:52.082269,0 days 00:00:04.328373,True,squared_error,31,,2,4,825,TPESampler,COMPLETE
1057,0.4021878060183394,2025-04-24 22:13:48.891474,2025-04-24 22:13:53.788017,0 days 00:00:04.896543,True,squared_error,35,,2,4,975,TPESampler,COMPLETE
1058,0.4030946334835235,2025-04-24 22:13:52.269454,2025-04-24 22:14:33.777575,0 days 00:00:41.508121,True,absolute_error,34,,2,2,988,TPESampler,COMPLETE
1059,0.4022936022957746,2025-04-24 22:13:53.966483,2025-04-24 22:13:58.642818,0 days 00:00:04.676335,True,squared_error,40,,2,2,1000,TPESampler,COMPLETE
1060,1.2887777597333865,2025-04-24 22:13:58.826192,2025-04-24 22:14:00.476338,0 days 00:00:01.650146,True,squared_error,39,log2,3,2,1000,TPESampler,COMPLETE
1061,0.4028808075948416,2025-04-24 22:14:00.675273,2025-04-24 22:14:05.036850,0 days 00:00:04.361577,True,squared_error,27,,2,2,915,TPESampler,COMPLETE
1062,1.315413130832975,2025-04-24 22:14:05.210720,2025-04-24 22:14:06.013957,0 days 00:00:00.803237,False,squared_error,14,log2,9,9,292,TPESampler,COMPLETE
1063,0.4396568647496294,2025-04-24 22:14:06.214353,2025-04-24 22:14:10.397309,0 days 00:00:04.182956,True,squared_error,28,,4,3,948,TPESampler,COMPLETE
1064,0.41636238004531084,2025-04-24 22:14:07.634918,2025-04-24 22:14:12.102988,0 days 00:00:04.468070,True,squared_error,32,,3,4,986,TPESampler,COMPLETE
1065,0.4164280246538695,2025-04-24 22:14:10.588966,2025-04-24 22:14:15.104978,0 days 00:00:04.516012,True,squared_error,34,,3,2,984,TPESampler,COMPLETE
1066,0.4022115206578541,2025-04-24 22:14:12.282166,2025-04-24 22:14:17.298768,0 days 00:00:05.016602,True,squared_error,32,,2,2,988,TPESampler,COMPLETE
1067,0.40232547819294767,2025-04-24 22:14:15.300465,2025-04-24 22:14:19.991385,0 days 00:00:04.690920,True,squared_error,50,,2,2,954,TPESampler,COMPLETE
1068,1.2679443926114033,2025-04-24 22:14:17.488404,2025-04-24 22:14:20.062702,0 days 00:00:02.574298,False,absolute_error,9,log2,1,9,311,TPESampler,COMPLETE
1069,0.4164280246538695,2025-04-24 22:14:20.136405,2025-04-24 22:14:24.841747,0 days 00:00:04.705342,True,squared_error,50,,3,2,984,TPESampler,COMPLETE
1070,0.4023745103445129,2025-04-24 22:14:20.207134,2025-04-24 22:14:25.540530,0 days 00:00:05.333396,True,squared_error,36,,2,4,998,TPESampler,COMPLETE
1071,0.4395779776688005,2025-04-24 22:14:25.033226,2025-04-24 22:14:29.315608,0 days 00:00:04.282382,True,squared_error,42,,4,3,853,TPESampler,COMPLETE
1072,0.8495855902769031,2025-04-24 22:14:25.950806,2025-04-24 22:14:28.075176,0 days 00:00:02.124370,True,squared_error,36,sqrt,2,4,945,TPESampler,COMPLETE
1073,0.42084242113183007,2025-04-24 22:14:28.261685,2025-04-24 22:14:34.158100,0 days 00:00:05.896415,True,squared_error,28,,1,3,986,TPESampler,COMPLETE
1074,0.5712885269502564,2025-04-24 22:14:29.534959,2025-04-24 22:14:34.083685,0 days 00:00:04.548726,True,absolute_error,40,sqrt,1,2,281,TPESampler,COMPLETE
1075,0.8484055450020871,2025-04-24 22:14:33.960833,2025-04-24 22:14:36.932044,0 days 00:00:02.971211,True,squared_error,46,sqrt,2,2,950,TPESampler,COMPLETE
1076,0.4023677558873753,2025-04-24 22:14:34.297647,2025-04-24 22:14:39.492791,0 days 00:00:05.195144,True,squared_error,32,,2,2,849,TPESampler,COMPLETE
1077,0.40261750640808514,2025-04-24 22:14:34.505056,2025-04-24 22:14:40.527461,0 days 00:00:06.022405,True,squared_error,26,,2,4,1000,TPESampler,COMPLETE
1078,0.411818403116641,2025-04-24 22:14:37.123187,2025-04-24 22:14:41.678074,0 days 00:00:04.554887,True,squared_error,42,,2,8,858,TPESampler,COMPLETE
1079,0.4062746423473318,2025-04-24 22:14:39.682714,2025-04-24 22:14:42.807059,0 days 00:00:03.124345,False,squared_error,18,,2,2,383,TPESampler,COMPLETE
1080,0.4022832800052251,2025-04-24 22:14:40.749337,2025-04-24 22:14:46.387941,0 days 00:00:05.638604,True,squared_error,39,,2,4,994,TPESampler,COMPLETE
1081,0.4025827911166676,2025-04-24 22:14:41.860461,2025-04-24 22:14:46.415971,0 days 00:00:04.555510,True,squared_error,37,,2,2,806,TPESampler,COMPLETE
1082,0.40853932446738267,2025-04-24 22:14:42.995598,2025-04-24 22:14:49.285681,0 days 00:00:06.290083,True,squared_error,33,,1,4,993,TPESampler,COMPLETE
1083,0.7142939510362013,2025-04-24 22:14:46.534733,2025-04-24 22:14:52.677707,0 days 00:00:06.142974,False,absolute_error,40,,13,43,296,TPESampler,COMPLETE
1084,0.41640572054022407,2025-04-24 22:14:46.585171,2025-04-24 22:14:51.288264,0 days 00:00:04.703093,True,squared_error,25,,3,2,983,TPESampler,COMPLETE
1085,0.5730184394355172,2025-04-24 22:14:49.468618,2025-04-24 22:15:09.772342,0 days 00:00:20.303724,False,absolute_error,24,,6,5,615,TPESampler,COMPLETE
1086,0.4045710650653312,2025-04-24 22:14:51.460761,2025-04-24 22:14:56.209899,0 days 00:00:04.749138,True,squared_error,42,,1,5,795,TPESampler,COMPLETE
1087,0.40230045900355177,2025-04-24 22:14:52.914529,2025-04-24 22:14:58.011345,0 days 00:00:05.096816,True,squared_error,48,,2,2,996,TPESampler,COMPLETE
1088,0.42344117053113955,2025-04-24 22:14:56.394658,2025-04-24 22:15:03.207905,0 days 00:00:06.813247,True,squared_error,48,,1,2,974,TPESampler,COMPLETE
1089,1.2993898478788428,2025-04-24 22:14:58.190786,2025-04-24 22:14:59.336251,0 days 00:00:01.145465,True,squared_error,26,sqrt,13,20,495,TPESampler,COMPLETE
1090,0.4268954373148349,2025-04-24 22:14:59.518356,2025-04-24 22:15:24.034679,0 days 00:00:24.516323,True,absolute_error,44,,3,2,821,TPESampler,COMPLETE
1091,0.42892026229387437,2025-04-24 22:15:03.378479,2025-04-24 22:15:08.636773,0 days 00:00:05.258294,False,squared_error,34,,3,3,887,TPESampler,COMPLETE
1092,0.41638113044184855,2025-04-24 22:15:08.830035,2025-04-24 22:15:13.271149,0 days 00:00:04.441114,True,squared_error,35,,3,4,987,TPESampler,COMPLETE
1093,0.41630274767387926,2025-04-24 22:15:09.956327,2025-04-24 22:15:13.284752,0 days 00:00:03.328425,True,squared_error,40,,3,3,780,TPESampler,COMPLETE
1094,1.0249928525747392,2025-04-24 22:15:13.423371,2025-04-24 22:15:15.125934,0 days 00:00:01.702563,False,squared_error,21,log2,1,20,879,TPESampler,COMPLETE
1095,1.3137508073489483,2025-04-24 22:15:13.471268,2025-04-24 22:15:15.116298,0 days 00:00:01.645030,False,absolute_error,50,sqrt,9,8,209,TPESampler,COMPLETE
1096,0.40261334397672616,2025-04-24 22:15:15.272484,2025-04-24 22:15:19.633621,0 days 00:00:04.361137,True,squared_error,42,,2,2,823,TPESampler,COMPLETE
1097,0.4023575818007951,2025-04-24 22:15:15.318111,2025-04-24 22:15:20.743077,0 days 00:00:05.424966,True,squared_error,33,,2,2,998,TPESampler,COMPLETE
1098,0.4025802749736362,2025-04-24 22:15:19.809828,2025-04-24 22:15:24.264285,0 days 00:00:04.454457,True,squared_error,28,,2,3,811,TPESampler,COMPLETE
1099,0.41615528933469836,2025-04-24 22:15:20.925888,2025-04-24 22:15:25.316651,0 days 00:00:04.390763,True,squared_error,40,,3,2,888,TPESampler,COMPLETE
1100,0.402240654477862,2025-04-24 22:15:24.223700,2025-04-24 22:15:30.390563,0 days 00:00:06.166863,True,squared_error,37,,2,2,993,TPESampler,COMPLETE
1101,0.43969894267763593,2025-04-24 22:15:24.473163,2025-04-24 22:15:29.731158,0 days 00:00:05.257995,True,squared_error,33,,4,2,994,TPESampler,COMPLETE
1102,1.3850430220697239,2025-04-24 22:15:25.757832,2025-04-24 22:15:27.705503,0 days 00:00:01.947671,True,absolute_error,37,log2,6,3,783,TPESampler,COMPLETE
1103,0.4185540576079451,2025-04-24 22:15:27.895828,2025-04-24 22:15:35.037483,0 days 00:00:07.141655,True,squared_error,36,,1,3,999,TPESampler,COMPLETE
1104,1.2307121359925248,2025-04-24 22:15:29.951107,2025-04-24 22:15:32.408179,0 days 00:00:02.457072,True,squared_error,24,log2,2,4,995,TPESampler,COMPLETE
1105,0.4026013323586826,2025-04-24 22:15:30.862026,2025-04-24 22:15:35.933416,0 days 00:00:05.071390,True,squared_error,39,,2,4,876,TPESampler,COMPLETE
1106,0.4021761942590767,2025-04-24 22:15:32.589433,2025-04-24 22:15:38.093944,0 days 00:00:05.504511,True,squared_error,41,,2,2,979,TPESampler,COMPLETE
1107,0.42457047834514844,2025-04-24 22:15:35.228447,2025-04-24 22:15:42.082964,0 days 00:00:06.854517,True,squared_error,27,,1,2,989,TPESampler,COMPLETE
1108,0.45895493608511634,2025-04-24 22:15:36.276120,2025-04-24 22:16:53.043433,0 days 00:01:16.767313,False,absolute_error,37,,2,3,981,TPESampler,COMPLETE
1109,0.4024818209716682,2025-04-24 22:15:38.262880,2025-04-24 22:15:42.338427,0 days 00:00:04.075547,True,squared_error,35,,2,2,851,TPESampler,COMPLETE
1110,0.5800400585455596,2025-04-24 22:15:42.282495,2025-04-24 22:15:45.888760,0 days 00:00:03.606265,True,squared_error,26,,8,8,992,TPESampler,COMPLETE
1111,0.40287147094128795,2025-04-24 22:15:42.571729,2025-04-24 22:15:48.860488,0 days 00:00:06.288759,False,squared_error,34,,2,2,855,TPESampler,COMPLETE
1112,0.9617690548869126,2025-04-24 22:15:46.070670,2025-04-24 22:15:46.805227,0 days 00:00:00.734557,False,squared_error,23,log2,1,30,131,TPESampler,COMPLETE
1113,0.4022324925345733,2025-04-24 22:15:46.985452,2025-04-24 22:15:51.869659,0 days 00:00:04.884207,True,squared_error,35,,2,2,989,TPESampler,COMPLETE
1114,0.865926282430198,2025-04-24 22:15:49.041759,2025-04-24 22:15:59.253949,0 days 00:00:10.212190,False,absolute_error,21,sqrt,1,16,503,TPESampler,COMPLETE
1115,0.4021929666101568,2025-04-24 22:15:52.047880,2025-04-24 22:15:56.565478,0 days 00:00:04.517598,True,squared_error,33,,2,2,977,TPESampler,COMPLETE
1116,1.3328029439964069,2025-04-24 22:15:56.742692,2025-04-24 22:15:57.707244,0 days 00:00:00.964552,False,squared_error,24,log2,10,2,633,TPESampler,COMPLETE
1117,1.3214740081996839,2025-04-24 22:15:57.894459,2025-04-24 22:15:59.044074,0 days 00:00:01.149615,True,squared_error,44,log2,5,10,574,TPESampler,COMPLETE
1118,0.4189497328667874,2025-04-24 22:15:59.216387,2025-04-24 22:16:04.604036,0 days 00:00:05.387649,True,squared_error,32,,1,3,879,TPESampler,COMPLETE
1119,0.40221028968139555,2025-04-24 22:15:59.486057,2025-04-24 22:16:04.281206,0 days 00:00:04.795149,True,squared_error,33,,2,4,967,TPESampler,COMPLETE
1120,0.6196946194987817,2025-04-24 22:16:04.480442,2025-04-24 22:17:44.783822,0 days 00:01:40.303380,False,absolute_error,11,,1,27,973,TPESampler,COMPLETE
1121,1.3313925829876765,2025-04-24 22:16:04.802417,2025-04-24 22:16:05.783664,0 days 00:00:00.981247,True,squared_error,16,log2,5,5,169,TPESampler,COMPLETE
1122,0.402598338941663,2025-04-24 22:16:05.961133,2025-04-24 22:16:10.014338,0 days 00:00:04.053205,True,squared_error,38,,2,3,859,TPESampler,COMPLETE
1123,0.402457634095767,2025-04-24 22:16:10.185592,2025-04-24 22:16:14.177135,0 days 00:00:03.991543,True,squared_error,42,,2,3,847,TPESampler,COMPLETE
1124,0.6352278988701627,2025-04-24 22:16:14.434880,2025-04-24 22:16:15.699484,0 days 00:00:01.264604,True,squared_error,13,,10,2,220,TPESampler,COMPLETE
1125,0.4652429964236938,2025-04-24 22:16:15.880383,2025-04-24 22:16:17.031772,0 days 00:00:01.151389,False,squared_error,26,,6,4,140,TPESampler,COMPLETE
1126,0.4027060775362901,2025-04-24 22:16:17.213040,2025-04-24 22:16:21.218337,0 days 00:00:04.005297,True,squared_error,27,,2,2,848,TPESampler,COMPLETE
1127,0.42439906536031663,2025-04-24 22:16:21.425889,2025-04-24 22:16:27.169720,0 days 00:00:05.743831,True,squared_error,39,,1,2,905,TPESampler,COMPLETE
1128,0.40231329187217196,2025-04-24 22:16:27.368016,2025-04-24 22:16:32.003168,0 days 00:00:04.635152,True,squared_error,32,,2,4,995,TPESampler,COMPLETE
1129,0.40216417828594947,2025-04-24 22:16:32.190232,2025-04-24 22:16:36.717278,0 days 00:00:04.527046,True,squared_error,28,,2,2,979,TPESampler,COMPLETE
1130,0.4025370151634988,2025-04-24 22:16:36.894638,2025-04-24 22:16:41.215922,0 days 00:00:04.321284,True,squared_error,21,,2,2,941,TPESampler,COMPLETE
1131,0.7455753512043829,2025-04-24 22:16:41.393085,2025-04-24 22:16:47.985913,0 days 00:00:06.592828,True,absolute_error,47,log2,1,4,617,TPESampler,COMPLETE
1132,1.019029320629149,2025-04-24 22:16:48.179115,2025-04-24 22:16:49.098282,0 days 00:00:00.919167,False,squared_error,7,sqrt,1,7,359,TPESampler,COMPLETE
1133,1.2104914538528235,2025-04-24 22:16:49.279586,2025-04-24 22:16:50.358125,0 days 00:00:01.078539,False,absolute_error,36,sqrt,5,2,103,TPESampler,COMPLETE
