number,value,datetime_start,datetime_complete,duration,params_bootstrap,params_criterion,params_max_depth,params_max_features,params_min_samples_leaf,params_min_samples_split,params_n_estimators,system_attrs_auto:sampler,state
1416,1.148604106860581,2025-04-24 22:28:13.446259,2025-04-24 22:28:15.508172,0 days 00:00:02.061913,True,squared_error,35,sqrt,5,2,984,TPESampler,COMPLETE
1417,0.42074384581767504,2025-04-24 22:28:15.365418,2025-04-24 22:28:20.912324,0 days 00:00:05.546906,True,squared_error,22,,1,3,832,TPESampler,COMPLETE
1418,0.4249560668491684,2025-04-24 22:28:15.749786,2025-04-24 22:28:22.260981,0 days 00:00:06.511195,True,squared_error,25,,1,2,866,TPESampler,COMPLETE
1419,0.40254666361864294,2025-04-24 22:28:16.955641,2025-04-24 22:28:22.141407,0 days 00:00:05.185766,True,squared_error,26,,2,2,988,TPESampler,COMPLETE
1420,0.409624199939888,2025-04-24 22:28:21.110823,2025-04-24 22:28:27.446173,0 days 00:00:06.335350,True,squared_error,24,,1,4,982,TPESampler,COMPLETE
1421,0.4023490008673131,2025-04-24 22:28:22.313881,2025-04-24 22:28:27.531201,0 days 00:00:05.217320,True,squared_error,22,,2,2,970,TPESampler,COMPLETE
1422,0.4162002104175526,2025-04-24 22:28:22.474721,2025-04-24 22:28:26.834016,0 days 00:00:04.359295,True,squared_error,26,,3,2,885,TPESampler,COMPLETE
1423,0.40289062328365616,2025-04-24 22:28:27.033016,2025-04-24 22:28:31.989160,0 days 00:00:04.956144,True,squared_error,23,,2,2,819,TPESampler,COMPLETE
1424,0.4163927830094299,2025-04-24 22:28:27.895628,2025-04-24 22:28:32.724597,0 days 00:00:04.828969,True,squared_error,27,,3,4,988,TPESampler,COMPLETE
1425,0.41630009954667174,2025-04-24 22:28:28.081424,2025-04-24 22:28:33.145086,0 days 00:00:05.063662,True,squared_error,30,,3,2,961,TPESampler,COMPLETE
1426,0.4026001072659132,2025-04-24 22:28:32.176207,2025-04-24 22:28:37.551068,0 days 00:00:05.374861,True,squared_error,29,,2,2,883,TPESampler,COMPLETE
1427,1.3800272149633057,2025-04-24 22:28:33.151957,2025-04-24 22:28:34.812146,0 days 00:00:01.660189,False,absolute_error,49,log2,7,6,395,TPESampler,COMPLETE
1428,0.4026198500574345,2025-04-24 22:28:33.352442,2025-04-24 22:28:39.138348,0 days 00:00:05.785906,True,squared_error,26,,2,2,992,TPESampler,COMPLETE
1429,0.4027824471879997,2025-04-24 22:28:35.015815,2025-04-24 22:28:39.650014,0 days 00:00:04.634199,True,squared_error,27,,2,2,835,TPESampler,COMPLETE
1430,0.4022124081304526,2025-04-24 22:28:37.753863,2025-04-24 22:28:43.221152,0 days 00:00:05.467289,True,squared_error,33,,2,2,983,TPESampler,COMPLETE
1431,0.42505377434068486,2025-04-24 22:28:39.338070,2025-04-24 22:28:45.867009,0 days 00:00:06.528939,True,squared_error,31,,1,2,884,TPESampler,COMPLETE
1432,0.4024910714473281,2025-04-24 22:28:39.913577,2025-04-24 22:28:45.027762,0 days 00:00:05.114185,True,squared_error,33,,2,3,910,TPESampler,COMPLETE
1433,0.5783631112120012,2025-04-24 22:28:43.417349,2025-04-24 22:29:00.018756,0 days 00:00:16.601407,True,absolute_error,28,,6,6,934,TPESampler,COMPLETE
1434,0.4248775827828926,2025-04-24 22:28:45.225192,2025-04-24 22:28:52.704201,0 days 00:00:07.479009,True,squared_error,32,,1,2,976,TPESampler,COMPLETE
1435,0.9787846933856806,2025-04-24 22:28:46.469517,2025-04-24 22:28:48.285383,0 days 00:00:01.815866,True,squared_error,21,sqrt,3,3,840,TPESampler,COMPLETE
1436,0.4026825345825278,2025-04-24 22:28:48.459196,2025-04-24 22:28:52.737451,0 days 00:00:04.278255,True,squared_error,35,,2,2,884,TPESampler,COMPLETE
1437,0.4022649904552218,2025-04-24 22:28:52.863548,2025-04-24 22:28:58.412406,0 days 00:00:05.548858,True,squared_error,35,,2,3,982,TPESampler,COMPLETE
1438,0.43965618716663735,2025-04-24 22:28:52.902921,2025-04-24 22:28:57.358786,0 days 00:00:04.455865,True,squared_error,31,,4,2,999,TPESampler,COMPLETE
1439,0.4025213104418719,2025-04-24 22:28:57.544316,2025-04-24 22:29:03.475606,0 days 00:00:05.931290,True,squared_error,26,,2,4,973,TPESampler,COMPLETE
1440,0.4023248361537819,2025-04-24 22:28:58.616116,2025-04-24 22:29:04.235194,0 days 00:00:05.619078,True,squared_error,32,,2,2,957,TPESampler,COMPLETE
1441,1.403080828804236,2025-04-24 22:29:00.221696,2025-04-24 22:29:01.893269,0 days 00:00:01.671573,True,absolute_error,39,log2,15,11,700,TPESampler,COMPLETE
1442,0.4116747860683061,2025-04-24 22:29:02.116733,2025-04-24 22:29:07.420938,0 days 00:00:05.304205,True,squared_error,28,,2,8,976,TPESampler,COMPLETE
1443,0.40232561648320175,2025-04-24 22:29:03.679026,2025-04-24 22:29:09.360390,0 days 00:00:05.681364,True,squared_error,34,,2,2,999,TPESampler,COMPLETE
1444,0.4266363501684351,2025-04-24 22:29:04.684047,2025-04-24 22:29:11.960071,0 days 00:00:07.276024,True,squared_error,26,,1,2,978,TPESampler,COMPLETE
1445,0.6969740532460567,2025-04-24 22:29:07.658119,2025-04-24 22:29:10.266867,0 days 00:00:02.608748,True,squared_error,24,,13,23,631,TPESampler,COMPLETE
1446,0.41651183820046933,2025-04-24 22:29:09.561050,2025-04-24 22:29:14.739261,0 days 00:00:05.178211,True,squared_error,32,,3,3,999,TPESampler,COMPLETE
1447,0.4022040392896479,2025-04-24 22:29:10.624338,2025-04-24 22:29:16.530029,0 days 00:00:05.905691,True,squared_error,33,,2,2,987,TPESampler,COMPLETE
1448,0.5584744906299479,2025-04-24 22:29:12.161082,2025-04-24 22:29:14.446301,0 days 00:00:02.285219,True,squared_error,14,,4,27,515,TPESampler,COMPLETE
1449,0.4036679006476158,2025-04-24 22:29:14.655171,2025-04-24 22:29:18.881836,0 days 00:00:04.226665,True,squared_error,37,,2,3,689,TPESampler,COMPLETE
1450,0.4023259613133283,2025-04-24 22:29:14.998821,2025-04-24 22:29:20.793689,0 days 00:00:05.794868,True,squared_error,35,,2,2,999,TPESampler,COMPLETE
1451,0.41642911018344403,2025-04-24 22:29:16.745065,2025-04-24 22:29:21.882865,0 days 00:00:05.137800,True,squared_error,38,,3,2,990,TPESampler,COMPLETE
1452,0.4331428637233787,2025-04-24 22:29:19.069093,2025-04-24 22:30:25.918450,0 days 00:01:06.849357,True,absolute_error,12,,1,6,908,TPESampler,COMPLETE
1453,0.4191445839207844,2025-04-24 22:29:20.973132,2025-04-24 22:29:27.244629,0 days 00:00:06.271497,True,squared_error,37,,1,3,964,TPESampler,COMPLETE
1454,0.40279944914666976,2025-04-24 22:29:22.072866,2025-04-24 22:29:26.641610,0 days 00:00:04.568744,True,squared_error,36,,2,5,994,TPESampler,COMPLETE
1455,0.41651152129787683,2025-04-24 22:29:26.829905,2025-04-24 22:29:31.428775,0 days 00:00:04.598870,True,squared_error,40,,3,2,996,TPESampler,COMPLETE
1456,0.41616935153052836,2025-04-24 22:29:27.466200,2025-04-24 22:29:33.085346,0 days 00:00:05.619146,True,squared_error,38,,1,3,811,TPESampler,COMPLETE
1457,0.40250527160674465,2025-04-24 22:29:31.619293,2025-04-24 22:29:36.840390,0 days 00:00:05.221097,True,squared_error,27,,2,3,979,TPESampler,COMPLETE
1458,0.8428082465440198,2025-04-24 22:29:33.272833,2025-04-24 22:29:34.440634,0 days 00:00:01.167801,False,squared_error,20,sqrt,2,3,425,TPESampler,COMPLETE
1459,0.40274880842230265,2025-04-24 22:29:34.628343,2025-04-24 22:29:38.829557,0 days 00:00:04.201214,True,squared_error,37,,2,2,773,TPESampler,COMPLETE
1460,0.42355505732812243,2025-04-24 22:29:37.025284,2025-04-24 22:29:43.806697,0 days 00:00:06.781413,True,squared_error,41,,1,2,988,TPESampler,COMPLETE
1461,0.4024759169600945,2025-04-24 22:29:39.016496,2025-04-24 22:29:43.066002,0 days 00:00:04.049506,True,squared_error,32,,2,2,829,TPESampler,COMPLETE
1462,0.40262345665243904,2025-04-24 22:29:43.256124,2025-04-24 22:29:48.719323,0 days 00:00:05.463199,True,squared_error,23,,2,2,987,TPESampler,COMPLETE
1463,0.855668217281126,2025-04-24 22:29:44.209095,2025-04-24 22:29:46.350688,0 days 00:00:02.141593,True,squared_error,29,sqrt,2,3,959,TPESampler,COMPLETE
1464,0.40301986143093804,2025-04-24 22:29:46.532019,2025-04-24 22:29:50.795379,0 days 00:00:04.263360,True,squared_error,25,,2,3,805,TPESampler,COMPLETE
1465,0.4027851491595242,2025-04-24 22:29:48.912041,2025-04-24 22:30:36.510761,0 days 00:00:47.598720,True,absolute_error,33,,2,2,894,TPESampler,COMPLETE
1466,0.6112712996531214,2025-04-24 22:29:50.986253,2025-04-24 22:29:54.115208,0 days 00:00:03.128955,True,squared_error,37,,9,2,934,TPESampler,COMPLETE
1467,0.4761096655104213,2025-04-24 22:29:54.301196,2025-04-24 22:30:26.041153,0 days 00:00:31.739957,True,absolute_error,42,,4,3,992,TPESampler,COMPLETE
1468,0.40259413264859584,2025-04-24 22:30:26.109385,2025-04-24 22:30:30.630856,0 days 00:00:04.521471,True,squared_error,41,,2,2,861,TPESampler,COMPLETE
1469,0.4159364344123085,2025-04-24 22:30:26.281435,2025-04-24 22:30:30.344785,0 days 00:00:04.063350,True,squared_error,40,,3,3,841,TPESampler,COMPLETE
1470,0.9793718979992497,2025-04-24 22:30:30.547782,2025-04-24 22:30:32.625166,0 days 00:00:02.077384,True,squared_error,43,sqrt,3,4,765,TPESampler,COMPLETE
1471,0.40230661092472036,2025-04-24 22:30:30.894505,2025-04-24 22:30:36.277792,0 days 00:00:05.383287,True,squared_error,31,,2,3,996,TPESampler,COMPLETE
1472,0.4022936022957746,2025-04-24 22:30:32.825529,2025-04-24 22:30:38.131551,0 days 00:00:05.306022,True,squared_error,41,,2,3,1000,TPESampler,COMPLETE
1473,0.4289200490473079,2025-04-24 22:30:36.466438,2025-04-24 22:30:42.973108,0 days 00:00:06.506670,False,squared_error,28,,3,2,999,TPESampler,COMPLETE
1474,0.5346360712796858,2025-04-24 22:30:36.829166,2025-04-24 22:30:38.109825,0 days 00:00:01.280659,False,squared_error,36,sqrt,1,4,189,TPESampler,COMPLETE
1475,0.41602092938151025,2025-04-24 22:30:38.272957,2025-04-24 22:30:42.473174,0 days 00:00:04.200217,True,squared_error,33,,3,3,846,TPESampler,COMPLETE
1476,0.5012773905252665,2025-04-24 22:30:38.320887,2025-04-24 22:30:42.519059,0 days 00:00:04.198172,True,squared_error,25,,6,3,994,TPESampler,COMPLETE
1477,0.6198949824109664,2025-04-24 22:30:42.619755,2025-04-24 22:30:48.963822,0 days 00:00:06.344067,True,absolute_error,33,,7,9,345,TPESampler,COMPLETE
1478,0.41638113044184855,2025-04-24 22:30:42.661200,2025-04-24 22:30:47.801549,0 days 00:00:05.140349,True,squared_error,49,,3,3,987,TPESampler,COMPLETE
1479,0.42510777997290605,2025-04-24 22:30:43.264159,2025-04-24 22:30:44.907471,0 days 00:00:01.643312,True,squared_error,43,,3,8,166,TPESampler,COMPLETE
1480,0.4027042440036438,2025-04-24 22:30:45.092201,2025-04-24 22:30:49.881908,0 days 00:00:04.789707,True,squared_error,31,,2,4,888,TPESampler,COMPLETE
1481,0.42237249953257006,2025-04-24 22:30:47.990567,2025-04-24 22:30:55.140602,0 days 00:00:07.150035,True,squared_error,46,,1,2,787,TPESampler,COMPLETE
1482,1.230299750796334,2025-04-24 22:30:49.399402,2025-04-24 22:30:51.741490,0 days 00:00:02.342088,True,squared_error,27,log2,2,2,850,TPESampler,COMPLETE
1483,1.3204985943154604,2025-04-24 22:30:50.308549,2025-04-24 22:30:51.655531,0 days 00:00:01.346982,False,squared_error,42,log2,7,41,583,TPESampler,COMPLETE
1484,0.40921120703038166,2025-04-24 22:30:51.812259,2025-04-24 22:30:56.977883,0 days 00:00:05.165624,True,squared_error,40,,1,7,839,TPESampler,COMPLETE
1485,0.990535095819113,2025-04-24 22:30:51.946078,2025-04-24 22:31:03.884888,0 days 00:00:11.938810,False,absolute_error,41,log2,1,38,649,TPESampler,COMPLETE
1486,0.402240654477862,2025-04-24 22:30:55.320833,2025-04-24 22:31:00.516793,0 days 00:00:05.195960,True,squared_error,36,,2,2,993,TPESampler,COMPLETE
1487,0.40840441095513186,2025-04-24 22:30:57.199008,2025-04-24 22:31:03.007513,0 days 00:00:05.808505,True,squared_error,31,,1,4,979,TPESampler,COMPLETE
1488,0.40279552685780873,2025-04-24 22:31:00.713746,2025-04-24 22:31:06.183674,0 days 00:00:05.469928,True,squared_error,36,,2,5,1000,TPESampler,COMPLETE
1489,0.41642911018344403,2025-04-24 22:31:03.194840,2025-04-24 22:31:08.256835,0 days 00:00:05.061995,True,squared_error,30,,3,2,990,TPESampler,COMPLETE
1490,0.40287042522504163,2025-04-24 22:31:04.201215,2025-04-24 22:31:10.823957,0 days 00:00:06.622742,False,squared_error,44,,2,4,912,TPESampler,COMPLETE
1491,0.4285598135719557,2025-04-24 22:31:06.375211,2025-04-24 22:31:13.180410,0 days 00:00:06.805199,True,squared_error,21,,1,2,982,TPESampler,COMPLETE
1492,0.40263451994008626,2025-04-24 22:31:08.450093,2025-04-24 22:31:13.668791,0 days 00:00:05.218698,True,squared_error,23,,2,4,990,TPESampler,COMPLETE
1493,0.4241302915847282,2025-04-24 22:31:11.016523,2025-04-24 22:31:18.603959,0 days 00:00:07.587436,True,squared_error,43,,1,2,981,TPESampler,COMPLETE
1494,0.9961425757037876,2025-04-24 22:31:13.370670,2025-04-24 22:31:15.516622,0 days 00:00:02.145952,True,squared_error,46,sqrt,3,19,738,TPESampler,COMPLETE
1495,0.41613283427644077,2025-04-24 22:31:13.883555,2025-04-24 22:31:17.987106,0 days 00:00:04.103551,True,squared_error,21,,3,3,773,TPESampler,COMPLETE
1496,1.2043066305154615,2025-04-24 22:31:15.713021,2025-04-24 22:31:20.373393,0 days 00:00:04.660372,False,absolute_error,31,sqrt,5,18,659,TPESampler,COMPLETE
1497,0.41596354578178035,2025-04-24 22:31:18.182292,2025-04-24 22:31:22.681055,0 days 00:00:04.498763,True,squared_error,33,,3,2,827,TPESampler,COMPLETE
1498,0.402708524540764,2025-04-24 22:31:18.837395,2025-04-24 22:31:23.880319,0 days 00:00:05.042924,True,squared_error,44,,2,2,873,TPESampler,COMPLETE
1499,0.46940647323817686,2025-04-24 22:31:20.566014,2025-04-24 22:31:27.883089,0 days 00:00:07.317075,False,squared_error,27,,1,2,751,TPESampler,COMPLETE
1500,1.3999207301559546,2025-04-24 22:31:22.868425,2025-04-24 22:31:23.789825,0 days 00:00:00.921400,True,absolute_error,12,log2,15,2,241,TPESampler,COMPLETE
1501,0.40238063126610984,2025-04-24 22:31:23.976913,2025-04-24 22:31:30.156334,0 days 00:00:06.179421,True,squared_error,31,,2,3,998,TPESampler,COMPLETE
1502,1.1875543294612685,2025-04-24 22:31:24.090288,2025-04-24 22:31:26.381683,0 days 00:00:02.291395,True,squared_error,47,sqrt,6,8,975,TPESampler,COMPLETE
1503,0.40696924594767864,2025-04-24 22:31:26.563977,2025-04-24 22:31:32.585960,0 days 00:00:06.021983,True,squared_error,39,,1,4,879,TPESampler,COMPLETE
1504,0.4396361747625949,2025-04-24 22:31:28.071512,2025-04-24 22:31:32.083577,0 days 00:00:04.012065,True,squared_error,41,,4,4,854,TPESampler,COMPLETE
1505,0.40222116043429706,2025-04-24 22:31:30.348762,2025-04-24 22:31:35.790244,0 days 00:00:05.441482,True,squared_error,45,,2,2,987,TPESampler,COMPLETE
1506,0.4036125079744797,2025-04-24 22:31:32.269591,2025-04-24 22:31:35.836202,0 days 00:00:03.566611,True,squared_error,50,,2,3,632,TPESampler,COMPLETE
1507,0.40235923870087176,2025-04-24 22:31:32.790511,2025-04-24 22:31:37.751096,0 days 00:00:04.960585,True,squared_error,33,,2,4,842,TPESampler,COMPLETE
1508,0.42385411452160454,2025-04-24 22:31:35.940416,2025-04-24 22:32:27.861709,0 days 00:00:51.921293,True,absolute_error,36,,1,6,739,TPESampler,COMPLETE
1509,0.4023369704743515,2025-04-24 22:31:36.051656,2025-04-24 22:31:40.881087,0 days 00:00:04.829431,True,squared_error,28,,2,2,842,TPESampler,COMPLETE
1510,0.646918211364567,2025-04-24 22:31:37.943151,2025-04-24 22:31:40.642615,0 days 00:00:02.699464,True,squared_error,35,,1,36,642,TPESampler,COMPLETE
1511,1.2289156415188278,2025-04-24 22:31:40.835062,2025-04-24 22:31:42.962096,0 days 00:00:02.127034,True,squared_error,43,log2,2,3,841,TPESampler,COMPLETE
1512,0.4165119353507597,2025-04-24 22:31:41.207350,2025-04-24 22:31:45.974293,0 days 00:00:04.766943,True,squared_error,41,,3,4,997,TPESampler,COMPLETE
1513,0.4364231904049108,2025-04-24 22:31:43.148808,2025-04-24 22:31:45.659108,0 days 00:00:02.510300,False,squared_error,23,,1,9,348,TPESampler,COMPLETE
1514,0.4023882519845315,2025-04-24 22:31:45.847598,2025-04-24 22:31:50.842866,0 days 00:00:04.995268,True,squared_error,35,,2,2,854,TPESampler,COMPLETE
1515,1.2885308888700238,2025-04-24 22:31:46.212543,2025-04-24 22:31:48.269412,0 days 00:00:02.056869,True,squared_error,35,log2,3,3,997,TPESampler,COMPLETE
1516,0.41657415186444163,2025-04-24 22:31:48.469930,2025-04-24 22:31:53.136797,0 days 00:00:04.666867,True,squared_error,20,,3,2,997,TPESampler,COMPLETE
1517,0.4242051874332892,2025-04-24 22:31:51.035686,2025-04-24 22:31:57.639526,0 days 00:00:06.603840,True,squared_error,27,,1,2,998,TPESampler,COMPLETE
1518,0.4055071601111638,2025-04-24 22:31:53.326035,2025-04-24 22:31:57.772003,0 days 00:00:04.445968,True,squared_error,43,,2,6,992,TPESampler,COMPLETE
1519,0.4165119353507597,2025-04-24 22:31:57.821753,2025-04-24 22:32:02.365524,0 days 00:00:04.543771,True,squared_error,43,,3,2,997,TPESampler,COMPLETE
1520,0.6230709293065977,2025-04-24 22:31:57.989854,2025-04-24 22:33:30.834064,0 days 00:01:32.844210,False,absolute_error,35,,1,28,794,TPESampler,COMPLETE
1521,0.4054874173978901,2025-04-24 22:32:02.554472,2025-04-24 22:32:06.762354,0 days 00:00:04.207882,True,squared_error,50,,2,6,955,TPESampler,COMPLETE
1522,0.402598338941663,2025-04-24 22:32:06.956774,2025-04-24 22:32:11.006566,0 days 00:00:04.049792,True,squared_error,45,,2,3,859,TPESampler,COMPLETE
1523,0.439663483760791,2025-04-24 22:32:11.198986,2025-04-24 22:32:14.513709,0 days 00:00:03.314723,True,squared_error,30,,4,8,837,TPESampler,COMPLETE
1524,0.4023011415031752,2025-04-24 22:32:14.700145,2025-04-24 22:32:19.307417,0 days 00:00:04.607272,True,squared_error,31,,2,2,992,TPESampler,COMPLETE
1525,0.40240712248832106,2025-04-24 22:32:19.488733,2025-04-24 22:32:23.478166,0 days 00:00:03.989433,True,squared_error,37,,2,2,850,TPESampler,COMPLETE
1526,0.4083265173232359,2025-04-24 22:32:23.666551,2025-04-24 22:32:27.991502,0 days 00:00:04.324951,True,squared_error,28,,1,4,799,TPESampler,COMPLETE
1527,0.41689564515800387,2025-04-24 22:32:28.054562,2025-04-24 22:32:33.908451,0 days 00:00:05.853889,True,squared_error,38,,1,3,883,TPESampler,COMPLETE
1528,0.40254443856857625,2025-04-24 22:32:28.224092,2025-04-24 22:32:32.731197,0 days 00:00:04.507105,True,squared_error,31,,2,4,863,TPESampler,COMPLETE
1529,0.4158990632349798,2025-04-24 22:32:32.936413,2025-04-24 22:32:36.942344,0 days 00:00:04.005931,True,squared_error,39,,3,4,830,TPESampler,COMPLETE
1530,0.4027200968085329,2025-04-24 22:32:34.092505,2025-04-24 22:32:38.662906,0 days 00:00:04.570401,True,squared_error,41,,2,2,882,TPESampler,COMPLETE
1531,0.4472907984391309,2025-04-24 22:32:37.134010,2025-04-24 22:32:40.631214,0 days 00:00:03.497204,False,squared_error,27,,4,2,564,TPESampler,COMPLETE
1532,0.40220373140675525,2025-04-24 22:32:38.847140,2025-04-24 22:32:43.922052,0 days 00:00:05.074912,True,squared_error,36,,2,4,980,TPESampler,COMPLETE
1533,0.4080438148519914,2025-04-24 22:32:40.815831,2025-04-24 22:32:46.362491,0 days 00:00:05.546660,True,squared_error,50,,1,4,907,TPESampler,COMPLETE
1534,0.4023259613133283,2025-04-24 22:32:44.131643,2025-04-24 22:32:49.421744,0 days 00:00:05.290101,True,squared_error,35,,2,4,999,TPESampler,COMPLETE
1535,0.43965618716663735,2025-04-24 22:32:46.557497,2025-04-24 22:32:50.929876,0 days 00:00:04.372379,True,squared_error,42,,4,2,999,TPESampler,COMPLETE
1536,0.49354009190764897,2025-04-24 22:32:49.614562,2025-04-24 22:33:25.660546,0 days 00:00:36.045984,False,absolute_error,26,,5,2,894,TPESampler,COMPLETE
1537,0.41651183820046933,2025-04-24 22:32:51.146007,2025-04-24 22:32:55.245542,0 days 00:00:04.099535,True,squared_error,37,,3,4,999,TPESampler,COMPLETE
1538,0.7122480162507804,2025-04-24 22:32:55.459085,2025-04-24 22:32:58.951435,0 days 00:00:03.492350,False,squared_error,39,,6,47,845,TPESampler,COMPLETE
1539,0.4164941683800708,2025-04-24 22:32:59.146015,2025-04-24 22:33:03.223846,0 days 00:00:04.077831,True,squared_error,26,,3,2,994,TPESampler,COMPLETE
1540,0.40264478812992216,2025-04-24 22:33:03.408141,2025-04-24 22:33:07.573911,0 days 00:00:04.165770,True,squared_error,36,,2,2,883,TPESampler,COMPLETE
1541,0.6503397904999018,2025-04-24 22:33:07.768309,2025-04-24 22:33:08.680379,0 days 00:00:00.912070,True,squared_error,32,,11,5,121,TPESampler,COMPLETE
1542,0.8495503541804352,2025-04-24 22:33:08.856809,2025-04-24 22:33:10.822293,0 days 00:00:01.965484,True,squared_error,43,sqrt,2,4,967,TPESampler,COMPLETE
1543,0.4030992360877418,2025-04-24 22:33:11.018655,2025-04-24 22:33:15.138582,0 days 00:00:04.119927,True,squared_error,24,,2,3,861,TPESampler,COMPLETE
1544,0.4022333352922416,2025-04-24 22:33:15.335742,2025-04-24 22:33:19.971918,0 days 00:00:04.636176,True,squared_error,40,,2,2,990,TPESampler,COMPLETE
1545,0.4255196171804661,2025-04-24 22:33:20.158541,2025-04-24 22:33:26.741510,0 days 00:00:06.582969,True,squared_error,33,,1,2,991,TPESampler,COMPLETE
1546,0.41674118221269507,2025-04-24 22:33:25.849765,2025-04-24 22:33:31.312185,0 days 00:00:05.462420,False,squared_error,31,,2,7,780,TPESampler,COMPLETE
1547,0.4397097635077257,2025-04-24 22:33:26.933677,2025-04-24 22:33:30.175600,0 days 00:00:03.241923,True,squared_error,30,,4,2,802,TPESampler,COMPLETE
1548,0.4026988566181491,2025-04-24 22:33:30.357877,2025-04-24 22:33:35.760187,0 days 00:00:05.402310,True,squared_error,50,,2,5,980,TPESampler,COMPLETE
1549,0.40287741118557585,2025-04-24 22:33:31.275495,2025-04-24 22:33:36.588902,0 days 00:00:05.313407,True,squared_error,24,,2,4,991,TPESampler,COMPLETE
1550,0.40229480858071254,2025-04-24 22:33:31.537949,2025-04-24 22:33:37.131064,0 days 00:00:05.593115,True,squared_error,43,,2,3,991,TPESampler,COMPLETE
1551,0.4028701524161914,2025-04-24 22:33:35.952648,2025-04-24 22:33:43.558947,0 days 00:00:07.606299,False,squared_error,37,,2,3,977,TPESampler,COMPLETE
1552,0.41176919444061183,2025-04-24 22:33:36.968574,2025-04-24 22:33:41.135663,0 days 00:00:04.167089,True,squared_error,36,,2,8,824,TPESampler,COMPLETE
1553,0.6496479605274097,2025-04-24 22:33:37.337329,2025-04-24 22:33:41.268392,0 days 00:00:03.931063,True,squared_error,20,,1,37,948,TPESampler,COMPLETE
1554,0.7078950799818303,2025-04-24 22:33:41.329899,2025-04-24 22:33:44.750021,0 days 00:00:03.420122,True,squared_error,36,log2,1,2,837,TPESampler,COMPLETE
1555,0.4165170038975512,2025-04-24 22:33:41.479234,2025-04-24 22:33:47.413269,0 days 00:00:05.934035,True,squared_error,36,,3,3,1000,TPESampler,COMPLETE
1556,0.40906952571305705,2025-04-24 22:33:43.761777,2025-04-24 22:33:50.704726,0 days 00:00:06.942949,True,squared_error,36,,1,4,976,TPESampler,COMPLETE
1557,1.3200370327842963,2025-04-24 22:33:44.941542,2025-04-24 22:33:46.891245,0 days 00:00:01.949703,True,squared_error,23,log2,5,3,989,TPESampler,COMPLETE
