number,value,datetime_start,datetime_complete,duration,params_bootstrap,params_criterion,params_max_depth,params_max_features,params_min_samples_leaf,params_min_samples_split,params_n_estimators,system_attrs_auto:sampler,state
1981,0.4024894240615571,2025-04-24 22:49:26.657034,2025-04-24 22:49:30.991375,0 days 00:00:04.334341,True,squared_error,32,,2,4,814,TPESampler,COMPLETE
1982,0.40237109542655053,2025-04-24 22:49:29.848791,2025-04-24 22:49:35.354564,0 days 00:00:05.505773,True,squared_error,44,,2,2,843,TPESampler,COMPLETE
1983,0.8662870787350675,2025-04-24 22:49:31.179826,2025-04-24 22:49:33.700106,0 days 00:00:02.520280,True,squared_error,25,sqrt,2,4,935,TPESampler,COMPLETE
1984,1.3516401110130039,2025-04-24 22:49:32.459019,2025-04-24 22:49:34.408662,0 days 00:00:01.949643,False,absolute_error,44,log2,4,2,461,TPESampler,COMPLETE
1985,0.4022214031754103,2025-04-24 22:49:33.887014,2025-04-24 22:49:39.221920,0 days 00:00:05.334906,True,squared_error,28,,2,4,990,TPESampler,COMPLETE
1986,0.40247159951256745,2025-04-24 22:49:34.844060,2025-04-24 22:49:39.946013,0 days 00:00:05.101953,True,squared_error,30,,2,2,995,TPESampler,COMPLETE
1987,0.6544225468701788,2025-04-24 22:49:35.814277,2025-04-24 22:49:44.564789,0 days 00:00:08.750512,False,absolute_error,24,,12,19,421,TPESampler,COMPLETE
1988,0.7265963085715048,2025-04-24 22:49:39.411662,2025-04-24 22:49:42.532348,0 days 00:00:03.120686,True,squared_error,17,sqrt,1,2,965,TPESampler,COMPLETE
1989,1.2275437988593823,2025-04-24 22:49:40.345833,2025-04-24 22:49:42.399427,0 days 00:00:02.053594,True,squared_error,28,log2,2,2,947,TPESampler,COMPLETE
1990,0.4047008602358064,2025-04-24 22:49:42.571393,2025-04-24 22:49:48.849903,0 days 00:00:06.278510,True,squared_error,42,,1,5,998,TPESampler,COMPLETE
1991,0.4023173743517606,2025-04-24 22:49:42.747823,2025-04-24 22:49:48.439939,0 days 00:00:05.692116,True,squared_error,32,,2,2,999,TPESampler,COMPLETE
1992,0.43958073759360394,2025-04-24 22:49:44.745933,2025-04-24 22:49:48.704959,0 days 00:00:03.959026,True,squared_error,43,,4,3,962,TPESampler,COMPLETE
1993,0.40550362077729185,2025-04-24 22:49:48.625612,2025-04-24 22:49:54.005313,0 days 00:00:05.379701,True,squared_error,43,,2,6,991,TPESampler,COMPLETE
1994,0.4394915391838221,2025-04-24 22:49:48.956428,2025-04-24 22:49:53.419465,0 days 00:00:04.463037,True,squared_error,29,,4,2,864,TPESampler,COMPLETE
1995,0.4073443772713206,2025-04-24 22:49:49.128434,2025-04-24 22:49:54.687718,0 days 00:00:05.559284,True,squared_error,16,,2,6,985,TPESampler,COMPLETE
1996,1.295518325219386,2025-04-24 22:49:53.607439,2025-04-24 22:49:54.694648,0 days 00:00:01.087209,True,squared_error,41,log2,3,4,180,TPESampler,COMPLETE
1997,0.4026959316571752,2025-04-24 22:49:54.211805,2025-04-24 22:49:59.626925,0 days 00:00:05.415120,True,squared_error,28,,2,2,887,TPESampler,COMPLETE
1998,0.4396877493844503,2025-04-24 22:49:54.905382,2025-04-24 22:49:59.627876,0 days 00:00:04.722494,True,squared_error,41,,4,4,993,TPESampler,COMPLETE
1999,0.4028404797691949,2025-04-24 22:49:55.125351,2025-04-24 22:50:42.409018,0 days 00:00:47.283667,True,absolute_error,45,,2,2,902,TPESampler,COMPLETE
2000,0.4026753842631687,2025-04-24 22:49:59.782140,2025-04-24 22:50:04.845874,0 days 00:00:05.063734,True,squared_error,29,,2,5,992,TPESampler,COMPLETE
2001,0.402240654477862,2025-04-24 22:49:59.829206,2025-04-24 22:50:04.916900,0 days 00:00:05.087694,True,squared_error,39,,2,3,993,TPESampler,COMPLETE
2002,0.4278949511185202,2025-04-24 22:50:04.997392,2025-04-24 22:51:25.612619,0 days 00:01:20.615227,True,absolute_error,23,,1,3,984,TPESampler,COMPLETE
2003,0.40354130005345445,2025-04-24 22:50:05.108135,2025-04-24 22:50:08.991445,0 days 00:00:03.883310,True,squared_error,38,,2,2,709,TPESampler,COMPLETE
2004,1.231684627860975,2025-04-24 22:50:09.178704,2025-04-24 22:50:10.621411,0 days 00:00:01.442707,True,squared_error,22,log2,2,4,786,TPESampler,COMPLETE
2005,1.3013669355688273,2025-04-24 22:50:10.800842,2025-04-24 22:50:12.417287,0 days 00:00:01.616445,True,squared_error,25,sqrt,14,11,963,TPESampler,COMPLETE
2006,0.40252434088730826,2025-04-24 22:50:12.591268,2025-04-24 22:50:16.626160,0 days 00:00:04.034892,True,squared_error,37,,2,3,857,TPESampler,COMPLETE
2007,0.40548350829870894,2025-04-24 22:50:16.819685,2025-04-24 22:51:09.624742,0 days 00:00:52.805057,True,absolute_error,28,,2,5,995,TPESampler,COMPLETE
2008,0.4025409613161658,2025-04-24 22:50:42.593693,2025-04-24 22:50:46.634452,0 days 00:00:04.040759,True,squared_error,30,,2,2,850,TPESampler,COMPLETE
2009,0.4672599511691515,2025-04-24 22:50:46.821490,2025-04-24 22:50:55.313769,0 days 00:00:08.492279,False,squared_error,34,,1,2,989,TPESampler,COMPLETE
2010,0.4165119353507597,2025-04-24 22:50:55.499962,2025-04-24 22:50:59.596237,0 days 00:00:04.096275,True,squared_error,26,,3,2,997,TPESampler,COMPLETE
2011,0.4264303834953593,2025-04-24 22:50:59.774078,2025-04-24 22:51:05.047587,0 days 00:00:05.273509,True,squared_error,30,,1,2,851,TPESampler,COMPLETE
2012,0.4027231477383789,2025-04-24 22:51:05.238922,2025-04-24 22:51:09.665035,0 days 00:00:04.426113,True,squared_error,36,,2,5,981,TPESampler,COMPLETE
2013,0.4161905290006526,2025-04-24 22:51:09.767839,2025-04-24 22:51:13.963242,0 days 00:00:04.195403,True,squared_error,35,,3,4,857,TPESampler,COMPLETE
2014,1.04370154857227,2025-04-24 22:51:09.868616,2025-04-24 22:51:12.980923,0 days 00:00:03.112307,True,absolute_error,24,log2,1,11,293,TPESampler,COMPLETE
2015,1.3330312682672885,2025-04-24 22:51:13.167685,2025-04-24 22:51:13.928407,0 days 00:00:00.760722,False,squared_error,49,log2,12,7,219,TPESampler,COMPLETE
2016,0.41603955135277726,2025-04-24 22:51:14.085601,2025-04-24 22:51:18.685916,0 days 00:00:04.600315,True,squared_error,36,,3,2,864,TPESampler,COMPLETE
2017,1.2798434864261676,2025-04-24 22:51:14.128250,2025-04-24 22:51:15.947925,0 days 00:00:01.819675,False,squared_error,49,log2,4,4,959,TPESampler,COMPLETE
2018,1.26017640417548,2025-04-24 22:51:16.173828,2025-04-24 22:51:19.157892,0 days 00:00:02.984064,True,absolute_error,23,sqrt,5,14,853,TPESampler,COMPLETE
2019,0.4022832800052251,2025-04-24 22:51:19.044156,2025-04-24 22:51:23.780171,0 days 00:00:04.736015,True,squared_error,43,,2,4,994,TPESampler,COMPLETE
2020,0.5730184394355173,2025-04-24 22:51:19.400243,2025-04-24 22:51:29.960635,0 days 00:00:10.560392,False,absolute_error,33,,6,4,308,TPESampler,COMPLETE
2021,0.46698697098428954,2025-04-24 22:51:23.967635,2025-04-24 22:51:27.842751,0 days 00:00:03.875116,True,squared_error,22,,5,7,931,TPESampler,COMPLETE
2022,0.4022333352922416,2025-04-24 22:51:25.802034,2025-04-24 22:51:31.326062,0 days 00:00:05.524028,True,squared_error,35,,2,4,990,TPESampler,COMPLETE
2023,0.4025462427317371,2025-04-24 22:51:28.022568,2025-04-24 22:51:33.953989,0 days 00:00:05.931421,True,squared_error,27,,2,3,988,TPESampler,COMPLETE
2024,0.5820954844836608,2025-04-24 22:51:30.145305,2025-04-24 22:51:32.775138,0 days 00:00:02.629833,True,squared_error,36,sqrt,1,5,771,TPESampler,COMPLETE
2025,0.4024818209716682,2025-04-24 22:51:31.511491,2025-04-24 22:51:36.564756,0 days 00:00:05.053265,True,squared_error,39,,2,2,851,TPESampler,COMPLETE
2026,0.4088812836562661,2025-04-24 22:51:32.966857,2025-04-24 22:51:39.696020,0 days 00:00:06.729163,True,squared_error,28,,1,4,976,TPESampler,COMPLETE
2027,0.4400352206171187,2025-04-24 22:51:34.144282,2025-04-24 22:51:36.719286,0 days 00:00:02.575004,True,squared_error,33,,4,3,569,TPESampler,COMPLETE
2028,1.0942713616984903,2025-04-24 22:51:36.726113,2025-04-24 22:51:37.723223,0 days 00:00:00.997110,True,squared_error,8,sqrt,2,49,193,TPESampler,COMPLETE
2029,0.4042582030590497,2025-04-24 22:51:36.952508,2025-04-24 22:51:42.238176,0 days 00:00:05.285668,True,squared_error,18,,2,4,865,TPESampler,COMPLETE
2030,0.43965618716663735,2025-04-24 22:51:38.158667,2025-04-24 22:51:42.785835,0 days 00:00:04.627168,True,squared_error,27,,4,4,999,TPESampler,COMPLETE
2031,0.42892045733843565,2025-04-24 22:51:39.882309,2025-04-24 22:51:45.942917,0 days 00:00:06.060608,False,squared_error,34,,3,2,977,TPESampler,COMPLETE
2032,0.41919926843792127,2025-04-24 22:51:42.419633,2025-04-24 22:51:48.399081,0 days 00:00:05.979448,True,squared_error,40,,1,3,905,TPESampler,COMPLETE
2033,0.40877058945406186,2025-04-24 22:51:42.991220,2025-04-24 22:51:49.088924,0 days 00:00:06.097704,True,squared_error,36,,1,4,996,TPESampler,COMPLETE
2034,0.5378228230886907,2025-04-24 22:51:46.133230,2025-04-24 22:51:50.055414,0 days 00:00:03.922184,True,absolute_error,35,,5,2,175,TPESampler,COMPLETE
2035,0.4396571537552967,2025-04-24 22:51:48.580755,2025-04-24 22:51:53.500512,0 days 00:00:04.919757,True,squared_error,25,,4,2,990,TPESampler,COMPLETE
2036,0.4026978853782508,2025-04-24 22:51:49.509412,2025-04-24 22:51:55.209509,0 days 00:00:05.700097,True,squared_error,27,,2,3,998,TPESampler,COMPLETE
2037,0.4164941683800708,2025-04-24 22:51:50.509561,2025-04-24 22:51:55.294495,0 days 00:00:04.784934,True,squared_error,45,,3,3,994,TPESampler,COMPLETE
2038,0.4023745103445129,2025-04-24 22:51:53.690080,2025-04-24 22:51:59.715424,0 days 00:00:06.025344,True,squared_error,42,,2,2,998,TPESampler,COMPLETE
2039,0.4711778287940131,2025-04-24 22:51:55.384281,2025-04-24 22:53:37.522486,0 days 00:01:42.138205,False,absolute_error,42,,1,2,822,TPESampler,COMPLETE
2040,1.319788075132756,2025-04-24 22:51:55.503881,2025-04-24 22:51:57.657410,0 days 00:00:02.153529,True,squared_error,30,log2,5,5,977,TPESampler,COMPLETE
2041,0.40230045900355177,2025-04-24 22:51:57.839834,2025-04-24 22:52:02.865563,0 days 00:00:05.025729,True,squared_error,40,,2,4,996,TPESampler,COMPLETE
2042,0.4023218971307515,2025-04-24 22:51:59.899779,2025-04-24 22:52:04.909744,0 days 00:00:05.009965,True,squared_error,36,,2,3,995,TPESampler,COMPLETE
2043,0.4026421084832704,2025-04-24 22:52:03.054265,2025-04-24 22:52:07.649813,0 days 00:00:04.595548,True,squared_error,32,,2,2,897,TPESampler,COMPLETE
2044,0.4763418418889821,2025-04-24 22:52:05.094629,2025-04-24 22:52:27.604549,0 days 00:00:22.509920,True,absolute_error,35,,4,3,982,TPESampler,COMPLETE
2045,1.3095254758142363,2025-04-24 22:52:07.831458,2025-04-24 22:52:10.947901,0 days 00:00:03.116443,True,absolute_error,49,log2,2,4,930,TPESampler,COMPLETE
2046,0.4397804718357272,2025-04-24 22:52:11.147919,2025-04-24 22:52:14.949434,0 days 00:00:03.801515,True,squared_error,37,,4,2,983,TPESampler,COMPLETE
2047,0.4025452403263631,2025-04-24 22:52:15.144640,2025-04-24 22:52:19.223467,0 days 00:00:04.078827,True,squared_error,43,,2,2,867,TPESampler,COMPLETE
2048,0.4024498377467935,2025-04-24 22:52:19.419284,2025-04-24 22:52:24.019324,0 days 00:00:04.600040,True,squared_error,30,,2,3,996,TPESampler,COMPLETE
2049,0.40542762887193706,2025-04-24 22:52:24.199104,2025-04-24 22:53:04.426642,0 days 00:00:40.227538,True,absolute_error,37,,2,5,990,TPESampler,COMPLETE
2050,0.4159369533751434,2025-04-24 22:52:27.786252,2025-04-24 22:52:31.271929,0 days 00:00:03.485677,True,squared_error,33,,3,5,833,TPESampler,COMPLETE
2051,0.8488502511617099,2025-04-24 22:52:31.448496,2025-04-24 22:52:33.422942,0 days 00:00:01.974446,True,squared_error,46,sqrt,2,2,981,TPESampler,COMPLETE
2052,0.4023882519845315,2025-04-24 22:52:33.608957,2025-04-24 22:52:37.630995,0 days 00:00:04.022038,True,squared_error,36,,2,4,854,TPESampler,COMPLETE
2053,0.4189200955600012,2025-04-24 22:52:37.806835,2025-04-24 22:52:42.848038,0 days 00:00:05.041203,True,squared_error,34,,1,3,864,TPESampler,COMPLETE
2054,0.40232561648320175,2025-04-24 22:52:43.041074,2025-04-24 22:52:47.727052,0 days 00:00:04.685978,True,squared_error,34,,2,2,999,TPESampler,COMPLETE
2055,0.40285944493506626,2025-04-24 22:52:48.079048,2025-04-24 22:52:52.012523,0 days 00:00:03.933475,True,squared_error,26,,2,2,835,TPESampler,COMPLETE
2056,0.40258612304768887,2025-04-24 22:52:52.194448,2025-04-24 22:52:56.215802,0 days 00:00:04.021354,True,squared_error,30,,2,3,845,TPESampler,COMPLETE
2057,0.4189979469431107,2025-04-24 22:52:56.397810,2025-04-24 22:53:01.276111,0 days 00:00:04.878301,True,squared_error,24,,1,3,870,TPESampler,COMPLETE
2058,1.2294444281052561,2025-04-24 22:53:01.464401,2025-04-24 22:53:03.147925,0 days 00:00:01.683524,True,squared_error,30,log2,2,4,978,TPESampler,COMPLETE
2059,0.40260302127551245,2025-04-24 22:53:03.333230,2025-04-24 22:53:07.912497,0 days 00:00:04.579267,True,squared_error,39,,2,4,875,TPESampler,COMPLETE
2060,0.4393964988545319,2025-04-24 22:53:04.609834,2025-04-24 22:53:08.139919,0 days 00:00:03.530085,True,squared_error,33,,4,4,876,TPESampler,COMPLETE
2061,0.4022832800052251,2025-04-24 22:53:08.099767,2025-04-24 22:53:13.103605,0 days 00:00:05.003838,True,squared_error,37,,2,2,994,TPESampler,COMPLETE
2062,0.4025455459219394,2025-04-24 22:53:08.385586,2025-04-24 22:53:12.868402,0 days 00:00:04.482816,True,squared_error,41,,2,2,864,TPESampler,COMPLETE
2063,0.4165170038975512,2025-04-24 22:53:13.062560,2025-04-24 22:53:17.576866,0 days 00:00:04.514306,True,squared_error,34,,3,3,1000,TPESampler,COMPLETE
2064,0.4190814573428229,2025-04-24 22:53:13.312114,2025-04-24 22:53:19.813242,0 days 00:00:06.501128,True,squared_error,37,,1,3,998,TPESampler,COMPLETE
2065,0.41403296980910437,2025-04-24 22:53:17.809023,2025-04-24 22:53:22.383629,0 days 00:00:04.574606,True,squared_error,41,,2,9,967,TPESampler,COMPLETE
2066,0.4022936022957746,2025-04-24 22:53:20.002014,2025-04-24 22:53:25.065174,0 days 00:00:05.063160,True,squared_error,43,,2,4,1000,TPESampler,COMPLETE
2067,0.4229857399819126,2025-04-24 22:53:22.570586,2025-04-24 22:53:28.344511,0 days 00:00:05.773925,True,squared_error,38,,1,2,842,TPESampler,COMPLETE
2068,0.40547714801480267,2025-04-24 22:53:25.254138,2025-04-24 22:53:30.006672,0 days 00:00:04.752534,True,squared_error,35,,2,6,982,TPESampler,COMPLETE
2069,0.4089930045712123,2025-04-24 22:53:28.531926,2025-04-24 22:53:34.414725,0 days 00:00:05.882799,True,squared_error,29,,1,4,997,TPESampler,COMPLETE
2070,0.4028692195830661,2025-04-24 22:53:30.192261,2025-04-24 22:53:36.924219,0 days 00:00:06.731958,False,squared_error,34,,2,3,988,TPESampler,COMPLETE
2071,0.40857277362102407,2025-04-24 22:53:34.606074,2025-04-24 22:53:39.024950,0 days 00:00:04.418876,True,squared_error,22,,2,7,853,TPESampler,COMPLETE
2072,0.40274341414058074,2025-04-24 22:53:37.124358,2025-04-24 22:53:42.738779,0 days 00:00:05.614421,True,squared_error,25,,2,2,854,TPESampler,COMPLETE
2073,0.7939860423022278,2025-04-24 22:53:37.744714,2025-04-24 22:53:38.962868,0 days 00:00:01.218154,False,squared_error,46,log2,1,21,259,TPESampler,COMPLETE
2074,1.2884024487432935,2025-04-24 22:53:39.116073,2025-04-24 22:53:40.621200,0 days 00:00:01.505127,True,squared_error,27,sqrt,12,2,286,TPESampler,COMPLETE
2075,0.439744526736441,2025-04-24 22:53:39.238932,2025-04-24 22:53:44.358837,0 days 00:00:05.119905,True,squared_error,42,,4,2,984,TPESampler,COMPLETE
2076,0.41294324817444567,2025-04-24 22:53:40.815020,2025-04-24 22:53:46.216346,0 days 00:00:05.401326,True,squared_error,31,,1,8,822,TPESampler,COMPLETE
2077,0.40244260975228585,2025-04-24 22:53:42.928674,2025-04-24 22:53:48.485764,0 days 00:00:05.557090,True,squared_error,32,,2,2,845,TPESampler,COMPLETE
2078,1.289264111268311,2025-04-24 22:53:44.552618,2025-04-24 22:53:46.551942,0 days 00:00:01.999324,True,squared_error,46,log2,3,4,979,TPESampler,COMPLETE
2079,0.4054605217960448,2025-04-24 22:53:46.413864,2025-04-24 22:53:51.461860,0 days 00:00:05.047996,True,squared_error,29,,2,6,836,TPESampler,COMPLETE
2080,0.43965163595953727,2025-04-24 22:53:46.801768,2025-04-24 22:53:51.872576,0 days 00:00:05.070808,True,squared_error,29,,4,2,991,TPESampler,COMPLETE
2081,0.4022918458992212,2025-04-24 22:53:48.683341,2025-04-24 22:53:54.594069,0 days 00:00:05.910728,True,squared_error,32,,2,2,996,TPESampler,COMPLETE
2082,0.4165170038975512,2025-04-24 22:53:51.651906,2025-04-24 22:53:57.583516,0 days 00:00:05.931610,True,squared_error,41,,3,2,1000,TPESampler,COMPLETE
2083,1.331492651243759,2025-04-24 22:53:52.139391,2025-04-24 22:53:53.176966,0 days 00:00:01.037575,False,squared_error,43,log2,10,40,138,TPESampler,COMPLETE
2084,0.42381541193778693,2025-04-24 22:53:53.364323,2025-04-24 22:54:01.283776,0 days 00:00:07.919453,True,squared_error,47,,1,2,990,TPESampler,COMPLETE
2085,1.2664187990149645,2025-04-24 22:53:54.782354,2025-04-24 22:53:55.898702,0 days 00:00:01.116348,False,squared_error,32,sqrt,15,26,574,TPESampler,COMPLETE
2086,1.3449067787842215,2025-04-24 22:53:56.095819,2025-04-24 22:53:57.553915,0 days 00:00:01.458096,True,squared_error,33,log2,9,22,630,TPESampler,COMPLETE
2087,0.4165132721545429,2025-04-24 22:53:57.704996,2025-04-24 22:54:03.081870,0 days 00:00:05.376874,True,squared_error,33,,3,3,998,TPESampler,COMPLETE
2088,0.40225661789919487,2025-04-24 22:53:57.749850,2025-04-24 22:54:03.749794,0 days 00:00:05.999944,True,squared_error,29,,2,4,996,TPESampler,COMPLETE
2089,0.40243998141820003,2025-04-24 22:54:01.476470,2025-04-24 22:54:07.215247,0 days 00:00:05.738777,True,squared_error,34,,2,3,848,TPESampler,COMPLETE
2090,1.3501395058649626,2025-04-24 22:54:03.263238,2025-04-24 22:54:05.538886,0 days 00:00:02.275648,True,squared_error,13,log2,14,4,739,TPESampler,COMPLETE
2091,0.8571780359973219,2025-04-24 22:54:04.296517,2025-04-24 22:54:07.272289,0 days 00:00:02.975772,True,squared_error,31,sqrt,2,3,986,TPESampler,COMPLETE
2092,0.4041791854418711,2025-04-24 22:54:05.733786,2025-04-24 22:54:10.069546,0 days 00:00:04.335760,True,squared_error,42,,2,5,695,TPESampler,COMPLETE
2093,0.43966120850181223,2025-04-24 22:54:07.463804,2025-04-24 22:54:11.702441,0 days 00:00:04.238637,True,squared_error,45,,4,2,791,TPESampler,COMPLETE
2094,0.42457047834514844,2025-04-24 22:54:07.517849,2025-04-24 22:54:15.387422,0 days 00:00:07.869573,True,squared_error,27,,1,2,989,TPESampler,COMPLETE
2095,0.828214166559611,2025-04-24 22:54:10.255179,2025-04-24 22:54:11.788842,0 days 00:00:01.533663,False,squared_error,48,log2,1,30,701,TPESampler,COMPLETE
2096,0.5449605814686346,2025-04-24 22:54:11.854755,2025-04-24 22:54:14.883450,0 days 00:00:03.028695,False,squared_error,32,sqrt,1,4,927,TPESampler,COMPLETE
2097,0.4023774172888807,2025-04-24 22:54:11.979023,2025-04-24 22:54:18.054829,0 days 00:00:06.075806,True,squared_error,21,,2,2,981,TPESampler,COMPLETE
2098,1.1356773547535515,2025-04-24 22:54:15.069108,2025-04-24 22:54:17.051877,0 days 00:00:01.982769,False,squared_error,30,log2,2,4,874,TPESampler,COMPLETE
2099,0.40237662031300964,2025-04-24 22:54:15.609597,2025-04-24 22:54:21.323530,0 days 00:00:05.713933,True,squared_error,40,,2,2,849,TPESampler,COMPLETE
2100,0.7566305480311185,2025-04-24 22:54:17.313304,2025-04-24 22:54:19.963442,0 days 00:00:02.650138,True,squared_error,29,sqrt,1,20,763,TPESampler,COMPLETE
2101,0.4083161231617578,2025-04-24 22:54:18.475692,2025-04-24 22:54:24.059087,0 days 00:00:05.583395,True,squared_error,33,,1,4,819,TPESampler,COMPLETE
2102,0.4022649904552218,2025-04-24 22:54:20.147225,2025-04-24 22:54:25.673617,0 days 00:00:05.526392,True,squared_error,46,,2,2,982,TPESampler,COMPLETE
2103,0.4024115343297506,2025-04-24 22:54:21.510491,2025-04-24 22:54:26.228015,0 days 00:00:04.717524,True,squared_error,29,,2,3,847,TPESampler,COMPLETE
2104,0.4237517176472066,2025-04-24 22:54:24.455327,2025-04-24 22:54:32.181104,0 days 00:00:07.725777,True,squared_error,38,,1,2,985,TPESampler,COMPLETE
2105,1.37138829805091,2025-04-24 22:54:25.852670,2025-04-24 22:54:27.799756,0 days 00:00:01.947086,False,absolute_error,19,log2,5,40,488,TPESampler,COMPLETE
2106,0.4394782227066694,2025-04-24 22:54:26.428568,2025-04-24 22:54:30.495797,0 days 00:00:04.067229,True,squared_error,39,,4,6,868,TPESampler,COMPLETE
2107,0.42682779280761424,2025-04-24 22:54:27.990483,2025-04-24 22:54:58.078344,0 days 00:00:30.087861,True,absolute_error,42,,3,2,989,TPESampler,COMPLETE
2108,0.4025787490369353,2025-04-24 22:54:30.683093,2025-04-24 22:54:35.185858,0 days 00:00:04.502765,True,squared_error,33,,2,3,858,TPESampler,COMPLETE
2109,0.40218817706406623,2025-04-24 22:54:32.368532,2025-04-24 22:54:37.508895,0 days 00:00:05.140363,True,squared_error,31,,2,3,985,TPESampler,COMPLETE
2110,0.4026224011374268,2025-04-24 22:54:35.382834,2025-04-24 22:54:39.879070,0 days 00:00:04.496236,True,squared_error,39,,2,4,862,TPESampler,COMPLETE
2111,0.40246136343630007,2025-04-24 22:54:37.695032,2025-04-24 22:54:42.803824,0 days 00:00:05.108792,True,squared_error,21,,2,2,992,TPESampler,COMPLETE
2112,1.1476843952381315,2025-04-24 22:54:40.091889,2025-04-24 22:54:42.504267,0 days 00:00:02.412378,True,squared_error,42,sqrt,5,3,961,TPESampler,COMPLETE
2113,0.7161585140345316,2025-04-24 22:54:42.886397,2025-04-24 22:54:44.161378,0 days 00:00:01.274981,False,squared_error,29,log2,1,2,117,TPESampler,COMPLETE
2114,0.439759650485895,2025-04-24 22:54:43.000497,2025-04-24 22:54:47.571097,0 days 00:00:04.570600,True,squared_error,19,,4,4,985,TPESampler,COMPLETE
2115,0.41651183820046933,2025-04-24 22:54:44.375544,2025-04-24 22:54:48.811622,0 days 00:00:04.436078,True,squared_error,40,,3,2,999,TPESampler,COMPLETE
2116,1.310198726265307,2025-04-24 22:54:47.757408,2025-04-24 22:54:49.401256,0 days 00:00:01.643848,True,absolute_error,37,log2,2,12,311,TPESampler,COMPLETE
2117,0.440122045559904,2025-04-24 22:54:49.000296,2025-04-24 22:54:52.241582,0 days 00:00:03.241286,True,squared_error,29,,4,2,657,TPESampler,COMPLETE
2118,0.4022832800052251,2025-04-24 22:54:49.659931,2025-04-24 22:54:54.884908,0 days 00:00:05.224977,True,squared_error,35,,2,3,994,TPESampler,COMPLETE
2119,0.4158805606441679,2025-04-24 22:54:52.431750,2025-04-24 22:54:56.503328,0 days 00:00:04.071578,True,squared_error,32,,3,3,838,TPESampler,COMPLETE
2120,0.40378455759668885,2025-04-24 22:54:55.076626,2025-04-24 22:55:01.659338,0 days 00:00:06.582712,True,squared_error,38,,1,5,995,TPESampler,COMPLETE
2121,0.558230808144398,2025-04-24 22:54:56.704917,2025-04-24 22:55:00.217996,0 days 00:00:03.513079,True,squared_error,29,sqrt,1,2,969,TPESampler,COMPLETE
