number,value,datetime_start,datetime_complete,duration,params_bootstrap,params_criterion,params_max_depth,params_max_features,params_min_samples_leaf,params_min_samples_split,params_n_estimators,system_attrs_auto:sampler,state
0,1.3054537155835242,2025-04-24 21:33:55.536884,2025-04-24 21:33:57.651243,0 days 00:00:02.114359,True,squared_error,35,sqrt,13,2,626,RandomSampler,COMPLETE
1,1.3024592888596749,2025-04-24 21:33:55.552566,2025-04-24 21:33:56.566906,0 days 00:00:01.014340,False,squared_error,40,log2,6,3,319,RandomSampler,COMPLETE
2,1.1823314338130184,2025-04-24 21:33:55.613193,2025-04-24 21:33:56.970487,0 days 00:00:01.357294,True,absolute_error,38,sqrt,4,2,122,RandomSampler,COMPLETE
3,1.2753128250056536,2025-04-24 21:33:56.754385,2025-04-24 21:33:58.375609,0 days 00:00:01.621224,True,squared_error,6,log2,2,14,485,TPESampler,COMPLETE
4,0.616946988934491,2025-04-24 21:33:57.156640,2025-04-24 21:34:26.138956,0 days 00:00:28.982316,True,absolute_error,32,,3,32,971,TPESampler,COMPLETE
5,0.7660775310243318,2025-04-24 21:33:58.105312,2025-04-24 21:34:03.797512,0 days 00:00:05.692200,False,absolute_error,31,sqrt,1,14,248,TPESampler,COMPLETE
6,0.9837913054152824,2025-04-24 21:33:58.632466,2025-04-24 21:33:59.549130,0 days 00:00:00.916664,True,squared_error,25,sqrt,3,2,372,TPESampler,COMPLETE
7,0.9644052883931774,2025-04-24 21:33:59.705333,2025-04-24 21:34:09.395128,0 days 00:00:09.689795,True,absolute_error,25,log2,1,2,966,TPESampler,COMPLETE
8,0.43959725470757366,2025-04-24 21:34:03.957637,2025-04-24 21:34:07.415008,0 days 00:00:03.457371,True,squared_error,16,,4,2,912,TPESampler,COMPLETE
9,1.2154379728069364,2025-04-24 21:34:07.572435,2025-04-24 21:34:11.150053,0 days 00:00:03.577618,True,absolute_error,22,sqrt,4,2,777,TPESampler,COMPLETE
10,1.102041811148199,2025-04-24 21:34:09.551437,2025-04-24 21:34:10.634334,0 days 00:00:01.082897,False,squared_error,10,sqrt,5,3,651,TPESampler,COMPLETE
11,1.2777852866396249,2025-04-24 21:34:10.791319,2025-04-24 21:34:12.543591,0 days 00:00:01.752272,True,squared_error,27,sqrt,10,46,806,TPESampler,COMPLETE
12,0.40843025748123385,2025-04-24 21:34:11.496686,2025-04-24 21:34:15.177604,0 days 00:00:03.680918,True,squared_error,35,,2,7,787,TPESampler,COMPLETE
13,0.7604584284168412,2025-04-24 21:34:12.706759,2025-04-24 21:34:19.015377,0 days 00:00:06.308618,False,absolute_error,28,sqrt,1,13,281,TPESampler,COMPLETE
14,0.4026850644386286,2025-04-24 21:34:15.337093,2025-04-24 21:34:19.575859,0 days 00:00:04.238766,True,squared_error,40,,2,3,895,TPESampler,COMPLETE
15,0.734554616820509,2025-04-24 21:34:19.172616,2025-04-24 21:34:22.067906,0 days 00:00:02.895290,True,squared_error,8,,15,2,864,TPESampler,COMPLETE
16,0.4131100721243277,2025-04-24 21:34:19.961965,2025-04-24 21:34:23.565429,0 days 00:00:03.603464,True,squared_error,31,,1,8,641,TPESampler,COMPLETE
17,0.42291507217710267,2025-04-24 21:34:22.240505,2025-04-24 21:34:28.644275,0 days 00:00:06.403770,True,squared_error,44,,1,2,835,TPESampler,COMPLETE
18,0.7765551720384576,2025-04-24 21:34:23.718221,2025-04-24 21:34:25.698286,0 days 00:00:01.980065,True,squared_error,45,log2,1,9,948,TPESampler,COMPLETE
19,0.5407436209224596,2025-04-24 21:34:25.850890,2025-04-24 21:34:30.174061,0 days 00:00:04.323171,True,squared_error,40,,7,2,948,TPESampler,COMPLETE
20,0.42471144825585394,2025-04-24 21:34:26.594099,2025-04-24 21:34:30.970798,0 days 00:00:04.376699,True,squared_error,39,,3,9,961,TPESampler,COMPLETE
21,0.9937204277758153,2025-04-24 21:34:28.806499,2025-04-24 21:34:30.203933,0 days 00:00:01.397434,True,squared_error,45,sqrt,3,12,523,TPESampler,COMPLETE
22,0.4132700884212515,2025-04-24 21:34:30.301887,2025-04-24 21:34:34.317488,0 days 00:00:04.015601,True,squared_error,24,,1,8,671,TPESampler,COMPLETE
23,0.43460533898219644,2025-04-24 21:34:30.347890,2025-04-24 21:34:34.294651,0 days 00:00:03.946761,False,squared_error,30,,2,14,606,TPESampler,COMPLETE
24,0.5089993749887598,2025-04-24 21:34:31.440453,2025-04-24 21:34:34.769066,0 days 00:00:03.328613,True,squared_error,41,,1,23,744,TPESampler,COMPLETE
25,0.42693312765633834,2025-04-24 21:34:34.435902,2025-04-24 21:35:00.184653,0 days 00:00:25.748751,True,absolute_error,35,,3,3,867,TPESampler,COMPLETE
26,0.6348671640255977,2025-04-24 21:34:34.485400,2025-04-24 21:34:37.791161,0 days 00:00:03.305761,True,squared_error,25,sqrt,1,4,903,TPESampler,COMPLETE
27,1.2832016215866984,2025-04-24 21:34:35.023932,2025-04-24 21:34:36.875179,0 days 00:00:01.851247,False,squared_error,40,log2,4,2,858,TPESampler,COMPLETE
28,0.5097563505765236,2025-04-24 21:34:37.044873,2025-04-24 21:35:14.316418,0 days 00:00:37.271545,True,absolute_error,38,,1,14,551,TPESampler,COMPLETE
29,1.3278905007322268,2025-04-24 21:34:37.947458,2025-04-24 21:34:39.112850,0 days 00:00:01.165392,True,squared_error,30,log2,6,8,685,TPESampler,COMPLETE
30,0.473042024995102,2025-04-24 21:34:39.265771,2025-04-24 21:34:43.422802,0 days 00:00:04.157031,False,squared_error,40,,1,3,485,TPESampler,COMPLETE
31,0.4103076149261911,2025-04-24 21:34:43.578981,2025-04-24 21:34:45.071890,0 days 00:00:01.492909,True,squared_error,24,,2,8,271,TPESampler,COMPLETE
32,0.41825571801589223,2025-04-24 21:34:45.232753,2025-04-24 21:34:47.169814,0 days 00:00:01.937061,True,squared_error,18,,3,7,419,TPESampler,COMPLETE
33,0.42892161287199765,2025-04-24 21:34:47.332384,2025-04-24 21:34:48.458619,0 days 00:00:01.126235,False,squared_error,36,,3,5,127,TPESampler,COMPLETE
34,1.2514970472606166,2025-04-24 21:34:48.609899,2025-04-24 21:34:49.300406,0 days 00:00:00.690507,True,squared_error,30,log2,2,6,159,TPESampler,COMPLETE
35,0.4095694011484268,2025-04-24 21:34:49.463450,2025-04-24 21:34:50.788777,0 days 00:00:01.325327,True,squared_error,25,,1,6,190,TPESampler,COMPLETE
36,0.40830743469823116,2025-04-24 21:34:50.942807,2025-04-24 21:34:52.131537,0 days 00:00:01.188730,True,squared_error,26,,1,6,158,TPESampler,COMPLETE
37,0.44425749811301607,2025-04-24 21:34:52.293885,2025-04-24 21:35:03.028495,0 days 00:00:10.734610,True,absolute_error,9,,1,7,185,TPESampler,COMPLETE
38,0.8459964399840543,2025-04-24 21:35:00.351131,2025-04-24 21:35:02.000482,0 days 00:00:01.649351,True,squared_error,48,sqrt,2,3,791,TPESampler,COMPLETE
39,0.6936943075106657,2025-04-24 21:35:02.151617,2025-04-24 21:35:02.819450,0 days 00:00:00.667833,True,squared_error,31,sqrt,1,10,105,TPESampler,COMPLETE
40,0.9459762283157096,2025-04-24 21:35:02.988536,2025-04-24 21:35:03.944051,0 days 00:00:00.955515,False,squared_error,20,log2,1,9,255,TPESampler,COMPLETE
41,0.4185366229040662,2025-04-24 21:35:03.230925,2025-04-24 21:35:05.410406,0 days 00:00:02.179481,True,squared_error,21,,1,2,228,TPESampler,COMPLETE
42,0.40287043115321564,2025-04-24 21:35:04.119577,2025-04-24 21:35:10.415562,0 days 00:00:06.295985,False,squared_error,47,,2,3,920,TPESampler,COMPLETE
43,0.4368514906320873,2025-04-24 21:35:05.568514,2025-04-24 21:35:06.452807,0 days 00:00:00.884293,True,squared_error,18,,2,13,104,TPESampler,COMPLETE
44,0.4070144780458994,2025-04-24 21:35:06.606792,2025-04-24 21:35:08.466058,0 days 00:00:01.859266,True,squared_error,29,,1,7,312,TPESampler,COMPLETE
45,0.4086667145012311,2025-04-24 21:35:08.622183,2025-04-24 21:35:09.592299,0 days 00:00:00.970116,True,squared_error,23,,1,5,105,TPESampler,COMPLETE
46,0.4228361704576001,2025-04-24 21:35:09.759143,2025-04-24 21:35:11.440725,0 days 00:00:01.681582,False,squared_error,29,,1,5,149,TPESampler,COMPLETE
47,0.4028684569589126,2025-04-24 21:35:10.629311,2025-04-24 21:35:17.375221,0 days 00:00:06.745910,False,squared_error,45,,2,3,938,TPESampler,COMPLETE
48,0.4038943387055016,2025-04-24 21:35:11.605512,2025-04-24 21:35:14.890829,0 days 00:00:03.285317,True,squared_error,39,,2,4,659,TPESampler,COMPLETE
49,0.45485558264005044,2025-04-24 21:35:14.484135,2025-04-24 21:35:16.112063,0 days 00:00:01.627928,True,squared_error,37,,1,15,202,TPESampler,COMPLETE
50,0.9234436517834907,2025-04-24 21:35:15.135042,2025-04-24 21:35:26.767015,0 days 00:00:11.631973,False,absolute_error,36,sqrt,2,3,764,TPESampler,COMPLETE
51,0.4170562133919163,2025-04-24 21:35:16.268776,2025-04-24 21:35:19.297747,0 days 00:00:03.028971,True,squared_error,44,,3,2,600,TPESampler,COMPLETE
52,0.42848096617772974,2025-04-24 21:35:17.531189,2025-04-24 21:35:24.453759,0 days 00:00:06.922570,False,squared_error,38,,1,7,959,TPESampler,COMPLETE
53,0.4652429964236937,2025-04-24 21:35:19.463371,2025-04-24 21:35:23.160185,0 days 00:00:03.696814,False,squared_error,41,,6,4,761,TPESampler,COMPLETE
54,0.40287110712684776,2025-04-24 21:35:23.326236,2025-04-24 21:35:29.378234,0 days 00:00:06.051998,False,squared_error,40,,2,2,848,TPESampler,COMPLETE
55,0.4028691523583126,2025-04-24 21:35:24.618841,2025-04-24 21:35:31.690105,0 days 00:00:07.071264,False,squared_error,48,,2,4,954,TPESampler,COMPLETE
56,0.5907998740523049,2025-04-24 21:35:26.928251,2025-04-24 21:35:29.582452,0 days 00:00:02.654201,False,squared_error,47,log2,1,2,753,TPESampler,COMPLETE
57,0.48130820397949686,2025-04-24 21:35:29.548644,2025-04-24 21:37:13.396646,0 days 00:01:43.848002,False,absolute_error,48,,1,3,830,TPESampler,COMPLETE
58,0.46719866460031356,2025-04-24 21:35:29.783590,2025-04-24 21:35:37.063534,0 days 00:00:07.279944,False,squared_error,33,,1,2,786,TPESampler,COMPLETE
59,0.40266076218695634,2025-04-24 21:35:32.066504,2025-04-24 21:35:37.351357,0 days 00:00:05.284853,False,squared_error,49,,2,5,828,TPESampler,COMPLETE
60,0.4668808427166325,2025-04-24 21:35:37.228076,2025-04-24 21:35:45.787328,0 days 00:00:08.559252,False,squared_error,50,,1,2,892,TPESampler,COMPLETE
61,0.8780620508449921,2025-04-24 21:35:37.500135,2025-04-24 21:35:39.325741,0 days 00:00:01.825606,False,squared_error,39,sqrt,3,5,911,TPESampler,COMPLETE
62,0.4289204245024861,2025-04-24 21:35:39.485370,2025-04-24 21:35:44.756567,0 days 00:00:05.271197,False,squared_error,38,,3,3,952,TPESampler,COMPLETE
63,0.40287318488527923,2025-04-24 21:35:44.918960,2025-04-24 21:35:50.109314,0 days 00:00:05.190354,False,squared_error,40,,2,4,749,TPESampler,COMPLETE
64,0.4289216482563856,2025-04-24 21:35:45.958765,2025-04-24 21:35:50.619274,0 days 00:00:04.660509,False,squared_error,49,,3,2,808,TPESampler,COMPLETE
65,0.7788640554755802,2025-04-24 21:35:50.269654,2025-04-24 21:35:51.846190,0 days 00:00:01.576536,False,squared_error,48,sqrt,2,7,547,TPESampler,COMPLETE
66,0.4150771990923648,2025-04-24 21:35:50.923854,2025-04-24 21:35:56.052786,0 days 00:00:05.128932,False,squared_error,41,,2,6,784,TPESampler,COMPLETE
67,0.42207033605282096,2025-04-24 21:35:52.013722,2025-04-24 21:35:57.857757,0 days 00:00:05.844035,False,squared_error,50,,2,8,928,TPESampler,COMPLETE
68,0.40287076873215666,2025-04-24 21:35:56.246629,2025-04-24 21:36:03.028242,0 days 00:00:06.781613,False,squared_error,48,,2,3,919,TPESampler,COMPLETE
69,0.4083492121235719,2025-04-24 21:35:58.033664,2025-04-24 21:36:01.981560,0 days 00:00:03.947896,True,squared_error,50,,2,7,905,TPESampler,COMPLETE
70,1.3560371665001394,2025-04-24 21:36:02.158311,2025-04-24 21:36:04.953712,0 days 00:00:02.795401,True,absolute_error,45,log2,3,4,887,TPESampler,COMPLETE
71,0.49219005380707637,2025-04-24 21:36:03.210425,2025-04-24 21:36:58.310464,0 days 00:00:55.100039,False,absolute_error,30,,3,4,956,TPESampler,COMPLETE
72,0.4028681164801486,2025-04-24 21:36:05.116297,2025-04-24 21:36:11.224139,0 days 00:00:06.107842,False,squared_error,43,,2,2,935,TPESampler,COMPLETE
73,0.402589574643328,2025-04-24 21:36:11.767775,2025-04-24 21:36:15.772418,0 days 00:00:04.004643,True,squared_error,38,,2,2,860,TPESampler,COMPLETE
74,0.4022457716135221,2025-04-24 21:36:15.961106,2025-04-24 21:36:20.444114,0 days 00:00:04.483008,True,squared_error,44,,2,2,974,TPESampler,COMPLETE
75,0.40252821490147556,2025-04-24 21:36:20.612753,2025-04-24 21:36:24.475952,0 days 00:00:03.863199,True,squared_error,37,,2,2,812,TPESampler,COMPLETE
76,1.2303474900325166,2025-04-24 21:36:24.648774,2025-04-24 21:36:26.054467,0 days 00:00:01.405693,True,squared_error,34,log2,2,2,803,TPESampler,COMPLETE
77,0.40217779514697144,2025-04-24 21:36:26.218800,2025-04-24 21:36:30.673984,0 days 00:00:04.455184,True,squared_error,46,,2,2,971,TPESampler,COMPLETE
78,0.41641695308756965,2025-04-24 21:36:30.831300,2025-04-24 21:36:34.828760,0 days 00:00:03.997460,True,squared_error,46,,3,3,989,TPESampler,COMPLETE
79,0.4235551354055436,2025-04-24 21:36:35.000894,2025-04-24 21:36:40.936892,0 days 00:00:05.935998,True,squared_error,38,,1,2,944,TPESampler,COMPLETE
80,0.4161605557438797,2025-04-24 21:36:41.104383,2025-04-24 21:36:44.767749,0 days 00:00:03.663366,True,squared_error,32,,3,2,892,TPESampler,COMPLETE
81,0.4158056030853524,2025-04-24 21:36:44.927659,2025-04-24 21:37:44.994599,0 days 00:01:00.066940,True,absolute_error,43,,1,4,863,TPESampler,COMPLETE
82,0.40247486633039964,2025-04-24 21:36:58.474745,2025-04-24 21:37:02.222505,0 days 00:00:03.747760,True,squared_error,43,,2,2,796,TPESampler,COMPLETE
83,0.40254484494269976,2025-04-24 21:37:02.383347,2025-04-24 21:37:06.264237,0 days 00:00:03.880890,True,squared_error,39,,2,2,833,TPESampler,COMPLETE
84,0.4160082396424798,2025-04-24 21:37:06.427197,2025-04-24 21:37:09.842265,0 days 00:00:03.415068,True,squared_error,48,,3,2,823,TPESampler,COMPLETE
85,0.9712967285128232,2025-04-24 21:37:10.027055,2025-04-24 21:37:11.616214,0 days 00:00:01.589159,True,squared_error,31,sqrt,3,3,869,TPESampler,COMPLETE
86,0.40287975309412966,2025-04-24 21:37:11.774988,2025-04-24 21:37:46.714910,0 days 00:00:34.939922,True,absolute_error,50,,2,2,839,TPESampler,COMPLETE
87,0.40260628097815315,2025-04-24 21:37:13.557021,2025-04-24 21:37:17.655416,0 days 00:00:04.098395,True,squared_error,44,,2,3,870,TPESampler,COMPLETE
88,0.40345781407644027,2025-04-24 21:37:17.813997,2025-04-24 21:37:21.398998,0 days 00:00:03.585001,True,squared_error,31,,2,2,742,TPESampler,COMPLETE
89,0.4025565501301357,2025-04-24 21:37:21.557645,2025-04-24 21:37:25.884459,0 days 00:00:04.326814,True,squared_error,42,,2,3,932,TPESampler,COMPLETE
90,0.4022832800052251,2025-04-24 21:37:26.048609,2025-04-24 21:37:30.594760,0 days 00:00:04.546151,True,squared_error,46,,2,2,994,TPESampler,COMPLETE
91,0.40251332426735736,2025-04-24 21:37:30.754632,2025-04-24 21:37:34.942295,0 days 00:00:04.187663,True,squared_error,47,,2,2,908,TPESampler,COMPLETE
92,0.42367257090131827,2025-04-24 21:37:35.102120,2025-04-24 21:37:41.124392,0 days 00:00:06.022272,True,squared_error,47,,1,2,940,TPESampler,COMPLETE
93,1.2294735897551223,2025-04-24 21:37:41.291506,2025-04-24 21:37:42.794219,0 days 00:00:01.502713,True,squared_error,46,log2,2,3,851,TPESampler,COMPLETE
94,0.40222958926160896,2025-04-24 21:37:42.949894,2025-04-24 21:37:48.175694,0 days 00:00:05.225800,True,squared_error,42,,2,2,983,TPESampler,COMPLETE
95,0.4037424365898391,2025-04-24 21:37:45.196441,2025-04-24 21:37:49.489715,0 days 00:00:04.293274,True,squared_error,42,,2,2,696,TPESampler,COMPLETE
96,0.40271034541138323,2025-04-24 21:37:46.890690,2025-04-24 21:37:52.131524,0 days 00:00:05.240834,True,squared_error,34,,2,5,964,TPESampler,COMPLETE
97,0.4025452403263631,2025-04-24 21:37:48.347729,2025-04-24 21:37:53.206258,0 days 00:00:04.858529,True,squared_error,37,,2,2,867,TPESampler,COMPLETE
98,0.402216389485944,2025-04-24 21:37:49.656353,2025-04-24 21:37:55.104653,0 days 00:00:05.448300,True,squared_error,45,,2,2,981,TPESampler,COMPLETE
99,0.40259858094523027,2025-04-24 21:37:52.300564,2025-04-24 21:37:57.852978,0 days 00:00:05.552414,True,squared_error,46,,2,2,858,TPESampler,COMPLETE
100,0.500137020835675,2025-04-24 21:37:53.396219,2025-04-24 21:37:57.092090,0 days 00:00:03.695871,True,squared_error,41,sqrt,1,2,892,TPESampler,COMPLETE
101,1.3448755815603475,2025-04-24 21:37:55.262810,2025-04-24 21:37:56.401561,0 days 00:00:01.138751,False,squared_error,22,log2,15,23,660,TPESampler,COMPLETE
102,1.403188696530632,2025-04-24 21:37:56.588315,2025-04-24 21:37:58.559888,0 days 00:00:01.971573,True,absolute_error,26,log2,13,3,588,TPESampler,COMPLETE
103,0.40226933609690013,2025-04-24 21:37:57.459554,2025-04-24 21:38:03.444997,0 days 00:00:05.985443,True,squared_error,46,,2,2,952,TPESampler,COMPLETE
104,1.3789731285639515,2025-04-24 21:37:58.337471,2025-04-24 21:38:00.102413,0 days 00:00:01.764942,False,absolute_error,9,log2,6,10,491,TPESampler,COMPLETE
105,0.43969894267763593,2025-04-24 21:37:58.753483,2025-04-24 21:38:03.675069,0 days 00:00:04.921586,True,squared_error,39,,4,2,994,TPESampler,COMPLETE
106,0.9726759755721076,2025-04-24 21:38:00.267499,2025-04-24 21:38:01.789912,0 days 00:00:01.522413,True,squared_error,13,sqrt,1,49,604,TPESampler,COMPLETE
107,0.40220373140675525,2025-04-24 21:38:01.960391,2025-04-24 21:38:07.339903,0 days 00:00:05.379512,True,squared_error,44,,2,4,980,TPESampler,COMPLETE
108,0.40239747526318437,2025-04-24 21:38:03.614384,2025-04-24 21:38:09.080654,0 days 00:00:05.466270,True,squared_error,46,,2,2,941,TPESampler,COMPLETE
109,0.626669702940924,2025-04-24 21:38:03.863861,2025-04-24 21:38:07.236700,0 days 00:00:03.372839,True,squared_error,45,log2,1,2,993,TPESampler,COMPLETE
110,1.159699035631995,2025-04-24 21:38:07.403154,2025-04-24 21:38:08.883357,0 days 00:00:01.480203,False,squared_error,46,log2,2,29,523,TPESampler,COMPLETE
111,1.0008699243547792,2025-04-24 21:38:07.501380,2025-04-24 21:38:10.509652,0 days 00:00:03.008272,False,squared_error,16,log2,1,2,989,TPESampler,COMPLETE
112,0.4026714069856485,2025-04-24 21:38:09.048568,2025-04-24 21:38:13.903856,0 days 00:00:04.855288,True,squared_error,50,,2,2,880,TPESampler,COMPLETE
113,0.4022595238614904,2025-04-24 21:38:09.233491,2025-04-24 21:38:14.496356,0 days 00:00:05.262865,True,squared_error,48,,2,2,962,TPESampler,COMPLETE
114,1.2704850255723397,2025-04-24 21:38:10.688689,2025-04-24 21:38:16.848848,0 days 00:00:06.160159,False,absolute_error,27,log2,2,15,909,TPESampler,COMPLETE
115,0.84779690014399,2025-04-24 21:38:14.095687,2025-04-24 21:38:16.540379,0 days 00:00:02.444692,True,squared_error,48,sqrt,2,2,933,TPESampler,COMPLETE
116,0.4022832800052251,2025-04-24 21:38:15.050644,2025-04-24 21:38:20.755923,0 days 00:00:05.705279,True,squared_error,47,,2,3,994,TPESampler,COMPLETE
117,1.3243816494622427,2025-04-24 21:38:16.714528,2025-04-24 21:38:18.679588,0 days 00:00:01.965060,True,squared_error,47,log2,6,2,839,TPESampler,COMPLETE
118,0.9364164653488228,2025-04-24 21:38:17.008413,2025-04-24 21:38:29.087821,0 days 00:00:12.079408,True,absolute_error,24,sqrt,1,34,951,TPESampler,COMPLETE
119,1.273040458599331,2025-04-24 21:38:18.848870,2025-04-24 21:38:20.338965,0 days 00:00:01.490095,False,absolute_error,9,sqrt,6,26,243,TPESampler,COMPLETE
120,0.43068573871947385,2025-04-24 21:38:20.505684,2025-04-24 21:38:54.930733,0 days 00:00:34.425049,True,absolute_error,35,,1,2,435,TPESampler,COMPLETE
121,0.4022324925345733,2025-04-24 21:38:20.916283,2025-04-24 21:38:25.588498,0 days 00:00:04.672215,True,squared_error,47,,2,3,989,TPESampler,COMPLETE
122,0.4165119353507597,2025-04-24 21:38:25.753183,2025-04-24 21:38:30.176899,0 days 00:00:04.423716,True,squared_error,47,,3,4,997,TPESampler,COMPLETE
123,0.4022828135384401,2025-04-24 21:38:29.271163,2025-04-24 21:38:34.121869,0 days 00:00:04.850706,True,squared_error,46,,2,3,984,TPESampler,COMPLETE
124,0.4026234296805454,2025-04-24 21:38:30.351427,2025-04-24 21:38:34.612091,0 days 00:00:04.260664,True,squared_error,49,,2,2,902,TPESampler,COMPLETE
125,0.40881866520866456,2025-04-24 21:38:34.292210,2025-04-24 21:38:39.400399,0 days 00:00:05.108189,True,squared_error,40,,1,7,963,TPESampler,COMPLETE
126,0.4027394930179356,2025-04-24 21:38:34.768989,2025-04-24 21:39:19.302386,0 days 00:00:44.533397,True,absolute_error,37,,2,2,965,TPESampler,COMPLETE
127,0.4023745103445129,2025-04-24 21:38:39.560612,2025-04-24 21:38:44.179486,0 days 00:00:04.618874,True,squared_error,48,,2,2,998,TPESampler,COMPLETE
128,1.3651069515085401,2025-04-24 21:38:44.368986,2025-04-24 21:38:45.493793,0 days 00:00:01.124807,True,absolute_error,29,sqrt,14,15,465,TPESampler,COMPLETE
129,0.5484305175412846,2025-04-24 21:38:45.656150,2025-04-24 21:39:03.924692,0 days 00:00:18.268542,True,absolute_error,49,sqrt,1,2,951,TPESampler,COMPLETE
130,1.3850682137211248,2025-04-24 21:38:55.092331,2025-04-24 21:38:56.219012,0 days 00:00:01.126681,True,absolute_error,47,log2,6,16,426,TPESampler,COMPLETE
131,0.4023780983546472,2025-04-24 21:38:56.383388,2025-04-24 21:39:00.869424,0 days 00:00:04.486036,True,squared_error,50,,2,3,960,TPESampler,COMPLETE
132,1.3030387588530932,2025-04-24 21:39:01.031532,2025-04-24 21:39:01.694044,0 days 00:00:00.662512,True,squared_error,37,sqrt,12,11,141,TPESampler,COMPLETE
133,0.7108544830248985,2025-04-24 21:39:01.858819,2025-04-24 21:39:02.725753,0 days 00:00:00.866934,False,squared_error,49,,6,46,101,TPESampler,COMPLETE
134,0.4163606654103958,2025-04-24 21:39:02.889879,2025-04-24 21:39:07.266018,0 days 00:00:04.376139,True,squared_error,44,,3,2,973,TPESampler,COMPLETE
135,0.4228571447268725,2025-04-24 21:39:04.093536,2025-04-24 21:39:10.748764,0 days 00:00:06.655228,True,squared_error,46,,1,2,997,TPESampler,COMPLETE
136,0.4027371660435327,2025-04-24 21:39:07.441460,2025-04-24 21:39:11.964592,0 days 00:00:04.523132,True,squared_error,44,,2,5,969,TPESampler,COMPLETE
137,0.8890313219268776,2025-04-24 21:39:10.907821,2025-04-24 21:39:11.754332,0 days 00:00:00.846511,False,squared_error,21,sqrt,2,29,263,TPESampler,COMPLETE
138,0.4021761942590767,2025-04-24 21:39:11.916713,2025-04-24 21:39:16.796499,0 days 00:00:04.879786,True,squared_error,39,,2,2,979,TPESampler,COMPLETE
139,0.4081069473978215,2025-04-24 21:39:12.177173,2025-04-24 21:39:18.372064,0 days 00:00:06.194891,True,squared_error,46,,1,4,999,TPESampler,COMPLETE
140,0.4022828135384401,2025-04-24 21:39:16.953544,2025-04-24 21:39:21.831465,0 days 00:00:04.877921,True,squared_error,45,,2,2,984,TPESampler,COMPLETE
