number,value,datetime_start,datetime_complete,duration,params_bootstrap,params_criterion,params_max_depth,params_max_features,params_min_samples_leaf,params_min_samples_split,params_n_estimators,system_attrs_auto:sampler,state
1558,0.4023982689174342,2025-04-24 22:33:47.092953,2025-04-24 22:33:52.101563,0 days 00:00:05.008610,True,squared_error,32,,2,3,850,TPESampler,COMPLETE
1559,0.4026441024931491,2025-04-24 22:33:47.641209,2025-04-24 22:33:53.438819,0 days 00:00:05.797610,True,squared_error,27,,2,2,997,TPESampler,COMPLETE
1560,0.4026595593330808,2025-04-24 22:33:50.894903,2025-04-24 22:33:55.768921,0 days 00:00:04.874018,True,squared_error,30,,2,2,832,TPESampler,COMPLETE
1561,0.40255493386962277,2025-04-24 22:33:52.304437,2025-04-24 22:33:57.343794,0 days 00:00:05.039357,True,squared_error,43,,2,2,827,TPESampler,COMPLETE
1562,0.40220381854544174,2025-04-24 22:33:53.627947,2025-04-24 22:33:59.433754,0 days 00:00:05.805807,True,squared_error,33,,2,2,963,TPESampler,COMPLETE
1563,0.8483518711087198,2025-04-24 22:33:55.959280,2025-04-24 22:33:58.784635,0 days 00:00:02.825355,True,squared_error,35,sqrt,2,2,995,TPESampler,COMPLETE
1564,0.4054539371821534,2025-04-24 22:33:57.550974,2025-04-24 22:34:04.071822,0 days 00:00:06.520848,True,squared_error,29,,1,5,999,TPESampler,COMPLETE
1565,0.4717271773857029,2025-04-24 22:33:58.977900,2025-04-24 22:34:02.886943,0 days 00:00:03.909043,False,squared_error,28,,8,6,740,TPESampler,COMPLETE
1566,0.4231271888241457,2025-04-24 22:33:59.700405,2025-04-24 22:34:06.066788,0 days 00:00:06.366383,True,squared_error,40,,1,2,832,TPESampler,COMPLETE
1567,0.4394828331041135,2025-04-24 22:34:03.083882,2025-04-24 22:34:07.559968,0 days 00:00:04.476086,True,squared_error,31,,4,3,870,TPESampler,COMPLETE
1568,0.40269165332176055,2025-04-24 22:34:04.258944,2025-04-24 22:34:09.839158,0 days 00:00:05.580214,True,squared_error,25,,2,2,984,TPESampler,COMPLETE
1569,0.40251897710039974,2025-04-24 22:34:06.257180,2025-04-24 22:34:11.268231,0 days 00:00:05.011051,True,squared_error,45,,2,4,836,TPESampler,COMPLETE
1570,0.41603955135277726,2025-04-24 22:34:07.775140,2025-04-24 22:34:12.474334,0 days 00:00:04.699194,True,squared_error,50,,3,3,864,TPESampler,COMPLETE
1571,0.40250966777853314,2025-04-24 22:34:10.035984,2025-04-24 22:34:15.399469,0 days 00:00:05.363485,True,squared_error,45,,2,3,910,TPESampler,COMPLETE
1572,0.40318542051037,2025-04-24 22:34:11.460197,2025-04-24 22:34:52.544887,0 days 00:00:41.084690,True,absolute_error,32,,2,3,985,TPESampler,COMPLETE
1573,0.4244466596799181,2025-04-24 22:34:12.670580,2025-04-24 22:34:19.369817,0 days 00:00:06.699237,True,squared_error,35,,1,2,997,TPESampler,COMPLETE
1574,0.4023745103445129,2025-04-24 22:34:15.577182,2025-04-24 22:34:20.727483,0 days 00:00:05.150301,True,squared_error,40,,2,2,998,TPESampler,COMPLETE
1575,0.40217744911480435,2025-04-24 22:34:19.550923,2025-04-24 22:34:24.760551,0 days 00:00:05.209628,True,squared_error,34,,2,2,971,TPESampler,COMPLETE
1576,0.4671688893389214,2025-04-24 22:34:20.917046,2025-04-24 22:34:23.313621,0 days 00:00:02.396575,False,squared_error,28,,5,16,439,TPESampler,COMPLETE
1577,0.40270487463348237,2025-04-24 22:34:23.506121,2025-04-24 22:34:27.925980,0 days 00:00:04.419859,True,squared_error,30,,2,3,809,TPESampler,COMPLETE
1578,0.4163606551772285,2025-04-24 22:34:24.966020,2025-04-24 22:34:29.627758,0 days 00:00:04.661738,True,squared_error,33,,3,2,980,TPESampler,COMPLETE
1579,0.402239287110711,2025-04-24 22:34:28.114910,2025-04-24 22:34:33.227226,0 days 00:00:05.112316,True,squared_error,29,,2,2,994,TPESampler,COMPLETE
1580,0.4022246597146587,2025-04-24 22:34:29.820797,2025-04-24 22:34:34.951106,0 days 00:00:05.130309,True,squared_error,32,,2,2,990,TPESampler,COMPLETE
1581,0.4163606654103958,2025-04-24 22:34:33.413227,2025-04-24 22:34:37.949435,0 days 00:00:04.536208,True,squared_error,27,,3,3,973,TPESampler,COMPLETE
1582,0.4024759169600945,2025-04-24 22:34:35.140254,2025-04-24 22:34:39.621834,0 days 00:00:04.481580,True,squared_error,32,,2,2,829,TPESampler,COMPLETE
1583,0.40328336401208986,2025-04-24 22:34:38.139813,2025-04-24 22:34:42.641865,0 days 00:00:04.502052,True,squared_error,19,,2,3,855,TPESampler,COMPLETE
1584,0.43969140621827035,2025-04-24 22:34:39.810693,2025-04-24 22:34:44.200291,0 days 00:00:04.389598,True,squared_error,31,,4,3,998,TPESampler,COMPLETE
1585,1.3812936198902745,2025-04-24 22:34:42.830811,2025-04-24 22:34:45.412856,0 days 00:00:02.582045,True,absolute_error,41,log2,5,2,975,TPESampler,COMPLETE
1586,0.4023745103445129,2025-04-24 22:34:44.436710,2025-04-24 22:34:49.537253,0 days 00:00:05.100543,True,squared_error,41,,2,2,998,TPESampler,COMPLETE
1587,0.4233253157259401,2025-04-24 22:34:45.606654,2025-04-24 22:34:50.760096,0 days 00:00:05.153442,True,squared_error,31,,1,2,743,TPESampler,COMPLETE
1588,0.40224031200913407,2025-04-24 22:34:49.728222,2025-04-24 22:34:55.228118,0 days 00:00:05.499896,True,squared_error,34,,2,4,993,TPESampler,COMPLETE
1589,0.4030608518675008,2025-04-24 22:34:50.953964,2025-04-24 22:34:55.225608,0 days 00:00:04.271644,True,squared_error,30,,2,5,795,TPESampler,COMPLETE
1590,0.40230985869946695,2025-04-24 22:34:52.782879,2025-04-24 22:34:58.676042,0 days 00:00:05.893163,True,squared_error,28,,2,2,995,TPESampler,COMPLETE
1591,0.8577345889010064,2025-04-24 22:34:55.395716,2025-04-24 22:34:57.489937,0 days 00:00:02.094221,False,squared_error,25,sqrt,2,21,846,TPESampler,COMPLETE
1592,0.4264264988745471,2025-04-24 22:34:55.444306,2025-04-24 22:35:02.291326,0 days 00:00:06.847020,True,squared_error,34,,1,2,835,TPESampler,COMPLETE
1593,0.4162752168246549,2025-04-24 22:34:57.669599,2025-04-24 22:35:02.233140,0 days 00:00:04.563541,True,squared_error,34,,3,2,900,TPESampler,COMPLETE
1594,0.4022936022957746,2025-04-24 22:34:58.865630,2025-04-24 22:35:04.583569,0 days 00:00:05.717939,True,squared_error,41,,2,2,1000,TPESampler,COMPLETE
1595,0.5030522033041303,2025-04-24 22:35:02.392858,2025-04-24 22:35:06.572779,0 days 00:00:04.179921,False,squared_error,42,,10,2,785,TPESampler,COMPLETE
1596,0.4026532707126624,2025-04-24 22:35:02.508326,2025-04-24 22:35:07.981301,0 days 00:00:05.472975,True,squared_error,29,,2,2,888,TPESampler,COMPLETE
1597,0.4160746729986438,2025-04-24 22:35:04.783716,2025-04-24 22:35:09.271136,0 days 00:00:04.487420,True,squared_error,36,,3,2,806,TPESampler,COMPLETE
1598,0.4085780783406609,2025-04-24 22:35:06.760371,2025-04-24 22:35:12.496308,0 days 00:00:05.735937,True,squared_error,27,,2,7,998,TPESampler,COMPLETE
1599,0.40223870887214347,2025-04-24 22:35:08.176805,2025-04-24 22:35:13.985033,0 days 00:00:05.808228,True,squared_error,31,,2,2,989,TPESampler,COMPLETE
1600,1.073039016338688,2025-04-24 22:35:09.460038,2025-04-24 22:35:10.644470,0 days 00:00:01.184432,False,squared_error,18,sqrt,5,2,544,TPESampler,COMPLETE
1601,0.41864183750234074,2025-04-24 22:35:10.840188,2025-04-24 22:35:17.605671,0 days 00:00:06.765483,True,squared_error,31,,1,3,891,TPESampler,COMPLETE
1602,1.3478322631446673,2025-04-24 22:35:12.684857,2025-04-24 22:35:13.720937,0 days 00:00:01.036080,True,squared_error,27,log2,13,12,306,TPESampler,COMPLETE
1603,1.1460247607656395,2025-04-24 22:35:13.917800,2025-04-24 22:35:15.487178,0 days 00:00:01.569378,False,squared_error,11,sqrt,6,37,481,TPESampler,COMPLETE
1604,0.62008407929392,2025-04-24 22:35:14.225580,2025-04-24 22:35:17.168771,0 days 00:00:02.943191,True,squared_error,27,sqrt,1,4,783,TPESampler,COMPLETE
1605,0.42337227555563295,2025-04-24 22:35:15.683099,2025-04-24 22:35:20.593542,0 days 00:00:04.910443,True,squared_error,10,,1,5,894,TPESampler,COMPLETE
1606,0.5697802404906034,2025-04-24 22:35:17.401117,2025-04-24 22:35:20.603619,0 days 00:00:03.202502,True,squared_error,30,sqrt,1,3,985,TPESampler,COMPLETE
1607,0.4394413341699771,2025-04-24 22:35:17.831620,2025-04-24 22:35:22.560455,0 days 00:00:04.728835,True,squared_error,37,,4,2,883,TPESampler,COMPLETE
1608,1.3282067814220275,2025-04-24 22:35:20.766415,2025-04-24 22:35:22.334230,0 days 00:00:01.567815,True,squared_error,8,log2,6,13,251,TPESampler,COMPLETE
1609,0.4309728592600313,2025-04-24 22:35:20.819541,2025-04-24 22:36:33.321809,0 days 00:01:12.502268,True,absolute_error,32,,1,2,992,TPESampler,COMPLETE
1610,1.0951030538748794,2025-04-24 22:35:22.512542,2025-04-24 22:35:24.365939,0 days 00:00:01.853397,True,squared_error,18,log2,1,43,709,TPESampler,COMPLETE
1611,0.822229780652621,2025-04-24 22:35:22.825239,2025-04-24 22:35:24.522595,0 days 00:00:01.697356,False,squared_error,39,sqrt,2,18,639,TPESampler,COMPLETE
1612,0.4190814573428229,2025-04-24 22:35:24.529257,2025-04-24 22:35:31.033762,0 days 00:00:06.504505,True,squared_error,37,,1,3,998,TPESampler,COMPLETE
1613,1.339744744491343,2025-04-24 22:35:24.727771,2025-04-24 22:35:25.914944,0 days 00:00:01.187173,True,squared_error,50,log2,8,5,142,TPESampler,COMPLETE
1614,0.40253682652709016,2025-04-24 22:35:26.108332,2025-04-24 22:35:30.307291,0 days 00:00:04.198959,True,squared_error,32,,2,4,864,TPESampler,COMPLETE
1615,0.6996081946637168,2025-04-24 22:35:30.495248,2025-04-24 22:35:34.949994,0 days 00:00:04.454746,False,squared_error,11,,10,43,972,TPESampler,COMPLETE
1616,0.5068648536195175,2025-04-24 22:35:31.462409,2025-04-24 22:35:32.581942,0 days 00:00:01.119533,True,squared_error,15,,1,20,145,TPESampler,COMPLETE
1617,0.4159602143926023,2025-04-24 22:35:32.776997,2025-04-24 22:35:36.697280,0 days 00:00:03.920283,True,squared_error,26,,3,2,816,TPESampler,COMPLETE
1618,0.40252361774677414,2025-04-24 22:35:35.151907,2025-04-24 22:35:40.826774,0 days 00:00:05.674867,True,squared_error,30,,2,2,998,TPESampler,COMPLETE
1619,0.8701116887877979,2025-04-24 22:35:36.886933,2025-04-24 22:35:38.824038,0 days 00:00:01.937105,True,squared_error,22,sqrt,2,2,865,TPESampler,COMPLETE
1620,1.401319833494849,2025-04-24 22:35:39.013971,2025-04-24 22:35:40.801814,0 days 00:00:01.787843,True,absolute_error,6,log2,14,2,856,TPESampler,COMPLETE
1621,0.5909166910723168,2025-04-24 22:35:40.966314,2025-04-24 22:35:54.501072,0 days 00:00:13.534758,False,absolute_error,5,,6,6,443,TPESampler,COMPLETE
1622,0.4234995619693584,2025-04-24 22:35:41.006104,2025-04-24 22:35:47.662814,0 days 00:00:06.656710,True,squared_error,44,,1,2,987,TPESampler,COMPLETE
1623,1.2343403987217019,2025-04-24 22:35:47.855047,2025-04-24 22:35:49.535182,0 days 00:00:01.680135,True,squared_error,31,log2,2,6,968,TPESampler,COMPLETE
1624,1.0056423781851438,2025-04-24 22:35:49.723581,2025-04-24 22:35:50.918055,0 days 00:00:01.194474,False,squared_error,24,log2,1,35,622,TPESampler,COMPLETE
1625,0.40252434088730826,2025-04-24 22:35:51.100292,2025-04-24 22:35:55.556264,0 days 00:00:04.455972,True,squared_error,35,,2,2,857,TPESampler,COMPLETE
1626,0.466553386761689,2025-04-24 22:35:54.694547,2025-04-24 22:35:57.683994,0 days 00:00:02.989447,True,squared_error,42,,5,2,626,TPESampler,COMPLETE
1627,0.41606862433292147,2025-04-24 22:35:55.751337,2025-04-24 22:35:59.922046,0 days 00:00:04.170709,True,squared_error,33,,3,4,870,TPESampler,COMPLETE
1628,0.43965618716663735,2025-04-24 22:35:57.899089,2025-04-24 22:36:02.367772,0 days 00:00:04.468683,True,squared_error,41,,4,2,999,TPESampler,COMPLETE
1629,1.380098734452143,2025-04-24 22:36:00.108307,2025-04-24 22:36:02.371625,0 days 00:00:02.263318,False,absolute_error,49,log2,6,49,940,TPESampler,COMPLETE
1630,0.5167749528412544,2025-04-24 22:36:02.516924,2025-04-24 22:36:05.470422,0 days 00:00:02.953498,True,squared_error,37,sqrt,1,2,672,TPESampler,COMPLETE
1631,0.4289236659391294,2025-04-24 22:36:02.567508,2025-04-24 22:36:07.607412,0 days 00:00:05.039904,False,squared_error,48,,3,5,699,TPESampler,COMPLETE
1632,1.394013833928076,2025-04-24 22:36:05.661790,2025-04-24 22:36:07.122522,0 days 00:00:01.460732,False,absolute_error,43,log2,12,10,715,TPESampler,COMPLETE
1633,0.4165199396182058,2025-04-24 22:36:07.311405,2025-04-24 22:36:11.920096,0 days 00:00:04.608691,True,squared_error,31,,3,5,992,TPESampler,COMPLETE
1634,0.42729641306345556,2025-04-24 22:36:07.838651,2025-04-24 22:36:14.768711,0 days 00:00:06.930060,True,squared_error,24,,1,2,989,TPESampler,COMPLETE
1635,0.8251479347736463,2025-04-24 22:36:12.122493,2025-04-24 22:36:13.987949,0 days 00:00:01.865456,True,squared_error,33,log2,1,6,807,TPESampler,COMPLETE
1636,1.2294748201150207,2025-04-24 22:36:14.183408,2025-04-24 22:36:16.614529,0 days 00:00:02.431121,True,squared_error,36,log2,2,2,997,TPESampler,COMPLETE
1637,0.4026224011374268,2025-04-24 22:36:15.247046,2025-04-24 22:36:20.024498,0 days 00:00:04.777452,True,squared_error,37,,2,2,862,TPESampler,COMPLETE
1638,0.41933382766831007,2025-04-24 22:36:16.799330,2025-04-24 22:36:22.510078,0 days 00:00:05.710748,True,squared_error,30,,1,3,859,TPESampler,COMPLETE
1639,1.2892804441851164,2025-04-24 22:36:20.221105,2025-04-24 22:36:22.023287,0 days 00:00:01.802182,True,squared_error,23,log2,3,2,985,TPESampler,COMPLETE
1640,0.4672785998206991,2025-04-24 22:36:22.214859,2025-04-24 22:36:30.244599,0 days 00:00:08.029740,False,squared_error,35,,1,2,862,TPESampler,COMPLETE
1641,0.41750473120673565,2025-04-24 22:36:22.697978,2025-04-24 22:36:28.707615,0 days 00:00:06.009637,True,squared_error,35,,1,3,992,TPESampler,COMPLETE
1642,0.6435313337971753,2025-04-24 22:36:28.909845,2025-04-24 22:36:32.168153,0 days 00:00:03.258308,False,squared_error,40,log2,1,2,876,TPESampler,COMPLETE
1643,0.44334022453229427,2025-04-24 22:36:30.433578,2025-04-24 22:36:34.603584,0 days 00:00:04.170006,True,squared_error,9,,4,3,904,TPESampler,COMPLETE
1644,0.4022502422063942,2025-04-24 22:36:32.365911,2025-04-24 22:36:37.894371,0 days 00:00:05.528460,True,squared_error,34,,2,2,978,TPESampler,COMPLETE
1645,0.40306418672251065,2025-04-24 22:36:33.521580,2025-04-24 22:36:38.418906,0 days 00:00:04.897326,True,squared_error,27,,2,4,890,TPESampler,COMPLETE
1646,0.40217324420769124,2025-04-24 22:36:34.805750,2025-04-24 22:36:40.285828,0 days 00:00:05.480078,True,squared_error,32,,2,4,985,TPESampler,COMPLETE
1647,0.40480619382322214,2025-04-24 22:36:38.091174,2025-04-24 22:36:44.659858,0 days 00:00:06.568684,True,squared_error,43,,1,5,999,TPESampler,COMPLETE
1648,0.40780503368473053,2025-04-24 22:36:38.622872,2025-04-24 22:36:42.068869,0 days 00:00:03.445997,True,squared_error,23,,1,5,457,TPESampler,COMPLETE
1649,0.4021689591177861,2025-04-24 22:36:40.500481,2025-04-24 22:36:46.077004,0 days 00:00:05.576523,True,squared_error,32,,2,3,971,TPESampler,COMPLETE
1650,0.40308638289935506,2025-04-24 22:36:42.255378,2025-04-24 22:36:47.397611,0 days 00:00:05.142233,True,squared_error,33,,2,5,884,TPESampler,COMPLETE
1651,0.40283730805101636,2025-04-24 22:36:44.860061,2025-04-24 22:36:49.983482,0 days 00:00:05.123421,True,squared_error,23,,2,4,878,TPESampler,COMPLETE
1652,0.40302384189785434,2025-04-24 22:36:46.274063,2025-04-24 22:36:51.785766,0 days 00:00:05.511703,True,squared_error,24,,2,5,999,TPESampler,COMPLETE
1653,0.4029933002096702,2025-04-24 22:36:47.588665,2025-04-24 22:36:52.452257,0 days 00:00:04.863592,True,squared_error,27,,2,4,892,TPESampler,COMPLETE
1654,0.4028695481928217,2025-04-24 22:36:50.176197,2025-04-24 22:36:57.327734,0 days 00:00:07.151537,False,squared_error,35,,2,4,997,TPESampler,COMPLETE
1655,0.41651094200726857,2025-04-24 22:36:51.986109,2025-04-24 22:36:56.656907,0 days 00:00:04.670798,True,squared_error,25,,3,4,997,TPESampler,COMPLETE
1656,0.40842669112333835,2025-04-24 22:36:52.911558,2025-04-24 22:36:59.231942,0 days 00:00:06.320384,True,squared_error,30,,1,4,980,TPESampler,COMPLETE
1657,0.40275052103362824,2025-04-24 22:36:56.840233,2025-04-24 22:37:02.382669,0 days 00:00:05.542436,True,squared_error,33,,2,5,983,TPESampler,COMPLETE
1658,0.4141747141224226,2025-04-24 22:36:57.825478,2025-04-24 22:37:02.673298,0 days 00:00:04.847820,True,squared_error,29,,2,9,999,TPESampler,COMPLETE
1659,0.402431509504561,2025-04-24 22:36:59.426309,2025-04-24 22:37:04.365500,0 days 00:00:04.939191,True,squared_error,32,,2,3,848,TPESampler,COMPLETE
1660,0.40250647237351994,2025-04-24 22:37:02.583165,2025-04-24 22:37:08.297875,0 days 00:00:05.714710,True,squared_error,32,,2,4,936,TPESampler,COMPLETE
1661,0.43965887071525606,2025-04-24 22:37:02.948228,2025-04-24 22:37:07.141533,0 days 00:00:04.193305,True,squared_error,36,,4,6,833,TPESampler,COMPLETE
1662,0.4025821874911273,2025-04-24 22:37:04.558884,2025-04-24 22:37:09.917096,0 days 00:00:05.358212,True,squared_error,32,,2,3,935,TPESampler,COMPLETE
1663,0.404726702191834,2025-04-24 22:37:07.334909,2025-04-24 22:37:14.345700,0 days 00:00:07.010791,False,squared_error,25,,2,4,936,TPESampler,COMPLETE
1664,0.40292740809819194,2025-04-24 22:37:08.490578,2025-04-24 22:37:12.811861,0 days 00:00:04.321283,True,squared_error,21,,2,2,802,TPESampler,COMPLETE
1665,0.40228844639697,2025-04-24 22:37:10.108546,2025-04-24 22:37:15.807546,0 days 00:00:05.699000,True,squared_error,28,,2,2,996,TPESampler,COMPLETE
1666,0.41601106631295875,2025-04-24 22:37:13.008102,2025-04-24 22:37:17.789562,0 days 00:00:04.781460,True,squared_error,29,,3,4,875,TPESampler,COMPLETE
1667,0.41639038991305977,2025-04-24 22:37:14.539377,2025-04-24 22:37:19.649395,0 days 00:00:05.110018,True,squared_error,28,,3,4,981,TPESampler,COMPLETE
1668,0.4070760945394691,2025-04-24 22:37:15.997449,2025-04-24 22:37:21.810813,0 days 00:00:05.813364,True,squared_error,20,,1,5,952,TPESampler,COMPLETE
1669,0.42391766214494764,2025-04-24 22:37:17.986467,2025-04-24 22:37:24.199295,0 days 00:00:06.212828,True,squared_error,27,,1,2,839,TPESampler,COMPLETE
1670,1.152515089862803,2025-04-24 22:37:19.838547,2025-04-24 22:37:31.433007,0 days 00:00:11.594460,False,absolute_error,21,log2,1,37,883,TPESampler,COMPLETE
1671,0.4053692871208352,2025-04-24 22:37:21.998904,2025-04-24 22:37:26.600884,0 days 00:00:04.601980,True,squared_error,32,,2,6,907,TPESampler,COMPLETE
1672,0.8205449390572632,2025-04-24 22:37:24.381838,2025-04-24 22:37:25.949525,0 days 00:00:01.567687,True,squared_error,50,log2,1,19,608,TPESampler,COMPLETE
1673,0.40274657823751425,2025-04-24 22:37:26.128339,2025-04-24 22:37:30.942167,0 days 00:00:04.813828,True,squared_error,32,,2,5,970,TPESampler,COMPLETE
1674,0.40577128890079117,2025-04-24 22:37:27.056006,2025-04-24 22:37:32.772071,0 days 00:00:05.716065,False,squared_error,27,,2,2,775,TPESampler,COMPLETE
1675,0.43970013307568806,2025-04-24 22:37:31.129031,2025-04-24 22:37:36.076029,0 days 00:00:04.946998,True,squared_error,31,,4,4,988,TPESampler,COMPLETE
1676,0.40436989941937407,2025-04-24 22:37:31.627239,2025-04-24 22:37:35.823687,0 days 00:00:04.196448,True,squared_error,30,,2,5,653,TPESampler,COMPLETE
1677,0.7289814802725861,2025-04-24 22:37:32.978923,2025-04-24 22:37:33.808076,0 days 00:00:00.829153,False,squared_error,49,sqrt,1,36,114,TPESampler,COMPLETE
1678,0.4088023922699438,2025-04-24 22:37:34.017791,2025-04-24 22:37:39.175421,0 days 00:00:05.157630,True,squared_error,31,,1,7,850,TPESampler,COMPLETE
1679,0.403847256520222,2025-04-24 22:37:36.022598,2025-04-24 22:37:39.856090,0 days 00:00:03.833492,True,squared_error,30,,2,2,633,TPESampler,COMPLETE
1680,0.40253884056152134,2025-04-24 22:37:36.348007,2025-04-24 22:37:41.724615,0 days 00:00:05.376608,True,squared_error,30,,2,3,853,TPESampler,COMPLETE
1681,1.2559138631982159,2025-04-24 22:37:39.363289,2025-04-24 22:37:44.612856,0 days 00:00:05.249567,False,absolute_error,15,sqrt,7,2,917,TPESampler,COMPLETE
1682,1.2655214771508356,2025-04-24 22:37:40.327561,2025-04-24 22:37:41.700749,0 days 00:00:01.373188,False,squared_error,5,log2,2,19,889,TPESampler,COMPLETE
1683,0.43946887200907137,2025-04-24 22:37:41.852308,2025-04-24 22:37:46.485325,0 days 00:00:04.633017,True,squared_error,24,,4,3,888,TPESampler,COMPLETE
1684,0.40221763668222793,2025-04-24 22:37:41.897860,2025-04-24 22:37:48.117178,0 days 00:00:06.219318,True,squared_error,28,,2,3,983,TPESampler,COMPLETE
1685,0.4022333352922416,2025-04-24 22:37:44.805249,2025-04-24 22:37:50.519883,0 days 00:00:05.714634,True,squared_error,36,,2,3,990,TPESampler,COMPLETE
1686,0.4021520784042123,2025-04-24 22:37:46.735574,2025-04-24 22:37:52.339665,0 days 00:00:05.604091,True,squared_error,32,,2,4,970,TPESampler,COMPLETE
1687,0.41642911018344403,2025-04-24 22:37:48.333490,2025-04-24 22:37:53.590100,0 days 00:00:05.256610,True,squared_error,30,,3,2,990,TPESampler,COMPLETE
1688,0.4024904676524185,2025-04-24 22:37:50.728465,2025-04-24 22:37:55.657063,0 days 00:00:04.928598,True,squared_error,29,,2,2,791,TPESampler,COMPLETE
1689,0.4116651128220814,2025-04-24 22:37:52.545770,2025-04-24 22:37:58.098784,0 days 00:00:05.553014,True,squared_error,31,,2,8,982,TPESampler,COMPLETE
1690,0.4026353287365055,2025-04-24 22:37:53.802135,2025-04-24 22:37:59.381566,0 days 00:00:05.579431,True,squared_error,29,,2,4,892,TPESampler,COMPLETE
1691,1.3085674475955436,2025-04-24 22:37:55.894916,2025-04-24 22:37:56.885810,0 days 00:00:00.990894,False,squared_error,7,log2,6,29,223,TPESampler,COMPLETE
1692,0.42169648840495866,2025-04-24 22:37:57.081603,2025-04-24 22:38:01.704133,0 days 00:00:04.622530,True,squared_error,33,,3,8,848,TPESampler,COMPLETE
1693,0.4183936555343667,2025-04-24 22:37:58.302919,2025-04-24 22:38:03.378732,0 days 00:00:05.075813,True,squared_error,36,,3,7,962,TPESampler,COMPLETE
1694,0.4021601886575112,2025-04-24 22:37:59.587151,2025-04-24 22:38:05.232610,0 days 00:00:05.645459,True,squared_error,29,,2,3,986,TPESampler,COMPLETE
1695,0.4036870990107963,2025-04-24 22:38:01.900405,2025-04-24 22:38:35.908331,0 days 00:00:34.007926,True,absolute_error,30,,2,3,801,TPESampler,COMPLETE
1696,0.4064306599204312,2025-04-24 22:38:03.563940,2025-04-24 22:38:09.011313,0 days 00:00:05.447373,True,squared_error,30,,1,5,968,TPESampler,COMPLETE
1697,0.6069900925206222,2025-04-24 22:38:05.431586,2025-04-24 22:38:41.615864,0 days 00:00:36.184278,False,absolute_error,50,,4,14,778,TPESampler,COMPLETE
1698,0.4022997169459775,2025-04-24 22:38:09.206054,2025-04-24 22:38:13.845773,0 days 00:00:04.639719,True,squared_error,31,,2,3,1000,TPESampler,COMPLETE
