number,value,datetime_start,datetime_complete,duration,params_bootstrap,params_criterion,params_max_depth,params_max_features,params_min_samples_leaf,params_min_samples_split,params_n_estimators,system_attrs_auto:sampler,state
567,0.4022832800052251,2025-04-24 21:55:07.110908,2025-04-24 21:55:12.124565,0 days 00:00:05.013657,True,squared_error,36,,2,2,994,TPESampler,COMPLETE
568,0.40906755785719856,2025-04-24 21:55:10.439385,2025-04-24 21:55:16.011071,0 days 00:00:05.571686,True,squared_error,29,,1,4,978,TPESampler,COMPLETE
569,0.4023218971307515,2025-04-24 21:55:12.291177,2025-04-24 21:55:17.300897,0 days 00:00:05.009720,True,squared_error,50,,2,2,995,TPESampler,COMPLETE
570,0.6087064930660403,2025-04-24 21:55:16.189762,2025-04-24 21:55:19.360367,0 days 00:00:03.170605,True,squared_error,24,sqrt,1,2,902,TPESampler,COMPLETE
571,0.40254484494269976,2025-04-24 21:55:17.471129,2025-04-24 21:55:22.247411,0 days 00:00:04.776282,True,squared_error,35,,2,4,833,TPESampler,COMPLETE
572,0.4074599394344155,2025-04-24 21:55:18.984756,2025-04-24 21:55:24.261237,0 days 00:00:05.276481,True,squared_error,50,,1,4,781,TPESampler,COMPLETE
573,0.4026473935288125,2025-04-24 21:55:19.849977,2025-04-24 21:55:24.200051,0 days 00:00:04.350074,True,squared_error,39,,2,2,819,TPESampler,COMPLETE
574,0.40235431941358146,2025-04-24 21:55:22.422056,2025-04-24 21:55:27.389181,0 days 00:00:04.967125,True,squared_error,44,,2,4,961,TPESampler,COMPLETE
575,0.4032840389386147,2025-04-24 21:55:24.334485,2025-04-24 21:55:59.259024,0 days 00:00:34.924539,True,absolute_error,31,,2,2,846,TPESampler,COMPLETE
576,0.4095731409279274,2025-04-24 21:55:24.413731,2025-04-24 21:55:43.932720,0 days 00:00:19.518989,True,absolute_error,42,,2,6,470,TPESampler,COMPLETE
577,0.4022936022957746,2025-04-24 21:55:27.558373,2025-04-24 21:55:32.111792,0 days 00:00:04.553419,True,squared_error,37,,2,3,1000,TPESampler,COMPLETE
578,0.41656284790795545,2025-04-24 21:55:32.279040,2025-04-24 21:55:36.247877,0 days 00:00:03.968837,True,squared_error,19,,3,4,993,TPESampler,COMPLETE
579,0.41641695308756965,2025-04-24 21:55:36.407507,2025-04-24 21:55:40.389560,0 days 00:00:03.982053,True,squared_error,34,,3,2,989,TPESampler,COMPLETE
580,0.4066500463783238,2025-04-24 21:55:40.566147,2025-04-24 21:55:46.273690,0 days 00:00:05.707543,True,squared_error,41,,1,4,993,TPESampler,COMPLETE
581,0.4396625271537314,2025-04-24 21:55:44.112930,2025-04-24 21:55:47.798535,0 days 00:00:03.685605,True,squared_error,44,,4,2,834,TPESampler,COMPLETE
582,0.40217476613909225,2025-04-24 21:55:46.467383,2025-04-24 21:55:51.584386,0 days 00:00:05.117003,True,squared_error,33,,2,3,973,TPESampler,COMPLETE
583,1.2278281455296252,2025-04-24 21:55:47.971833,2025-04-24 21:55:49.133132,0 days 00:00:01.161299,True,squared_error,8,sqrt,7,2,517,TPESampler,COMPLETE
584,0.40237950731325994,2025-04-24 21:55:49.314437,2025-04-24 21:55:53.614851,0 days 00:00:04.300414,True,squared_error,39,,2,2,842,TPESampler,COMPLETE
585,0.4652429964236937,2025-04-24 21:55:51.757137,2025-04-24 21:55:56.113449,0 days 00:00:04.356312,False,squared_error,46,,6,5,889,TPESampler,COMPLETE
586,0.40253859747712545,2025-04-24 21:55:53.794121,2025-04-24 21:55:58.452977,0 days 00:00:04.658856,True,squared_error,32,,2,3,878,TPESampler,COMPLETE
587,1.365917990285902,2025-04-24 21:55:56.289274,2025-04-24 21:55:57.414491,0 days 00:00:01.125217,True,absolute_error,45,sqrt,15,2,383,TPESampler,COMPLETE
588,0.4025886884147867,2025-04-24 21:55:57.587501,2025-04-24 21:56:02.116450,0 days 00:00:04.528949,True,squared_error,29,,2,3,801,TPESampler,COMPLETE
589,0.4025718937533529,2025-04-24 21:55:58.629504,2025-04-24 21:56:04.219477,0 days 00:00:05.589973,True,squared_error,26,,2,4,951,TPESampler,COMPLETE
590,0.4022649904552218,2025-04-24 21:55:59.738393,2025-04-24 21:56:04.987507,0 days 00:00:05.249114,True,squared_error,35,,2,3,982,TPESampler,COMPLETE
591,1.2298913057676861,2025-04-24 21:56:02.297041,2025-04-24 21:56:04.280404,0 days 00:00:01.983363,True,squared_error,40,log2,2,2,1000,TPESampler,COMPLETE
592,0.42418573029565226,2025-04-24 21:56:04.361161,2025-04-24 21:56:10.727844,0 days 00:00:06.366683,True,squared_error,35,,1,2,805,TPESampler,COMPLETE
593,0.42475491274913674,2025-04-24 21:56:04.446625,2025-04-24 21:56:12.154654,0 days 00:00:07.708029,True,squared_error,42,,1,2,999,TPESampler,COMPLETE
594,0.7042965005917555,2025-04-24 21:56:05.647513,2025-04-24 21:56:07.164774,0 days 00:00:01.517261,False,squared_error,27,,1,35,210,TPESampler,COMPLETE
595,1.2316237353770292,2025-04-24 21:56:07.335916,2025-04-24 21:56:08.958579,0 days 00:00:01.622663,True,squared_error,25,log2,2,5,821,TPESampler,COMPLETE
596,0.40254741032754054,2025-04-24 21:56:09.138044,2025-04-24 21:56:14.325950,0 days 00:00:05.187906,True,squared_error,27,,2,2,987,TPESampler,COMPLETE
597,1.0829827163616397,2025-04-24 21:56:10.895813,2025-04-24 21:56:14.181600,0 days 00:00:03.285787,True,absolute_error,10,sqrt,1,8,335,TPESampler,COMPLETE
598,0.4397168641254447,2025-04-24 21:56:12.388675,2025-04-24 21:56:17.077898,0 days 00:00:04.689223,True,squared_error,30,,4,2,996,TPESampler,COMPLETE
599,0.40250768634153283,2025-04-24 21:56:14.379370,2025-04-24 21:56:19.229572,0 days 00:00:04.850202,True,squared_error,40,,2,3,904,TPESampler,COMPLETE
600,0.4028695324068867,2025-04-24 21:56:14.560061,2025-04-24 21:56:21.721211,0 days 00:00:07.161150,False,squared_error,42,,2,2,987,TPESampler,COMPLETE
601,0.6073791386995572,2025-04-24 21:56:17.248598,2025-04-24 21:57:35.023860,0 days 00:01:17.775262,False,absolute_error,50,,1,22,670,TPESampler,COMPLETE
602,0.4023834962479698,2025-04-24 21:56:19.408608,2025-04-24 21:56:24.461636,0 days 00:00:05.053028,True,squared_error,30,,2,4,967,TPESampler,COMPLETE
603,0.6780374769066465,2025-04-24 21:56:21.892812,2025-04-24 21:56:23.048821,0 days 00:00:01.156009,False,squared_error,26,sqrt,1,10,415,TPESampler,COMPLETE
604,0.43965163595953727,2025-04-24 21:56:23.216092,2025-04-24 21:56:27.958474,0 days 00:00:04.742382,True,squared_error,48,,4,3,991,TPESampler,COMPLETE
605,0.7509759889343004,2025-04-24 21:56:24.645509,2025-04-24 21:56:26.742749,0 days 00:00:02.097240,True,squared_error,6,,14,40,644,TPESampler,COMPLETE
606,0.40253750197275967,2025-04-24 21:56:26.915475,2025-04-24 21:56:31.288059,0 days 00:00:04.372584,True,squared_error,44,,2,2,863,TPESampler,COMPLETE
607,0.402320512372665,2025-04-24 21:56:28.124001,2025-04-24 21:56:33.032932,0 days 00:00:04.908931,True,squared_error,46,,2,3,997,TPESampler,COMPLETE
608,0.41907909850456465,2025-04-24 21:56:31.454184,2025-04-24 21:56:37.545475,0 days 00:00:06.091291,True,squared_error,33,,1,3,967,TPESampler,COMPLETE
609,0.41630274767387926,2025-04-24 21:56:33.240042,2025-04-24 21:56:36.522589,0 days 00:00:03.282547,True,squared_error,30,,3,3,780,TPESampler,COMPLETE
610,1.155749473163402,2025-04-24 21:56:36.686126,2025-04-24 21:56:47.237718,0 days 00:00:10.551592,False,absolute_error,8,sqrt,1,3,904,TPESampler,COMPLETE
611,0.402320512372665,2025-04-24 21:56:37.711202,2025-04-24 21:56:42.256466,0 days 00:00:04.545264,True,squared_error,42,,2,4,997,TPESampler,COMPLETE
612,0.40677683467826675,2025-04-24 21:56:42.437263,2025-04-24 21:56:46.663479,0 days 00:00:04.226216,True,squared_error,34,,1,4,767,TPESampler,COMPLETE
613,1.0790486267487798,2025-04-24 21:56:46.833676,2025-04-24 21:56:49.024108,0 days 00:00:02.190432,True,squared_error,24,sqrt,4,3,967,TPESampler,COMPLETE
614,0.4021878060183394,2025-04-24 21:56:47.642133,2025-04-24 21:56:52.581143,0 days 00:00:04.939010,True,squared_error,38,,2,2,975,TPESampler,COMPLETE
615,0.40222022381018935,2025-04-24 21:56:49.198438,2025-04-24 21:56:54.077477,0 days 00:00:04.879039,True,squared_error,44,,2,2,988,TPESampler,COMPLETE
616,0.4026234296805454,2025-04-24 21:56:52.765167,2025-04-24 21:56:57.414183,0 days 00:00:04.649016,True,squared_error,35,,2,2,902,TPESampler,COMPLETE
617,1.2899211827863626,2025-04-24 21:56:54.244518,2025-04-24 21:56:56.684210,0 days 00:00:02.439692,True,absolute_error,29,sqrt,6,5,832,TPESampler,COMPLETE
618,0.4026013323586826,2025-04-24 21:56:57.067405,2025-04-24 21:57:01.604582,0 days 00:00:04.537177,True,squared_error,36,,2,2,876,TPESampler,COMPLETE
619,0.43973739812904206,2025-04-24 21:56:57.605530,2025-04-24 21:57:01.579932,0 days 00:00:03.974402,True,squared_error,31,,4,5,968,TPESampler,COMPLETE
620,0.402210266944343,2025-04-24 21:57:01.704263,2025-04-24 21:57:06.672686,0 days 00:00:04.968423,True,squared_error,42,,2,2,977,TPESampler,COMPLETE
621,0.40216292785949864,2025-04-24 21:57:01.754059,2025-04-24 21:57:06.669079,0 days 00:00:04.915020,True,squared_error,35,,2,2,976,TPESampler,COMPLETE
622,1.3931891316127385,2025-04-24 21:57:06.796528,2025-04-24 21:57:08.567303,0 days 00:00:01.770775,False,absolute_error,8,log2,10,2,684,TPESampler,COMPLETE
623,0.42331134937092146,2025-04-24 21:57:06.840384,2025-04-24 21:57:13.644483,0 days 00:00:06.804099,True,squared_error,38,,1,2,999,TPESampler,COMPLETE
624,0.6117763635212433,2025-04-24 21:57:08.761276,2025-04-24 21:58:23.304474,0 days 00:01:14.543198,False,absolute_error,18,,1,26,671,TPESampler,COMPLETE
625,0.40221102155262484,2025-04-24 21:57:13.819618,2025-04-24 21:57:18.246990,0 days 00:00:04.427372,True,squared_error,35,,2,2,968,TPESampler,COMPLETE
626,1.282554238665316,2025-04-24 21:57:18.420877,2025-04-24 21:57:20.266650,0 days 00:00:01.845773,False,absolute_error,5,sqrt,2,12,235,TPESampler,COMPLETE
627,0.9989780976059497,2025-04-24 21:57:20.426821,2025-04-24 21:57:21.139026,0 days 00:00:00.712205,True,squared_error,21,sqrt,3,29,150,TPESampler,COMPLETE
628,0.40265302121045354,2025-04-24 21:57:21.311944,2025-04-24 21:57:25.364310,0 days 00:00:04.052366,True,squared_error,41,,2,2,881,TPESampler,COMPLETE
629,0.8586151738941546,2025-04-24 21:57:25.551539,2025-04-24 21:57:27.145887,0 days 00:00:01.594348,True,squared_error,27,sqrt,2,2,768,TPESampler,COMPLETE
630,0.4220015704377149,2025-04-24 21:57:27.319509,2025-04-24 21:57:29.141889,0 days 00:00:01.822380,False,squared_error,49,,1,5,192,TPESampler,COMPLETE
631,0.40229496321871033,2025-04-24 21:57:29.316379,2025-04-24 21:57:33.817052,0 days 00:00:04.500673,True,squared_error,36,,2,3,992,TPESampler,COMPLETE
632,0.42679038968369176,2025-04-24 21:57:33.990813,2025-04-24 21:57:40.489897,0 days 00:00:06.499084,True,squared_error,30,,1,2,991,TPESampler,COMPLETE
633,0.40222116043429706,2025-04-24 21:57:35.192266,2025-04-24 21:57:39.778186,0 days 00:00:04.585920,True,squared_error,40,,2,2,987,TPESampler,COMPLETE
634,0.40228943921064797,2025-04-24 21:57:39.955049,2025-04-24 21:57:44.807761,0 days 00:00:04.852712,True,squared_error,31,,2,2,994,TPESampler,COMPLETE
635,0.7639650764418354,2025-04-24 21:57:40.849784,2025-04-24 21:57:46.199237,0 days 00:00:05.349453,True,absolute_error,46,,14,7,637,TPESampler,COMPLETE
636,0.40245858940583334,2025-04-24 21:57:44.982512,2025-04-24 21:57:49.272078,0 days 00:00:04.289566,True,squared_error,31,,2,4,845,TPESampler,COMPLETE
637,0.5030522033041316,2025-04-24 21:57:46.371317,2025-04-24 21:57:48.894970,0 days 00:00:02.523653,False,squared_error,37,,10,7,518,TPESampler,COMPLETE
638,0.5080887664720863,2025-04-24 21:57:49.071935,2025-04-24 21:57:52.529368,0 days 00:00:03.457433,True,squared_error,38,sqrt,1,2,959,TPESampler,COMPLETE
639,0.41651183820046933,2025-04-24 21:57:49.468187,2025-04-24 21:57:54.284135,0 days 00:00:04.815948,True,squared_error,43,,3,2,999,TPESampler,COMPLETE
640,0.4024340546660531,2025-04-24 21:57:52.719224,2025-04-24 21:57:57.627795,0 days 00:00:04.908571,True,squared_error,30,,2,4,984,TPESampler,COMPLETE
641,0.40261334397672616,2025-04-24 21:57:54.466458,2025-04-24 21:57:58.673773,0 days 00:00:04.207315,True,squared_error,42,,2,2,823,TPESampler,COMPLETE
642,0.40255857165816367,2025-04-24 21:57:57.812216,2025-04-24 21:58:02.049904,0 days 00:00:04.237688,True,squared_error,32,,2,2,818,TPESampler,COMPLETE
643,0.4235494853477811,2025-04-24 21:57:58.850914,2025-04-24 21:58:05.442499,0 days 00:00:06.591585,True,squared_error,50,,1,2,976,TPESampler,COMPLETE
644,0.4022824707493021,2025-04-24 21:58:02.226674,2025-04-24 21:58:07.122335,0 days 00:00:04.895661,True,squared_error,34,,2,2,984,TPESampler,COMPLETE
645,0.43965271813880824,2025-04-24 21:58:05.624720,2025-04-24 21:58:09.922475,0 days 00:00:04.297755,True,squared_error,34,,4,2,1000,TPESampler,COMPLETE
646,0.41246320095127476,2025-04-24 21:58:07.300444,2025-04-24 21:58:12.246977,0 days 00:00:04.946533,True,squared_error,19,,1,7,995,TPESampler,COMPLETE
647,0.40229496321871033,2025-04-24 21:58:10.113694,2025-04-24 21:58:15.112259,0 days 00:00:04.998565,True,squared_error,42,,2,2,992,TPESampler,COMPLETE
648,0.43940396712769625,2025-04-24 21:58:12.423965,2025-04-24 21:58:16.213902,0 days 00:00:03.789937,True,squared_error,37,,4,2,895,TPESampler,COMPLETE
649,0.4589460763268593,2025-04-24 21:58:15.279718,2025-04-24 21:58:37.444263,0 days 00:00:22.164545,False,absolute_error,33,,2,2,282,TPESampler,COMPLETE
650,1.2943250564420161,2025-04-24 21:58:16.395679,2025-04-24 21:58:17.511406,0 days 00:00:01.115727,True,squared_error,36,log2,3,37,558,TPESampler,COMPLETE
651,1.3696157349120244,2025-04-24 21:58:17.704061,2025-04-24 21:58:19.445214,0 days 00:00:01.741153,True,absolute_error,38,sqrt,15,3,961,TPESampler,COMPLETE
652,1.3336422389514886,2025-04-24 21:58:19.617119,2025-04-24 21:58:20.395914,0 days 00:00:00.778795,True,squared_error,24,log2,7,40,185,TPESampler,COMPLETE
653,0.4160662336980922,2025-04-24 21:58:20.605310,2025-04-24 21:58:24.694619,0 days 00:00:04.089309,True,squared_error,41,,3,4,871,TPESampler,COMPLETE
654,0.4166050803286943,2025-04-24 21:58:23.484896,2025-04-24 21:58:29.171411,0 days 00:00:05.686515,True,squared_error,38,,1,3,865,TPESampler,COMPLETE
655,0.4022936022957746,2025-04-24 21:58:24.867668,2025-04-24 21:58:29.569849,0 days 00:00:04.702181,True,squared_error,36,,2,3,1000,TPESampler,COMPLETE
656,0.4029794814426905,2025-04-24 21:58:29.360020,2025-04-24 21:58:33.538044,0 days 00:00:04.178024,True,squared_error,25,,2,3,824,TPESampler,COMPLETE
657,0.7628899570905792,2025-04-24 21:58:29.771590,2025-04-24 21:58:35.687725,0 days 00:00:05.916135,True,absolute_error,18,,14,3,665,TPESampler,COMPLETE
658,0.40229480858071254,2025-04-24 21:58:33.704245,2025-04-24 21:58:39.399581,0 days 00:00:05.695336,True,squared_error,40,,2,2,991,TPESampler,COMPLETE
659,0.761089319530704,2025-04-24 21:58:35.872730,2025-04-24 21:58:38.558013,0 days 00:00:02.685283,True,squared_error,34,log2,1,4,989,TPESampler,COMPLETE
660,0.6692948939492627,2025-04-24 21:58:37.633414,2025-04-24 21:58:40.686988,0 days 00:00:03.053574,True,squared_error,50,log2,1,5,866,TPESampler,COMPLETE
661,0.4024508246129969,2025-04-24 21:58:38.749683,2025-04-24 21:58:43.636634,0 days 00:00:04.886951,True,squared_error,49,,2,2,831,TPESampler,COMPLETE
662,0.40841725265414036,2025-04-24 21:58:39.750800,2025-04-24 21:58:44.884131,0 days 00:00:05.133331,True,squared_error,30,,2,7,967,TPESampler,COMPLETE
663,0.4023643152283052,2025-04-24 21:58:40.865199,2025-04-24 21:58:45.989706,0 days 00:00:05.124507,True,squared_error,30,,2,3,972,TPESampler,COMPLETE
664,0.4031016056959146,2025-04-24 21:58:43.831062,2025-04-24 21:59:25.771344,0 days 00:00:41.940282,True,absolute_error,36,,2,4,977,TPESampler,COMPLETE
665,1.3933519816923874,2025-04-24 21:58:45.063490,2025-04-24 21:58:45.966094,0 days 00:00:00.902604,False,absolute_error,29,log2,13,8,278,TPESampler,COMPLETE
666,0.40847511299889755,2025-04-24 21:58:46.091192,2025-04-24 21:58:51.017864,0 days 00:00:04.926672,True,squared_error,50,,2,7,994,TPESampler,COMPLETE
667,0.4399534518005744,2025-04-24 21:58:46.136140,2025-04-24 21:58:49.828700,0 days 00:00:03.692560,True,squared_error,28,,4,3,778,TPESampler,COMPLETE
668,1.3311669129370864,2025-04-24 21:58:50.017232,2025-04-24 21:58:51.143814,0 days 00:00:01.126582,False,absolute_error,22,log2,3,2,189,TPESampler,COMPLETE
669,0.4397804718357272,2025-04-24 21:58:51.197555,2025-04-24 21:58:55.370506,0 days 00:00:04.172951,True,squared_error,33,,4,4,983,TPESampler,COMPLETE
670,0.40222116043429706,2025-04-24 21:58:51.359503,2025-04-24 21:58:56.601583,0 days 00:00:05.242080,True,squared_error,35,,2,2,987,TPESampler,COMPLETE
671,0.6268090098325751,2025-04-24 21:58:55.562154,2025-04-24 21:58:56.890497,0 days 00:00:01.328343,False,squared_error,41,log2,1,3,356,TPESampler,COMPLETE
672,0.46740234069577974,2025-04-24 21:58:56.776366,2025-04-24 21:59:05.002806,0 days 00:00:08.226440,False,squared_error,31,,1,2,936,TPESampler,COMPLETE
673,1.1216064236936976,2025-04-24 21:58:57.072534,2025-04-24 21:59:00.410283,0 days 00:00:03.337749,True,absolute_error,31,sqrt,3,5,524,TPESampler,COMPLETE
674,0.40390935148227447,2025-04-24 21:59:00.600135,2025-04-24 21:59:41.431017,0 days 00:00:40.830882,True,absolute_error,22,,2,2,955,TPESampler,COMPLETE
675,0.40254676490553964,2025-04-24 21:59:05.165931,2025-04-24 21:59:08.973005,0 days 00:00:03.807074,True,squared_error,42,,2,4,798,TPESampler,COMPLETE
676,0.41619919828620805,2025-04-24 21:59:09.136027,2025-04-24 21:59:12.949179,0 days 00:00:03.813152,True,squared_error,10,,2,2,991,TPESampler,COMPLETE
677,0.4587541308304046,2025-04-24 21:59:13.128829,2025-04-24 21:59:15.016106,0 days 00:00:01.887277,True,squared_error,9,,1,14,470,TPESampler,COMPLETE
678,1.1585877441614,2025-04-24 21:59:15.206008,2025-04-24 21:59:17.196704,0 days 00:00:01.990696,False,absolute_error,28,sqrt,4,28,205,TPESampler,COMPLETE
679,0.4239874124123316,2025-04-24 21:59:17.372515,2025-04-24 21:59:22.570000,0 days 00:00:05.197485,True,squared_error,39,,1,2,808,TPESampler,COMPLETE
680,0.40400132693712104,2025-04-24 21:59:22.741881,2025-04-24 21:59:27.754397,0 days 00:00:05.012516,True,squared_error,37,,1,5,873,TPESampler,COMPLETE
681,0.40283775363417323,2025-04-24 21:59:25.951722,2025-04-24 21:59:30.835805,0 days 00:00:04.884083,True,squared_error,35,,2,5,996,TPESampler,COMPLETE
682,0.41598996033904206,2025-04-24 21:59:27.938391,2025-04-24 21:59:32.077637,0 days 00:00:04.139246,True,squared_error,36,,3,2,837,TPESampler,COMPLETE
683,1.2315428485175655,2025-04-24 21:59:31.017229,2025-04-24 21:59:32.641710,0 days 00:00:01.624481,True,squared_error,42,log2,2,2,740,TPESampler,COMPLETE
684,1.397099114782089,2025-04-24 21:59:32.266167,2025-04-24 21:59:34.013785,0 days 00:00:01.747618,True,absolute_error,41,log2,9,46,594,TPESampler,COMPLETE
685,0.4026348956469661,2025-04-24 21:59:32.821139,2025-04-24 21:59:37.497047,0 days 00:00:04.675908,True,squared_error,44,,2,2,871,TPESampler,COMPLETE
686,0.42331378645139384,2025-04-24 21:59:34.211266,2025-04-24 21:59:40.984427,0 days 00:00:06.773161,True,squared_error,37,,1,2,996,TPESampler,COMPLETE
687,0.8719309153306242,2025-04-24 21:59:37.672027,2025-04-24 21:59:38.984547,0 days 00:00:01.312520,False,squared_error,33,sqrt,3,6,613,TPESampler,COMPLETE
688,0.8900214011728327,2025-04-24 21:59:39.165621,2025-04-24 21:59:46.809437,0 days 00:00:07.643816,True,absolute_error,10,,8,50,570,TPESampler,COMPLETE
689,0.40263829542236046,2025-04-24 21:59:41.156346,2025-04-24 21:59:45.395232,0 days 00:00:04.238886,True,squared_error,32,,2,2,819,TPESampler,COMPLETE
690,0.4024504317042587,2025-04-24 21:59:41.618139,2025-04-24 21:59:45.920340,0 days 00:00:04.302201,True,squared_error,34,,2,4,831,TPESampler,COMPLETE
691,0.4023218971307515,2025-04-24 21:59:45.590147,2025-04-24 21:59:50.727484,0 days 00:00:05.137337,True,squared_error,44,,2,3,995,TPESampler,COMPLETE
692,0.40239644092606763,2025-04-24 21:59:46.105332,2025-04-24 21:59:51.220208,0 days 00:00:05.114876,True,squared_error,22,,2,2,1000,TPESampler,COMPLETE
693,0.8598155992838901,2025-04-24 21:59:47.227254,2025-04-24 21:59:52.249643,0 days 00:00:05.022389,False,absolute_error,42,log2,1,12,268,TPESampler,COMPLETE
694,0.42891989571568706,2025-04-24 21:59:50.894450,2025-04-24 21:59:56.389462,0 days 00:00:05.495012,False,squared_error,27,,3,4,821,TPESampler,COMPLETE
695,1.3942226099220845,2025-04-24 21:59:51.458044,2025-04-24 21:59:53.034599,0 days 00:00:01.576555,False,absolute_error,23,log2,12,2,413,TPESampler,COMPLETE
696,1.289264111268311,2025-04-24 21:59:52.561201,2025-04-24 21:59:54.698698,0 days 00:00:02.137497,True,squared_error,30,log2,3,2,979,TPESampler,COMPLETE
697,0.9677599321016903,2025-04-24 21:59:53.491222,2025-04-24 22:00:02.192898,0 days 00:00:08.701676,True,absolute_error,47,log2,1,28,719,TPESampler,COMPLETE
698,0.40231413738219285,2025-04-24 21:59:54.882345,2025-04-24 22:00:00.050803,0 days 00:00:05.168458,True,squared_error,28,,2,3,999,TPESampler,COMPLETE
699,0.43959331740796165,2025-04-24 21:59:56.570714,2025-04-24 22:00:00.364963,0 days 00:00:03.794249,True,squared_error,36,,4,3,936,TPESampler,COMPLETE
700,0.4054901314060099,2025-04-24 22:00:00.241869,2025-04-24 22:00:06.625770,0 days 00:00:06.383901,True,squared_error,34,,1,5,973,TPESampler,COMPLETE
701,0.41642857573861425,2025-04-24 22:00:00.556744,2025-04-24 22:00:05.492491,0 days 00:00:04.935747,True,squared_error,38,,3,3,978,TPESampler,COMPLETE
702,0.40218194661575374,2025-04-24 22:00:02.388488,2025-04-24 22:00:08.314610,0 days 00:00:05.926122,True,squared_error,48,,2,2,985,TPESampler,COMPLETE
703,0.402216389485944,2025-04-24 22:00:05.680833,2025-04-24 22:00:11.471079,0 days 00:00:05.790246,True,squared_error,39,,2,4,981,TPESampler,COMPLETE
704,1.339045018444487,2025-04-24 22:00:06.809465,2025-04-24 22:00:08.281639,0 days 00:00:01.472174,False,squared_error,10,log2,15,3,895,TPESampler,COMPLETE
705,0.42762387223998943,2025-04-24 22:00:08.447316,2025-04-24 22:00:28.545836,0 days 00:00:20.098520,True,absolute_error,47,,3,2,663,TPESampler,COMPLETE
706,0.41602092938151025,2025-04-24 22:00:08.543108,2025-04-24 22:00:12.955918,0 days 00:00:04.412810,True,squared_error,50,,3,2,846,TPESampler,COMPLETE
707,1.0717714062805228,2025-04-24 22:00:11.650487,2025-04-24 22:00:12.978721,0 days 00:00:01.328234,True,squared_error,7,sqrt,1,7,559,TPESampler,COMPLETE
708,0.4022649904552218,2025-04-24 22:00:13.088039,2025-04-24 22:00:18.543418,0 days 00:00:05.455379,True,squared_error,49,,2,2,982,TPESampler,COMPLETE
