number,value,datetime_start,datetime_complete,duration,params_bootstrap,params_criterion,params_max_depth,params_max_features,params_min_samples_leaf,params_min_samples_split,params_n_estimators,system_attrs_auto:sampler,state
1699,1.3493393652955743,2025-04-24 22:38:14.029484,2025-04-24 22:38:15.659008,0 days 00:00:01.629524,True,squared_error,16,log2,15,34,988,TPESampler,COMPLETE
1700,0.40324722443074085,2025-04-24 22:38:15.844529,2025-04-24 22:38:19.833349,0 days 00:00:03.988820,True,squared_error,26,,2,5,862,TPESampler,COMPLETE
1701,0.40271343420825834,2025-04-24 22:38:20.028205,2025-04-24 22:38:24.443833,0 days 00:00:04.415628,True,squared_error,30,,2,5,974,TPESampler,COMPLETE
1702,0.4028816184001916,2025-04-24 22:38:24.630318,2025-04-24 22:38:29.056056,0 days 00:00:04.425738,True,squared_error,24,,2,5,976,TPESampler,COMPLETE
1703,0.41010219233604517,2025-04-24 22:38:29.246850,2025-04-24 22:38:34.447731,0 days 00:00:05.200881,True,squared_error,26,,1,4,972,TPESampler,COMPLETE
1704,0.40229461925177185,2025-04-24 22:38:34.628144,2025-04-24 22:38:39.753441,0 days 00:00:05.125297,True,squared_error,34,,2,4,992,TPESampler,COMPLETE
1705,0.40535788567225217,2025-04-24 22:38:36.098239,2025-04-24 22:38:41.355479,0 days 00:00:05.257240,True,squared_error,34,,1,5,881,TPESampler,COMPLETE
1706,0.9953825566043735,2025-04-24 22:38:39.943112,2025-04-24 22:38:41.617467,0 days 00:00:01.674355,False,squared_error,42,sqrt,4,40,984,TPESampler,COMPLETE
1707,1.0761721011936418,2025-04-24 22:38:41.569658,2025-04-24 22:38:44.369708,0 days 00:00:02.800050,True,squared_error,36,sqrt,4,5,943,TPESampler,COMPLETE
1708,0.4025029171437514,2025-04-24 22:38:41.843749,2025-04-24 22:38:47.813061,0 days 00:00:05.969312,True,squared_error,36,,2,3,837,TPESampler,COMPLETE
1709,1.2820022130590638,2025-04-24 22:38:41.956819,2025-04-24 22:38:45.764138,0 days 00:00:03.807319,True,absolute_error,9,sqrt,5,23,647,TPESampler,COMPLETE
1710,0.40269684831369473,2025-04-24 22:38:44.563607,2025-04-24 22:38:49.737102,0 days 00:00:05.173495,True,squared_error,34,,2,4,888,TPESampler,COMPLETE
1711,0.40306578310397867,2025-04-24 22:38:45.974501,2025-04-24 22:38:50.366966,0 days 00:00:04.392465,True,squared_error,34,,2,4,752,TPESampler,COMPLETE
1712,0.4397387334494819,2025-04-24 22:38:48.011107,2025-04-24 22:38:52.120353,0 days 00:00:04.109246,True,squared_error,33,,4,4,812,TPESampler,COMPLETE
1713,0.4085101024205822,2025-04-24 22:38:49.931996,2025-04-24 22:38:55.445035,0 days 00:00:05.513039,True,squared_error,36,,2,7,995,TPESampler,COMPLETE
1714,0.963720853929683,2025-04-24 22:38:50.573851,2025-04-24 22:38:53.627604,0 days 00:00:03.053753,True,absolute_error,50,log2,1,30,200,TPESampler,COMPLETE
1715,0.47694779526956976,2025-04-24 22:38:52.331135,2025-04-24 22:39:13.132801,0 days 00:00:20.801666,True,absolute_error,31,,4,3,854,TPESampler,COMPLETE
1716,0.402684903849587,2025-04-24 22:38:53.825635,2025-04-24 22:38:59.589613,0 days 00:00:05.763978,True,squared_error,23,,2,3,994,TPESampler,COMPLETE
1717,1.2464993464530332,2025-04-24 22:38:55.633562,2025-04-24 22:38:57.005080,0 days 00:00:01.371518,False,squared_error,39,log2,3,2,690,TPESampler,COMPLETE
1718,1.3248315867691804,2025-04-24 22:38:57.195030,2025-04-24 22:38:58.835599,0 days 00:00:01.640569,True,squared_error,39,log2,6,8,849,TPESampler,COMPLETE
1719,0.40250768634153283,2025-04-24 22:38:59.026389,2025-04-24 22:39:03.887119,0 days 00:00:04.860730,True,squared_error,37,,2,4,904,TPESampler,COMPLETE
1720,0.4160038789901904,2025-04-24 22:39:00.007564,2025-04-24 22:39:03.858893,0 days 00:00:03.851329,True,squared_error,34,,3,4,868,TPESampler,COMPLETE
1721,0.4053596946611932,2025-04-24 22:39:04.026860,2025-04-24 22:39:09.820629,0 days 00:00:05.793769,True,squared_error,34,,1,5,984,TPESampler,COMPLETE
1722,0.4084188096243257,2025-04-24 22:39:04.080298,2025-04-24 22:39:10.143797,0 days 00:00:06.063499,True,squared_error,35,,1,4,993,TPESampler,COMPLETE
1723,0.7802608100128593,2025-04-24 22:39:10.020341,2025-04-24 22:39:12.858801,0 days 00:00:02.838460,True,absolute_error,49,,15,4,284,TPESampler,COMPLETE
1724,0.4092392225119204,2025-04-24 22:39:10.381333,2025-04-24 22:39:16.110203,0 days 00:00:05.728870,True,squared_error,27,,1,4,853,TPESampler,COMPLETE
1725,0.41651183820046933,2025-04-24 22:39:13.062239,2025-04-24 22:39:18.215008,0 days 00:00:05.152769,True,squared_error,26,,3,6,999,TPESampler,COMPLETE
1726,0.4021922705831619,2025-04-24 22:39:13.429952,2025-04-24 22:39:19.350937,0 days 00:00:05.920985,True,squared_error,28,,2,3,986,TPESampler,COMPLETE
1727,0.4279213184708309,2025-04-24 22:39:16.306056,2025-04-24 22:39:45.556099,0 days 00:00:29.250043,True,absolute_error,14,,3,2,955,TPESampler,COMPLETE
1728,0.4146287289532751,2025-04-24 22:39:18.419498,2025-04-24 22:39:22.551481,0 days 00:00:04.131983,True,squared_error,20,,1,8,747,TPESampler,COMPLETE
1729,0.41651152129787683,2025-04-24 22:39:19.546649,2025-04-24 22:39:24.244112,0 days 00:00:04.697463,True,squared_error,35,,3,3,996,TPESampler,COMPLETE
1730,1.030806147960413,2025-04-24 22:39:22.741215,2025-04-24 22:39:34.203611,0 days 00:00:11.462396,False,absolute_error,44,sqrt,3,2,973,TPESampler,COMPLETE
1731,0.930310523028585,2025-04-24 22:39:24.442823,2025-04-24 22:39:25.174560,0 days 00:00:00.731737,False,squared_error,39,sqrt,3,12,103,TPESampler,COMPLETE
1732,0.402320512372665,2025-04-24 22:39:25.360316,2025-04-24 22:39:30.129506,0 days 00:00:04.769190,True,squared_error,35,,2,4,997,TPESampler,COMPLETE
1733,0.43967472978608757,2025-04-24 22:39:30.345976,2025-04-24 22:39:33.701547,0 days 00:00:03.355571,True,squared_error,26,,4,4,835,TPESampler,COMPLETE
1734,0.4189325052421629,2025-04-24 22:39:33.886993,2025-04-24 22:39:38.373021,0 days 00:00:04.486028,True,squared_error,13,,3,5,979,TPESampler,COMPLETE
1735,0.40220426984088,2025-04-24 22:39:34.417352,2025-04-24 22:39:39.901519,0 days 00:00:05.484167,True,squared_error,35,,2,4,986,TPESampler,COMPLETE
1736,0.41190322010089614,2025-04-24 22:39:38.568426,2025-04-24 22:39:42.859022,0 days 00:00:04.290596,True,squared_error,24,,2,8,865,TPESampler,COMPLETE
1737,0.40973365985170507,2025-04-24 22:39:40.107748,2025-04-24 22:39:46.163269,0 days 00:00:06.055521,True,squared_error,24,,1,4,998,TPESampler,COMPLETE
1738,0.40577986696428386,2025-04-24 22:39:43.046249,2025-04-24 22:39:47.457436,0 days 00:00:04.411187,True,squared_error,37,,2,6,770,TPESampler,COMPLETE
1739,1.3302567029150536,2025-04-24 22:39:45.778333,2025-04-24 22:39:48.209027,0 days 00:00:02.430694,False,absolute_error,5,sqrt,10,12,532,TPESampler,COMPLETE
1740,0.4025105681792208,2025-04-24 22:39:46.381799,2025-04-24 22:39:51.287064,0 days 00:00:04.905265,True,squared_error,30,,2,4,844,TPESampler,COMPLETE
1741,0.8843850154211013,2025-04-24 22:39:47.645496,2025-04-24 22:39:51.527704,0 days 00:00:03.882208,False,absolute_error,16,sqrt,1,2,181,TPESampler,COMPLETE
1742,0.4268710408510086,2025-04-24 22:39:48.457824,2025-04-24 22:40:19.889919,0 days 00:00:31.432095,True,absolute_error,27,,3,4,987,TPESampler,COMPLETE
1743,0.40242895974272846,2025-04-24 22:39:51.473336,2025-04-24 22:39:56.510565,0 days 00:00:05.037229,True,squared_error,22,,2,3,997,TPESampler,COMPLETE
1744,0.4165119353507597,2025-04-24 22:39:51.799848,2025-04-24 22:39:56.391801,0 days 00:00:04.591953,True,squared_error,36,,3,3,997,TPESampler,COMPLETE
1745,0.6483598353402663,2025-04-24 22:39:56.561763,2025-04-24 22:40:05.507336,0 days 00:00:08.945573,False,absolute_error,49,log2,1,2,357,TPESampler,COMPLETE
1746,0.8493305890761798,2025-04-24 22:39:56.719966,2025-04-24 22:39:58.993837,0 days 00:00:02.273871,True,squared_error,35,sqrt,2,6,948,TPESampler,COMPLETE
1747,0.4252587599982864,2025-04-24 22:39:59.189022,2025-04-24 22:40:05.452261,0 days 00:00:06.263239,True,squared_error,31,,1,2,994,TPESampler,COMPLETE
1748,0.40287083959186976,2025-04-24 22:40:05.630155,2025-04-24 22:40:10.356737,0 days 00:00:04.726582,True,squared_error,21,,2,4,815,TPESampler,COMPLETE
1749,0.4396304779268516,2025-04-24 22:40:05.683168,2025-04-24 22:40:09.698328,0 days 00:00:04.015160,True,squared_error,34,,4,3,849,TPESampler,COMPLETE
1750,0.41642911018344403,2025-04-24 22:40:09.896068,2025-04-24 22:40:14.769716,0 days 00:00:04.873648,True,squared_error,35,,3,6,990,TPESampler,COMPLETE
1751,0.42350744483195035,2025-04-24 22:40:10.973939,2025-04-24 22:40:16.038731,0 days 00:00:05.064792,True,squared_error,36,,1,11,984,TPESampler,COMPLETE
1752,0.4026437010006071,2025-04-24 22:40:14.974018,2025-04-24 22:40:19.298913,0 days 00:00:04.324895,True,squared_error,31,,2,3,804,TPESampler,COMPLETE
1753,0.40223924012676254,2025-04-24 22:40:16.234100,2025-04-24 22:40:21.779198,0 days 00:00:05.545098,True,squared_error,29,,2,4,948,TPESampler,COMPLETE
1754,0.9723656375231223,2025-04-24 22:40:19.493077,2025-04-24 22:40:21.924292,0 days 00:00:02.431215,True,squared_error,30,sqrt,3,4,927,TPESampler,COMPLETE
1755,0.5909166910723163,2025-04-24 22:40:20.107311,2025-04-24 22:40:44.132204,0 days 00:00:24.024893,False,absolute_error,5,,6,2,792,TPESampler,COMPLETE
1756,0.40260302127551245,2025-04-24 22:40:21.978076,2025-04-24 22:40:26.373737,0 days 00:00:04.395661,True,squared_error,36,,2,4,875,TPESampler,COMPLETE
1757,0.815453925992412,2025-04-24 22:40:22.187468,2025-04-24 22:40:26.790991,0 days 00:00:04.603523,False,absolute_error,33,sqrt,1,26,168,TPESampler,COMPLETE
1758,0.4025802680047598,2025-04-24 22:40:26.573449,2025-04-24 22:40:31.503927,0 days 00:00:04.930478,True,squared_error,27,,2,4,978,TPESampler,COMPLETE
1759,0.422917623810541,2025-04-24 22:40:27.017210,2025-04-24 22:40:31.425727,0 days 00:00:04.408517,True,squared_error,39,,1,2,601,TPESampler,COMPLETE
1760,0.40222737046474305,2025-04-24 22:40:31.589398,2025-04-24 22:40:36.904508,0 days 00:00:05.315110,True,squared_error,31,,2,4,987,TPESampler,COMPLETE
1761,0.4165036937287669,2025-04-24 22:40:31.701499,2025-04-24 22:40:36.412001,0 days 00:00:04.710502,True,squared_error,24,,3,4,993,TPESampler,COMPLETE
1762,0.4174741603740729,2025-04-24 22:40:36.604547,2025-04-24 22:40:41.872898,0 days 00:00:05.268351,True,squared_error,36,,1,3,815,TPESampler,COMPLETE
1763,0.4289200490473079,2025-04-24 22:40:37.109172,2025-04-24 22:40:43.130479,0 days 00:00:06.021307,False,squared_error,30,,3,6,999,TPESampler,COMPLETE
1764,1.3870500659694769,2025-04-24 22:40:42.066512,2025-04-24 22:40:42.860058,0 days 00:00:00.793546,False,absolute_error,35,log2,12,44,124,TPESampler,COMPLETE
1765,1.22867702941135,2025-04-24 22:40:43.048780,2025-04-24 22:40:45.956328,0 days 00:00:02.907548,True,squared_error,31,log2,2,4,944,TPESampler,COMPLETE
1766,0.40827706365694855,2025-04-24 22:40:43.391175,2025-04-24 22:40:50.565567,0 days 00:00:07.174392,True,squared_error,30,,1,4,995,TPESampler,COMPLETE
1767,0.40220373140675525,2025-04-24 22:40:44.492996,2025-04-24 22:40:50.218206,0 days 00:00:05.725210,True,squared_error,38,,2,3,980,TPESampler,COMPLETE
1768,0.4397168641254447,2025-04-24 22:40:46.159278,2025-04-24 22:40:50.264718,0 days 00:00:04.105440,True,squared_error,35,,4,4,996,TPESampler,COMPLETE
1769,0.4247841900177558,2025-04-24 22:40:50.380521,2025-04-24 22:40:58.430037,0 days 00:00:08.049516,True,squared_error,32,,1,2,993,TPESampler,COMPLETE
1770,0.6999373383730109,2025-04-24 22:40:50.430864,2025-04-24 22:40:52.779326,0 days 00:00:02.348462,True,squared_error,31,sqrt,1,12,494,TPESampler,COMPLETE
1771,0.4024515160425762,2025-04-24 22:40:50.857226,2025-04-24 22:40:56.012297,0 days 00:00:05.155071,True,squared_error,40,,2,4,845,TPESampler,COMPLETE
1772,0.4027221395594586,2025-04-24 22:40:52.976800,2025-04-24 22:40:58.176529,0 days 00:00:05.199729,True,squared_error,23,,2,3,995,TPESampler,COMPLETE
1773,0.402217020721846,2025-04-24 22:40:56.208222,2025-04-24 22:41:01.748346,0 days 00:00:05.540124,True,squared_error,31,,2,3,972,TPESampler,COMPLETE
1774,0.40230045900355177,2025-04-24 22:40:58.379996,2025-04-24 22:41:04.014949,0 days 00:00:05.634953,True,squared_error,41,,2,4,996,TPESampler,COMPLETE
1775,0.41642911018344403,2025-04-24 22:40:58.753095,2025-04-24 22:41:03.876307,0 days 00:00:05.123212,True,squared_error,33,,3,2,990,TPESampler,COMPLETE
1776,0.40899736136571474,2025-04-24 22:41:01.945125,2025-04-24 22:41:07.548953,0 days 00:00:05.603828,True,squared_error,36,,1,4,831,TPESampler,COMPLETE
1777,0.402598338941663,2025-04-24 22:41:04.060830,2025-04-24 22:41:09.351656,0 days 00:00:05.290826,True,squared_error,37,,2,3,859,TPESampler,COMPLETE
1778,0.43968363747485156,2025-04-24 22:41:04.259010,2025-04-24 22:41:08.463343,0 days 00:00:04.204333,True,squared_error,23,,4,2,836,TPESampler,COMPLETE
1779,0.402240654477862,2025-04-24 22:41:07.749280,2025-04-24 22:41:14.136438,0 days 00:00:06.387158,True,squared_error,35,,2,2,993,TPESampler,COMPLETE
1780,1.3093638939114551,2025-04-24 22:41:08.816765,2025-04-24 22:41:12.802693,0 days 00:00:03.985928,True,absolute_error,28,log2,2,3,969,TPESampler,COMPLETE
1781,0.4394782227066694,2025-04-24 22:41:09.813780,2025-04-24 22:41:14.134938,0 days 00:00:04.321158,True,squared_error,39,,4,3,868,TPESampler,COMPLETE
1782,0.8526419347758833,2025-04-24 22:41:13.003856,2025-04-24 22:41:16.432216,0 days 00:00:03.428360,True,squared_error,32,sqrt,2,4,985,TPESampler,COMPLETE
1783,0.4237607145275203,2025-04-24 22:41:14.336849,2025-04-24 22:41:22.709769,0 days 00:00:08.372920,True,squared_error,37,,1,2,990,TPESampler,COMPLETE
1784,0.9542517037037661,2025-04-24 22:41:14.383920,2025-04-24 22:41:16.882497,0 days 00:00:02.498577,True,squared_error,12,sqrt,1,15,734,TPESampler,COMPLETE
1785,0.4024818209716682,2025-04-24 22:41:16.640174,2025-04-24 22:41:21.594384,0 days 00:00:04.954210,True,squared_error,36,,2,4,851,TPESampler,COMPLETE
1786,0.41626472284487576,2025-04-24 22:41:17.152710,2025-04-24 22:41:19.200421,0 days 00:00:02.047711,True,squared_error,50,,1,2,190,TPESampler,COMPLETE
1787,0.4165199396182058,2025-04-24 22:41:19.404435,2025-04-24 22:41:24.363438,0 days 00:00:04.959003,True,squared_error,32,,3,4,992,TPESampler,COMPLETE
1788,0.42806110528533364,2025-04-24 22:41:21.799640,2025-04-24 22:41:27.873687,0 days 00:00:06.074047,True,squared_error,17,,1,2,792,TPESampler,COMPLETE
1789,0.7097669699623728,2025-04-24 22:41:22.901486,2025-04-24 22:41:24.043238,0 days 00:00:01.141752,False,squared_error,16,,14,8,146,TPESampler,COMPLETE
1790,0.40252821490147556,2025-04-24 22:41:24.236389,2025-04-24 22:41:29.676092,0 days 00:00:05.439703,True,squared_error,35,,2,2,812,TPESampler,COMPLETE
1791,1.2326800992968392,2025-04-24 22:41:24.667559,2025-04-24 22:41:26.534118,0 days 00:00:01.866559,True,squared_error,31,log2,2,2,729,TPESampler,COMPLETE
1792,0.5412400566230561,2025-04-24 22:41:26.752838,2025-04-24 22:41:31.325861,0 days 00:00:04.573023,True,squared_error,29,,7,2,992,TPESampler,COMPLETE
1793,0.4022333352922416,2025-04-24 22:41:28.076480,2025-04-24 22:41:33.698839,0 days 00:00:05.622359,True,squared_error,35,,2,3,990,TPESampler,COMPLETE
1794,0.403458300259291,2025-04-24 22:41:29.895223,2025-04-24 22:41:35.009955,0 days 00:00:05.114732,True,squared_error,19,,2,2,866,TPESampler,COMPLETE
1795,0.4025932920741104,2025-04-24 22:41:31.524161,2025-04-24 22:41:36.715931,0 days 00:00:05.191770,True,squared_error,32,,2,3,875,TPESampler,COMPLETE
1796,0.4027262230114001,2025-04-24 22:41:33.899754,2025-04-24 22:41:39.580308,0 days 00:00:05.680554,True,squared_error,25,,2,2,991,TPESampler,COMPLETE
1797,0.41636238004531084,2025-04-24 22:41:35.214985,2025-04-24 22:41:40.215257,0 days 00:00:05.000272,True,squared_error,35,,3,3,986,TPESampler,COMPLETE
1798,0.40241666515098656,2025-04-24 22:41:36.915883,2025-04-24 22:41:42.505241,0 days 00:00:05.589358,True,squared_error,30,,2,3,982,TPESampler,COMPLETE
1799,0.4027262230114001,2025-04-24 22:41:39.785124,2025-04-24 22:41:45.446154,0 days 00:00:05.661030,True,squared_error,25,,2,4,991,TPESampler,COMPLETE
1800,0.419180428162466,2025-04-24 22:41:40.421769,2025-04-24 22:41:46.612263,0 days 00:00:06.190494,True,squared_error,32,,1,3,835,TPESampler,COMPLETE
1801,0.40245387511511854,2025-04-24 22:41:42.707194,2025-04-24 22:41:47.766842,0 days 00:00:05.059648,True,squared_error,28,,2,2,856,TPESampler,COMPLETE
1802,0.4028732196970255,2025-04-24 22:41:45.644371,2025-04-24 22:41:52.026314,0 days 00:00:06.381943,False,squared_error,37,,2,2,884,TPESampler,COMPLETE
1803,0.4178767090397026,2025-04-24 22:41:46.814928,2025-04-24 22:41:53.450030,0 days 00:00:06.635102,True,squared_error,35,,1,3,987,TPESampler,COMPLETE
1804,0.6213782670722268,2025-04-24 22:41:47.955651,2025-04-24 22:41:54.851799,0 days 00:00:06.896148,True,absolute_error,49,sqrt,1,5,426,TPESampler,COMPLETE
1805,0.4084384918305246,2025-04-24 22:41:52.236277,2025-04-24 22:41:58.044502,0 days 00:00:05.808225,True,squared_error,37,,2,7,980,TPESampler,COMPLETE
1806,0.8459409169867369,2025-04-24 22:41:53.651665,2025-04-24 22:41:56.220988,0 days 00:00:02.569323,True,squared_error,40,sqrt,2,2,855,TPESampler,COMPLETE
1807,0.4396304779268516,2025-04-24 22:41:55.056779,2025-04-24 22:41:59.526302,0 days 00:00:04.469523,True,squared_error,34,,4,2,849,TPESampler,COMPLETE
1808,0.4581088683556954,2025-04-24 22:41:56.429771,2025-04-24 22:44:04.305560,0 days 00:02:07.875789,False,absolute_error,42,,1,8,990,TPESampler,COMPLETE
1809,0.40218746204241185,2025-04-24 22:41:58.237032,2025-04-24 22:42:03.326540,0 days 00:00:05.089508,True,squared_error,34,,2,4,975,TPESampler,COMPLETE
1810,0.42008318553890245,2025-04-24 22:41:59.728969,2025-04-24 22:42:05.900648,0 days 00:00:06.171679,True,squared_error,30,,1,3,997,TPESampler,COMPLETE
1811,0.4022124081304526,2025-04-24 22:42:03.531942,2025-04-24 22:42:09.070199,0 days 00:00:05.538257,True,squared_error,33,,2,4,983,TPESampler,COMPLETE
1812,0.9739768606753115,2025-04-24 22:42:06.099614,2025-04-24 22:42:07.913963,0 days 00:00:01.814349,True,squared_error,33,sqrt,3,2,850,TPESampler,COMPLETE
1813,0.4025209261658975,2025-04-24 22:42:08.130212,2025-04-24 22:42:12.583725,0 days 00:00:04.453513,True,squared_error,29,,2,3,790,TPESampler,COMPLETE
1814,0.43965618716663735,2025-04-24 22:42:09.288068,2025-04-24 22:42:13.754410,0 days 00:00:04.466342,True,squared_error,31,,4,8,999,TPESampler,COMPLETE
1815,0.40542183933231196,2025-04-24 22:42:12.782863,2025-04-24 22:42:18.124837,0 days 00:00:05.341974,True,squared_error,37,,2,6,1000,TPESampler,COMPLETE
1816,1.3473961180680545,2025-04-24 22:42:13.952084,2025-04-24 22:42:15.592580,0 days 00:00:01.640496,True,squared_error,34,log2,12,46,879,TPESampler,COMPLETE
1817,0.6405573062856084,2025-04-24 22:42:15.786211,2025-04-24 22:43:02.978623,0 days 00:00:47.192412,False,absolute_error,23,,3,42,860,TPESampler,COMPLETE
1818,0.4026348956469661,2025-04-24 22:42:18.330441,2025-04-24 22:42:22.479740,0 days 00:00:04.149299,True,squared_error,35,,2,2,871,TPESampler,COMPLETE
1819,0.47228931095088655,2025-04-24 22:42:22.679946,2025-04-24 22:42:29.470833,0 days 00:00:06.790887,False,squared_error,38,,1,4,877,TPESampler,COMPLETE
1820,0.4161691298920868,2025-04-24 22:42:29.666142,2025-04-24 22:42:33.397729,0 days 00:00:03.731587,True,squared_error,38,,3,2,893,TPESampler,COMPLETE
1821,0.41649074544032433,2025-04-24 22:42:33.580383,2025-04-24 22:42:37.684176,0 days 00:00:04.103793,True,squared_error,35,,3,2,991,TPESampler,COMPLETE
1822,0.42625721937447664,2025-04-24 22:42:37.872706,2025-04-24 22:42:43.259152,0 days 00:00:05.386446,True,squared_error,34,,1,2,851,TPESampler,COMPLETE
1823,0.43977598334344736,2025-04-24 22:42:43.469283,2025-04-24 22:42:47.277914,0 days 00:00:03.808631,True,squared_error,28,,4,3,980,TPESampler,COMPLETE
1824,0.4024954078110198,2025-04-24 22:42:47.495913,2025-04-24 22:42:51.553671,0 days 00:00:04.057758,True,squared_error,40,,2,3,834,TPESampler,COMPLETE
1825,0.40496987655557787,2025-04-24 22:42:51.739771,2025-04-24 22:43:33.202550,0 days 00:00:41.462779,True,absolute_error,19,,2,4,994,TPESampler,COMPLETE
1826,0.6474023964014758,2025-04-24 22:43:03.185344,2025-04-24 22:43:20.913945,0 days 00:00:17.728601,False,absolute_error,25,,5,46,475,TPESampler,COMPLETE
1827,0.4935400919076481,2025-04-24 22:43:21.113077,2025-04-24 22:44:09.698078,0 days 00:00:48.585001,False,absolute_error,46,,5,5,970,TPESampler,COMPLETE
1828,1.3358715665705585,2025-04-24 22:43:33.398014,2025-04-24 22:43:34.635653,0 days 00:00:01.237639,True,absolute_error,6,log2,2,5,272,TPESampler,COMPLETE
1829,0.4165119353507597,2025-04-24 22:43:34.832205,2025-04-24 22:43:38.971344,0 days 00:00:04.139139,True,squared_error,29,,3,2,997,TPESampler,COMPLETE
1830,0.41598996033904206,2025-04-24 22:43:39.166639,2025-04-24 22:43:42.698160,0 days 00:00:03.531521,True,squared_error,27,,3,5,837,TPESampler,COMPLETE
1831,0.5745247202896906,2025-04-24 22:43:42.881488,2025-04-24 22:44:25.891301,0 days 00:00:43.009813,True,absolute_error,5,,1,17,732,TPESampler,COMPLETE
1832,0.4054331260818054,2025-04-24 22:44:04.490651,2025-04-24 22:44:08.386657,0 days 00:00:03.896006,True,squared_error,30,,2,6,856,TPESampler,COMPLETE
1833,0.4025455459219394,2025-04-24 22:44:08.574000,2025-04-24 22:44:13.639192,0 days 00:00:05.065192,True,squared_error,35,,2,2,864,TPESampler,COMPLETE
1834,0.9391623060752118,2025-04-24 22:44:09.890648,2025-04-24 22:44:11.030982,0 days 00:00:01.140334,False,squared_error,22,log2,1,10,439,TPESampler,COMPLETE
1835,0.40266524579197527,2025-04-24 22:44:11.230372,2025-04-24 22:44:16.486453,0 days 00:00:05.256081,True,squared_error,25,,2,3,989,TPESampler,COMPLETE
1836,0.402240654477862,2025-04-24 22:44:13.835020,2025-04-24 22:44:18.901760,0 days 00:00:05.066740,True,squared_error,39,,2,2,993,TPESampler,COMPLETE
1837,0.4754915465856812,2025-04-24 22:44:16.703176,2025-04-24 22:44:23.473644,0 days 00:00:06.770468,False,squared_error,27,,1,4,840,TPESampler,COMPLETE
1838,1.3455206896781424,2025-04-24 22:44:19.092088,2025-04-24 22:44:22.262586,0 days 00:00:03.170498,False,absolute_error,5,log2,2,3,819,TPESampler,COMPLETE
1839,0.7541425091601874,2025-04-24 22:44:22.454953,2025-04-24 22:44:25.925387,0 days 00:00:03.470434,True,squared_error,32,log2,1,2,991,TPESampler,COMPLETE
