number,value,datetime_start,datetime_complete,duration,params_bootstrap,params_criterion,params_max_depth,params_max_features,params_min_samples_leaf,params_min_samples_split,params_n_estimators,system_attrs_auto:sampler,state
709,0.4393983213794882,2025-04-24 22:00:13.143093,2025-04-24 22:00:17.217608,0 days 00:00:04.074515,True,squared_error,41,,4,2,877,TPESampler,COMPLETE
710,0.4225417451322373,2025-04-24 22:00:17.399217,2025-04-24 22:00:22.711986,0 days 00:00:05.312769,True,squared_error,49,,1,2,755,TPESampler,COMPLETE
711,0.4022832800052251,2025-04-24 22:00:18.732693,2025-04-24 22:00:23.707213,0 days 00:00:04.974520,True,squared_error,47,,2,2,994,TPESampler,COMPLETE
712,0.4192098417432027,2025-04-24 22:00:22.892229,2025-04-24 22:00:28.386211,0 days 00:00:05.493982,True,squared_error,30,,1,3,873,TPESampler,COMPLETE
713,0.40291110704266564,2025-04-24 22:00:23.880239,2025-04-24 22:00:27.744218,0 days 00:00:03.863979,True,squared_error,27,,2,2,805,TPESampler,COMPLETE
714,1.0304124561226282,2025-04-24 22:00:27.921243,2025-04-24 22:00:35.396652,0 days 00:00:07.475409,False,absolute_error,21,log2,1,3,504,TPESampler,COMPLETE
715,0.4024974192100261,2025-04-24 22:00:28.737167,2025-04-24 22:00:32.920396,0 days 00:00:04.183229,True,squared_error,46,,2,4,793,TPESampler,COMPLETE
716,0.43087969352487293,2025-04-24 22:00:28.813136,2025-04-24 22:01:41.133220,0 days 00:01:12.320084,True,absolute_error,33,,1,2,934,TPESampler,COMPLETE
717,0.7127090808109952,2025-04-24 22:00:33.090077,2025-04-24 22:00:48.099695,0 days 00:00:15.009618,False,absolute_error,39,,15,10,837,TPESampler,COMPLETE
718,0.9711963827057793,2025-04-24 22:00:35.575394,2025-04-24 22:00:37.342470,0 days 00:00:01.767076,True,squared_error,46,sqrt,3,2,944,TPESampler,COMPLETE
719,0.4023759016793659,2025-04-24 22:00:37.509313,2025-04-24 22:00:41.501474,0 days 00:00:03.992161,True,squared_error,39,,2,2,844,TPESampler,COMPLETE
720,0.9352895721016551,2025-04-24 22:00:41.671345,2025-04-24 22:00:43.890010,0 days 00:00:02.218665,True,squared_error,21,log2,1,2,996,TPESampler,COMPLETE
721,0.4163856497417495,2025-04-24 22:00:44.055245,2025-04-24 22:00:48.129697,0 days 00:00:04.074452,True,squared_error,50,,3,2,985,TPESampler,COMPLETE
722,0.40265302121045354,2025-04-24 22:00:48.216886,2025-04-24 22:00:53.161349,0 days 00:00:04.944463,True,squared_error,50,,2,4,881,TPESampler,COMPLETE
723,1.278797324438262,2025-04-24 22:00:48.254385,2025-04-24 22:00:49.842654,0 days 00:00:01.588269,True,squared_error,38,sqrt,10,3,519,TPESampler,COMPLETE
724,0.4396141554500507,2025-04-24 22:00:50.028975,2025-04-24 22:00:53.797242,0 days 00:00:03.768267,True,squared_error,23,,4,4,938,TPESampler,COMPLETE
725,0.4023320812796236,2025-04-24 22:00:53.338499,2025-04-24 22:00:58.339717,0 days 00:00:05.001218,True,squared_error,31,,2,2,999,TPESampler,COMPLETE
726,0.40253750197275967,2025-04-24 22:00:54.215944,2025-04-24 22:00:58.343182,0 days 00:00:04.127238,True,squared_error,36,,2,3,863,TPESampler,COMPLETE
727,0.41608615087566136,2025-04-24 22:00:58.477598,2025-04-24 22:02:03.859046,0 days 00:01:05.381448,True,absolute_error,50,,1,4,857,TPESampler,COMPLETE
728,0.6900823991057639,2025-04-24 22:00:58.529954,2025-04-24 22:01:01.610646,0 days 00:00:03.080692,False,squared_error,11,,4,32,597,TPESampler,COMPLETE
729,0.40229480858071254,2025-04-24 22:01:01.790934,2025-04-24 22:01:06.426147,0 days 00:00:04.635213,True,squared_error,35,,2,3,991,TPESampler,COMPLETE
730,0.41820303387820534,2025-04-24 22:01:06.608033,2025-04-24 22:01:12.430149,0 days 00:00:05.822116,True,squared_error,41,,1,3,997,TPESampler,COMPLETE
731,1.0113339452481445,2025-04-24 22:01:12.649032,2025-04-24 22:01:14.419515,0 days 00:00:01.770483,True,squared_error,12,sqrt,2,38,888,TPESampler,COMPLETE
732,0.40218194661575374,2025-04-24 22:01:14.590742,2025-04-24 22:01:19.192610,0 days 00:00:04.601868,True,squared_error,38,,2,3,985,TPESampler,COMPLETE
733,0.40223200932255093,2025-04-24 22:01:19.379631,2025-04-24 22:01:24.086996,0 days 00:00:04.707365,True,squared_error,32,,2,3,993,TPESampler,COMPLETE
734,0.4022595238614904,2025-04-24 22:01:24.261435,2025-04-24 22:01:28.749262,0 days 00:00:04.487827,True,squared_error,41,,2,4,962,TPESampler,COMPLETE
735,0.40222116043429706,2025-04-24 22:01:29.096781,2025-04-24 22:01:33.995865,0 days 00:00:04.899084,True,squared_error,42,,2,4,987,TPESampler,COMPLETE
736,1.0853264343019313,2025-04-24 22:01:34.196200,2025-04-24 22:01:35.055638,0 days 00:00:00.859438,True,squared_error,48,sqrt,4,41,240,TPESampler,COMPLETE
737,0.40286813552917383,2025-04-24 22:01:35.228319,2025-04-24 22:01:41.347223,0 days 00:00:06.118904,False,squared_error,35,,2,2,941,TPESampler,COMPLETE
738,0.8486763433915989,2025-04-24 22:01:41.301754,2025-04-24 22:01:43.536316,0 days 00:00:02.234562,True,squared_error,32,sqrt,2,2,871,TPESampler,COMPLETE
739,0.43965163595953727,2025-04-24 22:01:41.558145,2025-04-24 22:01:46.085904,0 days 00:00:04.527759,True,squared_error,50,,4,5,991,TPESampler,COMPLETE
740,0.4204035535499668,2025-04-24 22:01:43.718443,2025-04-24 22:01:49.140054,0 days 00:00:05.421611,True,squared_error,21,,1,3,907,TPESampler,COMPLETE
741,0.41615528933469836,2025-04-24 22:01:46.274539,2025-04-24 22:01:50.109742,0 days 00:00:03.835203,True,squared_error,38,,3,5,888,TPESampler,COMPLETE
742,1.3541345813480132,2025-04-24 22:01:49.383891,2025-04-24 22:01:50.582566,0 days 00:00:01.198675,True,absolute_error,16,sqrt,10,10,213,TPESampler,COMPLETE
743,0.4030099889519406,2025-04-24 22:01:50.357536,2025-04-24 22:01:55.785060,0 days 00:00:05.427524,True,squared_error,25,,2,5,975,TPESampler,COMPLETE
744,1.237371316288441,2025-04-24 22:01:50.784784,2025-04-24 22:01:52.860079,0 days 00:00:02.075295,True,squared_error,46,log2,2,12,821,TPESampler,COMPLETE
745,0.846971267710078,2025-04-24 22:01:53.042058,2025-04-24 22:01:55.159628,0 days 00:00:02.117570,True,squared_error,41,sqrt,2,3,993,TPESampler,COMPLETE
746,0.4783215140999811,2025-04-24 22:01:55.338676,2025-04-24 22:02:02.000228,0 days 00:00:06.661552,True,absolute_error,14,,4,2,281,TPESampler,COMPLETE
747,0.42310734470045214,2025-04-24 22:01:56.053962,2025-04-24 22:02:01.775944,0 days 00:00:05.721982,True,squared_error,47,,1,2,892,TPESampler,COMPLETE
748,0.40765302747034704,2025-04-24 22:02:01.952827,2025-04-24 22:02:04.885535,0 days 00:00:02.932708,True,squared_error,40,,1,6,435,TPESampler,COMPLETE
749,0.6335049772031082,2025-04-24 22:02:02.207016,2025-04-24 22:02:23.811529,0 days 00:00:21.604513,True,absolute_error,8,,1,33,387,TPESampler,COMPLETE
750,0.4084820200809393,2025-04-24 22:02:04.033640,2025-04-24 22:02:07.944701,0 days 00:00:03.911061,True,squared_error,32,,2,7,809,TPESampler,COMPLETE
751,0.42527485663965314,2025-04-24 22:02:05.061249,2025-04-24 22:02:11.510782,0 days 00:00:06.449533,True,squared_error,29,,1,2,984,TPESampler,COMPLETE
752,0.4164106768056004,2025-04-24 22:02:08.119139,2025-04-24 22:02:12.571591,0 days 00:00:04.452452,True,squared_error,43,,3,2,982,TPESampler,COMPLETE
753,0.43943424372215983,2025-04-24 22:02:11.691697,2025-04-24 22:02:15.547117,0 days 00:00:03.855420,True,squared_error,29,,4,2,885,TPESampler,COMPLETE
754,0.40237662031300964,2025-04-24 22:02:12.767187,2025-04-24 22:02:17.076194,0 days 00:00:04.309007,True,squared_error,48,,2,3,849,TPESampler,COMPLETE
755,0.6219872944280097,2025-04-24 22:02:15.735796,2025-04-24 22:02:17.028282,0 days 00:00:01.292486,True,squared_error,44,log2,1,2,289,TPESampler,COMPLETE
756,0.43965271813880824,2025-04-24 22:02:17.171950,2025-04-24 22:02:21.765126,0 days 00:00:04.593176,True,squared_error,41,,4,4,1000,TPESampler,COMPLETE
757,0.4160679605227207,2025-04-24 22:02:17.234172,2025-04-24 22:02:21.365297,0 days 00:00:04.131125,True,squared_error,36,,3,4,854,TPESampler,COMPLETE
758,1.3950606424037117,2025-04-24 22:02:21.551403,2025-04-24 22:02:22.354172,0 days 00:00:00.802769,True,absolute_error,18,log2,7,6,103,TPESampler,COMPLETE
759,1.2063796554215818,2025-04-24 22:02:21.966493,2025-04-24 22:02:23.787749,0 days 00:00:01.821256,False,squared_error,30,sqrt,10,2,930,TPESampler,COMPLETE
760,0.43973919642736004,2025-04-24 22:02:22.575992,2025-04-24 22:02:27.475489,0 days 00:00:04.899497,True,squared_error,36,,4,2,986,TPESampler,COMPLETE
761,0.4244180043333183,2025-04-24 22:02:23.956616,2025-04-24 22:02:30.336015,0 days 00:00:06.379399,True,squared_error,35,,1,2,832,TPESampler,COMPLETE
762,0.4024043240379661,2025-04-24 22:02:24.001591,2025-04-24 22:02:29.057778,0 days 00:00:05.056187,True,squared_error,33,,2,3,852,TPESampler,COMPLETE
763,0.4022324925345733,2025-04-24 22:02:27.744037,2025-04-24 22:02:33.403187,0 days 00:00:05.659150,True,squared_error,38,,2,3,989,TPESampler,COMPLETE
764,1.3474157832304348,2025-04-24 22:02:29.252747,2025-04-24 22:02:30.566795,0 days 00:00:01.314048,False,absolute_error,39,sqrt,15,15,384,TPESampler,COMPLETE
765,0.43384682622028103,2025-04-24 22:02:30.524654,2025-04-24 22:03:09.953351,0 days 00:00:39.428697,True,absolute_error,15,,1,2,521,TPESampler,COMPLETE
766,1.0763206529827851,2025-04-24 22:02:30.817524,2025-04-24 22:02:32.713321,0 days 00:00:01.895797,True,squared_error,18,log2,1,18,874,TPESampler,COMPLETE
767,0.4022649904552218,2025-04-24 22:02:32.916110,2025-04-24 22:02:37.983002,0 days 00:00:05.066892,True,squared_error,49,,2,3,982,TPESampler,COMPLETE
768,0.41638113044184855,2025-04-24 22:02:33.838986,2025-04-24 22:02:38.046980,0 days 00:00:04.207994,True,squared_error,32,,3,3,987,TPESampler,COMPLETE
769,0.4023741663634613,2025-04-24 22:02:38.118296,2025-04-24 22:02:43.179138,0 days 00:00:05.060842,True,squared_error,34,,2,2,998,TPESampler,COMPLETE
770,0.4027993530095251,2025-04-24 22:02:38.211309,2025-04-24 22:02:43.226628,0 days 00:00:05.015319,True,squared_error,35,,2,5,992,TPESampler,COMPLETE
771,0.40941752414026505,2025-04-24 22:02:43.332618,2025-04-24 22:02:49.065518,0 days 00:00:05.732900,True,squared_error,27,,1,4,993,TPESampler,COMPLETE
772,0.42268053202454664,2025-04-24 22:02:43.373255,2025-04-24 22:04:01.315398,0 days 00:01:17.942143,True,absolute_error,31,,1,6,964,TPESampler,COMPLETE
773,1.2880712425218495,2025-04-24 22:02:49.252841,2025-04-24 22:02:50.742739,0 days 00:00:01.489898,True,squared_error,44,log2,3,4,904,TPESampler,COMPLETE
774,1.0029968419856112,2025-04-24 22:02:50.924559,2025-04-24 22:02:52.269960,0 days 00:00:01.345401,True,squared_error,20,log2,1,6,555,TPESampler,COMPLETE
775,0.402240654477862,2025-04-24 22:02:52.446700,2025-04-24 22:02:57.044052,0 days 00:00:04.597352,True,squared_error,38,,2,2,993,TPESampler,COMPLETE
776,0.40305752632172576,2025-04-24 22:02:57.226662,2025-04-24 22:03:47.337398,0 days 00:00:50.110736,True,absolute_error,45,,2,2,994,TPESampler,COMPLETE
777,0.41642857573861425,2025-04-24 22:03:10.337874,2025-04-24 22:03:14.313484,0 days 00:00:03.975610,True,squared_error,26,,3,4,978,TPESampler,COMPLETE
778,0.402240654477862,2025-04-24 22:03:14.484588,2025-04-24 22:03:19.136893,0 days 00:00:04.652305,True,squared_error,49,,2,2,993,TPESampler,COMPLETE
779,0.4084380826979883,2025-04-24 22:03:19.303661,2025-04-24 22:03:24.652027,0 days 00:00:05.348366,True,squared_error,33,,1,4,994,TPESampler,COMPLETE
780,0.42474388038591043,2025-04-24 22:03:24.823978,2025-04-24 22:03:30.364785,0 days 00:00:05.540807,True,squared_error,42,,1,2,856,TPESampler,COMPLETE
781,1.329378499187122,2025-04-24 22:03:30.538939,2025-04-24 22:03:31.461432,0 days 00:00:00.922493,False,absolute_error,24,log2,3,15,126,TPESampler,COMPLETE
782,0.4029622496443473,2025-04-24 22:03:31.638950,2025-04-24 22:03:35.605099,0 days 00:00:03.966149,True,squared_error,26,,2,2,825,TPESampler,COMPLETE
783,1.2826156358354368,2025-04-24 22:03:35.778256,2025-04-24 22:03:41.171747,0 days 00:00:05.393491,False,absolute_error,16,log2,2,11,710,TPESampler,COMPLETE
784,0.40231066201535587,2025-04-24 22:03:41.334092,2025-04-24 22:03:45.459518,0 days 00:00:04.125426,True,squared_error,42,,2,4,840,TPESampler,COMPLETE
785,0.402240654477862,2025-04-24 22:03:45.635559,2025-04-24 22:03:50.586027,0 days 00:00:04.950468,True,squared_error,43,,2,4,993,TPESampler,COMPLETE
786,0.4023741663634613,2025-04-24 22:03:47.523694,2025-04-24 22:03:52.474488,0 days 00:00:04.950794,True,squared_error,34,,2,2,998,TPESampler,COMPLETE
787,0.4026533160933362,2025-04-24 22:03:50.765291,2025-04-24 22:03:55.146140,0 days 00:00:04.380849,True,squared_error,36,,2,4,802,TPESampler,COMPLETE
788,0.42109161112088395,2025-04-24 22:03:52.653887,2025-04-24 22:03:58.041896,0 days 00:00:05.388009,False,squared_error,16,,2,6,923,TPESampler,COMPLETE
789,0.40230045900355177,2025-04-24 22:03:55.323925,2025-04-24 22:04:00.272618,0 days 00:00:04.948693,True,squared_error,35,,2,3,996,TPESampler,COMPLETE
790,0.4289224648254362,2025-04-24 22:03:58.214995,2025-04-24 22:04:03.264558,0 days 00:00:05.049563,False,squared_error,41,,3,2,800,TPESampler,COMPLETE
791,0.47630707739497846,2025-04-24 22:04:00.441720,2025-04-24 22:04:23.781941,0 days 00:00:23.340221,True,absolute_error,35,,4,2,985,TPESampler,COMPLETE
792,0.8394110524402858,2025-04-24 22:04:01.489273,2025-04-24 22:04:07.898527,0 days 00:00:06.409254,True,absolute_error,34,log2,1,2,529,TPESampler,COMPLETE
793,0.4394782227066694,2025-04-24 22:04:03.437815,2025-04-24 22:04:06.930007,0 days 00:00:03.492192,True,squared_error,43,,4,2,868,TPESampler,COMPLETE
794,0.4234085699397043,2025-04-24 22:04:07.108073,2025-04-24 22:04:14.058073,0 days 00:00:06.950000,True,squared_error,41,,1,2,979,TPESampler,COMPLETE
795,0.4026490225309382,2025-04-24 22:04:08.083215,2025-04-24 22:04:12.068122,0 days 00:00:03.984907,True,squared_error,32,,2,2,821,TPESampler,COMPLETE
796,0.40244537423103216,2025-04-24 22:04:12.241486,2025-04-24 22:04:17.292660,0 days 00:00:05.051174,True,squared_error,30,,2,3,992,TPESampler,COMPLETE
797,1.1268339190034107,2025-04-24 22:04:14.237476,2025-04-24 22:04:18.464813,0 days 00:00:04.227337,True,absolute_error,46,sqrt,3,6,714,TPESampler,COMPLETE
798,0.4188058961791784,2025-04-24 22:04:17.474070,2025-04-24 22:04:23.877956,0 days 00:00:06.403886,True,squared_error,46,,1,3,989,TPESampler,COMPLETE
799,0.40218194661575374,2025-04-24 22:04:18.643769,2025-04-24 22:04:23.320967,0 days 00:00:04.677198,True,squared_error,50,,2,4,985,TPESampler,COMPLETE
800,1.1922320093931522,2025-04-24 22:04:23.495806,2025-04-24 22:04:25.649569,0 days 00:00:02.153763,False,squared_error,28,sqrt,9,21,833,TPESampler,COMPLETE
801,0.4162135633001781,2025-04-24 22:04:23.972936,2025-04-24 22:04:29.374071,0 days 00:00:05.401135,True,squared_error,49,,3,4,943,TPESampler,COMPLETE
802,0.4025975918758545,2025-04-24 22:04:24.327673,2025-04-24 22:04:29.911119,0 days 00:00:05.583446,True,squared_error,47,,2,4,917,TPESampler,COMPLETE
803,1.1396914421698594,2025-04-24 22:04:25.823977,2025-04-24 22:04:27.286643,0 days 00:00:01.462666,True,absolute_error,30,sqrt,3,27,192,TPESampler,COMPLETE
804,0.41945071356106517,2025-04-24 22:04:27.478572,2025-04-24 22:04:32.666407,0 days 00:00:05.187835,True,squared_error,43,,1,10,994,TPESampler,COMPLETE
805,0.9648766347144277,2025-04-24 22:04:29.556768,2025-04-24 22:04:33.238167,0 days 00:00:03.681399,False,absolute_error,46,sqrt,2,15,223,TPESampler,COMPLETE
806,0.48289158279907957,2025-04-24 22:04:30.144991,2025-04-24 22:05:45.548455,0 days 00:01:15.403464,False,absolute_error,27,,1,4,621,TPESampler,COMPLETE
807,0.4022649904552218,2025-04-24 22:04:32.836992,2025-04-24 22:04:38.554515,0 days 00:00:05.717523,True,squared_error,49,,2,2,982,TPESampler,COMPLETE
808,1.3908737269417182,2025-04-24 22:04:33.652090,2025-04-24 22:04:35.106301,0 days 00:00:01.454211,True,absolute_error,22,log2,7,27,623,TPESampler,COMPLETE
809,1.3088962220616358,2025-04-24 22:04:35.285763,2025-04-24 22:04:36.997047,0 days 00:00:01.711284,True,squared_error,36,log2,4,19,998,TPESampler,COMPLETE
810,0.4026359831458069,2025-04-24 22:04:37.188802,2025-04-24 22:04:41.453283,0 days 00:00:04.264481,True,squared_error,48,,2,3,872,TPESampler,COMPLETE
811,0.6082884195603645,2025-04-24 22:04:38.736442,2025-04-24 22:05:11.422671,0 days 00:00:32.686229,False,absolute_error,8,,1,13,331,TPESampler,COMPLETE
812,0.40805367470535653,2025-04-24 22:04:41.627579,2025-04-24 22:04:44.835619,0 days 00:00:03.208040,True,squared_error,18,,2,6,727,TPESampler,COMPLETE
813,0.40225646780307955,2025-04-24 22:04:45.004944,2025-04-24 22:04:49.364820,0 days 00:00:04.359876,True,squared_error,49,,2,4,947,TPESampler,COMPLETE
814,0.40286892946231173,2025-04-24 22:04:49.533545,2025-04-24 22:04:56.011819,0 days 00:00:06.478274,False,squared_error,41,,2,3,999,TPESampler,COMPLETE
815,0.866845808680679,2025-04-24 22:04:56.184578,2025-04-24 22:04:58.093667,0 days 00:00:01.909089,True,squared_error,24,sqrt,2,3,979,TPESampler,COMPLETE
816,1.2503139329630164,2025-04-24 22:04:58.259281,2025-04-24 22:05:00.330353,0 days 00:00:02.071072,False,absolute_error,24,sqrt,7,7,414,TPESampler,COMPLETE
817,1.3501794188583816,2025-04-24 22:05:00.512537,2025-04-24 22:05:01.658128,0 days 00:00:01.145591,True,squared_error,49,log2,11,26,602,TPESampler,COMPLETE
818,0.40260628097815315,2025-04-24 22:05:01.840752,2025-04-24 22:05:05.915857,0 days 00:00:04.075105,True,squared_error,42,,2,2,870,TPESampler,COMPLETE
819,0.4053877780070549,2025-04-24 22:05:06.087951,2025-04-24 22:05:10.262746,0 days 00:00:04.174795,True,squared_error,50,,2,6,965,TPESampler,COMPLETE
820,1.350048763520797,2025-04-24 22:05:10.521592,2025-04-24 22:05:12.240767,0 days 00:00:01.719175,True,squared_error,7,log2,13,15,827,TPESampler,COMPLETE
821,1.2546793688153035,2025-04-24 22:05:11.627593,2025-04-24 22:05:12.797000,0 days 00:00:01.169407,False,squared_error,17,sqrt,14,12,336,TPESampler,COMPLETE
822,0.40222958926160896,2025-04-24 22:05:12.591115,2025-04-24 22:05:17.973507,0 days 00:00:05.382392,True,squared_error,49,,2,4,983,TPESampler,COMPLETE
823,1.2282578170486305,2025-04-24 22:05:12.999541,2025-04-24 22:05:15.068297,0 days 00:00:02.068756,True,squared_error,28,log2,2,3,963,TPESampler,COMPLETE
824,0.5566408673834863,2025-04-24 22:05:15.253902,2025-04-24 22:05:18.203372,0 days 00:00:02.949470,True,squared_error,12,,4,27,825,TPESampler,COMPLETE
825,0.40275728264204924,2025-04-24 22:05:18.159459,2025-04-24 22:05:22.988051,0 days 00:00:04.828592,True,squared_error,45,,2,2,885,TPESampler,COMPLETE
826,1.390836066338529,2025-04-24 22:05:18.448773,2025-04-24 22:05:20.162888,0 days 00:00:01.714115,False,absolute_error,31,log2,9,24,625,TPESampler,COMPLETE
827,0.40497229206182134,2025-04-24 22:05:20.354715,2025-04-24 22:05:26.013110,0 days 00:00:05.658395,True,squared_error,43,,1,5,985,TPESampler,COMPLETE
828,0.40261979340792153,2025-04-24 22:05:23.172644,2025-04-24 22:05:28.164323,0 days 00:00:04.991679,True,squared_error,23,,2,3,974,TPESampler,COMPLETE
829,0.9872412983622637,2025-04-24 22:05:26.214734,2025-04-24 22:05:27.842308,0 days 00:00:01.627574,False,squared_error,17,sqrt,4,2,928,TPESampler,COMPLETE
830,0.4022649904552218,2025-04-24 22:05:28.035693,2025-04-24 22:05:33.422903,0 days 00:00:05.387210,True,squared_error,45,,2,3,982,TPESampler,COMPLETE
831,1.2296852428294898,2025-04-24 22:05:28.388691,2025-04-24 22:05:30.642169,0 days 00:00:02.253478,True,squared_error,46,log2,2,4,986,TPESampler,COMPLETE
832,0.402320512372665,2025-04-24 22:05:30.830886,2025-04-24 22:05:36.222672,0 days 00:00:05.391786,True,squared_error,42,,2,2,997,TPESampler,COMPLETE
833,1.1884396440930642,2025-04-24 22:05:33.617078,2025-04-24 22:05:34.805371,0 days 00:00:01.188293,True,squared_error,18,sqrt,6,3,258,TPESampler,COMPLETE
834,0.630940943090088,2025-04-24 22:05:34.993934,2025-04-24 22:05:37.639777,0 days 00:00:02.645843,True,squared_error,46,sqrt,1,9,913,TPESampler,COMPLETE
835,0.845731461438441,2025-04-24 22:05:36.409110,2025-04-24 22:05:38.723456,0 days 00:00:02.314346,True,squared_error,49,sqrt,2,5,849,TPESampler,COMPLETE
836,0.4073802777074387,2025-04-24 22:05:37.832974,2025-04-24 22:05:43.095743,0 days 00:00:05.262769,True,squared_error,48,,1,4,886,TPESampler,COMPLETE
837,0.40287356930838797,2025-04-24 22:05:38.911632,2025-04-24 22:05:44.998517,0 days 00:00:06.086885,False,squared_error,49,,2,2,885,TPESampler,COMPLETE
838,0.4397301230270905,2025-04-24 22:05:43.276184,2025-04-24 22:05:48.246184,0 days 00:00:04.970000,True,squared_error,44,,4,3,987,TPESampler,COMPLETE
839,1.1164516486912153,2025-04-24 22:05:45.205562,2025-04-24 22:05:46.885724,0 days 00:00:01.680162,False,squared_error,5,sqrt,1,3,678,TPESampler,COMPLETE
840,0.41609890972814295,2025-04-24 22:05:45.747334,2025-04-24 22:05:50.419083,0 days 00:00:04.671749,True,squared_error,27,,3,3,852,TPESampler,COMPLETE
841,0.447290798439126,2025-04-24 22:05:47.070989,2025-04-24 22:05:52.639482,0 days 00:00:05.568493,False,squared_error,49,,4,4,971,TPESampler,COMPLETE
842,0.40229325777407865,2025-04-24 22:05:48.423542,2025-04-24 22:05:54.271156,0 days 00:00:05.847614,True,squared_error,34,,2,4,1000,TPESampler,COMPLETE
843,1.2428046045218089,2025-04-24 22:05:50.622263,2025-04-24 22:05:52.037302,0 days 00:00:01.415039,False,squared_error,28,log2,3,2,840,TPESampler,COMPLETE
844,0.4026499864781384,2025-04-24 22:05:52.212924,2025-04-24 22:05:57.539858,0 days 00:00:05.326934,True,squared_error,26,,2,4,999,TPESampler,COMPLETE
845,0.5800159248456372,2025-04-24 22:05:53.107925,2025-04-24 22:06:06.733229,0 days 00:00:13.625304,True,absolute_error,6,,6,7,843,TPESampler,COMPLETE
846,0.40273709333439195,2025-04-24 22:05:54.458767,2025-04-24 22:05:59.028199,0 days 00:00:04.569432,True,squared_error,39,,2,2,889,TPESampler,COMPLETE
847,0.4164106768056004,2025-04-24 22:05:57.719295,2025-04-24 22:06:02.187649,0 days 00:00:04.468354,True,squared_error,41,,3,2,982,TPESampler,COMPLETE
848,0.4233253823083626,2025-04-24 22:05:59.203053,2025-04-24 22:06:06.335382,0 days 00:00:07.132329,True,squared_error,41,,1,2,973,TPESampler,COMPLETE
849,0.8453596880589228,2025-04-24 22:06:02.367463,2025-04-24 22:06:04.047016,0 days 00:00:01.679553,True,squared_error,49,sqrt,2,2,723,TPESampler,COMPLETE
850,1.307247489650755,2025-04-24 22:06:04.222247,2025-04-24 22:06:05.794178,0 days 00:00:01.571931,True,squared_error,50,log2,4,2,865,TPESampler,COMPLETE
