number,value,datetime_start,datetime_complete,duration,params_bootstrap,params_criterion,params_max_depth,params_max_features,params_min_samples_leaf,params_min_samples_split,params_n_estimators,system_attrs_auto:sampler,state
2405,0.7331541269251034,2025-04-24 23:05:07.032575,2025-04-24 23:05:10.572836,0 days 00:00:03.540261,True,squared_error,38,log2,1,4,999,TPESampler,COMPLETE
2406,1.1241782443956265,2025-04-24 23:05:08.436722,2025-04-24 23:05:09.362085,0 days 00:00:00.925363,False,squared_error,10,log2,1,8,209,TPESampler,COMPLETE
2407,1.2381688228699486,2025-04-24 23:05:09.558994,2025-04-24 23:05:13.604672,0 days 00:00:04.045678,False,absolute_error,6,sqrt,1,39,352,TPESampler,COMPLETE
2408,0.4395281789350686,2025-04-24 23:05:10.761283,2025-04-24 23:05:15.254847,0 days 00:00:04.493564,True,squared_error,28,,4,2,855,TPESampler,COMPLETE
2409,0.41651183820046933,2025-04-24 23:05:12.581901,2025-04-24 23:05:17.873656,0 days 00:00:05.291755,True,squared_error,31,,3,4,999,TPESampler,COMPLETE
2410,0.4028834421654443,2025-04-24 23:05:13.795945,2025-04-24 23:05:19.372428,0 days 00:00:05.576483,True,squared_error,31,,2,5,998,TPESampler,COMPLETE
2411,0.41649459025198,2025-04-24 23:05:15.452844,2025-04-24 23:05:20.419658,0 days 00:00:04.966814,True,squared_error,34,,3,3,995,TPESampler,COMPLETE
2412,0.4028723023330666,2025-04-24 23:05:18.065775,2025-04-24 23:05:24.050887,0 days 00:00:05.985112,False,squared_error,35,,2,4,781,TPESampler,COMPLETE
2413,0.7737836092331912,2025-04-24 23:05:19.562122,2025-04-24 23:05:22.573504,0 days 00:00:03.011382,True,absolute_error,27,sqrt,1,7,177,TPESampler,COMPLETE
2414,0.41605041234106993,2025-04-24 23:05:20.606440,2025-04-24 23:05:25.331292,0 days 00:00:04.724852,True,squared_error,30,,3,4,847,TPESampler,COMPLETE
2415,0.4025309373561724,2025-04-24 23:05:22.764227,2025-04-24 23:05:28.417169,0 days 00:00:05.652942,True,squared_error,27,,2,4,986,TPESampler,COMPLETE
2416,0.43213727681440023,2025-04-24 23:05:24.247097,2025-04-24 23:05:30.383331,0 days 00:00:06.136234,False,squared_error,42,,1,9,822,TPESampler,COMPLETE
2417,0.4268954373148349,2025-04-24 23:05:25.519286,2025-04-24 23:05:49.840197,0 days 00:00:24.320911,True,absolute_error,39,,3,3,821,TPESampler,COMPLETE
2418,0.4023259613133283,2025-04-24 23:05:28.605834,2025-04-24 23:05:33.704189,0 days 00:00:05.098355,True,squared_error,37,,2,2,999,TPESampler,COMPLETE
2419,0.4022198806645224,2025-04-24 23:05:30.585047,2025-04-24 23:05:35.673752,0 days 00:00:05.088705,True,squared_error,34,,2,4,988,TPESampler,COMPLETE
2420,0.41651152129787683,2025-04-24 23:05:33.891057,2025-04-24 23:05:38.526639,0 days 00:00:04.635582,True,squared_error,38,,3,3,996,TPESampler,COMPLETE
2421,0.44524375091533586,2025-04-24 23:05:35.860274,2025-04-24 23:06:45.748559,0 days 00:01:09.888285,True,absolute_error,37,,1,9,990,TPESampler,COMPLETE
2422,0.41687577943668885,2025-04-24 23:05:38.716737,2025-04-24 23:05:43.232900,0 days 00:00:04.516163,True,squared_error,29,,1,3,783,TPESampler,COMPLETE
2423,0.40289632647206347,2025-04-24 23:05:43.414232,2025-04-24 23:05:47.414520,0 days 00:00:04.000288,True,squared_error,32,,2,5,866,TPESampler,COMPLETE
2424,1.2751833809678348,2025-04-24 23:05:47.616565,2025-04-24 23:05:49.014495,0 days 00:00:01.397930,True,squared_error,7,log2,2,27,740,TPESampler,COMPLETE
2425,0.411818403116641,2025-04-24 23:05:49.202124,2025-04-24 23:05:53.435990,0 days 00:00:04.233866,True,squared_error,38,,2,8,858,TPESampler,COMPLETE
2426,0.402638221461731,2025-04-24 23:05:50.178137,2025-04-24 23:05:54.566850,0 days 00:00:04.388713,True,squared_error,27,,2,3,843,TPESampler,COMPLETE
2427,1.2082128843464117,2025-04-24 23:05:53.629138,2025-04-24 23:05:56.014314,0 days 00:00:02.385176,True,absolute_error,21,sqrt,4,17,407,TPESampler,COMPLETE
2428,0.4192712335513628,2025-04-24 23:05:54.771374,2025-04-24 23:06:01.109657,0 days 00:00:06.338283,True,squared_error,33,,1,3,978,TPESampler,COMPLETE
2429,1.3489569210358126,2025-04-24 23:05:56.218770,2025-04-24 23:05:57.212455,0 days 00:00:00.993685,True,squared_error,46,log2,15,25,320,TPESampler,COMPLETE
2430,0.41605041234106993,2025-04-24 23:05:57.415065,2025-04-24 23:06:01.079622,0 days 00:00:03.664557,True,squared_error,34,,3,2,847,TPESampler,COMPLETE
2431,0.4259461378659377,2025-04-24 23:06:01.227250,2025-04-24 23:06:02.947350,0 days 00:00:01.720100,False,squared_error,41,,2,10,123,TPESampler,COMPLETE
2432,0.4256423345231749,2025-04-24 23:06:01.272476,2025-04-24 23:06:07.659173,0 days 00:00:06.386697,True,squared_error,36,,1,2,869,TPESampler,COMPLETE
2433,0.4165119353507597,2025-04-24 23:06:03.159229,2025-04-24 23:06:07.357986,0 days 00:00:04.198757,True,squared_error,26,,3,2,997,TPESampler,COMPLETE
2434,0.4280232608675344,2025-04-24 23:06:07.543298,2025-04-24 23:06:12.883568,0 days 00:00:05.340270,True,squared_error,18,,1,2,871,TPESampler,COMPLETE
2435,0.4028590244728756,2025-04-24 23:06:07.918902,2025-04-24 23:06:14.868024,0 days 00:00:06.949122,False,squared_error,31,,2,2,974,TPESampler,COMPLETE
2436,0.41860389381898,2025-04-24 23:06:13.071858,2025-04-24 23:06:17.534992,0 days 00:00:04.463134,True,squared_error,24,,3,7,983,TPESampler,COMPLETE
2437,0.4025545379411974,2025-04-24 23:06:15.057960,2025-04-24 23:06:19.530597,0 days 00:00:04.472637,True,squared_error,34,,2,2,827,TPESampler,COMPLETE
2438,1.2882860960654265,2025-04-24 23:06:17.738234,2025-04-24 23:06:18.831557,0 days 00:00:01.093323,False,absolute_error,18,sqrt,8,2,135,TPESampler,COMPLETE
2439,0.43187316439358014,2025-04-24 23:06:19.038169,2025-04-24 23:07:15.844934,0 days 00:00:56.806765,True,absolute_error,23,,1,2,791,TPESampler,COMPLETE
2440,0.9970224445985598,2025-04-24 23:06:19.940643,2025-04-24 23:06:30.709064,0 days 00:00:10.768421,False,absolute_error,49,sqrt,2,35,724,TPESampler,COMPLETE
2441,0.4289197546450273,2025-04-24 23:06:30.895993,2025-04-24 23:06:36.500620,0 days 00:00:05.604627,False,squared_error,35,,3,4,997,TPESampler,COMPLETE
2442,0.6871899429528541,2025-04-24 23:06:36.686436,2025-04-24 23:06:38.967216,0 days 00:00:02.280780,True,squared_error,28,sqrt,1,8,918,TPESampler,COMPLETE
2443,0.40265215974004337,2025-04-24 23:06:39.155546,2025-04-24 23:06:43.082007,0 days 00:00:03.926461,True,squared_error,35,,2,4,822,TPESampler,COMPLETE
2444,0.402497475706624,2025-04-24 23:06:43.288435,2025-04-24 23:06:47.840230,0 days 00:00:04.551795,True,squared_error,37,,2,3,866,TPESampler,COMPLETE
2445,0.4190581170645234,2025-04-24 23:06:45.935645,2025-04-24 23:06:51.593246,0 days 00:00:05.657601,True,squared_error,37,,1,3,887,TPESampler,COMPLETE
2446,0.405419521291069,2025-04-24 23:06:48.031870,2025-04-24 23:06:52.888126,0 days 00:00:04.856256,True,squared_error,35,,2,6,977,TPESampler,COMPLETE
2447,0.8652318132168295,2025-04-24 23:06:51.794079,2025-04-24 23:06:54.418353,0 days 00:00:02.624274,True,squared_error,25,sqrt,2,2,995,TPESampler,COMPLETE
2448,0.402240654477862,2025-04-24 23:06:53.082996,2025-04-24 23:06:58.301777,0 days 00:00:05.218781,True,squared_error,37,,2,3,993,TPESampler,COMPLETE
2449,0.43962623018094354,2025-04-24 23:06:54.605215,2025-04-24 23:06:58.067173,0 days 00:00:03.461958,True,squared_error,32,,4,6,851,TPESampler,COMPLETE
2450,0.4087877936233477,2025-04-24 23:06:58.261138,2025-04-24 23:07:04.626628,0 days 00:00:06.365490,True,squared_error,36,,1,4,999,TPESampler,COMPLETE
2451,0.4027906137229525,2025-04-24 23:06:58.509544,2025-04-24 23:07:03.072256,0 days 00:00:04.562712,True,squared_error,27,,2,2,868,TPESampler,COMPLETE
2452,1.4027983580819703,2025-04-24 23:07:03.260209,2025-04-24 23:07:04.785485,0 days 00:00:01.525276,True,absolute_error,10,log2,15,13,716,TPESampler,COMPLETE
2453,0.4028556680405383,2025-04-24 23:07:04.839504,2025-04-24 23:07:09.434479,0 days 00:00:04.594975,True,squared_error,26,,2,2,877,TPESampler,COMPLETE
2454,0.43969894267763593,2025-04-24 23:07:05.064329,2025-04-24 23:07:09.342144,0 days 00:00:04.277815,True,squared_error,41,,4,2,994,TPESampler,COMPLETE
2455,0.8704174116236222,2025-04-24 23:07:09.509216,2025-04-24 23:07:11.830325,0 days 00:00:02.321109,True,squared_error,39,sqrt,2,10,808,TPESampler,COMPLETE
2456,0.42537236944741563,2025-04-24 23:07:09.651886,2025-04-24 23:07:15.935453,0 days 00:00:06.283567,True,squared_error,25,,1,2,895,TPESampler,COMPLETE
2457,0.40264478812992216,2025-04-24 23:07:12.020320,2025-04-24 23:07:16.478147,0 days 00:00:04.457827,True,squared_error,38,,2,2,883,TPESampler,COMPLETE
2458,0.4024807641826319,2025-04-24 23:07:16.018700,2025-04-24 23:07:21.357052,0 days 00:00:05.338352,True,squared_error,34,,2,2,905,TPESampler,COMPLETE
2459,0.40235501509807653,2025-04-24 23:07:16.140883,2025-04-24 23:07:21.650348,0 days 00:00:05.509465,True,squared_error,30,,2,3,986,TPESampler,COMPLETE
2460,0.4027553488404245,2025-04-24 23:07:16.817292,2025-04-24 23:07:22.101930,0 days 00:00:05.284638,True,squared_error,39,,2,5,993,TPESampler,COMPLETE
2461,0.40843513296942446,2025-04-24 23:07:21.739380,2025-04-24 23:07:26.660637,0 days 00:00:04.921257,True,squared_error,29,,2,7,834,TPESampler,COMPLETE
2462,0.4022505843909954,2025-04-24 23:07:21.861621,2025-04-24 23:07:28.268237,0 days 00:00:06.406616,True,squared_error,35,,2,2,978,TPESampler,COMPLETE
2463,0.4397679739479614,2025-04-24 23:07:22.490170,2025-04-24 23:07:26.243521,0 days 00:00:03.753351,True,squared_error,39,,4,3,735,TPESampler,COMPLETE
2464,0.40355222216672687,2025-04-24 23:07:26.439396,2025-04-24 23:08:04.566903,0 days 00:00:38.127507,True,absolute_error,27,,2,3,900,TPESampler,COMPLETE
2465,0.4022936022957746,2025-04-24 23:07:26.915646,2025-04-24 23:07:32.368059,0 days 00:00:05.452413,True,squared_error,35,,2,3,1000,TPESampler,COMPLETE
2466,0.4394214465108842,2025-04-24 23:07:28.466769,2025-04-24 23:07:32.366804,0 days 00:00:03.900035,True,squared_error,40,,4,2,861,TPESampler,COMPLETE
2467,0.43951044084511287,2025-04-24 23:07:32.523639,2025-04-24 23:07:36.910957,0 days 00:00:04.387318,True,squared_error,29,,4,4,897,TPESampler,COMPLETE
2468,0.4165132721545429,2025-04-24 23:07:32.566412,2025-04-24 23:07:37.360527,0 days 00:00:04.794115,True,squared_error,29,,3,3,998,TPESampler,COMPLETE
2469,0.694621859635125,2025-04-24 23:07:37.324395,2025-04-24 23:07:40.559869,0 days 00:00:03.235474,False,absolute_error,42,log2,1,4,151,TPESampler,COMPLETE
2470,0.40974269064861174,2025-04-24 23:07:37.670178,2025-04-24 23:07:42.760182,0 days 00:00:05.090004,True,squared_error,25,,1,4,863,TPESampler,COMPLETE
2471,0.40254484494269976,2025-04-24 23:07:40.749810,2025-04-24 23:07:45.254659,0 days 00:00:04.504849,True,squared_error,35,,2,4,833,TPESampler,COMPLETE
2472,0.4032805240516031,2025-04-24 23:07:43.201075,2025-04-24 23:08:25.174248,0 days 00:00:41.973173,True,absolute_error,32,,2,2,983,TPESampler,COMPLETE
2473,0.4086521168526134,2025-04-24 23:07:45.476312,2025-04-24 23:07:50.158585,0 days 00:00:04.682273,True,squared_error,35,,1,4,825,TPESampler,COMPLETE
2474,0.402708524540764,2025-04-24 23:07:50.351711,2025-04-24 23:07:54.510792,0 days 00:00:04.159081,True,squared_error,39,,2,4,873,TPESampler,COMPLETE
2475,0.40283362401247536,2025-04-24 23:07:54.704486,2025-04-24 23:07:58.870565,0 days 00:00:04.166079,True,squared_error,23,,2,4,869,TPESampler,COMPLETE
2476,0.42320467553069485,2025-04-24 23:07:59.055853,2025-04-24 23:08:05.714747,0 days 00:00:06.658894,True,squared_error,40,,1,2,996,TPESampler,COMPLETE
2477,0.43200586296587556,2025-04-24 23:08:04.754781,2025-04-24 23:09:08.471417,0 days 00:01:03.716636,True,absolute_error,42,,1,2,887,TPESampler,COMPLETE
2478,0.43944708524384457,2025-04-24 23:08:05.897726,2025-04-24 23:08:09.330054,0 days 00:00:03.432328,True,squared_error,33,,4,2,887,TPESampler,COMPLETE
2479,0.7047222891540127,2025-04-24 23:08:09.513663,2025-04-24 23:08:13.304104,0 days 00:00:03.790441,False,squared_error,25,,1,36,734,TPESampler,COMPLETE
2480,0.4028883871588816,2025-04-24 23:08:13.487949,2025-04-24 23:08:17.372499,0 days 00:00:03.884550,True,squared_error,27,,2,3,823,TPESampler,COMPLETE
2481,1.1425129746409428,2025-04-24 23:08:17.554000,2025-04-24 23:08:18.368690,0 days 00:00:00.814690,False,squared_error,29,sqrt,7,14,232,TPESampler,COMPLETE
2482,0.5515513019812776,2025-04-24 23:08:18.565736,2025-04-24 23:08:20.209824,0 days 00:00:01.644088,True,squared_error,34,,5,23,373,TPESampler,COMPLETE
2483,0.42505165637748943,2025-04-24 23:08:20.393722,2025-04-24 23:08:23.966473,0 days 00:00:03.572751,True,squared_error,31,,2,12,872,TPESampler,COMPLETE
2484,0.4031064869769188,2025-04-24 23:08:24.153394,2025-04-24 23:08:28.664758,0 days 00:00:04.511364,True,squared_error,24,,2,2,859,TPESampler,COMPLETE
2485,0.4023259613133283,2025-04-24 23:08:25.357453,2025-04-24 23:08:30.458418,0 days 00:00:05.100965,True,squared_error,39,,2,3,999,TPESampler,COMPLETE
2486,0.40287770347556406,2025-04-24 23:08:28.857739,2025-04-24 23:08:34.311470,0 days 00:00:05.453731,True,squared_error,24,,2,3,996,TPESampler,COMPLETE
2487,0.4164941683800708,2025-04-24 23:08:30.660075,2025-04-24 23:08:35.075400,0 days 00:00:04.415325,True,squared_error,35,,3,5,994,TPESampler,COMPLETE
2488,0.43970957318368925,2025-04-24 23:08:34.509608,2025-04-24 23:08:38.863487,0 days 00:00:04.353879,True,squared_error,36,,4,2,989,TPESampler,COMPLETE
2489,0.402320512372665,2025-04-24 23:08:35.499575,2025-04-24 23:08:40.698341,0 days 00:00:05.198766,True,squared_error,41,,2,3,997,TPESampler,COMPLETE
2490,0.4022890566100713,2025-04-24 23:08:39.057569,2025-04-24 23:08:44.192371,0 days 00:00:05.134802,True,squared_error,31,,2,3,984,TPESampler,COMPLETE
2491,0.4165119353507597,2025-04-24 23:08:40.888309,2025-04-24 23:08:45.580065,0 days 00:00:04.691756,True,squared_error,40,,3,2,997,TPESampler,COMPLETE
2492,0.40549580060569995,2025-04-24 23:08:44.604989,2025-04-24 23:08:49.517004,0 days 00:00:04.912015,True,squared_error,22,,2,6,996,TPESampler,COMPLETE
2493,0.40220311910210904,2025-04-24 23:08:45.767179,2025-04-24 23:08:50.905332,0 days 00:00:05.138153,True,squared_error,33,,2,4,988,TPESampler,COMPLETE
2494,0.4028767078223976,2025-04-24 23:08:49.708429,2025-04-24 23:08:54.775127,0 days 00:00:05.066698,True,squared_error,24,,2,2,992,TPESampler,COMPLETE
2495,0.4263754907150357,2025-04-24 23:08:51.097380,2025-04-24 23:08:57.142573,0 days 00:00:06.045193,True,squared_error,34,,1,2,879,TPESampler,COMPLETE
2496,0.41603955135277726,2025-04-24 23:08:54.970860,2025-04-24 23:08:59.209648,0 days 00:00:04.238788,True,squared_error,34,,3,4,864,TPESampler,COMPLETE
2497,1.1480641069551039,2025-04-24 23:08:57.340823,2025-04-24 23:08:58.701412,0 days 00:00:01.360589,True,squared_error,50,sqrt,5,2,566,TPESampler,COMPLETE
2498,0.4047506043726384,2025-04-24 23:08:58.889535,2025-04-24 23:09:00.672542,0 days 00:00:01.783007,False,squared_error,25,,2,3,163,TPESampler,COMPLETE
2499,0.6932120633768216,2025-04-24 23:08:59.413944,2025-04-24 23:09:01.480754,0 days 00:00:02.066810,False,squared_error,48,,5,26,366,TPESampler,COMPLETE
