number,value,datetime_start,datetime_complete,duration,params_bootstrap,params_criterion,params_max_depth,params_max_features,params_min_samples_leaf,params_min_samples_split,params_n_estimators,system_attrs_auto:sampler,state
1840,1.1176465127475248,2025-04-24 22:44:23.662986,2025-04-24 22:44:25.142747,0 days 00:00:01.479761,True,squared_error,10,sqrt,4,15,550,TPESampler,COMPLETE
1841,0.40222379628162724,2025-04-24 22:44:25.338343,2025-04-24 22:44:31.014682,0 days 00:00:05.676339,True,squared_error,32,,2,3,989,TPESampler,COMPLETE
1842,0.40252263507166036,2025-04-24 22:44:26.375226,2025-04-24 22:44:31.041481,0 days 00:00:04.666255,True,squared_error,41,,2,3,832,TPESampler,COMPLETE
1843,0.4021761942590767,2025-04-24 22:44:26.422630,2025-04-24 22:44:31.985414,0 days 00:00:05.562784,True,squared_error,35,,2,2,979,TPESampler,COMPLETE
1844,0.403460408398036,2025-04-24 22:44:31.164151,2025-04-24 22:45:11.744503,0 days 00:00:40.580352,True,absolute_error,29,,2,2,971,TPESampler,COMPLETE
1845,1.230805640427251,2025-04-24 22:44:31.207668,2025-04-24 22:44:33.978521,0 days 00:00:02.770853,True,squared_error,39,log2,2,5,988,TPESampler,COMPLETE
1846,0.42934123480020625,2025-04-24 22:44:32.643854,2025-04-24 22:45:31.174216,0 days 00:00:58.530362,True,absolute_error,36,,1,2,817,TPESampler,COMPLETE
1847,0.4080562429485902,2025-04-24 22:44:34.168175,2025-04-24 22:44:39.128238,0 days 00:00:04.960063,True,squared_error,38,,1,4,896,TPESampler,COMPLETE
1848,0.4395257481438424,2025-04-24 22:44:39.316491,2025-04-24 22:44:53.663174,0 days 00:00:14.346683,True,absolute_error,19,,3,8,466,TPESampler,COMPLETE
1849,0.4229198204530297,2025-04-24 22:44:53.892468,2025-04-24 22:44:59.450924,0 days 00:00:05.558456,True,squared_error,37,,1,2,861,TPESampler,COMPLETE
1850,1.3321125151664874,2025-04-24 22:44:59.644344,2025-04-24 22:45:00.911627,0 days 00:00:01.267283,False,squared_error,43,log2,11,42,932,TPESampler,COMPLETE
1851,0.6847774489860007,2025-04-24 22:45:01.102724,2025-04-24 22:45:08.483433,0 days 00:00:07.380709,True,absolute_error,33,sqrt,1,6,562,TPESampler,COMPLETE
1852,0.4028802104622033,2025-04-24 22:45:08.668053,2025-04-24 22:45:12.892992,0 days 00:00:04.224939,True,squared_error,27,,2,3,790,TPESampler,COMPLETE
1853,0.40297977660394185,2025-04-24 22:45:11.962186,2025-04-24 22:45:16.411667,0 days 00:00:04.449481,True,squared_error,37,,2,5,826,TPESampler,COMPLETE
1854,0.5414868274213698,2025-04-24 22:45:13.093723,2025-04-24 22:45:16.641952,0 days 00:00:03.548229,True,squared_error,44,,7,5,978,TPESampler,COMPLETE
1855,0.9734235966784225,2025-04-24 22:45:16.598873,2025-04-24 22:45:18.903227,0 days 00:00:02.304354,True,squared_error,28,sqrt,3,2,965,TPESampler,COMPLETE
1856,0.41597634721810867,2025-04-24 22:45:16.938519,2025-04-24 22:45:21.334651,0 days 00:00:04.396132,True,squared_error,38,,3,3,835,TPESampler,COMPLETE
1857,0.4025455459219394,2025-04-24 22:45:19.103538,2025-04-24 22:45:23.747424,0 days 00:00:04.643886,True,squared_error,40,,2,2,864,TPESampler,COMPLETE
1858,0.41602092938151025,2025-04-24 22:45:21.543442,2025-04-24 22:45:25.530573,0 days 00:00:03.987131,True,squared_error,32,,3,3,846,TPESampler,COMPLETE
1859,0.6264471940372497,2025-04-24 22:45:23.950710,2025-04-24 22:45:38.396447,0 days 00:00:14.445737,False,absolute_error,42,,8,2,510,TPESampler,COMPLETE
1860,0.40678131474938467,2025-04-24 22:45:25.715485,2025-04-24 22:45:31.506917,0 days 00:00:05.791432,False,squared_error,26,,2,3,874,TPESampler,COMPLETE
1861,0.41790669384712775,2025-04-24 22:45:31.354607,2025-04-24 22:45:37.824019,0 days 00:00:06.469412,True,squared_error,38,,1,3,995,TPESampler,COMPLETE
1862,0.402240654477862,2025-04-24 22:45:31.736147,2025-04-24 22:45:36.736008,0 days 00:00:04.999861,True,squared_error,35,,2,3,993,TPESampler,COMPLETE
1863,0.7644630299353077,2025-04-24 22:45:36.939519,2025-04-24 22:45:41.757332,0 days 00:00:04.817813,True,absolute_error,28,,14,4,450,TPESampler,COMPLETE
1864,0.8750095248213604,2025-04-24 22:45:38.012420,2025-04-24 22:45:41.781002,0 days 00:00:03.768582,True,absolute_error,36,sqrt,1,30,198,TPESampler,COMPLETE
1865,1.2864070390094515,2025-04-24 22:45:38.610148,2025-04-24 22:45:39.878986,0 days 00:00:01.268838,False,squared_error,50,log2,4,14,757,TPESampler,COMPLETE
1866,0.9916897495659278,2025-04-24 22:45:40.073911,2025-04-24 22:45:47.398958,0 days 00:00:07.325047,True,absolute_error,42,sqrt,2,2,814,TPESampler,COMPLETE
1867,1.292268632470917,2025-04-24 22:45:41.908639,2025-04-24 22:45:43.158711,0 days 00:00:01.250072,False,squared_error,29,log2,5,19,109,TPESampler,COMPLETE
1868,0.4022936022957746,2025-04-24 22:45:41.952577,2025-04-24 22:45:47.454457,0 days 00:00:05.501880,True,squared_error,38,,2,4,1000,TPESampler,COMPLETE
1869,0.40267833591262486,2025-04-24 22:45:43.353405,2025-04-24 22:45:47.765908,0 days 00:00:04.412503,True,squared_error,28,,2,2,882,TPESampler,COMPLETE
1870,0.4165170038975512,2025-04-24 22:45:47.568460,2025-04-24 22:45:52.507782,0 days 00:00:04.939322,True,squared_error,30,,3,4,1000,TPESampler,COMPLETE
1871,0.4195121534154673,2025-04-24 22:45:47.687964,2025-04-24 22:45:53.672212,0 days 00:00:05.984248,True,squared_error,25,,1,3,843,TPESampler,COMPLETE
1872,0.42522640074958934,2025-04-24 22:45:48.101537,2025-04-24 22:46:19.774707,0 days 00:00:31.673170,True,absolute_error,43,,2,8,716,TPESampler,COMPLETE
1873,0.415971812111556,2025-04-24 22:45:52.705145,2025-04-24 22:45:56.886444,0 days 00:00:04.181299,True,squared_error,24,,3,2,842,TPESampler,COMPLETE
1874,0.4023259613133283,2025-04-24 22:45:53.864635,2025-04-24 22:45:59.086120,0 days 00:00:05.221485,True,squared_error,35,,2,2,999,TPESampler,COMPLETE
1875,0.4027262230114001,2025-04-24 22:45:57.082061,2025-04-24 22:46:02.243775,0 days 00:00:05.161714,True,squared_error,25,,2,4,991,TPESampler,COMPLETE
1876,1.2440670244333116,2025-04-24 22:45:59.289140,2025-04-24 22:46:01.598931,0 days 00:00:02.309791,False,absolute_error,18,sqrt,6,21,397,TPESampler,COMPLETE
1877,0.4109995925964838,2025-04-24 22:46:01.810737,2025-04-24 22:46:07.417516,0 days 00:00:05.606779,True,squared_error,36,,1,8,997,TPESampler,COMPLETE
1878,0.4397794303579002,2025-04-24 22:46:02.459017,2025-04-24 22:46:06.665541,0 days 00:00:04.206524,True,squared_error,19,,4,2,980,TPESampler,COMPLETE
1879,0.4027394930179356,2025-04-24 22:46:06.878987,2025-04-24 22:46:52.304882,0 days 00:00:45.425895,True,absolute_error,37,,2,2,965,TPESampler,COMPLETE
1880,0.4472907984391284,2025-04-24 22:46:07.865682,2025-04-24 22:46:12.348718,0 days 00:00:04.483036,False,squared_error,35,,4,2,835,TPESampler,COMPLETE
1881,0.44881701516376005,2025-04-24 22:46:12.562020,2025-04-24 22:46:15.979224,0 days 00:00:03.417204,True,squared_error,41,,4,11,890,TPESampler,COMPLETE
1882,0.4021878060183394,2025-04-24 22:46:16.181428,2025-04-24 22:46:20.989348,0 days 00:00:04.807920,True,squared_error,37,,2,2,975,TPESampler,COMPLETE
1883,0.7119076360806633,2025-04-24 22:46:19.976337,2025-04-24 22:46:21.103002,0 days 00:00:01.126665,False,squared_error,41,,13,2,141,TPESampler,COMPLETE
1884,0.40884984688424586,2025-04-24 22:46:21.164946,2025-04-24 22:47:02.267148,0 days 00:00:41.102202,True,absolute_error,34,,2,6,898,TPESampler,COMPLETE
1885,0.42370610578441265,2025-04-24 22:46:21.309140,2025-04-24 22:46:27.169416,0 days 00:00:05.860276,True,squared_error,28,,1,2,870,TPESampler,COMPLETE
1886,0.4397699167562421,2025-04-24 22:46:27.347428,2025-04-24 22:46:31.126136,0 days 00:00:03.778708,True,squared_error,39,,4,4,972,TPESampler,COMPLETE
1887,0.4394905016553677,2025-04-24 22:46:31.308997,2025-04-24 22:46:34.785455,0 days 00:00:03.476458,True,squared_error,42,,4,2,873,TPESampler,COMPLETE
1888,0.40217779514697144,2025-04-24 22:46:34.984665,2025-04-24 22:46:39.633786,0 days 00:00:04.649121,True,squared_error,41,,2,4,971,TPESampler,COMPLETE
1889,0.4023317497502402,2025-04-24 22:46:39.819738,2025-04-24 22:46:43.918143,0 days 00:00:04.098405,True,squared_error,36,,2,2,839,TPESampler,COMPLETE
1890,0.4022936022957746,2025-04-24 22:46:44.123433,2025-04-24 22:46:48.863378,0 days 00:00:04.739945,True,squared_error,41,,2,3,1000,TPESampler,COMPLETE
1891,0.8830104403137582,2025-04-24 22:46:49.117230,2025-04-24 22:46:50.864608,0 days 00:00:01.747378,False,squared_error,29,sqrt,3,5,935,TPESampler,COMPLETE
1892,1.2329897019132783,2025-04-24 22:46:51.062122,2025-04-24 22:46:52.854382,0 days 00:00:01.792260,True,squared_error,33,log2,2,5,773,TPESampler,COMPLETE
1893,0.42859749111370793,2025-04-24 22:46:52.519030,2025-04-24 22:46:59.318732,0 days 00:00:06.799702,True,squared_error,21,,1,2,990,TPESampler,COMPLETE
1894,0.4022936022957746,2025-04-24 22:46:53.091462,2025-04-24 22:46:58.156831,0 days 00:00:05.065369,True,squared_error,36,,2,2,1000,TPESampler,COMPLETE
1895,0.8192337413393643,2025-04-24 22:46:58.355886,2025-04-24 22:47:00.880690,0 days 00:00:02.524804,False,squared_error,13,sqrt,1,2,955,TPESampler,COMPLETE
1896,0.4117303240406955,2025-04-24 22:46:59.525729,2025-04-24 22:47:04.335273,0 days 00:00:04.809544,True,squared_error,33,,2,8,868,TPESampler,COMPLETE
1897,0.4023960252248651,2025-04-24 22:47:01.067978,2025-04-24 22:47:06.625782,0 days 00:00:05.557804,True,squared_error,22,,2,2,984,TPESampler,COMPLETE
1898,0.40256164448107873,2025-04-24 22:47:02.459114,2025-04-24 22:47:07.262254,0 days 00:00:04.803140,True,squared_error,33,,2,4,806,TPESampler,COMPLETE
1899,0.6915780682393948,2025-04-24 22:47:04.528454,2025-04-24 22:47:06.045268,0 days 00:00:01.516814,False,squared_error,32,,4,32,214,TPESampler,COMPLETE
1900,1.0086048937136523,2025-04-24 22:47:06.248589,2025-04-24 22:47:09.375168,0 days 00:00:03.126579,True,squared_error,18,log2,1,5,932,TPESampler,COMPLETE
1901,0.4022324925345733,2025-04-24 22:47:06.822589,2025-04-24 22:47:13.109320,0 days 00:00:06.286731,True,squared_error,37,,2,3,989,TPESampler,COMPLETE
1902,0.40238063126610984,2025-04-24 22:47:07.555052,2025-04-24 22:47:13.461308,0 days 00:00:05.906256,True,squared_error,31,,2,2,998,TPESampler,COMPLETE
1903,0.6692240081361194,2025-04-24 22:47:09.579646,2025-04-24 22:47:10.623169,0 days 00:00:01.043523,True,squared_error,12,,12,24,134,TPESampler,COMPLETE
1904,0.4396827430014137,2025-04-24 22:47:10.815369,2025-04-24 22:47:15.951948,0 days 00:00:05.136579,True,squared_error,31,,4,3,997,TPESampler,COMPLETE
1905,1.226211963931995,2025-04-24 22:47:13.320414,2025-04-24 22:47:15.672136,0 days 00:00:02.351722,True,squared_error,32,sqrt,7,39,903,TPESampler,COMPLETE
1906,0.40506449249582666,2025-04-24 22:47:13.725730,2025-04-24 22:47:19.302671,0 days 00:00:05.576941,True,squared_error,27,,1,5,806,TPESampler,COMPLETE
1907,0.4023035631680275,2025-04-24 22:47:15.905181,2025-04-24 22:47:21.384351,0 days 00:00:05.479170,True,squared_error,33,,2,3,997,TPESampler,COMPLETE
1908,1.1626996404654704,2025-04-24 22:47:16.276404,2025-04-24 22:47:23.049938,0 days 00:00:06.773534,False,absolute_error,21,log2,1,47,471,TPESampler,COMPLETE
1909,0.4396827430014137,2025-04-24 22:47:19.500442,2025-04-24 22:47:24.311974,0 days 00:00:04.811532,True,squared_error,33,,4,2,997,TPESampler,COMPLETE
1910,0.4256423345231749,2025-04-24 22:47:21.571421,2025-04-24 22:47:28.166301,0 days 00:00:06.594880,True,squared_error,36,,1,2,869,TPESampler,COMPLETE
1911,0.40558992763696994,2025-04-24 22:47:23.239199,2025-04-24 22:47:27.473482,0 days 00:00:04.234283,True,squared_error,26,,2,6,807,TPESampler,COMPLETE
1912,0.4717271773857023,2025-04-24 22:47:24.499477,2025-04-24 22:47:29.702353,0 days 00:00:05.202876,False,squared_error,36,,8,4,969,TPESampler,COMPLETE
1913,0.4206853709854888,2025-04-24 22:47:27.669522,2025-04-24 22:47:34.843578,0 days 00:00:07.174056,True,squared_error,27,,1,3,992,TPESampler,COMPLETE
1914,0.40252361774677414,2025-04-24 22:47:28.659234,2025-04-24 22:47:34.566481,0 days 00:00:05.907247,True,squared_error,30,,2,3,998,TPESampler,COMPLETE
1915,1.368994134416813,2025-04-24 22:47:29.900005,2025-04-24 22:47:31.878332,0 days 00:00:01.978327,True,absolute_error,12,sqrt,15,43,859,TPESampler,COMPLETE
1916,0.4162112922689214,2025-04-24 22:47:32.070092,2025-04-24 22:47:36.552737,0 days 00:00:04.482645,True,squared_error,30,,3,3,803,TPESampler,COMPLETE
1917,0.4027454332978031,2025-04-24 22:47:34.793086,2025-04-24 22:47:39.766271,0 days 00:00:04.973185,True,squared_error,25,,2,3,842,TPESampler,COMPLETE
1918,0.4026205901484117,2025-04-24 22:47:35.149134,2025-04-24 22:47:41.144215,0 days 00:00:05.995081,True,squared_error,27,,2,2,992,TPESampler,COMPLETE
1919,0.4394494188116763,2025-04-24 22:47:36.749730,2025-04-24 22:47:40.913338,0 days 00:00:04.163608,True,squared_error,35,,4,4,869,TPESampler,COMPLETE
1920,0.4023218971307515,2025-04-24 22:47:39.956144,2025-04-24 22:47:46.206184,0 days 00:00:06.250040,True,squared_error,40,,2,2,995,TPESampler,COMPLETE
1921,0.4245519930943677,2025-04-24 22:47:41.101142,2025-04-24 22:47:48.937765,0 days 00:00:07.836623,True,squared_error,32,,1,2,994,TPESampler,COMPLETE
1922,1.384494741306961,2025-04-24 22:47:41.565009,2025-04-24 22:47:43.561384,0 days 00:00:01.996375,True,absolute_error,25,log2,6,8,593,TPESampler,COMPLETE
1923,0.407517110616056,2025-04-24 22:47:43.746461,2025-04-24 22:47:48.246732,0 days 00:00:04.500271,True,squared_error,35,,1,4,682,TPESampler,COMPLETE
1924,0.40725034383188896,2025-04-24 22:47:46.409057,2025-04-24 22:47:52.697606,0 days 00:00:06.288549,True,squared_error,42,,1,4,925,TPESampler,COMPLETE
1925,0.40242976261666225,2025-04-24 22:47:48.462865,2025-04-24 22:47:53.505535,0 days 00:00:05.042670,True,squared_error,37,,2,4,846,TPESampler,COMPLETE
1926,0.4187475779568573,2025-04-24 22:47:49.195710,2025-04-24 22:47:54.246096,0 days 00:00:05.050386,True,squared_error,30,,3,7,998,TPESampler,COMPLETE
1927,0.8995830861874227,2025-04-24 22:47:52.893227,2025-04-24 22:47:54.318131,0 days 00:00:01.424904,False,squared_error,50,sqrt,3,11,407,TPESampler,COMPLETE
1928,0.4025545246941893,2025-04-24 22:47:53.829243,2025-04-24 22:47:59.277860,0 days 00:00:05.448617,True,squared_error,32,,2,2,809,TPESampler,COMPLETE
1929,1.3101035038728666,2025-04-24 22:47:54.761724,2025-04-24 22:47:57.131243,0 days 00:00:02.369519,True,squared_error,34,log2,4,2,762,TPESampler,COMPLETE
1930,0.4022324925345733,2025-04-24 22:47:54.810123,2025-04-24 22:48:01.155207,0 days 00:00:06.345084,True,squared_error,37,,2,4,989,TPESampler,COMPLETE
1931,0.4159364344123085,2025-04-24 22:47:57.345902,2025-04-24 22:48:01.762649,0 days 00:00:04.416747,True,squared_error,38,,3,2,841,TPESampler,COMPLETE
1932,0.4158990632349798,2025-04-24 22:47:59.472825,2025-04-24 22:48:04.160381,0 days 00:00:04.687556,True,squared_error,39,,3,5,830,TPESampler,COMPLETE
1933,0.4022944665289754,2025-04-24 22:48:01.357844,2025-04-24 22:48:07.100200,0 days 00:00:05.742356,True,squared_error,34,,2,3,991,TPESampler,COMPLETE
1934,0.41651183820046933,2025-04-24 22:48:01.962920,2025-04-24 22:48:07.034071,0 days 00:00:05.071151,True,squared_error,35,,3,4,999,TPESampler,COMPLETE
1935,0.4722827910264023,2025-04-24 22:48:04.367594,2025-04-24 22:48:13.153552,0 days 00:00:08.785958,False,squared_error,23,,1,2,973,TPESampler,COMPLETE
1936,0.40292880224943994,2025-04-24 22:48:07.181439,2025-04-24 22:48:12.143095,0 days 00:00:04.961656,True,squared_error,27,,2,2,883,TPESampler,COMPLETE
1937,0.41588625048326555,2025-04-24 22:48:07.311702,2025-04-24 22:48:11.505863,0 days 00:00:04.194161,True,squared_error,26,,3,4,840,TPESampler,COMPLETE
1938,0.4022288109558414,2025-04-24 22:48:11.706129,2025-04-24 22:48:17.801959,0 days 00:00:06.095830,True,squared_error,28,,2,4,993,TPESampler,COMPLETE
1939,0.6530176956495188,2025-04-24 22:48:12.360605,2025-04-24 22:48:14.816285,0 days 00:00:02.455680,False,squared_error,45,log2,1,5,633,TPESampler,COMPLETE
1940,0.4024818209716682,2025-04-24 22:48:13.494893,2025-04-24 22:48:18.242384,0 days 00:00:04.747491,True,squared_error,42,,2,3,851,TPESampler,COMPLETE
1941,0.41273532823243286,2025-04-24 22:48:15.012874,2025-04-24 22:48:20.808260,0 days 00:00:05.795386,True,squared_error,29,,1,8,999,TPESampler,COMPLETE
1942,0.7097498252950838,2025-04-24 22:48:18.009514,2025-04-24 22:48:31.003553,0 days 00:00:12.994039,False,absolute_error,22,,14,11,690,TPESampler,COMPLETE
1943,1.1443182506973966,2025-04-24 22:48:18.495514,2025-04-24 22:48:19.476432,0 days 00:00:00.980918,False,squared_error,30,sqrt,7,4,138,TPESampler,COMPLETE
1944,0.40247493297610926,2025-04-24 22:48:19.680388,2025-04-24 22:48:24.081790,0 days 00:00:04.401402,True,squared_error,33,,2,2,834,TPESampler,COMPLETE
1945,0.4024646993337236,2025-04-24 22:48:21.005766,2025-04-24 22:48:25.302275,0 days 00:00:04.296509,True,squared_error,31,,2,4,847,TPESampler,COMPLETE
1946,0.4679345848729245,2025-04-24 22:48:24.276342,2025-04-24 22:48:37.977813,0 days 00:00:13.701471,False,absolute_error,42,,2,8,171,TPESampler,COMPLETE
1947,0.40251897710039974,2025-04-24 22:48:25.491807,2025-04-24 22:48:29.501892,0 days 00:00:04.010085,True,squared_error,40,,2,2,836,TPESampler,COMPLETE
1948,0.4022277700758027,2025-04-24 22:48:29.705982,2025-04-24 22:48:34.720728,0 days 00:00:05.014746,True,squared_error,39,,2,2,967,TPESampler,COMPLETE
1949,0.419175583598875,2025-04-24 22:48:31.202860,2025-04-24 22:48:37.449867,0 days 00:00:06.247007,True,squared_error,33,,1,3,991,TPESampler,COMPLETE
1950,0.40456539081316367,2025-04-24 22:48:34.910353,2025-04-24 22:48:40.182224,0 days 00:00:05.271871,True,squared_error,17,,2,2,985,TPESampler,COMPLETE
1951,0.6921486174989138,2025-04-24 22:48:37.642470,2025-04-24 22:48:41.425432,0 days 00:00:03.782962,False,squared_error,22,,8,24,666,TPESampler,COMPLETE
1952,0.5580235859544148,2025-04-24 22:48:38.202617,2025-04-24 22:48:41.564468,0 days 00:00:03.361851,True,squared_error,37,sqrt,1,4,999,TPESampler,COMPLETE
1953,0.4053002500803048,2025-04-24 22:48:40.379263,2025-04-24 22:48:45.077462,0 days 00:00:04.698199,True,squared_error,38,,2,6,839,TPESampler,COMPLETE
1954,0.4165170038975512,2025-04-24 22:48:41.616876,2025-04-24 22:48:46.648128,0 days 00:00:05.031252,True,squared_error,34,,3,3,1000,TPESampler,COMPLETE
1955,0.41605920817268427,2025-04-24 22:48:41.805057,2025-04-24 22:48:46.515520,0 days 00:00:04.710463,True,squared_error,41,,3,2,874,TPESampler,COMPLETE
1956,0.42271571054847795,2025-04-24 22:48:45.280885,2025-04-24 22:48:52.447663,0 days 00:00:07.166778,True,squared_error,44,,1,2,845,TPESampler,COMPLETE
1957,0.4023259613133283,2025-04-24 22:48:46.698385,2025-04-24 22:48:52.772376,0 days 00:00:06.073991,True,squared_error,41,,2,2,999,TPESampler,COMPLETE
1958,1.252877563219749,2025-04-24 22:48:46.880673,2025-04-24 22:48:48.612851,0 days 00:00:01.732178,False,squared_error,13,log2,3,2,802,TPESampler,COMPLETE
1959,1.1782471689339893,2025-04-24 22:48:48.812122,2025-04-24 22:48:50.256347,0 days 00:00:01.444225,False,squared_error,19,log2,2,50,900,TPESampler,COMPLETE
1960,0.42360210362813994,2025-04-24 22:48:50.438139,2025-04-24 22:48:58.159793,0 days 00:00:07.721654,True,squared_error,40,,1,2,979,TPESampler,COMPLETE
1961,0.40311158095798133,2025-04-24 22:48:52.643982,2025-04-24 22:48:56.979320,0 days 00:00:04.335338,True,squared_error,24,,2,3,809,TPESampler,COMPLETE
1962,0.4023218971307515,2025-04-24 22:48:53.024158,2025-04-24 22:48:58.434023,0 days 00:00:05.409865,True,squared_error,41,,2,3,995,TPESampler,COMPLETE
1963,0.4023218971307515,2025-04-24 22:48:57.166523,2025-04-24 22:49:02.832975,0 days 00:00:05.666452,True,squared_error,35,,2,2,995,TPESampler,COMPLETE
1964,0.40680487173235835,2025-04-24 22:48:58.358086,2025-04-24 22:49:04.048660,0 days 00:00:05.690574,True,squared_error,42,,1,4,823,TPESampler,COMPLETE
1965,0.4397305011371255,2025-04-24 22:48:58.708439,2025-04-24 22:49:02.837560,0 days 00:00:04.129121,True,squared_error,22,,4,3,944,TPESampler,COMPLETE
1966,0.43962581819388563,2025-04-24 22:49:02.977799,2025-04-24 22:49:07.747662,0 days 00:00:04.769863,True,squared_error,28,,4,2,852,TPESampler,COMPLETE
1967,1.229111190156663,2025-04-24 22:49:03.023121,2025-04-24 22:49:05.790039,0 days 00:00:02.766918,True,squared_error,41,log2,2,2,880,TPESampler,COMPLETE
1968,0.4668681775600086,2025-04-24 22:49:04.463587,2025-04-24 22:49:07.499697,0 days 00:00:03.036110,True,squared_error,49,,5,7,498,TPESampler,COMPLETE
1969,0.4085989355741746,2025-04-24 22:49:05.981381,2025-04-24 22:49:11.665854,0 days 00:00:05.684473,True,squared_error,30,,1,4,864,TPESampler,COMPLETE
1970,0.4397794625342369,2025-04-24 22:49:07.714501,2025-04-24 22:49:12.010266,0 days 00:00:04.295765,True,squared_error,39,,4,3,979,TPESampler,COMPLETE
1971,0.43199814507426243,2025-04-24 22:49:07.964238,2025-04-24 22:49:13.847327,0 days 00:00:05.883089,False,squared_error,18,,3,2,913,TPESampler,COMPLETE
1972,0.4026989025614729,2025-04-24 22:49:11.847351,2025-04-24 22:49:17.679962,0 days 00:00:05.832611,True,squared_error,26,,2,3,998,TPESampler,COMPLETE
1973,0.4027070348842071,2025-04-24 22:49:12.259093,2025-04-24 22:49:17.259541,0 days 00:00:05.000448,True,squared_error,27,,2,3,830,TPESampler,COMPLETE
1974,0.9148683020079639,2025-04-24 22:49:14.037221,2025-04-24 22:49:15.159684,0 days 00:00:01.122463,False,squared_error,24,sqrt,3,15,394,TPESampler,COMPLETE
1975,0.40556337446817275,2025-04-24 22:49:15.342827,2025-04-24 22:49:20.522206,0 days 00:00:05.179379,True,squared_error,27,,2,6,995,TPESampler,COMPLETE
1976,0.7127090808109994,2025-04-24 22:49:17.451796,2025-04-24 22:49:24.235526,0 days 00:00:06.783730,False,absolute_error,11,,15,3,369,TPESampler,COMPLETE
1977,0.42401512783829187,2025-04-24 22:49:17.920835,2025-04-24 22:49:24.478143,0 days 00:00:06.557308,True,squared_error,28,,1,2,1000,TPESampler,COMPLETE
1978,0.4032748703919365,2025-04-24 22:49:20.696198,2025-04-24 22:49:26.480405,0 days 00:00:05.784207,False,squared_error,30,,2,4,797,TPESampler,COMPLETE
1979,0.4232537465220517,2025-04-24 22:49:24.437607,2025-04-24 22:49:32.258402,0 days 00:00:07.820795,True,squared_error,38,,1,2,997,TPESampler,COMPLETE
1980,0.40273709333439195,2025-04-24 22:49:24.773209,2025-04-24 22:49:29.664594,0 days 00:00:04.891385,True,squared_error,38,,2,4,889,TPESampler,COMPLETE
