number,value,datetime_start,datetime_complete,duration,params_learning_rate,params_max_depth,params_max_features,params_min_samples_leaf,params_min_samples_split,params_n_estimators,params_subsample,system_attrs_auto:sampler,state
1122,0.31262475018335006,2025-04-24 22:09:34.303992,2025-04-24 22:09:40.776298,0 days 00:00:06.472306,0.07518692845124286,12,,1,13,1209,0.7436335789992549,TPESampler,COMPLETE
1123,0.3033129702598576,2025-04-24 22:09:34.869130,2025-04-24 22:09:42.507403,0 days 00:00:07.638273,0.08806271939051617,11,,2,19,1278,0.9574897119966251,TPESampler,COMPLETE
1124,0.34952233747605893,2025-04-24 22:09:37.518375,2025-04-24 22:09:43.223419,0 days 00:00:05.705044,0.07394026069900729,5,,2,16,1464,0.9992877928584342,TPESampler,COMPLETE
1125,0.5360740857376979,2025-04-24 22:09:40.997346,2025-04-24 22:09:42.356896,0 days 00:00:01.359550,0.03352770919448196,8,log2,10,16,877,0.9924364665981756,TPESampler,COMPLETE
1126,0.3924959315927725,2025-04-24 22:09:42.555094,2025-04-24 22:09:44.537433,0 days 00:00:01.982339,0.039703565773127406,9,log2,2,9,1316,0.8916986335721697,TPESampler,COMPLETE
1127,0.3279523142247452,2025-04-24 22:09:42.709779,2025-04-24 22:09:50.591293,0 days 00:00:07.881514,0.06690888155086121,12,,1,11,1198,0.9712677647748843,TPESampler,COMPLETE
1128,0.343745741522297,2025-04-24 22:09:43.461056,2025-04-24 22:09:47.545549,0 days 00:00:04.084493,0.08165201341664177,9,,1,16,714,0.965160391501051,TPESampler,COMPLETE
1129,0.36971082691303137,2025-04-24 22:09:44.724841,2025-04-24 22:09:50.975889,0 days 00:00:06.251048,0.0901090951389716,12,,3,12,1061,0.9453594924101145,TPESampler,COMPLETE
1130,0.29811713515539323,2025-04-24 22:09:47.736771,2025-04-24 22:09:55.545244,0 days 00:00:07.808473,0.09184996109893638,11,,2,18,1342,0.9753902225381509,TPESampler,COMPLETE
1131,0.33410307054462157,2025-04-24 22:09:50.778907,2025-04-24 22:09:57.519469,0 days 00:00:06.740562,0.07388741077645042,10,,3,19,1261,0.9361306906288748,TPESampler,COMPLETE
1132,0.3240701567017963,2025-04-24 22:09:51.204159,2025-04-24 22:09:55.858120,0 days 00:00:04.653961,0.08810408617668024,8,,2,20,1004,0.8996557234793349,TPESampler,COMPLETE
1133,0.3435309178088858,2025-04-24 22:09:55.736048,2025-04-24 22:10:01.609255,0 days 00:00:05.873207,0.04626371665844138,7,,1,18,1289,0.9575256071338913,TPESampler,COMPLETE
1134,0.3423547879761297,2025-04-24 22:09:56.075489,2025-04-24 22:10:02.274580,0 days 00:00:06.199091,0.07748133070497026,9,,3,15,1154,0.974445620659687,TPESampler,COMPLETE
1135,0.8755194662293938,2025-04-24 22:09:57.707587,2025-04-24 22:09:58.436428,0 days 00:00:00.728841,0.03689456875143434,10,log2,9,15,127,0.9348662471520371,TPESampler,COMPLETE
1136,0.334193556746085,2025-04-24 22:09:58.620724,2025-04-24 22:10:06.093098,0 days 00:00:07.472374,0.07968567270719691,10,,1,18,1279,0.9958676830293914,TPESampler,COMPLETE
1137,0.4865954260507758,2025-04-24 22:10:01.796829,2025-04-24 22:10:02.873778,0 days 00:00:01.076949,0.04427615451775449,8,log2,4,2,361,0.8257159774879079,TPESampler,COMPLETE
1138,0.363163867060173,2025-04-24 22:10:02.475526,2025-04-24 22:10:09.007007,0 days 00:00:06.531481,0.09523048076827045,11,,3,15,1142,0.9718563863825614,TPESampler,COMPLETE
1139,0.3341250170459149,2025-04-24 22:10:03.076832,2025-04-24 22:10:10.725831,0 days 00:00:07.648999,0.05518042969282624,10,,3,19,1421,0.9754041040874502,TPESampler,COMPLETE
1140,0.2959442124362815,2025-04-24 22:10:06.273740,2025-04-24 22:10:13.762114,0 days 00:00:07.488374,0.0758813238014179,12,,2,12,1262,0.9146793997589896,TPESampler,COMPLETE
1141,0.32302939579816314,2025-04-24 22:10:09.191367,2025-04-24 22:10:15.903073,0 days 00:00:06.711706,0.09988344389070715,12,,2,13,1150,0.8855573370960059,TPESampler,COMPLETE
1142,0.6899169273716487,2025-04-24 22:10:10.913675,2025-04-24 22:10:12.232273,0 days 00:00:01.318598,0.011663752594212175,6,log2,5,12,784,0.9073884639642175,TPESampler,COMPLETE
1143,0.28955709353741854,2025-04-24 22:10:12.678248,2025-04-24 22:10:19.110177,0 days 00:00:06.431929,0.0991026077589319,12,,2,15,1030,0.9657999264108963,TPESampler,COMPLETE
1144,0.3529678130919752,2025-04-24 22:10:13.963354,2025-04-24 22:10:21.946678,0 days 00:00:07.983324,0.08547799520412369,11,,3,12,1494,0.912127517752022,TPESampler,COMPLETE
1145,0.3240223496735584,2025-04-24 22:10:16.083111,2025-04-24 22:10:22.183230,0 days 00:00:06.100119,0.07740796978378829,11,,1,10,1102,0.8841704434068774,TPESampler,COMPLETE
1146,0.37563569231268057,2025-04-24 22:10:19.313389,2025-04-24 22:10:22.830763,0 days 00:00:03.517374,0.08232375517257272,12,,5,16,517,0.9857116744885861,TPESampler,COMPLETE
1147,0.4962922651342656,2025-04-24 22:10:22.133480,2025-04-24 22:10:23.686217,0 days 00:00:01.552737,0.06599949476828129,3,log2,10,8,891,0.6162138230118694,TPESampler,COMPLETE
1148,0.43007238269887815,2025-04-24 22:10:22.411999,2025-04-24 22:10:27.345409,0 days 00:00:04.933410,0.016994664260753117,8,,8,10,1129,0.8555145197108575,TPESampler,COMPLETE
1149,0.3518302035448708,2025-04-24 22:10:23.030362,2025-04-24 22:10:28.749855,0 days 00:00:05.719493,0.09633375936186676,12,,4,17,921,0.9702925064728808,TPESampler,COMPLETE
1150,0.3043929202113184,2025-04-24 22:10:23.882435,2025-04-24 22:10:31.486373,0 days 00:00:07.603938,0.07722088698773658,12,,2,14,1262,0.9402124835240709,TPESampler,COMPLETE
1151,0.3053980799008892,2025-04-24 22:10:27.513747,2025-04-24 22:10:34.390942,0 days 00:00:06.877195,0.058762812270038364,12,,2,15,1099,0.9558089632571972,TPESampler,COMPLETE
1152,0.3495957366012955,2025-04-24 22:10:28.958189,2025-04-24 22:10:31.175359,0 days 00:00:02.217170,0.04328699325927929,12,sqrt,1,8,1370,0.9021060478383636,TPESampler,COMPLETE
1153,0.3012137543722174,2025-04-24 22:10:31.353865,2025-04-24 22:10:39.439049,0 days 00:00:08.085184,0.047220057652043256,11,,2,13,1450,0.9203182181703392,TPESampler,COMPLETE
1154,0.34889012852509804,2025-04-24 22:10:31.690119,2025-04-24 22:10:37.022261,0 days 00:00:05.332142,0.06123269821226985,11,,3,16,894,0.9935651453668953,TPESampler,COMPLETE
1155,0.32416133325443763,2025-04-24 22:10:34.564220,2025-04-24 22:10:41.945029,0 days 00:00:07.380809,0.09529991668906228,12,,1,17,1109,0.9772105305998977,TPESampler,COMPLETE
1156,0.38025626316133554,2025-04-24 22:10:37.220078,2025-04-24 22:10:42.967940,0 days 00:00:05.747862,0.0632763486482,12,,6,13,1047,0.9118830379114871,TPESampler,COMPLETE
1157,0.34988652623655353,2025-04-24 22:10:39.627003,2025-04-24 22:10:47.777793,0 days 00:00:08.150790,0.039470286739088735,11,,3,7,1474,0.9218370701403784,TPESampler,COMPLETE
1158,0.333033244290839,2025-04-24 22:10:42.123652,2025-04-24 22:10:47.291554,0 days 00:00:05.167902,0.08447178923856137,12,,1,19,766,0.9984107721303932,TPESampler,COMPLETE
1159,0.32942122519912587,2025-04-24 22:10:43.152209,2025-04-24 22:10:51.246947,0 days 00:00:08.094738,0.058548176734631294,11,,1,13,1463,0.8948718714672721,TPESampler,COMPLETE
1160,0.38275307323361357,2025-04-24 22:10:47.483063,2025-04-24 22:10:54.719515,0 days 00:00:07.236452,0.07894258871701686,12,,6,17,1327,0.9445777312069034,TPESampler,COMPLETE
1161,0.508296779238002,2025-04-24 22:10:47.969319,2025-04-24 22:10:48.869769,0 days 00:00:00.900450,0.016364048862715037,7,sqrt,3,12,278,0.6034693331452116,TPESampler,COMPLETE
1162,0.3220779185415127,2025-04-24 22:10:49.048065,2025-04-24 22:10:55.023129,0 days 00:00:05.975064,0.07861078191059089,12,,1,12,973,0.9211178540808522,TPESampler,COMPLETE
1163,0.353541730042724,2025-04-24 22:10:51.433210,2025-04-24 22:10:58.668807,0 days 00:00:07.235597,0.08471525983979679,12,,3,10,1272,0.8846861066720711,TPESampler,COMPLETE
1164,0.35744040337234595,2025-04-24 22:10:54.900678,2025-04-24 22:10:56.797950,0 days 00:00:01.897272,0.04843193219071123,12,log2,3,7,1357,0.8771116959980011,TPESampler,COMPLETE
1165,0.38878645372055787,2025-04-24 22:10:55.241393,2025-04-24 22:11:03.408439,0 days 00:00:08.167046,0.06600436763790674,12,,5,14,1342,0.9289170079170113,TPESampler,COMPLETE
1166,0.3520540062001201,2025-04-24 22:10:56.980449,2025-04-24 22:10:58.720392,0 days 00:00:01.739943,0.09973664045195622,11,sqrt,1,13,975,0.9400308943923247,TPESampler,COMPLETE
1167,0.4582165550974855,2025-04-24 22:10:58.826292,2025-04-24 22:11:01.364538,0 days 00:00:02.538246,0.0372537319532765,8,log2,7,16,1464,0.7784119744300384,TPESampler,COMPLETE
1168,0.4025766787096457,2025-04-24 22:10:58.879158,2025-04-24 22:11:00.414531,0 days 00:00:01.535373,0.08175687306751812,5,sqrt,7,6,447,0.8809885008502598,TPESampler,COMPLETE
1169,0.31920084917784036,2025-04-24 22:11:00.609296,2025-04-24 22:11:08.806782,0 days 00:00:08.197486,0.06225501084911049,12,,1,11,1369,0.8519861774755291,TPESampler,COMPLETE
1170,0.35217215463294516,2025-04-24 22:11:01.566629,2025-04-24 22:11:07.836081,0 days 00:00:06.269452,0.09420544355566328,12,,3,14,1057,0.9622118366476724,TPESampler,COMPLETE
1171,0.38855778202283214,2025-04-24 22:11:03.626693,2025-04-24 22:11:08.400119,0 days 00:00:04.773426,0.01427130061775703,7,,6,10,1433,0.707976624833457,TPESampler,COMPLETE
1172,0.34553808525033536,2025-04-24 22:11:08.024530,2025-04-24 22:11:10.150564,0 days 00:00:02.126034,0.09796493815467477,12,log2,4,10,1210,0.9924396111284948,TPESampler,COMPLETE
1173,0.30112489880884813,2025-04-24 22:11:08.589202,2025-04-24 22:11:15.980315,0 days 00:00:07.391113,0.049701682477419115,12,,2,11,1166,0.9286834281342695,TPESampler,COMPLETE
1174,0.38043135921803695,2025-04-24 22:11:09.036693,2025-04-24 22:11:10.287911,0 days 00:00:01.251218,0.041738221038865396,8,sqrt,5,20,417,0.9539434194766305,TPESampler,COMPLETE
1175,0.32599706927065236,2025-04-24 22:11:10.345779,2025-04-24 22:11:12.446125,0 days 00:00:02.100346,0.035680092293771254,11,sqrt,3,11,1136,0.9902784482081144,TPESampler,COMPLETE
1176,0.36406063615463047,2025-04-24 22:11:10.574152,2025-04-24 22:11:17.460061,0 days 00:00:06.885909,0.05020000338420199,12,,3,8,1166,0.9070535355089784,TPESampler,COMPLETE
1177,0.3501600546203184,2025-04-24 22:11:12.807838,2025-04-24 22:11:20.857665,0 days 00:00:08.049827,0.08654160278222457,12,,3,16,1276,0.991222546396606,TPESampler,COMPLETE
1178,0.4579314142008902,2025-04-24 22:11:16.163986,2025-04-24 22:11:19.275302,0 days 00:00:03.111316,0.019225789847514267,4,,9,7,1100,0.6804725626310839,TPESampler,COMPLETE
1179,0.3772733183267993,2025-04-24 22:11:17.659224,2025-04-24 22:11:19.359463,0 days 00:00:01.700239,0.07546939854403856,11,log2,1,9,965,0.8520428139344104,TPESampler,COMPLETE
1180,0.29193006708062474,2025-04-24 22:11:19.424944,2025-04-24 22:11:27.419831,0 days 00:00:07.994887,0.06678235050143277,12,,2,13,1217,0.9847224256886472,TPESampler,COMPLETE
1181,0.32739940597618195,2025-04-24 22:11:19.534877,2025-04-24 22:11:25.058371,0 days 00:00:05.523494,0.09857271724523797,11,,2,20,941,0.837756051977841,TPESampler,COMPLETE
1182,0.3056121823409501,2025-04-24 22:11:21.045132,2025-04-24 22:11:28.640489,0 days 00:00:07.595357,0.0718407811750771,12,,2,11,1284,0.899403176246229,TPESampler,COMPLETE
1183,0.3028029247858703,2025-04-24 22:11:25.236932,2025-04-24 22:11:34.094466,0 days 00:00:08.857534,0.03561349352996101,12,,2,13,1492,0.9118888890507396,TPESampler,COMPLETE
1184,0.4131062000749975,2025-04-24 22:11:27.613889,2025-04-24 22:11:29.600191,0 days 00:00:01.986302,0.013605823389449446,4,sqrt,2,10,1387,0.712695915395284,TPESampler,COMPLETE
1185,0.35210494207095366,2025-04-24 22:11:28.839718,2025-04-24 22:11:35.629221,0 days 00:00:06.789503,0.05556690486223803,11,,4,14,1168,0.9578093610193804,TPESampler,COMPLETE
1186,0.3578065840353001,2025-04-24 22:11:29.778859,2025-04-24 22:11:32.333727,0 days 00:00:02.554868,0.01940735293561377,8,,4,8,589,0.7441352220976685,TPESampler,COMPLETE
1187,0.3334535478620514,2025-04-24 22:11:32.514739,2025-04-24 22:11:40.445060,0 days 00:00:07.930321,0.09602156834310975,12,,1,12,1153,0.9941484001340556,TPESampler,COMPLETE
1188,0.32837320409816234,2025-04-24 22:11:34.299040,2025-04-24 22:11:39.233761,0 days 00:00:04.934721,0.05811622154615897,11,,1,15,791,0.8997914300986276,TPESampler,COMPLETE
1189,0.5196640444865037,2025-04-24 22:11:35.805887,2025-04-24 22:11:37.151359,0 days 00:00:01.345472,0.0394186879312883,7,log2,9,19,949,0.7740859490961163,TPESampler,COMPLETE
1190,0.34232364216935074,2025-04-24 22:11:37.322736,2025-04-24 22:11:38.908112,0 days 00:00:01.585376,0.06548960178801057,12,log2,3,14,1128,0.9371431651077168,TPESampler,COMPLETE
1191,0.33463602901215767,2025-04-24 22:11:39.089421,2025-04-24 22:11:43.111939,0 days 00:00:04.022518,0.08089571401731575,12,,3,16,593,0.9016248490988976,TPESampler,COMPLETE
1192,0.34201835135385283,2025-04-24 22:11:39.500288,2025-04-24 22:11:41.819994,0 days 00:00:02.319706,0.03045951056611358,11,sqrt,4,10,1352,0.8131452046632831,TPESampler,COMPLETE
1193,0.7217244698840521,2025-04-24 22:11:40.638291,2025-04-24 22:11:41.541874,0 days 00:00:00.903583,0.01059355730876083,8,sqrt,5,10,159,0.8915439183763427,TPESampler,COMPLETE
1194,0.3443065455263232,2025-04-24 22:11:41.732481,2025-04-24 22:11:47.532419,0 days 00:00:05.799938,0.09613099114393628,12,,4,17,1078,0.8776338937879751,TPESampler,COMPLETE
1195,0.3529765565517188,2025-04-24 22:11:42.078765,2025-04-24 22:11:49.189524,0 days 00:00:07.110759,0.054064830242753284,12,,3,11,1191,0.9497007983466609,TPESampler,COMPLETE
1196,0.34326906781198463,2025-04-24 22:11:43.302037,2025-04-24 22:11:50.672788,0 days 00:00:07.370751,0.06440930956045123,12,,3,16,1263,0.9560560390333446,TPESampler,COMPLETE
1197,0.2991534769854652,2025-04-24 22:11:47.710521,2025-04-24 22:11:54.723768,0 days 00:00:07.013247,0.0596803072544857,12,,2,15,1131,0.9762077827650603,TPESampler,COMPLETE
1198,0.3397882459403021,2025-04-24 22:11:49.366841,2025-04-24 22:11:54.753726,0 days 00:00:05.386885,0.06865249412312588,12,,3,13,889,0.9509563486465715,TPESampler,COMPLETE
1199,0.36111737814726713,2025-04-24 22:11:50.921441,2025-04-24 22:11:56.319012,0 days 00:00:05.397571,0.0972834872473798,7,,1,10,1172,0.8946150995807899,TPESampler,COMPLETE
1200,0.4354489483039961,2025-04-24 22:11:54.886290,2025-04-24 22:11:56.544351,0 days 00:00:01.658061,0.0770601030879039,6,sqrt,9,9,983,0.9989596766079243,TPESampler,COMPLETE
1201,0.29801104366536063,2025-04-24 22:11:54.931563,2025-04-24 22:12:00.885215,0 days 00:00:05.953652,0.0880898911959842,11,,2,16,928,0.9867479436398652,TPESampler,COMPLETE
1202,0.32625609606166134,2025-04-24 22:11:56.504367,2025-04-24 22:12:01.119549,0 days 00:00:04.615182,0.09319161390593343,12,,1,14,768,0.8782869115450515,TPESampler,COMPLETE
1203,0.36094591647174157,2025-04-24 22:11:56.805760,2025-04-24 22:12:04.923312,0 days 00:00:08.117552,0.08343490972693478,12,,3,13,1450,0.907052871934796,TPESampler,COMPLETE
1204,0.3828061130871672,2025-04-24 22:12:01.075961,2025-04-24 22:12:05.374693,0 days 00:00:04.298732,0.011393472946146687,8,,5,19,1224,0.6328753788263763,TPESampler,COMPLETE
1205,0.5518291263600035,2025-04-24 22:12:01.361172,2025-04-24 22:12:02.596554,0 days 00:00:01.235382,0.016100669611419566,5,log2,1,17,615,0.9044803436641092,TPESampler,COMPLETE
1206,0.3252959656519199,2025-04-24 22:12:02.783548,2025-04-24 22:12:10.170863,0 days 00:00:07.387315,0.061470236437005166,12,,1,10,1242,0.8960696558635698,TPESampler,COMPLETE
1207,0.4049092562583987,2025-04-24 22:12:05.278856,2025-04-24 22:12:12.346941,0 days 00:00:07.068085,0.07262999484130549,12,,5,9,1249,0.9366055364963786,TPESampler,COMPLETE
1208,0.3140573883405628,2025-04-24 22:12:05.798846,2025-04-24 22:12:12.575237,0 days 00:00:06.776391,0.06181832592077655,10,,2,13,1275,0.9314427747814169,TPESampler,COMPLETE
1209,0.3552011036409819,2025-04-24 22:12:10.355315,2025-04-24 22:12:18.198497,0 days 00:00:07.843182,0.05287505856397196,10,,3,12,1264,0.9944340844417157,TPESampler,COMPLETE
1210,0.8728333964002406,2025-04-24 22:12:12.531007,2025-04-24 22:12:13.752248,0 days 00:00:01.221241,0.01526442408665751,8,log2,8,20,347,0.671504606384903,TPESampler,COMPLETE
1211,0.30699492661445665,2025-04-24 22:12:12.857529,2025-04-24 22:12:22.464847,0 days 00:00:09.607318,0.09990600147076337,12,,2,15,1448,0.9773845495526329,TPESampler,COMPLETE
1212,0.44892799092079794,2025-04-24 22:12:13.947213,2025-04-24 22:12:15.757363,0 days 00:00:01.810150,0.014277696075853207,4,,6,3,424,0.9639601820561001,TPESampler,COMPLETE
1213,0.4176849633332621,2025-04-24 22:12:15.928213,2025-04-24 22:12:17.204730,0 days 00:00:01.276517,0.02379466719387762,3,sqrt,3,7,800,0.9465543439778868,TPESampler,COMPLETE
1214,0.3256350408206084,2025-04-24 22:12:17.415960,2025-04-24 22:12:25.401189,0 days 00:00:07.985229,0.07067486684973939,12,,1,13,1229,0.9237303317434018,TPESampler,COMPLETE
1215,0.36249542057020606,2025-04-24 22:12:18.387239,2025-04-24 22:12:19.609827,0 days 00:00:01.222588,0.07203538339444682,9,log2,3,14,725,0.975757272848382,TPESampler,COMPLETE
1216,0.48089997502532905,2025-04-24 22:12:19.796214,2025-04-24 22:12:21.287942,0 days 00:00:01.491728,0.024082268834255134,8,log2,5,5,900,0.9719039200921795,TPESampler,COMPLETE
1217,0.34800263473936466,2025-04-24 22:12:21.470918,2025-04-24 22:12:26.170813,0 days 00:00:04.699895,0.09536023851624593,10,,4,13,866,0.8519935079000932,TPESampler,COMPLETE
1218,0.3627472647382789,2025-04-24 22:12:22.683842,2025-04-24 22:12:24.582330,0 days 00:00:01.898488,0.09500865699206273,11,log2,1,17,1281,0.9900965593755638,TPESampler,COMPLETE
1219,0.3034559257971526,2025-04-24 22:12:24.767157,2025-04-24 22:12:31.808757,0 days 00:00:07.041600,0.05819337750634644,12,,2,12,1198,0.9094594930542645,TPESampler,COMPLETE
1220,0.2991323840359736,2025-04-24 22:12:25.578553,2025-04-24 22:12:33.703659,0 days 00:00:08.125106,0.03674940438293592,12,,2,12,1304,0.9746989184944571,TPESampler,COMPLETE
1221,0.3153351117343409,2025-04-24 22:12:26.354023,2025-04-24 22:12:32.747429,0 days 00:00:06.393406,0.08006157026470573,10,,2,11,1196,0.9372773161202462,TPESampler,COMPLETE
1222,0.3292677030471031,2025-04-24 22:12:31.986722,2025-04-24 22:12:41.320085,0 days 00:00:09.333363,0.02757363305934518,12,,1,12,1463,0.991144810794461,TPESampler,COMPLETE
1223,0.3140174865633,2025-04-24 22:12:32.942152,2025-04-24 22:12:41.447508,0 days 00:00:08.505356,0.03730717586682381,12,,2,3,1338,0.9937848250318633,TPESampler,COMPLETE
1224,0.29864640598457587,2025-04-24 22:12:33.887149,2025-04-24 22:12:42.691167,0 days 00:00:08.804018,0.0767296869370133,12,,2,13,1494,0.9286892187765038,TPESampler,COMPLETE
1225,0.302946297062066,2025-04-24 22:12:41.522336,2025-04-24 22:12:48.715721,0 days 00:00:07.193385,0.0707005273091581,12,,2,12,1038,0.9854183162183879,TPESampler,COMPLETE
1226,0.36209290499287633,2025-04-24 22:12:41.650532,2025-04-24 22:12:51.236665,0 days 00:00:09.586133,0.0462317591944077,12,,3,11,1429,0.9930466704326748,TPESampler,COMPLETE
1227,0.30597248742969524,2025-04-24 22:12:43.235940,2025-04-24 22:12:51.864958,0 days 00:00:08.629018,0.08127931007402435,10,,2,12,1462,0.9948466211924822,TPESampler,COMPLETE
1228,0.35121663847547446,2025-04-24 22:12:49.289519,2025-04-24 22:12:57.125587,0 days 00:00:07.836068,0.09855690994173674,10,,1,12,1342,0.9082429653499751,TPESampler,COMPLETE
1229,0.33449505904756127,2025-04-24 22:12:51.740250,2025-04-24 22:13:00.131623,0 days 00:00:08.391373,0.04939695290335336,12,,1,12,1111,0.9982506344725727,TPESampler,COMPLETE
1230,0.3731968767922403,2025-04-24 22:12:52.160312,2025-04-24 22:12:54.260362,0 days 00:00:02.100050,0.07104688779501263,11,sqrt,2,19,295,0.91949207327307,TPESampler,COMPLETE
1231,0.3380346356814557,2025-04-24 22:12:54.472025,2025-04-24 22:12:56.948201,0 days 00:00:02.476176,0.04939569776246458,11,sqrt,2,12,1490,0.9658711814692282,TPESampler,COMPLETE
1232,0.3477590943019494,2025-04-24 22:12:57.132625,2025-04-24 22:13:03.228143,0 days 00:00:06.095518,0.05387146656976548,9,,3,7,1099,0.9453855258215235,TPESampler,COMPLETE
1233,0.31484012990678006,2025-04-24 22:12:57.323657,2025-04-24 22:13:05.413147,0 days 00:00:08.089490,0.09280077660581763,12,,2,10,1276,0.9277242275389856,TPESampler,COMPLETE
1234,0.4111913557382624,2025-04-24 22:13:00.324596,2025-04-24 22:13:02.082960,0 days 00:00:01.758364,0.05733003919584678,4,sqrt,6,15,1322,0.6121229337211104,TPESampler,COMPLETE
1235,0.35449999363998624,2025-04-24 22:13:02.262178,2025-04-24 22:13:08.127770,0 days 00:00:05.865592,0.0905414729357392,12,,3,9,1111,0.8046971717681419,TPESampler,COMPLETE
1236,0.47158555298206994,2025-04-24 22:13:03.417995,2025-04-24 22:13:05.673128,0 days 00:00:02.255133,0.014054022627666229,8,,10,16,626,0.6498432981708953,TPESampler,COMPLETE
1237,0.37968805379772513,2025-04-24 22:13:05.623899,2025-04-24 22:13:09.958229,0 days 00:00:04.334330,0.0166777346634003,11,,6,7,900,0.799678822290468,TPESampler,COMPLETE
1238,0.3668313245017659,2025-04-24 22:13:05.900252,2025-04-24 22:13:13.982132,0 days 00:00:08.081880,0.0750378966219203,12,,3,9,1258,0.9974590476871722,TPESampler,COMPLETE
1239,0.36065838032834163,2025-04-24 22:13:08.307873,2025-04-24 22:13:16.433554,0 days 00:00:08.125681,0.06683131787510146,12,,3,6,1416,0.8943473927343675,TPESampler,COMPLETE
1240,0.4090907959337635,2025-04-24 22:13:10.162115,2025-04-24 22:13:12.493204,0 days 00:00:02.331089,0.05562630912574641,10,,9,19,564,0.6769101138988729,TPESampler,COMPLETE
1241,0.4727077346485513,2025-04-24 22:13:12.678372,2025-04-24 22:13:14.014104,0 days 00:00:01.335732,0.049520835060193724,5,log2,7,5,595,0.9640894453282279,TPESampler,COMPLETE
1242,0.39288005908351076,2025-04-24 22:13:14.216911,2025-04-24 22:13:16.341336,0 days 00:00:02.124425,0.0832290012702926,4,,5,19,699,0.6295880305605744,TPESampler,COMPLETE
1243,0.3574776891518847,2025-04-24 22:13:14.290581,2025-04-24 22:13:22.282494,0 days 00:00:07.991913,0.07373337987967009,12,,3,14,1239,0.9914583973470056,TPESampler,COMPLETE
1244,0.3489674883157598,2025-04-24 22:13:16.516051,2025-04-24 22:13:18.568136,0 days 00:00:02.052085,0.08881110144772415,5,,4,20,453,0.8757954699780887,TPESampler,COMPLETE
1245,0.32624737941587756,2025-04-24 22:13:16.591570,2025-04-24 22:13:23.472874,0 days 00:00:06.881304,0.04496889924154611,10,,1,9,1248,0.8852615080659652,TPESampler,COMPLETE
