number,value,datetime_start,datetime_complete,duration,params_learning_rate,params_max_depth,params_max_features,params_min_samples_leaf,params_min_samples_split,params_n_estimators,params_subsample,system_attrs_auto:sampler,state
998,0.3558592111781976,2025-04-24 22:05:14.947761,2025-04-24 22:05:22.811595,0 days 00:00:07.863834,0.031549048837027624,10,,3,8,1384,0.993858445920751,TPESampler,COMPLETE
999,0.38770972783538205,2025-04-24 22:05:17.153976,2025-04-24 22:05:18.696491,0 days 00:00:01.542515,0.04653682611885909,4,sqrt,1,4,1041,0.893122180600182,TPESampler,COMPLETE
1000,0.3088960326871911,2025-04-24 22:05:18.885739,2025-04-24 22:05:27.239530,0 days 00:00:08.353791,0.06210046313951976,12,,2,3,1396,0.8997629049435696,TPESampler,COMPLETE
1001,0.3272171806497524,2025-04-24 22:05:20.490868,2025-04-24 22:05:28.070333,0 days 00:00:07.579465,0.098582821724198,11,,1,14,1150,0.9852671817478613,TPESampler,COMPLETE
1002,0.3901540475741979,2025-04-24 22:05:23.013120,2025-04-24 22:05:24.671532,0 days 00:00:01.658412,0.013716213277289854,12,sqrt,5,9,1075,0.6959474796133565,TPESampler,COMPLETE
1003,0.31322109819768884,2025-04-24 22:05:24.851650,2025-04-24 22:05:34.133056,0 days 00:00:09.281406,0.06555019113271503,12,,2,5,1443,0.9956635088409154,TPESampler,COMPLETE
1004,0.30189283925460325,2025-04-24 22:05:27.419138,2025-04-24 22:05:34.413554,0 days 00:00:06.994416,0.04016151734099005,12,,2,11,1110,0.9940309200166161,TPESampler,COMPLETE
1005,0.3103725831023527,2025-04-24 22:05:28.264516,2025-04-24 22:05:35.774416,0 days 00:00:07.509900,0.08763462607557479,12,,2,12,1237,0.9552982036943721,TPESampler,COMPLETE
1006,0.3016631669677109,2025-04-24 22:05:34.510023,2025-04-24 22:05:40.896558,0 days 00:00:06.386535,0.0444595823611879,11,,2,11,1129,0.9113063569604745,TPESampler,COMPLETE
1007,0.3502202341172449,2025-04-24 22:05:34.685758,2025-04-24 22:05:43.272716,0 days 00:00:08.586958,0.06195954694357963,12,,3,13,1381,0.9880750738423131,TPESampler,COMPLETE
1008,0.3627830306977604,2025-04-24 22:05:35.964273,2025-04-24 22:05:42.493160,0 days 00:00:06.528887,0.0636076896183767,12,,3,8,1122,0.9352601301427481,TPESampler,COMPLETE
1009,0.3225679435257478,2025-04-24 22:05:41.202901,2025-04-24 22:05:50.114123,0 days 00:00:08.911222,0.0437266238807134,12,,1,8,1385,0.9787145027168338,TPESampler,COMPLETE
1010,0.3300370387100308,2025-04-24 22:05:42.680273,2025-04-24 22:05:49.395196,0 days 00:00:06.714923,0.06102114292222076,10,,1,8,1256,0.9224801200574522,TPESampler,COMPLETE
1011,0.30216248343641977,2025-04-24 22:05:43.467018,2025-04-24 22:05:51.270395,0 days 00:00:07.803377,0.09117960527956687,12,,2,12,1245,0.99031006779292,TPESampler,COMPLETE
1012,0.36040252684596924,2025-04-24 22:05:49.575212,2025-04-24 22:05:58.015511,0 days 00:00:08.440299,0.06675301123298787,11,,3,10,1498,0.9697541557402516,TPESampler,COMPLETE
1013,0.3004785526293559,2025-04-24 22:05:50.330288,2025-04-24 22:05:59.284868,0 days 00:00:08.954580,0.04265815513484762,12,,2,13,1372,0.9958446398850017,TPESampler,COMPLETE
1014,0.3478353114625406,2025-04-24 22:05:51.460710,2025-04-24 22:05:57.890197,0 days 00:00:06.429487,0.08236016818451893,10,,3,15,1356,0.8861777218270693,TPESampler,COMPLETE
1015,0.31546528068568697,2025-04-24 22:05:58.066215,2025-04-24 22:06:05.200411,0 days 00:00:07.134196,0.07333534742465063,12,,1,12,1174,0.9149106662776065,TPESampler,COMPLETE
1016,0.3226935495059899,2025-04-24 22:05:58.238432,2025-04-24 22:06:07.848496,0 days 00:00:09.610064,0.08959243068001374,12,,1,9,1471,0.9935329266375968,TPESampler,COMPLETE
1017,0.3320507136787591,2025-04-24 22:05:59.476919,2025-04-24 22:06:01.996926,0 days 00:00:02.520007,0.04741968704849779,10,,2,18,545,0.6870576292454162,TPESampler,COMPLETE
1018,0.3087476121840335,2025-04-24 22:06:02.181378,2025-04-24 22:06:10.949562,0 days 00:00:08.768184,0.06726442947270884,11,,2,8,1474,0.9788021230482509,TPESampler,COMPLETE
1019,0.37173945826546734,2025-04-24 22:06:05.379054,2025-04-24 22:06:13.430428,0 days 00:00:08.051374,0.06431885392026129,11,,3,10,1293,0.9829040585479851,TPESampler,COMPLETE
1020,0.7795415349188334,2025-04-24 22:06:08.033818,2025-04-24 22:06:08.814596,0 days 00:00:00.780778,0.059611856810145254,11,log2,10,5,236,0.756736073245875,TPESampler,COMPLETE
1021,0.36422384626484594,2025-04-24 22:06:08.993687,2025-04-24 22:06:11.024072,0 days 00:00:02.030385,0.0865639886694468,5,sqrt,1,16,1455,0.8571149924377854,TPESampler,COMPLETE
1022,0.33028750623011033,2025-04-24 22:06:11.127573,2025-04-24 22:06:19.002166,0 days 00:00:07.874593,0.06778599149570312,11,,1,11,1255,0.9975521795597628,TPESampler,COMPLETE
1023,0.3317201746369569,2025-04-24 22:06:11.210285,2025-04-24 22:06:18.097848,0 days 00:00:06.887563,0.06818617780466804,12,,1,15,1064,0.961938677541603,TPESampler,COMPLETE
1024,0.39033481474767634,2025-04-24 22:06:13.617559,2025-04-24 22:06:22.877103,0 days 00:00:09.259544,0.09545907161128148,12,,4,10,1453,0.9974374679217181,TPESampler,COMPLETE
1025,0.33919651134829526,2025-04-24 22:06:18.283060,2025-04-24 22:06:20.772093,0 days 00:00:02.489033,0.07031677752609426,12,sqrt,2,17,1253,0.9861681488598049,TPESampler,COMPLETE
1026,0.43435044760368957,2025-04-24 22:06:19.190022,2025-04-24 22:06:21.048998,0 days 00:00:01.858976,0.011966926657506595,10,sqrt,7,20,953,0.7749681133127393,TPESampler,COMPLETE
1027,0.45326412251421017,2025-04-24 22:06:21.005830,2025-04-24 22:06:22.427490,0 days 00:00:01.421660,0.04273119942449895,5,,8,18,239,0.6025533185475346,TPESampler,COMPLETE
1028,0.29788745279091194,2025-04-24 22:06:21.257127,2025-04-24 22:06:30.353221,0 days 00:00:09.096094,0.09100880752221743,12,,2,11,1328,0.9959123147110802,TPESampler,COMPLETE
1029,0.34839791652386704,2025-04-24 22:06:22.754392,2025-04-24 22:06:25.138791,0 days 00:00:02.384399,0.09030710350748873,12,sqrt,1,12,1446,0.958761040440631,TPESampler,COMPLETE
1030,0.3592243022509905,2025-04-24 22:06:23.073626,2025-04-24 22:06:29.561404,0 days 00:00:06.487778,0.09471480241938339,10,,3,13,1247,0.9302835820965144,TPESampler,COMPLETE
1031,0.37074396583422636,2025-04-24 22:06:25.321362,2025-04-24 22:06:32.432045,0 days 00:00:07.110683,0.07767614091296646,12,,3,10,1252,0.9216020549242989,TPESampler,COMPLETE
1032,0.3044625148350015,2025-04-24 22:06:29.746244,2025-04-24 22:06:35.504885,0 days 00:00:05.758641,0.055073602328398155,12,,2,11,974,0.8873032632899098,TPESampler,COMPLETE
1033,0.36184637046337637,2025-04-24 22:06:30.538630,2025-04-24 22:06:36.149072,0 days 00:00:05.610442,0.04232284981806235,7,,1,12,1225,0.981737691337096,TPESampler,COMPLETE
1034,0.35955995814946046,2025-04-24 22:06:32.624363,2025-04-24 22:06:41.060217,0 days 00:00:08.435854,0.03354900756041666,12,,3,10,1368,0.9837594216668423,TPESampler,COMPLETE
1035,0.8958799219347343,2025-04-24 22:06:35.681364,2025-04-24 22:06:36.397378,0 days 00:00:00.716014,0.015473240225761381,10,log2,4,4,131,0.6328865828027489,TPESampler,COMPLETE
1036,0.3616124754757347,2025-04-24 22:06:36.332459,2025-04-24 22:06:43.191074,0 days 00:00:06.858615,0.09978060180126085,10,,3,11,1390,0.8675781415996284,TPESampler,COMPLETE
1037,0.33928063316789286,2025-04-24 22:06:36.626665,2025-04-24 22:06:42.231881,0 days 00:00:05.605216,0.0622236966391861,10,,3,12,1092,0.911178028024257,TPESampler,COMPLETE
1038,0.34870097481570206,2025-04-24 22:06:41.276408,2025-04-24 22:06:43.481057,0 days 00:00:02.204649,0.04229048362364746,9,sqrt,1,12,1260,0.9972401218084674,TPESampler,COMPLETE
1039,0.301876002833803,2025-04-24 22:06:42.425750,2025-04-24 22:06:51.281293,0 days 00:00:08.855543,0.051351275198481997,12,,2,11,1408,0.9694819477935411,TPESampler,COMPLETE
1040,0.4675396683096699,2025-04-24 22:06:43.389556,2025-04-24 22:06:44.636330,0 days 00:00:01.246774,0.06008318261201977,12,log2,7,3,560,0.952027530957598,TPESampler,COMPLETE
1041,0.3069392494288922,2025-04-24 22:06:43.723742,2025-04-24 22:06:52.456841,0 days 00:00:08.733099,0.05278394033256629,12,,2,12,1454,0.9238924638598167,TPESampler,COMPLETE
1042,0.2932558439034892,2025-04-24 22:06:44.918797,2025-04-24 22:06:52.299552,0 days 00:00:07.380755,0.0687035011370691,12,,2,11,1252,0.9299384567241159,TPESampler,COMPLETE
1043,0.2974668039786803,2025-04-24 22:06:51.540796,2025-04-24 22:07:01.068291,0 days 00:00:09.527495,0.06048103192132588,12,,2,14,1477,0.9812106736651826,TPESampler,COMPLETE
1044,0.8450600031043589,2025-04-24 22:06:52.459611,2025-04-24 22:06:53.343809,0 days 00:00:00.884198,0.027651303455382272,6,log2,10,10,279,0.721849354061848,TPESampler,COMPLETE
1045,0.39857399452231457,2025-04-24 22:06:52.626666,2025-04-24 22:06:54.336728,0 days 00:00:01.710062,0.046610571991636,6,sqrt,7,15,945,0.8427116129389842,TPESampler,COMPLETE
1046,0.3558755165109646,2025-04-24 22:06:53.532010,2025-04-24 22:07:00.500736,0 days 00:00:06.968726,0.07769206686465961,12,,3,11,1220,0.9088726670734985,TPESampler,COMPLETE
1047,0.46810991084742387,2025-04-24 22:06:54.521219,2025-04-24 22:06:56.257938,0 days 00:00:01.736719,0.03622167090211747,5,sqrt,10,10,1364,0.7212771037414349,TPESampler,COMPLETE
1048,0.3698345663628072,2025-04-24 22:06:56.439247,2025-04-24 22:07:04.067472,0 days 00:00:07.628225,0.052106235336639675,12,,4,10,1249,0.9913659645386487,TPESampler,COMPLETE
1049,0.31346293413689563,2025-04-24 22:07:00.696621,2025-04-24 22:07:07.772500,0 days 00:00:07.075879,0.05726262847318538,11,,2,10,1262,0.8976459307217518,TPESampler,COMPLETE
1050,0.3228801431164105,2025-04-24 22:07:01.265367,2025-04-24 22:07:07.017859,0 days 00:00:05.752492,0.05458547990096672,10,,2,11,1068,0.9318339493400106,TPESampler,COMPLETE
1051,0.3357407312542071,2025-04-24 22:07:04.250678,2025-04-24 22:07:11.771302,0 days 00:00:07.520624,0.04661449963977851,10,,1,10,1384,0.9410867321744522,TPESampler,COMPLETE
1052,0.29488394633204323,2025-04-24 22:07:07.191103,2025-04-24 22:07:16.343913,0 days 00:00:09.152810,0.05533881549659361,12,,2,9,1469,0.981271031720212,TPESampler,COMPLETE
1053,0.30180168873688656,2025-04-24 22:07:07.953456,2025-04-24 22:07:14.761073,0 days 00:00:06.807617,0.050043902252092626,12,,2,13,1174,0.9071169896170702,TPESampler,COMPLETE
1054,0.3045572832198942,2025-04-24 22:07:11.950074,2025-04-24 22:07:18.747842,0 days 00:00:06.797768,0.08629191589254308,11,,2,12,1126,0.8934708483212097,TPESampler,COMPLETE
1055,0.3145750674406437,2025-04-24 22:07:14.952851,2025-04-24 22:07:22.986798,0 days 00:00:08.033947,0.09774190178331368,12,,2,12,1465,0.8800514206527618,TPESampler,COMPLETE
1056,0.3189457822573443,2025-04-24 22:07:16.520008,2025-04-24 22:07:25.578696,0 days 00:00:09.058688,0.04639180547062184,12,,1,8,1484,0.9491926493537209,TPESampler,COMPLETE
1057,0.2983553640587682,2025-04-24 22:07:18.926326,2025-04-24 22:07:26.241126,0 days 00:00:07.314800,0.05326707679570323,12,,2,8,1206,0.9381236806182575,TPESampler,COMPLETE
1058,0.36902505248551853,2025-04-24 22:07:23.207817,2025-04-24 22:07:31.947238,0 days 00:00:08.739421,0.04730563061438243,11,,3,9,1365,0.9899701669341083,TPESampler,COMPLETE
1059,0.29502914572707933,2025-04-24 22:07:25.764917,2025-04-24 22:07:34.109408,0 days 00:00:08.344491,0.045247893703277114,12,,2,9,1291,0.9978684511056817,TPESampler,COMPLETE
1060,0.3137000613415499,2025-04-24 22:07:26.418160,2025-04-24 22:07:33.172933,0 days 00:00:06.754773,0.07364323436578836,10,,2,5,1255,0.9355211597533872,TPESampler,COMPLETE
1061,0.3218916440763276,2025-04-24 22:07:32.165626,2025-04-24 22:07:41.561538,0 days 00:00:09.395912,0.07219214488623274,12,,1,13,1364,0.998428925212012,TPESampler,COMPLETE
1062,0.48241085396605676,2025-04-24 22:07:33.361263,2025-04-24 22:07:34.943053,0 days 00:00:01.581790,0.02163331717113142,4,log2,1,18,942,0.7451970638255192,TPESampler,COMPLETE
1063,0.3124845658451317,2025-04-24 22:07:34.328185,2025-04-24 22:07:43.768520,0 days 00:00:09.440335,0.04762229292860958,12,,1,6,1457,0.9505719233515099,TPESampler,COMPLETE
1064,0.38819828842952464,2025-04-24 22:07:35.115354,2025-04-24 22:07:36.917881,0 days 00:00:01.802527,0.011206994185746675,5,sqrt,3,4,1317,0.9961458656788058,TPESampler,COMPLETE
1065,0.34663305871071604,2025-04-24 22:07:37.100497,2025-04-24 22:07:38.808956,0 days 00:00:01.708459,0.06646346644651369,10,sqrt,4,8,1065,0.9411802291347882,TPESampler,COMPLETE
1066,0.3759361666585626,2025-04-24 22:07:38.986956,2025-04-24 22:07:47.079878,0 days 00:00:08.092922,0.050667057430704536,12,,4,5,1287,0.9883093600537958,TPESampler,COMPLETE
1067,0.3864763259456008,2025-04-24 22:07:41.743517,2025-04-24 22:07:43.386096,0 days 00:00:01.642579,0.0772823552643803,9,sqrt,6,20,1117,0.8281559340764088,TPESampler,COMPLETE
1068,0.3177196446713512,2025-04-24 22:07:43.564750,2025-04-24 22:07:52.000174,0 days 00:00:08.435424,0.05436627182556756,10,,2,8,1468,0.9897699440320782,TPESampler,COMPLETE
1069,0.31493973169248524,2025-04-24 22:07:43.988148,2025-04-24 22:07:53.800429,0 days 00:00:09.812281,0.04991139513131629,12,,1,10,1490,0.9833724756693722,TPESampler,COMPLETE
1070,0.4155246856855875,2025-04-24 22:07:47.657207,2025-04-24 22:07:49.899442,0 days 00:00:02.242235,0.06360107295860613,6,log2,7,15,1175,0.9316572624884158,TPESampler,COMPLETE
1071,0.3292501600521546,2025-04-24 22:07:50.222241,2025-04-24 22:07:59.517494,0 days 00:00:09.295253,0.07190011708460989,12,,2,8,1455,0.9175790879843059,TPESampler,COMPLETE
1072,0.4405466936249708,2025-04-24 22:07:52.495897,2025-04-24 22:07:58.928211,0 days 00:00:06.432314,0.013378267679201401,7,,10,12,1457,0.9979723254413095,TPESampler,COMPLETE
1073,0.46443044199598704,2025-04-24 22:07:54.095675,2025-04-24 22:07:56.402312,0 days 00:00:02.306637,0.05353749769954885,6,log2,8,5,1408,0.605867445605715,TPESampler,COMPLETE
1074,0.3496330710890586,2025-04-24 22:07:56.720084,2025-04-24 22:08:03.717267,0 days 00:00:06.997183,0.023844042716482428,12,,3,7,1125,0.9641950184476724,TPESampler,COMPLETE
1075,0.3614501743481941,2025-04-24 22:07:59.103396,2025-04-24 22:08:08.137222,0 days 00:00:09.033826,0.04974609796722613,12,,3,9,1500,0.9749412593778436,TPESampler,COMPLETE
1076,0.3055540743956549,2025-04-24 22:07:59.738197,2025-04-24 22:08:06.979020,0 days 00:00:07.240823,0.05347701747432233,12,,2,8,1160,0.9785520305841605,TPESampler,COMPLETE
1077,0.3381489071753567,2025-04-24 22:08:03.900236,2025-04-24 22:08:10.686510,0 days 00:00:06.786274,0.03350350081461055,9,,1,10,1219,0.992062897541979,TPESampler,COMPLETE
1078,0.3413018855308263,2025-04-24 22:08:07.151941,2025-04-24 22:08:14.925237,0 days 00:00:07.773296,0.03434732442723016,12,,3,13,1323,0.9283765431191218,TPESampler,COMPLETE
1079,0.3892633440792444,2025-04-24 22:08:08.317824,2025-04-24 22:08:09.779653,0 days 00:00:01.461829,0.09430529876870258,3,log2,4,12,1099,0.8494592042940876,TPESampler,COMPLETE
1080,0.3668021539606442,2025-04-24 22:08:09.971988,2025-04-24 22:08:16.500171,0 days 00:00:06.528183,0.06312221366947618,12,,3,10,1019,0.9998171638625065,TPESampler,COMPLETE
1081,0.33295101331789717,2025-04-24 22:08:10.867836,2025-04-24 22:08:19.295088,0 days 00:00:08.427252,0.060444927380402885,10,,1,8,1492,0.9827649107852333,TPESampler,COMPLETE
1082,0.34740443794864867,2025-04-24 22:08:15.162740,2025-04-24 22:08:21.816936,0 days 00:00:06.654196,0.08549198419202274,10,,3,10,1253,0.9239846526376168,TPESampler,COMPLETE
1083,0.3312420654009499,2025-04-24 22:08:16.679508,2025-04-24 22:08:24.097259,0 days 00:00:07.417751,0.07907046203437988,10,,1,11,1371,0.9260402039702814,TPESampler,COMPLETE
1084,0.380008614248458,2025-04-24 22:08:19.489087,2025-04-24 22:08:28.408752,0 days 00:00:08.919665,0.09396497532079758,12,,4,14,1495,0.9876345181169865,TPESampler,COMPLETE
1085,0.31893601963403123,2025-04-24 22:08:21.992980,2025-04-24 22:08:29.456518,0 days 00:00:07.463538,0.04164791011318301,10,,2,8,1288,0.9955163606384605,TPESampler,COMPLETE
1086,0.6850236601401911,2025-04-24 22:08:24.273774,2025-04-24 22:08:25.191815,0 days 00:00:00.918041,0.014269665404585803,12,log2,3,2,370,0.8053194227417978,TPESampler,COMPLETE
1087,0.3881702185861203,2025-04-24 22:08:25.372765,2025-04-24 22:08:32.286199,0 days 00:00:06.913434,0.06608800543419895,8,,6,6,1427,0.9947020491531007,TPESampler,COMPLETE
1088,0.37593529188265423,2025-04-24 22:08:28.679491,2025-04-24 22:08:37.081859,0 days 00:00:08.402368,0.07296112537067384,10,,3,7,1480,0.9948590566115179,TPESampler,COMPLETE
1089,0.4070256633505346,2025-04-24 22:08:29.637656,2025-04-24 22:08:31.308243,0 days 00:00:01.670587,0.0351747899137889,10,log2,2,6,1152,0.9970311000976517,TPESampler,COMPLETE
1090,0.2981733163198271,2025-04-24 22:08:31.498421,2025-04-24 22:08:39.467484,0 days 00:00:07.969063,0.0643708850675806,12,,2,11,1338,0.9332266822115475,TPESampler,COMPLETE
1091,0.32644582773351644,2025-04-24 22:08:32.487591,2025-04-24 22:08:39.831306,0 days 00:00:07.343715,0.04662294669789891,12,,1,9,1103,0.9979398754158745,TPESampler,COMPLETE
1092,0.40811532746934465,2025-04-24 22:08:37.269862,2025-04-24 22:08:39.609274,0 days 00:00:02.339412,0.011793606398267632,4,,5,4,806,0.6103831909864017,TPESampler,COMPLETE
1093,0.30183752425386606,2025-04-24 22:08:39.745725,2025-04-24 22:08:49.371453,0 days 00:00:09.625728,0.06281468658052897,12,,2,8,1478,0.9793129628924533,TPESampler,COMPLETE
1094,0.3612137638308963,2025-04-24 22:08:39.797693,2025-04-24 22:08:49.335966,0 days 00:00:09.538273,0.054973620377980335,12,,3,9,1462,0.9791040559750174,TPESampler,COMPLETE
1095,0.40537582427361313,2025-04-24 22:08:40.070218,2025-04-24 22:08:41.782048,0 days 00:00:01.711830,0.016447160540694637,12,log2,1,7,922,0.6377191144426773,TPESampler,COMPLETE
1096,0.5233006661287095,2025-04-24 22:08:41.962543,2025-04-24 22:08:43.086995,0 days 00:00:01.124452,0.012007687745669725,3,,6,12,299,0.6107669797413258,TPESampler,COMPLETE
1097,0.42936773205450446,2025-04-24 22:08:43.269446,2025-04-24 22:08:45.193867,0 days 00:00:01.924421,0.025953359931479625,11,sqrt,8,18,1470,0.807645564572793,TPESampler,COMPLETE
1098,0.6928283807014735,2025-04-24 22:08:45.377758,2025-04-24 22:08:46.099445,0 days 00:00:00.721687,0.04544054810327944,6,log2,4,20,142,0.8280311716574538,TPESampler,COMPLETE
1099,0.36936705182321156,2025-04-24 22:08:46.274582,2025-04-24 22:08:55.312930,0 days 00:00:09.038348,0.06879957059534414,12,,3,10,1456,0.9939673326007407,TPESampler,COMPLETE
1100,0.35221006819465517,2025-04-24 22:08:49.488604,2025-04-24 22:08:57.430574,0 days 00:00:07.941970,0.032979737123055526,12,,3,9,1222,0.9988735353428777,TPESampler,COMPLETE
1101,0.3996694165328535,2025-04-24 22:08:49.533269,2025-04-24 22:08:51.289187,0 days 00:00:01.755918,0.010721787344982605,9,sqrt,1,2,715,0.7646845412038281,TPESampler,COMPLETE
1102,0.46634734504212433,2025-04-24 22:08:51.477172,2025-04-24 22:08:52.576296,0 days 00:00:01.099124,0.020399576786187135,4,,2,3,209,0.8102770436181642,TPESampler,COMPLETE
1103,0.38483112729673885,2025-04-24 22:08:52.804963,2025-04-24 22:08:59.420177,0 days 00:00:06.615214,0.04539061024564254,12,,5,11,1128,0.9340691666609012,TPESampler,COMPLETE
1104,0.3206792332407601,2025-04-24 22:08:55.492793,2025-04-24 22:08:57.598871,0 days 00:00:02.106078,0.05382133842562169,10,sqrt,3,7,1379,0.9323278841044591,TPESampler,COMPLETE
1105,0.344711832394073,2025-04-24 22:08:57.606403,2025-04-24 22:09:04.757276,0 days 00:00:07.150873,0.06014814375749609,12,,3,13,1244,0.915900833111455,TPESampler,COMPLETE
1106,0.29444138848176815,2025-04-24 22:08:57.790688,2025-04-24 22:09:05.794276,0 days 00:00:08.003588,0.08746115757935574,12,,2,13,1229,0.9913704510028851,TPESampler,COMPLETE
1107,0.6237227863240534,2025-04-24 22:08:59.596640,2025-04-24 22:09:01.091908,0 days 00:00:01.495268,0.017936048647337898,3,log2,8,5,1171,0.7735133642852202,TPESampler,COMPLETE
1108,0.319042211664893,2025-04-24 22:09:01.262235,2025-04-24 22:09:08.387856,0 days 00:00:07.125621,0.041768543108226044,12,,2,9,1316,0.8342344314871522,TPESampler,COMPLETE
1109,0.3427835329861245,2025-04-24 22:09:04.937416,2025-04-24 22:09:11.708841,0 days 00:00:06.771425,0.030729930282025874,10,,4,10,1343,0.9046718041906189,TPESampler,COMPLETE
1110,0.3421097231832085,2025-04-24 22:09:05.978906,2025-04-24 22:09:11.709868,0 days 00:00:05.730962,0.07069466156782685,11,,3,13,1051,0.920857458425487,TPESampler,COMPLETE
1111,0.2986919268260193,2025-04-24 22:09:08.571188,2025-04-24 22:09:16.368186,0 days 00:00:07.796998,0.07076132620535759,12,,2,14,1251,0.9889567821279248,TPESampler,COMPLETE
1112,0.2963598407069653,2025-04-24 22:09:11.960709,2025-04-24 22:09:19.207014,0 days 00:00:07.246305,0.07339272465623692,10,,2,19,1183,0.9822141439047958,TPESampler,COMPLETE
1113,0.3122798689467803,2025-04-24 22:09:11.999029,2025-04-24 22:09:19.288181,0 days 00:00:07.289152,0.08955779166000513,12,,2,16,1081,0.933605370303047,TPESampler,COMPLETE
1114,0.303951448128603,2025-04-24 22:09:16.557684,2025-04-24 22:09:23.896774,0 days 00:00:07.339090,0.0727508377778031,11,,2,11,1211,0.9940585348188438,TPESampler,COMPLETE
1115,0.31729873564056105,2025-04-24 22:09:19.364227,2025-04-24 22:09:25.457361,0 days 00:00:06.093134,0.06219995187047792,10,,2,14,1002,0.9994158456141411,TPESampler,COMPLETE
1116,0.33563941319684937,2025-04-24 22:09:19.481968,2025-04-24 22:09:26.898388,0 days 00:00:07.416420,0.0982664021475531,11,,1,12,1104,0.9975844601293864,TPESampler,COMPLETE
1117,0.40725048008818343,2025-04-24 22:09:24.073564,2025-04-24 22:09:25.685333,0 days 00:00:01.611769,0.01821864608495983,8,sqrt,7,6,1027,0.8599004544994314,TPESampler,COMPLETE
1118,0.33118732715227145,2025-04-24 22:09:25.642960,2025-04-24 22:09:31.579438,0 days 00:00:05.936478,0.07605446170497626,9,,1,19,1154,0.9473011924979113,TPESampler,COMPLETE
1119,0.33026704949042424,2025-04-24 22:09:25.923097,2025-04-24 22:09:34.685717,0 days 00:00:08.762620,0.07854277194457357,12,,1,18,1442,0.935576330731436,TPESampler,COMPLETE
1120,0.30419697682350816,2025-04-24 22:09:27.084781,2025-04-24 22:09:34.113609,0 days 00:00:07.028828,0.07972365148052075,12,,2,16,1251,0.885738318766304,TPESampler,COMPLETE
1121,0.3326550782220555,2025-04-24 22:09:31.758111,2025-04-24 22:09:37.332387,0 days 00:00:05.574276,0.0740828184183672,10,,3,17,1024,0.9197420003013042,TPESampler,COMPLETE
