number,value,datetime_start,datetime_complete,duration,params_learning_rate,params_max_depth,params_max_features,params_min_samples_leaf,params_min_samples_split,params_n_estimators,params_subsample,system_attrs_auto:sampler,state
2362,0.3384339924032463,2025-04-24 22:50:11.462541,2025-04-24 22:50:16.809416,0 days 00:00:05.346875,0.09210281616229152,12,,4,19,931,0.9117886336574368,TPESampler,COMPLETE
2363,0.3315045888722661,2025-04-24 22:50:15.883689,2025-04-24 22:50:22.872738,0 days 00:00:06.989049,0.09919375456458734,11,,1,19,1045,0.9562972848081612,TPESampler,COMPLETE
2364,0.3209223029818863,2025-04-24 22:50:16.979887,2025-04-24 22:50:18.792995,0 days 00:00:01.813108,0.08155391580540013,10,sqrt,3,18,657,0.9828781023212687,TPESampler,COMPLETE
2365,0.39226804109102925,2025-04-24 22:50:17.122742,2025-04-24 22:50:19.672473,0 days 00:00:02.549731,0.013600986572632978,10,sqrt,5,3,1199,0.655073977678089,TPESampler,COMPLETE
2366,0.3083117888919928,2025-04-24 22:50:18.988325,2025-04-24 22:50:25.050106,0 days 00:00:06.061781,0.0963489250180397,11,,2,16,957,0.9813154772708035,TPESampler,COMPLETE
2367,0.3120071270635068,2025-04-24 22:50:19.872972,2025-04-24 22:50:25.837529,0 days 00:00:05.964557,0.08804295048761722,12,,1,20,864,0.9893637843588552,TPESampler,COMPLETE
2368,0.3462958510050844,2025-04-24 22:50:23.066232,2025-04-24 22:50:28.613272,0 days 00:00:05.547040,0.09884235966425783,12,,3,20,950,0.8894106092171948,TPESampler,COMPLETE
2369,0.3264496586842504,2025-04-24 22:50:25.244806,2025-04-24 22:50:33.757105,0 days 00:00:08.512299,0.05529001467956399,12,,1,20,1243,0.9952642620943509,TPESampler,COMPLETE
2370,0.3391687699714997,2025-04-24 22:50:26.043086,2025-04-24 22:50:31.326056,0 days 00:00:05.282970,0.07869803727953979,11,,3,19,848,0.993021278341627,TPESampler,COMPLETE
2371,0.3134029026029284,2025-04-24 22:50:28.817229,2025-04-24 22:50:36.423760,0 days 00:00:07.606531,0.09630923714797408,12,,1,19,1119,0.9781692097001807,TPESampler,COMPLETE
2372,0.5216494609908054,2025-04-24 22:50:31.520649,2025-04-24 22:50:32.947940,0 days 00:00:01.427291,0.046449457035008725,4,log2,8,15,975,0.6399539978367417,TPESampler,COMPLETE
2373,0.33013287424482135,2025-04-24 22:50:33.145582,2025-04-24 22:50:38.747141,0 days 00:00:05.601559,0.07072509453623803,12,,3,20,870,0.962423126178816,TPESampler,COMPLETE
2374,0.30775711978116294,2025-04-24 22:50:33.959996,2025-04-24 22:50:39.456851,0 days 00:00:05.496855,0.09294834433718567,10,,2,20,991,0.8994265961346235,TPESampler,COMPLETE
2375,0.35574881842263517,2025-04-24 22:50:36.618517,2025-04-24 22:50:43.057619,0 days 00:00:06.439102,0.09828650059747923,12,,3,16,972,0.9752861409017959,TPESampler,COMPLETE
2376,0.4187365237801005,2025-04-24 22:50:38.945098,2025-04-24 22:50:40.880754,0 days 00:00:01.935656,0.09676966345453938,9,log2,6,17,1259,0.6601702680201743,TPESampler,COMPLETE
2377,0.3539255390144546,2025-04-24 22:50:39.676890,2025-04-24 22:50:44.469390,0 days 00:00:04.792500,0.09372060208869792,12,,4,13,678,0.9896600788400723,TPESampler,COMPLETE
2378,0.292420275857402,2025-04-24 22:50:41.092882,2025-04-24 22:50:50.424190,0 days 00:00:09.331308,0.05270004144050043,12,,2,19,1470,0.9848462641627473,TPESampler,COMPLETE
2379,0.2933259780391895,2025-04-24 22:50:43.357653,2025-04-24 22:50:49.396752,0 days 00:00:06.039099,0.05189888402187662,12,,2,20,999,0.9194600119344619,TPESampler,COMPLETE
2380,0.2932408082964961,2025-04-24 22:50:44.671480,2025-04-24 22:50:54.077821,0 days 00:00:09.406341,0.05743536391372256,12,,2,19,1495,0.9973524440274126,TPESampler,COMPLETE
2381,0.3142725116126551,2025-04-24 22:50:49.584962,2025-04-24 22:50:55.353031,0 days 00:00:05.768069,0.09221402681798783,12,,1,17,1034,0.7754048766952623,TPESampler,COMPLETE
2382,0.3172270968388476,2025-04-24 22:50:50.620934,2025-04-24 22:50:56.882463,0 days 00:00:06.261529,0.07093642587515113,12,,1,18,935,0.9768390455414733,TPESampler,COMPLETE
2383,0.3185016115484685,2025-04-24 22:50:54.274961,2025-04-24 22:51:03.764872,0 days 00:00:09.489911,0.06053399940411056,12,,1,20,1452,0.9873758544723023,TPESampler,COMPLETE
2384,0.3395286248976473,2025-04-24 22:50:55.555367,2025-04-24 22:51:03.957552,0 days 00:00:08.402185,0.08889046329062107,12,,1,17,1262,0.9975018505132454,TPESampler,COMPLETE
2385,0.3423065603608575,2025-04-24 22:50:57.082669,2025-04-24 22:51:01.687083,0 days 00:00:04.604414,0.09972599430031573,10,,3,17,812,0.982534777633408,TPESampler,COMPLETE
2386,0.3701395252522532,2025-04-24 22:51:01.879096,2025-04-24 22:51:04.014840,0 days 00:00:02.135744,0.011181333920707673,11,sqrt,2,17,1415,0.6222674212241532,TPESampler,COMPLETE
2387,0.32012793300525955,2025-04-24 22:51:03.951977,2025-04-24 22:51:06.385525,0 days 00:00:02.433548,0.06151469514899323,12,sqrt,3,18,1172,0.9812129937766856,TPESampler,COMPLETE
2388,0.3039379556833162,2025-04-24 22:51:04.370748,2025-04-24 22:51:12.335796,0 days 00:00:07.965048,0.06605083539014671,12,,1,20,1183,0.9472901601818742,TPESampler,COMPLETE
2389,0.3398636688968805,2025-04-24 22:51:04.417558,2025-04-24 22:51:11.201153,0 days 00:00:06.783595,0.08470783590898821,10,,1,20,1076,0.9930232135501554,TPESampler,COMPLETE
2390,0.2935526257843643,2025-04-24 22:51:06.582597,2025-04-24 22:51:13.389257,0 days 00:00:06.806660,0.07842536287553742,12,,2,17,1076,0.9183136796527316,TPESampler,COMPLETE
2391,0.3445817651704121,2025-04-24 22:51:11.401353,2025-04-24 22:51:20.616141,0 days 00:00:09.214788,0.04373500808437238,10,,4,17,1488,0.9782113543471506,TPESampler,COMPLETE
2392,0.3299609073360122,2025-04-24 22:51:12.536200,2025-04-24 22:51:18.713685,0 days 00:00:06.177485,0.08861990099666467,12,,1,17,808,0.9889800701215853,TPESampler,COMPLETE
2393,0.6747963231078892,2025-04-24 22:51:13.575847,2025-04-24 22:51:14.655760,0 days 00:00:01.079913,0.02073712701212609,3,log2,3,18,511,0.6224821585492992,TPESampler,COMPLETE
2394,0.4500826800359576,2025-04-24 22:51:14.857167,2025-04-24 22:51:16.161558,0 days 00:00:01.304391,0.099369474510831,5,log2,5,7,441,0.6597743640286252,TPESampler,COMPLETE
2395,0.40332531611861866,2025-04-24 22:51:16.374783,2025-04-24 22:51:17.694853,0 days 00:00:01.320070,0.06788544070840481,9,log2,1,18,717,0.7672607996360576,TPESampler,COMPLETE
2396,0.47126103038256856,2025-04-24 22:51:17.886601,2025-04-24 22:51:18.753958,0 days 00:00:00.867357,0.07172993582219005,7,sqrt,10,2,228,0.8127113617077573,TPESampler,COMPLETE
2397,0.3387687778897652,2025-04-24 22:51:18.853183,2025-04-24 22:51:23.120468,0 days 00:00:04.267285,0.0977424709690725,10,,3,19,665,0.9849627733180094,TPESampler,COMPLETE
2398,0.3475120614400031,2025-04-24 22:51:18.976541,2025-04-24 22:51:25.571116,0 days 00:00:06.594575,0.09978844794493494,12,,3,18,1052,0.9464875342380158,TPESampler,COMPLETE
2399,0.2967365221994276,2025-04-24 22:51:20.819504,2025-04-24 22:51:26.509213,0 days 00:00:05.689709,0.07947870301009302,11,,2,20,932,0.9487270941695661,TPESampler,COMPLETE
2400,0.31925303542135125,2025-04-24 22:51:23.310542,2025-04-24 22:51:29.820152,0 days 00:00:06.509610,0.05469599637476139,12,,1,20,931,0.9859141752176044,TPESampler,COMPLETE
2401,0.4662877955748297,2025-04-24 22:51:25.782328,2025-04-24 22:51:26.749739,0 days 00:00:00.967411,0.01646983428619438,12,sqrt,4,19,255,0.7471019791801623,TPESampler,COMPLETE
2402,0.3513442886395543,2025-04-24 22:51:26.714177,2025-04-24 22:51:32.552409,0 days 00:00:05.838232,0.09825714721995124,10,,4,19,1016,0.9908539270369047,TPESampler,COMPLETE
2403,0.344895616439042,2025-04-24 22:51:26.969925,2025-04-24 22:51:33.830600,0 days 00:00:06.860675,0.08267182081375853,12,,3,17,1136,0.9340973952429068,TPESampler,COMPLETE
2404,0.3010164070497426,2025-04-24 22:51:30.017291,2025-04-24 22:51:35.487393,0 days 00:00:05.470102,0.06703366241478315,12,,2,19,835,0.9491248421153127,TPESampler,COMPLETE
2405,0.3467620722026628,2025-04-24 22:51:32.747865,2025-04-24 22:51:38.655421,0 days 00:00:05.907556,0.08729196692392813,11,,3,20,921,0.9738551151790328,TPESampler,COMPLETE
2406,0.3022044144572946,2025-04-24 22:51:34.027339,2025-04-24 22:51:40.505209,0 days 00:00:06.477870,0.09833017466380958,12,,2,18,974,0.9589151983756461,TPESampler,COMPLETE
2407,0.3385898635833461,2025-04-24 22:51:35.681121,2025-04-24 22:51:37.460496,0 days 00:00:01.779375,0.0886305027801421,11,sqrt,2,19,993,0.9913004436890624,TPESampler,COMPLETE
2408,0.29765581426224014,2025-04-24 22:51:37.666452,2025-04-24 22:51:45.866263,0 days 00:00:08.199811,0.05736021355802967,12,,2,20,1316,0.9763542788624667,TPESampler,COMPLETE
2409,0.2883434418191401,2025-04-24 22:51:38.860793,2025-04-24 22:51:46.761557,0 days 00:00:07.900764,0.08457079743550774,11,,2,18,1301,0.9943681119946702,TPESampler,COMPLETE
2410,0.33502277333976094,2025-04-24 22:51:40.699533,2025-04-24 22:51:47.003304,0 days 00:00:06.303771,0.058216280124566935,12,,3,16,1114,0.8974623982988194,TPESampler,COMPLETE
2411,0.30272744093287185,2025-04-24 22:51:46.067561,2025-04-24 22:51:53.085015,0 days 00:00:07.017454,0.09975003307800377,12,,2,15,1011,0.9889980081074581,TPESampler,COMPLETE
2412,0.3220343475589721,2025-04-24 22:51:46.974533,2025-04-24 22:51:53.083903,0 days 00:00:06.109370,0.08939508705210736,11,,1,16,1033,0.8836188184080042,TPESampler,COMPLETE
2413,0.39932957072100916,2025-04-24 22:51:47.189286,2025-04-24 22:51:48.851974,0 days 00:00:01.662688,0.06659143159896401,10,log2,6,14,1172,0.998049256542919,TPESampler,COMPLETE
2414,0.33851156803791077,2025-04-24 22:51:49.060536,2025-04-24 22:51:55.103562,0 days 00:00:06.043026,0.07412746920348905,7,,1,17,1316,0.937681133943917,TPESampler,COMPLETE
2415,0.3447087890706374,2025-04-24 22:51:53.313616,2025-04-24 22:52:00.681774,0 days 00:00:07.368158,0.06589950172822566,10,,1,17,1169,0.9802592160919812,TPESampler,COMPLETE
2416,0.556029374571915,2025-04-24 22:51:53.369528,2025-04-24 22:51:54.844026,0 days 00:00:01.474498,0.010092753031055642,5,sqrt,6,3,513,0.8968608072432698,TPESampler,COMPLETE
2417,0.3227626199430543,2025-04-24 22:51:55.035764,2025-04-24 22:52:03.319548,0 days 00:00:08.283784,0.07335665087505656,12,,1,20,1203,0.9985563097753727,TPESampler,COMPLETE
2418,0.39467520078286455,2025-04-24 22:51:55.426914,2025-04-24 22:51:57.165318,0 days 00:00:01.738404,0.08108761585476848,3,sqrt,1,6,1228,0.6771593905551969,TPESampler,COMPLETE
2419,0.29300846844824985,2025-04-24 22:51:57.365996,2025-04-24 22:52:04.035192,0 days 00:00:06.669196,0.06933451072955088,10,,2,20,1097,0.9969154405087313,TPESampler,COMPLETE
2420,0.3678877315141859,2025-04-24 22:52:00.886553,2025-04-24 22:52:02.895723,0 days 00:00:02.009170,0.019710100600526227,8,,3,7,315,0.998241366232472,TPESampler,COMPLETE
2421,0.38834374645710606,2025-04-24 22:52:03.095028,2025-04-24 22:52:04.494767,0 days 00:00:01.399739,0.025284889387971844,10,sqrt,4,4,403,0.6829267411001045,TPESampler,COMPLETE
2422,0.36219196769807893,2025-04-24 22:52:03.600779,2025-04-24 22:52:10.097058,0 days 00:00:06.496279,0.0913641064405373,9,,3,16,1162,0.9976253402757074,TPESampler,COMPLETE
2423,0.2909177687869962,2025-04-24 22:52:04.281096,2025-04-24 22:52:13.647155,0 days 00:00:09.366059,0.05036666744373019,12,,2,20,1448,0.9997743437940151,TPESampler,COMPLETE
2424,0.35400058537314105,2025-04-24 22:52:04.781855,2025-04-24 22:52:11.702521,0 days 00:00:06.920666,0.0896659656585906,11,,3,17,1165,0.9926428897774291,TPESampler,COMPLETE
2425,0.3449130740060758,2025-04-24 22:52:10.441228,2025-04-24 22:52:18.774753,0 days 00:00:08.333525,0.07604163443765169,12,,3,20,1341,0.9859510567142511,TPESampler,COMPLETE
2426,0.3901015987789446,2025-04-24 22:52:11.901447,2025-04-24 22:52:19.975707,0 days 00:00:08.074260,0.07269756305169642,12,,5,20,1499,0.9194912986373216,TPESampler,COMPLETE
2427,0.3514680303089974,2025-04-24 22:52:13.843468,2025-04-24 22:52:21.084678,0 days 00:00:07.241210,0.08291887142464685,10,,4,18,1300,0.9865503254460356,TPESampler,COMPLETE
2428,0.33598493852971617,2025-04-24 22:52:18.969595,2025-04-24 22:52:27.231364,0 days 00:00:08.261769,0.07088755837086856,9,,1,19,1416,0.9979094211457403,TPESampler,COMPLETE
2429,0.6141443706061989,2025-04-24 22:52:20.187077,2025-04-24 22:52:21.111293,0 days 00:00:00.924216,0.011621236293723792,11,sqrt,5,5,225,0.7337568736399531,TPESampler,COMPLETE
2430,0.3435812484026375,2025-04-24 22:52:21.236327,2025-04-24 22:52:27.768128,0 days 00:00:06.531801,0.0890268610546958,10,,1,16,1005,0.987003953517738,TPESampler,COMPLETE
2431,0.43635976688853234,2025-04-24 22:52:21.282685,2025-04-24 22:52:23.557887,0 days 00:00:02.275202,0.02615732048760536,5,sqrt,8,13,1426,0.840695645239556,TPESampler,COMPLETE
2432,0.3532744430760465,2025-04-24 22:52:23.768639,2025-04-24 22:52:28.639637,0 days 00:00:04.870998,0.06841891140546376,5,,4,5,1283,0.9225688748254168,TPESampler,COMPLETE
2433,0.34050850082598505,2025-04-24 22:52:27.438110,2025-04-24 22:52:31.626815,0 days 00:00:04.188705,0.09015701469734709,10,,4,20,760,0.8327749969469328,TPESampler,COMPLETE
2434,0.33190427780951437,2025-04-24 22:52:28.027773,2025-04-24 22:52:37.194762,0 days 00:00:09.166989,0.07244634212829258,11,,1,17,1387,0.9995169561477922,TPESampler,COMPLETE
2435,0.3498602464390863,2025-04-24 22:52:28.860435,2025-04-24 22:52:36.456111,0 days 00:00:07.595676,0.07218072422476082,12,,3,18,1231,0.9776287063501644,TPESampler,COMPLETE
2436,0.5693452951540863,2025-04-24 22:52:31.829311,2025-04-24 22:52:32.817967,0 days 00:00:00.988656,0.011823309663728482,5,sqrt,3,17,336,0.9457993259516575,TPESampler,COMPLETE
2437,0.3666251732881862,2025-04-24 22:52:33.019068,2025-04-24 22:52:41.572520,0 days 00:00:08.553452,0.0636142997815725,11,,4,16,1467,0.9999317031684328,TPESampler,COMPLETE
2438,0.33188985039963714,2025-04-24 22:52:36.663777,2025-04-24 22:52:42.483190,0 days 00:00:05.819413,0.08304547181844882,12,,3,20,911,0.9530986579233537,TPESampler,COMPLETE
2439,0.3653150672342571,2025-04-24 22:52:37.427292,2025-04-24 22:52:43.508257,0 days 00:00:06.080965,0.039626123803388306,9,,5,20,1166,0.9639940295715171,TPESampler,COMPLETE
2440,0.3036987398512484,2025-04-24 22:52:41.943328,2025-04-24 22:52:49.783158,0 days 00:00:07.839830,0.0731053749260229,10,,2,20,1258,0.928761393685008,TPESampler,COMPLETE
2441,0.38185548887645876,2025-04-24 22:52:42.796433,2025-04-24 22:52:47.664804,0 days 00:00:04.868371,0.035998702015283414,5,,6,10,1269,0.7996416930247909,TPESampler,COMPLETE
2442,0.37351365665486724,2025-04-24 22:52:43.846655,2025-04-24 22:52:46.096481,0 days 00:00:02.249826,0.016059151379209446,11,sqrt,2,8,975,0.6032071019845529,TPESampler,COMPLETE
2443,0.4687083266814028,2025-04-24 22:52:46.339744,2025-04-24 22:52:48.456924,0 days 00:00:02.117180,0.03718850904045123,5,sqrt,10,17,819,0.7385573851553712,TPESampler,COMPLETE
2444,0.4635296854697235,2025-04-24 22:52:48.198534,2025-04-24 22:52:49.804099,0 days 00:00:01.605565,0.09313838234538603,8,sqrt,9,3,411,0.6605746490782847,TPESampler,COMPLETE
2445,0.396979728079453,2025-04-24 22:52:48.885857,2025-04-24 22:52:56.401498,0 days 00:00:07.515641,0.09445271469163638,11,,5,18,1222,0.9942767354926133,TPESampler,COMPLETE
2446,0.3520970324872357,2025-04-24 22:52:49.955721,2025-04-24 22:52:52.672411,0 days 00:00:02.716690,0.0804097098289578,12,sqrt,1,19,1110,0.9676777838345405,TPESampler,COMPLETE
2447,0.2881654781337205,2025-04-24 22:52:49.998102,2025-04-24 22:52:59.323167,0 days 00:00:09.325065,0.09761308682608817,11,,2,19,1328,0.9969018945317576,TPESampler,COMPLETE
2448,0.3108456437033118,2025-04-24 22:52:52.966020,2025-04-24 22:53:00.464295,0 days 00:00:07.498275,0.09965997247531093,9,,2,20,1348,0.9008319724040648,TPESampler,COMPLETE
2449,0.3835680489165634,2025-04-24 22:52:56.608591,2025-04-24 22:52:58.262788,0 days 00:00:01.654197,0.06777164071261908,12,sqrt,5,20,768,0.9725916669067443,TPESampler,COMPLETE
2450,0.3453584067286771,2025-04-24 22:52:58.457553,2025-04-24 22:53:06.998354,0 days 00:00:08.540801,0.07065628191385367,11,,3,17,1318,0.9793043929962143,TPESampler,COMPLETE
2451,0.3127129555106035,2025-04-24 22:52:59.539778,2025-04-24 22:53:04.403312,0 days 00:00:04.863534,0.0879231390208432,12,,2,20,842,0.7750662989747551,TPESampler,COMPLETE
2452,0.38757655951405406,2025-04-24 22:53:00.786680,2025-04-24 22:53:02.987913,0 days 00:00:02.201233,0.02254373473280424,6,,2,12,328,0.7587388458544981,TPESampler,COMPLETE
2453,0.8159334374554311,2025-04-24 22:53:03.202237,2025-04-24 22:53:03.982261,0 days 00:00:00.780024,0.059376039050453806,4,log2,9,20,106,0.9961998447370755,TPESampler,COMPLETE
2454,0.4026041351455093,2025-04-24 22:53:04.186897,2025-04-24 22:53:05.920513,0 days 00:00:01.733616,0.023153980650995505,3,sqrt,3,16,968,0.7011182589102501,TPESampler,COMPLETE
2455,0.3457434282213422,2025-04-24 22:53:04.688567,2025-04-24 22:53:12.347220,0 days 00:00:07.658653,0.09807856738167822,9,,1,16,1297,0.9957911794511082,TPESampler,COMPLETE
2456,0.3223537168735361,2025-04-24 22:53:06.121767,2025-04-24 22:53:14.442943,0 days 00:00:08.321176,0.09896971974951495,11,,1,19,1316,0.9747087966798038,TPESampler,COMPLETE
2457,0.4142594753407691,2025-04-24 22:53:07.452795,2025-04-24 22:53:09.158240,0 days 00:00:01.705445,0.027937361193083605,9,log2,1,16,1033,0.7157590154739488,TPESampler,COMPLETE
2458,0.35297354812176884,2025-04-24 22:53:09.370235,2025-04-24 22:53:17.268863,0 days 00:00:07.898628,0.09140343265188487,12,,4,17,1274,0.9726662236806853,TPESampler,COMPLETE
2459,0.3381499548735164,2025-04-24 22:53:12.547116,2025-04-24 22:53:14.412497,0 days 00:00:01.865381,0.06840259098891212,12,log2,3,19,1386,0.9928468875431614,TPESampler,COMPLETE
2460,0.3097043902262289,2025-04-24 22:53:14.584590,2025-04-24 22:53:22.917761,0 days 00:00:08.333171,0.09007039842345396,10,,2,16,1351,0.9887275352027559,TPESampler,COMPLETE
2461,0.31028627452916124,2025-04-24 22:53:14.630798,2025-04-24 22:53:21.450517,0 days 00:00:06.819719,0.08351127103732346,9,,2,20,1155,0.9900131215145748,TPESampler,COMPLETE
2462,0.36855063680473343,2025-04-24 22:53:17.481159,2025-04-24 22:53:19.800714,0 days 00:00:02.319555,0.09727361658845844,11,log2,1,20,1377,0.9512197925716673,TPESampler,COMPLETE
2463,0.353356873888258,2025-04-24 22:53:20.000554,2025-04-24 22:53:27.421981,0 days 00:00:07.421427,0.07395287686402396,10,,4,17,1345,0.9811755718860281,TPESampler,COMPLETE
2464,0.34515530103009795,2025-04-24 22:53:21.654286,2025-04-24 22:53:30.615855,0 days 00:00:08.961569,0.07415879495234885,11,,3,19,1463,0.9940667921184082,TPESampler,COMPLETE
2465,0.3541155571652701,2025-04-24 22:53:23.123828,2025-04-24 22:53:29.763039,0 days 00:00:06.639211,0.09506298387684317,11,,4,20,1164,0.9472063973870917,TPESampler,COMPLETE
2466,0.6192436191234215,2025-04-24 22:53:27.626491,2025-04-24 22:53:28.697091,0 days 00:00:01.070600,0.061095307433083924,7,log2,7,19,352,0.7743669487775197,TPESampler,COMPLETE
2467,0.27980791868721744,2025-04-24 22:53:28.990900,2025-04-24 22:53:37.278574,0 days 00:00:08.287674,0.08529471894917957,12,,2,19,1288,0.9862691678614768,TPESampler,COMPLETE
2468,0.33044681171805357,2025-04-24 22:53:29.963630,2025-04-24 22:53:36.874387,0 days 00:00:06.910757,0.09983781420683598,10,,1,20,1252,0.9445835917792882,TPESampler,COMPLETE
2469,0.32146723743217775,2025-04-24 22:53:30.840478,2025-04-24 22:53:37.225578,0 days 00:00:06.385100,0.046313261982691735,9,,2,20,1216,0.9981567411433808,TPESampler,COMPLETE
2470,0.2853357438302943,2025-04-24 22:53:37.085968,2025-04-24 22:53:46.194408,0 days 00:00:09.108440,0.08487990518100683,12,,2,20,1372,0.9862540644344769,TPESampler,COMPLETE
2471,0.35009958685849624,2025-04-24 22:53:37.481321,2025-04-24 22:53:38.746146,0 days 00:00:01.264825,0.0970576778759191,11,sqrt,4,2,169,0.9934733631359642,TPESampler,COMPLETE
2472,0.29731438430354024,2025-04-24 22:53:37.548933,2025-04-24 22:53:45.950468,0 days 00:00:08.401535,0.05614374281859142,11,,2,16,1419,0.9063986060067537,TPESampler,COMPLETE
2473,0.3561910889233332,2025-04-24 22:53:38.955744,2025-04-24 22:53:41.040181,0 days 00:00:02.084437,0.06101830502704173,10,sqrt,1,19,1164,0.9950001227440722,TPESampler,COMPLETE
2474,0.34119682960171616,2025-04-24 22:53:41.251762,2025-04-24 22:53:50.443830,0 days 00:00:09.192068,0.09250943518364434,11,,1,20,1456,0.9964940001696736,TPESampler,COMPLETE
2475,0.2965281220449695,2025-04-24 22:53:46.152432,2025-04-24 22:53:54.683164,0 days 00:00:08.530732,0.06704531394630511,10,,2,20,1488,0.9919165601942186,TPESampler,COMPLETE
2476,0.38322554121947283,2025-04-24 22:53:46.532821,2025-04-24 22:53:48.395647,0 days 00:00:01.862826,0.06845756641227975,4,sqrt,5,8,1317,0.9530842101516425,TPESampler,COMPLETE
2477,0.3574226290540113,2025-04-24 22:53:48.599871,2025-04-24 22:53:55.754051,0 days 00:00:07.154180,0.09916566812161659,10,,4,17,1293,0.9810548170253813,TPESampler,COMPLETE
2478,0.3488415246797306,2025-04-24 22:53:50.653817,2025-04-24 22:53:57.185309,0 days 00:00:06.531492,0.09898319908244638,11,,3,17,1196,0.8965122629046833,TPESampler,COMPLETE
2479,0.3352699708240154,2025-04-24 22:53:54.883645,2025-04-24 22:54:02.798982,0 days 00:00:07.915337,0.07153838287315607,11,,3,20,1421,0.9366490107028111,TPESampler,COMPLETE
2480,0.34382848208652594,2025-04-24 22:53:55.948649,2025-04-24 22:54:02.881527,0 days 00:00:06.932878,0.09637304835168552,11,,3,19,1190,0.988317790420809,TPESampler,COMPLETE
2481,0.376107571500887,2025-04-24 22:53:57.382319,2025-04-24 22:54:06.377348,0 days 00:00:08.995029,0.0995799079730998,12,,4,18,1494,0.9669494048084485,TPESampler,COMPLETE
2482,0.3630762685522952,2025-04-24 22:54:02.978628,2025-04-24 22:54:11.351602,0 days 00:00:08.372974,0.09802001615028502,12,,4,20,1392,0.9476549568806137,TPESampler,COMPLETE
2483,0.9053378481755491,2025-04-24 22:54:03.106488,2025-04-24 22:54:04.138323,0 days 00:00:01.031835,0.02713138641487005,12,log2,5,20,115,0.6015832603241619,TPESampler,COMPLETE
2484,0.6154197354713239,2025-04-24 22:54:04.339206,2025-04-24 22:54:05.272773,0 days 00:00:00.933567,0.05942641865226553,3,log2,1,16,245,0.8268423736701374,TPESampler,COMPLETE
2485,0.34686217077394405,2025-04-24 22:54:05.472114,2025-04-24 22:54:12.723629,0 days 00:00:07.251515,0.09635353221161767,10,,3,19,1323,0.9579323955105445,TPESampler,COMPLETE
