number,value,datetime_start,datetime_complete,duration,params_learning_rate,params_max_depth,params_max_features,params_min_samples_leaf,params_min_samples_split,params_n_estimators,params_subsample,system_attrs_auto:sampler,state
1742,0.38381141329725144,2025-04-24 22:30:09.454029,2025-04-24 22:30:11.970820,0 days 00:00:02.516791,0.04060165015427284,10,sqrt,5,20,1460,0.7324366099620437,TPESampler,COMPLETE
1743,0.34969391632668306,2025-04-24 22:30:10.569089,2025-04-24 22:30:13.105044,0 days 00:00:02.535955,0.08665702247944622,12,sqrt,1,15,1273,0.8531888488018666,TPESampler,COMPLETE
1744,0.45700114815662674,2025-04-24 22:30:12.181918,2025-04-24 22:30:13.106095,0 days 00:00:00.924177,0.06171176826538433,3,,4,12,100,0.859098139577551,TPESampler,COMPLETE
1745,0.4010297797159195,2025-04-24 22:30:13.268204,2025-04-24 22:30:21.853716,0 days 00:00:08.585512,0.056555119763619356,12,,5,13,1433,0.9982503454809799,TPESampler,COMPLETE
1746,0.2992885259146747,2025-04-24 22:30:13.314051,2025-04-24 22:30:20.378557,0 days 00:00:07.064506,0.04171125210613818,12,,2,15,1192,0.8837415913312433,TPESampler,COMPLETE
1747,0.3095535983233377,2025-04-24 22:30:14.985390,2025-04-24 22:30:23.822926,0 days 00:00:08.837536,0.054521342955282395,12,,2,14,1356,0.983754092361723,TPESampler,COMPLETE
1748,0.6303921548873868,2025-04-24 22:30:20.576448,2025-04-24 22:30:21.854933,0 days 00:00:01.278485,0.022030301712460617,9,log2,7,20,807,0.7348590524100082,TPESampler,COMPLETE
1749,0.2989352752669686,2025-04-24 22:30:22.028691,2025-04-24 22:30:31.576741,0 days 00:00:09.548050,0.0804900045933448,12,,2,15,1426,0.9997056295968983,TPESampler,COMPLETE
1750,0.3861832021875141,2025-04-24 22:30:22.074970,2025-04-24 22:30:23.961128,0 days 00:00:01.886158,0.09294319214194459,7,log2,4,20,795,0.7108455666259782,TPESampler,COMPLETE
1751,0.291574088408418,2025-04-24 22:30:24.017394,2025-04-24 22:30:32.349652,0 days 00:00:08.332258,0.0823037528062415,12,,2,18,1418,0.9435841859954228,TPESampler,COMPLETE
1752,0.29825054346267255,2025-04-24 22:30:24.183577,2025-04-24 22:30:33.306505,0 days 00:00:09.122928,0.07497440893330101,11,,2,9,1490,0.9977454023566259,TPESampler,COMPLETE
1753,0.46700141686624097,2025-04-24 22:30:31.780478,2025-04-24 22:30:33.045302,0 days 00:00:01.264824,0.07883189235612836,9,log2,6,10,408,0.887836569609504,TPESampler,COMPLETE
1754,0.34970667217994755,2025-04-24 22:30:32.563865,2025-04-24 22:30:40.127790,0 days 00:00:07.563925,0.07164045000825195,11,,4,20,1364,0.9547193818698899,TPESampler,COMPLETE
1755,0.30376323187500287,2025-04-24 22:30:33.265550,2025-04-24 22:30:41.427527,0 days 00:00:08.161977,0.09397435372172636,11,,2,18,1481,0.9290326945078872,TPESampler,COMPLETE
1756,0.2930911371119638,2025-04-24 22:30:33.522296,2025-04-24 22:30:41.351530,0 days 00:00:07.829234,0.09691294197932876,12,,2,15,1328,0.9301116662451426,TPESampler,COMPLETE
1757,0.30017557207699774,2025-04-24 22:30:40.345581,2025-04-24 22:30:46.810743,0 days 00:00:06.465162,0.08076442271884954,10,,2,17,1207,0.9054335474895943,TPESampler,COMPLETE
1758,0.31976863594394506,2025-04-24 22:30:41.517915,2025-04-24 22:30:49.700927,0 days 00:00:08.183012,0.071325238378161,12,,1,18,1345,0.9129574166544169,TPESampler,COMPLETE
1759,0.2972804924746887,2025-04-24 22:30:41.639530,2025-04-24 22:30:49.460115,0 days 00:00:07.820585,0.07112101775300378,11,,2,20,1326,0.9550777109231342,TPESampler,COMPLETE
1760,0.3235292857988125,2025-04-24 22:30:47.059287,2025-04-24 22:30:53.565851,0 days 00:00:06.506564,0.07354534111063925,11,,1,18,1015,0.9025300902263854,TPESampler,COMPLETE
1761,0.41613668940316406,2025-04-24 22:30:49.659057,2025-04-24 22:30:51.192436,0 days 00:00:01.533379,0.047795959134426094,7,,7,12,222,0.9727358885154818,TPESampler,COMPLETE
1762,0.3416996366183748,2025-04-24 22:30:49.998539,2025-04-24 22:30:57.634996,0 days 00:00:07.636457,0.09741698164465024,10,,1,16,1363,0.9588252486005915,TPESampler,COMPLETE
1763,0.35488576774932584,2025-04-24 22:30:51.402758,2025-04-24 22:30:58.279069,0 days 00:00:06.876311,0.09775323949854042,11,,3,14,1243,0.9240814184586105,TPESampler,COMPLETE
1764,0.2903832180005225,2025-04-24 22:30:53.775749,2025-04-24 22:31:00.496240,0 days 00:00:06.720491,0.07156901575016779,12,,2,20,1155,0.8922527038540279,TPESampler,COMPLETE
1765,0.35727599970097895,2025-04-24 22:30:57.839493,2025-04-24 22:31:05.619622,0 days 00:00:07.780129,0.07553116705892755,11,,3,16,1466,0.9165663127049981,TPESampler,COMPLETE
1766,0.3299447902151162,2025-04-24 22:30:58.465692,2025-04-24 22:31:06.610059,0 days 00:00:08.144367,0.09558342890404342,11,,1,19,1498,0.8814777490555603,TPESampler,COMPLETE
1767,0.34465405878484445,2025-04-24 22:31:00.706943,2025-04-24 22:31:08.525755,0 days 00:00:07.818812,0.09798928377072232,10,,3,20,1456,0.9569303539081888,TPESampler,COMPLETE
1768,0.34449625855162025,2025-04-24 22:31:05.813923,2025-04-24 22:31:11.195619,0 days 00:00:05.381696,0.07433091892344107,12,,3,16,885,0.8534826215533077,TPESampler,COMPLETE
1769,0.8151621196341949,2025-04-24 22:31:06.918511,2025-04-24 22:31:07.798924,0 days 00:00:00.880413,0.039755412091185154,8,log2,10,11,170,0.8356017434857992,TPESampler,COMPLETE
1770,0.3313915169954052,2025-04-24 22:31:08.010481,2025-04-24 22:31:15.597349,0 days 00:00:07.586868,0.07442939381548333,12,,1,20,1332,0.7924474807186428,TPESampler,COMPLETE
1771,0.3397228786701281,2025-04-24 22:31:08.729454,2025-04-24 22:31:15.439434,0 days 00:00:06.709980,0.08210597201602673,10,,4,20,1322,0.8631802584730158,TPESampler,COMPLETE
1772,0.4751070035938382,2025-04-24 22:31:11.414659,2025-04-24 22:31:13.064769,0 days 00:00:01.650110,0.052577796690400774,7,sqrt,10,2,1098,0.6687913866665217,TPESampler,COMPLETE
1773,0.29275162234116775,2025-04-24 22:31:13.264985,2025-04-24 22:31:20.966836,0 days 00:00:07.701851,0.053334206767712236,11,,2,19,1377,0.8985523181587903,TPESampler,COMPLETE
1774,0.34544912957808244,2025-04-24 22:31:15.642752,2025-04-24 22:31:21.794148,0 days 00:00:06.151396,0.09162634544009604,11,,1,18,1094,0.852454919461896,TPESampler,COMPLETE
1775,0.3609914419150657,2025-04-24 22:31:15.805282,2025-04-24 22:31:17.476040,0 days 00:00:01.670758,0.09463639129960895,9,sqrt,1,11,654,0.6656462028738431,TPESampler,COMPLETE
1776,0.3137354694532313,2025-04-24 22:31:17.664359,2025-04-24 22:31:25.437802,0 days 00:00:07.773443,0.09182623616099383,12,,1,20,1242,0.9469993520499772,TPESampler,COMPLETE
1777,0.3154604811232129,2025-04-24 22:31:21.167354,2025-04-24 22:31:27.655783,0 days 00:00:06.488429,0.09849504178739533,10,,2,16,1245,0.8321213148034057,TPESampler,COMPLETE
1778,0.3010124084805766,2025-04-24 22:31:21.995715,2025-04-24 22:31:29.267347,0 days 00:00:07.271632,0.06494411098548925,10,,2,18,1361,0.8829918144178381,TPESampler,COMPLETE
1779,0.36883881609627117,2025-04-24 22:31:25.638138,2025-04-24 22:31:27.665914,0 days 00:00:02.027776,0.051291784542912104,12,log2,2,19,1483,0.9441464529992644,TPESampler,COMPLETE
1780,0.33955854984702394,2025-04-24 22:31:27.805002,2025-04-24 22:31:34.264517,0 days 00:00:06.459515,0.07325647329880818,11,,4,19,1013,0.9123904174652394,TPESampler,COMPLETE
1781,0.3134412962595436,2025-04-24 22:31:27.846146,2025-04-24 22:31:30.694102,0 days 00:00:02.847956,0.04926903135329511,11,sqrt,3,19,1410,0.9516238853875623,TPESampler,COMPLETE
1782,0.3919398896711814,2025-04-24 22:31:29.474429,2025-04-24 22:31:31.107677,0 days 00:00:01.633248,0.06473588575517313,7,log2,2,8,766,0.624411705852421,TPESampler,COMPLETE
1783,0.5333508664447748,2025-04-24 22:31:30.896100,2025-04-24 22:31:32.783728,0 days 00:00:01.887628,0.02455981229594361,12,log2,8,14,1331,0.7082553632181361,TPESampler,COMPLETE
1784,0.3173854740291089,2025-04-24 22:31:31.355576,2025-04-24 22:31:37.287739,0 days 00:00:05.932163,0.05165683008829813,9,,2,19,1209,0.838253186082601,TPESampler,COMPLETE
1785,0.3075047354209556,2025-04-24 22:31:32.988975,2025-04-24 22:31:39.006252,0 days 00:00:06.017277,0.0709243914608564,9,,2,20,1312,0.7999213258115738,TPESampler,COMPLETE
1786,0.3019843192238873,2025-04-24 22:31:34.489983,2025-04-24 22:31:40.876641,0 days 00:00:06.386658,0.05633004053724147,11,,2,20,1173,0.8592554139439941,TPESampler,COMPLETE
1787,0.3328296835968945,2025-04-24 22:31:37.498956,2025-04-24 22:31:44.145376,0 days 00:00:06.646420,0.04966919310292353,10,,3,19,1300,0.8882164097256792,TPESampler,COMPLETE
1788,0.3218870522062807,2025-04-24 22:31:39.198517,2025-04-24 22:31:45.803420,0 days 00:00:06.604903,0.0805338874350203,12,,2,16,1175,0.8477481812591441,TPESampler,COMPLETE
1789,0.2978526684636859,2025-04-24 22:31:41.087292,2025-04-24 22:31:48.247297,0 days 00:00:07.160005,0.09291181875020717,12,,2,20,1256,0.891028307808472,TPESampler,COMPLETE
1790,0.3442082642651331,2025-04-24 22:31:44.388869,2025-04-24 22:31:50.938776,0 days 00:00:06.549907,0.07414909134743985,11,,3,16,1133,0.9199657762047495,TPESampler,COMPLETE
1791,0.3295480454448008,2025-04-24 22:31:45.998159,2025-04-24 22:31:50.236182,0 days 00:00:04.238023,0.054691270844914375,11,,4,20,785,0.853481425333717,TPESampler,COMPLETE
1792,0.37322105432708275,2025-04-24 22:31:48.441728,2025-04-24 22:31:56.142208,0 days 00:00:07.700480,0.09769853544363205,12,,3,12,1224,0.9990848004921083,TPESampler,COMPLETE
1793,0.32035145135265125,2025-04-24 22:31:50.455803,2025-04-24 22:31:56.545988,0 days 00:00:06.090185,0.07378524192052172,12,,1,17,977,0.9056333501586541,TPESampler,COMPLETE
1794,0.31939435375223485,2025-04-24 22:31:51.174850,2025-04-24 22:31:58.207108,0 days 00:00:07.032258,0.059351421191308276,11,,2,17,1368,0.8245926436696165,TPESampler,COMPLETE
1795,0.2944955041339136,2025-04-24 22:31:56.338539,2025-04-24 22:32:05.254632,0 days 00:00:08.916093,0.08251248822041321,12,,2,19,1427,0.9758243323473393,TPESampler,COMPLETE
1796,0.29747316958362396,2025-04-24 22:31:56.780277,2025-04-24 22:32:03.968766,0 days 00:00:07.188489,0.04665814842196696,11,,2,19,1287,0.9276424619893868,TPESampler,COMPLETE
1797,0.30483965925905376,2025-04-24 22:31:58.414210,2025-04-24 22:32:04.034027,0 days 00:00:05.619817,0.07657295731954385,12,,1,20,956,0.8942469278695417,TPESampler,COMPLETE
1798,0.32608649923473676,2025-04-24 22:32:04.122875,2025-04-24 22:32:11.518921,0 days 00:00:07.396046,0.04641270414188076,11,,1,20,1327,0.8524827543115105,TPESampler,COMPLETE
1799,0.37212225315683284,2025-04-24 22:32:04.246026,2025-04-24 22:32:10.634780,0 days 00:00:06.388754,0.0723052748306342,12,,5,17,1220,0.8607366776393505,TPESampler,COMPLETE
1800,0.3273513525765525,2025-04-24 22:32:05.449084,2025-04-24 22:32:14.256118,0 days 00:00:08.807034,0.08998371563574606,12,,1,19,1490,0.9055107293781364,TPESampler,COMPLETE
1801,0.3640412225040928,2025-04-24 22:32:10.959578,2025-04-24 22:32:15.112202,0 days 00:00:04.152624,0.023829566869409246,11,,5,17,913,0.6437821856407312,TPESampler,COMPLETE
1802,0.3142326056010799,2025-04-24 22:32:11.828824,2025-04-24 22:32:19.159766,0 days 00:00:07.330942,0.05724971353718339,11,,1,18,1277,0.9018944548482108,TPESampler,COMPLETE
1803,0.3422567092839956,2025-04-24 22:32:14.485382,2025-04-24 22:32:20.275600,0 days 00:00:05.790218,0.08023207475483739,11,,3,20,1063,0.8680652324284294,TPESampler,COMPLETE
1804,0.33026491528474705,2025-04-24 22:32:15.453785,2025-04-24 22:32:22.727768,0 days 00:00:07.273983,0.0602732398817671,12,,1,13,1200,0.882919574164215,TPESampler,COMPLETE
1805,0.3333815303724314,2025-04-24 22:32:19.357356,2025-04-24 22:32:26.674037,0 days 00:00:07.316681,0.03305838085425848,12,,3,20,1247,0.9106944127330824,TPESampler,COMPLETE
1806,0.364521687139892,2025-04-24 22:32:20.487946,2025-04-24 22:32:22.023674,0 days 00:00:01.535728,0.06804409860697187,12,log2,2,17,976,0.9924839844385022,TPESampler,COMPLETE
1807,0.2970283871451265,2025-04-24 22:32:22.226670,2025-04-24 22:32:29.360916,0 days 00:00:07.134246,0.05788455046413637,10,,2,19,1320,0.9035769381003997,TPESampler,COMPLETE
1808,0.3554308594762713,2025-04-24 22:32:22.967897,2025-04-24 22:32:28.768414,0 days 00:00:05.800517,0.09736016628778141,11,,3,16,1063,0.9067814359999297,TPESampler,COMPLETE
1809,0.32698849370857164,2025-04-24 22:32:26.866046,2025-04-24 22:32:34.284485,0 days 00:00:07.418439,0.04377472332341284,11,,3,20,1266,0.9317421152369565,TPESampler,COMPLETE
1810,0.3257053007610231,2025-04-24 22:32:28.959399,2025-04-24 22:32:31.098315,0 days 00:00:02.138916,0.06716594511628542,11,sqrt,3,17,1163,0.893715299958636,TPESampler,COMPLETE
1811,0.34481651493715965,2025-04-24 22:32:29.603894,2025-04-24 22:32:36.400616,0 days 00:00:06.796722,0.07329603296606063,12,,3,20,1032,0.9952098952054688,TPESampler,COMPLETE
1812,0.3503123948933127,2025-04-24 22:32:31.291102,2025-04-24 22:32:33.365064,0 days 00:00:02.073962,0.06769178981203128,6,,2,6,394,0.9965320482047842,TPESampler,COMPLETE
1813,0.34501645485696303,2025-04-24 22:32:33.576182,2025-04-24 22:32:40.888068,0 days 00:00:07.311886,0.0811643932497928,12,,4,19,1340,0.8097376877512241,TPESampler,COMPLETE
1814,0.3173611622714466,2025-04-24 22:32:34.486948,2025-04-24 22:32:42.028675,0 days 00:00:07.541727,0.0774042275662768,10,,1,20,1296,0.8796795230189569,TPESampler,COMPLETE
1815,0.6269531911752461,2025-04-24 22:32:36.602044,2025-04-24 22:32:37.930495,0 days 00:00:01.328451,0.026641378088294945,4,log2,10,14,838,0.9543448041471903,TPESampler,COMPLETE
1816,0.3608969766776596,2025-04-24 22:32:38.133912,2025-04-24 22:32:40.120556,0 days 00:00:01.986644,0.06470263759573511,12,log2,2,15,1418,0.8416251855293782,TPESampler,COMPLETE
1817,0.3940489843414815,2025-04-24 22:32:40.312490,2025-04-24 22:32:42.088409,0 days 00:00:01.775919,0.01974779210744515,9,sqrt,5,18,773,0.6829699532035226,TPESampler,COMPLETE
1818,0.34000837657368804,2025-04-24 22:32:41.095129,2025-04-24 22:32:49.054560,0 days 00:00:07.959431,0.09325370809456165,11,,1,15,1380,0.9192587520623489,TPESampler,COMPLETE
1819,0.2900051089519998,2025-04-24 22:32:42.309774,2025-04-24 22:32:48.993407,0 days 00:00:06.683633,0.06290228263670702,12,,2,20,984,0.9174441564120597,TPESampler,COMPLETE
1820,0.2909683830210899,2025-04-24 22:32:42.359187,2025-04-24 22:32:50.987403,0 days 00:00:08.628216,0.056250122744017785,12,,2,20,1245,0.9066318628420434,TPESampler,COMPLETE
1821,0.4913227640605251,2025-04-24 22:32:49.271094,2025-04-24 22:32:51.595180,0 days 00:00:02.324086,0.010976137469487115,4,sqrt,9,17,1381,0.7095611452472042,TPESampler,COMPLETE
1822,0.30656460473175023,2025-04-24 22:32:49.321853,2025-04-24 22:32:54.670447,0 days 00:00:05.348594,0.06669072632814815,10,,2,19,818,0.8837396417400645,TPESampler,COMPLETE
1823,0.3277820997746858,2025-04-24 22:32:51.324662,2025-04-24 22:32:57.286257,0 days 00:00:05.961595,0.04404935427093749,11,,1,19,974,0.8912862469230102,TPESampler,COMPLETE
1824,0.33565088586153957,2025-04-24 22:32:51.843554,2025-04-24 22:32:58.467692,0 days 00:00:06.624138,0.048929136440490364,10,,3,20,1089,0.9392632103631953,TPESampler,COMPLETE
1825,0.29816639124763245,2025-04-24 22:32:54.874772,2025-04-24 22:33:03.324104,0 days 00:00:08.449332,0.042731171983612065,11,,2,19,1424,0.9656231100093332,TPESampler,COMPLETE
1826,0.4745892532002882,2025-04-24 22:32:57.483460,2025-04-24 22:32:58.316350,0 days 00:00:00.832890,0.025436701455658947,10,sqrt,2,12,155,0.9783396710715679,TPESampler,COMPLETE
1827,0.3667695094028979,2025-04-24 22:32:58.510170,2025-04-24 22:33:05.177016,0 days 00:00:06.666846,0.03973842511269132,10,,5,20,1449,0.8481730321787296,TPESampler,COMPLETE
1828,0.31592112129830924,2025-04-24 22:32:58.665049,2025-04-24 22:33:05.426510,0 days 00:00:06.761461,0.04065064500624782,11,,1,20,1184,0.8817513485834237,TPESampler,COMPLETE
1829,0.32530950158092375,2025-04-24 22:33:03.523716,2025-04-24 22:33:10.427815,0 days 00:00:06.904099,0.07096885709383498,11,,1,20,1109,0.963848456485696,TPESampler,COMPLETE
1830,0.3094183601491378,2025-04-24 22:33:05.382608,2025-04-24 22:33:09.352191,0 days 00:00:03.969583,0.05166783661442491,11,,2,19,694,0.8783525520202369,TPESampler,COMPLETE
1831,0.36470431445716167,2025-04-24 22:33:05.717917,2025-04-24 22:33:11.224865,0 days 00:00:05.506948,0.039907599923039,12,,5,20,909,0.9743805891033391,TPESampler,COMPLETE
1832,0.3093393079589726,2025-04-24 22:33:09.572485,2025-04-24 22:33:17.764279,0 days 00:00:08.191794,0.060494757367716916,11,,2,18,1485,0.8343293981970322,TPESampler,COMPLETE
1833,0.35941364082618915,2025-04-24 22:33:10.643243,2025-04-24 22:33:12.523846,0 days 00:00:01.880603,0.04885462810616973,12,sqrt,1,20,838,0.9954895525216972,TPESampler,COMPLETE
1834,0.3352516044614711,2025-04-24 22:33:11.451393,2025-04-24 22:33:15.160984,0 days 00:00:03.709591,0.07828546012970518,12,,3,20,518,0.9473323485090296,TPESampler,COMPLETE
1835,0.33234770421312176,2025-04-24 22:33:12.721654,2025-04-24 22:33:14.923949,0 days 00:00:02.202295,0.08061626825495469,12,sqrt,4,18,1458,0.8558792721167735,TPESampler,COMPLETE
1836,0.33543310530874554,2025-04-24 22:33:15.122240,2025-04-24 22:33:23.239159,0 days 00:00:08.116919,0.05515339038724252,12,,3,19,1301,0.9695630189788533,TPESampler,COMPLETE
1837,0.29552187969543214,2025-04-24 22:33:15.535939,2025-04-24 22:33:21.918415,0 days 00:00:06.382476,0.08108123541427863,11,,2,20,1224,0.8359561158340895,TPESampler,COMPLETE
1838,0.2954612443655545,2025-04-24 22:33:17.973262,2025-04-24 22:33:23.650398,0 days 00:00:05.677136,0.056376523335242595,12,,2,19,928,0.9285331951767772,TPESampler,COMPLETE
1839,0.30396738423978764,2025-04-24 22:33:22.130573,2025-04-24 22:33:29.453956,0 days 00:00:07.323383,0.09274965162156941,12,,2,20,1155,0.9117492054604731,TPESampler,COMPLETE
1840,0.35393830680379257,2025-04-24 22:33:23.437154,2025-04-24 22:33:25.414278,0 days 00:00:01.977124,0.04505720982224885,8,sqrt,1,3,1068,0.7273228345774365,TPESampler,COMPLETE
1841,0.31498133364122105,2025-04-24 22:33:23.910640,2025-04-24 22:33:32.126724,0 days 00:00:08.216084,0.041822053143402954,12,,1,19,1372,0.8254152341288401,TPESampler,COMPLETE
1842,0.3500183203155089,2025-04-24 22:33:25.604860,2025-04-24 22:33:27.701747,0 days 00:00:02.096887,0.04506001766941392,12,sqrt,1,19,1253,0.8698502457872664,TPESampler,COMPLETE
1843,0.4506728585000073,2025-04-24 22:33:27.898267,2025-04-24 22:33:29.887794,0 days 00:00:01.989527,0.0765473688681059,10,sqrt,9,17,1472,0.6325780567075737,TPESampler,COMPLETE
1844,0.29641184310378765,2025-04-24 22:33:29.670631,2025-04-24 22:33:38.376252,0 days 00:00:08.705621,0.05242168786116729,11,,2,19,1440,0.9034859092977674,TPESampler,COMPLETE
1845,0.45595500323059285,2025-04-24 22:33:30.161253,2025-04-24 22:33:32.153163,0 days 00:00:01.991910,0.029274236840587102,8,sqrt,10,11,1442,0.8916792371159626,TPESampler,COMPLETE
1846,0.37312580817571933,2025-04-24 22:33:32.301505,2025-04-24 22:33:34.550455,0 days 00:00:02.248950,0.07036801529643878,12,log2,2,20,1158,0.9371974774976313,TPESampler,COMPLETE
1847,0.6827697091171399,2025-04-24 22:33:32.361868,2025-04-24 22:33:33.590709,0 days 00:00:01.228841,0.07617155766703798,8,log2,5,4,193,0.613442445804302,TPESampler,COMPLETE
1848,0.32491249656769716,2025-04-24 22:33:33.790513,2025-04-24 22:33:39.678923,0 days 00:00:05.888410,0.037551911038252575,11,,3,20,1049,0.8524623080022106,TPESampler,COMPLETE
1849,0.4723726089403535,2025-04-24 22:33:34.751952,2025-04-24 22:33:37.526860,0 days 00:00:02.774908,0.010805850577387597,8,,10,5,807,0.6485848980183576,TPESampler,COMPLETE
1850,0.33909275254671306,2025-04-24 22:33:37.756788,2025-04-24 22:33:42.560413,0 days 00:00:04.803625,0.05628455053790668,10,,1,19,789,0.9557841894427943,TPESampler,COMPLETE
1851,0.3372168169934015,2025-04-24 22:33:38.583096,2025-04-24 22:33:46.720397,0 days 00:00:08.137301,0.04959749663073821,12,,3,18,1486,0.8546855729472503,TPESampler,COMPLETE
1852,0.31648542997458656,2025-04-24 22:33:39.887027,2025-04-24 22:33:46.304038,0 days 00:00:06.417011,0.047082541544692824,12,,1,17,1080,0.8581509455995976,TPESampler,COMPLETE
1853,0.3653163592935155,2025-04-24 22:33:42.764859,2025-04-24 22:33:44.425805,0 days 00:00:01.660946,0.046290341943722196,12,log2,3,20,1190,0.746183003445158,TPESampler,COMPLETE
1854,0.3315806028010278,2025-04-24 22:33:44.617128,2025-04-24 22:33:50.818529,0 days 00:00:06.201401,0.07450846583336328,10,,3,20,1147,0.8913928263906369,TPESampler,COMPLETE
1855,0.35485183495938344,2025-04-24 22:33:46.500071,2025-04-24 22:33:48.834085,0 days 00:00:02.334014,0.08584366540101789,12,sqrt,1,20,1272,0.9155877509042205,TPESampler,COMPLETE
1856,0.30648866248734546,2025-04-24 22:33:46.964092,2025-04-24 22:33:52.800107,0 days 00:00:05.836015,0.06415182144785428,10,,2,20,1016,0.9142535073836336,TPESampler,COMPLETE
1857,0.3027573752485934,2025-04-24 22:33:49.035969,2025-04-24 22:33:55.873951,0 days 00:00:06.837982,0.04107831412144469,11,,2,19,1186,0.9254282907814843,TPESampler,COMPLETE
1858,0.29325361825488033,2025-04-24 22:33:51.024448,2025-04-24 22:33:58.719948,0 days 00:00:07.695500,0.05344440217389117,12,,2,19,1291,0.9257250538025338,TPESampler,COMPLETE
1859,0.3089508404020241,2025-04-24 22:33:53.017653,2025-04-24 22:33:59.437341,0 days 00:00:06.419688,0.05669248225298513,10,,2,19,1229,0.8795253960813805,TPESampler,COMPLETE
1860,0.3311993752538981,2025-04-24 22:33:56.074221,2025-04-24 22:34:00.772018,0 days 00:00:04.697797,0.07236602679602833,12,,3,20,732,0.9323621908863357,TPESampler,COMPLETE
1861,0.3156277032498852,2025-04-24 22:33:58.916199,2025-04-24 22:34:05.517794,0 days 00:00:06.601595,0.06342889075583957,12,,1,19,1040,0.9011063033697193,TPESampler,COMPLETE
1862,0.3853703130604934,2025-04-24 22:33:59.680114,2025-04-24 22:34:03.597445,0 days 00:00:03.917331,0.07152132236565108,6,,7,15,1340,0.6017610828259289,TPESampler,COMPLETE
1863,0.3058962841728591,2025-04-24 22:34:00.961892,2025-04-24 22:34:07.237257,0 days 00:00:06.275365,0.07191000725528865,11,,2,19,1123,0.8672330173762623,TPESampler,COMPLETE
1864,0.3500458037397752,2025-04-24 22:34:03.806655,2025-04-24 22:34:11.460638,0 days 00:00:07.653983,0.08339523307318901,11,,3,20,1450,0.8953115881809741,TPESampler,COMPLETE
1865,0.3602594662557697,2025-04-24 22:34:05.717684,2025-04-24 22:34:13.812249,0 days 00:00:08.094565,0.09787581691205222,12,,3,19,1477,0.9184730608477302,TPESampler,COMPLETE
