number,value,datetime_start,datetime_complete,duration,params_learning_rate,params_max_depth,params_max_features,params_min_samples_leaf,params_min_samples_split,params_n_estimators,params_subsample,system_attrs_auto:sampler,state
1370,0.6566275929405889,2025-04-24 22:17:29.912092,2025-04-24 22:17:30.727035,0 days 00:00:00.814943,0.012237810032670018,9,sqrt,4,19,169,0.9837848030249996,TPESampler,COMPLETE
1371,0.4022491251786136,2025-04-24 22:17:30.908456,2025-04-24 22:17:37.719688,0 days 00:00:06.811232,0.09579917806105777,11,,5,14,1156,0.9960063723726642,TPESampler,COMPLETE
1372,0.3072649741327009,2025-04-24 22:17:34.712825,2025-04-24 22:17:40.774772,0 days 00:00:06.061947,0.09371672345452234,10,,2,12,1069,0.9410219832984091,TPESampler,COMPLETE
1373,0.5507899202635889,2025-04-24 22:17:34.927950,2025-04-24 22:17:36.101190,0 days 00:00:01.173240,0.010434969500791527,5,sqrt,5,9,501,0.9754610645711848,TPESampler,COMPLETE
1374,0.32732905751255836,2025-04-24 22:17:36.283406,2025-04-24 22:17:44.066592,0 days 00:00:07.783186,0.06443871544441222,12,,1,11,1246,0.9586018812578447,TPESampler,COMPLETE
1375,0.3635133143528041,2025-04-24 22:17:37.912683,2025-04-24 22:17:44.758516,0 days 00:00:06.845833,0.08648741703844047,12,,3,14,1084,0.9953954173506718,TPESampler,COMPLETE
1376,0.29831271316618385,2025-04-24 22:17:40.995626,2025-04-24 22:17:50.324734,0 days 00:00:09.329108,0.0980850733508583,12,,2,9,1392,0.9994354286966873,TPESampler,COMPLETE
1377,0.7512626738902921,2025-04-24 22:17:44.248527,2025-04-24 22:17:45.319493,0 days 00:00:01.070966,0.013651533950537224,4,sqrt,6,19,199,0.7492128243814408,TPESampler,COMPLETE
1378,0.34967460676552764,2025-04-24 22:17:45.249025,2025-04-24 22:17:47.568355,0 days 00:00:02.319330,0.0887214225159701,12,log2,2,12,1130,0.9959999995447968,TPESampler,COMPLETE
1379,0.3562165939916611,2025-04-24 22:17:45.754777,2025-04-24 22:17:54.322994,0 days 00:00:08.568217,0.05906582234317306,11,,3,15,1277,0.9957001022821731,TPESampler,COMPLETE
1380,0.2988197259554607,2025-04-24 22:17:47.906378,2025-04-24 22:17:55.183061,0 days 00:00:07.276683,0.0974009160616575,10,,2,15,1133,0.9984976594561399,TPESampler,COMPLETE
1381,0.31886706592664316,2025-04-24 22:17:50.595789,2025-04-24 22:17:58.389868,0 days 00:00:07.794079,0.06043877868610781,10,,2,12,1256,0.9728288674958666,TPESampler,COMPLETE
1382,0.3249522512716614,2025-04-24 22:17:54.829508,2025-04-24 22:18:01.661267,0 days 00:00:06.831759,0.05681398310930565,10,,1,12,1129,0.9184498374127138,TPESampler,COMPLETE
1383,0.3799001198962552,2025-04-24 22:17:55.437072,2025-04-24 22:17:57.149291,0 days 00:00:01.712219,0.07729772838623522,12,log2,1,13,709,0.67845022876285,TPESampler,COMPLETE
1384,0.3164423288768255,2025-04-24 22:17:57.419673,2025-04-24 22:18:05.283249,0 days 00:00:07.863576,0.04524831840621429,12,,2,9,1294,0.9072931797676901,TPESampler,COMPLETE
1385,0.33659742460878656,2025-04-24 22:17:58.587107,2025-04-24 22:18:00.767614,0 days 00:00:02.180507,0.091020029264923,12,sqrt,4,14,1285,0.9590718302785824,TPESampler,COMPLETE
1386,0.35763892954535575,2025-04-24 22:18:01.004232,2025-04-24 22:18:05.864016,0 days 00:00:04.859784,0.011286791521575058,6,,1,16,1372,0.7112811872336027,TPESampler,COMPLETE
1387,0.30252937462835355,2025-04-24 22:18:01.890834,2025-04-24 22:18:11.089989,0 days 00:00:09.199155,0.08576991012564814,12,,2,11,1498,0.9752131965101691,TPESampler,COMPLETE
1388,0.3018660896794256,2025-04-24 22:18:05.520248,2025-04-24 22:18:13.308870,0 days 00:00:07.788622,0.08688836127990085,12,,2,14,1264,0.9640713905084723,TPESampler,COMPLETE
1389,0.36895706331645295,2025-04-24 22:18:06.105906,2025-04-24 22:18:15.332501,0 days 00:00:09.226595,0.0642067924009902,12,,3,9,1496,0.9979244840761349,TPESampler,COMPLETE
1390,0.3383820099348046,2025-04-24 22:18:11.310621,2025-04-24 22:18:18.956084,0 days 00:00:07.645463,0.07307674499454392,10,,1,13,1321,0.9926754822610262,TPESampler,COMPLETE
1391,0.3730822981389609,2025-04-24 22:18:13.514034,2025-04-24 22:18:20.328853,0 days 00:00:06.814819,0.0900679295590034,10,,4,9,1157,0.9860592632163456,TPESampler,COMPLETE
1392,0.30048275117735734,2025-04-24 22:18:15.523754,2025-04-24 22:18:24.237648,0 days 00:00:08.713894,0.03898844999007711,11,,2,10,1478,0.9883523619237014,TPESampler,COMPLETE
1393,0.36179449554700965,2025-04-24 22:18:19.150202,2025-04-24 22:18:28.337804,0 days 00:00:09.187602,0.09344503037974494,12,,3,12,1459,0.9977566944969237,TPESampler,COMPLETE
1394,0.2977387050189779,2025-04-24 22:18:20.518430,2025-04-24 22:18:27.262658,0 days 00:00:06.744228,0.09389274721557017,12,,2,18,1096,0.894735902092671,TPESampler,COMPLETE
1395,0.46015016802405073,2025-04-24 22:18:24.431825,2025-04-24 22:18:26.114920,0 days 00:00:01.683095,0.04089644054749748,4,sqrt,10,18,1238,0.8867371471548124,TPESampler,COMPLETE
1396,0.29401556715403826,2025-04-24 22:18:26.305645,2025-04-24 22:18:34.072181,0 days 00:00:07.766536,0.0900175042763351,12,,2,10,1211,0.9833480210210788,TPESampler,COMPLETE
1397,0.4216962441048613,2025-04-24 22:18:27.457889,2025-04-24 22:18:30.742499,0 days 00:00:03.284610,0.04418200948512112,8,,8,12,797,0.756085942840338,TPESampler,COMPLETE
1398,0.34987619659730035,2025-04-24 22:18:28.536261,2025-04-24 22:18:34.141128,0 days 00:00:05.604867,0.09381060645044945,9,,1,9,1253,0.7815053764954534,TPESampler,COMPLETE
1399,0.3208977880304426,2025-04-24 22:18:30.934057,2025-04-24 22:18:39.309460,0 days 00:00:08.375403,0.09934670102137184,12,,1,14,1301,0.9671566264495148,TPESampler,COMPLETE
1400,0.42497680605679333,2025-04-24 22:18:34.238385,2025-04-24 22:18:35.975078,0 days 00:00:01.736693,0.047596702794465894,11,sqrt,9,8,976,0.9337964241296988,TPESampler,COMPLETE
1401,0.36250545997759526,2025-04-24 22:18:34.356287,2025-04-24 22:18:42.390385,0 days 00:00:08.034098,0.06604914218550928,12,,3,13,1221,0.9992520863583415,TPESampler,COMPLETE
1402,0.33036879182952517,2025-04-24 22:18:36.161786,2025-04-24 22:18:42.476912,0 days 00:00:06.315126,0.09518448767871635,10,,1,5,1062,0.9770101703808154,TPESampler,COMPLETE
1403,0.4823687716603287,2025-04-24 22:18:39.516946,2025-04-24 22:18:40.413222,0 days 00:00:00.896276,0.05692824191029113,7,log2,2,16,270,0.7060697673048453,TPESampler,COMPLETE
1404,0.29537565998984644,2025-04-24 22:18:40.602642,2025-04-24 22:18:48.917909,0 days 00:00:08.315267,0.08343274660521868,12,,2,11,1280,0.9894351582907668,TPESampler,COMPLETE
1405,0.32461785591773046,2025-04-24 22:18:42.554647,2025-04-24 22:18:52.177993,0 days 00:00:09.623346,0.03852241913709287,12,,1,15,1468,0.9964887526957521,TPESampler,COMPLETE
1406,0.43212991236288995,2025-04-24 22:18:42.665781,2025-04-24 22:18:44.798522,0 days 00:00:02.132741,0.09905570093673936,8,,9,10,523,0.6144313781933316,TPESampler,COMPLETE
1407,0.3432741753663004,2025-04-24 22:18:45.022870,2025-04-24 22:18:51.590501,0 days 00:00:06.567631,0.06832995648548074,10,,1,9,1151,0.9630117203539053,TPESampler,COMPLETE
1408,0.3692104889262094,2025-04-24 22:18:49.100603,2025-04-24 22:18:51.538867,0 days 00:00:02.438264,0.03274907805066192,4,,2,20,898,0.6732340319630952,TPESampler,COMPLETE
1409,0.32323781766158965,2025-04-24 22:18:51.700073,2025-04-24 22:19:00.046146,0 days 00:00:08.346073,0.09931025482228696,11,,1,7,1263,0.9558395296053458,TPESampler,COMPLETE
1410,0.46097976750111647,2025-04-24 22:18:51.744466,2025-04-24 22:18:53.755128,0 days 00:00:02.010662,0.027456371464496795,7,sqrt,10,8,927,0.789501422852631,TPESampler,COMPLETE
1411,0.4379793763147664,2025-04-24 22:18:52.406841,2025-04-24 22:18:55.803775,0 days 00:00:03.396934,0.06317277859506264,5,,10,19,1020,0.7196785464862576,TPESampler,COMPLETE
1412,0.3285841943932531,2025-04-24 22:18:53.939056,2025-04-24 22:19:01.680955,0 days 00:00:07.741899,0.06428740979357142,11,,1,7,1206,0.9909636330921445,TPESampler,COMPLETE
1413,0.3424305990684326,2025-04-24 22:18:55.984878,2025-04-24 22:18:57.838852,0 days 00:00:01.853974,0.07769514985271207,12,log2,3,16,1469,0.9874891010318305,TPESampler,COMPLETE
1414,0.3926839209943206,2025-04-24 22:18:58.023975,2025-04-24 22:19:05.314173,0 days 00:00:07.290198,0.0960435809083992,12,,4,7,1217,0.9654612872688285,TPESampler,COMPLETE
1415,0.30081278718303844,2025-04-24 22:19:00.222275,2025-04-24 22:19:07.623903,0 days 00:00:07.401628,0.07653901326749071,12,,2,13,1154,0.990490374144591,TPESampler,COMPLETE
1416,0.31489128721024406,2025-04-24 22:19:01.857900,2025-04-24 22:19:08.563288,0 days 00:00:06.705388,0.06437745414134366,12,,1,9,1027,0.9503323399153467,TPESampler,COMPLETE
1417,0.4063929301320373,2025-04-24 22:19:05.579856,2025-04-24 22:19:07.034565,0 days 00:00:01.454709,0.0105924200289933,11,sqrt,5,5,785,0.8291658405370496,TPESampler,COMPLETE
1418,0.3645488366951082,2025-04-24 22:19:07.217625,2025-04-24 22:19:14.079856,0 days 00:00:06.862231,0.0989720255686654,11,,3,10,1232,0.9166250953688433,TPESampler,COMPLETE
1419,0.34321855192696343,2025-04-24 22:19:07.837676,2025-04-24 22:19:12.034236,0 days 00:00:04.196560,0.03217508835823667,8,,2,20,1195,0.6203449688406462,TPESampler,COMPLETE
1420,0.2895863322788703,2025-04-24 22:19:08.755391,2025-04-24 22:19:15.515484,0 days 00:00:06.760093,0.09658324370919073,12,,2,11,1032,0.994599651344871,TPESampler,COMPLETE
1421,0.2998432058647431,2025-04-24 22:19:12.218643,2025-04-24 22:19:20.467957,0 days 00:00:08.249314,0.0964231868626141,12,,2,11,1305,0.971690735842291,TPESampler,COMPLETE
1422,0.29476994900618647,2025-04-24 22:19:14.300385,2025-04-24 22:19:22.217164,0 days 00:00:07.916779,0.0989574129558188,11,,2,11,1321,0.9569312544701359,TPESampler,COMPLETE
1423,0.7201395614401344,2025-04-24 22:19:15.721358,2025-04-24 22:19:16.485263,0 days 00:00:00.763905,0.011592957429302084,12,sqrt,7,8,154,0.8744081390003128,TPESampler,COMPLETE
1424,0.5110326071273588,2025-04-24 22:19:16.662300,2025-04-24 22:19:17.600515,0 days 00:00:00.938215,0.018803204807657386,8,,9,20,107,0.7870929705983984,TPESampler,COMPLETE
1425,0.3774588148554378,2025-04-24 22:19:17.780565,2025-04-24 22:19:24.535777,0 days 00:00:06.755212,0.09647126994804159,12,,3,9,1099,0.9756030809470877,TPESampler,COMPLETE
1426,0.36913674677037533,2025-04-24 22:19:20.649617,2025-04-24 22:19:27.920904,0 days 00:00:07.271287,0.09906168225071736,12,,4,10,1213,0.9511111242710277,TPESampler,COMPLETE
1427,0.3488759365082547,2025-04-24 22:19:22.410130,2025-04-24 22:19:28.932256,0 days 00:00:06.522126,0.06492048247998287,12,,3,12,1022,0.9722142830260861,TPESampler,COMPLETE
1428,0.3096308383186402,2025-04-24 22:19:24.730256,2025-04-24 22:19:32.484530,0 days 00:00:07.754274,0.08077679439915172,10,,2,12,1348,0.987961809933782,TPESampler,COMPLETE
1429,0.321046217854437,2025-04-24 22:19:28.246666,2025-04-24 22:19:34.636741,0 days 00:00:06.390075,0.08993580929759488,11,,1,10,1041,0.9666410510807839,TPESampler,COMPLETE
1430,0.3335130712720633,2025-04-24 22:19:29.114169,2025-04-24 22:19:36.224339,0 days 00:00:07.110170,0.09400285760669846,11,,1,12,1190,0.9584697500773094,TPESampler,COMPLETE
1431,0.37937830487198,2025-04-24 22:19:32.665116,2025-04-24 22:19:40.852605,0 days 00:00:08.187489,0.0999766613465373,12,,3,11,1331,0.9958278978760775,TPESampler,COMPLETE
1432,0.29217850195126815,2025-04-24 22:19:34.841098,2025-04-24 22:19:43.777509,0 days 00:00:08.936411,0.08640964857298836,12,,2,12,1416,0.9994531576798172,TPESampler,COMPLETE
1433,0.3231928479964444,2025-04-24 22:19:36.407912,2025-04-24 22:19:43.625773,0 days 00:00:07.217861,0.09800049972857204,12,,1,13,1137,0.9708102050985039,TPESampler,COMPLETE
1434,0.359346988866162,2025-04-24 22:19:41.041513,2025-04-24 22:19:48.192810,0 days 00:00:07.151297,0.09038299597351382,10,,4,11,1417,0.9087528613795114,TPESampler,COMPLETE
1435,0.3400105144499367,2025-04-24 22:19:43.787668,2025-04-24 22:19:51.902315,0 days 00:00:08.114647,0.0752294614565123,10,,1,11,1472,0.9296672121393192,TPESampler,COMPLETE
1436,0.3532546859316279,2025-04-24 22:19:43.994400,2025-04-24 22:19:50.108165,0 days 00:00:06.113765,0.09927255232211785,11,,3,12,1018,0.9790708289527424,TPESampler,COMPLETE
1437,0.30994296047380504,2025-04-24 22:19:48.388539,2025-04-24 22:19:53.071471,0 days 00:00:04.682932,0.08752115463897361,10,,2,10,764,0.9933175319414005,TPESampler,COMPLETE
1438,0.3600308871836434,2025-04-24 22:19:50.291290,2025-04-24 22:19:58.615745,0 days 00:00:08.324455,0.07465223721211348,12,,3,13,1427,0.9488860491637068,TPESampler,COMPLETE
1439,0.3483719156971147,2025-04-24 22:19:52.088564,2025-04-24 22:19:59.190826,0 days 00:00:07.102262,0.06869991414296607,10,,3,14,1316,0.9674822874803364,TPESampler,COMPLETE
1440,0.30145149905936097,2025-04-24 22:19:53.253245,2025-04-24 22:20:02.416838,0 days 00:00:09.163593,0.07625572424557413,12,,2,10,1477,0.9624508885411832,TPESampler,COMPLETE
1441,0.33013646255253315,2025-04-24 22:19:58.834900,2025-04-24 22:20:04.813215,0 days 00:00:05.978315,0.09784205908999749,12,,1,13,882,0.9601453636801947,TPESampler,COMPLETE
1442,0.419126091522798,2025-04-24 22:19:59.380312,2025-04-24 22:20:00.812194,0 days 00:00:01.431882,0.030178054791755008,7,log2,2,8,922,0.7676763245618048,TPESampler,COMPLETE
1443,0.36246150146160455,2025-04-24 22:20:01.012029,2025-04-24 22:20:08.842100,0 days 00:00:07.830071,0.06017624167246532,9,,4,12,1484,0.9937358794123282,TPESampler,COMPLETE
1444,0.4360065116289873,2025-04-24 22:20:02.600080,2025-04-24 22:20:07.703861,0 days 00:00:05.103781,0.05015542429964247,5,,9,6,1474,0.9698526969585173,TPESampler,COMPLETE
1445,0.3033762980356232,2025-04-24 22:20:05.011749,2025-04-24 22:20:13.991201,0 days 00:00:08.979452,0.06683968002522023,12,,2,14,1384,0.9924085660931453,TPESampler,COMPLETE
1446,0.3161328326797915,2025-04-24 22:20:07.897976,2025-04-24 22:20:10.370695,0 days 00:00:02.472719,0.0905260264808331,12,sqrt,2,8,1399,0.8877046142817195,TPESampler,COMPLETE
1447,0.3516540240861799,2025-04-24 22:20:09.036740,2025-04-24 22:20:16.422447,0 days 00:00:07.385707,0.0865913884126482,10,,3,14,1441,0.9112396938054473,TPESampler,COMPLETE
1448,0.360932636621845,2025-04-24 22:20:10.557000,2025-04-24 22:20:18.519566,0 days 00:00:07.962566,0.09081999497182679,11,,3,12,1343,0.9942910982228844,TPESampler,COMPLETE
1449,0.3318272569816065,2025-04-24 22:20:14.221540,2025-04-24 22:20:19.252632,0 days 00:00:05.031092,0.0987606675861331,10,,3,18,880,0.9448853837244295,TPESampler,COMPLETE
1450,0.3343995309897953,2025-04-24 22:20:16.628830,2025-04-24 22:20:24.254991,0 days 00:00:07.626161,0.09057202542438865,10,,1,10,1239,0.9986405873123635,TPESampler,COMPLETE
1451,0.32928819983498375,2025-04-24 22:20:18.717912,2025-04-24 22:20:20.994962,0 days 00:00:02.277050,0.0847363988709359,11,sqrt,2,13,1232,0.9786334334381958,TPESampler,COMPLETE
1452,0.43218879515742586,2025-04-24 22:20:19.466552,2025-04-24 22:20:20.664840,0 days 00:00:01.198288,0.028132228028824004,9,,7,7,123,0.9456087384294974,TPESampler,COMPLETE
1453,0.317248301967695,2025-04-24 22:20:20.862052,2025-04-24 22:20:28.727660,0 days 00:00:07.865608,0.09391865669553072,12,,1,9,1224,0.959463718831934,TPESampler,COMPLETE
1454,0.3614378403841716,2025-04-24 22:20:21.239756,2025-04-24 22:20:28.056778,0 days 00:00:06.817022,0.08877214188956614,12,,3,11,1094,0.9889104308967082,TPESampler,COMPLETE
1455,0.3045621249455506,2025-04-24 22:20:24.440935,2025-04-24 22:20:32.596189,0 days 00:00:08.155254,0.07699002901100867,12,,2,12,1350,0.923517628015081,TPESampler,COMPLETE
1456,0.3028419163552936,2025-04-24 22:20:28.238167,2025-04-24 22:20:34.250099,0 days 00:00:06.011932,0.08637573578626546,12,,2,11,871,0.995505399142132,TPESampler,COMPLETE
1457,0.3625724800837725,2025-04-24 22:20:28.955840,2025-04-24 22:20:30.818615,0 days 00:00:01.862775,0.09328907131197313,12,log2,1,9,1227,0.987881823963255,TPESampler,COMPLETE
1458,0.2982376190028924,2025-04-24 22:20:31.020295,2025-04-24 22:20:39.780091,0 days 00:00:08.759796,0.09669327036604751,12,,2,12,1406,0.9886419122616182,TPESampler,COMPLETE
1459,0.3755220795191563,2025-04-24 22:20:32.783183,2025-04-24 22:20:40.165659,0 days 00:00:07.382476,0.06394583602203781,12,,4,10,1199,0.9932459734403183,TPESampler,COMPLETE
1460,0.32734698441458515,2025-04-24 22:20:34.449102,2025-04-24 22:20:44.294304,0 days 00:00:09.845202,0.0601809307157128,12,,1,6,1482,0.9940791845137208,TPESampler,COMPLETE
1461,0.3348084279597442,2025-04-24 22:20:39.969239,2025-04-24 22:20:47.093621,0 days 00:00:07.124382,0.09453254852915075,10,,1,15,1257,0.919923488320247,TPESampler,COMPLETE
1462,0.738909449183357,2025-04-24 22:20:40.389005,2025-04-24 22:20:41.247221,0 days 00:00:00.858216,0.013667723983383104,4,sqrt,9,5,254,0.7359975257393835,TPESampler,COMPLETE
1463,0.3245329361680204,2025-04-24 22:20:41.495187,2025-04-24 22:20:49.720068,0 days 00:00:08.224881,0.08308756537949673,12,,1,10,1185,0.9987193508780463,TPESampler,COMPLETE
1464,0.43188323594602446,2025-04-24 22:20:44.499307,2025-04-24 22:20:46.337298,0 days 00:00:01.837991,0.02689299919439154,6,log2,6,8,1474,0.9384727340411401,TPESampler,COMPLETE
1465,0.33729992510072193,2025-04-24 22:20:46.741992,2025-04-24 22:20:55.494209,0 days 00:00:08.752217,0.08804588162273559,10,,1,13,1397,0.9892485570589266,TPESampler,COMPLETE
1466,0.9152403553115698,2025-04-24 22:20:47.493228,2025-04-24 22:20:48.253343,0 days 00:00:00.760115,0.020956345790239667,4,log2,8,20,106,0.9413005685729962,TPESampler,COMPLETE
1467,0.2984260538292852,2025-04-24 22:20:48.444575,2025-04-24 22:20:55.043257,0 days 00:00:06.598682,0.09227814674817966,12,,2,12,985,0.9822995692453154,TPESampler,COMPLETE
1468,0.3412909876874746,2025-04-24 22:20:49.901947,2025-04-24 22:20:51.768796,0 days 00:00:01.866849,0.09931681962344753,10,log2,2,9,1413,0.9270657309445949,TPESampler,COMPLETE
1469,0.3882350608790925,2025-04-24 22:20:51.961481,2025-04-24 22:20:53.289506,0 days 00:00:01.328025,0.050387832720068235,11,,6,19,200,0.6032227962241768,TPESampler,COMPLETE
1470,0.36764809943133747,2025-04-24 22:20:53.490595,2025-04-24 22:21:01.355727,0 days 00:00:07.865132,0.09708403443793671,12,,4,12,1316,0.9214916120642214,TPESampler,COMPLETE
1471,0.34289690769691217,2025-04-24 22:20:55.264179,2025-04-24 22:20:57.901911,0 days 00:00:02.637732,0.08566685198259232,10,sqrt,1,9,1354,0.9757084079753052,TPESampler,COMPLETE
1472,0.48368592506459995,2025-04-24 22:20:55.749834,2025-04-24 22:20:56.900391,0 days 00:00:01.150557,0.028981044279399435,5,sqrt,8,17,328,0.9787892419989511,TPESampler,COMPLETE
1473,0.32146409129776504,2025-04-24 22:20:57.120037,2025-04-24 22:21:04.977248,0 days 00:00:07.857211,0.04826392066449964,12,,1,14,1221,0.9775680920830643,TPESampler,COMPLETE
1474,0.29134430169424924,2025-04-24 22:20:58.106146,2025-04-24 22:21:07.223122,0 days 00:00:09.116976,0.06376905166438704,12,,2,12,1424,0.9978641004859835,TPESampler,COMPLETE
1475,0.298798900514186,2025-04-24 22:21:01.557555,2025-04-24 22:21:10.477382,0 days 00:00:08.919827,0.06374841954606622,11,,2,14,1475,0.9973538527343234,TPESampler,COMPLETE
1476,0.30276389350502325,2025-04-24 22:21:05.198431,2025-04-24 22:21:13.307962,0 days 00:00:08.109531,0.06241642742558742,11,,2,10,1248,0.9971720067765785,TPESampler,COMPLETE
1477,0.29973322481449644,2025-04-24 22:21:07.413818,2025-04-24 22:21:16.977660,0 days 00:00:09.563842,0.05528883373940827,12,,2,12,1448,0.9946295129075979,TPESampler,COMPLETE
1478,0.37728733949747173,2025-04-24 22:21:10.657317,2025-04-24 22:21:12.622168,0 days 00:00:01.964851,0.04127076856930515,4,,1,12,681,0.6069198976639006,TPESampler,COMPLETE
1479,0.6723584236573954,2025-04-24 22:21:12.807107,2025-04-24 22:21:14.853507,0 days 00:00:02.046400,0.011155462544760363,11,log2,6,2,1185,0.7257495155917014,TPESampler,COMPLETE
1480,0.36485643659418227,2025-04-24 22:21:13.579443,2025-04-24 22:21:16.001959,0 days 00:00:02.422516,0.04886759688501313,9,log2,3,6,1403,0.9999258628079271,TPESampler,COMPLETE
1481,0.3632192672696517,2025-04-24 22:21:15.081438,2025-04-24 22:21:22.282450,0 days 00:00:07.201012,0.07183927428587901,10,,3,9,1210,0.9959809505492115,TPESampler,COMPLETE
1482,0.8103601245876945,2025-04-24 22:21:16.291021,2025-04-24 22:21:17.112339,0 days 00:00:00.821318,0.018493049939860187,5,log2,3,2,188,0.9250838444751841,TPESampler,COMPLETE
1483,0.40574226077646547,2025-04-24 22:21:17.170616,2025-04-24 22:21:25.222856,0 days 00:00:08.052240,0.07174914757729518,12,,5,8,1476,0.9158281754274851,TPESampler,COMPLETE
1484,0.29765950982622347,2025-04-24 22:21:17.336651,2025-04-24 22:21:24.937439,0 days 00:00:07.600788,0.0949505453988772,12,,2,18,1194,0.9828280622369212,TPESampler,COMPLETE
1485,0.6243935618694254,2025-04-24 22:21:22.656832,2025-04-24 22:21:23.963605,0 days 00:00:01.306773,0.018753260334209213,7,sqrt,9,19,314,0.7122753108791718,TPESampler,COMPLETE
1486,0.5292856474183854,2025-04-24 22:21:24.292123,2025-04-24 22:21:25.312721,0 days 00:00:01.020598,0.027625440822011387,8,sqrt,8,4,261,0.8806084250236109,TPESampler,COMPLETE
1487,0.32589502086646666,2025-04-24 22:21:25.170073,2025-04-24 22:21:33.341909,0 days 00:00:08.171836,0.0712998235970351,12,,1,14,1220,0.9891774368668161,TPESampler,COMPLETE
1488,0.8545795289295499,2025-04-24 22:21:25.513180,2025-04-24 22:21:26.595191,0 days 00:00:01.082011,0.017788830416385883,9,log2,6,9,188,0.9298042628226775,TPESampler,COMPLETE
1489,0.29893207225285273,2025-04-24 22:21:25.601497,2025-04-24 22:21:34.329431,0 days 00:00:08.727934,0.05832559161802259,12,,2,14,1330,0.9832989958654493,TPESampler,COMPLETE
1490,0.48154666775515487,2025-04-24 22:21:26.792945,2025-04-24 22:21:28.081947,0 days 00:00:01.289002,0.05731003171147863,12,log2,9,2,870,0.8087222625995029,TPESampler,COMPLETE
1491,0.295801958887583,2025-04-24 22:21:28.282976,2025-04-24 22:21:36.564916,0 days 00:00:08.281940,0.0939009864648415,12,,2,9,1298,0.992803603987343,TPESampler,COMPLETE
1492,0.2947365223429963,2025-04-24 22:21:33.534682,2025-04-24 22:21:43.012742,0 days 00:00:09.478060,0.05653010199891504,12,,2,14,1480,0.9886360212929115,TPESampler,COMPLETE
1493,0.31507902047903025,2025-04-24 22:21:34.525140,2025-04-24 22:21:36.493851,0 days 00:00:01.968711,0.05586734623829262,12,sqrt,3,8,1184,0.9675057124344717,TPESampler,COMPLETE
