number,value,datetime_start,datetime_complete,duration,params_learning_rate,params_max_depth,params_max_features,params_min_samples_leaf,params_min_samples_split,params_n_estimators,params_subsample,system_attrs_auto:sampler,state
1618,0.33885382962133914,2025-04-24 22:25:44.733821,2025-04-24 22:25:46.277487,0 days 00:00:01.543666,0.08753737627513239,9,sqrt,2,8,770,0.9766457125551218,TPESampler,COMPLETE
1619,0.4035126189843306,2025-04-24 22:25:46.492277,2025-04-24 22:25:48.324617,0 days 00:00:01.832340,0.05715894481958885,5,log2,1,2,1302,0.9419519341687091,TPESampler,COMPLETE
1620,0.3251659938729511,2025-04-24 22:25:48.521832,2025-04-24 22:25:56.550999,0 days 00:00:08.029167,0.08980063176502714,12,,1,11,1223,0.9902824786198489,TPESampler,COMPLETE
1621,0.322978666446169,2025-04-24 22:25:49.136597,2025-04-24 22:25:56.401569,0 days 00:00:07.264972,0.06225122423136608,12,,1,11,1101,0.9989289569195281,TPESampler,COMPLETE
1622,0.35969100283600247,2025-04-24 22:25:52.032462,2025-04-24 22:26:00.464611,0 days 00:00:08.432149,0.06117773943913359,11,,3,14,1410,0.9921062478528146,TPESampler,COMPLETE
1623,0.3301408388743279,2025-04-24 22:25:56.602000,2025-04-24 22:26:06.113706,0 days 00:00:09.511706,0.048818328934100014,12,,1,13,1427,0.9891992569248058,TPESampler,COMPLETE
1624,0.3337944819083429,2025-04-24 22:25:56.754381,2025-04-24 22:25:59.111366,0 days 00:00:02.356985,0.053262678841570724,7,,3,2,566,0.648195960343239,TPESampler,COMPLETE
1625,0.36904534139439094,2025-04-24 22:25:59.307659,2025-04-24 22:26:07.866078,0 days 00:00:08.558419,0.0919673733057913,12,,3,11,1320,0.9881987091592078,TPESampler,COMPLETE
1626,0.6190666835642312,2025-04-24 22:26:00.676160,2025-04-24 22:26:01.519249,0 days 00:00:00.843089,0.09999705417681659,9,log2,9,3,241,0.8533781303575607,TPESampler,COMPLETE
1627,0.365534478678402,2025-04-24 22:26:01.724149,2025-04-24 22:26:03.462745,0 days 00:00:01.738596,0.05305663617501367,12,log2,1,14,1120,0.9583773767260688,TPESampler,COMPLETE
1628,0.3633439102341898,2025-04-24 22:26:03.681310,2025-04-24 22:26:10.920061,0 days 00:00:07.238751,0.05322602914094307,12,,3,12,1110,0.9988406275072815,TPESampler,COMPLETE
1629,0.3546777379482382,2025-04-24 22:26:06.302313,2025-04-24 22:26:13.762092,0 days 00:00:07.459779,0.06583162517058529,12,,4,13,1189,0.9841710258429082,TPESampler,COMPLETE
1630,0.3261599512972321,2025-04-24 22:26:08.075456,2025-04-24 22:26:14.016968,0 days 00:00:05.941512,0.09779076228460505,12,,1,17,890,0.9911555725275757,TPESampler,COMPLETE
1631,0.33324158504138923,2025-04-24 22:26:11.129634,2025-04-24 22:26:18.254830,0 days 00:00:07.125196,0.05910467553748371,12,,3,17,1267,0.8835333685218894,TPESampler,COMPLETE
1632,0.31869796156856384,2025-04-24 22:26:13.961761,2025-04-24 22:26:16.107165,0 days 00:00:02.145404,0.09462533946037135,12,sqrt,2,16,1025,0.977676210597001,TPESampler,COMPLETE
1633,0.36129364640239375,2025-04-24 22:26:14.367525,2025-04-24 22:26:22.181267,0 days 00:00:07.813742,0.06813145250926951,12,,3,10,1261,0.9476688316925649,TPESampler,COMPLETE
1634,0.3556756540092066,2025-04-24 22:26:16.382255,2025-04-24 22:26:24.965978,0 days 00:00:08.583723,0.07180335063683242,12,,3,12,1476,0.958492857520198,TPESampler,COMPLETE
1635,0.3931743027970907,2025-04-24 22:26:18.515864,2025-04-24 22:26:27.150862,0 days 00:00:08.634998,0.09949262789017094,12,,4,11,1489,0.9572240644688688,TPESampler,COMPLETE
1636,0.45776002958906803,2025-04-24 22:26:22.363650,2025-04-24 22:26:25.713445,0 days 00:00:03.349795,0.04851405713423829,4,,10,11,1274,0.668514034109055,TPESampler,COMPLETE
1637,0.36332530185510253,2025-04-24 22:26:25.161244,2025-04-24 22:26:29.238326,0 days 00:00:04.077082,0.03924098685180628,10,,6,11,1047,0.6061048499956068,TPESampler,COMPLETE
1638,0.3134841253821673,2025-04-24 22:26:25.913277,2025-04-24 22:26:32.298019,0 days 00:00:06.384742,0.09777027996495188,10,,2,13,1056,0.997663417748206,TPESampler,COMPLETE
1639,0.4593263291974053,2025-04-24 22:26:27.349418,2025-04-24 22:26:29.062841,0 days 00:00:01.713423,0.022757397777744333,5,,9,3,417,0.7307357265633458,TPESampler,COMPLETE
1640,0.364306790392875,2025-04-24 22:26:29.237395,2025-04-24 22:26:37.220325,0 days 00:00:07.982930,0.0961606656342152,12,,3,14,1328,0.985442158191417,TPESampler,COMPLETE
1641,0.364468403991245,2025-04-24 22:26:29.488339,2025-04-24 22:26:37.102634,0 days 00:00:07.614295,0.07672658495031637,12,,3,12,1213,0.9923407798530687,TPESampler,COMPLETE
1642,0.355129804112195,2025-04-24 22:26:32.497896,2025-04-24 22:26:38.173257,0 days 00:00:05.675361,0.06886316736024702,12,,3,12,951,0.9131280730993429,TPESampler,COMPLETE
1643,0.31353302771825686,2025-04-24 22:26:37.291439,2025-04-24 22:26:45.028603,0 days 00:00:07.737164,0.053544014464358275,10,,2,12,1330,0.9109631366466407,TPESampler,COMPLETE
1644,0.33509771209711364,2025-04-24 22:26:37.420628,2025-04-24 22:26:44.290663,0 days 00:00:06.870035,0.09577559822330373,10,,1,10,1150,0.9230487790715994,TPESampler,COMPLETE
1645,0.36980131306763603,2025-04-24 22:26:38.385218,2025-04-24 22:26:40.244391,0 days 00:00:01.859173,0.03985347450889789,11,log2,1,20,1247,0.9842957211793328,TPESampler,COMPLETE
1646,0.4280557864708594,2025-04-24 22:26:40.435010,2025-04-24 22:26:42.126764,0 days 00:00:01.691754,0.04271383182726988,12,log2,7,10,1328,0.9116979916106867,TPESampler,COMPLETE
1647,0.36194775743980256,2025-04-24 22:26:42.328562,2025-04-24 22:26:49.267189,0 days 00:00:06.938627,0.09345515740953332,10,,3,13,1346,0.915205600677448,TPESampler,COMPLETE
1648,0.3207507195780984,2025-04-24 22:26:44.489611,2025-04-24 22:26:51.340958,0 days 00:00:06.851347,0.0615070990326897,11,,1,14,1202,0.8999010039097249,TPESampler,COMPLETE
1649,0.3606350974095962,2025-04-24 22:26:45.260590,2025-04-24 22:26:52.318799,0 days 00:00:07.058209,0.08242366308681837,10,,3,10,1255,0.988285935518624,TPESampler,COMPLETE
1650,0.3092050004444538,2025-04-24 22:26:49.448458,2025-04-24 22:26:57.734154,0 days 00:00:08.285696,0.0676526827896478,11,,2,10,1285,0.9974779284660995,TPESampler,COMPLETE
1651,0.32933105917837824,2025-04-24 22:26:51.544356,2025-04-24 22:27:00.427138,0 days 00:00:08.882782,0.09850984214311119,12,,1,11,1264,0.9989233612452725,TPESampler,COMPLETE
1652,0.3872093712302913,2025-04-24 22:26:52.537550,2025-04-24 22:26:54.357460,0 days 00:00:01.819910,0.04571817779940272,6,sqrt,5,20,1232,0.8676572131388832,TPESampler,COMPLETE
1653,0.37669851201181936,2025-04-24 22:26:54.551783,2025-04-24 22:26:55.940193,0 days 00:00:01.388410,0.0735623086912438,6,sqrt,1,11,794,0.8175391554622253,TPESampler,COMPLETE
1654,0.36814486946130554,2025-04-24 22:26:56.136151,2025-04-24 22:26:57.984746,0 days 00:00:01.848595,0.08227222822592557,9,log2,4,9,1472,0.9922133638564765,TPESampler,COMPLETE
1655,0.3098135854563939,2025-04-24 22:26:57.937980,2025-04-24 22:27:04.628843,0 days 00:00:06.690863,0.09677097723398075,12,,2,6,1046,0.9764580167908324,TPESampler,COMPLETE
1656,0.3062021300690356,2025-04-24 22:26:58.225485,2025-04-24 22:27:06.156140,0 days 00:00:07.930655,0.08606829002894288,11,,1,9,1400,0.894379883235457,TPESampler,COMPLETE
1657,0.32938885035320953,2025-04-24 22:27:00.631111,2025-04-24 22:27:09.768291,0 days 00:00:09.137180,0.04813361950658603,12,,1,17,1457,0.977926970522336,TPESampler,COMPLETE
1658,0.302875127874158,2025-04-24 22:27:04.823298,2025-04-24 22:27:13.341968,0 days 00:00:08.518670,0.052743240872574204,12,,2,16,1360,0.9962430564276495,TPESampler,COMPLETE
1659,0.3006246582422379,2025-04-24 22:27:06.355423,2025-04-24 22:27:13.209727,0 days 00:00:06.854304,0.047941847817576426,12,,2,12,1136,0.9428974846867673,TPESampler,COMPLETE
1660,0.32998743663893654,2025-04-24 22:27:10.077650,2025-04-24 22:27:18.554839,0 days 00:00:08.477189,0.09359909783421207,12,,1,14,1252,0.992847124958919,TPESampler,COMPLETE
1661,0.3353492914792367,2025-04-24 22:27:13.390958,2025-04-24 22:27:15.406129,0 days 00:00:02.015171,0.05814434373645108,10,sqrt,2,12,1200,0.9362983134716588,TPESampler,COMPLETE
1662,0.41308376147309606,2025-04-24 22:27:13.547026,2025-04-24 22:27:21.088040,0 days 00:00:07.541014,0.07756558281332045,10,,5,3,1410,0.9380120600700907,TPESampler,COMPLETE
1663,0.3481770219911373,2025-04-24 22:27:15.607694,2025-04-24 22:27:20.815932,0 days 00:00:05.208238,0.01543451377738496,8,,3,5,1038,0.9424685718705313,TPESampler,COMPLETE
1664,0.2961463838739942,2025-04-24 22:27:18.759696,2025-04-24 22:27:26.614542,0 days 00:00:07.854846,0.06715288280752085,11,,2,10,1390,0.9235461356998885,TPESampler,COMPLETE
1665,0.30157301685448684,2025-04-24 22:27:21.014800,2025-04-24 22:27:28.199458,0 days 00:00:07.184658,0.08914496482476357,12,,2,15,1017,0.9978829962001721,TPESampler,COMPLETE
1666,0.33305545490024935,2025-04-24 22:27:21.310366,2025-04-24 22:27:30.578925,0 days 00:00:09.268559,0.05224356858968532,12,,1,11,1247,0.9530065026177833,TPESampler,COMPLETE
1667,0.3468754742092033,2025-04-24 22:27:26.809451,2025-04-24 22:27:33.987634,0 days 00:00:07.178183,0.05989799768882317,10,,3,10,1260,0.9188432571597295,TPESampler,COMPLETE
1668,0.4124824353715502,2025-04-24 22:27:28.394193,2025-04-24 22:27:29.915341,0 days 00:00:01.521148,0.010620724527258901,7,sqrt,2,9,874,0.825316616391182,TPESampler,COMPLETE
1669,0.48590416785996204,2025-04-24 22:27:30.111491,2025-04-24 22:27:32.139375,0 days 00:00:02.027884,0.09130801963960662,4,log2,10,8,1447,0.7015832782155016,TPESampler,COMPLETE
1670,0.3737953091822732,2025-04-24 22:27:30.794368,2025-04-24 22:27:39.592109,0 days 00:00:08.797741,0.059079755185466015,11,,3,10,1441,0.9935652633999672,TPESampler,COMPLETE
1671,0.33328459708875946,2025-04-24 22:27:32.337979,2025-04-24 22:27:34.843018,0 days 00:00:02.505039,0.06101461831731885,12,sqrt,2,9,1400,0.9958414140212957,TPESampler,COMPLETE
1672,0.2972531677584133,2025-04-24 22:27:34.189787,2025-04-24 22:27:41.010250,0 days 00:00:06.820463,0.06858206394887681,12,,2,10,1088,0.9334729739442393,TPESampler,COMPLETE
1673,0.3717216047643089,2025-04-24 22:27:35.046277,2025-04-24 22:27:42.055136,0 days 00:00:07.008859,0.09682803843592011,12,,3,11,1255,0.8965630501352918,TPESampler,COMPLETE
1674,0.3251751206258393,2025-04-24 22:27:39.788405,2025-04-24 22:27:48.454421,0 days 00:00:08.666016,0.07886781520705252,11,,1,13,1494,0.914481636977785,TPESampler,COMPLETE
1675,0.4215591498226647,2025-04-24 22:27:41.247545,2025-04-24 22:27:47.419326,0 days 00:00:06.171781,0.014206638054086056,11,,9,14,1424,0.7896852209509643,TPESampler,COMPLETE
1676,0.30164168360933163,2025-04-24 22:27:42.259398,2025-04-24 22:27:49.677326,0 days 00:00:07.417928,0.06862474464903139,12,,2,11,1192,0.9585509548829126,TPESampler,COMPLETE
1677,0.3117290442156108,2025-04-24 22:27:47.878370,2025-04-24 22:27:57.176120,0 days 00:00:09.297750,0.06208994872193033,10,,2,11,1464,0.9981568910361509,TPESampler,COMPLETE
1678,0.444639453757967,2025-04-24 22:27:48.820540,2025-04-24 22:27:52.378999,0 days 00:00:03.558459,0.03929345938198798,11,,10,14,758,0.6218487948447984,TPESampler,COMPLETE
1679,0.6157130062693358,2025-04-24 22:27:49.979620,2025-04-24 22:27:51.299470,0 days 00:00:01.319850,0.04677528547459277,4,sqrt,10,7,131,0.7761653043076845,TPESampler,COMPLETE
1680,0.36550397619905006,2025-04-24 22:27:51.512883,2025-04-24 22:28:01.245078,0 days 00:00:09.732195,0.06762446915106152,12,,3,11,1474,0.9821393575714605,TPESampler,COMPLETE
1681,0.6064344262790725,2025-04-24 22:27:52.975050,2025-04-24 22:27:54.914399,0 days 00:00:01.939349,0.020047859916479945,11,log2,8,17,826,0.963742879835064,TPESampler,COMPLETE
1682,0.42002586501118616,2025-04-24 22:27:55.151531,2025-04-24 22:28:02.651615,0 days 00:00:07.500084,0.04580991313222017,11,,8,10,1307,0.9856421948779275,TPESampler,COMPLETE
1683,0.5353666626810771,2025-04-24 22:27:57.499586,2025-04-24 22:27:59.216225,0 days 00:00:01.716639,0.021374028884294176,9,log2,9,14,1223,0.9008422211195212,TPESampler,COMPLETE
1684,0.30008583309659054,2025-04-24 22:27:59.415267,2025-04-24 22:28:09.330457,0 days 00:00:09.915190,0.046973642937126595,12,,2,12,1497,0.9791213700184581,TPESampler,COMPLETE
1685,0.5528268822630904,2025-04-24 22:28:01.440521,2025-04-24 22:28:02.550264,0 days 00:00:01.109743,0.018479973241223982,4,log2,1,2,511,0.7100388839479623,TPESampler,COMPLETE
1686,0.37742304618112005,2025-04-24 22:28:02.717519,2025-04-24 22:28:05.004427,0 days 00:00:02.286908,0.051576418446632806,10,log2,4,18,1389,0.870269032872702,TPESampler,COMPLETE
1687,0.44185293118976904,2025-04-24 22:28:02.843756,2025-04-24 22:28:04.159539,0 days 00:00:01.315783,0.018044352879591226,9,sqrt,2,7,298,0.8174087697389759,TPESampler,COMPLETE
1688,0.39410573740110844,2025-04-24 22:28:04.356847,2025-04-24 22:28:12.934941,0 days 00:00:08.578094,0.09749544913236112,12,,4,7,1335,0.987922027265832,TPESampler,COMPLETE
1689,0.4005404792181859,2025-04-24 22:28:05.194087,2025-04-24 22:28:06.736228,0 days 00:00:01.542141,0.04745050440796706,9,log2,2,14,1021,0.8799291721536001,TPESampler,COMPLETE
1690,0.29048331759801416,2025-04-24 22:28:06.969871,2025-04-24 22:28:15.683114,0 days 00:00:08.713243,0.06803827458445172,12,,2,12,1331,0.9968288387664673,TPESampler,COMPLETE
1691,0.41031764888388494,2025-04-24 22:28:09.524552,2025-04-24 22:28:11.333093,0 days 00:00:01.808541,0.02542925588583282,11,log2,5,8,1498,0.9388922097178469,TPESampler,COMPLETE
1692,0.30890397052958546,2025-04-24 22:28:11.532003,2025-04-24 22:28:17.953630,0 days 00:00:06.421627,0.08717404250170689,11,,2,8,1137,0.894402740900519,TPESampler,COMPLETE
1693,0.30833684148317,2025-04-24 22:28:13.135517,2025-04-24 22:28:19.381291,0 days 00:00:06.245774,0.09823064905483173,11,,2,15,1100,0.905828816346879,TPESampler,COMPLETE
1694,0.3573304724780489,2025-04-24 22:28:15.912102,2025-04-24 22:28:25.175342,0 days 00:00:09.263240,0.050102127269531165,12,,3,13,1496,0.9885825440015207,TPESampler,COMPLETE
1695,0.34986058037917384,2025-04-24 22:28:18.142285,2025-04-24 22:28:26.042990,0 days 00:00:07.900705,0.07423474879645779,12,,3,14,1318,0.9733359357686859,TPESampler,COMPLETE
1696,0.297843188825348,2025-04-24 22:28:19.588638,2025-04-24 22:28:26.760310,0 days 00:00:07.171672,0.06671356093324216,12,,2,14,1121,0.9919285925306159,TPESampler,COMPLETE
1697,0.32766244986814536,2025-04-24 22:28:25.378556,2025-04-24 22:28:31.946527,0 days 00:00:06.567971,0.06329121826361586,12,,1,13,1042,0.9357918360032087,TPESampler,COMPLETE
1698,0.3239636317612418,2025-04-24 22:28:26.237212,2025-04-24 22:28:34.940296,0 days 00:00:08.703084,0.0950522859469898,12,,1,11,1427,0.9077442427975594,TPESampler,COMPLETE
1699,0.34860641826302,2025-04-24 22:28:26.979140,2025-04-24 22:28:34.355462,0 days 00:00:07.376322,0.09305962208901448,9,,3,17,1461,0.9814268800422435,TPESampler,COMPLETE
1700,0.3990687266374269,2025-04-24 22:28:32.140665,2025-04-24 22:28:34.344765,0 days 00:00:02.204100,0.03699991155172374,4,,6,9,762,0.6561638507212761,TPESampler,COMPLETE
1701,0.3155391033521531,2025-04-24 22:28:34.504487,2025-04-24 22:28:43.326970,0 days 00:00:08.822483,0.06575596263187873,12,,1,10,1338,0.9833098100739716,TPESampler,COMPLETE
1702,0.3061562285380369,2025-04-24 22:28:34.548756,2025-04-24 22:28:42.808425,0 days 00:00:08.259669,0.0994762854931353,11,,2,15,1338,0.9943677282533149,TPESampler,COMPLETE
1703,0.3561079262676437,2025-04-24 22:28:35.261259,2025-04-24 22:28:43.079708,0 days 00:00:07.818449,0.04769189496661796,10,,4,14,1479,0.9837103532231235,TPESampler,COMPLETE
1704,0.3262500751671845,2025-04-24 22:28:43.000820,2025-04-24 22:28:45.902649,0 days 00:00:02.901829,0.09040765250648805,12,sqrt,3,7,1426,0.9777441400590705,TPESampler,COMPLETE
1705,0.532237630827859,2025-04-24 22:28:43.328077,2025-04-24 22:28:44.642720,0 days 00:00:01.314643,0.031197489941284063,3,sqrt,6,2,295,0.9002789689267903,TPESampler,COMPLETE
1706,0.3021181694243021,2025-04-24 22:28:43.656640,2025-04-24 22:28:51.802351,0 days 00:00:08.145711,0.09929888466176588,11,,2,9,1297,0.9756112674060935,TPESampler,COMPLETE
1707,0.35439496195574227,2025-04-24 22:28:44.910503,2025-04-24 22:28:51.851932,0 days 00:00:06.941429,0.04459428806460983,11,,3,14,1145,0.9989013036275745,TPESampler,COMPLETE
1708,0.3376046441734749,2025-04-24 22:28:46.104885,2025-04-24 22:28:53.760869,0 days 00:00:07.655984,0.0655697248710484,10,,1,9,1296,0.9964694694705396,TPESampler,COMPLETE
1709,0.3649340344211609,2025-04-24 22:28:51.966427,2025-04-24 22:28:59.090928,0 days 00:00:07.124501,0.06709311177224916,12,,3,10,1078,0.9914927412104887,TPESampler,COMPLETE
1710,0.3145805039154397,2025-04-24 22:28:52.016632,2025-04-24 22:29:00.509101,0 days 00:00:08.492469,0.09523852339293301,12,,2,14,1299,0.9666509640167419,TPESampler,COMPLETE
1711,0.29453329917985793,2025-04-24 22:28:53.968521,2025-04-24 22:29:02.771130,0 days 00:00:08.802609,0.07043581280760186,12,,2,15,1419,0.9911420843296715,TPESampler,COMPLETE
1712,0.32623719287120406,2025-04-24 22:28:59.286074,2025-04-24 22:29:08.104512,0 days 00:00:08.818438,0.06507100159737962,12,,1,13,1351,0.9967794714786212,TPESampler,COMPLETE
1713,0.3575800875607743,2025-04-24 22:29:00.714446,2025-04-24 22:29:08.105882,0 days 00:00:07.391436,0.0499043546267329,11,,3,11,1244,0.9976022069207653,TPESampler,COMPLETE
1714,0.34564424643232283,2025-04-24 22:29:02.967380,2025-04-24 22:29:10.512396,0 days 00:00:07.545016,0.05789926363658443,10,,1,16,1264,0.994097781913909,TPESampler,COMPLETE
1715,0.7679895732440032,2025-04-24 22:29:08.288611,2025-04-24 22:29:09.284449,0 days 00:00:00.995838,0.03129035748102652,11,log2,7,20,213,0.7281803568442288,TPESampler,COMPLETE
1716,0.29786308559629987,2025-04-24 22:29:08.339804,2025-04-24 22:29:16.922102,0 days 00:00:08.582298,0.061457172549874504,11,,2,18,1435,0.9423502627028526,TPESampler,COMPLETE
1717,0.36230594174155234,2025-04-24 22:29:09.485251,2025-04-24 22:29:18.080050,0 days 00:00:08.594799,0.09639618057193174,11,,3,15,1464,0.9998123754286181,TPESampler,COMPLETE
1718,0.3463339224275649,2025-04-24 22:29:10.715605,2025-04-24 22:29:17.926227,0 days 00:00:07.210622,0.07290605603338969,12,,4,18,1313,0.9147092081112145,TPESampler,COMPLETE
1719,0.38073033317028976,2025-04-24 22:29:17.150266,2025-04-24 22:29:19.505890,0 days 00:00:02.355624,0.08478531279735453,7,log2,2,9,1441,0.6704235283032906,TPESampler,COMPLETE
1720,0.3449455658458578,2025-04-24 22:29:18.133964,2025-04-24 22:29:24.697238,0 days 00:00:06.563274,0.0669363899780614,12,,3,15,1153,0.8918655180827622,TPESampler,COMPLETE
1721,0.37427764873423136,2025-04-24 22:29:18.307179,2025-04-24 22:29:26.752975,0 days 00:00:08.445796,0.06357155249541878,12,,3,11,1340,0.9922946989374951,TPESampler,COMPLETE
1722,0.3028942099238877,2025-04-24 22:29:19.708032,2025-04-24 22:29:28.226604,0 days 00:00:08.518572,0.06713726946090039,12,,2,13,1422,0.9417496504126651,TPESampler,COMPLETE
1723,0.3567568954462007,2025-04-24 22:29:24.895255,2025-04-24 22:29:32.835197,0 days 00:00:07.939942,0.06844051889774677,12,,4,15,1341,0.9328888715785503,TPESampler,COMPLETE
1724,0.3572467546421473,2025-04-24 22:29:26.947361,2025-04-24 22:29:28.225384,0 days 00:00:01.278023,0.02604444479823569,7,sqrt,3,9,627,0.9249209846683429,TPESampler,COMPLETE
1725,0.3398032954304807,2025-04-24 22:29:28.388201,2025-04-24 22:29:37.086970,0 days 00:00:08.698769,0.044053489543588245,10,,1,11,1489,0.9857081122621159,TPESampler,COMPLETE
1726,0.3514230918951009,2025-04-24 22:29:28.432005,2025-04-24 22:29:36.762098,0 days 00:00:08.330093,0.06007754670998042,12,,3,13,1342,0.9678826779119579,TPESampler,COMPLETE
1727,0.3598064079953469,2025-04-24 22:29:33.029637,2025-04-24 22:29:41.374394,0 days 00:00:08.344757,0.05881070659700575,11,,3,15,1405,0.9929271479614836,TPESampler,COMPLETE
1728,0.38978898877358975,2025-04-24 22:29:36.953138,2025-04-24 22:29:39.792575,0 days 00:00:02.839437,0.02098374778943305,8,,6,7,771,0.6175191620442042,TPESampler,COMPLETE
1729,0.33582027978871964,2025-04-24 22:29:37.337307,2025-04-24 22:29:45.431667,0 days 00:00:08.094360,0.07647641763009697,12,,1,15,1245,0.9904476538520142,TPESampler,COMPLETE
1730,0.33748600505394916,2025-04-24 22:29:39.998322,2025-04-24 22:29:48.436505,0 days 00:00:08.438183,0.04646580863205067,12,,3,15,1481,0.9122851391430452,TPESampler,COMPLETE
1731,0.3000010320726127,2025-04-24 22:29:41.573703,2025-04-24 22:29:50.711636,0 days 00:00:09.137933,0.04433051400237052,12,,2,11,1447,0.9838085137115095,TPESampler,COMPLETE
1732,0.5238426884500927,2025-04-24 22:29:45.631465,2025-04-24 22:29:46.821127,0 days 00:00:01.189662,0.012040681946843174,5,,10,13,210,0.7912332597891579,TPESampler,COMPLETE
1733,0.294986583046409,2025-04-24 22:29:47.010766,2025-04-24 22:29:54.792217,0 days 00:00:07.781451,0.0967020278785012,12,,2,16,1209,0.9992837105565594,TPESampler,COMPLETE
1734,0.3546210850287429,2025-04-24 22:29:48.637102,2025-04-24 22:29:56.158840,0 days 00:00:07.521738,0.05217385277334009,12,,4,16,1231,0.9980668192086716,TPESampler,COMPLETE
1735,0.3559164425652488,2025-04-24 22:29:50.909167,2025-04-24 22:29:57.597591,0 days 00:00:06.688424,0.09641558337073636,11,,3,12,1118,0.9819061269343896,TPESampler,COMPLETE
1736,0.37135081393303515,2025-04-24 22:29:54.994127,2025-04-24 22:30:02.689218,0 days 00:00:07.695091,0.06580834663503428,10,,3,6,1299,0.9894582983291342,TPESampler,COMPLETE
1737,0.29875424111256377,2025-04-24 22:29:56.354566,2025-04-24 22:30:05.407990,0 days 00:00:09.053424,0.06565314379624194,12,,2,13,1408,0.993158858747838,TPESampler,COMPLETE
1738,0.39433442321866,2025-04-24 22:29:57.792337,2025-04-24 22:29:59.836882,0 days 00:00:02.044545,0.011926842636357236,9,sqrt,7,7,1467,0.9793626531530523,TPESampler,COMPLETE
1739,0.3259243426745914,2025-04-24 22:30:00.045033,2025-04-24 22:30:09.257461,0 days 00:00:09.212428,0.08195765241320889,12,,1,12,1411,0.9965197405285114,TPESampler,COMPLETE
1740,0.32244167824270176,2025-04-24 22:30:02.888776,2025-04-24 22:30:10.371588,0 days 00:00:07.482812,0.060048375881097106,12,,1,12,1183,0.9396619039425524,TPESampler,COMPLETE
1741,0.35105514611213534,2025-04-24 22:30:05.614670,2025-04-24 22:30:14.727273,0 days 00:00:09.112603,0.06157637278759256,12,,3,12,1488,0.9271338150327351,TPESampler,COMPLETE
