number,value,datetime_start,datetime_complete,duration,params_learning_rate,params_max_depth,params_max_features,params_min_samples_leaf,params_min_samples_split,params_n_estimators,params_subsample,system_attrs_auto:sampler,state
2114,0.48037781610713454,2025-04-24 22:41:54.685593,2025-04-24 22:41:56.054405,0 days 00:00:01.368812,0.017505552927769685,8,,9,3,166,0.8978039578318893,TPESampler,COMPLETE
2115,0.3178611260396384,2025-04-24 22:41:56.258837,2025-04-24 22:42:03.338477,0 days 00:00:07.079640,0.054824018867070425,12,,1,15,1152,0.9082735566015331,TPESampler,COMPLETE
2116,0.3152902167671377,2025-04-24 22:41:58.187307,2025-04-24 22:42:06.649332,0 days 00:00:08.462025,0.06570547555479744,11,,1,20,1426,0.9586686009916164,TPESampler,COMPLETE
2117,0.30583526820930007,2025-04-24 22:41:59.209485,2025-04-24 22:42:06.806214,0 days 00:00:07.596729,0.06577401313998493,10,,2,19,1355,0.9847541256290906,TPESampler,COMPLETE
2118,0.4371242136976196,2025-04-24 22:42:03.580561,2025-04-24 22:42:06.601862,0 days 00:00:03.021301,0.02345209502627481,9,,10,20,666,0.8351914585164757,TPESampler,COMPLETE
2119,0.43153003938679796,2025-04-24 22:42:06.771563,2025-04-24 22:42:08.586139,0 days 00:00:01.814576,0.07070001304617753,12,sqrt,8,17,689,0.8644682421677721,TPESampler,COMPLETE
2120,0.2890816070758515,2025-04-24 22:42:06.804333,2025-04-24 22:42:16.952497,0 days 00:00:10.148164,0.05494471033144817,12,,2,20,1492,0.9847767738654637,TPESampler,COMPLETE
2121,0.31251653998275486,2025-04-24 22:42:07.046210,2025-04-24 22:42:14.227637,0 days 00:00:07.181427,0.06018927710660519,12,,1,20,1097,0.911893535013193,TPESampler,COMPLETE
2122,0.33103310589538104,2025-04-24 22:42:09.020588,2025-04-24 22:42:16.241965,0 days 00:00:07.221377,0.049440289908399715,10,,1,20,1240,0.94296460217048,TPESampler,COMPLETE
2123,0.681686855106044,2025-04-24 22:42:14.460727,2025-04-24 22:42:15.433120,0 days 00:00:00.972393,0.01153808431859635,10,sqrt,8,15,293,0.8053138289910967,TPESampler,COMPLETE
2124,0.3409267174171026,2025-04-24 22:42:15.752693,2025-04-24 22:42:22.420014,0 days 00:00:06.667321,0.08914559649694573,9,,3,19,1160,0.9852954004300394,TPESampler,COMPLETE
2125,0.3525532680282038,2025-04-24 22:42:16.491739,2025-04-24 22:42:18.804498,0 days 00:00:02.312759,0.024716924643387282,5,sqrt,3,13,1439,0.9262308192417579,TPESampler,COMPLETE
2126,0.3347017802416835,2025-04-24 22:42:17.180456,2025-04-24 22:42:26.572713,0 days 00:00:09.392257,0.04352271572524154,12,,3,18,1500,0.9400369726584156,TPESampler,COMPLETE
2127,0.4446908347221328,2025-04-24 22:42:19.015066,2025-04-24 22:42:23.249846,0 days 00:00:04.234780,0.011246333196735117,7,,10,6,994,0.9212191899816535,TPESampler,COMPLETE
2128,0.6809062319293159,2025-04-24 22:42:22.622180,2025-04-24 22:42:24.257256,0 days 00:00:01.635076,0.03317014856157503,12,log2,10,6,689,0.6296281936569038,TPESampler,COMPLETE
2129,0.2968221357372891,2025-04-24 22:42:23.602452,2025-04-24 22:42:31.952886,0 days 00:00:08.350434,0.05409737110753753,11,,2,18,1314,0.9653304971993053,TPESampler,COMPLETE
2130,0.30133157082936457,2025-04-24 22:42:24.488273,2025-04-24 22:42:31.925879,0 days 00:00:07.437606,0.05577812040986031,11,,2,19,1189,0.9880192110128607,TPESampler,COMPLETE
2131,0.38832035657483155,2025-04-24 22:42:26.780027,2025-04-24 22:42:28.860214,0 days 00:00:02.080187,0.02592897183741008,10,sqrt,7,10,1307,0.9969392290368587,TPESampler,COMPLETE
2132,0.33323511272621864,2025-04-24 22:42:29.065828,2025-04-24 22:42:37.834170,0 days 00:00:08.768342,0.06623693789825898,12,,1,19,1359,0.9876531216196281,TPESampler,COMPLETE
2133,0.31540907871904605,2025-04-24 22:42:32.086027,2025-04-24 22:42:41.666776,0 days 00:00:09.580749,0.05595758134185858,12,,1,18,1480,0.983378714674733,TPESampler,COMPLETE
2134,0.29624052812490137,2025-04-24 22:42:32.127919,2025-04-24 22:42:39.882089,0 days 00:00:07.754170,0.057745826844458614,11,,2,20,1270,0.9809250122285361,TPESampler,COMPLETE
2135,0.3021717010090073,2025-04-24 22:42:38.026630,2025-04-24 22:42:46.123642,0 days 00:00:08.097012,0.043805141943281556,10,,2,20,1431,0.9932486404418882,TPESampler,COMPLETE
2136,0.2949465147628805,2025-04-24 22:42:40.077431,2025-04-24 22:42:48.685507,0 days 00:00:08.608076,0.060990090720337654,12,,2,20,1438,0.918020183046108,TPESampler,COMPLETE
2137,0.42884498784457287,2025-04-24 22:42:41.897155,2025-04-24 22:42:46.158958,0 days 00:00:04.261803,0.08133919105816528,10,,10,16,863,0.9642752386145186,TPESampler,COMPLETE
2138,0.29616667361659366,2025-04-24 22:42:46.314799,2025-04-24 22:42:55.863152,0 days 00:00:09.548353,0.06137134316468066,12,,2,20,1436,0.9573930840848598,TPESampler,COMPLETE
2139,0.29468853929562844,2025-04-24 22:42:46.371282,2025-04-24 22:42:55.571120,0 days 00:00:09.199838,0.04899302300147886,12,,2,20,1393,0.8801743391609674,TPESampler,COMPLETE
2140,0.34018927759679657,2025-04-24 22:42:48.930592,2025-04-24 22:42:57.112829,0 days 00:00:08.182237,0.04547287398729998,12,,3,18,1268,0.9849598349667112,TPESampler,COMPLETE
2141,0.3759700431159061,2025-04-24 22:42:55.827324,2025-04-24 22:43:04.230556,0 days 00:00:08.403232,0.046743498908455326,12,,5,20,1453,0.9662885298456985,TPESampler,COMPLETE
2142,0.3397524214587124,2025-04-24 22:42:56.076405,2025-04-24 22:43:02.880661,0 days 00:00:06.804256,0.05591303107841911,12,,4,19,1178,0.9275726451738064,TPESampler,COMPLETE
2143,0.292107549795583,2025-04-24 22:42:57.330292,2025-04-24 22:43:05.916336,0 days 00:00:08.586044,0.05473821075385071,12,,2,20,1362,0.9817688207372248,TPESampler,COMPLETE
2144,0.3757711517084771,2025-04-24 22:43:03.084058,2025-04-24 22:43:10.585593,0 days 00:00:07.501535,0.07375802639851543,10,,5,20,1450,0.9221495279233181,TPESampler,COMPLETE
2145,0.30243605399744317,2025-04-24 22:43:04.429912,2025-04-24 22:43:08.868957,0 days 00:00:04.439045,0.09495579072827785,11,,2,17,740,0.9057601996665636,TPESampler,COMPLETE
2146,0.3327713463770389,2025-04-24 22:43:06.116540,2025-04-24 22:43:13.797778,0 days 00:00:07.681238,0.03667960532922683,12,,3,19,1212,0.9766217511313906,TPESampler,COMPLETE
2147,0.3229332194078231,2025-04-24 22:43:09.065200,2025-04-24 22:43:16.868191,0 days 00:00:07.802991,0.05158330873428884,11,,1,20,1298,0.9647002393608727,TPESampler,COMPLETE
2148,0.333659501971681,2025-04-24 22:43:10.793272,2025-04-24 22:43:18.113443,0 days 00:00:07.320171,0.04051288122695826,12,,3,19,1206,0.9629863989692767,TPESampler,COMPLETE
2149,0.3404710141808399,2025-04-24 22:43:14.016205,2025-04-24 22:43:20.965755,0 days 00:00:06.949550,0.051595586568403545,9,,4,18,1395,0.9301299354927937,TPESampler,COMPLETE
2150,0.3398441200522163,2025-04-24 22:43:17.107868,2025-04-24 22:43:25.480542,0 days 00:00:08.372674,0.06121840125701179,10,,3,20,1473,0.9651190790525808,TPESampler,COMPLETE
2151,0.30577651471462064,2025-04-24 22:43:18.323643,2025-04-24 22:43:23.745732,0 days 00:00:05.422089,0.05991931980446475,10,,2,20,911,0.9575910998217537,TPESampler,COMPLETE
2152,0.3733888883658555,2025-04-24 22:43:21.164854,2025-04-24 22:43:22.700238,0 days 00:00:01.535384,0.0885964523618581,12,log2,2,17,920,0.7976723088066848,TPESampler,COMPLETE
2153,0.34367999131383603,2025-04-24 22:43:22.905763,2025-04-24 22:43:30.974572,0 days 00:00:08.068809,0.05514010521435382,10,,4,20,1488,0.9431232401267914,TPESampler,COMPLETE
2154,0.35872330266128155,2025-04-24 22:43:23.952349,2025-04-24 22:43:26.505025,0 days 00:00:02.552676,0.03812812743395701,12,sqrt,1,20,1300,0.982492658652136,TPESampler,COMPLETE
2155,0.33005518603553946,2025-04-24 22:43:25.685720,2025-04-24 22:43:34.344490,0 days 00:00:08.658770,0.0531010540678976,12,,3,19,1456,0.9611827141036682,TPESampler,COMPLETE
2156,0.298678625135588,2025-04-24 22:43:26.702566,2025-04-24 22:43:36.022645,0 days 00:00:09.320079,0.03824283960388012,12,,2,20,1472,0.997276530379335,TPESampler,COMPLETE
2157,0.30177129969307764,2025-04-24 22:43:31.182038,2025-04-24 22:43:39.522239,0 days 00:00:08.340201,0.055968159184684764,11,,2,20,1403,0.9467986566401799,TPESampler,COMPLETE
2158,0.36125247303787633,2025-04-24 22:43:34.554993,2025-04-24 22:43:37.135284,0 days 00:00:02.580291,0.09432371078334982,11,sqrt,1,17,1441,0.9346843010756908,TPESampler,COMPLETE
2159,0.2967991056838911,2025-04-24 22:43:36.232231,2025-04-24 22:43:45.088739,0 days 00:00:08.856508,0.0537694349749476,12,,2,19,1476,0.9498689567121439,TPESampler,COMPLETE
2160,0.3333836101441383,2025-04-24 22:43:37.336170,2025-04-24 22:43:46.169369,0 days 00:00:08.833199,0.04978979481093944,12,,3,20,1492,0.9658148727176559,TPESampler,COMPLETE
2161,0.35612716870204175,2025-04-24 22:43:39.721743,2025-04-24 22:43:47.558880,0 days 00:00:07.837137,0.06956446624065644,12,,4,20,1295,0.9960432572150465,TPESampler,COMPLETE
2162,0.2926426037060763,2025-04-24 22:43:45.301868,2025-04-24 22:43:53.731435,0 days 00:00:08.429567,0.06758345323105906,11,,2,19,1401,0.998595941171667,TPESampler,COMPLETE
2163,0.3346337846006144,2025-04-24 22:43:46.392668,2025-04-24 22:43:55.102142,0 days 00:00:08.709474,0.04971546352448289,12,,3,17,1480,0.9333113287992257,TPESampler,COMPLETE
2164,0.3302179757423692,2025-04-24 22:43:47.750269,2025-04-24 22:43:54.444296,0 days 00:00:06.694027,0.05931819159946243,12,,3,20,1097,0.9868271059348979,TPESampler,COMPLETE
2165,0.3341650285314841,2025-04-24 22:43:53.930287,2025-04-24 22:44:01.561511,0 days 00:00:07.631224,0.03512513226002887,11,,3,20,1331,0.9526725107193427,TPESampler,COMPLETE
2166,0.3103364193313936,2025-04-24 22:43:54.665733,2025-04-24 22:44:03.001246,0 days 00:00:08.335513,0.036614893149257345,12,,1,20,1328,0.9517279681940356,TPESampler,COMPLETE
2167,0.3478749405716487,2025-04-24 22:43:55.307098,2025-04-24 22:44:03.845489,0 days 00:00:08.538391,0.06623140038737572,12,,3,18,1363,0.9995406101752657,TPESampler,COMPLETE
2168,0.31873235825031315,2025-04-24 22:44:01.772269,2025-04-24 22:44:11.175369,0 days 00:00:09.403100,0.04617960936586743,12,,1,19,1369,0.996344032985513,TPESampler,COMPLETE
2169,0.39430185983718513,2025-04-24 22:44:03.208214,2025-04-24 22:44:07.236874,0 days 00:00:04.028660,0.012898179479566304,4,,5,20,1396,0.6813367954839403,TPESampler,COMPLETE
2170,0.6306238308370342,2025-04-24 22:44:04.082533,2025-04-24 22:44:05.215175,0 days 00:00:01.132642,0.013827183969930004,11,log2,3,13,410,0.8966414211627253,TPESampler,COMPLETE
2171,0.3244333785765057,2025-04-24 22:44:05.431674,2025-04-24 22:44:13.682802,0 days 00:00:08.251128,0.06321064738153215,12,,1,20,1226,0.9972616593314858,TPESampler,COMPLETE
2172,0.32747204518308237,2025-04-24 22:44:07.440277,2025-04-24 22:44:15.255425,0 days 00:00:07.815148,0.04218859178231678,12,,3,20,1326,0.923663304112992,TPESampler,COMPLETE
2173,0.33658728297118257,2025-04-24 22:44:11.381728,2025-04-24 22:44:19.911073,0 days 00:00:08.529345,0.04613603946301936,12,,3,20,1398,0.9893445105000542,TPESampler,COMPLETE
2174,0.31786294766243584,2025-04-24 22:44:13.892253,2025-04-24 22:44:22.153357,0 days 00:00:08.261104,0.05940140029376294,12,,1,20,1334,0.9225202927057056,TPESampler,COMPLETE
2175,0.3508155845747393,2025-04-24 22:44:15.449312,2025-04-24 22:44:21.032935,0 days 00:00:05.583623,0.09874444154682743,12,,4,18,832,0.9937219402671291,TPESampler,COMPLETE
2176,0.2925044122861906,2025-04-24 22:44:20.107225,2025-04-24 22:44:26.613063,0 days 00:00:06.505838,0.09744046851166945,11,,2,20,999,0.9768889791467683,TPESampler,COMPLETE
2177,0.3008630987159121,2025-04-24 22:44:21.233430,2025-04-24 22:44:30.681991,0 days 00:00:09.448561,0.04481200999013385,11,,2,19,1460,0.9992405105691007,TPESampler,COMPLETE
2178,0.3614521216437985,2025-04-24 22:44:22.370242,2025-04-24 22:44:24.679549,0 days 00:00:02.309307,0.05086409516799528,12,sqrt,1,18,1425,0.9617164822732905,TPESampler,COMPLETE
2179,0.36695177558285724,2025-04-24 22:44:24.890758,2025-04-24 22:44:26.877482,0 days 00:00:01.986724,0.05629751774379775,12,log2,1,18,1336,0.9772858112049745,TPESampler,COMPLETE
2180,0.2953868103865795,2025-04-24 22:44:26.826355,2025-04-24 22:44:34.705951,0 days 00:00:07.879596,0.05749473817226079,12,,2,20,1202,0.9114386403870606,TPESampler,COMPLETE
2181,0.49342457424190944,2025-04-24 22:44:27.107016,2025-04-24 22:44:28.671428,0 days 00:00:01.564412,0.06264029796238607,7,log2,10,9,1024,0.7754071757286859,TPESampler,COMPLETE
2182,0.3344254862555399,2025-04-24 22:44:28.882581,2025-04-24 22:44:31.357527,0 days 00:00:02.474946,0.07748564190836987,11,sqrt,2,20,1416,0.9997380983373352,TPESampler,COMPLETE
2183,0.3688252984307852,2025-04-24 22:44:30.881831,2025-04-24 22:44:32.942980,0 days 00:00:02.061149,0.035960690703951186,10,log2,3,20,1286,0.9230928563213182,TPESampler,COMPLETE
2184,0.3423923119262186,2025-04-24 22:44:31.589808,2025-04-24 22:44:37.514964,0 days 00:00:05.925156,0.09812868923565664,12,,3,18,1012,0.8760373128818532,TPESampler,COMPLETE
2185,0.3462518288487993,2025-04-24 22:44:33.157007,2025-04-24 22:44:41.318100,0 days 00:00:08.161093,0.05055646034562732,11,,3,20,1376,0.9954586053172284,TPESampler,COMPLETE
2186,0.2970458515880931,2025-04-24 22:44:34.908051,2025-04-24 22:44:42.538452,0 days 00:00:07.630401,0.05044238444904386,12,,2,17,1246,0.9450416120008285,TPESampler,COMPLETE
2187,0.3166018603973718,2025-04-24 22:44:37.705979,2025-04-24 22:44:45.092326,0 days 00:00:07.386347,0.04737590196664863,12,,1,17,1228,0.898429630316345,TPESampler,COMPLETE
2188,0.3500516427243007,2025-04-24 22:44:41.528307,2025-04-24 22:44:49.876331,0 days 00:00:08.348024,0.0684763769735164,12,,3,17,1435,0.9323421689481056,TPESampler,COMPLETE
2189,0.3028634724666699,2025-04-24 22:44:42.735421,2025-04-24 22:44:50.881119,0 days 00:00:08.145698,0.06839530208536784,10,,2,20,1458,0.9826624182048374,TPESampler,COMPLETE
2190,0.340557354198871,2025-04-24 22:44:45.293720,2025-04-24 22:44:53.337124,0 days 00:00:08.043404,0.06992039721136438,12,,3,20,1350,0.9587284262164931,TPESampler,COMPLETE
2191,0.3501537637598779,2025-04-24 22:44:50.074199,2025-04-24 22:44:58.506853,0 days 00:00:08.432654,0.0875893474646611,12,,3,18,1462,0.9494688846518038,TPESampler,COMPLETE
2192,0.28994574365919124,2025-04-24 22:44:51.094145,2025-04-24 22:44:58.556064,0 days 00:00:07.461919,0.05749571387802941,12,,2,20,1197,0.9838160952903252,TPESampler,COMPLETE
2193,0.3468087070124471,2025-04-24 22:44:53.544670,2025-04-24 22:45:00.827886,0 days 00:00:07.283216,0.09339487192108302,12,,3,20,1232,0.9355131927859172,TPESampler,COMPLETE
2194,0.3270842672236585,2025-04-24 22:44:58.687936,2025-04-24 22:45:04.615461,0 days 00:00:05.927525,0.0751247613535467,11,,1,16,859,0.9600215681807459,TPESampler,COMPLETE
2195,0.3738793210089813,2025-04-24 22:44:58.737358,2025-04-24 22:45:00.500232,0 days 00:00:01.762874,0.031882714542817464,7,sqrt,4,3,868,0.6057277567397297,TPESampler,COMPLETE
2196,0.3198442489594396,2025-04-24 22:45:00.697928,2025-04-24 22:45:08.170162,0 days 00:00:07.472234,0.0635467640868517,12,,1,20,1140,0.9080292843589884,TPESampler,COMPLETE
2197,0.408871530392474,2025-04-24 22:45:01.102189,2025-04-24 22:45:02.839932,0 days 00:00:01.737743,0.09334970366906178,11,log2,7,5,1384,0.8784110606514245,TPESampler,COMPLETE
2198,0.32361942700784824,2025-04-24 22:45:03.044970,2025-04-24 22:45:12.403420,0 days 00:00:09.358450,0.07522380983928185,12,,1,20,1402,0.9465177425662217,TPESampler,COMPLETE
2199,0.4187695795061351,2025-04-24 22:45:04.803512,2025-04-24 22:45:06.643885,0 days 00:00:01.840373,0.025905984840141182,8,log2,2,14,1395,0.8013116080936457,TPESampler,COMPLETE
2200,0.37443186358216024,2025-04-24 22:45:06.957043,2025-04-24 22:45:08.981628,0 days 00:00:02.024585,0.06858779584437252,10,log2,2,17,1133,0.9066171118826227,TPESampler,COMPLETE
2201,0.389216999622372,2025-04-24 22:45:08.379551,2025-04-24 22:45:10.547557,0 days 00:00:02.168006,0.03586969601793385,9,log2,3,5,1396,0.6383565273151464,TPESampler,COMPLETE
2202,0.3124091501424928,2025-04-24 22:45:09.205680,2025-04-24 22:45:16.745673,0 days 00:00:07.539993,0.08591015621235341,10,,2,20,1396,0.893124187719406,TPESampler,COMPLETE
2203,0.371358214919284,2025-04-24 22:45:10.746691,2025-04-24 22:45:16.410073,0 days 00:00:05.663382,0.017357080594223997,10,,5,5,1489,0.6481417669547149,TPESampler,COMPLETE
2204,0.3338218587787382,2025-04-24 22:45:12.612740,2025-04-24 22:45:18.821602,0 days 00:00:06.208862,0.05163346762950791,11,,1,18,962,0.9792654958542433,TPESampler,COMPLETE
2205,0.34462822521217507,2025-04-24 22:45:16.612201,2025-04-24 22:45:23.152429,0 days 00:00:06.540228,0.07110335813763263,12,,4,20,1174,0.8695051282663864,TPESampler,COMPLETE
2206,0.39100285736304746,2025-04-24 22:45:17.010331,2025-04-24 22:45:21.337502,0 days 00:00:04.327171,0.08092290587997818,12,,5,10,973,0.6591774007192135,TPESampler,COMPLETE
2207,0.3262004317485431,2025-04-24 22:45:19.043380,2025-04-24 22:45:27.749161,0 days 00:00:08.705781,0.0714266115737509,12,,1,17,1460,0.9001257157142802,TPESampler,COMPLETE
2208,0.3382564012803571,2025-04-24 22:45:21.551945,2025-04-24 22:45:27.907404,0 days 00:00:06.355459,0.09821617030094042,10,,1,20,1121,0.9521829361060268,TPESampler,COMPLETE
2209,0.29965269923507554,2025-04-24 22:45:23.360490,2025-04-24 22:45:32.169589,0 days 00:00:08.809099,0.05787542380201741,12,,2,20,1436,0.9609443368200389,TPESampler,COMPLETE
2210,0.3153605844269308,2025-04-24 22:45:27.925849,2025-04-24 22:45:34.361201,0 days 00:00:06.435352,0.09168939247462292,12,,1,20,1038,0.9008980856936339,TPESampler,COMPLETE
2211,0.3404163976155232,2025-04-24 22:45:28.129543,2025-04-24 22:45:34.860282,0 days 00:00:06.730739,0.06952847005951655,10,,4,17,1175,0.9777807622120464,TPESampler,COMPLETE
2212,0.41078834155530575,2025-04-24 22:45:32.364499,2025-04-24 22:45:33.777718,0 days 00:00:01.413219,0.017481521541433027,11,,6,2,203,0.7390545183213032,TPESampler,COMPLETE
2213,0.4591375428265818,2025-04-24 22:45:33.972824,2025-04-24 22:45:36.265487,0 days 00:00:02.292663,0.018180016779867976,4,sqrt,10,20,1274,0.9273480415879531,TPESampler,COMPLETE
2214,0.29171815597927636,2025-04-24 22:45:34.596753,2025-04-24 22:45:42.558381,0 days 00:00:07.961628,0.04248631725257903,12,,2,20,1207,0.9175406984218338,TPESampler,COMPLETE
2215,0.338307025811504,2025-04-24 22:45:35.129602,2025-04-24 22:45:42.530706,0 days 00:00:07.401104,0.05583940061144254,10,,3,20,1199,0.9687182425982526,TPESampler,COMPLETE
2216,0.4380489580520231,2025-04-24 22:45:36.469590,2025-04-24 22:45:37.732080,0 days 00:00:01.262490,0.03997220335771912,5,sqrt,9,5,636,0.8942276360827631,TPESampler,COMPLETE
2217,0.6195827082379818,2025-04-24 22:45:37.938910,2025-04-24 22:45:39.000646,0 days 00:00:01.061736,0.057008354330532744,12,log2,9,19,458,0.8627863394214624,TPESampler,COMPLETE
2218,0.6686612026421661,2025-04-24 22:45:39.210565,2025-04-24 22:45:40.057940,0 days 00:00:00.847375,0.08984167473369176,6,log2,9,17,211,0.9138575716608899,TPESampler,COMPLETE
2219,0.38982931811306787,2025-04-24 22:45:40.275850,2025-04-24 22:45:45.858552,0 days 00:00:05.582702,0.010590425312026234,6,,6,14,1336,0.8900572481849882,TPESampler,COMPLETE
2220,0.31808969892116123,2025-04-24 22:45:42.773802,2025-04-24 22:45:49.717666,0 days 00:00:06.943864,0.036768391960929445,12,,1,20,1056,0.8962103715350314,TPESampler,COMPLETE
2221,0.3744875151809149,2025-04-24 22:45:42.823830,2025-04-24 22:45:44.888787,0 days 00:00:02.064957,0.041727762489630615,12,log2,4,18,1228,0.9485250079761749,TPESampler,COMPLETE
2222,0.34049835046432264,2025-04-24 22:45:45.101114,2025-04-24 22:45:51.047805,0 days 00:00:05.946691,0.06277654350026321,12,,4,18,906,0.988263752838991,TPESampler,COMPLETE
2223,0.3259346022004353,2025-04-24 22:45:46.055663,2025-04-24 22:45:53.244818,0 days 00:00:07.189155,0.035254345102039085,12,,3,20,1147,0.9483774471774807,TPESampler,COMPLETE
2224,0.3206295725592775,2025-04-24 22:45:49.916112,2025-04-24 22:45:56.907567,0 days 00:00:06.991455,0.040235587076535885,12,,1,20,1063,0.9459112581896308,TPESampler,COMPLETE
2225,0.3422204013525993,2025-04-24 22:45:51.252030,2025-04-24 22:45:53.074962,0 days 00:00:01.822932,0.09973639781857559,11,sqrt,4,17,999,0.870989431812101,TPESampler,COMPLETE
2226,0.3796691761430453,2025-04-24 22:45:53.276559,2025-04-24 22:45:56.628026,0 days 00:00:03.351467,0.0546228055539388,12,,6,12,614,0.7998029835229129,TPESampler,COMPLETE
2227,0.2890613644006451,2025-04-24 22:45:53.462141,2025-04-24 22:46:01.892278,0 days 00:00:08.430137,0.0661238033693089,12,,2,20,1318,0.9457822858647915,TPESampler,COMPLETE
2228,0.3312300080855801,2025-04-24 22:45:56.825725,2025-04-24 22:46:05.530835,0 days 00:00:08.705110,0.033045205878582444,10,,1,20,1467,0.9762252019491867,TPESampler,COMPLETE
2229,0.439029979455782,2025-04-24 22:45:57.218496,2025-04-24 22:46:00.034560,0 days 00:00:02.816064,0.07013203295320929,3,,8,2,982,0.9257853383482013,TPESampler,COMPLETE
2230,0.4630213757967741,2025-04-24 22:46:00.243194,2025-04-24 22:46:01.922993,0 days 00:00:01.679799,0.0878397268263857,12,log2,9,7,1287,0.7097668610629294,TPESampler,COMPLETE
2231,0.33866708132264567,2025-04-24 22:46:02.066011,2025-04-24 22:46:08.631707,0 days 00:00:06.565696,0.0576676568735688,12,,3,20,1008,0.9934879780850516,TPESampler,COMPLETE
2232,0.29795218078948815,2025-04-24 22:46:02.110424,2025-04-24 22:46:08.714288,0 days 00:00:06.603864,0.04434053085662329,12,,2,20,1029,0.9408939999465057,TPESampler,COMPLETE
2233,0.29441006728361585,2025-04-24 22:46:05.739392,2025-04-24 22:46:12.719815,0 days 00:00:06.980423,0.054610926058537235,12,,2,19,1127,0.8802705180431647,TPESampler,COMPLETE
2234,0.39236381654337804,2025-04-24 22:46:08.824935,2025-04-24 22:46:10.753744,0 days 00:00:01.928809,0.015182752881233191,10,sqrt,1,20,932,0.712436634210112,TPESampler,COMPLETE
2235,0.33760309974470065,2025-04-24 22:46:08.972877,2025-04-24 22:46:17.896120,0 days 00:00:08.923243,0.07114793508405544,12,,3,20,1365,0.9752872582900982,TPESampler,COMPLETE
2236,0.3731954025694118,2025-04-24 22:46:10.972897,2025-04-24 22:46:12.888295,0 days 00:00:01.915398,0.08871754311143223,12,sqrt,5,20,1166,0.9107137528149507,TPESampler,COMPLETE
2237,0.34056812264238084,2025-04-24 22:46:12.896587,2025-04-24 22:46:16.548147,0 days 00:00:03.651560,0.09870442478302079,5,,4,17,1058,0.830778299150509,TPESampler,COMPLETE
