number,value,datetime_start,datetime_complete,duration,params_learning_rate,params_max_depth,params_max_features,params_min_samples_leaf,params_min_samples_split,params_n_estimators,params_subsample,system_attrs_auto:sampler,state
1246,0.3513388209866679,2025-04-24 22:13:18.751087,2025-04-24 22:13:25.244915,0 days 00:00:06.493828,0.07673949170270977,12,,3,13,1129,0.9182626128360024,TPESampler,COMPLETE
1247,0.3607325355576016,2025-04-24 22:13:22.479765,2025-04-24 22:13:28.953474,0 days 00:00:06.473709,0.0823044546198473,12,,3,14,1027,0.9954325858441988,TPESampler,COMPLETE
1248,0.3193617112095139,2025-04-24 22:13:23.652264,2025-04-24 22:13:31.450327,0 days 00:00:07.798063,0.04535286207128494,12,,1,11,1283,0.9416102548657379,TPESampler,COMPLETE
1249,0.3067821990003914,2025-04-24 22:13:25.429751,2025-04-24 22:13:32.665499,0 days 00:00:07.235748,0.09924910727370236,12,,2,14,1222,0.9284070379590182,TPESampler,COMPLETE
1250,0.30703970000197567,2025-04-24 22:13:29.146101,2025-04-24 22:13:37.895295,0 days 00:00:08.749194,0.02255638994432421,11,,2,9,1490,0.9880002529432558,TPESampler,COMPLETE
1251,0.2997679276338639,2025-04-24 22:13:31.671786,2025-04-24 22:13:38.867057,0 days 00:00:07.195271,0.06403727112392622,12,,2,9,1149,0.967183282615913,TPESampler,COMPLETE
1252,0.29894272697042434,2025-04-24 22:13:32.884830,2025-04-24 22:13:39.261866,0 days 00:00:06.377036,0.06389845150054128,12,,2,12,981,0.9977930437733821,TPESampler,COMPLETE
1253,0.3674796273992578,2025-04-24 22:13:38.070782,2025-04-24 22:13:45.536221,0 days 00:00:07.465439,0.07743783174733847,12,,3,5,1215,0.9388017627422932,TPESampler,COMPLETE
1254,0.39959648586760105,2025-04-24 22:13:39.055907,2025-04-24 22:13:39.942763,0 days 00:00:00.886856,0.09459100929409375,7,sqrt,5,14,169,0.6445427874194016,TPESampler,COMPLETE
1255,0.34725712273587384,2025-04-24 22:13:39.479691,2025-04-24 22:13:41.607770,0 days 00:00:02.128079,0.05309053965467915,11,log2,3,13,1474,0.9702048345280067,TPESampler,COMPLETE
1256,0.3444685654569382,2025-04-24 22:13:40.150885,2025-04-24 22:13:47.009614,0 days 00:00:06.858729,0.0358472643556441,10,,3,12,1364,0.8605504689834506,TPESampler,COMPLETE
1257,0.3518462756004552,2025-04-24 22:13:41.794755,2025-04-24 22:13:49.751986,0 days 00:00:07.957231,0.056545636209875114,12,,3,10,1409,0.8996467504812745,TPESampler,COMPLETE
1258,0.35924633410054674,2025-04-24 22:13:45.726089,2025-04-24 22:13:52.765470,0 days 00:00:07.039381,0.0862047233152373,12,,3,15,1406,0.8000501865203142,TPESampler,COMPLETE
1259,0.3713002759661071,2025-04-24 22:13:47.198341,2025-04-24 22:13:48.165245,0 days 00:00:00.966904,0.08854181662692487,4,sqrt,3,16,366,0.8651935457836499,TPESampler,COMPLETE
1260,0.2976629964505548,2025-04-24 22:13:48.365220,2025-04-24 22:13:57.349540,0 days 00:00:08.984320,0.0878525411062842,12,,2,11,1495,0.9621371463714339,TPESampler,COMPLETE
1261,0.3280328898094237,2025-04-24 22:13:49.928765,2025-04-24 22:13:58.551024,0 days 00:00:08.622259,0.07308841020741283,12,,1,8,1335,0.9882009791503343,TPESampler,COMPLETE
1262,0.30776461001716193,2025-04-24 22:13:52.950304,2025-04-24 22:14:00.928092,0 days 00:00:07.977788,0.04152845905650397,10,,2,10,1459,0.9294335039689892,TPESampler,COMPLETE
1263,0.3339061145346713,2025-04-24 22:13:57.534098,2025-04-24 22:13:59.775534,0 days 00:00:02.241436,0.09948277640751524,9,sqrt,2,15,1339,0.8919645178462411,TPESampler,COMPLETE
1264,0.32177897376415165,2025-04-24 22:13:58.752321,2025-04-24 22:14:05.850055,0 days 00:00:07.097734,0.07021501871359256,12,,1,15,1078,0.9942846024416981,TPESampler,COMPLETE
1265,0.29957465697580266,2025-04-24 22:13:59.976204,2025-04-24 22:14:08.815270,0 days 00:00:08.839066,0.05341515583321344,12,,2,10,1413,0.9905060678613283,TPESampler,COMPLETE
1266,0.3466130630640381,2025-04-24 22:14:01.127451,2025-04-24 22:14:08.942732,0 days 00:00:07.815281,0.07058901074405967,11,,1,12,1285,0.9959135960411056,TPESampler,COMPLETE
1267,0.300306022619145,2025-04-24 22:14:06.046379,2025-04-24 22:14:15.100280,0 days 00:00:09.053901,0.06691999810321389,12,,2,11,1466,0.976656380222039,TPESampler,COMPLETE
1268,0.29985100894836697,2025-04-24 22:14:08.992856,2025-04-24 22:14:16.464429,0 days 00:00:07.471573,0.06262995621528052,12,,2,12,1169,0.9898772481825036,TPESampler,COMPLETE
1269,0.32697955810128393,2025-04-24 22:14:09.209919,2025-04-24 22:14:18.764443,0 days 00:00:09.554524,0.056943083466810644,12,,1,12,1449,0.9992705929590427,TPESampler,COMPLETE
1270,0.3512768677350227,2025-04-24 22:14:15.302827,2025-04-24 22:14:21.614267,0 days 00:00:06.311440,0.09140723574810487,10,,3,14,1178,0.9143753296770541,TPESampler,COMPLETE
1271,0.40950842445658914,2025-04-24 22:14:16.647640,2025-04-24 22:14:24.280258,0 days 00:00:07.632618,0.06992610300254869,10,,5,10,1475,0.9404529642613925,TPESampler,COMPLETE
1272,0.36034345000785467,2025-04-24 22:14:18.952964,2025-04-24 22:14:26.929693,0 days 00:00:07.976729,0.05007111955923295,12,,3,13,1257,0.9990816639362425,TPESampler,COMPLETE
1273,0.3444823434625582,2025-04-24 22:14:21.799913,2025-04-24 22:14:28.228816,0 days 00:00:06.428903,0.05269078042680688,10,,1,7,1088,0.9812060561046577,TPESampler,COMPLETE
1274,0.3178225934622889,2025-04-24 22:14:24.461609,2025-04-24 22:14:30.910905,0 days 00:00:06.449296,0.06399282215819664,11,,2,7,1119,0.9082527495393857,TPESampler,COMPLETE
1275,0.38006824699360725,2025-04-24 22:14:27.119739,2025-04-24 22:14:33.814319,0 days 00:00:06.694580,0.07882612779158939,11,,4,8,1125,0.9889281566254458,TPESampler,COMPLETE
1276,0.31631577632942964,2025-04-24 22:14:28.427521,2025-04-24 22:14:34.047356,0 days 00:00:05.619835,0.0631844334395538,10,,2,14,1102,0.8575407507585753,TPESampler,COMPLETE
1277,0.35516521014545216,2025-04-24 22:14:31.104403,2025-04-24 22:14:37.229246,0 days 00:00:06.124843,0.09816048387535078,12,,3,10,1047,0.9247780966099868,TPESampler,COMPLETE
1278,0.30838697626461864,2025-04-24 22:14:34.006253,2025-04-24 22:14:42.715645,0 days 00:00:08.709392,0.05850123687279239,12,,2,8,1499,0.9041962241635307,TPESampler,COMPLETE
1279,0.3298309438956667,2025-04-24 22:14:34.311228,2025-04-24 22:14:41.926100,0 days 00:00:07.614872,0.09260178015399644,12,,1,14,1258,0.9248980603290716,TPESampler,COMPLETE
1280,0.33141232991245545,2025-04-24 22:14:37.457099,2025-04-24 22:14:43.207989,0 days 00:00:05.750890,0.0963996239949564,12,,1,10,957,0.8488142771812204,TPESampler,COMPLETE
1281,0.33375415688922794,2025-04-24 22:14:42.113762,2025-04-24 22:14:51.724181,0 days 00:00:09.610419,0.04700669790750588,11,,1,4,1500,0.9998541451026299,TPESampler,COMPLETE
1282,0.3164780133267745,2025-04-24 22:14:42.907827,2025-04-24 22:14:48.629043,0 days 00:00:05.721216,0.036306153823489146,12,,2,5,880,0.9807709845275837,TPESampler,COMPLETE
1283,0.3602064018565097,2025-04-24 22:14:43.423961,2025-04-24 22:14:50.069105,0 days 00:00:06.645144,0.09842769981787541,10,,3,12,1226,0.9771658016451091,TPESampler,COMPLETE
1284,0.40181144203099906,2025-04-24 22:14:48.829016,2025-04-24 22:14:52.004627,0 days 00:00:03.175611,0.011712729560102556,4,,2,5,881,0.9871292003821817,TPESampler,COMPLETE
1285,0.3257531884949792,2025-04-24 22:14:50.256718,2025-04-24 22:14:58.684023,0 days 00:00:08.427305,0.04720508149631362,12,,1,13,1400,0.9131917995808844,TPESampler,COMPLETE
1286,0.34873014104775774,2025-04-24 22:14:51.952734,2025-04-24 22:14:58.646290,0 days 00:00:06.693556,0.0377129426149969,12,,3,8,1110,0.9611946675617974,TPESampler,COMPLETE
1287,0.5397942184757102,2025-04-24 22:14:52.232759,2025-04-24 22:14:53.455391,0 days 00:00:01.222632,0.03439759306444498,3,log2,4,6,675,0.7127029827781548,TPESampler,COMPLETE
1288,0.3120476722891272,2025-04-24 22:14:53.708019,2025-04-24 22:15:00.814610,0 days 00:00:07.106591,0.09154267228619069,10,,2,9,1261,0.9747390743534345,TPESampler,COMPLETE
1289,0.3405883463213832,2025-04-24 22:14:58.792684,2025-04-24 22:15:00.787272,0 days 00:00:01.994588,0.05014521075997091,10,,2,6,257,0.7704997382189714,TPESampler,COMPLETE
1290,0.3162532129823677,2025-04-24 22:14:58.846577,2025-04-24 22:15:06.644057,0 days 00:00:07.797480,0.08837350524590876,10,,2,7,1442,0.9026665388365105,TPESampler,COMPLETE
1291,0.3310962214337083,2025-04-24 22:15:00.944442,2025-04-24 22:15:08.532159,0 days 00:00:07.587717,0.08784586201606916,12,,1,9,1219,0.9309882907340675,TPESampler,COMPLETE
1292,0.3104080101559982,2025-04-24 22:15:00.995121,2025-04-24 22:15:08.590538,0 days 00:00:07.595417,0.07204745312890531,12,,2,8,1153,0.9942710523716668,TPESampler,COMPLETE
1293,0.3585084123797978,2025-04-24 22:15:06.834060,2025-04-24 22:15:12.699663,0 days 00:00:05.865603,0.06872030834366542,10,,3,11,1017,0.9927425298976584,TPESampler,COMPLETE
1294,0.3625243896205537,2025-04-24 22:15:08.709381,2025-04-24 22:15:15.837730,0 days 00:00:07.128349,0.07037097275968016,10,,3,12,1272,0.9819589721634633,TPESampler,COMPLETE
1295,0.3256432955404114,2025-04-24 22:15:08.886906,2025-04-24 22:15:17.816199,0 days 00:00:08.929293,0.09162641047883952,12,,1,13,1328,0.9966294443701327,TPESampler,COMPLETE
1296,0.3420184452292882,2025-04-24 22:15:12.876648,2025-04-24 22:15:20.078558,0 days 00:00:07.201910,0.050984134232861564,12,,3,10,1208,0.9029750423026027,TPESampler,COMPLETE
1297,0.3235918321983371,2025-04-24 22:15:16.046627,2025-04-24 22:15:17.909478,0 days 00:00:01.862851,0.06059015168113344,11,sqrt,3,12,1187,0.8752267180722743,TPESampler,COMPLETE
1298,0.354738519982128,2025-04-24 22:15:17.985027,2025-04-24 22:15:25.791819,0 days 00:00:07.806792,0.07066736504407344,12,,3,12,1263,0.9564394083749403,TPESampler,COMPLETE
1299,0.3721708124489414,2025-04-24 22:15:18.100784,2025-04-24 22:15:19.949790,0 days 00:00:01.849006,0.08668418495733118,12,log2,1,9,1073,0.9312207657476111,TPESampler,COMPLETE
1300,0.8324178493650906,2025-04-24 22:15:20.205191,2025-04-24 22:15:21.399350,0 days 00:00:01.194159,0.014711190826227674,5,log2,9,10,392,0.9662254580032259,TPESampler,COMPLETE
1301,0.3453391477744445,2025-04-24 22:15:20.447733,2025-04-24 22:15:28.175866,0 days 00:00:07.728133,0.04112053981228208,9,,3,14,1470,0.9605250087497668,TPESampler,COMPLETE
1302,0.31520190713898116,2025-04-24 22:15:21.593102,2025-04-24 22:15:26.752666,0 days 00:00:05.159564,0.09543072925187142,10,,2,14,909,0.9591169160668419,TPESampler,COMPLETE
1303,0.364938430402771,2025-04-24 22:15:25.991329,2025-04-24 22:15:34.069762,0 days 00:00:08.078433,0.08023054804080727,12,,3,14,1291,0.9986943965106013,TPESampler,COMPLETE
1304,0.3070333899412187,2025-04-24 22:15:26.947940,2025-04-24 22:15:34.024882,0 days 00:00:07.076942,0.04063493607860115,12,,2,12,1470,0.7441240122337511,TPESampler,COMPLETE
1305,0.3557067448438315,2025-04-24 22:15:28.364280,2025-04-24 22:15:33.747927,0 days 00:00:05.383647,0.06616223171216704,10,,4,10,1058,0.9228161436669017,TPESampler,COMPLETE
1306,0.34050646298689163,2025-04-24 22:15:33.939582,2025-04-24 22:15:40.251724,0 days 00:00:06.312142,0.06657055079068906,10,,1,12,1081,0.8952818516445543,TPESampler,COMPLETE
1307,0.3429701884037562,2025-04-24 22:15:34.203673,2025-04-24 22:15:43.563246,0 days 00:00:09.359573,0.07588798958928471,12,,1,11,1497,0.8905268764810795,TPESampler,COMPLETE
1308,0.648176688662303,2025-04-24 22:15:34.323386,2025-04-24 22:15:36.208866,0 days 00:00:01.885480,0.01668208654337127,7,log2,10,20,1308,0.7286738221192643,TPESampler,COMPLETE
1309,0.39257036555610375,2025-04-24 22:15:36.394991,2025-04-24 22:15:39.464849,0 days 00:00:03.069858,0.042257329155081826,3,,5,16,1374,0.6699296588958431,TPESampler,COMPLETE
1310,0.3598691111287142,2025-04-24 22:15:39.650388,2025-04-24 22:15:41.779817,0 days 00:00:02.129429,0.06318503162566406,12,log2,2,3,1388,0.933065226155195,TPESampler,COMPLETE
1311,0.3591665002051351,2025-04-24 22:15:40.450156,2025-04-24 22:15:47.039252,0 days 00:00:06.589096,0.05717488194499828,11,,3,10,1153,0.9179669385870851,TPESampler,COMPLETE
1312,0.34770340121238685,2025-04-24 22:15:41.957613,2025-04-24 22:15:50.397615,0 days 00:00:08.440002,0.063978860646926,11,,3,13,1471,0.9507563325125804,TPESampler,COMPLETE
1313,0.34664064410720535,2025-04-24 22:15:43.761083,2025-04-24 22:15:49.724504,0 days 00:00:05.963421,0.09433205412627584,12,,1,13,935,0.928352644620924,TPESampler,COMPLETE
1314,0.5120790140686043,2025-04-24 22:15:47.234237,2025-04-24 22:15:48.116366,0 days 00:00:00.882129,0.02198414975345866,12,log2,1,14,241,0.6947932857463505,TPESampler,COMPLETE
1315,0.3305141156646813,2025-04-24 22:15:48.301749,2025-04-24 22:15:56.758774,0 days 00:00:08.457025,0.061665534558639545,12,,1,11,1287,0.9958525951249536,TPESampler,COMPLETE
1316,0.43305068428530913,2025-04-24 22:15:49.904949,2025-04-24 22:15:53.320287,0 days 00:00:03.415338,0.026918089844904947,7,,8,2,724,0.9860730390599416,TPESampler,COMPLETE
1317,0.317465044779271,2025-04-24 22:15:50.586360,2025-04-24 22:15:58.196361,0 days 00:00:07.610001,0.03677948526077969,12,,2,7,1176,0.9970869132777701,TPESampler,COMPLETE
1318,0.36906814172804553,2025-04-24 22:15:53.501464,2025-04-24 22:16:01.662612,0 days 00:00:08.161148,0.06583561057247031,12,,4,6,1330,0.9886474351613649,TPESampler,COMPLETE
1319,0.358718453858262,2025-04-24 22:15:56.942802,2025-04-24 22:16:03.440484,0 days 00:00:06.497682,0.06488028921469188,10,,3,9,1223,0.9219557058401914,TPESampler,COMPLETE
1320,0.34909835761435987,2025-04-24 22:15:58.388754,2025-04-24 22:16:05.479348,0 days 00:00:07.090594,0.0716621555551262,12,,4,13,1243,0.9055775065834962,TPESampler,COMPLETE
1321,0.4387195795146994,2025-04-24 22:16:01.846926,2025-04-24 22:16:04.519645,0 days 00:00:02.672719,0.010388861166405118,4,,6,13,705,0.9852554892018119,TPESampler,COMPLETE
1322,0.40906214087202464,2025-04-24 22:16:03.633036,2025-04-24 22:16:09.612221,0 days 00:00:05.979185,0.09734226368452115,12,,5,11,1073,0.9123985904384107,TPESampler,COMPLETE
1323,0.36596867415253853,2025-04-24 22:16:04.710361,2025-04-24 22:16:13.049520,0 days 00:00:08.339159,0.09898768263460085,12,,3,10,1478,0.9026639972793838,TPESampler,COMPLETE
1324,0.3101830321607187,2025-04-24 22:16:05.660971,2025-04-24 22:16:14.024252,0 days 00:00:08.363281,0.09549662059787987,10,,2,8,1430,0.9982070269241358,TPESampler,COMPLETE
1325,0.5259293432293577,2025-04-24 22:16:09.799025,2025-04-24 22:16:10.865247,0 days 00:00:01.066222,0.09203852632634361,4,log2,8,13,402,0.8198261835659393,TPESampler,COMPLETE
1326,0.3672414490053177,2025-04-24 22:16:11.049653,2025-04-24 22:16:18.767578,0 days 00:00:07.717925,0.09837837713404628,12,,3,13,1251,0.9425039714031445,TPESampler,COMPLETE
1327,0.34003062726993927,2025-04-24 22:16:13.452270,2025-04-24 22:16:19.809744,0 days 00:00:06.357474,0.05845236288074761,10,,3,11,1250,0.7920949602046424,TPESampler,COMPLETE
1328,0.37344635714975033,2025-04-24 22:16:14.447992,2025-04-24 22:16:16.020669,0 days 00:00:01.572677,0.017026895434991578,7,sqrt,4,20,871,0.882007892021516,TPESampler,COMPLETE
1329,0.34952381062751353,2025-04-24 22:16:16.211876,2025-04-24 22:16:17.886108,0 days 00:00:01.674232,0.05696140402116799,12,log2,3,9,1155,0.947833195478955,TPESampler,COMPLETE
1330,0.33214782400994897,2025-04-24 22:16:18.083099,2025-04-24 22:16:26.303132,0 days 00:00:08.220033,0.05045596173114246,11,,1,9,1430,0.9205330787802015,TPESampler,COMPLETE
1331,0.3468996235571581,2025-04-24 22:16:19.016469,2025-04-24 22:16:27.102849,0 days 00:00:08.086380,0.04806969286447802,11,,3,9,1492,0.9217643880154746,TPESampler,COMPLETE
1332,0.3232339298588646,2025-04-24 22:16:19.996295,2025-04-24 22:16:29.545596,0 days 00:00:09.549301,0.06591298964134103,12,,1,9,1452,0.9895977653306199,TPESampler,COMPLETE
1333,0.5227381805261797,2025-04-24 22:16:26.495693,2025-04-24 22:16:27.636473,0 days 00:00:01.140780,0.01074586740106517,7,,5,16,145,0.6980174749386944,TPESampler,COMPLETE
1334,0.4187952405488953,2025-04-24 22:16:27.318285,2025-04-24 22:16:32.067888,0 days 00:00:04.749603,0.030793444313702286,10,,10,8,1070,0.8358199720923398,TPESampler,COMPLETE
1335,0.36841530627438407,2025-04-24 22:16:27.854556,2025-04-24 22:16:35.274518,0 days 00:00:07.419962,0.09231865255836455,12,,3,10,1260,0.9578293404850897,TPESampler,COMPLETE
1336,0.32145010173973415,2025-04-24 22:16:29.728966,2025-04-24 22:16:37.507596,0 days 00:00:07.778630,0.06891602350507373,12,,2,5,1185,0.99774576862254,TPESampler,COMPLETE
1337,0.3150877570282863,2025-04-24 22:16:32.301401,2025-04-24 22:16:38.676755,0 days 00:00:06.375354,0.06621071484040443,12,,1,16,1090,0.8633754455858824,TPESampler,COMPLETE
1338,0.3022770696570453,2025-04-24 22:16:35.466635,2025-04-24 22:16:42.020939,0 days 00:00:06.554304,0.06248354926540439,12,,2,11,1038,0.8760613753066138,TPESampler,COMPLETE
1339,0.34135823302146995,2025-04-24 22:16:37.689180,2025-04-24 22:16:40.221610,0 days 00:00:02.532430,0.05552174927076089,12,sqrt,4,14,1442,0.9574279943395305,TPESampler,COMPLETE
1340,0.7192351351447669,2025-04-24 22:16:38.863403,2025-04-24 22:16:39.979393,0 days 00:00:01.115990,0.013102349388354037,3,sqrt,10,17,330,0.689092648733771,TPESampler,COMPLETE
1341,0.3851553504072742,2025-04-24 22:16:40.167675,2025-04-24 22:16:43.934561,0 days 00:00:03.766886,0.025802037657338538,6,,6,7,880,0.8084647333657886,TPESampler,COMPLETE
1342,0.564531347702162,2025-04-24 22:16:40.467458,2025-04-24 22:16:41.267671,0 days 00:00:00.800213,0.04584630098760164,8,log2,2,9,147,0.9771790101826918,TPESampler,COMPLETE
1343,0.5582065295658584,2025-04-24 22:16:41.471949,2025-04-24 22:16:42.871363,0 days 00:00:01.399414,0.012433919280593576,6,log2,1,10,590,0.6014189872735358,TPESampler,COMPLETE
1344,0.3738464850233676,2025-04-24 22:16:42.227735,2025-04-24 22:16:52.105141,0 days 00:00:09.877406,0.07255609576178329,12,,3,8,1412,0.9943835221590891,TPESampler,COMPLETE
1345,0.3782820891599146,2025-04-24 22:16:43.059318,2025-04-24 22:16:45.016213,0 days 00:00:01.956895,0.09083722962349661,12,sqrt,5,3,1008,0.9641751037486154,TPESampler,COMPLETE
1346,0.3955879488639035,2025-04-24 22:16:44.131093,2025-04-24 22:16:46.022182,0 days 00:00:01.891089,0.07398262695070586,8,log2,5,13,1135,0.7730562106033761,TPESampler,COMPLETE
1347,0.7241960458392321,2025-04-24 22:16:45.205541,2025-04-24 22:16:46.285215,0 days 00:00:01.079674,0.011472898993491538,4,sqrt,9,8,309,0.9438754454788655,TPESampler,COMPLETE
1348,0.3461250695766122,2025-04-24 22:16:46.241107,2025-04-24 22:16:48.238837,0 days 00:00:01.997730,0.09787241011669516,10,log2,3,12,1040,0.924444251164873,TPESampler,COMPLETE
1349,0.42890845924943694,2025-04-24 22:16:46.559439,2025-04-24 22:16:49.064989,0 days 00:00:02.505550,0.074237865772138,12,sqrt,9,12,1443,0.8281278811231795,TPESampler,COMPLETE
1350,0.3817277136170893,2025-04-24 22:16:48.441137,2025-04-24 22:16:50.824276,0 days 00:00:02.383139,0.09603998357260168,11,sqrt,5,11,1462,0.9237278476900539,TPESampler,COMPLETE
1351,0.3035698055807669,2025-04-24 22:16:49.267903,2025-04-24 22:16:58.088332,0 days 00:00:08.820429,0.0401368284329392,12,,2,11,1475,0.9143060188422443,TPESampler,COMPLETE
1352,0.37060400469799487,2025-04-24 22:16:51.107025,2025-04-24 22:16:58.079418,0 days 00:00:06.972393,0.05450038607132331,12,,4,9,1109,0.9966600950632823,TPESampler,COMPLETE
1353,0.6334176051585931,2025-04-24 22:16:52.290488,2025-04-24 22:16:53.664376,0 days 00:00:01.373888,0.019401077614994548,10,log2,10,5,1015,0.9028874656857081,TPESampler,COMPLETE
1354,0.37339357093379044,2025-04-24 22:16:53.858626,2025-04-24 22:17:02.333518,0 days 00:00:08.474892,0.07365161324588815,12,,4,13,1386,0.9955991086230084,TPESampler,COMPLETE
1355,0.3722652846874392,2025-04-24 22:16:58.222322,2025-04-24 22:17:00.656306,0 days 00:00:02.433984,0.015589432247227976,5,,4,15,675,0.7306346774402527,TPESampler,COMPLETE
1356,0.35944676496699307,2025-04-24 22:16:58.266686,2025-04-24 22:17:07.376133,0 days 00:00:09.109447,0.038660449400024596,12,,3,5,1449,0.980492328592539,TPESampler,COMPLETE
1357,0.347837368071003,2025-04-24 22:17:00.832833,2025-04-24 22:17:09.699790,0 days 00:00:08.866957,0.04133980177878429,12,,3,13,1466,0.9725157453319235,TPESampler,COMPLETE
1358,0.28943817131703026,2025-04-24 22:17:02.525561,2025-04-24 22:17:10.685815,0 days 00:00:08.160254,0.09370723986607625,12,,2,13,1279,0.9942823665271616,TPESampler,COMPLETE
1359,0.5802080302028925,2025-04-24 22:17:07.568174,2025-04-24 22:17:08.420442,0 days 00:00:00.852268,0.013097888006105863,4,,3,2,104,0.6275804899755122,TPESampler,COMPLETE
1360,0.3360982527334405,2025-04-24 22:17:08.598988,2025-04-24 22:17:16.816394,0 days 00:00:08.217406,0.07203353099384227,10,,1,16,1472,0.9409122674681208,TPESampler,COMPLETE
1361,0.3301529410585268,2025-04-24 22:17:09.908676,2025-04-24 22:17:20.095996,0 days 00:00:10.187320,0.044594552459101246,12,,1,8,1472,0.9957718250506392,TPESampler,COMPLETE
1362,0.31888854363313884,2025-04-24 22:17:11.032204,2025-04-24 22:17:17.291470,0 days 00:00:06.259266,0.04019679690513588,10,,2,10,1100,0.995331531877375,TPESampler,COMPLETE
1363,0.300504029727932,2025-04-24 22:17:16.995816,2025-04-24 22:17:24.364203,0 days 00:00:07.368387,0.08994422361615291,12,,2,12,1153,0.9901436722058191,TPESampler,COMPLETE
1364,0.32254870151413556,2025-04-24 22:17:17.493568,2025-04-24 22:17:26.890758,0 days 00:00:09.397190,0.08986403267560396,12,,1,15,1448,0.9959692648715887,TPESampler,COMPLETE
1365,0.29909717770637795,2025-04-24 22:17:20.275000,2025-04-24 22:17:27.280127,0 days 00:00:07.005127,0.06231987601942668,12,,2,18,1074,0.993947200467228,TPESampler,COMPLETE
1366,0.42993837765670845,2025-04-24 22:17:24.545737,2025-04-24 22:17:25.410285,0 days 00:00:00.864548,0.029513690810178718,10,sqrt,4,11,213,0.7002185272654206,TPESampler,COMPLETE
1367,0.364533402832415,2025-04-24 22:17:25.605070,2025-04-24 22:17:34.718920,0 days 00:00:09.113850,0.09440754884347666,12,,3,17,1470,0.997715453778284,TPESampler,COMPLETE
1368,0.4076046008824111,2025-04-24 22:17:27.074487,2025-04-24 22:17:29.722779,0 days 00:00:02.648292,0.06473802781651242,3,,7,6,959,0.751719764388468,TPESampler,COMPLETE
1369,0.34511384111162846,2025-04-24 22:17:27.531577,2025-04-24 22:17:34.536312,0 days 00:00:07.004735,0.06911147515037552,9,,1,12,1266,0.99259908977969,TPESampler,COMPLETE
