number,value,datetime_start,datetime_complete,duration,params_learning_rate,params_max_depth,params_max_features,params_min_samples_leaf,params_min_samples_split,params_n_estimators,params_subsample,system_attrs_auto:sampler,state
248,0.351821864271458,2025-04-24 21:42:01.451846,2025-04-24 21:42:05.483501,0 days 00:00:04.031655,0.012287787346716657,8,,4,20,959,0.842550636411143,TPESampler,COMPLETE
249,0.3212181985701619,2025-04-24 21:42:04.107815,2025-04-24 21:42:12.305127,0 days 00:00:08.197312,0.011465471071162815,12,,1,20,1274,0.9952996877636376,TPESampler,COMPLETE
250,0.3715386218032687,2025-04-24 21:42:05.684125,2025-04-24 21:42:07.279406,0 days 00:00:01.595281,0.01760384362408022,12,sqrt,2,18,922,0.8126780844916544,TPESampler,COMPLETE
251,0.5500468641647235,2025-04-24 21:42:07.448994,2025-04-24 21:42:09.113353,0 days 00:00:01.664359,0.017705590561408507,4,log2,7,11,1296,0.9294642234349779,TPESampler,COMPLETE
252,0.3204212822313598,2025-04-24 21:42:09.121550,2025-04-24 21:42:17.084741,0 days 00:00:07.963191,0.010115300779659239,12,,1,19,1303,0.8951802935245219,TPESampler,COMPLETE
253,0.38160525849024673,2025-04-24 21:42:09.377412,2025-04-24 21:42:12.187654,0 days 00:00:02.810242,0.01000680712025409,11,sqrt,2,19,1399,0.7579451432083351,TPESampler,COMPLETE
254,0.31989457871759336,2025-04-24 21:42:12.397886,2025-04-24 21:42:19.753267,0 days 00:00:07.355381,0.017393424720793787,11,,1,20,1322,0.8404559370722866,TPESampler,COMPLETE
255,0.4276529572510745,2025-04-24 21:42:12.523341,2025-04-24 21:42:14.542825,0 days 00:00:02.019484,0.08515700578990894,10,sqrt,8,7,1348,0.9875369689864546,TPESampler,COMPLETE
256,0.3645634285396684,2025-04-24 21:42:14.712524,2025-04-24 21:42:16.866796,0 days 00:00:02.154272,0.059810298517485795,9,sqrt,1,13,1453,0.7776850758906806,TPESampler,COMPLETE
257,0.3012261827817084,2025-04-24 21:42:17.044618,2025-04-24 21:42:24.825320,0 days 00:00:07.780702,0.01704704230939765,12,,2,20,1303,0.9294270782656165,TPESampler,COMPLETE
258,0.4230370631208557,2025-04-24 21:42:17.305696,2025-04-24 21:42:19.075064,0 days 00:00:01.769368,0.011696393495806702,10,log2,2,20,1284,0.842798528848534,TPESampler,COMPLETE
259,0.3016721914670243,2025-04-24 21:42:19.238741,2025-04-24 21:42:27.722773,0 days 00:00:08.484032,0.015411672926988824,12,,2,19,1487,0.8812408471600301,TPESampler,COMPLETE
260,0.7358824465668906,2025-04-24 21:42:19.956017,2025-04-24 21:42:21.254016,0 days 00:00:01.297999,0.010389636525466006,10,log2,8,6,889,0.9830839838819099,TPESampler,COMPLETE
261,0.34252732670838776,2025-04-24 21:42:21.418553,2025-04-24 21:42:23.361437,0 days 00:00:01.942884,0.026455748084043745,12,sqrt,4,14,1287,0.9553624076236654,TPESampler,COMPLETE
262,0.37819379771261113,2025-04-24 21:42:23.532866,2025-04-24 21:42:25.740673,0 days 00:00:02.207807,0.010577941138202216,10,sqrt,1,20,1364,0.9826308966843058,TPESampler,COMPLETE
263,0.29881570672540136,2025-04-24 21:42:25.008871,2025-04-24 21:42:33.343580,0 days 00:00:08.334709,0.03919320283081724,12,,2,8,1429,0.9254579715427801,TPESampler,COMPLETE
264,0.32233915419550246,2025-04-24 21:42:25.918765,2025-04-24 21:42:34.112615,0 days 00:00:08.193850,0.02464497022233903,12,,3,20,1464,0.934469952482565,TPESampler,COMPLETE
265,0.31452972047952954,2025-04-24 21:42:27.897627,2025-04-24 21:42:34.821003,0 days 00:00:06.923376,0.010070179931769755,12,,2,20,1226,0.9336207694795364,TPESampler,COMPLETE
266,0.36213961998394617,2025-04-24 21:42:33.506707,2025-04-24 21:42:35.696430,0 days 00:00:02.189723,0.02007683720463637,12,sqrt,1,20,1133,0.9436705788782388,TPESampler,COMPLETE
267,0.3055752830367303,2025-04-24 21:42:34.285768,2025-04-24 21:42:41.537042,0 days 00:00:07.251274,0.03618556717578114,11,,2,8,1255,0.9225892447247799,TPESampler,COMPLETE
268,0.39211549015806874,2025-04-24 21:42:34.991508,2025-04-24 21:42:37.130760,0 days 00:00:02.139252,0.02631718091678133,11,log2,2,7,1484,0.9472922249224633,TPESampler,COMPLETE
269,0.30055132048056604,2025-04-24 21:42:35.883948,2025-04-24 21:42:43.356203,0 days 00:00:07.472255,0.016697272517597988,12,,2,20,1302,0.9279966185472743,TPESampler,COMPLETE
270,0.30307248688520355,2025-04-24 21:42:37.311547,2025-04-24 21:42:44.054801,0 days 00:00:06.743254,0.07386052926764504,11,,2,9,1161,0.9524873820111301,TPESampler,COMPLETE
271,0.3173834478295486,2025-04-24 21:42:41.718673,2025-04-24 21:42:49.812775,0 days 00:00:08.094102,0.06125506129765272,11,,2,4,1404,0.9268017167012885,TPESampler,COMPLETE
272,0.3331557362903016,2025-04-24 21:42:43.516389,2025-04-24 21:42:50.762622,0 days 00:00:07.246233,0.017782875463520784,10,,3,20,1391,0.9053347046810125,TPESampler,COMPLETE
273,0.39920555608589076,2025-04-24 21:42:44.285529,2025-04-24 21:42:46.082883,0 days 00:00:01.797354,0.05705788801726474,12,log2,5,6,1295,0.8428800134551898,TPESampler,COMPLETE
274,0.30380884532778896,2025-04-24 21:42:46.535938,2025-04-24 21:42:55.187938,0 days 00:00:08.652000,0.03479932097477299,12,,2,6,1356,0.9231521958264395,TPESampler,COMPLETE
275,0.3407889889631801,2025-04-24 21:42:50.393333,2025-04-24 21:42:56.433634,0 days 00:00:06.040301,0.0894768955445045,9,,1,8,1034,0.9737520640589798,TPESampler,COMPLETE
276,0.36122356787095466,2025-04-24 21:42:51.048815,2025-04-24 21:42:53.101570,0 days 00:00:02.052755,0.09022810777621401,6,sqrt,1,7,554,0.9596904331652943,TPESampler,COMPLETE
277,0.3421815225301807,2025-04-24 21:42:53.377179,2025-04-24 21:43:00.942008,0 days 00:00:07.564829,0.02961737258463148,12,,3,9,1213,0.949977838484087,TPESampler,COMPLETE
278,0.33667940868131957,2025-04-24 21:42:55.457865,2025-04-24 21:43:02.166426,0 days 00:00:06.708561,0.03556678988340127,12,,1,3,1107,0.8436613786689405,TPESampler,COMPLETE
279,0.39096644507509054,2025-04-24 21:42:56.615043,2025-04-24 21:43:04.338869,0 days 00:00:07.723826,0.05218889639264343,11,,5,7,1484,0.9280849997871481,TPESampler,COMPLETE
280,0.31070622600143444,2025-04-24 21:43:01.121876,2025-04-24 21:43:07.481154,0 days 00:00:06.359278,0.0394716341804509,10,,2,4,1185,0.9027626120554343,TPESampler,COMPLETE
281,0.33396548852051994,2025-04-24 21:43:02.331084,2025-04-24 21:43:08.689886,0 days 00:00:06.358802,0.02283570393397436,11,,3,20,1136,0.9672681617142269,TPESampler,COMPLETE
282,0.3367948245988561,2025-04-24 21:43:04.532453,2025-04-24 21:43:11.334827,0 days 00:00:06.802374,0.015914233132537262,12,,3,3,1208,0.8838641024451662,TPESampler,COMPLETE
283,0.3209472488675168,2025-04-24 21:43:07.651333,2025-04-24 21:43:14.843287,0 days 00:00:07.191954,0.07620592541390352,12,,1,9,1203,0.9221182840885563,TPESampler,COMPLETE
284,0.325490369188584,2025-04-24 21:43:08.857292,2025-04-24 21:43:15.149963,0 days 00:00:06.292671,0.03105024388743976,11,,2,4,1082,0.923865352228432,TPESampler,COMPLETE
285,0.3389285314415504,2025-04-24 21:43:11.498375,2025-04-24 21:43:16.984031,0 days 00:00:05.485656,0.04048701162736393,7,,3,3,1207,0.9826059291624507,TPESampler,COMPLETE
286,0.47613468966247313,2025-04-24 21:43:15.007596,2025-04-24 21:43:16.550204,0 days 00:00:01.542608,0.0107157966514475,10,,10,15,253,0.8905719115372608,TPESampler,COMPLETE
287,0.3368280444462418,2025-04-24 21:43:15.376259,2025-04-24 21:43:19.763841,0 days 00:00:04.387582,0.03982629033935384,9,,3,8,921,0.8420615446520554,TPESampler,COMPLETE
288,0.3210856956275408,2025-04-24 21:43:16.720935,2025-04-24 21:43:24.338675,0 days 00:00:07.617740,0.05443797782217462,11,,1,10,1313,0.956245967088048,TPESampler,COMPLETE
289,0.31006102836371024,2025-04-24 21:43:17.164659,2025-04-24 21:43:24.871753,0 days 00:00:07.707094,0.03520636724731426,12,,2,8,1467,0.8065701878408944,TPESampler,COMPLETE
290,0.31445225221305506,2025-04-24 21:43:19.934210,2025-04-24 21:43:28.462462,0 days 00:00:08.528252,0.04976080581123995,11,,2,8,1485,0.9629806644345109,TPESampler,COMPLETE
291,0.35722059305768206,2025-04-24 21:43:24.533094,2025-04-24 21:43:32.103995,0 days 00:00:07.570901,0.04305014442527433,10,,3,8,1455,0.8960365926259147,TPESampler,COMPLETE
292,0.3474044365763674,2025-04-24 21:43:25.069757,2025-04-24 21:43:30.884183,0 days 00:00:05.814426,0.03225716758723844,12,,3,6,1220,0.700663195746524,TPESampler,COMPLETE
293,0.33289454470216845,2025-04-24 21:43:28.628134,2025-04-24 21:43:35.860302,0 days 00:00:07.232168,0.04322024289666565,11,,1,9,1447,0.7597341465954145,TPESampler,COMPLETE
294,0.31273549635071207,2025-04-24 21:43:31.051774,2025-04-24 21:43:37.860767,0 days 00:00:06.808993,0.03518262700827403,11,,2,9,1324,0.8326565565619013,TPESampler,COMPLETE
295,0.35974104972345905,2025-04-24 21:43:32.288019,2025-04-24 21:43:39.650979,0 days 00:00:07.362960,0.04223514699995983,12,,3,5,1306,0.9000755820083353,TPESampler,COMPLETE
296,0.3171364718417475,2025-04-24 21:43:36.041186,2025-04-24 21:43:43.467840,0 days 00:00:07.426654,0.023663176548945394,12,,2,4,1196,0.9478247450098531,TPESampler,COMPLETE
297,0.3645628043989189,2025-04-24 21:43:38.027325,2025-04-24 21:43:43.674974,0 days 00:00:05.647649,0.0625393508585672,11,,3,5,1028,0.8969773165509973,TPESampler,COMPLETE
298,0.3437086028577854,2025-04-24 21:43:39.821529,2025-04-24 21:43:46.631430,0 days 00:00:06.809901,0.0225722799635496,8,,1,6,1413,0.8902024352722882,TPESampler,COMPLETE
299,0.38136452031597784,2025-04-24 21:43:43.643309,2025-04-24 21:43:45.955575,0 days 00:00:02.312266,0.029273993608203947,10,log2,4,11,1473,0.8043553658205642,TPESampler,COMPLETE
300,0.4529662197917648,2025-04-24 21:43:43.842067,2025-04-24 21:43:45.225012,0 days 00:00:01.382945,0.013482098728659872,6,sqrt,3,3,496,0.9989955717954179,TPESampler,COMPLETE
301,0.35729008585210387,2025-04-24 21:43:45.401959,2025-04-24 21:43:52.308969,0 days 00:00:06.907010,0.07500473320383184,12,,4,9,1453,0.754306672101453,TPESampler,COMPLETE
302,0.4663282157918546,2025-04-24 21:43:46.130179,2025-04-24 21:43:47.984793,0 days 00:00:01.854614,0.02654798317215092,5,log2,5,18,1329,0.6834109353293077,TPESampler,COMPLETE
303,0.3023351950695363,2025-04-24 21:43:46.835416,2025-04-24 21:43:52.270579,0 days 00:00:05.435163,0.0476685837250557,12,,2,10,842,0.9592087353871126,TPESampler,COMPLETE
304,0.3703768533516345,2025-04-24 21:43:48.161432,2025-04-24 21:43:55.486569,0 days 00:00:07.325137,0.05860882813711979,11,,3,8,1228,0.9898875920977106,TPESampler,COMPLETE
305,0.31904204525194957,2025-04-24 21:43:52.398568,2025-04-24 21:43:57.766827,0 days 00:00:05.368259,0.02366945762293034,11,,2,10,816,0.9832723837293733,TPESampler,COMPLETE
306,0.35586701893407535,2025-04-24 21:43:52.443834,2025-04-24 21:43:54.785630,0 days 00:00:02.341796,0.033683772877768185,11,sqrt,1,10,1386,0.911849735080277,TPESampler,COMPLETE
307,0.34439372346240205,2025-04-24 21:43:54.945093,2025-04-24 21:43:56.855869,0 days 00:00:01.910776,0.024587916210189777,10,sqrt,4,3,1196,0.8275612972547439,TPESampler,COMPLETE
308,0.3231187981450027,2025-04-24 21:43:55.657541,2025-04-24 21:44:00.339530,0 days 00:00:04.681989,0.03642097733052326,12,,1,9,728,0.9197104198956921,TPESampler,COMPLETE
309,0.3543416062992352,2025-04-24 21:43:57.028365,2025-04-24 21:44:04.657065,0 days 00:00:07.628700,0.028976039287010986,12,,4,10,1471,0.8156732392769325,TPESampler,COMPLETE
310,0.3689414352313038,2025-04-24 21:43:57.993805,2025-04-24 21:44:01.999084,0 days 00:00:04.005279,0.014405839971411854,4,,3,11,1108,0.974431091872764,TPESampler,COMPLETE
311,0.8415629606478664,2025-04-24 21:44:00.514547,2025-04-24 21:44:01.286685,0 days 00:00:00.772138,0.013905124078436257,6,log2,5,15,241,0.9736697161675985,TPESampler,COMPLETE
312,0.33526518777176745,2025-04-24 21:44:01.457020,2025-04-24 21:44:08.069930,0 days 00:00:06.612910,0.03035998512307138,11,,3,8,1240,0.8809461145624388,TPESampler,COMPLETE
313,0.3333074847065627,2025-04-24 21:44:02.175556,2025-04-24 21:44:07.394664,0 days 00:00:05.219108,0.04608221093618689,12,,3,9,875,0.9305457070484937,TPESampler,COMPLETE
314,0.3634000720291055,2025-04-24 21:44:04.825658,2025-04-24 21:44:10.650233,0 days 00:00:05.824575,0.09731036661838224,11,,3,10,1001,0.9792093835275473,TPESampler,COMPLETE
315,0.31112430111023553,2025-04-24 21:44:07.574834,2025-04-24 21:44:16.351291,0 days 00:00:08.776457,0.03190641921165077,12,,2,7,1399,0.9692121618994533,TPESampler,COMPLETE
316,0.3180672828814845,2025-04-24 21:44:08.262993,2025-04-24 21:44:15.617788,0 days 00:00:07.354795,0.032020895969314456,11,,1,6,1315,0.9105136048673834,TPESampler,COMPLETE
317,0.3105932997102067,2025-04-24 21:44:10.831330,2025-04-24 21:44:16.637195,0 days 00:00:05.805865,0.036914015773923545,11,,2,12,1018,0.8960545253639243,TPESampler,COMPLETE
318,0.3618150210207399,2025-04-24 21:44:15.785580,2025-04-24 21:44:23.395183,0 days 00:00:07.609603,0.03981874167881855,12,,3,3,1462,0.7745753335747437,TPESampler,COMPLETE
319,0.3668371574505463,2025-04-24 21:44:16.516187,2025-04-24 21:44:18.244203,0 days 00:00:01.728016,0.048342427576172575,12,sqrt,1,12,940,0.9665735575822987,TPESampler,COMPLETE
320,0.31209060019982726,2025-04-24 21:44:16.795796,2025-04-24 21:44:21.863346,0 days 00:00:05.067550,0.050803028535869404,11,,2,9,818,0.991465156483546,TPESampler,COMPLETE
321,0.3131664599172757,2025-04-24 21:44:18.485891,2025-04-24 21:44:21.790468,0 days 00:00:03.304577,0.056987507167993695,11,,2,14,528,0.9654509266300565,TPESampler,COMPLETE
322,0.38843772147904215,2025-04-24 21:44:21.928297,2025-04-24 21:44:24.723626,0 days 00:00:02.795329,0.0898039621142853,6,sqrt,6,15,1475,0.9657612919266889,TPESampler,COMPLETE
323,0.3945632717545676,2025-04-24 21:44:22.002916,2025-04-24 21:44:24.469906,0 days 00:00:02.466990,0.04383957976596552,10,log2,1,5,1037,0.8244764739557995,TPESampler,COMPLETE
324,0.3145947671951202,2025-04-24 21:44:23.602920,2025-04-24 21:44:31.433883,0 days 00:00:07.830963,0.03215781641549173,12,,1,9,1283,0.911180569030271,TPESampler,COMPLETE
325,0.30762933317750296,2025-04-24 21:44:24.662746,2025-04-24 21:44:33.256101,0 days 00:00:08.593355,0.01973536751844416,12,,2,18,1452,0.9662458251485708,TPESampler,COMPLETE
326,0.33123045447432603,2025-04-24 21:44:24.932620,2025-04-24 21:44:30.315014,0 days 00:00:05.382394,0.03949856948178853,9,,1,4,1085,0.896261879965586,TPESampler,COMPLETE
327,0.31935929660700824,2025-04-24 21:44:30.496850,2025-04-24 21:44:38.525369,0 days 00:00:08.028519,0.04254201443360799,12,,1,11,1404,0.852484601348647,TPESampler,COMPLETE
328,0.3260845214975575,2025-04-24 21:44:31.603358,2025-04-24 21:44:37.118193,0 days 00:00:05.514835,0.05205686194185265,9,,2,11,1105,0.9061872030484975,TPESampler,COMPLETE
329,0.7605900461218341,2025-04-24 21:44:33.440804,2025-04-24 21:44:34.342261,0 days 00:00:00.901457,0.01618272129659235,10,log2,4,15,361,0.6621745854068519,TPESampler,COMPLETE
330,0.31920214758480964,2025-04-24 21:44:34.513952,2025-04-24 21:44:41.197416,0 days 00:00:06.683464,0.02363247414294184,11,,1,18,1139,0.9017648068649778,TPESampler,COMPLETE
331,0.3765742309664184,2025-04-24 21:44:37.302277,2025-04-24 21:44:39.626458,0 days 00:00:02.324181,0.03218881003523693,12,log2,1,15,1454,0.966758419332074,TPESampler,COMPLETE
332,0.3705206550303432,2025-04-24 21:44:38.700889,2025-04-24 21:44:41.119445,0 days 00:00:02.418556,0.011526669764908208,12,sqrt,5,20,1348,0.9785006625832378,TPESampler,COMPLETE
333,0.3717194814446842,2025-04-24 21:44:39.805918,2025-04-24 21:44:41.829159,0 days 00:00:02.023241,0.03704174708829308,12,log2,1,7,942,0.9384556672701395,TPESampler,COMPLETE
334,0.31412307673945544,2025-04-24 21:44:41.258609,2025-04-24 21:44:49.191617,0 days 00:00:07.933008,0.045790032923618475,12,,1,19,1287,0.9305681765429841,TPESampler,COMPLETE
335,0.45335307553209636,2025-04-24 21:44:41.384331,2025-04-24 21:44:43.076722,0 days 00:00:01.692391,0.059813874840303115,3,,9,10,449,0.7718011672759079,TPESampler,COMPLETE
336,0.3315035931546083,2025-04-24 21:44:42.206522,2025-04-24 21:44:47.833792,0 days 00:00:05.627270,0.033440247386543255,10,,3,13,1148,0.8629734892174798,TPESampler,COMPLETE
337,0.6721750023461912,2025-04-24 21:44:43.248187,2025-04-24 21:44:43.923994,0 days 00:00:00.675807,0.029741423972962915,11,sqrt,10,4,116,0.9390829609638548,TPESampler,COMPLETE
338,0.3217936135010617,2025-04-24 21:44:44.084528,2025-04-24 21:44:52.612605,0 days 00:00:08.528077,0.01947998036807713,12,,1,17,1352,0.9955895198913879,TPESampler,COMPLETE
339,0.3040888142804452,2025-04-24 21:44:48.006650,2025-04-24 21:44:55.962186,0 days 00:00:07.955536,0.02259351110929572,12,,2,20,1290,0.9826296533582,TPESampler,COMPLETE
340,0.42515729805418495,2025-04-24 21:44:49.371538,2025-04-24 21:44:55.373181,0 days 00:00:06.001643,0.030324914343082873,10,,10,5,1253,0.9847781328547183,TPESampler,COMPLETE
341,0.37931009554557626,2025-04-24 21:44:52.789678,2025-04-24 21:44:54.615819,0 days 00:00:01.826141,0.0671567502258882,12,,5,4,259,0.8829324832722713,TPESampler,COMPLETE
342,0.34319066352970473,2025-04-24 21:44:54.777933,2025-04-24 21:45:01.442726,0 days 00:00:06.664793,0.01992343431291199,12,,4,14,1156,0.9581869571796992,TPESampler,COMPLETE
343,0.31568454144657077,2025-04-24 21:44:55.547022,2025-04-24 21:45:04.360792,0 days 00:00:08.813770,0.02982186048423702,12,,1,20,1470,0.9273424098385934,TPESampler,COMPLETE
344,0.3153507604322221,2025-04-24 21:44:56.146846,2025-04-24 21:45:03.122353,0 days 00:00:06.975507,0.021646209306597698,12,,1,20,1141,0.9533363397205629,TPESampler,COMPLETE
345,0.320009919169809,2025-04-24 21:45:01.610295,2025-04-24 21:45:07.771829,0 days 00:00:06.161534,0.04165293784565641,12,,1,13,965,0.9257036568062117,TPESampler,COMPLETE
346,0.30336919615731195,2025-04-24 21:45:03.299599,2025-04-24 21:45:10.913676,0 days 00:00:07.614077,0.02244617141885559,12,,2,19,1236,0.954826172162755,TPESampler,COMPLETE
347,0.6764047856826443,2025-04-24 21:45:04.535233,2025-04-24 21:45:05.909796,0 days 00:00:01.374563,0.013773024725773938,10,log2,9,18,1047,0.8118796713077436,TPESampler,COMPLETE
348,0.33340182346170577,2025-04-24 21:45:06.089002,2025-04-24 21:45:11.655490,0 days 00:00:05.566488,0.020412931545360013,12,,3,20,927,0.9336103306494031,TPESampler,COMPLETE
349,0.48957998563909605,2025-04-24 21:45:07.939569,2025-04-24 21:45:09.218163,0 days 00:00:01.278594,0.017780022512199435,4,sqrt,8,3,833,0.6666237209665156,TPESampler,COMPLETE
350,0.31854454719172387,2025-04-24 21:45:09.399209,2025-04-24 21:45:17.290714,0 days 00:00:07.891505,0.022313923200587248,12,,2,8,1477,0.8293012201639488,TPESampler,COMPLETE
351,0.3264624456778655,2025-04-24 21:45:11.179181,2025-04-24 21:45:17.511184,0 days 00:00:06.332003,0.021699585574438126,12,,3,20,1064,0.9399346496671364,TPESampler,COMPLETE
352,0.34672112060387905,2025-04-24 21:45:11.954473,2025-04-24 21:45:20.914552,0 days 00:00:08.960079,0.03579198424334719,12,,3,15,1484,0.9901867548910949,TPESampler,COMPLETE
353,0.34647286331436017,2025-04-24 21:45:17.471787,2025-04-24 21:45:25.122275,0 days 00:00:07.650488,0.051447295353307616,12,,3,9,1388,0.8801616562713849,TPESampler,COMPLETE
354,0.31060542251344936,2025-04-24 21:45:17.728482,2025-04-24 21:45:25.181481,0 days 00:00:07.452999,0.027911430672070137,10,,2,20,1385,0.9450273365135948,TPESampler,COMPLETE
355,0.4690641022993819,2025-04-24 21:45:21.091406,2025-04-24 21:45:22.060850,0 days 00:00:00.969444,0.04313635122191988,5,log2,1,16,459,0.9160424735091498,TPESampler,COMPLETE
356,0.44938834291286417,2025-04-24 21:45:22.230210,2025-04-24 21:45:23.313672,0 days 00:00:01.083462,0.08020808329992135,7,sqrt,8,14,590,0.6561184960722574,TPESampler,COMPLETE
357,0.31221819083614955,2025-04-24 21:45:23.479009,2025-04-24 21:45:30.170579,0 days 00:00:06.691570,0.026943041614817517,12,,2,17,1063,0.9767093372551223,TPESampler,COMPLETE
358,0.37454718560176464,2025-04-24 21:45:25.275097,2025-04-24 21:45:27.221390,0 days 00:00:01.946293,0.0819598853649527,10,log2,1,9,1318,0.9533840974999384,TPESampler,COMPLETE
359,0.34401252785325226,2025-04-24 21:45:25.339769,2025-04-24 21:45:33.909737,0 days 00:00:08.569968,0.013518062687651246,12,,4,20,1479,0.9708742063960888,TPESampler,COMPLETE
360,0.3069554624451304,2025-04-24 21:45:27.394323,2025-04-24 21:45:35.190182,0 days 00:00:07.795859,0.014983161170418114,12,,2,20,1416,0.8919708345720261,TPESampler,COMPLETE
361,0.32248732970737864,2025-04-24 21:45:30.359356,2025-04-24 21:45:37.104167,0 days 00:00:06.744811,0.030546253593311458,12,,3,16,1198,0.8843407849179884,TPESampler,COMPLETE
362,0.7827329316132339,2025-04-24 21:45:34.213536,2025-04-24 21:45:35.590710,0 days 00:00:01.377174,0.016890131303375303,4,log2,9,7,624,0.8371181349343151,TPESampler,COMPLETE
363,0.303475052565294,2025-04-24 21:45:35.378929,2025-04-24 21:45:43.346541,0 days 00:00:07.967612,0.018552434364795933,11,,2,20,1456,0.9372215380928423,TPESampler,COMPLETE
364,0.30171989127323756,2025-04-24 21:45:35.788503,2025-04-24 21:45:43.203438,0 days 00:00:07.414935,0.021669730432654553,12,,2,18,1300,0.924193026460508,TPESampler,COMPLETE
365,0.32279339014589714,2025-04-24 21:45:37.274931,2025-04-24 21:45:44.662615,0 days 00:00:07.387684,0.012333514381073104,12,,1,15,1256,0.9288173898792168,TPESampler,COMPLETE
366,0.3228788900167992,2025-04-24 21:45:43.395192,2025-04-24 21:45:50.834277,0 days 00:00:07.439085,0.0224354029214567,12,,3,17,1249,0.9167089011503156,TPESampler,COMPLETE
367,0.42367792567423235,2025-04-24 21:45:43.532925,2025-04-24 21:45:48.103032,0 days 00:00:04.570107,0.08517517228333277,12,,10,7,865,0.8906286442144977,TPESampler,COMPLETE
368,0.5979132749777114,2025-04-24 21:45:44.847065,2025-04-24 21:45:45.842131,0 days 00:00:00.995066,0.012941558271486074,9,sqrt,10,2,451,0.842827582122109,TPESampler,COMPLETE
369,0.43817721198283927,2025-04-24 21:45:46.038056,2025-04-24 21:45:47.790782,0 days 00:00:01.752726,0.04107484752917466,4,log2,5,8,1404,0.6481675106714649,TPESampler,COMPLETE
370,0.29809652506192047,2025-04-24 21:45:47.971140,2025-04-24 21:45:55.988260,0 days 00:00:08.017120,0.019853294806622603,12,,2,20,1425,0.9080829669759064,TPESampler,COMPLETE
371,0.3309905020119457,2025-04-24 21:45:48.267674,2025-04-24 21:45:55.743747,0 days 00:00:07.476073,0.017495299579374582,12,,3,17,1388,0.8889252368392604,TPESampler,COMPLETE
372,0.3303405411598413,2025-04-24 21:45:51.022506,2025-04-24 21:45:58.719798,0 days 00:00:07.697292,0.02671854755751068,11,,1,19,1250,0.9965109054581593,TPESampler,COMPLETE
