number,value,datetime_start,datetime_complete,duration,params_learning_rate,params_max_depth,params_max_features,params_min_samples_leaf,params_min_samples_split,params_n_estimators,params_subsample,system_attrs_auto:sampler,state
1494,0.3858003205496644,2025-04-24 22:21:36.656219,2025-04-24 22:21:46.107021,0 days 00:00:09.450802,0.06446249490166894,12,,3,8,1487,0.9987403187794758,TPESampler,COMPLETE
1495,0.6886930455356187,2025-04-24 22:21:36.783113,2025-04-24 22:21:37.818223,0 days 00:00:01.035110,0.05041209174834238,9,log2,9,3,226,0.9695114026192386,TPESampler,COMPLETE
1496,0.33452135596570665,2025-04-24 22:21:38.006307,2025-04-24 22:21:45.628303,0 days 00:00:07.621996,0.0698119896747516,10,,1,10,1429,0.9276895487270032,TPESampler,COMPLETE
1497,0.3755726180762414,2025-04-24 22:21:43.202849,2025-04-24 22:21:51.939808,0 days 00:00:08.736959,0.08293336103880465,12,,3,12,1420,0.9985385670759149,TPESampler,COMPLETE
1498,0.32511073072973906,2025-04-24 22:21:45.817004,2025-04-24 22:21:54.331842,0 days 00:00:08.514838,0.055150069673997146,12,,1,16,1393,0.9314037832636721,TPESampler,COMPLETE
1499,0.2981607639582345,2025-04-24 22:21:46.341792,2025-04-24 22:21:54.112709,0 days 00:00:07.770917,0.055964093558261416,11,,2,15,1334,0.9743683856567334,TPESampler,COMPLETE
1500,0.3487442613275343,2025-04-24 22:21:52.142228,2025-04-24 22:21:54.070269,0 days 00:00:01.928041,0.08798708138299896,12,log2,2,11,1427,0.9903298970772727,TPESampler,COMPLETE
1501,0.35269368406338325,2025-04-24 22:21:54.211535,2025-04-24 22:22:02.074170,0 days 00:00:07.862635,0.07373929773153932,11,,3,16,1397,0.9390507047744215,TPESampler,COMPLETE
1502,0.4651937744507047,2025-04-24 22:21:54.339823,2025-04-24 22:21:56.411878,0 days 00:00:02.072055,0.014375495889603941,8,sqrt,9,15,1163,0.707489247398879,TPESampler,COMPLETE
1503,0.32448082375013443,2025-04-24 22:21:54.625365,2025-04-24 22:22:03.246084,0 days 00:00:08.620719,0.07294425939344412,12,,2,15,1461,0.9138718794133103,TPESampler,COMPLETE
1504,0.3335968738658657,2025-04-24 22:21:56.592673,2025-04-24 22:22:04.244258,0 days 00:00:07.651585,0.04591888984398082,11,,3,16,1349,0.9549719410871417,TPESampler,COMPLETE
1505,0.32902369626291594,2025-04-24 22:22:02.277416,2025-04-24 22:22:12.279308,0 days 00:00:10.001892,0.0684793967010672,12,,1,12,1480,0.9904999978047084,TPESampler,COMPLETE
1506,0.414422102015592,2025-04-24 22:22:03.459131,2025-04-24 22:22:05.207914,0 days 00:00:01.748783,0.03875875449417828,3,sqrt,2,20,1057,0.7802151441802014,TPESampler,COMPLETE
1507,0.3497426647542811,2025-04-24 22:22:04.483015,2025-04-24 22:22:11.702143,0 days 00:00:07.219128,0.0824366920092542,10,,3,15,1292,0.9719474891284863,TPESampler,COMPLETE
1508,0.4324661210334377,2025-04-24 22:22:05.411788,2025-04-24 22:22:07.211040,0 days 00:00:01.799252,0.09154482329601484,6,sqrt,9,9,1371,0.7241044309174107,TPESampler,COMPLETE
1509,0.3387000936608745,2025-04-24 22:22:07.396213,2025-04-24 22:22:12.900578,0 days 00:00:05.504365,0.06481464195180518,12,,3,15,899,0.9264643359695159,TPESampler,COMPLETE
1510,0.38080686780014883,2025-04-24 22:22:11.889267,2025-04-24 22:22:20.437226,0 days 00:00:08.547959,0.03531602442892844,12,,5,14,1404,0.9922733454425665,TPESampler,COMPLETE
1511,0.3282462407779897,2025-04-24 22:22:12.488027,2025-04-24 22:22:14.543580,0 days 00:00:02.055553,0.09791460048896063,11,sqrt,3,9,1107,0.9171468645810593,TPESampler,COMPLETE
1512,0.3786811153762056,2025-04-24 22:22:13.114197,2025-04-24 22:22:14.364631,0 days 00:00:01.250434,0.044757051056281895,8,,4,2,115,0.9812798028435665,TPESampler,COMPLETE
1513,0.33474562631410937,2025-04-24 22:22:14.542368,2025-04-24 22:22:22.789971,0 days 00:00:08.247603,0.07079436066697499,10,,1,16,1459,0.9948563482139914,TPESampler,COMPLETE
1514,0.34940552265249347,2025-04-24 22:22:14.736608,2025-04-24 22:22:23.303722,0 days 00:00:08.567114,0.053369994038688695,12,,3,11,1479,0.9452727973966129,TPESampler,COMPLETE
1515,0.3219582524563418,2025-04-24 22:22:20.630443,2025-04-24 22:22:29.649240,0 days 00:00:09.018797,0.05133482820680023,11,,1,15,1484,0.9615664774560241,TPESampler,COMPLETE
1516,0.2982357281807768,2025-04-24 22:22:22.993681,2025-04-24 22:22:29.287690,0 days 00:00:06.294009,0.09970118228698793,12,,2,16,1009,0.943884738615075,TPESampler,COMPLETE
1517,0.39325944155831594,2025-04-24 22:22:23.501875,2025-04-24 22:22:24.637215,0 days 00:00:01.135340,0.05526580176921557,8,log2,3,3,521,0.9746470337638047,TPESampler,COMPLETE
1518,0.31953861299272834,2025-04-24 22:22:24.850316,2025-04-24 22:22:32.858500,0 days 00:00:08.008184,0.035330019730892386,10,,2,12,1434,0.9850448856333778,TPESampler,COMPLETE
1519,0.31604116401050186,2025-04-24 22:22:29.557024,2025-04-24 22:22:39.014079,0 days 00:00:09.457055,0.09319432907938435,12,,1,13,1461,0.9760612741336205,TPESampler,COMPLETE
1520,0.32279959223761007,2025-04-24 22:22:30.085430,2025-04-24 22:22:38.916902,0 days 00:00:08.831472,0.07501994223480374,11,,1,11,1491,0.9670158333589821,TPESampler,COMPLETE
1521,0.3631983864599165,2025-04-24 22:22:33.055560,2025-04-24 22:22:40.997771,0 days 00:00:07.942211,0.05871681924636912,11,,4,11,1419,0.9463966736420091,TPESampler,COMPLETE
1522,0.3847597776045185,2025-04-24 22:22:39.092837,2025-04-24 22:22:40.851633,0 days 00:00:01.758796,0.05997918628765122,12,sqrt,6,20,947,0.7308432480126809,TPESampler,COMPLETE
1523,0.2964563190366399,2025-04-24 22:22:39.221846,2025-04-24 22:22:47.928657,0 days 00:00:08.706811,0.06337114477228324,12,,2,17,1312,0.9800151245600486,TPESampler,COMPLETE
1524,0.42636633475244357,2025-04-24 22:22:41.139135,2025-04-24 22:22:42.675107,0 days 00:00:01.535972,0.051633726524256726,5,log2,5,15,761,0.8595869436229998,TPESampler,COMPLETE
1525,0.3434563928543248,2025-04-24 22:22:41.354046,2025-04-24 22:22:48.360208,0 days 00:00:07.006162,0.04937995080968547,12,,4,16,1142,0.9363889358281614,TPESampler,COMPLETE
1526,0.3550142807096755,2025-04-24 22:22:42.865164,2025-04-24 22:22:50.372818,0 days 00:00:07.507654,0.04461393400046955,12,,4,16,1177,0.997279782627047,TPESampler,COMPLETE
1527,0.3183492303283732,2025-04-24 22:22:48.220673,2025-04-24 22:22:56.482871,0 days 00:00:08.262198,0.09880152602165947,12,,1,15,1401,0.8813788907320443,TPESampler,COMPLETE
1528,0.3008307209112099,2025-04-24 22:22:48.696845,2025-04-24 22:22:57.978955,0 days 00:00:09.282110,0.06956269741359805,11,,2,15,1499,0.9935823675540078,TPESampler,COMPLETE
1529,0.32844868124161974,2025-04-24 22:22:50.742588,2025-04-24 22:22:59.389775,0 days 00:00:08.647187,0.09650925275473467,12,,2,6,1368,0.8410120246775394,TPESampler,COMPLETE
1530,0.32242725688169716,2025-04-24 22:22:56.770906,2025-04-24 22:23:05.275262,0 days 00:00:08.504356,0.07223297589209302,10,,2,10,1446,0.9814185523224909,TPESampler,COMPLETE
1531,0.4828560234039837,2025-04-24 22:22:58.183888,2025-04-24 22:22:59.507878,0 days 00:00:01.323990,0.014492598299288414,12,sqrt,10,2,686,0.9816039211241869,TPESampler,COMPLETE
1532,0.30239908325298387,2025-04-24 22:22:59.578013,2025-04-24 22:23:07.100392,0 days 00:00:07.522379,0.0567435603179369,12,,2,16,1156,0.997162451866447,TPESampler,COMPLETE
1533,0.33579022440381007,2025-04-24 22:22:59.708797,2025-04-24 22:23:08.625558,0 days 00:00:08.916761,0.05063282517525759,12,,3,15,1470,0.9632390057754547,TPESampler,COMPLETE
1534,0.3510875612880155,2025-04-24 22:23:05.467834,2025-04-24 22:23:14.477952,0 days 00:00:09.010118,0.04278151157416015,12,,3,15,1486,0.9936445801903364,TPESampler,COMPLETE
1535,0.35387455205310764,2025-04-24 22:23:07.284363,2025-04-24 22:23:16.058683,0 days 00:00:08.774320,0.05083805040200894,12,,4,13,1492,0.974645823400993,TPESampler,COMPLETE
1536,0.33142487616461874,2025-04-24 22:23:08.828988,2025-04-24 22:23:17.786310,0 days 00:00:08.957322,0.05287004404966022,11,,1,10,1448,0.9995068482622855,TPESampler,COMPLETE
1537,0.36518949737012,2025-04-24 22:23:14.738539,2025-04-24 22:23:21.854195,0 days 00:00:07.115656,0.08706370044627924,10,,4,15,1255,0.9901771497677405,TPESampler,COMPLETE
1538,0.5785380986703436,2025-04-24 22:23:16.257173,2025-04-24 22:23:17.799476,0 days 00:00:01.542303,0.023874233251042067,6,log2,8,8,1063,0.6839032660103443,TPESampler,COMPLETE
1539,0.35134106069110327,2025-04-24 22:23:17.950853,2025-04-24 22:23:25.353685,0 days 00:00:07.402832,0.05634446801107296,11,,3,12,1287,0.9331353421526444,TPESampler,COMPLETE
1540,0.34364653831722747,2025-04-24 22:23:17.997529,2025-04-24 22:23:26.877666,0 days 00:00:08.880137,0.02831604625945115,11,,3,9,1477,0.9611718874319796,TPESampler,COMPLETE
1541,0.4621510059854519,2025-04-24 22:23:22.073669,2025-04-24 22:23:23.129123,0 days 00:00:01.055454,0.08110886835598347,6,sqrt,10,17,418,0.7681031791935895,TPESampler,COMPLETE
1542,0.37775132508063913,2025-04-24 22:23:23.317811,2025-04-24 22:23:31.085856,0 days 00:00:07.768045,0.09216032470083114,10,,3,9,1421,0.9427667047785144,TPESampler,COMPLETE
1543,0.3435736488507231,2025-04-24 22:23:25.562254,2025-04-24 22:23:27.307834,0 days 00:00:01.745580,0.057015503002923344,11,log2,3,13,1164,0.9861859280049893,TPESampler,COMPLETE
1544,0.3132393806339784,2025-04-24 22:23:27.093158,2025-04-24 22:23:35.449758,0 days 00:00:08.356600,0.033080659865248795,10,,2,7,1500,0.9611114900894135,TPESampler,COMPLETE
1545,0.3083496910164538,2025-04-24 22:23:27.549621,2025-04-24 22:23:36.479129,0 days 00:00:08.929508,0.0809174942149357,12,,2,8,1478,0.9348098802417834,TPESampler,COMPLETE
1546,0.4502290540772025,2025-04-24 22:23:31.286946,2025-04-24 22:23:32.629307,0 days 00:00:01.342361,0.02760138404965364,6,,8,12,259,0.7173351673104167,TPESampler,COMPLETE
1547,0.3579407148118988,2025-04-24 22:23:32.818589,2025-04-24 22:23:39.660970,0 days 00:00:06.842381,0.09845712051978792,12,,3,14,1088,0.9438302128938403,TPESampler,COMPLETE
1548,0.373447125584557,2025-04-24 22:23:35.644120,2025-04-24 22:23:37.513945,0 days 00:00:01.869825,0.012955907102059207,11,sqrt,2,10,905,0.7948591653338937,TPESampler,COMPLETE
1549,0.30077066295732396,2025-04-24 22:23:36.702050,2025-04-24 22:23:45.848899,0 days 00:00:09.146849,0.04434913242682771,12,,2,12,1466,0.9660747068988176,TPESampler,COMPLETE
1550,0.4019312365623458,2025-04-24 22:23:37.708683,2025-04-24 22:23:38.714925,0 days 00:00:01.006242,0.06635560335517514,5,log2,1,6,400,0.9374922446191798,TPESampler,COMPLETE
1551,0.29761894031669134,2025-04-24 22:23:38.925787,2025-04-24 22:23:47.102665,0 days 00:00:08.176878,0.06075064133031984,12,,2,13,1352,0.9298117762786728,TPESampler,COMPLETE
1552,0.32723436088847524,2025-04-24 22:23:39.848773,2025-04-24 22:23:49.569142,0 days 00:00:09.720369,0.03545351127041185,12,,1,9,1496,0.9748442800155501,TPESampler,COMPLETE
1553,0.3982897794123946,2025-04-24 22:23:46.069114,2025-04-24 22:23:47.995416,0 days 00:00:01.926302,0.02673312533014151,10,log2,4,17,1289,0.9907023039769428,TPESampler,COMPLETE
1554,0.467260047195972,2025-04-24 22:23:47.328367,2025-04-24 22:23:49.180623,0 days 00:00:01.852256,0.09859621780641926,3,log2,10,2,1000,0.9053761741252964,TPESampler,COMPLETE
1555,0.32577762172923785,2025-04-24 22:23:48.267799,2025-04-24 22:23:56.056455,0 days 00:00:07.788656,0.07830458522136503,12,,1,8,1269,0.9180216340759552,TPESampler,COMPLETE
1556,0.2949010686683984,2025-04-24 22:23:49.364348,2025-04-24 22:23:58.204532,0 days 00:00:08.840184,0.05181853569228449,12,,2,11,1476,0.9370175524235147,TPESampler,COMPLETE
1557,0.3079907601315006,2025-04-24 22:23:49.822512,2025-04-24 22:23:55.795948,0 days 00:00:05.973436,0.066579225176498,12,,2,11,1021,0.9253229747455626,TPESampler,COMPLETE
1558,0.3229907650837371,2025-04-24 22:23:55.988272,2025-04-24 22:23:58.297531,0 days 00:00:02.309259,0.09827303364468584,12,sqrt,3,13,1442,0.9877257316791268,TPESampler,COMPLETE
1559,0.33573627117342514,2025-04-24 22:23:56.304591,2025-04-24 22:24:01.348067,0 days 00:00:05.043476,0.065841434586099,10,,1,11,794,0.9936469087030054,TPESampler,COMPLETE
1560,0.33036285851449704,2025-04-24 22:23:58.380019,2025-04-24 22:24:06.992959,0 days 00:00:08.612940,0.09708297519946425,10,,1,11,1469,0.9950058649880482,TPESampler,COMPLETE
1561,0.3612344053922847,2025-04-24 22:23:58.509426,2025-04-24 22:24:07.138754,0 days 00:00:08.629328,0.0537012760386232,12,,3,11,1371,0.9894174843791258,TPESampler,COMPLETE
1562,0.6265992667147172,2025-04-24 22:24:01.538209,2025-04-24 22:24:02.599582,0 days 00:00:01.061373,0.013601082952286419,5,log2,2,10,512,0.8000340472087056,TPESampler,COMPLETE
1563,0.3263139767789991,2025-04-24 22:24:02.798550,2025-04-24 22:24:10.806685,0 days 00:00:08.008135,0.07245761180968191,12,,1,13,1256,0.9543471271707858,TPESampler,COMPLETE
1564,0.42503906668343666,2025-04-24 22:24:07.189607,2025-04-24 22:24:09.805588,0 days 00:00:02.615981,0.01035480155230915,3,,6,14,1075,0.6707058802367518,TPESampler,COMPLETE
1565,0.2923408752964035,2025-04-24 22:24:07.346542,2025-04-24 22:24:15.860980,0 days 00:00:08.514438,0.0659251791681854,12,,2,12,1314,0.9962688653695773,TPESampler,COMPLETE
1566,0.3265520115933524,2025-04-24 22:24:10.002972,2025-04-24 22:24:17.533750,0 days 00:00:07.530778,0.08878958833287776,12,,1,12,1250,0.9073258405377204,TPESampler,COMPLETE
1567,0.3535533449076999,2025-04-24 22:24:10.994430,2025-04-24 22:24:18.488621,0 days 00:00:07.494191,0.09532176244462853,12,,3,17,1250,0.974252743921458,TPESampler,COMPLETE
1568,0.3163592757563408,2025-04-24 22:24:16.053870,2025-04-24 22:24:22.787938,0 days 00:00:06.734068,0.06025389761549163,10,,2,13,1159,0.9821267472495724,TPESampler,COMPLETE
1569,0.35906139492305955,2025-04-24 22:24:17.809340,2025-04-24 22:24:25.563861,0 days 00:00:07.754521,0.08321782573811688,12,,3,12,1288,0.9414754316771223,TPESampler,COMPLETE
1570,0.3627114853601812,2025-04-24 22:24:18.693613,2025-04-24 22:24:25.159679,0 days 00:00:06.466066,0.09871426420313402,10,,4,12,1184,0.9647735093957928,TPESampler,COMPLETE
1571,0.31455231659352323,2025-04-24 22:24:22.992035,2025-04-24 22:24:29.436585,0 days 00:00:06.444550,0.08920748776591636,12,,1,10,934,0.9905455883349672,TPESampler,COMPLETE
1572,0.33095621610061254,2025-04-24 22:24:25.348940,2025-04-24 22:24:32.406328,0 days 00:00:07.057388,0.0697790900145459,12,,1,12,1057,0.9980045070913829,TPESampler,COMPLETE
1573,0.3039768548912773,2025-04-24 22:24:25.801316,2025-04-24 22:24:34.205603,0 days 00:00:08.404287,0.06805425564763473,12,,2,13,1405,0.9360350219750787,TPESampler,COMPLETE
1574,0.37161179955279594,2025-04-24 22:24:29.885175,2025-04-24 22:24:35.434638,0 days 00:00:05.549463,0.09962083754766879,11,,3,10,971,0.9005038546360034,TPESampler,COMPLETE
1575,0.34472345835616736,2025-04-24 22:24:32.601348,2025-04-24 22:24:35.676106,0 days 00:00:03.074758,0.03232889779018695,9,,3,11,741,0.6115862526381837,TPESampler,COMPLETE
1576,0.3569777869865509,2025-04-24 22:24:34.395607,2025-04-24 22:24:42.761858,0 days 00:00:08.366251,0.08207924391347057,10,,3,13,1423,0.9982937415525169,TPESampler,COMPLETE
1577,0.4553714431869211,2025-04-24 22:24:35.633377,2025-04-24 22:24:36.925099,0 days 00:00:01.291722,0.018648061301389778,9,sqrt,9,17,605,0.9433321395428356,TPESampler,COMPLETE
1578,0.31623827694486173,2025-04-24 22:24:35.963274,2025-04-24 22:24:45.899111,0 days 00:00:09.935837,0.09759605639321388,12,,1,11,1477,0.9944155156650144,TPESampler,COMPLETE
1579,0.3676543628683223,2025-04-24 22:24:37.170867,2025-04-24 22:24:39.166087,0 days 00:00:01.995220,0.05169098819738602,11,log2,1,14,1394,0.9438758798874767,TPESampler,COMPLETE
1580,0.34962913649029936,2025-04-24 22:24:39.375665,2025-04-24 22:24:46.450582,0 days 00:00:07.074917,0.0521793907901813,12,,3,13,1117,0.9712920622286918,TPESampler,COMPLETE
1581,0.43184627952528076,2025-04-24 22:24:42.964241,2025-04-24 22:24:44.347419,0 days 00:00:01.383178,0.02295564652270632,3,sqrt,2,9,823,0.7532259791064536,TPESampler,COMPLETE
1582,0.3308281714934306,2025-04-24 22:24:44.561824,2025-04-24 22:24:50.072943,0 days 00:00:05.511119,0.05825579831406947,12,,1,13,747,0.9986909480886205,TPESampler,COMPLETE
1583,0.4013256398388532,2025-04-24 22:24:46.115459,2025-04-24 22:24:52.477087,0 days 00:00:06.361628,0.07650259272584733,12,,5,11,948,0.989545764777002,TPESampler,COMPLETE
1584,0.32456383702493097,2025-04-24 22:24:46.659341,2025-04-24 22:24:48.615415,0 days 00:00:01.956074,0.0963943400776908,12,sqrt,3,12,1123,0.9985068449067647,TPESampler,COMPLETE
1585,0.5023642090893871,2025-04-24 22:24:48.823165,2025-04-24 22:24:50.104482,0 days 00:00:01.281317,0.017122213602873013,9,sqrt,10,10,762,0.6920654956326554,TPESampler,COMPLETE
1586,0.29968653953016106,2025-04-24 22:24:50.215498,2025-04-24 22:24:58.756882,0 days 00:00:08.541384,0.08111634298145644,11,,2,13,1387,0.9995213768277849,TPESampler,COMPLETE
1587,0.3643342321944348,2025-04-24 22:24:50.272176,2025-04-24 22:24:58.820974,0 days 00:00:08.548798,0.0909666287064142,12,,3,14,1477,0.928013471725954,TPESampler,COMPLETE
1588,0.6067561869695535,2025-04-24 22:24:52.753575,2025-04-24 22:24:53.814322,0 days 00:00:01.060747,0.012445150698123086,11,log2,2,19,348,0.973313266129699,TPESampler,COMPLETE
1589,0.30302697090465397,2025-04-24 22:24:54.017580,2025-04-24 22:25:02.035820,0 days 00:00:08.018240,0.061493510001138424,12,,2,14,1233,0.985658112473265,TPESampler,COMPLETE
1590,0.37607808343490695,2025-04-24 22:24:59.147226,2025-04-24 22:25:00.960026,0 days 00:00:01.812800,0.06641439580993093,12,,5,5,260,0.6754577745348368,TPESampler,COMPLETE
1591,0.5154100804466729,2025-04-24 22:24:59.235245,2025-04-24 22:25:00.419855,0 days 00:00:01.184610,0.02548448008444368,3,,6,15,141,0.6845376728280888,TPESampler,COMPLETE
1592,0.36158829867780856,2025-04-24 22:25:00.839332,2025-04-24 22:25:08.078483,0 days 00:00:07.239151,0.09865062471487895,12,,3,13,1195,0.957512322534462,TPESampler,COMPLETE
1593,0.3141031953403185,2025-04-24 22:25:01.197633,2025-04-24 22:25:07.167591,0 days 00:00:05.969958,0.09944288049789766,9,,2,14,1068,0.9988802955407806,TPESampler,COMPLETE
1594,0.5921941154440435,2025-04-24 22:25:02.240024,2025-04-24 22:25:03.547625,0 days 00:00:01.307601,0.02406358614008366,9,log2,7,7,843,0.7676903837793991,TPESampler,COMPLETE
1595,0.3628858536019235,2025-04-24 22:25:03.741718,2025-04-24 22:25:10.441413,0 days 00:00:06.699695,0.07131878219881797,11,,3,12,1076,0.998530083713119,TPESampler,COMPLETE
1596,0.35329112346355146,2025-04-24 22:25:07.876077,2025-04-24 22:25:10.420203,0 days 00:00:02.544126,0.06430391645846918,12,sqrt,1,13,1477,0.9706396672414286,TPESampler,COMPLETE
1597,0.3404826252489572,2025-04-24 22:25:08.326343,2025-04-24 22:25:15.182939,0 days 00:00:06.856596,0.031556753288146173,10,,1,15,1016,0.9931608344710661,TPESampler,COMPLETE
1598,0.38944553829843015,2025-04-24 22:25:10.597678,2025-04-24 22:25:12.511526,0 days 00:00:01.913848,0.05696146238389618,8,sqrt,5,10,863,0.7552554524653257,TPESampler,COMPLETE
1599,0.47128067000593415,2025-04-24 22:25:10.646045,2025-04-24 22:25:12.393874,0 days 00:00:01.747829,0.0612630331616258,10,log2,6,15,595,0.7843968883328318,TPESampler,COMPLETE
1600,0.38170927892412176,2025-04-24 22:25:12.567340,2025-04-24 22:25:13.905066,0 days 00:00:01.337726,0.08598128333122905,10,,5,16,124,0.7438029153361392,TPESampler,COMPLETE
1601,0.3367198931816218,2025-04-24 22:25:12.715369,2025-04-24 22:25:18.195195,0 days 00:00:05.479826,0.050119514589236566,9,,1,4,963,0.7703461776756231,TPESampler,COMPLETE
1602,0.6370765429664713,2025-04-24 22:25:14.249799,2025-04-24 22:25:16.874755,0 days 00:00:02.624956,0.012662155558794044,6,log2,7,6,1466,0.6324411227492739,TPESampler,COMPLETE
1603,0.41587456033636944,2025-04-24 22:25:15.390858,2025-04-24 22:25:17.127085,0 days 00:00:01.736227,0.04320535484105826,3,sqrt,1,8,733,0.6058831465465531,TPESampler,COMPLETE
1604,0.32396070213435024,2025-04-24 22:25:17.081204,2025-04-24 22:25:26.359389,0 days 00:00:09.278185,0.06844115830374238,12,,1,14,1426,0.9870636167798187,TPESampler,COMPLETE
1605,0.3027601587408512,2025-04-24 22:25:17.387446,2025-04-24 22:25:24.561044,0 days 00:00:07.173598,0.06954311154944266,12,,2,16,1096,0.9942502703143956,TPESampler,COMPLETE
1606,0.3903206776316651,2025-04-24 22:25:18.424635,2025-04-24 22:25:19.787624,0 days 00:00:01.362989,0.028112512227770968,10,sqrt,6,7,745,0.7815389341590256,TPESampler,COMPLETE
1607,0.30532595759607006,2025-04-24 22:25:20.006084,2025-04-24 22:25:27.767669,0 days 00:00:07.761585,0.0974813872212713,12,,2,16,1222,0.9752957164410323,TPESampler,COMPLETE
1608,0.408145323983042,2025-04-24 22:25:24.765761,2025-04-24 22:25:26.360858,0 days 00:00:01.595097,0.010149939911720605,9,,1,20,325,0.6083545500429397,TPESampler,COMPLETE
1609,0.3003155662597651,2025-04-24 22:25:26.537484,2025-04-24 22:25:35.532291,0 days 00:00:08.994807,0.07201704266266708,12,,2,14,1418,0.989809850045957,TPESampler,COMPLETE
1610,0.3570856302646552,2025-04-24 22:25:26.590910,2025-04-24 22:25:35.506892,0 days 00:00:08.915982,0.06763809457094022,12,,4,15,1450,0.9734600505038244,TPESampler,COMPLETE
1611,0.3613499400805699,2025-04-24 22:25:28.006248,2025-04-24 22:25:33.493351,0 days 00:00:05.487103,0.08520041210758243,12,,3,13,865,0.9970690225718957,TPESampler,COMPLETE
1612,0.30072583347000337,2025-04-24 22:25:33.702354,2025-04-24 22:25:40.793832,0 days 00:00:07.091478,0.09989108425258951,12,,2,12,1168,0.9304525852287493,TPESampler,COMPLETE
1613,0.35369641769132865,2025-04-24 22:25:35.752537,2025-04-24 22:25:44.156619,0 days 00:00:08.404082,0.035434987669335775,10,,4,9,1467,0.9936555864344881,TPESampler,COMPLETE
1614,0.3770705354449904,2025-04-24 22:25:35.801764,2025-04-24 22:25:44.452101,0 days 00:00:08.650337,0.07108598275630884,11,,4,11,1423,0.996869130831925,TPESampler,COMPLETE
1615,0.369923537719231,2025-04-24 22:25:41.001645,2025-04-24 22:25:42.285343,0 days 00:00:01.283698,0.0633288695007654,11,log2,3,20,722,0.973989417626989,TPESampler,COMPLETE
1616,0.3760217122422715,2025-04-24 22:25:42.480321,2025-04-24 22:25:48.928045,0 days 00:00:06.447724,0.08589773792216247,12,,4,9,936,0.9985002706368203,TPESampler,COMPLETE
1617,0.3494769517403471,2025-04-24 22:25:44.394706,2025-04-24 22:25:51.816575,0 days 00:00:07.421869,0.046483182791758865,10,,1,13,1221,0.9909675421978554,TPESampler,COMPLETE
