number,value,datetime_start,datetime_complete,duration,params_learning_rate,params_max_depth,params_max_features,params_min_samples_leaf,params_min_samples_split,params_n_estimators,params_subsample,system_attrs_auto:sampler,state
873,0.2992111644792691,2025-04-24 22:00:54.110737,2025-04-24 22:01:02.241777,0 days 00:00:08.131040,0.08676945999747696,12,,2,9,1338,0.9676198361884241,TPESampler,COMPLETE
874,0.37913265979963734,2025-04-24 22:00:57.623944,2025-04-24 22:01:05.268830,0 days 00:00:07.644886,0.08138227798781791,11,,3,8,1342,0.9719711959430866,TPESampler,COMPLETE
875,0.31957778483569727,2025-04-24 22:01:01.872598,2025-04-24 22:01:10.869572,0 days 00:00:08.996974,0.09696741813624461,12,,1,8,1443,0.9526202246668863,TPESampler,COMPLETE
876,0.2999464654323502,2025-04-24 22:01:02.436495,2025-04-24 22:01:09.502801,0 days 00:00:07.066306,0.09975954166009114,12,,2,10,1181,0.9506775665061837,TPESampler,COMPLETE
877,0.33790927310543456,2025-04-24 22:01:05.446878,2025-04-24 22:01:12.289666,0 days 00:00:06.842788,0.08297642816799589,10,,1,10,1169,0.9913670735912418,TPESampler,COMPLETE
878,0.33712927084036626,2025-04-24 22:01:09.712982,2025-04-24 22:01:18.013544,0 days 00:00:08.300562,0.04186761752845146,10,,1,13,1464,0.991633855356617,TPESampler,COMPLETE
879,0.33190480408679524,2025-04-24 22:01:11.046132,2025-04-24 22:01:19.214288,0 days 00:00:08.168156,0.0508991312127443,11,,1,9,1330,0.9979737569176034,TPESampler,COMPLETE
880,0.3153413910835865,2025-04-24 22:01:12.475811,2025-04-24 22:01:19.497041,0 days 00:00:07.021230,0.084017632745358,12,,2,12,1188,0.8740418628291738,TPESampler,COMPLETE
881,0.31457441322830254,2025-04-24 22:01:18.212458,2025-04-24 22:01:25.416252,0 days 00:00:07.203794,0.08496360512781562,12,,2,8,1112,0.998406920498082,TPESampler,COMPLETE
882,0.3595514706431179,2025-04-24 22:01:19.399087,2025-04-24 22:01:26.515167,0 days 00:00:07.116080,0.07053682644617834,9,,3,11,1493,0.9162085745683975,TPESampler,COMPLETE
883,0.3627760447361841,2025-04-24 22:01:19.769519,2025-04-24 22:01:27.905333,0 days 00:00:08.135814,0.08159049605281513,12,,3,8,1273,0.9699615281252605,TPESampler,COMPLETE
884,0.32170498756790183,2025-04-24 22:01:25.595987,2025-04-24 22:01:27.952537,0 days 00:00:02.356550,0.05558803113829104,11,sqrt,3,15,1265,0.6729821215095633,TPESampler,COMPLETE
885,0.35875217962239103,2025-04-24 22:01:26.695237,2025-04-24 22:01:29.277880,0 days 00:00:02.582643,0.07064206624943756,12,sqrt,1,10,1205,0.9861103727366691,TPESampler,COMPLETE
886,0.3483555593251527,2025-04-24 22:01:28.054557,2025-04-24 22:01:32.942353,0 days 00:00:04.887796,0.09649742223031159,9,,3,11,875,0.9569507414906716,TPESampler,COMPLETE
887,0.3291227045968327,2025-04-24 22:01:28.184432,2025-04-24 22:01:35.805261,0 days 00:00:07.620829,0.09741508794314428,12,,1,10,1166,0.9417743794206499,TPESampler,COMPLETE
888,0.3792258642798297,2025-04-24 22:01:29.506852,2025-04-24 22:01:38.232054,0 days 00:00:08.725202,0.08956019434304403,12,,3,8,1476,0.983962809400373,TPESampler,COMPLETE
889,0.318395667598678,2025-04-24 22:01:33.144802,2025-04-24 22:01:39.660091,0 days 00:00:06.515289,0.060426314746807,10,,2,14,1136,0.9951773491535508,TPESampler,COMPLETE
890,0.3542606671044391,2025-04-24 22:01:35.977282,2025-04-24 22:01:43.159825,0 days 00:00:07.182543,0.033957111988402025,9,,4,4,1408,0.9783783838623875,TPESampler,COMPLETE
891,0.34945238705215953,2025-04-24 22:01:38.407907,2025-04-24 22:01:45.596251,0 days 00:00:07.188344,0.09228322279288376,12,,3,17,1176,0.9957609349469225,TPESampler,COMPLETE
892,0.32156997622822303,2025-04-24 22:01:39.864481,2025-04-24 22:01:46.819045,0 days 00:00:06.954564,0.05124861376155939,12,,1,10,1151,0.910942652436153,TPESampler,COMPLETE
893,0.28946938715341525,2025-04-24 22:01:43.357720,2025-04-24 22:01:52.060774,0 days 00:00:08.703054,0.07969379713131061,12,,2,12,1447,0.9681887916342952,TPESampler,COMPLETE
894,0.36307736657403683,2025-04-24 22:01:45.771467,2025-04-24 22:01:54.566414,0 days 00:00:08.794947,0.04279160585513272,12,,3,9,1472,0.9835850738568358,TPESampler,COMPLETE
895,0.37335447967978697,2025-04-24 22:01:46.998011,2025-04-24 22:01:55.809395,0 days 00:00:08.811384,0.050804694230314494,12,,3,7,1439,0.994448278325861,TPESampler,COMPLETE
896,0.37414584081520785,2025-04-24 22:01:52.231823,2025-04-24 22:02:00.057818,0 days 00:00:07.825995,0.086388312770637,12,,3,11,1221,0.993256582419401,TPESampler,COMPLETE
897,0.8211780902701188,2025-04-24 22:01:54.741279,2025-04-24 22:01:55.482983,0 days 00:00:00.741704,0.013645194296776447,5,sqrt,10,16,150,0.90518272679838,TPESampler,COMPLETE
898,0.35705801313033236,2025-04-24 22:01:55.659002,2025-04-24 22:01:58.362144,0 days 00:00:02.703142,0.048115765669415785,3,,2,7,969,0.8068306967016979,TPESampler,COMPLETE
899,0.45142085379243485,2025-04-24 22:01:56.017394,2025-04-24 22:01:58.976684,0 days 00:00:02.959290,0.027318903441153074,5,,10,8,779,0.8855680519046123,TPESampler,COMPLETE
900,0.35639469604760726,2025-04-24 22:01:58.550741,2025-04-24 22:02:05.435138,0 days 00:00:06.884397,0.060748647583468506,12,,3,10,1167,0.8926570288452881,TPESampler,COMPLETE
901,0.36764433657983625,2025-04-24 22:01:59.170997,2025-04-24 22:02:01.245608,0 days 00:00:02.074611,0.05827001175052653,5,sqrt,4,4,1492,0.6349447430978831,TPESampler,COMPLETE
902,0.3009374516873094,2025-04-24 22:02:00.240019,2025-04-24 22:02:08.592146,0 days 00:00:08.352127,0.06590714784922834,12,,2,11,1303,0.9784254759485487,TPESampler,COMPLETE
903,0.4312652285860026,2025-04-24 22:02:01.449920,2025-04-24 22:02:04.566502,0 days 00:00:03.116582,0.05600872768880085,12,,10,3,927,0.6255745377060401,TPESampler,COMPLETE
904,0.29976332406742956,2025-04-24 22:02:04.737275,2025-04-24 22:02:13.186369,0 days 00:00:08.449094,0.08024672172048221,12,,2,12,1430,0.9063784354016311,TPESampler,COMPLETE
905,0.3389222200156451,2025-04-24 22:02:05.631676,2025-04-24 22:02:06.809360,0 days 00:00:01.177684,0.0921791012850868,12,sqrt,4,10,483,0.9030299994390869,TPESampler,COMPLETE
906,0.3443813838195291,2025-04-24 22:02:07.009339,2025-04-24 22:02:11.611928,0 days 00:00:04.602589,0.0572997464346083,5,,3,20,1406,0.8849881113933897,TPESampler,COMPLETE
907,0.3011149301864668,2025-04-24 22:02:08.781535,2025-04-24 22:02:16.932417,0 days 00:00:08.150882,0.05883093675493408,10,,2,12,1374,0.9389150787997271,TPESampler,COMPLETE
908,0.8831787772921235,2025-04-24 22:02:11.801213,2025-04-24 22:02:12.843883,0 days 00:00:01.042670,0.012228704460471945,12,log2,10,11,478,0.7073632178204238,TPESampler,COMPLETE
909,0.34126215393966597,2025-04-24 22:02:13.057130,2025-04-24 22:02:21.351339,0 days 00:00:08.294209,0.06926117361330743,11,,3,15,1483,0.9543571774066505,TPESampler,COMPLETE
910,0.4387327444886297,2025-04-24 22:02:13.386104,2025-04-24 22:02:14.491829,0 days 00:00:01.105725,0.08369797043005058,11,log2,6,2,570,0.704226652581855,TPESampler,COMPLETE
911,0.32318666453815953,2025-04-24 22:02:14.700863,2025-04-24 22:02:18.926500,0 days 00:00:04.225637,0.09946044139752831,12,,1,9,643,0.9077165875959209,TPESampler,COMPLETE
912,0.3604835995752729,2025-04-24 22:02:17.120886,2025-04-24 22:02:23.152233,0 days 00:00:06.031347,0.0896839594694937,12,,3,14,1003,0.953357559855428,TPESampler,COMPLETE
913,0.3671595561133914,2025-04-24 22:02:19.109039,2025-04-24 22:02:23.929020,0 days 00:00:04.819981,0.0946129154967298,11,,3,12,953,0.8022384918836394,TPESampler,COMPLETE
914,0.3501965726463,2025-04-24 22:02:21.541082,2025-04-24 22:02:28.895882,0 days 00:00:07.354800,0.08869300679957043,10,,1,14,1230,0.995171013727387,TPESampler,COMPLETE
915,0.2966325017666354,2025-04-24 22:02:23.329446,2025-04-24 22:02:31.892633,0 days 00:00:08.563187,0.05181351070630519,11,,2,9,1415,0.9994262135357569,TPESampler,COMPLETE
916,0.5430386366104623,2025-04-24 22:02:24.129262,2025-04-24 22:02:25.319100,0 days 00:00:01.189838,0.02646956867137919,5,log2,5,16,715,0.7176148608172165,TPESampler,COMPLETE
917,0.30561447628562893,2025-04-24 22:02:25.498553,2025-04-24 22:02:33.883501,0 days 00:00:08.384948,0.07031721401784839,12,,2,9,1457,0.9151615183120827,TPESampler,COMPLETE
918,0.34937271178488194,2025-04-24 22:02:29.177795,2025-04-24 22:02:36.541059,0 days 00:00:07.363264,0.09085609535582344,12,,3,12,1304,0.9353390485491081,TPESampler,COMPLETE
919,0.327709965165331,2025-04-24 22:02:32.091433,2025-04-24 22:02:40.932186,0 days 00:00:08.840753,0.05032263536020121,12,,1,11,1373,0.9901750519277488,TPESampler,COMPLETE
920,0.36606233197481725,2025-04-24 22:02:34.077495,2025-04-24 22:02:41.338501,0 days 00:00:07.261006,0.09943158683433598,11,,3,9,1343,0.9369400216433814,TPESampler,COMPLETE
921,0.3616417237211326,2025-04-24 22:02:36.724831,2025-04-24 22:02:42.959617,0 days 00:00:06.234786,0.05299782472263707,10,,4,11,1122,0.9932813832937825,TPESampler,COMPLETE
922,0.3234241228470136,2025-04-24 22:02:41.198951,2025-04-24 22:02:50.471016,0 days 00:00:09.272065,0.07310420945346387,11,,1,7,1488,0.9790952545901007,TPESampler,COMPLETE
923,0.3227676262860768,2025-04-24 22:02:41.541499,2025-04-24 22:02:44.191317,0 days 00:00:02.649818,0.09087587216695352,12,log2,3,12,1359,0.9570118672446253,TPESampler,COMPLETE
924,0.2941713487745204,2025-04-24 22:02:43.270297,2025-04-24 22:02:53.050643,0 days 00:00:09.780346,0.04676639785151294,12,,2,11,1464,0.9773151208376349,TPESampler,COMPLETE
925,0.37058192808605106,2025-04-24 22:02:44.477203,2025-04-24 22:02:46.886376,0 days 00:00:02.409173,0.07981259127434086,9,log2,2,16,1243,0.9585294541158936,TPESampler,COMPLETE
926,0.36435365579305024,2025-04-24 22:02:47.381542,2025-04-24 22:02:55.059073,0 days 00:00:07.677531,0.05112344824475108,10,,4,9,1307,0.9798322659401383,TPESampler,COMPLETE
927,0.38741143410312434,2025-04-24 22:02:50.862981,2025-04-24 22:02:58.297886,0 days 00:00:07.434905,0.010087560410210434,11,,7,5,1430,0.854446494271199,TPESampler,COMPLETE
928,0.2998283906478416,2025-04-24 22:02:53.380329,2025-04-24 22:03:01.846402,0 days 00:00:08.466073,0.07475774127784407,10,,2,13,1489,0.9783193439717809,TPESampler,COMPLETE
929,0.31946796515454784,2025-04-24 22:02:55.364033,2025-04-24 22:03:02.916828,0 days 00:00:07.552795,0.04238686032025028,9,,2,7,1473,0.9444144504193253,TPESampler,COMPLETE
930,0.3155026965890611,2025-04-24 22:02:58.489605,2025-04-24 22:03:06.972786,0 days 00:00:08.483181,0.04440751597903218,11,,2,5,1337,0.9976425613534144,TPESampler,COMPLETE
931,0.3487329809016829,2025-04-24 22:03:02.024981,2025-04-24 22:03:04.506276,0 days 00:00:02.481295,0.07379722362650118,11,sqrt,1,4,1395,0.9697396462816938,TPESampler,COMPLETE
932,0.3577865009713722,2025-04-24 22:03:03.092382,2025-04-24 22:03:12.112391,0 days 00:00:09.020009,0.04397536475483605,12,,4,11,1474,0.9748601374705204,TPESampler,COMPLETE
933,0.35751231151914764,2025-04-24 22:03:04.688169,2025-04-24 22:03:12.083533,0 days 00:00:07.395364,0.09059547227113329,12,,3,13,1188,0.9775510099423811,TPESampler,COMPLETE
934,0.36467038462242324,2025-04-24 22:03:07.151114,2025-04-24 22:03:08.716972,0 days 00:00:01.565858,0.0718238699701314,12,log2,2,10,942,0.999258871001048,TPESampler,COMPLETE
935,0.43659399276956223,2025-04-24 22:03:08.893783,2025-04-24 22:03:10.931457,0 days 00:00:02.037674,0.08571111646909503,5,,9,2,551,0.8482157054559518,TPESampler,COMPLETE
936,0.30920571397079033,2025-04-24 22:03:11.112042,2025-04-24 22:03:18.616339,0 days 00:00:07.504297,0.05880374590183692,10,,2,10,1336,0.9784046387803608,TPESampler,COMPLETE
937,0.4505417693996085,2025-04-24 22:03:12.226557,2025-04-24 22:03:17.016161,0 days 00:00:04.789604,0.016514526148965317,9,,10,18,1499,0.6181562140161526,TPESampler,COMPLETE
938,0.3179389957483613,2025-04-24 22:03:12.274099,2025-04-24 22:03:21.465681,0 days 00:00:09.191582,0.09639060131186844,12,,1,11,1441,0.9444597627149995,TPESampler,COMPLETE
939,0.29796413755218354,2025-04-24 22:03:17.214086,2025-04-24 22:03:25.612124,0 days 00:00:08.398038,0.0377387408367102,12,,2,10,1351,0.9634659364781049,TPESampler,COMPLETE
940,0.360193541991897,2025-04-24 22:03:18.788761,2025-04-24 22:03:24.155817,0 days 00:00:05.367056,0.09808324292350923,9,,4,13,1045,0.9838386872738396,TPESampler,COMPLETE
941,0.3870114427826844,2025-04-24 22:03:21.651994,2025-04-24 22:03:24.449987,0 days 00:00:02.797993,0.04473634251714265,4,,6,15,930,0.827459448876626,TPESampler,COMPLETE
942,0.3258386334360591,2025-04-24 22:03:24.329757,2025-04-24 22:03:29.256325,0 days 00:00:04.926568,0.09826743351142979,12,,1,6,709,0.9743087487285688,TPESampler,COMPLETE
943,0.35829940017296874,2025-04-24 22:03:24.658360,2025-04-24 22:03:32.245853,0 days 00:00:07.587493,0.05131699797922672,10,,3,8,1454,0.910892861231037,TPESampler,COMPLETE
944,0.45144150698194296,2025-04-24 22:03:25.786247,2025-04-24 22:03:26.924312,0 days 00:00:01.138065,0.016430065927825612,11,,7,10,171,0.7077266386010757,TPESampler,COMPLETE
945,0.35541557652718825,2025-04-24 22:03:27.104389,2025-04-24 22:03:35.306747,0 days 00:00:08.202358,0.0514113235830463,10,,3,10,1478,0.9811665962642208,TPESampler,COMPLETE
946,0.35023539210433696,2025-04-24 22:03:29.437034,2025-04-24 22:03:33.652534,0 days 00:00:04.215500,0.011150707229235111,11,,4,11,1023,0.6502170077739189,TPESampler,COMPLETE
947,0.33433383041101883,2025-04-24 22:03:32.436408,2025-04-24 22:03:41.742903,0 days 00:00:09.306495,0.05151352234339916,11,,1,11,1482,0.996523727399549,TPESampler,COMPLETE
948,0.3819064422595173,2025-04-24 22:03:33.835049,2025-04-24 22:03:35.991073,0 days 00:00:02.156024,0.06031399805694795,9,sqrt,5,5,1440,0.8118993408080982,TPESampler,COMPLETE
949,0.3310797830565268,2025-04-24 22:03:35.483805,2025-04-24 22:03:44.342612,0 days 00:00:08.858807,0.036064538453943834,12,,1,8,1333,0.9969225588318462,TPESampler,COMPLETE
950,0.5745232429308202,2025-04-24 22:03:36.181941,2025-04-24 22:03:37.370925,0 days 00:00:01.188984,0.03776645095917054,3,log2,10,10,784,0.7879762173678624,TPESampler,COMPLETE
951,0.3307773562221856,2025-04-24 22:03:37.543373,2025-04-24 22:03:44.412222,0 days 00:00:06.868849,0.09790872677978026,12,,1,14,1155,0.9133130807572519,TPESampler,COMPLETE
952,0.29266025155630104,2025-04-24 22:03:41.928475,2025-04-24 22:03:50.315466,0 days 00:00:08.386991,0.09058223207957743,12,,2,14,1337,0.988811921067356,TPESampler,COMPLETE
953,0.2948897144725777,2025-04-24 22:03:44.481423,2025-04-24 22:03:52.713445,0 days 00:00:08.232022,0.083908273073186,12,,2,11,1257,0.9958173564332646,TPESampler,COMPLETE
954,0.355932194085566,2025-04-24 22:03:44.600537,2025-04-24 22:03:46.573410,0 days 00:00:01.972873,0.09950480684690877,9,sqrt,1,12,1161,0.9968894310172961,TPESampler,COMPLETE
955,0.2970718020323422,2025-04-24 22:03:46.761101,2025-04-24 22:03:52.979083,0 days 00:00:06.217982,0.09682472047827144,12,,2,10,966,0.9772053534456758,TPESampler,COMPLETE
956,0.7309718683070351,2025-04-24 22:03:50.493792,2025-04-24 22:03:52.100375,0 days 00:00:01.606583,0.011522557288921589,9,log2,6,17,809,0.6183771821556917,TPESampler,COMPLETE
957,0.4495720164572526,2025-04-24 22:03:52.289218,2025-04-24 22:03:53.591296,0 days 00:00:01.302078,0.036454086076405046,10,sqrt,9,17,431,0.882431178265579,TPESampler,COMPLETE
958,0.3666141773935967,2025-04-24 22:03:52.907551,2025-04-24 22:04:01.153273,0 days 00:00:08.245722,0.09232172889795763,11,,3,13,1394,0.99827802067798,TPESampler,COMPLETE
959,0.3306217685215634,2025-04-24 22:03:53.216482,2025-04-24 22:03:55.172080,0 days 00:00:01.955598,0.06475360089323545,12,sqrt,4,6,1149,0.7052049772742994,TPESampler,COMPLETE
960,0.31846780578870487,2025-04-24 22:03:53.797154,2025-04-24 22:04:03.115373,0 days 00:00:09.318219,0.09752316350802111,12,,1,13,1499,0.9716216436294578,TPESampler,COMPLETE
961,0.2994400686581292,2025-04-24 22:03:55.352853,2025-04-24 22:04:03.272977,0 days 00:00:07.920124,0.06779870847162184,12,,2,15,1355,0.9466600427950019,TPESampler,COMPLETE
962,0.34024098222232196,2025-04-24 22:04:01.322124,2025-04-24 22:04:08.378132,0 days 00:00:07.056008,0.05204342889752789,10,,1,13,1226,0.9188353271718905,TPESampler,COMPLETE
963,0.3462605166251865,2025-04-24 22:04:03.280262,2025-04-24 22:04:09.803878,0 days 00:00:06.523616,0.03607989947940885,8,,4,11,1472,0.845654574027111,TPESampler,COMPLETE
964,0.36213303147886877,2025-04-24 22:04:03.442262,2025-04-24 22:04:05.229825,0 days 00:00:01.787563,0.05279846892210379,12,sqrt,1,13,909,0.8389653799868912,TPESampler,COMPLETE
965,0.36609682430545787,2025-04-24 22:04:05.407177,2025-04-24 22:04:07.577076,0 days 00:00:02.169899,0.021650735675068294,6,sqrt,4,2,1464,0.7832434403586591,TPESampler,COMPLETE
966,0.3542680941041202,2025-04-24 22:04:07.756293,2025-04-24 22:04:16.118082,0 days 00:00:08.361789,0.05487928433262004,12,,3,15,1422,0.9735719467564757,TPESampler,COMPLETE
967,0.2929311848983927,2025-04-24 22:04:08.559707,2025-04-24 22:04:17.608791,0 days 00:00:09.049084,0.049870602244422794,12,,2,9,1492,0.97191289825394,TPESampler,COMPLETE
968,0.2991578167775229,2025-04-24 22:04:10.001436,2025-04-24 22:04:18.504429,0 days 00:00:08.502993,0.08596368248081449,12,,2,15,1378,0.9900409713746593,TPESampler,COMPLETE
969,0.3645939099512145,2025-04-24 22:04:16.307606,2025-04-24 22:04:24.761992,0 days 00:00:08.454386,0.06274721585304076,12,,3,9,1406,0.9830502570122704,TPESampler,COMPLETE
970,0.34973684006580147,2025-04-24 22:04:17.787636,2025-04-24 22:04:24.930671,0 days 00:00:07.143035,0.05485078189820291,11,,3,11,1426,0.8727307482255326,TPESampler,COMPLETE
971,0.3256440480796818,2025-04-24 22:04:18.679211,2025-04-24 22:04:27.438644,0 days 00:00:08.759433,0.05941061026160242,11,,1,13,1467,0.9897043081935768,TPESampler,COMPLETE
972,0.34924680830841875,2025-04-24 22:04:24.939371,2025-04-24 22:04:33.055781,0 days 00:00:08.116410,0.04581497086312903,12,,4,12,1497,0.912210657500167,TPESampler,COMPLETE
973,0.29878431743376294,2025-04-24 22:04:25.115804,2025-04-24 22:04:32.986076,0 days 00:00:07.870272,0.06246760267098869,12,,2,13,1252,0.9975509979015313,TPESampler,COMPLETE
974,0.321974258699228,2025-04-24 22:04:27.635340,2025-04-24 22:04:36.327623,0 days 00:00:08.692283,0.060424982306313706,12,,1,11,1466,0.9258863199438241,TPESampler,COMPLETE
975,0.358487510716738,2025-04-24 22:04:33.129492,2025-04-24 22:04:40.946398,0 days 00:00:07.816906,0.06396304041677056,11,,3,10,1454,0.9242241851020797,TPESampler,COMPLETE
976,0.3232578004660194,2025-04-24 22:04:33.236669,2025-04-24 22:04:41.985142,0 days 00:00:08.748473,0.029390118691936886,12,,1,11,1482,0.915022294371034,TPESampler,COMPLETE
977,0.34995163791635575,2025-04-24 22:04:36.505922,2025-04-24 22:04:45.287894,0 days 00:00:08.781972,0.05181517580846118,11,,3,11,1468,0.985121842550115,TPESampler,COMPLETE
978,0.36157296192915106,2025-04-24 22:04:41.462581,2025-04-24 22:04:43.616406,0 days 00:00:02.153825,0.07053632557911693,10,log2,1,14,1451,0.8845847142479142,TPESampler,COMPLETE
979,0.3178948040621303,2025-04-24 22:04:42.201384,2025-04-24 22:04:50.313041,0 days 00:00:08.111657,0.05431711877355576,10,,2,10,1385,0.9945365511203046,TPESampler,COMPLETE
980,0.35110576282533595,2025-04-24 22:04:43.791692,2025-04-24 22:04:51.122731,0 days 00:00:07.331039,0.039938851487125095,11,,3,13,1201,0.9999333852418674,TPESampler,COMPLETE
981,0.33509210903586034,2025-04-24 22:04:45.473531,2025-04-24 22:04:52.115214,0 days 00:00:06.641683,0.07352576321685163,9,,1,15,1391,0.8649714693455698,TPESampler,COMPLETE
982,0.34139253835651284,2025-04-24 22:04:50.495353,2025-04-24 22:04:58.342627,0 days 00:00:07.847274,0.044728907483382915,10,,1,11,1466,0.8326565911436791,TPESampler,COMPLETE
983,0.3333529861765452,2025-04-24 22:04:51.475388,2025-04-24 22:04:59.137898,0 days 00:00:07.662510,0.09408609118207813,11,,1,16,1253,0.9479913619012337,TPESampler,COMPLETE
984,0.3601324012975115,2025-04-24 22:04:52.310953,2025-04-24 22:04:54.300404,0 days 00:00:01.989451,0.04339242229910023,12,log2,1,10,1370,0.9112672410140528,TPESampler,COMPLETE
985,0.42791368185427225,2025-04-24 22:04:54.476165,2025-04-24 22:04:55.987526,0 days 00:00:01.511361,0.017160142188093152,7,,6,15,257,0.9675793473402747,TPESampler,COMPLETE
986,0.3648060161912147,2025-04-24 22:04:56.168370,2025-04-24 22:05:04.843629,0 days 00:00:08.675259,0.09429126657612134,11,,3,13,1440,0.9946018841168346,TPESampler,COMPLETE
987,0.4056067675217486,2025-04-24 22:04:58.513395,2025-04-24 22:04:59.806445,0 days 00:00:01.293050,0.06029713241711168,10,sqrt,6,16,554,0.7217512980118667,TPESampler,COMPLETE
988,0.3529637714029676,2025-04-24 22:04:59.330939,2025-04-24 22:05:08.141867,0 days 00:00:08.810928,0.04692060709760492,12,,3,9,1429,0.9587852871394152,TPESampler,COMPLETE
989,0.3573996665401759,2025-04-24 22:05:00.003565,2025-04-24 22:05:01.827098,0 days 00:00:01.823533,0.07906951256925977,11,log2,1,13,1259,0.9729941984117508,TPESampler,COMPLETE
990,0.5041292522992644,2025-04-24 22:05:02.020312,2025-04-24 22:05:03.179363,0 days 00:00:01.159051,0.010362698236446215,5,,3,12,193,0.849303361927682,TPESampler,COMPLETE
991,0.33602846297589767,2025-04-24 22:05:03.373762,2025-04-24 22:05:10.888409,0 days 00:00:07.514647,0.0570411078075402,11,,1,14,1189,0.996607463548173,TPESampler,COMPLETE
992,0.3311617660724695,2025-04-24 22:05:05.023467,2025-04-24 22:05:06.817665,0 days 00:00:01.794198,0.05976901507767971,12,sqrt,3,13,1056,0.9958424478327365,TPESampler,COMPLETE
993,0.6131254140611339,2025-04-24 22:05:06.987591,2025-04-24 22:05:07.832878,0 days 00:00:00.845287,0.048150864334471445,11,log2,6,9,271,0.6314387925898522,TPESampler,COMPLETE
994,0.3316521929442499,2025-04-24 22:05:08.014972,2025-04-24 22:05:13.607058,0 days 00:00:05.592086,0.0691347144607319,10,,3,14,1076,0.9183716083279686,TPESampler,COMPLETE
995,0.30066767481859336,2025-04-24 22:05:08.335901,2025-04-24 22:05:16.971056,0 days 00:00:08.635155,0.039067279683309704,11,,2,9,1486,0.9616254129418212,TPESampler,COMPLETE
996,0.30221705050343184,2025-04-24 22:05:11.069218,2025-04-24 22:05:20.271897,0 days 00:00:09.202679,0.06462464476430657,12,,2,9,1482,0.970175821737293,TPESampler,COMPLETE
997,0.6300305327869176,2025-04-24 22:05:13.790753,2025-04-24 22:05:14.767865,0 days 00:00:00.977112,0.03099937908547418,3,sqrt,3,15,172,0.7559643580074252,TPESampler,COMPLETE
