number,value,datetime_start,datetime_complete,duration,params_learning_rate,params_max_depth,params_max_features,params_min_samples_leaf,params_min_samples_split,params_n_estimators,params_subsample,system_attrs_auto:sampler,state
373,0.307467170555177,2025-04-24 21:45:55.941966,2025-04-24 21:46:04.017480,0 days 00:00:08.075514,0.019005467120460143,11,,2,19,1450,0.9093517123028669,TPESampler,COMPLETE
374,0.30409925177279973,2025-04-24 21:45:56.245656,2025-04-24 21:46:03.212289,0 days 00:00:06.966633,0.026296382545179287,12,,2,18,1242,0.8344883055218517,TPESampler,COMPLETE
375,0.38409728233590495,2025-04-24 21:45:58.904241,2025-04-24 21:46:00.253753,0 days 00:00:01.349512,0.02374021081290012,10,sqrt,6,20,762,0.8905794407586793,TPESampler,COMPLETE
376,0.3978610805912096,2025-04-24 21:46:00.444673,2025-04-24 21:46:02.358914,0 days 00:00:01.914241,0.028807896137473473,11,log2,2,20,1403,0.8809028284294362,TPESampler,COMPLETE
377,0.3067949971117526,2025-04-24 21:46:02.558003,2025-04-24 21:46:10.269453,0 days 00:00:07.711450,0.021319780037263796,11,,2,18,1432,0.8809782821339155,TPESampler,COMPLETE
378,0.3202706037394516,2025-04-24 21:46:03.447833,2025-04-24 21:46:10.270812,0 days 00:00:06.822979,0.01857555059674972,12,,1,19,1204,0.8694730388192762,TPESampler,COMPLETE
379,0.34852902900286825,2025-04-24 21:46:04.235101,2025-04-24 21:46:06.479129,0 days 00:00:02.244028,0.03839408749386034,3,,3,19,745,0.8895810504386106,TPESampler,COMPLETE
380,0.31865613713184204,2025-04-24 21:46:06.684174,2025-04-24 21:46:14.315434,0 days 00:00:07.631260,0.02220298919044958,12,,1,19,1314,0.8992556885066479,TPESampler,COMPLETE
381,0.32988516741669216,2025-04-24 21:46:10.409730,2025-04-24 21:46:18.774286,0 days 00:00:08.364556,0.030457722816475647,12,,1,18,1449,0.8389829463591866,TPESampler,COMPLETE
382,0.31575191886023524,2025-04-24 21:46:10.463912,2025-04-24 21:46:16.907682,0 days 00:00:06.443770,0.02585921279711768,9,,2,15,1349,0.8463680610773902,TPESampler,COMPLETE
383,0.3885311062621479,2025-04-24 21:46:14.516466,2025-04-24 21:46:15.511479,0 days 00:00:00.995013,0.03376210023577305,10,sqrt,5,3,364,0.8415963847545971,TPESampler,COMPLETE
384,0.3817157006614141,2025-04-24 21:46:15.793847,2025-04-24 21:46:17.000988,0 days 00:00:01.207141,0.060250211582116055,10,sqrt,1,3,548,0.6929484124211444,TPESampler,COMPLETE
385,0.4305078861897371,2025-04-24 21:46:17.066057,2025-04-24 21:46:21.724558,0 days 00:00:04.658501,0.05233615253812547,7,,10,13,1252,0.8335486235120774,TPESampler,COMPLETE
386,0.3018539440370512,2025-04-24 21:46:17.184607,2025-04-24 21:46:23.961116,0 days 00:00:06.776509,0.031237550414085342,10,,2,19,1371,0.84540889946737,TPESampler,COMPLETE
387,0.3274617567707167,2025-04-24 21:46:18.965823,2025-04-24 21:46:25.514345,0 days 00:00:06.548522,0.02418931206290358,10,,3,20,1322,0.8930550929548408,TPESampler,COMPLETE
388,0.3254619082220962,2025-04-24 21:46:21.900982,2025-04-24 21:46:27.784719,0 days 00:00:05.883737,0.026597513515705204,12,,3,17,1203,0.746214803043283,TPESampler,COMPLETE
389,0.334453315787713,2025-04-24 21:46:24.132488,2025-04-24 21:46:31.159532,0 days 00:00:07.027044,0.02668795017835122,9,,1,19,1423,0.8857971166191075,TPESampler,COMPLETE
390,0.3283062877463031,2025-04-24 21:46:25.689806,2025-04-24 21:46:31.858373,0 days 00:00:06.168567,0.022706959668396424,12,,3,17,1123,0.8518137025328562,TPESampler,COMPLETE
391,0.3340179349610254,2025-04-24 21:46:27.958563,2025-04-24 21:46:34.604474,0 days 00:00:06.645911,0.021579656130893885,10,,4,19,1403,0.8164202755214388,TPESampler,COMPLETE
392,0.33062593917691047,2025-04-24 21:46:31.325429,2025-04-24 21:46:36.904002,0 days 00:00:05.578573,0.0385347407012363,9,,3,20,1150,0.8716786444588227,TPESampler,COMPLETE
393,0.35835026443299534,2025-04-24 21:46:32.025641,2025-04-24 21:46:34.343877,0 days 00:00:02.318236,0.017399172180816276,12,sqrt,2,19,1464,0.8613232084501137,TPESampler,COMPLETE
394,0.32825768492560653,2025-04-24 21:46:34.518324,2025-04-24 21:46:40.663988,0 days 00:00:06.145664,0.029579490837679037,10,,1,20,1281,0.828444257295416,TPESampler,COMPLETE
395,0.3216615764345864,2025-04-24 21:46:34.793689,2025-04-24 21:46:41.788079,0 days 00:00:06.994390,0.05496187194667029,12,,1,6,1075,0.9587740535593109,TPESampler,COMPLETE
396,0.4308557040353637,2025-04-24 21:46:37.070740,2025-04-24 21:46:40.691010,0 days 00:00:03.620270,0.03971126084722901,9,,9,14,719,0.9372931352025629,TPESampler,COMPLETE
397,0.397247517493047,2025-04-24 21:46:40.812374,2025-04-24 21:46:41.954825,0 days 00:00:01.142451,0.0613987642979683,9,sqrt,6,6,477,0.6298059687818265,TPESampler,COMPLETE
398,0.31258196434749835,2025-04-24 21:46:40.850036,2025-04-24 21:46:48.395715,0 days 00:00:07.545679,0.027292939723552186,12,,2,19,1327,0.8492849550918707,TPESampler,COMPLETE
399,0.31284561462558724,2025-04-24 21:46:41.973775,2025-04-24 21:46:49.556129,0 days 00:00:07.582354,0.021433798602479757,10,,2,19,1486,0.8842159600552598,TPESampler,COMPLETE
400,0.3244453228859377,2025-04-24 21:46:42.162937,2025-04-24 21:46:44.480035,0 days 00:00:02.317098,0.03302937507417563,11,sqrt,3,17,1414,0.8960570672237221,TPESampler,COMPLETE
401,0.3261402718977093,2025-04-24 21:46:44.660283,2025-04-24 21:46:51.911345,0 days 00:00:07.251062,0.026920526431198147,11,,3,20,1361,0.9056490231312649,TPESampler,COMPLETE
402,0.3044475223493798,2025-04-24 21:46:48.575415,2025-04-24 21:46:57.157455,0 days 00:00:08.582040,0.02059633664665583,12,,2,19,1474,0.8962951164995078,TPESampler,COMPLETE
403,0.5856750437998328,2025-04-24 21:46:49.735233,2025-04-24 21:46:50.675088,0 days 00:00:00.939855,0.021937117102275604,3,sqrt,7,19,386,0.6426668896086032,TPESampler,COMPLETE
404,0.7089023540749175,2025-04-24 21:46:50.850755,2025-04-24 21:46:51.912735,0 days 00:00:01.061980,0.019528431893968554,7,log2,5,9,497,0.8170827085989881,TPESampler,COMPLETE
405,0.3722128798857131,2025-04-24 21:46:52.048975,2025-04-24 21:46:56.062431,0 days 00:00:04.013456,0.08692046513297724,8,,6,18,1004,0.7687220914803834,TPESampler,COMPLETE
406,0.31253378904747414,2025-04-24 21:46:52.101784,2025-04-24 21:46:59.629690,0 days 00:00:07.527906,0.0179154422529773,10,,2,20,1384,0.9026620012524589,TPESampler,COMPLETE
407,0.6994317350769962,2025-04-24 21:46:56.236370,2025-04-24 21:46:56.930730,0 days 00:00:00.694360,0.03059127799410848,12,sqrt,9,9,133,0.7252880013661692,TPESampler,COMPLETE
408,0.32446268115858384,2025-04-24 21:46:57.113343,2025-04-24 21:47:05.319544,0 days 00:00:08.206201,0.02121618860526046,11,,1,20,1472,0.8986864976415371,TPESampler,COMPLETE
409,0.5812157801119574,2025-04-24 21:46:57.374156,2025-04-24 21:46:58.769757,0 days 00:00:01.395601,0.018627495777795804,11,log2,5,9,915,0.6932325956809318,TPESampler,COMPLETE
410,0.30775693327097825,2025-04-24 21:46:58.957029,2025-04-24 21:47:06.903410,0 days 00:00:07.946381,0.025267178953383894,12,,2,19,1254,0.9933189235076064,TPESampler,COMPLETE
411,0.4267556239723137,2025-04-24 21:46:59.831248,2025-04-24 21:47:01.314279,0 days 00:00:01.483031,0.06227693987673298,9,log2,6,9,1210,0.6245694668532189,TPESampler,COMPLETE
412,0.368639348046169,2025-04-24 21:47:01.480883,2025-04-24 21:47:08.629853,0 days 00:00:07.148970,0.021864263982033644,12,,5,19,1359,0.9068345325578542,TPESampler,COMPLETE
413,0.31135243470715096,2025-04-24 21:47:05.495768,2025-04-24 21:47:12.409990,0 days 00:00:06.914222,0.020649620207706602,11,,2,17,1243,0.8818424505808918,TPESampler,COMPLETE
414,0.31933277883104216,2025-04-24 21:47:07.081339,2025-04-24 21:47:15.605143,0 days 00:00:08.523804,0.020782483889123116,12,,1,18,1440,0.9001950069671525,TPESampler,COMPLETE
415,0.46467527780249684,2025-04-24 21:47:08.798295,2025-04-24 21:47:10.533924,0 days 00:00:01.735629,0.01701564665142421,12,log2,5,14,1450,0.8932791802053003,TPESampler,COMPLETE
416,0.3251271838135886,2025-04-24 21:47:10.955156,2025-04-24 21:47:18.282369,0 days 00:00:07.327213,0.03518980955666721,12,,3,20,1262,0.8668354298600792,TPESampler,COMPLETE
417,0.38624457381490235,2025-04-24 21:47:12.788471,2025-04-24 21:47:15.745586,0 days 00:00:02.957115,0.025996902000327476,12,,5,10,471,0.9714136729643034,TPESampler,COMPLETE
418,0.5079516850022676,2025-04-24 21:47:15.764839,2025-04-24 21:47:16.824799,0 days 00:00:01.059960,0.0266302708818068,3,,9,3,194,0.8757978893964796,TPESampler,COMPLETE
419,0.3682281739383878,2025-04-24 21:47:15.917208,2025-04-24 21:47:17.346972,0 days 00:00:01.429764,0.04529169100415355,10,log2,3,10,680,0.8592639542536167,TPESampler,COMPLETE
420,0.3056477788607441,2025-04-24 21:47:17.002429,2025-04-24 21:47:25.623387,0 days 00:00:08.620958,0.017099231768747978,12,,2,18,1445,0.9129227797124493,TPESampler,COMPLETE
421,0.3174580725176694,2025-04-24 21:47:17.537455,2025-04-24 21:47:24.949233,0 days 00:00:07.411778,0.017986897936192105,12,,1,20,1256,0.8890162256055576,TPESampler,COMPLETE
422,0.4035579621526856,2025-04-24 21:47:18.495606,2025-04-24 21:47:20.675524,0 days 00:00:02.179918,0.016003950382320335,4,,1,8,653,0.79049229893855,TPESampler,COMPLETE
423,0.37760447746049325,2025-04-24 21:47:20.858181,2025-04-24 21:47:22.611684,0 days 00:00:01.753503,0.01878771708203858,4,,3,18,637,0.6070888165799704,TPESampler,COMPLETE
424,0.41527036349483176,2025-04-24 21:47:22.783920,2025-04-24 21:47:24.375064,0 days 00:00:01.591144,0.016723096869530454,11,log2,2,14,1108,0.9770971765043793,TPESampler,COMPLETE
425,0.5179931849962253,2025-04-24 21:47:24.557368,2025-04-24 21:47:25.522764,0 days 00:00:00.965396,0.012849906249567708,8,sqrt,3,2,275,0.7013931347464747,TPESampler,COMPLETE
426,0.3516316352166875,2025-04-24 21:47:25.147959,2025-04-24 21:47:29.135917,0 days 00:00:03.987958,0.09550757570526199,3,,2,18,1487,0.7354737810856309,TPESampler,COMPLETE
427,0.3102391228393076,2025-04-24 21:47:25.856691,2025-04-24 21:47:34.078267,0 days 00:00:08.221576,0.020824749102806232,12,,2,19,1378,0.8137145331228802,TPESampler,COMPLETE
428,0.37428746592697865,2025-04-24 21:47:25.911960,2025-04-24 21:47:28.907503,0 days 00:00:02.995543,0.029697945152768128,3,,4,3,677,0.9695961104781289,TPESampler,COMPLETE
429,0.3920239699340355,2025-04-24 21:47:29.084351,2025-04-24 21:47:30.464095,0 days 00:00:01.379744,0.044265431648914715,7,sqrt,6,20,748,0.7336764499585284,TPESampler,COMPLETE
430,0.3026640871705689,2025-04-24 21:47:29.403868,2025-04-24 21:47:36.575818,0 days 00:00:07.171950,0.017715092543218115,12,,2,20,1223,0.9324077569995721,TPESampler,COMPLETE
431,0.3303748966389618,2025-04-24 21:47:30.651769,2025-04-24 21:47:38.455366,0 days 00:00:07.803597,0.024641683324109875,12,,3,16,1429,0.8841875808846742,TPESampler,COMPLETE
432,0.3447376973281976,2025-04-24 21:47:34.264336,2025-04-24 21:47:41.232827,0 days 00:00:06.968491,0.01710287978839155,9,,3,16,1377,0.9688375805655441,TPESampler,COMPLETE
433,0.3393900199440401,2025-04-24 21:47:36.760825,2025-04-24 21:47:40.519301,0 days 00:00:03.758476,0.03074475106976606,7,,3,3,1066,0.6356976563196183,TPESampler,COMPLETE
434,0.3304724356518678,2025-04-24 21:47:38.629448,2025-04-24 21:47:46.335303,0 days 00:00:07.705855,0.01931474249597234,12,,3,18,1249,0.952228903071356,TPESampler,COMPLETE
435,0.4011338861122614,2025-04-24 21:47:40.702662,2025-04-24 21:47:42.301190,0 days 00:00:01.598528,0.0216102625144085,10,log2,3,17,1001,0.8722766091419137,TPESampler,COMPLETE
436,0.34158578314329874,2025-04-24 21:47:41.454556,2025-04-24 21:47:49.328033,0 days 00:00:07.873477,0.023117926733574094,10,,4,20,1432,0.9880724380986421,TPESampler,COMPLETE
437,0.34817373831653214,2025-04-24 21:47:42.483379,2025-04-24 21:47:44.327023,0 days 00:00:01.843644,0.028656145583768455,8,sqrt,4,20,1219,0.9599578789162119,TPESampler,COMPLETE
438,0.30932434619357074,2025-04-24 21:47:44.501535,2025-04-24 21:47:53.013748,0 days 00:00:08.512213,0.07721350795814406,11,,2,10,1472,0.8919604448483034,TPESampler,COMPLETE
439,0.4592042302753838,2025-04-24 21:47:46.684794,2025-04-24 21:47:48.699722,0 days 00:00:02.014928,0.01756760666512668,12,log2,4,2,1013,0.9364637346855237,TPESampler,COMPLETE
440,0.544122983844505,2025-04-24 21:47:49.083880,2025-04-24 21:47:51.113974,0 days 00:00:02.030094,0.010261147984591856,3,sqrt,1,15,784,0.848393411797836,TPESampler,COMPLETE
441,0.337127306026004,2025-04-24 21:47:49.711220,2025-04-24 21:47:57.453376,0 days 00:00:07.742156,0.03186642056392673,9,,1,12,1376,0.9268224681854969,TPESampler,COMPLETE
442,0.32507865697367794,2025-04-24 21:47:51.855747,2025-04-24 21:47:59.651847,0 days 00:00:07.796100,0.022327504734469282,12,,3,20,1215,0.9357993230322862,TPESampler,COMPLETE
443,0.36387093917841407,2025-04-24 21:47:53.215808,2025-04-24 21:47:54.968457,0 days 00:00:01.752649,0.024814549571381024,10,sqrt,2,5,837,0.9645930592766412,TPESampler,COMPLETE
444,0.3583365479178496,2025-04-24 21:47:55.177878,2025-04-24 21:48:03.373484,0 days 00:00:08.195606,0.035153213727044066,12,,4,6,1287,0.9864343579392918,TPESampler,COMPLETE
445,0.32289213332568756,2025-04-24 21:47:57.689954,2025-04-24 21:47:59.626716,0 days 00:00:01.936762,0.09384966899657837,12,sqrt,2,7,1060,0.9964131582621929,TPESampler,COMPLETE
446,0.3078211739619131,2025-04-24 21:47:59.747427,2025-04-24 21:48:04.960479,0 days 00:00:05.213052,0.06761517887709403,12,,2,10,799,0.9327017005710491,TPESampler,COMPLETE
447,0.3346814847109001,2025-04-24 21:47:59.796786,2025-04-24 21:48:07.029996,0 days 00:00:07.233210,0.019677079510270666,12,,3,16,1213,0.9073416590558504,TPESampler,COMPLETE
448,0.34227878577461335,2025-04-24 21:48:03.548382,2025-04-24 21:48:05.185151,0 days 00:00:01.636769,0.03017608277113088,9,sqrt,3,19,985,0.7910232864887927,TPESampler,COMPLETE
449,0.3122686423784214,2025-04-24 21:48:05.142470,2025-04-24 21:48:11.816199,0 days 00:00:06.673729,0.02026006179525949,11,,2,20,1090,0.9455478512736448,TPESampler,COMPLETE
450,0.864405546421,2025-04-24 21:48:05.421228,2025-04-24 21:48:06.381716,0 days 00:00:00.960488,0.012232284634015036,12,log2,10,7,391,0.922384312799218,TPESampler,COMPLETE
451,0.306772698955807,2025-04-24 21:48:06.558895,2025-04-24 21:48:15.082579,0 days 00:00:08.523684,0.01702270904827285,12,,2,17,1460,0.9024019540330045,TPESampler,COMPLETE
452,0.42785965753839794,2025-04-24 21:48:07.209249,2025-04-24 21:48:08.768051,0 days 00:00:01.558802,0.08049237785537698,10,sqrt,8,3,1076,0.724436156248614,TPESampler,COMPLETE
453,0.4541769859741913,2025-04-24 21:48:08.940792,2025-04-24 21:48:10.504143,0 days 00:00:01.563351,0.024230352945080604,12,log2,5,19,1253,0.900295785593966,TPESampler,COMPLETE
454,0.33425330419658783,2025-04-24 21:48:10.666114,2025-04-24 21:48:17.316192,0 days 00:00:06.650078,0.02154743884790853,12,,3,19,1187,0.8678820080459052,TPESampler,COMPLETE
455,0.2999587191570911,2025-04-24 21:48:12.086716,2025-04-24 21:48:19.298737,0 days 00:00:07.212021,0.023656143147193595,11,,2,20,1285,0.9362860931101243,TPESampler,COMPLETE
456,0.3225766935753459,2025-04-24 21:48:15.252152,2025-04-24 21:48:23.950583,0 days 00:00:08.698431,0.02011558907278062,12,,1,18,1469,0.9427446458679376,TPESampler,COMPLETE
457,0.30088171081085563,2025-04-24 21:48:17.487927,2025-04-24 21:48:24.259358,0 days 00:00:06.771431,0.02144161312280488,12,,2,20,1206,0.8963061310194546,TPESampler,COMPLETE
458,0.3396596329202223,2025-04-24 21:48:19.477457,2025-04-24 21:48:26.056007,0 days 00:00:06.578550,0.048512261660891884,11,,3,12,1215,0.9094078866072237,TPESampler,COMPLETE
459,0.3078400727965433,2025-04-24 21:48:24.126380,2025-04-24 21:48:32.228102,0 days 00:00:08.101722,0.03217468817974235,11,,2,9,1421,0.9079211251997013,TPESampler,COMPLETE
460,0.35587897376404887,2025-04-24 21:48:24.435889,2025-04-24 21:48:32.179968,0 days 00:00:07.744079,0.04462652222124006,12,,3,6,1325,0.9061086163424888,TPESampler,COMPLETE
461,0.4497985440652924,2025-04-24 21:48:26.226956,2025-04-24 21:48:27.680976,0 days 00:00:01.454020,0.08796540095425434,8,log2,9,2,1145,0.8000244087249905,TPESampler,COMPLETE
462,0.8210601590604226,2025-04-24 21:48:27.848801,2025-04-24 21:48:28.800839,0 days 00:00:00.952038,0.012168772121078211,6,log2,9,4,496,0.6824192214768146,TPESampler,COMPLETE
463,0.30477964648410133,2025-04-24 21:48:28.971790,2025-04-24 21:48:35.060253,0 days 00:00:06.088463,0.030446206013018905,11,,2,19,1039,0.9186546396512537,TPESampler,COMPLETE
464,0.7478058171733365,2025-04-24 21:48:32.315832,2025-04-24 21:48:33.441867,0 days 00:00:01.126035,0.016612805031707534,7,log2,6,2,368,0.9709780680309791,TPESampler,COMPLETE
465,0.5227661372152272,2025-04-24 21:48:32.364197,2025-04-24 21:48:33.681759,0 days 00:00:01.317562,0.08637505213292158,5,log2,10,17,501,0.6851896419762402,TPESampler,COMPLETE
466,0.4005499651933742,2025-04-24 21:48:33.623644,2025-04-24 21:48:35.372812,0 days 00:00:01.749168,0.057030072354614374,8,log2,1,18,1169,0.7986102695150337,TPESampler,COMPLETE
467,0.3104584233937191,2025-04-24 21:48:33.899789,2025-04-24 21:48:41.429364,0 days 00:00:07.529575,0.01776596676703897,12,,2,19,1204,0.9687195000608849,TPESampler,COMPLETE
468,0.34854852565988814,2025-04-24 21:48:35.243073,2025-04-24 21:48:36.461523,0 days 00:00:01.218450,0.09516990906589666,12,log2,3,10,621,0.9640319942546662,TPESampler,COMPLETE
469,0.3332558482594358,2025-04-24 21:48:35.559192,2025-04-24 21:48:40.817078,0 days 00:00:05.257886,0.0354372537477862,10,,1,19,925,0.963752424294563,TPESampler,COMPLETE
470,0.3222163915766902,2025-04-24 21:48:36.626157,2025-04-24 21:48:42.111921,0 days 00:00:05.485764,0.03752503643768754,11,,1,18,992,0.8645277071989864,TPESampler,COMPLETE
471,0.3074923514412592,2025-04-24 21:48:41.003630,2025-04-24 21:48:45.957600,0 days 00:00:04.953970,0.026200009010463696,11,,2,20,864,0.8911268671892205,TPESampler,COMPLETE
472,0.3773514528154114,2025-04-24 21:48:41.634239,2025-04-24 21:48:43.556148,0 days 00:00:01.921909,0.01927335058348871,9,sqrt,1,15,1076,0.9481822825965623,TPESampler,COMPLETE
473,0.2970481008614967,2025-04-24 21:48:42.311102,2025-04-24 21:48:48.988374,0 days 00:00:06.677272,0.028354039054331245,11,,2,20,1230,0.9075518063256564,TPESampler,COMPLETE
474,0.3678973394484851,2025-04-24 21:48:43.747038,2025-04-24 21:48:50.857949,0 days 00:00:07.110911,0.07062585250617698,10,,3,11,1303,0.9788667642390538,TPESampler,COMPLETE
475,0.33071145972931904,2025-04-24 21:48:46.145556,2025-04-24 21:48:52.078449,0 days 00:00:05.932893,0.04834747456095093,9,,3,18,1337,0.8293439127520215,TPESampler,COMPLETE
476,0.3301111218514911,2025-04-24 21:48:49.158209,2025-04-24 21:48:54.853422,0 days 00:00:05.695213,0.029610484248705878,12,,4,20,1035,0.9026696832909079,TPESampler,COMPLETE
477,0.30489729314540065,2025-04-24 21:48:51.028034,2025-04-24 21:48:57.353131,0 days 00:00:06.325097,0.026087554869599062,11,,2,20,1137,0.905605686096841,TPESampler,COMPLETE
478,0.33521582649322684,2025-04-24 21:48:52.255778,2025-04-24 21:48:58.186257,0 days 00:00:05.930479,0.022302278309009587,9,,2,15,1097,0.9923795420120513,TPESampler,COMPLETE
479,0.8014092631831611,2025-04-24 21:48:55.030293,2025-04-24 21:48:55.840901,0 days 00:00:00.810608,0.044010349959834126,3,log2,7,14,194,0.6647141501528262,TPESampler,COMPLETE
480,0.3091047517005924,2025-04-24 21:48:56.014555,2025-04-24 21:49:03.861164,0 days 00:00:07.846609,0.03355659911521501,10,,2,19,1343,0.9503257097019528,TPESampler,COMPLETE
481,0.35738170432002686,2025-04-24 21:48:57.532301,2025-04-24 21:48:59.996587,0 days 00:00:02.464286,0.020303043302184045,10,,4,2,390,0.9007100683065135,TPESampler,COMPLETE
482,0.461895425951297,2025-04-24 21:48:58.352945,2025-04-24 21:48:59.853303,0 days 00:00:01.500358,0.015164014738791398,6,sqrt,9,19,1002,0.8324690943765267,TPESampler,COMPLETE
483,0.4848584923559183,2025-04-24 21:49:00.035685,2025-04-24 21:49:01.705861,0 days 00:00:01.670176,0.058114052973246656,12,log2,8,14,834,0.6438345652238098,TPESampler,COMPLETE
484,0.5903312145317328,2025-04-24 21:49:00.205249,2025-04-24 21:49:02.085765,0 days 00:00:01.880516,0.030569807498420636,9,log2,9,12,1000,0.6085727086975425,TPESampler,COMPLETE
485,0.33656535691156747,2025-04-24 21:49:01.891197,2025-04-24 21:49:08.107605,0 days 00:00:06.216408,0.022296278293244706,9,,1,20,1173,0.9711068323236483,TPESampler,COMPLETE
486,0.338186746926519,2025-04-24 21:49:02.292928,2025-04-24 21:49:10.552244,0 days 00:00:08.259316,0.03534372566456187,12,,4,20,1398,0.9888705320217773,TPESampler,COMPLETE
487,0.8192082158836771,2025-04-24 21:49:04.048783,2025-04-24 21:49:04.722423,0 days 00:00:00.673640,0.07138076666833608,3,log2,3,4,106,0.7722722899345232,TPESampler,COMPLETE
488,0.29943946828049434,2025-04-24 21:49:04.898323,2025-04-24 21:49:11.486125,0 days 00:00:06.587802,0.02375236990683194,12,,2,20,1167,0.8991483999490814,TPESampler,COMPLETE
489,0.30669744670993127,2025-04-24 21:49:08.277165,2025-04-24 21:49:14.913202,0 days 00:00:06.636037,0.025152378538183823,12,,2,18,1137,0.9057811247875126,TPESampler,COMPLETE
490,0.3477430719527582,2025-04-24 21:49:10.732090,2025-04-24 21:49:13.097935,0 days 00:00:02.365845,0.030161923543368042,12,sqrt,2,18,1453,0.9957925075848975,TPESampler,COMPLETE
491,0.3193698870216761,2025-04-24 21:49:11.786586,2025-04-24 21:49:18.003591,0 days 00:00:06.217005,0.018604100455431292,12,,1,18,907,0.8939946435582116,TPESampler,COMPLETE
492,0.3191461997511664,2025-04-24 21:49:13.279594,2025-04-24 21:49:21.993174,0 days 00:00:08.713580,0.02187791450044264,12,,1,20,1371,0.9626184505620621,TPESampler,COMPLETE
493,0.4311956549642941,2025-04-24 21:49:15.100498,2025-04-24 21:49:16.739448,0 days 00:00:01.638950,0.012094398178569249,3,sqrt,3,17,1245,0.6669863572457164,TPESampler,COMPLETE
494,0.37378639924565554,2025-04-24 21:49:16.907001,2025-04-24 21:49:20.904142,0 days 00:00:03.997141,0.019789497148391278,3,,5,2,1442,0.914498082517075,TPESampler,COMPLETE
495,0.3362622313743665,2025-04-24 21:49:18.174450,2025-04-24 21:49:22.888717,0 days 00:00:04.714267,0.03543201634729669,12,,3,13,734,0.967649141109073,TPESampler,COMPLETE
496,0.3295708264808343,2025-04-24 21:49:21.082987,2025-04-24 21:49:28.724573,0 days 00:00:07.641586,0.02698371991034532,12,,3,19,1412,0.8729376298891728,TPESampler,COMPLETE
497,0.35612588513813775,2025-04-24 21:49:22.168287,2025-04-24 21:49:23.528523,0 days 00:00:01.360236,0.07342942067541565,4,sqrt,3,19,723,0.6712083722546404,TPESampler,COMPLETE
