number,value,datetime_start,datetime_complete,duration,params_learning_rate,params_max_depth,params_max_features,params_min_samples_leaf,params_min_samples_split,params_n_estimators,params_subsample,system_attrs_auto:sampler,state
2238,0.3153645314545051,2025-04-24 22:46:13.133896,2025-04-24 22:46:17.946780,0 days 00:00:04.812884,0.09733564676752646,11,,1,16,816,0.82673814983654,TPESampler,COMPLETE
2239,0.3283244120571,2025-04-24 22:46:16.755136,2025-04-24 22:46:23.517960,0 days 00:00:06.762824,0.05923368127463506,10,,3,20,1225,0.9084080744573582,TPESampler,COMPLETE
2240,0.3988759745600423,2025-04-24 22:46:18.057658,2025-04-24 22:46:20.370078,0 days 00:00:02.312420,0.02856977780864536,5,sqrt,6,6,1493,0.6522107706133097,TPESampler,COMPLETE
2241,0.2958221585307589,2025-04-24 22:46:18.246248,2025-04-24 22:46:24.682256,0 days 00:00:06.436008,0.051821859589118106,12,,2,17,905,0.9952884657910359,TPESampler,COMPLETE
2242,0.3341360490905309,2025-04-24 22:46:20.582231,2025-04-24 22:46:26.108433,0 days 00:00:05.526202,0.09257515745778902,12,,3,20,908,0.9106063752783073,TPESampler,COMPLETE
2243,0.3357198362145472,2025-04-24 22:46:23.715641,2025-04-24 22:46:30.961187,0 days 00:00:07.245546,0.058924250981086154,12,,3,20,1152,0.9277152401930525,TPESampler,COMPLETE
2244,0.302145524343356,2025-04-24 22:46:24.876755,2025-04-24 22:46:32.882203,0 days 00:00:08.005448,0.0907875773193369,12,,2,20,1301,0.9025744361771143,TPESampler,COMPLETE
2245,0.32902044921586465,2025-04-24 22:46:26.321370,2025-04-24 22:46:27.643820,0 days 00:00:01.322450,0.06965997192090968,11,sqrt,3,17,576,0.7756857314432288,TPESampler,COMPLETE
2246,0.4431729232172306,2025-04-24 22:46:27.862203,2025-04-24 22:46:29.649019,0 days 00:00:01.786816,0.01634418549225785,11,sqrt,9,12,1214,0.8277621014360209,TPESampler,COMPLETE
2247,0.33082300067155773,2025-04-24 22:46:29.871904,2025-04-24 22:46:37.553686,0 days 00:00:07.681782,0.05710075218598148,12,,3,20,1216,0.9383029713740558,TPESampler,COMPLETE
2248,0.3427779572635142,2025-04-24 22:46:31.172601,2025-04-24 22:46:33.178597,0 days 00:00:02.005996,0.061826786877626196,10,sqrt,2,18,1200,0.9228354467856741,TPESampler,COMPLETE
2249,0.4262185706084919,2025-04-24 22:46:33.098228,2025-04-24 22:46:34.887104,0 days 00:00:01.788876,0.06255251836622598,12,sqrt,8,12,1117,0.6649217097366172,TPESampler,COMPLETE
2250,0.2831543099504759,2025-04-24 22:46:33.478433,2025-04-24 22:46:43.726758,0 days 00:00:10.248325,0.06515069879321625,12,,2,17,1500,0.9958358421566443,TPESampler,COMPLETE
2251,0.3416237501392667,2025-04-24 22:46:35.112016,2025-04-24 22:46:42.610239,0 days 00:00:07.498223,0.0771387626877539,12,,3,20,1288,0.8783586241611787,TPESampler,COMPLETE
2252,0.36421468092516684,2025-04-24 22:46:37.750598,2025-04-24 22:46:39.786813,0 days 00:00:02.036215,0.05414287041192274,9,sqrt,1,19,1289,0.7909008536885167,TPESampler,COMPLETE
2253,0.37185483273192804,2025-04-24 22:46:39.995179,2025-04-24 22:46:41.475569,0 days 00:00:01.480390,0.0878432017582391,5,log2,3,2,939,0.7497029929880298,TPESampler,COMPLETE
2254,0.3781782152131386,2025-04-24 22:46:41.662416,2025-04-24 22:46:43.898478,0 days 00:00:02.236062,0.07304969906304279,10,log2,2,19,1423,0.9847917885578623,TPESampler,COMPLETE
2255,0.31806414263119914,2025-04-24 22:46:42.825999,2025-04-24 22:46:50.181723,0 days 00:00:07.355724,0.07253439486350277,12,,1,20,1226,0.8913837627332222,TPESampler,COMPLETE
2256,0.3006883872883848,2025-04-24 22:46:43.912245,2025-04-24 22:46:50.698428,0 days 00:00:06.786183,0.0771250216797818,12,,2,18,1173,0.8956880684348205,TPESampler,COMPLETE
2257,0.30443774791482947,2025-04-24 22:46:44.121638,2025-04-24 22:46:52.658745,0 days 00:00:08.537107,0.08290729185287281,11,,2,17,1478,0.9475811596342993,TPESampler,COMPLETE
2258,0.4316788087199725,2025-04-24 22:46:50.374400,2025-04-24 22:46:53.896896,0 days 00:00:03.522496,0.01653366973597865,12,,10,13,607,0.8659153469657851,TPESampler,COMPLETE
2259,0.33634505068396287,2025-04-24 22:46:50.933469,2025-04-24 22:46:58.574326,0 days 00:00:07.640857,0.05842835970399663,12,,3,20,1221,0.9843529356595265,TPESampler,COMPLETE
2260,0.2902119361849994,2025-04-24 22:46:52.854677,2025-04-24 22:47:01.433033,0 days 00:00:08.578356,0.0655435554539992,12,,2,20,1344,0.9986502360532064,TPESampler,COMPLETE
2261,0.32930331317865325,2025-04-24 22:46:54.105029,2025-04-24 22:47:01.666320,0 days 00:00:07.561291,0.07174665770238986,10,,1,19,1331,0.9858428383674785,TPESampler,COMPLETE
2262,0.3533227720105494,2025-04-24 22:46:58.771339,2025-04-24 22:47:06.951787,0 days 00:00:08.180448,0.09176879152891747,12,,3,20,1362,0.9760615793074193,TPESampler,COMPLETE
2263,0.29694988409808204,2025-04-24 22:47:01.637637,2025-04-24 22:47:09.017726,0 days 00:00:07.380089,0.09084060591160223,12,,2,20,1197,0.9738541537590509,TPESampler,COMPLETE
2264,0.32697263698948004,2025-04-24 22:47:01.851517,2025-04-24 22:47:10.990479,0 days 00:00:09.138962,0.06806767600680023,12,,1,19,1446,0.9549825838176482,TPESampler,COMPLETE
2265,0.4495935463549762,2025-04-24 22:47:07.329991,2025-04-24 22:47:11.140726,0 days 00:00:03.810735,0.011930454142458921,6,,10,18,1030,0.8165376910090658,TPESampler,COMPLETE
2266,0.3089274524338979,2025-04-24 22:47:09.220225,2025-04-24 22:47:17.124409,0 days 00:00:07.904184,0.05643490326230212,10,,2,16,1482,0.9059776153614388,TPESampler,COMPLETE
2267,0.2961115024617229,2025-04-24 22:47:11.200949,2025-04-24 22:47:18.336333,0 days 00:00:07.135384,0.061244614325452036,11,,2,20,1184,0.9717765817954109,TPESampler,COMPLETE
2268,0.2837760871568456,2025-04-24 22:47:11.373350,2025-04-24 22:47:19.251103,0 days 00:00:07.877753,0.06233241278433108,12,,2,20,1253,0.9552236300730639,TPESampler,COMPLETE
2269,0.32761523472284015,2025-04-24 22:47:17.335006,2025-04-24 22:47:24.629476,0 days 00:00:07.294470,0.06472223442792635,12,,1,19,1117,0.9741039736648737,TPESampler,COMPLETE
2270,0.3472759485283145,2025-04-24 22:47:18.529985,2025-04-24 22:47:26.383090,0 days 00:00:07.853105,0.06229183643395872,10,,3,19,1364,0.9973939876537593,TPESampler,COMPLETE
2271,0.2910305623153422,2025-04-24 22:47:19.460158,2025-04-24 22:47:27.498672,0 days 00:00:08.038514,0.08102075947997467,12,,2,20,1258,0.9742264848063977,TPESampler,COMPLETE
2272,0.3281907968694739,2025-04-24 22:47:24.824275,2025-04-24 22:47:30.807460,0 days 00:00:05.983185,0.055791065208298594,12,,3,20,939,0.944480442295713,TPESampler,COMPLETE
2273,0.3385104064533833,2025-04-24 22:47:26.583770,2025-04-24 22:47:32.412938,0 days 00:00:05.829168,0.07812541730144212,10,,3,20,999,0.9807008004459049,TPESampler,COMPLETE
2274,0.3378929025977358,2025-04-24 22:47:27.693859,2025-04-24 22:47:34.399353,0 days 00:00:06.705494,0.060591890395330764,11,,3,18,1115,0.9793258333855287,TPESampler,COMPLETE
2275,0.3404501869322294,2025-04-24 22:47:31.002346,2025-04-24 22:47:36.693212,0 days 00:00:05.690866,0.09317377525488765,12,,3,20,972,0.863338315625304,TPESampler,COMPLETE
2276,0.2981448778225932,2025-04-24 22:47:32.634042,2025-04-24 22:47:40.940426,0 days 00:00:08.306384,0.09626560879663519,12,,2,20,1289,0.9601682802999435,TPESampler,COMPLETE
2277,0.4753079157298482,2025-04-24 22:47:34.616733,2025-04-24 22:47:36.177225,0 days 00:00:01.560492,0.011430162168754343,3,,5,9,445,0.7638563284076106,TPESampler,COMPLETE
2278,0.3462006481834377,2025-04-24 22:47:36.367323,2025-04-24 22:47:38.475321,0 days 00:00:02.107998,0.07026234558309594,12,log2,3,20,1407,0.9381798567588222,TPESampler,COMPLETE
2279,0.35125583356110585,2025-04-24 22:47:36.943721,2025-04-24 22:47:45.855624,0 days 00:00:08.911903,0.0925921601537543,11,,3,20,1500,0.985662166938439,TPESampler,COMPLETE
2280,0.3416040540567172,2025-04-24 22:47:39.638854,2025-04-24 22:47:46.988037,0 days 00:00:07.349183,0.05077015370770099,12,,3,20,1134,0.9923378055916025,TPESampler,COMPLETE
2281,0.2935363764839057,2025-04-24 22:47:41.137607,2025-04-24 22:47:48.342643,0 days 00:00:07.205036,0.06810410664083442,10,,2,20,1257,0.9696145406107513,TPESampler,COMPLETE
2282,0.37158948032796424,2025-04-24 22:47:46.261743,2025-04-24 22:47:48.586000,0 days 00:00:02.324257,0.08499112021531754,5,,3,17,168,0.7303498590357482,TPESampler,COMPLETE
2283,0.3693580432228135,2025-04-24 22:47:47.547188,2025-04-24 22:47:54.701830,0 days 00:00:07.154642,0.07910927522866201,10,,5,20,1154,0.9808178858573774,TPESampler,COMPLETE
2284,0.3388206265536634,2025-04-24 22:47:48.898263,2025-04-24 22:47:54.840554,0 days 00:00:05.942291,0.08633450723471738,10,,3,17,1053,0.8666359768620211,TPESampler,COMPLETE
2285,0.29559367862898595,2025-04-24 22:47:48.983102,2025-04-24 22:47:56.302427,0 days 00:00:07.319325,0.05360731630467818,12,,2,20,962,0.9980660737056639,TPESampler,COMPLETE
2286,0.3278962580062841,2025-04-24 22:47:54.977202,2025-04-24 22:47:59.094268,0 days 00:00:04.117066,0.08254902548216655,11,,4,19,712,0.7593860934475489,TPESampler,COMPLETE
2287,0.3278822939563993,2025-04-24 22:47:55.286808,2025-04-24 22:48:03.267365,0 days 00:00:07.980557,0.05644234485664679,12,,1,17,1178,0.9779379536133043,TPESampler,COMPLETE
2288,0.2991981148256868,2025-04-24 22:47:56.580117,2025-04-24 22:48:03.779714,0 days 00:00:07.199597,0.05830070685977574,12,,2,17,1083,0.9981018990530272,TPESampler,COMPLETE
2289,0.2972810592973313,2025-04-24 22:47:59.294992,2025-04-24 22:48:08.834135,0 days 00:00:09.539143,0.08493596372640885,12,,2,18,1494,0.970860099996093,TPESampler,COMPLETE
2290,0.42375810974134265,2025-04-24 22:48:03.467062,2025-04-24 22:48:05.502244,0 days 00:00:02.035182,0.04972434886228079,3,log2,7,3,1491,0.9731765105189932,TPESampler,COMPLETE
2291,0.31922970200010425,2025-04-24 22:48:04.027570,2025-04-24 22:48:11.511089,0 days 00:00:07.483519,0.07354696713922246,12,,1,20,1080,0.9804746486281728,TPESampler,COMPLETE
2292,0.2965704110790746,2025-04-24 22:48:05.700207,2025-04-24 22:48:12.693635,0 days 00:00:06.993428,0.08185312859224585,11,,2,17,1087,0.9944544536254678,TPESampler,COMPLETE
2293,0.6285022585221318,2025-04-24 22:48:09.037578,2025-04-24 22:48:10.189230,0 days 00:00:01.151652,0.012068156330831489,10,log2,3,13,550,0.7519139185217772,TPESampler,COMPLETE
2294,0.34079158763162365,2025-04-24 22:48:10.391710,2025-04-24 22:48:17.430353,0 days 00:00:07.038643,0.07831954018463522,12,,3,20,1179,0.9505301018918852,TPESampler,COMPLETE
2295,0.29514582568868447,2025-04-24 22:48:11.718934,2025-04-24 22:48:18.829635,0 days 00:00:07.110701,0.07829437920527986,11,,2,19,1146,0.9754178203786726,TPESampler,COMPLETE
2296,0.33556994404287876,2025-04-24 22:48:12.892784,2025-04-24 22:48:20.885407,0 days 00:00:07.992623,0.05303812976476896,10,,1,18,1340,0.9955457927467527,TPESampler,COMPLETE
2297,0.2996886661667194,2025-04-24 22:48:17.636030,2025-04-24 22:48:24.283848,0 days 00:00:06.647818,0.09040027820848985,11,,2,20,1029,0.9369457241384099,TPESampler,COMPLETE
2298,0.4594588082225279,2025-04-24 22:48:19.034987,2025-04-24 22:48:19.907419,0 days 00:00:00.872432,0.09667848952943203,3,sqrt,7,2,177,0.8650538680892056,TPESampler,COMPLETE
2299,0.3641540622602186,2025-04-24 22:48:20.120388,2025-04-24 22:48:22.251999,0 days 00:00:02.131611,0.078212693916725,10,log2,1,20,1275,0.8853617080965789,TPESampler,COMPLETE
2300,0.33906587850245623,2025-04-24 22:48:21.106893,2025-04-24 22:48:28.065034,0 days 00:00:06.958141,0.09631785499790739,11,,3,20,1120,0.9792321574395788,TPESampler,COMPLETE
2301,0.43939027643238615,2025-04-24 22:48:22.455686,2025-04-24 22:48:26.302564,0 days 00:00:03.846878,0.028253678851806296,8,,10,13,1096,0.6769026438923547,TPESampler,COMPLETE
2302,0.29068156608027257,2025-04-24 22:48:24.485685,2025-04-24 22:48:30.720847,0 days 00:00:06.235162,0.0920254804445514,12,,2,20,947,0.9798421679312442,TPESampler,COMPLETE
2303,0.32408752623940185,2025-04-24 22:48:26.507550,2025-04-24 22:48:33.840625,0 days 00:00:07.333075,0.053590972964595925,12,,1,19,1163,0.9422991199956838,TPESampler,COMPLETE
2304,0.3152068537018549,2025-04-24 22:48:28.267810,2025-04-24 22:48:35.500844,0 days 00:00:07.233034,0.09902267405192554,12,,1,20,1206,0.8825478486542898,TPESampler,COMPLETE
2305,0.31351578473933395,2025-04-24 22:48:30.985689,2025-04-24 22:48:35.582510,0 days 00:00:04.596821,0.07324644907314798,11,,1,19,728,0.924671455784919,TPESampler,COMPLETE
2306,0.3085371408985653,2025-04-24 22:48:34.049236,2025-04-24 22:48:40.088632,0 days 00:00:06.039396,0.071600227068838,10,,2,18,1011,0.9358279568672464,TPESampler,COMPLETE
2307,0.33196143870677797,2025-04-24 22:48:35.685890,2025-04-24 22:48:41.759296,0 days 00:00:06.073406,0.07862081410149072,11,,3,19,956,0.9684987387625034,TPESampler,COMPLETE
2308,0.32790696443993006,2025-04-24 22:48:35.818004,2025-04-24 22:48:37.846963,0 days 00:00:02.028959,0.09913581660780874,10,sqrt,2,20,1051,0.9507965430778393,TPESampler,COMPLETE
2309,0.29624865042890935,2025-04-24 22:48:38.049465,2025-04-24 22:48:44.986843,0 days 00:00:06.937378,0.09476846784220888,12,,2,20,1110,0.9569593157781126,TPESampler,COMPLETE
2310,0.31868660438813157,2025-04-24 22:48:40.298733,2025-04-24 22:48:45.741854,0 days 00:00:05.443121,0.09146402169138436,11,,1,19,835,0.9756861027989521,TPESampler,COMPLETE
2311,0.38161132215753274,2025-04-24 22:48:41.954064,2025-04-24 22:48:48.017349,0 days 00:00:06.063285,0.08853232025828303,12,,5,19,1018,0.963690781073805,TPESampler,COMPLETE
2312,0.30399120378420547,2025-04-24 22:48:45.201294,2025-04-24 22:48:50.822672,0 days 00:00:05.621378,0.0778965827824385,10,,2,20,881,0.9827687543640157,TPESampler,COMPLETE
2313,0.3340344396202349,2025-04-24 22:48:45.966759,2025-04-24 22:48:52.679774,0 days 00:00:06.713015,0.061557292003299034,12,,3,20,1042,0.9555371770765849,TPESampler,COMPLETE
2314,0.39448014549359117,2025-04-24 22:48:48.209716,2025-04-24 22:48:49.952720,0 days 00:00:01.743004,0.07242938689472138,3,sqrt,5,14,1244,0.7777054651037894,TPESampler,COMPLETE
2315,0.2965066656548309,2025-04-24 22:48:50.163020,2025-04-24 22:48:55.545502,0 days 00:00:05.382482,0.08467475172284038,12,,2,17,833,0.9262000860286137,TPESampler,COMPLETE
2316,0.33331008355619574,2025-04-24 22:48:51.033663,2025-04-24 22:48:55.713472,0 days 00:00:04.679809,0.09281928455096854,12,,3,20,775,0.9082195677281726,TPESampler,COMPLETE
2317,0.3316113697747508,2025-04-24 22:48:52.875826,2025-04-24 22:48:57.845382,0 days 00:00:04.969556,0.07396776542648172,12,,3,20,727,0.997464368961529,TPESampler,COMPLETE
2318,0.3266853377037114,2025-04-24 22:48:55.732006,2025-04-24 22:49:01.587580,0 days 00:00:05.855574,0.09903438782809638,12,,1,18,903,0.9419888220438435,TPESampler,COMPLETE
2319,0.31409943651632877,2025-04-24 22:48:55.951156,2025-04-24 22:49:03.589522,0 days 00:00:07.638366,0.053076491978304094,12,,1,19,1173,0.9684752808871515,TPESampler,COMPLETE
2320,0.3590161250077308,2025-04-24 22:48:58.054608,2025-04-24 22:49:05.416740,0 days 00:00:07.362132,0.0696576836277129,12,,4,18,1159,0.995670111935015,TPESampler,COMPLETE
2321,0.35473028041063703,2025-04-24 22:49:01.786341,2025-04-24 22:49:03.674911,0 days 00:00:01.888570,0.050761843702641016,12,sqrt,1,18,1046,0.9329448094824816,TPESampler,COMPLETE
2322,0.3262312954284234,2025-04-24 22:49:03.779775,2025-04-24 22:49:11.237794,0 days 00:00:07.458019,0.07377775807102278,12,,1,17,1084,0.9849672007352142,TPESampler,COMPLETE
2323,0.33372473492236127,2025-04-24 22:49:03.923568,2025-04-24 22:49:09.060148,0 days 00:00:05.136580,0.09878725210456102,11,,3,20,821,0.9523423201724388,TPESampler,COMPLETE
2324,0.2941205674460398,2025-04-24 22:49:05.618687,2025-04-24 22:49:13.254763,0 days 00:00:07.636076,0.07146540880085892,12,,2,20,1301,0.9003886717178466,TPESampler,COMPLETE
2325,0.29749390193041647,2025-04-24 22:49:09.255063,2025-04-24 22:49:16.612095,0 days 00:00:07.357032,0.06699961756764819,11,,2,17,1172,0.9625287347636355,TPESampler,COMPLETE
2326,0.3161956855365337,2025-04-24 22:49:11.425597,2025-04-24 22:49:18.817813,0 days 00:00:07.392216,0.08915239384969098,12,,1,20,1077,0.9670250917863465,TPESampler,COMPLETE
2327,0.3936105077159868,2025-04-24 22:49:13.469884,2025-04-24 22:49:15.150784,0 days 00:00:01.680900,0.05287401150517558,3,log2,3,16,1186,0.9074473635047293,TPESampler,COMPLETE
2328,0.29081102249598695,2025-04-24 22:49:15.455554,2025-04-24 22:49:22.143125,0 days 00:00:06.687571,0.09414997562174407,12,,2,19,980,0.9978477265138838,TPESampler,COMPLETE
2329,0.3313956504875081,2025-04-24 22:49:16.827333,2025-04-24 22:49:22.790269,0 days 00:00:05.962936,0.06700858414761701,10,,1,20,1022,0.9118241248635837,TPESampler,COMPLETE
2330,0.3509134274781144,2025-04-24 22:49:19.032931,2025-04-24 22:49:26.781203,0 days 00:00:07.748272,0.05598052869929934,12,,4,19,1260,0.994826358406873,TPESampler,COMPLETE
2331,0.32832509538426524,2025-04-24 22:49:22.346777,2025-04-24 22:49:29.426183,0 days 00:00:07.079406,0.08817791573264916,12,,1,17,1011,0.988034650675297,TPESampler,COMPLETE
2332,0.33595861293250756,2025-04-24 22:49:23.022317,2025-04-24 22:49:27.733743,0 days 00:00:04.711426,0.08804784163046148,10,,1,17,795,0.9477783121401481,TPESampler,COMPLETE
2333,0.329436867640436,2025-04-24 22:49:26.974335,2025-04-24 22:49:32.053091,0 days 00:00:05.078756,0.08559972922804336,12,,1,18,713,0.926683488196444,TPESampler,COMPLETE
2334,0.3313048639883329,2025-04-24 22:49:27.924018,2025-04-24 22:49:32.685640,0 days 00:00:04.761622,0.08157345357415997,12,,1,20,642,0.9568800328120287,TPESampler,COMPLETE
2335,0.3921408340188766,2025-04-24 22:49:29.661609,2025-04-24 22:49:31.131838,0 days 00:00:01.470229,0.05949255512394362,9,log2,2,17,936,0.9806717014871564,TPESampler,COMPLETE
2336,0.34017206426402846,2025-04-24 22:49:31.332474,2025-04-24 22:49:37.945452,0 days 00:00:06.612978,0.09015166614635343,12,,3,18,885,0.9809389656719703,TPESampler,COMPLETE
2337,0.36548731180635174,2025-04-24 22:49:32.245409,2025-04-24 22:49:34.013121,0 days 00:00:01.767712,0.09173803327138098,12,log2,4,19,884,0.9887295534861432,TPESampler,COMPLETE
2338,0.5688480176909542,2025-04-24 22:49:32.914810,2025-04-24 22:49:34.104299,0 days 00:00:01.189489,0.01934600556858535,4,sqrt,3,10,318,0.7976208955240327,TPESampler,COMPLETE
2339,0.6328802384757912,2025-04-24 22:49:34.201994,2025-04-24 22:49:36.138223,0 days 00:00:01.936229,0.015732301929100946,7,log2,8,5,1159,0.824575039971332,TPESampler,COMPLETE
2340,0.39278964303485076,2025-04-24 22:49:34.339856,2025-04-24 22:49:36.281808,0 days 00:00:01.941952,0.025664738570210916,6,,5,12,375,0.6255513900077896,TPESampler,COMPLETE
2341,0.2891325130038218,2025-04-24 22:49:36.332515,2025-04-24 22:49:42.753851,0 days 00:00:06.421336,0.08914935154746338,12,,2,20,933,0.9937914477134785,TPESampler,COMPLETE
2342,0.36427517722576824,2025-04-24 22:49:36.518576,2025-04-24 22:49:38.369934,0 days 00:00:01.851358,0.090968234518646,12,log2,1,20,995,0.9250775911616727,TPESampler,COMPLETE
2343,0.33753169974701436,2025-04-24 22:49:38.145710,2025-04-24 22:49:43.189660,0 days 00:00:05.043950,0.06199784258519663,12,,4,16,885,0.8718805208787455,TPESampler,COMPLETE
2344,0.30441117578788696,2025-04-24 22:49:38.649213,2025-04-24 22:49:43.070262,0 days 00:00:04.421049,0.05432896047453705,10,,2,16,863,0.8400123673359107,TPESampler,COMPLETE
2345,0.2974823328203667,2025-04-24 22:49:42.952091,2025-04-24 22:49:49.510123,0 days 00:00:06.558032,0.07616659492932187,12,,2,17,986,0.9857860741932448,TPESampler,COMPLETE
2346,0.344748656665463,2025-04-24 22:49:43.293088,2025-04-24 22:49:50.485753,0 days 00:00:07.192665,0.06682053125203723,12,,3,18,1080,0.9895712281841281,TPESampler,COMPLETE
2347,0.36617199493927044,2025-04-24 22:49:43.462578,2025-04-24 22:49:49.015896,0 days 00:00:05.553318,0.07008111067465848,11,,5,20,944,0.9815021846407654,TPESampler,COMPLETE
2348,0.2984951927296731,2025-04-24 22:49:49.203141,2025-04-24 22:49:55.119754,0 days 00:00:05.916613,0.06394307830830681,12,,2,19,870,0.9965610138931372,TPESampler,COMPLETE
2349,0.2933719977338063,2025-04-24 22:49:49.759051,2025-04-24 22:49:55.544202,0 days 00:00:05.785151,0.09230003270956387,12,,2,20,909,0.9421451503782006,TPESampler,COMPLETE
2350,0.35313718599602345,2025-04-24 22:49:50.691830,2025-04-24 22:49:55.197415,0 days 00:00:04.505585,0.09743006331034834,10,,3,15,882,0.8909093253455245,TPESampler,COMPLETE
2351,0.3401668612118465,2025-04-24 22:49:55.301215,2025-04-24 22:50:00.859990,0 days 00:00:05.558775,0.09043726679610403,10,,1,19,866,0.9757976459554052,TPESampler,COMPLETE
2352,0.32223304798805996,2025-04-24 22:49:55.442634,2025-04-24 22:50:01.449709,0 days 00:00:06.007075,0.08199758115555994,12,,1,16,829,0.9761616469360377,TPESampler,COMPLETE
2353,0.38230613776398753,2025-04-24 22:49:55.823105,2025-04-24 22:49:58.120359,0 days 00:00:02.297254,0.028626393246132628,9,,6,20,496,0.6488670814953504,TPESampler,COMPLETE
2354,0.3446729125339231,2025-04-24 22:49:58.315025,2025-04-24 22:50:05.251972,0 days 00:00:06.936947,0.08604262202791707,11,,3,18,1135,0.9976627415043772,TPESampler,COMPLETE
2355,0.3373269931928652,2025-04-24 22:50:01.064194,2025-04-24 22:50:05.667267,0 days 00:00:04.603073,0.09837858206833297,12,,3,18,700,0.9669605663070588,TPESampler,COMPLETE
2356,0.3416376973632025,2025-04-24 22:50:01.684195,2025-04-24 22:50:06.495470,0 days 00:00:04.811275,0.07833027486724091,10,,3,18,818,0.9492425705873828,TPESampler,COMPLETE
2357,0.3406276796187266,2025-04-24 22:50:05.446133,2025-04-24 22:50:10.117439,0 days 00:00:04.671306,0.06868575606856472,10,,3,16,742,0.9916093014687163,TPESampler,COMPLETE
2358,0.3390149090427996,2025-04-24 22:50:05.959907,2025-04-24 22:50:11.133937,0 days 00:00:05.174030,0.0642438428198306,8,,3,19,966,0.9924846819254113,TPESampler,COMPLETE
2359,0.3339749832343664,2025-04-24 22:50:06.741176,2025-04-24 22:50:10.849488,0 days 00:00:04.108312,0.090506346652534,12,,1,18,539,0.9947555429059787,TPESampler,COMPLETE
2360,0.3068124349013548,2025-04-24 22:50:10.316256,2025-04-24 22:50:15.676126,0 days 00:00:05.359870,0.05347660148181246,11,,2,20,824,0.9908416986814873,TPESampler,COMPLETE
2361,0.33854973992500914,2025-04-24 22:50:11.061166,2025-04-24 22:50:16.916962,0 days 00:00:05.855796,0.07189687351595711,12,,3,19,938,0.9724517157445617,TPESampler,COMPLETE
