number,value,datetime_start,datetime_complete,duration,params_learning_rate,params_max_depth,params_max_features,params_min_samples_leaf,params_min_samples_split,params_n_estimators,params_subsample,system_attrs_auto:sampler,state
2486,0.3432032043131312,2025-04-24 22:54:06.577935,2025-04-24 22:54:14.407869,0 days 00:00:07.829934,0.09634717879449725,11,,3,20,1300,0.9882164644741244,TPESampler,COMPLETE
2487,0.3455720454109443,2025-04-24 22:54:11.551464,2025-04-24 22:54:19.488985,0 days 00:00:07.937521,0.06881605387354935,10,,3,17,1484,0.9207901521218402,TPESampler,COMPLETE
2488,0.39853156233770765,2025-04-24 22:54:12.957308,2025-04-24 22:54:14.638119,0 days 00:00:01.680811,0.011481772111447588,10,,3,6,235,0.8489289744095212,TPESampler,COMPLETE
2489,0.3433561632170846,2025-04-24 22:54:14.611955,2025-04-24 22:54:23.908798,0 days 00:00:09.296843,0.05970857677674183,12,,3,18,1496,0.9690795459504246,TPESampler,COMPLETE
2490,0.34270544793966834,2025-04-24 22:54:14.807197,2025-04-24 22:54:21.765024,0 days 00:00:06.957827,0.0975615484716191,10,,1,20,1167,0.9973828196391913,TPESampler,COMPLETE
2491,0.34934902525093775,2025-04-24 22:54:19.687039,2025-04-24 22:54:27.254040,0 days 00:00:07.567001,0.06537569956981866,12,,3,18,1154,0.9983680148263758,TPESampler,COMPLETE
2492,0.6671634346293754,2025-04-24 22:54:21.977764,2025-04-24 22:54:23.013545,0 days 00:00:01.035781,0.025458390666018058,3,log2,3,19,440,0.9122769649052109,TPESampler,COMPLETE
2493,0.3395401663699841,2025-04-24 22:54:23.223671,2025-04-24 22:54:31.831376,0 days 00:00:08.607705,0.0955823686338291,10,,1,20,1449,0.9979154862087034,TPESampler,COMPLETE
2494,0.2960156604629068,2025-04-24 22:54:24.110228,2025-04-24 22:54:33.892584,0 days 00:00:09.782356,0.08739164681006423,12,,2,16,1495,0.9881900770193498,TPESampler,COMPLETE
2495,0.8768323412108241,2025-04-24 22:54:27.464057,2025-04-24 22:54:28.324331,0 days 00:00:00.860274,0.042872876820126055,6,log2,10,2,151,0.8261687775963444,TPESampler,COMPLETE
2496,0.35781835018571495,2025-04-24 22:54:28.544204,2025-04-24 22:54:33.054260,0 days 00:00:04.510056,0.09710544555632857,12,,3,12,743,0.8778728598657854,TPESampler,COMPLETE
2497,0.3213603605931672,2025-04-24 22:54:32.033102,2025-04-24 22:54:40.745808,0 days 00:00:08.712706,0.07334381667161963,12,,1,20,1299,0.9916225982106354,TPESampler,COMPLETE
2498,0.3190336804995221,2025-04-24 22:54:33.244411,2025-04-24 22:54:40.829739,0 days 00:00:07.585328,0.07302964477744117,12,,1,20,1130,0.9975954597354899,TPESampler,COMPLETE
2499,0.2995059903677176,2025-04-24 22:54:34.109308,2025-04-24 22:54:41.842709,0 days 00:00:07.733401,0.06912179681228688,11,,2,19,1317,0.9821171075895435,TPESampler,COMPLETE
