number,value,datetime_start,datetime_complete,duration,params_learning_rate,params_max_depth,params_max_features,params_min_samples_leaf,params_min_samples_split,params_n_estimators,params_subsample,system_attrs_auto:sampler,state
0,0.8516295735190483,2025-04-24 21:35:15.072412,2025-04-24 21:35:16.042545,0 days 00:00:00.970133,0.016942619609523212,6,log2,9,2,238,0.9453485827624214,RandomSampler,COMPLETE
1,0.4821074585165422,2025-04-24 21:35:15.085571,2025-04-24 21:35:17.698683,0 days 00:00:02.613112,0.035893152955522874,8,log2,7,5,1121,0.8214584997956894,RandomSampler,COMPLETE
2,0.9114547126957012,2025-04-24 21:35:15.147833,2025-04-24 21:35:16.439653,0 days 00:00:01.291820,0.014788678741191597,8,log2,8,9,285,0.6332049899048747,RandomSampler,COMPLETE
3,0.45518910923130645,2025-04-24 21:35:16.235313,2025-04-24 21:35:18.320098,0 days 00:00:02.084785,0.024747546653555618,10,log2,5,18,982,0.8903387950393851,TPESampler,COMPLETE
4,0.46309953301307116,2025-04-24 21:35:16.620717,2025-04-24 21:35:18.318820,0 days 00:00:01.698103,0.02087891616158135,7,log2,2,9,700,0.681552678475318,TPESampler,COMPLETE
5,0.3930889291181427,2025-04-24 21:35:17.897303,2025-04-24 21:35:19.256441,0 days 00:00:01.359138,0.043420765525429846,9,,6,14,206,0.8054075724075573,TPESampler,COMPLETE
6,0.43820411665896003,2025-04-24 21:35:18.469576,2025-04-24 21:35:21.007756,0 days 00:00:02.538180,0.013917107674561306,6,log2,1,9,1345,0.6683751221378331,TPESampler,COMPLETE
7,0.8162287246328156,2025-04-24 21:35:18.520846,2025-04-24 21:35:19.767097,0 days 00:00:01.246251,0.016194662685118245,7,log2,10,19,532,0.9512880859806422,TPESampler,COMPLETE
8,0.3406926765664554,2025-04-24 21:35:19.454643,2025-04-24 21:35:22.090150,0 days 00:00:02.635507,0.09654944248056749,4,,3,15,746,0.6586579764169116,TPESampler,COMPLETE
9,0.35512056965066047,2025-04-24 21:35:19.991934,2025-04-24 21:35:21.756215,0 days 00:00:01.764281,0.08659602060972164,6,sqrt,4,11,872,0.6793313596144935,TPESampler,COMPLETE
10,0.3959924407706918,2025-04-24 21:35:21.182136,2025-04-24 21:35:28.473586,0 days 00:00:07.291450,0.08030305458837098,10,,5,13,1377,0.9594244442256024,TPESampler,COMPLETE
11,0.342272532114077,2025-04-24 21:35:21.919250,2025-04-24 21:35:23.004813,0 days 00:00:01.085563,0.07074522629974084,10,,2,19,100,0.838277002680614,TPESampler,COMPLETE
12,0.35483884272199234,2025-04-24 21:35:22.253530,2025-04-24 21:35:24.395851,0 days 00:00:02.142321,0.07127766471028832,4,,3,17,663,0.7621320294235499,TPESampler,COMPLETE
13,0.32837776926111606,2025-04-24 21:35:23.169508,2025-04-24 21:35:24.746237,0 days 00:00:01.576729,0.04370020185448698,11,,2,19,220,0.8691629369367913,TPESampler,COMPLETE
14,0.3180296301905007,2025-04-24 21:35:24.561233,2025-04-24 21:35:29.257116,0 days 00:00:04.695883,0.038667227857635725,12,,1,14,805,0.7830290384440772,TPESampler,COMPLETE
15,0.37045879483226707,2025-04-24 21:35:24.951536,2025-04-24 21:35:25.966490,0 days 00:00:01.014954,0.05504197691984612,11,sqrt,2,13,399,0.9609870519086336,TPESampler,COMPLETE
16,0.33435794562631466,2025-04-24 21:35:26.128650,2025-04-24 21:35:27.488091,0 days 00:00:01.359441,0.08924864988227607,7,,1,7,250,0.7114993960646419,TPESampler,COMPLETE
17,0.4202353413712105,2025-04-24 21:35:27.651988,2025-04-24 21:35:28.546453,0 days 00:00:00.894465,0.056949078000428005,10,log2,2,2,430,0.6137523328284046,TPESampler,COMPLETE
18,0.3436503053676715,2025-04-24 21:35:28.618589,2025-04-24 21:35:30.634300,0 days 00:00:02.015711,0.06657606423290695,10,,3,11,368,0.6161846774595652,TPESampler,COMPLETE
19,0.3904574297641494,2025-04-24 21:35:28.677137,2025-04-24 21:35:29.817773,0 days 00:00:01.140636,0.04880478246171315,7,,4,4,102,0.769106839161953,TPESampler,COMPLETE
20,0.32602917454715064,2025-04-24 21:35:29.489251,2025-04-24 21:35:32.874439,0 days 00:00:03.385188,0.02410314983761197,10,,2,20,621,0.7833129283015712,TPESampler,COMPLETE
21,0.37099208818046725,2025-04-24 21:35:29.982284,2025-04-24 21:35:31.772720,0 days 00:00:01.790436,0.030096202338651165,9,sqrt,1,12,928,0.8275148896232877,TPESampler,COMPLETE
22,0.3823333948168344,2025-04-24 21:35:30.800866,2025-04-24 21:35:32.558130,0 days 00:00:01.757264,0.0698997131444647,11,log2,2,14,955,0.7656872340476759,TPESampler,COMPLETE
23,0.33591212365117856,2025-04-24 21:35:31.961438,2025-04-24 21:35:36.079564,0 days 00:00:04.118126,0.039996711652101294,11,,4,10,778,0.8157290332585875,TPESampler,COMPLETE
24,0.3374767166829051,2025-04-24 21:35:32.739531,2025-04-24 21:35:36.058336,0 days 00:00:03.318805,0.023759284488489758,10,,3,20,718,0.7140105737933374,TPESampler,COMPLETE
25,0.38702603536418295,2025-04-24 21:35:33.123883,2025-04-24 21:35:34.137662,0 days 00:00:01.013779,0.02405901574336675,10,,1,19,123,0.8600635302797801,TPESampler,COMPLETE
26,0.3345226108103912,2025-04-24 21:35:34.299432,2025-04-24 21:35:39.271570,0 days 00:00:04.972138,0.03349236377169159,8,,1,20,908,0.8812204519892244,TPESampler,COMPLETE
27,0.33268285211593623,2025-04-24 21:35:36.194051,2025-04-24 21:35:37.763236,0 days 00:00:01.569185,0.04874690136605561,12,,1,17,153,0.9968965666120482,TPESampler,COMPLETE
28,0.5238375336347243,2025-04-24 21:35:36.241199,2025-04-24 21:35:37.120317,0 days 00:00:00.879118,0.04224892333033919,9,log2,2,18,155,0.9339231169112977,TPESampler,COMPLETE
29,0.3327691844921883,2025-04-24 21:35:37.284813,2025-04-24 21:35:42.388223,0 days 00:00:05.103410,0.042180816297668566,12,,1,14,967,0.7328238067858497,TPESampler,COMPLETE
30,0.33192582236322143,2025-04-24 21:35:37.925935,2025-04-24 21:35:42.384191,0 days 00:00:04.458256,0.012969554087972443,11,,2,14,842,0.836983213138795,TPESampler,COMPLETE
31,0.4128106763168476,2025-04-24 21:35:39.434983,2025-04-24 21:35:40.695356,0 days 00:00:01.260373,0.018429541665438778,8,sqrt,1,20,487,0.6698584738586815,TPESampler,COMPLETE
32,0.3454911821224302,2025-04-24 21:35:40.860409,2025-04-24 21:35:42.157898,0 days 00:00:01.297489,0.02311763891078913,12,sqrt,3,18,567,0.7534294059742367,TPESampler,COMPLETE
33,0.3345988117002815,2025-04-24 21:35:42.345791,2025-04-24 21:35:47.398780,0 days 00:00:05.052989,0.011089450495869948,9,,2,12,1095,0.8308473666336716,TPESampler,COMPLETE
34,0.4859310367161723,2025-04-24 21:35:42.640211,2025-04-24 21:35:43.917399,0 days 00:00:01.277188,0.012976744741909673,12,log2,2,9,618,0.7605711025429784,TPESampler,COMPLETE
35,0.3227590278385554,2025-04-24 21:35:42.681950,2025-04-24 21:35:47.396849,0 days 00:00:04.714899,0.01195205763120924,12,,2,13,800,0.8821929277080467,TPESampler,COMPLETE
36,0.3356220017018703,2025-04-24 21:35:44.084039,2025-04-24 21:35:47.637649,0 days 00:00:03.553610,0.020567236198319964,12,,1,20,654,0.7901084433800339,TPESampler,COMPLETE
37,0.3834215455223069,2025-04-24 21:35:47.536575,2025-04-24 21:35:49.894252,0 days 00:00:02.357677,0.028265291377683632,12,,5,16,304,0.9190018920899989,TPESampler,COMPLETE
38,0.38735989345387584,2025-04-24 21:35:47.590028,2025-04-24 21:35:50.862836,0 days 00:00:03.272808,0.01040304593914998,12,,5,7,500,0.8772365382589301,TPESampler,COMPLETE
39,0.41026374727649767,2025-04-24 21:35:47.841934,2025-04-24 21:35:49.311824,0 days 00:00:01.469890,0.022864686687390844,11,log2,1,14,732,0.8886662263732109,TPESampler,COMPLETE
40,0.32541035712023525,2025-04-24 21:35:49.477900,2025-04-24 21:35:54.923406,0 days 00:00:05.445506,0.051712487285616664,12,,3,17,971,0.8461778186045096,TPESampler,COMPLETE
41,0.3931357410024904,2025-04-24 21:35:50.064195,2025-04-24 21:35:51.425187,0 days 00:00:01.360992,0.01007601575476514,11,sqrt,3,13,668,0.8870921630011189,TPESampler,COMPLETE
42,0.42233052109442326,2025-04-24 21:35:51.065459,2025-04-24 21:35:52.945683,0 days 00:00:01.880224,0.02215417159708411,7,sqrt,7,7,1338,0.6155148863331471,TPESampler,COMPLETE
43,0.3380749789647226,2025-04-24 21:35:51.599510,2025-04-24 21:35:57.208753,0 days 00:00:05.609243,0.013671863528285763,12,,3,15,959,0.9246236177806949,TPESampler,COMPLETE
44,0.3283712589397532,2025-04-24 21:35:53.138860,2025-04-24 21:35:57.954094,0 days 00:00:04.815234,0.010197201521430459,12,,2,15,886,0.8255196133838532,TPESampler,COMPLETE
45,0.344723302641677,2025-04-24 21:35:55.101062,2025-04-24 21:35:57.080915,0 days 00:00:01.979853,0.05055323340011109,11,sqrt,4,19,1347,0.9135988815353863,TPESampler,COMPLETE
46,0.3302269034841361,2025-04-24 21:35:57.253113,2025-04-24 21:36:01.875899,0 days 00:00:04.622786,0.059537775230126475,11,,3,18,904,0.8135557231954677,TPESampler,COMPLETE
47,0.32302273455449226,2025-04-24 21:35:57.422306,2025-04-24 21:36:04.014121,0 days 00:00:06.591815,0.04234416239493106,12,,1,18,991,0.9818725321897634,TPESampler,COMPLETE
48,0.3331991696989928,2025-04-24 21:35:58.153269,2025-04-24 21:36:01.419681,0 days 00:00:03.266412,0.014050584605806573,11,,1,7,551,0.896352393380476,TPESampler,COMPLETE
49,0.4692892609703695,2025-04-24 21:36:01.591954,2025-04-24 21:36:03.033813,0 days 00:00:01.441859,0.015557160755703549,11,log2,3,19,913,0.7769778480357028,TPESampler,COMPLETE
50,0.3346173577347916,2025-04-24 21:36:02.068443,2025-04-24 21:36:08.481860,0 days 00:00:06.413417,0.03275892394207159,10,,4,16,1309,0.8750286002447493,TPESampler,COMPLETE
51,0.3666101676877149,2025-04-24 21:36:03.216773,2025-04-24 21:36:08.782249,0 days 00:00:05.565476,0.012361029759766674,12,,5,15,1428,0.6459519803136324,TPESampler,COMPLETE
52,0.33635359667198855,2025-04-24 21:36:04.169913,2025-04-24 21:36:09.245423,0 days 00:00:05.075510,0.05294587472546949,11,,4,19,846,0.9558237431187669,TPESampler,COMPLETE
53,0.3407383959661705,2025-04-24 21:36:08.653389,2025-04-24 21:36:13.553860,0 days 00:00:04.900471,0.013097032110486085,12,,1,11,917,0.7293957258496978,TPESampler,COMPLETE
54,0.3445030132438662,2025-04-24 21:36:09.192133,2025-04-24 21:36:15.230636,0 days 00:00:06.038503,0.05015509539640443,10,,1,13,1042,0.9737988091824115,TPESampler,COMPLETE
55,0.3471677107884199,2025-04-24 21:36:09.477087,2025-04-24 21:36:15.083170,0 days 00:00:05.606083,0.03183103993114728,11,,3,16,915,0.9931994007027216,TPESampler,COMPLETE
56,0.32904355186364065,2025-04-24 21:36:13.729945,2025-04-24 21:36:20.144231,0 days 00:00:06.414286,0.056746139492679065,12,,1,18,948,0.9929525835797178,TPESampler,COMPLETE
57,0.3812997093012475,2025-04-24 21:36:15.295833,2025-04-24 21:36:19.604080,0 days 00:00:04.308247,0.011993439769490298,12,,5,14,768,0.8229313569619338,TPESampler,COMPLETE
58,0.48719414012942003,2025-04-24 21:36:15.365146,2025-04-24 21:36:16.988419,0 days 00:00:01.623273,0.010457537118971804,11,log2,3,13,1026,0.8478086180795416,TPESampler,COMPLETE
59,0.49911492592858653,2025-04-24 21:36:17.155024,2025-04-24 21:36:18.308572,0 days 00:00:01.153548,0.03095663450826113,6,sqrt,9,14,401,0.7617551279775215,TPESampler,COMPLETE
60,0.37498519416808074,2025-04-24 21:36:18.510471,2025-04-24 21:36:19.876419,0 days 00:00:01.365948,0.048807034302762654,12,log2,1,16,817,0.9950430559137362,TPESampler,COMPLETE
61,0.33612625242019323,2025-04-24 21:36:19.788297,2025-04-24 21:36:23.156516,0 days 00:00:03.368219,0.0679428647224879,10,,1,13,564,0.83187269251632,TPESampler,COMPLETE
62,0.3859183760202283,2025-04-24 21:36:20.092848,2025-04-24 21:36:22.557626,0 days 00:00:02.464778,0.010969259570928189,7,,1,17,509,0.8226918866519422,TPESampler,COMPLETE
63,0.3814486119947076,2025-04-24 21:36:20.408530,2025-04-24 21:36:21.962040,0 days 00:00:01.553510,0.02182021531233072,6,,4,19,327,0.7435296526724624,TPESampler,COMPLETE
64,0.36182495996798675,2025-04-24 21:36:22.135502,2025-04-24 21:36:24.502290,0 days 00:00:02.366788,0.039040700307302716,11,sqrt,1,18,1095,0.9871156741998858,TPESampler,COMPLETE
65,0.40655331206929485,2025-04-24 21:36:22.738576,2025-04-24 21:36:24.626114,0 days 00:00:01.887538,0.06198796915696202,11,log2,5,17,955,0.8541441109815185,TPESampler,COMPLETE
66,0.3425147951846047,2025-04-24 21:36:23.364779,2025-04-24 21:36:26.675985,0 days 00:00:03.311206,0.027451716054721763,10,,1,13,569,0.763518641524867,TPESampler,COMPLETE
67,0.44287502620187863,2025-04-24 21:36:24.670646,2025-04-24 21:36:28.041065,0 days 00:00:03.370419,0.09421509550496723,4,,10,15,1298,0.6601249659392017,TPESampler,COMPLETE
68,0.3293906997260083,2025-04-24 21:36:24.804127,2025-04-24 21:36:33.220865,0 days 00:00:08.416738,0.03481449078614111,12,,3,20,1378,0.9678482417266697,TPESampler,COMPLETE
69,0.32288086990380405,2025-04-24 21:36:26.847975,2025-04-24 21:36:29.266076,0 days 00:00:02.418101,0.04388393468879213,10,,2,19,423,0.8539443013604682,TPESampler,COMPLETE
70,0.3217987081667443,2025-04-24 21:36:28.234215,2025-04-24 21:36:35.680734,0 days 00:00:07.446519,0.014405182765038082,12,,1,16,1270,0.8293800946589494,TPESampler,COMPLETE
71,0.3263306348934699,2025-04-24 21:36:29.436517,2025-04-24 21:36:34.612457,0 days 00:00:05.175940,0.01045932929115277,12,,1,12,877,0.8934135551652378,TPESampler,COMPLETE
72,0.34236492717855443,2025-04-24 21:36:33.399332,2025-04-24 21:36:36.640348,0 days 00:00:03.241016,0.03770514780240927,9,,3,18,617,0.8751695655815748,TPESampler,COMPLETE
73,0.33278382198375445,2025-04-24 21:36:34.791951,2025-04-24 21:36:41.077487,0 days 00:00:06.285536,0.010323953743586979,11,,2,11,1070,0.9965013312350588,TPESampler,COMPLETE
74,0.32565152965467786,2025-04-24 21:36:36.058654,2025-04-24 21:36:40.176499,0 days 00:00:04.117845,0.014599142033938747,11,,1,12,674,0.9262140994125924,TPESampler,COMPLETE
75,0.3209551977543942,2025-04-24 21:36:36.873291,2025-04-24 21:36:43.694321,0 days 00:00:06.821030,0.018224969511696935,12,,2,18,1243,0.8491134812428364,TPESampler,COMPLETE
76,0.7554140593731908,2025-04-24 21:36:40.339574,2025-04-24 21:36:41.029659,0 days 00:00:00.690085,0.04003261925773465,12,log2,5,19,205,0.809511542779145,TPESampler,COMPLETE
77,0.3535146095340989,2025-04-24 21:36:41.174125,2025-04-24 21:36:44.820503,0 days 00:00:03.646378,0.018648495692797425,8,,3,13,733,0.9253312843437053,TPESampler,COMPLETE
78,0.34565660446496727,2025-04-24 21:36:41.211831,2025-04-24 21:36:45.557000,0 days 00:00:04.345169,0.014152751027551064,10,,1,17,689,0.997480628462403,TPESampler,COMPLETE
79,0.32051243818983416,2025-04-24 21:36:43.859015,2025-04-24 21:36:49.659130,0 days 00:00:05.800115,0.023745929088692577,9,,2,17,1236,0.8251285521069931,TPESampler,COMPLETE
80,0.319372555241492,2025-04-24 21:36:44.988729,2025-04-24 21:36:52.974020,0 days 00:00:07.985291,0.012543962567145617,12,,2,15,1458,0.831337035916167,TPESampler,COMPLETE
81,0.38914235861947655,2025-04-24 21:36:45.727926,2025-04-24 21:36:47.254197,0 days 00:00:01.526271,0.014953225460847765,12,,2,13,171,0.8536763855201601,TPESampler,COMPLETE
82,0.4282916063223015,2025-04-24 21:36:47.423984,2025-04-24 21:36:49.314242,0 days 00:00:01.890258,0.011434752448844272,9,log2,1,17,1372,0.937336802120908,TPESampler,COMPLETE
83,0.3499707665249189,2025-04-24 21:36:49.477135,2025-04-24 21:36:54.610946,0 days 00:00:05.133811,0.031174313799271672,7,,1,15,1343,0.7341070865795657,TPESampler,COMPLETE
84,0.3800922254451442,2025-04-24 21:36:49.826083,2025-04-24 21:36:51.810350,0 days 00:00:01.984267,0.01280898484503036,11,sqrt,2,14,1212,0.837825764144886,TPESampler,COMPLETE
85,0.45913473579119574,2025-04-24 21:36:51.974581,2025-04-24 21:36:53.203542,0 days 00:00:01.228961,0.09890373506986617,8,,10,4,218,0.6504886345985095,TPESampler,COMPLETE
86,0.32562598280652566,2025-04-24 21:36:53.154372,2025-04-24 21:36:59.829741,0 days 00:00:06.675369,0.010111262647037066,12,,1,17,1349,0.7671746753948858,TPESampler,COMPLETE
87,0.33249321349819827,2025-04-24 21:36:53.432575,2025-04-24 21:37:01.371386,0 days 00:00:07.938811,0.018917186066265437,12,,3,14,1484,0.8757853334389675,TPESampler,COMPLETE
88,0.3318493694045594,2025-04-24 21:36:54.775093,2025-04-24 21:37:00.254025,0 days 00:00:05.478932,0.023910467034039814,9,,3,19,1347,0.7788070477611879,TPESampler,COMPLETE
89,0.32245070585029934,2025-04-24 21:36:59.994630,2025-04-24 21:37:07.486266,0 days 00:00:07.491636,0.012219731323018028,12,,1,16,1290,0.8805095350876927,TPESampler,COMPLETE
90,0.31610085446142056,2025-04-24 21:37:00.412292,2025-04-24 21:37:06.988430,0 days 00:00:06.576138,0.028326021934962583,11,,2,18,1246,0.8328256057970228,TPESampler,COMPLETE
91,0.34591521059982405,2025-04-24 21:37:01.540677,2025-04-24 21:37:02.940541,0 days 00:00:01.399864,0.05745604111326761,12,sqrt,2,13,772,0.7139019322811132,TPESampler,COMPLETE
92,0.38918491721008125,2025-04-24 21:37:03.092747,2025-04-24 21:37:04.824542,0 days 00:00:01.731795,0.017834658021554848,12,log2,3,19,1360,0.8325199195266557,TPESampler,COMPLETE
93,0.3305874419659534,2025-04-24 21:37:04.998829,2025-04-24 21:37:11.860970,0 days 00:00:06.862141,0.01159117871816345,12,,2,15,1404,0.7731782380659307,TPESampler,COMPLETE
94,0.33643494257995843,2025-04-24 21:37:07.144212,2025-04-24 21:37:13.112455,0 days 00:00:05.968243,0.033716936609897524,10,,1,16,1235,0.7791380527654466,TPESampler,COMPLETE
95,0.3111157287147987,2025-04-24 21:37:07.650234,2025-04-24 21:37:14.564165,0 days 00:00:06.913931,0.013943284031213646,11,,2,20,1253,0.953085947372244,TPESampler,COMPLETE
96,0.32358179704475026,2025-04-24 21:37:12.037371,2025-04-24 21:37:19.002796,0 days 00:00:06.965425,0.02426688891667053,11,,1,17,1275,0.8993092686854098,TPESampler,COMPLETE
97,0.3262307816846038,2025-04-24 21:37:13.331316,2025-04-24 21:37:20.138299,0 days 00:00:06.806983,0.0156159834277466,12,,3,18,1344,0.8235973600855612,TPESampler,COMPLETE
98,0.3162976515944596,2025-04-24 21:37:14.738091,2025-04-24 21:37:22.775730,0 days 00:00:08.037639,0.012351453364816311,11,,2,17,1466,0.9526863335257635,TPESampler,COMPLETE
99,0.37515861422854974,2025-04-24 21:37:19.170444,2025-04-24 21:37:19.924176,0 days 00:00:00.753732,0.04803570975359489,9,sqrt,3,14,220,0.7685307446379166,TPESampler,COMPLETE
100,0.3195665615511903,2025-04-24 21:37:20.099282,2025-04-24 21:37:25.289646,0 days 00:00:05.190364,0.02618225535569153,11,,2,19,997,0.8362625759658538,TPESampler,COMPLETE
101,0.3257306538010181,2025-04-24 21:37:20.333824,2025-04-24 21:37:26.686004,0 days 00:00:06.352180,0.020848025135328227,12,,1,14,1167,0.8087805209057723,TPESampler,COMPLETE
102,0.3187026713557115,2025-04-24 21:37:22.938100,2025-04-24 21:37:31.508210,0 days 00:00:08.570110,0.016396361767808624,12,,1,20,1368,0.9927249072244866,TPESampler,COMPLETE
103,0.36564972527363854,2025-04-24 21:37:25.454687,2025-04-24 21:37:27.671398,0 days 00:00:02.216711,0.018834681109264315,10,sqrt,1,20,1392,0.8845916693400304,TPESampler,COMPLETE
104,0.38822895376772965,2025-04-24 21:37:26.849195,2025-04-24 21:37:32.426152,0 days 00:00:05.576957,0.014623544000049367,10,,7,18,1067,0.9903274468587856,TPESampler,COMPLETE
105,0.3228979133287215,2025-04-24 21:37:27.833726,2025-04-24 21:37:35.062140,0 days 00:00:07.228414,0.010876503756386692,10,,2,15,1464,0.8970506192104301,TPESampler,COMPLETE
106,0.3272229786329015,2025-04-24 21:37:31.678498,2025-04-24 21:37:39.163585,0 days 00:00:07.485087,0.021045062445197955,11,,1,19,1377,0.9111841188275397,TPESampler,COMPLETE
107,0.3074762167634012,2025-04-24 21:37:32.590982,2025-04-24 21:37:40.195242,0 days 00:00:07.604260,0.011966802788278719,12,,2,20,1413,0.8880632811017058,TPESampler,COMPLETE
108,0.34271420724625845,2025-04-24 21:37:35.240599,2025-04-24 21:37:41.109350,0 days 00:00:05.868751,0.016792452423716832,7,,2,18,1334,0.9823921677597407,TPESampler,COMPLETE
109,0.31802196953968015,2025-04-24 21:37:39.318158,2025-04-24 21:37:45.841768,0 days 00:00:06.523610,0.015243016253969902,12,,2,17,1008,0.9979086894647535,TPESampler,COMPLETE
110,0.3537974835615977,2025-04-24 21:37:40.373804,2025-04-24 21:37:42.816387,0 days 00:00:02.442583,0.014929015872235961,12,sqrt,1,17,1462,0.9892657226112248,TPESampler,COMPLETE
111,0.3249292589968107,2025-04-24 21:37:41.296989,2025-04-24 21:37:49.437020,0 days 00:00:08.140031,0.01205255064718273,10,,2,19,1478,0.9794290736629964,TPESampler,COMPLETE
112,0.30193523497086655,2025-04-24 21:37:42.983039,2025-04-24 21:37:50.640251,0 days 00:00:07.657212,0.014645045527302964,12,,2,20,1274,0.9287102171722701,TPESampler,COMPLETE
113,0.4156989125031844,2025-04-24 21:37:46.261317,2025-04-24 21:37:49.050791,0 days 00:00:02.789474,0.011664903448808156,11,log2,1,10,1490,0.7939602300702098,TPESampler,COMPLETE
114,0.3303330698793209,2025-04-24 21:37:49.430917,2025-04-24 21:37:55.874322,0 days 00:00:06.443405,0.019463464090255945,10,,1,20,1027,0.9467805023485139,TPESampler,COMPLETE
115,0.30413661483120913,2025-04-24 21:37:50.130043,2025-04-24 21:37:58.568472,0 days 00:00:08.438429,0.014389844414951844,12,,2,20,1365,0.9383792680950099,TPESampler,COMPLETE
116,0.32975673617896756,2025-04-24 21:37:50.897328,2025-04-24 21:37:57.990667,0 days 00:00:07.093339,0.010917054903554591,11,,1,18,1191,0.9738848670068901,TPESampler,COMPLETE
117,0.3400456357383999,2025-04-24 21:37:56.051769,2025-04-24 21:38:03.443785,0 days 00:00:07.392016,0.015145809942525798,12,,4,18,1286,0.939512260765842,TPESampler,COMPLETE
118,0.32698097750726846,2025-04-24 21:37:58.171768,2025-04-24 21:38:02.829812,0 days 00:00:04.658044,0.023432396511046692,12,,3,17,899,0.8031242645989518,TPESampler,COMPLETE
119,0.31930085520015605,2025-04-24 21:37:58.864378,2025-04-24 21:38:08.022194,0 days 00:00:09.157816,0.015174761672395183,12,,1,20,1495,0.9803700093944129,TPESampler,COMPLETE
120,0.3395354732316179,2025-04-24 21:38:03.005123,2025-04-24 21:38:09.886852,0 days 00:00:06.881729,0.014118822714933655,11,,4,20,1297,0.9257827797605005,TPESampler,COMPLETE
121,0.37978343369369216,2025-04-24 21:38:03.630719,2025-04-24 21:38:05.176140,0 days 00:00:01.545421,0.013574854573517146,12,sqrt,2,20,885,0.9719245314807081,TPESampler,COMPLETE
122,0.3352909130686208,2025-04-24 21:38:05.344089,2025-04-24 21:38:11.810176,0 days 00:00:06.466087,0.01481981801272367,12,,3,20,1091,0.979977975132635,TPESampler,COMPLETE
123,0.3116515304100707,2025-04-24 21:38:08.221487,2025-04-24 21:38:15.882981,0 days 00:00:07.661494,0.014791213579031048,11,,2,20,1389,0.9258242081412178,TPESampler,COMPLETE
