number,value,datetime_start,datetime_complete,duration,params_learning_rate,params_max_depth,params_max_features,params_min_samples_leaf,params_min_samples_split,params_n_estimators,params_subsample,system_attrs_auto:sampler,state
748,0.3014134382030938,2025-04-24 21:56:59.877923,2025-04-24 21:57:08.449003,0 days 00:00:08.571080,0.03383241117713943,12,,2,17,1484,0.9331854100450492,TPESampler,COMPLETE
749,0.30329367343167596,2025-04-24 21:57:02.127947,2025-04-24 21:57:09.264767,0 days 00:00:07.136820,0.04418807448642192,12,,2,12,1138,0.9916460358078958,TPESampler,COMPLETE
750,0.3183704146227262,2025-04-24 21:57:04.561730,2025-04-24 21:57:13.670523,0 days 00:00:09.108793,0.04933446639795316,12,,2,7,1478,0.9866280686716487,TPESampler,COMPLETE
751,0.31440967824914096,2025-04-24 21:57:08.619747,2025-04-24 21:57:14.969363,0 days 00:00:06.349616,0.0737555442220578,10,,2,9,1195,0.9155507695211151,TPESampler,COMPLETE
752,0.3190098957461219,2025-04-24 21:57:09.450087,2025-04-24 21:57:16.772941,0 days 00:00:07.322854,0.0366805295749467,12,,1,10,1190,0.9156753134465582,TPESampler,COMPLETE
753,0.3424085324002921,2025-04-24 21:57:13.859393,2025-04-24 21:57:21.409961,0 days 00:00:07.550568,0.05293359456275312,12,,3,14,1486,0.8354010514528,TPESampler,COMPLETE
754,0.3252025395411108,2025-04-24 21:57:15.151201,2025-04-24 21:57:22.115922,0 days 00:00:06.964721,0.08869413664582566,12,,1,6,1201,0.869930182926258,TPESampler,COMPLETE
755,0.3591468786026656,2025-04-24 21:57:16.941952,2025-04-24 21:57:23.210137,0 days 00:00:06.268185,0.08948610559524312,12,,3,7,1121,0.8977325738452475,TPESampler,COMPLETE
756,0.34728887314493107,2025-04-24 21:57:21.595315,2025-04-24 21:57:29.404681,0 days 00:00:07.809366,0.045354687845465744,10,,3,11,1440,0.9817397203792848,TPESampler,COMPLETE
757,0.3231889654855208,2025-04-24 21:57:22.382902,2025-04-24 21:57:31.961387,0 days 00:00:09.578485,0.09503315100189551,12,,2,5,1482,0.9940548673300732,TPESampler,COMPLETE
758,0.3024386078209394,2025-04-24 21:57:23.383585,2025-04-24 21:57:30.271319,0 days 00:00:06.887734,0.05784870958846396,12,,2,12,1125,0.9638549723049343,TPESampler,COMPLETE
759,0.44075951874509445,2025-04-24 21:57:29.583947,2025-04-24 21:57:31.228964,0 days 00:00:01.645017,0.07168129128919758,3,sqrt,8,3,1093,0.9994385661383455,TPESampler,COMPLETE
760,0.28975518613111184,2025-04-24 21:57:30.468942,2025-04-24 21:57:39.044520,0 days 00:00:08.575578,0.07527140368497237,12,,2,12,1346,0.9946663711295064,TPESampler,COMPLETE
761,0.3542177014987124,2025-04-24 21:57:31.418454,2025-04-24 21:57:37.966901,0 days 00:00:06.548447,0.04106366748444609,11,,4,9,1181,0.9193693359940518,TPESampler,COMPLETE
762,0.31294964797447145,2025-04-24 21:57:32.181001,2025-04-24 21:57:40.532424,0 days 00:00:08.351423,0.03372805630593266,11,,2,12,1402,0.992494704272207,TPESampler,COMPLETE
763,0.38560802310426984,2025-04-24 21:57:38.140172,2025-04-24 21:57:39.895252,0 days 00:00:01.755080,0.06314980969618864,6,,5,7,363,0.8283733253478629,TPESampler,COMPLETE
764,0.3751763362232888,2025-04-24 21:57:39.222222,2025-04-24 21:57:46.492925,0 days 00:00:07.270703,0.0640120722896689,12,,4,12,1175,0.9991843197449444,TPESampler,COMPLETE
765,0.3235782045911156,2025-04-24 21:57:40.068201,2025-04-24 21:57:46.485751,0 days 00:00:06.417550,0.0848277706128,11,,1,14,1068,0.9814408817823274,TPESampler,COMPLETE
766,0.36639782128857024,2025-04-24 21:57:40.743313,2025-04-24 21:57:48.442919,0 days 00:00:07.699606,0.08017637688621321,12,,3,11,1273,0.9906424945108911,TPESampler,COMPLETE
767,0.33534711788362953,2025-04-24 21:57:46.865396,2025-04-24 21:57:50.136634,0 days 00:00:03.271238,0.053751626265154964,12,sqrt,4,9,1472,0.9943257566431234,TPESampler,COMPLETE
768,0.36795030174814053,2025-04-24 21:57:46.944810,2025-04-24 21:57:56.663567,0 days 00:00:09.718757,0.06797788049393322,12,,3,9,1340,0.9948736557798094,TPESampler,COMPLETE
769,0.4510048612908476,2025-04-24 21:57:48.821797,2025-04-24 21:57:52.115934,0 days 00:00:03.294137,0.01176473635592903,5,,8,4,771,0.8337674243649505,TPESampler,COMPLETE
770,0.31898875013217304,2025-04-24 21:57:50.379271,2025-04-24 21:57:58.412352,0 days 00:00:08.033081,0.04580306743361209,12,,1,19,1143,0.9679755638409839,TPESampler,COMPLETE
771,0.37693587927388306,2025-04-24 21:57:52.430623,2025-04-24 21:57:54.270948,0 days 00:00:01.840325,0.06322181822630825,12,log2,4,13,1089,0.8791343141259049,TPESampler,COMPLETE
772,0.29592202010397595,2025-04-24 21:57:54.505901,2025-04-24 21:58:01.091928,0 days 00:00:06.586027,0.09485856052520877,11,,2,12,1154,0.9190771911389918,TPESampler,COMPLETE
773,0.33167624482437924,2025-04-24 21:57:56.864302,2025-04-24 21:58:05.846159,0 days 00:00:08.981857,0.057220641143672445,12,,1,9,1495,0.9107454609203904,TPESampler,COMPLETE
774,0.3623460636839422,2025-04-24 21:57:58.605350,2025-04-24 21:58:04.450212,0 days 00:00:05.844862,0.05625096084355115,12,,3,8,1046,0.8682208580572146,TPESampler,COMPLETE
775,0.35992291680842375,2025-04-24 21:58:01.279111,2025-04-24 21:58:05.062143,0 days 00:00:03.783032,0.07648129586143931,8,,3,12,784,0.9119727769569318,TPESampler,COMPLETE
776,0.32958288162224053,2025-04-24 21:58:04.625041,2025-04-24 21:58:11.196916,0 days 00:00:06.571875,0.08118952755523152,10,,2,11,1329,0.8546232874768857,TPESampler,COMPLETE
777,0.40639741599728857,2025-04-24 21:58:05.257428,2025-04-24 21:58:12.098940,0 days 00:00:06.841512,0.08637229302168095,12,,5,13,1361,0.8760651477764272,TPESampler,COMPLETE
778,0.371238918789099,2025-04-24 21:58:06.307441,2025-04-24 21:58:12.482511,0 days 00:00:06.175070,0.09895512375538848,10,,3,7,1203,0.9137725885292608,TPESampler,COMPLETE
779,0.33011743784965286,2025-04-24 21:58:11.379572,2025-04-24 21:58:13.627970,0 days 00:00:02.248398,0.08370643102147167,12,sqrt,3,12,1235,0.9052864657789033,TPESampler,COMPLETE
780,0.31084506259157885,2025-04-24 21:58:12.277382,2025-04-24 21:58:20.051221,0 days 00:00:07.773839,0.054439491749145225,10,,2,8,1398,0.8763827189742902,TPESampler,COMPLETE
781,0.2962980537794092,2025-04-24 21:58:12.821035,2025-04-24 21:58:21.058897,0 days 00:00:08.237862,0.0956858449070461,12,,2,12,1202,0.9946688937648677,TPESampler,COMPLETE
782,0.3906630178029993,2025-04-24 21:58:13.888953,2025-04-24 21:58:15.736523,0 days 00:00:01.847570,0.07102015538474223,6,log2,2,20,1477,0.6399339876510655,TPESampler,COMPLETE
783,0.3137268956995017,2025-04-24 21:58:15.914869,2025-04-24 21:58:22.890058,0 days 00:00:06.975189,0.09012236653679374,10,,2,12,1248,0.9344521254413338,TPESampler,COMPLETE
784,0.3241071497824798,2025-04-24 21:58:20.242040,2025-04-24 21:58:22.754586,0 days 00:00:02.512546,0.0667779794715629,12,sqrt,2,7,1075,0.8973185374275527,TPESampler,COMPLETE
785,0.40847227062955455,2025-04-24 21:58:21.256193,2025-04-24 21:58:22.882329,0 days 00:00:01.626136,0.06095862255929528,3,log2,3,6,899,0.9761899645656797,TPESampler,COMPLETE
786,0.34297250062420015,2025-04-24 21:58:22.950696,2025-04-24 21:58:29.352866,0 days 00:00:06.402170,0.0571803132190714,12,,3,16,1097,0.9065035258623169,TPESampler,COMPLETE
787,0.854767412432895,2025-04-24 21:58:23.057883,2025-04-24 21:58:24.418347,0 days 00:00:01.360464,0.011308906216137823,3,log2,8,17,547,0.9251052584504706,TPESampler,COMPLETE
788,0.34055973763335384,2025-04-24 21:58:23.106543,2025-04-24 21:58:27.836749,0 days 00:00:04.730206,0.08999016802574733,10,,1,12,817,0.8464686378525558,TPESampler,COMPLETE
789,0.3296563072067602,2025-04-24 21:58:24.646485,2025-04-24 21:58:29.296275,0 days 00:00:04.649790,0.038870700619253,12,,3,17,824,0.8737059585320288,TPESampler,COMPLETE
790,0.35636193139814665,2025-04-24 21:58:28.037878,2025-04-24 21:58:34.996410,0 days 00:00:06.958532,0.0828067020612402,12,,3,13,1146,0.9684661012641596,TPESampler,COMPLETE
791,0.342126795584174,2025-04-24 21:58:29.445373,2025-04-24 21:58:35.766587,0 days 00:00:06.321214,0.09972064691615501,10,,1,13,1124,0.9267928139452547,TPESampler,COMPLETE
792,0.35222185886964075,2025-04-24 21:58:29.525682,2025-04-24 21:58:37.743926,0 days 00:00:08.218244,0.041208345965478815,12,,3,10,1467,0.8873481636545666,TPESampler,COMPLETE
793,0.32927184769372664,2025-04-24 21:58:35.189275,2025-04-24 21:58:43.143599,0 days 00:00:07.954324,0.06469365031365615,12,,1,12,1268,0.9728129769165603,TPESampler,COMPLETE
794,0.3688983543052631,2025-04-24 21:58:35.948830,2025-04-24 21:58:42.999209,0 days 00:00:07.050379,0.04718964355063186,9,,5,19,1493,0.9702924281914003,TPESampler,COMPLETE
795,0.32373854287633597,2025-04-24 21:58:37.915569,2025-04-24 21:58:46.047185,0 days 00:00:08.131616,0.07518962331310969,12,,1,14,1364,0.8984765666856618,TPESampler,COMPLETE
796,0.5026685590193419,2025-04-24 21:58:43.149117,2025-04-24 21:58:44.736486,0 days 00:00:01.587369,0.04177463948542249,11,log2,9,4,1237,0.6381107543681497,TPESampler,COMPLETE
797,0.3110536812420761,2025-04-24 21:58:43.307870,2025-04-24 21:58:52.262789,0 days 00:00:08.954919,0.08951832282407785,12,,2,14,1491,0.9407634258660088,TPESampler,COMPLETE
798,0.4820841690684085,2025-04-24 21:58:44.926239,2025-04-24 21:58:45.991326,0 days 00:00:01.065087,0.016784864744322427,4,sqrt,2,2,521,0.7435930810369294,TPESampler,COMPLETE
799,0.3234413099846935,2025-04-24 21:58:46.151412,2025-04-24 21:58:52.841139,0 days 00:00:06.689727,0.09879217486508766,12,,1,12,1013,0.9661836950653727,TPESampler,COMPLETE
800,0.3231383585077703,2025-04-24 21:58:46.199020,2025-04-24 21:58:51.994117,0 days 00:00:05.795097,0.05357760326855205,12,,1,20,961,0.8831940480843692,TPESampler,COMPLETE
801,0.3544089554848519,2025-04-24 21:58:52.190483,2025-04-24 21:58:58.823542,0 days 00:00:06.633059,0.07756119720632348,12,,3,13,1233,0.8790508302744532,TPESampler,COMPLETE
802,0.37012680427305616,2025-04-24 21:58:52.492182,2025-04-24 21:58:56.366019,0 days 00:00:03.873837,0.08937221211810285,12,,3,7,670,0.8651940425197838,TPESampler,COMPLETE
803,0.3718866449920543,2025-04-24 21:58:53.013458,2025-04-24 21:58:59.743786,0 days 00:00:06.730328,0.062133981085471295,12,,4,9,1271,0.8698958723937942,TPESampler,COMPLETE
804,0.3283962024571918,2025-04-24 21:58:56.539221,2025-04-24 21:59:03.582395,0 days 00:00:07.043174,0.09770444762029963,10,,1,10,1334,0.9090353474012504,TPESampler,COMPLETE
805,0.3233086083459546,2025-04-24 21:58:59.127941,2025-04-24 21:59:06.957140,0 days 00:00:07.829199,0.038670452953907385,12,,1,15,1378,0.8798503674145159,TPESampler,COMPLETE
806,0.3142791798734006,2025-04-24 21:58:59.912987,2025-04-24 21:59:07.485243,0 days 00:00:07.572256,0.09913963733976974,12,,2,7,1271,0.9361944365790347,TPESampler,COMPLETE
807,0.3098556075323369,2025-04-24 21:59:03.758127,2025-04-24 21:59:09.968106,0 days 00:00:06.209979,0.09850700288123795,9,,2,9,1153,0.9985886625621329,TPESampler,COMPLETE
808,0.3644107079742131,2025-04-24 21:59:07.134708,2025-04-24 21:59:14.657202,0 days 00:00:07.522494,0.06804965864342356,12,,3,10,1352,0.9173748580391323,TPESampler,COMPLETE
809,0.2969043461155742,2025-04-24 21:59:07.670151,2025-04-24 21:59:14.539516,0 days 00:00:06.869365,0.09020585395519849,12,,2,10,1158,0.9419514321345751,TPESampler,COMPLETE
810,0.2944169185310753,2025-04-24 21:59:10.149512,2025-04-24 21:59:18.473964,0 days 00:00:08.324452,0.08751890486524405,12,,2,11,1309,0.9658164407470803,TPESampler,COMPLETE
811,0.46985311373062816,2025-04-24 21:59:14.703124,2025-04-24 21:59:16.800602,0 days 00:00:02.097478,0.021842515369132585,3,sqrt,10,3,1125,0.8122862050756953,TPESampler,COMPLETE
812,0.3646731072913733,2025-04-24 21:59:14.859675,2025-04-24 21:59:17.440723,0 days 00:00:02.581048,0.0889125783906373,11,log2,4,11,1495,0.8590268700353835,TPESampler,COMPLETE
813,0.3426524784233834,2025-04-24 21:59:17.021524,2025-04-24 21:59:18.967125,0 days 00:00:01.945601,0.06858131130296506,10,log2,3,10,1100,0.9476907686850272,TPESampler,COMPLETE
814,0.40321846592692623,2025-04-24 21:59:17.666184,2025-04-24 21:59:19.115605,0 days 00:00:01.449421,0.08172331149602259,3,,6,5,298,0.6261302124910544,TPESampler,COMPLETE
815,0.3689062414213839,2025-04-24 21:59:18.665882,2025-04-24 21:59:25.440051,0 days 00:00:06.774169,0.09828962170352226,11,,3,9,1144,0.9774970660848434,TPESampler,COMPLETE
816,0.3556314412839867,2025-04-24 21:59:19.163896,2025-04-24 21:59:22.630147,0 days 00:00:03.466251,0.0465127054226638,5,,2,12,1232,0.6126461218893839,TPESampler,COMPLETE
817,0.36552446310460257,2025-04-24 21:59:19.375983,2025-04-24 21:59:27.243944,0 days 00:00:07.867961,0.08245946245885992,12,,3,14,1255,0.9857805325898976,TPESampler,COMPLETE
818,0.3092807439282518,2025-04-24 21:59:22.814959,2025-04-24 21:59:30.150599,0 days 00:00:07.335640,0.09375775775521596,11,,2,13,1223,0.9852976243460112,TPESampler,COMPLETE
819,0.3874628956646517,2025-04-24 21:59:25.629393,2025-04-24 21:59:26.937716,0 days 00:00:01.308323,0.025907784649833926,10,sqrt,1,13,680,0.6506241962354824,TPESampler,COMPLETE
820,0.36605561530205105,2025-04-24 21:59:27.118025,2025-04-24 21:59:33.727291,0 days 00:00:06.609266,0.0981779478530606,12,,4,12,1204,0.9263614382485413,TPESampler,COMPLETE
821,0.34825634602975925,2025-04-24 21:59:27.423797,2025-04-24 21:59:33.773406,0 days 00:00:06.349609,0.0951309663054133,11,,3,15,1160,0.9477541904426211,TPESampler,COMPLETE
822,0.3045298146735371,2025-04-24 21:59:30.318416,2025-04-24 21:59:36.836647,0 days 00:00:06.518231,0.056676302463167585,12,,2,13,1056,0.9625755463272718,TPESampler,COMPLETE
823,0.3184243964966307,2025-04-24 21:59:33.879563,2025-04-24 21:59:41.264523,0 days 00:00:07.384960,0.08322739683178022,12,,1,9,1209,0.9045594900478577,TPESampler,COMPLETE
824,0.32071226925572377,2025-04-24 21:59:33.922337,2025-04-24 21:59:39.560722,0 days 00:00:05.638385,0.04411635160359726,12,,2,9,995,0.8136132070562611,TPESampler,COMPLETE
825,0.3638529512446734,2025-04-24 21:59:37.013153,2025-04-24 21:59:44.483793,0 days 00:00:07.470640,0.06839821800838794,12,,3,12,1178,0.9989289179313257,TPESampler,COMPLETE
826,0.35555811928820114,2025-04-24 21:59:39.750966,2025-04-24 21:59:46.151114,0 days 00:00:06.400148,0.09314550825013874,12,,3,10,1091,0.9080685532434769,TPESampler,COMPLETE
827,0.6282900788357165,2025-04-24 21:59:41.449500,2025-04-24 21:59:42.221283,0 days 00:00:00.771783,0.09628884175011702,5,log2,9,6,205,0.8818852044321435,TPESampler,COMPLETE
828,0.29373097646751095,2025-04-24 21:59:42.416906,2025-04-24 21:59:51.828933,0 days 00:00:09.412027,0.0721108620037545,12,,2,9,1408,0.997867661694841,TPESampler,COMPLETE
829,0.7263694700287319,2025-04-24 21:59:44.672248,2025-04-24 21:59:45.632638,0 days 00:00:00.960390,0.02316805042959189,10,log2,10,2,505,0.7876333590143315,TPESampler,COMPLETE
830,0.4653232423408866,2025-04-24 21:59:45.809468,2025-04-24 21:59:47.488729,0 days 00:00:01.679261,0.06494250347824294,10,log2,10,17,1211,0.8553565703713868,TPESampler,COMPLETE
831,0.43945105452472194,2025-04-24 21:59:46.333919,2025-04-24 21:59:49.930349,0 days 00:00:03.596430,0.014318415954302255,7,,8,17,774,0.9054704057411578,TPESampler,COMPLETE
832,0.3198248014221538,2025-04-24 21:59:47.673872,2025-04-24 21:59:49.266280,0 days 00:00:01.592408,0.07779811982473277,12,sqrt,3,16,863,0.941632840244949,TPESampler,COMPLETE
833,0.30016164270197293,2025-04-24 21:59:49.455858,2025-04-24 21:59:54.758142,0 days 00:00:05.302284,0.08092706422920552,10,,2,9,902,0.9188277610990669,TPESampler,COMPLETE
834,0.5130175696369537,2025-04-24 21:59:50.124458,2025-04-24 21:59:51.219800,0 days 00:00:01.095342,0.06046057558930094,12,log2,10,9,679,0.9419365372127486,TPESampler,COMPLETE
835,0.4264527418116259,2025-04-24 21:59:51.398457,2025-04-24 21:59:52.644752,0 days 00:00:01.246295,0.07863161754636339,9,sqrt,8,7,498,0.7781920594519248,TPESampler,COMPLETE
836,0.33213691851449495,2025-04-24 21:59:52.033188,2025-04-24 21:59:59.605364,0 days 00:00:07.572176,0.07505036929102392,11,,1,8,1242,0.9522701999338138,TPESampler,COMPLETE
837,0.40203827434008493,2025-04-24 21:59:52.841896,2025-04-24 22:00:00.814661,0 days 00:00:07.972765,0.087237354030023,10,,5,12,1465,0.9890621646063215,TPESampler,COMPLETE
838,0.37774779701049993,2025-04-24 21:59:54.945660,2025-04-24 21:59:59.135270,0 days 00:00:04.189610,0.08033315038544976,7,,5,2,1190,0.7610506328708798,TPESampler,COMPLETE
839,0.4914676174561059,2025-04-24 21:59:59.315263,2025-04-24 22:00:01.912483,0 days 00:00:02.597220,0.01355340287156359,4,log2,3,11,1409,0.9255594032204779,TPESampler,COMPLETE
840,0.368399448194874,2025-04-24 21:59:59.812879,2025-04-24 22:00:02.502582,0 days 00:00:02.689703,0.02709358323288785,8,sqrt,2,9,1299,0.787294379869413,TPESampler,COMPLETE
841,0.32017566713890205,2025-04-24 22:00:01.012896,2025-04-24 22:00:10.595922,0 days 00:00:09.583026,0.08781293884973623,12,,1,14,1414,0.9965179851669402,TPESampler,COMPLETE
842,0.3316657558206509,2025-04-24 22:00:02.347758,2025-04-24 22:00:10.445237,0 days 00:00:08.097479,0.07011327868237634,12,,1,11,1246,0.9806119756704237,TPESampler,COMPLETE
843,0.32037573924004303,2025-04-24 22:00:02.820056,2025-04-24 22:00:04.938262,0 days 00:00:02.118206,0.07695830317627804,12,sqrt,3,10,1358,0.9919362367602578,TPESampler,COMPLETE
844,0.306368130254618,2025-04-24 22:00:05.113975,2025-04-24 22:00:12.318574,0 days 00:00:07.204599,0.08880680915211536,12,,2,12,1188,0.9514540534139295,TPESampler,COMPLETE
845,0.33883385847136355,2025-04-24 22:00:10.612954,2025-04-24 22:00:17.840187,0 days 00:00:07.227233,0.05231847223283647,12,,1,7,1164,0.9409014401179018,TPESampler,COMPLETE
846,0.3012671825052859,2025-04-24 22:00:10.768754,2025-04-24 22:00:17.836158,0 days 00:00:07.067404,0.08787594344178816,12,,2,11,1094,0.996707170761232,TPESampler,COMPLETE
847,0.3123457010481088,2025-04-24 22:00:12.888565,2025-04-24 22:00:19.400408,0 days 00:00:06.511843,0.05313101334893328,10,,2,10,1119,0.984116150347888,TPESampler,COMPLETE
848,0.30916074395935994,2025-04-24 22:00:17.987232,2025-04-24 22:00:26.139614,0 days 00:00:08.152382,0.05324760682833593,10,,2,9,1292,0.9962776134644687,TPESampler,COMPLETE
849,0.3515109744797496,2025-04-24 22:00:18.036696,2025-04-24 22:00:19.790163,0 days 00:00:01.753467,0.06237612031716528,12,sqrt,1,6,644,0.9288896145583653,TPESampler,COMPLETE
850,0.3562877673639568,2025-04-24 22:00:19.595549,2025-04-24 22:00:21.577943,0 days 00:00:01.982394,0.0593447788475873,8,sqrt,2,16,1027,0.9489727530767119,TPESampler,COMPLETE
851,0.3911463638583755,2025-04-24 22:00:20.254562,2025-04-24 22:00:29.180954,0 days 00:00:08.926392,0.08457954475121147,12,,4,11,1396,0.9965137931038366,TPESampler,COMPLETE
852,0.5770842439184648,2025-04-24 22:00:21.755567,2025-04-24 22:00:22.572371,0 days 00:00:00.816804,0.018312122305535295,3,,4,18,110,0.8166769042693881,TPESampler,COMPLETE
853,0.44348335895402147,2025-04-24 22:00:22.750360,2025-04-24 22:00:24.152036,0 days 00:00:01.401676,0.028395513905639515,11,sqrt,9,3,912,0.7725931020381342,TPESampler,COMPLETE
854,0.48786230072653913,2025-04-24 22:00:24.340240,2025-04-24 22:00:25.282826,0 days 00:00:00.942586,0.07157941382106958,12,sqrt,10,18,340,0.6558006551585294,TPESampler,COMPLETE
855,0.3373162345635282,2025-04-24 22:00:25.458947,2025-04-24 22:00:32.559122,0 days 00:00:07.100175,0.06112135426531288,11,,1,9,1148,0.9937215112954205,TPESampler,COMPLETE
856,0.3108093872877176,2025-04-24 22:00:26.314117,2025-04-24 22:00:34.621430,0 days 00:00:08.307313,0.09804858641120759,10,,2,11,1481,0.9921158571741517,TPESampler,COMPLETE
857,0.29470200041729117,2025-04-24 22:00:29.367052,2025-04-24 22:00:38.678487,0 days 00:00:09.311435,0.06026051061995652,12,,2,9,1453,0.9896842209122705,TPESampler,COMPLETE
858,0.3582807891198918,2025-04-24 22:00:32.749525,2025-04-24 22:00:34.945211,0 days 00:00:02.195686,0.05992161364531719,12,log2,1,8,1454,0.9906791565302203,TPESampler,COMPLETE
859,0.38016280808765274,2025-04-24 22:00:34.806814,2025-04-24 22:00:42.670311,0 days 00:00:07.863497,0.0799319070499961,12,,3,8,1367,0.8696165682723637,TPESampler,COMPLETE
860,0.7472860149724804,2025-04-24 22:00:35.139258,2025-04-24 22:00:36.485501,0 days 00:00:01.346243,0.01178817387688231,6,log2,10,14,1002,0.9313013583861656,TPESampler,COMPLETE
861,0.3375573628154402,2025-04-24 22:00:36.661435,2025-04-24 22:00:41.667613,0 days 00:00:05.006178,0.039939927819753744,6,,2,12,1329,0.8262909961255179,TPESampler,COMPLETE
862,0.35498116632676124,2025-04-24 22:00:38.857069,2025-04-24 22:00:40.653617,0 days 00:00:01.796548,0.09857842684212097,12,log2,2,13,1217,0.8715626587522824,TPESampler,COMPLETE
863,0.4143271284864593,2025-04-24 22:00:40.861756,2025-04-24 22:00:42.760441,0 days 00:00:01.898685,0.01728365365717391,8,log2,2,13,1267,0.6332881117377261,TPESampler,COMPLETE
864,0.3515384979708981,2025-04-24 22:00:41.852051,2025-04-24 22:00:46.367932,0 days 00:00:04.515881,0.04116610603524007,3,,4,12,1393,0.9410763026020974,TPESampler,COMPLETE
865,0.3648833553501047,2025-04-24 22:00:42.825623,2025-04-24 22:00:44.733419,0 days 00:00:01.907796,0.04848189569527051,12,log2,4,6,1222,0.9904587972912601,TPESampler,COMPLETE
866,0.32782330553344036,2025-04-24 22:00:42.956086,2025-04-24 22:00:51.781136,0 days 00:00:08.825050,0.0655518263333112,12,,1,8,1264,0.9996691696713941,TPESampler,COMPLETE
867,0.7294624867999611,2025-04-24 22:00:44.906865,2025-04-24 22:00:45.625127,0 days 00:00:00.718262,0.024543919586252537,4,sqrt,2,6,106,0.9423503676402284,TPESampler,COMPLETE
868,0.2909139463220309,2025-04-24 22:00:45.804613,2025-04-24 22:00:53.934995,0 days 00:00:08.130382,0.0945812183888036,12,,2,10,1267,0.9702245139265752,TPESampler,COMPLETE
869,0.5442089934782991,2025-04-24 22:00:46.560904,2025-04-24 22:00:48.244613,0 days 00:00:01.683709,0.012616533685827094,3,log2,2,17,1428,0.7551921213414816,TPESampler,COMPLETE
870,0.32802778835387303,2025-04-24 22:00:48.430175,2025-04-24 22:00:57.441102,0 days 00:00:09.010927,0.06414704754184633,12,,1,9,1366,0.9993858777436898,TPESampler,COMPLETE
871,0.4263967076051303,2025-04-24 22:00:51.963201,2025-04-24 22:00:53.410049,0 days 00:00:01.446848,0.08772901112204722,9,sqrt,8,17,930,0.9768980711716727,TPESampler,COMPLETE
872,0.3694885122518174,2025-04-24 22:00:53.579994,2025-04-24 22:01:01.675199,0 days 00:00:08.095205,0.04015164411464805,12,,4,8,1326,0.9930916512380968,TPESampler,COMPLETE
