number,value,datetime_start,datetime_complete,duration,params_criterion,params_max_depth,params_max_features,params_min_samples_leaf,params_min_samples_split,params_splitter,system_attrs_auto:sampler,state
715,1.39690460665991,2025-04-24 21:04:46.570749,2025-04-24 21:04:47.482287,0 days 00:00:00.911538,absolute_error,22,log2,3,7,random,TPESampler,COMPLETE
716,0.5647532297301866,2025-04-24 21:04:46.824824,2025-04-24 21:04:47.942241,0 days 00:00:01.117417,absolute_error,34,sqrt,1,2,best,TPESampler,COMPLETE
717,0.6966010673464934,2025-04-24 21:04:47.532796,2025-04-24 21:04:48.160021,0 days 00:00:00.627225,friedman_mse,31,sqrt,1,2,best,TPESampler,COMPLETE
718,1.2076965740491883,2025-04-24 21:04:47.725418,2025-04-24 21:04:48.543467,0 days 00:00:00.818049,absolute_error,28,sqrt,3,2,best,TPESampler,COMPLETE
719,0.8356479176587005,2025-04-24 21:04:48.157556,2025-04-24 21:04:49.255626,0 days 00:00:01.098070,absolute_error,26,sqrt,1,5,random,TPESampler,COMPLETE
720,0.8883365842971866,2025-04-24 21:04:48.453983,2025-04-24 21:04:49.441056,0 days 00:00:00.987073,squared_error,27,sqrt,1,20,random,TPESampler,COMPLETE
721,0.7495346713750386,2025-04-24 21:04:48.787733,2025-04-24 21:04:49.848614,0 days 00:00:01.060881,absolute_error,30,sqrt,1,2,best,TPESampler,COMPLETE
722,1.2076965740491883,2025-04-24 21:04:49.652244,2025-04-24 21:04:50.387885,0 days 00:00:00.735641,absolute_error,35,sqrt,3,2,best,TPESampler,COMPLETE
723,0.5872420994323145,2025-04-24 21:04:49.709174,2025-04-24 21:04:50.556141,0 days 00:00:00.846967,absolute_error,35,sqrt,1,2,best,TPESampler,COMPLETE
724,0.6310502563923985,2025-04-24 21:04:50.077006,2025-04-24 21:04:50.863506,0 days 00:00:00.786500,absolute_error,33,sqrt,1,5,best,TPESampler,COMPLETE
725,1.2076965740491883,2025-04-24 21:04:50.609886,2025-04-24 21:04:51.425859,0 days 00:00:00.815973,absolute_error,28,sqrt,3,5,best,TPESampler,COMPLETE
726,0.9970333222906006,2025-04-24 21:04:50.811965,2025-04-24 21:04:51.632762,0 days 00:00:00.820797,absolute_error,25,sqrt,1,5,best,TPESampler,COMPLETE
727,1.3249616219514153,2025-04-24 21:04:51.360958,2025-04-24 21:04:52.012126,0 days 00:00:00.651168,squared_error,3,sqrt,4,3,random,TPESampler,COMPLETE
728,1.2617212807074492,2025-04-24 21:04:51.680068,2025-04-24 21:04:52.303542,0 days 00:00:00.623474,squared_error,11,sqrt,1,9,best,TPESampler,COMPLETE
729,0.6112778743973727,2025-04-24 21:04:51.910833,2025-04-24 21:04:52.735417,0 days 00:00:00.824584,absolute_error,29,sqrt,1,2,best,TPESampler,COMPLETE
730,1.4138971746431086,2025-04-24 21:04:52.261424,2025-04-24 21:04:52.945513,0 days 00:00:00.684089,absolute_error,24,log2,9,18,best,TPESampler,COMPLETE
731,0.9996424324783258,2025-04-24 21:04:52.546358,2025-04-24 21:04:53.252404,0 days 00:00:00.706046,absolute_error,29,sqrt,2,2,best,TPESampler,COMPLETE
732,0.7033595174659969,2025-04-24 21:04:52.999326,2025-04-24 21:04:54.021939,0 days 00:00:01.022613,absolute_error,28,sqrt,1,5,best,TPESampler,COMPLETE
733,1.092772879039125,2025-04-24 21:04:53.208929,2025-04-24 21:04:54.067218,0 days 00:00:00.858289,absolute_error,24,sqrt,1,2,best,TPESampler,COMPLETE
734,0.6432215326416982,2025-04-24 21:04:53.466337,2025-04-24 21:04:54.209958,0 days 00:00:00.743621,squared_error,32,sqrt,1,5,best,TPESampler,COMPLETE
735,0.6755787793007089,2025-04-24 21:04:54.215840,2025-04-24 21:04:54.975399,0 days 00:00:00.759559,absolute_error,35,sqrt,1,5,best,TPESampler,COMPLETE
736,1.2076965740491883,2025-04-24 21:04:54.278357,2025-04-24 21:04:55.372263,0 days 00:00:01.093906,absolute_error,22,sqrt,3,5,best,TPESampler,COMPLETE
737,0.9996424324783258,2025-04-24 21:04:54.377914,2025-04-24 21:04:55.247983,0 days 00:00:00.870069,absolute_error,31,sqrt,2,2,best,TPESampler,COMPLETE
738,0.9996424324783258,2025-04-24 21:04:55.233069,2025-04-24 21:04:55.876957,0 days 00:00:00.643888,absolute_error,28,sqrt,2,2,best,TPESampler,COMPLETE
739,0.5647532297301866,2025-04-24 21:04:55.463539,2025-04-24 21:04:56.283500,0 days 00:00:00.819961,absolute_error,34,sqrt,1,2,best,TPESampler,COMPLETE
740,0.5872420994323145,2025-04-24 21:04:55.620911,2025-04-24 21:04:56.420437,0 days 00:00:00.799526,absolute_error,35,sqrt,1,2,best,TPESampler,COMPLETE
741,0.9996424324783258,2025-04-24 21:04:56.190649,2025-04-24 21:04:56.849725,0 days 00:00:00.659076,absolute_error,28,sqrt,2,2,best,TPESampler,COMPLETE
742,1.3725420775754957,2025-04-24 21:04:56.547395,2025-04-24 21:04:57.326730,0 days 00:00:00.779335,squared_error,2,log2,3,16,best,TPESampler,COMPLETE
743,0.7495346713750386,2025-04-24 21:04:56.725179,2025-04-24 21:04:57.543217,0 days 00:00:00.818038,absolute_error,30,sqrt,1,2,best,TPESampler,COMPLETE
744,1.1302409528743838,2025-04-24 21:04:57.057678,2025-04-24 21:04:57.733326,0 days 00:00:00.675648,absolute_error,29,sqrt,2,5,best,TPESampler,COMPLETE
745,0.9312073070199461,2025-04-24 21:04:57.563137,2025-04-24 21:04:58.519508,0 days 00:00:00.956371,absolute_error,30,sqrt,1,5,best,TPESampler,COMPLETE
746,0.610896094172543,2025-04-24 21:04:57.771956,2025-04-24 21:04:58.819277,0 days 00:00:01.047321,absolute_error,26,sqrt,1,2,best,TPESampler,COMPLETE
747,0.5542791023918845,2025-04-24 21:04:57.968302,2025-04-24 21:04:58.853862,0 days 00:00:00.885560,absolute_error,31,sqrt,1,2,best,TPESampler,COMPLETE
748,1.4099363199826813,2025-04-24 21:04:58.762631,2025-04-24 21:04:59.378735,0 days 00:00:00.616104,absolute_error,30,log2,5,12,random,TPESampler,COMPLETE
749,0.856297005325639,2025-04-24 21:04:59.072239,2025-04-24 21:04:59.908120,0 days 00:00:00.835881,absolute_error,28,sqrt,1,2,best,TPESampler,COMPLETE
750,0.7315288325921784,2025-04-24 21:04:59.120232,2025-04-24 21:04:59.937666,0 days 00:00:00.817434,friedman_mse,28,sqrt,1,2,random,TPESampler,COMPLETE
751,0.856297005325639,2025-04-24 21:04:59.779889,2025-04-24 21:05:00.828352,0 days 00:00:01.048463,absolute_error,28,sqrt,1,2,best,TPESampler,COMPLETE
752,1.2076965740491883,2025-04-24 21:05:00.127504,2025-04-24 21:05:01.056418,0 days 00:00:00.928914,absolute_error,30,sqrt,3,5,best,TPESampler,COMPLETE
753,1.2076965740491883,2025-04-24 21:05:00.184503,2025-04-24 21:05:01.273428,0 days 00:00:01.088925,absolute_error,30,sqrt,3,5,best,TPESampler,COMPLETE
754,0.9996424324783258,2025-04-24 21:05:01.069990,2025-04-24 21:05:01.683946,0 days 00:00:00.613956,absolute_error,30,sqrt,2,2,best,TPESampler,COMPLETE
755,1.0673201805126924,2025-04-24 21:05:01.367715,2025-04-24 21:05:02.165888,0 days 00:00:00.798173,friedman_mse,29,sqrt,5,3,best,TPESampler,COMPLETE
756,1.0498076960778187,2025-04-24 21:05:01.535621,2025-04-24 21:05:02.347968,0 days 00:00:00.812347,squared_error,24,sqrt,3,2,best,TPESampler,COMPLETE
757,1.3679729947669532,2025-04-24 21:05:01.942448,2025-04-24 21:05:02.580409,0 days 00:00:00.637961,friedman_mse,1,log2,5,9,random,TPESampler,COMPLETE
758,0.9312073070199461,2025-04-24 21:05:02.483594,2025-04-24 21:05:03.421969,0 days 00:00:00.938375,absolute_error,30,sqrt,1,5,best,TPESampler,COMPLETE
759,0.6598205726585867,2025-04-24 21:05:02.786130,2025-04-24 21:05:03.728027,0 days 00:00:00.941897,squared_error,33,sqrt,1,2,best,TPESampler,COMPLETE
760,1.4230105932325812,2025-04-24 21:05:02.837371,2025-04-24 21:05:03.726594,0 days 00:00:00.889223,absolute_error,31,sqrt,9,8,random,TPESampler,COMPLETE
761,0.7495346713750386,2025-04-24 21:05:03.675436,2025-04-24 21:05:04.319354,0 days 00:00:00.643918,absolute_error,30,sqrt,1,2,best,TPESampler,COMPLETE
762,0.5872420994323145,2025-04-24 21:05:03.953389,2025-04-24 21:05:04.892880,0 days 00:00:00.939491,absolute_error,35,sqrt,1,2,best,TPESampler,COMPLETE
763,0.6310502563923985,2025-04-24 21:05:04.075720,2025-04-24 21:05:04.944536,0 days 00:00:00.868816,absolute_error,33,sqrt,1,5,best,TPESampler,COMPLETE
764,1.3679729947669532,2025-04-24 21:05:04.726155,2025-04-24 21:05:05.458924,0 days 00:00:00.732769,squared_error,8,log2,10,8,random,TPESampler,COMPLETE
765,0.856297005325639,2025-04-24 21:05:05.079630,2025-04-24 21:05:06.061744,0 days 00:00:00.982114,absolute_error,28,sqrt,1,2,best,TPESampler,COMPLETE
766,0.9896382479483637,2025-04-24 21:05:05.192526,2025-04-24 21:05:06.427795,0 days 00:00:01.235269,absolute_error,35,log2,2,19,best,TPESampler,COMPLETE
767,1.3187513250101375,2025-04-24 21:05:05.678251,2025-04-24 21:05:06.787332,0 days 00:00:01.109081,absolute_error,19,sqrt,2,2,random,TPESampler,COMPLETE
768,1.0498076960778187,2025-04-24 21:05:06.681108,2025-04-24 21:05:07.448767,0 days 00:00:00.767659,friedman_mse,21,sqrt,3,2,best,TPESampler,COMPLETE
769,0.9312073070199461,2025-04-24 21:05:06.750658,2025-04-24 21:05:07.763833,0 days 00:00:01.013175,absolute_error,30,sqrt,1,5,best,TPESampler,COMPLETE
770,1.0131068116827324,2025-04-24 21:05:07.152895,2025-04-24 21:05:07.946745,0 days 00:00:00.793850,absolute_error,35,log2,3,3,best,TPESampler,COMPLETE
771,1.2076965740491883,2025-04-24 21:05:07.706623,2025-04-24 21:05:08.469541,0 days 00:00:00.762918,absolute_error,32,sqrt,3,2,best,TPESampler,COMPLETE
772,1.2076965740491883,2025-04-24 21:05:08.016231,2025-04-24 21:05:08.802607,0 days 00:00:00.786376,absolute_error,35,sqrt,3,2,best,TPESampler,COMPLETE
773,0.7495346713750386,2025-04-24 21:05:08.254793,2025-04-24 21:05:09.035026,0 days 00:00:00.780233,absolute_error,30,sqrt,1,2,best,TPESampler,COMPLETE
774,0.5872420994323145,2025-04-24 21:05:08.750553,2025-04-24 21:05:09.576817,0 days 00:00:00.826264,absolute_error,35,sqrt,1,2,best,TPESampler,COMPLETE
775,1.3679729947669532,2025-04-24 21:05:09.042797,2025-04-24 21:05:09.883079,0 days 00:00:00.840282,squared_error,1,log2,5,5,random,TPESampler,COMPLETE
776,0.6873703655189166,2025-04-24 21:05:09.253752,2025-04-24 21:05:10.096619,0 days 00:00:00.842867,absolute_error,30,log2,1,2,best,TPESampler,COMPLETE
777,1.3677569516816517,2025-04-24 21:05:09.816277,2025-04-24 21:05:10.492019,0 days 00:00:00.675742,friedman_mse,35,log2,8,16,best,TPESampler,COMPLETE
778,0.9312073070199461,2025-04-24 21:05:10.182568,2025-04-24 21:05:10.975865,0 days 00:00:00.793297,absolute_error,30,sqrt,1,5,best,TPESampler,COMPLETE
779,0.8261004558018388,2025-04-24 21:05:10.349488,2025-04-24 21:05:11.142719,0 days 00:00:00.793231,squared_error,34,log2,2,13,best,TPESampler,COMPLETE
780,1.0499206487851411,2025-04-24 21:05:10.751895,2025-04-24 21:05:11.876157,0 days 00:00:01.124262,squared_error,27,sqrt,3,19,best,TPESampler,COMPLETE
781,0.8957868161300393,2025-04-24 21:05:11.275315,2025-04-24 21:05:12.105336,0 days 00:00:00.830021,absolute_error,19,sqrt,1,5,best,TPESampler,COMPLETE
782,0.9996424324783258,2025-04-24 21:05:11.346358,2025-04-24 21:05:12.420450,0 days 00:00:01.074092,absolute_error,27,sqrt,2,2,best,TPESampler,COMPLETE
783,1.3679729947669532,2025-04-24 21:05:12.117865,2025-04-24 21:05:12.987197,0 days 00:00:00.869332,squared_error,21,log2,6,7,random,TPESampler,COMPLETE
784,0.6112778743973727,2025-04-24 21:05:12.320950,2025-04-24 21:05:13.390904,0 days 00:00:01.069954,absolute_error,29,sqrt,1,2,best,TPESampler,COMPLETE
785,0.6288399089804382,2025-04-24 21:05:12.672568,2025-04-24 21:05:13.745426,0 days 00:00:01.072858,absolute_error,31,sqrt,1,5,best,TPESampler,COMPLETE
786,1.2076965740491883,2025-04-24 21:05:13.421205,2025-04-24 21:05:14.430542,0 days 00:00:01.009337,absolute_error,27,sqrt,3,2,best,TPESampler,COMPLETE
787,1.0099953635558898,2025-04-24 21:05:13.753629,2025-04-24 21:05:14.899167,0 days 00:00:01.145538,absolute_error,23,sqrt,1,2,best,TPESampler,COMPLETE
788,1.3262151716400714,2025-04-24 21:05:14.035770,2025-04-24 21:05:15.198577,0 days 00:00:01.162807,squared_error,12,sqrt,10,18,random,TPESampler,COMPLETE
789,0.5647532297301866,2025-04-24 21:05:14.767402,2025-04-24 21:05:15.935716,0 days 00:00:01.168314,absolute_error,34,sqrt,1,2,best,TPESampler,COMPLETE
790,1.3679729947669532,2025-04-24 21:05:15.347228,2025-04-24 21:05:16.541662,0 days 00:00:01.194434,friedman_mse,10,log2,8,19,random,TPESampler,COMPLETE
791,1.2731240702210205,2025-04-24 21:05:15.611281,2025-04-24 21:05:16.749635,0 days 00:00:01.138354,squared_error,27,sqrt,5,14,random,TPESampler,COMPLETE
792,0.7495346713750386,2025-04-24 21:05:16.430368,2025-04-24 21:05:17.183655,0 days 00:00:00.753287,absolute_error,30,sqrt,1,2,best,TPESampler,COMPLETE
793,1.1302409528743838,2025-04-24 21:05:16.879728,2025-04-24 21:05:17.512680,0 days 00:00:00.632952,absolute_error,34,sqrt,2,5,best,TPESampler,COMPLETE
794,1.0498076960778187,2025-04-24 21:05:17.097896,2025-04-24 21:05:17.952644,0 days 00:00:00.854748,friedman_mse,32,sqrt,3,2,best,TPESampler,COMPLETE
795,1.2728267614075626,2025-04-24 21:05:17.411576,2025-04-24 21:05:18.241987,0 days 00:00:00.830411,friedman_mse,9,sqrt,7,12,random,TPESampler,COMPLETE
796,0.9860869366393894,2025-04-24 21:05:17.815931,2025-04-24 21:05:18.650362,0 days 00:00:00.834431,absolute_error,30,sqrt,1,2,random,TPESampler,COMPLETE
797,1.359571383264774,2025-04-24 21:05:18.200908,2025-04-24 21:05:19.050906,0 days 00:00:00.849998,friedman_mse,24,sqrt,10,3,best,TPESampler,COMPLETE
798,0.5542791023918845,2025-04-24 21:05:18.477902,2025-04-24 21:05:19.529324,0 days 00:00:01.051422,absolute_error,31,sqrt,1,2,best,TPESampler,COMPLETE
799,1.2076965740491883,2025-04-24 21:05:18.941798,2025-04-24 21:05:19.769906,0 days 00:00:00.828108,absolute_error,25,sqrt,3,5,best,TPESampler,COMPLETE
800,0.856297005325639,2025-04-24 21:05:19.434056,2025-04-24 21:05:20.147557,0 days 00:00:00.713501,absolute_error,28,sqrt,1,2,best,TPESampler,COMPLETE
801,0.5682124588118789,2025-04-24 21:05:19.844547,2025-04-24 21:05:20.679386,0 days 00:00:00.834839,absolute_error,27,sqrt,1,2,best,TPESampler,COMPLETE
802,0.9996424324783258,2025-04-24 21:05:20.100564,2025-04-24 21:05:20.933622,0 days 00:00:00.833058,absolute_error,32,sqrt,2,2,best,TPESampler,COMPLETE
803,1.3625908614134468,2025-04-24 21:05:20.392508,2025-04-24 21:05:21.146979,0 days 00:00:00.754471,squared_error,33,log2,4,18,random,TPESampler,COMPLETE
804,0.7033595174659969,2025-04-24 21:05:20.882727,2025-04-24 21:05:21.688429,0 days 00:00:00.805702,absolute_error,28,sqrt,1,5,best,TPESampler,COMPLETE
805,0.9996424324783258,2025-04-24 21:05:21.159619,2025-04-24 21:05:21.989740,0 days 00:00:00.830121,absolute_error,30,sqrt,2,2,best,TPESampler,COMPLETE
806,1.3679729947669532,2025-04-24 21:05:21.377712,2025-04-24 21:05:22.147101,0 days 00:00:00.769389,squared_error,35,log2,9,2,random,TPESampler,COMPLETE
807,0.7495346713750386,2025-04-24 21:05:21.969565,2025-04-24 21:05:22.718293,0 days 00:00:00.748728,absolute_error,30,sqrt,1,2,best,TPESampler,COMPLETE
808,1.2076965740491883,2025-04-24 21:05:22.199439,2025-04-24 21:05:23.028970,0 days 00:00:00.829531,absolute_error,32,sqrt,3,2,best,TPESampler,COMPLETE
809,0.6755787793007089,2025-04-24 21:05:22.346967,2025-04-24 21:05:23.210933,0 days 00:00:00.863966,absolute_error,35,sqrt,1,5,best,TPESampler,COMPLETE
810,1.0313227598578136,2025-04-24 21:05:22.966731,2025-04-24 21:05:23.695374,0 days 00:00:00.728643,absolute_error,23,sqrt,1,5,best,TPESampler,COMPLETE
811,0.7449736342272454,2025-04-24 21:05:23.300784,2025-04-24 21:05:24.390623,0 days 00:00:01.089839,absolute_error,29,log2,1,6,best,TPESampler,COMPLETE
812,0.7495346713750386,2025-04-24 21:05:23.472487,2025-04-24 21:05:24.505346,0 days 00:00:01.032859,absolute_error,30,sqrt,1,2,best,TPESampler,COMPLETE
813,1.4099363199826813,2025-04-24 21:05:23.943217,2025-04-24 21:05:24.782976,0 days 00:00:00.839759,absolute_error,34,log2,5,6,random,TPESampler,COMPLETE
814,0.7084730562241784,2025-04-24 21:05:24.644535,2025-04-24 21:05:25.633403,0 days 00:00:00.988868,absolute_error,32,sqrt,1,5,best,TPESampler,COMPLETE
815,1.4058384605507321,2025-04-24 21:05:24.713461,2025-04-24 21:05:25.593503,0 days 00:00:00.880042,absolute_error,3,sqrt,4,18,best,TPESampler,COMPLETE
816,1.4148597056909755,2025-04-24 21:05:25.201565,2025-04-24 21:05:25.955347,0 days 00:00:00.753782,absolute_error,7,log2,8,16,random,TPESampler,COMPLETE
817,1.2076965740491883,2025-04-24 21:05:25.863442,2025-04-24 21:05:26.491074,0 days 00:00:00.627632,absolute_error,29,sqrt,3,5,best,TPESampler,COMPLETE
818,0.610896094172543,2025-04-24 21:05:25.917480,2025-04-24 21:05:26.865287,0 days 00:00:00.947807,absolute_error,26,sqrt,1,2,best,TPESampler,COMPLETE
819,1.0949224575803045,2025-04-24 21:05:26.210928,2025-04-24 21:05:27.173141,0 days 00:00:00.962213,absolute_error,28,sqrt,2,10,best,TPESampler,COMPLETE
820,0.5542791023918845,2025-04-24 21:05:26.780090,2025-04-24 21:05:27.531991,0 days 00:00:00.751901,absolute_error,31,sqrt,1,2,best,TPESampler,COMPLETE
821,1.3682811295707875,2025-04-24 21:05:27.123028,2025-04-24 21:05:27.834983,0 days 00:00:00.711955,squared_error,2,sqrt,3,12,best,TPESampler,COMPLETE
822,1.3888218671611363,2025-04-24 21:05:27.432606,2025-04-24 21:05:28.315496,0 days 00:00:00.882890,absolute_error,24,log2,1,18,random,TPESampler,COMPLETE
823,1.4248046085496897,2025-04-24 21:05:27.833617,2025-04-24 21:05:28.492910,0 days 00:00:00.659293,absolute_error,33,sqrt,8,18,best,TPESampler,COMPLETE
824,1.3679729947669532,2025-04-24 21:05:28.092483,2025-04-24 21:05:28.780889,0 days 00:00:00.688406,friedman_mse,20,log2,10,11,random,TPESampler,COMPLETE
825,0.6353676108874886,2025-04-24 21:05:28.614355,2025-04-24 21:05:29.367557,0 days 00:00:00.753202,absolute_error,26,sqrt,1,5,best,TPESampler,COMPLETE
826,1.2076965740491883,2025-04-24 21:05:28.740298,2025-04-24 21:05:29.787994,0 days 00:00:01.047696,absolute_error,20,sqrt,3,2,best,TPESampler,COMPLETE
827,1.2076965740491883,2025-04-24 21:05:29.007708,2025-04-24 21:05:29.985442,0 days 00:00:00.977734,absolute_error,29,sqrt,3,2,best,TPESampler,COMPLETE
828,0.5542791023918845,2025-04-24 21:05:29.720140,2025-04-24 21:05:30.505632,0 days 00:00:00.785492,absolute_error,31,sqrt,1,2,best,TPESampler,COMPLETE
829,0.6288399089804382,2025-04-24 21:05:30.074469,2025-04-24 21:05:31.039821,0 days 00:00:00.965352,absolute_error,31,sqrt,1,5,best,TPESampler,COMPLETE
830,0.5647532297301866,2025-04-24 21:05:30.300843,2025-04-24 21:05:31.266565,0 days 00:00:00.965722,absolute_error,34,sqrt,1,2,best,TPESampler,COMPLETE
831,1.3400451655954668,2025-04-24 21:05:30.749024,2025-04-24 21:05:31.454938,0 days 00:00:00.705914,absolute_error,21,sqrt,5,19,random,TPESampler,COMPLETE
832,0.856297005325639,2025-04-24 21:05:31.293121,2025-04-24 21:05:31.960626,0 days 00:00:00.667505,absolute_error,28,sqrt,1,2,best,TPESampler,COMPLETE
833,1.2076965740491883,2025-04-24 21:05:31.520796,2025-04-24 21:05:32.519432,0 days 00:00:00.998636,absolute_error,35,sqrt,3,5,best,TPESampler,COMPLETE
834,1.2076965740491883,2025-04-24 21:05:31.712933,2025-04-24 21:05:32.765313,0 days 00:00:01.052380,absolute_error,27,sqrt,3,2,best,TPESampler,COMPLETE
835,1.3677569516816517,2025-04-24 21:05:32.285143,2025-04-24 21:05:33.286466,0 days 00:00:01.001323,friedman_mse,29,log2,5,3,best,TPESampler,COMPLETE
836,1.092772879039125,2025-04-24 21:05:32.816849,2025-04-24 21:05:33.513865,0 days 00:00:00.697016,absolute_error,24,sqrt,1,2,best,TPESampler,COMPLETE
837,0.9194592887273054,2025-04-24 21:05:33.060992,2025-04-24 21:05:33.787721,0 days 00:00:00.726729,absolute_error,27,sqrt,1,5,best,TPESampler,COMPLETE
838,1.423326593847949,2025-04-24 21:05:33.565563,2025-04-24 21:05:34.285576,0 days 00:00:00.720013,absolute_error,4,sqrt,7,3,random,TPESampler,COMPLETE
839,0.6698865826477293,2025-04-24 21:05:33.798711,2025-04-24 21:05:34.589004,0 days 00:00:00.790293,friedman_mse,30,sqrt,1,2,best,TPESampler,COMPLETE
840,1.359571383264774,2025-04-24 21:05:34.177526,2025-04-24 21:05:34.991528,0 days 00:00:00.814002,friedman_mse,6,sqrt,10,8,best,TPESampler,COMPLETE
841,0.9312073070199461,2025-04-24 21:05:34.543964,2025-04-24 21:05:35.369029,0 days 00:00:00.825065,absolute_error,30,sqrt,1,5,best,TPESampler,COMPLETE
842,0.5872420994323145,2025-04-24 21:05:34.808492,2025-04-24 21:05:35.572201,0 days 00:00:00.763709,absolute_error,35,sqrt,1,2,best,TPESampler,COMPLETE
843,0.6112778743973727,2025-04-24 21:05:35.305639,2025-04-24 21:05:36.097022,0 days 00:00:00.791383,absolute_error,29,sqrt,1,2,best,TPESampler,COMPLETE
844,0.7495346713750386,2025-04-24 21:05:35.634079,2025-04-24 21:05:36.399977,0 days 00:00:00.765898,absolute_error,30,sqrt,1,2,best,TPESampler,COMPLETE
845,1.3679729947669532,2025-04-24 21:05:35.778493,2025-04-24 21:05:36.639609,0 days 00:00:00.861116,squared_error,27,log2,10,7,random,TPESampler,COMPLETE
846,1.327329250716521,2025-04-24 21:05:36.351558,2025-04-24 21:05:37.130470,0 days 00:00:00.778912,absolute_error,33,sqrt,2,6,random,TPESampler,COMPLETE
847,1.2076965740491883,2025-04-24 21:05:36.802053,2025-04-24 21:05:37.680572,0 days 00:00:00.878519,absolute_error,29,sqrt,3,2,best,TPESampler,COMPLETE
848,1.2076965740491883,2025-04-24 21:05:36.998944,2025-04-24 21:05:37.828184,0 days 00:00:00.829240,absolute_error,28,sqrt,3,2,best,TPESampler,COMPLETE
849,0.555832913159586,2025-04-24 21:05:37.373112,2025-04-24 21:05:38.088321,0 days 00:00:00.715209,absolute_error,32,sqrt,1,2,best,TPESampler,COMPLETE
850,0.9312073070199461,2025-04-24 21:05:37.966537,2025-04-24 21:05:38.709231,0 days 00:00:00.742694,absolute_error,30,sqrt,1,5,best,TPESampler,COMPLETE
851,1.2076965740491883,2025-04-24 21:05:38.040066,2025-04-24 21:05:38.926300,0 days 00:00:00.886234,absolute_error,35,sqrt,3,2,best,TPESampler,COMPLETE
852,1.092772879039125,2025-04-24 21:05:38.360034,2025-04-24 21:05:39.134804,0 days 00:00:00.774770,absolute_error,24,sqrt,1,2,best,TPESampler,COMPLETE
853,0.6310502563923985,2025-04-24 21:05:38.987438,2025-04-24 21:05:39.665504,0 days 00:00:00.678066,absolute_error,33,sqrt,1,5,best,TPESampler,COMPLETE
854,0.555832913159586,2025-04-24 21:05:39.227548,2025-04-24 21:05:40.030943,0 days 00:00:00.803395,absolute_error,32,sqrt,1,2,best,TPESampler,COMPLETE
855,0.5682124588118789,2025-04-24 21:05:39.432319,2025-04-24 21:05:40.290031,0 days 00:00:00.857712,absolute_error,27,sqrt,1,2,best,TPESampler,COMPLETE
856,0.5872420994323145,2025-04-24 21:05:39.964696,2025-04-24 21:05:40.879813,0 days 00:00:00.915117,absolute_error,35,sqrt,1,2,best,TPESampler,COMPLETE
857,0.8674110959837661,2025-04-24 21:05:40.286852,2025-04-24 21:05:41.014257,0 days 00:00:00.727405,friedman_mse,11,log2,2,5,best,TPESampler,COMPLETE
