number,value,datetime_start,datetime_complete,duration,params_criterion,params_max_depth,params_max_features,params_min_samples_leaf,params_min_samples_split,params_splitter,system_attrs_auto:sampler,state
1285,0.6288399089804382,2025-04-24 21:08:30.547639,2025-04-24 21:08:31.455859,0 days 00:00:00.908220,absolute_error,31,sqrt,1,5,best,TPESampler,COMPLETE
1286,0.5872420994323145,2025-04-24 21:08:30.728086,2025-04-24 21:08:31.619655,0 days 00:00:00.891569,absolute_error,35,sqrt,1,2,best,TPESampler,COMPLETE
1287,1.3679729947669532,2025-04-24 21:08:31.156828,2025-04-24 21:08:31.880879,0 days 00:00:00.724051,friedman_mse,14,log2,6,7,random,TPESampler,COMPLETE
1288,0.7495346713750386,2025-04-24 21:08:31.699897,2025-04-24 21:08:32.640949,0 days 00:00:00.941052,absolute_error,30,sqrt,1,2,best,TPESampler,COMPLETE
1289,0.5682124588118789,2025-04-24 21:08:31.836810,2025-04-24 21:08:32.831769,0 days 00:00:00.994959,absolute_error,27,sqrt,1,2,best,TPESampler,COMPLETE
1290,1.39690460665991,2025-04-24 21:08:32.096529,2025-04-24 21:08:32.941354,0 days 00:00:00.844825,absolute_error,11,log2,3,8,random,TPESampler,COMPLETE
1291,0.9996424324783258,2025-04-24 21:08:32.878567,2025-04-24 21:08:33.678005,0 days 00:00:00.799438,absolute_error,31,sqrt,2,2,best,TPESampler,COMPLETE
1292,0.6288399089804382,2025-04-24 21:08:33.129013,2025-04-24 21:08:34.025867,0 days 00:00:00.896854,absolute_error,31,sqrt,1,5,best,TPESampler,COMPLETE
1293,1.2168800208288038,2025-04-24 21:08:33.275883,2025-04-24 21:08:34.204350,0 days 00:00:00.928467,absolute_error,27,sqrt,1,2,random,TPESampler,COMPLETE
1294,1.1725983074554982,2025-04-24 21:08:33.966843,2025-04-24 21:08:34.627485,0 days 00:00:00.660642,squared_error,27,sqrt,3,2,random,TPESampler,COMPLETE
1295,1.2076965740491883,2025-04-24 21:08:34.315739,2025-04-24 21:08:35.277108,0 days 00:00:00.961369,absolute_error,35,sqrt,3,2,best,TPESampler,COMPLETE
1296,1.2076965740491883,2025-04-24 21:08:34.472769,2025-04-24 21:08:35.323867,0 days 00:00:00.851098,absolute_error,31,sqrt,3,2,best,TPESampler,COMPLETE
1297,1.1302409528743838,2025-04-24 21:08:34.972175,2025-04-24 21:08:35.761602,0 days 00:00:00.789427,absolute_error,25,sqrt,2,5,best,TPESampler,COMPLETE
1298,0.6112778743973727,2025-04-24 21:08:35.447430,2025-04-24 21:08:36.356265,0 days 00:00:00.908835,absolute_error,29,sqrt,1,2,best,TPESampler,COMPLETE
1299,0.5542791023918845,2025-04-24 21:08:35.503426,2025-04-24 21:08:36.484791,0 days 00:00:00.981365,absolute_error,31,sqrt,1,2,best,TPESampler,COMPLETE
1300,0.9194592887273054,2025-04-24 21:08:36.249366,2025-04-24 21:08:37.181160,0 days 00:00:00.931794,absolute_error,27,sqrt,1,5,best,TPESampler,COMPLETE
1301,0.7063284002837366,2025-04-24 21:08:36.633375,2025-04-24 21:08:37.476162,0 days 00:00:00.842787,absolute_error,34,sqrt,1,5,best,TPESampler,COMPLETE
1302,0.9996424324783258,2025-04-24 21:08:36.726225,2025-04-24 21:08:37.693281,0 days 00:00:00.967056,absolute_error,35,sqrt,2,2,best,TPESampler,COMPLETE
1303,1.2076965740491883,2025-04-24 21:08:37.445612,2025-04-24 21:08:38.395253,0 days 00:00:00.949641,absolute_error,26,sqrt,3,2,best,TPESampler,COMPLETE
1304,0.9509712570148049,2025-04-24 21:08:37.822831,2025-04-24 21:08:38.642338,0 days 00:00:00.819507,absolute_error,24,sqrt,1,9,best,TPESampler,COMPLETE
1305,0.5682124588118789,2025-04-24 21:08:37.967781,2025-04-24 21:08:38.834040,0 days 00:00:00.866259,absolute_error,27,sqrt,1,2,best,TPESampler,COMPLETE
1306,0.6288399089804382,2025-04-24 21:08:38.689357,2025-04-24 21:08:39.357871,0 days 00:00:00.668514,absolute_error,31,sqrt,1,5,best,TPESampler,COMPLETE
1307,0.8465624319698303,2025-04-24 21:08:38.878929,2025-04-24 21:08:39.765531,0 days 00:00:00.886602,absolute_error,33,sqrt,1,2,best,TPESampler,COMPLETE
1308,0.5542791023918845,2025-04-24 21:08:39.039205,2025-04-24 21:08:40.047040,0 days 00:00:01.007835,absolute_error,31,sqrt,1,2,best,TPESampler,COMPLETE
1309,1.3677569516816517,2025-04-24 21:08:39.716065,2025-04-24 21:08:40.527591,0 days 00:00:00.811526,friedman_mse,23,log2,4,12,best,TPESampler,COMPLETE
1310,1.092772879039125,2025-04-24 21:08:40.052386,2025-04-24 21:08:40.934056,0 days 00:00:00.881670,absolute_error,24,sqrt,1,2,best,TPESampler,COMPLETE
1311,0.610896094172543,2025-04-24 21:08:40.339957,2025-04-24 21:08:41.300584,0 days 00:00:00.960627,absolute_error,26,sqrt,1,2,best,TPESampler,COMPLETE
1312,1.2076965740491883,2025-04-24 21:08:40.882667,2025-04-24 21:08:41.624863,0 days 00:00:00.742196,absolute_error,35,sqrt,3,5,best,TPESampler,COMPLETE
1313,0.6755787793007089,2025-04-24 21:08:41.301867,2025-04-24 21:08:42.079216,0 days 00:00:00.777349,absolute_error,35,sqrt,1,5,best,TPESampler,COMPLETE
1314,0.8619925758252567,2025-04-24 21:08:41.588835,2025-04-24 21:08:42.443627,0 days 00:00:00.854792,squared_error,30,log2,3,4,best,TPESampler,COMPLETE
1315,1.2076965740491883,2025-04-24 21:08:41.881378,2025-04-24 21:08:42.794514,0 days 00:00:00.913136,absolute_error,29,sqrt,3,5,best,TPESampler,COMPLETE
1316,1.3625908614134468,2025-04-24 21:08:42.393828,2025-04-24 21:08:43.122003,0 days 00:00:00.728175,squared_error,20,log2,4,17,random,TPESampler,COMPLETE
1317,1.2076965740491883,2025-04-24 21:08:42.709623,2025-04-24 21:08:43.623345,0 days 00:00:00.913722,absolute_error,28,sqrt,3,2,best,TPESampler,COMPLETE
1318,0.5872420994323145,2025-04-24 21:08:43.125754,2025-04-24 21:08:43.844285,0 days 00:00:00.718531,absolute_error,35,sqrt,1,2,best,TPESampler,COMPLETE
1319,1.3378011980521618,2025-04-24 21:08:43.385300,2025-04-24 21:08:44.146075,0 days 00:00:00.760775,absolute_error,31,sqrt,2,11,random,TPESampler,COMPLETE
1320,0.9996424324783258,2025-04-24 21:08:43.893058,2025-04-24 21:08:44.706604,0 days 00:00:00.813546,absolute_error,26,sqrt,2,2,best,TPESampler,COMPLETE
1321,0.6638847036354089,2025-04-24 21:08:44.175662,2025-04-24 21:08:45.217855,0 days 00:00:01.042193,squared_error,34,sqrt,1,2,best,TPESampler,COMPLETE
1322,1.414267416587207,2025-04-24 21:08:44.608137,2025-04-24 21:08:45.476577,0 days 00:00:00.868440,absolute_error,32,sqrt,6,4,best,TPESampler,COMPLETE
1323,1.0498076960778187,2025-04-24 21:08:44.981404,2025-04-24 21:08:45.694163,0 days 00:00:00.712759,friedman_mse,26,sqrt,3,2,best,TPESampler,COMPLETE
1324,0.9996424324783258,2025-04-24 21:08:45.496234,2025-04-24 21:08:46.269841,0 days 00:00:00.773607,absolute_error,30,sqrt,2,2,best,TPESampler,COMPLETE
1325,0.9194592887273054,2025-04-24 21:08:45.749909,2025-04-24 21:08:46.808892,0 days 00:00:01.058983,absolute_error,27,sqrt,1,5,best,TPESampler,COMPLETE
1326,0.616367830067441,2025-04-24 21:08:45.924125,2025-04-24 21:08:46.797790,0 days 00:00:00.873665,friedman_mse,34,sqrt,1,3,best,TPESampler,COMPLETE
1327,0.6112778743973727,2025-04-24 21:08:46.550345,2025-04-24 21:08:47.326109,0 days 00:00:00.775764,absolute_error,29,sqrt,1,2,best,TPESampler,COMPLETE
1328,0.6919576112851691,2025-04-24 21:08:47.002400,2025-04-24 21:08:48.026462,0 days 00:00:01.024062,squared_error,28,sqrt,1,2,best,TPESampler,COMPLETE
1329,0.555832913159586,2025-04-24 21:08:47.047491,2025-04-24 21:08:48.031201,0 days 00:00:00.983710,absolute_error,32,sqrt,1,2,best,TPESampler,COMPLETE
1330,1.359571383264774,2025-04-24 21:08:47.598360,2025-04-24 21:08:48.338835,0 days 00:00:00.740475,squared_error,33,sqrt,9,17,best,TPESampler,COMPLETE
1331,1.1302409528743838,2025-04-24 21:08:48.300933,2025-04-24 21:08:49.301810,0 days 00:00:01.000877,absolute_error,30,sqrt,2,5,best,TPESampler,COMPLETE
1332,0.8488317133487976,2025-04-24 21:08:48.337224,2025-04-24 21:08:49.307486,0 days 00:00:00.970262,friedman_mse,13,log2,1,11,best,TPESampler,COMPLETE
1333,0.555832913159586,2025-04-24 21:08:49.035889,2025-04-24 21:08:49.793364,0 days 00:00:00.757475,absolute_error,32,sqrt,1,2,best,TPESampler,COMPLETE
1334,1.3419437849162803,2025-04-24 21:08:49.521155,2025-04-24 21:08:50.337039,0 days 00:00:00.815884,absolute_error,14,sqrt,6,8,random,TPESampler,COMPLETE
1335,0.9996424324783258,2025-04-24 21:08:49.581152,2025-04-24 21:08:50.544741,0 days 00:00:00.963589,absolute_error,32,sqrt,2,2,best,TPESampler,COMPLETE
1336,0.6540510953786189,2025-04-24 21:08:50.076755,2025-04-24 21:08:51.118922,0 days 00:00:01.042167,absolute_error,29,sqrt,1,5,best,TPESampler,COMPLETE
1337,1.4278629024452307,2025-04-24 21:08:50.602307,2025-04-24 21:08:51.369819,0 days 00:00:00.767512,absolute_error,9,sqrt,5,12,best,TPESampler,COMPLETE
1338,0.5872420994323145,2025-04-24 21:08:50.903809,2025-04-24 21:08:51.724525,0 days 00:00:00.820716,absolute_error,35,sqrt,1,2,best,TPESampler,COMPLETE
1339,0.7033595174659969,2025-04-24 21:08:51.383458,2025-04-24 21:08:52.297422,0 days 00:00:00.913964,absolute_error,28,sqrt,1,5,best,TPESampler,COMPLETE
1340,0.6288399089804382,2025-04-24 21:08:51.581916,2025-04-24 21:08:52.477572,0 days 00:00:00.895656,absolute_error,31,sqrt,1,5,best,TPESampler,COMPLETE
1341,1.2076965740491883,2025-04-24 21:08:51.945036,2025-04-24 21:08:52.788368,0 days 00:00:00.843332,absolute_error,32,sqrt,3,2,best,TPESampler,COMPLETE
1342,0.6112778743973727,2025-04-24 21:08:52.586795,2025-04-24 21:08:53.367998,0 days 00:00:00.781203,absolute_error,29,sqrt,1,2,best,TPESampler,COMPLETE
1343,0.9610014723049441,2025-04-24 21:08:52.672841,2025-04-24 21:08:53.519957,0 days 00:00:00.847116,absolute_error,34,log2,2,2,best,TPESampler,COMPLETE
1344,0.7495346713750386,2025-04-24 21:08:53.048852,2025-04-24 21:08:53.879905,0 days 00:00:00.831053,absolute_error,30,sqrt,1,2,best,TPESampler,COMPLETE
1345,1.2076965740491883,2025-04-24 21:08:53.618154,2025-04-24 21:08:54.469990,0 days 00:00:00.851836,absolute_error,30,sqrt,3,2,best,TPESampler,COMPLETE
1346,1.017590684050681,2025-04-24 21:08:53.803514,2025-04-24 21:08:54.653660,0 days 00:00:00.850146,absolute_error,22,sqrt,1,5,best,TPESampler,COMPLETE
1347,0.5682124588118789,2025-04-24 21:08:54.128751,2025-04-24 21:08:55.407837,0 days 00:00:01.279086,absolute_error,27,sqrt,1,2,best,TPESampler,COMPLETE
1348,1.2076965740491883,2025-04-24 21:08:54.791453,2025-04-24 21:08:55.738331,0 days 00:00:00.946878,absolute_error,32,sqrt,3,5,best,TPESampler,COMPLETE
1349,0.6288399089804382,2025-04-24 21:08:54.853531,2025-04-24 21:08:55.749229,0 days 00:00:00.895698,absolute_error,31,sqrt,1,5,best,TPESampler,COMPLETE
1350,1.3625908614134468,2025-04-24 21:08:55.698875,2025-04-24 21:08:56.374207,0 days 00:00:00.675332,friedman_mse,35,log2,5,4,random,TPESampler,COMPLETE
1351,0.8465624319698303,2025-04-24 21:08:56.009496,2025-04-24 21:08:56.773763,0 days 00:00:00.764267,absolute_error,33,sqrt,1,2,best,TPESampler,COMPLETE
1352,0.6755787793007089,2025-04-24 21:08:56.046546,2025-04-24 21:08:57.119530,0 days 00:00:01.072984,absolute_error,35,sqrt,1,5,best,TPESampler,COMPLETE
1353,1.2076965740491883,2025-04-24 21:08:56.681332,2025-04-24 21:08:57.528174,0 days 00:00:00.846842,absolute_error,26,sqrt,3,2,best,TPESampler,COMPLETE
1354,0.7495346713750386,2025-04-24 21:08:57.078790,2025-04-24 21:08:57.875348,0 days 00:00:00.796558,absolute_error,30,sqrt,1,2,best,TPESampler,COMPLETE
1355,0.7308497541973092,2025-04-24 21:08:57.496222,2025-04-24 21:08:58.317304,0 days 00:00:00.821082,absolute_error,31,log2,1,5,best,TPESampler,COMPLETE
1356,0.5682124588118789,2025-04-24 21:08:57.835863,2025-04-24 21:08:58.720266,0 days 00:00:00.884403,absolute_error,27,sqrt,1,2,best,TPESampler,COMPLETE
1357,0.7489351469834852,2025-04-24 21:08:58.141447,2025-04-24 21:08:59.064827,0 days 00:00:00.923380,absolute_error,35,sqrt,1,10,best,TPESampler,COMPLETE
1358,1.2076965740491883,2025-04-24 21:08:58.605560,2025-04-24 21:08:59.392096,0 days 00:00:00.786536,absolute_error,29,sqrt,3,5,best,TPESampler,COMPLETE
1359,0.6755787793007089,2025-04-24 21:08:59.072001,2025-04-24 21:08:59.873331,0 days 00:00:00.801330,absolute_error,35,sqrt,1,5,best,TPESampler,COMPLETE
1360,0.7495346713750386,2025-04-24 21:08:59.347299,2025-04-24 21:09:00.284953,0 days 00:00:00.937654,absolute_error,30,sqrt,1,2,best,TPESampler,COMPLETE
1361,1.2076965740491883,2025-04-24 21:08:59.711318,2025-04-24 21:09:00.661597,0 days 00:00:00.950279,absolute_error,30,sqrt,3,2,best,TPESampler,COMPLETE
1362,0.7495346713750386,2025-04-24 21:09:00.178523,2025-04-24 21:09:01.324217,0 days 00:00:01.145694,absolute_error,30,sqrt,1,2,best,TPESampler,COMPLETE
1363,1.2076965740491883,2025-04-24 21:09:00.660260,2025-04-24 21:09:01.590392,0 days 00:00:00.930132,absolute_error,35,sqrt,3,2,best,TPESampler,COMPLETE
1364,1.0313227598578136,2025-04-24 21:09:01.082462,2025-04-24 21:09:01.912274,0 days 00:00:00.829812,absolute_error,23,sqrt,1,5,best,TPESampler,COMPLETE
1365,0.5872420994323145,2025-04-24 21:09:01.607295,2025-04-24 21:09:02.474921,0 days 00:00:00.867626,absolute_error,35,sqrt,1,2,best,TPESampler,COMPLETE
1366,1.0239469245301904,2025-04-24 21:09:01.805031,2025-04-24 21:09:02.648816,0 days 00:00:00.843785,absolute_error,4,log2,1,11,best,TPESampler,COMPLETE
1367,1.0099953635558898,2025-04-24 21:09:02.143221,2025-04-24 21:09:03.000737,0 days 00:00:00.857516,absolute_error,23,sqrt,1,2,best,TPESampler,COMPLETE
1368,0.7033595174659969,2025-04-24 21:09:02.720329,2025-04-24 21:09:03.580019,0 days 00:00:00.859690,absolute_error,28,sqrt,1,5,best,TPESampler,COMPLETE
1369,1.1302409528743838,2025-04-24 21:09:02.933276,2025-04-24 21:09:03.846116,0 days 00:00:00.912840,absolute_error,29,sqrt,2,5,best,TPESampler,COMPLETE
1370,0.9312073070199461,2025-04-24 21:09:03.282375,2025-04-24 21:09:04.418112,0 days 00:00:01.135737,absolute_error,30,sqrt,1,5,best,TPESampler,COMPLETE
1371,0.9996424324783258,2025-04-24 21:09:03.850849,2025-04-24 21:09:04.744204,0 days 00:00:00.893355,absolute_error,28,sqrt,2,2,best,TPESampler,COMPLETE
1372,0.555832913159586,2025-04-24 21:09:04.144829,2025-04-24 21:09:05.144564,0 days 00:00:00.999735,absolute_error,32,sqrt,1,2,best,TPESampler,COMPLETE
1373,0.5872420994323145,2025-04-24 21:09:04.696760,2025-04-24 21:09:05.425156,0 days 00:00:00.728396,absolute_error,35,sqrt,1,2,best,TPESampler,COMPLETE
1374,0.5713387065834993,2025-04-24 21:09:05.107758,2025-04-24 21:09:06.033036,0 days 00:00:00.925278,absolute_error,25,sqrt,1,2,best,TPESampler,COMPLETE
1375,1.2308277058861974,2025-04-24 21:09:05.465065,2025-04-24 21:09:06.391340,0 days 00:00:00.926275,friedman_mse,9,sqrt,4,11,best,TPESampler,COMPLETE
1376,1.4246109891092213,2025-04-24 21:09:05.758658,2025-04-24 21:09:06.955971,0 days 00:00:01.197313,absolute_error,9,sqrt,2,6,best,TPESampler,COMPLETE
1377,0.6112778743973727,2025-04-24 21:09:06.358551,2025-04-24 21:09:07.346031,0 days 00:00:00.987480,absolute_error,29,sqrt,1,2,best,TPESampler,COMPLETE
1378,1.2076965740491883,2025-04-24 21:09:06.735775,2025-04-24 21:09:07.960109,0 days 00:00:01.224334,absolute_error,28,sqrt,3,2,best,TPESampler,COMPLETE
1379,1.2076965740491883,2025-04-24 21:09:07.300220,2025-04-24 21:09:08.157066,0 days 00:00:00.856846,absolute_error,31,sqrt,3,2,best,TPESampler,COMPLETE
1380,0.7084730562241784,2025-04-24 21:09:07.695925,2025-04-24 21:09:08.437422,0 days 00:00:00.741497,absolute_error,32,sqrt,1,5,best,TPESampler,COMPLETE
1381,1.0298965263073634,2025-04-24 21:09:08.265734,2025-04-24 21:09:09.065503,0 days 00:00:00.799769,squared_error,30,sqrt,2,5,best,TPESampler,COMPLETE
1382,1.3187513250101375,2025-04-24 21:09:08.389107,2025-04-24 21:09:09.416644,0 days 00:00:01.027537,absolute_error,31,sqrt,2,2,random,TPESampler,COMPLETE
1383,0.5542791023918845,2025-04-24 21:09:08.707577,2025-04-24 21:09:09.630358,0 days 00:00:00.922781,absolute_error,31,sqrt,1,2,best,TPESampler,COMPLETE
1384,0.5872420994323145,2025-04-24 21:09:09.362996,2025-04-24 21:09:10.191801,0 days 00:00:00.828805,absolute_error,35,sqrt,1,2,best,TPESampler,COMPLETE
1385,1.2076965740491883,2025-04-24 21:09:09.751190,2025-04-24 21:09:10.559865,0 days 00:00:00.808675,absolute_error,35,sqrt,3,2,best,TPESampler,COMPLETE
1386,0.6540510953786189,2025-04-24 21:09:09.940945,2025-04-24 21:09:10.879713,0 days 00:00:00.938768,absolute_error,29,sqrt,1,5,best,TPESampler,COMPLETE
1387,0.610896094172543,2025-04-24 21:09:10.469838,2025-04-24 21:09:11.272061,0 days 00:00:00.802223,absolute_error,26,sqrt,1,2,best,TPESampler,COMPLETE
1388,1.2076965740491883,2025-04-24 21:09:10.799473,2025-04-24 21:09:11.628542,0 days 00:00:00.829069,absolute_error,24,sqrt,3,5,best,TPESampler,COMPLETE
1389,0.7535887259405779,2025-04-24 21:09:11.149726,2025-04-24 21:09:11.985677,0 days 00:00:00.835951,friedman_mse,25,sqrt,1,6,best,TPESampler,COMPLETE
1390,0.9996424324783258,2025-04-24 21:09:11.634431,2025-04-24 21:09:12.576472,0 days 00:00:00.942041,absolute_error,28,sqrt,2,2,best,TPESampler,COMPLETE
1391,1.2076965740491883,2025-04-24 21:09:11.907463,2025-04-24 21:09:12.741589,0 days 00:00:00.834126,absolute_error,32,sqrt,3,5,best,TPESampler,COMPLETE
1392,0.6112778743973727,2025-04-24 21:09:12.230388,2025-04-24 21:09:13.080743,0 days 00:00:00.850355,absolute_error,29,sqrt,1,2,best,TPESampler,COMPLETE
1393,1.1302409528743838,2025-04-24 21:09:12.813980,2025-04-24 21:09:13.692232,0 days 00:00:00.878252,absolute_error,30,sqrt,2,5,best,TPESampler,COMPLETE
1394,1.1302409528743838,2025-04-24 21:09:13.043479,2025-04-24 21:09:13.966022,0 days 00:00:00.922543,absolute_error,30,sqrt,2,5,best,TPESampler,COMPLETE
1395,0.6698865826477293,2025-04-24 21:09:13.315823,2025-04-24 21:09:14.115472,0 days 00:00:00.799649,friedman_mse,30,sqrt,1,2,best,TPESampler,COMPLETE
1396,1.3848069511729402,2025-04-24 21:09:13.925462,2025-04-24 21:09:14.778221,0 days 00:00:00.852759,absolute_error,15,log2,1,13,random,TPESampler,COMPLETE
1397,1.3318717022348503,2025-04-24 21:09:14.260521,2025-04-24 21:09:14.900257,0 days 00:00:00.639736,squared_error,4,sqrt,9,14,random,TPESampler,COMPLETE
1398,0.8161486427713086,2025-04-24 21:09:14.487509,2025-04-24 21:09:15.293087,0 days 00:00:00.805578,absolute_error,26,sqrt,1,8,random,TPESampler,COMPLETE
1399,0.9996424324783258,2025-04-24 21:09:15.090650,2025-04-24 21:09:16.049663,0 days 00:00:00.959013,absolute_error,35,sqrt,2,2,best,TPESampler,COMPLETE
1400,0.5872420994323145,2025-04-24 21:09:15.149897,2025-04-24 21:09:16.081364,0 days 00:00:00.931467,absolute_error,35,sqrt,1,2,best,TPESampler,COMPLETE
1401,1.4148597056909755,2025-04-24 21:09:15.481792,2025-04-24 21:09:16.315465,0 days 00:00:00.833673,absolute_error,32,sqrt,10,19,random,TPESampler,COMPLETE
1402,0.5542791023918845,2025-04-24 21:09:16.274013,2025-04-24 21:09:17.034199,0 days 00:00:00.760186,absolute_error,31,sqrt,1,2,best,TPESampler,COMPLETE
1403,0.9996424324783258,2025-04-24 21:09:16.312834,2025-04-24 21:09:17.452294,0 days 00:00:01.139460,absolute_error,28,sqrt,2,2,best,TPESampler,COMPLETE
1404,1.0131068116827324,2025-04-24 21:09:16.536262,2025-04-24 21:09:17.622425,0 days 00:00:01.086163,absolute_error,28,log2,3,6,best,TPESampler,COMPLETE
1405,0.6812608722646134,2025-04-24 21:09:17.385863,2025-04-24 21:09:18.183755,0 days 00:00:00.797892,absolute_error,29,log2,1,2,best,TPESampler,COMPLETE
1406,1.2268295614326363,2025-04-24 21:09:17.688534,2025-04-24 21:09:18.607662,0 days 00:00:00.919128,friedman_mse,34,log2,1,14,random,TPESampler,COMPLETE
1407,0.856297005325639,2025-04-24 21:09:17.847991,2025-04-24 21:09:18.823344,0 days 00:00:00.975353,absolute_error,28,sqrt,1,2,best,TPESampler,COMPLETE
1408,1.2731240702210205,2025-04-24 21:09:18.532239,2025-04-24 21:09:19.385034,0 days 00:00:00.852795,friedman_mse,17,sqrt,5,18,random,TPESampler,COMPLETE
1409,0.7084730562241784,2025-04-24 21:09:18.899153,2025-04-24 21:09:19.709336,0 days 00:00:00.810183,absolute_error,32,sqrt,1,5,best,TPESampler,COMPLETE
1410,0.5542791023918845,2025-04-24 21:09:19.145166,2025-04-24 21:09:19.882512,0 days 00:00:00.737346,absolute_error,31,sqrt,1,2,best,TPESampler,COMPLETE
1411,1.1302409528743838,2025-04-24 21:09:19.655982,2025-04-24 21:09:20.500812,0 days 00:00:00.844830,absolute_error,27,sqrt,2,5,best,TPESampler,COMPLETE
1412,1.3567965243581712,2025-04-24 21:09:19.968359,2025-04-24 21:09:20.809511,0 days 00:00:00.841152,squared_error,7,log2,1,15,random,TPESampler,COMPLETE
1413,1.2987477158496454,2025-04-24 21:09:20.124994,2025-04-24 21:09:21.040944,0 days 00:00:00.915950,friedman_mse,7,sqrt,4,3,best,TPESampler,COMPLETE
1414,1.1302409528743838,2025-04-24 21:09:20.755614,2025-04-24 21:09:21.413606,0 days 00:00:00.657992,absolute_error,35,sqrt,2,5,best,TPESampler,COMPLETE
1415,1.4138971746431086,2025-04-24 21:09:21.120016,2025-04-24 21:09:21.978309,0 days 00:00:00.858293,absolute_error,33,log2,4,12,best,TPESampler,COMPLETE
1416,0.9194592887273054,2025-04-24 21:09:21.292578,2025-04-24 21:09:22.122002,0 days 00:00:00.829424,absolute_error,27,sqrt,1,5,best,TPESampler,COMPLETE
1417,0.6540510953786189,2025-04-24 21:09:21.633952,2025-04-24 21:09:22.437745,0 days 00:00:00.803793,absolute_error,29,sqrt,1,5,best,TPESampler,COMPLETE
1418,0.7495346713750386,2025-04-24 21:09:22.268916,2025-04-24 21:09:23.253002,0 days 00:00:00.984086,absolute_error,30,sqrt,1,2,best,TPESampler,COMPLETE
1419,0.9996424324783258,2025-04-24 21:09:22.337560,2025-04-24 21:09:23.347410,0 days 00:00:01.009850,absolute_error,24,sqrt,2,2,best,TPESampler,COMPLETE
1420,0.6112778743973727,2025-04-24 21:09:22.929322,2025-04-24 21:09:23.678572,0 days 00:00:00.749250,absolute_error,29,sqrt,1,2,best,TPESampler,COMPLETE
1421,1.2076965740491883,2025-04-24 21:09:23.577695,2025-04-24 21:09:24.462031,0 days 00:00:00.884336,absolute_error,31,sqrt,3,2,best,TPESampler,COMPLETE
1422,0.6288399089804382,2025-04-24 21:09:23.641329,2025-04-24 21:09:24.685882,0 days 00:00:01.044553,absolute_error,31,sqrt,1,5,best,TPESampler,COMPLETE
1423,0.6964980049699784,2025-04-24 21:09:23.930143,2025-04-24 21:09:24.827721,0 days 00:00:00.897578,absolute_error,33,sqrt,1,2,random,TPESampler,COMPLETE
1424,0.7495346713750386,2025-04-24 21:09:24.734886,2025-04-24 21:09:25.463241,0 days 00:00:00.728355,absolute_error,30,sqrt,1,2,best,TPESampler,COMPLETE
1425,0.555832913159586,2025-04-24 21:09:24.957356,2025-04-24 21:09:25.836645,0 days 00:00:00.879289,absolute_error,32,sqrt,1,2,best,TPESampler,COMPLETE
1426,1.2076965740491883,2025-04-24 21:09:25.300605,2025-04-24 21:09:26.294457,0 days 00:00:00.993852,absolute_error,29,sqrt,3,2,best,TPESampler,COMPLETE
