number,value,datetime_start,datetime_complete,duration,params_criterion,params_max_depth,params_max_features,params_min_samples_leaf,params_min_samples_split,params_splitter,system_attrs_auto:sampler,state
2275,1.335711393574172,2025-04-24 21:15:34.310981,2025-04-24 21:15:35.327661,0 days 00:00:01.016680,absolute_error,29,sqrt,3,5,random,TPESampler,COMPLETE
2276,1.3365908817218308,2025-04-24 21:15:34.396277,2025-04-24 21:15:35.826891,0 days 00:00:01.430614,absolute_error,25,sqrt,3,10,random,TPESampler,COMPLETE
2277,0.9860869366393894,2025-04-24 21:15:35.282465,2025-04-24 21:15:36.256795,0 days 00:00:00.974330,absolute_error,30,sqrt,1,2,random,TPESampler,COMPLETE
2278,0.6750005427680865,2025-04-24 21:15:35.686434,2025-04-24 21:15:36.703925,0 days 00:00:01.017491,absolute_error,30,sqrt,1,5,random,TPESampler,COMPLETE
2279,1.335711393574172,2025-04-24 21:15:36.096847,2025-04-24 21:15:37.145388,0 days 00:00:01.048541,absolute_error,35,sqrt,3,2,random,TPESampler,COMPLETE
2280,0.9815969962935377,2025-04-24 21:15:36.653830,2025-04-24 21:15:37.609111,0 days 00:00:00.955281,squared_error,32,sqrt,1,2,random,TPESampler,COMPLETE
2281,1.2741490090538539,2025-04-24 21:15:37.015408,2025-04-24 21:15:38.089633,0 days 00:00:01.074225,absolute_error,28,sqrt,1,2,random,TPESampler,COMPLETE
2282,0.9860869366393894,2025-04-24 21:15:37.526014,2025-04-24 21:15:38.686045,0 days 00:00:01.160031,absolute_error,30,sqrt,1,2,random,TPESampler,COMPLETE
2283,1.005467895307365,2025-04-24 21:15:38.085045,2025-04-24 21:15:39.059588,0 days 00:00:00.974543,absolute_error,31,sqrt,1,2,random,TPESampler,COMPLETE
2284,1.005467895307365,2025-04-24 21:15:38.424117,2025-04-24 21:15:39.474474,0 days 00:00:01.050357,absolute_error,31,sqrt,1,2,random,TPESampler,COMPLETE
2285,1.335711393574172,2025-04-24 21:15:39.016301,2025-04-24 21:15:40.057435,0 days 00:00:01.041134,absolute_error,30,sqrt,3,5,random,TPESampler,COMPLETE
2286,0.9815969962935377,2025-04-24 21:15:39.472898,2025-04-24 21:15:40.373438,0 days 00:00:00.900540,friedman_mse,32,sqrt,1,2,random,TPESampler,COMPLETE
2287,1.114909371722551,2025-04-24 21:15:39.794542,2025-04-24 21:15:40.763740,0 days 00:00:00.969198,absolute_error,35,sqrt,1,2,random,TPESampler,COMPLETE
2288,1.4169796832743113,2025-04-24 21:15:40.396717,2025-04-24 21:15:41.484440,0 days 00:00:01.087723,absolute_error,2,sqrt,9,20,random,TPESampler,COMPLETE
2289,1.2119861239647682,2025-04-24 21:15:40.754672,2025-04-24 21:15:41.685875,0 days 00:00:00.931203,absolute_error,29,sqrt,1,2,random,TPESampler,COMPLETE
2290,1.005467895307365,2025-04-24 21:15:41.131831,2025-04-24 21:15:41.974928,0 days 00:00:00.843097,absolute_error,31,sqrt,1,2,random,TPESampler,COMPLETE
2291,0.6785347225984457,2025-04-24 21:15:41.875369,2025-04-24 21:15:42.705516,0 days 00:00:00.830147,absolute_error,35,sqrt,1,5,random,TPESampler,COMPLETE
2292,1.335711393574172,2025-04-24 21:15:41.941429,2025-04-24 21:15:43.132815,0 days 00:00:01.191386,absolute_error,26,sqrt,3,2,random,TPESampler,COMPLETE
2293,1.3182621955384042,2025-04-24 21:15:42.278306,2025-04-24 21:15:43.325226,0 days 00:00:01.046920,absolute_error,27,sqrt,2,5,random,TPESampler,COMPLETE
2294,0.7464085682144045,2025-04-24 21:15:43.052745,2025-04-24 21:15:43.822816,0 days 00:00:00.770071,absolute_error,28,sqrt,1,5,random,TPESampler,COMPLETE
2295,1.335711393574172,2025-04-24 21:15:43.468054,2025-04-24 21:15:44.486048,0 days 00:00:01.017994,absolute_error,31,sqrt,3,5,random,TPESampler,COMPLETE
2296,1.114909371722551,2025-04-24 21:15:43.658985,2025-04-24 21:15:44.671938,0 days 00:00:01.012953,absolute_error,35,sqrt,1,2,random,TPESampler,COMPLETE
2297,1.335711393574172,2025-04-24 21:15:44.130475,2025-04-24 21:15:45.009924,0 days 00:00:00.879449,absolute_error,30,sqrt,3,2,random,TPESampler,COMPLETE
2298,0.6750005427680865,2025-04-24 21:15:44.879576,2025-04-24 21:15:45.851712,0 days 00:00:00.972136,absolute_error,30,sqrt,1,5,random,TPESampler,COMPLETE
2299,1.3419437849162803,2025-04-24 21:15:44.959606,2025-04-24 21:15:46.180154,0 days 00:00:01.220548,absolute_error,25,sqrt,6,2,random,TPESampler,COMPLETE
2300,1.1924180531178654,2025-04-24 21:15:45.344509,2025-04-24 21:15:46.709284,0 days 00:00:01.364775,absolute_error,26,sqrt,1,2,random,TPESampler,COMPLETE
2301,1.114909371722551,2025-04-24 21:15:46.166130,2025-04-24 21:15:47.082724,0 days 00:00:00.916594,absolute_error,35,sqrt,1,2,random,TPESampler,COMPLETE
2302,1.3830465488541124,2025-04-24 21:15:46.464940,2025-04-24 21:15:47.372119,0 days 00:00:00.907179,absolute_error,24,log2,1,2,random,TPESampler,COMPLETE
2303,1.0297478661477455,2025-04-24 21:15:47.081295,2025-04-24 21:15:48.079030,0 days 00:00:00.997735,absolute_error,32,sqrt,1,5,random,TPESampler,COMPLETE
2304,1.005467895307365,2025-04-24 21:15:47.340386,2025-04-24 21:15:48.349799,0 days 00:00:01.009413,absolute_error,31,sqrt,1,2,random,TPESampler,COMPLETE
2305,1.335711393574172,2025-04-24 21:15:47.721078,2025-04-24 21:15:48.480785,0 days 00:00:00.759707,absolute_error,35,sqrt,3,2,random,TPESampler,COMPLETE
2306,1.2119861239647682,2025-04-24 21:15:48.394466,2025-04-24 21:15:49.491982,0 days 00:00:01.097516,absolute_error,29,sqrt,1,2,random,TPESampler,COMPLETE
2307,1.005467895307365,2025-04-24 21:15:48.636825,2025-04-24 21:15:49.808429,0 days 00:00:01.171604,absolute_error,31,sqrt,1,2,random,TPESampler,COMPLETE
2308,1.335711393574172,2025-04-24 21:15:48.846129,2025-04-24 21:15:50.062001,0 days 00:00:01.215872,absolute_error,30,sqrt,3,2,random,TPESampler,COMPLETE
2309,1.2482047264307685,2025-04-24 21:15:49.747529,2025-04-24 21:15:50.609002,0 days 00:00:00.861473,absolute_error,24,sqrt,1,5,random,TPESampler,COMPLETE
2310,0.6785347225984457,2025-04-24 21:15:50.172968,2025-04-24 21:15:51.348608,0 days 00:00:01.175640,absolute_error,35,sqrt,1,5,random,TPESampler,COMPLETE
2311,1.3182621955384042,2025-04-24 21:15:50.408808,2025-04-24 21:15:51.792242,0 days 00:00:01.383434,absolute_error,29,sqrt,2,5,random,TPESampler,COMPLETE
2312,0.9860869366393894,2025-04-24 21:15:51.007659,2025-04-24 21:15:52.267556,0 days 00:00:01.259897,absolute_error,30,sqrt,1,2,random,TPESampler,COMPLETE
2313,1.335711393574172,2025-04-24 21:15:51.667990,2025-04-24 21:15:52.532522,0 days 00:00:00.864532,absolute_error,35,sqrt,3,4,random,TPESampler,COMPLETE
2314,1.335711393574172,2025-04-24 21:15:52.197371,2025-04-24 21:15:53.227986,0 days 00:00:01.030615,absolute_error,35,sqrt,3,2,random,TPESampler,COMPLETE
2315,1.3182621955384042,2025-04-24 21:15:52.611225,2025-04-24 21:15:53.662412,0 days 00:00:01.051187,absolute_error,31,sqrt,2,5,random,TPESampler,COMPLETE
2316,0.6234752034897817,2025-04-24 21:15:52.795249,2025-04-24 21:15:53.878359,0 days 00:00:01.083110,absolute_error,34,sqrt,1,2,random,TPESampler,COMPLETE
2317,1.114909371722551,2025-04-24 21:15:53.595623,2025-04-24 21:15:54.655529,0 days 00:00:01.059906,absolute_error,35,sqrt,1,2,random,TPESampler,COMPLETE
2318,0.6750005427680865,2025-04-24 21:15:53.950989,2025-04-24 21:15:54.879010,0 days 00:00:00.928021,absolute_error,30,sqrt,1,5,random,TPESampler,COMPLETE
2319,0.6750005427680865,2025-04-24 21:15:54.198726,2025-04-24 21:15:55.181979,0 days 00:00:00.983253,absolute_error,30,sqrt,1,5,random,TPESampler,COMPLETE
2320,1.2119861239647682,2025-04-24 21:15:54.968678,2025-04-24 21:15:56.209263,0 days 00:00:01.240585,absolute_error,29,sqrt,1,2,random,TPESampler,COMPLETE
2321,1.33707615296096,2025-04-24 21:15:55.150624,2025-04-24 21:15:56.352636,0 days 00:00:01.202012,absolute_error,17,sqrt,4,3,random,TPESampler,COMPLETE
2322,1.1763447383239396,2025-04-24 21:15:55.931471,2025-04-24 21:15:56.702186,0 days 00:00:00.770715,absolute_error,25,sqrt,1,2,random,TPESampler,COMPLETE
2323,1.1762267009527727,2025-04-24 21:15:56.580783,2025-04-24 21:15:57.725158,0 days 00:00:01.144375,squared_error,24,sqrt,2,3,random,TPESampler,COMPLETE
2324,1.335711393574172,2025-04-24 21:15:56.646139,2025-04-24 21:15:57.868790,0 days 00:00:01.222651,absolute_error,21,sqrt,3,6,random,TPESampler,COMPLETE
2325,1.335711393574172,2025-04-24 21:15:57.358571,2025-04-24 21:15:58.250355,0 days 00:00:00.891784,absolute_error,35,sqrt,3,5,random,TPESampler,COMPLETE
2326,1.335711393574172,2025-04-24 21:15:58.209282,2025-04-24 21:15:59.184427,0 days 00:00:00.975145,absolute_error,29,sqrt,3,2,random,TPESampler,COMPLETE
2327,0.6785347225984457,2025-04-24 21:15:58.258958,2025-04-24 21:15:59.727962,0 days 00:00:01.469004,absolute_error,35,sqrt,1,5,random,TPESampler,COMPLETE
2328,0.6750005427680865,2025-04-24 21:15:58.510529,2025-04-24 21:15:59.819273,0 days 00:00:01.308744,absolute_error,30,sqrt,1,5,random,TPESampler,COMPLETE
2329,1.3182621955384042,2025-04-24 21:15:59.557285,2025-04-24 21:16:00.487618,0 days 00:00:00.930333,absolute_error,35,sqrt,2,5,random,TPESampler,COMPLETE
2330,0.9860869366393894,2025-04-24 21:15:59.960705,2025-04-24 21:16:01.198986,0 days 00:00:01.238281,absolute_error,30,sqrt,1,2,random,TPESampler,COMPLETE
2331,1.114909371722551,2025-04-24 21:16:00.103846,2025-04-24 21:16:01.276606,0 days 00:00:01.172760,absolute_error,35,sqrt,1,2,random,TPESampler,COMPLETE
2332,1.4138971746431086,2025-04-24 21:16:00.810903,2025-04-24 21:16:01.654091,0 days 00:00:00.843188,absolute_error,1,log2,5,19,best,TPESampler,COMPLETE
2333,1.335711393574172,2025-04-24 21:16:01.552142,2025-04-24 21:16:02.594127,0 days 00:00:01.041985,absolute_error,28,sqrt,3,5,random,TPESampler,COMPLETE
2334,1.0458376878339173,2025-04-24 21:16:01.615153,2025-04-24 21:16:03.104747,0 days 00:00:01.489594,absolute_error,24,sqrt,1,2,random,TPESampler,COMPLETE
2335,1.335711393574172,2025-04-24 21:16:01.983943,2025-04-24 21:16:02.933495,0 days 00:00:00.949552,absolute_error,28,sqrt,3,2,random,TPESampler,COMPLETE
2336,1.114909371722551,2025-04-24 21:16:02.852619,2025-04-24 21:16:03.756246,0 days 00:00:00.903627,absolute_error,35,sqrt,1,2,random,TPESampler,COMPLETE
2337,1.1763447383239396,2025-04-24 21:16:03.288362,2025-04-24 21:16:04.257262,0 days 00:00:00.968900,absolute_error,25,sqrt,1,2,random,TPESampler,COMPLETE
2338,1.0037551612433278,2025-04-24 21:16:03.478628,2025-04-24 21:16:04.558241,0 days 00:00:01.079613,squared_error,22,sqrt,1,2,random,TPESampler,COMPLETE
2339,1.3187513250101375,2025-04-24 21:16:04.202156,2025-04-24 21:16:05.188691,0 days 00:00:00.986535,absolute_error,30,sqrt,2,2,random,TPESampler,COMPLETE
2340,0.9860869366393894,2025-04-24 21:16:04.551859,2025-04-24 21:16:05.453072,0 days 00:00:00.901213,absolute_error,30,sqrt,1,2,random,TPESampler,COMPLETE
2341,0.9860869366393894,2025-04-24 21:16:04.902362,2025-04-24 21:16:06.105839,0 days 00:00:01.203477,absolute_error,30,sqrt,1,2,random,TPESampler,COMPLETE
2342,1.3677569516816517,2025-04-24 21:16:05.464321,2025-04-24 21:16:06.567185,0 days 00:00:01.102864,squared_error,14,log2,7,3,best,TPESampler,COMPLETE
2343,1.1725983074554982,2025-04-24 21:16:05.840772,2025-04-24 21:16:06.845380,0 days 00:00:01.004608,squared_error,31,sqrt,3,6,random,TPESampler,COMPLETE
2344,1.005467895307365,2025-04-24 21:16:06.474166,2025-04-24 21:16:07.487990,0 days 00:00:01.013824,absolute_error,31,sqrt,1,2,random,TPESampler,COMPLETE
2345,1.114909371722551,2025-04-24 21:16:07.025427,2025-04-24 21:16:07.908419,0 days 00:00:00.882992,absolute_error,35,sqrt,1,2,random,TPESampler,COMPLETE
2346,1.3182621955384042,2025-04-24 21:16:07.113063,2025-04-24 21:16:08.128388,0 days 00:00:01.015325,absolute_error,32,sqrt,2,5,random,TPESampler,COMPLETE
2347,0.6785347225984457,2025-04-24 21:16:07.785263,2025-04-24 21:16:08.700486,0 days 00:00:00.915223,absolute_error,35,sqrt,1,5,random,TPESampler,COMPLETE
2348,1.3679729947669532,2025-04-24 21:16:08.209805,2025-04-24 21:16:09.215335,0 days 00:00:01.005530,squared_error,21,log2,6,2,random,TPESampler,COMPLETE
2349,1.39690460665991,2025-04-24 21:16:08.372244,2025-04-24 21:16:09.606202,0 days 00:00:01.233958,absolute_error,34,log2,3,6,random,TPESampler,COMPLETE
2350,1.267565231714146,2025-04-24 21:16:09.026197,2025-04-24 21:16:10.194726,0 days 00:00:01.168529,friedman_mse,31,sqrt,3,7,random,TPESampler,COMPLETE
2351,1.335711393574172,2025-04-24 21:16:09.623498,2025-04-24 21:16:10.610336,0 days 00:00:00.986838,absolute_error,27,sqrt,3,2,random,TPESampler,COMPLETE
2352,1.335711393574172,2025-04-24 21:16:09.902444,2025-04-24 21:16:10.774178,0 days 00:00:00.871734,absolute_error,28,sqrt,3,2,random,TPESampler,COMPLETE
2353,0.7644716249456515,2025-04-24 21:16:10.531380,2025-04-24 21:16:11.315975,0 days 00:00:00.784595,friedman_mse,25,sqrt,1,2,random,TPESampler,COMPLETE
2354,0.7464085682144045,2025-04-24 21:16:10.945080,2025-04-24 21:16:11.860058,0 days 00:00:00.914978,absolute_error,28,sqrt,1,5,random,TPESampler,COMPLETE
2355,1.335711393574172,2025-04-24 21:16:11.202610,2025-04-24 21:16:12.153997,0 days 00:00:00.951387,absolute_error,31,sqrt,3,5,random,TPESampler,COMPLETE
2356,1.145601103624533,2025-04-24 21:16:11.581093,2025-04-24 21:16:12.525797,0 days 00:00:00.944704,absolute_error,30,sqrt,1,9,random,TPESampler,COMPLETE
2357,1.2119861239647682,2025-04-24 21:16:12.152340,2025-04-24 21:16:13.233668,0 days 00:00:01.081328,absolute_error,29,sqrt,1,2,random,TPESampler,COMPLETE
2358,1.114909371722551,2025-04-24 21:16:12.534828,2025-04-24 21:16:13.497484,0 days 00:00:00.962656,absolute_error,35,sqrt,1,2,random,TPESampler,COMPLETE
2359,1.2119861239647682,2025-04-24 21:16:12.840251,2025-04-24 21:16:13.961510,0 days 00:00:01.121259,absolute_error,29,sqrt,1,2,random,TPESampler,COMPLETE
2360,1.384582140238885,2025-04-24 21:16:13.518620,2025-04-24 21:16:14.599491,0 days 00:00:01.080871,absolute_error,27,log2,1,2,random,TPESampler,COMPLETE
2361,1.3187513250101375,2025-04-24 21:16:13.785354,2025-04-24 21:16:14.953800,0 days 00:00:01.168446,absolute_error,35,sqrt,2,2,random,TPESampler,COMPLETE
2362,1.335711393574172,2025-04-24 21:16:14.351749,2025-04-24 21:16:15.428382,0 days 00:00:01.076633,absolute_error,35,sqrt,3,5,random,TPESampler,COMPLETE
2363,1.019412803797631,2025-04-24 21:16:14.912740,2025-04-24 21:16:15.985336,0 days 00:00:01.072596,absolute_error,6,log2,1,19,best,TPESampler,COMPLETE
2364,1.2482047264307685,2025-04-24 21:16:15.327785,2025-04-24 21:16:16.556185,0 days 00:00:01.228400,absolute_error,24,sqrt,1,5,random,TPESampler,COMPLETE
2365,1.3267117987075143,2025-04-24 21:16:15.859186,2025-04-24 21:16:16.720269,0 days 00:00:00.861083,absolute_error,25,sqrt,1,5,random,TPESampler,COMPLETE
2366,0.9860869366393894,2025-04-24 21:16:16.352952,2025-04-24 21:16:17.625339,0 days 00:00:01.272387,absolute_error,30,sqrt,1,2,random,TPESampler,COMPLETE
2367,1.335711393574172,2025-04-24 21:16:16.803331,2025-04-24 21:16:17.954434,0 days 00:00:01.151103,absolute_error,31,sqrt,3,2,random,TPESampler,COMPLETE
2368,1.3677569516816517,2025-04-24 21:16:17.090303,2025-04-24 21:16:18.214779,0 days 00:00:01.124476,friedman_mse,6,log2,10,19,best,TPESampler,COMPLETE
2369,0.6750005427680865,2025-04-24 21:16:17.900670,2025-04-24 21:16:19.055451,0 days 00:00:01.154781,absolute_error,30,sqrt,1,5,random,TPESampler,COMPLETE
2370,0.6750005427680865,2025-04-24 21:16:18.225763,2025-04-24 21:16:19.229261,0 days 00:00:01.003498,absolute_error,30,sqrt,1,5,random,TPESampler,COMPLETE
2371,1.3187513250101375,2025-04-24 21:16:18.649681,2025-04-24 21:16:19.635939,0 days 00:00:00.986258,absolute_error,30,sqrt,2,2,random,TPESampler,COMPLETE
2372,1.2119861239647682,2025-04-24 21:16:19.302239,2025-04-24 21:16:20.575774,0 days 00:00:01.273535,absolute_error,29,sqrt,1,2,random,TPESampler,COMPLETE
2373,0.6964980049699784,2025-04-24 21:16:19.491713,2025-04-24 21:16:20.825577,0 days 00:00:01.333864,absolute_error,33,sqrt,1,2,random,TPESampler,COMPLETE
2374,0.9860869366393894,2025-04-24 21:16:19.999598,2025-04-24 21:16:21.405277,0 days 00:00:01.405679,absolute_error,30,sqrt,1,2,random,TPESampler,COMPLETE
2375,1.335711393574172,2025-04-24 21:16:20.955052,2025-04-24 21:16:22.214425,0 days 00:00:01.259373,absolute_error,32,sqrt,3,2,random,TPESampler,COMPLETE
2376,0.6785347225984457,2025-04-24 21:16:21.329668,2025-04-24 21:16:22.391964,0 days 00:00:01.062296,absolute_error,35,sqrt,1,5,random,TPESampler,COMPLETE
2377,0.9667006726783023,2025-04-24 21:16:21.852474,2025-04-24 21:16:22.741894,0 days 00:00:00.889420,absolute_error,34,sqrt,1,5,random,TPESampler,COMPLETE
2378,1.3187513250101375,2025-04-24 21:16:22.656596,2025-04-24 21:16:23.678559,0 days 00:00:01.021963,absolute_error,35,sqrt,2,2,random,TPESampler,COMPLETE
2379,1.335711393574172,2025-04-24 21:16:22.698508,2025-04-24 21:16:23.778493,0 days 00:00:01.079985,absolute_error,31,sqrt,3,2,random,TPESampler,COMPLETE
2380,1.005467895307365,2025-04-24 21:16:22.993816,2025-04-24 21:16:23.953759,0 days 00:00:00.959943,absolute_error,31,sqrt,1,2,random,TPESampler,COMPLETE
2381,1.1725983074554982,2025-04-24 21:16:24.079353,2025-04-24 21:16:25.457284,0 days 00:00:01.377931,friedman_mse,29,sqrt,3,2,random,TPESampler,COMPLETE
2382,1.0324703545097333,2025-04-24 21:16:24.141641,2025-04-24 21:16:25.420877,0 days 00:00:01.279236,friedman_mse,35,sqrt,1,2,random,TPESampler,COMPLETE
2383,1.3187513250101375,2025-04-24 21:16:24.293062,2025-04-24 21:16:25.521075,0 days 00:00:01.228013,absolute_error,23,sqrt,2,2,random,TPESampler,COMPLETE
2384,0.9860869366393894,2025-04-24 21:16:25.631563,2025-04-24 21:16:26.632436,0 days 00:00:01.000873,absolute_error,30,sqrt,1,2,random,TPESampler,COMPLETE
2385,1.3182621955384042,2025-04-24 21:16:25.642141,2025-04-24 21:16:27.360645,0 days 00:00:01.718504,absolute_error,30,sqrt,2,5,random,TPESampler,COMPLETE
2386,0.6869414978083808,2025-04-24 21:16:25.767985,2025-04-24 21:16:26.937430,0 days 00:00:01.169445,squared_error,32,sqrt,1,4,random,TPESampler,COMPLETE
2387,0.7367734144772758,2025-04-24 21:16:26.896969,2025-04-24 21:16:28.008652,0 days 00:00:01.111683,absolute_error,29,sqrt,1,5,random,TPESampler,COMPLETE
2388,0.9222133075858336,2025-04-24 21:16:27.309008,2025-04-24 21:16:28.306171,0 days 00:00:00.997163,squared_error,24,sqrt,1,14,best,TPESampler,COMPLETE
2389,0.743600828343223,2025-04-24 21:16:27.594784,2025-04-24 21:16:28.585485,0 days 00:00:00.990701,absolute_error,31,sqrt,1,5,random,TPESampler,COMPLETE
2390,1.3823819361225373,2025-04-24 21:16:28.345083,2025-04-24 21:16:29.394456,0 days 00:00:01.049373,absolute_error,30,log2,1,2,random,TPESampler,COMPLETE
2391,1.335711393574172,2025-04-24 21:16:28.578388,2025-04-24 21:16:29.569605,0 days 00:00:00.991217,absolute_error,31,sqrt,3,2,random,TPESampler,COMPLETE
2392,1.3187513250101375,2025-04-24 21:16:28.959864,2025-04-24 21:16:29.914039,0 days 00:00:00.954175,absolute_error,31,sqrt,2,2,random,TPESampler,COMPLETE
2393,0.6964980049699784,2025-04-24 21:16:29.819872,2025-04-24 21:16:30.834817,0 days 00:00:01.014945,absolute_error,33,sqrt,1,2,random,TPESampler,COMPLETE
2394,0.5517216241439309,2025-04-24 21:16:29.875989,2025-04-24 21:16:30.890076,0 days 00:00:01.014087,absolute_error,32,sqrt,1,2,random,TPESampler,COMPLETE
2395,0.6234752034897817,2025-04-24 21:16:30.446166,2025-04-24 21:16:31.292192,0 days 00:00:00.846026,absolute_error,34,sqrt,1,2,random,TPESampler,COMPLETE
2396,0.6785347225984457,2025-04-24 21:16:31.119498,2025-04-24 21:16:32.138271,0 days 00:00:01.018773,absolute_error,35,sqrt,1,5,random,TPESampler,COMPLETE
2397,1.2119861239647682,2025-04-24 21:16:31.174746,2025-04-24 21:16:32.298269,0 days 00:00:01.123523,absolute_error,29,sqrt,1,2,random,TPESampler,COMPLETE
2398,1.114909371722551,2025-04-24 21:16:31.607016,2025-04-24 21:16:33.193814,0 days 00:00:01.586798,absolute_error,35,sqrt,1,2,random,TPESampler,COMPLETE
2399,1.2741490090538539,2025-04-24 21:16:32.528776,2025-04-24 21:16:33.586222,0 days 00:00:01.057446,absolute_error,28,sqrt,1,2,random,TPESampler,COMPLETE
2400,0.7464085682144045,2025-04-24 21:16:32.573734,2025-04-24 21:16:33.581005,0 days 00:00:01.007271,absolute_error,28,sqrt,1,5,random,TPESampler,COMPLETE
2401,1.3187513250101375,2025-04-24 21:16:33.548570,2025-04-24 21:16:34.291038,0 days 00:00:00.742468,absolute_error,25,sqrt,2,2,random,TPESampler,COMPLETE
2402,1.114909371722551,2025-04-24 21:16:33.915169,2025-04-24 21:16:34.754315,0 days 00:00:00.839146,absolute_error,35,sqrt,1,2,random,TPESampler,COMPLETE
2403,1.3182621955384042,2025-04-24 21:16:33.960181,2025-04-24 21:16:35.112132,0 days 00:00:01.151951,absolute_error,29,sqrt,2,5,random,TPESampler,COMPLETE
2404,0.7367734144772758,2025-04-24 21:16:34.680068,2025-04-24 21:16:35.585058,0 days 00:00:00.904990,absolute_error,29,sqrt,1,5,random,TPESampler,COMPLETE
2405,0.8622037809680244,2025-04-24 21:16:35.042405,2025-04-24 21:16:36.053462,0 days 00:00:01.011057,friedman_mse,14,log2,3,20,best,TPESampler,COMPLETE
2406,0.6785347225984457,2025-04-24 21:16:35.396219,2025-04-24 21:16:36.439295,0 days 00:00:01.043076,absolute_error,35,sqrt,1,5,random,TPESampler,COMPLETE
2407,1.335711393574172,2025-04-24 21:16:36.010023,2025-04-24 21:16:36.993312,0 days 00:00:00.983289,absolute_error,33,sqrt,3,2,random,TPESampler,COMPLETE
2408,1.1763447383239396,2025-04-24 21:16:36.390133,2025-04-24 21:16:37.329366,0 days 00:00:00.939233,absolute_error,25,sqrt,1,2,random,TPESampler,COMPLETE
2409,1.335711393574172,2025-04-24 21:16:36.688857,2025-04-24 21:16:37.700028,0 days 00:00:01.011171,absolute_error,27,sqrt,3,5,random,TPESampler,COMPLETE
2410,0.6310805851469582,2025-04-24 21:16:37.342899,2025-04-24 21:16:38.380279,0 days 00:00:01.037380,squared_error,33,sqrt,1,2,random,TPESampler,COMPLETE
2411,1.335711393574172,2025-04-24 21:16:37.585331,2025-04-24 21:16:38.573673,0 days 00:00:00.988342,absolute_error,35,sqrt,3,5,random,TPESampler,COMPLETE
2412,1.005467895307365,2025-04-24 21:16:37.985045,2025-04-24 21:16:38.874563,0 days 00:00:00.889518,absolute_error,31,sqrt,1,2,random,TPESampler,COMPLETE
2413,0.9860869366393894,2025-04-24 21:16:38.798096,2025-04-24 21:16:39.833451,0 days 00:00:01.035355,absolute_error,30,sqrt,1,2,random,TPESampler,COMPLETE
2414,1.114909371722551,2025-04-24 21:16:38.839503,2025-04-24 21:16:40.043739,0 days 00:00:01.204236,absolute_error,35,sqrt,1,2,random,TPESampler,COMPLETE
2415,1.005467895307365,2025-04-24 21:16:39.148355,2025-04-24 21:16:40.122109,0 days 00:00:00.973754,absolute_error,31,sqrt,1,2,random,TPESampler,COMPLETE
