number,value,datetime_start,datetime_complete,duration,params_criterion,params_max_depth,params_max_features,params_min_samples_leaf,params_min_samples_split,params_splitter,system_attrs_auto:sampler,state
286,0.6088450820608182,2025-04-24 21:02:04.560080,2025-04-24 21:02:05.464771,0 days 00:00:00.904691,absolute_error,34,sqrt,1,3,best,TPESampler,COMPLETE
287,0.7063284002837366,2025-04-24 21:02:04.929971,2025-04-24 21:02:05.915001,0 days 00:00:00.985030,absolute_error,34,sqrt,1,5,best,TPESampler,COMPLETE
288,1.3581916589995315,2025-04-24 21:02:05.294391,2025-04-24 21:02:06.113661,0 days 00:00:00.819270,absolute_error,35,sqrt,8,11,best,TPESampler,COMPLETE
289,0.8465624319698303,2025-04-24 21:02:05.830196,2025-04-24 21:02:07.176916,0 days 00:00:01.346720,absolute_error,33,sqrt,1,2,best,TPESampler,COMPLETE
290,0.5872420994323145,2025-04-24 21:02:06.224674,2025-04-24 21:02:07.454926,0 days 00:00:01.230252,absolute_error,35,sqrt,1,2,best,TPESampler,COMPLETE
291,1.0498076960778187,2025-04-24 21:02:06.385222,2025-04-24 21:02:07.582976,0 days 00:00:01.197754,friedman_mse,35,sqrt,3,5,best,TPESampler,COMPLETE
292,0.9996424324783258,2025-04-24 21:02:07.541265,2025-04-24 21:02:08.388820,0 days 00:00:00.847555,absolute_error,35,sqrt,2,2,best,TPESampler,COMPLETE
293,1.4138971746431086,2025-04-24 21:02:07.693739,2025-04-24 21:02:08.552069,0 days 00:00:00.858330,absolute_error,8,log2,8,20,best,TPESampler,COMPLETE
294,1.1762267009527727,2025-04-24 21:02:07.871855,2025-04-24 21:02:08.707194,0 days 00:00:00.835339,friedman_mse,35,sqrt,2,2,random,TPESampler,COMPLETE
295,0.5889451668041809,2025-04-24 21:02:08.662056,2025-04-24 21:02:09.641930,0 days 00:00:00.979874,absolute_error,35,sqrt,1,3,best,TPESampler,COMPLETE
296,0.8465624319698303,2025-04-24 21:02:08.770204,2025-04-24 21:02:10.036118,0 days 00:00:01.265914,absolute_error,33,sqrt,1,2,best,TPESampler,COMPLETE
297,0.6873703655189166,2025-04-24 21:02:08.955186,2025-04-24 21:02:10.384738,0 days 00:00:01.429552,absolute_error,30,log2,1,2,best,TPESampler,COMPLETE
298,0.8465624319698303,2025-04-24 21:02:09.920375,2025-04-24 21:02:11.135370,0 days 00:00:01.214995,absolute_error,33,sqrt,1,2,best,TPESampler,COMPLETE
299,1.3350944742710678,2025-04-24 21:02:10.613055,2025-04-24 21:02:11.536944,0 days 00:00:00.923889,friedman_mse,18,log2,2,8,random,TPESampler,COMPLETE
300,1.3581916589995315,2025-04-24 21:02:10.882432,2025-04-24 21:02:11.732585,0 days 00:00:00.850153,absolute_error,16,sqrt,8,10,best,TPESampler,COMPLETE
301,0.5872420994323145,2025-04-24 21:02:11.459563,2025-04-24 21:02:12.226321,0 days 00:00:00.766758,absolute_error,35,sqrt,1,2,best,TPESampler,COMPLETE
302,1.2076965740491883,2025-04-24 21:02:11.800797,2025-04-24 21:02:12.652139,0 days 00:00:00.851342,absolute_error,31,sqrt,3,2,best,TPESampler,COMPLETE
303,0.5542791023918845,2025-04-24 21:02:11.958606,2025-04-24 21:02:12.845179,0 days 00:00:00.886573,absolute_error,31,sqrt,1,2,best,TPESampler,COMPLETE
304,1.4203183267161783,2025-04-24 21:02:12.568017,2025-04-24 21:02:13.337888,0 days 00:00:00.769871,absolute_error,13,sqrt,6,18,best,TPESampler,COMPLETE
305,0.680762371433113,2025-04-24 21:02:12.880061,2025-04-24 21:02:13.719248,0 days 00:00:00.839187,squared_error,32,sqrt,1,2,best,TPESampler,COMPLETE
306,0.6288399089804382,2025-04-24 21:02:13.075125,2025-04-24 21:02:14.097027,0 days 00:00:01.021902,absolute_error,31,sqrt,1,5,best,TPESampler,COMPLETE
307,1.2076965740491883,2025-04-24 21:02:13.643384,2025-04-24 21:02:14.444520,0 days 00:00:00.801136,absolute_error,35,sqrt,3,6,best,TPESampler,COMPLETE
308,0.5647532297301866,2025-04-24 21:02:13.963916,2025-04-24 21:02:14.768659,0 days 00:00:00.804743,absolute_error,34,sqrt,1,2,best,TPESampler,COMPLETE
309,0.8465624319698303,2025-04-24 21:02:14.450628,2025-04-24 21:02:15.255968,0 days 00:00:00.805340,absolute_error,33,sqrt,1,2,best,TPESampler,COMPLETE
310,1.3679729947669532,2025-04-24 21:02:14.718140,2025-04-24 21:02:15.776441,0 days 00:00:01.058301,squared_error,25,log2,10,16,random,TPESampler,COMPLETE
311,0.555832913159586,2025-04-24 21:02:15.016122,2025-04-24 21:02:16.326985,0 days 00:00:01.310863,absolute_error,32,sqrt,1,2,best,TPESampler,COMPLETE
312,0.5872420994323145,2025-04-24 21:02:15.514236,2025-04-24 21:02:16.547036,0 days 00:00:01.032800,absolute_error,35,sqrt,1,2,best,TPESampler,COMPLETE
313,0.8465624319698303,2025-04-24 21:02:16.273293,2025-04-24 21:02:17.033051,0 days 00:00:00.759758,absolute_error,33,sqrt,1,2,best,TPESampler,COMPLETE
314,1.2076965740491883,2025-04-24 21:02:16.561396,2025-04-24 21:02:17.383466,0 days 00:00:00.822070,absolute_error,31,sqrt,3,2,best,TPESampler,COMPLETE
315,1.2076965740491883,2025-04-24 21:02:16.798927,2025-04-24 21:02:17.562384,0 days 00:00:00.763457,absolute_error,35,sqrt,3,2,best,TPESampler,COMPLETE
316,0.5872420994323145,2025-04-24 21:02:17.319786,2025-04-24 21:02:17.964571,0 days 00:00:00.644785,absolute_error,35,sqrt,1,2,best,TPESampler,COMPLETE
317,0.6729098757353278,2025-04-24 21:02:17.684345,2025-04-24 21:02:18.496196,0 days 00:00:00.811851,absolute_error,34,sqrt,1,6,best,TPESampler,COMPLETE
318,0.6821898461155685,2025-04-24 21:02:17.845943,2025-04-24 21:02:18.769257,0 days 00:00:00.923314,friedman_mse,35,sqrt,1,4,best,TPESampler,COMPLETE
319,1.3187513250101375,2025-04-24 21:02:18.218218,2025-04-24 21:02:18.977338,0 days 00:00:00.759120,absolute_error,33,sqrt,2,2,random,TPESampler,COMPLETE
320,1.349125432941631,2025-04-24 21:02:18.705482,2025-04-24 21:02:19.392987,0 days 00:00:00.687505,squared_error,9,log2,1,8,random,TPESampler,COMPLETE
321,1.3677569516816517,2025-04-24 21:02:19.104524,2025-04-24 21:02:20.015596,0 days 00:00:00.911072,friedman_mse,20,log2,5,6,best,TPESampler,COMPLETE
322,0.5872420994323145,2025-04-24 21:02:19.268904,2025-04-24 21:02:20.222221,0 days 00:00:00.953317,absolute_error,35,sqrt,1,2,best,TPESampler,COMPLETE
323,0.6288399089804382,2025-04-24 21:02:19.629486,2025-04-24 21:02:20.591846,0 days 00:00:00.962360,absolute_error,31,sqrt,1,5,best,TPESampler,COMPLETE
324,1.2076965740491883,2025-04-24 21:02:20.224203,2025-04-24 21:02:21.037902,0 days 00:00:00.813699,absolute_error,32,sqrt,3,2,best,TPESampler,COMPLETE
325,0.5542791023918845,2025-04-24 21:02:20.532976,2025-04-24 21:02:21.358857,0 days 00:00:00.825881,absolute_error,31,sqrt,1,2,best,TPESampler,COMPLETE
326,0.555832913159586,2025-04-24 21:02:20.921143,2025-04-24 21:02:21.680003,0 days 00:00:00.758860,absolute_error,32,sqrt,1,2,best,TPESampler,COMPLETE
327,0.8830393779381801,2025-04-24 21:02:21.274945,2025-04-24 21:02:21.981183,0 days 00:00:00.706238,absolute_error,35,sqrt,1,6,best,TPESampler,COMPLETE
328,0.5647532297301866,2025-04-24 21:02:21.584790,2025-04-24 21:02:22.265311,0 days 00:00:00.680521,absolute_error,34,sqrt,1,2,best,TPESampler,COMPLETE
329,1.3318717022348503,2025-04-24 21:02:21.881639,2025-04-24 21:02:22.645856,0 days 00:00:00.764217,squared_error,34,sqrt,9,16,random,TPESampler,COMPLETE
330,0.7188501308142904,2025-04-24 21:02:22.221453,2025-04-24 21:02:22.965917,0 days 00:00:00.744464,friedman_mse,7,log2,1,16,best,TPESampler,COMPLETE
331,0.6288399089804382,2025-04-24 21:02:22.467599,2025-04-24 21:02:23.264395,0 days 00:00:00.796796,absolute_error,31,sqrt,1,5,best,TPESampler,COMPLETE
332,1.0673201805126924,2025-04-24 21:02:22.904323,2025-04-24 21:02:23.534124,0 days 00:00:00.629801,squared_error,16,sqrt,4,11,best,TPESampler,COMPLETE
333,1.3625908614134468,2025-04-24 21:02:23.203123,2025-04-24 21:02:23.955469,0 days 00:00:00.752346,friedman_mse,23,log2,5,2,random,TPESampler,COMPLETE
334,0.5647532297301866,2025-04-24 21:02:23.493732,2025-04-24 21:02:24.229647,0 days 00:00:00.735915,absolute_error,34,sqrt,1,2,best,TPESampler,COMPLETE
335,1.2076965740491883,2025-04-24 21:02:23.820791,2025-04-24 21:02:24.538812,0 days 00:00:00.718021,absolute_error,32,sqrt,3,2,best,TPESampler,COMPLETE
336,0.5872420994323145,2025-04-24 21:02:24.233103,2025-04-24 21:02:25.026368,0 days 00:00:00.793265,absolute_error,35,sqrt,1,2,best,TPESampler,COMPLETE
337,0.9996424324783258,2025-04-24 21:02:24.426163,2025-04-24 21:02:25.304824,0 days 00:00:00.878661,absolute_error,33,sqrt,2,2,best,TPESampler,COMPLETE
338,1.0498076960778187,2025-04-24 21:02:24.814103,2025-04-24 21:02:25.516874,0 days 00:00:00.702771,friedman_mse,34,sqrt,3,2,best,TPESampler,COMPLETE
339,0.5542791023918845,2025-04-24 21:02:25.234583,2025-04-24 21:02:26.096489,0 days 00:00:00.861906,absolute_error,31,sqrt,1,2,best,TPESampler,COMPLETE
340,0.7495346713750386,2025-04-24 21:02:25.596124,2025-04-24 21:02:26.468516,0 days 00:00:00.872392,absolute_error,30,sqrt,1,2,best,TPESampler,COMPLETE
341,0.6540510953786189,2025-04-24 21:02:25.928763,2025-04-24 21:02:26.707161,0 days 00:00:00.778398,absolute_error,29,sqrt,1,5,best,TPESampler,COMPLETE
342,1.3400451655954668,2025-04-24 21:02:26.416555,2025-04-24 21:02:27.153548,0 days 00:00:00.736993,absolute_error,28,sqrt,5,11,random,TPESampler,COMPLETE
343,1.3679729947669532,2025-04-24 21:02:26.786585,2025-04-24 21:02:27.524257,0 days 00:00:00.737672,squared_error,22,log2,6,20,random,TPESampler,COMPLETE
344,0.848060369526298,2025-04-24 21:02:26.976189,2025-04-24 21:02:27.827355,0 days 00:00:00.851166,absolute_error,32,sqrt,1,7,random,TPESampler,COMPLETE
345,0.9996424324783258,2025-04-24 21:02:27.459878,2025-04-24 21:02:28.201222,0 days 00:00:00.741344,absolute_error,30,sqrt,2,2,best,TPESampler,COMPLETE
346,0.7495346713750386,2025-04-24 21:02:27.833378,2025-04-24 21:02:28.505208,0 days 00:00:00.671830,absolute_error,30,sqrt,1,2,best,TPESampler,COMPLETE
347,0.6367020427091272,2025-04-24 21:02:28.094101,2025-04-24 21:02:28.901915,0 days 00:00:00.807814,absolute_error,31,sqrt,1,6,best,TPESampler,COMPLETE
348,0.9312073070199461,2025-04-24 21:02:28.423784,2025-04-24 21:02:29.253095,0 days 00:00:00.829311,absolute_error,30,sqrt,1,5,best,TPESampler,COMPLETE
349,0.7495346713750386,2025-04-24 21:02:28.836458,2025-04-24 21:02:29.558235,0 days 00:00:00.721777,absolute_error,30,sqrt,1,2,best,TPESampler,COMPLETE
350,0.5542791023918845,2025-04-24 21:02:29.144366,2025-04-24 21:02:29.892287,0 days 00:00:00.747921,absolute_error,31,sqrt,1,2,best,TPESampler,COMPLETE
351,1.2076965740491883,2025-04-24 21:02:29.506262,2025-04-24 21:02:30.236547,0 days 00:00:00.730285,absolute_error,32,sqrt,3,5,best,TPESampler,COMPLETE
352,1.3679729947669532,2025-04-24 21:02:29.793224,2025-04-24 21:02:30.970350,0 days 00:00:01.177126,friedman_mse,20,log2,6,12,random,TPESampler,COMPLETE
353,0.5542791023918845,2025-04-24 21:02:30.149830,2025-04-24 21:02:31.350575,0 days 00:00:01.200745,absolute_error,31,sqrt,1,2,best,TPESampler,COMPLETE
354,0.8465624319698303,2025-04-24 21:02:30.804980,2025-04-24 21:02:31.594022,0 days 00:00:00.789042,absolute_error,33,sqrt,1,2,best,TPESampler,COMPLETE
355,0.5542791023918845,2025-04-24 21:02:31.286553,2025-04-24 21:02:32.043353,0 days 00:00:00.756800,absolute_error,31,sqrt,1,2,best,TPESampler,COMPLETE
356,1.123391360187449,2025-04-24 21:02:31.636666,2025-04-24 21:02:32.383579,0 days 00:00:00.746913,squared_error,22,sqrt,2,8,random,TPESampler,COMPLETE
357,0.7101938896795618,2025-04-24 21:02:31.937213,2025-04-24 21:02:32.666934,0 days 00:00:00.729721,squared_error,35,sqrt,1,5,best,TPESampler,COMPLETE
358,0.6540510953786189,2025-04-24 21:02:32.275143,2025-04-24 21:02:33.043839,0 days 00:00:00.768696,absolute_error,29,sqrt,1,5,best,TPESampler,COMPLETE
359,0.9996424324783258,2025-04-24 21:02:32.628927,2025-04-24 21:02:33.356816,0 days 00:00:00.727889,absolute_error,29,sqrt,2,2,best,TPESampler,COMPLETE
360,1.0131068116827324,2025-04-24 21:02:32.954027,2025-04-24 21:02:33.675318,0 days 00:00:00.721291,absolute_error,27,log2,3,2,best,TPESampler,COMPLETE
361,0.6288399089804382,2025-04-24 21:02:33.260038,2025-04-24 21:02:34.011695,0 days 00:00:00.751657,absolute_error,31,sqrt,1,5,best,TPESampler,COMPLETE
362,1.2076965740491883,2025-04-24 21:02:33.590735,2025-04-24 21:02:34.366120,0 days 00:00:00.775385,absolute_error,29,sqrt,3,5,best,TPESampler,COMPLETE
363,0.6112778743973727,2025-04-24 21:02:33.913521,2025-04-24 21:02:34.676949,0 days 00:00:00.763428,absolute_error,29,sqrt,1,2,best,TPESampler,COMPLETE
364,0.6095026962894158,2025-04-24 21:02:34.252129,2025-04-24 21:02:35.044000,0 days 00:00:00.791871,absolute_error,30,sqrt,1,3,best,TPESampler,COMPLETE
365,1.3262151716400714,2025-04-24 21:02:34.633752,2025-04-24 21:02:35.440633,0 days 00:00:00.806881,friedman_mse,29,sqrt,10,16,random,TPESampler,COMPLETE
366,0.8465624319698303,2025-04-24 21:02:34.933811,2025-04-24 21:02:35.863600,0 days 00:00:00.929789,absolute_error,33,sqrt,1,2,best,TPESampler,COMPLETE
367,1.2076965740491883,2025-04-24 21:02:35.365889,2025-04-24 21:02:36.142444,0 days 00:00:00.776555,absolute_error,29,sqrt,3,3,best,TPESampler,COMPLETE
368,0.6289588084452069,2025-04-24 21:02:35.686388,2025-04-24 21:02:36.583932,0 days 00:00:00.897544,absolute_error,29,sqrt,1,4,best,TPESampler,COMPLETE
369,0.6598205726585867,2025-04-24 21:02:36.104666,2025-04-24 21:02:36.880142,0 days 00:00:00.775476,friedman_mse,33,sqrt,1,2,best,TPESampler,COMPLETE
370,0.6087495235188407,2025-04-24 21:02:36.419523,2025-04-24 21:02:37.193089,0 days 00:00:00.773566,absolute_error,29,sqrt,1,3,best,TPESampler,COMPLETE
371,0.555832913159586,2025-04-24 21:02:36.835112,2025-04-24 21:02:37.473007,0 days 00:00:00.637895,absolute_error,32,sqrt,1,2,best,TPESampler,COMPLETE
372,1.04738456046613,2025-04-24 21:02:37.111093,2025-04-24 21:02:37.879617,0 days 00:00:00.768524,friedman_mse,18,sqrt,3,14,best,TPESampler,COMPLETE
373,0.7495346713750386,2025-04-24 21:02:37.425673,2025-04-24 21:02:38.211470,0 days 00:00:00.785797,absolute_error,30,sqrt,1,2,best,TPESampler,COMPLETE
374,1.2076965740491883,2025-04-24 21:02:37.726541,2025-04-24 21:02:38.503776,0 days 00:00:00.777235,absolute_error,30,sqrt,3,2,best,TPESampler,COMPLETE
375,0.7495346713750386,2025-04-24 21:02:38.121478,2025-04-24 21:02:38.880393,0 days 00:00:00.758915,absolute_error,30,sqrt,1,2,best,TPESampler,COMPLETE
376,1.0498076960778187,2025-04-24 21:02:38.455180,2025-04-24 21:02:39.164929,0 days 00:00:00.709749,squared_error,29,sqrt,3,2,best,TPESampler,COMPLETE
377,1.3313785974589911,2025-04-24 21:02:38.726605,2025-04-24 21:02:39.433558,0 days 00:00:00.706953,friedman_mse,3,sqrt,6,8,random,TPESampler,COMPLETE
378,1.359571383264774,2025-04-24 21:02:39.159423,2025-04-24 21:02:39.801177,0 days 00:00:00.641754,squared_error,32,sqrt,9,5,best,TPESampler,COMPLETE
379,0.7495346713750386,2025-04-24 21:02:39.382139,2025-04-24 21:02:40.132283,0 days 00:00:00.750144,absolute_error,30,sqrt,1,2,best,TPESampler,COMPLETE
380,1.2076965740491883,2025-04-24 21:02:39.685976,2025-04-24 21:02:40.420096,0 days 00:00:00.734120,absolute_error,28,sqrt,3,2,best,TPESampler,COMPLETE
381,0.6112778743973727,2025-04-24 21:02:40.031606,2025-04-24 21:02:40.834457,0 days 00:00:00.802851,absolute_error,29,sqrt,1,2,best,TPESampler,COMPLETE
382,0.7495346713750386,2025-04-24 21:02:40.368476,2025-04-24 21:02:41.197292,0 days 00:00:00.828816,absolute_error,30,sqrt,1,2,best,TPESampler,COMPLETE
383,0.5542791023918845,2025-04-24 21:02:40.664596,2025-04-24 21:02:41.407276,0 days 00:00:00.742680,absolute_error,31,sqrt,1,2,best,TPESampler,COMPLETE
384,1.4148597056909755,2025-04-24 21:02:41.130149,2025-04-24 21:02:41.855621,0 days 00:00:00.725472,absolute_error,33,log2,9,10,random,TPESampler,COMPLETE
385,1.3187513250101375,2025-04-24 21:02:41.409974,2025-04-24 21:02:42.240374,0 days 00:00:00.830400,absolute_error,27,sqrt,2,2,random,TPESampler,COMPLETE
386,1.2076965740491883,2025-04-24 21:02:41.683861,2025-04-24 21:02:42.405064,0 days 00:00:00.721203,absolute_error,34,sqrt,3,5,best,TPESampler,COMPLETE
387,1.4222892482905918,2025-04-24 21:02:42.141660,2025-04-24 21:02:42.803453,0 days 00:00:00.661793,absolute_error,1,sqrt,3,4,best,TPESampler,COMPLETE
388,1.39690460665991,2025-04-24 21:02:42.495536,2025-04-24 21:02:43.263781,0 days 00:00:00.768245,absolute_error,11,log2,3,14,random,TPESampler,COMPLETE
389,0.856297005325639,2025-04-24 21:02:42.648863,2025-04-24 21:02:43.367234,0 days 00:00:00.718371,absolute_error,28,sqrt,1,2,best,TPESampler,COMPLETE
390,0.6112778743973727,2025-04-24 21:02:43.025939,2025-04-24 21:02:43.763390,0 days 00:00:00.737451,absolute_error,29,sqrt,1,2,best,TPESampler,COMPLETE
391,1.2076965740491883,2025-04-24 21:02:43.460576,2025-04-24 21:02:44.255646,0 days 00:00:00.795070,absolute_error,29,sqrt,3,2,best,TPESampler,COMPLETE
392,1.344003918250421,2025-04-24 21:02:43.651311,2025-04-24 21:02:44.399389,0 days 00:00:00.748078,squared_error,9,log2,3,17,random,TPESampler,COMPLETE
393,0.6288399089804382,2025-04-24 21:02:43.968645,2025-04-24 21:02:44.930361,0 days 00:00:00.961716,absolute_error,31,sqrt,1,5,best,TPESampler,COMPLETE
394,0.6210942871030631,2025-04-24 21:02:44.484727,2025-04-24 21:02:45.271286,0 days 00:00:00.786559,absolute_error,31,log2,1,4,best,TPESampler,COMPLETE
395,1.4148597056909755,2025-04-24 21:02:44.644253,2025-04-24 21:02:45.592333,0 days 00:00:00.948080,absolute_error,26,log2,10,20,random,TPESampler,COMPLETE
396,0.8830393779381801,2025-04-24 21:02:45.201004,2025-04-24 21:02:46.106488,0 days 00:00:00.905484,absolute_error,35,sqrt,1,6,best,TPESampler,COMPLETE
397,0.6830357187994675,2025-04-24 21:02:45.672983,2025-04-24 21:02:46.928151,0 days 00:00:01.255168,absolute_error,33,sqrt,1,4,random,TPESampler,COMPLETE
398,1.36527051973169,2025-04-24 21:02:45.873283,2025-04-24 21:02:47.179729,0 days 00:00:01.306446,absolute_error,32,log2,1,2,random,TPESampler,COMPLETE
399,0.7495346713750386,2025-04-24 21:02:46.404148,2025-04-24 21:02:47.532273,0 days 00:00:01.128125,absolute_error,30,sqrt,1,2,best,TPESampler,COMPLETE
400,0.7495346713750386,2025-04-24 21:02:47.406848,2025-04-24 21:02:49.228199,0 days 00:00:01.821351,absolute_error,30,sqrt,1,2,best,TPESampler,COMPLETE
401,1.2076965740491883,2025-04-24 21:02:47.479041,2025-04-24 21:02:49.808029,0 days 00:00:02.328988,absolute_error,29,sqrt,3,2,best,TPESampler,COMPLETE
402,1.4138971746431086,2025-04-24 21:02:48.045317,2025-04-24 21:02:50.131800,0 days 00:00:02.086483,absolute_error,22,log2,7,11,best,TPESampler,COMPLETE
403,0.6919576112851691,2025-04-24 21:02:49.911423,2025-04-24 21:02:51.304139,0 days 00:00:01.392716,squared_error,28,sqrt,1,2,best,TPESampler,COMPLETE
404,0.5647532297301866,2025-04-24 21:02:50.447891,2025-04-24 21:02:51.854011,0 days 00:00:01.406120,absolute_error,34,sqrt,1,2,best,TPESampler,COMPLETE
405,1.4148597056909755,2025-04-24 21:02:50.565560,2025-04-24 21:02:52.226815,0 days 00:00:01.661255,absolute_error,12,sqrt,10,19,random,TPESampler,COMPLETE
406,1.2076965740491883,2025-04-24 21:02:51.742293,2025-04-24 21:02:52.832032,0 days 00:00:01.089739,absolute_error,30,sqrt,3,2,best,TPESampler,COMPLETE
407,1.007838021756667,2025-04-24 21:02:52.407871,2025-04-24 21:02:53.579474,0 days 00:00:01.171603,absolute_error,28,sqrt,1,6,best,TPESampler,COMPLETE
408,1.1579755495671251,2025-04-24 21:02:52.672116,2025-04-24 21:02:53.897464,0 days 00:00:01.225348,absolute_error,23,sqrt,2,18,best,TPESampler,COMPLETE
409,1.2076965740491883,2025-04-24 21:02:53.399885,2025-04-24 21:02:54.559972,0 days 00:00:01.160087,absolute_error,35,sqrt,3,2,best,TPESampler,COMPLETE
410,1.3262151716400714,2025-04-24 21:02:53.898751,2025-04-24 21:02:55.370556,0 days 00:00:01.471805,squared_error,31,sqrt,10,6,random,TPESampler,COMPLETE
411,0.5542791023918845,2025-04-24 21:02:54.349793,2025-04-24 21:02:55.776071,0 days 00:00:01.426278,absolute_error,31,sqrt,1,2,best,TPESampler,COMPLETE
412,0.555832913159586,2025-04-24 21:02:55.083782,2025-04-24 21:02:56.268830,0 days 00:00:01.185048,absolute_error,32,sqrt,1,2,best,TPESampler,COMPLETE
413,0.7033595174659969,2025-04-24 21:02:55.674944,2025-04-24 21:02:56.755275,0 days 00:00:01.080331,absolute_error,28,sqrt,1,5,best,TPESampler,COMPLETE
414,0.6526502695763474,2025-04-24 21:02:56.064940,2025-04-24 21:02:57.348987,0 days 00:00:01.284047,absolute_error,28,log2,1,2,best,TPESampler,COMPLETE
415,1.0572106585957868,2025-04-24 21:02:56.679974,2025-04-24 21:02:58.085831,0 days 00:00:01.405857,friedman_mse,32,sqrt,1,20,random,TPESampler,COMPLETE
416,0.5542791023918845,2025-04-24 21:02:57.304986,2025-04-24 21:02:58.420324,0 days 00:00:01.115338,absolute_error,31,sqrt,1,2,best,TPESampler,COMPLETE
417,0.7033595174659969,2025-04-24 21:02:58.031789,2025-04-24 21:02:58.938652,0 days 00:00:00.906863,absolute_error,28,sqrt,1,5,best,TPESampler,COMPLETE
418,0.856297005325639,2025-04-24 21:02:58.364128,2025-04-24 21:02:59.536526,0 days 00:00:01.172398,absolute_error,28,sqrt,1,2,best,TPESampler,COMPLETE
419,0.5682124588118789,2025-04-24 21:02:58.756807,2025-04-24 21:02:59.933644,0 days 00:00:01.176837,absolute_error,27,sqrt,1,2,best,TPESampler,COMPLETE
420,0.9312073070199461,2025-04-24 21:02:59.399227,2025-04-24 21:03:00.473999,0 days 00:00:01.074772,absolute_error,30,sqrt,1,5,best,TPESampler,COMPLETE
421,1.2076965740491883,2025-04-24 21:02:59.885271,2025-04-24 21:03:00.786510,0 days 00:00:00.901239,absolute_error,28,sqrt,3,2,best,TPESampler,COMPLETE
422,0.7235427905137525,2025-04-24 21:03:00.370997,2025-04-24 21:03:01.307976,0 days 00:00:00.936979,friedman_mse,26,sqrt,1,2,best,TPESampler,COMPLETE
423,1.0324703545097333,2025-04-24 21:03:00.730268,2025-04-24 21:03:01.669693,0 days 00:00:00.939425,squared_error,35,sqrt,1,2,random,TPESampler,COMPLETE
424,0.5682124588118789,2025-04-24 21:03:01.183001,2025-04-24 21:03:01.956895,0 days 00:00:00.773894,absolute_error,27,sqrt,1,2,best,TPESampler,COMPLETE
425,0.5542791023918845,2025-04-24 21:03:01.533131,2025-04-24 21:03:02.473746,0 days 00:00:00.940615,absolute_error,31,sqrt,1,2,best,TPESampler,COMPLETE
426,0.7495346713750386,2025-04-24 21:03:01.923738,2025-04-24 21:03:02.643538,0 days 00:00:00.719800,absolute_error,30,sqrt,1,2,best,TPESampler,COMPLETE
427,1.4008887910800534,2025-04-24 21:03:02.184052,2025-04-24 21:03:02.929876,0 days 00:00:00.745824,absolute_error,4,sqrt,3,12,best,TPESampler,COMPLETE
428,0.6112778743973727,2025-04-24 21:03:02.710004,2025-04-24 21:03:03.459462,0 days 00:00:00.749458,absolute_error,29,sqrt,1,2,best,TPESampler,COMPLETE
