number,value,datetime_start,datetime_complete,duration,params_criterion,params_max_depth,params_max_features,params_min_samples_leaf,params_min_samples_split,params_splitter,system_attrs_auto:sampler,state
858,1.1302409528743838,2025-04-24 21:05:40.570398,2025-04-24 21:05:41.362050,0 days 00:00:00.791652,absolute_error,32,sqrt,2,5,best,TPESampler,COMPLETE
859,1.3716599770440436,2025-04-24 21:05:41.182588,2025-04-24 21:05:42.077962,0 days 00:00:00.895374,squared_error,1,sqrt,1,3,best,TPESampler,COMPLETE
860,0.856297005325639,2025-04-24 21:05:41.233689,2025-04-24 21:05:42.023052,0 days 00:00:00.789363,absolute_error,28,sqrt,1,2,best,TPESampler,COMPLETE
861,1.0498076960778187,2025-04-24 21:05:41.578000,2025-04-24 21:05:42.967222,0 days 00:00:01.389222,squared_error,30,sqrt,3,3,best,TPESampler,COMPLETE
862,0.555832913159586,2025-04-24 21:05:42.179364,2025-04-24 21:05:43.273855,0 days 00:00:01.094491,absolute_error,32,sqrt,1,2,best,TPESampler,COMPLETE
863,1.2076965740491883,2025-04-24 21:05:42.225140,2025-04-24 21:05:43.164509,0 days 00:00:00.939369,absolute_error,26,sqrt,3,5,best,TPESampler,COMPLETE
864,0.7033595174659969,2025-04-24 21:05:43.202508,2025-04-24 21:05:43.880517,0 days 00:00:00.678009,absolute_error,28,sqrt,1,5,best,TPESampler,COMPLETE
865,0.7341375207481863,2025-04-24 21:05:43.390342,2025-04-24 21:05:44.357439,0 days 00:00:00.967097,friedman_mse,33,sqrt,1,9,best,TPESampler,COMPLETE
866,1.3187513250101375,2025-04-24 21:05:43.536320,2025-04-24 21:05:44.433323,0 days 00:00:00.897003,absolute_error,27,sqrt,2,2,random,TPESampler,COMPLETE
867,1.2076965740491883,2025-04-24 21:05:44.166505,2025-04-24 21:05:44.898958,0 days 00:00:00.732453,absolute_error,32,sqrt,3,2,best,TPESampler,COMPLETE
868,0.7495346713750386,2025-04-24 21:05:44.578494,2025-04-24 21:05:45.398445,0 days 00:00:00.819951,absolute_error,30,sqrt,1,2,best,TPESampler,COMPLETE
869,0.856297005325639,2025-04-24 21:05:44.848286,2025-04-24 21:05:45.646883,0 days 00:00:00.798597,absolute_error,28,sqrt,1,2,best,TPESampler,COMPLETE
870,1.2076965740491883,2025-04-24 21:05:45.101491,2025-04-24 21:05:45.977682,0 days 00:00:00.876191,absolute_error,34,sqrt,3,5,best,TPESampler,COMPLETE
871,0.6310502563923985,2025-04-24 21:05:45.645368,2025-04-24 21:05:46.517907,0 days 00:00:00.872539,absolute_error,33,sqrt,1,5,best,TPESampler,COMPLETE
872,1.2076965740491883,2025-04-24 21:05:45.930203,2025-04-24 21:05:46.702579,0 days 00:00:00.772376,absolute_error,31,sqrt,3,2,best,TPESampler,COMPLETE
873,0.9736108774151305,2025-04-24 21:05:46.230082,2025-04-24 21:05:47.036748,0 days 00:00:00.806666,friedman_mse,26,sqrt,4,9,best,TPESampler,COMPLETE
874,0.7495346713750386,2025-04-24 21:05:46.794649,2025-04-24 21:05:47.607893,0 days 00:00:00.813244,absolute_error,30,sqrt,1,2,best,TPESampler,COMPLETE
875,0.7495346713750386,2025-04-24 21:05:46.915535,2025-04-24 21:05:47.807932,0 days 00:00:00.892397,absolute_error,30,sqrt,1,2,best,TPESampler,COMPLETE
876,1.3366731480724,2025-04-24 21:05:47.266827,2025-04-24 21:05:48.129302,0 days 00:00:00.862475,absolute_error,7,sqrt,1,11,random,TPESampler,COMPLETE
877,0.9610014723049441,2025-04-24 21:05:47.830364,2025-04-24 21:05:48.623126,0 days 00:00:00.792762,absolute_error,29,log2,2,2,best,TPESampler,COMPLETE
878,0.9610014723049441,2025-04-24 21:05:48.017861,2025-04-24 21:05:48.866285,0 days 00:00:00.848424,absolute_error,28,log2,2,2,best,TPESampler,COMPLETE
879,0.6283387272564507,2025-04-24 21:05:48.389167,2025-04-24 21:05:49.229629,0 days 00:00:00.840462,absolute_error,35,log2,1,2,best,TPESampler,COMPLETE
880,1.1302409528743838,2025-04-24 21:05:48.932687,2025-04-24 21:05:49.751710,0 days 00:00:00.819023,absolute_error,35,sqrt,2,5,best,TPESampler,COMPLETE
881,0.9194592887273054,2025-04-24 21:05:49.147274,2025-04-24 21:05:50.063406,0 days 00:00:00.916132,absolute_error,27,sqrt,1,5,best,TPESampler,COMPLETE
882,0.6969850559386573,2025-04-24 21:05:49.460666,2025-04-24 21:05:50.293318,0 days 00:00:00.832652,friedman_mse,30,log2,1,2,best,TPESampler,COMPLETE
883,0.5647532297301866,2025-04-24 21:05:49.997609,2025-04-24 21:05:50.994358,0 days 00:00:00.996749,absolute_error,34,sqrt,1,2,best,TPESampler,COMPLETE
884,0.7136356355134803,2025-04-24 21:05:50.381558,2025-04-24 21:05:51.280017,0 days 00:00:00.898459,squared_error,29,sqrt,1,4,best,TPESampler,COMPLETE
885,1.2076965740491883,2025-04-24 21:05:50.568630,2025-04-24 21:05:51.477125,0 days 00:00:00.908495,absolute_error,28,sqrt,3,5,best,TPESampler,COMPLETE
886,1.0099953635558898,2025-04-24 21:05:51.297059,2025-04-24 21:05:52.008909,0 days 00:00:00.711850,absolute_error,23,sqrt,1,2,best,TPESampler,COMPLETE
887,0.9996424324783258,2025-04-24 21:05:51.521171,2025-04-24 21:05:52.378570,0 days 00:00:00.857399,absolute_error,35,sqrt,2,2,best,TPESampler,COMPLETE
888,1.0679382701076958,2025-04-24 21:05:51.908507,2025-04-24 21:05:52.620897,0 days 00:00:00.712390,friedman_mse,25,sqrt,4,20,best,TPESampler,COMPLETE
889,1.3679729947669532,2025-04-24 21:05:52.318645,2025-04-24 21:05:53.113111,0 days 00:00:00.794466,friedman_mse,8,log2,9,12,random,TPESampler,COMPLETE
890,1.4148597056909755,2025-04-24 21:05:52.695060,2025-04-24 21:05:53.473570,0 days 00:00:00.778510,absolute_error,8,log2,8,3,random,TPESampler,COMPLETE
891,0.6540510953786189,2025-04-24 21:05:52.867460,2025-04-24 21:05:53.807953,0 days 00:00:00.940493,absolute_error,29,sqrt,1,5,best,TPESampler,COMPLETE
892,1.3677569516816517,2025-04-24 21:05:53.412725,2025-04-24 21:05:54.223696,0 days 00:00:00.810971,friedman_mse,21,log2,9,20,best,TPESampler,COMPLETE
893,1.2076965740491883,2025-04-24 21:05:53.801244,2025-04-24 21:05:54.520424,0 days 00:00:00.719180,absolute_error,26,sqrt,3,2,best,TPESampler,COMPLETE
894,0.5542791023918845,2025-04-24 21:05:54.123517,2025-04-24 21:05:54.990023,0 days 00:00:00.866506,absolute_error,31,sqrt,1,2,best,TPESampler,COMPLETE
895,0.5872420994323145,2025-04-24 21:05:54.486433,2025-04-24 21:05:55.329557,0 days 00:00:00.843124,absolute_error,35,sqrt,1,2,best,TPESampler,COMPLETE
896,0.6288399089804382,2025-04-24 21:05:54.811507,2025-04-24 21:05:55.649138,0 days 00:00:00.837631,absolute_error,31,sqrt,1,5,best,TPESampler,COMPLETE
897,0.7495346713750386,2025-04-24 21:05:55.335204,2025-04-24 21:05:56.090796,0 days 00:00:00.755592,absolute_error,30,sqrt,1,2,best,TPESampler,COMPLETE
898,0.6112778743973727,2025-04-24 21:05:55.608370,2025-04-24 21:05:56.450803,0 days 00:00:00.842433,absolute_error,29,sqrt,1,2,best,TPESampler,COMPLETE
899,1.2076965740491883,2025-04-24 21:05:55.907075,2025-04-24 21:05:56.771153,0 days 00:00:00.864078,absolute_error,30,sqrt,3,2,best,TPESampler,COMPLETE
900,1.1302409528743838,2025-04-24 21:05:56.350302,2025-04-24 21:05:57.170427,0 days 00:00:00.820125,absolute_error,27,sqrt,2,5,best,TPESampler,COMPLETE
901,0.7495346713750386,2025-04-24 21:05:56.776276,2025-04-24 21:05:57.650036,0 days 00:00:00.873760,absolute_error,30,sqrt,1,2,best,TPESampler,COMPLETE
902,0.9194592887273054,2025-04-24 21:05:57.056728,2025-04-24 21:05:58.034113,0 days 00:00:00.977385,absolute_error,27,sqrt,1,5,best,TPESampler,COMPLETE
903,0.6003596742775619,2025-04-24 21:05:57.461013,2025-04-24 21:05:58.331086,0 days 00:00:00.870073,friedman_mse,34,sqrt,1,6,best,TPESampler,COMPLETE
904,1.2076965740491883,2025-04-24 21:05:57.928954,2025-04-24 21:05:58.742467,0 days 00:00:00.813513,absolute_error,31,sqrt,3,2,best,TPESampler,COMPLETE
905,0.5713387065834993,2025-04-24 21:05:58.324872,2025-04-24 21:05:59.069032,0 days 00:00:00.744160,absolute_error,25,sqrt,1,2,best,TPESampler,COMPLETE
906,0.5872420994323145,2025-04-24 21:05:58.568546,2025-04-24 21:05:59.404027,0 days 00:00:00.835481,absolute_error,35,sqrt,1,2,best,TPESampler,COMPLETE
907,0.6450702871187598,2025-04-24 21:05:59.075730,2025-04-24 21:05:59.941961,0 days 00:00:00.866231,squared_error,29,sqrt,1,2,best,TPESampler,COMPLETE
908,0.7063284002837366,2025-04-24 21:05:59.299675,2025-04-24 21:06:00.107123,0 days 00:00:00.807448,absolute_error,34,sqrt,1,5,best,TPESampler,COMPLETE
909,0.856297005325639,2025-04-24 21:05:59.694057,2025-04-24 21:06:00.458043,0 days 00:00:00.763986,absolute_error,28,sqrt,1,2,best,TPESampler,COMPLETE
910,0.9996424324783258,2025-04-24 21:06:00.179122,2025-04-24 21:06:01.148359,0 days 00:00:00.969237,absolute_error,29,sqrt,2,2,best,TPESampler,COMPLETE
911,0.6310502563923985,2025-04-24 21:06:00.456733,2025-04-24 21:06:01.512667,0 days 00:00:01.055934,absolute_error,33,sqrt,1,5,best,TPESampler,COMPLETE
912,0.6755787793007089,2025-04-24 21:06:00.932595,2025-04-24 21:06:01.881000,0 days 00:00:00.948405,absolute_error,35,sqrt,1,5,best,TPESampler,COMPLETE
913,0.6755787793007089,2025-04-24 21:06:01.408980,2025-04-24 21:06:02.250226,0 days 00:00:00.841246,absolute_error,35,sqrt,1,5,best,TPESampler,COMPLETE
914,0.7495346713750386,2025-04-24 21:06:01.822582,2025-04-24 21:06:02.660874,0 days 00:00:00.838292,absolute_error,30,sqrt,1,2,best,TPESampler,COMPLETE
915,0.7495346713750386,2025-04-24 21:06:02.152859,2025-04-24 21:06:03.079140,0 days 00:00:00.926281,absolute_error,30,sqrt,1,2,best,TPESampler,COMPLETE
916,1.2076965740491883,2025-04-24 21:06:02.525728,2025-04-24 21:06:03.314861,0 days 00:00:00.789133,absolute_error,30,sqrt,3,5,best,TPESampler,COMPLETE
917,0.9996424324783258,2025-04-24 21:06:02.996556,2025-04-24 21:06:03.786175,0 days 00:00:00.789619,absolute_error,29,sqrt,2,2,best,TPESampler,COMPLETE
918,0.5872420994323145,2025-04-24 21:06:03.362867,2025-04-24 21:06:04.254208,0 days 00:00:00.891341,absolute_error,35,sqrt,1,2,best,TPESampler,COMPLETE
919,1.2168800208288038,2025-04-24 21:06:03.552922,2025-04-24 21:06:04.521694,0 days 00:00:00.968772,absolute_error,27,sqrt,1,2,random,TPESampler,COMPLETE
920,1.2076965740491883,2025-04-24 21:06:04.133938,2025-04-24 21:06:04.994381,0 days 00:00:00.860443,absolute_error,32,sqrt,3,2,best,TPESampler,COMPLETE
921,0.5713387065834993,2025-04-24 21:06:04.630518,2025-04-24 21:06:05.587395,0 days 00:00:00.956877,absolute_error,25,sqrt,1,2,best,TPESampler,COMPLETE
922,0.5713387065834993,2025-04-24 21:06:04.813389,2025-04-24 21:06:05.767216,0 days 00:00:00.953827,absolute_error,25,sqrt,1,2,best,TPESampler,COMPLETE
923,0.6288399089804382,2025-04-24 21:06:05.243030,2025-04-24 21:06:06.028648,0 days 00:00:00.785618,absolute_error,31,sqrt,1,5,best,TPESampler,COMPLETE
924,0.9970333222906006,2025-04-24 21:06:05.873441,2025-04-24 21:06:07.107626,0 days 00:00:01.234185,absolute_error,25,sqrt,1,5,best,TPESampler,COMPLETE
925,0.6450702871187598,2025-04-24 21:06:05.961267,2025-04-24 21:06:07.021338,0 days 00:00:01.060071,friedman_mse,29,sqrt,1,2,best,TPESampler,COMPLETE
926,1.3677569516816517,2025-04-24 21:06:06.462824,2025-04-24 21:06:07.478027,0 days 00:00:01.015203,squared_error,32,log2,6,20,best,TPESampler,COMPLETE
927,0.9996424324783258,2025-04-24 21:06:07.350033,2025-04-24 21:06:08.360722,0 days 00:00:01.010689,absolute_error,31,sqrt,2,2,best,TPESampler,COMPLETE
928,0.5872420994323145,2025-04-24 21:06:07.415198,2025-04-24 21:06:08.359262,0 days 00:00:00.944064,absolute_error,35,sqrt,1,2,best,TPESampler,COMPLETE
929,0.5542791023918845,2025-04-24 21:06:08.021622,2025-04-24 21:06:08.767443,0 days 00:00:00.745821,absolute_error,31,sqrt,1,2,best,TPESampler,COMPLETE
930,0.7052145350764119,2025-04-24 21:06:08.628324,2025-04-24 21:06:09.520601,0 days 00:00:00.892277,absolute_error,33,sqrt,1,5,random,TPESampler,COMPLETE
931,1.2076965740491883,2025-04-24 21:06:08.709097,2025-04-24 21:06:09.797928,0 days 00:00:01.088831,absolute_error,28,sqrt,3,5,best,TPESampler,COMPLETE
932,1.114909371722551,2025-04-24 21:06:09.022482,2025-04-24 21:06:09.796528,0 days 00:00:00.774046,absolute_error,35,sqrt,1,2,random,TPESampler,COMPLETE
933,0.9194592887273054,2025-04-24 21:06:09.746777,2025-04-24 21:06:10.393826,0 days 00:00:00.647049,absolute_error,27,sqrt,1,5,best,TPESampler,COMPLETE
934,0.5542791023918845,2025-04-24 21:06:10.056397,2025-04-24 21:06:11.021990,0 days 00:00:00.965593,absolute_error,31,sqrt,1,2,best,TPESampler,COMPLETE
935,0.6112778743973727,2025-04-24 21:06:10.109270,2025-04-24 21:06:11.019506,0 days 00:00:00.910236,absolute_error,29,sqrt,1,2,best,TPESampler,COMPLETE
936,0.7033595174659969,2025-04-24 21:06:10.642064,2025-04-24 21:06:11.377596,0 days 00:00:00.735532,absolute_error,28,sqrt,1,5,best,TPESampler,COMPLETE
937,1.2076965740491883,2025-04-24 21:06:11.312981,2025-04-24 21:06:12.234602,0 days 00:00:00.921621,absolute_error,33,sqrt,3,2,best,TPESampler,COMPLETE
938,0.9996424324783258,2025-04-24 21:06:11.368634,2025-04-24 21:06:12.310161,0 days 00:00:00.941527,absolute_error,30,sqrt,2,2,best,TPESampler,COMPLETE
939,0.7495346713750386,2025-04-24 21:06:12.036878,2025-04-24 21:06:13.033809,0 days 00:00:00.996931,absolute_error,30,sqrt,1,2,best,TPESampler,COMPLETE
940,1.4138971746431086,2025-04-24 21:06:12.436078,2025-04-24 21:06:13.267216,0 days 00:00:00.831138,absolute_error,16,log2,6,7,best,TPESampler,COMPLETE
941,1.2076965740491883,2025-04-24 21:06:12.500134,2025-04-24 21:06:13.426878,0 days 00:00:00.926744,absolute_error,24,sqrt,3,2,best,TPESampler,COMPLETE
942,0.9312073070199461,2025-04-24 21:06:13.375716,2025-04-24 21:06:14.291241,0 days 00:00:00.915525,absolute_error,30,sqrt,1,5,best,TPESampler,COMPLETE
943,1.2076965740491883,2025-04-24 21:06:13.536768,2025-04-24 21:06:14.488048,0 days 00:00:00.951280,absolute_error,34,sqrt,3,2,best,TPESampler,COMPLETE
944,0.7495346713750386,2025-04-24 21:06:13.708631,2025-04-24 21:06:14.524274,0 days 00:00:00.815643,absolute_error,30,sqrt,1,2,best,TPESampler,COMPLETE
945,0.555832913159586,2025-04-24 21:06:14.603619,2025-04-24 21:06:15.722652,0 days 00:00:01.119033,absolute_error,32,sqrt,1,2,best,TPESampler,COMPLETE
946,0.6540510953786189,2025-04-24 21:06:14.612873,2025-04-24 21:06:15.870372,0 days 00:00:01.257499,absolute_error,29,sqrt,1,5,best,TPESampler,COMPLETE
947,1.092772879039125,2025-04-24 21:06:15.443218,2025-04-24 21:06:16.182223,0 days 00:00:00.739005,absolute_error,24,sqrt,1,2,best,TPESampler,COMPLETE
948,0.7495346713750386,2025-04-24 21:06:16.040601,2025-04-24 21:06:16.763233,0 days 00:00:00.722632,absolute_error,30,sqrt,1,2,best,TPESampler,COMPLETE
949,0.5542791023918845,2025-04-24 21:06:16.133183,2025-04-24 21:06:17.093546,0 days 00:00:00.960363,absolute_error,31,sqrt,1,2,best,TPESampler,COMPLETE
950,1.3677569516816517,2025-04-24 21:06:16.427406,2025-04-24 21:06:17.253424,0 days 00:00:00.826018,squared_error,26,log2,10,20,best,TPESampler,COMPLETE
951,0.5872420994323145,2025-04-24 21:06:17.056355,2025-04-24 21:06:18.032230,0 days 00:00:00.975875,absolute_error,35,sqrt,1,2,best,TPESampler,COMPLETE
952,1.0131068116827324,2025-04-24 21:06:17.397524,2025-04-24 21:06:18.154284,0 days 00:00:00.756760,absolute_error,28,log2,3,8,best,TPESampler,COMPLETE
953,1.2076965740491883,2025-04-24 21:06:17.634076,2025-04-24 21:06:18.459259,0 days 00:00:00.825183,absolute_error,30,sqrt,3,6,best,TPESampler,COMPLETE
954,1.2076965740491883,2025-04-24 21:06:18.339442,2025-04-24 21:06:19.249203,0 days 00:00:00.909761,absolute_error,30,sqrt,3,2,best,TPESampler,COMPLETE
955,1.2076965740491883,2025-04-24 21:06:18.396670,2025-04-24 21:06:19.288722,0 days 00:00:00.892052,absolute_error,23,sqrt,3,2,best,TPESampler,COMPLETE
956,1.359571383264774,2025-04-24 21:06:18.900426,2025-04-24 21:06:19.682352,0 days 00:00:00.781926,friedman_mse,27,sqrt,10,12,best,TPESampler,COMPLETE
957,0.7336643688022678,2025-04-24 21:06:19.509820,2025-04-24 21:06:20.360024,0 days 00:00:00.850204,absolute_error,31,sqrt,1,9,best,TPESampler,COMPLETE
958,1.4058384605507321,2025-04-24 21:06:19.608054,2025-04-24 21:06:20.729053,0 days 00:00:01.120999,absolute_error,5,sqrt,10,10,best,TPESampler,COMPLETE
959,1.2076965740491883,2025-04-24 21:06:19.886122,2025-04-24 21:06:20.830646,0 days 00:00:00.944524,absolute_error,28,sqrt,3,5,best,TPESampler,COMPLETE
960,0.5872420994323145,2025-04-24 21:06:20.662125,2025-04-24 21:06:21.322597,0 days 00:00:00.660472,absolute_error,35,sqrt,1,2,best,TPESampler,COMPLETE
961,0.6540510953786189,2025-04-24 21:06:20.989145,2025-04-24 21:06:21.815086,0 days 00:00:00.825941,absolute_error,29,sqrt,1,5,best,TPESampler,COMPLETE
962,0.9996424324783258,2025-04-24 21:06:21.072937,2025-04-24 21:06:21.987948,0 days 00:00:00.915011,absolute_error,29,sqrt,2,2,best,TPESampler,COMPLETE
963,1.3576605235835724,2025-04-24 21:06:21.574910,2025-04-24 21:06:22.285159,0 days 00:00:00.710249,friedman_mse,6,log2,2,11,random,TPESampler,COMPLETE
964,0.610896094172543,2025-04-24 21:06:22.026583,2025-04-24 21:06:22.891809,0 days 00:00:00.865226,absolute_error,26,sqrt,1,2,best,TPESampler,COMPLETE
965,1.0131068116827324,2025-04-24 21:06:22.239713,2025-04-24 21:06:23.109338,0 days 00:00:00.869625,absolute_error,9,log2,3,17,best,TPESampler,COMPLETE
966,1.1302409528743838,2025-04-24 21:06:22.516904,2025-04-24 21:06:23.320740,0 days 00:00:00.803836,absolute_error,31,sqrt,2,5,best,TPESampler,COMPLETE
967,0.7221749259799802,2025-04-24 21:06:23.120171,2025-04-24 21:06:23.825843,0 days 00:00:00.705672,squared_error,35,sqrt,2,3,best,TPESampler,COMPLETE
968,1.0131068116827324,2025-04-24 21:06:23.330795,2025-04-24 21:06:24.193196,0 days 00:00:00.862401,absolute_error,10,log2,3,9,best,TPESampler,COMPLETE
969,0.9312073070199461,2025-04-24 21:06:23.579244,2025-04-24 21:06:24.536532,0 days 00:00:00.957288,absolute_error,30,sqrt,1,5,best,TPESampler,COMPLETE
970,1.0498076960778187,2025-04-24 21:06:24.180105,2025-04-24 21:06:24.984337,0 days 00:00:00.804232,friedman_mse,31,sqrt,3,5,best,TPESampler,COMPLETE
971,0.856297005325639,2025-04-24 21:06:24.491549,2025-04-24 21:06:25.373947,0 days 00:00:00.882398,absolute_error,28,sqrt,1,2,best,TPESampler,COMPLETE
972,0.9512587673975786,2025-04-24 21:06:24.920852,2025-04-24 21:06:25.704384,0 days 00:00:00.783532,squared_error,26,sqrt,3,11,best,TPESampler,COMPLETE
973,1.1302409528743838,2025-04-24 21:06:25.212395,2025-04-24 21:06:26.208159,0 days 00:00:00.995764,absolute_error,35,sqrt,2,5,best,TPESampler,COMPLETE
974,0.9996424324783258,2025-04-24 21:06:25.643903,2025-04-24 21:06:26.387729,0 days 00:00:00.743826,absolute_error,35,sqrt,2,2,best,TPESampler,COMPLETE
975,0.5872420994323145,2025-04-24 21:06:25.963469,2025-04-24 21:06:26.658662,0 days 00:00:00.695193,absolute_error,35,sqrt,1,2,best,TPESampler,COMPLETE
976,0.9194592887273054,2025-04-24 21:06:26.513179,2025-04-24 21:06:27.505101,0 days 00:00:00.991922,absolute_error,27,sqrt,1,5,best,TPESampler,COMPLETE
977,0.7983821148098718,2025-04-24 21:06:26.575949,2025-04-24 21:06:27.482133,0 days 00:00:00.906184,friedman_mse,25,sqrt,1,2,best,TPESampler,COMPLETE
978,1.3679729947669532,2025-04-24 21:06:27.010693,2025-04-24 21:06:27.814828,0 days 00:00:00.804135,friedman_mse,22,log2,9,18,random,TPESampler,COMPLETE
979,0.6755787793007089,2025-04-24 21:06:27.712878,2025-04-24 21:06:28.547727,0 days 00:00:00.834849,absolute_error,35,sqrt,1,5,best,TPESampler,COMPLETE
980,1.2076965740491883,2025-04-24 21:06:27.772682,2025-04-24 21:06:28.603943,0 days 00:00:00.831261,absolute_error,28,sqrt,3,2,best,TPESampler,COMPLETE
981,0.856297005325639,2025-04-24 21:06:28.246502,2025-04-24 21:06:28.987714,0 days 00:00:00.741212,absolute_error,28,sqrt,1,2,best,TPESampler,COMPLETE
982,1.2076965740491883,2025-04-24 21:06:28.752045,2025-04-24 21:06:29.579483,0 days 00:00:00.827438,absolute_error,35,sqrt,3,2,best,TPESampler,COMPLETE
983,0.7495346713750386,2025-04-24 21:06:28.807862,2025-04-24 21:06:29.739919,0 days 00:00:00.932057,absolute_error,30,sqrt,1,2,best,TPESampler,COMPLETE
984,0.9996424324783258,2025-04-24 21:06:29.500313,2025-04-24 21:06:30.396904,0 days 00:00:00.896591,absolute_error,24,sqrt,2,2,best,TPESampler,COMPLETE
985,0.5682124588118789,2025-04-24 21:06:29.838420,2025-04-24 21:06:30.854802,0 days 00:00:01.016382,absolute_error,27,sqrt,1,2,best,TPESampler,COMPLETE
986,0.7033595174659969,2025-04-24 21:06:30.001606,2025-04-24 21:06:30.929328,0 days 00:00:00.927722,absolute_error,28,sqrt,1,5,best,TPESampler,COMPLETE
987,0.856297005325639,2025-04-24 21:06:30.752910,2025-04-24 21:06:31.681590,0 days 00:00:00.928680,absolute_error,28,sqrt,1,2,best,TPESampler,COMPLETE
988,0.5542791023918845,2025-04-24 21:06:31.104749,2025-04-24 21:06:32.027769,0 days 00:00:00.923020,absolute_error,31,sqrt,1,2,best,TPESampler,COMPLETE
989,1.1302409528743838,2025-04-24 21:06:31.145421,2025-04-24 21:06:32.000782,0 days 00:00:00.855361,absolute_error,31,sqrt,2,5,best,TPESampler,COMPLETE
990,1.335711393574172,2025-04-24 21:06:31.951822,2025-04-24 21:06:32.816687,0 days 00:00:00.864865,absolute_error,26,sqrt,3,6,random,TPESampler,COMPLETE
991,0.5872420994323145,2025-04-24 21:06:32.252826,2025-04-24 21:06:33.258538,0 days 00:00:01.005712,absolute_error,35,sqrt,1,2,best,TPESampler,COMPLETE
992,0.7221749259799802,2025-04-24 21:06:32.303280,2025-04-24 21:06:33.221552,0 days 00:00:00.918272,friedman_mse,35,sqrt,2,2,best,TPESampler,COMPLETE
993,0.721368937134416,2025-04-24 21:06:33.042339,2025-04-24 21:06:33.700522,0 days 00:00:00.658183,absolute_error,27,log2,1,4,best,TPESampler,COMPLETE
994,1.1302409528743838,2025-04-24 21:06:33.442829,2025-04-24 21:06:34.277986,0 days 00:00:00.835157,absolute_error,31,sqrt,2,5,best,TPESampler,COMPLETE
995,0.6288399089804382,2025-04-24 21:06:33.494810,2025-04-24 21:06:34.429541,0 days 00:00:00.934731,absolute_error,31,sqrt,1,5,best,TPESampler,COMPLETE
996,1.3679729947669532,2025-04-24 21:06:33.995893,2025-04-24 21:06:34.762656,0 days 00:00:00.766763,squared_error,15,log2,9,20,random,TPESampler,COMPLETE
997,0.5542791023918845,2025-04-24 21:06:34.489258,2025-04-24 21:06:35.389830,0 days 00:00:00.900572,absolute_error,31,sqrt,1,2,best,TPESampler,COMPLETE
998,1.2076965740491883,2025-04-24 21:06:34.699262,2025-04-24 21:06:35.535790,0 days 00:00:00.836528,absolute_error,29,sqrt,3,2,best,TPESampler,COMPLETE
999,1.0407913578173011,2025-04-24 21:06:35.026694,2025-04-24 21:06:35.895418,0 days 00:00:00.868724,absolute_error,21,sqrt,2,7,best,TPESampler,COMPLETE
1000,1.3591173522042397,2025-04-24 21:06:35.606499,2025-04-24 21:06:36.397116,0 days 00:00:00.790617,squared_error,7,sqrt,8,7,best,TPESampler,COMPLETE
