number,value,datetime_start,datetime_complete,duration,params_criterion,params_max_depth,params_max_features,params_min_samples_leaf,params_min_samples_split,params_splitter,system_attrs_auto:sampler,state
2134,0.814387570271266,2025-04-24 21:14:31.026307,2025-04-24 21:14:32.001308,0 days 00:00:00.975001,absolute_error,23,sqrt,1,2,random,TPESampler,COMPLETE
2135,1.2119861239647682,2025-04-24 21:14:31.908689,2025-04-24 21:14:32.964003,0 days 00:00:01.055314,absolute_error,29,sqrt,1,2,random,TPESampler,COMPLETE
2136,1.335711393574172,2025-04-24 21:14:31.953417,2025-04-24 21:14:32.996373,0 days 00:00:01.042956,absolute_error,34,sqrt,3,2,random,TPESampler,COMPLETE
2137,1.335711393574172,2025-04-24 21:14:32.520187,2025-04-24 21:14:33.287082,0 days 00:00:00.766895,absolute_error,33,sqrt,3,2,random,TPESampler,COMPLETE
2138,1.2119861239647682,2025-04-24 21:14:33.250580,2025-04-24 21:14:34.325767,0 days 00:00:01.075187,absolute_error,29,sqrt,1,2,random,TPESampler,COMPLETE
2139,1.2741490090538539,2025-04-24 21:14:33.285542,2025-04-24 21:14:34.337740,0 days 00:00:01.052198,absolute_error,28,sqrt,1,2,random,TPESampler,COMPLETE
2140,0.743600828343223,2025-04-24 21:14:34.015795,2025-04-24 21:14:34.866682,0 days 00:00:00.850887,absolute_error,31,sqrt,1,5,random,TPESampler,COMPLETE
2141,1.335711393574172,2025-04-24 21:14:34.537288,2025-04-24 21:14:35.454672,0 days 00:00:00.917384,absolute_error,26,sqrt,3,4,random,TPESampler,COMPLETE
2142,1.335711393574172,2025-04-24 21:14:34.582721,2025-04-24 21:14:35.550969,0 days 00:00:00.968248,absolute_error,28,sqrt,3,2,random,TPESampler,COMPLETE
2143,0.6785347225984457,2025-04-24 21:14:35.254494,2025-04-24 21:14:36.231274,0 days 00:00:00.976780,absolute_error,35,sqrt,1,5,random,TPESampler,COMPLETE
2144,0.6234752034897817,2025-04-24 21:14:35.727888,2025-04-24 21:14:36.742798,0 days 00:00:01.014910,absolute_error,34,sqrt,1,2,random,TPESampler,COMPLETE
2145,0.743600828343223,2025-04-24 21:14:35.862363,2025-04-24 21:14:36.828755,0 days 00:00:00.966392,absolute_error,31,sqrt,1,5,random,TPESampler,COMPLETE
2146,0.6964980049699784,2025-04-24 21:14:36.569751,2025-04-24 21:14:37.373690,0 days 00:00:00.803939,absolute_error,33,sqrt,1,2,random,TPESampler,COMPLETE
2147,0.6234752034897817,2025-04-24 21:14:36.993165,2025-04-24 21:14:38.148773,0 days 00:00:01.155608,absolute_error,34,sqrt,1,2,random,TPESampler,COMPLETE
2148,1.335711393574172,2025-04-24 21:14:37.038979,2025-04-24 21:14:38.147080,0 days 00:00:01.108101,absolute_error,30,sqrt,3,2,random,TPESampler,COMPLETE
2149,1.0936056961204568,2025-04-24 21:14:37.678163,2025-04-24 21:14:38.548536,0 days 00:00:00.870373,friedman_mse,29,sqrt,1,5,random,TPESampler,COMPLETE
2150,1.005467895307365,2025-04-24 21:14:38.493948,2025-04-24 21:14:39.523089,0 days 00:00:01.029141,absolute_error,31,sqrt,1,2,random,TPESampler,COMPLETE
2151,1.2741490090538539,2025-04-24 21:14:38.540754,2025-04-24 21:14:39.662283,0 days 00:00:01.121529,absolute_error,28,sqrt,1,2,random,TPESampler,COMPLETE
2152,1.3187513250101375,2025-04-24 21:14:39.254408,2025-04-24 21:14:40.084410,0 days 00:00:00.830002,absolute_error,35,sqrt,2,2,random,TPESampler,COMPLETE
2153,1.39690460665991,2025-04-24 21:14:39.815983,2025-04-24 21:14:40.761172,0 days 00:00:00.945189,absolute_error,26,log2,3,2,random,TPESampler,COMPLETE
2154,1.335711393574172,2025-04-24 21:14:39.892896,2025-04-24 21:14:41.118936,0 days 00:00:01.226040,absolute_error,33,sqrt,3,5,random,TPESampler,COMPLETE
2155,1.2482047264307685,2025-04-24 21:14:40.422800,2025-04-24 21:14:41.248261,0 days 00:00:00.825461,absolute_error,24,sqrt,1,5,random,TPESampler,COMPLETE
2156,1.114909371722551,2025-04-24 21:14:41.110536,2025-04-24 21:14:41.898076,0 days 00:00:00.787540,absolute_error,35,sqrt,1,2,random,TPESampler,COMPLETE
2157,1.335711393574172,2025-04-24 21:14:41.356360,2025-04-24 21:14:42.453936,0 days 00:00:01.097576,absolute_error,35,sqrt,3,2,random,TPESampler,COMPLETE
2158,0.6785347225984457,2025-04-24 21:14:41.570355,2025-04-24 21:14:42.550665,0 days 00:00:00.980310,absolute_error,35,sqrt,1,5,random,TPESampler,COMPLETE
2159,1.3182621955384042,2025-04-24 21:14:42.274166,2025-04-24 21:14:43.079988,0 days 00:00:00.805822,absolute_error,30,sqrt,2,5,random,TPESampler,COMPLETE
2160,1.3187513250101375,2025-04-24 21:14:42.711588,2025-04-24 21:14:43.721615,0 days 00:00:01.010027,absolute_error,29,sqrt,2,2,random,TPESampler,COMPLETE
2161,1.3187513250101375,2025-04-24 21:14:42.931597,2025-04-24 21:14:43.876675,0 days 00:00:00.945078,absolute_error,27,sqrt,2,2,random,TPESampler,COMPLETE
2162,1.2675211112043427,2025-04-24 21:14:43.366734,2025-04-24 21:14:44.261882,0 days 00:00:00.895148,squared_error,34,sqrt,4,2,random,TPESampler,COMPLETE
2163,0.9860869366393894,2025-04-24 21:14:44.003619,2025-04-24 21:14:44.888116,0 days 00:00:00.884497,absolute_error,30,sqrt,1,2,random,TPESampler,COMPLETE
2164,1.005467895307365,2025-04-24 21:14:44.094717,2025-04-24 21:14:45.071967,0 days 00:00:00.977250,absolute_error,31,sqrt,1,2,random,TPESampler,COMPLETE
2165,1.1762267009527727,2025-04-24 21:14:44.586482,2025-04-24 21:14:45.346267,0 days 00:00:00.759785,squared_error,29,sqrt,2,2,random,TPESampler,COMPLETE
2166,1.2482047264307685,2025-04-24 21:14:45.304160,2025-04-24 21:14:46.545263,0 days 00:00:01.241103,absolute_error,24,sqrt,1,5,random,TPESampler,COMPLETE
2167,1.2168800208288038,2025-04-24 21:14:45.353466,2025-04-24 21:14:46.398127,0 days 00:00:01.044661,absolute_error,27,sqrt,1,2,random,TPESampler,COMPLETE
2168,0.5517216241439309,2025-04-24 21:14:45.574994,2025-04-24 21:14:46.609833,0 days 00:00:01.034839,absolute_error,32,sqrt,1,2,random,TPESampler,COMPLETE
2169,1.3182621955384042,2025-04-24 21:14:46.708491,2025-04-24 21:14:48.023128,0 days 00:00:01.314637,absolute_error,31,sqrt,2,5,random,TPESampler,COMPLETE
2170,1.335711393574172,2025-04-24 21:14:46.807743,2025-04-24 21:14:47.713878,0 days 00:00:00.906135,absolute_error,31,sqrt,3,5,random,TPESampler,COMPLETE
2171,1.0619702795778294,2025-04-24 21:14:46.923266,2025-04-24 21:14:48.020417,0 days 00:00:01.097151,squared_error,28,sqrt,1,6,random,TPESampler,COMPLETE
2172,1.3187513250101375,2025-04-24 21:14:47.981676,2025-04-24 21:14:48.979133,0 days 00:00:00.997457,absolute_error,35,sqrt,2,2,random,TPESampler,COMPLETE
2173,0.6750005427680865,2025-04-24 21:14:48.351037,2025-04-24 21:14:49.414645,0 days 00:00:01.063608,absolute_error,30,sqrt,1,5,random,TPESampler,COMPLETE
2174,1.0297478661477455,2025-04-24 21:14:48.399198,2025-04-24 21:14:49.406464,0 days 00:00:01.007266,absolute_error,32,sqrt,1,5,random,TPESampler,COMPLETE
2175,1.3187513250101375,2025-04-24 21:14:49.256325,2025-04-24 21:14:50.027593,0 days 00:00:00.771268,absolute_error,27,sqrt,2,2,random,TPESampler,COMPLETE
2176,1.3582303073334094,2025-04-24 21:14:49.679921,2025-04-24 21:14:50.877586,0 days 00:00:01.197665,absolute_error,35,log2,1,3,random,TPESampler,COMPLETE
2177,1.005467895307365,2025-04-24 21:14:49.732093,2025-04-24 21:14:50.875658,0 days 00:00:01.143565,absolute_error,31,sqrt,1,2,random,TPESampler,COMPLETE
2178,1.114909371722551,2025-04-24 21:14:50.334333,2025-04-24 21:14:51.376595,0 days 00:00:01.042262,absolute_error,35,sqrt,1,2,random,TPESampler,COMPLETE
2179,1.3187513250101375,2025-04-24 21:14:51.247777,2025-04-24 21:14:52.257693,0 days 00:00:01.009916,absolute_error,29,sqrt,2,2,random,TPESampler,COMPLETE
2180,0.9860869366393894,2025-04-24 21:14:51.335158,2025-04-24 21:14:52.374844,0 days 00:00:01.039686,absolute_error,30,sqrt,1,2,random,TPESampler,COMPLETE
2181,0.8276417230085414,2025-04-24 21:14:51.890110,2025-04-24 21:14:52.750804,0 days 00:00:00.860694,absolute_error,31,sqrt,1,10,random,TPESampler,COMPLETE
2182,1.1762267009527727,2025-04-24 21:14:52.560720,2025-04-24 21:14:53.476459,0 days 00:00:00.915739,squared_error,35,sqrt,2,2,random,TPESampler,COMPLETE
2183,1.1725983074554982,2025-04-24 21:14:52.619967,2025-04-24 21:14:53.643940,0 days 00:00:01.023973,squared_error,18,sqrt,3,4,random,TPESampler,COMPLETE
2184,1.114909371722551,2025-04-24 21:14:53.097160,2025-04-24 21:14:53.975767,0 days 00:00:00.878607,absolute_error,35,sqrt,1,2,random,TPESampler,COMPLETE
2185,1.335711393574172,2025-04-24 21:14:53.904070,2025-04-24 21:14:54.877921,0 days 00:00:00.973851,absolute_error,30,sqrt,3,4,random,TPESampler,COMPLETE
2186,1.335711393574172,2025-04-24 21:14:53.943761,2025-04-24 21:14:55.238976,0 days 00:00:01.295215,absolute_error,31,sqrt,3,2,random,TPESampler,COMPLETE
2187,1.233261715540308,2025-04-24 21:14:54.270256,2025-04-24 21:14:55.273554,0 days 00:00:01.003298,absolute_error,29,sqrt,1,6,random,TPESampler,COMPLETE
2188,0.6750005427680865,2025-04-24 21:14:55.174687,2025-04-24 21:14:56.330840,0 days 00:00:01.156153,absolute_error,30,sqrt,1,5,random,TPESampler,COMPLETE
2189,0.6785347225984457,2025-04-24 21:14:55.588573,2025-04-24 21:14:56.811568,0 days 00:00:01.222995,absolute_error,35,sqrt,1,5,random,TPESampler,COMPLETE
2190,1.2168800208288038,2025-04-24 21:14:55.647501,2025-04-24 21:14:56.730981,0 days 00:00:01.083480,absolute_error,27,sqrt,1,2,random,TPESampler,COMPLETE
2191,1.3187513250101375,2025-04-24 21:14:56.639151,2025-04-24 21:14:57.425325,0 days 00:00:00.786174,absolute_error,29,sqrt,2,2,random,TPESampler,COMPLETE
2192,0.9799994516512941,2025-04-24 21:14:56.943033,2025-04-24 21:14:57.923632,0 days 00:00:00.980599,squared_error,31,sqrt,1,2,random,TPESampler,COMPLETE
2193,1.0297478661477455,2025-04-24 21:14:57.093619,2025-04-24 21:14:58.268442,0 days 00:00:01.174823,absolute_error,32,sqrt,1,5,random,TPESampler,COMPLETE
2194,1.4137864129741968,2025-04-24 21:14:57.902316,2025-04-24 21:14:58.933594,0 days 00:00:01.031278,absolute_error,1,sqrt,3,14,random,TPESampler,COMPLETE
2195,1.114909371722551,2025-04-24 21:14:58.232807,2025-04-24 21:14:59.136231,0 days 00:00:00.903424,absolute_error,35,sqrt,1,2,random,TPESampler,COMPLETE
2196,0.6577569118528691,2025-04-24 21:14:58.575206,2025-04-24 21:14:59.436092,0 days 00:00:00.860886,friedman_mse,29,sqrt,1,2,random,TPESampler,COMPLETE
2197,0.9860869366393894,2025-04-24 21:14:59.325813,2025-04-24 21:15:00.400642,0 days 00:00:01.074829,absolute_error,30,sqrt,1,2,random,TPESampler,COMPLETE
2198,1.335711393574172,2025-04-24 21:14:59.398502,2025-04-24 21:15:00.395074,0 days 00:00:00.996572,absolute_error,35,sqrt,3,2,random,TPESampler,COMPLETE
2199,0.5517216241439309,2025-04-24 21:14:59.987436,2025-04-24 21:15:00.885140,0 days 00:00:00.897704,absolute_error,32,sqrt,1,2,random,TPESampler,COMPLETE
2200,0.6964980049699784,2025-04-24 21:15:00.683738,2025-04-24 21:15:01.942494,0 days 00:00:01.258756,absolute_error,33,sqrt,1,2,random,TPESampler,COMPLETE
2201,1.335711393574172,2025-04-24 21:15:00.741036,2025-04-24 21:15:01.861295,0 days 00:00:01.120259,absolute_error,35,sqrt,3,4,random,TPESampler,COMPLETE
2202,0.9860869366393894,2025-04-24 21:15:01.253050,2025-04-24 21:15:02.457464,0 days 00:00:01.204414,absolute_error,30,sqrt,1,2,random,TPESampler,COMPLETE
2203,1.3679729947669532,2025-04-24 21:15:02.099589,2025-04-24 21:15:03.264937,0 days 00:00:01.165348,friedman_mse,4,log2,10,17,random,TPESampler,COMPLETE
2204,1.3267117987075143,2025-04-24 21:15:02.169545,2025-04-24 21:15:03.255804,0 days 00:00:01.086259,absolute_error,25,sqrt,1,5,random,TPESampler,COMPLETE
2205,1.2741490090538539,2025-04-24 21:15:02.904458,2025-04-24 21:15:03.949226,0 days 00:00:01.044768,absolute_error,28,sqrt,1,2,random,TPESampler,COMPLETE
2206,0.6750005427680865,2025-04-24 21:15:03.576183,2025-04-24 21:15:04.743088,0 days 00:00:01.166905,absolute_error,30,sqrt,1,5,random,TPESampler,COMPLETE
2207,0.7464085682144045,2025-04-24 21:15:03.630815,2025-04-24 21:15:04.751612,0 days 00:00:01.120797,absolute_error,28,sqrt,1,5,random,TPESampler,COMPLETE
2208,1.114909371722551,2025-04-24 21:15:04.261992,2025-04-24 21:15:05.171217,0 days 00:00:00.909225,absolute_error,35,sqrt,1,2,random,TPESampler,COMPLETE
2209,1.335711393574172,2025-04-24 21:15:05.118944,2025-04-24 21:15:06.234238,0 days 00:00:01.115294,absolute_error,31,sqrt,3,2,random,TPESampler,COMPLETE
2210,1.335711393574172,2025-04-24 21:15:05.159823,2025-04-24 21:15:06.265783,0 days 00:00:01.105960,absolute_error,25,sqrt,3,5,random,TPESampler,COMPLETE
2211,1.2119861239647682,2025-04-24 21:15:05.862885,2025-04-24 21:15:06.882188,0 days 00:00:01.019303,absolute_error,29,sqrt,1,2,random,TPESampler,COMPLETE
2212,1.0458376878339173,2025-04-24 21:15:06.787396,2025-04-24 21:15:07.764641,0 days 00:00:00.977245,absolute_error,24,sqrt,1,2,random,TPESampler,COMPLETE
2213,0.6750005427680865,2025-04-24 21:15:06.838509,2025-04-24 21:15:08.077706,0 days 00:00:01.239197,absolute_error,30,sqrt,1,5,random,TPESampler,COMPLETE
2214,1.3187513250101375,2025-04-24 21:15:07.190474,2025-04-24 21:15:08.044871,0 days 00:00:00.854397,absolute_error,35,sqrt,2,2,random,TPESampler,COMPLETE
2215,1.114909371722551,2025-04-24 21:15:07.996841,2025-04-24 21:15:08.877308,0 days 00:00:00.880467,absolute_error,35,sqrt,1,2,random,TPESampler,COMPLETE
2216,1.3187513250101375,2025-04-24 21:15:08.315947,2025-04-24 21:15:09.612344,0 days 00:00:01.296397,absolute_error,31,sqrt,2,2,random,TPESampler,COMPLETE
2217,1.3182621955384042,2025-04-24 21:15:08.419786,2025-04-24 21:15:09.622520,0 days 00:00:01.202734,absolute_error,33,sqrt,2,5,random,TPESampler,COMPLETE
2218,0.5517216241439309,2025-04-24 21:15:09.173272,2025-04-24 21:15:09.977433,0 days 00:00:00.804161,absolute_error,32,sqrt,1,2,random,TPESampler,COMPLETE
2219,0.9860869366393894,2025-04-24 21:15:09.829804,2025-04-24 21:15:10.662265,0 days 00:00:00.832461,absolute_error,30,sqrt,1,2,random,TPESampler,COMPLETE
2220,1.3643945219641105,2025-04-24 21:15:10.075221,2025-04-24 21:15:11.067275,0 days 00:00:00.992054,absolute_error,34,log2,1,6,random,TPESampler,COMPLETE
2221,1.335711393574172,2025-04-24 21:15:10.217286,2025-04-24 21:15:11.235490,0 days 00:00:01.018204,absolute_error,27,sqrt,3,5,random,TPESampler,COMPLETE
2222,1.2119861239647682,2025-04-24 21:15:10.995824,2025-04-24 21:15:11.900819,0 days 00:00:00.904995,absolute_error,29,sqrt,1,2,random,TPESampler,COMPLETE
2223,0.6785347225984457,2025-04-24 21:15:11.299528,2025-04-24 21:15:12.414235,0 days 00:00:01.114707,absolute_error,35,sqrt,1,5,random,TPESampler,COMPLETE
2224,0.6785347225984457,2025-04-24 21:15:11.484977,2025-04-24 21:15:12.582236,0 days 00:00:01.097259,absolute_error,35,sqrt,1,5,random,TPESampler,COMPLETE
2225,0.7367734144772758,2025-04-24 21:15:12.218360,2025-04-24 21:15:12.968762,0 days 00:00:00.750402,absolute_error,29,sqrt,1,5,random,TPESampler,COMPLETE
2226,0.6750005427680865,2025-04-24 21:15:12.673973,2025-04-24 21:15:13.624846,0 days 00:00:00.950873,absolute_error,30,sqrt,1,5,random,TPESampler,COMPLETE
2227,1.3187513250101375,2025-04-24 21:15:12.829909,2025-04-24 21:15:13.813865,0 days 00:00:00.983956,absolute_error,27,sqrt,2,2,random,TPESampler,COMPLETE
2228,1.3187513250101375,2025-04-24 21:15:13.318430,2025-04-24 21:15:14.122845,0 days 00:00:00.804415,absolute_error,29,sqrt,2,2,random,TPESampler,COMPLETE
2229,1.3187513250101375,2025-04-24 21:15:13.867742,2025-04-24 21:15:15.133473,0 days 00:00:01.265731,absolute_error,31,sqrt,2,2,random,TPESampler,COMPLETE
2230,0.7885853385218138,2025-04-24 21:15:14.114518,2025-04-24 21:15:15.054610,0 days 00:00:00.940092,friedman_mse,33,sqrt,1,3,random,TPESampler,COMPLETE
2231,1.2119861239647682,2025-04-24 21:15:14.435442,2025-04-24 21:15:15.427751,0 days 00:00:00.992309,absolute_error,29,sqrt,1,2,random,TPESampler,COMPLETE
2232,1.335711393574172,2025-04-24 21:15:15.393909,2025-04-24 21:15:16.478810,0 days 00:00:01.084901,absolute_error,27,sqrt,3,2,random,TPESampler,COMPLETE
2233,1.4099363199826813,2025-04-24 21:15:15.434850,2025-04-24 21:15:16.550560,0 days 00:00:01.115710,absolute_error,3,log2,5,19,random,TPESampler,COMPLETE
2234,0.9860869366393894,2025-04-24 21:15:15.655829,2025-04-24 21:15:16.727116,0 days 00:00:01.071287,absolute_error,30,sqrt,1,2,random,TPESampler,COMPLETE
2235,0.6785347225984457,2025-04-24 21:15:16.697903,2025-04-24 21:15:17.785897,0 days 00:00:01.087994,absolute_error,35,sqrt,1,5,random,TPESampler,COMPLETE
2236,1.3203741211150226,2025-04-24 21:15:16.806451,2025-04-24 21:15:17.948019,0 days 00:00:01.141568,friedman_mse,35,log2,2,5,random,TPESampler,COMPLETE
2237,0.5517216241439309,2025-04-24 21:15:17.440634,2025-04-24 21:15:18.378177,0 days 00:00:00.937543,absolute_error,32,sqrt,1,2,random,TPESampler,COMPLETE
2238,1.3679729947669532,2025-04-24 21:15:18.142447,2025-04-24 21:15:18.997271,0 days 00:00:00.854824,friedman_mse,1,log2,6,4,random,TPESampler,COMPLETE
2239,1.3187513250101375,2025-04-24 21:15:18.212023,2025-04-24 21:15:19.331174,0 days 00:00:01.119151,absolute_error,33,sqrt,2,2,random,TPESampler,COMPLETE
2240,1.114909371722551,2025-04-24 21:15:18.690670,2025-04-24 21:15:19.561641,0 days 00:00:00.870971,absolute_error,35,sqrt,1,2,random,TPESampler,COMPLETE
2241,1.335711393574172,2025-04-24 21:15:19.272463,2025-04-24 21:15:20.020645,0 days 00:00:00.748182,absolute_error,29,sqrt,3,5,random,TPESampler,COMPLETE
2242,1.1708790545094125,2025-04-24 21:15:19.678433,2025-04-24 21:15:20.670198,0 days 00:00:00.991765,squared_error,34,log2,1,3,random,TPESampler,COMPLETE
2243,1.3627626176744154,2025-04-24 21:15:19.859665,2025-04-24 21:15:20.843005,0 days 00:00:00.983340,absolute_error,31,log2,1,2,random,TPESampler,COMPLETE
2244,0.5517216241439309,2025-04-24 21:15:20.352156,2025-04-24 21:15:21.216710,0 days 00:00:00.864554,absolute_error,32,sqrt,1,2,random,TPESampler,COMPLETE
2245,1.005467895307365,2025-04-24 21:15:20.898757,2025-04-24 21:15:21.915674,0 days 00:00:01.016917,absolute_error,31,sqrt,1,2,random,TPESampler,COMPLETE
2246,1.335711393574172,2025-04-24 21:15:21.086318,2025-04-24 21:15:22.163051,0 days 00:00:01.076733,absolute_error,35,sqrt,3,5,random,TPESampler,COMPLETE
2247,1.005467895307365,2025-04-24 21:15:21.492444,2025-04-24 21:15:22.559098,0 days 00:00:01.066654,absolute_error,31,sqrt,1,2,random,TPESampler,COMPLETE
2248,1.335711393574172,2025-04-24 21:15:22.210207,2025-04-24 21:15:23.215146,0 days 00:00:01.004939,absolute_error,35,sqrt,3,2,random,TPESampler,COMPLETE
2249,0.6785347225984457,2025-04-24 21:15:22.431262,2025-04-24 21:15:23.384868,0 days 00:00:00.953606,absolute_error,35,sqrt,1,5,random,TPESampler,COMPLETE
2250,0.8356479176587005,2025-04-24 21:15:22.819857,2025-04-24 21:15:23.770696,0 days 00:00:00.950839,absolute_error,26,sqrt,1,5,random,TPESampler,COMPLETE
2251,1.3677569516816517,2025-04-24 21:15:23.597453,2025-04-24 21:15:24.843040,0 days 00:00:01.245587,friedman_mse,4,log2,10,6,best,TPESampler,COMPLETE
2252,1.3187513250101375,2025-04-24 21:15:23.653252,2025-04-24 21:15:24.780507,0 days 00:00:01.127255,absolute_error,31,sqrt,2,2,random,TPESampler,COMPLETE
2253,1.3187513250101375,2025-04-24 21:15:24.115111,2025-04-24 21:15:25.049098,0 days 00:00:00.933987,absolute_error,28,sqrt,2,2,random,TPESampler,COMPLETE
2254,1.114909371722551,2025-04-24 21:15:24.998932,2025-04-24 21:15:25.972551,0 days 00:00:00.973619,absolute_error,35,sqrt,1,2,random,TPESampler,COMPLETE
2255,1.2168800208288038,2025-04-24 21:15:25.109607,2025-04-24 21:15:26.179572,0 days 00:00:01.069965,absolute_error,27,sqrt,1,2,random,TPESampler,COMPLETE
2256,0.6750005427680865,2025-04-24 21:15:25.608118,2025-04-24 21:15:26.571087,0 days 00:00:00.962969,absolute_error,30,sqrt,1,5,random,TPESampler,COMPLETE
2257,0.6785347225984457,2025-04-24 21:15:26.401565,2025-04-24 21:15:27.489280,0 days 00:00:01.087715,absolute_error,35,sqrt,1,5,random,TPESampler,COMPLETE
2258,1.1725983074554982,2025-04-24 21:15:26.472401,2025-04-24 21:15:27.701947,0 days 00:00:01.229546,friedman_mse,34,sqrt,3,2,random,TPESampler,COMPLETE
2259,0.5517216241439309,2025-04-24 21:15:26.870908,2025-04-24 21:15:27.828139,0 days 00:00:00.957231,absolute_error,32,sqrt,1,2,random,TPESampler,COMPLETE
2260,0.5517216241439309,2025-04-24 21:15:27.757771,2025-04-24 21:15:28.546325,0 days 00:00:00.788554,absolute_error,32,sqrt,1,2,random,TPESampler,COMPLETE
2261,1.114909371722551,2025-04-24 21:15:27.994607,2025-04-24 21:15:29.167369,0 days 00:00:01.172762,absolute_error,35,sqrt,1,2,random,TPESampler,COMPLETE
2262,1.39690460665991,2025-04-24 21:15:28.181434,2025-04-24 21:15:29.182579,0 days 00:00:01.001145,absolute_error,35,log2,3,2,random,TPESampler,COMPLETE
2263,0.6750005427680865,2025-04-24 21:15:28.878350,2025-04-24 21:15:29.663299,0 days 00:00:00.784949,absolute_error,30,sqrt,1,5,random,TPESampler,COMPLETE
2264,1.1763447383239396,2025-04-24 21:15:29.409740,2025-04-24 21:15:30.397634,0 days 00:00:00.987894,absolute_error,25,sqrt,1,2,random,TPESampler,COMPLETE
2265,0.814387570271266,2025-04-24 21:15:29.475737,2025-04-24 21:15:30.576078,0 days 00:00:01.100341,absolute_error,23,sqrt,1,2,random,TPESampler,COMPLETE
2266,0.743600828343223,2025-04-24 21:15:30.223180,2025-04-24 21:15:31.118424,0 days 00:00:00.895244,absolute_error,31,sqrt,1,5,random,TPESampler,COMPLETE
2267,1.335711393574172,2025-04-24 21:15:30.743088,2025-04-24 21:15:31.585399,0 days 00:00:00.842311,absolute_error,32,sqrt,3,2,random,TPESampler,COMPLETE
2268,0.6964980049699784,2025-04-24 21:15:31.003661,2025-04-24 21:15:32.123818,0 days 00:00:01.120157,absolute_error,33,sqrt,1,2,random,TPESampler,COMPLETE
2269,1.3365908817218308,2025-04-24 21:15:31.464852,2025-04-24 21:15:32.466910,0 days 00:00:01.002058,absolute_error,33,sqrt,3,9,random,TPESampler,COMPLETE
2270,1.335711393574172,2025-04-24 21:15:31.864285,2025-04-24 21:15:32.787664,0 days 00:00:00.923379,absolute_error,26,sqrt,3,2,random,TPESampler,COMPLETE
2271,1.3187513250101375,2025-04-24 21:15:32.413539,2025-04-24 21:15:33.503276,0 days 00:00:01.089737,absolute_error,35,sqrt,2,2,random,TPESampler,COMPLETE
2272,0.6964980049699784,2025-04-24 21:15:32.793873,2025-04-24 21:15:33.987121,0 days 00:00:01.193248,absolute_error,33,sqrt,1,2,random,TPESampler,COMPLETE
2273,0.7367734144772758,2025-04-24 21:15:33.090833,2025-04-24 21:15:34.099805,0 days 00:00:01.008972,absolute_error,29,sqrt,1,5,random,TPESampler,COMPLETE
2274,1.335711393574172,2025-04-24 21:15:34.022144,2025-04-24 21:15:35.041232,0 days 00:00:01.019088,absolute_error,30,sqrt,3,2,random,TPESampler,COMPLETE
