number,value,datetime_start,datetime_complete,duration,params_criterion,params_max_depth,params_max_features,params_min_samples_leaf,params_min_samples_split,params_splitter,system_attrs_auto:sampler,state
1143,0.5872420994323145,2025-04-24 21:07:29.747577,2025-04-24 21:07:30.547390,0 days 00:00:00.799813,absolute_error,35,sqrt,1,2,best,TPESampler,COMPLETE
1144,1.4203183267161783,2025-04-24 21:07:30.066184,2025-04-24 21:07:31.031637,0 days 00:00:00.965453,absolute_error,21,sqrt,6,20,best,TPESampler,COMPLETE
1145,1.2076965740491883,2025-04-24 21:07:30.267101,2025-04-24 21:07:31.104637,0 days 00:00:00.837536,absolute_error,31,sqrt,3,2,best,TPESampler,COMPLETE
1146,1.2076965740491883,2025-04-24 21:07:30.837278,2025-04-24 21:07:31.900675,0 days 00:00:01.063397,absolute_error,25,sqrt,3,2,best,TPESampler,COMPLETE
1147,0.9996424324783258,2025-04-24 21:07:31.266633,2025-04-24 21:07:32.164844,0 days 00:00:00.898211,absolute_error,28,sqrt,2,2,best,TPESampler,COMPLETE
1148,1.4138971746431086,2025-04-24 21:07:31.430985,2025-04-24 21:07:32.348478,0 days 00:00:00.917493,absolute_error,18,log2,8,2,best,TPESampler,COMPLETE
1149,0.6540510953786189,2025-04-24 21:07:32.163517,2025-04-24 21:07:32.901330,0 days 00:00:00.737813,absolute_error,29,sqrt,1,5,best,TPESampler,COMPLETE
1150,0.9860869366393894,2025-04-24 21:07:32.395149,2025-04-24 21:07:33.292869,0 days 00:00:00.897720,absolute_error,30,sqrt,1,2,random,TPESampler,COMPLETE
1151,1.0301807161647192,2025-04-24 21:07:32.762938,2025-04-24 21:07:33.506030,0 days 00:00:00.743092,squared_error,14,sqrt,1,2,random,TPESampler,COMPLETE
1152,0.7225550674205817,2025-04-24 21:07:33.246362,2025-04-24 21:07:34.162902,0 days 00:00:00.916540,absolute_error,35,log2,1,5,best,TPESampler,COMPLETE
1153,0.9194592887273054,2025-04-24 21:07:33.621812,2025-04-24 21:07:34.446244,0 days 00:00:00.824432,absolute_error,27,sqrt,1,5,best,TPESampler,COMPLETE
1154,0.5542791023918845,2025-04-24 21:07:33.775587,2025-04-24 21:07:34.623656,0 days 00:00:00.848069,absolute_error,31,sqrt,1,2,best,TPESampler,COMPLETE
1155,1.3625908614134468,2025-04-24 21:07:34.448406,2025-04-24 21:07:36.051225,0 days 00:00:01.602819,squared_error,31,log2,5,4,random,TPESampler,COMPLETE
1156,0.9996424324783258,2025-04-24 21:07:34.743575,2025-04-24 21:07:36.362220,0 days 00:00:01.618645,absolute_error,26,sqrt,2,2,best,TPESampler,COMPLETE
1157,0.7495346713750386,2025-04-24 21:07:35.420813,2025-04-24 21:07:37.072160,0 days 00:00:01.651347,absolute_error,30,sqrt,1,2,best,TPESampler,COMPLETE
1158,1.1302409528743838,2025-04-24 21:07:36.502741,2025-04-24 21:07:37.405616,0 days 00:00:00.902875,absolute_error,32,sqrt,2,5,best,TPESampler,COMPLETE
1159,0.6864171229196162,2025-04-24 21:07:36.673173,2025-04-24 21:07:37.563769,0 days 00:00:00.890596,absolute_error,33,log2,1,2,best,TPESampler,COMPLETE
1160,1.3677569516816517,2025-04-24 21:07:37.347824,2025-04-24 21:07:38.003031,0 days 00:00:00.655207,squared_error,32,log2,5,8,best,TPESampler,COMPLETE
1161,0.6310502563923985,2025-04-24 21:07:37.679317,2025-04-24 21:07:38.538664,0 days 00:00:00.859347,absolute_error,33,sqrt,1,5,best,TPESampler,COMPLETE
1162,0.6288399089804382,2025-04-24 21:07:37.861468,2025-04-24 21:07:38.842629,0 days 00:00:00.981161,absolute_error,31,sqrt,1,5,best,TPESampler,COMPLETE
1163,0.7495346713750386,2025-04-24 21:07:38.225491,2025-04-24 21:07:38.926972,0 days 00:00:00.701481,absolute_error,30,sqrt,1,2,best,TPESampler,COMPLETE
1164,0.7501745807455008,2025-04-24 21:07:38.854112,2025-04-24 21:07:39.491587,0 days 00:00:00.637475,squared_error,30,sqrt,1,6,best,TPESampler,COMPLETE
1165,0.5542791023918845,2025-04-24 21:07:39.032589,2025-04-24 21:07:39.859660,0 days 00:00:00.827071,absolute_error,31,sqrt,1,2,best,TPESampler,COMPLETE
1166,0.6755787793007089,2025-04-24 21:07:39.185222,2025-04-24 21:07:40.219742,0 days 00:00:01.034520,absolute_error,35,sqrt,1,5,best,TPESampler,COMPLETE
1167,1.2076965740491883,2025-04-24 21:07:39.804664,2025-04-24 21:07:40.580077,0 days 00:00:00.775413,absolute_error,31,sqrt,3,2,best,TPESampler,COMPLETE
1168,0.5713387065834993,2025-04-24 21:07:40.112197,2025-04-24 21:07:40.874822,0 days 00:00:00.762625,absolute_error,25,sqrt,1,2,best,TPESampler,COMPLETE
1169,0.9996424324783258,2025-04-24 21:07:40.476960,2025-04-24 21:07:41.387096,0 days 00:00:00.910136,absolute_error,35,sqrt,2,2,best,TPESampler,COMPLETE
1170,0.666729144139305,2025-04-24 21:07:40.834205,2025-04-24 21:07:41.585379,0 days 00:00:00.751174,absolute_error,24,sqrt,1,5,best,TPESampler,COMPLETE
1171,0.6112778743973727,2025-04-24 21:07:41.155244,2025-04-24 21:07:41.942799,0 days 00:00:00.787555,absolute_error,29,sqrt,1,2,best,TPESampler,COMPLETE
1172,0.5872420994323145,2025-04-24 21:07:41.738738,2025-04-24 21:07:42.899179,0 days 00:00:01.160441,absolute_error,35,sqrt,1,2,best,TPESampler,COMPLETE
1173,0.8465624319698303,2025-04-24 21:07:41.805445,2025-04-24 21:07:42.655550,0 days 00:00:00.850105,absolute_error,33,sqrt,1,2,best,TPESampler,COMPLETE
1174,0.5542791023918845,2025-04-24 21:07:42.159791,2025-04-24 21:07:42.907398,0 days 00:00:00.747607,absolute_error,31,sqrt,1,2,best,TPESampler,COMPLETE
1175,1.4148597056909755,2025-04-24 21:07:42.861634,2025-04-24 21:07:43.455830,0 days 00:00:00.594196,absolute_error,1,log2,9,7,random,TPESampler,COMPLETE
1176,0.9194592887273054,2025-04-24 21:07:43.149640,2025-04-24 21:07:44.002289,0 days 00:00:00.852649,absolute_error,27,sqrt,1,5,best,TPESampler,COMPLETE
1177,1.2076965740491883,2025-04-24 21:07:43.186055,2025-04-24 21:07:44.188428,0 days 00:00:01.002373,absolute_error,26,sqrt,3,5,best,TPESampler,COMPLETE
1178,0.825308855024025,2025-04-24 21:07:43.926799,2025-04-24 21:07:44.847574,0 days 00:00:00.920775,friedman_mse,19,sqrt,1,2,best,TPESampler,COMPLETE
1179,1.2076965740491883,2025-04-24 21:07:44.335060,2025-04-24 21:07:45.722556,0 days 00:00:01.387496,absolute_error,31,sqrt,3,2,best,TPESampler,COMPLETE
1180,1.2435539977360384,2025-04-24 21:07:44.588481,2025-04-24 21:07:45.977098,0 days 00:00:01.388617,absolute_error,21,sqrt,1,17,random,TPESampler,COMPLETE
1181,0.5713387065834993,2025-04-24 21:07:45.277151,2025-04-24 21:07:47.181177,0 days 00:00:01.904026,absolute_error,25,sqrt,1,2,best,TPESampler,COMPLETE
1182,0.9312073070199461,2025-04-24 21:07:46.065812,2025-04-24 21:07:47.487196,0 days 00:00:01.421384,absolute_error,30,sqrt,1,5,best,TPESampler,COMPLETE
1183,0.856297005325639,2025-04-24 21:07:46.598940,2025-04-24 21:07:47.968795,0 days 00:00:01.369855,absolute_error,28,sqrt,1,2,best,TPESampler,COMPLETE
1184,1.2728267614075626,2025-04-24 21:07:47.546512,2025-04-24 21:07:49.535665,0 days 00:00:01.989153,squared_error,34,sqrt,7,20,random,TPESampler,COMPLETE
1185,1.4284522321688322,2025-04-24 21:07:47.967402,2025-04-24 21:07:50.375072,0 days 00:00:02.407670,absolute_error,11,sqrt,7,7,best,TPESampler,COMPLETE
1186,1.3679729947669532,2025-04-24 21:07:48.998525,2025-04-24 21:07:50.852366,0 days 00:00:01.853841,friedman_mse,33,log2,9,9,random,TPESampler,COMPLETE
1187,1.1302409528743838,2025-04-24 21:07:50.357669,2025-04-24 21:07:51.923397,0 days 00:00:01.565728,absolute_error,31,sqrt,2,5,best,TPESampler,COMPLETE
1188,1.0498076960778187,2025-04-24 21:07:51.142670,2025-04-24 21:07:52.421252,0 days 00:00:01.278582,friedman_mse,30,sqrt,3,2,best,TPESampler,COMPLETE
1189,1.2076965740491883,2025-04-24 21:07:51.365016,2025-04-24 21:07:52.757065,0 days 00:00:01.392049,absolute_error,29,sqrt,3,2,best,TPESampler,COMPLETE
1190,0.5647532297301866,2025-04-24 21:07:52.336633,2025-04-24 21:07:53.388294,0 days 00:00:01.051661,absolute_error,34,sqrt,1,2,best,TPESampler,COMPLETE
1191,0.7495346713750386,2025-04-24 21:07:52.721472,2025-04-24 21:07:54.230413,0 days 00:00:01.508941,absolute_error,30,sqrt,1,2,best,TPESampler,COMPLETE
1192,1.2076965740491883,2025-04-24 21:07:53.383749,2025-04-24 21:07:54.505775,0 days 00:00:01.122026,absolute_error,35,sqrt,3,2,best,TPESampler,COMPLETE
1193,0.9500378057151307,2025-04-24 21:07:53.898245,2025-04-24 21:07:54.914204,0 days 00:00:01.015959,absolute_error,35,sqrt,4,11,best,TPESampler,COMPLETE
1194,1.4058384605507321,2025-04-24 21:07:54.472908,2025-04-24 21:07:55.647275,0 days 00:00:01.174367,absolute_error,28,sqrt,10,15,best,TPESampler,COMPLETE
1195,1.4058384605507321,2025-04-24 21:07:54.985449,2025-04-24 21:07:56.175791,0 days 00:00:01.190342,absolute_error,14,sqrt,9,14,best,TPESampler,COMPLETE
1196,1.2076965740491883,2025-04-24 21:07:55.266248,2025-04-24 21:07:56.629627,0 days 00:00:01.363379,absolute_error,28,sqrt,3,5,best,TPESampler,COMPLETE
1197,1.3679729947669532,2025-04-24 21:07:56.053775,2025-04-24 21:07:57.249579,0 days 00:00:01.195804,friedman_mse,1,log2,9,8,random,TPESampler,COMPLETE
1198,0.856297005325639,2025-04-24 21:07:56.478781,2025-04-24 21:07:57.740766,0 days 00:00:01.261985,absolute_error,28,sqrt,1,2,best,TPESampler,COMPLETE
1199,0.7063284002837366,2025-04-24 21:07:57.040529,2025-04-24 21:07:58.147916,0 days 00:00:01.107387,absolute_error,34,sqrt,1,5,best,TPESampler,COMPLETE
1200,1.33707615296096,2025-04-24 21:07:57.825033,2025-04-24 21:07:58.763341,0 days 00:00:00.938308,absolute_error,24,sqrt,4,3,random,TPESampler,COMPLETE
1201,0.9194592887273054,2025-04-24 21:07:58.054335,2025-04-24 21:07:58.902010,0 days 00:00:00.847675,absolute_error,27,sqrt,1,5,best,TPESampler,COMPLETE
1202,0.8963165774359542,2025-04-24 21:07:58.384125,2025-04-24 21:07:59.402413,0 days 00:00:01.018288,absolute_error,24,sqrt,1,4,random,TPESampler,COMPLETE
1203,0.7336643688022678,2025-04-24 21:07:58.958101,2025-04-24 21:07:59.734335,0 days 00:00:00.776234,absolute_error,31,sqrt,1,9,best,TPESampler,COMPLETE
1204,0.856297005325639,2025-04-24 21:07:59.198744,2025-04-24 21:08:00.017964,0 days 00:00:00.819220,absolute_error,28,sqrt,1,2,best,TPESampler,COMPLETE
1205,1.2076965740491883,2025-04-24 21:07:59.679907,2025-04-24 21:08:00.544634,0 days 00:00:00.864727,absolute_error,30,sqrt,3,5,best,TPESampler,COMPLETE
1206,1.3677569516816517,2025-04-24 21:08:00.016588,2025-04-24 21:08:00.865519,0 days 00:00:00.848931,squared_error,24,log2,5,2,best,TPESampler,COMPLETE
1207,0.9996424324783258,2025-04-24 21:08:00.327774,2025-04-24 21:08:01.212360,0 days 00:00:00.884586,absolute_error,30,sqrt,2,2,best,TPESampler,COMPLETE
1208,0.6755787793007089,2025-04-24 21:08:00.868801,2025-04-24 21:08:01.680988,0 days 00:00:00.812187,absolute_error,35,sqrt,1,5,best,TPESampler,COMPLETE
1209,0.7495346713750386,2025-04-24 21:08:01.168465,2025-04-24 21:08:02.021226,0 days 00:00:00.852761,absolute_error,30,sqrt,1,2,best,TPESampler,COMPLETE
1210,0.5647532297301866,2025-04-24 21:08:01.502843,2025-04-24 21:08:02.477270,0 days 00:00:00.974427,absolute_error,34,sqrt,1,2,best,TPESampler,COMPLETE
1211,0.9312073070199461,2025-04-24 21:08:01.952650,2025-04-24 21:08:02.813963,0 days 00:00:00.861313,absolute_error,30,sqrt,1,5,best,TPESampler,COMPLETE
1212,1.3679729947669532,2025-04-24 21:08:02.375478,2025-04-24 21:08:03.148544,0 days 00:00:00.773066,squared_error,31,log2,8,18,random,TPESampler,COMPLETE
1213,1.334781507267615,2025-04-24 21:08:02.820092,2025-04-24 21:08:03.729887,0 days 00:00:00.909795,friedman_mse,17,log2,2,14,random,TPESampler,COMPLETE
1214,1.2076965740491883,2025-04-24 21:08:03.018156,2025-04-24 21:08:03.883236,0 days 00:00:00.865080,absolute_error,28,sqrt,3,2,best,TPESampler,COMPLETE
1215,0.9996424324783258,2025-04-24 21:08:03.434206,2025-04-24 21:08:04.158437,0 days 00:00:00.724231,absolute_error,30,sqrt,2,2,best,TPESampler,COMPLETE
1216,0.9579520660564302,2025-04-24 21:08:03.969290,2025-04-24 21:08:04.838935,0 days 00:00:00.869645,friedman_mse,16,sqrt,6,16,best,TPESampler,COMPLETE
1217,1.3297833838322575,2025-04-24 21:08:04.122721,2025-04-24 21:08:05.066724,0 days 00:00:00.944003,squared_error,21,log2,2,7,random,TPESampler,COMPLETE
1218,0.7518416819516345,2025-04-24 21:08:04.438174,2025-04-24 21:08:05.210020,0 days 00:00:00.771846,friedman_mse,30,sqrt,1,7,random,TPESampler,COMPLETE
1219,1.3243604777594438,2025-04-24 21:08:05.143672,2025-04-24 21:08:05.833316,0 days 00:00:00.689644,friedman_mse,25,log2,2,5,random,TPESampler,COMPLETE
1220,0.7136356355134803,2025-04-24 21:08:05.335886,2025-04-24 21:08:06.289142,0 days 00:00:00.953256,friedman_mse,29,sqrt,1,4,best,TPESampler,COMPLETE
1221,0.5713387065834993,2025-04-24 21:08:05.668651,2025-04-24 21:08:06.618066,0 days 00:00:00.949415,absolute_error,25,sqrt,1,2,best,TPESampler,COMPLETE
1222,1.0498076960778187,2025-04-24 21:08:06.227476,2025-04-24 21:08:07.412503,0 days 00:00:01.185027,squared_error,29,sqrt,3,2,best,TPESampler,COMPLETE
1223,0.5542791023918845,2025-04-24 21:08:06.682674,2025-04-24 21:08:07.637686,0 days 00:00:00.955012,absolute_error,31,sqrt,1,2,best,TPESampler,COMPLETE
1224,0.5872420994323145,2025-04-24 21:08:07.183300,2025-04-24 21:08:07.984766,0 days 00:00:00.801466,absolute_error,35,sqrt,1,2,best,TPESampler,COMPLETE
1225,1.2076965740491883,2025-04-24 21:08:07.674175,2025-04-24 21:08:08.494246,0 days 00:00:00.820071,absolute_error,35,sqrt,3,5,best,TPESampler,COMPLETE
1226,0.9194592887273054,2025-04-24 21:08:07.888276,2025-04-24 21:08:08.755160,0 days 00:00:00.866884,absolute_error,27,sqrt,1,5,best,TPESampler,COMPLETE
1227,1.3677569516816517,2025-04-24 21:08:08.206685,2025-04-24 21:08:08.901696,0 days 00:00:00.695011,squared_error,23,log2,9,14,best,TPESampler,COMPLETE
1228,0.5682124588118789,2025-04-24 21:08:08.704535,2025-04-24 21:08:09.438383,0 days 00:00:00.733848,absolute_error,27,sqrt,1,2,best,TPESampler,COMPLETE
1229,1.4138971746431086,2025-04-24 21:08:08.993137,2025-04-24 21:08:09.804137,0 days 00:00:00.811000,absolute_error,15,log2,10,14,best,TPESampler,COMPLETE
1230,1.2076965740491883,2025-04-24 21:08:09.141917,2025-04-24 21:08:10.035597,0 days 00:00:00.893680,absolute_error,29,sqrt,3,2,best,TPESampler,COMPLETE
1231,0.7495346713750386,2025-04-24 21:08:09.739136,2025-04-24 21:08:10.547640,0 days 00:00:00.808504,absolute_error,30,sqrt,1,2,best,TPESampler,COMPLETE
1232,1.1302409528743838,2025-04-24 21:08:10.087469,2025-04-24 21:08:10.927450,0 days 00:00:00.839981,absolute_error,35,sqrt,2,5,best,TPESampler,COMPLETE
1233,1.1302409528743838,2025-04-24 21:08:10.353748,2025-04-24 21:08:11.271402,0 days 00:00:00.917654,absolute_error,30,sqrt,2,5,best,TPESampler,COMPLETE
1234,0.9312073070199461,2025-04-24 21:08:10.876691,2025-04-24 21:08:11.601441,0 days 00:00:00.724750,absolute_error,30,sqrt,1,5,best,TPESampler,COMPLETE
1235,0.5872420994323145,2025-04-24 21:08:11.198413,2025-04-24 21:08:12.094650,0 days 00:00:00.896237,absolute_error,35,sqrt,1,2,best,TPESampler,COMPLETE
1236,0.6496831382391208,2025-04-24 21:08:11.596170,2025-04-24 21:08:12.377213,0 days 00:00:00.781043,squared_error,35,sqrt,1,3,best,TPESampler,COMPLETE
1237,1.2076965740491883,2025-04-24 21:08:11.838493,2025-04-24 21:08:12.607945,0 days 00:00:00.769452,absolute_error,32,sqrt,3,2,best,TPESampler,COMPLETE
1238,0.7495346713750386,2025-04-24 21:08:12.331566,2025-04-24 21:08:13.115236,0 days 00:00:00.783670,absolute_error,30,sqrt,1,2,best,TPESampler,COMPLETE
1239,0.5542791023918845,2025-04-24 21:08:12.643577,2025-04-24 21:08:13.488252,0 days 00:00:00.844675,absolute_error,31,sqrt,1,2,best,TPESampler,COMPLETE
1240,0.6540510953786189,2025-04-24 21:08:12.877208,2025-04-24 21:08:13.727114,0 days 00:00:00.849906,absolute_error,29,sqrt,1,5,best,TPESampler,COMPLETE
1241,0.9160893955110146,2025-04-24 21:08:13.441974,2025-04-24 21:08:14.174751,0 days 00:00:00.732777,absolute_error,22,sqrt,1,2,best,TPESampler,COMPLETE
1242,1.2076965740491883,2025-04-24 21:08:13.830639,2025-04-24 21:08:14.755838,0 days 00:00:00.925199,absolute_error,23,sqrt,3,5,best,TPESampler,COMPLETE
1243,0.6540510953786189,2025-04-24 21:08:13.999636,2025-04-24 21:08:14.921465,0 days 00:00:00.921829,absolute_error,29,sqrt,1,5,best,TPESampler,COMPLETE
1244,0.6462758006949559,2025-04-24 21:08:14.562426,2025-04-24 21:08:15.196616,0 days 00:00:00.634190,squared_error,22,sqrt,1,2,best,TPESampler,COMPLETE
1245,1.2076965740491883,2025-04-24 21:08:15.005524,2025-04-24 21:08:15.770678,0 days 00:00:00.765154,absolute_error,30,sqrt,3,2,best,TPESampler,COMPLETE
1246,0.555832913159586,2025-04-24 21:08:15.152602,2025-04-24 21:08:16.134021,0 days 00:00:00.981419,absolute_error,32,sqrt,1,2,best,TPESampler,COMPLETE
1247,0.5872420994323145,2025-04-24 21:08:15.433772,2025-04-24 21:08:16.260556,0 days 00:00:00.826784,absolute_error,35,sqrt,1,2,best,TPESampler,COMPLETE
1248,1.2076965740491883,2025-04-24 21:08:16.068960,2025-04-24 21:08:16.772256,0 days 00:00:00.703296,absolute_error,22,sqrt,3,2,best,TPESampler,COMPLETE
1249,0.5682124588118789,2025-04-24 21:08:16.447766,2025-04-24 21:08:17.355843,0 days 00:00:00.908077,absolute_error,27,sqrt,1,2,best,TPESampler,COMPLETE
1250,0.5713387065834993,2025-04-24 21:08:16.594303,2025-04-24 21:08:17.420685,0 days 00:00:00.826382,absolute_error,25,sqrt,1,2,best,TPESampler,COMPLETE
1251,1.1302409528743838,2025-04-24 21:08:17.110460,2025-04-24 21:08:17.962628,0 days 00:00:00.852168,absolute_error,29,sqrt,2,5,best,TPESampler,COMPLETE
1252,0.9547665570232677,2025-04-24 21:08:17.579281,2025-04-24 21:08:18.539648,0 days 00:00:00.960367,squared_error,30,sqrt,6,2,best,TPESampler,COMPLETE
1253,0.7259296474698178,2025-04-24 21:08:17.664123,2025-04-24 21:08:18.731305,0 days 00:00:01.067182,absolute_error,26,log2,1,4,best,TPESampler,COMPLETE
1254,1.2728267614075626,2025-04-24 21:08:18.231341,2025-04-24 21:08:19.023690,0 days 00:00:00.792349,friedman_mse,27,sqrt,7,12,random,TPESampler,COMPLETE
1255,1.2076965740491883,2025-04-24 21:08:18.923619,2025-04-24 21:08:19.845972,0 days 00:00:00.922353,absolute_error,32,sqrt,3,2,best,TPESampler,COMPLETE
1256,0.9996424324783258,2025-04-24 21:08:18.987481,2025-04-24 21:08:20.015516,0 days 00:00:01.028035,absolute_error,31,sqrt,2,2,best,TPESampler,COMPLETE
1257,0.6310502563923985,2025-04-24 21:08:19.284447,2025-04-24 21:08:20.381516,0 days 00:00:01.097069,absolute_error,33,sqrt,1,5,best,TPESampler,COMPLETE
1258,0.6366836627529742,2025-04-24 21:08:20.082542,2025-04-24 21:08:21.025036,0 days 00:00:00.942494,absolute_error,27,log2,1,2,best,TPESampler,COMPLETE
1259,0.7495346713750386,2025-04-24 21:08:20.256236,2025-04-24 21:08:21.164117,0 days 00:00:00.907881,absolute_error,30,sqrt,1,2,best,TPESampler,COMPLETE
1260,0.9194592887273054,2025-04-24 21:08:20.672530,2025-04-24 21:08:21.486334,0 days 00:00:00.813804,absolute_error,27,sqrt,1,5,best,TPESampler,COMPLETE
1261,1.359571383264774,2025-04-24 21:08:21.323108,2025-04-24 21:08:22.320404,0 days 00:00:00.997296,squared_error,3,sqrt,7,17,best,TPESampler,COMPLETE
1262,1.3187513250101375,2025-04-24 21:08:21.370122,2025-04-24 21:08:22.267111,0 days 00:00:00.896989,absolute_error,33,sqrt,2,2,random,TPESampler,COMPLETE
1263,1.1302409528743838,2025-04-24 21:08:21.738376,2025-04-24 21:08:22.627823,0 days 00:00:00.889447,absolute_error,35,sqrt,2,5,best,TPESampler,COMPLETE
1264,0.7495346713750386,2025-04-24 21:08:22.544278,2025-04-24 21:08:23.416550,0 days 00:00:00.872272,absolute_error,30,sqrt,1,2,best,TPESampler,COMPLETE
1265,0.9996424324783258,2025-04-24 21:08:22.593501,2025-04-24 21:08:23.904008,0 days 00:00:01.310507,absolute_error,35,sqrt,2,2,best,TPESampler,COMPLETE
1266,0.6755787793007089,2025-04-24 21:08:22.882401,2025-04-24 21:08:23.724571,0 days 00:00:00.842170,absolute_error,35,sqrt,1,5,best,TPESampler,COMPLETE
1267,0.781398070002973,2025-04-24 21:08:23.663611,2025-04-24 21:08:24.409545,0 days 00:00:00.745934,friedman_mse,35,sqrt,2,5,best,TPESampler,COMPLETE
1268,0.9667006726783023,2025-04-24 21:08:23.973836,2025-04-24 21:08:24.972386,0 days 00:00:00.998550,absolute_error,34,sqrt,1,5,random,TPESampler,COMPLETE
1269,0.856297005325639,2025-04-24 21:08:24.112395,2025-04-24 21:08:25.106464,0 days 00:00:00.994069,absolute_error,28,sqrt,1,2,best,TPESampler,COMPLETE
1270,1.0131068116827324,2025-04-24 21:08:24.694821,2025-04-24 21:08:25.404212,0 days 00:00:00.709391,absolute_error,32,log2,3,2,best,TPESampler,COMPLETE
1271,0.9312073070199461,2025-04-24 21:08:25.278388,2025-04-24 21:08:26.097505,0 days 00:00:00.819117,absolute_error,30,sqrt,1,5,best,TPESampler,COMPLETE
1272,0.5542791023918845,2025-04-24 21:08:25.330695,2025-04-24 21:08:26.284507,0 days 00:00:00.953812,absolute_error,31,sqrt,1,2,best,TPESampler,COMPLETE
1273,1.2076965740491883,2025-04-24 21:08:25.670806,2025-04-24 21:08:26.567901,0 days 00:00:00.897095,absolute_error,26,sqrt,3,2,best,TPESampler,COMPLETE
1274,1.2076965740491883,2025-04-24 21:08:26.376788,2025-04-24 21:08:27.308891,0 days 00:00:00.932103,absolute_error,30,sqrt,3,5,best,TPESampler,COMPLETE
1275,0.5872420994323145,2025-04-24 21:08:26.554248,2025-04-24 21:08:27.587985,0 days 00:00:01.033737,absolute_error,35,sqrt,1,2,best,TPESampler,COMPLETE
1276,1.2682598017698241,2025-04-24 21:08:26.833052,2025-04-24 21:08:27.704131,0 days 00:00:00.871079,friedman_mse,25,sqrt,6,5,random,TPESampler,COMPLETE
1277,0.5713387065834993,2025-04-24 21:08:27.546637,2025-04-24 21:08:28.339844,0 days 00:00:00.793207,absolute_error,25,sqrt,1,2,best,TPESampler,COMPLETE
1278,0.6450702871187598,2025-04-24 21:08:27.830779,2025-04-24 21:08:28.711187,0 days 00:00:00.880408,friedman_mse,29,sqrt,1,2,best,TPESampler,COMPLETE
1279,0.9312073070199461,2025-04-24 21:08:27.947732,2025-04-24 21:08:28.896626,0 days 00:00:00.948894,absolute_error,30,sqrt,1,5,best,TPESampler,COMPLETE
1280,1.3877582794236027,2025-04-24 21:08:28.654225,2025-04-24 21:08:29.319894,0 days 00:00:00.665669,absolute_error,27,log2,2,3,random,TPESampler,COMPLETE
1281,0.9996424324783258,2025-04-24 21:08:29.016853,2025-04-24 21:08:29.868253,0 days 00:00:00.851400,absolute_error,30,sqrt,2,2,best,TPESampler,COMPLETE
1282,0.7495346713750386,2025-04-24 21:08:29.185537,2025-04-24 21:08:30.188376,0 days 00:00:01.002839,absolute_error,30,sqrt,1,2,best,TPESampler,COMPLETE
1283,1.0313227598578136,2025-04-24 21:08:29.595136,2025-04-24 21:08:30.438529,0 days 00:00:00.843393,absolute_error,23,sqrt,1,5,best,TPESampler,COMPLETE
1284,1.2076965740491883,2025-04-24 21:08:30.139406,2025-04-24 21:08:30.884953,0 days 00:00:00.745547,absolute_error,29,sqrt,3,5,best,TPESampler,COMPLETE
