number,value,datetime_start,datetime_complete,duration,params_criterion,params_max_depth,params_max_features,params_min_samples_leaf,params_min_samples_split,params_splitter,system_attrs_auto:sampler,state
2416,1.335711393574172,2025-04-24 21:16:40.090298,2025-04-24 21:16:40.919563,0 days 00:00:00.829265,absolute_error,35,sqrt,3,2,random,TPESampler,COMPLETE
2417,1.3182621955384042,2025-04-24 21:16:40.324791,2025-04-24 21:16:41.231732,0 days 00:00:00.906941,absolute_error,30,sqrt,2,5,random,TPESampler,COMPLETE
2418,1.114909371722551,2025-04-24 21:16:40.457169,2025-04-24 21:16:41.564312,0 days 00:00:01.107143,absolute_error,35,sqrt,1,2,random,TPESampler,COMPLETE
2419,1.3600685344512033,2025-04-24 21:16:41.196504,2025-04-24 21:16:42.249037,0 days 00:00:01.052533,absolute_error,31,log2,1,5,random,TPESampler,COMPLETE
2420,0.9860869366393894,2025-04-24 21:16:41.565979,2025-04-24 21:16:42.428994,0 days 00:00:00.863015,absolute_error,30,sqrt,1,2,random,TPESampler,COMPLETE
2421,0.7464085682144045,2025-04-24 21:16:41.854152,2025-04-24 21:16:42.759628,0 days 00:00:00.905476,absolute_error,28,sqrt,1,5,random,TPESampler,COMPLETE
2422,1.335711393574172,2025-04-24 21:16:42.620991,2025-04-24 21:16:43.705638,0 days 00:00:01.084647,absolute_error,35,sqrt,3,2,random,TPESampler,COMPLETE
2423,1.3182621955384042,2025-04-24 21:16:42.696730,2025-04-24 21:16:43.740947,0 days 00:00:01.044217,absolute_error,30,sqrt,2,5,random,TPESampler,COMPLETE
2424,1.1763447383239396,2025-04-24 21:16:43.277829,2025-04-24 21:16:44.036840,0 days 00:00:00.759011,absolute_error,25,sqrt,1,2,random,TPESampler,COMPLETE
2425,0.743600828343223,2025-04-24 21:16:43.970268,2025-04-24 21:16:44.949232,0 days 00:00:00.978964,absolute_error,31,sqrt,1,5,random,TPESampler,COMPLETE
2426,1.335711393574172,2025-04-24 21:16:44.263610,2025-04-24 21:16:45.299657,0 days 00:00:01.036047,absolute_error,29,sqrt,3,2,random,TPESampler,COMPLETE
2427,1.3182621955384042,2025-04-24 21:16:44.313964,2025-04-24 21:16:45.563767,0 days 00:00:01.249803,absolute_error,35,sqrt,2,5,random,TPESampler,COMPLETE
2428,1.3378011980521618,2025-04-24 21:16:45.229995,2025-04-24 21:16:46.265351,0 days 00:00:01.035356,absolute_error,35,sqrt,2,9,random,TPESampler,COMPLETE
2429,1.3187513250101375,2025-04-24 21:16:45.576820,2025-04-24 21:16:46.450897,0 days 00:00:00.874077,absolute_error,31,sqrt,2,2,random,TPESampler,COMPLETE
2430,1.2119861239647682,2025-04-24 21:16:45.950898,2025-04-24 21:16:46.872629,0 days 00:00:00.921731,absolute_error,29,sqrt,1,2,random,TPESampler,COMPLETE
2431,0.7464085682144045,2025-04-24 21:16:46.587784,2025-04-24 21:16:47.535130,0 days 00:00:00.947346,absolute_error,28,sqrt,1,5,random,TPESampler,COMPLETE
2432,0.9860869366393894,2025-04-24 21:16:46.676866,2025-04-24 21:16:47.785667,0 days 00:00:01.108801,absolute_error,30,sqrt,1,2,random,TPESampler,COMPLETE
2433,1.3187513250101375,2025-04-24 21:16:47.159233,2025-04-24 21:16:48.181158,0 days 00:00:01.021925,absolute_error,29,sqrt,2,2,random,TPESampler,COMPLETE
2434,1.0458376878339173,2025-04-24 21:16:47.835112,2025-04-24 21:16:48.902184,0 days 00:00:01.067072,absolute_error,24,sqrt,1,2,random,TPESampler,COMPLETE
2435,1.3803344387022112,2025-04-24 21:16:48.091885,2025-04-24 21:16:49.026825,0 days 00:00:00.934940,absolute_error,22,log2,1,6,random,TPESampler,COMPLETE
2436,1.2119861239647682,2025-04-24 21:16:48.534733,2025-04-24 21:16:49.353126,0 days 00:00:00.818393,absolute_error,29,sqrt,1,2,random,TPESampler,COMPLETE
2437,1.005467895307365,2025-04-24 21:16:49.276385,2025-04-24 21:16:50.182827,0 days 00:00:00.906442,absolute_error,31,sqrt,1,2,random,TPESampler,COMPLETE
2438,1.4099403933078523,2025-04-24 21:16:49.319736,2025-04-24 21:16:50.534347,0 days 00:00:01.214611,absolute_error,2,log2,1,8,random,TPESampler,COMPLETE
2439,1.2675211112043427,2025-04-24 21:16:49.654649,2025-04-24 21:16:50.752143,0 days 00:00:01.097494,squared_error,25,sqrt,4,18,random,TPESampler,COMPLETE
2440,1.1709415380471102,2025-04-24 21:16:50.446813,2025-04-24 21:16:51.484859,0 days 00:00:01.038046,squared_error,35,sqrt,2,6,random,TPESampler,COMPLETE
2441,1.3187513250101375,2025-04-24 21:16:50.824416,2025-04-24 21:16:52.089805,0 days 00:00:01.265389,absolute_error,35,sqrt,2,2,random,TPESampler,COMPLETE
2442,1.3182621955384042,2025-04-24 21:16:51.028468,2025-04-24 21:16:52.162493,0 days 00:00:01.134025,absolute_error,31,sqrt,2,5,random,TPESampler,COMPLETE
2443,0.9667006726783023,2025-04-24 21:16:51.895367,2025-04-24 21:16:52.892188,0 days 00:00:00.996821,absolute_error,34,sqrt,1,5,random,TPESampler,COMPLETE
2444,0.6785347225984457,2025-04-24 21:16:52.487914,2025-04-24 21:16:53.557163,0 days 00:00:01.069249,absolute_error,35,sqrt,1,5,random,TPESampler,COMPLETE
2445,0.9860869366393894,2025-04-24 21:16:52.540092,2025-04-24 21:16:53.685523,0 days 00:00:01.145431,absolute_error,30,sqrt,1,2,random,TPESampler,COMPLETE
2446,0.743600828343223,2025-04-24 21:16:53.249772,2025-04-24 21:16:54.001886,0 days 00:00:00.752114,absolute_error,31,sqrt,1,5,random,TPESampler,COMPLETE
2447,0.6964980049699784,2025-04-24 21:16:53.899795,2025-04-24 21:16:55.001913,0 days 00:00:01.102118,absolute_error,33,sqrt,1,2,random,TPESampler,COMPLETE
2448,1.335711393574172,2025-04-24 21:16:53.959944,2025-04-24 21:16:55.069162,0 days 00:00:01.109218,absolute_error,35,sqrt,3,2,random,TPESampler,COMPLETE
2449,0.6964980049699784,2025-04-24 21:16:54.290151,2025-04-24 21:16:55.401864,0 days 00:00:01.111713,absolute_error,33,sqrt,1,2,random,TPESampler,COMPLETE
2450,1.335711393574172,2025-04-24 21:16:55.300880,2025-04-24 21:16:56.349656,0 days 00:00:01.048776,absolute_error,24,sqrt,3,2,random,TPESampler,COMPLETE
2451,0.7976190831171034,2025-04-24 21:16:55.354530,2025-04-24 21:16:56.575062,0 days 00:00:01.220532,friedman_mse,26,sqrt,1,5,random,TPESampler,COMPLETE
2452,1.114909371722551,2025-04-24 21:16:55.687791,2025-04-24 21:16:56.879493,0 days 00:00:01.191702,absolute_error,35,sqrt,1,2,random,TPESampler,COMPLETE
2453,1.3267117987075143,2025-04-24 21:16:56.628679,2025-04-24 21:16:57.702268,0 days 00:00:01.073589,absolute_error,25,sqrt,1,5,random,TPESampler,COMPLETE
2454,1.3182621955384042,2025-04-24 21:16:56.878093,2025-04-24 21:16:57.975373,0 days 00:00:01.097280,absolute_error,26,sqrt,2,5,random,TPESampler,COMPLETE
2455,1.3182621955384042,2025-04-24 21:16:57.261672,2025-04-24 21:16:58.042583,0 days 00:00:00.780911,absolute_error,29,sqrt,2,5,random,TPESampler,COMPLETE
2456,1.1763447383239396,2025-04-24 21:16:57.985420,2025-04-24 21:16:59.166433,0 days 00:00:01.181013,absolute_error,25,sqrt,1,2,random,TPESampler,COMPLETE
2457,0.6750005427680865,2025-04-24 21:16:58.193607,2025-04-24 21:16:59.342537,0 days 00:00:01.148930,absolute_error,30,sqrt,1,5,random,TPESampler,COMPLETE
2458,1.0297478661477455,2025-04-24 21:16:58.446074,2025-04-24 21:16:59.450848,0 days 00:00:01.004774,absolute_error,32,sqrt,1,5,random,TPESampler,COMPLETE
2459,1.3602888872974177,2025-04-24 21:16:59.387603,2025-04-24 21:17:00.263936,0 days 00:00:00.876333,absolute_error,34,log2,1,2,random,TPESampler,COMPLETE
2460,1.335711393574172,2025-04-24 21:16:59.692532,2025-04-24 21:17:00.698660,0 days 00:00:01.006128,absolute_error,27,sqrt,3,2,random,TPESampler,COMPLETE
2461,1.335711393574172,2025-04-24 21:16:59.847063,2025-04-24 21:17:01.060904,0 days 00:00:01.213841,absolute_error,30,sqrt,3,5,random,TPESampler,COMPLETE
2462,1.1901482147353724,2025-04-24 21:17:00.658862,2025-04-24 21:17:01.639141,0 days 00:00:00.980279,friedman_mse,34,sqrt,2,5,random,TPESampler,COMPLETE
2463,1.3187513250101375,2025-04-24 21:17:01.019780,2025-04-24 21:17:01.882635,0 days 00:00:00.862855,absolute_error,31,sqrt,2,2,random,TPESampler,COMPLETE
2464,1.114909371722551,2025-04-24 21:17:01.359981,2025-04-24 21:17:02.330517,0 days 00:00:00.970536,absolute_error,35,sqrt,1,2,random,TPESampler,COMPLETE
2465,0.9860869366393894,2025-04-24 21:17:02.011539,2025-04-24 21:17:03.125465,0 days 00:00:01.113926,absolute_error,30,sqrt,1,2,random,TPESampler,COMPLETE
2466,0.9860869366393894,2025-04-24 21:17:02.329352,2025-04-24 21:17:03.296923,0 days 00:00:00.967571,absolute_error,30,sqrt,1,2,random,TPESampler,COMPLETE
2467,1.335711393574172,2025-04-24 21:17:02.694426,2025-04-24 21:17:03.623283,0 days 00:00:00.928857,absolute_error,28,sqrt,3,2,random,TPESampler,COMPLETE
2468,1.335711393574172,2025-04-24 21:17:03.517140,2025-04-24 21:17:04.317512,0 days 00:00:00.800372,absolute_error,34,sqrt,3,5,random,TPESampler,COMPLETE
2469,1.335711393574172,2025-04-24 21:17:03.583586,2025-04-24 21:17:04.800925,0 days 00:00:01.217339,absolute_error,31,sqrt,3,2,random,TPESampler,COMPLETE
2470,1.3187513250101375,2025-04-24 21:17:03.949736,2025-04-24 21:17:04.950209,0 days 00:00:01.000473,absolute_error,30,sqrt,2,2,random,TPESampler,COMPLETE
2471,1.335711393574172,2025-04-24 21:17:04.682847,2025-04-24 21:17:05.610430,0 days 00:00:00.927583,absolute_error,35,sqrt,3,2,random,TPESampler,COMPLETE
2472,1.005467895307365,2025-04-24 21:17:05.121355,2025-04-24 21:17:06.251083,0 days 00:00:01.129728,absolute_error,31,sqrt,1,2,random,TPESampler,COMPLETE
2473,1.1732084372031155,2025-04-24 21:17:05.275961,2025-04-24 21:17:06.368870,0 days 00:00:01.092909,absolute_error,27,sqrt,1,5,random,TPESampler,COMPLETE
2474,1.114909371722551,2025-04-24 21:17:05.972744,2025-04-24 21:17:06.744019,0 days 00:00:00.771275,absolute_error,35,sqrt,1,2,random,TPESampler,COMPLETE
2475,1.114909371722551,2025-04-24 21:17:06.659127,2025-04-24 21:17:07.884609,0 days 00:00:01.225482,absolute_error,35,sqrt,1,2,random,TPESampler,COMPLETE
2476,1.1924180531178654,2025-04-24 21:17:06.511981,2025-04-24 21:17:07.895024,0 days 00:00:01.383043,absolute_error,26,sqrt,1,2,random,TPESampler,COMPLETE
2477,1.3378011980521618,2025-04-24 21:17:07.451046,2025-04-24 21:17:08.314654,0 days 00:00:00.863608,absolute_error,25,sqrt,2,9,random,TPESampler,COMPLETE
2478,0.7052145350764119,2025-04-24 21:17:08.177919,2025-04-24 21:17:09.105649,0 days 00:00:00.927730,absolute_error,33,sqrt,1,5,random,TPESampler,COMPLETE
2479,0.6750005427680865,2025-04-24 21:17:08.227547,2025-04-24 21:17:09.544676,0 days 00:00:01.317129,absolute_error,30,sqrt,1,5,random,TPESampler,COMPLETE
2480,1.2741490090538539,2025-04-24 21:17:08.619509,2025-04-24 21:17:09.819633,0 days 00:00:01.200124,absolute_error,28,sqrt,1,2,random,TPESampler,COMPLETE
2481,0.9860869366393894,2025-04-24 21:17:09.583235,2025-04-24 21:17:11.059869,0 days 00:00:01.476634,absolute_error,30,sqrt,1,2,random,TPESampler,COMPLETE
2482,1.3182621955384042,2025-04-24 21:17:09.786395,2025-04-24 21:17:11.363550,0 days 00:00:01.577155,absolute_error,35,sqrt,2,5,random,TPESampler,COMPLETE
2483,1.335711393574172,2025-04-24 21:17:10.088536,2025-04-24 21:17:11.509135,0 days 00:00:01.420599,absolute_error,30,sqrt,3,5,random,TPESampler,COMPLETE
2484,0.7052145350764119,2025-04-24 21:17:11.462579,2025-04-24 21:17:12.348958,0 days 00:00:00.886379,absolute_error,33,sqrt,1,5,random,TPESampler,COMPLETE
2485,1.3677569516816517,2025-04-24 21:17:11.748179,2025-04-24 21:17:12.891284,0 days 00:00:01.143105,squared_error,10,log2,8,18,best,TPESampler,COMPLETE
2486,1.2079506990755198,2025-04-24 21:17:11.911417,2025-04-24 21:17:13.135310,0 days 00:00:01.223893,absolute_error,30,sqrt,1,4,random,TPESampler,COMPLETE
2487,1.1725983074554982,2025-04-24 21:17:12.812498,2025-04-24 21:17:13.636510,0 days 00:00:00.824012,squared_error,31,sqrt,3,2,random,TPESampler,COMPLETE
2488,1.335711393574172,2025-04-24 21:17:13.235112,2025-04-24 21:17:14.366308,0 days 00:00:01.131196,absolute_error,30,sqrt,3,2,random,TPESampler,COMPLETE
2489,0.6234752034897817,2025-04-24 21:17:13.483462,2025-04-24 21:17:14.565769,0 days 00:00:01.082307,absolute_error,34,sqrt,1,2,random,TPESampler,COMPLETE
2490,1.019101943004136,2025-04-24 21:17:13.986861,2025-04-24 21:17:14.907852,0 days 00:00:00.920991,squared_error,27,sqrt,1,2,random,TPESampler,COMPLETE
2491,1.005467895307365,2025-04-24 21:17:14.794495,2025-04-24 21:17:15.928496,0 days 00:00:01.134001,absolute_error,31,sqrt,1,2,random,TPESampler,COMPLETE
2492,1.114909371722551,2025-04-24 21:17:14.866892,2025-04-24 21:17:15.931861,0 days 00:00:01.064969,absolute_error,35,sqrt,1,2,random,TPESampler,COMPLETE
2493,1.1763447383239396,2025-04-24 21:17:15.453202,2025-04-24 21:17:16.331821,0 days 00:00:00.878619,absolute_error,25,sqrt,1,2,random,TPESampler,COMPLETE
2494,1.335711393574172,2025-04-24 21:17:16.223869,2025-04-24 21:17:17.274114,0 days 00:00:01.050245,absolute_error,35,sqrt,3,5,random,TPESampler,COMPLETE
2495,1.0324703545097333,2025-04-24 21:17:16.289728,2025-04-24 21:17:17.626407,0 days 00:00:01.336679,squared_error,35,sqrt,1,2,random,TPESampler,COMPLETE
2496,1.114909371722551,2025-04-24 21:17:16.625141,2025-04-24 21:17:17.909954,0 days 00:00:01.284813,absolute_error,35,sqrt,1,2,random,TPESampler,COMPLETE
2497,1.2168800208288038,2025-04-24 21:17:17.536041,2025-04-24 21:17:18.674648,0 days 00:00:01.138607,absolute_error,27,sqrt,1,2,random,TPESampler,COMPLETE
2498,0.7367734144772758,2025-04-24 21:17:18.084164,2025-04-24 21:17:19.207021,0 days 00:00:01.122857,absolute_error,29,sqrt,1,5,random,TPESampler,COMPLETE
2499,1.3187513250101375,2025-04-24 21:17:18.324983,2025-04-24 21:17:19.243089,0 days 00:00:00.918106,absolute_error,29,sqrt,2,2,random,TPESampler,COMPLETE
