number,value,datetime_start,datetime_complete,duration,params_criterion,params_max_depth,params_max_features,params_min_samples_leaf,params_min_samples_split,params_splitter,system_attrs_auto:sampler,state
1711,0.9996424324783258,2025-04-24 21:11:22.738112,2025-04-24 21:11:23.555592,0 days 00:00:00.817480,absolute_error,30,sqrt,2,2,best,TPESampler,COMPLETE
1712,0.6288399089804382,2025-04-24 21:11:23.076350,2025-04-24 21:11:24.099629,0 days 00:00:01.023279,absolute_error,31,sqrt,1,5,best,TPESampler,COMPLETE
1713,1.2076965740491883,2025-04-24 21:11:23.508405,2025-04-24 21:11:24.297085,0 days 00:00:00.788680,absolute_error,32,sqrt,3,5,best,TPESampler,COMPLETE
1714,1.2076965740491883,2025-04-24 21:11:23.840506,2025-04-24 21:11:25.068918,0 days 00:00:01.228412,absolute_error,35,sqrt,3,2,best,TPESampler,COMPLETE
1715,1.0283729451430148,2025-04-24 21:11:24.489483,2025-04-24 21:11:25.437091,0 days 00:00:00.947608,absolute_error,6,log2,3,3,best,TPESampler,COMPLETE
1716,0.6755787793007089,2025-04-24 21:11:24.589745,2025-04-24 21:11:25.637330,0 days 00:00:01.047585,absolute_error,35,sqrt,1,5,best,TPESampler,COMPLETE
1717,1.2725666200726056,2025-04-24 21:11:25.383518,2025-04-24 21:11:26.200534,0 days 00:00:00.817016,friedman_mse,6,sqrt,6,18,random,TPESampler,COMPLETE
1718,0.7741785052605572,2025-04-24 21:11:25.818613,2025-04-24 21:11:26.871742,0 days 00:00:01.053129,absolute_error,20,sqrt,1,5,best,TPESampler,COMPLETE
1719,1.3677569516816517,2025-04-24 21:11:26.021628,2025-04-24 21:11:27.158488,0 days 00:00:01.136860,friedman_mse,28,log2,6,20,best,TPESampler,COMPLETE
1720,0.6112778743973727,2025-04-24 21:11:26.520688,2025-04-24 21:11:27.423475,0 days 00:00:00.902787,absolute_error,29,sqrt,1,2,best,TPESampler,COMPLETE
1721,0.9996424324783258,2025-04-24 21:11:27.235180,2025-04-24 21:11:28.051291,0 days 00:00:00.816111,absolute_error,30,sqrt,2,2,best,TPESampler,COMPLETE
1722,1.2076965740491883,2025-04-24 21:11:27.435907,2025-04-24 21:11:28.249038,0 days 00:00:00.813131,absolute_error,24,sqrt,3,5,best,TPESampler,COMPLETE
1723,0.7495346713750386,2025-04-24 21:11:27.698946,2025-04-24 21:11:28.626284,0 days 00:00:00.927338,absolute_error,30,sqrt,1,2,best,TPESampler,COMPLETE
1724,1.2076965740491883,2025-04-24 21:11:28.418011,2025-04-24 21:11:29.327957,0 days 00:00:00.909946,absolute_error,31,sqrt,3,2,best,TPESampler,COMPLETE
1725,1.0131068116827324,2025-04-24 21:11:28.520663,2025-04-24 21:11:29.478156,0 days 00:00:00.957493,absolute_error,32,log2,3,5,best,TPESampler,COMPLETE
1726,0.5647532297301866,2025-04-24 21:11:28.972379,2025-04-24 21:11:29.776769,0 days 00:00:00.804390,absolute_error,34,sqrt,1,2,best,TPESampler,COMPLETE
1727,0.555832913159586,2025-04-24 21:11:29.662820,2025-04-24 21:11:30.663104,0 days 00:00:01.000284,absolute_error,32,sqrt,1,2,best,TPESampler,COMPLETE
1728,0.7495346713750386,2025-04-24 21:11:29.726566,2025-04-24 21:11:30.701628,0 days 00:00:00.975062,absolute_error,30,sqrt,1,2,best,TPESampler,COMPLETE
1729,0.6638847036354089,2025-04-24 21:11:30.275163,2025-04-24 21:11:31.179224,0 days 00:00:00.904061,squared_error,34,sqrt,1,2,best,TPESampler,COMPLETE
1730,0.9970333222906006,2025-04-24 21:11:30.896429,2025-04-24 21:11:31.928333,0 days 00:00:01.031904,absolute_error,25,sqrt,1,5,best,TPESampler,COMPLETE
1731,1.2076965740491883,2025-04-24 21:11:30.947130,2025-04-24 21:11:31.929818,0 days 00:00:00.982688,absolute_error,25,sqrt,3,2,best,TPESampler,COMPLETE
1732,1.1302409528743838,2025-04-24 21:11:31.540362,2025-04-24 21:11:32.281177,0 days 00:00:00.740815,absolute_error,35,sqrt,2,5,best,TPESampler,COMPLETE
1733,1.1725983074554982,2025-04-24 21:11:32.170651,2025-04-24 21:11:33.225619,0 days 00:00:01.054968,friedman_mse,27,sqrt,3,4,random,TPESampler,COMPLETE
1734,0.6755787793007089,2025-04-24 21:11:32.242844,2025-04-24 21:11:33.538311,0 days 00:00:01.295467,absolute_error,35,sqrt,1,5,best,TPESampler,COMPLETE
1735,0.6919576112851691,2025-04-24 21:11:32.541133,2025-04-24 21:11:33.772874,0 days 00:00:01.231741,friedman_mse,28,sqrt,1,2,best,TPESampler,COMPLETE
1736,0.5713387065834993,2025-04-24 21:11:33.469362,2025-04-24 21:11:34.351765,0 days 00:00:00.882403,absolute_error,25,sqrt,1,2,best,TPESampler,COMPLETE
1737,0.6750603857551389,2025-04-24 21:11:33.907176,2025-04-24 21:11:34.777491,0 days 00:00:00.870315,squared_error,27,sqrt,1,2,best,TPESampler,COMPLETE
1738,0.5872420994323145,2025-04-24 21:11:34.067385,2025-04-24 21:11:35.147081,0 days 00:00:01.079696,absolute_error,35,sqrt,1,2,best,TPESampler,COMPLETE
1739,1.2076965740491883,2025-04-24 21:11:34.718557,2025-04-24 21:11:35.649486,0 days 00:00:00.930929,absolute_error,28,sqrt,3,2,best,TPESampler,COMPLETE
1740,1.2076965740491883,2025-04-24 21:11:35.152504,2025-04-24 21:11:35.977139,0 days 00:00:00.824635,absolute_error,35,sqrt,3,2,best,TPESampler,COMPLETE
1741,0.7353381510235582,2025-04-24 21:11:35.420962,2025-04-24 21:11:36.193739,0 days 00:00:00.772777,absolute_error,27,log2,1,6,best,TPESampler,COMPLETE
1742,1.3262151716400714,2025-04-24 21:11:35.940185,2025-04-24 21:11:36.737567,0 days 00:00:00.797382,squared_error,22,sqrt,10,7,random,TPESampler,COMPLETE
1743,0.610896094172543,2025-04-24 21:11:36.272468,2025-04-24 21:11:37.191767,0 days 00:00:00.919299,absolute_error,26,sqrt,1,2,best,TPESampler,COMPLETE
1744,0.5542791023918845,2025-04-24 21:11:36.465599,2025-04-24 21:11:37.449051,0 days 00:00:00.983452,absolute_error,31,sqrt,1,2,best,TPESampler,COMPLETE
1745,0.6112778743973727,2025-04-24 21:11:37.079598,2025-04-24 21:11:37.800826,0 days 00:00:00.721228,absolute_error,29,sqrt,1,2,best,TPESampler,COMPLETE
1746,0.5872420994323145,2025-04-24 21:11:37.503742,2025-04-24 21:11:38.530181,0 days 00:00:01.026439,absolute_error,35,sqrt,1,2,best,TPESampler,COMPLETE
1747,0.6288399089804382,2025-04-24 21:11:37.759907,2025-04-24 21:11:38.702228,0 days 00:00:00.942321,absolute_error,31,sqrt,1,5,best,TPESampler,COMPLETE
1748,1.1302409528743838,2025-04-24 21:11:38.159181,2025-04-24 21:11:39.002271,0 days 00:00:00.843090,absolute_error,31,sqrt,2,5,best,TPESampler,COMPLETE
1749,0.9312073070199461,2025-04-24 21:11:38.867788,2025-04-24 21:11:39.872374,0 days 00:00:01.004586,absolute_error,30,sqrt,1,5,best,TPESampler,COMPLETE
1750,0.7033595174659969,2025-04-24 21:11:38.935358,2025-04-24 21:11:39.919268,0 days 00:00:00.983910,absolute_error,28,sqrt,1,5,best,TPESampler,COMPLETE
1751,0.5682124588118789,2025-04-24 21:11:39.499370,2025-04-24 21:11:40.394331,0 days 00:00:00.894961,absolute_error,27,sqrt,1,2,best,TPESampler,COMPLETE
1752,1.2076965740491883,2025-04-24 21:11:40.120518,2025-04-24 21:11:41.277883,0 days 00:00:01.157365,absolute_error,29,sqrt,3,2,best,TPESampler,COMPLETE
1753,0.9996424324783258,2025-04-24 21:11:40.193744,2025-04-24 21:11:41.220522,0 days 00:00:01.026778,absolute_error,31,sqrt,2,2,best,TPESampler,COMPLETE
1754,0.9194592887273054,2025-04-24 21:11:40.945112,2025-04-24 21:11:41.729893,0 days 00:00:00.784781,absolute_error,27,sqrt,1,5,best,TPESampler,COMPLETE
1755,0.5542791023918845,2025-04-24 21:11:41.461726,2025-04-24 21:11:42.439798,0 days 00:00:00.978072,absolute_error,31,sqrt,1,2,best,TPESampler,COMPLETE
1756,0.9996424324783258,2025-04-24 21:11:41.512519,2025-04-24 21:11:42.542778,0 days 00:00:01.030259,absolute_error,30,sqrt,2,2,best,TPESampler,COMPLETE
1757,1.3187513250101375,2025-04-24 21:11:42.085255,2025-04-24 21:11:42.850047,0 days 00:00:00.764792,absolute_error,27,sqrt,2,2,random,TPESampler,COMPLETE
1758,0.9996424324783258,2025-04-24 21:11:42.780450,2025-04-24 21:11:43.822012,0 days 00:00:01.041562,absolute_error,25,sqrt,2,2,best,TPESampler,COMPLETE
1759,0.6540510953786189,2025-04-24 21:11:42.810822,2025-04-24 21:11:43.992802,0 days 00:00:01.181980,absolute_error,29,sqrt,1,5,best,TPESampler,COMPLETE
1760,1.2076965740491883,2025-04-24 21:11:43.127926,2025-04-24 21:11:44.099017,0 days 00:00:00.971091,absolute_error,26,sqrt,3,5,best,TPESampler,COMPLETE
1761,0.6755787793007089,2025-04-24 21:11:44.041151,2025-04-24 21:11:44.969527,0 days 00:00:00.928376,absolute_error,35,sqrt,1,5,best,TPESampler,COMPLETE
1762,0.856297005325639,2025-04-24 21:11:44.302694,2025-04-24 21:11:45.303915,0 days 00:00:01.001221,absolute_error,28,sqrt,1,2,best,TPESampler,COMPLETE
1763,1.2076965740491883,2025-04-24 21:11:44.401858,2025-04-24 21:11:45.516560,0 days 00:00:01.114702,absolute_error,31,sqrt,3,2,best,TPESampler,COMPLETE
1764,0.6755787793007089,2025-04-24 21:11:45.232101,2025-04-24 21:11:46.030961,0 days 00:00:00.798860,absolute_error,35,sqrt,1,5,best,TPESampler,COMPLETE
1765,0.8465624319698303,2025-04-24 21:11:45.637735,2025-04-24 21:11:46.590601,0 days 00:00:00.952866,absolute_error,33,sqrt,1,2,best,TPESampler,COMPLETE
1766,0.7495346713750386,2025-04-24 21:11:45.833417,2025-04-24 21:11:46.790524,0 days 00:00:00.957107,absolute_error,30,sqrt,1,2,best,TPESampler,COMPLETE
1767,0.8356479176587005,2025-04-24 21:11:46.329442,2025-04-24 21:11:47.181176,0 days 00:00:00.851734,absolute_error,26,sqrt,1,5,random,TPESampler,COMPLETE
1768,1.2076965740491883,2025-04-24 21:11:46.902902,2025-04-24 21:11:47.812038,0 days 00:00:00.909136,absolute_error,28,sqrt,3,5,best,TPESampler,COMPLETE
1769,1.3218053084730046,2025-04-24 21:11:47.089217,2025-04-24 21:11:47.959482,0 days 00:00:00.870265,squared_error,6,sqrt,1,20,best,TPESampler,COMPLETE
1770,0.9996424324783258,2025-04-24 21:11:47.430746,2025-04-24 21:11:48.354962,0 days 00:00:00.924216,absolute_error,35,sqrt,2,2,best,TPESampler,COMPLETE
1771,1.0498076960778187,2025-04-24 21:11:48.045047,2025-04-24 21:11:49.011205,0 days 00:00:00.966158,friedman_mse,25,sqrt,3,5,best,TPESampler,COMPLETE
1772,0.9160893955110146,2025-04-24 21:11:48.159407,2025-04-24 21:11:49.200095,0 days 00:00:01.040688,absolute_error,22,sqrt,1,2,best,TPESampler,COMPLETE
1773,1.0099953635558898,2025-04-24 21:11:48.618426,2025-04-24 21:11:49.482285,0 days 00:00:00.863859,absolute_error,23,sqrt,1,2,best,TPESampler,COMPLETE
1774,0.6540510953786189,2025-04-24 21:11:49.418518,2025-04-24 21:11:50.448246,0 days 00:00:01.029728,absolute_error,29,sqrt,1,5,best,TPESampler,COMPLETE
1775,0.5517216241439309,2025-04-24 21:11:49.434453,2025-04-24 21:11:50.654347,0 days 00:00:01.219894,absolute_error,32,sqrt,1,2,random,TPESampler,COMPLETE
1776,0.5542791023918845,2025-04-24 21:11:49.782458,2025-04-24 21:11:50.765795,0 days 00:00:00.983337,absolute_error,31,sqrt,1,2,best,TPESampler,COMPLETE
1777,1.3182621955384042,2025-04-24 21:11:50.697529,2025-04-24 21:11:51.549696,0 days 00:00:00.852167,absolute_error,34,sqrt,2,5,random,TPESampler,COMPLETE
1778,0.9860869366393894,2025-04-24 21:11:50.929488,2025-04-24 21:11:52.056379,0 days 00:00:01.126891,absolute_error,30,sqrt,1,2,random,TPESampler,COMPLETE
1779,1.3368882189736997,2025-04-24 21:11:51.020488,2025-04-24 21:11:52.066081,0 days 00:00:01.045593,absolute_error,33,sqrt,2,7,random,TPESampler,COMPLETE
1780,1.3187513250101375,2025-04-24 21:11:51.920899,2025-04-24 21:11:52.794471,0 days 00:00:00.873572,absolute_error,35,sqrt,2,4,random,TPESampler,COMPLETE
1781,1.2741490090538539,2025-04-24 21:11:52.276633,2025-04-24 21:11:53.213488,0 days 00:00:00.936855,absolute_error,28,sqrt,1,2,random,TPESampler,COMPLETE
1782,1.2076965740491883,2025-04-24 21:11:52.409238,2025-04-24 21:11:53.540287,0 days 00:00:01.131049,absolute_error,31,sqrt,3,5,best,TPESampler,COMPLETE
1783,0.5872420994323145,2025-04-24 21:11:53.156869,2025-04-24 21:11:53.982899,0 days 00:00:00.826030,absolute_error,35,sqrt,1,2,best,TPESampler,COMPLETE
1784,1.0336119447551722,2025-04-24 21:11:53.494563,2025-04-24 21:11:54.470975,0 days 00:00:00.976412,absolute_error,30,sqrt,1,3,random,TPESampler,COMPLETE
1785,1.2000807722836062,2025-04-24 21:11:53.862436,2025-04-24 21:11:54.841043,0 days 00:00:00.978607,absolute_error,33,sqrt,1,6,random,TPESampler,COMPLETE
1786,0.6234752034897817,2025-04-24 21:11:54.402224,2025-04-24 21:11:55.216512,0 days 00:00:00.814288,absolute_error,34,sqrt,1,2,random,TPESampler,COMPLETE
1787,1.3187513250101375,2025-04-24 21:11:54.844076,2025-04-24 21:11:55.825549,0 days 00:00:00.981473,absolute_error,35,sqrt,2,2,random,TPESampler,COMPLETE
1788,0.9860869366393894,2025-04-24 21:11:55.139913,2025-04-24 21:11:56.119538,0 days 00:00:00.979625,absolute_error,30,sqrt,1,2,random,TPESampler,COMPLETE
1789,1.2076965740491883,2025-04-24 21:11:55.493394,2025-04-24 21:11:56.361170,0 days 00:00:00.867776,absolute_error,35,sqrt,3,5,best,TPESampler,COMPLETE
1790,1.4230105932325812,2025-04-24 21:11:56.069509,2025-04-24 21:11:56.930750,0 days 00:00:00.861241,absolute_error,12,sqrt,8,11,random,TPESampler,COMPLETE
1791,1.335711393574172,2025-04-24 21:11:56.425795,2025-04-24 21:11:57.358736,0 days 00:00:00.932941,absolute_error,29,sqrt,3,2,random,TPESampler,COMPLETE
1792,0.9996424324783258,2025-04-24 21:11:56.598874,2025-04-24 21:11:57.687673,0 days 00:00:01.088799,absolute_error,27,sqrt,2,2,best,TPESampler,COMPLETE
1793,1.2741490090538539,2025-04-24 21:11:57.248877,2025-04-24 21:11:58.104772,0 days 00:00:00.855895,absolute_error,28,sqrt,1,2,random,TPESampler,COMPLETE
1794,1.335711393574172,2025-04-24 21:11:57.676382,2025-04-24 21:11:58.549085,0 days 00:00:00.872703,absolute_error,35,sqrt,3,3,random,TPESampler,COMPLETE
1795,1.3182621955384042,2025-04-24 21:11:57.992842,2025-04-24 21:11:59.000993,0 days 00:00:01.008151,absolute_error,28,sqrt,2,5,random,TPESampler,COMPLETE
1796,1.3187513250101375,2025-04-24 21:11:58.388591,2025-04-24 21:11:59.278327,0 days 00:00:00.889736,absolute_error,30,sqrt,2,2,random,TPESampler,COMPLETE
1797,1.3182621955384042,2025-04-24 21:11:58.931843,2025-04-24 21:11:59.765999,0 days 00:00:00.834156,absolute_error,29,sqrt,2,5,random,TPESampler,COMPLETE
1798,0.8484585719705644,2025-04-24 21:11:59.382821,2025-04-24 21:12:00.235009,0 days 00:00:00.852188,absolute_error,34,sqrt,1,4,random,TPESampler,COMPLETE
1799,1.3969275733416553,2025-04-24 21:11:59.560505,2025-04-24 21:12:00.770015,0 days 00:00:01.209510,absolute_error,5,sqrt,6,3,best,TPESampler,COMPLETE
1800,1.0756436642655602,2025-04-24 21:12:00.158665,2025-04-24 21:12:01.152776,0 days 00:00:00.994111,absolute_error,34,sqrt,1,3,random,TPESampler,COMPLETE
1801,0.9610014723049441,2025-04-24 21:12:00.647340,2025-04-24 21:12:01.792997,0 days 00:00:01.145657,absolute_error,28,log2,2,2,best,TPESampler,COMPLETE
1802,1.3877582794236027,2025-04-24 21:12:01.151718,2025-04-24 21:12:02.018051,0 days 00:00:00.866333,absolute_error,35,log2,2,4,random,TPESampler,COMPLETE
1803,0.9312073070199461,2025-04-24 21:12:01.459290,2025-04-24 21:12:02.337172,0 days 00:00:00.877882,absolute_error,30,sqrt,1,5,best,TPESampler,COMPLETE
1804,1.4148597056909755,2025-04-24 21:12:02.114775,2025-04-24 21:12:03.223176,0 days 00:00:01.108401,absolute_error,17,log2,6,16,random,TPESampler,COMPLETE
1805,1.1924180531178654,2025-04-24 21:12:02.283545,2025-04-24 21:12:03.464767,0 days 00:00:01.181222,absolute_error,26,sqrt,1,2,random,TPESampler,COMPLETE
1806,0.7105690610052176,2025-04-24 21:12:02.643436,2025-04-24 21:12:03.578413,0 days 00:00:00.934977,absolute_error,32,sqrt,1,3,random,TPESampler,COMPLETE
1807,0.7105690610052176,2025-04-24 21:12:03.507948,2025-04-24 21:12:04.272735,0 days 00:00:00.764787,absolute_error,32,sqrt,1,3,random,TPESampler,COMPLETE
1808,1.1917180697270022,2025-04-24 21:12:03.725754,2025-04-24 21:12:05.013820,0 days 00:00:01.288066,absolute_error,32,sqrt,1,6,random,TPESampler,COMPLETE
1809,1.2418622399379184,2025-04-24 21:12:03.809578,2025-04-24 21:12:04.870683,0 days 00:00:01.061105,absolute_error,31,sqrt,1,3,random,TPESampler,COMPLETE
1810,1.0782824056673017,2025-04-24 21:12:04.575836,2025-04-24 21:12:05.322951,0 days 00:00:00.747115,absolute_error,17,sqrt,1,4,random,TPESampler,COMPLETE
1811,1.4148597056909755,2025-04-24 21:12:05.280650,2025-04-24 21:12:06.339053,0 days 00:00:01.058403,absolute_error,18,log2,6,3,random,TPESampler,COMPLETE
1812,1.335711393574172,2025-04-24 21:12:05.313759,2025-04-24 21:12:06.486806,0 days 00:00:01.173047,absolute_error,26,sqrt,3,2,random,TPESampler,COMPLETE
1813,0.7475826604084083,2025-04-24 21:12:05.985558,2025-04-24 21:12:06.959081,0 days 00:00:00.973523,squared_error,30,sqrt,1,5,best,TPESampler,COMPLETE
1814,1.2076965740491883,2025-04-24 21:12:06.855742,2025-04-24 21:12:07.929776,0 days 00:00:01.074034,absolute_error,30,sqrt,3,2,best,TPESampler,COMPLETE
1815,0.610896094172543,2025-04-24 21:12:06.920986,2025-04-24 21:12:08.174976,0 days 00:00:01.253990,absolute_error,26,sqrt,1,2,best,TPESampler,COMPLETE
1816,0.6353676108874886,2025-04-24 21:12:07.231990,2025-04-24 21:12:08.312843,0 days 00:00:01.080853,absolute_error,26,sqrt,1,5,best,TPESampler,COMPLETE
1817,1.3679729947669532,2025-04-24 21:12:08.236489,2025-04-24 21:12:09.049376,0 days 00:00:00.812887,friedman_mse,19,log2,6,16,random,TPESampler,COMPLETE
1818,0.555832913159586,2025-04-24 21:12:08.482151,2025-04-24 21:12:09.652315,0 days 00:00:01.170164,absolute_error,32,sqrt,1,2,best,TPESampler,COMPLETE
1819,0.856297005325639,2025-04-24 21:12:08.644308,2025-04-24 21:12:09.899337,0 days 00:00:01.255029,absolute_error,28,sqrt,1,2,best,TPESampler,COMPLETE
1820,1.335711393574172,2025-04-24 21:12:09.592859,2025-04-24 21:12:10.630992,0 days 00:00:01.038133,absolute_error,29,sqrt,3,2,random,TPESampler,COMPLETE
1821,1.3187513250101375,2025-04-24 21:12:09.994434,2025-04-24 21:12:11.231371,0 days 00:00:01.236937,absolute_error,30,sqrt,2,2,random,TPESampler,COMPLETE
1822,0.6964980049699784,2025-04-24 21:12:10.274595,2025-04-24 21:12:11.463978,0 days 00:00:01.189383,absolute_error,33,sqrt,1,2,random,TPESampler,COMPLETE
1823,1.2076965740491883,2025-04-24 21:12:10.958868,2025-04-24 21:12:12.032890,0 days 00:00:01.074022,absolute_error,31,sqrt,3,5,best,TPESampler,COMPLETE
1824,1.2076965740491883,2025-04-24 21:12:11.505106,2025-04-24 21:12:12.612516,0 days 00:00:01.107410,absolute_error,31,sqrt,3,2,best,TPESampler,COMPLETE
1825,0.5872420994323145,2025-04-24 21:12:11.856154,2025-04-24 21:12:12.879853,0 days 00:00:01.023699,absolute_error,35,sqrt,1,2,best,TPESampler,COMPLETE
1826,0.5872420994323145,2025-04-24 21:12:12.303337,2025-04-24 21:12:13.150535,0 days 00:00:00.847198,absolute_error,35,sqrt,1,2,best,TPESampler,COMPLETE
1827,0.7178070808109186,2025-04-24 21:12:12.934752,2025-04-24 21:12:13.932104,0 days 00:00:00.997352,absolute_error,30,sqrt,1,9,best,TPESampler,COMPLETE
1828,0.856297005325639,2025-04-24 21:12:13.155225,2025-04-24 21:12:14.302797,0 days 00:00:01.147572,absolute_error,28,sqrt,1,2,best,TPESampler,COMPLETE
1829,1.1762267009527727,2025-04-24 21:12:13.456921,2025-04-24 21:12:14.345616,0 days 00:00:00.888695,squared_error,31,sqrt,2,2,random,TPESampler,COMPLETE
1830,0.9312073070199461,2025-04-24 21:12:14.201518,2025-04-24 21:12:15.240222,0 days 00:00:01.038704,absolute_error,30,sqrt,1,5,best,TPESampler,COMPLETE
1831,0.5517216241439309,2025-04-24 21:12:14.585767,2025-04-24 21:12:15.616578,0 days 00:00:01.030811,absolute_error,32,sqrt,1,2,random,TPESampler,COMPLETE
1832,1.4041352399815534,2025-04-24 21:12:14.631167,2025-04-24 21:12:15.624516,0 days 00:00:00.993349,absolute_error,8,log2,1,2,random,TPESampler,COMPLETE
1833,1.335711393574172,2025-04-24 21:12:15.534559,2025-04-24 21:12:16.321041,0 days 00:00:00.786482,absolute_error,32,sqrt,3,2,random,TPESampler,COMPLETE
1834,1.005467895307365,2025-04-24 21:12:15.833805,2025-04-24 21:12:16.776823,0 days 00:00:00.943018,absolute_error,31,sqrt,1,2,random,TPESampler,COMPLETE
1835,1.39690460665991,2025-04-24 21:12:15.949572,2025-04-24 21:12:17.114863,0 days 00:00:01.165291,absolute_error,32,log2,3,2,random,TPESampler,COMPLETE
1836,0.9860869366393894,2025-04-24 21:12:16.729162,2025-04-24 21:12:17.681654,0 days 00:00:00.952492,absolute_error,30,sqrt,1,2,random,TPESampler,COMPLETE
1837,0.5517216241439309,2025-04-24 21:12:17.071439,2025-04-24 21:12:18.229366,0 days 00:00:01.157927,absolute_error,32,sqrt,1,2,random,TPESampler,COMPLETE
1838,1.0297478661477455,2025-04-24 21:12:17.409664,2025-04-24 21:12:18.523945,0 days 00:00:01.114281,absolute_error,32,sqrt,1,5,random,TPESampler,COMPLETE
1839,0.8356479176587005,2025-04-24 21:12:18.495493,2025-04-24 21:12:19.497616,0 days 00:00:01.002123,absolute_error,26,sqrt,1,5,random,TPESampler,COMPLETE
1840,1.1302409528743838,2025-04-24 21:12:18.559650,2025-04-24 21:12:19.687149,0 days 00:00:01.127499,absolute_error,24,sqrt,2,5,best,TPESampler,COMPLETE
1841,1.3187513250101375,2025-04-24 21:12:19.053993,2025-04-24 21:12:20.019807,0 days 00:00:00.965814,absolute_error,33,sqrt,2,3,random,TPESampler,COMPLETE
1842,0.6234752034897817,2025-04-24 21:12:19.852814,2025-04-24 21:12:20.676127,0 days 00:00:00.823313,absolute_error,34,sqrt,1,2,random,TPESampler,COMPLETE
1843,1.060761770159566,2025-04-24 21:12:19.943686,2025-04-24 21:12:20.901065,0 days 00:00:00.957379,absolute_error,28,sqrt,1,4,random,TPESampler,COMPLETE
1844,1.3187513250101375,2025-04-24 21:12:20.327565,2025-04-24 21:12:21.216820,0 days 00:00:00.889255,absolute_error,35,sqrt,2,2,random,TPESampler,COMPLETE
1845,1.2119861239647682,2025-04-24 21:12:20.945768,2025-04-24 21:12:21.861611,0 days 00:00:00.915843,absolute_error,29,sqrt,1,2,random,TPESampler,COMPLETE
1846,1.33707615296096,2025-04-24 21:12:21.173900,2025-04-24 21:12:22.271645,0 days 00:00:01.097745,absolute_error,34,sqrt,4,2,random,TPESampler,COMPLETE
1847,0.6785347225984457,2025-04-24 21:12:21.472419,2025-04-24 21:12:22.331072,0 days 00:00:00.858653,absolute_error,35,sqrt,1,5,random,TPESampler,COMPLETE
1848,0.9860869366393894,2025-04-24 21:12:22.181049,2025-04-24 21:12:23.033024,0 days 00:00:00.851975,absolute_error,30,sqrt,1,2,random,TPESampler,COMPLETE
1849,0.6750005427680865,2025-04-24 21:12:22.595585,2025-04-24 21:12:23.489101,0 days 00:00:00.893516,absolute_error,30,sqrt,1,5,random,TPESampler,COMPLETE
1850,1.335711393574172,2025-04-24 21:12:22.647897,2025-04-24 21:12:23.877120,0 days 00:00:01.229223,absolute_error,35,sqrt,3,3,random,TPESampler,COMPLETE
1851,1.3187513250101375,2025-04-24 21:12:23.438256,2025-04-24 21:12:24.204524,0 days 00:00:00.766268,absolute_error,32,sqrt,2,3,random,TPESampler,COMPLETE
