number,value,datetime_start,datetime_complete,duration,params_criterion,params_max_depth,params_max_features,params_min_samples_leaf,params_min_samples_split,params_splitter,system_attrs_auto:sampler,state
1001,0.6112778743973727,2025-04-24 21:06:35.886749,2025-04-24 21:06:36.610343,0 days 00:00:00.723594,absolute_error,29,sqrt,1,2,best,TPESampler,COMPLETE
1002,0.6755787793007089,2025-04-24 21:06:36.149756,2025-04-24 21:06:36.863736,0 days 00:00:00.713980,absolute_error,35,sqrt,1,5,best,TPESampler,COMPLETE
1003,0.7592811383434773,2025-04-24 21:06:36.763793,2025-04-24 21:06:37.689915,0 days 00:00:00.926122,squared_error,26,sqrt,1,5,best,TPESampler,COMPLETE
1004,1.3416769911136657,2025-04-24 21:06:36.817149,2025-04-24 21:06:37.645840,0 days 00:00:00.828691,absolute_error,23,sqrt,7,14,random,TPESampler,COMPLETE
1005,0.6976006612165097,2025-04-24 21:06:37.081954,2025-04-24 21:06:37.933248,0 days 00:00:00.851294,absolute_error,20,log2,1,2,best,TPESampler,COMPLETE
1006,0.5682124588118789,2025-04-24 21:06:37.874063,2025-04-24 21:06:38.690565,0 days 00:00:00.816502,absolute_error,27,sqrt,1,2,best,TPESampler,COMPLETE
1007,1.2076965740491883,2025-04-24 21:06:37.931214,2025-04-24 21:06:38.972265,0 days 00:00:01.041051,absolute_error,32,sqrt,3,2,best,TPESampler,COMPLETE
1008,1.2076965740491883,2025-04-24 21:06:38.186603,2025-04-24 21:06:39.001148,0 days 00:00:00.814545,absolute_error,28,sqrt,3,2,best,TPESampler,COMPLETE
1009,0.5542791023918845,2025-04-24 21:06:38.921512,2025-04-24 21:06:39.648490,0 days 00:00:00.726978,absolute_error,31,sqrt,1,2,best,TPESampler,COMPLETE
1010,0.7033595174659969,2025-04-24 21:06:39.152586,2025-04-24 21:06:40.040418,0 days 00:00:00.887832,absolute_error,28,sqrt,1,5,best,TPESampler,COMPLETE
1011,1.335711393574172,2025-04-24 21:06:39.259756,2025-04-24 21:06:40.132426,0 days 00:00:00.872670,absolute_error,32,sqrt,3,2,random,TPESampler,COMPLETE
1012,0.9996424324783258,2025-04-24 21:06:39.982267,2025-04-24 21:06:40.720001,0 days 00:00:00.737734,absolute_error,30,sqrt,2,2,best,TPESampler,COMPLETE
1013,0.555832913159586,2025-04-24 21:06:40.261856,2025-04-24 21:06:41.068160,0 days 00:00:00.806304,absolute_error,32,sqrt,1,2,best,TPESampler,COMPLETE
1014,0.5542791023918845,2025-04-24 21:06:40.360923,2025-04-24 21:06:41.307207,0 days 00:00:00.946284,absolute_error,31,sqrt,1,2,best,TPESampler,COMPLETE
1015,1.092772879039125,2025-04-24 21:06:41.021898,2025-04-24 21:06:41.787457,0 days 00:00:00.765559,absolute_error,24,sqrt,1,2,best,TPESampler,COMPLETE
1016,1.1302409528743838,2025-04-24 21:06:41.377068,2025-04-24 21:06:42.168987,0 days 00:00:00.791919,absolute_error,24,sqrt,2,5,best,TPESampler,COMPLETE
1017,1.3351812185314336,2025-04-24 21:06:41.534911,2025-04-24 21:06:42.455068,0 days 00:00:00.920157,squared_error,12,log2,2,3,random,TPESampler,COMPLETE
1018,1.2728267614075626,2025-04-24 21:06:42.122212,2025-04-24 21:06:42.855132,0 days 00:00:00.732920,friedman_mse,31,sqrt,7,20,random,TPESampler,COMPLETE
1019,0.6310502563923985,2025-04-24 21:06:42.503168,2025-04-24 21:06:43.225713,0 days 00:00:00.722545,absolute_error,33,sqrt,1,5,best,TPESampler,COMPLETE
1020,0.5542791023918845,2025-04-24 21:06:42.759652,2025-04-24 21:06:43.571490,0 days 00:00:00.811838,absolute_error,31,sqrt,1,2,best,TPESampler,COMPLETE
1021,1.4148597056909755,2025-04-24 21:06:43.125225,2025-04-24 21:06:43.917601,0 days 00:00:00.792376,absolute_error,24,log2,9,14,random,TPESampler,COMPLETE
1022,0.9996424324783258,2025-04-24 21:06:43.480379,2025-04-24 21:06:44.292135,0 days 00:00:00.811756,absolute_error,35,sqrt,2,2,best,TPESampler,COMPLETE
1023,0.7084730562241784,2025-04-24 21:06:43.811528,2025-04-24 21:06:44.765900,0 days 00:00:00.954372,absolute_error,32,sqrt,1,5,best,TPESampler,COMPLETE
1024,0.610896094172543,2025-04-24 21:06:44.244196,2025-04-24 21:06:45.047356,0 days 00:00:00.803160,absolute_error,26,sqrt,1,2,best,TPESampler,COMPLETE
1025,0.9194592887273054,2025-04-24 21:06:44.545745,2025-04-24 21:06:45.194059,0 days 00:00:00.648314,absolute_error,27,sqrt,1,5,best,TPESampler,COMPLETE
1026,0.5872420994323145,2025-04-24 21:06:45.057208,2025-04-24 21:06:45.750888,0 days 00:00:00.693680,absolute_error,35,sqrt,1,2,best,TPESampler,COMPLETE
1027,0.9996424324783258,2025-04-24 21:06:45.267807,2025-04-24 21:06:46.146241,0 days 00:00:00.878434,absolute_error,30,sqrt,2,2,best,TPESampler,COMPLETE
1028,1.2076965740491883,2025-04-24 21:06:45.510218,2025-04-24 21:06:46.390786,0 days 00:00:00.880568,absolute_error,31,sqrt,3,2,best,TPESampler,COMPLETE
1029,0.7495346713750386,2025-04-24 21:06:46.103823,2025-04-24 21:06:46.773366,0 days 00:00:00.669543,absolute_error,30,sqrt,1,2,best,TPESampler,COMPLETE
1030,1.1302409528743838,2025-04-24 21:06:46.479397,2025-04-24 21:06:47.321300,0 days 00:00:00.841903,absolute_error,30,sqrt,2,5,best,TPESampler,COMPLETE
1031,1.4148597056909755,2025-04-24 21:06:46.670517,2025-04-24 21:06:47.483520,0 days 00:00:00.813003,absolute_error,31,log2,6,19,random,TPESampler,COMPLETE
1032,0.9970333222906006,2025-04-24 21:06:46.990314,2025-04-24 21:06:47.777197,0 days 00:00:00.786883,absolute_error,25,sqrt,1,5,best,TPESampler,COMPLETE
1033,1.3408130340550188,2025-04-24 21:06:47.626080,2025-04-24 21:06:48.496538,0 days 00:00:00.870458,absolute_error,22,sqrt,7,5,best,TPESampler,COMPLETE
1034,1.2076965740491883,2025-04-24 21:06:47.734843,2025-04-24 21:06:48.563102,0 days 00:00:00.828259,absolute_error,34,sqrt,3,5,best,TPESampler,COMPLETE
1035,0.7240040268774914,2025-04-24 21:06:48.237926,2025-04-24 21:06:48.867265,0 days 00:00:00.629339,squared_error,5,log2,1,9,best,TPESampler,COMPLETE
1036,0.6288399089804382,2025-04-24 21:06:48.757057,2025-04-24 21:06:49.675444,0 days 00:00:00.918387,absolute_error,31,sqrt,1,5,best,TPESampler,COMPLETE
1037,0.7495346713750386,2025-04-24 21:06:48.806796,2025-04-24 21:06:49.935114,0 days 00:00:01.128318,absolute_error,30,sqrt,1,2,best,TPESampler,COMPLETE
1038,0.5872420994323145,2025-04-24 21:06:49.113886,2025-04-24 21:06:50.004332,0 days 00:00:00.890446,absolute_error,35,sqrt,1,2,best,TPESampler,COMPLETE
1039,0.610896094172543,2025-04-24 21:06:49.963179,2025-04-24 21:06:50.724254,0 days 00:00:00.761075,absolute_error,26,sqrt,1,2,best,TPESampler,COMPLETE
1040,0.6812608722646134,2025-04-24 21:06:50.134712,2025-04-24 21:06:51.011993,0 days 00:00:00.877281,absolute_error,29,log2,1,2,best,TPESampler,COMPLETE
1041,1.2076965740491883,2025-04-24 21:06:50.359817,2025-04-24 21:06:51.206720,0 days 00:00:00.846903,absolute_error,26,sqrt,3,2,best,TPESampler,COMPLETE
1042,0.555832913159586,2025-04-24 21:06:51.057975,2025-04-24 21:06:51.712909,0 days 00:00:00.654934,absolute_error,32,sqrt,1,2,best,TPESampler,COMPLETE
1043,1.0236056098557604,2025-04-24 21:06:51.258436,2025-04-24 21:06:52.097497,0 days 00:00:00.839061,squared_error,35,sqrt,2,10,best,TPESampler,COMPLETE
1044,1.3677569516816517,2025-04-24 21:06:51.473334,2025-04-24 21:06:52.483325,0 days 00:00:01.009991,friedman_mse,24,log2,10,3,best,TPESampler,COMPLETE
1045,0.6755787793007089,2025-04-24 21:06:52.051290,2025-04-24 21:06:52.843405,0 days 00:00:00.792115,absolute_error,35,sqrt,1,5,best,TPESampler,COMPLETE
1046,1.3677569516816517,2025-04-24 21:06:52.386036,2025-04-24 21:06:53.158190,0 days 00:00:00.772154,squared_error,17,log2,5,19,best,TPESampler,COMPLETE
1047,1.2076965740491883,2025-04-24 21:06:52.789427,2025-04-24 21:06:53.476973,0 days 00:00:00.687546,absolute_error,29,sqrt,3,2,best,TPESampler,COMPLETE
1048,0.8399129490138849,2025-04-24 21:06:53.146684,2025-04-24 21:06:53.894518,0 days 00:00:00.747834,squared_error,29,sqrt,2,2,best,TPESampler,COMPLETE
1049,1.0099953635558898,2025-04-24 21:06:53.439937,2025-04-24 21:06:54.222827,0 days 00:00:00.782890,absolute_error,23,sqrt,1,2,best,TPESampler,COMPLETE
1050,1.2076965740491883,2025-04-24 21:06:53.714875,2025-04-24 21:06:54.583055,0 days 00:00:00.868180,absolute_error,35,sqrt,3,2,best,TPESampler,COMPLETE
1051,0.9312073070199461,2025-04-24 21:06:54.192248,2025-04-24 21:06:54.992173,0 days 00:00:00.799925,absolute_error,30,sqrt,1,5,best,TPESampler,COMPLETE
1052,0.7495346713750386,2025-04-24 21:06:54.488495,2025-04-24 21:06:55.318398,0 days 00:00:00.829903,absolute_error,30,sqrt,1,2,best,TPESampler,COMPLETE
1053,0.555832913159586,2025-04-24 21:06:54.837277,2025-04-24 21:06:55.593881,0 days 00:00:00.756604,absolute_error,32,sqrt,1,2,best,TPESampler,COMPLETE
1054,1.2076965740491883,2025-04-24 21:06:55.281555,2025-04-24 21:06:56.149162,0 days 00:00:00.867607,absolute_error,35,sqrt,3,5,best,TPESampler,COMPLETE
1055,1.3677569516816517,2025-04-24 21:06:55.596681,2025-04-24 21:06:56.453205,0 days 00:00:00.856524,friedman_mse,11,log2,6,4,best,TPESampler,COMPLETE
1056,0.9312073070199461,2025-04-24 21:06:55.974957,2025-04-24 21:06:56.777286,0 days 00:00:00.802329,absolute_error,30,sqrt,1,5,best,TPESampler,COMPLETE
1057,1.2076965740491883,2025-04-24 21:06:56.459799,2025-04-24 21:06:57.333907,0 days 00:00:00.874108,absolute_error,30,sqrt,3,5,best,TPESampler,COMPLETE
1058,0.5872420994323145,2025-04-24 21:06:56.658898,2025-04-24 21:06:57.530486,0 days 00:00:00.871588,absolute_error,35,sqrt,1,2,best,TPESampler,COMPLETE
1059,0.9996424324783258,2025-04-24 21:06:56.992230,2025-04-24 21:06:57.722388,0 days 00:00:00.730158,absolute_error,25,sqrt,2,2,best,TPESampler,COMPLETE
1060,0.7495346713750386,2025-04-24 21:06:57.595989,2025-04-24 21:06:58.279678,0 days 00:00:00.683689,absolute_error,30,sqrt,1,2,best,TPESampler,COMPLETE
1061,0.610896094172543,2025-04-24 21:06:57.794814,2025-04-24 21:06:58.800194,0 days 00:00:01.005380,absolute_error,26,sqrt,1,2,best,TPESampler,COMPLETE
1062,1.0313227598578136,2025-04-24 21:06:57.994367,2025-04-24 21:06:58.977460,0 days 00:00:00.983093,absolute_error,23,sqrt,1,5,best,TPESampler,COMPLETE
1063,0.9312073070199461,2025-04-24 21:06:58.610788,2025-04-24 21:06:59.385359,0 days 00:00:00.774571,absolute_error,30,sqrt,1,5,best,TPESampler,COMPLETE
1064,0.7367734144772758,2025-04-24 21:06:59.011921,2025-04-24 21:06:59.792109,0 days 00:00:00.780188,absolute_error,29,sqrt,1,5,random,TPESampler,COMPLETE
1065,0.7259592001861561,2025-04-24 21:06:59.282360,2025-04-24 21:07:00.128682,0 days 00:00:00.846322,friedman_mse,30,sqrt,1,4,best,TPESampler,COMPLETE
1066,1.005467895307365,2025-04-24 21:06:59.624614,2025-04-24 21:07:00.496899,0 days 00:00:00.872285,absolute_error,31,sqrt,1,2,random,TPESampler,COMPLETE
1067,1.3679729947669532,2025-04-24 21:07:00.020276,2025-04-24 21:07:00.780385,0 days 00:00:00.760109,squared_error,5,log2,7,20,random,TPESampler,COMPLETE
1068,1.2675211112043427,2025-04-24 21:07:00.433928,2025-04-24 21:07:01.267797,0 days 00:00:00.833869,friedman_mse,35,sqrt,4,7,random,TPESampler,COMPLETE
1069,0.856297005325639,2025-04-24 21:07:00.952076,2025-04-24 21:07:01.826829,0 days 00:00:00.874753,absolute_error,28,sqrt,1,2,best,TPESampler,COMPLETE
1070,1.2076965740491883,2025-04-24 21:07:01.065303,2025-04-24 21:07:01.989244,0 days 00:00:00.923941,absolute_error,30,sqrt,3,2,best,TPESampler,COMPLETE
1071,0.9892601680224912,2025-04-24 21:07:01.510815,2025-04-24 21:07:02.263572,0 days 00:00:00.752757,absolute_error,33,log2,2,6,best,TPESampler,COMPLETE
1072,0.6288399089804382,2025-04-24 21:07:02.058427,2025-04-24 21:07:02.825466,0 days 00:00:00.767039,absolute_error,31,sqrt,1,5,best,TPESampler,COMPLETE
1073,0.6755787793007089,2025-04-24 21:07:02.232655,2025-04-24 21:07:03.220763,0 days 00:00:00.988108,absolute_error,35,sqrt,1,5,best,TPESampler,COMPLETE
1074,0.9996424324783258,2025-04-24 21:07:02.475899,2025-04-24 21:07:03.373555,0 days 00:00:00.897656,absolute_error,31,sqrt,2,2,best,TPESampler,COMPLETE
1075,1.2076965740491883,2025-04-24 21:07:03.148139,2025-04-24 21:07:03.889003,0 days 00:00:00.740864,absolute_error,26,sqrt,3,5,best,TPESampler,COMPLETE
1076,0.555832913159586,2025-04-24 21:07:03.491223,2025-04-24 21:07:04.246619,0 days 00:00:00.755396,absolute_error,32,sqrt,1,2,best,TPESampler,COMPLETE
1077,0.5872420994323145,2025-04-24 21:07:03.709595,2025-04-24 21:07:04.585575,0 days 00:00:00.875980,absolute_error,35,sqrt,1,2,best,TPESampler,COMPLETE
1078,0.555832913159586,2025-04-24 21:07:04.121471,2025-04-24 21:07:04.828731,0 days 00:00:00.707260,absolute_error,32,sqrt,1,2,best,TPESampler,COMPLETE
1079,1.2076965740491883,2025-04-24 21:07:04.549037,2025-04-24 21:07:05.347841,0 days 00:00:00.798804,absolute_error,31,sqrt,3,5,best,TPESampler,COMPLETE
1080,1.3677569516816517,2025-04-24 21:07:04.827286,2025-04-24 21:07:05.483310,0 days 00:00:00.656024,friedman_mse,33,log2,8,8,best,TPESampler,COMPLETE
1081,1.0447560661400384,2025-04-24 21:07:05.067465,2025-04-24 21:07:05.958195,0 days 00:00:00.890730,friedman_mse,26,sqrt,2,6,best,TPESampler,COMPLETE
1082,0.7495346713750386,2025-04-24 21:07:05.609658,2025-04-24 21:07:06.670571,0 days 00:00:01.060913,absolute_error,30,sqrt,1,2,best,TPESampler,COMPLETE
1083,1.3365908817218308,2025-04-24 21:07:05.782374,2025-04-24 21:07:06.820104,0 days 00:00:01.037730,absolute_error,34,sqrt,3,19,random,TPESampler,COMPLETE
1084,1.1302409528743838,2025-04-24 21:07:06.284013,2025-04-24 21:07:07.275070,0 days 00:00:00.991057,absolute_error,25,sqrt,2,5,best,TPESampler,COMPLETE
1085,0.610896094172543,2025-04-24 21:07:06.889475,2025-04-24 21:07:07.789572,0 days 00:00:00.900097,absolute_error,26,sqrt,1,2,best,TPESampler,COMPLETE
1086,0.956874881353438,2025-04-24 21:07:07.262655,2025-04-24 21:07:07.982484,0 days 00:00:00.719829,squared_error,31,sqrt,6,19,best,TPESampler,COMPLETE
1087,0.9194592887273054,2025-04-24 21:07:07.553745,2025-04-24 21:07:08.705739,0 days 00:00:01.151994,absolute_error,27,sqrt,1,5,best,TPESampler,COMPLETE
1088,0.9996424324783258,2025-04-24 21:07:08.072466,2025-04-24 21:07:08.919561,0 days 00:00:00.847095,absolute_error,30,sqrt,2,2,best,TPESampler,COMPLETE
1089,1.3677569516816517,2025-04-24 21:07:08.218771,2025-04-24 21:07:09.029390,0 days 00:00:00.810619,friedman_mse,15,log2,8,11,best,TPESampler,COMPLETE
1090,0.6919576112851691,2025-04-24 21:07:08.939873,2025-04-24 21:07:10.013692,0 days 00:00:01.073819,squared_error,28,sqrt,1,2,best,TPESampler,COMPLETE
1091,0.7495346713750386,2025-04-24 21:07:09.467568,2025-04-24 21:07:10.571641,0 days 00:00:01.104073,absolute_error,30,sqrt,1,2,best,TPESampler,COMPLETE
1092,1.2076965740491883,2025-04-24 21:07:09.724961,2025-04-24 21:07:10.871222,0 days 00:00:01.146261,absolute_error,30,sqrt,3,2,best,TPESampler,COMPLETE
1093,0.6288399089804382,2025-04-24 21:07:10.430481,2025-04-24 21:07:11.366209,0 days 00:00:00.935728,absolute_error,31,sqrt,1,5,best,TPESampler,COMPLETE
1094,0.7495346713750386,2025-04-24 21:07:10.941993,2025-04-24 21:07:11.737763,0 days 00:00:00.795770,absolute_error,30,sqrt,1,2,best,TPESampler,COMPLETE
1095,0.6112778743973727,2025-04-24 21:07:11.122873,2025-04-24 21:07:12.079894,0 days 00:00:00.957021,absolute_error,29,sqrt,1,2,best,TPESampler,COMPLETE
1096,0.680762371433113,2025-04-24 21:07:11.649557,2025-04-24 21:07:12.516171,0 days 00:00:00.866614,friedman_mse,32,sqrt,1,2,best,TPESampler,COMPLETE
1097,1.4169796832743113,2025-04-24 21:07:12.053825,2025-04-24 21:07:12.978779,0 days 00:00:00.924954,absolute_error,2,sqrt,9,12,random,TPESampler,COMPLETE
1098,1.2076965740491883,2025-04-24 21:07:12.518540,2025-04-24 21:07:13.314617,0 days 00:00:00.796077,absolute_error,35,sqrt,3,5,best,TPESampler,COMPLETE
1099,0.6598205726585867,2025-04-24 21:07:12.870582,2025-04-24 21:07:13.706401,0 days 00:00:00.835819,squared_error,33,sqrt,1,2,best,TPESampler,COMPLETE
1100,0.9312073070199461,2025-04-24 21:07:13.266595,2025-04-24 21:07:14.065853,0 days 00:00:00.799258,absolute_error,30,sqrt,1,5,best,TPESampler,COMPLETE
1101,0.6755787793007089,2025-04-24 21:07:13.544260,2025-04-24 21:07:14.430740,0 days 00:00:00.886480,absolute_error,35,sqrt,1,5,best,TPESampler,COMPLETE
1102,0.8465624319698303,2025-04-24 21:07:13.960522,2025-04-24 21:07:14.822533,0 days 00:00:00.862011,absolute_error,33,sqrt,1,2,best,TPESampler,COMPLETE
1103,0.9996424324783258,2025-04-24 21:07:14.364406,2025-04-24 21:07:15.178438,0 days 00:00:00.814032,absolute_error,35,sqrt,2,2,best,TPESampler,COMPLETE
1104,0.8289750887242672,2025-04-24 21:07:14.657800,2025-04-24 21:07:15.586978,0 days 00:00:00.929178,squared_error,27,log2,2,18,best,TPESampler,COMPLETE
1105,0.9996424324783258,2025-04-24 21:07:15.124675,2025-04-24 21:07:15.912688,0 days 00:00:00.788013,absolute_error,27,sqrt,2,2,best,TPESampler,COMPLETE
1106,1.2076965740491883,2025-04-24 21:07:15.496870,2025-04-24 21:07:16.303586,0 days 00:00:00.806716,absolute_error,26,sqrt,3,2,best,TPESampler,COMPLETE
1107,1.2076965740491883,2025-04-24 21:07:15.872220,2025-04-24 21:07:16.667412,0 days 00:00:00.795192,absolute_error,27,sqrt,3,5,best,TPESampler,COMPLETE
1108,0.5872420994323145,2025-04-24 21:07:16.130019,2025-04-24 21:07:16.930082,0 days 00:00:00.800063,absolute_error,35,sqrt,1,2,best,TPESampler,COMPLETE
1109,1.092772879039125,2025-04-24 21:07:16.625454,2025-04-24 21:07:17.417777,0 days 00:00:00.792323,absolute_error,24,sqrt,1,2,best,TPESampler,COMPLETE
1110,0.851370255680307,2025-04-24 21:07:16.892398,2025-04-24 21:07:17.672065,0 days 00:00:00.779667,absolute_error,18,sqrt,1,2,best,TPESampler,COMPLETE
1111,0.6112778743973727,2025-04-24 21:07:17.173936,2025-04-24 21:07:18.240955,0 days 00:00:01.067019,absolute_error,29,sqrt,1,2,best,TPESampler,COMPLETE
1112,1.359571383264774,2025-04-24 21:07:17.673189,2025-04-24 21:07:18.601827,0 days 00:00:00.928638,squared_error,3,sqrt,10,14,best,TPESampler,COMPLETE
1113,0.7033595174659969,2025-04-24 21:07:18.123804,2025-04-24 21:07:19.006411,0 days 00:00:00.882607,absolute_error,28,sqrt,1,5,best,TPESampler,COMPLETE
1114,1.2076965740491883,2025-04-24 21:07:18.536856,2025-04-24 21:07:19.442378,0 days 00:00:00.905522,absolute_error,35,sqrt,3,2,best,TPESampler,COMPLETE
1115,0.5542791023918845,2025-04-24 21:07:18.945943,2025-04-24 21:07:19.849328,0 days 00:00:00.903385,absolute_error,31,sqrt,1,2,best,TPESampler,COMPLETE
1116,0.9996424324783258,2025-04-24 21:07:19.250022,2025-04-24 21:07:20.232331,0 days 00:00:00.982309,absolute_error,26,sqrt,2,2,best,TPESampler,COMPLETE
1117,1.372185540556408,2025-04-24 21:07:19.808695,2025-04-24 21:07:20.573778,0 days 00:00:00.765083,friedman_mse,2,sqrt,10,14,best,TPESampler,COMPLETE
1118,1.2076965740491883,2025-04-24 21:07:20.068243,2025-04-24 21:07:20.966112,0 days 00:00:00.897869,absolute_error,31,sqrt,3,5,best,TPESampler,COMPLETE
1119,0.9312073070199461,2025-04-24 21:07:20.530500,2025-04-24 21:07:21.337031,0 days 00:00:00.806531,absolute_error,30,sqrt,1,5,best,TPESampler,COMPLETE
1120,0.856297005325639,2025-04-24 21:07:20.934565,2025-04-24 21:07:21.885786,0 days 00:00:00.951221,absolute_error,28,sqrt,1,2,best,TPESampler,COMPLETE
1121,1.3416769911136657,2025-04-24 21:07:21.269896,2025-04-24 21:07:22.111588,0 days 00:00:00.841692,absolute_error,35,sqrt,7,12,random,TPESampler,COMPLETE
1122,0.7495346713750386,2025-04-24 21:07:21.634729,2025-04-24 21:07:22.546294,0 days 00:00:00.911565,absolute_error,30,sqrt,1,2,best,TPESampler,COMPLETE
1123,0.5542791023918845,2025-04-24 21:07:22.185988,2025-04-24 21:07:23.136052,0 days 00:00:00.950064,absolute_error,31,sqrt,1,2,best,TPESampler,COMPLETE
1124,1.2076965740491883,2025-04-24 21:07:22.501132,2025-04-24 21:07:23.439821,0 days 00:00:00.938689,absolute_error,32,sqrt,3,2,best,TPESampler,COMPLETE
1125,0.6755787793007089,2025-04-24 21:07:22.788451,2025-04-24 21:07:23.626212,0 days 00:00:00.837761,absolute_error,35,sqrt,1,5,best,TPESampler,COMPLETE
1126,0.5872420994323145,2025-04-24 21:07:23.379289,2025-04-24 21:07:24.072757,0 days 00:00:00.693468,absolute_error,35,sqrt,1,2,best,TPESampler,COMPLETE
1127,1.33707615296096,2025-04-24 21:07:23.734935,2025-04-24 21:07:24.511095,0 days 00:00:00.776160,absolute_error,17,sqrt,4,11,random,TPESampler,COMPLETE
1128,1.3390163188386321,2025-04-24 21:07:23.879461,2025-04-24 21:07:24.700133,0 days 00:00:00.820672,squared_error,19,sqrt,7,7,best,TPESampler,COMPLETE
1129,0.9312073070199461,2025-04-24 21:07:24.400444,2025-04-24 21:07:25.165484,0 days 00:00:00.765040,absolute_error,30,sqrt,1,5,best,TPESampler,COMPLETE
1130,0.5713387065834993,2025-04-24 21:07:24.830647,2025-04-24 21:07:25.588624,0 days 00:00:00.757977,absolute_error,25,sqrt,1,2,best,TPESampler,COMPLETE
1131,0.5682124588118789,2025-04-24 21:07:24.981854,2025-04-24 21:07:25.915954,0 days 00:00:00.934100,absolute_error,27,sqrt,1,2,best,TPESampler,COMPLETE
1132,1.0131068116827324,2025-04-24 21:07:25.485213,2025-04-24 21:07:26.297990,0 days 00:00:00.812777,absolute_error,29,log2,3,2,best,TPESampler,COMPLETE
1133,1.2076965740491883,2025-04-24 21:07:25.815104,2025-04-24 21:07:26.566321,0 days 00:00:00.751217,absolute_error,30,sqrt,3,5,best,TPESampler,COMPLETE
1134,1.2076965740491883,2025-04-24 21:07:26.242914,2025-04-24 21:07:27.143201,0 days 00:00:00.900287,absolute_error,35,sqrt,3,2,best,TPESampler,COMPLETE
1135,0.666729144139305,2025-04-24 21:07:26.768814,2025-04-24 21:07:27.683169,0 days 00:00:00.914355,absolute_error,24,sqrt,1,5,best,TPESampler,COMPLETE
1136,1.2076965740491883,2025-04-24 21:07:26.923499,2025-04-24 21:07:27.855205,0 days 00:00:00.931706,absolute_error,29,sqrt,3,2,best,TPESampler,COMPLETE
1137,0.5872420994323145,2025-04-24 21:07:27.426974,2025-04-24 21:07:28.235817,0 days 00:00:00.808843,absolute_error,35,sqrt,1,2,best,TPESampler,COMPLETE
1138,1.0416889220350627,2025-04-24 21:07:27.947253,2025-04-24 21:07:28.788456,0 days 00:00:00.841203,absolute_error,29,sqrt,2,9,best,TPESampler,COMPLETE
1139,0.5542791023918845,2025-04-24 21:07:28.149682,2025-04-24 21:07:28.929221,0 days 00:00:00.779539,absolute_error,31,sqrt,1,2,best,TPESampler,COMPLETE
1140,0.856297005325639,2025-04-24 21:07:28.491769,2025-04-24 21:07:29.452596,0 days 00:00:00.960827,absolute_error,28,sqrt,1,2,best,TPESampler,COMPLETE
1141,0.7084730562241784,2025-04-24 21:07:29.002485,2025-04-24 21:07:29.682288,0 days 00:00:00.679803,absolute_error,32,sqrt,1,5,best,TPESampler,COMPLETE
1142,0.7671499982148208,2025-04-24 21:07:29.241145,2025-04-24 21:07:29.958354,0 days 00:00:00.717209,squared_error,24,sqrt,1,5,random,TPESampler,COMPLETE
