number,value,datetime_start,datetime_complete,duration,params_criterion,params_max_depth,params_max_features,params_min_samples_leaf,params_min_samples_split,params_splitter,system_attrs_auto:sampler,state
0,1.1579755495671251,2025-04-24 21:00:23.343717,2025-04-24 21:00:24.068158,0 days 00:00:00.724441,absolute_error,27,sqrt,2,20,best,RandomSampler,COMPLETE
1,1.4099363199826813,2025-04-24 21:00:23.361089,2025-04-24 21:00:23.894376,0 days 00:00:00.533287,absolute_error,24,log2,5,17,random,RandomSampler,COMPLETE
2,1.3408130340550188,2025-04-24 21:00:23.432652,2025-04-24 21:00:23.972291,0 days 00:00:00.539639,absolute_error,28,sqrt,7,7,best,RandomSampler,COMPLETE
3,1.321660496939291,2025-04-24 21:00:24.115891,2025-04-24 21:00:24.800070,0 days 00:00:00.684179,squared_error,2,sqrt,1,15,random,TPESampler,COMPLETE
4,1.2144909973673537,2025-04-24 21:00:24.170649,2025-04-24 21:00:24.793232,0 days 00:00:00.622583,absolute_error,19,sqrt,3,16,best,TPESampler,COMPLETE
5,1.1725983074554982,2025-04-24 21:00:24.326419,2025-04-24 21:00:24.966402,0 days 00:00:00.639983,friedman_mse,29,sqrt,3,2,random,TPESampler,COMPLETE
6,1.3677569516816517,2025-04-24 21:00:25.020859,2025-04-24 21:00:25.600107,0 days 00:00:00.579248,squared_error,3,log2,10,6,best,TPESampler,COMPLETE
7,1.4222892482905918,2025-04-24 21:00:25.073417,2025-04-24 21:00:25.912190,0 days 00:00:00.838773,absolute_error,1,sqrt,6,8,best,TPESampler,COMPLETE
8,1.0131068116827324,2025-04-24 21:00:25.194567,2025-04-24 21:00:26.065360,0 days 00:00:00.870793,absolute_error,12,log2,3,14,best,TPESampler,COMPLETE
9,1.146242075754961,2025-04-24 21:00:25.800012,2025-04-24 21:00:26.355301,0 days 00:00:00.555289,squared_error,11,sqrt,2,3,random,TPESampler,COMPLETE
10,1.344003918250421,2025-04-24 21:00:26.174577,2025-04-24 21:00:26.743553,0 days 00:00:00.568976,friedman_mse,20,log2,3,14,random,TPESampler,COMPLETE
11,1.3677569516816517,2025-04-24 21:00:26.253713,2025-04-24 21:00:26.937786,0 days 00:00:00.684073,friedman_mse,14,log2,4,15,best,TPESampler,COMPLETE
12,1.1809758727465913,2025-04-24 21:00:26.726462,2025-04-24 21:00:27.354073,0 days 00:00:00.627611,squared_error,6,sqrt,3,3,random,TPESampler,COMPLETE
13,0.9921451435368585,2025-04-24 21:00:27.057523,2025-04-24 21:00:27.843504,0 days 00:00:00.785981,absolute_error,16,log2,2,9,best,TPESampler,COMPLETE
14,1.0131068116827324,2025-04-24 21:00:27.126107,2025-04-24 21:00:27.927527,0 days 00:00:00.801420,absolute_error,8,log2,2,14,best,TPESampler,COMPLETE
15,1.0131068116827324,2025-04-24 21:00:27.630122,2025-04-24 21:00:28.183525,0 days 00:00:00.553403,absolute_error,23,log2,3,7,best,TPESampler,COMPLETE
16,1.4138971746431086,2025-04-24 21:00:28.072076,2025-04-24 21:00:28.758353,0 days 00:00:00.686277,absolute_error,9,log2,4,6,best,TPESampler,COMPLETE
17,1.0237524860707625,2025-04-24 21:00:28.149308,2025-04-24 21:00:28.855573,0 days 00:00:00.706265,absolute_error,4,log2,2,5,best,TPESampler,COMPLETE
18,0.856694216724409,2025-04-24 21:00:28.382558,2025-04-24 21:00:29.111753,0 days 00:00:00.729195,squared_error,14,log2,2,7,best,TPESampler,COMPLETE
19,0.7246988308181394,2025-04-24 21:00:28.972662,2025-04-24 21:00:29.705065,0 days 00:00:00.732403,squared_error,23,log2,1,3,best,TPESampler,COMPLETE
20,0.8297844106018962,2025-04-24 21:00:29.051493,2025-04-24 21:00:29.870454,0 days 00:00:00.818961,squared_error,20,log2,2,6,best,TPESampler,COMPLETE
21,0.8622037809680244,2025-04-24 21:00:29.321029,2025-04-24 21:00:30.075979,0 days 00:00:00.754950,squared_error,23,log2,3,12,best,TPESampler,COMPLETE
22,0.8294451661513046,2025-04-24 21:00:30.010472,2025-04-24 21:00:30.889242,0 days 00:00:00.878770,squared_error,27,log2,2,2,best,TPESampler,COMPLETE
23,0.6940885250748186,2025-04-24 21:00:30.107550,2025-04-24 21:00:31.218010,0 days 00:00:01.110460,squared_error,26,log2,1,2,best,TPESampler,COMPLETE
24,0.8116023347124355,2025-04-24 21:00:30.256644,2025-04-24 21:00:31.230085,0 days 00:00:00.973441,squared_error,13,log2,2,2,best,TPESampler,COMPLETE
25,0.736935003228652,2025-04-24 21:00:31.149739,2025-04-24 21:00:31.853184,0 days 00:00:00.703445,friedman_mse,30,log2,1,5,best,TPESampler,COMPLETE
26,0.6962347938275559,2025-04-24 21:00:31.435719,2025-04-24 21:00:32.416183,0 days 00:00:00.980464,friedman_mse,35,log2,1,3,best,TPESampler,COMPLETE
27,1.2144005393002264,2025-04-24 21:00:31.489299,2025-04-24 21:00:32.297414,0 days 00:00:00.808115,friedman_mse,34,log2,1,9,random,TPESampler,COMPLETE
28,1.3877582794236027,2025-04-24 21:00:32.150604,2025-04-24 21:00:33.331578,0 days 00:00:01.180974,absolute_error,33,log2,2,4,random,TPESampler,COMPLETE
29,0.705153727653071,2025-04-24 21:00:32.585989,2025-04-24 21:00:33.510942,0 days 00:00:00.924953,squared_error,34,sqrt,1,7,best,TPESampler,COMPLETE
30,0.6750603857551389,2025-04-24 21:00:32.772420,2025-04-24 21:00:33.893861,0 days 00:00:01.121441,squared_error,27,sqrt,1,2,best,TPESampler,COMPLETE
31,0.7572120212089476,2025-04-24 21:00:33.566939,2025-04-24 21:00:34.297510,0 days 00:00:00.730571,squared_error,30,sqrt,1,9,best,TPESampler,COMPLETE
32,0.7221749259799802,2025-04-24 21:00:33.764631,2025-04-24 21:00:34.548758,0 days 00:00:00.784127,squared_error,35,sqrt,2,4,best,TPESampler,COMPLETE
33,0.7418571718931632,2025-04-24 21:00:34.127416,2025-04-24 21:00:34.829496,0 days 00:00:00.702080,squared_error,23,sqrt,1,3,best,TPESampler,COMPLETE
34,1.0416889220350627,2025-04-24 21:00:34.600242,2025-04-24 21:00:35.336264,0 days 00:00:00.736022,absolute_error,33,sqrt,2,9,best,TPESampler,COMPLETE
35,1.1767590822151803,2025-04-24 21:00:34.779633,2025-04-24 21:00:35.493976,0 days 00:00:00.714343,squared_error,35,sqrt,1,8,random,TPESampler,COMPLETE
36,0.6527618645843418,2025-04-24 21:00:35.255258,2025-04-24 21:00:35.896989,0 days 00:00:00.641731,absolute_error,35,log2,1,4,best,TPESampler,COMPLETE
37,0.7131902576718143,2025-04-24 21:00:35.577843,2025-04-24 21:00:36.457948,0 days 00:00:00.880105,absolute_error,30,log2,1,3,best,TPESampler,COMPLETE
38,0.7225550674205817,2025-04-24 21:00:35.769171,2025-04-24 21:00:36.517837,0 days 00:00:00.748666,absolute_error,35,log2,1,5,best,TPESampler,COMPLETE
39,0.8294451661513046,2025-04-24 21:00:36.145096,2025-04-24 21:00:37.221735,0 days 00:00:01.076639,friedman_mse,33,log2,2,2,best,TPESampler,COMPLETE
40,1.01198968648017,2025-04-24 21:00:36.674092,2025-04-24 21:00:37.591019,0 days 00:00:00.916927,friedman_mse,21,sqrt,2,5,best,TPESampler,COMPLETE
41,1.2076965740491883,2025-04-24 21:00:36.728287,2025-04-24 21:00:37.548886,0 days 00:00:00.820599,absolute_error,31,sqrt,3,2,best,TPESampler,COMPLETE
42,0.7005142358620232,2025-04-24 21:00:37.486731,2025-04-24 21:00:38.156182,0 days 00:00:00.669451,friedman_mse,35,sqrt,1,8,best,TPESampler,COMPLETE
43,0.7210074432052395,2025-04-24 21:00:37.763945,2025-04-24 21:00:38.570606,0 days 00:00:00.806661,friedman_mse,30,sqrt,1,3,best,TPESampler,COMPLETE
44,0.9675646360410559,2025-04-24 21:00:37.817412,2025-04-24 21:00:38.566661,0 days 00:00:00.749249,friedman_mse,31,sqrt,2,14,best,TPESampler,COMPLETE
45,1.323365692598151,2025-04-24 21:00:38.377439,2025-04-24 21:00:39.446035,0 days 00:00:01.068596,squared_error,26,log2,2,5,random,TPESampler,COMPLETE
46,0.6827800452619114,2025-04-24 21:00:38.758946,2025-04-24 21:00:39.635791,0 days 00:00:00.876845,squared_error,35,log2,1,4,best,TPESampler,COMPLETE
47,1.4148597056909755,2025-04-24 21:00:38.808137,2025-04-24 21:00:39.771689,0 days 00:00:00.963552,absolute_error,24,sqrt,10,15,random,TPESampler,COMPLETE
48,1.3262151716400714,2025-04-24 21:00:39.660566,2025-04-24 21:00:40.413449,0 days 00:00:00.752883,squared_error,9,sqrt,10,4,random,TPESampler,COMPLETE
49,0.7814983001618244,2025-04-24 21:00:39.924768,2025-04-24 21:00:41.031869,0 days 00:00:01.107101,squared_error,33,log2,1,8,best,TPESampler,COMPLETE
50,1.3677569516816517,2025-04-24 21:00:40.014498,2025-04-24 21:00:40.802320,0 days 00:00:00.787822,squared_error,18,log2,8,18,best,TPESampler,COMPLETE
51,1.050290632693015,2025-04-24 21:00:40.747190,2025-04-24 21:00:41.446010,0 days 00:00:00.698820,friedman_mse,31,sqrt,3,8,best,TPESampler,COMPLETE
52,0.8294451661513046,2025-04-24 21:00:41.104176,2025-04-24 21:00:41.945687,0 days 00:00:00.841511,squared_error,34,log2,2,2,best,TPESampler,COMPLETE
53,0.6922245801195056,2025-04-24 21:00:41.323615,2025-04-24 21:00:42.054315,0 days 00:00:00.730700,squared_error,33,log2,1,3,best,TPESampler,COMPLETE
54,1.3677569516816517,2025-04-24 21:00:41.688203,2025-04-24 21:00:42.530262,0 days 00:00:00.842059,friedman_mse,29,log2,8,4,best,TPESampler,COMPLETE
55,1.0673201805126924,2025-04-24 21:00:42.157935,2025-04-24 21:00:42.946911,0 days 00:00:00.788976,squared_error,26,sqrt,5,4,best,TPESampler,COMPLETE
56,0.7236280706063103,2025-04-24 21:00:42.386882,2025-04-24 21:00:43.173530,0 days 00:00:00.786648,squared_error,33,log2,1,4,best,TPESampler,COMPLETE
57,1.3262151716400714,2025-04-24 21:00:42.800456,2025-04-24 21:00:43.476695,0 days 00:00:00.676239,squared_error,1,sqrt,8,19,random,TPESampler,COMPLETE
58,0.956874881353438,2025-04-24 21:00:43.211620,2025-04-24 21:00:43.980477,0 days 00:00:00.768857,squared_error,27,sqrt,6,16,best,TPESampler,COMPLETE
59,1.019101943004136,2025-04-24 21:00:43.479962,2025-04-24 21:00:44.548348,0 days 00:00:01.068386,squared_error,27,sqrt,1,2,random,TPESampler,COMPLETE
60,0.630903210521767,2025-04-24 21:00:43.881980,2025-04-24 21:00:44.714817,0 days 00:00:00.832837,friedman_mse,35,log2,1,7,best,TPESampler,COMPLETE
61,0.630903210521767,2025-04-24 21:00:44.467371,2025-04-24 21:00:45.211711,0 days 00:00:00.744340,friedman_mse,35,log2,1,7,best,TPESampler,COMPLETE
62,1.4138971746431086,2025-04-24 21:00:44.784966,2025-04-24 21:00:45.509873,0 days 00:00:00.724907,absolute_error,31,log2,4,5,best,TPESampler,COMPLETE
63,1.3677569516816517,2025-04-24 21:00:44.954797,2025-04-24 21:00:45.714026,0 days 00:00:00.759229,friedman_mse,35,log2,4,11,best,TPESampler,COMPLETE
64,1.3322345159230207,2025-04-24 21:00:45.458859,2025-04-24 21:00:46.114539,0 days 00:00:00.655680,friedman_mse,24,sqrt,8,3,random,TPESampler,COMPLETE
65,0.7404423285719909,2025-04-24 21:00:45.794996,2025-04-24 21:00:46.566487,0 days 00:00:00.771491,friedman_mse,34,log2,1,9,best,TPESampler,COMPLETE
66,0.6941102797207614,2025-04-24 21:00:45.998365,2025-04-24 21:00:46.761266,0 days 00:00:00.762901,friedman_mse,35,log2,1,9,best,TPESampler,COMPLETE
67,0.7236280706063103,2025-04-24 21:00:46.413118,2025-04-24 21:00:47.134356,0 days 00:00:00.721238,squared_error,33,log2,1,4,best,TPESampler,COMPLETE
68,1.0993459613881815,2025-04-24 21:00:46.798232,2025-04-24 21:00:47.489495,0 days 00:00:00.691263,absolute_error,28,sqrt,1,18,random,TPESampler,COMPLETE
69,1.3498283893880367,2025-04-24 21:00:47.042384,2025-04-24 21:00:47.783635,0 days 00:00:00.741251,friedman_mse,8,log2,2,19,random,TPESampler,COMPLETE
70,1.3625908614134468,2025-04-24 21:00:47.379099,2025-04-24 21:00:48.068449,0 days 00:00:00.689350,friedman_mse,8,log2,5,6,random,TPESampler,COMPLETE
71,1.3679729947669532,2025-04-24 21:00:47.741379,2025-04-24 21:00:48.419715,0 days 00:00:00.678336,friedman_mse,29,log2,9,14,random,TPESampler,COMPLETE
72,0.827471460821445,2025-04-24 21:00:48.062369,2025-04-24 21:00:48.715388,0 days 00:00:00.653019,friedman_mse,23,log2,2,10,best,TPESampler,COMPLETE
73,0.7694633557640977,2025-04-24 21:00:48.308553,2025-04-24 21:00:49.010928,0 days 00:00:00.702375,friedman_mse,33,log2,1,9,best,TPESampler,COMPLETE
74,0.6966010673464934,2025-04-24 21:00:48.668248,2025-04-24 21:00:49.371692,0 days 00:00:00.703444,squared_error,31,sqrt,1,2,best,TPESampler,COMPLETE
75,1.3679729947669532,2025-04-24 21:00:48.955928,2025-04-24 21:00:49.728997,0 days 00:00:00.773069,friedman_mse,4,log2,7,15,random,TPESampler,COMPLETE
76,0.6515992903689769,2025-04-24 21:00:49.254105,2025-04-24 21:00:50.085075,0 days 00:00:00.830970,absolute_error,31,log2,1,8,best,TPESampler,COMPLETE
77,0.8246228047102716,2025-04-24 21:00:49.662899,2025-04-24 21:00:50.357908,0 days 00:00:00.695009,friedman_mse,33,log2,2,6,best,TPESampler,COMPLETE
78,0.9896382479483637,2025-04-24 21:00:50.011378,2025-04-24 21:00:50.754728,0 days 00:00:00.743350,absolute_error,34,log2,2,13,best,TPESampler,COMPLETE
79,0.7401483816902585,2025-04-24 21:00:50.305085,2025-04-24 21:00:51.045522,0 days 00:00:00.740437,absolute_error,30,log2,1,7,best,TPESampler,COMPLETE
80,1.4138971746431086,2025-04-24 21:00:50.635533,2025-04-24 21:00:51.353449,0 days 00:00:00.717916,absolute_error,1,log2,9,14,best,TPESampler,COMPLETE
81,1.3848240990448737,2025-04-24 21:00:50.986844,2025-04-24 21:00:51.676559,0 days 00:00:00.689715,absolute_error,24,log2,1,11,random,TPESampler,COMPLETE
82,1.3677569516816517,2025-04-24 21:00:51.247561,2025-04-24 21:00:52.015180,0 days 00:00:00.767619,squared_error,28,log2,4,5,best,TPESampler,COMPLETE
83,1.4148597056909755,2025-04-24 21:00:51.625232,2025-04-24 21:00:52.419588,0 days 00:00:00.794356,absolute_error,14,log2,10,20,random,TPESampler,COMPLETE
84,0.695844345141541,2025-04-24 21:00:51.972709,2025-04-24 21:00:52.757652,0 days 00:00:00.784943,friedman_mse,35,log2,1,6,best,TPESampler,COMPLETE
85,0.7258394248784972,2025-04-24 21:00:52.309770,2025-04-24 21:00:52.941957,0 days 00:00:00.632187,friedman_mse,31,log2,1,16,best,TPESampler,COMPLETE
86,0.7214734634094812,2025-04-24 21:00:52.704888,2025-04-24 21:00:53.454767,0 days 00:00:00.749879,absolute_error,35,log2,1,8,best,TPESampler,COMPLETE
87,1.4058384605507321,2025-04-24 21:00:53.014622,2025-04-24 21:00:53.788205,0 days 00:00:00.773583,absolute_error,18,sqrt,10,20,best,TPESampler,COMPLETE
88,1.1707428444729318,2025-04-24 21:00:53.176304,2025-04-24 21:00:53.983979,0 days 00:00:00.807675,squared_error,32,log2,1,4,random,TPESampler,COMPLETE
89,1.3416769911136657,2025-04-24 21:00:53.738008,2025-04-24 21:00:54.590713,0 days 00:00:00.852705,absolute_error,35,sqrt,7,5,random,TPESampler,COMPLETE
90,1.0131068116827324,2025-04-24 21:00:54.057951,2025-04-24 21:00:54.761803,0 days 00:00:00.703852,absolute_error,35,log2,3,3,best,TPESampler,COMPLETE
91,0.7316816527911695,2025-04-24 21:00:54.200455,2025-04-24 21:00:55.020185,0 days 00:00:00.819730,squared_error,21,log2,1,2,best,TPESampler,COMPLETE
92,1.344003918250421,2025-04-24 21:00:54.803377,2025-04-24 21:00:55.656312,0 days 00:00:00.852935,friedman_mse,34,log2,3,4,random,TPESampler,COMPLETE
93,0.7247446321475927,2025-04-24 21:00:54.966754,2025-04-24 21:00:55.719794,0 days 00:00:00.753040,friedman_mse,32,log2,1,5,best,TPESampler,COMPLETE
94,0.8297844106018962,2025-04-24 21:00:55.248108,2025-04-24 21:00:55.985655,0 days 00:00:00.737547,friedman_mse,35,log2,2,8,best,TPESampler,COMPLETE
95,0.7148015383195052,2025-04-24 21:00:55.891012,2025-04-24 21:00:56.702502,0 days 00:00:00.811490,friedman_mse,35,log2,1,11,best,TPESampler,COMPLETE
96,0.630903210521767,2025-04-24 21:00:55.946049,2025-04-24 21:00:56.753909,0 days 00:00:00.807860,friedman_mse,35,log2,1,7,best,TPESampler,COMPLETE
97,0.851370255680307,2025-04-24 21:00:56.254670,2025-04-24 21:00:57.067041,0 days 00:00:00.812371,absolute_error,18,sqrt,1,2,best,TPESampler,COMPLETE
98,0.6962347938275559,2025-04-24 21:00:56.966914,2025-04-24 21:00:57.671366,0 days 00:00:00.704452,squared_error,35,log2,1,3,best,TPESampler,COMPLETE
99,1.3264303992535873,2025-04-24 21:00:57.028966,2025-04-24 21:00:57.922010,0 days 00:00:00.893044,friedman_mse,3,sqrt,3,12,best,TPESampler,COMPLETE
100,1.3262151716400714,2025-04-24 21:00:57.312136,2025-04-24 21:00:58.254637,0 days 00:00:00.942501,friedman_mse,5,sqrt,10,14,random,TPESampler,COMPLETE
101,1.123391360187449,2025-04-24 21:00:57.958043,2025-04-24 21:00:58.647411,0 days 00:00:00.689368,friedman_mse,33,sqrt,2,8,random,TPESampler,COMPLETE
102,0.7458330308724526,2025-04-24 21:00:58.165546,2025-04-24 21:00:58.962229,0 days 00:00:00.796683,friedman_mse,27,log2,1,7,best,TPESampler,COMPLETE
103,0.8246228047102716,2025-04-24 21:00:58.504427,2025-04-24 21:00:59.164205,0 days 00:00:00.659778,friedman_mse,35,log2,2,6,best,TPESampler,COMPLETE
104,0.6698808592957831,2025-04-24 21:00:58.908648,2025-04-24 21:00:59.569411,0 days 00:00:00.660763,friedman_mse,35,log2,1,5,best,TPESampler,COMPLETE
105,0.6234752034897817,2025-04-24 21:00:59.222131,2025-04-24 21:01:00.088922,0 days 00:00:00.866791,absolute_error,34,sqrt,1,2,random,TPESampler,COMPLETE
106,1.3679729947669532,2025-04-24 21:00:59.403832,2025-04-24 21:01:00.178876,0 days 00:00:00.775044,squared_error,30,log2,8,10,random,TPESampler,COMPLETE
107,0.7105690610052176,2025-04-24 21:00:59.872481,2025-04-24 21:01:00.632256,0 days 00:00:00.759775,absolute_error,32,sqrt,1,3,random,TPESampler,COMPLETE
108,0.8988701550681125,2025-04-24 21:01:00.287668,2025-04-24 21:01:01.163192,0 days 00:00:00.875524,squared_error,17,sqrt,1,3,best,TPESampler,COMPLETE
109,1.335711393574172,2025-04-24 21:01:00.377712,2025-04-24 21:01:01.169377,0 days 00:00:00.791665,absolute_error,35,sqrt,3,3,random,TPESampler,COMPLETE
110,0.8248327555402727,2025-04-24 21:01:00.907222,2025-04-24 21:01:01.556168,0 days 00:00:00.648946,squared_error,27,log2,2,5,best,TPESampler,COMPLETE
111,0.9282849699210477,2025-04-24 21:01:01.386163,2025-04-24 21:01:02.067969,0 days 00:00:00.681806,squared_error,26,sqrt,2,2,best,TPESampler,COMPLETE
112,1.4138971746431086,2025-04-24 21:01:01.437660,2025-04-24 21:01:02.182228,0 days 00:00:00.744568,absolute_error,26,log2,6,20,best,TPESampler,COMPLETE
113,1.3677569516816517,2025-04-24 21:01:01.782983,2025-04-24 21:01:02.488469,0 days 00:00:00.705486,friedman_mse,13,log2,9,4,best,TPESampler,COMPLETE
114,0.8479044598855919,2025-04-24 21:01:02.357564,2025-04-24 21:01:03.208202,0 days 00:00:00.850638,absolute_error,23,log2,1,11,best,TPESampler,COMPLETE
115,0.7131902576718143,2025-04-24 21:01:02.443639,2025-04-24 21:01:03.273066,0 days 00:00:00.829427,absolute_error,30,log2,1,3,best,TPESampler,COMPLETE
116,0.5872420994323145,2025-04-24 21:01:02.689433,2025-04-24 21:01:03.518789,0 days 00:00:00.829356,absolute_error,35,sqrt,1,2,best,TPESampler,COMPLETE
117,1.2076965740491883,2025-04-24 21:01:03.433901,2025-04-24 21:01:04.212758,0 days 00:00:00.778857,absolute_error,27,sqrt,3,5,best,TPESampler,COMPLETE
118,0.5903507012833906,2025-04-24 21:01:03.476037,2025-04-24 21:01:04.371834,0 days 00:00:00.895797,absolute_error,32,sqrt,1,3,best,TPESampler,COMPLETE
119,1.1302409528743838,2025-04-24 21:01:03.718635,2025-04-24 21:01:04.612509,0 days 00:00:00.893874,absolute_error,34,sqrt,2,5,best,TPESampler,COMPLETE
120,0.6088450820608182,2025-04-24 21:01:04.465174,2025-04-24 21:01:05.185766,0 days 00:00:00.720592,absolute_error,34,sqrt,1,3,best,TPESampler,COMPLETE
121,0.7105690610052176,2025-04-24 21:01:04.666067,2025-04-24 21:01:05.557961,0 days 00:00:00.891894,absolute_error,32,sqrt,1,3,random,TPESampler,COMPLETE
122,0.5872420994323145,2025-04-24 21:01:04.922073,2025-04-24 21:01:05.909812,0 days 00:00:00.987739,absolute_error,35,sqrt,1,2,best,TPESampler,COMPLETE
123,0.7033595174659969,2025-04-24 21:01:05.500847,2025-04-24 21:01:06.348237,0 days 00:00:00.847390,absolute_error,28,sqrt,1,5,best,TPESampler,COMPLETE
124,0.9996424324783258,2025-04-24 21:01:05.798183,2025-04-24 21:01:06.603726,0 days 00:00:00.805543,absolute_error,34,sqrt,2,2,best,TPESampler,COMPLETE
125,0.6310502563923985,2025-04-24 21:01:06.223473,2025-04-24 21:01:07.233092,0 days 00:00:01.009619,absolute_error,33,sqrt,1,5,best,TPESampler,COMPLETE
126,1.3391957616655856,2025-04-24 21:01:06.609072,2025-04-24 21:01:07.632612,0 days 00:00:01.023540,friedman_mse,26,sqrt,8,9,best,TPESampler,COMPLETE
127,0.6088450820608182,2025-04-24 21:01:07.037998,2025-04-24 21:01:08.063533,0 days 00:00:01.025535,absolute_error,34,sqrt,1,3,best,TPESampler,COMPLETE
128,0.8830393779381801,2025-04-24 21:01:07.477551,2025-04-24 21:01:08.406842,0 days 00:00:00.929291,absolute_error,35,sqrt,1,6,best,TPESampler,COMPLETE
129,0.5542791023918845,2025-04-24 21:01:07.957414,2025-04-24 21:01:08.802286,0 days 00:00:00.844872,absolute_error,31,sqrt,1,2,best,TPESampler,COMPLETE
130,0.6095026962894158,2025-04-24 21:01:08.353908,2025-04-24 21:01:09.086188,0 days 00:00:00.732280,absolute_error,30,sqrt,1,3,best,TPESampler,COMPLETE
131,0.6088450820608182,2025-04-24 21:01:08.636824,2025-04-24 21:01:09.431251,0 days 00:00:00.794427,absolute_error,34,sqrt,1,3,best,TPESampler,COMPLETE
132,0.5889451668041809,2025-04-24 21:01:09.091854,2025-04-24 21:01:09.896946,0 days 00:00:00.805092,absolute_error,35,sqrt,1,3,best,TPESampler,COMPLETE
133,0.9996424324783258,2025-04-24 21:01:09.385156,2025-04-24 21:01:10.168473,0 days 00:00:00.783317,absolute_error,28,sqrt,2,3,best,TPESampler,COMPLETE
134,0.5542791023918845,2025-04-24 21:01:09.728225,2025-04-24 21:01:10.517223,0 days 00:00:00.788998,absolute_error,31,sqrt,1,2,best,TPESampler,COMPLETE
135,0.5647532297301866,2025-04-24 21:01:10.159355,2025-04-24 21:01:10.853769,0 days 00:00:00.694414,absolute_error,34,sqrt,1,2,best,TPESampler,COMPLETE
136,0.5872420994323145,2025-04-24 21:01:10.424638,2025-04-24 21:01:11.203122,0 days 00:00:00.778484,absolute_error,35,sqrt,1,2,best,TPESampler,COMPLETE
137,0.9996424324783258,2025-04-24 21:01:10.759098,2025-04-24 21:01:11.509338,0 days 00:00:00.750240,absolute_error,29,sqrt,2,2,best,TPESampler,COMPLETE
138,0.5647532297301866,2025-04-24 21:01:11.098550,2025-04-24 21:01:11.810490,0 days 00:00:00.711940,absolute_error,34,sqrt,1,2,best,TPESampler,COMPLETE
139,0.5889451668041809,2025-04-24 21:01:11.412239,2025-04-24 21:01:12.165090,0 days 00:00:00.752851,absolute_error,35,sqrt,1,3,best,TPESampler,COMPLETE
140,0.5682124588118789,2025-04-24 21:01:11.709969,2025-04-24 21:01:12.508520,0 days 00:00:00.798551,absolute_error,27,sqrt,1,2,best,TPESampler,COMPLETE
141,0.5889451668041809,2025-04-24 21:01:12.104545,2025-04-24 21:01:12.815006,0 days 00:00:00.710461,absolute_error,35,sqrt,1,3,best,TPESampler,COMPLETE
142,0.6112778743973727,2025-04-24 21:01:12.391776,2025-04-24 21:01:13.153609,0 days 00:00:00.761833,absolute_error,29,sqrt,1,2,best,TPESampler,COMPLETE
