number,value,datetime_start,datetime_complete,duration,params_learning_rate,params_max_depth,params_max_features,params_min_samples_leaf,params_min_samples_split,params_n_estimators,params_subsample,system_attrs_auto:sampler,state
2096,0.29796801205419704,2025-04-24 22:16:21.528305,2025-04-24 22:16:25.773052,0 days 00:00:04.244747,0.08211721278603153,3,sqrt,3,5,1340,0.6650453282027281,TPESampler,COMPLETE
2097,0.4472066922446197,2025-04-24 22:16:24.710115,2025-04-24 22:16:29.019890,0 days 00:00:04.309775,0.040755201499956095,3,,10,8,1074,0.8613569584540891,TPESampler,COMPLETE
2098,0.2427878876748704,2025-04-24 22:16:25.902869,2025-04-24 22:16:29.051732,0 days 00:00:03.148863,0.09010125681122326,9,log2,1,20,1132,0.7156472145034859,TPESampler,COMPLETE
2099,0.2785912615893335,2025-04-24 22:16:25.926651,2025-04-24 22:16:29.132532,0 days 00:00:03.205881,0.09811267091545547,4,sqrt,2,8,1118,0.7066807322318032,TPESampler,COMPLETE
2100,0.30503600657148183,2025-04-24 22:16:29.201311,2025-04-24 22:16:33.607598,0 days 00:00:04.406287,0.06817202544789486,3,sqrt,2,7,1462,0.711472169443368,TPESampler,COMPLETE
2101,0.4175889776058893,2025-04-24 22:16:29.216086,2025-04-24 22:16:31.636620,0 days 00:00:02.420534,0.09878933652599138,7,sqrt,8,20,525,0.7365285469969718,TPESampler,COMPLETE
2102,0.25972989893150883,2025-04-24 22:16:29.859502,2025-04-24 22:16:34.486028,0 days 00:00:04.626526,0.0847639404888698,5,sqrt,1,16,1494,0.6038340125285508,TPESampler,COMPLETE
2103,0.30195104926000954,2025-04-24 22:16:31.842965,2025-04-24 22:16:35.621385,0 days 00:00:03.778420,0.03105538659919483,3,sqrt,2,17,1318,0.7829938134728843,TPESampler,COMPLETE
2104,0.2558641782407906,2025-04-24 22:16:33.831598,2025-04-24 22:16:37.659601,0 days 00:00:03.828003,0.09921021901096563,5,sqrt,1,17,1129,0.6840370817393152,TPESampler,COMPLETE
2105,0.3069961395535887,2025-04-24 22:16:34.701131,2025-04-24 22:16:38.945893,0 days 00:00:04.244762,0.0796070689402273,5,log2,1,15,1344,0.6024573467520807,TPESampler,COMPLETE
2106,0.42320221298336164,2025-04-24 22:16:35.854321,2025-04-24 22:16:39.054556,0 days 00:00:03.200235,0.06198464632708169,11,log2,7,13,1166,0.9897742821000964,TPESampler,COMPLETE
2107,0.46123398025054024,2025-04-24 22:16:37.903296,2025-04-24 22:16:41.149760,0 days 00:00:03.246464,0.029432471934164633,12,,10,3,426,0.8919436245083754,TPESampler,COMPLETE
2108,0.30075342546723677,2025-04-24 22:16:39.118679,2025-04-24 22:16:41.722935,0 days 00:00:02.604256,0.05659497312746249,5,sqrt,3,3,1122,0.7079327342100744,TPESampler,COMPLETE
2109,0.3798476584581585,2025-04-24 22:16:39.250225,2025-04-24 22:16:45.326250,0 days 00:00:06.076025,0.09074692595186475,10,,2,20,1104,0.6913629878538409,TPESampler,COMPLETE
2110,0.2582620655085265,2025-04-24 22:16:41.373388,2025-04-24 22:16:44.864773,0 days 00:00:03.491385,0.08774845615135891,7,sqrt,1,16,1468,0.6897832975754149,TPESampler,COMPLETE
2111,0.29038922577750675,2025-04-24 22:16:42.004254,2025-04-24 22:16:45.048736,0 days 00:00:03.044482,0.09499406795435425,5,sqrt,3,10,1326,0.6156101305530555,TPESampler,COMPLETE
2112,0.3113112213886532,2025-04-24 22:16:45.047742,2025-04-24 22:16:49.057049,0 days 00:00:04.009307,0.03354350973898326,9,log2,1,12,1412,0.9952099158051657,TPESampler,COMPLETE
2113,0.2974930853779642,2025-04-24 22:16:45.261850,2025-04-24 22:16:49.462811,0 days 00:00:04.200961,0.09898606365308273,5,sqrt,3,15,1402,0.7370469427836561,TPESampler,COMPLETE
2114,0.292208576794467,2025-04-24 22:16:45.631052,2025-04-24 22:16:49.048688,0 days 00:00:03.417636,0.05827254798551737,8,log2,1,13,976,0.6537645592327694,TPESampler,COMPLETE
2115,0.28039548452811425,2025-04-24 22:16:49.220840,2025-04-24 22:16:53.399546,0 days 00:00:04.178706,0.03303939706175468,6,sqrt,1,20,1362,0.6656278302207523,TPESampler,COMPLETE
2116,1.2930238975183228,2025-04-24 22:16:49.274321,2025-04-24 22:16:50.885470,0 days 00:00:01.611149,0.01799593825842599,5,log2,10,6,201,0.62289471177173,TPESampler,COMPLETE
2117,0.24205353730264886,2025-04-24 22:16:49.837291,2025-04-24 22:16:53.851561,0 days 00:00:04.014270,0.09104797647628564,6,sqrt,1,16,1444,0.8075116642668763,TPESampler,COMPLETE
2118,0.29813761893381896,2025-04-24 22:16:51.195050,2025-04-24 22:16:54.952899,0 days 00:00:03.757849,0.05929297648620717,10,sqrt,1,12,1229,0.693440554183952,TPESampler,COMPLETE
2119,0.38925651693633184,2025-04-24 22:16:53.618057,2025-04-24 22:16:57.356467,0 days 00:00:03.738410,0.038958612769853,8,sqrt,7,7,1355,0.8816217624420755,TPESampler,COMPLETE
2120,0.3377228229192355,2025-04-24 22:16:54.114771,2025-04-24 22:16:57.322485,0 days 00:00:03.207714,0.09368131891334609,5,sqrt,5,8,1068,0.754086855487198,TPESampler,COMPLETE
2121,0.2683775035879119,2025-04-24 22:16:55.131581,2025-04-24 22:16:58.937131,0 days 00:00:03.805550,0.06420234126210031,6,sqrt,1,10,1474,0.6695390570670092,TPESampler,COMPLETE
2122,0.4198299326474024,2025-04-24 22:16:57.491828,2025-04-24 22:17:02.128378,0 days 00:00:04.636550,0.04147109415189377,6,,9,13,903,0.7721102444774997,TPESampler,COMPLETE
2123,0.2174991256148492,2025-04-24 22:16:57.526671,2025-04-24 22:17:00.898767,0 days 00:00:03.372096,0.09580868790197684,6,sqrt,1,17,1248,0.64742007921438,TPESampler,COMPLETE
2124,0.3108504810840899,2025-04-24 22:16:59.147802,2025-04-24 22:17:02.993718,0 days 00:00:03.845916,0.06858546149749878,6,sqrt,2,20,1498,0.7200447142883616,TPESampler,COMPLETE
2125,0.2752785838858272,2025-04-24 22:17:01.105565,2025-04-24 22:17:04.209819,0 days 00:00:03.104254,0.08792612781399357,7,sqrt,2,15,1106,0.6802055649049276,TPESampler,COMPLETE
2126,0.47913813830915114,2025-04-24 22:17:02.342920,2025-04-24 22:17:06.258890,0 days 00:00:03.915970,0.012990648446629087,8,,9,11,723,0.6103484453691382,TPESampler,COMPLETE
2127,0.2954596820946184,2025-04-24 22:17:03.207283,2025-04-24 22:17:06.253812,0 days 00:00:03.046529,0.08913003736273767,6,sqrt,3,16,1192,0.6066358725096526,TPESampler,COMPLETE
2128,0.2434982170342571,2025-04-24 22:17:04.427741,2025-04-24 22:17:06.998141,0 days 00:00:02.570400,0.09667184815338428,5,sqrt,1,17,1185,0.6773357374274533,TPESampler,COMPLETE
2129,0.28292113964815646,2025-04-24 22:17:06.457866,2025-04-24 22:17:10.384722,0 days 00:00:03.926856,0.08258762627265688,5,sqrt,1,14,1169,0.664391859549119,TPESampler,COMPLETE
2130,0.31122303856460476,2025-04-24 22:17:06.494765,2025-04-24 22:17:10.380278,0 days 00:00:03.885513,0.04098270318583737,3,sqrt,2,15,1132,0.6917678024696854,TPESampler,COMPLETE
2131,0.2765633613311881,2025-04-24 22:17:07.298123,2025-04-24 22:17:10.636513,0 days 00:00:03.338390,0.0956622279444743,5,sqrt,3,16,1295,0.6426350514591471,TPESampler,COMPLETE
2132,0.27862143024674574,2025-04-24 22:17:10.711744,2025-04-24 22:17:14.904340,0 days 00:00:04.192596,0.06316625509823676,5,sqrt,2,17,1236,0.6949552911401724,TPESampler,COMPLETE
2133,0.46984835898384614,2025-04-24 22:17:10.729310,2025-04-24 22:17:14.393018,0 days 00:00:03.663708,0.05051936288797394,5,,10,9,627,0.619075140218589,TPESampler,COMPLETE
2134,0.24700187478090455,2025-04-24 22:17:10.930758,2025-04-24 22:17:14.736083,0 days 00:00:03.805325,0.0628793270340324,6,sqrt,1,19,1234,0.6506487642188064,TPESampler,COMPLETE
2135,0.3143627604074951,2025-04-24 22:17:14.609243,2025-04-24 22:17:18.186720,0 days 00:00:03.577477,0.09860535091146734,6,sqrt,2,17,1297,0.6835154577667709,TPESampler,COMPLETE
2136,0.32422602779450976,2025-04-24 22:17:15.095168,2025-04-24 22:17:20.543880,0 days 00:00:05.448712,0.07382998380799664,5,,3,14,1249,0.6260848022966844,TPESampler,COMPLETE
2137,0.3210845648201959,2025-04-24 22:17:15.264672,2025-04-24 22:17:19.208568,0 days 00:00:03.943896,0.09500332336528772,6,sqrt,3,20,1382,0.6040770115552951,TPESampler,COMPLETE
2138,0.25120534789094756,2025-04-24 22:17:18.402682,2025-04-24 22:17:21.979102,0 days 00:00:03.576420,0.09373699477303463,7,sqrt,1,13,1462,0.618844891578294,TPESampler,COMPLETE
2139,0.30615800501806,2025-04-24 22:17:19.457610,2025-04-24 22:17:22.313812,0 days 00:00:02.856202,0.05682410653455226,6,sqrt,2,13,1038,0.669517803024117,TPESampler,COMPLETE
2140,1.192346979960268,2025-04-24 22:17:20.762644,2025-04-24 22:17:22.065004,0 days 00:00:01.302360,0.07529148671849704,9,log2,9,12,144,0.673597481596481,TPESampler,COMPLETE
2141,0.34088637216904805,2025-04-24 22:17:22.156413,2025-04-24 22:17:28.162974,0 days 00:00:06.006561,0.05909198853902976,5,,2,19,1474,0.6611949410668239,TPESampler,COMPLETE
2142,0.6414068312315404,2025-04-24 22:17:22.321771,2025-04-24 22:17:24.636099,0 days 00:00:02.314328,0.08564572887488663,11,log2,9,10,685,0.840996917020474,TPESampler,COMPLETE
2143,0.9770593047421952,2025-04-24 22:17:22.589078,2025-04-24 22:17:25.460381,0 days 00:00:02.871303,0.012513197030373045,11,log2,4,14,962,0.7130142548119706,TPESampler,COMPLETE
2144,0.4543473512484634,2025-04-24 22:17:24.863611,2025-04-24 22:17:31.727805,0 days 00:00:06.864194,0.026697403512998673,11,,10,3,1312,0.7549886948549285,TPESampler,COMPLETE
2145,0.2969056546371695,2025-04-24 22:17:25.708040,2025-04-24 22:17:28.233492,0 days 00:00:02.525452,0.03702276513805345,5,sqrt,2,20,1296,0.7879514094695541,TPESampler,COMPLETE
2146,0.29372978778026393,2025-04-24 22:17:28.343998,2025-04-24 22:17:31.590671,0 days 00:00:03.246673,0.04896992019724016,4,sqrt,3,20,1246,0.716197788861184,TPESampler,COMPLETE
2147,0.3001462054532793,2025-04-24 22:17:28.480428,2025-04-24 22:17:30.865185,0 days 00:00:02.384757,0.06194562566019817,4,sqrt,2,4,766,0.9040124861730185,TPESampler,COMPLETE
2148,0.3536858810061944,2025-04-24 22:17:31.074389,2025-04-24 22:17:34.416672,0 days 00:00:03.342283,0.09879766312241342,7,sqrt,2,12,1480,0.6056705910281274,TPESampler,COMPLETE
2149,0.3117061438468054,2025-04-24 22:17:31.934844,2025-04-24 22:17:34.762505,0 days 00:00:02.827661,0.09886392622949138,7,sqrt,2,17,1100,0.620492732528053,TPESampler,COMPLETE
2150,0.3717380037886765,2025-04-24 22:17:31.981061,2025-04-24 22:17:37.770260,0 days 00:00:05.789199,0.021426787019067667,12,,7,8,805,0.9611141249583899,TPESampler,COMPLETE
2151,0.8293474291919449,2025-04-24 22:17:34.617655,2025-04-24 22:17:35.866901,0 days 00:00:01.249246,0.02997769516726369,11,log2,3,8,360,0.6836410842109811,TPESampler,COMPLETE
2152,0.3336558170649003,2025-04-24 22:17:35.056486,2025-04-24 22:17:40.234986,0 days 00:00:05.178500,0.0257924037616506,4,,1,10,1302,0.845620655502872,TPESampler,COMPLETE
2153,0.2630219695389213,2025-04-24 22:17:36.066720,2025-04-24 22:17:38.832992,0 days 00:00:02.766272,0.06660970620214722,5,sqrt,1,15,1309,0.661737905879192,TPESampler,COMPLETE
2154,0.2937139037714588,2025-04-24 22:17:37.977573,2025-04-24 22:17:40.130939,0 days 00:00:02.153366,0.07916557043314817,6,sqrt,1,14,711,0.6512954641226184,TPESampler,COMPLETE
2155,0.33373918036608546,2025-04-24 22:17:39.047054,2025-04-24 22:17:40.784634,0 days 00:00:01.737580,0.04004938933725522,3,sqrt,2,20,851,0.6872151194798319,TPESampler,COMPLETE
2156,0.314264562870733,2025-04-24 22:17:40.600433,2025-04-24 22:17:43.186913,0 days 00:00:02.586480,0.06116157952021694,6,log2,1,6,751,0.6269683945828756,TPESampler,COMPLETE
2157,0.2800559686687049,2025-04-24 22:17:40.722667,2025-04-24 22:17:44.300190,0 days 00:00:03.577523,0.09844801218516848,5,sqrt,3,19,1210,0.8495994423623554,TPESampler,COMPLETE
2158,0.29004605126268174,2025-04-24 22:17:41.188041,2025-04-24 22:17:43.553791,0 days 00:00:02.365750,0.03135757833557258,7,sqrt,1,2,625,0.7393680534804562,TPESampler,COMPLETE
2159,0.2567956350755582,2025-04-24 22:17:43.362237,2025-04-24 22:17:46.399803,0 days 00:00:03.037566,0.05707436307276347,6,sqrt,1,18,1243,0.6996124582692609,TPESampler,COMPLETE
2160,0.2833527593068961,2025-04-24 22:17:43.795437,2025-04-24 22:17:47.028667,0 days 00:00:03.233230,0.09855166145079998,4,sqrt,1,14,1271,0.7178078050251092,TPESampler,COMPLETE
2161,0.2739860344840556,2025-04-24 22:17:44.513770,2025-04-24 22:17:47.776597,0 days 00:00:03.262827,0.09858067191530953,6,sqrt,1,18,1229,0.6181952170396869,TPESampler,COMPLETE
2162,1.2940445904396984,2025-04-24 22:17:46.928991,2025-04-24 22:17:48.661102,0 days 00:00:01.732111,0.013022718528599205,12,log2,9,12,174,0.6745887071959993,TPESampler,COMPLETE
2163,0.2939465677096791,2025-04-24 22:17:47.606397,2025-04-24 22:17:50.672637,0 days 00:00:03.066240,0.09535774206300855,6,sqrt,1,17,867,0.7065214984616024,TPESampler,COMPLETE
2164,0.2730486913903946,2025-04-24 22:17:48.353632,2025-04-24 22:17:52.472145,0 days 00:00:04.118513,0.0899170846824317,10,log2,1,18,1325,0.7092209709364146,TPESampler,COMPLETE
2165,0.3165496479494692,2025-04-24 22:17:49.260328,2025-04-24 22:17:52.469570,0 days 00:00:03.209242,0.06580502829720969,12,sqrt,2,19,1023,0.7603368540105938,TPESampler,COMPLETE
2166,0.3059061851659304,2025-04-24 22:17:51.218151,2025-04-24 22:17:54.604975,0 days 00:00:03.386824,0.05980543766942136,5,sqrt,3,17,1395,0.7001140320031888,TPESampler,COMPLETE
2167,0.24487521166112675,2025-04-24 22:17:52.880956,2025-04-24 22:17:56.384032,0 days 00:00:03.503076,0.09136937047058764,4,sqrt,1,19,1131,0.6036917290332885,TPESampler,COMPLETE
2168,0.8861999368273465,2025-04-24 22:17:53.069570,2025-04-24 22:17:55.221979,0 days 00:00:02.152409,0.03488456643048266,3,sqrt,5,10,186,0.6121695375565026,TPESampler,COMPLETE
2169,0.2696860625181834,2025-04-24 22:17:54.978548,2025-04-24 22:17:58.701305,0 days 00:00:03.722757,0.053757730575852786,5,sqrt,1,15,1443,0.6071294413301529,TPESampler,COMPLETE
2170,0.2736355388537714,2025-04-24 22:17:55.629844,2025-04-24 22:17:59.586463,0 days 00:00:03.956619,0.05376533457024773,8,sqrt,1,11,1128,0.6702441688982034,TPESampler,COMPLETE
2171,0.2928769596023917,2025-04-24 22:17:56.723322,2025-04-24 22:17:59.312814,0 days 00:00:02.589492,0.060991089831247895,5,sqrt,1,20,704,0.655764354129044,TPESampler,COMPLETE
2172,0.3031465763009301,2025-04-24 22:17:58.950365,2025-04-24 22:18:02.104204,0 days 00:00:03.153839,0.09748444015794497,5,sqrt,3,20,1276,0.6771028394284434,TPESampler,COMPLETE
2173,0.2879250437180699,2025-04-24 22:17:59.553514,2025-04-24 22:18:03.769427,0 days 00:00:04.215913,0.09893088980311225,4,sqrt,3,12,1244,0.8140782762451562,TPESampler,COMPLETE
2174,0.2764999888256086,2025-04-24 22:17:59.819275,2025-04-24 22:18:04.353366,0 days 00:00:04.534091,0.07288439409620222,5,sqrt,1,17,1384,0.6688285306582527,TPESampler,COMPLETE
2175,0.3115117511178416,2025-04-24 22:18:02.340349,2025-04-24 22:18:05.186356,0 days 00:00:02.846007,0.02868303069226993,7,sqrt,4,12,877,0.9982778232310661,TPESampler,COMPLETE
2176,0.37103642635579975,2025-04-24 22:18:03.994031,2025-04-24 22:18:08.248224,0 days 00:00:04.254193,0.08385216937726823,11,,2,14,824,0.610171932338998,TPESampler,COMPLETE
2177,0.2697405248281059,2025-04-24 22:18:04.632441,2025-04-24 22:18:07.360510,0 days 00:00:02.728069,0.09818709043175558,10,sqrt,1,13,1245,0.6987574387639048,TPESampler,COMPLETE
2178,0.36985315986376416,2025-04-24 22:18:05.464930,2025-04-24 22:18:14.640234,0 days 00:00:09.175304,0.0201967636148864,12,,7,14,1442,0.9317049667195942,TPESampler,COMPLETE
2179,0.2602605199470549,2025-04-24 22:18:07.559868,2025-04-24 22:18:09.937056,0 days 00:00:02.377188,0.08337889735395901,6,sqrt,1,11,1012,0.7683438720645005,TPESampler,COMPLETE
2180,0.23221291823242235,2025-04-24 22:18:08.452977,2025-04-24 22:18:11.469363,0 days 00:00:03.016386,0.09527902112242814,6,sqrt,1,16,1430,0.7009883717055757,TPESampler,COMPLETE
2181,0.2890469113895352,2025-04-24 22:18:10.136099,2025-04-24 22:18:12.413261,0 days 00:00:02.277162,0.04605161360643806,6,sqrt,2,19,891,0.7372927367499578,TPESampler,COMPLETE
2182,0.2646458397065218,2025-04-24 22:18:11.680470,2025-04-24 22:18:15.042929,0 days 00:00:03.362459,0.09162451068044498,6,sqrt,1,20,1473,0.6921697877358718,TPESampler,COMPLETE
2183,0.28748795532748356,2025-04-24 22:18:12.633273,2025-04-24 22:18:16.129512,0 days 00:00:03.496239,0.05675231048957985,5,sqrt,3,18,1491,0.6756659103099965,TPESampler,COMPLETE
2184,0.3372459338522195,2025-04-24 22:18:14.986090,2025-04-24 22:18:18.230903,0 days 00:00:03.244813,0.07778440829896568,3,,6,3,739,0.9647915069604927,TPESampler,COMPLETE
2185,0.29388161596190404,2025-04-24 22:18:15.375996,2025-04-24 22:18:18.702600,0 days 00:00:03.326604,0.0841888152920851,5,sqrt,1,20,1250,0.7018631851513626,TPESampler,COMPLETE
2186,0.2470440628250119,2025-04-24 22:18:16.346526,2025-04-24 22:18:20.204110,0 days 00:00:03.857584,0.0687773816280932,10,sqrt,1,16,1436,0.6063481917229792,TPESampler,COMPLETE
2187,0.3036676187057901,2025-04-24 22:18:18.454365,2025-04-24 22:18:22.508228,0 days 00:00:04.053863,0.0878910693812212,6,sqrt,2,16,1490,0.6469438297931058,TPESampler,COMPLETE
2188,0.31754604275321785,2025-04-24 22:18:19.000529,2025-04-24 22:18:22.781582,0 days 00:00:03.781053,0.06007655033004925,7,sqrt,2,18,1476,0.654512988239053,TPESampler,COMPLETE
2189,0.38763734926373006,2025-04-24 22:18:20.416752,2025-04-24 22:18:22.482792,0 days 00:00:02.066040,0.07894849273378823,12,,2,17,164,0.9837576992974849,TPESampler,COMPLETE
2190,0.3153610297129698,2025-04-24 22:18:22.677695,2025-04-24 22:18:28.576001,0 days 00:00:05.898306,0.05901252172178302,7,,3,16,1354,0.6682720481175097,TPESampler,COMPLETE
2191,0.2752244730666228,2025-04-24 22:18:22.727182,2025-04-24 22:18:27.401446,0 days 00:00:04.674264,0.09497915762006842,7,,1,18,1135,0.660463727307719,TPESampler,COMPLETE
2192,0.3385585089756468,2025-04-24 22:18:23.045941,2025-04-24 22:18:25.455498,0 days 00:00:02.409557,0.04682884654701492,9,sqrt,2,19,711,0.6884755641575487,TPESampler,COMPLETE
2193,0.28957244089729384,2025-04-24 22:18:25.663747,2025-04-24 22:18:30.172846,0 days 00:00:04.509099,0.07477149294555042,11,,1,20,801,0.7528678158284086,TPESampler,COMPLETE
2194,0.28304796948130956,2025-04-24 22:18:27.605217,2025-04-24 22:18:30.733684,0 days 00:00:03.128467,0.05340634190193126,7,sqrt,1,15,1428,0.6851394474330014,TPESampler,COMPLETE
2195,0.2206168968736632,2025-04-24 22:18:28.792304,2025-04-24 22:18:32.552674,0 days 00:00:03.760370,0.09625923212550994,8,sqrt,1,17,1448,0.6176299519977592,TPESampler,COMPLETE
2196,0.3016992134266382,2025-04-24 22:18:30.390559,2025-04-24 22:18:33.788873,0 days 00:00:03.398314,0.07288735084974336,7,sqrt,2,16,1100,0.668957220381439,TPESampler,COMPLETE
2197,0.2683845188651992,2025-04-24 22:18:30.954037,2025-04-24 22:18:34.297948,0 days 00:00:03.343911,0.07028599091366901,7,sqrt,1,16,1257,0.6075570625095209,TPESampler,COMPLETE
2198,1.2930567234840162,2025-04-24 22:18:32.763879,2025-04-24 22:18:33.874201,0 days 00:00:01.110322,0.024646473816243505,12,log2,10,18,161,0.7837196162748095,TPESampler,COMPLETE
2199,0.2427316713090953,2025-04-24 22:18:33.977055,2025-04-24 22:18:38.422422,0 days 00:00:04.445367,0.06117190530290611,9,sqrt,1,13,1442,0.6442373028362383,TPESampler,COMPLETE
2200,0.2978017819372489,2025-04-24 22:18:34.116901,2025-04-24 22:18:37.872995,0 days 00:00:03.756094,0.06032824401767971,9,sqrt,3,17,1225,0.6245991207309013,TPESampler,COMPLETE
2201,0.23099740323974285,2025-04-24 22:18:34.645086,2025-04-24 22:18:38.629383,0 days 00:00:03.984297,0.08286254620416494,9,sqrt,1,15,1359,0.6486347678987924,TPESampler,COMPLETE
2202,0.295393393647784,2025-04-24 22:18:38.055606,2025-04-24 22:18:41.683158,0 days 00:00:03.627552,0.09542089696747699,8,sqrt,1,17,1483,0.691917219088092,TPESampler,COMPLETE
2203,0.2620210280135148,2025-04-24 22:18:38.665227,2025-04-24 22:18:41.724627,0 days 00:00:03.059400,0.08603260777899191,5,sqrt,1,20,1008,0.6769329361922024,TPESampler,COMPLETE
2204,0.34279754905664256,2025-04-24 22:18:38.870737,2025-04-24 22:18:45.369292,0 days 00:00:06.498555,0.048695750238919366,5,,5,17,1430,0.8368200198049087,TPESampler,COMPLETE
2205,0.6087456471404802,2025-04-24 22:18:41.853779,2025-04-24 22:18:44.319379,0 days 00:00:02.465600,0.07076118047825389,3,log2,10,10,937,0.9376629146244675,TPESampler,COMPLETE
2206,0.285437937156898,2025-04-24 22:18:41.894943,2025-04-24 22:18:44.924377,0 days 00:00:03.029434,0.06195174644241919,8,sqrt,3,14,1108,0.6130633081203704,TPESampler,COMPLETE
2207,0.26351709723574884,2025-04-24 22:18:44.518519,2025-04-24 22:18:51.223094,0 days 00:00:06.704575,0.0879505397525316,9,,1,14,1378,0.6156219862316252,TPESampler,COMPLETE
2208,0.2715482544724516,2025-04-24 22:18:45.133008,2025-04-24 22:18:48.765172,0 days 00:00:03.632164,0.06790952542229611,8,sqrt,3,18,1461,0.6439600996466673,TPESampler,COMPLETE
2209,0.24433945461476322,2025-04-24 22:18:45.653226,2025-04-24 22:18:48.854960,0 days 00:00:03.201734,0.09625115150669329,7,sqrt,1,17,1184,0.6412300107649792,TPESampler,COMPLETE
2210,0.23028422041730184,2025-04-24 22:18:48.938864,2025-04-24 22:18:52.440647,0 days 00:00:03.501783,0.08842992048625212,9,sqrt,1,18,1225,0.6115448096920895,TPESampler,COMPLETE
2211,0.2829477292949596,2025-04-24 22:18:49.077176,2025-04-24 22:18:52.412476,0 days 00:00:03.335300,0.0868897171807128,8,sqrt,1,18,1202,0.6543399700596183,TPESampler,COMPLETE
2212,0.3151429769906075,2025-04-24 22:18:51.527296,2025-04-24 22:18:59.297610,0 days 00:00:07.770314,0.0924542877346979,9,,3,12,1495,0.6904299802494152,TPESampler,COMPLETE
2213,0.2539451065273856,2025-04-24 22:18:52.589858,2025-04-24 22:18:56.182901,0 days 00:00:03.593043,0.09207589671872432,8,sqrt,1,16,1324,0.6608598657446989,TPESampler,COMPLETE
2214,0.3167071180069423,2025-04-24 22:18:52.710431,2025-04-24 22:18:56.123004,0 days 00:00:03.412573,0.08394424028889086,9,sqrt,2,16,1204,0.617735567540855,TPESampler,COMPLETE
2215,0.3602899055757273,2025-04-24 22:18:56.292928,2025-04-24 22:19:00.121904,0 days 00:00:03.828976,0.0871891781363084,10,sqrt,2,19,1395,0.6186812726741118,TPESampler,COMPLETE
2216,0.26250123671089703,2025-04-24 22:18:56.334989,2025-04-24 22:19:00.310285,0 days 00:00:03.975296,0.0935268309818351,10,sqrt,1,16,1363,0.615125524260345,TPESampler,COMPLETE
2217,0.48850267954143567,2025-04-24 22:18:59.517085,2025-04-24 22:19:03.230306,0 days 00:00:03.713221,0.02849306218075916,12,log2,5,11,1429,0.7330965017501138,TPESampler,COMPLETE
2218,0.3073849144167453,2025-04-24 22:19:00.338664,2025-04-24 22:19:04.012723,0 days 00:00:03.674059,0.09050537723117341,8,sqrt,3,14,1232,0.6052964208261793,TPESampler,COMPLETE
