number,value,datetime_start,datetime_complete,duration,params_learning_rate,params_max_depth,params_max_features,params_min_samples_leaf,params_min_samples_split,params_n_estimators,params_subsample,system_attrs_auto:sampler,state
617,0.24797574728125832,2025-04-24 21:46:41.065507,2025-04-24 21:46:43.804798,0 days 00:00:02.739291,0.0727961709044058,5,sqrt,1,19,1489,0.7519586158884378,TPESampler,COMPLETE
618,0.4392458558174275,2025-04-24 21:46:42.005912,2025-04-24 21:46:43.062123,0 days 00:00:01.056211,0.09788908407330744,6,sqrt,7,6,268,0.6813526196774149,TPESampler,COMPLETE
619,0.2695067957952515,2025-04-24 21:46:43.111961,2025-04-24 21:46:46.609361,0 days 00:00:03.497400,0.08208060869704932,5,sqrt,1,11,1423,0.6846004792814034,TPESampler,COMPLETE
620,0.43610297113371854,2025-04-24 21:46:43.295095,2025-04-24 21:46:47.770460,0 days 00:00:04.475365,0.010969257713776994,4,,10,3,1036,0.924928647761978,TPESampler,COMPLETE
621,0.7301940730934545,2025-04-24 21:46:44.000191,2025-04-24 21:46:47.305894,0 days 00:00:03.305703,0.0119190917470398,4,log2,4,3,1462,0.9351667447588938,TPESampler,COMPLETE
622,0.32848693082572317,2025-04-24 21:46:46.773731,2025-04-24 21:46:49.795838,0 days 00:00:03.022107,0.09623063267228664,6,sqrt,1,11,1089,0.6368614422524077,TPESampler,COMPLETE
623,1.1594386159123262,2025-04-24 21:46:47.531971,2025-04-24 21:46:49.843688,0 days 00:00:02.311717,0.01029858529296572,8,log2,10,12,867,0.8978819496530595,TPESampler,COMPLETE
624,0.5119613652006262,2025-04-24 21:46:47.999050,2025-04-24 21:46:51.234717,0 days 00:00:03.235667,0.01328325224016832,9,,10,2,620,0.6431682458308957,TPESampler,COMPLETE
625,0.4390819525282235,2025-04-24 21:46:49.948459,2025-04-24 21:46:52.371410,0 days 00:00:02.422951,0.03995896401891677,5,sqrt,9,8,857,0.902405309703203,TPESampler,COMPLETE
626,0.26274913291559737,2025-04-24 21:46:50.011104,2025-04-24 21:46:53.709404,0 days 00:00:03.698300,0.09872947186912616,6,sqrt,1,7,1251,0.6149402845117071,TPESampler,COMPLETE
627,0.5651525155274572,2025-04-24 21:46:51.495042,2025-04-24 21:46:53.276531,0 days 00:00:01.781489,0.013567276514740762,7,sqrt,1,8,406,0.7864258414632375,TPESampler,COMPLETE
628,0.28589143608420614,2025-04-24 21:46:52.590981,2025-04-24 21:46:56.235868,0 days 00:00:03.644887,0.0987331703459667,7,sqrt,3,11,1427,0.6207483104615423,TPESampler,COMPLETE
629,0.36586446129321176,2025-04-24 21:46:53.494209,2025-04-24 21:46:55.433107,0 days 00:00:01.938898,0.03446609092702473,10,,6,18,261,0.7822889213042444,TPESampler,COMPLETE
630,0.2948773631134428,2025-04-24 21:46:53.876033,2025-04-24 21:46:57.699074,0 days 00:00:03.823041,0.04287135870453302,4,sqrt,3,18,1447,0.6105408543381847,TPESampler,COMPLETE
631,0.29072457467511614,2025-04-24 21:46:55.639263,2025-04-24 21:46:59.059507,0 days 00:00:03.420244,0.06317202808215103,3,sqrt,1,14,1319,0.6839255156389971,TPESampler,COMPLETE
632,0.4277624425303987,2025-04-24 21:46:56.449974,2025-04-24 21:46:57.926448,0 days 00:00:01.476474,0.04403113435950199,10,log2,1,5,258,0.616480385388904,TPESampler,COMPLETE
633,0.34744238518660614,2025-04-24 21:46:57.887426,2025-04-24 21:47:00.495247,0 days 00:00:02.607821,0.011156179462453236,11,sqrt,2,12,884,0.8557167850946895,TPESampler,COMPLETE
634,0.3027937735539162,2025-04-24 21:46:58.152519,2025-04-24 21:47:00.903293,0 days 00:00:02.750774,0.08889249479363599,4,sqrt,3,13,1065,0.6445367313793328,TPESampler,COMPLETE
635,0.2904474030836225,2025-04-24 21:46:59.294461,2025-04-24 21:47:02.840411,0 days 00:00:03.545950,0.09706894871922819,3,sqrt,3,14,1426,0.6039722434889637,TPESampler,COMPLETE
636,0.25970524174750437,2025-04-24 21:47:00.655280,2025-04-24 21:47:04.377640,0 days 00:00:03.722360,0.07101333046250138,4,sqrt,1,14,1417,0.6031568487000123,TPESampler,COMPLETE
637,0.30282052310507807,2025-04-24 21:47:01.087220,2025-04-24 21:47:04.938324,0 days 00:00:03.851104,0.09751551941954865,4,sqrt,3,8,1369,0.776135813934608,TPESampler,COMPLETE
638,0.29219694427729503,2025-04-24 21:47:03.005684,2025-04-24 21:47:05.992765,0 days 00:00:02.987081,0.0783459042697256,5,sqrt,1,15,1181,0.6517609464612981,TPESampler,COMPLETE
639,0.25014156257249154,2025-04-24 21:47:04.571722,2025-04-24 21:47:07.138245,0 days 00:00:02.566523,0.07747334290415088,8,sqrt,1,19,1042,0.6072685193453036,TPESampler,COMPLETE
640,0.32974892084695273,2025-04-24 21:47:05.108071,2025-04-24 21:47:08.700961,0 days 00:00:03.592890,0.018420433648192718,3,,5,9,1069,0.6239191383090816,TPESampler,COMPLETE
641,0.42069322471448906,2025-04-24 21:47:06.212714,2025-04-24 21:47:08.023928,0 days 00:00:01.811214,0.06882041125937485,9,log2,5,18,710,0.8566296568265048,TPESampler,COMPLETE
642,0.29582210686859717,2025-04-24 21:47:07.430260,2025-04-24 21:47:12.939218,0 days 00:00:05.508958,0.0776056622471252,5,,3,5,1467,0.6692959400899099,TPESampler,COMPLETE
643,0.2898371581146952,2025-04-24 21:47:08.228968,2025-04-24 21:47:11.593652,0 days 00:00:03.364684,0.09836552610306508,3,sqrt,1,4,1464,0.7330879053076357,TPESampler,COMPLETE
644,0.29052970679663503,2025-04-24 21:47:08.907472,2025-04-24 21:47:12.690717,0 days 00:00:03.783245,0.06787378589989032,7,sqrt,1,19,1476,0.712854872078725,TPESampler,COMPLETE
645,0.3164205940494322,2025-04-24 21:47:11.824920,2025-04-24 21:47:15.907447,0 days 00:00:04.082527,0.07343510704828661,6,sqrt,1,14,1349,0.6030563720994558,TPESampler,COMPLETE
646,0.2699462091871609,2025-04-24 21:47:12.889651,2025-04-24 21:47:16.925882,0 days 00:00:04.036231,0.09560235414965684,7,sqrt,2,16,1398,0.6199102370795474,TPESampler,COMPLETE
647,0.252947415029031,2025-04-24 21:47:13.207421,2025-04-24 21:47:16.952607,0 days 00:00:03.745186,0.06537874130422022,5,sqrt,1,4,1240,0.7452326498797265,TPESampler,COMPLETE
648,0.2782912472803754,2025-04-24 21:47:16.114479,2025-04-24 21:47:19.426261,0 days 00:00:03.311782,0.09134574690011348,5,sqrt,1,12,1406,0.604695584703341,TPESampler,COMPLETE
649,0.372488137199348,2025-04-24 21:47:17.088569,2025-04-24 21:47:19.983342,0 days 00:00:02.894773,0.01794167146562227,8,sqrt,5,14,991,0.6720723292116115,TPESampler,COMPLETE
650,0.32721597024575233,2025-04-24 21:47:17.135687,2025-04-24 21:47:19.672069,0 days 00:00:02.536382,0.050368172598634645,3,,5,10,525,0.7654322907742002,TPESampler,COMPLETE
651,0.2599270427271949,2025-04-24 21:47:19.625080,2025-04-24 21:47:23.722179,0 days 00:00:04.097099,0.09187061289812888,3,sqrt,1,11,1470,0.7436616980582155,TPESampler,COMPLETE
652,0.306796436695158,2025-04-24 21:47:19.932014,2025-04-24 21:47:23.454181,0 days 00:00:03.522167,0.05865080836391768,6,sqrt,2,10,1091,0.614618407089829,TPESampler,COMPLETE
653,0.3189220273087593,2025-04-24 21:47:20.348519,2025-04-24 21:47:24.465174,0 days 00:00:04.116655,0.05196086904860437,9,sqrt,5,14,1482,0.6323305241825308,TPESampler,COMPLETE
654,1.2334178894928425,2025-04-24 21:47:23.678976,2025-04-24 21:47:24.667347,0 days 00:00:00.988371,0.016372826062606895,3,log2,6,13,263,0.7681515624031761,TPESampler,COMPLETE
655,0.9308866868399817,2025-04-24 21:47:23.968485,2025-04-24 21:47:25.563279,0 days 00:00:01.594794,0.016394694103646766,7,log2,4,6,540,0.9936400985604052,TPESampler,COMPLETE
656,0.3145945585425696,2025-04-24 21:47:24.691406,2025-04-24 21:47:28.630891,0 days 00:00:03.939485,0.029503694119937102,10,sqrt,2,18,1488,0.6454056768050368,TPESampler,COMPLETE
657,0.698173858763389,2025-04-24 21:47:24.869520,2025-04-24 21:47:27.565843,0 days 00:00:02.696323,0.010113709250604046,3,sqrt,1,10,1003,0.963361019985791,TPESampler,COMPLETE
658,0.24723064600701805,2025-04-24 21:47:25.912725,2025-04-24 21:47:30.584532,0 days 00:00:04.671807,0.0953275636226019,5,sqrt,1,11,1496,0.6660453826460553,TPESampler,COMPLETE
659,0.3308328733390822,2025-04-24 21:47:27.818872,2025-04-24 21:47:31.878860,0 days 00:00:04.059988,0.06566421966643625,6,sqrt,5,19,1484,0.7745543808723737,TPESampler,COMPLETE
660,0.29023369548695405,2025-04-24 21:47:28.833935,2025-04-24 21:47:33.026372,0 days 00:00:04.192437,0.052380201254249484,6,sqrt,1,20,1498,0.6616295810123404,TPESampler,COMPLETE
661,0.26873788755448247,2025-04-24 21:47:30.812846,2025-04-24 21:47:34.678727,0 days 00:00:03.865881,0.08517837687096502,4,sqrt,1,18,1486,0.6709842284599342,TPESampler,COMPLETE
662,0.2319753891625511,2025-04-24 21:47:32.189030,2025-04-24 21:47:35.896744,0 days 00:00:03.707714,0.08199350701269764,5,sqrt,1,18,1450,0.6079639572202251,TPESampler,COMPLETE
663,0.2501233442370039,2025-04-24 21:47:33.190588,2025-04-24 21:47:37.013988,0 days 00:00:03.823400,0.07234996959343197,6,sqrt,1,16,1495,0.6365218147189917,TPESampler,COMPLETE
664,0.8475309817703462,2025-04-24 21:47:34.873387,2025-04-24 21:47:37.938147,0 days 00:00:03.064760,0.021033817599908425,5,log2,10,12,1465,0.7363763233120805,TPESampler,COMPLETE
665,0.31538951908006574,2025-04-24 21:47:36.067212,2025-04-24 21:47:39.221051,0 days 00:00:03.153839,0.06271962285435755,6,sqrt,2,2,1485,0.7793528650378273,TPESampler,COMPLETE
666,0.3639547757083142,2025-04-24 21:47:37.187621,2025-04-24 21:47:42.793617,0 days 00:00:05.605996,0.03924575322583796,11,,7,17,919,0.9219511822015262,TPESampler,COMPLETE
667,0.3510765334035963,2025-04-24 21:47:38.097286,2025-04-24 21:47:40.690908,0 days 00:00:02.593622,0.08974501000642897,7,log2,6,13,1478,0.9231628233139002,TPESampler,COMPLETE
668,0.33795365279112977,2025-04-24 21:47:39.411941,2025-04-24 21:47:44.611905,0 days 00:00:05.199964,0.09632027746953921,6,,2,10,1442,0.638821480204773,TPESampler,COMPLETE
669,0.3856728217756399,2025-04-24 21:47:40.887064,2025-04-24 21:47:42.545465,0 days 00:00:01.658401,0.03456932816212112,12,sqrt,7,10,685,0.878023822481023,TPESampler,COMPLETE
670,0.35966426609991664,2025-04-24 21:47:42.744818,2025-04-24 21:47:48.393560,0 days 00:00:05.648742,0.07996391109695963,7,,4,15,1477,0.6004112554640103,TPESampler,COMPLETE
671,0.2540559139686808,2025-04-24 21:47:43.047548,2025-04-24 21:47:45.339816,0 days 00:00:02.292268,0.09502522760712688,6,sqrt,1,20,1013,0.6207117510099185,TPESampler,COMPLETE
672,0.6479842612719517,2025-04-24 21:47:44.799256,2025-04-24 21:47:48.015754,0 days 00:00:03.216498,0.031819575171164814,10,log2,8,18,1450,0.8929634413246846,TPESampler,COMPLETE
673,0.320478603105558,2025-04-24 21:47:45.560867,2025-04-24 21:47:48.629831,0 days 00:00:03.068964,0.09464091354621049,6,log2,1,16,1051,0.600874597516313,TPESampler,COMPLETE
674,0.2577580898257955,2025-04-24 21:47:48.549657,2025-04-24 21:47:53.999305,0 days 00:00:05.449648,0.0525626496739444,4,,1,11,1419,0.6152411659363349,TPESampler,COMPLETE
675,0.3255231507869208,2025-04-24 21:47:48.846029,2025-04-24 21:47:53.027567,0 days 00:00:04.181538,0.09305350563091035,6,sqrt,3,4,1082,0.8147808493652441,TPESampler,COMPLETE
676,0.2773871105747793,2025-04-24 21:47:49.022530,2025-04-24 21:47:53.377074,0 days 00:00:04.354544,0.08419185581067758,4,sqrt,2,19,1402,0.6047192842940521,TPESampler,COMPLETE
677,0.29642235590322696,2025-04-24 21:47:53.237666,2025-04-24 21:47:54.866035,0 days 00:00:01.628369,0.06954626398076928,9,sqrt,2,15,433,0.9750521742718686,TPESampler,COMPLETE
678,0.26437756616171443,2025-04-24 21:47:53.632660,2025-04-24 21:47:57.190830,0 days 00:00:03.558170,0.09342539141519951,6,sqrt,1,13,1270,0.6486007380059741,TPESampler,COMPLETE
679,0.2915741835459823,2025-04-24 21:47:54.443223,2025-04-24 21:47:58.292754,0 days 00:00:03.849531,0.0986246553696323,7,sqrt,1,15,1394,0.6540868795918947,TPESampler,COMPLETE
680,0.27556767923922043,2025-04-24 21:47:55.175124,2025-04-24 21:47:58.822211,0 days 00:00:03.647087,0.061123945474895386,3,sqrt,1,2,1182,0.8199239018488611,TPESampler,COMPLETE
681,0.2554886261181357,2025-04-24 21:47:57.505586,2025-04-24 21:48:01.200319,0 days 00:00:03.694733,0.0728256305692275,6,sqrt,1,16,1255,0.6020658321549167,TPESampler,COMPLETE
682,0.25602771294197074,2025-04-24 21:47:58.523668,2025-04-24 21:48:02.395146,0 days 00:00:03.871478,0.09024839890680696,4,sqrt,1,7,1334,0.6899302654097809,TPESampler,COMPLETE
683,0.5753025847816847,2025-04-24 21:47:59.025932,2025-04-24 21:48:02.201781,0 days 00:00:03.175849,0.07079363253932185,5,log2,10,16,1165,0.8669839469720045,TPESampler,COMPLETE
684,0.29386244176549037,2025-04-24 21:48:01.416821,2025-04-24 21:48:04.700475,0 days 00:00:03.283654,0.08603434664179202,5,log2,2,14,1445,0.6795289025587606,TPESampler,COMPLETE
685,0.29712761053256953,2025-04-24 21:48:02.393717,2025-04-24 21:48:05.906813,0 days 00:00:03.513096,0.05014546990310078,5,sqrt,3,16,1425,0.609930474305582,TPESampler,COMPLETE
686,0.7201742423849757,2025-04-24 21:48:02.600545,2025-04-24 21:48:03.788842,0 days 00:00:01.188297,0.05481088686913762,10,sqrt,9,5,144,0.8066325101653542,TPESampler,COMPLETE
687,0.29870723600902,2025-04-24 21:48:03.949511,2025-04-24 21:48:06.407749,0 days 00:00:02.458238,0.08560706188238412,3,sqrt,2,10,1196,0.6349450119311381,TPESampler,COMPLETE
688,0.3758127377795675,2025-04-24 21:48:04.859716,2025-04-24 21:48:10.885959,0 days 00:00:06.026243,0.013334834174569255,11,,1,4,1082,0.7003015578097788,TPESampler,COMPLETE
689,0.32895892784008424,2025-04-24 21:48:06.166488,2025-04-24 21:48:08.821586,0 days 00:00:02.655098,0.0994800037038493,6,sqrt,4,14,1159,0.6555467606740858,TPESampler,COMPLETE
690,0.2869956352679885,2025-04-24 21:48:06.630486,2025-04-24 21:48:09.091036,0 days 00:00:02.460550,0.030406078236892106,5,sqrt,1,18,1079,0.6152368410130528,TPESampler,COMPLETE
691,0.2985920999474084,2025-04-24 21:48:09.005934,2025-04-24 21:48:11.918851,0 days 00:00:02.912917,0.09182737011328893,5,sqrt,3,10,1445,0.6062472805519544,TPESampler,COMPLETE
692,0.30276960597977215,2025-04-24 21:48:09.285807,2025-04-24 21:48:12.443142,0 days 00:00:03.157335,0.06593875561199607,9,sqrt,1,14,1492,0.683479332568628,TPESampler,COMPLETE
693,0.2884856571615903,2025-04-24 21:48:11.264298,2025-04-24 21:48:15.187209,0 days 00:00:03.922911,0.09991637447476906,8,sqrt,1,12,1228,0.6019438069506979,TPESampler,COMPLETE
694,0.7982148988457645,2025-04-24 21:48:12.219026,2025-04-24 21:48:15.608378,0 days 00:00:03.389352,0.023129217974377832,12,log2,8,4,1247,0.7469453418084988,TPESampler,COMPLETE
695,0.33172330520625565,2025-04-24 21:48:12.683184,2025-04-24 21:48:16.201153,0 days 00:00:03.517969,0.09945914320928355,3,sqrt,4,2,1237,0.8097592273036107,TPESampler,COMPLETE
696,0.2838435827140622,2025-04-24 21:48:15.396260,2025-04-24 21:48:19.432022,0 days 00:00:04.035762,0.07727230502086033,4,sqrt,2,14,1467,0.7753834019057118,TPESampler,COMPLETE
697,0.24250532037495934,2025-04-24 21:48:15.827592,2025-04-24 21:48:20.088874,0 days 00:00:04.261282,0.0942244783621232,6,log2,1,13,1486,0.6283487310643319,TPESampler,COMPLETE
698,0.2926228235274589,2025-04-24 21:48:16.399866,2025-04-24 21:48:20.656595,0 days 00:00:04.256729,0.046902351062362985,3,sqrt,1,6,1494,0.6889483619393134,TPESampler,COMPLETE
699,0.26168315969505196,2025-04-24 21:48:19.635569,2025-04-24 21:48:22.712792,0 days 00:00:03.077223,0.07133840567317308,6,sqrt,1,11,1481,0.6155909773321416,TPESampler,COMPLETE
700,0.33894839839649465,2025-04-24 21:48:20.284323,2025-04-24 21:48:25.666085,0 days 00:00:05.381762,0.09327819618004216,6,,1,3,1389,0.7269292392863529,TPESampler,COMPLETE
701,0.28180491122454404,2025-04-24 21:48:20.849005,2025-04-24 21:48:26.512197,0 days 00:00:05.663192,0.06910399745844628,9,,1,17,1450,0.6526860205515901,TPESampler,COMPLETE
702,0.283434557660051,2025-04-24 21:48:22.893174,2025-04-24 21:48:25.628403,0 days 00:00:02.735229,0.0728299686590593,3,sqrt,2,2,1472,0.753139656469079,TPESampler,COMPLETE
703,0.29460984426977127,2025-04-24 21:48:25.759871,2025-04-24 21:48:29.240731,0 days 00:00:03.480860,0.09814976542856226,7,sqrt,3,15,1229,0.615457580963727,TPESampler,COMPLETE
704,0.2540370784913928,2025-04-24 21:48:25.805449,2025-04-24 21:48:29.909427,0 days 00:00:04.103978,0.07109266607718549,4,sqrt,1,5,1425,0.784515756855215,TPESampler,COMPLETE
705,0.24759572011500278,2025-04-24 21:48:26.723529,2025-04-24 21:48:30.629659,0 days 00:00:03.906130,0.09820278463950662,5,sqrt,1,7,1458,0.7142025240892784,TPESampler,COMPLETE
706,0.301411492094909,2025-04-24 21:48:29.439377,2025-04-24 21:48:34.515641,0 days 00:00:05.076264,0.07981570582444446,3,,1,4,1399,0.7211474362051096,TPESampler,COMPLETE
707,0.2815356187536712,2025-04-24 21:48:30.100541,2025-04-24 21:48:33.317430,0 days 00:00:03.216889,0.044332634458469085,7,sqrt,2,17,1344,0.6259707109698032,TPESampler,COMPLETE
708,0.2537592840291341,2025-04-24 21:48:30.855555,2025-04-24 21:48:34.424143,0 days 00:00:03.568588,0.09599355471344698,4,sqrt,1,17,1481,0.6200612343207804,TPESampler,COMPLETE
709,0.29282348858745744,2025-04-24 21:48:33.510934,2025-04-24 21:48:36.940051,0 days 00:00:03.429117,0.06222557202230762,8,sqrt,3,17,1387,0.6486571446964868,TPESampler,COMPLETE
710,0.3185065473457185,2025-04-24 21:48:34.586808,2025-04-24 21:48:37.934270,0 days 00:00:03.347462,0.09793381695793077,5,sqrt,4,3,995,0.7283308623751356,TPESampler,COMPLETE
711,0.2720969261944639,2025-04-24 21:48:34.652388,2025-04-24 21:48:38.689529,0 days 00:00:04.037141,0.08520311381322844,3,sqrt,2,2,1344,0.6237118667307161,TPESampler,COMPLETE
712,0.826656308083467,2025-04-24 21:48:37.153273,2025-04-24 21:48:38.863376,0 days 00:00:01.710103,0.02998702530750522,3,log2,3,14,566,0.9037327726973484,TPESampler,COMPLETE
713,0.23995197729109463,2025-04-24 21:48:38.140901,2025-04-24 21:48:41.321799,0 days 00:00:03.180898,0.09630290196969611,5,sqrt,1,18,1272,0.6141929955625899,TPESampler,COMPLETE
714,0.2686524004468711,2025-04-24 21:48:38.872414,2025-04-24 21:48:42.578206,0 days 00:00:03.705792,0.07580590540138245,3,sqrt,1,10,1495,0.603821331005676,TPESampler,COMPLETE
715,0.2542944027448037,2025-04-24 21:48:39.057137,2025-04-24 21:48:42.873576,0 days 00:00:03.816439,0.09538552630178737,7,sqrt,1,19,1386,0.6020263941889731,TPESampler,COMPLETE
716,0.7761655455609959,2025-04-24 21:48:41.539066,2025-04-24 21:48:43.567990,0 days 00:00:02.028924,0.041512671711793035,7,log2,8,19,831,0.612569052250467,TPESampler,COMPLETE
717,0.2789994941012721,2025-04-24 21:48:42.745552,2025-04-24 21:48:45.418951,0 days 00:00:02.673399,0.05947238070572065,4,sqrt,1,19,1010,0.6739076782843756,TPESampler,COMPLETE
718,0.26448814485237043,2025-04-24 21:48:43.033035,2025-04-24 21:48:46.193238,0 days 00:00:03.160203,0.07599436716071857,6,sqrt,1,17,1222,0.6116550621672314,TPESampler,COMPLETE
719,0.31158954913602044,2025-04-24 21:48:43.912958,2025-04-24 21:48:46.170167,0 days 00:00:02.257209,0.02861186590318142,11,sqrt,1,6,703,0.6769821807099675,TPESampler,COMPLETE
720,0.300185287230736,2025-04-24 21:48:45.583151,2025-04-24 21:48:47.864208,0 days 00:00:02.281057,0.08672770456051569,5,sqrt,2,20,1171,0.6069186143430092,TPESampler,COMPLETE
721,0.24274065994453897,2025-04-24 21:48:46.324548,2025-04-24 21:48:49.744043,0 days 00:00:03.419495,0.09769155671613707,6,sqrt,1,14,1340,0.653207368494382,TPESampler,COMPLETE
722,0.3390049075387062,2025-04-24 21:48:46.366228,2025-04-24 21:48:50.781654,0 days 00:00:04.415426,0.026451934819081584,3,,6,10,1141,0.9489374121336289,TPESampler,COMPLETE
723,0.2814132584754737,2025-04-24 21:48:48.088640,2025-04-24 21:48:51.019617,0 days 00:00:02.930977,0.0872931143925338,5,sqrt,1,15,1084,0.6657598575392377,TPESampler,COMPLETE
724,0.2604942358379469,2025-04-24 21:48:49.931201,2025-04-24 21:48:53.014450,0 days 00:00:03.083249,0.052399870388228194,4,sqrt,1,18,1405,0.6171494687465796,TPESampler,COMPLETE
725,0.288106852631999,2025-04-24 21:48:50.975283,2025-04-24 21:48:53.902266,0 days 00:00:02.926983,0.08109140254360883,5,sqrt,1,2,1226,0.6818356457126906,TPESampler,COMPLETE
726,0.33960633080784025,2025-04-24 21:48:51.273630,2025-04-24 21:48:56.369391,0 days 00:00:05.095761,0.038383029139073,6,,2,16,1307,0.6161266249461834,TPESampler,COMPLETE
727,0.35198366741654163,2025-04-24 21:48:53.186085,2025-04-24 21:48:54.877890,0 days 00:00:01.691805,0.022964728097877855,5,sqrt,3,17,717,0.8454968618532588,TPESampler,COMPLETE
728,0.30509854184801705,2025-04-24 21:48:54.088175,2025-04-24 21:48:56.606012,0 days 00:00:02.517837,0.09548538077919325,4,sqrt,2,13,1191,0.6730297241824187,TPESampler,COMPLETE
729,0.2795104931044036,2025-04-24 21:48:55.073266,2025-04-24 21:48:58.105772,0 days 00:00:03.032506,0.09705387267726008,5,sqrt,2,15,1302,0.645305905382774,TPESampler,COMPLETE
730,0.29820070374689117,2025-04-24 21:48:56.564076,2025-04-24 21:48:58.445920,0 days 00:00:01.881844,0.06318477566733818,11,,1,17,248,0.7083543348132713,TPESampler,COMPLETE
731,0.3050756183852761,2025-04-24 21:48:56.853450,2025-04-24 21:48:59.337147,0 days 00:00:02.483697,0.05353329090146435,4,sqrt,1,16,1095,0.617960093444551,TPESampler,COMPLETE
732,0.3138385148747859,2025-04-24 21:48:58.297534,2025-04-24 21:49:01.973382,0 days 00:00:03.675848,0.05672539144091351,4,sqrt,1,5,1482,0.7344606046386646,TPESampler,COMPLETE
733,0.25469987935010563,2025-04-24 21:48:58.682940,2025-04-24 21:49:02.415613,0 days 00:00:03.732673,0.03579344463542277,6,sqrt,1,17,1489,0.6632769129723066,TPESampler,COMPLETE
734,0.28735624604479737,2025-04-24 21:48:59.531253,2025-04-24 21:49:03.353048,0 days 00:00:03.821795,0.05982243977794582,7,sqrt,1,6,1474,0.7640903189133619,TPESampler,COMPLETE
735,0.2766523667333924,2025-04-24 21:49:02.143233,2025-04-24 21:49:06.270686,0 days 00:00:04.127453,0.08428905046618328,5,sqrt,3,17,1453,0.6920934101775397,TPESampler,COMPLETE
736,0.2623050841057828,2025-04-24 21:49:02.586424,2025-04-24 21:49:06.525596,0 days 00:00:03.939172,0.09929402901847101,4,sqrt,1,16,1326,0.6121235095992414,TPESampler,COMPLETE
737,0.27545952735803036,2025-04-24 21:49:03.550270,2025-04-24 21:49:07.004485,0 days 00:00:03.454215,0.04418577354216527,8,sqrt,1,14,1130,0.7073844549736452,TPESampler,COMPLETE
738,0.29744019604764516,2025-04-24 21:49:06.479749,2025-04-24 21:49:09.945890,0 days 00:00:03.466141,0.09914725124018883,5,sqrt,3,8,1320,0.682779108137627,TPESampler,COMPLETE
739,0.31298601900337425,2025-04-24 21:49:06.728365,2025-04-24 21:49:10.809353,0 days 00:00:04.080988,0.055763594371539896,8,sqrt,2,16,1483,0.706799835874805,TPESampler,COMPLETE
740,0.24513233776021712,2025-04-24 21:49:07.291347,2025-04-24 21:49:11.057641,0 days 00:00:03.766294,0.08783122740822012,6,sqrt,1,6,1454,0.6023249143693142,TPESampler,COMPLETE
