number,value,datetime_start,datetime_complete,duration,params_learning_rate,params_max_depth,params_max_features,params_min_samples_leaf,params_min_samples_split,params_n_estimators,params_subsample,system_attrs_auto:sampler,state
1235,0.35690448927111307,2025-04-24 21:59:02.335987,2025-04-24 21:59:06.827503,0 days 00:00:04.491516,0.010766627452208164,9,,5,19,839,0.7566588336605747,TPESampler,COMPLETE
1236,0.2939611353316082,2025-04-24 21:59:02.618070,2025-04-24 21:59:05.669796,0 days 00:00:03.051726,0.09589302010947554,4,sqrt,1,18,1457,0.7453149731721305,TPESampler,COMPLETE
1237,0.3151545226538079,2025-04-24 21:59:03.535310,2025-04-24 21:59:06.346065,0 days 00:00:02.810755,0.09189685344837079,5,sqrt,1,18,1181,0.674129921901407,TPESampler,COMPLETE
1238,0.28637072883062975,2025-04-24 21:59:05.865829,2025-04-24 21:59:08.863911,0 days 00:00:02.998082,0.0979461335258467,6,sqrt,2,12,1091,0.7518846220282664,TPESampler,COMPLETE
1239,0.9283903638368283,2025-04-24 21:59:06.600096,2025-04-24 21:59:07.684665,0 days 00:00:01.084569,0.06408380767342099,11,log2,4,14,162,0.8032181848820283,TPESampler,COMPLETE
1240,0.2926457000256838,2025-04-24 21:59:07.070222,2025-04-24 21:59:10.036917,0 days 00:00:02.966695,0.08206417995834953,3,sqrt,3,18,938,0.7272904523457331,TPESampler,COMPLETE
1241,0.2704910602666012,2025-04-24 21:59:07.917245,2025-04-24 21:59:11.508949,0 days 00:00:03.591704,0.09573662376413934,4,sqrt,3,16,1308,0.7822789837473421,TPESampler,COMPLETE
1242,0.23058847018512268,2025-04-24 21:59:09.071580,2025-04-24 21:59:12.438906,0 days 00:00:03.367326,0.0859808587645733,5,sqrt,1,20,1095,0.6947533293621373,TPESampler,COMPLETE
1243,0.29583867723935664,2025-04-24 21:59:10.249995,2025-04-24 21:59:13.700720,0 days 00:00:03.450725,0.08755080696652728,7,log2,2,18,1495,0.6389182131670228,TPESampler,COMPLETE
1244,0.36252394213114436,2025-04-24 21:59:11.723784,2025-04-24 21:59:15.589951,0 days 00:00:03.866167,0.037101007567120446,3,,7,18,1123,0.6958043839118003,TPESampler,COMPLETE
1245,0.2839368977755197,2025-04-24 21:59:12.637740,2025-04-24 21:59:15.669615,0 days 00:00:03.031875,0.05253786927762378,4,sqrt,2,20,1460,0.8655134615353421,TPESampler,COMPLETE
1246,0.28895482861901534,2025-04-24 21:59:13.993826,2025-04-24 21:59:19.473210,0 days 00:00:05.479384,0.05455717886900615,10,,1,20,1067,0.6496253884589155,TPESampler,COMPLETE
1247,1.1359438276683076,2025-04-24 21:59:15.760659,2025-04-24 21:59:16.937645,0 days 00:00:01.176986,0.028138877550548683,12,log2,7,18,304,0.6841940040418575,TPESampler,COMPLETE
1248,0.5585762215148782,2025-04-24 21:59:15.884839,2025-04-24 21:59:17.597450,0 days 00:00:01.712611,0.05863837619880873,4,sqrt,10,18,563,0.6241284380847136,TPESampler,COMPLETE
1249,0.8813208727456433,2025-04-24 21:59:17.137251,2025-04-24 21:59:19.716898,0 days 00:00:02.579647,0.02396887243772582,6,log2,10,5,1264,0.6446160624642245,TPESampler,COMPLETE
1250,0.2842791531908028,2025-04-24 21:59:17.842035,2025-04-24 21:59:20.515880,0 days 00:00:02.673845,0.07725249331656828,4,sqrt,2,19,1152,0.6512647789872574,TPESampler,COMPLETE
1251,0.5006607452330787,2025-04-24 21:59:19.778365,2025-04-24 21:59:21.562559,0 days 00:00:01.784194,0.06688785450325659,3,sqrt,10,3,534,0.9757360758028509,TPESampler,COMPLETE
1252,0.2882591836389053,2025-04-24 21:59:19.975490,2025-04-24 21:59:22.619649,0 days 00:00:02.644159,0.07860121647020447,3,sqrt,2,12,960,0.821128340433772,TPESampler,COMPLETE
1253,1.1123468337541709,2025-04-24 21:59:20.829717,2025-04-24 21:59:22.037706,0 days 00:00:01.207989,0.02038609162879922,5,log2,4,9,194,0.8547061462008497,TPESampler,COMPLETE
1254,0.255929114070502,2025-04-24 21:59:21.751126,2025-04-24 21:59:24.496882,0 days 00:00:02.745756,0.09387948731120392,6,sqrt,1,20,1181,0.6403250783267159,TPESampler,COMPLETE
1255,0.3427378137194394,2025-04-24 21:59:22.250092,2025-04-24 21:59:29.004979,0 days 00:00:06.754887,0.010992809635739243,5,,6,4,1476,0.9182187157429458,TPESampler,COMPLETE
1256,0.36170532468020006,2025-04-24 21:59:22.803013,2025-04-24 21:59:25.415229,0 days 00:00:02.612216,0.05411114406651746,3,log2,2,15,1152,0.8365411067517696,TPESampler,COMPLETE
1257,0.2718419735101999,2025-04-24 21:59:24.699020,2025-04-24 21:59:27.754131,0 days 00:00:03.055111,0.05330367995357751,4,sqrt,1,16,1285,0.7842905713034898,TPESampler,COMPLETE
1258,0.3113161160419672,2025-04-24 21:59:25.803034,2025-04-24 21:59:29.086190,0 days 00:00:03.283156,0.09932834357526932,6,sqrt,4,15,1377,0.7215071820458642,TPESampler,COMPLETE
1259,0.27912046763422155,2025-04-24 21:59:27.962765,2025-04-24 21:59:30.765293,0 days 00:00:02.802528,0.07685262452480014,4,sqrt,2,16,1154,0.7727794227982,TPESampler,COMPLETE
1260,0.9704712484832727,2025-04-24 21:59:29.163859,2025-04-24 21:59:32.733926,0 days 00:00:03.570067,0.014967440387011467,3,log2,8,18,1339,0.6726437502453126,TPESampler,COMPLETE
1261,0.25029126049393713,2025-04-24 21:59:29.290880,2025-04-24 21:59:33.423621,0 days 00:00:04.132741,0.09756584186250523,5,sqrt,1,4,1351,0.6703549276139467,TPESampler,COMPLETE
1262,0.2601062479715284,2025-04-24 21:59:30.982161,2025-04-24 21:59:34.315501,0 days 00:00:03.333340,0.07701742161992577,4,sqrt,1,16,1231,0.7443616030381196,TPESampler,COMPLETE
1263,0.40020831993294204,2025-04-24 21:59:32.930610,2025-04-24 21:59:34.033073,0 days 00:00:01.102463,0.09710272205056547,9,sqrt,1,8,131,0.6689299219485855,TPESampler,COMPLETE
1264,0.2698074636461128,2025-04-24 21:59:33.630535,2025-04-24 21:59:36.469780,0 days 00:00:02.839245,0.08631256778469072,5,sqrt,1,18,1150,0.7126218686359553,TPESampler,COMPLETE
1265,0.37588133861436573,2025-04-24 21:59:34.244467,2025-04-24 21:59:41.443943,0 days 00:00:07.199476,0.024193187256134747,11,,7,11,1436,0.7064896318127089,TPESampler,COMPLETE
1266,0.26660935180841316,2025-04-24 21:59:34.568853,2025-04-24 21:59:37.222134,0 days 00:00:02.653281,0.09669708345852072,5,sqrt,1,20,1110,0.6602087111682654,TPESampler,COMPLETE
1267,0.24106959588597215,2025-04-24 21:59:36.712691,2025-04-24 21:59:38.841405,0 days 00:00:02.128714,0.08764559905172448,7,sqrt,1,17,764,0.7163007003800742,TPESampler,COMPLETE
1268,0.26468567177575275,2025-04-24 21:59:37.434652,2025-04-24 21:59:39.857474,0 days 00:00:02.422822,0.09301534378100729,8,sqrt,1,19,1135,0.6176132915290257,TPESampler,COMPLETE
1269,0.27919728285530143,2025-04-24 21:59:39.045190,2025-04-24 21:59:41.306927,0 days 00:00:02.261737,0.06935444953947707,4,sqrt,1,20,988,0.6753877045251838,TPESampler,COMPLETE
1270,0.38949966952697057,2025-04-24 21:59:40.068666,2025-04-24 21:59:43.061719,0 days 00:00:02.993053,0.010005656020785337,6,,1,13,550,0.9362869648259373,TPESampler,COMPLETE
1271,0.3605960312594755,2025-04-24 21:59:41.503556,2025-04-24 21:59:44.548732,0 days 00:00:03.045176,0.09343654034989342,4,log2,1,15,1265,0.6407805831510142,TPESampler,COMPLETE
1272,0.27974884726113874,2025-04-24 21:59:41.702120,2025-04-24 21:59:44.895348,0 days 00:00:03.193228,0.07780756419132905,5,sqrt,2,14,1171,0.7747421356346411,TPESampler,COMPLETE
1273,0.24061442558274895,2025-04-24 21:59:43.269071,2025-04-24 21:59:46.868396,0 days 00:00:03.599325,0.09786230558150391,7,sqrt,1,19,1259,0.6917505961837582,TPESampler,COMPLETE
1274,0.30312416269559617,2025-04-24 21:59:44.761721,2025-04-24 21:59:48.792344,0 days 00:00:04.030623,0.08683664820377708,5,sqrt,2,18,1481,0.8274488623741076,TPESampler,COMPLETE
1275,0.27266889960396223,2025-04-24 21:59:45.108393,2025-04-24 21:59:48.361713,0 days 00:00:03.253320,0.08620717724470489,4,sqrt,1,12,1109,0.8062338212412532,TPESampler,COMPLETE
1276,0.817495240468772,2025-04-24 21:59:47.077508,2025-04-24 21:59:49.245792,0 days 00:00:02.168284,0.06250303544844267,6,log2,7,2,648,0.6904497397630031,TPESampler,COMPLETE
1277,0.28261565595362154,2025-04-24 21:59:48.567829,2025-04-24 21:59:52.289584,0 days 00:00:03.721755,0.06789919826985641,4,sqrt,1,15,1493,0.7614611827194472,TPESampler,COMPLETE
1278,0.2705656190427734,2025-04-24 21:59:49.030736,2025-04-24 21:59:52.333987,0 days 00:00:03.303251,0.05858373503173847,8,log2,1,20,1245,0.6549816267317078,TPESampler,COMPLETE
1279,0.7629679539815872,2025-04-24 21:59:49.538610,2025-04-24 21:59:50.734646,0 days 00:00:01.196036,0.04639628747582327,12,sqrt,8,17,174,0.6265937150424588,TPESampler,COMPLETE
1280,0.26795629418798667,2025-04-24 21:59:50.956709,2025-04-24 21:59:53.779818,0 days 00:00:02.823109,0.05353107284367662,5,sqrt,1,20,1031,0.6904076633487736,TPESampler,COMPLETE
1281,0.2633447334484958,2025-04-24 21:59:52.456353,2025-04-24 21:59:55.093940,0 days 00:00:02.637587,0.09896468704685502,3,sqrt,1,18,928,0.7494445522485473,TPESampler,COMPLETE
1282,0.26396889387266775,2025-04-24 21:59:52.491709,2025-04-24 21:59:56.703608,0 days 00:00:04.211899,0.09248597518575455,6,sqrt,1,8,1464,0.6207341795195053,TPESampler,COMPLETE
1283,0.3113484848536036,2025-04-24 21:59:54.000326,2025-04-24 21:59:56.853877,0 days 00:00:02.853551,0.07085497639473143,5,sqrt,2,18,974,0.7070156706132001,TPESampler,COMPLETE
1284,0.33698357858140526,2025-04-24 21:59:55.303943,2025-04-24 21:59:58.578570,0 days 00:00:03.274627,0.06414114202067406,7,sqrt,4,20,1240,0.6007110130556423,TPESampler,COMPLETE
1285,0.43056487063675614,2025-04-24 21:59:56.905892,2025-04-24 21:59:58.755362,0 days 00:00:01.849470,0.02114766686902368,12,sqrt,7,13,662,0.9889410670199419,TPESampler,COMPLETE
1286,1.2320137970632652,2025-04-24 21:59:57.084539,2025-04-24 21:59:58.641587,0 days 00:00:01.557048,0.012143768033752585,3,log2,7,3,430,0.6557396074763899,TPESampler,COMPLETE
1287,0.27898904850211187,2025-04-24 21:59:58.703146,2025-04-24 22:00:01.638042,0 days 00:00:02.934896,0.08365383867385477,8,sqrt,3,20,1325,0.6667374029436692,TPESampler,COMPLETE
1288,0.27144347929411844,2025-04-24 21:59:58.831199,2025-04-24 22:00:05.189528,0 days 00:00:06.358329,0.0952054842346931,11,,1,17,1191,0.665591109376418,TPESampler,COMPLETE
1289,0.3844007310332356,2025-04-24 21:59:58.996029,2025-04-24 22:00:01.162607,0 days 00:00:02.166578,0.04906833359446988,4,log2,2,18,669,0.7541740375025376,TPESampler,COMPLETE
1290,0.2886320917511769,2025-04-24 22:00:01.475931,2025-04-24 22:00:04.037206,0 days 00:00:02.561275,0.07151702623348359,6,sqrt,2,20,939,0.7071858260617604,TPESampler,COMPLETE
1291,0.5172256796456807,2025-04-24 22:00:01.936935,2025-04-24 22:00:04.121024,0 days 00:00:02.184089,0.010051883951585424,8,sqrt,1,15,634,0.8587129898238635,TPESampler,COMPLETE
1292,0.2537837289717521,2025-04-24 22:00:04.197000,2025-04-24 22:00:07.655183,0 days 00:00:03.458183,0.07397311535858875,6,sqrt,1,20,1487,0.7543529655111569,TPESampler,COMPLETE
1293,0.2902028847406881,2025-04-24 22:00:04.319801,2025-04-24 22:00:07.555595,0 days 00:00:03.235794,0.055067962820353464,9,sqrt,1,19,1169,0.6014923173218939,TPESampler,COMPLETE
1294,0.27532863357967424,2025-04-24 22:00:05.360778,2025-04-24 22:00:08.465056,0 days 00:00:03.104278,0.09479743247596951,8,sqrt,1,15,1279,0.6684689999488742,TPESampler,COMPLETE
1295,0.2941692371023856,2025-04-24 22:00:07.718739,2025-04-24 22:00:09.923593,0 days 00:00:02.204854,0.09944670455199253,6,sqrt,2,16,995,0.6286932684435705,TPESampler,COMPLETE
1296,0.2893355373339419,2025-04-24 22:00:07.849054,2025-04-24 22:00:13.637016,0 days 00:00:05.787962,0.02106893576462056,8,,1,20,1383,0.6888246406217067,TPESampler,COMPLETE
1297,0.3758742184685351,2025-04-24 22:00:08.762721,2025-04-24 22:00:15.024560,0 days 00:00:06.261839,0.09812930572392786,12,,2,7,966,0.9254194773810455,TPESampler,COMPLETE
1298,0.289011384557494,2025-04-24 22:00:10.104869,2025-04-24 22:00:12.648408,0 days 00:00:02.543539,0.08397208812211641,5,log2,1,16,1422,0.7863676874997163,TPESampler,COMPLETE
1299,0.2389786584191292,2025-04-24 22:00:12.987657,2025-04-24 22:00:16.267274,0 days 00:00:03.279617,0.09906119026263956,8,sqrt,1,13,1397,0.6670409098631405,TPESampler,COMPLETE
1300,0.30177762245312373,2025-04-24 22:00:13.900483,2025-04-24 22:00:17.111596,0 days 00:00:03.211113,0.06468459362168665,5,sqrt,2,15,1079,0.9021585111436999,TPESampler,COMPLETE
1301,0.29318808802692725,2025-04-24 22:00:15.227951,2025-04-24 22:00:18.761917,0 days 00:00:03.533966,0.07653327585384433,6,sqrt,3,14,1277,0.60357506370933,TPESampler,COMPLETE
1302,0.2568783140444791,2025-04-24 22:00:16.474631,2025-04-24 22:00:20.157809,0 days 00:00:03.683178,0.05734010419901144,5,sqrt,1,19,1211,0.7465051090158494,TPESampler,COMPLETE
1303,0.7875727427425372,2025-04-24 22:00:17.334299,2025-04-24 22:00:19.491977,0 days 00:00:02.157678,0.04558555676497337,12,log2,10,5,673,0.9970974363791449,TPESampler,COMPLETE
1304,0.24807924810508672,2025-04-24 22:00:19.010022,2025-04-24 22:00:21.534214,0 days 00:00:02.524192,0.060351000574870015,7,sqrt,1,20,1076,0.6637038570705376,TPESampler,COMPLETE
1305,0.2692806451861312,2025-04-24 22:00:19.698122,2025-04-24 22:00:23.406146,0 days 00:00:03.708024,0.06334407972924247,5,sqrt,1,17,1286,0.6060841450241479,TPESampler,COMPLETE
1306,0.24137302340277375,2025-04-24 22:00:20.529351,2025-04-24 22:00:23.499929,0 days 00:00:02.970578,0.08028513043573075,8,sqrt,1,16,962,0.6004149616711352,TPESampler,COMPLETE
1307,0.3096583516807744,2025-04-24 22:00:21.740015,2025-04-24 22:00:24.378618,0 days 00:00:02.638603,0.09950248577339228,3,sqrt,3,4,1010,0.7243216132484119,TPESampler,COMPLETE
1308,0.30449229198914995,2025-04-24 22:00:23.577386,2025-04-24 22:00:27.536458,0 days 00:00:03.959072,0.08626281911839928,5,sqrt,1,12,1372,0.7840742518763969,TPESampler,COMPLETE
1309,0.3029454251392384,2025-04-24 22:00:23.693469,2025-04-24 22:00:27.772768,0 days 00:00:04.079299,0.0947726387056199,6,sqrt,1,20,1314,0.6558959039429634,TPESampler,COMPLETE
1310,0.31299722968420396,2025-04-24 22:00:24.637629,2025-04-24 22:00:28.828775,0 days 00:00:04.191146,0.09973456176413863,10,sqrt,2,16,1398,0.6644485670705716,TPESampler,COMPLETE
1311,0.3750559389618779,2025-04-24 22:00:27.729568,2025-04-24 22:00:30.070065,0 days 00:00:02.340497,0.014618439793090578,6,sqrt,4,6,827,0.9366196221321967,TPESampler,COMPLETE
1312,0.2852630473224749,2025-04-24 22:00:28.022564,2025-04-24 22:00:31.561266,0 days 00:00:03.538702,0.09909856915535321,5,sqrt,2,13,1299,0.7171270762256877,TPESampler,COMPLETE
1313,0.3096631172471237,2025-04-24 22:00:29.034365,2025-04-24 22:00:32.075161,0 days 00:00:03.040796,0.08069880645087409,10,sqrt,3,20,1068,0.7008808151728187,TPESampler,COMPLETE
1314,0.6685666702232556,2025-04-24 22:00:30.275485,2025-04-24 22:00:31.604347,0 days 00:00:01.328862,0.013428128903733022,12,,10,19,133,0.6122550147110598,TPESampler,COMPLETE
1315,0.3491257324526667,2025-04-24 22:00:31.710557,2025-04-24 22:00:36.027960,0 days 00:00:04.317403,0.07060701071894374,6,,4,20,979,0.6135637340803627,TPESampler,COMPLETE
1316,0.2555385999228435,2025-04-24 22:00:31.752384,2025-04-24 22:00:35.137519,0 days 00:00:03.385135,0.05554553525586232,4,sqrt,1,13,1278,0.7983562896623779,TPESampler,COMPLETE
1317,0.3031490950867629,2025-04-24 22:00:32.381292,2025-04-24 22:00:35.934314,0 days 00:00:03.553022,0.07642836200998412,6,sqrt,3,8,1427,0.6558968840990621,TPESampler,COMPLETE
1318,0.28358254578184566,2025-04-24 22:00:35.333158,2025-04-24 22:00:39.072532,0 days 00:00:03.739374,0.09332195399344007,7,sqrt,2,13,1476,0.6024077396511958,TPESampler,COMPLETE
1319,0.27542154190255624,2025-04-24 22:00:36.139384,2025-04-24 22:00:39.960306,0 days 00:00:03.820922,0.08782683232064548,5,sqrt,2,16,1498,0.6134279342722109,TPESampler,COMPLETE
1320,0.2897497196773968,2025-04-24 22:00:36.255582,2025-04-24 22:00:39.373876,0 days 00:00:03.118294,0.07572630117385366,9,log2,1,15,1039,0.7672884882101546,TPESampler,COMPLETE
1321,0.2458752840889766,2025-04-24 22:00:39.245537,2025-04-24 22:00:41.796972,0 days 00:00:02.551435,0.09296083362532345,3,sqrt,1,12,1244,0.783370775522813,TPESampler,COMPLETE
1322,0.28337391962941644,2025-04-24 22:00:39.563728,2025-04-24 22:00:45.641104,0 days 00:00:06.077376,0.09793350576555265,6,,1,19,1445,0.6567646642708351,TPESampler,COMPLETE
1323,0.2637524379606299,2025-04-24 22:00:40.156913,2025-04-24 22:00:42.708885,0 days 00:00:02.551972,0.0915081558438188,6,sqrt,1,20,930,0.7327635600197304,TPESampler,COMPLETE
1324,0.2563706143399721,2025-04-24 22:00:41.996355,2025-04-24 22:00:44.937852,0 days 00:00:02.941497,0.09176199881751324,7,sqrt,1,11,1262,0.65157676275421,TPESampler,COMPLETE
1325,0.3644654587090008,2025-04-24 22:00:42.919064,2025-04-24 22:00:44.882770,0 days 00:00:01.963706,0.0997781388541411,11,sqrt,4,8,624,0.882198221652662,TPESampler,COMPLETE
1326,0.3085738688356429,2025-04-24 22:00:45.030425,2025-04-24 22:00:47.696256,0 days 00:00:02.665831,0.09967757391894047,3,sqrt,4,13,1175,0.7427604844936719,TPESampler,COMPLETE
1327,0.3313661679579283,2025-04-24 22:00:45.154877,2025-04-24 22:00:51.646772,0 days 00:00:06.491895,0.09919507600624648,8,,3,18,1277,0.7080216899776174,TPESampler,COMPLETE
1328,0.24665645034771608,2025-04-24 22:00:45.866848,2025-04-24 22:00:49.070808,0 days 00:00:03.203960,0.06964314006102483,6,sqrt,1,20,1343,0.6039401870726787,TPESampler,COMPLETE
1329,0.2912112970522749,2025-04-24 22:00:47.887022,2025-04-24 22:00:50.079970,0 days 00:00:02.192948,0.09750931064705128,4,log2,1,14,1066,0.8161893728924394,TPESampler,COMPLETE
1330,0.338841998933061,2025-04-24 22:00:49.265131,2025-04-24 22:00:50.935803,0 days 00:00:01.670672,0.06460522205506572,6,log2,2,8,610,0.9724900080754527,TPESampler,COMPLETE
1331,0.5889745225831597,2025-04-24 22:00:50.270642,2025-04-24 22:00:51.280615,0 days 00:00:01.009973,0.08911430479359142,6,log2,1,17,220,0.76793962146118,TPESampler,COMPLETE
1332,0.3176796598367201,2025-04-24 22:00:51.164672,2025-04-24 22:00:54.392667,0 days 00:00:03.227995,0.09598904399586729,3,sqrt,4,20,1135,0.7091245406456703,TPESampler,COMPLETE
1333,0.26960486275103257,2025-04-24 22:00:51.544338,2025-04-24 22:00:54.731776,0 days 00:00:03.187438,0.09583975070520012,5,sqrt,1,15,1002,0.7995290176514561,TPESampler,COMPLETE
1334,0.2873128137645892,2025-04-24 22:00:51.981400,2025-04-24 22:00:56.301392,0 days 00:00:04.319992,0.09707635624634968,7,sqrt,1,17,1476,0.6247171717727036,TPESampler,COMPLETE
1335,0.2684852082785346,2025-04-24 22:00:54.595264,2025-04-24 22:00:58.300863,0 days 00:00:03.705599,0.09010360272723264,5,sqrt,1,14,1301,0.6190851839862361,TPESampler,COMPLETE
1336,0.28971372192863376,2025-04-24 22:00:54.950193,2025-04-24 22:00:58.605544,0 days 00:00:03.655351,0.0900551518273245,8,sqrt,1,15,1193,0.6001447636950636,TPESampler,COMPLETE
1337,0.2872211556125188,2025-04-24 22:00:56.509642,2025-04-24 22:00:59.853788,0 days 00:00:03.344146,0.07876575967650105,3,sqrt,3,15,1441,0.8353340529938627,TPESampler,COMPLETE
1338,0.3401806253152519,2025-04-24 22:00:58.474656,2025-04-24 22:01:01.867510,0 days 00:00:03.392854,0.09004663210274315,9,sqrt,1,16,1263,0.6596163803605108,TPESampler,COMPLETE
1339,0.26306714445511803,2025-04-24 22:00:58.784868,2025-04-24 22:01:02.143950,0 days 00:00:03.359082,0.05038020782367602,8,sqrt,1,19,1385,0.6112098949792226,TPESampler,COMPLETE
1340,0.4521209608040929,2025-04-24 22:01:00.044659,2025-04-24 22:01:06.263970,0 days 00:00:06.219311,0.025759449251345733,11,,10,6,1021,0.9594653502264446,TPESampler,COMPLETE
1341,0.2714082220851359,2025-04-24 22:01:02.098065,2025-04-24 22:01:04.759000,0 days 00:00:02.660935,0.06552774920390426,3,sqrt,1,16,1157,0.7230279510559044,TPESampler,COMPLETE
1342,0.30110407159616015,2025-04-24 22:01:02.423948,2025-04-24 22:01:04.754936,0 days 00:00:02.330988,0.09390813583690796,6,sqrt,1,19,786,0.6404105541296335,TPESampler,COMPLETE
1343,0.36404878237803234,2025-04-24 22:01:04.931806,2025-04-24 22:01:06.883212,0 days 00:00:01.951406,0.015497036834164504,10,,5,3,228,0.8735321884677312,TPESampler,COMPLETE
1344,0.2973630798032726,2025-04-24 22:01:04.981708,2025-04-24 22:01:07.859752,0 days 00:00:02.878044,0.07996994200596257,8,sqrt,2,8,1171,0.6064674103238875,TPESampler,COMPLETE
1345,0.3214755309103345,2025-04-24 22:01:06.457621,2025-04-24 22:01:10.257737,0 days 00:00:03.800116,0.09369509979746457,6,sqrt,4,20,1375,0.6445802134581041,TPESampler,COMPLETE
1346,0.2748484497241932,2025-04-24 22:01:07.101024,2025-04-24 22:01:10.583858,0 days 00:00:03.482834,0.08443219292404959,5,sqrt,1,14,1174,0.6059785690787192,TPESampler,COMPLETE
1347,0.2574654020542818,2025-04-24 22:01:08.082732,2025-04-24 22:01:11.716324,0 days 00:00:03.633592,0.09256595053021519,5,sqrt,1,14,1349,0.7724179288458551,TPESampler,COMPLETE
1348,0.3340321425379933,2025-04-24 22:01:10.457163,2025-04-24 22:01:17.317564,0 days 00:00:06.860401,0.09683692688219242,8,,1,8,1456,0.7085709384514068,TPESampler,COMPLETE
1349,0.2744705073158666,2025-04-24 22:01:10.821434,2025-04-24 22:01:13.750793,0 days 00:00:02.929359,0.08637118061078296,6,sqrt,1,19,1472,0.6720772882500704,TPESampler,COMPLETE
1350,0.2706753071943522,2025-04-24 22:01:11.919717,2025-04-24 22:01:14.694033,0 days 00:00:02.774316,0.057777256735330275,6,sqrt,1,15,1056,0.6730909080075423,TPESampler,COMPLETE
1351,0.3056648679430094,2025-04-24 22:01:13.948375,2025-04-24 22:01:16.480517,0 days 00:00:02.532142,0.09486386479007704,5,sqrt,2,20,1247,0.7046028311621036,TPESampler,COMPLETE
1352,0.2707939179374063,2025-04-24 22:01:15.005748,2025-04-24 22:01:17.976206,0 days 00:00:02.970458,0.09680713269521905,4,sqrt,1,20,1212,0.7039281024346402,TPESampler,COMPLETE
1353,0.27089087154857755,2025-04-24 22:01:16.672182,2025-04-24 22:01:20.600240,0 days 00:00:03.928058,0.0839052694100766,5,sqrt,2,17,1492,0.6003545738583628,TPESampler,COMPLETE
1354,0.5861339266627451,2025-04-24 22:01:17.543429,2025-04-24 22:01:20.564109,0 days 00:00:03.020680,0.02431506006339826,8,log2,3,17,968,0.8472992721494209,TPESampler,COMPLETE
1355,0.2544976014343843,2025-04-24 22:01:18.188169,2025-04-24 22:01:21.807311,0 days 00:00:03.619142,0.05651746763168488,6,sqrt,1,16,1487,0.7275602301211513,TPESampler,COMPLETE
1356,0.2752494452972078,2025-04-24 22:01:20.764259,2025-04-24 22:01:24.597843,0 days 00:00:03.833584,0.062164787303446385,9,sqrt,1,20,1280,0.7085310757260574,TPESampler,COMPLETE
1357,0.5804718205851453,2025-04-24 22:01:20.813382,2025-04-24 22:01:24.669754,0 days 00:00:03.856372,0.010932964623381192,9,sqrt,9,16,1380,0.8061855647041053,TPESampler,COMPLETE
