number,value,datetime_start,datetime_complete,duration,params_learning_rate,params_max_depth,params_max_features,params_min_samples_leaf,params_min_samples_split,params_n_estimators,params_subsample,system_attrs_auto:sampler,state
1727,0.3125289838486907,2025-04-24 22:08:49.179430,2025-04-24 22:08:53.723272,0 days 00:00:04.543842,0.09762450169664606,6,sqrt,3,14,1483,0.6908123758070372,TPESampler,COMPLETE
1728,0.2582081186236165,2025-04-24 22:08:53.509111,2025-04-24 22:08:57.585772,0 days 00:00:04.076661,0.07630312523425298,11,sqrt,1,17,1497,0.6748191444722864,TPESampler,COMPLETE
1729,0.3098972873376643,2025-04-24 22:08:53.856534,2025-04-24 22:08:56.644422,0 days 00:00:02.787888,0.03256425129949708,10,sqrt,4,4,751,0.8934143740129874,TPESampler,COMPLETE
1730,0.30191138956807684,2025-04-24 22:08:53.937410,2025-04-24 22:08:56.743412,0 days 00:00:02.806002,0.08011091032722974,5,sqrt,3,15,790,0.7294538903875655,TPESampler,COMPLETE
1731,0.354639707073958,2025-04-24 22:08:56.784760,2025-04-24 22:08:59.104347,0 days 00:00:02.319587,0.04477004727166549,5,log2,1,4,954,0.8551729907770578,TPESampler,COMPLETE
1732,0.32884630203201143,2025-04-24 22:08:56.912097,2025-04-24 22:09:00.761930,0 days 00:00:03.849833,0.099219404688738,9,sqrt,2,20,1270,0.6968235282633986,TPESampler,COMPLETE
1733,0.2670566299606057,2025-04-24 22:08:57.800077,2025-04-24 22:09:02.192759,0 days 00:00:04.392682,0.0998706085158062,7,sqrt,1,14,1488,0.6505294440389177,TPESampler,COMPLETE
1734,0.28566309027822634,2025-04-24 22:08:59.357362,2025-04-24 22:09:03.828505,0 days 00:00:04.471143,0.08763469699368455,8,sqrt,3,13,1490,0.6134386913073859,TPESampler,COMPLETE
1735,0.28109459983199403,2025-04-24 22:09:00.974122,2025-04-24 22:09:04.640936,0 days 00:00:03.666814,0.05425878613218793,8,sqrt,3,14,1188,0.6242591547887035,TPESampler,COMPLETE
1736,0.24828310519310437,2025-04-24 22:09:02.393715,2025-04-24 22:09:06.500756,0 days 00:00:04.107041,0.06380425772771361,9,sqrt,1,18,1424,0.7491263351601141,TPESampler,COMPLETE
1737,0.3196785598874282,2025-04-24 22:09:04.039764,2025-04-24 22:09:07.539470,0 days 00:00:03.499706,0.09694852948555087,7,sqrt,4,12,1211,0.6817003670228734,TPESampler,COMPLETE
1738,0.3003637365628902,2025-04-24 22:09:04.847185,2025-04-24 22:09:08.832890,0 days 00:00:03.985705,0.06962229247972604,7,sqrt,3,16,1382,0.6471208298388965,TPESampler,COMPLETE
1739,0.3532577180699948,2025-04-24 22:09:06.668205,2025-04-24 22:09:09.886444,0 days 00:00:03.218239,0.022694878695334052,3,sqrt,3,11,1090,0.7621355451952155,TPESampler,COMPLETE
1740,0.23769852367266367,2025-04-24 22:09:07.746234,2025-04-24 22:09:11.432727,0 days 00:00:03.686493,0.09702022060506209,7,sqrt,1,16,1363,0.6431158855402538,TPESampler,COMPLETE
1741,0.3575651013632109,2025-04-24 22:09:09.057397,2025-04-24 22:09:11.540375,0 days 00:00:02.482978,0.040713128170218146,5,log2,1,12,1158,0.6464665238871692,TPESampler,COMPLETE
1742,0.34219420003023354,2025-04-24 22:09:10.129188,2025-04-24 22:09:15.267493,0 days 00:00:05.138305,0.014449484152558038,12,,5,6,925,0.7652585127012335,TPESampler,COMPLETE
1743,0.32148470507120275,2025-04-24 22:09:11.638935,2025-04-24 22:09:13.515681,0 days 00:00:01.876746,0.09852875061741413,10,log2,3,3,553,0.8047558693256633,TPESampler,COMPLETE
1744,0.23685214200438726,2025-04-24 22:09:11.780023,2025-04-24 22:09:15.536677,0 days 00:00:03.756654,0.09377618942185047,7,sqrt,1,16,1352,0.6008617129218434,TPESampler,COMPLETE
1745,0.2969407130332472,2025-04-24 22:09:13.747780,2025-04-24 22:09:17.724601,0 days 00:00:03.976821,0.056764368187902065,6,sqrt,2,18,1489,0.700039626818721,TPESampler,COMPLETE
1746,0.27828888381402866,2025-04-24 22:09:15.493837,2025-04-24 22:09:18.911191,0 days 00:00:03.417354,0.09737160790842432,7,sqrt,1,17,1217,0.6606436694883284,TPESampler,COMPLETE
1747,0.2840932275683961,2025-04-24 22:09:15.817865,2025-04-24 22:09:18.933945,0 days 00:00:03.116080,0.0910711786230353,7,sqrt,3,20,1022,0.6985336002019412,TPESampler,COMPLETE
1748,0.24392083816194632,2025-04-24 22:09:17.931173,2025-04-24 22:09:20.721223,0 days 00:00:02.790050,0.08291007624097167,5,sqrt,1,10,1292,0.6240412019746744,TPESampler,COMPLETE
1749,0.31527272371371806,2025-04-24 22:09:19.056051,2025-04-24 22:09:23.161618,0 days 00:00:04.105567,0.07915422535267091,5,sqrt,3,17,1268,0.6039384171891728,TPESampler,COMPLETE
1750,0.3167628572965753,2025-04-24 22:09:19.103766,2025-04-24 22:09:21.783657,0 days 00:00:02.679891,0.043934533351973476,12,sqrt,2,11,619,0.9630902819968556,TPESampler,COMPLETE
1751,0.28277939456849466,2025-04-24 22:09:20.953248,2025-04-24 22:09:25.192049,0 days 00:00:04.238801,0.06976412371595513,5,sqrt,3,15,1489,0.6818983709638498,TPESampler,COMPLETE
1752,0.28870817953811806,2025-04-24 22:09:22.001232,2025-04-24 22:09:25.217920,0 days 00:00:03.216688,0.052852657691372186,4,sqrt,3,19,1137,0.762738124627699,TPESampler,COMPLETE
1753,0.4696806121442359,2025-04-24 22:09:23.373409,2025-04-24 22:09:25.964533,0 days 00:00:02.591124,0.09120054292366754,12,sqrt,10,18,1059,0.6912363037759829,TPESampler,COMPLETE
1754,0.3022333286704622,2025-04-24 22:09:25.337187,2025-04-24 22:09:29.177426,0 days 00:00:03.840239,0.06530220828549922,4,sqrt,1,15,1238,0.7964071801959905,TPESampler,COMPLETE
1755,0.44519786223212626,2025-04-24 22:09:25.373115,2025-04-24 22:09:27.247983,0 days 00:00:01.874868,0.0581209251112804,12,sqrt,8,13,331,0.928024484540641,TPESampler,COMPLETE
1756,0.27026928315739035,2025-04-24 22:09:26.197022,2025-04-24 22:09:29.475590,0 days 00:00:03.278568,0.05804607814590792,3,sqrt,1,4,1122,0.6067051697861079,TPESampler,COMPLETE
1757,0.28392233085708907,2025-04-24 22:09:27.457282,2025-04-24 22:09:30.564243,0 days 00:00:03.106961,0.07117445317718249,5,sqrt,1,17,1112,0.6220395849388142,TPESampler,COMPLETE
1758,0.28485419937623147,2025-04-24 22:09:29.350318,2025-04-24 22:09:31.959064,0 days 00:00:02.608746,0.06049751112221257,10,sqrt,1,11,868,0.6883447077717217,TPESampler,COMPLETE
1759,0.3044717338833527,2025-04-24 22:09:29.692394,2025-04-24 22:09:33.031588,0 days 00:00:03.339194,0.06974432773134479,5,sqrt,2,14,1298,0.6030975701025059,TPESampler,COMPLETE
1760,0.29299932595572964,2025-04-24 22:09:30.744249,2025-04-24 22:09:34.541017,0 days 00:00:03.796768,0.07679610867426019,7,sqrt,1,9,1388,0.6037886689997181,TPESampler,COMPLETE
1761,0.29926067950520846,2025-04-24 22:09:32.201003,2025-04-24 22:09:35.653091,0 days 00:00:03.452088,0.09495564405024931,4,sqrt,2,11,1106,0.7731169610129593,TPESampler,COMPLETE
1762,0.26757121854065735,2025-04-24 22:09:33.237557,2025-04-24 22:09:36.418621,0 days 00:00:03.181064,0.06890283970827753,5,sqrt,1,15,1010,0.7164850604126572,TPESampler,COMPLETE
1763,0.29732451002098614,2025-04-24 22:09:34.752420,2025-04-24 22:09:38.266858,0 days 00:00:03.514438,0.07524927610555185,8,sqrt,1,16,1291,0.6692332140336869,TPESampler,COMPLETE
1764,0.8827529734591892,2025-04-24 22:09:35.834798,2025-04-24 22:09:38.301419,0 days 00:00:02.466621,0.01165571374763632,3,log2,2,2,885,0.9224298674987714,TPESampler,COMPLETE
1765,0.4707992645971819,2025-04-24 22:09:36.694059,2025-04-24 22:09:41.635585,0 days 00:00:04.941526,0.011065929640728382,3,,10,16,1430,0.6429683471002746,TPESampler,COMPLETE
1766,0.2544410115746535,2025-04-24 22:09:38.427286,2025-04-24 22:09:42.197312,0 days 00:00:03.770026,0.0980642152056419,6,sqrt,1,19,1447,0.6027559071237067,TPESampler,COMPLETE
1767,0.29594695907511037,2025-04-24 22:09:38.457786,2025-04-24 22:09:40.661253,0 days 00:00:02.203467,0.08100161482120798,10,log2,2,12,637,0.9854707264817684,TPESampler,COMPLETE
1768,0.39400797348085637,2025-04-24 22:09:40.932197,2025-04-24 22:09:42.488979,0 days 00:00:01.556782,0.02225392596275342,5,,2,13,162,0.9283198507416615,TPESampler,COMPLETE
1769,0.29273998128210393,2025-04-24 22:09:41.855787,2025-04-24 22:09:45.949817,0 days 00:00:04.094030,0.06605437682254,7,sqrt,1,14,1403,0.6030880407891889,TPESampler,COMPLETE
1770,0.3422678630598557,2025-04-24 22:09:42.453510,2025-04-24 22:09:46.797784,0 days 00:00:04.344274,0.06571066455604618,10,sqrt,2,15,1474,0.6949505263949958,TPESampler,COMPLETE
1771,0.261409929158107,2025-04-24 22:09:42.731044,2025-04-24 22:09:46.589608,0 days 00:00:03.858564,0.06947297359031122,5,sqrt,1,16,1306,0.6812316985793843,TPESampler,COMPLETE
1772,0.30950218912432276,2025-04-24 22:09:46.128536,2025-04-24 22:09:49.729462,0 days 00:00:03.600926,0.09769844634270307,11,sqrt,2,12,1440,0.6327189529816813,TPESampler,COMPLETE
1773,0.8660224747373123,2025-04-24 22:09:46.912900,2025-04-24 22:09:49.594196,0 days 00:00:02.681296,0.017920246271777823,8,log2,7,12,1083,0.8364086862436725,TPESampler,COMPLETE
1774,0.30073766642890193,2025-04-24 22:09:47.066766,2025-04-24 22:09:50.743746,0 days 00:00:03.676980,0.04688307499158955,7,sqrt,1,20,1438,0.7446732023056516,TPESampler,COMPLETE
1775,0.22234260811318157,2025-04-24 22:09:49.746759,2025-04-24 22:09:52.532111,0 days 00:00:02.785352,0.07931057563261831,8,sqrt,1,20,1258,0.6709880375113492,TPESampler,COMPLETE
1776,0.35595813007211835,2025-04-24 22:09:49.944848,2025-04-24 22:09:55.395652,0 days 00:00:05.450804,0.04958283563502223,8,,2,14,1209,0.6142247529300653,TPESampler,COMPLETE
1777,1.0758903982569248,2025-04-24 22:09:50.953613,2025-04-24 22:09:52.434142,0 days 00:00:01.480529,0.014986943692996796,4,sqrt,10,13,323,0.7410411746859686,TPESampler,COMPLETE
1778,0.30656024756449696,2025-04-24 22:09:52.631744,2025-04-24 22:09:56.200993,0 days 00:00:03.569249,0.06855374917701829,7,sqrt,1,20,1174,0.689346077398091,TPESampler,COMPLETE
1779,0.2653200906682395,2025-04-24 22:09:52.766065,2025-04-24 22:09:56.202412,0 days 00:00:03.436347,0.08781639704415789,9,sqrt,1,20,1119,0.7786070256075207,TPESampler,COMPLETE
1780,0.3279295871390204,2025-04-24 22:09:55.610981,2025-04-24 22:09:59.000260,0 days 00:00:03.389279,0.05596488859157858,9,sqrt,4,19,1303,0.8170717840834475,TPESampler,COMPLETE
1781,0.5504842835478455,2025-04-24 22:09:56.421624,2025-04-24 22:09:58.096503,0 days 00:00:01.674879,0.01761038994549535,11,sqrt,5,8,322,0.9139332847512854,TPESampler,COMPLETE
1782,0.35350453918663355,2025-04-24 22:09:56.598283,2025-04-24 22:09:59.046225,0 days 00:00:02.447942,0.052901656394599705,7,,2,6,353,0.6086836851313855,TPESampler,COMPLETE
1783,0.29330720889451817,2025-04-24 22:09:58.312629,2025-04-24 22:10:01.339036,0 days 00:00:03.026407,0.059538582900417227,10,sqrt,1,18,1196,0.6601424809458536,TPESampler,COMPLETE
1784,0.30920985468788986,2025-04-24 22:09:59.180603,2025-04-24 22:10:02.800233,0 days 00:00:03.619630,0.08262875828271947,8,sqrt,2,20,1417,0.7079554899182972,TPESampler,COMPLETE
1785,0.2586575990181025,2025-04-24 22:09:59.228279,2025-04-24 22:10:03.349348,0 days 00:00:04.121069,0.08831292600387385,9,sqrt,1,17,1409,0.7586425586737576,TPESampler,COMPLETE
1786,0.9165213206955115,2025-04-24 22:10:01.510357,2025-04-24 22:10:02.520060,0 days 00:00:01.009703,0.08934970721737612,12,log2,7,17,171,0.6552339424482738,TPESampler,COMPLETE
1787,0.3026504966813083,2025-04-24 22:10:02.728468,2025-04-24 22:10:06.171145,0 days 00:00:03.442677,0.0695630589675233,8,sqrt,3,20,1254,0.6853662292845626,TPESampler,COMPLETE
1788,0.2708547316645008,2025-04-24 22:10:03.068895,2025-04-24 22:10:06.683613,0 days 00:00:03.614718,0.07352778109427226,9,sqrt,1,17,1103,0.7527350000968192,TPESampler,COMPLETE
1789,0.5721647485551312,2025-04-24 22:10:03.694931,2025-04-24 22:10:06.997771,0 days 00:00:03.302840,0.030359432474543816,9,log2,8,2,1464,0.9547434580253644,TPESampler,COMPLETE
1790,0.6328825150768876,2025-04-24 22:10:06.341333,2025-04-24 22:10:08.299034,0 days 00:00:01.957701,0.012508075158996735,11,log2,1,7,479,0.787117114053699,TPESampler,COMPLETE
1791,0.3185438030239191,2025-04-24 22:10:06.916937,2025-04-24 22:10:10.586385,0 days 00:00:03.669448,0.05562710648386241,8,sqrt,2,20,1184,0.6346624230507237,TPESampler,COMPLETE
1792,0.2824579787074175,2025-04-24 22:10:07.306763,2025-04-24 22:10:10.414567,0 days 00:00:03.107804,0.07587874688552455,3,sqrt,1,20,950,0.6120247602382111,TPESampler,COMPLETE
1793,0.23702300220585337,2025-04-24 22:10:08.507230,2025-04-24 22:10:12.687577,0 days 00:00:04.180347,0.09515512995344093,8,sqrt,1,20,1391,0.6369889860373673,TPESampler,COMPLETE
1794,0.2575514727972039,2025-04-24 22:10:10.595415,2025-04-24 22:10:14.116501,0 days 00:00:03.521086,0.09659470776021481,3,sqrt,1,8,1204,0.6927356088328215,TPESampler,COMPLETE
1795,0.3380868291640076,2025-04-24 22:10:10.840329,2025-04-24 22:10:14.658679,0 days 00:00:03.818350,0.044844814873044994,12,sqrt,5,19,1413,0.9733708367407642,TPESampler,COMPLETE
1796,0.35921013268931357,2025-04-24 22:10:12.910789,2025-04-24 22:10:19.114660,0 days 00:00:06.203871,0.08953176788284038,7,,5,4,1194,0.9965747763113955,TPESampler,COMPLETE
1797,0.3208053508488053,2025-04-24 22:10:14.406643,2025-04-24 22:10:16.754420,0 days 00:00:02.347777,0.09435885395526568,7,sqrt,2,20,1113,0.6399435151317177,TPESampler,COMPLETE
1798,0.36766923122578116,2025-04-24 22:10:14.917209,2025-04-24 22:10:19.751292,0 days 00:00:04.834083,0.013580248905448884,8,,6,9,1181,0.601253169129183,TPESampler,COMPLETE
1799,0.2453204469401192,2025-04-24 22:10:16.944296,2025-04-24 22:10:19.945464,0 days 00:00:03.001168,0.0791727176179617,8,sqrt,1,19,1484,0.67400509787739,TPESampler,COMPLETE
1800,0.24917477739164628,2025-04-24 22:10:19.333983,2025-04-24 22:10:23.283426,0 days 00:00:03.949443,0.07403673977285725,8,sqrt,1,20,1354,0.6637466329191316,TPESampler,COMPLETE
1801,0.25902093060974063,2025-04-24 22:10:19.984204,2025-04-24 22:10:24.121479,0 days 00:00:04.137275,0.05472488673649314,7,sqrt,1,20,1364,0.6879356612003888,TPESampler,COMPLETE
1802,0.2722715857787565,2025-04-24 22:10:20.274209,2025-04-24 22:10:23.626177,0 days 00:00:03.351968,0.06699936656425223,8,sqrt,1,18,1013,0.729184316223226,TPESampler,COMPLETE
1803,0.32932181930041804,2025-04-24 22:10:23.495781,2025-04-24 22:10:26.231928,0 days 00:00:02.736147,0.09957919079141736,8,sqrt,2,20,949,0.6629037748342316,TPESampler,COMPLETE
1804,0.2874201596157572,2025-04-24 22:10:23.893312,2025-04-24 22:10:27.636131,0 days 00:00:03.742819,0.08066878674878099,3,sqrt,2,15,1486,0.6089981607156393,TPESampler,COMPLETE
1805,0.3049443756238655,2025-04-24 22:10:24.475291,2025-04-24 22:10:27.998161,0 days 00:00:03.522870,0.09097624549534755,9,sqrt,2,20,1191,0.6190970371841791,TPESampler,COMPLETE
1806,0.27241510906721367,2025-04-24 22:10:26.404443,2025-04-24 22:10:29.647575,0 days 00:00:03.243132,0.06494984380357068,7,log2,1,18,1396,0.6259254615181014,TPESampler,COMPLETE
1807,0.2805656905819473,2025-04-24 22:10:27.809995,2025-04-24 22:10:30.865239,0 days 00:00:03.055244,0.06790173729817722,8,sqrt,1,20,1198,0.6010329701097379,TPESampler,COMPLETE
1808,0.5544131435523277,2025-04-24 22:10:28.231258,2025-04-24 22:10:30.010250,0 days 00:00:01.778992,0.010994804898407332,6,sqrt,3,6,565,0.6362186819933299,TPESampler,COMPLETE
1809,0.25701359752232095,2025-04-24 22:10:29.830786,2025-04-24 22:10:33.112449,0 days 00:00:03.281663,0.07198280056114542,8,sqrt,1,19,1224,0.7019276782190907,TPESampler,COMPLETE
1810,0.27806621038453644,2025-04-24 22:10:30.255867,2025-04-24 22:10:33.242168,0 days 00:00:02.986301,0.05832731908400381,6,sqrt,1,15,1078,0.8114469337632294,TPESampler,COMPLETE
1811,1.317370386720559,2025-04-24 22:10:31.072420,2025-04-24 22:10:32.234536,0 days 00:00:01.162116,0.013739691956229106,9,log2,5,2,191,0.6303509857017149,TPESampler,COMPLETE
1812,0.25722349646458,2025-04-24 22:10:32.407883,2025-04-24 22:10:35.958432,0 days 00:00:03.550549,0.0685479973826353,9,log2,1,20,1325,0.6056918136964906,TPESampler,COMPLETE
1813,0.29031976140449856,2025-04-24 22:10:33.393777,2025-04-24 22:10:36.987812,0 days 00:00:03.594035,0.09042074751829325,4,sqrt,3,12,1399,0.7703599480529058,TPESampler,COMPLETE
1814,0.26303392881288445,2025-04-24 22:10:33.518035,2025-04-24 22:10:36.769000,0 days 00:00:03.250965,0.09810288655241521,4,sqrt,1,14,1105,0.7781174687658293,TPESampler,COMPLETE
1815,0.2792680409080393,2025-04-24 22:10:36.128052,2025-04-24 22:10:39.318155,0 days 00:00:03.190103,0.06772817530063104,4,sqrt,1,7,1440,0.6066753672573931,TPESampler,COMPLETE
1816,0.23974876734320652,2025-04-24 22:10:36.944739,2025-04-24 22:10:40.591903,0 days 00:00:03.647164,0.09632929328249305,8,sqrt,1,16,1346,0.7031625994753783,TPESampler,COMPLETE
1817,0.2897288500336375,2025-04-24 22:10:37.238421,2025-04-24 22:10:40.131399,0 days 00:00:02.892978,0.09899593006176047,5,sqrt,1,16,1039,0.6934203984527681,TPESampler,COMPLETE
1818,0.9687200290240771,2025-04-24 22:10:39.495935,2025-04-24 22:10:40.543247,0 days 00:00:01.047312,0.01460838026435475,9,sqrt,7,14,215,0.776648781908682,TPESampler,COMPLETE
1819,0.34181665699438074,2025-04-24 22:10:40.349424,2025-04-24 22:10:44.143179,0 days 00:00:03.793755,0.06806566213954925,6,,2,16,827,0.6518150308234283,TPESampler,COMPLETE
1820,0.34762006614191526,2025-04-24 22:10:40.791649,2025-04-24 22:10:44.445596,0 days 00:00:03.653947,0.04350468781247483,7,log2,1,20,1371,0.8157838352848218,TPESampler,COMPLETE
1821,0.27874369583868697,2025-04-24 22:10:40.853590,2025-04-24 22:10:44.891027,0 days 00:00:04.037437,0.09488751795647157,5,sqrt,2,13,1485,0.6339795861864026,TPESampler,COMPLETE
1822,0.2921863840483518,2025-04-24 22:10:44.388758,2025-04-24 22:10:47.982728,0 days 00:00:03.593970,0.055916185644803905,6,sqrt,3,20,1442,0.6270396693952413,TPESampler,COMPLETE
1823,0.28704963765375774,2025-04-24 22:10:44.717994,2025-04-24 22:10:48.293696,0 days 00:00:03.575702,0.06674862706548676,9,sqrt,3,17,1272,0.6517961183849073,TPESampler,COMPLETE
1824,0.2734545904554765,2025-04-24 22:10:45.186800,2025-04-24 22:10:48.586845,0 days 00:00:03.400045,0.09637733887945026,8,log2,1,9,1491,0.9831046115378361,TPESampler,COMPLETE
1825,0.33750349661087586,2025-04-24 22:10:48.161078,2025-04-24 22:10:51.943067,0 days 00:00:03.781989,0.06225492509836722,6,log2,1,14,1491,0.6962880743207548,TPESampler,COMPLETE
1826,0.5020559468234806,2025-04-24 22:10:48.513738,2025-04-24 22:10:51.955939,0 days 00:00:03.442201,0.03753952620787108,5,log2,7,4,1333,0.9073491033065519,TPESampler,COMPLETE
1827,0.2671900644113386,2025-04-24 22:10:48.851851,2025-04-24 22:10:52.511482,0 days 00:00:03.659631,0.09860998571364385,5,sqrt,1,15,1451,0.6006656702330397,TPESampler,COMPLETE
1828,0.4513270740532777,2025-04-24 22:10:52.127140,2025-04-24 22:10:58.765343,0 days 00:00:06.638203,0.09725229555581022,9,,10,8,1360,0.8522088885318276,TPESampler,COMPLETE
1829,0.2639626453704541,2025-04-24 22:10:52.165452,2025-04-24 22:10:55.073216,0 days 00:00:02.907764,0.07998307863694157,10,sqrt,1,19,1210,0.674132172673105,TPESampler,COMPLETE
1830,0.2948507537418877,2025-04-24 22:10:52.832597,2025-04-24 22:10:59.299349,0 days 00:00:06.466752,0.07533048619699603,9,,1,20,1441,0.6702457762864602,TPESampler,COMPLETE
1831,0.3176865727855812,2025-04-24 22:10:55.279490,2025-04-24 22:10:57.756571,0 days 00:00:02.477081,0.04663458870069464,3,sqrt,1,19,1298,0.7173370610405938,TPESampler,COMPLETE
1832,0.29164272302803723,2025-04-24 22:10:57.966716,2025-04-24 22:11:01.123310,0 days 00:00:03.156594,0.05247248293750035,8,sqrt,2,18,1246,0.7154211348685104,TPESampler,COMPLETE
1833,0.2875100002668286,2025-04-24 22:10:58.968273,2025-04-24 22:11:02.697672,0 days 00:00:03.729399,0.0981599975763778,7,sqrt,1,19,1222,0.6724544627319203,TPESampler,COMPLETE
1834,0.289001369839909,2025-04-24 22:10:59.524960,2025-04-24 22:11:03.017297,0 days 00:00:03.492337,0.0611295844887544,5,sqrt,2,17,1237,0.7268998558646067,TPESampler,COMPLETE
1835,0.33143532242836393,2025-04-24 22:11:01.341986,2025-04-24 22:11:06.786398,0 days 00:00:05.444412,0.08699905828908201,7,,3,19,1163,0.6514400824772228,TPESampler,COMPLETE
1836,0.23083589193703366,2025-04-24 22:11:02.942652,2025-04-24 22:11:05.956484,0 days 00:00:03.013832,0.09427602122457183,10,log2,1,20,1200,0.7135521448214837,TPESampler,COMPLETE
1837,0.28289121893605534,2025-04-24 22:11:03.281418,2025-04-24 22:11:06.855774,0 days 00:00:03.574356,0.06729397777935768,10,sqrt,1,14,1447,0.6136523387680637,TPESampler,COMPLETE
1838,0.2645276260800711,2025-04-24 22:11:06.140097,2025-04-24 22:11:09.210250,0 days 00:00:03.070153,0.07849435286172006,5,sqrt,1,17,1445,0.6125561797531542,TPESampler,COMPLETE
1839,0.2688425584094242,2025-04-24 22:11:06.959588,2025-04-24 22:11:10.982190,0 days 00:00:04.022602,0.07181747922233499,5,sqrt,1,18,1318,0.727795530228642,TPESampler,COMPLETE
1840,0.3168350540787433,2025-04-24 22:11:07.082737,2025-04-24 22:11:10.377661,0 days 00:00:03.294924,0.09038622910005044,11,log2,3,20,1062,0.737876531004574,TPESampler,COMPLETE
1841,0.26595475808995345,2025-04-24 22:11:09.434426,2025-04-24 22:11:13.112531,0 days 00:00:03.678105,0.08259273871599562,9,sqrt,1,13,1449,0.6713092400034103,TPESampler,COMPLETE
1842,0.24833850473707544,2025-04-24 22:11:10.615908,2025-04-24 22:11:13.863603,0 days 00:00:03.247695,0.08434798713005659,9,log2,1,16,1263,0.7340746456472572,TPESampler,COMPLETE
1843,0.2827860176051025,2025-04-24 22:11:11.191655,2025-04-24 22:11:14.176849,0 days 00:00:02.985194,0.08706443076970906,9,log2,3,18,1311,0.7149704286602743,TPESampler,COMPLETE
1844,0.3356014737088212,2025-04-24 22:11:13.285732,2025-04-24 22:11:15.085776,0 days 00:00:01.800044,0.056659412177721045,4,log2,1,20,959,0.603290156428684,TPESampler,COMPLETE
1845,0.30097551922099514,2025-04-24 22:11:14.103671,2025-04-24 22:11:16.836223,0 days 00:00:02.732552,0.08162678778805886,12,log2,3,18,1123,0.6212980406367513,TPESampler,COMPLETE
1846,0.2580738581207061,2025-04-24 22:11:14.474460,2025-04-24 22:11:19.562590,0 days 00:00:05.088130,0.08924291297945751,5,,1,11,1311,0.601859597624344,TPESampler,COMPLETE
1847,1.2276999167820293,2025-04-24 22:11:15.303853,2025-04-24 22:11:16.747941,0 days 00:00:01.444088,0.010864586966847275,5,log2,7,20,366,0.7406370953132987,TPESampler,COMPLETE
1848,0.2756869434029192,2025-04-24 22:11:16.919721,2025-04-24 22:11:19.529358,0 days 00:00:02.609637,0.07527420454836509,11,log2,2,16,982,0.7260873792018945,TPESampler,COMPLETE
1849,0.4006433484750047,2025-04-24 22:11:17.051286,2025-04-24 22:11:20.943755,0 days 00:00:03.892469,0.011724493207606686,3,,8,7,1063,0.7154769036453913,TPESampler,COMPLETE
