number,value,datetime_start,datetime_complete,duration,params_learning_rate,params_max_depth,params_max_features,params_min_samples_leaf,params_min_samples_split,params_n_estimators,params_subsample,system_attrs_auto:sampler,state
1481,0.8229503695166442,2025-04-24 22:03:56.421990,2025-04-24 22:03:58.304024,0 days 00:00:01.882034,0.08712416376993018,7,log2,9,9,480,0.6284153393052736,TPESampler,COMPLETE
1482,0.24277459113356148,2025-04-24 22:03:56.880842,2025-04-24 22:04:00.115791,0 days 00:00:03.234949,0.09890972577823062,6,sqrt,1,15,1308,0.6862040410271129,TPESampler,COMPLETE
1483,0.27934356793306314,2025-04-24 22:03:58.458946,2025-04-24 22:04:02.006737,0 days 00:00:03.547791,0.05769391978980708,8,sqrt,1,19,1491,0.6768893304239028,TPESampler,COMPLETE
1484,0.3270404147484594,2025-04-24 22:03:58.510568,2025-04-24 22:04:06.066195,0 days 00:00:07.555627,0.010782859123525529,12,,3,13,1221,0.7214132553930052,TPESampler,COMPLETE
1485,0.5178248456557738,2025-04-24 22:04:00.307367,2025-04-24 22:04:01.912112,0 days 00:00:01.604745,0.03278520572357875,6,sqrt,8,2,471,0.9511449886274541,TPESampler,COMPLETE
1486,1.2538154199178242,2025-04-24 22:04:02.081568,2025-04-24 22:04:03.025459,0 days 00:00:00.943891,0.014680959879231455,4,log2,1,4,136,0.8619827557167654,TPESampler,COMPLETE
1487,1.0442363628463363,2025-04-24 22:04:02.215966,2025-04-24 22:04:03.962203,0 days 00:00:01.746237,0.012176425358831764,11,log2,6,16,759,0.9841993930971975,TPESampler,COMPLETE
1488,0.3950318932388563,2025-04-24 22:04:03.234346,2025-04-24 22:04:04.710634,0 days 00:00:01.476288,0.0609172577232423,12,log2,3,19,537,0.6086915500955348,TPESampler,COMPLETE
1489,0.28772633059903646,2025-04-24 22:04:04.186515,2025-04-24 22:04:06.920918,0 days 00:00:02.734403,0.06877866416761531,6,sqrt,3,20,1049,0.776073051258831,TPESampler,COMPLETE
1490,0.2739630500512558,2025-04-24 22:04:04.947055,2025-04-24 22:04:08.540900,0 days 00:00:03.593845,0.0927633369339235,3,sqrt,1,16,1499,0.8186355526078714,TPESampler,COMPLETE
1491,0.5968386732023518,2025-04-24 22:04:06.298984,2025-04-24 22:04:07.851873,0 days 00:00:01.552889,0.04712797224520406,12,sqrt,9,12,310,0.7727040730548701,TPESampler,COMPLETE
1492,0.2516274021237519,2025-04-24 22:04:07.165099,2025-04-24 22:04:10.826031,0 days 00:00:03.660932,0.06285194114424307,5,sqrt,1,17,1496,0.7695092296671273,TPESampler,COMPLETE
1493,0.5670189465060551,2025-04-24 22:04:08.072762,2025-04-24 22:04:10.276452,0 days 00:00:02.203690,0.010329714600628617,9,sqrt,4,14,602,0.634512740353589,TPESampler,COMPLETE
1494,0.3134910466648383,2025-04-24 22:04:08.743348,2025-04-24 22:04:15.650613,0 days 00:00:06.907265,0.03189512108760756,8,,3,9,1364,0.7948203419654608,TPESampler,COMPLETE
1495,0.25516614865329657,2025-04-24 22:04:10.490680,2025-04-24 22:04:13.158017,0 days 00:00:02.667337,0.0861442357332994,4,sqrt,1,14,1091,0.7027951183012253,TPESampler,COMPLETE
1496,0.3150520150020062,2025-04-24 22:04:11.097848,2025-04-24 22:04:14.413813,0 days 00:00:03.315965,0.07151437417143396,8,sqrt,2,17,1417,0.600924058221128,TPESampler,COMPLETE
1497,0.2799491290984512,2025-04-24 22:04:13.318832,2025-04-24 22:04:15.970503,0 days 00:00:02.651671,0.09569120754745498,5,sqrt,3,18,1450,0.6390454137839197,TPESampler,COMPLETE
1498,0.2584070276785306,2025-04-24 22:04:14.579197,2025-04-24 22:04:18.406882,0 days 00:00:03.827685,0.06133345699183237,10,sqrt,1,20,1301,0.6226129052578345,TPESampler,COMPLETE
1499,0.3461053408438616,2025-04-24 22:04:15.833921,2025-04-24 22:04:19.571295,0 days 00:00:03.737374,0.0792482086762432,11,sqrt,1,13,1268,0.6211860256101008,TPESampler,COMPLETE
1500,0.30551344840396016,2025-04-24 22:04:16.176955,2025-04-24 22:04:19.473186,0 days 00:00:03.296231,0.09862516725582061,5,sqrt,3,11,1153,0.6239875777657565,TPESampler,COMPLETE
1501,0.4968733503248361,2025-04-24 22:04:18.612712,2025-04-24 22:04:20.692400,0 days 00:00:02.079688,0.02851409755494355,8,sqrt,9,2,730,0.7850396417830345,TPESampler,COMPLETE
1502,0.25414892785701465,2025-04-24 22:04:19.688964,2025-04-24 22:04:24.279565,0 days 00:00:04.590601,0.08400093852701596,9,sqrt,1,15,1489,0.6246191694224843,TPESampler,COMPLETE
1503,0.26894238839067763,2025-04-24 22:04:19.793805,2025-04-24 22:04:23.501459,0 days 00:00:03.707654,0.05194661531111961,6,sqrt,1,17,1122,0.7116102807817181,TPESampler,COMPLETE
1504,0.3025541709955774,2025-04-24 22:04:21.124573,2025-04-24 22:04:24.092125,0 days 00:00:02.967552,0.06743877289744413,5,sqrt,1,10,1106,0.6229075069082013,TPESampler,COMPLETE
1505,0.24348579410204357,2025-04-24 22:04:23.673407,2025-04-24 22:04:27.474945,0 days 00:00:03.801538,0.058411229667147214,8,sqrt,1,16,1320,0.6077734509180798,TPESampler,COMPLETE
1506,0.2965391070669748,2025-04-24 22:04:24.309049,2025-04-24 22:04:28.337847,0 days 00:00:04.028798,0.07786781931973329,6,sqrt,3,20,1467,0.7047384061682441,TPESampler,COMPLETE
1507,0.2644750896353718,2025-04-24 22:04:24.489124,2025-04-24 22:04:28.173196,0 days 00:00:03.684072,0.06751608388788043,6,sqrt,1,17,1243,0.7134766449889733,TPESampler,COMPLETE
1508,0.27339204666590894,2025-04-24 22:04:27.702593,2025-04-24 22:04:30.792365,0 days 00:00:03.089772,0.09871047883391727,5,sqrt,1,13,1247,0.6019942247198055,TPESampler,COMPLETE
1509,0.3660270679579913,2025-04-24 22:04:28.407107,2025-04-24 22:04:30.861063,0 days 00:00:02.453956,0.061731946647163444,4,,1,2,445,0.8001896991917671,TPESampler,COMPLETE
1510,0.28110071895679845,2025-04-24 22:04:28.581815,2025-04-24 22:04:31.630495,0 days 00:00:03.048680,0.09880409690976956,3,sqrt,1,19,1216,0.6774586576220097,TPESampler,COMPLETE
1511,0.42197220366648514,2025-04-24 22:04:30.911650,2025-04-24 22:04:36.665474,0 days 00:00:05.753824,0.013666201841092084,11,,8,6,1040,0.6822858197507904,TPESampler,COMPLETE
1512,0.23465398976949478,2025-04-24 22:04:31.043825,2025-04-24 22:04:34.429019,0 days 00:00:03.385194,0.09387846608091603,6,sqrt,1,17,1419,0.6673938032697421,TPESampler,COMPLETE
1513,0.3200822984958893,2025-04-24 22:04:31.856258,2025-04-24 22:04:35.155091,0 days 00:00:03.298833,0.09351630506917043,4,sqrt,2,20,1497,0.7105026013859157,TPESampler,COMPLETE
1514,0.29541659860433206,2025-04-24 22:04:34.616523,2025-04-24 22:04:38.450966,0 days 00:00:03.834443,0.06596069980509754,6,sqrt,2,13,1491,0.6607771313007688,TPESampler,COMPLETE
1515,0.2886759089962151,2025-04-24 22:04:35.381903,2025-04-24 22:04:39.328219,0 days 00:00:03.946316,0.09972014039711218,7,sqrt,1,12,1327,0.7352068289279318,TPESampler,COMPLETE
1516,0.2590011585531128,2025-04-24 22:04:36.907985,2025-04-24 22:04:40.339393,0 days 00:00:03.431408,0.057078315945631376,6,sqrt,1,10,1279,0.6003998290013473,TPESampler,COMPLETE
1517,0.39807502145991547,2025-04-24 22:04:38.664514,2025-04-24 22:04:41.899018,0 days 00:00:03.234504,0.05277534385432904,6,,8,9,615,0.8468871186544908,TPESampler,COMPLETE
1518,0.3048620963916275,2025-04-24 22:04:39.537447,2025-04-24 22:04:42.593579,0 days 00:00:03.056132,0.09610304951881617,7,sqrt,3,16,1469,0.7112257458713005,TPESampler,COMPLETE
1519,0.45089336906010613,2025-04-24 22:04:40.545061,2025-04-24 22:04:45.700149,0 days 00:00:05.155088,0.09057890759550931,3,,10,19,1453,0.652069166578991,TPESampler,COMPLETE
1520,0.2947070271100699,2025-04-24 22:04:42.107891,2025-04-24 22:04:45.795454,0 days 00:00:03.687563,0.0965955917273274,6,sqrt,3,20,1497,0.6406540287823277,TPESampler,COMPLETE
1521,0.29207110654193646,2025-04-24 22:04:42.828369,2025-04-24 22:04:45.936128,0 days 00:00:03.107759,0.0901539203890261,7,sqrt,1,15,1159,0.654558109291456,TPESampler,COMPLETE
1522,0.3043667514031102,2025-04-24 22:04:45.877319,2025-04-24 22:04:49.102081,0 days 00:00:03.224762,0.08822726433854622,6,sqrt,3,17,1208,0.6367603857833464,TPESampler,COMPLETE
1523,0.24351642609393045,2025-04-24 22:04:45.993203,2025-04-24 22:04:49.241888,0 days 00:00:03.248685,0.08487929493322884,6,sqrt,1,15,1284,0.6855447829812025,TPESampler,COMPLETE
1524,0.34421560420928343,2025-04-24 22:04:46.174212,2025-04-24 22:04:52.726844,0 days 00:00:06.552632,0.032672742990444315,12,,5,19,1051,0.7651331221680532,TPESampler,COMPLETE
1525,0.37414487801852236,2025-04-24 22:04:49.294436,2025-04-24 22:04:52.064362,0 days 00:00:02.769926,0.01877897071684148,10,log2,1,15,1213,0.7743514633505416,TPESampler,COMPLETE
1526,0.7469322285265744,2025-04-24 22:04:49.461923,2025-04-24 22:04:51.712984,0 days 00:00:02.251061,0.025175881565427514,12,log2,4,16,786,0.6109898815411392,TPESampler,COMPLETE
1527,0.42403970803207364,2025-04-24 22:04:51.903301,2025-04-24 22:04:53.776673,0 days 00:00:01.873372,0.0283745624336667,8,,9,5,242,0.9270841322413468,TPESampler,COMPLETE
1528,0.29781513824688566,2025-04-24 22:04:52.327937,2025-04-24 22:04:55.975990,0 days 00:00:03.648053,0.08311403465399737,7,sqrt,3,9,1415,0.602314603540825,TPESampler,COMPLETE
1529,0.2877425726114426,2025-04-24 22:04:52.937624,2025-04-24 22:04:56.390730,0 days 00:00:03.453106,0.09212354520324534,5,sqrt,2,17,1310,0.6439292538553318,TPESampler,COMPLETE
1530,0.3910241889488762,2025-04-24 22:04:53.972390,2025-04-24 22:04:56.396694,0 days 00:00:02.424304,0.09594371654441426,7,,7,19,416,0.6257761890319109,TPESampler,COMPLETE
1531,0.28191658896794014,2025-04-24 22:04:56.174626,2025-04-24 22:04:59.462338,0 days 00:00:03.287712,0.09548940413897751,9,sqrt,3,16,1269,0.6648461181523403,TPESampler,COMPLETE
1532,0.2870633238130053,2025-04-24 22:04:56.630280,2025-04-24 22:05:00.295590,0 days 00:00:03.665310,0.09422047746525519,6,sqrt,2,16,1294,0.6903270126306147,TPESampler,COMPLETE
1533,0.6164877900968848,2025-04-24 22:04:56.673670,2025-04-24 22:04:59.387675,0 days 00:00:02.714005,0.0227790184840148,8,sqrt,10,16,801,0.6838492996036878,TPESampler,COMPLETE
1534,0.2482212970858401,2025-04-24 22:04:59.537192,2025-04-24 22:05:02.389785,0 days 00:00:02.852593,0.0985305111193128,5,sqrt,1,20,1128,0.7682558518036168,TPESampler,COMPLETE
1535,0.28397835793043724,2025-04-24 22:04:59.657858,2025-04-24 22:05:02.514539,0 days 00:00:02.856681,0.09935042142871808,5,sqrt,1,19,987,0.6760683503768539,TPESampler,COMPLETE
1536,0.2941348873269731,2025-04-24 22:05:00.563327,2025-04-24 22:05:03.202600,0 days 00:00:02.639273,0.05575434005308605,6,sqrt,3,18,1070,0.6182125369302308,TPESampler,COMPLETE
1537,0.279556060170357,2025-04-24 22:05:02.547254,2025-04-24 22:05:06.179670,0 days 00:00:03.632416,0.08402597279947364,11,sqrt,1,16,1286,0.6182223403483951,TPESampler,COMPLETE
1538,0.2560565393528732,2025-04-24 22:05:02.711945,2025-04-24 22:05:06.462604,0 days 00:00:03.750659,0.0658763366395107,4,sqrt,1,14,1337,0.7104527850909822,TPESampler,COMPLETE
1539,0.2481063661438839,2025-04-24 22:05:03.440506,2025-04-24 22:05:07.020991,0 days 00:00:03.580485,0.08531895758569057,6,sqrt,1,20,1277,0.6861788563769606,TPESampler,COMPLETE
1540,0.24640596305539492,2025-04-24 22:05:06.420509,2025-04-24 22:05:09.770403,0 days 00:00:03.349894,0.06511603142353997,5,sqrt,1,6,1272,0.613351120286763,TPESampler,COMPLETE
1541,0.5584533602876605,2025-04-24 22:05:06.678711,2025-04-24 22:05:08.230932,0 days 00:00:01.552221,0.011283257808114218,8,,7,3,173,0.6049760527930819,TPESampler,COMPLETE
1542,0.24573945120819715,2025-04-24 22:05:07.325437,2025-04-24 22:05:11.484185,0 days 00:00:04.158748,0.09989701215126344,7,sqrt,1,12,1486,0.6734166315805508,TPESampler,COMPLETE
1543,0.28012046844604505,2025-04-24 22:05:08.447261,2025-04-24 22:05:12.332115,0 days 00:00:03.884854,0.09827117199332959,8,log2,1,11,1396,0.6272250839953825,TPESampler,COMPLETE
1544,0.24477818745552282,2025-04-24 22:05:09.967980,2025-04-24 22:05:12.711135,0 days 00:00:02.743155,0.09910408600274194,9,log2,1,17,1212,0.6509416143710218,TPESampler,COMPLETE
1545,0.28344244950226377,2025-04-24 22:05:11.666609,2025-04-24 22:05:15.056237,0 days 00:00:03.389628,0.09840875077946352,8,sqrt,3,17,1374,0.6986712975518585,TPESampler,COMPLETE
1546,0.2628466501237731,2025-04-24 22:05:12.582500,2025-04-24 22:05:16.348461,0 days 00:00:03.765961,0.09924997239578143,9,sqrt,1,18,1498,0.6752547780757068,TPESampler,COMPLETE
1547,0.2921069926134364,2025-04-24 22:05:12.929666,2025-04-24 22:05:16.484482,0 days 00:00:03.554816,0.054686006514545776,6,sqrt,3,17,1499,0.7355749943959231,TPESampler,COMPLETE
1548,0.2742300415451901,2025-04-24 22:05:15.238773,2025-04-24 22:05:18.194439,0 days 00:00:02.955666,0.05893797798617912,3,sqrt,1,16,1296,0.6083241587065078,TPESampler,COMPLETE
1549,0.2902110341532347,2025-04-24 22:05:16.533956,2025-04-24 22:05:19.283614,0 days 00:00:02.749658,0.06359650709538905,3,sqrt,3,5,1106,0.6517302215277752,TPESampler,COMPLETE
1550,0.2566850016757378,2025-04-24 22:05:16.693090,2025-04-24 22:05:19.717917,0 days 00:00:03.024827,0.08916014858241991,10,sqrt,1,17,1076,0.6387091040387562,TPESampler,COMPLETE
1551,0.25245585131455006,2025-04-24 22:05:18.373454,2025-04-24 22:05:21.012869,0 days 00:00:02.639415,0.0840048471275337,5,sqrt,1,6,1219,0.6863235689329101,TPESampler,COMPLETE
1552,0.2782276079726608,2025-04-24 22:05:19.507071,2025-04-24 22:05:21.729486,0 days 00:00:02.222415,0.0684140274010287,5,sqrt,3,20,1206,0.6655485374740525,TPESampler,COMPLETE
1553,0.39397143380438354,2025-04-24 22:05:20.062877,2025-04-24 22:05:29.379144,0 days 00:00:09.316267,0.02864407318381973,12,,1,9,1428,0.9412141316936967,TPESampler,COMPLETE
1554,0.28597280841634964,2025-04-24 22:05:21.209239,2025-04-24 22:05:24.360579,0 days 00:00:03.151340,0.07443413234763513,5,sqrt,1,15,1464,0.644466494554329,TPESampler,COMPLETE
1555,0.2807429579640097,2025-04-24 22:05:21.965986,2025-04-24 22:05:24.466412,0 days 00:00:02.500426,0.09364208154423231,6,sqrt,1,5,1162,0.6936916453803412,TPESampler,COMPLETE
1556,0.28841928897147295,2025-04-24 22:05:24.524864,2025-04-24 22:05:27.162012,0 days 00:00:02.637148,0.0902028218552148,6,sqrt,2,17,1485,0.604802401823052,TPESampler,COMPLETE
1557,0.27531909215686035,2025-04-24 22:05:24.677541,2025-04-24 22:05:28.829371,0 days 00:00:04.151830,0.09404371471301852,3,,1,17,1367,0.7355343769863628,TPESampler,COMPLETE
1558,0.28564613842683867,2025-04-24 22:05:27.365748,2025-04-24 22:05:29.876026,0 days 00:00:02.510278,0.06973093727170891,11,sqrt,3,16,1271,0.7521582368684167,TPESampler,COMPLETE
1559,0.39077366528909463,2025-04-24 22:05:29.058806,2025-04-24 22:05:32.401450,0 days 00:00:03.342644,0.021502067658483025,12,,1,11,413,0.893691876637889,TPESampler,COMPLETE
1560,0.2882987147478072,2025-04-24 22:05:29.638519,2025-04-24 22:05:33.062585,0 days 00:00:03.424066,0.09141655278161127,4,sqrt,2,17,1497,0.6531237152863375,TPESampler,COMPLETE
1561,0.40559356579055883,2025-04-24 22:05:30.122867,2025-04-24 22:05:33.143868,0 days 00:00:03.021001,0.0735953219107498,12,sqrt,8,10,1270,0.7425254626711356,TPESampler,COMPLETE
1562,0.2843110715991067,2025-04-24 22:05:32.590402,2025-04-24 22:05:35.173006,0 days 00:00:02.582604,0.09518992127181368,5,log2,1,19,1446,0.6376541387234087,TPESampler,COMPLETE
1563,0.5088638392179688,2025-04-24 22:05:33.318868,2025-04-24 22:05:37.252455,0 days 00:00:03.933587,0.013310699587381741,8,,10,19,767,0.6062889046117268,TPESampler,COMPLETE
1564,0.3103581688299312,2025-04-24 22:05:33.403416,2025-04-24 22:05:37.173653,0 days 00:00:03.770237,0.09329296114479729,6,sqrt,3,12,1420,0.7833262020827685,TPESampler,COMPLETE
1565,0.3105483680170862,2025-04-24 22:05:35.395897,2025-04-24 22:05:38.828937,0 days 00:00:03.433040,0.08504282577660122,6,sqrt,1,16,1346,0.7247444130598402,TPESampler,COMPLETE
1566,0.2808865612900451,2025-04-24 22:05:37.334516,2025-04-24 22:05:40.838370,0 days 00:00:03.503854,0.09032166877603662,3,sqrt,2,15,1183,0.7415390734758289,TPESampler,COMPLETE
1567,0.2879955835602829,2025-04-24 22:05:37.456394,2025-04-24 22:05:41.011941,0 days 00:00:03.555547,0.09110950327780977,4,sqrt,3,15,1199,0.6847376915257184,TPESampler,COMPLETE
1568,0.26599515011693375,2025-04-24 22:05:39.059347,2025-04-24 22:05:42.642283,0 days 00:00:03.582936,0.09024966995075916,5,sqrt,1,14,1446,0.7523055557260728,TPESampler,COMPLETE
1569,0.31074488038064013,2025-04-24 22:05:41.133091,2025-04-24 22:05:44.365432,0 days 00:00:03.232341,0.09298448855748438,4,sqrt,3,6,1290,0.7214217894757702,TPESampler,COMPLETE
1570,0.32978973504456155,2025-04-24 22:05:41.295490,2025-04-24 22:05:44.360964,0 days 00:00:03.065474,0.05583008185529961,4,log2,2,18,1232,0.7331486299854875,TPESampler,COMPLETE
1571,0.331379730869837,2025-04-24 22:05:42.817395,2025-04-24 22:05:46.134623,0 days 00:00:03.317228,0.019784109286514286,10,sqrt,5,5,1298,0.7980870116929091,TPESampler,COMPLETE
1572,0.2761511811546226,2025-04-24 22:05:44.524412,2025-04-24 22:05:48.517952,0 days 00:00:03.993540,0.08448645173397754,6,sqrt,1,18,1402,0.6769585367018559,TPESampler,COMPLETE
1573,0.28860828257162374,2025-04-24 22:05:44.575329,2025-04-24 22:05:48.297107,0 days 00:00:03.721778,0.09341276502567347,5,sqrt,1,18,1174,0.6152969869350612,TPESampler,COMPLETE
1574,0.28933155611305755,2025-04-24 22:05:46.350328,2025-04-24 22:05:49.393555,0 days 00:00:03.043227,0.09851065279456375,7,sqrt,1,18,1083,0.6575127588502676,TPESampler,COMPLETE
1575,0.8254415685586199,2025-04-24 22:05:48.477956,2025-04-24 22:05:49.887789,0 days 00:00:01.409833,0.012203223341922195,3,sqrt,2,3,448,0.9507655193166832,TPESampler,COMPLETE
1576,0.2948663633970699,2025-04-24 22:05:48.756584,2025-04-24 22:05:50.946899,0 days 00:00:02.190315,0.0848800413035304,7,log2,2,20,926,0.7627749007172575,TPESampler,COMPLETE
1577,0.3066941565565473,2025-04-24 22:05:49.591256,2025-04-24 22:05:52.287375,0 days 00:00:02.696119,0.07153749780964118,6,sqrt,1,17,978,0.6004532344454074,TPESampler,COMPLETE
1578,0.27204060539294145,2025-04-24 22:05:50.073709,2025-04-24 22:05:54.031719,0 days 00:00:03.958010,0.06302967753055265,10,sqrt,1,10,1454,0.6393757654783446,TPESampler,COMPLETE
1579,0.24397914858194109,2025-04-24 22:05:51.278508,2025-04-24 22:05:55.177114,0 days 00:00:03.898606,0.0654139524898223,6,sqrt,1,20,1479,0.6040574885765281,TPESampler,COMPLETE
1580,0.27473218444196107,2025-04-24 22:05:52.511598,2025-04-24 22:05:56.481505,0 days 00:00:03.969907,0.04573185294286854,5,sqrt,1,19,1493,0.729877025041743,TPESampler,COMPLETE
1581,0.3115901546644764,2025-04-24 22:05:54.243426,2025-04-24 22:05:57.478540,0 days 00:00:03.235114,0.09789774897869125,3,log2,2,10,1458,0.6841196360066557,TPESampler,COMPLETE
1582,0.27399633032243087,2025-04-24 22:05:55.348084,2025-04-24 22:05:58.459086,0 days 00:00:03.111002,0.09618615683067283,5,sqrt,1,10,1219,0.7223095925084271,TPESampler,COMPLETE
1583,0.24686225216864902,2025-04-24 22:05:56.658633,2025-04-24 22:06:00.187491,0 days 00:00:03.528858,0.07439665391641696,5,sqrt,1,9,1263,0.7024848740363888,TPESampler,COMPLETE
1584,0.4303169990481887,2025-04-24 22:05:57.656532,2025-04-24 22:06:01.321648,0 days 00:00:03.665116,0.062412728407586784,5,sqrt,9,9,1417,0.8443014177370104,TPESampler,COMPLETE
1585,0.2525625511498031,2025-04-24 22:05:58.692588,2025-04-24 22:06:02.053460,0 days 00:00:03.360872,0.0830262331923374,7,sqrt,1,17,1128,0.6027309291285744,TPESampler,COMPLETE
1586,0.29824772344909295,2025-04-24 22:06:00.460070,2025-04-24 22:06:04.612557,0 days 00:00:04.152487,0.0967341070208537,5,sqrt,2,18,1496,0.7594903900878094,TPESampler,COMPLETE
1587,0.31522060223030807,2025-04-24 22:06:01.518864,2025-04-24 22:06:04.978299,0 days 00:00:03.459435,0.07609136273508532,8,sqrt,1,20,1075,0.6524692985882741,TPESampler,COMPLETE
1588,0.2515110115818714,2025-04-24 22:06:02.270406,2025-04-24 22:06:06.203468,0 days 00:00:03.933062,0.09210602337481408,5,sqrt,1,15,1500,0.6769732345912792,TPESampler,COMPLETE
1589,0.25608246325742373,2025-04-24 22:06:04.823848,2025-04-24 22:06:07.806677,0 days 00:00:02.982829,0.0951770665425154,7,sqrt,1,12,1106,0.6415679239664784,TPESampler,COMPLETE
1590,0.24298877239331534,2025-04-24 22:06:05.263846,2025-04-24 22:06:09.354216,0 days 00:00:04.090370,0.0750011442617206,4,sqrt,1,7,1350,0.6814701228478917,TPESampler,COMPLETE
1591,0.7442050208157169,2025-04-24 22:06:06.476976,2025-04-24 22:06:09.701077,0 days 00:00:03.224101,0.019025265993653354,3,log2,5,11,1296,0.8475936048472533,TPESampler,COMPLETE
1592,0.28867195527744316,2025-04-24 22:06:07.984394,2025-04-24 22:06:11.608991,0 days 00:00:03.624597,0.06694757348778664,3,,1,17,989,0.7732799220193196,TPESampler,COMPLETE
1593,0.2931602396910264,2025-04-24 22:06:09.554584,2025-04-24 22:06:12.341213,0 days 00:00:02.786629,0.07265896899046166,4,sqrt,1,8,1278,0.6876352118281807,TPESampler,COMPLETE
1594,0.48179566494437887,2025-04-24 22:06:09.948669,2025-04-24 22:06:11.362131,0 days 00:00:01.413462,0.013034785553838605,10,,6,16,141,0.8984280261371144,TPESampler,COMPLETE
1595,1.0591097161215095,2025-04-24 22:06:11.540840,2025-04-24 22:06:12.854333,0 days 00:00:01.313493,0.012965004721502433,9,log2,1,13,192,0.69165725342913,TPESampler,COMPLETE
1596,0.722836359093883,2025-04-24 22:06:11.851634,2025-04-24 22:06:14.371845,0 days 00:00:02.520211,0.05129627631310978,12,log2,9,16,864,0.6501645494239587,TPESampler,COMPLETE
1597,0.2116881043526277,2025-04-24 22:06:12.659214,2025-04-24 22:06:16.260901,0 days 00:00:03.601687,0.08126858136591739,6,sqrt,1,16,1408,0.6034418816645306,TPESampler,COMPLETE
1598,0.309282376443235,2025-04-24 22:06:13.196729,2025-04-24 22:06:18.673081,0 days 00:00:05.476352,0.08636596152849683,5,,3,20,1420,0.6005557725540848,TPESampler,COMPLETE
1599,1.0210710762103807,2025-04-24 22:06:14.591146,2025-04-24 22:06:16.905626,0 days 00:00:02.314480,0.01528649559072506,8,log2,10,2,828,0.9919033975054106,TPESampler,COMPLETE
1600,0.28205183897229136,2025-04-24 22:06:16.469718,2025-04-24 22:06:19.552150,0 days 00:00:03.082432,0.09679700798515606,10,sqrt,1,19,1174,0.6045792867264229,TPESampler,COMPLETE
1601,0.28315121315962244,2025-04-24 22:06:17.123016,2025-04-24 22:06:20.316204,0 days 00:00:03.193188,0.09750874928988891,5,sqrt,1,16,1275,0.6098707372888255,TPESampler,COMPLETE
1602,0.44129187563483446,2025-04-24 22:06:18.886874,2025-04-24 22:06:24.464646,0 days 00:00:05.577772,0.058395840762976,6,,10,3,1302,0.9098175206974337,TPESampler,COMPLETE
1603,0.3116611689298591,2025-04-24 22:06:19.788757,2025-04-24 22:06:22.201448,0 days 00:00:02.412691,0.0946793406959091,6,sqrt,1,20,1182,0.6102033827465225,TPESampler,COMPLETE
