number,value,datetime_start,datetime_complete,duration,params_learning_rate,params_max_depth,params_max_features,params_min_samples_leaf,params_min_samples_split,params_n_estimators,params_subsample,system_attrs_auto:sampler,state
1850,0.30610790204013694,2025-04-24 22:11:19.712172,2025-04-24 22:11:23.114843,0 days 00:00:03.402671,0.046325187367710546,8,log2,2,18,1083,0.6757615520692162,TPESampler,COMPLETE
1851,0.3480591894389219,2025-04-24 22:11:19.761883,2025-04-24 22:11:23.645580,0 days 00:00:03.883697,0.07926242522264047,9,log2,4,17,1374,0.6154162592117602,TPESampler,COMPLETE
1852,0.28530216115956264,2025-04-24 22:11:21.166996,2025-04-24 22:11:26.793387,0 days 00:00:05.626391,0.09873626698973251,4,,1,11,1284,0.7162521524304587,TPESampler,COMPLETE
1853,0.29939865244311586,2025-04-24 22:11:23.326831,2025-04-24 22:11:25.570288,0 days 00:00:02.243457,0.08365885519026234,10,log2,3,20,868,0.8447712455271288,TPESampler,COMPLETE
1854,0.9092136395763302,2025-04-24 22:11:23.867195,2025-04-24 22:11:25.310898,0 days 00:00:01.443703,0.016366869824784747,12,log2,2,18,275,0.7052391345839619,TPESampler,COMPLETE
1855,0.29463327942440387,2025-04-24 22:11:25.513025,2025-04-24 22:11:29.210243,0 days 00:00:03.697218,0.09922161216306236,10,log2,2,19,1485,0.8341340320766951,TPESampler,COMPLETE
1856,0.3112937708601461,2025-04-24 22:11:25.843180,2025-04-24 22:11:29.574201,0 days 00:00:03.731021,0.09435327111717982,9,sqrt,2,14,1209,0.6582441694864497,TPESampler,COMPLETE
1857,0.27913665694135276,2025-04-24 22:11:26.999715,2025-04-24 22:11:30.614296,0 days 00:00:03.614581,0.07912554729650392,4,sqrt,3,20,1224,0.64540180501133,TPESampler,COMPLETE
1858,0.27744595429901564,2025-04-24 22:11:29.424363,2025-04-24 22:11:32.594576,0 days 00:00:03.170213,0.09482699526614893,9,log2,2,19,1069,0.6699728170812419,TPESampler,COMPLETE
1859,0.2897739706177424,2025-04-24 22:11:29.847970,2025-04-24 22:11:33.486627,0 days 00:00:03.638657,0.08975490718942257,12,log2,2,17,1167,0.7791467133504045,TPESampler,COMPLETE
1860,0.30540628462450076,2025-04-24 22:11:30.839134,2025-04-24 22:11:33.863846,0 days 00:00:03.024712,0.09596381109397631,4,sqrt,3,17,1047,0.7324178425847384,TPESampler,COMPLETE
1861,0.26615218019477493,2025-04-24 22:11:32.769977,2025-04-24 22:11:35.951320,0 days 00:00:03.181343,0.07921840068228107,4,sqrt,3,15,1309,0.75939030854374,TPESampler,COMPLETE
1862,0.3100497531984024,2025-04-24 22:11:33.684087,2025-04-24 22:11:36.807219,0 days 00:00:03.123132,0.09521942891888094,7,sqrt,3,14,1193,0.6144338288613334,TPESampler,COMPLETE
1863,0.28405473176922486,2025-04-24 22:11:34.068481,2025-04-24 22:11:37.546671,0 days 00:00:03.478190,0.09839892882633036,9,log2,2,19,1442,0.6359869534676923,TPESampler,COMPLETE
1864,0.3146671507383011,2025-04-24 22:11:36.127397,2025-04-24 22:11:38.662483,0 days 00:00:02.535086,0.07552033001951591,5,sqrt,1,19,1035,0.7039971950310352,TPESampler,COMPLETE
1865,0.3163483360593563,2025-04-24 22:11:36.984884,2025-04-24 22:11:40.640656,0 days 00:00:03.655772,0.07140736389420693,6,sqrt,4,18,1453,0.603002798713826,TPESampler,COMPLETE
1866,0.2733951501458593,2025-04-24 22:11:37.744016,2025-04-24 22:11:41.442693,0 days 00:00:03.698677,0.09112418189869874,8,sqrt,1,16,1264,0.6050763432654693,TPESampler,COMPLETE
1867,0.27696752493336185,2025-04-24 22:11:38.836117,2025-04-24 22:11:43.021513,0 days 00:00:04.185396,0.061927608221688704,7,sqrt,1,16,1483,0.652117150690968,TPESampler,COMPLETE
1868,0.26309044794693087,2025-04-24 22:11:40.855533,2025-04-24 22:11:45.058732,0 days 00:00:04.203199,0.07148760434726799,11,log2,1,18,1449,0.735860317324008,TPESampler,COMPLETE
1869,0.31375342819944446,2025-04-24 22:11:41.641149,2025-04-24 22:11:45.106352,0 days 00:00:03.465203,0.0799946719165942,10,log2,1,20,1112,0.6962758910297485,TPESampler,COMPLETE
1870,0.3323791520924513,2025-04-24 22:11:43.229817,2025-04-24 22:11:46.143527,0 days 00:00:02.913710,0.04795188708170039,12,log2,1,17,1104,0.6805759352494359,TPESampler,COMPLETE
1871,0.28257558024093477,2025-04-24 22:11:45.215871,2025-04-24 22:11:48.172749,0 days 00:00:02.956878,0.0739752783836242,5,sqrt,2,20,1251,0.6062800446290053,TPESampler,COMPLETE
1872,1.1744697321076523,2025-04-24 22:11:45.364228,2025-04-24 22:11:46.931686,0 days 00:00:01.567458,0.04302592224093504,9,log2,10,2,259,0.7609673237913731,TPESampler,COMPLETE
1873,0.26755181286152985,2025-04-24 22:11:46.407595,2025-04-24 22:11:49.185800,0 days 00:00:02.778205,0.09517497879596076,8,log2,2,20,1143,0.7606554823142183,TPESampler,COMPLETE
1874,0.2804763984294336,2025-04-24 22:11:47.141256,2025-04-24 22:11:51.138369,0 days 00:00:03.997113,0.06122253246049649,8,sqrt,1,16,1460,0.6087268576743845,TPESampler,COMPLETE
1875,0.9232555819666911,2025-04-24 22:11:48.349972,2025-04-24 22:11:51.282602,0 days 00:00:02.932630,0.012378826771141107,10,log2,5,17,1182,0.60274465129821,TPESampler,COMPLETE
1876,0.26202476332001984,2025-04-24 22:11:49.361379,2025-04-24 22:11:51.787568,0 days 00:00:02.426189,0.06996870776407947,4,sqrt,1,18,1102,0.7690779629440857,TPESampler,COMPLETE
1877,0.2902413198927623,2025-04-24 22:11:51.378240,2025-04-24 22:11:55.135566,0 days 00:00:03.757326,0.06344161297504482,6,sqrt,3,15,1351,0.6706548489375868,TPESampler,COMPLETE
1878,0.37181301822040086,2025-04-24 22:11:51.547671,2025-04-24 22:11:54.591160,0 days 00:00:03.043489,0.03855652976605495,12,,7,16,352,0.9955695099311008,TPESampler,COMPLETE
1879,0.3199831939002479,2025-04-24 22:11:52.108003,2025-04-24 22:11:54.866627,0 days 00:00:02.758624,0.07478471421358954,5,log2,4,16,1108,0.709735259462577,TPESampler,COMPLETE
1880,0.23956758519213242,2025-04-24 22:11:54.805511,2025-04-24 22:11:58.168400,0 days 00:00:03.362889,0.09727338213753585,11,log2,1,17,1003,0.7321108265613369,TPESampler,COMPLETE
1881,0.23608956407908746,2025-04-24 22:11:55.277099,2025-04-24 22:11:59.318176,0 days 00:00:04.041077,0.09964823493836575,6,sqrt,1,16,1246,0.6022861391029085,TPESampler,COMPLETE
1882,0.40423237425781183,2025-04-24 22:11:55.376672,2025-04-24 22:11:59.539953,0 days 00:00:04.163281,0.09757017409720949,4,sqrt,7,16,1368,0.6090433318952865,TPESampler,COMPLETE
1883,0.26672536640518,2025-04-24 22:11:58.378328,2025-04-24 22:12:02.002944,0 days 00:00:03.624616,0.07299283207862223,8,sqrt,1,20,1495,0.600730097614729,TPESampler,COMPLETE
1884,0.3674036065318498,2025-04-24 22:11:59.503470,2025-04-24 22:12:01.926271,0 days 00:00:02.422801,0.06688386648389504,5,,7,2,470,0.7231178791424896,TPESampler,COMPLETE
1885,0.26326367257255195,2025-04-24 22:11:59.865840,2025-04-24 22:12:02.920460,0 days 00:00:03.054620,0.09161546600541191,10,log2,1,20,1201,0.7844790484233736,TPESampler,COMPLETE
1886,0.34908339358631446,2025-04-24 22:12:02.098977,2025-04-24 22:12:10.026549,0 days 00:00:07.927572,0.03863154508976608,11,,6,6,1494,0.6548541965872697,TPESampler,COMPLETE
1887,0.2577883963962661,2025-04-24 22:12:02.240421,2025-04-24 22:12:05.663966,0 days 00:00:03.423545,0.06016378571933074,6,sqrt,1,19,1383,0.65624055051642,TPESampler,COMPLETE
1888,0.29068884890375085,2025-04-24 22:12:03.171392,2025-04-24 22:12:06.734810,0 days 00:00:03.563418,0.04973700032663737,4,sqrt,3,10,1497,0.6284674162311339,TPESampler,COMPLETE
1889,1.072926603270588,2025-04-24 22:12:05.939230,2025-04-24 22:12:07.992724,0 days 00:00:02.053494,0.011488258446428529,3,log2,10,13,990,0.9515527772707855,TPESampler,COMPLETE
1890,0.29727254652173796,2025-04-24 22:12:06.899909,2025-04-24 22:12:09.179405,0 days 00:00:02.279496,0.09914502843344582,7,log2,3,13,1142,0.6465734541167387,TPESampler,COMPLETE
1891,0.28921399178311996,2025-04-24 22:12:08.199025,2025-04-24 22:12:11.103346,0 days 00:00:02.904321,0.0838798909832861,7,sqrt,3,16,1426,0.6078814579791363,TPESampler,COMPLETE
1892,0.45593940987606757,2025-04-24 22:12:09.517856,2025-04-24 22:12:13.948371,0 days 00:00:04.430515,0.06495473605407538,7,,10,20,775,0.8319906128055611,TPESampler,COMPLETE
1893,0.3152674086195255,2025-04-24 22:12:10.305989,2025-04-24 22:12:13.261988,0 days 00:00:02.955999,0.046845951777679286,10,log2,2,20,1040,0.6289753326099009,TPESampler,COMPLETE
1894,0.27853418692576565,2025-04-24 22:12:11.326228,2025-04-24 22:12:13.717427,0 days 00:00:02.391199,0.07056880202978746,9,log2,1,19,955,0.6991996981831426,TPESampler,COMPLETE
1895,0.28127766348414035,2025-04-24 22:12:13.494850,2025-04-24 22:12:17.443464,0 days 00:00:03.948614,0.08899128426179256,9,log2,2,17,1451,0.7526505325740348,TPESampler,COMPLETE
1896,0.2645140621003357,2025-04-24 22:12:14.012617,2025-04-24 22:12:18.438632,0 days 00:00:04.426015,0.06545714795795211,3,sqrt,1,16,1438,0.7045052406927467,TPESampler,COMPLETE
1897,0.283654709599021,2025-04-24 22:12:14.337189,2025-04-24 22:12:18.520531,0 days 00:00:04.183342,0.08949194940014944,3,sqrt,1,7,1292,0.6264424598228604,TPESampler,COMPLETE
1898,0.3521653756246599,2025-04-24 22:12:17.676904,2025-04-24 22:12:20.494239,0 days 00:00:02.817335,0.010962071742023604,3,,2,2,604,0.6024507999242631,TPESampler,COMPLETE
1899,0.38974705830146095,2025-04-24 22:12:18.706163,2025-04-24 22:12:21.057678,0 days 00:00:02.351515,0.042348497961508955,12,sqrt,5,6,512,0.6066780410175392,TPESampler,COMPLETE
1900,0.46501714469511296,2025-04-24 22:12:18.807286,2025-04-24 22:12:22.383201,0 days 00:00:03.575915,0.010389450237761355,12,sqrt,6,8,1155,0.7478436163870662,TPESampler,COMPLETE
1901,0.307649625861774,2025-04-24 22:12:20.710425,2025-04-24 22:12:24.227322,0 days 00:00:03.516897,0.08915387636532614,10,log2,3,19,1199,0.6924007817009693,TPESampler,COMPLETE
1902,0.26726385741955716,2025-04-24 22:12:21.280954,2025-04-24 22:12:25.116530,0 days 00:00:03.835576,0.09979895192571694,3,sqrt,1,4,1159,0.6260156034179164,TPESampler,COMPLETE
1903,0.310414156075653,2025-04-24 22:12:22.627523,2025-04-24 22:12:25.947020,0 days 00:00:03.319497,0.05032837414714236,9,log2,1,20,1146,0.7538477802611148,TPESampler,COMPLETE
1904,0.34981447294077406,2025-04-24 22:12:24.430290,2025-04-24 22:12:30.062713,0 days 00:00:05.632423,0.04343635894912387,10,,5,5,947,0.8408024963339995,TPESampler,COMPLETE
1905,0.36510700123454765,2025-04-24 22:12:25.352281,2025-04-24 22:12:28.037515,0 days 00:00:02.685234,0.015753905559335438,5,sqrt,5,16,1417,0.7343604291874714,TPESampler,COMPLETE
1906,0.3261946708667498,2025-04-24 22:12:26.195180,2025-04-24 22:12:31.863472,0 days 00:00:05.668292,0.09778930309781395,9,,3,19,1304,0.6163878060681763,TPESampler,COMPLETE
1907,0.4878106486387137,2025-04-24 22:12:28.235302,2025-04-24 22:12:30.322904,0 days 00:00:02.087602,0.01441831897108754,4,sqrt,6,20,1069,0.8064227184846514,TPESampler,COMPLETE
1908,0.3600658176086979,2025-04-24 22:12:30.278640,2025-04-24 22:12:33.638692,0 days 00:00:03.360052,0.07001413851288286,8,,2,20,691,0.6225442349604225,TPESampler,COMPLETE
1909,0.3227355417438404,2025-04-24 22:12:30.604633,2025-04-24 22:12:32.243821,0 days 00:00:01.639188,0.07077329320766168,11,log2,1,17,590,0.761140166152673,TPESampler,COMPLETE
1910,0.28021910580998044,2025-04-24 22:12:32.066880,2025-04-24 22:12:34.877280,0 days 00:00:02.810400,0.07577686896297972,8,log2,1,20,1064,0.7107172551839037,TPESampler,COMPLETE
1911,0.7448269458420115,2025-04-24 22:12:32.514761,2025-04-24 22:12:33.904042,0 days 00:00:01.389281,0.08571901166325809,3,log2,2,6,357,0.6896650209007125,TPESampler,COMPLETE
1912,0.30611833652067255,2025-04-24 22:12:33.853850,2025-04-24 22:12:36.535436,0 days 00:00:02.681586,0.07864376112284119,10,log2,2,20,919,0.7615602589296557,TPESampler,COMPLETE
1913,0.5223648151893,2025-04-24 22:12:34.176974,2025-04-24 22:12:36.344567,0 days 00:00:02.167593,0.029486187351972774,8,sqrt,9,17,496,0.9954699074738552,TPESampler,COMPLETE
1914,0.2899792308086365,2025-04-24 22:12:35.125328,2025-04-24 22:12:38.820613,0 days 00:00:03.695285,0.09811945838184272,6,sqrt,2,10,1200,0.6302937675057115,TPESampler,COMPLETE
1915,0.28261679802448775,2025-04-24 22:12:36.546534,2025-04-24 22:12:40.046188,0 days 00:00:03.499654,0.06004647665420316,3,sqrt,1,12,1169,0.6909941649712646,TPESampler,COMPLETE
1916,0.28304138444635935,2025-04-24 22:12:36.733977,2025-04-24 22:12:40.047680,0 days 00:00:03.313703,0.07836698712396825,11,log2,2,20,1084,0.7207835063481295,TPESampler,COMPLETE
1917,0.28012827270622426,2025-04-24 22:12:39.034816,2025-04-24 22:12:42.120154,0 days 00:00:03.085338,0.0761164621351505,12,log2,2,19,1335,0.7223329293335045,TPESampler,COMPLETE
1918,0.29222167229945867,2025-04-24 22:12:40.220339,2025-04-24 22:12:43.741865,0 days 00:00:03.521526,0.06398752476246117,7,sqrt,1,12,1302,0.7822867789541068,TPESampler,COMPLETE
1919,0.28074560330362575,2025-04-24 22:12:40.273549,2025-04-24 22:12:43.642973,0 days 00:00:03.369424,0.05778769177047469,3,sqrt,2,5,1166,0.7199971667477522,TPESampler,COMPLETE
1920,0.2715004072058671,2025-04-24 22:12:42.534694,2025-04-24 22:12:45.570139,0 days 00:00:03.035445,0.0835457686133932,11,log2,1,19,1353,0.6425136504712405,TPESampler,COMPLETE
1921,0.2722767086333968,2025-04-24 22:12:43.920315,2025-04-24 22:12:47.248070,0 days 00:00:03.327755,0.07325311231506378,4,sqrt,1,12,1325,0.7310754080558911,TPESampler,COMPLETE
1922,0.3112353202455833,2025-04-24 22:12:44.025293,2025-04-24 22:12:48.104255,0 days 00:00:04.078962,0.09751696026050685,6,sqrt,2,15,1417,0.6024354301482797,TPESampler,COMPLETE
1923,0.3021380305429901,2025-04-24 22:12:46.133243,2025-04-24 22:12:49.055978,0 days 00:00:02.922735,0.058745658548774414,10,log2,2,16,1164,0.6482451884071345,TPESampler,COMPLETE
1924,0.2615822194737751,2025-04-24 22:12:47.857372,2025-04-24 22:12:51.499825,0 days 00:00:03.642453,0.0674859706419013,11,log2,1,19,1148,0.7309400010181598,TPESampler,COMPLETE
1925,0.2927279286808687,2025-04-24 22:12:48.450155,2025-04-24 22:12:51.995777,0 days 00:00:03.545622,0.053378193523650676,10,log2,3,20,1399,0.7277974171406947,TPESampler,COMPLETE
1926,0.8282487088654917,2025-04-24 22:12:49.650010,2025-04-24 22:12:51.550051,0 days 00:00:01.900041,0.019692161983447875,8,sqrt,2,2,123,0.6367519338236269,TPESampler,COMPLETE
1927,0.3094319523710614,2025-04-24 22:12:51.813403,2025-04-24 22:12:57.139400,0 days 00:00:05.325997,0.09661585503232197,3,log2,1,16,1470,0.74129168001561,TPESampler,COMPLETE
1928,0.2624561752804611,2025-04-24 22:12:51.933094,2025-04-24 22:12:57.019997,0 days 00:00:05.086903,0.08806030685984552,11,log2,1,18,1191,0.7271131889939203,TPESampler,COMPLETE
1929,0.37890191379095384,2025-04-24 22:12:53.567593,2025-04-24 22:12:57.455139,0 days 00:00:03.887546,0.09639606577689797,10,log2,6,14,1302,0.8045877776200812,TPESampler,COMPLETE
1930,0.2641964020431054,2025-04-24 22:12:57.217491,2025-04-24 22:13:01.142811,0 days 00:00:03.925320,0.09741758552849691,7,sqrt,1,20,1146,0.7285009044449006,TPESampler,COMPLETE
1931,0.2512239618377092,2025-04-24 22:12:57.357693,2025-04-24 22:13:01.767530,0 days 00:00:04.409837,0.09767989308918633,5,sqrt,1,14,1316,0.7055070039389352,TPESampler,COMPLETE
1932,0.5062551204065739,2025-04-24 22:12:57.936864,2025-04-24 22:13:02.036769,0 days 00:00:04.099905,0.014901117972547994,11,sqrt,9,4,1389,0.8167875475842318,TPESampler,COMPLETE
1933,0.28005059040446256,2025-04-24 22:13:01.358163,2025-04-24 22:13:05.576994,0 days 00:00:04.218831,0.06340550007470294,5,sqrt,1,14,1469,0.7284541417984434,TPESampler,COMPLETE
1934,0.24887672303668945,2025-04-24 22:13:01.985106,2025-04-24 22:13:05.876866,0 days 00:00:03.891760,0.0736184802501074,3,sqrt,1,15,1465,0.6086919503421482,TPESampler,COMPLETE
1935,0.29918122479918585,2025-04-24 22:13:02.294946,2025-04-24 22:13:05.785918,0 days 00:00:03.490972,0.09904661142263961,4,sqrt,1,17,1235,0.7760720301102393,TPESampler,COMPLETE
1936,0.2555738521797612,2025-04-24 22:13:05.752875,2025-04-24 22:13:09.836281,0 days 00:00:04.083406,0.09100806090521461,4,sqrt,1,19,1282,0.69572656856708,TPESampler,COMPLETE
1937,0.2754209457706415,2025-04-24 22:13:05.984640,2025-04-24 22:13:09.930790,0 days 00:00:03.946150,0.06385514915417499,3,sqrt,1,20,1292,0.7226620470410565,TPESampler,COMPLETE
1938,0.5114554637424998,2025-04-24 22:13:06.236661,2025-04-24 22:13:09.834694,0 days 00:00:03.598033,0.02942659805093449,6,sqrt,9,13,1125,0.6063811116091893,TPESampler,COMPLETE
1939,0.813325470774358,2025-04-24 22:13:10.006837,2025-04-24 22:13:12.097314,0 days 00:00:02.090477,0.0628933799953289,4,log2,7,11,562,0.6233001993543739,TPESampler,COMPLETE
1940,0.28264103293821835,2025-04-24 22:13:10.017531,2025-04-24 22:13:13.748063,0 days 00:00:03.730532,0.08888256052848281,9,log2,2,20,1426,0.7103315844624085,TPESampler,COMPLETE
1941,1.0482543926690049,2025-04-24 22:13:10.143146,2025-04-24 22:13:12.150544,0 days 00:00:02.007398,0.025452831548196834,4,log2,8,14,417,0.9965673481302193,TPESampler,COMPLETE
1942,0.29954215612282825,2025-04-24 22:13:12.274427,2025-04-24 22:13:16.823626,0 days 00:00:04.549199,0.09750534143876463,4,sqrt,1,19,1455,0.6629087535509377,TPESampler,COMPLETE
1943,0.3726019801018572,2025-04-24 22:13:12.332994,2025-04-24 22:13:16.865783,0 days 00:00:04.532789,0.01709427801668709,12,log2,1,10,1296,0.6188293280173035,TPESampler,COMPLETE
1944,0.24493279831356454,2025-04-24 22:13:13.999285,2025-04-24 22:13:17.502819,0 days 00:00:03.503534,0.06630414894310743,5,sqrt,1,19,1213,0.6115145010676216,TPESampler,COMPLETE
1945,0.3698786721371898,2025-04-24 22:13:17.011032,2025-04-24 22:13:24.030150,0 days 00:00:07.019118,0.06529352026550908,10,,2,15,1495,0.6077612244428282,TPESampler,COMPLETE
1946,0.29733196504557574,2025-04-24 22:13:17.064992,2025-04-24 22:13:20.805497,0 days 00:00:03.740505,0.06324959974213733,10,log2,1,19,1398,0.7240829487295295,TPESampler,COMPLETE
1947,0.27943177484934256,2025-04-24 22:13:17.757317,2025-04-24 22:13:21.452150,0 days 00:00:03.694833,0.07321485736389514,8,sqrt,1,15,1478,0.605871532507623,TPESampler,COMPLETE
1948,0.3269302022922943,2025-04-24 22:13:20.992761,2025-04-24 22:13:23.896492,0 days 00:00:02.903731,0.08087726982481577,4,,1,14,627,0.9457195588096757,TPESampler,COMPLETE
1949,0.2459438728681749,2025-04-24 22:13:21.689619,2025-04-24 22:13:24.421998,0 days 00:00:02.732379,0.08015662560495669,7,sqrt,1,12,1491,0.6172292103841708,TPESampler,COMPLETE
1950,0.30633314681253476,2025-04-24 22:13:24.100049,2025-04-24 22:13:28.177326,0 days 00:00:04.077277,0.08668331275273337,9,sqrt,4,15,1355,0.6045644989331997,TPESampler,COMPLETE
1951,0.24886201969166774,2025-04-24 22:13:24.222303,2025-04-24 22:13:27.924752,0 days 00:00:03.702449,0.09175168520104414,4,sqrt,1,5,1172,0.7699933124508401,TPESampler,COMPLETE
1952,0.23292325646341835,2025-04-24 22:13:24.731083,2025-04-24 22:13:28.834661,0 days 00:00:04.103578,0.09486211845934275,5,sqrt,1,15,1464,0.6588532608481777,TPESampler,COMPLETE
1953,0.25751395697366014,2025-04-24 22:13:28.110228,2025-04-24 22:13:30.986875,0 days 00:00:02.876647,0.07349373433667811,7,sqrt,1,18,1188,0.6011264338170693,TPESampler,COMPLETE
1954,0.37412539908110276,2025-04-24 22:13:28.456842,2025-04-24 22:13:32.047276,0 days 00:00:03.590434,0.07179954445303353,9,sqrt,2,17,1402,0.6888228572483289,TPESampler,COMPLETE
1955,0.29531378873037933,2025-04-24 22:13:29.043541,2025-04-24 22:13:32.404794,0 days 00:00:03.361253,0.08022784917834898,5,sqrt,2,10,1432,0.7241457179193952,TPESampler,COMPLETE
1956,0.3107462113196681,2025-04-24 22:13:31.160821,2025-04-24 22:13:33.334209,0 days 00:00:02.173388,0.06145072238972727,5,sqrt,4,20,756,0.6782733137770385,TPESampler,COMPLETE
1957,0.318103930022828,2025-04-24 22:13:32.223431,2025-04-24 22:13:36.283257,0 days 00:00:04.059826,0.07526613450240603,6,sqrt,1,19,1408,0.681306595246605,TPESampler,COMPLETE
1958,0.31174808041730956,2025-04-24 22:13:32.665756,2025-04-24 22:13:36.416975,0 days 00:00:03.751219,0.054792033216291135,5,log2,2,15,1342,0.603481038448454,TPESampler,COMPLETE
1959,0.3058582053703189,2025-04-24 22:13:33.566999,2025-04-24 22:13:37.620332,0 days 00:00:04.053333,0.0782071111918968,7,sqrt,1,16,1490,0.6714465571669609,TPESampler,COMPLETE
1960,0.32963067615942465,2025-04-24 22:13:36.435572,2025-04-24 22:13:40.612670,0 days 00:00:04.177098,0.09775738838190548,9,sqrt,4,18,1466,0.6869416819632062,TPESampler,COMPLETE
1961,0.4992680769581116,2025-04-24 22:13:36.647204,2025-04-24 22:13:39.224311,0 days 00:00:02.577107,0.08591507476867573,7,log2,8,13,894,0.8157539143445971,TPESampler,COMPLETE
1962,0.26704680332630454,2025-04-24 22:13:37.800970,2025-04-24 22:13:42.151249,0 days 00:00:04.350279,0.09943584171131678,11,sqrt,1,17,1465,0.6573739264050927,TPESampler,COMPLETE
1963,0.4488756296760654,2025-04-24 22:13:39.444696,2025-04-24 22:13:41.513391,0 days 00:00:02.068695,0.020372154901140364,7,sqrt,5,11,499,0.9412904968557573,TPESampler,COMPLETE
1964,0.24452673520204882,2025-04-24 22:13:40.827902,2025-04-24 22:13:47.089169,0 days 00:00:06.261267,0.08106177473582257,6,,1,18,1435,0.6071306463219571,TPESampler,COMPLETE
1965,0.2882664984364137,2025-04-24 22:13:41.733775,2025-04-24 22:13:45.414511,0 days 00:00:03.680736,0.07500940125614193,6,sqrt,3,14,1434,0.6000383037059313,TPESampler,COMPLETE
1966,0.31726629450133126,2025-04-24 22:13:42.385485,2025-04-24 22:13:46.049080,0 days 00:00:03.663595,0.0937772516238762,4,sqrt,4,11,1465,0.6890944143713622,TPESampler,COMPLETE
1967,1.016261615122189,2025-04-24 22:13:45.627624,2025-04-24 22:13:46.812653,0 days 00:00:01.185029,0.017083999508480174,12,log2,3,4,181,0.9330541472098742,TPESampler,COMPLETE
1968,0.8885693897583709,2025-04-24 22:13:46.277155,2025-04-24 22:13:47.824093,0 days 00:00:01.546938,0.03718621018682998,7,log2,6,20,389,0.9747504507538622,TPESampler,COMPLETE
1969,0.2887173355264613,2025-04-24 22:13:47.043281,2025-04-24 22:13:51.203959,0 days 00:00:04.160678,0.09359089533524306,3,sqrt,2,9,1405,0.7658191059935013,TPESampler,COMPLETE
1970,0.28911829521110105,2025-04-24 22:13:47.323633,2025-04-24 22:13:50.676605,0 days 00:00:03.352972,0.08729814947991897,10,log2,1,20,1050,0.7011304856623594,TPESampler,COMPLETE
1971,0.3040514557823391,2025-04-24 22:13:48.105650,2025-04-24 22:13:51.202726,0 days 00:00:03.097076,0.09846656050752409,3,log2,1,6,1054,0.700107951320838,TPESampler,COMPLETE
1972,0.24628313845507943,2025-04-24 22:13:50.844183,2025-04-24 22:13:54.035319,0 days 00:00:03.191136,0.09004270635971241,3,sqrt,1,6,1268,0.7479954796882836,TPESampler,COMPLETE
