number,value,datetime_start,datetime_complete,duration,params_learning_rate,params_max_depth,params_max_features,params_min_samples_leaf,params_min_samples_split,params_n_estimators,params_subsample,system_attrs_auto:sampler,state
741,0.28001044870603586,2025-04-24 21:49:10.151203,2025-04-24 21:49:14.537666,0 days 00:00:04.386463,0.09619016865365695,3,,1,13,1317,0.612005086760772,TPESampler,COMPLETE
742,0.2856868324311673,2025-04-24 21:49:11.012256,2025-04-24 21:49:14.541066,0 days 00:00:03.528810,0.05297090225230993,5,sqrt,2,15,1475,0.6269296426609408,TPESampler,COMPLETE
743,0.2681363581057246,2025-04-24 21:49:11.301102,2025-04-24 21:49:14.970212,0 days 00:00:03.669110,0.05210704779653816,6,sqrt,1,18,1301,0.6904760814266123,TPESampler,COMPLETE
744,0.4224678024418714,2025-04-24 21:49:14.696339,2025-04-24 21:49:16.725848,0 days 00:00:02.029509,0.09781099300911643,3,log2,4,20,620,0.8520662581839249,TPESampler,COMPLETE
745,0.2821800922691302,2025-04-24 21:49:14.741966,2025-04-24 21:49:19.010986,0 days 00:00:04.269020,0.07080262650630272,6,sqrt,2,20,1388,0.6154251209110713,TPESampler,COMPLETE
746,0.3120472105887085,2025-04-24 21:49:15.391954,2025-04-24 21:49:19.663609,0 days 00:00:04.271655,0.09549558164563182,7,sqrt,2,15,1464,0.6784756330095979,TPESampler,COMPLETE
747,0.2857334907508948,2025-04-24 21:49:16.921246,2025-04-24 21:49:20.270744,0 days 00:00:03.349498,0.07898761086371393,5,sqrt,1,15,1435,0.7246021881886587,TPESampler,COMPLETE
748,0.29210940730379076,2025-04-24 21:49:19.236787,2025-04-24 21:49:22.539221,0 days 00:00:03.302434,0.08437760241542967,6,sqrt,2,12,1486,0.6027357202767778,TPESampler,COMPLETE
749,0.9412146222273375,2025-04-24 21:49:19.961806,2025-04-24 21:49:21.437609,0 days 00:00:01.475803,0.03558268602754529,11,log2,7,13,398,0.9313549303619848,TPESampler,COMPLETE
750,0.343345941028082,2025-04-24 21:49:20.473286,2025-04-24 21:49:22.374298,0 days 00:00:01.901012,0.09123889417987968,6,,5,16,310,0.7943468860978258,TPESampler,COMPLETE
751,0.2676778658794689,2025-04-24 21:49:21.627871,2025-04-24 21:49:24.680918,0 days 00:00:03.053047,0.05985650947708494,6,sqrt,1,20,1197,0.6091803037454644,TPESampler,COMPLETE
752,0.8621793932720386,2025-04-24 21:49:22.533222,2025-04-24 21:49:24.023623,0 days 00:00:01.490401,0.013908430897113916,9,sqrt,10,10,392,0.9503107533209051,TPESampler,COMPLETE
753,0.31105307744531685,2025-04-24 21:49:22.726914,2025-04-24 21:49:25.769978,0 days 00:00:03.043064,0.05962760387443768,3,sqrt,3,7,1151,0.7671537730414589,TPESampler,COMPLETE
754,0.3205415315203068,2025-04-24 21:49:24.265306,2025-04-24 21:49:26.844447,0 days 00:00:02.579141,0.08880256875502321,8,log2,3,20,890,0.63291917577824,TPESampler,COMPLETE
755,0.22318572100365736,2025-04-24 21:49:24.886493,2025-04-24 21:49:28.435862,0 days 00:00:03.549369,0.09532183319052374,6,sqrt,1,10,1444,0.6441586043076666,TPESampler,COMPLETE
756,0.7824970773744113,2025-04-24 21:49:25.985241,2025-04-24 21:49:27.327245,0 days 00:00:01.342004,0.06023085279240931,5,log2,4,12,257,0.8527180630370663,TPESampler,COMPLETE
757,0.33483932462673416,2025-04-24 21:49:27.041088,2025-04-24 21:49:30.119132,0 days 00:00:03.078044,0.09843069577270439,5,sqrt,4,19,1202,0.641374202929455,TPESampler,COMPLETE
758,0.3034211826114546,2025-04-24 21:49:27.515347,2025-04-24 21:49:30.336217,0 days 00:00:02.820870,0.0898919961773207,4,sqrt,1,7,1121,0.7886999636329141,TPESampler,COMPLETE
759,0.3115322813109976,2025-04-24 21:49:28.597997,2025-04-24 21:49:31.716804,0 days 00:00:03.118807,0.06213675055348972,6,sqrt,3,14,1200,0.6338929798848959,TPESampler,COMPLETE
760,0.2678877458552515,2025-04-24 21:49:30.297136,2025-04-24 21:49:34.275348,0 days 00:00:03.978212,0.08445506315139349,5,sqrt,1,6,1465,0.7689685699964894,TPESampler,COMPLETE
761,0.2601923528672197,2025-04-24 21:49:30.522130,2025-04-24 21:49:34.325788,0 days 00:00:03.803658,0.09958597982048127,6,sqrt,1,16,1299,0.6030350791854451,TPESampler,COMPLETE
762,0.28886516037696086,2025-04-24 21:49:31.918694,2025-04-24 21:49:35.253670,0 days 00:00:03.334976,0.07759096312047659,4,sqrt,3,7,1495,0.7137328167532991,TPESampler,COMPLETE
763,0.26171011063133487,2025-04-24 21:49:34.404621,2025-04-24 21:49:38.153150,0 days 00:00:03.748529,0.060817390127369454,7,sqrt,1,12,1431,0.7010353729231574,TPESampler,COMPLETE
764,0.8968925453725766,2025-04-24 21:49:34.530298,2025-04-24 21:49:36.397232,0 days 00:00:01.866934,0.04313271345061082,12,log2,10,7,625,0.7197634674068205,TPESampler,COMPLETE
765,0.3030403373344291,2025-04-24 21:49:35.493793,2025-04-24 21:49:38.637081,0 days 00:00:03.143288,0.06111486407671367,5,sqrt,1,11,1203,0.7020051432551532,TPESampler,COMPLETE
766,0.24034968494442502,2025-04-24 21:49:36.661998,2025-04-24 21:49:40.285081,0 days 00:00:03.623083,0.0944007998473667,5,sqrt,1,17,1416,0.6243044838704336,TPESampler,COMPLETE
767,0.28149799483633037,2025-04-24 21:49:38.327002,2025-04-24 21:49:41.344716,0 days 00:00:03.017714,0.09549360464129757,3,sqrt,2,12,1282,0.707896238296698,TPESampler,COMPLETE
768,0.3600967156567104,2025-04-24 21:49:38.791141,2025-04-24 21:49:42.097762,0 days 00:00:03.306621,0.024178848228142678,12,sqrt,5,5,1284,0.9455700194716601,TPESampler,COMPLETE
769,0.28503495940199064,2025-04-24 21:49:40.493077,2025-04-24 21:49:43.417153,0 days 00:00:02.924076,0.08351514366145972,5,sqrt,1,17,1326,0.600117394910846,TPESampler,COMPLETE
770,0.8266884098687421,2025-04-24 21:49:41.515878,2025-04-24 21:49:43.331370,0 days 00:00:01.815492,0.010661741760198204,3,sqrt,1,15,664,0.7982651083086431,TPESampler,COMPLETE
771,0.41166067278868235,2025-04-24 21:49:42.256951,2025-04-24 21:49:43.372808,0 days 00:00:01.115857,0.04532811411812702,6,sqrt,1,14,263,0.6131948619023238,TPESampler,COMPLETE
772,0.2643007352569287,2025-04-24 21:49:43.451489,2025-04-24 21:49:46.452446,0 days 00:00:03.000957,0.09934376124901018,4,sqrt,2,14,1165,0.8396887103246979,TPESampler,COMPLETE
773,0.2545524786128791,2025-04-24 21:49:43.496185,2025-04-24 21:49:47.426096,0 days 00:00:03.929911,0.09596677362804606,9,sqrt,1,17,1395,0.7382507950118237,TPESampler,COMPLETE
774,0.29140347053918836,2025-04-24 21:49:43.607308,2025-04-24 21:49:47.656321,0 days 00:00:04.049013,0.0792851756633312,5,sqrt,2,20,1495,0.6029846551507129,TPESampler,COMPLETE
775,0.46070495514662074,2025-04-24 21:49:46.659275,2025-04-24 21:49:48.887244,0 days 00:00:02.227969,0.09471744736667927,11,,10,12,331,0.7482202134331021,TPESampler,COMPLETE
776,0.28441907941448563,2025-04-24 21:49:47.611844,2025-04-24 21:49:50.970964,0 days 00:00:03.359120,0.06164954820607251,5,sqrt,1,3,1488,0.7530812246573889,TPESampler,COMPLETE
777,0.27079531137146806,2025-04-24 21:49:47.897882,2025-04-24 21:49:51.318445,0 days 00:00:03.420563,0.054335541884107726,5,sqrt,1,17,1488,0.6942993819060552,TPESampler,COMPLETE
778,0.26944808500338496,2025-04-24 21:49:49.059511,2025-04-24 21:49:52.139736,0 days 00:00:03.080225,0.06872828947677827,4,sqrt,1,14,1480,0.8311210841558216,TPESampler,COMPLETE
779,0.40448916250608913,2025-04-24 21:49:51.136168,2025-04-24 21:49:53.820270,0 days 00:00:02.684102,0.022906151961960504,10,sqrt,7,11,1310,0.7582568299663114,TPESampler,COMPLETE
780,0.41016244268834523,2025-04-24 21:49:51.587594,2025-04-24 21:49:56.501425,0 days 00:00:04.913831,0.013263278707374862,7,,8,10,1057,0.7947483690599321,TPESampler,COMPLETE
781,0.23473497196093274,2025-04-24 21:49:52.411469,2025-04-24 21:49:55.840077,0 days 00:00:03.428608,0.06612197962406402,7,sqrt,1,17,1469,0.6188779726112453,TPESampler,COMPLETE
782,0.2803176586488622,2025-04-24 21:49:54.022710,2025-04-24 21:49:57.420471,0 days 00:00:03.397761,0.06831711942042547,7,sqrt,1,9,1429,0.6129932985690573,TPESampler,COMPLETE
783,0.29683830362268654,2025-04-24 21:49:56.055664,2025-04-24 21:49:59.630035,0 days 00:00:03.574371,0.09762678536008777,7,sqrt,2,8,1219,0.7077458601216827,TPESampler,COMPLETE
784,0.2789642903266158,2025-04-24 21:49:56.698662,2025-04-24 21:50:00.784899,0 days 00:00:04.086237,0.06586786731720629,9,sqrt,1,15,1488,0.687053051382237,TPESampler,COMPLETE
785,0.27289422186951495,2025-04-24 21:49:57.627678,2025-04-24 21:50:01.508204,0 days 00:00:03.880526,0.06618823527805756,8,sqrt,1,17,1384,0.6986124805762979,TPESampler,COMPLETE
786,0.2741864110243174,2025-04-24 21:49:59.804511,2025-04-24 21:50:02.983377,0 days 00:00:03.178866,0.05754735390859089,3,sqrt,1,5,1173,0.7389553032586005,TPESampler,COMPLETE
787,0.3002228598869333,2025-04-24 21:50:00.988728,2025-04-24 21:50:04.825502,0 days 00:00:03.836774,0.09021699338734643,5,sqrt,3,2,1445,0.6738112891699671,TPESampler,COMPLETE
788,0.27831147304722337,2025-04-24 21:50:01.700748,2025-04-24 21:50:04.827227,0 days 00:00:03.126479,0.09011979101314692,5,sqrt,1,2,1120,0.7620103193204968,TPESampler,COMPLETE
789,0.3287924685078417,2025-04-24 21:50:03.267722,2025-04-24 21:50:06.311989,0 days 00:00:03.044267,0.05516893135131312,7,sqrt,4,16,1481,0.6448611445335903,TPESampler,COMPLETE
790,0.8740612252990781,2025-04-24 21:50:04.989462,2025-04-24 21:50:08.237805,0 days 00:00:03.248343,0.02254036263975117,6,log2,8,5,850,0.8255596863764338,TPESampler,COMPLETE
791,0.29140682811633484,2025-04-24 21:50:05.068398,2025-04-24 21:50:09.565499,0 days 00:00:04.497101,0.0489543143054267,8,sqrt,2,18,1322,0.6158144288580925,TPESampler,COMPLETE
792,0.27230138435202494,2025-04-24 21:50:06.541679,2025-04-24 21:50:10.624213,0 days 00:00:04.082534,0.06441994747165729,6,sqrt,2,17,1386,0.6286070380521707,TPESampler,COMPLETE
793,0.2916645342521658,2025-04-24 21:50:08.449320,2025-04-24 21:50:12.123174,0 days 00:00:03.673854,0.052209331589306955,8,sqrt,1,18,1197,0.6122234705895185,TPESampler,COMPLETE
794,0.347217647898655,2025-04-24 21:50:09.776256,2025-04-24 21:50:12.480394,0 days 00:00:02.704138,0.0359556679318979,10,sqrt,5,6,964,0.6966309493937558,TPESampler,COMPLETE
795,0.24203413963003637,2025-04-24 21:50:10.830894,2025-04-24 21:50:14.292481,0 days 00:00:03.461587,0.07919783572631282,8,sqrt,1,15,1496,0.6064911354084546,TPESampler,COMPLETE
796,0.26768322442495907,2025-04-24 21:50:12.427613,2025-04-24 21:50:18.003739,0 days 00:00:05.576126,0.0651534067210349,7,,1,15,1439,0.6077083138515202,TPESampler,COMPLETE
797,0.3014665475081889,2025-04-24 21:50:12.748595,2025-04-24 21:50:14.122979,0 days 00:00:01.374384,0.091111980698769,8,,1,18,152,0.9161814099665438,TPESampler,COMPLETE
798,0.36633420337448136,2025-04-24 21:50:14.343849,2025-04-24 21:50:16.302696,0 days 00:00:01.958847,0.04111689450041608,6,,6,18,431,0.614646034225123,TPESampler,COMPLETE
799,0.2918090195897994,2025-04-24 21:50:14.527777,2025-04-24 21:50:17.417903,0 days 00:00:02.890126,0.0697582581311793,7,sqrt,1,17,1333,0.6997592325388432,TPESampler,COMPLETE
800,0.3178368037305311,2025-04-24 21:50:16.496759,2025-04-24 21:50:20.172109,0 days 00:00:03.675350,0.0698660021592038,9,sqrt,1,18,1487,0.6152430299223174,TPESampler,COMPLETE
801,0.29477894358431495,2025-04-24 21:50:17.625301,2025-04-24 21:50:20.300281,0 days 00:00:02.674980,0.07681289092100785,10,log2,4,2,1322,0.9773392885795271,TPESampler,COMPLETE
802,0.35836966322521074,2025-04-24 21:50:18.203264,2025-04-24 21:50:20.516193,0 days 00:00:02.312929,0.06220245940191336,8,,2,7,324,0.8888381047923173,TPESampler,COMPLETE
803,0.3615561040082884,2025-04-24 21:50:20.356847,2025-04-24 21:50:24.727333,0 days 00:00:04.370486,0.09843249771188195,3,,7,9,1121,0.7196575012148915,TPESampler,COMPLETE
804,0.30394710659112045,2025-04-24 21:50:20.524604,2025-04-24 21:50:24.661866,0 days 00:00:04.137262,0.012835771161251742,11,sqrt,2,2,1431,0.9048465792177423,TPESampler,COMPLETE
805,0.28521780623136117,2025-04-24 21:50:21.065309,2025-04-24 21:50:24.483741,0 days 00:00:03.418432,0.09733376274303782,3,sqrt,1,8,1311,0.7654819758924444,TPESampler,COMPLETE
806,0.3849296115164932,2025-04-24 21:50:24.761056,2025-04-24 21:50:28.485861,0 days 00:00:03.724805,0.038746117864932,5,log2,4,15,1404,0.6393049704474798,TPESampler,COMPLETE
807,0.27207806540095403,2025-04-24 21:50:24.981451,2025-04-24 21:50:29.560416,0 days 00:00:04.578965,0.0360695964522083,8,sqrt,1,16,1477,0.6190052454486048,TPESampler,COMPLETE
808,0.2605764154752165,2025-04-24 21:50:25.069649,2025-04-24 21:50:28.838531,0 days 00:00:03.768882,0.06391582645943122,7,sqrt,1,13,1111,0.606439688686511,TPESampler,COMPLETE
809,1.2224264790692843,2025-04-24 21:50:28.793142,2025-04-24 21:50:29.841514,0 days 00:00:01.048372,0.016258431069893744,8,log2,4,3,111,0.8437842116141767,TPESampler,COMPLETE
810,0.27578720545777613,2025-04-24 21:50:29.083509,2025-04-24 21:50:33.524976,0 days 00:00:04.441467,0.05792639550891734,8,sqrt,1,14,1451,0.6451706437119139,TPESampler,COMPLETE
811,0.3093902913831033,2025-04-24 21:50:29.789402,2025-04-24 21:50:33.874462,0 days 00:00:04.085060,0.0833943345817602,7,sqrt,1,17,1407,0.6871142247804405,TPESampler,COMPLETE
812,0.27164106541555255,2025-04-24 21:50:30.052019,2025-04-24 21:50:34.275481,0 days 00:00:04.223462,0.09341757806672135,4,sqrt,3,13,1473,0.7278992573407778,TPESampler,COMPLETE
813,0.2394379726166987,2025-04-24 21:50:33.730226,2025-04-24 21:50:37.800268,0 days 00:00:04.070042,0.08861024206782145,3,sqrt,1,7,1413,0.6535497192073398,TPESampler,COMPLETE
814,0.2741887169106286,2025-04-24 21:50:34.095107,2025-04-24 21:50:38.656180,0 days 00:00:04.561073,0.03817596182084342,5,sqrt,1,10,1470,0.7108259898975451,TPESampler,COMPLETE
815,0.26766794574964886,2025-04-24 21:50:34.651622,2025-04-24 21:50:38.733207,0 days 00:00:04.081585,0.05690699666311457,5,sqrt,1,4,1346,0.6589134121857579,TPESampler,COMPLETE
816,0.2539623894237413,2025-04-24 21:50:38.003158,2025-04-24 21:50:41.681273,0 days 00:00:03.678115,0.05831534287131546,4,sqrt,1,3,1480,0.6663334640986203,TPESampler,COMPLETE
817,0.40186413560350054,2025-04-24 21:50:38.828920,2025-04-24 21:50:42.095224,0 days 00:00:03.266304,0.08903921928489479,9,log2,7,3,1496,0.8196608972844327,TPESampler,COMPLETE
818,1.1559702935776384,2025-04-24 21:50:38.875106,2025-04-24 21:50:40.046360,0 days 00:00:01.171254,0.02495622226273608,3,sqrt,1,12,116,0.9783183048088928,TPESampler,COMPLETE
819,0.3484241870877088,2025-04-24 21:50:40.250244,2025-04-24 21:50:46.432489,0 days 00:00:06.182245,0.05654335756837637,9,,5,16,1189,0.7934256461453193,TPESampler,COMPLETE
820,0.2551282194054612,2025-04-24 21:50:41.872002,2025-04-24 21:50:44.651065,0 days 00:00:02.779063,0.09758332276703202,3,sqrt,1,6,1195,0.6234407826294756,TPESampler,COMPLETE
821,0.2893790839716072,2025-04-24 21:50:42.309442,2025-04-24 21:50:45.454056,0 days 00:00:03.144614,0.09864003187023626,3,sqrt,3,8,1442,0.6806412237064001,TPESampler,COMPLETE
822,0.3379680058175482,2025-04-24 21:50:44.840899,2025-04-24 21:50:46.385601,0 days 00:00:01.544702,0.08373690000374613,7,log2,2,11,748,0.6915168828792166,TPESampler,COMPLETE
823,0.2798593090216457,2025-04-24 21:50:45.656428,2025-04-24 21:50:50.453915,0 days 00:00:04.797487,0.05925877928442176,4,,3,6,1286,0.8798389428653811,TPESampler,COMPLETE
824,0.288043814506875,2025-04-24 21:50:46.526743,2025-04-24 21:50:49.176280,0 days 00:00:02.649537,0.04950029678393167,3,sqrt,2,6,1369,0.6255917661078959,TPESampler,COMPLETE
825,0.45622596337044397,2025-04-24 21:50:46.578057,2025-04-24 21:50:49.202252,0 days 00:00:02.624195,0.037758644455080606,8,,10,13,494,0.7665329494070406,TPESampler,COMPLETE
826,0.2773877231226251,2025-04-24 21:50:49.311285,2025-04-24 21:50:53.302808,0 days 00:00:03.991523,0.06087811025502184,5,sqrt,2,19,1499,0.6023231740641127,TPESampler,COMPLETE
827,0.3309770239196024,2025-04-24 21:50:49.350508,2025-04-24 21:50:53.046083,0 days 00:00:03.695575,0.06268424682782198,3,log2,1,7,1370,0.6379447070551184,TPESampler,COMPLETE
828,0.28292497510945847,2025-04-24 21:50:50.662288,2025-04-24 21:50:54.619268,0 days 00:00:03.956980,0.09238956693811674,5,sqrt,2,7,1427,0.6534560274806223,TPESampler,COMPLETE
829,0.2869097067158971,2025-04-24 21:50:53.242417,2025-04-24 21:50:56.506920,0 days 00:00:03.264503,0.09756446773354138,3,sqrt,2,8,1236,0.6503161066406586,TPESampler,COMPLETE
830,0.2561017801186108,2025-04-24 21:50:53.517263,2025-04-24 21:50:57.289974,0 days 00:00:03.772711,0.09728703905391545,8,log2,1,19,1322,0.7169300192260486,TPESampler,COMPLETE
831,0.2528467686251207,2025-04-24 21:50:54.828711,2025-04-24 21:50:58.328195,0 days 00:00:03.499484,0.07942532871048022,6,sqrt,1,7,1236,0.6928270962468105,TPESampler,COMPLETE
832,0.24385018307132536,2025-04-24 21:50:56.693984,2025-04-24 21:51:00.031595,0 days 00:00:03.337611,0.0979704688966711,7,sqrt,1,19,1155,0.6529605868725941,TPESampler,COMPLETE
833,0.47639195372560084,2025-04-24 21:50:57.517791,2025-04-24 21:51:00.793232,0 days 00:00:03.275441,0.029184227228802272,3,log2,2,18,1262,0.7880382054613867,TPESampler,COMPLETE
834,0.28160553281815853,2025-04-24 21:50:58.546691,2025-04-24 21:51:02.427908,0 days 00:00:03.881217,0.07721689920578738,3,sqrt,2,6,1490,0.6839638259579904,TPESampler,COMPLETE
835,0.281893061513532,2025-04-24 21:51:00.232098,2025-04-24 21:51:03.412164,0 days 00:00:03.180066,0.05302060148418654,3,sqrt,3,10,1470,0.7190526700251743,TPESampler,COMPLETE
836,0.3897168811415093,2025-04-24 21:51:00.983459,2025-04-24 21:51:04.258567,0 days 00:00:03.275108,0.04805506310251061,11,,7,20,568,0.6697518969159928,TPESampler,COMPLETE
837,0.2467195153131953,2025-04-24 21:51:02.631318,2025-04-24 21:51:05.646626,0 days 00:00:03.015308,0.07913336769742346,6,sqrt,1,10,1242,0.698860506217766,TPESampler,COMPLETE
838,0.32065312418500336,2025-04-24 21:51:03.596148,2025-04-24 21:51:07.200328,0 days 00:00:03.604180,0.09064489637072955,9,sqrt,2,10,1371,0.6725438063302641,TPESampler,COMPLETE
839,0.24951494070843924,2025-04-24 21:51:04.461606,2025-04-24 21:51:08.356366,0 days 00:00:03.894760,0.08831364197041953,7,sqrt,1,14,1455,0.6103736302606817,TPESampler,COMPLETE
840,0.274011039810837,2025-04-24 21:51:05.857489,2025-04-24 21:51:09.813320,0 days 00:00:03.955831,0.05901410954288656,3,sqrt,1,9,1462,0.7429306174725171,TPESampler,COMPLETE
841,0.32106723731570597,2025-04-24 21:51:07.410783,2025-04-24 21:51:11.487408,0 days 00:00:04.076625,0.08540266397972103,7,sqrt,2,17,1461,0.6580695382327563,TPESampler,COMPLETE
842,0.30940327593124206,2025-04-24 21:51:08.568013,2025-04-24 21:51:11.572609,0 days 00:00:03.004596,0.09244942366135926,4,sqrt,1,12,1103,0.6273504579366201,TPESampler,COMPLETE
843,0.910459945902149,2025-04-24 21:51:10.034443,2025-04-24 21:51:11.400989,0 days 00:00:01.366546,0.034119918262266305,3,log2,1,7,269,0.628971615183619,TPESampler,COMPLETE
844,0.4007653917692289,2025-04-24 21:51:11.651272,2025-04-24 21:51:14.126824,0 days 00:00:02.475552,0.05157103590443571,10,sqrt,7,17,709,0.7939078302140271,TPESampler,COMPLETE
845,0.2883311654811002,2025-04-24 21:51:11.661867,2025-04-24 21:51:15.911167,0 days 00:00:04.249300,0.034009611056104005,7,sqrt,3,19,1349,0.7263281004823963,TPESampler,COMPLETE
846,0.2863998894620948,2025-04-24 21:51:11.838211,2025-04-24 21:51:15.916650,0 days 00:00:04.078439,0.07901727394509052,4,sqrt,1,11,1285,0.6824539209814373,TPESampler,COMPLETE
847,0.2594242426199093,2025-04-24 21:51:14.355223,2025-04-24 21:51:18.115716,0 days 00:00:03.760493,0.06267484433398876,7,sqrt,1,15,1495,0.6572664736960094,TPESampler,COMPLETE
848,0.35168698562048994,2025-04-24 21:51:16.066315,2025-04-24 21:51:20.116606,0 days 00:00:04.050291,0.09194408200609333,7,sqrt,1,4,1373,0.8646428787588951,TPESampler,COMPLETE
849,0.2940918617303571,2025-04-24 21:51:16.120438,2025-04-24 21:51:19.461033,0 days 00:00:03.340595,0.09619412150491723,12,sqrt,4,14,1064,0.6225490442757471,TPESampler,COMPLETE
850,0.2590426578888993,2025-04-24 21:51:18.323582,2025-04-24 21:51:21.180751,0 days 00:00:02.857169,0.06862284213408637,3,sqrt,1,6,1276,0.6850393381045989,TPESampler,COMPLETE
851,0.2470996447298699,2025-04-24 21:51:19.673790,2025-04-24 21:51:23.857973,0 days 00:00:04.184183,0.09404527657403938,4,sqrt,1,11,1485,0.671301763796692,TPESampler,COMPLETE
852,0.3023795215031372,2025-04-24 21:51:20.447325,2025-04-24 21:51:24.008742,0 days 00:00:03.561417,0.05408894308930628,6,sqrt,3,19,1248,0.719651214289749,TPESampler,COMPLETE
853,0.3077513405267029,2025-04-24 21:51:21.385569,2025-04-24 21:51:25.188570,0 days 00:00:03.803001,0.09499411808553787,8,sqrt,3,19,1491,0.6631761754597559,TPESampler,COMPLETE
854,0.36525964936294375,2025-04-24 21:51:23.999919,2025-04-24 21:51:27.911528,0 days 00:00:03.911609,0.03577918622683629,5,log2,1,19,1337,0.6523210469050109,TPESampler,COMPLETE
855,0.252973329631838,2025-04-24 21:51:24.262305,2025-04-24 21:51:28.777974,0 days 00:00:04.515669,0.0980843778125185,6,sqrt,1,10,1498,0.6321097256728926,TPESampler,COMPLETE
856,0.28273911618896047,2025-04-24 21:51:25.563434,2025-04-24 21:51:29.034660,0 days 00:00:03.471226,0.061795247888998026,6,sqrt,3,15,1227,0.6579692313617831,TPESampler,COMPLETE
857,0.45295137283344383,2025-04-24 21:51:28.142667,2025-04-24 21:51:35.170963,0 days 00:00:07.028296,0.07574159566024065,8,,10,20,1322,0.978834535653861,TPESampler,COMPLETE
858,0.2719525612570736,2025-04-24 21:51:28.998865,2025-04-24 21:51:32.343353,0 days 00:00:03.344488,0.05063086685534596,5,sqrt,1,15,1471,0.6015666875751975,TPESampler,COMPLETE
859,0.26461263313230243,2025-04-24 21:51:29.237767,2025-04-24 21:51:32.372370,0 days 00:00:03.134603,0.04724751572679525,5,sqrt,1,19,1224,0.6726452230254756,TPESampler,COMPLETE
860,0.3082606366279789,2025-04-24 21:51:32.485275,2025-04-24 21:51:36.173862,0 days 00:00:03.688587,0.05789152522508107,6,sqrt,3,14,1458,0.6055093653767635,TPESampler,COMPLETE
861,0.27247238735972285,2025-04-24 21:51:32.533469,2025-04-24 21:51:36.136513,0 days 00:00:03.603044,0.06406891895009592,7,sqrt,3,11,1325,0.6780381687788749,TPESampler,COMPLETE
862,0.3081097239883214,2025-04-24 21:51:35.381484,2025-04-24 21:51:41.033719,0 days 00:00:05.652235,0.08206337791282203,5,,1,8,1433,0.7464657858672256,TPESampler,COMPLETE
863,0.6699970304442592,2025-04-24 21:51:36.281576,2025-04-24 21:51:37.416533,0 days 00:00:01.134957,0.03133424254722711,7,sqrt,6,2,234,0.6370064218641207,TPESampler,COMPLETE
864,0.26486055307056716,2025-04-24 21:51:36.331764,2025-04-24 21:51:39.583432,0 days 00:00:03.251668,0.03837772614790527,7,sqrt,1,17,1493,0.6003969899173397,TPESampler,COMPLETE
