number,value,datetime_start,datetime_complete,duration,params_learning_rate,params_max_depth,params_max_features,params_min_samples_leaf,params_min_samples_split,params_n_estimators,params_subsample,system_attrs_auto:sampler,state
865,0.2978804861855937,2025-04-24 21:51:37.726541,2025-04-24 21:51:40.689381,0 days 00:00:02.962840,0.06420959888649934,9,sqrt,2,13,1215,0.6917421759802624,TPESampler,COMPLETE
866,0.23139510655975531,2025-04-24 21:51:39.795021,2025-04-24 21:51:42.974959,0 days 00:00:03.179938,0.09275457342111021,3,sqrt,1,5,1307,0.6753995712875296,TPESampler,COMPLETE
867,0.30509279222299945,2025-04-24 21:51:40.890003,2025-04-24 21:51:44.639967,0 days 00:00:03.749964,0.09518410091633012,6,sqrt,2,15,1495,0.6298785426596124,TPESampler,COMPLETE
868,0.2595682992691554,2025-04-24 21:51:41.294057,2025-04-24 21:51:44.742447,0 days 00:00:03.448390,0.0783575762110215,5,sqrt,1,15,1371,0.7006033319714994,TPESampler,COMPLETE
869,0.27922231434109346,2025-04-24 21:51:43.158323,2025-04-24 21:51:46.230189,0 days 00:00:03.071866,0.07228992127390417,7,sqrt,1,19,1259,0.6897030952003823,TPESampler,COMPLETE
870,0.28176745427693556,2025-04-24 21:51:44.815659,2025-04-24 21:51:48.642591,0 days 00:00:03.826932,0.06344697938129643,3,sqrt,2,18,1473,0.6953520022353002,TPESampler,COMPLETE
871,0.29246451666937606,2025-04-24 21:51:44.890504,2025-04-24 21:51:48.853665,0 days 00:00:03.963161,0.06622592597026723,7,sqrt,3,16,1460,0.6177467214781254,TPESampler,COMPLETE
872,0.2407234989592999,2025-04-24 21:51:46.434486,2025-04-24 21:51:49.800684,0 days 00:00:03.366198,0.09270541315082698,5,sqrt,1,20,1453,0.6147656955157478,TPESampler,COMPLETE
873,0.3036701657094934,2025-04-24 21:51:48.799118,2025-04-24 21:51:52.032129,0 days 00:00:03.233011,0.08395145796457099,11,log2,1,14,1353,0.6120914951367694,TPESampler,COMPLETE
874,0.26525104834361246,2025-04-24 21:51:49.101244,2025-04-24 21:51:52.096772,0 days 00:00:02.995528,0.05851501544029591,6,sqrt,1,11,1219,0.6540797894011097,TPESampler,COMPLETE
875,0.2629829813257886,2025-04-24 21:51:49.962655,2025-04-24 21:51:53.178472,0 days 00:00:03.215817,0.0982754775311256,6,sqrt,1,11,1471,0.7389206371627736,TPESampler,COMPLETE
876,0.37657879052585835,2025-04-24 21:51:52.189542,2025-04-24 21:51:58.384714,0 days 00:00:06.195172,0.01604675895711971,6,,7,15,1410,0.755322052533398,TPESampler,COMPLETE
877,0.270353979666537,2025-04-24 21:51:52.239503,2025-04-24 21:51:55.332007,0 days 00:00:03.092504,0.0983560228520428,7,sqrt,1,17,1237,0.6637559135331121,TPESampler,COMPLETE
878,0.6998894314526918,2025-04-24 21:51:53.359606,2025-04-24 21:51:54.402185,0 days 00:00:01.042579,0.07785619903896734,12,log2,8,7,238,0.9866443373516641,TPESampler,COMPLETE
879,0.30797561448485017,2025-04-24 21:51:54.592673,2025-04-24 21:51:57.931649,0 days 00:00:03.338976,0.07929412781860969,9,sqrt,1,18,1490,0.6659381438867326,TPESampler,COMPLETE
880,0.41272032276593784,2025-04-24 21:51:55.520838,2025-04-24 21:51:57.522402,0 days 00:00:02.001564,0.02182637473196824,11,log2,1,12,742,0.787093508641077,TPESampler,COMPLETE
881,0.33186159805538756,2025-04-24 21:51:57.714756,2025-04-24 21:52:03.685835,0 days 00:00:05.971079,0.07682539316807795,6,,2,14,1448,0.7164670312225478,TPESampler,COMPLETE
882,1.0938592492080186,2025-04-24 21:51:58.157174,2025-04-24 21:52:00.513381,0 days 00:00:02.356207,0.015511571777304238,3,log2,7,5,1094,0.7002007158768523,TPESampler,COMPLETE
883,0.6795831710533976,2025-04-24 21:51:58.608857,2025-04-24 21:52:00.273400,0 days 00:00:01.664543,0.012007400267724086,12,sqrt,5,10,414,0.6684183049231736,TPESampler,COMPLETE
884,0.2506822127778622,2025-04-24 21:52:00.467556,2025-04-24 21:52:03.555580,0 days 00:00:03.088024,0.0929514957373054,7,sqrt,1,15,1363,0.6036812812772144,TPESampler,COMPLETE
885,0.30073092837420917,2025-04-24 21:52:00.716601,2025-04-24 21:52:03.939833,0 days 00:00:03.223232,0.08325546082885732,7,sqrt,1,17,1455,0.6433866328329473,TPESampler,COMPLETE
886,0.29581876732136086,2025-04-24 21:52:03.750482,2025-04-24 21:52:06.664519,0 days 00:00:02.914037,0.05514940466544339,4,sqrt,1,6,1366,0.8830474056935129,TPESampler,COMPLETE
887,0.3879697082795145,2025-04-24 21:52:03.909508,2025-04-24 21:52:09.274102,0 days 00:00:05.364594,0.043321897390085594,12,,2,4,874,0.8221164253250924,TPESampler,COMPLETE
888,0.2904907258058716,2025-04-24 21:52:04.239345,2025-04-24 21:52:06.917773,0 days 00:00:02.678428,0.07947911112400596,6,sqrt,3,11,1150,0.6143401175664739,TPESampler,COMPLETE
889,0.412971389390481,2025-04-24 21:52:06.861455,2025-04-24 21:52:11.257529,0 days 00:00:04.396074,0.018713739927941654,7,,1,3,950,0.9653067190960687,TPESampler,COMPLETE
890,0.30130556451982893,2025-04-24 21:52:07.133369,2025-04-24 21:52:12.267435,0 days 00:00:05.134066,0.042034095806020036,6,,1,17,1495,0.8130350607753504,TPESampler,COMPLETE
891,0.3644390095868071,2025-04-24 21:52:09.441823,2025-04-24 21:52:14.164546,0 days 00:00:04.722723,0.011223948992865329,10,,6,4,793,0.9966693541975774,TPESampler,COMPLETE
892,0.2857077346440772,2025-04-24 21:52:11.579377,2025-04-24 21:52:14.874494,0 days 00:00:03.295117,0.04864943726473752,7,sqrt,1,15,1487,0.6053780661668642,TPESampler,COMPLETE
893,0.28986417033180845,2025-04-24 21:52:12.482804,2025-04-24 21:52:15.483002,0 days 00:00:03.000198,0.08061913492701762,7,sqrt,3,20,1122,0.637313424277487,TPESampler,COMPLETE
894,0.25827706492044006,2025-04-24 21:52:14.465781,2025-04-24 21:52:17.917785,0 days 00:00:03.452004,0.05268028760914386,7,sqrt,1,17,1408,0.6227253504063937,TPESampler,COMPLETE
895,0.3116800233873709,2025-04-24 21:52:15.092079,2025-04-24 21:52:18.472120,0 days 00:00:03.380041,0.09258029792083808,6,sqrt,4,7,1444,0.8497548357632739,TPESampler,COMPLETE
896,0.47140046137028585,2025-04-24 21:52:15.689233,2025-04-24 21:52:18.811274,0 days 00:00:03.122041,0.03888375129837351,12,,10,5,544,0.6794522887397066,TPESampler,COMPLETE
897,0.2805251963897263,2025-04-24 21:52:18.100067,2025-04-24 21:52:20.931809,0 days 00:00:02.831742,0.059685267263417746,6,log2,2,10,1261,0.6145116393813446,TPESampler,COMPLETE
898,0.3047296448257272,2025-04-24 21:52:18.675200,2025-04-24 21:52:22.638639,0 days 00:00:03.963439,0.07481893029147801,8,,1,10,825,0.6427076797943891,TPESampler,COMPLETE
899,0.2771907965680285,2025-04-24 21:52:19.005794,2025-04-24 21:52:21.958008,0 days 00:00:02.952214,0.09970484155582096,5,sqrt,1,17,1317,0.7166378275356178,TPESampler,COMPLETE
900,0.2806901227579767,2025-04-24 21:52:21.141893,2025-04-24 21:52:24.630687,0 days 00:00:03.488794,0.05416403119427595,5,sqrt,2,6,1494,0.7096904061345212,TPESampler,COMPLETE
901,0.340551499545192,2025-04-24 21:52:22.151619,2025-04-24 21:52:25.974315,0 days 00:00:03.822696,0.08717824275413641,11,sqrt,4,14,1419,0.6762972028858797,TPESampler,COMPLETE
902,0.2809269344134603,2025-04-24 21:52:22.876938,2025-04-24 21:52:26.377381,0 days 00:00:03.500443,0.05617574334123411,5,sqrt,1,17,1201,0.6101693112348466,TPESampler,COMPLETE
903,0.44936708714800666,2025-04-24 21:52:24.803197,2025-04-24 21:52:27.337144,0 days 00:00:02.533947,0.09950785040564311,3,sqrt,10,10,1005,0.8888620794754164,TPESampler,COMPLETE
904,0.275347846677075,2025-04-24 21:52:26.169328,2025-04-24 21:52:30.167167,0 days 00:00:03.997839,0.09916578729685938,9,sqrt,3,14,1431,0.6614667818635843,TPESampler,COMPLETE
905,0.24361333577844402,2025-04-24 21:52:26.594163,2025-04-24 21:52:30.138396,0 days 00:00:03.544233,0.08809033951004917,3,sqrt,1,2,1269,0.7012143796176443,TPESampler,COMPLETE
906,0.28071474234938687,2025-04-24 21:52:27.524557,2025-04-24 21:52:30.936971,0 days 00:00:03.412414,0.08292988630029405,10,sqrt,1,13,1273,0.6770230224100657,TPESampler,COMPLETE
907,0.25490322164617973,2025-04-24 21:52:30.239200,2025-04-24 21:52:33.658919,0 days 00:00:03.419719,0.06187129116993905,7,sqrt,1,15,1322,0.6061060947365107,TPESampler,COMPLETE
908,0.24676559853601449,2025-04-24 21:52:30.291809,2025-04-24 21:52:33.723573,0 days 00:00:03.431764,0.08041452262259846,6,sqrt,1,11,1226,0.601872817225573,TPESampler,COMPLETE
909,0.2738305002290101,2025-04-24 21:52:31.156509,2025-04-24 21:52:34.613893,0 days 00:00:03.457384,0.050327025195306525,3,sqrt,1,2,1429,0.6800485048303685,TPESampler,COMPLETE
910,0.2916993169607499,2025-04-24 21:52:33.822530,2025-04-24 21:52:38.345307,0 days 00:00:04.522777,0.08697870580431237,6,sqrt,2,6,1497,0.7674973703099691,TPESampler,COMPLETE
911,0.29852710177700614,2025-04-24 21:52:33.925808,2025-04-24 21:52:37.618205,0 days 00:00:03.692397,0.05104649590332898,4,sqrt,4,7,1170,0.68253915222265,TPESampler,COMPLETE
912,0.4583108310014692,2025-04-24 21:52:34.944393,2025-04-24 21:52:37.864311,0 days 00:00:02.919918,0.0804370262482673,4,log2,7,7,972,0.8011796477068341,TPESampler,COMPLETE
913,0.29785495007634905,2025-04-24 21:52:37.820779,2025-04-24 21:52:41.459832,0 days 00:00:03.639053,0.0441844170352208,6,sqrt,3,20,1355,0.6553455308069654,TPESampler,COMPLETE
914,0.31019320801624645,2025-04-24 21:52:38.105682,2025-04-24 21:52:41.951536,0 days 00:00:03.845854,0.03596293892372196,8,log2,2,4,1440,0.8846442289725788,TPESampler,COMPLETE
915,0.2733399272866064,2025-04-24 21:52:38.644779,2025-04-24 21:52:42.451652,0 days 00:00:03.806873,0.09842060021591845,4,sqrt,2,6,1412,0.6490239145646232,TPESampler,COMPLETE
916,0.2670029055395479,2025-04-24 21:52:41.674918,2025-04-24 21:52:44.421110,0 days 00:00:02.746192,0.04893564117496116,5,sqrt,1,20,1336,0.7475493947122049,TPESampler,COMPLETE
917,0.2815191566865318,2025-04-24 21:52:42.544415,2025-04-24 21:52:46.056415,0 days 00:00:03.512000,0.07152365529629143,9,sqrt,3,16,1220,0.6855288414054559,TPESampler,COMPLETE
918,0.24064215167958228,2025-04-24 21:52:42.991480,2025-04-24 21:52:46.913928,0 days 00:00:03.922448,0.05372589755914434,6,sqrt,1,19,1453,0.6073979850812868,TPESampler,COMPLETE
919,0.25778353277849747,2025-04-24 21:52:44.841910,2025-04-24 21:52:48.254323,0 days 00:00:03.412413,0.07006638569703048,8,sqrt,1,20,1286,0.6076302235687934,TPESampler,COMPLETE
920,0.2706444840356014,2025-04-24 21:52:46.543614,2025-04-24 21:52:49.435219,0 days 00:00:02.891605,0.05710319212250569,6,sqrt,1,14,1100,0.6045351316450193,TPESampler,COMPLETE
921,0.2852000788622572,2025-04-24 21:52:47.345358,2025-04-24 21:52:50.851580,0 days 00:00:03.506222,0.07789992639542669,3,sqrt,1,16,1409,0.7765913600950548,TPESampler,COMPLETE
922,0.2614739936270043,2025-04-24 21:52:48.754691,2025-04-24 21:52:52.386797,0 days 00:00:03.632106,0.056123418848341024,4,sqrt,1,17,1440,0.6579516370463798,TPESampler,COMPLETE
923,0.2752186237127399,2025-04-24 21:52:49.739290,2025-04-24 21:52:52.466740,0 days 00:00:02.727450,0.09910215640850854,6,sqrt,1,14,1135,0.6174969050175224,TPESampler,COMPLETE
924,0.27225470762880466,2025-04-24 21:52:51.264641,2025-04-24 21:52:54.522937,0 days 00:00:03.258296,0.054901981614601206,4,sqrt,1,3,1414,0.7727237791812922,TPESampler,COMPLETE
925,0.25770736634926633,2025-04-24 21:52:52.656588,2025-04-24 21:52:56.109434,0 days 00:00:03.452846,0.07413606405796755,5,sqrt,1,16,1426,0.6257368449951984,TPESampler,COMPLETE
926,1.1432596519140157,2025-04-24 21:52:52.703636,2025-04-24 21:52:54.326606,0 days 00:00:01.622970,0.012634791068192852,11,log2,2,11,125,0.8632671206318944,TPESampler,COMPLETE
927,0.30616974429430316,2025-04-24 21:52:54.637178,2025-04-24 21:52:57.493268,0 days 00:00:02.856090,0.09658577462693506,3,sqrt,1,3,1494,0.6176769058576447,TPESampler,COMPLETE
928,0.36706474292005353,2025-04-24 21:52:54.707868,2025-04-24 21:53:03.598463,0 days 00:00:08.890595,0.021784412176898745,10,,2,16,1438,0.9348810152885273,TPESampler,COMPLETE
929,0.6561975651369218,2025-04-24 21:52:56.305099,2025-04-24 21:52:57.232768,0 days 00:00:00.927669,0.051290022953755995,12,sqrt,5,6,106,0.8064053178008507,TPESampler,COMPLETE
930,0.3303762723005398,2025-04-24 21:52:57.442431,2025-04-24 21:53:00.227375,0 days 00:00:02.784944,0.031868506679556985,3,sqrt,1,19,1339,0.6029897603242256,TPESampler,COMPLETE
931,0.28919100362115124,2025-04-24 21:52:57.724025,2025-04-24 21:53:00.466750,0 days 00:00:02.742725,0.08430358303743823,8,sqrt,1,14,1065,0.6813396193484875,TPESampler,COMPLETE
932,0.40176907009708857,2025-04-24 21:53:00.422734,2025-04-24 21:53:05.468641,0 days 00:00:05.045907,0.03232011569951329,5,,8,9,1382,0.8002840951134959,TPESampler,COMPLETE
933,0.23860961099950612,2025-04-24 21:53:00.727591,2025-04-24 21:53:02.922510,0 days 00:00:02.194919,0.08247516112178112,5,sqrt,1,7,1168,0.70147609738521,TPESampler,COMPLETE
934,0.30076911643937687,2025-04-24 21:53:03.125392,2025-04-24 21:53:05.577934,0 days 00:00:02.452542,0.06152676915588628,4,sqrt,3,7,1082,0.651888057094762,TPESampler,COMPLETE
935,0.30730836826621727,2025-04-24 21:53:03.814578,2025-04-24 21:53:06.667165,0 days 00:00:02.852587,0.07909974638045351,5,sqrt,2,5,1319,0.7253098835603342,TPESampler,COMPLETE
936,0.3063765748633809,2025-04-24 21:53:05.667564,2025-04-24 21:53:09.403283,0 days 00:00:03.735719,0.055260586012504616,6,sqrt,4,5,1247,0.7813696737189573,TPESampler,COMPLETE
937,0.26934075227309007,2025-04-24 21:53:05.737675,2025-04-24 21:53:09.056156,0 days 00:00:03.318481,0.09197911832589249,3,sqrt,1,4,979,0.6731388549469552,TPESampler,COMPLETE
938,0.29054529890195147,2025-04-24 21:53:06.861226,2025-04-24 21:53:10.113950,0 days 00:00:03.252724,0.055680788912587834,3,sqrt,1,9,1243,0.6956371547359071,TPESampler,COMPLETE
939,0.3085121582980201,2025-04-24 21:53:09.237435,2025-04-24 21:53:13.063055,0 days 00:00:03.825620,0.09906946838817006,3,,1,5,1264,0.6057050983380707,TPESampler,COMPLETE
940,0.2459242705612332,2025-04-24 21:53:09.594792,2025-04-24 21:53:12.711001,0 days 00:00:03.116209,0.05451993851570819,6,sqrt,1,8,1291,0.6734541621105011,TPESampler,COMPLETE
941,0.2835289575134598,2025-04-24 21:53:10.348415,2025-04-24 21:53:12.490966,0 days 00:00:02.142551,0.06742423984687347,5,sqrt,1,9,671,0.6738236706653434,TPESampler,COMPLETE
942,0.4590450782943438,2025-04-24 21:53:12.859901,2025-04-24 21:53:16.131134,0 days 00:00:03.271233,0.025161385452374875,4,sqrt,8,8,1162,0.7371449717365665,TPESampler,COMPLETE
943,0.2743117847026801,2025-04-24 21:53:13.078940,2025-04-24 21:53:16.595623,0 days 00:00:03.516683,0.08230547117186703,7,sqrt,1,7,1229,0.7463082909047731,TPESampler,COMPLETE
944,0.2730634762166255,2025-04-24 21:53:13.394130,2025-04-24 21:53:16.708830,0 days 00:00:03.314700,0.07086055137541422,5,sqrt,2,8,1128,0.7566653523146242,TPESampler,COMPLETE
945,0.29305503486684126,2025-04-24 21:53:16.283013,2025-04-24 21:53:18.636193,0 days 00:00:02.353180,0.08085544964264234,5,sqrt,2,7,957,0.6603827753422271,TPESampler,COMPLETE
946,0.2735403279111342,2025-04-24 21:53:16.767828,2025-04-24 21:53:20.764459,0 days 00:00:03.996631,0.062428183744419184,5,sqrt,1,7,1421,0.7324267188329928,TPESampler,COMPLETE
947,0.2686049984152343,2025-04-24 21:53:16.986730,2025-04-24 21:53:20.329796,0 days 00:00:03.343066,0.09857326388540959,4,sqrt,3,8,1034,0.6914564392750836,TPESampler,COMPLETE
948,0.27465128979525805,2025-04-24 21:53:18.826570,2025-04-24 21:53:22.680535,0 days 00:00:03.853965,0.09379252819859851,9,sqrt,1,12,1483,0.6873710879853097,TPESampler,COMPLETE
949,0.243353105609827,2025-04-24 21:53:20.715208,2025-04-24 21:53:23.234419,0 days 00:00:02.519211,0.07244514336425904,5,sqrt,1,6,1100,0.6720637362753812,TPESampler,COMPLETE
950,0.35341173460091396,2025-04-24 21:53:21.015489,2025-04-24 21:53:28.381685,0 days 00:00:07.366196,0.07854380057285767,9,,2,7,1341,0.9234747098388076,TPESampler,COMPLETE
951,0.28099378549234183,2025-04-24 21:53:22.871083,2025-04-24 21:53:25.570589,0 days 00:00:02.699506,0.02872774603175609,6,sqrt,1,3,1360,0.7795263414107222,TPESampler,COMPLETE
952,1.1738297702259968,2025-04-24 21:53:23.427626,2025-04-24 21:53:24.365030,0 days 00:00:00.937404,0.021245004328038875,9,log2,4,20,122,0.9886613955878156,TPESampler,COMPLETE
953,0.3596619395758616,2025-04-24 21:53:24.545179,2025-04-24 21:53:31.345380,0 days 00:00:06.800201,0.028973050123016892,12,,2,6,1411,0.6832158867616531,TPESampler,COMPLETE
954,0.4581123575868948,2025-04-24 21:53:25.767290,2025-04-24 21:53:32.149418,0 days 00:00:06.382128,0.012885872243405193,8,,10,5,1416,0.9323982701096496,TPESampler,COMPLETE
955,0.2961699543382445,2025-04-24 21:53:28.557425,2025-04-24 21:53:30.765128,0 days 00:00:02.207703,0.059749208040958554,4,sqrt,3,17,1274,0.7180663666795353,TPESampler,COMPLETE
956,0.22165404885347978,2025-04-24 21:53:30.929244,2025-04-24 21:53:34.095848,0 days 00:00:03.166604,0.09322800578943463,4,sqrt,1,7,1260,0.7104467306120246,TPESampler,COMPLETE
957,0.30554555660840177,2025-04-24 21:53:31.540771,2025-04-24 21:53:35.264506,0 days 00:00:03.723735,0.04398463623175227,6,log2,2,13,1459,0.931032238491194,TPESampler,COMPLETE
958,0.2655126460590486,2025-04-24 21:53:32.382144,2025-04-24 21:53:36.050853,0 days 00:00:03.668709,0.09665004361918104,5,sqrt,1,11,1348,0.643117220552177,TPESampler,COMPLETE
959,0.27539969620362736,2025-04-24 21:53:34.308902,2025-04-24 21:53:37.015311,0 days 00:00:02.706409,0.05987544216252865,4,sqrt,2,14,1152,0.7681586551150538,TPESampler,COMPLETE
960,0.8876618815470027,2025-04-24 21:53:35.481318,2025-04-24 21:53:36.554380,0 days 00:00:01.073062,0.06148217746139889,4,log2,7,20,269,0.8945072287770925,TPESampler,COMPLETE
961,0.2767977806384919,2025-04-24 21:53:36.214984,2025-04-24 21:53:39.381094,0 days 00:00:03.166110,0.07326857863043162,4,sqrt,1,5,1139,0.7135430792717146,TPESampler,COMPLETE
962,0.26395176362411604,2025-04-24 21:53:36.765222,2025-04-24 21:53:40.224237,0 days 00:00:03.459015,0.08461472359830403,6,sqrt,1,8,1118,0.676015984918582,TPESampler,COMPLETE
963,0.26235914418030454,2025-04-24 21:53:37.227552,2025-04-24 21:53:40.682197,0 days 00:00:03.454645,0.0794553255512531,4,sqrt,1,7,1169,0.6475841451115257,TPESampler,COMPLETE
964,0.34853826074713573,2025-04-24 21:53:39.579097,2025-04-24 21:53:42.095148,0 days 00:00:02.516051,0.062380595786424464,4,log2,3,3,977,0.6308294778101187,TPESampler,COMPLETE
965,0.2878264210595677,2025-04-24 21:53:40.461357,2025-04-24 21:53:43.237911,0 days 00:00:02.776554,0.04315125089449204,6,sqrt,2,6,987,0.7184338446367595,TPESampler,COMPLETE
966,1.1147293156420088,2025-04-24 21:53:40.910159,2025-04-24 21:53:42.185482,0 days 00:00:01.275323,0.03143820830902767,8,log2,10,16,236,0.984224503599421,TPESampler,COMPLETE
967,0.28446626166309485,2025-04-24 21:53:42.261034,2025-04-24 21:53:46.118055,0 days 00:00:03.857021,0.08152243317693597,5,sqrt,1,6,1477,0.7273251349232425,TPESampler,COMPLETE
968,0.28723354405111584,2025-04-24 21:53:42.387925,2025-04-24 21:53:46.045327,0 days 00:00:03.657402,0.0801186418047209,4,sqrt,1,10,1365,0.7408773726111765,TPESampler,COMPLETE
969,0.4585732899468156,2025-04-24 21:53:43.448386,2025-04-24 21:53:47.060430,0 days 00:00:03.612044,0.07693274533908609,6,,10,5,705,0.7654586979806377,TPESampler,COMPLETE
970,0.2641119499223985,2025-04-24 21:53:46.195777,2025-04-24 21:53:49.840937,0 days 00:00:03.645160,0.06710289274273794,6,sqrt,1,13,1273,0.6782946297205814,TPESampler,COMPLETE
971,0.31413143145186684,2025-04-24 21:53:46.269667,2025-04-24 21:53:50.520633,0 days 00:00:04.250966,0.09481017497533836,7,sqrt,2,18,1496,0.621948686225539,TPESampler,COMPLETE
972,0.26435377197328613,2025-04-24 21:53:47.254191,2025-04-24 21:53:50.948518,0 days 00:00:03.694327,0.05371465314385781,10,sqrt,1,14,1332,0.6055096795272541,TPESampler,COMPLETE
973,0.24771326902087654,2025-04-24 21:53:50.061683,2025-04-24 21:53:53.335906,0 days 00:00:03.274223,0.07886007414498114,4,sqrt,1,5,1201,0.7474850014372749,TPESampler,COMPLETE
974,0.43544918889000717,2025-04-24 21:53:50.716624,2025-04-24 21:53:53.332456,0 days 00:00:02.615832,0.034675675995128726,6,log2,2,12,813,0.800175728199167,TPESampler,COMPLETE
975,0.4774837791257786,2025-04-24 21:53:51.177564,2025-04-24 21:53:54.293633,0 days 00:00:03.116069,0.025076765171854334,9,sqrt,10,3,1141,0.9257679519162181,TPESampler,COMPLETE
976,1.19564378863404,2025-04-24 21:53:53.485825,2025-04-24 21:53:55.434678,0 days 00:00:01.948853,0.011034826985092524,8,log2,8,7,610,0.748946716774613,TPESampler,COMPLETE
977,0.24287398357516127,2025-04-24 21:53:53.533727,2025-04-24 21:53:57.103311,0 days 00:00:03.569584,0.08737242314440423,7,sqrt,1,20,1123,0.6659295938169902,TPESampler,COMPLETE
978,0.30075549653960354,2025-04-24 21:53:54.512961,2025-04-24 21:53:58.096244,0 days 00:00:03.583283,0.09948576539086984,3,sqrt,1,6,1264,0.6684340772659678,TPESampler,COMPLETE
979,0.3225989797716641,2025-04-24 21:53:55.646334,2025-04-24 21:53:59.670392,0 days 00:00:04.024058,0.058648553053288865,5,log2,3,4,1487,0.7438901160976316,TPESampler,COMPLETE
980,0.3102272253583782,2025-04-24 21:53:57.309381,2025-04-24 21:54:00.516900,0 days 00:00:03.207519,0.07909585037927527,7,sqrt,3,16,1181,0.6080068446512846,TPESampler,COMPLETE
981,0.7771671488846397,2025-04-24 21:53:58.301690,2025-04-24 21:53:59.710309,0 days 00:00:01.408619,0.03116475771534449,7,log2,1,19,262,0.908253040327735,TPESampler,COMPLETE
982,0.8997668312457833,2025-04-24 21:53:59.831881,2025-04-24 21:54:02.727970,0 days 00:00:02.896089,0.01838357953306052,7,log2,6,15,986,0.6343695173088775,TPESampler,COMPLETE
983,0.24680508465291623,2025-04-24 21:53:59.889579,2025-04-24 21:54:03.655111,0 days 00:00:03.765532,0.08485630476681116,3,sqrt,1,10,1209,0.7574856937801929,TPESampler,COMPLETE
984,0.29239103210316075,2025-04-24 21:54:00.761320,2025-04-24 21:54:04.492006,0 days 00:00:03.730686,0.04833670966417583,3,sqrt,1,14,1436,0.7160631413910614,TPESampler,COMPLETE
985,0.2726577447156156,2025-04-24 21:54:02.929469,2025-04-24 21:54:07.430692,0 days 00:00:04.501223,0.07626087153451208,5,,1,19,1171,0.6316096433157478,TPESampler,COMPLETE
986,0.279373070779251,2025-04-24 21:54:03.866465,2025-04-24 21:54:06.520774,0 days 00:00:02.654309,0.06984765688635479,8,sqrt,2,5,991,0.6316479102343489,TPESampler,COMPLETE
987,0.5203265448541936,2025-04-24 21:54:04.691955,2025-04-24 21:54:06.499306,0 days 00:00:01.807351,0.07094830722207715,10,sqrt,10,2,574,0.6970022624267205,TPESampler,COMPLETE
988,0.2771699054763286,2025-04-24 21:54:06.644264,2025-04-24 21:54:10.413633,0 days 00:00:03.769369,0.0816200052245894,9,sqrt,1,13,1404,0.6067450577586811,TPESampler,COMPLETE
