number,value,datetime_start,datetime_complete,duration,params_learning_rate,params_max_depth,params_max_features,params_min_samples_leaf,params_min_samples_split,params_n_estimators,params_subsample,system_attrs_auto:sampler,state
247,0.3093972327637736,2025-04-24 21:39:35.848902,2025-04-24 21:39:37.669396,0 days 00:00:01.820494,0.05924273696990568,3,sqrt,2,2,669,0.6787621897098121,TPESampler,COMPLETE
248,0.2428316725796098,2025-04-24 21:39:37.854704,2025-04-24 21:39:40.820085,0 days 00:00:02.965381,0.05782371382998318,6,sqrt,1,14,1418,0.6621720870981432,TPESampler,COMPLETE
249,0.28939043188831176,2025-04-24 21:39:38.294683,2025-04-24 21:39:42.661146,0 days 00:00:04.366463,0.09891344607538766,6,,1,14,1040,0.730591224754221,TPESampler,COMPLETE
250,0.957648988862698,2025-04-24 21:39:38.496513,2025-04-24 21:39:40.480830,0 days 00:00:01.984317,0.03085058573090621,10,log2,9,11,717,0.6103766966755988,TPESampler,COMPLETE
251,0.349870560095113,2025-04-24 21:39:40.674108,2025-04-24 21:39:46.265660,0 days 00:00:05.591552,0.06931189282710697,8,,4,9,1352,0.6707100171367695,TPESampler,COMPLETE
252,0.2779138856637283,2025-04-24 21:39:40.997425,2025-04-24 21:39:43.731511,0 days 00:00:02.734086,0.09797297013870834,5,sqrt,1,5,1469,0.6442220926529406,TPESampler,COMPLETE
253,0.2708907790184646,2025-04-24 21:39:42.827458,2025-04-24 21:39:45.903989,0 days 00:00:03.076531,0.06124701623322672,5,sqrt,2,12,1498,0.6985004788532657,TPESampler,COMPLETE
254,0.3577246937028085,2025-04-24 21:39:43.880444,2025-04-24 21:39:47.064868,0 days 00:00:03.184424,0.07468811984773428,9,sqrt,1,2,1240,0.8375453066551676,TPESampler,COMPLETE
255,0.30606822746458207,2025-04-24 21:39:46.106213,2025-04-24 21:39:49.256986,0 days 00:00:03.150773,0.05692906947383535,6,sqrt,3,17,1290,0.6376226825704892,TPESampler,COMPLETE
256,0.23941021338886476,2025-04-24 21:39:46.450913,2025-04-24 21:39:50.088148,0 days 00:00:03.637235,0.06959999763280496,7,sqrt,1,16,1463,0.6402914344601657,TPESampler,COMPLETE
257,0.2777995088069705,2025-04-24 21:39:47.253591,2025-04-24 21:39:50.005236,0 days 00:00:02.751645,0.08461376565199157,5,sqrt,1,4,1069,0.7912471574751293,TPESampler,COMPLETE
258,0.33534628029547553,2025-04-24 21:39:49.441802,2025-04-24 21:39:52.589496,0 days 00:00:03.147694,0.09070265739891664,6,sqrt,1,8,1454,0.7203742127565391,TPESampler,COMPLETE
259,0.3261838927839689,2025-04-24 21:39:50.202895,2025-04-24 21:39:53.859270,0 days 00:00:03.656375,0.07419125812228715,6,sqrt,2,20,1436,0.6238168263041789,TPESampler,COMPLETE
260,0.29034936528957966,2025-04-24 21:39:50.266121,2025-04-24 21:39:53.941961,0 days 00:00:03.675840,0.06165003672142637,8,sqrt,2,14,1405,0.6194675501656293,TPESampler,COMPLETE
261,1.063213579385089,2025-04-24 21:39:52.748087,2025-04-24 21:39:54.517893,0 days 00:00:01.769806,0.019328328607828803,4,log2,9,11,923,0.7184213913489358,TPESampler,COMPLETE
262,0.4614940594133625,2025-04-24 21:39:54.004414,2025-04-24 21:40:00.111102,0 days 00:00:06.106688,0.055710383896185156,10,,10,20,1204,0.8438076184142111,TPESampler,COMPLETE
263,0.2626120830115968,2025-04-24 21:39:54.131085,2025-04-24 21:39:56.973421,0 days 00:00:02.842336,0.08988077209447248,6,sqrt,1,15,1456,0.7834456770154318,TPESampler,COMPLETE
264,0.3398936620796323,2025-04-24 21:39:54.722524,2025-04-24 21:39:56.452526,0 days 00:00:01.730002,0.019121486717477213,5,,2,2,312,0.8353152964639843,TPESampler,COMPLETE
265,0.737696507169264,2025-04-24 21:39:56.630882,2025-04-24 21:39:58.519816,0 days 00:00:01.888934,0.011795048190154488,12,sqrt,9,13,858,0.6977689928232529,TPESampler,COMPLETE
266,0.2523659803385115,2025-04-24 21:39:57.163997,2025-04-24 21:39:59.991244,0 days 00:00:02.827247,0.07612623876958628,5,sqrt,1,12,1396,0.7494215119368762,TPESampler,COMPLETE
267,0.22997817632254128,2025-04-24 21:39:58.683879,2025-04-24 21:40:01.994103,0 days 00:00:03.310224,0.08159067025660814,8,sqrt,1,15,1410,0.6319716682828458,TPESampler,COMPLETE
268,1.0990480813945562,2025-04-24 21:40:00.173696,2025-04-24 21:40:02.244058,0 days 00:00:02.070362,0.020762387141224414,7,log2,9,19,650,0.8718773081152572,TPESampler,COMPLETE
269,0.27856734308769804,2025-04-24 21:40:00.302480,2025-04-24 21:40:03.513240,0 days 00:00:03.210760,0.07550627678771958,6,sqrt,2,16,1202,0.6904787410105372,TPESampler,COMPLETE
270,0.3061485960055973,2025-04-24 21:40:02.198667,2025-04-24 21:40:08.306882,0 days 00:00:06.108215,0.052222119799573904,7,,1,11,1409,0.6650244891341501,TPESampler,COMPLETE
271,0.237271511535611,2025-04-24 21:40:02.481261,2025-04-24 21:40:05.778557,0 days 00:00:03.297296,0.07155053223221841,5,sqrt,1,17,1469,0.6342152458399217,TPESampler,COMPLETE
272,0.30574114820574433,2025-04-24 21:40:03.695599,2025-04-24 21:40:06.986678,0 days 00:00:03.291079,0.05614285376639243,8,sqrt,2,17,1445,0.6409830245369197,TPESampler,COMPLETE
273,0.28789523050598925,2025-04-24 21:40:05.965145,2025-04-24 21:40:09.032847,0 days 00:00:03.067702,0.08724315245754688,5,sqrt,1,14,1427,0.6092421716188012,TPESampler,COMPLETE
274,0.31660415469769043,2025-04-24 21:40:07.197876,2025-04-24 21:40:11.085956,0 days 00:00:03.888080,0.04591246640481972,8,sqrt,1,15,1474,0.7194908789991725,TPESampler,COMPLETE
275,0.3763651497774385,2025-04-24 21:40:08.460198,2025-04-24 21:40:11.885731,0 days 00:00:03.425533,0.05545611441142472,12,sqrt,7,12,1352,0.9467681568190045,TPESampler,COMPLETE
276,0.26167973346071793,2025-04-24 21:40:09.228603,2025-04-24 21:40:12.567621,0 days 00:00:03.339018,0.08790135452601557,6,sqrt,1,12,1297,0.6770806504187523,TPESampler,COMPLETE
277,0.6487908232912774,2025-04-24 21:40:11.236679,2025-04-24 21:40:12.618131,0 days 00:00:01.381452,0.08596837484645242,3,log2,7,19,551,0.6848802186137632,TPESampler,COMPLETE
278,0.40146950648484464,2025-04-24 21:40:12.036988,2025-04-24 21:40:14.445539,0 days 00:00:02.408551,0.032222309929288775,4,log2,1,3,1310,0.6401086726149686,TPESampler,COMPLETE
279,0.2893415956756994,2025-04-24 21:40:12.675514,2025-04-24 21:40:15.696597,0 days 00:00:03.021083,0.07400992542960269,8,log2,1,12,1483,0.7113238122334222,TPESampler,COMPLETE
280,0.8941299417359067,2025-04-24 21:40:12.736605,2025-04-24 21:40:14.062512,0 days 00:00:01.325907,0.013060009780389426,6,sqrt,7,2,276,0.8166157322860403,TPESampler,COMPLETE
281,0.37162165773914113,2025-04-24 21:40:14.264355,2025-04-24 21:40:16.234347,0 days 00:00:01.969992,0.010462738872489233,4,,4,15,455,0.7612775083131604,TPESampler,COMPLETE
282,0.2578135098888497,2025-04-24 21:40:14.632915,2025-04-24 21:40:18.023957,0 days 00:00:03.391042,0.05546904809547091,6,sqrt,1,16,1390,0.6657727330435526,TPESampler,COMPLETE
283,0.3242198719380418,2025-04-24 21:40:15.884091,2025-04-24 21:40:19.065143,0 days 00:00:03.181052,0.09597482330067351,8,sqrt,2,14,1131,0.700886728302138,TPESampler,COMPLETE
284,0.27326315271777696,2025-04-24 21:40:16.408835,2025-04-24 21:40:19.975802,0 days 00:00:03.566967,0.09694797561684237,5,sqrt,3,3,1474,0.7638894639402096,TPESampler,COMPLETE
285,0.30542986086854196,2025-04-24 21:40:18.577723,2025-04-24 21:40:21.967389,0 days 00:00:03.389666,0.03910147182797285,4,sqrt,2,20,1349,0.6978872625474065,TPESampler,COMPLETE
286,0.2655311390637975,2025-04-24 21:40:19.254111,2025-04-24 21:40:22.453009,0 days 00:00:03.198898,0.07713719089937925,7,sqrt,1,15,1197,0.6441410823780234,TPESampler,COMPLETE
287,0.2745534098854624,2025-04-24 21:40:20.155820,2025-04-24 21:40:23.726674,0 days 00:00:03.570854,0.06031611537846366,5,sqrt,2,16,1443,0.7351831414097334,TPESampler,COMPLETE
288,0.28745659326346257,2025-04-24 21:40:22.162488,2025-04-24 21:40:25.130772,0 days 00:00:02.968284,0.09654586482477982,9,sqrt,2,17,1257,0.6182708146833618,TPESampler,COMPLETE
289,0.2696435091115587,2025-04-24 21:40:22.651946,2025-04-24 21:40:25.591753,0 days 00:00:02.939807,0.046685389710699764,6,sqrt,1,14,1282,0.6593006985192689,TPESampler,COMPLETE
290,0.27686309298437184,2025-04-24 21:40:23.876945,2025-04-24 21:40:26.515611,0 days 00:00:02.638666,0.05463924395198056,4,sqrt,1,8,1189,0.6442347002715086,TPESampler,COMPLETE
291,0.9540589340765299,2025-04-24 21:40:25.292271,2025-04-24 21:40:27.641215,0 days 00:00:02.348944,0.0106893531257986,5,log2,4,11,942,0.7227896629868188,TPESampler,COMPLETE
292,0.25396957690551414,2025-04-24 21:40:25.750638,2025-04-24 21:40:29.678508,0 days 00:00:03.927870,0.06873327890980449,11,sqrt,1,13,1426,0.638123700541943,TPESampler,COMPLETE
293,0.2732018794772683,2025-04-24 21:40:26.723696,2025-04-24 21:40:30.353161,0 days 00:00:03.629465,0.06281798371977976,4,sqrt,1,2,1470,0.7184449797047557,TPESampler,COMPLETE
294,0.2661065365072638,2025-04-24 21:40:27.823949,2025-04-24 21:40:31.040957,0 days 00:00:03.217008,0.04673026342392298,5,sqrt,1,16,1390,0.676020737583444,TPESampler,COMPLETE
295,0.3027797288592619,2025-04-24 21:40:29.825229,2025-04-24 21:40:33.024979,0 days 00:00:03.199750,0.051875691720764956,8,sqrt,1,11,1351,0.653994034681078,TPESampler,COMPLETE
296,0.30165104237370083,2025-04-24 21:40:30.499492,2025-04-24 21:40:33.697685,0 days 00:00:03.198193,0.03829856434056701,11,sqrt,3,16,1258,0.6691291153497742,TPESampler,COMPLETE
297,0.2703229106879166,2025-04-24 21:40:31.224546,2025-04-24 21:40:34.695784,0 days 00:00:03.471238,0.06788422095484203,10,sqrt,1,14,1398,0.707318242864141,TPESampler,COMPLETE
298,0.4136234859657738,2025-04-24 21:40:33.217295,2025-04-24 21:40:39.573281,0 days 00:00:06.355986,0.04622908267501056,12,,8,18,1437,0.6253285732372799,TPESampler,COMPLETE
299,0.9924108547936872,2025-04-24 21:40:33.890192,2025-04-24 21:40:34.912912,0 days 00:00:01.022720,0.015606753699948876,6,sqrt,4,18,165,0.6428747804057977,TPESampler,COMPLETE
300,0.25452652638458295,2025-04-24 21:40:34.921112,2025-04-24 21:40:38.500276,0 days 00:00:03.579164,0.06218179326717722,9,sqrt,1,9,1483,0.8273423410375347,TPESampler,COMPLETE
301,0.25398154513963017,2025-04-24 21:40:35.107174,2025-04-24 21:40:38.465257,0 days 00:00:03.358083,0.04229881489616857,11,sqrt,1,9,1307,0.654091050578801,TPESampler,COMPLETE
302,0.28893287101121645,2025-04-24 21:40:38.596450,2025-04-24 21:40:42.444067,0 days 00:00:03.847617,0.04163833233326448,12,sqrt,3,5,1351,0.7398424122406972,TPESampler,COMPLETE
303,0.2804015185054063,2025-04-24 21:40:38.632708,2025-04-24 21:40:42.679756,0 days 00:00:04.047048,0.033803992199542665,11,sqrt,1,8,1357,0.6882644279707991,TPESampler,COMPLETE
304,0.2866670436876755,2025-04-24 21:40:39.758565,2025-04-24 21:40:43.602649,0 days 00:00:03.844084,0.05762066737252303,9,sqrt,1,7,1434,0.7811492793067272,TPESampler,COMPLETE
305,0.30325185581086367,2025-04-24 21:40:42.638357,2025-04-24 21:40:46.396911,0 days 00:00:03.758554,0.06409880392785428,11,sqrt,2,9,1400,0.6517599705303035,TPESampler,COMPLETE
306,0.2723100570963248,2025-04-24 21:40:42.912763,2025-04-24 21:40:46.088930,0 days 00:00:03.176167,0.061629534316381615,3,sqrt,1,19,1336,0.6085784396892813,TPESampler,COMPLETE
307,0.31212750727744887,2025-04-24 21:40:43.750156,2025-04-24 21:40:46.749040,0 days 00:00:02.998884,0.05073946587155604,11,sqrt,1,13,1136,0.6423250266556032,TPESampler,COMPLETE
308,0.30810099169845023,2025-04-24 21:40:46.233761,2025-04-24 21:40:48.806337,0 days 00:00:02.572576,0.06103685387872766,9,log2,2,5,1245,0.6107127805696023,TPESampler,COMPLETE
309,0.3563500307562964,2025-04-24 21:40:46.572441,2025-04-24 21:40:48.728183,0 days 00:00:02.155742,0.03227737949301803,3,sqrt,1,5,856,0.75029806289773,TPESampler,COMPLETE
310,0.2898417566150816,2025-04-24 21:40:46.929976,2025-04-24 21:40:50.104927,0 days 00:00:03.174951,0.05878438222605011,12,sqrt,1,9,1281,0.6143180686861152,TPESampler,COMPLETE
311,0.25371229154901315,2025-04-24 21:40:48.860189,2025-04-24 21:40:52.817037,0 days 00:00:03.956848,0.08004450596742246,7,sqrt,1,17,1432,0.6709579480232625,TPESampler,COMPLETE
312,0.31310653630563184,2025-04-24 21:40:48.962792,2025-04-24 21:40:52.917494,0 days 00:00:03.954702,0.07086301813373352,9,sqrt,4,10,1416,0.8340605860651011,TPESampler,COMPLETE
313,0.3314357085491777,2025-04-24 21:40:50.260853,2025-04-24 21:40:53.360941,0 days 00:00:03.100088,0.08382771123153095,4,sqrt,3,7,1175,0.7024068732158348,TPESampler,COMPLETE
314,0.29473140488114924,2025-04-24 21:40:52.982623,2025-04-24 21:40:56.788464,0 days 00:00:03.805841,0.0599227381478017,9,sqrt,2,11,1292,0.81540415666309,TPESampler,COMPLETE
315,0.2159996526095001,2025-04-24 21:40:53.118261,2025-04-24 21:40:57.196305,0 days 00:00:04.078044,0.08921276230425934,8,sqrt,1,14,1441,0.6009547027219384,TPESampler,COMPLETE
316,0.3173840872482491,2025-04-24 21:40:53.584376,2025-04-24 21:40:57.417852,0 days 00:00:03.833476,0.04483395565216046,12,sqrt,2,11,1438,0.8758183645293761,TPESampler,COMPLETE
317,0.6997091637529905,2025-04-24 21:40:56.944311,2025-04-24 21:40:57.794318,0 days 00:00:00.850007,0.06760812712279518,12,log2,4,12,251,0.9829046063585686,TPESampler,COMPLETE
318,0.30566847148329357,2025-04-24 21:40:57.344849,2025-04-24 21:41:00.741837,0 days 00:00:03.396988,0.08399280689670371,9,sqrt,2,12,1494,0.6025045340120017,TPESampler,COMPLETE
319,0.3377438284005905,2025-04-24 21:40:57.592891,2025-04-24 21:41:01.085493,0 days 00:00:03.492602,0.08149225305710038,12,sqrt,2,15,1433,0.6317638109724806,TPESampler,COMPLETE
320,0.4657007857838959,2025-04-24 21:40:58.015285,2025-04-24 21:41:00.144807,0 days 00:00:02.129522,0.0114912640395363,3,,10,14,513,0.7887306494050002,TPESampler,COMPLETE
321,0.2609593071393647,2025-04-24 21:41:00.301988,2025-04-24 21:41:04.059395,0 days 00:00:03.757407,0.0704431093178642,12,log2,1,20,1429,0.8408058840215678,TPESampler,COMPLETE
322,0.26933521585008513,2025-04-24 21:41:00.948424,2025-04-24 21:41:04.823530,0 days 00:00:03.875106,0.08919875002104177,7,sqrt,1,20,1476,0.6451702085391843,TPESampler,COMPLETE
323,0.3227823315372646,2025-04-24 21:41:01.278241,2025-04-24 21:41:05.040993,0 days 00:00:03.762752,0.08748866644675377,8,sqrt,1,10,1451,0.7800924764656607,TPESampler,COMPLETE
324,0.26790238488400137,2025-04-24 21:41:04.225072,2025-04-24 21:41:07.165651,0 days 00:00:02.940579,0.05859165897616962,6,sqrt,1,16,1499,0.6549103882125888,TPESampler,COMPLETE
325,0.2756976173907634,2025-04-24 21:41:04.982998,2025-04-24 21:41:08.771510,0 days 00:00:03.788512,0.07335838514642479,10,sqrt,1,18,1491,0.6556251931552672,TPESampler,COMPLETE
326,0.34389593171030824,2025-04-24 21:41:05.224068,2025-04-24 21:41:08.956389,0 days 00:00:03.732321,0.09774319570589966,8,sqrt,1,14,1406,0.7038919637504891,TPESampler,COMPLETE
327,0.275498432697372,2025-04-24 21:41:07.324518,2025-04-24 21:41:10.289092,0 days 00:00:02.964574,0.09840109785169382,10,sqrt,1,11,1099,0.6020173060927521,TPESampler,COMPLETE
328,0.2814993342880956,2025-04-24 21:41:08.973036,2025-04-24 21:41:11.854152,0 days 00:00:02.881116,0.0877872945969632,8,sqrt,1,11,1447,0.611016003803339,TPESampler,COMPLETE
329,0.4261997090919193,2025-04-24 21:41:09.157788,2025-04-24 21:41:13.501979,0 days 00:00:04.344191,0.025836854587491177,11,,9,7,791,0.8245413761858734,TPESampler,COMPLETE
330,0.27397384716338014,2025-04-24 21:41:10.474535,2025-04-24 21:41:13.027402,0 days 00:00:02.552867,0.07241666795177179,3,sqrt,1,2,1164,0.7024611486891009,TPESampler,COMPLETE
331,0.2598703618791804,2025-04-24 21:41:12.034809,2025-04-24 21:41:15.371157,0 days 00:00:03.336348,0.06751299951886972,10,sqrt,1,16,1302,0.8987071221352507,TPESampler,COMPLETE
332,0.3380192253011357,2025-04-24 21:41:13.209411,2025-04-24 21:41:16.154448,0 days 00:00:02.945037,0.09455270042292152,5,log2,4,2,1141,0.7061747831702795,TPESampler,COMPLETE
333,0.3033914704884319,2025-04-24 21:41:13.686975,2025-04-24 21:41:17.526288,0 days 00:00:03.839313,0.0665419196316719,9,sqrt,2,7,1460,0.8812440771392054,TPESampler,COMPLETE
334,0.6837276447979431,2025-04-24 21:41:15.603994,2025-04-24 21:41:17.437985,0 days 00:00:01.833991,0.013880821605615835,4,sqrt,9,4,801,0.9983786133378416,TPESampler,COMPLETE
335,0.31066034756914906,2025-04-24 21:41:16.322276,2025-04-24 21:41:19.167576,0 days 00:00:02.845300,0.04491229447979087,9,sqrt,1,6,1218,0.6148177357413235,TPESampler,COMPLETE
336,0.3205623839575198,2025-04-24 21:41:17.569995,2025-04-24 21:41:21.003041,0 days 00:00:03.433046,0.06265104903506438,10,sqrt,2,20,1260,0.7574116409103087,TPESampler,COMPLETE
337,0.25011222364548563,2025-04-24 21:41:17.713793,2025-04-24 21:41:21.514983,0 days 00:00:03.801190,0.08705695937709007,7,sqrt,1,14,1469,0.6486046926163833,TPESampler,COMPLETE
338,0.28739728811338167,2025-04-24 21:41:19.363383,2025-04-24 21:41:23.122421,0 days 00:00:03.759038,0.06270979113337333,10,sqrt,1,11,1462,0.8565891875237154,TPESampler,COMPLETE
339,0.3776571543471714,2025-04-24 21:41:21.199839,2025-04-24 21:41:22.715056,0 days 00:00:01.515217,0.058839643426072785,8,sqrt,6,7,440,0.9433308231976936,TPESampler,COMPLETE
340,0.2806000617206277,2025-04-24 21:41:21.715358,2025-04-24 21:41:24.570279,0 days 00:00:02.854921,0.08051942052913116,6,sqrt,2,17,1352,0.7045620459539491,TPESampler,COMPLETE
341,0.26711982290713815,2025-04-24 21:41:22.870358,2025-04-24 21:41:29.695842,0 days 00:00:06.825484,0.06276418410669786,12,,1,18,1406,0.6042510545446493,TPESampler,COMPLETE
342,0.5381416228441603,2025-04-24 21:41:23.247412,2025-04-24 21:41:26.107254,0 days 00:00:02.859842,0.018431287110733375,9,sqrt,9,14,1426,0.6352760168941567,TPESampler,COMPLETE
343,0.2727105750489805,2025-04-24 21:41:24.740557,2025-04-24 21:41:27.984342,0 days 00:00:03.243785,0.09168232577951065,7,sqrt,1,14,1468,0.6106773059298862,TPESampler,COMPLETE
344,0.2830272792316813,2025-04-24 21:41:26.278135,2025-04-24 21:41:28.727816,0 days 00:00:02.449681,0.08835109948018884,5,log2,1,8,1132,0.7473128873814775,TPESampler,COMPLETE
345,0.5514539519549592,2025-04-24 21:41:28.134102,2025-04-24 21:41:29.285300,0 days 00:00:01.151198,0.06319912241840105,10,sqrt,10,12,475,0.6616521157572718,TPESampler,COMPLETE
346,0.48685810053855966,2025-04-24 21:41:28.885172,2025-04-24 21:41:29.967096,0 days 00:00:01.081924,0.07908047291846435,8,sqrt,10,13,292,0.8680011190141839,TPESampler,COMPLETE
347,0.2529616991259745,2025-04-24 21:41:29.478188,2025-04-24 21:41:32.911164,0 days 00:00:03.432976,0.08346484174649653,6,sqrt,1,12,1446,0.7313323896831098,TPESampler,COMPLETE
348,0.332651162862083,2025-04-24 21:41:29.904616,2025-04-24 21:41:33.016448,0 days 00:00:03.111832,0.09938744727841832,4,sqrt,1,3,1357,0.7609216650586128,TPESampler,COMPLETE
349,0.26680886882695476,2025-04-24 21:41:30.238449,2025-04-24 21:41:32.711025,0 days 00:00:02.472576,0.08045911112401824,4,sqrt,1,14,963,0.8033253594795855,TPESampler,COMPLETE
350,0.6478375814987896,2025-04-24 21:41:32.858261,2025-04-24 21:41:33.952817,0 days 00:00:01.094556,0.012451626269646125,10,sqrt,5,19,357,0.9570669135829736,TPESampler,COMPLETE
351,0.25169880083112095,2025-04-24 21:41:33.117478,2025-04-24 21:41:36.730481,0 days 00:00:03.613003,0.06726727207712328,8,sqrt,1,16,1187,0.6141848724540768,TPESampler,COMPLETE
352,0.4807601460720279,2025-04-24 21:41:33.245278,2025-04-24 21:41:36.851319,0 days 00:00:03.606041,0.0838466181911168,10,log2,9,18,1470,0.7686045697667307,TPESampler,COMPLETE
353,0.3141327314185111,2025-04-24 21:41:34.142460,2025-04-24 21:41:37.728860,0 days 00:00:03.586400,0.07087585023320453,6,sqrt,3,11,1284,0.7273615721753582,TPESampler,COMPLETE
354,0.31820425497356625,2025-04-24 21:41:36.925063,2025-04-24 21:41:40.381781,0 days 00:00:03.456718,0.08675870543251447,4,log2,1,3,1490,0.7058219836018332,TPESampler,COMPLETE
355,0.3573563706792865,2025-04-24 21:41:36.991972,2025-04-24 21:41:40.308765,0 days 00:00:03.316793,0.034921893331320876,6,,2,19,507,0.969111644573286,TPESampler,COMPLETE
356,0.29216716739598425,2025-04-24 21:41:37.986034,2025-04-24 21:41:41.121496,0 days 00:00:03.135462,0.056292248538821976,7,sqrt,2,8,1431,0.7041887730453951,TPESampler,COMPLETE
357,0.22684876190282158,2025-04-24 21:41:40.442387,2025-04-24 21:41:43.750490,0 days 00:00:03.308103,0.0891905658994625,4,sqrt,1,8,1407,0.682100294516742,TPESampler,COMPLETE
358,0.274291223202714,2025-04-24 21:41:40.556845,2025-04-24 21:41:44.070809,0 days 00:00:03.513964,0.05334212255045652,4,sqrt,1,8,1408,0.6719993644072665,TPESampler,COMPLETE
359,0.2791766928703486,2025-04-24 21:41:41.293102,2025-04-24 21:41:44.352884,0 days 00:00:03.059782,0.06002302369274876,8,sqrt,1,17,1223,0.6639760441488618,TPESampler,COMPLETE
360,0.3112496517894427,2025-04-24 21:41:43.902108,2025-04-24 21:41:47.755350,0 days 00:00:03.853242,0.08723952984043133,6,sqrt,2,7,1494,0.7325258524813468,TPESampler,COMPLETE
361,0.2352660777479272,2025-04-24 21:41:44.270356,2025-04-24 21:41:48.075422,0 days 00:00:03.805066,0.05781412953425296,8,sqrt,1,16,1433,0.6517399538529107,TPESampler,COMPLETE
362,0.2830622049999853,2025-04-24 21:41:44.547350,2025-04-24 21:41:47.796587,0 days 00:00:03.249237,0.07910291774107711,3,sqrt,1,7,1216,0.6677114428300073,TPESampler,COMPLETE
363,0.35722259698890996,2025-04-24 21:41:47.866911,2025-04-24 21:41:50.997014,0 days 00:00:03.130103,0.09705431163943601,4,sqrt,1,9,1105,0.6847019669611947,TPESampler,COMPLETE
364,0.29002328528602017,2025-04-24 21:41:47.940440,2025-04-24 21:41:50.927000,0 days 00:00:02.986560,0.03875590872881553,9,sqrt,2,15,872,0.6330953713706057,TPESampler,COMPLETE
365,0.5530718676277628,2025-04-24 21:41:48.269605,2025-04-24 21:41:51.089435,0 days 00:00:02.819830,0.05649895751364406,8,log2,9,2,1107,0.8117150257816432,TPESampler,COMPLETE
366,0.2737588705652199,2025-04-24 21:41:51.058804,2025-04-24 21:41:54.510769,0 days 00:00:03.451965,0.09912790411111513,4,sqrt,2,7,1402,0.7268423182394073,TPESampler,COMPLETE
367,0.6373308200240742,2025-04-24 21:41:51.159088,2025-04-24 21:41:54.544514,0 days 00:00:03.385426,0.010765703349993098,5,sqrt,8,3,1174,0.6883756318603165,TPESampler,COMPLETE
368,0.26094624868979943,2025-04-24 21:41:51.249996,2025-04-24 21:41:54.872905,0 days 00:00:03.622909,0.0891225284126836,8,sqrt,1,18,1152,0.7055097122647251,TPESampler,COMPLETE
369,0.26256654980139377,2025-04-24 21:41:54.665606,2025-04-24 21:41:57.451537,0 days 00:00:02.785931,0.050777019039995784,8,sqrt,1,16,1134,0.6231880535489106,TPESampler,COMPLETE
