number,value,datetime_start,datetime_complete,duration,params_learning_rate,params_max_depth,params_max_features,params_min_samples_leaf,params_min_samples_split,params_n_estimators,params_subsample,system_attrs_auto:sampler,state
989,0.31513346443609436,2025-04-24 21:54:06.689386,2025-04-24 21:54:10.150024,0 days 00:00:03.460638,0.0833345707101018,5,sqrt,2,8,1198,0.7523112998734407,TPESampler,COMPLETE
990,0.27112362624225633,2025-04-24 21:54:07.649148,2025-04-24 21:54:10.834968,0 days 00:00:03.185820,0.06093264004125456,4,sqrt,1,8,1020,0.7091977637718221,TPESampler,COMPLETE
991,0.5030868991425274,2025-04-24 21:54:10.370167,2025-04-24 21:54:13.553532,0 days 00:00:03.183365,0.0758407434302852,10,log2,10,7,1499,0.9866126142586737,TPESampler,COMPLETE
992,0.24276918374388431,2025-04-24 21:54:10.651515,2025-04-24 21:54:14.798018,0 days 00:00:04.146503,0.09219609438376854,4,sqrt,1,7,1357,0.6777677030002583,TPESampler,COMPLETE
993,0.4507400314880375,2025-04-24 21:54:11.145875,2025-04-24 21:54:15.216389,0 days 00:00:04.070514,0.04822601889699713,3,sqrt,10,3,1369,0.9722305527736335,TPESampler,COMPLETE
994,0.3146103110677337,2025-04-24 21:54:13.762943,2025-04-24 21:54:17.556907,0 days 00:00:03.793964,0.07872732651243948,6,sqrt,2,19,1432,0.7092963141837227,TPESampler,COMPLETE
995,0.302421491530102,2025-04-24 21:54:14.996233,2025-04-24 21:54:18.858355,0 days 00:00:03.862122,0.0706460398084869,5,sqrt,3,11,1450,0.683125665781675,TPESampler,COMPLETE
996,0.7533194536213954,2025-04-24 21:54:15.441624,2025-04-24 21:54:17.397894,0 days 00:00:01.956270,0.012361682440492756,9,log2,1,15,514,0.9259502553786941,TPESampler,COMPLETE
997,0.29836252714854233,2025-04-24 21:54:17.575775,2025-04-24 21:54:21.424009,0 days 00:00:03.848234,0.06516628557845922,4,sqrt,3,15,1401,0.6116047616755356,TPESampler,COMPLETE
998,0.7898468816078267,2025-04-24 21:54:17.747959,2025-04-24 21:54:20.393862,0 days 00:00:02.645903,0.010315420950390779,7,sqrt,8,18,792,0.6736545987597191,TPESampler,COMPLETE
999,0.24540056779507277,2025-04-24 21:54:19.068370,2025-04-24 21:54:22.007274,0 days 00:00:02.938904,0.09222912886132088,5,sqrt,1,7,1003,0.7560349400203088,TPESampler,COMPLETE
1000,0.326423235634566,2025-04-24 21:54:20.602437,2025-04-24 21:54:24.683520,0 days 00:00:04.081083,0.06873661748001847,6,sqrt,1,17,1275,0.6129733899975851,TPESampler,COMPLETE
1001,0.3316001673378239,2025-04-24 21:54:21.637579,2025-04-24 21:54:25.622930,0 days 00:00:03.985351,0.06765943884860283,8,sqrt,3,18,1304,0.6089456793048751,TPESampler,COMPLETE
1002,0.2515635491329061,2025-04-24 21:54:22.208372,2025-04-24 21:54:25.472209,0 days 00:00:03.263837,0.09873188964164442,3,sqrt,1,8,976,0.7184163485367714,TPESampler,COMPLETE
1003,0.28866512927895166,2025-04-24 21:54:24.976057,2025-04-24 21:54:28.563349,0 days 00:00:03.587292,0.05659999542491859,5,sqrt,3,16,1356,0.8111145517848224,TPESampler,COMPLETE
1004,1.0710101636107379,2025-04-24 21:54:25.683123,2025-04-24 21:54:26.867343,0 days 00:00:01.184220,0.06826017236333042,6,log2,9,13,267,0.9472419315205924,TPESampler,COMPLETE
1005,0.3310068515160681,2025-04-24 21:54:25.863510,2025-04-24 21:54:30.075343,0 days 00:00:04.211833,0.056342616947472425,5,sqrt,4,19,1486,0.6774315054405721,TPESampler,COMPLETE
1006,0.2767374607046883,2025-04-24 21:54:27.078557,2025-04-24 21:54:31.163288,0 days 00:00:04.084731,0.08090231842070597,8,sqrt,3,13,1440,0.6644664288793712,TPESampler,COMPLETE
1007,0.2505333735026698,2025-04-24 21:54:28.769570,2025-04-24 21:54:31.214011,0 days 00:00:02.444441,0.0691808784023393,7,sqrt,1,9,781,0.8017278608213311,TPESampler,COMPLETE
1008,0.25079811342234976,2025-04-24 21:54:30.265459,2025-04-24 21:54:33.980391,0 days 00:00:03.714932,0.07062120263678934,6,sqrt,1,17,1492,0.6128311613793546,TPESampler,COMPLETE
1009,0.27871733245159325,2025-04-24 21:54:31.306873,2025-04-24 21:54:35.384742,0 days 00:00:04.077869,0.09631108514502945,7,log2,3,10,1465,0.7443270199615433,TPESampler,COMPLETE
1010,0.25025415785738736,2025-04-24 21:54:31.355797,2025-04-24 21:54:35.654020,0 days 00:00:04.298223,0.08685335782347155,3,sqrt,1,20,1489,0.600429301312852,TPESampler,COMPLETE
1011,0.2632289076648539,2025-04-24 21:54:34.176378,2025-04-24 21:54:38.304104,0 days 00:00:04.127726,0.04968738011791912,6,sqrt,1,19,1483,0.6984547558959875,TPESampler,COMPLETE
1012,0.25039761525169746,2025-04-24 21:54:35.588393,2025-04-24 21:54:39.253851,0 days 00:00:03.665458,0.09413944062334509,6,sqrt,1,17,1462,0.6174378258381193,TPESampler,COMPLETE
1013,1.1239657816269593,2025-04-24 21:54:35.897458,2025-04-24 21:54:37.647980,0 days 00:00:01.750522,0.022713095565128884,8,log2,10,12,382,0.7828845453101773,TPESampler,COMPLETE
1014,0.44152435629310716,2025-04-24 21:54:37.858053,2025-04-24 21:54:40.397690,0 days 00:00:02.539637,0.04645592485750124,7,log2,4,3,840,0.7703205047466757,TPESampler,COMPLETE
1015,0.28995010970730667,2025-04-24 21:54:38.519412,2025-04-24 21:54:42.787125,0 days 00:00:04.267713,0.09889838483909408,4,sqrt,2,14,1477,0.7631729327455626,TPESampler,COMPLETE
1016,0.3078547572678406,2025-04-24 21:54:39.454634,2025-04-24 21:54:43.506462,0 days 00:00:04.051828,0.07215585183960206,5,log2,2,17,1471,0.6156762932190744,TPESampler,COMPLETE
1017,0.29501304799675726,2025-04-24 21:54:40.615433,2025-04-24 21:54:44.829295,0 days 00:00:04.213862,0.05925339216955905,8,sqrt,1,8,1463,0.6653075770476277,TPESampler,COMPLETE
1018,0.2583128902698105,2025-04-24 21:54:42.991402,2025-04-24 21:54:46.790673,0 days 00:00:03.799271,0.09848540252962,5,sqrt,1,9,1291,0.7515277465249874,TPESampler,COMPLETE
1019,0.2822916413311475,2025-04-24 21:54:43.702498,2025-04-24 21:54:47.096802,0 days 00:00:03.394304,0.08148289841706241,3,sqrt,3,5,1169,0.7429119019259828,TPESampler,COMPLETE
1020,0.30751545412041653,2025-04-24 21:54:45.038772,2025-04-24 21:54:49.811362,0 days 00:00:04.772590,0.061301012948265406,3,,3,17,1481,0.6425460761839239,TPESampler,COMPLETE
1021,0.3485899184161841,2025-04-24 21:54:47.007375,2025-04-24 21:54:50.040183,0 days 00:00:03.032808,0.02837594488056754,8,,5,13,469,0.995219349471479,TPESampler,COMPLETE
1022,0.3007842236026507,2025-04-24 21:54:47.381970,2025-04-24 21:54:50.033547,0 days 00:00:02.651577,0.08882692268798789,6,sqrt,3,8,1211,0.7017348218312208,TPESampler,COMPLETE
1023,0.3329450801831998,2025-04-24 21:54:50.000190,2025-04-24 21:54:53.242391,0 days 00:00:03.242201,0.050243704917523016,7,log2,3,19,1393,0.6890958569344175,TPESampler,COMPLETE
1024,0.28194638355894147,2025-04-24 21:54:50.283544,2025-04-24 21:54:53.832556,0 days 00:00:03.549012,0.06829005057933214,7,sqrt,1,19,1108,0.6056781855011897,TPESampler,COMPLETE
1025,0.34971696914328215,2025-04-24 21:54:50.323484,2025-04-24 21:54:54.610428,0 days 00:00:04.286944,0.09586137063936345,8,sqrt,2,5,1471,0.6984557614145377,TPESampler,COMPLETE
1026,0.33206257027770997,2025-04-24 21:54:53.452127,2025-04-24 21:54:57.885562,0 days 00:00:04.433435,0.07448059129250473,6,,2,12,1071,0.6052066351885339,TPESampler,COMPLETE
1027,0.2917734944963938,2025-04-24 21:54:54.034456,2025-04-24 21:54:57.636458,0 days 00:00:03.602002,0.04700064694074781,10,sqrt,3,15,1433,0.7791570166356733,TPESampler,COMPLETE
1028,0.24618122919244315,2025-04-24 21:54:54.816408,2025-04-24 21:54:57.718055,0 days 00:00:02.901647,0.09688194462293973,3,sqrt,1,10,1147,0.698387908270459,TPESampler,COMPLETE
1029,0.3222441086365024,2025-04-24 21:54:57.784167,2025-04-24 21:55:01.543747,0 days 00:00:03.759580,0.09812393815388389,4,sqrt,1,12,1331,0.6651310478427483,TPESampler,COMPLETE
1030,0.254923286507001,2025-04-24 21:54:57.894014,2025-04-24 21:55:01.702917,0 days 00:00:03.808903,0.0699965943544971,7,log2,1,6,1197,0.7298770727176432,TPESampler,COMPLETE
1031,0.29558549403284257,2025-04-24 21:54:58.083893,2025-04-24 21:55:01.763583,0 days 00:00:03.679690,0.09533022808057103,5,sqrt,2,9,1136,0.6246994404037405,TPESampler,COMPLETE
1032,0.3150587283324997,2025-04-24 21:55:01.731136,2025-04-24 21:55:05.107003,0 days 00:00:03.375867,0.09222134082315304,6,sqrt,1,14,1214,0.7080969802062608,TPESampler,COMPLETE
1033,0.32755348615518026,2025-04-24 21:55:01.887556,2025-04-24 21:55:05.941761,0 days 00:00:04.054205,0.0637002408657631,5,log2,1,12,1371,0.7654707397698362,TPESampler,COMPLETE
1034,0.24668973042389636,2025-04-24 21:55:01.936639,2025-04-24 21:55:06.221758,0 days 00:00:04.285119,0.08984431513679168,7,sqrt,1,10,1468,0.6851386622619889,TPESampler,COMPLETE
1035,0.2888330531160775,2025-04-24 21:55:05.310226,2025-04-24 21:55:09.144103,0 days 00:00:03.833877,0.06837038282416444,6,sqrt,1,15,1482,0.6826656715258863,TPESampler,COMPLETE
1036,0.3357584293744954,2025-04-24 21:55:06.161867,2025-04-24 21:55:08.385143,0 days 00:00:02.223276,0.026850788451481675,4,,5,15,452,0.8758224988128973,TPESampler,COMPLETE
1037,0.2880764727368574,2025-04-24 21:55:06.457524,2025-04-24 21:55:09.427007,0 days 00:00:02.969483,0.09897899974719919,3,sqrt,1,16,1145,0.6005881633848726,TPESampler,COMPLETE
1038,0.29304012692853637,2025-04-24 21:55:08.609232,2025-04-24 21:55:12.736745,0 days 00:00:04.127513,0.0871765219173944,11,sqrt,3,19,1439,0.6447075158575907,TPESampler,COMPLETE
1039,0.2799085743287163,2025-04-24 21:55:09.373225,2025-04-24 21:55:12.879461,0 days 00:00:03.506236,0.07880891489569312,8,sqrt,1,16,1222,0.6655492708439115,TPESampler,COMPLETE
1040,0.31345262425944537,2025-04-24 21:55:09.656279,2025-04-24 21:55:12.974708,0 days 00:00:03.318429,0.019678957832816604,12,sqrt,2,20,1073,0.8706335998596961,TPESampler,COMPLETE
1041,0.2546795822035667,2025-04-24 21:55:12.940123,2025-04-24 21:55:17.072726,0 days 00:00:04.132603,0.06421277753820262,5,sqrt,1,10,1490,0.6724453274131303,TPESampler,COMPLETE
1042,0.3086631016022453,2025-04-24 21:55:13.106786,2025-04-24 21:55:17.018542,0 days 00:00:03.911756,0.091662326971667,6,sqrt,1,9,1192,0.6479763678015711,TPESampler,COMPLETE
1043,0.25994286501388336,2025-04-24 21:55:13.154775,2025-04-24 21:55:17.403791,0 days 00:00:04.249016,0.0943829288387013,7,sqrt,1,14,1398,0.6565726892903515,TPESampler,COMPLETE
1044,0.35817033346442684,2025-04-24 21:55:17.175240,2025-04-24 21:55:19.898829,0 days 00:00:02.723589,0.027955519880259936,12,log2,2,17,983,0.9127120066943298,TPESampler,COMPLETE
1045,0.28533477129014706,2025-04-24 21:55:17.220843,2025-04-24 21:55:20.890632,0 days 00:00:03.669789,0.07447519703558322,7,sqrt,1,17,1457,0.6068176926436757,TPESampler,COMPLETE
1046,0.36995811075696855,2025-04-24 21:55:17.674621,2025-04-24 21:55:18.933786,0 days 00:00:01.259165,0.08879832301264544,8,,6,9,116,0.6075468773067814,TPESampler,COMPLETE
1047,0.31675339141194186,2025-04-24 21:55:19.143719,2025-04-24 21:55:23.992788,0 days 00:00:04.849069,0.054387004468621325,4,,4,11,1289,0.7596137126533368,TPESampler,COMPLETE
1048,0.9014638922855827,2025-04-24 21:55:20.083724,2025-04-24 21:55:22.893769,0 days 00:00:02.810045,0.024299904030830027,11,log2,8,17,1081,0.6424636517127001,TPESampler,COMPLETE
1049,0.27739954271624917,2025-04-24 21:55:21.122432,2025-04-24 21:55:24.022742,0 days 00:00:02.900310,0.04359067095167811,5,sqrt,1,6,1171,0.7809579076756336,TPESampler,COMPLETE
1050,0.30166535360382907,2025-04-24 21:55:23.090515,2025-04-24 21:55:26.197972,0 days 00:00:03.107457,0.0588649445550295,5,sqrt,2,15,1494,0.7454689340139842,TPESampler,COMPLETE
1051,0.3131094598620377,2025-04-24 21:55:24.155449,2025-04-24 21:55:30.646103,0 days 00:00:06.490654,0.05894825408207389,12,,3,18,885,0.989293460560537,TPESampler,COMPLETE
1052,0.2647845413275688,2025-04-24 21:55:24.194762,2025-04-24 21:55:27.369510,0 days 00:00:03.174748,0.09083146459373544,6,sqrt,1,20,1352,0.6013440287617163,TPESampler,COMPLETE
1053,0.7612974998402563,2025-04-24 21:55:26.384049,2025-04-24 21:55:28.037653,0 days 00:00:01.653604,0.01714512491554741,12,sqrt,10,5,718,0.6122673677164754,TPESampler,COMPLETE
1054,0.26207114081414284,2025-04-24 21:55:27.562197,2025-04-24 21:55:30.583583,0 days 00:00:03.021386,0.09989604012259347,4,sqrt,1,5,1250,0.6881445318824783,TPESampler,COMPLETE
1055,0.23890342865486539,2025-04-24 21:55:28.225968,2025-04-24 21:55:31.606268,0 days 00:00:03.380300,0.09664682244263825,4,sqrt,1,10,1480,0.6838806518762746,TPESampler,COMPLETE
1056,0.4526139238270091,2025-04-24 21:55:30.738365,2025-04-24 21:55:34.529576,0 days 00:00:03.791211,0.047530374000405405,12,,10,11,560,0.9323190402051214,TPESampler,COMPLETE
1057,0.2954289020817976,2025-04-24 21:55:30.811183,2025-04-24 21:55:34.208463,0 days 00:00:03.397280,0.08963392343297444,6,sqrt,1,14,1438,0.6157340588687901,TPESampler,COMPLETE
1058,0.28390102697282255,2025-04-24 21:55:31.814435,2025-04-24 21:55:34.828402,0 days 00:00:03.013967,0.04965374782335494,9,sqrt,1,18,1436,0.6772219639284772,TPESampler,COMPLETE
1059,0.2939594905150135,2025-04-24 21:55:34.616359,2025-04-24 21:55:38.309374,0 days 00:00:03.693015,0.052144481480280835,4,sqrt,2,19,1243,0.6706563609530025,TPESampler,COMPLETE
1060,0.25157081557219374,2025-04-24 21:55:35.040920,2025-04-24 21:55:39.340016,0 days 00:00:04.299096,0.0964362411740303,8,sqrt,1,9,1448,0.6340360642538756,TPESampler,COMPLETE
1061,0.25644235391667203,2025-04-24 21:55:35.250145,2025-04-24 21:55:39.281261,0 days 00:00:04.031116,0.08542490840615681,3,sqrt,1,6,1444,0.7189249040975292,TPESampler,COMPLETE
1062,0.4774344170850624,2025-04-24 21:55:38.515629,2025-04-24 21:55:41.953425,0 days 00:00:03.437796,0.07646268551227534,8,log2,7,9,1495,0.6292773701242131,TPESampler,COMPLETE
1063,0.306707795536999,2025-04-24 21:55:39.445068,2025-04-24 21:55:43.675465,0 days 00:00:04.230397,0.09895968575511555,9,sqrt,2,15,1424,0.600841462361788,TPESampler,COMPLETE
1064,0.24783248966682953,2025-04-24 21:55:39.487372,2025-04-24 21:55:43.433251,0 days 00:00:03.945879,0.0955628557391394,5,sqrt,1,12,1318,0.6032744667678877,TPESampler,COMPLETE
1065,0.2535882262251364,2025-04-24 21:55:42.168621,2025-04-24 21:55:45.645586,0 days 00:00:03.476965,0.06342098520681104,4,sqrt,1,20,1385,0.6883436044405659,TPESampler,COMPLETE
1066,0.41742795380510844,2025-04-24 21:55:43.629905,2025-04-24 21:55:48.840932,0 days 00:00:05.211027,0.0715684115525568,8,,8,7,1161,0.6363506259167406,TPESampler,COMPLETE
1067,1.0702366835008494,2025-04-24 21:55:43.881134,2025-04-24 21:55:46.409593,0 days 00:00:02.528459,0.010360843781323716,9,log2,7,2,1067,0.694889717205335,TPESampler,COMPLETE
1068,0.3061444122520014,2025-04-24 21:55:45.846325,2025-04-24 21:55:48.738825,0 days 00:00:02.892500,0.09413435843914217,6,sqrt,2,20,1185,0.6874562853304496,TPESampler,COMPLETE
1069,0.323692779462856,2025-04-24 21:55:46.628346,2025-04-24 21:55:49.913680,0 days 00:00:03.285334,0.0846262949426094,9,sqrt,1,15,1452,0.6904389165360245,TPESampler,COMPLETE
1070,0.2392362994415048,2025-04-24 21:55:48.904859,2025-04-24 21:55:51.224421,0 days 00:00:02.319562,0.09801065628692936,5,sqrt,1,2,733,0.654883464753733,TPESampler,COMPLETE
1071,0.41524921139595894,2025-04-24 21:55:48.989437,2025-04-24 21:55:50.402243,0 days 00:00:01.412806,0.02334094327909363,6,,4,4,104,0.7378575156377577,TPESampler,COMPLETE
1072,0.7372642714938726,2025-04-24 21:55:50.104292,2025-04-24 21:55:51.666636,0 days 00:00:01.562344,0.031286171562714106,11,log2,6,20,667,0.9157357244455767,TPESampler,COMPLETE
1073,0.23401263396238187,2025-04-24 21:55:50.595023,2025-04-24 21:55:54.726226,0 days 00:00:04.131203,0.09968900007101614,5,sqrt,1,6,1403,0.690855911301612,TPESampler,COMPLETE
1074,0.31108751113353184,2025-04-24 21:55:51.534971,2025-04-24 21:55:55.412749,0 days 00:00:03.877778,0.09697828680715645,7,sqrt,2,13,1307,0.602744748261489,TPESampler,COMPLETE
1075,0.295255890530289,2025-04-24 21:55:51.890742,2025-04-24 21:55:55.769276,0 days 00:00:03.878534,0.07837191110128314,5,sqrt,3,13,1398,0.6104346510705317,TPESampler,COMPLETE
1076,0.36572283264707517,2025-04-24 21:55:54.926868,2025-04-24 21:56:03.168369,0 days 00:00:08.241501,0.026289535924237963,12,,6,2,1262,0.9827598277496102,TPESampler,COMPLETE
1077,0.2591580342718287,2025-04-24 21:55:55.616328,2025-04-24 21:55:58.852600,0 days 00:00:03.236272,0.09828060183270858,4,sqrt,1,8,1484,0.667290629147942,TPESampler,COMPLETE
1078,0.2856576423547926,2025-04-24 21:55:55.984527,2025-04-24 21:55:58.828023,0 days 00:00:02.843496,0.09584812258878832,5,sqrt,1,20,1116,0.6076918879350167,TPESampler,COMPLETE
1079,0.9614825940286622,2025-04-24 21:55:58.969547,2025-04-24 21:56:01.378409,0 days 00:00:02.408862,0.014361267982343747,8,log2,8,10,1239,0.6941893567928303,TPESampler,COMPLETE
1080,0.33271729373824527,2025-04-24 21:55:59.018323,2025-04-24 21:56:00.774340,0 days 00:00:01.756017,0.025641507976631832,11,sqrt,2,16,445,0.7634200809149194,TPESampler,COMPLETE
1081,0.3317249535246148,2025-04-24 21:56:00.966195,2025-04-24 21:56:05.056792,0 days 00:00:04.090597,0.03162046467081705,3,,2,19,1257,0.6483687242220693,TPESampler,COMPLETE
1082,1.1474475999733582,2025-04-24 21:56:01.584663,2025-04-24 21:56:03.110609,0 days 00:00:01.525946,0.010859518670798115,7,log2,6,13,681,0.8494622151055173,TPESampler,COMPLETE
1083,0.2729871816875247,2025-04-24 21:56:03.267236,2025-04-24 21:56:06.986352,0 days 00:00:03.719116,0.09935268454183492,5,sqrt,3,8,1391,0.708232450235796,TPESampler,COMPLETE
1084,0.2751285538732888,2025-04-24 21:56:03.320397,2025-04-24 21:56:07.576294,0 days 00:00:04.255897,0.09802448767085414,12,sqrt,1,17,1381,0.7164845347236654,TPESampler,COMPLETE
1085,0.27865364312988916,2025-04-24 21:56:05.259197,2025-04-24 21:56:09.059866,0 days 00:00:03.800669,0.06396098926969264,3,sqrt,3,7,1454,0.8129889534240291,TPESampler,COMPLETE
1086,0.2872658814474946,2025-04-24 21:56:07.190621,2025-04-24 21:56:10.932558,0 days 00:00:03.741937,0.055014393014750106,8,sqrt,2,12,1217,0.6341044664170974,TPESampler,COMPLETE
1087,0.34278312070903594,2025-04-24 21:56:07.781154,2025-04-24 21:56:10.898964,0 days 00:00:03.117810,0.06681453393845245,4,log2,3,13,1036,0.6110337776213772,TPESampler,COMPLETE
1088,0.23097445277914716,2025-04-24 21:56:09.288861,2025-04-24 21:56:12.380687,0 days 00:00:03.091826,0.08776988556723068,5,sqrt,1,16,1467,0.6098491302910033,TPESampler,COMPLETE
1089,0.9613425013628114,2025-04-24 21:56:11.069141,2025-04-24 21:56:12.743054,0 days 00:00:01.673913,0.03612840595978221,7,log2,4,5,292,0.6234654186619157,TPESampler,COMPLETE
1090,0.22566613164286284,2025-04-24 21:56:11.116329,2025-04-24 21:56:14.749137,0 days 00:00:03.632808,0.0960717393560196,9,sqrt,1,18,1314,0.6463293859419212,TPESampler,COMPLETE
1091,0.24694567363508882,2025-04-24 21:56:12.627425,2025-04-24 21:56:15.717045,0 days 00:00:03.089620,0.052527636657383005,4,sqrt,1,13,1426,0.6120320999300749,TPESampler,COMPLETE
1092,0.2708660960255374,2025-04-24 21:56:13.091752,2025-04-24 21:56:19.057216,0 days 00:00:05.965464,0.060897591649524935,7,,1,19,1393,0.6412470167285989,TPESampler,COMPLETE
1093,0.29150480112224214,2025-04-24 21:56:14.938133,2025-04-24 21:56:18.088026,0 days 00:00:03.149893,0.07111228968222973,4,sqrt,3,16,1315,0.6573737558392816,TPESampler,COMPLETE
1094,0.30087453995427915,2025-04-24 21:56:15.933177,2025-04-24 21:56:19.084956,0 days 00:00:03.151779,0.05913490197370935,5,sqrt,3,17,1459,0.6204003243238373,TPESampler,COMPLETE
1095,0.2779881572905652,2025-04-24 21:56:18.284008,2025-04-24 21:56:21.465086,0 days 00:00:03.181078,0.05969035857632842,4,sqrt,1,17,1492,0.6067084675543291,TPESampler,COMPLETE
1096,0.280101100747066,2025-04-24 21:56:19.201641,2025-04-24 21:56:22.393419,0 days 00:00:03.191778,0.08982131732633357,10,sqrt,1,15,1184,0.7063449323979661,TPESampler,COMPLETE
1097,0.41492063469212515,2025-04-24 21:56:19.244126,2025-04-24 21:56:21.437434,0 days 00:00:02.193308,0.06124558469020204,9,log2,1,17,594,0.8998648743387329,TPESampler,COMPLETE
1098,0.3720684137551541,2025-04-24 21:56:21.558532,2025-04-24 21:56:26.339484,0 days 00:00:04.780952,0.011552831814028434,4,,1,6,1199,0.8905573178244197,TPESampler,COMPLETE
1099,0.31119726424394184,2025-04-24 21:56:21.592617,2025-04-24 21:56:24.590851,0 days 00:00:02.998234,0.0780043154747743,10,sqrt,2,19,1113,0.6659322628985774,TPESampler,COMPLETE
1100,0.2977675412022933,2025-04-24 21:56:22.591331,2025-04-24 21:56:25.237512,0 days 00:00:02.646181,0.06128960949244023,10,sqrt,1,18,940,0.6319965294879112,TPESampler,COMPLETE
1101,0.23471638278701737,2025-04-24 21:56:24.791871,2025-04-24 21:56:28.546257,0 days 00:00:03.754386,0.09909148565902307,6,sqrt,1,19,1480,0.7096593557225734,TPESampler,COMPLETE
1102,0.3115019977854842,2025-04-24 21:56:25.446837,2025-04-24 21:56:28.631428,0 days 00:00:03.184591,0.04444458562855888,9,sqrt,2,20,1107,0.7245046995325685,TPESampler,COMPLETE
1103,0.30333799279478374,2025-04-24 21:56:26.505521,2025-04-24 21:56:29.814834,0 days 00:00:03.309313,0.08448941153089937,9,sqrt,2,18,1218,0.6857589403269103,TPESampler,COMPLETE
1104,0.2657121005559368,2025-04-24 21:56:28.702356,2025-04-24 21:56:33.078083,0 days 00:00:04.375727,0.08225357144036749,7,sqrt,1,20,1459,0.7084566056338666,TPESampler,COMPLETE
1105,0.30904637203951985,2025-04-24 21:56:28.843052,2025-04-24 21:56:33.124857,0 days 00:00:04.281805,0.09810575203061839,4,sqrt,3,16,1480,0.6350550680714147,TPESampler,COMPLETE
1106,0.29236717726404393,2025-04-24 21:56:30.014850,2025-04-24 21:56:34.140288,0 days 00:00:04.125438,0.0837008547033938,7,sqrt,3,18,1498,0.6953184457697623,TPESampler,COMPLETE
1107,0.283298076499505,2025-04-24 21:56:33.221073,2025-04-24 21:56:36.899963,0 days 00:00:03.678890,0.08871081415058145,4,sqrt,2,19,1329,0.74217457929417,TPESampler,COMPLETE
1108,0.3686978912203009,2025-04-24 21:56:33.267516,2025-04-24 21:56:35.191531,0 days 00:00:01.924015,0.0237078416639177,3,,2,11,295,0.7409241624822177,TPESampler,COMPLETE
1109,0.2842191956876329,2025-04-24 21:56:34.353033,2025-04-24 21:56:37.860810,0 days 00:00:03.507777,0.06498041674416975,5,sqrt,2,16,1290,0.6045905998119516,TPESampler,COMPLETE
1110,0.24480273864212812,2025-04-24 21:56:35.392713,2025-04-24 21:56:39.294238,0 days 00:00:03.901525,0.0948486292433323,5,sqrt,1,17,1377,0.6863653030682877,TPESampler,COMPLETE
1111,0.31016879888294807,2025-04-24 21:56:37.099369,2025-04-24 21:56:41.003555,0 days 00:00:03.904186,0.07483239242925495,5,sqrt,2,19,1488,0.7252771821648474,TPESampler,COMPLETE
