number,value,datetime_start,datetime_complete,duration,params_learning_rate,params_max_depth,params_max_features,params_min_samples_leaf,params_min_samples_split,params_n_estimators,params_subsample,system_attrs_auto:sampler,state
1973,0.2912131497887937,2025-04-24 22:13:51.370090,2025-04-24 22:13:56.006721,0 days 00:00:04.636631,0.09917920147496341,4,sqrt,2,16,1475,0.7271923626092597,TPESampler,COMPLETE
1974,0.2555521801834524,2025-04-24 22:13:51.452486,2025-04-24 22:13:55.066099,0 days 00:00:03.613613,0.09510400795858734,5,sqrt,1,9,993,0.6004753307270495,TPESampler,COMPLETE
1975,0.28265630674323666,2025-04-24 22:13:54.263732,2025-04-24 22:13:57.681873,0 days 00:00:03.418141,0.034101218795856425,9,sqrt,1,20,1271,0.7126139048305082,TPESampler,COMPLETE
1976,0.42160659301373266,2025-04-24 22:13:55.323472,2025-04-24 22:13:57.502679,0 days 00:00:02.179207,0.04061603723735822,11,,8,7,253,0.790075005878449,TPESampler,COMPLETE
1977,0.2994875174316287,2025-04-24 22:13:56.204794,2025-04-24 22:13:59.812024,0 days 00:00:03.607230,0.06629071698545831,8,sqrt,3,11,1404,0.6939362785608914,TPESampler,COMPLETE
1978,0.45390910579362603,2025-04-24 22:13:57.690284,2025-04-24 22:14:00.894907,0 days 00:00:03.204623,0.040603540413449844,7,,10,2,562,0.8597051381082671,TPESampler,COMPLETE
1979,0.27741389978785863,2025-04-24 22:13:57.929597,2025-04-24 22:14:00.864533,0 days 00:00:02.934936,0.06541440818277652,4,sqrt,1,9,1314,0.6567856336066772,TPESampler,COMPLETE
1980,0.3092715745298656,2025-04-24 22:14:00.036258,2025-04-24 22:14:02.543689,0 days 00:00:02.507431,0.08217199347871013,4,log2,2,12,1125,0.7326363800523621,TPESampler,COMPLETE
1981,0.38659613850078306,2025-04-24 22:14:01.039730,2025-04-24 22:14:05.958437,0 days 00:00:04.918707,0.06407768769128447,10,,2,11,746,0.8222957775670123,TPESampler,COMPLETE
1982,0.2632282985720323,2025-04-24 22:14:01.088800,2025-04-24 22:14:04.483812,0 days 00:00:03.395012,0.08655091449486733,5,sqrt,1,12,1479,0.6555888244996525,TPESampler,COMPLETE
1983,0.28452252242781545,2025-04-24 22:14:02.754225,2025-04-24 22:14:05.426337,0 days 00:00:02.672112,0.09737851371935073,10,sqrt,1,16,1104,0.6686612284171061,TPESampler,COMPLETE
1984,0.36126354766059154,2025-04-24 22:14:04.685120,2025-04-24 22:14:06.115255,0 days 00:00:01.430135,0.041353547560808585,7,sqrt,5,11,403,0.8358620844430665,TPESampler,COMPLETE
1985,0.24096142675901208,2025-04-24 22:14:05.724879,2025-04-24 22:14:09.296602,0 days 00:00:03.571723,0.09844590654325334,8,sqrt,1,10,1274,0.6587687297958904,TPESampler,COMPLETE
1986,0.30934634471296546,2025-04-24 22:14:06.225972,2025-04-24 22:14:10.640097,0 days 00:00:04.414125,0.07047698309060495,5,,3,7,992,0.6425142948649883,TPESampler,COMPLETE
1987,0.5538650042121567,2025-04-24 22:14:06.394444,2025-04-24 22:14:09.381586,0 days 00:00:02.987142,0.07637955450394024,12,log2,9,5,1116,0.742321442750495,TPESampler,COMPLETE
1988,0.3687431837477487,2025-04-24 22:14:09.500205,2025-04-24 22:14:13.304630,0 days 00:00:03.804425,0.02058398552788004,9,,2,16,586,0.7815446445224756,TPESampler,COMPLETE
1989,0.3432311859968019,2025-04-24 22:14:09.630594,2025-04-24 22:14:13.101315,0 days 00:00:03.470721,0.0528696148605987,4,log2,3,20,1485,0.6722190472494897,TPESampler,COMPLETE
1990,0.27957331066090546,2025-04-24 22:14:10.856651,2025-04-24 22:14:14.539899,0 days 00:00:03.683248,0.06333437627280404,10,sqrt,1,20,1500,0.6476927046684444,TPESampler,COMPLETE
1991,0.2900162223511794,2025-04-24 22:14:13.376390,2025-04-24 22:14:17.527284,0 days 00:00:04.150894,0.060246163653376754,7,sqrt,3,16,1284,0.8238212924516941,TPESampler,COMPLETE
1992,0.2801663129483077,2025-04-24 22:14:13.500509,2025-04-24 22:14:17.967820,0 days 00:00:04.467311,0.09813792899870816,5,sqrt,1,19,1415,0.626055820218026,TPESampler,COMPLETE
1993,0.3301273195251045,2025-04-24 22:14:14.760216,2025-04-24 22:14:18.417281,0 days 00:00:03.657065,0.06484151858347813,4,log2,1,20,1240,0.8489511687831808,TPESampler,COMPLETE
1994,0.267981693828158,2025-04-24 22:14:17.743625,2025-04-24 22:14:21.303914,0 days 00:00:03.560289,0.05501602465743502,5,sqrt,1,19,1241,0.6497145729582525,TPESampler,COMPLETE
1995,0.2722936724375727,2025-04-24 22:14:18.263615,2025-04-24 22:14:22.094271,0 days 00:00:03.830656,0.06116609364120894,6,sqrt,3,17,1465,0.6428337913988119,TPESampler,COMPLETE
1996,0.27494995362601093,2025-04-24 22:14:18.701146,2025-04-24 22:14:22.010399,0 days 00:00:03.309253,0.09130608660904004,11,log2,2,10,1232,0.829843292416687,TPESampler,COMPLETE
1997,0.27788401710261373,2025-04-24 22:14:21.493812,2025-04-24 22:14:24.055436,0 days 00:00:02.561624,0.07031565803672436,6,sqrt,3,18,1077,0.7099355719351792,TPESampler,COMPLETE
1998,0.27397204589676555,2025-04-24 22:14:22.305552,2025-04-24 22:14:26.063904,0 days 00:00:03.758352,0.08788352273609981,12,log2,1,20,1281,0.739063274077081,TPESampler,COMPLETE
1999,0.8314927114239818,2025-04-24 22:14:22.353728,2025-04-24 22:14:25.393913,0 days 00:00:03.040185,0.017226524026703032,11,log2,8,20,1178,0.9706886012317568,TPESampler,COMPLETE
2000,0.27820386062834257,2025-04-24 22:14:24.232223,2025-04-24 22:14:27.649250,0 days 00:00:03.417027,0.06682466553096617,8,sqrt,1,17,1218,0.6090542394058764,TPESampler,COMPLETE
2001,0.3092302589752759,2025-04-24 22:14:25.599714,2025-04-24 22:14:28.811835,0 days 00:00:03.212121,0.093188774815565,3,sqrt,1,13,1255,0.7759403542546581,TPESampler,COMPLETE
2002,0.2646197439702871,2025-04-24 22:14:26.312138,2025-04-24 22:14:31.857201,0 days 00:00:05.545063,0.052698198466215845,8,,1,20,1069,0.6125921251111162,TPESampler,COMPLETE
2003,0.2663258814824322,2025-04-24 22:14:27.857501,2025-04-24 22:14:31.074342,0 days 00:00:03.216841,0.062028942757899455,4,sqrt,1,20,1410,0.7578798018896793,TPESampler,COMPLETE
2004,0.846769267235978,2025-04-24 22:14:29.021825,2025-04-24 22:14:30.322264,0 days 00:00:01.300439,0.021908959044655223,5,sqrt,7,17,245,0.7909191085291897,TPESampler,COMPLETE
2005,0.24759013079023878,2025-04-24 22:14:30.516484,2025-04-24 22:14:33.751798,0 days 00:00:03.235314,0.0998443737639115,3,sqrt,1,10,1276,0.6938022386955766,TPESampler,COMPLETE
2006,0.2846497104206954,2025-04-24 22:14:31.288705,2025-04-24 22:14:35.554266,0 days 00:00:04.265561,0.09413669750043363,9,sqrt,1,18,1400,0.7088966788255497,TPESampler,COMPLETE
2007,0.2632843283324208,2025-04-24 22:14:32.080813,2025-04-24 22:14:36.178793,0 days 00:00:04.097980,0.09216577133151158,9,sqrt,1,17,1311,0.6069079935511055,TPESampler,COMPLETE
2008,0.27536253103297437,2025-04-24 22:14:33.968343,2025-04-24 22:14:38.073150,0 days 00:00:04.104807,0.06767412190157418,8,sqrt,1,12,1457,0.6886256577729247,TPESampler,COMPLETE
2009,0.28892984326367577,2025-04-24 22:14:35.776408,2025-04-24 22:14:38.702425,0 days 00:00:02.926017,0.0679979687251029,3,sqrt,1,15,1194,0.8515194628698939,TPESampler,COMPLETE
2010,0.9042522894612179,2025-04-24 22:14:36.474872,2025-04-24 22:14:37.984738,0 days 00:00:01.509866,0.06490884710365447,7,log2,10,13,304,0.8157759242556902,TPESampler,COMPLETE
2011,1.3222474281202563,2025-04-24 22:14:38.182392,2025-04-24 22:14:39.433880,0 days 00:00:01.251488,0.014868287604508599,3,log2,10,17,124,0.7925999922147406,TPESampler,COMPLETE
2012,0.33623459991801063,2025-04-24 22:14:38.337534,2025-04-24 22:14:42.603809,0 days 00:00:04.266275,0.09926742411347834,6,sqrt,1,10,1477,0.6339411844230639,TPESampler,COMPLETE
2013,0.30197369331163576,2025-04-24 22:14:39.027783,2025-04-24 22:14:41.530034,0 days 00:00:02.502251,0.08872923367467991,4,sqrt,3,20,777,0.8524102210030637,TPESampler,COMPLETE
2014,0.33180804516429535,2025-04-24 22:14:39.639092,2025-04-24 22:14:43.947108,0 days 00:00:04.308016,0.09825583509551342,9,sqrt,2,16,1454,0.6466904085899718,TPESampler,COMPLETE
2015,0.2931837787213788,2025-04-24 22:14:41.710065,2025-04-24 22:14:45.188614,0 days 00:00:03.478549,0.09765715309092132,11,log2,2,19,1194,0.6515363947695657,TPESampler,COMPLETE
2016,0.28133013355555975,2025-04-24 22:14:42.839255,2025-04-24 22:14:45.936515,0 days 00:00:03.097260,0.07098084813246669,10,sqrt,3,12,1139,0.6088230995940516,TPESampler,COMPLETE
2017,0.3330168371735935,2025-04-24 22:14:44.164088,2025-04-24 22:14:49.577127,0 days 00:00:05.413039,0.09488691556683074,6,,4,9,1285,0.6857407389420682,TPESampler,COMPLETE
2018,0.2805942317862985,2025-04-24 22:14:45.376005,2025-04-24 22:14:48.177978,0 days 00:00:02.801973,0.07687669910533493,7,sqrt,3,19,1292,0.6291172659404465,TPESampler,COMPLETE
2019,0.7891127576345671,2025-04-24 22:14:46.170455,2025-04-24 22:14:47.376820,0 days 00:00:01.206365,0.03607280633367132,6,log2,3,2,275,0.9817260918317728,TPESampler,COMPLETE
2020,0.2637548002960303,2025-04-24 22:14:47.573179,2025-04-24 22:14:50.851019,0 days 00:00:03.277840,0.0698763046690893,7,sqrt,1,17,1231,0.6570802290052088,TPESampler,COMPLETE
2021,0.432054418765093,2025-04-24 22:14:48.408257,2025-04-24 22:14:51.175769,0 days 00:00:02.767512,0.0837489441623653,11,sqrt,9,13,1019,0.9323853047436597,TPESampler,COMPLETE
2022,0.27055851242592677,2025-04-24 22:14:49.787308,2025-04-24 22:14:52.483650,0 days 00:00:02.696342,0.0943585004855462,7,sqrt,3,20,963,0.6020959203946571,TPESampler,COMPLETE
2023,0.9020272128486724,2025-04-24 22:14:51.036340,2025-04-24 22:14:53.027627,0 days 00:00:01.991287,0.015950922806007267,8,log2,4,6,622,0.82566797079975,TPESampler,COMPLETE
2024,0.2884730770496251,2025-04-24 22:14:51.406998,2025-04-24 22:14:55.116563,0 days 00:00:03.709565,0.07076096824550783,6,sqrt,1,19,1478,0.6082182072151452,TPESampler,COMPLETE
2025,0.2678603634202156,2025-04-24 22:14:52.666166,2025-04-24 22:14:56.122616,0 days 00:00:03.456450,0.07244335400078311,7,sqrt,1,17,1323,0.6011917243768263,TPESampler,COMPLETE
2026,0.25287751452836055,2025-04-24 22:14:53.255419,2025-04-24 22:14:56.358484,0 days 00:00:03.103065,0.057180504339963696,6,sqrt,1,20,1122,0.6635513387708507,TPESampler,COMPLETE
2027,0.223815616647672,2025-04-24 22:14:55.295680,2025-04-24 22:14:58.796809,0 days 00:00:03.501129,0.06185261823163901,5,sqrt,1,18,1396,0.6812231736844756,TPESampler,COMPLETE
2028,0.3007714934706536,2025-04-24 22:14:56.313690,2025-04-24 22:15:00.085474,0 days 00:00:03.771784,0.09672811106980672,8,sqrt,1,15,1206,0.7060537431131798,TPESampler,COMPLETE
2029,0.2879739991097795,2025-04-24 22:14:56.623339,2025-04-24 22:15:00.877242,0 days 00:00:04.253903,0.06061549661107657,5,sqrt,2,15,1486,0.7981460161710382,TPESampler,COMPLETE
2030,0.2820491128862538,2025-04-24 22:14:59.046993,2025-04-24 22:15:02.946670,0 days 00:00:03.899677,0.036670772154807664,5,sqrt,1,15,1353,0.7418515466461679,TPESampler,COMPLETE
2031,0.28954332879690126,2025-04-24 22:15:00.308207,2025-04-24 22:15:04.125625,0 days 00:00:03.817418,0.06280365947216107,6,sqrt,3,17,1296,0.7587156911476907,TPESampler,COMPLETE
2032,0.2621239173966885,2025-04-24 22:15:01.095349,2025-04-24 22:15:05.286577,0 days 00:00:04.191228,0.042191571110127626,6,sqrt,1,18,1463,0.6992198035186048,TPESampler,COMPLETE
2033,0.429190906794622,2025-04-24 22:15:03.159250,2025-04-24 22:15:05.213349,0 days 00:00:02.054099,0.095690718368855,12,sqrt,9,9,597,0.772095022991688,TPESampler,COMPLETE
2034,0.2709140744339007,2025-04-24 22:15:04.347256,2025-04-24 22:15:07.892459,0 days 00:00:03.545203,0.08849977642996124,10,sqrt,1,11,1402,0.6076326320120952,TPESampler,COMPLETE
2035,0.25387151689859105,2025-04-24 22:15:05.364951,2025-04-24 22:15:09.049540,0 days 00:00:03.684589,0.06628008509400198,5,sqrt,1,18,1475,0.6989387924829872,TPESampler,COMPLETE
2036,0.32571261085203257,2025-04-24 22:15:05.482583,2025-04-24 22:15:09.020799,0 days 00:00:03.538216,0.09413732560110691,6,sqrt,4,12,1305,0.8868612411564859,TPESampler,COMPLETE
2037,0.2906830861028608,2025-04-24 22:15:08.072190,2025-04-24 22:15:10.962984,0 days 00:00:02.890794,0.07651482527142765,10,,3,2,380,0.7766063367290409,TPESampler,COMPLETE
2038,0.2759951725250667,2025-04-24 22:15:09.201099,2025-04-24 22:15:12.370839,0 days 00:00:03.169740,0.0294082405765627,9,sqrt,1,15,1089,0.6082830640535549,TPESampler,COMPLETE
2039,0.2809915997461103,2025-04-24 22:15:09.249127,2025-04-24 22:15:12.895547,0 days 00:00:03.646420,0.0728082171396774,8,sqrt,3,20,1420,0.7851105972727405,TPESampler,COMPLETE
2040,0.2709597198624184,2025-04-24 22:15:11.183259,2025-04-24 22:15:14.017499,0 days 00:00:02.834240,0.06494818133231439,4,sqrt,1,17,1198,0.6821685740585693,TPESampler,COMPLETE
2041,0.2982648287206573,2025-04-24 22:15:12.540666,2025-04-24 22:15:15.119741,0 days 00:00:02.579075,0.07821792197582539,6,sqrt,3,20,1240,0.7030127001853755,TPESampler,COMPLETE
2042,0.3396204102643415,2025-04-24 22:15:13.093706,2025-04-24 22:15:18.982352,0 days 00:00:05.888646,0.0653163137997504,7,,2,12,1202,0.7507918037935203,TPESampler,COMPLETE
2043,0.3000744543397207,2025-04-24 22:15:14.195451,2025-04-24 22:15:17.033925,0 days 00:00:02.838474,0.05590200418856292,8,sqrt,3,16,1149,0.7053915893060444,TPESampler,COMPLETE
2044,0.2256049138167944,2025-04-24 22:15:15.319652,2025-04-24 22:15:18.650381,0 days 00:00:03.330729,0.09094892666414903,6,sqrt,1,17,1495,0.6767626555542526,TPESampler,COMPLETE
2045,0.7378088387516047,2025-04-24 22:15:17.250726,2025-04-24 22:15:18.295095,0 days 00:00:01.044369,0.05931904018174141,6,log2,2,5,132,0.8339872582601091,TPESampler,COMPLETE
2046,0.2950894783637572,2025-04-24 22:15:18.517574,2025-04-24 22:15:22.538317,0 days 00:00:04.020743,0.07253144062903766,5,sqrt,3,16,1304,0.6861718053815584,TPESampler,COMPLETE
2047,0.30454181901055066,2025-04-24 22:15:18.928790,2025-04-24 22:15:22.618774,0 days 00:00:03.689984,0.04203998332721514,5,sqrt,4,16,1111,0.6877696695619702,TPESampler,COMPLETE
2048,0.31330583269217804,2025-04-24 22:15:19.285813,2025-04-24 22:15:23.075992,0 days 00:00:03.790179,0.09868592508065391,7,log2,4,15,1477,0.6127966079382117,TPESampler,COMPLETE
2049,0.3777635251454648,2025-04-24 22:15:22.710623,2025-04-24 22:15:27.693853,0 days 00:00:04.983230,0.04990656401478568,5,,7,6,1202,0.6982811710290427,TPESampler,COMPLETE
2050,0.2555814382091178,2025-04-24 22:15:22.822533,2025-04-24 22:15:26.653530,0 days 00:00:03.830997,0.07635052053213912,7,sqrt,1,13,1443,0.7263001001121989,TPESampler,COMPLETE
2051,0.6995666467033641,2025-04-24 22:15:23.362129,2025-04-24 22:15:25.768103,0 days 00:00:02.405974,0.08796728098308851,4,log2,10,2,874,0.649304377155287,TPESampler,COMPLETE
2052,0.2941622999557251,2025-04-24 22:15:25.976222,2025-04-24 22:15:29.015358,0 days 00:00:03.039136,0.09337486975414354,6,sqrt,2,15,1191,0.7734504992223373,TPESampler,COMPLETE
2053,0.39819122693500736,2025-04-24 22:15:26.886093,2025-04-24 22:15:30.291576,0 days 00:00:03.405483,0.01634151430454593,3,,8,16,821,0.7088524276866761,TPESampler,COMPLETE
2054,0.32448114094324115,2025-04-24 22:15:27.925608,2025-04-24 22:15:31.678011,0 days 00:00:03.752403,0.09987637952195068,5,sqrt,2,12,1407,0.6792678826798757,TPESampler,COMPLETE
2055,0.29743070771221636,2025-04-24 22:15:29.222674,2025-04-24 22:15:32.962105,0 days 00:00:03.739431,0.030673040296722163,5,sqrt,3,19,1287,0.7196254266016939,TPESampler,COMPLETE
2056,0.31289834447839354,2025-04-24 22:15:30.523110,2025-04-24 22:15:34.386815,0 days 00:00:03.863705,0.05621168296930581,4,sqrt,1,18,1460,0.7136931294016715,TPESampler,COMPLETE
2057,0.5758820749485148,2025-04-24 22:15:31.895423,2025-04-24 22:15:33.213145,0 days 00:00:01.317722,0.010694908371847549,7,,4,20,119,0.8539479530131283,TPESampler,COMPLETE
2058,0.29300437541434643,2025-04-24 22:15:33.170824,2025-04-24 22:15:36.173558,0 days 00:00:03.002734,0.09472000837673131,4,sqrt,3,5,1283,0.6237164131778551,TPESampler,COMPLETE
2059,0.3398246146540702,2025-04-24 22:15:33.519127,2025-04-24 22:15:39.614417,0 days 00:00:06.095290,0.08057525634652013,5,,2,17,1432,0.7521570856882038,TPESampler,COMPLETE
2060,0.2828148072909838,2025-04-24 22:15:34.586165,2025-04-24 22:15:37.987751,0 days 00:00:03.401586,0.053686012924000485,6,sqrt,1,15,1307,0.7245252386816933,TPESampler,COMPLETE
2061,0.26272509420269385,2025-04-24 22:15:36.386391,2025-04-24 22:15:39.550961,0 days 00:00:03.164570,0.0767505715515305,5,sqrt,1,17,1353,0.6884011173882972,TPESampler,COMPLETE
2062,0.2907328342165643,2025-04-24 22:15:38.167769,2025-04-24 22:15:41.309485,0 days 00:00:03.141716,0.09287948009774023,4,sqrt,1,17,1498,0.7446897280591488,TPESampler,COMPLETE
2063,0.2863192425443149,2025-04-24 22:15:39.719417,2025-04-24 22:15:43.529963,0 days 00:00:03.810546,0.09402952560476575,7,sqrt,3,13,1396,0.6667393351822434,TPESampler,COMPLETE
2064,0.2570465321036934,2025-04-24 22:15:39.846003,2025-04-24 22:15:43.306026,0 days 00:00:03.460023,0.08328215404523967,8,log2,1,20,1235,0.6764689130448043,TPESampler,COMPLETE
2065,0.3373638119299599,2025-04-24 22:15:41.504101,2025-04-24 22:15:45.142527,0 days 00:00:03.638426,0.0987461709811687,7,sqrt,2,19,1459,0.6764878148712286,TPESampler,COMPLETE
2066,0.2792191654917241,2025-04-24 22:15:43.485637,2025-04-24 22:15:47.011329,0 days 00:00:03.525692,0.07470644128146982,7,sqrt,3,14,1470,0.7085189262082499,TPESampler,COMPLETE
2067,0.3346299503179664,2025-04-24 22:15:43.744903,2025-04-24 22:15:49.030053,0 days 00:00:05.285150,0.05432613771823328,5,,5,13,1382,0.6166199182661848,TPESampler,COMPLETE
2068,0.28196651236845466,2025-04-24 22:15:45.314842,2025-04-24 22:15:48.256162,0 days 00:00:02.941320,0.05079331085782702,3,sqrt,1,7,1267,0.6820525293034772,TPESampler,COMPLETE
2069,0.233887356732192,2025-04-24 22:15:47.200862,2025-04-24 22:15:50.820511,0 days 00:00:03.619649,0.08080343029085707,5,sqrt,1,16,1447,0.6939492296276246,TPESampler,COMPLETE
2070,0.2824347580499286,2025-04-24 22:15:48.461270,2025-04-24 22:15:52.055481,0 days 00:00:03.594211,0.09156978418995218,7,sqrt,1,16,1485,0.6072347182259789,TPESampler,COMPLETE
2071,0.3853490784443277,2025-04-24 22:15:49.278514,2025-04-24 22:15:50.632999,0 days 00:00:01.354485,0.0644178088848775,9,sqrt,2,3,182,0.8032485933080541,TPESampler,COMPLETE
2072,0.4034280781108144,2025-04-24 22:15:50.821825,2025-04-24 22:15:59.962519,0 days 00:00:09.140694,0.055554739278465645,12,,9,13,1419,0.9244769874935997,TPESampler,COMPLETE
2073,0.29455306699640144,2025-04-24 22:15:51.075184,2025-04-24 22:15:54.205550,0 days 00:00:03.130366,0.0727684324549283,5,sqrt,1,16,1225,0.6878234883414012,TPESampler,COMPLETE
2074,0.24421450036044112,2025-04-24 22:15:52.299886,2025-04-24 22:15:55.645199,0 days 00:00:03.345313,0.09231568579206773,6,sqrt,1,14,1496,0.6784720503106899,TPESampler,COMPLETE
2075,0.2773535329591633,2025-04-24 22:15:54.414393,2025-04-24 22:15:57.440736,0 days 00:00:03.026343,0.09048037003710312,6,sqrt,1,16,1417,0.6808090963517399,TPESampler,COMPLETE
2076,0.24932021897672105,2025-04-24 22:15:55.856340,2025-04-24 22:15:59.030596,0 days 00:00:03.174256,0.0696968222219452,5,sqrt,1,19,1494,0.7683434612702977,TPESampler,COMPLETE
2077,0.348952195795455,2025-04-24 22:15:57.649431,2025-04-24 22:16:00.777548,0 days 00:00:03.128117,0.013928915948738954,5,sqrt,2,6,1329,0.961846208779226,TPESampler,COMPLETE
2078,0.25291352151173324,2025-04-24 22:15:59.244632,2025-04-24 22:16:03.631861,0 days 00:00:04.387229,0.051432827758701366,6,sqrt,1,16,1494,0.7158432332240197,TPESampler,COMPLETE
2079,0.3025471800398485,2025-04-24 22:16:00.196765,2025-04-24 22:16:04.870439,0 days 00:00:04.673674,0.060532066271040685,5,sqrt,2,14,1476,0.6726536147083901,TPESampler,COMPLETE
2080,0.2841402498715649,2025-04-24 22:16:01.009624,2025-04-24 22:16:05.688011,0 days 00:00:04.678387,0.05738231431407585,6,sqrt,1,10,1458,0.734801396886634,TPESampler,COMPLETE
2081,0.2672610321236567,2025-04-24 22:16:03.868330,2025-04-24 22:16:08.206675,0 days 00:00:04.338345,0.06685037525751714,8,sqrt,1,16,1466,0.7243338631929571,TPESampler,COMPLETE
2082,0.3178139865159851,2025-04-24 22:16:05.080205,2025-04-24 22:16:08.148205,0 days 00:00:03.068000,0.09898194071501748,4,log2,1,18,1020,0.6362777980813893,TPESampler,COMPLETE
2083,0.655788266574275,2025-04-24 22:16:05.909313,2025-04-24 22:16:09.227559,0 days 00:00:03.318246,0.021131774114697025,7,log2,5,3,1272,0.6594493132162129,TPESampler,COMPLETE
2084,0.26485678951930963,2025-04-24 22:16:08.330986,2025-04-24 22:16:13.141773,0 days 00:00:04.810787,0.09611003245323442,8,sqrt,1,13,1335,0.604932785665437,TPESampler,COMPLETE
2085,0.2850323297685418,2025-04-24 22:16:08.382900,2025-04-24 22:16:12.346980,0 days 00:00:03.964080,0.08569588277524032,6,sqrt,3,16,1157,0.7511223635990254,TPESampler,COMPLETE
2086,0.30415789320273806,2025-04-24 22:16:09.601503,2025-04-24 22:16:13.401185,0 days 00:00:03.799682,0.09703594449479834,10,log2,3,13,1438,0.6492417741789557,TPESampler,COMPLETE
2087,0.3324566223400103,2025-04-24 22:16:12.567003,2025-04-24 22:16:16.152310,0 days 00:00:03.585307,0.045172858491883225,3,sqrt,5,20,1400,0.745249925728953,TPESampler,COMPLETE
2088,0.2659381459122597,2025-04-24 22:16:13.470465,2025-04-24 22:16:17.351845,0 days 00:00:03.881380,0.06492305998332809,5,sqrt,1,19,1135,0.7149332477379556,TPESampler,COMPLETE
2089,0.3029513364844457,2025-04-24 22:16:13.735511,2025-04-24 22:16:17.740525,0 days 00:00:04.005014,0.06308519534223192,6,sqrt,1,17,1217,0.7359374185516746,TPESampler,COMPLETE
2090,0.9432435595536429,2025-04-24 22:16:16.375160,2025-04-24 22:16:18.270420,0 days 00:00:01.895260,0.013362770659813448,7,log2,3,20,541,0.9731205312050217,TPESampler,COMPLETE
2091,0.3454633686530438,2025-04-24 22:16:17.575900,2025-04-24 22:16:21.278993,0 days 00:00:03.703093,0.09176109890269456,4,sqrt,6,18,1364,0.8613073555578268,TPESampler,COMPLETE
2092,0.3100285985074966,2025-04-24 22:16:18.013895,2025-04-24 22:16:21.142326,0 days 00:00:03.128431,0.02987152448060323,6,sqrt,4,2,848,0.8681369447868486,TPESampler,COMPLETE
2093,1.2602912781712954,2025-04-24 22:16:18.625198,2025-04-24 22:16:20.084136,0 days 00:00:01.458938,0.01529619361512814,6,log2,7,12,172,0.6928230955938385,TPESampler,COMPLETE
2094,0.2721900134826314,2025-04-24 22:16:20.306001,2025-04-24 22:16:24.488792,0 days 00:00:04.182791,0.0743093537298232,11,log2,1,13,1471,0.7169772222799067,TPESampler,COMPLETE
2095,0.2669267894656417,2025-04-24 22:16:21.397625,2025-04-24 22:16:25.808347,0 days 00:00:04.410722,0.07982232829572489,4,sqrt,1,15,1472,0.7506235579473264,TPESampler,COMPLETE
