number,value,datetime_start,datetime_complete,duration,params_learning_rate,params_max_depth,params_max_features,params_min_samples_leaf,params_min_samples_split,params_n_estimators,params_subsample,system_attrs_auto:sampler,state
0,0.6488182182045165,2025-04-24 21:34:59.984063,2025-04-24 21:35:02.433233,0 days 00:00:02.449170,0.016826891576942185,4,log2,1,9,1115,0.8028193994890255,RandomSampler,COMPLETE
1,1.0691413522849011,2025-04-24 21:35:00.002391,2025-04-24 21:35:01.118025,0 days 00:00:01.115634,0.03675732420413807,5,log2,10,14,187,0.9927817120224615,RandomSampler,COMPLETE
2,0.2986685794337527,2025-04-24 21:35:00.073567,2025-04-24 21:35:02.279059,0 days 00:00:02.205492,0.0910873377812742,8,log2,2,18,898,0.7147364501594144,RandomSampler,COMPLETE
3,0.6843136212368741,2025-04-24 21:35:01.309368,2025-04-24 21:35:03.492287,0 days 00:00:02.182919,0.014118473165593224,6,sqrt,10,9,1120,0.6217810880136838,TPESampler,COMPLETE
4,0.6193596956432029,2025-04-24 21:35:02.451838,2025-04-24 21:35:04.255586,0 days 00:00:01.803748,0.051962730499187926,6,log2,8,9,1086,0.6314518047469128,TPESampler,COMPLETE
5,0.3725269274109654,2025-04-24 21:35:02.639748,2025-04-24 21:35:05.240095,0 days 00:00:02.600347,0.018291516232020796,12,,6,11,463,0.6379239735653496,TPESampler,COMPLETE
6,0.8531500330963745,2025-04-24 21:35:03.662832,2025-04-24 21:35:05.274204,0 days 00:00:01.611372,0.046068621033928635,12,log2,10,19,777,0.7040213049613804,TPESampler,COMPLETE
7,0.523823880347866,2025-04-24 21:35:04.431673,2025-04-24 21:35:07.056369,0 days 00:00:02.624696,0.01538482358179236,11,sqrt,10,11,1406,0.9008819226599322,TPESampler,COMPLETE
8,0.374116903394304,2025-04-24 21:35:05.388008,2025-04-24 21:35:08.834056,0 days 00:00:03.446048,0.021290939283130663,9,sqrt,6,18,1397,0.9670680228593076,TPESampler,COMPLETE
9,0.8927364141888579,2025-04-24 21:35:05.434669,2025-04-24 21:35:07.295860,0 days 00:00:01.861191,0.017992349315017128,8,log2,4,17,665,0.8380270181791318,TPESampler,COMPLETE
10,0.6473262997191602,2025-04-24 21:35:07.242825,2025-04-24 21:35:09.231938,0 days 00:00:01.989113,0.011098541549011354,5,sqrt,6,16,742,0.7052447697819823,TPESampler,COMPLETE
11,0.3797922599984012,2025-04-24 21:35:07.494811,2025-04-24 21:35:09.120578,0 days 00:00:01.625767,0.06826886400582294,11,log2,4,10,513,0.7775143336882999,TPESampler,COMPLETE
12,0.34314368773755644,2025-04-24 21:35:09.032515,2025-04-24 21:35:12.912004,0 days 00:00:03.879489,0.01882925034429592,11,,5,12,788,0.6610076168389468,TPESampler,COMPLETE
13,0.33344025379535097,2025-04-24 21:35:09.389278,2025-04-24 21:35:11.769646,0 days 00:00:02.380368,0.09186808760997936,7,log2,4,18,1012,0.7736659365606814,TPESampler,COMPLETE
14,0.3013217545367434,2025-04-24 21:35:09.459413,2025-04-24 21:35:11.793793,0 days 00:00:02.334380,0.09459926262083211,7,log2,1,20,844,0.7685228252043687,TPESampler,COMPLETE
15,0.3628444542418612,2025-04-24 21:35:11.911204,2025-04-24 21:35:13.181593,0 days 00:00:01.270389,0.08750121860081646,8,log2,2,16,367,0.6114312935689802,TPESampler,COMPLETE
16,0.6157925677021366,2025-04-24 21:35:11.978858,2025-04-24 21:35:13.550063,0 days 00:00:01.571205,0.056722328120964394,3,log2,3,16,630,0.6666721380915688,TPESampler,COMPLETE
17,0.28959258712680097,2025-04-24 21:35:13.073112,2025-04-24 21:35:14.840255,0 days 00:00:01.767143,0.09419234041982552,9,sqrt,1,17,738,0.7558938438092426,TPESampler,COMPLETE
18,0.260861276374133,2025-04-24 21:35:13.376091,2025-04-24 21:35:16.207836,0 days 00:00:02.831745,0.056169701802918304,8,log2,1,16,1344,0.6294870397722497,TPESampler,COMPLETE
19,0.3014814653031649,2025-04-24 21:35:13.739427,2025-04-24 21:35:17.603984,0 days 00:00:03.864557,0.04602045263357729,7,,1,17,753,0.836215115839359,TPESampler,COMPLETE
20,0.31429955629634876,2025-04-24 21:35:15.028780,2025-04-24 21:35:16.939819,0 days 00:00:01.911039,0.07971117820573063,9,sqrt,2,12,745,0.6954223267330215,TPESampler,COMPLETE
21,0.283661859371686,2025-04-24 21:35:16.381259,2025-04-24 21:35:18.565240,0 days 00:00:02.183981,0.061035471093847854,6,log2,2,11,1456,0.6586013977603609,TPESampler,COMPLETE
22,0.35298777322251873,2025-04-24 21:35:17.110811,2025-04-24 21:35:23.135350,0 days 00:00:06.024539,0.030122764303868753,8,,5,18,1427,0.6913281574573882,TPESampler,COMPLETE
23,0.3280041404354958,2025-04-24 21:35:17.892492,2025-04-24 21:35:19.165495,0 days 00:00:01.273003,0.04448099229588673,10,sqrt,2,17,399,0.8100444988408207,TPESampler,COMPLETE
24,0.5033199783432946,2025-04-24 21:35:18.734529,2025-04-24 21:35:21.081544,0 days 00:00:02.347015,0.028772177753029964,6,log2,4,12,1374,0.6063515597003782,TPESampler,COMPLETE
25,0.3281095652299669,2025-04-24 21:35:19.376243,2025-04-24 21:35:24.569499,0 days 00:00:05.193256,0.09224077178078037,5,,2,13,1483,0.6126048578141849,TPESampler,COMPLETE
26,0.2973270300965276,2025-04-24 21:35:21.249096,2025-04-24 21:35:23.812419,0 days 00:00:02.563323,0.03581338596859765,10,log2,2,14,1468,0.6209858021079345,TPESampler,COMPLETE
27,0.3012181398153161,2025-04-24 21:35:23.315806,2025-04-24 21:35:26.801350,0 days 00:00:03.485544,0.08113463322376532,7,log2,2,5,1497,0.7285846613614009,TPESampler,COMPLETE
28,0.2760698271669103,2025-04-24 21:35:23.990499,2025-04-24 21:35:27.505895,0 days 00:00:03.515396,0.04076497171960491,6,sqrt,1,17,1318,0.6249603180594322,TPESampler,COMPLETE
29,0.2936211214801131,2025-04-24 21:35:24.768710,2025-04-24 21:35:28.105442,0 days 00:00:03.336732,0.04695300647475011,4,sqrt,2,5,1400,0.6027461609936874,TPESampler,COMPLETE
30,0.270227864517666,2025-04-24 21:35:26.995839,2025-04-24 21:35:30.844460,0 days 00:00:03.848621,0.08407807801256162,9,log2,1,17,1440,0.6720315168609258,TPESampler,COMPLETE
31,0.29302636563775,2025-04-24 21:35:27.676209,2025-04-24 21:35:31.176262,0 days 00:00:03.500053,0.03657812084995504,5,sqrt,3,20,1242,0.7055885492898755,TPESampler,COMPLETE
32,0.28612022328168024,2025-04-24 21:35:28.297648,2025-04-24 21:35:31.982078,0 days 00:00:03.684430,0.027470953728171526,8,sqrt,1,9,1457,0.6794546017827499,TPESampler,COMPLETE
33,0.3714444523233269,2025-04-24 21:35:31.095054,2025-04-24 21:35:38.103158,0 days 00:00:07.008104,0.09724285229662677,10,,2,16,1378,0.719975351411661,TPESampler,COMPLETE
34,0.25782784307184947,2025-04-24 21:35:31.421390,2025-04-24 21:35:34.218794,0 days 00:00:02.797404,0.08318095741695068,7,log2,1,16,1428,0.6193008948003531,TPESampler,COMPLETE
35,0.2814999628917404,2025-04-24 21:35:32.170674,2025-04-24 21:35:35.242369,0 days 00:00:03.071695,0.074583748112541,8,sqrt,1,17,1288,0.6197858821783567,TPESampler,COMPLETE
36,0.29029284590420756,2025-04-24 21:35:34.397171,2025-04-24 21:35:38.429142,0 days 00:00:04.031971,0.06357657890226767,9,log2,1,18,1475,0.6235911079162789,TPESampler,COMPLETE
37,0.28507175513577904,2025-04-24 21:35:35.476811,2025-04-24 21:35:38.950733,0 days 00:00:03.473922,0.09284966788926845,6,log2,3,20,1439,0.6482982001543861,TPESampler,COMPLETE
38,0.29430410964704995,2025-04-24 21:35:38.296074,2025-04-24 21:35:41.471600,0 days 00:00:03.175526,0.06511915391051563,9,log2,1,15,1416,0.7788788854615393,TPESampler,COMPLETE
39,0.28760445133039225,2025-04-24 21:35:38.592302,2025-04-24 21:35:44.103695,0 days 00:00:05.511393,0.026935235760497146,7,,1,15,1232,0.6982005268975483,TPESampler,COMPLETE
40,0.28736491789327223,2025-04-24 21:35:39.134656,2025-04-24 21:35:42.171680,0 days 00:00:03.037024,0.027100174671784952,6,sqrt,1,15,1295,0.6359255316900951,TPESampler,COMPLETE
41,0.2900729079870098,2025-04-24 21:35:41.657306,2025-04-24 21:35:44.531722,0 days 00:00:02.874416,0.09843400865125503,9,log2,1,15,1142,0.698644287436795,TPESampler,COMPLETE
42,0.3481771665644112,2025-04-24 21:35:42.374413,2025-04-24 21:35:45.312441,0 days 00:00:02.938028,0.03691335348346704,5,log2,1,19,1274,0.6144536639036705,TPESampler,COMPLETE
43,0.27936642006762974,2025-04-24 21:35:44.325556,2025-04-24 21:35:47.958467,0 days 00:00:03.632911,0.049308819074461885,8,sqrt,1,16,1300,0.6586164024948311,TPESampler,COMPLETE
44,0.2991322576345358,2025-04-24 21:35:44.727272,2025-04-24 21:35:47.737216,0 days 00:00:03.009944,0.07626281868670243,8,sqrt,2,19,976,0.6246335456186303,TPESampler,COMPLETE
45,0.2713392912125828,2025-04-24 21:35:45.511150,2025-04-24 21:35:48.289827,0 days 00:00:02.778677,0.08775899350543223,4,sqrt,1,16,969,0.6817915423452716,TPESampler,COMPLETE
46,0.27902076272092075,2025-04-24 21:35:47.918318,2025-04-24 21:35:51.341238,0 days 00:00:03.422920,0.030040607240025895,9,sqrt,1,16,1258,0.7146076871425688,TPESampler,COMPLETE
47,0.28125437342299103,2025-04-24 21:35:48.172792,2025-04-24 21:35:50.705388,0 days 00:00:02.532596,0.06620000113262234,4,sqrt,1,7,770,0.7393583937611466,TPESampler,COMPLETE
48,0.22987804161392136,2025-04-24 21:35:48.588797,2025-04-24 21:35:52.129143,0 days 00:00:03.540346,0.08735428609397143,4,sqrt,1,14,1468,0.7554859837617074,TPESampler,COMPLETE
49,0.40316272762386535,2025-04-24 21:35:50.973864,2025-04-24 21:35:52.455530,0 days 00:00:01.481666,0.04327679419054192,4,sqrt,1,17,464,0.6983814888990609,TPESampler,COMPLETE
50,0.3302059390016655,2025-04-24 21:35:51.507391,2025-04-24 21:35:53.982519,0 days 00:00:02.475128,0.0818937392659582,4,sqrt,4,17,1183,0.6529234443455357,TPESampler,COMPLETE
51,0.33546046753266673,2025-04-24 21:35:52.287227,2025-04-24 21:35:54.673495,0 days 00:00:02.386268,0.07859989649729157,4,log2,1,14,1035,0.7089923577663805,TPESampler,COMPLETE
52,0.35815943169082054,2025-04-24 21:35:52.606497,2025-04-24 21:35:55.916361,0 days 00:00:03.309864,0.05936376115681359,3,log2,1,15,1484,0.8746236831771951,TPESampler,COMPLETE
53,0.3049018980103235,2025-04-24 21:35:54.136591,2025-04-24 21:35:56.806202,0 days 00:00:02.669611,0.08873069239575296,6,sqrt,2,15,1338,0.8148243885864707,TPESampler,COMPLETE
54,0.2917864436637958,2025-04-24 21:35:54.822057,2025-04-24 21:35:56.475413,0 days 00:00:01.653356,0.09432183691131857,3,sqrt,2,17,697,0.6549097548635605,TPESampler,COMPLETE
55,0.27346198461762333,2025-04-24 21:35:56.074589,2025-04-24 21:35:58.339675,0 days 00:00:02.265086,0.09766540396963543,7,log2,1,18,1197,0.6155549338687679,TPESampler,COMPLETE
56,0.3093293360447125,2025-04-24 21:35:56.858692,2025-04-24 21:35:59.003864,0 days 00:00:02.145172,0.09203567970775753,5,sqrt,1,18,839,0.7878790718538788,TPESampler,COMPLETE
57,0.2964993005818486,2025-04-24 21:35:57.025809,2025-04-24 21:35:59.488850,0 days 00:00:02.463041,0.04096238109780298,3,sqrt,1,13,1152,0.6280606821326102,TPESampler,COMPLETE
58,0.2660138043895301,2025-04-24 21:35:58.499151,2025-04-24 21:36:02.700002,0 days 00:00:04.200851,0.0818903070009961,5,,1,19,1085,0.6996413910244524,TPESampler,COMPLETE
59,0.2639491023940772,2025-04-24 21:35:59.158986,2025-04-24 21:36:02.333961,0 days 00:00:03.174975,0.09456881158728428,4,sqrt,1,14,1378,0.7235847456897155,TPESampler,COMPLETE
60,0.2930908430000425,2025-04-24 21:35:59.643489,2025-04-24 21:36:02.563707,0 days 00:00:02.920218,0.06767386199800193,7,log2,2,14,1269,0.6032999871093233,TPESampler,COMPLETE
61,0.2628088722879614,2025-04-24 21:36:02.526468,2025-04-24 21:36:07.148121,0 days 00:00:04.621653,0.07957946295256281,6,,1,20,1193,0.7572871684930196,TPESampler,COMPLETE
62,0.34185631745158934,2025-04-24 21:36:02.694856,2025-04-24 21:36:06.110208,0 days 00:00:03.415352,0.042436773096260656,3,,2,18,973,0.7239389566891802,TPESampler,COMPLETE
63,0.28624415077907894,2025-04-24 21:36:02.934155,2025-04-24 21:36:05.584408,0 days 00:00:02.650253,0.06627731322250102,3,sqrt,2,13,1361,0.7177298084809469,TPESampler,COMPLETE
64,0.34824533164252885,2025-04-24 21:36:05.772668,2025-04-24 21:36:08.587438,0 days 00:00:02.814770,0.0986591453760882,5,,2,17,685,0.7242599132525425,TPESampler,COMPLETE
65,0.259232471061991,2025-04-24 21:36:06.247551,2025-04-24 21:36:09.291429,0 days 00:00:03.043878,0.08407481804713617,5,sqrt,1,14,1484,0.7552943314679748,TPESampler,COMPLETE
66,0.27493993483033996,2025-04-24 21:36:07.330842,2025-04-24 21:36:12.275089,0 days 00:00:04.944247,0.08679068315389282,6,,1,16,1332,0.7941031589210008,TPESampler,COMPLETE
67,0.27324134894128677,2025-04-24 21:36:08.765592,2025-04-24 21:36:13.310392,0 days 00:00:04.544800,0.09782943048088433,4,,1,20,1208,0.7327775590458641,TPESampler,COMPLETE
68,0.26781883764712683,2025-04-24 21:36:09.499645,2025-04-24 21:36:12.649827,0 days 00:00:03.150182,0.08221849586815974,5,sqrt,1,14,1492,0.7640632339207238,TPESampler,COMPLETE
69,0.3016971159491635,2025-04-24 21:36:12.450848,2025-04-24 21:36:15.458356,0 days 00:00:03.007508,0.09782920899862933,4,sqrt,2,18,1454,0.7265534594322811,TPESampler,COMPLETE
70,0.2784129562168398,2025-04-24 21:36:12.869456,2025-04-24 21:36:17.259457,0 days 00:00:04.390001,0.07101375360539497,6,,1,18,1026,0.688767669093801,TPESampler,COMPLETE
71,0.3611488284436107,2025-04-24 21:36:13.474659,2025-04-24 21:36:15.677042,0 days 00:00:02.202383,0.08585974326118231,12,sqrt,5,18,848,0.9341978915751257,TPESampler,COMPLETE
72,0.27720280762977656,2025-04-24 21:36:15.638609,2025-04-24 21:36:18.684488,0 days 00:00:03.045879,0.08044772407439162,3,sqrt,2,11,1416,0.878868741930735,TPESampler,COMPLETE
73,0.2736665462418152,2025-04-24 21:36:15.891390,2025-04-24 21:36:19.248239,0 days 00:00:03.356849,0.09330605617133478,8,sqrt,1,10,1267,0.6852992719609511,TPESampler,COMPLETE
74,0.28764738211234114,2025-04-24 21:36:17.466958,2025-04-24 21:36:20.734104,0 days 00:00:03.267146,0.05260285224465209,6,sqrt,1,12,1441,0.8310191359871103,TPESampler,COMPLETE
75,0.262418222857827,2025-04-24 21:36:18.886823,2025-04-24 21:36:22.859275,0 days 00:00:03.972452,0.07406807560706122,4,sqrt,1,8,1472,0.7849539142764369,TPESampler,COMPLETE
76,0.2746877405720603,2025-04-24 21:36:19.668931,2025-04-24 21:36:23.152151,0 days 00:00:03.483220,0.07027150290677267,4,sqrt,1,15,1345,0.8022163664886328,TPESampler,COMPLETE
77,0.41142881570392836,2025-04-24 21:36:20.907338,2025-04-24 21:36:23.109858,0 days 00:00:02.202520,0.015804543667724796,11,sqrt,5,4,580,0.976417945104011,TPESampler,COMPLETE
78,0.3402733180278724,2025-04-24 21:36:23.061594,2025-04-24 21:36:28.544430,0 days 00:00:05.482836,0.07052305217260871,5,,1,7,1277,0.7744959471831255,TPESampler,COMPLETE
79,0.27074694946001193,2025-04-24 21:36:23.294339,2025-04-24 21:36:27.314069,0 days 00:00:04.019730,0.0954094986828439,5,sqrt,1,6,1395,0.8607802795353551,TPESampler,COMPLETE
80,0.3079125413033202,2025-04-24 21:36:23.340736,2025-04-24 21:36:27.318256,0 days 00:00:03.977520,0.04223344745594758,4,sqrt,4,4,1456,0.7645356418629101,TPESampler,COMPLETE
81,0.31464758063888376,2025-04-24 21:36:27.448444,2025-04-24 21:36:30.951739,0 days 00:00:03.503295,0.06647802362459419,5,sqrt,4,9,1378,0.7269389485892335,TPESampler,COMPLETE
82,0.30240582382521897,2025-04-24 21:36:27.495973,2025-04-24 21:36:31.097767,0 days 00:00:03.601794,0.07468037526192176,5,sqrt,3,10,1409,0.6792934417549998,TPESampler,COMPLETE
83,0.35319468444865587,2025-04-24 21:36:28.944740,2025-04-24 21:36:32.666327,0 days 00:00:03.721587,0.01582759708294537,3,,1,19,992,0.9693826038094471,TPESampler,COMPLETE
84,0.5406422545616179,2025-04-24 21:36:31.138750,2025-04-24 21:36:34.771157,0 days 00:00:03.632407,0.02220527509208167,9,log2,5,2,1435,0.8475753318551981,TPESampler,COMPLETE
85,0.30067193759548144,2025-04-24 21:36:31.327567,2025-04-24 21:36:35.493179,0 days 00:00:04.165612,0.09266124351499166,4,sqrt,3,13,1417,0.7624370312223386,TPESampler,COMPLETE
86,0.26399743697068134,2025-04-24 21:36:32.861377,2025-04-24 21:36:36.363421,0 days 00:00:03.502044,0.0519463426863595,4,sqrt,1,8,1402,0.7909444638784482,TPESampler,COMPLETE
87,0.3087199231494199,2025-04-24 21:36:34.978280,2025-04-24 21:36:40.486476,0 days 00:00:05.508196,0.04723600754363846,5,,3,18,1483,0.7280045858211291,TPESampler,COMPLETE
88,0.2728225640063058,2025-04-24 21:36:35.689343,2025-04-24 21:36:38.941006,0 days 00:00:03.251663,0.06635970852609097,6,sqrt,1,14,1336,0.7320333715367773,TPESampler,COMPLETE
89,0.2859334407014901,2025-04-24 21:36:36.693766,2025-04-24 21:36:39.470037,0 days 00:00:02.776271,0.051577434655922516,3,sqrt,2,9,1125,0.7886988715525,TPESampler,COMPLETE
90,0.2907577272408794,2025-04-24 21:36:39.142418,2025-04-24 21:36:44.949208,0 days 00:00:05.806790,0.05192731322299102,9,,1,20,1086,0.8275168790689595,TPESampler,COMPLETE
91,0.30651517058725414,2025-04-24 21:36:39.631728,2025-04-24 21:36:41.524365,0 days 00:00:01.892637,0.03654789673648487,4,sqrt,1,4,988,0.9573595578454502,TPESampler,COMPLETE
92,0.2664104138936543,2025-04-24 21:36:40.661232,2025-04-24 21:36:43.555435,0 days 00:00:02.894203,0.08697928591417972,3,sqrt,1,4,1433,0.733320924832736,TPESampler,COMPLETE
93,0.2550645208169906,2025-04-24 21:36:41.728338,2025-04-24 21:36:44.993751,0 days 00:00:03.265413,0.08565060649987719,6,sqrt,1,13,1468,0.7319117313954415,TPESampler,COMPLETE
94,0.23798266655994155,2025-04-24 21:36:43.744828,2025-04-24 21:36:46.749645,0 days 00:00:03.004817,0.09918105260786747,4,sqrt,1,7,1427,0.7043896015858603,TPESampler,COMPLETE
95,0.3673800991150453,2025-04-24 21:36:45.101778,2025-04-24 21:36:51.169008,0 days 00:00:06.067230,0.09158262488075226,7,,2,19,1444,0.6001313435048916,TPESampler,COMPLETE
96,0.3676726603195805,2025-04-24 21:36:45.150847,2025-04-24 21:36:47.966826,0 days 00:00:02.815979,0.03715643401280958,4,log2,3,7,1313,0.7417256713086863,TPESampler,COMPLETE
97,0.29558474157649245,2025-04-24 21:36:46.901540,2025-04-24 21:36:49.821266,0 days 00:00:02.919726,0.0992566478022675,3,sqrt,1,9,1431,0.7593559248012594,TPESampler,COMPLETE
98,0.2830794343396618,2025-04-24 21:36:48.142499,2025-04-24 21:36:51.251283,0 days 00:00:03.108784,0.03883541922875771,4,sqrt,2,10,1474,0.8259450149197007,TPESampler,COMPLETE
99,0.26510154038430955,2025-04-24 21:36:50.009434,2025-04-24 21:36:53.047151,0 days 00:00:03.037717,0.09069798400129107,4,log2,1,7,1483,0.7231370716936044,TPESampler,COMPLETE
100,0.3058336940552841,2025-04-24 21:36:51.340712,2025-04-24 21:36:56.781112,0 days 00:00:05.440400,0.06216604572047751,3,,1,12,1491,0.803107508841088,TPESampler,COMPLETE
101,0.43031529751342035,2025-04-24 21:36:51.432412,2025-04-24 21:36:54.893990,0 days 00:00:03.461578,0.010014157996986413,7,sqrt,6,10,1445,0.8011381452485222,TPESampler,COMPLETE
102,0.28397825502456575,2025-04-24 21:36:53.243175,2025-04-24 21:36:56.509142,0 days 00:00:03.265967,0.04406067998785242,6,sqrt,1,6,1281,0.6953495353172565,TPESampler,COMPLETE
103,0.30740059212599435,2025-04-24 21:36:55.083773,2025-04-24 21:36:58.048680,0 days 00:00:02.964907,0.0745423888091321,3,log2,1,5,1272,0.7313177845427425,TPESampler,COMPLETE
104,0.2701386348693445,2025-04-24 21:36:56.699591,2025-04-24 21:37:00.006224,0 days 00:00:03.306633,0.09439454863492888,5,log2,1,11,1188,0.8429913334376031,TPESampler,COMPLETE
105,0.2981263741487495,2025-04-24 21:36:57.008410,2025-04-24 21:37:00.861780,0 days 00:00:03.853370,0.09213670051321131,3,log2,2,6,1409,0.6285221641563344,TPESampler,COMPLETE
106,0.2771529786225866,2025-04-24 21:36:58.240441,2025-04-24 21:37:01.399053,0 days 00:00:03.158612,0.05740141347163218,10,log2,1,13,1079,0.6231568825671218,TPESampler,COMPLETE
107,0.2681339706396412,2025-04-24 21:37:00.196793,2025-04-24 21:37:04.269803,0 days 00:00:04.073010,0.07450708031212601,5,sqrt,1,8,1466,0.6483027199455219,TPESampler,COMPLETE
108,0.2857189183887577,2025-04-24 21:37:01.048328,2025-04-24 21:37:05.059534,0 days 00:00:04.011206,0.07725870356854549,5,sqrt,1,9,1425,0.7812524954571936,TPESampler,COMPLETE
109,0.3190398661203518,2025-04-24 21:37:01.567234,2025-04-24 21:37:05.110510,0 days 00:00:03.543276,0.06450465663280239,3,log2,4,9,1397,0.8344004913923622,TPESampler,COMPLETE
110,0.3273259079328169,2025-04-24 21:37:04.460426,2025-04-24 21:37:07.705659,0 days 00:00:03.245233,0.03248809943207062,7,log2,1,16,1472,0.7103341416255594,TPESampler,COMPLETE
111,0.42725682704629286,2025-04-24 21:37:05.201326,2025-04-24 21:37:09.104297,0 days 00:00:03.902971,0.060625437588794254,9,sqrt,8,4,1361,0.9399424102746748,TPESampler,COMPLETE
112,0.3255666820214271,2025-04-24 21:37:05.265864,2025-04-24 21:37:08.992059,0 days 00:00:03.726195,0.03595063221597305,8,log2,2,17,1254,0.6015893158108949,TPESampler,COMPLETE
113,0.3080040437433145,2025-04-24 21:37:07.903249,2025-04-24 21:37:10.207231,0 days 00:00:02.303982,0.09930628148713865,6,sqrt,3,5,992,0.6524192819204123,TPESampler,COMPLETE
114,0.3152946118450368,2025-04-24 21:37:09.173678,2025-04-24 21:37:12.387508,0 days 00:00:03.213830,0.06620888278464593,5,log2,3,9,1492,0.7449855196651997,TPESampler,COMPLETE
115,0.3592154758910107,2025-04-24 21:37:09.251238,2025-04-24 21:37:12.709348,0 days 00:00:03.458110,0.059931371849028095,3,log2,1,12,1380,0.6821825345184934,TPESampler,COMPLETE
116,1.2316947268597374,2025-04-24 21:37:10.407875,2025-04-24 21:37:12.468881,0 days 00:00:02.061006,0.01097473770448192,3,log2,10,10,529,0.951434003860567,TPESampler,COMPLETE
117,0.355910562595235,2025-04-24 21:37:12.520664,2025-04-24 21:37:16.590583,0 days 00:00:04.069919,0.012440193930611531,10,,2,11,635,0.8828137208925088,TPESampler,COMPLETE
118,0.9625761153334914,2025-04-24 21:37:12.637671,2025-04-24 21:37:14.390796,0 days 00:00:01.753125,0.022690973293174748,8,log2,7,2,633,0.7202001806392399,TPESampler,COMPLETE
119,0.3617911190636376,2025-04-24 21:37:13.276604,2025-04-24 21:37:17.312371,0 days 00:00:04.035767,0.05052484672093729,6,,2,20,1006,0.6997327835969264,TPESampler,COMPLETE
120,0.3131496756802298,2025-04-24 21:37:14.571346,2025-04-24 21:37:16.853025,0 days 00:00:02.281679,0.06402663539548402,6,log2,3,15,1462,0.7091456096742919,TPESampler,COMPLETE
121,0.2782533783478162,2025-04-24 21:37:16.775555,2025-04-24 21:37:19.800741,0 days 00:00:03.025186,0.09948280855774257,6,log2,1,8,1345,0.6282658434689932,TPESampler,COMPLETE
122,0.2394824590997122,2025-04-24 21:37:17.086180,2025-04-24 21:37:20.376780,0 days 00:00:03.290600,0.0995287826329644,4,sqrt,1,3,1358,0.7353178122133052,TPESampler,COMPLETE
