number,value,datetime_start,datetime_complete,duration,params_learning_rate,params_max_depth,params_max_features,params_min_samples_leaf,params_min_samples_split,params_n_estimators,params_subsample,system_attrs_auto:sampler,state
1358,0.25686565535537276,2025-04-24 22:01:22.014524,2025-04-24 22:01:25.218296,0 days 00:00:03.203772,0.09463674641680721,4,sqrt,1,15,1253,0.8383662567025733,TPESampler,COMPLETE
1359,0.3290129576171021,2025-04-24 22:01:24.760826,2025-04-24 22:01:28.443993,0 days 00:00:03.683167,0.0997324085323853,7,sqrt,2,6,1291,0.693993503020509,TPESampler,COMPLETE
1360,0.26557521356417424,2025-04-24 22:01:24.896148,2025-04-24 22:01:29.031993,0 days 00:00:04.135845,0.09180045890009399,9,sqrt,1,20,1259,0.7160269145138579,TPESampler,COMPLETE
1361,0.2664096239723824,2025-04-24 22:01:25.497026,2025-04-24 22:01:29.153788,0 days 00:00:03.656762,0.09929404630808357,3,sqrt,1,13,1404,0.7820592857895947,TPESampler,COMPLETE
1362,0.3176587633982747,2025-04-24 22:01:28.641667,2025-04-24 22:01:31.839847,0 days 00:00:03.198180,0.06453013614929476,9,sqrt,2,20,1095,0.6352608325138734,TPESampler,COMPLETE
1363,0.2766986553950808,2025-04-24 22:01:29.327710,2025-04-24 22:01:33.054961,0 days 00:00:03.727251,0.07318072080497463,7,sqrt,1,11,1131,0.6054037930638214,TPESampler,COMPLETE
1364,0.2982583545698125,2025-04-24 22:01:29.406547,2025-04-24 22:01:32.945422,0 days 00:00:03.538875,0.06740744026827035,7,sqrt,3,16,1057,0.71320511417123,TPESampler,COMPLETE
1365,0.33186000944490157,2025-04-24 22:01:32.051734,2025-04-24 22:01:35.979245,0 days 00:00:03.927511,0.06908859070780668,4,,4,17,1068,0.7093613753649023,TPESampler,COMPLETE
1366,0.37665593520486923,2025-04-24 22:01:33.145751,2025-04-24 22:01:35.888045,0 days 00:00:02.742294,0.043014065723072696,7,sqrt,7,15,889,0.9068577969092777,TPESampler,COMPLETE
1367,0.2973269946231528,2025-04-24 22:01:33.236175,2025-04-24 22:01:36.744167,0 days 00:00:03.507992,0.08757500007695102,10,sqrt,3,18,1147,0.6071003565806564,TPESampler,COMPLETE
1368,0.2565483087552836,2025-04-24 22:01:36.055825,2025-04-24 22:01:39.398208,0 days 00:00:03.342383,0.07510672652782778,8,sqrt,2,20,1031,0.6026094388132336,TPESampler,COMPLETE
1369,0.2844512864795682,2025-04-24 22:01:36.190070,2025-04-24 22:01:39.677321,0 days 00:00:03.487251,0.09253196582934509,6,log2,3,10,1096,0.6947018278631355,TPESampler,COMPLETE
1370,0.4287909866244842,2025-04-24 22:01:36.971989,2025-04-24 22:01:40.464621,0 days 00:00:03.492632,0.010564599840218703,8,sqrt,6,17,1256,0.92239579648033,TPESampler,COMPLETE
1371,0.2771671889058095,2025-04-24 22:01:39.629253,2025-04-24 22:01:43.295847,0 days 00:00:03.666594,0.05982249382612003,5,sqrt,3,5,1310,0.6135900229562418,TPESampler,COMPLETE
1372,0.2909149437011278,2025-04-24 22:01:39.909298,2025-04-24 22:01:43.834956,0 days 00:00:03.925658,0.09747354476900758,5,sqrt,1,6,1334,0.6810317914064687,TPESampler,COMPLETE
1373,0.327437487238125,2025-04-24 22:01:40.650845,2025-04-24 22:01:44.622500,0 days 00:00:03.971655,0.0548866666594074,10,sqrt,3,15,1437,0.600956850988081,TPESampler,COMPLETE
1374,0.2871807690914838,2025-04-24 22:01:43.508584,2025-04-24 22:01:46.953134,0 days 00:00:03.444550,0.07007690824374281,7,sqrt,2,19,1272,0.6001411306571901,TPESampler,COMPLETE
1375,0.2621609614205364,2025-04-24 22:01:44.092090,2025-04-24 22:01:47.300800,0 days 00:00:03.208710,0.07479691364178001,7,log2,1,15,1307,0.641495937491369,TPESampler,COMPLETE
1376,0.36000361871924125,2025-04-24 22:01:44.836715,2025-04-24 22:01:47.497851,0 days 00:00:02.661136,0.06614275804145925,8,,6,9,356,0.9692499996505206,TPESampler,COMPLETE
1377,0.6860471291779212,2025-04-24 22:01:47.164860,2025-04-24 22:01:49.983579,0 days 00:00:02.818719,0.010664238478079499,3,sqrt,4,8,1027,0.6246303931750532,TPESampler,COMPLETE
1378,0.27684051477057414,2025-04-24 22:01:47.527023,2025-04-24 22:01:50.956296,0 days 00:00:03.429273,0.0940994174344814,9,sqrt,1,17,1459,0.6265531159683454,TPESampler,COMPLETE
1379,0.3155772468230917,2025-04-24 22:01:47.730792,2025-04-24 22:01:53.503510,0 days 00:00:05.772718,0.08532297482823603,5,,1,12,1420,0.791543737897618,TPESampler,COMPLETE
1380,0.4495271266536596,2025-04-24 22:01:50.205739,2025-04-24 22:01:52.538286,0 days 00:00:02.332547,0.09593969256723593,4,sqrt,10,2,1345,0.7734417334741948,TPESampler,COMPLETE
1381,0.3723447414046961,2025-04-24 22:01:51.142010,2025-04-24 22:01:58.008680,0 days 00:00:06.866670,0.0658774425619112,9,,7,14,1218,0.9247315505873366,TPESampler,COMPLETE
1382,0.29858099059008614,2025-04-24 22:01:52.734334,2025-04-24 22:01:55.781059,0 days 00:00:03.046725,0.09029244348006872,7,sqrt,1,17,1490,0.718119260500795,TPESampler,COMPLETE
1383,0.25544495705895326,2025-04-24 22:01:53.711613,2025-04-24 22:01:56.350242,0 days 00:00:02.638629,0.09842468080207817,7,sqrt,1,16,1198,0.7969823768820362,TPESampler,COMPLETE
1384,0.26849376032181393,2025-04-24 22:01:56.008487,2025-04-24 22:01:58.999585,0 days 00:00:02.991098,0.09674873741904517,9,sqrt,1,16,1147,0.6834042003545328,TPESampler,COMPLETE
1385,0.4513769465612052,2025-04-24 22:01:56.585500,2025-04-24 22:01:59.001386,0 days 00:00:02.415886,0.0954750876018253,10,log2,7,9,1050,0.7043751934590309,TPESampler,COMPLETE
1386,0.29005966364486896,2025-04-24 22:01:58.224876,2025-04-24 22:02:01.236540,0 days 00:00:03.011664,0.08599922815366766,3,sqrt,2,4,1198,0.6319283745405243,TPESampler,COMPLETE
1387,0.29419720865524035,2025-04-24 22:01:59.157231,2025-04-24 22:02:01.791206,0 days 00:00:02.633975,0.09714899174567097,7,log2,4,20,846,0.9580761893918075,TPESampler,COMPLETE
1388,0.28983462083371825,2025-04-24 22:01:59.205539,2025-04-24 22:02:02.987463,0 days 00:00:03.781924,0.06490323927462027,6,sqrt,2,16,1233,0.6684770982567958,TPESampler,COMPLETE
1389,0.3244122563227764,2025-04-24 22:02:01.471756,2025-04-24 22:02:05.106058,0 days 00:00:03.634302,0.09905147578995775,6,sqrt,3,17,1220,0.6653510255996736,TPESampler,COMPLETE
1390,0.28531262820932796,2025-04-24 22:02:02.000118,2025-04-24 22:02:06.127428,0 days 00:00:04.127310,0.05890490505516783,6,sqrt,1,13,1445,0.6355013599784445,TPESampler,COMPLETE
1391,0.3118458535420186,2025-04-24 22:02:03.200200,2025-04-24 22:02:07.496323,0 days 00:00:04.296123,0.06860436470456506,8,sqrt,3,19,1489,0.6236249103455078,TPESampler,COMPLETE
1392,0.29840591629182167,2025-04-24 22:02:05.322047,2025-04-24 22:02:09.420809,0 days 00:00:04.098762,0.09529878476281872,12,log2,3,20,1451,0.6764850879031057,TPESampler,COMPLETE
1393,0.3083950892239216,2025-04-24 22:02:06.347761,2025-04-24 22:02:09.433274,0 days 00:00:03.085513,0.01958372410806737,7,sqrt,2,11,1025,0.8287290800590508,TPESampler,COMPLETE
1394,0.2596121789650917,2025-04-24 22:02:07.704014,2025-04-24 22:02:13.606105,0 days 00:00:05.902091,0.07927849200255017,6,,1,14,1493,0.626228210695264,TPESampler,COMPLETE
1395,0.3070727545930293,2025-04-24 22:02:09.622803,2025-04-24 22:02:13.531253,0 days 00:00:03.908450,0.09937593832586859,4,sqrt,1,17,1269,0.7374512610083472,TPESampler,COMPLETE
1396,0.2549032356624225,2025-04-24 22:02:09.828956,2025-04-24 22:02:13.874921,0 days 00:00:04.045965,0.08695800821136951,3,sqrt,1,14,1462,0.7084944032374527,TPESampler,COMPLETE
1397,0.35266378210966715,2025-04-24 22:02:13.728279,2025-04-24 22:02:19.020044,0 days 00:00:05.291765,0.09024098317167875,5,,2,16,1146,0.7081098043604359,TPESampler,COMPLETE
1398,0.3136097297857646,2025-04-24 22:02:13.810982,2025-04-24 22:02:17.022894,0 days 00:00:03.211912,0.09079585471550265,5,log2,2,5,1338,0.6011446382071883,TPESampler,COMPLETE
1399,1.24251586079296,2025-04-24 22:02:14.139583,2025-04-24 22:02:15.633443,0 days 00:00:01.493860,0.019679580857764462,8,log2,10,13,262,0.6338628780614899,TPESampler,COMPLETE
1400,0.2966227107399528,2025-04-24 22:02:15.835221,2025-04-24 22:02:18.065645,0 days 00:00:02.230424,0.04856766996245784,4,sqrt,3,18,890,0.6018845861767481,TPESampler,COMPLETE
1401,0.29575972943076184,2025-04-24 22:02:17.230607,2025-04-24 22:02:20.182080,0 days 00:00:02.951473,0.09356691131669458,7,sqrt,3,18,1212,0.603529233353842,TPESampler,COMPLETE
1402,0.9728429787491814,2025-04-24 22:02:18.255488,2025-04-24 22:02:20.011538,0 days 00:00:01.756050,0.024693621240503182,9,log2,6,19,566,0.777057843831548,TPESampler,COMPLETE
1403,1.2584236702348373,2025-04-24 22:02:19.234047,2025-04-24 22:02:20.280369,0 days 00:00:01.046322,0.016436395870922754,7,sqrt,10,9,105,0.7166603889441834,TPESampler,COMPLETE
1404,0.24715937234208987,2025-04-24 22:02:20.289881,2025-04-24 22:02:24.534413,0 days 00:00:04.244532,0.08683281469693675,6,sqrt,1,14,1500,0.6022250455970434,TPESampler,COMPLETE
1405,0.2963823239366824,2025-04-24 22:02:20.369689,2025-04-24 22:02:24.904691,0 days 00:00:04.535002,0.07481681762562754,9,sqrt,4,9,1446,0.6218473741022205,TPESampler,COMPLETE
1406,0.26215820663235895,2025-04-24 22:02:20.495283,2025-04-24 22:02:24.506486,0 days 00:00:04.011203,0.08666116722495648,7,sqrt,1,20,1269,0.6047087545608666,TPESampler,COMPLETE
1407,0.42611034210774856,2025-04-24 22:02:24.663897,2025-04-24 22:02:26.994846,0 days 00:00:02.330949,0.028296086820322572,4,sqrt,5,3,615,0.7412566567254874,TPESampler,COMPLETE
1408,0.52078009094924,2025-04-24 22:02:24.716262,2025-04-24 22:02:27.887851,0 days 00:00:03.171589,0.030382014102026594,8,log2,4,20,983,0.6857317801292956,TPESampler,COMPLETE
1409,0.3133568615135211,2025-04-24 22:02:25.204938,2025-04-24 22:02:28.767151,0 days 00:00:03.562213,0.07511509760599958,7,sqrt,1,17,1281,0.693113101133996,TPESampler,COMPLETE
1410,0.41272330311916866,2025-04-24 22:02:27.195620,2025-04-24 22:02:32.026475,0 days 00:00:04.830855,0.02045025702565598,6,,9,12,1008,0.9488740752325879,TPESampler,COMPLETE
1411,0.2970317125326167,2025-04-24 22:02:28.113778,2025-04-24 22:02:31.650864,0 days 00:00:03.537086,0.07680804958848271,7,sqrt,1,9,1494,0.6659218982453532,TPESampler,COMPLETE
1412,0.26844372063877286,2025-04-24 22:02:29.143261,2025-04-24 22:02:32.220527,0 days 00:00:03.077266,0.08105813243592928,8,sqrt,1,16,1275,0.6055591085402191,TPESampler,COMPLETE
1413,0.43798657306581623,2025-04-24 22:02:31.875883,2025-04-24 22:02:33.465935,0 days 00:00:01.590052,0.09891682543336096,6,sqrt,10,17,450,0.93661804839604,TPESampler,COMPLETE
1414,0.47270221253817424,2025-04-24 22:02:32.270682,2025-04-24 22:02:36.404006,0 days 00:00:04.133324,0.024209432982512064,5,,10,19,943,0.6452697344252671,TPESampler,COMPLETE
1415,0.31060253082072276,2025-04-24 22:02:32.535527,2025-04-24 22:02:36.459919,0 days 00:00:03.924392,0.05660311675897984,10,sqrt,1,18,1459,0.6150122424486134,TPESampler,COMPLETE
1416,0.2975894170386584,2025-04-24 22:02:33.683027,2025-04-24 22:02:36.537553,0 days 00:00:02.854526,0.09734453998289931,5,sqrt,3,20,973,0.6695933435170838,TPESampler,COMPLETE
1417,0.36262721275280274,2025-04-24 22:02:36.587155,2025-04-24 22:02:40.990074,0 days 00:00:04.402919,0.07199937082879283,12,,7,4,735,0.7082806409556972,TPESampler,COMPLETE
1418,0.2838610423104927,2025-04-24 22:02:36.634679,2025-04-24 22:02:39.334776,0 days 00:00:02.700097,0.08143249428046999,8,sqrt,1,20,999,0.7058331874124335,TPESampler,COMPLETE
1419,0.29309951897887526,2025-04-24 22:02:36.769912,2025-04-24 22:02:40.839768,0 days 00:00:04.069856,0.09817352685824396,3,,3,7,1036,0.7396708233907836,TPESampler,COMPLETE
1420,0.250155450721949,2025-04-24 22:02:39.531450,2025-04-24 22:02:42.362690,0 days 00:00:02.831240,0.057761276305162264,4,sqrt,1,19,1465,0.6992895653835334,TPESampler,COMPLETE
1421,0.27536789179680216,2025-04-24 22:02:41.140544,2025-04-24 22:02:44.962972,0 days 00:00:03.822428,0.09509592113170844,5,sqrt,2,6,1273,0.6290564029807137,TPESampler,COMPLETE
1422,0.2654690684017992,2025-04-24 22:02:41.223773,2025-04-24 22:02:45.634410,0 days 00:00:04.410637,0.09531053641634041,8,sqrt,1,12,1472,0.601454571968164,TPESampler,COMPLETE
1423,0.2811829067711125,2025-04-24 22:02:42.996589,2025-04-24 22:02:46.190834,0 days 00:00:03.194245,0.09791848344917699,5,sqrt,1,14,1169,0.7487068880031367,TPESampler,COMPLETE
1424,0.31178850152103,2025-04-24 22:02:45.569089,2025-04-24 22:02:52.316937,0 days 00:00:06.747848,0.021203579931433666,6,,4,15,1489,0.9809520408817536,TPESampler,COMPLETE
1425,0.31412306651054234,2025-04-24 22:02:46.013281,2025-04-24 22:02:48.109738,0 days 00:00:02.096457,0.0409321833147208,7,sqrt,2,20,505,0.7589840093041355,TPESampler,COMPLETE
1426,0.24568435834369293,2025-04-24 22:02:46.760564,2025-04-24 22:02:49.750361,0 days 00:00:02.989797,0.061205573593318865,6,sqrt,1,19,1309,0.6835734905092063,TPESampler,COMPLETE
1427,1.0160641477973515,2025-04-24 22:02:48.480457,2025-04-24 22:02:50.547049,0 days 00:00:02.066592,0.026999539062867218,10,log2,10,18,773,0.7591301285008573,TPESampler,COMPLETE
1428,0.35508198026906573,2025-04-24 22:02:49.970807,2025-04-24 22:02:55.307732,0 days 00:00:05.336925,0.011198865149581717,5,,6,17,1230,0.9890628837593947,TPESampler,COMPLETE
1429,0.23756498472872778,2025-04-24 22:02:50.935015,2025-04-24 22:02:53.900506,0 days 00:00:02.965491,0.09898480502506307,6,sqrt,1,19,1439,0.8086464639430825,TPESampler,COMPLETE
1430,0.2692631672922209,2025-04-24 22:02:52.523295,2025-04-24 22:02:55.842731,0 days 00:00:03.319436,0.060868155579978704,4,sqrt,2,12,1303,0.7373001217001676,TPESampler,COMPLETE
1431,0.30560619650618037,2025-04-24 22:02:54.183541,2025-04-24 22:02:58.302692,0 days 00:00:04.119151,0.09988028421484739,6,sqrt,2,7,1463,0.6782076822745323,TPESampler,COMPLETE
1432,0.5843083264443498,2025-04-24 22:02:55.494254,2025-04-24 22:02:59.400898,0 days 00:00:03.906644,0.011434503691687532,9,sqrt,8,3,1440,0.6444427142513711,TPESampler,COMPLETE
1433,0.3834705725953915,2025-04-24 22:02:56.020510,2025-04-24 22:02:59.583221,0 days 00:00:03.562711,0.02785420418130988,3,sqrt,7,5,1474,0.9238377834875073,TPESampler,COMPLETE
1434,0.5409359946726325,2025-04-24 22:02:58.544665,2025-04-24 22:03:01.851763,0 days 00:00:03.307098,0.015622602743900364,6,sqrt,10,7,1400,0.8475911079951928,TPESampler,COMPLETE
1435,0.28239370364734123,2025-04-24 22:02:59.626383,2025-04-24 22:03:03.551935,0 days 00:00:03.925552,0.059850549948234716,8,sqrt,3,16,1336,0.6955061570102702,TPESampler,COMPLETE
1436,0.28700399018460293,2025-04-24 22:02:59.821415,2025-04-24 22:03:03.615506,0 days 00:00:03.794091,0.06562274853823988,5,sqrt,3,9,1303,0.6203171778897416,TPESampler,COMPLETE
1437,0.2698082474357788,2025-04-24 22:03:02.051767,2025-04-24 22:03:05.535663,0 days 00:00:03.483896,0.09499920286504726,6,sqrt,1,20,1410,0.7598349120251422,TPESampler,COMPLETE
1438,0.2482880723843239,2025-04-24 22:03:03.670595,2025-04-24 22:03:06.563367,0 days 00:00:02.892772,0.09250539144154978,6,sqrt,1,18,1060,0.6062495917339714,TPESampler,COMPLETE
1439,0.2888775097166843,2025-04-24 22:03:03.793529,2025-04-24 22:03:07.471674,0 days 00:00:03.678145,0.06562933919606637,5,sqrt,1,15,1453,0.6380915722749072,TPESampler,COMPLETE
1440,0.341044566163088,2025-04-24 22:03:05.803520,2025-04-24 22:03:08.544879,0 days 00:00:02.741359,0.08846265240620217,3,sqrt,5,5,1364,0.6205474036923746,TPESampler,COMPLETE
1441,0.31119694377805346,2025-04-24 22:03:06.736026,2025-04-24 22:03:12.520297,0 days 00:00:05.784271,0.04730511513325858,9,,1,7,1211,0.6370229658872072,TPESampler,COMPLETE
1442,0.2625348228277335,2025-04-24 22:03:07.664535,2025-04-24 22:03:10.622523,0 days 00:00:02.957988,0.09932483622264576,3,sqrt,1,6,1395,0.7010742922570913,TPESampler,COMPLETE
1443,0.25271110896874,2025-04-24 22:03:08.748072,2025-04-24 22:03:11.590118,0 days 00:00:02.842046,0.06244497287203139,7,sqrt,1,15,1144,0.6550130031066329,TPESampler,COMPLETE
1444,0.3045021773756587,2025-04-24 22:03:10.814615,2025-04-24 22:03:14.326767,0 days 00:00:03.512152,0.09951631212698067,8,sqrt,2,20,1432,0.6126705540439772,TPESampler,COMPLETE
1445,0.2527064361352903,2025-04-24 22:03:11.802235,2025-04-24 22:03:15.712928,0 days 00:00:03.910693,0.09944438506142173,5,sqrt,1,10,1388,0.7338232901339868,TPESampler,COMPLETE
1446,0.2578078447548513,2025-04-24 22:03:12.770708,2025-04-24 22:03:16.584362,0 days 00:00:03.813654,0.06789405656987522,5,sqrt,1,20,1254,0.6857353743704165,TPESampler,COMPLETE
1447,0.28599803063898366,2025-04-24 22:03:14.602796,2025-04-24 22:03:17.996940,0 days 00:00:03.394144,0.05810560057141612,5,sqrt,1,12,1229,0.7101884082234535,TPESampler,COMPLETE
1448,0.3042473764195843,2025-04-24 22:03:15.928916,2025-04-24 22:03:19.922271,0 days 00:00:03.993355,0.09340250585014613,4,sqrt,1,18,1440,0.6915087529910157,TPESampler,COMPLETE
1449,0.2503200162952881,2025-04-24 22:03:16.820476,2025-04-24 22:03:20.989295,0 days 00:00:04.168819,0.09312934836739742,9,sqrt,1,16,1409,0.6562627753667731,TPESampler,COMPLETE
1450,0.2514777219233834,2025-04-24 22:03:18.202417,2025-04-24 22:03:21.995636,0 days 00:00:03.793219,0.09678625058157299,5,sqrt,1,16,1346,0.6212983369019872,TPESampler,COMPLETE
1451,0.32933771827817204,2025-04-24 22:03:20.130774,2025-04-24 22:03:24.028769,0 days 00:00:03.897995,0.05498049074307085,9,sqrt,2,15,1301,0.6069012539503591,TPESampler,COMPLETE
1452,0.2881929372591655,2025-04-24 22:03:21.220496,2025-04-24 22:03:25.586065,0 days 00:00:04.365569,0.062218216615545864,8,sqrt,1,15,1470,0.7002039065961101,TPESampler,COMPLETE
1453,0.2891481511380683,2025-04-24 22:03:22.268006,2025-04-24 22:03:25.884756,0 days 00:00:03.616750,0.06775070153843943,4,sqrt,3,9,1246,0.6855149378521498,TPESampler,COMPLETE
1454,0.277485511890611,2025-04-24 22:03:24.240501,2025-04-24 22:03:28.070906,0 days 00:00:03.830405,0.05919756706115337,6,sqrt,1,17,1497,0.6337696268331526,TPESampler,COMPLETE
1455,0.34944155642924724,2025-04-24 22:03:25.791459,2025-04-24 22:03:30.978092,0 days 00:00:05.186633,0.06507034611180812,7,,1,12,966,0.9892808847786838,TPESampler,COMPLETE
1456,0.28688821792030594,2025-04-24 22:03:26.101856,2025-04-24 22:03:28.943439,0 days 00:00:02.841583,0.034247339181731964,12,log2,1,19,1254,0.6245391420207442,TPESampler,COMPLETE
1457,0.32349047408689446,2025-04-24 22:03:28.266275,2025-04-24 22:03:30.728455,0 days 00:00:02.462180,0.09470428681905954,3,log2,4,18,1287,0.8125166133258827,TPESampler,COMPLETE
1458,0.25193725358288505,2025-04-24 22:03:29.161600,2025-04-24 22:03:32.174995,0 days 00:00:03.013395,0.09770930853333669,8,sqrt,1,20,1149,0.6551880816066902,TPESampler,COMPLETE
1459,0.27501615712789024,2025-04-24 22:03:30.927422,2025-04-24 22:03:35.018362,0 days 00:00:04.090940,0.09896389326088964,8,sqrt,1,15,1452,0.6498782853105096,TPESampler,COMPLETE
1460,0.2473480849832637,2025-04-24 22:03:31.281814,2025-04-24 22:03:34.419091,0 days 00:00:03.137277,0.08706576978020789,3,sqrt,1,7,1092,0.7254395511074739,TPESampler,COMPLETE
1461,0.291410901687389,2025-04-24 22:03:32.397641,2025-04-24 22:03:36.220566,0 days 00:00:03.822925,0.08270300778045783,4,sqrt,3,19,1495,0.7356012207389768,TPESampler,COMPLETE
1462,0.31988771218068063,2025-04-24 22:03:34.622817,2025-04-24 22:03:40.282677,0 days 00:00:05.659860,0.06539554905635375,5,,1,8,1352,0.6531093210224809,TPESampler,COMPLETE
1463,0.2553056104211077,2025-04-24 22:03:35.227346,2025-04-24 22:03:38.550946,0 days 00:00:03.323600,0.06456018218552319,6,sqrt,1,15,1296,0.6031483520297516,TPESampler,COMPLETE
1464,0.28980809552146675,2025-04-24 22:03:36.431085,2025-04-24 22:03:39.930923,0 days 00:00:03.499838,0.07350442180948735,7,sqrt,3,18,1335,0.7044410389908004,TPESampler,COMPLETE
1465,0.26419743898105663,2025-04-24 22:03:38.747128,2025-04-24 22:03:42.422494,0 days 00:00:03.675366,0.06504732782860503,6,sqrt,1,14,1499,0.8525868820418505,TPESampler,COMPLETE
1466,0.27740475535372405,2025-04-24 22:03:40.137601,2025-04-24 22:03:43.849303,0 days 00:00:03.711702,0.053291081024255504,5,sqrt,3,19,1472,0.7787213343788073,TPESampler,COMPLETE
1467,0.4623961044229476,2025-04-24 22:03:40.470989,2025-04-24 22:03:43.299342,0 days 00:00:02.828353,0.040978501213728716,10,sqrt,8,7,973,0.6084538591538008,TPESampler,COMPLETE
1468,0.7895496630715527,2025-04-24 22:03:42.643970,2025-04-24 22:03:43.807240,0 days 00:00:01.163270,0.03599296915601402,9,sqrt,7,13,142,0.9223513467276852,TPESampler,COMPLETE
1469,1.166785225362861,2025-04-24 22:03:43.552627,2025-04-24 22:03:44.850102,0 days 00:00:01.297475,0.010497756897181161,4,sqrt,9,18,268,0.6132770213077741,TPESampler,COMPLETE
1470,0.28329635909895196,2025-04-24 22:03:44.054292,2025-04-24 22:03:48.590224,0 days 00:00:04.535932,0.0832149055869823,6,sqrt,1,20,1472,0.6127279119453073,TPESampler,COMPLETE
1471,0.40589795040987264,2025-04-24 22:03:44.100074,2025-04-24 22:03:46.927023,0 days 00:00:02.826949,0.010575389113244304,10,sqrt,3,4,754,0.9351136714981372,TPESampler,COMPLETE
1472,0.2671705242395244,2025-04-24 22:03:45.075141,2025-04-24 22:03:48.798689,0 days 00:00:03.723548,0.07584611518207798,7,sqrt,1,11,1292,0.6775224902314834,TPESampler,COMPLETE
1473,0.24166939467465492,2025-04-24 22:03:47.150013,2025-04-24 22:03:50.544577,0 days 00:00:03.394564,0.09935365236160358,5,sqrt,1,7,1415,0.63936650182533,TPESampler,COMPLETE
1474,0.5090310664867466,2025-04-24 22:03:48.766089,2025-04-24 22:03:50.617154,0 days 00:00:01.851065,0.01574035806957233,4,sqrt,2,5,706,0.8250148005398126,TPESampler,COMPLETE
1475,0.3565569440660437,2025-04-24 22:03:49.039869,2025-04-24 22:03:54.562138,0 days 00:00:05.522269,0.011348869302231562,7,,4,20,1307,0.6918315090022491,TPESampler,COMPLETE
1476,0.30460216200064605,2025-04-24 22:03:50.709921,2025-04-24 22:03:54.372075,0 days 00:00:03.662154,0.08906710737068861,3,sqrt,3,5,1279,0.7075412297845965,TPESampler,COMPLETE
1477,0.6007314456104643,2025-04-24 22:03:50.841351,2025-04-24 22:03:54.338975,0 days 00:00:03.497624,0.05492085751905691,11,log2,10,13,1153,0.8261994589287148,TPESampler,COMPLETE
1478,0.3148770832582944,2025-04-24 22:03:54.524019,2025-04-24 22:03:56.636820,0 days 00:00:02.112801,0.048571191619891915,4,sqrt,1,19,860,0.8047457803519615,TPESampler,COMPLETE
1479,1.104751948511898,2025-04-24 22:03:54.566642,2025-04-24 22:03:56.217849,0 days 00:00:01.651207,0.05968228691113563,10,log2,8,18,145,0.8281482447979855,TPESampler,COMPLETE
1480,0.24751651209048792,2025-04-24 22:03:54.777218,2025-04-24 22:03:58.353059,0 days 00:00:03.575841,0.09801866032892455,5,sqrt,1,16,1119,0.619222899805628,TPESampler,COMPLETE
