number,value,datetime_start,datetime_complete,duration,params_learning_rate,params_max_depth,params_max_features,params_min_samples_leaf,params_min_samples_split,params_n_estimators,params_subsample,system_attrs_auto:sampler,state
1604,0.33629247873398144,2025-04-24 22:06:20.535884,2025-04-24 22:06:24.466183,0 days 00:00:03.930299,0.012197926823595068,6,,4,4,828,0.8294879258990744,TPESampler,COMPLETE
1605,0.23962190751008902,2025-04-24 22:06:22.387023,2025-04-24 22:06:24.844612,0 days 00:00:02.457589,0.07350714482585598,6,sqrt,1,16,1259,0.6055276811474499,TPESampler,COMPLETE
1606,1.0644814622218062,2025-04-24 22:06:24.669577,2025-04-24 22:06:26.394565,0 days 00:00:01.724988,0.01177095688875392,9,log2,7,2,601,0.8855504530527296,TPESampler,COMPLETE
1607,0.328407359398392,2025-04-24 22:06:24.714251,2025-04-24 22:06:28.668286,0 days 00:00:03.954035,0.01263329282530977,11,sqrt,3,18,1104,0.9857169881753194,TPESampler,COMPLETE
1608,0.24170671439046146,2025-04-24 22:06:25.055684,2025-04-24 22:06:29.601589,0 days 00:00:04.545905,0.06465369376036051,7,sqrt,1,13,1409,0.6071865416168123,TPESampler,COMPLETE
1609,0.31005318407708515,2025-04-24 22:06:26.594660,2025-04-24 22:06:30.168293,0 days 00:00:03.573633,0.0954962028989972,9,sqrt,3,19,1198,0.6902362335837153,TPESampler,COMPLETE
1610,0.2696145673231841,2025-04-24 22:06:28.947458,2025-04-24 22:06:33.609213,0 days 00:00:04.661755,0.07471881204392675,6,sqrt,1,13,1500,0.6751015739123487,TPESampler,COMPLETE
1611,0.28585179850331877,2025-04-24 22:06:29.831683,2025-04-24 22:06:34.073513,0 days 00:00:04.241830,0.0721032830580636,5,sqrt,1,18,1476,0.6267077838327415,TPESampler,COMPLETE
1612,0.47233960115032464,2025-04-24 22:06:30.376711,2025-04-24 22:06:32.534498,0 days 00:00:02.157787,0.04733448568903178,4,sqrt,9,15,583,0.9797171980336018,TPESampler,COMPLETE
1613,0.28683774932108613,2025-04-24 22:06:32.763622,2025-04-24 22:06:36.916384,0 days 00:00:04.152762,0.09122494678696091,6,sqrt,3,13,1476,0.6049532766498824,TPESampler,COMPLETE
1614,1.012824752179934,2025-04-24 22:06:33.842893,2025-04-24 22:06:34.978296,0 days 00:00:01.135403,0.03177908340692439,5,log2,1,18,133,0.7178676340649733,TPESampler,COMPLETE
1615,0.4456060559310589,2025-04-24 22:06:34.334589,2025-04-24 22:06:37.558079,0 days 00:00:03.223490,0.0133695227437206,5,sqrt,1,19,968,0.6887313089679561,TPESampler,COMPLETE
1616,0.30855590225602725,2025-04-24 22:06:35.200219,2025-04-24 22:06:38.653748,0 days 00:00:03.453529,0.09559298732424092,10,sqrt,3,12,1174,0.6785563560497516,TPESampler,COMPLETE
1617,0.3150635226124839,2025-04-24 22:06:37.122623,2025-04-24 22:06:39.493070,0 days 00:00:02.370447,0.05082516173867932,4,sqrt,3,12,850,0.6614917879590527,TPESampler,COMPLETE
1618,0.4505411446386923,2025-04-24 22:06:37.777086,2025-04-24 22:06:43.535760,0 days 00:00:05.758674,0.07602583973081448,4,,10,13,1428,0.8850179842329753,TPESampler,COMPLETE
1619,0.3604678127351798,2025-04-24 22:06:38.878462,2025-04-24 22:06:42.387234,0 days 00:00:03.508772,0.054593816028093836,6,,7,20,633,0.9979110359251301,TPESampler,COMPLETE
1620,0.24161861641357132,2025-04-24 22:06:39.696252,2025-04-24 22:06:42.521476,0 days 00:00:02.825224,0.09925747655776301,5,sqrt,1,19,1414,0.6087032914201272,TPESampler,COMPLETE
1621,0.45379876510404576,2025-04-24 22:06:42.568513,2025-04-24 22:06:48.404102,0 days 00:00:05.835589,0.02718631957506971,6,,10,17,1441,0.6719780710023104,TPESampler,COMPLETE
1622,0.3165803689052131,2025-04-24 22:06:42.732155,2025-04-24 22:06:46.082178,0 days 00:00:03.350023,0.09042671043178703,7,sqrt,2,16,1466,0.6216942184308544,TPESampler,COMPLETE
1623,0.5375715233383632,2025-04-24 22:06:43.768379,2025-04-24 22:06:46.996885,0 days 00:00:03.228506,0.012458428737650726,7,log2,1,17,1263,0.9987104980534818,TPESampler,COMPLETE
1624,0.5148038262518311,2025-04-24 22:06:46.357003,2025-04-24 22:06:47.823040,0 days 00:00:01.466037,0.027951176260747293,3,sqrt,2,11,416,0.6730286816181992,TPESampler,COMPLETE
1625,0.27607428313060733,2025-04-24 22:06:47.223476,2025-04-24 22:06:51.081949,0 days 00:00:03.858473,0.08545911831948282,6,sqrt,1,14,1284,0.6206181510492238,TPESampler,COMPLETE
1626,1.2100631065373557,2025-04-24 22:06:48.013896,2025-04-24 22:06:49.446242,0 days 00:00:01.432346,0.013607459827118936,3,log2,2,16,285,0.9995490572330594,TPESampler,COMPLETE
1627,0.31600841365166155,2025-04-24 22:06:48.611574,2025-04-24 22:06:51.637052,0 days 00:00:03.025478,0.08920042020695226,4,sqrt,4,18,1118,0.6034304793447802,TPESampler,COMPLETE
1628,0.25401525115314205,2025-04-24 22:06:49.662586,2025-04-24 22:06:53.077005,0 days 00:00:03.414419,0.06513895462796308,9,sqrt,1,20,1192,0.6580654301827759,TPESampler,COMPLETE
1629,0.2848347087741456,2025-04-24 22:06:51.507490,2025-04-24 22:06:55.061838,0 days 00:00:03.554348,0.09982336752663053,6,sqrt,3,16,1271,0.6123622592564885,TPESampler,COMPLETE
1630,0.24088405656897194,2025-04-24 22:06:51.867288,2025-04-24 22:06:55.506904,0 days 00:00:03.639616,0.08347466877104645,5,sqrt,1,15,1404,0.6087882957839174,TPESampler,COMPLETE
1631,0.46406650822213863,2025-04-24 22:06:53.286173,2025-04-24 22:06:58.708408,0 days 00:00:05.422235,0.05380125183948596,11,,10,8,1017,0.7234190230536192,TPESampler,COMPLETE
1632,0.30745048987417617,2025-04-24 22:06:55.274756,2025-04-24 22:06:58.184940,0 days 00:00:02.910184,0.09825081773568944,8,sqrt,3,3,1229,0.6218035284008304,TPESampler,COMPLETE
1633,0.2600930168765286,2025-04-24 22:06:55.758677,2025-04-24 22:06:59.042142,0 days 00:00:03.283465,0.09597716340118286,10,sqrt,1,13,1364,0.764489112085818,TPESampler,COMPLETE
1634,0.3012541503511876,2025-04-24 22:06:58.395763,2025-04-24 22:07:01.567584,0 days 00:00:03.171821,0.0989469009456414,4,sqrt,2,3,1164,0.708528817788386,TPESampler,COMPLETE
1635,0.2318361751540704,2025-04-24 22:06:58.938388,2025-04-24 22:07:02.601211,0 days 00:00:03.662823,0.08623956768221026,8,sqrt,1,20,1291,0.6807475370173933,TPESampler,COMPLETE
1636,1.1047053819286188,2025-04-24 22:06:59.337707,2025-04-24 22:07:00.573803,0 days 00:00:01.236096,0.0488712003818156,9,log2,5,5,125,0.9400264159941538,TPESampler,COMPLETE
1637,0.2793865590580196,2025-04-24 22:07:00.790306,2025-04-24 22:07:04.875641,0 days 00:00:04.085335,0.05810341543313207,8,sqrt,3,13,1381,0.6725297532033943,TPESampler,COMPLETE
1638,0.24857112076943577,2025-04-24 22:07:01.775775,2025-04-24 22:07:05.866139,0 days 00:00:04.090364,0.09024063423502,7,sqrt,1,18,1411,0.6203358651239921,TPESampler,COMPLETE
1639,1.132151210779008,2025-04-24 22:07:02.810548,2025-04-24 22:07:04.600100,0 days 00:00:01.789552,0.014753316986346736,12,log2,6,6,417,0.6279485885256384,TPESampler,COMPLETE
1640,0.288920614371807,2025-04-24 22:07:04.831957,2025-04-24 22:07:07.785575,0 days 00:00:02.953618,0.06434129651483417,8,sqrt,1,16,1177,0.6519944365426946,TPESampler,COMPLETE
1641,0.24370063785772908,2025-04-24 22:07:05.154754,2025-04-24 22:07:08.255060,0 days 00:00:03.100306,0.07319837363209188,8,sqrt,1,19,1205,0.6780815992939723,TPESampler,COMPLETE
1642,0.34681915541476555,2025-04-24 22:07:06.083249,2025-04-24 22:07:10.219771,0 days 00:00:04.136522,0.05899935398192673,11,sqrt,2,20,1489,0.7054817828363418,TPESampler,COMPLETE
1643,0.504648000280029,2025-04-24 22:07:07.969650,2025-04-24 22:07:11.094851,0 days 00:00:03.125201,0.027487415722683314,6,log2,5,9,1382,0.7777336197793515,TPESampler,COMPLETE
1644,0.2781917939225178,2025-04-24 22:07:08.466909,2025-04-24 22:07:11.839706,0 days 00:00:03.372797,0.0670321158725476,5,log2,1,7,1494,0.6661429521482163,TPESampler,COMPLETE
1645,0.2810763004857135,2025-04-24 22:07:10.400263,2025-04-24 22:07:13.124061,0 days 00:00:02.723798,0.08947317883175658,9,sqrt,3,20,1242,0.6000745720576547,TPESampler,COMPLETE
1646,0.5438674701728717,2025-04-24 22:07:11.330168,2025-04-24 22:07:12.796800,0 days 00:00:01.466632,0.02861884217921796,12,log2,1,16,341,0.8403195387932826,TPESampler,COMPLETE
1647,0.2831568794078163,2025-04-24 22:07:12.055491,2025-04-24 22:07:15.613264,0 days 00:00:03.557773,0.06557417889790641,9,sqrt,1,15,1215,0.6709558761026789,TPESampler,COMPLETE
1648,0.3575474879372896,2025-04-24 22:07:13.190429,2025-04-24 22:07:14.697876,0 days 00:00:01.507447,0.03324478520701063,11,sqrt,1,19,410,0.9264916412939027,TPESampler,COMPLETE
1649,0.48882864394396525,2025-04-24 22:07:13.357380,2025-04-24 22:07:15.670486,0 days 00:00:02.313106,0.05186166492108717,9,sqrt,9,17,949,0.6150122503136722,TPESampler,COMPLETE
1650,0.5004673148085043,2025-04-24 22:07:14.886445,2025-04-24 22:07:16.783223,0 days 00:00:01.896778,0.09376219119031887,9,log2,9,19,1022,0.9640429054359427,TPESampler,COMPLETE
1651,0.2911549991868234,2025-04-24 22:07:15.757932,2025-04-24 22:07:19.453787,0 days 00:00:03.695855,0.09776700587427342,9,sqrt,1,19,1291,0.6462741638267223,TPESampler,COMPLETE
1652,0.2886556863534478,2025-04-24 22:07:15.885620,2025-04-24 22:07:18.902063,0 days 00:00:03.016443,0.08414929133518216,3,sqrt,1,6,1007,0.6605664807559326,TPESampler,COMPLETE
1653,0.37802291511295777,2025-04-24 22:07:17.006919,2025-04-24 22:07:21.997611,0 days 00:00:04.990692,0.029096353066217544,12,,7,11,889,0.6912510308626212,TPESampler,COMPLETE
1654,0.31425402460053026,2025-04-24 22:07:19.113200,2025-04-24 22:07:21.996026,0 days 00:00:02.882826,0.04916098838485076,7,sqrt,2,20,1241,0.6433320017227755,TPESampler,COMPLETE
1655,0.2982937019880887,2025-04-24 22:07:19.823985,2025-04-24 22:07:23.157142,0 days 00:00:03.333157,0.0709649909885556,9,sqrt,3,14,1441,0.6375879753235696,TPESampler,COMPLETE
1656,0.3891127282566258,2025-04-24 22:07:22.159299,2025-04-24 22:07:28.350206,0 days 00:00:06.190907,0.01718530009565418,11,,2,17,992,0.8636700508634202,TPESampler,COMPLETE
1657,0.29567205865405816,2025-04-24 22:07:22.203677,2025-04-24 22:07:25.076526,0 days 00:00:02.872849,0.09549785341319532,9,sqrt,1,15,1232,0.611318624347276,TPESampler,COMPLETE
1658,0.2913547294157573,2025-04-24 22:07:23.397314,2025-04-24 22:07:27.139398,0 days 00:00:03.742084,0.09161471643904369,9,sqrt,3,15,1124,0.7351318880171535,TPESampler,COMPLETE
1659,0.28187655989348814,2025-04-24 22:07:25.274785,2025-04-24 22:07:27.966344,0 days 00:00:02.691559,0.09885318288856973,7,sqrt,1,14,1148,0.6026819204440059,TPESampler,COMPLETE
1660,0.32355943777034096,2025-04-24 22:07:27.339181,2025-04-24 22:07:30.359665,0 days 00:00:03.020484,0.07441384686708195,8,sqrt,3,20,1151,0.7252034295273726,TPESampler,COMPLETE
1661,0.2704437847300356,2025-04-24 22:07:28.200332,2025-04-24 22:07:31.425358,0 days 00:00:03.225026,0.07660043514537926,7,sqrt,1,20,1159,0.7031642344864083,TPESampler,COMPLETE
1662,1.1653110308213956,2025-04-24 22:07:28.603021,2025-04-24 22:07:30.001304,0 days 00:00:01.398283,0.01066727193977692,3,sqrt,5,16,218,0.7144139710970973,TPESampler,COMPLETE
1663,0.2658411579456419,2025-04-24 22:07:30.201976,2025-04-24 22:07:35.283571,0 days 00:00:05.081595,0.05053042739335261,5,,1,17,1325,0.711850320448401,TPESampler,COMPLETE
1664,0.4275112526905544,2025-04-24 22:07:30.598464,2025-04-24 22:07:34.961912,0 days 00:00:04.363448,0.027405589530293175,3,,9,3,1279,0.7360957389738522,TPESampler,COMPLETE
1665,0.24412616055505543,2025-04-24 22:07:31.643072,2025-04-24 22:07:34.467899,0 days 00:00:02.824827,0.08653697511799671,3,sqrt,1,4,1253,0.6855116237421847,TPESampler,COMPLETE
1666,0.37666287932255516,2025-04-24 22:07:34.659978,2025-04-24 22:07:36.033543,0 days 00:00:01.373565,0.0840508769284491,4,sqrt,5,12,289,0.6982717572453139,TPESampler,COMPLETE
1667,0.2474043628357171,2025-04-24 22:07:35.227325,2025-04-24 22:07:39.519335,0 days 00:00:04.292010,0.09251452044872664,4,sqrt,1,18,1496,0.6062790868141686,TPESampler,COMPLETE
1668,0.2950300547775725,2025-04-24 22:07:35.545052,2025-04-24 22:07:39.576954,0 days 00:00:04.031902,0.0950199885861858,6,sqrt,1,6,1299,0.7228890737091688,TPESampler,COMPLETE
1669,0.3143562342526467,2025-04-24 22:07:36.263469,2025-04-24 22:07:40.050426,0 days 00:00:03.786957,0.0985638487247078,8,sqrt,2,20,1292,0.6598899564371815,TPESampler,COMPLETE
1670,0.2951753794033157,2025-04-24 22:07:39.686577,2025-04-24 22:07:44.156053,0 days 00:00:04.469476,0.06809372391622491,8,sqrt,1,20,1449,0.6687030000626202,TPESampler,COMPLETE
1671,0.26888316300702086,2025-04-24 22:07:39.716932,2025-04-24 22:07:43.889800,0 days 00:00:04.172868,0.07612262349292433,3,sqrt,1,10,1355,0.7231915722734431,TPESampler,COMPLETE
1672,0.30701480016109267,2025-04-24 22:07:40.330903,2025-04-24 22:07:43.920006,0 days 00:00:03.589103,0.05436011059703686,3,sqrt,3,13,1287,0.8283847996735019,TPESampler,COMPLETE
1673,0.28583241918219726,2025-04-24 22:07:44.070008,2025-04-24 22:07:48.568081,0 days 00:00:04.498073,0.09642553835291894,4,sqrt,2,3,1493,0.6782699999953489,TPESampler,COMPLETE
1674,0.3050213427280166,2025-04-24 22:07:44.129322,2025-04-24 22:07:47.847880,0 days 00:00:03.718558,0.09285317343942265,3,sqrt,3,9,1253,0.7121766298500808,TPESampler,COMPLETE
1675,0.2816385875318212,2025-04-24 22:07:44.408762,2025-04-24 22:07:48.777616,0 days 00:00:04.368854,0.08403742202968965,6,sqrt,3,10,1490,0.6018709824663789,TPESampler,COMPLETE
1676,0.29970417343815225,2025-04-24 22:07:48.258651,2025-04-24 22:07:51.100392,0 days 00:00:02.841741,0.06029170811971376,9,sqrt,1,20,1130,0.6688584430699087,TPESampler,COMPLETE
1677,0.3356271911168519,2025-04-24 22:07:48.963478,2025-04-24 22:07:55.009732,0 days 00:00:06.046254,0.09913737406484043,11,,5,16,1240,0.6111400148533286,TPESampler,COMPLETE
1678,0.29238559634786304,2025-04-24 22:07:49.375723,2025-04-24 22:07:55.681944,0 days 00:00:06.306221,0.06284024674553804,9,,1,18,1324,0.7339965924048002,TPESampler,COMPLETE
1679,0.25557147185369616,2025-04-24 22:07:51.436213,2025-04-24 22:07:54.074873,0 days 00:00:02.638660,0.05857106646702571,7,sqrt,1,18,1068,0.6576184985408661,TPESampler,COMPLETE
1680,0.4517230153949544,2025-04-24 22:07:54.284174,2025-04-24 22:07:57.267511,0 days 00:00:02.983337,0.043863367232601126,12,sqrt,10,20,1203,0.91504146873551,TPESampler,COMPLETE
1681,0.2599204308828991,2025-04-24 22:07:55.235342,2025-04-24 22:07:59.206396,0 days 00:00:03.971054,0.07892454294688403,3,sqrt,1,11,1495,0.826091217129014,TPESampler,COMPLETE
1682,0.28597099838671775,2025-04-24 22:07:56.077568,2025-04-24 22:07:59.346201,0 days 00:00:03.268633,0.08914678977153699,7,log2,2,20,1074,0.6344325561036812,TPESampler,COMPLETE
1683,0.29401613382944736,2025-04-24 22:07:57.479978,2025-04-24 22:08:00.464318,0 days 00:00:02.984340,0.05449138578705152,5,sqrt,3,13,1201,0.6265318735459379,TPESampler,COMPLETE
1684,0.3164193216144695,2025-04-24 22:07:59.347576,2025-04-24 22:08:02.958519,0 days 00:00:03.610943,0.08296296062807847,7,sqrt,1,17,1499,0.6038137023536587,TPESampler,COMPLETE
1685,0.2253150461762655,2025-04-24 22:07:59.588358,2025-04-24 22:08:03.202451,0 days 00:00:03.614093,0.09360311294058284,6,sqrt,1,17,1497,0.6117958564644409,TPESampler,COMPLETE
1686,0.30185276849357806,2025-04-24 22:08:00.652748,2025-04-24 22:08:03.503272,0 days 00:00:02.850524,0.058758971868193406,5,sqrt,1,10,1107,0.8768132485497901,TPESampler,COMPLETE
1687,0.26355666458474425,2025-04-24 22:08:03.132409,2025-04-24 22:08:06.907900,0 days 00:00:03.775491,0.07484056431006568,6,sqrt,1,12,1472,0.6224841846794092,TPESampler,COMPLETE
1688,0.29546863530173223,2025-04-24 22:08:03.395639,2025-04-24 22:08:07.050402,0 days 00:00:03.654763,0.04789155798313708,3,sqrt,3,16,1472,0.6992478488022276,TPESampler,COMPLETE
1689,0.2510642560420781,2025-04-24 22:08:03.829478,2025-04-24 22:08:07.322443,0 days 00:00:03.492965,0.0937777927423212,8,sqrt,1,18,1257,0.6501843130554447,TPESampler,COMPLETE
1690,0.3292920893127179,2025-04-24 22:08:07.049089,2025-04-24 22:08:10.450765,0 days 00:00:03.401676,0.020995864406236565,10,,3,11,598,0.6661450089841529,TPESampler,COMPLETE
1691,0.30838929974132767,2025-04-24 22:08:07.259571,2025-04-24 22:08:10.369613,0 days 00:00:03.110042,0.08587774856529523,5,sqrt,2,16,1492,0.6093176043409035,TPESampler,COMPLETE
1692,0.33192562944550397,2025-04-24 22:08:07.526332,2025-04-24 22:08:09.267964,0 days 00:00:01.741632,0.026453968664860637,12,sqrt,2,7,484,0.8578665482032267,TPESampler,COMPLETE
1693,0.27921229432770117,2025-04-24 22:08:09.442267,2025-04-24 22:08:11.800604,0 days 00:00:02.358337,0.07774089313953839,8,sqrt,1,20,1024,0.6054531696641859,TPESampler,COMPLETE
1694,0.5500066719864843,2025-04-24 22:08:10.523598,2025-04-24 22:08:13.747084,0 days 00:00:03.223486,0.011895885580641629,3,sqrt,6,2,1292,0.8528937594419725,TPESampler,COMPLETE
1695,0.2530299560703947,2025-04-24 22:08:10.643347,2025-04-24 22:08:14.364590,0 days 00:00:03.721243,0.059539582196778754,6,sqrt,1,14,1497,0.6100622434997737,TPESampler,COMPLETE
1696,0.31372776567999033,2025-04-24 22:08:11.976437,2025-04-24 22:08:13.743146,0 days 00:00:01.766709,0.07356828816848666,6,sqrt,1,8,412,0.9954792942443962,TPESampler,COMPLETE
1697,0.25037253010300214,2025-04-24 22:08:13.903675,2025-04-24 22:08:18.043606,0 days 00:00:04.139931,0.06601539485736978,4,sqrt,1,19,1294,0.6121088124245284,TPESampler,COMPLETE
1698,0.3343958491754793,2025-04-24 22:08:13.955157,2025-04-24 22:08:18.674901,0 days 00:00:04.719744,0.09576351680431708,8,sqrt,2,16,1492,0.6268422653675167,TPESampler,COMPLETE
1699,0.3019239562303748,2025-04-24 22:08:14.630674,2025-04-24 22:08:18.272271,0 days 00:00:03.641597,0.059770525109253535,6,sqrt,2,20,1147,0.6071968212869366,TPESampler,COMPLETE
1700,0.2519192339224637,2025-04-24 22:08:18.215646,2025-04-24 22:08:21.982233,0 days 00:00:03.766587,0.0856462317388725,5,sqrt,1,16,1435,0.6154996754383274,TPESampler,COMPLETE
1701,0.25806722626275475,2025-04-24 22:08:18.499074,2025-04-24 22:08:22.114769,0 days 00:00:03.615695,0.046630062085922366,6,sqrt,1,17,1157,0.6033112639467701,TPESampler,COMPLETE
1702,0.3221937805040087,2025-04-24 22:08:18.949319,2025-04-24 22:08:22.034197,0 days 00:00:03.084878,0.02091308819529634,5,sqrt,3,20,1106,0.9549388821478442,TPESampler,COMPLETE
1703,0.2854129951776656,2025-04-24 22:08:22.175063,2025-04-24 22:08:25.791301,0 days 00:00:03.616238,0.04036612482665369,6,sqrt,1,13,1183,0.612836135142893,TPESampler,COMPLETE
1704,0.3060480200696763,2025-04-24 22:08:22.229790,2025-04-24 22:08:25.829625,0 days 00:00:03.599835,0.09584517065060329,6,sqrt,2,19,1470,0.6008440335769305,TPESampler,COMPLETE
1705,0.3298289251354539,2025-04-24 22:08:22.341933,2025-04-24 22:08:25.906352,0 days 00:00:03.564419,0.09645353140497012,9,sqrt,2,20,1204,0.7221692122692726,TPESampler,COMPLETE
1706,0.25269461102984,2025-04-24 22:08:25.993918,2025-04-24 22:08:29.339406,0 days 00:00:03.345488,0.05440507306316702,8,sqrt,1,12,1471,0.6152490809706104,TPESampler,COMPLETE
1707,0.250670667151951,2025-04-24 22:08:26.041394,2025-04-24 22:08:31.076490,0 days 00:00:05.035096,0.09717688977411817,4,,1,16,1399,0.6118451535071201,TPESampler,COMPLETE
1708,0.2691603148735312,2025-04-24 22:08:26.175744,2025-04-24 22:08:31.503586,0 days 00:00:05.327842,0.085700843857238,8,,1,11,1196,0.6228246711148246,TPESampler,COMPLETE
1709,0.266825306958778,2025-04-24 22:08:29.540421,2025-04-24 22:08:32.507115,0 days 00:00:02.966694,0.051601249498251976,7,sqrt,1,18,1483,0.6006542602316685,TPESampler,COMPLETE
1710,0.3405590330471918,2025-04-24 22:08:31.276298,2025-04-24 22:08:32.690255,0 days 00:00:01.413957,0.07205904713662059,6,,5,3,153,0.9612502003378282,TPESampler,COMPLETE
1711,0.293721479012854,2025-04-24 22:08:31.752927,2025-04-24 22:08:34.595821,0 days 00:00:02.842894,0.05349789989535451,5,sqrt,1,16,1162,0.6611442431831527,TPESampler,COMPLETE
1712,0.3134935218177188,2025-04-24 22:08:32.681665,2025-04-24 22:08:36.319234,0 days 00:00:03.637569,0.047994301066459626,9,sqrt,2,20,1474,0.6023880791696927,TPESampler,COMPLETE
1713,0.2824237902940101,2025-04-24 22:08:32.916755,2025-04-24 22:08:36.342681,0 days 00:00:03.425926,0.057332742660366795,9,sqrt,3,18,1345,0.6796171547810659,TPESampler,COMPLETE
1714,0.28153495634563774,2025-04-24 22:08:34.772153,2025-04-24 22:08:37.467423,0 days 00:00:02.695270,0.052485742278695374,6,sqrt,3,17,1260,0.609214303567429,TPESampler,COMPLETE
1715,0.2704535576765238,2025-04-24 22:08:36.446920,2025-04-24 22:08:40.620033,0 days 00:00:04.173113,0.06566134847358604,5,sqrt,1,20,1486,0.6546313207965612,TPESampler,COMPLETE
1716,0.2402693544536475,2025-04-24 22:08:36.477550,2025-04-24 22:08:39.982207,0 days 00:00:03.504657,0.06268605296043735,7,sqrt,1,20,1248,0.6207623879086736,TPESampler,COMPLETE
1717,0.31751997744904625,2025-04-24 22:08:37.707515,2025-04-24 22:08:41.516431,0 days 00:00:03.808916,0.09315244249858819,7,sqrt,1,12,1284,0.6282816709664568,TPESampler,COMPLETE
1718,0.6502177595588823,2025-04-24 22:08:40.191081,2025-04-24 22:08:41.670337,0 days 00:00:01.479256,0.03159839002266137,4,sqrt,5,18,276,0.9566732285927906,TPESampler,COMPLETE
1719,0.268300003918585,2025-04-24 22:08:40.846454,2025-04-24 22:08:44.645469,0 days 00:00:03.799015,0.0979913355350841,8,sqrt,1,20,1311,0.6032270124666187,TPESampler,COMPLETE
1720,0.28594792981229594,2025-04-24 22:08:41.754994,2025-04-24 22:08:45.210650,0 days 00:00:03.455656,0.06083928896478212,3,sqrt,2,14,1493,0.6712522572858962,TPESampler,COMPLETE
1721,0.3733325797948803,2025-04-24 22:08:41.917465,2025-04-24 22:08:48.616747,0 days 00:00:06.699282,0.025457409706352675,8,,7,20,1226,0.9036444208838211,TPESampler,COMPLETE
1722,0.3000951084676361,2025-04-24 22:08:44.844193,2025-04-24 22:08:46.327619,0 days 00:00:01.483426,0.07472002362833897,4,sqrt,2,19,484,0.7593411648617754,TPESampler,COMPLETE
1723,0.24126595813767424,2025-04-24 22:08:45.425392,2025-04-24 22:08:48.713486,0 days 00:00:03.288094,0.07607306002976537,6,sqrt,1,15,1442,0.6044312934418149,TPESampler,COMPLETE
1724,0.26721876376217335,2025-04-24 22:08:46.528060,2025-04-24 22:08:48.972811,0 days 00:00:02.444751,0.08687070432502986,8,sqrt,3,16,903,0.6822433322825373,TPESampler,COMPLETE
1725,0.2770101192572615,2025-04-24 22:08:48.806147,2025-04-24 22:08:53.554095,0 days 00:00:04.747948,0.050620937995284075,5,sqrt,2,12,1450,0.7508609373894637,TPESampler,COMPLETE
1726,0.27643341126297066,2025-04-24 22:08:48.932302,2025-04-24 22:08:53.298804,0 days 00:00:04.366502,0.05960772257058709,5,sqrt,1,11,1316,0.641464477749282,TPESampler,COMPLETE
