number,value,datetime_start,datetime_complete,duration,params_learning_rate,params_max_depth,params_max_features,params_min_samples_leaf,params_min_samples_split,params_n_estimators,params_subsample,system_attrs_auto:sampler,state
370,1.2830694685152684,2025-04-24 21:41:54.711168,2025-04-24 21:41:55.754399,0 days 00:00:01.043231,0.01656865421879913,10,log2,7,12,139,0.7589842414393703,TPESampler,COMPLETE
371,0.3095160488295816,2025-04-24 21:41:55.113581,2025-04-24 21:41:58.553068,0 days 00:00:03.439487,0.07910255146927077,6,sqrt,3,14,1455,0.6703048182027973,TPESampler,COMPLETE
372,0.27486171820543104,2025-04-24 21:41:55.920553,2025-04-24 21:41:59.373997,0 days 00:00:03.453444,0.06593620253765073,5,sqrt,1,12,1437,0.665017709196037,TPESampler,COMPLETE
373,0.2734241021113829,2025-04-24 21:41:57.654380,2025-04-24 21:42:01.186081,0 days 00:00:03.531701,0.08685497724214675,5,sqrt,1,13,1436,0.751854575996143,TPESampler,COMPLETE
374,0.2975087321251366,2025-04-24 21:41:58.754660,2025-04-24 21:42:02.363598,0 days 00:00:03.608938,0.04836704001536789,8,sqrt,1,16,1412,0.6632340648732412,TPESampler,COMPLETE
375,0.24861511599671074,2025-04-24 21:41:59.527486,2025-04-24 21:42:03.186219,0 days 00:00:03.658733,0.07108344904679434,7,sqrt,1,16,1471,0.613507945649437,TPESampler,COMPLETE
376,0.3105431633675284,2025-04-24 21:42:01.377472,2025-04-24 21:42:03.739443,0 days 00:00:02.361971,0.07318647521031373,9,sqrt,3,16,896,0.609577449890947,TPESampler,COMPLETE
377,0.3401356966047908,2025-04-24 21:42:02.554432,2025-04-24 21:42:09.157812,0 days 00:00:06.603380,0.06551428410824676,6,,6,17,1475,0.9980613157873228,TPESampler,COMPLETE
378,0.28437371281032314,2025-04-24 21:42:03.369226,2025-04-24 21:42:06.705422,0 days 00:00:03.336196,0.04945837973344634,6,sqrt,3,11,1453,0.6202779157133026,TPESampler,COMPLETE
379,0.2815595052099911,2025-04-24 21:42:03.885777,2025-04-24 21:42:07.269637,0 days 00:00:03.383860,0.07333320137317254,7,sqrt,2,15,1449,0.6182335166142114,TPESampler,COMPLETE
380,0.28378388732675797,2025-04-24 21:42:06.889899,2025-04-24 21:42:10.172199,0 days 00:00:03.282300,0.06866396464667604,7,sqrt,3,17,1441,0.7026478381949273,TPESampler,COMPLETE
381,0.25635629102206814,2025-04-24 21:42:07.437592,2025-04-24 21:42:09.847751,0 days 00:00:02.410159,0.08358878908938604,7,sqrt,1,11,831,0.615803513312688,TPESampler,COMPLETE
382,0.23853298511706006,2025-04-24 21:42:09.543097,2025-04-24 21:42:12.926863,0 days 00:00:03.383766,0.08509492134296938,7,sqrt,1,16,1409,0.6158118885109819,TPESampler,COMPLETE
383,0.2905181629045188,2025-04-24 21:42:10.500485,2025-04-24 21:42:14.274359,0 days 00:00:03.773874,0.04028592065045648,3,sqrt,1,14,1469,0.8035281226141759,TPESampler,COMPLETE
384,0.25059085262249237,2025-04-24 21:42:10.673434,2025-04-24 21:42:14.775603,0 days 00:00:04.102169,0.04996137158731164,8,sqrt,1,13,1366,0.6010371915689438,TPESampler,COMPLETE
385,0.24924697129143786,2025-04-24 21:42:13.134091,2025-04-24 21:42:16.053097,0 days 00:00:02.919006,0.09213206620397452,6,sqrt,1,17,1345,0.6101417099258136,TPESampler,COMPLETE
386,0.2745388316098077,2025-04-24 21:42:14.441873,2025-04-24 21:42:17.656153,0 days 00:00:03.214280,0.09825958880850051,3,sqrt,2,5,1499,0.7371304829868426,TPESampler,COMPLETE
387,0.2774667208927931,2025-04-24 21:42:14.936369,2025-04-24 21:42:17.763622,0 days 00:00:02.827253,0.06842779599652893,8,sqrt,1,17,1128,0.6209376033957339,TPESampler,COMPLETE
388,0.2550783510979542,2025-04-24 21:42:16.208446,2025-04-24 21:42:19.345584,0 days 00:00:03.137138,0.057995784203243625,6,sqrt,1,18,1478,0.6110649471378784,TPESampler,COMPLETE
389,1.114291946994159,2025-04-24 21:42:17.799618,2025-04-24 21:42:20.157269,0 days 00:00:02.357651,0.011447035203715487,10,log2,8,20,786,0.7544294545544318,TPESampler,COMPLETE
390,0.2609211174522558,2025-04-24 21:42:17.991994,2025-04-24 21:42:21.522932,0 days 00:00:03.530938,0.07097004536296359,7,sqrt,1,16,1166,0.640889877501762,TPESampler,COMPLETE
391,1.140457497533415,2025-04-24 21:42:19.552488,2025-04-24 21:42:21.455881,0 days 00:00:01.903393,0.01643469500066462,5,log2,9,20,605,0.6227343372043579,TPESampler,COMPLETE
392,0.2608289049141093,2025-04-24 21:42:20.344350,2025-04-24 21:42:22.773414,0 days 00:00:02.429064,0.09019193060439346,7,sqrt,1,15,1088,0.6062015367656061,TPESampler,COMPLETE
393,0.23754092011038552,2025-04-24 21:42:21.568694,2025-04-24 21:42:25.526418,0 days 00:00:03.957724,0.0749944027362396,5,sqrt,1,5,1496,0.7663466921101095,TPESampler,COMPLETE
394,0.2515200695057917,2025-04-24 21:42:21.686500,2025-04-24 21:42:25.598706,0 days 00:00:03.912206,0.09906042890148363,10,sqrt,1,15,1372,0.6130728781856286,TPESampler,COMPLETE
395,0.3069914319241215,2025-04-24 21:42:22.973104,2025-04-24 21:42:26.334260,0 days 00:00:03.361156,0.05847925841893688,8,sqrt,2,15,1444,0.6220807541012742,TPESampler,COMPLETE
396,0.7484079173770438,2025-04-24 21:42:25.664805,2025-04-24 21:42:27.136913,0 days 00:00:01.472108,0.018642046581432987,9,sqrt,8,5,437,0.6706268887262323,TPESampler,COMPLETE
397,0.2270897833088056,2025-04-24 21:42:25.796026,2025-04-24 21:42:29.174345,0 days 00:00:03.378319,0.09763025485858827,6,sqrt,1,19,1337,0.6062766393566618,TPESampler,COMPLETE
398,0.44677991205679635,2025-04-24 21:42:26.507600,2025-04-24 21:42:29.132916,0 days 00:00:02.625316,0.06527451847722021,6,sqrt,8,9,1046,0.6532129075893908,TPESampler,COMPLETE
399,0.2699897045795714,2025-04-24 21:42:27.357564,2025-04-24 21:42:30.048251,0 days 00:00:02.690687,0.05408431617133023,8,sqrt,1,13,1249,0.6203102941657022,TPESampler,COMPLETE
400,0.2653545544697075,2025-04-24 21:42:29.250436,2025-04-24 21:42:31.990201,0 days 00:00:02.739765,0.06440093604176574,8,sqrt,1,19,1500,0.6116257977175522,TPESampler,COMPLETE
401,0.2910706767549474,2025-04-24 21:42:29.292646,2025-04-24 21:42:31.717508,0 days 00:00:02.424862,0.0768876785052075,5,sqrt,1,19,1102,0.6143380805038886,TPESampler,COMPLETE
402,0.34124354911281873,2025-04-24 21:42:30.233307,2025-04-24 21:42:33.906982,0 days 00:00:03.673675,0.08493779272415893,6,sqrt,2,16,1324,0.6122474399035248,TPESampler,COMPLETE
403,0.27751648747987306,2025-04-24 21:42:31.925773,2025-04-24 21:42:36.410664,0 days 00:00:04.484891,0.08714121961489736,7,,1,16,1245,0.6079849475029262,TPESampler,COMPLETE
404,0.2865581206926253,2025-04-24 21:42:32.161557,2025-04-24 21:42:36.802156,0 days 00:00:04.640599,0.09109958764206545,7,,1,14,1268,0.6402659996567129,TPESampler,COMPLETE
405,0.2741626017978342,2025-04-24 21:42:34.082733,2025-04-24 21:42:36.862793,0 days 00:00:02.780060,0.09414770909723823,11,sqrt,1,14,1442,0.6533958450690638,TPESampler,COMPLETE
406,0.2998670105380351,2025-04-24 21:42:36.591557,2025-04-24 21:42:39.556771,0 days 00:00:02.965214,0.02970247290422087,8,sqrt,2,12,1363,0.6312475589053013,TPESampler,COMPLETE
407,0.3472248394499804,2025-04-24 21:42:36.989238,2025-04-24 21:42:39.488748,0 days 00:00:02.499510,0.03597071550927792,5,,6,5,410,0.8676211117061643,TPESampler,COMPLETE
408,0.33194527846016564,2025-04-24 21:42:37.050758,2025-04-24 21:42:40.346824,0 days 00:00:03.296066,0.09995994419859294,8,sqrt,2,18,1407,0.6108272174465865,TPESampler,COMPLETE
409,0.329397845311931,2025-04-24 21:42:39.628157,2025-04-24 21:42:43.072617,0 days 00:00:03.444460,0.09335149650314102,9,sqrt,2,19,1278,0.8568299123349702,TPESampler,COMPLETE
410,0.21989729929037896,2025-04-24 21:42:39.690803,2025-04-24 21:42:43.703072,0 days 00:00:04.012269,0.09492427479279014,9,sqrt,1,16,1419,0.6550053187293224,TPESampler,COMPLETE
411,0.2574731101001634,2025-04-24 21:42:40.539676,2025-04-24 21:42:44.092771,0 days 00:00:03.553095,0.09686226995912585,4,sqrt,1,9,1496,0.6796431520263487,TPESampler,COMPLETE
412,0.7387698557239665,2025-04-24 21:42:43.261586,2025-04-24 21:42:45.565784,0 days 00:00:02.304198,0.010060743589038006,10,log2,4,4,1075,0.8855955561798652,TPESampler,COMPLETE
413,0.2873048609259077,2025-04-24 21:42:44.144463,2025-04-24 21:42:47.152872,0 days 00:00:03.008409,0.06872127937817323,6,sqrt,1,4,1428,0.6978715849113667,TPESampler,COMPLETE
414,0.31763017429648566,2025-04-24 21:42:44.353867,2025-04-24 21:42:47.337900,0 days 00:00:02.984033,0.09028632041399866,5,sqrt,1,5,1186,0.6646147373961515,TPESampler,COMPLETE
415,0.29377532113088684,2025-04-24 21:42:46.059328,2025-04-24 21:42:48.547545,0 days 00:00:02.488217,0.07700839142787075,4,sqrt,3,16,1343,0.6290404202762705,TPESampler,COMPLETE
416,0.2968069009856459,2025-04-24 21:42:47.490530,2025-04-24 21:42:50.960490,0 days 00:00:03.469960,0.07294313353998422,5,sqrt,1,17,1475,0.6383371180310441,TPESampler,COMPLETE
417,0.2770350447902235,2025-04-24 21:42:47.796528,2025-04-24 21:42:51.565640,0 days 00:00:03.769112,0.09858647996324592,6,sqrt,2,18,1247,0.6265833179284838,TPESampler,COMPLETE
418,0.30955620796040545,2025-04-24 21:42:48.969324,2025-04-24 21:42:52.667045,0 days 00:00:03.697721,0.053504154217710945,8,log2,2,20,1271,0.9017654965861099,TPESampler,COMPLETE
419,0.33723451837156787,2025-04-24 21:42:51.146291,2025-04-24 21:42:55.197256,0 days 00:00:04.050965,0.011809773865211991,3,,4,15,1315,0.8719560847914144,TPESampler,COMPLETE
420,0.2610930337998743,2025-04-24 21:42:51.815047,2025-04-24 21:42:55.607107,0 days 00:00:03.792060,0.055414062101957304,4,sqrt,1,5,1461,0.7253106493642469,TPESampler,COMPLETE
421,0.3452877599334762,2025-04-24 21:42:53.303494,2025-04-24 21:42:55.942818,0 days 00:00:02.639324,0.09416101811281558,3,log2,2,8,1060,0.692129652307725,TPESampler,COMPLETE
422,0.3024353766464619,2025-04-24 21:42:55.500260,2025-04-24 21:42:59.184794,0 days 00:00:03.684534,0.08274127928636957,9,sqrt,1,19,1454,0.7953607947899051,TPESampler,COMPLETE
423,0.22488017079305014,2025-04-24 21:42:55.874418,2025-04-24 21:42:59.430419,0 days 00:00:03.556001,0.09207106629030744,6,sqrt,1,16,1477,0.6069961226092367,TPESampler,COMPLETE
424,0.3133423001655353,2025-04-24 21:42:56.299806,2025-04-24 21:42:59.185691,0 days 00:00:02.885885,0.07491023941327386,7,sqrt,4,9,1186,0.6203149841346958,TPESampler,COMPLETE
425,0.24537467641936536,2025-04-24 21:42:59.314841,2025-04-24 21:43:02.735067,0 days 00:00:03.420226,0.07444482858301943,6,sqrt,1,20,1374,0.6180900104562003,TPESampler,COMPLETE
426,0.2704090462814774,2025-04-24 21:42:59.367328,2025-04-24 21:43:02.866565,0 days 00:00:03.499237,0.08499870226289839,4,sqrt,1,16,1403,0.6020535803355976,TPESampler,COMPLETE
427,1.0758311251172865,2025-04-24 21:42:59.962307,2025-04-24 21:43:01.318747,0 days 00:00:01.356440,0.01490841933653122,6,log2,3,10,343,0.6535143361961342,TPESampler,COMPLETE
428,0.36520478709084525,2025-04-24 21:43:01.487940,2025-04-24 21:43:04.154362,0 days 00:00:02.666422,0.07608557238329232,7,sqrt,6,20,1285,0.625364138535052,TPESampler,COMPLETE
429,0.31414076935228713,2025-04-24 21:43:02.865721,2025-04-24 21:43:05.904939,0 days 00:00:03.039218,0.08945235648030764,8,sqrt,3,14,1349,0.620210139375467,TPESampler,COMPLETE
430,0.28330588928137507,2025-04-24 21:43:03.026214,2025-04-24 21:43:06.172672,0 days 00:00:03.146458,0.09447081401682883,6,sqrt,2,17,1486,0.6275507714144711,TPESampler,COMPLETE
431,1.1777564969991596,2025-04-24 21:43:04.312998,2025-04-24 21:43:05.224798,0 days 00:00:00.911800,0.04815522030705234,7,log2,6,17,160,0.6183240573731292,TPESampler,COMPLETE
432,0.23344835651122003,2025-04-24 21:43:05.386213,2025-04-24 21:43:08.140767,0 days 00:00:02.754554,0.07974672247539001,6,sqrt,1,14,1264,0.6130713421518644,TPESampler,COMPLETE
433,0.24655986670323723,2025-04-24 21:43:06.130872,2025-04-24 21:43:09.160492,0 days 00:00:03.029620,0.08083799853975086,6,sqrt,1,18,1429,0.6380759467186377,TPESampler,COMPLETE
434,0.3317221985731776,2025-04-24 21:43:06.324468,2025-04-24 21:43:08.897298,0 days 00:00:02.572830,0.05720721961818163,4,,2,5,589,0.9373011425040705,TPESampler,COMPLETE
435,0.2841846086095141,2025-04-24 21:43:08.287388,2025-04-24 21:43:11.862494,0 days 00:00:03.575106,0.04623279409861753,6,sqrt,2,5,1486,0.809391155343474,TPESampler,COMPLETE
436,0.32222701032934764,2025-04-24 21:43:09.099324,2025-04-24 21:43:11.959348,0 days 00:00:02.860024,0.02923858569543285,4,,1,8,675,0.6160287310071922,TPESampler,COMPLETE
437,0.24065038409253653,2025-04-24 21:43:09.388137,2025-04-24 21:43:12.829995,0 days 00:00:03.441858,0.08125289477335634,5,sqrt,1,20,1458,0.6605535810306449,TPESampler,COMPLETE
438,0.314179160243532,2025-04-24 21:43:12.033417,2025-04-24 21:43:15.062679,0 days 00:00:03.029262,0.03138324679777666,5,sqrt,4,3,1015,0.6443808521704535,TPESampler,COMPLETE
439,0.27496534023744024,2025-04-24 21:43:12.167599,2025-04-24 21:43:16.078827,0 days 00:00:03.911228,0.07448873427244015,4,sqrt,1,6,1365,0.6535960493413014,TPESampler,COMPLETE
440,0.27024062979573416,2025-04-24 21:43:13.037049,2025-04-24 21:43:17.146681,0 days 00:00:04.109632,0.08584010415600832,5,sqrt,1,20,1470,0.6871732088554234,TPESampler,COMPLETE
441,0.2768965194000293,2025-04-24 21:43:15.262660,2025-04-24 21:43:18.624773,0 days 00:00:03.362113,0.084219674952863,3,sqrt,2,20,1377,0.6458257563591224,TPESampler,COMPLETE
442,0.4389197778233704,2025-04-24 21:43:16.275161,2025-04-24 21:43:18.432285,0 days 00:00:02.157124,0.0193983032448378,4,,10,11,383,0.9716320408370235,TPESampler,COMPLETE
443,0.4580663678644766,2025-04-24 21:43:17.337715,2025-04-24 21:43:19.714090,0 days 00:00:02.376375,0.06169911065831473,10,sqrt,10,6,871,0.8549185236670537,TPESampler,COMPLETE
444,0.42492724290494466,2025-04-24 21:43:18.618732,2025-04-24 21:43:23.149883,0 days 00:00:04.531151,0.029346289573707895,9,,8,4,957,0.620878737711587,TPESampler,COMPLETE
445,0.2573647654337804,2025-04-24 21:43:18.803293,2025-04-24 21:43:22.287117,0 days 00:00:03.483824,0.08322145111046668,6,sqrt,1,19,1356,0.6575554055795014,TPESampler,COMPLETE
446,0.25093615374536615,2025-04-24 21:43:19.897496,2025-04-24 21:43:23.028670,0 days 00:00:03.131174,0.09883152263173833,6,sqrt,1,20,1390,0.6461222869097898,TPESampler,COMPLETE
447,0.24827611843890385,2025-04-24 21:43:22.487860,2025-04-24 21:43:25.416756,0 days 00:00:02.928896,0.05291369859661336,7,sqrt,1,19,1241,0.6882310859358722,TPESampler,COMPLETE
448,0.3769616108849139,2025-04-24 21:43:23.214812,2025-04-24 21:43:25.960944,0 days 00:00:02.746132,0.012650076378735223,8,,7,11,424,0.9258842786228783,TPESampler,COMPLETE
449,0.28842891239265045,2025-04-24 21:43:23.338817,2025-04-24 21:43:26.765931,0 days 00:00:03.427114,0.0982974350141252,7,sqrt,1,18,1456,0.6224854351123738,TPESampler,COMPLETE
450,0.3052974027032073,2025-04-24 21:43:25.606358,2025-04-24 21:43:28.556582,0 days 00:00:02.950224,0.04628490494235467,5,sqrt,3,19,1286,0.6264857984356633,TPESampler,COMPLETE
451,0.3114782715615853,2025-04-24 21:43:26.148567,2025-04-24 21:43:33.639301,0 days 00:00:07.490734,0.015148266125012931,9,,3,10,1384,0.8493574584410044,TPESampler,COMPLETE
452,0.2842803597979334,2025-04-24 21:43:26.960927,2025-04-24 21:43:29.480286,0 days 00:00:02.519359,0.07146659608022006,5,sqrt,1,20,1104,0.7261898099919034,TPESampler,COMPLETE
453,0.2871605463205747,2025-04-24 21:43:28.740243,2025-04-24 21:43:31.178799,0 days 00:00:02.438556,0.054186837990844464,5,sqrt,2,15,1139,0.6081965665846293,TPESampler,COMPLETE
454,0.2824345945819621,2025-04-24 21:43:29.683773,2025-04-24 21:43:32.227351,0 days 00:00:02.543578,0.08874237142609902,5,log2,2,18,1185,0.7194063095954744,TPESampler,COMPLETE
455,0.26463700588769956,2025-04-24 21:43:31.362753,2025-04-24 21:43:34.758715,0 days 00:00:03.395962,0.06475120603108478,5,sqrt,1,2,1457,0.7895037384494253,TPESampler,COMPLETE
456,0.27471929446010357,2025-04-24 21:43:32.425499,2025-04-24 21:43:36.501606,0 days 00:00:04.076107,0.05665722591373888,4,sqrt,2,19,1495,0.7011075340558113,TPESampler,COMPLETE
457,0.26126268213263093,2025-04-24 21:43:33.835891,2025-04-24 21:43:38.021932,0 days 00:00:04.186041,0.05230544200138901,6,sqrt,1,14,1473,0.626663548807354,TPESampler,COMPLETE
458,0.28605842084522104,2025-04-24 21:43:34.954812,2025-04-24 21:43:38.606982,0 days 00:00:03.652170,0.06359767647800726,5,sqrt,1,13,1297,0.6108441498423363,TPESampler,COMPLETE
459,0.8848149812045648,2025-04-24 21:43:36.719465,2025-04-24 21:43:38.308732,0 days 00:00:01.589267,0.049120270798128286,3,log2,6,6,455,0.7606167939666199,TPESampler,COMPLETE
460,0.2708151439074184,2025-04-24 21:43:38.224399,2025-04-24 21:43:42.337808,0 days 00:00:04.113409,0.05677773394246818,8,sqrt,1,19,1487,0.6420708351067113,TPESampler,COMPLETE
461,0.27012292498148593,2025-04-24 21:43:38.552802,2025-04-24 21:43:42.077631,0 days 00:00:03.524829,0.04286570769045317,7,sqrt,1,18,1211,0.7586805597945027,TPESampler,COMPLETE
462,0.25232319533479236,2025-04-24 21:43:38.921638,2025-04-24 21:43:42.935574,0 days 00:00:04.013936,0.08815741337781438,9,sqrt,1,15,1476,0.6549196500749999,TPESampler,COMPLETE
463,0.23730235397450428,2025-04-24 21:43:42.276298,2025-04-24 21:43:46.136272,0 days 00:00:03.859974,0.04836470156690733,5,sqrt,1,19,1475,0.6288871986309205,TPESampler,COMPLETE
464,0.2720297635591434,2025-04-24 21:43:42.518665,2025-04-24 21:43:46.221787,0 days 00:00:03.703122,0.04726443045768471,6,sqrt,1,20,1312,0.6000364658730497,TPESampler,COMPLETE
465,0.2675774703332732,2025-04-24 21:43:43.130892,2025-04-24 21:43:46.512644,0 days 00:00:03.381752,0.06323952356282413,6,sqrt,1,17,1204,0.6443471161401023,TPESampler,COMPLETE
466,0.3501484735086891,2025-04-24 21:43:46.286717,2025-04-24 21:43:49.797575,0 days 00:00:03.510858,0.06138226098241714,3,log2,1,19,1290,0.6242944403135504,TPESampler,COMPLETE
467,0.32616550151342294,2025-04-24 21:43:46.397008,2025-04-24 21:43:50.660736,0 days 00:00:04.263728,0.07008881018053549,5,sqrt,5,2,1464,0.6701076246880943,TPESampler,COMPLETE
468,0.22310432386109375,2025-04-24 21:43:46.746715,2025-04-24 21:43:50.553051,0 days 00:00:03.806336,0.08578688203352874,7,sqrt,1,20,1197,0.6163527732921297,TPESampler,COMPLETE
469,0.40832124374402384,2025-04-24 21:43:49.994042,2025-04-24 21:43:55.638488,0 days 00:00:05.644446,0.08666710101006764,12,,9,6,973,0.9617162567608967,TPESampler,COMPLETE
470,0.27050370277527613,2025-04-24 21:43:50.721656,2025-04-24 21:43:52.916002,0 days 00:00:02.194346,0.08822255080694344,6,sqrt,1,16,1252,0.6031454199116103,TPESampler,COMPLETE
471,0.41917334389546373,2025-04-24 21:43:50.832563,2025-04-24 21:43:57.920968,0 days 00:00:07.088405,0.011736469913993538,11,,9,17,1353,0.9140460121068217,TPESampler,COMPLETE
472,0.28637520700325647,2025-04-24 21:43:53.101937,2025-04-24 21:43:55.319402,0 days 00:00:02.217465,0.03510785082378744,4,sqrt,1,18,1411,0.6896861537428624,TPESampler,COMPLETE
473,0.2863905420412735,2025-04-24 21:43:55.492188,2025-04-24 21:43:57.424221,0 days 00:00:01.932033,0.049235082023107044,7,sqrt,2,20,1049,0.6517200739785948,TPESampler,COMPLETE
474,0.35711260294305375,2025-04-24 21:43:55.857970,2025-04-24 21:43:59.584931,0 days 00:00:03.726961,0.015263858296293469,11,,5,18,619,0.9838810477828117,TPESampler,COMPLETE
475,0.27076528816699935,2025-04-24 21:43:57.608466,2025-04-24 21:44:02.574863,0 days 00:00:04.966397,0.09261615563807615,4,,1,15,1456,0.6832415537472164,TPESampler,COMPLETE
476,0.2826552146872432,2025-04-24 21:43:58.196720,2025-04-24 21:44:01.540300,0 days 00:00:03.343580,0.061612179927136725,6,sqrt,3,20,1468,0.6277559503774228,TPESampler,COMPLETE
477,0.2641142330123567,2025-04-24 21:43:59.763458,2025-04-24 21:44:02.493144,0 days 00:00:02.729686,0.09254263412744362,4,sqrt,1,17,1107,0.6969879286295385,TPESampler,COMPLETE
478,0.4893893981178258,2025-04-24 21:44:01.726553,2025-04-24 21:44:04.004130,0 days 00:00:02.277577,0.019278285030401212,6,,10,10,512,0.6781036801294051,TPESampler,COMPLETE
479,0.5992923563752923,2025-04-24 21:44:02.664284,2025-04-24 21:44:05.375653,0 days 00:00:02.711369,0.03037242649405435,12,log2,5,11,986,0.7990904441451017,TPESampler,COMPLETE
480,0.25551988443268386,2025-04-24 21:44:02.794460,2025-04-24 21:44:06.713929,0 days 00:00:03.919469,0.07946855409255282,5,sqrt,1,7,1406,0.8207199399419907,TPESampler,COMPLETE
481,0.6605702495742231,2025-04-24 21:44:04.226279,2025-04-24 21:44:06.464962,0 days 00:00:02.238683,0.024441725707220963,3,sqrt,10,19,682,0.7940795622223422,TPESampler,COMPLETE
482,0.4915573372716272,2025-04-24 21:44:05.579250,2025-04-24 21:44:08.623568,0 days 00:00:03.044318,0.010823023550145373,12,,10,8,524,0.7396203687009334,TPESampler,COMPLETE
483,0.2222701193221136,2025-04-24 21:44:06.666651,2025-04-24 21:44:10.462415,0 days 00:00:03.795764,0.06066197713512126,5,sqrt,1,19,1483,0.7186786796975606,TPESampler,COMPLETE
484,0.2842100143515255,2025-04-24 21:44:06.926312,2025-04-24 21:44:09.966617,0 days 00:00:03.040305,0.06236388815102327,7,sqrt,2,20,1070,0.6422001091495884,TPESampler,COMPLETE
485,0.3348084141895627,2025-04-24 21:44:08.848137,2025-04-24 21:44:11.663467,0 days 00:00:02.815330,0.014819253940858767,8,sqrt,4,9,1260,0.9568045329508879,TPESampler,COMPLETE
486,0.3071012051303986,2025-04-24 21:44:10.326835,2025-04-24 21:44:13.127577,0 days 00:00:02.800742,0.03214459553775505,8,sqrt,1,18,930,0.9420688488992638,TPESampler,COMPLETE
487,0.2691370433251746,2025-04-24 21:44:10.743104,2025-04-24 21:44:13.751382,0 days 00:00:03.008278,0.08130411986935449,7,sqrt,1,20,912,0.6602380525479896,TPESampler,COMPLETE
488,0.317814035916874,2025-04-24 21:44:11.855553,2025-04-24 21:44:15.324775,0 days 00:00:03.469222,0.09753376472774303,4,sqrt,4,19,1456,0.6459587256399214,TPESampler,COMPLETE
489,0.48789382931577996,2025-04-24 21:44:13.329054,2025-04-24 21:44:15.405068,0 days 00:00:02.076014,0.017438877881079663,7,sqrt,7,11,736,0.8609880623297309,TPESampler,COMPLETE
490,0.26015563391637964,2025-04-24 21:44:13.969365,2025-04-24 21:44:17.324237,0 days 00:00:03.354872,0.07439522014918436,5,sqrt,1,18,1451,0.6563076906905169,TPESampler,COMPLETE
491,0.30658950157538906,2025-04-24 21:44:15.466016,2025-04-24 21:44:19.370883,0 days 00:00:03.904867,0.06916594933339014,9,sqrt,4,20,1433,0.64295354579901,TPESampler,COMPLETE
492,0.26269438432093684,2025-04-24 21:44:15.530690,2025-04-24 21:44:19.414119,0 days 00:00:03.883429,0.059834024681299974,5,sqrt,1,19,1481,0.6368559272345187,TPESampler,COMPLETE
