number,value,datetime_start,datetime_complete,duration,params_learning_rate,params_max_depth,params_max_features,params_min_samples_leaf,params_min_samples_split,params_n_estimators,params_subsample,system_attrs_auto:sampler,state
2465,0.2992381816843759,2025-04-24 22:24:30.847857,2025-04-24 22:24:33.841071,0 days 00:00:02.993214,0.0936894047514181,7,sqrt,3,15,1497,0.7150749639139139,TPESampler,COMPLETE
2466,0.3795768493405337,2025-04-24 22:24:31.078430,2025-04-24 22:24:36.895919,0 days 00:00:05.817489,0.01702248965656119,7,,7,7,1471,0.7039781285730629,TPESampler,COMPLETE
2467,0.26148392675673626,2025-04-24 22:24:34.050802,2025-04-24 22:24:36.736844,0 days 00:00:02.686042,0.05086523860306669,9,sqrt,1,19,1141,0.6277609779265539,TPESampler,COMPLETE
2468,0.2742451862424427,2025-04-24 22:24:35.197085,2025-04-24 22:24:38.397040,0 days 00:00:03.199955,0.05898646702916757,8,sqrt,1,16,1164,0.669943943443543,TPESampler,COMPLETE
2469,0.2391042066748645,2025-04-24 22:24:36.943301,2025-04-24 22:24:40.831878,0 days 00:00:03.888577,0.057623642500807884,9,sqrt,1,20,1234,0.6095982399271757,TPESampler,COMPLETE
2470,0.26206294583694595,2025-04-24 22:24:37.166417,2025-04-24 22:24:41.378174,0 days 00:00:04.211757,0.096271745796085,7,sqrt,1,16,1369,0.6271513652347932,TPESampler,COMPLETE
2471,0.2581892686178442,2025-04-24 22:24:38.644606,2025-04-24 22:24:42.411974,0 days 00:00:03.767368,0.06316800953207855,7,sqrt,1,17,1186,0.6803278244882063,TPESampler,COMPLETE
2472,0.22466899006361515,2025-04-24 22:24:41.057210,2025-04-24 22:24:44.890252,0 days 00:00:03.833042,0.0975438940119556,5,sqrt,1,20,1283,0.6740267974218113,TPESampler,COMPLETE
2473,0.2744683311813005,2025-04-24 22:24:41.658465,2025-04-24 22:24:46.466731,0 days 00:00:04.808266,0.058869654364939766,7,sqrt,1,20,1484,0.7956626534468674,TPESampler,COMPLETE
2474,0.434849701269701,2025-04-24 22:24:42.669158,2025-04-24 22:24:46.434476,0 days 00:00:03.765318,0.09367599776411052,5,log2,8,8,1429,0.980034071988948,TPESampler,COMPLETE
2475,0.2824864173177201,2025-04-24 22:24:45.125200,2025-04-24 22:24:48.083447,0 days 00:00:02.958247,0.053936186495107744,7,sqrt,1,20,983,0.6784239349791533,TPESampler,COMPLETE
2476,0.28134711642178756,2025-04-24 22:24:46.634257,2025-04-24 22:24:50.643691,0 days 00:00:04.009434,0.09846908752718628,8,sqrt,1,19,1168,0.6761295037980521,TPESampler,COMPLETE
2477,0.3043127916025012,2025-04-24 22:24:46.698145,2025-04-24 22:24:51.643275,0 days 00:00:04.945130,0.08805415113879511,10,sqrt,2,20,1470,0.6101371575455109,TPESampler,COMPLETE
2478,0.3380968217959733,2025-04-24 22:24:48.302360,2025-04-24 22:24:51.868495,0 days 00:00:03.566135,0.09663133079911265,6,sqrt,2,17,1073,0.6501034520159551,TPESampler,COMPLETE
2479,0.26491791453813646,2025-04-24 22:24:50.878010,2025-04-24 22:24:55.058879,0 days 00:00:04.180869,0.08348702760725446,9,sqrt,1,19,1398,0.6000442989377481,TPESampler,COMPLETE
2480,0.27091424288345334,2025-04-24 22:24:51.875792,2025-04-24 22:24:55.847904,0 days 00:00:03.972112,0.08800635288623875,6,sqrt,1,19,1239,0.6316404094120983,TPESampler,COMPLETE
2481,0.28541905923641064,2025-04-24 22:24:52.133054,2025-04-24 22:24:56.540214,0 days 00:00:04.407160,0.09584634413175154,7,log2,1,16,1488,0.6874366659444231,TPESampler,COMPLETE
2482,0.873862424829486,2025-04-24 22:24:55.288346,2025-04-24 22:24:57.564821,0 days 00:00:02.276475,0.022512206713906798,5,log2,5,18,678,0.9203373224500541,TPESampler,COMPLETE
2483,0.29167156536941224,2025-04-24 22:24:56.093599,2025-04-24 22:24:59.410900,0 days 00:00:03.317301,0.09901587095487703,7,sqrt,3,16,1290,0.6491373970263516,TPESampler,COMPLETE
2484,0.6146275283245617,2025-04-24 22:24:56.801654,2025-04-24 22:24:58.634082,0 days 00:00:01.832428,0.026788775915283204,12,sqrt,7,17,345,0.7499965786819457,TPESampler,COMPLETE
2485,0.3893972717964668,2025-04-24 22:24:57.794831,2025-04-24 22:24:59.228640,0 days 00:00:01.433809,0.06527839222166461,3,,8,10,173,0.8792387853667105,TPESampler,COMPLETE
2486,0.2612843725940074,2025-04-24 22:24:58.859844,2025-04-24 22:25:02.152969,0 days 00:00:03.293125,0.08208486221961679,6,sqrt,1,19,1204,0.646362812221669,TPESampler,COMPLETE
2487,0.2634798567732969,2025-04-24 22:24:59.498895,2025-04-24 22:25:04.266373,0 days 00:00:04.767478,0.09540624774252444,12,sqrt,1,20,1273,0.6024238340955962,TPESampler,COMPLETE
2488,0.2679806184888664,2025-04-24 22:24:59.699655,2025-04-24 22:25:04.313137,0 days 00:00:04.613482,0.0993004711379891,5,sqrt,1,20,1289,0.6021970805806328,TPESampler,COMPLETE
2489,0.2941022301809613,2025-04-24 22:25:02.390267,2025-04-24 22:25:05.667372,0 days 00:00:03.277105,0.09963301144897828,6,sqrt,1,15,1132,0.6819798341903388,TPESampler,COMPLETE
2490,0.2538765467049398,2025-04-24 22:25:04.457695,2025-04-24 22:25:08.336963,0 days 00:00:03.879268,0.07741596397499004,6,sqrt,1,20,1327,0.670627566945861,TPESampler,COMPLETE
2491,0.273043844964095,2025-04-24 22:25:04.504714,2025-04-24 22:25:08.165221,0 days 00:00:03.660507,0.0826893349356959,6,sqrt,1,20,1167,0.6023930940765672,TPESampler,COMPLETE
2492,0.2507805300151179,2025-04-24 22:25:05.896341,2025-04-24 22:25:10.301514,0 days 00:00:04.405173,0.07502789302761449,7,sqrt,1,17,1490,0.615431610146456,TPESampler,COMPLETE
2493,0.29797546016986043,2025-04-24 22:25:08.401416,2025-04-24 22:25:12.013195,0 days 00:00:03.611779,0.06119778448238098,6,sqrt,2,16,1204,0.6194461972927338,TPESampler,COMPLETE
2494,0.5889906991699019,2025-04-24 22:25:08.604648,2025-04-24 22:25:11.269418,0 days 00:00:02.664770,0.017279040813542368,3,sqrt,5,18,809,0.9688052623497215,TPESampler,COMPLETE
2495,0.3461857745012068,2025-04-24 22:25:10.537321,2025-04-24 22:25:13.764882,0 days 00:00:03.227561,0.04646019105971188,3,sqrt,6,17,1113,0.8920962235816107,TPESampler,COMPLETE
2496,0.29105937319622655,2025-04-24 22:25:11.536319,2025-04-24 22:25:15.140442,0 days 00:00:03.604123,0.08747052426122373,8,sqrt,2,18,1039,0.6034325865043842,TPESampler,COMPLETE
2497,0.4860387597886859,2025-04-24 22:25:12.277190,2025-04-24 22:25:15.359353,0 days 00:00:03.082163,0.02557166369334335,8,sqrt,8,3,1294,0.6176100247303598,TPESampler,COMPLETE
2498,0.25491091972220753,2025-04-24 22:25:14.006646,2025-04-24 22:25:17.124979,0 days 00:00:03.118333,0.09663914288072593,6,sqrt,1,16,1204,0.6820799716567632,TPESampler,COMPLETE
2499,0.28010296896661496,2025-04-24 22:25:15.394783,2025-04-24 22:25:17.750770,0 days 00:00:02.355987,0.04315582720987897,9,log2,1,16,1482,0.6334238008968073,TPESampler,COMPLETE
