number,value,datetime_start,datetime_complete,duration,params_learning_rate,params_max_depth,params_max_features,params_min_samples_leaf,params_min_samples_split,params_n_estimators,params_subsample,system_attrs_auto:sampler,state
1112,0.26591934788667365,2025-04-24 21:56:38.068058,2025-04-24 21:56:41.891255,0 days 00:00:03.823197,0.06714213445604113,5,sqrt,1,17,1444,0.6825786186847902,TPESampler,COMPLETE
1113,0.2327441720050542,2025-04-24 21:56:39.502556,2025-04-24 21:56:43.192063,0 days 00:00:03.689507,0.08974502375494989,8,sqrt,1,20,1211,0.6444861848880957,TPESampler,COMPLETE
1114,0.2897876344038961,2025-04-24 21:56:41.211115,2025-04-24 21:56:45.412898,0 days 00:00:04.201783,0.09746657040200102,10,sqrt,1,19,1415,0.7053297969254377,TPESampler,COMPLETE
1115,0.3129305796824434,2025-04-24 21:56:42.112101,2025-04-24 21:56:44.798527,0 days 00:00:02.686426,0.09272239540663423,9,sqrt,2,18,828,0.6010217496183077,TPESampler,COMPLETE
1116,0.2722976000838915,2025-04-24 21:56:43.399748,2025-04-24 21:56:46.717391,0 days 00:00:03.317643,0.0945793758933015,9,sqrt,1,19,1253,0.6285968883174499,TPESampler,COMPLETE
1117,0.26433147194201584,2025-04-24 21:56:44.996048,2025-04-24 21:56:47.878155,0 days 00:00:02.882107,0.05916853231605676,12,sqrt,1,20,1222,0.6137216998862447,TPESampler,COMPLETE
1118,0.4709766419611889,2025-04-24 21:56:45.618083,2025-04-24 21:56:46.667321,0 days 00:00:01.049238,0.02832066488078082,3,,9,10,140,0.8037546330603832,TPESampler,COMPLETE
1119,0.3084444243110409,2025-04-24 21:56:46.833460,2025-04-24 21:56:50.224453,0 days 00:00:03.390993,0.06411365086144952,8,,3,3,798,0.663405596708375,TPESampler,COMPLETE
1120,0.311244778031218,2025-04-24 21:56:46.884816,2025-04-24 21:56:52.380573,0 days 00:00:05.495757,0.014012100397509355,7,,3,5,1310,0.7045583875987624,TPESampler,COMPLETE
1121,0.22334751563577404,2025-04-24 21:56:48.063604,2025-04-24 21:56:50.958754,0 days 00:00:02.895150,0.06698647539782754,8,sqrt,1,20,1357,0.6093015080960614,TPESampler,COMPLETE
1122,0.23609461968295248,2025-04-24 21:56:50.417602,2025-04-24 21:56:53.136617,0 days 00:00:02.719015,0.06985537148518929,6,sqrt,1,19,1057,0.8021941719753116,TPESampler,COMPLETE
1123,0.29922944293133863,2025-04-24 21:56:51.306376,2025-04-24 21:56:54.576445,0 days 00:00:03.270069,0.06772827932018037,8,sqrt,1,19,1330,0.618414092952914,TPESampler,COMPLETE
1124,0.6928658674849341,2025-04-24 21:56:52.606951,2025-04-24 21:56:55.275658,0 days 00:00:02.668707,0.045689734093198306,12,log2,7,7,1242,0.6307038195392685,TPESampler,COMPLETE
1125,0.4896854855768113,2025-04-24 21:56:53.344721,2025-04-24 21:56:54.494657,0 days 00:00:01.149936,0.03262086039501269,6,sqrt,2,9,260,0.8758915638577367,TPESampler,COMPLETE
1126,0.38754459095598576,2025-04-24 21:56:54.641777,2025-04-24 21:57:02.119483,0 days 00:00:07.477706,0.09280073727757347,12,,2,16,1174,0.8592959523802666,TPESampler,COMPLETE
1127,1.1654332587817597,2025-04-24 21:56:54.756428,2025-04-24 21:56:55.835813,0 days 00:00:01.079385,0.01170598942274014,5,sqrt,9,10,157,0.9041990293842292,TPESampler,COMPLETE
1128,0.28500505947658217,2025-04-24 21:56:55.497673,2025-04-24 21:56:58.556893,0 days 00:00:03.059220,0.09004862904609218,10,sqrt,1,18,1333,0.636617720162444,TPESampler,COMPLETE
1129,0.2654340095065155,2025-04-24 21:56:56.008240,2025-04-24 21:56:58.880143,0 days 00:00:02.871903,0.06522888861852061,8,sqrt,1,18,1259,0.64586827614435,TPESampler,COMPLETE
1130,0.28398294187196915,2025-04-24 21:56:58.751850,2025-04-24 21:57:01.337871,0 days 00:00:02.586021,0.06873127819672731,8,sqrt,1,20,1307,0.6313782824547443,TPESampler,COMPLETE
1131,0.4007645962584762,2025-04-24 21:56:59.109744,2025-04-24 21:57:00.096070,0 days 00:00:00.986326,0.07826490708433538,7,sqrt,5,20,167,0.7959811836834972,TPESampler,COMPLETE
1132,0.3089248221756052,2025-04-24 21:57:00.295473,2025-04-24 21:57:02.916175,0 days 00:00:02.620702,0.06971914118019196,8,sqrt,2,17,1089,0.620333964783744,TPESampler,COMPLETE
1133,0.29852833007104596,2025-04-24 21:57:01.530118,2025-04-24 21:57:03.908029,0 days 00:00:02.377911,0.07316822853769742,10,sqrt,2,2,955,0.9642903980030052,TPESampler,COMPLETE
1134,0.4597603006234624,2025-04-24 21:57:02.325569,2025-04-24 21:57:06.959323,0 days 00:00:04.633754,0.0990236540034237,8,,10,13,936,0.8574102580134415,TPESampler,COMPLETE
1135,0.30162058674260916,2025-04-24 21:57:03.163710,2025-04-24 21:57:06.689775,0 days 00:00:03.526065,0.05878640123706357,3,,1,7,1041,0.7648217407774591,TPESampler,COMPLETE
1136,0.2752370449699293,2025-04-24 21:57:04.092211,2025-04-24 21:57:06.630876,0 days 00:00:02.538665,0.09780468192385705,7,sqrt,2,19,1189,0.7323959492018003,TPESampler,COMPLETE
1137,1.2685009439159738,2025-04-24 21:57:06.787800,2025-04-24 21:57:07.948783,0 days 00:00:01.160983,0.015176721235537914,7,log2,6,15,174,0.9195517204984798,TPESampler,COMPLETE
1138,0.3734128512163539,2025-04-24 21:57:06.852791,2025-04-24 21:57:14.184460,0 days 00:00:07.331669,0.010672964723938291,11,,7,9,1357,0.8000744910007932,TPESampler,COMPLETE
1139,0.27613159842921486,2025-04-24 21:57:07.218651,2025-04-24 21:57:10.135264,0 days 00:00:02.916613,0.07702047219622853,9,sqrt,3,19,1334,0.6061224194709218,TPESampler,COMPLETE
1140,0.29864305738257774,2025-04-24 21:57:08.145917,2025-04-24 21:57:11.037766,0 days 00:00:02.891849,0.05375441794840301,8,sqrt,2,20,1309,0.6120675959991229,TPESampler,COMPLETE
1141,0.3142777982522711,2025-04-24 21:57:10.434018,2025-04-24 21:57:12.293226,0 days 00:00:01.859208,0.05134883963998059,9,sqrt,4,20,1059,0.6404370826901196,TPESampler,COMPLETE
1142,0.2811030011673693,2025-04-24 21:57:11.366807,2025-04-24 21:57:13.519451,0 days 00:00:02.152644,0.04991066449463589,6,sqrt,1,19,762,0.6215925947603876,TPESampler,COMPLETE
1143,0.32530225379002004,2025-04-24 21:57:12.567988,2025-04-24 21:57:15.283217,0 days 00:00:02.715229,0.08078911403452914,8,sqrt,3,17,1201,0.6549315450992317,TPESampler,COMPLETE
1144,0.259933903604351,2025-04-24 21:57:13.723782,2025-04-24 21:57:17.701801,0 days 00:00:03.978019,0.09500669594134525,7,sqrt,1,16,1495,0.7540177703477503,TPESampler,COMPLETE
1145,0.26772448931317694,2025-04-24 21:57:14.445928,2025-04-24 21:57:17.877991,0 days 00:00:03.432063,0.06182900251498278,10,sqrt,1,18,1255,0.6871790955100452,TPESampler,COMPLETE
1146,0.27433481132298654,2025-04-24 21:57:15.444933,2025-04-24 21:57:18.500377,0 days 00:00:03.055444,0.09028820786842383,8,sqrt,1,16,1250,0.6498101487126061,TPESampler,COMPLETE
1147,0.26605484205714414,2025-04-24 21:57:17.855455,2025-04-24 21:57:20.963648,0 days 00:00:03.108193,0.09531948893442078,8,sqrt,1,20,1357,0.6040789322011962,TPESampler,COMPLETE
1148,0.26829093734585535,2025-04-24 21:57:18.068960,2025-04-24 21:57:20.732612,0 days 00:00:02.663652,0.05670508227964932,8,sqrt,1,20,995,0.6553721334624464,TPESampler,COMPLETE
1149,0.237383011299155,2025-04-24 21:57:18.702664,2025-04-24 21:57:21.444321,0 days 00:00:02.741657,0.07468977880491695,7,sqrt,1,20,1162,0.6047341033432652,TPESampler,COMPLETE
1150,0.28263594808328246,2025-04-24 21:57:20.902871,2025-04-24 21:57:23.672141,0 days 00:00:02.769270,0.09959900528453328,8,sqrt,1,19,980,0.6411108705793831,TPESampler,COMPLETE
1151,0.3417688286452627,2025-04-24 21:57:21.210744,2025-04-24 21:57:24.245097,0 days 00:00:03.034353,0.01464327672710173,12,sqrt,4,8,1091,0.6099722621851396,TPESampler,COMPLETE
1152,0.28796566199195245,2025-04-24 21:57:21.679691,2025-04-24 21:57:24.488734,0 days 00:00:02.809043,0.09617015883166684,8,sqrt,3,17,1037,0.6065332890373776,TPESampler,COMPLETE
1153,0.3324493607785618,2025-04-24 21:57:23.843769,2025-04-24 21:57:25.317028,0 days 00:00:01.473259,0.042629405054589224,4,,1,18,249,0.6726092950662645,TPESampler,COMPLETE
1154,0.2733633568973443,2025-04-24 21:57:24.416638,2025-04-24 21:57:30.385430,0 days 00:00:05.968792,0.0621456185964158,5,,1,20,1478,0.7737391611935094,TPESampler,COMPLETE
1155,0.35591749923824206,2025-04-24 21:57:24.663707,2025-04-24 21:57:26.446935,0 days 00:00:01.783228,0.09807456414714656,10,sqrt,1,20,653,0.7050872090420784,TPESampler,COMPLETE
1156,0.2972841330653754,2025-04-24 21:57:25.535148,2025-04-24 21:57:27.996166,0 days 00:00:02.461018,0.07118840153555188,6,log2,1,18,1093,0.6817681673818166,TPESampler,COMPLETE
1157,0.2765330668351617,2025-04-24 21:57:26.646415,2025-04-24 21:57:30.112711,0 days 00:00:03.466296,0.09876580471714794,9,sqrt,1,20,1328,0.6326229854518883,TPESampler,COMPLETE
1158,0.3040705488212476,2025-04-24 21:57:28.174384,2025-04-24 21:57:31.119674,0 days 00:00:02.945290,0.098395780944024,7,sqrt,2,19,1187,0.623314726758268,TPESampler,COMPLETE
1159,0.2629032475839794,2025-04-24 21:57:30.305980,2025-04-24 21:57:34.194004,0 days 00:00:03.888024,0.07575238934392543,9,sqrt,1,20,1422,0.6972531034036551,TPESampler,COMPLETE
1160,0.7680372642328285,2025-04-24 21:57:30.631014,2025-04-24 21:57:33.630492,0 days 00:00:02.999478,0.013334902294011932,3,log2,2,9,1187,0.9723749910505217,TPESampler,COMPLETE
1161,0.2617077433463251,2025-04-24 21:57:31.336010,2025-04-24 21:57:34.637037,0 days 00:00:03.301027,0.09780910437207885,6,sqrt,1,20,1182,0.7497793311023049,TPESampler,COMPLETE
1162,0.40175787949752423,2025-04-24 21:57:33.808197,2025-04-24 21:57:37.281266,0 days 00:00:03.473069,0.033162024944387455,3,,9,15,1048,0.9945643881075821,TPESampler,COMPLETE
1163,0.41684852732521205,2025-04-24 21:57:34.358326,2025-04-24 21:57:35.930636,0 days 00:00:01.572310,0.030866592948587377,5,,9,18,318,0.8730789587158356,TPESampler,COMPLETE
1164,0.31993024586391094,2025-04-24 21:57:34.809781,2025-04-24 21:57:41.364844,0 days 00:00:06.555063,0.06098714293853843,11,,3,18,1261,0.7219951437728214,TPESampler,COMPLETE
1165,0.28240223880080645,2025-04-24 21:57:36.123078,2025-04-24 21:57:39.034120,0 days 00:00:02.911042,0.09787322403230367,7,sqrt,1,17,1318,0.7197155898172446,TPESampler,COMPLETE
1166,0.31697596765820807,2025-04-24 21:57:37.470316,2025-04-24 21:57:39.885654,0 days 00:00:02.415338,0.03470691292920334,4,sqrt,1,17,1165,0.8836366312908874,TPESampler,COMPLETE
1167,0.309471677153237,2025-04-24 21:57:39.230270,2025-04-24 21:57:42.334202,0 days 00:00:03.103932,0.06226187502734042,6,sqrt,2,20,1213,0.6712040024889111,TPESampler,COMPLETE
1168,0.28749897607969255,2025-04-24 21:57:40.089320,2025-04-24 21:57:43.136644,0 days 00:00:03.047324,0.09231713271726462,9,sqrt,1,14,1102,0.6198327948425543,TPESampler,COMPLETE
1169,0.22752435644948252,2025-04-24 21:57:41.564339,2025-04-24 21:57:45.315602,0 days 00:00:03.751263,0.09306742301796163,5,sqrt,1,18,1413,0.7195714075088085,TPESampler,COMPLETE
1170,0.33512153302432873,2025-04-24 21:57:42.584231,2025-04-24 21:57:46.207987,0 days 00:00:03.623756,0.09361510792914547,9,sqrt,2,20,1497,0.6824733101786521,TPESampler,COMPLETE
1171,1.1827947339367328,2025-04-24 21:57:43.322579,2025-04-24 21:57:45.383618,0 days 00:00:02.061039,0.010847403724533458,11,log2,10,9,542,0.8664074901554275,TPESampler,COMPLETE
1172,0.25372537148063207,2025-04-24 21:57:45.483895,2025-04-24 21:57:49.405968,0 days 00:00:03.922073,0.0816838910653619,4,sqrt,1,19,1408,0.7358973617440664,TPESampler,COMPLETE
1173,0.29407743791798546,2025-04-24 21:57:45.640583,2025-04-24 21:57:50.058031,0 days 00:00:04.417448,0.08786919353200312,5,sqrt,2,16,1321,0.786993121205342,TPESampler,COMPLETE
1174,0.24860734725881659,2025-04-24 21:57:46.925249,2025-04-24 21:57:50.687731,0 days 00:00:03.762482,0.08689096217308986,3,sqrt,1,20,1189,0.8299696567527169,TPESampler,COMPLETE
1175,0.25208130642672316,2025-04-24 21:57:49.663026,2025-04-24 21:57:52.390213,0 days 00:00:02.727187,0.08749663011330906,8,sqrt,1,19,1219,0.744946378178666,TPESampler,COMPLETE
1176,0.6675688755206435,2025-04-24 21:57:50.331388,2025-04-24 21:57:52.799320,0 days 00:00:02.467932,0.013907450179761485,4,sqrt,5,9,700,0.740295546480188,TPESampler,COMPLETE
1177,0.3044105839549375,2025-04-24 21:57:51.356488,2025-04-24 21:57:54.141623,0 days 00:00:02.785135,0.03640582147494139,8,sqrt,1,20,1122,0.6149421967111584,TPESampler,COMPLETE
1178,0.35436206991745567,2025-04-24 21:57:52.696770,2025-04-24 21:57:56.172443,0 days 00:00:03.475673,0.012429983271925038,6,,1,8,790,0.6910459888919382,TPESampler,COMPLETE
1179,0.2950150010908242,2025-04-24 21:57:53.100291,2025-04-24 21:57:55.920511,0 days 00:00:02.820220,0.08158107098946922,4,sqrt,1,17,1288,0.6987303031060033,TPESampler,COMPLETE
1180,0.2642174061814084,2025-04-24 21:57:54.437891,2025-04-24 21:58:00.525060,0 days 00:00:06.087169,0.09373508128772821,8,,1,17,1422,0.6150572333528791,TPESampler,COMPLETE
1181,0.2882341656829679,2025-04-24 21:57:56.250310,2025-04-24 21:58:00.015612,0 days 00:00:03.765302,0.09376788576742888,10,sqrt,1,19,1444,0.6052704828326961,TPESampler,COMPLETE
1182,0.2859439138030134,2025-04-24 21:57:56.380029,2025-04-24 21:57:59.834692,0 days 00:00:03.454663,0.08646865601205836,5,sqrt,3,19,1275,0.7501355584833831,TPESampler,COMPLETE
1183,0.24845807900320374,2025-04-24 21:58:00.013834,2025-04-24 21:58:04.284518,0 days 00:00:04.270684,0.04566932985070856,7,sqrt,1,17,1492,0.7958646957198238,TPESampler,COMPLETE
1184,0.3008794043045153,2025-04-24 21:58:00.234814,2025-04-24 21:58:04.458090,0 days 00:00:04.223276,0.09993230963180917,4,sqrt,1,12,1491,0.6225912921937062,TPESampler,COMPLETE
1185,0.3453221870164094,2025-04-24 21:58:00.818743,2025-04-24 21:58:05.170659,0 days 00:00:04.351916,0.09556554680055267,4,sqrt,1,15,1484,0.6824446538783195,TPESampler,COMPLETE
1186,0.4382478586476407,2025-04-24 21:58:04.466083,2025-04-24 21:58:06.199580,0 days 00:00:01.733497,0.09384592621691,5,,9,11,236,0.7227039582514828,TPESampler,COMPLETE
1187,0.26374910775353944,2025-04-24 21:58:04.647768,2025-04-24 21:58:07.494076,0 days 00:00:02.846308,0.061257243621285686,7,sqrt,1,15,1224,0.6964119371077484,TPESampler,COMPLETE
1188,0.3039331627367074,2025-04-24 21:58:05.402794,2025-04-24 21:58:09.296825,0 days 00:00:03.894031,0.06132311323262874,8,sqrt,2,12,1459,0.6084294471762739,TPESampler,COMPLETE
1189,0.55389697414106,2025-04-24 21:58:06.471011,2025-04-24 21:58:08.437291,0 days 00:00:01.966280,0.09960020730683754,7,sqrt,10,6,661,0.620843990735441,TPESampler,COMPLETE
1190,0.4453980922945964,2025-04-24 21:58:07.697184,2025-04-24 21:58:09.913588,0 days 00:00:02.216404,0.010041132910576603,5,,9,20,373,0.891925876015317,TPESampler,COMPLETE
1191,1.2335550165573674,2025-04-24 21:58:08.649910,2025-04-24 21:58:09.534876,0 days 00:00:00.884966,0.025212763448853513,4,log2,5,20,117,0.8459194406807738,TPESampler,COMPLETE
1192,0.2798913602475162,2025-04-24 21:58:09.498353,2025-04-24 21:58:13.174206,0 days 00:00:03.675853,0.05170064617102369,10,sqrt,1,16,1257,0.6798548489511822,TPESampler,COMPLETE
1193,0.24869505421531557,2025-04-24 21:58:09.863586,2025-04-24 21:58:13.413680,0 days 00:00:03.550094,0.0907382697903668,5,sqrt,1,16,1301,0.7467062588701273,TPESampler,COMPLETE
1194,0.2891811760774392,2025-04-24 21:58:10.243671,2025-04-24 21:58:13.814200,0 days 00:00:03.570529,0.08311127967624052,6,sqrt,1,18,1357,0.6897731935802471,TPESampler,COMPLETE
1195,0.4558076609766394,2025-04-24 21:58:13.425247,2025-04-24 21:58:16.835248,0 days 00:00:03.410001,0.013111162140497547,6,,10,17,857,0.8122195478176364,TPESampler,COMPLETE
1196,0.3562283787613365,2025-04-24 21:58:13.688275,2025-04-24 21:58:17.689120,0 days 00:00:04.000845,0.08828086882873773,6,,7,18,993,0.7971608468851269,TPESampler,COMPLETE
1197,0.2751548461035633,2025-04-24 21:58:14.083966,2025-04-24 21:58:16.809037,0 days 00:00:02.725071,0.08786905502101368,6,sqrt,3,12,1355,0.682549843227346,TPESampler,COMPLETE
1198,0.295440684280853,2025-04-24 21:58:16.935092,2025-04-24 21:58:20.049910,0 days 00:00:03.114818,0.06855619766330424,7,sqrt,1,20,1268,0.725755730479256,TPESampler,COMPLETE
1199,0.3158223017549407,2025-04-24 21:58:16.947910,2025-04-24 21:58:19.761138,0 days 00:00:02.813228,0.08434264826355191,9,log2,2,18,1070,0.6159779548031724,TPESampler,COMPLETE
1200,0.3580924924328288,2025-04-24 21:58:17.880811,2025-04-24 21:58:20.761378,0 days 00:00:02.880567,0.026364753703448818,7,,2,15,630,0.6010542991666162,TPESampler,COMPLETE
1201,0.29541521586099045,2025-04-24 21:58:19.992956,2025-04-24 21:58:24.049607,0 days 00:00:04.056651,0.09689201716258172,5,sqrt,2,16,1477,0.6645245524492974,TPESampler,COMPLETE
1202,0.4286574900913517,2025-04-24 21:58:20.378189,2025-04-24 21:58:22.856304,0 days 00:00:02.478115,0.03145214369777643,7,sqrt,6,20,629,0.6449253782510385,TPESampler,COMPLETE
1203,0.27081545709694105,2025-04-24 21:58:21.012763,2025-04-24 21:58:24.934559,0 days 00:00:03.921796,0.06806637310910657,7,sqrt,1,12,1353,0.6045845879791168,TPESampler,COMPLETE
1204,0.33173885237899964,2025-04-24 21:58:23.060885,2025-04-24 21:58:27.145689,0 days 00:00:04.084804,0.08172367054972876,5,sqrt,1,17,1490,0.7438859612460454,TPESampler,COMPLETE
1205,0.29940413493597656,2025-04-24 21:58:24.269122,2025-04-24 21:58:27.780852,0 days 00:00:03.511730,0.09920591753354556,5,log2,2,20,1355,0.695056512219414,TPESampler,COMPLETE
1206,0.2844084871837891,2025-04-24 21:58:25.148738,2025-04-24 21:58:33.022286,0 days 00:00:07.873548,0.05259319266924181,11,,1,13,1450,0.6938785438666923,TPESampler,COMPLETE
1207,0.3246550064301229,2025-04-24 21:58:27.337069,2025-04-24 21:58:29.671688,0 days 00:00:02.334619,0.05778412968024319,12,log2,3,7,1147,0.7395523905127859,TPESampler,COMPLETE
1208,0.2571100467926581,2025-04-24 21:58:28.006669,2025-04-24 21:58:31.348842,0 days 00:00:03.342173,0.07012268248400662,8,sqrt,1,20,1452,0.6084301259766898,TPESampler,COMPLETE
1209,0.2921118320578955,2025-04-24 21:58:29.907999,2025-04-24 21:58:34.653970,0 days 00:00:04.745971,0.08880579996637811,3,,3,14,1458,0.7336312339381287,TPESampler,COMPLETE
1210,0.3211217069661352,2025-04-24 21:58:31.544416,2025-04-24 21:58:34.943734,0 days 00:00:03.399318,0.09611325136629746,6,sqrt,2,14,1493,0.6829563493396452,TPESampler,COMPLETE
1211,0.277392419701671,2025-04-24 21:58:33.222325,2025-04-24 21:58:36.745678,0 days 00:00:03.523353,0.04433368338686411,8,sqrt,3,20,1410,0.6600282677322891,TPESampler,COMPLETE
1212,0.257230568165959,2025-04-24 21:58:34.854885,2025-04-24 21:58:39.883771,0 days 00:00:05.028886,0.09574508618876917,8,,1,19,1104,0.616437141991328,TPESampler,COMPLETE
1213,0.2662828755339538,2025-04-24 21:58:35.216036,2025-04-24 21:58:38.419203,0 days 00:00:03.203167,0.09830059802792496,5,sqrt,1,13,1369,0.8409900703980311,TPESampler,COMPLETE
1214,0.2849984152616223,2025-04-24 21:58:36.928095,2025-04-24 21:58:39.394155,0 days 00:00:02.466060,0.07761950841534197,4,sqrt,3,14,1109,0.6045540246112292,TPESampler,COMPLETE
1215,0.3024266062017981,2025-04-24 21:58:38.623048,2025-04-24 21:58:41.879723,0 days 00:00:03.256675,0.09634342093913213,7,sqrt,3,17,1377,0.6111778466202841,TPESampler,COMPLETE
1216,0.3225948866616447,2025-04-24 21:58:39.657229,2025-04-24 21:58:43.747102,0 days 00:00:04.089873,0.02540999759136699,3,,4,2,1027,0.99112797544583,TPESampler,COMPLETE
1217,0.3013441093863823,2025-04-24 21:58:40.113115,2025-04-24 21:58:43.488867,0 days 00:00:03.375752,0.09726843255461687,5,sqrt,2,20,1416,0.6568915399655679,TPESampler,COMPLETE
1218,0.29465762660796796,2025-04-24 21:58:42.084246,2025-04-24 21:58:46.056160,0 days 00:00:03.971914,0.06492315916522873,9,sqrt,2,17,1493,0.627006118112299,TPESampler,COMPLETE
1219,0.3055999992195814,2025-04-24 21:58:43.697763,2025-04-24 21:58:47.478243,0 days 00:00:03.780480,0.09920049285567659,5,sqrt,2,19,1421,0.6833246734916698,TPESampler,COMPLETE
1220,0.5631081399082603,2025-04-24 21:58:44.015022,2025-04-24 21:58:46.233914,0 days 00:00:02.218892,0.08466345354719046,5,log2,10,2,672,0.9566598885846379,TPESampler,COMPLETE
1221,0.2864951171930897,2025-04-24 21:58:46.235307,2025-04-24 21:58:50.275634,0 days 00:00:04.040327,0.0776095226613361,6,sqrt,2,20,1408,0.7823442405530805,TPESampler,COMPLETE
1222,0.2899081563780879,2025-04-24 21:58:46.459159,2025-04-24 21:58:50.812975,0 days 00:00:04.353816,0.09761037170850019,6,sqrt,2,18,1488,0.7323357131395927,TPESampler,COMPLETE
1223,0.34251456976483874,2025-04-24 21:58:47.681815,2025-04-24 21:58:51.783106,0 days 00:00:04.101291,0.0988039985287048,9,sqrt,2,15,1487,0.6034393995695421,TPESampler,COMPLETE
1224,0.23729037136798153,2025-04-24 21:58:50.481846,2025-04-24 21:58:53.953172,0 days 00:00:03.471326,0.09468202619051456,6,sqrt,1,17,1350,0.6048019691437089,TPESampler,COMPLETE
1225,0.27995010840694756,2025-04-24 21:58:51.076205,2025-04-24 21:58:54.538829,0 days 00:00:03.462624,0.06412577879646697,9,sqrt,1,19,1098,0.6899666588713355,TPESampler,COMPLETE
1226,0.2632586620695076,2025-04-24 21:58:52.019672,2025-04-24 21:58:55.347592,0 days 00:00:03.327920,0.09962751903432161,7,sqrt,1,17,1146,0.7012635276480854,TPESampler,COMPLETE
1227,0.2800829317520887,2025-04-24 21:58:54.141747,2025-04-24 21:58:57.964947,0 days 00:00:03.823200,0.09000350430459494,6,sqrt,1,16,1456,0.6138105780316575,TPESampler,COMPLETE
1228,0.3331404948338962,2025-04-24 21:58:54.737628,2025-04-24 21:58:58.049634,0 days 00:00:03.312006,0.09331421358298218,7,sqrt,3,20,1149,0.650115622882618,TPESampler,COMPLETE
1229,0.8724902179931695,2025-04-24 21:58:55.562670,2025-04-24 21:58:57.404035,0 days 00:00:01.841365,0.03462548481398211,7,log2,7,11,479,0.9514282162556074,TPESampler,COMPLETE
1230,0.24144758677311462,2025-04-24 21:58:57.611574,2025-04-24 21:59:00.628783,0 days 00:00:03.017209,0.08618031240758653,7,sqrt,1,20,1424,0.6744827378819673,TPESampler,COMPLETE
1231,0.22895653077900976,2025-04-24 21:58:58.229257,2025-04-24 21:59:01.495621,0 days 00:00:03.266364,0.09411696688068687,4,sqrt,1,14,1255,0.7692265687337666,TPESampler,COMPLETE
1232,0.32902300822026503,2025-04-24 21:58:58.278879,2025-04-24 21:59:02.403104,0 days 00:00:04.124225,0.039588039089212594,8,,3,20,670,0.7683377168515704,TPESampler,COMPLETE
1233,0.5206324291792579,2025-04-24 21:59:00.855105,2025-04-24 21:59:02.136213,0 days 00:00:01.281108,0.04969475335877174,3,sqrt,7,13,341,0.8298344146736168,TPESampler,COMPLETE
1234,0.7267752334266361,2025-04-24 21:59:01.711269,2025-04-24 21:59:03.338899,0 days 00:00:01.627630,0.012857827952652683,11,sqrt,9,16,602,0.8680464747038734,TPESampler,COMPLETE
