number,value,datetime_start,datetime_complete,duration,params_constant_value,params_kernel_type,params_length_scale,params_noise_level,params_nu,system_attrs_auto:sampler,state
228,0.949431780480232,2025-04-24 21:01:48.672095,2025-04-24 21:01:50.204335,0 days 00:00:01.532240,29.83482068198481,Matern,2.5540973563992274e-05,1.4358698245471653e-10,1.5,TPESampler,COMPLETE
229,0.3026845951711528,2025-04-24 21:01:49.650891,2025-04-24 21:01:51.414243,0 days 00:00:01.763352,3.4890125808100523,RBF,1.1134482814541393,0.9786689048598998,1.5,TPESampler,COMPLETE
230,0.9228200975323504,2025-04-24 21:01:50.550560,2025-04-24 21:01:51.809998,0 days 00:00:01.259438,0.557877473073854,RBF,7.690819642307022e-05,0.015682709742150226,1.5,TPESampler,COMPLETE
231,0.30268458505935,2025-04-24 21:01:50.711538,2025-04-24 21:01:54.276097,0 days 00:00:03.564559,2.9319574477898162e-06,RBF,0.28858465081451307,6.082974635204248e-06,0.5,TPESampler,COMPLETE
232,0.9494317743134839,2025-04-24 21:01:51.643000,2025-04-24 21:01:52.730189,0 days 00:00:01.087189,31093.48371193568,Matern,0.18061209811374468,0.02374746952449155,1.5,TPESampler,COMPLETE
233,0.9228200908815335,2025-04-24 21:01:52.007900,2025-04-24 21:01:53.707664,0 days 00:00:01.699764,10149.129948972968,Matern,0.07514604619486644,0.005754831981240776,1.5,TPESampler,COMPLETE
234,0.2867972499248499,2025-04-24 21:01:52.955843,2025-04-24 21:01:54.561902,0 days 00:00:01.606059,6316.406102483953,Matern,1.1534185769257528,0.25126810553658535,1.5,TPESampler,COMPLETE
235,0.9228200921803871,2025-04-24 21:01:53.923252,2025-04-24 21:01:57.182598,0 days 00:00:03.259346,0.0006370246252299587,Matern,873.9147286760091,0.00010303033437339732,1.5,TPESampler,COMPLETE
236,0.9228200398592177,2025-04-24 21:01:54.496965,2025-04-24 21:01:55.924302,0 days 00:00:01.427337,0.46509508596926036,Matern,8.046545427911813,0.002178435992046243,1.5,TPESampler,COMPLETE
237,0.9228201006858152,2025-04-24 21:01:54.797278,2025-04-24 21:01:56.204889,0 days 00:00:01.407611,17347.77089606636,Matern,0.07102111299078251,0.5395421006917194,1.5,TPESampler,COMPLETE
238,0.9494322793417138,2025-04-24 21:01:56.153679,2025-04-24 21:01:57.596113,0 days 00:00:01.442434,99.10906079473499,Matern,3.09565149238702,0.03529786530255276,1.5,TPESampler,COMPLETE
239,0.28679725275799944,2025-04-24 21:01:56.732784,2025-04-24 21:01:58.456919,0 days 00:00:01.724135,43001.40854963837,Matern,0.7104157599805141,0.14717344767371587,1.5,TPESampler,COMPLETE
240,0.2867971807398829,2025-04-24 21:01:57.549349,2025-04-24 21:02:02.127059,0 days 00:00:04.577710,128.09411245158464,Matern,29361.3059713075,0.4268860729200571,1.5,TPESampler,COMPLETE
241,0.2867972434346267,2025-04-24 21:01:57.866915,2025-04-24 21:02:00.198224,0 days 00:00:02.331309,57.6376313233372,Matern,4.877333778524755,0.0015627307106810514,1.5,TPESampler,COMPLETE
242,0.9228200895819336,2025-04-24 21:01:58.682564,2025-04-24 21:02:01.807966,0 days 00:00:03.125402,0.000466920886156189,Matern,0.06149509072722734,0.14047628334800025,1.5,TPESampler,COMPLETE
243,0.3026845488439101,2025-04-24 21:02:00.428420,2025-04-24 21:02:05.083671,0 days 00:00:04.655251,4.909964857969605e-07,RBF,2.083712128539496,0.1461602379095485,2.5,TPESampler,COMPLETE
244,0.28679725317644217,2025-04-24 21:02:02.026080,2025-04-24 21:02:04.131240,0 days 00:00:02.105160,11138.713436176247,Matern,38388.955397036145,0.2422085498404612,1.5,TPESampler,COMPLETE
245,0.922820092275799,2025-04-24 21:02:02.333298,2025-04-24 21:02:04.320841,0 days 00:00:01.987543,128.63680096708336,Matern,13137.34241728076,0.018780857758048726,1.5,TPESampler,COMPLETE
246,0.9228200924428038,2025-04-24 21:02:04.324650,2025-04-24 21:02:06.283154,0 days 00:00:01.958504,0.0002683104564254336,Matern,12.851422353739993,1.5687488044784067e-09,1.5,TPESampler,COMPLETE
247,0.9494322792708472,2025-04-24 21:02:04.537973,2025-04-24 21:02:06.320369,0 days 00:00:01.782396,345.37126461072046,Matern,90265.33885653185,0.33640203439110394,1.5,TPESampler,COMPLETE
248,0.9228201077240035,2025-04-24 21:02:05.382173,2025-04-24 21:02:07.254521,0 days 00:00:01.872348,0.009728168217298149,RBF,0.0009119200786106577,2.4807692051541423e-08,1.5,TPESampler,COMPLETE
249,0.9494322778530696,2025-04-24 21:02:06.488278,2025-04-24 21:02:08.479264,0 days 00:00:01.990986,0.07956383322366949,Matern,4599.240109397341,0.11679381526177894,1.5,TPESampler,COMPLETE
250,0.28679731529086255,2025-04-24 21:02:06.654205,2025-04-24 21:02:08.379254,0 days 00:00:01.725049,4.393165022127933,Matern,7.171381282848496,0.0014750252016305341,1.5,TPESampler,COMPLETE
251,0.28679725291756686,2025-04-24 21:02:07.503421,2025-04-24 21:02:09.318375,0 days 00:00:01.814954,172.1146519435405,Matern,1.2269290459207667,0.00028964962423851115,1.5,TPESampler,COMPLETE
252,0.2867972537576733,2025-04-24 21:02:08.546258,2025-04-24 21:02:10.801628,0 days 00:00:02.255370,89.95592544111878,Matern,410.2748993957247,0.4913215514256127,1.5,TPESampler,COMPLETE
253,0.28679724978774257,2025-04-24 21:02:08.660437,2025-04-24 21:02:10.605656,0 days 00:00:01.945219,13.797629103060155,Matern,1.3316227196702624,0.002663001248706217,1.5,TPESampler,COMPLETE
254,0.9494322789061609,2025-04-24 21:02:09.613482,2025-04-24 21:02:10.700286,0 days 00:00:01.086804,1401.2827195044947,Matern,8.8505573566267,2.735647321455346e-07,1.5,TPESampler,COMPLETE
255,0.33018883114696934,2025-04-24 21:02:10.753846,2025-04-24 21:02:12.879260,0 days 00:00:02.125414,71.03981396267199,Matern,1.5647847502111536,0.001697648432791285,0.5,TPESampler,COMPLETE
256,0.9228201044709142,2025-04-24 21:02:10.893096,2025-04-24 21:02:12.535635,0 days 00:00:01.642539,551.0720449699469,Matern,149.2161273538932,0.0006782434852025022,1.5,TPESampler,COMPLETE
257,0.94943227931179,2025-04-24 21:02:11.029754,2025-04-24 21:02:12.917117,0 days 00:00:01.887363,60.240290898590665,Matern,52868.0655754576,0.7356690322101357,1.5,TPESampler,COMPLETE
258,0.9228200930246961,2025-04-24 21:02:12.768276,2025-04-24 21:02:15.976311,0 days 00:00:03.208035,0.00024811789149715367,Matern,13764.390584856512,2.0461783914353726e-07,0.5,TPESampler,COMPLETE
259,0.2867972485969443,2025-04-24 21:02:13.052373,2025-04-24 21:02:15.276537,0 days 00:00:02.224164,0.5711770849974571,Matern,0.19255263420289923,0.014091889419071036,1.5,TPESampler,COMPLETE
260,0.9228200928652908,2025-04-24 21:02:13.146298,2025-04-24 21:02:15.581203,0 days 00:00:02.434905,15.776936449640905,Matern,1123.5234872301783,0.01973502002639631,1.5,TPESampler,COMPLETE
261,0.9493402256690248,2025-04-24 21:02:15.507436,2025-04-24 21:02:17.982393,0 days 00:00:02.474957,0.00040953305485186026,Matern,2.1426125478590303,0.02099762485980963,1.5,TPESampler,COMPLETE
262,0.28679723429505183,2025-04-24 21:02:15.805595,2025-04-24 21:02:17.501992,0 days 00:00:01.696397,1118.8248952966308,Matern,72.61261775533345,0.07270382981310505,1.5,TPESampler,COMPLETE
263,0.2867972551962619,2025-04-24 21:02:16.217878,2025-04-24 21:02:20.948049,0 days 00:00:04.730171,0.29318633828979745,Matern,0.3978575032095682,4.147358125439022e-06,1.5,TPESampler,COMPLETE
264,0.28679720794657293,2025-04-24 21:02:17.747193,2025-04-24 21:02:20.234843,0 days 00:00:02.487650,8107.092180973288,Matern,109.08127447029368,0.44548796050444883,1.5,TPESampler,COMPLETE
265,0.9494317804743141,2025-04-24 21:02:18.264067,2025-04-24 21:02:19.735373,0 days 00:00:01.471306,4320.741707123661,RBF,0.1724615369648223,0.01832793636921812,1.5,TPESampler,COMPLETE
266,0.2867972527132234,2025-04-24 21:02:19.997311,2025-04-24 21:02:22.399043,0 days 00:00:02.401732,17877.500326579346,Matern,523.403440684408,0.004936981031108218,1.5,TPESampler,COMPLETE
267,0.286797253325014,2025-04-24 21:02:20.482853,2025-04-24 21:02:22.408515,0 days 00:00:01.925662,79226.80711273357,Matern,109.52146514429405,0.4471141484880657,1.5,TPESampler,COMPLETE
268,0.28679722683114944,2025-04-24 21:02:21.165505,2025-04-24 21:02:23.224714,0 days 00:00:02.059209,96.91377711441214,Matern,142.5234855551005,0.7659817512772554,1.5,TPESampler,COMPLETE
269,0.9228200924396327,2025-04-24 21:02:22.558569,2025-04-24 21:02:24.977821,0 days 00:00:02.419252,11488.604205770567,Matern,64108.380913333385,0.004391558765541156,1.5,TPESampler,COMPLETE
270,0.9494317804767772,2025-04-24 21:02:22.603252,2025-04-24 21:02:24.029815,0 days 00:00:01.426563,276.40467324272987,RBF,0.025684046369382797,1.609342585917295e-10,1.5,TPESampler,COMPLETE
271,0.28679725381165494,2025-04-24 21:02:23.434227,2025-04-24 21:02:25.251106,0 days 00:00:01.816879,13.83996720178475,Matern,868.5751124158701,0.1942813188212132,1.5,TPESampler,COMPLETE
272,0.2867972567719433,2025-04-24 21:02:24.247075,2025-04-24 21:02:26.184562,0 days 00:00:01.937487,1451.221390514375,Matern,96.90511516803492,0.03991746735382362,1.5,TPESampler,COMPLETE
273,0.2867972529312544,2025-04-24 21:02:25.203099,2025-04-24 21:02:26.833110,0 days 00:00:01.630011,98.16849320867757,Matern,56.561314086203666,0.30842637234288733,1.5,TPESampler,COMPLETE
274,0.9228198182549922,2025-04-24 21:02:25.558185,2025-04-24 21:02:26.901221,0 days 00:00:01.343036,52647.575400905895,RBF,0.0010010753918136914,0.25472313751977643,0.5,TPESampler,COMPLETE
275,0.9228200973458113,2025-04-24 21:02:26.410900,2025-04-24 21:02:28.295050,0 days 00:00:01.884150,1320.6492041075878,RBF,14.198393374372795,5.093978830918374e-05,0.5,TPESampler,COMPLETE
276,0.330188789710871,2025-04-24 21:02:27.025548,2025-04-24 21:02:29.034510,0 days 00:00:02.008962,1314.9811607078539,Matern,109.56283771821921,0.09386090168421742,0.5,TPESampler,COMPLETE
277,0.3301888884114678,2025-04-24 21:02:27.104688,2025-04-24 21:02:28.870731,0 days 00:00:01.766043,199.39136615495732,Matern,969.9824371667223,0.1790154362533368,0.5,TPESampler,COMPLETE
278,0.949424036232383,2025-04-24 21:02:28.531304,2025-04-24 21:02:29.998049,0 days 00:00:01.466745,1.9146958873705675e-07,RBF,2.788056488621502e-05,0.013292727753793242,2.5,TPESampler,COMPLETE
279,0.9228200925575929,2025-04-24 21:02:29.076702,2025-04-24 21:02:31.248802,0 days 00:00:02.172100,2.1543927543272,Matern,54640.37861841734,0.002832637200867227,0.5,TPESampler,COMPLETE
280,0.28679715906130276,2025-04-24 21:02:29.263583,2025-04-24 21:02:31.047223,0 days 00:00:01.783640,1462.5488583372014,Matern,53.67818235280964,0.6864331580016232,1.5,TPESampler,COMPLETE
281,0.9228200922646732,2025-04-24 21:02:30.263625,2025-04-24 21:02:31.977954,0 days 00:00:01.714329,175.1129029802193,Matern,0.007085563824953094,0.0049317763863544065,1.5,TPESampler,COMPLETE
282,0.2867972501645515,2025-04-24 21:02:31.261033,2025-04-24 21:02:33.003065,0 days 00:00:01.742032,1390.844607152267,Matern,10.556280954433696,0.1502598300017863,1.5,TPESampler,COMPLETE
283,0.2867972816406755,2025-04-24 21:02:31.520493,2025-04-24 21:02:33.264323,0 days 00:00:01.743830,401.2443189098919,Matern,21.938499334495035,0.2425558255163438,1.5,TPESampler,COMPLETE
284,0.28679725290747266,2025-04-24 21:02:32.211630,2025-04-24 21:02:34.196953,0 days 00:00:01.985323,2607.724545857693,Matern,52.92085487568123,0.6930909144558741,1.5,TPESampler,COMPLETE
285,0.28679720633790473,2025-04-24 21:02:33.213186,2025-04-24 21:02:35.100215,0 days 00:00:01.887029,1095.7355979190456,Matern,317.0838545884895,0.3427010905311745,1.5,TPESampler,COMPLETE
286,0.28679723982461836,2025-04-24 21:02:33.495722,2025-04-24 21:02:35.716662,0 days 00:00:02.220940,4292.359915678892,Matern,10.090503055694011,0.0018085969825351264,1.5,TPESampler,COMPLETE
287,0.9228200923436609,2025-04-24 21:02:34.417268,2025-04-24 21:02:37.185230,0 days 00:00:02.767962,9.462260423932872e-07,Matern,0.16893244947943284,0.0027068026692914685,1.5,TPESampler,COMPLETE
288,0.2867972720396535,2025-04-24 21:02:35.353249,2025-04-24 21:02:37.249627,0 days 00:00:01.896378,772.1080514345158,Matern,62.99073456053238,0.396714529417962,1.5,TPESampler,COMPLETE
289,0.28679719601865766,2025-04-24 21:02:35.959532,2025-04-24 21:02:37.921844,0 days 00:00:01.962312,243.91087747996198,Matern,221.97456996092197,0.2898310554537419,1.5,TPESampler,COMPLETE
290,0.2867972459972113,2025-04-24 21:02:37.349711,2025-04-24 21:02:39.233520,0 days 00:00:01.883809,6149.21973485111,Matern,95.29181661823318,0.02447123336695078,1.5,TPESampler,COMPLETE
291,0.28679725239642534,2025-04-24 21:02:37.438557,2025-04-24 21:02:40.120392,0 days 00:00:02.681835,659.5881461707032,Matern,1478.707870778702,0.9670005063728694,1.5,TPESampler,COMPLETE
292,0.2867972535212361,2025-04-24 21:02:38.185765,2025-04-24 21:02:39.718282,0 days 00:00:01.532517,57.6036005011794,Matern,24.799946645601178,0.8511988574329025,1.5,TPESampler,COMPLETE
293,0.28679725807587253,2025-04-24 21:02:39.458680,2025-04-24 21:02:41.407666,0 days 00:00:01.948986,65.32410670546278,Matern,54.05489925699083,0.9455118255059072,1.5,TPESampler,COMPLETE
294,0.2887076469589789,2025-04-24 21:02:39.951918,2025-04-24 21:02:41.414276,0 days 00:00:01.462358,2226.4281094262687,Matern,0.5271006064196238,0.9469537080668217,2.5,TPESampler,COMPLETE
295,0.28679724172557586,2025-04-24 21:02:40.293547,2025-04-24 21:02:42.277854,0 days 00:00:01.984307,2304.120808099859,Matern,231.89812251253346,0.07532706584516018,1.5,TPESampler,COMPLETE
296,0.28679725416831003,2025-04-24 21:02:41.576300,2025-04-24 21:02:44.947305,0 days 00:00:03.371005,0.00010399492092416879,Matern,92.02483919615399,0.060565471480602685,1.5,TPESampler,COMPLETE
297,0.29682709129044216,2025-04-24 21:02:41.629067,2025-04-24 21:02:45.441084,0 days 00:00:03.812017,1.532450384779391e-05,Matern,1.4622352110487509,0.38554382565983436,1.5,TPESampler,COMPLETE
298,0.28679725076646173,2025-04-24 21:02:42.487694,2025-04-24 21:02:44.690176,0 days 00:00:02.202482,15478.657937656331,Matern,127.16771430595522,0.10286919947791177,1.5,TPESampler,COMPLETE
299,0.28679723300864673,2025-04-24 21:02:44.907416,2025-04-24 21:02:47.003123,0 days 00:00:02.095707,692.9017650884255,Matern,1300.1293709733536,0.30277618339811074,1.5,TPESampler,COMPLETE
300,0.2867972525049268,2025-04-24 21:02:45.183761,2025-04-24 21:02:47.089823,0 days 00:00:01.906062,46.90944313287666,Matern,473.1381360615358,0.9833445663260564,1.5,TPESampler,COMPLETE
301,0.2867972734471785,2025-04-24 21:02:45.695520,2025-04-24 21:02:47.350254,0 days 00:00:01.654734,43.12691632590242,Matern,19.88612591735044,0.011181711798961533,1.5,TPESampler,COMPLETE
302,0.2867972681507146,2025-04-24 21:02:47.176391,2025-04-24 21:02:48.842329,0 days 00:00:01.665938,1317.894484850489,Matern,422.7046349266168,0.18907688494990446,1.5,TPESampler,COMPLETE
303,0.28679725653454335,2025-04-24 21:02:47.264184,2025-04-24 21:02:49.701888,0 days 00:00:02.437704,37.27314780302509,Matern,2570.4260343755936,0.7795798184801317,1.5,TPESampler,COMPLETE
304,0.9228201069092863,2025-04-24 21:02:47.582560,2025-04-24 21:02:49.953918,0 days 00:00:02.371358,137.2636198429538,Matern,4384.938773450436,0.004487723947804972,1.5,TPESampler,COMPLETE
305,0.28679727187888365,2025-04-24 21:02:49.051493,2025-04-24 21:02:50.907860,0 days 00:00:01.856367,746.4176893220672,Matern,223.85414532250917,0.6793215995958081,1.5,TPESampler,COMPLETE
306,0.92282009273031,2025-04-24 21:02:49.909452,2025-04-24 21:02:51.813155,0 days 00:00:01.903703,911.0658009649866,Matern,420.61743681578025,0.0035738925981615077,2.5,TPESampler,COMPLETE
307,0.9228200924668146,2025-04-24 21:02:50.239825,2025-04-24 21:02:52.280817,0 days 00:00:02.040992,174.389677414937,RBF,347.5385621187904,0.006929022972817174,1.5,TPESampler,COMPLETE
308,0.922820092211623,2025-04-24 21:02:51.152150,2025-04-24 21:02:54.003749,0 days 00:00:02.851599,1.0078271583382029e-07,RBF,15006.653289017124,2.576962035474998e-05,1.5,TPESampler,COMPLETE
309,0.28679725235854814,2025-04-24 21:02:52.046260,2025-04-24 21:02:53.976494,0 days 00:00:01.930234,9.73463122464569e-07,Matern,7.010006252597723,0.023510783335904603,1.5,TPESampler,COMPLETE
310,0.28679736133050127,2025-04-24 21:02:52.506564,2025-04-24 21:02:54.306267,0 days 00:00:01.799703,28692.71316907695,Matern,48.90555165377996,0.4358159869981133,1.5,TPESampler,COMPLETE
311,0.9494322635256962,2025-04-24 21:02:54.111427,2025-04-24 21:02:55.484336,0 days 00:00:01.372909,10.354223355386608,Matern,0.6540497274744873,1.3455791549814334e-05,1.5,TPESampler,COMPLETE
312,0.949432262790715,2025-04-24 21:02:54.156418,2025-04-24 21:02:55.584651,0 days 00:00:01.428233,4.168644616940203,Matern,0.8639077008271772,1.722761330529438e-05,1.5,TPESampler,COMPLETE
313,0.28679730894039307,2025-04-24 21:02:54.551025,2025-04-24 21:02:56.953592,0 days 00:00:02.402567,1150.933408904385,Matern,1117.5282397399963,0.024418457046748915,1.5,TPESampler,COMPLETE
314,0.2867972650463199,2025-04-24 21:02:55.658487,2025-04-24 21:02:57.092038,0 days 00:00:01.433551,0.7748515538461395,Matern,38.40753273097196,0.10061866084149337,1.5,TPESampler,COMPLETE
315,0.28679725600389844,2025-04-24 21:02:55.754171,2025-04-24 21:02:58.110187,0 days 00:00:02.356016,14157.15270928253,Matern,973.7616388907796,0.39453792465758164,1.5,TPESampler,COMPLETE
316,0.9494317804801794,2025-04-24 21:02:57.151214,2025-04-24 21:02:58.394483,0 days 00:00:01.243269,6049.680240069811,Matern,2.9590775109811428e-05,2.2251406324125117e-08,0.5,TPESampler,COMPLETE
317,0.28679735056967354,2025-04-24 21:02:57.334093,2025-04-24 21:02:59.319591,0 days 00:00:01.985498,354.74040538934696,Matern,293.3111185436059,0.010502494899059021,1.5,TPESampler,COMPLETE
318,0.2867972637681309,2025-04-24 21:02:58.342517,2025-04-24 21:03:00.113689,0 days 00:00:01.771172,13.350493773696618,Matern,1312.169937822147,0.06296495165591291,1.5,TPESampler,COMPLETE
319,0.9228200861098956,2025-04-24 21:02:58.621378,2025-04-24 21:02:59.878645,0 days 00:00:01.257267,0.11020836205189673,Matern,0.0777349606930106,0.0024675914828733076,1.5,TPESampler,COMPLETE
320,0.28679725180954907,2025-04-24 21:02:59.535053,2025-04-24 21:03:01.058924,0 days 00:00:01.523871,0.5270124224734548,Matern,1.8423631289429356,0.00115219860879737,1.5,TPESampler,COMPLETE
321,0.2867974163778874,2025-04-24 21:03:00.073684,2025-04-24 21:03:02.141437,0 days 00:00:02.067753,0.004663345053321171,Matern,11.617473112713876,0.7880945828114195,1.5,TPESampler,COMPLETE
322,0.28679727752457845,2025-04-24 21:03:00.375947,2025-04-24 21:03:02.602250,0 days 00:00:02.226303,175.71677124887765,Matern,749.5081380702868,0.8886339295660451,1.5,TPESampler,COMPLETE
323,0.2867972932358251,2025-04-24 21:03:01.282605,2025-04-24 21:03:02.732695,0 days 00:00:01.450090,136.05483783007296,Matern,3.2390648247144864,0.9645989491894993,1.5,TPESampler,COMPLETE
324,0.9228201037602881,2025-04-24 21:03:02.370231,2025-04-24 21:03:03.857352,0 days 00:00:01.487121,73.06983312283432,Matern,122.5981163172103,0.004566382495286765,1.5,TPESampler,COMPLETE
325,0.922820092433728,2025-04-24 21:03:02.815991,2025-04-24 21:03:06.141493,0 days 00:00:03.325502,1.2763760682954233e-06,RBF,4298.578137584602,1.432802137208217e-10,0.5,TPESampler,COMPLETE
326,0.288707657457987,2025-04-24 21:03:02.984595,2025-04-24 21:03:05.311992,0 days 00:00:02.327397,346.9004803462523,Matern,923.7365336242008,0.7255259308108917,2.5,TPESampler,COMPLETE
327,0.28679725817851937,2025-04-24 21:03:04.078283,2025-04-24 21:03:05.877639,0 days 00:00:01.799356,15340.969595556844,Matern,12.571832094416203,0.8517776189004953,1.5,TPESampler,COMPLETE
328,0.2867972442813151,2025-04-24 21:03:05.557745,2025-04-24 21:03:09.265768,0 days 00:00:03.708023,8.28005198461775e-06,Matern,0.7004321676862133,0.027449684165051686,1.5,TPESampler,COMPLETE
329,0.9494317804740904,2025-04-24 21:03:06.102073,2025-04-24 21:03:07.416222,0 days 00:00:01.314149,121.73233007408176,Matern,0.0017466855026219976,5.405684513767283e-10,2.5,TPESampler,COMPLETE
330,0.92282009250849,2025-04-24 21:03:06.411554,2025-04-24 21:03:08.247202,0 days 00:00:01.835648,22.766945483889383,Matern,149.46860228730372,0.00919216081154255,1.5,TPESampler,COMPLETE
331,0.9454248210113925,2025-04-24 21:03:07.633427,2025-04-24 21:03:10.558876,0 days 00:00:02.925449,0.002614899079371651,Matern,133.7751375293674,0.007220385375140087,1.5,TPESampler,COMPLETE
332,0.9228200918063127,2025-04-24 21:03:08.454760,2025-04-24 21:03:10.949877,0 days 00:00:02.495117,13.977721178226199,Matern,0.011994335423192,0.000157192435840294,1.5,TPESampler,COMPLETE
333,0.9494322793417138,2025-04-24 21:03:09.620526,2025-04-24 21:03:11.030238,0 days 00:00:01.409712,212.85166028590032,Matern,7.5555167683490145,0.025189345016473103,1.5,TPESampler,COMPLETE
334,0.9494322793365069,2025-04-24 21:03:10.886287,2025-04-24 21:03:12.590506,0 days 00:00:01.704219,6.100491717707115,Matern,59529.72125912961,0.4684767097801404,1.5,TPESampler,COMPLETE
335,0.3026845866831301,2025-04-24 21:03:11.201821,2025-04-24 21:03:13.290528,0 days 00:00:02.088707,0.01352699408027691,RBF,97.79406309833091,0.08138022720659656,1.5,TPESampler,COMPLETE
336,0.9228200906445898,2025-04-24 21:03:11.247440,2025-04-24 21:03:13.269312,0 days 00:00:02.021872,3.9703732968812546e-05,RBF,1.698513426600886,1.6450634220134782e-09,0.5,TPESampler,COMPLETE
337,0.28679719333309434,2025-04-24 21:03:12.806311,2025-04-24 21:03:14.491474,0 days 00:00:01.685163,11.550693352822616,Matern,1.098982606461971,0.46783712221600426,1.5,TPESampler,COMPLETE
338,0.9494316756750819,2025-04-24 21:03:13.463540,2025-04-24 21:03:15.002349,0 days 00:00:01.538809,2.7890876246966585e-06,Matern,0.00018969541263839796,0.04899469960601658,2.5,TPESampler,COMPLETE
339,0.2867972543250169,2025-04-24 21:03:13.510166,2025-04-24 21:03:15.991845,0 days 00:00:02.481679,400.81210568228715,Matern,231.6592041912362,0.7159924827955578,1.5,TPESampler,COMPLETE
340,0.9228200928061905,2025-04-24 21:03:14.683184,2025-04-24 21:03:16.391833,0 days 00:00:01.708649,0.2326471375276878,Matern,0.05925521932347563,0.1406814033913688,1.5,TPESampler,COMPLETE
341,0.2867972490655406,2025-04-24 21:03:15.204919,2025-04-24 21:03:16.730325,0 days 00:00:01.525406,1.6112877886397794,Matern,1.8780154151401278,0.050904111209944494,1.5,TPESampler,COMPLETE
342,0.28679736624647384,2025-04-24 21:03:16.420440,2025-04-24 21:03:17.807999,0 days 00:00:01.387559,47.4541781966329,Matern,7.360840696531666,0.11671351669490736,1.5,TPESampler,COMPLETE
