number,value,datetime_start,datetime_complete,duration,params_constant_value,params_kernel_type,params_length_scale,params_noise_level,params_nu,system_attrs_auto:sampler,state
1488,0.9228200925469304,2025-04-24 21:17:13.280244,2025-04-24 21:17:15.142592,0 days 00:00:01.862348,856.2474223814124,Matern,0.061884388518067254,0.009807241092226577,1.5,TPESampler,COMPLETE
1489,0.2887076476755632,2025-04-24 21:17:13.696727,2025-04-24 21:17:15.604485,0 days 00:00:01.907758,67.40756009448232,Matern,0.3882359543177572,0.24730016961037724,2.5,TPESampler,COMPLETE
1490,0.286797252284368,2025-04-24 21:17:14.531064,2025-04-24 21:17:16.311095,0 days 00:00:01.780031,0.312509180226474,Matern,4.645299611180815,0.02675421956280058,1.5,TPESampler,COMPLETE
1491,0.9494322786864071,2025-04-24 21:17:15.367219,2025-04-24 21:17:16.779895,0 days 00:00:01.412676,1119.7552910128773,Matern,4.768146623577921,1.2068072606823765e-05,1.5,TPESampler,COMPLETE
1492,0.9228200918382746,2025-04-24 21:17:15.853004,2025-04-24 21:17:18.606212,0 days 00:00:02.753208,55.150692556503074,RBF,99789.09874906496,7.447287163020337e-06,1.5,TPESampler,COMPLETE
1493,0.9228201198215257,2025-04-24 21:17:16.545817,2025-04-24 21:17:17.964534,0 days 00:00:01.418717,0.45694759930616013,Matern,0.008324907982859257,0.01602937925074097,1.5,TPESampler,COMPLETE
1494,0.2867972527535063,2025-04-24 21:17:17.016154,2025-04-24 21:17:18.988798,0 days 00:00:01.972644,276.0214080218793,Matern,3.5803664711527996,0.009979820660154176,1.5,TPESampler,COMPLETE
1495,0.9228201141686545,2025-04-24 21:17:18.183624,2025-04-24 21:17:19.969018,0 days 00:00:01.785394,0.06964242145714161,Matern,12.054200190313656,0.00446692009692447,0.5,TPESampler,COMPLETE
1496,0.9228200925530959,2025-04-24 21:17:18.825668,2025-04-24 21:17:20.885091,0 days 00:00:02.059423,13.478184156595772,Matern,78.88462124667605,0.00038813962099670433,1.5,TPESampler,COMPLETE
1497,0.28870762297506053,2025-04-24 21:17:19.208165,2025-04-24 21:17:21.037170,0 days 00:00:01.829005,26.141722704033587,Matern,192.4172654874319,0.10176562084231063,2.5,TPESampler,COMPLETE
1498,0.2867973211987779,2025-04-24 21:17:20.185528,2025-04-24 21:17:23.077643,0 days 00:00:02.892115,1.6607187800010796,Matern,1.3106901012598162,0.0003526102472807831,1.5,TPESampler,COMPLETE
1499,0.9494322793417138,2025-04-24 21:17:21.091389,2025-04-24 21:17:22.141284,0 days 00:00:01.049895,555.6134377106229,Matern,2.678467288964801,0.029841713899466583,1.5,TPESampler,COMPLETE
1500,0.3301888255322006,2025-04-24 21:17:21.269531,2025-04-24 21:17:23.439890,0 days 00:00:02.170359,1.234445669116023,Matern,10.09950469680624,0.0002613460148636609,0.5,TPESampler,COMPLETE
1501,0.28679725440729925,2025-04-24 21:17:22.383815,2025-04-24 21:17:24.153133,0 days 00:00:01.769318,32.53949306501738,Matern,9.559314717179882,0.12989721001550297,1.5,TPESampler,COMPLETE
1502,0.9228200920186387,2025-04-24 21:17:23.293095,2025-04-24 21:17:24.872233,0 days 00:00:01.579138,0.041049719775520584,Matern,13.38429799553247,0.0009461977009272824,1.5,TPESampler,COMPLETE
1503,0.922820091964708,2025-04-24 21:17:23.669338,2025-04-24 21:17:25.614901,0 days 00:00:01.945563,28.921092001512708,Matern,684.7171153966929,0.000237238628925469,1.5,TPESampler,COMPLETE
1504,0.9228200947150076,2025-04-24 21:17:24.366786,2025-04-24 21:17:26.377017,0 days 00:00:02.010231,1.7049764088959178,Matern,41.021184763965344,0.006357069401517992,1.5,TPESampler,COMPLETE
1505,0.28679722381537065,2025-04-24 21:17:25.081861,2025-04-24 21:17:27.486000,0 days 00:00:02.404139,86673.35391911892,Matern,26.92453113022779,0.003269006392267529,1.5,TPESampler,COMPLETE
1506,0.9228200965812072,2025-04-24 21:17:25.823479,2025-04-24 21:17:28.649229,0 days 00:00:02.825750,0.43087889527165724,Matern,1664.3688586317824,1.2193618559248402e-10,1.5,TPESampler,COMPLETE
1507,0.2867972546246025,2025-04-24 21:17:26.596495,2025-04-24 21:17:27.970792,0 days 00:00:01.374297,0.8799174530976792,Matern,3.511675759423283,0.6080362406119364,1.5,TPESampler,COMPLETE
1508,0.9494322792947262,2025-04-24 21:17:27.700484,2025-04-24 21:17:29.458825,0 days 00:00:01.758341,91346.8989942061,Matern,0.7621038073435067,0.0010890050280672606,1.5,TPESampler,COMPLETE
1509,0.9228200924352097,2025-04-24 21:17:28.227632,2025-04-24 21:17:30.832680,0 days 00:00:02.605048,3835.3438437641807,RBF,11.693257336384328,4.9349781483096976e-05,1.5,TPESampler,COMPLETE
1510,0.2867973478534063,2025-04-24 21:17:28.855693,2025-04-24 21:17:30.678256,0 days 00:00:01.822563,298.38137123589195,Matern,82.64336208756674,0.0058805214089888026,1.5,TPESampler,COMPLETE
1511,0.9228200920910149,2025-04-24 21:17:29.688424,2025-04-24 21:17:31.610477,0 days 00:00:01.922053,0.019919802853665562,RBF,0.008118942501268834,0.0007880093109794903,1.5,TPESampler,COMPLETE
1512,0.28870764842633473,2025-04-24 21:17:30.890624,2025-04-24 21:17:32.306474,0 days 00:00:01.415850,0.29035035538090276,Matern,0.594881092571709,0.000960432476507901,2.5,TPESampler,COMPLETE
1513,0.9494317804802388,2025-04-24 21:17:31.065794,2025-04-24 21:17:32.586238,0 days 00:00:01.520444,15.668324347792199,Matern,0.00021832229889841252,5.700575212633956e-08,1.5,TPESampler,COMPLETE
1514,0.9494322793413984,2025-04-24 21:17:31.860704,2025-04-24 21:17:33.316285,0 days 00:00:01.455581,1518.391362293099,Matern,6.302521549581507,0.0001625635270061001,1.5,TPESampler,COMPLETE
1515,0.28679725399408057,2025-04-24 21:17:32.554834,2025-04-24 21:17:35.285989,0 days 00:00:02.731155,4701.572339890069,Matern,88.02133625784631,0.07217199636407554,1.5,TPESampler,COMPLETE
1516,0.2867972628034757,2025-04-24 21:17:32.912040,2025-04-24 21:17:34.561726,0 days 00:00:01.649686,2.8698577843017232,Matern,11.666640544840503,0.01794596211067311,1.5,TPESampler,COMPLETE
1517,0.9228201085806605,2025-04-24 21:17:33.536814,2025-04-24 21:17:35.014031,0 days 00:00:01.477217,581.7092491761385,Matern,530.092646821433,7.564865144094002e-06,1.5,TPESampler,COMPLETE
1518,0.28679724347566415,2025-04-24 21:17:34.774488,2025-04-24 21:17:37.023309,0 days 00:00:02.248821,3.4664075231046807,Matern,0.14679307668190802,0.003909962914320794,1.5,TPESampler,COMPLETE
1519,0.9228200922997801,2025-04-24 21:17:35.470234,2025-04-24 21:17:37.375481,0 days 00:00:01.905247,105.47505920849325,Matern,35.65255155275592,2.8853540984456535e-05,2.5,TPESampler,COMPLETE
1520,0.949408962883063,2025-04-24 21:17:35.540332,2025-04-24 21:17:37.055470,0 days 00:00:01.515138,8.895181133425608e-06,Matern,8302.98815567239,2.777923539400654e-05,0.5,TPESampler,COMPLETE
1521,0.33018881525854143,2025-04-24 21:17:37.180178,2025-04-24 21:17:38.758120,0 days 00:00:01.577942,69331.9674695787,Matern,3.051812586504623,0.25042873932405907,0.5,TPESampler,COMPLETE
1522,0.9228200928942826,2025-04-24 21:17:37.227991,2025-04-24 21:17:39.175202,0 days 00:00:01.947211,0.7605539258599194,Matern,34.70924618407315,3.2511904012351504e-06,1.5,TPESampler,COMPLETE
1523,0.9494317804799474,2025-04-24 21:17:37.673952,2025-04-24 21:17:38.742768,0 days 00:00:01.068816,1221.9602385273884,RBF,1.1183548877383968e-05,1.619752179395124e-06,0.5,TPESampler,COMPLETE
1524,0.2867972452058109,2025-04-24 21:17:38.916718,2025-04-24 21:17:40.553908,0 days 00:00:01.637190,519.1786169569027,Matern,6.537909599910741,0.4225244564963504,1.5,TPESampler,COMPLETE
1525,0.28679724014110725,2025-04-24 21:17:38.980133,2025-04-24 21:17:40.826480,0 days 00:00:01.846347,524.5344518687884,Matern,0.33217884174722917,0.010719950494008394,1.5,TPESampler,COMPLETE
1526,0.9228200919749364,2025-04-24 21:17:39.465075,2025-04-24 21:17:41.198681,0 days 00:00:01.733606,5.161017922503495,Matern,22.734569982924004,0.00010976184448324346,1.5,TPESampler,COMPLETE
1527,0.949432274091657,2025-04-24 21:17:40.784696,2025-04-24 21:17:42.148743,0 days 00:00:01.364047,5.214388645465615,Matern,1.1652076973607386,9.165077887038032e-05,1.5,TPESampler,COMPLETE
1528,0.9228200937121549,2025-04-24 21:17:41.083097,2025-04-24 21:17:42.760493,0 days 00:00:01.677396,140.7463824172303,Matern,133.66200625774331,0.003970555613153796,1.5,TPESampler,COMPLETE
1529,0.9228200923060477,2025-04-24 21:17:41.512339,2025-04-24 21:17:42.826816,0 days 00:00:01.314477,0.8625552349536381,Matern,19.595540801209882,0.004937979792431476,1.5,TPESampler,COMPLETE
1530,0.3301887990586687,2025-04-24 21:17:42.379068,2025-04-24 21:17:44.070888,0 days 00:00:01.691820,1249.9166592669699,Matern,186.0886499990073,0.005488667715848711,0.5,TPESampler,COMPLETE
1531,0.9494322793417138,2025-04-24 21:17:42.958453,2025-04-24 21:17:44.073189,0 days 00:00:01.114736,2611.1387761673977,Matern,4.3474095845428,0.022836455463577182,1.5,TPESampler,COMPLETE
1532,0.28679725214872237,2025-04-24 21:17:43.106457,2025-04-24 21:17:44.998652,0 days 00:00:01.892195,90.56651470787004,Matern,53.77141128638568,0.06833111561234419,1.5,TPESampler,COMPLETE
1533,0.9494322793168601,2025-04-24 21:17:44.293942,2025-04-24 21:17:45.811046,0 days 00:00:01.517104,89148.24211631031,Matern,181.64307411265577,3.221846999555511e-05,1.5,TPESampler,COMPLETE
1534,0.2867972504188907,2025-04-24 21:17:44.340791,2025-04-24 21:17:46.508443,0 days 00:00:02.167652,77411.85023048401,Matern,84.3401377259963,0.844348914262305,1.5,TPESampler,COMPLETE
1535,0.9228200906178433,2025-04-24 21:17:45.235532,2025-04-24 21:17:48.265450,0 days 00:00:03.029918,0.005295843227965139,Matern,8.202237360361261,0.014304815622155239,1.5,TPESampler,COMPLETE
1536,0.2867972313111384,2025-04-24 21:17:46.038094,2025-04-24 21:17:48.788824,0 days 00:00:02.750730,0.11104521806923967,Matern,1.1086173422571564,0.00012984812612294087,1.5,TPESampler,COMPLETE
1537,0.3026845863395042,2025-04-24 21:17:46.765112,2025-04-24 21:17:51.091522,0 days 00:00:04.326410,2.5205436938075572e-06,RBF,2.004869792490957,6.161216632098448e-05,1.5,TPESampler,COMPLETE
1538,0.9228200925630113,2025-04-24 21:17:48.506124,2025-04-24 21:17:51.501651,0 days 00:00:02.995527,0.4378714136271543,Matern,422.4584069755559,0.00019120618043714675,1.5,TPESampler,COMPLETE
1539,0.9494322774358531,2025-04-24 21:17:49.135749,2025-04-24 21:17:50.550098,0 days 00:00:01.414349,83.95783748675214,Matern,1.5043403508749547,5.2663689126963834e-05,1.5,TPESampler,COMPLETE
1540,0.9228200981204974,2025-04-24 21:17:50.760917,2025-04-24 21:17:52.132536,0 days 00:00:01.371619,5.799661839871225,Matern,0.06611302950170292,0.052103021977525206,1.5,TPESampler,COMPLETE
1541,0.2867972821161207,2025-04-24 21:17:51.305629,2025-04-24 21:17:52.845330,0 days 00:00:01.539701,15.791592755842338,Matern,20.319799331985205,0.01584728789832305,1.5,TPESampler,COMPLETE
1542,0.3301886394385748,2025-04-24 21:17:51.774415,2025-04-24 21:17:53.483040,0 days 00:00:01.708625,479.9041792727984,Matern,1.194284126295827,0.8784123325346996,0.5,TPESampler,COMPLETE
1543,0.9494322793433844,2025-04-24 21:17:52.380560,2025-04-24 21:17:53.487244,0 days 00:00:01.106684,1663.5715623363826,RBF,2.960236542059609,0.027237042666238075,1.5,TPESampler,COMPLETE
1544,0.9228185076326417,2025-04-24 21:17:53.068465,2025-04-24 21:17:55.590079,0 days 00:00:02.521614,0.0002449203668375613,Matern,0.11119519367043988,0.00639333136048199,1.5,TPESampler,COMPLETE
1545,0.9494248948498767,2025-04-24 21:17:53.734009,2025-04-24 21:17:55.118553,0 days 00:00:01.384544,0.00014049467528921665,RBF,4.030194528465655e-05,0.2100536402467731,1.5,TPESampler,COMPLETE
1546,0.9228200925126498,2025-04-24 21:17:53.795525,2025-04-24 21:17:55.658703,0 days 00:00:01.863178,0.007209956569328435,RBF,0.0004976664220012147,4.370532536300617e-09,0.5,TPESampler,COMPLETE
1547,0.28679729779502405,2025-04-24 21:17:55.334722,2025-04-24 21:17:57.126390,0 days 00:00:01.791668,38.45107446349079,Matern,32.666236320822456,0.655505872594062,1.5,TPESampler,COMPLETE
1548,0.9228200924791443,2025-04-24 21:17:55.980315,2025-04-24 21:17:59.053516,0 days 00:00:03.073201,5.144341015377734e-05,RBF,0.00010191323504676602,0.0008811707611722922,2.5,TPESampler,COMPLETE
1549,0.28679726114213705,2025-04-24 21:17:56.029530,2025-04-24 21:17:57.784996,0 days 00:00:01.755466,9.448829545184722,Matern,0.30815470742862067,0.0015995407707292564,1.5,TPESampler,COMPLETE
1550,0.9228200892892641,2025-04-24 21:17:57.343512,2025-04-24 21:17:58.784121,0 days 00:00:01.440609,91.44923755288416,RBF,0.00036593048030213394,0.2857031703965268,0.5,TPESampler,COMPLETE
1551,0.28679728135339166,2025-04-24 21:17:57.997993,2025-04-24 21:18:00.137093,0 days 00:00:02.139100,486.4601860915744,Matern,80.15381161253414,0.053418204010985015,1.5,TPESampler,COMPLETE
1552,0.286797261769527,2025-04-24 21:17:59.008762,2025-04-24 21:18:00.813395,0 days 00:00:01.804633,36.083223076123176,Matern,1.0232684899875413,0.0016298501513483407,1.5,TPESampler,COMPLETE
1553,0.286797252511611,2025-04-24 21:17:59.328738,2025-04-24 21:18:01.474955,0 days 00:00:02.146217,761.7729143581456,Matern,0.2759015008745493,0.35774110241784063,1.5,TPESampler,COMPLETE
1554,0.9228200919613826,2025-04-24 21:18:00.380689,2025-04-24 21:18:01.921682,0 days 00:00:01.540993,0.0950447149945195,Matern,2.263246967673597,0.007152777465271236,1.5,TPESampler,COMPLETE
1555,0.28679725280652046,2025-04-24 21:18:01.017032,2025-04-24 21:18:02.996936,0 days 00:00:01.979904,318.086902278293,Matern,2.234845717797074,0.0006170479071428005,1.5,TPESampler,COMPLETE
1556,0.33018885044956714,2025-04-24 21:18:01.685562,2025-04-24 21:18:03.355015,0 days 00:00:01.669453,62.84144422022135,Matern,69.30054708499786,0.9333385660093285,0.5,TPESampler,COMPLETE
1557,0.9228200919890021,2025-04-24 21:18:02.160088,2025-04-24 21:18:04.190293,0 days 00:00:02.030205,8452.41629366519,Matern,2398.220844614583,0.0027440600670682732,1.5,TPESampler,COMPLETE
1558,0.9228200931609134,2025-04-24 21:18:03.216407,2025-04-24 21:18:04.542805,0 days 00:00:01.326398,84.10938374940895,Matern,114.69351140631986,0.003668985366483535,1.5,TPESampler,COMPLETE
1559,0.28679721775213335,2025-04-24 21:18:03.579989,2025-04-24 21:18:05.320596,0 days 00:00:01.740607,61.90522528609003,Matern,7.826736935104298,0.9838227338532824,1.5,TPESampler,COMPLETE
1560,0.9228200854742256,2025-04-24 21:18:04.404023,2025-04-24 21:18:06.819557,0 days 00:00:02.415534,8.61803408068533e-06,Matern,6.377898589428068,1.656821144013653e-06,2.5,TPESampler,COMPLETE
1561,0.9228200899502662,2025-04-24 21:18:04.769107,2025-04-24 21:18:06.149508,0 days 00:00:01.380401,0.0024456463788852245,RBF,0.005623192407148811,6.785903064363838e-07,0.5,TPESampler,COMPLETE
1562,0.9228200627717476,2025-04-24 21:18:05.537899,2025-04-24 21:18:07.613116,0 days 00:00:02.075217,0.5581769809447824,Matern,0.08656768589950097,6.284888020999413e-05,1.5,TPESampler,COMPLETE
1563,0.33018857975960825,2025-04-24 21:18:06.385723,2025-04-24 21:18:08.237131,0 days 00:00:01.851408,423.3759337629797,Matern,14.729124035926121,0.0007821331724939757,0.5,TPESampler,COMPLETE
1564,0.9494300125766876,2025-04-24 21:18:07.042210,2025-04-24 21:18:08.420199,0 days 00:00:01.377989,1.301996974907591e-07,RBF,60.65485364703695,0.1898718968685745,1.5,TPESampler,COMPLETE
1565,0.9228200931453193,2025-04-24 21:18:07.887224,2025-04-24 21:18:09.526001,0 days 00:00:01.638777,1.0774492516977308,Matern,20.997543125855778,0.0011958087525317277,1.5,TPESampler,COMPLETE
1566,0.28679725049392574,2025-04-24 21:18:08.465921,2025-04-24 21:18:10.197445,0 days 00:00:01.731524,533.9080015085133,Matern,65.64027029398682,0.06705435835746025,1.5,TPESampler,COMPLETE
1567,0.2867972623220006,2025-04-24 21:18:08.678390,2025-04-24 21:18:10.111944,0 days 00:00:01.433554,1.1579374541480463,Matern,5.351248246178635,0.01822088965073966,1.5,TPESampler,COMPLETE
1568,0.9228200890816706,2025-04-24 21:18:09.761727,2025-04-24 21:18:11.394375,0 days 00:00:01.632648,407.59257900702056,Matern,345.0630560741412,0.001244532162597463,1.5,TPESampler,COMPLETE
1569,0.28679719289213423,2025-04-24 21:18:10.346251,2025-04-24 21:18:12.313421,0 days 00:00:01.967170,620.2866446052643,Matern,8.20421637697025,0.006680773893612966,1.5,TPESampler,COMPLETE
1570,0.28679724978298493,2025-04-24 21:18:10.395306,2025-04-24 21:18:12.286889,0 days 00:00:01.891583,1335.2247977929358,Matern,2.525053324825633,0.0017289101606680795,1.5,TPESampler,COMPLETE
1571,0.2867972544984748,2025-04-24 21:18:11.617309,2025-04-24 21:18:13.770099,0 days 00:00:02.152790,3821.173227381658,Matern,284.08703059572554,0.02196872444468062,1.5,TPESampler,COMPLETE
1572,0.9494322784554673,2025-04-24 21:18:12.455176,2025-04-24 21:18:13.824735,0 days 00:00:01.369559,12.661541617064136,Matern,5.186523403151694,5.0227923568277566e-05,1.5,TPESampler,COMPLETE
1573,0.28679731731034847,2025-04-24 21:18:12.501470,2025-04-24 21:18:14.050911,0 days 00:00:01.549441,0.1121182656525721,Matern,0.5594647925033929,0.028408674066187873,1.5,TPESampler,COMPLETE
1574,0.2867972470602237,2025-04-24 21:18:13.945852,2025-04-24 21:18:15.654739,0 days 00:00:01.708887,35.63818510032437,Matern,57.086047724577625,0.009043280800918057,1.5,TPESampler,COMPLETE
1575,0.2867971808044644,2025-04-24 21:18:14.015578,2025-04-24 21:18:15.750533,0 days 00:00:01.734955,50678.96252127071,Matern,18.62821818572138,0.08394879544938835,1.5,TPESampler,COMPLETE
1576,0.2867972355841064,2025-04-24 21:18:14.619859,2025-04-24 21:18:16.611722,0 days 00:00:01.991863,37722.71180699335,Matern,5.602696002056217,0.9725992079291673,1.5,TPESampler,COMPLETE
1577,0.9228200908363551,2025-04-24 21:18:15.827392,2025-04-24 21:18:18.911845,0 days 00:00:03.084453,0.006142216140692811,Matern,50.953389720255025,0.0007164078307767541,1.5,TPESampler,COMPLETE
1578,0.2867971983232765,2025-04-24 21:18:15.973721,2025-04-24 21:18:18.328452,0 days 00:00:02.354731,12.6800697219521,Matern,0.17342208721244937,0.0022181562032652377,1.5,TPESampler,COMPLETE
1579,0.9494322790913262,2025-04-24 21:18:16.848692,2025-04-24 21:18:18.015121,0 days 00:00:01.166429,6390.053754967852,RBF,1.747968185445297,4.6986638499088865e-07,0.5,TPESampler,COMPLETE
1580,0.9494316523945932,2025-04-24 21:18:18.251999,2025-04-24 21:18:19.349179,0 days 00:00:01.097180,46931.31660470824,Matern,0.2603440943937264,0.02341084654290299,1.5,TPESampler,COMPLETE
1581,0.9494322793300825,2025-04-24 21:18:18.573833,2025-04-24 21:18:19.946894,0 days 00:00:01.373061,97506.31667324864,Matern,4.067238386852058,9.607386755493098e-05,1.5,TPESampler,COMPLETE
1582,0.9228200926916442,2025-04-24 21:18:19.117946,2025-04-24 21:18:21.058008,0 days 00:00:01.940062,68608.31559649776,Matern,2001.8854744207138,0.0013058658082315327,1.5,TPESampler,COMPLETE
1583,0.28870764737988314,2025-04-24 21:18:19.562077,2025-04-24 21:18:21.621922,0 days 00:00:02.059845,330.2738660314894,Matern,6.714874042471695,0.0016622393451105717,2.5,TPESampler,COMPLETE
1584,0.9228200909849014,2025-04-24 21:18:20.194055,2025-04-24 21:18:22.265223,0 days 00:00:02.071168,1.9260967275687846,Matern,33.72147907147955,0.025776300346603838,1.5,TPESampler,COMPLETE
1585,0.2867972502660524,2025-04-24 21:18:21.274802,2025-04-24 21:18:22.731459,0 days 00:00:01.456657,1.536730905695109,Matern,13.433582101863667,0.09478602164016602,1.5,TPESampler,COMPLETE
1586,0.2867972496567916,2025-04-24 21:18:21.854753,2025-04-24 21:18:23.707218,0 days 00:00:01.852465,5.961253188748202,Matern,12.479104318645499,0.000854091996899146,1.5,TPESampler,COMPLETE
1587,0.9228200924666353,2025-04-24 21:18:22.488120,2025-04-24 21:18:24.720288,0 days 00:00:02.232168,1.330086049900724e-07,Matern,9.161481355018285,1.1181434269534768e-08,0.5,TPESampler,COMPLETE
1588,0.2867972374798912,2025-04-24 21:18:22.978251,2025-04-24 21:18:24.608652,0 days 00:00:01.630401,14.80683318217362,Matern,45.49723956780927,0.9844471688882965,1.5,TPESampler,COMPLETE
1589,0.2867972497329862,2025-04-24 21:18:23.916322,2025-04-24 21:18:25.995825,0 days 00:00:02.079503,46.771775611988915,Matern,0.3572088850364528,0.04616456756300531,1.5,TPESampler,COMPLETE
1590,0.9228200925001151,2025-04-24 21:18:24.802054,2025-04-24 21:18:27.489215,0 days 00:00:02.687161,1245.749361164207,Matern,29166.223788883566,5.389423479037937e-05,1.5,TPESampler,COMPLETE
1591,0.9494317804802521,2025-04-24 21:18:24.942728,2025-04-24 21:18:26.752843,0 days 00:00:01.810115,4.067705450129611,RBF,0.12630712977605665,4.993235829683719e-09,1.5,TPESampler,COMPLETE
1592,0.922820080814372,2025-04-24 21:18:26.357844,2025-04-24 21:18:28.748540,0 days 00:00:02.390696,0.04388281436248285,Matern,4.2608593981864455,9.308940877247078e-06,1.5,TPESampler,COMPLETE
1593,0.922820092536772,2025-04-24 21:18:27.041622,2025-04-24 21:18:29.362487,0 days 00:00:02.320865,1.6064580218208644,Matern,631.3886639584575,0.0007706466651681414,1.5,TPESampler,COMPLETE
1594,0.9494322787273916,2025-04-24 21:18:27.714154,2025-04-24 21:18:29.015826,0 days 00:00:01.301672,46.16345854574174,Matern,8.049106202552188,3.139141594431369e-05,1.5,TPESampler,COMPLETE
1595,0.30268458965442807,2025-04-24 21:18:28.965997,2025-04-24 21:18:32.244188,0 days 00:00:03.278191,0.005633360702944824,RBF,0.7428168976960303,0.0032641992261898158,1.5,TPESampler,COMPLETE
1596,0.2867972269489424,2025-04-24 21:18:29.262331,2025-04-24 21:18:31.382128,0 days 00:00:02.119797,523.3354551908515,Matern,148.73713989597925,0.023265816815540696,1.5,TPESampler,COMPLETE
1597,0.2867972527552971,2025-04-24 21:18:29.634199,2025-04-24 21:18:31.335141,0 days 00:00:01.700942,5370.648117095497,Matern,365.2746792548908,0.2058856701375802,1.5,TPESampler,COMPLETE
1598,0.2867972529739583,2025-04-24 21:18:31.509356,2025-04-24 21:18:33.166488,0 days 00:00:01.657132,0.10614684430888212,Matern,1.6793856983101159,0.8154093640000598,1.5,TPESampler,COMPLETE
1599,0.28679725952553614,2025-04-24 21:18:31.583704,2025-04-24 21:18:33.444462,0 days 00:00:01.860758,32.38054006624727,Matern,100.61854947655287,0.050025611181621125,1.5,TPESampler,COMPLETE
1600,0.2867971467328008,2025-04-24 21:18:32.477183,2025-04-24 21:18:34.308008,0 days 00:00:01.830825,145.46991502257822,Matern,1.2149981465479058,0.0017596725968516062,1.5,TPESampler,COMPLETE
1601,0.9228200925212904,2025-04-24 21:18:33.385330,2025-04-24 21:18:35.059847,0 days 00:00:01.674517,623.0688294694862,Matern,244.15666024865422,0.00038520231693870745,1.5,TPESampler,COMPLETE
