number,value,datetime_start,datetime_complete,duration,params_constant_value,params_kernel_type,params_length_scale,params_noise_level,params_nu,system_attrs_auto:sampler,state
573,0.2867972220021888,2025-04-24 21:06:00.252839,2025-04-24 21:06:02.111487,0 days 00:00:01.858648,27919.79525822639,Matern,9.701295719120182,0.005478520717171277,1.5,TPESampler,COMPLETE
574,0.9494322793417138,2025-04-24 21:06:01.082144,2025-04-24 21:06:02.286777,0 days 00:00:01.204633,93644.15697390905,Matern,62.0682849126087,0.027560055268069237,1.5,TPESampler,COMPLETE
575,0.2867972535134526,2025-04-24 21:06:02.244785,2025-04-24 21:06:04.081024,0 days 00:00:01.836239,837.2603095123953,Matern,12.315206050643194,0.00519583944182074,1.5,TPESampler,COMPLETE
576,0.9228200977939881,2025-04-24 21:06:02.289836,2025-04-24 21:06:04.252278,0 days 00:00:01.962442,21524.778772034275,Matern,0.05653436514381101,0.008489425662762892,1.5,TPESampler,COMPLETE
577,0.28679725270398554,2025-04-24 21:06:02.465076,2025-04-24 21:06:04.732129,0 days 00:00:02.267053,17127.17149865517,Matern,0.2557765979446752,0.1488020506186742,1.5,TPESampler,COMPLETE
578,0.9228200922558951,2025-04-24 21:06:04.301473,2025-04-24 21:06:05.669560,0 days 00:00:01.368087,1696.04426391781,RBF,38.162484001941756,0.0003267949500568665,1.5,TPESampler,COMPLETE
579,0.9494322793417138,2025-04-24 21:06:04.505001,2025-04-24 21:06:05.570188,0 days 00:00:01.065187,30227.421591675324,Matern,9.652279991774767,0.031696974394115805,1.5,TPESampler,COMPLETE
580,0.9494322793417138,2025-04-24 21:06:05.032347,2025-04-24 21:06:06.480200,0 days 00:00:01.447853,33842.91956717568,Matern,1.7695498785761876,0.000358764811040082,1.5,TPESampler,COMPLETE
581,0.3301881937099893,2025-04-24 21:06:05.741440,2025-04-24 21:06:07.226226,0 days 00:00:01.484786,1117.6706957144145,Matern,16.611602007325438,0.47139408542035827,0.5,TPESampler,COMPLETE
582,0.28679725385455945,2025-04-24 21:06:05.876611,2025-04-24 21:06:08.318922,0 days 00:00:02.442311,44792.995329506535,Matern,489.5023733064293,0.004454838308645077,1.5,TPESampler,COMPLETE
583,0.2867972524847605,2025-04-24 21:06:06.697020,2025-04-24 21:06:08.611569,0 days 00:00:01.914549,30737.025755707033,Matern,3.0332347969666626,0.4540976307215248,1.5,TPESampler,COMPLETE
584,0.2867973128405603,2025-04-24 21:06:07.513309,2025-04-24 21:06:09.265105,0 days 00:00:01.751796,4373.209218235985,Matern,3.2340478988764696,0.00565497241732518,1.5,TPESampler,COMPLETE
585,0.9494322793417138,2025-04-24 21:06:08.557430,2025-04-24 21:06:09.521317,0 days 00:00:00.963887,31399.693935468356,Matern,2.2623840530497823,0.019544859600007323,1.5,TPESampler,COMPLETE
586,0.28679725274109674,2025-04-24 21:06:08.902995,2025-04-24 21:06:10.779843,0 days 00:00:01.876848,24112.593556421052,Matern,92.52652795619771,0.013812631676653116,1.5,TPESampler,COMPLETE
587,0.9494322792398986,2025-04-24 21:06:09.460431,2025-04-24 21:06:11.054879,0 days 00:00:01.594448,0.0019214427888795869,Matern,11558.134210645581,0.08058699543330962,2.5,TPESampler,COMPLETE
588,0.9228200928369109,2025-04-24 21:06:09.780836,2025-04-24 21:06:12.580699,0 days 00:00:02.799863,4.958168090734153e-07,Matern,7.81848574065845e-05,2.3722666437224068e-05,1.5,TPESampler,COMPLETE
589,0.2867972540337947,2025-04-24 21:06:11.006448,2025-04-24 21:06:12.612152,0 days 00:00:01.605704,21.80995821758694,Matern,1.3994857606262239,0.00019546636763650155,1.5,TPESampler,COMPLETE
590,0.28679721441939066,2025-04-24 21:06:11.289206,2025-04-24 21:06:13.288585,0 days 00:00:01.999379,6915.655756449265,Matern,8.176255280840014,0.42899104919780084,1.5,TPESampler,COMPLETE
591,0.2867972473143473,2025-04-24 21:06:12.732996,2025-04-24 21:06:14.637104,0 days 00:00:01.904108,34945.665002217385,Matern,2.971261164000604,0.8665013807754812,1.5,TPESampler,COMPLETE
592,0.9228200929542701,2025-04-24 21:06:12.779640,2025-04-24 21:06:16.283419,0 days 00:00:03.503779,43519.86861511416,Matern,0.002628214450911889,0.001139246688280103,0.5,TPESampler,COMPLETE
593,0.2867972598881621,2025-04-24 21:06:13.571120,2025-04-24 21:06:15.260048,0 days 00:00:01.688928,22463.02248955774,Matern,5.512287221784432,0.2931343847501735,1.5,TPESampler,COMPLETE
594,0.2867972515170545,2025-04-24 21:06:14.857528,2025-04-24 21:06:17.041810,0 days 00:00:02.184282,46751.000986891515,Matern,530.2688793656974,0.06757521163376737,1.5,TPESampler,COMPLETE
595,0.2867972527589216,2025-04-24 21:06:15.500103,2025-04-24 21:06:17.013526,0 days 00:00:01.513423,2464.7080958047177,Matern,0.9656543616519748,0.795152088728252,1.5,TPESampler,COMPLETE
596,0.9228200924841959,2025-04-24 21:06:16.480295,2025-04-24 21:06:19.729700,0 days 00:00:03.249405,5.451085235254449e-06,Matern,27219.924061525773,2.45387643828505e-09,1.5,TPESampler,COMPLETE
597,0.28679728769363805,2025-04-24 21:06:17.177657,2025-04-24 21:06:19.072664,0 days 00:00:01.895007,4557.716857771574,Matern,1134.1443722529048,0.8155560239433902,1.5,TPESampler,COMPLETE
598,0.28679733565218524,2025-04-24 21:06:17.222582,2025-04-24 21:06:19.134413,0 days 00:00:01.911831,8936.889416398457,Matern,281.2491980176376,0.36681339624373405,1.5,TPESampler,COMPLETE
599,0.2867972473917846,2025-04-24 21:06:19.211328,2025-04-24 21:06:20.966086,0 days 00:00:01.754758,250.4587428127047,Matern,2.0113652468936394,0.009849633361494041,1.5,TPESampler,COMPLETE
600,0.922820082895867,2025-04-24 21:06:19.289774,2025-04-24 21:06:21.994038,0 days 00:00:02.704264,1.5356346127078528,Matern,2291.5042721598656,0.009259561682738502,1.5,TPESampler,COMPLETE
601,0.9228200911054913,2025-04-24 21:06:20.003013,2025-04-24 21:06:21.871677,0 days 00:00:01.868664,2.375749753598695e-06,RBF,0.017551451721457695,2.606336301228366e-09,2.5,TPESampler,COMPLETE
602,0.9228200874187198,2025-04-24 21:06:21.183083,2025-04-24 21:06:23.552775,0 days 00:00:02.369692,0.012857591608615654,RBF,0.003202042124117619,0.0025611174772391413,2.5,TPESampler,COMPLETE
603,0.28679725499708475,2025-04-24 21:06:22.075508,2025-04-24 21:06:23.603656,0 days 00:00:01.528148,0.18657952768991595,Matern,0.7520907712935461,0.00048710259703909335,1.5,TPESampler,COMPLETE
604,0.9228200924683846,2025-04-24 21:06:22.228400,2025-04-24 21:06:23.994288,0 days 00:00:01.765888,0.09613468299439827,Matern,3.9998199994959664,9.975616982128068e-05,1.5,TPESampler,COMPLETE
605,0.2867972528944813,2025-04-24 21:06:23.699272,2025-04-24 21:06:25.547946,0 days 00:00:01.848674,4266.2917177308245,Matern,22.66965646241747,0.7608671254582201,1.5,TPESampler,COMPLETE
606,0.28679725733370576,2025-04-24 21:06:23.758615,2025-04-24 21:06:26.675014,0 days 00:00:02.916399,3083.8953732161026,Matern,37519.46451875879,0.7083472468460777,1.5,TPESampler,COMPLETE
607,0.3301888448977369,2025-04-24 21:06:24.236931,2025-04-24 21:06:25.955054,0 days 00:00:01.718123,69797.04559903943,Matern,600.107234834314,0.010967484137769996,0.5,TPESampler,COMPLETE
608,0.28679706070831584,2025-04-24 21:06:25.805357,2025-04-24 21:06:28.507980,0 days 00:00:02.702623,54.945067508637436,Matern,62.50878461668458,0.005809873086522065,1.5,TPESampler,COMPLETE
609,0.286797292486845,2025-04-24 21:06:26.156655,2025-04-24 21:06:27.686463,0 days 00:00:01.529808,32254.69556466687,Matern,6.989101135913086,0.6962196578002803,1.5,TPESampler,COMPLETE
610,0.28679724980255245,2025-04-24 21:06:26.933786,2025-04-24 21:06:28.516410,0 days 00:00:01.582624,28.325979981483535,Matern,19.4939629056763,0.013126903924141075,1.5,TPESampler,COMPLETE
611,0.2867972547256143,2025-04-24 21:06:27.896973,2025-04-24 21:06:29.781099,0 days 00:00:01.884126,2056.0196697666306,Matern,0.21910695514115405,0.4115478795573049,1.5,TPESampler,COMPLETE
612,0.9228200929429847,2025-04-24 21:06:28.652318,2025-04-24 21:06:30.783643,0 days 00:00:02.131325,90.52681704685833,Matern,248.6900757793039,0.01463219893084941,1.5,TPESampler,COMPLETE
613,0.9494317804800916,2025-04-24 21:06:28.700691,2025-04-24 21:06:30.170203,0 days 00:00:01.469512,48418.32144435915,RBF,0.000944836727706424,2.20605071640832e-10,2.5,TPESampler,COMPLETE
614,0.9494322792523288,2025-04-24 21:06:29.998906,2025-04-24 21:06:31.167456,0 days 00:00:01.168550,68.77837124570087,Matern,2.4528882150874236,8.847810372790282e-05,2.5,TPESampler,COMPLETE
615,0.9494322758633654,2025-04-24 21:06:30.424945,2025-04-24 21:06:31.831376,0 days 00:00:01.406431,46.660885579189205,Matern,1.9690822190363297,6.251440686096073e-06,1.5,TPESampler,COMPLETE
616,0.288707698931974,2025-04-24 21:06:30.995283,2025-04-24 21:06:33.329040,0 days 00:00:02.333757,87304.08545841137,Matern,98.80400912347022,0.769499771170682,2.5,TPESampler,COMPLETE
617,0.9228200921843125,2025-04-24 21:06:31.428936,2025-04-24 21:06:33.973892,0 days 00:00:02.544956,0.43677264685107225,Matern,401.8687441190397,0.03190027032315917,1.5,TPESampler,COMPLETE
618,0.9228200938519073,2025-04-24 21:06:32.071494,2025-04-24 21:06:33.769821,0 days 00:00:01.698327,851.7492498293574,Matern,3568.2365921286614,0.0003674318299719562,1.5,TPESampler,COMPLETE
619,0.28679744838451965,2025-04-24 21:06:33.544024,2025-04-24 21:06:35.580921,0 days 00:00:02.036897,60.45694246507005,Matern,6.599363124385725,0.003194689522981962,1.5,TPESampler,COMPLETE
620,0.9228200912432675,2025-04-24 21:06:34.007143,2025-04-24 21:06:35.429141,0 days 00:00:01.421998,34005.578349946365,Matern,0.0019928785719609955,0.5903447686132299,1.5,TPESampler,COMPLETE
621,0.922820085879905,2025-04-24 21:06:34.214777,2025-04-24 21:06:36.010303,0 days 00:00:01.795526,32.19656711332531,Matern,115.53664337786888,0.00044560715243428676,1.5,TPESampler,COMPLETE
622,0.3026845844183666,2025-04-24 21:06:35.653298,2025-04-24 21:06:37.244164,0 days 00:00:01.590866,677.5241640853732,RBF,1.2050381439115105,0.4192314911264871,1.5,TPESampler,COMPLETE
623,0.2867972075455247,2025-04-24 21:06:35.841022,2025-04-24 21:06:38.293129,0 days 00:00:02.452107,112.14394415735548,Matern,61.864859902825714,0.0010145398978544222,1.5,TPESampler,COMPLETE
624,0.9228200909617966,2025-04-24 21:06:36.328344,2025-04-24 21:06:37.924888,0 days 00:00:01.596544,1597.3154576491465,Matern,1355.8237695046732,0.007106770682680843,1.5,TPESampler,COMPLETE
625,0.9494322793339754,2025-04-24 21:06:37.452952,2025-04-24 21:06:39.313276,0 days 00:00:01.860324,0.008169776842938825,RBF,28561.081851213024,0.0853322697931571,1.5,TPESampler,COMPLETE
626,0.28679714524055777,2025-04-24 21:06:38.137731,2025-04-24 21:06:40.010434,0 days 00:00:01.872703,59.69192964572695,Matern,5.8237766621835325,0.00021872255108550852,1.5,TPESampler,COMPLETE
627,0.9494322791376356,2025-04-24 21:06:38.495224,2025-04-24 21:06:40.285638,0 days 00:00:01.790414,160.43653768020036,Matern,359.3179907670562,0.018912011256282297,1.5,TPESampler,COMPLETE
628,0.922820092519228,2025-04-24 21:06:39.526971,2025-04-24 21:06:41.894986,0 days 00:00:02.368015,17.32322617421635,Matern,59420.17655595621,0.00888894574227262,1.5,TPESampler,COMPLETE
629,0.9228200926929317,2025-04-24 21:06:40.212436,2025-04-24 21:06:42.084952,0 days 00:00:01.872516,121.67019260366334,Matern,38.413070400869294,0.00010708054152025534,1.5,TPESampler,COMPLETE
630,0.9494322792840266,2025-04-24 21:06:40.577136,2025-04-24 21:06:41.933523,0 days 00:00:01.356387,6236.311971211552,Matern,6.100101905642458,5.758168149590402e-05,1.5,TPESampler,COMPLETE
631,0.9228200923655346,2025-04-24 21:06:42.047460,2025-04-24 21:06:43.977280,0 days 00:00:01.929820,25.66791463502206,Matern,80.81661598580035,0.0002841547535549193,1.5,TPESampler,COMPLETE
632,0.2867972480470193,2025-04-24 21:06:42.083188,2025-04-24 21:06:44.680667,0 days 00:00:02.597479,30.266574022934122,Matern,13.691126409033819,0.00011581620915726451,1.5,TPESampler,COMPLETE
633,0.9494319543647665,2025-04-24 21:06:42.721523,2025-04-24 21:06:43.840137,0 days 00:00:01.118614,6.99751834988615,Matern,3.254366102567189,0.00011060232187312041,0.5,TPESampler,COMPLETE
634,0.28679724981707355,2025-04-24 21:06:44.024438,2025-04-24 21:06:45.478524,0 days 00:00:01.454086,29.57390853927574,Matern,7.0699851545824135,0.01604588837220206,1.5,TPESampler,COMPLETE
635,0.9228200925818827,2025-04-24 21:06:44.280733,2025-04-24 21:06:45.975794,0 days 00:00:01.695061,27.199818998240996,Matern,134.94114520630447,8.953114760236674e-06,1.5,TPESampler,COMPLETE
636,0.28679726639938924,2025-04-24 21:06:44.902686,2025-04-24 21:06:46.797115,0 days 00:00:01.894429,10.531304402992289,Matern,1.8792312782828664,0.001225898840575956,1.5,TPESampler,COMPLETE
637,0.9494317804802215,2025-04-24 21:06:45.710780,2025-04-24 21:06:46.915187,0 days 00:00:01.204407,1050.1613017684797,Matern,0.0042822158633157425,7.88630511031974e-05,2.5,TPESampler,COMPLETE
638,0.28679727359663204,2025-04-24 21:06:46.255305,2025-04-24 21:06:48.212966,0 days 00:00:01.957661,462.3688193491353,Matern,129.36653425447483,0.011612127746049875,1.5,TPESampler,COMPLETE
639,0.28679725292710195,2025-04-24 21:06:46.994940,2025-04-24 21:06:48.836053,0 days 00:00:01.841113,42.42030340614512,Matern,29.498596246663496,0.0007344163570965895,1.5,TPESampler,COMPLETE
640,0.9228200924590694,2025-04-24 21:06:47.091780,2025-04-24 21:06:49.125303,0 days 00:00:02.033523,138.00895399786543,Matern,116.17534805066484,0.0012061982399251114,1.5,TPESampler,COMPLETE
641,0.2867972835821869,2025-04-24 21:06:48.431661,2025-04-24 21:06:50.924415,0 days 00:00:02.492754,540.6226950898613,Matern,79.83796320470383,0.0002668197177821943,1.5,TPESampler,COMPLETE
642,0.30268458693269584,2025-04-24 21:06:49.046079,2025-04-24 21:06:52.783464,0 days 00:00:03.737385,0.0027430374173254986,RBF,0.9662666957746078,7.839095760790081e-08,1.5,TPESampler,COMPLETE
643,0.9494317804804027,2025-04-24 21:06:49.339779,2025-04-24 21:06:50.551989,0 days 00:00:01.212210,50.204001944293864,RBF,0.01923693240792172,3.1475722570004477e-07,2.5,TPESampler,COMPLETE
644,0.2867972536863591,2025-04-24 21:06:50.765474,2025-04-24 21:06:52.374001,0 days 00:00:01.608527,747.7668691698988,Matern,39.387528076911096,0.08053760207498382,1.5,TPESampler,COMPLETE
645,0.949431780256643,2025-04-24 21:06:51.120567,2025-04-24 21:06:52.469891,0 days 00:00:01.349324,19.851012784109965,Matern,0.13157168356342624,6.536672879680823e-05,1.5,TPESampler,COMPLETE
646,0.28679717754647516,2025-04-24 21:06:52.535131,2025-04-24 21:06:53.912551,0 days 00:00:01.377420,29.220577543894063,Matern,5.944647540779659,0.0016824047123018882,1.5,TPESampler,COMPLETE
647,0.28679725106869763,2025-04-24 21:06:52.678610,2025-04-24 21:06:55.031559,0 days 00:00:02.352949,1779.594801092128,Matern,117.69502710813113,0.13820563367889246,1.5,TPESampler,COMPLETE
648,0.28679725587202426,2025-04-24 21:06:52.983139,2025-04-24 21:06:54.648414,0 days 00:00:01.665275,1988.7036123367661,Matern,0.5381455284564082,0.0026624270938043295,1.5,TPESampler,COMPLETE
649,0.2867972528073753,2025-04-24 21:06:54.124532,2025-04-24 21:06:56.275427,0 days 00:00:02.150895,6.510137244643342,Matern,2.795349592179071,0.00017541768763659822,1.5,TPESampler,COMPLETE
650,0.9494322780622434,2025-04-24 21:06:54.866096,2025-04-24 21:06:56.273975,0 days 00:00:01.407879,1328.1484709969118,Matern,0.9539342535485591,8.719492200549392e-05,1.5,TPESampler,COMPLETE
651,0.9494317804802295,2025-04-24 21:06:55.261917,2025-04-24 21:06:56.878418,0 days 00:00:01.616501,38.62818506491452,RBF,0.0880191390256969,5.9291274609197244e-05,0.5,TPESampler,COMPLETE
652,0.9228201070953624,2025-04-24 21:06:56.474761,2025-04-24 21:06:58.166825,0 days 00:00:01.692064,141.63943302222322,Matern,177.90644982071245,0.007494568510871625,1.5,TPESampler,COMPLETE
653,0.9228200911442643,2025-04-24 21:06:56.554682,2025-04-24 21:06:58.236618,0 days 00:00:01.681936,0.08245325950131265,Matern,62.56564619368024,4.751842045564917e-05,1.5,TPESampler,COMPLETE
654,0.2867972264280782,2025-04-24 21:06:57.142040,2025-04-24 21:06:59.029066,0 days 00:00:01.887026,30.884807374025048,Matern,3.7119510048290403,0.00037540498965979907,1.5,TPESampler,COMPLETE
655,0.9494322793433767,2025-04-24 21:06:58.323635,2025-04-24 21:07:00.389173,0 days 00:00:02.065538,0.004729988203223782,RBF,99999.34165899761,0.003957167255115945,0.5,TPESampler,COMPLETE
656,0.2867974171425898,2025-04-24 21:06:58.387524,2025-04-24 21:07:00.288238,0 days 00:00:01.900714,114.12820148474609,Matern,1.9537102951682812,0.0024603620690226294,1.5,TPESampler,COMPLETE
657,0.2867972438810998,2025-04-24 21:06:59.263937,2025-04-24 21:07:01.303376,0 days 00:00:02.039439,87630.85617067176,Matern,32.88297266723351,0.3103349927303691,1.5,TPESampler,COMPLETE
658,0.9228200923472306,2025-04-24 21:07:00.469133,2025-04-24 21:07:02.654863,0 days 00:00:02.185730,1297.1409169354201,Matern,6779.940454729299,0.020064364642300925,1.5,TPESampler,COMPLETE
659,0.33018871275708445,2025-04-24 21:07:00.597717,2025-04-24 21:07:02.392957,0 days 00:00:01.795240,24.66275834815198,Matern,422.9804792665114,0.0016881657981133212,0.5,TPESampler,COMPLETE
660,0.922820092989942,2025-04-24 21:07:01.514439,2025-04-24 21:07:03.088131,0 days 00:00:01.573692,5.5509775841944275,Matern,151.34118233517694,0.00015067989817909986,1.5,TPESampler,COMPLETE
661,0.30268463975651827,2025-04-24 21:07:02.606700,2025-04-24 21:07:04.939351,0 days 00:00:02.332651,241.6538008484577,RBF,31.94548002965874,0.010682065270665297,1.5,TPESampler,COMPLETE
662,0.2867972528546647,2025-04-24 21:07:02.928195,2025-04-24 21:07:05.059299,0 days 00:00:02.131104,6829.570477933847,Matern,2582.638865850709,0.7070307718516518,1.5,TPESampler,COMPLETE
663,0.9493668023743101,2025-04-24 21:07:03.295703,2025-04-24 21:07:04.682354,0 days 00:00:01.386651,2.6762443796174586e-05,RBF,240.65923043916976,1.9985735528088009e-10,2.5,TPESampler,COMPLETE
664,0.9228200654248406,2025-04-24 21:07:04.896454,2025-04-24 21:07:06.604665,0 days 00:00:01.708211,1447.6350403709803,Matern,1833.6434247326217,2.291537125584547e-05,1.5,TPESampler,COMPLETE
665,0.28679724147362984,2025-04-24 21:07:05.150368,2025-04-24 21:07:07.024723,0 days 00:00:01.874355,313.4421583598551,Matern,1.8777331308064658,0.010740458069728207,1.5,TPESampler,COMPLETE
666,0.9494322793417138,2025-04-24 21:07:05.288086,2025-04-24 21:07:06.519234,0 days 00:00:01.231148,755.5587390716559,Matern,1.8067778356906117,0.024644546096908703,1.5,TPESampler,COMPLETE
667,0.9228200957340441,2025-04-24 21:07:06.723145,2025-04-24 21:07:08.531076,0 days 00:00:01.807931,0.052152276900841,Matern,1.255422819661133,4.65629073676849e-09,2.5,TPESampler,COMPLETE
668,0.9494322416798487,2025-04-24 21:07:06.800727,2025-04-24 21:07:09.076558,0 days 00:00:02.275831,0.8834113934763765,Matern,0.44619320105592897,1.2341236033297045e-06,1.5,TPESampler,COMPLETE
669,0.9494320866061834,2025-04-24 21:07:07.276796,2025-04-24 21:07:08.500067,0 days 00:00:01.223271,51224.48661747469,Matern,1.7048370674247766,1.0695500167835154e-10,0.5,TPESampler,COMPLETE
670,0.9494321442524873,2025-04-24 21:07:08.650907,2025-04-24 21:07:10.204088,0 days 00:00:01.553181,2897.214501393157,Matern,11.138619503300523,2.745235311635933e-05,0.5,TPESampler,COMPLETE
671,0.9494322792846828,2025-04-24 21:07:08.689208,2025-04-24 21:07:10.896497,0 days 00:00:02.207289,50.0429710408166,Matern,97361.22188081543,0.06380887950314056,1.5,TPESampler,COMPLETE
672,0.2867972529993044,2025-04-24 21:07:09.424348,2025-04-24 21:07:11.458771,0 days 00:00:02.034423,404.9264627738247,Matern,44.464960206806275,0.22613432046903625,1.5,TPESampler,COMPLETE
673,0.9494317804801174,2025-04-24 21:07:10.408486,2025-04-24 21:07:12.062884,0 days 00:00:01.654398,1356.375595019579,Matern,0.032488015941275504,3.3862647661523684e-05,1.5,TPESampler,COMPLETE
674,0.9228200957605183,2025-04-24 21:07:11.173396,2025-04-24 21:07:12.724616,0 days 00:00:01.551220,225.29379828777857,Matern,564.7753971592597,0.0019149881041617973,1.5,TPESampler,COMPLETE
675,0.28679727270321376,2025-04-24 21:07:11.690423,2025-04-24 21:07:13.762671,0 days 00:00:02.072248,44.87570887479839,Matern,464.6764977374522,0.10898346083942721,1.5,TPESampler,COMPLETE
676,0.2867972532916515,2025-04-24 21:07:12.327017,2025-04-24 21:07:14.323326,0 days 00:00:01.996309,547.0711028138339,Matern,78.73458521403037,0.0004338279103854472,1.5,TPESampler,COMPLETE
677,0.9228200693761783,2025-04-24 21:07:12.934137,2025-04-24 21:07:15.395374,0 days 00:00:02.461237,0.1541048787408279,RBF,0.0038521599322489317,6.830594322888013e-06,1.5,TPESampler,COMPLETE
678,0.9228200926643055,2025-04-24 21:07:13.977905,2025-04-24 21:07:15.673350,0 days 00:00:01.695445,11.230323184286025,Matern,75.68541997145451,0.004889937293930747,1.5,TPESampler,COMPLETE
679,0.9228200923603281,2025-04-24 21:07:14.521330,2025-04-24 21:07:16.313517,0 days 00:00:01.792187,0.5238143769876185,Matern,88.6313583750981,0.00039552079945064106,1.5,TPESampler,COMPLETE
680,0.9228200935445906,2025-04-24 21:07:15.617535,2025-04-24 21:07:17.814792,0 days 00:00:02.197257,0.014315537684742441,Matern,478.053426643853,1.0663095364882143e-05,0.5,TPESampler,COMPLETE
681,0.9494317804802219,2025-04-24 21:07:15.934432,2025-04-24 21:07:17.913616,0 days 00:00:01.979184,2.7631308480114,RBF,0.15740808127918543,3.0590007695285966e-08,0.5,TPESampler,COMPLETE
682,0.286797240307598,2025-04-24 21:07:16.587950,2025-04-24 21:07:18.732845,0 days 00:00:02.144895,608.1328311640606,Matern,10.7350703262082,0.9913006633154258,1.5,TPESampler,COMPLETE
683,0.922820094260602,2025-04-24 21:07:18.028804,2025-04-24 21:07:19.796055,0 days 00:00:01.767251,0.8779361383007073,Matern,0.009408145473367149,0.00021456156782058978,1.5,TPESampler,COMPLETE
684,0.28679725043800586,2025-04-24 21:07:18.140022,2025-04-24 21:07:20.350313,0 days 00:00:02.210291,1242.6877617684158,Matern,5.1203974944419,0.0005676214903539487,1.5,TPESampler,COMPLETE
685,0.33018882576437314,2025-04-24 21:07:19.058346,2025-04-24 21:07:21.352036,0 days 00:00:02.293690,1688.8920678267077,Matern,26625.4030724748,0.21837345361235874,0.5,TPESampler,COMPLETE
686,0.2867972585574299,2025-04-24 21:07:20.020246,2025-04-24 21:07:21.960102,0 days 00:00:01.939856,49886.7543518334,Matern,0.2710839616077429,0.07026437012214562,1.5,TPESampler,COMPLETE
687,0.28679725287161517,2025-04-24 21:07:20.579012,2025-04-24 21:07:22.626578,0 days 00:00:02.047566,675.2505479943062,Matern,282.7329942606891,0.05627388917303259,1.5,TPESampler,COMPLETE
