number,value,datetime_start,datetime_complete,duration,params_constant_value,params_kernel_type,params_length_scale,params_noise_level,params_nu,system_attrs_auto:sampler,state
803,0.9494322793319412,2025-04-24 21:08:45.070556,2025-04-24 21:08:46.818837,0 days 00:00:01.748281,10.334339830659168,Matern,50918.62389088058,0.7724249633357219,1.5,TPESampler,COMPLETE
804,0.9228200923265658,2025-04-24 21:08:45.559045,2025-04-24 21:08:47.911219,0 days 00:00:02.352174,6970.512084260999,Matern,121.09689022609732,1.1950239835144548e-05,1.5,TPESampler,COMPLETE
805,0.28679725193433697,2025-04-24 21:08:46.048627,2025-04-24 21:08:48.305599,0 days 00:00:02.256972,0.0036789937177016158,Matern,0.13986194261609886,0.003512712531689035,1.5,TPESampler,COMPLETE
806,0.9228200905373525,2025-04-24 21:08:47.044278,2025-04-24 21:08:48.760461,0 days 00:00:01.716183,4116.1478905041295,Matern,0.030785261103912224,0.2676472232975385,1.5,TPESampler,COMPLETE
807,0.9228200926636191,2025-04-24 21:08:48.196034,2025-04-24 21:08:50.362944,0 days 00:00:02.166910,34.344188508410234,RBF,956.9517592933679,0.0002115589417747344,1.5,TPESampler,COMPLETE
808,0.9494317804791124,2025-04-24 21:08:48.586985,2025-04-24 21:08:49.711577,0 days 00:00:01.124592,30.12006971018082,Matern,0.09184133160143838,3.791572198460692e-05,1.5,TPESampler,COMPLETE
809,0.9228200958360174,2025-04-24 21:08:48.949415,2025-04-24 21:08:50.786380,0 days 00:00:01.836965,96225.18466923539,Matern,0.03322991270149115,0.08983093799961579,1.5,TPESampler,COMPLETE
810,0.28679725527355815,2025-04-24 21:08:49.984922,2025-04-24 21:08:52.617126,0 days 00:00:02.632204,63035.95348144944,Matern,109.3707245707459,0.00031519672241178,1.5,TPESampler,COMPLETE
811,0.922819185077892,2025-04-24 21:08:50.605813,2025-04-24 21:08:52.184899,0 days 00:00:01.579086,1.7524873443256936,Matern,14.4544893777421,0.011318941603610877,1.5,TPESampler,COMPLETE
812,0.949431780476793,2025-04-24 21:08:50.981495,2025-04-24 21:08:52.091746,0 days 00:00:01.110251,110.49957968808606,Matern,0.09113794347134867,0.020799545564974063,1.5,TPESampler,COMPLETE
813,0.9228200924876288,2025-04-24 21:08:52.248137,2025-04-24 21:08:54.249738,0 days 00:00:02.001601,1.0042286724972784,Matern,8.020641125972212,6.983447175264961e-05,1.5,TPESampler,COMPLETE
814,0.2867972356122217,2025-04-24 21:08:52.405162,2025-04-24 21:08:54.396136,0 days 00:00:01.990974,70825.45334294639,Matern,13.235360100165298,0.00027145309928743413,1.5,TPESampler,COMPLETE
815,0.9494322793417138,2025-04-24 21:08:52.890654,2025-04-24 21:08:53.980474,0 days 00:00:01.089820,61937.86724975523,Matern,1.1578735309202384,0.01718355112784326,1.5,TPESampler,COMPLETE
816,0.2867972323545491,2025-04-24 21:08:54.196242,2025-04-24 21:08:55.710628,0 days 00:00:01.514386,120.82174206212193,Matern,4.584070208260116,0.012606832765663647,1.5,TPESampler,COMPLETE
817,0.28679724650143734,2025-04-24 21:08:54.504423,2025-04-24 21:08:56.257571,0 days 00:00:01.753148,8.492916386721964,Matern,211.9817419416363,0.09923354401637619,1.5,TPESampler,COMPLETE
818,0.2867972551370539,2025-04-24 21:08:54.714892,2025-04-24 21:08:57.751888,0 days 00:00:03.036996,1.3829462309105063,Matern,0.20840602454959675,0.00015334443007010504,1.5,TPESampler,COMPLETE
819,0.9228200918545084,2025-04-24 21:08:55.926702,2025-04-24 21:08:57.318655,0 days 00:00:01.391953,0.0005896020197692096,Matern,0.07197932074377204,2.6183289520258256e-06,1.5,TPESampler,COMPLETE
820,0.9228200923798731,2025-04-24 21:08:56.479530,2025-04-24 21:08:58.067314,0 days 00:00:01.587784,0.013272919075850731,Matern,3.5565597914042466,0.003393620376333882,1.5,TPESampler,COMPLETE
821,0.9228200914048285,2025-04-24 21:08:57.524623,2025-04-24 21:08:59.659512,0 days 00:00:02.134889,5.841569000042516,Matern,157.1016530905626,0.003586178548027994,1.5,TPESampler,COMPLETE
822,0.922820092443955,2025-04-24 21:08:57.986267,2025-04-24 21:09:00.460761,0 days 00:00:02.474494,2.8916288498325926,Matern,3061.4766555157426,0.005584288806398814,1.5,TPESampler,COMPLETE
823,0.2887076822416003,2025-04-24 21:08:58.334166,2025-04-24 21:09:01.771374,0 days 00:00:03.437208,0.00206294203661105,Matern,0.4675341351090477,0.0007463710050740088,2.5,TPESampler,COMPLETE
824,0.922820092434015,2025-04-24 21:08:59.876495,2025-04-24 21:09:01.623379,0 days 00:00:01.746884,10.084045905008916,Matern,0.011895568990451811,0.44304561303736706,1.5,TPESampler,COMPLETE
825,0.2867972358594688,2025-04-24 21:09:00.816376,2025-04-24 21:09:03.509527,0 days 00:00:02.693151,10.743730042044195,Matern,13.051494291237537,0.00022337641035452479,1.5,TPESampler,COMPLETE
826,0.9228200915223282,2025-04-24 21:09:01.846899,2025-04-24 21:09:03.698286,0 days 00:00:01.851387,1841.8066747354846,Matern,65005.34234041208,0.06170152224581383,1.5,TPESampler,COMPLETE
827,0.9228200922066025,2025-04-24 21:09:02.049060,2025-04-24 21:09:05.041433,0 days 00:00:02.992373,0.0011239222915364567,RBF,11.906618754523704,0.0006969202778959707,1.5,TPESampler,COMPLETE
828,0.2867972257472934,2025-04-24 21:09:03.708887,2025-04-24 21:09:05.299773,0 days 00:00:01.590886,60.06666200237884,Matern,0.5480204956146348,0.00047342540190643763,1.5,TPESampler,COMPLETE
829,0.2867972531155046,2025-04-24 21:09:03.914392,2025-04-24 21:09:05.986709,0 days 00:00:02.072317,0.44280232951842097,Matern,200.23688516918574,0.08933779898470773,1.5,TPESampler,COMPLETE
830,0.9228200924659684,2025-04-24 21:09:05.255304,2025-04-24 21:09:07.316251,0 days 00:00:02.060947,49881.41357987537,Matern,30718.97255442669,9.45868733994498e-05,1.5,TPESampler,COMPLETE
831,0.286797284531977,2025-04-24 21:09:05.559692,2025-04-24 21:09:07.345582,0 days 00:00:01.785890,11.258498412442027,Matern,30.65373517530895,0.009246936849237834,1.5,TPESampler,COMPLETE
832,0.30268458546718807,2025-04-24 21:09:06.234738,2025-04-24 21:09:08.174052,0 days 00:00:01.939314,56029.424758796886,RBF,3.3841228774408756,0.9325161146041632,1.5,TPESampler,COMPLETE
833,0.28679725309490495,2025-04-24 21:09:07.459256,2025-04-24 21:09:09.431715,0 days 00:00:01.972459,1.6779218348924652,Matern,0.7745796985201233,0.004582281797478177,1.5,TPESampler,COMPLETE
834,0.28679728270915406,2025-04-24 21:09:07.507934,2025-04-24 21:09:09.470710,0 days 00:00:01.962776,3.4037677590206727,Matern,1.42924601425502,0.024375578751556895,1.5,TPESampler,COMPLETE
835,0.28679723423431747,2025-04-24 21:09:08.411155,2025-04-24 21:09:10.525565,0 days 00:00:02.114410,3648.521168134509,Matern,584.2493159419143,0.012194097028414095,1.5,TPESampler,COMPLETE
836,0.9228200928475183,2025-04-24 21:09:09.571868,2025-04-24 21:09:12.633501,0 days 00:00:03.061633,0.0008107134371493198,Matern,117.89148268859515,8.576480394536208e-05,1.5,TPESampler,COMPLETE
837,0.9228180120857586,2025-04-24 21:09:09.635393,2025-04-24 21:09:11.217691,0 days 00:00:01.582298,66.11928081949277,Matern,0.11117056922342401,0.5936446217756445,1.5,TPESampler,COMPLETE
838,0.28679725113834226,2025-04-24 21:09:10.757201,2025-04-24 21:09:12.095958,0 days 00:00:01.338757,26.082481310931342,Matern,7.11879844992933,0.12376189835692684,1.5,TPESampler,COMPLETE
839,0.2867972644417229,2025-04-24 21:09:11.462163,2025-04-24 21:09:13.563178,0 days 00:00:02.101015,803.0602296995474,Matern,31.72391495831588,0.00011253453027839482,1.5,TPESampler,COMPLETE
840,0.9228200897837784,2025-04-24 21:09:12.316504,2025-04-24 21:09:14.760167,0 days 00:00:02.443663,5.3442050956658065,Matern,1612.2855592643973,0.00011645814519206746,1.5,TPESampler,COMPLETE
841,0.922820092581573,2025-04-24 21:09:12.873710,2025-04-24 21:09:15.594542,0 days 00:00:02.720832,7.037833994558811e-05,RBF,21.008930834126115,0.011067471316480585,0.5,TPESampler,COMPLETE
842,0.2867971906999562,2025-04-24 21:09:13.767226,2025-04-24 21:09:15.776961,0 days 00:00:02.009735,24.32431880301961,Matern,1271.2098648509518,0.04674792906350679,1.5,TPESampler,COMPLETE
843,0.9228200900907852,2025-04-24 21:09:14.978388,2025-04-24 21:09:16.602178,0 days 00:00:01.623790,0.06893574189665666,Matern,0.028636665661762952,0.005283469050814962,1.5,TPESampler,COMPLETE
844,0.9228200864967488,2025-04-24 21:09:15.850890,2025-04-24 21:09:18.469524,0 days 00:00:02.618634,7.3328632177222675,Matern,180.26070655700406,0.02138279653226319,1.5,TPESampler,COMPLETE
845,0.9228200923813074,2025-04-24 21:09:16.124709,2025-04-24 21:09:18.600770,0 days 00:00:02.476061,1.234456053528423,Matern,600.4255981285878,0.030509811523532385,1.5,TPESampler,COMPLETE
846,0.9228200919014425,2025-04-24 21:09:16.838947,2025-04-24 21:09:19.023732,0 days 00:00:02.184785,8.411995221099312,Matern,1440.8231458679138,0.006400772393723922,1.5,TPESampler,COMPLETE
847,0.9228200934380278,2025-04-24 21:09:18.649794,2025-04-24 21:09:20.862213,0 days 00:00:02.212419,81.68467009991073,Matern,50409.60429336238,0.0026137380023317407,1.5,TPESampler,COMPLETE
848,0.28679723513783373,2025-04-24 21:09:18.831211,2025-04-24 21:09:20.602824,0 days 00:00:01.771613,212.0351660075447,Matern,1.896768025045544,0.0006854950763913293,1.5,TPESampler,COMPLETE
849,0.922820092507959,2025-04-24 21:09:19.221749,2025-04-24 21:09:21.376394,0 days 00:00:02.154645,0.0061630043212958195,RBF,28.283470602383826,1.5109270134903707e-10,0.5,TPESampler,COMPLETE
850,0.28679721911617506,2025-04-24 21:09:20.811014,2025-04-24 21:09:22.803864,0 days 00:00:01.992850,7.720772982192059,Matern,1383.074016842532,0.1386647321809799,1.5,TPESampler,COMPLETE
851,0.2867972516234162,2025-04-24 21:09:21.140731,2025-04-24 21:09:23.609747,0 days 00:00:02.469016,1607.341753630522,Matern,73824.83225703011,0.92484276531716,1.5,TPESampler,COMPLETE
852,0.9494322793428349,2025-04-24 21:09:21.612800,2025-04-24 21:09:22.838885,0 days 00:00:01.226085,1.575223742346368e-06,RBF,77668.91309862905,0.004138896809886407,0.5,TPESampler,COMPLETE
853,0.9228200944968461,2025-04-24 21:09:22.965665,2025-04-24 21:09:25.136983,0 days 00:00:02.171318,0.008462428955687091,Matern,4.534855140002732,0.007918628171471905,1.5,TPESampler,COMPLETE
854,0.9228200924527685,2025-04-24 21:09:23.019926,2025-04-24 21:09:25.048954,0 days 00:00:02.029028,0.1372546511999048,Matern,8.92089746975235,0.010072607598389807,1.5,TPESampler,COMPLETE
855,0.9228200923784049,2025-04-24 21:09:23.818163,2025-04-24 21:09:25.738028,0 days 00:00:01.919865,7.081667255029726,Matern,58.53829983855575,0.00023080932809424508,1.5,TPESampler,COMPLETE
856,0.9494322793417138,2025-04-24 21:09:25.215773,2025-04-24 21:09:26.423226,0 days 00:00:01.207453,87030.42808209962,Matern,2.417189373693477,0.03924677434548867,1.5,TPESampler,COMPLETE
857,0.28679725290956626,2025-04-24 21:09:25.283224,2025-04-24 21:09:27.329051,0 days 00:00:02.045827,326.9226691986434,Matern,1.8423933675205961,0.006088379963600879,1.5,TPESampler,COMPLETE
858,0.2867972328657849,2025-04-24 21:09:26.020353,2025-04-24 21:09:28.106056,0 days 00:00:02.085703,6.9122519219992915,Matern,7.962487999579225,0.0002147498654098318,1.5,TPESampler,COMPLETE
859,0.9494317804802342,2025-04-24 21:09:26.643428,2025-04-24 21:09:28.012795,0 days 00:00:01.369367,21.899684523403355,Matern,0.0009696230335134652,1.8449198436158833e-09,0.5,TPESampler,COMPLETE
860,0.9494322792022691,2025-04-24 21:09:27.544389,2025-04-24 21:09:29.476985,0 days 00:00:01.932596,3.830163614727708,Matern,23174.386779934142,0.06579103896880281,1.5,TPESampler,COMPLETE
861,0.2867972524720712,2025-04-24 21:09:28.201439,2025-04-24 21:09:29.835837,0 days 00:00:01.634398,21.10789613240824,Matern,100.04586460067073,0.1278742107860817,1.5,TPESampler,COMPLETE
862,0.949431780479242,2025-04-24 21:09:28.288375,2025-04-24 21:09:29.742636,0 days 00:00:01.454261,27901.25696638368,Matern,0.0030383679206012304,0.00031744451034535913,1.5,TPESampler,COMPLETE
863,0.9228200854103878,2025-04-24 21:09:29.689962,2025-04-24 21:09:31.743820,0 days 00:00:02.053858,392.94051394732764,Matern,1811.377501435064,0.004003200043391251,1.5,TPESampler,COMPLETE
864,0.9228200925754654,2025-04-24 21:09:30.016510,2025-04-24 21:09:33.543295,0 days 00:00:03.526785,0.00038758620853949116,Matern,2727.506795266269,2.460546021634943e-09,2.5,TPESampler,COMPLETE
865,0.9228200921805482,2025-04-24 21:09:30.061556,2025-04-24 21:09:31.584829,0 days 00:00:01.523273,450.1585531610673,Matern,0.0638115536234694,0.00027495407101422575,1.5,TPESampler,COMPLETE
866,0.9228200931499447,2025-04-24 21:09:31.763186,2025-04-24 21:09:34.698736,0 days 00:00:02.935550,0.007335133142969342,Matern,6.659930375302709e-05,0.6667063236280343,2.5,TPESampler,COMPLETE
867,0.3301888189621647,2025-04-24 21:09:31.968138,2025-04-24 21:09:33.659979,0 days 00:00:01.691841,2.007271369264357,Matern,1.9875101870066914,0.029692977675259368,0.5,TPESampler,COMPLETE
868,0.922820091264451,2025-04-24 21:09:33.721422,2025-04-24 21:09:36.860004,0 days 00:00:03.138582,4.887084123018951e-06,Matern,19269.359100770955,1.8672108635495666e-06,1.5,TPESampler,COMPLETE
869,0.2867973570880869,2025-04-24 21:09:33.872573,2025-04-24 21:09:35.341741,0 days 00:00:01.469168,0.8805342944365535,Matern,1.575483918905412,0.012483633931415421,1.5,TPESampler,COMPLETE
870,0.9494319391412722,2025-04-24 21:09:34.918629,2025-04-24 21:09:36.245646,0 days 00:00:01.327017,5.10381584313287,Matern,12.341865535832426,2.6398104051610784e-07,0.5,TPESampler,COMPLETE
871,0.2867972532486779,2025-04-24 21:09:35.568493,2025-04-24 21:09:37.449596,0 days 00:00:01.881103,3.1893070817103095,Matern,762.266674514143,0.436297716212549,1.5,TPESampler,COMPLETE
872,0.2867972579557193,2025-04-24 21:09:36.456643,2025-04-24 21:09:39.028195,0 days 00:00:02.571552,252.62595248516234,Matern,0.18826770094950002,0.4709949850654847,1.5,TPESampler,COMPLETE
873,0.9228200924756255,2025-04-24 21:09:37.068215,2025-04-24 21:09:39.122782,0 days 00:00:02.054567,30.434506205454372,Matern,2742.6051551984183,0.017597319063894157,1.5,TPESampler,COMPLETE
874,0.2867972696739189,2025-04-24 21:09:37.649067,2025-04-24 21:09:39.155447,0 days 00:00:01.506380,754.7067119984746,Matern,34.17299604440378,0.003851780128814637,1.5,TPESampler,COMPLETE
875,0.28679724483997965,2025-04-24 21:09:39.203788,2025-04-24 21:09:40.609904,0 days 00:00:01.406116,11.319058642555973,Matern,8.711991058128273,0.014367513622678166,1.5,TPESampler,COMPLETE
876,0.9494322792286084,2025-04-24 21:09:39.261432,2025-04-24 21:09:40.643591,0 days 00:00:01.382159,40232.03166002842,Matern,25.28206538052665,3.7132793218919803e-06,1.5,TPESampler,COMPLETE
877,0.9228200927607119,2025-04-24 21:09:39.346810,2025-04-24 21:09:42.165186,0 days 00:00:02.818376,32.4649884077113,Matern,15.51880819796037,4.676705406095042e-05,1.5,TPESampler,COMPLETE
878,0.2867972985153337,2025-04-24 21:09:40.779635,2025-04-24 21:09:42.219891,0 days 00:00:01.440256,5.695356134519793,Matern,5.120516793069599,0.009211590021283057,1.5,TPESampler,COMPLETE
879,0.28679724635793363,2025-04-24 21:09:40.830936,2025-04-24 21:09:42.465513,0 days 00:00:01.634577,0.9750888842025471,Matern,2.8339240239852597,0.0003301787685915216,1.5,TPESampler,COMPLETE
880,0.9228200916939822,2025-04-24 21:09:42.317333,2025-04-24 21:09:45.410410,0 days 00:00:03.093077,0.555011880953073,Matern,9.252221953554093e-05,2.3900206953292974e-06,0.5,TPESampler,COMPLETE
881,0.2867972292735414,2025-04-24 21:09:42.361403,2025-04-24 21:09:44.198823,0 days 00:00:01.837420,129.82620984457756,Matern,0.3042514549332692,0.00021086977447674755,1.5,TPESampler,COMPLETE
882,0.2867972502319131,2025-04-24 21:09:42.680315,2025-04-24 21:09:44.272287,0 days 00:00:01.591972,149.99010182612267,Matern,10.310934505418713,0.035968670536155496,1.5,TPESampler,COMPLETE
883,0.2887076425404568,2025-04-24 21:09:44.413322,2025-04-24 21:09:46.789120,0 days 00:00:02.375798,676.0358122419148,Matern,4.933548593060525,0.03770788876173847,2.5,TPESampler,COMPLETE
884,0.2867972471112864,2025-04-24 21:09:44.474555,2025-04-24 21:09:46.881218,0 days 00:00:02.406663,1.9947501459917543,Matern,0.279321352097445,0.00039538572309944436,1.5,TPESampler,COMPLETE
885,0.9228200706962926,2025-04-24 21:09:45.804369,2025-04-24 21:09:47.465339,0 days 00:00:01.660970,0.050424407184690934,Matern,0.13763250297690122,6.169199668534564e-05,1.5,TPESampler,COMPLETE
886,0.9228200910952516,2025-04-24 21:09:47.001442,2025-04-24 21:09:49.239503,0 days 00:00:02.238061,17.59257634046263,Matern,81.57662531872242,0.017190957757025494,1.5,TPESampler,COMPLETE
887,0.9228200923979708,2025-04-24 21:09:47.052020,2025-04-24 21:09:48.982912,0 days 00:00:01.930892,69883.46767946046,Matern,0.03056674479549028,0.7548181421307071,1.5,TPESampler,COMPLETE
888,0.2867972002278195,2025-04-24 21:09:47.703259,2025-04-24 21:09:49.671337,0 days 00:00:01.968078,13.212650138624955,Matern,269.6424377084131,0.5627790502971474,1.5,TPESampler,COMPLETE
889,0.9228200924750682,2025-04-24 21:09:49.198147,2025-04-24 21:09:51.504864,0 days 00:00:02.306717,14.416332922996993,Matern,45549.09601835574,4.543608020972175e-07,1.5,TPESampler,COMPLETE
890,0.2867973201653695,2025-04-24 21:09:49.508733,2025-04-24 21:09:51.501092,0 days 00:00:01.992359,12.162910332636594,Matern,4644.7795100108015,0.10550629677905526,1.5,TPESampler,COMPLETE
891,0.29528249225737874,2025-04-24 21:09:49.892637,2025-04-24 21:09:54.196933,0 days 00:00:04.304296,14146.950502596997,Matern,0.4473613595111652,3.0051283141797474e-09,1.5,TPESampler,COMPLETE
892,0.33018878972967447,2025-04-24 21:09:51.626745,2025-04-24 21:09:53.258324,0 days 00:00:01.631579,50408.92658891072,Matern,114.5833206312133,0.8853973811533254,0.5,TPESampler,COMPLETE
893,0.9494317801165943,2025-04-24 21:09:51.676251,2025-04-24 21:09:53.086209,0 days 00:00:01.409958,8955.046834537927,Matern,0.15466349537900334,1.935416809441011e-08,2.5,TPESampler,COMPLETE
894,0.28679725684185803,2025-04-24 21:09:53.267905,2025-04-24 21:09:55.300780,0 days 00:00:02.032875,19.77170791439947,Matern,1626.750188761035,0.10552252664212614,1.5,TPESampler,COMPLETE
895,0.286797249713752,2025-04-24 21:09:53.458458,2025-04-24 21:09:55.206547,0 days 00:00:01.748089,10.052299619422364,Matern,75.15397095711957,0.2576862581550922,1.5,TPESampler,COMPLETE
896,0.28679718037396695,2025-04-24 21:09:54.415401,2025-04-24 21:09:58.548527,0 days 00:00:04.133126,0.3427149119409207,Matern,1808.0686641892787,0.1983272582875952,1.5,TPESampler,COMPLETE
897,0.9228200913627036,2025-04-24 21:09:55.370427,2025-04-24 21:09:57.038059,0 days 00:00:01.667632,0.00011175919005185424,RBF,0.00718972124373858,4.335208416110765e-10,1.5,TPESampler,COMPLETE
898,0.28870764533025345,2025-04-24 21:09:55.505616,2025-04-24 21:09:57.429643,0 days 00:00:01.924027,0.08219307390463253,Matern,94.4899479784191,0.3538661163038794,2.5,TPESampler,COMPLETE
899,0.28679724264510803,2025-04-24 21:09:57.258199,2025-04-24 21:09:59.177205,0 days 00:00:01.919006,75289.53770272434,Matern,26.656930375355973,0.0009953479343405278,1.5,TPESampler,COMPLETE
900,0.2867971826079066,2025-04-24 21:09:57.664608,2025-04-24 21:10:00.072921,0 days 00:00:02.408313,226.78697699755273,Matern,3234.483893324179,0.07729758184969256,1.5,TPESampler,COMPLETE
901,0.9228200919120655,2025-04-24 21:09:58.763920,2025-04-24 21:10:01.827241,0 days 00:00:03.063321,0.3515589830077687,Matern,4833.858312653276,0.02141082209223105,1.5,TPESampler,COMPLETE
902,0.28679724840022064,2025-04-24 21:09:59.472529,2025-04-24 21:10:01.005471,0 days 00:00:01.532942,1.725489539824915,Matern,26.113049396348906,0.23890567169963675,1.5,TPESampler,COMPLETE
903,0.949432279262046,2025-04-24 21:10:00.303545,2025-04-24 21:10:02.085783,0 days 00:00:01.782238,0.13665845337087013,Matern,17600.824620670563,0.5692008922216728,1.5,TPESampler,COMPLETE
904,0.9228200925229614,2025-04-24 21:10:01.218373,2025-04-24 21:10:04.019041,0 days 00:00:02.800668,3.2504664702107933,Matern,22648.071882983124,0.009507834277883953,1.5,TPESampler,COMPLETE
905,0.2867972462318288,2025-04-24 21:10:02.038520,2025-04-24 21:10:04.078003,0 days 00:00:02.039483,117.64393657307622,Matern,50876.70334783307,0.08182481448479745,1.5,TPESampler,COMPLETE
906,0.28679725274733076,2025-04-24 21:10:02.344826,2025-04-24 21:10:04.652046,0 days 00:00:02.307220,6682.042607091254,Matern,4737.974707536604,0.04760626169548966,1.5,TPESampler,COMPLETE
907,0.9494317804790657,2025-04-24 21:10:04.186800,2025-04-24 21:10:05.474228,0 days 00:00:01.287428,7388.297004592216,RBF,0.0015119718965434052,0.0002136851215319107,0.5,TPESampler,COMPLETE
908,0.9228200928524368,2025-04-24 21:10:04.240916,2025-04-24 21:10:06.860585,0 days 00:00:02.619669,2091.972511007516,Matern,4415.35444624717,0.004726162868636812,1.5,TPESampler,COMPLETE
909,0.9494322791255793,2025-04-24 21:10:04.958352,2025-04-24 21:10:06.554989,0 days 00:00:01.596637,0.09275995434375064,Matern,10857.819693723872,0.8714332400861274,1.5,TPESampler,COMPLETE
910,0.9228201030934766,2025-04-24 21:10:05.699700,2025-04-24 21:10:08.032700,0 days 00:00:02.333000,11.629801565699289,RBF,392.03440160786914,0.012783601721539051,1.5,TPESampler,COMPLETE
911,0.28679726573712877,2025-04-24 21:10:06.772443,2025-04-24 21:10:08.866917,0 days 00:00:02.094474,33.43345486546673,Matern,2878.95760819943,0.5314983213931861,1.5,TPESampler,COMPLETE
912,0.9228200923316227,2025-04-24 21:10:07.088393,2025-04-24 21:10:09.553532,0 days 00:00:02.465139,2.106707542276261,Matern,6379.816691514093,0.0005584259906962726,1.5,TPESampler,COMPLETE
913,0.9228200814029143,2025-04-24 21:10:08.244964,2025-04-24 21:10:10.021795,0 days 00:00:01.776831,24.32870476283155,RBF,37.17456701655501,1.4726448305939391e-05,1.5,TPESampler,COMPLETE
914,0.9228200914087932,2025-04-24 21:10:09.066728,2025-04-24 21:10:11.692459,0 days 00:00:02.625731,178.96168641723995,Matern,785.2385323312153,0.016470605554098718,1.5,TPESampler,COMPLETE
915,0.9228200881795513,2025-04-24 21:10:09.793123,2025-04-24 21:10:12.964636,0 days 00:00:03.171513,0.1619304804036986,Matern,1847.3274149798206,0.005544934349728175,1.5,TPESampler,COMPLETE
916,0.9228200899499708,2025-04-24 21:10:10.250004,2025-04-24 21:10:12.319870,0 days 00:00:02.069866,334.5122530950703,Matern,34872.75868509674,0.018762569954919567,1.5,TPESampler,COMPLETE
917,0.2867972494948361,2025-04-24 21:10:11.914646,2025-04-24 21:10:14.054017,0 days 00:00:02.139371,1.5946394953118577,Matern,1399.4015276907867,0.4722311682366585,1.5,TPESampler,COMPLETE
