number,value,datetime_start,datetime_complete,duration,params_constant_value,params_kernel_type,params_length_scale,params_noise_level,params_nu,system_attrs_auto:sampler,state
2400,0.2867972259418562,2025-04-24 21:28:11.587189,2025-04-24 21:28:13.371796,0 days 00:00:01.784607,88.20983027189891,Matern,0.38189377059784135,0.006678555811092033,1.5,TPESampler,COMPLETE
2401,0.28679725860328453,2025-04-24 21:28:12.502863,2025-04-24 21:28:14.367612,0 days 00:00:01.864749,27.399501104738544,Matern,198.91707172958266,0.04538281559135476,1.5,TPESampler,COMPLETE
2402,0.2867972629076731,2025-04-24 21:28:12.638687,2025-04-24 21:28:15.139868,0 days 00:00:02.501181,41119.765820985434,Matern,489.1923376780475,0.044300734205095796,1.5,TPESampler,COMPLETE
2403,0.2867972426834975,2025-04-24 21:28:13.601727,2025-04-24 21:28:15.862388,0 days 00:00:02.260661,3515.5597391086862,Matern,6.743531780498455,0.0028245970930965156,1.5,TPESampler,COMPLETE
2404,0.9494317804785631,2025-04-24 21:28:14.590780,2025-04-24 21:28:16.352638,0 days 00:00:01.761858,4774.726822911003,Matern,0.02689165677000323,0.00026104572639384005,1.5,TPESampler,COMPLETE
2405,0.28679727222598145,2025-04-24 21:28:15.478645,2025-04-24 21:28:18.105920,0 days 00:00:02.627275,313.14841309310106,Matern,0.21219397452534638,0.013291137147791423,1.5,TPESampler,COMPLETE
2406,0.9228200931604166,2025-04-24 21:28:16.285868,2025-04-24 21:28:19.257968,0 days 00:00:02.972100,2488.5453627549255,Matern,84475.47505448844,0.002177142260465922,1.5,TPESampler,COMPLETE
2407,0.9228200924825226,2025-04-24 21:28:16.714059,2025-04-24 21:28:18.168956,0 days 00:00:01.454897,88.98389460654785,Matern,0.000842982982290223,0.0052747595782656805,1.5,TPESampler,COMPLETE
2408,0.9228200927979318,2025-04-24 21:28:18.291298,2025-04-24 21:28:19.779643,0 days 00:00:01.488345,62.24240279174974,Matern,118.11367657569495,0.002202883555955849,1.5,TPESampler,COMPLETE
2409,0.9228200924209702,2025-04-24 21:28:18.333601,2025-04-24 21:28:20.115724,0 days 00:00:01.782123,377.98480791209835,Matern,570.3904717879374,7.062098257171549e-05,1.5,TPESampler,COMPLETE
2410,0.9228200914571494,2025-04-24 21:28:19.499401,2025-04-24 21:28:22.098726,0 days 00:00:02.599325,0.7268702137572663,Matern,2461.1406895518003,0.020825108099685304,1.5,TPESampler,COMPLETE
2411,0.9494322782758183,2025-04-24 21:28:20.052368,2025-04-24 21:28:21.319425,0 days 00:00:01.267057,45.884307876569075,Matern,15.358251850643988,4.861771294663384e-05,1.5,TPESampler,COMPLETE
2412,0.2867970955028786,2025-04-24 21:28:20.370045,2025-04-24 21:28:22.184905,0 days 00:00:01.814860,0.9407055467628197,Matern,91.55905126906327,0.04502988368168876,1.5,TPESampler,COMPLETE
2413,0.2867972546901945,2025-04-24 21:28:21.557979,2025-04-24 21:28:23.275721,0 days 00:00:01.717742,9.202820303885211,Matern,19.553743447431515,0.9220840342024887,1.5,TPESampler,COMPLETE
2414,0.9494322309715972,2025-04-24 21:28:22.296967,2025-04-24 21:28:24.672164,0 days 00:00:02.375197,0.014897454023135472,Matern,1680.2314219290581,0.04265478863619341,1.5,TPESampler,COMPLETE
2415,0.9228200924808396,2025-04-24 21:28:22.441157,2025-04-24 21:28:24.398740,0 days 00:00:01.957583,0.013570119403055166,Matern,6977.824309676494,0.003071380882518552,1.5,TPESampler,COMPLETE
2416,0.9228200925240235,2025-04-24 21:28:23.521608,2025-04-24 21:28:25.519661,0 days 00:00:01.998053,0.006844717195290659,Matern,0.0023341715770440587,1.0194227856458266e-10,0.5,TPESampler,COMPLETE
2417,0.30268458373875584,2025-04-24 21:28:24.618712,2025-04-24 21:28:27.016820,0 days 00:00:02.398108,24845.063198602627,RBF,4.160461518450402,0.0007506659954066958,1.5,TPESampler,COMPLETE
2418,0.922820092472322,2025-04-24 21:28:24.958670,2025-04-24 21:28:27.298747,0 days 00:00:02.340077,0.19668666988908737,Matern,1220.076715754219,0.0006335372756337155,1.5,TPESampler,COMPLETE
2419,0.9228200942107186,2025-04-24 21:28:25.744985,2025-04-24 21:28:28.915859,0 days 00:00:03.170874,0.02329490255676495,Matern,115.5477746430416,0.010008317055205591,1.5,TPESampler,COMPLETE
2420,0.9228200924939691,2025-04-24 21:28:27.241944,2025-04-24 21:28:30.141255,0 days 00:00:02.899311,2.843153011943202,Matern,8093.538956766457,0.009040955355745466,1.5,TPESampler,COMPLETE
2421,0.28679724309315896,2025-04-24 21:28:27.616682,2025-04-24 21:28:29.085708,0 days 00:00:01.469026,5.269784527713527,Matern,36.594744687560905,0.03717899550634892,1.5,TPESampler,COMPLETE
2422,0.9494322672758873,2025-04-24 21:28:29.107378,2025-04-24 21:28:30.225521,0 days 00:00:01.118143,40559.370077909574,Matern,88.4218947017016,0.021976291498801214,0.5,TPESampler,COMPLETE
2423,0.9228200926192588,2025-04-24 21:28:29.384267,2025-04-24 21:28:31.605454,0 days 00:00:02.221187,6.184398040180899,Matern,55.50742645255115,1.5524946964223666e-07,2.5,TPESampler,COMPLETE
2424,0.2867972528267829,2025-04-24 21:28:30.317909,2025-04-24 21:28:32.314899,0 days 00:00:01.996990,3.6894111572130277,Matern,232.68492120296773,0.051896975781312284,1.5,TPESampler,COMPLETE
2425,0.3026845873546376,2025-04-24 21:28:30.447929,2025-04-24 21:28:32.944265,0 days 00:00:02.496336,52017.02976681833,RBF,60.93019330356376,0.0016437657766331067,2.5,TPESampler,COMPLETE
2426,0.9494317780931932,2025-04-24 21:28:31.837898,2025-04-24 21:28:33.346585,0 days 00:00:01.508687,1291.1119142353975,Matern,0.16323939723777023,4.031066721975868e-05,1.5,TPESampler,COMPLETE
2427,0.28679727305839153,2025-04-24 21:28:32.582302,2025-04-24 21:28:34.858682,0 days 00:00:02.276380,1.4058222653827945,Matern,45.76386559797476,0.030151198413898184,1.5,TPESampler,COMPLETE
2428,0.9494317804776582,2025-04-24 21:28:33.160907,2025-04-24 21:28:34.457089,0 days 00:00:01.296182,96.77772457432513,Matern,0.03195427273870873,0.019296837085667796,1.5,TPESampler,COMPLETE
2429,0.28679725333258077,2025-04-24 21:28:33.583038,2025-04-24 21:28:36.087799,0 days 00:00:02.504761,0.4932027461112149,Matern,6074.841322769315,0.03474161713258874,1.5,TPESampler,COMPLETE
2430,0.28679723867257145,2025-04-24 21:28:34.678985,2025-04-24 21:28:36.658265,0 days 00:00:01.979280,138.6079715291091,Matern,3.6321072961798007,0.000278519592686423,1.5,TPESampler,COMPLETE
2431,0.2867972506439171,2025-04-24 21:28:35.115826,2025-04-24 21:28:36.974034,0 days 00:00:01.858208,0.3228276443059739,Matern,314.7305791175548,0.12109389398154707,1.5,TPESampler,COMPLETE
2432,0.9493908771645567,2025-04-24 21:28:36.368262,2025-04-24 21:28:38.049077,0 days 00:00:01.680815,32653.262353633658,Matern,0.013339924212339956,0.0010043559332267844,0.5,TPESampler,COMPLETE
2433,0.4637578632623254,2025-04-24 21:28:36.920884,2025-04-24 21:28:40.568477,0 days 00:00:03.647593,0.3257564525000063,Matern,3923.156899428535,0.07355147047314602,1.5,TPESampler,COMPLETE
2434,0.33016728474301343,2025-04-24 21:28:37.336251,2025-04-24 21:28:38.942131,0 days 00:00:01.605880,268.1458468952733,Matern,23.15109239710747,0.006987288555240744,0.5,TPESampler,COMPLETE
2435,0.9228200920424258,2025-04-24 21:28:38.294742,2025-04-24 21:28:40.569733,0 days 00:00:02.274991,919.7513830791187,RBF,876.2978431804115,4.079309224009162e-06,1.5,TPESampler,COMPLETE
2436,0.9228201073101949,2025-04-24 21:28:39.180129,2025-04-24 21:28:41.487641,0 days 00:00:02.307512,1.29938319211174,Matern,269.21164138855136,0.019220150039482436,1.5,TPESampler,COMPLETE
2437,0.28679703825262826,2025-04-24 21:28:40.761265,2025-04-24 21:28:45.402444,0 days 00:00:04.641179,43354.02501385451,Matern,0.17902836042065462,0.0059578083905055665,1.5,TPESampler,COMPLETE
2438,0.9494317804277411,2025-04-24 21:28:40.801276,2025-04-24 21:28:42.663496,0 days 00:00:01.862220,82644.39970512732,Matern,0.01759923439223025,0.053018377738790756,1.5,TPESampler,COMPLETE
2439,0.28679721676284126,2025-04-24 21:28:41.831881,2025-04-24 21:28:44.781480,0 days 00:00:02.949599,3125.154692435579,Matern,2788.820790461915,0.30147938350545034,1.5,TPESampler,COMPLETE
2440,0.28870764916363695,2025-04-24 21:28:42.895964,2025-04-24 21:28:46.650621,0 days 00:00:03.754657,48.81329354594873,Matern,0.4274562634222072,4.9335002218509645e-05,2.5,TPESampler,COMPLETE
2441,0.949432279331403,2025-04-24 21:28:45.019782,2025-04-24 21:28:46.391870,0 days 00:00:01.372088,68778.25477749077,Matern,7.1419695297781365,7.98387248022431e-05,1.5,TPESampler,COMPLETE
2442,0.28679727080108974,2025-04-24 21:28:45.618661,2025-04-24 21:28:47.601696,0 days 00:00:01.983035,22862.572595381094,Matern,0.372582118361563,0.08937510840123548,1.5,TPESampler,COMPLETE
2443,0.9228200922095062,2025-04-24 21:28:46.612645,2025-04-24 21:28:49.389001,0 days 00:00:02.776356,3789.3987542854343,Matern,0.00022781235199692798,0.0006066513414701506,1.5,TPESampler,COMPLETE
2444,0.9228200932043958,2025-04-24 21:28:46.893419,2025-04-24 21:28:48.612828,0 days 00:00:01.719409,944.6949109197828,Matern,0.030331731176884542,0.39366401274495894,1.5,TPESampler,COMPLETE
2445,0.9464325900148489,2025-04-24 21:28:47.882159,2025-04-24 21:28:50.619104,0 days 00:00:02.736945,12829.992034533214,Matern,0.0007510087294158353,0.0016094041757964478,1.5,TPESampler,COMPLETE
2446,0.9228200992418016,2025-04-24 21:28:48.833669,2025-04-24 21:28:50.404027,0 days 00:00:01.570358,857.1820445187751,Matern,0.0755159203627168,0.10570474299635949,1.5,TPESampler,COMPLETE
2447,0.9228200935191343,2025-04-24 21:28:49.627916,2025-04-24 21:28:52.286101,0 days 00:00:02.658185,630.7178783914111,RBF,6.971035111880346,2.9781613870181325e-07,2.5,TPESampler,COMPLETE
2448,0.9494317804754432,2025-04-24 21:28:50.625578,2025-04-24 21:28:52.253331,0 days 00:00:01.627753,62140.17721187002,Matern,0.01370516010073222,0.027288523244838915,1.5,TPESampler,COMPLETE
2449,0.28679713982881355,2025-04-24 21:28:50.855118,2025-04-24 21:28:53.228835,0 days 00:00:02.373717,22601.99885894713,Matern,1.0767996178511765,0.10450710553550337,1.5,TPESampler,COMPLETE
2450,0.9228200893892297,2025-04-24 21:28:52.436776,2025-04-24 21:28:54.217193,0 days 00:00:01.780417,1283.07290541578,Matern,0.046595293090427675,0.08295849282033596,1.5,TPESampler,COMPLETE
2451,0.2867972753978867,2025-04-24 21:28:52.469136,2025-04-24 21:28:55.426614,0 days 00:00:02.957478,12578.366107813503,Matern,0.2012581668000411,0.009653168568255684,1.5,TPESampler,COMPLETE
2452,0.9494317804762598,2025-04-24 21:28:53.498598,2025-04-24 21:28:54.744595,0 days 00:00:01.245997,11.28059392703186,Matern,6.66628295084387e-05,0.00012505650652630068,0.5,TPESampler,COMPLETE
2453,0.9494317804784219,2025-04-24 21:28:54.451799,2025-04-24 21:28:55.911542,0 days 00:00:01.459743,86516.64501433219,RBF,0.0026778572626390694,0.0011665229102314327,1.5,TPESampler,COMPLETE
2454,0.28679726234131403,2025-04-24 21:28:55.027525,2025-04-24 21:28:56.731796,0 days 00:00:01.704271,6271.2243106347405,Matern,2.283786158959286,0.15456184404030637,1.5,TPESampler,COMPLETE
2455,0.9228200903774822,2025-04-24 21:28:55.649085,2025-04-24 21:28:57.423962,0 days 00:00:01.774877,13123.3987785946,Matern,0.0018532426504311377,0.005113803227759971,1.5,TPESampler,COMPLETE
2456,0.9494322793417138,2025-04-24 21:28:56.173200,2025-04-24 21:28:57.398812,0 days 00:00:01.225612,15119.368701342497,Matern,0.65357737523377,0.04553529648031272,1.5,TPESampler,COMPLETE
2457,0.9228200924148349,2025-04-24 21:28:56.961955,2025-04-24 21:29:00.476152,0 days 00:00:03.514197,5613.837234309483,Matern,0.004392485512999284,0.0018963717416343093,1.5,TPESampler,COMPLETE
2458,0.28679725284957747,2025-04-24 21:28:57.635869,2025-04-24 21:28:59.804551,0 days 00:00:02.168682,23850.06438428743,Matern,1.286696336848018,0.005306981888035889,1.5,TPESampler,COMPLETE
2459,0.9228200924917294,2025-04-24 21:28:57.791784,2025-04-24 21:29:01.323692,0 days 00:00:03.531908,6652.882933494623,Matern,0.01033131769577405,0.0007778264024107236,2.5,TPESampler,COMPLETE
2460,0.28679725147115337,2025-04-24 21:29:00.078931,2025-04-24 21:29:02.023893,0 days 00:00:01.944962,3445.736409286996,Matern,1.4419898231512165,0.000617402927940076,1.5,TPESampler,COMPLETE
2461,0.28679725342569123,2025-04-24 21:29:00.796117,2025-04-24 21:29:02.652776,0 days 00:00:01.856659,7545.4858303276005,Matern,2.478477492693226,0.618378854809386,1.5,TPESampler,COMPLETE
2462,0.286797257265514,2025-04-24 21:29:01.589062,2025-04-24 21:29:03.684243,0 days 00:00:02.095181,70103.71240896184,Matern,4.03775234183129,0.0022242647656569707,1.5,TPESampler,COMPLETE
2463,0.28679727650186165,2025-04-24 21:29:02.267179,2025-04-24 21:29:03.847824,0 days 00:00:01.580645,46527.15519100072,Matern,0.9295374626317007,0.3215411571312707,1.5,TPESampler,COMPLETE
2464,0.9494317804801456,2025-04-24 21:29:02.905766,2025-04-24 21:29:03.932995,0 days 00:00:01.027229,3.550295696263777e-07,Matern,0.00017856967881712743,0.9767437804242178,2.5,TPESampler,COMPLETE
2465,0.9494317804449636,2025-04-24 21:29:03.895663,2025-04-24 21:29:05.150514,0 days 00:00:01.254851,9134.441809374624,Matern,0.12620845878779224,0.03931625843880702,2.5,TPESampler,COMPLETE
2466,0.949431778866624,2025-04-24 21:29:04.138172,2025-04-24 21:29:05.873977,0 days 00:00:01.735805,17442.05509821055,Matern,0.15692795227789672,0.03679882050290942,1.5,TPESampler,COMPLETE
2467,0.9228200925725251,2025-04-24 21:29:04.242638,2025-04-24 21:29:07.135943,0 days 00:00:02.893305,66811.72550698277,Matern,0.023193305493963857,0.007077272820283901,1.5,TPESampler,COMPLETE
2468,0.9494317804615076,2025-04-24 21:29:05.500085,2025-04-24 21:29:07.548323,0 days 00:00:02.048238,11542.0271910358,Matern,0.01504973824246551,0.02109047049483565,1.5,TPESampler,COMPLETE
2469,0.9228200920975158,2025-04-24 21:29:06.239315,2025-04-24 21:29:08.642470,0 days 00:00:02.403155,12189.145748645324,Matern,0.05683117597700056,0.004198297236202708,1.5,TPESampler,COMPLETE
2470,0.949432277757684,2025-04-24 21:29:07.511671,2025-04-24 21:29:08.815290,0 days 00:00:01.303619,98.26243961268138,RBF,0.9761296712373583,1.409253209656504e-10,2.5,TPESampler,COMPLETE
2471,0.9228190390457995,2025-04-24 21:29:07.790291,2025-04-24 21:29:09.783473,0 days 00:00:01.993182,7079.782046180197,Matern,0.07427514879853145,0.01193791816999207,0.5,TPESampler,COMPLETE
2472,0.28679725370775383,2025-04-24 21:29:08.845449,2025-04-24 21:29:10.482612,0 days 00:00:01.637163,2171.8339168152993,Matern,4.562830554468535,0.0736046332680723,1.5,TPESampler,COMPLETE
2473,0.9494321511244205,2025-04-24 21:29:09.129791,2025-04-24 21:29:10.474546,0 days 00:00:01.344755,2171.605435663508,Matern,0.48006915556846574,0.04445126742517394,1.5,TPESampler,COMPLETE
2474,0.9228200931977276,2025-04-24 21:29:10.032630,2025-04-24 21:29:11.876714,0 days 00:00:01.844084,59608.697445616905,Matern,0.029970123606870087,0.8784011334342431,1.5,TPESampler,COMPLETE
2475,0.9494322793417138,2025-04-24 21:29:10.689725,2025-04-24 21:29:11.852312,0 days 00:00:01.162587,18368.5949758044,Matern,2.036209678872091,0.020010745654780074,1.5,TPESampler,COMPLETE
2476,0.922820093755286,2025-04-24 21:29:10.934019,2025-04-24 21:29:12.949586,0 days 00:00:02.015567,4848.8756265718675,Matern,0.06479029445113897,0.007602906676470565,1.5,TPESampler,COMPLETE
2477,0.28679734171797966,2025-04-24 21:29:12.025865,2025-04-24 21:29:14.018235,0 days 00:00:01.992370,68432.62609633713,Matern,2.1749431074831143,0.008343282402334149,1.5,TPESampler,COMPLETE
2478,0.9228200927062193,2025-04-24 21:29:12.072776,2025-04-24 21:29:13.676105,0 days 00:00:01.603329,0.0032546759516023215,RBF,5.2331028727827135e-05,2.2259245020362266e-06,1.5,TPESampler,COMPLETE
2479,0.28679725048302024,2025-04-24 21:29:13.195817,2025-04-24 21:29:14.758901,0 days 00:00:01.563084,42185.95338577656,Matern,0.49054629823138424,0.001408617550236544,1.5,TPESampler,COMPLETE
2480,0.9494316696592621,2025-04-24 21:29:13.928592,2025-04-24 21:29:15.377211,0 days 00:00:01.448619,95273.2893707404,Matern,0.25776084150567946,0.001061680026831314,1.5,TPESampler,COMPLETE
2481,0.2867972515187348,2025-04-24 21:29:14.324191,2025-04-24 21:29:16.085997,0 days 00:00:01.761806,42661.201835262356,Matern,0.4976740117249117,0.41050701657637756,1.5,TPESampler,COMPLETE
2482,0.9494317802241588,2025-04-24 21:29:14.975448,2025-04-24 21:29:16.249446,0 days 00:00:01.273998,90839.12045737362,Matern,0.13314968017414958,2.4891937251122e-05,1.5,TPESampler,COMPLETE
2483,0.9494322793417138,2025-04-24 21:29:15.614368,2025-04-24 21:29:16.989061,0 days 00:00:01.374693,7629.408711972151,Matern,0.9954113130118537,0.038718136142960685,1.5,TPESampler,COMPLETE
2484,0.286797347092237,2025-04-24 21:29:16.292479,2025-04-24 21:29:18.661151,0 days 00:00:02.368672,14406.034771946075,Matern,0.12648748654631947,0.09036758555388472,1.5,TPESampler,COMPLETE
2485,0.28679721531899277,2025-04-24 21:29:16.481572,2025-04-24 21:29:19.031235,0 days 00:00:02.549663,69189.68048686374,Matern,0.16905878139098865,0.0063937508664788315,1.5,TPESampler,COMPLETE
2486,0.9228187332535879,2025-04-24 21:29:17.237303,2025-04-24 21:29:18.647312,0 days 00:00:01.410009,88982.69959781531,Matern,0.1082902985522534,0.07185409741448119,1.5,TPESampler,COMPLETE
2487,0.949431099751189,2025-04-24 21:29:18.825012,2025-04-24 21:29:20.172032,0 days 00:00:01.347020,37848.868427971494,Matern,0.307259222101774,0.0004672069116642874,1.5,TPESampler,COMPLETE
2488,0.9494322793417138,2025-04-24 21:29:18.865934,2025-04-24 21:29:20.042268,0 days 00:00:01.176334,72593.98147222822,Matern,10.258129078230873,0.023579667311542034,1.5,TPESampler,COMPLETE
2489,0.94943178047398,2025-04-24 21:29:19.352145,2025-04-24 21:29:20.536598,0 days 00:00:01.184453,19736.029512712445,RBF,0.06633077667369068,0.03374411553777171,0.5,TPESampler,COMPLETE
2490,0.2867972533232396,2025-04-24 21:29:20.260680,2025-04-24 21:29:22.226679,0 days 00:00:01.965999,17029.9127845689,Matern,92.71310964605885,0.122216718984295,1.5,TPESampler,COMPLETE
2491,0.2867972456115977,2025-04-24 21:29:20.411134,2025-04-24 21:29:22.175448,0 days 00:00:01.764314,30764.52431124193,Matern,2.826758276053821,0.24506555925766607,1.5,TPESampler,COMPLETE
2492,0.922820087400891,2025-04-24 21:29:20.840771,2025-04-24 21:29:22.575030,0 days 00:00:01.734259,17345.073783808886,Matern,0.045965962315241374,0.006486987988093053,1.5,TPESampler,COMPLETE
2493,0.9494317804756734,2025-04-24 21:29:22.360700,2025-04-24 21:29:23.698883,0 days 00:00:01.338183,70215.30372836701,Matern,0.09969863872676793,0.00010875509141800897,1.5,TPESampler,COMPLETE
2494,0.9494317798053972,2025-04-24 21:29:22.513945,2025-04-24 21:29:23.888661,0 days 00:00:01.374716,68657.8481690158,Matern,0.14466709173956546,0.01256281979780286,1.5,TPESampler,COMPLETE
2495,0.28679726022867724,2025-04-24 21:29:22.948011,2025-04-24 21:29:24.757964,0 days 00:00:01.809953,75111.14956387649,Matern,0.6039485479754894,0.14837463477889684,1.5,TPESampler,COMPLETE
2496,0.286797255180609,2025-04-24 21:29:23.887610,2025-04-24 21:29:25.771262,0 days 00:00:01.883652,11110.796149370191,Matern,4.351325297665423,0.9338081422900204,1.5,TPESampler,COMPLETE
2497,0.28679725919726157,2025-04-24 21:29:24.153696,2025-04-24 21:29:25.764459,0 days 00:00:01.610763,42003.442674764905,Matern,3.968571739184943,0.051029761145722066,1.5,TPESampler,COMPLETE
2498,0.9228200889716968,2025-04-24 21:29:25.020831,2025-04-24 21:29:27.236634,0 days 00:00:02.215803,8058.772417846523,Matern,0.06495251244701235,0.0005950743360995087,1.5,TPESampler,COMPLETE
2499,0.9228200933667193,2025-04-24 21:29:25.960196,2025-04-24 21:29:27.474266,0 days 00:00:01.514070,97310.10119038101,Matern,7396.885600311467,1.2281842420145196e-06,1.5,TPESampler,COMPLETE
