number,value,datetime_start,datetime_complete,duration,params_constant_value,params_kernel_type,params_length_scale,params_noise_level,params_nu,system_attrs_auto:sampler,state
1944,0.30268458458832737,2025-04-24 21:22:43.502257,2025-04-24 21:22:45.656666,0 days 00:00:02.154409,50698.53922572953,RBF,41.218771636679264,0.0038252355789378943,1.5,TPESampler,COMPLETE
1945,0.2867964201531341,2025-04-24 21:22:43.826821,2025-04-24 21:22:45.709975,0 days 00:00:01.883154,0.9139762917618747,Matern,42.77436948149707,0.0662514638886213,1.5,TPESampler,COMPLETE
1946,0.9228200924718969,2025-04-24 21:22:44.398411,2025-04-24 21:22:45.865430,0 days 00:00:01.467019,2.580750054624724,Matern,0.005631219621132483,0.5812200105997731,1.5,TPESampler,COMPLETE
1947,0.28679725134352985,2025-04-24 21:22:45.832435,2025-04-24 21:22:47.586503,0 days 00:00:01.754068,0.012155858881767687,Matern,39.521484015036805,0.06708307831543657,1.5,TPESampler,COMPLETE
1948,0.9228200917442523,2025-04-24 21:22:45.868062,2025-04-24 21:22:48.354507,0 days 00:00:02.486445,5.640665248658813,Matern,464.8684110551821,0.03857717518445016,1.5,TPESampler,COMPLETE
1949,0.28679725180699245,2025-04-24 21:22:46.117632,2025-04-24 21:22:48.125242,0 days 00:00:02.007610,0.2597176378526451,Matern,501.68517374237894,0.4376191457595411,1.5,TPESampler,COMPLETE
1950,0.9228200904792829,2025-04-24 21:22:47.819853,2025-04-24 21:22:50.361182,0 days 00:00:02.541329,0.00014787722135155921,Matern,440.9169878141179,0.005610229238465995,1.5,TPESampler,COMPLETE
1951,0.2867972498530717,2025-04-24 21:22:48.412044,2025-04-24 21:22:49.852048,0 days 00:00:01.440004,0.10816047015195264,Matern,25.667077820224105,0.5325413879203333,1.5,TPESampler,COMPLETE
1952,0.28679722693423704,2025-04-24 21:22:48.663126,2025-04-24 21:22:50.142023,0 days 00:00:01.478897,1.728083748877396,Matern,76.14256073535242,0.24233450737071693,1.5,TPESampler,COMPLETE
1953,0.9494322793175586,2025-04-24 21:22:50.090031,2025-04-24 21:22:51.562083,0 days 00:00:01.472052,63111.505761121545,Matern,88.47835914041309,2.792362533466514e-05,1.5,TPESampler,COMPLETE
1954,0.2867972167825973,2025-04-24 21:22:50.423708,2025-04-24 21:22:52.211604,0 days 00:00:01.787896,177.47804281102825,Matern,13.347605706762586,0.8908163069198599,1.5,TPESampler,COMPLETE
1955,0.2887076467751044,2025-04-24 21:22:50.612173,2025-04-24 21:22:52.429097,0 days 00:00:01.816924,1.2475456334236141,Matern,53.62476147371666,0.1860975794045166,2.5,TPESampler,COMPLETE
1956,0.2867972543049524,2025-04-24 21:22:51.832637,2025-04-24 21:22:53.686494,0 days 00:00:01.853857,188.71763079008628,Matern,67.05625907959444,0.04026449034849125,1.5,TPESampler,COMPLETE
1957,0.33018953124961886,2025-04-24 21:22:52.461552,2025-04-24 21:22:54.008527,0 days 00:00:01.546975,80.80127955174592,Matern,8.93532079367535,0.007453543451832566,0.5,TPESampler,COMPLETE
1958,0.2867972531295962,2025-04-24 21:22:52.683353,2025-04-24 21:22:54.425848,0 days 00:00:01.742495,0.04189203040607,Matern,97.74643560075357,0.07886103687609315,1.5,TPESampler,COMPLETE
1959,0.922820092474365,2025-04-24 21:22:53.917202,2025-04-24 21:22:56.158047,0 days 00:00:02.240845,16.375624065740976,Matern,740.8653149777988,0.002599863529469595,1.5,TPESampler,COMPLETE
1960,0.2867972550662636,2025-04-24 21:22:54.296076,2025-04-24 21:22:55.866186,0 days 00:00:01.570110,0.9536160086619956,Matern,164.3860772541392,0.20271829247268816,1.5,TPESampler,COMPLETE
1961,0.28679725404934836,2025-04-24 21:22:54.760510,2025-04-24 21:22:56.569523,0 days 00:00:01.809013,205.33503809754237,Matern,8.672009220783568,0.01545790481118011,1.5,TPESampler,COMPLETE
1962,0.2867972530087446,2025-04-24 21:22:56.089332,2025-04-24 21:22:58.028589,0 days 00:00:01.939257,1667.2330933861558,Matern,669.9703894567126,0.038262251889799745,1.5,TPESampler,COMPLETE
1963,0.922820095298915,2025-04-24 21:22:56.509250,2025-04-24 21:22:58.213391,0 days 00:00:01.704141,4.92697359213357,Matern,1781.476440215335,0.005347867405634564,0.5,TPESampler,COMPLETE
1964,0.2867972184061157,2025-04-24 21:22:56.835718,2025-04-24 21:22:58.479126,0 days 00:00:01.643408,11.361570662878766,Matern,872.5201288021678,0.06630237925485633,1.5,TPESampler,COMPLETE
1965,0.9228200960662791,2025-04-24 21:22:58.221855,2025-04-24 21:22:59.905967,0 days 00:00:01.684112,0.4835396780479351,Matern,15.953680744177959,0.025615121072276276,1.5,TPESampler,COMPLETE
1966,0.28679725303425874,2025-04-24 21:22:58.443748,2025-04-24 21:23:00.375963,0 days 00:00:01.932215,2.4529309517386313,Matern,140.15866337058878,0.039153652750859,1.5,TPESampler,COMPLETE
1967,0.2867972465625937,2025-04-24 21:22:58.825332,2025-04-24 21:23:00.665387,0 days 00:00:01.840055,0.242322411581869,Matern,207.6343873512194,0.9090085797280182,1.5,TPESampler,COMPLETE
1968,0.2867972319083638,2025-04-24 21:23:00.369759,2025-04-24 21:23:02.281330,0 days 00:00:01.911571,4890.492446144639,Matern,160.38761595246305,0.0003950888420748794,1.5,TPESampler,COMPLETE
1969,0.9494317804801662,2025-04-24 21:23:00.632285,2025-04-24 21:23:02.227053,0 days 00:00:01.594768,2026.1770988046744,RBF,1.126224743019557e-05,2.697199928912127e-09,0.5,TPESampler,COMPLETE
1970,0.30268458421584227,2025-04-24 21:23:00.901034,2025-04-24 21:23:02.665792,0 days 00:00:01.764758,0.41511101424270513,RBF,38.490107846297064,0.5874487205506322,1.5,TPESampler,COMPLETE
1971,0.33018879658169725,2025-04-24 21:23:02.424219,2025-04-24 21:23:04.013581,0 days 00:00:01.589362,42.51269819066627,Matern,360.42637849014386,0.0869521926191788,0.5,TPESampler,COMPLETE
1972,0.2867972015589448,2025-04-24 21:23:02.469907,2025-04-24 21:23:03.980990,0 days 00:00:01.511083,65.0165635802311,Matern,2.0824435792514007,0.09017669064713456,1.5,TPESampler,COMPLETE
1973,0.9228200914184829,2025-04-24 21:23:02.899131,2025-04-24 21:23:05.705645,0 days 00:00:02.806514,0.030624201006564596,Matern,0.05627149236806133,0.771365411088047,1.5,TPESampler,COMPLETE
1974,0.2867972434099229,2025-04-24 21:23:04.155395,2025-04-24 21:23:05.743439,0 days 00:00:01.588044,0.11074037014537096,Matern,0.5439897119733427,0.06799217776450592,1.5,TPESampler,COMPLETE
1975,0.2867972512702163,2025-04-24 21:23:04.198744,2025-04-24 21:23:05.807492,0 days 00:00:01.608748,458.5873278860036,Matern,8.059080024421586,0.03234980859854703,1.5,TPESampler,COMPLETE
1976,0.9228200938650607,2025-04-24 21:23:05.872650,2025-04-24 21:23:08.337974,0 days 00:00:02.465324,15.537972352362194,Matern,628.4757955101823,0.007355559726889976,1.5,TPESampler,COMPLETE
1977,0.2867971967814021,2025-04-24 21:23:05.881020,2025-04-24 21:23:08.060507,0 days 00:00:02.179487,799.1776743970922,Matern,329.52131644124074,0.4660344294741211,1.5,TPESampler,COMPLETE
1978,0.2867973077966163,2025-04-24 21:23:06.047387,2025-04-24 21:23:08.105431,0 days 00:00:02.058044,25.736709983550828,Matern,645.3472814935925,0.7531852292036362,1.5,TPESampler,COMPLETE
1979,0.28679720929291125,2025-04-24 21:23:08.259472,2025-04-24 21:23:10.365686,0 days 00:00:02.106214,21.886838075690754,Matern,1.8960146661973982,0.014687390464655893,1.5,TPESampler,COMPLETE
1980,0.9228200928139192,2025-04-24 21:23:08.302170,2025-04-24 21:23:10.373261,0 days 00:00:02.071091,1818.7758714742222,Matern,1922.48666186547,0.0003298566355602439,1.5,TPESampler,COMPLETE
1981,0.2867972326726577,2025-04-24 21:23:08.616240,2025-04-24 21:23:10.326196,0 days 00:00:01.709956,0.1858411220631888,Matern,6.155864747485925,0.09559379082150352,1.5,TPESampler,COMPLETE
1982,0.949339875719808,2025-04-24 21:23:10.477979,2025-04-24 21:23:12.750357,0 days 00:00:02.272378,2.5257265586625695e-05,Matern,1.2880341929741255,0.02442687806837339,1.5,TPESampler,COMPLETE
1983,0.9228201004493595,2025-04-24 21:23:10.603616,2025-04-24 21:23:13.170750,0 days 00:00:02.567134,2.100729289807273e-07,RBF,0.020183134871299357,0.0015855336306763303,0.5,TPESampler,COMPLETE
1984,0.28679727136897387,2025-04-24 21:23:10.745080,2025-04-24 21:23:12.470233,0 days 00:00:01.725153,23.20196418131776,Matern,32.27032438233604,0.025477292427941747,1.5,TPESampler,COMPLETE
1985,0.9494322782083746,2025-04-24 21:23:12.701709,2025-04-24 21:23:14.498991,0 days 00:00:01.797282,312.2023207444281,Matern,273.55704884569786,0.016546419099795897,1.5,TPESampler,COMPLETE
1986,0.2867972536905109,2025-04-24 21:23:13.013569,2025-04-24 21:23:15.154642,0 days 00:00:02.141073,39.812304420323095,Matern,0.14438531047899472,0.47448082953478715,1.5,TPESampler,COMPLETE
1987,0.9228200925060556,2025-04-24 21:23:13.438706,2025-04-24 21:23:16.115410,0 days 00:00:02.676704,0.25630917752830507,Matern,1854.23771945328,0.0031427496256647967,1.5,TPESampler,COMPLETE
1988,0.9228200967784457,2025-04-24 21:23:14.736188,2025-04-24 21:23:16.502389,0 days 00:00:01.766201,479.4060221820968,Matern,133.99655478102642,0.0009301222530401356,1.5,TPESampler,COMPLETE
1989,0.30268459141213366,2025-04-24 21:23:15.401533,2025-04-24 21:23:17.009091,0 days 00:00:01.607558,48.38035551149938,RBF,2.107054064226071,0.0697692909651775,1.5,TPESampler,COMPLETE
1990,0.9228200924520805,2025-04-24 21:23:16.355233,2025-04-24 21:23:18.439630,0 days 00:00:02.084397,0.050557823227117646,Matern,14.698113786875597,0.02529270000874784,1.5,TPESampler,COMPLETE
1991,0.286797223988563,2025-04-24 21:23:16.747783,2025-04-24 21:23:18.304196,0 days 00:00:01.556413,0.712679498627642,Matern,3.9744346043286036,0.08313162001175856,1.5,TPESampler,COMPLETE
1992,0.2867972342456315,2025-04-24 21:23:17.470751,2025-04-24 21:23:19.183135,0 days 00:00:01.712384,1199.5009629723388,Matern,22.906191385390702,0.013331484122996923,1.5,TPESampler,COMPLETE
1993,0.33018882897190105,2025-04-24 21:23:18.514345,2025-04-24 21:23:20.653114,0 days 00:00:02.138769,0.011712878910095342,Matern,1.5815869869696388,0.3483363245586767,0.5,TPESampler,COMPLETE
1994,0.9228168058228374,2025-04-24 21:23:18.663348,2025-04-24 21:23:20.380838,0 days 00:00:01.717490,153.70330716039425,Matern,0.11456951861500775,0.013098472298915101,1.5,TPESampler,COMPLETE
1995,0.9493640648164895,2025-04-24 21:23:19.434371,2025-04-24 21:23:20.672283,0 days 00:00:01.237912,0.009778782588871342,Matern,243.6542600189178,0.003262136084986928,1.5,TPESampler,COMPLETE
1996,0.28870763555487755,2025-04-24 21:23:20.598828,2025-04-24 21:23:22.200908,0 days 00:00:01.602080,0.9003173009730662,Matern,0.9638157940701694,0.02126884944330081,2.5,TPESampler,COMPLETE
1997,0.9228200789448365,2025-04-24 21:23:20.883850,2025-04-24 21:23:22.687431,0 days 00:00:01.803581,3849.0943503144877,Matern,0.0195997255618385,0.9469629513905011,0.5,TPESampler,COMPLETE
1998,0.9494322531468093,2025-04-24 21:23:20.969091,2025-04-24 21:23:22.524582,0 days 00:00:01.555491,49975.70905912178,Matern,3456.4738213707087,1.1495878323321182e-07,0.5,TPESampler,COMPLETE
1999,0.9494322793432715,2025-04-24 21:23:22.465630,2025-04-24 21:23:24.155103,0 days 00:00:01.689473,2.250648370720618e-05,RBF,93860.3428239967,0.13671170385917475,2.5,TPESampler,COMPLETE
2000,0.28679724891988556,2025-04-24 21:23:22.790538,2025-04-24 21:23:24.719420,0 days 00:00:01.928882,101.54437233520123,Matern,17.857536012094425,0.021967283146753874,1.5,TPESampler,COMPLETE
2001,0.9494322793417049,2025-04-24 21:23:22.953075,2025-04-24 21:23:24.129526,0 days 00:00:01.176451,140.08991492966817,Matern,5.826661351173179,0.024254266406964275,1.5,TPESampler,COMPLETE
2002,0.2867972254221536,2025-04-24 21:23:24.285029,2025-04-24 21:23:25.894068,0 days 00:00:01.609039,115.70135326018959,Matern,0.4577737764531934,0.48726931410812324,1.5,TPESampler,COMPLETE
2003,0.33018883161345586,2025-04-24 21:23:24.329256,2025-04-24 21:23:26.629990,0 days 00:00:02.300734,2822.4983466891217,Matern,583.9009748819478,0.06768677816181246,0.5,TPESampler,COMPLETE
2004,0.2867972399538304,2025-04-24 21:23:25.044373,2025-04-24 21:23:26.706517,0 days 00:00:01.662144,3.981379566976615,Matern,33.935168459365336,0.03971282144483523,1.5,TPESampler,COMPLETE
2005,0.2867972534316514,2025-04-24 21:23:26.117928,2025-04-24 21:23:28.108749,0 days 00:00:01.990821,114.08127392188753,Matern,1412.2709062110898,0.04514946305531922,1.5,TPESampler,COMPLETE
2006,0.2887076282254103,2025-04-24 21:23:26.824476,2025-04-24 21:23:30.646865,0 days 00:00:03.822389,3.6079902081384544e-06,Matern,1.040633934928767,2.5535914808170795e-09,2.5,TPESampler,COMPLETE
2007,0.28679725267461004,2025-04-24 21:23:26.957465,2025-04-24 21:23:28.804603,0 days 00:00:01.847138,332.4827019982986,Matern,5.759507216719282,0.9295844204494705,1.5,TPESampler,COMPLETE
2008,0.9228200828609169,2025-04-24 21:23:28.340718,2025-04-24 21:23:31.049778,0 days 00:00:02.709060,0.0016752418529879147,Matern,1849.030820903744,0.0004176346995581543,2.5,TPESampler,COMPLETE
2009,0.2867972535833071,2025-04-24 21:23:29.022642,2025-04-24 21:23:31.058770,0 days 00:00:02.036128,206.7961279250375,Matern,82.56836834252927,0.0011507985774763657,1.5,TPESampler,COMPLETE
2010,0.9228200924813852,2025-04-24 21:23:30.876403,2025-04-24 21:23:33.003638,0 days 00:00:02.127235,0.42241763703111734,Matern,383.21039309444444,0.012437486782753549,1.5,TPESampler,COMPLETE
2011,0.9228200924928712,2025-04-24 21:23:31.222895,2025-04-24 21:23:33.004949,0 days 00:00:01.782054,2.1391610486836013e-06,Matern,35972.426531433244,8.540895351270856e-10,2.5,TPESampler,COMPLETE
2012,0.2867972535447477,2025-04-24 21:23:31.323382,2025-04-24 21:23:34.173936,0 days 00:00:02.850554,2400.32755270209,Matern,3014.4752959228977,0.047627207416869245,1.5,TPESampler,COMPLETE
2013,0.9494317804803406,2025-04-24 21:23:33.191340,2025-04-24 21:23:35.111269,0 days 00:00:01.919929,7.502396373301949,Matern,0.029019978499368975,5.325508652888188e-10,2.5,TPESampler,COMPLETE
2014,0.9228200602958725,2025-04-24 21:23:33.238353,2025-04-24 21:23:36.101636,0 days 00:00:02.863283,1.089279377126552,Matern,25.06209849630721,0.03459593411846368,1.5,TPESampler,COMPLETE
2015,0.2867972208960327,2025-04-24 21:23:34.558897,2025-04-24 21:23:38.287628,0 days 00:00:03.728731,0.0004682449888672325,Matern,23.773743025953408,0.5066192179251443,1.5,TPESampler,COMPLETE
2016,0.922820093040268,2025-04-24 21:23:35.339994,2025-04-24 21:23:37.290672,0 days 00:00:01.950678,85.29577221664758,Matern,538.9896507694987,2.2616517250005264e-06,1.5,TPESampler,COMPLETE
2017,0.9228200900795472,2025-04-24 21:23:36.325795,2025-04-24 21:23:38.380306,0 days 00:00:02.054511,4.184597992928828,RBF,191.45042267233455,0.0005950510662502375,0.5,TPESampler,COMPLETE
2018,0.2867972556784522,2025-04-24 21:23:37.518706,2025-04-24 21:23:38.818610,0 days 00:00:01.299904,1.530243002028512,Matern,6.410137105780702,0.13606283277307193,1.5,TPESampler,COMPLETE
2019,0.28679725421266467,2025-04-24 21:23:38.478795,2025-04-24 21:23:40.564586,0 days 00:00:02.085791,32832.21254109153,Matern,155.5088770095899,0.0008826434766416029,1.5,TPESampler,COMPLETE
2020,0.9228200924654625,2025-04-24 21:23:38.555447,2025-04-24 21:23:42.429044,0 days 00:00:03.873597,1.480978995527466e-06,RBF,12.481287151707074,1.3886823873357516e-08,2.5,TPESampler,COMPLETE
2021,0.2867972453438377,2025-04-24 21:23:39.158384,2025-04-24 21:23:40.928120,0 days 00:00:01.769736,2897.662504321778,Matern,567.08389673779,0.9896910300816903,1.5,TPESampler,COMPLETE
2022,0.9228200925972102,2025-04-24 21:23:40.790598,2025-04-24 21:23:44.487498,0 days 00:00:03.696900,0.026102527453302448,RBF,0.10962163736124857,1.1807212965042386e-08,2.5,TPESampler,COMPLETE
2023,0.28679725062158806,2025-04-24 21:23:41.169863,2025-04-24 21:23:43.318768,0 days 00:00:02.148905,2.9071904966646525,Matern,1.8401364231707986,0.697488526376429,1.5,TPESampler,COMPLETE
2024,0.2867972361294069,2025-04-24 21:23:42.763780,2025-04-24 21:23:45.926558,0 days 00:00:03.162778,0.0007547412996997681,Matern,2.566938339926199,0.0030376302055446025,1.5,TPESampler,COMPLETE
2025,0.9494322793417138,2025-04-24 21:23:43.651446,2025-04-24 21:23:45.086295,0 days 00:00:01.434849,760.4982052784968,Matern,1.3530792943671404,0.015955853722198713,1.5,TPESampler,COMPLETE
2026,0.2867972544178183,2025-04-24 21:23:44.719591,2025-04-24 21:23:46.898831,0 days 00:00:02.179240,370.0655588389095,Matern,61.60810805069964,0.0023266847958411103,1.5,TPESampler,COMPLETE
2027,0.9228200743209094,2025-04-24 21:23:45.286488,2025-04-24 21:23:47.020483,0 days 00:00:01.733995,0.009089594492064047,Matern,0.005911231903353095,0.008250063437056865,1.5,TPESampler,COMPLETE
2028,0.2867972564743629,2025-04-24 21:23:46.179869,2025-04-24 21:23:47.884056,0 days 00:00:01.704187,3.640563514781311,Matern,103.41966623749785,0.6026341078275939,1.5,TPESampler,COMPLETE
2029,0.9228200925039267,2025-04-24 21:23:47.099498,2025-04-24 21:23:50.878194,0 days 00:00:03.778696,1.3789037201022493e-07,RBF,0.0023445060613643855,0.010292055038889079,2.5,TPESampler,COMPLETE
2030,0.28679725197254474,2025-04-24 21:23:47.189322,2025-04-24 21:23:48.832102,0 days 00:00:01.642780,21.121160598017727,Matern,4.560592547954793,0.01923775456424039,1.5,TPESampler,COMPLETE
2031,0.28679724974359494,2025-04-24 21:23:48.106472,2025-04-24 21:23:49.599900,0 days 00:00:01.493428,5.576309184481565,Matern,9.52394564639067,0.8215500019026617,1.5,TPESampler,COMPLETE
2032,0.9494322793018043,2025-04-24 21:23:49.076012,2025-04-24 21:23:50.517650,0 days 00:00:01.441638,93760.01860619224,Matern,208.12521837926226,1.837692428653689e-05,1.5,TPESampler,COMPLETE
2033,0.9228200924672363,2025-04-24 21:23:49.865135,2025-04-24 21:23:51.354683,0 days 00:00:01.489548,77.84908007448321,Matern,104.42194450768433,0.0032155528597110775,1.5,TPESampler,COMPLETE
2034,0.9228200940024774,2025-04-24 21:23:50.742257,2025-04-24 21:23:53.343550,0 days 00:00:02.601293,2.131079537433981,Matern,265.19485946623155,0.0017884940829459054,1.5,TPESampler,COMPLETE
2035,0.9228200918208531,2025-04-24 21:23:51.125066,2025-04-24 21:23:53.290709,0 days 00:00:02.165643,31.777923023385178,Matern,4033.300702162757,0.01616154913445034,1.5,TPESampler,COMPLETE
2036,0.2867972775288479,2025-04-24 21:23:51.595706,2025-04-24 21:23:53.294539,0 days 00:00:01.698833,1429.1237335762507,Matern,108.21088592130832,0.046495631017938376,1.5,TPESampler,COMPLETE
2037,0.286797224594759,2025-04-24 21:23:53.455922,2025-04-24 21:23:55.616441,0 days 00:00:02.160519,334.7867017676148,Matern,1.5376045150136988,0.011708585041716017,1.5,TPESampler,COMPLETE
2038,0.9228200922648642,2025-04-24 21:23:53.466802,2025-04-24 21:23:56.662647,0 days 00:00:03.195845,17.793428403678398,Matern,9351.436384657667,2.5196372857964712e-05,1.5,TPESampler,COMPLETE
2039,0.9228200927555443,2025-04-24 21:23:53.514596,2025-04-24 21:23:55.899662,0 days 00:00:02.385066,0.15879989114531023,Matern,42.5865629557873,0.03004452146287421,1.5,TPESampler,COMPLETE
2040,0.33018888265090807,2025-04-24 21:23:55.840292,2025-04-24 21:23:57.534654,0 days 00:00:01.694362,8.271066108515795,Matern,0.5092144973577288,0.3171324033008875,0.5,TPESampler,COMPLETE
2041,0.949431780476457,2025-04-24 21:23:56.163112,2025-04-24 21:23:57.441768,0 days 00:00:01.278656,11.004557107837277,Matern,0.09242986808307241,0.02326605294046888,1.5,TPESampler,COMPLETE
2042,0.2867944096117616,2025-04-24 21:23:56.915840,2025-04-24 21:23:58.456588,0 days 00:00:01.540748,5.372641745720855,Matern,3.15240095877842,0.02317049983435737,1.5,TPESampler,COMPLETE
2043,0.286797252648526,2025-04-24 21:23:57.640058,2025-04-24 21:23:59.341941,0 days 00:00:01.701883,823.0614389606815,Matern,23.980815387905206,0.0337151542851929,1.5,TPESampler,COMPLETE
2044,0.2867972517339069,2025-04-24 21:23:57.775734,2025-04-24 21:23:59.618919,0 days 00:00:01.843185,151.172005950457,Matern,75.29658136631876,0.4005981834810933,1.5,TPESampler,COMPLETE
2045,0.2867972659782371,2025-04-24 21:23:58.713328,2025-04-24 21:24:00.346227,0 days 00:00:01.632899,2.5213110173292668,Matern,2.4165576604456485,0.021366481658254926,1.5,TPESampler,COMPLETE
2046,0.9228200944721462,2025-04-24 21:23:59.558605,2025-04-24 21:24:01.888831,0 days 00:00:02.330226,0.0024852742434225933,Matern,3.138930499287715,0.00847169243193758,1.5,TPESampler,COMPLETE
2047,0.28679725390614685,2025-04-24 21:23:59.888858,2025-04-24 21:24:01.641012,0 days 00:00:01.752154,5.1545473124566525,Matern,0.7141048352895696,0.012528686323899469,1.5,TPESampler,COMPLETE
2048,0.2867972618206616,2025-04-24 21:24:00.618884,2025-04-24 21:24:02.185892,0 days 00:00:01.567008,0.23921955833570574,Matern,2.349379411248878,0.054743846105779946,1.5,TPESampler,COMPLETE
2049,0.9228200924996148,2025-04-24 21:24:01.853793,2025-04-24 21:24:03.190381,0 days 00:00:01.336588,0.901639283452538,Matern,0.06342827554254908,0.03338181240232563,1.5,TPESampler,COMPLETE
2050,0.2867971754972966,2025-04-24 21:24:02.149028,2025-04-24 21:24:03.801418,0 days 00:00:01.652390,8.162676433659795,Matern,0.6712227422721192,0.007228846788478463,1.5,TPESampler,COMPLETE
2051,0.922820092717095,2025-04-24 21:24:02.569822,2025-04-24 21:24:05.032854,0 days 00:00:02.463032,0.02028972293156903,RBF,0.04732429257006431,5.142415313973769e-06,2.5,TPESampler,COMPLETE
2052,0.2867972414916997,2025-04-24 21:24:03.431904,2025-04-24 21:24:04.858270,0 days 00:00:01.426366,0.45100066892414525,Matern,2.6973630230441414,0.05113695701430538,1.5,TPESampler,COMPLETE
2053,0.286797253053615,2025-04-24 21:24:04.012772,2025-04-24 21:24:05.612154,0 days 00:00:01.599382,0.13512425396244235,Matern,0.7608167957492387,0.028263870306355743,1.5,TPESampler,COMPLETE
2054,0.28679720365668093,2025-04-24 21:24:05.035317,2025-04-24 21:24:06.292614,0 days 00:00:01.257297,8.416413794920333,Matern,5.898632759210964,0.009838239007434602,1.5,TPESampler,COMPLETE
2055,0.9228200974048261,2025-04-24 21:24:05.250449,2025-04-24 21:24:07.579086,0 days 00:00:02.328637,1.2021795451649233,Matern,308.43354016492424,0.0059696830501259415,1.5,TPESampler,COMPLETE
2056,0.9228200922606434,2025-04-24 21:24:05.867237,2025-04-24 21:24:07.866304,0 days 00:00:01.999067,0.44185892078212313,Matern,29.978892285028994,0.017605286279504664,1.5,TPESampler,COMPLETE
2057,0.286797255956826,2025-04-24 21:24:06.525697,2025-04-24 21:24:08.234377,0 days 00:00:01.708680,17.781143975307966,Matern,0.25564013002469876,0.005048784503269028,1.5,TPESampler,COMPLETE
