number,value,datetime_start,datetime_complete,duration,params_constant_value,params_kernel_type,params_length_scale,params_noise_level,params_nu,system_attrs_auto:sampler,state
343,0.28679725279067386,2025-04-24 21:03:16.627058,2025-04-24 21:03:18.334318,0 days 00:00:01.707260,17.76465131843005,Matern,1.3235563090610911,0.2761490390784249,1.5,TPESampler,COMPLETE
344,0.9494317801393334,2025-04-24 21:03:17.014147,2025-04-24 21:03:18.170517,0 days 00:00:01.156370,3.3911116431397617e-07,Matern,0.0039245352285159464,0.3615808036878256,1.5,TPESampler,COMPLETE
345,0.9228200926928369,2025-04-24 21:03:18.013818,2025-04-24 21:03:20.258096,0 days 00:00:02.244278,716.8539388432789,Matern,4858.757646903571,0.015937394773156654,1.5,TPESampler,COMPLETE
346,0.28679729759817824,2025-04-24 21:03:18.312739,2025-04-24 21:03:20.869545,0 days 00:00:02.556806,170.2090165668068,Matern,3370.2499268961606,0.07120910915101608,1.5,TPESampler,COMPLETE
347,0.9494322789139809,2025-04-24 21:03:18.565902,2025-04-24 21:03:19.801406,0 days 00:00:01.235504,785.2306947502681,Matern,4.092821688091278,1.6003064224986379e-06,2.5,TPESampler,COMPLETE
348,0.28679725538746526,2025-04-24 21:03:20.034896,2025-04-24 21:03:22.105385,0 days 00:00:02.070489,0.0001688808061933303,Matern,3.135448438027337,0.10531689205135028,1.5,TPESampler,COMPLETE
349,0.28679725540916456,2025-04-24 21:03:20.484075,2025-04-24 21:03:22.059649,0 days 00:00:01.575574,171.3687913971212,Matern,18.518387287395743,0.9839104747584952,1.5,TPESampler,COMPLETE
350,0.9494314453697625,2025-04-24 21:03:21.111037,2025-04-24 21:03:22.424463,0 days 00:00:01.313426,2.259970890697268e-05,Matern,259.37075503439905,0.05285372256214258,1.5,TPESampler,COMPLETE
351,0.9228200940110652,2025-04-24 21:03:22.219540,2025-04-24 21:03:23.933353,0 days 00:00:01.713813,0.0070774940855631175,Matern,1.5198058680027815,1.830140568406756e-05,2.5,TPESampler,COMPLETE
352,0.9228200911850465,2025-04-24 21:03:22.261009,2025-04-24 21:03:24.727291,0 days 00:00:02.466282,5664.72264821826,RBF,77223.40340745707,2.0013862596230555e-05,0.5,TPESampler,COMPLETE
353,0.28679726263656197,2025-04-24 21:03:22.647221,2025-04-24 21:03:24.755583,0 days 00:00:02.108362,6767.434587271353,Matern,323.0098720982501,0.025086786050676255,1.5,TPESampler,COMPLETE
354,0.2867972215619339,2025-04-24 21:03:24.134923,2025-04-24 21:03:25.550377,0 days 00:00:01.415454,7.2419401856941485,Matern,1.4470462041489747,0.8650414625617423,1.5,TPESampler,COMPLETE
355,0.2887075395560396,2025-04-24 21:03:24.899090,2025-04-24 21:03:26.929173,0 days 00:00:02.030083,0.15864901842759244,Matern,1.2422292577762655,0.6128169709681909,2.5,TPESampler,COMPLETE
356,0.9228200926490405,2025-04-24 21:03:24.948956,2025-04-24 21:03:26.908062,0 days 00:00:01.959106,63.811766868606945,Matern,0.024166565051006575,0.543919068505572,1.5,TPESampler,COMPLETE
357,0.9228200930100122,2025-04-24 21:03:25.815382,2025-04-24 21:03:30.636808,0 days 00:00:04.821426,0.024352706591838073,Matern,0.012902731219895332,0.039380154766196405,0.5,TPESampler,COMPLETE
358,0.9228200862435717,2025-04-24 21:03:27.144778,2025-04-24 21:03:29.750840,0 days 00:00:02.606062,0.266808843168195,RBF,7.600461419552891,0.004541677717506469,2.5,TPESampler,COMPLETE
359,0.2867972586157292,2025-04-24 21:03:27.212660,2025-04-24 21:03:29.629761,0 days 00:00:02.417101,4.660120245811886,Matern,8.687766926243059,0.49918365534402603,1.5,TPESampler,COMPLETE
360,0.9494321293256499,2025-04-24 21:03:29.860699,2025-04-24 21:03:31.345533,0 days 00:00:01.484834,1.2654040138255073e-06,Matern,8039.077032776902,0.17639747560812316,0.5,TPESampler,COMPLETE
361,0.286797268066171,2025-04-24 21:03:29.977625,2025-04-24 21:03:33.267438,0 days 00:00:03.289813,422.01500918487113,Matern,2640.66815077017,0.20671228223546273,1.5,TPESampler,COMPLETE
362,0.28679725353427704,2025-04-24 21:03:30.875310,2025-04-24 21:03:32.799595,0 days 00:00:01.924285,28015.178611229836,Matern,364.438308463211,0.5952482294617466,1.5,TPESampler,COMPLETE
363,0.94943178048009,2025-04-24 21:03:31.587439,2025-04-24 21:03:33.118476,0 days 00:00:01.531037,32577.17270775064,RBF,0.000132044137794501,1.456259798974194e-05,2.5,TPESampler,COMPLETE
364,0.2867972658012301,2025-04-24 21:03:33.038616,2025-04-24 21:03:35.109786,0 days 00:00:02.071170,854.6551657550759,Matern,4298.896958818664,0.7824296661860439,1.5,TPESampler,COMPLETE
365,0.9228200950782625,2025-04-24 21:03:33.361050,2025-04-24 21:03:35.037006,0 days 00:00:01.675956,0.00010636745362073174,Matern,0.0005731291365902102,7.591838451325002e-10,1.5,TPESampler,COMPLETE
366,0.9494322696003413,2025-04-24 21:03:33.520329,2025-04-24 21:03:35.942201,0 days 00:00:02.421872,1.1776423076062482e-05,Matern,0.4967069663340275,0.0009162521479815794,1.5,TPESampler,COMPLETE
367,0.9228200885043022,2025-04-24 21:03:35.186684,2025-04-24 21:03:39.555768,0 days 00:00:04.369084,2.2886149390242223e-06,RBF,0.0015575891020324151,0.0007187028821179759,1.5,TPESampler,COMPLETE
368,0.9228200914247059,2025-04-24 21:03:35.267663,2025-04-24 21:03:37.662593,0 days 00:00:02.394930,0.6836094852856774,RBF,13979.757847205088,5.2616644751203835e-05,1.5,TPESampler,COMPLETE
369,0.2867972397377362,2025-04-24 21:03:36.177162,2025-04-24 21:03:40.145963,0 days 00:00:03.968801,1.0347700074025496e-06,Matern,2.6315851230960576,0.8800016462932224,1.5,TPESampler,COMPLETE
370,0.286797218619024,2025-04-24 21:03:37.874112,2025-04-24 21:03:39.502627,0 days 00:00:01.628515,0.07501120735585343,Matern,1.7423174528480248,0.646692216486043,1.5,TPESampler,COMPLETE
371,0.2867970906924862,2025-04-24 21:03:39.657661,2025-04-24 21:03:41.211066,0 days 00:00:01.553405,8.279097121467318,Matern,54.74330946551751,0.11463895453399761,1.5,TPESampler,COMPLETE
372,0.9494317804797112,2025-04-24 21:03:39.736605,2025-04-24 21:03:41.073405,0 days 00:00:01.336800,4176.545316289593,RBF,0.0012689325660633671,2.4074239485427706e-07,0.5,TPESampler,COMPLETE
373,0.2867972446112875,2025-04-24 21:03:40.369428,2025-04-24 21:03:41.838611,0 days 00:00:01.469183,0.1219875558268299,Matern,0.4173771927327138,0.12396649216029554,1.5,TPESampler,COMPLETE
374,0.28679725890544533,2025-04-24 21:03:41.270654,2025-04-24 21:03:42.700514,0 days 00:00:01.429860,0.8535716512116919,Matern,2.7703442369700784,0.33517178774011797,1.5,TPESampler,COMPLETE
375,0.9228200617799788,2025-04-24 21:03:41.469105,2025-04-24 21:03:42.732877,0 days 00:00:01.263772,6.923319947798079,Matern,0.09068017769707079,0.04186603339410094,1.5,TPESampler,COMPLETE
376,0.28679725447933835,2025-04-24 21:03:42.062948,2025-04-24 21:03:44.033280,0 days 00:00:01.970332,0.014933540844096344,Matern,4.768634061221827,0.5546048509534532,1.5,TPESampler,COMPLETE
377,0.2867972231050169,2025-04-24 21:03:42.844338,2025-04-24 21:03:44.193291,0 days 00:00:01.348953,0.16258263983345628,Matern,1.6213978638166107,0.544425039795891,1.5,TPESampler,COMPLETE
378,0.28679715070961814,2025-04-24 21:03:42.902708,2025-04-24 21:03:46.178490,0 days 00:00:03.275782,0.007169042013477626,Matern,1.4486988767684523,0.012766755512059642,1.5,TPESampler,COMPLETE
379,0.28679725229384295,2025-04-24 21:03:44.252154,2025-04-24 21:03:45.940116,0 days 00:00:01.687962,0.07990588691995744,Matern,0.9886692269099601,0.32210669790140267,1.5,TPESampler,COMPLETE
380,0.2867972523938916,2025-04-24 21:03:44.449515,2025-04-24 21:03:46.179972,0 days 00:00:01.730457,1.3351174472254155,Matern,30.239644381932518,0.5772676559929096,1.5,TPESampler,COMPLETE
381,0.2867972569436229,2025-04-24 21:03:46.139123,2025-04-24 21:03:47.476460,0 days 00:00:01.337337,0.8655532415459736,Matern,10.229269641808907,0.30591260876162923,1.5,TPESampler,COMPLETE
382,0.28679725312880944,2025-04-24 21:03:46.464870,2025-04-24 21:03:48.198837,0 days 00:00:01.733967,0.09811652513751025,Matern,0.8180832980144934,0.019962757086357426,1.5,TPESampler,COMPLETE
383,0.9228200925243134,2025-04-24 21:03:46.512273,2025-04-24 21:03:48.575833,0 days 00:00:02.063560,0.3042408238142624,Matern,0.04058719861822241,0.24794453986284662,1.5,TPESampler,COMPLETE
384,0.2867972493150159,2025-04-24 21:03:47.744848,2025-04-24 21:03:49.433913,0 days 00:00:01.689065,4.423013825413022,Matern,2.0130909742127527,0.848195255778445,1.5,TPESampler,COMPLETE
385,0.286797241265638,2025-04-24 21:03:48.479157,2025-04-24 21:03:50.438925,0 days 00:00:01.959768,0.3013045102946095,Matern,0.2268280578213605,0.5583911124689868,1.5,TPESampler,COMPLETE
386,0.9228200924175924,2025-04-24 21:03:48.826698,2025-04-24 21:03:51.433261,0 days 00:00:02.606563,0.09184322822170905,Matern,950.7556553906951,4.261961002113326e-08,1.5,TPESampler,COMPLETE
387,0.33018884078053196,2025-04-24 21:03:49.671303,2025-04-24 21:03:52.060930,0 days 00:00:02.389627,0.0012790449729368123,Matern,10.050179053150705,0.17501945381070685,0.5,TPESampler,COMPLETE
388,0.9228200925363798,2025-04-24 21:03:50.677301,2025-04-24 21:03:52.906692,0 days 00:00:02.229391,0.060432071162987544,Matern,67.10681606247715,0.001287339335911509,1.5,TPESampler,COMPLETE
389,0.9228200923519526,2025-04-24 21:03:51.654286,2025-04-24 21:03:54.361212,0 days 00:00:02.706926,0.0047162877676470375,Matern,4.3649828636579775,0.003616881314183056,1.5,TPESampler,COMPLETE
390,0.2867972361422327,2025-04-24 21:03:52.279709,2025-04-24 21:03:55.506431,0 days 00:00:03.226722,0.004547612519819586,Matern,0.2030819159332759,0.10989093290603869,1.5,TPESampler,COMPLETE
391,0.9228200918336507,2025-04-24 21:03:53.130004,2025-04-24 21:03:55.450270,0 days 00:00:02.320266,3.5434784220523854,Matern,11916.83023808511,3.0120127056907403e-07,0.5,TPESampler,COMPLETE
392,0.9228200937926274,2025-04-24 21:03:54.581852,2025-04-24 21:03:56.059204,0 days 00:00:01.477352,0.003961333936596087,RBF,0.001391933922411897,9.508357627039035e-07,2.5,TPESampler,COMPLETE
393,0.2867972466446307,2025-04-24 21:03:55.599035,2025-04-24 21:03:57.282720,0 days 00:00:01.683685,2.572963162691448,Matern,14.565305699778305,0.010425545101811321,1.5,TPESampler,COMPLETE
394,0.2867972476400435,2025-04-24 21:03:55.676331,2025-04-24 21:03:57.320345,0 days 00:00:01.644014,5.804268134607115,Matern,10.910868834364173,0.0037523453072915046,1.5,TPESampler,COMPLETE
395,0.28679724908250637,2025-04-24 21:03:56.277874,2025-04-24 21:03:58.757821,0 days 00:00:02.479947,0.710203715256311,Matern,498.9149438814476,0.07533372579827759,1.5,TPESampler,COMPLETE
396,0.28679723754001096,2025-04-24 21:03:57.445191,2025-04-24 21:03:58.823863,0 days 00:00:01.378672,16.601069048321076,Matern,2.6368133211981,0.7597043990915662,1.5,TPESampler,COMPLETE
397,0.2867972537069957,2025-04-24 21:03:57.496263,2025-04-24 21:04:00.702093,0 days 00:00:03.205830,0.029644968264021222,Matern,0.9914676550035983,0.016903656260991225,1.5,TPESampler,COMPLETE
398,0.3026844559238555,2025-04-24 21:03:58.905603,2025-04-24 21:04:02.651015,0 days 00:00:03.745412,10.966983949606192,RBF,4802.980336153428,0.5050905686978245,1.5,TPESampler,COMPLETE
399,0.2867972718544441,2025-04-24 21:03:58.980182,2025-04-24 21:04:01.514264,0 days 00:00:02.534082,8.315380921868755,Matern,0.1871436776745973,0.490484854504616,1.5,TPESampler,COMPLETE
400,0.286797230800596,2025-04-24 21:04:00.920469,2025-04-24 21:04:02.678420,0 days 00:00:01.757951,0.0702095783809508,Matern,41.781577876501856,0.06227020031365773,1.5,TPESampler,COMPLETE
401,0.9228200915261008,2025-04-24 21:04:01.729488,2025-04-24 21:04:04.717484,0 days 00:00:02.987996,0.0023609220949980716,RBF,0.061794207346318054,0.01671768954328006,1.5,TPESampler,COMPLETE
402,0.9228200911925926,2025-04-24 21:04:02.791333,2025-04-24 21:04:05.895401,0 days 00:00:03.104068,0.005478013226791785,Matern,4.93213405109884,0.017181219570132338,1.5,TPESampler,COMPLETE
403,0.28679721806555025,2025-04-24 21:04:02.846059,2025-04-24 21:04:05.903705,0 days 00:00:03.057646,0.2089173487060564,Matern,935.9557447614366,0.3458478386012756,1.5,TPESampler,COMPLETE
404,0.2867972537213901,2025-04-24 21:04:04.935570,2025-04-24 21:04:07.704436,0 days 00:00:02.768866,0.004017864623511055,Matern,75.97183690785809,0.25740166178917007,1.5,TPESampler,COMPLETE
405,0.30268456609176786,2025-04-24 21:04:06.045278,2025-04-24 21:04:08.001409,0 days 00:00:01.956131,336.2869277096588,RBF,8.223413350076664,0.2955970787228276,1.5,TPESampler,COMPLETE
406,0.9494322675991087,2025-04-24 21:04:06.093803,2025-04-24 21:04:07.745287,0 days 00:00:01.651484,0.01753067774204756,Matern,1627.1919080925074,0.9000673614009675,1.5,TPESampler,COMPLETE
407,0.9228200901274345,2025-04-24 21:04:07.875649,2025-04-24 21:04:09.510316,0 days 00:00:01.634667,0.11585546954730291,Matern,1.4884478164103898,0.0004106136277661345,1.5,TPESampler,COMPLETE
408,0.2867972541625874,2025-04-24 21:04:07.942610,2025-04-24 21:04:09.539644,0 days 00:00:01.597034,0.12825804568893104,Matern,0.21151583051136066,0.00023250849723222884,1.5,TPESampler,COMPLETE
409,0.28679725442709925,2025-04-24 21:04:08.236580,2025-04-24 21:04:09.815046,0 days 00:00:01.578466,1.0013743042260026,Matern,0.2933905018394545,0.0043501599930826935,1.5,TPESampler,COMPLETE
410,0.2867973038431441,2025-04-24 21:04:09.654457,2025-04-24 21:04:11.557747,0 days 00:00:01.903290,2.0857786845770425,Matern,187.2974777283128,0.9500925166106682,1.5,TPESampler,COMPLETE
411,0.28679725234700265,2025-04-24 21:04:09.696452,2025-04-24 21:04:11.588010,0 days 00:00:01.891558,3.7393893979591875,Matern,362.96241228135494,0.14533891723423434,1.5,TPESampler,COMPLETE
412,0.3301888307674993,2025-04-24 21:04:10.028099,2025-04-24 21:04:11.858721,0 days 00:00:01.830622,5.186811173891809,Matern,541.5799210872282,0.9576896184177472,0.5,TPESampler,COMPLETE
413,0.9228200923938592,2025-04-24 21:04:11.693302,2025-04-24 21:04:14.168630,0 days 00:00:02.475328,35340.78459988707,RBF,14301.70572766526,3.687613712888691e-10,1.5,TPESampler,COMPLETE
414,0.2867972370764473,2025-04-24 21:04:11.751924,2025-04-24 21:04:13.363100,0 days 00:00:01.611176,18.132075173020702,Matern,12.08979958720509,0.02221510966425027,1.5,TPESampler,COMPLETE
415,0.28679725268033773,2025-04-24 21:04:12.065191,2025-04-24 21:04:15.018906,0 days 00:00:02.953715,0.0024255170424607748,Matern,0.5498803584219674,0.8667391166015973,1.5,TPESampler,COMPLETE
416,0.28679725816564255,2025-04-24 21:04:13.583891,2025-04-24 21:04:15.284222,0 days 00:00:01.700331,280.9173219594681,Matern,34.03156860983512,0.018611968554533877,1.5,TPESampler,COMPLETE
417,0.3026846357914927,2025-04-24 21:04:14.416752,2025-04-24 21:04:16.151964,0 days 00:00:01.735212,244.4611156259709,RBF,5.630519280003291,0.057754116537648094,2.5,TPESampler,COMPLETE
418,0.9494322789215283,2025-04-24 21:04:15.232087,2025-04-24 21:04:16.419430,0 days 00:00:01.187343,11.33185575048969,Matern,3.9466133770233176,8.367875516602789e-05,1.5,TPESampler,COMPLETE
419,0.28679724501337206,2025-04-24 21:04:15.541595,2025-04-24 21:04:17.659870,0 days 00:00:02.118275,0.0699764101551457,Matern,184.56023919254145,0.45411252404235475,1.5,TPESampler,COMPLETE
420,0.2867972527112768,2025-04-24 21:04:16.358342,2025-04-24 21:04:17.852322,0 days 00:00:01.493980,104.23208220914282,Matern,5.619410764599214,0.7080441204325904,1.5,TPESampler,COMPLETE
421,0.28679725286809155,2025-04-24 21:04:16.662247,2025-04-24 21:04:18.531635,0 days 00:00:01.869388,83090.38142711941,Matern,20.838776776278355,0.16281551884570614,1.5,TPESampler,COMPLETE
422,0.2867972895832811,2025-04-24 21:04:17.876806,2025-04-24 21:04:20.469431,0 days 00:00:02.592625,4.503183097454947,Matern,0.15650739297393024,0.001588973025616951,1.5,TPESampler,COMPLETE
423,0.28679725566042324,2025-04-24 21:04:18.054716,2025-04-24 21:04:19.477721,0 days 00:00:01.423005,0.18739050227192997,Matern,2.493388931153007,0.627288611911566,1.5,TPESampler,COMPLETE
424,0.9228200923521647,2025-04-24 21:04:18.765793,2025-04-24 21:04:21.313452,0 days 00:00:02.547659,0.6687609137847863,Matern,5540.619335425027,0.00666939606402313,1.5,TPESampler,COMPLETE
425,0.28679720145242366,2025-04-24 21:04:19.685738,2025-04-24 21:04:22.023487,0 days 00:00:02.337749,289.4761521207799,Matern,0.1628195789798465,0.9011541592212249,1.5,TPESampler,COMPLETE
426,0.9494317796009342,2025-04-24 21:04:20.673160,2025-04-24 21:04:22.055146,0 days 00:00:01.381986,2.084766154537815,Matern,0.1452220146007487,3.628521279127677e-10,1.5,TPESampler,COMPLETE
427,0.28679724928672684,2025-04-24 21:04:21.520641,2025-04-24 21:04:23.137881,0 days 00:00:01.617240,760.137552860574,Matern,10.528644645256001,0.060958678325690324,1.5,TPESampler,COMPLETE
428,0.9228201008549953,2025-04-24 21:04:22.193200,2025-04-24 21:04:23.967226,0 days 00:00:01.774026,6.457043651644125,Matern,0.029580036830049294,0.039801368064572774,2.5,TPESampler,COMPLETE
429,0.9228200924895783,2025-04-24 21:04:22.246229,2025-04-24 21:04:24.224945,0 days 00:00:01.978716,198.82739225754273,Matern,0.043761572188656485,0.4023959330054839,1.5,TPESampler,COMPLETE
430,0.9494322793417138,2025-04-24 21:04:23.464551,2025-04-24 21:04:24.680710,0 days 00:00:01.216159,233.02206354887878,Matern,0.9024789234615034,0.03939987713954546,1.5,TPESampler,COMPLETE
431,0.28679728010295163,2025-04-24 21:04:24.171763,2025-04-24 21:04:25.804566,0 days 00:00:01.632803,16.987304179189007,Matern,0.4040634945252079,0.5851925490843051,1.5,TPESampler,COMPLETE
432,0.2867973411496006,2025-04-24 21:04:24.500960,2025-04-24 21:04:26.362924,0 days 00:00:01.861964,439.1057174434089,Matern,0.22388639460572082,0.16712348947045566,1.5,TPESampler,COMPLETE
433,0.2867972426232921,2025-04-24 21:04:24.883546,2025-04-24 21:04:26.249580,0 days 00:00:01.366034,16.132433132917896,Matern,2.5293166416445945,0.9535940664071667,1.5,TPESampler,COMPLETE
434,0.28679725294492986,2025-04-24 21:04:26.021395,2025-04-24 21:04:27.640630,0 days 00:00:01.619235,264.3099388640296,Matern,38.12983395275566,0.026870835082350285,1.5,TPESampler,COMPLETE
435,0.949431780480242,2025-04-24 21:04:26.490486,2025-04-24 21:04:27.917153,0 days 00:00:01.426667,13.562536219686532,RBF,1.0656135197312761e-05,3.4508601171403976e-08,1.5,TPESampler,COMPLETE
436,0.9494322793417138,2025-04-24 21:04:26.593657,2025-04-24 21:04:27.981851,0 days 00:00:01.388194,5189.702131336767,Matern,8.677401705422895,0.020430610528560912,1.5,TPESampler,COMPLETE
437,0.9228200940534885,2025-04-24 21:04:27.854543,2025-04-24 21:04:29.284680,0 days 00:00:01.430137,0.028880028797226627,RBF,0.0008737011370800537,0.00023229054838773365,0.5,TPESampler,COMPLETE
438,0.9228200938847674,2025-04-24 21:04:28.108755,2025-04-24 21:04:29.537434,0 days 00:00:01.428679,0.29354502205194927,RBF,0.024231097577483,0.1635993053176195,0.5,TPESampler,COMPLETE
439,0.9228200925252266,2025-04-24 21:04:28.361629,2025-04-24 21:04:31.021538,0 days 00:00:02.659909,37550.23356301802,Matern,10515.178177440292,0.013068955455205046,1.5,TPESampler,COMPLETE
440,0.28679725280288687,2025-04-24 21:04:29.485755,2025-04-24 21:04:31.071531,0 days 00:00:01.585776,19814.02858415471,Matern,0.8108700474513126,0.4346489418015291,1.5,TPESampler,COMPLETE
441,0.3026845856367333,2025-04-24 21:04:29.927550,2025-04-24 21:04:31.626710,0 days 00:00:01.699160,18.952937669755975,RBF,0.5169962202287752,0.002018809990652023,1.5,TPESampler,COMPLETE
442,0.9494317804801572,2025-04-24 21:04:31.176375,2025-04-24 21:04:32.611087,0 days 00:00:01.434712,4825.18217995295,Matern,1.4471246492697594e-05,1.364192552697364e-07,2.5,TPESampler,COMPLETE
443,0.9228200901845571,2025-04-24 21:04:31.229746,2025-04-24 21:04:33.072229,0 days 00:00:01.842483,17.398035431832753,Matern,36.263342581200455,8.254546472737955e-05,1.5,TPESampler,COMPLETE
444,0.9228147260576371,2025-04-24 21:04:31.897262,2025-04-24 21:04:33.561906,0 days 00:00:01.664644,0.5604089134730293,Matern,0.11760737981221651,0.9336675334549688,1.5,TPESampler,COMPLETE
445,0.9228200915076034,2025-04-24 21:04:32.836421,2025-04-24 21:04:34.670892,0 days 00:00:01.834471,0.3048902031873936,Matern,7.236776846565459,0.019881513752011044,2.5,TPESampler,COMPLETE
446,0.28679769874308714,2025-04-24 21:04:33.306657,2025-04-24 21:04:34.750164,0 days 00:00:01.443507,2.54066663841732,Matern,0.3842843982624415,0.004221874535128835,1.5,TPESampler,COMPLETE
447,0.2867973235359518,2025-04-24 21:04:33.788075,2025-04-24 21:04:35.478343,0 days 00:00:01.690268,2343.3997142862954,Matern,6.1507433189602585,0.5771691766313373,1.5,TPESampler,COMPLETE
448,0.9494322784862507,2025-04-24 21:04:34.845106,2025-04-24 21:04:36.471543,0 days 00:00:01.626437,0.6150039904048865,Matern,7048.701991599484,0.7266530025582743,1.5,TPESampler,COMPLETE
449,0.2887076448607667,2025-04-24 21:04:34.903325,2025-04-24 21:04:36.465423,0 days 00:00:01.562098,29.204845068689405,Matern,4.38072352353804,0.08480518619981295,2.5,TPESampler,COMPLETE
450,0.33018883479331035,2025-04-24 21:04:35.695969,2025-04-24 21:04:37.584059,0 days 00:00:01.888090,20234.295382618715,Matern,4.075266833572726,0.06823460849487613,0.5,TPESampler,COMPLETE
451,0.9228200927998039,2025-04-24 21:04:36.636840,2025-04-24 21:04:38.537174,0 days 00:00:01.900334,163.9042946530932,Matern,0.01199492501347743,0.4741196024431199,1.5,TPESampler,COMPLETE
452,0.9228200926482838,2025-04-24 21:04:36.679203,2025-04-24 21:04:38.647969,0 days 00:00:01.968766,0.3017775585792142,Matern,0.0005447893355835077,0.04883704484251697,1.5,TPESampler,COMPLETE
453,0.2867972533831391,2025-04-24 21:04:38.006965,2025-04-24 21:04:39.839153,0 days 00:00:01.832188,58.242416247009224,Matern,79.54302528873674,0.5080199558658464,1.5,TPESampler,COMPLETE
454,0.9228200929976731,2025-04-24 21:04:38.743357,2025-04-24 21:04:41.225500,0 days 00:00:02.482143,0.6633540515191598,Matern,3379.5187908066455,0.02082265512880045,2.5,TPESampler,COMPLETE
455,0.9228200922718703,2025-04-24 21:04:38.830402,2025-04-24 21:04:41.223977,0 days 00:00:02.393575,0.3305616449313144,Matern,224.8475787076095,0.003259989367004345,1.5,TPESampler,COMPLETE
456,0.9228200924981312,2025-04-24 21:04:40.080013,2025-04-24 21:04:41.475498,0 days 00:00:01.395485,603.3941158645388,Matern,544.2003014226739,0.006711555966011521,1.5,TPESampler,COMPLETE
457,0.9228200924762275,2025-04-24 21:04:41.380666,2025-04-24 21:04:44.636173,0 days 00:00:03.255507,1.9937685440474043e-06,RBF,114.97481510988055,1.999230280053571e-08,1.5,TPESampler,COMPLETE
