number,value,datetime_start,datetime_complete,duration,params_constant_value,params_kernel_type,params_length_scale,params_noise_level,params_nu,system_attrs_auto:sampler,state
1374,0.9228200894812171,2025-04-24 21:15:47.185666,2025-04-24 21:15:49.499667,0 days 00:00:02.314001,0.0668742559733822,Matern,28.64295991457832,0.0009410944657720251,1.5,TPESampler,COMPLETE
1375,0.9228200918895386,2025-04-24 21:15:47.263670,2025-04-24 21:15:48.816904,0 days 00:00:01.553234,0.3489152427533303,Matern,5.869591719499013,0.00037028835093335895,1.5,TPESampler,COMPLETE
1376,0.28679729924999753,2025-04-24 21:15:49.055776,2025-04-24 21:15:51.043420,0 days 00:00:01.987644,155.3979905648766,Matern,55.71438516725417,0.011349462028503647,1.5,TPESampler,COMPLETE
1377,0.9494317804801586,2025-04-24 21:15:49.389986,2025-04-24 21:15:50.627223,0 days 00:00:01.237237,4937.779725550294,RBF,3.1518618586044575e-05,1.8782231907339857e-08,2.5,TPESampler,COMPLETE
1378,0.9228200899092923,2025-04-24 21:15:49.848765,2025-04-24 21:15:51.417105,0 days 00:00:01.568340,1840.6812609664014,Matern,675.3287931474431,3.5393899335126035e-05,1.5,TPESampler,COMPLETE
1379,0.9494317761270763,2025-04-24 21:15:50.877463,2025-04-24 21:15:52.019671,0 days 00:00:01.142208,75261.39591469405,Matern,0.17383534467219908,0.02870227195619163,1.5,TPESampler,COMPLETE
1380,0.9228200883571607,2025-04-24 21:15:51.341058,2025-04-24 21:15:53.832104,0 days 00:00:02.491046,42846.784658238044,RBF,0.07919922837050289,0.0031246967634000872,1.5,TPESampler,COMPLETE
1381,0.28679724013449454,2025-04-24 21:15:51.698617,2025-04-24 21:15:54.637293,0 days 00:00:02.938676,501.67989028150913,Matern,10932.656808032665,0.9972970305879841,1.5,TPESampler,COMPLETE
1382,0.28679726277196604,2025-04-24 21:15:52.404901,2025-04-24 21:15:54.705890,0 days 00:00:02.300989,3553.9699598389243,Matern,23.89084528373361,0.018072139860575234,1.5,TPESampler,COMPLETE
1383,0.2867972475129912,2025-04-24 21:15:54.075091,2025-04-24 21:15:55.620241,0 days 00:00:01.545150,1.301296098007672,Matern,2.1211294332281856,0.01178536451744931,1.5,TPESampler,COMPLETE
1384,0.9228200924758103,2025-04-24 21:15:54.840505,2025-04-24 21:15:56.761645,0 days 00:00:01.921140,105.91416699027556,RBF,21.637141934005058,2.4868274181921118e-05,2.5,TPESampler,COMPLETE
1385,0.9228200914009419,2025-04-24 21:15:54.889673,2025-04-24 21:15:57.847516,0 days 00:00:02.957843,0.0005287912584262754,RBF,1647.7814437488587,0.0008099385716933452,1.5,TPESampler,COMPLETE
1386,0.28679725680891716,2025-04-24 21:15:55.858816,2025-04-24 21:15:57.676811,0 days 00:00:01.817995,5605.486477186965,Matern,9.014995368624431,0.900465454408258,1.5,TPESampler,COMPLETE
1387,0.9228200926244035,2025-04-24 21:15:56.996408,2025-04-24 21:15:59.710185,0 days 00:00:02.713777,0.23564791251011616,Matern,758.9934790025325,0.012309855811296958,1.5,TPESampler,COMPLETE
1388,0.30268458064261355,2025-04-24 21:15:57.902293,2025-04-24 21:15:59.405047,0 days 00:00:01.502754,0.2989316148685615,RBF,6.06176205130158,0.5635211966435911,1.5,TPESampler,COMPLETE
1389,0.3026845859238261,2025-04-24 21:15:58.072248,2025-04-24 21:16:00.046170,0 days 00:00:01.973922,26.293612419163548,RBF,41.974447500908425,0.04265142913691681,1.5,TPESampler,COMPLETE
1390,0.2887076485175146,2025-04-24 21:15:59.641985,2025-04-24 21:16:01.385228,0 days 00:00:01.743243,486.94610567567685,Matern,1.1626660836401224,0.005832197887251479,2.5,TPESampler,COMPLETE
1391,0.28679725574126835,2025-04-24 21:15:59.993170,2025-04-24 21:16:01.666221,0 days 00:00:01.673051,130.35158573164097,Matern,24.591723060535113,0.6582580025733848,1.5,TPESampler,COMPLETE
1392,0.28679728650924324,2025-04-24 21:16:00.330231,2025-04-24 21:16:02.130580,0 days 00:00:01.800349,498.2264228738659,Matern,19.196558831116185,0.00013797191046374676,1.5,TPESampler,COMPLETE
1393,0.28679723599249235,2025-04-24 21:16:01.606509,2025-04-24 21:16:03.521604,0 days 00:00:01.915095,556.8381867112985,Matern,40.02463748660258,0.9827441064785604,1.5,TPESampler,COMPLETE
1394,0.9228200906770107,2025-04-24 21:16:02.016006,2025-04-24 21:16:04.899656,0 days 00:00:02.883650,0.0010608146538174945,Matern,13.992619781566946,0.02878329869926044,1.5,TPESampler,COMPLETE
1395,0.2867972955774577,2025-04-24 21:16:02.411639,2025-04-24 21:16:05.278566,0 days 00:00:02.866927,0.008475906529995336,Matern,0.4963487998979978,0.00013479436923828669,1.5,TPESampler,COMPLETE
1396,0.9228200923215961,2025-04-24 21:16:03.756545,2025-04-24 21:16:05.383634,0 days 00:00:01.627089,17.93694662487232,Matern,212.19785191926758,0.001897052133954804,1.5,TPESampler,COMPLETE
1397,0.2867972569784192,2025-04-24 21:16:05.135169,2025-04-24 21:16:07.108170,0 days 00:00:01.973001,70845.9366925909,Matern,1.9950990295798485,0.009177354918304334,1.5,TPESampler,COMPLETE
1398,0.28679724006427293,2025-04-24 21:16:05.512663,2025-04-24 21:16:07.614347,0 days 00:00:02.101684,29.810767571968448,Matern,164.09682819102838,0.9054298464179332,1.5,TPESampler,COMPLETE
1399,0.28679725883219426,2025-04-24 21:16:05.700980,2025-04-24 21:16:07.961450,0 days 00:00:02.260470,3642.8655586045306,Matern,652.7606160021736,0.021378820785946273,1.5,TPESampler,COMPLETE
1400,0.28870764296802476,2025-04-24 21:16:07.557184,2025-04-24 21:16:10.542805,0 days 00:00:02.985621,1.1015661096561743e-05,Matern,0.1617707322404591,0.00518194926714044,2.5,TPESampler,COMPLETE
1401,0.2867972173807236,2025-04-24 21:16:07.857379,2025-04-24 21:16:09.667625,0 days 00:00:01.810246,29.469878632707264,Matern,1.842955410185351,0.008107208448377382,1.5,TPESampler,COMPLETE
1402,0.9228201117434673,2025-04-24 21:16:08.228802,2025-04-24 21:16:10.813718,0 days 00:00:02.584916,0.0004899074288895508,Matern,5.914935596386251,0.044413385533826594,2.5,TPESampler,COMPLETE
1403,0.28679722742033387,2025-04-24 21:16:09.896514,2025-04-24 21:16:11.538122,0 days 00:00:01.641608,1.3000255726740633,Matern,0.4368829533833763,0.0005656579791905303,1.5,TPESampler,COMPLETE
1404,0.9228200924828375,2025-04-24 21:16:10.767674,2025-04-24 21:16:12.842413,0 days 00:00:02.074739,6.839700394565173,Matern,1197.9448885673853,0.008823993761911805,1.5,TPESampler,COMPLETE
1405,0.2867972590196082,2025-04-24 21:16:11.107313,2025-04-24 21:16:12.867840,0 days 00:00:01.760527,91699.52710481176,Matern,43.2439574090578,0.39997267590670327,1.5,TPESampler,COMPLETE
1406,0.949432256179399,2025-04-24 21:16:11.823136,2025-04-24 21:16:13.710829,0 days 00:00:01.887693,0.019566793590789795,Matern,1277.9694819420545,0.2943988796035695,1.5,TPESampler,COMPLETE
1407,0.2867973389052052,2025-04-24 21:16:13.020296,2025-04-24 21:16:14.476255,0 days 00:00:01.455959,0.7171670540685453,Matern,7.19487078270726,0.08460555131111212,1.5,TPESampler,COMPLETE
1408,0.9228201007150645,2025-04-24 21:16:13.058392,2025-04-24 21:16:15.190143,0 days 00:00:02.131751,0.4409847592851149,RBF,27.455400603953073,1.92715000325246e-08,0.5,TPESampler,COMPLETE
1409,0.9494322793422623,2025-04-24 21:16:13.957521,2025-04-24 21:16:15.468859,0 days 00:00:01.511338,4.809466521128618e-06,RBF,74785.7876404386,4.471192760290801e-05,2.5,TPESampler,COMPLETE
1410,0.9228200924496662,2025-04-24 21:16:14.717230,2025-04-24 21:16:16.316305,0 days 00:00:01.599075,52.553663224991766,Matern,37.524988240985884,9.721709779308708e-05,1.5,TPESampler,COMPLETE
1411,0.9228200924987988,2025-04-24 21:16:15.422379,2025-04-24 21:16:19.536765,0 days 00:00:04.114386,4.257604078812278e-05,Matern,3704.8230352775713,1.5787882932129984e-10,0.5,TPESampler,COMPLETE
1412,0.33018881346209245,2025-04-24 21:16:15.777913,2025-04-24 21:16:17.933342,0 days 00:00:02.155429,0.00087047585889529,Matern,0.5862257595798982,2.4427144500108637e-09,0.5,TPESampler,COMPLETE
1413,0.9228200924461515,2025-04-24 21:16:16.558693,2025-04-24 21:16:18.860739,0 days 00:00:02.302046,1.6489856005521666,Matern,706.9984927390733,0.03514637097981387,1.5,TPESampler,COMPLETE
1414,0.2867972522827087,2025-04-24 21:16:18.176979,2025-04-24 21:16:19.950746,0 days 00:00:01.773767,485.78884949890835,Matern,6.3106866721961685,0.003561715896530994,1.5,TPESampler,COMPLETE
1415,0.9494322792767456,2025-04-24 21:16:19.093136,2025-04-24 21:16:20.848760,0 days 00:00:01.755624,246.29150983629464,Matern,79022.42811330248,0.866183022225296,1.5,TPESampler,COMPLETE
1416,0.2867972485707454,2025-04-24 21:16:19.786314,2025-04-24 21:16:21.777543,0 days 00:00:01.991229,702.5174883294286,Matern,291.03000732100145,0.011913996868099146,1.5,TPESampler,COMPLETE
1417,0.9228200925536186,2025-04-24 21:16:20.195268,2025-04-24 21:16:22.044318,0 days 00:00:01.849050,6.043038868156133,Matern,40.01995894041812,1.9003109537406947e-05,1.5,TPESampler,COMPLETE
1418,0.2867972555354078,2025-04-24 21:16:21.351031,2025-04-24 21:16:23.158191,0 days 00:00:01.807160,26.167572192783943,Matern,1.0230268286675952,0.005021538364123901,1.5,TPESampler,COMPLETE
1419,0.9228200924949893,2025-04-24 21:16:21.994497,2025-04-24 21:16:24.306117,0 days 00:00:02.311620,0.13020324557834972,Matern,1106.9302404449938,0.0002010526643048662,1.5,TPESampler,COMPLETE
1420,0.9228200927031041,2025-04-24 21:16:22.317337,2025-04-24 21:16:23.938850,0 days 00:00:01.621513,0.19510748146058673,Matern,9.337345631766134,0.01539243145936204,1.5,TPESampler,COMPLETE
1421,0.9228200889526009,2025-04-24 21:16:23.385479,2025-04-24 21:16:25.120556,0 days 00:00:01.735077,0.0003988402400481735,RBF,4.894995170629274,1.6837468155270226e-06,2.5,TPESampler,COMPLETE
1422,0.9494322793417138,2025-04-24 21:16:24.201505,2025-04-24 21:16:25.217093,0 days 00:00:01.015588,1116.8146489267087,Matern,8.846370424376957,0.03240502994529524,1.5,TPESampler,COMPLETE
1423,0.9228200962916638,2025-04-24 21:16:24.535727,2025-04-24 21:16:26.646956,0 days 00:00:02.111229,0.0014152567045758522,Matern,31.321376639078153,4.4029719679909696e-07,1.5,TPESampler,COMPLETE
1424,0.2867972494244825,2025-04-24 21:16:25.317557,2025-04-24 21:16:27.331412,0 days 00:00:02.013855,1858.1169054709987,Matern,286.83346415151806,0.03801823702328445,1.5,TPESampler,COMPLETE
1425,0.2867971493444806,2025-04-24 21:16:25.452674,2025-04-24 21:16:26.683599,0 days 00:00:01.230925,12.29990044069673,Matern,3.3367467250854537,0.000965512079546431,1.5,TPESampler,COMPLETE
1426,0.9228200934278149,2025-04-24 21:16:26.822569,2025-04-24 21:16:29.042471,0 days 00:00:02.219902,3.4041090776825547,Matern,0.03310993418821895,0.0003410856477572318,1.5,TPESampler,COMPLETE
1427,0.28679725323430977,2025-04-24 21:16:26.867105,2025-04-24 21:16:28.740577,0 days 00:00:01.873472,2.858809426379843,Matern,2.207334103682857,0.0008905980804219858,1.5,TPESampler,COMPLETE
1428,0.9494314520482963,2025-04-24 21:16:27.568376,2025-04-24 21:16:29.289138,0 days 00:00:01.720762,2.0109260839331027,Matern,0.20794619259283437,1.3083578246061695e-05,1.5,TPESampler,COMPLETE
1429,0.2867972602386723,2025-04-24 21:16:28.990014,2025-04-24 21:16:30.799841,0 days 00:00:01.809827,66.13591434264788,Matern,6.946988458366379,0.00025776731187290093,1.5,TPESampler,COMPLETE
1430,0.28679721503240646,2025-04-24 21:16:29.319698,2025-04-24 21:16:30.923821,0 days 00:00:01.604123,1.852355492260042,Matern,1.0197534364853569,0.0006743486070533946,1.5,TPESampler,COMPLETE
1431,0.9228200932538282,2025-04-24 21:16:29.640405,2025-04-24 21:16:31.490307,0 days 00:00:01.849902,1.2590845898883805,Matern,18.22986379366197,2.5653330605315087e-05,1.5,TPESampler,COMPLETE
1432,0.9228200911054913,2025-04-24 21:16:30.981753,2025-04-24 21:16:32.863776,0 days 00:00:01.882023,9.2800578289924e-07,RBF,5.322382150484223e-05,1.885568217883619e-10,1.5,TPESampler,COMPLETE
1433,0.2867971951266958,2025-04-24 21:16:31.158874,2025-04-24 21:16:32.723106,0 days 00:00:01.564232,10.914249649714858,Matern,3.860298529326361,0.0019327262930495625,1.5,TPESampler,COMPLETE
1434,0.9494322777696239,2025-04-24 21:16:31.795513,2025-04-24 21:16:33.212828,0 days 00:00:01.417315,48.198633071798206,Matern,5.117084643623264,9.65957581939788e-06,1.5,TPESampler,COMPLETE
1435,0.28679717583760506,2025-04-24 21:16:32.921435,2025-04-24 21:16:34.275917,0 days 00:00:01.354482,3.0129213306906495,Matern,4.485850403499587,0.0016986517449523633,1.5,TPESampler,COMPLETE
1436,0.9228200911054913,2025-04-24 21:16:33.119581,2025-04-24 21:16:35.128914,0 days 00:00:02.009333,2.553652377104991e-07,RBF,0.0006225065546565382,4.789510036186133e-10,0.5,TPESampler,COMPLETE
1437,0.28679724445228294,2025-04-24 21:16:33.457938,2025-04-24 21:16:35.182096,0 days 00:00:01.724158,192.7093303119485,Matern,0.39842852878229795,0.005388320975006033,1.5,TPESampler,COMPLETE
1438,0.9228200933003959,2025-04-24 21:16:34.489013,2025-04-24 21:16:36.527053,0 days 00:00:02.038040,5.305035439719976,Matern,23.356034292216844,0.00028576996295311954,1.5,TPESampler,COMPLETE
1439,0.2867973044973152,2025-04-24 21:16:35.297253,2025-04-24 21:16:36.648873,0 days 00:00:01.351620,1.2897729511639544,Matern,4.864211268752552,0.005826673172131131,1.5,TPESampler,COMPLETE
1440,0.9228200886001917,2025-04-24 21:16:35.431282,2025-04-24 21:16:36.839863,0 days 00:00:01.408581,0.14902214409322503,Matern,0.07448192718064187,0.004195157178586159,1.5,TPESampler,COMPLETE
1441,0.28679725553567037,2025-04-24 21:16:36.730795,2025-04-24 21:16:38.445877,0 days 00:00:01.715082,6.402195880140025,Matern,15.97437045040871,0.0013415040384666252,1.5,TPESampler,COMPLETE
1442,0.286797279815267,2025-04-24 21:16:36.853436,2025-04-24 21:16:38.532330,0 days 00:00:01.678894,9.929884615780235,Matern,1.3593733746901435,0.0055790562972596065,1.5,TPESampler,COMPLETE
1443,0.946953248154242,2025-04-24 21:16:37.135920,2025-04-24 21:16:40.140863,0 days 00:00:03.004943,34487.291638261064,Matern,1.9497890711421222e-05,0.0015067462424047692,2.5,TPESampler,COMPLETE
1444,0.28679725238676496,2025-04-24 21:16:38.609444,2025-04-24 21:16:41.239232,0 days 00:00:02.629788,1.3808934128827726,Matern,0.770490675366638,0.0004475206105822352,1.5,TPESampler,COMPLETE
1445,0.286797254030378,2025-04-24 21:16:38.763583,2025-04-24 21:16:41.345960,0 days 00:00:02.582377,40.54840460940029,Matern,0.20264363015063092,0.00787853663809633,1.5,TPESampler,COMPLETE
1446,0.9228200926015685,2025-04-24 21:16:40.344849,2025-04-24 21:16:43.854593,0 days 00:00:03.509744,2.1227679269068038e-07,Matern,0.00043141787003362595,0.0023141363344095127,0.5,TPESampler,COMPLETE
1447,0.28679725562161595,2025-04-24 21:16:41.426463,2025-04-24 21:16:43.926048,0 days 00:00:02.499585,5.431364358116346,Matern,1.44158917861116,0.00014547860638964338,1.5,TPESampler,COMPLETE
1448,0.9228200938845136,2025-04-24 21:16:41.564469,2025-04-24 21:16:44.947848,0 days 00:00:03.383379,0.04246523268371786,Matern,0.01862380681333527,3.887775658200901e-09,1.5,TPESampler,COMPLETE
1449,0.9228200925375728,2025-04-24 21:16:44.189305,2025-04-24 21:16:46.123289,0 days 00:00:01.933984,0.0015785529401433687,Matern,1.8350910206736573,8.138421715764646e-05,1.5,TPESampler,COMPLETE
1450,0.9228200911054913,2025-04-24 21:16:44.280837,2025-04-24 21:16:47.092015,0 days 00:00:02.811178,2.173096854759181e-07,RBF,2.1830349842990453e-05,1.182613983741996e-10,2.5,TPESampler,COMPLETE
1451,0.9228200889948379,2025-04-24 21:16:45.203301,2025-04-24 21:16:46.999548,0 days 00:00:01.796247,2.2018262560279624,Matern,102.40219404918705,0.00012171039558201564,1.5,TPESampler,COMPLETE
1452,0.28679725275869217,2025-04-24 21:16:46.338676,2025-04-24 21:16:49.000393,0 days 00:00:02.661717,0.039253961562862386,Matern,0.1641515227332244,0.0004757719550888648,1.5,TPESampler,COMPLETE
1453,0.9228200924252388,2025-04-24 21:16:47.186148,2025-04-24 21:16:49.140583,0 days 00:00:01.954435,18196.542627557217,RBF,53.596592001977974,5.007298116651827e-10,2.5,TPESampler,COMPLETE
1454,0.9494317804753267,2025-04-24 21:16:47.338609,2025-04-24 21:16:48.935646,0 days 00:00:01.597037,173.66034077226504,Matern,0.03957751228043297,7.708279599106822e-06,2.5,TPESampler,COMPLETE
1455,0.2867972652782985,2025-04-24 21:16:49.112502,2025-04-24 21:16:51.507897,0 days 00:00:02.395395,252.38413331297096,Matern,6.376124763590058,0.00014698770885464318,1.5,TPESampler,COMPLETE
1456,0.9228200925720247,2025-04-24 21:16:49.235019,2025-04-24 21:16:51.042019,0 days 00:00:01.807000,0.10432967636109303,Matern,9.78883119773488,0.0010306008375100598,1.5,TPESampler,COMPLETE
1457,0.9228200941143521,2025-04-24 21:16:49.388067,2025-04-24 21:16:50.975533,0 days 00:00:01.587466,0.41411930599535945,Matern,5.940137890479915,0.0007838456181256436,1.5,TPESampler,COMPLETE
1458,0.28679725330592365,2025-04-24 21:16:51.164857,2025-04-24 21:16:53.737811,0 days 00:00:02.572954,212.14209780617276,Matern,8.290857911303288,0.010547328740242147,1.5,TPESampler,COMPLETE
1459,0.949431780479655,2025-04-24 21:16:51.303347,2025-04-24 21:16:53.368121,0 days 00:00:02.064774,32433.145123595008,RBF,0.1558223199139453,0.0004242426496451664,2.5,TPESampler,COMPLETE
1460,0.28679724975116383,2025-04-24 21:16:51.821200,2025-04-24 21:16:54.120277,0 days 00:00:02.299077,1.6692383362657255,Matern,0.4780968166612496,0.071415241821716,1.5,TPESampler,COMPLETE
1461,0.28679725395196315,2025-04-24 21:16:53.588857,2025-04-24 21:16:56.140242,0 days 00:00:02.551385,5.476013001505909,Matern,0.2017758366487662,0.000616761293234447,1.5,TPESampler,COMPLETE
1462,0.28679724548465674,2025-04-24 21:16:53.963377,2025-04-24 21:16:55.779735,0 days 00:00:01.816358,109.15675142215053,Matern,6.999462154330157,0.0006684757830552481,1.5,TPESampler,COMPLETE
1463,0.2867974129804309,2025-04-24 21:16:54.336392,2025-04-24 21:16:55.703940,0 days 00:00:01.367548,1.8705285477093372,Matern,5.69478608843203,0.0063165849998127735,1.5,TPESampler,COMPLETE
1464,0.28679725209474116,2025-04-24 21:16:55.875137,2025-04-24 21:16:58.478226,0 days 00:00:02.603089,199.51258611834484,Matern,69.98969020556764,0.0005818056688467407,1.5,TPESampler,COMPLETE
1465,0.2867972682788947,2025-04-24 21:16:55.961030,2025-04-24 21:16:58.004348,0 days 00:00:02.043318,8088.218657993394,Matern,8.179141428053871,0.0012851293639830753,1.5,TPESampler,COMPLETE
1466,0.9494322793417138,2025-04-24 21:16:56.407733,2025-04-24 21:16:57.543522,0 days 00:00:01.135789,1037.3261284274986,Matern,1.3542595739193708,0.04506157648136103,1.5,TPESampler,COMPLETE
1467,0.9494322697755206,2025-04-24 21:16:57.769696,2025-04-24 21:16:59.197481,0 days 00:00:01.427785,14.742583819031385,Matern,0.8641176353639751,5.873894063612426e-05,1.5,TPESampler,COMPLETE
1468,0.2867972536906361,2025-04-24 21:16:58.241544,2025-04-24 21:17:00.886743,0 days 00:00:02.645199,0.025207620417195167,Matern,1.2376325666728853,0.021165992069563093,1.5,TPESampler,COMPLETE
1469,0.9228200931485381,2025-04-24 21:16:58.708490,2025-04-24 21:17:00.552162,0 days 00:00:01.843672,8.91446266352145,Matern,43.01113271076248,0.0019519468613834233,1.5,TPESampler,COMPLETE
1470,0.9228200929909661,2025-04-24 21:16:59.447120,2025-04-24 21:17:01.987310,0 days 00:00:02.540190,0.1529684168946744,RBF,474.0240232558111,1.2084240935719751e-05,1.5,TPESampler,COMPLETE
1471,0.2867972925931072,2025-04-24 21:17:00.961121,2025-04-24 21:17:02.991105,0 days 00:00:02.029984,13.243075451262552,Matern,2.6142689166888964,0.0013822211972463363,1.5,TPESampler,COMPLETE
1472,0.2867972552710915,2025-04-24 21:17:01.117282,2025-04-24 21:17:02.732760,0 days 00:00:01.615478,18.327756028361254,Matern,0.9537034365165322,0.03883080771688714,1.5,TPESampler,COMPLETE
1473,0.2867972671736557,2025-04-24 21:17:02.238157,2025-04-24 21:17:03.784223,0 days 00:00:01.546066,34.07541914779604,Matern,3.8084414528954573,0.05587089420771306,1.5,TPESampler,COMPLETE
1474,0.9228200933162414,2025-04-24 21:17:02.948215,2025-04-24 21:17:04.766137,0 days 00:00:01.817922,3.9948715175471654,Matern,71.61861793454958,0.0023774076700210827,1.5,TPESampler,COMPLETE
1475,0.9228200924029806,2025-04-24 21:17:03.232657,2025-04-24 21:17:05.138009,0 days 00:00:01.905352,0.01600491276770248,Matern,0.007602386336821469,1.548009743571725e-05,1.5,TPESampler,COMPLETE
1476,0.2867971874510531,2025-04-24 21:17:04.055823,2025-04-24 21:17:05.788584,0 days 00:00:01.732761,33.78181738807531,Matern,17.883361889712525,0.002132926865216384,1.5,TPESampler,COMPLETE
1477,0.922820092772048,2025-04-24 21:17:05.031860,2025-04-24 21:17:06.846510,0 days 00:00:01.814650,0.047356922125273156,Matern,3.574336249211231,0.0002583551827136363,1.5,TPESampler,COMPLETE
1478,0.2867972521546184,2025-04-24 21:17:05.364173,2025-04-24 21:17:07.366897,0 days 00:00:02.002724,69791.31827640093,Matern,26.999003652136324,0.003267844527468442,1.5,TPESampler,COMPLETE
1479,0.9228200924641703,2025-04-24 21:17:06.029480,2025-04-24 21:17:07.620599,0 days 00:00:01.591119,814.1019100718556,Matern,488.5985460213495,0.0005022787695339681,1.5,TPESampler,COMPLETE
1480,0.9494322682104654,2025-04-24 21:17:07.064485,2025-04-24 21:17:08.572284,0 days 00:00:01.507799,1.5730759165216068,Matern,1.8090567274396878,6.144940594943392e-06,1.5,TPESampler,COMPLETE
1481,0.9494322792409003,2025-04-24 21:17:07.652185,2025-04-24 21:17:08.887550,0 days 00:00:01.235365,34160.441680172094,Matern,33.181697715829685,3.714640694953454e-08,1.5,TPESampler,COMPLETE
1482,0.2867972504839279,2025-04-24 21:17:07.845158,2025-04-24 21:17:09.815916,0 days 00:00:01.970758,69290.84634463764,Matern,0.2658500801085595,0.5336356550050537,1.5,TPESampler,COMPLETE
1483,0.9494322793379124,2025-04-24 21:17:08.789078,2025-04-24 21:17:10.086040,0 days 00:00:01.296962,5999.4628678873,Matern,48.55831387957098,9.060178550795845e-05,1.5,TPESampler,COMPLETE
1484,0.9228200905981612,2025-04-24 21:17:09.159840,2025-04-24 21:17:11.069737,0 days 00:00:01.909897,50.27861472778335,RBF,14.212081912211522,0.0006108246932551365,1.5,TPESampler,COMPLETE
1485,0.2867972500436982,2025-04-24 21:17:10.035619,2025-04-24 21:17:12.975814,0 days 00:00:02.940195,0.025802556963017333,Matern,0.4106860804480297,0.009142912794895717,1.5,TPESampler,COMPLETE
1486,0.3026845772257694,2025-04-24 21:17:10.407121,2025-04-24 21:17:13.356958,0 days 00:00:02.949837,88849.69480245844,RBF,41.5241774555093,0.42756683056264105,0.5,TPESampler,COMPLETE
1487,0.9228200114246534,2025-04-24 21:17:11.303320,2025-04-24 21:17:14.277336,0 days 00:00:02.974016,5.141540642327764,RBF,0.11183357850824625,0.0013987221625949538,1.5,TPESampler,COMPLETE
