number,value,datetime_start,datetime_complete,duration,params_constant_value,params_kernel_type,params_length_scale,params_noise_level,params_nu,system_attrs_auto:sampler,state
1830,0.28679719443132873,2025-04-24 21:21:21.848395,2025-04-24 21:21:23.304105,0 days 00:00:01.455710,1.404623896764051,Matern,2.2431863697128094,0.008694283499424225,1.5,TPESampler,COMPLETE
1831,0.922820092515825,2025-04-24 21:21:23.098636,2025-04-24 21:21:25.117841,0 days 00:00:02.019205,0.18907168354016762,Matern,475.70456128171776,0.00028083031670689176,1.5,TPESampler,COMPLETE
1832,0.2867972625490518,2025-04-24 21:21:23.141007,2025-04-24 21:21:24.982711,0 days 00:00:01.841704,2660.9799786363906,Matern,1.165963369645574,0.00550160356689807,1.5,TPESampler,COMPLETE
1833,0.9228200917123544,2025-04-24 21:21:23.582171,2025-04-24 21:21:26.545424,0 days 00:00:02.963253,0.007147513876143995,RBF,12.973646248601579,0.037578022741806306,1.5,TPESampler,COMPLETE
1834,0.33018901657344113,2025-04-24 21:21:25.194903,2025-04-24 21:21:26.824776,0 days 00:00:01.629873,1.499214459571164,Matern,29.614611670352964,0.004025850194979252,0.5,TPESampler,COMPLETE
1835,0.9494322792755197,2025-04-24 21:21:25.349548,2025-04-24 21:21:26.607611,0 days 00:00:01.258063,84581.65699778669,Matern,13.394226183255732,3.060646267314427e-07,2.5,TPESampler,COMPLETE
1836,0.9228200847962682,2025-04-24 21:21:26.749458,2025-04-24 21:21:28.979550,0 days 00:00:02.230092,75983.71083069686,RBF,0.16610718182780526,0.16981813569004683,1.5,TPESampler,COMPLETE
1837,0.28679725155935276,2025-04-24 21:21:26.797830,2025-04-24 21:21:29.285297,0 days 00:00:02.487467,8370.845798607665,Matern,44.59068856877368,0.007811148097411067,1.5,TPESampler,COMPLETE
1838,0.2867972779738832,2025-04-24 21:21:27.494346,2025-04-24 21:21:30.982307,0 days 00:00:03.487961,0.0012376787073346942,Matern,0.8038589661480969,0.5211400085065961,1.5,TPESampler,COMPLETE
1839,0.28679726317518733,2025-04-24 21:21:29.214978,2025-04-24 21:21:30.897713,0 days 00:00:01.682735,817.1187156920831,Matern,124.7157824523993,0.4872591862498871,1.5,TPESampler,COMPLETE
1840,0.9494307141287773,2025-04-24 21:21:29.564986,2025-04-24 21:21:30.735807,0 days 00:00:01.170821,154.6220439533145,Matern,0.3137611894508805,2.4963474177857252e-05,1.5,TPESampler,COMPLETE
1841,0.9228164707365633,2025-04-24 21:21:30.947928,2025-04-24 21:21:32.659319,0 days 00:00:01.711391,6.994529968780108,Matern,0.11536499786992833,0.002294166136718534,1.5,TPESampler,COMPLETE
1842,0.9228200925225262,2025-04-24 21:21:31.129035,2025-04-24 21:21:33.057652,0 days 00:00:01.928617,4.555499288348321,Matern,1523.6479371892099,1.4575455364019427e-05,0.5,TPESampler,COMPLETE
1843,0.2867972381488695,2025-04-24 21:21:31.361297,2025-04-24 21:21:33.349260,0 days 00:00:01.987963,0.14574798190418842,Matern,88.64037858122475,0.7229619073075532,1.5,TPESampler,COMPLETE
1844,0.949430940030545,2025-04-24 21:21:32.890332,2025-04-24 21:21:34.226219,0 days 00:00:01.335887,82466.15152006263,Matern,0.30696738842996507,0.017087140821373626,1.5,TPESampler,COMPLETE
1845,0.922820093380107,2025-04-24 21:21:33.287060,2025-04-24 21:21:34.837884,0 days 00:00:01.550824,0.021850851404828064,Matern,5.873592558782896,6.165223962198237e-05,1.5,TPESampler,COMPLETE
1846,0.3026845829398409,2025-04-24 21:21:33.651262,2025-04-24 21:21:35.502910,0 days 00:00:01.851648,5.6809629750739585,RBF,1.103917932213826,0.006271453516283106,1.5,TPESampler,COMPLETE
1847,0.288707498357731,2025-04-24 21:21:34.454789,2025-04-24 21:21:36.311049,0 days 00:00:01.856260,353.03689199942824,Matern,18.67966354117614,0.796401912882875,2.5,TPESampler,COMPLETE
1848,0.9228200930580797,2025-04-24 21:21:35.080509,2025-04-24 21:21:37.361651,0 days 00:00:02.281142,26.888901874302718,Matern,390.32315951154993,0.007420228104855304,1.5,TPESampler,COMPLETE
1849,0.28679724499668746,2025-04-24 21:21:35.744288,2025-04-24 21:21:37.253953,0 days 00:00:01.509665,28.944761406682495,Matern,4.74375714302753,0.05081429128286135,1.5,TPESampler,COMPLETE
1850,0.2867972476025417,2025-04-24 21:21:36.541404,2025-04-24 21:21:39.080787,0 days 00:00:02.539383,5243.07611323683,Matern,856.8929703908461,0.008083253796409036,1.5,TPESampler,COMPLETE
1851,0.9228200824962514,2025-04-24 21:21:37.455966,2025-04-24 21:21:39.843694,0 days 00:00:02.387728,57.7365242221934,RBF,12832.19436426825,3.7283039335893496e-06,2.5,TPESampler,COMPLETE
1852,0.28679725938014883,2025-04-24 21:21:37.591770,2025-04-24 21:21:39.363336,0 days 00:00:01.771566,112.94200690667928,Matern,4.285562054771582,0.0004343372032936706,1.5,TPESampler,COMPLETE
1853,0.28679726828297053,2025-04-24 21:21:39.321932,2025-04-24 21:21:41.615635,0 days 00:00:02.293703,2.6655697883930105,Matern,14.763927773640745,0.0007193439344678353,1.5,TPESampler,COMPLETE
1854,0.9494322793097605,2025-04-24 21:21:39.628441,2025-04-24 21:21:40.911834,0 days 00:00:01.283393,12307.070782562161,Matern,28.74408592487448,4.020852283301965e-05,1.5,TPESampler,COMPLETE
1855,0.3026845641042332,2025-04-24 21:21:40.105492,2025-04-24 21:21:42.777519,0 days 00:00:02.672027,4986.845478458179,RBF,14148.870949820614,0.33136659170969934,1.5,TPESampler,COMPLETE
1856,0.9228200923945566,2025-04-24 21:21:41.164713,2025-04-24 21:21:42.820139,0 days 00:00:01.655426,0.04422542463286361,Matern,2.4376473830284855,0.00776700968782016,1.5,TPESampler,COMPLETE
1857,0.9228200919769661,2025-04-24 21:21:41.854809,2025-04-24 21:21:44.579119,0 days 00:00:02.724310,0.004090918416099402,RBF,0.03068513310634049,0.6360064665158975,1.5,TPESampler,COMPLETE
1858,0.28679721284204196,2025-04-24 21:21:42.940624,2025-04-24 21:21:44.608402,0 days 00:00:01.667778,66079.55698453198,Matern,1.5928987685664102,0.20137608902088344,1.5,TPESampler,COMPLETE
1859,0.9228200925571484,2025-04-24 21:21:42.988130,2025-04-24 21:21:45.304744,0 days 00:00:02.316614,0.5055779789211319,Matern,145.36458698474027,0.007861796113065943,2.5,TPESampler,COMPLETE
1860,0.28679714646722143,2025-04-24 21:21:44.738738,2025-04-24 21:21:46.441144,0 days 00:00:01.702406,26.852349032838568,Matern,35.017524616052306,0.03167698729748123,1.5,TPESampler,COMPLETE
1861,0.28679724902372594,2025-04-24 21:21:44.775138,2025-04-24 21:21:46.534734,0 days 00:00:01.759596,367.6376139299589,Matern,0.38980376971373043,0.9700963123644273,1.5,TPESampler,COMPLETE
1862,0.2867972529010152,2025-04-24 21:21:45.598324,2025-04-24 21:21:47.146523,0 days 00:00:01.548199,31.31303638672079,Matern,133.30034234451162,0.04355115507840686,1.5,TPESampler,COMPLETE
1863,0.9228200960873387,2025-04-24 21:21:46.631216,2025-04-24 21:21:49.218449,0 days 00:00:02.587233,11.194735483405294,Matern,347.547493056012,0.013622618814211666,1.5,TPESampler,COMPLETE
1864,0.28679689035805433,2025-04-24 21:21:46.833002,2025-04-24 21:21:48.444966,0 days 00:00:01.611964,14.43105220275476,Matern,67.34081952028458,0.11986508844649711,1.5,TPESampler,COMPLETE
1865,0.28679720646923906,2025-04-24 21:21:47.426962,2025-04-24 21:21:48.773881,0 days 00:00:01.346919,11.398202240183242,Matern,30.25232771252416,0.07058938896696267,1.5,TPESampler,COMPLETE
1866,0.2867972386896263,2025-04-24 21:21:48.679210,2025-04-24 21:21:50.129787,0 days 00:00:01.450577,1.4425582164086026,Matern,47.23501818915144,0.16296760156593343,1.5,TPESampler,COMPLETE
1867,0.2867972546853816,2025-04-24 21:21:49.033936,2025-04-24 21:21:50.584708,0 days 00:00:01.550772,2.9003877407367207,Matern,121.40039178914283,0.6016884736167784,1.5,TPESampler,COMPLETE
1868,0.33018882347577583,2025-04-24 21:21:49.442621,2025-04-24 21:21:51.585001,0 days 00:00:02.142380,86210.55188802513,Matern,36186.51785576187,0.004606469838435864,0.5,TPESampler,COMPLETE
1869,0.28679727534346944,2025-04-24 21:21:50.345090,2025-04-24 21:21:52.247084,0 days 00:00:01.901994,35.80099410662124,Matern,272.07885238142086,0.32336016834122105,1.5,TPESampler,COMPLETE
1870,0.9228200911054913,2025-04-24 21:21:50.827035,2025-04-24 21:21:52.621704,0 days 00:00:01.794669,1.3339117097644946e-07,RBF,0.0250668868558092,1.1240649803947003e-10,1.5,TPESampler,COMPLETE
1871,0.28679725321280486,2025-04-24 21:21:51.827907,2025-04-24 21:21:53.725428,0 days 00:00:01.897521,192.8894107039706,Matern,100.00874100778657,0.8732483821129395,1.5,TPESampler,COMPLETE
1872,0.28679728891840695,2025-04-24 21:21:52.476855,2025-04-24 21:21:54.311646,0 days 00:00:01.834791,27.586543403574666,Matern,727.0438837162988,0.08024213167196094,1.5,TPESampler,COMPLETE
1873,0.922820092681415,2025-04-24 21:21:52.857164,2025-04-24 21:21:55.397746,0 days 00:00:02.540582,86.29335194911764,Matern,1407.2095849532136,0.004031095436806924,1.5,TPESampler,COMPLETE
1874,0.46809144565374283,2025-04-24 21:21:53.949517,2025-04-24 21:21:57.588151,0 days 00:00:03.638634,4.023425048325496,Matern,247.46785691594576,0.07867397057502226,1.5,TPESampler,COMPLETE
1875,0.2867972531108091,2025-04-24 21:21:54.562636,2025-04-24 21:21:56.147177,0 days 00:00:01.584541,5.858871684062471,Matern,79.90500189513466,0.4209557124135984,1.5,TPESampler,COMPLETE
1876,0.9228200928627371,2025-04-24 21:21:55.620284,2025-04-24 21:21:57.712650,0 days 00:00:02.092366,0.3256585400610189,Matern,320.24213095213275,0.01254481682450308,1.5,TPESampler,COMPLETE
1877,0.28679725622431324,2025-04-24 21:21:56.397187,2025-04-24 21:21:57.667466,0 days 00:00:01.270279,1.1057311678611337,Matern,1.8221294919176136,0.5775537064493402,1.5,TPESampler,COMPLETE
1878,0.28679727346813605,2025-04-24 21:21:57.773330,2025-04-24 21:21:59.548522,0 days 00:00:01.775192,10.593519720001517,Matern,44.5177556440436,0.03831240404272423,1.5,TPESampler,COMPLETE
1879,0.28679726315675164,2025-04-24 21:21:57.880153,2025-04-24 21:21:59.494835,0 days 00:00:01.614682,1721.9612173449111,Matern,17.157705314364357,0.08002216002182154,1.5,TPESampler,COMPLETE
1880,0.286797247383406,2025-04-24 21:21:57.994203,2025-04-24 21:21:59.520145,0 days 00:00:01.525942,81.40196303756316,Matern,31.13393411430851,0.4380837832881171,1.5,TPESampler,COMPLETE
1881,0.28679724866891526,2025-04-24 21:21:59.673673,2025-04-24 21:22:01.126818,0 days 00:00:01.453145,2.4843299213929773,Matern,25.773173149515472,0.1543441213644643,1.5,TPESampler,COMPLETE
1882,0.2867972420710037,2025-04-24 21:21:59.743287,2025-04-24 21:22:02.862865,0 days 00:00:03.119578,829.4024703593988,Matern,1320.7957100661845,0.038770791412640164,1.5,TPESampler,COMPLETE
1883,0.28679733034469657,2025-04-24 21:21:59.769904,2025-04-24 21:22:01.423963,0 days 00:00:01.654059,194.93809279251246,Matern,94.72588465525075,0.04447478279899259,1.5,TPESampler,COMPLETE
1884,0.3026845979208847,2025-04-24 21:22:01.347321,2025-04-24 21:22:03.122630,0 days 00:00:01.775309,1.3411813873162073,RBF,405.04905901791756,0.161335050738735,1.5,TPESampler,COMPLETE
1885,0.9228200933451728,2025-04-24 21:22:01.698909,2025-04-24 21:22:04.013158,0 days 00:00:02.314249,0.3577194211962522,Matern,227.72189881075036,0.011587351155153016,1.5,TPESampler,COMPLETE
1886,0.28679715249795007,2025-04-24 21:22:03.084857,2025-04-24 21:22:04.492598,0 days 00:00:01.407741,8.692687468149298,Matern,2.326424313130066,0.08419235248148875,1.5,TPESampler,COMPLETE
1887,0.2867972448367877,2025-04-24 21:22:03.436697,2025-04-24 21:22:05.713334,0 days 00:00:02.276637,6914.343345296128,Matern,895.9604226556237,0.6865956918552921,1.5,TPESampler,COMPLETE
1888,0.2867972546750018,2025-04-24 21:22:04.244209,2025-04-24 21:22:05.678532,0 days 00:00:01.434323,14.558593585520278,Matern,5.855352758701956,0.6536935659750427,1.5,TPESampler,COMPLETE
1889,0.2867970727933165,2025-04-24 21:22:04.710823,2025-04-24 21:22:06.152084,0 days 00:00:01.441261,19.01201464682931,Matern,0.46044755416052513,0.12815687860561234,1.5,TPESampler,COMPLETE
1890,0.28679724882467267,2025-04-24 21:22:05.840387,2025-04-24 21:22:07.407432,0 days 00:00:01.567045,4.879802173261163,Matern,1.2788062046384334,0.45044379947590363,1.5,TPESampler,COMPLETE
1891,0.28679723590839706,2025-04-24 21:22:05.882573,2025-04-24 21:22:08.120488,0 days 00:00:02.237915,136.13552842343293,Matern,0.26103980414042155,0.045541447581886156,1.5,TPESampler,COMPLETE
1892,0.2867972504026286,2025-04-24 21:22:06.494447,2025-04-24 21:22:08.084609,0 days 00:00:01.590162,18.528240144997504,Matern,17.132758615538204,0.1620606595205875,1.5,TPESampler,COMPLETE
1893,0.9228200918668721,2025-04-24 21:22:07.626035,2025-04-24 21:22:09.239480,0 days 00:00:01.613445,1.915523123729448,Matern,0.07265549438357248,0.9516828097311638,1.5,TPESampler,COMPLETE
1894,0.9494317803972909,2025-04-24 21:22:08.298973,2025-04-24 21:22:09.762035,0 days 00:00:01.463062,85.47271157741766,Matern,0.04462328241955867,0.038886041042774815,1.5,TPESampler,COMPLETE
1895,0.2867972500856205,2025-04-24 21:22:08.351507,2025-04-24 21:22:09.983354,0 days 00:00:01.631847,10.89534670148411,Matern,12.885968988933287,0.1483545754371848,1.5,TPESampler,COMPLETE
1896,0.2867972599461364,2025-04-24 21:22:09.530689,2025-04-24 21:22:11.076877,0 days 00:00:01.546188,104.12637024782164,Matern,4.12019152562935,0.20153834312885072,1.5,TPESampler,COMPLETE
1897,0.28679725299737635,2025-04-24 21:22:10.019797,2025-04-24 21:22:11.386564,0 days 00:00:01.366767,2.2821288875225347,Matern,3.2003002402484793,0.7493593202788988,1.5,TPESampler,COMPLETE
1898,0.9228200925851305,2025-04-24 21:22:10.278468,2025-04-24 21:22:11.904002,0 days 00:00:01.625534,118.90328277140411,Matern,0.05096572713731825,0.279681348486771,1.5,TPESampler,COMPLETE
1899,0.2867972453745517,2025-04-24 21:22:11.340984,2025-04-24 21:22:14.107747,0 days 00:00:02.766763,2.4275759259151766,Matern,0.13974629804336813,0.26845788903446266,1.5,TPESampler,COMPLETE
1900,0.9228200923957586,2025-04-24 21:22:11.668884,2025-04-24 21:22:13.680995,0 days 00:00:02.012111,0.21063435533309022,Matern,0.013060412102623587,0.3467218691837077,2.5,TPESampler,COMPLETE
1901,0.9228200926782738,2025-04-24 21:22:12.178995,2025-04-24 21:22:13.775601,0 days 00:00:01.596606,1.5217880110816375,Matern,0.061568419709981594,0.1733706811856924,1.5,TPESampler,COMPLETE
1902,0.9228201057956997,2025-04-24 21:22:13.861533,2025-04-24 21:22:15.317382,0 days 00:00:01.455849,2.8610447771439986,RBF,0.007506925536934499,0.5673234397223226,1.5,TPESampler,COMPLETE
1903,0.28679724720443,2025-04-24 21:22:13.994112,2025-04-24 21:22:16.567894,0 days 00:00:02.573782,17.837215544807986,Matern,0.13222713378178358,0.04837803895473808,1.5,TPESampler,COMPLETE
1904,0.2867972338621122,2025-04-24 21:22:14.388231,2025-04-24 21:22:16.069439,0 days 00:00:01.681208,36.50693334169765,Matern,0.26175066025252036,0.2020380316859418,1.5,TPESampler,COMPLETE
1905,0.2867972468645582,2025-04-24 21:22:15.535142,2025-04-24 21:22:17.248370,0 days 00:00:01.713228,0.09371433966772336,Matern,11.139780011695631,0.9950063416430083,1.5,TPESampler,COMPLETE
1906,0.2867972641540192,2025-04-24 21:22:16.313613,2025-04-24 21:22:17.882403,0 days 00:00:01.568790,49.707483436939285,Matern,1.8980114676100284,0.4315122492813334,1.5,TPESampler,COMPLETE
1907,0.28679725663665295,2025-04-24 21:22:16.814821,2025-04-24 21:22:18.780895,0 days 00:00:01.966074,9.676193048014422,Matern,0.6681603443716938,0.6391720012477722,1.5,TPESampler,COMPLETE
1908,0.9228200924847029,2025-04-24 21:22:17.633953,2025-04-24 21:22:19.890223,0 days 00:00:02.256270,508.2499909894781,Matern,0.025395667154750935,0.0024790074403461793,2.5,TPESampler,COMPLETE
1909,0.9494322780708586,2025-04-24 21:22:18.120258,2025-04-24 21:22:19.837786,0 days 00:00:01.717528,3.977576782676023e-07,Matern,3306.7580936849613,0.600104500484562,2.5,TPESampler,COMPLETE
1910,0.2867973721377105,2025-04-24 21:22:19.167166,2025-04-24 21:22:21.120621,0 days 00:00:01.953455,0.232034093164736,Matern,4.5884142364853835,0.030317190118225514,1.5,TPESampler,COMPLETE
1911,0.3301888889621333,2025-04-24 21:22:20.095445,2025-04-24 21:22:21.614396,0 days 00:00:01.518951,3.3144193447853354,Matern,6.509190937580832,0.03303640202434173,0.5,TPESampler,COMPLETE
1912,0.28679716778009146,2025-04-24 21:22:20.224657,2025-04-24 21:22:21.738491,0 days 00:00:01.513834,0.33212824330509905,Matern,1.579778515302054,0.8814910243702248,1.5,TPESampler,COMPLETE
1913,0.9228200905190674,2025-04-24 21:22:21.364486,2025-04-24 21:22:23.156444,0 days 00:00:01.791958,0.1072215608030067,Matern,0.0013278477635023168,0.49281922301914477,1.5,TPESampler,COMPLETE
1914,0.2867972523846981,2025-04-24 21:22:21.869754,2025-04-24 21:22:23.229309,0 days 00:00:01.359555,52.144402918416176,Matern,16.944120658766806,0.02641605676330368,1.5,TPESampler,COMPLETE
1915,0.2867972546440548,2025-04-24 21:22:22.179984,2025-04-24 21:22:23.757200,0 days 00:00:01.577216,14.054285822365673,Matern,2.436937729703399,0.17041247186674302,1.5,TPESampler,COMPLETE
1916,0.28679723482127545,2025-04-24 21:22:23.330303,2025-04-24 21:22:25.180788,0 days 00:00:01.850485,0.014873393840400638,Matern,1.6043376922677948,0.08209774417778679,1.5,TPESampler,COMPLETE
1917,0.28679725479705687,2025-04-24 21:22:23.472667,2025-04-24 21:22:25.119891,0 days 00:00:01.647224,5.282071778031273,Matern,3.8822041149636988,0.03451398072961975,1.5,TPESampler,COMPLETE
1918,0.2867972524527565,2025-04-24 21:22:24.030738,2025-04-24 21:22:25.248804,0 days 00:00:01.218066,16.133756060382748,Matern,1.5303100342883027,0.11102719624588196,1.5,TPESampler,COMPLETE
1919,0.2867972419992226,2025-04-24 21:22:25.304082,2025-04-24 21:22:26.804671,0 days 00:00:01.500589,96.02363241686325,Matern,20.588232890401354,0.04360254979488173,1.5,TPESampler,COMPLETE
1920,0.28679725326424427,2025-04-24 21:22:25.361073,2025-04-24 21:22:27.975851,0 days 00:00:02.614778,9.102200244067356,Matern,878.9601805465654,0.05231388621155357,1.5,TPESampler,COMPLETE
1921,0.9228200931991721,2025-04-24 21:22:25.535650,2025-04-24 21:22:27.702531,0 days 00:00:02.166881,10.072738684057615,Matern,0.00269791721828501,0.014929071268920131,1.5,TPESampler,COMPLETE
1922,0.2867972331973008,2025-04-24 21:22:27.042639,2025-04-24 21:22:28.370064,0 days 00:00:01.327425,5.966953468070121,Matern,1.7583537315815068,0.038955760126107346,1.5,TPESampler,COMPLETE
1923,0.2867972379254922,2025-04-24 21:22:27.933759,2025-04-24 21:22:29.529968,0 days 00:00:01.596209,14.915147122271666,Matern,82.02187914842911,0.44984833863011764,1.5,TPESampler,COMPLETE
1924,0.9228200925211255,2025-04-24 21:22:28.263899,2025-04-24 21:22:29.562735,0 days 00:00:01.298836,306.440984960992,Matern,425.34859349659143,0.011867068793310542,1.5,TPESampler,COMPLETE
1925,0.9228200925190169,2025-04-24 21:22:28.629608,2025-04-24 21:22:30.999028,0 days 00:00:02.369420,3.4081827351086497e-06,Matern,0.0009301912077459074,1.232963687681213e-05,2.5,TPESampler,COMPLETE
1926,0.2867972606876675,2025-04-24 21:22:29.715308,2025-04-24 21:22:31.318141,0 days 00:00:01.602833,2.6082007584494153,Matern,0.5550223312953078,0.017343823518977942,1.5,TPESampler,COMPLETE
1927,0.2867972065692815,2025-04-24 21:22:29.764156,2025-04-24 21:22:31.367186,0 days 00:00:01.603030,0.22551019011572188,Matern,0.3008036267682309,0.11729207228482506,1.5,TPESampler,COMPLETE
1928,0.286797266813127,2025-04-24 21:22:31.234920,2025-04-24 21:22:32.959777,0 days 00:00:01.724857,0.06261652222061545,Matern,27.54823200511159,0.07098126382795475,1.5,TPESampler,COMPLETE
1929,0.2867972606930321,2025-04-24 21:22:31.571427,2025-04-24 21:22:33.109966,0 days 00:00:01.538539,127.12687044034654,Matern,21.268441990634237,0.9801112622528686,1.5,TPESampler,COMPLETE
1930,0.2867972627841531,2025-04-24 21:22:31.616987,2025-04-24 21:22:33.802738,0 days 00:00:02.185751,61.852428809905184,Matern,174.93301572955014,0.9437992747636793,1.5,TPESampler,COMPLETE
1931,0.28679725322271754,2025-04-24 21:22:33.157481,2025-04-24 21:22:34.701351,0 days 00:00:01.543870,0.08763320730396314,Matern,39.955861744161005,0.7661092297733164,1.5,TPESampler,COMPLETE
1932,0.28679727510773867,2025-04-24 21:22:33.345249,2025-04-24 21:22:34.974219,0 days 00:00:01.628970,0.3594701194168383,Matern,0.23354977363592203,0.08161411230497116,1.5,TPESampler,COMPLETE
1933,0.2867972643118407,2025-04-24 21:22:34.031460,2025-04-24 21:22:36.107353,0 days 00:00:02.075893,512.7686525687179,Matern,568.7578856643313,0.08977207483186783,1.5,TPESampler,COMPLETE
1934,0.9228200809598043,2025-04-24 21:22:34.926815,2025-04-24 21:22:37.249007,0 days 00:00:02.322192,0.9320244966451752,Matern,613.501595775172,0.0033616430569225544,1.5,TPESampler,COMPLETE
1935,0.9228200902250105,2025-04-24 21:22:35.235826,2025-04-24 21:22:37.201300,0 days 00:00:01.965474,9.29528690508457,Matern,203.5408073727552,0.028344807654456707,1.5,TPESampler,COMPLETE
1936,0.92282009560538,2025-04-24 21:22:36.339142,2025-04-24 21:22:38.382722,0 days 00:00:02.043580,1.7704479662215102,Matern,337.5846652096469,0.03262936219608346,1.5,TPESampler,COMPLETE
1937,0.28679724098228426,2025-04-24 21:22:37.378101,2025-04-24 21:22:39.283763,0 days 00:00:01.905662,13.561917653175978,Matern,0.24563302023719732,0.21245178366515213,1.5,TPESampler,COMPLETE
1938,0.9228200947142436,2025-04-24 21:22:37.416732,2025-04-24 21:22:40.216229,0 days 00:00:02.799497,47545.644044749766,Matern,45688.49936964495,0.0019498239336583924,1.5,TPESampler,COMPLETE
1939,0.28679725424657665,2025-04-24 21:22:38.615675,2025-04-24 21:22:40.142308,0 days 00:00:01.526633,34.29138720415869,Matern,5.643003233148394,0.04536403123119705,1.5,TPESampler,COMPLETE
1940,0.2867972488843826,2025-04-24 21:22:39.503777,2025-04-24 21:22:41.254957,0 days 00:00:01.751180,33.14944061855382,Matern,23.599522680464283,0.017299225820624164,1.5,TPESampler,COMPLETE
1941,0.922820078310142,2025-04-24 21:22:40.334814,2025-04-24 21:22:43.024581,0 days 00:00:02.689767,235.27720686435768,Matern,387.32196547901634,0.0022298407543420357,2.5,TPESampler,COMPLETE
1942,0.922820092305428,2025-04-24 21:22:40.464903,2025-04-24 21:22:44.117788,0 days 00:00:03.652885,228.90031595898478,Matern,1956.754897842077,0.0033215786073810495,1.5,TPESampler,COMPLETE
1943,0.9228200979315986,2025-04-24 21:22:41.504935,2025-04-24 21:22:43.551995,0 days 00:00:02.047060,94.629263630039,Matern,0.01643142287543392,0.04244619192176973,1.5,TPESampler,COMPLETE
