number,value,datetime_start,datetime_complete,duration,params_constant_value,params_kernel_type,params_length_scale,params_noise_level,params_nu,system_attrs_auto:sampler,state
1146,0.2867972544090408,2025-04-24 21:13:04.373638,2025-04-24 21:13:06.483373,0 days 00:00:02.109735,4604.350900415001,Matern,2104.353392854209,0.02443575507981185,1.5,TPESampler,COMPLETE
1147,0.2867972254299173,2025-04-24 21:13:04.779884,2025-04-24 21:13:06.443464,0 days 00:00:01.663580,22.084710088344533,Matern,39.084544141817496,0.028016224817709687,1.5,TPESampler,COMPLETE
1148,0.2867972477308147,2025-04-24 21:13:05.593843,2025-04-24 21:13:07.476342,0 days 00:00:01.882499,1142.4113866626033,Matern,45.397224535410544,0.920157104527735,1.5,TPESampler,COMPLETE
1149,0.9494317804801826,2025-04-24 21:13:06.597579,2025-04-24 21:13:08.053065,0 days 00:00:01.455486,6168.159894587018,RBF,0.003739262041294068,2.502366045521203e-08,1.5,TPESampler,COMPLETE
1150,0.949432253022107,2025-04-24 21:13:06.653369,2025-04-24 21:13:08.699062,0 days 00:00:02.045693,0.004524090472740007,Matern,1119.2979359711323,0.09646733169198783,1.5,TPESampler,COMPLETE
1151,0.286797295958329,2025-04-24 21:13:07.698963,2025-04-24 21:13:09.356646,0 days 00:00:01.657683,94160.60874490929,Matern,0.6974255310182275,0.1635061659792843,1.5,TPESampler,COMPLETE
1152,0.9228200926984796,2025-04-24 21:13:08.278609,2025-04-24 21:13:10.567308,0 days 00:00:02.288699,4.0982821706136,Matern,1303.3398319312498,0.010833363970789992,1.5,TPESampler,COMPLETE
1153,0.9228200898499248,2025-04-24 21:13:08.944760,2025-04-24 21:13:11.428737,0 days 00:00:02.483977,929.5616094071091,Matern,19814.175256695948,0.004845274852863043,1.5,TPESampler,COMPLETE
1154,0.9494322793085358,2025-04-24 21:13:09.642007,2025-04-24 21:13:11.800410,0 days 00:00:02.158403,1.5729688416686205,Matern,3.5715740632936672,8.18266918912903e-06,1.5,TPESampler,COMPLETE
1155,0.9228200914483434,2025-04-24 21:13:10.783181,2025-04-24 21:13:12.662969,0 days 00:00:01.879788,0.13083964044980934,Matern,11.31466597480916,5.561659059237452e-05,0.5,TPESampler,COMPLETE
1156,0.9494322084011463,2025-04-24 21:13:11.651957,2025-04-24 21:13:12.764628,0 days 00:00:01.112671,18192.114791057513,Matern,97.14039142925775,3.28818765079824e-06,0.5,TPESampler,COMPLETE
1157,0.28679725482510277,2025-04-24 21:13:12.025485,2025-04-24 21:13:14.152898,0 days 00:00:02.127413,0.14924080588981675,Matern,31.243044364698875,0.03427583825665155,1.5,TPESampler,COMPLETE
1158,0.2867972497014568,2025-04-24 21:13:12.845655,2025-04-24 21:13:15.198998,0 days 00:00:02.353343,32.719019414779325,Matern,1648.0793901644931,0.7516594697978325,1.5,TPESampler,COMPLETE
1159,0.9228197413305353,2025-04-24 21:13:12.925811,2025-04-24 21:13:14.481684,0 days 00:00:01.555873,909.102967414855,Matern,0.09929889731210396,0.003870715818512844,1.5,TPESampler,COMPLETE
1160,0.2867972528149856,2025-04-24 21:13:14.485648,2025-04-24 21:13:16.969403,0 days 00:00:02.483755,95187.43185759695,Matern,39.39586829853897,0.0002691035282877398,1.5,TPESampler,COMPLETE
1161,0.9228200933207966,2025-04-24 21:13:14.896596,2025-04-24 21:13:16.703988,0 days 00:00:01.807392,0.15964511531795533,Matern,0.06681423094579424,0.0001797213771582362,1.5,TPESampler,COMPLETE
1162,0.9494322790696748,2025-04-24 21:13:15.563809,2025-04-24 21:13:16.973391,0 days 00:00:01.409582,0.005997433453071112,Matern,9559.44330967175,0.9190929947587073,1.5,TPESampler,COMPLETE
1163,0.286797252904027,2025-04-24 21:13:16.917995,2025-04-24 21:13:18.802967,0 days 00:00:01.884972,0.5587561582689865,Matern,0.1731858375893104,0.011175570192771716,1.5,TPESampler,COMPLETE
1164,0.2867972533125493,2025-04-24 21:13:17.207199,2025-04-24 21:13:19.573613,0 days 00:00:02.366414,147.39545645806953,Matern,515.5135653956326,0.035115586895802686,1.5,TPESampler,COMPLETE
1165,0.2867972457362231,2025-04-24 21:13:17.256077,2025-04-24 21:13:19.189548,0 days 00:00:01.933471,0.0012311534491607928,Matern,4.927719248233494,0.02747163186215499,1.5,TPESampler,COMPLETE
1166,0.286797250147149,2025-04-24 21:13:19.053346,2025-04-24 21:13:21.109457,0 days 00:00:02.056111,68.00260306757785,Matern,10.35891190013752,0.00015655552038292955,1.5,TPESampler,COMPLETE
1167,0.9228200926233356,2025-04-24 21:13:19.516192,2025-04-24 21:13:22.540173,0 days 00:00:03.023981,20.914846867757177,Matern,823.7508504961398,0.005395744841188621,2.5,TPESampler,COMPLETE
1168,0.2867972518083017,2025-04-24 21:13:19.821873,2025-04-24 21:13:21.896618,0 days 00:00:02.074745,2302.8809295660762,Matern,139.35186973949183,0.0011106646164326186,1.5,TPESampler,COMPLETE
1169,0.2867972495104811,2025-04-24 21:13:21.382470,2025-04-24 21:13:23.639543,0 days 00:00:02.257073,86941.45681338829,Matern,89077.64532197814,0.3312229061219269,1.5,TPESampler,COMPLETE
1170,0.2867971396429866,2025-04-24 21:13:22.142787,2025-04-24 21:13:23.602812,0 days 00:00:01.460025,7.234032983355159,Matern,50.117550530356084,0.050789653543543097,1.5,TPESampler,COMPLETE
1171,0.2867972445791402,2025-04-24 21:13:22.778257,2025-04-24 21:13:24.412887,0 days 00:00:01.634630,16.5237059291645,Matern,6.3037738428837695,0.005080067502186854,1.5,TPESampler,COMPLETE
1172,0.9228200924864616,2025-04-24 21:13:23.757977,2025-04-24 21:13:26.080880,0 days 00:00:02.322903,0.22575811200770107,Matern,167.9292462070602,8.250865287347451e-05,1.5,TPESampler,COMPLETE
1173,0.922820091184248,2025-04-24 21:13:23.816260,2025-04-24 21:13:25.393852,0 days 00:00:01.577592,0.5531416414464108,Matern,0.011055148094172943,0.003987432998698466,2.5,TPESampler,COMPLETE
1174,0.9228200924738678,2025-04-24 21:13:24.677554,2025-04-24 21:13:27.087798,0 days 00:00:02.410244,0.00647158392249402,RBF,1211.8130982743646,7.065803207620759e-09,1.5,TPESampler,COMPLETE
1175,0.9228201000935605,2025-04-24 21:13:25.599611,2025-04-24 21:13:26.973061,0 days 00:00:01.373450,0.216928655868532,RBF,4.388263720253746,0.0017898664426059913,1.5,TPESampler,COMPLETE
1176,0.28679722828115806,2025-04-24 21:13:26.303369,2025-04-24 21:13:27.967894,0 days 00:00:01.664525,19.94048967767004,Matern,5.63889699893373,0.005120270323990832,1.5,TPESampler,COMPLETE
1177,0.2867972415329694,2025-04-24 21:13:27.197107,2025-04-24 21:13:28.918805,0 days 00:00:01.721698,2.65502918074336,Matern,0.4426697986811154,0.017703431332178325,1.5,TPESampler,COMPLETE
1178,0.30268460170878836,2025-04-24 21:13:27.310139,2025-04-24 21:13:30.553273,0 days 00:00:03.243134,1.6209854878478e-07,RBF,0.813400554647167,4.969370610963441e-08,1.5,TPESampler,COMPLETE
1179,0.28679724473603124,2025-04-24 21:13:28.196048,2025-04-24 21:13:29.570084,0 days 00:00:01.374036,22.367247018395084,Matern,7.281858504953311,0.13401148398722623,1.5,TPESampler,COMPLETE
1180,0.9228195434819118,2025-04-24 21:13:29.162993,2025-04-24 21:13:30.641157,0 days 00:00:01.478164,0.7939257238848612,Matern,9.30685006821105,0.0031652485729834583,1.5,TPESampler,COMPLETE
1181,0.9228200911338522,2025-04-24 21:13:29.813306,2025-04-24 21:13:32.342336,0 days 00:00:02.529030,0.2827107902419523,Matern,82.70631389870698,0.0032893162451626745,1.5,TPESampler,COMPLETE
1182,0.2867972548805616,2025-04-24 21:13:30.709566,2025-04-24 21:13:32.261084,0 days 00:00:01.551518,1.2363900585894312,Matern,57.63270910837054,0.0991382392301205,1.5,TPESampler,COMPLETE
1183,0.9494322793417138,2025-04-24 21:13:30.841473,2025-04-24 21:13:31.884800,0 days 00:00:01.043327,174.43881220901324,Matern,2.083650792092081,0.02114372306734058,1.5,TPESampler,COMPLETE
1184,0.9228200924652205,2025-04-24 21:13:32.107216,2025-04-24 21:13:34.012154,0 days 00:00:01.904938,0.9314702970397285,Matern,20.92311997935645,0.017246784418576397,1.5,TPESampler,COMPLETE
1185,0.286797189087507,2025-04-24 21:13:32.459444,2025-04-24 21:13:34.268988,0 days 00:00:01.809544,1290.7720193790158,Matern,0.33364029678445056,0.0004069401693074998,1.5,TPESampler,COMPLETE
1186,0.2867972482433497,2025-04-24 21:13:32.545224,2025-04-24 21:13:34.270425,0 days 00:00:01.725201,95.80502562189298,Matern,0.7890278344149837,0.00172211684562601,1.5,TPESampler,COMPLETE
1187,0.9228200895060423,2025-04-24 21:13:34.224808,2025-04-24 21:13:36.924608,0 days 00:00:02.699800,1628.1273084447703,Matern,0.07668003223109116,0.0010642149938560144,1.5,TPESampler,COMPLETE
1188,0.9228200926805983,2025-04-24 21:13:34.529078,2025-04-24 21:13:36.222653,0 days 00:00:01.693575,0.6145261168232635,Matern,15.014845628909177,7.778366238723555e-05,1.5,TPESampler,COMPLETE
1189,0.9494322787595789,2025-04-24 21:13:34.577205,2025-04-24 21:13:36.090850,0 days 00:00:01.513645,28765.810789961684,Matern,1.547606863085562,1.976701655929541e-05,1.5,TPESampler,COMPLETE
1190,0.33018864055015656,2025-04-24 21:13:36.295501,2025-04-24 21:13:38.183009,0 days 00:00:01.887508,169.84804697731926,Matern,0.4001317697840946,0.0025256007172128466,0.5,TPESampler,COMPLETE
1191,0.9494322792785443,2025-04-24 21:13:36.461326,2025-04-24 21:13:38.271448,0 days 00:00:01.810122,0.019119343259720385,RBF,11384.355459215916,0.03683132232955223,2.5,TPESampler,COMPLETE
1192,0.922819340045141,2025-04-24 21:13:37.161380,2025-04-24 21:13:38.560034,0 days 00:00:01.398654,108.70320847909905,Matern,0.10422374064474152,0.00025152702548322944,1.5,TPESampler,COMPLETE
1193,0.28679727613624445,2025-04-24 21:13:38.353933,2025-04-24 21:13:40.954952,0 days 00:00:02.601019,543.4806824758824,Matern,0.1669291477295283,0.00031577698855336995,1.5,TPESampler,COMPLETE
1194,0.28679730532263936,2025-04-24 21:13:38.481210,2025-04-24 21:13:41.143152,0 days 00:00:02.661942,0.009505348121270277,Matern,1.1200840267736683,0.00348746847547162,1.5,TPESampler,COMPLETE
1195,0.9494322777297602,2025-04-24 21:13:38.821816,2025-04-24 21:13:39.964772,0 days 00:00:01.142956,1025.2670326947327,Matern,1.683482079267248,2.9358423560053997e-06,1.5,TPESampler,COMPLETE
1196,0.3026846436499216,2025-04-24 21:13:40.203409,2025-04-24 21:13:43.481444,0 days 00:00:03.278035,0.009312228363332049,RBF,0.5278737287273313,4.539988065442713e-05,0.5,TPESampler,COMPLETE
1197,0.9494322793301675,2025-04-24 21:13:41.146940,2025-04-24 21:13:42.403978,0 days 00:00:01.257038,817.7375248425012,Matern,3.448175749386832,0.0001512022882131715,1.5,TPESampler,COMPLETE
1198,0.9228200722490285,2025-04-24 21:13:41.355802,2025-04-24 21:13:43.028764,0 days 00:00:01.672962,22.00405470637429,Matern,0.08487849609467918,0.00018385944762002495,1.5,TPESampler,COMPLETE
1199,0.28679725169933856,2025-04-24 21:13:42.626154,2025-04-24 21:13:44.503029,0 days 00:00:01.876875,90481.56242443938,Matern,1.4024627579818993,0.0034844800846831783,1.5,TPESampler,COMPLETE
1200,0.949431780480034,2025-04-24 21:13:43.249956,2025-04-24 21:13:44.559999,0 days 00:00:01.310043,109.71432408605637,Matern,0.07727582875147217,1.4142133481015418e-05,1.5,TPESampler,COMPLETE
1201,0.2867972708618015,2025-04-24 21:13:43.722892,2025-04-24 21:13:45.791161,0 days 00:00:02.068269,55692.78719182688,Matern,2.72708751875749,0.9755030623444747,1.5,TPESampler,COMPLETE
1202,0.949432270502988,2025-04-24 21:13:44.669760,2025-04-24 21:13:46.036019,0 days 00:00:01.366259,28.00848001981248,Matern,0.7961507866564261,5.28447312987818e-05,1.5,TPESampler,COMPLETE
1203,0.9494306607278787,2025-04-24 21:13:44.774203,2025-04-24 21:13:46.194498,0 days 00:00:01.420295,1311.3955866004007,Matern,0.27802475460545156,9.261486881002745e-05,0.5,TPESampler,COMPLETE
1204,0.2867972534568311,2025-04-24 21:13:45.997580,2025-04-24 21:13:48.570238,0 days 00:00:02.572658,3251.233192613071,Matern,0.19978788107287263,0.0008553003212550882,1.5,TPESampler,COMPLETE
1205,0.28679725284513463,2025-04-24 21:13:46.245889,2025-04-24 21:13:48.001775,0 days 00:00:01.755886,4508.733113223462,Matern,1.1834261015037848,0.008001431836584331,1.5,TPESampler,COMPLETE
1206,0.28679725323510113,2025-04-24 21:13:46.485869,2025-04-24 21:13:48.577963,0 days 00:00:02.092094,1310.7070655832254,Matern,3.85522824472196,0.0009508179503724419,1.5,TPESampler,COMPLETE
1207,0.2867972421250078,2025-04-24 21:13:48.233678,2025-04-24 21:13:50.125461,0 days 00:00:01.891783,110.86740563033511,Matern,0.3094520700719878,0.0032120056746815276,1.5,TPESampler,COMPLETE
1208,0.9494317804781452,2025-04-24 21:13:48.845601,2025-04-24 21:13:50.222017,0 days 00:00:01.376416,30546.342630651092,Matern,0.004174462233770508,0.015612912412531904,1.5,TPESampler,COMPLETE
1209,0.9228200935953109,2025-04-24 21:13:48.906587,2025-04-24 21:13:50.733795,0 days 00:00:01.827208,10730.078684275613,Matern,0.0006378452078507061,0.005764780035539459,1.5,TPESampler,COMPLETE
1210,0.9494322784090611,2025-04-24 21:13:50.313009,2025-04-24 21:13:51.845101,0 days 00:00:01.532092,8836.821277095025,Matern,1.047335945577888,4.096696632606603e-05,1.5,TPESampler,COMPLETE
1211,0.9494317804796852,2025-04-24 21:13:50.401128,2025-04-24 21:13:52.191867,0 days 00:00:01.790739,14454.771484644658,Matern,0.0072234522934436895,0.00016969991848232285,1.5,TPESampler,COMPLETE
1212,0.9494322793417034,2025-04-24 21:13:51.078997,2025-04-24 21:13:52.150605,0 days 00:00:01.071608,936.0927869683004,Matern,8.420517841084276,0.026529064678854887,1.5,TPESampler,COMPLETE
1213,0.9228200926955553,2025-04-24 21:13:52.108432,2025-04-24 21:13:54.267024,0 days 00:00:02.158592,2.8278841106933195,RBF,99785.22936958101,2.0698649232034062e-07,0.5,TPESampler,COMPLETE
1214,0.922820092965467,2025-04-24 21:13:52.430925,2025-04-24 21:13:55.825516,0 days 00:00:03.394591,30.263360893206574,Matern,28.8212670096991,1.318060766286916e-05,1.5,TPESampler,COMPLETE
1215,0.2867971251920219,2025-04-24 21:13:52.480643,2025-04-24 21:13:54.359063,0 days 00:00:01.878420,38.84625501107271,Matern,16.839625902837042,0.0007322362493751965,1.5,TPESampler,COMPLETE
1216,0.9228200927395932,2025-04-24 21:13:54.438978,2025-04-24 21:13:56.077535,0 days 00:00:01.638557,3.532379953634333,Matern,95.85330274623735,0.0003152901783229547,1.5,TPESampler,COMPLETE
1217,0.9228200923238374,2025-04-24 21:13:54.513769,2025-04-24 21:13:56.398454,0 days 00:00:01.884685,1.9130348572881464,Matern,22.384108287837503,0.00032885410838705314,1.5,TPESampler,COMPLETE
1218,0.28679726452930343,2025-04-24 21:13:56.035064,2025-04-24 21:13:57.819721,0 days 00:00:01.784657,92.17514282274547,Matern,32.66516979749902,0.0005860158174617703,1.5,TPESampler,COMPLETE
1219,0.2867973020502111,2025-04-24 21:13:56.306048,2025-04-24 21:13:57.889036,0 days 00:00:01.582988,0.32165641318362576,Matern,0.7096466125813875,0.0018906303382889306,1.5,TPESampler,COMPLETE
1220,0.9228200916853516,2025-04-24 21:13:56.652573,2025-04-24 21:13:58.553264,0 days 00:00:01.900691,251.2276556628901,Matern,144.10426109979682,0.00015494290174943192,1.5,TPESampler,COMPLETE
1221,0.28679725238963355,2025-04-24 21:13:58.006373,2025-04-24 21:13:59.829699,0 days 00:00:01.823326,23.489026244127633,Matern,38.740052585273595,0.005895395125998377,1.5,TPESampler,COMPLETE
1222,0.922820093496354,2025-04-24 21:13:58.150062,2025-04-24 21:14:00.084606,0 days 00:00:01.934544,0.13243273974838485,Matern,2.7691536057022628,0.00010805397011449227,1.5,TPESampler,COMPLETE
1223,0.9228200924533809,2025-04-24 21:13:58.789734,2025-04-24 21:14:00.791954,0 days 00:00:02.002220,52439.069422327106,Matern,5524.843370210261,9.971679734030408e-06,1.5,TPESampler,COMPLETE
1224,0.2867972379608015,2025-04-24 21:14:00.048215,2025-04-24 21:14:01.526686,0 days 00:00:01.478471,2.4472348277522538,Matern,9.805277808958515,0.04888318382353559,1.5,TPESampler,COMPLETE
1225,0.9228200890223675,2025-04-24 21:14:00.270890,2025-04-24 21:14:02.840315,0 days 00:00:02.569425,0.02172238429874932,Matern,2506.1565924377824,3.5887002121219075e-06,1.5,TPESampler,COMPLETE
1226,0.2867971938157379,2025-04-24 21:14:01.097755,2025-04-24 21:14:02.795390,0 days 00:00:01.697635,1.010737039526256,Matern,0.37178190079431356,0.007991336727859332,1.5,TPESampler,COMPLETE
1227,0.2867972522362377,2025-04-24 21:14:01.758127,2025-04-24 21:14:04.001642,0 days 00:00:02.243515,32.56928703681905,Matern,5.164207581836358,0.0004793859881260651,1.5,TPESampler,COMPLETE
1228,0.2867972526763509,2025-04-24 21:14:02.968216,2025-04-24 21:14:04.619266,0 days 00:00:01.651050,97.5363341322027,Matern,6.774588204640268,0.03979208682961012,1.5,TPESampler,COMPLETE
1229,0.9228200902925053,2025-04-24 21:14:03.022666,2025-04-24 21:14:06.197213,0 days 00:00:03.174547,0.009608707595101119,RBF,4.7447754798930404e-05,0.6796710693762653,0.5,TPESampler,COMPLETE
1230,0.28679725286742735,2025-04-24 21:14:04.221555,2025-04-24 21:14:05.921954,0 days 00:00:01.700399,4071.364827729796,Matern,78.14876679862428,0.0011910210814538612,1.5,TPESampler,COMPLETE
1231,0.2867972177375145,2025-04-24 21:14:04.840777,2025-04-24 21:14:07.049754,0 days 00:00:02.208977,0.04729196085989115,Matern,9.957502161190861,0.057283936732617786,1.5,TPESampler,COMPLETE
1232,0.2887076660965633,2025-04-24 21:14:06.143973,2025-04-24 21:14:08.194862,0 days 00:00:02.050889,1697.460895818715,Matern,47.21736904750431,0.23509538307788494,2.5,TPESampler,COMPLETE
1233,0.9494322783074031,2025-04-24 21:14:06.469739,2025-04-24 21:14:07.769158,0 days 00:00:01.299419,3.903334514011514,Matern,3.7141764230333147,9.980744858132077e-05,1.5,TPESampler,COMPLETE
1234,0.2867973184995102,2025-04-24 21:14:07.305802,2025-04-24 21:14:08.867092,0 days 00:00:01.561290,408.7539019901053,Matern,4.056368296117802,0.08812319059941738,1.5,TPESampler,COMPLETE
1235,0.9228200924109162,2025-04-24 21:14:08.006521,2025-04-24 21:14:09.654676,0 days 00:00:01.648155,136.6264820649339,Matern,90.71753206752646,9.129102059043232e-06,1.5,TPESampler,COMPLETE
1236,0.2867971125243834,2025-04-24 21:14:08.412350,2025-04-24 21:14:10.162577,0 days 00:00:01.750227,680.9460823750039,Matern,12.766308513107818,0.23500404659067403,1.5,TPESampler,COMPLETE
1237,0.9228200922526566,2025-04-24 21:14:09.118127,2025-04-24 21:14:10.592408,0 days 00:00:01.474281,0.0009358105844445051,Matern,0.00040093986896483255,1.2303019782466766e-05,0.5,TPESampler,COMPLETE
1238,0.9228200555647957,2025-04-24 21:14:09.887603,2025-04-24 21:14:11.461686,0 days 00:00:01.574083,7.574066578703431,Matern,14.364250330776871,0.0002988558285543882,1.5,TPESampler,COMPLETE
1239,0.2867972529389669,2025-04-24 21:14:10.432004,2025-04-24 21:14:12.392200,0 days 00:00:01.960196,15150.587414069541,Matern,102.78574467120006,0.9790549678168575,1.5,TPESampler,COMPLETE
1240,0.2867972249937529,2025-04-24 21:14:10.825341,2025-04-24 21:14:12.447162,0 days 00:00:01.621821,697.2451946448488,Matern,13.478883117270712,0.03126383341298757,1.5,TPESampler,COMPLETE
1241,0.2867972524386846,2025-04-24 21:14:11.678472,2025-04-24 21:14:13.574640,0 days 00:00:01.896168,598.4363886636922,Matern,30.25038582556675,0.030634919805062256,1.5,TPESampler,COMPLETE
1242,0.28679722053937023,2025-04-24 21:14:12.568506,2025-04-24 21:14:14.311736,0 days 00:00:01.743230,104.20500225551056,Matern,15.938938764759625,0.08954879435958024,1.5,TPESampler,COMPLETE
1243,0.28679724873903073,2025-04-24 21:14:12.608533,2025-04-24 21:14:14.917582,0 days 00:00:02.309049,1044.0278540179177,Matern,28.65760984247604,0.7744582804133279,1.5,TPESampler,COMPLETE
1244,0.2867972496680193,2025-04-24 21:14:13.811404,2025-04-24 21:14:15.597647,0 days 00:00:01.786243,32.44811818486429,Matern,52.16624940241266,0.18324090828667763,1.5,TPESampler,COMPLETE
1245,0.28679724942010865,2025-04-24 21:14:14.553017,2025-04-24 21:14:16.253471,0 days 00:00:01.700454,11.139336377815365,Matern,8.44287046357292,0.7380282591468525,1.5,TPESampler,COMPLETE
1246,0.28679731398844654,2025-04-24 21:14:15.140231,2025-04-24 21:14:17.071530,0 days 00:00:01.931299,2005.3969241310754,Matern,20.487139127417223,0.2325324688488095,1.5,TPESampler,COMPLETE
1247,0.28679725671261747,2025-04-24 21:14:15.854414,2025-04-24 21:14:17.616903,0 days 00:00:01.762489,721.9233630516458,Matern,0.6375980450987875,0.16355113652666112,1.5,TPESampler,COMPLETE
1248,0.28870764875087834,2025-04-24 21:14:16.517328,2025-04-24 21:14:18.146897,0 days 00:00:01.629569,2.155153739322854,Matern,7.275244254514294,0.19295956089133784,2.5,TPESampler,COMPLETE
1249,0.949431780480127,2025-04-24 21:14:17.300144,2025-04-24 21:14:18.905789,0 days 00:00:01.605645,1.1270524146602994,RBF,0.0003207361504402494,2.7646032870926742e-06,0.5,TPESampler,COMPLETE
1250,0.28679725107651255,2025-04-24 21:14:17.888107,2025-04-24 21:14:19.697259,0 days 00:00:01.809152,956.1443495484634,Matern,44.64042607360535,0.9272999545594158,1.5,TPESampler,COMPLETE
1251,0.9494322793417138,2025-04-24 21:14:18.394557,2025-04-24 21:14:19.513596,0 days 00:00:01.119039,2667.050602170022,Matern,3.469368916601124,0.031606031433577306,1.5,TPESampler,COMPLETE
1252,0.922820092807616,2025-04-24 21:14:19.154077,2025-04-24 21:14:21.451323,0 days 00:00:02.297246,27436.775727293116,Matern,52.997892338586695,1.6897412257046226e-09,2.5,TPESampler,COMPLETE
1253,0.2867972566308344,2025-04-24 21:14:19.756401,2025-04-24 21:14:21.452369,0 days 00:00:01.695968,339.8634401363849,Matern,130.28907345574535,0.4571833979198801,1.5,TPESampler,COMPLETE
1254,0.2867972531090782,2025-04-24 21:14:19.963872,2025-04-24 21:14:21.910926,0 days 00:00:01.947054,22221.321224354815,Matern,125.83916227541621,0.0029043931861901925,1.5,TPESampler,COMPLETE
1255,0.9494322793417138,2025-04-24 21:14:21.644571,2025-04-24 21:14:22.828626,0 days 00:00:01.184055,16955.905745016134,Matern,16.570380325876357,0.03609569083408254,1.5,TPESampler,COMPLETE
1256,0.286797334024599,2025-04-24 21:14:21.697468,2025-04-24 21:14:23.811721,0 days 00:00:02.114253,47128.84878164275,Matern,160.62788788360032,0.023485559766690953,1.5,TPESampler,COMPLETE
1257,0.9228200925752478,2025-04-24 21:14:22.160123,2025-04-24 21:14:23.810500,0 days 00:00:01.650377,102.66477194004425,Matern,363.0934757530635,0.002467787077144755,1.5,TPESampler,COMPLETE
1258,0.3301888227518034,2025-04-24 21:14:23.061387,2025-04-24 21:14:24.660678,0 days 00:00:01.599291,289.3256419507779,Matern,63.799301872327256,0.0988338199988992,0.5,TPESampler,COMPLETE
1259,0.9228200928307463,2025-04-24 21:14:23.973539,2025-04-24 21:14:26.302930,0 days 00:00:02.329391,28.43366737263343,RBF,41446.88138398474,1.0072713370005847e-09,1.5,TPESampler,COMPLETE
