number,value,datetime_start,datetime_complete,duration,params_constant_value,params_kernel_type,params_length_scale,params_noise_level,params_nu,system_attrs_auto:sampler,state
918,0.28679726419112544,2025-04-24 21:10:12.545697,2025-04-24 21:10:14.541949,0 days 00:00:01.996252,54.70951464061517,Matern,205.70697626566687,0.926351356300498,1.5,TPESampler,COMPLETE
919,0.33018884682108357,2025-04-24 21:10:13.177784,2025-04-24 21:10:14.867981,0 days 00:00:01.690197,25.493129174305594,Matern,2512.4073096562915,0.036628128951243955,0.5,TPESampler,COMPLETE
920,0.9494322790072915,2025-04-24 21:10:14.304699,2025-04-24 21:10:16.368418,0 days 00:00:02.063719,0.0563849594447862,Matern,11932.446602973727,0.01775549082964456,1.5,TPESampler,COMPLETE
921,0.2867972578124125,2025-04-24 21:10:14.760632,2025-04-24 21:10:16.836266,0 days 00:00:02.075634,50.19891706700544,Matern,952.5612959122525,0.5477184958363467,1.5,TPESampler,COMPLETE
922,0.922820091741859,2025-04-24 21:10:15.116947,2025-04-24 21:10:16.935718,0 days 00:00:01.818771,372.92861549924487,Matern,660.6779300516532,0.005254083063476685,1.5,TPESampler,COMPLETE
923,0.9228200911054913,2025-04-24 21:10:16.597424,2025-04-24 21:10:18.644655,0 days 00:00:02.047231,1.2571510386917623e-07,Matern,0.0033925334431969636,3.43003123778721e-10,2.5,TPESampler,COMPLETE
924,0.2867972503813261,2025-04-24 21:10:17.123266,2025-04-24 21:10:19.250048,0 days 00:00:02.126782,129.37329228687182,Matern,1743.5571489985796,0.04356142837657127,1.5,TPESampler,COMPLETE
925,0.9228200913544383,2025-04-24 21:10:17.171097,2025-04-24 21:10:20.774914,0 days 00:00:03.603817,0.019500233736737902,Matern,770.912186436705,0.010619345345636697,1.5,TPESampler,COMPLETE
926,0.9228200928145507,2025-04-24 21:10:18.850889,2025-04-24 21:10:20.997750,0 days 00:00:02.146861,329.4712150450421,Matern,3375.184784331206,0.0001634699564264154,1.5,TPESampler,COMPLETE
927,0.9494317804802486,2025-04-24 21:10:19.466825,2025-04-24 21:10:21.120956,0 days 00:00:01.654131,10.365756981337956,Matern,0.02539680717758041,4.571274641076922e-07,1.5,TPESampler,COMPLETE
928,0.2867972601930645,2025-04-24 21:10:21.062979,2025-04-24 21:10:23.430990,0 days 00:00:02.368011,2942.581965624649,Matern,401.00606866862114,0.019185701971750097,1.5,TPESampler,COMPLETE
929,0.28679726097975483,2025-04-24 21:10:21.240318,2025-04-24 21:10:24.031812,0 days 00:00:02.791494,71162.42927129142,Matern,143.71823082844406,0.007755491612725164,1.5,TPESampler,COMPLETE
930,0.9228200923987773,2025-04-24 21:10:21.325080,2025-04-24 21:10:23.334269,0 days 00:00:02.009189,14.73240334418644,Matern,167.5324007239855,4.319196262667895e-07,1.5,TPESampler,COMPLETE
931,0.9228200924940504,2025-04-24 21:10:23.499687,2025-04-24 21:10:25.676490,0 days 00:00:02.176803,457.4054313486151,Matern,2735.464783323874,0.033290289843959306,1.5,TPESampler,COMPLETE
932,0.2867972535912572,2025-04-24 21:10:23.633805,2025-04-24 21:10:26.679826,0 days 00:00:03.046021,384.84299386948254,Matern,11557.543938299832,0.5571978284721887,1.5,TPESampler,COMPLETE
933,0.922820092527432,2025-04-24 21:10:24.281826,2025-04-24 21:10:27.652030,0 days 00:00:03.370204,0.020115621679871826,Matern,471.47704167732945,0.012878902313524794,1.5,TPESampler,COMPLETE
934,0.9228200924914528,2025-04-24 21:10:25.922379,2025-04-24 21:10:28.015355,0 days 00:00:02.092976,102.58295440748168,Matern,202.47941358835976,0.0019156338668700776,2.5,TPESampler,COMPLETE
935,0.922820093885634,2025-04-24 21:10:26.936938,2025-04-24 21:10:29.425486,0 days 00:00:02.488548,0.7265578467179643,Matern,2165.134372520816,0.035328885333292336,1.5,TPESampler,COMPLETE
936,0.2867972543978615,2025-04-24 21:10:28.063565,2025-04-24 21:10:29.819071,0 days 00:00:01.755506,221.4973401048243,Matern,66.70177129934112,0.023605450089669397,1.5,TPESampler,COMPLETE
937,0.9494322768121424,2025-04-24 21:10:28.259697,2025-04-24 21:10:30.114779,0 days 00:00:01.855082,21.48410929151401,Matern,18683.847932197787,0.7539577033297278,1.5,TPESampler,COMPLETE
938,0.28679658588103757,2025-04-24 21:10:29.662757,2025-04-24 21:10:31.467292,0 days 00:00:01.804535,760.2972654412312,Matern,27.531932739513778,0.01108856807105234,1.5,TPESampler,COMPLETE
939,0.2867972488516205,2025-04-24 21:10:30.050719,2025-04-24 21:10:32.894753,0 days 00:00:02.844034,32317.969001149766,Matern,27840.512784820075,0.05948231961240159,1.5,TPESampler,COMPLETE
940,0.9494322793417138,2025-04-24 21:10:30.361341,2025-04-24 21:10:31.466232,0 days 00:00:01.104891,60205.85640952697,Matern,3.586375771068268,0.033873812688394914,1.5,TPESampler,COMPLETE
941,0.9228200928049888,2025-04-24 21:10:31.628345,2025-04-24 21:10:33.142492,0 days 00:00:01.514147,98.19404252691002,Matern,78.70218046920377,0.0002712299609290014,1.5,TPESampler,COMPLETE
942,0.28679719414600413,2025-04-24 21:10:31.674592,2025-04-24 21:10:33.550738,0 days 00:00:01.876146,495.66580387898307,Matern,34.28401091503174,0.0006731286288922964,1.5,TPESampler,COMPLETE
943,0.28679725258811395,2025-04-24 21:10:33.101905,2025-04-24 21:10:35.120663,0 days 00:00:02.018758,415.70819282508296,Matern,3.87137170236838,0.0026018991451378093,1.5,TPESampler,COMPLETE
944,0.9228200894656985,2025-04-24 21:10:33.445271,2025-04-24 21:10:35.049921,0 days 00:00:01.604650,0.27798618794765545,Matern,105.96607431227616,5.093138122051975e-05,1.5,TPESampler,COMPLETE
945,0.28870768907208627,2025-04-24 21:10:33.851160,2025-04-24 21:10:36.160397,0 days 00:00:02.309237,1.8048154596455805,Matern,0.2541675534609846,0.00013825535823293656,2.5,TPESampler,COMPLETE
946,0.9228200969653341,2025-04-24 21:10:35.230344,2025-04-24 21:10:37.763316,0 days 00:00:02.532972,3.610823282049065,Matern,2.4920205594670945e-05,0.000575407237030521,1.5,TPESampler,COMPLETE
947,0.9228200836476772,2025-04-24 21:10:35.311455,2025-04-24 21:10:37.638797,0 days 00:00:02.327342,8.692347554229844,Matern,212.4582589237279,0.001963593010472926,1.5,TPESampler,COMPLETE
948,0.2867972650232864,2025-04-24 21:10:36.376660,2025-04-24 21:10:38.262248,0 days 00:00:01.885588,84084.07084057326,Matern,2.6815178175272787,0.0017053868890413897,1.5,TPESampler,COMPLETE
949,0.9494322772640035,2025-04-24 21:10:37.850612,2025-04-24 21:10:39.069497,0 days 00:00:01.218885,859.207905828021,Matern,0.7756058050801177,0.00011078692949992568,1.5,TPESampler,COMPLETE
950,0.9228200924766121,2025-04-24 21:10:37.985594,2025-04-24 21:10:41.607811,0 days 00:00:03.622217,0.031388112402806,Matern,3190.0124186257904,0.020875420677333393,0.5,TPESampler,COMPLETE
951,0.2867972573299934,2025-04-24 21:10:38.577884,2025-04-24 21:10:40.456912,0 days 00:00:01.879028,0.005668566937090024,Matern,108.3218552362286,0.07694069748216001,1.5,TPESampler,COMPLETE
952,0.9494322787532911,2025-04-24 21:10:39.315920,2025-04-24 21:10:40.361893,0 days 00:00:01.045973,283.9231787172027,Matern,2.826227926609108,4.3039002430490887e-05,1.5,TPESampler,COMPLETE
953,0.28679724824209085,2025-04-24 21:10:40.541277,2025-04-24 21:10:42.914336,0 days 00:00:02.373059,19213.020760524865,Matern,232.2730461125006,0.00027414933678114367,1.5,TPESampler,COMPLETE
954,0.2867972334273196,2025-04-24 21:10:40.630688,2025-04-24 21:10:42.528616,0 days 00:00:01.897928,3.1129139474230385,Matern,0.8085981118032458,0.00023276954395010926,1.5,TPESampler,COMPLETE
955,0.2867973229713007,2025-04-24 21:10:41.823066,2025-04-24 21:10:43.942167,0 days 00:00:02.119101,3481.3305464302966,Matern,24.373882905221297,0.003987166601566595,1.5,TPESampler,COMPLETE
956,0.28679720921904284,2025-04-24 21:10:42.741345,2025-04-24 21:10:45.886544,0 days 00:00:03.145199,0.0062431409176880856,Matern,0.3583558077013978,0.006076825182499143,1.5,TPESampler,COMPLETE
957,0.9228200925189132,2025-04-24 21:10:43.134472,2025-04-24 21:10:45.916117,0 days 00:00:02.781645,0.008104338267337183,Matern,216.3285457234165,7.248392547316133e-07,2.5,TPESampler,COMPLETE
958,0.2867972559929393,2025-04-24 21:10:44.149813,2025-04-24 21:10:45.881875,0 days 00:00:01.732062,264.52715875023966,Matern,32.753313026007355,0.0016503096271890986,1.5,TPESampler,COMPLETE
959,0.9228200922892733,2025-04-24 21:10:46.049738,2025-04-24 21:10:49.239045,0 days 00:00:03.189307,0.05785192430345421,Matern,134.66067246192983,0.026411133240468343,1.5,TPESampler,COMPLETE
960,0.9228200911054913,2025-04-24 21:10:46.064448,2025-04-24 21:10:48.422828,0 days 00:00:02.358380,6.920149360953209e-06,RBF,0.0004712256165347612,2.4671947680244135e-07,1.5,TPESampler,COMPLETE
961,0.9494322793417138,2025-04-24 21:10:46.054849,2025-04-24 21:10:47.456901,0 days 00:00:01.402052,944.5292876546248,Matern,2.2065306691224165,0.025783623035856188,1.5,TPESampler,COMPLETE
962,0.9494322793406827,2025-04-24 21:10:47.669466,2025-04-24 21:10:49.875807,0 days 00:00:02.206341,1.6193000324353928,Matern,85150.40982911877,0.012384639816376533,2.5,TPESampler,COMPLETE
963,0.9228200971016746,2025-04-24 21:10:48.626277,2025-04-24 21:10:50.961966,0 days 00:00:02.335689,15.190532895012431,Matern,2836.7756018187247,0.006809914555442222,1.5,TPESampler,COMPLETE
964,0.9494322430529167,2025-04-24 21:10:49.474451,2025-04-24 21:10:50.895456,0 days 00:00:01.421005,1.6061409595435927,Matern,0.5208012702813153,1.6112011933880913e-05,1.5,TPESampler,COMPLETE
965,0.28679724696250597,2025-04-24 21:10:50.116618,2025-04-24 21:10:52.022005,0 days 00:00:01.905387,68524.15897550482,Matern,151.62496206573363,0.01996732264779104,1.5,TPESampler,COMPLETE
966,0.2867975096946574,2025-04-24 21:10:51.073087,2025-04-24 21:10:52.944855,0 days 00:00:01.871768,85.42652085871981,Matern,28.782689865380657,0.012015716386522242,1.5,TPESampler,COMPLETE
967,0.9228200926797077,2025-04-24 21:10:51.159770,2025-04-24 21:10:53.633851,0 days 00:00:02.474081,653.1970316921984,Matern,25641.203570127615,2.372785597388375e-08,2.5,TPESampler,COMPLETE
968,0.949431780480061,2025-04-24 21:10:52.242810,2025-04-24 21:10:54.117422,0 days 00:00:01.874612,14.19631705795983,RBF,0.10194497631630986,1.3912997234105813e-05,1.5,TPESampler,COMPLETE
969,0.9228200901418769,2025-04-24 21:10:53.215948,2025-04-24 21:10:55.325204,0 days 00:00:02.109256,9.618299443270843,Matern,148.71931758069138,0.005329991243075482,1.5,TPESampler,COMPLETE
970,0.9228200925781234,2025-04-24 21:10:53.914963,2025-04-24 21:10:55.508888,0 days 00:00:01.593925,11633.467188987222,Matern,69.20981256472714,3.688329526450141e-05,2.5,TPESampler,COMPLETE
971,0.9228200905264193,2025-04-24 21:10:54.319991,2025-04-24 21:10:56.234926,0 days 00:00:01.914935,4.061203250385272,Matern,42.12169938646747,3.391145928766091e-05,1.5,TPESampler,COMPLETE
972,0.28679729995401193,2025-04-24 21:10:55.526829,2025-04-24 21:10:57.490295,0 days 00:00:01.963466,187.3391012483869,Matern,2.1938323754354747,0.0013686587698365025,1.5,TPESampler,COMPLETE
973,0.32579310556629537,2025-04-24 21:10:55.739068,2025-04-24 21:10:57.992280,0 days 00:00:02.253212,0.04402220832885557,Matern,0.12476464491356638,0.009615685636930604,1.5,TPESampler,COMPLETE
974,0.9228200919313412,2025-04-24 21:10:56.452198,2025-04-24 21:10:59.066527,0 days 00:00:02.614329,46.864938186489965,Matern,1640.3468757073726,0.0005069967743997603,1.5,TPESampler,COMPLETE
975,0.9228197020133961,2025-04-24 21:10:57.726114,2025-04-24 21:10:59.648627,0 days 00:00:01.922513,1.1486666790291051,Matern,24.495009520932463,0.04517611504062119,1.5,TPESampler,COMPLETE
976,0.28679723665525586,2025-04-24 21:10:58.278998,2025-04-24 21:10:59.937483,0 days 00:00:01.658485,53.58575146978717,Matern,13.568218035370988,0.01948755045698998,1.5,TPESampler,COMPLETE
977,0.2867972519385262,2025-04-24 21:10:59.305677,2025-04-24 21:11:02.573193,0 days 00:00:03.267516,0.013515157119422224,Matern,191.85630029159455,0.4847951167831117,1.5,TPESampler,COMPLETE
978,0.3301888194568264,2025-04-24 21:10:59.897957,2025-04-24 21:11:01.417895,0 days 00:00:01.519938,4138.613831024724,Matern,118.3154881621043,0.004396725066753812,0.5,TPESampler,COMPLETE
979,0.28679726364698177,2025-04-24 21:11:00.148412,2025-04-24 21:11:03.311337,0 days 00:00:03.162925,9.384292692231144,Matern,0.11081135449888914,0.0003554860531368871,1.5,TPESampler,COMPLETE
980,0.9228200925188972,2025-04-24 21:11:01.658784,2025-04-24 21:11:04.472766,0 days 00:00:02.813982,0.00030796547880327155,Matern,19.02107775108687,0.0009997865206030252,1.5,TPESampler,COMPLETE
981,0.9228200916786713,2025-04-24 21:11:02.814336,2025-04-24 21:11:04.359924,0 days 00:00:01.545588,738.8754645586795,RBF,799.8789547798533,0.003101319364121037,0.5,TPESampler,COMPLETE
982,0.9494322793372248,2025-04-24 21:11:03.547857,2025-04-24 21:11:05.490988,0 days 00:00:01.943131,1.5926135539978727,Matern,79681.43232445081,0.018145087009509262,1.5,TPESampler,COMPLETE
983,0.9494322793417138,2025-04-24 21:11:04.561389,2025-04-24 21:11:05.570083,0 days 00:00:01.008694,5276.558855360115,Matern,15.83043130156445,0.023773468085423386,1.5,TPESampler,COMPLETE
984,0.2867972576213981,2025-04-24 21:11:04.706728,2025-04-24 21:11:06.749935,0 days 00:00:02.043207,2426.364086031755,Matern,1414.3582256861243,0.035192960116913724,1.5,TPESampler,COMPLETE
985,0.949432279289197,2025-04-24 21:11:05.659184,2025-04-24 21:11:07.426992,0 days 00:00:01.767808,16.65515852647037,RBF,19116.50175627826,0.8657462522382168,1.5,TPESampler,COMPLETE
986,0.9228200924867946,2025-04-24 21:11:05.745071,2025-04-24 21:11:08.233061,0 days 00:00:02.487990,3144.1283477505353,Matern,76784.91242026073,0.004482115341431113,1.5,TPESampler,COMPLETE
987,0.9228200926933406,2025-04-24 21:11:06.979442,2025-04-24 21:11:08.801495,0 days 00:00:01.822053,0.04134734074109769,Matern,3.774660082162292,0.000527922449586954,1.5,TPESampler,COMPLETE
988,0.9228200924462429,2025-04-24 21:11:07.673880,2025-04-24 21:11:09.849235,0 days 00:00:02.175355,340.26548773959286,Matern,42.751277148851926,3.412824975934507e-05,1.5,TPESampler,COMPLETE
989,0.3026845736873792,2025-04-24 21:11:08.454178,2025-04-24 21:11:09.897038,0 days 00:00:01.442860,10.92367623142089,RBF,3.2514214313180796,0.23939329994398226,0.5,TPESampler,COMPLETE
990,0.949432279339051,2025-04-24 21:11:09.041790,2025-04-24 21:11:10.861892,0 days 00:00:01.820102,90.63923928599122,Matern,95285.12389591342,0.25924613993240253,1.5,TPESampler,COMPLETE
991,0.2867972562615056,2025-04-24 21:11:10.017940,2025-04-24 21:11:12.261855,0 days 00:00:02.243915,1441.5734397105618,Matern,92.62730466000751,0.0042094794891410735,1.5,TPESampler,COMPLETE
992,0.9494322793417138,2025-04-24 21:11:10.064589,2025-04-24 21:11:11.871385,0 days 00:00:01.806796,79.82701866656629,Matern,255.51669836476893,0.02722448173488661,1.5,TPESampler,COMPLETE
993,0.2867972535083092,2025-04-24 21:11:11.100798,2025-04-24 21:11:12.726241,0 days 00:00:01.625443,567.9260599073174,Matern,1.3042723358320818,0.010342906035230082,1.5,TPESampler,COMPLETE
994,0.9228200923671825,2025-04-24 21:11:12.091438,2025-04-24 21:11:14.295153,0 days 00:00:02.203715,2.457541224020492,Matern,516.4989971841247,0.008986816915949944,1.5,TPESampler,COMPLETE
995,0.9228200869270239,2025-04-24 21:11:12.454417,2025-04-24 21:11:14.306048,0 days 00:00:01.851631,0.14707292699371735,Matern,10.479652828806195,0.022833773538706928,1.5,TPESampler,COMPLETE
996,0.2867972521499761,2025-04-24 21:11:13.024148,2025-04-24 21:11:14.666829,0 days 00:00:01.642681,61400.4503399661,Matern,7.182661592796215,0.07050389898620206,1.5,TPESampler,COMPLETE
997,0.9228200923435323,2025-04-24 21:11:14.485664,2025-04-24 21:11:17.376181,0 days 00:00:02.890517,0.11932966215620774,Matern,1.3473092822894197e-05,2.2588407032450146e-10,2.5,TPESampler,COMPLETE
998,0.9494322793396525,2025-04-24 21:11:14.535309,2025-04-24 21:11:16.399448,0 days 00:00:01.864139,0.0006678119782606099,Matern,74072.3422876829,0.038272978574655364,1.5,TPESampler,COMPLETE
999,0.9494317804802355,2025-04-24 21:11:14.909610,2025-04-24 21:11:16.338344,0 days 00:00:01.428734,19.557496693706373,RBF,6.291751797221919e-05,3.194030800169608e-06,2.5,TPESampler,COMPLETE
1000,0.28679738289013895,2025-04-24 21:11:16.527963,2025-04-24 21:11:18.653021,0 days 00:00:02.125058,1415.3372113167616,Matern,144.761837446029,0.0363429207210246,1.5,TPESampler,COMPLETE
1001,0.9228200928066269,2025-04-24 21:11:16.572244,2025-04-24 21:11:18.705614,0 days 00:00:02.133370,2.6234907637841562,Matern,36.2229473406284,0.0006630077233230641,1.5,TPESampler,COMPLETE
1002,0.2867972190461881,2025-04-24 21:11:17.622328,2025-04-24 21:11:19.983489,0 days 00:00:02.361161,8.610186140692148,Matern,0.12836320794199332,0.003493601692507071,1.5,TPESampler,COMPLETE
1003,0.28679725091700176,2025-04-24 21:11:18.841123,2025-04-24 21:11:20.734590,0 days 00:00:01.893467,990.0763349463194,Matern,9.794560192944669,0.000579504034611036,1.5,TPESampler,COMPLETE
1004,0.9494317804799763,2025-04-24 21:11:18.888823,2025-04-24 21:11:20.268653,0 days 00:00:01.379830,33.487567241257544,Matern,0.001924340678988801,3.75985372308463e-05,1.5,TPESampler,COMPLETE
1005,0.922820092496723,2025-04-24 21:11:20.216313,2025-04-24 21:11:21.733497,0 days 00:00:01.517184,150.0810901634099,Matern,40141.58007456925,0.0001079616583264897,0.5,TPESampler,COMPLETE
1006,0.28679724042221394,2025-04-24 21:11:20.486132,2025-04-24 21:11:22.139897,0 days 00:00:01.653765,2.3344272348502373,Matern,6.70801266445803,0.0004629187687571153,1.5,TPESampler,COMPLETE
1007,0.28679725405686224,2025-04-24 21:11:20.963013,2025-04-24 21:11:23.059439,0 days 00:00:02.096426,0.5158431986840638,Matern,626.2645480882106,0.6898641244222178,1.5,TPESampler,COMPLETE
1008,0.922820093115576,2025-04-24 21:11:21.967257,2025-04-24 21:11:24.331586,0 days 00:00:02.364329,41.3521964971957,Matern,991.2890272354325,0.022076594086326406,1.5,TPESampler,COMPLETE
1009,0.28679723373663335,2025-04-24 21:11:22.356776,2025-04-24 21:11:24.237807,0 days 00:00:01.881031,278.13802011583135,Matern,0.2741104435479906,0.0017669414078348676,1.5,TPESampler,COMPLETE
1010,0.2867972521352955,2025-04-24 21:11:23.275241,2025-04-24 21:11:25.165442,0 days 00:00:01.890201,4671.087863873299,Matern,11.616692173803518,0.046577349922545884,1.5,TPESampler,COMPLETE
1011,0.9494317804800958,2025-04-24 21:11:24.429409,2025-04-24 21:11:25.931448,0 days 00:00:01.502039,32584.60840952785,Matern,0.03461776302954676,3.944372610989519e-06,1.5,TPESampler,COMPLETE
1012,0.9228200905947489,2025-04-24 21:11:24.513245,2025-04-24 21:11:26.857824,0 days 00:00:02.344579,221.83720729834351,Matern,1405.6091201910854,0.00015039108537312902,1.5,TPESampler,COMPLETE
1013,0.9494322791730329,2025-04-24 21:11:25.439484,2025-04-24 21:11:26.901335,0 days 00:00:01.461851,70163.4436829507,Matern,4.993383047183663,2.0481682690226588e-05,1.5,TPESampler,COMPLETE
1014,0.9228200915999764,2025-04-24 21:11:26.140667,2025-04-24 21:11:27.892500,0 days 00:00:01.751833,1324.0110869716648,Matern,1204.4200976407822,0.009260883929661,1.5,TPESampler,COMPLETE
1015,0.28679724333536344,2025-04-24 21:11:27.044423,2025-04-24 21:11:28.763200,0 days 00:00:01.718777,0.24433518741298887,Matern,1.2173621559820238,0.02106256903877767,1.5,TPESampler,COMPLETE
1016,0.9228200893786649,2025-04-24 21:11:27.143631,2025-04-24 21:11:30.215847,0 days 00:00:03.072216,5.175432319554452,Matern,9.199264125540997,5.833600583612758e-06,1.5,TPESampler,COMPLETE
1017,0.2867972615528807,2025-04-24 21:11:28.132785,2025-04-24 21:11:29.539244,0 days 00:00:01.406459,15.638955243874173,Matern,5.217327554749928,0.10841673558209156,1.5,TPESampler,COMPLETE
1018,0.2867972497276123,2025-04-24 21:11:28.984858,2025-04-24 21:11:30.953756,0 days 00:00:01.968898,4.258557319885114,Matern,205.99569201913096,0.9722191748202272,1.5,TPESampler,COMPLETE
1019,0.2867970220205975,2025-04-24 21:11:29.781974,2025-04-24 21:11:32.023826,0 days 00:00:02.241852,56.24632708792333,Matern,2101.9398561607327,0.05118193181132447,1.5,TPESampler,COMPLETE
1020,0.9228200926622904,2025-04-24 21:11:30.452579,2025-04-24 21:11:33.381291,0 days 00:00:02.928712,99722.47799566307,Matern,4669.357187616544,0.00041156517655382947,1.5,TPESampler,COMPLETE
1021,0.9228200929654311,2025-04-24 21:11:31.194100,2025-04-24 21:11:32.952091,0 days 00:00:01.757991,0.24318252812706787,Matern,0.02347367213237409,0.00018190410852662493,1.5,TPESampler,COMPLETE
1022,0.9494322793373354,2025-04-24 21:11:32.327587,2025-04-24 21:11:34.257932,0 days 00:00:01.930345,10.28842396761858,Matern,64417.804200507424,0.7561071796633524,1.5,TPESampler,COMPLETE
1023,0.9228200928109623,2025-04-24 21:11:33.193727,2025-04-24 21:11:35.885675,0 days 00:00:02.691948,7.215893613349189,Matern,9475.777906252064,0.04099722484882571,1.5,TPESampler,COMPLETE
1024,0.28679725343786777,2025-04-24 21:11:33.589901,2025-04-24 21:11:35.624228,0 days 00:00:02.034327,75.55465151039598,Matern,1626.8923607676918,0.2495955558443661,1.5,TPESampler,COMPLETE
1025,0.9228200923963673,2025-04-24 21:11:34.474154,2025-04-24 21:11:36.806105,0 days 00:00:02.331951,9286.849127587137,Matern,21897.27107897376,4.941790623742607e-08,1.5,TPESampler,COMPLETE
1026,0.922820092309634,2025-04-24 21:11:35.841022,2025-04-24 21:11:37.858069,0 days 00:00:02.017047,121.41135882597875,Matern,4026.583801237128,0.010430277362612043,1.5,TPESampler,COMPLETE
1027,0.32779821739360043,2025-04-24 21:11:36.159250,2025-04-24 21:11:38.898176,0 days 00:00:02.738926,1.0840925964220697e-07,Matern,0.09159112712608174,2.2014955410981984e-05,0.5,TPESampler,COMPLETE
1028,0.9228200924303017,2025-04-24 21:11:37.042723,2025-04-24 21:11:39.443755,0 days 00:00:02.401032,10.229416677449109,Matern,3123.4790868849373,0.042657364264238926,1.5,TPESampler,COMPLETE
1029,0.286797263345211,2025-04-24 21:11:38.091164,2025-04-24 21:11:40.080716,0 days 00:00:01.989552,3562.247553242074,Matern,713.9918499875635,0.01616610221224818,1.5,TPESampler,COMPLETE
1030,0.9228200924403314,2025-04-24 21:11:39.120208,2025-04-24 21:11:41.402168,0 days 00:00:02.281960,21.884642815810373,Matern,85943.88417686704,0.00383762305488319,1.5,TPESampler,COMPLETE
1031,0.286797282106321,2025-04-24 21:11:39.661165,2025-04-24 21:11:41.970904,0 days 00:00:02.309739,1269.8004918277352,Matern,6293.504856261314,0.05206242197806436,1.5,TPESampler,COMPLETE
