number,value,datetime_start,datetime_complete,duration,params_constant_value,params_kernel_type,params_length_scale,params_noise_level,params_nu,system_attrs_auto:sampler,state
2058,0.2867972511384928,2025-04-24 21:24:07.800356,2025-04-24 21:24:09.477607,0 days 00:00:01.677251,65.68165387666974,Matern,9.51087780825642,0.002943368412039692,1.5,TPESampler,COMPLETE
2059,0.9228200918771468,2025-04-24 21:24:08.128841,2025-04-24 21:24:10.386113,0 days 00:00:02.257272,12257.520382565437,RBF,666.4201022229698,3.0153795885644497e-10,0.5,TPESampler,COMPLETE
2060,0.9494317804753563,2025-04-24 21:24:08.530218,2025-04-24 21:24:09.547748,0 days 00:00:01.017530,6.644200657940303,Matern,0.05280700088035275,0.028330416711840598,1.5,TPESampler,COMPLETE
2061,0.28679725081011975,2025-04-24 21:24:09.650786,2025-04-24 21:24:11.711295,0 days 00:00:02.060509,0.7155248786065135,Matern,5.175869325070676,0.012636018123492382,1.5,TPESampler,COMPLETE
2062,0.92282009609756,2025-04-24 21:24:09.806399,2025-04-24 21:24:12.107203,0 days 00:00:02.300804,6.127813023626176e-05,Matern,0.02492623027837738,1.0480491166946989e-09,1.5,TPESampler,COMPLETE
2063,0.9228200936845702,2025-04-24 21:24:10.593973,2025-04-24 21:24:12.314142,0 days 00:00:01.720169,0.32206325354707643,Matern,0.06384311553945472,0.01791880172841958,1.5,TPESampler,COMPLETE
2064,0.9228200925330018,2025-04-24 21:24:12.057617,2025-04-24 21:24:13.566808,0 days 00:00:01.509191,2.0056741808841982,Matern,26.244887250723245,0.0017559999504444335,1.5,TPESampler,COMPLETE
2065,0.2867972427662146,2025-04-24 21:24:12.386309,2025-04-24 21:24:14.039765,0 days 00:00:01.653456,122.87235151888478,Matern,0.684429863866473,0.004953143492127924,1.5,TPESampler,COMPLETE
2066,0.922820094249947,2025-04-24 21:24:12.592208,2025-04-24 21:24:14.362689,0 days 00:00:01.770481,5.402836536577133,Matern,61.571852328563764,0.002058919012088348,1.5,TPESampler,COMPLETE
2067,0.9228200967801157,2025-04-24 21:24:13.800097,2025-04-24 21:24:15.902193,0 days 00:00:02.102096,0.7008606989979331,Matern,32.034109559249856,0.009426427545440114,1.5,TPESampler,COMPLETE
2068,0.9228200903192844,2025-04-24 21:24:14.313869,2025-04-24 21:24:15.930398,0 days 00:00:01.616529,4.969319714069501,Matern,37.29026197562352,0.016066142252312475,1.5,TPESampler,COMPLETE
2069,0.2867972074695891,2025-04-24 21:24:14.620412,2025-04-24 21:24:16.146542,0 days 00:00:01.526130,8.596896504982091,Matern,1.8805721000046942,0.008521466777104648,1.5,TPESampler,COMPLETE
2070,0.2867972535278135,2025-04-24 21:24:16.071069,2025-04-24 21:24:18.065289,0 days 00:00:01.994220,0.012319530801226518,Matern,10.693153881102447,0.44132893456411815,1.5,TPESampler,COMPLETE
2071,0.9228200923930499,2025-04-24 21:24:16.115489,2025-04-24 21:24:18.899295,0 days 00:00:02.783806,0.5681276152101069,RBF,42.65128813747889,0.0023663947138486425,1.5,TPESampler,COMPLETE
2072,0.9494316911175507,2025-04-24 21:24:16.568548,2025-04-24 21:24:18.024888,0 days 00:00:01.456340,1.0989186522075888e-07,Matern,0.0458249608197052,0.05213135889429417,0.5,TPESampler,COMPLETE
2073,0.28679714031995784,2025-04-24 21:24:18.241409,2025-04-24 21:24:19.820894,0 days 00:00:01.579485,18.3511294637586,Matern,0.9240367881058371,0.03887987499179221,1.5,TPESampler,COMPLETE
2074,0.28679725094790964,2025-04-24 21:24:18.283893,2025-04-24 21:24:20.072834,0 days 00:00:01.788941,8.344988761872832,Matern,0.7666677761141484,0.642418586795034,1.5,TPESampler,COMPLETE
2075,0.33018884964962897,2025-04-24 21:24:19.138931,2025-04-24 21:24:21.314861,0 days 00:00:02.175930,0.8473749345976341,Matern,297.20956507600926,0.0892355117871844,0.5,TPESampler,COMPLETE
2076,0.9228200789378708,2025-04-24 21:24:20.043481,2025-04-24 21:24:21.775707,0 days 00:00:01.732226,40.76756226262829,Matern,0.02374563905354559,0.12497484832945836,1.5,TPESampler,COMPLETE
2077,0.28679694678396317,2025-04-24 21:24:20.319075,2025-04-24 21:24:23.424291,0 days 00:00:03.105216,338.2668547463335,Matern,0.41440250132180295,0.02479348065118962,1.5,TPESampler,COMPLETE
2078,0.28679722633764265,2025-04-24 21:24:21.653207,2025-04-24 21:24:23.255530,0 days 00:00:01.602323,4.062769598740114,Matern,0.3315865852361238,0.05337104824897493,1.5,TPESampler,COMPLETE
2079,0.28679725945163953,2025-04-24 21:24:22.026090,2025-04-24 21:24:23.381655,0 days 00:00:01.355565,17.389253790850116,Matern,0.36417257982441525,0.0077628467585953076,1.5,TPESampler,COMPLETE
2080,0.2867972603699723,2025-04-24 21:24:23.470709,2025-04-24 21:24:26.913399,0 days 00:00:03.442690,470.5637140231046,Matern,0.1752463891963788,0.08285901974868844,1.5,TPESampler,COMPLETE
2081,0.2867972245008618,2025-04-24 21:24:23.536117,2025-04-24 21:24:25.071521,0 days 00:00:01.535404,1084.2156315239922,Matern,0.3530423724319885,0.0055823883356616475,1.5,TPESampler,COMPLETE
2082,0.9228200934437922,2025-04-24 21:24:23.621989,2025-04-24 21:24:28.048176,0 days 00:00:04.426187,8.935847612232785e-06,RBF,9247.380794305172,1.2439987302217723e-10,1.5,TPESampler,COMPLETE
2083,0.9228200866291157,2025-04-24 21:24:25.299004,2025-04-24 21:24:27.084839,0 days 00:00:01.785835,524.567023782032,Matern,0.010268924123824465,0.18482118336364778,1.5,TPESampler,COMPLETE
2084,0.9228200925107432,2025-04-24 21:24:27.161848,2025-04-24 21:24:28.845294,0 days 00:00:01.683446,712.7545242286101,Matern,0.002724692848519135,0.3218808136874615,1.5,TPESampler,COMPLETE
2085,0.9228134685140063,2025-04-24 21:24:27.298976,2025-04-24 21:24:28.862202,0 days 00:00:01.563226,191.83061777564615,Matern,0.12060636756696544,0.0020961664101921697,1.5,TPESampler,COMPLETE
2086,0.9494317804742287,2025-04-24 21:24:28.285212,2025-04-24 21:24:29.599536,0 days 00:00:01.314324,725.9233434363614,Matern,0.0454654043963956,0.0316696860662776,1.5,TPESampler,COMPLETE
2087,0.28679725232299935,2025-04-24 21:24:29.030238,2025-04-24 21:24:33.385554,0 days 00:00:04.355316,473.7393862704405,Matern,0.36459998270816324,0.04270719815398492,1.5,TPESampler,COMPLETE
2088,0.9494317804777614,2025-04-24 21:24:29.100696,2025-04-24 21:24:30.837537,0 days 00:00:01.736841,348.15231268037303,Matern,0.017729746744092775,0.02938405339609348,1.5,TPESampler,COMPLETE
2089,0.28679716693317525,2025-04-24 21:24:29.897062,2025-04-24 21:24:31.721259,0 days 00:00:01.824197,214.09605850665133,Matern,0.839887140186856,0.4391900217795949,1.5,TPESampler,COMPLETE
2090,0.922820093710552,2025-04-24 21:24:31.059467,2025-04-24 21:24:33.198382,0 days 00:00:02.138915,157.11588810769842,Matern,0.019300848421995698,0.0014538943224408655,1.5,TPESampler,COMPLETE
2091,0.9228200974449253,2025-04-24 21:24:32.209440,2025-04-24 21:24:34.180489,0 days 00:00:01.971049,30.483261364311186,Matern,0.061926945318429086,0.06012886445083127,1.5,TPESampler,COMPLETE
2092,0.9228198501702176,2025-04-24 21:24:33.442396,2025-04-24 21:24:34.695647,0 days 00:00:01.253251,46.52049797125112,Matern,0.09649064047037673,0.8725460420591779,1.5,TPESampler,COMPLETE
2093,0.28679723655777295,2025-04-24 21:24:33.656016,2025-04-24 21:24:37.854940,0 days 00:00:04.198924,4804.622696579086,Matern,0.3890582545716099,0.00024943314916947936,1.5,TPESampler,COMPLETE
2094,0.922820095015314,2025-04-24 21:24:34.433695,2025-04-24 21:24:35.851590,0 days 00:00:01.417895,237.9368575593433,Matern,0.0008527512398333424,0.0030201610965118024,1.5,TPESampler,COMPLETE
2095,0.28679731138222747,2025-04-24 21:24:34.939412,2025-04-24 21:24:36.631935,0 days 00:00:01.692523,491.7934395191185,Matern,0.32647575093859044,0.011398824988347106,1.5,TPESampler,COMPLETE
2096,0.2867973521731413,2025-04-24 21:24:36.076505,2025-04-24 21:24:37.586691,0 days 00:00:01.510186,347.72500334380254,Matern,0.4696438334396035,0.00904706672007205,1.5,TPESampler,COMPLETE
2097,0.9494317804781901,2025-04-24 21:24:36.889998,2025-04-24 21:24:38.002464,0 days 00:00:01.112466,877.7651807411588,Matern,0.08362828431227777,0.02054034955791945,1.5,TPESampler,COMPLETE
2098,0.9228200923944044,2025-04-24 21:24:37.819135,2025-04-24 21:24:40.026104,0 days 00:00:02.206969,36.09864890277342,RBF,0.0032143230749129164,0.017551164663596602,1.5,TPESampler,COMPLETE
2099,0.9228200917009654,2025-04-24 21:24:38.132564,2025-04-24 21:24:39.570476,0 days 00:00:01.437912,2.747074239784937,Matern,0.006305820645535386,0.0023341159147558643,1.5,TPESampler,COMPLETE
2100,0.9494322793416927,2025-04-24 21:24:38.286517,2025-04-24 21:24:39.431179,0 days 00:00:01.144662,31.48267739097968,Matern,2.090503792776031,0.0263570479943307,1.5,TPESampler,COMPLETE
2101,0.28679726013282797,2025-04-24 21:24:39.628375,2025-04-24 21:24:41.245870,0 days 00:00:01.617495,3915.116998007463,Matern,0.6519180387078379,0.0005873821127487731,1.5,TPESampler,COMPLETE
2102,0.28679725495267644,2025-04-24 21:24:39.818230,2025-04-24 21:24:41.409424,0 days 00:00:01.591194,94.40394778906003,Matern,0.8630568195780693,0.014591134688898943,1.5,TPESampler,COMPLETE
2103,0.9228200924662057,2025-04-24 21:24:40.337044,2025-04-24 21:24:42.320239,0 days 00:00:01.983195,0.010036720590904475,RBF,31.446196898812435,3.1509517031571764e-10,1.5,TPESampler,COMPLETE
2104,0.28679725366379505,2025-04-24 21:24:41.454203,2025-04-24 21:24:43.115041,0 days 00:00:01.660838,69.63613914409946,Matern,0.39027449027191685,0.05744791015032989,1.5,TPESampler,COMPLETE
2105,0.3026845823822438,2025-04-24 21:24:41.658008,2025-04-24 21:24:43.804150,0 days 00:00:02.146142,242.52235171005407,RBF,19.15657983243407,0.00392979134504632,1.5,TPESampler,COMPLETE
2106,0.28679725794852245,2025-04-24 21:24:42.560644,2025-04-24 21:24:44.256251,0 days 00:00:01.695607,153.9363521825267,Matern,1.4525434448096137,0.00253012330791921,1.5,TPESampler,COMPLETE
2107,0.2887076515359327,2025-04-24 21:24:43.358306,2025-04-24 21:24:45.015504,0 days 00:00:01.657198,110.54913097973576,Matern,0.3806400487709888,0.005174368856464955,2.5,TPESampler,COMPLETE
2108,0.28679717860946435,2025-04-24 21:24:44.061722,2025-04-24 21:24:45.669652,0 days 00:00:01.607930,1722.1663410551064,Matern,0.7975239935860884,0.011442844709935073,1.5,TPESampler,COMPLETE
2109,0.3301888243667676,2025-04-24 21:24:44.510955,2025-04-24 21:24:47.335313,0 days 00:00:02.824358,81.94903647330223,Matern,0.1475275593309817,0.015958824230027206,0.5,TPESampler,COMPLETE
2110,0.28679728194126225,2025-04-24 21:24:45.250720,2025-04-24 21:24:46.787231,0 days 00:00:01.536511,10033.607485518232,Matern,0.5302482756822517,0.0014237380079914802,1.5,TPESampler,COMPLETE
2111,0.2867972723789539,2025-04-24 21:24:45.910481,2025-04-24 21:24:47.383127,0 days 00:00:01.472646,644.9702899825564,Matern,0.4412594343707992,0.07185449276889314,1.5,TPESampler,COMPLETE
2112,0.9493633668861219,2025-04-24 21:24:47.008025,2025-04-24 21:24:48.348771,0 days 00:00:01.340746,1.9998761030444626e-07,Matern,216.78288378036916,5.113582359109262e-06,0.5,TPESampler,COMPLETE
2113,0.2867972685307922,2025-04-24 21:24:47.546296,2025-04-24 21:24:49.356909,0 days 00:00:01.810613,2169.118405159205,Matern,48.78357276876164,0.0017688472402379281,1.5,TPESampler,COMPLETE
2114,0.2867972533580161,2025-04-24 21:24:47.692535,2025-04-24 21:24:49.478063,0 days 00:00:01.785528,328.2833188670782,Matern,15.793410679262113,0.00718551796436928,1.5,TPESampler,COMPLETE
2115,0.2887076877457511,2025-04-24 21:24:48.576442,2025-04-24 21:24:50.176036,0 days 00:00:01.599594,13.801463228720861,Matern,2.910752100150618,0.5460930888183874,2.5,TPESampler,COMPLETE
2116,0.9228200921755737,2025-04-24 21:24:49.571171,2025-04-24 21:24:51.201074,0 days 00:00:01.629903,2.379598181590973,Matern,0.03752714321572914,0.01079713136455741,1.5,TPESampler,COMPLETE
2117,0.9228187436188546,2025-04-24 21:24:49.715795,2025-04-24 21:24:51.254591,0 days 00:00:01.538796,10.819089057023955,Matern,0.10806986531773426,0.008444506223241877,1.5,TPESampler,COMPLETE
2118,0.2867972515649537,2025-04-24 21:24:50.466816,2025-04-24 21:24:52.154609,0 days 00:00:01.687793,26.57620046013051,Matern,2.943896620578186,0.08392036792671484,1.5,TPESampler,COMPLETE
2119,0.286797252892903,2025-04-24 21:24:51.380751,2025-04-24 21:24:53.218131,0 days 00:00:01.837380,953.1552565479434,Matern,2.4111525222732695,0.001677675971773652,1.5,TPESampler,COMPLETE
2120,0.3301892953573943,2025-04-24 21:24:51.507180,2025-04-24 21:24:53.307464,0 days 00:00:01.800284,4720.8226231207245,Matern,0.8971982897028354,0.003221099166153825,0.5,TPESampler,COMPLETE
2121,0.2867973293806629,2025-04-24 21:24:52.387612,2025-04-24 21:24:54.080297,0 days 00:00:01.692685,5.997855135629764,Matern,0.3842253483828231,0.04202378238499204,1.5,TPESampler,COMPLETE
2122,0.9228200924168203,2025-04-24 21:24:53.406254,2025-04-24 21:24:55.914373,0 days 00:00:02.508119,6.995264188062812,Matern,20011.26805375249,0.0017262931595107603,1.5,TPESampler,COMPLETE
2123,0.2867972482227426,2025-04-24 21:24:53.546089,2025-04-24 21:24:55.141972,0 days 00:00:01.595883,94.10657814553419,Matern,3.666793903082664,0.056417931557481746,1.5,TPESampler,COMPLETE
2124,0.28679725269816275,2025-04-24 21:24:54.303069,2025-04-24 21:24:56.074762,0 days 00:00:01.771693,4357.077473772977,Matern,14.19168028005576,0.00018757084172085732,1.5,TPESampler,COMPLETE
2125,0.9494322793428375,2025-04-24 21:24:55.361595,2025-04-24 21:24:56.498078,0 days 00:00:01.136483,675.7812876919044,RBF,0.5525928950037601,0.02207856464784379,1.5,TPESampler,COMPLETE
2126,0.28679746409644613,2025-04-24 21:24:56.127892,2025-04-24 21:24:57.857940,0 days 00:00:01.730048,33.4131402662553,Matern,4.742064910263427,0.027687259255586606,1.5,TPESampler,COMPLETE
2127,0.2867972347579441,2025-04-24 21:24:56.328447,2025-04-24 21:24:58.125227,0 days 00:00:01.796780,159.31101198173255,Matern,21.94899133732125,0.01108508113045872,1.5,TPESampler,COMPLETE
2128,0.9228200920635762,2025-04-24 21:24:56.854213,2025-04-24 21:24:58.258399,0 days 00:00:01.404186,6.7895645874138735,Matern,0.00926334258104484,0.18849598891545857,1.5,TPESampler,COMPLETE
2129,0.9228200924946077,2025-04-24 21:24:58.144283,2025-04-24 21:25:00.489799,0 days 00:00:02.345516,1003.6120358649678,Matern,6231.667805168377,0.0009687959980303186,1.5,TPESampler,COMPLETE
2130,0.9494322793428275,2025-04-24 21:24:58.366978,2025-04-24 21:24:59.686741,0 days 00:00:01.319763,30083.331209703192,Matern,3.509404334718494,0.00019240596184863894,2.5,TPESampler,COMPLETE
2131,0.2867972461549632,2025-04-24 21:24:58.520348,2025-04-24 21:25:00.431390,0 days 00:00:01.911042,75.32965302747992,Matern,44.073588264493836,0.0028602194986145934,1.5,TPESampler,COMPLETE
2132,0.2867973389373089,2025-04-24 21:24:59.927389,2025-04-24 21:25:01.932940,0 days 00:00:02.005551,0.9565056804089628,Matern,0.19208143172638545,0.01704524407265017,1.5,TPESampler,COMPLETE
2133,0.9228200924417911,2025-04-24 21:25:00.620186,2025-04-24 21:25:02.945469,0 days 00:00:02.325283,1220.9723681222645,Matern,0.0028735192119332224,0.0006425212735299555,1.5,TPESampler,COMPLETE
2134,0.9228200924773915,2025-04-24 21:25:00.693900,2025-04-24 21:25:02.612734,0 days 00:00:01.918834,160.838188158076,Matern,117.8772805797757,0.0020934590575969053,1.5,TPESampler,COMPLETE
2135,0.9228200956088795,2025-04-24 21:25:02.176732,2025-04-24 21:25:06.563334,0 days 00:00:04.386602,8.570197947047791e-05,Matern,0.006695417518024074,0.01521311311693144,1.5,TPESampler,COMPLETE
2136,0.9494317804802332,2025-04-24 21:25:02.864886,2025-04-24 21:25:04.476621,0 days 00:00:01.611735,25.068612535360604,RBF,0.0016314153802762868,1.368608519488493e-09,2.5,TPESampler,COMPLETE
2137,0.28870764629398,2025-04-24 21:25:03.247092,2025-04-24 21:25:05.391881,0 days 00:00:02.144789,101.71398714320159,Matern,31.44848443059249,0.015141058585108672,2.5,TPESampler,COMPLETE
2138,0.2867972298784364,2025-04-24 21:25:04.739446,2025-04-24 21:25:06.365135,0 days 00:00:01.625689,27.38195852692737,Matern,2.1403353393424034,0.05506393893823082,1.5,TPESampler,COMPLETE
2139,0.28679725235098286,2025-04-24 21:25:05.665566,2025-04-24 21:25:07.644819,0 days 00:00:01.979253,74.85904280625464,Matern,4.655914028752139,0.004083916384099972,1.5,TPESampler,COMPLETE
2140,0.28679725265858763,2025-04-24 21:25:06.562093,2025-04-24 21:25:08.171461,0 days 00:00:01.609368,801.3286953360969,Matern,1.548248431894587,0.1548911245206892,1.5,TPESampler,COMPLETE
2141,0.9494317803735544,2025-04-24 21:25:06.832443,2025-04-24 21:25:08.042280,0 days 00:00:01.209837,1059.3468092270027,Matern,0.1091325164854188,0.04049844008078532,1.5,TPESampler,COMPLETE
2142,0.9228200928360938,2025-04-24 21:25:07.886209,2025-04-24 21:25:09.649045,0 days 00:00:01.762836,2040.4408142278012,Matern,1397.7018453382636,0.0007426865889875728,1.5,TPESampler,COMPLETE
2143,0.2867972511568294,2025-04-24 21:25:08.350196,2025-04-24 21:25:10.418329,0 days 00:00:02.068133,46046.166872799935,Matern,19.838550838605723,0.0003491334407446848,1.5,TPESampler,COMPLETE
2144,0.28679725252281907,2025-04-24 21:25:08.426824,2025-04-24 21:25:10.135725,0 days 00:00:01.708901,184.38398538864823,Matern,1.2278364144616423,0.0023430385776628936,1.5,TPESampler,COMPLETE
2145,0.9494186994034669,2025-04-24 21:25:09.886520,2025-04-24 21:25:11.490453,0 days 00:00:01.603933,2.3225440403264788,Matern,0.3381555222946972,1.8792020633773354e-07,2.5,TPESampler,COMPLETE
2146,0.28679725284057267,2025-04-24 21:25:10.358569,2025-04-24 21:25:12.470506,0 days 00:00:02.111937,77423.4191242671,Matern,331.39761573589135,0.004572068560820454,1.5,TPESampler,COMPLETE
2147,0.28679723939262197,2025-04-24 21:25:10.714069,2025-04-24 21:25:12.501948,0 days 00:00:01.787879,72.86346361993604,Matern,0.3033331750101111,0.5682325311173713,1.5,TPESampler,COMPLETE
2148,0.2867972534163986,2025-04-24 21:25:11.736772,2025-04-24 21:25:13.955709,0 days 00:00:02.218937,1238.2723773543353,Matern,17.387636970597054,0.0035915621550655632,1.5,TPESampler,COMPLETE
2149,0.9228200965391088,2025-04-24 21:25:12.640729,2025-04-24 21:25:13.954712,0 days 00:00:01.313983,0.7384681238495855,Matern,0.055499156635992905,0.026170968986738034,1.5,TPESampler,COMPLETE
2150,0.9228200067813346,2025-04-24 21:25:12.691844,2025-04-24 21:25:14.201190,0 days 00:00:01.509346,4.95474289141233,Matern,0.10645578428160349,0.05778469261416668,2.5,TPESampler,COMPLETE
2151,0.28679725215431773,2025-04-24 21:25:14.106454,2025-04-24 21:25:15.706850,0 days 00:00:01.600396,18.074825332754017,Matern,6.361699775253203,0.04249243920375657,1.5,TPESampler,COMPLETE
2152,0.9494322791291684,2025-04-24 21:25:14.160100,2025-04-24 21:25:16.265593,0 days 00:00:02.105493,20.03292787019186,Matern,225.33346287728162,0.030540000235245363,1.5,TPESampler,COMPLETE
2153,0.2867972537030034,2025-04-24 21:25:14.541744,2025-04-24 21:25:16.081741,0 days 00:00:01.539997,32.612689557294175,Matern,1.7135530515407633,0.00666862002597124,1.5,TPESampler,COMPLETE
2154,0.922820090436689,2025-04-24 21:25:15.932237,2025-04-24 21:25:17.349515,0 days 00:00:01.417278,4.94603723629024,RBF,0.0776351432795664,0.10624752237384444,2.5,TPESampler,COMPLETE
2155,0.2867972490844954,2025-04-24 21:25:16.309092,2025-04-24 21:25:18.242798,0 days 00:00:01.933706,159.58659845648987,Matern,11.461303857569158,0.02579782959838683,1.5,TPESampler,COMPLETE
2156,0.922820094367864,2025-04-24 21:25:16.555132,2025-04-24 21:25:18.243982,0 days 00:00:01.688850,124.7355228912745,Matern,135.32734583242916,0.0007266428174421897,1.5,TPESampler,COMPLETE
2157,0.2867972635625501,2025-04-24 21:25:17.627460,2025-04-24 21:25:19.358986,0 days 00:00:01.731526,7.821005362699795,Matern,0.2945230827770014,0.006411354727347168,1.5,TPESampler,COMPLETE
2158,0.922820090989387,2025-04-24 21:25:18.419391,2025-04-24 21:25:21.307158,0 days 00:00:02.887767,2.0770093815573287,Matern,1813.4785106017064,0.028720936202525145,1.5,TPESampler,COMPLETE
2159,0.9228200922852959,2025-04-24 21:25:18.479616,2025-04-24 21:25:21.127088,0 days 00:00:02.647472,6.330461167422273,Matern,236.46218855635811,0.01584773156618491,1.5,TPESampler,COMPLETE
2160,0.28679723245379574,2025-04-24 21:25:19.579550,2025-04-24 21:25:20.847893,0 days 00:00:01.268343,1554.1970711027077,Matern,0.5012386256586914,0.0012712354782992807,1.5,TPESampler,COMPLETE
2161,0.9228200955621203,2025-04-24 21:25:21.081910,2025-04-24 21:25:23.238707,0 days 00:00:02.156797,26.997047195208328,Matern,4876.032577487711,0.0047980173358468485,1.5,TPESampler,COMPLETE
2162,0.9228200923808899,2025-04-24 21:25:21.441580,2025-04-24 21:25:24.031628,0 days 00:00:02.590048,32.88787227203261,Matern,425.75547796411996,0.010691153869932935,1.5,TPESampler,COMPLETE
2163,0.9494098043297112,2025-04-24 21:25:21.596812,2025-04-24 21:25:23.085777,0 days 00:00:01.488965,92788.73876611573,Matern,0.46132931165212804,1.3992273215931657e-05,1.5,TPESampler,COMPLETE
2164,0.9494317804800946,2025-04-24 21:25:23.294779,2025-04-24 21:25:24.921555,0 days 00:00:01.626776,35946.92489838634,Matern,0.023379229049767625,4.61342984282076e-06,0.5,TPESampler,COMPLETE
2165,0.9494317804742891,2025-04-24 21:25:23.482161,2025-04-24 21:25:25.137463,0 days 00:00:01.655302,2473.3881334402413,Matern,0.009863310941108898,0.0247450084340294,1.5,TPESampler,COMPLETE
2166,0.2867972285855996,2025-04-24 21:25:24.375170,2025-04-24 21:25:26.188478,0 days 00:00:01.813308,22.50685749010699,Matern,3.6342510884308417,0.09498597552347804,1.5,TPESampler,COMPLETE
2167,0.28679729537775706,2025-04-24 21:25:25.167415,2025-04-24 21:25:26.485903,0 days 00:00:01.318488,2.3859671436201237,Matern,1.4227058810501974,0.008898098001024696,1.5,TPESampler,COMPLETE
2168,0.28679725250527044,2025-04-24 21:25:25.386617,2025-04-24 21:25:27.187414,0 days 00:00:01.800797,221.97207732448808,Matern,20.27263372709676,0.011402283716795218,1.5,TPESampler,COMPLETE
2169,0.28679725236902653,2025-04-24 21:25:26.420600,2025-04-24 21:25:28.211407,0 days 00:00:01.790807,0.867082203796555,Matern,0.2971926617399965,0.06106834708483299,1.5,TPESampler,COMPLETE
2170,0.2867972410361529,2025-04-24 21:25:26.893330,2025-04-24 21:25:28.975490,0 days 00:00:02.082160,7501.039676286829,Matern,16.162286827702093,0.004647559710231466,1.5,TPESampler,COMPLETE
2171,0.9228200902294513,2025-04-24 21:25:27.467484,2025-04-24 21:25:29.820574,0 days 00:00:02.353090,2706.164888215914,Matern,14116.503907952128,0.019457435996656093,1.5,TPESampler,COMPLETE
