number,value,datetime_start,datetime_complete,duration,params_constant_value,params_kernel_type,params_length_scale,params_noise_level,params_nu,system_attrs_auto:sampler,state
1260,0.2867972527951557,2025-04-24 21:14:24.029116,2025-04-24 21:14:26.614347,0 days 00:00:02.585231,7320.579219112301,Matern,1995.2993145013618,0.9912865210822356,1.5,TPESampler,COMPLETE
1261,0.9228200937942646,2025-04-24 21:14:24.894595,2025-04-24 21:14:26.359580,0 days 00:00:01.464985,0.00393432621434088,RBF,9.02885673492264e-05,1.6670310246459296e-09,2.5,TPESampler,COMPLETE
1262,0.9228200924342483,2025-04-24 21:14:26.526989,2025-04-24 21:14:29.219290,0 days 00:00:02.692301,7.178178695882288e-05,RBF,0.060243573386576856,0.0020769879575266363,2.5,TPESampler,COMPLETE
1263,0.2867971878366544,2025-04-24 21:14:26.580176,2025-04-24 21:14:28.427142,0 days 00:00:01.846966,7.747171619597837,Matern,21.363950029057833,0.006815348817041934,1.5,TPESampler,COMPLETE
1264,0.9228200898230721,2025-04-24 21:14:26.863995,2025-04-24 21:14:29.676938,0 days 00:00:02.812943,0.0329670770823884,Matern,627.1958304302218,0.009925402494271976,1.5,TPESampler,COMPLETE
1265,0.28870773757949936,2025-04-24 21:14:28.651786,2025-04-24 21:14:30.163184,0 days 00:00:01.511398,9.197271506296595,Matern,3.478528087023671,0.0005737688475828749,2.5,TPESampler,COMPLETE
1266,0.9228200927496044,2025-04-24 21:14:29.452139,2025-04-24 21:14:31.261395,0 days 00:00:01.809256,0.24053125436448217,Matern,18.089118616772527,0.010742844946459577,1.5,TPESampler,COMPLETE
1267,0.28679722138345504,2025-04-24 21:14:29.958002,2025-04-24 21:14:31.357256,0 days 00:00:01.399254,48.17578078490573,Matern,4.694565355572936,0.5077857295510977,1.5,TPESampler,COMPLETE
1268,0.9228200918417715,2025-04-24 21:14:30.419293,2025-04-24 21:14:32.984801,0 days 00:00:02.565508,85797.90675055368,Matern,1732.433301823563,6.441038664637529e-05,2.5,TPESampler,COMPLETE
1269,0.2867972689961741,2025-04-24 21:14:31.447383,2025-04-24 21:14:33.662188,0 days 00:00:02.214805,1303.5145854966354,Matern,146.39829243484925,0.009279501213650622,1.5,TPESampler,COMPLETE
1270,0.2867971574779674,2025-04-24 21:14:31.529577,2025-04-24 21:14:33.131343,0 days 00:00:01.601766,0.18303271058900414,Matern,18.089011345714784,0.6510430532229349,1.5,TPESampler,COMPLETE
1271,0.2867972476843507,2025-04-24 21:14:33.180383,2025-04-24 21:14:35.228925,0 days 00:00:02.048542,0.019769358862490705,Matern,47.453441342801014,0.613200549445197,1.5,TPESampler,COMPLETE
1272,0.9228200924780449,2025-04-24 21:14:33.358397,2025-04-24 21:14:35.472055,0 days 00:00:02.113658,0.2105293368435639,Matern,39.0305781942209,0.015152261561769135,1.5,TPESampler,COMPLETE
1273,0.28679725473113216,2025-04-24 21:14:33.867888,2025-04-24 21:14:35.332546,0 days 00:00:01.464658,1.3952344063937283,Matern,31.054476750842564,0.12096400488359935,1.5,TPESampler,COMPLETE
1274,0.2867972726048598,2025-04-24 21:14:35.413376,2025-04-24 21:14:37.741523,0 days 00:00:02.328147,0.005314114503173975,Matern,42.45656693657617,0.5089037643275303,1.5,TPESampler,COMPLETE
1275,0.28679725152834007,2025-04-24 21:14:35.483928,2025-04-24 21:14:37.204367,0 days 00:00:01.720439,0.3883996139677622,Matern,73.86432736997425,0.332964121491178,1.5,TPESampler,COMPLETE
1276,0.2867972608711701,2025-04-24 21:14:36.054501,2025-04-24 21:14:37.680576,0 days 00:00:01.626075,0.04731460315284473,Matern,33.24302621578225,0.712413510194775,1.5,TPESampler,COMPLETE
1277,0.2867972466299768,2025-04-24 21:14:37.434270,2025-04-24 21:14:39.145516,0 days 00:00:01.711246,1.6406349354941918,Matern,34.889071333577654,0.762638404458872,1.5,TPESampler,COMPLETE
1278,0.28679724996764666,2025-04-24 21:14:37.957117,2025-04-24 21:14:39.782376,0 days 00:00:01.825259,4.52798742980258,Matern,1.4668393026456812,0.1582325950344141,1.5,TPESampler,COMPLETE
1279,0.9228200924989113,2025-04-24 21:14:38.022721,2025-04-24 21:14:41.153600,0 days 00:00:03.130879,0.020164936548071163,Matern,0.038740285161571415,0.042098659164744506,1.5,TPESampler,COMPLETE
1280,0.9228200925261116,2025-04-24 21:14:39.463466,2025-04-24 21:14:42.088499,0 days 00:00:02.625033,0.0004172535068938952,Matern,0.024552554093326084,0.00027077589333646124,1.5,TPESampler,COMPLETE
1281,0.2867972219382846,2025-04-24 21:14:40.085962,2025-04-24 21:14:42.142782,0 days 00:00:02.056820,0.7034279230884073,Matern,2.8314186725430437,0.2337066253964166,1.5,TPESampler,COMPLETE
1282,0.9228200918099229,2025-04-24 21:14:41.471101,2025-04-24 21:14:44.311482,0 days 00:00:02.840381,0.001893802959738866,Matern,0.07163435266974373,0.14615899763711854,1.5,TPESampler,COMPLETE
1283,0.2867972331236333,2025-04-24 21:14:42.306602,2025-04-24 21:14:45.364528,0 days 00:00:03.057926,0.016429140559655768,Matern,0.6193757078538797,0.026839000756095986,1.5,TPESampler,COMPLETE
1284,0.2867972441076212,2025-04-24 21:14:42.370981,2025-04-24 21:14:43.999658,0 days 00:00:01.628677,0.3575379208960587,Matern,8.228474200213487,0.09181759099543071,1.5,TPESampler,COMPLETE
1285,0.286797242953147,2025-04-24 21:14:44.268433,2025-04-24 21:14:45.836720,0 days 00:00:01.568287,0.5446266417902564,Matern,104.93678817940248,0.533596533562633,1.5,TPESampler,COMPLETE
1286,0.2867972528930001,2025-04-24 21:14:44.562294,2025-04-24 21:14:46.155000,0 days 00:00:01.592706,5153.459984667541,Matern,1.2083764900929395,0.06637598483328422,1.5,TPESampler,COMPLETE
1287,0.28679731559835336,2025-04-24 21:14:45.593877,2025-04-24 21:14:47.262269,0 days 00:00:01.668392,0.03134217245609554,Matern,7.375842600602308,0.4272507381781756,1.5,TPESampler,COMPLETE
1288,0.2867972552024457,2025-04-24 21:14:46.076874,2025-04-24 21:14:48.066126,0 days 00:00:01.989252,0.0032236361557688976,Matern,4.337615348439805,0.7291109606993804,1.5,TPESampler,COMPLETE
1289,0.9494322793417138,2025-04-24 21:14:46.427763,2025-04-24 21:14:47.640048,0 days 00:00:01.212285,70870.30729959236,Matern,4.73650805512378,0.01738767024680861,1.5,TPESampler,COMPLETE
1290,0.9493830482073061,2025-04-24 21:14:47.476787,2025-04-24 21:14:48.854412,0 days 00:00:01.377625,0.0013980396231485683,Matern,602.4105846252938,0.0003447653450624702,1.5,TPESampler,COMPLETE
1291,0.9228200904534337,2025-04-24 21:14:47.855507,2025-04-24 21:14:51.029488,0 days 00:00:03.173981,0.02012993689955355,Matern,135.4505584512055,0.008294119091481795,1.5,TPESampler,COMPLETE
1292,0.286797257713918,2025-04-24 21:14:48.318787,2025-04-24 21:14:49.596267,0 days 00:00:01.277480,1.5284188806075372,Matern,4.779013657652416,0.023113437881784635,1.5,TPESampler,COMPLETE
1293,0.33018839481825446,2025-04-24 21:14:49.100411,2025-04-24 21:14:50.642656,0 days 00:00:01.542245,0.07673361364129215,Matern,1.0665158557431262,0.0234442019631576,0.5,TPESampler,COMPLETE
1294,0.9494322301442252,2025-04-24 21:14:49.845931,2025-04-24 21:14:51.421099,0 days 00:00:01.575168,0.22629268669862057,Matern,2104.222065920762,0.8778988430439318,1.5,TPESampler,COMPLETE
1295,0.2867972533147003,2025-04-24 21:14:50.900265,2025-04-24 21:14:52.264586,0 days 00:00:01.364321,9.683037136107762,Matern,1.3051291978317627,0.038139954674077464,1.5,TPESampler,COMPLETE
1296,0.2867972241282503,2025-04-24 21:14:51.274313,2025-04-24 21:14:52.658581,0 days 00:00:01.384268,52.831832418015765,Matern,8.224065900509892,0.005861344932361768,1.5,TPESampler,COMPLETE
1297,0.28679726077158124,2025-04-24 21:14:51.637980,2025-04-24 21:14:53.132284,0 days 00:00:01.494304,17267.00901140602,Matern,0.4611145019958344,0.5670196133470815,1.5,TPESampler,COMPLETE
1298,0.9228200927439698,2025-04-24 21:14:52.482205,2025-04-24 21:14:54.674174,0 days 00:00:02.191969,0.9204186481925922,RBF,311.26080309469006,0.004355107005249357,1.5,TPESampler,COMPLETE
1299,0.9494322792697527,2025-04-24 21:14:52.864825,2025-04-24 21:14:54.185224,0 days 00:00:01.320399,44649.120989823015,Matern,58.00526641050417,8.754750093086754e-06,1.5,TPESampler,COMPLETE
1300,0.9228200926231845,2025-04-24 21:14:53.381541,2025-04-24 21:14:55.196139,0 days 00:00:01.814598,1.0287236729178957,Matern,33.09271034603671,0.003359753524348077,1.5,TPESampler,COMPLETE
1301,0.922820093777877,2025-04-24 21:14:54.403934,2025-04-24 21:14:56.070289,0 days 00:00:01.666355,21.716699374183403,Matern,73.7013558774943,0.0034325660966454986,1.5,TPESampler,COMPLETE
1302,0.28679722526593315,2025-04-24 21:14:54.927904,2025-04-24 21:14:57.615522,0 days 00:00:02.687618,0.017581001776472326,Matern,1.9718520043482097,0.01763906308706637,1.5,TPESampler,COMPLETE
1303,0.2867972514456906,2025-04-24 21:14:55.455209,2025-04-24 21:14:56.915522,0 days 00:00:01.460313,64.31256232557965,Matern,16.087542265611095,0.002324440932827165,1.5,TPESampler,COMPLETE
1304,0.9228200946681928,2025-04-24 21:14:56.294060,2025-04-24 21:14:58.201949,0 days 00:00:01.907889,15.247537886415467,Matern,1374.8548051426042,2.3430991962594166e-05,1.5,TPESampler,COMPLETE
1305,0.9494317777332003,2025-04-24 21:14:57.156925,2025-04-24 21:14:58.257480,0 days 00:00:01.100555,1.8402937150418838e-07,RBF,0.0003567991773012878,0.19867659594456227,1.5,TPESampler,COMPLETE
1306,0.9494322303822053,2025-04-24 21:14:57.856264,2025-04-24 21:14:58.862799,0 days 00:00:01.006535,4.191785572942096e-07,RBF,413.0362267581384,0.5925832806626536,0.5,TPESampler,COMPLETE
1307,0.28679721554752924,2025-04-24 21:14:58.419258,2025-04-24 21:15:00.445156,0 days 00:00:02.025898,651.5796940845047,Matern,1.1858501019274268,0.9869564164273366,1.5,TPESampler,COMPLETE
1308,0.2867972517298069,2025-04-24 21:14:58.481429,2025-04-24 21:15:00.697928,0 days 00:00:02.216499,1980.3929075103222,Matern,18.78295668564384,0.002507097310147699,1.5,TPESampler,COMPLETE
1309,0.9228200924663603,2025-04-24 21:14:59.133091,2025-04-24 21:15:00.472630,0 days 00:00:01.339539,15.141760347936291,RBF,4.275999757790436,0.00020321907607194343,1.5,TPESampler,COMPLETE
1310,0.9228200936822408,2025-04-24 21:15:00.614743,2025-04-24 21:15:02.381251,0 days 00:00:01.766508,2.5593631161667036,Matern,258.37628252664035,0.0002453108631906933,1.5,TPESampler,COMPLETE
1311,0.2867972477017285,2025-04-24 21:15:00.661240,2025-04-24 21:15:02.408591,0 days 00:00:01.747351,15.948922778127384,Matern,15.116926130739248,0.4854587734844471,1.5,TPESampler,COMPLETE
1312,0.286797262154727,2025-04-24 21:15:00.961671,2025-04-24 21:15:02.514237,0 days 00:00:01.552566,1.0548501587786288,Matern,74.59917017736056,0.5769868896717362,1.5,TPESampler,COMPLETE
1313,0.2867974112304949,2025-04-24 21:15:02.527865,2025-04-24 21:15:04.166995,0 days 00:00:01.639130,128.3187021221256,Matern,14.141291020750105,0.0024899059266888343,1.5,TPESampler,COMPLETE
1314,0.9228200924901587,2025-04-24 21:15:02.591402,2025-04-24 21:15:04.267856,0 days 00:00:01.676454,426.3386791223886,Matern,4.6730209398648874e-05,0.23532302018677523,2.5,TPESampler,COMPLETE
1315,0.9228200911935567,2025-04-24 21:15:02.721734,2025-04-24 21:15:05.988368,0 days 00:00:03.266634,0.0003437342524160343,Matern,34.6387317118873,0.005552038694557614,1.5,TPESampler,COMPLETE
1316,0.9494322793417138,2025-04-24 21:15:04.348900,2025-04-24 21:15:05.674046,0 days 00:00:01.325146,76602.63878839811,Matern,15.265743412300296,0.018175351251917205,1.5,TPESampler,COMPLETE
1317,0.28679725258859734,2025-04-24 21:15:04.484412,2025-04-24 21:15:07.991343,0 days 00:00:03.506931,0.07627780345788461,Matern,0.543539787940765,4.823394763930606e-06,1.5,TPESampler,COMPLETE
1318,0.28679730462924435,2025-04-24 21:15:05.909798,2025-04-24 21:15:07.832448,0 days 00:00:01.922650,0.49894857303941087,Matern,3.2109372624960786,0.0007947132012057791,1.5,TPESampler,COMPLETE
1319,0.9228200923901126,2025-04-24 21:15:06.290470,2025-04-24 21:15:08.084853,0 days 00:00:01.794383,237.403684707537,Matern,214.0184062405572,0.0002351322947449631,1.5,TPESampler,COMPLETE
1320,0.2867972558881794,2025-04-24 21:15:08.047174,2025-04-24 21:15:09.547840,0 days 00:00:01.500666,17.164642416927173,Matern,4.022474487332892,0.024346504335775523,1.5,TPESampler,COMPLETE
1321,0.9494322793417138,2025-04-24 21:15:08.192256,2025-04-24 21:15:09.485276,0 days 00:00:01.293020,801.9183468641824,Matern,7.12286858291908,0.03377063845953796,1.5,TPESampler,COMPLETE
1322,0.3301888248784557,2025-04-24 21:15:08.380969,2025-04-24 21:15:10.664596,0 days 00:00:02.283627,285.1773630549672,Matern,138.37955264260196,0.00012954875094018588,0.5,TPESampler,COMPLETE
1323,0.9228200938802198,2025-04-24 21:15:09.673316,2025-04-24 21:15:11.705026,0 days 00:00:02.031710,1788.286403410948,Matern,111.72342709728076,1.233581630711815e-10,1.5,TPESampler,COMPLETE
1324,0.2867972283505874,2025-04-24 21:15:09.755809,2025-04-24 21:15:11.780754,0 days 00:00:02.024945,1.1446501867910415,Matern,369.0672977973543,0.9500238880841131,1.5,TPESampler,COMPLETE
1325,0.30268458603261733,2025-04-24 21:15:11.112003,2025-04-24 21:15:13.123830,0 days 00:00:02.011827,3991.637094531707,RBF,49.12755607510353,0.05043744544467313,1.5,TPESampler,COMPLETE
1326,0.9494317804800958,2025-04-24 21:15:11.894267,2025-04-24 21:15:13.201381,0 days 00:00:01.307114,32601.353358624994,Matern,1.72415206975056e-05,5.229997535214123e-09,1.5,TPESampler,COMPLETE
1327,0.9228200927257593,2025-04-24 21:15:11.975761,2025-04-24 21:15:13.647262,0 days 00:00:01.671501,0.03325944436934249,Matern,4.317758062792858,0.0008695064745602875,1.5,TPESampler,COMPLETE
1328,0.32712380353591797,2025-04-24 21:15:13.308850,2025-04-24 21:15:15.457638,0 days 00:00:02.148788,5.479406047524948,Matern,0.11335120148280015,0.03335425351072574,1.5,TPESampler,COMPLETE
1329,0.28679725662712485,2025-04-24 21:15:13.399169,2025-04-24 21:15:16.370906,0 days 00:00:02.971737,1979.6327345369352,Matern,111.11585914954715,0.00015906207302748796,1.5,TPESampler,COMPLETE
1330,0.9426080257107811,2025-04-24 21:15:13.915932,2025-04-24 21:15:16.457021,0 days 00:00:02.541089,0.04895913093421403,Matern,435.6816152129901,0.016784189334722293,1.5,TPESampler,COMPLETE
1331,0.2867972519155684,2025-04-24 21:15:15.674814,2025-04-24 21:15:17.389199,0 days 00:00:01.714385,1704.0965434716804,Matern,4.424562851127187,0.5459738747122721,1.5,TPESampler,COMPLETE
1332,0.28679726048078497,2025-04-24 21:15:16.557473,2025-04-24 21:15:19.007965,0 days 00:00:02.450492,0.09437949430942102,Matern,2.064049587323953,0.02506931408534348,1.5,TPESampler,COMPLETE
1333,0.9228200951435459,2025-04-24 21:15:16.716571,2025-04-24 21:15:18.691050,0 days 00:00:01.974479,4.328161383480532,Matern,30.13865944071619,0.0014229221727308956,1.5,TPESampler,COMPLETE
1334,0.2867972470446269,2025-04-24 21:15:17.628207,2025-04-24 21:15:19.542900,0 days 00:00:01.914693,1856.0419803841473,Matern,94.61776248165862,0.007550640554238241,1.5,TPESampler,COMPLETE
1335,0.9228200910413911,2025-04-24 21:15:18.928046,2025-04-24 21:15:21.045643,0 days 00:00:02.117597,2.238693941733048,Matern,135.24616687239967,0.01138051761920106,1.5,TPESampler,COMPLETE
1336,0.28679725878728457,2025-04-24 21:15:19.277850,2025-04-24 21:15:21.021744,0 days 00:00:01.743894,88436.73236849713,Matern,1.0997928922778322,0.07469135514394497,1.5,TPESampler,COMPLETE
1337,0.2867971863510208,2025-04-24 21:15:19.780029,2025-04-24 21:15:21.099276,0 days 00:00:01.319247,4.7611889469888915,Matern,3.254520806307277,0.9185622912135097,1.5,TPESampler,COMPLETE
1338,0.9228200924949299,2025-04-24 21:15:21.179050,2025-04-24 21:15:23.428080,0 days 00:00:02.249030,1437.8563643673324,Matern,34958.34216293455,2.3558981762136267e-10,0.5,TPESampler,COMPLETE
1339,0.33018865259420754,2025-04-24 21:15:21.208059,2025-04-24 21:15:22.948679,0 days 00:00:01.740620,0.5202375699497125,Matern,16.729467962209934,0.45594358651327965,0.5,TPESampler,COMPLETE
1340,0.2867972521017053,2025-04-24 21:15:21.257664,2025-04-24 21:15:23.329781,0 days 00:00:02.072117,121.44843124940874,Matern,39.26808533415866,0.19688308760637907,1.5,TPESampler,COMPLETE
1341,0.28679728779521063,2025-04-24 21:15:23.186375,2025-04-24 21:15:24.639876,0 days 00:00:01.453501,0.2925898465311592,Matern,0.909104994770087,0.002789337761760517,1.5,TPESampler,COMPLETE
1342,0.2867972115613623,2025-04-24 21:15:23.568578,2025-04-24 21:15:25.772481,0 days 00:00:02.203903,72967.14427741495,Matern,27.086524256237315,0.44255840002628916,1.5,TPESampler,COMPLETE
1343,0.9228200901724302,2025-04-24 21:15:23.788986,2025-04-24 21:15:25.463277,0 days 00:00:01.674291,67723.09615219,Matern,1021.7460881737375,0.0009451379259064143,1.5,TPESampler,COMPLETE
1344,0.9494322793414697,2025-04-24 21:15:24.855539,2025-04-24 21:15:27.012289,0 days 00:00:02.156750,0.6498203919125488,Matern,96213.46392699276,0.049091988553534624,1.5,TPESampler,COMPLETE
1345,0.28679721314749035,2025-04-24 21:15:25.691610,2025-04-24 21:15:27.949175,0 days 00:00:02.257565,94.80599009964484,Matern,218.08570302181315,0.9520975348026337,1.5,TPESampler,COMPLETE
1346,0.922820098154068,2025-04-24 21:15:26.047990,2025-04-24 21:15:28.703180,0 days 00:00:02.655190,7.962639369688695,Matern,8.938253990924359,5.412476035336841e-05,1.5,TPESampler,COMPLETE
1347,0.9228201027437398,2025-04-24 21:15:27.262608,2025-04-24 21:15:28.701623,0 days 00:00:01.439015,0.5837923065138383,Matern,14.96932526965114,0.00427595330216388,2.5,TPESampler,COMPLETE
1348,0.2867973360912498,2025-04-24 21:15:28.174738,2025-04-24 21:15:30.074594,0 days 00:00:01.899856,183.1945714773474,Matern,51.43211629117389,0.0012157408942887415,1.5,TPESampler,COMPLETE
1349,0.9228200924183053,2025-04-24 21:15:28.875344,2025-04-24 21:15:30.309502,0 days 00:00:01.434158,0.0012043803198298938,RBF,2.81893742413e-05,1.0678015025399694e-09,1.5,TPESampler,COMPLETE
1350,0.9494322793417138,2025-04-24 21:15:28.920636,2025-04-24 21:15:30.149089,0 days 00:00:01.228453,348.7053833108531,Matern,0.8707203061721419,0.03515527721257345,1.5,TPESampler,COMPLETE
1351,0.9228200966346023,2025-04-24 21:15:30.261243,2025-04-24 21:15:32.561605,0 days 00:00:02.300362,0.004810191443664149,Matern,0.027674461087725897,1.6404890592297786e-07,2.5,TPESampler,COMPLETE
1352,0.2867974446906726,2025-04-24 21:15:30.391925,2025-04-24 21:15:32.560072,0 days 00:00:02.168147,176.99465613860173,Matern,156.06945559934658,0.01458529826283314,1.5,TPESampler,COMPLETE
1353,0.9494322793407286,2025-04-24 21:15:30.552716,2025-04-24 21:15:32.615300,0 days 00:00:02.062584,5.079323206585639,Matern,86171.48657742796,0.8277935659942465,1.5,TPESampler,COMPLETE
1354,0.28679725929448613,2025-04-24 21:15:32.710159,2025-04-24 21:15:34.196519,0 days 00:00:01.486360,1.9022484605301009,Matern,0.8449742597326088,0.012110764950297668,1.5,TPESampler,COMPLETE
1355,0.28679725327445094,2025-04-24 21:15:32.779299,2025-04-24 21:15:35.210020,0 days 00:00:02.430721,34928.9444488089,Matern,9.320175669888924,0.00033437082631581673,1.5,TPESampler,COMPLETE
1356,0.9494317804782872,2025-04-24 21:15:32.809572,2025-04-24 21:15:34.096390,0 days 00:00:01.286818,484.063437313905,RBF,0.0013906697903971644,4.205893012731555e-10,0.5,TPESampler,COMPLETE
1357,0.9228200967644499,2025-04-24 21:15:34.291243,2025-04-24 21:15:36.239207,0 days 00:00:01.947964,4.464537962394751,Matern,157.55454820703233,0.0021099352819156196,1.5,TPESampler,COMPLETE
1358,0.2867972527238872,2025-04-24 21:15:34.370351,2025-04-24 21:15:36.206500,0 days 00:00:01.836149,1733.7323826635525,Matern,29.57501474933105,0.025910178852018254,1.5,TPESampler,COMPLETE
1359,0.2867972474385201,2025-04-24 21:15:35.459326,2025-04-24 21:15:37.168447,0 days 00:00:01.709121,26.23801576917422,Matern,39.390504771561645,0.018697134237973652,1.5,TPESampler,COMPLETE
1360,0.28679726733160954,2025-04-24 21:15:36.371450,2025-04-24 21:15:38.185636,0 days 00:00:01.814186,0.06454613115264234,Matern,371.76436387070726,0.072000197674733,1.5,TPESampler,COMPLETE
1361,0.2867972778945455,2025-04-24 21:15:36.415323,2025-04-24 21:15:38.503422,0 days 00:00:02.088099,95204.08992692221,Matern,329.3362332328241,0.053772434810771756,1.5,TPESampler,COMPLETE
1362,0.3026845076314701,2025-04-24 21:15:37.423403,2025-04-24 21:15:41.531132,0 days 00:00:04.107729,1.951865015986196e-05,RBF,1.5462308920285444,0.6995979727299229,1.5,TPESampler,COMPLETE
1363,0.2867972620660552,2025-04-24 21:15:38.426427,2025-04-24 21:15:39.885428,0 days 00:00:01.459001,0.023634247948403218,Matern,6.579389767433356,0.8177233019994905,1.5,TPESampler,COMPLETE
1364,0.9494322672758873,2025-04-24 21:15:38.757820,2025-04-24 21:15:39.915958,0 days 00:00:01.158138,214.86738675484213,Matern,2.875775256611606,0.01704760251612088,0.5,TPESampler,COMPLETE
1365,0.2867972305542106,2025-04-24 21:15:40.050983,2025-04-24 21:15:41.731626,0 days 00:00:01.680643,9.539580722739306,Matern,64.5561256724698,0.09713344037410636,1.5,TPESampler,COMPLETE
1366,0.9228200922492881,2025-04-24 21:15:40.116178,2025-04-24 21:15:42.742283,0 days 00:00:02.626105,13.593190827534468,Matern,185.53286001664864,0.019205089429331423,1.5,TPESampler,COMPLETE
1367,0.9228200929377719,2025-04-24 21:15:41.742713,2025-04-24 21:15:43.490114,0 days 00:00:01.747401,0.10757134955733169,Matern,34.8174929092257,2.3058604954909326e-05,1.5,TPESampler,COMPLETE
1368,0.28679728662942644,2025-04-24 21:15:41.956578,2025-04-24 21:15:44.564980,0 days 00:00:02.608402,54.99225105468551,Matern,0.6547012182430479,0.017612573099285503,1.5,TPESampler,COMPLETE
1369,0.9228196437413392,2025-04-24 21:15:42.963120,2025-04-24 21:15:45.024677,0 days 00:00:02.061557,52.757107529996624,RBF,0.18505107414927302,0.15373901557564118,1.5,TPESampler,COMPLETE
1370,0.2867972368120721,2025-04-24 21:15:43.843742,2025-04-24 21:15:46.144849,0 days 00:00:02.301107,32.77038443488392,Matern,3.613610095801153,0.0003784873258062118,1.5,TPESampler,COMPLETE
1371,0.28679726831084756,2025-04-24 21:15:44.921140,2025-04-24 21:15:46.986182,0 days 00:00:02.065042,1042.4509317570337,Matern,8.026479879468441,0.0006740353430175286,1.5,TPESampler,COMPLETE
1372,0.286797220031677,2025-04-24 21:15:45.299329,2025-04-24 21:15:47.026494,0 days 00:00:01.727165,0.11440788008941852,Matern,0.5499566008416497,0.8478667287763416,1.5,TPESampler,COMPLETE
1373,0.2954697822610742,2025-04-24 21:15:46.588905,2025-04-24 21:15:49.137588,0 days 00:00:02.548683,15192.260022075448,Matern,3.3727692911152913,0.08859462637008413,2.5,TPESampler,COMPLETE
