number,value,datetime_start,datetime_complete,duration,params_constant_value,params_kernel_type,params_length_scale,params_noise_level,params_nu,system_attrs_auto:sampler,state
1602,0.28679722306291977,2025-04-24 21:18:33.717909,2025-04-24 21:18:35.136612,0 days 00:00:01.418703,9.83648986266282,Matern,3.8145725662982324,0.001771891815363766,1.5,TPESampler,COMPLETE
1603,0.2867972640529872,2025-04-24 21:18:34.531809,2025-04-24 21:18:36.216005,0 days 00:00:01.684196,779.3355253232342,Matern,0.861455930265687,0.0008291871836813635,1.5,TPESampler,COMPLETE
1604,0.9494315867116252,2025-04-24 21:18:35.244312,2025-04-24 21:18:36.502242,0 days 00:00:01.257930,437.3185350748351,Matern,0.50110664581023,0.00018693397261285264,1.5,TPESampler,COMPLETE
1605,0.28679724132777207,2025-04-24 21:18:35.379782,2025-04-24 21:18:37.072730,0 days 00:00:01.692948,89.03754722656637,Matern,0.3961034830548559,0.013939822006069753,1.5,TPESampler,COMPLETE
1606,0.9494317804802552,2025-04-24 21:18:36.430743,2025-04-24 21:18:38.241884,0 days 00:00:01.811141,5.046097579235383,RBF,0.12296839919627618,1.8414640734408121e-10,0.5,TPESampler,COMPLETE
1607,0.2867972705944438,2025-04-24 21:18:36.814540,2025-04-24 21:18:39.631441,0 days 00:00:02.816901,717.8321010142082,Matern,0.15852514308889423,0.0009414727831853484,1.5,TPESampler,COMPLETE
1608,0.2867975268492799,2025-04-24 21:18:37.345051,2025-04-24 21:18:39.632839,0 days 00:00:02.287788,294.52931409677757,Matern,3.6252774862958947,0.0007710351391566632,1.5,TPESampler,COMPLETE
1609,0.9494317804802448,2025-04-24 21:18:38.459188,2025-04-24 21:18:40.459702,0 days 00:00:02.000514,42.1572770661462,Matern,0.014251230823362184,0.00011060919335548144,1.5,TPESampler,COMPLETE
1610,0.28679720596194475,2025-04-24 21:18:39.963716,2025-04-24 21:18:41.876470,0 days 00:00:01.912754,96.34580470159662,Matern,1.7489821959065361,0.0009034750727359083,1.5,TPESampler,COMPLETE
1611,0.9228200876120445,2025-04-24 21:18:40.066929,2025-04-24 21:18:42.576208,0 days 00:00:02.509279,0.0011682042737759493,Matern,0.00011111085058498862,0.0013155685084231285,1.5,TPESampler,COMPLETE
1612,0.9228200924655632,2025-04-24 21:18:40.748876,2025-04-24 21:18:44.109318,0 days 00:00:03.360442,0.00039741273226243036,RBF,48104.76445511307,7.924546642073749e-07,0.5,TPESampler,COMPLETE
1613,0.28679727963629137,2025-04-24 21:18:42.097921,2025-04-24 21:18:44.286033,0 days 00:00:02.188112,0.9859441287413652,Matern,0.1706451596718308,0.0004211351884499184,1.5,TPESampler,COMPLETE
1614,0.3301885377736179,2025-04-24 21:18:42.825862,2025-04-24 21:18:44.375799,0 days 00:00:01.549937,2.8630053534016837,Matern,0.286508804882655,0.016497923606279354,0.5,TPESampler,COMPLETE
1615,0.9228200922986379,2025-04-24 21:18:44.332434,2025-04-24 21:18:48.108691,0 days 00:00:03.776257,7.20374343184576e-06,Matern,456.0177639977725,1.4274567396259933e-10,1.5,TPESampler,COMPLETE
1616,0.28679720590587665,2025-04-24 21:18:44.579060,2025-04-24 21:18:47.083675,0 days 00:00:02.504615,7.56376335047854,Matern,0.29080199477329904,0.015756465424460537,1.5,TPESampler,COMPLETE
1617,0.9494322790554032,2025-04-24 21:18:44.624005,2025-04-24 21:18:45.908395,0 days 00:00:01.284390,633.8627674393598,Matern,32.004188774437196,4.598519433046483e-06,1.5,TPESampler,COMPLETE
1618,0.9228200925293417,2025-04-24 21:18:46.122083,2025-04-24 21:18:47.528153,0 days 00:00:01.406070,0.010744178313452668,RBF,3.4000035455442528,2.4133208695313066e-05,1.5,TPESampler,COMPLETE
1619,0.9494322790793477,2025-04-24 21:18:47.295821,2025-04-24 21:18:48.578906,0 days 00:00:01.283085,76.10635573274226,Matern,3.032194098731618,8.095527141030376e-05,1.5,TPESampler,COMPLETE
1620,0.28679727270586497,2025-04-24 21:18:47.748023,2025-04-24 21:18:49.622736,0 days 00:00:01.874713,65.48798200129977,Matern,2.3718926831372933,0.0013341812881289277,1.5,TPESampler,COMPLETE
1621,0.922820092621879,2025-04-24 21:18:48.342177,2025-04-24 21:18:50.463800,0 days 00:00:02.121623,0.5556629774256683,Matern,6.088680054876754,7.333732111143092e-05,1.5,TPESampler,COMPLETE
1622,0.28679724533150913,2025-04-24 21:18:48.836384,2025-04-24 21:18:50.433559,0 days 00:00:01.597175,2846.524736225315,Matern,1.70726377746188,0.0018116270239840662,1.5,TPESampler,COMPLETE
1623,0.28679724693691444,2025-04-24 21:18:49.822138,2025-04-24 21:18:51.966537,0 days 00:00:02.144399,13628.07025799941,Matern,2.640416372797532,0.0050668840186394925,1.5,TPESampler,COMPLETE
1624,0.9494322793417138,2025-04-24 21:18:50.595388,2025-04-24 21:18:52.382929,0 days 00:00:01.787541,7311.971875260941,Matern,0.6854734023276555,0.04479675075691614,1.5,TPESampler,COMPLETE
1625,0.9228200924630108,2025-04-24 21:18:50.647250,2025-04-24 21:18:53.254783,0 days 00:00:02.607533,47.03855793061462,Matern,0.014886054915609938,0.0123745030419287,1.5,TPESampler,COMPLETE
1626,0.9494317804804222,2025-04-24 21:18:52.400071,2025-04-24 21:18:54.101549,0 days 00:00:01.701478,48.040188437075756,Matern,0.05751416108183987,3.2227880122906417e-07,1.5,TPESampler,COMPLETE
1627,0.2887076394853051,2025-04-24 21:18:52.756533,2025-04-24 21:18:54.752642,0 days 00:00:01.996109,0.030018035471306003,Matern,1.1568570448123123,0.38659409754606694,2.5,TPESampler,COMPLETE
1628,0.2867972618339387,2025-04-24 21:18:53.491917,2025-04-24 21:18:57.335419,0 days 00:00:03.843502,0.0002725915781627178,Matern,0.3784181421174422,0.20292086682816027,1.5,TPESampler,COMPLETE
1629,0.2867972496104772,2025-04-24 21:18:54.316218,2025-04-24 21:18:55.794306,0 days 00:00:01.478088,0.7782208653024896,Matern,5.135343394616555,0.000998067360644617,1.5,TPESampler,COMPLETE
1630,0.9228200879145588,2025-04-24 21:18:54.980170,2025-04-24 21:18:56.519716,0 days 00:00:01.539546,89.61673281851769,Matern,108.50523197329859,1.303686656396142e-10,2.5,TPESampler,COMPLETE
1631,0.9494322793417138,2025-04-24 21:18:56.027064,2025-04-24 21:18:57.262827,0 days 00:00:01.235763,13.102642216470727,Matern,1.421684653378101,0.02172207758646073,1.5,TPESampler,COMPLETE
1632,0.28679725267264244,2025-04-24 21:18:56.736404,2025-04-24 21:18:58.865009,0 days 00:00:02.128605,726.7667446279547,Matern,13.968124164939104,0.0009531168798576884,1.5,TPESampler,COMPLETE
1633,0.2867973131316074,2025-04-24 21:18:57.443773,2025-04-24 21:18:59.795766,0 days 00:00:02.351993,81224.74259252357,Matern,273.1925378102395,0.00035346944178938245,1.5,TPESampler,COMPLETE
1634,0.9228200595821245,2025-04-24 21:18:57.577535,2025-04-24 21:18:59.126445,0 days 00:00:01.548910,0.0513767864367273,Matern,0.060823278673923106,0.002883005797604622,1.5,TPESampler,COMPLETE
1635,0.3301907545991486,2025-04-24 21:18:59.084502,2025-04-24 21:19:00.752241,0 days 00:00:01.667739,75081.51416932733,Matern,89.08407311368312,0.000460299754420922,0.5,TPESampler,COMPLETE
1636,0.9228200976603937,2025-04-24 21:18:59.364520,2025-04-24 21:19:01.569245,0 days 00:00:02.204725,3.2124505291119583,Matern,12924.75197647319,1.407306805154928e-06,2.5,TPESampler,COMPLETE
1637,0.9228200873383519,2025-04-24 21:19:00.015658,2025-04-24 21:19:01.387021,0 days 00:00:01.371363,36.00170173463702,Matern,0.08035848467175014,0.0007098797991948485,1.5,TPESampler,COMPLETE
1638,0.9228200926652443,2025-04-24 21:19:00.968676,2025-04-24 21:19:03.583950,0 days 00:00:02.615274,0.06176687025655058,Matern,813.660007081127,0.000637570568047174,0.5,TPESampler,COMPLETE
1639,0.2867972210229878,2025-04-24 21:19:01.588297,2025-04-24 21:19:03.153804,0 days 00:00:01.565507,2362.98058709054,Matern,1.5045071301223298,0.12382376901116202,1.5,TPESampler,COMPLETE
1640,0.9228186236388137,2025-04-24 21:19:01.787133,2025-04-24 21:19:03.329133,0 days 00:00:01.542000,37.54393184843068,Matern,29.846025538790247,0.00013432896054957054,1.5,TPESampler,COMPLETE
1641,0.2867972630151373,2025-04-24 21:19:03.331681,2025-04-24 21:19:05.173628,0 days 00:00:01.841947,73738.81146555148,Matern,24.000869169414404,0.04564958050005421,1.5,TPESampler,COMPLETE
1642,0.2867972524784174,2025-04-24 21:19:03.544074,2025-04-24 21:19:05.994573,0 days 00:00:02.450499,3.085897533496357,Matern,1.4519527065478601,0.00038147270812424733,1.5,TPESampler,COMPLETE
1643,0.29281834150205516,2025-04-24 21:19:03.863539,2025-04-24 21:19:06.728918,0 days 00:00:02.865379,0.0008012835856089609,Matern,11.583083470637467,0.07100382096024595,1.5,TPESampler,COMPLETE
1644,0.2867972541156158,2025-04-24 21:19:05.405888,2025-04-24 21:19:06.821570,0 days 00:00:01.415682,0.18483053902676239,Matern,0.6447722916105134,0.025902578005137893,1.5,TPESampler,COMPLETE
1645,0.2867972774255966,2025-04-24 21:19:06.216519,2025-04-24 21:19:09.051637,0 days 00:00:02.835118,12.789151285613375,Matern,26.887383936246145,0.00047839352522132105,1.5,TPESampler,COMPLETE
1646,0.2867973049779043,2025-04-24 21:19:06.914900,2025-04-24 21:19:08.504615,0 days 00:00:01.589715,8.68618821799087,Matern,7.714578125602818,0.017684296374552825,1.5,TPESampler,COMPLETE
1647,0.2867972506052491,2025-04-24 21:19:07.041821,2025-04-24 21:19:08.772920,0 days 00:00:01.731099,47850.5233034983,Matern,0.41892142772611146,0.803602222352371,1.5,TPESampler,COMPLETE
1648,0.9228200925036633,2025-04-24 21:19:08.724260,2025-04-24 21:19:11.703709,0 days 00:00:02.979449,2.4869346476053527,RBF,17009.710109437587,0.010062476604879531,0.5,TPESampler,COMPLETE
1649,0.9228200936200499,2025-04-24 21:19:09.044951,2025-04-24 21:19:10.713088,0 days 00:00:01.668137,422.2293497503996,Matern,0.005333900496278557,0.00800722847936448,0.5,TPESampler,COMPLETE
1650,0.9494317804802438,2025-04-24 21:19:09.349805,2025-04-24 21:19:10.873668,0 days 00:00:01.523863,11.65399865165367,Matern,0.06834094173487398,9.8606616287514e-06,1.5,TPESampler,COMPLETE
1651,0.2867972506459235,2025-04-24 21:19:10.920916,2025-04-24 21:19:14.091226,0 days 00:00:03.170310,0.025338377944577706,Matern,1.2197424348616073,0.001550909380996169,1.5,TPESampler,COMPLETE
1652,0.2867972561426941,2025-04-24 21:19:11.118768,2025-04-24 21:19:13.191117,0 days 00:00:02.072349,391.6245348531825,Matern,0.23559630760222033,0.06555094662485488,1.5,TPESampler,COMPLETE
1653,0.2867971949835639,2025-04-24 21:19:11.924186,2025-04-24 21:19:13.639677,0 days 00:00:01.715491,201.8284119815478,Matern,8.06172379941204,0.004482367311391791,1.5,TPESampler,COMPLETE
1654,0.9228200916824338,2025-04-24 21:19:13.406545,2025-04-24 21:19:15.429528,0 days 00:00:02.022983,0.4090765502402241,Matern,67.36321083181414,0.0008182452176690654,1.5,TPESampler,COMPLETE
1655,0.28679725349620433,2025-04-24 21:19:13.853045,2025-04-24 21:19:15.785616,0 days 00:00:01.932571,798.0298111702026,Matern,8.588376895462053,0.0011590993497014085,1.5,TPESampler,COMPLETE
1656,0.9228200911519333,2025-04-24 21:19:14.373663,2025-04-24 21:19:16.871081,0 days 00:00:02.497418,0.011147054923150842,Matern,22.660241781952994,0.004488988305677622,1.5,TPESampler,COMPLETE
1657,0.9494322705895045,2025-04-24 21:19:15.650185,2025-04-24 21:19:16.761788,0 days 00:00:01.111603,21.997241440751534,Matern,0.877355392256793,4.000832742002097e-05,1.5,TPESampler,COMPLETE
1658,0.9494322793417138,2025-04-24 21:19:16.021717,2025-04-24 21:19:17.538974,0 days 00:00:01.517257,79563.64056302037,Matern,6.427144130321392,0.01922710536021824,1.5,TPESampler,COMPLETE
1659,0.2867972517682186,2025-04-24 21:19:16.954747,2025-04-24 21:19:18.690484,0 days 00:00:01.735737,658.8926078271676,Matern,28.6788157844484,0.0009332738426551543,1.5,TPESampler,COMPLETE
1660,0.30268453888895436,2025-04-24 21:19:17.027334,2025-04-24 21:19:18.408575,0 days 00:00:01.381241,0.5086646252819256,RBF,1.10811572855402,0.028378226825455342,1.5,TPESampler,COMPLETE
1661,0.2867972586353947,2025-04-24 21:19:17.756796,2025-04-24 21:19:19.535958,0 days 00:00:01.779162,9.917846321006797,Matern,1.4252627202066435,0.11212915532659806,1.5,TPESampler,COMPLETE
1662,0.9228200911650722,2025-04-24 21:19:18.630295,2025-04-24 21:19:19.908862,0 days 00:00:01.278567,63137.47077646307,RBF,325.00923014926343,8.277031992426206e-07,2.5,TPESampler,COMPLETE
1663,0.28679719697105804,2025-04-24 21:19:18.950255,2025-04-24 21:19:20.824587,0 days 00:00:01.874332,25.25944455837006,Matern,3.3459512639881686,0.002331142616678044,1.5,TPESampler,COMPLETE
1664,0.9228200927831958,2025-04-24 21:19:19.760445,2025-04-24 21:19:21.335572,0 days 00:00:01.575127,285.0591911854313,Matern,187.50402174487263,3.1729968104939754e-05,1.5,TPESampler,COMPLETE
1665,0.2867973039918895,2025-04-24 21:19:20.144865,2025-04-24 21:19:21.950418,0 days 00:00:01.805553,83248.44419182143,Matern,0.34989785370940557,0.007847416997357283,1.5,TPESampler,COMPLETE
1666,0.9228200923241141,2025-04-24 21:19:21.058006,2025-04-24 21:19:22.692527,0 days 00:00:01.634521,3.646845517002333,Matern,110.40717865454494,4.9398257592865424e-05,1.5,TPESampler,COMPLETE
1667,0.9494322793417138,2025-04-24 21:19:21.580648,2025-04-24 21:19:22.691123,0 days 00:00:01.110475,1772.00740920478,Matern,1.2093917026711587,0.044826093358877876,1.5,TPESampler,COMPLETE
1668,0.9228200987163907,2025-04-24 21:19:22.145737,2025-04-24 21:19:24.318975,0 days 00:00:02.173238,0.14133431273733155,Matern,23.139584335312033,0.006661300426187558,1.5,TPESampler,COMPLETE
1669,0.9494321341633646,2025-04-24 21:19:22.852009,2025-04-24 21:19:24.283476,0 days 00:00:01.431467,49.51320126245783,Matern,59.373796184996465,1.8680934623835764e-09,0.5,TPESampler,COMPLETE
1670,0.2867972452944525,2025-04-24 21:19:22.909176,2025-04-24 21:19:24.541826,0 days 00:00:01.632650,1.1368494627177221,Matern,1.4476959642423795,0.0016757839804606698,1.5,TPESampler,COMPLETE
1671,0.3301892710265992,2025-04-24 21:19:24.455175,2025-04-24 21:19:26.246411,0 days 00:00:01.791236,1.8909379503739023,Matern,0.994295598028214,0.001001317199546744,0.5,TPESampler,COMPLETE
1672,0.922819961733327,2025-04-24 21:19:24.498237,2025-04-24 21:19:27.391928,0 days 00:00:02.893691,0.24610721056270568,Matern,0.09439340969281851,3.9301648029193514e-05,1.5,TPESampler,COMPLETE
1673,0.28679725110375054,2025-04-24 21:19:25.008430,2025-04-24 21:19:27.091496,0 days 00:00:02.083066,3140.8783555372042,Matern,23.51893850148955,0.004093658546932607,1.5,TPESampler,COMPLETE
1674,0.30268457401872917,2025-04-24 21:19:26.475380,2025-04-24 21:19:28.399578,0 days 00:00:01.924198,0.03209643816338057,RBF,0.9274194350830886,0.3509246484924774,2.5,TPESampler,COMPLETE
1675,0.28679723407314106,2025-04-24 21:19:27.349095,2025-04-24 21:19:29.522051,0 days 00:00:02.172956,94934.49340862596,Matern,2936.6339927815147,0.021159055109078336,1.5,TPESampler,COMPLETE
1676,0.2867972523231969,2025-04-24 21:19:27.653186,2025-04-24 21:19:29.425696,0 days 00:00:01.772510,95.33765501658391,Matern,17.88096217212713,0.004271876391612994,1.5,TPESampler,COMPLETE
1677,0.9494322765913885,2025-04-24 21:19:28.617749,2025-04-24 21:19:30.012314,0 days 00:00:01.394565,974.0986465236404,Matern,0.8825482230474182,1.4629632341526053e-05,1.5,TPESampler,COMPLETE
1678,0.28679726383290194,2025-04-24 21:19:29.597110,2025-04-24 21:19:31.264454,0 days 00:00:01.667344,367.88556879763803,Matern,1.48217188168561,0.33237257904044276,1.5,TPESampler,COMPLETE
1679,0.28679724383266464,2025-04-24 21:19:29.726614,2025-04-24 21:19:31.293837,0 days 00:00:01.567223,2.5318035852305094,Matern,0.3188100881580936,0.003524236441234607,1.5,TPESampler,COMPLETE
1680,0.30268457674965427,2025-04-24 21:19:30.285270,2025-04-24 21:19:33.427440,0 days 00:00:03.142170,0.0003191350932951507,RBF,0.6876015604875502,0.23985886143438898,0.5,TPESampler,COMPLETE
1681,0.29804302178182246,2025-04-24 21:19:31.414421,2025-04-24 21:19:34.702018,0 days 00:00:03.287597,2.962906002753305,Matern,18.910888638712667,0.004519082102749792,1.5,TPESampler,COMPLETE
1682,0.2887076258173529,2025-04-24 21:19:31.463553,2025-04-24 21:19:32.956595,0 days 00:00:01.493042,12.362810695252056,Matern,6.1568215572098905,0.030943459779658098,2.5,TPESampler,COMPLETE
1683,0.9228200928739312,2025-04-24 21:19:33.178374,2025-04-24 21:19:34.941108,0 days 00:00:01.762734,0.16705437285660232,Matern,0.05255805540849009,0.3396268333885005,1.5,TPESampler,COMPLETE
1684,0.9228200910139237,2025-04-24 21:19:33.659295,2025-04-24 21:19:35.394069,0 days 00:00:01.734774,29.969852085351125,Matern,0.02804339500940463,0.0022036500946020637,1.5,TPESampler,COMPLETE
1685,0.28679725136952455,2025-04-24 21:19:34.992441,2025-04-24 21:19:36.540066,0 days 00:00:01.547625,10.971478989504522,Matern,10.262141793303373,0.04008039220075618,1.5,TPESampler,COMPLETE
1686,0.2867973672746515,2025-04-24 21:19:35.231605,2025-04-24 21:19:36.984972,0 days 00:00:01.753367,5.14226342251013,Matern,31.04446208367176,0.023563734181500286,1.5,TPESampler,COMPLETE
1687,0.2867972410862487,2025-04-24 21:19:35.701885,2025-04-24 21:19:37.815947,0 days 00:00:02.114062,86223.01040639715,Matern,6.703799856327912,0.0007922912165934273,1.5,TPESampler,COMPLETE
1688,0.2867972436923449,2025-04-24 21:19:36.754805,2025-04-24 21:19:38.748593,0 days 00:00:01.993788,19.260363413528232,Matern,0.2557594250024733,0.00047515999075724085,1.5,TPESampler,COMPLETE
1689,0.2867972451083113,2025-04-24 21:19:37.199713,2025-04-24 21:19:38.749827,0 days 00:00:01.550114,0.04702549993651629,Matern,15.091567840895069,0.11970987251791027,1.5,TPESampler,COMPLETE
1690,0.9228200922424029,2025-04-24 21:19:38.033194,2025-04-24 21:19:39.671283,0 days 00:00:01.638089,10.277562802782771,Matern,140.5832069533424,0.0015981061335395748,1.5,TPESampler,COMPLETE
1691,0.2867972526485517,2025-04-24 21:19:38.921815,2025-04-24 21:19:40.900830,0 days 00:00:01.979015,1169.0459635193513,Matern,43.95040366323121,0.08971871127155527,1.5,TPESampler,COMPLETE
1692,0.28679724870778844,2025-04-24 21:19:38.962843,2025-04-24 21:19:40.634559,0 days 00:00:01.671716,0.16857670045580087,Matern,5.236473387871178,0.9486177423552585,1.5,TPESampler,COMPLETE
1693,0.9494322793295645,2025-04-24 21:19:40.132157,2025-04-24 21:19:41.384461,0 days 00:00:01.252304,1498.4170532494402,Matern,6.416796293602702,0.00010580111375469075,1.5,TPESampler,COMPLETE
1694,0.2887076472286961,2025-04-24 21:19:40.861323,2025-04-24 21:19:43.661035,0 days 00:00:02.799712,2995.959855679926,Matern,374.9727859646797,0.04796644413891189,2.5,TPESampler,COMPLETE
1695,0.9494317804801582,2025-04-24 21:19:41.163949,2025-04-24 21:19:42.657421,0 days 00:00:01.493472,4915.797617594244,RBF,4.235272133928995e-05,3.807479099732009e-10,1.5,TPESampler,COMPLETE
1696,0.9228200911054913,2025-04-24 21:19:41.597229,2025-04-24 21:19:45.211788,0 days 00:00:03.614559,1.3860844787596672e-06,Matern,0.02021961616791852,1.6270344408232072e-07,2.5,TPESampler,COMPLETE
1697,0.9494322709945981,2025-04-24 21:19:43.132201,2025-04-24 21:19:45.574043,0 days 00:00:02.441842,2.0050076031201853,Matern,1.294922218395562,6.460137537939005e-05,1.5,TPESampler,COMPLETE
1698,0.9494317804789819,2025-04-24 21:19:44.133412,2025-04-24 21:19:46.268523,0 days 00:00:02.135111,74216.80133715551,Matern,0.038324648496431545,0.0005214494135369075,1.5,TPESampler,COMPLETE
1699,0.9228200922561263,2025-04-24 21:19:45.519078,2025-04-24 21:19:47.431304,0 days 00:00:01.912226,59.49540962950573,Matern,511.27635871140234,0.00046187282422373554,1.5,TPESampler,COMPLETE
1700,0.2867972731382393,2025-04-24 21:19:45.997441,2025-04-24 21:19:48.164468,0 days 00:00:02.167027,47545.148534216765,Matern,18.041537335606304,0.8456973266583783,1.5,TPESampler,COMPLETE
1701,0.9228200903054673,2025-04-24 21:19:46.528697,2025-04-24 21:19:48.959623,0 days 00:00:02.430926,75.50110522500381,RBF,526.1454344745367,0.009060396492628747,1.5,TPESampler,COMPLETE
1702,0.9494320590650002,2025-04-24 21:19:47.650816,2025-04-24 21:19:48.868282,0 days 00:00:01.217466,18.72829345042649,Matern,10.850616646007659,5.747935190114609e-05,0.5,TPESampler,COMPLETE
1703,0.9494317801267247,2025-04-24 21:19:48.394765,2025-04-24 21:19:49.815775,0 days 00:00:01.421010,123.92128306345971,Matern,0.09918725246990481,2.4046411054462802e-06,0.5,TPESampler,COMPLETE
1704,0.9228200923554463,2025-04-24 21:19:49.040790,2025-04-24 21:19:51.030085,0 days 00:00:01.989295,1.3365843890109972,Matern,4.855129340593447,8.018402921999593e-05,1.5,TPESampler,COMPLETE
1705,0.9228200968704106,2025-04-24 21:19:49.114123,2025-04-24 21:19:50.937557,0 days 00:00:01.823434,0.08719814768298453,Matern,21.510750812999863,0.0002587552282382494,1.5,TPESampler,COMPLETE
1706,0.2867973981381535,2025-04-24 21:19:50.042354,2025-04-24 21:19:51.872545,0 days 00:00:01.830191,1407.9277860619125,Matern,17.233559578319237,0.007183930821679977,1.5,TPESampler,COMPLETE
1707,0.9494313757383688,2025-04-24 21:19:51.113811,2025-04-24 21:19:52.189669,0 days 00:00:01.075858,941.0711731730249,Matern,0.4678632625902212,0.026408898331302506,1.5,TPESampler,COMPLETE
1708,0.28679724340433876,2025-04-24 21:19:51.232348,2025-04-24 21:19:52.782939,0 days 00:00:01.550591,0.4930826899841144,Matern,0.8518494563453933,0.008750318141110248,1.5,TPESampler,COMPLETE
1709,0.28679725390260585,2025-04-24 21:19:52.113545,2025-04-24 21:19:54.828663,0 days 00:00:02.715118,78491.57590567916,Matern,112.47969138556503,0.0039716553742755074,1.5,TPESampler,COMPLETE
1710,0.9228200926419283,2025-04-24 21:19:52.434895,2025-04-24 21:19:54.203079,0 days 00:00:01.768184,765.9706248722498,Matern,377.86308635325724,0.0017821540283088505,1.5,TPESampler,COMPLETE
1711,0.922820092379145,2025-04-24 21:19:53.024341,2025-04-24 21:19:54.834652,0 days 00:00:01.810311,25028.603337265322,Matern,500.5342000315118,1.1478375665044043e-06,1.5,TPESampler,COMPLETE
1712,0.28679718568486573,2025-04-24 21:19:54.420264,2025-04-24 21:19:55.949712,0 days 00:00:01.529448,12.78133640474813,Matern,3.853272148305237,0.0007210589750135875,1.5,TPESampler,COMPLETE
1713,0.2867972635427794,2025-04-24 21:19:55.084293,2025-04-24 21:19:56.973581,0 days 00:00:01.889288,68.67736060313455,Matern,20.46652847643,0.03829460673503631,1.5,TPESampler,COMPLETE
1714,0.2867972594713121,2025-04-24 21:19:55.146500,2025-04-24 21:19:57.002663,0 days 00:00:01.856163,3.9990544354211375,Matern,30.99805361866449,0.02755435490262888,1.5,TPESampler,COMPLETE
1715,0.9494322774005556,2025-04-24 21:19:56.179195,2025-04-24 21:19:57.402785,0 days 00:00:01.223590,145.88782097474817,Matern,2.6271805166153053,4.867374388009273e-06,1.5,TPESampler,COMPLETE
