number,value,datetime_start,datetime_complete,duration,params_constant_value,params_kernel_type,params_length_scale,params_noise_level,params_nu,system_attrs_auto:sampler,state
1716,0.30268461697354704,2025-04-24 21:19:57.151728,2025-04-24 21:19:58.833938,0 days 00:00:01.682210,81.1005257605572,RBF,0.8982256670965035,0.0006905934886345791,0.5,TPESampler,COMPLETE
1717,0.9494317804799416,2025-04-24 21:19:57.199687,2025-04-24 21:19:58.575107,0 days 00:00:01.375420,27607.17318376594,Matern,4.0668251779902135e-05,4.3135888047757095e-05,0.5,TPESampler,COMPLETE
1718,0.2867972510335434,2025-04-24 21:19:57.673781,2025-04-24 21:20:00.498962,0 days 00:00:02.825181,0.0012704341589781344,Matern,0.1347671970427798,0.0010831305745143574,1.5,TPESampler,COMPLETE
1719,0.9228200923162823,2025-04-24 21:19:58.786160,2025-04-24 21:20:00.872932,0 days 00:00:02.086772,4.801959596696657,Matern,342.05708641508204,0.0005101727246327441,1.5,TPESampler,COMPLETE
1720,0.3301888278688201,2025-04-24 21:19:59.308084,2025-04-24 21:20:03.246728,0 days 00:00:03.938644,0.0007187248783449946,Matern,0.11914910310217976,0.059154937410045835,0.5,TPESampler,COMPLETE
1721,0.28679725920330057,2025-04-24 21:20:00.727567,2025-04-24 21:20:02.709219,0 days 00:00:01.981652,4103.267844583018,Matern,55.495758279791275,0.08600632089591242,1.5,TPESampler,COMPLETE
1722,0.9494322793417138,2025-04-24 21:20:01.094982,2025-04-24 21:20:02.140374,0 days 00:00:01.045392,482.7242684666318,Matern,10.21615664477125,0.020848939815717497,1.5,TPESampler,COMPLETE
1723,0.28679724602654594,2025-04-24 21:20:02.359404,2025-04-24 21:20:04.078888,0 days 00:00:01.719484,148.23605852562724,Matern,0.2773770196270383,0.00019234105895011292,1.5,TPESampler,COMPLETE
1724,0.28679724489834824,2025-04-24 21:20:03.003297,2025-04-24 21:20:04.515449,0 days 00:00:01.512152,464.8731672768172,Matern,11.412208565018686,0.7019352549199815,1.5,TPESampler,COMPLETE
1725,0.922820092403761,2025-04-24 21:20:03.506185,2025-04-24 21:20:05.842620,0 days 00:00:02.336435,0.6476250957810091,Matern,71.37278006185302,0.030124873763993244,1.5,TPESampler,COMPLETE
1726,0.9228200943697037,2025-04-24 21:20:04.376615,2025-04-24 21:20:06.124998,0 days 00:00:01.748383,0.0305217154807396,Matern,53.97185996506121,3.3019258323320434e-05,1.5,TPESampler,COMPLETE
1727,0.28679725865631245,2025-04-24 21:20:04.754608,2025-04-24 21:20:07.231715,0 days 00:00:02.477107,12.3462776755955,Matern,0.39427715754477577,0.02534540197032329,1.5,TPESampler,COMPLETE
1728,0.9228200924435572,2025-04-24 21:20:06.068631,2025-04-24 21:20:07.611126,0 days 00:00:01.542495,0.3776793263609558,Matern,0.005156571084745964,0.0009030589795847779,1.5,TPESampler,COMPLETE
1729,0.9228200922081528,2025-04-24 21:20:06.364390,2025-04-24 21:20:08.445812,0 days 00:00:02.081422,53085.69766141685,RBF,1594.5678753030854,0.0001454232898658477,1.5,TPESampler,COMPLETE
1730,0.9228200898249039,2025-04-24 21:20:07.457827,2025-04-24 21:20:09.293756,0 days 00:00:01.835929,0.04465490396630689,Matern,2.4805860966897155,0.015598470678229863,1.5,TPESampler,COMPLETE
1731,0.28679725786614185,2025-04-24 21:20:07.881719,2025-04-24 21:20:09.977690,0 days 00:00:02.095971,210.29026758209386,Matern,30.35519518894211,0.00010629591018844326,1.5,TPESampler,COMPLETE
1732,0.2867972071276966,2025-04-24 21:20:08.701615,2025-04-24 21:20:10.270550,0 days 00:00:01.568935,0.2381382053831169,Matern,0.3873519885069238,0.00043787601707849034,1.5,TPESampler,COMPLETE
1733,0.288707667481467,2025-04-24 21:20:09.563887,2025-04-24 21:20:11.556786,0 days 00:00:01.992899,86216.43680170747,Matern,1.6880447900825042,0.7057134988716038,2.5,TPESampler,COMPLETE
1734,0.9228200720813426,2025-04-24 21:20:10.201036,2025-04-24 21:20:11.711072,0 days 00:00:01.510036,516.4757056117489,Matern,0.06563919126097674,0.0032994776863894152,1.5,TPESampler,COMPLETE
1735,0.922820092392109,2025-04-24 21:20:10.579240,2025-04-24 21:20:12.442651,0 days 00:00:01.863411,51.85369319975161,Matern,563.448758612419,0.001605853631714902,1.5,TPESampler,COMPLETE
1736,0.28679727929651916,2025-04-24 21:20:11.759993,2025-04-24 21:20:13.271873,0 days 00:00:01.511880,38.378451649555856,Matern,7.929522776030363,0.0033482171661502174,1.5,TPESampler,COMPLETE
1737,0.28679718096122414,2025-04-24 21:20:11.957903,2025-04-24 21:20:13.546247,0 days 00:00:01.588344,1.1669426454296152,Matern,7.795069515810356,0.7377713534652989,1.5,TPESampler,COMPLETE
1738,0.9494317803144973,2025-04-24 21:20:12.677568,2025-04-24 21:20:13.858558,0 days 00:00:01.180990,9826.876370018137,RBF,0.017125620902771532,0.04311154421906996,2.5,TPESampler,COMPLETE
1739,0.2867972200642191,2025-04-24 21:20:13.497680,2025-04-24 21:20:15.318725,0 days 00:00:01.821045,5024.531193505094,Matern,23.616814673163955,0.0002221735881569162,1.5,TPESampler,COMPLETE
1740,0.3026846077929793,2025-04-24 21:20:13.814004,2025-04-24 21:20:15.940923,0 days 00:00:02.126919,132.89058857358842,RBF,1.501603908863276,0.0006268434245268831,1.5,TPESampler,COMPLETE
1741,0.2867972542147425,2025-04-24 21:20:14.122057,2025-04-24 21:20:15.997836,0 days 00:00:01.875779,1532.8450926281773,Matern,41.52155164007706,0.723397042765342,1.5,TPESampler,COMPLETE
1742,0.9228200915824302,2025-04-24 21:20:15.548600,2025-04-24 21:20:18.512739,0 days 00:00:02.964139,0.34087815124931237,Matern,94.93062867222991,0.009203575185141265,1.5,TPESampler,COMPLETE
1743,0.9494317804363231,2025-04-24 21:20:16.201512,2025-04-24 21:20:18.252050,0 days 00:00:02.050538,3935.5090588564435,Matern,0.01609716363017409,0.042246970951606344,1.5,TPESampler,COMPLETE
1744,0.2867972035003189,2025-04-24 21:20:16.245688,2025-04-24 21:20:19.197288,0 days 00:00:02.951600,31.234072190774995,Matern,2.2159931883279915,0.0006715204952171036,1.5,TPESampler,COMPLETE
1745,0.922820099928355,2025-04-24 21:20:18.465421,2025-04-24 21:20:20.329090,0 days 00:00:01.863669,0.033235953274199294,Matern,9.28525391496143,8.205883596799873e-06,2.5,TPESampler,COMPLETE
1746,0.2867973088141309,2025-04-24 21:20:18.797432,2025-04-24 21:20:20.382567,0 days 00:00:01.585135,11.18394269322535,Matern,2.1550942232539207,0.03615433275498518,1.5,TPESampler,COMPLETE
1747,0.9494322793417138,2025-04-24 21:20:19.437857,2025-04-24 21:20:20.459428,0 days 00:00:01.021571,74954.32523308917,Matern,4.586524873412884,0.02320153159597533,1.5,TPESampler,COMPLETE
1748,0.286797283325943,2025-04-24 21:20:20.495693,2025-04-24 21:20:22.771664,0 days 00:00:02.275971,17.888526030007586,Matern,131.1868015797595,0.027117361060119135,1.5,TPESampler,COMPLETE
1749,0.28679739154343886,2025-04-24 21:20:20.536140,2025-04-24 21:20:22.895598,0 days 00:00:02.359458,3136.6489717796044,Matern,210.24168850664162,0.705242514207674,1.5,TPESampler,COMPLETE
1750,0.2867972169411229,2025-04-24 21:20:20.669706,2025-04-24 21:20:22.516268,0 days 00:00:01.846562,28.993507088907513,Matern,9.090869250660301,0.0013418214954650216,1.5,TPESampler,COMPLETE
1751,0.2867972537099151,2025-04-24 21:20:22.728426,2025-04-24 21:20:24.434016,0 days 00:00:01.705590,0.25541820194609466,Matern,0.9537119784764618,0.0018492568251810267,1.5,TPESampler,COMPLETE
1752,0.2867972889456338,2025-04-24 21:20:23.049562,2025-04-24 21:20:24.747982,0 days 00:00:01.698420,917.224204624857,Matern,282.97656965150304,0.021942803359788644,1.5,TPESampler,COMPLETE
1753,0.949432276338797,2025-04-24 21:20:23.300158,2025-04-24 21:20:24.789894,0 days 00:00:01.489736,9.707133652307121,Matern,4.301358004984553,1.5626871937578663e-06,1.5,TPESampler,COMPLETE
1754,0.9228200911674387,2025-04-24 21:20:24.669357,2025-04-24 21:20:27.990083,0 days 00:00:03.320726,1.417036956180825e-06,Matern,41.973459783634674,5.830002649861712e-05,1.5,TPESampler,COMPLETE
1755,0.9228200928382166,2025-04-24 21:20:24.995510,2025-04-24 21:20:26.751244,0 days 00:00:01.755734,1656.226024698457,Matern,440.3214844201082,0.0009974107590219727,1.5,TPESampler,COMPLETE
1756,0.2867972432731319,2025-04-24 21:20:25.048127,2025-04-24 21:20:26.705094,0 days 00:00:01.656967,1500.934151046327,Matern,3.4994399635769966,0.35468486890003253,1.5,TPESampler,COMPLETE
1757,0.9228200906777743,2025-04-24 21:20:26.874935,2025-04-24 21:20:28.842030,0 days 00:00:01.967095,0.9090687732504186,Matern,65.18828306201198,0.0021725127223100717,1.5,TPESampler,COMPLETE
1758,0.28679725152413554,2025-04-24 21:20:27.005065,2025-04-24 21:20:30.627609,0 days 00:00:03.622544,0.008885921087212867,Matern,0.3900897683379493,0.058245505692598544,1.5,TPESampler,COMPLETE
1759,0.28679722429025983,2025-04-24 21:20:28.217499,2025-04-24 21:20:31.089417,0 days 00:00:02.871918,1247.7462063448472,Matern,0.403222213300789,0.027605622228530472,1.5,TPESampler,COMPLETE
1760,0.9228200915836916,2025-04-24 21:20:29.077760,2025-04-24 21:20:32.015986,0 days 00:00:02.938226,0.01581691647103243,RBF,223.34846817789926,4.467201309468512e-08,2.5,TPESampler,COMPLETE
1761,0.28679725483182866,2025-04-24 21:20:30.849464,2025-04-24 21:20:32.593821,0 days 00:00:01.744357,4.205600228799887,Matern,0.26747252081812506,0.03959653591640426,1.5,TPESampler,COMPLETE
1762,0.28679721354955406,2025-04-24 21:20:31.317079,2025-04-24 21:20:33.413466,0 days 00:00:02.096387,2799.3202834923054,Matern,56.43077544956848,0.0024277069636219418,1.5,TPESampler,COMPLETE
1763,0.9228200924981244,2025-04-24 21:20:32.245112,2025-04-24 21:20:36.059959,0 days 00:00:03.814847,0.0013651457221196196,Matern,4.326323399605771,0.007106825394188419,1.5,TPESampler,COMPLETE
1764,0.9228200924650375,2025-04-24 21:20:32.801075,2025-04-24 21:20:34.115059,0 days 00:00:01.313984,73784.36176464448,Matern,0.05947307629006575,0.9769260651561638,1.5,TPESampler,COMPLETE
1765,0.9494317804788318,2025-04-24 21:20:33.871382,2025-04-24 21:20:35.069759,0 days 00:00:01.198377,4019.772113918215,RBF,6.971444930182355e-05,0.00021164688432346733,1.5,TPESampler,COMPLETE
1766,0.9494316455144329,2025-04-24 21:20:34.320299,2025-04-24 21:20:35.621483,0 days 00:00:01.301184,3.2022244649935114,Matern,0.2083419707471885,3.176011305608407e-05,1.5,TPESampler,COMPLETE
1767,0.2867971937393172,2025-04-24 21:20:35.286631,2025-04-24 21:20:37.094028,0 days 00:00:01.807397,198.01991489427968,Matern,2.387479913753116,0.002506576398284304,1.5,TPESampler,COMPLETE
1768,0.922820093770679,2025-04-24 21:20:35.808428,2025-04-24 21:20:38.780645,0 days 00:00:02.972217,3.808483679677182e-05,RBF,0.001112147378421247,0.001131797169449031,0.5,TPESampler,COMPLETE
1769,0.9228200922682402,2025-04-24 21:20:36.482236,2025-04-24 21:20:38.330308,0 days 00:00:01.848072,3434.608849028128,Matern,200.97743805100518,2.8005432983400036e-05,1.5,TPESampler,COMPLETE
1770,0.28679723687518255,2025-04-24 21:20:37.316516,2025-04-24 21:20:38.810020,0 days 00:00:01.493504,8.782095812618921,Matern,4.171959275496106,0.0011482944537683493,1.5,TPESampler,COMPLETE
1771,0.28679727990443543,2025-04-24 21:20:38.540353,2025-04-24 21:20:40.142496,0 days 00:00:01.602143,2.5676623809632977,Matern,3.6068517753500533,0.8485900393363682,1.5,TPESampler,COMPLETE
1772,0.9228200903061496,2025-04-24 21:20:39.066256,2025-04-24 21:20:41.038368,0 days 00:00:01.972112,0.9891420761415651,Matern,17.753353197486245,0.00045251977131021505,1.5,TPESampler,COMPLETE
1773,0.2867972504804884,2025-04-24 21:20:39.193850,2025-04-24 21:20:41.075503,0 days 00:00:01.881653,533.9699330862256,Matern,33.03472030066902,0.0268699231428674,1.5,TPESampler,COMPLETE
1774,0.9228200915436888,2025-04-24 21:20:40.449390,2025-04-24 21:20:42.496772,0 days 00:00:02.047382,3.4442192097632316,Matern,72.2727969327758,0.009422878727792077,1.5,TPESampler,COMPLETE
1775,0.9228200945274545,2025-04-24 21:20:41.207824,2025-04-24 21:20:42.754147,0 days 00:00:01.546323,15.383211377609161,Matern,62.749977085956495,0.0001305875886432374,2.5,TPESampler,COMPLETE
1776,0.2867972521198754,2025-04-24 21:20:41.248213,2025-04-24 21:20:43.418730,0 days 00:00:02.170517,1369.6734663076395,Matern,1.4679039906342286,0.863955305982847,1.5,TPESampler,COMPLETE
1777,0.9228200928882769,2025-04-24 21:20:42.704994,2025-04-24 21:20:44.894338,0 days 00:00:02.189344,0.699594392552294,Matern,86.46994329370433,1.6885837078438112e-05,1.5,TPESampler,COMPLETE
1778,0.9494322771931301,2025-04-24 21:20:43.029695,2025-04-24 21:20:44.269477,0 days 00:00:01.239782,420.75759213249495,Matern,1.1031962507900006,4.4185048020783874e-05,1.5,TPESampler,COMPLETE
1779,0.28679723856732803,2025-04-24 21:20:43.655495,2025-04-24 21:20:45.991134,0 days 00:00:02.335639,1704.398390591444,Matern,1125.4773003114733,0.038448795741841124,1.5,TPESampler,COMPLETE
1780,0.9494322725055693,2025-04-24 21:20:44.484865,2025-04-24 21:20:47.095236,0 days 00:00:02.610371,3.043104376353545e-05,Matern,1.6962617780039395,0.0005098942191364428,1.5,TPESampler,COMPLETE
1781,0.2867972493833118,2025-04-24 21:20:45.145034,2025-04-24 21:20:47.823838,0 days 00:00:02.678804,84901.99430319994,Matern,2633.4390064181243,0.10947177799270842,1.5,TPESampler,COMPLETE
1782,0.922820092679172,2025-04-24 21:20:46.220977,2025-04-24 21:20:49.035698,0 days 00:00:02.814721,6.343935560474368,Matern,1639.5846206369054,0.0002626015926524086,1.5,TPESampler,COMPLETE
1783,0.28679729589057784,2025-04-24 21:20:47.306564,2025-04-24 21:20:49.526275,0 days 00:00:02.219711,0.2511488689583594,Matern,32.22895731255973,0.03942656321558308,1.5,TPESampler,COMPLETE
1784,0.28679728398618043,2025-04-24 21:20:48.194090,2025-04-24 21:20:49.956526,0 days 00:00:01.762436,1738.6058940049688,Matern,2.2695146349855304,0.00864745509812041,1.5,TPESampler,COMPLETE
1785,0.9228200924410538,2025-04-24 21:20:49.275269,2025-04-24 21:20:50.621812,0 days 00:00:01.346543,1.3024775731087503,Matern,6.73376597580517e-05,0.00214337218947589,2.5,TPESampler,COMPLETE
1786,0.9228200975955358,2025-04-24 21:20:49.758352,2025-04-24 21:20:51.337731,0 days 00:00:01.579379,50.402703933739396,Matern,58.05371586427537,5.499703703982176e-05,1.5,TPESampler,COMPLETE
1787,0.9228200931062647,2025-04-24 21:20:50.247044,2025-04-24 21:20:52.165545,0 days 00:00:01.918501,6.435593855045732,RBF,215.80409090272352,0.00020392133976562118,1.5,TPESampler,COMPLETE
1788,0.2867972582768889,2025-04-24 21:20:50.838124,2025-04-24 21:20:52.452613,0 days 00:00:01.614489,3.9506779681675854,Matern,0.8465016325857894,0.0002872514487342961,1.5,TPESampler,COMPLETE
1789,0.28679727038546604,2025-04-24 21:20:51.585101,2025-04-24 21:20:54.474440,0 days 00:00:02.889339,0.05883151897764814,Matern,1.0218313779535215,0.0003580238487076777,1.5,TPESampler,COMPLETE
1790,0.28679728657765335,2025-04-24 21:20:52.399411,2025-04-24 21:20:54.263562,0 days 00:00:01.864151,168.42223602829452,Matern,0.1806006193561065,0.002359906238282088,1.5,TPESampler,COMPLETE
1791,0.28679725049663823,2025-04-24 21:20:52.719654,2025-04-24 21:20:54.093334,0 days 00:00:01.373680,819.0945698320054,Matern,47.09663124700172,0.0017719589388190207,1.5,TPESampler,COMPLETE
1792,0.9228200892775787,2025-04-24 21:20:54.286194,2025-04-24 21:20:56.762506,0 days 00:00:02.476312,12.415624227943528,Matern,201.53753177957094,0.023922769781565722,1.5,TPESampler,COMPLETE
1793,0.9494322793417138,2025-04-24 21:20:54.483747,2025-04-24 21:20:55.637113,0 days 00:00:01.153366,154.05029624956447,Matern,2.568821090918798,0.030419296937791752,1.5,TPESampler,COMPLETE
1794,0.3301889051450981,2025-04-24 21:20:54.847556,2025-04-24 21:20:58.299801,0 days 00:00:03.452245,3.0010683498822473e-06,Matern,54.72021081713602,0.76506769738003,0.5,TPESampler,COMPLETE
1795,0.28679727826388074,2025-04-24 21:20:55.895104,2025-04-24 21:20:57.258232,0 days 00:00:01.363128,59.51271406300363,Matern,1.841347354786553,0.7513187099432008,1.5,TPESampler,COMPLETE
1796,0.2867972457278902,2025-04-24 21:20:57.001013,2025-04-24 21:20:58.935078,0 days 00:00:01.934065,3541.5055909185044,Matern,59.53683602795199,0.031101693744022704,1.5,TPESampler,COMPLETE
1797,0.9494322793417138,2025-04-24 21:20:57.551807,2025-04-24 21:20:58.903349,0 days 00:00:01.351542,86170.4705594947,Matern,5.399676615319048,0.00032030766953592457,1.5,TPESampler,COMPLETE
1798,0.2867972559293676,2025-04-24 21:20:58.534277,2025-04-24 21:21:00.261673,0 days 00:00:01.727396,19.000709379359915,Matern,27.08225549799955,0.0016259133020505004,1.5,TPESampler,COMPLETE
1799,0.9228200912017424,2025-04-24 21:20:59.101389,2025-04-24 21:21:00.760890,0 days 00:00:01.659501,0.4638201952663374,Matern,13.985587599378174,0.0005072828272314282,1.5,TPESampler,COMPLETE
1800,0.922820092471508,2025-04-24 21:20:59.181715,2025-04-24 21:21:02.226260,0 days 00:00:03.044545,0.0169826866397455,Matern,40.20246003068529,0.01446047258992707,1.5,TPESampler,COMPLETE
1801,0.28679896403178345,2025-04-24 21:21:00.505418,2025-04-24 21:21:02.112982,0 days 00:00:01.607564,15.635880080407816,Matern,34.54708640695283,0.01734947370156018,1.5,TPESampler,COMPLETE
1802,0.30268460975153005,2025-04-24 21:21:00.998593,2025-04-24 21:21:03.196639,0 days 00:00:02.198046,599.0989058809074,RBF,151.07332211068618,0.6130972383397602,1.5,TPESampler,COMPLETE
1803,0.9228200749110406,2025-04-24 21:21:02.286875,2025-04-24 21:21:04.463699,0 days 00:00:02.176824,73791.5801447125,Matern,4989.169959796869,7.610174792962735e-05,1.5,TPESampler,COMPLETE
1804,0.9228200927503822,2025-04-24 21:21:02.430822,2025-04-24 21:21:05.474408,0 days 00:00:03.043586,0.00013951651339318445,Matern,25.458249483715147,0.002113369419588163,0.5,TPESampler,COMPLETE
1805,0.9228200987283663,2025-04-24 21:21:03.416298,2025-04-24 21:21:05.445827,0 days 00:00:02.029529,45.97851597326467,Matern,2314.8944697346715,0.001888087038137183,1.5,TPESampler,COMPLETE
1806,0.2867972696032895,2025-04-24 21:21:04.698087,2025-04-24 21:21:06.272233,0 days 00:00:01.574146,2.663254238164495,Matern,1.4459623323370236,0.042834121601385076,1.5,TPESampler,COMPLETE
1807,0.9228193492213911,2025-04-24 21:21:05.624999,2025-04-24 21:21:07.563880,0 days 00:00:01.938881,10.93246751507694,Matern,0.10384030289887407,0.0011456157371788989,1.5,TPESampler,COMPLETE
1808,0.2867972615207633,2025-04-24 21:21:05.677465,2025-04-24 21:21:07.652978,0 days 00:00:01.975513,1430.662365979023,Matern,167.78636798141136,0.056303640789178835,1.5,TPESampler,COMPLETE
1809,0.9228200909574866,2025-04-24 21:21:06.511871,2025-04-24 21:21:08.646448,0 days 00:00:02.134577,8.801784704595617,RBF,0.0003203320078130871,0.0002339566149113011,1.5,TPESampler,COMPLETE
1810,0.2867972602024833,2025-04-24 21:21:07.741991,2025-04-24 21:21:09.618550,0 days 00:00:01.876559,145.44767926667012,Matern,2.1132384513008224,0.001490308677146699,1.5,TPESampler,COMPLETE
1811,0.2867972600104823,2025-04-24 21:21:07.873064,2025-04-24 21:21:10.741382,0 days 00:00:02.868318,0.0011018380783170156,Matern,113.20371115609336,0.8762024032216295,1.5,TPESampler,COMPLETE
1812,0.28679721394056823,2025-04-24 21:21:08.869192,2025-04-24 21:21:10.589932,0 days 00:00:01.720740,5.8768524347921,Matern,41.94556849300622,0.9361162635628544,1.5,TPESampler,COMPLETE
1813,0.9228200975250315,2025-04-24 21:21:09.869998,2025-04-24 21:21:11.679545,0 days 00:00:01.809547,79528.6758612416,Matern,0.06071267510181907,0.005418918556345446,1.5,TPESampler,COMPLETE
1814,0.9228200890704494,2025-04-24 21:21:10.802609,2025-04-24 21:21:12.524744,0 days 00:00:01.722135,53.22797178447221,Matern,51.706262256485765,9.386254570863692e-05,1.5,TPESampler,COMPLETE
1815,0.2887076032362144,2025-04-24 21:21:11.000343,2025-04-24 21:21:12.820411,0 days 00:00:01.820068,20.48286171675013,Matern,0.9551654592545288,0.0012820315008286152,2.5,TPESampler,COMPLETE
1816,0.33018882066562194,2025-04-24 21:21:11.911500,2025-04-24 21:21:14.279752,0 days 00:00:02.368252,0.06881161418188324,Matern,1880.5841746411886,0.9550132143276617,0.5,TPESampler,COMPLETE
1817,0.9494322793417138,2025-04-24 21:21:12.768125,2025-04-24 21:21:13.846113,0 days 00:00:01.077988,43327.04898280903,Matern,6.380737755026177,0.036751674060800356,1.5,TPESampler,COMPLETE
1818,0.9228200911054913,2025-04-24 21:21:13.124016,2025-04-24 21:21:15.033884,0 days 00:00:01.909868,4.52518529160207e-06,RBF,0.0012784412075394671,4.282950380135042e-07,2.5,TPESampler,COMPLETE
1819,0.2867972687504863,2025-04-24 21:21:14.079602,2025-04-24 21:21:18.086762,0 days 00:00:04.007160,0.5122417603787613,Matern,1.1740546943303596,9.828850007627918e-06,1.5,TPESampler,COMPLETE
1820,0.2867972410139623,2025-04-24 21:21:14.528185,2025-04-24 21:21:16.029224,0 days 00:00:01.501039,0.16847952928661866,Matern,0.8098001736912425,0.005288257499510977,1.5,TPESampler,COMPLETE
1821,0.2867972199336783,2025-04-24 21:21:15.261914,2025-04-24 21:21:17.135593,0 days 00:00:01.873679,574.4819349612271,Matern,6.174115933670385,0.00016614229914260523,1.5,TPESampler,COMPLETE
1822,0.28679723498163406,2025-04-24 21:21:16.253500,2025-04-24 21:21:18.205282,0 days 00:00:01.951782,87049.01855292196,Matern,15.258331312022012,0.48532075152138143,1.5,TPESampler,COMPLETE
1823,0.9228200924619809,2025-04-24 21:21:17.352456,2025-04-24 21:21:19.865413,0 days 00:00:02.512957,523.8369250864321,Matern,5409.018605651289,0.0009263495093984889,1.5,TPESampler,COMPLETE
1824,0.2867972528018476,2025-04-24 21:21:18.285293,2025-04-24 21:21:20.190125,0 days 00:00:01.904832,130.75811057400574,Matern,131.39399354874473,0.04413441422362421,1.5,TPESampler,COMPLETE
1825,0.9494322759127635,2025-04-24 21:21:18.432892,2025-04-24 21:21:19.841672,0 days 00:00:01.408780,51.483541694638156,RBF,0.5653322691234159,1.1293020286147496e-05,1.5,TPESampler,COMPLETE
1826,0.9494322790837605,2025-04-24 21:21:20.011550,2025-04-24 21:21:21.280856,0 days 00:00:01.269306,60277.706703627795,Matern,5.184227473612009,2.0257266830786574e-06,1.5,TPESampler,COMPLETE
1827,0.9494322781103542,2025-04-24 21:21:20.056867,2025-04-24 21:21:21.597765,0 days 00:00:01.540898,7.782313032259465,Matern,5.2829846311402235,5.789587641108362e-05,1.5,TPESampler,COMPLETE
1828,0.9228200943325533,2025-04-24 21:21:20.378764,2025-04-24 21:21:22.925031,0 days 00:00:02.546267,0.20320760137186913,Matern,67.12393896853585,0.027623419141568517,1.5,TPESampler,COMPLETE
1829,0.28679727824648976,2025-04-24 21:21:21.508830,2025-04-24 21:21:22.946764,0 days 00:00:01.437934,41.87738770875536,Matern,10.918073330880812,0.014136876012758915,1.5,TPESampler,COMPLETE
