number,value,datetime_start,datetime_complete,duration,params_constant_value,params_kernel_type,params_length_scale,params_noise_level,params_nu,system_attrs_auto:sampler,state
1032,0.9494322755173787,2025-04-24 21:11:40.324107,2025-04-24 21:11:41.895467,0 days 00:00:01.571360,0.9389312853714248,Matern,4019.13303300613,0.5651428363439941,2.5,TPESampler,COMPLETE
1033,0.9228200920199217,2025-04-24 21:11:41.640549,2025-04-24 21:11:43.638903,0 days 00:00:01.998354,117.40211867529695,RBF,65359.34614573295,0.00527047826892846,2.5,TPESampler,COMPLETE
1034,0.9228200924168701,2025-04-24 21:11:42.176988,2025-04-24 21:11:44.281226,0 days 00:00:02.104238,1.6364771140491987,Matern,1626.5580251526735,0.003171153615109316,1.5,TPESampler,COMPLETE
1035,0.9228200924733095,2025-04-24 21:11:42.235344,2025-04-24 21:11:44.387084,0 days 00:00:02.151740,63.704049477776934,Matern,11473.85538284515,0.022746309492082062,1.5,TPESampler,COMPLETE
1036,0.9228200911054913,2025-04-24 21:11:43.848397,2025-04-24 21:11:45.703311,0 days 00:00:01.854914,1.399084440824912e-07,Matern,9.764622938834552e-05,1.6231837948496844e-06,0.5,TPESampler,COMPLETE
1037,0.9228200922797556,2025-04-24 21:11:44.484726,2025-04-24 21:11:46.702430,0 days 00:00:02.217704,21.22018171507507,RBF,67513.20797547464,3.0008974494530154e-10,2.5,TPESampler,COMPLETE
1038,0.28679724070898316,2025-04-24 21:11:44.564324,2025-04-24 21:11:46.785258,0 days 00:00:02.220934,87312.29091992787,Matern,6068.872164365989,0.8789284655771487,1.5,TPESampler,COMPLETE
1039,0.9228200924868374,2025-04-24 21:11:45.933373,2025-04-24 21:11:47.857786,0 days 00:00:01.924413,83647.79796157293,Matern,286.9848042211863,4.3293261824048235e-05,1.5,TPESampler,COMPLETE
1040,0.28679725626119584,2025-04-24 21:11:46.859555,2025-04-24 21:11:48.880532,0 days 00:00:02.020977,183.1815203587377,Matern,503.41733343322727,0.9335519338799008,1.5,TPESampler,COMPLETE
1041,0.30268457519562963,2025-04-24 21:11:47.011871,2025-04-24 21:11:48.876541,0 days 00:00:01.864670,11.972464513074211,RBF,187.35260456917638,0.5116809000471615,2.5,TPESampler,COMPLETE
1042,0.9228200923535665,2025-04-24 21:11:48.083553,2025-04-24 21:11:50.309008,0 days 00:00:02.225455,4.364799823859871,Matern,220.90282124960711,0.010232520859346292,1.5,TPESampler,COMPLETE
1043,0.2867972499262706,2025-04-24 21:11:49.089050,2025-04-24 21:11:50.926988,0 days 00:00:01.837938,73667.61498445399,Matern,5.565512700153323,0.08099985786360217,1.5,TPESampler,COMPLETE
1044,0.2867972658292656,2025-04-24 21:11:49.139495,2025-04-24 21:11:50.928408,0 days 00:00:01.788913,788.2145845273376,Matern,251.0218251245364,0.05543391161388256,1.5,TPESampler,COMPLETE
1045,0.28679725781474685,2025-04-24 21:11:50.539173,2025-04-24 21:11:52.150222,0 days 00:00:01.611049,84341.18403405126,Matern,0.45318952937633117,0.0032780173964941303,1.5,TPESampler,COMPLETE
1046,0.9494322682903992,2025-04-24 21:11:51.159511,2025-04-24 21:11:52.602946,0 days 00:00:01.443435,25.73282847192249,Matern,0.6823258203592881,1.1513400810234337e-05,1.5,TPESampler,COMPLETE
1047,0.949432276983491,2025-04-24 21:11:51.208675,2025-04-24 21:11:53.112244,0 days 00:00:01.903569,0.4222766236697803,Matern,5064.216547251576,0.1864863220697495,1.5,TPESampler,COMPLETE
1048,0.9228200944010125,2025-04-24 21:11:52.364790,2025-04-24 21:11:54.074312,0 days 00:00:01.709522,79.21480954115474,Matern,226.2680457172773,0.0032760536898575813,1.5,TPESampler,COMPLETE
1049,0.9228200917942616,2025-04-24 21:11:52.837848,2025-04-24 21:11:55.086496,0 days 00:00:02.248648,11.105420377792461,Matern,397.34795066847715,0.01647901852426697,1.5,TPESampler,COMPLETE
1050,0.9228200922309729,2025-04-24 21:11:53.322378,2025-04-24 21:11:55.011316,0 days 00:00:01.688938,0.012339358600513965,Matern,2.8642595355176144,3.15654588187576e-05,1.5,TPESampler,COMPLETE
1051,0.28679720283957705,2025-04-24 21:11:54.301285,2025-04-24 21:11:55.843572,0 days 00:00:01.542287,30.676350138831598,Matern,5.264776448413795,0.0022647932671834674,1.5,TPESampler,COMPLETE
1052,0.286797253282369,2025-04-24 21:11:55.172447,2025-04-24 21:11:57.220708,0 days 00:00:02.048261,2100.5185786700767,Matern,23.84489330589709,0.005621325814575114,1.5,TPESampler,COMPLETE
1053,0.949432277934401,2025-04-24 21:11:55.254652,2025-04-24 21:11:56.957149,0 days 00:00:01.702497,4.236357249742881,Matern,3.700262756151245,7.674976879492706e-05,1.5,TPESampler,COMPLETE
1054,0.9228200986542886,2025-04-24 21:11:56.125615,2025-04-24 21:11:58.586435,0 days 00:00:02.460820,1779.849137764279,Matern,3416.7039574138066,0.025552638765216337,1.5,TPESampler,COMPLETE
1055,0.922820086488647,2025-04-24 21:11:57.187273,2025-04-24 21:11:59.223159,0 days 00:00:02.035886,0.33404917421308333,Matern,144.29389577833146,0.0016069816355391026,1.5,TPESampler,COMPLETE
1056,0.2867972993080204,2025-04-24 21:11:57.465146,2025-04-24 21:11:59.224913,0 days 00:00:01.759767,343.0854301578517,Matern,134.27108611001668,0.02212282441024814,1.5,TPESampler,COMPLETE
1057,0.9494322782646576,2025-04-24 21:11:58.826151,2025-04-24 21:11:59.984024,0 days 00:00:01.157873,104.07401908383362,Matern,1.2868285148049108,0.00010851975487836978,1.5,TPESampler,COMPLETE
1058,0.922820092520714,2025-04-24 21:11:59.429748,2025-04-24 21:12:01.578879,0 days 00:00:02.149131,3438.3015951380403,RBF,259.3268446905418,0.0017843377301696203,1.5,TPESampler,COMPLETE
1059,0.9228200927233036,2025-04-24 21:11:59.795999,2025-04-24 21:12:01.554933,0 days 00:00:01.758934,72.35851722276627,Matern,51.3654759220793,0.00025096202382999145,1.5,TPESampler,COMPLETE
1060,0.2867972537269999,2025-04-24 21:12:00.252115,2025-04-24 21:12:01.918708,0 days 00:00:01.666593,91680.6562191922,Matern,7.79524263929475,0.27315139921981885,1.5,TPESampler,COMPLETE
1061,0.2867972437074964,2025-04-24 21:12:01.714534,2025-04-24 21:12:03.586848,0 days 00:00:01.872314,646.7210014009415,Matern,65.72641919134482,0.07559179861954521,1.5,TPESampler,COMPLETE
1062,0.28679725861011773,2025-04-24 21:12:01.755477,2025-04-24 21:12:03.722240,0 days 00:00:01.966763,305.5998872972892,Matern,507.76504516398256,0.05506592353159253,1.5,TPESampler,COMPLETE
1063,0.9228200941486057,2025-04-24 21:12:02.446393,2025-04-24 21:12:04.814463,0 days 00:00:02.368070,143.04792414655458,Matern,3045.093236748377,0.0006554926755885731,1.5,TPESampler,COMPLETE
1064,0.9228200931001025,2025-04-24 21:12:03.787881,2025-04-24 21:12:05.996930,0 days 00:00:02.209049,7.8986631871159405,Matern,4282.195977406721,0.028478040091956865,1.5,TPESampler,COMPLETE
1065,0.9228200928864074,2025-04-24 21:12:03.941676,2025-04-24 21:12:06.033115,0 days 00:00:02.091439,96.73106271055921,Matern,1828.1507590164792,0.009826640733541387,1.5,TPESampler,COMPLETE
1066,0.9228200927102685,2025-04-24 21:12:05.037024,2025-04-24 21:12:06.574896,0 days 00:00:01.537872,804.0795206619699,RBF,220.91530337839535,6.548593628326585e-07,0.5,TPESampler,COMPLETE
1067,0.922820089943235,2025-04-24 21:12:06.169385,2025-04-24 21:12:07.726618,0 days 00:00:01.557233,9.732298080609109,Matern,46.35383997904358,0.0012534533362981166,1.5,TPESampler,COMPLETE
1068,0.28679725239530596,2025-04-24 21:12:06.227528,2025-04-24 21:12:08.580091,0 days 00:00:02.352563,198.95841310319844,Matern,1199.3432584263378,0.7865633020879722,1.5,TPESampler,COMPLETE
1069,0.9494304687535762,2025-04-24 21:12:06.898273,2025-04-24 21:12:08.753206,0 days 00:00:01.854933,0.2932191559019153,Matern,1608.059054068181,0.573845250373744,1.5,TPESampler,COMPLETE
1070,0.9494322793382929,2025-04-24 21:12:07.957261,2025-04-24 21:12:10.066606,0 days 00:00:02.109345,7.271330688511955,RBF,83680.97203820589,0.018373464627179703,1.5,TPESampler,COMPLETE
1071,0.28679725782760784,2025-04-24 21:12:08.760794,2025-04-24 21:12:10.368931,0 days 00:00:01.608137,1559.1986175781406,Matern,43.50919952350184,0.9487678188134931,1.5,TPESampler,COMPLETE
1072,0.3026845437757381,2025-04-24 21:12:08.940105,2025-04-24 21:12:10.896424,0 days 00:00:01.956319,497.70279755862464,RBF,3.2240479795607206,0.002190708563004662,1.5,TPESampler,COMPLETE
1073,0.9228200890767839,2025-04-24 21:12:10.303586,2025-04-24 21:12:12.079776,0 days 00:00:01.776190,0.07434529290968465,Matern,15.923501273015267,0.0008365152258815182,1.5,TPESampler,COMPLETE
1074,0.9228200920957433,2025-04-24 21:12:10.835710,2025-04-24 21:12:13.047805,0 days 00:00:02.212095,465.1141764543305,Matern,26736.472474897982,0.059044001524886834,1.5,TPESampler,COMPLETE
1075,0.9228200925855975,2025-04-24 21:12:11.187593,2025-04-24 21:12:13.564228,0 days 00:00:02.376635,0.03263115697168334,RBF,25049.91848976385,5.859832586115233e-06,2.5,TPESampler,COMPLETE
1076,0.2867972451953089,2025-04-24 21:12:12.297639,2025-04-24 21:12:14.086646,0 days 00:00:01.789007,0.6155049968890633,Matern,212.03916877458056,0.07540671458957551,1.5,TPESampler,COMPLETE
1077,0.2867972405691852,2025-04-24 21:12:13.321506,2025-04-24 21:12:15.144526,0 days 00:00:01.823020,0.9820115041017997,Matern,0.9559247525670181,0.00029592274204156844,1.5,TPESampler,COMPLETE
1078,0.28679726951767603,2025-04-24 21:12:13.805067,2025-04-24 21:12:15.466677,0 days 00:00:01.661610,996.1344815135999,Matern,7.842420102887035,0.0018717215990513337,1.5,TPESampler,COMPLETE
1079,0.2867972541173762,2025-04-24 21:12:14.415502,2025-04-24 21:12:16.269544,0 days 00:00:01.854042,174.94484740980354,Matern,4.3695250601842535,0.002524791841782791,1.5,TPESampler,COMPLETE
1080,0.9228200925067414,2025-04-24 21:12:15.380974,2025-04-24 21:12:18.062753,0 days 00:00:02.681779,0.14069125831280402,Matern,56448.15529177234,0.0005048633336428599,1.5,TPESampler,COMPLETE
1081,0.9228200924787868,2025-04-24 21:12:15.734820,2025-04-24 21:12:18.146659,0 days 00:00:02.411839,0.20033641876342514,RBF,874.519582314687,0.053470595133796955,1.5,TPESampler,COMPLETE
1082,0.286797252737068,2025-04-24 21:12:16.514921,2025-04-24 21:12:18.547209,0 days 00:00:02.032288,95982.93598058533,Matern,135.8252785464211,0.0006820723067574687,1.5,TPESampler,COMPLETE
1083,0.28679724776088905,2025-04-24 21:12:18.283182,2025-04-24 21:12:19.840709,0 days 00:00:01.557527,32.092131661076536,Matern,97.34388633666508,0.13727205337847143,1.5,TPESampler,COMPLETE
1084,0.33018893535010774,2025-04-24 21:12:18.340872,2025-04-24 21:12:22.198132,0 days 00:00:03.857260,0.6878318101881242,Matern,0.09841781101596309,3.443719667828875e-05,0.5,TPESampler,COMPLETE
1085,0.286797257609051,2025-04-24 21:12:18.825972,2025-04-24 21:12:20.606909,0 days 00:00:01.780937,0.10187527371590036,Matern,0.3676996673126914,0.001773780558855319,1.5,TPESampler,COMPLETE
1086,0.9493404405800507,2025-04-24 21:12:20.081488,2025-04-24 21:12:22.490686,0 days 00:00:02.409198,0.00029159921043555193,Matern,0.32756307420977343,0.01488760286061134,1.5,TPESampler,COMPLETE
1087,0.9228200924746134,2025-04-24 21:12:20.842350,2025-04-24 21:12:22.717915,0 days 00:00:01.875565,7.727077630144182,Matern,344.2877753964766,0.0004023622881387523,1.5,TPESampler,COMPLETE
1088,0.33018981925217317,2025-04-24 21:12:22.438970,2025-04-24 21:12:24.004106,0 days 00:00:01.565136,159.6015016165451,Matern,2437.9457748828986,0.22334801518010614,0.5,TPESampler,COMPLETE
1089,0.33018879535480583,2025-04-24 21:12:22.719036,2025-04-24 21:12:24.473557,0 days 00:00:01.754521,10.833329178125867,Matern,181.2753608592318,0.0004832137477067533,0.5,TPESampler,COMPLETE
1090,0.3301855082724447,2025-04-24 21:12:23.049114,2025-04-24 21:12:24.472104,0 days 00:00:01.422990,38007.33334408742,Matern,2.3144281163271105,0.005097573228784391,0.5,TPESampler,COMPLETE
1091,0.28679724593300837,2025-04-24 21:12:24.250965,2025-04-24 21:12:25.745241,0 days 00:00:01.494276,232.8144979621906,Matern,23.085917015011415,0.019643758859416882,1.5,TPESampler,COMPLETE
1092,0.9494322788683707,2025-04-24 21:12:24.704068,2025-04-24 21:12:26.451351,0 days 00:00:01.747283,8.119330483090831,Matern,16245.989071517468,0.97278247881886,1.5,TPESampler,COMPLETE
1093,0.2867972961985966,2025-04-24 21:12:24.755630,2025-04-24 21:12:26.737350,0 days 00:00:01.981720,697.4859646445462,Matern,49.54749547761384,0.000227989227292947,1.5,TPESampler,COMPLETE
1094,0.9494322793299574,2025-04-24 21:12:25.973986,2025-04-24 21:12:27.189093,0 days 00:00:01.215107,33365.2183304372,Matern,0.7261037938953457,0.012148620304885473,1.5,TPESampler,COMPLETE
1095,0.9228200918889415,2025-04-24 21:12:26.692904,2025-04-24 21:12:28.657286,0 days 00:00:01.964382,906.109546020286,Matern,54.486464617894136,2.357395723733286e-06,1.5,TPESampler,COMPLETE
1096,0.9228200926258262,2025-04-24 21:12:27.001248,2025-04-24 21:12:29.978536,0 days 00:00:02.977288,0.03053634387910517,Matern,43.75529955218602,0.0008394204502933551,1.5,TPESampler,COMPLETE
1097,0.28679725141265594,2025-04-24 21:12:27.461462,2025-04-24 21:12:29.433450,0 days 00:00:01.971988,733.2017855797917,Matern,2124.358167379348,0.07867393001757968,1.5,TPESampler,COMPLETE
1098,0.28679723966846754,2025-04-24 21:12:28.910620,2025-04-24 21:12:31.462339,0 days 00:00:02.551719,4368.791360691006,Matern,203.0644420752602,0.0280908424442008,1.5,TPESampler,COMPLETE
1099,0.2867973220107285,2025-04-24 21:12:29.648287,2025-04-24 21:12:31.015312,0 days 00:00:01.367025,5.807309560063493,Matern,8.268173942598713,0.003499190123308873,1.5,TPESampler,COMPLETE
1100,0.28679725085436525,2025-04-24 21:12:30.202787,2025-04-24 21:12:31.774353,0 days 00:00:01.571566,24.28442418941913,Matern,0.3307494954894738,0.00029400504222320173,1.5,TPESampler,COMPLETE
1101,0.28679729197108617,2025-04-24 21:12:31.229716,2025-04-24 21:12:33.240891,0 days 00:00:02.011175,0.05911777847340111,Matern,18.325046968074886,0.03581087335783782,1.5,TPESampler,COMPLETE
1102,0.922820093506488,2025-04-24 21:12:31.708240,2025-04-24 21:12:34.233061,0 days 00:00:02.524821,30.562196517172584,Matern,1604.6308027280957,0.000994013034535271,1.5,TPESampler,COMPLETE
1103,0.9228200810784374,2025-04-24 21:12:32.016109,2025-04-24 21:12:33.499093,0 days 00:00:01.482984,2.3155252367204655,Matern,42.48359004071895,0.0069348446880538135,1.5,TPESampler,COMPLETE
1104,0.2867972552482874,2025-04-24 21:12:33.445620,2025-04-24 21:12:35.101134,0 days 00:00:01.655514,34636.87786045736,Matern,2.6100552165141195,0.5654782482599914,1.5,TPESampler,COMPLETE
1105,0.2867972563905131,2025-04-24 21:12:33.804351,2025-04-24 21:12:36.193753,0 days 00:00:02.389402,49219.37237608997,Matern,332.11501907034966,0.017268884352476335,1.5,TPESampler,COMPLETE
1106,0.9494322791226542,2025-04-24 21:12:34.450093,2025-04-24 21:12:36.166679,0 days 00:00:01.716586,431.0787910304623,Matern,93805.67888584094,0.5237162602351454,1.5,TPESampler,COMPLETE
1107,0.9494322761878299,2025-04-24 21:12:35.323314,2025-04-24 21:12:36.649776,0 days 00:00:01.326462,1008.8095849659345,Matern,0.6008637824902663,0.00013800858873152928,1.5,TPESampler,COMPLETE
1108,0.9228200924708888,2025-04-24 21:12:36.332613,2025-04-24 21:12:38.238909,0 days 00:00:01.906296,58484.973986191406,Matern,0.05545629600975026,0.01056004995614411,2.5,TPESampler,COMPLETE
1109,0.28679726244514303,2025-04-24 21:12:36.388112,2025-04-24 21:12:38.342431,0 days 00:00:01.954319,2.2656777257312704,Matern,1127.986824805902,0.08415939959565302,1.5,TPESampler,COMPLETE
1110,0.2867972526584707,2025-04-24 21:12:36.919567,2025-04-24 21:12:39.179973,0 days 00:00:02.260406,641.4925760466333,Matern,1804.322276061222,0.9716072689092499,1.5,TPESampler,COMPLETE
1111,0.9228200924674687,2025-04-24 21:12:38.426753,2025-04-24 21:12:40.935809,0 days 00:00:02.509056,1.920373829686447,Matern,546.8171693308341,0.04040879830775573,1.5,TPESampler,COMPLETE
1112,0.9494317763385377,2025-04-24 21:12:38.543921,2025-04-24 21:12:40.018842,0 days 00:00:01.474921,5.122570019184697,Matern,0.16750457288491846,7.20613938422983e-05,1.5,TPESampler,COMPLETE
1113,0.28679725060230765,2025-04-24 21:12:39.416832,2025-04-24 21:12:40.989602,0 days 00:00:01.572770,171.79070369396857,Matern,37.378431986657105,0.056473158871137415,1.5,TPESampler,COMPLETE
1114,0.9494322793417138,2025-04-24 21:12:40.245752,2025-04-24 21:12:41.221219,0 days 00:00:00.975467,595.3509478028313,Matern,2.002833842383539,0.020338117973891626,1.5,TPESampler,COMPLETE
1115,0.3026846895147955,2025-04-24 21:12:41.119338,2025-04-24 21:12:42.789625,0 days 00:00:01.670287,7.981742096185232,RBF,4.888659047411468,0.15575372999351367,1.5,TPESampler,COMPLETE
1116,0.28679724072149,2025-04-24 21:12:41.166177,2025-04-24 21:12:44.243187,0 days 00:00:03.077010,1.6497936320927956e-07,Matern,0.7402958256696183,5.39416355211499e-08,1.5,TPESampler,COMPLETE
1117,0.2867973332993363,2025-04-24 21:12:41.465035,2025-04-24 21:12:42.752221,0 days 00:00:01.287186,2.3908046626187156,Matern,3.332884493237182,0.0026948221216504466,1.5,TPESampler,COMPLETE
1118,0.9228200924745865,2025-04-24 21:12:42.924298,2025-04-24 21:12:44.916255,0 days 00:00:01.991957,23.278110875763986,Matern,220.38229264636092,0.010052785042368723,1.5,TPESampler,COMPLETE
1119,0.9228200892243913,2025-04-24 21:12:42.991927,2025-04-24 21:12:45.498795,0 days 00:00:02.506868,104.6637378037845,Matern,20602.21775603345,0.011436447325699884,1.5,TPESampler,COMPLETE
1120,0.922820092485273,2025-04-24 21:12:44.473857,2025-04-24 21:12:47.039885,0 days 00:00:02.566028,1848.675112213812,Matern,64.72091122341045,8.295717035582646e-05,1.5,TPESampler,COMPLETE
1121,0.922820094282417,2025-04-24 21:12:45.143322,2025-04-24 21:12:46.762999,0 days 00:00:01.619677,0.3672713435502423,Matern,13.446093406118035,0.0003074872158071849,1.5,TPESampler,COMPLETE
1122,0.9228200928766753,2025-04-24 21:12:45.746646,2025-04-24 21:12:49.546113,0 days 00:00:03.799467,9.908016962962518e-07,RBF,549.3540414097756,7.487046150321934e-08,0.5,TPESampler,COMPLETE
1123,0.9228200924085684,2025-04-24 21:12:46.970161,2025-04-24 21:12:49.687941,0 days 00:00:02.717780,7941.152364475021,RBF,6.020826004660463,4.0840674184885753e-07,1.5,TPESampler,COMPLETE
1124,0.9228201008958745,2025-04-24 21:12:47.304252,2025-04-24 21:12:49.157381,0 days 00:00:01.853129,0.6779301912598166,Matern,0.012673580091356343,0.0033093394595371277,1.5,TPESampler,COMPLETE
1125,0.2867972440243895,2025-04-24 21:12:49.473828,2025-04-24 21:12:51.126020,0 days 00:00:01.652192,20.872078524122767,Matern,72.79276724760773,0.03319225159116016,1.5,TPESampler,COMPLETE
1126,0.2867972577128462,2025-04-24 21:12:49.839329,2025-04-24 21:12:52.174282,0 days 00:00:02.334953,22.750188994893293,Matern,5.360137893999389,0.0004477448584758822,1.5,TPESampler,COMPLETE
1127,0.9228200925010859,2025-04-24 21:12:50.111802,2025-04-24 21:12:52.091059,0 days 00:00:01.979257,8552.111527825482,Matern,33566.55941586401,0.009410109268272925,2.5,TPESampler,COMPLETE
1128,0.3026845825652706,2025-04-24 21:12:51.344334,2025-04-24 21:12:53.367871,0 days 00:00:02.023537,2753.100413589721,RBF,739.7288662262367,0.06631773423056167,1.5,TPESampler,COMPLETE
1129,0.28679725802193057,2025-04-24 21:12:52.258802,2025-04-24 21:12:54.491688,0 days 00:00:02.232886,98176.99286895905,Matern,313.905874578799,0.11495550551815933,1.5,TPESampler,COMPLETE
1130,0.9494322793417138,2025-04-24 21:12:52.352643,2025-04-24 21:12:53.593192,0 days 00:00:01.240549,98310.67209563073,Matern,20.93050168077182,0.024923435625257433,1.5,TPESampler,COMPLETE
1131,0.28870762940840156,2025-04-24 21:12:53.594510,2025-04-24 21:12:55.623277,0 days 00:00:02.028767,3928.503006540054,Matern,53.47993676734653,0.00340206049697423,2.5,TPESampler,COMPLETE
1132,0.9228200924676611,2025-04-24 21:12:53.865382,2025-04-24 21:12:55.584988,0 days 00:00:01.719606,511.58402911880825,Matern,690.1295693366233,0.0007293899137875543,1.5,TPESampler,COMPLETE
1133,0.9494322764698223,2025-04-24 21:12:54.718004,2025-04-24 21:12:56.018079,0 days 00:00:01.300075,21.91022963795555,Matern,3.204789432515815,1.8679845523222624e-07,1.5,TPESampler,COMPLETE
1134,0.9228200925924575,2025-04-24 21:12:55.743455,2025-04-24 21:12:58.181818,0 days 00:00:02.438363,0.5433300451236616,Matern,147.19001980533682,0.00027870295109885124,2.5,TPESampler,COMPLETE
1135,0.28679725208268186,2025-04-24 21:12:55.792026,2025-04-24 21:12:57.989979,0 days 00:00:02.197953,173.53501112682483,Matern,1697.0125308098545,0.7147833349164828,1.5,TPESampler,COMPLETE
1136,0.9494317587780527,2025-04-24 21:12:56.460193,2025-04-24 21:12:57.598726,0 days 00:00:01.138533,39610.05057548266,Matern,0.20969581139415128,0.027496680192149507,1.5,TPESampler,COMPLETE
1137,0.2867972487981895,2025-04-24 21:12:57.837756,2025-04-24 21:12:59.856328,0 days 00:00:02.018572,447.6430137933338,Matern,10.071326146514188,0.0017730994230761535,1.5,TPESampler,COMPLETE
1138,0.28679725278565277,2025-04-24 21:12:58.209415,2025-04-24 21:13:02.087527,0 days 00:00:03.878112,0.0008436111775018382,Matern,1.730415019885664,0.0011511138120948818,1.5,TPESampler,COMPLETE
1139,0.9228200914386464,2025-04-24 21:12:58.429957,2025-04-24 21:13:00.525182,0 days 00:00:02.095225,55.419892178098344,Matern,0.010837755202272514,0.000453479628677298,1.5,TPESampler,COMPLETE
1140,0.28679724801989775,2025-04-24 21:13:00.183822,2025-04-24 21:13:01.986708,0 days 00:00:01.802886,0.9318313040608127,Matern,87.31034117169526,0.8329678340241571,1.5,TPESampler,COMPLETE
1141,0.28679725325425875,2025-04-24 21:13:00.781132,2025-04-24 21:13:02.412899,0 days 00:00:01.631767,602.327875297666,Matern,11.698331255912194,0.1173863879850226,1.5,TPESampler,COMPLETE
1142,0.9494322792639572,2025-04-24 21:13:02.176040,2025-04-24 21:13:04.168621,0 days 00:00:01.992581,1.2834386213804738,Matern,29781.53755924335,0.02638612624663343,1.5,TPESampler,COMPLETE
1143,0.9493972186543214,2025-04-24 21:13:02.248994,2025-04-24 21:13:03.781971,0 days 00:00:01.532977,1.0233565854950291e-06,RBF,18.069120826795036,6.688060479216197e-05,0.5,TPESampler,COMPLETE
1144,0.3301887976463419,2025-04-24 21:13:02.667214,2025-04-24 21:13:04.447661,0 days 00:00:01.780447,3.1492500928196363,Matern,47.27941855537656,0.02109250644077964,0.5,TPESampler,COMPLETE
1145,0.2867972716289614,2025-04-24 21:13:04.032016,2025-04-24 21:13:05.375131,0 days 00:00:01.343115,5.05937850093724,Matern,2.4376200171989733,0.0007323245043775123,1.5,TPESampler,COMPLETE
