number,value,datetime_start,datetime_complete,duration,params_constant_value,params_kernel_type,params_length_scale,params_noise_level,params_nu,system_attrs_auto:sampler,state
688,0.2867972413379719,2025-04-24 21:07:21.566273,2025-04-24 21:07:23.359746,0 days 00:00:01.793473,514.2402260749651,Matern,28.48013771755642,0.03897503471192278,1.5,TPESampler,COMPLETE
689,0.2867972459915375,2025-04-24 21:07:22.174217,2025-04-24 21:07:23.977199,0 days 00:00:01.802982,14.844897715844843,Matern,0.9185084329120361,0.0013769252334373634,1.5,TPESampler,COMPLETE
690,0.9228200922662058,2025-04-24 21:07:22.884181,2025-04-24 21:07:25.304643,0 days 00:00:02.420462,50038.43163850261,RBF,2267.347543277786,4.837470308140659e-06,1.5,TPESampler,COMPLETE
691,0.2867972525894993,2025-04-24 21:07:23.584300,2025-04-24 21:07:25.597885,0 days 00:00:02.013585,95112.7056670205,Matern,838.8293198755739,0.10640987943045857,1.5,TPESampler,COMPLETE
692,0.2867972525584857,2025-04-24 21:07:24.212761,2025-04-24 21:07:26.215654,0 days 00:00:02.002893,580.0396364066331,Matern,0.21281379359053598,0.9788426685786735,1.5,TPESampler,COMPLETE
693,0.922820091985674,2025-04-24 21:07:25.529628,2025-04-24 21:07:26.776451,0 days 00:00:01.246823,0.7167082950082801,Matern,1.7057190872007953e-05,0.014324002050397943,0.5,TPESampler,COMPLETE
694,0.9494322793417138,2025-04-24 21:07:25.866158,2025-04-24 21:07:26.998933,0 days 00:00:01.132775,65380.36726163407,Matern,8.72217660502179,0.022254324267672904,1.5,TPESampler,COMPLETE
695,0.9228200924633186,2025-04-24 21:07:26.448829,2025-04-24 21:07:28.506621,0 days 00:00:02.057792,67.29620867318825,Matern,3280.95065853624,0.011076663241341824,1.5,TPESampler,COMPLETE
696,0.288707637744734,2025-04-24 21:07:27.061128,2025-04-24 21:07:28.935786,0 days 00:00:01.874658,34.72284115364906,Matern,0.9192900432454549,0.002408682571984951,2.5,TPESampler,COMPLETE
697,0.28679723029963344,2025-04-24 21:07:27.243391,2025-04-24 21:07:29.347196,0 days 00:00:02.103805,10964.888897191571,Matern,93.37222693877187,0.8324643877211525,1.5,TPESampler,COMPLETE
698,0.2867972429806235,2025-04-24 21:07:28.720774,2025-04-24 21:07:30.185725,0 days 00:00:01.464951,404.06465847108444,Matern,22.407262373261347,0.01033297559779483,1.5,TPESampler,COMPLETE
699,0.28679724120812566,2025-04-24 21:07:29.164538,2025-04-24 21:07:30.564395,0 days 00:00:01.399857,8.426881421199171,Matern,5.893078477336866,0.0012225949669512376,1.5,TPESampler,COMPLETE
700,0.9228200924629127,2025-04-24 21:07:29.532806,2025-04-24 21:07:32.821499,0 days 00:00:03.288693,110.68882609308935,Matern,765.1745830109794,0.02751000265333778,1.5,TPESampler,COMPLETE
701,0.9228200934240025,2025-04-24 21:07:30.405401,2025-04-24 21:07:32.264814,0 days 00:00:01.859413,1924.8933366692147,RBF,0.042394445802678406,0.0004203565572734316,1.5,TPESampler,COMPLETE
702,0.9228200840683211,2025-04-24 21:07:30.762770,2025-04-24 21:07:33.635855,0 days 00:00:02.873085,0.569396426940583,Matern,4.400925599154619e-05,1.238731145027176e-05,2.5,TPESampler,COMPLETE
703,0.2867972554794114,2025-04-24 21:07:32.492276,2025-04-24 21:07:36.231509,0 days 00:00:03.739233,0.38308311880093765,Matern,0.43953255948642733,3.678882038822613e-05,1.5,TPESampler,COMPLETE
704,0.28679723616695363,2025-04-24 21:07:33.067256,2025-04-24 21:07:35.188566,0 days 00:00:02.121310,768.3166896767225,Matern,2704.7920728169856,0.9390832601951636,1.5,TPESampler,COMPLETE
705,0.922820092486563,2025-04-24 21:07:33.885599,2025-04-24 21:07:35.917010,0 days 00:00:02.031411,4716.693374653307,RBF,42702.46551326273,0.003958526583249752,1.5,TPESampler,COMPLETE
706,0.3301889624372438,2025-04-24 21:07:35.479619,2025-04-24 21:07:37.899732,0 days 00:00:02.420113,16647.529631866677,Matern,0.3063267457015587,0.1716848637543572,0.5,TPESampler,COMPLETE
707,0.2867972233540917,2025-04-24 21:07:36.359862,2025-04-24 21:07:38.321695,0 days 00:00:01.961833,125.66676246480544,Matern,1513.0654084797213,0.9521237319302707,1.5,TPESampler,COMPLETE
708,0.9494322733023363,2025-04-24 21:07:36.464963,2025-04-24 21:07:37.882306,0 days 00:00:01.417343,187.20368804786096,Matern,0.6353171980835883,5.4323107054254806e-06,1.5,TPESampler,COMPLETE
709,0.2867972461496921,2025-04-24 21:07:38.049557,2025-04-24 21:07:39.720331,0 days 00:00:01.670774,898.6246764896108,Matern,2.6229000382015646,0.0011354305942056881,1.5,TPESampler,COMPLETE
710,0.28679727438584574,2025-04-24 21:07:38.111605,2025-04-24 21:07:39.718848,0 days 00:00:01.607243,115.70924285810156,Matern,20.6616546348075,0.9930316101536986,1.5,TPESampler,COMPLETE
711,0.9228200978155883,2025-04-24 21:07:38.606179,2025-04-24 21:07:41.606451,0 days 00:00:03.000272,9.96512496589989e-07,RBF,4376.910025236522,6.560663456164381e-08,2.5,TPESampler,COMPLETE
712,0.9228200930844007,2025-04-24 21:07:39.875780,2025-04-24 21:07:43.010977,0 days 00:00:03.135197,5.833030517755784e-06,RBF,28.794594713283548,0.00012489856360190475,2.5,TPESampler,COMPLETE
713,0.9228200922426618,2025-04-24 21:07:39.923606,2025-04-24 21:07:42.244942,0 days 00:00:02.321336,15.686829062942804,Matern,322.9814189725717,0.009210471976806262,1.5,TPESampler,COMPLETE
714,0.28679725758632674,2025-04-24 21:07:41.830038,2025-04-24 21:07:43.700488,0 days 00:00:01.870450,32262.515356997126,Matern,195.28018006213273,0.9678590943344394,1.5,TPESampler,COMPLETE
715,0.9228200913956273,2025-04-24 21:07:42.472041,2025-04-24 21:07:43.899390,0 days 00:00:01.427349,5182.383209379807,Matern,0.0076334683280278376,0.5813714045310444,2.5,TPESampler,COMPLETE
716,0.9228200924645067,2025-04-24 21:07:43.237434,2025-04-24 21:07:46.635494,0 days 00:00:03.398060,1.1108742868257888e-07,Matern,81.73407658483495,1.6194103744584255e-08,2.5,TPESampler,COMPLETE
717,0.3026845856828427,2025-04-24 21:07:43.904418,2025-04-24 21:07:46.126137,0 days 00:00:02.221719,663.2213305643338,RBF,314.4472387445473,0.5725324435399023,1.5,TPESampler,COMPLETE
718,0.28679725176026954,2025-04-24 21:07:44.097458,2025-04-24 21:07:47.091487,0 days 00:00:02.994029,48261.74938499464,Matern,0.2532816724545306,0.0015684066321206697,1.5,TPESampler,COMPLETE
719,0.2867971669923836,2025-04-24 21:07:46.367573,2025-04-24 21:07:48.034705,0 days 00:00:01.667132,1.8656872018655568,Matern,8.240395899991103,0.007641605435517199,1.5,TPESampler,COMPLETE
720,0.28870764647479524,2025-04-24 21:07:46.889533,2025-04-24 21:07:49.257941,0 days 00:00:02.368408,304.2128075084566,Matern,17055.370349148616,0.11095828564775868,2.5,TPESampler,COMPLETE
721,0.2867972447758242,2025-04-24 21:07:47.265858,2025-04-24 21:07:48.743715,0 days 00:00:01.477857,160.80027042177036,Matern,29.34926598610119,0.0443584323895406,1.5,TPESampler,COMPLETE
722,0.2867961240881429,2025-04-24 21:07:48.241657,2025-04-24 21:07:49.754018,0 days 00:00:01.512361,1.427568633060938,Matern,4.151654953506079,0.000501306647667006,1.5,TPESampler,COMPLETE
723,0.9228200924046203,2025-04-24 21:07:48.983958,2025-04-24 21:07:51.504259,0 days 00:00:02.520301,0.4659554585745126,Matern,205.08304325334555,0.0005091245652077652,1.5,TPESampler,COMPLETE
724,0.9228200921767452,2025-04-24 21:07:49.579329,2025-04-24 21:07:51.471160,0 days 00:00:01.891831,0.4506070784892579,Matern,33.8390850177048,0.00517792317646771,1.5,TPESampler,COMPLETE
725,0.9228200924779687,2025-04-24 21:07:50.015065,2025-04-24 21:07:52.095522,0 days 00:00:02.080457,0.012545602366759653,Matern,17.36206335226522,0.0016830926230436904,1.5,TPESampler,COMPLETE
726,0.28679725360264896,2025-04-24 21:07:51.619743,2025-04-24 21:07:52.959950,0 days 00:00:01.340207,0.3185229530534258,Matern,0.8199654319763998,0.003269631211784056,1.5,TPESampler,COMPLETE
727,0.9228200923135191,2025-04-24 21:07:51.666841,2025-04-24 21:07:54.017033,0 days 00:00:02.350192,94.4844058155421,Matern,47.771295978879,1.2413652307523968e-05,1.5,TPESampler,COMPLETE
728,0.9228200934068879,2025-04-24 21:07:52.322565,2025-04-24 21:07:53.983608,0 days 00:00:01.661043,0.21093082223199217,Matern,13.329688885287506,0.0001949398446158589,1.5,TPESampler,COMPLETE
729,0.9228200924628411,2025-04-24 21:07:53.182741,2025-04-24 21:07:55.061642,0 days 00:00:01.878901,5.555144405436153,Matern,225.6596009284498,0.009510702707405796,1.5,TPESampler,COMPLETE
730,0.9228200981641884,2025-04-24 21:07:54.119732,2025-04-24 21:07:55.773062,0 days 00:00:01.653330,0.17574719738276898,Matern,15.780590144977493,2.052632512056026e-06,1.5,TPESampler,COMPLETE
731,0.9228200923396451,2025-04-24 21:07:54.176462,2025-04-24 21:07:56.319260,0 days 00:00:02.142798,4828.405609856552,RBF,500.7931774226575,0.00540056274688987,2.5,TPESampler,COMPLETE
732,0.3301888657497247,2025-04-24 21:07:55.287395,2025-04-24 21:07:57.404672,0 days 00:00:02.117277,1.5159081513114732,Matern,57010.34735810782,0.3754480060320823,0.5,TPESampler,COMPLETE
733,0.9228200927765976,2025-04-24 21:07:55.975842,2025-04-24 21:07:57.559249,0 days 00:00:01.583407,2.4847469642739006,Matern,24.73428396331513,0.0027622795930533047,1.5,TPESampler,COMPLETE
734,0.9228200173837388,2025-04-24 21:07:56.551862,2025-04-24 21:07:58.027787,0 days 00:00:01.475925,1.2358218084979995,Matern,13.971290128510313,0.009074704010496688,1.5,TPESampler,COMPLETE
735,0.28679724280196583,2025-04-24 21:07:57.569732,2025-04-24 21:07:58.885114,0 days 00:00:01.315382,0.8685839046159961,Matern,1.3477823156386706,0.00034497456298484956,1.5,TPESampler,COMPLETE
736,0.9228200940058376,2025-04-24 21:07:57.760067,2025-04-24 21:07:59.447071,0 days 00:00:01.687004,4096.433206799996,Matern,3991.6682013728237,0.0021508415582513025,1.5,TPESampler,COMPLETE
737,0.28679725607362855,2025-04-24 21:07:58.228774,2025-04-24 21:07:59.566866,0 days 00:00:01.338092,4.777703185955212,Matern,8.969972608210604,0.029732093908857213,1.5,TPESampler,COMPLETE
738,0.28679726538829775,2025-04-24 21:07:59.105979,2025-04-24 21:08:01.012568,0 days 00:00:01.906589,46.415840178129045,Matern,4334.658346338614,0.27016851783564005,1.5,TPESampler,COMPLETE
739,0.2867972556036228,2025-04-24 21:07:59.667843,2025-04-24 21:08:01.391264,0 days 00:00:01.723421,49.68665078106307,Matern,8.723529253528,0.00011218342162514712,1.5,TPESampler,COMPLETE
740,0.9228200949192303,2025-04-24 21:07:59.816265,2025-04-24 21:08:02.639344,0 days 00:00:02.823079,0.0005382148851506949,Matern,0.06462480915795882,0.005456585663077641,1.5,TPESampler,COMPLETE
741,0.286797252121117,2025-04-24 21:08:01.233608,2025-04-24 21:08:04.184540,0 days 00:00:02.950932,0.006186824504452388,Matern,0.8433637617361871,0.0003036625446704483,1.5,TPESampler,COMPLETE
742,0.9228200923995593,2025-04-24 21:08:01.599458,2025-04-24 21:08:02.738061,0 days 00:00:01.138603,2.553877250263052,Matern,0.05670523806362444,0.0021167789146163667,1.5,TPESampler,COMPLETE
743,0.2867972521454922,2025-04-24 21:08:02.806578,2025-04-24 21:08:04.753834,0 days 00:00:01.947256,90.22411112709788,Matern,61.628260800633505,0.012410246378667512,1.5,TPESampler,COMPLETE
744,0.9228200897553509,2025-04-24 21:08:02.889443,2025-04-24 21:08:05.237230,0 days 00:00:02.347787,396.38599752098673,Matern,16038.901714308155,0.02180507303159806,1.5,TPESampler,COMPLETE
745,0.9228200924861228,2025-04-24 21:08:04.411297,2025-04-24 21:08:06.977896,0 days 00:00:02.566599,96.34225006627322,Matern,11019.916510213445,6.122819033941718e-05,2.5,TPESampler,COMPLETE
746,0.2867973186536833,2025-04-24 21:08:04.994121,2025-04-24 21:08:07.162481,0 days 00:00:02.168360,244.73149718514773,Matern,87.71142907908627,0.0011979721577007904,1.5,TPESampler,COMPLETE
747,0.28679724385203825,2025-04-24 21:08:05.471369,2025-04-24 21:08:06.979269,0 days 00:00:01.507900,34.0045598487433,Matern,1.3569385862296406,0.009647936541117284,1.5,TPESampler,COMPLETE
748,0.9494322764046945,2025-04-24 21:08:07.128315,2025-04-24 21:08:08.592701,0 days 00:00:01.464386,7.1299581545102875,Matern,4.874208341387105,1.575480334279095e-05,1.5,TPESampler,COMPLETE
749,0.9228201031933397,2025-04-24 21:08:07.182887,2025-04-24 21:08:08.771933,0 days 00:00:01.589046,0.12864798865626498,Matern,0.018630680727347214,0.0007246485036976812,0.5,TPESampler,COMPLETE
750,0.2887076509407218,2025-04-24 21:08:07.365322,2025-04-24 21:08:09.790892,0 days 00:00:02.425570,67.3316985602967,Matern,284.6295618309755,0.7466258122514764,2.5,TPESampler,COMPLETE
751,0.2867972624688623,2025-04-24 21:08:08.811666,2025-04-24 21:08:10.837521,0 days 00:00:02.025855,96.24682212200979,Matern,8380.919509588763,0.6974353655864373,1.5,TPESampler,COMPLETE
752,0.2867972593441767,2025-04-24 21:08:08.995117,2025-04-24 21:08:10.678260,0 days 00:00:01.683143,43.95468460023775,Matern,367.27436089953954,0.18872253858709073,1.5,TPESampler,COMPLETE
753,0.28679715490578117,2025-04-24 21:08:10.034633,2025-04-24 21:08:11.834793,0 days 00:00:01.800160,2.1193857036573807,Matern,5.183253443875582,0.0006984292007411538,1.5,TPESampler,COMPLETE
754,0.9228200909685184,2025-04-24 21:08:10.894821,2025-04-24 21:08:12.449543,0 days 00:00:01.554722,970.1605974244518,Matern,279.00540401432437,0.0011672399055550826,1.5,TPESampler,COMPLETE
755,0.28679713942645396,2025-04-24 21:08:11.039114,2025-04-24 21:08:13.368025,0 days 00:00:02.328911,61407.32261734215,Matern,106.34116098720376,0.0001336118880904041,1.5,TPESampler,COMPLETE
756,0.2867972031452133,2025-04-24 21:08:12.055113,2025-04-24 21:08:13.501274,0 days 00:00:01.446161,2.4978738189595373,Matern,6.496338326113582,0.005069308608750121,1.5,TPESampler,COMPLETE
757,0.9228200923058352,2025-04-24 21:08:12.676865,2025-04-24 21:08:14.288826,0 days 00:00:01.611961,0.38509887035545076,Matern,22.155381707177618,0.0021340252003795726,1.5,TPESampler,COMPLETE
758,0.28679724737152584,2025-04-24 21:08:13.548043,2025-04-24 21:08:15.072028,0 days 00:00:01.523985,0.4226632045194287,Matern,0.24945521333777523,0.0021317711117360173,1.5,TPESampler,COMPLETE
759,0.9228200913784803,2025-04-24 21:08:13.697762,2025-04-24 21:08:16.042271,0 days 00:00:02.344509,67727.8028735415,Matern,463.4262451188366,2.5497682343416002e-06,1.5,TPESampler,COMPLETE
760,0.9228200955965721,2025-04-24 21:08:14.503044,2025-04-24 21:08:15.941898,0 days 00:00:01.438854,0.03568499069320053,Matern,3.9577446151530657,0.0004108717968352852,1.5,TPESampler,COMPLETE
761,0.2867972437878578,2025-04-24 21:08:15.282477,2025-04-24 21:08:16.832890,0 days 00:00:01.550413,3.360636658012925,Matern,0.6370216641131314,0.008574403977907681,1.5,TPESampler,COMPLETE
762,0.9228200910677034,2025-04-24 21:08:16.137267,2025-04-24 21:08:17.806134,0 days 00:00:01.668867,0.1775268254852164,Matern,11.122631146622211,0.0024030265113818114,1.5,TPESampler,COMPLETE
763,0.286797251760602,2025-04-24 21:08:16.296598,2025-04-24 21:08:18.324903,0 days 00:00:02.028305,29.828032004818265,Matern,0.30714385573769104,0.0002933632342099629,1.5,TPESampler,COMPLETE
764,0.2867972529444588,2025-04-24 21:08:17.121094,2025-04-24 21:08:18.587841,0 days 00:00:01.466747,0.14042698544417498,Matern,1.287829115357447,0.00020805922900986006,1.5,TPESampler,COMPLETE
765,0.9494322793428275,2025-04-24 21:08:18.009457,2025-04-24 21:08:19.245684,0 days 00:00:01.236227,58051.14785381677,Matern,1.9661479363796017,0.0002878250631926124,2.5,TPESampler,COMPLETE
766,0.9228200924662732,2025-04-24 21:08:18.523114,2025-04-24 21:08:20.089213,0 days 00:00:01.566099,60738.99083017307,Matern,780.6707226689912,0.0004181632254465638,1.5,TPESampler,COMPLETE
767,0.2867972539067497,2025-04-24 21:08:18.827156,2025-04-24 21:08:21.183851,0 days 00:00:02.356695,10999.138623986753,Matern,264.6391414285232,0.0003585167304418925,1.5,TPESampler,COMPLETE
768,0.922820092452114,2025-04-24 21:08:19.452374,2025-04-24 21:08:20.558993,0 days 00:00:01.106619,1.2131641459193,RBF,0.017033967934298375,0.013791085650605476,1.5,TPESampler,COMPLETE
769,0.28679724244587484,2025-04-24 21:08:20.325133,2025-04-24 21:08:22.287572,0 days 00:00:01.962439,14.870764539191624,Matern,1.9228451682852177,0.0007316714682222802,1.5,TPESampler,COMPLETE
770,0.9494322788813028,2025-04-24 21:08:20.815582,2025-04-24 21:08:22.014375,0 days 00:00:01.198793,15821.144886842761,Matern,3.4209444050852347,5.7381151681833455e-06,1.5,TPESampler,COMPLETE
771,0.3216192388587556,2025-04-24 21:08:21.395476,2025-04-24 21:08:23.508687,0 days 00:00:02.113211,1.290640349034474,Matern,12.749545168137184,0.0012673199687580326,1.5,TPESampler,COMPLETE
772,0.28679724532463563,2025-04-24 21:08:22.240186,2025-04-24 21:08:24.198878,0 days 00:00:01.958692,22715.326183245892,Matern,17.8977710247445,0.000637661331136874,1.5,TPESampler,COMPLETE
773,0.9228200930096849,2025-04-24 21:08:22.547818,2025-04-24 21:08:24.298884,0 days 00:00:01.751066,4.217120452977327,RBF,12.530922172663004,0.006491163447709605,1.5,TPESampler,COMPLETE
774,0.922820095425964,2025-04-24 21:08:23.735599,2025-04-24 21:08:25.882913,0 days 00:00:02.147314,0.06245632697513914,Matern,381.5130862135121,0.005494906913104394,1.5,TPESampler,COMPLETE
775,0.28679728622031775,2025-04-24 21:08:24.402453,2025-04-24 21:08:25.953004,0 days 00:00:01.550551,1.4963090670196135,Matern,0.46117384500930253,0.003069950442982719,1.5,TPESampler,COMPLETE
776,0.3026845860834659,2025-04-24 21:08:24.548483,2025-04-24 21:08:27.806745,0 days 00:00:03.258262,0.0069840575601061135,RBF,0.48094552605517815,1.1487692764369612e-10,2.5,TPESampler,COMPLETE
777,0.9228200910777501,2025-04-24 21:08:26.058172,2025-04-24 21:08:28.198299,0 days 00:00:02.140127,0.3134428220481385,Matern,2.623712435223745,1.7687011688027955e-05,1.5,TPESampler,COMPLETE
778,0.9228201006888608,2025-04-24 21:08:26.147639,2025-04-24 21:08:27.686106,0 days 00:00:01.538467,0.46136547556859786,Matern,9.230339566813942,0.005856444122686045,1.5,TPESampler,COMPLETE
779,0.9228200468139947,2025-04-24 21:08:27.885116,2025-04-24 21:08:29.273409,0 days 00:00:01.388293,38.17738777919223,Matern,0.08862712619480173,0.005661365908092875,1.5,TPESampler,COMPLETE
780,0.9494317804799948,2025-04-24 21:08:28.033107,2025-04-24 21:08:29.538006,0 days 00:00:01.504899,81.61502560550632,RBF,0.04404403185432719,0.00015358490026354593,2.5,TPESampler,COMPLETE
781,0.9228200918006532,2025-04-24 21:08:28.450403,2025-04-24 21:08:29.815708,0 days 00:00:01.365305,23050.096888838118,Matern,695.1434187955022,5.448066935294869e-05,1.5,TPESampler,COMPLETE
782,0.28679725195588823,2025-04-24 21:08:29.484898,2025-04-24 21:08:30.749983,0 days 00:00:01.265085,7.945682139269678,Matern,4.963287553622817,0.004355420487537192,1.5,TPESampler,COMPLETE
783,0.3301888595948067,2025-04-24 21:08:29.795134,2025-04-24 21:08:31.736227,0 days 00:00:01.941093,42.89246362857504,Matern,28.370108055087968,0.010033779127666235,0.5,TPESampler,COMPLETE
784,0.286797252987177,2025-04-24 21:08:30.085429,2025-04-24 21:08:31.714428,0 days 00:00:01.628999,6.619588731510232,Matern,4.997296061708879,0.0003719799932931666,1.5,TPESampler,COMPLETE
785,0.33018880395121253,2025-04-24 21:08:30.967620,2025-04-24 21:08:32.532741,0 days 00:00:01.565121,20.098956690000755,Matern,0.6791524229876609,0.001815657516830563,0.5,TPESampler,COMPLETE
786,0.9494322793417138,2025-04-24 21:08:31.912064,2025-04-24 21:08:33.247788,0 days 00:00:01.335724,39980.77873645738,Matern,1.7789658088540217,0.0005305139510059656,1.5,TPESampler,COMPLETE
787,0.9228200861718019,2025-04-24 21:08:31.957551,2025-04-24 21:08:33.734645,0 days 00:00:01.777094,24.596501369201842,Matern,0.00521483588881577,0.012739511101119665,1.5,TPESampler,COMPLETE
788,0.2867972498312433,2025-04-24 21:08:32.781011,2025-04-24 21:08:34.223089,0 days 00:00:01.442078,38.860557184514825,Matern,1.831541956913497,0.04391179587760415,1.5,TPESampler,COMPLETE
789,0.922820091845481,2025-04-24 21:08:33.478116,2025-04-24 21:08:35.716763,0 days 00:00:02.238647,0.003086946014265834,Matern,2.2761885714772734,0.00028587527964272835,0.5,TPESampler,COMPLETE
790,0.30268452816358327,2025-04-24 21:08:33.977995,2025-04-24 21:08:35.650277,0 days 00:00:01.672282,0.8701431231725592,RBF,0.4896366275406963,0.00045180852241937425,1.5,TPESampler,COMPLETE
791,0.4804546850410245,2025-04-24 21:08:34.462391,2025-04-24 21:08:37.444459,0 days 00:00:02.982068,1.5394907975372302e-06,Matern,474.3191097803036,0.0016821367657391406,2.5,TPESampler,COMPLETE
792,0.9228200923533189,2025-04-24 21:08:35.803808,2025-04-24 21:08:37.191783,0 days 00:00:01.387975,46.17404359237741,Matern,0.0001951097265518372,0.3497697583354033,1.5,TPESampler,COMPLETE
793,0.9228200923145861,2025-04-24 21:08:35.882794,2025-04-24 21:08:39.268334,0 days 00:00:03.385540,0.00039417974404080605,RBF,9387.46200795349,4.426938221681655e-06,1.5,TPESampler,COMPLETE
794,0.9494322726985701,2025-04-24 21:08:37.402501,2025-04-24 21:08:38.801398,0 days 00:00:01.398897,26.527893613108574,Matern,1.1723774743453719,7.175241993212333e-06,1.5,TPESampler,COMPLETE
795,0.9228200888524735,2025-04-24 21:08:37.681970,2025-04-24 21:08:41.162946,0 days 00:00:03.480976,4.2092938828476247e-07,Matern,74472.65296177992,7.660577670565677e-09,0.5,TPESampler,COMPLETE
796,0.9228200924757968,2025-04-24 21:08:39.021852,2025-04-24 21:08:41.518113,0 days 00:00:02.496261,0.3605115802824358,Matern,43.215389354521186,0.007596376566960569,1.5,TPESampler,COMPLETE
797,0.9228200947517581,2025-04-24 21:08:39.533615,2025-04-24 21:08:41.984270,0 days 00:00:02.450655,0.9253546722273093,Matern,328.1195558300705,0.0003952809943664216,1.5,TPESampler,COMPLETE
798,0.9228200926794228,2025-04-24 21:08:41.376107,2025-04-24 21:08:43.452041,0 days 00:00:02.075934,1.940087757053144,Matern,7.6817288715579535,1.931516491681208e-05,2.5,TPESampler,COMPLETE
799,0.922820092522971,2025-04-24 21:08:41.710971,2025-04-24 21:08:43.386945,0 days 00:00:01.675974,7.13842830221544,Matern,31.19577536643791,0.00411465555599938,2.5,TPESampler,COMPLETE
800,0.9228200925320269,2025-04-24 21:08:42.203654,2025-04-24 21:08:44.832275,0 days 00:00:02.628621,0.016620668268816835,Matern,131.46564705143214,0.002282659067162333,2.5,TPESampler,COMPLETE
801,0.3026846381511675,2025-04-24 21:08:43.539037,2025-04-24 21:08:45.794155,0 days 00:00:02.255118,86805.35473268531,RBF,4.390898653600054,0.0033291646955197676,1.5,TPESampler,COMPLETE
802,0.2867972635421511,2025-04-24 21:08:43.616968,2025-04-24 21:08:45.312375,0 days 00:00:01.695407,6.0822041031060845,Matern,9.520132061411367,0.033938074408420435,1.5,TPESampler,COMPLETE
