number,value,datetime_start,datetime_complete,duration,params_constant_value,params_kernel_type,params_length_scale,params_noise_level,params_nu,system_attrs_auto:sampler,state
458,0.2867972415188936,2025-04-24 21:04:41.425392,2025-04-24 21:04:43.585065,0 days 00:00:02.159673,27975.237897170988,Matern,2816.763343116541,0.35558486722154886,1.5,TPESampler,COMPLETE
459,0.9228200925291716,2025-04-24 21:04:41.722708,2025-04-24 21:04:43.319188,0 days 00:00:01.596480,0.0008273963375440071,Matern,2.596092709356521,1.5122713500883232e-05,1.5,TPESampler,COMPLETE
460,0.30268458477303817,2025-04-24 21:04:43.533515,2025-04-24 21:04:45.651519,0 days 00:00:02.118004,304.7782354690053,RBF,816.0600682510648,0.7035259988018767,0.5,TPESampler,COMPLETE
461,0.9228200951565873,2025-04-24 21:04:43.855536,2025-04-24 21:04:45.110568,0 days 00:00:01.255032,0.15804845028954884,Matern,7.9719667042393265,0.003580339465751749,1.5,TPESampler,COMPLETE
462,0.28679725681758184,2025-04-24 21:04:44.871491,2025-04-24 21:04:46.639174,0 days 00:00:01.767683,94.36798313399646,Matern,110.34015790179168,0.4773712393990164,1.5,TPESampler,COMPLETE
463,0.9228200862341829,2025-04-24 21:04:45.392756,2025-04-24 21:04:47.526567,0 days 00:00:02.133811,103.75290604422017,Matern,53094.15502729816,0.0006742087357268706,1.5,TPESampler,COMPLETE
464,0.9494317804799749,2025-04-24 21:04:45.888332,2025-04-24 21:04:47.337716,0 days 00:00:01.449384,151.99739071603037,Matern,0.04272005148808335,0.0001481554675529751,1.5,TPESampler,COMPLETE
465,0.28679722911038,2025-04-24 21:04:46.897344,2025-04-24 21:04:48.955284,0 days 00:00:02.057940,4665.7245490811365,Matern,375.3608042842943,0.8850697275742123,1.5,TPESampler,COMPLETE
466,0.33018882030904095,2025-04-24 21:04:47.554029,2025-04-24 21:04:49.563790,0 days 00:00:02.009761,0.002440763223263841,Matern,0.5526302280631913,5.242803648521468e-07,0.5,TPESampler,COMPLETE
467,0.330188825925522,2025-04-24 21:04:47.743867,2025-04-24 21:04:50.343303,0 days 00:00:02.599436,14.18929227426628,Matern,0.10570707023520019,0.19731844648277314,0.5,TPESampler,COMPLETE
468,0.2867970854422063,2025-04-24 21:04:49.182291,2025-04-24 21:04:51.354056,0 days 00:00:02.171765,2438.491544525046,Matern,1282.9077756717786,0.10054765368356394,1.5,TPESampler,COMPLETE
469,0.9493487922041688,2025-04-24 21:04:49.783308,2025-04-24 21:04:50.749344,0 days 00:00:00.966036,0.0016428787748542968,Matern,0.004855576518000187,0.5594528899550042,1.5,TPESampler,COMPLETE
470,0.2867972278210896,2025-04-24 21:04:50.566499,2025-04-24 21:04:51.822887,0 days 00:00:01.256388,8.467443933936607,Matern,2.45327900049202,0.0019295357439541928,1.5,TPESampler,COMPLETE
471,0.2867972450407434,2025-04-24 21:04:50.944157,2025-04-24 21:04:52.944824,0 days 00:00:02.000667,54713.39912974016,Matern,235.56564324835512,0.7483921537148054,1.5,TPESampler,COMPLETE
472,0.2867972603642861,2025-04-24 21:04:51.576075,2025-04-24 21:04:53.037629,0 days 00:00:01.461554,2.7164645967498053,Matern,0.6327134312982226,0.002770655609223385,1.5,TPESampler,COMPLETE
473,0.28679726872859085,2025-04-24 21:04:52.065735,2025-04-24 21:04:54.485326,0 days 00:00:02.419591,21.984821286773478,Matern,50.026426649714196,0.004272145125264859,1.5,TPESampler,COMPLETE
474,0.28679726039028774,2025-04-24 21:04:53.098116,2025-04-24 21:04:54.534971,0 days 00:00:01.436855,0.3008493112665637,Matern,71.17691600330352,0.9882116899292088,1.5,TPESampler,COMPLETE
475,0.2867972460012629,2025-04-24 21:04:53.260187,2025-04-24 21:04:54.940711,0 days 00:00:01.680524,47.185775296472144,Matern,0.5468264234006033,0.00015286383290236805,1.5,TPESampler,COMPLETE
476,0.2867973422721537,2025-04-24 21:04:54.636546,2025-04-24 21:04:56.112305,0 days 00:00:01.475759,12.112201176725137,Matern,0.615925371370244,0.0005604411210996781,1.5,TPESampler,COMPLETE
477,0.9228200931072978,2025-04-24 21:04:54.715011,2025-04-24 21:04:56.081609,0 days 00:00:01.366598,4.3658146162437275,Matern,0.05298459042973791,0.004302874280623391,1.5,TPESampler,COMPLETE
478,0.9494322792743358,2025-04-24 21:04:55.241471,2025-04-24 21:04:56.833934,0 days 00:00:01.592463,20836.63875999533,Matern,50.1437318558474,1.6203450976909588e-05,1.5,TPESampler,COMPLETE
479,0.3026846082907623,2025-04-24 21:04:56.245943,2025-04-24 21:04:58.787213,0 days 00:00:02.541270,44065.3297569296,RBF,688.4842096776885,0.4036209611013411,1.5,TPESampler,COMPLETE
480,0.2867972569300915,2025-04-24 21:04:56.291250,2025-04-24 21:04:57.952102,0 days 00:00:01.660852,0.19692299142973996,Matern,2.111153435428359,0.021092744926554916,1.5,TPESampler,COMPLETE
481,0.28679724895336933,2025-04-24 21:04:57.300652,2025-04-24 21:04:58.704873,0 days 00:00:01.404221,6.220287726295021,Matern,17.6278651010388,0.029489059951416704,1.5,TPESampler,COMPLETE
482,0.2867972512008259,2025-04-24 21:04:58.165709,2025-04-24 21:05:01.246839,0 days 00:00:03.081130,18.085271005340118,Matern,0.3680815550563097,0.02442427975403453,1.5,TPESampler,COMPLETE
483,0.28679725422121227,2025-04-24 21:04:58.908557,2025-04-24 21:05:00.556872,0 days 00:00:01.648315,0.6320541090755418,Matern,0.3361528397091508,0.8170187727918778,1.5,TPESampler,COMPLETE
484,0.2867972489584708,2025-04-24 21:04:58.955060,2025-04-24 21:05:01.656370,0 days 00:00:02.701310,0.007454784170978649,Matern,1.161856741467811,0.006762021074339182,1.5,TPESampler,COMPLETE
485,0.2867972525231578,2025-04-24 21:05:00.788614,2025-04-24 21:05:02.549652,0 days 00:00:01.761038,2.263697590114958,Matern,97.33553409101445,0.9273238452108435,1.5,TPESampler,COMPLETE
486,0.922820102965319,2025-04-24 21:05:01.483344,2025-04-24 21:05:02.850910,0 days 00:00:01.367566,7.8952780349077,Matern,55.933762752489926,0.0015300753397702546,1.5,TPESampler,COMPLETE
487,0.9228200924403517,2025-04-24 21:05:01.851823,2025-04-24 21:05:04.461095,0 days 00:00:02.609272,0.12211395044267138,Matern,17.841637667883983,1.3118885648423514e-09,0.5,TPESampler,COMPLETE
488,0.28679725138209144,2025-04-24 21:05:02.772489,2025-04-24 21:05:04.425462,0 days 00:00:01.652973,0.009323148158538276,Matern,0.7899145451794456,0.7820247679000127,1.5,TPESampler,COMPLETE
489,0.28679723499947674,2025-04-24 21:05:03.102723,2025-04-24 21:05:05.694555,0 days 00:00:02.591832,72.33444773101739,Matern,0.4036403378607543,0.027889706103765923,1.5,TPESampler,COMPLETE
490,0.9228200924465007,2025-04-24 21:05:04.582029,2025-04-24 21:05:06.517172,0 days 00:00:01.935143,0.2625329684013146,RBF,17.49071434753869,0.00016042279691435616,1.5,TPESampler,COMPLETE
491,0.9228200914425152,2025-04-24 21:05:04.631089,2025-04-24 21:05:06.292850,0 days 00:00:01.661761,0.7899460351737576,Matern,5.261238249860273,0.000141869195919603,1.5,TPESampler,COMPLETE
492,0.2867971928463871,2025-04-24 21:05:05.929499,2025-04-24 21:05:07.755719,0 days 00:00:01.826220,57.08343943998371,Matern,662.2767753434584,0.06336490822283596,1.5,TPESampler,COMPLETE
493,0.9228200895721342,2025-04-24 21:05:06.552595,2025-04-24 21:05:07.804443,0 days 00:00:01.251848,3197.3123475893453,RBF,1.0643270464235075e-05,0.20988351774147315,2.5,TPESampler,COMPLETE
494,0.9494317804801996,2025-04-24 21:05:06.768826,2025-04-24 21:05:08.150061,0 days 00:00:01.381235,1.937208600968454,Matern,0.0037672693458982967,6.5437652161564215e-06,1.5,TPESampler,COMPLETE
495,0.9228200924171469,2025-04-24 21:05:07.906316,2025-04-24 21:05:09.891885,0 days 00:00:01.985569,0.1296908420109556,Matern,30.788940029895205,0.005138739873356185,0.5,TPESampler,COMPLETE
496,0.9494317804800284,2025-04-24 21:05:07.991941,2025-04-24 21:05:09.768598,0 days 00:00:01.776657,104.93032781103761,Matern,0.01217309719350355,0.00010067500085537269,0.5,TPESampler,COMPLETE
497,0.9228200936101987,2025-04-24 21:05:08.401413,2025-04-24 21:05:10.653016,0 days 00:00:02.251603,17.947770083172955,Matern,846.9147404399981,0.006093703449207517,1.5,TPESampler,COMPLETE
498,0.9228200919922024,2025-04-24 21:05:09.955304,2025-04-24 21:05:11.660298,0 days 00:00:01.704994,65.49654715389954,Matern,311.1333874932859,0.005638576142773946,1.5,TPESampler,COMPLETE
499,0.2867972551212286,2025-04-24 21:05:10.107345,2025-04-24 21:05:12.025265,0 days 00:00:01.917920,4.708952417277299,Matern,1171.3597586816977,0.6996792307016723,1.5,TPESampler,COMPLETE
500,0.9494322793413766,2025-04-24 21:05:10.897216,2025-04-24 21:05:11.845467,0 days 00:00:00.948251,9.60077717344677e-07,RBF,54206.63918725691,0.11490532713754167,1.5,TPESampler,COMPLETE
501,0.2867972443487976,2025-04-24 21:05:11.849328,2025-04-24 21:05:13.439508,0 days 00:00:01.590180,300.5567134125748,Matern,152.99574573290394,0.7601375135632269,1.5,TPESampler,COMPLETE
502,0.2867972509301242,2025-04-24 21:05:12.035640,2025-04-24 21:05:13.723001,0 days 00:00:01.687361,115.37165606193375,Matern,65.05656395432779,0.021353628705351433,1.5,TPESampler,COMPLETE
503,0.28679718035993623,2025-04-24 21:05:12.385551,2025-04-24 21:05:14.283763,0 days 00:00:01.898212,54.99639722024773,Matern,874.3697944921313,0.20009670398980578,1.5,TPESampler,COMPLETE
504,0.28679729093962186,2025-04-24 21:05:13.716420,2025-04-24 21:05:15.560739,0 days 00:00:01.844319,3008.548958624751,Matern,173.70367086409215,0.003546293635690721,1.5,TPESampler,COMPLETE
505,0.28679722912404876,2025-04-24 21:05:13.924428,2025-04-24 21:05:15.968325,0 days 00:00:02.043897,68.3014013516309,Matern,15292.442364729708,0.1719537939422024,1.5,TPESampler,COMPLETE
506,0.9228201004631038,2025-04-24 21:05:14.494491,2025-04-24 21:05:16.823793,0 days 00:00:02.329302,71.90728634907013,Matern,2820.205051622935,0.024080515701098103,1.5,TPESampler,COMPLETE
507,0.286797256957775,2025-04-24 21:05:15.801977,2025-04-24 21:05:17.665542,0 days 00:00:01.863565,50.31784670549063,Matern,825.6957280934295,0.44626341753124077,1.5,TPESampler,COMPLETE
508,0.286797317681687,2025-04-24 21:05:16.148074,2025-04-24 21:05:17.990691,0 days 00:00:01.842617,1322.3983778086579,Matern,16.04494272219741,0.49824027030707607,1.5,TPESampler,COMPLETE
509,0.9228200924939179,2025-04-24 21:05:17.040763,2025-04-24 21:05:19.409386,0 days 00:00:02.368623,2.797810110812462,Matern,4823.937243138091,0.007617849876553817,1.5,TPESampler,COMPLETE
510,0.2867972517970782,2025-04-24 21:05:17.908426,2025-04-24 21:05:19.693228,0 days 00:00:01.784802,110.34238777733357,Matern,21372.785752007818,0.09077037230405945,1.5,TPESampler,COMPLETE
511,0.2867973101090413,2025-04-24 21:05:18.239103,2025-04-24 21:05:20.050226,0 days 00:00:01.811123,71.7339329921671,Matern,531.7479465984737,0.34977312337811206,1.5,TPESampler,COMPLETE
512,0.2867972667250648,2025-04-24 21:05:19.651239,2025-04-24 21:05:21.354408,0 days 00:00:01.703169,3.6073589263169774,Matern,1147.2256166416223,0.7162137578358712,1.5,TPESampler,COMPLETE
513,0.286797234184588,2025-04-24 21:05:19.945717,2025-04-24 21:05:21.246994,0 days 00:00:01.301277,118.00328840410782,Matern,2.668288570368825,0.6028753816168033,1.5,TPESampler,COMPLETE
514,0.9228200969099026,2025-04-24 21:05:20.324229,2025-04-24 21:05:22.135026,0 days 00:00:01.810797,4.441924559655566,Matern,163.92107833536565,0.02189543684423219,1.5,TPESampler,COMPLETE
515,0.9493874926691009,2025-04-24 21:05:21.422941,2025-04-24 21:05:22.468786,0 days 00:00:01.045845,619.7989108909514,Matern,0.373389533995402,2.004177729677129e-08,0.5,TPESampler,COMPLETE
516,0.922820093093291,2025-04-24 21:05:21.565282,2025-04-24 21:05:23.079563,0 days 00:00:01.514281,1.093639137694503,RBF,6.704425400635819,1.1433615608206498e-08,2.5,TPESampler,COMPLETE
517,0.2887076462336115,2025-04-24 21:05:22.373342,2025-04-24 21:05:24.357454,0 days 00:00:01.984112,66566.8396567137,Matern,1779.7011259522974,0.0211380916881381,2.5,TPESampler,COMPLETE
518,0.2867972599174841,2025-04-24 21:05:22.688494,2025-04-24 21:05:24.820640,0 days 00:00:02.132146,897.9413471009376,Matern,892.3788190388487,0.27740732526036294,1.5,TPESampler,COMPLETE
519,0.28679724897557607,2025-04-24 21:05:23.316402,2025-04-24 21:05:24.825603,0 days 00:00:01.509201,47.330632194650406,Matern,0.34526019319451,0.4939025713908642,1.5,TPESampler,COMPLETE
520,0.28679724637958975,2025-04-24 21:05:24.583006,2025-04-24 21:05:25.981725,0 days 00:00:01.398719,0.9201710998288389,Matern,2.5014617530007106,0.7864785502422389,1.5,TPESampler,COMPLETE
521,0.28679723973096866,2025-04-24 21:05:25.056065,2025-04-24 21:05:27.409500,0 days 00:00:02.353435,177.69570860730983,Matern,6701.343936444181,0.8996861723498094,1.5,TPESampler,COMPLETE
522,0.2867972538677734,2025-04-24 21:05:25.096275,2025-04-24 21:05:27.291812,0 days 00:00:02.195537,20296.507476164454,Matern,23.178400832916903,0.004978861591586107,1.5,TPESampler,COMPLETE
523,0.28679731264524977,2025-04-24 21:05:26.194957,2025-04-24 21:05:27.786689,0 days 00:00:01.591732,123.09798093158803,Matern,107.21916754155886,0.05888593280094689,1.5,TPESampler,COMPLETE
524,0.9494322790730596,2025-04-24 21:05:27.476598,2025-04-24 21:05:29.295328,0 days 00:00:01.818730,0.06464899947837006,Matern,12878.550676825045,0.018606116608153637,1.5,TPESampler,COMPLETE
525,0.9228200943279803,2025-04-24 21:05:27.637284,2025-04-24 21:05:30.182179,0 days 00:00:02.544895,68.67829298777724,RBF,273.2215506173656,5.942668079600396e-08,1.5,TPESampler,COMPLETE
526,0.286797253026759,2025-04-24 21:05:28.125019,2025-04-24 21:05:29.424673,0 days 00:00:01.299654,78802.69035985981,Matern,0.4334066298964251,0.28551287652749485,1.5,TPESampler,COMPLETE
527,0.28679725138032025,2025-04-24 21:05:29.503530,2025-04-24 21:05:31.586832,0 days 00:00:02.083302,309.990400274304,Matern,526.3916092099452,0.780053885186527,1.5,TPESampler,COMPLETE
528,0.9228200924734513,2025-04-24 21:05:29.692221,2025-04-24 21:05:31.519462,0 days 00:00:01.827241,3663.0263261767964,Matern,1728.0053385046338,0.004373343314914013,1.5,TPESampler,COMPLETE
529,0.28679731030046207,2025-04-24 21:05:30.410043,2025-04-24 21:05:32.213969,0 days 00:00:01.803926,3.9576572076473684,Matern,98.65694820918485,0.6477715150393131,1.5,TPESampler,COMPLETE
530,0.9228200927063387,2025-04-24 21:05:31.696567,2025-04-24 21:05:34.001628,0 days 00:00:02.305061,2.126910461383809,Matern,84.10669604204223,0.014491596188273358,1.5,TPESampler,COMPLETE
531,0.2867973306522337,2025-04-24 21:05:31.774469,2025-04-24 21:05:33.547450,0 days 00:00:01.772981,449.395761347489,Matern,12.975791280603866,0.32475875726832143,1.5,TPESampler,COMPLETE
532,0.922820091326073,2025-04-24 21:05:32.543656,2025-04-24 21:05:34.192125,0 days 00:00:01.648469,1.751040450670277e-05,RBF,2.699745281847784e-05,2.3708558844018843e-09,0.5,TPESampler,COMPLETE
533,0.28679744099564797,2025-04-24 21:05:33.770315,2025-04-24 21:05:35.969825,0 days 00:00:02.199510,2.879799464967767,Matern,0.19124305021713148,0.9925952515632661,1.5,TPESampler,COMPLETE
534,0.9228200645617931,2025-04-24 21:05:34.246988,2025-04-24 21:05:35.854872,0 days 00:00:01.607884,0.9077772542797935,RBF,358.3324386242034,9.093994538614277e-06,0.5,TPESampler,COMPLETE
535,0.286797238512738,2025-04-24 21:05:34.440464,2025-04-24 21:05:36.288514,0 days 00:00:01.848050,1306.2880622903333,Matern,2046.354016623274,0.04098590864423975,1.5,TPESampler,COMPLETE
536,0.9228200924270951,2025-04-24 21:05:36.049038,2025-04-24 21:05:37.454609,0 days 00:00:01.405571,0.00028402711926213517,Matern,0.0027673129063140187,1.569282950109299e-09,0.5,TPESampler,COMPLETE
537,0.9494322790564659,2025-04-24 21:05:36.186069,2025-04-24 21:05:37.481433,0 days 00:00:01.295364,358.49204362828226,Matern,5.439808273034571,3.970664159044349e-05,1.5,TPESampler,COMPLETE
538,0.2867972527943744,2025-04-24 21:05:36.514855,2025-04-24 21:05:37.914622,0 days 00:00:01.399767,1.606420356368634,Matern,2.0673637526515574,0.04863607455334899,1.5,TPESampler,COMPLETE
539,0.30268457082062317,2025-04-24 21:05:37.621726,2025-04-24 21:05:39.221179,0 days 00:00:01.599453,0.03011955962286559,RBF,2.418328974585268,0.12728561700856805,1.5,TPESampler,COMPLETE
540,0.9228200928920429,2025-04-24 21:05:37.670137,2025-04-24 21:05:39.524102,0 days 00:00:01.853965,0.005001853324227067,Matern,0.007203870354053109,0.0011914868464945022,1.5,TPESampler,COMPLETE
541,0.2867972664927124,2025-04-24 21:05:38.168959,2025-04-24 21:05:40.278255,0 days 00:00:02.109296,1738.2401355722466,Matern,9.909224228325105,0.013872258979415436,1.5,TPESampler,COMPLETE
542,0.9494321176040166,2025-04-24 21:05:39.473584,2025-04-24 21:05:41.122816,0 days 00:00:01.649232,0.0002997250662096245,RBF,256.46238499055266,0.22357142161582966,2.5,TPESampler,COMPLETE
543,0.2867972520797177,2025-04-24 21:05:39.753003,2025-04-24 21:05:41.504787,0 days 00:00:01.751784,226.69179348929183,Matern,511.15880196623266,0.024144711652890723,1.5,TPESampler,COMPLETE
544,0.2867972515065955,2025-04-24 21:05:40.532306,2025-04-24 21:05:42.050490,0 days 00:00:01.518184,282.1683357585836,Matern,4.270570132764971,0.7735829685790403,1.5,TPESampler,COMPLETE
545,0.9228200960266887,2025-04-24 21:05:41.513116,2025-04-24 21:05:43.209144,0 days 00:00:01.696028,259.96515326185875,Matern,0.00795631538957398,0.7109745959743402,1.5,TPESampler,COMPLETE
546,0.3026846260958454,2025-04-24 21:05:41.701916,2025-04-24 21:05:44.086997,0 days 00:00:02.385081,10.26086788250012,RBF,245.86784571785793,0.6276952619452838,1.5,TPESampler,COMPLETE
547,0.2867972510702679,2025-04-24 21:05:42.304550,2025-04-24 21:05:44.534816,0 days 00:00:02.230266,2.5087682284528605,Matern,62.2901196600745,0.053711906740964294,1.5,TPESampler,COMPLETE
548,0.3301887572401186,2025-04-24 21:05:43.434305,2025-04-24 21:05:44.841190,0 days 00:00:01.406885,0.08624991292851278,Matern,17.812943108985433,0.841094316175262,0.5,TPESampler,COMPLETE
549,0.2867972557363527,2025-04-24 21:05:44.358009,2025-04-24 21:05:46.434158,0 days 00:00:02.076149,4016.7491913501835,Matern,46.191838350301325,0.7989441252937205,1.5,TPESampler,COMPLETE
550,0.3301888194955293,2025-04-24 21:05:44.790305,2025-04-24 21:05:46.508975,0 days 00:00:01.718670,47882.68871807394,Matern,4345.9711997785835,0.0002044858378614049,0.5,TPESampler,COMPLETE
551,0.28679725757629465,2025-04-24 21:05:45.083421,2025-04-24 21:05:46.858229,0 days 00:00:01.774808,22176.940409299947,Matern,40.95606941582015,0.007899898050198794,1.5,TPESampler,COMPLETE
552,0.9228200928113928,2025-04-24 21:05:46.594023,2025-04-24 21:05:48.284805,0 days 00:00:01.690782,180.53999343148755,Matern,0.03072876470712101,0.004292533062331191,1.5,TPESampler,COMPLETE
553,0.9228200927078393,2025-04-24 21:05:46.680299,2025-04-24 21:05:48.382168,0 days 00:00:01.701869,328.52621472240304,Matern,0.03992923729418945,0.0038956758708808335,1.5,TPESampler,COMPLETE
554,0.9228200926609855,2025-04-24 21:05:47.086710,2025-04-24 21:05:49.780479,0 days 00:00:02.693769,0.023366668142343804,RBF,34753.0566877224,1.1486582760706055e-08,2.5,TPESampler,COMPLETE
555,0.2887076453553454,2025-04-24 21:05:48.488500,2025-04-24 21:05:50.436520,0 days 00:00:01.948020,64.88936302052134,Matern,132.70932388009555,0.03667917524907603,2.5,TPESampler,COMPLETE
556,0.28679725532630834,2025-04-24 21:05:48.568120,2025-04-24 21:05:50.757517,0 days 00:00:02.189397,843.0128592548847,Matern,8921.411195231398,0.67544332769425,1.5,TPESampler,COMPLETE
557,0.9494322793428275,2025-04-24 21:05:49.993023,2025-04-24 21:05:51.131868,0 days 00:00:01.138845,62868.559752831876,Matern,10.073707540701,0.02468984834721166,2.5,TPESampler,COMPLETE
558,0.2867972862832085,2025-04-24 21:05:50.698540,2025-04-24 21:05:52.352101,0 days 00:00:01.653561,1.0761439634673078,Matern,21.082716489653507,0.5665910592308168,1.5,TPESampler,COMPLETE
559,0.9494322793380203,2025-04-24 21:05:51.038317,2025-04-24 21:05:52.650272,0 days 00:00:01.611955,0.7669068808716296,Matern,63835.34244130066,0.3887058915159771,1.5,TPESampler,COMPLETE
560,0.9228189261562822,2025-04-24 21:05:51.386374,2025-04-24 21:05:53.144648,0 days 00:00:01.758274,0.022514792245328544,Matern,5.104604225258351,0.03219785042437125,1.5,TPESampler,COMPLETE
561,0.9228200925313106,2025-04-24 21:05:52.601119,2025-04-24 21:05:54.976503,0 days 00:00:02.375384,2.2711554209268656,Matern,1671.1336569332962,2.0573385770902182e-05,1.5,TPESampler,COMPLETE
562,0.28679726845794656,2025-04-24 21:05:52.876599,2025-04-24 21:05:54.590736,0 days 00:00:01.714137,365.0939412442832,Matern,212.34670554437582,0.018127734979154535,1.5,TPESampler,COMPLETE
563,0.9228200911325736,2025-04-24 21:05:53.384655,2025-04-24 21:05:55.060653,0 days 00:00:01.675998,0.000124071685774708,Matern,2.206623763134951e-05,1.1269849771749839e-06,2.5,TPESampler,COMPLETE
564,0.922820092758414,2025-04-24 21:05:54.821386,2025-04-24 21:05:56.946515,0 days 00:00:02.125129,2377.0703894974276,RBF,65673.01635005504,5.481375109737634e-09,0.5,TPESampler,COMPLETE
565,0.9228200911054913,2025-04-24 21:05:55.168987,2025-04-24 21:05:57.076993,0 days 00:00:01.908006,2.623568399723939e-06,RBF,0.043394086384336956,7.5864078110940905e-06,2.5,TPESampler,COMPLETE
566,0.2867973026497729,2025-04-24 21:05:55.364656,2025-04-24 21:05:56.860625,0 days 00:00:01.495969,13.269754285581778,Matern,7.570188420438514,0.8549050990002494,1.5,TPESampler,COMPLETE
567,0.9494317804743848,2025-04-24 21:05:57.017018,2025-04-24 21:05:58.297655,0 days 00:00:01.280637,3.1274707405850046,Matern,0.06100654202044506,2.639389074486182e-05,1.5,TPESampler,COMPLETE
568,0.2867972558718928,2025-04-24 21:05:57.138439,2025-04-24 21:05:59.112132,0 days 00:00:01.973693,57.13642639272604,Matern,429.9973774647581,0.04210252635458446,1.5,TPESampler,COMPLETE
569,0.28679717360747153,2025-04-24 21:05:57.319620,2025-04-24 21:05:59.298005,0 days 00:00:01.978385,64104.69868859627,Matern,3.5532118288630947,0.1200750270848858,1.5,TPESampler,COMPLETE
570,0.28679725100998266,2025-04-24 21:05:58.529418,2025-04-24 21:05:59.978318,0 days 00:00:01.448900,6.09969005606011,Matern,0.5388349151487913,0.010625582339099254,1.5,TPESampler,COMPLETE
571,0.28679722659094725,2025-04-24 21:05:59.303909,2025-04-24 21:06:02.076836,0 days 00:00:02.772927,604.492625465369,Matern,0.38004751768374406,0.04331576726318282,1.5,TPESampler,COMPLETE
572,0.9494322793417138,2025-04-24 21:05:59.490454,2025-04-24 21:06:00.799439,0 days 00:00:01.308985,40077.53347630511,Matern,7.760827859728393,0.018643368036394572,1.5,TPESampler,COMPLETE
