number,value,datetime_start,datetime_complete,duration,params_criterion,params_max_depth,params_max_features,params_min_samples_leaf,params_min_samples_split,params_splitter,system_attrs_auto:sampler,state
1143,0.7975493713728398,2025-04-24 21:07:55.589695,2025-04-24 21:07:56.832241,0 days 00:00:01.242546,squared_error,30,log2,3,7,best,TPESampler,COMPLETE
1144,0.7975493713728398,2025-04-24 21:07:55.633862,2025-04-24 21:07:56.828151,0 days 00:00:01.194289,squared_error,30,log2,3,10,best,TPESampler,COMPLETE
1145,0.5128537554029937,2025-04-24 21:07:56.487150,2025-04-24 21:07:58.168114,0 days 00:00:01.680964,squared_error,35,log2,1,11,best,TPESampler,COMPLETE
1146,0.5556325618090721,2025-04-24 21:07:57.182300,2025-04-24 21:07:58.421211,0 days 00:00:01.238911,squared_error,34,sqrt,1,10,best,TPESampler,COMPLETE
1147,0.44670023329729247,2025-04-24 21:07:57.392898,2025-04-24 21:07:58.459271,0 days 00:00:01.066373,squared_error,35,log2,1,7,best,TPESampler,COMPLETE
1148,0.7975493713728398,2025-04-24 21:07:58.580488,2025-04-24 21:07:59.451604,0 days 00:00:00.871116,squared_error,35,log2,3,10,best,TPESampler,COMPLETE
1149,0.4948844885027081,2025-04-24 21:07:58.593754,2025-04-24 21:07:59.773485,0 days 00:00:01.179731,squared_error,35,log2,1,9,best,TPESampler,COMPLETE
1150,0.7975493713728398,2025-04-24 21:07:58.657233,2025-04-24 21:07:59.609760,0 days 00:00:00.952527,squared_error,35,log2,3,10,best,TPESampler,COMPLETE
1151,0.6756408221672622,2025-04-24 21:07:59.728066,2025-04-24 21:08:00.618929,0 days 00:00:00.890863,squared_error,30,log2,1,8,best,TPESampler,COMPLETE
1152,0.9490846887778294,2025-04-24 21:07:59.882889,2025-04-24 21:08:00.981446,0 days 00:00:01.098557,squared_error,2,log2,1,12,best,TPESampler,COMPLETE
1153,1.0007431665713944,2025-04-24 21:08:00.069995,2025-04-24 21:08:00.984455,0 days 00:00:00.914460,absolute_error,6,log2,5,16,best,TPESampler,COMPLETE
1154,0.6735913168527353,2025-04-24 21:08:00.923539,2025-04-24 21:08:01.594368,0 days 00:00:00.670829,squared_error,30,log2,1,10,best,TPESampler,COMPLETE
1155,0.5128537554029937,2025-04-24 21:08:01.265084,2025-04-24 21:08:02.272245,0 days 00:00:01.007161,squared_error,35,log2,1,11,best,TPESampler,COMPLETE
1156,0.677376436102564,2025-04-24 21:08:01.316095,2025-04-24 21:08:02.312719,0 days 00:00:00.996624,squared_error,31,log2,1,12,best,TPESampler,COMPLETE
1157,0.972901152467277,2025-04-24 21:08:02.044103,2025-04-24 21:08:02.794916,0 days 00:00:00.750813,absolute_error,7,sqrt,4,13,random,TPESampler,COMPLETE
1158,0.7975493713728398,2025-04-24 21:08:02.477535,2025-04-24 21:08:03.373598,0 days 00:00:00.896063,squared_error,29,log2,3,14,best,TPESampler,COMPLETE
1159,1.0007431665713944,2025-04-24 21:08:02.526465,2025-04-24 21:08:03.533843,0 days 00:00:01.007378,absolute_error,4,log2,7,15,random,TPESampler,COMPLETE
1160,0.922426147955362,2025-04-24 21:08:03.258948,2025-04-24 21:08:03.987528,0 days 00:00:00.728580,squared_error,35,log2,2,11,random,TPESampler,COMPLETE
1161,0.6692087088741673,2025-04-24 21:08:03.701867,2025-04-24 21:08:04.620625,0 days 00:00:00.918758,friedman_mse,30,log2,1,9,best,TPESampler,COMPLETE
1162,0.5120876615801571,2025-04-24 21:08:03.848465,2025-04-24 21:08:04.761051,0 days 00:00:00.912586,squared_error,35,log2,1,12,best,TPESampler,COMPLETE
1163,0.4948844885027081,2025-04-24 21:08:04.305095,2025-04-24 21:08:05.057266,0 days 00:00:00.752171,squared_error,35,log2,1,9,best,TPESampler,COMPLETE
1164,0.6747391651080636,2025-04-24 21:08:04.865052,2025-04-24 21:08:05.765091,0 days 00:00:00.900039,squared_error,29,log2,1,8,best,TPESampler,COMPLETE
1165,0.4438474442892985,2025-04-24 21:08:05.002753,2025-04-24 21:08:06.013230,0 days 00:00:01.010477,squared_error,35,log2,1,10,best,TPESampler,COMPLETE
1166,0.4438474442892985,2025-04-24 21:08:05.273628,2025-04-24 21:08:06.200542,0 days 00:00:00.926914,squared_error,35,log2,1,10,best,TPESampler,COMPLETE
1167,0.7975493713728398,2025-04-24 21:08:06.043283,2025-04-24 21:08:07.174786,0 days 00:00:01.131503,squared_error,35,log2,2,6,best,TPESampler,COMPLETE
1168,0.7975493713728398,2025-04-24 21:08:06.355725,2025-04-24 21:08:07.587318,0 days 00:00:01.231593,squared_error,30,log2,3,12,best,TPESampler,COMPLETE
1169,0.7975493713728398,2025-04-24 21:08:06.967190,2025-04-24 21:08:07.900457,0 days 00:00:00.933267,squared_error,35,log2,2,9,best,TPESampler,COMPLETE
1170,0.7975493713728398,2025-04-24 21:08:07.433024,2025-04-24 21:08:08.246119,0 days 00:00:00.813095,squared_error,30,log2,2,10,best,TPESampler,COMPLETE
1171,0.7975493713728398,2025-04-24 21:08:07.946470,2025-04-24 21:08:08.989412,0 days 00:00:01.042942,squared_error,30,log2,3,9,best,TPESampler,COMPLETE
1172,0.6689797096059603,2025-04-24 21:08:08.189037,2025-04-24 21:08:09.066925,0 days 00:00:00.877888,squared_error,30,log2,1,11,best,TPESampler,COMPLETE
1173,0.5101622714757418,2025-04-24 21:08:08.476775,2025-04-24 21:08:09.382389,0 days 00:00:00.905614,squared_error,35,log2,1,13,best,TPESampler,COMPLETE
1174,0.4948844885027081,2025-04-24 21:08:09.285802,2025-04-24 21:08:10.172394,0 days 00:00:00.886592,squared_error,35,log2,1,9,best,TPESampler,COMPLETE
1175,0.894550859606008,2025-04-24 21:08:09.339015,2025-04-24 21:08:10.249076,0 days 00:00:00.910061,friedman_mse,35,sqrt,8,11,best,TPESampler,COMPLETE
1176,0.5101622714757418,2025-04-24 21:08:09.835134,2025-04-24 21:08:10.610716,0 days 00:00:00.775582,squared_error,35,log2,1,13,best,TPESampler,COMPLETE
1177,0.44670023329729247,2025-04-24 21:08:10.406770,2025-04-24 21:08:11.238749,0 days 00:00:00.831979,squared_error,35,log2,1,7,best,TPESampler,COMPLETE
1178,0.9347481389709953,2025-04-24 21:08:10.471148,2025-04-24 21:08:11.381736,0 days 00:00:00.910588,squared_error,15,sqrt,9,10,random,TPESampler,COMPLETE
1179,0.7975493713728398,2025-04-24 21:08:10.877346,2025-04-24 21:08:11.670390,0 days 00:00:00.793044,squared_error,35,log2,3,11,best,TPESampler,COMPLETE
1180,0.6689797096059603,2025-04-24 21:08:11.542984,2025-04-24 21:08:12.316362,0 days 00:00:00.773378,squared_error,30,log2,1,11,best,TPESampler,COMPLETE
1181,0.6756408221672622,2025-04-24 21:08:11.739758,2025-04-24 21:08:12.791370,0 days 00:00:01.051612,squared_error,30,log2,1,8,best,TPESampler,COMPLETE
1182,0.6702958143159663,2025-04-24 21:08:11.896768,2025-04-24 21:08:12.888801,0 days 00:00:00.992033,squared_error,29,log2,1,13,best,TPESampler,COMPLETE
1183,0.786987845634963,2025-04-24 21:08:12.593803,2025-04-24 21:08:13.397124,0 days 00:00:00.803321,absolute_error,27,log2,3,12,best,TPESampler,COMPLETE
1184,0.5120876615801571,2025-04-24 21:08:13.036826,2025-04-24 21:08:13.821789,0 days 00:00:00.784963,friedman_mse,35,log2,1,12,best,TPESampler,COMPLETE
1185,0.7975493713728398,2025-04-24 21:08:13.215639,2025-04-24 21:08:14.273917,0 days 00:00:01.058278,squared_error,35,log2,3,8,best,TPESampler,COMPLETE
1186,0.8876713258154219,2025-04-24 21:08:13.742091,2025-04-24 21:08:14.513043,0 days 00:00:00.770952,squared_error,6,sqrt,6,9,best,TPESampler,COMPLETE
1187,0.48051683833886516,2025-04-24 21:08:14.113688,2025-04-24 21:08:14.825805,0 days 00:00:00.712117,squared_error,35,log2,1,8,best,TPESampler,COMPLETE
1188,0.4948844885027081,2025-04-24 21:08:14.581823,2025-04-24 21:08:15.429544,0 days 00:00:00.847721,friedman_mse,35,log2,1,9,best,TPESampler,COMPLETE
1189,0.5128537554029937,2025-04-24 21:08:14.786938,2025-04-24 21:08:15.626453,0 days 00:00:00.839515,squared_error,35,log2,1,11,best,TPESampler,COMPLETE
1190,0.7975493713728398,2025-04-24 21:08:15.047694,2025-04-24 21:08:16.022349,0 days 00:00:00.974655,squared_error,30,log2,2,12,best,TPESampler,COMPLETE
1191,0.4438474442892985,2025-04-24 21:08:15.686786,2025-04-24 21:08:16.559970,0 days 00:00:00.873184,squared_error,35,log2,1,10,best,TPESampler,COMPLETE
1192,0.4438474442892985,2025-04-24 21:08:15.914537,2025-04-24 21:08:16.715728,0 days 00:00:00.801191,squared_error,35,log2,1,10,best,TPESampler,COMPLETE
1193,0.7975493713728398,2025-04-24 21:08:16.255838,2025-04-24 21:08:17.067814,0 days 00:00:00.811976,squared_error,35,log2,2,11,best,TPESampler,COMPLETE
1194,1.028030364428894,2025-04-24 21:08:16.795730,2025-04-24 21:08:17.678934,0 days 00:00:00.883204,absolute_error,31,sqrt,5,15,best,TPESampler,COMPLETE
1195,0.6756408221672622,2025-04-24 21:08:16.989750,2025-04-24 21:08:17.920020,0 days 00:00:00.930270,squared_error,30,log2,1,8,best,TPESampler,COMPLETE
1196,0.6756408221672622,2025-04-24 21:08:17.314717,2025-04-24 21:08:18.705891,0 days 00:00:01.391174,squared_error,30,log2,1,8,best,TPESampler,COMPLETE
1197,0.4948844885027081,2025-04-24 21:08:18.113631,2025-04-24 21:08:18.946014,0 days 00:00:00.832383,squared_error,35,log2,1,9,best,TPESampler,COMPLETE
1198,0.7975493713728398,2025-04-24 21:08:18.205391,2025-04-24 21:08:19.057384,0 days 00:00:00.851993,squared_error,35,log2,2,7,best,TPESampler,COMPLETE
1199,0.7633732370034454,2025-04-24 21:08:18.967105,2025-04-24 21:08:19.712658,0 days 00:00:00.745553,absolute_error,31,log2,1,11,best,TPESampler,COMPLETE
1200,0.7975493713728398,2025-04-24 21:08:19.225450,2025-04-24 21:08:20.053690,0 days 00:00:00.828240,squared_error,30,log2,2,10,best,TPESampler,COMPLETE
1201,0.9671029066257907,2025-04-24 21:08:19.425663,2025-04-24 21:08:20.633162,0 days 00:00:01.207499,absolute_error,29,log2,5,11,random,TPESampler,COMPLETE
1202,0.7975493713728398,2025-04-24 21:08:20.059347,2025-04-24 21:08:20.980263,0 days 00:00:00.920916,friedman_mse,35,log2,2,4,best,TPESampler,COMPLETE
1203,0.7975493713728398,2025-04-24 21:08:20.381767,2025-04-24 21:08:21.263396,0 days 00:00:00.881629,squared_error,35,log2,2,10,best,TPESampler,COMPLETE
1204,0.9061960060656828,2025-04-24 21:08:20.913637,2025-04-24 21:08:21.591243,0 days 00:00:00.677606,squared_error,35,log2,1,10,random,TPESampler,COMPLETE
1205,0.7975493713728398,2025-04-24 21:08:21.319517,2025-04-24 21:08:22.138863,0 days 00:00:00.819346,squared_error,35,log2,3,17,best,TPESampler,COMPLETE
1206,0.922426147955362,2025-04-24 21:08:21.594447,2025-04-24 21:08:22.448035,0 days 00:00:00.853588,friedman_mse,21,log2,5,19,random,TPESampler,COMPLETE
1207,0.6708356072336189,2025-04-24 21:08:21.933046,2025-04-24 21:08:22.821920,0 days 00:00:00.888874,squared_error,30,log2,1,12,best,TPESampler,COMPLETE
1208,0.458106663082747,2025-04-24 21:08:22.389838,2025-04-24 21:08:23.202153,0 days 00:00:00.812315,squared_error,35,log2,1,6,best,TPESampler,COMPLETE
1209,0.9833875795200541,2025-04-24 21:08:22.694284,2025-04-24 21:08:23.530653,0 days 00:00:00.836369,absolute_error,3,sqrt,1,5,random,TPESampler,COMPLETE
1210,0.7975493713728398,2025-04-24 21:08:23.052170,2025-04-24 21:08:24.074780,0 days 00:00:01.022610,squared_error,35,log2,3,12,best,TPESampler,COMPLETE
1211,0.7975493713728398,2025-04-24 21:08:23.533856,2025-04-24 21:08:24.368404,0 days 00:00:00.834548,squared_error,35,log2,2,12,best,TPESampler,COMPLETE
1212,0.4438474442892985,2025-04-24 21:08:23.835133,2025-04-24 21:08:24.679610,0 days 00:00:00.844477,squared_error,35,log2,1,10,best,TPESampler,COMPLETE
1213,0.48444975754384645,2025-04-24 21:08:24.315993,2025-04-24 21:08:25.002090,0 days 00:00:00.686097,squared_error,35,log2,1,14,best,TPESampler,COMPLETE
1214,0.9993409537053991,2025-04-24 21:08:24.623807,2025-04-24 21:08:25.435673,0 days 00:00:00.811866,absolute_error,6,sqrt,10,19,random,TPESampler,COMPLETE
1215,0.6545164836672983,2025-04-24 21:08:24.995202,2025-04-24 21:08:25.730182,0 days 00:00:00.734980,squared_error,29,log2,1,9,best,TPESampler,COMPLETE
1216,0.8913351576037826,2025-04-24 21:08:25.255332,2025-04-24 21:08:26.283081,0 days 00:00:01.027749,squared_error,34,sqrt,3,9,best,TPESampler,COMPLETE
1217,0.5128537554029937,2025-04-24 21:08:25.722276,2025-04-24 21:08:26.485878,0 days 00:00:00.763602,squared_error,35,log2,1,11,best,TPESampler,COMPLETE
1218,0.7975493713728398,2025-04-24 21:08:25.983365,2025-04-24 21:08:26.881529,0 days 00:00:00.898164,squared_error,30,log2,3,8,best,TPESampler,COMPLETE
1219,0.4948844885027081,2025-04-24 21:08:26.609118,2025-04-24 21:08:27.421301,0 days 00:00:00.812183,squared_error,35,log2,1,9,best,TPESampler,COMPLETE
1220,0.7975493713728398,2025-04-24 21:08:26.750172,2025-04-24 21:08:27.658326,0 days 00:00:00.908154,friedman_mse,35,log2,3,11,best,TPESampler,COMPLETE
1221,0.6702958143159663,2025-04-24 21:08:27.137928,2025-04-24 21:08:27.987133,0 days 00:00:00.849205,squared_error,29,log2,1,13,best,TPESampler,COMPLETE
1222,0.9621384458505818,2025-04-24 21:08:27.698708,2025-04-24 21:08:28.591119,0 days 00:00:00.892411,absolute_error,35,log2,1,7,random,TPESampler,COMPLETE
1223,0.5710376737588779,2025-04-24 21:08:27.919006,2025-04-24 21:08:28.729544,0 days 00:00:00.810538,squared_error,30,sqrt,1,6,best,TPESampler,COMPLETE
1224,0.7975493713728398,2025-04-24 21:08:28.256055,2025-04-24 21:08:29.013992,0 days 00:00:00.757937,squared_error,30,log2,2,10,best,TPESampler,COMPLETE
1225,0.9347481389709953,2025-04-24 21:08:28.890241,2025-04-24 21:08:29.856944,0 days 00:00:00.966703,squared_error,26,sqrt,9,13,random,TPESampler,COMPLETE
1226,0.5848454072682857,2025-04-24 21:08:28.974846,2025-04-24 21:08:29.928034,0 days 00:00:00.953188,squared_error,35,sqrt,1,11,best,TPESampler,COMPLETE
1227,0.7975493713728398,2025-04-24 21:08:29.494177,2025-04-24 21:08:30.321396,0 days 00:00:00.827219,squared_error,35,log2,3,8,best,TPESampler,COMPLETE
1228,0.4438474442892985,2025-04-24 21:08:30.122301,2025-04-24 21:08:31.184506,0 days 00:00:01.062205,squared_error,35,log2,1,10,best,TPESampler,COMPLETE
1229,0.5120876615801571,2025-04-24 21:08:30.167035,2025-04-24 21:08:31.112054,0 days 00:00:00.945019,squared_error,35,log2,1,12,best,TPESampler,COMPLETE
1230,0.6692087088741673,2025-04-24 21:08:30.637833,2025-04-24 21:08:31.574919,0 days 00:00:00.937086,squared_error,30,log2,1,9,best,TPESampler,COMPLETE
1231,0.9347481389709953,2025-04-24 21:08:31.332278,2025-04-24 21:08:32.192675,0 days 00:00:00.860397,friedman_mse,22,sqrt,6,5,random,TPESampler,COMPLETE
1232,0.44670023329729247,2025-04-24 21:08:31.384306,2025-04-24 21:08:32.253773,0 days 00:00:00.869467,squared_error,35,log2,1,7,best,TPESampler,COMPLETE
1233,0.7975493713728398,2025-04-24 21:08:31.890045,2025-04-24 21:08:32.578137,0 days 00:00:00.688092,squared_error,29,log2,3,13,best,TPESampler,COMPLETE
1234,0.654454193048308,2025-04-24 21:08:32.453181,2025-04-24 21:08:33.546393,0 days 00:00:01.093212,absolute_error,35,log2,1,9,best,TPESampler,COMPLETE
1235,0.7975493713728398,2025-04-24 21:08:32.524894,2025-04-24 21:08:33.361529,0 days 00:00:00.836635,squared_error,35,log2,3,12,best,TPESampler,COMPLETE
1236,0.7975493713728398,2025-04-24 21:08:32.829030,2025-04-24 21:08:33.674985,0 days 00:00:00.845955,squared_error,35,log2,3,10,best,TPESampler,COMPLETE
1237,0.6881819029838491,2025-04-24 21:08:33.605231,2025-04-24 21:08:34.467639,0 days 00:00:00.862408,squared_error,29,log2,1,12,best,TPESampler,COMPLETE
1238,0.6689797096059603,2025-04-24 21:08:33.797493,2025-04-24 21:08:34.729107,0 days 00:00:00.931614,squared_error,30,log2,1,11,best,TPESampler,COMPLETE
1239,0.6845605447994518,2025-04-24 21:08:33.989739,2025-04-24 21:08:34.840160,0 days 00:00:00.850421,squared_error,22,log2,1,9,best,TPESampler,COMPLETE
1240,0.6735913168527353,2025-04-24 21:08:34.778665,2025-04-24 21:08:35.744382,0 days 00:00:00.965717,squared_error,30,log2,1,10,best,TPESampler,COMPLETE
1241,0.48051683833886516,2025-04-24 21:08:34.956440,2025-04-24 21:08:35.951195,0 days 00:00:00.994755,squared_error,35,log2,1,8,best,TPESampler,COMPLETE
1242,0.4438474442892985,2025-04-24 21:08:35.223000,2025-04-24 21:08:36.092993,0 days 00:00:00.869993,squared_error,35,log2,1,10,best,TPESampler,COMPLETE
1243,0.4948844885027081,2025-04-24 21:08:36.006173,2025-04-24 21:08:36.675205,0 days 00:00:00.669032,squared_error,35,log2,1,9,best,TPESampler,COMPLETE
1244,0.7975493713728398,2025-04-24 21:08:36.220569,2025-04-24 21:08:37.013031,0 days 00:00:00.792462,squared_error,29,log2,3,9,best,TPESampler,COMPLETE
1245,0.7975493713728398,2025-04-24 21:08:36.554650,2025-04-24 21:08:37.326969,0 days 00:00:00.772319,squared_error,35,log2,3,12,best,TPESampler,COMPLETE
1246,1.0169646864906652,2025-04-24 21:08:37.011624,2025-04-24 21:08:37.792311,0 days 00:00:00.780687,absolute_error,19,sqrt,7,7,best,TPESampler,COMPLETE
1247,0.44670023329729247,2025-04-24 21:08:37.283883,2025-04-24 21:08:38.102942,0 days 00:00:00.819059,friedman_mse,35,log2,1,7,best,TPESampler,COMPLETE
1248,0.7975493713728398,2025-04-24 21:08:37.662290,2025-04-24 21:08:38.484786,0 days 00:00:00.822496,squared_error,35,log2,3,9,best,TPESampler,COMPLETE
1249,0.5120876615801571,2025-04-24 21:08:38.062468,2025-04-24 21:08:38.857324,0 days 00:00:00.794856,squared_error,35,log2,1,12,best,TPESampler,COMPLETE
1250,0.922426147955362,2025-04-24 21:08:38.378691,2025-04-24 21:08:39.183722,0 days 00:00:00.805031,squared_error,28,log2,3,10,random,TPESampler,COMPLETE
1251,0.5898358222930986,2025-04-24 21:08:38.734621,2025-04-24 21:08:39.716469,0 days 00:00:00.981848,absolute_error,26,sqrt,1,16,best,TPESampler,COMPLETE
1252,0.6668555007839312,2025-04-24 21:08:39.192365,2025-04-24 21:08:40.087047,0 days 00:00:00.894682,squared_error,29,log2,1,16,best,TPESampler,COMPLETE
1253,0.7975493713728398,2025-04-24 21:08:39.547406,2025-04-24 21:08:40.636259,0 days 00:00:01.088853,squared_error,29,log2,2,6,best,TPESampler,COMPLETE
1254,0.6765049187574741,2025-04-24 21:08:40.077995,2025-04-24 21:08:40.821139,0 days 00:00:00.743144,squared_error,29,log2,1,10,best,TPESampler,COMPLETE
1255,1.0007431665713944,2025-04-24 21:08:40.380977,2025-04-24 21:08:41.101695,0 days 00:00:00.720718,absolute_error,1,log2,5,7,best,TPESampler,COMPLETE
1256,0.6747391651080636,2025-04-24 21:08:40.918993,2025-04-24 21:08:41.899601,0 days 00:00:00.980608,squared_error,29,log2,1,8,best,TPESampler,COMPLETE
1257,0.7975493713728398,2025-04-24 21:08:41.038135,2025-04-24 21:08:41.906967,0 days 00:00:00.868832,squared_error,35,log2,2,12,best,TPESampler,COMPLETE
1258,0.5101622714757418,2025-04-24 21:08:41.587942,2025-04-24 21:08:42.367610,0 days 00:00:00.779668,squared_error,35,log2,1,13,best,TPESampler,COMPLETE
1259,0.44670023329729247,2025-04-24 21:08:42.115958,2025-04-24 21:08:42.946858,0 days 00:00:00.830900,squared_error,35,log2,1,7,best,TPESampler,COMPLETE
1260,0.4438474442892985,2025-04-24 21:08:42.164029,2025-04-24 21:08:43.095368,0 days 00:00:00.931339,squared_error,35,log2,1,10,best,TPESampler,COMPLETE
1261,0.7975493713728398,2025-04-24 21:08:42.591228,2025-04-24 21:08:43.388845,0 days 00:00:00.797617,squared_error,29,log2,3,9,best,TPESampler,COMPLETE
1262,0.9003368091347548,2025-04-24 21:08:43.269302,2025-04-24 21:08:44.319208,0 days 00:00:01.049906,squared_error,31,log2,1,6,random,TPESampler,COMPLETE
1263,0.5120876615801571,2025-04-24 21:08:43.319159,2025-04-24 21:08:44.685905,0 days 00:00:01.366746,squared_error,35,log2,1,12,best,TPESampler,COMPLETE
1264,0.5120876615801571,2025-04-24 21:08:43.618132,2025-04-24 21:08:44.515133,0 days 00:00:00.897001,squared_error,35,log2,1,12,best,TPESampler,COMPLETE
1265,0.7975493713728398,2025-04-24 21:08:44.557014,2025-04-24 21:08:45.238025,0 days 00:00:00.681011,squared_error,35,log2,3,5,best,TPESampler,COMPLETE
1266,0.7975493713728398,2025-04-24 21:08:44.786204,2025-04-24 21:08:45.556418,0 days 00:00:00.770214,squared_error,35,log2,3,7,best,TPESampler,COMPLETE
1267,0.6831095431530921,2025-04-24 21:08:45.099720,2025-04-24 21:08:45.936067,0 days 00:00:00.836347,friedman_mse,28,log2,1,11,best,TPESampler,COMPLETE
1268,0.6914253690247881,2025-04-24 21:08:45.496669,2025-04-24 21:08:46.266364,0 days 00:00:00.769695,squared_error,29,log2,1,11,best,TPESampler,COMPLETE
1269,0.7975493713728398,2025-04-24 21:08:45.773330,2025-04-24 21:08:46.722940,0 days 00:00:00.949610,squared_error,35,log2,2,10,best,TPESampler,COMPLETE
1270,0.899047508785746,2025-04-24 21:08:46.225320,2025-04-24 21:08:47.095134,0 days 00:00:00.869814,squared_error,30,log2,1,15,random,TPESampler,COMPLETE
1271,0.48051683833886516,2025-04-24 21:08:46.528910,2025-04-24 21:08:47.455577,0 days 00:00:00.926667,squared_error,35,log2,1,8,best,TPESampler,COMPLETE
1272,0.5128537554029937,2025-04-24 21:08:46.978276,2025-04-24 21:08:47.737943,0 days 00:00:00.759667,friedman_mse,35,log2,1,11,best,TPESampler,COMPLETE
1273,0.7975493713728398,2025-04-24 21:08:47.463591,2025-04-24 21:08:48.369620,0 days 00:00:00.906029,squared_error,35,log2,2,10,best,TPESampler,COMPLETE
1274,0.6417886234522288,2025-04-24 21:08:47.692967,2025-04-24 21:08:48.684932,0 days 00:00:00.991965,friedman_mse,12,sqrt,2,13,best,TPESampler,COMPLETE
1275,0.4948844885027081,2025-04-24 21:08:47.985428,2025-04-24 21:08:48.788101,0 days 00:00:00.802673,squared_error,35,log2,1,9,best,TPESampler,COMPLETE
1276,0.5995580378238244,2025-04-24 21:08:48.623060,2025-04-24 21:08:49.395297,0 days 00:00:00.772237,squared_error,35,sqrt,1,7,best,TPESampler,COMPLETE
1277,0.7975493713728398,2025-04-24 21:08:48.923603,2025-04-24 21:08:49.753534,0 days 00:00:00.829931,squared_error,30,log2,3,11,best,TPESampler,COMPLETE
1278,0.6747391651080636,2025-04-24 21:08:49.049347,2025-04-24 21:08:50.031454,0 days 00:00:00.982107,squared_error,29,log2,1,8,best,TPESampler,COMPLETE
1279,0.7975493713728398,2025-04-24 21:08:49.713455,2025-04-24 21:08:50.567151,0 days 00:00:00.853696,friedman_mse,30,log2,3,8,best,TPESampler,COMPLETE
1280,0.9494322793442198,2025-04-24 21:08:50.037930,2025-04-24 21:08:51.056080,0 days 00:00:01.018150,friedman_mse,29,log2,7,19,random,TPESampler,COMPLETE
1281,0.5120876615801571,2025-04-24 21:08:50.435349,2025-04-24 21:08:51.358095,0 days 00:00:00.922746,squared_error,35,log2,1,12,best,TPESampler,COMPLETE
1282,0.6765049187574741,2025-04-24 21:08:50.955765,2025-04-24 21:08:51.913127,0 days 00:00:00.957362,squared_error,29,log2,1,10,best,TPESampler,COMPLETE
1283,0.4948844885027081,2025-04-24 21:08:51.313723,2025-04-24 21:08:52.263780,0 days 00:00:00.950057,squared_error,35,log2,1,9,best,TPESampler,COMPLETE
1284,0.9347481389709953,2025-04-24 21:08:51.656625,2025-04-24 21:08:52.602846,0 days 00:00:00.946221,squared_error,8,sqrt,7,14,random,TPESampler,COMPLETE
