number,value,datetime_start,datetime_complete,duration,params_criterion,params_max_depth,params_max_features,params_min_samples_leaf,params_min_samples_split,params_splitter,system_attrs_auto:sampler,state
1285,0.7130748710988879,2025-04-24 21:08:52.154756,2025-04-24 21:08:53.138382,0 days 00:00:00.983626,absolute_error,32,log2,1,18,best,TPESampler,COMPLETE
1286,0.4438474442892985,2025-04-24 21:08:52.556792,2025-04-24 21:08:53.435227,0 days 00:00:00.878435,squared_error,35,log2,1,10,best,TPESampler,COMPLETE
1287,0.5128537554029937,2025-04-24 21:08:52.871250,2025-04-24 21:08:53.650300,0 days 00:00:00.779050,squared_error,35,log2,1,11,best,TPESampler,COMPLETE
1288,0.9172310018643973,2025-04-24 21:08:53.371964,2025-04-24 21:08:54.119773,0 days 00:00:00.747809,squared_error,7,sqrt,1,18,random,TPESampler,COMPLETE
1289,0.6914253690247881,2025-04-24 21:08:53.772998,2025-04-24 21:08:54.599595,0 days 00:00:00.826597,squared_error,29,log2,1,11,best,TPESampler,COMPLETE
1290,0.5128537554029937,2025-04-24 21:08:53.922826,2025-04-24 21:08:54.817723,0 days 00:00:00.894897,squared_error,35,log2,1,11,best,TPESampler,COMPLETE
1291,0.7975493713728398,2025-04-24 21:08:54.372568,2025-04-24 21:08:55.168349,0 days 00:00:00.795781,squared_error,35,log2,3,12,best,TPESampler,COMPLETE
1292,0.6486758301127608,2025-04-24 21:08:54.878846,2025-04-24 21:08:55.697226,0 days 00:00:00.818380,squared_error,29,log2,1,7,best,TPESampler,COMPLETE
1293,0.7975493713728398,2025-04-24 21:08:55.122868,2025-04-24 21:08:56.022639,0 days 00:00:00.899771,squared_error,30,log2,3,10,best,TPESampler,COMPLETE
1294,0.7221627019184623,2025-04-24 21:08:55.390805,2025-04-24 21:08:56.367353,0 days 00:00:00.976548,squared_error,30,log2,1,6,best,TPESampler,COMPLETE
1295,0.44670023329729247,2025-04-24 21:08:55.952080,2025-04-24 21:08:56.690748,0 days 00:00:00.738668,squared_error,35,log2,1,7,best,TPESampler,COMPLETE
1296,0.7975493713728398,2025-04-24 21:08:56.372991,2025-04-24 21:08:57.269441,0 days 00:00:00.896450,squared_error,35,log2,3,9,best,TPESampler,COMPLETE
1297,0.6406190708244043,2025-04-24 21:08:56.722217,2025-04-24 21:08:57.643966,0 days 00:00:00.921749,absolute_error,27,log2,1,12,best,TPESampler,COMPLETE
1298,0.8008085597175219,2025-04-24 21:08:57.081254,2025-04-24 21:08:58.215831,0 days 00:00:01.134577,squared_error,6,log2,1,2,best,TPESampler,COMPLETE
1299,0.7975493713728398,2025-04-24 21:08:57.637731,2025-04-24 21:08:58.428769,0 days 00:00:00.791038,squared_error,30,log2,2,15,best,TPESampler,COMPLETE
1300,0.6811438523657211,2025-04-24 21:08:57.968746,2025-04-24 21:08:59.180913,0 days 00:00:01.212167,squared_error,31,log2,1,15,best,TPESampler,COMPLETE
1301,0.786987845634963,2025-04-24 21:08:58.609770,2025-04-24 21:08:59.550839,0 days 00:00:00.941069,absolute_error,35,log2,3,10,best,TPESampler,COMPLETE
1302,0.786987845634963,2025-04-24 21:08:58.692924,2025-04-24 21:08:59.507669,0 days 00:00:00.814745,absolute_error,35,log2,2,11,best,TPESampler,COMPLETE
1303,0.6689797096059603,2025-04-24 21:08:59.432855,2025-04-24 21:09:00.143849,0 days 00:00:00.710994,squared_error,30,log2,1,11,best,TPESampler,COMPLETE
1304,0.48051683833886516,2025-04-24 21:08:59.772976,2025-04-24 21:09:01.037862,0 days 00:00:01.264886,squared_error,35,log2,1,8,best,TPESampler,COMPLETE
1305,0.48051683833886516,2025-04-24 21:08:59.816592,2025-04-24 21:09:00.918991,0 days 00:00:01.102399,squared_error,35,log2,1,8,best,TPESampler,COMPLETE
1306,0.7975493713728398,2025-04-24 21:09:00.511558,2025-04-24 21:09:01.353813,0 days 00:00:00.842255,squared_error,35,log2,3,10,best,TPESampler,COMPLETE
1307,0.93763901116295,2025-04-24 21:09:01.255969,2025-04-24 21:09:02.005562,0 days 00:00:00.749593,squared_error,9,log2,1,20,random,TPESampler,COMPLETE
1308,0.9494322793442198,2025-04-24 21:09:01.308381,2025-04-24 21:09:02.248322,0 days 00:00:00.939941,friedman_mse,25,log2,8,20,best,TPESampler,COMPLETE
1309,0.6708356072336189,2025-04-24 21:09:01.629392,2025-04-24 21:09:02.631269,0 days 00:00:01.001877,squared_error,30,log2,1,12,best,TPESampler,COMPLETE
1310,0.6765049187574741,2025-04-24 21:09:02.314118,2025-04-24 21:09:03.228137,0 days 00:00:00.914019,squared_error,29,log2,1,10,best,TPESampler,COMPLETE
1311,0.7975493713728398,2025-04-24 21:09:02.513284,2025-04-24 21:09:03.606533,0 days 00:00:01.093249,squared_error,35,log2,2,12,best,TPESampler,COMPLETE
1312,0.4948844885027081,2025-04-24 21:09:02.880603,2025-04-24 21:09:03.941560,0 days 00:00:01.060957,squared_error,35,log2,1,9,best,TPESampler,COMPLETE
1313,0.7975493713728398,2025-04-24 21:09:03.478338,2025-04-24 21:09:04.305953,0 days 00:00:00.827615,friedman_mse,35,log2,3,9,best,TPESampler,COMPLETE
1314,0.5128537554029937,2025-04-24 21:09:03.940247,2025-04-24 21:09:04.844733,0 days 00:00:00.904486,squared_error,35,log2,1,11,best,TPESampler,COMPLETE
1315,0.9494322793442198,2025-04-24 21:09:04.309809,2025-04-24 21:09:05.170634,0 days 00:00:00.860825,squared_error,3,log2,6,12,best,TPESampler,COMPLETE
1316,0.5101622714757418,2025-04-24 21:09:04.704840,2025-04-24 21:09:05.467416,0 days 00:00:00.762576,squared_error,35,log2,1,13,best,TPESampler,COMPLETE
1317,0.6765049187574741,2025-04-24 21:09:05.169223,2025-04-24 21:09:06.102074,0 days 00:00:00.932851,squared_error,29,log2,1,10,best,TPESampler,COMPLETE
1318,0.7975493713728398,2025-04-24 21:09:05.474019,2025-04-24 21:09:06.431444,0 days 00:00:00.957425,squared_error,30,log2,3,9,best,TPESampler,COMPLETE
1319,1.0007431665713944,2025-04-24 21:09:05.838612,2025-04-24 21:09:06.963251,0 days 00:00:01.124639,absolute_error,35,log2,10,2,random,TPESampler,COMPLETE
1320,0.9494322793442198,2025-04-24 21:09:06.437876,2025-04-24 21:09:07.522280,0 days 00:00:01.084404,friedman_mse,18,log2,10,3,random,TPESampler,COMPLETE
1321,0.8996195254384107,2025-04-24 21:09:06.926418,2025-04-24 21:09:07.889020,0 days 00:00:00.962602,squared_error,28,log2,1,10,random,TPESampler,COMPLETE
1322,0.4438474442892985,2025-04-24 21:09:07.323559,2025-04-24 21:09:08.440152,0 days 00:00:01.116593,squared_error,35,log2,1,10,best,TPESampler,COMPLETE
1323,0.4438474442892985,2025-04-24 21:09:07.896639,2025-04-24 21:09:08.650111,0 days 00:00:00.753472,squared_error,35,log2,1,10,best,TPESampler,COMPLETE
1324,0.7975493713728398,2025-04-24 21:09:08.182449,2025-04-24 21:09:08.939403,0 days 00:00:00.756954,squared_error,30,log2,2,8,best,TPESampler,COMPLETE
1325,0.7975493713728398,2025-04-24 21:09:08.803818,2025-04-24 21:09:09.679491,0 days 00:00:00.875673,squared_error,35,log2,3,7,best,TPESampler,COMPLETE
1326,0.458106663082747,2025-04-24 21:09:08.899074,2025-04-24 21:09:10.041807,0 days 00:00:01.142733,squared_error,35,log2,1,6,best,TPESampler,COMPLETE
1327,0.9027082956026495,2025-04-24 21:09:09.164636,2025-04-24 21:09:10.039033,0 days 00:00:00.874397,squared_error,35,log2,1,9,random,TPESampler,COMPLETE
1328,0.6317023826094311,2025-04-24 21:09:09.998216,2025-04-24 21:09:10.932895,0 days 00:00:00.934679,squared_error,28,sqrt,2,11,best,TPESampler,COMPLETE
1329,0.7975493713728398,2025-04-24 21:09:10.339727,2025-04-24 21:09:11.249720,0 days 00:00:00.909993,squared_error,21,log2,3,10,best,TPESampler,COMPLETE
1330,0.6708356072336189,2025-04-24 21:09:10.368574,2025-04-24 21:09:11.261658,0 days 00:00:00.893084,squared_error,30,log2,1,12,best,TPESampler,COMPLETE
1331,0.7975493713728398,2025-04-24 21:09:11.191437,2025-04-24 21:09:11.926759,0 days 00:00:00.735322,squared_error,35,log2,3,10,best,TPESampler,COMPLETE
1332,0.5120876615801571,2025-04-24 21:09:11.454587,2025-04-24 21:09:12.472503,0 days 00:00:01.017916,squared_error,35,log2,1,12,best,TPESampler,COMPLETE
1333,0.4948844885027081,2025-04-24 21:09:11.496337,2025-04-24 21:09:12.498665,0 days 00:00:01.002328,squared_error,35,log2,1,9,best,TPESampler,COMPLETE
1334,0.6735913168527353,2025-04-24 21:09:12.214562,2025-04-24 21:09:12.952271,0 days 00:00:00.737709,squared_error,30,log2,1,10,best,TPESampler,COMPLETE
1335,0.894337295554728,2025-04-24 21:09:12.680262,2025-04-24 21:09:13.612513,0 days 00:00:00.932251,friedman_mse,8,sqrt,3,3,best,TPESampler,COMPLETE
1336,0.5101622714757418,2025-04-24 21:09:12.755213,2025-04-24 21:09:13.692091,0 days 00:00:00.936878,friedman_mse,35,log2,1,13,best,TPESampler,COMPLETE
1337,0.5128537554029937,2025-04-24 21:09:13.441324,2025-04-24 21:09:14.167485,0 days 00:00:00.726161,squared_error,35,log2,1,11,best,TPESampler,COMPLETE
1338,0.7975493713728398,2025-04-24 21:09:13.866614,2025-04-24 21:09:14.741808,0 days 00:00:00.875194,squared_error,30,log2,3,11,best,TPESampler,COMPLETE
1339,0.9494322793442198,2025-04-24 21:09:14.039772,2025-04-24 21:09:14.909553,0 days 00:00:00.869781,squared_error,34,log2,8,20,random,TPESampler,COMPLETE
1340,0.7975493713728398,2025-04-24 21:09:14.443505,2025-04-24 21:09:15.222196,0 days 00:00:00.778691,squared_error,35,log2,3,9,best,TPESampler,COMPLETE
1341,0.686720725631779,2025-04-24 21:09:14.985360,2025-04-24 21:09:15.788091,0 days 00:00:00.802731,squared_error,22,log2,1,13,best,TPESampler,COMPLETE
1342,0.9494322793442198,2025-04-24 21:09:15.180002,2025-04-24 21:09:16.163688,0 days 00:00:00.983686,friedman_mse,26,log2,9,4,best,TPESampler,COMPLETE
1343,0.6765049187574741,2025-04-24 21:09:15.457194,2025-04-24 21:09:16.553801,0 days 00:00:01.096607,squared_error,29,log2,1,10,best,TPESampler,COMPLETE
1344,0.7975493713728398,2025-04-24 21:09:16.118524,2025-04-24 21:09:16.866522,0 days 00:00:00.747998,squared_error,35,log2,3,14,best,TPESampler,COMPLETE
1345,0.6168626322209401,2025-04-24 21:09:16.434150,2025-04-24 21:09:17.367489,0 days 00:00:00.933339,squared_error,34,sqrt,2,13,best,TPESampler,COMPLETE
1346,0.4948844885027081,2025-04-24 21:09:16.820805,2025-04-24 21:09:17.745963,0 days 00:00:00.925158,squared_error,35,log2,1,9,best,TPESampler,COMPLETE
1347,0.6692087088741673,2025-04-24 21:09:17.204817,2025-04-24 21:09:17.972275,0 days 00:00:00.767458,squared_error,30,log2,1,9,best,TPESampler,COMPLETE
1348,0.6168626322209401,2025-04-24 21:09:17.692303,2025-04-24 21:09:18.463101,0 days 00:00:00.770798,friedman_mse,24,sqrt,2,13,best,TPESampler,COMPLETE
1349,0.47972783277528486,2025-04-24 21:09:18.045933,2025-04-24 21:09:18.969695,0 days 00:00:00.923762,squared_error,35,log2,1,18,best,TPESampler,COMPLETE
1350,0.458106663082747,2025-04-24 21:09:18.271426,2025-04-24 21:09:19.160716,0 days 00:00:00.889290,squared_error,35,log2,1,6,best,TPESampler,COMPLETE
1351,0.7975493713728398,2025-04-24 21:09:18.834663,2025-04-24 21:09:19.743837,0 days 00:00:00.909174,squared_error,35,log2,2,9,best,TPESampler,COMPLETE
1352,0.6708356072336189,2025-04-24 21:09:19.227398,2025-04-24 21:09:19.947921,0 days 00:00:00.720523,squared_error,30,log2,1,12,best,TPESampler,COMPLETE
1353,0.6914253690247881,2025-04-24 21:09:19.454186,2025-04-24 21:09:20.266067,0 days 00:00:00.811881,friedman_mse,29,log2,1,11,best,TPESampler,COMPLETE
1354,0.4438474442892985,2025-04-24 21:09:20.005451,2025-04-24 21:09:20.762779,0 days 00:00:00.757328,squared_error,35,log2,1,10,best,TPESampler,COMPLETE
1355,0.5120876615801571,2025-04-24 21:09:20.269577,2025-04-24 21:09:21.087692,0 days 00:00:00.818115,squared_error,35,log2,1,12,best,TPESampler,COMPLETE
1356,0.922426147955362,2025-04-24 21:09:20.636512,2025-04-24 21:09:21.615104,0 days 00:00:00.978592,squared_error,35,log2,3,10,random,TPESampler,COMPLETE
1357,0.46385297432679357,2025-04-24 21:09:21.033831,2025-04-24 21:09:21.972248,0 days 00:00:00.938417,squared_error,35,log2,1,15,best,TPESampler,COMPLETE
1358,0.6775674127828398,2025-04-24 21:09:21.400580,2025-04-24 21:09:22.234482,0 days 00:00:00.833902,friedman_mse,31,log2,1,7,best,TPESampler,COMPLETE
1359,0.922426147955362,2025-04-24 21:09:21.923695,2025-04-24 21:09:22.767774,0 days 00:00:00.844079,friedman_mse,33,log2,5,10,random,TPESampler,COMPLETE
1360,0.4948844885027081,2025-04-24 21:09:22.301738,2025-04-24 21:09:23.159166,0 days 00:00:00.857428,squared_error,35,log2,1,9,best,TPESampler,COMPLETE
1361,0.7975493713728398,2025-04-24 21:09:22.467269,2025-04-24 21:09:23.511529,0 days 00:00:01.044260,squared_error,29,log2,3,11,best,TPESampler,COMPLETE
1362,0.7975493713728398,2025-04-24 21:09:23.164637,2025-04-24 21:09:23.985080,0 days 00:00:00.820443,squared_error,35,log2,3,11,best,TPESampler,COMPLETE
1363,0.7975493713728398,2025-04-24 21:09:23.463830,2025-04-24 21:09:24.369993,0 days 00:00:00.906163,squared_error,35,log2,3,9,best,TPESampler,COMPLETE
1364,0.6692087088741673,2025-04-24 21:09:23.770959,2025-04-24 21:09:24.688387,0 days 00:00:00.917428,squared_error,30,log2,1,9,best,TPESampler,COMPLETE
1365,0.6553604014596837,2025-04-24 21:09:24.321810,2025-04-24 21:09:25.076511,0 days 00:00:00.754701,squared_error,29,log2,1,6,best,TPESampler,COMPLETE
1366,0.7975493713728398,2025-04-24 21:09:24.732760,2025-04-24 21:09:25.678844,0 days 00:00:00.946084,squared_error,29,log2,3,14,best,TPESampler,COMPLETE
1367,0.7975493713728398,2025-04-24 21:09:24.932409,2025-04-24 21:09:25.849942,0 days 00:00:00.917533,squared_error,29,log2,2,9,best,TPESampler,COMPLETE
1368,0.4438474442892985,2025-04-24 21:09:25.309933,2025-04-24 21:09:26.158497,0 days 00:00:00.848564,squared_error,35,log2,1,10,best,TPESampler,COMPLETE
1369,0.6881819029838491,2025-04-24 21:09:26.028114,2025-04-24 21:09:26.969236,0 days 00:00:00.941122,squared_error,29,log2,1,12,best,TPESampler,COMPLETE
1370,0.9023013902286269,2025-04-24 21:09:26.106661,2025-04-24 21:09:27.065829,0 days 00:00:00.959168,friedman_mse,33,log2,1,18,random,TPESampler,COMPLETE
1371,0.5128537554029937,2025-04-24 21:09:26.636496,2025-04-24 21:09:27.398325,0 days 00:00:00.761829,squared_error,35,log2,1,11,best,TPESampler,COMPLETE
1372,0.48051683833886516,2025-04-24 21:09:27.276152,2025-04-24 21:09:28.316088,0 days 00:00:01.039936,squared_error,35,log2,1,8,best,TPESampler,COMPLETE
1373,1.0007431665713944,2025-04-24 21:09:27.361194,2025-04-24 21:09:28.628433,0 days 00:00:01.267239,absolute_error,10,log2,9,5,best,TPESampler,COMPLETE
1374,0.654454193048308,2025-04-24 21:09:27.617719,2025-04-24 21:09:28.637256,0 days 00:00:01.019537,absolute_error,35,log2,1,9,best,TPESampler,COMPLETE
1375,0.5128537554029937,2025-04-24 21:09:28.571583,2025-04-24 21:09:29.294681,0 days 00:00:00.723098,squared_error,35,log2,1,11,best,TPESampler,COMPLETE
1376,0.5101622714757418,2025-04-24 21:09:28.856601,2025-04-24 21:09:29.690954,0 days 00:00:00.834353,squared_error,35,log2,1,13,best,TPESampler,COMPLETE
1377,0.5101622714757418,2025-04-24 21:09:28.984864,2025-04-24 21:09:29.961681,0 days 00:00:00.976817,squared_error,35,log2,1,13,best,TPESampler,COMPLETE
1378,0.7221627019184623,2025-04-24 21:09:29.639856,2025-04-24 21:09:30.465504,0 days 00:00:00.825648,squared_error,30,log2,1,6,best,TPESampler,COMPLETE
1379,0.9993409537053991,2025-04-24 21:09:29.977692,2025-04-24 21:09:30.890344,0 days 00:00:00.912652,absolute_error,3,sqrt,7,18,random,TPESampler,COMPLETE
1380,0.48051683833886516,2025-04-24 21:09:30.336130,2025-04-24 21:09:31.266116,0 days 00:00:00.929986,squared_error,35,log2,1,8,best,TPESampler,COMPLETE
1381,0.7975493713728398,2025-04-24 21:09:30.758144,2025-04-24 21:09:31.670459,0 days 00:00:00.912315,squared_error,35,log2,2,8,best,TPESampler,COMPLETE
1382,0.9494322793442198,2025-04-24 21:09:31.204994,2025-04-24 21:09:32.100421,0 days 00:00:00.895427,squared_error,35,log2,6,11,best,TPESampler,COMPLETE
1383,0.5214805538018283,2025-04-24 21:09:31.542735,2025-04-24 21:09:32.394340,0 days 00:00:00.851605,friedman_mse,34,log2,1,9,best,TPESampler,COMPLETE
1384,0.9763278858485838,2025-04-24 21:09:31.892854,2025-04-24 21:09:32.706376,0 days 00:00:00.813522,absolute_error,26,sqrt,5,19,random,TPESampler,COMPLETE
1385,0.7975493713728398,2025-04-24 21:09:32.397808,2025-04-24 21:09:33.326580,0 days 00:00:00.928772,squared_error,29,log2,2,9,best,TPESampler,COMPLETE
1386,0.7975493713728398,2025-04-24 21:09:32.695854,2025-04-24 21:09:33.455087,0 days 00:00:00.759233,squared_error,29,log2,2,10,best,TPESampler,COMPLETE
1387,0.6735913168527353,2025-04-24 21:09:32.990953,2025-04-24 21:09:33.728221,0 days 00:00:00.737268,squared_error,30,log2,1,10,best,TPESampler,COMPLETE
1388,0.4438474442892985,2025-04-24 21:09:33.557312,2025-04-24 21:09:34.496498,0 days 00:00:00.939186,squared_error,35,log2,1,10,best,TPESampler,COMPLETE
1389,0.7975493713728398,2025-04-24 21:09:33.676627,2025-04-24 21:09:34.747293,0 days 00:00:01.070666,squared_error,35,log2,2,11,best,TPESampler,COMPLETE
1390,0.5128537554029937,2025-04-24 21:09:34.017581,2025-04-24 21:09:34.803861,0 days 00:00:00.786280,squared_error,35,log2,1,11,best,TPESampler,COMPLETE
1391,0.7975493713728398,2025-04-24 21:09:34.732968,2025-04-24 21:09:35.412772,0 days 00:00:00.679804,squared_error,35,log2,3,11,best,TPESampler,COMPLETE
1392,0.6273556321959779,2025-04-24 21:09:34.962133,2025-04-24 21:09:35.850322,0 days 00:00:00.888189,squared_error,35,sqrt,1,10,best,TPESampler,COMPLETE
1393,0.6674401218257165,2025-04-24 21:09:35.096267,2025-04-24 21:09:35.909110,0 days 00:00:00.812843,squared_error,29,log2,1,14,best,TPESampler,COMPLETE
1394,0.7975493713728398,2025-04-24 21:09:35.694589,2025-04-24 21:09:36.608886,0 days 00:00:00.914297,squared_error,30,log2,2,9,best,TPESampler,COMPLETE
1395,0.6756408221672622,2025-04-24 21:09:36.111124,2025-04-24 21:09:36.959220,0 days 00:00:00.848096,squared_error,30,log2,1,8,best,TPESampler,COMPLETE
1396,0.458106663082747,2025-04-24 21:09:36.236485,2025-04-24 21:09:37.168136,0 days 00:00:00.931651,squared_error,35,log2,1,6,best,TPESampler,COMPLETE
1397,0.4438474442892985,2025-04-24 21:09:36.915141,2025-04-24 21:09:37.726547,0 days 00:00:00.811406,friedman_mse,35,log2,1,10,best,TPESampler,COMPLETE
1398,0.9029634705962206,2025-04-24 21:09:37.236863,2025-04-24 21:09:38.073036,0 days 00:00:00.836173,squared_error,34,log2,1,15,random,TPESampler,COMPLETE
1399,0.894550859606008,2025-04-24 21:09:37.473912,2025-04-24 21:09:38.317749,0 days 00:00:00.843837,squared_error,35,sqrt,8,18,best,TPESampler,COMPLETE
1400,0.6689797096059603,2025-04-24 21:09:38.006061,2025-04-24 21:09:38.778372,0 days 00:00:00.772311,squared_error,30,log2,1,11,best,TPESampler,COMPLETE
1401,0.5128537554029937,2025-04-24 21:09:38.454749,2025-04-24 21:09:39.380550,0 days 00:00:00.925801,squared_error,35,log2,1,11,best,TPESampler,COMPLETE
1402,0.7975493713728398,2025-04-24 21:09:38.643871,2025-04-24 21:09:39.552323,0 days 00:00:00.908452,squared_error,35,log2,3,12,best,TPESampler,COMPLETE
1403,0.57337827941785,2025-04-24 21:09:39.052889,2025-04-24 21:09:40.156774,0 days 00:00:01.103885,squared_error,15,sqrt,1,10,best,TPESampler,COMPLETE
1404,0.7975493713728398,2025-04-24 21:09:39.862382,2025-04-24 21:09:40.696222,0 days 00:00:00.833840,squared_error,30,log2,3,7,best,TPESampler,COMPLETE
1405,0.9366032534973519,2025-04-24 21:09:40.013131,2025-04-24 21:09:41.018075,0 days 00:00:01.004944,squared_error,7,sqrt,1,3,random,TPESampler,COMPLETE
1406,1.0234382327956146,2025-04-24 21:09:40.429867,2025-04-24 21:09:41.263430,0 days 00:00:00.833563,absolute_error,4,sqrt,10,5,best,TPESampler,COMPLETE
1407,0.7975493713728398,2025-04-24 21:09:40.953606,2025-04-24 21:09:41.668653,0 days 00:00:00.715047,squared_error,30,log2,2,12,best,TPESampler,COMPLETE
1408,0.8942042180115075,2025-04-24 21:09:41.342047,2025-04-24 21:09:42.255394,0 days 00:00:00.913347,squared_error,20,sqrt,10,10,best,TPESampler,COMPLETE
1409,0.4948844885027081,2025-04-24 21:09:41.533930,2025-04-24 21:09:42.403933,0 days 00:00:00.870003,squared_error,35,log2,1,9,best,TPESampler,COMPLETE
1410,0.5128537554029937,2025-04-24 21:09:41.905468,2025-04-24 21:09:42.664238,0 days 00:00:00.758770,squared_error,35,log2,1,11,best,TPESampler,COMPLETE
1411,0.44670023329729247,2025-04-24 21:09:42.531993,2025-04-24 21:09:43.748841,0 days 00:00:01.216848,squared_error,35,log2,1,7,best,TPESampler,COMPLETE
1412,0.48051683833886516,2025-04-24 21:09:42.616541,2025-04-24 21:09:43.413767,0 days 00:00:00.797226,squared_error,35,log2,1,8,best,TPESampler,COMPLETE
1413,0.6756408221672622,2025-04-24 21:09:42.916790,2025-04-24 21:09:43.821031,0 days 00:00:00.904241,squared_error,30,log2,1,8,best,TPESampler,COMPLETE
1414,0.5128537554029937,2025-04-24 21:09:43.692937,2025-04-24 21:09:44.937808,0 days 00:00:01.244871,squared_error,35,log2,1,11,best,TPESampler,COMPLETE
1415,0.7975493713728398,2025-04-24 21:09:44.095068,2025-04-24 21:09:45.176803,0 days 00:00:01.081735,squared_error,35,log2,3,9,best,TPESampler,COMPLETE
1416,0.7975493713728398,2025-04-24 21:09:44.141455,2025-04-24 21:09:45.470474,0 days 00:00:01.329019,squared_error,35,log2,3,11,best,TPESampler,COMPLETE
1417,0.7975493713728398,2025-04-24 21:09:45.321378,2025-04-24 21:09:46.233981,0 days 00:00:00.912603,squared_error,35,log2,2,14,best,TPESampler,COMPLETE
1418,0.6692087088741673,2025-04-24 21:09:45.756088,2025-04-24 21:09:46.600181,0 days 00:00:00.844093,squared_error,30,log2,1,9,best,TPESampler,COMPLETE
1419,0.6586011368319069,2025-04-24 21:09:45.965201,2025-04-24 21:09:46.963625,0 days 00:00:00.998424,squared_error,30,log2,1,14,best,TPESampler,COMPLETE
1420,0.7975493713728398,2025-04-24 21:09:46.543995,2025-04-24 21:09:47.264771,0 days 00:00:00.720776,squared_error,35,log2,3,6,best,TPESampler,COMPLETE
1421,0.4948844885027081,2025-04-24 21:09:46.962151,2025-04-24 21:09:47.858908,0 days 00:00:00.896757,squared_error,35,log2,1,9,best,TPESampler,COMPLETE
1422,0.6914253690247881,2025-04-24 21:09:47.252793,2025-04-24 21:09:48.231006,0 days 00:00:00.978213,squared_error,29,log2,1,11,best,TPESampler,COMPLETE
1423,0.6914253690247881,2025-04-24 21:09:47.541618,2025-04-24 21:09:48.438211,0 days 00:00:00.896593,squared_error,29,log2,1,11,best,TPESampler,COMPLETE
1424,0.48444975754384645,2025-04-24 21:09:48.140761,2025-04-24 21:09:48.813808,0 days 00:00:00.673047,squared_error,35,log2,1,14,best,TPESampler,COMPLETE
1425,0.4438474442892985,2025-04-24 21:09:48.526672,2025-04-24 21:09:49.403929,0 days 00:00:00.877257,squared_error,35,log2,1,10,best,TPESampler,COMPLETE
1426,0.6811438523657211,2025-04-24 21:09:48.672190,2025-04-24 21:09:49.560503,0 days 00:00:00.888313,friedman_mse,31,log2,1,15,best,TPESampler,COMPLETE
