number,value,datetime_start,datetime_complete,duration,params_criterion,params_max_depth,params_max_features,params_min_samples_leaf,params_min_samples_split,params_splitter,system_attrs_auto:sampler,state
2279,0.6756408221672622,2025-04-24 21:16:01.149732,2025-04-24 21:16:02.229711,0 days 00:00:01.079979,friedman_mse,30,log2,1,8,best,TPESampler,COMPLETE
2280,0.7975493713728398,2025-04-24 21:16:01.697363,2025-04-24 21:16:02.581471,0 days 00:00:00.884108,squared_error,30,log2,3,7,best,TPESampler,COMPLETE
2281,0.7975493713728398,2025-04-24 21:16:01.988437,2025-04-24 21:16:02.918181,0 days 00:00:00.929744,squared_error,25,log2,3,6,best,TPESampler,COMPLETE
2282,0.7975493713728398,2025-04-24 21:16:02.558873,2025-04-24 21:16:03.583806,0 days 00:00:01.024933,squared_error,35,log2,3,7,best,TPESampler,COMPLETE
2283,0.7975493713728398,2025-04-24 21:16:02.924780,2025-04-24 21:16:03.794794,0 days 00:00:00.870014,squared_error,35,log2,3,8,best,TPESampler,COMPLETE
2284,0.6914253690247881,2025-04-24 21:16:03.288829,2025-04-24 21:16:04.174649,0 days 00:00:00.885820,squared_error,29,log2,1,11,best,TPESampler,COMPLETE
2285,0.458106663082747,2025-04-24 21:16:03.861348,2025-04-24 21:16:04.984818,0 days 00:00:01.123470,squared_error,35,log2,1,6,best,TPESampler,COMPLETE
2286,0.4438474442892985,2025-04-24 21:16:04.167524,2025-04-24 21:16:05.070044,0 days 00:00:00.902520,squared_error,35,log2,1,10,best,TPESampler,COMPLETE
2287,0.7975493713728398,2025-04-24 21:16:04.780786,2025-04-24 21:16:05.880461,0 days 00:00:01.099675,squared_error,30,log2,3,14,best,TPESampler,COMPLETE
2288,0.7975493713728398,2025-04-24 21:16:05.264724,2025-04-24 21:16:06.169246,0 days 00:00:00.904522,friedman_mse,35,log2,2,10,best,TPESampler,COMPLETE
2289,0.4438474442892985,2025-04-24 21:16:05.538190,2025-04-24 21:16:06.630375,0 days 00:00:01.092185,squared_error,35,log2,1,10,best,TPESampler,COMPLETE
2290,0.9011184130241341,2025-04-24 21:16:06.214291,2025-04-24 21:16:07.367630,0 days 00:00:01.153339,squared_error,26,log2,1,7,random,TPESampler,COMPLETE
2291,0.4948844885027081,2025-04-24 21:16:06.433608,2025-04-24 21:16:07.525595,0 days 00:00:01.091987,squared_error,35,log2,1,9,best,TPESampler,COMPLETE
2292,0.6914253690247881,2025-04-24 21:16:06.992788,2025-04-24 21:16:07.828801,0 days 00:00:00.836013,squared_error,29,log2,1,11,best,TPESampler,COMPLETE
2293,0.4438474442892985,2025-04-24 21:16:07.638051,2025-04-24 21:16:08.866630,0 days 00:00:01.228579,squared_error,35,log2,1,10,best,TPESampler,COMPLETE
2294,0.9013604716534591,2025-04-24 21:16:07.780106,2025-04-24 21:16:08.881482,0 days 00:00:01.101376,friedman_mse,22,log2,1,15,random,TPESampler,COMPLETE
2295,0.5101622714757418,2025-04-24 21:16:08.360412,2025-04-24 21:16:09.280953,0 days 00:00:00.920541,squared_error,35,log2,1,13,best,TPESampler,COMPLETE
2296,0.7975493713728398,2025-04-24 21:16:09.107143,2025-04-24 21:16:10.238541,0 days 00:00:01.131398,squared_error,30,log2,3,10,best,TPESampler,COMPLETE
2297,0.6317023826094311,2025-04-24 21:16:09.162560,2025-04-24 21:16:10.239954,0 days 00:00:01.077394,friedman_mse,35,sqrt,2,10,best,TPESampler,COMPLETE
2298,0.6897684790416273,2025-04-24 21:16:09.601375,2025-04-24 21:16:10.463423,0 days 00:00:00.862048,squared_error,24,log2,1,8,best,TPESampler,COMPLETE
2299,0.7538962288842931,2025-04-24 21:16:10.509863,2025-04-24 21:16:11.455045,0 days 00:00:00.945182,squared_error,30,sqrt,1,11,best,TPESampler,COMPLETE
2300,0.8913351576037826,2025-04-24 21:16:10.574324,2025-04-24 21:16:11.877822,0 days 00:00:01.303498,squared_error,35,sqrt,3,11,best,TPESampler,COMPLETE
2301,0.6689797096059603,2025-04-24 21:16:10.702193,2025-04-24 21:16:11.826505,0 days 00:00:01.124312,squared_error,30,log2,1,11,best,TPESampler,COMPLETE
2302,0.7975493713728398,2025-04-24 21:16:11.717010,2025-04-24 21:16:12.775314,0 days 00:00:01.058304,squared_error,35,log2,2,11,best,TPESampler,COMPLETE
2303,0.7975493713728398,2025-04-24 21:16:12.117450,2025-04-24 21:16:13.129379,0 days 00:00:01.011929,squared_error,30,log2,2,8,best,TPESampler,COMPLETE
2304,0.7975493713728398,2025-04-24 21:16:12.163072,2025-04-24 21:16:13.163163,0 days 00:00:01.000091,squared_error,30,log2,2,9,best,TPESampler,COMPLETE
2305,0.4948844885027081,2025-04-24 21:16:13.059733,2025-04-24 21:16:13.808587,0 days 00:00:00.748854,squared_error,35,log2,1,9,best,TPESampler,COMPLETE
2306,0.6511497278763692,2025-04-24 21:16:13.409004,2025-04-24 21:16:14.673193,0 days 00:00:01.264189,squared_error,30,log2,1,7,best,TPESampler,COMPLETE
2307,0.7975493713728398,2025-04-24 21:16:13.487456,2025-04-24 21:16:14.750034,0 days 00:00:01.262578,squared_error,30,log2,2,11,best,TPESampler,COMPLETE
2308,0.44670023329729247,2025-04-24 21:16:14.454753,2025-04-24 21:16:15.356660,0 days 00:00:00.901907,squared_error,35,log2,1,7,best,TPESampler,COMPLETE
2309,0.6735913168527353,2025-04-24 21:16:14.944840,2025-04-24 21:16:16.066670,0 days 00:00:01.121830,squared_error,30,log2,1,10,best,TPESampler,COMPLETE
2310,0.5120876615801571,2025-04-24 21:16:15.208074,2025-04-24 21:16:16.339379,0 days 00:00:01.131305,squared_error,35,log2,1,12,best,TPESampler,COMPLETE
2311,0.7975493713728398,2025-04-24 21:16:15.751926,2025-04-24 21:16:16.775859,0 days 00:00:01.023933,squared_error,35,log2,3,10,best,TPESampler,COMPLETE
2312,0.7975493713728398,2025-04-24 21:16:16.418154,2025-04-24 21:16:17.506763,0 days 00:00:01.088609,squared_error,35,log2,2,9,best,TPESampler,COMPLETE
2313,0.5120876615801571,2025-04-24 21:16:16.821518,2025-04-24 21:16:17.902494,0 days 00:00:01.080976,squared_error,35,log2,1,12,best,TPESampler,COMPLETE
2314,0.6708356072336189,2025-04-24 21:16:17.294408,2025-04-24 21:16:18.424100,0 days 00:00:01.129692,squared_error,30,log2,1,12,best,TPESampler,COMPLETE
2315,0.9030907753187482,2025-04-24 21:16:17.858382,2025-04-24 21:16:18.764329,0 days 00:00:00.905947,squared_error,32,log2,1,8,random,TPESampler,COMPLETE
2316,0.4438474442892985,2025-04-24 21:16:18.180754,2025-04-24 21:16:19.123708,0 days 00:00:00.942954,squared_error,35,log2,1,10,best,TPESampler,COMPLETE
2317,0.44670023329729247,2025-04-24 21:16:18.710739,2025-04-24 21:16:19.477095,0 days 00:00:00.766356,squared_error,35,log2,1,7,best,TPESampler,COMPLETE
2318,0.671564007425267,2025-04-24 21:16:19.180032,2025-04-24 21:16:20.363868,0 days 00:00:01.183836,squared_error,30,log2,1,13,best,TPESampler,COMPLETE
2319,0.4948844885027081,2025-04-24 21:16:19.418121,2025-04-24 21:16:20.656057,0 days 00:00:01.237936,squared_error,35,log2,1,9,best,TPESampler,COMPLETE
2320,0.6392649452524175,2025-04-24 21:16:19.810403,2025-04-24 21:16:21.815520,0 days 00:00:02.005117,squared_error,31,sqrt,1,8,best,TPESampler,COMPLETE
2321,0.7975493713728398,2025-04-24 21:16:20.892847,2025-04-24 21:16:22.197278,0 days 00:00:01.304431,squared_error,35,log2,2,12,best,TPESampler,COMPLETE
2322,1.0007431665713944,2025-04-24 21:16:21.072166,2025-04-24 21:16:22.348843,0 days 00:00:01.276677,absolute_error,1,log2,9,2,random,TPESampler,COMPLETE
2323,0.5101622714757418,2025-04-24 21:16:22.129503,2025-04-24 21:16:23.264253,0 days 00:00:01.134750,squared_error,35,log2,1,13,best,TPESampler,COMPLETE
2324,0.7975493713728398,2025-04-24 21:16:22.499581,2025-04-24 21:16:23.806750,0 days 00:00:01.307169,friedman_mse,12,log2,3,20,best,TPESampler,COMPLETE
2325,0.7975493713728398,2025-04-24 21:16:22.639305,2025-04-24 21:16:23.557625,0 days 00:00:00.918320,squared_error,35,log2,3,12,best,TPESampler,COMPLETE
2326,0.6211745625966201,2025-04-24 21:16:23.513519,2025-04-24 21:16:24.464760,0 days 00:00:00.951241,absolute_error,29,log2,1,9,best,TPESampler,COMPLETE
2327,0.6737764944140061,2025-04-24 21:16:23.882158,2025-04-24 21:16:24.883855,0 days 00:00:01.001697,friedman_mse,31,log2,1,10,best,TPESampler,COMPLETE
2328,0.6747391651080636,2025-04-24 21:16:24.089126,2025-04-24 21:16:25.055809,0 days 00:00:00.966683,squared_error,29,log2,1,8,best,TPESampler,COMPLETE
2329,0.9671029066257907,2025-04-24 21:16:24.795308,2025-04-24 21:16:25.614074,0 days 00:00:00.818766,absolute_error,19,log2,5,14,random,TPESampler,COMPLETE
2330,0.5120876615801571,2025-04-24 21:16:25.250992,2025-04-24 21:16:26.272914,0 days 00:00:01.021922,squared_error,35,log2,1,12,best,TPESampler,COMPLETE
2331,0.48051683833886516,2025-04-24 21:16:25.471482,2025-04-24 21:16:26.585029,0 days 00:00:01.113547,squared_error,35,log2,1,8,best,TPESampler,COMPLETE
2332,0.44670023329729247,2025-04-24 21:16:25.958711,2025-04-24 21:16:26.768585,0 days 00:00:00.809874,squared_error,35,log2,1,7,best,TPESampler,COMPLETE
2333,0.5436620092712224,2025-04-24 21:16:26.677740,2025-04-24 21:16:27.430682,0 days 00:00:00.752942,friedman_mse,35,log2,1,5,best,TPESampler,COMPLETE
2334,0.786987845634963,2025-04-24 21:16:26.910738,2025-04-24 21:16:28.057637,0 days 00:00:01.146899,absolute_error,35,log2,2,10,best,TPESampler,COMPLETE
2335,0.922426147955362,2025-04-24 21:16:27.093961,2025-04-24 21:16:28.153623,0 days 00:00:01.059662,squared_error,34,log2,3,9,random,TPESampler,COMPLETE
2336,0.9255759610404857,2025-04-24 21:16:27.759232,2025-04-24 21:16:28.543710,0 days 00:00:00.784478,friedman_mse,11,sqrt,4,5,random,TPESampler,COMPLETE
2337,0.48444975754384645,2025-04-24 21:16:28.338312,2025-04-24 21:16:29.469658,0 days 00:00:01.131346,friedman_mse,35,log2,1,14,best,TPESampler,COMPLETE
2338,1.0007431665713944,2025-04-24 21:16:28.391957,2025-04-24 21:16:29.461908,0 days 00:00:01.069951,absolute_error,26,log2,4,2,best,TPESampler,COMPLETE
2339,0.7975493713728398,2025-04-24 21:16:29.109457,2025-04-24 21:16:29.952148,0 days 00:00:00.842691,squared_error,30,log2,3,8,best,TPESampler,COMPLETE
2340,0.6747391651080636,2025-04-24 21:16:29.685042,2025-04-24 21:16:30.755386,0 days 00:00:01.070344,squared_error,29,log2,1,8,best,TPESampler,COMPLETE
2341,1.0007431665713944,2025-04-24 21:16:29.735309,2025-04-24 21:16:30.738589,0 days 00:00:01.003280,absolute_error,23,log2,6,14,best,TPESampler,COMPLETE
2342,0.8278238927609931,2025-04-24 21:16:30.336938,2025-04-24 21:16:31.099332,0 days 00:00:00.762394,absolute_error,35,log2,1,3,best,TPESampler,COMPLETE
2343,0.7975493713728398,2025-04-24 21:16:30.982091,2025-04-24 21:16:31.923509,0 days 00:00:00.941418,squared_error,35,log2,3,11,best,TPESampler,COMPLETE
2344,0.7975493713728398,2025-04-24 21:16:31.029510,2025-04-24 21:16:32.202610,0 days 00:00:01.173100,squared_error,35,log2,3,14,best,TPESampler,COMPLETE
2345,0.8909138482452268,2025-04-24 21:16:31.459432,2025-04-24 21:16:32.633144,0 days 00:00:01.173712,friedman_mse,17,sqrt,4,8,best,TPESampler,COMPLETE
2346,0.4438474442892985,2025-04-24 21:16:32.267902,2025-04-24 21:16:33.288875,0 days 00:00:01.020973,squared_error,35,log2,1,10,best,TPESampler,COMPLETE
2347,0.6545164836672983,2025-04-24 21:16:32.486990,2025-04-24 21:16:33.464652,0 days 00:00:00.977662,squared_error,29,log2,1,9,best,TPESampler,COMPLETE
2348,0.7975493713728398,2025-04-24 21:16:32.924909,2025-04-24 21:16:33.787239,0 days 00:00:00.862330,friedman_mse,35,log2,3,11,best,TPESampler,COMPLETE
2349,0.7975493713728398,2025-04-24 21:16:33.662147,2025-04-24 21:16:34.703225,0 days 00:00:01.041078,squared_error,29,log2,2,13,best,TPESampler,COMPLETE
2350,0.5128537554029937,2025-04-24 21:16:33.739927,2025-04-24 21:16:34.718322,0 days 00:00:00.978395,squared_error,35,log2,1,11,best,TPESampler,COMPLETE
2351,0.6756408221672622,2025-04-24 21:16:34.314398,2025-04-24 21:16:35.594373,0 days 00:00:01.279975,squared_error,30,log2,1,8,best,TPESampler,COMPLETE
2352,0.7975493713728398,2025-04-24 21:16:34.938212,2025-04-24 21:16:35.951455,0 days 00:00:01.013243,squared_error,35,log2,3,10,best,TPESampler,COMPLETE
2353,0.7975493713728398,2025-04-24 21:16:34.979908,2025-04-24 21:16:36.007913,0 days 00:00:01.028005,squared_error,30,log2,3,10,best,TPESampler,COMPLETE
2354,0.9494322793442198,2025-04-24 21:16:35.881345,2025-04-24 21:16:36.819421,0 days 00:00:00.938076,squared_error,34,log2,6,17,best,TPESampler,COMPLETE
2355,0.4438474442892985,2025-04-24 21:16:36.211755,2025-04-24 21:16:37.112030,0 days 00:00:00.900275,squared_error,35,log2,1,10,best,TPESampler,COMPLETE
2356,0.8876713258154219,2025-04-24 21:16:36.269643,2025-04-24 21:16:37.527465,0 days 00:00:01.257822,squared_error,29,sqrt,5,17,best,TPESampler,COMPLETE
2357,0.6822475001707234,2025-04-24 21:16:37.132845,2025-04-24 21:16:38.230931,0 days 00:00:01.098086,absolute_error,35,log2,1,14,best,TPESampler,COMPLETE
2358,0.4438474442892985,2025-04-24 21:16:37.372791,2025-04-24 21:16:38.396146,0 days 00:00:01.023355,squared_error,35,log2,1,10,best,TPESampler,COMPLETE
2359,0.7975493713728398,2025-04-24 21:16:37.830844,2025-04-24 21:16:38.721657,0 days 00:00:00.890813,squared_error,35,log2,2,7,best,TPESampler,COMPLETE
2360,0.6689797096059603,2025-04-24 21:16:38.620458,2025-04-24 21:16:39.636071,0 days 00:00:01.015613,squared_error,30,log2,1,11,best,TPESampler,COMPLETE
2361,0.7975493713728398,2025-04-24 21:16:38.685038,2025-04-24 21:16:39.878728,0 days 00:00:01.193690,squared_error,35,log2,2,13,best,TPESampler,COMPLETE
2362,0.7975493713728398,2025-04-24 21:16:39.012821,2025-04-24 21:16:39.961583,0 days 00:00:00.948762,squared_error,35,log2,3,9,best,TPESampler,COMPLETE
2363,0.6692087088741673,2025-04-24 21:16:39.907433,2025-04-24 21:16:41.068139,0 days 00:00:01.160706,squared_error,30,log2,1,9,best,TPESampler,COMPLETE
2364,0.6756408221672622,2025-04-24 21:16:40.113729,2025-04-24 21:16:41.359175,0 days 00:00:01.245446,squared_error,30,log2,1,8,best,TPESampler,COMPLETE
2365,0.6708356072336189,2025-04-24 21:16:40.342138,2025-04-24 21:16:41.541966,0 days 00:00:01.199828,squared_error,30,log2,1,12,best,TPESampler,COMPLETE
2366,0.7975493713728398,2025-04-24 21:16:41.302570,2025-04-24 21:16:42.047818,0 days 00:00:00.745248,squared_error,35,log2,2,9,best,TPESampler,COMPLETE
2367,0.5120876615801571,2025-04-24 21:16:41.610957,2025-04-24 21:16:42.872237,0 days 00:00:01.261280,squared_error,35,log2,1,12,best,TPESampler,COMPLETE
2368,0.7975493713728398,2025-04-24 21:16:41.820545,2025-04-24 21:16:42.879125,0 days 00:00:01.058580,squared_error,35,log2,2,11,best,TPESampler,COMPLETE
2369,0.7975493713728398,2025-04-24 21:16:42.396144,2025-04-24 21:16:43.160918,0 days 00:00:00.764774,squared_error,29,log2,3,14,best,TPESampler,COMPLETE
2370,0.4948844885027081,2025-04-24 21:16:43.124663,2025-04-24 21:16:44.182133,0 days 00:00:01.057470,squared_error,35,log2,1,9,best,TPESampler,COMPLETE
2371,0.7975493713728398,2025-04-24 21:16:43.169603,2025-04-24 21:16:44.096184,0 days 00:00:00.926581,squared_error,35,log2,3,5,best,TPESampler,COMPLETE
2372,0.6692087088741673,2025-04-24 21:16:43.714736,2025-04-24 21:16:44.574715,0 days 00:00:00.859979,squared_error,30,log2,1,9,best,TPESampler,COMPLETE
2373,0.458106663082747,2025-04-24 21:16:44.479617,2025-04-24 21:16:45.478467,0 days 00:00:00.998850,squared_error,35,log2,1,6,best,TPESampler,COMPLETE
2374,0.5995580378238244,2025-04-24 21:16:44.538442,2025-04-24 21:16:45.553535,0 days 00:00:01.015093,squared_error,35,sqrt,1,7,best,TPESampler,COMPLETE
2375,0.5120876615801571,2025-04-24 21:16:45.087772,2025-04-24 21:16:45.875550,0 days 00:00:00.787778,squared_error,35,log2,1,12,best,TPESampler,COMPLETE
2376,0.922426147955362,2025-04-24 21:16:45.775945,2025-04-24 21:16:46.838745,0 days 00:00:01.062800,squared_error,13,log2,3,10,random,TPESampler,COMPLETE
2377,0.7975493713728398,2025-04-24 21:16:45.836506,2025-04-24 21:16:46.724089,0 days 00:00:00.887583,squared_error,30,log2,3,12,best,TPESampler,COMPLETE
2378,0.48732093497631573,2025-04-24 21:16:46.153283,2025-04-24 21:16:47.169080,0 days 00:00:01.015797,friedman_mse,34,log2,1,10,best,TPESampler,COMPLETE
2379,0.7975493713728398,2025-04-24 21:16:47.084648,2025-04-24 21:16:47.858590,0 days 00:00:00.773942,squared_error,30,log2,2,11,best,TPESampler,COMPLETE
2380,0.7975493713728398,2025-04-24 21:16:47.130560,2025-04-24 21:16:48.148543,0 days 00:00:01.017983,squared_error,29,log2,3,10,best,TPESampler,COMPLETE
2381,0.7975493713728398,2025-04-24 21:16:47.531100,2025-04-24 21:16:48.560159,0 days 00:00:01.029059,squared_error,24,log2,2,10,best,TPESampler,COMPLETE
2382,0.671564007425267,2025-04-24 21:16:48.204696,2025-04-24 21:16:49.181831,0 days 00:00:00.977135,squared_error,30,log2,1,13,best,TPESampler,COMPLETE
2383,0.7225064406780577,2025-04-24 21:16:48.440576,2025-04-24 21:16:49.355778,0 days 00:00:00.915202,squared_error,23,log2,1,12,best,TPESampler,COMPLETE
2384,0.6692087088741673,2025-04-24 21:16:48.816664,2025-04-24 21:16:49.628906,0 days 00:00:00.812242,squared_error,30,log2,1,9,best,TPESampler,COMPLETE
2385,0.4948844885027081,2025-04-24 21:16:49.542405,2025-04-24 21:16:50.670946,0 days 00:00:01.128541,squared_error,35,log2,1,9,best,TPESampler,COMPLETE
2386,0.4948844885027081,2025-04-24 21:16:49.584218,2025-04-24 21:16:50.736492,0 days 00:00:01.152274,squared_error,35,log2,1,9,best,TPESampler,COMPLETE
2387,0.48051683833886516,2025-04-24 21:16:49.869583,2025-04-24 21:16:50.937112,0 days 00:00:01.067529,squared_error,35,log2,1,8,best,TPESampler,COMPLETE
2388,0.9494322793442198,2025-04-24 21:16:50.888236,2025-04-24 21:16:51.930008,0 days 00:00:01.041772,squared_error,4,log2,9,4,best,TPESampler,COMPLETE
2389,0.6708356072336189,2025-04-24 21:16:51.185032,2025-04-24 21:16:52.481104,0 days 00:00:01.296072,squared_error,30,log2,1,12,best,TPESampler,COMPLETE
2390,0.5101622714757418,2025-04-24 21:16:51.694560,2025-04-24 21:16:52.835157,0 days 00:00:01.140597,squared_error,35,log2,1,13,best,TPESampler,COMPLETE
2391,0.9245771875115085,2025-04-24 21:16:52.221540,2025-04-24 21:16:53.203354,0 days 00:00:00.981814,friedman_mse,34,sqrt,3,6,random,TPESampler,COMPLETE
2392,0.7975493713728398,2025-04-24 21:16:52.847569,2025-04-24 21:16:53.840192,0 days 00:00:00.992623,squared_error,35,log2,2,11,best,TPESampler,COMPLETE
2393,0.7975493713728398,2025-04-24 21:16:53.063020,2025-04-24 21:16:54.057244,0 days 00:00:00.994224,squared_error,35,log2,2,9,best,TPESampler,COMPLETE
2394,0.7975493713728398,2025-04-24 21:16:53.512865,2025-04-24 21:16:54.462133,0 days 00:00:00.949268,squared_error,35,log2,3,11,best,TPESampler,COMPLETE
2395,0.6708356072336189,2025-04-24 21:16:54.105278,2025-04-24 21:16:55.024969,0 days 00:00:00.919691,squared_error,30,log2,1,12,best,TPESampler,COMPLETE
2396,0.6735913168527353,2025-04-24 21:16:54.330540,2025-04-24 21:16:55.431050,0 days 00:00:01.100510,squared_error,30,log2,1,10,best,TPESampler,COMPLETE
2397,0.4948844885027081,2025-04-24 21:16:54.795230,2025-04-24 21:16:55.869678,0 days 00:00:01.074448,squared_error,35,log2,1,9,best,TPESampler,COMPLETE
2398,0.7975493713728398,2025-04-24 21:16:55.316448,2025-04-24 21:16:56.267188,0 days 00:00:00.950740,squared_error,30,log2,2,5,best,TPESampler,COMPLETE
2399,0.9026941259161437,2025-04-24 21:16:55.807441,2025-04-24 21:16:56.636147,0 days 00:00:00.828706,squared_error,35,log2,1,7,random,TPESampler,COMPLETE
2400,0.5120876615801571,2025-04-24 21:16:56.254376,2025-04-24 21:16:57.291514,0 days 00:00:01.037138,squared_error,35,log2,1,12,best,TPESampler,COMPLETE
2401,0.6692087088741673,2025-04-24 21:16:56.552355,2025-04-24 21:16:57.567564,0 days 00:00:01.015209,squared_error,30,log2,1,9,best,TPESampler,COMPLETE
2402,0.4438474442892985,2025-04-24 21:16:56.954974,2025-04-24 21:16:58.154610,0 days 00:00:01.199636,squared_error,35,log2,1,10,best,TPESampler,COMPLETE
2403,0.46385297432679357,2025-04-24 21:16:57.574763,2025-04-24 21:16:58.476672,0 days 00:00:00.901909,squared_error,35,log2,1,15,best,TPESampler,COMPLETE
2404,0.44670023329729247,2025-04-24 21:16:57.886199,2025-04-24 21:16:59.042558,0 days 00:00:01.156359,squared_error,35,log2,1,7,best,TPESampler,COMPLETE
2405,0.9993409537053991,2025-04-24 21:16:58.469154,2025-04-24 21:16:59.443906,0 days 00:00:00.974752,absolute_error,25,sqrt,10,4,random,TPESampler,COMPLETE
2406,0.7975493713728398,2025-04-24 21:16:58.796808,2025-04-24 21:16:59.754380,0 days 00:00:00.957572,squared_error,35,log2,3,7,best,TPESampler,COMPLETE
2407,0.7975493713728398,2025-04-24 21:16:59.378652,2025-04-24 21:17:00.131313,0 days 00:00:00.752661,friedman_mse,35,log2,2,7,best,TPESampler,COMPLETE
2408,0.6486758301127608,2025-04-24 21:16:59.804946,2025-04-24 21:17:00.862596,0 days 00:00:01.057650,squared_error,29,log2,1,7,best,TPESampler,COMPLETE
2409,0.7975493713728398,2025-04-24 21:17:00.117977,2025-04-24 21:17:01.065270,0 days 00:00:00.947293,squared_error,29,log2,3,10,best,TPESampler,COMPLETE
2410,0.9624189975311311,2025-04-24 21:17:00.455619,2025-04-24 21:17:01.338034,0 days 00:00:00.882415,absolute_error,35,log2,1,17,random,TPESampler,COMPLETE
2411,1.0234382327956146,2025-04-24 21:17:01.122307,2025-04-24 21:17:02.296952,0 days 00:00:01.174645,absolute_error,11,sqrt,8,5,best,TPESampler,COMPLETE
2412,0.4438474442892985,2025-04-24 21:17:01.335388,2025-04-24 21:17:02.427718,0 days 00:00:01.092330,squared_error,35,log2,1,10,best,TPESampler,COMPLETE
2413,0.8876713258154219,2025-04-24 21:17:01.782898,2025-04-24 21:17:02.772725,0 days 00:00:00.989827,squared_error,11,sqrt,6,20,best,TPESampler,COMPLETE
2414,0.8991600557359704,2025-04-24 21:17:02.671013,2025-04-24 21:17:03.762774,0 days 00:00:01.091761,squared_error,30,log2,1,12,random,TPESampler,COMPLETE
2415,0.6689797096059603,2025-04-24 21:17:02.736986,2025-04-24 21:17:03.847042,0 days 00:00:01.110056,squared_error,30,log2,1,11,best,TPESampler,COMPLETE
2416,0.4438474442892985,2025-04-24 21:17:03.068015,2025-04-24 21:17:04.220468,0 days 00:00:01.152453,squared_error,35,log2,1,10,best,TPESampler,COMPLETE
2417,0.6317023826094311,2025-04-24 21:17:04.124688,2025-04-24 21:17:05.087479,0 days 00:00:00.962791,squared_error,35,sqrt,2,10,best,TPESampler,COMPLETE
2418,0.7975493713728398,2025-04-24 21:17:04.177963,2025-04-24 21:17:05.466909,0 days 00:00:01.288946,squared_error,35,log2,3,9,best,TPESampler,COMPLETE
2419,0.7975493713728398,2025-04-24 21:17:04.494744,2025-04-24 21:17:05.651836,0 days 00:00:01.157092,squared_error,35,log2,2,7,best,TPESampler,COMPLETE
2420,0.7975493713728398,2025-04-24 21:17:05.383096,2025-04-24 21:17:06.403997,0 days 00:00:01.020901,squared_error,35,log2,2,10,best,TPESampler,COMPLETE
