number,value,datetime_start,datetime_complete,duration,params_criterion,params_max_depth,params_max_features,params_min_samples_leaf,params_min_samples_split,params_splitter,system_attrs_auto:sampler,state
715,0.6747391651080636,2025-04-24 21:05:04.310514,2025-04-24 21:05:05.158637,0 days 00:00:00.848123,squared_error,29,log2,1,8,best,TPESampler,COMPLETE
716,0.4438474442892985,2025-04-24 21:05:04.364611,2025-04-24 21:05:05.160661,0 days 00:00:00.796050,squared_error,35,log2,1,10,best,TPESampler,COMPLETE
717,0.7975493713728398,2025-04-24 21:05:04.819908,2025-04-24 21:05:05.638309,0 days 00:00:00.818401,squared_error,31,log2,3,11,best,TPESampler,COMPLETE
718,0.4948844885027081,2025-04-24 21:05:05.413343,2025-04-24 21:05:06.784051,0 days 00:00:01.370708,squared_error,35,log2,1,9,best,TPESampler,COMPLETE
719,0.7975493713728398,2025-04-24 21:05:05.483944,2025-04-24 21:05:06.711035,0 days 00:00:01.227091,squared_error,35,log2,3,11,best,TPESampler,COMPLETE
720,0.5120876615801571,2025-04-24 21:05:05.940310,2025-04-24 21:05:07.185180,0 days 00:00:01.244870,squared_error,35,log2,1,12,best,TPESampler,COMPLETE
721,0.6702958143159663,2025-04-24 21:05:07.093277,2025-04-24 21:05:07.909443,0 days 00:00:00.816166,squared_error,29,log2,1,13,best,TPESampler,COMPLETE
722,0.8913351576037826,2025-04-24 21:05:07.149330,2025-04-24 21:05:08.115399,0 days 00:00:00.966069,squared_error,34,sqrt,3,10,best,TPESampler,COMPLETE
723,0.7975493713728398,2025-04-24 21:05:07.425167,2025-04-24 21:05:08.255236,0 days 00:00:00.830069,squared_error,35,log2,3,12,best,TPESampler,COMPLETE
724,0.9524425849299664,2025-04-24 21:05:08.168522,2025-04-24 21:05:08.824598,0 days 00:00:00.656076,squared_error,1,sqrt,2,7,best,TPESampler,COMPLETE
725,0.6708356072336189,2025-04-24 21:05:08.397034,2025-04-24 21:05:09.127660,0 days 00:00:00.730626,squared_error,30,log2,1,12,best,TPESampler,COMPLETE
726,0.5128537554029937,2025-04-24 21:05:08.755749,2025-04-24 21:05:09.519306,0 days 00:00:00.763557,squared_error,35,log2,1,11,best,TPESampler,COMPLETE
727,0.5128537554029937,2025-04-24 21:05:09.075673,2025-04-24 21:05:09.805880,0 days 00:00:00.730207,squared_error,35,log2,1,11,best,TPESampler,COMPLETE
728,0.7975493713728398,2025-04-24 21:05:09.376034,2025-04-24 21:05:10.118971,0 days 00:00:00.742937,squared_error,35,log2,3,9,best,TPESampler,COMPLETE
729,0.4948844885027081,2025-04-24 21:05:09.741002,2025-04-24 21:05:10.529299,0 days 00:00:00.788297,squared_error,35,log2,1,9,best,TPESampler,COMPLETE
730,0.6914253690247881,2025-04-24 21:05:10.070317,2025-04-24 21:05:10.823195,0 days 00:00:00.752878,squared_error,29,log2,1,11,best,TPESampler,COMPLETE
731,0.6756408221672622,2025-04-24 21:05:10.376175,2025-04-24 21:05:11.347147,0 days 00:00:00.970972,squared_error,30,log2,1,8,best,TPESampler,COMPLETE
732,0.4438474442892985,2025-04-24 21:05:10.826943,2025-04-24 21:05:11.532305,0 days 00:00:00.705362,squared_error,35,log2,1,10,best,TPESampler,COMPLETE
733,0.7102428557456395,2025-04-24 21:05:11.103290,2025-04-24 21:05:11.831946,0 days 00:00:00.728656,squared_error,19,log2,1,10,best,TPESampler,COMPLETE
734,0.7975493713728398,2025-04-24 21:05:11.615936,2025-04-24 21:05:12.358916,0 days 00:00:00.742980,squared_error,35,log2,3,8,best,TPESampler,COMPLETE
735,0.5455758555249035,2025-04-24 21:05:11.716466,2025-04-24 21:05:12.587376,0 days 00:00:00.870910,squared_error,27,sqrt,1,9,best,TPESampler,COMPLETE
736,1.0007431665713944,2025-04-24 21:05:12.124858,2025-04-24 21:05:12.925196,0 days 00:00:00.800338,absolute_error,17,log2,7,17,random,TPESampler,COMPLETE
737,0.4948844885027081,2025-04-24 21:05:12.653639,2025-04-24 21:05:13.646240,0 days 00:00:00.992601,squared_error,35,log2,1,9,best,TPESampler,COMPLETE
738,0.6765049187574741,2025-04-24 21:05:12.931362,2025-04-24 21:05:14.119720,0 days 00:00:01.188358,squared_error,29,log2,1,10,best,TPESampler,COMPLETE
739,1.028030364428894,2025-04-24 21:05:13.574607,2025-04-24 21:05:14.657976,0 days 00:00:01.083369,absolute_error,2,sqrt,5,9,best,TPESampler,COMPLETE
740,0.5101622714757418,2025-04-24 21:05:13.949836,2025-04-24 21:05:15.423658,0 days 00:00:01.473822,squared_error,35,log2,1,13,best,TPESampler,COMPLETE
741,0.7975493713728398,2025-04-24 21:05:14.601784,2025-04-24 21:05:15.807796,0 days 00:00:01.206012,squared_error,28,log2,3,9,best,TPESampler,COMPLETE
742,0.4948844885027081,2025-04-24 21:05:15.052262,2025-04-24 21:05:16.552538,0 days 00:00:01.500276,squared_error,35,log2,1,9,best,TPESampler,COMPLETE
743,0.972901152467277,2025-04-24 21:05:15.849544,2025-04-24 21:05:16.739852,0 days 00:00:00.890308,absolute_error,29,sqrt,4,9,random,TPESampler,COMPLETE
744,0.9671029066257907,2025-04-24 21:05:16.166521,2025-04-24 21:05:17.005884,0 days 00:00:00.839363,absolute_error,13,log2,4,12,random,TPESampler,COMPLETE
745,0.4438474442892985,2025-04-24 21:05:16.848537,2025-04-24 21:05:17.602856,0 days 00:00:00.754319,squared_error,35,log2,1,10,best,TPESampler,COMPLETE
746,0.6692087088741673,2025-04-24 21:05:16.969875,2025-04-24 21:05:18.039042,0 days 00:00:01.069167,squared_error,30,log2,1,9,best,TPESampler,COMPLETE
747,0.48444975754384645,2025-04-24 21:05:17.277402,2025-04-24 21:05:18.229688,0 days 00:00:00.952286,friedman_mse,35,log2,1,14,best,TPESampler,COMPLETE
748,0.6708356072336189,2025-04-24 21:05:17.970378,2025-04-24 21:05:18.655046,0 days 00:00:00.684668,squared_error,30,log2,1,12,best,TPESampler,COMPLETE
749,0.7975493713728398,2025-04-24 21:05:18.346940,2025-04-24 21:05:19.177582,0 days 00:00:00.830642,squared_error,35,log2,2,8,best,TPESampler,COMPLETE
750,0.7975493713728398,2025-04-24 21:05:18.531382,2025-04-24 21:05:19.357377,0 days 00:00:00.825995,squared_error,35,log2,2,14,best,TPESampler,COMPLETE
751,0.4948844885027081,2025-04-24 21:05:18.887380,2025-04-24 21:05:19.696367,0 days 00:00:00.808987,squared_error,35,log2,1,9,best,TPESampler,COMPLETE
752,0.7975493713728398,2025-04-24 21:05:19.548147,2025-04-24 21:05:20.388919,0 days 00:00:00.840772,squared_error,28,log2,2,8,best,TPESampler,COMPLETE
753,0.5128537554029937,2025-04-24 21:05:19.628280,2025-04-24 21:05:20.632390,0 days 00:00:01.004110,squared_error,35,log2,1,11,best,TPESampler,COMPLETE
754,0.5128537554029937,2025-04-24 21:05:19.910198,2025-04-24 21:05:20.734667,0 days 00:00:00.824469,squared_error,35,log2,1,11,best,TPESampler,COMPLETE
755,0.7006299436730432,2025-04-24 21:05:20.643784,2025-04-24 21:05:21.300634,0 days 00:00:00.656850,friedman_mse,25,log2,1,5,best,TPESampler,COMPLETE
756,0.5120876615801571,2025-04-24 21:05:20.851815,2025-04-24 21:05:21.590649,0 days 00:00:00.738834,squared_error,35,log2,1,12,best,TPESampler,COMPLETE
757,0.5101622714757418,2025-04-24 21:05:21.178384,2025-04-24 21:05:22.084240,0 days 00:00:00.905856,squared_error,35,log2,1,13,best,TPESampler,COMPLETE
758,0.7975493713728398,2025-04-24 21:05:21.595321,2025-04-24 21:05:22.277314,0 days 00:00:00.681993,squared_error,34,log2,3,9,best,TPESampler,COMPLETE
759,0.9494322793442198,2025-04-24 21:05:21.883074,2025-04-24 21:05:22.564171,0 days 00:00:00.681097,squared_error,12,log2,10,5,best,TPESampler,COMPLETE
760,0.6486758301127608,2025-04-24 21:05:22.399438,2025-04-24 21:05:23.112248,0 days 00:00:00.712810,squared_error,29,log2,1,7,best,TPESampler,COMPLETE
761,0.47276956250391633,2025-04-24 21:05:22.519572,2025-04-24 21:05:23.429267,0 days 00:00:00.909695,friedman_mse,34,log2,1,7,best,TPESampler,COMPLETE
762,0.7975493713728398,2025-04-24 21:05:22.822780,2025-04-24 21:05:23.650468,0 days 00:00:00.827688,squared_error,35,log2,3,12,best,TPESampler,COMPLETE
763,0.7975493713728398,2025-04-24 21:05:23.375194,2025-04-24 21:05:24.124302,0 days 00:00:00.749108,squared_error,35,log2,3,9,best,TPESampler,COMPLETE
764,0.6689797096059603,2025-04-24 21:05:23.719127,2025-04-24 21:05:24.421052,0 days 00:00:00.701925,squared_error,30,log2,1,11,best,TPESampler,COMPLETE
765,0.786987845634963,2025-04-24 21:05:23.885603,2025-04-24 21:05:24.772052,0 days 00:00:00.886449,absolute_error,35,log2,3,12,best,TPESampler,COMPLETE
766,0.7975493713728398,2025-04-24 21:05:24.425978,2025-04-24 21:05:25.248651,0 days 00:00:00.822673,squared_error,27,log2,3,12,best,TPESampler,COMPLETE
767,0.6317023826094311,2025-04-24 21:05:24.657868,2025-04-24 21:05:25.452865,0 days 00:00:00.794997,squared_error,35,sqrt,2,10,best,TPESampler,COMPLETE
768,0.7975493713728398,2025-04-24 21:05:24.998003,2025-04-24 21:05:25.774270,0 days 00:00:00.776267,squared_error,35,log2,2,7,best,TPESampler,COMPLETE
769,0.7975493713728398,2025-04-24 21:05:25.510943,2025-04-24 21:05:26.200102,0 days 00:00:00.689159,squared_error,27,log2,3,20,best,TPESampler,COMPLETE
770,0.8942042180115075,2025-04-24 21:05:25.767453,2025-04-24 21:05:26.515736,0 days 00:00:00.748283,squared_error,5,sqrt,10,8,best,TPESampler,COMPLETE
771,0.5128537554029937,2025-04-24 21:05:26.026040,2025-04-24 21:05:26.948513,0 days 00:00:00.922473,squared_error,35,log2,1,11,best,TPESampler,COMPLETE
772,0.786987845634963,2025-04-24 21:05:26.514453,2025-04-24 21:05:27.423036,0 days 00:00:00.908583,absolute_error,28,log2,2,10,best,TPESampler,COMPLETE
773,0.7975493713728398,2025-04-24 21:05:26.962428,2025-04-24 21:05:27.733082,0 days 00:00:00.770654,squared_error,35,log2,3,9,best,TPESampler,COMPLETE
774,0.6545164836672983,2025-04-24 21:05:27.311521,2025-04-24 21:05:28.122681,0 days 00:00:00.811160,squared_error,29,log2,1,9,best,TPESampler,COMPLETE
775,0.4948844885027081,2025-04-24 21:05:27.679756,2025-04-24 21:05:28.611456,0 days 00:00:00.931700,squared_error,35,log2,1,9,best,TPESampler,COMPLETE
776,0.6765049187574741,2025-04-24 21:05:28.001900,2025-04-24 21:05:28.791521,0 days 00:00:00.789621,squared_error,29,log2,1,10,best,TPESampler,COMPLETE
777,0.4948844885027081,2025-04-24 21:05:28.375815,2025-04-24 21:05:29.072843,0 days 00:00:00.697028,squared_error,35,log2,1,9,best,TPESampler,COMPLETE
778,0.7975493713728398,2025-04-24 21:05:28.889149,2025-04-24 21:05:29.880199,0 days 00:00:00.991050,squared_error,30,log2,2,10,best,TPESampler,COMPLETE
779,0.7975493713728398,2025-04-24 21:05:29.024860,2025-04-24 21:05:30.130463,0 days 00:00:01.105603,squared_error,29,log2,3,12,best,TPESampler,COMPLETE
780,0.8876713258154219,2025-04-24 21:05:29.307243,2025-04-24 21:05:30.254075,0 days 00:00:00.946832,squared_error,7,sqrt,5,16,best,TPESampler,COMPLETE
781,0.8991600557359704,2025-04-24 21:05:30.150569,2025-04-24 21:05:30.909670,0 days 00:00:00.759101,squared_error,30,log2,1,9,random,TPESampler,COMPLETE
782,0.4438474442892985,2025-04-24 21:05:30.488237,2025-04-24 21:05:31.316565,0 days 00:00:00.828328,squared_error,35,log2,1,10,best,TPESampler,COMPLETE
783,0.5128537554029937,2025-04-24 21:05:30.594933,2025-04-24 21:05:31.533376,0 days 00:00:00.938443,friedman_mse,35,log2,1,11,best,TPESampler,COMPLETE
784,0.48051683833886516,2025-04-24 21:05:31.218015,2025-04-24 21:05:31.924858,0 days 00:00:00.706843,squared_error,35,log2,1,8,best,TPESampler,COMPLETE
785,0.922426147955362,2025-04-24 21:05:31.596458,2025-04-24 21:05:32.682172,0 days 00:00:01.085714,friedman_mse,35,log2,2,10,random,TPESampler,COMPLETE
786,0.4438474442892985,2025-04-24 21:05:31.785016,2025-04-24 21:05:32.837076,0 days 00:00:01.052060,squared_error,35,log2,1,10,best,TPESampler,COMPLETE
787,0.6914253690247881,2025-04-24 21:05:32.283663,2025-04-24 21:05:33.131605,0 days 00:00:00.847942,squared_error,29,log2,1,11,best,TPESampler,COMPLETE
788,0.7975493713728398,2025-04-24 21:05:32.882761,2025-04-24 21:05:33.927042,0 days 00:00:01.044281,squared_error,35,log2,2,12,best,TPESampler,COMPLETE
789,0.5101622714757418,2025-04-24 21:05:33.088675,2025-04-24 21:05:33.776366,0 days 00:00:00.687691,squared_error,35,log2,1,13,best,TPESampler,COMPLETE
790,0.6734080287670924,2025-04-24 21:05:33.372190,2025-04-24 21:05:34.468372,0 days 00:00:01.096182,squared_error,31,log2,1,8,best,TPESampler,COMPLETE
791,0.786987845634963,2025-04-24 21:05:33.984743,2025-04-24 21:05:34.792878,0 days 00:00:00.808135,absolute_error,33,log2,3,7,best,TPESampler,COMPLETE
792,0.6638444438015556,2025-04-24 21:05:34.226624,2025-04-24 21:05:35.013915,0 days 00:00:00.787291,absolute_error,34,log2,1,12,best,TPESampler,COMPLETE
793,0.8942042180115075,2025-04-24 21:05:34.715520,2025-04-24 21:05:35.477000,0 days 00:00:00.761480,squared_error,18,sqrt,10,4,best,TPESampler,COMPLETE
794,0.6702958143159663,2025-04-24 21:05:35.125091,2025-04-24 21:05:35.845919,0 days 00:00:00.720828,squared_error,29,log2,1,13,best,TPESampler,COMPLETE
795,0.7975493713728398,2025-04-24 21:05:35.281475,2025-04-24 21:05:36.071167,0 days 00:00:00.789692,squared_error,35,log2,3,12,best,TPESampler,COMPLETE
796,0.7975493713728398,2025-04-24 21:05:35.776411,2025-04-24 21:05:36.544791,0 days 00:00:00.768380,squared_error,29,log2,3,9,best,TPESampler,COMPLETE
797,0.7975493713728398,2025-04-24 21:05:36.146674,2025-04-24 21:05:37.091497,0 days 00:00:00.944823,squared_error,35,log2,3,11,best,TPESampler,COMPLETE
798,0.7975493713728398,2025-04-24 21:05:36.287276,2025-04-24 21:05:37.236944,0 days 00:00:00.949668,squared_error,35,log2,3,9,best,TPESampler,COMPLETE
799,0.48051683833886516,2025-04-24 21:05:36.831228,2025-04-24 21:05:37.531044,0 days 00:00:00.699816,squared_error,35,log2,1,8,best,TPESampler,COMPLETE
800,0.5128537554029937,2025-04-24 21:05:37.421694,2025-04-24 21:05:38.272662,0 days 00:00:00.850968,squared_error,35,log2,1,11,best,TPESampler,COMPLETE
801,0.4438474442892985,2025-04-24 21:05:37.484020,2025-04-24 21:05:38.320634,0 days 00:00:00.836614,squared_error,35,log2,1,10,best,TPESampler,COMPLETE
802,0.6814491812392187,2025-04-24 21:05:37.973325,2025-04-24 21:05:38.618034,0 days 00:00:00.644709,squared_error,28,log2,1,8,best,TPESampler,COMPLETE
803,0.4438474442892985,2025-04-24 21:05:38.510688,2025-04-24 21:05:39.352764,0 days 00:00:00.842076,squared_error,35,log2,1,10,best,TPESampler,COMPLETE
804,0.5101622714757418,2025-04-24 21:05:38.579845,2025-04-24 21:05:39.588666,0 days 00:00:01.008821,squared_error,35,log2,1,13,best,TPESampler,COMPLETE
805,0.44670023329729247,2025-04-24 21:05:38.863172,2025-04-24 21:05:39.654901,0 days 00:00:00.791729,squared_error,35,log2,1,7,best,TPESampler,COMPLETE
806,0.922426147955362,2025-04-24 21:05:39.581766,2025-04-24 21:05:40.567407,0 days 00:00:00.985641,squared_error,34,log2,3,13,random,TPESampler,COMPLETE
807,0.6765049187574741,2025-04-24 21:05:39.809355,2025-04-24 21:05:40.890137,0 days 00:00:01.080782,squared_error,29,log2,1,10,best,TPESampler,COMPLETE
808,0.5168021789170579,2025-04-24 21:05:39.913077,2025-04-24 21:05:40.895099,0 days 00:00:00.982022,squared_error,31,sqrt,1,11,best,TPESampler,COMPLETE
809,0.6545164836672983,2025-04-24 21:05:40.830074,2025-04-24 21:05:41.451834,0 days 00:00:00.621760,squared_error,29,log2,1,9,best,TPESampler,COMPLETE
810,0.7975493713728398,2025-04-24 21:05:41.167922,2025-04-24 21:05:42.042782,0 days 00:00:00.874860,friedman_mse,35,log2,3,8,best,TPESampler,COMPLETE
811,0.48051683833886516,2025-04-24 21:05:41.226117,2025-04-24 21:05:42.191081,0 days 00:00:00.964964,squared_error,35,log2,1,8,best,TPESampler,COMPLETE
812,0.4948844885027081,2025-04-24 21:05:41.721257,2025-04-24 21:05:42.430971,0 days 00:00:00.709714,squared_error,35,log2,1,9,best,TPESampler,COMPLETE
813,1.0007431665713944,2025-04-24 21:05:42.379902,2025-04-24 21:05:43.115139,0 days 00:00:00.735237,absolute_error,31,log2,7,11,best,TPESampler,COMPLETE
814,0.9494322793442198,2025-04-24 21:05:42.435094,2025-04-24 21:05:43.620181,0 days 00:00:01.185087,friedman_mse,12,log2,10,2,best,TPESampler,COMPLETE
815,0.4438474442892985,2025-04-24 21:05:42.648483,2025-04-24 21:05:43.440738,0 days 00:00:00.792255,squared_error,35,log2,1,10,best,TPESampler,COMPLETE
816,0.6881819029838491,2025-04-24 21:05:43.387431,2025-04-24 21:05:44.182458,0 days 00:00:00.795027,squared_error,29,log2,1,12,best,TPESampler,COMPLETE
817,0.7975493713728398,2025-04-24 21:05:43.691465,2025-04-24 21:05:44.550379,0 days 00:00:00.858914,squared_error,29,log2,3,10,best,TPESampler,COMPLETE
818,0.6708356072336189,2025-04-24 21:05:43.835655,2025-04-24 21:05:44.750733,0 days 00:00:00.915078,squared_error,30,log2,1,12,best,TPESampler,COMPLETE
819,0.922426147955362,2025-04-24 21:05:44.495933,2025-04-24 21:05:45.199672,0 days 00:00:00.703739,squared_error,35,log2,2,8,random,TPESampler,COMPLETE
820,0.7651501885917299,2025-04-24 21:05:44.806632,2025-04-24 21:05:45.539511,0 days 00:00:00.732879,absolute_error,29,log2,1,6,best,TPESampler,COMPLETE
821,0.7975493713728398,2025-04-24 21:05:45.033791,2025-04-24 21:05:45.895311,0 days 00:00:00.861520,squared_error,35,log2,2,11,best,TPESampler,COMPLETE
822,0.9494322793442198,2025-04-24 21:05:45.492255,2025-04-24 21:05:46.394137,0 days 00:00:00.901882,friedman_mse,18,log2,4,4,best,TPESampler,COMPLETE
823,0.7975493713728398,2025-04-24 21:05:45.828178,2025-04-24 21:05:46.637319,0 days 00:00:00.809141,squared_error,35,log2,3,8,best,TPESampler,COMPLETE
824,0.9494322793442198,2025-04-24 21:05:46.142975,2025-04-24 21:05:46.965220,0 days 00:00:00.822245,friedman_mse,1,log2,9,19,best,TPESampler,COMPLETE
825,0.6756408221672622,2025-04-24 21:05:46.695177,2025-04-24 21:05:47.586588,0 days 00:00:00.891411,squared_error,30,log2,1,8,best,TPESampler,COMPLETE
826,0.7975493713728398,2025-04-24 21:05:46.901914,2025-04-24 21:05:47.722805,0 days 00:00:00.820891,squared_error,35,log2,3,14,best,TPESampler,COMPLETE
827,0.7666072309984453,2025-04-24 21:05:47.276857,2025-04-24 21:05:48.000937,0 days 00:00:00.724080,friedman_mse,27,sqrt,1,7,random,TPESampler,COMPLETE
828,0.7975493713728398,2025-04-24 21:05:47.857383,2025-04-24 21:05:48.645685,0 days 00:00:00.788302,squared_error,35,log2,3,11,best,TPESampler,COMPLETE
829,0.6723564892984676,2025-04-24 21:05:47.937722,2025-04-24 21:05:48.937208,0 days 00:00:00.999486,squared_error,35,sqrt,1,8,best,TPESampler,COMPLETE
830,0.7975493713728398,2025-04-24 21:05:48.266578,2025-04-24 21:05:49.168501,0 days 00:00:00.901923,friedman_mse,27,log2,3,8,best,TPESampler,COMPLETE
831,0.4438474442892985,2025-04-24 21:05:48.966501,2025-04-24 21:05:49.880130,0 days 00:00:00.913629,squared_error,35,log2,1,10,best,TPESampler,COMPLETE
832,0.5101622714757418,2025-04-24 21:05:49.238174,2025-04-24 21:05:50.082200,0 days 00:00:00.844026,squared_error,35,log2,1,13,best,TPESampler,COMPLETE
833,0.7975493713728398,2025-04-24 21:05:49.620254,2025-04-24 21:05:50.680437,0 days 00:00:01.060183,friedman_mse,34,log2,3,12,best,TPESampler,COMPLETE
834,0.4948844885027081,2025-04-24 21:05:50.126007,2025-04-24 21:05:51.010985,0 days 00:00:00.884978,squared_error,35,log2,1,9,best,TPESampler,COMPLETE
835,0.7975493713728398,2025-04-24 21:05:50.393587,2025-04-24 21:05:51.249452,0 days 00:00:00.855865,squared_error,35,log2,3,9,best,TPESampler,COMPLETE
836,0.6756408221672622,2025-04-24 21:05:50.936832,2025-04-24 21:05:51.752800,0 days 00:00:00.815968,squared_error,30,log2,1,8,best,TPESampler,COMPLETE
837,0.7975493713728398,2025-04-24 21:05:51.333923,2025-04-24 21:05:52.125109,0 days 00:00:00.791186,squared_error,30,log2,2,12,best,TPESampler,COMPLETE
838,0.8913351576037826,2025-04-24 21:05:51.492247,2025-04-24 21:05:52.300463,0 days 00:00:00.808216,friedman_mse,34,sqrt,3,8,best,TPESampler,COMPLETE
839,0.5120876615801571,2025-04-24 21:05:52.072909,2025-04-24 21:05:52.732362,0 days 00:00:00.659453,squared_error,35,log2,1,12,best,TPESampler,COMPLETE
840,0.6689797096059603,2025-04-24 21:05:52.436438,2025-04-24 21:05:53.610403,0 days 00:00:01.173965,friedman_mse,30,log2,1,11,best,TPESampler,COMPLETE
841,0.6707880756755985,2025-04-24 21:05:52.681855,2025-04-24 21:05:53.488054,0 days 00:00:00.806199,friedman_mse,31,log2,1,9,best,TPESampler,COMPLETE
842,0.6831095431530921,2025-04-24 21:05:52.962923,2025-04-24 21:05:53.763157,0 days 00:00:00.800234,friedman_mse,28,log2,1,11,best,TPESampler,COMPLETE
843,0.4948844885027081,2025-04-24 21:05:53.830207,2025-04-24 21:05:55.040339,0 days 00:00:01.210132,squared_error,35,log2,1,9,best,TPESampler,COMPLETE
844,0.6692087088741673,2025-04-24 21:05:53.910408,2025-04-24 21:05:54.894476,0 days 00:00:00.984068,squared_error,30,log2,1,9,best,TPESampler,COMPLETE
845,0.48051683833886516,2025-04-24 21:05:54.048696,2025-04-24 21:05:55.170820,0 days 00:00:01.122124,squared_error,35,log2,1,8,best,TPESampler,COMPLETE
846,0.7975493713728398,2025-04-24 21:05:55.132767,2025-04-24 21:05:55.869780,0 days 00:00:00.737013,squared_error,30,log2,3,8,best,TPESampler,COMPLETE
847,0.6708356072336189,2025-04-24 21:05:55.227592,2025-04-24 21:05:56.248491,0 days 00:00:01.020899,squared_error,30,log2,1,12,best,TPESampler,COMPLETE
848,0.7975493713728398,2025-04-24 21:05:55.419432,2025-04-24 21:05:56.261105,0 days 00:00:00.841673,squared_error,29,log2,2,11,best,TPESampler,COMPLETE
849,0.5128537554029937,2025-04-24 21:05:56.171094,2025-04-24 21:05:56.944308,0 days 00:00:00.773214,squared_error,35,log2,1,11,best,TPESampler,COMPLETE
850,0.5120876615801571,2025-04-24 21:05:56.435847,2025-04-24 21:05:57.348215,0 days 00:00:00.912368,squared_error,35,log2,1,12,best,TPESampler,COMPLETE
851,1.0234382327956146,2025-04-24 21:05:56.478206,2025-04-24 21:05:57.410167,0 days 00:00:00.931961,absolute_error,33,sqrt,9,14,best,TPESampler,COMPLETE
852,0.4438474442892985,2025-04-24 21:05:57.269021,2025-04-24 21:05:58.019479,0 days 00:00:00.750458,squared_error,35,log2,1,10,best,TPESampler,COMPLETE
853,0.48051683833886516,2025-04-24 21:05:57.689753,2025-04-24 21:05:58.507935,0 days 00:00:00.818182,squared_error,35,log2,1,8,best,TPESampler,COMPLETE
854,0.9494322793442198,2025-04-24 21:05:57.752543,2025-04-24 21:05:58.728366,0 days 00:00:00.975823,squared_error,4,log2,8,16,random,TPESampler,COMPLETE
855,0.7975493713728398,2025-04-24 21:05:58.454062,2025-04-24 21:05:59.149878,0 days 00:00:00.695816,squared_error,29,log2,3,6,best,TPESampler,COMPLETE
856,0.7975493713728398,2025-04-24 21:05:58.826542,2025-04-24 21:05:59.664515,0 days 00:00:00.837973,squared_error,35,log2,3,9,best,TPESampler,COMPLETE
857,0.5120876615801571,2025-04-24 21:05:59.001316,2025-04-24 21:05:59.870502,0 days 00:00:00.869186,squared_error,35,log2,1,12,best,TPESampler,COMPLETE
