number,value,datetime_start,datetime_complete,duration,params_criterion,params_max_depth,params_max_features,params_min_samples_leaf,params_min_samples_split,params_splitter,system_attrs_auto:sampler,state
286,1.0007431665713944,2025-04-24 21:02:23.556952,2025-04-24 21:02:24.349654,0 days 00:00:00.792702,absolute_error,12,log2,10,16,random,TPESampler,COMPLETE
287,0.7975493713728398,2025-04-24 21:02:24.095457,2025-04-24 21:02:24.721196,0 days 00:00:00.625739,squared_error,35,log2,2,4,best,TPESampler,COMPLETE
288,0.5436620092712224,2025-04-24 21:02:24.438254,2025-04-24 21:02:25.140281,0 days 00:00:00.702027,squared_error,35,log2,1,5,best,TPESampler,COMPLETE
289,0.9347481389709953,2025-04-24 21:02:24.590634,2025-04-24 21:02:25.434571,0 days 00:00:00.843937,squared_error,17,sqrt,9,2,random,TPESampler,COMPLETE
290,0.7975493713728398,2025-04-24 21:02:24.986030,2025-04-24 21:02:26.000057,0 days 00:00:01.014027,squared_error,29,log2,3,7,best,TPESampler,COMPLETE
291,0.921490865991525,2025-04-24 21:02:25.431436,2025-04-24 21:02:26.246985,0 days 00:00:00.815549,friedman_mse,10,sqrt,5,2,random,TPESampler,COMPLETE
292,0.4605209589836094,2025-04-24 21:02:25.927060,2025-04-24 21:02:26.608861,0 days 00:00:00.681801,squared_error,35,log2,1,2,best,TPESampler,COMPLETE
293,0.4438474442892985,2025-04-24 21:02:26.277427,2025-04-24 21:02:26.999204,0 days 00:00:00.721777,squared_error,35,log2,1,10,best,TPESampler,COMPLETE
294,0.6689797096059603,2025-04-24 21:02:26.527691,2025-04-24 21:02:27.515991,0 days 00:00:00.988300,squared_error,30,log2,1,11,best,TPESampler,COMPLETE
295,0.6737764944140061,2025-04-24 21:02:26.876015,2025-04-24 21:02:27.619490,0 days 00:00:00.743475,squared_error,31,log2,1,10,best,TPESampler,COMPLETE
296,0.4438474442892985,2025-04-24 21:02:27.201773,2025-04-24 21:02:27.897412,0 days 00:00:00.695639,squared_error,35,log2,1,10,best,TPESampler,COMPLETE
297,0.9255759610404857,2025-04-24 21:02:27.762097,2025-04-24 21:02:28.523201,0 days 00:00:00.761104,friedman_mse,6,sqrt,4,13,random,TPESampler,COMPLETE
298,0.972901152467277,2025-04-24 21:02:27.829446,2025-04-24 21:02:28.708562,0 days 00:00:00.879116,absolute_error,9,sqrt,4,20,random,TPESampler,COMPLETE
299,0.7975493713728398,2025-04-24 21:02:28.149611,2025-04-24 21:02:29.100894,0 days 00:00:00.951283,squared_error,35,log2,2,11,best,TPESampler,COMPLETE
300,0.47092685315408,2025-04-24 21:02:28.782345,2025-04-24 21:02:29.532432,0 days 00:00:00.750087,friedman_mse,34,log2,1,12,best,TPESampler,COMPLETE
301,0.49233224785953744,2025-04-24 21:02:28.978622,2025-04-24 21:02:29.800396,0 days 00:00:00.821774,squared_error,33,log2,1,10,best,TPESampler,COMPLETE
302,0.5003913648226206,2025-04-24 21:02:29.325139,2025-04-24 21:02:30.636371,0 days 00:00:01.311232,squared_error,33,log2,1,8,best,TPESampler,COMPLETE
303,0.4438474442892985,2025-04-24 21:02:29.799152,2025-04-24 21:02:30.849653,0 days 00:00:01.050501,squared_error,35,log2,1,10,best,TPESampler,COMPLETE
304,0.9638042122577196,2025-04-24 21:02:30.082775,2025-04-24 21:02:31.176927,0 days 00:00:01.094152,absolute_error,28,sqrt,2,19,random,TPESampler,COMPLETE
305,0.7975493713728398,2025-04-24 21:02:30.965417,2025-04-24 21:02:31.759675,0 days 00:00:00.794258,squared_error,35,log2,3,10,best,TPESampler,COMPLETE
306,0.5120876615801571,2025-04-24 21:02:31.127355,2025-04-24 21:02:32.067656,0 days 00:00:00.940301,squared_error,35,log2,1,12,best,TPESampler,COMPLETE
307,0.922426147955362,2025-04-24 21:02:31.446296,2025-04-24 21:02:32.200235,0 days 00:00:00.753939,squared_error,35,log2,2,17,random,TPESampler,COMPLETE
308,0.7546014862161753,2025-04-24 21:02:32.069009,2025-04-24 21:02:33.001690,0 days 00:00:00.932681,friedman_mse,11,log2,1,11,best,TPESampler,COMPLETE
309,0.8962733979255898,2025-04-24 21:02:32.317543,2025-04-24 21:02:33.112599,0 days 00:00:00.795056,friedman_mse,3,sqrt,5,14,best,TPESampler,COMPLETE
310,0.9494322793442198,2025-04-24 21:02:32.494193,2025-04-24 21:02:33.299197,0 days 00:00:00.805004,squared_error,28,log2,10,3,best,TPESampler,COMPLETE
311,0.6879152987275021,2025-04-24 21:02:33.249122,2025-04-24 21:02:34.376694,0 days 00:00:01.127572,absolute_error,35,log2,1,10,best,TPESampler,COMPLETE
312,0.9061960060656828,2025-04-24 21:02:33.345541,2025-04-24 21:02:34.171286,0 days 00:00:00.825745,squared_error,35,log2,1,10,random,TPESampler,COMPLETE
313,0.9494322793442198,2025-04-24 21:02:33.495766,2025-04-24 21:02:34.378177,0 days 00:00:00.882411,friedman_mse,28,log2,6,4,random,TPESampler,COMPLETE
314,0.9494322793442198,2025-04-24 21:02:34.426219,2025-04-24 21:02:35.007267,0 days 00:00:00.581048,friedman_mse,28,log2,9,10,best,TPESampler,COMPLETE
315,0.49441090632956214,2025-04-24 21:02:34.617800,2025-04-24 21:02:35.590310,0 days 00:00:00.972510,squared_error,33,log2,1,11,best,TPESampler,COMPLETE
316,0.7245104563386248,2025-04-24 21:02:34.805131,2025-04-24 21:02:35.778267,0 days 00:00:00.973136,squared_error,13,log2,1,16,best,TPESampler,COMPLETE
317,0.4948844885027081,2025-04-24 21:02:35.272625,2025-04-24 21:02:36.168762,0 days 00:00:00.896137,squared_error,35,log2,1,9,best,TPESampler,COMPLETE
318,0.894550859606008,2025-04-24 21:02:35.866126,2025-04-24 21:02:36.662805,0 days 00:00:00.796679,squared_error,27,sqrt,8,12,best,TPESampler,COMPLETE
319,0.4438474442892985,2025-04-24 21:02:36.041904,2025-04-24 21:02:36.791939,0 days 00:00:00.750035,squared_error,35,log2,1,10,best,TPESampler,COMPLETE
320,0.674050854009347,2025-04-24 21:02:36.379101,2025-04-24 21:02:37.057375,0 days 00:00:00.678274,squared_error,28,log2,1,9,best,TPESampler,COMPLETE
321,0.49233224785953744,2025-04-24 21:02:36.963303,2025-04-24 21:02:37.726085,0 days 00:00:00.762782,squared_error,33,log2,1,10,best,TPESampler,COMPLETE
322,0.7975493713728398,2025-04-24 21:02:37.020524,2025-04-24 21:02:37.915046,0 days 00:00:00.894522,squared_error,35,log2,2,10,best,TPESampler,COMPLETE
323,0.7975493713728398,2025-04-24 21:02:37.265622,2025-04-24 21:02:38.043279,0 days 00:00:00.777657,squared_error,34,log2,2,9,best,TPESampler,COMPLETE
324,0.4948844885027081,2025-04-24 21:02:37.986900,2025-04-24 21:02:38.661832,0 days 00:00:00.674932,squared_error,35,log2,1,9,best,TPESampler,COMPLETE
325,0.5120876615801571,2025-04-24 21:02:38.136002,2025-04-24 21:02:39.022613,0 days 00:00:00.886611,squared_error,35,log2,1,12,best,TPESampler,COMPLETE
326,0.5043541415890872,2025-04-24 21:02:38.376005,2025-04-24 21:02:39.169497,0 days 00:00:00.793492,squared_error,33,log2,1,14,best,TPESampler,COMPLETE
327,0.9347481389709953,2025-04-24 21:02:38.941593,2025-04-24 21:02:39.558183,0 days 00:00:00.616590,squared_error,26,sqrt,7,10,random,TPESampler,COMPLETE
328,0.9671029066257907,2025-04-24 21:02:39.256462,2025-04-24 21:02:40.035637,0 days 00:00:00.779175,absolute_error,24,log2,3,15,random,TPESampler,COMPLETE
329,0.48051683833886516,2025-04-24 21:02:39.438866,2025-04-24 21:02:40.191163,0 days 00:00:00.752297,squared_error,35,log2,1,8,best,TPESampler,COMPLETE
330,0.9494322793442198,2025-04-24 21:02:39.779828,2025-04-24 21:02:40.471670,0 days 00:00:00.691842,friedman_mse,8,log2,8,3,random,TPESampler,COMPLETE
331,0.9245771875115085,2025-04-24 21:02:40.299419,2025-04-24 21:02:41.433099,0 days 00:00:01.133680,friedman_mse,35,sqrt,3,10,random,TPESampler,COMPLETE
332,0.48051683833886516,2025-04-24 21:02:40.401100,2025-04-24 21:02:41.069905,0 days 00:00:00.668805,squared_error,35,log2,1,8,best,TPESampler,COMPLETE
333,1.0007431665713944,2025-04-24 21:02:40.673051,2025-04-24 21:02:41.480019,0 days 00:00:00.806968,absolute_error,14,log2,7,9,best,TPESampler,COMPLETE
334,0.674050854009347,2025-04-24 21:02:41.367958,2025-04-24 21:02:41.920430,0 days 00:00:00.552472,squared_error,28,log2,1,9,best,TPESampler,COMPLETE
335,0.7975493713728398,2025-04-24 21:02:41.675067,2025-04-24 21:02:42.446409,0 days 00:00:00.771342,squared_error,35,log2,3,9,best,TPESampler,COMPLETE
336,0.4948844885027081,2025-04-24 21:02:41.732820,2025-04-24 21:02:42.571170,0 days 00:00:00.838350,squared_error,35,log2,1,9,best,TPESampler,COMPLETE
337,0.44670023329729247,2025-04-24 21:02:42.146099,2025-04-24 21:02:42.870739,0 days 00:00:00.724640,squared_error,35,log2,1,7,best,TPESampler,COMPLETE
338,0.8876713258154219,2025-04-24 21:02:42.705969,2025-04-24 21:02:43.520655,0 days 00:00:00.814686,friedman_mse,12,sqrt,6,4,best,TPESampler,COMPLETE
339,1.0007431665713944,2025-04-24 21:02:42.818366,2025-04-24 21:02:43.754778,0 days 00:00:00.936412,absolute_error,26,log2,10,19,best,TPESampler,COMPLETE
340,0.6317023826094311,2025-04-24 21:02:43.056086,2025-04-24 21:02:43.851879,0 days 00:00:00.795793,squared_error,25,sqrt,2,8,best,TPESampler,COMPLETE
341,0.9347481389709953,2025-04-24 21:02:43.764502,2025-04-24 21:02:44.436834,0 days 00:00:00.672332,squared_error,7,sqrt,10,12,random,TPESampler,COMPLETE
342,0.6814491812392187,2025-04-24 21:02:43.981482,2025-04-24 21:02:44.753970,0 days 00:00:00.772488,squared_error,28,log2,1,8,best,TPESampler,COMPLETE
343,0.48051683833886516,2025-04-24 21:02:44.168748,2025-04-24 21:02:44.939216,0 days 00:00:00.770468,squared_error,35,log2,1,8,best,TPESampler,COMPLETE
344,0.44670023329729247,2025-04-24 21:02:44.702604,2025-04-24 21:02:45.284752,0 days 00:00:00.582148,squared_error,35,log2,1,7,best,TPESampler,COMPLETE
345,0.4438474442892985,2025-04-24 21:02:45.027475,2025-04-24 21:02:45.987910,0 days 00:00:00.960435,squared_error,35,log2,1,10,best,TPESampler,COMPLETE
346,0.9116704775858039,2025-04-24 21:02:45.215139,2025-04-24 21:02:46.188706,0 days 00:00:00.973567,squared_error,19,sqrt,2,7,random,TPESampler,COMPLETE
347,0.9494322793442198,2025-04-24 21:02:45.922882,2025-04-24 21:02:46.991194,0 days 00:00:01.068312,friedman_mse,18,log2,4,20,best,TPESampler,COMPLETE
348,0.7975493713728398,2025-04-24 21:02:46.303929,2025-04-24 21:02:47.671761,0 days 00:00:01.367832,squared_error,35,log2,2,11,best,TPESampler,COMPLETE
349,0.7975493713728398,2025-04-24 21:02:46.603084,2025-04-24 21:02:48.005663,0 days 00:00:01.402579,squared_error,35,log2,2,13,best,TPESampler,COMPLETE
350,0.9347481389709953,2025-04-24 21:02:47.267414,2025-04-24 21:02:48.654964,0 days 00:00:01.387550,squared_error,31,sqrt,6,18,random,TPESampler,COMPLETE
351,0.48051683833886516,2025-04-24 21:02:48.042423,2025-04-24 21:02:50.438413,0 days 00:00:02.395990,squared_error,35,log2,1,8,best,TPESampler,COMPLETE
352,0.7975493713728398,2025-04-24 21:02:48.659009,2025-04-24 21:02:50.693085,0 days 00:00:02.034076,squared_error,29,log2,2,9,best,TPESampler,COMPLETE
353,0.5214805538018283,2025-04-24 21:02:49.747347,2025-04-24 21:02:51.314327,0 days 00:00:01.566980,squared_error,34,log2,1,9,best,TPESampler,COMPLETE
354,0.7975493713728398,2025-04-24 21:02:50.741393,2025-04-24 21:02:52.169664,0 days 00:00:01.428271,squared_error,29,log2,3,8,best,TPESampler,COMPLETE
355,0.48051683833886516,2025-04-24 21:02:51.304101,2025-04-24 21:02:52.640395,0 days 00:00:01.336294,squared_error,35,log2,1,8,best,TPESampler,COMPLETE
356,0.49441090632956214,2025-04-24 21:02:51.792782,2025-04-24 21:02:53.298205,0 days 00:00:01.505423,squared_error,33,log2,1,11,best,TPESampler,COMPLETE
357,0.5390089079404952,2025-04-24 21:02:52.551096,2025-04-24 21:02:53.683422,0 days 00:00:01.132326,squared_error,32,sqrt,1,9,best,TPESampler,COMPLETE
358,0.9993409537053991,2025-04-24 21:02:53.304046,2025-04-24 21:02:54.127550,0 days 00:00:00.823504,absolute_error,16,sqrt,9,17,random,TPESampler,COMPLETE
359,0.5101622714757418,2025-04-24 21:02:53.682121,2025-04-24 21:02:54.576980,0 days 00:00:00.894859,squared_error,35,log2,1,13,best,TPESampler,COMPLETE
360,1.0007431665713944,2025-04-24 21:02:53.925358,2025-04-24 21:02:55.310959,0 days 00:00:01.385601,absolute_error,24,log2,5,19,best,TPESampler,COMPLETE
361,0.7975493713728398,2025-04-24 21:02:54.705330,2025-04-24 21:02:55.862463,0 days 00:00:01.157133,squared_error,35,log2,2,9,best,TPESampler,COMPLETE
362,0.7975493713728398,2025-04-24 21:02:55.309248,2025-04-24 21:02:56.350936,0 days 00:00:01.041688,squared_error,35,log2,2,8,best,TPESampler,COMPLETE
363,0.4438474442892985,2025-04-24 21:02:55.697377,2025-04-24 21:02:57.036458,0 days 00:00:01.339081,squared_error,35,log2,1,10,best,TPESampler,COMPLETE
364,0.6831095431530921,2025-04-24 21:02:56.352287,2025-04-24 21:02:57.807676,0 days 00:00:01.455389,squared_error,28,log2,1,11,best,TPESampler,COMPLETE
365,0.4438474442892985,2025-04-24 21:02:56.746588,2025-04-24 21:02:58.177637,0 days 00:00:01.431049,squared_error,35,log2,1,10,best,TPESampler,COMPLETE
366,0.4438474442892985,2025-04-24 21:02:57.484370,2025-04-24 21:02:58.485974,0 days 00:00:01.001604,squared_error,35,log2,1,10,best,TPESampler,COMPLETE
367,0.49441090632956214,2025-04-24 21:02:58.214752,2025-04-24 21:02:59.277356,0 days 00:00:01.062604,squared_error,33,log2,1,11,best,TPESampler,COMPLETE
368,0.9494322793442198,2025-04-24 21:02:58.491162,2025-04-24 21:02:59.744038,0 days 00:00:01.252876,squared_error,32,log2,8,4,random,TPESampler,COMPLETE
369,0.5128537554029937,2025-04-24 21:02:58.913098,2025-04-24 21:03:00.401135,0 days 00:00:01.488037,squared_error,35,log2,1,11,best,TPESampler,COMPLETE
370,0.5128537554029937,2025-04-24 21:02:59.651763,2025-04-24 21:03:00.591973,0 days 00:00:00.940210,squared_error,35,log2,1,11,best,TPESampler,COMPLETE
371,0.5317878712168591,2025-04-24 21:02:59.985987,2025-04-24 21:03:00.916228,0 days 00:00:00.930241,squared_error,32,log2,1,11,best,TPESampler,COMPLETE
372,0.7975493713728398,2025-04-24 21:03:00.677005,2025-04-24 21:03:01.881606,0 days 00:00:01.204601,squared_error,35,log2,2,11,best,TPESampler,COMPLETE
373,0.9009035308227251,2025-04-24 21:03:00.846851,2025-04-24 21:03:01.755674,0 days 00:00:00.908823,squared_error,31,log2,1,7,random,TPESampler,COMPLETE
374,0.5128537554029937,2025-04-24 21:03:01.242506,2025-04-24 21:03:02.023818,0 days 00:00:00.781312,squared_error,35,log2,1,11,best,TPESampler,COMPLETE
375,0.5128537554029937,2025-04-24 21:03:01.979032,2025-04-24 21:03:02.608730,0 days 00:00:00.629698,squared_error,35,log2,1,11,best,TPESampler,COMPLETE
376,0.7975493713728398,2025-04-24 21:03:02.066304,2025-04-24 21:03:02.909105,0 days 00:00:00.842801,squared_error,35,log2,3,8,best,TPESampler,COMPLETE
377,0.6988897683419196,2025-04-24 21:03:02.429003,2025-04-24 21:03:03.200212,0 days 00:00:00.771209,absolute_error,35,sqrt,1,6,best,TPESampler,COMPLETE
378,0.6736005304390017,2025-04-24 21:03:02.898014,2025-04-24 21:03:03.654442,0 days 00:00:00.756428,squared_error,27,log2,1,11,best,TPESampler,COMPLETE
379,0.674050854009347,2025-04-24 21:03:03.156346,2025-04-24 21:03:03.949857,0 days 00:00:00.793511,squared_error,28,log2,1,9,best,TPESampler,COMPLETE
380,0.7975493713728398,2025-04-24 21:03:03.484746,2025-04-24 21:03:04.386597,0 days 00:00:00.901851,squared_error,28,log2,3,12,best,TPESampler,COMPLETE
381,0.7975493713728398,2025-04-24 21:03:03.943776,2025-04-24 21:03:04.611332,0 days 00:00:00.667556,friedman_mse,33,log2,3,9,best,TPESampler,COMPLETE
382,0.8913351576037826,2025-04-24 21:03:04.201504,2025-04-24 21:03:04.952249,0 days 00:00:00.750745,squared_error,8,sqrt,3,11,best,TPESampler,COMPLETE
383,0.7975493713728398,2025-04-24 21:03:04.703789,2025-04-24 21:03:05.521039,0 days 00:00:00.817250,squared_error,35,log2,2,9,best,TPESampler,COMPLETE
384,0.48051683833886516,2025-04-24 21:03:04.895583,2025-04-24 21:03:05.631484,0 days 00:00:00.735901,squared_error,35,log2,1,8,best,TPESampler,COMPLETE
385,0.7975493713728398,2025-04-24 21:03:05.188637,2025-04-24 21:03:05.971714,0 days 00:00:00.783077,squared_error,35,log2,3,8,best,TPESampler,COMPLETE
386,0.9494322793442198,2025-04-24 21:03:05.750203,2025-04-24 21:03:06.810368,0 days 00:00:01.060165,friedman_mse,20,log2,10,16,random,TPESampler,COMPLETE
387,0.6777763019194643,2025-04-24 21:03:05.846019,2025-04-24 21:03:07.125502,0 days 00:00:01.279483,squared_error,28,log2,1,7,best,TPESampler,COMPLETE
388,0.6499694535869922,2025-04-24 21:03:06.575495,2025-04-24 21:03:07.577426,0 days 00:00:01.001931,absolute_error,29,log2,1,11,best,TPESampler,COMPLETE
389,0.4948844885027081,2025-04-24 21:03:07.119568,2025-04-24 21:03:07.764831,0 days 00:00:00.645263,squared_error,35,log2,1,9,best,TPESampler,COMPLETE
390,0.9671029066257907,2025-04-24 21:03:07.349362,2025-04-24 21:03:08.062672,0 days 00:00:00.713310,absolute_error,34,log2,3,9,random,TPESampler,COMPLETE
391,0.4438474442892985,2025-04-24 21:03:07.812401,2025-04-24 21:03:09.299206,0 days 00:00:01.486805,squared_error,35,log2,1,10,best,TPESampler,COMPLETE
392,0.5082141134805584,2025-04-24 21:03:08.004125,2025-04-24 21:03:09.455479,0 days 00:00:01.451354,squared_error,34,log2,1,11,best,TPESampler,COMPLETE
393,0.7975493713728398,2025-04-24 21:03:08.875719,2025-04-24 21:03:09.765934,0 days 00:00:00.890215,squared_error,35,log2,2,10,best,TPESampler,COMPLETE
394,0.7975493713728398,2025-04-24 21:03:09.535147,2025-04-24 21:03:10.274155,0 days 00:00:00.739008,squared_error,35,log2,3,13,best,TPESampler,COMPLETE
395,0.5120876615801571,2025-04-24 21:03:09.714553,2025-04-24 21:03:10.418502,0 days 00:00:00.703949,squared_error,35,log2,1,12,best,TPESampler,COMPLETE
396,0.991699396114276,2025-04-24 21:03:09.993790,2025-04-24 21:03:10.748835,0 days 00:00:00.755045,absolute_error,16,sqrt,1,10,best,TPESampler,COMPLETE
397,1.0234382327956146,2025-04-24 21:03:10.506563,2025-04-24 21:03:11.291672,0 days 00:00:00.785109,absolute_error,24,sqrt,10,12,best,TPESampler,COMPLETE
398,0.922426147955362,2025-04-24 21:03:10.623796,2025-04-24 21:03:11.536547,0 days 00:00:00.912751,squared_error,29,log2,3,11,random,TPESampler,COMPLETE
399,0.7975493713728398,2025-04-24 21:03:10.993170,2025-04-24 21:03:11.923049,0 days 00:00:00.929879,squared_error,29,log2,3,9,best,TPESampler,COMPLETE
400,0.9347481389709953,2025-04-24 21:03:11.695335,2025-04-24 21:03:12.416076,0 days 00:00:00.720741,friedman_mse,25,sqrt,7,12,random,TPESampler,COMPLETE
401,0.4438474442892985,2025-04-24 21:03:11.820938,2025-04-24 21:03:12.639075,0 days 00:00:00.818137,squared_error,35,log2,1,10,best,TPESampler,COMPLETE
402,0.4948844885027081,2025-04-24 21:03:12.152791,2025-04-24 21:03:12.977634,0 days 00:00:00.824843,squared_error,35,log2,1,9,best,TPESampler,COMPLETE
403,0.46385297432679357,2025-04-24 21:03:12.629432,2025-04-24 21:03:13.445192,0 days 00:00:00.815760,squared_error,35,log2,1,15,best,TPESampler,COMPLETE
404,0.7628343761831035,2025-04-24 21:03:13.103055,2025-04-24 21:03:13.992641,0 days 00:00:00.889586,absolute_error,31,sqrt,3,18,best,TPESampler,COMPLETE
405,0.4948844885027081,2025-04-24 21:03:13.305763,2025-04-24 21:03:14.106904,0 days 00:00:00.801141,squared_error,35,log2,1,9,best,TPESampler,COMPLETE
406,0.4438474442892985,2025-04-24 21:03:13.723021,2025-04-24 21:03:14.546183,0 days 00:00:00.823162,squared_error,35,log2,1,10,best,TPESampler,COMPLETE
407,0.6750604722884704,2025-04-24 21:03:14.248835,2025-04-24 21:03:15.002653,0 days 00:00:00.753818,squared_error,28,log2,1,13,best,TPESampler,COMPLETE
408,0.7836532696339454,2025-04-24 21:03:14.424329,2025-04-24 21:03:15.194322,0 days 00:00:00.769993,absolute_error,7,sqrt,3,2,best,TPESampler,COMPLETE
409,0.6831095431530921,2025-04-24 21:03:14.738280,2025-04-24 21:03:15.490230,0 days 00:00:00.751950,squared_error,28,log2,1,11,best,TPESampler,COMPLETE
410,0.5128537554029937,2025-04-24 21:03:15.250465,2025-04-24 21:03:16.257348,0 days 00:00:01.006883,squared_error,35,log2,1,11,best,TPESampler,COMPLETE
411,1.0007431665713944,2025-04-24 21:03:15.437145,2025-04-24 21:03:16.068709,0 days 00:00:00.631564,absolute_error,35,log2,4,11,best,TPESampler,COMPLETE
412,0.6317023826094311,2025-04-24 21:03:15.708318,2025-04-24 21:03:16.561601,0 days 00:00:00.853283,squared_error,34,sqrt,2,11,best,TPESampler,COMPLETE
413,0.5082141134805584,2025-04-24 21:03:16.318492,2025-04-24 21:03:17.233983,0 days 00:00:00.915491,squared_error,34,log2,1,11,best,TPESampler,COMPLETE
414,0.4948844885027081,2025-04-24 21:03:16.518719,2025-04-24 21:03:17.526056,0 days 00:00:01.007337,squared_error,35,log2,1,9,best,TPESampler,COMPLETE
415,0.5128537554029937,2025-04-24 21:03:16.803681,2025-04-24 21:03:17.666525,0 days 00:00:00.862844,squared_error,35,log2,1,11,best,TPESampler,COMPLETE
416,0.7975493713728398,2025-04-24 21:03:17.524414,2025-04-24 21:03:18.608134,0 days 00:00:01.083720,squared_error,35,log2,3,12,best,TPESampler,COMPLETE
417,0.48732093497631573,2025-04-24 21:03:17.736003,2025-04-24 21:03:18.574544,0 days 00:00:00.838541,friedman_mse,34,log2,1,10,best,TPESampler,COMPLETE
418,0.6121382486623906,2025-04-24 21:03:17.860765,2025-04-24 21:03:18.877738,0 days 00:00:01.016973,squared_error,35,sqrt,1,6,best,TPESampler,COMPLETE
419,0.5120876615801571,2025-04-24 21:03:18.776619,2025-04-24 21:03:19.647813,0 days 00:00:00.871194,squared_error,35,log2,1,12,best,TPESampler,COMPLETE
420,0.6674904996783185,2025-04-24 21:03:18.826787,2025-04-24 21:03:19.710372,0 days 00:00:00.883585,friedman_mse,26,log2,1,16,best,TPESampler,COMPLETE
421,0.5120876615801571,2025-04-24 21:03:19.279110,2025-04-24 21:03:20.028985,0 days 00:00:00.749875,squared_error,35,log2,1,12,best,TPESampler,COMPLETE
422,0.6616302052487377,2025-04-24 21:03:19.904976,2025-04-24 21:03:20.859159,0 days 00:00:00.954183,absolute_error,33,sqrt,2,12,best,TPESampler,COMPLETE
423,0.6765049187574741,2025-04-24 21:03:19.975460,2025-04-24 21:03:20.662666,0 days 00:00:00.687206,squared_error,29,log2,1,10,best,TPESampler,COMPLETE
424,0.9029572497460439,2025-04-24 21:03:20.246285,2025-04-24 21:03:20.980867,0 days 00:00:00.734582,squared_error,33,log2,1,12,random,TPESampler,COMPLETE
425,0.6765049187574741,2025-04-24 21:03:20.931070,2025-04-24 21:03:21.603384,0 days 00:00:00.672314,squared_error,29,log2,1,10,best,TPESampler,COMPLETE
426,0.922426147955362,2025-04-24 21:03:21.131125,2025-04-24 21:03:22.134578,0 days 00:00:01.003453,squared_error,35,log2,4,8,random,TPESampler,COMPLETE
427,0.7975493713728398,2025-04-24 21:03:21.237112,2025-04-24 21:03:22.133106,0 days 00:00:00.895994,squared_error,31,log2,3,10,best,TPESampler,COMPLETE
428,0.6747391651080636,2025-04-24 21:03:21.803020,2025-04-24 21:03:22.475554,0 days 00:00:00.672534,squared_error,29,log2,1,8,best,TPESampler,COMPLETE
