number,value,datetime_start,datetime_complete,duration,params_criterion,params_max_depth,params_max_features,params_min_samples_leaf,params_min_samples_split,params_splitter,system_attrs_auto:sampler,state
1001,0.6708356072336189,2025-04-24 21:06:54.975948,2025-04-24 21:06:55.668987,0 days 00:00:00.693039,squared_error,30,log2,1,12,best,TPESampler,COMPLETE
1002,0.7975493713728398,2025-04-24 21:06:55.181575,2025-04-24 21:06:56.076537,0 days 00:00:00.894962,squared_error,35,log2,3,12,best,TPESampler,COMPLETE
1003,0.894550859606008,2025-04-24 21:06:55.378284,2025-04-24 21:06:56.198371,0 days 00:00:00.820087,squared_error,8,sqrt,7,4,best,TPESampler,COMPLETE
1004,0.7975493713728398,2025-04-24 21:06:55.985339,2025-04-24 21:06:56.657310,0 days 00:00:00.671971,squared_error,35,log2,2,11,best,TPESampler,COMPLETE
1005,0.7975493713728398,2025-04-24 21:06:56.380962,2025-04-24 21:06:57.206514,0 days 00:00:00.825552,squared_error,35,log2,2,11,best,TPESampler,COMPLETE
1006,0.6689797096059603,2025-04-24 21:06:56.442871,2025-04-24 21:06:57.374127,0 days 00:00:00.931256,squared_error,30,log2,1,11,best,TPESampler,COMPLETE
1007,0.7975493713728398,2025-04-24 21:06:56.950225,2025-04-24 21:06:57.952102,0 days 00:00:01.001877,friedman_mse,28,log2,3,12,best,TPESampler,COMPLETE
1008,0.7712088672102367,2025-04-24 21:06:57.434875,2025-04-24 21:06:58.134791,0 days 00:00:00.699916,absolute_error,19,sqrt,4,3,best,TPESampler,COMPLETE
1009,0.9494322793442198,2025-04-24 21:06:57.735143,2025-04-24 21:06:58.406368,0 days 00:00:00.671225,squared_error,5,log2,8,8,best,TPESampler,COMPLETE
1010,0.6747391651080636,2025-04-24 21:06:58.296214,2025-04-24 21:06:59.195596,0 days 00:00:00.899382,squared_error,29,log2,1,8,best,TPESampler,COMPLETE
1011,0.9494322793442198,2025-04-24 21:06:58.364539,2025-04-24 21:06:59.264573,0 days 00:00:00.900034,friedman_mse,35,log2,8,2,random,TPESampler,COMPLETE
1012,0.7975493713728398,2025-04-24 21:06:58.881448,2025-04-24 21:06:59.616577,0 days 00:00:00.735129,squared_error,35,log2,2,9,best,TPESampler,COMPLETE
1013,0.5984241182870361,2025-04-24 21:06:59.384389,2025-04-24 21:07:00.404304,0 days 00:00:01.019915,absolute_error,31,log2,1,8,best,TPESampler,COMPLETE
1014,0.4438474442892985,2025-04-24 21:06:59.464727,2025-04-24 21:07:00.295559,0 days 00:00:00.830832,squared_error,35,log2,1,10,best,TPESampler,COMPLETE
1015,0.6536086648697055,2025-04-24 21:06:59.881899,2025-04-24 21:07:00.680308,0 days 00:00:00.798409,friedman_mse,28,log2,1,6,best,TPESampler,COMPLETE
1016,0.6614879266907515,2025-04-24 21:07:00.564930,2025-04-24 21:07:01.538581,0 days 00:00:00.973651,squared_error,34,sqrt,1,11,best,TPESampler,COMPLETE
1017,0.8894105515009568,2025-04-24 21:07:00.630189,2025-04-24 21:07:01.773284,0 days 00:00:01.143095,squared_error,32,sqrt,9,7,best,TPESampler,COMPLETE
1018,0.7975493713728398,2025-04-24 21:07:01.033657,2025-04-24 21:07:01.885389,0 days 00:00:00.851732,friedman_mse,35,log2,2,8,best,TPESampler,COMPLETE
1019,0.44670023329729247,2025-04-24 21:07:01.818162,2025-04-24 21:07:02.461371,0 days 00:00:00.643209,squared_error,35,log2,1,7,best,TPESampler,COMPLETE
1020,0.6689797096059603,2025-04-24 21:07:02.028767,2025-04-24 21:07:02.866532,0 days 00:00:00.837765,squared_error,30,log2,1,11,best,TPESampler,COMPLETE
1021,0.7975493713728398,2025-04-24 21:07:02.205277,2025-04-24 21:07:03.059243,0 days 00:00:00.853966,squared_error,29,log2,2,7,best,TPESampler,COMPLETE
1022,0.4438474442892985,2025-04-24 21:07:02.794301,2025-04-24 21:07:03.486988,0 days 00:00:00.692687,squared_error,35,log2,1,10,best,TPESampler,COMPLETE
1023,0.9347481389709953,2025-04-24 21:07:03.176831,2025-04-24 21:07:04.102772,0 days 00:00:00.925941,friedman_mse,11,sqrt,9,2,random,TPESampler,COMPLETE
1024,0.7975493713728398,2025-04-24 21:07:03.368328,2025-04-24 21:07:04.251696,0 days 00:00:00.883368,squared_error,35,log2,3,9,best,TPESampler,COMPLETE
1025,0.7975493713728398,2025-04-24 21:07:03.716903,2025-04-24 21:07:04.536543,0 days 00:00:00.819640,squared_error,35,log2,2,14,best,TPESampler,COMPLETE
1026,0.5120876615801571,2025-04-24 21:07:04.330619,2025-04-24 21:07:05.107600,0 days 00:00:00.776981,squared_error,35,log2,1,12,best,TPESampler,COMPLETE
1027,0.9671029066257907,2025-04-24 21:07:04.484826,2025-04-24 21:07:05.487638,0 days 00:00:01.002812,absolute_error,25,log2,3,20,random,TPESampler,COMPLETE
1028,0.4438474442892985,2025-04-24 21:07:04.774864,2025-04-24 21:07:05.602255,0 days 00:00:00.827391,squared_error,35,log2,1,10,best,TPESampler,COMPLETE
1029,0.7975493713728398,2025-04-24 21:07:05.420054,2025-04-24 21:07:06.180352,0 days 00:00:00.760298,squared_error,35,log2,2,13,best,TPESampler,COMPLETE
1030,0.48051683833886516,2025-04-24 21:07:05.771083,2025-04-24 21:07:06.800795,0 days 00:00:01.029712,squared_error,35,log2,1,8,best,TPESampler,COMPLETE
1031,0.7975493713728398,2025-04-24 21:07:05.842136,2025-04-24 21:07:07.270286,0 days 00:00:01.428150,squared_error,30,log2,3,10,best,TPESampler,COMPLETE
1032,0.922426147955362,2025-04-24 21:07:06.680568,2025-04-24 21:07:07.557621,0 days 00:00:00.877053,squared_error,23,log2,2,18,random,TPESampler,COMPLETE
1033,0.6536086648697055,2025-04-24 21:07:07.262661,2025-04-24 21:07:08.215510,0 days 00:00:00.952849,squared_error,28,log2,1,6,best,TPESampler,COMPLETE
1034,0.6881819029838491,2025-04-24 21:07:07.556223,2025-04-24 21:07:08.402057,0 days 00:00:00.845834,squared_error,29,log2,1,12,best,TPESampler,COMPLETE
1035,0.6735913168527353,2025-04-24 21:07:07.951843,2025-04-24 21:07:08.711861,0 days 00:00:00.760018,squared_error,30,log2,1,10,best,TPESampler,COMPLETE
1036,0.5120876615801571,2025-04-24 21:07:08.497894,2025-04-24 21:07:09.612758,0 days 00:00:01.114864,squared_error,35,log2,1,12,best,TPESampler,COMPLETE
1037,0.5128537554029937,2025-04-24 21:07:08.672833,2025-04-24 21:07:10.116002,0 days 00:00:01.443169,squared_error,35,log2,1,11,best,TPESampler,COMPLETE
1038,0.6734080287670924,2025-04-24 21:07:08.950122,2025-04-24 21:07:10.356672,0 days 00:00:01.406550,squared_error,31,log2,1,8,best,TPESampler,COMPLETE
1039,0.9347481389709953,2025-04-24 21:07:10.021233,2025-04-24 21:07:10.976030,0 days 00:00:00.954797,squared_error,25,sqrt,6,5,random,TPESampler,COMPLETE
1040,0.5128537554029937,2025-04-24 21:07:10.556485,2025-04-24 21:07:11.516033,0 days 00:00:00.959548,friedman_mse,35,log2,1,11,best,TPESampler,COMPLETE
1041,0.6379608956994225,2025-04-24 21:07:10.813148,2025-04-24 21:07:11.743039,0 days 00:00:00.929891,squared_error,31,sqrt,2,7,best,TPESampler,COMPLETE
1042,0.7975493713728398,2025-04-24 21:07:11.214685,2025-04-24 21:07:12.100044,0 days 00:00:00.885359,squared_error,35,log2,3,10,best,TPESampler,COMPLETE
1043,0.786987845634963,2025-04-24 21:07:11.744223,2025-04-24 21:07:12.740866,0 days 00:00:00.996643,absolute_error,35,log2,3,9,best,TPESampler,COMPLETE
1044,0.7975493713728398,2025-04-24 21:07:12.013980,2025-04-24 21:07:13.037433,0 days 00:00:01.023453,squared_error,30,log2,2,17,best,TPESampler,COMPLETE
1045,0.6569705502301121,2025-04-24 21:07:12.518661,2025-04-24 21:07:13.345039,0 days 00:00:00.826378,absolute_error,35,sqrt,2,10,best,TPESampler,COMPLETE
1046,0.48051683833886516,2025-04-24 21:07:13.043645,2025-04-24 21:07:13.954284,0 days 00:00:00.910639,squared_error,35,log2,1,8,best,TPESampler,COMPLETE
1047,0.4438474442892985,2025-04-24 21:07:13.286882,2025-04-24 21:07:14.077065,0 days 00:00:00.790183,squared_error,35,log2,1,10,best,TPESampler,COMPLETE
1048,0.6747391651080636,2025-04-24 21:07:13.601620,2025-04-24 21:07:14.895974,0 days 00:00:01.294354,friedman_mse,29,log2,1,8,best,TPESampler,COMPLETE
1049,0.5128537554029937,2025-04-24 21:07:14.279977,2025-04-24 21:07:15.151795,0 days 00:00:00.871818,squared_error,35,log2,1,11,best,TPESampler,COMPLETE
1050,0.5128537554029937,2025-04-24 21:07:14.375013,2025-04-24 21:07:15.315615,0 days 00:00:00.940602,squared_error,35,log2,1,11,best,TPESampler,COMPLETE
1051,0.7975493713728398,2025-04-24 21:07:15.270232,2025-04-24 21:07:15.985750,0 days 00:00:00.715518,squared_error,35,log2,2,6,best,TPESampler,COMPLETE
1052,0.9494322793442198,2025-04-24 21:07:15.516748,2025-04-24 21:07:16.379986,0 days 00:00:00.863238,friedman_mse,4,log2,9,6,best,TPESampler,COMPLETE
1053,0.7975493713728398,2025-04-24 21:07:15.714365,2025-04-24 21:07:16.578176,0 days 00:00:00.863811,squared_error,30,log2,3,12,best,TPESampler,COMPLETE
1054,0.4948844885027081,2025-04-24 21:07:16.312033,2025-04-24 21:07:17.044383,0 days 00:00:00.732350,squared_error,35,log2,1,9,best,TPESampler,COMPLETE
1055,0.9494322793442198,2025-04-24 21:07:16.725671,2025-04-24 21:07:17.542526,0 days 00:00:00.816855,squared_error,30,log2,6,12,best,TPESampler,COMPLETE
1056,0.7975493713728398,2025-04-24 21:07:16.906661,2025-04-24 21:07:17.736558,0 days 00:00:00.829897,squared_error,29,log2,3,6,best,TPESampler,COMPLETE
1057,0.9014724344684435,2025-04-24 21:07:17.307186,2025-04-24 21:07:18.181349,0 days 00:00:00.874163,squared_error,23,log2,1,7,random,TPESampler,COMPLETE
1058,0.6735913168527353,2025-04-24 21:07:18.079470,2025-04-24 21:07:19.116404,0 days 00:00:01.036934,squared_error,30,log2,1,10,best,TPESampler,COMPLETE
1059,0.6733449539668771,2025-04-24 21:07:18.134639,2025-04-24 21:07:18.891811,0 days 00:00:00.757172,squared_error,28,log2,1,10,best,TPESampler,COMPLETE
1060,0.9663131987069496,2025-04-24 21:07:18.411482,2025-04-24 21:07:19.288258,0 days 00:00:00.876776,absolute_error,29,sqrt,1,8,random,TPESampler,COMPLETE
1061,0.6511497278763692,2025-04-24 21:07:19.170874,2025-04-24 21:07:19.849577,0 days 00:00:00.678703,squared_error,30,log2,1,7,best,TPESampler,COMPLETE
1062,0.9007598209071372,2025-04-24 21:07:19.357423,2025-04-24 21:07:20.348129,0 days 00:00:00.990706,friedman_mse,27,log2,1,9,random,TPESampler,COMPLETE
1063,0.7975493713728398,2025-04-24 21:07:19.655857,2025-04-24 21:07:20.461249,0 days 00:00:00.805392,squared_error,35,log2,3,8,best,TPESampler,COMPLETE
1064,0.4438474442892985,2025-04-24 21:07:20.176412,2025-04-24 21:07:20.906868,0 days 00:00:00.730456,squared_error,35,log2,1,10,best,TPESampler,COMPLETE
1065,0.48444975754384645,2025-04-24 21:07:20.574574,2025-04-24 21:07:21.451754,0 days 00:00:00.877180,squared_error,35,log2,1,14,best,TPESampler,COMPLETE
1066,0.6682355028351007,2025-04-24 21:07:20.762282,2025-04-24 21:07:21.643918,0 days 00:00:00.881636,squared_error,31,log2,1,14,best,TPESampler,COMPLETE
1067,0.7975493713728398,2025-04-24 21:07:21.153416,2025-04-24 21:07:22.013683,0 days 00:00:00.860267,squared_error,29,log2,3,12,best,TPESampler,COMPLETE
1068,1.0007431665713944,2025-04-24 21:07:21.718817,2025-04-24 21:07:22.569588,0 days 00:00:00.850771,absolute_error,3,log2,7,5,random,TPESampler,COMPLETE
1069,0.4438474442892985,2025-04-24 21:07:21.944150,2025-04-24 21:07:22.741718,0 days 00:00:00.797568,squared_error,35,log2,1,10,best,TPESampler,COMPLETE
1070,0.7975493713728398,2025-04-24 21:07:22.262288,2025-04-24 21:07:23.039862,0 days 00:00:00.777574,squared_error,35,log2,3,10,best,TPESampler,COMPLETE
1071,0.7975493713728398,2025-04-24 21:07:22.822839,2025-04-24 21:07:23.555530,0 days 00:00:00.732691,squared_error,30,log2,3,10,best,TPESampler,COMPLETE
1072,0.6756408221672622,2025-04-24 21:07:22.997609,2025-04-24 21:07:23.911234,0 days 00:00:00.913625,squared_error,30,log2,1,8,best,TPESampler,COMPLETE
1073,0.7035500740618197,2025-04-24 21:07:23.243825,2025-04-24 21:07:24.124596,0 days 00:00:00.880771,squared_error,20,log2,1,16,best,TPESampler,COMPLETE
1074,0.48051683833886516,2025-04-24 21:07:23.833090,2025-04-24 21:07:24.698977,0 days 00:00:00.865887,squared_error,35,log2,1,8,best,TPESampler,COMPLETE
1075,0.889614020123195,2025-04-24 21:07:24.222653,2025-04-24 21:07:24.889593,0 days 00:00:00.666940,friedman_mse,14,sqrt,4,17,best,TPESampler,COMPLETE
1076,0.972901152467277,2025-04-24 21:07:24.463504,2025-04-24 21:07:25.160521,0 days 00:00:00.697017,absolute_error,18,sqrt,4,15,random,TPESampler,COMPLETE
1077,0.7975493713728398,2025-04-24 21:07:25.051846,2025-04-24 21:07:26.017474,0 days 00:00:00.965628,squared_error,29,log2,3,9,best,TPESampler,COMPLETE
1078,0.6520278154474404,2025-04-24 21:07:25.117091,2025-04-24 21:07:26.327778,0 days 00:00:01.210687,absolute_error,26,log2,1,9,best,TPESampler,COMPLETE
1079,0.5128537554029937,2025-04-24 21:07:25.537429,2025-04-24 21:07:26.368634,0 days 00:00:00.831205,squared_error,35,log2,1,11,best,TPESampler,COMPLETE
1080,0.9494322793442198,2025-04-24 21:07:26.262051,2025-04-24 21:07:27.115127,0 days 00:00:00.853076,friedman_mse,4,log2,9,9,random,TPESampler,COMPLETE
1081,0.8027142882240161,2025-04-24 21:07:26.557905,2025-04-24 21:07:27.499900,0 days 00:00:00.941995,absolute_error,35,log2,1,13,best,TPESampler,COMPLETE
1082,0.495497014291423,2025-04-24 21:07:26.656856,2025-04-24 21:07:27.701941,0 days 00:00:01.045085,friedman_mse,34,sqrt,1,15,best,TPESampler,COMPLETE
1083,0.48051683833886516,2025-04-24 21:07:27.430158,2025-04-24 21:07:28.245366,0 days 00:00:00.815208,squared_error,35,log2,1,8,best,TPESampler,COMPLETE
1084,0.6545164836672983,2025-04-24 21:07:27.776278,2025-04-24 21:07:28.578110,0 days 00:00:00.801832,squared_error,29,log2,1,9,best,TPESampler,COMPLETE
1085,0.6881819029838491,2025-04-24 21:07:27.976911,2025-04-24 21:07:29.055600,0 days 00:00:01.078689,squared_error,29,log2,1,12,best,TPESampler,COMPLETE
1086,0.6243451061639267,2025-04-24 21:07:28.545497,2025-04-24 21:07:29.394075,0 days 00:00:00.848578,absolute_error,13,log2,1,16,best,TPESampler,COMPLETE
1087,0.924545407778719,2025-04-24 21:07:28.825251,2025-04-24 21:07:29.614588,0 days 00:00:00.789337,squared_error,1,sqrt,2,11,random,TPESampler,COMPLETE
1088,0.7975493713728398,2025-04-24 21:07:29.331234,2025-04-24 21:07:30.179988,0 days 00:00:00.848754,squared_error,35,log2,3,9,best,TPESampler,COMPLETE
1089,0.44670023329729247,2025-04-24 21:07:29.677997,2025-04-24 21:07:30.577907,0 days 00:00:00.899910,squared_error,35,log2,1,7,best,TPESampler,COMPLETE
1090,0.4948844885027081,2025-04-24 21:07:29.842085,2025-04-24 21:07:30.801337,0 days 00:00:00.959252,squared_error,35,log2,1,9,best,TPESampler,COMPLETE
1091,0.7975493713728398,2025-04-24 21:07:30.507418,2025-04-24 21:07:31.279424,0 days 00:00:00.772006,squared_error,20,log2,2,12,best,TPESampler,COMPLETE
1092,0.7975493713728398,2025-04-24 21:07:30.855729,2025-04-24 21:07:31.622201,0 days 00:00:00.766472,squared_error,35,log2,2,13,best,TPESampler,COMPLETE
1093,0.889614020123195,2025-04-24 21:07:31.126776,2025-04-24 21:07:31.956848,0 days 00:00:00.830072,squared_error,26,sqrt,4,11,best,TPESampler,COMPLETE
1094,0.7975493713728398,2025-04-24 21:07:31.623649,2025-04-24 21:07:32.518650,0 days 00:00:00.895001,squared_error,35,log2,3,12,best,TPESampler,COMPLETE
1095,0.6702958143159663,2025-04-24 21:07:31.826059,2025-04-24 21:07:32.674212,0 days 00:00:00.848153,friedman_mse,29,log2,1,13,best,TPESampler,COMPLETE
1096,0.5101622714757418,2025-04-24 21:07:32.252510,2025-04-24 21:07:33.109656,0 days 00:00:00.857146,squared_error,35,log2,1,13,best,TPESampler,COMPLETE
1097,0.6831095431530921,2025-04-24 21:07:32.768787,2025-04-24 21:07:33.609128,0 days 00:00:00.840341,squared_error,28,log2,1,11,best,TPESampler,COMPLETE
1098,0.5128537554029937,2025-04-24 21:07:32.975294,2025-04-24 21:07:33.832115,0 days 00:00:00.856821,squared_error,35,log2,1,11,best,TPESampler,COMPLETE
1099,0.6545164836672983,2025-04-24 21:07:33.381954,2025-04-24 21:07:34.070892,0 days 00:00:00.688938,squared_error,29,log2,1,9,best,TPESampler,COMPLETE
1100,0.7975493713728398,2025-04-24 21:07:33.871056,2025-04-24 21:07:34.540186,0 days 00:00:00.669130,friedman_mse,3,log2,2,15,best,TPESampler,COMPLETE
1101,0.4948844885027081,2025-04-24 21:07:34.097559,2025-04-24 21:07:34.894746,0 days 00:00:00.797187,squared_error,35,log2,1,9,best,TPESampler,COMPLETE
1102,0.7975493713728398,2025-04-24 21:07:34.425557,2025-04-24 21:07:35.750982,0 days 00:00:01.325425,squared_error,35,log2,3,11,best,TPESampler,COMPLETE
1103,0.9038888070762442,2025-04-24 21:07:34.827370,2025-04-24 21:07:36.632994,0 days 00:00:01.805624,squared_error,34,log2,1,10,random,TPESampler,COMPLETE
1104,0.5128537554029937,2025-04-24 21:07:35.642176,2025-04-24 21:07:36.970379,0 days 00:00:01.328203,squared_error,35,log2,1,11,best,TPESampler,COMPLETE
1105,0.44670023329729247,2025-04-24 21:07:36.401894,2025-04-24 21:07:37.197734,0 days 00:00:00.795840,squared_error,35,log2,1,7,best,TPESampler,COMPLETE
1106,0.6729478953566472,2025-04-24 21:07:36.915860,2025-04-24 21:07:37.599910,0 days 00:00:00.684050,squared_error,21,log2,1,7,best,TPESampler,COMPLETE
1107,0.4948844885027081,2025-04-24 21:07:37.293427,2025-04-24 21:07:38.156097,0 days 00:00:00.862670,friedman_mse,35,log2,1,9,best,TPESampler,COMPLETE
1108,0.6702958143159663,2025-04-24 21:07:37.461727,2025-04-24 21:07:38.350664,0 days 00:00:00.888937,squared_error,29,log2,1,13,best,TPESampler,COMPLETE
1109,0.9029572497460439,2025-04-24 21:07:37.856352,2025-04-24 21:07:38.686287,0 days 00:00:00.829935,friedman_mse,33,log2,1,12,random,TPESampler,COMPLETE
1110,0.7975493713728398,2025-04-24 21:07:38.398045,2025-04-24 21:07:39.212343,0 days 00:00:00.814298,squared_error,35,log2,3,6,best,TPESampler,COMPLETE
1111,0.6335124317141577,2025-04-24 21:07:38.692490,2025-04-24 21:07:39.544695,0 days 00:00:00.852205,friedman_mse,35,sqrt,1,9,best,TPESampler,COMPLETE
1112,0.5120876615801571,2025-04-24 21:07:38.904195,2025-04-24 21:07:39.783263,0 days 00:00:00.879068,squared_error,35,log2,1,12,best,TPESampler,COMPLETE
1113,0.9993409537053991,2025-04-24 21:07:39.490891,2025-04-24 21:07:40.262508,0 days 00:00:00.771617,absolute_error,32,sqrt,10,15,random,TPESampler,COMPLETE
1114,0.6266667029663823,2025-04-24 21:07:39.823455,2025-04-24 21:07:40.645023,0 days 00:00:00.821568,absolute_error,35,log2,1,7,best,TPESampler,COMPLETE
1115,0.6881819029838491,2025-04-24 21:07:40.004054,2025-04-24 21:07:40.837828,0 days 00:00:00.833774,squared_error,29,log2,1,12,best,TPESampler,COMPLETE
1116,0.6765049187574741,2025-04-24 21:07:40.578572,2025-04-24 21:07:41.245765,0 days 00:00:00.667193,squared_error,29,log2,1,10,best,TPESampler,COMPLETE
1117,0.4438474442892985,2025-04-24 21:07:40.943661,2025-04-24 21:07:41.735952,0 days 00:00:00.792291,squared_error,35,log2,1,10,best,TPESampler,COMPLETE
1118,0.7975493713728398,2025-04-24 21:07:41.120989,2025-04-24 21:07:41.875542,0 days 00:00:00.754553,friedman_mse,31,log2,3,10,best,TPESampler,COMPLETE
1119,0.7975493713728398,2025-04-24 21:07:41.490152,2025-04-24 21:07:42.258066,0 days 00:00:00.767914,squared_error,35,log2,3,9,best,TPESampler,COMPLETE
1120,0.6553604014596837,2025-04-24 21:07:41.950667,2025-04-24 21:07:42.754111,0 days 00:00:00.803444,squared_error,29,log2,1,6,best,TPESampler,COMPLETE
1121,0.4948844885027081,2025-04-24 21:07:42.122401,2025-04-24 21:07:42.972618,0 days 00:00:00.850217,squared_error,35,log2,1,9,best,TPESampler,COMPLETE
1122,0.7975493713728398,2025-04-24 21:07:42.539618,2025-04-24 21:07:43.266438,0 days 00:00:00.726820,squared_error,29,log2,2,10,best,TPESampler,COMPLETE
1123,0.7975493713728398,2025-04-24 21:07:43.224034,2025-04-24 21:07:44.102541,0 days 00:00:00.878507,friedman_mse,33,log2,3,18,best,TPESampler,COMPLETE
1124,1.0007431665713944,2025-04-24 21:07:43.272925,2025-04-24 21:07:44.535134,0 days 00:00:01.262209,absolute_error,12,log2,8,18,best,TPESampler,COMPLETE
1125,0.7975493713728398,2025-04-24 21:07:43.469966,2025-04-24 21:07:44.359308,0 days 00:00:00.889342,squared_error,35,log2,2,8,best,TPESampler,COMPLETE
1126,1.0171174076762823,2025-04-24 21:07:44.436562,2025-04-24 21:07:45.427319,0 days 00:00:00.990757,absolute_error,2,log2,1,3,best,TPESampler,COMPLETE
1127,0.48444975754384645,2025-04-24 21:07:44.795173,2025-04-24 21:07:45.998234,0 days 00:00:01.203061,squared_error,35,log2,1,14,best,TPESampler,COMPLETE
1128,0.7975493713728398,2025-04-24 21:07:44.984309,2025-04-24 21:07:46.902427,0 days 00:00:01.918118,squared_error,29,log2,3,10,best,TPESampler,COMPLETE
1129,0.6765049187574741,2025-04-24 21:07:45.948957,2025-04-24 21:07:47.359462,0 days 00:00:01.410505,squared_error,29,log2,1,10,best,TPESampler,COMPLETE
1130,0.7975493713728398,2025-04-24 21:07:46.605917,2025-04-24 21:07:48.025339,0 days 00:00:01.419422,friedman_mse,35,log2,2,12,best,TPESampler,COMPLETE
1131,0.6409272396101185,2025-04-24 21:07:47.545531,2025-04-24 21:07:49.567006,0 days 00:00:02.021475,squared_error,29,sqrt,1,10,best,TPESampler,COMPLETE
1132,0.7975493713728398,2025-04-24 21:07:48.031623,2025-04-24 21:07:50.397099,0 days 00:00:02.365476,squared_error,35,log2,2,10,best,TPESampler,COMPLETE
1133,0.922426147955362,2025-04-24 21:07:49.036524,2025-04-24 21:07:51.189323,0 days 00:00:02.152799,squared_error,35,log2,3,7,random,TPESampler,COMPLETE
1134,0.4438474442892985,2025-04-24 21:07:50.341533,2025-04-24 21:07:52.078618,0 days 00:00:01.737085,squared_error,35,log2,1,10,best,TPESampler,COMPLETE
1135,0.6914253690247881,2025-04-24 21:07:50.913708,2025-04-24 21:07:52.278461,0 days 00:00:01.364753,squared_error,29,log2,1,11,best,TPESampler,COMPLETE
1136,0.7975493713728398,2025-04-24 21:07:51.639376,2025-04-24 21:07:52.647565,0 days 00:00:01.008189,squared_error,35,log2,2,12,best,TPESampler,COMPLETE
1137,0.6511497278763692,2025-04-24 21:07:52.389807,2025-04-24 21:07:53.517410,0 days 00:00:01.127603,squared_error,30,log2,1,7,best,TPESampler,COMPLETE
1138,0.4438474442892985,2025-04-24 21:07:52.584756,2025-04-24 21:07:53.888930,0 days 00:00:01.304174,squared_error,35,log2,1,10,best,TPESampler,COMPLETE
1139,0.44670023329729247,2025-04-24 21:07:52.992976,2025-04-24 21:07:54.749524,0 days 00:00:01.756548,squared_error,35,log2,1,7,best,TPESampler,COMPLETE
1140,0.7975493713728398,2025-04-24 21:07:53.982754,2025-04-24 21:07:55.211847,0 days 00:00:01.229093,squared_error,35,log2,2,11,best,TPESampler,COMPLETE
1141,0.48444975754384645,2025-04-24 21:07:54.199301,2025-04-24 21:07:55.216520,0 days 00:00:01.017219,squared_error,35,log2,1,14,best,TPESampler,COMPLETE
1142,0.6765049187574741,2025-04-24 21:07:55.092888,2025-04-24 21:07:56.131265,0 days 00:00:01.038377,squared_error,29,log2,1,10,best,TPESampler,COMPLETE
