number,value,datetime_start,datetime_complete,duration,params_criterion,params_max_depth,params_max_features,params_min_samples_leaf,params_min_samples_split,params_splitter,system_attrs_auto:sampler,state
858,0.6545164836672983,2025-04-24 21:05:59.362146,2025-04-24 21:06:00.236993,0 days 00:00:00.874847,squared_error,29,log2,1,9,best,TPESampler,COMPLETE
859,0.48051683833886516,2025-04-24 21:05:59.974342,2025-04-24 21:06:01.042139,0 days 00:00:01.067797,squared_error,35,log2,1,8,best,TPESampler,COMPLETE
860,0.4438474442892985,2025-04-24 21:06:00.117100,2025-04-24 21:06:01.226614,0 days 00:00:01.109514,squared_error,35,log2,1,10,best,TPESampler,COMPLETE
861,0.6702958143159663,2025-04-24 21:06:00.523330,2025-04-24 21:06:01.530736,0 days 00:00:01.007406,squared_error,29,log2,1,13,best,TPESampler,COMPLETE
862,0.9347481389709953,2025-04-24 21:06:01.433133,2025-04-24 21:06:02.265048,0 days 00:00:00.831915,friedman_mse,28,sqrt,10,13,random,TPESampler,COMPLETE
863,0.786987845634963,2025-04-24 21:06:01.487869,2025-04-24 21:06:02.485070,0 days 00:00:00.997201,absolute_error,34,log2,2,10,best,TPESampler,COMPLETE
864,0.922426147955362,2025-04-24 21:06:01.758098,2025-04-24 21:06:02.638733,0 days 00:00:00.880635,squared_error,17,log2,5,10,random,TPESampler,COMPLETE
865,0.9494322793442198,2025-04-24 21:06:02.571746,2025-04-24 21:06:03.465914,0 days 00:00:00.894168,squared_error,7,log2,8,19,best,TPESampler,COMPLETE
866,0.7975493713728398,2025-04-24 21:06:02.780763,2025-04-24 21:06:03.771232,0 days 00:00:00.990469,squared_error,29,log2,3,11,best,TPESampler,COMPLETE
867,0.7975493713728398,2025-04-24 21:06:02.939740,2025-04-24 21:06:03.836705,0 days 00:00:00.896965,squared_error,35,log2,3,9,best,TPESampler,COMPLETE
868,0.7975493713728398,2025-04-24 21:06:03.715816,2025-04-24 21:06:04.462026,0 days 00:00:00.746210,squared_error,35,log2,3,13,best,TPESampler,COMPLETE
869,0.5120876615801571,2025-04-24 21:06:04.068608,2025-04-24 21:06:05.105187,0 days 00:00:01.036579,squared_error,35,log2,1,12,best,TPESampler,COMPLETE
870,0.4948844885027081,2025-04-24 21:06:04.133135,2025-04-24 21:06:05.234092,0 days 00:00:01.100957,squared_error,35,log2,1,9,best,TPESampler,COMPLETE
871,0.48051683833886516,2025-04-24 21:06:04.728629,2025-04-24 21:06:05.530044,0 days 00:00:00.801415,friedman_mse,35,log2,1,8,best,TPESampler,COMPLETE
872,0.6735913168527353,2025-04-24 21:06:05.377363,2025-04-24 21:06:06.236781,0 days 00:00:00.859418,squared_error,30,log2,1,10,best,TPESampler,COMPLETE
873,0.6831095431530921,2025-04-24 21:06:05.480034,2025-04-24 21:06:06.366799,0 days 00:00:00.886765,squared_error,28,log2,1,11,best,TPESampler,COMPLETE
874,0.8991600557359704,2025-04-24 21:06:05.979489,2025-04-24 21:06:07.140210,0 days 00:00:01.160721,squared_error,30,log2,1,11,random,TPESampler,COMPLETE
875,0.9040925312139748,2025-04-24 21:06:06.709799,2025-04-24 21:06:07.798571,0 days 00:00:01.088772,squared_error,34,log2,1,11,random,TPESampler,COMPLETE
876,0.7975493713728398,2025-04-24 21:06:06.855279,2025-04-24 21:06:07.856203,0 days 00:00:01.000924,squared_error,35,log2,2,7,best,TPESampler,COMPLETE
877,0.9494322793442198,2025-04-24 21:06:07.579996,2025-04-24 21:06:08.299728,0 days 00:00:00.719732,friedman_mse,9,log2,6,15,best,TPESampler,COMPLETE
878,0.5120876615801571,2025-04-24 21:06:08.036165,2025-04-24 21:06:09.056238,0 days 00:00:01.020073,squared_error,35,log2,1,12,best,TPESampler,COMPLETE
879,0.5120876615801571,2025-04-24 21:06:08.086409,2025-04-24 21:06:08.913532,0 days 00:00:00.827123,squared_error,35,log2,1,12,best,TPESampler,COMPLETE
880,0.8894105515009568,2025-04-24 21:06:08.621721,2025-04-24 21:06:09.461740,0 days 00:00:00.840019,friedman_mse,19,sqrt,9,15,best,TPESampler,COMPLETE
881,0.6553604014596837,2025-04-24 21:06:09.213492,2025-04-24 21:06:10.046680,0 days 00:00:00.833188,squared_error,29,log2,1,6,best,TPESampler,COMPLETE
882,0.7975493713728398,2025-04-24 21:06:09.270664,2025-04-24 21:06:10.119883,0 days 00:00:00.849219,squared_error,29,log2,2,6,best,TPESampler,COMPLETE
883,0.44670023329729247,2025-04-24 21:06:09.758828,2025-04-24 21:06:10.442373,0 days 00:00:00.683545,squared_error,35,log2,1,7,best,TPESampler,COMPLETE
884,0.4438474442892985,2025-04-24 21:06:10.277028,2025-04-24 21:06:11.254182,0 days 00:00:00.977154,squared_error,35,log2,1,10,best,TPESampler,COMPLETE
885,0.6545164836672983,2025-04-24 21:06:10.321215,2025-04-24 21:06:11.220664,0 days 00:00:00.899449,squared_error,29,log2,1,9,best,TPESampler,COMPLETE
886,0.6879152987275021,2025-04-24 21:06:10.694066,2025-04-24 21:06:11.627211,0 days 00:00:00.933145,absolute_error,35,log2,1,10,best,TPESampler,COMPLETE
887,0.7975493713728398,2025-04-24 21:06:11.518653,2025-04-24 21:06:12.605955,0 days 00:00:01.087302,squared_error,29,log2,2,10,best,TPESampler,COMPLETE
888,0.7975493713728398,2025-04-24 21:06:11.575903,2025-04-24 21:06:12.383538,0 days 00:00:00.807635,squared_error,35,log2,3,9,best,TPESampler,COMPLETE
889,0.7975493713728398,2025-04-24 21:06:11.860727,2025-04-24 21:06:12.719572,0 days 00:00:00.858845,squared_error,29,log2,3,11,best,TPESampler,COMPLETE
890,0.7127472187776792,2025-04-24 21:06:12.626767,2025-04-24 21:06:13.268612,0 days 00:00:00.641845,squared_error,35,sqrt,1,11,random,TPESampler,COMPLETE
891,1.0007431665713944,2025-04-24 21:06:12.833986,2025-04-24 21:06:13.687865,0 days 00:00:00.853879,absolute_error,12,log2,4,4,best,TPESampler,COMPLETE
892,0.6692087088741673,2025-04-24 21:06:13.217251,2025-04-24 21:06:14.030932,0 days 00:00:00.813681,squared_error,30,log2,1,9,best,TPESampler,COMPLETE
893,0.9993409537053991,2025-04-24 21:06:13.535635,2025-04-24 21:06:14.396313,0 days 00:00:00.860678,absolute_error,27,sqrt,7,15,random,TPESampler,COMPLETE
894,0.894550859606008,2025-04-24 21:06:13.977799,2025-04-24 21:06:15.096393,0 days 00:00:01.118594,squared_error,26,sqrt,8,18,best,TPESampler,COMPLETE
895,0.44670023329729247,2025-04-24 21:06:14.345449,2025-04-24 21:06:15.316151,0 days 00:00:00.970702,squared_error,35,log2,1,7,best,TPESampler,COMPLETE
896,0.4948844885027081,2025-04-24 21:06:14.700188,2025-04-24 21:06:15.759097,0 days 00:00:01.058909,squared_error,35,log2,1,9,best,TPESampler,COMPLETE
897,0.5120876615801571,2025-04-24 21:06:15.395005,2025-04-24 21:06:16.174962,0 days 00:00:00.779957,squared_error,35,log2,1,12,best,TPESampler,COMPLETE
898,0.5120876615801571,2025-04-24 21:06:15.553835,2025-04-24 21:06:16.402490,0 days 00:00:00.848655,squared_error,35,log2,1,12,best,TPESampler,COMPLETE
899,0.4438474442892985,2025-04-24 21:06:16.061625,2025-04-24 21:06:16.734737,0 days 00:00:00.673112,squared_error,35,log2,1,10,best,TPESampler,COMPLETE
900,0.7975493713728398,2025-04-24 21:06:16.476415,2025-04-24 21:06:17.288542,0 days 00:00:00.812127,squared_error,30,log2,3,12,best,TPESampler,COMPLETE
901,0.9638042122577196,2025-04-24 21:06:16.676736,2025-04-24 21:06:17.671146,0 days 00:00:00.994410,absolute_error,19,sqrt,2,4,random,TPESampler,COMPLETE
902,0.671564007425267,2025-04-24 21:06:16.942904,2025-04-24 21:06:17.945167,0 days 00:00:01.002263,squared_error,30,log2,1,13,best,TPESampler,COMPLETE
903,0.5128537554029937,2025-04-24 21:06:17.554792,2025-04-24 21:06:18.559582,0 days 00:00:01.004790,friedman_mse,35,log2,1,11,best,TPESampler,COMPLETE
904,0.9084558828920171,2025-04-24 21:06:18.035795,2025-04-24 21:06:18.740490,0 days 00:00:00.704695,friedman_mse,15,sqrt,1,15,random,TPESampler,COMPLETE
905,0.9993409537053991,2025-04-24 21:06:18.267342,2025-04-24 21:06:19.059305,0 days 00:00:00.791963,absolute_error,2,sqrt,10,8,random,TPESampler,COMPLETE
906,0.7975493713728398,2025-04-24 21:06:18.798539,2025-04-24 21:06:19.739395,0 days 00:00:00.940856,squared_error,35,log2,3,8,best,TPESampler,COMPLETE
907,0.4948844885027081,2025-04-24 21:06:19.063252,2025-04-24 21:06:19.950012,0 days 00:00:00.886760,squared_error,35,log2,1,9,best,TPESampler,COMPLETE
908,0.6689797096059603,2025-04-24 21:06:19.452576,2025-04-24 21:06:20.321021,0 days 00:00:00.868445,squared_error,30,log2,1,11,best,TPESampler,COMPLETE
909,0.7975493713728398,2025-04-24 21:06:20.018622,2025-04-24 21:06:20.755608,0 days 00:00:00.736986,squared_error,35,log2,2,10,best,TPESampler,COMPLETE
910,0.9379476480807927,2025-04-24 21:06:20.198599,2025-04-24 21:06:21.143302,0 days 00:00:00.944703,friedman_mse,7,log2,1,5,random,TPESampler,COMPLETE
911,0.48444975754384645,2025-04-24 21:06:20.599824,2025-04-24 21:06:21.334529,0 days 00:00:00.734705,squared_error,35,log2,1,14,best,TPESampler,COMPLETE
912,0.48051683833886516,2025-04-24 21:06:21.067309,2025-04-24 21:06:21.809706,0 days 00:00:00.742397,squared_error,35,log2,1,8,best,TPESampler,COMPLETE
913,0.7975493713728398,2025-04-24 21:06:21.443496,2025-04-24 21:06:22.328327,0 days 00:00:00.884831,squared_error,35,log2,2,11,best,TPESampler,COMPLETE
914,0.7975493713728398,2025-04-24 21:06:21.595722,2025-04-24 21:06:22.398443,0 days 00:00:00.802721,squared_error,35,log2,3,12,best,TPESampler,COMPLETE
915,0.6545164836672983,2025-04-24 21:06:22.056895,2025-04-24 21:06:22.776507,0 days 00:00:00.719612,squared_error,29,log2,1,9,best,TPESampler,COMPLETE
916,0.7975493713728398,2025-04-24 21:06:22.507500,2025-04-24 21:06:23.312891,0 days 00:00:00.805391,squared_error,35,log2,3,6,best,TPESampler,COMPLETE
917,0.4438474442892985,2025-04-24 21:06:22.570607,2025-04-24 21:06:23.444386,0 days 00:00:00.873779,squared_error,35,log2,1,10,best,TPESampler,COMPLETE
918,0.7975493713728398,2025-04-24 21:06:23.216803,2025-04-24 21:06:23.874201,0 days 00:00:00.657398,squared_error,29,log2,2,10,best,TPESampler,COMPLETE
919,0.4948844885027081,2025-04-24 21:06:23.560406,2025-04-24 21:06:24.407494,0 days 00:00:00.847088,squared_error,35,log2,1,9,best,TPESampler,COMPLETE
920,0.9486947174197512,2025-04-24 21:06:23.609318,2025-04-24 21:06:24.599922,0 days 00:00:00.990604,friedman_mse,1,sqrt,4,19,best,TPESampler,COMPLETE
921,0.4948844885027081,2025-04-24 21:06:24.328778,2025-04-24 21:06:25.038280,0 days 00:00:00.709502,squared_error,35,log2,1,9,best,TPESampler,COMPLETE
922,0.7975493713728398,2025-04-24 21:06:24.718925,2025-04-24 21:06:25.574383,0 days 00:00:00.855458,squared_error,35,log2,3,13,best,TPESampler,COMPLETE
923,0.7975493713728398,2025-04-24 21:06:24.914211,2025-04-24 21:06:25.763899,0 days 00:00:00.849688,squared_error,35,log2,3,13,best,TPESampler,COMPLETE
924,0.6633411862198678,2025-04-24 21:06:25.260067,2025-04-24 21:06:26.121318,0 days 00:00:00.861251,friedman_mse,28,sqrt,1,17,random,TPESampler,COMPLETE
925,0.4438474442892985,2025-04-24 21:06:25.817632,2025-04-24 21:06:26.643817,0 days 00:00:00.826185,squared_error,35,log2,1,10,best,TPESampler,COMPLETE
926,0.8876713258154219,2025-04-24 21:06:26.006684,2025-04-24 21:06:26.823147,0 days 00:00:00.816463,friedman_mse,29,sqrt,5,13,best,TPESampler,COMPLETE
927,0.9993409537053991,2025-04-24 21:06:26.351600,2025-04-24 21:06:27.536431,0 days 00:00:01.184831,absolute_error,15,sqrt,7,2,random,TPESampler,COMPLETE
928,0.6914253690247881,2025-04-24 21:06:26.963286,2025-04-24 21:06:27.752315,0 days 00:00:00.789029,squared_error,29,log2,1,11,best,TPESampler,COMPLETE
929,0.6545164836672983,2025-04-24 21:06:27.063816,2025-04-24 21:06:27.872087,0 days 00:00:00.808271,squared_error,29,log2,1,9,best,TPESampler,COMPLETE
930,0.5128537554029937,2025-04-24 21:06:27.823719,2025-04-24 21:06:28.453666,0 days 00:00:00.629947,squared_error,35,log2,1,11,best,TPESampler,COMPLETE
931,0.7975493713728398,2025-04-24 21:06:28.038968,2025-04-24 21:06:29.019904,0 days 00:00:00.980936,squared_error,30,log2,2,8,best,TPESampler,COMPLETE
932,0.4948844885027081,2025-04-24 21:06:28.233343,2025-04-24 21:06:29.074865,0 days 00:00:00.841522,squared_error,35,log2,1,9,best,TPESampler,COMPLETE
933,0.7975493713728398,2025-04-24 21:06:28.728064,2025-04-24 21:06:29.569855,0 days 00:00:00.841791,squared_error,35,log2,2,10,best,TPESampler,COMPLETE
934,0.9494322793442198,2025-04-24 21:06:29.213680,2025-04-24 21:06:30.185245,0 days 00:00:00.971565,squared_error,18,log2,5,2,best,TPESampler,COMPLETE
935,0.7975493713728398,2025-04-24 21:06:29.272491,2025-04-24 21:06:30.254761,0 days 00:00:00.982270,squared_error,29,log2,2,12,best,TPESampler,COMPLETE
936,0.7975493713728398,2025-04-24 21:06:29.819752,2025-04-24 21:06:30.598005,0 days 00:00:00.778253,friedman_mse,35,log2,3,12,best,TPESampler,COMPLETE
937,0.7030607691189532,2025-04-24 21:06:30.490659,2025-04-24 21:06:31.431954,0 days 00:00:00.941295,squared_error,31,log2,1,13,best,TPESampler,COMPLETE
938,0.5128537554029937,2025-04-24 21:06:30.551510,2025-04-24 21:06:31.503831,0 days 00:00:00.952321,squared_error,35,log2,1,11,best,TPESampler,COMPLETE
939,0.7975493713728398,2025-04-24 21:06:31.141937,2025-04-24 21:06:31.791494,0 days 00:00:00.649557,squared_error,29,log2,3,8,best,TPESampler,COMPLETE
940,0.5962489373305783,2025-04-24 21:06:31.682631,2025-04-24 21:06:32.518122,0 days 00:00:00.835491,squared_error,34,sqrt,1,9,best,TPESampler,COMPLETE
941,0.6511497278763692,2025-04-24 21:06:31.746387,2025-04-24 21:06:32.526475,0 days 00:00:00.780088,squared_error,30,log2,1,7,best,TPESampler,COMPLETE
942,0.4948844885027081,2025-04-24 21:06:32.248297,2025-04-24 21:06:32.945763,0 days 00:00:00.697466,friedman_mse,35,log2,1,9,best,TPESampler,COMPLETE
943,0.7975493713728398,2025-04-24 21:06:32.738213,2025-04-24 21:06:33.477522,0 days 00:00:00.739309,squared_error,35,log2,3,10,best,TPESampler,COMPLETE
944,0.5120876615801571,2025-04-24 21:06:32.795147,2025-04-24 21:06:33.684713,0 days 00:00:00.889566,squared_error,35,log2,1,12,best,TPESampler,COMPLETE
945,0.671564007425267,2025-04-24 21:06:33.197581,2025-04-24 21:06:33.945204,0 days 00:00:00.747623,squared_error,30,log2,1,13,best,TPESampler,COMPLETE
946,0.8942042180115075,2025-04-24 21:06:33.794550,2025-04-24 21:06:34.719962,0 days 00:00:00.925412,squared_error,10,sqrt,10,20,best,TPESampler,COMPLETE
947,0.44670023329729247,2025-04-24 21:06:33.884335,2025-04-24 21:06:34.792505,0 days 00:00:00.908170,squared_error,35,log2,1,7,best,TPESampler,COMPLETE
948,0.7975493713728398,2025-04-24 21:06:34.398812,2025-04-24 21:06:35.120162,0 days 00:00:00.721350,squared_error,35,log2,2,7,best,TPESampler,COMPLETE
949,0.7975493713728398,2025-04-24 21:06:34.989485,2025-04-24 21:06:35.946042,0 days 00:00:00.956557,squared_error,30,log2,3,10,best,TPESampler,COMPLETE
950,0.922426147955362,2025-04-24 21:06:35.070645,2025-04-24 21:06:35.940637,0 days 00:00:00.869992,squared_error,27,log2,3,8,random,TPESampler,COMPLETE
951,0.46385297432679357,2025-04-24 21:06:35.604808,2025-04-24 21:06:36.416962,0 days 00:00:00.812154,squared_error,35,log2,1,15,best,TPESampler,COMPLETE
952,0.5120876615801571,2025-04-24 21:06:36.130967,2025-04-24 21:06:37.020983,0 days 00:00:00.890016,squared_error,35,log2,1,12,best,TPESampler,COMPLETE
953,0.6545164836672983,2025-04-24 21:06:36.184529,2025-04-24 21:06:37.093228,0 days 00:00:00.908699,squared_error,29,log2,1,9,best,TPESampler,COMPLETE
954,0.6765049187574741,2025-04-24 21:06:36.714567,2025-04-24 21:06:37.820930,0 days 00:00:01.106363,squared_error,29,log2,1,10,best,TPESampler,COMPLETE
955,0.5128537554029937,2025-04-24 21:06:37.223648,2025-04-24 21:06:38.224988,0 days 00:00:01.001340,squared_error,35,log2,1,11,best,TPESampler,COMPLETE
956,0.7975493713728398,2025-04-24 21:06:37.273937,2025-04-24 21:06:38.227617,0 days 00:00:00.953680,squared_error,35,log2,3,8,best,TPESampler,COMPLETE
957,0.4948844885027081,2025-04-24 21:06:38.033019,2025-04-24 21:06:38.686915,0 days 00:00:00.653896,squared_error,35,log2,1,9,best,TPESampler,COMPLETE
958,0.6175599523851972,2025-04-24 21:06:38.425759,2025-04-24 21:06:39.277998,0 days 00:00:00.852239,absolute_error,35,log2,1,11,best,TPESampler,COMPLETE
959,0.8913351576037826,2025-04-24 21:06:38.476830,2025-04-24 21:06:39.408971,0 days 00:00:00.932141,squared_error,35,sqrt,3,12,best,TPESampler,COMPLETE
960,0.7975493713728398,2025-04-24 21:06:38.987858,2025-04-24 21:06:39.744510,0 days 00:00:00.756652,squared_error,35,log2,3,9,best,TPESampler,COMPLETE
961,0.6692087088741673,2025-04-24 21:06:39.600782,2025-04-24 21:06:40.771817,0 days 00:00:01.171035,squared_error,30,log2,1,9,best,TPESampler,COMPLETE
962,0.6735913168527353,2025-04-24 21:06:39.688176,2025-04-24 21:06:40.465607,0 days 00:00:00.777431,squared_error,30,log2,1,10,best,TPESampler,COMPLETE
963,0.9494322793442198,2025-04-24 21:06:39.988031,2025-04-24 21:06:40.799860,0 days 00:00:00.811829,squared_error,16,log2,10,19,best,TPESampler,COMPLETE
964,0.889614020123195,2025-04-24 21:06:40.723449,2025-04-24 21:06:41.458969,0 days 00:00:00.735520,friedman_mse,35,sqrt,4,18,best,TPESampler,COMPLETE
965,0.4948844885027081,2025-04-24 21:06:40.984493,2025-04-24 21:06:41.795178,0 days 00:00:00.810685,squared_error,35,log2,1,9,best,TPESampler,COMPLETE
966,0.7975493713728398,2025-04-24 21:06:41.028162,2025-04-24 21:06:42.051238,0 days 00:00:01.023076,squared_error,27,log2,3,15,best,TPESampler,COMPLETE
967,0.6881819029838491,2025-04-24 21:06:41.748988,2025-04-24 21:06:42.624454,0 days 00:00:00.875466,squared_error,29,log2,1,12,best,TPESampler,COMPLETE
968,0.44670023329729247,2025-04-24 21:06:42.166386,2025-04-24 21:06:42.878200,0 days 00:00:00.711814,squared_error,35,log2,1,7,best,TPESampler,COMPLETE
969,0.5120876615801571,2025-04-24 21:06:42.408883,2025-04-24 21:06:43.165194,0 days 00:00:00.756311,squared_error,35,log2,1,12,best,TPESampler,COMPLETE
970,1.0007431665713944,2025-04-24 21:06:42.871839,2025-04-24 21:06:43.659165,0 days 00:00:00.787326,absolute_error,34,log2,8,18,best,TPESampler,COMPLETE
971,0.7975493713728398,2025-04-24 21:06:43.169322,2025-04-24 21:06:43.967167,0 days 00:00:00.797845,squared_error,35,log2,3,11,best,TPESampler,COMPLETE
972,0.7975493713728398,2025-04-24 21:06:43.531226,2025-04-24 21:06:44.314676,0 days 00:00:00.783450,squared_error,35,log2,3,13,best,TPESampler,COMPLETE
973,0.7975493713728398,2025-04-24 21:06:43.965835,2025-04-24 21:06:44.890981,0 days 00:00:00.925146,squared_error,30,log2,2,8,best,TPESampler,COMPLETE
974,0.48051683833886516,2025-04-24 21:06:44.267233,2025-04-24 21:06:45.089005,0 days 00:00:00.821772,squared_error,35,log2,1,8,best,TPESampler,COMPLETE
975,0.9068679541938097,2025-04-24 21:06:44.643421,2025-04-24 21:06:45.381521,0 days 00:00:00.738100,squared_error,35,log2,1,12,random,TPESampler,COMPLETE
976,0.7975493713728398,2025-04-24 21:06:45.207717,2025-04-24 21:06:46.273131,0 days 00:00:01.065414,squared_error,35,log2,3,10,best,TPESampler,COMPLETE
977,1.0007431665713944,2025-04-24 21:06:45.337894,2025-04-24 21:06:46.164977,0 days 00:00:00.827083,absolute_error,35,log2,7,18,random,TPESampler,COMPLETE
978,0.786987845634963,2025-04-24 21:06:45.632888,2025-04-24 21:06:46.423513,0 days 00:00:00.790625,absolute_error,26,log2,2,16,best,TPESampler,COMPLETE
979,0.9494322793442198,2025-04-24 21:06:46.510529,2025-04-24 21:06:47.361423,0 days 00:00:00.850894,squared_error,15,log2,9,2,random,TPESampler,COMPLETE
980,0.6708356072336189,2025-04-24 21:06:46.567468,2025-04-24 21:06:47.777901,0 days 00:00:01.210433,squared_error,30,log2,1,12,best,TPESampler,COMPLETE
981,0.7975493713728398,2025-04-24 21:06:46.699875,2025-04-24 21:06:47.662876,0 days 00:00:00.963001,squared_error,35,log2,2,9,best,TPESampler,COMPLETE
982,0.5120876615801571,2025-04-24 21:06:47.602713,2025-04-24 21:06:48.241487,0 days 00:00:00.638774,squared_error,35,log2,1,12,best,TPESampler,COMPLETE
983,0.4438474442892985,2025-04-24 21:06:47.961668,2025-04-24 21:06:48.885290,0 days 00:00:00.923622,squared_error,35,log2,1,10,best,TPESampler,COMPLETE
984,0.922426147955362,2025-04-24 21:06:48.029072,2025-04-24 21:06:48.948970,0 days 00:00:00.919898,friedman_mse,18,log2,5,6,random,TPESampler,COMPLETE
985,0.48051683833886516,2025-04-24 21:06:48.716835,2025-04-24 21:06:49.402833,0 days 00:00:00.685998,squared_error,35,log2,1,8,best,TPESampler,COMPLETE
986,0.6116709999078218,2025-04-24 21:06:49.076257,2025-04-24 21:06:50.082106,0 days 00:00:01.005849,squared_error,31,sqrt,1,13,best,TPESampler,COMPLETE
987,0.9347481389709953,2025-04-24 21:06:49.129903,2025-04-24 21:06:50.181096,0 days 00:00:01.051193,friedman_mse,11,sqrt,10,12,random,TPESampler,COMPLETE
988,0.5128537554029937,2025-04-24 21:06:49.928391,2025-04-24 21:06:50.634777,0 days 00:00:00.706386,squared_error,35,log2,1,11,best,TPESampler,COMPLETE
989,0.7975493713728398,2025-04-24 21:06:50.329623,2025-04-24 21:06:51.170092,0 days 00:00:00.840469,squared_error,29,log2,2,11,best,TPESampler,COMPLETE
990,0.7975493713728398,2025-04-24 21:06:50.393276,2025-04-24 21:06:51.309255,0 days 00:00:00.915979,squared_error,29,log2,2,10,best,TPESampler,COMPLETE
991,0.6756408221672622,2025-04-24 21:06:51.093015,2025-04-24 21:06:51.810935,0 days 00:00:00.717920,squared_error,30,log2,1,8,best,TPESampler,COMPLETE
992,0.6765049187574741,2025-04-24 21:06:51.385115,2025-04-24 21:06:52.324239,0 days 00:00:00.939124,squared_error,29,log2,1,10,best,TPESampler,COMPLETE
993,0.4438474442892985,2025-04-24 21:06:51.531119,2025-04-24 21:06:52.419462,0 days 00:00:00.888343,squared_error,35,log2,1,10,best,TPESampler,COMPLETE
994,0.9026744957667574,2025-04-24 21:06:52.237614,2025-04-24 21:06:52.893200,0 days 00:00:00.655586,squared_error,35,log2,1,8,random,TPESampler,COMPLETE
995,0.7975493713728398,2025-04-24 21:06:52.602189,2025-04-24 21:06:53.528635,0 days 00:00:00.926446,squared_error,35,log2,2,9,best,TPESampler,COMPLETE
996,0.5101622714757418,2025-04-24 21:06:52.645314,2025-04-24 21:06:53.616392,0 days 00:00:00.971078,squared_error,35,log2,1,13,best,TPESampler,COMPLETE
997,0.48051683833886516,2025-04-24 21:06:53.352328,2025-04-24 21:06:54.044962,0 days 00:00:00.692634,squared_error,35,log2,1,8,best,TPESampler,COMPLETE
998,0.5120876615801571,2025-04-24 21:06:53.773921,2025-04-24 21:06:54.726507,0 days 00:00:00.952586,friedman_mse,35,log2,1,12,best,TPESampler,COMPLETE
999,0.894550859606008,2025-04-24 21:06:53.996941,2025-04-24 21:06:54.958263,0 days 00:00:00.961322,friedman_mse,4,sqrt,8,3,best,TPESampler,COMPLETE
1000,0.9347481389709953,2025-04-24 21:06:54.235321,2025-04-24 21:06:55.032553,0 days 00:00:00.797232,squared_error,29,sqrt,9,4,random,TPESampler,COMPLETE
