number,value,datetime_start,datetime_complete,duration,params_criterion,params_max_depth,params_max_features,params_min_samples_leaf,params_min_samples_split,params_splitter,system_attrs_auto:sampler,state
2421,0.7975493713728398,2025-04-24 21:17:05.765007,2025-04-24 21:17:06.607927,0 days 00:00:00.842920,squared_error,30,log2,3,8,best,TPESampler,COMPLETE
2422,0.7975493713728398,2025-04-24 21:17:06.033013,2025-04-24 21:17:06.981170,0 days 00:00:00.948157,squared_error,30,log2,3,9,best,TPESampler,COMPLETE
2423,0.7975493713728398,2025-04-24 21:17:06.914874,2025-04-24 21:17:08.220137,0 days 00:00:01.305263,squared_error,35,log2,3,12,best,TPESampler,COMPLETE
2424,0.5430408394043414,2025-04-24 21:17:06.953121,2025-04-24 21:17:08.148928,0 days 00:00:01.195807,squared_error,30,sqrt,1,13,best,TPESampler,COMPLETE
2425,0.5128537554029937,2025-04-24 21:17:07.842907,2025-04-24 21:17:09.150795,0 days 00:00:01.307888,squared_error,35,log2,1,11,best,TPESampler,COMPLETE
2426,0.6586011368319069,2025-04-24 21:17:08.492861,2025-04-24 21:17:09.693490,0 days 00:00:01.200629,squared_error,30,log2,1,14,best,TPESampler,COMPLETE
2427,0.6891956072013478,2025-04-24 21:17:08.540437,2025-04-24 21:17:09.823938,0 days 00:00:01.283501,squared_error,30,log2,1,15,best,TPESampler,COMPLETE
2428,0.7975493713728398,2025-04-24 21:17:09.632598,2025-04-24 21:17:10.750358,0 days 00:00:01.117760,friedman_mse,26,log2,3,14,best,TPESampler,COMPLETE
2429,0.7975493713728398,2025-04-24 21:17:09.965410,2025-04-24 21:17:11.517620,0 days 00:00:01.552210,squared_error,30,log2,2,11,best,TPESampler,COMPLETE
2430,0.6692087088741673,2025-04-24 21:17:10.105413,2025-04-24 21:17:11.577855,0 days 00:00:01.472442,squared_error,30,log2,1,9,best,TPESampler,COMPLETE
2431,0.5128537554029937,2025-04-24 21:17:11.119803,2025-04-24 21:17:12.065483,0 days 00:00:00.945680,squared_error,35,log2,1,11,best,TPESampler,COMPLETE
2432,0.6735913168527353,2025-04-24 21:17:11.789865,2025-04-24 21:17:12.825440,0 days 00:00:01.035575,squared_error,30,log2,1,10,best,TPESampler,COMPLETE
2433,0.6511497278763692,2025-04-24 21:17:11.854311,2025-04-24 21:17:13.217337,0 days 00:00:01.363026,squared_error,30,log2,1,7,best,TPESampler,COMPLETE
2434,0.7975493713728398,2025-04-24 21:17:12.560487,2025-04-24 21:17:13.569335,0 days 00:00:01.008848,friedman_mse,35,log2,2,11,best,TPESampler,COMPLETE
2435,0.9671029066257907,2025-04-24 21:17:13.175623,2025-04-24 21:17:14.291843,0 days 00:00:01.116220,absolute_error,13,log2,4,19,random,TPESampler,COMPLETE
2436,0.5101622714757418,2025-04-24 21:17:13.560888,2025-04-24 21:17:14.521637,0 days 00:00:00.960749,squared_error,35,log2,1,13,best,TPESampler,COMPLETE
2437,0.9494322793442198,2025-04-24 21:17:13.908001,2025-04-24 21:17:14.765583,0 days 00:00:00.857582,squared_error,25,log2,10,4,random,TPESampler,COMPLETE
2438,0.4438474442892985,2025-04-24 21:17:14.576027,2025-04-24 21:17:15.734983,0 days 00:00:01.158956,squared_error,35,log2,1,10,best,TPESampler,COMPLETE
2439,0.7975493713728398,2025-04-24 21:17:14.802834,2025-04-24 21:17:15.732560,0 days 00:00:00.929726,squared_error,35,log2,2,8,best,TPESampler,COMPLETE
2440,0.6478538547086877,2025-04-24 21:17:15.032833,2025-04-24 21:17:16.144104,0 days 00:00:01.111271,absolute_error,28,log2,1,12,best,TPESampler,COMPLETE
2441,0.9993409537053991,2025-04-24 21:17:16.050624,2025-04-24 21:17:17.069024,0 days 00:00:01.018400,absolute_error,22,sqrt,9,17,random,TPESampler,COMPLETE
2442,0.48051683833886516,2025-04-24 21:17:16.105200,2025-04-24 21:17:17.353373,0 days 00:00:01.248173,squared_error,35,log2,1,8,best,TPESampler,COMPLETE
2443,0.6734080287670924,2025-04-24 21:17:16.422130,2025-04-24 21:17:17.394967,0 days 00:00:00.972837,friedman_mse,31,log2,1,8,best,TPESampler,COMPLETE
2444,0.7975493713728398,2025-04-24 21:17:17.293160,2025-04-24 21:17:18.150283,0 days 00:00:00.857123,squared_error,35,log2,2,12,best,TPESampler,COMPLETE
2445,0.5128537554029937,2025-04-24 21:17:17.635442,2025-04-24 21:17:18.874316,0 days 00:00:01.238874,friedman_mse,35,log2,1,11,best,TPESampler,COMPLETE
2446,0.7975493713728398,2025-04-24 21:17:17.849843,2025-04-24 21:17:18.948568,0 days 00:00:01.098725,squared_error,30,log2,2,10,best,TPESampler,COMPLETE
2447,0.6765049187574741,2025-04-24 21:17:18.694046,2025-04-24 21:17:19.432383,0 days 00:00:00.738337,squared_error,29,log2,1,10,best,TPESampler,COMPLETE
2448,0.922426147955362,2025-04-24 21:17:19.126277,2025-04-24 21:17:20.172926,0 days 00:00:01.046649,squared_error,35,log2,3,7,random,TPESampler,COMPLETE
2449,0.697887953316521,2025-04-24 21:17:19.176839,2025-04-24 21:17:20.261204,0 days 00:00:01.084365,friedman_mse,21,log2,1,9,best,TPESampler,COMPLETE
2450,0.5120876615801571,2025-04-24 21:17:19.919211,2025-04-24 21:17:20.655072,0 days 00:00:00.735861,squared_error,35,log2,1,12,best,TPESampler,COMPLETE
2451,0.4948844885027081,2025-04-24 21:17:20.611929,2025-04-24 21:17:21.667361,0 days 00:00:01.055432,squared_error,35,log2,1,9,best,TPESampler,COMPLETE
2452,0.6546358027701945,2025-04-24 21:17:20.652714,2025-04-24 21:17:21.888377,0 days 00:00:01.235663,squared_error,29,log2,1,5,best,TPESampler,COMPLETE
2453,0.9494322793442198,2025-04-24 21:17:20.973160,2025-04-24 21:17:21.938360,0 days 00:00:00.965200,squared_error,35,log2,5,8,best,TPESampler,COMPLETE
2454,0.7975493713728398,2025-04-24 21:17:21.889691,2025-04-24 21:17:22.642076,0 days 00:00:00.752385,squared_error,30,log2,3,12,best,TPESampler,COMPLETE
2455,1.0169646864906652,2025-04-24 21:17:22.121178,2025-04-24 21:17:23.131923,0 days 00:00:01.010745,absolute_error,2,sqrt,7,12,best,TPESampler,COMPLETE
2456,0.6689797096059603,2025-04-24 21:17:22.237876,2025-04-24 21:17:23.272643,0 days 00:00:01.034767,squared_error,30,log2,1,11,best,TPESampler,COMPLETE
2457,0.5128537554029937,2025-04-24 21:17:23.011132,2025-04-24 21:17:23.713743,0 days 00:00:00.702611,squared_error,35,log2,1,11,best,TPESampler,COMPLETE
2458,0.458106663082747,2025-04-24 21:17:23.459344,2025-04-24 21:17:24.388454,0 days 00:00:00.929110,squared_error,35,log2,1,6,best,TPESampler,COMPLETE
2459,0.7203120591174959,2025-04-24 21:17:23.678863,2025-04-24 21:17:24.585337,0 days 00:00:00.906474,squared_error,24,log2,1,11,best,TPESampler,COMPLETE
2460,0.7975493713728398,2025-04-24 21:17:24.015277,2025-04-24 21:17:24.911868,0 days 00:00:00.896591,squared_error,35,log2,3,9,best,TPESampler,COMPLETE
2461,0.654454193048308,2025-04-24 21:17:24.806713,2025-04-24 21:17:25.790738,0 days 00:00:00.984025,absolute_error,35,log2,1,9,best,TPESampler,COMPLETE
2462,0.9494322793442198,2025-04-24 21:17:24.865322,2025-04-24 21:17:25.995242,0 days 00:00:01.129920,squared_error,33,log2,10,7,best,TPESampler,COMPLETE
2463,0.7975493713728398,2025-04-24 21:17:25.181661,2025-04-24 21:17:26.257387,0 days 00:00:01.075726,squared_error,35,log2,2,10,best,TPESampler,COMPLETE
2464,0.922426147955362,2025-04-24 21:17:26.040142,2025-04-24 21:17:26.986189,0 days 00:00:00.946047,squared_error,29,log2,3,13,random,TPESampler,COMPLETE
2465,0.6689797096059603,2025-04-24 21:17:26.250780,2025-04-24 21:17:27.146828,0 days 00:00:00.896048,squared_error,30,log2,1,11,best,TPESampler,COMPLETE
2466,0.4438474442892985,2025-04-24 21:17:26.633166,2025-04-24 21:17:27.444854,0 days 00:00:00.811688,squared_error,35,log2,1,10,best,TPESampler,COMPLETE
2467,0.7975493713728398,2025-04-24 21:17:27.410200,2025-04-24 21:17:28.406530,0 days 00:00:00.996330,squared_error,35,log2,2,9,best,TPESampler,COMPLETE
2468,0.7975493713728398,2025-04-24 21:17:27.450166,2025-04-24 21:17:28.456910,0 days 00:00:01.006744,squared_error,35,log2,3,11,best,TPESampler,COMPLETE
2469,0.7975493713728398,2025-04-24 21:17:27.654933,2025-04-24 21:17:28.665314,0 days 00:00:01.010381,squared_error,35,log2,2,13,best,TPESampler,COMPLETE
2470,0.44670023329729247,2025-04-24 21:17:28.631397,2025-04-24 21:17:29.429186,0 days 00:00:00.797789,friedman_mse,35,log2,1,7,best,TPESampler,COMPLETE
2471,0.6708356072336189,2025-04-24 21:17:28.824338,2025-04-24 21:17:29.867358,0 days 00:00:01.043020,squared_error,30,log2,1,12,best,TPESampler,COMPLETE
2472,0.9671029066257907,2025-04-24 21:17:29.009401,2025-04-24 21:17:30.011687,0 days 00:00:01.002286,absolute_error,8,log2,2,12,random,TPESampler,COMPLETE
2473,0.6756408221672622,2025-04-24 21:17:29.778749,2025-04-24 21:17:30.711392,0 days 00:00:00.932643,squared_error,30,log2,1,8,best,TPESampler,COMPLETE
2474,0.645547103343722,2025-04-24 21:17:30.107182,2025-04-24 21:17:31.347008,0 days 00:00:01.239826,absolute_error,18,log2,1,7,best,TPESampler,COMPLETE
2475,0.786987845634963,2025-04-24 21:17:30.293665,2025-04-24 21:17:31.576682,0 days 00:00:01.283017,absolute_error,30,log2,3,12,best,TPESampler,COMPLETE
2476,0.7975493713728398,2025-04-24 21:17:31.256316,2025-04-24 21:17:32.163865,0 days 00:00:00.907549,squared_error,35,log2,2,15,best,TPESampler,COMPLETE
2477,0.4948844885027081,2025-04-24 21:17:31.643917,2025-04-24 21:17:32.969375,0 days 00:00:01.325458,squared_error,35,log2,1,9,best,TPESampler,COMPLETE
2478,0.9494322793442198,2025-04-24 21:17:31.840793,2025-04-24 21:17:33.038395,0 days 00:00:01.197602,friedman_mse,35,log2,5,13,best,TPESampler,COMPLETE
2479,0.5101622714757418,2025-04-24 21:17:32.463084,2025-04-24 21:17:33.460840,0 days 00:00:00.997756,squared_error,35,log2,1,13,best,TPESampler,COMPLETE
2480,0.48051683833886516,2025-04-24 21:17:33.207237,2025-04-24 21:17:34.281109,0 days 00:00:01.073872,squared_error,35,log2,1,8,best,TPESampler,COMPLETE
2481,0.7975493713728398,2025-04-24 21:17:33.259541,2025-04-24 21:17:34.249690,0 days 00:00:00.990149,squared_error,35,log2,2,7,best,TPESampler,COMPLETE
2482,0.7975493713728398,2025-04-24 21:17:33.772253,2025-04-24 21:17:34.528393,0 days 00:00:00.756140,squared_error,29,log2,2,9,best,TPESampler,COMPLETE
2483,0.5128537554029937,2025-04-24 21:17:34.486501,2025-04-24 21:17:35.404598,0 days 00:00:00.918097,squared_error,35,log2,1,11,best,TPESampler,COMPLETE
2484,0.6756408221672622,2025-04-24 21:17:34.586727,2025-04-24 21:17:35.610561,0 days 00:00:01.023834,squared_error,30,log2,1,8,best,TPESampler,COMPLETE
2485,0.6735913168527353,2025-04-24 21:17:34.790764,2025-04-24 21:17:35.919192,0 days 00:00:01.128428,squared_error,30,log2,1,10,best,TPESampler,COMPLETE
2486,0.7975493713728398,2025-04-24 21:17:35.670200,2025-04-24 21:17:36.508947,0 days 00:00:00.838747,squared_error,30,log2,3,7,best,TPESampler,COMPLETE
2487,0.7975493713728398,2025-04-24 21:17:35.932331,2025-04-24 21:17:36.870920,0 days 00:00:00.938589,squared_error,29,log2,3,10,best,TPESampler,COMPLETE
2488,1.0007431665713944,2025-04-24 21:17:36.293402,2025-04-24 21:17:37.182096,0 days 00:00:00.888694,absolute_error,19,log2,6,7,best,TPESampler,COMPLETE
2489,0.7975493713728398,2025-04-24 21:17:36.825677,2025-04-24 21:17:37.809312,0 days 00:00:00.983635,squared_error,35,log2,3,8,best,TPESampler,COMPLETE
2490,0.7975493713728398,2025-04-24 21:17:37.249516,2025-04-24 21:17:38.115908,0 days 00:00:00.866392,squared_error,35,log2,3,12,best,TPESampler,COMPLETE
2491,0.7975493713728398,2025-04-24 21:17:37.552764,2025-04-24 21:17:38.486620,0 days 00:00:00.933856,squared_error,30,log2,3,13,best,TPESampler,COMPLETE
2492,0.922426147955362,2025-04-24 21:17:38.135878,2025-04-24 21:17:39.101554,0 days 00:00:00.965676,squared_error,35,log2,2,13,random,TPESampler,COMPLETE
2493,0.9494322793442198,2025-04-24 21:17:38.358446,2025-04-24 21:17:39.296668,0 days 00:00:00.938222,squared_error,22,log2,8,20,random,TPESampler,COMPLETE
2494,0.9347481389709953,2025-04-24 21:17:38.794558,2025-04-24 21:17:39.547853,0 days 00:00:00.753295,squared_error,4,sqrt,8,9,random,TPESampler,COMPLETE
2495,0.48051683833886516,2025-04-24 21:17:39.512922,2025-04-24 21:17:40.449870,0 days 00:00:00.936948,squared_error,35,log2,1,8,best,TPESampler,COMPLETE
2496,0.4948844885027081,2025-04-24 21:17:39.551965,2025-04-24 21:17:40.534001,0 days 00:00:00.982036,squared_error,35,log2,1,9,best,TPESampler,COMPLETE
2497,0.5120876615801571,2025-04-24 21:17:39.807855,2025-04-24 21:17:40.880338,0 days 00:00:01.072483,squared_error,35,log2,1,12,best,TPESampler,COMPLETE
2498,0.5436620092712224,2025-04-24 21:17:40.774677,2025-04-24 21:17:41.667038,0 days 00:00:00.892361,squared_error,35,log2,1,5,best,TPESampler,COMPLETE
2499,0.9993409537053991,2025-04-24 21:17:40.845790,2025-04-24 21:17:41.688755,0 days 00:00:00.842965,absolute_error,11,sqrt,9,7,random,TPESampler,COMPLETE
