number,value,datetime_start,datetime_complete,duration,params_criterion,params_max_depth,params_max_features,params_min_samples_leaf,params_min_samples_split,params_splitter,system_attrs_auto:sampler,state
1711,0.6545164836672983,2025-04-24 21:11:48.402153,2025-04-24 21:11:49.618863,0 days 00:00:01.216710,squared_error,29,log2,1,9,best,TPESampler,COMPLETE
1712,0.5101622714757418,2025-04-24 21:11:49.021537,2025-04-24 21:11:49.896731,0 days 00:00:00.875194,squared_error,35,log2,1,13,best,TPESampler,COMPLETE
1713,0.5128537554029937,2025-04-24 21:11:49.572614,2025-04-24 21:11:50.513967,0 days 00:00:00.941353,squared_error,35,log2,1,11,best,TPESampler,COMPLETE
1714,0.7975493713728398,2025-04-24 21:11:49.956373,2025-04-24 21:11:50.697009,0 days 00:00:00.740636,squared_error,35,log2,2,8,best,TPESampler,COMPLETE
1715,0.6756408221672622,2025-04-24 21:11:50.221979,2025-04-24 21:11:51.124748,0 days 00:00:00.902769,squared_error,30,log2,1,8,best,TPESampler,COMPLETE
1716,0.7975493713728398,2025-04-24 21:11:50.807268,2025-04-24 21:11:51.647107,0 days 00:00:00.839839,squared_error,29,log2,3,10,best,TPESampler,COMPLETE
1717,0.889614020123195,2025-04-24 21:11:50.959859,2025-04-24 21:11:51.915563,0 days 00:00:00.955704,friedman_mse,25,sqrt,4,19,best,TPESampler,COMPLETE
1718,0.9486947174197512,2025-04-24 21:11:51.407422,2025-04-24 21:11:52.213225,0 days 00:00:00.805803,squared_error,1,sqrt,4,3,best,TPESampler,COMPLETE
1719,0.44670023329729247,2025-04-24 21:11:51.918544,2025-04-24 21:11:52.848854,0 days 00:00:00.930310,squared_error,35,log2,1,7,best,TPESampler,COMPLETE
1720,0.458106663082747,2025-04-24 21:11:52.170750,2025-04-24 21:11:53.053178,0 days 00:00:00.882428,squared_error,35,log2,1,6,best,TPESampler,COMPLETE
1721,0.4948844885027081,2025-04-24 21:11:52.512191,2025-04-24 21:11:53.426000,0 days 00:00:00.913809,squared_error,35,log2,1,9,best,TPESampler,COMPLETE
1722,0.7975493713728398,2025-04-24 21:11:53.107740,2025-04-24 21:11:54.053369,0 days 00:00:00.945629,squared_error,29,log2,2,13,best,TPESampler,COMPLETE
1723,0.921490865991525,2025-04-24 21:11:53.351923,2025-04-24 21:11:54.237029,0 days 00:00:00.885106,friedman_mse,17,sqrt,5,11,random,TPESampler,COMPLETE
1724,0.6765049187574741,2025-04-24 21:11:53.704430,2025-04-24 21:11:54.558422,0 days 00:00:00.853992,squared_error,29,log2,1,10,best,TPESampler,COMPLETE
1725,0.7403414685487072,2025-04-24 21:11:54.421991,2025-04-24 21:11:55.289950,0 days 00:00:00.867959,absolute_error,30,log2,1,15,best,TPESampler,COMPLETE
1726,0.5128537554029937,2025-04-24 21:11:54.490709,2025-04-24 21:11:55.720678,0 days 00:00:01.229969,squared_error,35,log2,1,11,best,TPESampler,COMPLETE
1727,0.5128537554029937,2025-04-24 21:11:54.779296,2025-04-24 21:11:55.865848,0 days 00:00:01.086552,squared_error,35,log2,1,11,best,TPESampler,COMPLETE
1728,0.7975493713728398,2025-04-24 21:11:55.606217,2025-04-24 21:11:56.418249,0 days 00:00:00.812032,squared_error,35,log2,3,11,best,TPESampler,COMPLETE
1729,0.7975493713728398,2025-04-24 21:11:56.040911,2025-04-24 21:11:57.130112,0 days 00:00:01.089201,squared_error,29,log2,2,9,best,TPESampler,COMPLETE
1730,0.6735913168527353,2025-04-24 21:11:56.166448,2025-04-24 21:11:57.128654,0 days 00:00:00.962206,squared_error,30,log2,1,10,best,TPESampler,COMPLETE
1731,0.7975493713728398,2025-04-24 21:11:56.739438,2025-04-24 21:11:58.053432,0 days 00:00:01.313994,squared_error,35,log2,3,9,best,TPESampler,COMPLETE
1732,0.7975493713728398,2025-04-24 21:11:57.373186,2025-04-24 21:11:58.403417,0 days 00:00:01.030231,friedman_mse,30,log2,2,13,best,TPESampler,COMPLETE
1733,0.5128537554029937,2025-04-24 21:11:57.427642,2025-04-24 21:11:58.438910,0 days 00:00:01.011268,squared_error,35,log2,1,11,best,TPESampler,COMPLETE
1734,0.5120876615801571,2025-04-24 21:11:58.332462,2025-04-24 21:11:59.339485,0 days 00:00:01.007023,squared_error,35,log2,1,12,best,TPESampler,COMPLETE
1735,0.4438474442892985,2025-04-24 21:11:58.582688,2025-04-24 21:11:59.657048,0 days 00:00:01.074360,squared_error,35,log2,1,10,best,TPESampler,COMPLETE
1736,0.6735913168527353,2025-04-24 21:11:58.707241,2025-04-24 21:11:59.766280,0 days 00:00:01.059039,squared_error,30,log2,1,10,best,TPESampler,COMPLETE
1737,0.7975493713728398,2025-04-24 21:11:59.586467,2025-04-24 21:12:00.346654,0 days 00:00:00.760187,squared_error,35,log2,3,10,best,TPESampler,COMPLETE
1738,0.894550859606008,2025-04-24 21:11:59.919501,2025-04-24 21:12:01.161934,0 days 00:00:01.242433,squared_error,4,sqrt,8,14,best,TPESampler,COMPLETE
1739,0.4948844885027081,2025-04-24 21:12:00.073218,2025-04-24 21:12:01.225173,0 days 00:00:01.151955,squared_error,35,log2,1,9,best,TPESampler,COMPLETE
1740,0.9494322793442198,2025-04-24 21:12:00.940549,2025-04-24 21:12:01.713993,0 days 00:00:00.773444,friedman_mse,5,log2,6,14,random,TPESampler,COMPLETE
1741,0.6689797096059603,2025-04-24 21:12:01.424102,2025-04-24 21:12:02.315847,0 days 00:00:00.891745,squared_error,30,log2,1,11,best,TPESampler,COMPLETE
1742,0.9347316332712444,2025-04-24 21:12:01.481169,2025-04-24 21:12:02.686683,0 days 00:00:01.205514,friedman_mse,19,log2,1,6,random,TPESampler,COMPLETE
1743,0.7975493713728398,2025-04-24 21:12:02.055736,2025-04-24 21:12:02.960324,0 days 00:00:00.904588,squared_error,30,log2,3,10,best,TPESampler,COMPLETE
1744,0.7221627019184623,2025-04-24 21:12:02.626305,2025-04-24 21:12:03.479421,0 days 00:00:00.853116,squared_error,30,log2,1,6,best,TPESampler,COMPLETE
1745,0.48444975754384645,2025-04-24 21:12:03.020808,2025-04-24 21:12:03.874114,0 days 00:00:00.853306,squared_error,35,log2,1,14,best,TPESampler,COMPLETE
1746,0.6708356072336189,2025-04-24 21:12:03.284653,2025-04-24 21:12:04.213731,0 days 00:00:00.929078,squared_error,30,log2,1,12,best,TPESampler,COMPLETE
1747,0.4948844885027081,2025-04-24 21:12:03.861464,2025-04-24 21:12:04.805981,0 days 00:00:00.944517,squared_error,35,log2,1,9,best,TPESampler,COMPLETE
1748,0.48051683833886516,2025-04-24 21:12:04.141970,2025-04-24 21:12:05.158026,0 days 00:00:01.016056,squared_error,35,log2,1,8,best,TPESampler,COMPLETE
1749,0.7975493713728398,2025-04-24 21:12:04.493725,2025-04-24 21:12:05.527334,0 days 00:00:01.033609,squared_error,35,log2,3,10,best,TPESampler,COMPLETE
1750,0.6756408221672622,2025-04-24 21:12:05.039158,2025-04-24 21:12:05.833690,0 days 00:00:00.794532,squared_error,30,log2,1,8,best,TPESampler,COMPLETE
1751,0.7975493713728398,2025-04-24 21:12:05.528824,2025-04-24 21:12:06.779471,0 days 00:00:01.250647,squared_error,30,log2,3,7,best,TPESampler,COMPLETE
1752,0.7975493713728398,2025-04-24 21:12:05.829847,2025-04-24 21:12:06.957649,0 days 00:00:01.127802,squared_error,35,log2,3,8,best,TPESampler,COMPLETE
1753,0.786987845634963,2025-04-24 21:12:06.110027,2025-04-24 21:12:07.238315,0 days 00:00:01.128288,absolute_error,31,log2,2,9,best,TPESampler,COMPLETE
1754,0.8913351576037826,2025-04-24 21:12:07.127677,2025-04-24 21:12:08.248767,0 days 00:00:01.121090,squared_error,26,sqrt,3,7,best,TPESampler,COMPLETE
1755,0.4694960500030294,2025-04-24 21:12:07.194000,2025-04-24 21:12:08.519445,0 days 00:00:01.325445,friedman_mse,34,log2,1,8,best,TPESampler,COMPLETE
1756,0.4438474442892985,2025-04-24 21:12:07.524247,2025-04-24 21:12:08.673833,0 days 00:00:01.149586,squared_error,35,log2,1,10,best,TPESampler,COMPLETE
1757,0.9027082956026495,2025-04-24 21:12:08.512831,2025-04-24 21:12:09.453318,0 days 00:00:00.940487,friedman_mse,35,log2,1,9,random,TPESampler,COMPLETE
1758,0.922426147955362,2025-04-24 21:12:08.776437,2025-04-24 21:12:10.131924,0 days 00:00:01.355487,squared_error,21,log2,3,13,random,TPESampler,COMPLETE
1759,0.7975493713728398,2025-04-24 21:12:08.910632,2025-04-24 21:12:10.478170,0 days 00:00:01.567538,squared_error,29,log2,2,12,best,TPESampler,COMPLETE
1760,0.9347481389709953,2025-04-24 21:12:09.982779,2025-04-24 21:12:11.006922,0 days 00:00:01.024143,friedman_mse,11,sqrt,8,8,random,TPESampler,COMPLETE
1761,0.786987845634963,2025-04-24 21:12:10.676308,2025-04-24 21:12:11.639391,0 days 00:00:00.963083,absolute_error,21,log2,3,5,best,TPESampler,COMPLETE
1762,0.7975493713728398,2025-04-24 21:12:10.874876,2025-04-24 21:12:11.965938,0 days 00:00:01.091062,friedman_mse,4,log2,3,6,best,TPESampler,COMPLETE
1763,0.4438474442892985,2025-04-24 21:12:11.273945,2025-04-24 21:12:12.253212,0 days 00:00:00.979267,squared_error,35,log2,1,10,best,TPESampler,COMPLETE
1764,0.5120876615801571,2025-04-24 21:12:12.116224,2025-04-24 21:12:12.973887,0 days 00:00:00.857663,squared_error,35,log2,1,12,best,TPESampler,COMPLETE
1765,0.5101622714757418,2025-04-24 21:12:12.209652,2025-04-24 21:12:13.116540,0 days 00:00:00.906888,squared_error,35,log2,1,13,best,TPESampler,COMPLETE
1766,0.786987845634963,2025-04-24 21:12:12.594971,2025-04-24 21:12:13.463074,0 days 00:00:00.868103,absolute_error,35,log2,3,9,best,TPESampler,COMPLETE
1767,0.7178532893636496,2025-04-24 21:12:13.367616,2025-04-24 21:12:14.379692,0 days 00:00:01.012076,squared_error,23,log2,1,11,best,TPESampler,COMPLETE
1768,0.7975493713728398,2025-04-24 21:12:13.424884,2025-04-24 21:12:14.459405,0 days 00:00:01.034521,squared_error,30,log2,2,9,best,TPESampler,COMPLETE
1769,0.7975493713728398,2025-04-24 21:12:13.964828,2025-04-24 21:12:14.748402,0 days 00:00:00.783574,squared_error,30,log2,3,14,best,TPESampler,COMPLETE
1770,0.7975493713728398,2025-04-24 21:12:14.721977,2025-04-24 21:12:15.581414,0 days 00:00:00.859437,friedman_mse,29,log2,3,11,best,TPESampler,COMPLETE
1771,0.6692087088741673,2025-04-24 21:12:14.760127,2025-04-24 21:12:15.921889,0 days 00:00:01.161762,squared_error,30,log2,1,9,best,TPESampler,COMPLETE
1772,0.6511497278763692,2025-04-24 21:12:15.015040,2025-04-24 21:12:16.120818,0 days 00:00:01.105778,squared_error,30,log2,1,7,best,TPESampler,COMPLETE
1773,0.7975493713728398,2025-04-24 21:12:15.863395,2025-04-24 21:12:16.713147,0 days 00:00:00.849752,squared_error,35,log2,3,6,best,TPESampler,COMPLETE
1774,0.7975493713728398,2025-04-24 21:12:16.182609,2025-04-24 21:12:17.114385,0 days 00:00:00.931776,squared_error,20,log2,3,5,best,TPESampler,COMPLETE
1775,0.4948844885027081,2025-04-24 21:12:16.374173,2025-04-24 21:12:17.476235,0 days 00:00:01.102062,squared_error,35,log2,1,9,best,TPESampler,COMPLETE
1776,0.9463249836645335,2025-04-24 21:12:17.102895,2025-04-24 21:12:18.318344,0 days 00:00:01.215449,squared_error,1,sqrt,10,17,random,TPESampler,COMPLETE
1777,0.7975493713728398,2025-04-24 21:12:17.437888,2025-04-24 21:12:18.778009,0 days 00:00:01.340121,squared_error,35,log2,3,13,best,TPESampler,COMPLETE
1778,0.5128537554029937,2025-04-24 21:12:18.172324,2025-04-24 21:12:19.370020,0 days 00:00:01.197696,squared_error,35,log2,1,11,best,TPESampler,COMPLETE
1779,0.6708356072336189,2025-04-24 21:12:18.601970,2025-04-24 21:12:19.820358,0 days 00:00:01.218388,squared_error,30,log2,1,12,best,TPESampler,COMPLETE
1780,0.7975493713728398,2025-04-24 21:12:19.154674,2025-04-24 21:12:20.125696,0 days 00:00:00.971022,squared_error,35,log2,2,8,best,TPESampler,COMPLETE
1781,0.9040925312139748,2025-04-24 21:12:19.696751,2025-04-24 21:12:20.715834,0 days 00:00:01.019083,squared_error,34,log2,1,11,random,TPESampler,COMPLETE
1782,0.922426147955362,2025-04-24 21:12:20.118720,2025-04-24 21:12:20.878571,0 days 00:00:00.759851,friedman_mse,27,log2,3,14,random,TPESampler,COMPLETE
1783,0.9494322793442198,2025-04-24 21:12:20.430363,2025-04-24 21:12:21.243825,0 days 00:00:00.813462,friedman_mse,28,log2,7,13,best,TPESampler,COMPLETE
1784,0.44670023329729247,2025-04-24 21:12:21.046781,2025-04-24 21:12:21.975357,0 days 00:00:00.928576,squared_error,35,log2,1,7,best,TPESampler,COMPLETE
1785,0.9671029066257907,2025-04-24 21:12:21.119420,2025-04-24 21:12:22.071329,0 days 00:00:00.951909,absolute_error,34,log2,4,16,random,TPESampler,COMPLETE
1786,0.6545164836672983,2025-04-24 21:12:21.564375,2025-04-24 21:12:22.405369,0 days 00:00:00.840994,squared_error,29,log2,1,9,best,TPESampler,COMPLETE
1787,0.7975493713728398,2025-04-24 21:12:22.270961,2025-04-24 21:12:23.258055,0 days 00:00:00.987094,squared_error,35,log2,3,11,best,TPESampler,COMPLETE
1788,0.7975493713728398,2025-04-24 21:12:22.347508,2025-04-24 21:12:23.328994,0 days 00:00:00.981486,friedman_mse,35,log2,2,12,best,TPESampler,COMPLETE
1789,0.6308505732339394,2025-04-24 21:12:22.916303,2025-04-24 21:12:23.803409,0 days 00:00:00.887106,squared_error,27,sqrt,1,10,best,TPESampler,COMPLETE
1790,0.7975493713728398,2025-04-24 21:12:23.499516,2025-04-24 21:12:24.385440,0 days 00:00:00.885924,squared_error,30,log2,3,10,best,TPESampler,COMPLETE
1791,0.7975493713728398,2025-04-24 21:12:23.576807,2025-04-24 21:12:24.574283,0 days 00:00:00.997476,squared_error,35,log2,2,10,best,TPESampler,COMPLETE
1792,0.8913351576037826,2025-04-24 21:12:24.104653,2025-04-24 21:12:24.893089,0 days 00:00:00.788436,squared_error,35,sqrt,3,10,best,TPESampler,COMPLETE
1793,0.6998113638779174,2025-04-24 21:12:24.646991,2025-04-24 21:12:25.588787,0 days 00:00:00.941796,squared_error,28,log2,1,16,best,TPESampler,COMPLETE
1794,0.4948844885027081,2025-04-24 21:12:24.847599,2025-04-24 21:12:25.731407,0 days 00:00:00.883808,squared_error,35,log2,1,9,best,TPESampler,COMPLETE
1795,0.458106663082747,2025-04-24 21:12:25.240498,2025-04-24 21:12:26.040910,0 days 00:00:00.800412,squared_error,35,log2,1,6,best,TPESampler,COMPLETE
1796,0.6689797096059603,2025-04-24 21:12:25.919318,2025-04-24 21:12:26.842599,0 days 00:00:00.923281,squared_error,30,log2,1,11,best,TPESampler,COMPLETE
1797,0.654454193048308,2025-04-24 21:12:26.001742,2025-04-24 21:12:27.019902,0 days 00:00:01.018160,absolute_error,35,log2,1,9,best,TPESampler,COMPLETE
1798,0.5128537554029937,2025-04-24 21:12:26.540384,2025-04-24 21:12:27.393721,0 days 00:00:00.853337,squared_error,35,log2,1,11,best,TPESampler,COMPLETE
1799,0.48051683833886516,2025-04-24 21:12:27.352257,2025-04-24 21:12:28.144042,0 days 00:00:00.791785,squared_error,35,log2,1,8,best,TPESampler,COMPLETE
1800,0.671564007425267,2025-04-24 21:12:27.396735,2025-04-24 21:12:28.596829,0 days 00:00:01.200094,squared_error,30,log2,1,13,best,TPESampler,COMPLETE
1801,0.6914253690247881,2025-04-24 21:12:27.634324,2025-04-24 21:12:28.619818,0 days 00:00:00.985494,squared_error,29,log2,1,11,best,TPESampler,COMPLETE
1802,0.48444975754384645,2025-04-24 21:12:28.478409,2025-04-24 21:12:29.320843,0 days 00:00:00.842434,squared_error,35,log2,1,14,best,TPESampler,COMPLETE
1803,0.786987845634963,2025-04-24 21:12:28.946243,2025-04-24 21:12:29.936098,0 days 00:00:00.989855,absolute_error,35,log2,3,16,best,TPESampler,COMPLETE
1804,0.44898661991792777,2025-04-24 21:12:28.997419,2025-04-24 21:12:29.946647,0 days 00:00:00.949228,friedman_mse,34,log2,1,6,best,TPESampler,COMPLETE
1805,0.9347481389709953,2025-04-24 21:12:29.768684,2025-04-24 21:12:30.732985,0 days 00:00:00.964301,squared_error,3,sqrt,10,2,random,TPESampler,COMPLETE
1806,0.7975493713728398,2025-04-24 21:12:30.178117,2025-04-24 21:12:31.538174,0 days 00:00:01.360057,squared_error,30,log2,3,7,best,TPESampler,COMPLETE
1807,0.7226669768922478,2025-04-24 21:12:30.222036,2025-04-24 21:12:31.158297,0 days 00:00:00.936261,friedman_mse,10,log2,1,2,best,TPESampler,COMPLETE
1808,0.5128537554029937,2025-04-24 21:12:31.077737,2025-04-24 21:12:31.736094,0 days 00:00:00.658357,squared_error,35,log2,1,11,best,TPESampler,COMPLETE
1809,0.6756408221672622,2025-04-24 21:12:31.465767,2025-04-24 21:12:32.286361,0 days 00:00:00.820594,squared_error,30,log2,1,8,best,TPESampler,COMPLETE
1810,0.7975493713728398,2025-04-24 21:12:31.810177,2025-04-24 21:12:32.678553,0 days 00:00:00.868376,squared_error,35,log2,2,11,best,TPESampler,COMPLETE
1811,0.7975493713728398,2025-04-24 21:12:31.999519,2025-04-24 21:12:32.922064,0 days 00:00:00.922545,squared_error,35,log2,3,9,best,TPESampler,COMPLETE
1812,0.7975493713728398,2025-04-24 21:12:32.620608,2025-04-24 21:12:33.594246,0 days 00:00:00.973638,squared_error,30,log2,2,11,best,TPESampler,COMPLETE
1813,0.5128537554029937,2025-04-24 21:12:32.935993,2025-04-24 21:12:33.707750,0 days 00:00:00.771757,friedman_mse,35,log2,1,11,best,TPESampler,COMPLETE
1814,0.7853673683943797,2025-04-24 21:12:33.354550,2025-04-24 21:12:34.176275,0 days 00:00:00.821725,absolute_error,6,log2,1,11,best,TPESampler,COMPLETE
1815,0.7975493713728398,2025-04-24 21:12:33.865545,2025-04-24 21:12:34.912065,0 days 00:00:01.046520,squared_error,35,log2,2,9,best,TPESampler,COMPLETE
1816,0.44670023329729247,2025-04-24 21:12:33.909519,2025-04-24 21:12:34.942555,0 days 00:00:01.033036,squared_error,35,log2,1,7,best,TPESampler,COMPLETE
1817,0.7975493713728398,2025-04-24 21:12:34.656314,2025-04-24 21:12:35.840435,0 days 00:00:01.184121,squared_error,30,log2,3,11,best,TPESampler,COMPLETE
1818,0.6689797096059603,2025-04-24 21:12:35.166216,2025-04-24 21:12:36.114585,0 days 00:00:00.948369,squared_error,30,log2,1,11,best,TPESampler,COMPLETE
1819,0.7975493713728398,2025-04-24 21:12:35.233681,2025-04-24 21:12:36.219601,0 days 00:00:00.985920,squared_error,35,log2,2,10,best,TPESampler,COMPLETE
1820,0.6692087088741673,2025-04-24 21:12:36.134241,2025-04-24 21:12:36.991238,0 days 00:00:00.856997,squared_error,30,log2,1,9,best,TPESampler,COMPLETE
1821,0.7975493713728398,2025-04-24 21:12:36.348427,2025-04-24 21:12:37.166370,0 days 00:00:00.817943,squared_error,22,log2,2,7,best,TPESampler,COMPLETE
1822,0.4438474442892985,2025-04-24 21:12:36.711770,2025-04-24 21:12:37.443772,0 days 00:00:00.732002,squared_error,35,log2,1,10,best,TPESampler,COMPLETE
1823,0.6689797096059603,2025-04-24 21:12:37.353128,2025-04-24 21:12:38.339099,0 days 00:00:00.985971,squared_error,30,log2,1,11,best,TPESampler,COMPLETE
1824,0.674050854009347,2025-04-24 21:12:37.394013,2025-04-24 21:12:38.344062,0 days 00:00:00.950049,friedman_mse,28,log2,1,9,best,TPESampler,COMPLETE
1825,0.7975493713728398,2025-04-24 21:12:37.968543,2025-04-24 21:12:38.870991,0 days 00:00:00.902448,squared_error,35,log2,3,8,best,TPESampler,COMPLETE
1826,0.4438474442892985,2025-04-24 21:12:38.561006,2025-04-24 21:12:39.696750,0 days 00:00:01.135744,squared_error,35,log2,1,10,best,TPESampler,COMPLETE
1827,0.5120876615801571,2025-04-24 21:12:38.622706,2025-04-24 21:12:39.620583,0 days 00:00:00.997877,squared_error,35,log2,1,12,best,TPESampler,COMPLETE
1828,0.7975493713728398,2025-04-24 21:12:39.240785,2025-04-24 21:12:40.011805,0 days 00:00:00.771020,squared_error,35,log2,3,14,best,TPESampler,COMPLETE
1829,0.7975493713728398,2025-04-24 21:12:39.974473,2025-04-24 21:12:40.750952,0 days 00:00:00.776479,friedman_mse,35,log2,3,11,best,TPESampler,COMPLETE
1830,0.6175599523851972,2025-04-24 21:12:40.015335,2025-04-24 21:12:41.033861,0 days 00:00:01.018526,absolute_error,35,log2,1,11,best,TPESampler,COMPLETE
1831,0.9671029066257907,2025-04-24 21:12:40.225467,2025-04-24 21:12:41.425238,0 days 00:00:01.199771,absolute_error,34,log2,2,10,random,TPESampler,COMPLETE
1832,0.4948844885027081,2025-04-24 21:12:41.076976,2025-04-24 21:12:42.079081,0 days 00:00:01.002105,squared_error,35,log2,1,9,best,TPESampler,COMPLETE
1833,0.48051683833886516,2025-04-24 21:12:41.292130,2025-04-24 21:12:42.294730,0 days 00:00:01.002600,squared_error,35,log2,1,8,best,TPESampler,COMPLETE
1834,0.6756408221672622,2025-04-24 21:12:41.707717,2025-04-24 21:12:42.568955,0 days 00:00:00.861238,squared_error,30,log2,1,8,best,TPESampler,COMPLETE
1835,0.8996195254384107,2025-04-24 21:12:42.338066,2025-04-24 21:12:43.281520,0 days 00:00:00.943454,squared_error,28,log2,1,10,random,TPESampler,COMPLETE
1836,0.8538480935201685,2025-04-24 21:12:42.627251,2025-04-24 21:12:43.640099,0 days 00:00:01.012848,squared_error,31,sqrt,1,8,random,TPESampler,COMPLETE
1837,0.7975493713728398,2025-04-24 21:12:43.058154,2025-04-24 21:12:44.012744,0 days 00:00:00.954590,squared_error,30,log2,3,9,best,TPESampler,COMPLETE
1838,0.6161267474793877,2025-04-24 21:12:43.626956,2025-04-24 21:12:44.788923,0 days 00:00:01.161967,absolute_error,22,sqrt,1,2,best,TPESampler,COMPLETE
1839,0.6750604722884704,2025-04-24 21:12:44.005348,2025-04-24 21:12:45.262973,0 days 00:00:01.257625,friedman_mse,28,log2,1,13,best,TPESampler,COMPLETE
1840,0.6689797096059603,2025-04-24 21:12:44.522400,2025-04-24 21:12:45.823072,0 days 00:00:01.300672,squared_error,30,log2,1,11,best,TPESampler,COMPLETE
1841,0.9496877974944425,2025-04-24 21:12:45.218598,2025-04-24 21:12:46.761259,0 days 00:00:01.542661,squared_error,1,log2,3,16,best,TPESampler,COMPLETE
1842,0.6756408221672622,2025-04-24 21:12:45.780131,2025-04-24 21:12:47.184338,0 days 00:00:01.404207,squared_error,30,log2,1,8,best,TPESampler,COMPLETE
1843,0.7705471233802808,2025-04-24 21:12:46.290353,2025-04-24 21:12:48.645227,0 days 00:00:02.354874,absolute_error,28,sqrt,3,10,best,TPESampler,COMPLETE
1844,0.7975493713728398,2025-04-24 21:12:47.509647,2025-04-24 21:12:49.452230,0 days 00:00:01.942583,squared_error,35,log2,2,12,best,TPESampler,COMPLETE
1845,0.5120876615801571,2025-04-24 21:12:47.636345,2025-04-24 21:12:49.928226,0 days 00:00:02.291881,squared_error,35,log2,1,12,best,TPESampler,COMPLETE
1846,0.4948844885027081,2025-04-24 21:12:49.836814,2025-04-24 21:12:50.884497,0 days 00:00:01.047683,squared_error,35,log2,1,9,best,TPESampler,COMPLETE
1847,0.6891956072013478,2025-04-24 21:12:50.123956,2025-04-24 21:12:51.923089,0 days 00:00:01.799133,squared_error,30,log2,1,15,best,TPESampler,COMPLETE
1848,0.7975493713728398,2025-04-24 21:12:50.805218,2025-04-24 21:12:52.289460,0 days 00:00:01.484242,squared_error,30,log2,3,12,best,TPESampler,COMPLETE
1849,0.7975493713728398,2025-04-24 21:12:51.618863,2025-04-24 21:12:52.878863,0 days 00:00:01.260000,squared_error,30,log2,3,11,best,TPESampler,COMPLETE
1850,0.7975493713728398,2025-04-24 21:12:52.343385,2025-04-24 21:12:53.773096,0 days 00:00:01.429711,squared_error,35,log2,2,13,best,TPESampler,COMPLETE
1851,0.5128537554029937,2025-04-24 21:12:52.607636,2025-04-24 21:12:54.262922,0 days 00:00:01.655286,squared_error,35,log2,1,11,best,TPESampler,COMPLETE
1852,0.458106663082747,2025-04-24 21:12:53.305674,2025-04-24 21:12:55.012268,0 days 00:00:01.706594,squared_error,35,log2,1,6,best,TPESampler,COMPLETE
