number,value,datetime_start,datetime_complete,duration,params_criterion,params_max_depth,params_max_features,params_min_samples_leaf,params_min_samples_split,params_splitter,system_attrs_auto:sampler,state
2137,0.7975493713728398,2025-04-24 21:14:57.969822,2025-04-24 21:14:58.841829,0 days 00:00:00.872007,squared_error,35,log2,2,10,best,TPESampler,COMPLETE
2138,0.9494322793442198,2025-04-24 21:14:58.033112,2025-04-24 21:14:59.306995,0 days 00:00:01.273883,squared_error,4,log2,10,12,best,TPESampler,COMPLETE
2139,0.7975493713728398,2025-04-24 21:14:58.305304,2025-04-24 21:14:59.448982,0 days 00:00:01.143678,squared_error,35,log2,3,9,best,TPESampler,COMPLETE
2140,0.9255759610404857,2025-04-24 21:14:59.195448,2025-04-24 21:14:59.929289,0 days 00:00:00.733841,squared_error,13,sqrt,4,13,random,TPESampler,COMPLETE
2141,0.786987845634963,2025-04-24 21:14:59.600122,2025-04-24 21:15:00.611291,0 days 00:00:01.011169,absolute_error,31,log2,3,9,best,TPESampler,COMPLETE
2142,0.4948844885027081,2025-04-24 21:14:59.787906,2025-04-24 21:15:00.842967,0 days 00:00:01.055061,squared_error,35,log2,1,9,best,TPESampler,COMPLETE
2143,0.9347481389709953,2025-04-24 21:15:00.252936,2025-04-24 21:15:01.047802,0 days 00:00:00.794866,squared_error,17,sqrt,6,16,random,TPESampler,COMPLETE
2144,0.5120876615801571,2025-04-24 21:15:00.888269,2025-04-24 21:15:02.243457,0 days 00:00:01.355188,squared_error,35,log2,1,12,best,TPESampler,COMPLETE
2145,0.7975493713728398,2025-04-24 21:15:01.146176,2025-04-24 21:15:02.590143,0 days 00:00:01.443967,squared_error,29,log2,3,8,best,TPESampler,COMPLETE
2146,0.5101622714757418,2025-04-24 21:15:01.466285,2025-04-24 21:15:02.786466,0 days 00:00:01.320181,squared_error,35,log2,1,13,best,TPESampler,COMPLETE
2147,0.9993409537053991,2025-04-24 21:15:02.510468,2025-04-24 21:15:03.207305,0 days 00:00:00.696837,absolute_error,20,sqrt,8,6,random,TPESampler,COMPLETE
2148,0.9347481389709953,2025-04-24 21:15:02.941132,2025-04-24 21:15:03.945558,0 days 00:00:01.004426,squared_error,35,sqrt,9,14,random,TPESampler,COMPLETE
2149,0.7027154457858903,2025-04-24 21:15:03.134521,2025-04-24 21:15:04.281183,0 days 00:00:01.146662,squared_error,24,log2,1,14,best,TPESampler,COMPLETE
2150,0.5120876615801571,2025-04-24 21:15:03.514655,2025-04-24 21:15:04.511848,0 days 00:00:00.997193,friedman_mse,35,log2,1,12,best,TPESampler,COMPLETE
2151,0.7975493713728398,2025-04-24 21:15:04.232466,2025-04-24 21:15:05.133184,0 days 00:00:00.900718,squared_error,35,log2,3,11,best,TPESampler,COMPLETE
2152,0.6692087088741673,2025-04-24 21:15:04.582277,2025-04-24 21:15:05.585298,0 days 00:00:01.003021,squared_error,30,log2,1,9,best,TPESampler,COMPLETE
2153,0.5128537554029937,2025-04-24 21:15:04.775776,2025-04-24 21:15:05.758758,0 days 00:00:00.982982,squared_error,35,log2,1,11,best,TPESampler,COMPLETE
2154,0.7975493713728398,2025-04-24 21:15:05.422131,2025-04-24 21:15:06.431554,0 days 00:00:01.009423,squared_error,30,log2,2,13,best,TPESampler,COMPLETE
2155,1.0234382327956146,2025-04-24 21:15:05.860786,2025-04-24 21:15:07.303926,0 days 00:00:01.443140,absolute_error,33,sqrt,10,10,best,TPESampler,COMPLETE
2156,0.7975493713728398,2025-04-24 21:15:06.043220,2025-04-24 21:15:07.292267,0 days 00:00:01.249047,squared_error,35,log2,2,9,best,TPESampler,COMPLETE
2157,0.9494322793442198,2025-04-24 21:15:06.918641,2025-04-24 21:15:07.657792,0 days 00:00:00.739151,squared_error,22,log2,8,3,best,TPESampler,COMPLETE
2158,0.674050854009347,2025-04-24 21:15:07.476954,2025-04-24 21:15:08.749973,0 days 00:00:01.273019,friedman_mse,28,log2,1,9,best,TPESampler,COMPLETE
2159,0.4948844885027081,2025-04-24 21:15:07.527723,2025-04-24 21:15:08.751224,0 days 00:00:01.223501,squared_error,35,log2,1,9,best,TPESampler,COMPLETE
2160,0.4438474442892985,2025-04-24 21:15:07.972668,2025-04-24 21:15:09.131770,0 days 00:00:01.159102,squared_error,35,log2,1,10,best,TPESampler,COMPLETE
2161,0.7975493713728398,2025-04-24 21:15:09.045672,2025-04-24 21:15:09.849048,0 days 00:00:00.803376,squared_error,35,log2,3,13,best,TPESampler,COMPLETE
2162,0.7139952038158272,2025-04-24 21:15:09.093761,2025-04-24 21:15:10.415849,0 days 00:00:01.322088,squared_error,23,log2,1,10,best,TPESampler,COMPLETE
2163,0.6536227573836495,2025-04-24 21:15:09.448290,2025-04-24 21:15:10.453827,0 days 00:00:01.005537,absolute_error,31,log2,1,12,best,TPESampler,COMPLETE
2164,0.7050570733862331,2025-04-24 21:15:10.185802,2025-04-24 21:15:11.014787,0 days 00:00:00.828985,squared_error,30,log2,1,4,best,TPESampler,COMPLETE
2165,0.6756408221672622,2025-04-24 21:15:10.660927,2025-04-24 21:15:11.655504,0 days 00:00:00.994577,squared_error,30,log2,1,8,best,TPESampler,COMPLETE
2166,0.6756408221672622,2025-04-24 21:15:10.705723,2025-04-24 21:15:11.764114,0 days 00:00:01.058391,squared_error,30,log2,1,8,best,TPESampler,COMPLETE
2167,0.4948844885027081,2025-04-24 21:15:11.488231,2025-04-24 21:15:12.270428,0 days 00:00:00.782197,squared_error,35,log2,1,9,best,TPESampler,COMPLETE
2168,0.7975493713728398,2025-04-24 21:15:11.950611,2025-04-24 21:15:12.975714,0 days 00:00:01.025103,squared_error,30,log2,3,8,best,TPESampler,COMPLETE
2169,0.8913351576037826,2025-04-24 21:15:12.168295,2025-04-24 21:15:13.148209,0 days 00:00:00.979914,squared_error,34,sqrt,3,8,best,TPESampler,COMPLETE
2170,0.9671029066257907,2025-04-24 21:15:12.648078,2025-04-24 21:15:13.575318,0 days 00:00:00.927240,absolute_error,10,log2,3,3,random,TPESampler,COMPLETE
2171,0.4438474442892985,2025-04-24 21:15:13.238871,2025-04-24 21:15:14.148625,0 days 00:00:00.909754,squared_error,35,log2,1,10,best,TPESampler,COMPLETE
2172,0.7975493713728398,2025-04-24 21:15:13.432825,2025-04-24 21:15:14.542632,0 days 00:00:01.109807,squared_error,35,log2,3,9,best,TPESampler,COMPLETE
2173,0.7975493713728398,2025-04-24 21:15:13.893434,2025-04-24 21:15:14.792829,0 days 00:00:00.899395,squared_error,35,log2,3,7,best,TPESampler,COMPLETE
2174,0.7975493713728398,2025-04-24 21:15:14.504984,2025-04-24 21:15:15.406359,0 days 00:00:00.901375,squared_error,35,log2,3,12,best,TPESampler,COMPLETE
2175,0.671564007425267,2025-04-24 21:15:14.863988,2025-04-24 21:15:15.954138,0 days 00:00:01.090150,squared_error,30,log2,1,13,best,TPESampler,COMPLETE
2176,0.46385297432679357,2025-04-24 21:15:15.064593,2025-04-24 21:15:15.946537,0 days 00:00:00.881944,squared_error,35,log2,1,15,best,TPESampler,COMPLETE
2177,0.9653842079857469,2025-04-24 21:15:15.713820,2025-04-24 21:15:16.513843,0 days 00:00:00.800023,absolute_error,26,log2,1,12,random,TPESampler,COMPLETE
2178,0.6689797096059603,2025-04-24 21:15:16.167477,2025-04-24 21:15:17.318026,0 days 00:00:01.150549,squared_error,30,log2,1,11,best,TPESampler,COMPLETE
2179,0.7975493713728398,2025-04-24 21:15:16.200487,2025-04-24 21:15:17.413815,0 days 00:00:01.213328,squared_error,30,log2,2,11,best,TPESampler,COMPLETE
2180,0.46337395013381627,2025-04-24 21:15:16.863230,2025-04-24 21:15:17.809497,0 days 00:00:00.946267,squared_error,35,log2,1,4,best,TPESampler,COMPLETE
2181,0.7975493713728398,2025-04-24 21:15:17.767630,2025-04-24 21:15:18.803004,0 days 00:00:01.035374,friedman_mse,31,log2,3,9,best,TPESampler,COMPLETE
2182,0.6735913168527353,2025-04-24 21:15:17.803139,2025-04-24 21:15:18.857178,0 days 00:00:01.054039,squared_error,30,log2,1,10,best,TPESampler,COMPLETE
2183,0.5128537554029937,2025-04-24 21:15:18.523551,2025-04-24 21:15:19.317472,0 days 00:00:00.793921,squared_error,35,log2,1,11,best,TPESampler,COMPLETE
2184,0.6689797096059603,2025-04-24 21:15:19.028064,2025-04-24 21:15:20.127597,0 days 00:00:01.099533,squared_error,30,log2,1,11,best,TPESampler,COMPLETE
2185,0.7975493713728398,2025-04-24 21:15:19.077503,2025-04-24 21:15:20.096677,0 days 00:00:01.019174,squared_error,30,log2,2,11,best,TPESampler,COMPLETE
2186,0.7975493713728398,2025-04-24 21:15:19.658892,2025-04-24 21:15:20.490639,0 days 00:00:00.831747,squared_error,23,log2,3,13,best,TPESampler,COMPLETE
2187,0.5128537554029937,2025-04-24 21:15:20.448005,2025-04-24 21:15:21.441338,0 days 00:00:00.993333,squared_error,35,log2,1,11,best,TPESampler,COMPLETE
2188,0.921490865991525,2025-04-24 21:15:20.479976,2025-04-24 21:15:21.547523,0 days 00:00:01.067547,squared_error,30,sqrt,5,9,random,TPESampler,COMPLETE
2189,0.4948844885027081,2025-04-24 21:15:20.785169,2025-04-24 21:15:21.896723,0 days 00:00:01.111554,squared_error,35,log2,1,9,best,TPESampler,COMPLETE
2190,0.6708356072336189,2025-04-24 21:15:21.850437,2025-04-24 21:15:22.622469,0 days 00:00:00.772032,squared_error,30,log2,1,12,best,TPESampler,COMPLETE
2191,0.5962410098210372,2025-04-24 21:15:21.898120,2025-04-24 21:15:23.001434,0 days 00:00:01.103314,friedman_mse,23,sqrt,1,13,random,TPESampler,COMPLETE
2192,0.4438474442892985,2025-04-24 21:15:22.148107,2025-04-24 21:15:23.256973,0 days 00:00:01.108866,squared_error,35,log2,1,10,best,TPESampler,COMPLETE
2193,0.4438474442892985,2025-04-24 21:15:22.958553,2025-04-24 21:15:23.875374,0 days 00:00:00.916821,squared_error,35,log2,1,10,best,TPESampler,COMPLETE
2194,0.6879152987275021,2025-04-24 21:15:23.327989,2025-04-24 21:15:24.620762,0 days 00:00:01.292773,absolute_error,35,log2,1,10,best,TPESampler,COMPLETE
2195,0.4438474442892985,2025-04-24 21:15:23.516937,2025-04-24 21:15:24.460416,0 days 00:00:00.943479,squared_error,35,log2,1,10,best,TPESampler,COMPLETE
2196,0.7975493713728398,2025-04-24 21:15:24.226739,2025-04-24 21:15:24.939248,0 days 00:00:00.712509,squared_error,35,log2,3,6,best,TPESampler,COMPLETE
2197,1.0007431665713944,2025-04-24 21:15:24.840115,2025-04-24 21:15:25.558164,0 days 00:00:00.718049,absolute_error,31,log2,7,6,random,TPESampler,COMPLETE
2198,0.7975493713728398,2025-04-24 21:15:24.904022,2025-04-24 21:15:26.098766,0 days 00:00:01.194744,squared_error,30,log2,3,9,best,TPESampler,COMPLETE
2199,0.7975493713728398,2025-04-24 21:15:25.221034,2025-04-24 21:15:26.272564,0 days 00:00:01.051530,squared_error,35,log2,3,12,best,TPESampler,COMPLETE
2200,0.7975493713728398,2025-04-24 21:15:25.861016,2025-04-24 21:15:26.656542,0 days 00:00:00.795526,squared_error,30,log2,2,8,best,TPESampler,COMPLETE
2201,0.7975493713728398,2025-04-24 21:15:26.480333,2025-04-24 21:15:27.426934,0 days 00:00:00.946601,squared_error,35,log2,2,12,best,TPESampler,COMPLETE
2202,0.9494322793442198,2025-04-24 21:15:26.610910,2025-04-24 21:15:27.583487,0 days 00:00:00.972577,squared_error,16,log2,10,8,random,TPESampler,COMPLETE
2203,0.48051683833886516,2025-04-24 21:15:27.051802,2025-04-24 21:15:27.993193,0 days 00:00:00.941391,squared_error,35,log2,1,8,best,TPESampler,COMPLETE
2204,0.7975493713728398,2025-04-24 21:15:27.656435,2025-04-24 21:15:28.611829,0 days 00:00:00.955394,squared_error,30,log2,3,10,best,TPESampler,COMPLETE
2205,0.6775674127828398,2025-04-24 21:15:27.850963,2025-04-24 21:15:28.892799,0 days 00:00:01.041836,squared_error,31,log2,1,7,best,TPESampler,COMPLETE
2206,0.7041916481125602,2025-04-24 21:15:28.343845,2025-04-24 21:15:29.297684,0 days 00:00:00.953839,squared_error,25,log2,1,6,best,TPESampler,COMPLETE
2207,0.6511497278763692,2025-04-24 21:15:28.896007,2025-04-24 21:15:29.956745,0 days 00:00:01.060738,squared_error,30,log2,1,7,best,TPESampler,COMPLETE
2208,0.458106663082747,2025-04-24 21:15:29.171302,2025-04-24 21:15:30.216661,0 days 00:00:01.045359,squared_error,35,log2,1,6,best,TPESampler,COMPLETE
2209,0.5128537554029937,2025-04-24 21:15:29.589218,2025-04-24 21:15:30.596459,0 days 00:00:01.007241,friedman_mse,35,log2,1,11,best,TPESampler,COMPLETE
2210,0.904824688015853,2025-04-24 21:15:30.248013,2025-04-24 21:15:31.258871,0 days 00:00:01.010858,squared_error,35,log2,1,14,random,TPESampler,COMPLETE
2211,0.921490865991525,2025-04-24 21:15:30.457449,2025-04-24 21:15:31.448731,0 days 00:00:00.991282,squared_error,12,sqrt,5,3,random,TPESampler,COMPLETE
2212,0.6586011368319069,2025-04-24 21:15:30.918189,2025-04-24 21:15:31.830886,0 days 00:00:00.912697,squared_error,30,log2,1,14,best,TPESampler,COMPLETE
2213,0.7975493713728398,2025-04-24 21:15:31.515596,2025-04-24 21:15:32.439193,0 days 00:00:00.923597,squared_error,31,log2,2,10,best,TPESampler,COMPLETE
2214,0.9347481389709953,2025-04-24 21:15:31.688763,2025-04-24 21:15:32.713856,0 days 00:00:01.025093,friedman_mse,26,sqrt,6,18,random,TPESampler,COMPLETE
2215,0.6735913168527353,2025-04-24 21:15:32.103409,2025-04-24 21:15:33.121861,0 days 00:00:01.018452,squared_error,30,log2,1,10,best,TPESampler,COMPLETE
2216,0.46385297432679357,2025-04-24 21:15:32.765125,2025-04-24 21:15:33.948241,0 days 00:00:01.183116,squared_error,35,log2,1,15,best,TPESampler,COMPLETE
2217,0.7975493713728398,2025-04-24 21:15:32.998150,2025-04-24 21:15:34.138242,0 days 00:00:01.140092,squared_error,35,log2,2,9,best,TPESampler,COMPLETE
2218,0.5128537554029937,2025-04-24 21:15:33.479384,2025-04-24 21:15:34.465237,0 days 00:00:00.985853,squared_error,35,log2,1,11,best,TPESampler,COMPLETE
2219,0.7975493713728398,2025-04-24 21:15:34.424252,2025-04-24 21:15:35.452116,0 days 00:00:01.027864,friedman_mse,31,log2,3,12,best,TPESampler,COMPLETE
2220,0.6317023826094311,2025-04-24 21:15:34.458884,2025-04-24 21:15:35.791652,0 days 00:00:01.332768,squared_error,31,sqrt,2,9,best,TPESampler,COMPLETE
2221,0.5120876615801571,2025-04-24 21:15:34.798280,2025-04-24 21:15:35.936976,0 days 00:00:01.138696,squared_error,35,log2,1,12,best,TPESampler,COMPLETE
2222,0.7975493713728398,2025-04-24 21:15:35.749070,2025-04-24 21:15:36.544695,0 days 00:00:00.795625,squared_error,35,log2,3,9,best,TPESampler,COMPLETE
2223,0.7975493713728398,2025-04-24 21:15:36.050543,2025-04-24 21:15:37.085325,0 days 00:00:01.034782,squared_error,35,log2,2,7,best,TPESampler,COMPLETE
2224,0.6692087088741673,2025-04-24 21:15:36.184186,2025-04-24 21:15:37.090557,0 days 00:00:00.906371,squared_error,30,log2,1,9,best,TPESampler,COMPLETE
2225,0.4438474442892985,2025-04-24 21:15:36.854248,2025-04-24 21:15:38.286112,0 days 00:00:01.431864,squared_error,35,log2,1,10,best,TPESampler,COMPLETE
2226,1.0007431665713944,2025-04-24 21:15:37.252766,2025-04-24 21:15:38.613048,0 days 00:00:01.360282,absolute_error,15,log2,6,3,random,TPESampler,COMPLETE
2227,0.894550859606008,2025-04-24 21:15:37.288514,2025-04-24 21:15:38.280735,0 days 00:00:00.992221,squared_error,18,sqrt,7,4,best,TPESampler,COMPLETE
2228,0.4438474442892985,2025-04-24 21:15:38.509715,2025-04-24 21:15:39.270835,0 days 00:00:00.761120,squared_error,35,log2,1,10,best,TPESampler,COMPLETE
2229,0.44670023329729247,2025-04-24 21:15:38.573945,2025-04-24 21:15:39.823256,0 days 00:00:01.249311,squared_error,35,log2,1,7,best,TPESampler,COMPLETE
2230,0.6689797096059603,2025-04-24 21:15:38.920155,2025-04-24 21:15:39.937551,0 days 00:00:01.017396,squared_error,30,log2,1,11,best,TPESampler,COMPLETE
2231,0.7975493713728398,2025-04-24 21:15:39.632690,2025-04-24 21:15:40.465644,0 days 00:00:00.832954,squared_error,35,log2,3,10,best,TPESampler,COMPLETE
2232,0.7975493713728398,2025-04-24 21:15:40.091432,2025-04-24 21:15:41.247851,0 days 00:00:01.156419,squared_error,30,log2,2,15,best,TPESampler,COMPLETE
2233,0.7975493713728398,2025-04-24 21:15:40.178442,2025-04-24 21:15:41.278036,0 days 00:00:01.099594,friedman_mse,30,log2,3,6,best,TPESampler,COMPLETE
2234,0.9494322793442198,2025-04-24 21:15:40.835207,2025-04-24 21:15:41.551674,0 days 00:00:00.716467,squared_error,30,log2,6,8,best,TPESampler,COMPLETE
2235,0.786987845634963,2025-04-24 21:15:41.505895,2025-04-24 21:15:42.539389,0 days 00:00:01.033494,absolute_error,35,log2,2,7,best,TPESampler,COMPLETE
2236,0.5101622714757418,2025-04-24 21:15:41.566051,2025-04-24 21:15:42.628801,0 days 00:00:01.062750,squared_error,35,log2,1,13,best,TPESampler,COMPLETE
2237,0.7975493713728398,2025-04-24 21:15:41.789888,2025-04-24 21:15:42.832139,0 days 00:00:01.042251,squared_error,35,log2,3,13,best,TPESampler,COMPLETE
2238,0.7975493713728398,2025-04-24 21:15:42.790952,2025-04-24 21:15:43.873919,0 days 00:00:01.082967,squared_error,23,log2,2,10,best,TPESampler,COMPLETE
2239,0.9638042122577196,2025-04-24 21:15:42.981146,2025-04-24 21:15:43.946428,0 days 00:00:00.965282,absolute_error,12,sqrt,2,14,random,TPESampler,COMPLETE
2240,0.6511497278763692,2025-04-24 21:15:43.253858,2025-04-24 21:15:44.195540,0 days 00:00:00.941682,squared_error,30,log2,1,7,best,TPESampler,COMPLETE
2241,0.6416333266631498,2025-04-24 21:15:44.102486,2025-04-24 21:15:44.911924,0 days 00:00:00.809438,squared_error,23,sqrt,1,18,best,TPESampler,COMPLETE
2242,0.7975493713728398,2025-04-24 21:15:44.357406,2025-04-24 21:15:45.402426,0 days 00:00:01.045020,squared_error,35,log2,2,9,best,TPESampler,COMPLETE
2243,0.6747391651080636,2025-04-24 21:15:44.587483,2025-04-24 21:15:45.870818,0 days 00:00:01.283335,squared_error,29,log2,1,8,best,TPESampler,COMPLETE
2244,0.6689797096059603,2025-04-24 21:15:45.349388,2025-04-24 21:15:46.346056,0 days 00:00:00.996668,squared_error,30,log2,1,11,best,TPESampler,COMPLETE
2245,0.7975493713728398,2025-04-24 21:15:45.747266,2025-04-24 21:15:46.642679,0 days 00:00:00.895413,friedman_mse,35,log2,3,8,best,TPESampler,COMPLETE
2246,0.48051683833886516,2025-04-24 21:15:46.223691,2025-04-24 21:15:47.057583,0 days 00:00:00.833892,squared_error,35,log2,1,8,best,TPESampler,COMPLETE
2247,0.5848454072682857,2025-04-24 21:15:46.689206,2025-04-24 21:15:47.560219,0 days 00:00:00.871013,squared_error,35,sqrt,1,11,best,TPESampler,COMPLETE
2248,0.5120876615801571,2025-04-24 21:15:47.010463,2025-04-24 21:15:47.981757,0 days 00:00:00.971294,squared_error,35,log2,1,12,best,TPESampler,COMPLETE
2249,0.7975493713728398,2025-04-24 21:15:47.377916,2025-04-24 21:15:48.236279,0 days 00:00:00.858363,squared_error,35,log2,2,12,best,TPESampler,COMPLETE
2250,0.7975493713728398,2025-04-24 21:15:47.929648,2025-04-24 21:15:48.886127,0 days 00:00:00.956479,squared_error,30,log2,3,12,best,TPESampler,COMPLETE
2251,0.7975493713728398,2025-04-24 21:15:48.276504,2025-04-24 21:15:49.231383,0 days 00:00:00.954879,squared_error,30,log2,2,11,best,TPESampler,COMPLETE
2252,0.7975493713728398,2025-04-24 21:15:48.576616,2025-04-24 21:15:49.546594,0 days 00:00:00.969978,squared_error,35,log2,3,10,best,TPESampler,COMPLETE
2253,0.48051683833886516,2025-04-24 21:15:49.187537,2025-04-24 21:15:50.200215,0 days 00:00:01.012678,squared_error,35,log2,1,8,best,TPESampler,COMPLETE
2254,0.5120876615801571,2025-04-24 21:15:49.552454,2025-04-24 21:15:50.515627,0 days 00:00:00.963173,squared_error,35,log2,1,12,best,TPESampler,COMPLETE
2255,0.48444975754384645,2025-04-24 21:15:49.901614,2025-04-24 21:15:50.710619,0 days 00:00:00.809005,squared_error,35,log2,1,14,best,TPESampler,COMPLETE
2256,1.0007431665713944,2025-04-24 21:15:50.566237,2025-04-24 21:15:51.638507,0 days 00:00:01.072270,absolute_error,33,log2,10,17,random,TPESampler,COMPLETE
2257,0.6831095431530921,2025-04-24 21:15:50.769422,2025-04-24 21:15:52.133962,0 days 00:00:01.364540,squared_error,28,log2,1,11,best,TPESampler,COMPLETE
2258,0.4948844885027081,2025-04-24 21:15:50.984850,2025-04-24 21:15:52.283388,0 days 00:00:01.298538,squared_error,35,log2,1,9,best,TPESampler,COMPLETE
2259,0.4948844885027081,2025-04-24 21:15:52.007525,2025-04-24 21:15:53.124255,0 days 00:00:01.116730,squared_error,35,log2,1,9,best,TPESampler,COMPLETE
2260,0.4948844885027081,2025-04-24 21:15:52.432691,2025-04-24 21:15:53.435535,0 days 00:00:01.002844,squared_error,35,log2,1,9,best,TPESampler,COMPLETE
2261,1.0234382327956146,2025-04-24 21:15:52.829988,2025-04-24 21:15:53.748327,0 days 00:00:00.918339,absolute_error,34,sqrt,8,3,best,TPESampler,COMPLETE
2262,0.5128537554029937,2025-04-24 21:15:53.494289,2025-04-24 21:15:54.338331,0 days 00:00:00.844042,squared_error,35,log2,1,11,best,TPESampler,COMPLETE
2263,0.7975493713728398,2025-04-24 21:15:53.780684,2025-04-24 21:15:54.843544,0 days 00:00:01.062860,squared_error,30,log2,3,10,best,TPESampler,COMPLETE
2264,0.7975493713728398,2025-04-24 21:15:54.182369,2025-04-24 21:15:55.289638,0 days 00:00:01.107269,squared_error,31,log2,3,4,best,TPESampler,COMPLETE
2265,0.7254599947963579,2025-04-24 21:15:54.690288,2025-04-24 21:15:55.558215,0 days 00:00:00.867927,absolute_error,28,log2,1,7,best,TPESampler,COMPLETE
2266,0.8876713258154219,2025-04-24 21:15:55.245532,2025-04-24 21:15:56.114757,0 days 00:00:00.869225,squared_error,17,sqrt,5,12,best,TPESampler,COMPLETE
2267,0.6914253690247881,2025-04-24 21:15:55.644173,2025-04-24 21:15:56.642100,0 days 00:00:00.997927,friedman_mse,29,log2,1,11,best,TPESampler,COMPLETE
2268,0.7975493713728398,2025-04-24 21:15:55.839083,2025-04-24 21:15:56.877419,0 days 00:00:01.038336,squared_error,35,log2,2,10,best,TPESampler,COMPLETE
2269,0.6735913168527353,2025-04-24 21:15:56.484780,2025-04-24 21:15:57.336168,0 days 00:00:00.851388,squared_error,30,log2,1,10,best,TPESampler,COMPLETE
2270,0.7975493713728398,2025-04-24 21:15:56.995617,2025-04-24 21:15:58.004006,0 days 00:00:01.008389,squared_error,30,log2,2,10,best,TPESampler,COMPLETE
2271,0.6914253690247881,2025-04-24 21:15:57.189558,2025-04-24 21:15:58.186583,0 days 00:00:00.997025,squared_error,29,log2,1,11,best,TPESampler,COMPLETE
2272,0.8942042180115075,2025-04-24 21:15:57.663334,2025-04-24 21:15:58.505176,0 days 00:00:00.841842,squared_error,32,sqrt,10,11,best,TPESampler,COMPLETE
2273,0.6756408221672622,2025-04-24 21:15:58.462220,2025-04-24 21:15:59.604982,0 days 00:00:01.142762,squared_error,30,log2,1,8,best,TPESampler,COMPLETE
2274,1.0007431665713944,2025-04-24 21:15:58.277688,2025-04-24 21:16:00.122608,0 days 00:00:01.844920,absolute_error,33,log2,5,20,best,TPESampler,COMPLETE
2275,0.922426147955362,2025-04-24 21:15:58.897976,2025-04-24 21:15:59.919324,0 days 00:00:01.021348,squared_error,35,log2,2,11,random,TPESampler,COMPLETE
2276,0.6586011368319069,2025-04-24 21:15:59.878648,2025-04-24 21:16:00.746949,0 days 00:00:00.868301,squared_error,30,log2,1,14,best,TPESampler,COMPLETE
2277,0.7975493713728398,2025-04-24 21:16:00.193325,2025-04-24 21:16:01.196569,0 days 00:00:01.003244,squared_error,35,log2,3,11,best,TPESampler,COMPLETE
2278,0.9494322793442198,2025-04-24 21:16:00.378669,2025-04-24 21:16:01.618937,0 days 00:00:01.240268,friedman_mse,9,log2,5,10,best,TPESampler,COMPLETE
