number,value,datetime_start,datetime_complete,duration,params_criterion,params_max_depth,params_max_features,params_min_samples_leaf,params_min_samples_split,params_splitter,system_attrs_auto:sampler,state
0,0.9347481389709953,2025-04-24 21:00:37.487790,2025-04-24 21:00:38.093810,0 days 00:00:00.606020,friedman_mse,12,sqrt,9,14,random,RandomSampler,COMPLETE
1,0.8913351576037826,2025-04-24 21:00:37.504142,2025-04-24 21:00:38.099213,0 days 00:00:00.595071,friedman_mse,21,sqrt,3,15,best,RandomSampler,COMPLETE
2,0.9494322793442198,2025-04-24 21:00:37.600347,2025-04-24 21:00:38.266875,0 days 00:00:00.666528,friedman_mse,20,log2,10,12,random,RandomSampler,COMPLETE
3,0.9494322793442198,2025-04-24 21:00:38.329616,2025-04-24 21:00:39.143659,0 days 00:00:00.814043,friedman_mse,1,log2,8,7,best,TPESampler,COMPLETE
4,0.922426147955362,2025-04-24 21:00:38.395862,2025-04-24 21:00:39.046196,0 days 00:00:00.650334,friedman_mse,15,log2,4,7,random,TPESampler,COMPLETE
5,1.028030364428894,2025-04-24 21:00:38.698213,2025-04-24 21:00:39.361399,0 days 00:00:00.663186,absolute_error,21,sqrt,5,10,best,TPESampler,COMPLETE
6,0.9524425849299664,2025-04-24 21:00:39.314250,2025-04-24 21:00:40.075076,0 days 00:00:00.760826,squared_error,1,sqrt,2,16,best,TPESampler,COMPLETE
7,1.028030364428894,2025-04-24 21:00:39.391770,2025-04-24 21:00:40.167475,0 days 00:00:00.775705,absolute_error,26,sqrt,6,13,best,TPESampler,COMPLETE
8,0.7194883123745602,2025-04-24 21:00:39.683091,2025-04-24 21:00:40.373073,0 days 00:00:00.689982,absolute_error,32,sqrt,2,5,best,TPESampler,COMPLETE
9,0.922426147955362,2025-04-24 21:00:40.320047,2025-04-24 21:00:41.148660,0 days 00:00:00.828613,friedman_mse,26,log2,3,2,random,TPESampler,COMPLETE
10,0.922426147955362,2025-04-24 21:00:40.396591,2025-04-24 21:00:41.228329,0 days 00:00:00.831738,squared_error,27,log2,5,4,random,TPESampler,COMPLETE
11,0.894550859606008,2025-04-24 21:00:40.582231,2025-04-24 21:00:41.362811,0 days 00:00:00.780580,squared_error,28,sqrt,7,6,best,TPESampler,COMPLETE
12,0.7766630874097967,2025-04-24 21:00:41.370464,2025-04-24 21:00:42.070907,0 days 00:00:00.700443,absolute_error,30,sqrt,3,2,best,TPESampler,COMPLETE
13,0.6408021405408113,2025-04-24 21:00:41.433838,2025-04-24 21:00:42.381087,0 days 00:00:00.947249,friedman_mse,25,sqrt,2,17,best,TPESampler,COMPLETE
14,0.7712088672102367,2025-04-24 21:00:41.583695,2025-04-24 21:00:42.555185,0 days 00:00:00.971490,absolute_error,34,sqrt,4,5,best,TPESampler,COMPLETE
15,0.9245771875115085,2025-04-24 21:00:42.417956,2025-04-24 21:00:43.160318,0 days 00:00:00.742362,friedman_mse,33,sqrt,3,15,random,TPESampler,COMPLETE
16,0.8898655866291454,2025-04-24 21:00:42.682196,2025-04-24 21:00:43.600447,0 days 00:00:00.918251,absolute_error,29,sqrt,1,14,best,TPESampler,COMPLETE
17,0.6806094890723541,2025-04-24 21:00:42.813552,2025-04-24 21:00:43.795708,0 days 00:00:00.982156,friedman_mse,27,log2,1,12,best,TPESampler,COMPLETE
18,0.7975493713728398,2025-04-24 21:00:43.475044,2025-04-24 21:00:44.347883,0 days 00:00:00.872839,friedman_mse,24,log2,2,11,best,TPESampler,COMPLETE
19,0.7975493713728398,2025-04-24 21:00:43.937171,2025-04-24 21:00:44.606314,0 days 00:00:00.669143,friedman_mse,35,log2,3,17,best,TPESampler,COMPLETE
20,0.922426147955362,2025-04-24 21:00:44.193060,2025-04-24 21:00:44.972404,0 days 00:00:00.779344,friedman_mse,18,log2,2,17,random,TPESampler,COMPLETE
21,0.5702554139584247,2025-04-24 21:00:44.659312,2025-04-24 21:00:45.374367,0 days 00:00:00.715055,friedman_mse,32,sqrt,1,6,best,TPESampler,COMPLETE
22,0.786987845634963,2025-04-24 21:00:44.925440,2025-04-24 21:00:45.715534,0 days 00:00:00.790094,absolute_error,27,log2,2,8,best,TPESampler,COMPLETE
23,0.5492948550260202,2025-04-24 21:00:45.272982,2025-04-24 21:00:46.076090,0 days 00:00:00.803108,friedman_mse,25,sqrt,1,19,best,TPESampler,COMPLETE
24,0.616704975239498,2025-04-24 21:00:45.612103,2025-04-24 21:00:46.266080,0 days 00:00:00.653977,friedman_mse,31,sqrt,1,4,best,TPESampler,COMPLETE
25,0.6699170210290821,2025-04-24 21:00:46.078328,2025-04-24 21:00:47.050643,0 days 00:00:00.972315,friedman_mse,34,sqrt,1,5,best,TPESampler,COMPLETE
26,0.6416778380181587,2025-04-24 21:00:46.275038,2025-04-24 21:00:47.216929,0 days 00:00:00.941891,friedman_mse,25,sqrt,1,2,best,TPESampler,COMPLETE
27,0.9116704775858039,2025-04-24 21:00:46.579480,2025-04-24 21:00:47.411553,0 days 00:00:00.832073,friedman_mse,22,sqrt,2,3,random,TPESampler,COMPLETE
28,0.5516945697956954,2025-04-24 21:00:47.302308,2025-04-24 21:00:47.881044,0 days 00:00:00.578736,squared_error,27,sqrt,1,8,best,TPESampler,COMPLETE
29,0.6708583131946557,2025-04-24 21:00:47.542544,2025-04-24 21:00:48.334424,0 days 00:00:00.791880,squared_error,18,sqrt,2,9,best,TPESampler,COMPLETE
30,0.5475861846154583,2025-04-24 21:00:47.671875,2025-04-24 21:00:48.420894,0 days 00:00:00.749019,squared_error,27,sqrt,1,7,best,TPESampler,COMPLETE
31,0.9116704775858039,2025-04-24 21:00:48.217082,2025-04-24 21:00:48.969718,0 days 00:00:00.752636,squared_error,30,sqrt,2,5,random,TPESampler,COMPLETE
32,0.6051469984207681,2025-04-24 21:00:48.589310,2025-04-24 21:00:49.479983,0 days 00:00:00.890673,squared_error,33,sqrt,1,10,best,TPESampler,COMPLETE
33,0.5997895390273341,2025-04-24 21:00:48.638172,2025-04-24 21:00:49.493686,0 days 00:00:00.855514,squared_error,33,sqrt,1,8,best,TPESampler,COMPLETE
34,0.6451247801067114,2025-04-24 21:00:49.186510,2025-04-24 21:00:49.857495,0 days 00:00:00.670985,squared_error,18,sqrt,1,4,best,TPESampler,COMPLETE
35,0.6408021405408113,2025-04-24 21:00:49.690269,2025-04-24 21:00:50.570614,0 days 00:00:00.880345,squared_error,25,sqrt,2,19,best,TPESampler,COMPLETE
36,0.4646442062482263,2025-04-24 21:00:49.764667,2025-04-24 21:00:50.634512,0 days 00:00:00.869845,squared_error,35,log2,1,3,best,TPESampler,COMPLETE
37,0.8876713258154219,2025-04-24 21:00:50.160098,2025-04-24 21:00:50.913559,0 days 00:00:00.753461,friedman_mse,10,sqrt,6,19,best,TPESampler,COMPLETE
38,0.6699817572771019,2025-04-24 21:00:50.778915,2025-04-24 21:00:51.644900,0 days 00:00:00.865985,squared_error,31,log2,1,3,best,TPESampler,COMPLETE
39,0.4605209589836094,2025-04-24 21:00:50.848399,2025-04-24 21:00:51.720725,0 days 00:00:00.872326,squared_error,35,log2,1,2,best,TPESampler,COMPLETE
40,0.9116704775858039,2025-04-24 21:00:51.216727,2025-04-24 21:00:51.979557,0 days 00:00:00.762830,friedman_mse,23,sqrt,2,19,random,TPESampler,COMPLETE
41,0.9494322793442198,2025-04-24 21:00:51.866824,2025-04-24 21:00:52.648388,0 days 00:00:00.781564,squared_error,28,log2,4,4,best,TPESampler,COMPLETE
42,0.919849525624737,2025-04-24 21:00:51.941794,2025-04-24 21:00:52.838998,0 days 00:00:00.897204,squared_error,33,log2,1,3,random,TPESampler,COMPLETE
43,0.9167251506253564,2025-04-24 21:00:52.214291,2025-04-24 21:00:53.034349,0 days 00:00:00.820058,squared_error,32,log2,1,3,random,TPESampler,COMPLETE
44,0.7975493713728398,2025-04-24 21:00:52.893392,2025-04-24 21:00:53.557046,0 days 00:00:00.663654,squared_error,35,log2,2,9,best,TPESampler,COMPLETE
45,0.7975493713728398,2025-04-24 21:00:53.092454,2025-04-24 21:00:53.937706,0 days 00:00:00.845252,friedman_mse,34,log2,2,2,best,TPESampler,COMPLETE
46,0.7975493713728398,2025-04-24 21:00:53.227078,2025-04-24 21:00:54.121431,0 days 00:00:00.894353,squared_error,33,log2,3,3,best,TPESampler,COMPLETE
47,0.6187813715358572,2025-04-24 21:00:53.886387,2025-04-24 21:00:54.675578,0 days 00:00:00.789191,friedman_mse,25,sqrt,2,20,best,TPESampler,COMPLETE
48,0.7050206224878302,2025-04-24 21:00:54.197686,2025-04-24 21:00:55.024583,0 days 00:00:00.826897,absolute_error,34,log2,1,4,best,TPESampler,COMPLETE
49,0.9230363570593395,2025-04-24 21:00:54.326347,2025-04-24 21:00:55.161264,0 days 00:00:00.834917,absolute_error,20,sqrt,1,20,best,TPESampler,COMPLETE
50,0.6535365241805663,2025-04-24 21:00:54.936496,2025-04-24 21:00:55.516458,0 days 00:00:00.579962,squared_error,29,sqrt,2,2,best,TPESampler,COMPLETE
51,0.8913351576037826,2025-04-24 21:00:55.265649,2025-04-24 21:00:55.975535,0 days 00:00:00.709886,friedman_mse,23,sqrt,3,9,best,TPESampler,COMPLETE
52,0.6682481592170211,2025-04-24 21:00:55.406463,2025-04-24 21:00:56.169926,0 days 00:00:00.763463,squared_error,31,log2,1,2,best,TPESampler,COMPLETE
53,0.9347481389709953,2025-04-24 21:00:55.912937,2025-04-24 21:00:56.536329,0 days 00:00:00.623392,squared_error,19,sqrt,8,17,random,TPESampler,COMPLETE
54,0.921490865991525,2025-04-24 21:00:56.216782,2025-04-24 21:00:56.976891,0 days 00:00:00.760109,squared_error,11,sqrt,5,2,random,TPESampler,COMPLETE
55,0.4605209589836094,2025-04-24 21:00:56.430202,2025-04-24 21:00:57.157218,0 days 00:00:00.727016,squared_error,35,log2,1,2,best,TPESampler,COMPLETE
56,0.46337395013381627,2025-04-24 21:00:56.906078,2025-04-24 21:00:57.775379,0 days 00:00:00.869301,squared_error,35,log2,1,4,best,TPESampler,COMPLETE
57,0.8909138482452268,2025-04-24 21:00:57.193777,2025-04-24 21:00:57.949955,0 days 00:00:00.756178,squared_error,26,sqrt,4,7,best,TPESampler,COMPLETE
58,0.9993409537053991,2025-04-24 21:00:57.365008,2025-04-24 21:00:58.287917,0 days 00:00:00.922909,absolute_error,3,sqrt,8,15,random,TPESampler,COMPLETE
59,0.44670023329729247,2025-04-24 21:00:58.112927,2025-04-24 21:00:58.817878,0 days 00:00:00.704951,squared_error,35,log2,1,7,best,TPESampler,COMPLETE
60,0.6546761103714271,2025-04-24 21:00:58.201589,2025-04-24 21:00:58.995624,0 days 00:00:00.794035,friedman_mse,13,sqrt,1,17,best,TPESampler,COMPLETE
61,0.7975493713728398,2025-04-24 21:00:58.528991,2025-04-24 21:00:59.170511,0 days 00:00:00.641520,squared_error,35,log2,2,2,best,TPESampler,COMPLETE
62,0.5157873063065417,2025-04-24 21:00:59.077851,2025-04-24 21:01:00.011681,0 days 00:00:00.933830,squared_error,34,log2,1,5,best,TPESampler,COMPLETE
63,0.9463249836645335,2025-04-24 21:00:59.240129,2025-04-24 21:01:00.178004,0 days 00:00:00.937875,friedman_mse,1,sqrt,10,2,random,TPESampler,COMPLETE
64,0.7975493713728398,2025-04-24 21:00:59.495018,2025-04-24 21:01:00.346813,0 days 00:00:00.851795,squared_error,35,log2,2,7,best,TPESampler,COMPLETE
65,0.922426147955362,2025-04-24 21:01:00.292577,2025-04-24 21:01:01.069032,0 days 00:00:00.776455,squared_error,20,log2,2,11,random,TPESampler,COMPLETE
66,0.4646442062482263,2025-04-24 21:01:00.405445,2025-04-24 21:01:01.242754,0 days 00:00:00.837309,squared_error,35,log2,1,3,best,TPESampler,COMPLETE
67,0.7121735492441255,2025-04-24 21:01:00.590352,2025-04-24 21:01:01.376227,0 days 00:00:00.785875,squared_error,26,log2,1,6,best,TPESampler,COMPLETE
68,0.44898661991792777,2025-04-24 21:01:01.279159,2025-04-24 21:01:02.081049,0 days 00:00:00.801890,squared_error,34,log2,1,6,best,TPESampler,COMPLETE
69,0.5436620092712224,2025-04-24 21:01:01.455466,2025-04-24 21:01:02.218445,0 days 00:00:00.762979,squared_error,35,log2,1,5,best,TPESampler,COMPLETE
70,0.8196822382300737,2025-04-24 21:01:01.553503,2025-04-24 21:01:02.427322,0 days 00:00:00.873819,squared_error,4,log2,1,6,best,TPESampler,COMPLETE
71,0.9494322793442198,2025-04-24 21:01:02.340146,2025-04-24 21:01:03.006745,0 days 00:00:00.666599,friedman_mse,35,log2,9,2,best,TPESampler,COMPLETE
72,0.4948844885027081,2025-04-24 21:01:02.490006,2025-04-24 21:01:03.367968,0 days 00:00:00.877962,friedman_mse,35,log2,1,9,best,TPESampler,COMPLETE
73,0.45627240934088864,2025-04-24 21:01:02.747108,2025-04-24 21:01:03.521037,0 days 00:00:00.773929,squared_error,34,log2,1,2,best,TPESampler,COMPLETE
74,0.4646442062482263,2025-04-24 21:01:03.282536,2025-04-24 21:01:04.053436,0 days 00:00:00.770900,squared_error,35,log2,1,3,best,TPESampler,COMPLETE
75,0.4517794511521974,2025-04-24 21:01:03.586865,2025-04-24 21:01:04.421799,0 days 00:00:00.834934,squared_error,34,log2,1,4,best,TPESampler,COMPLETE
76,0.9494322793442198,2025-04-24 21:01:03.772827,2025-04-24 21:01:04.595888,0 days 00:00:00.823061,friedman_mse,5,log2,4,2,best,TPESampler,COMPLETE
77,0.922426147955362,2025-04-24 21:01:04.319542,2025-04-24 21:01:05.081736,0 days 00:00:00.762194,squared_error,35,log2,2,11,random,TPESampler,COMPLETE
78,0.9486947174197512,2025-04-24 21:01:04.668825,2025-04-24 21:01:05.490508,0 days 00:00:00.821683,squared_error,1,sqrt,6,3,best,TPESampler,COMPLETE
79,0.5064927807511617,2025-04-24 21:01:04.890198,2025-04-24 21:01:05.835881,0 days 00:00:00.945683,squared_error,34,sqrt,1,2,best,TPESampler,COMPLETE
80,0.44670023329729247,2025-04-24 21:01:05.419197,2025-04-24 21:01:06.244510,0 days 00:00:00.825313,squared_error,35,log2,1,7,best,TPESampler,COMPLETE
81,1.0190535933749674,2025-04-24 21:01:05.777321,2025-04-24 21:01:06.579516,0 days 00:00:00.802195,absolute_error,4,sqrt,3,12,best,TPESampler,COMPLETE
82,0.49441090632956214,2025-04-24 21:01:06.133008,2025-04-24 21:01:07.198744,0 days 00:00:01.065736,squared_error,33,log2,1,11,best,TPESampler,COMPLETE
83,0.6692087088741673,2025-04-24 21:01:06.484623,2025-04-24 21:01:07.675743,0 days 00:00:01.191120,squared_error,30,log2,1,9,best,TPESampler,COMPLETE
84,0.44670023329729247,2025-04-24 21:01:06.942194,2025-04-24 21:01:07.995741,0 days 00:00:01.053547,squared_error,35,log2,1,7,best,TPESampler,COMPLETE
85,1.0007431665713944,2025-04-24 21:01:07.506062,2025-04-24 21:01:08.371225,0 days 00:00:00.865163,absolute_error,12,log2,9,3,random,TPESampler,COMPLETE
86,0.4948844885027081,2025-04-24 21:01:08.057514,2025-04-24 21:01:08.772075,0 days 00:00:00.714561,squared_error,35,log2,1,9,best,TPESampler,COMPLETE
87,0.9993409537053991,2025-04-24 21:01:08.307898,2025-04-24 21:01:09.147708,0 days 00:00:00.839810,absolute_error,31,sqrt,8,12,random,TPESampler,COMPLETE
88,0.8894105515009568,2025-04-24 21:01:08.658444,2025-04-24 21:01:09.337676,0 days 00:00:00.679232,squared_error,14,sqrt,9,9,best,TPESampler,COMPLETE
89,0.9671029066257907,2025-04-24 21:01:09.089269,2025-04-24 21:01:09.721045,0 days 00:00:00.631776,absolute_error,30,log2,2,6,random,TPESampler,COMPLETE
90,0.49345057673125364,2025-04-24 21:01:09.445082,2025-04-24 21:01:10.206205,0 days 00:00:00.761123,squared_error,33,log2,1,7,best,TPESampler,COMPLETE
91,0.9494322793442198,2025-04-24 21:01:09.603089,2025-04-24 21:01:10.433743,0 days 00:00:00.830654,friedman_mse,16,log2,10,7,best,TPESampler,COMPLETE
92,0.654454193048308,2025-04-24 21:01:10.059956,2025-04-24 21:01:10.717731,0 days 00:00:00.657775,absolute_error,35,log2,1,9,best,TPESampler,COMPLETE
93,0.5046293507598797,2025-04-24 21:01:10.444397,2025-04-24 21:01:11.078379,0 days 00:00:00.633982,squared_error,33,log2,1,3,best,TPESampler,COMPLETE
94,0.9494322793442198,2025-04-24 21:01:10.671537,2025-04-24 21:01:11.359723,0 days 00:00:00.688186,squared_error,35,log2,4,7,best,TPESampler,COMPLETE
95,1.0007431665713944,2025-04-24 21:01:10.963250,2025-04-24 21:01:11.702061,0 days 00:00:00.738811,absolute_error,29,log2,10,8,best,TPESampler,COMPLETE
96,0.9494322793442198,2025-04-24 21:01:11.308021,2025-04-24 21:01:12.036972,0 days 00:00:00.728951,friedman_mse,35,log2,10,10,random,TPESampler,COMPLETE
97,0.9494322793442198,2025-04-24 21:01:11.611749,2025-04-24 21:01:12.404080,0 days 00:00:00.792331,friedman_mse,25,log2,6,14,random,TPESampler,COMPLETE
98,0.9494322793442198,2025-04-24 21:01:11.984841,2025-04-24 21:01:12.710967,0 days 00:00:00.726126,squared_error,6,log2,8,9,random,TPESampler,COMPLETE
99,0.45627240934088864,2025-04-24 21:01:12.293811,2025-04-24 21:01:13.055261,0 days 00:00:00.761450,squared_error,34,log2,1,2,best,TPESampler,COMPLETE
100,0.7038708707407538,2025-04-24 21:01:12.623250,2025-04-24 21:01:13.416127,0 days 00:00:00.792877,squared_error,22,log2,1,3,best,TPESampler,COMPLETE
101,0.7975493713728398,2025-04-24 21:01:12.956523,2025-04-24 21:01:13.745189,0 days 00:00:00.788666,squared_error,28,log2,2,2,best,TPESampler,COMPLETE
102,0.5157873063065417,2025-04-24 21:01:13.352203,2025-04-24 21:01:14.063194,0 days 00:00:00.710991,squared_error,34,log2,1,5,best,TPESampler,COMPLETE
103,0.6723712143681343,2025-04-24 21:01:13.639659,2025-04-24 21:01:14.432971,0 days 00:00:00.793312,friedman_mse,29,log2,1,3,best,TPESampler,COMPLETE
104,0.7840016422444951,2025-04-24 21:01:13.966434,2025-04-24 21:01:14.770809,0 days 00:00:00.804375,absolute_error,29,log2,2,2,best,TPESampler,COMPLETE
105,0.4778216987320454,2025-04-24 21:01:14.325113,2025-04-24 21:01:15.477261,0 days 00:00:01.152148,squared_error,33,log2,1,2,best,TPESampler,COMPLETE
106,1.0169646864906652,2025-04-24 21:01:14.691951,2025-04-24 21:01:15.776842,0 days 00:00:01.084891,absolute_error,11,sqrt,7,3,best,TPESampler,COMPLETE
107,0.7975493713728398,2025-04-24 21:01:15.110597,2025-04-24 21:01:16.042955,0 days 00:00:00.932358,squared_error,35,log2,2,2,best,TPESampler,COMPLETE
108,0.9671029066257907,2025-04-24 21:01:15.811498,2025-04-24 21:01:16.540504,0 days 00:00:00.729006,absolute_error,7,log2,3,18,random,TPESampler,COMPLETE
109,0.9182173105176079,2025-04-24 21:01:16.040617,2025-04-24 21:01:16.899363,0 days 00:00:00.858746,friedman_mse,35,log2,1,2,random,TPESampler,COMPLETE
110,0.4605209589836094,2025-04-24 21:01:16.297261,2025-04-24 21:01:17.209903,0 days 00:00:00.912642,squared_error,35,log2,1,2,best,TPESampler,COMPLETE
111,0.48051683833886516,2025-04-24 21:01:16.790624,2025-04-24 21:01:17.401866,0 days 00:00:00.611242,squared_error,35,log2,1,8,best,TPESampler,COMPLETE
112,0.5093621405173775,2025-04-24 21:01:17.154615,2025-04-24 21:01:17.792887,0 days 00:00:00.638272,squared_error,32,log2,1,3,best,TPESampler,COMPLETE
113,0.9494322793442198,2025-04-24 21:01:17.464134,2025-04-24 21:01:18.317920,0 days 00:00:00.853786,squared_error,35,log2,7,17,best,TPESampler,COMPLETE
114,0.45627240934088864,2025-04-24 21:01:17.665302,2025-04-24 21:01:18.377933,0 days 00:00:00.712631,squared_error,34,log2,1,2,best,TPESampler,COMPLETE
115,0.8894105515009568,2025-04-24 21:01:18.116117,2025-04-24 21:01:19.228878,0 days 00:00:01.112761,friedman_mse,22,sqrt,9,20,best,TPESampler,COMPLETE
116,0.4605209589836094,2025-04-24 21:01:18.580710,2025-04-24 21:01:19.452262,0 days 00:00:00.871552,squared_error,35,log2,1,2,best,TPESampler,COMPLETE
117,0.4881349703848251,2025-04-24 21:01:18.648346,2025-04-24 21:01:19.548119,0 days 00:00:00.899773,squared_error,34,log2,1,3,best,TPESampler,COMPLETE
118,0.4646442062482263,2025-04-24 21:01:19.477762,2025-04-24 21:01:20.372739,0 days 00:00:00.894977,squared_error,35,log2,1,3,best,TPESampler,COMPLETE
119,0.4605209589836094,2025-04-24 21:01:19.663023,2025-04-24 21:01:20.629442,0 days 00:00:00.966419,squared_error,35,log2,1,2,best,TPESampler,COMPLETE
120,0.922426147955362,2025-04-24 21:01:19.826720,2025-04-24 21:01:20.662624,0 days 00:00:00.835904,squared_error,35,log2,4,5,random,TPESampler,COMPLETE
121,0.4646442062482263,2025-04-24 21:01:20.624435,2025-04-24 21:01:21.233609,0 days 00:00:00.609174,squared_error,35,log2,1,3,best,TPESampler,COMPLETE
122,0.9494322793442198,2025-04-24 21:01:20.852092,2025-04-24 21:01:21.649641,0 days 00:00:00.797549,squared_error,14,log2,7,5,best,TPESampler,COMPLETE
123,0.922426147955362,2025-04-24 21:01:21.033881,2025-04-24 21:01:21.884843,0 days 00:00:00.850962,friedman_mse,2,log2,5,16,random,TPESampler,COMPLETE
124,0.9494322793442198,2025-04-24 21:01:21.522763,2025-04-24 21:01:22.235205,0 days 00:00:00.712442,squared_error,5,log2,4,13,best,TPESampler,COMPLETE
125,1.0234382327956146,2025-04-24 21:01:21.941038,2025-04-24 21:01:22.736184,0 days 00:00:00.795146,absolute_error,4,sqrt,10,18,best,TPESampler,COMPLETE
126,0.9494322793442198,2025-04-24 21:01:22.122091,2025-04-24 21:01:22.832595,0 days 00:00:00.710504,squared_error,35,log2,4,2,best,TPESampler,COMPLETE
127,0.7975493713728398,2025-04-24 21:01:22.643856,2025-04-24 21:01:23.616043,0 days 00:00:00.972187,squared_error,30,log2,2,2,best,TPESampler,COMPLETE
128,0.9638042122577196,2025-04-24 21:01:22.944101,2025-04-24 21:01:23.820968,0 days 00:00:00.876867,absolute_error,18,sqrt,3,11,random,TPESampler,COMPLETE
129,1.0007431665713944,2025-04-24 21:01:23.101442,2025-04-24 21:01:23.943767,0 days 00:00:00.842325,absolute_error,2,log2,8,14,best,TPESampler,COMPLETE
130,0.9347481389709953,2025-04-24 21:01:23.877525,2025-04-24 21:01:24.500744,0 days 00:00:00.623219,friedman_mse,14,sqrt,6,9,random,TPESampler,COMPLETE
131,0.9201355635266542,2025-04-24 21:01:24.078460,2025-04-24 21:01:24.815822,0 days 00:00:00.737362,squared_error,35,log2,1,4,random,TPESampler,COMPLETE
132,0.6979596766643811,2025-04-24 21:01:24.279396,2025-04-24 21:01:25.016601,0 days 00:00:00.737205,squared_error,28,log2,1,5,best,TPESampler,COMPLETE
133,0.4857647657734063,2025-04-24 21:01:24.760761,2025-04-24 21:01:25.613176,0 days 00:00:00.852415,squared_error,32,log2,1,2,best,TPESampler,COMPLETE
134,0.7975493713728398,2025-04-24 21:01:25.097279,2025-04-24 21:01:26.156642,0 days 00:00:01.059363,squared_error,35,log2,2,4,best,TPESampler,COMPLETE
135,0.458106663082747,2025-04-24 21:01:25.321050,2025-04-24 21:01:26.153779,0 days 00:00:00.832729,squared_error,35,log2,1,6,best,TPESampler,COMPLETE
136,0.8894105515009568,2025-04-24 21:01:25.901877,2025-04-24 21:01:26.559144,0 days 00:00:00.657267,friedman_mse,25,sqrt,9,5,best,TPESampler,COMPLETE
137,0.6775674127828398,2025-04-24 21:01:26.434264,2025-04-24 21:01:27.294778,0 days 00:00:00.860514,squared_error,31,log2,1,7,best,TPESampler,COMPLETE
138,0.7975493713728398,2025-04-24 21:01:26.490294,2025-04-24 21:01:27.545106,0 days 00:00:01.054812,squared_error,30,log2,3,7,best,TPESampler,COMPLETE
139,0.6676849480746322,2025-04-24 21:01:26.788443,2025-04-24 21:01:27.646875,0 days 00:00:00.858432,absolute_error,35,log2,1,2,best,TPESampler,COMPLETE
140,0.4646442062482263,2025-04-24 21:01:27.604897,2025-04-24 21:01:28.232081,0 days 00:00:00.627184,squared_error,35,log2,1,3,best,TPESampler,COMPLETE
141,0.7975493713728398,2025-04-24 21:01:27.774401,2025-04-24 21:01:28.681083,0 days 00:00:00.906682,squared_error,35,log2,2,6,best,TPESampler,COMPLETE
142,0.44670023329729247,2025-04-24 21:01:27.823895,2025-04-24 21:01:28.810947,0 days 00:00:00.987052,squared_error,35,log2,1,7,best,TPESampler,COMPLETE
