number,value,datetime_start,datetime_complete,duration,params_criterion,params_max_depth,params_max_features,params_min_samples_leaf,params_min_samples_split,params_splitter,system_attrs_auto:sampler,state
2147,0.5522341372198587,2025-04-24 21:14:38.119452,2025-04-24 21:14:39.172465,0 days 00:00:01.053013,friedman_mse,35,sqrt,1,6,best,TPESampler,COMPLETE
2148,0.7196483853662857,2025-04-24 21:14:38.217527,2025-04-24 21:14:39.389662,0 days 00:00:01.172135,friedman_mse,30,sqrt,3,7,best,TPESampler,COMPLETE
2149,0.7081393260540442,2025-04-24 21:14:38.560007,2025-04-24 21:14:39.534842,0 days 00:00:00.974835,friedman_mse,28,sqrt,3,9,best,TPESampler,COMPLETE
2150,0.7113263276640378,2025-04-24 21:14:39.461375,2025-04-24 21:14:40.274366,0 days 00:00:00.812991,friedman_mse,35,sqrt,3,7,best,TPESampler,COMPLETE
2151,0.610300375570967,2025-04-24 21:14:39.676254,2025-04-24 21:14:40.910429,0 days 00:00:01.234175,friedman_mse,35,sqrt,1,5,best,TPESampler,COMPLETE
2152,0.6581282397926295,2025-04-24 21:14:39.848464,2025-04-24 21:14:40.945854,0 days 00:00:01.097390,friedman_mse,30,sqrt,2,6,best,TPESampler,COMPLETE
2153,0.675982364902162,2025-04-24 21:14:40.618011,2025-04-24 21:14:41.776567,0 days 00:00:01.158556,friedman_mse,35,sqrt,2,6,best,TPESampler,COMPLETE
2154,0.7246712212327447,2025-04-24 21:14:41.131028,2025-04-24 21:14:42.023096,0 days 00:00:00.892068,friedman_mse,35,sqrt,3,5,best,TPESampler,COMPLETE
2155,0.5981875505937236,2025-04-24 21:14:41.193456,2025-04-24 21:14:42.328364,0 days 00:00:01.134908,friedman_mse,35,sqrt,1,7,best,TPESampler,COMPLETE
2156,0.610300375570967,2025-04-24 21:14:42.057422,2025-04-24 21:14:42.994848,0 days 00:00:00.937426,friedman_mse,35,sqrt,1,5,best,TPESampler,COMPLETE
2157,0.6123183697228924,2025-04-24 21:14:42.412999,2025-04-24 21:14:43.539604,0 days 00:00:01.126605,friedman_mse,30,sqrt,1,6,best,TPESampler,COMPLETE
2158,0.5522341372198587,2025-04-24 21:14:42.619034,2025-04-24 21:14:43.693055,0 days 00:00:01.074021,friedman_mse,35,sqrt,1,6,best,TPESampler,COMPLETE
2159,0.6794094981777127,2025-04-24 21:14:43.290774,2025-04-24 21:14:44.018114,0 days 00:00:00.727340,friedman_mse,29,sqrt,3,4,best,TPESampler,COMPLETE
2160,0.632199359486392,2025-04-24 21:14:43.797982,2025-04-24 21:14:44.688680,0 days 00:00:00.890698,friedman_mse,30,sqrt,1,9,best,TPESampler,COMPLETE
2161,0.6539311476955247,2025-04-24 21:14:43.974596,2025-04-24 21:14:44.931932,0 days 00:00:00.957336,friedman_mse,30,sqrt,1,4,best,TPESampler,COMPLETE
2162,0.7106696395891989,2025-04-24 21:14:44.351498,2025-04-24 21:14:45.197067,0 days 00:00:00.845569,friedman_mse,35,sqrt,3,9,best,TPESampler,COMPLETE
2163,0.6015012618996902,2025-04-24 21:14:44.938396,2025-04-24 21:14:45.671399,0 days 00:00:00.733003,friedman_mse,30,sqrt,1,8,best,TPESampler,COMPLETE
2164,0.7246712212327447,2025-04-24 21:14:45.341143,2025-04-24 21:14:46.371649,0 days 00:00:01.030506,friedman_mse,35,sqrt,3,3,best,TPESampler,COMPLETE
2165,0.5925119263261721,2025-04-24 21:14:45.502776,2025-04-24 21:14:46.497567,0 days 00:00:00.994791,friedman_mse,35,sqrt,1,3,best,TPESampler,COMPLETE
2166,0.5925119263261721,2025-04-24 21:14:45.970241,2025-04-24 21:14:46.682403,0 days 00:00:00.712162,friedman_mse,35,sqrt,1,3,best,TPESampler,COMPLETE
2167,0.5981875505937236,2025-04-24 21:14:46.638081,2025-04-24 21:14:47.290578,0 days 00:00:00.652497,friedman_mse,35,sqrt,1,7,best,TPESampler,COMPLETE
2168,0.7053046058871686,2025-04-24 21:14:46.996110,2025-04-24 21:14:47.963198,0 days 00:00:00.967088,friedman_mse,30,sqrt,3,10,best,TPESampler,COMPLETE
2169,0.6082164367053395,2025-04-24 21:14:47.038769,2025-04-24 21:14:48.060600,0 days 00:00:01.021831,squared_error,34,sqrt,2,5,best,TPESampler,COMPLETE
2170,0.5814870567678823,2025-04-24 21:14:47.771026,2025-04-24 21:14:48.677954,0 days 00:00:00.906928,friedman_mse,24,sqrt,1,6,best,TPESampler,COMPLETE
2171,0.5981875505937236,2025-04-24 21:14:48.186655,2025-04-24 21:14:49.258645,0 days 00:00:01.071990,friedman_mse,35,sqrt,1,7,best,TPESampler,COMPLETE
2172,0.5522341372198587,2025-04-24 21:14:48.318352,2025-04-24 21:14:49.271013,0 days 00:00:00.952661,friedman_mse,35,sqrt,1,6,best,TPESampler,COMPLETE
2173,0.602796038059482,2025-04-24 21:14:48.990936,2025-04-24 21:14:49.775238,0 days 00:00:00.784302,absolute_error,35,sqrt,3,6,best,TPESampler,COMPLETE
2174,0.7246712212327447,2025-04-24 21:14:49.504737,2025-04-24 21:14:50.358627,0 days 00:00:00.853890,friedman_mse,35,sqrt,3,6,best,TPESampler,COMPLETE
2175,0.6468159413546908,2025-04-24 21:14:49.555138,2025-04-24 21:14:50.633468,0 days 00:00:01.078330,friedman_mse,30,sqrt,2,4,best,TPESampler,COMPLETE
2176,0.5986673267910899,2025-04-24 21:14:50.095063,2025-04-24 21:14:51.215870,0 days 00:00:01.120807,friedman_mse,30,sqrt,1,5,best,TPESampler,COMPLETE
2177,0.5981875505937236,2025-04-24 21:14:50.721156,2025-04-24 21:14:51.904167,0 days 00:00:01.183011,friedman_mse,35,sqrt,1,7,best,TPESampler,COMPLETE
2178,0.610300375570967,2025-04-24 21:14:51.076294,2025-04-24 21:14:52.095918,0 days 00:00:01.019624,friedman_mse,35,sqrt,1,5,best,TPESampler,COMPLETE
2179,0.6689822961370628,2025-04-24 21:14:51.560440,2025-04-24 21:14:52.403615,0 days 00:00:00.843175,friedman_mse,30,sqrt,2,7,best,TPESampler,COMPLETE
2180,0.6123183697228924,2025-04-24 21:14:52.321707,2025-04-24 21:14:53.279407,0 days 00:00:00.957700,friedman_mse,30,sqrt,1,6,best,TPESampler,COMPLETE
2181,0.7406517311742006,2025-04-24 21:14:52.172152,2025-04-24 21:14:53.612864,0 days 00:00:01.440712,friedman_mse,30,sqrt,3,4,best,TPESampler,COMPLETE
2182,0.7113263276640378,2025-04-24 21:14:52.700885,2025-04-24 21:14:53.748841,0 days 00:00:01.047956,friedman_mse,35,sqrt,3,7,best,TPESampler,COMPLETE
2183,0.6595065143489847,2025-04-24 21:14:53.544105,2025-04-24 21:14:54.343930,0 days 00:00:00.799825,friedman_mse,35,sqrt,2,10,best,TPESampler,COMPLETE
2184,0.6307166641615489,2025-04-24 21:14:53.864484,2025-04-24 21:14:54.798800,0 days 00:00:00.934316,friedman_mse,30,sqrt,1,3,best,TPESampler,COMPLETE
2185,0.6948300332203996,2025-04-24 21:14:54.040280,2025-04-24 21:14:55.235224,0 days 00:00:01.194944,friedman_mse,21,sqrt,3,5,best,TPESampler,COMPLETE
2186,0.632199359486392,2025-04-24 21:14:54.719082,2025-04-24 21:14:55.689128,0 days 00:00:00.970046,friedman_mse,30,sqrt,1,9,best,TPESampler,COMPLETE
2187,0.5978929531338989,2025-04-24 21:14:55.111209,2025-04-24 21:14:55.956827,0 days 00:00:00.845618,friedman_mse,35,sqrt,1,10,best,TPESampler,COMPLETE
2188,0.7246712212327447,2025-04-24 21:14:55.614154,2025-04-24 21:14:56.819986,0 days 00:00:01.205832,friedman_mse,35,sqrt,3,3,best,TPESampler,COMPLETE
2189,0.5912055792002768,2025-04-24 21:14:56.081822,2025-04-24 21:14:57.153173,0 days 00:00:01.071351,absolute_error,31,sqrt,1,6,best,TPESampler,COMPLETE
2190,0.9928365741172522,2025-04-24 21:14:56.257171,2025-04-24 21:14:57.541220,0 days 00:00:01.284049,squared_error,23,log2,10,7,best,TPESampler,COMPLETE
2191,0.5981875505937236,2025-04-24 21:14:57.092932,2025-04-24 21:14:58.031947,0 days 00:00:00.939015,friedman_mse,35,sqrt,1,7,best,TPESampler,COMPLETE
2192,0.6581282397926295,2025-04-24 21:14:57.661226,2025-04-24 21:14:58.653134,0 days 00:00:00.991908,friedman_mse,30,sqrt,2,6,best,TPESampler,COMPLETE
2193,0.7246712212327447,2025-04-24 21:14:57.840949,2025-04-24 21:14:58.844422,0 days 00:00:01.003473,friedman_mse,35,sqrt,3,4,best,TPESampler,COMPLETE
2194,0.6248248219525877,2025-04-24 21:14:58.427089,2025-04-24 21:14:59.216505,0 days 00:00:00.789416,friedman_mse,35,sqrt,1,4,best,TPESampler,COMPLETE
2195,0.5981875505937236,2025-04-24 21:14:59.111891,2025-04-24 21:15:00.019695,0 days 00:00:00.907804,friedman_mse,35,sqrt,1,7,best,TPESampler,COMPLETE
2196,0.5522341372198587,2025-04-24 21:14:59.169107,2025-04-24 21:15:00.564336,0 days 00:00:01.395229,friedman_mse,35,sqrt,1,6,best,TPESampler,COMPLETE
2197,0.5981875505937236,2025-04-24 21:14:59.507788,2025-04-24 21:15:00.368128,0 days 00:00:00.860340,friedman_mse,35,sqrt,1,7,best,TPESampler,COMPLETE
2198,0.6539311476955247,2025-04-24 21:15:00.325641,2025-04-24 21:15:01.021428,0 days 00:00:00.695787,friedman_mse,30,sqrt,1,4,best,TPESampler,COMPLETE
2199,0.6123183697228924,2025-04-24 21:15:00.705523,2025-04-24 21:15:01.860068,0 days 00:00:01.154545,friedman_mse,30,sqrt,1,6,best,TPESampler,COMPLETE
2200,0.5990037672372435,2025-04-24 21:15:00.859711,2025-04-24 21:15:02.037356,0 days 00:00:01.177645,friedman_mse,30,sqrt,1,7,best,TPESampler,COMPLETE
2201,0.9737936641952643,2025-04-24 21:15:01.461323,2025-04-24 21:15:02.367864,0 days 00:00:00.906541,squared_error,33,sqrt,9,7,random,TPESampler,COMPLETE
2202,0.7106696395891989,2025-04-24 21:15:02.270648,2025-04-24 21:15:03.268410,0 days 00:00:00.997762,friedman_mse,35,sqrt,3,9,best,TPESampler,COMPLETE
2203,0.6568175016976607,2025-04-24 21:15:02.327335,2025-04-24 21:15:03.511840,0 days 00:00:01.184505,friedman_mse,35,sqrt,2,4,best,TPESampler,COMPLETE
2204,0.610300375570967,2025-04-24 21:15:02.657182,2025-04-24 21:15:03.804257,0 days 00:00:01.147075,friedman_mse,35,sqrt,1,5,best,TPESampler,COMPLETE
2205,0.6451831437449033,2025-04-24 21:15:03.562414,2025-04-24 21:15:04.467444,0 days 00:00:00.905030,friedman_mse,29,sqrt,1,8,best,TPESampler,COMPLETE
2206,0.6158166985156879,2025-04-24 21:15:03.843560,2025-04-24 21:15:04.782976,0 days 00:00:00.939416,friedman_mse,35,sqrt,1,9,best,TPESampler,COMPLETE
2207,0.7246712212327447,2025-04-24 21:15:04.106445,2025-04-24 21:15:04.925946,0 days 00:00:00.819501,friedman_mse,35,sqrt,3,6,best,TPESampler,COMPLETE
2208,0.6248248219525877,2025-04-24 21:15:04.732468,2025-04-24 21:15:05.556623,0 days 00:00:00.824155,friedman_mse,35,sqrt,1,4,best,TPESampler,COMPLETE
2209,0.7053046058871686,2025-04-24 21:15:05.030133,2025-04-24 21:15:06.038903,0 days 00:00:01.008770,friedman_mse,30,sqrt,3,10,best,TPESampler,COMPLETE
2210,0.6446227396865948,2025-04-24 21:15:05.171159,2025-04-24 21:15:06.492345,0 days 00:00:01.321186,friedman_mse,29,sqrt,1,6,best,TPESampler,COMPLETE
2211,0.9968066590016214,2025-04-24 21:15:05.915416,2025-04-24 21:15:07.097001,0 days 00:00:01.181585,squared_error,22,log2,10,9,random,TPESampler,COMPLETE
2212,0.6794094981777127,2025-04-24 21:15:06.632616,2025-04-24 21:15:07.730610,0 days 00:00:01.097994,friedman_mse,29,sqrt,3,6,best,TPESampler,COMPLETE
2213,0.6011863667970774,2025-04-24 21:15:06.879689,2025-04-24 21:15:07.818214,0 days 00:00:00.938525,friedman_mse,35,sqrt,1,11,best,TPESampler,COMPLETE
2214,0.6293599461146093,2025-04-24 21:15:07.487434,2025-04-24 21:15:08.240323,0 days 00:00:00.752889,friedman_mse,29,sqrt,2,2,best,TPESampler,COMPLETE
2215,0.6766465369414466,2025-04-24 21:15:07.983772,2025-04-24 21:15:08.981667,0 days 00:00:00.997895,absolute_error,21,sqrt,1,6,best,TPESampler,COMPLETE
2216,0.6551631182803123,2025-04-24 21:15:08.207389,2025-04-24 21:15:09.178424,0 days 00:00:00.971035,friedman_mse,35,sqrt,2,7,best,TPESampler,COMPLETE
2217,0.9962502283466568,2025-04-24 21:15:08.567713,2025-04-24 21:15:10.003731,0 days 00:00:01.436018,squared_error,10,log2,8,6,random,TPESampler,COMPLETE
2218,0.610300375570967,2025-04-24 21:15:09.352566,2025-04-24 21:15:10.535347,0 days 00:00:01.182781,friedman_mse,35,sqrt,1,5,best,TPESampler,COMPLETE
2219,0.6446227396865948,2025-04-24 21:15:09.397814,2025-04-24 21:15:10.362568,0 days 00:00:00.964754,friedman_mse,29,sqrt,1,6,best,TPESampler,COMPLETE
2220,0.6539311476955247,2025-04-24 21:15:10.303075,2025-04-24 21:15:11.086096,0 days 00:00:00.783021,friedman_mse,30,sqrt,1,4,best,TPESampler,COMPLETE
2221,0.5925656078110476,2025-04-24 21:15:10.619338,2025-04-24 21:15:11.644261,0 days 00:00:01.024923,squared_error,31,sqrt,1,5,best,TPESampler,COMPLETE
2222,0.6158166985156879,2025-04-24 21:15:10.757822,2025-04-24 21:15:11.791963,0 days 00:00:01.034141,friedman_mse,35,sqrt,1,9,best,TPESampler,COMPLETE
2223,0.632199359486392,2025-04-24 21:15:11.405751,2025-04-24 21:15:12.148474,0 days 00:00:00.742723,friedman_mse,30,sqrt,1,9,best,TPESampler,COMPLETE
2224,0.610300375570967,2025-04-24 21:15:12.034072,2025-04-24 21:15:13.085390,0 days 00:00:01.051318,friedman_mse,35,sqrt,1,5,best,TPESampler,COMPLETE
2225,0.610300375570967,2025-04-24 21:15:12.102485,2025-04-24 21:15:13.173687,0 days 00:00:01.071202,friedman_mse,35,sqrt,1,5,best,TPESampler,COMPLETE
2226,0.9962502283466568,2025-04-24 21:15:12.702646,2025-04-24 21:15:13.510818,0 days 00:00:00.808172,friedman_mse,2,log2,7,5,random,TPESampler,COMPLETE
2227,0.7113263276640378,2025-04-24 21:15:13.391201,2025-04-24 21:15:14.468810,0 days 00:00:01.077609,friedman_mse,35,sqrt,3,7,best,TPESampler,COMPLETE
2228,0.6551631182803123,2025-04-24 21:15:13.473345,2025-04-24 21:15:14.745766,0 days 00:00:01.272421,friedman_mse,35,sqrt,2,7,best,TPESampler,COMPLETE
2229,0.7246712212327447,2025-04-24 21:15:13.784521,2025-04-24 21:15:14.751319,0 days 00:00:00.966798,friedman_mse,35,sqrt,3,5,best,TPESampler,COMPLETE
2230,0.6248248219525877,2025-04-24 21:15:14.710385,2025-04-24 21:15:15.490439,0 days 00:00:00.780054,friedman_mse,35,sqrt,1,4,best,TPESampler,COMPLETE
2231,0.6446227396865948,2025-04-24 21:15:15.048548,2025-04-24 21:15:16.108143,0 days 00:00:01.059595,friedman_mse,29,sqrt,1,6,best,TPESampler,COMPLETE
2232,0.5706235589210358,2025-04-24 21:15:15.124226,2025-04-24 21:15:16.247072,0 days 00:00:01.122846,absolute_error,34,sqrt,1,7,best,TPESampler,COMPLETE
2233,0.5990037672372435,2025-04-24 21:15:15.806380,2025-04-24 21:15:16.561849,0 days 00:00:00.755469,friedman_mse,30,sqrt,1,7,best,TPESampler,COMPLETE
2234,0.964903983025146,2025-04-24 21:15:16.473733,2025-04-24 21:15:17.497940,0 days 00:00:01.024207,absolute_error,11,log2,5,10,best,TPESampler,COMPLETE
2235,0.9545020982502701,2025-04-24 21:15:16.519557,2025-04-24 21:15:17.663563,0 days 00:00:01.144006,friedman_mse,30,log2,3,7,best,TPESampler,COMPLETE
2236,0.5522341372198587,2025-04-24 21:15:16.830951,2025-04-24 21:15:18.104547,0 days 00:00:01.273596,friedman_mse,35,sqrt,1,6,best,TPESampler,COMPLETE
2237,0.5522341372198587,2025-04-24 21:15:17.739554,2025-04-24 21:15:18.839273,0 days 00:00:01.099719,friedman_mse,35,sqrt,1,6,best,TPESampler,COMPLETE
2238,0.6581282397926295,2025-04-24 21:15:17.889144,2025-04-24 21:15:18.868721,0 days 00:00:00.979577,friedman_mse,30,sqrt,2,6,best,TPESampler,COMPLETE
2239,0.6158166985156879,2025-04-24 21:15:18.644164,2025-04-24 21:15:20.364828,0 days 00:00:01.720664,friedman_mse,35,sqrt,1,9,best,TPESampler,COMPLETE
2240,0.7406517311742006,2025-04-24 21:15:19.029292,2025-04-24 21:15:20.036244,0 days 00:00:01.006952,friedman_mse,30,sqrt,3,6,best,TPESampler,COMPLETE
2241,0.7092445813596325,2025-04-24 21:15:19.162476,2025-04-24 21:15:20.212724,0 days 00:00:01.050248,friedman_mse,35,log2,2,2,best,TPESampler,COMPLETE
2242,0.6539311476955247,2025-04-24 21:15:20.282453,2025-04-24 21:15:21.007581,0 days 00:00:00.725128,friedman_mse,30,sqrt,1,4,best,TPESampler,COMPLETE
2243,0.6906100213968112,2025-04-24 21:15:20.503667,2025-04-24 21:15:21.584832,0 days 00:00:01.081165,friedman_mse,35,log2,1,7,best,TPESampler,COMPLETE
2244,0.5981875505937236,2025-04-24 21:15:20.646324,2025-04-24 21:15:21.672074,0 days 00:00:01.025750,friedman_mse,35,sqrt,1,7,best,TPESampler,COMPLETE
2245,0.614576214514942,2025-04-24 21:15:21.319299,2025-04-24 21:15:22.088641,0 days 00:00:00.769342,absolute_error,35,sqrt,1,6,best,TPESampler,COMPLETE
2246,0.610300375570967,2025-04-24 21:15:21.798674,2025-04-24 21:15:22.918629,0 days 00:00:01.119955,squared_error,35,sqrt,1,5,best,TPESampler,COMPLETE
2247,0.6626098337689691,2025-04-24 21:15:21.862555,2025-04-24 21:15:22.944085,0 days 00:00:01.081530,friedman_mse,23,sqrt,1,5,best,TPESampler,COMPLETE
2248,0.6568175016976607,2025-04-24 21:15:22.643789,2025-04-24 21:15:23.493240,0 days 00:00:00.849451,friedman_mse,35,sqrt,2,2,best,TPESampler,COMPLETE
2249,0.6248248219525877,2025-04-24 21:15:23.135048,2025-04-24 21:15:24.276550,0 days 00:00:01.141502,friedman_mse,35,sqrt,1,4,best,TPESampler,COMPLETE
2250,0.6015012618996902,2025-04-24 21:15:23.186860,2025-04-24 21:15:24.281913,0 days 00:00:01.095053,friedman_mse,30,sqrt,1,8,best,TPESampler,COMPLETE
2251,0.6248248219525877,2025-04-24 21:15:23.847261,2025-04-24 21:15:24.678173,0 days 00:00:00.830912,friedman_mse,35,sqrt,1,4,best,TPESampler,COMPLETE
2252,0.7055944843631554,2025-04-24 21:15:24.585813,2025-04-24 21:15:25.498846,0 days 00:00:00.913033,absolute_error,20,sqrt,2,20,best,TPESampler,COMPLETE
2253,0.9554917281394487,2025-04-24 21:15:24.638917,2025-04-24 21:15:25.781525,0 days 00:00:01.142608,squared_error,5,sqrt,5,17,best,TPESampler,COMPLETE
2254,0.6327006073621034,2025-04-24 21:15:24.959465,2025-04-24 21:15:26.242582,0 days 00:00:01.283117,friedman_mse,35,sqrt,1,8,best,TPESampler,COMPLETE
2255,0.709416214903288,2025-04-24 21:15:25.831770,2025-04-24 21:15:27.007971,0 days 00:00:01.176201,friedman_mse,31,sqrt,3,8,best,TPESampler,COMPLETE
2256,0.9737936641952643,2025-04-24 21:15:26.075736,2025-04-24 21:15:27.246020,0 days 00:00:01.170284,squared_error,27,sqrt,10,17,random,TPESampler,COMPLETE
2257,0.5990037672372435,2025-04-24 21:15:26.576171,2025-04-24 21:15:27.630922,0 days 00:00:01.054751,friedman_mse,30,sqrt,1,7,best,TPESampler,COMPLETE
2258,0.8025318233554969,2025-04-24 21:15:27.294628,2025-04-24 21:15:28.309951,0 days 00:00:01.015323,friedman_mse,34,sqrt,9,13,best,TPESampler,COMPLETE
2259,0.7113263276640378,2025-04-24 21:15:27.525296,2025-04-24 21:15:28.503626,0 days 00:00:00.978330,friedman_mse,35,sqrt,3,7,best,TPESampler,COMPLETE
2260,0.9737936641952643,2025-04-24 21:15:27.920483,2025-04-24 21:15:28.882182,0 days 00:00:00.961699,friedman_mse,17,sqrt,10,9,random,TPESampler,COMPLETE
2261,0.7406517311742006,2025-04-24 21:15:28.611869,2025-04-24 21:15:29.604097,0 days 00:00:00.992228,friedman_mse,30,sqrt,3,5,best,TPESampler,COMPLETE
2262,0.7246712212327447,2025-04-24 21:15:28.815854,2025-04-24 21:15:29.825555,0 days 00:00:01.009701,friedman_mse,35,sqrt,3,5,best,TPESampler,COMPLETE
2263,0.9928365741172522,2025-04-24 21:15:29.273026,2025-04-24 21:15:30.230305,0 days 00:00:00.957279,friedman_mse,5,log2,10,10,best,TPESampler,COMPLETE
2264,0.5522341372198587,2025-04-24 21:15:29.906406,2025-04-24 21:15:30.870871,0 days 00:00:00.964465,friedman_mse,35,sqrt,1,6,best,TPESampler,COMPLETE
2265,0.7222608388817914,2025-04-24 21:15:30.027938,2025-04-24 21:15:31.118649,0 days 00:00:01.090711,friedman_mse,28,sqrt,3,20,random,TPESampler,COMPLETE
2266,0.6158166985156879,2025-04-24 21:15:30.525971,2025-04-24 21:15:31.523673,0 days 00:00:00.997702,friedman_mse,35,sqrt,1,9,best,TPESampler,COMPLETE
2267,0.6152703424484823,2025-04-24 21:15:31.169569,2025-04-24 21:15:32.212758,0 days 00:00:01.043189,friedman_mse,30,sqrt,2,5,best,TPESampler,COMPLETE
2268,0.6293599461146093,2025-04-24 21:15:31.386895,2025-04-24 21:15:32.371669,0 days 00:00:00.984774,friedman_mse,29,sqrt,2,3,best,TPESampler,COMPLETE
2269,0.922340079460055,2025-04-24 21:15:31.844187,2025-04-24 21:15:32.687215,0 days 00:00:00.843028,absolute_error,23,log2,3,18,best,TPESampler,COMPLETE
2270,0.6361895113592757,2025-04-24 21:15:32.548287,2025-04-24 21:15:33.511403,0 days 00:00:00.963116,friedman_mse,29,sqrt,1,4,best,TPESampler,COMPLETE
2271,0.5522341372198587,2025-04-24 21:15:32.618012,2025-04-24 21:15:33.828329,0 days 00:00:01.210317,friedman_mse,35,sqrt,1,6,best,TPESampler,COMPLETE
2272,0.9368976210873065,2025-04-24 21:15:33.061174,2025-04-24 21:15:34.140554,0 days 00:00:01.079380,friedman_mse,35,log2,3,9,best,TPESampler,COMPLETE
2273,0.5925119263261721,2025-04-24 21:15:34.037843,2025-04-24 21:15:35.021052,0 days 00:00:00.983209,friedman_mse,35,sqrt,1,3,best,TPESampler,COMPLETE
2274,0.6650856195703805,2025-04-24 21:15:34.099898,2025-04-24 21:15:35.067220,0 days 00:00:00.967322,friedman_mse,30,sqrt,2,9,best,TPESampler,COMPLETE
2275,0.6245248678738824,2025-04-24 21:15:34.562831,2025-04-24 21:15:35.382294,0 days 00:00:00.819463,friedman_mse,30,sqrt,2,10,best,TPESampler,COMPLETE
2276,0.7246712212327447,2025-04-24 21:15:35.342146,2025-04-24 21:15:36.506037,0 days 00:00:01.163891,friedman_mse,35,sqrt,3,5,best,TPESampler,COMPLETE
2277,0.7258703503262229,2025-04-24 21:15:35.385074,2025-04-24 21:15:36.554800,0 days 00:00:01.169726,friedman_mse,35,sqrt,3,8,best,TPESampler,COMPLETE
2278,0.5981875505937236,2025-04-24 21:15:35.670872,2025-04-24 21:15:36.823769,0 days 00:00:01.152897,friedman_mse,35,sqrt,1,7,best,TPESampler,COMPLETE
2279,0.6123183697228924,2025-04-24 21:15:36.777393,2025-04-24 21:15:38.013398,0 days 00:00:01.236005,friedman_mse,30,sqrt,1,6,best,TPESampler,COMPLETE
2280,0.5986673267910899,2025-04-24 21:15:36.821537,2025-04-24 21:15:38.091511,0 days 00:00:01.269974,friedman_mse,30,sqrt,1,5,best,TPESampler,COMPLETE
2281,0.6689822961370628,2025-04-24 21:15:37.168907,2025-04-24 21:15:38.224849,0 days 00:00:01.055942,friedman_mse,30,sqrt,2,7,best,TPESampler,COMPLETE
2282,0.6595065143489847,2025-04-24 21:15:38.269110,2025-04-24 21:15:39.293372,0 days 00:00:01.024262,friedman_mse,35,sqrt,2,10,best,TPESampler,COMPLETE
2283,0.610300375570967,2025-04-24 21:15:38.320404,2025-04-24 21:15:39.492789,0 days 00:00:01.172385,friedman_mse,35,sqrt,1,5,best,TPESampler,COMPLETE
2284,0.6082164367053395,2025-04-24 21:15:38.437125,2025-04-24 21:15:39.614295,0 days 00:00:01.177170,friedman_mse,35,sqrt,2,5,best,TPESampler,COMPLETE
2285,0.6327006073621034,2025-04-24 21:15:39.547913,2025-04-24 21:15:40.915011,0 days 00:00:01.367098,friedman_mse,35,sqrt,1,8,best,TPESampler,COMPLETE
2286,0.6248248219525877,2025-04-24 21:15:39.744529,2025-04-24 21:15:40.943520,0 days 00:00:01.198991,friedman_mse,35,sqrt,1,4,best,TPESampler,COMPLETE
2287,0.6446227396865948,2025-04-24 21:15:40.033920,2025-04-24 21:15:41.125180,0 days 00:00:01.091260,friedman_mse,29,sqrt,1,6,best,TPESampler,COMPLETE
2288,0.5522341372198587,2025-04-24 21:15:41.132593,2025-04-24 21:15:41.984850,0 days 00:00:00.852257,friedman_mse,35,sqrt,1,6,best,TPESampler,COMPLETE
2289,0.7139772654378607,2025-04-24 21:15:41.216945,2025-04-24 21:15:42.553265,0 days 00:00:01.336320,friedman_mse,31,sqrt,1,2,best,TPESampler,COMPLETE
2290,0.5981875505937236,2025-04-24 21:15:41.396970,2025-04-24 21:15:42.386802,0 days 00:00:00.989832,friedman_mse,35,sqrt,1,7,best,TPESampler,COMPLETE
