number,value,datetime_start,datetime_complete,duration,params_criterion,params_max_depth,params_max_features,params_min_samples_leaf,params_min_samples_split,params_splitter,system_attrs_auto:sampler,state
1000,0.689760431628426,2025-04-24 21:06:36.078217,2025-04-24 21:06:36.944629,0 days 00:00:00.866412,friedman_mse,35,sqrt,3,5,random,TPESampler,COMPLETE
1001,0.5901353558999477,2025-04-24 21:06:36.656217,2025-04-24 21:06:37.346227,0 days 00:00:00.690010,friedman_mse,35,sqrt,1,2,random,TPESampler,COMPLETE
1002,0.572323290498834,2025-04-24 21:06:37.026761,2025-04-24 21:06:37.887474,0 days 00:00:00.860713,friedman_mse,35,sqrt,1,3,random,TPESampler,COMPLETE
1003,0.6767196774666705,2025-04-24 21:06:37.205668,2025-04-24 21:06:38.079765,0 days 00:00:00.874097,friedman_mse,29,sqrt,2,5,random,TPESampler,COMPLETE
1004,0.6921755075647752,2025-04-24 21:06:37.608016,2025-04-24 21:06:38.379728,0 days 00:00:00.771712,friedman_mse,23,sqrt,2,15,random,TPESampler,COMPLETE
1005,0.689760431628426,2025-04-24 21:06:38.144300,2025-04-24 21:06:38.917989,0 days 00:00:00.773689,friedman_mse,30,sqrt,3,2,random,TPESampler,COMPLETE
1006,0.6146447020156406,2025-04-24 21:06:38.330780,2025-04-24 21:06:39.211603,0 days 00:00:00.880823,friedman_mse,30,sqrt,1,4,random,TPESampler,COMPLETE
1007,0.65939355930446,2025-04-24 21:06:38.622128,2025-04-24 21:06:39.438389,0 days 00:00:00.816261,friedman_mse,29,sqrt,2,8,random,TPESampler,COMPLETE
1008,0.5669738735012982,2025-04-24 21:06:39.164028,2025-04-24 21:06:39.908271,0 days 00:00:00.744243,friedman_mse,35,sqrt,1,4,random,TPESampler,COMPLETE
1009,0.964903983025146,2025-04-24 21:06:39.444646,2025-04-24 21:06:40.387678,0 days 00:00:00.943032,absolute_error,25,log2,7,12,best,TPESampler,COMPLETE
1010,0.5775889978864173,2025-04-24 21:06:39.696830,2025-04-24 21:06:40.602261,0 days 00:00:00.905431,friedman_mse,35,sqrt,1,9,random,TPESampler,COMPLETE
1011,0.5735536095371757,2025-04-24 21:06:40.150144,2025-04-24 21:06:41.087460,0 days 00:00:00.937316,squared_error,35,sqrt,1,5,random,TPESampler,COMPLETE
1012,0.6331470915422162,2025-04-24 21:06:40.655532,2025-04-24 21:06:41.420693,0 days 00:00:00.765161,friedman_mse,30,sqrt,1,7,random,TPESampler,COMPLETE
1013,0.6331470915422162,2025-04-24 21:06:40.851238,2025-04-24 21:06:41.715761,0 days 00:00:00.864523,friedman_mse,30,sqrt,1,7,random,TPESampler,COMPLETE
1014,0.5735536095371757,2025-04-24 21:06:41.390972,2025-04-24 21:06:42.127765,0 days 00:00:00.736793,friedman_mse,35,sqrt,1,5,random,TPESampler,COMPLETE
1015,0.689760431628426,2025-04-24 21:06:41.762369,2025-04-24 21:06:42.492658,0 days 00:00:00.730289,friedman_mse,35,sqrt,3,3,random,TPESampler,COMPLETE
1016,0.689760431628426,2025-04-24 21:06:42.031602,2025-04-24 21:06:42.836825,0 days 00:00:00.805223,friedman_mse,35,sqrt,3,3,random,TPESampler,COMPLETE
1017,0.6178174092883351,2025-04-24 21:06:42.457180,2025-04-24 21:06:43.213227,0 days 00:00:00.756047,friedman_mse,29,sqrt,1,4,random,TPESampler,COMPLETE
1018,0.5735536095371757,2025-04-24 21:06:42.732189,2025-04-24 21:06:43.577567,0 days 00:00:00.845378,friedman_mse,35,sqrt,1,5,random,TPESampler,COMPLETE
1019,0.6227485159214275,2025-04-24 21:06:43.092638,2025-04-24 21:06:43.950378,0 days 00:00:00.857740,friedman_mse,30,sqrt,1,2,random,TPESampler,COMPLETE
1020,0.6178174092883351,2025-04-24 21:06:43.568242,2025-04-24 21:06:44.352682,0 days 00:00:00.784440,friedman_mse,29,sqrt,1,4,random,TPESampler,COMPLETE
1021,0.5735536095371757,2025-04-24 21:06:43.863641,2025-04-24 21:06:44.663617,0 days 00:00:00.799976,friedman_mse,35,sqrt,1,5,random,TPESampler,COMPLETE
1022,0.5669738735012982,2025-04-24 21:06:44.189998,2025-04-24 21:06:45.051211,0 days 00:00:00.861213,friedman_mse,35,sqrt,1,4,random,TPESampler,COMPLETE
1023,0.7238353318092209,2025-04-24 21:06:44.662136,2025-04-24 21:06:45.380529,0 days 00:00:00.718393,absolute_error,20,sqrt,6,2,best,TPESampler,COMPLETE
1024,0.7229976776132628,2025-04-24 21:06:44.944476,2025-04-24 21:06:45.829050,0 days 00:00:00.884574,absolute_error,35,sqrt,7,18,best,TPESampler,COMPLETE
1025,0.5901353558999477,2025-04-24 21:06:45.388344,2025-04-24 21:06:46.159842,0 days 00:00:00.771498,friedman_mse,35,sqrt,1,2,random,TPESampler,COMPLETE
1026,0.689760431628426,2025-04-24 21:06:45.715891,2025-04-24 21:06:46.574663,0 days 00:00:00.858772,friedman_mse,30,sqrt,3,4,random,TPESampler,COMPLETE
1027,0.7143351171141927,2025-04-24 21:06:46.117262,2025-04-24 21:06:47.014108,0 days 00:00:00.896846,friedman_mse,35,sqrt,3,8,random,TPESampler,COMPLETE
1028,0.5897648645579153,2025-04-24 21:06:46.398815,2025-04-24 21:06:47.237050,0 days 00:00:00.838235,friedman_mse,35,sqrt,1,7,random,TPESampler,COMPLETE
1029,0.689760431628426,2025-04-24 21:06:46.946248,2025-04-24 21:06:47.756096,0 days 00:00:00.809848,friedman_mse,35,sqrt,3,5,random,TPESampler,COMPLETE
1030,0.5910861426343554,2025-04-24 21:06:47.251789,2025-04-24 21:06:48.096229,0 days 00:00:00.844440,friedman_mse,35,sqrt,1,6,random,TPESampler,COMPLETE
1031,0.6568175016976607,2025-04-24 21:06:47.617065,2025-04-24 21:06:48.565030,0 days 00:00:00.947965,friedman_mse,32,sqrt,2,2,best,TPESampler,COMPLETE
1032,0.5522341372198587,2025-04-24 21:06:48.050331,2025-04-24 21:06:48.757224,0 days 00:00:00.706893,friedman_mse,35,sqrt,1,6,best,TPESampler,COMPLETE
1033,0.6227485159214275,2025-04-24 21:06:48.297732,2025-04-24 21:06:49.129968,0 days 00:00:00.832236,friedman_mse,30,sqrt,1,2,random,TPESampler,COMPLETE
1034,0.6294262830691475,2025-04-24 21:06:48.913687,2025-04-24 21:06:49.702224,0 days 00:00:00.788537,friedman_mse,28,sqrt,1,8,best,TPESampler,COMPLETE
1035,0.6795586075375003,2025-04-24 21:06:49.023362,2025-04-24 21:06:49.932895,0 days 00:00:00.909533,friedman_mse,24,sqrt,3,6,best,TPESampler,COMPLETE
1036,0.6777654391113064,2025-04-24 21:06:49.377910,2025-04-24 21:06:50.183508,0 days 00:00:00.805598,friedman_mse,29,sqrt,2,5,best,TPESampler,COMPLETE
1037,0.6842897848958955,2025-04-24 21:06:50.036196,2025-04-24 21:06:51.009750,0 days 00:00:00.973554,friedman_mse,29,sqrt,2,10,best,TPESampler,COMPLETE
1038,0.6506144251141773,2025-04-24 21:06:50.179068,2025-04-24 21:06:50.987191,0 days 00:00:00.808123,friedman_mse,31,sqrt,1,8,best,TPESampler,COMPLETE
1039,0.6086400187979454,2025-04-24 21:06:50.446233,2025-04-24 21:06:51.340552,0 days 00:00:00.894319,friedman_mse,33,sqrt,1,8,best,TPESampler,COMPLETE
1040,0.715013161324494,2025-04-24 21:06:51.246584,2025-04-24 21:06:52.033120,0 days 00:00:00.786536,friedman_mse,32,sqrt,3,7,best,TPESampler,COMPLETE
1041,0.9545020982502701,2025-04-24 21:06:51.296405,2025-04-24 21:06:52.224646,0 days 00:00:00.928241,friedman_mse,34,log2,3,6,best,TPESampler,COMPLETE
1042,0.6404311976994013,2025-04-24 21:06:51.561115,2025-04-24 21:06:52.599932,0 days 00:00:01.038817,friedman_mse,28,sqrt,2,6,best,TPESampler,COMPLETE
1043,0.5910861426343554,2025-04-24 21:06:52.276956,2025-04-24 21:06:53.090637,0 days 00:00:00.813681,friedman_mse,35,sqrt,1,6,random,TPESampler,COMPLETE
1044,0.6123183697228924,2025-04-24 21:06:52.480205,2025-04-24 21:06:53.280636,0 days 00:00:00.800431,friedman_mse,30,sqrt,1,6,best,TPESampler,COMPLETE
1045,0.695132658085423,2025-04-24 21:06:52.837781,2025-04-24 21:06:53.565649,0 days 00:00:00.727868,friedman_mse,32,sqrt,1,2,best,TPESampler,COMPLETE
1046,0.5601090226456882,2025-04-24 21:06:53.453674,2025-04-24 21:06:54.319673,0 days 00:00:00.865999,friedman_mse,34,sqrt,1,4,best,TPESampler,COMPLETE
1047,0.5522341372198587,2025-04-24 21:06:53.529438,2025-04-24 21:06:54.624777,0 days 00:00:01.095339,friedman_mse,35,sqrt,1,6,best,TPESampler,COMPLETE
1048,0.6321873822339226,2025-04-24 21:06:53.785245,2025-04-24 21:06:54.664729,0 days 00:00:00.879484,friedman_mse,35,sqrt,2,11,best,TPESampler,COMPLETE
1049,0.6123183697228924,2025-04-24 21:06:54.555423,2025-04-24 21:06:55.211028,0 days 00:00:00.655605,friedman_mse,30,sqrt,1,6,best,TPESampler,COMPLETE
1050,0.6068214966349627,2025-04-24 21:06:54.915029,2025-04-24 21:06:55.763459,0 days 00:00:00.848430,friedman_mse,34,sqrt,1,6,best,TPESampler,COMPLETE
1051,0.7113263276640378,2025-04-24 21:06:54.958605,2025-04-24 21:06:55.862337,0 days 00:00:00.903732,friedman_mse,34,sqrt,3,7,best,TPESampler,COMPLETE
1052,0.6568175016976607,2025-04-24 21:06:55.552624,2025-04-24 21:06:56.278469,0 days 00:00:00.725845,friedman_mse,35,sqrt,2,4,best,TPESampler,COMPLETE
1053,0.6388396911586912,2025-04-24 21:06:56.032464,2025-04-24 21:06:56.827867,0 days 00:00:00.795403,friedman_mse,33,sqrt,1,3,best,TPESampler,COMPLETE
1054,0.6568175016976607,2025-04-24 21:06:56.089227,2025-04-24 21:06:56.981025,0 days 00:00:00.891798,friedman_mse,32,sqrt,2,4,best,TPESampler,COMPLETE
1055,0.6551631182803123,2025-04-24 21:06:56.519872,2025-04-24 21:06:57.765145,0 days 00:00:01.245273,friedman_mse,33,sqrt,2,7,best,TPESampler,COMPLETE
1056,0.5981875505937236,2025-04-24 21:06:57.147773,2025-04-24 21:06:58.100238,0 days 00:00:00.952465,friedman_mse,35,sqrt,1,7,best,TPESampler,COMPLETE
1057,0.5570349516953657,2025-04-24 21:06:57.205561,2025-04-24 21:06:58.098767,0 days 00:00:00.893206,friedman_mse,32,sqrt,1,6,best,TPESampler,COMPLETE
1058,0.675982364902162,2025-04-24 21:06:57.961897,2025-04-24 21:06:58.690310,0 days 00:00:00.728413,friedman_mse,35,sqrt,2,6,best,TPESampler,COMPLETE
1059,0.6996372204646344,2025-04-24 21:06:58.374492,2025-04-24 21:06:59.327664,0 days 00:00:00.953172,squared_error,23,sqrt,3,7,best,TPESampler,COMPLETE
1060,0.6581282397926295,2025-04-24 21:06:58.412606,2025-04-24 21:06:59.305543,0 days 00:00:00.892937,squared_error,30,sqrt,2,6,best,TPESampler,COMPLETE
1061,0.6002195353791403,2025-04-24 21:06:58.956787,2025-04-24 21:06:59.621010,0 days 00:00:00.664223,friedman_mse,34,sqrt,1,7,best,TPESampler,COMPLETE
1062,0.606163688550708,2025-04-24 21:06:59.525780,2025-04-24 21:07:00.650680,0 days 00:00:01.124900,friedman_mse,33,sqrt,1,4,best,TPESampler,COMPLETE
1063,0.9581948037924227,2025-04-24 21:06:59.584012,2025-04-24 21:07:00.352281,0 days 00:00:00.768269,absolute_error,6,sqrt,10,16,random,TPESampler,COMPLETE
1064,0.6866139495437327,2025-04-24 21:06:59.865236,2025-04-24 21:07:00.759300,0 days 00:00:00.894064,friedman_mse,33,sqrt,1,6,best,TPESampler,COMPLETE
1065,0.5814361283424697,2025-04-24 21:07:00.578843,2025-04-24 21:07:01.467453,0 days 00:00:00.888610,friedman_mse,33,sqrt,1,7,best,TPESampler,COMPLETE
1066,0.6373919652727638,2025-04-24 21:07:00.970370,2025-04-24 21:07:01.863886,0 days 00:00:00.893516,friedman_mse,19,sqrt,1,3,best,TPESampler,COMPLETE
1067,0.5570349516953657,2025-04-24 21:07:01.032254,2025-04-24 21:07:01.896129,0 days 00:00:00.863875,friedman_mse,32,sqrt,1,6,best,TPESampler,COMPLETE
1068,0.5981875505937236,2025-04-24 21:07:01.752454,2025-04-24 21:07:03.109037,0 days 00:00:01.356583,friedman_mse,35,sqrt,1,7,best,TPESampler,COMPLETE
1069,0.6803749766244268,2025-04-24 21:07:02.044237,2025-04-24 21:07:02.962274,0 days 00:00:00.918037,squared_error,28,log2,1,8,best,TPESampler,COMPLETE
1070,0.6068214966349627,2025-04-24 21:07:02.158745,2025-04-24 21:07:03.110506,0 days 00:00:00.951761,friedman_mse,34,sqrt,1,6,best,TPESampler,COMPLETE
1071,0.6029004895814106,2025-04-24 21:07:03.268711,2025-04-24 21:07:04.091526,0 days 00:00:00.822815,friedman_mse,27,sqrt,1,5,best,TPESampler,COMPLETE
1072,0.7190455830201625,2025-04-24 21:07:03.282160,2025-04-24 21:07:04.425451,0 days 00:00:01.143291,friedman_mse,30,sqrt,4,5,best,TPESampler,COMPLETE
1073,0.6805363692892722,2025-04-24 21:07:03.287802,2025-04-24 21:07:04.274451,0 days 00:00:00.986649,friedman_mse,29,sqrt,1,3,best,TPESampler,COMPLETE
1074,0.642967950902596,2025-04-24 21:07:04.326369,2025-04-24 21:07:05.008048,0 days 00:00:00.681679,friedman_mse,29,sqrt,1,9,best,TPESampler,COMPLETE
1075,0.6361895113592757,2025-04-24 21:07:04.545270,2025-04-24 21:07:05.380733,0 days 00:00:00.835463,friedman_mse,29,sqrt,1,4,best,TPESampler,COMPLETE
1076,0.686552194285178,2025-04-24 21:07:04.744336,2025-04-24 21:07:05.591408,0 days 00:00:00.847072,friedman_mse,27,sqrt,2,5,best,TPESampler,COMPLETE
1077,0.687976334662244,2025-04-24 21:07:05.318378,2025-04-24 21:07:06.158742,0 days 00:00:00.840364,friedman_mse,33,log2,1,7,best,TPESampler,COMPLETE
1078,0.7183195623582611,2025-04-24 21:07:05.674888,2025-04-24 21:07:06.707258,0 days 00:00:01.032370,friedman_mse,27,sqrt,1,7,best,TPESampler,COMPLETE
1079,0.5814361283424697,2025-04-24 21:07:05.869615,2025-04-24 21:07:06.923868,0 days 00:00:01.054253,friedman_mse,33,sqrt,1,7,best,TPESampler,COMPLETE
1080,0.5923682861774692,2025-04-24 21:07:06.647621,2025-04-24 21:07:07.482384,0 days 00:00:00.834763,friedman_mse,34,sqrt,1,5,best,TPESampler,COMPLETE
1081,0.5925656078110476,2025-04-24 21:07:06.961955,2025-04-24 21:07:07.790511,0 days 00:00:00.828556,friedman_mse,31,sqrt,1,5,best,TPESampler,COMPLETE
1082,0.675982364902162,2025-04-24 21:07:07.303249,2025-04-24 21:07:08.316706,0 days 00:00:01.013457,friedman_mse,34,sqrt,2,6,best,TPESampler,COMPLETE
1083,0.6082164367053395,2025-04-24 21:07:07.795911,2025-04-24 21:07:08.578135,0 days 00:00:00.782224,friedman_mse,34,sqrt,2,5,best,TPESampler,COMPLETE
1084,0.7246712212327447,2025-04-24 21:07:08.071066,2025-04-24 21:07:08.767163,0 days 00:00:00.696097,friedman_mse,34,sqrt,3,2,best,TPESampler,COMPLETE
1085,0.6015012618996902,2025-04-24 21:07:08.606817,2025-04-24 21:07:09.631805,0 days 00:00:01.024988,friedman_mse,30,sqrt,1,8,best,TPESampler,COMPLETE
1086,0.6062383726266027,2025-04-24 21:07:08.851218,2025-04-24 21:07:10.043175,0 days 00:00:01.191957,friedman_mse,34,sqrt,1,11,best,TPESampler,COMPLETE
1087,0.5616498096723733,2025-04-24 21:07:09.498243,2025-04-24 21:07:10.500103,0 days 00:00:01.001860,friedman_mse,35,sqrt,1,12,best,TPESampler,COMPLETE
1088,0.706977125199864,2025-04-24 21:07:10.030564,2025-04-24 21:07:11.141347,0 days 00:00:01.110783,friedman_mse,27,sqrt,1,14,best,TPESampler,COMPLETE
1089,0.9968066590016214,2025-04-24 21:07:10.505859,2025-04-24 21:07:11.419051,0 days 00:00:00.913192,squared_error,1,sqrt,6,17,random,TPESampler,COMPLETE
1090,0.6659193936754176,2025-04-24 21:07:11.010114,2025-04-24 21:07:11.874810,0 days 00:00:00.864696,friedman_mse,35,sqrt,2,9,best,TPESampler,COMPLETE
1091,0.5726798261396243,2025-04-24 21:07:11.375497,2025-04-24 21:07:12.402430,0 days 00:00:01.026933,absolute_error,35,sqrt,1,5,best,TPESampler,COMPLETE
1092,0.6518691584550678,2025-04-24 21:07:11.692077,2025-04-24 21:07:12.755210,0 days 00:00:01.063133,friedman_mse,29,sqrt,1,5,best,TPESampler,COMPLETE
1093,0.7090963274358311,2025-04-24 21:07:12.229094,2025-04-24 21:07:13.088055,0 days 00:00:00.858961,friedman_mse,30,sqrt,3,14,best,TPESampler,COMPLETE
1094,0.6530914488671333,2025-04-24 21:07:12.681510,2025-04-24 21:07:13.598501,0 days 00:00:00.916991,friedman_mse,32,sqrt,2,13,best,TPESampler,COMPLETE
1095,0.6158166985156879,2025-04-24 21:07:13.034264,2025-04-24 21:07:13.779040,0 days 00:00:00.744776,friedman_mse,35,sqrt,1,9,best,TPESampler,COMPLETE
1096,0.6543467398872477,2025-04-24 21:07:13.310673,2025-04-24 21:07:14.096198,0 days 00:00:00.785525,friedman_mse,30,sqrt,2,12,best,TPESampler,COMPLETE
1097,0.5678250894923149,2025-04-24 21:07:13.844926,2025-04-24 21:07:14.686800,0 days 00:00:00.841874,friedman_mse,34,sqrt,1,16,best,TPESampler,COMPLETE
1098,0.649573014390662,2025-04-24 21:07:14.049341,2025-04-24 21:07:14.882530,0 days 00:00:00.833189,friedman_mse,35,sqrt,2,8,best,TPESampler,COMPLETE
1099,0.6157617894780196,2025-04-24 21:07:14.384017,2025-04-24 21:07:15.294234,0 days 00:00:00.910217,friedman_mse,33,sqrt,1,14,best,TPESampler,COMPLETE
1100,0.6275308346432694,2025-04-24 21:07:14.952092,2025-04-24 21:07:15.853756,0 days 00:00:00.901664,absolute_error,33,sqrt,2,13,best,TPESampler,COMPLETE
1101,0.6530914488671333,2025-04-24 21:07:15.178190,2025-04-24 21:07:16.045626,0 days 00:00:00.867436,friedman_mse,35,sqrt,2,13,best,TPESampler,COMPLETE
1102,0.5978929531338989,2025-04-24 21:07:15.546401,2025-04-24 21:07:16.318558,0 days 00:00:00.772157,friedman_mse,35,sqrt,1,10,best,TPESampler,COMPLETE
1103,0.6068214966349627,2025-04-24 21:07:16.196533,2025-04-24 21:07:17.080887,0 days 00:00:00.884354,friedman_mse,34,sqrt,1,6,best,TPESampler,COMPLETE
1104,0.6871884164014715,2025-04-24 21:07:16.271277,2025-04-24 21:07:17.141241,0 days 00:00:00.869964,friedman_mse,26,sqrt,3,5,best,TPESampler,COMPLETE
1105,0.9581948037924227,2025-04-24 21:07:16.806845,2025-04-24 21:07:17.467902,0 days 00:00:00.661057,absolute_error,13,sqrt,10,5,random,TPESampler,COMPLETE
1106,0.5522341372198587,2025-04-24 21:07:17.348209,2025-04-24 21:07:18.433376,0 days 00:00:01.085167,friedman_mse,35,sqrt,1,6,best,TPESampler,COMPLETE
1107,0.6035982221692777,2025-04-24 21:07:17.395371,2025-04-24 21:07:18.575842,0 days 00:00:01.180471,friedman_mse,35,sqrt,1,2,best,TPESampler,COMPLETE
1108,0.6775232039549919,2025-04-24 21:07:18.173048,2025-04-24 21:07:18.843427,0 days 00:00:00.670379,friedman_mse,24,sqrt,3,8,best,TPESampler,COMPLETE
1109,0.9583528309130763,2025-04-24 21:07:18.711926,2025-04-24 21:07:19.709479,0 days 00:00:00.997553,friedman_mse,2,sqrt,5,8,best,TPESampler,COMPLETE
1110,0.7246712212327447,2025-04-24 21:07:18.780711,2025-04-24 21:07:19.907532,0 days 00:00:01.126821,friedman_mse,35,sqrt,3,6,best,TPESampler,COMPLETE
1111,0.5616498096723733,2025-04-24 21:07:19.104896,2025-04-24 21:07:20.011362,0 days 00:00:00.906466,squared_error,35,sqrt,1,12,best,TPESampler,COMPLETE
1112,0.68636520552826,2025-04-24 21:07:19.950839,2025-04-24 21:07:20.815265,0 days 00:00:00.864426,squared_error,29,sqrt,3,10,best,TPESampler,COMPLETE
1113,0.5561055710214411,2025-04-24 21:07:20.195225,2025-04-24 21:07:21.052206,0 days 00:00:00.856981,squared_error,33,sqrt,1,12,best,TPESampler,COMPLETE
1114,0.6157617894780196,2025-04-24 21:07:20.292719,2025-04-24 21:07:21.166548,0 days 00:00:00.873829,squared_error,33,sqrt,1,14,best,TPESampler,COMPLETE
1115,0.6321873822339226,2025-04-24 21:07:21.070328,2025-04-24 21:07:21.731905,0 days 00:00:00.661577,squared_error,33,sqrt,2,11,best,TPESampler,COMPLETE
1116,0.610300375570967,2025-04-24 21:07:21.415028,2025-04-24 21:07:22.305768,0 days 00:00:00.890740,squared_error,35,sqrt,1,5,best,TPESampler,COMPLETE
1117,0.6167655646140088,2025-04-24 21:07:21.464868,2025-04-24 21:07:22.455165,0 days 00:00:00.990297,squared_error,26,sqrt,1,10,best,TPESampler,COMPLETE
1118,0.6295733552888221,2025-04-24 21:07:22.020900,2025-04-24 21:07:22.727036,0 days 00:00:00.706136,squared_error,32,sqrt,1,13,best,TPESampler,COMPLETE
1119,0.6530914488671333,2025-04-24 21:07:22.591600,2025-04-24 21:07:23.292554,0 days 00:00:00.700954,squared_error,33,sqrt,2,13,best,TPESampler,COMPLETE
1120,0.6360232774334932,2025-04-24 21:07:22.689990,2025-04-24 21:07:23.626112,0 days 00:00:00.936122,friedman_mse,27,sqrt,1,10,best,TPESampler,COMPLETE
1121,0.6062383726266027,2025-04-24 21:07:23.009650,2025-04-24 21:07:24.058601,0 days 00:00:01.048951,squared_error,34,sqrt,1,11,best,TPESampler,COMPLETE
1122,0.649573014390662,2025-04-24 21:07:23.586592,2025-04-24 21:07:24.329969,0 days 00:00:00.743377,friedman_mse,35,sqrt,2,8,best,TPESampler,COMPLETE
1123,0.7071324179378625,2025-04-24 21:07:23.942559,2025-04-24 21:07:24.763084,0 days 00:00:00.820525,squared_error,29,sqrt,3,16,best,TPESampler,COMPLETE
1124,0.6082164367053395,2025-04-24 21:07:24.294327,2025-04-24 21:07:25.095492,0 days 00:00:00.801165,friedman_mse,35,sqrt,2,5,best,TPESampler,COMPLETE
1125,0.6248248219525877,2025-04-24 21:07:24.589155,2025-04-24 21:07:25.396799,0 days 00:00:00.807644,friedman_mse,35,sqrt,1,4,best,TPESampler,COMPLETE
1126,0.6569776090701482,2025-04-24 21:07:25.093908,2025-04-24 21:07:25.844414,0 days 00:00:00.750506,squared_error,33,sqrt,2,12,best,TPESampler,COMPLETE
1127,0.6569776090701482,2025-04-24 21:07:25.345963,2025-04-24 21:07:26.135190,0 days 00:00:00.789227,squared_error,31,sqrt,2,12,best,TPESampler,COMPLETE
1128,0.671618841435268,2025-04-24 21:07:25.606010,2025-04-24 21:07:26.449027,0 days 00:00:00.843017,squared_error,28,sqrt,2,13,best,TPESampler,COMPLETE
1129,0.7190455830201625,2025-04-24 21:07:26.147155,2025-04-24 21:07:26.986878,0 days 00:00:00.839723,squared_error,35,sqrt,4,9,best,TPESampler,COMPLETE
1130,0.6086400187979454,2025-04-24 21:07:26.434601,2025-04-24 21:07:27.373569,0 days 00:00:00.938968,squared_error,33,sqrt,1,8,best,TPESampler,COMPLETE
1131,0.9928365741172522,2025-04-24 21:07:26.858211,2025-04-24 21:07:27.894270,0 days 00:00:01.036059,squared_error,16,log2,7,17,best,TPESampler,COMPLETE
1132,0.6659193936754176,2025-04-24 21:07:27.261773,2025-04-24 21:07:28.092606,0 days 00:00:00.830833,squared_error,31,sqrt,2,9,best,TPESampler,COMPLETE
1133,0.6155261828297663,2025-04-24 21:07:27.660781,2025-04-24 21:07:28.453088,0 days 00:00:00.792307,absolute_error,32,sqrt,1,10,best,TPESampler,COMPLETE
1134,0.6772977101833962,2025-04-24 21:07:28.166402,2025-04-24 21:07:28.990774,0 days 00:00:00.824372,squared_error,29,sqrt,2,12,best,TPESampler,COMPLETE
1135,0.9928365741172522,2025-04-24 21:07:28.343801,2025-04-24 21:07:29.294895,0 days 00:00:00.951094,squared_error,5,log2,9,14,best,TPESampler,COMPLETE
1136,0.6162422819289737,2025-04-24 21:07:28.680003,2025-04-24 21:07:29.513107,0 days 00:00:00.833104,squared_error,28,sqrt,1,17,best,TPESampler,COMPLETE
1137,0.5616498096723733,2025-04-24 21:07:29.233264,2025-04-24 21:07:30.094345,0 days 00:00:00.861081,squared_error,35,sqrt,1,12,best,TPESampler,COMPLETE
1138,0.6321873822339226,2025-04-24 21:07:29.583776,2025-04-24 21:07:30.531859,0 days 00:00:00.948083,squared_error,34,sqrt,2,11,best,TPESampler,COMPLETE
1139,0.9737936641952643,2025-04-24 21:07:29.788917,2025-04-24 21:07:30.827550,0 days 00:00:01.038633,squared_error,3,sqrt,7,9,random,TPESampler,COMPLETE
1140,0.6648284558386203,2025-04-24 21:07:30.464733,2025-04-24 21:07:31.149822,0 days 00:00:00.685089,squared_error,32,sqrt,2,15,best,TPESampler,COMPLETE
1141,0.7186218468788037,2025-04-24 21:07:30.831457,2025-04-24 21:07:31.717539,0 days 00:00:00.886082,squared_error,35,sqrt,3,17,best,TPESampler,COMPLETE
1142,0.6659193936754176,2025-04-24 21:07:31.031196,2025-04-24 21:07:31.871423,0 days 00:00:00.840227,squared_error,35,sqrt,2,9,best,TPESampler,COMPLETE
