number,value,datetime_start,datetime_complete,duration,params_criterion,params_max_depth,params_max_features,params_min_samples_leaf,params_min_samples_split,params_splitter,system_attrs_auto:sampler,state
1143,0.6216475717333518,2025-04-24 21:07:31.423376,2025-04-24 21:07:32.175557,0 days 00:00:00.752181,squared_error,33,sqrt,1,11,best,TPESampler,COMPLETE
1144,0.7076263462217791,2025-04-24 21:07:31.910906,2025-04-24 21:07:33.028690,0 days 00:00:01.117784,squared_error,32,log2,1,12,best,TPESampler,COMPLETE
1145,0.6595065143489847,2025-04-24 21:07:32.111198,2025-04-24 21:07:32.947649,0 days 00:00:00.836451,squared_error,31,sqrt,2,10,best,TPESampler,COMPLETE
1146,0.5853235656379547,2025-04-24 21:07:32.401390,2025-04-24 21:07:33.214061,0 days 00:00:00.812671,squared_error,35,sqrt,1,13,best,TPESampler,COMPLETE
1147,0.7277538126455737,2025-04-24 21:07:33.222524,2025-04-24 21:07:34.101012,0 days 00:00:00.878488,absolute_error,19,sqrt,7,14,best,TPESampler,COMPLETE
1148,0.6212356206607815,2025-04-24 21:07:33.285405,2025-04-24 21:07:34.277670,0 days 00:00:00.992265,squared_error,29,sqrt,1,11,best,TPESampler,COMPLETE
1149,0.6912669627150736,2025-04-24 21:07:33.420119,2025-04-24 21:07:34.402959,0 days 00:00:00.982840,squared_error,21,sqrt,2,12,best,TPESampler,COMPLETE
1150,0.6157617894780196,2025-04-24 21:07:34.356732,2025-04-24 21:07:36.171995,0 days 00:00:01.815263,squared_error,33,sqrt,1,14,best,TPESampler,COMPLETE
1151,0.5925119263261721,2025-04-24 21:07:34.545960,2025-04-24 21:07:36.369711,0 days 00:00:01.823751,friedman_mse,35,sqrt,1,3,best,TPESampler,COMPLETE
1152,0.7155308899518609,2025-04-24 21:07:34.696019,2025-04-24 21:07:36.489384,0 days 00:00:01.793365,squared_error,35,sqrt,3,14,best,TPESampler,COMPLETE
1153,0.6311738269248106,2025-04-24 21:07:36.445970,2025-04-24 21:07:37.287484,0 days 00:00:00.841514,squared_error,34,sqrt,1,9,best,TPESampler,COMPLETE
1154,0.7564353732875213,2025-04-24 21:07:36.616904,2025-04-24 21:07:37.617395,0 days 00:00:01.000491,squared_error,13,sqrt,2,13,random,TPESampler,COMPLETE
1155,0.9962502283466568,2025-04-24 21:07:36.868934,2025-04-24 21:07:37.797360,0 days 00:00:00.928426,squared_error,19,log2,6,14,random,TPESampler,COMPLETE
1156,0.6595065143489847,2025-04-24 21:07:37.565139,2025-04-24 21:07:38.368205,0 days 00:00:00.803066,squared_error,35,sqrt,2,10,best,TPESampler,COMPLETE
1157,0.6638834253178444,2025-04-24 21:07:37.861204,2025-04-24 21:07:38.565061,0 days 00:00:00.703857,squared_error,28,sqrt,1,14,best,TPESampler,COMPLETE
1158,0.7036521193234571,2025-04-24 21:07:38.079907,2025-04-24 21:07:38.814288,0 days 00:00:00.734381,friedman_mse,29,log2,1,11,best,TPESampler,COMPLETE
1159,0.6004184754684004,2025-04-24 21:07:38.685778,2025-04-24 21:07:39.536191,0 days 00:00:00.850413,squared_error,31,sqrt,1,11,best,TPESampler,COMPLETE
1160,0.9720329956141542,2025-04-24 21:07:38.774444,2025-04-24 21:07:39.827343,0 days 00:00:01.052899,absolute_error,21,log2,3,19,random,TPESampler,COMPLETE
1161,0.565318581935515,2025-04-24 21:07:39.023759,2025-04-24 21:07:39.833626,0 days 00:00:00.809867,squared_error,35,sqrt,1,15,best,TPESampler,COMPLETE
1162,0.6492740176698527,2025-04-24 21:07:39.774904,2025-04-24 21:07:40.434881,0 days 00:00:00.659977,friedman_mse,31,sqrt,1,6,best,TPESampler,COMPLETE
1163,0.6143938462848596,2025-04-24 21:07:40.122441,2025-04-24 21:07:40.948222,0 days 00:00:00.825781,friedman_mse,34,sqrt,1,15,best,TPESampler,COMPLETE
1164,0.6597034408927593,2025-04-24 21:07:40.157503,2025-04-24 21:07:41.144496,0 days 00:00:00.986993,squared_error,34,sqrt,2,15,random,TPESampler,COMPLETE
1165,0.9911402167769385,2025-04-24 21:07:40.710152,2025-04-24 21:07:41.443749,0 days 00:00:00.733597,friedman_mse,21,log2,4,2,best,TPESampler,COMPLETE
1166,0.6898049003174207,2025-04-24 21:07:41.228776,2025-04-24 21:07:42.186964,0 days 00:00:00.958188,squared_error,33,sqrt,3,20,best,TPESampler,COMPLETE
1167,0.7186218468788037,2025-04-24 21:07:41.382022,2025-04-24 21:07:42.266862,0 days 00:00:00.884840,squared_error,34,sqrt,3,15,best,TPESampler,COMPLETE
1168,0.5928962035336419,2025-04-24 21:07:41.903677,2025-04-24 21:07:42.580733,0 days 00:00:00.677056,squared_error,32,sqrt,1,18,best,TPESampler,COMPLETE
1169,0.6648284558386203,2025-04-24 21:07:42.455316,2025-04-24 21:07:43.167691,0 days 00:00:00.712375,squared_error,35,sqrt,2,15,best,TPESampler,COMPLETE
1170,0.7186218468788037,2025-04-24 21:07:42.513140,2025-04-24 21:07:43.545548,0 days 00:00:01.032408,squared_error,34,sqrt,3,15,best,TPESampler,COMPLETE
1171,0.7350894647503713,2025-04-24 21:07:42.839338,2025-04-24 21:07:43.655596,0 days 00:00:00.816258,absolute_error,35,sqrt,9,3,best,TPESampler,COMPLETE
1172,0.9152335590441333,2025-04-24 21:07:43.496876,2025-04-24 21:07:44.278018,0 days 00:00:00.781142,squared_error,33,sqrt,5,10,random,TPESampler,COMPLETE
1173,0.5678250894923149,2025-04-24 21:07:43.787947,2025-04-24 21:07:44.887940,0 days 00:00:01.099993,squared_error,34,sqrt,1,16,best,TPESampler,COMPLETE
1174,0.5853891428288016,2025-04-24 21:07:43.923594,2025-04-24 21:07:45.298784,0 days 00:00:01.375190,squared_error,32,sqrt,1,14,best,TPESampler,COMPLETE
1175,0.9968066590016214,2025-04-24 21:07:44.688308,2025-04-24 21:07:45.911581,0 days 00:00:01.223273,squared_error,31,log2,9,7,random,TPESampler,COMPLETE
1176,0.5671925813176031,2025-04-24 21:07:45.215146,2025-04-24 21:07:46.781401,0 days 00:00:01.566255,squared_error,35,sqrt,1,14,best,TPESampler,COMPLETE
1177,0.6321873822339226,2025-04-24 21:07:45.615551,2025-04-24 21:07:47.215413,0 days 00:00:01.599862,squared_error,35,sqrt,2,11,best,TPESampler,COMPLETE
1178,0.609437299456365,2025-04-24 21:07:46.590180,2025-04-24 21:07:47.938667,0 days 00:00:01.348487,friedman_mse,29,sqrt,1,10,best,TPESampler,COMPLETE
1179,0.6316910650032455,2025-04-24 21:07:47.424356,2025-04-24 21:07:49.527491,0 days 00:00:02.103135,squared_error,31,sqrt,1,14,best,TPESampler,COMPLETE
1180,0.6216475717333518,2025-04-24 21:07:47.717306,2025-04-24 21:07:50.063385,0 days 00:00:02.346079,friedman_mse,33,sqrt,1,11,best,TPESampler,COMPLETE
1181,0.8025318233554969,2025-04-24 21:07:48.320200,2025-04-24 21:07:50.764450,0 days 00:00:02.444250,friedman_mse,23,sqrt,9,11,best,TPESampler,COMPLETE
1182,0.8025318233554969,2025-04-24 21:07:50.238513,2025-04-24 21:07:51.715133,0 days 00:00:01.476620,squared_error,24,sqrt,9,18,best,TPESampler,COMPLETE
1183,0.565318581935515,2025-04-24 21:07:50.672217,2025-04-24 21:07:52.427740,0 days 00:00:01.755523,squared_error,35,sqrt,1,15,best,TPESampler,COMPLETE
1184,0.7501154875935077,2025-04-24 21:07:51.628619,2025-04-24 21:07:52.717507,0 days 00:00:01.088888,friedman_mse,29,log2,1,2,best,TPESampler,COMPLETE
1185,0.6648284558386203,2025-04-24 21:07:52.140511,2025-04-24 21:07:53.526441,0 days 00:00:01.385930,squared_error,35,sqrt,2,15,best,TPESampler,COMPLETE
1186,0.5616498096723733,2025-04-24 21:07:52.685617,2025-04-24 21:07:54.118804,0 days 00:00:01.433187,squared_error,35,sqrt,1,12,best,TPESampler,COMPLETE
1187,0.6345191082112132,2025-04-24 21:07:53.181422,2025-04-24 21:07:54.401609,0 days 00:00:01.220187,squared_error,30,sqrt,1,13,best,TPESampler,COMPLETE
1188,0.6216475717333518,2025-04-24 21:07:54.034545,2025-04-24 21:07:55.021391,0 days 00:00:00.986846,squared_error,33,sqrt,1,11,best,TPESampler,COMPLETE
1189,0.6943121931815914,2025-04-24 21:07:54.414194,2025-04-24 21:07:55.621172,0 days 00:00:01.206978,squared_error,35,log2,2,13,best,TPESampler,COMPLETE
1190,0.5928962035336419,2025-04-24 21:07:54.901905,2025-04-24 21:07:56.061778,0 days 00:00:01.159873,squared_error,32,sqrt,1,18,best,TPESampler,COMPLETE
1191,0.6158166985156879,2025-04-24 21:07:55.622837,2025-04-24 21:07:56.700851,0 days 00:00:01.078014,squared_error,35,sqrt,1,9,best,TPESampler,COMPLETE
1192,0.6473933409643637,2025-04-24 21:07:56.064809,2025-04-24 21:07:56.951639,0 days 00:00:00.886830,squared_error,35,sqrt,1,18,best,TPESampler,COMPLETE
1193,0.679455346517496,2025-04-24 21:07:56.395391,2025-04-24 21:07:58.108760,0 days 00:00:01.713369,squared_error,31,log2,1,16,best,TPESampler,COMPLETE
1194,0.629624198383062,2025-04-24 21:07:57.126397,2025-04-24 21:07:58.431894,0 days 00:00:01.305497,squared_error,31,sqrt,1,13,best,TPESampler,COMPLETE
1195,0.6143938462848596,2025-04-24 21:07:57.248936,2025-04-24 21:07:58.434168,0 days 00:00:01.185232,squared_error,34,sqrt,1,15,best,TPESampler,COMPLETE
1196,0.5561055710214411,2025-04-24 21:07:58.388679,2025-04-24 21:07:59.101040,0 days 00:00:00.712361,squared_error,33,sqrt,1,12,best,TPESampler,COMPLETE
1197,0.6530914488671333,2025-04-24 21:07:58.654769,2025-04-24 21:07:59.671939,0 days 00:00:01.017170,squared_error,35,sqrt,2,13,best,TPESampler,COMPLETE
1198,0.6648284558386203,2025-04-24 21:07:58.707785,2025-04-24 21:07:59.683223,0 days 00:00:00.975438,squared_error,35,sqrt,2,15,best,TPESampler,COMPLETE
1199,0.6457707372457452,2025-04-24 21:07:59.368405,2025-04-24 21:08:00.139548,0 days 00:00:00.771143,squared_error,34,sqrt,1,14,best,TPESampler,COMPLETE
1200,0.6569776090701482,2025-04-24 21:07:59.874991,2025-04-24 21:08:00.839043,0 days 00:00:00.964052,squared_error,35,sqrt,2,12,best,TPESampler,COMPLETE
1201,0.6620222959101101,2025-04-24 21:07:59.939795,2025-04-24 21:08:00.886250,0 days 00:00:00.946455,squared_error,25,sqrt,1,13,best,TPESampler,COMPLETE
1202,0.6404563397184219,2025-04-24 21:08:00.455894,2025-04-24 21:08:01.203133,0 days 00:00:00.747239,squared_error,27,sqrt,1,11,best,TPESampler,COMPLETE
1203,0.6530914488671333,2025-04-24 21:08:01.099292,2025-04-24 21:08:01.935520,0 days 00:00:00.836228,squared_error,34,sqrt,2,13,best,TPESampler,COMPLETE
1204,0.5616498096723733,2025-04-24 21:08:01.165713,2025-04-24 21:08:02.233073,0 days 00:00:01.067360,squared_error,35,sqrt,1,12,best,TPESampler,COMPLETE
1205,0.7200228907845636,2025-04-24 21:08:01.412655,2025-04-24 21:08:02.292305,0 days 00:00:00.879650,squared_error,30,sqrt,4,13,best,TPESampler,COMPLETE
1206,0.618571421678708,2025-04-24 21:08:02.231178,2025-04-24 21:08:03.079848,0 days 00:00:00.848670,squared_error,34,sqrt,1,12,best,TPESampler,COMPLETE
1207,0.6975869412010501,2025-04-24 21:08:02.447734,2025-04-24 21:08:03.376672,0 days 00:00:00.928938,squared_error,35,log2,2,6,best,TPESampler,COMPLETE
1208,0.6902998891271458,2025-04-24 21:08:02.503638,2025-04-24 21:08:03.474512,0 days 00:00:00.970874,absolute_error,23,sqrt,3,13,best,TPESampler,COMPLETE
1209,0.5616498096723733,2025-04-24 21:08:03.310058,2025-04-24 21:08:04.057970,0 days 00:00:00.747912,squared_error,35,sqrt,1,12,best,TPESampler,COMPLETE
1210,0.964903983025146,2025-04-24 21:08:03.618108,2025-04-24 21:08:04.457102,0 days 00:00:00.838994,absolute_error,21,log2,9,7,best,TPESampler,COMPLETE
1211,0.6457707372457452,2025-04-24 21:08:03.733492,2025-04-24 21:08:04.747015,0 days 00:00:01.013523,squared_error,34,sqrt,1,14,best,TPESampler,COMPLETE
1212,0.964903983025146,2025-04-24 21:08:04.409912,2025-04-24 21:08:05.239571,0 days 00:00:00.829659,absolute_error,16,log2,10,15,best,TPESampler,COMPLETE
1213,0.6613970629145345,2025-04-24 21:08:04.742716,2025-04-24 21:08:05.530128,0 days 00:00:00.787412,friedman_mse,35,log2,1,13,best,TPESampler,COMPLETE
1214,0.6011863667970774,2025-04-24 21:08:05.003183,2025-04-24 21:08:05.919253,0 days 00:00:00.916070,squared_error,35,sqrt,1,11,best,TPESampler,COMPLETE
1215,0.5644264610142787,2025-04-24 21:08:05.535414,2025-04-24 21:08:06.657035,0 days 00:00:01.121621,squared_error,32,sqrt,1,10,best,TPESampler,COMPLETE
1216,0.5915473206387258,2025-04-24 21:08:05.772189,2025-04-24 21:08:06.805231,0 days 00:00:01.033042,squared_error,30,sqrt,1,14,best,TPESampler,COMPLETE
1217,0.6158166985156879,2025-04-24 21:08:06.260534,2025-04-24 21:08:07.451538,0 days 00:00:01.191004,squared_error,35,sqrt,1,9,best,TPESampler,COMPLETE
1218,0.6191926214916927,2025-04-24 21:08:07.139238,2025-04-24 21:08:08.079005,0 days 00:00:00.939767,squared_error,32,sqrt,1,11,best,TPESampler,COMPLETE
1219,0.6569776090701482,2025-04-24 21:08:07.330904,2025-04-24 21:08:08.182279,0 days 00:00:00.851375,squared_error,35,sqrt,2,12,best,TPESampler,COMPLETE
1220,0.6672296478101067,2025-04-24 21:08:07.760688,2025-04-24 21:08:08.492227,0 days 00:00:00.731539,squared_error,30,sqrt,2,12,random,TPESampler,COMPLETE
1221,0.6239750048219057,2025-04-24 21:08:08.410494,2025-04-24 21:08:09.244971,0 days 00:00:00.834477,squared_error,30,sqrt,1,12,best,TPESampler,COMPLETE
1222,0.6346783462746558,2025-04-24 21:08:08.457976,2025-04-24 21:08:09.402669,0 days 00:00:00.944693,squared_error,30,sqrt,1,10,best,TPESampler,COMPLETE
1223,0.5730386882119437,2025-04-24 21:08:09.166296,2025-04-24 21:08:09.848720,0 days 00:00:00.682424,squared_error,34,sqrt,1,8,best,TPESampler,COMPLETE
1224,0.6569776090701482,2025-04-24 21:08:09.524126,2025-04-24 21:08:10.377938,0 days 00:00:00.853812,squared_error,35,sqrt,2,12,best,TPESampler,COMPLETE
1225,0.6966386482436462,2025-04-24 21:08:09.671764,2025-04-24 21:08:10.709578,0 days 00:00:01.037814,squared_error,31,sqrt,3,10,best,TPESampler,COMPLETE
1226,0.5853235656379547,2025-04-24 21:08:10.087221,2025-04-24 21:08:10.951210,0 days 00:00:00.863989,squared_error,35,sqrt,1,13,best,TPESampler,COMPLETE
1227,0.7126558329407795,2025-04-24 21:08:10.658859,2025-04-24 21:08:11.510740,0 days 00:00:00.851881,squared_error,27,sqrt,3,14,best,TPESampler,COMPLETE
1228,0.6850354486810637,2025-04-24 21:08:10.958870,2025-04-24 21:08:11.759248,0 days 00:00:00.800378,squared_error,27,sqrt,1,13,best,TPESampler,COMPLETE
1229,0.6158166985156879,2025-04-24 21:08:11.267340,2025-04-24 21:08:12.309470,0 days 00:00:01.042130,squared_error,35,sqrt,1,9,best,TPESampler,COMPLETE
1230,0.5616498096723733,2025-04-24 21:08:11.768834,2025-04-24 21:08:12.730769,0 days 00:00:00.961935,squared_error,35,sqrt,1,12,best,TPESampler,COMPLETE
1231,0.6384745916758102,2025-04-24 21:08:12.212791,2025-04-24 21:08:13.264118,0 days 00:00:01.051327,absolute_error,27,sqrt,1,13,best,TPESampler,COMPLETE
1232,0.5978929531338989,2025-04-24 21:08:12.687011,2025-04-24 21:08:13.509641,0 days 00:00:00.822630,squared_error,35,sqrt,1,10,best,TPESampler,COMPLETE
1233,0.6321446368180886,2025-04-24 21:08:13.020646,2025-04-24 21:08:13.897066,0 days 00:00:00.876420,absolute_error,35,sqrt,1,12,best,TPESampler,COMPLETE
1234,0.6975337189752864,2025-04-24 21:08:13.514466,2025-04-24 21:08:14.472829,0 days 00:00:00.958363,absolute_error,28,sqrt,4,7,best,TPESampler,COMPLETE
1235,0.5853235656379547,2025-04-24 21:08:13.744272,2025-04-24 21:08:14.630503,0 days 00:00:00.886231,squared_error,35,sqrt,1,13,best,TPESampler,COMPLETE
1236,0.5842675118295414,2025-04-24 21:08:14.130340,2025-04-24 21:08:14.930597,0 days 00:00:00.800257,squared_error,34,sqrt,1,13,best,TPESampler,COMPLETE
1237,0.5671925813176031,2025-04-24 21:08:14.834010,2025-04-24 21:08:15.704464,0 days 00:00:00.870454,squared_error,35,sqrt,1,14,best,TPESampler,COMPLETE
1238,0.6191926214916927,2025-04-24 21:08:14.889508,2025-04-24 21:08:15.972779,0 days 00:00:01.083271,squared_error,32,sqrt,1,11,best,TPESampler,COMPLETE
1239,0.68636520552826,2025-04-24 21:08:15.172830,2025-04-24 21:08:16.111561,0 days 00:00:00.938731,squared_error,29,sqrt,3,10,best,TPESampler,COMPLETE
1240,0.7186431077620621,2025-04-24 21:08:15.967346,2025-04-24 21:08:16.672723,0 days 00:00:00.705377,squared_error,35,sqrt,3,10,best,TPESampler,COMPLETE
1241,0.5616498096723733,2025-04-24 21:08:16.221753,2025-04-24 21:08:17.037362,0 days 00:00:00.815609,squared_error,35,sqrt,1,12,best,TPESampler,COMPLETE
1242,0.6319146122215336,2025-04-24 21:08:16.394706,2025-04-24 21:08:17.361263,0 days 00:00:00.966557,absolute_error,34,log2,1,17,best,TPESampler,COMPLETE
1243,0.5671925813176031,2025-04-24 21:08:16.968395,2025-04-24 21:08:17.693103,0 days 00:00:00.724708,squared_error,35,sqrt,1,14,best,TPESampler,COMPLETE
1244,0.5880426769542213,2025-04-24 21:08:17.366250,2025-04-24 21:08:18.489169,0 days 00:00:01.122919,squared_error,35,sqrt,1,17,best,TPESampler,COMPLETE
1245,0.6006090932195002,2025-04-24 21:08:17.694301,2025-04-24 21:08:18.727737,0 days 00:00:01.033436,absolute_error,34,sqrt,3,10,best,TPESampler,COMPLETE
1246,0.611561031952885,2025-04-24 21:08:18.217136,2025-04-24 21:08:18.985765,0 days 00:00:00.768629,squared_error,33,sqrt,1,10,best,TPESampler,COMPLETE
1247,0.565318581935515,2025-04-24 21:08:18.795282,2025-04-24 21:08:19.572900,0 days 00:00:00.777618,squared_error,35,sqrt,1,15,best,TPESampler,COMPLETE
1248,0.6377239140367861,2025-04-24 21:08:19.022939,2025-04-24 21:08:19.885151,0 days 00:00:00.862212,squared_error,27,sqrt,1,8,best,TPESampler,COMPLETE
1249,0.706977125199864,2025-04-24 21:08:19.421302,2025-04-24 21:08:20.318270,0 days 00:00:00.896968,squared_error,27,sqrt,1,14,best,TPESampler,COMPLETE
1250,0.6455251655473836,2025-04-24 21:08:19.839344,2025-04-24 21:08:20.683727,0 days 00:00:00.844383,squared_error,28,sqrt,1,11,random,TPESampler,COMPLETE
1251,0.6934277588523042,2025-04-24 21:08:20.134311,2025-04-24 21:08:21.012478,0 days 00:00:00.878167,squared_error,35,log2,2,18,best,TPESampler,COMPLETE
1252,0.6543809735247141,2025-04-24 21:08:20.674076,2025-04-24 21:08:21.532778,0 days 00:00:00.858702,absolute_error,34,sqrt,1,18,best,TPESampler,COMPLETE
1253,0.6276809128732134,2025-04-24 21:08:21.079051,2025-04-24 21:08:21.911823,0 days 00:00:00.832772,squared_error,29,sqrt,1,16,best,TPESampler,COMPLETE
1254,0.5671925813176031,2025-04-24 21:08:21.286565,2025-04-24 21:08:22.261390,0 days 00:00:00.974825,squared_error,35,sqrt,1,14,best,TPESampler,COMPLETE
1255,0.7135700678476479,2025-04-24 21:08:21.876665,2025-04-24 21:08:22.573668,0 days 00:00:00.697003,squared_error,33,sqrt,3,13,best,TPESampler,COMPLETE
1256,0.6069838100184047,2025-04-24 21:08:22.259976,2025-04-24 21:08:23.236514,0 days 00:00:00.976538,squared_error,28,sqrt,1,10,best,TPESampler,COMPLETE
1257,0.6011863667970774,2025-04-24 21:08:22.525513,2025-04-24 21:08:23.565542,0 days 00:00:01.040029,squared_error,35,sqrt,1,11,best,TPESampler,COMPLETE
1258,0.7186431077620621,2025-04-24 21:08:22.809291,2025-04-24 21:08:23.564116,0 days 00:00:00.754825,squared_error,35,sqrt,3,11,best,TPESampler,COMPLETE
1259,0.6011863667970774,2025-04-24 21:08:23.519521,2025-04-24 21:08:24.173739,0 days 00:00:00.654218,squared_error,35,sqrt,1,11,best,TPESampler,COMPLETE
1260,0.6530914488671333,2025-04-24 21:08:23.876042,2025-04-24 21:08:24.857058,0 days 00:00:00.981016,squared_error,35,sqrt,2,13,best,TPESampler,COMPLETE
1261,0.90376982927729,2025-04-24 21:08:23.915444,2025-04-24 21:08:24.847888,0 days 00:00:00.932444,absolute_error,29,sqrt,5,20,random,TPESampler,COMPLETE
1262,0.9740683440979027,2025-04-24 21:08:24.651542,2025-04-24 21:08:25.350310,0 days 00:00:00.698768,absolute_error,33,log2,10,11,random,TPESampler,COMPLETE
1263,0.9928365741172522,2025-04-24 21:08:25.058040,2025-04-24 21:08:25.942477,0 days 00:00:00.884437,friedman_mse,12,log2,10,17,best,TPESampler,COMPLETE
1264,0.5900705706240466,2025-04-24 21:08:25.106972,2025-04-24 21:08:25.986429,0 days 00:00:00.879457,squared_error,35,sqrt,1,16,best,TPESampler,COMPLETE
1265,0.5616498096723733,2025-04-24 21:08:25.804361,2025-04-24 21:08:26.550115,0 days 00:00:00.745754,squared_error,35,sqrt,1,12,best,TPESampler,COMPLETE
1266,0.6186976381009088,2025-04-24 21:08:26.195894,2025-04-24 21:08:27.146765,0 days 00:00:00.950871,squared_error,30,sqrt,1,11,best,TPESampler,COMPLETE
1267,0.5616498096723733,2025-04-24 21:08:26.256332,2025-04-24 21:08:27.183265,0 days 00:00:00.926933,squared_error,35,sqrt,1,12,best,TPESampler,COMPLETE
1268,0.6530914488671333,2025-04-24 21:08:27.014109,2025-04-24 21:08:27.716897,0 days 00:00:00.702788,squared_error,35,sqrt,2,13,best,TPESampler,COMPLETE
1269,0.5671925813176031,2025-04-24 21:08:27.389134,2025-04-24 21:08:28.370242,0 days 00:00:00.981108,squared_error,35,sqrt,1,14,best,TPESampler,COMPLETE
1270,0.6345191082112132,2025-04-24 21:08:27.451379,2025-04-24 21:08:28.367225,0 days 00:00:00.915846,squared_error,30,sqrt,1,13,best,TPESampler,COMPLETE
1271,0.6011863667970774,2025-04-24 21:08:28.131738,2025-04-24 21:08:28.826467,0 days 00:00:00.694729,squared_error,35,sqrt,1,11,best,TPESampler,COMPLETE
1272,0.6143938462848596,2025-04-24 21:08:28.562329,2025-04-24 21:08:29.361291,0 days 00:00:00.798962,squared_error,34,sqrt,1,15,best,TPESampler,COMPLETE
1273,0.7152720142654864,2025-04-24 21:08:28.613470,2025-04-24 21:08:29.545540,0 days 00:00:00.932070,squared_error,35,sqrt,3,13,random,TPESampler,COMPLETE
1274,0.5561055710214411,2025-04-24 21:08:29.118841,2025-04-24 21:08:29.803844,0 days 00:00:00.685003,squared_error,33,sqrt,1,12,best,TPESampler,COMPLETE
1275,0.7183195623582611,2025-04-24 21:08:29.738554,2025-04-24 21:08:30.880744,0 days 00:00:01.142190,squared_error,27,sqrt,1,7,best,TPESampler,COMPLETE
1276,0.6011863667970774,2025-04-24 21:08:29.841444,2025-04-24 21:08:30.743107,0 days 00:00:00.901663,squared_error,35,sqrt,1,11,best,TPESampler,COMPLETE
1277,0.7126558329407795,2025-04-24 21:08:29.994066,2025-04-24 21:08:31.160202,0 days 00:00:01.166136,squared_error,27,sqrt,3,13,best,TPESampler,COMPLETE
1278,0.7155308899518609,2025-04-24 21:08:31.057304,2025-04-24 21:08:31.993609,0 days 00:00:00.936305,squared_error,35,sqrt,3,13,best,TPESampler,COMPLETE
1279,0.7162306212015819,2025-04-24 21:08:31.109293,2025-04-24 21:08:32.057861,0 days 00:00:00.948568,squared_error,35,sqrt,3,12,best,TPESampler,COMPLETE
1280,0.5616498096723733,2025-04-24 21:08:31.643809,2025-04-24 21:08:32.366755,0 days 00:00:00.722946,squared_error,35,sqrt,1,12,best,TPESampler,COMPLETE
1281,0.6211073898298162,2025-04-24 21:08:32.244410,2025-04-24 21:08:33.274859,0 days 00:00:01.030449,squared_error,28,sqrt,1,11,best,TPESampler,COMPLETE
1282,0.6404563397184219,2025-04-24 21:08:32.310067,2025-04-24 21:08:33.241043,0 days 00:00:00.930976,squared_error,27,sqrt,1,11,best,TPESampler,COMPLETE
1283,0.6011863667970774,2025-04-24 21:08:32.621151,2025-04-24 21:08:33.598241,0 days 00:00:00.977090,squared_error,35,sqrt,1,11,best,TPESampler,COMPLETE
1284,0.9911402167769385,2025-04-24 21:08:33.464099,2025-04-24 21:08:34.202934,0 days 00:00:00.738835,squared_error,31,log2,4,9,best,TPESampler,COMPLETE
