number,value,datetime_start,datetime_complete,duration,params_criterion,params_max_depth,params_max_features,params_min_samples_leaf,params_min_samples_split,params_splitter,system_attrs_auto:sampler,state
2291,0.7246712212327447,2025-04-24 21:15:42.350381,2025-04-24 21:15:43.201243,0 days 00:00:00.850862,friedman_mse,35,sqrt,3,5,best,TPESampler,COMPLETE
2292,0.5522341372198587,2025-04-24 21:15:42.673314,2025-04-24 21:15:43.724320,0 days 00:00:01.051006,friedman_mse,35,sqrt,1,6,best,TPESampler,COMPLETE
2293,0.6467934412261577,2025-04-24 21:15:42.804308,2025-04-24 21:15:43.944601,0 days 00:00:01.140293,friedman_mse,23,sqrt,2,9,best,TPESampler,COMPLETE
2294,0.9962502283466568,2025-04-24 21:15:43.527060,2025-04-24 21:15:44.317922,0 days 00:00:00.790862,squared_error,16,log2,8,16,random,TPESampler,COMPLETE
2295,0.6186976381009088,2025-04-24 21:15:44.171654,2025-04-24 21:15:45.227175,0 days 00:00:01.055521,friedman_mse,30,sqrt,1,11,best,TPESampler,COMPLETE
2296,0.642967950902596,2025-04-24 21:15:44.278931,2025-04-24 21:15:45.382596,0 days 00:00:01.103665,friedman_mse,29,sqrt,1,9,best,TPESampler,COMPLETE
2297,0.6152703424484823,2025-04-24 21:15:44.582875,2025-04-24 21:15:45.798048,0 days 00:00:01.215173,friedman_mse,30,sqrt,2,5,best,TPESampler,COMPLETE
2298,0.7238353318092209,2025-04-24 21:15:45.482145,2025-04-24 21:15:46.455865,0 days 00:00:00.973720,absolute_error,35,sqrt,6,4,best,TPESampler,COMPLETE
2299,0.7258703503262229,2025-04-24 21:15:45.721647,2025-04-24 21:15:46.652727,0 days 00:00:00.931080,friedman_mse,35,sqrt,3,8,best,TPESampler,COMPLETE
2300,0.6751160047468913,2025-04-24 21:15:46.109068,2025-04-24 21:15:47.008251,0 days 00:00:00.899183,friedman_mse,27,log2,1,10,best,TPESampler,COMPLETE
2301,0.6446227396865948,2025-04-24 21:15:46.842783,2025-04-24 21:15:48.127992,0 days 00:00:01.285209,friedman_mse,29,sqrt,1,6,best,TPESampler,COMPLETE
2302,0.6659193936754176,2025-04-24 21:15:46.903589,2025-04-24 21:15:48.101811,0 days 00:00:01.198222,friedman_mse,35,sqrt,2,9,best,TPESampler,COMPLETE
2303,0.610300375570967,2025-04-24 21:15:47.364116,2025-04-24 21:15:48.262125,0 days 00:00:00.898009,friedman_mse,35,sqrt,1,5,best,TPESampler,COMPLETE
2304,0.6035982221692777,2025-04-24 21:15:48.340417,2025-04-24 21:15:49.320906,0 days 00:00:00.980489,friedman_mse,35,sqrt,1,2,best,TPESampler,COMPLETE
2305,0.7136764163204343,2025-04-24 21:15:48.377390,2025-04-24 21:15:50.101268,0 days 00:00:01.723878,friedman_mse,30,sqrt,3,8,best,TPESampler,COMPLETE
2306,0.632199359486392,2025-04-24 21:15:48.525438,2025-04-24 21:15:49.654130,0 days 00:00:01.128692,friedman_mse,30,sqrt,1,9,best,TPESampler,COMPLETE
2307,0.7406517311742006,2025-04-24 21:15:49.583085,2025-04-24 21:15:50.344926,0 days 00:00:00.761841,friedman_mse,30,sqrt,3,4,best,TPESampler,COMPLETE
2308,0.6446227396865948,2025-04-24 21:15:49.972398,2025-04-24 21:15:50.853968,0 days 00:00:00.881570,friedman_mse,29,sqrt,1,6,best,TPESampler,COMPLETE
2309,0.6082164367053395,2025-04-24 21:15:50.446895,2025-04-24 21:15:51.707161,0 days 00:00:01.260266,friedman_mse,35,sqrt,2,5,best,TPESampler,COMPLETE
2310,0.7350894647503713,2025-04-24 21:15:50.624712,2025-04-24 21:15:51.833382,0 days 00:00:01.208670,absolute_error,33,sqrt,9,14,best,TPESampler,COMPLETE
2311,0.6158166985156879,2025-04-24 21:15:51.527397,2025-04-24 21:15:52.348979,0 days 00:00:00.821582,friedman_mse,35,sqrt,1,9,best,TPESampler,COMPLETE
2312,0.7406517311742006,2025-04-24 21:15:51.985047,2025-04-24 21:15:53.060839,0 days 00:00:01.075792,friedman_mse,30,sqrt,3,6,best,TPESampler,COMPLETE
2313,0.675982364902162,2025-04-24 21:15:52.105658,2025-04-24 21:15:53.244561,0 days 00:00:01.138903,friedman_mse,35,sqrt,2,6,best,TPESampler,COMPLETE
2314,0.6123183697228924,2025-04-24 21:15:52.722836,2025-04-24 21:15:53.675464,0 days 00:00:00.952628,friedman_mse,30,sqrt,1,6,best,TPESampler,COMPLETE
2315,0.7400254842932275,2025-04-24 21:15:53.475909,2025-04-24 21:15:54.775275,0 days 00:00:01.299366,squared_error,31,log2,1,2,best,TPESampler,COMPLETE
2316,0.6158166985156879,2025-04-24 21:15:53.518866,2025-04-24 21:15:54.789940,0 days 00:00:01.271074,friedman_mse,35,sqrt,1,9,best,TPESampler,COMPLETE
2317,0.6227361853799519,2025-04-24 21:15:54.038461,2025-04-24 21:15:55.097202,0 days 00:00:01.058741,friedman_mse,30,sqrt,1,2,best,TPESampler,COMPLETE
2318,0.5981875505937236,2025-04-24 21:15:55.138443,2025-04-24 21:15:56.724095,0 days 00:00:01.585652,friedman_mse,35,sqrt,1,7,best,TPESampler,COMPLETE
2319,0.5981875505937236,2025-04-24 21:15:55.185081,2025-04-24 21:15:56.535075,0 days 00:00:01.349994,friedman_mse,35,sqrt,1,7,best,TPESampler,COMPLETE
2320,0.6248248219525877,2025-04-24 21:15:55.347043,2025-04-24 21:15:56.536499,0 days 00:00:01.189456,friedman_mse,35,sqrt,1,4,best,TPESampler,COMPLETE
2321,0.7246712212327447,2025-04-24 21:15:56.861582,2025-04-24 21:15:57.943768,0 days 00:00:01.082186,friedman_mse,35,sqrt,3,6,best,TPESampler,COMPLETE
2322,0.6733930761791806,2025-04-24 21:15:56.920174,2025-04-24 21:15:58.422691,0 days 00:00:01.502517,friedman_mse,35,log2,1,5,best,TPESampler,COMPLETE
2323,0.5522341372198587,2025-04-24 21:15:57.081875,2025-04-24 21:15:58.288048,0 days 00:00:01.206173,friedman_mse,35,sqrt,1,6,best,TPESampler,COMPLETE
2324,0.6123183697228924,2025-04-24 21:15:58.227314,2025-04-24 21:15:59.362582,0 days 00:00:01.135268,friedman_mse,30,sqrt,1,6,best,TPESampler,COMPLETE
2325,0.7246712212327447,2025-04-24 21:15:58.590948,2025-04-24 21:15:59.542912,0 days 00:00:00.951964,squared_error,34,sqrt,3,5,best,TPESampler,COMPLETE
2326,0.5522341372198587,2025-04-24 21:15:58.944251,2025-04-24 21:16:00.000969,0 days 00:00:01.056718,friedman_mse,35,sqrt,1,6,best,TPESampler,COMPLETE
2327,0.7246712212327447,2025-04-24 21:15:59.650383,2025-04-24 21:16:00.673234,0 days 00:00:01.022851,friedman_mse,35,sqrt,3,5,best,TPESampler,COMPLETE
2328,0.6450518978047365,2025-04-24 21:15:59.828479,2025-04-24 21:16:00.854622,0 days 00:00:01.026143,absolute_error,33,log2,1,9,best,TPESampler,COMPLETE
2329,0.6353164201088797,2025-04-24 21:16:00.341328,2025-04-24 21:16:01.289986,0 days 00:00:00.948658,absolute_error,30,sqrt,2,9,best,TPESampler,COMPLETE
2330,0.6015012618996902,2025-04-24 21:16:00.925626,2025-04-24 21:16:02.023268,0 days 00:00:01.097642,friedman_mse,30,sqrt,1,8,best,TPESampler,COMPLETE
2331,0.9737936641952643,2025-04-24 21:16:01.158921,2025-04-24 21:16:02.224917,0 days 00:00:01.065996,friedman_mse,12,sqrt,6,16,random,TPESampler,COMPLETE
2332,0.5986673267910899,2025-04-24 21:16:01.598543,2025-04-24 21:16:02.665370,0 days 00:00:01.066827,friedman_mse,30,sqrt,1,5,best,TPESampler,COMPLETE
2333,0.7186431077620621,2025-04-24 21:16:02.391946,2025-04-24 21:16:03.263609,0 days 00:00:00.871663,friedman_mse,35,sqrt,3,10,best,TPESampler,COMPLETE
2334,0.6248248219525877,2025-04-24 21:16:02.442654,2025-04-24 21:16:03.571385,0 days 00:00:01.128731,friedman_mse,35,sqrt,1,4,best,TPESampler,COMPLETE
2335,0.6327006073621034,2025-04-24 21:16:02.953182,2025-04-24 21:16:04.029004,0 days 00:00:01.075822,friedman_mse,35,sqrt,1,8,best,TPESampler,COMPLETE
2336,0.6539311476955247,2025-04-24 21:16:03.577147,2025-04-24 21:16:04.515047,0 days 00:00:00.937900,friedman_mse,30,sqrt,1,4,best,TPESampler,COMPLETE
2337,0.7246712212327447,2025-04-24 21:16:03.914785,2025-04-24 21:16:04.940347,0 days 00:00:01.025562,friedman_mse,35,sqrt,3,3,best,TPESampler,COMPLETE
2338,0.7185647807428723,2025-04-24 21:16:04.357126,2025-04-24 21:16:05.370915,0 days 00:00:01.013789,friedman_mse,29,sqrt,3,8,best,TPESampler,COMPLETE
2339,0.5981875505937236,2025-04-24 21:16:04.767749,2025-04-24 21:16:05.836270,0 days 00:00:01.068521,friedman_mse,35,sqrt,1,7,best,TPESampler,COMPLETE
2340,0.6015012618996902,2025-04-24 21:16:05.320146,2025-04-24 21:16:06.264179,0 days 00:00:00.944033,friedman_mse,30,sqrt,1,8,best,TPESampler,COMPLETE
2341,0.6794094981777127,2025-04-24 21:16:05.756980,2025-04-24 21:16:06.948653,0 days 00:00:01.191673,friedman_mse,29,sqrt,3,6,best,TPESampler,COMPLETE
2342,0.6728668312357213,2025-04-24 21:16:06.130281,2025-04-24 21:16:07.214540,0 days 00:00:01.084259,friedman_mse,29,sqrt,2,8,best,TPESampler,COMPLETE
2343,0.5986673267910899,2025-04-24 21:16:06.877985,2025-04-24 21:16:07.824458,0 days 00:00:00.946473,friedman_mse,30,sqrt,1,5,best,TPESampler,COMPLETE
2344,0.5522341372198587,2025-04-24 21:16:07.246937,2025-04-24 21:16:08.234597,0 days 00:00:00.987660,friedman_mse,35,sqrt,1,6,best,TPESampler,COMPLETE
2345,0.6568175016976607,2025-04-24 21:16:07.449855,2025-04-24 21:16:08.689051,0 days 00:00:01.239196,friedman_mse,35,sqrt,2,4,best,TPESampler,COMPLETE
2346,0.5981875505937236,2025-04-24 21:16:08.192831,2025-04-24 21:16:09.261931,0 days 00:00:01.069100,friedman_mse,35,sqrt,1,7,best,TPESampler,COMPLETE
2347,0.7542530233791589,2025-04-24 21:16:08.575285,2025-04-24 21:16:09.446429,0 days 00:00:00.871144,absolute_error,7,sqrt,7,13,best,TPESampler,COMPLETE
2348,0.6293599461146093,2025-04-24 21:16:08.978029,2025-04-24 21:16:09.837998,0 days 00:00:00.859969,friedman_mse,29,sqrt,2,4,best,TPESampler,COMPLETE
2349,0.6035982221692777,2025-04-24 21:16:09.543379,2025-04-24 21:16:10.591356,0 days 00:00:01.047977,friedman_mse,35,sqrt,1,2,best,TPESampler,COMPLETE
2350,0.658314798542652,2025-04-24 21:16:09.680298,2025-04-24 21:16:10.757678,0 days 00:00:01.077380,friedman_mse,24,sqrt,1,8,best,TPESampler,COMPLETE
2351,0.6659193936754176,2025-04-24 21:16:10.185941,2025-04-24 21:16:11.047708,0 days 00:00:00.861767,friedman_mse,35,sqrt,2,9,best,TPESampler,COMPLETE
2352,0.9403191562745545,2025-04-24 21:16:10.938660,2025-04-24 21:16:11.935178,0 days 00:00:00.996518,squared_error,15,log2,1,3,best,TPESampler,COMPLETE
2353,0.954452680836701,2025-04-24 21:16:11.006968,2025-04-24 21:16:11.932309,0 days 00:00:00.925341,absolute_error,2,sqrt,3,9,random,TPESampler,COMPLETE
2354,0.610300375570967,2025-04-24 21:16:11.570341,2025-04-24 21:16:12.542644,0 days 00:00:00.972303,friedman_mse,35,sqrt,1,5,best,TPESampler,COMPLETE
2355,0.7246712212327447,2025-04-24 21:16:12.188249,2025-04-24 21:16:13.280714,0 days 00:00:01.092465,friedman_mse,35,sqrt,3,6,best,TPESampler,COMPLETE
2356,0.6039730949864337,2025-04-24 21:16:12.223044,2025-04-24 21:16:13.288230,0 days 00:00:01.065186,friedman_mse,24,sqrt,1,5,best,TPESampler,COMPLETE
2357,0.7258703503262229,2025-04-24 21:16:12.882800,2025-04-24 21:16:13.688467,0 days 00:00:00.805667,friedman_mse,35,sqrt,3,8,best,TPESampler,COMPLETE
2358,0.7246712212327447,2025-04-24 21:16:13.547710,2025-04-24 21:16:14.579873,0 days 00:00:01.032163,friedman_mse,35,sqrt,3,2,best,TPESampler,COMPLETE
2359,0.6446227396865948,2025-04-24 21:16:13.606111,2025-04-24 21:16:14.781505,0 days 00:00:01.175394,friedman_mse,29,sqrt,1,6,best,TPESampler,COMPLETE
2360,0.610300375570967,2025-04-24 21:16:14.078257,2025-04-24 21:16:15.054816,0 days 00:00:00.976559,friedman_mse,35,sqrt,1,5,best,TPESampler,COMPLETE
2361,0.5981875505937236,2025-04-24 21:16:14.992610,2025-04-24 21:16:16.087739,0 days 00:00:01.095129,friedman_mse,35,sqrt,1,7,best,TPESampler,COMPLETE
2362,0.6011863667970774,2025-04-24 21:16:14.999129,2025-04-24 21:16:16.229787,0 days 00:00:01.230658,friedman_mse,35,sqrt,1,11,best,TPESampler,COMPLETE
2363,0.6540978000576883,2025-04-24 21:16:15.433394,2025-04-24 21:16:16.547343,0 days 00:00:01.113949,friedman_mse,29,sqrt,1,7,best,TPESampler,COMPLETE
2364,0.6551631182803123,2025-04-24 21:16:16.440467,2025-04-24 21:16:17.578437,0 days 00:00:01.137970,friedman_mse,35,sqrt,2,7,best,TPESampler,COMPLETE
2365,0.964903983025146,2025-04-24 21:16:16.505137,2025-04-24 21:16:17.576913,0 days 00:00:01.071776,absolute_error,7,log2,7,14,best,TPESampler,COMPLETE
2366,0.9301433635917724,2025-04-24 21:16:17.260569,2025-04-24 21:16:18.202756,0 days 00:00:00.942187,friedman_mse,8,sqrt,2,17,random,TPESampler,COMPLETE
2367,0.6880538529608641,2025-04-24 21:16:17.800326,2025-04-24 21:16:18.675107,0 days 00:00:00.874781,friedman_mse,23,sqrt,3,5,best,TPESampler,COMPLETE
2368,0.9962502283466568,2025-04-24 21:16:17.847867,2025-04-24 21:16:18.916692,0 days 00:00:01.068825,friedman_mse,22,log2,7,10,random,TPESampler,COMPLETE
2369,0.5986673267910899,2025-04-24 21:16:18.554816,2025-04-24 21:16:19.367815,0 days 00:00:00.812999,friedman_mse,30,sqrt,1,5,best,TPESampler,COMPLETE
2370,0.5522341372198587,2025-04-24 21:16:19.010407,2025-04-24 21:16:20.183215,0 days 00:00:01.172808,friedman_mse,35,sqrt,1,6,best,TPESampler,COMPLETE
2371,0.9738497171248582,2025-04-24 21:16:19.218926,2025-04-24 21:16:20.489985,0 days 00:00:01.271059,squared_error,2,sqrt,10,19,random,TPESampler,COMPLETE
2372,0.6361895113592757,2025-04-24 21:16:19.654621,2025-04-24 21:16:20.994578,0 days 00:00:01.339957,friedman_mse,29,sqrt,1,4,best,TPESampler,COMPLETE
2373,0.6581282397926295,2025-04-24 21:16:20.804248,2025-04-24 21:16:22.190941,0 days 00:00:01.386693,friedman_mse,30,sqrt,2,6,best,TPESampler,COMPLETE
2374,0.6551631182803123,2025-04-24 21:16:20.926761,2025-04-24 21:16:22.586303,0 days 00:00:01.659542,friedman_mse,35,sqrt,2,7,best,TPESampler,COMPLETE
2375,0.6327006073621034,2025-04-24 21:16:21.471308,2025-04-24 21:16:22.553884,0 days 00:00:01.082576,friedman_mse,35,sqrt,1,8,best,TPESampler,COMPLETE
2376,0.6015012618996902,2025-04-24 21:16:22.505147,2025-04-24 21:16:23.279071,0 days 00:00:00.773924,friedman_mse,30,sqrt,1,8,best,TPESampler,COMPLETE
2377,0.6248248219525877,2025-04-24 21:16:22.753580,2025-04-24 21:16:23.757476,0 days 00:00:01.003896,friedman_mse,35,sqrt,1,4,best,TPESampler,COMPLETE
2378,0.7246712212327447,2025-04-24 21:16:22.906434,2025-04-24 21:16:23.821151,0 days 00:00:00.914717,friedman_mse,35,sqrt,3,5,best,TPESampler,COMPLETE
2379,0.971526010237953,2025-04-24 21:16:23.660378,2025-04-24 21:16:24.816412,0 days 00:00:01.156034,absolute_error,27,log2,5,4,random,TPESampler,COMPLETE
2380,0.5522341372198587,2025-04-24 21:16:24.008994,2025-04-24 21:16:25.136101,0 days 00:00:01.127107,friedman_mse,35,sqrt,1,6,best,TPESampler,COMPLETE
2381,0.5522341372198587,2025-04-24 21:16:24.197982,2025-04-24 21:16:25.402652,0 days 00:00:01.204670,friedman_mse,35,sqrt,1,6,best,TPESampler,COMPLETE
2382,0.6451831437449033,2025-04-24 21:16:25.078353,2025-04-24 21:16:26.062954,0 days 00:00:00.984601,friedman_mse,29,sqrt,1,8,best,TPESampler,COMPLETE
2383,0.6324378944326069,2025-04-24 21:16:25.417256,2025-04-24 21:16:26.359731,0 days 00:00:00.942475,absolute_error,35,sqrt,2,7,best,TPESampler,COMPLETE
2384,0.9962502283466568,2025-04-24 21:16:25.727970,2025-04-24 21:16:26.746287,0 days 00:00:01.018317,friedman_mse,34,log2,8,11,random,TPESampler,COMPLETE
2385,0.7406517311742006,2025-04-24 21:16:26.361872,2025-04-24 21:16:27.479507,0 days 00:00:01.117635,friedman_mse,30,sqrt,3,6,best,TPESampler,COMPLETE
2386,0.6539311476955247,2025-04-24 21:16:26.700964,2025-04-24 21:16:27.685295,0 days 00:00:00.984331,friedman_mse,30,sqrt,1,4,best,TPESampler,COMPLETE
2387,0.5990037672372435,2025-04-24 21:16:27.074279,2025-04-24 21:16:28.045558,0 days 00:00:00.971279,friedman_mse,30,sqrt,1,7,best,TPESampler,COMPLETE
2388,0.5978929531338989,2025-04-24 21:16:27.751064,2025-04-24 21:16:28.775644,0 days 00:00:01.024580,friedman_mse,35,sqrt,1,10,best,TPESampler,COMPLETE
2389,0.6975869412010501,2025-04-24 21:16:28.043987,2025-04-24 21:16:28.930740,0 days 00:00:00.886753,friedman_mse,29,log2,2,6,best,TPESampler,COMPLETE
2390,0.7113263276640378,2025-04-24 21:16:28.391422,2025-04-24 21:16:29.412167,0 days 00:00:01.020745,friedman_mse,35,sqrt,3,7,best,TPESampler,COMPLETE
2391,0.6035982221692777,2025-04-24 21:16:29.043169,2025-04-24 21:16:30.091014,0 days 00:00:01.047845,friedman_mse,35,sqrt,1,2,best,TPESampler,COMPLETE
2392,0.6248248219525877,2025-04-24 21:16:29.265125,2025-04-24 21:16:30.246907,0 days 00:00:00.981782,friedman_mse,35,sqrt,1,4,best,TPESampler,COMPLETE
2393,0.5986673267910899,2025-04-24 21:16:29.755175,2025-04-24 21:16:30.571271,0 days 00:00:00.816096,friedman_mse,30,sqrt,1,5,best,TPESampler,COMPLETE
2394,0.7406517311742006,2025-04-24 21:16:30.529170,2025-04-24 21:16:31.587424,0 days 00:00:01.058254,friedman_mse,30,sqrt,3,2,best,TPESampler,COMPLETE
2395,0.6689822961370628,2025-04-24 21:16:30.569267,2025-04-24 21:16:31.632651,0 days 00:00:01.063384,friedman_mse,30,sqrt,2,7,best,TPESampler,COMPLETE
2396,0.7391373405534509,2025-04-24 21:16:31.294556,2025-04-24 21:16:32.231300,0 days 00:00:00.936744,friedman_mse,29,log2,1,6,best,TPESampler,COMPLETE
2397,0.5990037672372435,2025-04-24 21:16:31.830030,2025-04-24 21:16:33.032612,0 days 00:00:01.202582,friedman_mse,30,sqrt,1,7,best,TPESampler,COMPLETE
2398,0.6327006073621034,2025-04-24 21:16:31.990164,2025-04-24 21:16:33.149353,0 days 00:00:01.159189,friedman_mse,35,sqrt,1,8,best,TPESampler,COMPLETE
2399,0.7406517311742006,2025-04-24 21:16:32.748273,2025-04-24 21:16:33.438512,0 days 00:00:00.690239,friedman_mse,30,sqrt,3,6,best,TPESampler,COMPLETE
2400,0.7113263276640378,2025-04-24 21:16:33.312321,2025-04-24 21:16:34.387440,0 days 00:00:01.075119,friedman_mse,35,sqrt,3,7,best,TPESampler,COMPLETE
2401,0.9964161010826412,2025-04-24 21:16:33.375974,2025-04-24 21:16:34.560674,0 days 00:00:01.184700,squared_error,15,log2,3,11,random,TPESampler,COMPLETE
2402,0.6103199910742486,2025-04-24 21:16:33.748715,2025-04-24 21:16:34.843879,0 days 00:00:01.095164,absolute_error,28,sqrt,2,5,best,TPESampler,COMPLETE
2403,0.610300375570967,2025-04-24 21:16:34.622495,2025-04-24 21:16:35.576548,0 days 00:00:00.954053,friedman_mse,35,sqrt,1,5,best,TPESampler,COMPLETE
2404,0.610300375570967,2025-04-24 21:16:34.835480,2025-04-24 21:16:35.823967,0 days 00:00:00.988487,friedman_mse,35,sqrt,1,5,best,TPESampler,COMPLETE
2405,0.6327006073621034,2025-04-24 21:16:35.206820,2025-04-24 21:16:36.244158,0 days 00:00:01.037338,friedman_mse,35,sqrt,1,8,best,TPESampler,COMPLETE
2406,0.610300375570967,2025-04-24 21:16:35.886150,2025-04-24 21:16:36.921488,0 days 00:00:01.035338,friedman_mse,35,sqrt,1,5,best,TPESampler,COMPLETE
2407,0.649573014390662,2025-04-24 21:16:36.109403,2025-04-24 21:16:37.102851,0 days 00:00:00.993448,friedman_mse,35,sqrt,2,8,best,TPESampler,COMPLETE
2408,0.6361895113592757,2025-04-24 21:16:36.565260,2025-04-24 21:16:37.412327,0 days 00:00:00.847067,friedman_mse,29,sqrt,1,4,best,TPESampler,COMPLETE
2409,0.9928365741172522,2025-04-24 21:16:37.374969,2025-04-24 21:16:38.464379,0 days 00:00:01.089410,squared_error,12,log2,5,14,best,TPESampler,COMPLETE
2410,0.6082164367053395,2025-04-24 21:16:37.387151,2025-04-24 21:16:38.570218,0 days 00:00:01.183067,friedman_mse,35,sqrt,2,5,best,TPESampler,COMPLETE
2411,0.7246712212327447,2025-04-24 21:16:38.165841,2025-04-24 21:16:38.904852,0 days 00:00:00.739011,friedman_mse,35,sqrt,3,4,best,TPESampler,COMPLETE
2412,0.7182589720793523,2025-04-24 21:16:38.794547,2025-04-24 21:16:39.855197,0 days 00:00:01.060650,friedman_mse,30,sqrt,3,9,best,TPESampler,COMPLETE
2413,0.5981875505937236,2025-04-24 21:16:38.865469,2025-04-24 21:16:39.930983,0 days 00:00:01.065514,friedman_mse,35,sqrt,1,7,best,TPESampler,COMPLETE
2414,0.6123183697228924,2025-04-24 21:16:39.463605,2025-04-24 21:16:40.214688,0 days 00:00:00.751083,friedman_mse,30,sqrt,1,6,best,TPESampler,COMPLETE
2415,0.632199359486392,2025-04-24 21:16:40.173294,2025-04-24 21:16:40.981764,0 days 00:00:00.808470,friedman_mse,30,sqrt,1,9,best,TPESampler,COMPLETE
2416,0.6539311476955247,2025-04-24 21:16:40.221944,2025-04-24 21:16:41.406595,0 days 00:00:01.184651,friedman_mse,30,sqrt,1,4,best,TPESampler,COMPLETE
2417,0.610300375570967,2025-04-24 21:16:40.442763,2025-04-24 21:16:41.551127,0 days 00:00:01.108364,friedman_mse,35,sqrt,1,5,best,TPESampler,COMPLETE
2418,0.6158166985156879,2025-04-24 21:16:41.357624,2025-04-24 21:16:42.278255,0 days 00:00:00.920631,friedman_mse,35,sqrt,1,9,best,TPESampler,COMPLETE
2419,0.675982364902162,2025-04-24 21:16:41.659687,2025-04-24 21:16:42.568595,0 days 00:00:00.908908,friedman_mse,35,sqrt,2,6,best,TPESampler,COMPLETE
2420,0.6327006073621034,2025-04-24 21:16:41.936075,2025-04-24 21:16:42.913023,0 days 00:00:00.976948,friedman_mse,35,sqrt,1,8,best,TPESampler,COMPLETE
2421,0.5750216425928508,2025-04-24 21:16:42.567635,2025-04-24 21:16:43.548409,0 days 00:00:00.980774,squared_error,33,sqrt,1,5,best,TPESampler,COMPLETE
2422,0.8025318233554969,2025-04-24 21:16:43.012749,2025-04-24 21:16:43.891517,0 days 00:00:00.878768,squared_error,28,sqrt,9,11,best,TPESampler,COMPLETE
2423,0.6794094981777127,2025-04-24 21:16:43.313620,2025-04-24 21:16:44.376659,0 days 00:00:01.063039,friedman_mse,29,sqrt,3,4,best,TPESampler,COMPLETE
2424,0.6123183697228924,2025-04-24 21:16:43.886178,2025-04-24 21:16:44.784035,0 days 00:00:00.897857,friedman_mse,30,sqrt,1,6,best,TPESampler,COMPLETE
2425,0.6540978000576883,2025-04-24 21:16:44.255356,2025-04-24 21:16:45.250218,0 days 00:00:00.994862,friedman_mse,29,sqrt,1,7,best,TPESampler,COMPLETE
2426,0.9968064910218514,2025-04-24 21:16:44.645524,2025-04-24 21:16:45.533654,0 days 00:00:00.888130,friedman_mse,21,log2,3,20,random,TPESampler,COMPLETE
2427,0.6837675836256646,2025-04-24 21:16:45.160570,2025-04-24 21:16:46.017721,0 days 00:00:00.857151,squared_error,17,sqrt,1,7,best,TPESampler,COMPLETE
2428,0.6564909004043457,2025-04-24 21:16:45.629762,2025-04-24 21:16:46.676618,0 days 00:00:01.046856,friedman_mse,23,sqrt,1,10,best,TPESampler,COMPLETE
2429,0.637785899500027,2025-04-24 21:16:45.873361,2025-04-24 21:16:46.953042,0 days 00:00:01.079681,friedman_mse,29,sqrt,1,2,best,TPESampler,COMPLETE
2430,0.610300375570967,2025-04-24 21:16:46.305711,2025-04-24 21:16:47.375372,0 days 00:00:01.069661,friedman_mse,35,sqrt,1,5,best,TPESampler,COMPLETE
2431,0.7246712212327447,2025-04-24 21:16:47.018292,2025-04-24 21:16:47.989952,0 days 00:00:00.971660,friedman_mse,35,sqrt,3,5,best,TPESampler,COMPLETE
2432,0.5522341372198587,2025-04-24 21:16:47.243970,2025-04-24 21:16:48.257516,0 days 00:00:01.013546,friedman_mse,35,sqrt,1,6,best,TPESampler,COMPLETE
2433,0.5925119263261721,2025-04-24 21:16:47.732482,2025-04-24 21:16:48.534664,0 days 00:00:00.802182,friedman_mse,35,sqrt,1,3,best,TPESampler,COMPLETE
2434,0.9747088420477746,2025-04-24 21:16:48.437613,2025-04-24 21:16:49.548133,0 days 00:00:01.110520,squared_error,30,log2,2,8,random,TPESampler,COMPLETE
