number,value,datetime_start,datetime_complete,duration,params_criterion,params_max_depth,params_max_features,params_min_samples_leaf,params_min_samples_split,params_splitter,system_attrs_auto:sampler,state
2003,0.649573014390662,2025-04-24 21:13:35.262591,2025-04-24 21:13:36.149453,0 days 00:00:00.886862,friedman_mse,35,sqrt,2,8,best,TPESampler,COMPLETE
2004,0.6158166985156879,2025-04-24 21:13:35.625076,2025-04-24 21:13:36.463642,0 days 00:00:00.838566,friedman_mse,35,sqrt,1,9,best,TPESampler,COMPLETE
2005,0.9583528309130763,2025-04-24 21:13:36.292618,2025-04-24 21:13:37.158967,0 days 00:00:00.866349,squared_error,2,sqrt,4,12,best,TPESampler,COMPLETE
2006,0.6551631182803123,2025-04-24 21:13:36.395764,2025-04-24 21:13:37.431879,0 days 00:00:01.036115,friedman_mse,35,sqrt,2,7,best,TPESampler,COMPLETE
2007,0.9733091069111984,2025-04-24 21:13:36.759784,2025-04-24 21:13:37.847279,0 days 00:00:01.087495,friedman_mse,2,sqrt,2,18,best,TPESampler,COMPLETE
2008,0.9996614637005212,2025-04-24 21:13:37.462186,2025-04-24 21:13:38.449070,0 days 00:00:00.986884,squared_error,4,log2,2,4,best,TPESampler,COMPLETE
2009,0.6468159413546908,2025-04-24 21:13:37.699324,2025-04-24 21:13:38.699091,0 days 00:00:00.999767,friedman_mse,30,sqrt,2,3,best,TPESampler,COMPLETE
2010,0.6518691584550678,2025-04-24 21:13:38.172061,2025-04-24 21:13:38.943747,0 days 00:00:00.771686,friedman_mse,29,sqrt,1,5,best,TPESampler,COMPLETE
2011,0.610300375570967,2025-04-24 21:13:38.752284,2025-04-24 21:13:39.692061,0 days 00:00:00.939777,friedman_mse,35,sqrt,1,5,best,TPESampler,COMPLETE
2012,0.6568175016976607,2025-04-24 21:13:39.049354,2025-04-24 21:13:39.883776,0 days 00:00:00.834422,friedman_mse,35,sqrt,2,2,best,TPESampler,COMPLETE
2013,0.6346783462746558,2025-04-24 21:13:39.397208,2025-04-24 21:13:40.206752,0 days 00:00:00.809544,friedman_mse,30,sqrt,1,10,best,TPESampler,COMPLETE
2014,0.6327006073621034,2025-04-24 21:13:40.076860,2025-04-24 21:13:41.042890,0 days 00:00:00.966030,friedman_mse,35,sqrt,1,8,best,TPESampler,COMPLETE
2015,0.6327006073621034,2025-04-24 21:13:40.168956,2025-04-24 21:13:41.147060,0 days 00:00:00.978104,friedman_mse,35,sqrt,1,8,best,TPESampler,COMPLETE
2016,0.9928365741172522,2025-04-24 21:13:40.728005,2025-04-24 21:13:41.468281,0 days 00:00:00.740276,squared_error,35,log2,10,15,best,TPESampler,COMPLETE
2017,0.6248248219525877,2025-04-24 21:13:41.302930,2025-04-24 21:13:42.486955,0 days 00:00:01.184025,friedman_mse,35,sqrt,1,4,best,TPESampler,COMPLETE
2018,0.6123183697228924,2025-04-24 21:13:41.348099,2025-04-24 21:13:42.423364,0 days 00:00:01.075265,friedman_mse,30,sqrt,1,6,best,TPESampler,COMPLETE
2019,0.6805363692892722,2025-04-24 21:13:41.795118,2025-04-24 21:13:42.630217,0 days 00:00:00.835099,friedman_mse,29,sqrt,1,3,best,TPESampler,COMPLETE
2020,0.7166800751920849,2025-04-24 21:13:42.707428,2025-04-24 21:13:43.660242,0 days 00:00:00.952814,friedman_mse,31,sqrt,3,6,best,TPESampler,COMPLETE
2021,0.6581282397926295,2025-04-24 21:13:42.758034,2025-04-24 21:13:44.152054,0 days 00:00:01.394020,friedman_mse,30,sqrt,2,6,best,TPESampler,COMPLETE
2022,0.7186431077620621,2025-04-24 21:13:42.890178,2025-04-24 21:13:43.984982,0 days 00:00:01.094804,friedman_mse,35,sqrt,3,10,best,TPESampler,COMPLETE
2023,0.7246712212327447,2025-04-24 21:13:43.924796,2025-04-24 21:13:44.598827,0 days 00:00:00.674031,friedman_mse,35,sqrt,3,6,best,TPESampler,COMPLETE
2024,0.7342842462406697,2025-04-24 21:13:44.287932,2025-04-24 21:13:45.230646,0 days 00:00:00.942714,absolute_error,11,sqrt,7,4,best,TPESampler,COMPLETE
2025,0.6015012618996902,2025-04-24 21:13:44.452631,2025-04-24 21:13:45.439371,0 days 00:00:00.986740,friedman_mse,30,sqrt,1,8,best,TPESampler,COMPLETE
2026,0.6123183697228924,2025-04-24 21:13:44.910602,2025-04-24 21:13:45.817327,0 days 00:00:00.906725,friedman_mse,30,sqrt,1,6,best,TPESampler,COMPLETE
2027,0.6082164367053395,2025-04-24 21:13:45.502453,2025-04-24 21:13:46.528343,0 days 00:00:01.025890,friedman_mse,35,sqrt,2,5,best,TPESampler,COMPLETE
2028,0.5522341372198587,2025-04-24 21:13:45.686225,2025-04-24 21:13:46.699445,0 days 00:00:01.013220,friedman_mse,35,sqrt,1,6,best,TPESampler,COMPLETE
2029,0.7351467180525566,2025-04-24 21:13:46.164751,2025-04-24 21:13:47.031816,0 days 00:00:00.867065,squared_error,32,sqrt,3,4,best,TPESampler,COMPLETE
2030,0.6082164367053395,2025-04-24 21:13:46.890528,2025-04-24 21:13:47.743304,0 days 00:00:00.852776,friedman_mse,35,sqrt,2,5,best,TPESampler,COMPLETE
2031,0.5522341372198587,2025-04-24 21:13:46.978797,2025-04-24 21:13:47.902935,0 days 00:00:00.924138,friedman_mse,35,sqrt,1,6,best,TPESampler,COMPLETE
2032,0.5959603272821926,2025-04-24 21:13:47.363782,2025-04-24 21:13:48.205212,0 days 00:00:00.841430,friedman_mse,31,sqrt,1,3,best,TPESampler,COMPLETE
2033,0.675982364902162,2025-04-24 21:13:48.102472,2025-04-24 21:13:49.049515,0 days 00:00:00.947043,friedman_mse,35,sqrt,2,6,best,TPESampler,COMPLETE
2034,0.6158166985156879,2025-04-24 21:13:48.171481,2025-04-24 21:13:49.384128,0 days 00:00:01.212647,friedman_mse,35,sqrt,1,9,best,TPESampler,COMPLETE
2035,0.5978929531338989,2025-04-24 21:13:48.499906,2025-04-24 21:13:49.569537,0 days 00:00:01.069631,friedman_mse,35,sqrt,1,10,best,TPESampler,COMPLETE
2036,0.7196483853662857,2025-04-24 21:13:49.344567,2025-04-24 21:13:50.177162,0 days 00:00:00.832595,friedman_mse,30,sqrt,3,7,best,TPESampler,COMPLETE
2037,0.6728668312357213,2025-04-24 21:13:49.635690,2025-04-24 21:13:50.767768,0 days 00:00:01.132078,friedman_mse,29,sqrt,2,8,best,TPESampler,COMPLETE
2038,0.6568175016976607,2025-04-24 21:13:49.837022,2025-04-24 21:13:50.965542,0 days 00:00:01.128520,friedman_mse,35,sqrt,2,4,best,TPESampler,COMPLETE
2039,0.6248248219525877,2025-04-24 21:13:50.512957,2025-04-24 21:13:51.712929,0 days 00:00:01.199972,friedman_mse,35,sqrt,1,4,best,TPESampler,COMPLETE
2040,0.6426396730909659,2025-04-24 21:13:51.055373,2025-04-24 21:13:52.034347,0 days 00:00:00.978974,friedman_mse,31,sqrt,1,7,best,TPESampler,COMPLETE
2041,0.9968066590016214,2025-04-24 21:13:51.197035,2025-04-24 21:13:52.281306,0 days 00:00:01.084271,friedman_mse,35,log2,10,17,random,TPESampler,COMPLETE
2042,0.9962502283466568,2025-04-24 21:13:51.991672,2025-04-24 21:13:52.751432,0 days 00:00:00.759760,friedman_mse,17,log2,8,15,random,TPESampler,COMPLETE
2043,0.7246712212327447,2025-04-24 21:13:52.403881,2025-04-24 21:13:53.414666,0 days 00:00:01.010785,friedman_mse,35,sqrt,3,6,best,TPESampler,COMPLETE
2044,0.6148732347535573,2025-04-24 21:13:52.582458,2025-04-24 21:13:53.706047,0 days 00:00:01.123589,absolute_error,35,sqrt,2,3,best,TPESampler,COMPLETE
2045,0.610300375570967,2025-04-24 21:13:53.084209,2025-04-24 21:13:53.824943,0 days 00:00:00.740734,friedman_mse,35,sqrt,1,5,best,TPESampler,COMPLETE
2046,0.610300375570967,2025-04-24 21:13:53.741536,2025-04-24 21:13:54.469128,0 days 00:00:00.727592,squared_error,35,sqrt,1,5,best,TPESampler,COMPLETE
2047,0.5981875505937236,2025-04-24 21:13:53.960199,2025-04-24 21:13:54.950221,0 days 00:00:00.990022,friedman_mse,35,sqrt,1,7,best,TPESampler,COMPLETE
2048,0.5990037672372435,2025-04-24 21:13:54.121037,2025-04-24 21:13:55.057592,0 days 00:00:00.936555,friedman_mse,30,sqrt,1,7,best,TPESampler,COMPLETE
2049,0.610300375570967,2025-04-24 21:13:54.771229,2025-04-24 21:13:55.508944,0 days 00:00:00.737715,friedman_mse,35,sqrt,1,5,best,TPESampler,COMPLETE
2050,0.6626098337689691,2025-04-24 21:13:55.207079,2025-04-24 21:13:56.131577,0 days 00:00:00.924498,friedman_mse,23,sqrt,1,5,best,TPESampler,COMPLETE
2051,0.7258703503262229,2025-04-24 21:13:55.373683,2025-04-24 21:13:56.311404,0 days 00:00:00.937721,friedman_mse,35,sqrt,3,8,best,TPESampler,COMPLETE
2052,0.6327006073621034,2025-04-24 21:13:55.808159,2025-04-24 21:13:56.622140,0 days 00:00:00.813981,friedman_mse,35,sqrt,1,8,best,TPESampler,COMPLETE
2053,0.7280159561755103,2025-04-24 21:13:56.395424,2025-04-24 21:13:57.418841,0 days 00:00:01.023417,friedman_mse,27,log2,1,5,best,TPESampler,COMPLETE
2054,0.9545020982502701,2025-04-24 21:13:56.572569,2025-04-24 21:13:57.659596,0 days 00:00:01.087027,friedman_mse,27,log2,3,5,best,TPESampler,COMPLETE
2055,0.9928365741172522,2025-04-24 21:13:57.082569,2025-04-24 21:13:58.058224,0 days 00:00:00.975655,squared_error,26,log2,6,3,best,TPESampler,COMPLETE
2056,0.9779823069244629,2025-04-24 21:13:57.681289,2025-04-24 21:13:58.677138,0 days 00:00:00.995849,absolute_error,14,log2,1,8,random,TPESampler,COMPLETE
2057,0.5986673267910899,2025-04-24 21:13:57.922399,2025-04-24 21:13:59.010026,0 days 00:00:01.087627,friedman_mse,30,sqrt,1,5,best,TPESampler,COMPLETE
2058,0.6539311476955247,2025-04-24 21:13:58.387286,2025-04-24 21:13:59.303600,0 days 00:00:00.916314,friedman_mse,30,sqrt,1,4,best,TPESampler,COMPLETE
2059,0.6035982221692777,2025-04-24 21:13:58.956143,2025-04-24 21:13:59.644984,0 days 00:00:00.688841,friedman_mse,35,sqrt,1,2,best,TPESampler,COMPLETE
2060,0.5981875505937236,2025-04-24 21:13:59.372080,2025-04-24 21:14:00.541259,0 days 00:00:01.169179,friedman_mse,35,sqrt,1,7,best,TPESampler,COMPLETE
2061,0.6327006073621034,2025-04-24 21:13:59.603047,2025-04-24 21:14:00.573570,0 days 00:00:00.970523,friedman_mse,35,sqrt,1,8,best,TPESampler,COMPLETE
2062,0.610300375570967,2025-04-24 21:13:59.880260,2025-04-24 21:14:00.790241,0 days 00:00:00.909981,friedman_mse,35,sqrt,1,5,best,TPESampler,COMPLETE
2063,0.632619855875025,2025-04-24 21:14:00.739423,2025-04-24 21:14:01.630643,0 days 00:00:00.891220,friedman_mse,28,sqrt,1,9,best,TPESampler,COMPLETE
2064,0.6468159413546908,2025-04-24 21:14:01.026468,2025-04-24 21:14:02.130765,0 days 00:00:01.104297,friedman_mse,30,sqrt,2,4,best,TPESampler,COMPLETE
2065,0.649573014390662,2025-04-24 21:14:01.291197,2025-04-24 21:14:02.229436,0 days 00:00:00.938239,friedman_mse,35,sqrt,2,8,best,TPESampler,COMPLETE
2066,0.5990037672372435,2025-04-24 21:14:01.925527,2025-04-24 21:14:02.645918,0 days 00:00:00.720391,friedman_mse,30,sqrt,1,7,best,TPESampler,COMPLETE
2067,0.5522341372198587,2025-04-24 21:14:02.407299,2025-04-24 21:14:03.218515,0 days 00:00:00.811216,friedman_mse,35,sqrt,1,6,best,TPESampler,COMPLETE
2068,0.7136764163204343,2025-04-24 21:14:02.458109,2025-04-24 21:14:03.456818,0 days 00:00:00.998709,friedman_mse,30,sqrt,3,8,best,TPESampler,COMPLETE
2069,0.5522341372198587,2025-04-24 21:14:02.915130,2025-04-24 21:14:03.735316,0 days 00:00:00.820186,friedman_mse,35,sqrt,1,6,best,TPESampler,COMPLETE
2070,0.610300375570967,2025-04-24 21:14:03.681070,2025-04-24 21:14:04.620189,0 days 00:00:00.939119,friedman_mse,35,sqrt,1,5,best,TPESampler,COMPLETE
2071,0.7406517311742006,2025-04-24 21:14:03.686373,2025-04-24 21:14:04.830792,0 days 00:00:01.144419,friedman_mse,30,sqrt,3,5,best,TPESampler,COMPLETE
2072,0.5986673267910899,2025-04-24 21:14:04.009608,2025-04-24 21:14:05.043232,0 days 00:00:01.033624,friedman_mse,30,sqrt,1,5,best,TPESampler,COMPLETE
2073,0.6346783462746558,2025-04-24 21:14:04.885733,2025-04-24 21:14:05.855770,0 days 00:00:00.970037,friedman_mse,30,sqrt,1,10,best,TPESampler,COMPLETE
2074,0.675982364902162,2025-04-24 21:14:05.086137,2025-04-24 21:14:06.527916,0 days 00:00:01.441779,friedman_mse,35,sqrt,2,6,best,TPESampler,COMPLETE
2075,0.7246712212327447,2025-04-24 21:14:05.278965,2025-04-24 21:14:06.359544,0 days 00:00:01.080579,friedman_mse,35,sqrt,3,3,best,TPESampler,COMPLETE
2076,0.5990037672372435,2025-04-24 21:14:06.155616,2025-04-24 21:14:07.079366,0 days 00:00:00.923750,friedman_mse,30,sqrt,1,7,best,TPESampler,COMPLETE
2077,0.7155967574884852,2025-04-24 21:14:06.795262,2025-04-24 21:14:08.337267,0 days 00:00:01.542005,friedman_mse,29,sqrt,3,7,best,TPESampler,COMPLETE
2078,0.6794094981777127,2025-04-24 21:14:06.849223,2025-04-24 21:14:08.254011,0 days 00:00:01.404788,friedman_mse,29,sqrt,3,5,best,TPESampler,COMPLETE
2079,0.5986673267910899,2025-04-24 21:14:07.438035,2025-04-24 21:14:08.585067,0 days 00:00:01.147032,friedman_mse,30,sqrt,1,5,best,TPESampler,COMPLETE
2080,0.6539311476955247,2025-04-24 21:14:08.622837,2025-04-24 21:14:09.989655,0 days 00:00:01.366818,friedman_mse,30,sqrt,1,4,best,TPESampler,COMPLETE
2081,0.7106696395891989,2025-04-24 21:14:08.680860,2025-04-24 21:14:09.887083,0 days 00:00:01.206223,friedman_mse,35,sqrt,3,9,best,TPESampler,COMPLETE
2082,0.6035982221692777,2025-04-24 21:14:08.797488,2025-04-24 21:14:09.928779,0 days 00:00:01.131291,friedman_mse,35,sqrt,1,2,best,TPESampler,COMPLETE
2083,0.9332193771285112,2025-04-24 21:14:10.099536,2025-04-24 21:14:11.406742,0 days 00:00:01.307206,friedman_mse,14,log2,2,10,best,TPESampler,COMPLETE
2084,0.7113263276640378,2025-04-24 21:14:10.166705,2025-04-24 21:14:11.087356,0 days 00:00:00.920651,friedman_mse,35,sqrt,3,7,best,TPESampler,COMPLETE
2085,0.6276110393036777,2025-04-24 21:14:10.215179,2025-04-24 21:14:11.413404,0 days 00:00:01.198225,absolute_error,29,sqrt,1,4,best,TPESampler,COMPLETE
2086,0.6327006073621034,2025-04-24 21:14:11.354139,2025-04-24 21:14:12.030024,0 days 00:00:00.675885,friedman_mse,35,sqrt,1,8,best,TPESampler,COMPLETE
2087,0.5522341372198587,2025-04-24 21:14:11.710658,2025-04-24 21:14:12.786103,0 days 00:00:01.075445,friedman_mse,35,sqrt,1,6,best,TPESampler,COMPLETE
2088,0.6571715889920813,2025-04-24 21:14:11.753496,2025-04-24 21:14:12.784626,0 days 00:00:01.031130,friedman_mse,29,sqrt,2,7,best,TPESampler,COMPLETE
2089,0.6158166985156879,2025-04-24 21:14:12.367270,2025-04-24 21:14:13.104729,0 days 00:00:00.737459,friedman_mse,35,sqrt,1,9,best,TPESampler,COMPLETE
2090,0.7467878360368371,2025-04-24 21:14:13.066848,2025-04-24 21:14:13.995694,0 days 00:00:00.928846,squared_error,12,sqrt,4,5,random,TPESampler,COMPLETE
2091,0.5981875505937236,2025-04-24 21:14:13.114389,2025-04-24 21:14:14.178163,0 days 00:00:01.063774,friedman_mse,35,sqrt,1,7,best,TPESampler,COMPLETE
2092,0.5522341372198587,2025-04-24 21:14:13.331685,2025-04-24 21:14:14.373601,0 days 00:00:01.041916,friedman_mse,35,sqrt,1,6,best,TPESampler,COMPLETE
2093,0.6540978000576883,2025-04-24 21:14:14.291261,2025-04-24 21:14:15.030013,0 days 00:00:00.738752,friedman_mse,29,sqrt,1,7,best,TPESampler,COMPLETE
2094,0.5925119263261721,2025-04-24 21:14:14.547001,2025-04-24 21:14:15.714109,0 days 00:00:01.167108,friedman_mse,35,sqrt,1,3,best,TPESampler,COMPLETE
2095,0.6293599461146093,2025-04-24 21:14:14.690095,2025-04-24 21:14:15.808870,0 days 00:00:01.118775,friedman_mse,29,sqrt,2,4,best,TPESampler,COMPLETE
2096,0.6568175016976607,2025-04-24 21:14:15.310752,2025-04-24 21:14:16.126999,0 days 00:00:00.816247,friedman_mse,35,sqrt,2,4,best,TPESampler,COMPLETE
2097,0.6015012618996902,2025-04-24 21:14:16.030376,2025-04-24 21:14:17.140650,0 days 00:00:01.110274,friedman_mse,30,sqrt,1,8,best,TPESampler,COMPLETE
2098,0.7246712212327447,2025-04-24 21:14:16.083055,2025-04-24 21:14:17.069841,0 days 00:00:00.986786,friedman_mse,35,sqrt,3,6,best,TPESampler,COMPLETE
2099,0.6689822961370628,2025-04-24 21:14:16.659020,2025-04-24 21:14:17.656260,0 days 00:00:00.997240,friedman_mse,30,sqrt,2,7,best,TPESampler,COMPLETE
2100,0.8025318233554969,2025-04-24 21:14:17.509677,2025-04-24 21:14:18.778238,0 days 00:00:01.268561,squared_error,34,sqrt,9,2,best,TPESampler,COMPLETE
2101,0.9737936641952643,2025-04-24 21:14:17.616621,2025-04-24 21:14:18.815456,0 days 00:00:01.198835,friedman_mse,3,sqrt,10,17,random,TPESampler,COMPLETE
2102,0.6551631182803123,2025-04-24 21:14:18.107693,2025-04-24 21:14:19.072406,0 days 00:00:00.964713,friedman_mse,35,sqrt,2,7,best,TPESampler,COMPLETE
2103,1.0113655924653453,2025-04-24 21:14:19.010901,2025-04-24 21:14:19.982982,0 days 00:00:00.972081,friedman_mse,12,log2,1,5,random,TPESampler,COMPLETE
2104,0.9545020982502701,2025-04-24 21:14:19.160349,2025-04-24 21:14:20.115541,0 days 00:00:00.955192,friedman_mse,35,log2,3,6,best,TPESampler,COMPLETE
2105,0.9737936641952643,2025-04-24 21:14:19.408082,2025-04-24 21:14:20.443898,0 days 00:00:01.035816,squared_error,34,sqrt,7,18,random,TPESampler,COMPLETE
2106,0.7246712212327447,2025-04-24 21:14:20.333675,2025-04-24 21:14:21.395296,0 days 00:00:01.061621,friedman_mse,35,sqrt,3,4,best,TPESampler,COMPLETE
2107,0.6761324654580804,2025-04-24 21:14:20.398982,2025-04-24 21:14:21.327237,0 days 00:00:00.928255,friedman_mse,31,log2,1,5,best,TPESampler,COMPLETE
2108,0.7090359516520972,2025-04-24 21:14:20.959948,2025-04-24 21:14:21.736417,0 days 00:00:00.776469,absolute_error,14,sqrt,3,14,random,TPESampler,COMPLETE
2109,0.5981875505937236,2025-04-24 21:14:21.697817,2025-04-24 21:14:22.769987,0 days 00:00:01.072170,friedman_mse,35,sqrt,1,7,best,TPESampler,COMPLETE
2110,0.6361895113592757,2025-04-24 21:14:21.750421,2025-04-24 21:14:22.753537,0 days 00:00:01.003116,friedman_mse,29,sqrt,1,4,best,TPESampler,COMPLETE
2111,0.6551631182803123,2025-04-24 21:14:22.309073,2025-04-24 21:14:23.060792,0 days 00:00:00.751719,friedman_mse,35,sqrt,2,7,best,TPESampler,COMPLETE
2112,0.5522341372198587,2025-04-24 21:14:23.021645,2025-04-24 21:14:23.909412,0 days 00:00:00.887767,friedman_mse,35,sqrt,1,6,best,TPESampler,COMPLETE
2113,0.6539311476955247,2025-04-24 21:14:23.093593,2025-04-24 21:14:24.223404,0 days 00:00:01.129811,friedman_mse,30,sqrt,1,4,best,TPESampler,COMPLETE
2114,0.5925119263261721,2025-04-24 21:14:23.301112,2025-04-24 21:14:24.605163,0 days 00:00:01.304051,friedman_mse,35,sqrt,1,3,best,TPESampler,COMPLETE
2115,0.5981875505937236,2025-04-24 21:14:24.172040,2025-04-24 21:14:25.108426,0 days 00:00:00.936386,friedman_mse,35,sqrt,1,7,best,TPESampler,COMPLETE
2116,0.610300375570967,2025-04-24 21:14:24.495819,2025-04-24 21:14:25.328639,0 days 00:00:00.832820,friedman_mse,35,sqrt,1,5,best,TPESampler,COMPLETE
2117,0.6638375522073072,2025-04-24 21:14:24.985030,2025-04-24 21:14:25.878050,0 days 00:00:00.893020,friedman_mse,23,sqrt,2,8,best,TPESampler,COMPLETE
2118,0.6595065143489847,2025-04-24 21:14:25.425501,2025-04-24 21:14:26.593346,0 days 00:00:01.167845,friedman_mse,35,sqrt,2,10,best,TPESampler,COMPLETE
2119,0.7246712212327447,2025-04-24 21:14:25.637827,2025-04-24 21:14:26.721870,0 days 00:00:01.084043,friedman_mse,35,sqrt,3,5,best,TPESampler,COMPLETE
2120,0.6015012618996902,2025-04-24 21:14:26.194920,2025-04-24 21:14:27.075882,0 days 00:00:00.880962,friedman_mse,30,sqrt,1,8,best,TPESampler,COMPLETE
2121,0.5522341372198587,2025-04-24 21:14:26.947894,2025-04-24 21:14:27.866955,0 days 00:00:00.919061,friedman_mse,35,sqrt,1,6,best,TPESampler,COMPLETE
2122,0.6446227396865948,2025-04-24 21:14:27.008519,2025-04-24 21:14:28.008756,0 days 00:00:01.000237,friedman_mse,29,sqrt,1,6,best,TPESampler,COMPLETE
2123,0.632199359486392,2025-04-24 21:14:27.451388,2025-04-24 21:14:28.399509,0 days 00:00:00.948121,friedman_mse,30,sqrt,1,9,best,TPESampler,COMPLETE
2124,0.6248248219525877,2025-04-24 21:14:28.189081,2025-04-24 21:14:29.268864,0 days 00:00:01.079783,friedman_mse,35,sqrt,1,4,best,TPESampler,COMPLETE
2125,0.6015012618996902,2025-04-24 21:14:28.266424,2025-04-24 21:14:29.270279,0 days 00:00:01.003855,friedman_mse,30,sqrt,1,8,best,TPESampler,COMPLETE
2126,0.6539311476955247,2025-04-24 21:14:28.705269,2025-04-24 21:14:30.007483,0 days 00:00:01.302214,friedman_mse,30,sqrt,1,4,best,TPESampler,COMPLETE
2127,0.6783568392569116,2025-04-24 21:14:29.428801,2025-04-24 21:14:30.383403,0 days 00:00:00.954602,absolute_error,35,sqrt,1,3,best,TPESampler,COMPLETE
2128,0.7406517311742006,2025-04-24 21:14:29.519848,2025-04-24 21:14:30.638497,0 days 00:00:01.118649,friedman_mse,30,sqrt,3,3,best,TPESampler,COMPLETE
2129,0.6794094981777127,2025-04-24 21:14:30.320597,2025-04-24 21:14:31.064598,0 days 00:00:00.744001,friedman_mse,29,sqrt,3,6,best,TPESampler,COMPLETE
2130,0.988192362972504,2025-04-24 21:14:30.736470,2025-04-24 21:14:31.767024,0 days 00:00:01.030554,friedman_mse,24,log2,4,16,best,TPESampler,COMPLETE
2131,0.6962318006492422,2025-04-24 21:14:30.927257,2025-04-24 21:14:32.065981,0 days 00:00:01.138724,friedman_mse,35,log2,1,4,best,TPESampler,COMPLETE
2132,0.6227361853799519,2025-04-24 21:14:31.317318,2025-04-24 21:14:32.273367,0 days 00:00:00.956049,friedman_mse,30,sqrt,1,2,best,TPESampler,COMPLETE
2133,0.675982364902162,2025-04-24 21:14:32.030322,2025-04-24 21:14:32.837910,0 days 00:00:00.807588,friedman_mse,35,sqrt,2,6,best,TPESampler,COMPLETE
2134,0.7322341151053493,2025-04-24 21:14:32.334958,2025-04-24 21:14:33.504230,0 days 00:00:01.169272,absolute_error,21,sqrt,10,9,best,TPESampler,COMPLETE
2135,0.5990037672372435,2025-04-24 21:14:32.516104,2025-04-24 21:14:33.513056,0 days 00:00:00.996952,friedman_mse,30,sqrt,1,7,best,TPESampler,COMPLETE
2136,0.6158166985156879,2025-04-24 21:14:33.207759,2025-04-24 21:14:34.043438,0 days 00:00:00.835679,friedman_mse,35,sqrt,1,9,best,TPESampler,COMPLETE
2137,0.6082164367053395,2025-04-24 21:14:33.745329,2025-04-24 21:14:34.789568,0 days 00:00:01.044239,friedman_mse,35,sqrt,2,5,best,TPESampler,COMPLETE
2138,0.7258703503262229,2025-04-24 21:14:33.801223,2025-04-24 21:14:34.847646,0 days 00:00:01.046423,friedman_mse,35,sqrt,3,8,best,TPESampler,COMPLETE
2139,0.6248248219525877,2025-04-24 21:14:34.421508,2025-04-24 21:14:35.149744,0 days 00:00:00.728236,friedman_mse,35,sqrt,1,4,best,TPESampler,COMPLETE
2140,0.6518691584550678,2025-04-24 21:14:35.035353,2025-04-24 21:14:36.129318,0 days 00:00:01.093965,friedman_mse,29,sqrt,1,5,best,TPESampler,COMPLETE
2141,0.5981875505937236,2025-04-24 21:14:35.210328,2025-04-24 21:14:36.424400,0 days 00:00:01.214072,friedman_mse,35,sqrt,1,7,best,TPESampler,COMPLETE
2142,0.6327006073621034,2025-04-24 21:14:35.398086,2025-04-24 21:14:36.657962,0 days 00:00:01.259876,friedman_mse,35,sqrt,1,8,best,TPESampler,COMPLETE
2143,0.6469188128218861,2025-04-24 21:14:36.366895,2025-04-24 21:14:37.136899,0 days 00:00:00.770004,squared_error,28,sqrt,1,5,best,TPESampler,COMPLETE
2144,0.6158166985156879,2025-04-24 21:14:36.784003,2025-04-24 21:14:37.764302,0 days 00:00:00.980299,friedman_mse,35,sqrt,1,9,best,TPESampler,COMPLETE
2145,0.6446227396865948,2025-04-24 21:14:36.982608,2025-04-24 21:14:37.953319,0 days 00:00:00.970711,friedman_mse,29,sqrt,1,6,best,TPESampler,COMPLETE
2146,0.6383495815479239,2025-04-24 21:14:37.403105,2025-04-24 21:14:38.259288,0 days 00:00:00.856183,friedman_mse,35,log2,1,9,best,TPESampler,COMPLETE
