number,value,datetime_start,datetime_complete,duration,params_criterion,params_max_depth,params_max_features,params_min_samples_leaf,params_min_samples_split,params_splitter,system_attrs_auto:sampler,state
285,0.572323290498834,2025-04-24 21:02:03.861963,2025-04-24 21:02:04.519994,0 days 00:00:00.658031,friedman_mse,35,sqrt,1,3,random,TPESampler,COMPLETE
286,0.6448501516931647,2025-04-24 21:02:04.105745,2025-04-24 21:02:04.924658,0 days 00:00:00.818913,friedman_mse,28,sqrt,1,6,random,TPESampler,COMPLETE
287,0.689760431628426,2025-04-24 21:02:04.511694,2025-04-24 21:02:05.261882,0 days 00:00:00.750188,friedman_mse,33,sqrt,3,2,random,TPESampler,COMPLETE
288,0.572323290498834,2025-04-24 21:02:04.809094,2025-04-24 21:02:05.726903,0 days 00:00:00.917809,friedman_mse,35,sqrt,1,3,random,TPESampler,COMPLETE
289,0.6435221608690469,2025-04-24 21:02:05.199643,2025-04-24 21:02:06.133884,0 days 00:00:00.934241,friedman_mse,28,sqrt,1,2,random,TPESampler,COMPLETE
290,0.6408571384350191,2025-04-24 21:02:05.568492,2025-04-24 21:02:06.638947,0 days 00:00:01.070455,friedman_mse,35,sqrt,2,2,random,TPESampler,COMPLETE
291,0.5901353558999477,2025-04-24 21:02:06.006335,2025-04-24 21:02:07.027611,0 days 00:00:01.021276,friedman_mse,35,sqrt,1,2,random,TPESampler,COMPLETE
292,0.5781700102250805,2025-04-24 21:02:06.498758,2025-04-24 21:02:07.537478,0 days 00:00:01.038720,friedman_mse,34,sqrt,1,3,random,TPESampler,COMPLETE
293,0.5901353558999477,2025-04-24 21:02:06.952163,2025-04-24 21:02:07.861269,0 days 00:00:00.909106,friedman_mse,35,sqrt,1,2,random,TPESampler,COMPLETE
294,0.6227485159214275,2025-04-24 21:02:07.420922,2025-04-24 21:02:08.235723,0 days 00:00:00.814801,friedman_mse,30,sqrt,1,2,random,TPESampler,COMPLETE
295,0.9811288712474544,2025-04-24 21:02:07.751158,2025-04-24 21:02:08.548749,0 days 00:00:00.797591,friedman_mse,35,log2,2,5,random,TPESampler,COMPLETE
296,0.6398489079096115,2025-04-24 21:02:08.113831,2025-04-24 21:02:08.853513,0 days 00:00:00.739682,squared_error,28,sqrt,1,3,random,TPESampler,COMPLETE
297,0.5901353558999477,2025-04-24 21:02:08.502492,2025-04-24 21:02:09.595504,0 days 00:00:01.093012,friedman_mse,35,sqrt,1,2,random,TPESampler,COMPLETE
298,0.572323290498834,2025-04-24 21:02:08.805064,2025-04-24 21:02:10.055937,0 days 00:00:01.250873,friedman_mse,35,sqrt,1,3,random,TPESampler,COMPLETE
299,0.689760431628426,2025-04-24 21:02:09.118437,2025-04-24 21:02:10.427409,0 days 00:00:01.308972,friedman_mse,29,sqrt,3,6,random,TPESampler,COMPLETE
300,0.572323290498834,2025-04-24 21:02:09.964893,2025-04-24 21:02:11.129150,0 days 00:00:01.164257,friedman_mse,35,sqrt,1,3,random,TPESampler,COMPLETE
301,0.9193722816845605,2025-04-24 21:02:10.460692,2025-04-24 21:02:11.658466,0 days 00:00:01.197774,friedman_mse,29,log2,1,2,random,TPESampler,COMPLETE
302,0.689760431628426,2025-04-24 21:02:10.987797,2025-04-24 21:02:11.842241,0 days 00:00:00.854444,friedman_mse,35,sqrt,3,5,random,TPESampler,COMPLETE
303,0.5999626187268805,2025-04-24 21:02:11.378573,2025-04-24 21:02:12.232538,0 days 00:00:00.853965,absolute_error,35,sqrt,1,4,random,TPESampler,COMPLETE
304,0.689760431628426,2025-04-24 21:02:11.892046,2025-04-24 21:02:12.843856,0 days 00:00:00.951810,friedman_mse,28,sqrt,3,3,random,TPESampler,COMPLETE
305,0.6267094573687406,2025-04-24 21:02:12.089245,2025-04-24 21:02:12.971318,0 days 00:00:00.882073,friedman_mse,29,sqrt,1,5,random,TPESampler,COMPLETE
306,0.5735536095371757,2025-04-24 21:02:12.524387,2025-04-24 21:02:13.318443,0 days 00:00:00.794056,friedman_mse,35,sqrt,1,5,random,TPESampler,COMPLETE
307,0.5901353558999477,2025-04-24 21:02:13.200224,2025-04-24 21:02:14.253775,0 days 00:00:01.053551,friedman_mse,35,sqrt,1,2,random,TPESampler,COMPLETE
308,0.5735536095371757,2025-04-24 21:02:13.271966,2025-04-24 21:02:14.060820,0 days 00:00:00.788854,friedman_mse,35,sqrt,1,5,random,TPESampler,COMPLETE
309,0.6408571384350191,2025-04-24 21:02:13.582314,2025-04-24 21:02:14.558517,0 days 00:00:00.976203,squared_error,35,sqrt,2,2,random,TPESampler,COMPLETE
310,0.5901353558999477,2025-04-24 21:02:14.376118,2025-04-24 21:02:15.281156,0 days 00:00:00.905038,friedman_mse,35,sqrt,1,2,random,TPESampler,COMPLETE
311,0.6267094573687406,2025-04-24 21:02:14.551529,2025-04-24 21:02:15.603463,0 days 00:00:01.051934,friedman_mse,29,sqrt,1,5,random,TPESampler,COMPLETE
312,0.971526010237953,2025-04-24 21:02:14.804974,2025-04-24 21:02:16.069924,0 days 00:00:01.264950,absolute_error,9,log2,8,11,random,TPESampler,COMPLETE
313,0.689760431628426,2025-04-24 21:02:15.540933,2025-04-24 21:02:16.522745,0 days 00:00:00.981812,friedman_mse,35,sqrt,3,4,random,TPESampler,COMPLETE
314,0.964903983025146,2025-04-24 21:02:16.134835,2025-04-24 21:02:17.016379,0 days 00:00:00.881544,absolute_error,4,log2,5,5,best,TPESampler,COMPLETE
315,0.7176178557795468,2025-04-24 21:02:16.404603,2025-04-24 21:02:17.203522,0 days 00:00:00.798919,absolute_error,19,log2,1,5,best,TPESampler,COMPLETE
316,0.5735536095371757,2025-04-24 21:02:16.717652,2025-04-24 21:02:17.510156,0 days 00:00:00.792504,friedman_mse,35,sqrt,1,5,random,TPESampler,COMPLETE
317,0.689760431628426,2025-04-24 21:02:17.258713,2025-04-24 21:02:17.938331,0 days 00:00:00.679618,friedman_mse,35,sqrt,3,2,random,TPESampler,COMPLETE
318,0.6274646664513288,2025-04-24 21:02:17.515457,2025-04-24 21:02:18.363373,0 days 00:00:00.847916,friedman_mse,29,sqrt,1,3,random,TPESampler,COMPLETE
319,0.6448501516931647,2025-04-24 21:02:17.733181,2025-04-24 21:02:18.567879,0 days 00:00:00.834698,friedman_mse,28,sqrt,1,6,random,TPESampler,COMPLETE
320,0.6568175016976607,2025-04-24 21:02:18.283313,2025-04-24 21:02:18.973871,0 days 00:00:00.690558,friedman_mse,33,sqrt,2,2,best,TPESampler,COMPLETE
321,0.6408571384350191,2025-04-24 21:02:18.660795,2025-04-24 21:02:19.557860,0 days 00:00:00.897065,friedman_mse,35,sqrt,2,4,random,TPESampler,COMPLETE
322,0.5669738735012982,2025-04-24 21:02:18.809258,2025-04-24 21:02:19.811062,0 days 00:00:01.001804,friedman_mse,35,sqrt,1,4,random,TPESampler,COMPLETE
323,0.7467054482379599,2025-04-24 21:02:19.205215,2025-04-24 21:02:20.158226,0 days 00:00:00.953011,friedman_mse,19,sqrt,4,20,random,TPESampler,COMPLETE
324,0.5910861426343554,2025-04-24 21:02:19.878264,2025-04-24 21:02:20.613361,0 days 00:00:00.735097,friedman_mse,35,sqrt,1,6,random,TPESampler,COMPLETE
325,0.689760431628426,2025-04-24 21:02:20.161043,2025-04-24 21:02:20.968417,0 days 00:00:00.807374,friedman_mse,35,sqrt,3,5,random,TPESampler,COMPLETE
326,0.9968066590016214,2025-04-24 21:02:20.455227,2025-04-24 21:02:21.307549,0 days 00:00:00.852322,squared_error,1,log2,9,4,random,TPESampler,COMPLETE
327,0.7350894647503713,2025-04-24 21:02:20.919396,2025-04-24 21:02:21.593784,0 days 00:00:00.674388,absolute_error,22,sqrt,9,5,best,TPESampler,COMPLETE
328,0.5669738735012982,2025-04-24 21:02:21.220946,2025-04-24 21:02:21.972310,0 days 00:00:00.751364,friedman_mse,35,sqrt,1,4,random,TPESampler,COMPLETE
329,0.6178174092883351,2025-04-24 21:02:21.553439,2025-04-24 21:02:22.279733,0 days 00:00:00.726294,friedman_mse,29,sqrt,1,4,random,TPESampler,COMPLETE
330,0.6294485605176467,2025-04-24 21:02:21.865122,2025-04-24 21:02:22.549527,0 days 00:00:00.684405,friedman_mse,29,sqrt,1,6,random,TPESampler,COMPLETE
331,0.6708968638004861,2025-04-24 21:02:22.178928,2025-04-24 21:02:22.886600,0 days 00:00:00.707672,friedman_mse,35,sqrt,2,7,random,TPESampler,COMPLETE
332,0.9470723409902122,2025-04-24 21:02:22.502754,2025-04-24 21:02:23.178971,0 days 00:00:00.676217,squared_error,7,sqrt,1,20,random,TPESampler,COMPLETE
333,0.7180015183534638,2025-04-24 21:02:22.786149,2025-04-24 21:02:23.570188,0 days 00:00:00.784039,friedman_mse,22,sqrt,5,17,best,TPESampler,COMPLETE
334,0.6098714731524191,2025-04-24 21:02:23.139681,2025-04-24 21:02:23.825627,0 days 00:00:00.685946,friedman_mse,34,sqrt,1,5,random,TPESampler,COMPLETE
335,0.5669738735012982,2025-04-24 21:02:23.442138,2025-04-24 21:02:24.202696,0 days 00:00:00.760558,friedman_mse,35,sqrt,1,4,random,TPESampler,COMPLETE
336,0.6435221608690469,2025-04-24 21:02:23.814712,2025-04-24 21:02:24.515362,0 days 00:00:00.700650,friedman_mse,28,sqrt,1,2,random,TPESampler,COMPLETE
337,0.572323290498834,2025-04-24 21:02:24.088132,2025-04-24 21:02:24.807689,0 days 00:00:00.719557,friedman_mse,35,sqrt,1,3,random,TPESampler,COMPLETE
338,0.5897648645579153,2025-04-24 21:02:24.398801,2025-04-24 21:02:25.148490,0 days 00:00:00.749689,friedman_mse,35,sqrt,1,7,random,TPESampler,COMPLETE
339,0.902510941907429,2025-04-24 21:02:24.760815,2025-04-24 21:02:25.561442,0 days 00:00:00.800627,friedman_mse,35,log2,1,3,random,TPESampler,COMPLETE
340,0.6267094573687406,2025-04-24 21:02:25.140987,2025-04-24 21:02:26.044356,0 days 00:00:00.903369,friedman_mse,29,sqrt,1,5,random,TPESampler,COMPLETE
341,0.9581948037924227,2025-04-24 21:02:25.449184,2025-04-24 21:02:26.356284,0 days 00:00:00.907100,absolute_error,29,sqrt,10,11,random,TPESampler,COMPLETE
342,0.5669738735012982,2025-04-24 21:02:25.924297,2025-04-24 21:02:26.811867,0 days 00:00:00.887570,friedman_mse,35,sqrt,1,4,random,TPESampler,COMPLETE
343,0.5910861426343554,2025-04-24 21:02:26.310397,2025-04-24 21:02:27.145523,0 days 00:00:00.835126,friedman_mse,35,sqrt,1,6,random,TPESampler,COMPLETE
344,0.7669212232792286,2025-04-24 21:02:26.625799,2025-04-24 21:02:27.362355,0 days 00:00:00.736556,squared_error,11,sqrt,6,20,best,TPESampler,COMPLETE
345,0.5735536095371757,2025-04-24 21:02:27.085186,2025-04-24 21:02:27.814102,0 days 00:00:00.728916,friedman_mse,35,sqrt,1,5,random,TPESampler,COMPLETE
346,0.689760431628426,2025-04-24 21:02:27.480826,2025-04-24 21:02:28.354892,0 days 00:00:00.874066,friedman_mse,29,sqrt,3,3,random,TPESampler,COMPLETE
347,0.90376982927729,2025-04-24 21:02:27.679732,2025-04-24 21:02:28.502013,0 days 00:00:00.822281,absolute_error,15,sqrt,5,19,random,TPESampler,COMPLETE
348,0.5735536095371757,2025-04-24 21:02:28.009893,2025-04-24 21:02:28.928727,0 days 00:00:00.918834,friedman_mse,35,sqrt,1,5,random,TPESampler,COMPLETE
349,0.6888385548503625,2025-04-24 21:02:28.597754,2025-04-24 21:02:29.390993,0 days 00:00:00.793239,absolute_error,25,sqrt,3,4,random,TPESampler,COMPLETE
350,0.689760431628426,2025-04-24 21:02:28.807602,2025-04-24 21:02:29.580966,0 days 00:00:00.773364,friedman_mse,34,sqrt,3,2,random,TPESampler,COMPLETE
351,0.608377100174696,2025-04-24 21:02:29.181725,2025-04-24 21:02:30.192949,0 days 00:00:01.011224,absolute_error,34,sqrt,1,3,random,TPESampler,COMPLETE
352,0.5910861426343554,2025-04-24 21:02:29.643689,2025-04-24 21:02:30.661452,0 days 00:00:01.017763,friedman_mse,35,sqrt,1,6,random,TPESampler,COMPLETE
353,0.5910861426343554,2025-04-24 21:02:29.889610,2025-04-24 21:02:31.027629,0 days 00:00:01.138019,squared_error,35,sqrt,1,6,random,TPESampler,COMPLETE
354,0.689760431628426,2025-04-24 21:02:30.719385,2025-04-24 21:02:31.549854,0 days 00:00:00.830469,friedman_mse,32,sqrt,3,6,random,TPESampler,COMPLETE
355,0.9928365741172522,2025-04-24 21:02:31.025932,2025-04-24 21:02:31.714466,0 days 00:00:00.688534,squared_error,35,log2,10,8,best,TPESampler,COMPLETE
356,0.5735536095371757,2025-04-24 21:02:31.282265,2025-04-24 21:02:31.992388,0 days 00:00:00.710123,friedman_mse,35,sqrt,1,5,random,TPESampler,COMPLETE
357,0.5901353558999477,2025-04-24 21:02:31.860354,2025-04-24 21:02:32.723230,0 days 00:00:00.862876,friedman_mse,35,sqrt,1,2,random,TPESampler,COMPLETE
358,0.5735536095371757,2025-04-24 21:02:31.926092,2025-04-24 21:02:33.034637,0 days 00:00:01.108545,friedman_mse,35,sqrt,1,5,random,TPESampler,COMPLETE
359,0.6146447020156406,2025-04-24 21:02:32.205354,2025-04-24 21:02:32.902133,0 days 00:00:00.696779,friedman_mse,30,sqrt,1,4,random,TPESampler,COMPLETE
360,0.689760431628426,2025-04-24 21:02:32.939499,2025-04-24 21:02:33.570170,0 days 00:00:00.630671,friedman_mse,35,sqrt,3,3,random,TPESampler,COMPLETE
361,0.964903983025146,2025-04-24 21:02:33.149500,2025-04-24 21:02:33.869974,0 days 00:00:00.720474,absolute_error,34,log2,8,19,best,TPESampler,COMPLETE
362,0.5669738735012982,2025-04-24 21:02:33.306794,2025-04-24 21:02:34.079553,0 days 00:00:00.772759,friedman_mse,35,sqrt,1,4,random,TPESampler,COMPLETE
363,0.6314602793941344,2025-04-24 21:02:33.806689,2025-04-24 21:02:34.468913,0 days 00:00:00.662224,friedman_mse,31,sqrt,1,2,random,TPESampler,COMPLETE
364,0.9928365741172522,2025-04-24 21:02:34.153376,2025-04-24 21:02:34.822975,0 days 00:00:00.669599,squared_error,13,log2,10,17,best,TPESampler,COMPLETE
365,0.5669738735012982,2025-04-24 21:02:34.286981,2025-04-24 21:02:35.250627,0 days 00:00:00.963646,friedman_mse,35,sqrt,1,4,random,TPESampler,COMPLETE
366,0.689760431628426,2025-04-24 21:02:34.745123,2025-04-24 21:02:35.522187,0 days 00:00:00.777064,friedman_mse,34,sqrt,3,5,random,TPESampler,COMPLETE
367,0.6035982221692777,2025-04-24 21:02:35.158548,2025-04-24 21:02:35.926431,0 days 00:00:00.767883,friedman_mse,35,sqrt,1,2,best,TPESampler,COMPLETE
368,0.6294485605176467,2025-04-24 21:02:35.619575,2025-04-24 21:02:36.403297,0 days 00:00:00.783722,friedman_mse,29,sqrt,1,6,random,TPESampler,COMPLETE
369,0.6271160627848882,2025-04-24 21:02:35.783069,2025-04-24 21:02:36.524847,0 days 00:00:00.741778,friedman_mse,29,sqrt,1,8,random,TPESampler,COMPLETE
370,0.9962502283466568,2025-04-24 21:02:36.142469,2025-04-24 21:02:36.758609,0 days 00:00:00.616140,friedman_mse,18,log2,5,15,random,TPESampler,COMPLETE
371,0.9968066590016214,2025-04-24 21:02:36.664876,2025-04-24 21:02:37.589738,0 days 00:00:00.924862,squared_error,15,log2,9,11,random,TPESampler,COMPLETE
372,0.5735536095371757,2025-04-24 21:02:36.721772,2025-04-24 21:02:37.449018,0 days 00:00:00.727246,friedman_mse,35,sqrt,1,5,random,TPESampler,COMPLETE
373,0.9811288712474544,2025-04-24 21:02:36.962137,2025-04-24 21:02:37.720359,0 days 00:00:00.758222,squared_error,19,log2,2,5,random,TPESampler,COMPLETE
374,0.7143351171141927,2025-04-24 21:02:37.667752,2025-04-24 21:02:38.471498,0 days 00:00:00.803746,friedman_mse,35,sqrt,3,7,random,TPESampler,COMPLETE
375,0.5868961265114919,2025-04-24 21:02:37.807141,2025-04-24 21:02:38.646993,0 days 00:00:00.839852,friedman_mse,35,sqrt,1,8,random,TPESampler,COMPLETE
376,0.6267094573687406,2025-04-24 21:02:37.994480,2025-04-24 21:02:38.814070,0 days 00:00:00.819590,friedman_mse,29,sqrt,1,5,random,TPESampler,COMPLETE
377,0.874778254287426,2025-04-24 21:02:38.708717,2025-04-24 21:02:39.340188,0 days 00:00:00.631471,squared_error,35,log2,1,4,random,TPESampler,COMPLETE
378,0.5897648645579153,2025-04-24 21:02:38.910777,2025-04-24 21:02:39.672531,0 days 00:00:00.761754,friedman_mse,35,sqrt,1,7,random,TPESampler,COMPLETE
379,0.9733091069111984,2025-04-24 21:02:39.112831,2025-04-24 21:02:39.904012,0 days 00:00:00.791181,squared_error,2,sqrt,1,16,best,TPESampler,COMPLETE
380,0.9928365741172522,2025-04-24 21:02:39.598112,2025-04-24 21:02:40.270966,0 days 00:00:00.672854,friedman_mse,18,log2,10,2,best,TPESampler,COMPLETE
381,0.572323290498834,2025-04-24 21:02:39.935043,2025-04-24 21:02:40.624161,0 days 00:00:00.689118,friedman_mse,35,sqrt,1,3,random,TPESampler,COMPLETE
382,0.9737936641952643,2025-04-24 21:02:40.174056,2025-04-24 21:02:40.981230,0 days 00:00:00.807174,friedman_mse,11,sqrt,7,9,random,TPESampler,COMPLETE
383,0.689760431628426,2025-04-24 21:02:40.514492,2025-04-24 21:02:41.339217,0 days 00:00:00.824725,friedman_mse,30,sqrt,3,5,random,TPESampler,COMPLETE
384,0.9962502283466568,2025-04-24 21:02:40.858770,2025-04-24 21:02:41.640951,0 days 00:00:00.782181,friedman_mse,34,log2,6,14,random,TPESampler,COMPLETE
385,0.5735536095371757,2025-04-24 21:02:41.210482,2025-04-24 21:02:41.966403,0 days 00:00:00.755921,friedman_mse,35,sqrt,1,5,random,TPESampler,COMPLETE
386,0.5901353558999477,2025-04-24 21:02:41.597363,2025-04-24 21:02:42.253659,0 days 00:00:00.656296,friedman_mse,35,sqrt,1,2,random,TPESampler,COMPLETE
387,0.5735536095371757,2025-04-24 21:02:41.843385,2025-04-24 21:02:42.663906,0 days 00:00:00.820521,friedman_mse,35,sqrt,1,5,random,TPESampler,COMPLETE
388,0.5669738735012982,2025-04-24 21:02:42.204499,2025-04-24 21:02:42.985736,0 days 00:00:00.781237,friedman_mse,35,sqrt,1,4,random,TPESampler,COMPLETE
389,0.689760431628426,2025-04-24 21:02:42.543469,2025-04-24 21:02:43.279624,0 days 00:00:00.736155,friedman_mse,29,sqrt,3,2,random,TPESampler,COMPLETE
390,0.9740683440979027,2025-04-24 21:02:42.988226,2025-04-24 21:02:43.677232,0 days 00:00:00.689006,absolute_error,17,log2,9,2,random,TPESampler,COMPLETE
391,0.6288807612873618,2025-04-24 21:02:43.268760,2025-04-24 21:02:44.000102,0 days 00:00:00.731342,friedman_mse,28,sqrt,1,4,random,TPESampler,COMPLETE
392,0.6435221608690469,2025-04-24 21:02:43.513198,2025-04-24 21:02:44.240764,0 days 00:00:00.727566,friedman_mse,28,sqrt,1,2,random,TPESampler,COMPLETE
393,0.6553395349959267,2025-04-24 21:02:43.937745,2025-04-24 21:02:44.707724,0 days 00:00:00.769979,friedman_mse,35,sqrt,2,5,random,TPESampler,COMPLETE
394,0.5735536095371757,2025-04-24 21:02:44.313422,2025-04-24 21:02:45.017761,0 days 00:00:00.704339,friedman_mse,35,sqrt,1,5,random,TPESampler,COMPLETE
395,0.6267094573687406,2025-04-24 21:02:44.456198,2025-04-24 21:02:45.222020,0 days 00:00:00.765822,friedman_mse,29,sqrt,1,5,random,TPESampler,COMPLETE
396,0.572323290498834,2025-04-24 21:02:44.951945,2025-04-24 21:02:45.892859,0 days 00:00:00.940914,friedman_mse,35,sqrt,1,3,random,TPESampler,COMPLETE
397,0.572323290498834,2025-04-24 21:02:45.245476,2025-04-24 21:02:46.302931,0 days 00:00:01.057455,friedman_mse,35,sqrt,1,3,random,TPESampler,COMPLETE
398,0.5735536095371757,2025-04-24 21:02:45.633625,2025-04-24 21:02:46.533074,0 days 00:00:00.899449,friedman_mse,35,sqrt,1,5,random,TPESampler,COMPLETE
399,0.649573014390662,2025-04-24 21:02:46.189211,2025-04-24 21:02:47.347229,0 days 00:00:01.158018,friedman_mse,31,sqrt,2,8,best,TPESampler,COMPLETE
400,0.689760431628426,2025-04-24 21:02:46.840526,2025-04-24 21:02:48.226473,0 days 00:00:01.385947,friedman_mse,35,sqrt,3,3,random,TPESampler,COMPLETE
401,0.689760431628426,2025-04-24 21:02:47.151568,2025-04-24 21:02:48.598748,0 days 00:00:01.447180,friedman_mse,35,sqrt,3,6,random,TPESampler,COMPLETE
402,0.5897648645579153,2025-04-24 21:02:47.637241,2025-04-24 21:02:49.718314,0 days 00:00:02.081073,friedman_mse,35,sqrt,1,7,random,TPESampler,COMPLETE
403,0.689760431628426,2025-04-24 21:02:49.238620,2025-04-24 21:02:51.342036,0 days 00:00:02.103416,friedman_mse,35,sqrt,3,4,random,TPESampler,COMPLETE
404,0.6178174092883351,2025-04-24 21:02:49.388794,2025-04-24 21:02:51.376534,0 days 00:00:01.987740,friedman_mse,29,sqrt,1,4,random,TPESampler,COMPLETE
405,0.5901353558999477,2025-04-24 21:02:50.439527,2025-04-24 21:02:52.005222,0 days 00:00:01.565695,friedman_mse,35,sqrt,1,2,random,TPESampler,COMPLETE
406,0.5669738735012982,2025-04-24 21:02:51.742970,2025-04-24 21:02:53.517733,0 days 00:00:01.774763,friedman_mse,35,sqrt,1,4,random,TPESampler,COMPLETE
407,0.5669738735012982,2025-04-24 21:02:51.865468,2025-04-24 21:02:53.301797,0 days 00:00:01.436329,friedman_mse,35,sqrt,1,4,random,TPESampler,COMPLETE
408,0.9737936641952643,2025-04-24 21:02:52.333649,2025-04-24 21:02:53.714320,0 days 00:00:01.380671,squared_error,28,sqrt,7,15,random,TPESampler,COMPLETE
409,0.9968064910218514,2025-04-24 21:02:53.669496,2025-04-24 21:02:54.780563,0 days 00:00:01.111067,squared_error,3,log2,3,11,random,TPESampler,COMPLETE
410,0.7143351171141927,2025-04-24 21:02:53.826537,2025-04-24 21:02:55.109574,0 days 00:00:01.283037,friedman_mse,28,sqrt,3,9,random,TPESampler,COMPLETE
411,0.9747088420477746,2025-04-24 21:02:54.009204,2025-04-24 21:02:55.567412,0 days 00:00:01.558208,friedman_mse,35,log2,2,8,random,TPESampler,COMPLETE
412,0.5781700102250805,2025-04-24 21:02:55.429714,2025-04-24 21:02:56.486407,0 days 00:00:01.056693,squared_error,34,sqrt,1,3,random,TPESampler,COMPLETE
413,0.689760431628426,2025-04-24 21:02:55.565752,2025-04-24 21:02:57.003804,0 days 00:00:01.438052,squared_error,35,sqrt,3,6,random,TPESampler,COMPLETE
414,0.6027151455713532,2025-04-24 21:02:55.838245,2025-04-24 21:02:57.218784,0 days 00:00:01.380539,friedman_mse,31,sqrt,1,6,random,TPESampler,COMPLETE
415,0.6661569787988538,2025-04-24 21:02:57.061232,2025-04-24 21:02:58.115079,0 days 00:00:01.053847,friedman_mse,29,sqrt,2,6,random,TPESampler,COMPLETE
416,0.5910861426343554,2025-04-24 21:02:57.371922,2025-04-24 21:02:58.598147,0 days 00:00:01.226225,friedman_mse,35,sqrt,1,6,random,TPESampler,COMPLETE
417,0.5735536095371757,2025-04-24 21:02:57.631792,2025-04-24 21:02:58.884825,0 days 00:00:01.253033,friedman_mse,35,sqrt,1,5,random,TPESampler,COMPLETE
418,0.6098714731524191,2025-04-24 21:02:58.384439,2025-04-24 21:02:59.394826,0 days 00:00:01.010387,friedman_mse,34,sqrt,1,5,random,TPESampler,COMPLETE
419,0.6506775355839041,2025-04-24 21:02:58.955674,2025-04-24 21:03:00.164158,0 days 00:00:01.208484,absolute_error,33,sqrt,1,6,random,TPESampler,COMPLETE
420,0.5735536095371757,2025-04-24 21:02:59.351110,2025-04-24 21:03:00.564786,0 days 00:00:01.213676,friedman_mse,35,sqrt,1,5,random,TPESampler,COMPLETE
421,0.689760431628426,2025-04-24 21:02:59.743074,2025-04-24 21:03:01.217388,0 days 00:00:01.474314,friedman_mse,30,sqrt,3,5,random,TPESampler,COMPLETE
422,0.988192362972504,2025-04-24 21:03:00.558129,2025-04-24 21:03:01.409915,0 days 00:00:00.851786,squared_error,4,log2,4,10,best,TPESampler,COMPLETE
423,0.62949872596784,2025-04-24 21:03:00.845665,2025-04-24 21:03:01.728346,0 days 00:00:00.882681,friedman_mse,28,sqrt,1,5,random,TPESampler,COMPLETE
424,0.971526010237953,2025-04-24 21:03:01.460461,2025-04-24 21:03:02.149932,0 days 00:00:00.689471,absolute_error,8,log2,5,4,random,TPESampler,COMPLETE
425,0.675982364902162,2025-04-24 21:03:01.726825,2025-04-24 21:03:02.525954,0 days 00:00:00.799129,friedman_mse,35,sqrt,2,6,best,TPESampler,COMPLETE
426,0.9127555858720797,2025-04-24 21:03:01.959606,2025-04-24 21:03:02.747813,0 days 00:00:00.788207,friedman_mse,33,log2,1,6,random,TPESampler,COMPLETE
427,0.6408571384350191,2025-04-24 21:03:02.460147,2025-04-24 21:03:03.068387,0 days 00:00:00.608240,friedman_mse,35,sqrt,2,4,random,TPESampler,COMPLETE
