number,value,datetime_start,datetime_complete,duration,params_criterion,params_max_depth,params_max_features,params_min_samples_leaf,params_min_samples_split,params_splitter,system_attrs_auto:sampler,state
428,0.5868961265114919,2025-04-24 21:03:02.804838,2025-04-24 21:03:03.589859,0 days 00:00:00.785021,friedman_mse,35,sqrt,1,8,random,TPESampler,COMPLETE
429,0.689760431628426,2025-04-24 21:03:03.074802,2025-04-24 21:03:03.742565,0 days 00:00:00.667763,friedman_mse,29,sqrt,3,4,random,TPESampler,COMPLETE
430,0.9968066590016214,2025-04-24 21:03:03.304903,2025-04-24 21:03:04.031044,0 days 00:00:00.726141,friedman_mse,23,log2,9,17,random,TPESampler,COMPLETE
431,0.7972530392015776,2025-04-24 21:03:03.930445,2025-04-24 21:03:04.981936,0 days 00:00:01.051491,friedman_mse,9,sqrt,6,20,best,TPESampler,COMPLETE
432,0.5735536095371757,2025-04-24 21:03:03.983101,2025-04-24 21:03:04.666674,0 days 00:00:00.683573,friedman_mse,35,sqrt,1,5,random,TPESampler,COMPLETE
433,0.5669738735012982,2025-04-24 21:03:04.226419,2025-04-24 21:03:05.022539,0 days 00:00:00.796120,friedman_mse,35,sqrt,1,4,random,TPESampler,COMPLETE
434,0.6274646664513288,2025-04-24 21:03:04.914188,2025-04-24 21:03:05.820931,0 days 00:00:00.906743,friedman_mse,29,sqrt,1,3,random,TPESampler,COMPLETE
435,0.991219443504939,2025-04-24 21:03:05.178915,2025-04-24 21:03:06.414495,0 days 00:00:01.235580,friedman_mse,2,log2,4,6,best,TPESampler,COMPLETE
436,0.689760431628426,2025-04-24 21:03:05.231231,2025-04-24 21:03:06.402139,0 days 00:00:01.170908,friedman_mse,34,sqrt,3,6,random,TPESampler,COMPLETE
437,0.572323290498834,2025-04-24 21:03:06.244633,2025-04-24 21:03:07.155918,0 days 00:00:00.911285,friedman_mse,35,sqrt,1,3,random,TPESampler,COMPLETE
438,0.689760431628426,2025-04-24 21:03:06.732638,2025-04-24 21:03:07.762466,0 days 00:00:01.029828,friedman_mse,34,sqrt,3,2,random,TPESampler,COMPLETE
439,0.6288807612873618,2025-04-24 21:03:06.873285,2025-04-24 21:03:07.661726,0 days 00:00:00.788441,friedman_mse,28,sqrt,1,4,random,TPESampler,COMPLETE
440,0.9539452868079322,2025-04-24 21:03:07.386227,2025-04-24 21:03:08.199484,0 days 00:00:00.813257,absolute_error,4,sqrt,5,13,random,TPESampler,COMPLETE
441,0.6144793058012911,2025-04-24 21:03:07.899157,2025-04-24 21:03:09.481625,0 days 00:00:01.582468,friedman_mse,29,sqrt,1,7,random,TPESampler,COMPLETE
442,0.9962502283466568,2025-04-24 21:03:08.084317,2025-04-24 21:03:09.642362,0 days 00:00:01.558045,squared_error,25,log2,7,20,random,TPESampler,COMPLETE
443,0.6708968638004861,2025-04-24 21:03:09.180342,2025-04-24 21:03:09.924052,0 days 00:00:00.743710,friedman_mse,35,sqrt,2,7,random,TPESampler,COMPLETE
444,0.6919380019442345,2025-04-24 21:03:09.737248,2025-04-24 21:03:10.486289,0 days 00:00:00.749041,absolute_error,14,sqrt,3,6,best,TPESampler,COMPLETE
445,0.6408571384350191,2025-04-24 21:03:09.821752,2025-04-24 21:03:10.607186,0 days 00:00:00.785434,friedman_mse,35,sqrt,2,4,random,TPESampler,COMPLETE
446,0.6267094573687406,2025-04-24 21:03:10.159560,2025-04-24 21:03:10.893621,0 days 00:00:00.734061,friedman_mse,29,sqrt,1,5,random,TPESampler,COMPLETE
447,0.689760431628426,2025-04-24 21:03:10.738269,2025-04-24 21:03:11.694612,0 days 00:00:00.956343,friedman_mse,35,sqrt,3,5,random,TPESampler,COMPLETE
448,0.5735536095371757,2025-04-24 21:03:10.835872,2025-04-24 21:03:11.748672,0 days 00:00:00.912800,friedman_mse,35,sqrt,1,5,random,TPESampler,COMPLETE
449,0.5901353558999477,2025-04-24 21:03:11.301831,2025-04-24 21:03:12.137436,0 days 00:00:00.835605,friedman_mse,35,sqrt,1,2,random,TPESampler,COMPLETE
450,0.9534465257850157,2025-04-24 21:03:11.894578,2025-04-24 21:03:12.712995,0 days 00:00:00.818417,absolute_error,5,sqrt,4,3,random,TPESampler,COMPLETE
451,0.6294485605176467,2025-04-24 21:03:11.943841,2025-04-24 21:03:12.848352,0 days 00:00:00.904511,friedman_mse,29,sqrt,1,6,random,TPESampler,COMPLETE
452,0.6098714731524191,2025-04-24 21:03:12.364307,2025-04-24 21:03:13.263014,0 days 00:00:00.898707,friedman_mse,34,sqrt,1,5,random,TPESampler,COMPLETE
453,0.6657519179651408,2025-04-24 21:03:13.095560,2025-04-24 21:03:14.158612,0 days 00:00:01.063052,absolute_error,35,sqrt,3,6,random,TPESampler,COMPLETE
454,0.9581948037924227,2025-04-24 21:03:13.220433,2025-04-24 21:03:14.083770,0 days 00:00:00.863337,absolute_error,15,sqrt,10,20,random,TPESampler,COMPLETE
455,0.5868961265114919,2025-04-24 21:03:13.484034,2025-04-24 21:03:14.388290,0 days 00:00:00.904256,friedman_mse,35,sqrt,1,8,random,TPESampler,COMPLETE
456,0.572323290498834,2025-04-24 21:03:14.342622,2025-04-24 21:03:15.208066,0 days 00:00:00.865444,friedman_mse,35,sqrt,1,3,random,TPESampler,COMPLETE
457,0.610300375570967,2025-04-24 21:03:14.415675,2025-04-24 21:03:15.517557,0 days 00:00:01.101882,friedman_mse,35,sqrt,1,5,best,TPESampler,COMPLETE
458,0.5669738735012982,2025-04-24 21:03:14.561066,2025-04-24 21:03:15.520377,0 days 00:00:00.959311,friedman_mse,35,sqrt,1,4,random,TPESampler,COMPLETE
459,0.6458391393380777,2025-04-24 21:03:15.471460,2025-04-24 21:03:16.093711,0 days 00:00:00.622251,friedman_mse,29,sqrt,1,2,random,TPESampler,COMPLETE
460,0.5924739104462563,2025-04-24 21:03:15.759026,2025-04-24 21:03:16.833528,0 days 00:00:01.074502,friedman_mse,34,sqrt,1,6,random,TPESampler,COMPLETE
461,0.689760431628426,2025-04-24 21:03:15.830314,2025-04-24 21:03:16.678942,0 days 00:00:00.848628,friedman_mse,35,sqrt,3,5,random,TPESampler,COMPLETE
462,0.5669738735012982,2025-04-24 21:03:16.351119,2025-04-24 21:03:17.208011,0 days 00:00:00.856892,friedman_mse,35,sqrt,1,4,random,TPESampler,COMPLETE
463,0.9968064910218514,2025-04-24 21:03:17.087516,2025-04-24 21:03:17.896897,0 days 00:00:00.809381,squared_error,24,log2,3,19,random,TPESampler,COMPLETE
464,0.5897648645579153,2025-04-24 21:03:17.171848,2025-04-24 21:03:18.062055,0 days 00:00:00.890207,friedman_mse,35,sqrt,1,7,random,TPESampler,COMPLETE
465,0.6477874452601059,2025-04-24 21:03:17.440455,2025-04-24 21:03:18.194525,0 days 00:00:00.754070,friedman_mse,30,sqrt,1,6,random,TPESampler,COMPLETE
466,0.5910861426343554,2025-04-24 21:03:18.129918,2025-04-24 21:03:18.792136,0 days 00:00:00.662218,friedman_mse,35,sqrt,1,6,random,TPESampler,COMPLETE
467,0.689760431628426,2025-04-24 21:03:18.322351,2025-04-24 21:03:19.229861,0 days 00:00:00.907510,friedman_mse,35,sqrt,3,3,random,TPESampler,COMPLETE
468,0.9451031138449261,2025-04-24 21:03:18.433213,2025-04-24 21:03:19.353722,0 days 00:00:00.920509,absolute_error,24,log2,1,5,random,TPESampler,COMPLETE
469,0.5910861426343554,2025-04-24 21:03:19.043041,2025-04-24 21:03:19.698869,0 days 00:00:00.655828,friedman_mse,35,sqrt,1,6,random,TPESampler,COMPLETE
470,0.6156651197787549,2025-04-24 21:03:19.554485,2025-04-24 21:03:20.355813,0 days 00:00:00.801328,friedman_mse,20,sqrt,1,8,best,TPESampler,COMPLETE
471,0.66991615931603,2025-04-24 21:03:19.645742,2025-04-24 21:03:20.561103,0 days 00:00:00.915361,squared_error,25,sqrt,1,18,best,TPESampler,COMPLETE
472,0.8019589268035308,2025-04-24 21:03:19.909633,2025-04-24 21:03:20.671177,0 days 00:00:00.761544,squared_error,34,sqrt,8,12,best,TPESampler,COMPLETE
473,0.5994678123585252,2025-04-24 21:03:20.575027,2025-04-24 21:03:21.221778,0 days 00:00:00.646751,absolute_error,30,sqrt,1,2,random,TPESampler,COMPLETE
474,0.6146447020156406,2025-04-24 21:03:20.784992,2025-04-24 21:03:21.565259,0 days 00:00:00.780267,friedman_mse,30,sqrt,1,4,random,TPESampler,COMPLETE
475,0.9928365741172522,2025-04-24 21:03:20.969026,2025-04-24 21:03:21.772442,0 days 00:00:00.803416,squared_error,22,log2,8,8,best,TPESampler,COMPLETE
476,0.689760431628426,2025-04-24 21:03:21.504816,2025-04-24 21:03:22.074456,0 days 00:00:00.569640,friedman_mse,29,sqrt,3,4,random,TPESampler,COMPLETE
477,0.5669738735012982,2025-04-24 21:03:21.847804,2025-04-24 21:03:22.739180,0 days 00:00:00.891376,friedman_mse,35,sqrt,1,4,random,TPESampler,COMPLETE
478,0.6408571384350191,2025-04-24 21:03:22.083024,2025-04-24 21:03:23.019282,0 days 00:00:00.936258,friedman_mse,35,sqrt,2,4,random,TPESampler,COMPLETE
479,0.964903983025146,2025-04-24 21:03:22.279467,2025-04-24 21:03:23.065640,0 days 00:00:00.786173,absolute_error,32,log2,9,7,best,TPESampler,COMPLETE
480,0.6553395349959267,2025-04-24 21:03:22.952646,2025-04-24 21:03:23.614852,0 days 00:00:00.662206,friedman_mse,35,sqrt,2,5,random,TPESampler,COMPLETE
481,0.5735536095371757,2025-04-24 21:03:23.225767,2025-04-24 21:03:24.059675,0 days 00:00:00.833908,friedman_mse,35,sqrt,1,5,random,TPESampler,COMPLETE
482,0.572323290498834,2025-04-24 21:03:23.279498,2025-04-24 21:03:24.067064,0 days 00:00:00.787566,friedman_mse,35,sqrt,1,3,random,TPESampler,COMPLETE
483,0.5669738735012982,2025-04-24 21:03:23.817474,2025-04-24 21:03:24.568225,0 days 00:00:00.750751,friedman_mse,35,sqrt,1,4,random,TPESampler,COMPLETE
484,0.6399598940908395,2025-04-24 21:03:24.302853,2025-04-24 21:03:25.066108,0 days 00:00:00.763255,squared_error,25,sqrt,1,6,random,TPESampler,COMPLETE
485,0.5897648645579153,2025-04-24 21:03:24.369426,2025-04-24 21:03:25.189497,0 days 00:00:00.820071,friedman_mse,35,sqrt,1,7,random,TPESampler,COMPLETE
486,0.988192362972504,2025-04-24 21:03:24.760952,2025-04-24 21:03:25.490666,0 days 00:00:00.729714,friedman_mse,32,log2,4,12,best,TPESampler,COMPLETE
487,0.6729199123747311,2025-04-24 21:03:25.273052,2025-04-24 21:03:26.025549,0 days 00:00:00.752497,absolute_error,25,sqrt,2,11,random,TPESampler,COMPLETE
488,0.6661569787988538,2025-04-24 21:03:25.432808,2025-04-24 21:03:26.165974,0 days 00:00:00.733166,friedman_mse,29,sqrt,2,6,random,TPESampler,COMPLETE
489,0.964903983025146,2025-04-24 21:03:25.739522,2025-04-24 21:03:26.423261,0 days 00:00:00.683739,absolute_error,2,log2,8,20,best,TPESampler,COMPLETE
490,0.6477874452601059,2025-04-24 21:03:26.244044,2025-04-24 21:03:27.030422,0 days 00:00:00.786378,friedman_mse,30,sqrt,1,6,random,TPESampler,COMPLETE
491,0.9964161010826412,2025-04-24 21:03:26.415813,2025-04-24 21:03:27.493343,0 days 00:00:01.077530,friedman_mse,35,log2,3,2,random,TPESampler,COMPLETE
492,0.7355853934316654,2025-04-24 21:03:26.704175,2025-04-24 21:03:27.577353,0 days 00:00:00.873178,squared_error,12,sqrt,1,11,best,TPESampler,COMPLETE
493,0.7143351171141927,2025-04-24 21:03:27.214108,2025-04-24 21:03:27.888405,0 days 00:00:00.674297,friedman_mse,35,sqrt,3,8,random,TPESampler,COMPLETE
494,0.5669738735012982,2025-04-24 21:03:27.771355,2025-04-24 21:03:28.510598,0 days 00:00:00.739243,friedman_mse,35,sqrt,1,4,random,TPESampler,COMPLETE
495,0.9737936641952643,2025-04-24 21:03:27.844058,2025-04-24 21:03:28.731093,0 days 00:00:00.887035,friedman_mse,24,sqrt,9,5,random,TPESampler,COMPLETE
496,0.9928365741172522,2025-04-24 21:03:28.086197,2025-04-24 21:03:28.800941,0 days 00:00:00.714744,friedman_mse,3,log2,9,6,best,TPESampler,COMPLETE
497,0.5669738735012982,2025-04-24 21:03:28.747378,2025-04-24 21:03:29.543688,0 days 00:00:00.796310,friedman_mse,35,sqrt,1,4,random,TPESampler,COMPLETE
498,0.6080739943014954,2025-04-24 21:03:28.911483,2025-04-24 21:03:29.740004,0 days 00:00:00.828521,friedman_mse,35,sqrt,1,10,random,TPESampler,COMPLETE
499,0.9962502283466568,2025-04-24 21:03:29.084945,2025-04-24 21:03:29.835159,0 days 00:00:00.750214,friedman_mse,3,log2,5,3,random,TPESampler,COMPLETE
500,0.7774448084602187,2025-04-24 21:03:29.781730,2025-04-24 21:03:30.555245,0 days 00:00:00.773515,friedman_mse,24,sqrt,10,18,best,TPESampler,COMPLETE
501,0.5669738735012982,2025-04-24 21:03:29.973658,2025-04-24 21:03:31.050508,0 days 00:00:01.076850,friedman_mse,35,sqrt,1,4,random,TPESampler,COMPLETE
502,0.9300318574621721,2025-04-24 21:03:30.061889,2025-04-24 21:03:31.116273,0 days 00:00:01.054384,friedman_mse,28,log2,1,6,random,TPESampler,COMPLETE
503,0.5735536095371757,2025-04-24 21:03:30.756282,2025-04-24 21:03:31.443549,0 days 00:00:00.687267,friedman_mse,35,sqrt,1,5,random,TPESampler,COMPLETE
504,0.5735536095371757,2025-04-24 21:03:31.326497,2025-04-24 21:03:32.127892,0 days 00:00:00.801395,friedman_mse,35,sqrt,1,5,random,TPESampler,COMPLETE
505,0.9737936641952643,2025-04-24 21:03:31.400463,2025-04-24 21:03:32.572625,0 days 00:00:01.172162,squared_error,23,sqrt,10,7,random,TPESampler,COMPLETE
506,0.6178174092883351,2025-04-24 21:03:31.676586,2025-04-24 21:03:32.705613,0 days 00:00:01.029027,friedman_mse,29,sqrt,1,4,random,TPESampler,COMPLETE
507,0.5735536095371757,2025-04-24 21:03:32.650527,2025-04-24 21:03:33.352567,0 days 00:00:00.702040,friedman_mse,35,sqrt,1,5,random,TPESampler,COMPLETE
508,0.689760431628426,2025-04-24 21:03:32.858086,2025-04-24 21:03:33.756012,0 days 00:00:00.897926,friedman_mse,29,sqrt,3,3,random,TPESampler,COMPLETE
509,0.5735536095371757,2025-04-24 21:03:32.901808,2025-04-24 21:03:33.719849,0 days 00:00:00.818041,squared_error,35,sqrt,1,5,random,TPESampler,COMPLETE
510,0.6408571384350191,2025-04-24 21:03:33.652486,2025-04-24 21:03:34.284600,0 days 00:00:00.632114,friedman_mse,35,sqrt,2,3,random,TPESampler,COMPLETE
511,0.6267927039260746,2025-04-24 21:03:33.964961,2025-04-24 21:03:34.810109,0 days 00:00:00.845148,friedman_mse,30,sqrt,1,5,random,TPESampler,COMPLETE
512,0.5669738735012982,2025-04-24 21:03:34.025024,2025-04-24 21:03:34.868464,0 days 00:00:00.843440,friedman_mse,35,sqrt,1,4,random,TPESampler,COMPLETE
513,0.5735536095371757,2025-04-24 21:03:34.487133,2025-04-24 21:03:35.232807,0 days 00:00:00.745674,friedman_mse,35,sqrt,1,5,random,TPESampler,COMPLETE
514,0.689760431628426,2025-04-24 21:03:35.041436,2025-04-24 21:03:36.018880,0 days 00:00:00.977444,friedman_mse,35,sqrt,3,2,random,TPESampler,COMPLETE
515,0.9928365741172522,2025-04-24 21:03:35.103375,2025-04-24 21:03:35.970130,0 days 00:00:00.866755,friedman_mse,3,log2,5,17,best,TPESampler,COMPLETE
516,0.6600174044152318,2025-04-24 21:03:35.488439,2025-04-24 21:03:36.252841,0 days 00:00:00.764402,friedman_mse,31,sqrt,2,19,best,TPESampler,COMPLETE
517,0.6146447020156406,2025-04-24 21:03:36.216457,2025-04-24 21:03:36.895172,0 days 00:00:00.678715,friedman_mse,30,sqrt,1,4,random,TPESampler,COMPLETE
518,0.5669738735012982,2025-04-24 21:03:36.258693,2025-04-24 21:03:37.240269,0 days 00:00:00.981576,friedman_mse,35,sqrt,1,4,random,TPESampler,COMPLETE
519,0.689760431628426,2025-04-24 21:03:36.455839,2025-04-24 21:03:37.332754,0 days 00:00:00.876915,friedman_mse,35,sqrt,3,4,random,TPESampler,COMPLETE
520,0.689760431628426,2025-04-24 21:03:37.183913,2025-04-24 21:03:37.754908,0 days 00:00:00.570995,friedman_mse,35,sqrt,3,4,random,TPESampler,COMPLETE
521,0.5910861426343554,2025-04-24 21:03:37.468507,2025-04-24 21:03:38.282198,0 days 00:00:00.813691,friedman_mse,35,sqrt,1,6,random,TPESampler,COMPLETE
522,0.5669738735012982,2025-04-24 21:03:37.606462,2025-04-24 21:03:38.417263,0 days 00:00:00.810801,friedman_mse,35,sqrt,1,4,random,TPESampler,COMPLETE
523,0.5901353558999477,2025-04-24 21:03:37.998118,2025-04-24 21:03:38.665577,0 days 00:00:00.667459,friedman_mse,35,sqrt,1,2,random,TPESampler,COMPLETE
524,0.6455239044788237,2025-04-24 21:03:38.550709,2025-04-24 21:03:39.494980,0 days 00:00:00.944271,absolute_error,27,sqrt,1,6,random,TPESampler,COMPLETE
525,0.608377100174696,2025-04-24 21:03:38.622468,2025-04-24 21:03:39.397394,0 days 00:00:00.774926,absolute_error,34,sqrt,1,3,random,TPESampler,COMPLETE
526,0.6178174092883351,2025-04-24 21:03:38.862996,2025-04-24 21:03:39.673232,0 days 00:00:00.810236,friedman_mse,29,sqrt,1,4,random,TPESampler,COMPLETE
527,0.6398489079096115,2025-04-24 21:03:39.628614,2025-04-24 21:03:40.357492,0 days 00:00:00.728878,friedman_mse,28,sqrt,1,3,random,TPESampler,COMPLETE
528,0.6398489079096115,2025-04-24 21:03:39.719027,2025-04-24 21:03:40.483371,0 days 00:00:00.764344,friedman_mse,28,sqrt,1,3,random,TPESampler,COMPLETE
529,0.6829163250321814,2025-04-24 21:03:40.079129,2025-04-24 21:03:40.780162,0 days 00:00:00.701033,friedman_mse,28,log2,2,7,best,TPESampler,COMPLETE
530,0.7143351171141927,2025-04-24 21:03:40.644274,2025-04-24 21:03:41.493827,0 days 00:00:00.849553,friedman_mse,34,sqrt,3,7,random,TPESampler,COMPLETE
531,0.6708968638004861,2025-04-24 21:03:40.714287,2025-04-24 21:03:41.505942,0 days 00:00:00.791655,friedman_mse,35,sqrt,2,7,random,TPESampler,COMPLETE
532,0.7682813561270208,2025-04-24 21:03:41.220589,2025-04-24 21:03:41.914848,0 days 00:00:00.694259,squared_error,13,sqrt,7,4,best,TPESampler,COMPLETE
533,0.7168317564223909,2025-04-24 21:03:41.695245,2025-04-24 21:03:42.626513,0 days 00:00:00.931268,squared_error,18,log2,2,18,best,TPESampler,COMPLETE
534,0.5901353558999477,2025-04-24 21:03:41.765023,2025-04-24 21:03:42.613420,0 days 00:00:00.848397,friedman_mse,35,sqrt,1,2,random,TPESampler,COMPLETE
535,0.7359022299797667,2025-04-24 21:03:42.188512,2025-04-24 21:03:43.089467,0 days 00:00:00.900955,absolute_error,13,sqrt,8,9,best,TPESampler,COMPLETE
536,0.5735536095371757,2025-04-24 21:03:42.823900,2025-04-24 21:03:43.582204,0 days 00:00:00.758304,friedman_mse,35,sqrt,1,5,random,TPESampler,COMPLETE
537,0.9737936641952643,2025-04-24 21:03:42.890946,2025-04-24 21:03:43.680240,0 days 00:00:00.789294,squared_error,14,sqrt,7,8,random,TPESampler,COMPLETE
538,0.689760431628426,2025-04-24 21:03:43.350754,2025-04-24 21:03:44.114859,0 days 00:00:00.764105,friedman_mse,35,sqrt,3,5,random,TPESampler,COMPLETE
539,0.6144793058012911,2025-04-24 21:03:43.800639,2025-04-24 21:03:44.532859,0 days 00:00:00.732220,friedman_mse,29,sqrt,1,7,random,TPESampler,COMPLETE
540,0.6146447020156406,2025-04-24 21:03:43.884489,2025-04-24 21:03:44.871056,0 days 00:00:00.986567,friedman_mse,30,sqrt,1,4,random,TPESampler,COMPLETE
541,0.5897648645579153,2025-04-24 21:03:44.397731,2025-04-24 21:03:45.079348,0 days 00:00:00.681617,friedman_mse,35,sqrt,1,7,random,TPESampler,COMPLETE
542,0.5669738735012982,2025-04-24 21:03:44.809261,2025-04-24 21:03:45.443344,0 days 00:00:00.634083,friedman_mse,35,sqrt,1,4,random,TPESampler,COMPLETE
543,0.6361895113592757,2025-04-24 21:03:45.152149,2025-04-24 21:03:45.944236,0 days 00:00:00.792087,friedman_mse,29,sqrt,1,4,best,TPESampler,COMPLETE
544,0.9233401050352098,2025-04-24 21:03:45.317884,2025-04-24 21:03:46.094409,0 days 00:00:00.776525,friedman_mse,34,log2,1,5,random,TPESampler,COMPLETE
545,0.5669738735012982,2025-04-24 21:03:45.700959,2025-04-24 21:03:46.444652,0 days 00:00:00.743693,friedman_mse,35,sqrt,1,4,random,TPESampler,COMPLETE
546,0.6274646664513288,2025-04-24 21:03:46.207788,2025-04-24 21:03:46.983992,0 days 00:00:00.776204,friedman_mse,29,sqrt,1,3,random,TPESampler,COMPLETE
547,0.5735536095371757,2025-04-24 21:03:46.348366,2025-04-24 21:03:47.116098,0 days 00:00:00.767732,friedman_mse,35,sqrt,1,5,random,TPESampler,COMPLETE
548,0.689760431628426,2025-04-24 21:03:46.677795,2025-04-24 21:03:47.427555,0 days 00:00:00.749760,friedman_mse,35,sqrt,3,5,random,TPESampler,COMPLETE
549,0.689760431628426,2025-04-24 21:03:47.290068,2025-04-24 21:03:48.107690,0 days 00:00:00.817622,friedman_mse,29,sqrt,3,5,random,TPESampler,COMPLETE
550,0.689760431628426,2025-04-24 21:03:47.355886,2025-04-24 21:03:48.338277,0 days 00:00:00.982391,friedman_mse,35,sqrt,3,5,random,TPESampler,COMPLETE
551,0.5901353558999477,2025-04-24 21:03:47.625754,2025-04-24 21:03:48.431265,0 days 00:00:00.805511,friedman_mse,35,sqrt,1,2,random,TPESampler,COMPLETE
552,0.5669738735012982,2025-04-24 21:03:48.393956,2025-04-24 21:03:49.291631,0 days 00:00:00.897675,friedman_mse,35,sqrt,1,4,random,TPESampler,COMPLETE
553,0.6458391393380777,2025-04-24 21:03:48.578065,2025-04-24 21:03:49.489412,0 days 00:00:00.911347,friedman_mse,29,sqrt,1,2,random,TPESampler,COMPLETE
554,0.5669738735012982,2025-04-24 21:03:48.756495,2025-04-24 21:03:49.637280,0 days 00:00:00.880785,friedman_mse,35,sqrt,1,4,random,TPESampler,COMPLETE
555,0.587025569867736,2025-04-24 21:03:49.585599,2025-04-24 21:03:50.465501,0 days 00:00:00.879902,absolute_error,35,sqrt,1,5,random,TPESampler,COMPLETE
556,0.971526010237953,2025-04-24 21:03:49.730132,2025-04-24 21:03:50.653997,0 days 00:00:00.923865,absolute_error,24,log2,8,15,random,TPESampler,COMPLETE
557,0.5669738735012982,2025-04-24 21:03:49.940732,2025-04-24 21:03:50.750751,0 days 00:00:00.810019,friedman_mse,35,sqrt,1,4,random,TPESampler,COMPLETE
558,0.9581948037924227,2025-04-24 21:03:50.702077,2025-04-24 21:03:51.488362,0 days 00:00:00.786285,absolute_error,33,sqrt,10,3,random,TPESampler,COMPLETE
559,0.6248248219525877,2025-04-24 21:03:50.843394,2025-04-24 21:03:51.714684,0 days 00:00:00.871290,friedman_mse,35,sqrt,1,4,best,TPESampler,COMPLETE
560,0.689760431628426,2025-04-24 21:03:51.032945,2025-04-24 21:03:51.830610,0 days 00:00:00.797665,friedman_mse,29,sqrt,3,2,random,TPESampler,COMPLETE
561,0.5901353558999477,2025-04-24 21:03:51.781431,2025-04-24 21:03:52.682243,0 days 00:00:00.900812,squared_error,35,sqrt,1,2,random,TPESampler,COMPLETE
562,0.7497192078861455,2025-04-24 21:03:51.948818,2025-04-24 21:03:52.766255,0 days 00:00:00.817437,absolute_error,12,sqrt,1,16,best,TPESampler,COMPLETE
563,0.6294485605176467,2025-04-24 21:03:52.169767,2025-04-24 21:03:52.969676,0 days 00:00:00.799909,friedman_mse,29,sqrt,1,6,random,TPESampler,COMPLETE
564,0.9968066590016214,2025-04-24 21:03:52.917968,2025-04-24 21:03:53.731739,0 days 00:00:00.813771,squared_error,34,log2,10,19,random,TPESampler,COMPLETE
565,0.689760431628426,2025-04-24 21:03:52.979455,2025-04-24 21:03:53.849120,0 days 00:00:00.869665,friedman_mse,35,sqrt,3,5,random,TPESampler,COMPLETE
566,0.971526010237953,2025-04-24 21:03:53.182898,2025-04-24 21:03:54.030299,0 days 00:00:00.847401,absolute_error,22,log2,7,9,random,TPESampler,COMPLETE
567,0.6477874452601059,2025-04-24 21:03:53.983204,2025-04-24 21:03:54.600210,0 days 00:00:00.617006,friedman_mse,30,sqrt,1,6,random,TPESampler,COMPLETE
568,0.572323290498834,2025-04-24 21:03:54.035954,2025-04-24 21:03:55.105088,0 days 00:00:01.069134,friedman_mse,35,sqrt,1,3,random,TPESampler,COMPLETE
569,0.6458391393380777,2025-04-24 21:03:54.192033,2025-04-24 21:03:54.931518,0 days 00:00:00.739485,friedman_mse,29,sqrt,1,2,random,TPESampler,COMPLETE
570,0.5910861426343554,2025-04-24 21:03:54.864040,2025-04-24 21:03:55.536402,0 days 00:00:00.672362,friedman_mse,35,sqrt,1,6,random,TPESampler,COMPLETE
