number,value,datetime_start,datetime_complete,duration,params_criterion,params_max_depth,params_max_features,params_min_samples_leaf,params_min_samples_split,params_splitter,system_attrs_auto:sampler,state
571,0.5910861426343554,2025-04-24 21:03:55.213958,2025-04-24 21:03:55.891551,0 days 00:00:00.677593,friedman_mse,35,sqrt,1,6,random,TPESampler,COMPLETE
572,0.6661569787988538,2025-04-24 21:03:55.350929,2025-04-24 21:03:56.228893,0 days 00:00:00.877964,friedman_mse,29,sqrt,2,6,random,TPESampler,COMPLETE
573,0.9928365741172522,2025-04-24 21:03:55.820596,2025-04-24 21:03:56.737387,0 days 00:00:00.916791,friedman_mse,19,log2,7,12,best,TPESampler,COMPLETE
574,0.5910861426343554,2025-04-24 21:03:56.127934,2025-04-24 21:03:56.921109,0 days 00:00:00.793175,friedman_mse,35,sqrt,1,6,random,TPESampler,COMPLETE
575,0.5735536095371757,2025-04-24 21:03:56.485391,2025-04-24 21:03:57.250876,0 days 00:00:00.765485,friedman_mse,35,sqrt,1,5,random,TPESampler,COMPLETE
576,0.689760431628426,2025-04-24 21:03:57.041870,2025-04-24 21:03:57.821019,0 days 00:00:00.779149,friedman_mse,35,sqrt,3,5,random,TPESampler,COMPLETE
577,0.689760431628426,2025-04-24 21:03:57.203157,2025-04-24 21:03:58.167443,0 days 00:00:00.964286,friedman_mse,35,sqrt,3,2,random,TPESampler,COMPLETE
578,0.689760431628426,2025-04-24 21:03:57.540110,2025-04-24 21:03:58.340929,0 days 00:00:00.800819,friedman_mse,35,sqrt,3,3,random,TPESampler,COMPLETE
579,0.572323290498834,2025-04-24 21:03:58.094431,2025-04-24 21:03:58.718634,0 days 00:00:00.624203,friedman_mse,35,sqrt,1,3,random,TPESampler,COMPLETE
580,0.6458391393380777,2025-04-24 21:03:58.439891,2025-04-24 21:03:59.238630,0 days 00:00:00.798739,friedman_mse,29,sqrt,1,2,random,TPESampler,COMPLETE
581,0.9737936641952643,2025-04-24 21:03:58.600087,2025-04-24 21:03:59.377021,0 days 00:00:00.776934,squared_error,10,sqrt,7,17,random,TPESampler,COMPLETE
582,0.922340079460055,2025-04-24 21:03:58.939003,2025-04-24 21:03:59.583300,0 days 00:00:00.644297,absolute_error,14,log2,3,20,best,TPESampler,COMPLETE
583,0.5735536095371757,2025-04-24 21:03:59.514709,2025-04-24 21:04:00.692387,0 days 00:00:01.177678,friedman_mse,35,sqrt,1,5,random,TPESampler,COMPLETE
584,0.9621018743975015,2025-04-24 21:03:59.591431,2025-04-24 21:04:00.478747,0 days 00:00:00.887316,friedman_mse,2,sqrt,8,13,best,TPESampler,COMPLETE
585,0.572323290498834,2025-04-24 21:03:59.798857,2025-04-24 21:04:00.771170,0 days 00:00:00.972313,friedman_mse,35,sqrt,1,3,random,TPESampler,COMPLETE
586,0.6267094573687406,2025-04-24 21:04:00.724583,2025-04-24 21:04:01.407776,0 days 00:00:00.683193,friedman_mse,29,sqrt,1,5,random,TPESampler,COMPLETE
587,0.5735536095371757,2025-04-24 21:04:00.907473,2025-04-24 21:04:01.726639,0 days 00:00:00.819166,friedman_mse,35,sqrt,1,5,random,TPESampler,COMPLETE
588,0.5735536095371757,2025-04-24 21:04:01.008229,2025-04-24 21:04:01.907477,0 days 00:00:00.899248,friedman_mse,35,sqrt,1,5,random,TPESampler,COMPLETE
589,0.6369530693147781,2025-04-24 21:04:01.673374,2025-04-24 21:04:02.347875,0 days 00:00:00.674501,friedman_mse,30,sqrt,1,9,random,TPESampler,COMPLETE
590,0.6274646664513288,2025-04-24 21:04:02.007724,2025-04-24 21:04:02.863718,0 days 00:00:00.855994,friedman_mse,29,sqrt,1,3,random,TPESampler,COMPLETE
591,0.6146447020156406,2025-04-24 21:04:02.167838,2025-04-24 21:04:03.043820,0 days 00:00:00.875982,friedman_mse,30,sqrt,1,4,random,TPESampler,COMPLETE
592,0.6767196774666705,2025-04-24 21:04:02.576397,2025-04-24 21:04:03.338039,0 days 00:00:00.761642,friedman_mse,29,sqrt,2,5,random,TPESampler,COMPLETE
593,0.6158166985156879,2025-04-24 21:04:03.171064,2025-04-24 21:04:03.883291,0 days 00:00:00.712227,friedman_mse,35,sqrt,1,9,best,TPESampler,COMPLETE
594,0.6794094981777127,2025-04-24 21:04:03.327511,2025-04-24 21:04:03.983648,0 days 00:00:00.656137,friedman_mse,29,sqrt,3,4,best,TPESampler,COMPLETE
595,0.6408571384350191,2025-04-24 21:04:03.632641,2025-04-24 21:04:04.750829,0 days 00:00:01.118188,friedman_mse,35,sqrt,2,2,random,TPESampler,COMPLETE
596,0.6828322741481112,2025-04-24 21:04:04.178106,2025-04-24 21:04:04.933268,0 days 00:00:00.755162,squared_error,30,sqrt,2,5,random,TPESampler,COMPLETE
597,0.6331470915422162,2025-04-24 21:04:04.239505,2025-04-24 21:04:05.000995,0 days 00:00:00.761490,friedman_mse,30,sqrt,1,7,random,TPESampler,COMPLETE
598,0.9740683440979027,2025-04-24 21:04:05.098251,2025-04-24 21:04:06.265994,0 days 00:00:01.167743,absolute_error,35,log2,9,5,random,TPESampler,COMPLETE
599,0.572323290498834,2025-04-24 21:04:05.165253,2025-04-24 21:04:05.984995,0 days 00:00:00.819742,friedman_mse,35,sqrt,1,3,random,TPESampler,COMPLETE
600,0.9756148782405616,2025-04-24 21:04:05.218738,2025-04-24 21:04:06.144016,0 days 00:00:00.925278,friedman_mse,35,log2,2,2,random,TPESampler,COMPLETE
601,0.5901353558999477,2025-04-24 21:04:06.218933,2025-04-24 21:04:07.000322,0 days 00:00:00.781389,friedman_mse,35,sqrt,1,2,random,TPESampler,COMPLETE
602,0.5735536095371757,2025-04-24 21:04:06.409561,2025-04-24 21:04:07.340635,0 days 00:00:00.931074,friedman_mse,35,sqrt,1,5,random,TPESampler,COMPLETE
603,0.9928365741172522,2025-04-24 21:04:06.615490,2025-04-24 21:04:07.713430,0 days 00:00:01.097940,squared_error,13,log2,10,9,best,TPESampler,COMPLETE
604,0.6672753968898228,2025-04-24 21:04:07.344805,2025-04-24 21:04:08.235156,0 days 00:00:00.890351,friedman_mse,35,sqrt,2,8,random,TPESampler,COMPLETE
605,0.689760431628426,2025-04-24 21:04:07.654571,2025-04-24 21:04:08.531729,0 days 00:00:00.877158,friedman_mse,35,sqrt,3,5,random,TPESampler,COMPLETE
606,0.8883954733367782,2025-04-24 21:04:08.045919,2025-04-24 21:04:08.896899,0 days 00:00:00.850980,friedman_mse,35,log2,1,7,random,TPESampler,COMPLETE
607,0.5897648645579153,2025-04-24 21:04:08.476016,2025-04-24 21:04:09.220647,0 days 00:00:00.744631,friedman_mse,35,sqrt,1,7,random,TPESampler,COMPLETE
608,0.9928365741172522,2025-04-24 21:04:08.786186,2025-04-24 21:04:09.518998,0 days 00:00:00.732812,friedman_mse,32,log2,5,20,best,TPESampler,COMPLETE
609,0.5910861426343554,2025-04-24 21:04:09.123094,2025-04-24 21:04:09.966482,0 days 00:00:00.843388,friedman_mse,35,sqrt,1,6,random,TPESampler,COMPLETE
610,0.5901353558999477,2025-04-24 21:04:09.474391,2025-04-24 21:04:10.268164,0 days 00:00:00.793773,friedman_mse,35,sqrt,1,2,random,TPESampler,COMPLETE
611,0.758242579202491,2025-04-24 21:04:09.714766,2025-04-24 21:04:10.480432,0 days 00:00:00.765666,friedman_mse,11,sqrt,4,12,random,TPESampler,COMPLETE
612,0.6267094573687406,2025-04-24 21:04:10.198927,2025-04-24 21:04:11.061773,0 days 00:00:00.862846,friedman_mse,29,sqrt,1,5,random,TPESampler,COMPLETE
613,0.6767196774666705,2025-04-24 21:04:10.542455,2025-04-24 21:04:11.336619,0 days 00:00:00.794164,friedman_mse,29,sqrt,2,5,random,TPESampler,COMPLETE
614,0.9734763840206616,2025-04-24 21:04:10.771715,2025-04-24 21:04:11.525243,0 days 00:00:00.753528,absolute_error,7,log2,1,2,random,TPESampler,COMPLETE
615,0.7246712212327447,2025-04-24 21:04:11.269415,2025-04-24 21:04:11.921367,0 days 00:00:00.651952,friedman_mse,35,sqrt,3,5,best,TPESampler,COMPLETE
616,0.9968066590016214,2025-04-24 21:04:11.625923,2025-04-24 21:04:12.362746,0 days 00:00:00.736823,friedman_mse,6,log2,10,19,random,TPESampler,COMPLETE
617,0.6581634791944057,2025-04-24 21:04:11.797325,2025-04-24 21:04:12.792476,0 days 00:00:00.995151,friedman_mse,30,sqrt,2,2,random,TPESampler,COMPLETE
618,0.572323290498834,2025-04-24 21:04:12.216808,2025-04-24 21:04:13.160534,0 days 00:00:00.943726,friedman_mse,35,sqrt,1,3,random,TPESampler,COMPLETE
619,0.6438247230552657,2025-04-24 21:04:12.698374,2025-04-24 21:04:13.656681,0 days 00:00:00.958307,friedman_mse,35,sqrt,2,6,random,TPESampler,COMPLETE
620,0.5669738735012982,2025-04-24 21:04:13.186347,2025-04-24 21:04:13.846584,0 days 00:00:00.660237,friedman_mse,35,sqrt,1,4,random,TPESampler,COMPLETE
621,0.5901353558999477,2025-04-24 21:04:13.410881,2025-04-24 21:04:14.124551,0 days 00:00:00.713670,friedman_mse,35,sqrt,1,2,random,TPESampler,COMPLETE
622,0.689760431628426,2025-04-24 21:04:13.962467,2025-04-24 21:04:14.698045,0 days 00:00:00.735578,friedman_mse,29,sqrt,3,4,random,TPESampler,COMPLETE
623,0.5910861426343554,2025-04-24 21:04:14.081712,2025-04-24 21:04:15.040435,0 days 00:00:00.958723,friedman_mse,35,sqrt,1,6,random,TPESampler,COMPLETE
624,0.6267094573687406,2025-04-24 21:04:14.396609,2025-04-24 21:04:15.397232,0 days 00:00:01.000623,friedman_mse,29,sqrt,1,5,random,TPESampler,COMPLETE
625,0.572323290498834,2025-04-24 21:04:14.951825,2025-04-24 21:04:15.713370,0 days 00:00:00.761545,friedman_mse,35,sqrt,1,3,random,TPESampler,COMPLETE
626,0.689760431628426,2025-04-24 21:04:15.287151,2025-04-24 21:04:16.104186,0 days 00:00:00.817035,friedman_mse,30,sqrt,3,5,random,TPESampler,COMPLETE
627,0.9619510831483713,2025-04-24 21:04:15.665473,2025-04-24 21:04:16.368232,0 days 00:00:00.702759,absolute_error,34,log2,2,2,random,TPESampler,COMPLETE
628,0.5897648645579153,2025-04-24 21:04:15.945599,2025-04-24 21:04:16.752133,0 days 00:00:00.806534,friedman_mse,35,sqrt,1,7,random,TPESampler,COMPLETE
629,0.8680276422392068,2025-04-24 21:04:16.331577,2025-04-24 21:04:17.140481,0 days 00:00:00.808904,friedman_mse,35,log2,1,2,random,TPESampler,COMPLETE
630,0.689760431628426,2025-04-24 21:04:16.572135,2025-04-24 21:04:17.338082,0 days 00:00:00.765947,friedman_mse,35,sqrt,3,5,random,TPESampler,COMPLETE
631,0.9737936641952643,2025-04-24 21:04:17.074734,2025-04-24 21:04:17.897174,0 days 00:00:00.822440,friedman_mse,33,sqrt,7,10,random,TPESampler,COMPLETE
632,0.9225172148928519,2025-04-24 21:04:17.379865,2025-04-24 21:04:18.269182,0 days 00:00:00.889317,absolute_error,3,sqrt,5,13,best,TPESampler,COMPLETE
633,0.6267927039260746,2025-04-24 21:04:17.591922,2025-04-24 21:04:18.500093,0 days 00:00:00.908171,friedman_mse,30,sqrt,1,5,random,TPESampler,COMPLETE
634,0.6267094573687406,2025-04-24 21:04:18.208583,2025-04-24 21:04:18.850403,0 days 00:00:00.641820,friedman_mse,29,sqrt,1,5,random,TPESampler,COMPLETE
635,0.6438247230552657,2025-04-24 21:04:18.564384,2025-04-24 21:04:19.276388,0 days 00:00:00.712004,friedman_mse,35,sqrt,2,6,random,TPESampler,COMPLETE
636,0.9732829950945884,2025-04-24 21:04:18.842409,2025-04-24 21:04:19.621344,0 days 00:00:00.778935,absolute_error,32,log2,4,17,best,TPESampler,COMPLETE
637,0.5669738735012982,2025-04-24 21:04:19.110420,2025-04-24 21:04:19.864089,0 days 00:00:00.753669,friedman_mse,35,sqrt,1,4,random,TPESampler,COMPLETE
638,0.5897648645579153,2025-04-24 21:04:19.556248,2025-04-24 21:04:20.212395,0 days 00:00:00.656147,friedman_mse,35,sqrt,1,7,random,TPESampler,COMPLETE
639,0.689760431628426,2025-04-24 21:04:19.902111,2025-04-24 21:04:20.956868,0 days 00:00:01.054757,friedman_mse,34,sqrt,3,2,random,TPESampler,COMPLETE
640,0.6464243186205905,2025-04-24 21:04:20.161555,2025-04-24 21:04:20.918292,0 days 00:00:00.756737,absolute_error,34,sqrt,1,9,random,TPESampler,COMPLETE
641,0.689760431628426,2025-04-24 21:04:20.418511,2025-04-24 21:04:21.218036,0 days 00:00:00.799525,friedman_mse,35,sqrt,3,2,random,TPESampler,COMPLETE
642,0.689760431628426,2025-04-24 21:04:21.121349,2025-04-24 21:04:21.720803,0 days 00:00:00.599454,friedman_mse,35,sqrt,3,5,random,TPESampler,COMPLETE
643,0.6267927039260746,2025-04-24 21:04:21.176913,2025-04-24 21:04:22.146495,0 days 00:00:00.969582,friedman_mse,30,sqrt,1,5,random,TPESampler,COMPLETE
644,0.5735536095371757,2025-04-24 21:04:21.456950,2025-04-24 21:04:22.313741,0 days 00:00:00.856791,friedman_mse,35,sqrt,1,5,random,TPESampler,COMPLETE
645,0.689760431628426,2025-04-24 21:04:22.001599,2025-04-24 21:04:22.814426,0 days 00:00:00.812827,squared_error,35,sqrt,3,5,random,TPESampler,COMPLETE
646,0.5735536095371757,2025-04-24 21:04:22.429829,2025-04-24 21:04:23.389110,0 days 00:00:00.959281,friedman_mse,35,sqrt,1,5,random,TPESampler,COMPLETE
647,0.6398489079096115,2025-04-24 21:04:22.687823,2025-04-24 21:04:23.528078,0 days 00:00:00.840255,friedman_mse,28,sqrt,1,3,random,TPESampler,COMPLETE
648,0.6865750431815761,2025-04-24 21:04:23.029997,2025-04-24 21:04:23.840652,0 days 00:00:00.810655,friedman_mse,29,sqrt,2,2,random,TPESampler,COMPLETE
649,0.603345525713688,2025-04-24 21:04:23.604881,2025-04-24 21:04:24.373393,0 days 00:00:00.768512,absolute_error,35,sqrt,1,2,random,TPESampler,COMPLETE
650,0.5735536095371757,2025-04-24 21:04:23.766863,2025-04-24 21:04:24.514125,0 days 00:00:00.747262,friedman_mse,35,sqrt,1,5,random,TPESampler,COMPLETE
651,0.5669738735012982,2025-04-24 21:04:24.059316,2025-04-24 21:04:24.816817,0 days 00:00:00.757501,friedman_mse,35,sqrt,1,4,random,TPESampler,COMPLETE
652,0.6732705314596547,2025-04-24 21:04:24.614841,2025-04-24 21:04:25.341840,0 days 00:00:00.726999,absolute_error,32,sqrt,3,4,random,TPESampler,COMPLETE
653,0.6458391393380777,2025-04-24 21:04:24.711434,2025-04-24 21:04:25.585398,0 days 00:00:00.873964,friedman_mse,29,sqrt,1,2,random,TPESampler,COMPLETE
654,0.5901353558999477,2025-04-24 21:04:25.075289,2025-04-24 21:04:25.944819,0 days 00:00:00.869530,friedman_mse,35,sqrt,1,2,random,TPESampler,COMPLETE
655,0.6828322741481112,2025-04-24 21:04:25.584121,2025-04-24 21:04:26.306347,0 days 00:00:00.722226,friedman_mse,30,sqrt,2,5,random,TPESampler,COMPLETE
656,0.6267927039260746,2025-04-24 21:04:25.847031,2025-04-24 21:04:26.682186,0 days 00:00:00.835155,friedman_mse,30,sqrt,1,5,random,TPESampler,COMPLETE
657,0.5669738735012982,2025-04-24 21:04:26.135337,2025-04-24 21:04:26.877099,0 days 00:00:00.741762,friedman_mse,35,sqrt,1,4,random,TPESampler,COMPLETE
658,0.723316865509627,2025-04-24 21:04:26.599830,2025-04-24 21:04:27.336957,0 days 00:00:00.737127,absolute_error,35,log2,2,6,best,TPESampler,COMPLETE
659,0.5901353558999477,2025-04-24 21:04:26.962774,2025-04-24 21:04:27.801895,0 days 00:00:00.839121,friedman_mse,35,sqrt,1,2,random,TPESampler,COMPLETE
660,0.5669738735012982,2025-04-24 21:04:27.150421,2025-04-24 21:04:27.920932,0 days 00:00:00.770511,friedman_mse,35,sqrt,1,4,random,TPESampler,COMPLETE
661,0.7143351171141927,2025-04-24 21:04:27.574930,2025-04-24 21:04:28.270327,0 days 00:00:00.695397,friedman_mse,35,sqrt,3,7,random,TPESampler,COMPLETE
662,0.610300375570967,2025-04-24 21:04:28.084927,2025-04-24 21:04:28.803247,0 days 00:00:00.718320,friedman_mse,35,sqrt,1,5,best,TPESampler,COMPLETE
663,0.5925119263261721,2025-04-24 21:04:28.134550,2025-04-24 21:04:28.957089,0 days 00:00:00.822539,friedman_mse,35,sqrt,1,3,best,TPESampler,COMPLETE
664,0.6271160627848882,2025-04-24 21:04:28.491520,2025-04-24 21:04:29.226843,0 days 00:00:00.735323,friedman_mse,29,sqrt,1,8,random,TPESampler,COMPLETE
665,0.689760431628426,2025-04-24 21:04:29.081134,2025-04-24 21:04:30.167174,0 days 00:00:01.086040,squared_error,28,sqrt,3,2,random,TPESampler,COMPLETE
666,0.7220766605066294,2025-04-24 21:04:29.172895,2025-04-24 21:04:29.924069,0 days 00:00:00.751174,friedman_mse,17,sqrt,3,7,random,TPESampler,COMPLETE
667,0.5735536095371757,2025-04-24 21:04:29.459274,2025-04-24 21:04:30.252555,0 days 00:00:00.793281,squared_error,35,sqrt,1,5,random,TPESampler,COMPLETE
668,0.5910861426343554,2025-04-24 21:04:30.177621,2025-04-24 21:04:30.980284,0 days 00:00:00.802663,friedman_mse,35,sqrt,1,6,random,TPESampler,COMPLETE
669,0.9928365741172522,2025-04-24 21:04:30.347788,2025-04-24 21:04:31.460217,0 days 00:00:01.112429,friedman_mse,12,log2,6,6,best,TPESampler,COMPLETE
670,0.6458391393380777,2025-04-24 21:04:30.515602,2025-04-24 21:04:31.311773,0 days 00:00:00.796171,friedman_mse,29,sqrt,1,2,random,TPESampler,COMPLETE
671,0.5669738735012982,2025-04-24 21:04:31.306696,2025-04-24 21:04:32.008599,0 days 00:00:00.701903,friedman_mse,35,sqrt,1,4,random,TPESampler,COMPLETE
672,0.6314602793941344,2025-04-24 21:04:31.518800,2025-04-24 21:04:32.400552,0 days 00:00:00.881752,friedman_mse,31,sqrt,1,2,random,TPESampler,COMPLETE
673,0.689760431628426,2025-04-24 21:04:31.739149,2025-04-24 21:04:32.639021,0 days 00:00:00.899872,friedman_mse,30,sqrt,3,5,random,TPESampler,COMPLETE
674,0.6408571384350191,2025-04-24 21:04:32.343952,2025-04-24 21:04:33.092660,0 days 00:00:00.748708,friedman_mse,35,sqrt,2,2,random,TPESampler,COMPLETE
675,0.5897648645579153,2025-04-24 21:04:32.652556,2025-04-24 21:04:33.589077,0 days 00:00:00.936521,friedman_mse,35,sqrt,1,7,random,TPESampler,COMPLETE
676,0.689760431628426,2025-04-24 21:04:33.025314,2025-04-24 21:04:33.783545,0 days 00:00:00.758231,friedman_mse,30,sqrt,3,4,random,TPESampler,COMPLETE
677,0.7143351171141927,2025-04-24 21:04:33.340981,2025-04-24 21:04:34.417925,0 days 00:00:01.076944,friedman_mse,28,sqrt,3,8,random,TPESampler,COMPLETE
678,0.689760431628426,2025-04-24 21:04:33.863427,2025-04-24 21:04:34.696764,0 days 00:00:00.833337,friedman_mse,35,sqrt,3,4,random,TPESampler,COMPLETE
679,0.5735536095371757,2025-04-24 21:04:34.190438,2025-04-24 21:04:34.922319,0 days 00:00:00.731881,friedman_mse,35,sqrt,1,5,random,TPESampler,COMPLETE
680,0.5735536095371757,2025-04-24 21:04:34.640468,2025-04-24 21:04:35.441937,0 days 00:00:00.801469,friedman_mse,35,sqrt,1,5,random,TPESampler,COMPLETE
681,0.9152335590441333,2025-04-24 21:04:34.947823,2025-04-24 21:04:35.771949,0 days 00:00:00.824126,squared_error,21,sqrt,5,12,random,TPESampler,COMPLETE
682,0.6943826006444396,2025-04-24 21:04:35.277393,2025-04-24 21:04:36.123111,0 days 00:00:00.845718,absolute_error,24,sqrt,2,19,random,TPESampler,COMPLETE
683,0.6408571384350191,2025-04-24 21:04:35.765048,2025-04-24 21:04:36.481823,0 days 00:00:00.716775,friedman_mse,35,sqrt,2,4,random,TPESampler,COMPLETE
684,0.5669738735012982,2025-04-24 21:04:36.038793,2025-04-24 21:04:36.958907,0 days 00:00:00.920114,friedman_mse,35,sqrt,1,4,random,TPESampler,COMPLETE
685,0.6294485605176467,2025-04-24 21:04:36.368928,2025-04-24 21:04:37.086090,0 days 00:00:00.717162,friedman_mse,29,sqrt,1,6,random,TPESampler,COMPLETE
686,0.689760431628426,2025-04-24 21:04:36.733746,2025-04-24 21:04:37.610140,0 days 00:00:00.876394,friedman_mse,35,sqrt,3,2,random,TPESampler,COMPLETE
687,0.689760431628426,2025-04-24 21:04:37.183886,2025-04-24 21:04:37.951020,0 days 00:00:00.767134,friedman_mse,35,sqrt,3,3,random,TPESampler,COMPLETE
688,0.7190455830201625,2025-04-24 21:04:37.390560,2025-04-24 21:04:38.271146,0 days 00:00:00.880586,squared_error,35,sqrt,4,4,best,TPESampler,COMPLETE
689,0.9720329956141542,2025-04-24 21:04:37.944786,2025-04-24 21:04:38.661851,0 days 00:00:00.717065,absolute_error,16,log2,3,12,random,TPESampler,COMPLETE
690,0.9740683440979027,2025-04-24 21:04:38.226759,2025-04-24 21:04:38.995390,0 days 00:00:00.768631,absolute_error,1,log2,6,18,random,TPESampler,COMPLETE
691,0.7143351171141927,2025-04-24 21:04:38.493556,2025-04-24 21:04:39.272802,0 days 00:00:00.779246,friedman_mse,35,sqrt,3,7,random,TPESampler,COMPLETE
692,0.6178174092883351,2025-04-24 21:04:38.940306,2025-04-24 21:04:39.721453,0 days 00:00:00.781147,friedman_mse,29,sqrt,1,4,random,TPESampler,COMPLETE
693,0.572323290498834,2025-04-24 21:04:39.275506,2025-04-24 21:04:40.088327,0 days 00:00:00.812821,friedman_mse,35,sqrt,1,3,random,TPESampler,COMPLETE
694,0.6477874452601059,2025-04-24 21:04:39.558209,2025-04-24 21:04:40.303137,0 days 00:00:00.744928,friedman_mse,30,sqrt,1,6,random,TPESampler,COMPLETE
695,0.5901353558999477,2025-04-24 21:04:40.032058,2025-04-24 21:04:40.676247,0 days 00:00:00.644189,friedman_mse,35,sqrt,1,2,random,TPESampler,COMPLETE
696,0.5735536095371757,2025-04-24 21:04:40.390516,2025-04-24 21:04:41.182603,0 days 00:00:00.792087,friedman_mse,35,sqrt,1,5,random,TPESampler,COMPLETE
697,0.7143351171141927,2025-04-24 21:04:40.558477,2025-04-24 21:04:41.314910,0 days 00:00:00.756433,friedman_mse,35,sqrt,3,7,random,TPESampler,COMPLETE
698,0.7682813561270208,2025-04-24 21:04:40.882718,2025-04-24 21:04:41.747959,0 days 00:00:00.865241,friedman_mse,30,sqrt,7,4,best,TPESampler,COMPLETE
699,0.5901353558999477,2025-04-24 21:04:41.440007,2025-04-24 21:04:42.140740,0 days 00:00:00.700733,friedman_mse,35,sqrt,1,2,random,TPESampler,COMPLETE
700,0.6366109246992507,2025-04-24 21:04:41.471407,2025-04-24 21:04:42.384615,0 days 00:00:00.913208,absolute_error,32,sqrt,2,6,best,TPESampler,COMPLETE
701,0.9530278408470751,2025-04-24 21:04:42.056629,2025-04-24 21:04:42.786394,0 days 00:00:00.729765,friedman_mse,29,log2,1,3,random,TPESampler,COMPLETE
702,0.6294485605176467,2025-04-24 21:04:42.505811,2025-04-24 21:04:43.292476,0 days 00:00:00.786665,friedman_mse,29,sqrt,1,6,random,TPESampler,COMPLETE
703,0.6178174092883351,2025-04-24 21:04:42.668606,2025-04-24 21:04:43.608564,0 days 00:00:00.939958,friedman_mse,29,sqrt,1,4,random,TPESampler,COMPLETE
704,0.6708968638004861,2025-04-24 21:04:43.013729,2025-04-24 21:04:43.807941,0 days 00:00:00.794212,friedman_mse,35,sqrt,2,7,random,TPESampler,COMPLETE
705,0.6146447020156406,2025-04-24 21:04:43.536971,2025-04-24 21:04:44.288853,0 days 00:00:00.751882,friedman_mse,30,sqrt,1,4,random,TPESampler,COMPLETE
706,0.9928365741172522,2025-04-24 21:04:43.861635,2025-04-24 21:04:44.654063,0 days 00:00:00.792428,friedman_mse,32,log2,9,17,best,TPESampler,COMPLETE
707,0.572323290498834,2025-04-24 21:04:44.013565,2025-04-24 21:04:44.875859,0 days 00:00:00.862294,friedman_mse,35,sqrt,1,3,random,TPESampler,COMPLETE
708,0.7682813561270208,2025-04-24 21:04:44.563724,2025-04-24 21:04:45.336165,0 days 00:00:00.772441,friedman_mse,32,sqrt,7,17,best,TPESampler,COMPLETE
709,0.6178174092883351,2025-04-24 21:04:44.995382,2025-04-24 21:04:45.866421,0 days 00:00:00.871039,friedman_mse,29,sqrt,1,4,random,TPESampler,COMPLETE
710,0.689760431628426,2025-04-24 21:04:45.180808,2025-04-24 21:04:46.020716,0 days 00:00:00.839908,friedman_mse,30,sqrt,3,5,random,TPESampler,COMPLETE
711,0.9623454203099837,2025-04-24 21:04:45.624696,2025-04-24 21:04:46.347862,0 days 00:00:00.723166,absolute_error,32,log2,2,17,random,TPESampler,COMPLETE
712,0.6438247230552657,2025-04-24 21:04:46.132880,2025-04-24 21:04:46.853398,0 days 00:00:00.720518,friedman_mse,35,sqrt,2,6,random,TPESampler,COMPLETE
713,0.9964161010826412,2025-04-24 21:04:46.225688,2025-04-24 21:04:47.035726,0 days 00:00:00.810038,friedman_mse,29,log2,3,7,random,TPESampler,COMPLETE
