number,value,datetime_start,datetime_complete,duration,params_criterion,params_max_depth,params_max_features,params_min_samples_leaf,params_min_samples_split,params_splitter,system_attrs_auto:sampler,state
1285,0.6953050252159898,2025-04-24 21:08:33.561102,2025-04-24 21:08:34.473845,0 days 00:00:00.912743,squared_error,33,log2,2,10,best,TPESampler,COMPLETE
1286,0.5671925813176031,2025-04-24 21:08:33.839396,2025-04-24 21:08:34.613412,0 days 00:00:00.774016,squared_error,35,sqrt,1,14,best,TPESampler,COMPLETE
1287,0.659210125953578,2025-04-24 21:08:34.557692,2025-04-24 21:08:35.241062,0 days 00:00:00.683370,squared_error,29,sqrt,1,12,best,TPESampler,COMPLETE
1288,0.6657994378256321,2025-04-24 21:08:34.766818,2025-04-24 21:08:35.600685,0 days 00:00:00.833867,squared_error,28,sqrt,1,15,best,TPESampler,COMPLETE
1289,0.621594419398725,2025-04-24 21:08:34.919090,2025-04-24 21:08:35.873750,0 days 00:00:00.954660,squared_error,28,sqrt,1,16,best,TPESampler,COMPLETE
1290,0.5853235656379547,2025-04-24 21:08:35.543742,2025-04-24 21:08:36.429022,0 days 00:00:00.885280,squared_error,35,sqrt,1,13,best,TPESampler,COMPLETE
1291,0.5780541480334686,2025-04-24 21:08:35.934092,2025-04-24 21:08:36.740869,0 days 00:00:00.806777,squared_error,34,sqrt,1,10,best,TPESampler,COMPLETE
1292,0.6327006073621034,2025-04-24 21:08:36.197587,2025-04-24 21:08:36.889673,0 days 00:00:00.692086,squared_error,35,sqrt,1,8,best,TPESampler,COMPLETE
1293,0.5853235656379547,2025-04-24 21:08:36.727633,2025-04-24 21:08:37.427214,0 days 00:00:00.699581,squared_error,35,sqrt,1,13,best,TPESampler,COMPLETE
1294,0.5842675118295414,2025-04-24 21:08:36.967946,2025-04-24 21:08:38.099650,0 days 00:00:01.131704,squared_error,34,sqrt,1,13,best,TPESampler,COMPLETE
1295,0.5853235656379547,2025-04-24 21:08:37.167006,2025-04-24 21:08:37.988754,0 days 00:00:00.821748,squared_error,35,sqrt,1,13,best,TPESampler,COMPLETE
1296,0.659210125953578,2025-04-24 21:08:37.732746,2025-04-24 21:08:38.395355,0 days 00:00:00.662609,squared_error,29,sqrt,1,12,best,TPESampler,COMPLETE
1297,0.5956044908740991,2025-04-24 21:08:38.279645,2025-04-24 21:08:39.153339,0 days 00:00:00.873694,squared_error,35,sqrt,1,11,random,TPESampler,COMPLETE
1298,0.6342324716266236,2025-04-24 21:08:38.348526,2025-04-24 21:08:39.235963,0 days 00:00:00.887437,absolute_error,35,sqrt,1,15,best,TPESampler,COMPLETE
1299,0.7200228907845636,2025-04-24 21:08:38.846087,2025-04-24 21:08:39.548318,0 days 00:00:00.702231,friedman_mse,35,sqrt,4,13,best,TPESampler,COMPLETE
1300,0.6158166985156879,2025-04-24 21:08:39.438000,2025-04-24 21:08:40.238765,0 days 00:00:00.800765,squared_error,35,sqrt,1,9,best,TPESampler,COMPLETE
1301,0.7705920031243296,2025-04-24 21:08:39.504647,2025-04-24 21:08:40.290990,0 days 00:00:00.786343,squared_error,10,sqrt,1,6,random,TPESampler,COMPLETE
1302,0.6990687282789342,2025-04-24 21:08:40.043326,2025-04-24 21:08:41.536796,0 days 00:00:01.493470,squared_error,31,sqrt,3,14,best,TPESampler,COMPLETE
1303,0.6011863667970774,2025-04-24 21:08:40.442339,2025-04-24 21:08:41.463033,0 days 00:00:01.020694,squared_error,35,sqrt,1,11,best,TPESampler,COMPLETE
1304,0.6626945892373451,2025-04-24 21:08:40.576441,2025-04-24 21:08:41.506758,0 days 00:00:00.930317,squared_error,26,sqrt,3,13,best,TPESampler,COMPLETE
1305,0.5671925813176031,2025-04-24 21:08:41.647634,2025-04-24 21:08:42.994534,0 days 00:00:01.346900,squared_error,35,sqrt,1,14,best,TPESampler,COMPLETE
1306,0.6964537071860332,2025-04-24 21:08:41.727238,2025-04-24 21:08:42.695304,0 days 00:00:00.968066,squared_error,29,sqrt,3,9,best,TPESampler,COMPLETE
1307,0.7155967574884852,2025-04-24 21:08:41.804005,2025-04-24 21:08:42.726497,0 days 00:00:00.922492,squared_error,29,sqrt,3,7,best,TPESampler,COMPLETE
1308,0.9225172148928519,2025-04-24 21:08:42.893143,2025-04-24 21:08:43.848625,0 days 00:00:00.955482,absolute_error,3,sqrt,4,2,best,TPESampler,COMPLETE
1309,0.7186431077620621,2025-04-24 21:08:42.954186,2025-04-24 21:08:43.794178,0 days 00:00:00.839992,squared_error,34,sqrt,3,11,best,TPESampler,COMPLETE
1310,0.7186431077620621,2025-04-24 21:08:43.239836,2025-04-24 21:08:44.128869,0 days 00:00:00.889033,squared_error,35,sqrt,3,10,best,TPESampler,COMPLETE
1311,0.6657434878049803,2025-04-24 21:08:44.089744,2025-04-24 21:08:45.123464,0 days 00:00:01.033720,squared_error,34,log2,1,14,best,TPESampler,COMPLETE
1312,0.6747417741593336,2025-04-24 21:08:44.131877,2025-04-24 21:08:45.049364,0 days 00:00:00.917487,absolute_error,32,log2,1,12,best,TPESampler,COMPLETE
1313,0.5853235656379547,2025-04-24 21:08:44.411719,2025-04-24 21:08:45.410038,0 days 00:00:00.998319,squared_error,35,sqrt,1,13,best,TPESampler,COMPLETE
1314,0.6011863667970774,2025-04-24 21:08:45.319934,2025-04-24 21:08:46.179046,0 days 00:00:00.859112,squared_error,35,sqrt,1,11,best,TPESampler,COMPLETE
1315,0.6203042998271446,2025-04-24 21:08:45.374979,2025-04-24 21:08:46.446042,0 days 00:00:01.071063,squared_error,30,sqrt,1,16,best,TPESampler,COMPLETE
1316,0.5842675118295414,2025-04-24 21:08:45.663187,2025-04-24 21:08:46.560530,0 days 00:00:00.897343,friedman_mse,34,sqrt,1,13,best,TPESampler,COMPLETE
1317,0.7186218468788037,2025-04-24 21:08:46.485910,2025-04-24 21:08:47.165885,0 days 00:00:00.679975,squared_error,35,sqrt,3,17,best,TPESampler,COMPLETE
1318,0.6011863667970774,2025-04-24 21:08:46.692223,2025-04-24 21:08:47.625640,0 days 00:00:00.933417,squared_error,35,sqrt,1,11,best,TPESampler,COMPLETE
1319,0.6014217053928542,2025-04-24 21:08:46.910512,2025-04-24 21:08:47.773188,0 days 00:00:00.862676,squared_error,35,sqrt,1,14,random,TPESampler,COMPLETE
1320,0.5880426769542213,2025-04-24 21:08:47.442065,2025-04-24 21:08:48.179683,0 days 00:00:00.737618,squared_error,35,sqrt,1,17,best,TPESampler,COMPLETE
1321,0.6174108501355868,2025-04-24 21:08:47.857576,2025-04-24 21:08:48.700532,0 days 00:00:00.842956,squared_error,28,sqrt,2,15,best,TPESampler,COMPLETE
1322,0.6069838100184047,2025-04-24 21:08:47.988088,2025-04-24 21:08:48.901620,0 days 00:00:00.913532,squared_error,28,sqrt,1,10,best,TPESampler,COMPLETE
1323,0.659210125953578,2025-04-24 21:08:48.431682,2025-04-24 21:08:49.212483,0 days 00:00:00.780801,squared_error,29,sqrt,1,12,best,TPESampler,COMPLETE
1324,0.7200228907845636,2025-04-24 21:08:48.940942,2025-04-24 21:08:49.791036,0 days 00:00:00.850094,squared_error,35,sqrt,4,13,best,TPESampler,COMPLETE
1325,0.5616498096723733,2025-04-24 21:08:49.209676,2025-04-24 21:08:49.964781,0 days 00:00:00.755105,squared_error,35,sqrt,1,12,best,TPESampler,COMPLETE
1326,0.6304878500546764,2025-04-24 21:08:49.479288,2025-04-24 21:08:50.347079,0 days 00:00:00.867791,absolute_error,29,sqrt,1,7,best,TPESampler,COMPLETE
1327,0.5978929531338989,2025-04-24 21:08:50.038848,2025-04-24 21:08:50.947761,0 days 00:00:00.908913,squared_error,35,sqrt,1,10,best,TPESampler,COMPLETE
1328,0.5616498096723733,2025-04-24 21:08:50.231959,2025-04-24 21:08:51.082877,0 days 00:00:00.850918,squared_error,35,sqrt,1,12,best,TPESampler,COMPLETE
1329,0.5900705706240466,2025-04-24 21:08:50.632664,2025-04-24 21:08:51.384959,0 days 00:00:00.752295,squared_error,35,sqrt,1,16,best,TPESampler,COMPLETE
1330,0.68636520552826,2025-04-24 21:08:51.323046,2025-04-24 21:08:51.984960,0 days 00:00:00.661914,squared_error,29,sqrt,3,11,best,TPESampler,COMPLETE
1331,0.649573014390662,2025-04-24 21:08:51.324643,2025-04-24 21:08:52.305110,0 days 00:00:00.980467,squared_error,35,sqrt,2,8,best,TPESampler,COMPLETE
1332,0.6186976381009088,2025-04-24 21:08:51.662680,2025-04-24 21:08:52.704448,0 days 00:00:01.041768,squared_error,30,sqrt,1,11,best,TPESampler,COMPLETE
1333,0.6011863667970774,2025-04-24 21:08:52.260964,2025-04-24 21:08:53.200356,0 days 00:00:00.939392,squared_error,35,sqrt,1,11,best,TPESampler,COMPLETE
1334,0.6214192570092795,2025-04-24 21:08:52.603771,2025-04-24 21:08:53.529762,0 days 00:00:00.925991,squared_error,31,sqrt,1,12,best,TPESampler,COMPLETE
1335,0.6772977101833962,2025-04-24 21:08:52.963739,2025-04-24 21:08:53.713075,0 days 00:00:00.749336,squared_error,29,sqrt,2,12,best,TPESampler,COMPLETE
1336,0.618571421678708,2025-04-24 21:08:53.452007,2025-04-24 21:08:54.259456,0 days 00:00:00.807449,squared_error,34,sqrt,1,12,best,TPESampler,COMPLETE
1337,0.7186431077620621,2025-04-24 21:08:53.770152,2025-04-24 21:08:54.565590,0 days 00:00:00.795438,squared_error,35,sqrt,3,11,best,TPESampler,COMPLETE
1338,0.6595065143489847,2025-04-24 21:08:53.985919,2025-04-24 21:08:54.892990,0 days 00:00:00.907071,squared_error,35,sqrt,2,10,best,TPESampler,COMPLETE
1339,0.7092437143961341,2025-04-24 21:08:54.512490,2025-04-24 21:08:55.435350,0 days 00:00:00.922860,squared_error,30,sqrt,3,12,best,TPESampler,COMPLETE
1340,0.7155308899518609,2025-04-24 21:08:54.933971,2025-04-24 21:08:55.635732,0 days 00:00:00.701761,squared_error,35,sqrt,3,13,best,TPESampler,COMPLETE
1341,0.6011863667970774,2025-04-24 21:08:55.195954,2025-04-24 21:08:56.376011,0 days 00:00:01.180057,squared_error,35,sqrt,1,11,best,TPESampler,COMPLETE
1342,0.6679792761435555,2025-04-24 21:08:55.777317,2025-04-24 21:08:56.738497,0 days 00:00:00.961180,squared_error,28,sqrt,1,13,best,TPESampler,COMPLETE
1343,0.9737936641952643,2025-04-24 21:08:55.832267,2025-04-24 21:08:56.740063,0 days 00:00:00.907796,friedman_mse,9,sqrt,9,2,random,TPESampler,COMPLETE
1344,0.7084195152796207,2025-04-24 21:08:56.677249,2025-04-24 21:08:57.371159,0 days 00:00:00.693910,squared_error,28,log2,1,12,best,TPESampler,COMPLETE
1345,0.6569776090701482,2025-04-24 21:08:57.023748,2025-04-24 21:08:57.951290,0 days 00:00:00.927542,squared_error,35,sqrt,2,12,best,TPESampler,COMPLETE
1346,0.6272893609782497,2025-04-24 21:08:57.075160,2025-04-24 21:08:58.102950,0 days 00:00:01.027790,squared_error,31,sqrt,1,10,best,TPESampler,COMPLETE
1347,0.6481288639616444,2025-04-24 21:08:57.588394,2025-04-24 21:08:58.393197,0 days 00:00:00.804803,squared_error,30,sqrt,2,8,best,TPESampler,COMPLETE
1348,0.6530914488671333,2025-04-24 21:08:58.321862,2025-04-24 21:08:59.191249,0 days 00:00:00.869387,squared_error,35,sqrt,2,13,best,TPESampler,COMPLETE
1349,0.964903983025146,2025-04-24 21:08:58.336437,2025-04-24 21:08:59.225545,0 days 00:00:00.889108,absolute_error,21,log2,6,19,best,TPESampler,COMPLETE
1350,0.5616498096723733,2025-04-24 21:08:58.868927,2025-04-24 21:08:59.681190,0 days 00:00:00.812263,squared_error,35,sqrt,1,12,best,TPESampler,COMPLETE
1351,0.6239750048219057,2025-04-24 21:08:59.424935,2025-04-24 21:09:00.418453,0 days 00:00:00.993518,squared_error,30,sqrt,1,12,best,TPESampler,COMPLETE
1352,0.6011863667970774,2025-04-24 21:08:59.473884,2025-04-24 21:09:00.416982,0 days 00:00:00.943098,friedman_mse,35,sqrt,1,11,best,TPESampler,COMPLETE
1353,0.6451831437449033,2025-04-24 21:08:59.988144,2025-04-24 21:09:00.926707,0 days 00:00:00.938563,squared_error,29,sqrt,1,8,best,TPESampler,COMPLETE
1354,0.971526010237953,2025-04-24 21:09:00.599028,2025-04-24 21:09:01.592738,0 days 00:00:00.993710,absolute_error,18,log2,5,4,random,TPESampler,COMPLETE
1355,0.6062383726266027,2025-04-24 21:09:00.642147,2025-04-24 21:09:01.635058,0 days 00:00:00.992911,squared_error,34,sqrt,1,11,best,TPESampler,COMPLETE
1356,0.7186431077620621,2025-04-24 21:09:01.463983,2025-04-24 21:09:02.368528,0 days 00:00:00.904545,squared_error,35,sqrt,3,10,best,TPESampler,COMPLETE
1357,0.646499814982388,2025-04-24 21:09:01.763885,2025-04-24 21:09:02.957650,0 days 00:00:01.193765,absolute_error,27,sqrt,1,2,best,TPESampler,COMPLETE
1358,0.9159433407254562,2025-04-24 21:09:01.910880,2025-04-24 21:09:02.748098,0 days 00:00:00.837218,friedman_mse,12,log2,2,5,best,TPESampler,COMPLETE
1359,0.6219577036794363,2025-04-24 21:09:02.689228,2025-04-24 21:09:03.311658,0 days 00:00:00.622430,squared_error,29,sqrt,1,13,best,TPESampler,COMPLETE
1360,0.6815637168029901,2025-04-24 21:09:03.032511,2025-04-24 21:09:03.962778,0 days 00:00:00.930267,squared_error,35,log2,1,8,best,TPESampler,COMPLETE
1361,0.6011863667970774,2025-04-24 21:09:03.264163,2025-04-24 21:09:04.287075,0 days 00:00:01.022912,squared_error,35,sqrt,1,11,best,TPESampler,COMPLETE
1362,0.7799537292375676,2025-04-24 21:09:03.547306,2025-04-24 21:09:04.428965,0 days 00:00:00.881659,squared_error,9,sqrt,1,5,best,TPESampler,COMPLETE
1363,0.6346783462746558,2025-04-24 21:09:04.321595,2025-04-24 21:09:05.013224,0 days 00:00:00.691629,squared_error,30,sqrt,1,10,best,TPESampler,COMPLETE
1364,0.6158166985156879,2025-04-24 21:09:04.536166,2025-04-24 21:09:05.354671,0 days 00:00:00.818505,friedman_mse,35,sqrt,1,9,best,TPESampler,COMPLETE
1365,0.5780541480334686,2025-04-24 21:09:04.743417,2025-04-24 21:09:05.632854,0 days 00:00:00.889437,squared_error,34,sqrt,1,10,best,TPESampler,COMPLETE
1366,0.7210392916394468,2025-04-24 21:09:05.359761,2025-04-24 21:09:06.298947,0 days 00:00:00.939186,friedman_mse,35,sqrt,3,15,random,TPESampler,COMPLETE
1367,0.5978929531338989,2025-04-24 21:09:05.587030,2025-04-24 21:09:06.770664,0 days 00:00:01.183634,squared_error,35,sqrt,1,10,best,TPESampler,COMPLETE
1368,0.6155261828297663,2025-04-24 21:09:05.887261,2025-04-24 21:09:07.043433,0 days 00:00:01.156172,absolute_error,32,sqrt,1,10,best,TPESampler,COMPLETE
1369,0.5671925813176031,2025-04-24 21:09:06.623389,2025-04-24 21:09:07.461123,0 days 00:00:00.837734,squared_error,35,sqrt,1,14,best,TPESampler,COMPLETE
1370,0.5853235656379547,2025-04-24 21:09:07.172420,2025-04-24 21:09:08.087006,0 days 00:00:00.914586,squared_error,35,sqrt,1,13,best,TPESampler,COMPLETE
1371,0.7258703503262229,2025-04-24 21:09:07.355540,2025-04-24 21:09:08.200836,0 days 00:00:00.845296,squared_error,35,sqrt,3,8,best,TPESampler,COMPLETE
1372,0.7162306212015819,2025-04-24 21:09:07.777467,2025-04-24 21:09:08.615005,0 days 00:00:00.837538,squared_error,35,sqrt,3,12,best,TPESampler,COMPLETE
1373,0.6239750048219057,2025-04-24 21:09:08.319010,2025-04-24 21:09:09.167513,0 days 00:00:00.848503,squared_error,30,sqrt,1,12,best,TPESampler,COMPLETE
1374,0.9580050953235268,2025-04-24 21:09:08.482261,2025-04-24 21:09:09.338648,0 days 00:00:00.856387,absolute_error,5,log2,2,3,best,TPESampler,COMPLETE
1375,0.6011863667970774,2025-04-24 21:09:08.915208,2025-04-24 21:09:09.694750,0 days 00:00:00.779542,squared_error,35,sqrt,1,11,best,TPESampler,COMPLETE
1376,0.6118796542365356,2025-04-24 21:09:09.438485,2025-04-24 21:09:10.339141,0 days 00:00:00.900656,absolute_error,35,sqrt,1,8,best,TPESampler,COMPLETE
1377,0.5981875505937236,2025-04-24 21:09:09.582736,2025-04-24 21:09:10.473895,0 days 00:00:00.891159,squared_error,35,sqrt,1,7,best,TPESampler,COMPLETE
1378,0.5853235656379547,2025-04-24 21:09:09.997869,2025-04-24 21:09:10.787907,0 days 00:00:00.790038,squared_error,35,sqrt,1,13,best,TPESampler,COMPLETE
1379,0.9621018743975015,2025-04-24 21:09:10.685738,2025-04-24 21:09:11.387527,0 days 00:00:00.701789,squared_error,2,sqrt,8,4,best,TPESampler,COMPLETE
1380,0.7196434236504137,2025-04-24 21:09:10.754161,2025-04-24 21:09:11.847994,0 days 00:00:01.093833,friedman_mse,33,sqrt,3,11,best,TPESampler,COMPLETE
1381,0.7155967574884852,2025-04-24 21:09:11.054261,2025-04-24 21:09:11.907522,0 days 00:00:00.853261,friedman_mse,29,sqrt,3,7,best,TPESampler,COMPLETE
1382,0.6327006073621034,2025-04-24 21:09:11.668612,2025-04-24 21:09:12.319909,0 days 00:00:00.651297,friedman_mse,35,sqrt,1,8,best,TPESampler,COMPLETE
1383,0.6077884737561778,2025-04-24 21:09:12.036327,2025-04-24 21:09:13.015527,0 days 00:00:00.979200,friedman_mse,25,sqrt,1,6,best,TPESampler,COMPLETE
1384,0.5616498096723733,2025-04-24 21:09:12.108652,2025-04-24 21:09:13.072327,0 days 00:00:00.963675,squared_error,35,sqrt,1,12,best,TPESampler,COMPLETE
1385,0.6966386482436462,2025-04-24 21:09:12.595358,2025-04-24 21:09:13.411539,0 days 00:00:00.816181,squared_error,31,sqrt,3,12,best,TPESampler,COMPLETE
1386,0.6011863667970774,2025-04-24 21:09:13.320475,2025-04-24 21:09:13.981051,0 days 00:00:00.660576,squared_error,35,sqrt,1,11,best,TPESampler,COMPLETE
1387,0.6015012618996902,2025-04-24 21:09:13.371860,2025-04-24 21:09:14.329677,0 days 00:00:00.957817,squared_error,30,sqrt,1,8,best,TPESampler,COMPLETE
1388,0.6309862218325992,2025-04-24 21:09:13.661918,2025-04-24 21:09:14.564630,0 days 00:00:00.902712,squared_error,29,sqrt,1,14,random,TPESampler,COMPLETE
1389,0.6321873822339226,2025-04-24 21:09:14.284963,2025-04-24 21:09:14.993158,0 days 00:00:00.708195,squared_error,35,sqrt,2,11,best,TPESampler,COMPLETE
1390,0.609437299456365,2025-04-24 21:09:14.683440,2025-04-24 21:09:15.558906,0 days 00:00:00.875466,squared_error,29,sqrt,1,10,best,TPESampler,COMPLETE
1391,0.5978929531338989,2025-04-24 21:09:14.868909,2025-04-24 21:09:15.711315,0 days 00:00:00.842406,squared_error,35,sqrt,1,10,best,TPESampler,COMPLETE
1392,0.6445043268504566,2025-04-24 21:09:15.270980,2025-04-24 21:09:15.971720,0 days 00:00:00.700740,squared_error,35,log2,1,12,best,TPESampler,COMPLETE
1393,0.7128024838985607,2025-04-24 21:09:15.832377,2025-04-24 21:09:16.750049,0 days 00:00:00.917672,squared_error,27,sqrt,3,12,best,TPESampler,COMPLETE
1394,0.6295733552888221,2025-04-24 21:09:15.931562,2025-04-24 21:09:16.849259,0 days 00:00:00.917697,squared_error,32,sqrt,1,13,best,TPESampler,COMPLETE
1395,0.7155308899518609,2025-04-24 21:09:16.433769,2025-04-24 21:09:17.247671,0 days 00:00:00.813902,squared_error,35,sqrt,3,14,best,TPESampler,COMPLETE
1396,0.6011863667970774,2025-04-24 21:09:17.105904,2025-04-24 21:09:17.857683,0 days 00:00:00.751779,squared_error,35,sqrt,1,11,best,TPESampler,COMPLETE
1397,0.6850354486810637,2025-04-24 21:09:17.203956,2025-04-24 21:09:18.317963,0 days 00:00:01.114007,squared_error,27,sqrt,1,13,best,TPESampler,COMPLETE
1398,0.6708162073173933,2025-04-24 21:09:17.544027,2025-04-24 21:09:18.412597,0 days 00:00:00.868570,squared_error,28,sqrt,2,12,best,TPESampler,COMPLETE
1399,0.7461578418738657,2025-04-24 21:09:18.154377,2025-04-24 21:09:18.910910,0 days 00:00:00.756533,squared_error,16,log2,1,8,best,TPESampler,COMPLETE
1400,0.629624198383062,2025-04-24 21:09:18.567560,2025-04-24 21:09:19.457566,0 days 00:00:00.890006,friedman_mse,31,sqrt,1,13,best,TPESampler,COMPLETE
1401,0.9928365741172522,2025-04-24 21:09:18.744212,2025-04-24 21:09:19.759525,0 days 00:00:01.015313,friedman_mse,33,log2,5,2,best,TPESampler,COMPLETE
1402,0.6219577036794363,2025-04-24 21:09:19.166787,2025-04-24 21:09:20.022021,0 days 00:00:00.855234,squared_error,29,sqrt,1,13,best,TPESampler,COMPLETE
1403,0.6327006073621034,2025-04-24 21:09:19.708516,2025-04-24 21:09:20.584771,0 days 00:00:00.876255,friedman_mse,35,sqrt,1,8,best,TPESampler,COMPLETE
1404,0.6212356206607815,2025-04-24 21:09:20.028538,2025-04-24 21:09:20.781417,0 days 00:00:00.752879,squared_error,29,sqrt,1,11,best,TPESampler,COMPLETE
1405,0.5978929531338989,2025-04-24 21:09:20.312713,2025-04-24 21:09:21.348483,0 days 00:00:01.035770,squared_error,35,sqrt,1,10,best,TPESampler,COMPLETE
1406,0.6011863667970774,2025-04-24 21:09:20.860593,2025-04-24 21:09:21.606446,0 days 00:00:00.745853,squared_error,35,sqrt,1,11,best,TPESampler,COMPLETE
1407,0.5616498096723733,2025-04-24 21:09:21.125858,2025-04-24 21:09:21.971919,0 days 00:00:00.846061,squared_error,35,sqrt,1,12,best,TPESampler,COMPLETE
1408,0.6540978000576883,2025-04-24 21:09:21.660195,2025-04-24 21:09:22.499159,0 days 00:00:00.838964,friedman_mse,29,sqrt,1,7,best,TPESampler,COMPLETE
1409,0.7135700678476479,2025-04-24 21:09:21.863836,2025-04-24 21:09:22.686811,0 days 00:00:00.822975,squared_error,33,sqrt,3,13,best,TPESampler,COMPLETE
1410,0.610300375570967,2025-04-24 21:09:22.253715,2025-04-24 21:09:23.066742,0 days 00:00:00.813027,friedman_mse,35,sqrt,1,5,best,TPESampler,COMPLETE
1411,0.5616498096723733,2025-04-24 21:09:22.741607,2025-04-24 21:09:23.608271,0 days 00:00:00.866664,squared_error,35,sqrt,1,12,best,TPESampler,COMPLETE
1412,0.7162306212015819,2025-04-24 21:09:22.922657,2025-04-24 21:09:23.787583,0 days 00:00:00.864926,squared_error,34,sqrt,3,12,best,TPESampler,COMPLETE
1413,0.5616498096723733,2025-04-24 21:09:23.343522,2025-04-24 21:09:24.070439,0 days 00:00:00.726917,friedman_mse,35,sqrt,1,12,best,TPESampler,COMPLETE
1414,0.5842675118295414,2025-04-24 21:09:23.891360,2025-04-24 21:09:24.860817,0 days 00:00:00.969457,squared_error,34,sqrt,1,13,best,TPESampler,COMPLETE
1415,0.5842675118295414,2025-04-24 21:09:24.036382,2025-04-24 21:09:25.172344,0 days 00:00:01.135962,squared_error,34,sqrt,1,13,best,TPESampler,COMPLETE
1416,0.9962502283466568,2025-04-24 21:09:24.321233,2025-04-24 21:09:25.159140,0 days 00:00:00.837907,friedman_mse,28,log2,6,19,random,TPESampler,COMPLETE
1417,0.5991101576395818,2025-04-24 21:09:25.119326,2025-04-24 21:09:26.071712,0 days 00:00:00.952386,squared_error,34,sqrt,1,11,random,TPESampler,COMPLETE
1418,0.6530914488671333,2025-04-24 21:09:25.409237,2025-04-24 21:09:26.381232,0 days 00:00:00.971995,squared_error,35,sqrt,2,13,best,TPESampler,COMPLETE
1419,0.7186218468788037,2025-04-24 21:09:25.460198,2025-04-24 21:09:26.423436,0 days 00:00:00.963238,friedman_mse,35,sqrt,3,15,best,TPESampler,COMPLETE
1420,0.6219577036794363,2025-04-24 21:09:26.321588,2025-04-24 21:09:27.038650,0 days 00:00:00.717062,squared_error,29,sqrt,1,13,best,TPESampler,COMPLETE
1421,0.6931973418375907,2025-04-24 21:09:26.583386,2025-04-24 21:09:27.538347,0 days 00:00:00.954961,friedman_mse,21,sqrt,3,12,best,TPESampler,COMPLETE
1422,0.7186431077620621,2025-04-24 21:09:26.689183,2025-04-24 21:09:27.745332,0 days 00:00:01.056149,squared_error,35,sqrt,3,11,best,TPESampler,COMPLETE
1423,0.6045022893329373,2025-04-24 21:09:27.326727,2025-04-24 21:09:28.067511,0 days 00:00:00.740784,friedman_mse,28,sqrt,1,6,best,TPESampler,COMPLETE
1424,0.5853235656379547,2025-04-24 21:09:27.785718,2025-04-24 21:09:28.969781,0 days 00:00:01.184063,squared_error,35,sqrt,1,13,best,TPESampler,COMPLETE
1425,0.6326878795249784,2025-04-24 21:09:28.020343,2025-04-24 21:09:28.828350,0 days 00:00:00.808007,absolute_error,35,sqrt,2,11,best,TPESampler,COMPLETE
1426,0.5616498096723733,2025-04-24 21:09:28.286113,2025-04-24 21:09:29.130278,0 days 00:00:00.844165,squared_error,35,sqrt,1,12,best,TPESampler,COMPLETE
