number,value,datetime_start,datetime_complete,duration,params_criterion,params_max_depth,params_max_features,params_min_samples_leaf,params_min_samples_split,params_splitter,system_attrs_auto:sampler,state
0,0.9928365741172522,2025-04-24 21:00:23.711162,2025-04-24 21:00:24.316245,0 days 00:00:00.605083,friedman_mse,1,log2,9,2,best,RandomSampler,COMPLETE
1,0.988192362972504,2025-04-24 21:00:23.727592,2025-04-24 21:00:24.311004,0 days 00:00:00.583412,friedman_mse,4,log2,4,11,best,RandomSampler,COMPLETE
2,0.7600001757728128,2025-04-24 21:00:23.807843,2025-04-24 21:00:24.384181,0 days 00:00:00.576338,friedman_mse,17,sqrt,1,20,random,RandomSampler,COMPLETE
3,0.9543211654238264,2025-04-24 21:00:24.495258,2025-04-24 21:00:25.231366,0 days 00:00:00.736108,absolute_error,2,sqrt,7,19,random,TPESampler,COMPLETE
4,0.971526010237953,2025-04-24 21:00:24.506150,2025-04-24 21:00:25.095047,0 days 00:00:00.588897,absolute_error,6,log2,6,15,random,TPESampler,COMPLETE
5,0.9368976210873065,2025-04-24 21:00:24.525547,2025-04-24 21:00:25.372027,0 days 00:00:00.846480,squared_error,21,log2,3,14,best,TPESampler,COMPLETE
6,0.679590395566603,2025-04-24 21:00:25.332150,2025-04-24 21:00:25.821429,0 days 00:00:00.489279,friedman_mse,28,sqrt,2,2,random,TPESampler,COMPLETE
7,0.7774448084602187,2025-04-24 21:00:25.549336,2025-04-24 21:00:26.092902,0 days 00:00:00.543566,friedman_mse,14,sqrt,10,14,best,TPESampler,COMPLETE
8,0.9740683440979027,2025-04-24 21:00:25.782782,2025-04-24 21:00:26.395052,0 days 00:00:00.612270,absolute_error,25,log2,10,11,random,TPESampler,COMPLETE
9,0.7238353318092209,2025-04-24 21:00:26.050067,2025-04-24 21:00:26.691390,0 days 00:00:00.641323,absolute_error,32,sqrt,6,5,best,TPESampler,COMPLETE
10,0.967750226038825,2025-04-24 21:00:26.293503,2025-04-24 21:00:26.833481,0 days 00:00:00.539978,squared_error,15,log2,2,9,random,TPESampler,COMPLETE
11,0.9680489899896118,2025-04-24 21:00:26.628388,2025-04-24 21:00:27.106337,0 days 00:00:00.477949,squared_error,5,sqrt,5,12,random,TPESampler,COMPLETE
12,0.7238353318092209,2025-04-24 21:00:26.901632,2025-04-24 21:00:27.591651,0 days 00:00:00.690019,absolute_error,34,sqrt,6,4,best,TPESampler,COMPLETE
13,0.6448501516931647,2025-04-24 21:00:27.104592,2025-04-24 21:00:27.881065,0 days 00:00:00.776473,friedman_mse,28,sqrt,1,6,random,TPESampler,COMPLETE
14,0.9737936641952643,2025-04-24 21:00:27.424405,2025-04-24 21:00:28.172282,0 days 00:00:00.747877,friedman_mse,22,sqrt,7,3,random,TPESampler,COMPLETE
15,0.6271160627848882,2025-04-24 21:00:27.954022,2025-04-24 21:00:28.538926,0 days 00:00:00.584904,friedman_mse,29,sqrt,1,8,random,TPESampler,COMPLETE
16,0.7483617814574448,2025-04-24 21:00:28.170811,2025-04-24 21:00:28.989442,0 days 00:00:00.818631,friedman_mse,34,sqrt,4,13,random,TPESampler,COMPLETE
17,0.7408501443798525,2025-04-24 21:00:28.425317,2025-04-24 21:00:29.132348,0 days 00:00:00.707031,friedman_mse,17,sqrt,1,9,random,TPESampler,COMPLETE
18,0.9756148782405616,2025-04-24 21:00:28.733902,2025-04-24 21:00:29.371781,0 days 00:00:00.637879,squared_error,30,log2,2,3,random,TPESampler,COMPLETE
19,0.598283265820093,2025-04-24 21:00:29.238623,2025-04-24 21:00:30.143006,0 days 00:00:00.904383,friedman_mse,33,sqrt,1,10,random,TPESampler,COMPLETE
20,0.649573014390662,2025-04-24 21:00:29.311204,2025-04-24 21:00:30.332042,0 days 00:00:01.020838,squared_error,35,sqrt,2,8,best,TPESampler,COMPLETE
21,0.6077884737561778,2025-04-24 21:00:29.598847,2025-04-24 21:00:30.430273,0 days 00:00:00.831426,squared_error,25,sqrt,1,6,best,TPESampler,COMPLETE
22,0.791216231769204,2025-04-24 21:00:30.369760,2025-04-24 21:00:31.321002,0 days 00:00:00.951242,squared_error,12,sqrt,3,5,best,TPESampler,COMPLETE
23,0.6540055888703845,2025-04-24 21:00:30.591738,2025-04-24 21:00:31.456978,0 days 00:00:00.865240,squared_error,23,sqrt,1,4,best,TPESampler,COMPLETE
24,0.6448971905698498,2025-04-24 21:00:30.830333,2025-04-24 21:00:31.764441,0 days 00:00:00.934108,absolute_error,27,sqrt,2,14,random,TPESampler,COMPLETE
25,0.9749715991626106,2025-04-24 21:00:31.613251,2025-04-24 21:00:32.762438,0 days 00:00:01.149187,friedman_mse,25,log2,2,11,random,TPESampler,COMPLETE
26,0.9749715991626106,2025-04-24 21:00:31.712241,2025-04-24 21:00:32.812864,0 days 00:00:01.100623,friedman_mse,27,log2,2,11,random,TPESampler,COMPLETE
27,0.5991101576395818,2025-04-24 21:00:32.004152,2025-04-24 21:00:33.013775,0 days 00:00:01.009623,friedman_mse,34,sqrt,1,11,random,TPESampler,COMPLETE
28,0.68893655195591,2025-04-24 21:00:33.053871,2025-04-24 21:00:33.783389,0 days 00:00:00.729518,squared_error,24,sqrt,1,10,best,TPESampler,COMPLETE
29,0.6201637266171189,2025-04-24 21:00:33.107315,2025-04-24 21:00:34.126423,0 days 00:00:01.019108,absolute_error,35,sqrt,1,8,random,TPESampler,COMPLETE
30,0.6093198091926756,2025-04-24 21:00:33.268582,2025-04-24 21:00:34.170077,0 days 00:00:00.901495,friedman_mse,33,sqrt,1,14,random,TPESampler,COMPLETE
31,0.615172530587286,2025-04-24 21:00:34.053534,2025-04-24 21:00:34.748817,0 days 00:00:00.695283,friedman_mse,24,sqrt,1,13,best,TPESampler,COMPLETE
32,0.6251276831187144,2025-04-24 21:00:34.288010,2025-04-24 21:00:35.217359,0 days 00:00:00.929349,friedman_mse,32,sqrt,1,15,random,TPESampler,COMPLETE
33,0.5994812466507513,2025-04-24 21:00:34.400654,2025-04-24 21:00:35.273374,0 days 00:00:00.872720,friedman_mse,34,sqrt,1,13,random,TPESampler,COMPLETE
34,0.6053271915456655,2025-04-24 21:00:35.008969,2025-04-24 21:00:35.662101,0 days 00:00:00.653132,squared_error,32,sqrt,1,13,random,TPESampler,COMPLETE
35,0.7049168081040487,2025-04-24 21:00:35.398285,2025-04-24 21:00:36.130470,0 days 00:00:00.732185,squared_error,27,sqrt,2,12,random,TPESampler,COMPLETE
36,0.6615058255818821,2025-04-24 21:00:35.507728,2025-04-24 21:00:36.329015,0 days 00:00:00.821287,squared_error,32,sqrt,2,15,random,TPESampler,COMPLETE
37,0.6943121931815914,2025-04-24 21:00:36.075311,2025-04-24 21:00:36.713198,0 days 00:00:00.637887,friedman_mse,35,log2,2,16,best,TPESampler,COMPLETE
38,0.9962502283466568,2025-04-24 21:00:36.390472,2025-04-24 21:00:37.046749,0 days 00:00:00.656277,squared_error,33,log2,6,15,random,TPESampler,COMPLETE
39,0.5850611944576458,2025-04-24 21:00:36.654638,2025-04-24 21:00:37.485121,0 days 00:00:00.830483,absolute_error,33,sqrt,3,16,best,TPESampler,COMPLETE
40,0.6080739943014954,2025-04-24 21:00:37.002645,2025-04-24 21:00:37.747227,0 days 00:00:00.744582,friedman_mse,35,sqrt,1,10,random,TPESampler,COMPLETE
41,0.6108844305993476,2025-04-24 21:00:37.317053,2025-04-24 21:00:38.126402,0 days 00:00:00.809349,absolute_error,35,sqrt,3,16,best,TPESampler,COMPLETE
42,0.7232416036747522,2025-04-24 21:00:37.799114,2025-04-24 21:00:38.476798,0 days 00:00:00.677684,absolute_error,25,log2,2,18,best,TPESampler,COMPLETE
43,0.9585835621537486,2025-04-24 21:00:38.030550,2025-04-24 21:00:38.781826,0 days 00:00:00.751276,absolute_error,5,sqrt,2,19,best,TPESampler,COMPLETE
44,0.9482326291575534,2025-04-24 21:00:38.362265,2025-04-24 21:00:39.086595,0 days 00:00:00.724330,squared_error,29,log2,1,14,random,TPESampler,COMPLETE
45,0.7150183055863607,2025-04-24 21:00:38.690872,2025-04-24 21:00:39.425139,0 days 00:00:00.734267,squared_error,33,sqrt,3,16,best,TPESampler,COMPLETE
46,0.6303303204719402,2025-04-24 21:00:39.040373,2025-04-24 21:00:39.854731,0 days 00:00:00.814358,absolute_error,30,sqrt,1,11,best,TPESampler,COMPLETE
47,0.9732829950945884,2025-04-24 21:00:39.380988,2025-04-24 21:00:40.152825,0 days 00:00:00.771837,absolute_error,33,log2,4,11,best,TPESampler,COMPLETE
48,0.6031643544199893,2025-04-24 21:00:39.728459,2025-04-24 21:00:40.603358,0 days 00:00:00.874899,squared_error,31,sqrt,1,10,random,TPESampler,COMPLETE
49,0.6893613079905405,2025-04-24 21:00:40.155696,2025-04-24 21:00:40.929930,0 days 00:00:00.774234,absolute_error,25,sqrt,4,20,best,TPESampler,COMPLETE
50,0.6029430312616197,2025-04-24 21:00:40.500350,2025-04-24 21:00:41.277709,0 days 00:00:00.777359,squared_error,32,sqrt,1,5,random,TPESampler,COMPLETE
51,0.675982364902162,2025-04-24 21:00:40.870741,2025-04-24 21:00:41.614647,0 days 00:00:00.743906,friedman_mse,35,sqrt,2,6,best,TPESampler,COMPLETE
52,0.6659409810363822,2025-04-24 21:00:41.224857,2025-04-24 21:00:41.964756,0 days 00:00:00.739899,squared_error,33,sqrt,2,2,random,TPESampler,COMPLETE
53,0.6739241387721318,2025-04-24 21:00:41.571448,2025-04-24 21:00:42.429764,0 days 00:00:00.858316,squared_error,27,sqrt,2,8,random,TPESampler,COMPLETE
54,0.6368902311899737,2025-04-24 21:00:41.846263,2025-04-24 21:00:42.709614,0 days 00:00:00.863351,squared_error,27,sqrt,1,6,random,TPESampler,COMPLETE
55,0.9928365741172522,2025-04-24 21:00:42.190051,2025-04-24 21:00:43.010288,0 days 00:00:00.820237,squared_error,9,log2,7,11,best,TPESampler,COMPLETE
56,0.7200228907845636,2025-04-24 21:00:42.706999,2025-04-24 21:00:43.343594,0 days 00:00:00.636595,friedman_mse,33,sqrt,4,14,best,TPESampler,COMPLETE
57,0.9737936641952643,2025-04-24 21:00:43.001420,2025-04-24 21:00:43.968928,0 days 00:00:00.967508,friedman_mse,25,sqrt,10,20,random,TPESampler,COMPLETE
58,0.9928365741172522,2025-04-24 21:00:43.198072,2025-04-24 21:00:44.150910,0 days 00:00:00.952838,squared_error,26,log2,8,2,best,TPESampler,COMPLETE
59,0.9261146242179444,2025-04-24 21:00:43.910537,2025-04-24 21:00:44.674721,0 days 00:00:00.764184,absolute_error,2,sqrt,6,6,best,TPESampler,COMPLETE
60,0.9601928051021433,2025-04-24 21:00:44.268306,2025-04-24 21:00:44.965291,0 days 00:00:00.696985,absolute_error,5,sqrt,2,10,random,TPESampler,COMPLETE
61,0.6672753968898228,2025-04-24 21:00:44.521514,2025-04-24 21:00:45.273038,0 days 00:00:00.751524,squared_error,35,sqrt,2,8,random,TPESampler,COMPLETE
62,0.9975432579877402,2025-04-24 21:00:44.943585,2025-04-24 21:00:45.676280,0 days 00:00:00.732695,squared_error,6,log2,1,20,random,TPESampler,COMPLETE
63,0.9450547319334748,2025-04-24 21:00:45.220093,2025-04-24 21:00:46.013385,0 days 00:00:00.793292,absolute_error,32,log2,1,12,random,TPESampler,COMPLETE
64,0.5956044908740991,2025-04-24 21:00:45.542295,2025-04-24 21:00:46.331637,0 days 00:00:00.789342,squared_error,35,sqrt,1,11,random,TPESampler,COMPLETE
65,0.9738497171248582,2025-04-24 21:00:45.960524,2025-04-24 21:00:46.602804,0 days 00:00:00.642280,friedman_mse,2,sqrt,7,4,random,TPESampler,COMPLETE
66,0.6770350859320085,2025-04-24 21:00:46.208815,2025-04-24 21:00:46.925905,0 days 00:00:00.717090,friedman_mse,28,sqrt,2,12,random,TPESampler,COMPLETE
67,0.7464799534437441,2025-04-24 21:00:46.561505,2025-04-24 21:00:47.194748,0 days 00:00:00.633243,friedman_mse,29,sqrt,4,7,random,TPESampler,COMPLETE
68,0.9928365741172522,2025-04-24 21:00:46.835863,2025-04-24 21:00:47.574394,0 days 00:00:00.738531,friedman_mse,13,log2,7,18,best,TPESampler,COMPLETE
69,0.9962502283466568,2025-04-24 21:00:47.150441,2025-04-24 21:00:47.867633,0 days 00:00:00.717192,squared_error,14,log2,6,19,random,TPESampler,COMPLETE
70,0.6062383726266027,2025-04-24 21:00:47.460636,2025-04-24 21:00:48.254110,0 days 00:00:00.793474,friedman_mse,34,sqrt,1,11,best,TPESampler,COMPLETE
71,0.7785265082009343,2025-04-24 21:00:47.812325,2025-04-24 21:00:48.566036,0 days 00:00:00.753711,friedman_mse,20,log2,1,5,best,TPESampler,COMPLETE
72,0.584815607939243,2025-04-24 21:00:48.132758,2025-04-24 21:00:48.922340,0 days 00:00:00.789582,squared_error,33,sqrt,1,13,random,TPESampler,COMPLETE
73,0.61003860929192,2025-04-24 21:00:48.476717,2025-04-24 21:00:49.231590,0 days 00:00:00.754873,squared_error,33,sqrt,1,11,random,TPESampler,COMPLETE
74,0.6598090476337168,2025-04-24 21:00:48.812668,2025-04-24 21:00:49.556049,0 days 00:00:00.743381,absolute_error,34,sqrt,2,18,random,TPESampler,COMPLETE
75,0.7238353318092209,2025-04-24 21:00:49.175556,2025-04-24 21:00:49.884092,0 days 00:00:00.708536,absolute_error,27,sqrt,6,12,best,TPESampler,COMPLETE
76,0.5868961265114919,2025-04-24 21:00:49.452418,2025-04-24 21:00:50.214615,0 days 00:00:00.762197,friedman_mse,35,sqrt,1,8,random,TPESampler,COMPLETE
77,0.9737936641952643,2025-04-24 21:00:49.775212,2025-04-24 21:00:50.478935,0 days 00:00:00.703723,squared_error,12,sqrt,10,16,random,TPESampler,COMPLETE
78,0.5910861426343554,2025-04-24 21:00:50.100246,2025-04-24 21:00:50.828618,0 days 00:00:00.728372,friedman_mse,35,sqrt,1,6,random,TPESampler,COMPLETE
79,0.7135231976865668,2025-04-24 21:00:50.468423,2025-04-24 21:00:51.134098,0 days 00:00:00.665675,friedman_mse,34,sqrt,3,10,random,TPESampler,COMPLETE
80,0.6146447020156406,2025-04-24 21:00:50.706000,2025-04-24 21:00:51.575204,0 days 00:00:00.869204,friedman_mse,30,sqrt,1,4,random,TPESampler,COMPLETE
81,0.9962502283466568,2025-04-24 21:00:51.062067,2025-04-24 21:00:51.813878,0 days 00:00:00.751811,friedman_mse,34,log2,5,6,random,TPESampler,COMPLETE
82,0.6007924014186778,2025-04-24 21:00:51.390082,2025-04-24 21:00:52.217876,0 days 00:00:00.827794,friedman_mse,32,sqrt,1,9,random,TPESampler,COMPLETE
83,0.9928365741172522,2025-04-24 21:00:51.807390,2025-04-24 21:00:52.521526,0 days 00:00:00.714136,friedman_mse,34,log2,10,12,best,TPESampler,COMPLETE
84,0.5691234829311607,2025-04-24 21:00:52.063215,2025-04-24 21:00:52.799937,0 days 00:00:00.736722,friedman_mse,34,sqrt,1,7,random,TPESampler,COMPLETE
85,0.6029395236055548,2025-04-24 21:00:52.457551,2025-04-24 21:00:53.187813,0 days 00:00:00.730262,friedman_mse,33,sqrt,1,9,random,TPESampler,COMPLETE
86,0.689760431628426,2025-04-24 21:00:52.751487,2025-04-24 21:00:53.483895,0 days 00:00:00.732408,friedman_mse,35,sqrt,3,3,random,TPESampler,COMPLETE
87,0.6098714731524191,2025-04-24 21:00:53.085773,2025-04-24 21:00:53.919791,0 days 00:00:00.834018,friedman_mse,34,sqrt,1,5,random,TPESampler,COMPLETE
88,0.6353895806520753,2025-04-24 21:00:53.436766,2025-04-24 21:00:54.191402,0 days 00:00:00.754636,friedman_mse,31,sqrt,1,13,random,TPESampler,COMPLETE
89,0.6014217053928542,2025-04-24 21:00:53.804852,2025-04-24 21:00:54.549531,0 days 00:00:00.744679,squared_error,35,sqrt,1,14,random,TPESampler,COMPLETE
90,0.9749715991626106,2025-04-24 21:00:54.181538,2025-04-24 21:00:54.881605,0 days 00:00:00.700067,friedman_mse,35,log2,2,9,random,TPESampler,COMPLETE
91,0.90376982927729,2025-04-24 21:00:54.426994,2025-04-24 21:00:55.207479,0 days 00:00:00.780485,absolute_error,34,sqrt,5,7,random,TPESampler,COMPLETE
92,0.9281544931504808,2025-04-24 21:00:54.771796,2025-04-24 21:00:55.446878,0 days 00:00:00.675082,friedman_mse,30,log2,1,3,random,TPESampler,COMPLETE
93,0.5821890428713193,2025-04-24 21:00:55.104250,2025-04-24 21:00:55.786165,0 days 00:00:00.681915,friedman_mse,34,sqrt,1,8,random,TPESampler,COMPLETE
94,0.5991101576395818,2025-04-24 21:00:55.407978,2025-04-24 21:00:56.175730,0 days 00:00:00.767752,friedman_mse,34,sqrt,1,11,random,TPESampler,COMPLETE
95,0.7669212232792286,2025-04-24 21:00:55.743523,2025-04-24 21:00:56.473387,0 days 00:00:00.729864,friedman_mse,11,sqrt,5,13,best,TPESampler,COMPLETE
96,0.6584093215051056,2025-04-24 21:00:56.062055,2025-04-24 21:00:56.805855,0 days 00:00:00.743800,friedman_mse,35,sqrt,2,10,random,TPESampler,COMPLETE
97,0.7389997290168945,2025-04-24 21:00:56.411400,2025-04-24 21:00:57.216922,0 days 00:00:00.805522,absolute_error,7,sqrt,8,18,best,TPESampler,COMPLETE
98,0.7895823578654255,2025-04-24 21:00:56.690061,2025-04-24 21:00:57.569113,0 days 00:00:00.879052,friedman_mse,7,sqrt,10,4,best,TPESampler,COMPLETE
99,0.9962502283466568,2025-04-24 21:00:57.089373,2025-04-24 21:00:57.791115,0 days 00:00:00.701742,squared_error,11,log2,7,2,random,TPESampler,COMPLETE
100,0.9715123193587423,2025-04-24 21:00:57.474954,2025-04-24 21:00:58.210509,0 days 00:00:00.735555,absolute_error,3,log2,1,10,best,TPESampler,COMPLETE
101,0.6297518692625522,2025-04-24 21:00:57.802408,2025-04-24 21:00:58.579845,0 days 00:00:00.777437,absolute_error,26,sqrt,1,4,random,TPESampler,COMPLETE
102,0.9737936641952643,2025-04-24 21:00:58.113159,2025-04-24 21:00:58.873556,0 days 00:00:00.760397,squared_error,34,sqrt,8,2,random,TPESampler,COMPLETE
103,0.5845401005072158,2025-04-24 21:00:58.469259,2025-04-24 21:00:59.164646,0 days 00:00:00.695387,friedman_mse,33,sqrt,1,7,random,TPESampler,COMPLETE
104,0.6080739943014954,2025-04-24 21:00:58.812969,2025-04-24 21:00:59.489683,0 days 00:00:00.676714,friedman_mse,35,sqrt,1,10,random,TPESampler,COMPLETE
105,0.5735536095371757,2025-04-24 21:00:59.116989,2025-04-24 21:00:59.781931,0 days 00:00:00.664942,friedman_mse,35,sqrt,1,5,random,TPESampler,COMPLETE
106,0.693270508850544,2025-04-24 21:00:59.373155,2025-04-24 21:01:00.219731,0 days 00:00:00.846576,absolute_error,35,sqrt,1,19,best,TPESampler,COMPLETE
107,0.6438247230552657,2025-04-24 21:00:59.698065,2025-04-24 21:01:00.575602,0 days 00:00:00.877537,friedman_mse,35,sqrt,2,6,random,TPESampler,COMPLETE
108,0.6554608043408595,2025-04-24 21:01:00.139143,2025-04-24 21:01:00.889389,0 days 00:00:00.750246,friedman_mse,26,sqrt,1,7,random,TPESampler,COMPLETE
109,0.8873925072545136,2025-04-24 21:01:00.480294,2025-04-24 21:01:01.168457,0 days 00:00:00.688163,squared_error,35,log2,1,10,random,TPESampler,COMPLETE
110,0.6005958457854215,2025-04-24 21:01:00.871657,2025-04-24 21:01:01.525084,0 days 00:00:00.653427,friedman_mse,33,sqrt,1,6,random,TPESampler,COMPLETE
111,0.6814177030595521,2025-04-24 21:01:01.114667,2025-04-24 21:01:01.889580,0 days 00:00:00.774913,friedman_mse,25,sqrt,3,2,best,TPESampler,COMPLETE
112,0.6635171443360832,2025-04-24 21:01:01.427557,2025-04-24 21:01:02.220938,0 days 00:00:00.793381,absolute_error,26,sqrt,2,15,best,TPESampler,COMPLETE
113,0.9581948037924227,2025-04-24 21:01:01.774998,2025-04-24 21:01:02.490889,0 days 00:00:00.715891,absolute_error,17,sqrt,6,12,random,TPESampler,COMPLETE
114,0.5669738735012982,2025-04-24 21:01:02.223234,2025-04-24 21:01:02.919462,0 days 00:00:00.696228,friedman_mse,35,sqrt,1,4,random,TPESampler,COMPLETE
115,0.5910861426343554,2025-04-24 21:01:02.503594,2025-04-24 21:01:03.321563,0 days 00:00:00.817969,friedman_mse,35,sqrt,1,6,random,TPESampler,COMPLETE
116,0.5950903114898565,2025-04-24 21:01:02.695444,2025-04-24 21:01:03.509648,0 days 00:00:00.814204,friedman_mse,34,sqrt,1,4,random,TPESampler,COMPLETE
117,0.6212009730019902,2025-04-24 21:01:03.196397,2025-04-24 21:01:03.828529,0 days 00:00:00.632132,friedman_mse,32,sqrt,1,6,random,TPESampler,COMPLETE
118,0.5669738735012982,2025-04-24 21:01:03.561819,2025-04-24 21:01:04.339868,0 days 00:00:00.778049,friedman_mse,35,sqrt,1,4,random,TPESampler,COMPLETE
119,0.6274646664513288,2025-04-24 21:01:03.722187,2025-04-24 21:01:04.549253,0 days 00:00:00.827066,friedman_mse,29,sqrt,1,3,random,TPESampler,COMPLETE
120,0.5669738735012982,2025-04-24 21:01:04.051897,2025-04-24 21:01:04.941290,0 days 00:00:00.889393,friedman_mse,35,sqrt,1,4,random,TPESampler,COMPLETE
121,0.5781700102250805,2025-04-24 21:01:04.626765,2025-04-24 21:01:05.479994,0 days 00:00:00.853229,friedman_mse,34,sqrt,1,3,random,TPESampler,COMPLETE
122,0.5901353558999477,2025-04-24 21:01:04.885269,2025-04-24 21:01:05.655965,0 days 00:00:00.770696,friedman_mse,35,sqrt,1,2,random,TPESampler,COMPLETE
123,0.5669738735012982,2025-04-24 21:01:05.207857,2025-04-24 21:01:05.959603,0 days 00:00:00.751746,friedman_mse,35,sqrt,1,4,random,TPESampler,COMPLETE
124,0.7092445813596325,2025-04-24 21:01:05.724493,2025-04-24 21:01:06.581560,0 days 00:00:00.857067,friedman_mse,35,log2,2,2,best,TPESampler,COMPLETE
125,0.689760431628426,2025-04-24 21:01:05.904067,2025-04-24 21:01:07.003175,0 days 00:00:01.099108,friedman_mse,32,sqrt,3,2,random,TPESampler,COMPLETE
126,0.689760431628426,2025-04-24 21:01:06.178873,2025-04-24 21:01:07.327567,0 days 00:00:01.148694,friedman_mse,32,sqrt,3,2,random,TPESampler,COMPLETE
127,0.5950903114898565,2025-04-24 21:01:07.020151,2025-04-24 21:01:07.896724,0 days 00:00:00.876573,friedman_mse,34,sqrt,1,4,random,TPESampler,COMPLETE
128,0.9964161010826412,2025-04-24 21:01:07.380616,2025-04-24 21:01:08.422591,0 days 00:00:01.041975,friedman_mse,10,log2,3,5,random,TPESampler,COMPLETE
129,0.6966704703661589,2025-04-24 21:01:07.628731,2025-04-24 21:01:08.584318,0 days 00:00:00.955587,friedman_mse,34,sqrt,1,2,best,TPESampler,COMPLETE
130,0.5890991875910309,2025-04-24 21:01:08.164320,2025-04-24 21:01:08.856153,0 days 00:00:00.691833,friedman_mse,34,sqrt,1,2,random,TPESampler,COMPLETE
131,0.5890991875910309,2025-04-24 21:01:08.685962,2025-04-24 21:01:09.564790,0 days 00:00:00.878828,friedman_mse,34,sqrt,1,2,random,TPESampler,COMPLETE
132,0.6275961063708742,2025-04-24 21:01:08.809767,2025-04-24 21:01:09.675735,0 days 00:00:00.865968,friedman_mse,32,sqrt,1,3,random,TPESampler,COMPLETE
133,0.6566756190269205,2025-04-24 21:01:09.123880,2025-04-24 21:01:09.944505,0 days 00:00:00.820625,friedman_mse,34,sqrt,2,2,random,TPESampler,COMPLETE
134,0.5781700102250805,2025-04-24 21:01:09.820226,2025-04-24 21:01:10.654257,0 days 00:00:00.834031,friedman_mse,34,sqrt,1,3,random,TPESampler,COMPLETE
135,0.6657519179651408,2025-04-24 21:01:09.890210,2025-04-24 21:01:10.761173,0 days 00:00:00.870963,absolute_error,34,sqrt,3,2,random,TPESampler,COMPLETE
136,0.6438247230552657,2025-04-24 21:01:10.410462,2025-04-24 21:01:11.019082,0 days 00:00:00.608620,friedman_mse,35,sqrt,2,6,random,TPESampler,COMPLETE
137,0.9581948037924227,2025-04-24 21:01:10.888042,2025-04-24 21:01:11.664441,0 days 00:00:00.776399,absolute_error,35,sqrt,8,18,random,TPESampler,COMPLETE
138,0.6783568392569116,2025-04-24 21:01:10.946320,2025-04-24 21:01:11.960911,0 days 00:00:01.014591,absolute_error,35,sqrt,1,3,best,TPESampler,COMPLETE
139,0.6253040124771999,2025-04-24 21:01:11.224468,2025-04-24 21:01:12.002229,0 days 00:00:00.777761,absolute_error,33,sqrt,1,7,random,TPESampler,COMPLETE
140,0.5910861426343554,2025-04-24 21:01:11.881815,2025-04-24 21:01:12.547064,0 days 00:00:00.665249,friedman_mse,35,sqrt,1,6,random,TPESampler,COMPLETE
141,0.6263503106302462,2025-04-24 21:01:12.164097,2025-04-24 21:01:13.060074,0 days 00:00:00.895977,friedman_mse,32,sqrt,1,2,random,TPESampler,COMPLETE
