number,value,datetime_start,datetime_complete,duration,params_criterion,params_max_depth,params_max_features,params_min_samples_leaf,params_min_samples_split,params_splitter,system_attrs_auto:sampler,state
2435,0.7258703503262229,2025-04-24 21:16:48.498965,2025-04-24 21:16:49.640611,0 days 00:00:01.141646,friedman_mse,35,sqrt,3,8,best,TPESampler,COMPLETE
2436,0.6327006073621034,2025-04-24 21:16:48.815353,2025-04-24 21:16:49.920862,0 days 00:00:01.105509,friedman_mse,35,sqrt,1,8,best,TPESampler,COMPLETE
2437,0.6547285592620417,2025-04-24 21:16:49.835941,2025-04-24 21:16:50.956162,0 days 00:00:01.120221,friedman_mse,29,sqrt,2,6,best,TPESampler,COMPLETE
2438,0.7406517311742006,2025-04-24 21:16:49.989224,2025-04-24 21:16:51.063291,0 days 00:00:01.074067,friedman_mse,30,sqrt,3,6,best,TPESampler,COMPLETE
2439,0.7406517311742006,2025-04-24 21:16:50.173422,2025-04-24 21:16:51.583964,0 days 00:00:01.410542,friedman_mse,30,sqrt,3,5,best,TPESampler,COMPLETE
2440,0.5981875505937236,2025-04-24 21:16:51.296594,2025-04-24 21:16:52.529515,0 days 00:00:01.232921,friedman_mse,35,sqrt,1,7,best,TPESampler,COMPLETE
2441,0.6650856195703805,2025-04-24 21:16:51.595144,2025-04-24 21:16:52.769153,0 days 00:00:01.174009,friedman_mse,30,sqrt,2,9,best,TPESampler,COMPLETE
2442,0.9918207526715642,2025-04-24 21:16:51.888008,2025-04-24 21:16:53.183136,0 days 00:00:01.295128,squared_error,7,log2,1,12,random,TPESampler,COMPLETE
2443,0.6733930761791806,2025-04-24 21:16:52.817188,2025-04-24 21:16:53.805855,0 days 00:00:00.988667,friedman_mse,35,log2,1,5,best,TPESampler,COMPLETE
2444,0.5986673267910899,2025-04-24 21:16:53.047806,2025-04-24 21:16:54.064276,0 days 00:00:01.016470,friedman_mse,30,sqrt,1,5,best,TPESampler,COMPLETE
2445,0.6947803023265209,2025-04-24 21:16:53.493982,2025-04-24 21:16:54.348776,0 days 00:00:00.854794,friedman_mse,22,log2,2,20,best,TPESampler,COMPLETE
2446,0.6568175016976607,2025-04-24 21:16:54.115233,2025-04-24 21:16:54.906965,0 days 00:00:00.791732,friedman_mse,35,sqrt,2,3,best,TPESampler,COMPLETE
2447,0.6829087846700124,2025-04-24 21:16:54.398444,2025-04-24 21:16:55.447486,0 days 00:00:01.049042,absolute_error,17,sqrt,4,11,best,TPESampler,COMPLETE
2448,0.5833421407487621,2025-04-24 21:16:54.616358,2025-04-24 21:16:55.599941,0 days 00:00:00.983583,absolute_error,34,sqrt,1,5,best,TPESampler,COMPLETE
2449,0.6015012618996902,2025-04-24 21:16:55.274218,2025-04-24 21:16:55.988636,0 days 00:00:00.714418,friedman_mse,30,sqrt,1,8,best,TPESampler,COMPLETE
2450,0.675982364902162,2025-04-24 21:16:55.715527,2025-04-24 21:16:56.608576,0 days 00:00:00.893049,friedman_mse,35,sqrt,2,6,best,TPESampler,COMPLETE
2451,0.5925119263261721,2025-04-24 21:16:55.847130,2025-04-24 21:16:56.883915,0 days 00:00:01.036785,friedman_mse,35,sqrt,1,3,best,TPESampler,COMPLETE
2452,0.7258703503262229,2025-04-24 21:16:56.300010,2025-04-24 21:16:57.068035,0 days 00:00:00.768025,friedman_mse,35,sqrt,3,8,best,TPESampler,COMPLETE
2453,0.675982364902162,2025-04-24 21:16:56.961862,2025-04-24 21:16:57.755042,0 days 00:00:00.793180,friedman_mse,35,sqrt,2,6,best,TPESampler,COMPLETE
2454,0.695132658085423,2025-04-24 21:16:57.217106,2025-04-24 21:16:58.419126,0 days 00:00:01.202020,squared_error,32,sqrt,1,2,best,TPESampler,COMPLETE
2455,0.6152703424484823,2025-04-24 21:16:57.402410,2025-04-24 21:16:58.466690,0 days 00:00:01.064280,squared_error,30,sqrt,2,5,best,TPESampler,COMPLETE
2456,0.6346783462746558,2025-04-24 21:16:58.102082,2025-04-24 21:16:58.935896,0 days 00:00:00.833814,friedman_mse,30,sqrt,1,10,best,TPESampler,COMPLETE
2457,0.5986673267910899,2025-04-24 21:16:58.635634,2025-04-24 21:16:59.696992,0 days 00:00:01.061358,friedman_mse,30,sqrt,1,5,best,TPESampler,COMPLETE
2458,0.610300375570967,2025-04-24 21:16:58.676941,2025-04-24 21:16:59.849515,0 days 00:00:01.172574,friedman_mse,35,sqrt,1,5,best,TPESampler,COMPLETE
2459,0.5522341372198587,2025-04-24 21:16:59.408797,2025-04-24 21:17:00.265075,0 days 00:00:00.856278,friedman_mse,35,sqrt,1,6,best,TPESampler,COMPLETE
2460,0.971526010237953,2025-04-24 21:16:59.918817,2025-04-24 21:17:00.939795,0 days 00:00:01.020978,absolute_error,15,log2,8,19,random,TPESampler,COMPLETE
2461,0.5978929531338989,2025-04-24 21:17:00.127485,2025-04-24 21:17:01.195688,0 days 00:00:01.068203,friedman_mse,35,sqrt,1,10,best,TPESampler,COMPLETE
2462,0.6123183697228924,2025-04-24 21:17:00.580707,2025-04-24 21:17:01.635112,0 days 00:00:01.054405,friedman_mse,30,sqrt,1,6,best,TPESampler,COMPLETE
2463,0.9928365741172522,2025-04-24 21:17:01.260522,2025-04-24 21:17:02.436485,0 days 00:00:01.175963,squared_error,17,log2,7,7,best,TPESampler,COMPLETE
2464,0.5853577495940356,2025-04-24 21:17:01.488178,2025-04-24 21:17:02.769693,0 days 00:00:01.281515,absolute_error,35,sqrt,1,7,best,TPESampler,COMPLETE
2465,0.610300375570967,2025-04-24 21:17:02.112435,2025-04-24 21:17:03.028772,0 days 00:00:00.916337,friedman_mse,35,sqrt,1,5,best,TPESampler,COMPLETE
2466,0.7246712212327447,2025-04-24 21:17:02.717480,2025-04-24 21:17:03.535894,0 days 00:00:00.818414,friedman_mse,35,sqrt,3,4,best,TPESampler,COMPLETE
2467,0.5990037672372435,2025-04-24 21:17:03.136026,2025-04-24 21:17:04.195063,0 days 00:00:01.059037,friedman_mse,30,sqrt,1,7,best,TPESampler,COMPLETE
2468,0.5981875505937236,2025-04-24 21:17:03.309332,2025-04-24 21:17:04.281266,0 days 00:00:00.971934,friedman_mse,35,sqrt,1,7,best,TPESampler,COMPLETE
2469,0.6701183889200352,2025-04-24 21:17:03.899577,2025-04-24 21:17:04.844156,0 days 00:00:00.944579,friedman_mse,24,sqrt,1,3,best,TPESampler,COMPLETE
2470,0.6152703424484823,2025-04-24 21:17:04.448954,2025-04-24 21:17:05.563320,0 days 00:00:01.114366,friedman_mse,30,sqrt,2,5,best,TPESampler,COMPLETE
2471,0.675982364902162,2025-04-24 21:17:04.474612,2025-04-24 21:17:05.649221,0 days 00:00:01.174609,friedman_mse,35,sqrt,2,6,best,TPESampler,COMPLETE
2472,0.6327006073621034,2025-04-24 21:17:05.158900,2025-04-24 21:17:05.992299,0 days 00:00:00.833399,friedman_mse,35,sqrt,1,8,best,TPESampler,COMPLETE
2473,0.6468159413546908,2025-04-24 21:17:05.796125,2025-04-24 21:17:07.029185,0 days 00:00:01.233060,friedman_mse,30,sqrt,2,3,best,TPESampler,COMPLETE
2474,0.6015012618996902,2025-04-24 21:17:05.852548,2025-04-24 21:17:07.109691,0 days 00:00:01.257143,friedman_mse,30,sqrt,1,8,best,TPESampler,COMPLETE
2475,0.7467054482379599,2025-04-24 21:17:06.299643,2025-04-24 21:17:07.472814,0 days 00:00:01.173171,squared_error,24,sqrt,4,17,random,TPESampler,COMPLETE
2476,0.7186431077620621,2025-04-24 21:17:07.415510,2025-04-24 21:17:08.437101,0 days 00:00:01.021591,friedman_mse,35,sqrt,3,11,best,TPESampler,COMPLETE
2477,0.6123183697228924,2025-04-24 21:17:07.575736,2025-04-24 21:17:08.756158,0 days 00:00:01.180422,friedman_mse,30,sqrt,1,6,best,TPESampler,COMPLETE
2478,0.6248248219525877,2025-04-24 21:17:07.871318,2025-04-24 21:17:09.002065,0 days 00:00:01.130747,friedman_mse,35,sqrt,1,4,best,TPESampler,COMPLETE
2479,0.7196483853662857,2025-04-24 21:17:08.711147,2025-04-24 21:17:09.895627,0 days 00:00:01.184480,friedman_mse,30,sqrt,3,7,best,TPESampler,COMPLETE
2480,0.7406517311742006,2025-04-24 21:17:09.040304,2025-04-24 21:17:10.299995,0 days 00:00:01.259691,friedman_mse,30,sqrt,3,6,best,TPESampler,COMPLETE
2481,0.6551631182803123,2025-04-24 21:17:09.365934,2025-04-24 21:17:10.511361,0 days 00:00:01.145427,friedman_mse,35,sqrt,2,7,best,TPESampler,COMPLETE
2482,0.6518691584550678,2025-04-24 21:17:10.320691,2025-04-24 21:17:11.355607,0 days 00:00:01.034916,friedman_mse,29,sqrt,1,5,best,TPESampler,COMPLETE
2483,0.5981875505937236,2025-04-24 21:17:10.704644,2025-04-24 21:17:12.100838,0 days 00:00:01.396194,friedman_mse,35,sqrt,1,7,best,TPESampler,COMPLETE
2484,0.5981875505937236,2025-04-24 21:17:10.927357,2025-04-24 21:17:12.095070,0 days 00:00:01.167713,friedman_mse,35,sqrt,1,7,best,TPESampler,COMPLETE
2485,0.6248248219525877,2025-04-24 21:17:11.705099,2025-04-24 21:17:12.649687,0 days 00:00:00.944588,friedman_mse,35,sqrt,1,4,best,TPESampler,COMPLETE
2486,0.9545020982502701,2025-04-24 21:17:12.448398,2025-04-24 21:17:13.805219,0 days 00:00:01.356821,friedman_mse,34,log2,3,5,best,TPESampler,COMPLETE
2487,0.6186976381009088,2025-04-24 21:17:12.578027,2025-04-24 21:17:13.889217,0 days 00:00:01.311190,friedman_mse,30,sqrt,1,11,best,TPESampler,COMPLETE
2488,0.9968066590016214,2025-04-24 21:17:12.926314,2025-04-24 21:17:14.292797,0 days 00:00:01.366483,friedman_mse,23,log2,10,3,random,TPESampler,COMPLETE
2489,0.5978929531338989,2025-04-24 21:17:14.143838,2025-04-24 21:17:15.218184,0 days 00:00:01.074346,friedman_mse,35,sqrt,1,10,best,TPESampler,COMPLETE
2490,0.6568175016976607,2025-04-24 21:17:14.192268,2025-04-24 21:17:15.456716,0 days 00:00:01.264448,friedman_mse,35,sqrt,2,3,best,TPESampler,COMPLETE
2491,0.637785899500027,2025-04-24 21:17:14.617610,2025-04-24 21:17:15.544710,0 days 00:00:00.927100,friedman_mse,29,sqrt,1,2,best,TPESampler,COMPLETE
2492,0.7113263276640378,2025-04-24 21:17:15.499292,2025-04-24 21:17:16.684639,0 days 00:00:01.185347,friedman_mse,35,sqrt,3,7,best,TPESampler,COMPLETE
2493,0.5522341372198587,2025-04-24 21:17:15.688532,2025-04-24 21:17:16.595993,0 days 00:00:00.907461,friedman_mse,35,sqrt,1,6,best,TPESampler,COMPLETE
2494,0.6446227396865948,2025-04-24 21:17:15.979778,2025-04-24 21:17:17.019335,0 days 00:00:01.039557,friedman_mse,29,sqrt,1,6,best,TPESampler,COMPLETE
2495,0.9774731018222353,2025-04-24 21:17:16.973607,2025-04-24 21:17:18.240052,0 days 00:00:01.266445,squared_error,3,sqrt,1,9,random,TPESampler,COMPLETE
2496,0.6015012618996902,2025-04-24 21:17:17.017649,2025-04-24 21:17:18.153140,0 days 00:00:01.135491,friedman_mse,30,sqrt,1,8,best,TPESampler,COMPLETE
2497,0.7246712212327447,2025-04-24 21:17:17.965597,2025-04-24 21:17:18.750504,0 days 00:00:00.784907,friedman_mse,35,sqrt,3,6,best,TPESampler,COMPLETE
2498,0.6327006073621034,2025-04-24 21:17:18.445641,2025-04-24 21:17:19.336399,0 days 00:00:00.890758,friedman_mse,35,sqrt,1,8,best,TPESampler,COMPLETE
2499,0.7774448084602187,2025-04-24 21:17:18.497086,2025-04-24 21:17:19.428305,0 days 00:00:00.931219,squared_error,12,sqrt,10,3,best,TPESampler,COMPLETE
