number,value,datetime_start,datetime_complete,duration,params_criterion,params_max_depth,params_max_features,params_min_samples_leaf,params_min_samples_split,params_splitter,system_attrs_auto:sampler,state
1859,0.6659193936754176,2025-04-24 21:12:29.781584,2025-04-24 21:12:30.590960,0 days 00:00:00.809376,friedman_mse,35,sqrt,2,9,best,TPESampler,COMPLETE
1860,0.6248248219525877,2025-04-24 21:12:30.234166,2025-04-24 21:12:31.249629,0 days 00:00:01.015463,friedman_mse,35,sqrt,1,4,best,TPESampler,COMPLETE
1861,0.6518691584550678,2025-04-24 21:12:30.661646,2025-04-24 21:12:31.569108,0 days 00:00:00.907462,friedman_mse,29,sqrt,1,5,best,TPESampler,COMPLETE
1862,0.6540978000576883,2025-04-24 21:12:31.011815,2025-04-24 21:12:31.912729,0 days 00:00:00.900914,friedman_mse,29,sqrt,1,7,best,TPESampler,COMPLETE
1863,0.7246712212327447,2025-04-24 21:12:31.570298,2025-04-24 21:12:32.746515,0 days 00:00:01.176217,friedman_mse,35,sqrt,3,5,best,TPESampler,COMPLETE
1864,0.5522341372198587,2025-04-24 21:12:31.905394,2025-04-24 21:12:32.940514,0 days 00:00:01.035120,friedman_mse,35,sqrt,1,6,best,TPESampler,COMPLETE
1865,0.6346783462746558,2025-04-24 21:12:32.401879,2025-04-24 21:12:33.259872,0 days 00:00:00.857993,friedman_mse,30,sqrt,1,10,best,TPESampler,COMPLETE
1866,0.610300375570967,2025-04-24 21:12:33.022450,2025-04-24 21:12:33.878141,0 days 00:00:00.855691,friedman_mse,35,sqrt,1,5,best,TPESampler,COMPLETE
1867,0.6361895113592757,2025-04-24 21:12:33.212152,2025-04-24 21:12:34.210159,0 days 00:00:00.998007,squared_error,29,sqrt,1,4,best,TPESampler,COMPLETE
1868,0.649573014390662,2025-04-24 21:12:33.572108,2025-04-24 21:12:34.500567,0 days 00:00:00.928459,friedman_mse,35,sqrt,2,8,best,TPESampler,COMPLETE
1869,0.6123183697228924,2025-04-24 21:12:34.171739,2025-04-24 21:12:34.878920,0 days 00:00:00.707181,friedman_mse,30,sqrt,1,6,best,TPESampler,COMPLETE
1870,0.6568175016976607,2025-04-24 21:12:34.579272,2025-04-24 21:12:35.473571,0 days 00:00:00.894299,friedman_mse,35,sqrt,2,4,best,TPESampler,COMPLETE
1871,0.610300375570967,2025-04-24 21:12:34.762434,2025-04-24 21:12:35.759712,0 days 00:00:00.997278,friedman_mse,35,sqrt,1,5,best,TPESampler,COMPLETE
1872,0.7155967574884852,2025-04-24 21:12:35.143519,2025-04-24 21:12:35.914856,0 days 00:00:00.771337,friedman_mse,29,sqrt,3,7,best,TPESampler,COMPLETE
1873,0.6659193936754176,2025-04-24 21:12:35.812490,2025-04-24 21:12:36.509608,0 days 00:00:00.697118,friedman_mse,35,sqrt,2,9,best,TPESampler,COMPLETE
1874,0.5981875505937236,2025-04-24 21:12:36.033450,2025-04-24 21:12:36.990321,0 days 00:00:00.956871,friedman_mse,35,sqrt,1,7,best,TPESampler,COMPLETE
1875,0.6158166985156879,2025-04-24 21:12:36.245903,2025-04-24 21:12:37.088942,0 days 00:00:00.843039,friedman_mse,35,sqrt,1,9,best,TPESampler,COMPLETE
1876,0.6227361853799519,2025-04-24 21:12:36.799899,2025-04-24 21:12:37.607737,0 days 00:00:00.807838,friedman_mse,30,sqrt,1,2,best,TPESampler,COMPLETE
1877,0.7165915127012,2025-04-24 21:12:37.269943,2025-04-24 21:12:38.310138,0 days 00:00:01.040195,friedman_mse,31,log2,1,7,best,TPESampler,COMPLETE
1878,0.5522341372198587,2025-04-24 21:12:37.337134,2025-04-24 21:12:38.402420,0 days 00:00:01.065286,friedman_mse,35,sqrt,1,6,best,TPESampler,COMPLETE
1879,0.7196483853662857,2025-04-24 21:12:38.115208,2025-04-24 21:12:38.919133,0 days 00:00:00.803925,friedman_mse,30,sqrt,3,7,best,TPESampler,COMPLETE
1880,0.6035982221692777,2025-04-24 21:12:38.578875,2025-04-24 21:12:39.651422,0 days 00:00:01.072547,friedman_mse,35,sqrt,1,2,best,TPESampler,COMPLETE
1881,0.6307166641615489,2025-04-24 21:12:38.677183,2025-04-24 21:12:39.776677,0 days 00:00:01.099494,friedman_mse,30,sqrt,1,3,best,TPESampler,COMPLETE
1882,0.6327006073621034,2025-04-24 21:12:39.284124,2025-04-24 21:12:40.079176,0 days 00:00:00.795052,friedman_mse,35,sqrt,1,8,best,TPESampler,COMPLETE
1883,0.6571715889920813,2025-04-24 21:12:39.912719,2025-04-24 21:12:40.762512,0 days 00:00:00.849793,friedman_mse,29,sqrt,2,7,best,TPESampler,COMPLETE
1884,0.6540978000576883,2025-04-24 21:12:39.994859,2025-04-24 21:12:40.925553,0 days 00:00:00.930694,friedman_mse,29,sqrt,1,7,best,TPESampler,COMPLETE
1885,0.9887930186250102,2025-04-24 21:12:40.420174,2025-04-24 21:12:41.240862,0 days 00:00:00.820688,squared_error,1,sqrt,10,12,best,TPESampler,COMPLETE
1886,0.610300375570967,2025-04-24 21:12:41.142695,2025-04-24 21:12:41.866805,0 days 00:00:00.724110,friedman_mse,35,sqrt,1,5,best,TPESampler,COMPLETE
1887,0.6551631182803123,2025-04-24 21:12:41.201562,2025-04-24 21:12:42.231299,0 days 00:00:01.029737,friedman_mse,35,sqrt,2,7,best,TPESampler,COMPLETE
1888,0.6446227396865948,2025-04-24 21:12:41.499089,2025-04-24 21:12:42.558383,0 days 00:00:01.059294,friedman_mse,29,sqrt,1,6,best,TPESampler,COMPLETE
1889,0.5978929531338989,2025-04-24 21:12:42.166511,2025-04-24 21:12:42.958955,0 days 00:00:00.792444,friedman_mse,35,sqrt,1,10,best,TPESampler,COMPLETE
1890,0.6120343741939518,2025-04-24 21:12:42.607369,2025-04-24 21:12:43.615673,0 days 00:00:01.008304,absolute_error,34,sqrt,1,6,best,TPESampler,COMPLETE
1891,0.7406517311742006,2025-04-24 21:12:42.817015,2025-04-24 21:12:43.819724,0 days 00:00:01.002709,friedman_mse,30,sqrt,3,5,best,TPESampler,COMPLETE
1892,0.5522341372198587,2025-04-24 21:12:43.217740,2025-04-24 21:12:44.672870,0 days 00:00:01.455130,friedman_mse,35,sqrt,1,6,best,TPESampler,COMPLETE
1893,0.7246712212327447,2025-04-24 21:12:43.867623,2025-04-24 21:12:44.897329,0 days 00:00:01.029706,friedman_mse,35,sqrt,3,6,best,TPESampler,COMPLETE
1894,0.7246712212327447,2025-04-24 21:12:44.181992,2025-04-24 21:12:45.380359,0 days 00:00:01.198367,friedman_mse,35,sqrt,3,4,best,TPESampler,COMPLETE
1895,0.6123183697228924,2025-04-24 21:12:45.097078,2025-04-24 21:12:46.880761,0 days 00:00:01.783683,friedman_mse,30,sqrt,1,6,best,TPESampler,COMPLETE
1896,0.610300375570967,2025-04-24 21:12:45.304728,2025-04-24 21:12:46.619690,0 days 00:00:01.314962,friedman_mse,35,sqrt,1,5,best,TPESampler,COMPLETE
1897,0.6518691584550678,2025-04-24 21:12:45.793339,2025-04-24 21:12:47.512597,0 days 00:00:01.719258,friedman_mse,29,sqrt,1,5,best,TPESampler,COMPLETE
1898,0.609437299456365,2025-04-24 21:12:47.133753,2025-04-24 21:12:48.955850,0 days 00:00:01.822097,friedman_mse,29,sqrt,1,10,best,TPESampler,COMPLETE
1899,0.609437299456365,2025-04-24 21:12:47.506808,2025-04-24 21:12:49.553656,0 days 00:00:02.046848,friedman_mse,29,sqrt,1,10,best,TPESampler,COMPLETE
1900,0.9928365741172522,2025-04-24 21:12:47.896348,2025-04-24 21:12:49.998578,0 days 00:00:02.102230,squared_error,21,log2,10,20,best,TPESampler,COMPLETE
1901,0.610300375570967,2025-04-24 21:12:49.958366,2025-04-24 21:12:51.331335,0 days 00:00:01.372969,friedman_mse,35,sqrt,1,5,best,TPESampler,COMPLETE
1902,0.6728668312357213,2025-04-24 21:12:50.098779,2025-04-24 21:12:51.830683,0 days 00:00:01.731904,friedman_mse,29,sqrt,2,8,best,TPESampler,COMPLETE
1903,0.5981875505937236,2025-04-24 21:12:50.444369,2025-04-24 21:12:52.171228,0 days 00:00:01.726859,friedman_mse,35,sqrt,1,7,best,TPESampler,COMPLETE
1904,0.5981875505937236,2025-04-24 21:12:51.764611,2025-04-24 21:12:52.846832,0 days 00:00:01.082221,friedman_mse,35,sqrt,1,7,best,TPESampler,COMPLETE
1905,0.5522341372198587,2025-04-24 21:12:52.322318,2025-04-24 21:12:53.778987,0 days 00:00:01.456669,friedman_mse,35,sqrt,1,6,best,TPESampler,COMPLETE
1906,0.6815637168029901,2025-04-24 21:12:52.528846,2025-04-24 21:12:54.077111,0 days 00:00:01.548265,friedman_mse,35,log2,1,8,best,TPESampler,COMPLETE
1907,0.7187218102618173,2025-04-24 21:12:53.359972,2025-04-24 21:12:54.498680,0 days 00:00:01.138708,friedman_mse,34,sqrt,6,3,best,TPESampler,COMPLETE
1908,0.7187218102618173,2025-04-24 21:12:54.222593,2025-04-24 21:12:55.652211,0 days 00:00:01.429618,friedman_mse,31,sqrt,6,7,best,TPESampler,COMPLETE
1909,0.7113263276640378,2025-04-24 21:12:54.367454,2025-04-24 21:12:55.970201,0 days 00:00:01.602747,friedman_mse,35,sqrt,3,7,best,TPESampler,COMPLETE
1910,0.6547285592620417,2025-04-24 21:12:55.263303,2025-04-24 21:12:56.331268,0 days 00:00:01.067965,friedman_mse,29,sqrt,2,6,best,TPESampler,COMPLETE
1911,0.5986673267910899,2025-04-24 21:12:56.205237,2025-04-24 21:12:57.370100,0 days 00:00:01.164863,friedman_mse,30,sqrt,1,5,best,TPESampler,COMPLETE
1912,0.6248248219525877,2025-04-24 21:12:56.265135,2025-04-24 21:12:57.507446,0 days 00:00:01.242311,squared_error,35,sqrt,1,4,best,TPESampler,COMPLETE
1913,0.9929778992934213,2025-04-24 21:12:57.085982,2025-04-24 21:12:57.945449,0 days 00:00:00.859467,friedman_mse,12,log2,1,19,random,TPESampler,COMPLETE
1914,0.7246712212327447,2025-04-24 21:12:57.716096,2025-04-24 21:12:58.661611,0 days 00:00:00.945515,friedman_mse,35,sqrt,3,3,best,TPESampler,COMPLETE
1915,0.610300375570967,2025-04-24 21:12:57.899724,2025-04-24 21:12:59.114014,0 days 00:00:01.214290,friedman_mse,35,sqrt,1,5,best,TPESampler,COMPLETE
1916,0.964903983025146,2025-04-24 21:12:58.327477,2025-04-24 21:12:59.407166,0 days 00:00:01.079689,absolute_error,23,log2,8,2,best,TPESampler,COMPLETE
1917,0.7182589720793523,2025-04-24 21:12:59.082533,2025-04-24 21:12:59.836097,0 days 00:00:00.753564,friedman_mse,30,sqrt,3,9,best,TPESampler,COMPLETE
1918,0.6158166985156879,2025-04-24 21:12:59.397607,2025-04-24 21:13:00.193206,0 days 00:00:00.795599,friedman_mse,35,sqrt,1,9,best,TPESampler,COMPLETE
1919,0.6248248219525877,2025-04-24 21:12:59.694879,2025-04-24 21:13:00.973598,0 days 00:00:01.278719,friedman_mse,35,sqrt,1,4,best,TPESampler,COMPLETE
1920,0.6082164367053395,2025-04-24 21:13:00.078934,2025-04-24 21:13:01.169520,0 days 00:00:01.090586,friedman_mse,35,sqrt,2,5,best,TPESampler,COMPLETE
1921,0.6361895113592757,2025-04-24 21:13:00.415640,2025-04-24 21:13:01.544240,0 days 00:00:01.128600,friedman_mse,29,sqrt,1,4,best,TPESampler,COMPLETE
1922,0.6794094981777127,2025-04-24 21:13:01.247050,2025-04-24 21:13:02.147347,0 days 00:00:00.900297,friedman_mse,29,sqrt,3,5,best,TPESampler,COMPLETE
1923,0.6123183697228924,2025-04-24 21:13:01.398060,2025-04-24 21:13:02.305963,0 days 00:00:00.907903,friedman_mse,30,sqrt,1,6,best,TPESampler,COMPLETE
1924,0.6426396730909659,2025-04-24 21:13:01.788060,2025-04-24 21:13:02.705816,0 days 00:00:00.917756,friedman_mse,31,sqrt,1,7,best,TPESampler,COMPLETE
1925,0.7258703503262229,2025-04-24 21:13:02.399122,2025-04-24 21:13:03.299167,0 days 00:00:00.900045,friedman_mse,35,sqrt,3,8,best,TPESampler,COMPLETE
1926,0.5925119263261721,2025-04-24 21:13:02.514306,2025-04-24 21:13:03.482072,0 days 00:00:00.967766,friedman_mse,35,sqrt,1,3,best,TPESampler,COMPLETE
1927,0.9168932871996543,2025-04-24 21:13:02.971123,2025-04-24 21:13:03.913232,0 days 00:00:00.942109,absolute_error,14,log2,1,15,best,TPESampler,COMPLETE
1928,0.5981875505937236,2025-04-24 21:13:03.618877,2025-04-24 21:13:04.538869,0 days 00:00:00.919992,friedman_mse,35,sqrt,1,7,best,TPESampler,COMPLETE
1929,0.5522341372198587,2025-04-24 21:13:03.679204,2025-04-24 21:13:04.688747,0 days 00:00:01.009543,friedman_mse,35,sqrt,1,6,best,TPESampler,COMPLETE
1930,0.5986673267910899,2025-04-24 21:13:04.190509,2025-04-24 21:13:05.048771,0 days 00:00:00.858262,friedman_mse,30,sqrt,1,5,best,TPESampler,COMPLETE
1931,0.6015012618996902,2025-04-24 21:13:04.844243,2025-04-24 21:13:05.724088,0 days 00:00:00.879845,friedman_mse,30,sqrt,1,8,best,TPESampler,COMPLETE
1932,0.6975869412010501,2025-04-24 21:13:04.903445,2025-04-24 21:13:05.902787,0 days 00:00:00.999342,friedman_mse,35,log2,2,6,best,TPESampler,COMPLETE
1933,0.6327006073621034,2025-04-24 21:13:05.353344,2025-04-24 21:13:06.208549,0 days 00:00:00.855205,friedman_mse,35,sqrt,1,8,best,TPESampler,COMPLETE
1934,0.7406517311742006,2025-04-24 21:13:06.167174,2025-04-24 21:13:07.227766,0 days 00:00:01.060592,friedman_mse,30,sqrt,3,4,best,TPESampler,COMPLETE
1935,0.6551631182803123,2025-04-24 21:13:06.203117,2025-04-24 21:13:07.575693,0 days 00:00:01.372576,friedman_mse,35,sqrt,2,7,best,TPESampler,COMPLETE
1936,0.7186431077620621,2025-04-24 21:13:06.564560,2025-04-24 21:13:07.671272,0 days 00:00:01.106712,friedman_mse,35,sqrt,3,10,best,TPESampler,COMPLETE
1937,0.6568175016976607,2025-04-24 21:13:07.513914,2025-04-24 21:13:08.455085,0 days 00:00:00.941171,friedman_mse,35,sqrt,2,2,best,TPESampler,COMPLETE
1938,0.610300375570967,2025-04-24 21:13:07.822832,2025-04-24 21:13:08.938334,0 days 00:00:01.115502,friedman_mse,35,sqrt,1,5,best,TPESampler,COMPLETE
1939,0.5522341372198587,2025-04-24 21:13:08.001732,2025-04-24 21:13:09.114665,0 days 00:00:01.112933,friedman_mse,35,sqrt,1,6,best,TPESampler,COMPLETE
1940,0.6307166641615489,2025-04-24 21:13:08.805921,2025-04-24 21:13:09.462182,0 days 00:00:00.656261,friedman_mse,30,sqrt,1,3,best,TPESampler,COMPLETE
1941,0.7682813561270208,2025-04-24 21:13:09.416529,2025-04-24 21:13:10.342251,0 days 00:00:00.925722,friedman_mse,16,sqrt,7,15,best,TPESampler,COMPLETE
1942,0.7406517311742006,2025-04-24 21:13:09.266618,2025-04-24 21:13:10.664671,0 days 00:00:01.398053,friedman_mse,30,sqrt,3,6,best,TPESampler,COMPLETE
1943,0.7246712212327447,2025-04-24 21:13:09.757354,2025-04-24 21:13:10.713852,0 days 00:00:00.956498,friedman_mse,35,sqrt,3,6,best,TPESampler,COMPLETE
1944,0.5522341372198587,2025-04-24 21:13:10.601438,2025-04-24 21:13:11.321473,0 days 00:00:00.720035,friedman_mse,35,sqrt,1,6,best,TPESampler,COMPLETE
1945,0.975912913728396,2025-04-24 21:13:10.948990,2025-04-24 21:13:11.840396,0 days 00:00:00.891406,friedman_mse,30,log2,2,17,random,TPESampler,COMPLETE
1946,0.6092021505232494,2025-04-24 21:13:11.024959,2025-04-24 21:13:12.064692,0 days 00:00:01.039733,absolute_error,35,sqrt,2,5,best,TPESampler,COMPLETE
1947,0.6158166985156879,2025-04-24 21:13:11.597211,2025-04-24 21:13:12.366151,0 days 00:00:00.768940,friedman_mse,35,sqrt,1,9,best,TPESampler,COMPLETE
1948,0.6481288639616444,2025-04-24 21:13:12.325404,2025-04-24 21:13:13.384909,0 days 00:00:01.059505,friedman_mse,30,sqrt,2,8,best,TPESampler,COMPLETE
1949,0.6248248219525877,2025-04-24 21:13:12.363614,2025-04-24 21:13:13.386356,0 days 00:00:01.022742,friedman_mse,35,sqrt,1,4,best,TPESampler,COMPLETE
1950,0.6015012618996902,2025-04-24 21:13:13.092969,2025-04-24 21:13:13.923893,0 days 00:00:00.830924,friedman_mse,30,sqrt,1,8,best,TPESampler,COMPLETE
1951,0.6792298417518213,2025-04-24 21:13:13.592282,2025-04-24 21:13:14.683725,0 days 00:00:01.091443,absolute_error,24,sqrt,2,9,best,TPESampler,COMPLETE
1952,0.6307166641615489,2025-04-24 21:13:13.701091,2025-04-24 21:13:14.869258,0 days 00:00:01.168167,friedman_mse,30,sqrt,1,3,best,TPESampler,COMPLETE
1953,0.5981875505937236,2025-04-24 21:13:14.275519,2025-04-24 21:13:15.328366,0 days 00:00:01.052847,friedman_mse,35,sqrt,1,7,best,TPESampler,COMPLETE
1954,0.7113263276640378,2025-04-24 21:13:14.951924,2025-04-24 21:13:16.077847,0 days 00:00:01.125923,friedman_mse,35,sqrt,3,7,best,TPESampler,COMPLETE
1955,0.6015012618996902,2025-04-24 21:13:15.125080,2025-04-24 21:13:16.144535,0 days 00:00:01.019455,friedman_mse,30,sqrt,1,8,best,TPESampler,COMPLETE
1956,0.6324378944326069,2025-04-24 21:13:15.651194,2025-04-24 21:13:16.462209,0 days 00:00:00.811015,absolute_error,35,sqrt,2,7,best,TPESampler,COMPLETE
1957,0.6123183697228924,2025-04-24 21:13:16.421033,2025-04-24 21:13:17.500126,0 days 00:00:01.079093,friedman_mse,30,sqrt,1,6,best,TPESampler,COMPLETE
1958,0.7246712212327447,2025-04-24 21:13:16.453761,2025-04-24 21:13:17.470438,0 days 00:00:01.016677,friedman_mse,35,sqrt,3,5,best,TPESampler,COMPLETE
1959,0.5981875505937236,2025-04-24 21:13:17.149924,2025-04-24 21:13:18.025740,0 days 00:00:00.875816,friedman_mse,35,sqrt,1,7,best,TPESampler,COMPLETE
1960,0.5990037672372435,2025-04-24 21:13:17.744406,2025-04-24 21:13:18.630512,0 days 00:00:00.886106,friedman_mse,30,sqrt,1,7,best,TPESampler,COMPLETE
1961,0.6327006073621034,2025-04-24 21:13:17.805159,2025-04-24 21:13:18.822827,0 days 00:00:01.017668,friedman_mse,35,sqrt,1,8,best,TPESampler,COMPLETE
1962,0.7246712212327447,2025-04-24 21:13:18.305469,2025-04-24 21:13:19.131609,0 days 00:00:00.826140,friedman_mse,35,sqrt,3,6,best,TPESampler,COMPLETE
1963,0.6152703424484823,2025-04-24 21:13:18.974405,2025-04-24 21:13:20.023375,0 days 00:00:01.048970,friedman_mse,30,sqrt,2,5,best,TPESampler,COMPLETE
1964,0.6248248219525877,2025-04-24 21:13:19.098345,2025-04-24 21:13:20.329597,0 days 00:00:01.231252,friedman_mse,35,sqrt,1,4,best,TPESampler,COMPLETE
1965,0.5954029196258062,2025-04-24 21:13:19.681086,2025-04-24 21:13:20.515994,0 days 00:00:00.834908,absolute_error,28,sqrt,1,8,best,TPESampler,COMPLETE
1966,0.6164743825213621,2025-04-24 21:13:20.280932,2025-04-24 21:13:21.089293,0 days 00:00:00.808361,friedman_mse,23,sqrt,1,2,best,TPESampler,COMPLETE
1967,0.651942299743665,2025-04-24 21:13:20.569574,2025-04-24 21:13:21.370890,0 days 00:00:00.801316,friedman_mse,22,sqrt,2,4,best,TPESampler,COMPLETE
1968,0.610300375570967,2025-04-24 21:13:20.819329,2025-04-24 21:13:21.618888,0 days 00:00:00.799559,friedman_mse,35,sqrt,1,5,best,TPESampler,COMPLETE
1969,0.6361895113592757,2025-04-24 21:13:21.419723,2025-04-24 21:13:22.141651,0 days 00:00:00.721928,friedman_mse,29,sqrt,1,4,best,TPESampler,COMPLETE
1970,0.6248248219525877,2025-04-24 21:13:21.671898,2025-04-24 21:13:22.614804,0 days 00:00:00.942906,friedman_mse,35,sqrt,1,4,best,TPESampler,COMPLETE
1971,0.610300375570967,2025-04-24 21:13:21.887905,2025-04-24 21:13:22.841032,0 days 00:00:00.953127,friedman_mse,35,sqrt,1,5,best,TPESampler,COMPLETE
1972,0.7106696395891989,2025-04-24 21:13:22.523268,2025-04-24 21:13:23.282691,0 days 00:00:00.759423,friedman_mse,35,sqrt,3,9,best,TPESampler,COMPLETE
1973,0.632199359486392,2025-04-24 21:13:22.949189,2025-04-24 21:13:23.814917,0 days 00:00:00.865728,friedman_mse,30,sqrt,1,9,best,TPESampler,COMPLETE
1974,0.6446227396865948,2025-04-24 21:13:23.096560,2025-04-24 21:13:23.986789,0 days 00:00:00.890229,friedman_mse,29,sqrt,1,6,best,TPESampler,COMPLETE
1975,0.5978929531338989,2025-04-24 21:13:23.662739,2025-04-24 21:13:24.440071,0 days 00:00:00.777332,friedman_mse,35,sqrt,1,10,best,TPESampler,COMPLETE
1976,0.7406517311742006,2025-04-24 21:13:24.087157,2025-04-24 21:13:25.075834,0 days 00:00:00.988677,friedman_mse,30,sqrt,3,5,best,TPESampler,COMPLETE
1977,0.7246712212327447,2025-04-24 21:13:24.241387,2025-04-24 21:13:25.176692,0 days 00:00:00.935305,friedman_mse,35,sqrt,3,6,best,TPESampler,COMPLETE
1978,0.6158166985156879,2025-04-24 21:13:24.764111,2025-04-24 21:13:25.519229,0 days 00:00:00.755118,friedman_mse,35,sqrt,1,9,best,TPESampler,COMPLETE
1979,0.9962502283466568,2025-04-24 21:13:25.421260,2025-04-24 21:13:26.401945,0 days 00:00:00.980685,squared_error,10,log2,4,16,random,TPESampler,COMPLETE
1980,0.6035982221692777,2025-04-24 21:13:25.467430,2025-04-24 21:13:26.434722,0 days 00:00:00.967292,friedman_mse,35,sqrt,1,2,best,TPESampler,COMPLETE
1981,0.6540978000576883,2025-04-24 21:13:26.044489,2025-04-24 21:13:26.742332,0 days 00:00:00.697843,friedman_mse,29,sqrt,1,7,best,TPESampler,COMPLETE
1982,0.6118796542365356,2025-04-24 21:13:26.640193,2025-04-24 21:13:27.649775,0 days 00:00:01.009582,absolute_error,35,sqrt,1,8,best,TPESampler,COMPLETE
1983,0.6123183697228924,2025-04-24 21:13:26.706813,2025-04-24 21:13:27.808334,0 days 00:00:01.101521,friedman_mse,30,sqrt,1,6,best,TPESampler,COMPLETE
1984,0.6123183697228924,2025-04-24 21:13:27.026254,2025-04-24 21:13:27.931649,0 days 00:00:00.905395,friedman_mse,30,sqrt,1,6,best,TPESampler,COMPLETE
1985,0.5981875505937236,2025-04-24 21:13:27.871839,2025-04-24 21:13:28.825867,0 days 00:00:00.954028,friedman_mse,35,sqrt,1,7,best,TPESampler,COMPLETE
1986,0.7246712212327447,2025-04-24 21:13:28.146453,2025-04-24 21:13:29.150342,0 days 00:00:01.003889,friedman_mse,35,sqrt,3,4,best,TPESampler,COMPLETE
1987,0.610300375570967,2025-04-24 21:13:28.230834,2025-04-24 21:13:29.369626,0 days 00:00:01.138792,friedman_mse,35,sqrt,1,5,best,TPESampler,COMPLETE
1988,0.675982364902162,2025-04-24 21:13:29.097886,2025-04-24 21:13:29.949535,0 days 00:00:00.851649,friedman_mse,35,sqrt,2,6,best,TPESampler,COMPLETE
1989,0.6489198865309416,2025-04-24 21:13:29.427470,2025-04-24 21:13:30.286148,0 days 00:00:00.858678,friedman_mse,35,log2,1,6,best,TPESampler,COMPLETE
1990,0.6327006073621034,2025-04-24 21:13:29.684143,2025-04-24 21:13:30.795417,0 days 00:00:01.111274,friedman_mse,35,sqrt,1,8,best,TPESampler,COMPLETE
1991,0.7187218102618173,2025-04-24 21:13:30.247347,2025-04-24 21:13:31.104597,0 days 00:00:00.857250,friedman_mse,19,sqrt,5,3,best,TPESampler,COMPLETE
1992,0.675982364902162,2025-04-24 21:13:30.558436,2025-04-24 21:13:31.277413,0 days 00:00:00.718977,friedman_mse,35,sqrt,2,6,best,TPESampler,COMPLETE
1993,0.6078108379240212,2025-04-24 21:13:31.106959,2025-04-24 21:13:31.806221,0 days 00:00:00.699262,friedman_mse,22,sqrt,1,8,best,TPESampler,COMPLETE
1994,0.7322341151053493,2025-04-24 21:13:31.490229,2025-04-24 21:13:32.443893,0 days 00:00:00.953664,absolute_error,13,sqrt,10,19,best,TPESampler,COMPLETE
1995,0.7196483853662857,2025-04-24 21:13:31.537466,2025-04-24 21:13:32.482315,0 days 00:00:00.944849,friedman_mse,30,sqrt,3,7,best,TPESampler,COMPLETE
1996,0.7182589720793523,2025-04-24 21:13:32.259932,2025-04-24 21:13:33.759442,0 days 00:00:01.499510,friedman_mse,30,sqrt,3,9,best,TPESampler,COMPLETE
1997,0.5522341372198587,2025-04-24 21:13:32.623528,2025-04-24 21:13:33.593139,0 days 00:00:00.969611,friedman_mse,35,sqrt,1,6,best,TPESampler,COMPLETE
1998,0.6248248219525877,2025-04-24 21:13:32.749256,2025-04-24 21:13:33.760917,0 days 00:00:01.011661,friedman_mse,35,sqrt,1,4,best,TPESampler,COMPLETE
1999,0.7406517311742006,2025-04-24 21:13:33.925496,2025-04-24 21:13:34.729387,0 days 00:00:00.803891,friedman_mse,30,sqrt,3,3,best,TPESampler,COMPLETE
2000,0.9962502283466568,2025-04-24 21:13:33.946105,2025-04-24 21:13:34.960744,0 days 00:00:01.014639,squared_error,33,log2,7,11,random,TPESampler,COMPLETE
2001,0.6123183697228924,2025-04-24 21:13:33.939711,2025-04-24 21:13:35.273007,0 days 00:00:01.333296,friedman_mse,30,sqrt,1,6,best,TPESampler,COMPLETE
2002,0.6123183697228924,2025-04-24 21:13:35.002538,2025-04-24 21:13:35.978151,0 days 00:00:00.975613,friedman_mse,30,sqrt,1,6,best,TPESampler,COMPLETE
