number,value,datetime_start,datetime_complete,duration,params_criterion,params_max_depth,params_max_features,params_min_samples_leaf,params_min_samples_split,params_splitter,system_attrs_auto:sampler,state
1715,0.5981875505937236,2025-04-24 21:11:27.825733,2025-04-24 21:11:28.532564,0 days 00:00:00.706831,friedman_mse,35,sqrt,1,7,best,TPESampler,COMPLETE
1716,0.6711336049143307,2025-04-24 21:11:28.247475,2025-04-24 21:11:29.344223,0 days 00:00:01.096748,friedman_mse,21,sqrt,1,8,best,TPESampler,COMPLETE
1717,0.6446227396865948,2025-04-24 21:11:28.373475,2025-04-24 21:11:29.418561,0 days 00:00:01.045086,friedman_mse,29,sqrt,1,6,best,TPESampler,COMPLETE
1718,0.6629240235460389,2025-04-24 21:11:28.942156,2025-04-24 21:11:29.769270,0 days 00:00:00.827114,absolute_error,31,log2,1,5,best,TPESampler,COMPLETE
1719,0.7187218102618173,2025-04-24 21:11:29.673943,2025-04-24 21:11:30.683723,0 days 00:00:01.009780,friedman_mse,22,sqrt,6,10,best,TPESampler,COMPLETE
1720,0.610300375570967,2025-04-24 21:11:29.731348,2025-04-24 21:11:31.009296,0 days 00:00:01.277948,friedman_mse,35,sqrt,1,5,best,TPESampler,COMPLETE
1721,0.6906100213968112,2025-04-24 21:11:29.964250,2025-04-24 21:11:31.011834,0 days 00:00:01.047584,friedman_mse,35,log2,1,7,best,TPESampler,COMPLETE
1722,0.6518691584550678,2025-04-24 21:11:30.963776,2025-04-24 21:11:31.694600,0 days 00:00:00.730824,friedman_mse,29,sqrt,1,5,best,TPESampler,COMPLETE
1723,0.5853577495940356,2025-04-24 21:11:31.219459,2025-04-24 21:11:32.232476,0 days 00:00:01.013017,absolute_error,35,sqrt,1,7,best,TPESampler,COMPLETE
1724,0.7246712212327447,2025-04-24 21:11:31.351607,2025-04-24 21:11:32.290135,0 days 00:00:00.938528,friedman_mse,35,sqrt,3,6,best,TPESampler,COMPLETE
1725,0.9968066590016214,2025-04-24 21:11:32.024909,2025-04-24 21:11:32.759793,0 days 00:00:00.734884,squared_error,6,log2,10,10,random,TPESampler,COMPLETE
1726,0.6777654391113064,2025-04-24 21:11:32.466622,2025-04-24 21:11:33.306408,0 days 00:00:00.839786,friedman_mse,29,sqrt,2,5,best,TPESampler,COMPLETE
1727,0.6518691584550678,2025-04-24 21:11:32.543209,2025-04-24 21:11:33.553919,0 days 00:00:01.010710,friedman_mse,29,sqrt,1,5,best,TPESampler,COMPLETE
1728,0.7018135560578764,2025-04-24 21:11:33.086139,2025-04-24 21:11:33.879854,0 days 00:00:00.793715,friedman_mse,31,sqrt,3,9,best,TPESampler,COMPLETE
1729,0.7246712212327447,2025-04-24 21:11:33.592663,2025-04-24 21:11:34.530062,0 days 00:00:00.937399,friedman_mse,35,sqrt,3,5,best,TPESampler,COMPLETE
1730,0.6158166985156879,2025-04-24 21:11:33.840594,2025-04-24 21:11:34.828342,0 days 00:00:00.987748,friedman_mse,35,sqrt,1,9,best,TPESampler,COMPLETE
1731,0.5522341372198587,2025-04-24 21:11:34.146391,2025-04-24 21:11:35.173442,0 days 00:00:01.027051,friedman_mse,35,sqrt,1,6,best,TPESampler,COMPLETE
1732,0.610300375570967,2025-04-24 21:11:34.846267,2025-04-24 21:11:35.710250,0 days 00:00:00.863983,friedman_mse,35,sqrt,1,5,best,TPESampler,COMPLETE
1733,0.5522341372198587,2025-04-24 21:11:35.063311,2025-04-24 21:11:36.046468,0 days 00:00:00.983157,friedman_mse,35,sqrt,1,6,best,TPESampler,COMPLETE
1734,0.5981875505937236,2025-04-24 21:11:35.426806,2025-04-24 21:11:36.334626,0 days 00:00:00.907820,friedman_mse,35,sqrt,1,7,best,TPESampler,COMPLETE
1735,0.610300375570967,2025-04-24 21:11:36.011603,2025-04-24 21:11:36.868976,0 days 00:00:00.857373,friedman_mse,35,sqrt,1,5,best,TPESampler,COMPLETE
1736,0.6614161227577632,2025-04-24 21:11:36.341112,2025-04-24 21:11:37.307098,0 days 00:00:00.965986,friedman_mse,28,sqrt,2,8,best,TPESampler,COMPLETE
1737,0.7406517311742006,2025-04-24 21:11:36.727289,2025-04-24 21:11:37.553067,0 days 00:00:00.825778,friedman_mse,30,sqrt,3,2,best,TPESampler,COMPLETE
1738,0.642967950902596,2025-04-24 21:11:37.244261,2025-04-24 21:11:38.027171,0 days 00:00:00.782910,friedman_mse,29,sqrt,1,9,best,TPESampler,COMPLETE
1739,0.7196483853662857,2025-04-24 21:11:37.619635,2025-04-24 21:11:38.749290,0 days 00:00:01.129655,friedman_mse,30,sqrt,3,7,best,TPESampler,COMPLETE
1740,0.6539311476955247,2025-04-24 21:11:37.818248,2025-04-24 21:11:38.844017,0 days 00:00:01.025769,friedman_mse,30,sqrt,1,4,best,TPESampler,COMPLETE
1741,0.6035982221692777,2025-04-24 21:11:38.366575,2025-04-24 21:11:39.123016,0 days 00:00:00.756441,friedman_mse,35,sqrt,1,2,best,TPESampler,COMPLETE
1742,0.642967950902596,2025-04-24 21:11:39.072070,2025-04-24 21:11:40.404426,0 days 00:00:01.332356,friedman_mse,29,sqrt,1,9,best,TPESampler,COMPLETE
1743,0.6158166985156879,2025-04-24 21:11:39.149991,2025-04-24 21:11:40.293924,0 days 00:00:01.143933,friedman_mse,35,sqrt,1,9,best,TPESampler,COMPLETE
1744,0.6123183697228924,2025-04-24 21:11:39.321253,2025-04-24 21:11:40.367490,0 days 00:00:01.046237,friedman_mse,30,sqrt,1,6,best,TPESampler,COMPLETE
1745,0.6327006073621034,2025-04-24 21:11:40.495881,2025-04-24 21:11:41.628675,0 days 00:00:01.132794,friedman_mse,35,sqrt,1,8,best,TPESampler,COMPLETE
1746,0.6327006073621034,2025-04-24 21:11:40.564537,2025-04-24 21:11:41.831379,0 days 00:00:01.266842,friedman_mse,35,sqrt,1,8,best,TPESampler,COMPLETE
1747,0.7246712212327447,2025-04-24 21:11:40.610185,2025-04-24 21:11:41.600254,0 days 00:00:00.990069,friedman_mse,35,sqrt,3,3,best,TPESampler,COMPLETE
1748,0.6777654391113064,2025-04-24 21:11:41.878974,2025-04-24 21:11:42.819896,0 days 00:00:00.940922,friedman_mse,29,sqrt,2,5,best,TPESampler,COMPLETE
1749,0.7106696395891989,2025-04-24 21:11:41.946716,2025-04-24 21:11:43.141081,0 days 00:00:01.194365,friedman_mse,35,sqrt,3,9,best,TPESampler,COMPLETE
1750,0.610300375570967,2025-04-24 21:11:42.167065,2025-04-24 21:11:43.186594,0 days 00:00:01.019529,friedman_mse,35,sqrt,1,5,best,TPESampler,COMPLETE
1751,0.610300375570967,2025-04-24 21:11:43.095227,2025-04-24 21:11:43.819312,0 days 00:00:00.724085,friedman_mse,35,sqrt,1,5,best,TPESampler,COMPLETE
1752,0.610300375570967,2025-04-24 21:11:43.326082,2025-04-24 21:11:44.539085,0 days 00:00:01.213003,friedman_mse,35,sqrt,1,5,best,TPESampler,COMPLETE
1753,0.5522341372198587,2025-04-24 21:11:43.460544,2025-04-24 21:11:44.552148,0 days 00:00:01.091604,friedman_mse,35,sqrt,1,6,best,TPESampler,COMPLETE
1754,0.5750216425928508,2025-04-24 21:11:44.066253,2025-04-24 21:11:44.825270,0 days 00:00:00.759017,squared_error,33,sqrt,1,5,best,TPESampler,COMPLETE
1755,0.6227361853799519,2025-04-24 21:11:44.785425,2025-04-24 21:11:45.580415,0 days 00:00:00.794990,friedman_mse,30,sqrt,1,2,best,TPESampler,COMPLETE
1756,0.7246712212327447,2025-04-24 21:11:45.024584,2025-04-24 21:11:45.962107,0 days 00:00:00.937523,friedman_mse,35,sqrt,3,6,best,TPESampler,COMPLETE
1757,0.6446227396865948,2025-04-24 21:11:45.247777,2025-04-24 21:11:46.244884,0 days 00:00:00.997107,friedman_mse,29,sqrt,1,6,best,TPESampler,COMPLETE
1758,0.9928365741172522,2025-04-24 21:11:45.899436,2025-04-24 21:11:46.570395,0 days 00:00:00.670959,friedman_mse,35,log2,7,11,best,TPESampler,COMPLETE
1759,0.7106696395891989,2025-04-24 21:11:46.303690,2025-04-24 21:11:47.594869,0 days 00:00:01.291179,friedman_mse,35,sqrt,3,9,best,TPESampler,COMPLETE
1760,0.7246712212327447,2025-04-24 21:11:46.502913,2025-04-24 21:11:47.392149,0 days 00:00:00.889236,friedman_mse,35,sqrt,3,6,best,TPESampler,COMPLETE
1761,0.649573014390662,2025-04-24 21:11:46.798696,2025-04-24 21:11:47.770975,0 days 00:00:00.972279,friedman_mse,35,sqrt,2,8,best,TPESampler,COMPLETE
1762,0.6015012618996902,2025-04-24 21:11:47.600425,2025-04-24 21:11:48.752933,0 days 00:00:01.152508,friedman_mse,30,sqrt,1,8,best,TPESampler,COMPLETE
1763,0.6446227396865948,2025-04-24 21:11:47.848687,2025-04-24 21:11:48.799448,0 days 00:00:00.950761,friedman_mse,29,sqrt,1,6,best,TPESampler,COMPLETE
1764,0.6015012618996902,2025-04-24 21:11:48.019078,2025-04-24 21:11:49.064802,0 days 00:00:01.045724,friedman_mse,30,sqrt,1,8,best,TPESampler,COMPLETE
1765,0.6082164367053395,2025-04-24 21:11:49.109338,2025-04-24 21:11:50.338364,0 days 00:00:01.229026,friedman_mse,35,sqrt,2,5,best,TPESampler,COMPLETE
1766,0.7246712212327447,2025-04-24 21:11:49.156985,2025-04-24 21:11:50.395107,0 days 00:00:01.238122,friedman_mse,35,sqrt,3,4,best,TPESampler,COMPLETE
1767,0.610300375570967,2025-04-24 21:11:49.293134,2025-04-24 21:11:50.561883,0 days 00:00:01.268749,friedman_mse,35,sqrt,1,5,best,TPESampler,COMPLETE
1768,0.610300375570967,2025-04-24 21:11:50.518790,2025-04-24 21:11:51.275472,0 days 00:00:00.756682,friedman_mse,35,sqrt,1,5,best,TPESampler,COMPLETE
1769,0.7155967574884852,2025-04-24 21:11:50.602075,2025-04-24 21:11:51.697396,0 days 00:00:01.095321,friedman_mse,29,sqrt,3,7,best,TPESampler,COMPLETE
1770,0.6327006073621034,2025-04-24 21:11:50.807630,2025-04-24 21:11:51.763995,0 days 00:00:00.956365,friedman_mse,35,sqrt,1,8,best,TPESampler,COMPLETE
1771,0.694744421825073,2025-04-24 21:11:51.613475,2025-04-24 21:11:52.522660,0 days 00:00:00.909185,friedman_mse,29,log2,2,5,best,TPESampler,COMPLETE
1772,0.6327006073621034,2025-04-24 21:11:51.922422,2025-04-24 21:11:53.142239,0 days 00:00:01.219817,friedman_mse,35,sqrt,1,8,best,TPESampler,COMPLETE
1773,0.5522341372198587,2025-04-24 21:11:52.044784,2025-04-24 21:11:53.143691,0 days 00:00:01.098907,friedman_mse,35,sqrt,1,6,best,TPESampler,COMPLETE
1774,0.5925119263261721,2025-04-24 21:11:52.817069,2025-04-24 21:11:53.733086,0 days 00:00:00.916017,friedman_mse,35,sqrt,1,3,best,TPESampler,COMPLETE
1775,0.6152703424484823,2025-04-24 21:11:53.359643,2025-04-24 21:11:54.153372,0 days 00:00:00.793729,friedman_mse,30,sqrt,2,5,best,TPESampler,COMPLETE
1776,0.6293599461146093,2025-04-24 21:11:53.402958,2025-04-24 21:11:54.469016,0 days 00:00:01.066058,friedman_mse,29,sqrt,2,4,best,TPESampler,COMPLETE
1777,0.6518691584550678,2025-04-24 21:11:54.079053,2025-04-24 21:11:54.905893,0 days 00:00:00.826840,friedman_mse,29,sqrt,1,5,best,TPESampler,COMPLETE
1778,0.5978929531338989,2025-04-24 21:11:54.563672,2025-04-24 21:11:55.515007,0 days 00:00:00.951335,friedman_mse,35,sqrt,1,10,best,TPESampler,COMPLETE
1779,0.7246712212327447,2025-04-24 21:11:54.774201,2025-04-24 21:11:55.694637,0 days 00:00:00.920436,friedman_mse,35,sqrt,3,6,best,TPESampler,COMPLETE
1780,0.7246712212327447,2025-04-24 21:11:55.189461,2025-04-24 21:11:56.544949,0 days 00:00:01.355488,squared_error,35,sqrt,3,5,best,TPESampler,COMPLETE
1781,0.6540978000576883,2025-04-24 21:11:55.843085,2025-04-24 21:11:57.075642,0 days 00:00:01.232557,friedman_mse,29,sqrt,1,7,best,TPESampler,COMPLETE
1782,0.5956996530554518,2025-04-24 21:11:55.919302,2025-04-24 21:11:56.861204,0 days 00:00:00.941902,absolute_error,29,sqrt,1,5,best,TPESampler,COMPLETE
1783,0.6327006073621034,2025-04-24 21:11:56.815546,2025-04-24 21:11:57.718017,0 days 00:00:00.902471,friedman_mse,35,sqrt,1,8,best,TPESampler,COMPLETE
1784,0.5981875505937236,2025-04-24 21:11:57.135389,2025-04-24 21:11:57.917329,0 days 00:00:00.781940,friedman_mse,35,sqrt,1,7,best,TPESampler,COMPLETE
1785,0.6248248219525877,2025-04-24 21:11:57.374143,2025-04-24 21:11:58.257602,0 days 00:00:00.883459,friedman_mse,35,sqrt,1,4,best,TPESampler,COMPLETE
1786,0.6581282397926295,2025-04-24 21:11:58.007462,2025-04-24 21:11:59.010267,0 days 00:00:01.002805,friedman_mse,30,sqrt,2,6,best,TPESampler,COMPLETE
1787,0.7258703503262229,2025-04-24 21:11:58.129221,2025-04-24 21:11:59.288634,0 days 00:00:01.159413,friedman_mse,35,sqrt,3,8,best,TPESampler,COMPLETE
1788,0.675982364902162,2025-04-24 21:11:58.507603,2025-04-24 21:11:59.384262,0 days 00:00:00.876659,friedman_mse,35,sqrt,2,6,best,TPESampler,COMPLETE
1789,0.6035982221692777,2025-04-24 21:11:59.287308,2025-04-24 21:11:59.987561,0 days 00:00:00.700253,friedman_mse,35,sqrt,1,2,best,TPESampler,COMPLETE
1790,0.6794094981777127,2025-04-24 21:11:59.644061,2025-04-24 21:12:00.812231,0 days 00:00:01.168170,friedman_mse,29,sqrt,3,6,best,TPESampler,COMPLETE
1791,0.6446227396865948,2025-04-24 21:11:59.682878,2025-04-24 21:12:00.813878,0 days 00:00:01.131000,friedman_mse,29,sqrt,1,6,best,TPESampler,COMPLETE
1792,0.5522341372198587,2025-04-24 21:12:00.302621,2025-04-24 21:12:01.119967,0 days 00:00:00.817346,friedman_mse,35,sqrt,1,6,best,TPESampler,COMPLETE
1793,0.5522341372198587,2025-04-24 21:12:01.073185,2025-04-24 21:12:02.005175,0 days 00:00:00.931990,friedman_mse,35,sqrt,1,6,best,TPESampler,COMPLETE
1794,0.6361895113592757,2025-04-24 21:12:01.355976,2025-04-24 21:12:02.510653,0 days 00:00:01.154677,friedman_mse,29,sqrt,1,4,best,TPESampler,COMPLETE
1795,0.5986673267910899,2025-04-24 21:12:01.458075,2025-04-24 21:12:02.588105,0 days 00:00:01.130030,friedman_mse,30,sqrt,1,5,best,TPESampler,COMPLETE
1796,0.6249892227503617,2025-04-24 21:12:02.297561,2025-04-24 21:12:03.127970,0 days 00:00:00.830409,friedman_mse,31,sqrt,1,9,best,TPESampler,COMPLETE
1797,0.5981875505937236,2025-04-24 21:12:02.779032,2025-04-24 21:12:03.734569,0 days 00:00:00.955537,friedman_mse,35,sqrt,1,7,best,TPESampler,COMPLETE
1798,0.7113263276640378,2025-04-24 21:12:02.998636,2025-04-24 21:12:03.900105,0 days 00:00:00.901469,friedman_mse,35,sqrt,3,7,best,TPESampler,COMPLETE
1799,0.6248248219525877,2025-04-24 21:12:03.385483,2025-04-24 21:12:04.198170,0 days 00:00:00.812687,friedman_mse,35,sqrt,1,4,best,TPESampler,COMPLETE
1800,0.708731352951706,2025-04-24 21:12:04.058374,2025-04-24 21:12:04.886759,0 days 00:00:00.828385,friedman_mse,28,sqrt,3,10,best,TPESampler,COMPLETE
1801,0.6571715889920813,2025-04-24 21:12:04.158000,2025-04-24 21:12:05.073950,0 days 00:00:00.915950,friedman_mse,29,sqrt,2,7,best,TPESampler,COMPLETE
1802,0.7406517311742006,2025-04-24 21:12:04.515060,2025-04-24 21:12:05.393384,0 days 00:00:00.878324,friedman_mse,30,sqrt,3,4,best,TPESampler,COMPLETE
1803,0.610300375570967,2025-04-24 21:12:05.109795,2025-04-24 21:12:06.032721,0 days 00:00:00.922926,friedman_mse,35,sqrt,1,5,best,TPESampler,COMPLETE
1804,0.6539311476955247,2025-04-24 21:12:05.311861,2025-04-24 21:12:06.186642,0 days 00:00:00.874781,friedman_mse,30,sqrt,1,4,best,TPESampler,COMPLETE
1805,0.6361895113592757,2025-04-24 21:12:05.670486,2025-04-24 21:12:06.829352,0 days 00:00:01.158866,friedman_mse,29,sqrt,1,4,best,TPESampler,COMPLETE
1806,0.6327006073621034,2025-04-24 21:12:06.346047,2025-04-24 21:12:07.496871,0 days 00:00:01.150824,friedman_mse,35,sqrt,1,8,best,TPESampler,COMPLETE
1807,0.5833421407487621,2025-04-24 21:12:06.665570,2025-04-24 21:12:07.893908,0 days 00:00:01.228338,absolute_error,34,sqrt,1,5,best,TPESampler,COMPLETE
1808,0.6158166985156879,2025-04-24 21:12:07.173113,2025-04-24 21:12:08.083133,0 days 00:00:00.910020,friedman_mse,35,sqrt,1,9,best,TPESampler,COMPLETE
1809,0.610300375570967,2025-04-24 21:12:07.967435,2025-04-24 21:12:08.860016,0 days 00:00:00.892581,squared_error,35,sqrt,1,5,best,TPESampler,COMPLETE
1810,0.6015012618996902,2025-04-24 21:12:08.167916,2025-04-24 21:12:09.722731,0 days 00:00:01.554815,friedman_mse,30,sqrt,1,8,best,TPESampler,COMPLETE
1811,0.649573014390662,2025-04-24 21:12:08.343696,2025-04-24 21:12:09.724177,0 days 00:00:01.380481,friedman_mse,35,sqrt,2,8,best,TPESampler,COMPLETE
1812,0.5522341372198587,2025-04-24 21:12:09.365492,2025-04-24 21:12:10.288782,0 days 00:00:00.923290,friedman_mse,35,sqrt,1,6,best,TPESampler,COMPLETE
1813,0.6571715889920813,2025-04-24 21:12:10.151235,2025-04-24 21:12:11.335428,0 days 00:00:01.184193,friedman_mse,29,sqrt,2,7,best,TPESampler,COMPLETE
1814,0.7246712212327447,2025-04-24 21:12:10.219274,2025-04-24 21:12:11.345513,0 days 00:00:01.126239,friedman_mse,35,sqrt,3,5,best,TPESampler,COMPLETE
1815,0.6869700271219243,2025-04-24 21:12:11.002849,2025-04-24 21:12:12.037565,0 days 00:00:01.034716,friedman_mse,33,log2,2,9,best,TPESampler,COMPLETE
1816,0.6035982221692777,2025-04-24 21:12:11.550899,2025-04-24 21:12:12.710315,0 days 00:00:01.159416,friedman_mse,35,sqrt,1,2,best,TPESampler,COMPLETE
1817,0.6248248219525877,2025-04-24 21:12:11.622552,2025-04-24 21:12:12.833071,0 days 00:00:01.210519,friedman_mse,35,sqrt,1,4,best,TPESampler,COMPLETE
1818,0.6481288639616444,2025-04-24 21:12:12.530774,2025-04-24 21:12:13.408847,0 days 00:00:00.878073,friedman_mse,30,sqrt,2,8,best,TPESampler,COMPLETE
1819,0.6015012618996902,2025-04-24 21:12:12.998639,2025-04-24 21:12:13.918036,0 days 00:00:00.919397,friedman_mse,30,sqrt,1,8,best,TPESampler,COMPLETE
1820,0.6015012618996902,2025-04-24 21:12:13.096238,2025-04-24 21:12:14.044557,0 days 00:00:00.948319,friedman_mse,30,sqrt,1,8,best,TPESampler,COMPLETE
1821,0.6158166985156879,2025-04-24 21:12:13.779444,2025-04-24 21:12:14.564329,0 days 00:00:00.784885,friedman_mse,35,sqrt,1,9,best,TPESampler,COMPLETE
1822,0.6568175016976607,2025-04-24 21:12:14.158205,2025-04-24 21:12:15.104756,0 days 00:00:00.946551,friedman_mse,35,sqrt,2,4,best,TPESampler,COMPLETE
1823,0.9581948037924227,2025-04-24 21:12:14.348919,2025-04-24 21:12:15.256177,0 days 00:00:00.907258,absolute_error,27,sqrt,9,20,random,TPESampler,COMPLETE
1824,0.7258703503262229,2025-04-24 21:12:14.962609,2025-04-24 21:12:15.700243,0 days 00:00:00.737634,friedman_mse,35,sqrt,3,8,best,TPESampler,COMPLETE
1825,0.675982364902162,2025-04-24 21:12:15.384600,2025-04-24 21:12:16.296362,0 days 00:00:00.911762,friedman_mse,35,sqrt,2,6,best,TPESampler,COMPLETE
1826,0.5522341372198587,2025-04-24 21:12:15.545675,2025-04-24 21:12:16.540529,0 days 00:00:00.994854,friedman_mse,35,sqrt,1,6,best,TPESampler,COMPLETE
1827,0.6777654391113064,2025-04-24 21:12:16.036733,2025-04-24 21:12:16.894456,0 days 00:00:00.857723,friedman_mse,29,sqrt,2,5,best,TPESampler,COMPLETE
1828,0.7246712212327447,2025-04-24 21:12:16.642033,2025-04-24 21:12:17.508861,0 days 00:00:00.866828,friedman_mse,35,sqrt,3,4,best,TPESampler,COMPLETE
1829,0.5522341372198587,2025-04-24 21:12:16.814098,2025-04-24 21:12:17.693446,0 days 00:00:00.879348,friedman_mse,35,sqrt,1,6,best,TPESampler,COMPLETE
1830,0.6929639379005934,2025-04-24 21:12:17.168930,2025-04-24 21:12:18.480360,0 days 00:00:01.311430,friedman_mse,31,sqrt,1,4,best,TPESampler,COMPLETE
1831,0.5522341372198587,2025-04-24 21:12:18.158543,2025-04-24 21:12:19.243321,0 days 00:00:01.084778,friedman_mse,35,sqrt,1,6,best,TPESampler,COMPLETE
1832,0.6327006073621034,2025-04-24 21:12:18.346276,2025-04-24 21:12:19.507400,0 days 00:00:01.161124,friedman_mse,35,sqrt,1,8,best,TPESampler,COMPLETE
1833,0.9962502283466568,2025-04-24 21:12:18.775872,2025-04-24 21:12:19.851347,0 days 00:00:01.075475,friedman_mse,23,log2,4,10,random,TPESampler,COMPLETE
1834,0.6469188128218861,2025-04-24 21:12:19.575414,2025-04-24 21:12:20.536624,0 days 00:00:00.961210,friedman_mse,28,sqrt,1,5,best,TPESampler,COMPLETE
1835,0.6540978000576883,2025-04-24 21:12:19.840287,2025-04-24 21:12:20.687804,0 days 00:00:00.847517,friedman_mse,29,sqrt,1,7,best,TPESampler,COMPLETE
1836,0.90376982927729,2025-04-24 21:12:20.191143,2025-04-24 21:12:20.998287,0 days 00:00:00.807144,absolute_error,18,sqrt,5,2,random,TPESampler,COMPLETE
1837,0.5522341372198587,2025-04-24 21:12:20.894512,2025-04-24 21:12:21.904380,0 days 00:00:01.009868,friedman_mse,35,sqrt,1,6,best,TPESampler,COMPLETE
1838,0.6509855886928757,2025-04-24 21:12:20.956645,2025-04-24 21:12:22.113910,0 days 00:00:01.157265,friedman_mse,33,log2,1,4,best,TPESampler,COMPLETE
1839,0.9737936641952643,2025-04-24 21:12:21.280495,2025-04-24 21:12:22.514985,0 days 00:00:01.234490,friedman_mse,31,sqrt,10,12,random,TPESampler,COMPLETE
1840,0.9928365741172522,2025-04-24 21:12:22.156043,2025-04-24 21:12:23.072854,0 days 00:00:00.916811,friedman_mse,21,log2,9,8,best,TPESampler,COMPLETE
1841,0.7467878360368371,2025-04-24 21:12:22.394191,2025-04-24 21:12:23.373668,0 days 00:00:00.979477,friedman_mse,12,sqrt,4,3,random,TPESampler,COMPLETE
1842,0.6158166985156879,2025-04-24 21:12:22.777255,2025-04-24 21:12:23.760540,0 days 00:00:00.983285,friedman_mse,35,sqrt,1,9,best,TPESampler,COMPLETE
1843,0.9581948037924227,2025-04-24 21:12:23.398244,2025-04-24 21:12:24.354745,0 days 00:00:00.956501,absolute_error,13,sqrt,8,12,random,TPESampler,COMPLETE
1844,0.7166800751920849,2025-04-24 21:12:23.625086,2025-04-24 21:12:24.533007,0 days 00:00:00.907921,friedman_mse,31,sqrt,3,4,best,TPESampler,COMPLETE
1845,0.7246712212327447,2025-04-24 21:12:24.058020,2025-04-24 21:12:24.822093,0 days 00:00:00.764073,friedman_mse,35,sqrt,3,2,best,TPESampler,COMPLETE
1846,0.6568175016976607,2025-04-24 21:12:24.753633,2025-04-24 21:12:25.537033,0 days 00:00:00.783400,friedman_mse,35,sqrt,2,4,best,TPESampler,COMPLETE
1847,0.7113263276640378,2025-04-24 21:12:24.768142,2025-04-24 21:12:25.689465,0 days 00:00:00.921323,friedman_mse,35,sqrt,3,7,best,TPESampler,COMPLETE
1848,0.610300375570967,2025-04-24 21:12:25.158566,2025-04-24 21:12:25.992087,0 days 00:00:00.833521,friedman_mse,35,sqrt,1,5,best,TPESampler,COMPLETE
1849,0.6116739712005577,2025-04-24 21:12:25.857269,2025-04-24 21:12:26.712933,0 days 00:00:00.855664,absolute_error,31,sqrt,3,6,best,TPESampler,COMPLETE
1850,0.964903983025146,2025-04-24 21:12:25.956739,2025-04-24 21:12:27.120144,0 days 00:00:01.163405,absolute_error,34,log2,6,9,best,TPESampler,COMPLETE
1851,0.6123183697228924,2025-04-24 21:12:26.287990,2025-04-24 21:12:27.307542,0 days 00:00:01.019552,friedman_mse,30,sqrt,1,6,best,TPESampler,COMPLETE
1852,0.5522341372198587,2025-04-24 21:12:27.030624,2025-04-24 21:12:27.911250,0 days 00:00:00.880626,friedman_mse,35,sqrt,1,6,best,TPESampler,COMPLETE
1853,0.6518691584550678,2025-04-24 21:12:27.401625,2025-04-24 21:12:28.340364,0 days 00:00:00.938739,friedman_mse,29,sqrt,1,5,best,TPESampler,COMPLETE
1854,0.5981875505937236,2025-04-24 21:12:27.644301,2025-04-24 21:12:28.663633,0 days 00:00:01.019332,friedman_mse,35,sqrt,1,7,best,TPESampler,COMPLETE
1855,0.7185647807428723,2025-04-24 21:12:28.275986,2025-04-24 21:12:29.159501,0 days 00:00:00.883515,friedman_mse,29,sqrt,3,8,best,TPESampler,COMPLETE
1856,0.6468159413546908,2025-04-24 21:12:28.743608,2025-04-24 21:12:29.515949,0 days 00:00:00.772341,friedman_mse,30,sqrt,2,2,best,TPESampler,COMPLETE
1857,0.6518272123179334,2025-04-24 21:12:29.038338,2025-04-24 21:12:29.911438,0 days 00:00:00.873100,friedman_mse,22,sqrt,1,6,best,TPESampler,COMPLETE
1858,0.7246712212327447,2025-04-24 21:12:29.457998,2025-04-24 21:12:30.278375,0 days 00:00:00.820377,friedman_mse,35,sqrt,3,6,best,TPESampler,COMPLETE
