number,value,datetime_start,datetime_complete,duration,params_C,params_epsilon,params_gamma,params_kernel,system_attrs_auto:sampler,state
1061,0.30385510863181264,2025-04-24 21:16:09.658642,2025-04-24 21:16:10.158278,0 days 00:00:00.499636,86.02892844102134,0.038443020167896615,0.09322804662224404,rbf,TPESampler,COMPLETE
1062,0.36750446057444075,2025-04-24 21:16:10.085981,2025-04-24 21:16:10.569304,0 days 00:00:00.483323,2.668595523493812,0.07990306735400127,0.06112193200952103,rbf,TPESampler,COMPLETE
1063,0.2898236787713711,2025-04-24 21:16:10.392475,2025-04-24 21:16:10.959610,0 days 00:00:00.567135,24.545372733687024,0.03549478841693082,0.04944387261184277,rbf,TPESampler,COMPLETE
1064,0.28186828724895485,2025-04-24 21:16:10.748886,2025-04-24 21:16:11.340060,0 days 00:00:00.591174,89.54075539090937,0.030187926798149117,0.025013852505464625,rbf,TPESampler,COMPLETE
1065,0.297073941419709,2025-04-24 21:16:11.194540,2025-04-24 21:16:11.748594,0 days 00:00:00.554054,88.5008611548134,0.01581505800636152,0.01484086330584771,rbf,TPESampler,COMPLETE
1066,0.2952068771394241,2025-04-24 21:16:11.592290,2025-04-24 21:16:12.133711,0 days 00:00:00.541421,7.208245718753393,0.007417779713664826,0.12458687790163334,rbf,TPESampler,COMPLETE
1067,0.505678669106623,2025-04-24 21:16:11.924233,2025-04-24 21:16:12.408452,0 days 00:00:00.484219,27.588886803699904,0.01677665120089937,0.0013131096621982344,rbf,TPESampler,COMPLETE
1068,0.2981791530213547,2025-04-24 21:16:12.357658,2025-04-24 21:16:12.852513,0 days 00:00:00.494855,86.73817241949136,0.016887375784365728,0.013955651901935777,rbf,TPESampler,COMPLETE
1069,0.36426156170134744,2025-04-24 21:16:12.628436,2025-04-24 21:16:14.523481,0 days 00:00:01.895045,24.060116370434383,0.006864380930250401,0.07426155574342547,linear,TPESampler,COMPLETE
1070,0.9505595663178701,2025-04-24 21:16:13.047348,2025-04-24 21:19:36.580008,0 days 00:03:23.532660,7.032624216506601,0.0013923772112942622,0.35947193654683796,poly,TPESampler,COMPLETE
1071,0.30727341744747044,2025-04-24 21:16:14.710004,2025-04-24 21:16:15.293615,0 days 00:00:00.583611,14.290567512873931,0.02958320313438263,0.0230789784078319,rbf,TPESampler,COMPLETE
1072,0.29172482389791377,2025-04-24 21:16:15.586273,2025-04-24 21:16:16.192841,0 days 00:00:00.606568,90.5835033871833,0.031664351954603875,0.04068297988015966,rbf,TPESampler,COMPLETE
1073,0.28579754453297035,2025-04-24 21:16:16.380659,2025-04-24 21:16:17.026578,0 days 00:00:00.645919,98.71200283727845,0.01935301852357534,0.02054772780529046,rbf,TPESampler,COMPLETE
1074,0.3009101434631984,2025-04-24 21:16:17.383545,2025-04-24 21:16:17.912944,0 days 00:00:00.529399,24.381824270513967,0.010044144127093587,0.11504206581237607,rbf,TPESampler,COMPLETE
1075,0.2988812533599438,2025-04-24 21:16:18.107969,2025-04-24 21:16:18.702804,0 days 00:00:00.594835,91.5532235165038,0.02225345338222724,0.04770103578329627,rbf,TPESampler,COMPLETE
1076,0.2833400797738386,2025-04-24 21:16:18.915217,2025-04-24 21:16:19.469575,0 days 00:00:00.554358,98.421707496516,0.04449035997375883,0.02012745397283331,rbf,TPESampler,COMPLETE
1077,0.502094051881664,2025-04-24 21:16:19.688554,2025-04-24 21:16:20.506934,0 days 00:00:00.818380,3.6187437262583173,0.003083177677716715,0.010437562964836451,rbf,TPESampler,COMPLETE
1078,0.416712357395482,2025-04-24 21:16:21.094512,2025-04-24 21:16:21.826388,0 days 00:00:00.731876,19.795746896033965,0.01357677997602582,0.003794450291130844,rbf,TPESampler,COMPLETE
1079,0.3055247540615887,2025-04-24 21:16:22.026741,2025-04-24 21:16:22.604275,0 days 00:00:00.577534,97.654447636826,0.026515058187185525,0.053817551835321005,rbf,TPESampler,COMPLETE
1080,0.3109352893540706,2025-04-24 21:16:22.785819,2025-04-24 21:16:23.296853,0 days 00:00:00.511034,13.805954835045835,0.00966454284504481,0.04134082065615302,rbf,TPESampler,COMPLETE
1081,14.450596550047072,2025-04-24 21:16:23.484201,2025-04-24 21:16:24.013501,0 days 00:00:00.529300,24.1566253754062,0.0660426492666541,0.006872540447057269,sigmoid,TPESampler,COMPLETE
1082,0.9016433157040666,2025-04-24 21:16:24.230082,2025-04-24 21:16:24.733438,0 days 00:00:00.503356,0.146975509441668,0.019016305623851943,0.0009823713680186387,sigmoid,TPESampler,COMPLETE
1083,0.8792569381825205,2025-04-24 21:16:24.920005,2025-04-24 21:17:24.785684,0 days 00:00:59.865679,76.22478940323505,0.018086770548318604,0.06982641507339038,poly,TPESampler,COMPLETE
1084,0.309931862220521,2025-04-24 21:17:24.994157,2025-04-24 21:17:25.495113,0 days 00:00:00.500956,64.20109975101127,0.026023781548178054,0.00577075012977259,rbf,TPESampler,COMPLETE
1085,0.2826837852278152,2025-04-24 21:17:25.687416,2025-04-24 21:17:26.229544,0 days 00:00:00.542128,96.9070164971836,0.038999955325055166,0.020428009085648933,rbf,TPESampler,COMPLETE
1086,0.30556853535994577,2025-04-24 21:17:26.434882,2025-04-24 21:17:26.980070,0 days 00:00:00.545188,21.22399859847444,0.03803866901347838,0.015400473807806379,rbf,TPESampler,COMPLETE
1087,0.31394800197218464,2025-04-24 21:17:27.158612,2025-04-24 21:17:27.639782,0 days 00:00:00.481170,28.61181546244746,0.026854959122157566,0.008429107041064898,rbf,TPESampler,COMPLETE
1088,0.28712862490704827,2025-04-24 21:17:27.813514,2025-04-24 21:17:28.348562,0 days 00:00:00.535048,90.15735654580568,0.02628571489688081,0.018924254717788462,rbf,TPESampler,COMPLETE
1089,0.326768246636915,2025-04-24 21:17:28.535020,2025-04-24 21:17:29.021983,0 days 00:00:00.486963,88.1128679995416,0.03084286845480612,0.002901524135655113,rbf,TPESampler,COMPLETE
1090,0.2923672702827517,2025-04-24 21:17:29.201056,2025-04-24 21:17:29.722089,0 days 00:00:00.521033,22.698952832509168,0.010178469681369161,0.06739075473237842,rbf,TPESampler,COMPLETE
1091,0.3589155733066584,2025-04-24 21:17:29.906595,2025-04-24 21:17:30.655849,0 days 00:00:00.749254,8.536916456191676,0.10568182580130506,0.012750685432607559,linear,TPESampler,COMPLETE
1092,0.36708370875399593,2025-04-24 21:17:30.844572,2025-04-24 21:17:33.911463,0 days 00:00:03.066891,33.83538920523255,0.0010607242021917977,0.007872790052299107,linear,TPESampler,COMPLETE
1093,0.3614079040970284,2025-04-24 21:17:34.102847,2025-04-24 21:17:40.455031,0 days 00:00:06.352184,95.72632197596735,0.0373819098590578,0.042294691313151785,linear,TPESampler,COMPLETE
1094,0.29749451417750405,2025-04-24 21:17:40.632219,2025-04-24 21:17:41.157952,0 days 00:00:00.525733,91.4201555960804,0.05378656760896192,0.01009131030702028,rbf,TPESampler,COMPLETE
1095,0.29195072052563437,2025-04-24 21:17:41.345600,2025-04-24 21:17:41.919982,0 days 00:00:00.574382,98.75822863890073,0.01581191766984989,0.016657538939661595,rbf,TPESampler,COMPLETE
1096,0.40627995487015034,2025-04-24 21:17:42.100279,2025-04-24 21:17:42.612653,0 days 00:00:00.512374,8.111687080799644,0.0554006468266569,0.009955514756616457,rbf,TPESampler,COMPLETE
1097,0.3045031867738697,2025-04-24 21:17:42.829492,2025-04-24 21:17:43.361183,0 days 00:00:00.531691,93.40645016576723,0.04520873887609255,0.0596614905262665,rbf,TPESampler,COMPLETE
1098,0.3143048118577161,2025-04-24 21:17:43.540359,2025-04-24 21:17:44.199508,0 days 00:00:00.659149,89.47156500015095,0.004760844139116853,0.07212499785666299,rbf,TPESampler,COMPLETE
1099,0.3659231497266537,2025-04-24 21:17:44.542187,2025-04-24 21:17:45.390041,0 days 00:00:00.847854,0.49006521011085663,0.007767017924995905,0.3812657230135389,linear,TPESampler,COMPLETE
1100,0.30251338118747473,2025-04-24 21:17:45.831485,2025-04-24 21:17:46.676946,0 days 00:00:00.845461,17.086405733004675,0.0631101723929575,0.016307332051804863,rbf,TPESampler,COMPLETE
1101,0.47946625680429866,2025-04-24 21:17:47.065530,2025-04-24 21:17:48.084485,0 days 00:00:01.018955,2.283752706861761,0.041207866850037134,0.022077943891243478,rbf,TPESampler,COMPLETE
1102,0.303327668047519,2025-04-24 21:17:48.427687,2025-04-24 21:17:50.021023,0 days 00:00:01.593336,98.5208581285479,0.04248603415914809,0.047120482315066166,rbf,TPESampler,COMPLETE
1103,0.2949163152414207,2025-04-24 21:17:50.195057,2025-04-24 21:17:50.915902,0 days 00:00:00.720845,17.047583061046495,0.027717647151760543,0.054469693379031243,rbf,TPESampler,COMPLETE
1104,0.6965169677219609,2025-04-24 21:17:51.307926,2025-04-24 21:17:51.846970,0 days 00:00:00.539044,11.636710035903507,0.005992979648833784,0.0001401589899481546,sigmoid,TPESampler,COMPLETE
1105,0.2820613066568013,2025-04-24 21:17:52.026221,2025-04-24 21:17:53.110931,0 days 00:00:01.084710,94.82460276608593,0.02768932731997153,0.023029204893060495,rbf,TPESampler,COMPLETE
1106,0.8785908332663622,2025-04-24 21:17:53.414125,2025-04-24 21:17:54.158637,0 days 00:00:00.744512,88.77387658427048,0.04193604990729171,0.01435599717039144,poly,TPESampler,COMPLETE
1107,0.3089428361394328,2025-04-24 21:17:54.486233,2025-04-24 21:17:55.373704,0 days 00:00:00.887471,90.29127967394007,0.022613673539890022,0.0048390706565977545,rbf,TPESampler,COMPLETE
1108,0.310049960366027,2025-04-24 21:17:55.612648,2025-04-24 21:17:56.170930,0 days 00:00:00.558282,24.24111427478696,0.010039403271570504,0.011446173941017096,rbf,TPESampler,COMPLETE
1109,0.2829494067413637,2025-04-24 21:17:56.406692,2025-04-24 21:17:57.244732,0 days 00:00:00.838040,91.36421640130715,0.036639732514732605,0.022468689783240934,rbf,TPESampler,COMPLETE
1110,0.3006778266738336,2025-04-24 21:17:57.429334,2025-04-24 21:17:58.261737,0 days 00:00:00.832403,97.8186931287204,0.007095600048870809,0.01806808627272988,rbf,TPESampler,COMPLETE
1111,0.30139467544511755,2025-04-24 21:17:58.454653,2025-04-24 21:17:58.940700,0 days 00:00:00.486047,17.270562654197384,0.06374388072648149,0.015077055893396573,rbf,TPESampler,COMPLETE
1112,0.3081298064659593,2025-04-24 21:17:59.121011,2025-04-24 21:17:59.611781,0 days 00:00:00.490770,97.04651944726422,0.05700529314412986,0.17872596534498086,rbf,TPESampler,COMPLETE
1113,0.30580089341277666,2025-04-24 21:17:59.789039,2025-04-24 21:18:00.296071,0 days 00:00:00.507032,98.46119726509629,0.07107164934097879,0.0487876661817626,rbf,TPESampler,COMPLETE
1114,0.31300921666283127,2025-04-24 21:18:00.473652,2025-04-24 21:18:00.960901,0 days 00:00:00.487249,15.420556054402969,0.012950339777812413,0.028840531138650635,rbf,TPESampler,COMPLETE
1115,0.3095934276042392,2025-04-24 21:18:01.140698,2025-04-24 21:18:01.660103,0 days 00:00:00.519405,16.851314704579217,0.01612987723342159,0.03192288953039903,rbf,TPESampler,COMPLETE
1116,0.2833880259663036,2025-04-24 21:18:01.835158,2025-04-24 21:18:02.383049,0 days 00:00:00.547891,98.06221548824777,0.016899469973533365,0.029049720512603325,rbf,TPESampler,COMPLETE
1117,0.30423472535113844,2025-04-24 21:18:02.566549,2025-04-24 21:18:03.143451,0 days 00:00:00.576902,88.44671490695956,0.028369958762541572,0.005715886795605987,rbf,TPESampler,COMPLETE
1118,0.2868787408260337,2025-04-24 21:18:03.329397,2025-04-24 21:18:03.864963,0 days 00:00:00.535566,93.44670852020073,0.11567882462789093,0.01748616010546096,rbf,TPESampler,COMPLETE
1119,0.3055972717342146,2025-04-24 21:18:04.058924,2025-04-24 21:18:04.599428,0 days 00:00:00.540504,95.4360181779845,0.020045492610374093,0.009090029176219708,rbf,TPESampler,COMPLETE
1120,0.38212391783235977,2025-04-24 21:18:04.787431,2025-04-24 21:18:05.297459,0 days 00:00:00.510028,24.511439141063008,0.07151126015007858,0.004332875108320584,rbf,TPESampler,COMPLETE
1121,0.3043168682948951,2025-04-24 21:18:05.498971,2025-04-24 21:18:06.098731,0 days 00:00:00.599760,87.57070019720301,0.01655353269174217,0.05305852934145539,rbf,TPESampler,COMPLETE
1122,0.3024778676343703,2025-04-24 21:18:06.280813,2025-04-24 21:18:06.815487,0 days 00:00:00.534674,21.75615551441615,0.05338108696869568,0.014588020944392897,rbf,TPESampler,COMPLETE
1123,0.3061568290351464,2025-04-24 21:18:06.996374,2025-04-24 21:18:07.749938,0 days 00:00:00.753564,98.9940468758343,0.027245227792640263,0.004956178575555655,rbf,TPESampler,COMPLETE
1124,0.31618356080610166,2025-04-24 21:18:07.935821,2025-04-24 21:18:08.435703,0 days 00:00:00.499882,14.743727519087386,0.02949091650081828,0.21149485428741405,rbf,TPESampler,COMPLETE
1125,0.3088274615938388,2025-04-24 21:18:08.696329,2025-04-24 21:18:09.275015,0 days 00:00:00.578686,90.00773493933134,0.015756856940739843,0.08082949366225681,rbf,TPESampler,COMPLETE
1126,0.29018144746182106,2025-04-24 21:18:09.455634,2025-04-24 21:18:10.001941,0 days 00:00:00.546307,99.94359343599231,0.03409537203764831,0.014438347690853557,rbf,TPESampler,COMPLETE
1127,0.2947083733207813,2025-04-24 21:18:10.182325,2025-04-24 21:18:10.683691,0 days 00:00:00.501366,95.47762302157912,0.11900005472321162,0.032269454463790634,rbf,TPESampler,COMPLETE
1128,0.9767290537162716,2025-04-24 21:18:10.860820,2025-04-24 21:18:11.331410,0 days 00:00:00.470590,0.02375551726736033,0.0017525817512775792,0.000577185308312884,rbf,TPESampler,COMPLETE
1129,0.3494101242765677,2025-04-24 21:18:11.503638,2025-04-24 21:18:12.020739,0 days 00:00:00.517101,19.12485355068873,0.022326437337023847,0.009162603334003417,rbf,TPESampler,COMPLETE
1130,0.3226822588243083,2025-04-24 21:18:12.224677,2025-04-24 21:18:12.750449,0 days 00:00:00.525772,95.00283201023349,0.012179955609902383,0.1634466978934624,rbf,TPESampler,COMPLETE
1131,0.29668404800662024,2025-04-24 21:18:12.940786,2025-04-24 21:18:13.438628,0 days 00:00:00.497842,23.904514551499872,0.04978521935415386,0.06697045248194784,rbf,TPESampler,COMPLETE
1132,0.30030419216226084,2025-04-24 21:18:13.608365,2025-04-24 21:18:14.154773,0 days 00:00:00.546408,88.98970963611401,0.014071251871215823,0.013562951768983597,rbf,TPESampler,COMPLETE
1133,0.8750616939796775,2025-04-24 21:18:14.365134,2025-04-24 21:18:15.024885,0 days 00:00:00.659751,15.119117002320788,0.041009764692557085,0.030121120072358527,poly,TPESampler,COMPLETE
1134,0.3079089335101575,2025-04-24 21:18:15.208084,2025-04-24 21:18:15.741232,0 days 00:00:00.533148,95.89714297255951,0.008201091327721984,0.00950825394186468,rbf,TPESampler,COMPLETE
1135,0.3167279821364897,2025-04-24 21:18:15.929068,2025-04-24 21:18:16.420584,0 days 00:00:00.491516,96.7079668521375,0.02777744414633543,0.19662368591253185,rbf,TPESampler,COMPLETE
1136,0.3012325578345447,2025-04-24 21:18:16.592608,2025-04-24 21:18:17.296890,0 days 00:00:00.704282,97.67472227697023,0.036805567252231976,0.0067875219941063375,rbf,TPESampler,COMPLETE
1137,0.2977338184360896,2025-04-24 21:18:17.481807,2025-04-24 21:18:18.008977,0 days 00:00:00.527170,24.27893041265794,0.06519445247656576,0.06306210346813129,rbf,TPESampler,COMPLETE
1138,0.31015431815042016,2025-04-24 21:18:18.192039,2025-04-24 21:18:18.684511,0 days 00:00:00.492472,18.32544662655114,0.017871069959539656,0.025373601252264462,rbf,TPESampler,COMPLETE
1139,0.3650707852881229,2025-04-24 21:18:18.858614,2025-04-24 21:18:23.784203,0 days 00:00:04.925589,79.96586986095305,0.01815104218144207,0.015211466263214792,linear,TPESampler,COMPLETE
1140,0.2835118495772202,2025-04-24 21:18:23.966883,2025-04-24 21:18:24.480597,0 days 00:00:00.513714,96.87683988153464,0.07067171104988586,0.022511809770871336,rbf,TPESampler,COMPLETE
1141,244.7869561597404,2025-04-24 21:18:24.658193,2025-04-24 21:18:25.149741,0 days 00:00:00.491548,30.694188552077957,0.013429711055672372,0.05437384475475106,sigmoid,TPESampler,COMPLETE
1142,0.3043366853886418,2025-04-24 21:18:25.326232,2025-04-24 21:18:25.835591,0 days 00:00:00.509359,18.040889177742645,0.031152599084024197,0.015399137902211894,rbf,TPESampler,COMPLETE
1143,0.28414089555165933,2025-04-24 21:18:26.006376,2025-04-24 21:18:26.552999,0 days 00:00:00.546623,94.87474628904158,0.033665088816621856,0.020018673305293912,rbf,TPESampler,COMPLETE
1144,0.32291424109953704,2025-04-24 21:18:26.766965,2025-04-24 21:18:27.423361,0 days 00:00:00.656396,11.501677252756178,0.13539432336286972,0.020201372077723104,rbf,TPESampler,COMPLETE
1145,0.3646339062549851,2025-04-24 21:18:27.601254,2025-04-24 21:18:28.293886,0 days 00:00:00.692632,2.0103940796579445,0.0046842418225739495,0.00012080114259816218,linear,TPESampler,COMPLETE
1146,0.35655017972679326,2025-04-24 21:18:28.470700,2025-04-24 21:18:28.945167,0 days 00:00:00.474467,33.67976452482848,0.001105453097684462,0.3278210400353726,rbf,TPESampler,COMPLETE
1147,3.7127667745027346,2025-04-24 21:18:29.122012,2025-04-24 21:18:29.601495,0 days 00:00:00.479483,58.94588447714382,0.028810407011483668,0.0030729468841045418,sigmoid,TPESampler,COMPLETE
1148,0.30336931150426993,2025-04-24 21:18:29.771192,2025-04-24 21:18:30.288495,0 days 00:00:00.517303,94.52045162173368,0.04069097912667595,0.0708622499973145,rbf,TPESampler,COMPLETE
1149,0.657722929293311,2025-04-24 21:18:30.468166,2025-04-24 21:18:30.938158,0 days 00:00:00.469992,0.9818193373234134,0.23380725970995492,0.005105729369741343,sigmoid,TPESampler,COMPLETE
1150,0.2944375878358499,2025-04-24 21:18:31.110811,2025-04-24 21:18:31.629299,0 days 00:00:00.518488,15.176292747435266,0.01831309220766013,0.0629093726010271,rbf,TPESampler,COMPLETE
1151,0.30063071572344624,2025-04-24 21:18:31.810655,2025-04-24 21:18:32.343899,0 days 00:00:00.533244,22.481348193245726,0.04562969287118911,0.017713968670968798,rbf,TPESampler,COMPLETE
1152,0.9966047940973486,2025-04-24 21:18:32.535264,2025-04-24 21:18:33.137001,0 days 00:00:00.601737,0.0025810964901884234,0.02705018000333964,0.0013048306595611382,sigmoid,TPESampler,COMPLETE
1153,0.29519221429016707,2025-04-24 21:18:33.307980,2025-04-24 21:18:33.819256,0 days 00:00:00.511276,23.483134523699157,0.13477238769917008,0.13088413918588468,rbf,TPESampler,COMPLETE
1154,406.7591649150627,2025-04-24 21:18:34.001175,2025-04-24 21:18:34.493310,0 days 00:00:00.492135,60.78953729602155,0.052076334493206054,0.03520237421367886,sigmoid,TPESampler,COMPLETE
1155,0.308351924247708,2025-04-24 21:18:34.665602,2025-04-24 21:18:35.172020,0 days 00:00:00.506418,20.333217136840183,0.011971572870979427,0.027772734054256936,rbf,TPESampler,COMPLETE
1156,0.29789544276144797,2025-04-24 21:18:35.345068,2025-04-24 21:18:35.871817,0 days 00:00:00.526749,87.37601913871079,0.04787255038538052,0.008573888122789669,rbf,TPESampler,COMPLETE
1157,0.9431709111828804,2025-04-24 21:18:36.056540,2025-04-24 21:18:36.526483,0 days 00:00:00.469943,0.002157766685136823,0.9910484196562528,0.00010295509675882279,sigmoid,TPESampler,COMPLETE
1158,0.3023261476697083,2025-04-24 21:18:36.715441,2025-04-24 21:18:37.237748,0 days 00:00:00.522307,98.74056770724154,0.05292392777216532,0.07148218763604115,rbf,TPESampler,COMPLETE
1159,0.29131641705138484,2025-04-24 21:18:37.411278,2025-04-24 21:18:37.922233,0 days 00:00:00.510955,87.01610878474648,0.05530976850655627,0.014918600159669313,rbf,TPESampler,COMPLETE
1160,0.30753133624669443,2025-04-24 21:18:38.112743,2025-04-24 21:18:38.603461,0 days 00:00:00.490718,18.27687480123527,0.027120663871921528,0.02823988484711101,rbf,TPESampler,COMPLETE
1161,0.30894527190451254,2025-04-24 21:18:38.783996,2025-04-24 21:18:39.318796,0 days 00:00:00.534800,99.83478418912026,0.016894545719869987,0.07290325393093912,rbf,TPESampler,COMPLETE
1162,0.28273048423353686,2025-04-24 21:18:39.489531,2025-04-24 21:18:40.029761,0 days 00:00:00.540230,99.36955853244359,0.028830958657841986,0.032452276096809604,rbf,TPESampler,COMPLETE
1163,0.298349234053299,2025-04-24 21:18:40.205691,2025-04-24 21:18:40.702158,0 days 00:00:00.496467,22.355993670485088,0.09245027527135302,0.016384002133860973,rbf,TPESampler,COMPLETE
1164,0.304193063534916,2025-04-24 21:18:40.888454,2025-04-24 21:18:41.388363,0 days 00:00:00.499909,18.133261963747042,0.04889649491294034,0.031268540256486274,rbf,TPESampler,COMPLETE
1165,0.29404381353386877,2025-04-24 21:18:41.564702,2025-04-24 21:18:42.150696,0 days 00:00:00.585994,98.24727889005409,0.024991448600662526,0.01360136178843539,rbf,TPESampler,COMPLETE
1166,0.29325478641447816,2025-04-24 21:18:42.344423,2025-04-24 21:18:42.909462,0 days 00:00:00.565039,94.88475072733733,0.032487950094224234,0.041185447282461374,rbf,TPESampler,COMPLETE
1167,0.29740156079865787,2025-04-24 21:18:43.091448,2025-04-24 21:18:43.596685,0 days 00:00:00.505237,22.1865968113537,0.023704970421307932,0.10344829372376063,rbf,TPESampler,COMPLETE
1168,0.3716657278136995,2025-04-24 21:18:43.774070,2025-04-24 21:18:44.290853,0 days 00:00:00.516783,20.606923868992652,0.027931498966981095,0.006727753237371016,rbf,TPESampler,COMPLETE
1169,0.35861757598076416,2025-04-24 21:18:44.464984,2025-04-24 21:18:46.495777,0 days 00:00:02.030793,18.979019575853652,0.052294774433031085,0.06469665138354579,linear,TPESampler,COMPLETE
1170,0.8304363418573555,2025-04-24 21:18:46.671090,2025-04-24 21:18:47.515213,0 days 00:00:00.844123,0.25397288671059004,0.09326579240976418,0.21656570403266348,poly,TPESampler,COMPLETE
1171,0.289015622393638,2025-04-24 21:18:47.717438,2025-04-24 21:18:48.283637,0 days 00:00:00.566199,99.03630286415404,0.013634558611880569,0.020999609099081797,rbf,TPESampler,COMPLETE
1172,0.3076087287919953,2025-04-24 21:18:48.465464,2025-04-24 21:18:48.973322,0 days 00:00:00.507858,14.492229740455658,0.02891854106452208,0.02540432296931553,rbf,TPESampler,COMPLETE
1173,0.753350197216851,2025-04-24 21:18:49.143685,2025-04-24 21:18:49.643342,0 days 00:00:00.499657,0.38423076705828846,0.0012241734957502426,0.049279261605289865,poly,TPESampler,COMPLETE
1174,0.2899881351588313,2025-04-24 21:18:49.813109,2025-04-24 21:18:50.327323,0 days 00:00:00.514214,91.07023205572396,0.058828098785462954,0.016588111357694914,rbf,TPESampler,COMPLETE
1175,0.2852570356810939,2025-04-24 21:18:50.505926,2025-04-24 21:18:51.016610,0 days 00:00:00.510684,92.99866140324248,0.05322479120537136,0.030647152646275932,rbf,TPESampler,COMPLETE
1176,0.2875223119970961,2025-04-24 21:18:51.204036,2025-04-24 21:18:51.744655,0 days 00:00:00.540619,98.3723692130966,0.03676975239611892,0.03563470696780318,rbf,TPESampler,COMPLETE
1177,0.36210499805256735,2025-04-24 21:18:51.920925,2025-04-24 21:18:57.457558,0 days 00:00:05.536633,92.63840145044162,0.050421947652064376,0.0034326687419597773,linear,TPESampler,COMPLETE
1178,0.3066987032827186,2025-04-24 21:18:57.635170,2025-04-24 21:18:58.111712,0 days 00:00:00.476542,14.628530170403982,0.10414770551124589,0.03232326149118152,rbf,TPESampler,COMPLETE
