number,value,datetime_start,datetime_complete,duration,params_C,params_epsilon,params_gamma,params_kernel,system_attrs_auto:sampler,state
471,0.3504558830128439,2025-04-24 21:06:38.670217,2025-04-24 21:06:39.151298,0 days 00:00:00.481081,16.03242383234712,0.01542310257415421,0.010847353086721263,rbf,TPESampler,COMPLETE
472,0.28847500580028496,2025-04-24 21:06:39.333479,2025-04-24 21:06:39.870384,0 days 00:00:00.536905,99.5292823261887,0.026608970824588435,0.01617304715224869,rbf,TPESampler,COMPLETE
473,0.3107763538964807,2025-04-24 21:06:40.057221,2025-04-24 21:06:40.594826,0 days 00:00:00.537605,15.525755148307669,0.030055921553843186,0.027470353852317744,rbf,TPESampler,COMPLETE
474,0.3046957196538157,2025-04-24 21:06:40.771679,2025-04-24 21:06:41.278875,0 days 00:00:00.507196,97.90997087494645,0.05938003505877709,0.05793000410107394,rbf,TPESampler,COMPLETE
475,0.28772750923558627,2025-04-24 21:06:41.451427,2025-04-24 21:06:42.014730,0 days 00:00:00.563303,95.30072335467071,0.027586898397995063,0.017328139944281642,rbf,TPESampler,COMPLETE
476,0.28590405871597385,2025-04-24 21:06:42.190272,2025-04-24 21:06:42.735661,0 days 00:00:00.545389,91.18619561171668,0.03439816517137927,0.01899694011681633,rbf,TPESampler,COMPLETE
477,0.3043336392145296,2025-04-24 21:06:42.912688,2025-04-24 21:06:43.433991,0 days 00:00:00.521303,67.8392940344131,0.027667835053742457,0.06847765594230572,rbf,TPESampler,COMPLETE
478,0.2876530160014352,2025-04-24 21:06:43.619278,2025-04-24 21:06:44.148328,0 days 00:00:00.529050,28.797052446451723,0.026712723322351858,0.04818217276830492,rbf,TPESampler,COMPLETE
479,0.3044119785681472,2025-04-24 21:06:44.366886,2025-04-24 21:06:44.925400,0 days 00:00:00.558514,86.23303924625844,0.030746801170126476,0.0915792993690481,rbf,TPESampler,COMPLETE
480,0.3930202866395433,2025-04-24 21:06:45.104217,2025-04-24 21:06:45.648389,0 days 00:00:00.544172,13.94743770492892,0.026413798393320486,0.007419042284162999,rbf,TPESampler,COMPLETE
481,0.3598847758080563,2025-04-24 21:06:45.839460,2025-04-24 21:06:56.747411,0 days 00:00:10.907951,94.77931702364108,0.07714117300584936,0.10944365750461592,linear,TPESampler,COMPLETE
482,0.3220694339488435,2025-04-24 21:06:56.921649,2025-04-24 21:06:57.421890,0 days 00:00:00.500241,13.542000122201426,0.07791053662374524,0.013449118570151249,rbf,TPESampler,COMPLETE
483,4.516406310660286,2025-04-24 21:06:57.616659,2025-04-24 21:06:58.085760,0 days 00:00:00.469101,0.5548663954509981,0.03319687412880654,0.8269262968892322,sigmoid,TPESampler,COMPLETE
484,0.29524784511385405,2025-04-24 21:06:58.294556,2025-04-24 21:06:58.844930,0 days 00:00:00.550374,90.03179728291374,0.022150083470550374,0.014253954954216554,rbf,TPESampler,COMPLETE
485,0.30841987667407256,2025-04-24 21:06:59.028673,2025-04-24 21:06:59.620280,0 days 00:00:00.591607,97.47006696108964,0.016282146410432952,0.0637153145599868,rbf,TPESampler,COMPLETE
486,0.9997455893691222,2025-04-24 21:06:59.803765,2025-04-24 21:07:00.305685,0 days 00:00:00.501920,98.15331551718577,0.001158366152125504,0.00010248909991489277,poly,TPESampler,COMPLETE
487,0.28860205891240454,2025-04-24 21:07:00.495419,2025-04-24 21:07:01.130969,0 days 00:00:00.635550,88.16467540982418,0.1235842475802137,0.01851924958923178,rbf,TPESampler,COMPLETE
488,0.389755624243042,2025-04-24 21:07:01.341279,2025-04-24 21:07:01.828276,0 days 00:00:00.486997,19.650411390857297,0.007730580536363358,0.005489659634160938,rbf,TPESampler,COMPLETE
489,0.970224845431058,2025-04-24 21:07:01.994933,2025-04-24 21:07:02.469183,0 days 00:00:00.474250,0.0031822705947294775,0.17199440418759496,0.006628308794095019,rbf,TPESampler,COMPLETE
490,112.80050082830326,2025-04-24 21:07:02.648148,2025-04-24 21:07:03.167132,0 days 00:00:00.518984,71.02505412155068,0.03983300180114715,0.010918799528428091,sigmoid,TPESampler,COMPLETE
491,0.30455327192687276,2025-04-24 21:07:03.349826,2025-04-24 21:07:03.861835,0 days 00:00:00.512009,92.68633022750673,0.042729546681145876,0.0507952930109661,rbf,TPESampler,COMPLETE
492,0.8862914370095217,2025-04-24 21:07:04.041319,2025-04-24 21:07:04.528891,0 days 00:00:00.487572,0.6128010430969563,0.20891300310471578,0.00012453937933288515,rbf,TPESampler,COMPLETE
493,636.5122037134535,2025-04-24 21:07:04.701189,2025-04-24 21:07:05.187720,0 days 00:00:00.486531,73.75549120688892,0.03146566323088027,0.05908053371051994,sigmoid,TPESampler,COMPLETE
494,0.980632566033279,2025-04-24 21:07:05.369761,2025-04-24 21:07:05.872866,0 days 00:00:00.503105,0.0025444876783410407,0.006041240076122123,0.006173971227678146,rbf,TPESampler,COMPLETE
495,0.9277025916876304,2025-04-24 21:07:06.096740,2025-04-24 21:07:07.154457,0 days 00:00:01.057717,6.594392590193123,0.017150484895303828,0.057830809283449705,poly,TPESampler,COMPLETE
496,0.2817881944607652,2025-04-24 21:07:07.403229,2025-04-24 21:07:07.962723,0 days 00:00:00.559494,96.08466608979151,0.03136243082561692,0.02473316326279394,rbf,TPESampler,COMPLETE
497,0.30676880543642476,2025-04-24 21:07:08.136500,2025-04-24 21:07:08.644904,0 days 00:00:00.508404,12.493980272999856,0.06382565163623467,0.03762339530280226,rbf,TPESampler,COMPLETE
498,0.3639320957975326,2025-04-24 21:07:08.825178,2025-04-24 21:07:13.725430,0 days 00:00:04.900252,83.37574667393166,0.025926861743247875,0.04396206481964186,linear,TPESampler,COMPLETE
499,0.30377758722692705,2025-04-24 21:07:13.910471,2025-04-24 21:07:14.457244,0 days 00:00:00.546773,94.08031923169897,0.03666815283200052,0.07028466034715918,rbf,TPESampler,COMPLETE
500,0.386983025008829,2025-04-24 21:07:14.642329,2025-04-24 21:07:15.306347,0 days 00:00:00.664018,75.43112471735431,0.5852519598849698,0.0004254793230790719,linear,TPESampler,COMPLETE
501,0.30941381106235205,2025-04-24 21:07:15.487303,2025-04-24 21:07:15.995178,0 days 00:00:00.507875,12.122395107952048,0.041254546181362504,0.026003111569940476,rbf,TPESampler,COMPLETE
502,0.29872328817213034,2025-04-24 21:07:16.181411,2025-04-24 21:07:16.713672,0 days 00:00:00.532261,27.08385579503343,0.0120235624519053,0.08103723862464816,rbf,TPESampler,COMPLETE
503,0.29821711030274156,2025-04-24 21:07:16.892663,2025-04-24 21:07:17.430252,0 days 00:00:00.537589,96.55732757509733,0.03448833392391465,0.04409168183591547,rbf,TPESampler,COMPLETE
504,0.31928666964211616,2025-04-24 21:07:17.611688,2025-04-24 21:07:18.313918,0 days 00:00:00.702230,75.48087240032189,0.037613021079925375,0.003820663620504769,rbf,TPESampler,COMPLETE
505,48.03094637909462,2025-04-24 21:07:18.486873,2025-04-24 21:07:18.980816,0 days 00:00:00.493943,15.029148533396297,0.013178085997226459,0.017679107715400454,sigmoid,TPESampler,COMPLETE
506,0.294153058190599,2025-04-24 21:07:19.159673,2025-04-24 21:07:19.819235,0 days 00:00:00.659562,93.25541283657746,0.057108114226671114,0.007220347751857604,rbf,TPESampler,COMPLETE
507,0.3095302855028713,2025-04-24 21:07:19.994536,2025-04-24 21:07:20.503478,0 days 00:00:00.508942,25.954492151790582,0.012362191760623703,0.020285326715793358,rbf,TPESampler,COMPLETE
508,0.892600367086091,2025-04-24 21:07:20.686567,2025-04-24 21:07:54.099097,0 days 00:00:33.412530,83.12228922195783,0.011094384120666344,0.07259586779660518,poly,TPESampler,COMPLETE
509,0.2918936631816253,2025-04-24 21:07:54.332905,2025-04-24 21:07:55.003603,0 days 00:00:00.670698,79.09999288479379,0.05882470320373701,0.017262752956589054,rbf,TPESampler,COMPLETE
510,0.3019360535062313,2025-04-24 21:07:55.361955,2025-04-24 21:07:56.276722,0 days 00:00:00.914767,91.88064998947138,0.0276036297637142,0.049976669474892856,rbf,TPESampler,COMPLETE
511,0.3627779008615332,2025-04-24 21:07:56.465752,2025-04-24 21:07:58.188212,0 days 00:00:01.722460,16.04739550727559,0.028052441578124226,0.009262786686785339,linear,TPESampler,COMPLETE
512,0.30506276097394236,2025-04-24 21:07:58.380928,2025-04-24 21:07:58.938729,0 days 00:00:00.557801,92.01037190628786,0.016845329646389254,0.008670457166005991,rbf,TPESampler,COMPLETE
513,0.2817063423405535,2025-04-24 21:07:59.115859,2025-04-24 21:07:59.694455,0 days 00:00:00.578596,98.2868557071727,0.02892298011059792,0.025638675311412423,rbf,TPESampler,COMPLETE
514,0.2990143796010484,2025-04-24 21:07:59.887288,2025-04-24 21:08:00.429446,0 days 00:00:00.542158,24.587917631257557,0.07672514711502136,0.03367590529928152,rbf,TPESampler,COMPLETE
515,0.284130958421548,2025-04-24 21:08:00.639559,2025-04-24 21:08:01.173886,0 days 00:00:00.534327,97.1766299438298,0.06414772428159903,0.019473930393716827,rbf,TPESampler,COMPLETE
516,0.29404382557571046,2025-04-24 21:08:01.358134,2025-04-24 21:08:01.875631,0 days 00:00:00.517497,10.522788291551212,0.02861554966417384,0.1457432610436749,rbf,TPESampler,COMPLETE
517,0.8707880392179286,2025-04-24 21:08:02.071126,2025-04-24 21:08:04.336453,0 days 00:00:02.265327,54.967175659161754,0.07345896627882441,0.10965127612941093,poly,TPESampler,COMPLETE
518,0.28316300086452384,2025-04-24 21:08:04.514272,2025-04-24 21:08:05.113253,0 days 00:00:00.598981,99.41201722138527,0.021977004626044183,0.03152921857074458,rbf,TPESampler,COMPLETE
519,0.3034526058461128,2025-04-24 21:08:05.296139,2025-04-24 21:08:05.837464,0 days 00:00:00.541325,17.237178214067924,0.055842842695372236,0.03554185260683234,rbf,TPESampler,COMPLETE
520,0.2865892782567135,2025-04-24 21:08:06.038130,2025-04-24 21:08:06.789206,0 days 00:00:00.751076,93.35301016555646,0.030469839940333594,0.036609891875273574,rbf,TPESampler,COMPLETE
521,0.3097137515721301,2025-04-24 21:08:07.209778,2025-04-24 21:08:07.729351,0 days 00:00:00.519573,16.43944726446439,0.013596872264710819,0.02478891025016623,rbf,TPESampler,COMPLETE
522,0.294187246135731,2025-04-24 21:08:07.929369,2025-04-24 21:08:08.477467,0 days 00:00:00.548098,89.0534351911116,0.0346799951664375,0.042338866469235355,rbf,TPESampler,COMPLETE
523,0.3189837599372129,2025-04-24 21:08:08.646184,2025-04-24 21:08:09.178533,0 days 00:00:00.532349,99.83410995610272,0.010315143776564254,0.12311271501919925,rbf,TPESampler,COMPLETE
524,0.9965142163393771,2025-04-24 21:08:09.365010,2025-04-24 21:08:09.835393,0 days 00:00:00.470383,0.023701396144308082,0.09468811938383702,0.00013399654656989668,sigmoid,TPESampler,COMPLETE
525,0.3230336504924809,2025-04-24 21:08:10.025154,2025-04-24 21:08:10.518948,0 days 00:00:00.493794,21.194075941870288,0.07959476885719625,0.2340210639201793,rbf,TPESampler,COMPLETE
526,0.3060128035205572,2025-04-24 21:08:10.698884,2025-04-24 21:08:11.243646,0 days 00:00:00.544762,95.90813269428236,0.014798945530173297,0.0057122986713048,rbf,TPESampler,COMPLETE
527,0.31258811049651447,2025-04-24 21:08:11.430480,2025-04-24 21:08:11.969142,0 days 00:00:00.538662,8.565159028967141,0.02290129029297788,0.027724992719094375,rbf,TPESampler,COMPLETE
528,0.3036076327507477,2025-04-24 21:08:12.146716,2025-04-24 21:08:12.643582,0 days 00:00:00.496866,16.22544462391848,0.06777021586864808,0.02326419331230705,rbf,TPESampler,COMPLETE
529,39.24846273734226,2025-04-24 21:08:12.826840,2025-04-24 21:08:13.340850,0 days 00:00:00.514010,46.98916808883696,0.13137974223263993,0.007999391865030334,sigmoid,TPESampler,COMPLETE
530,0.29236667312421016,2025-04-24 21:08:13.509265,2025-04-24 21:08:14.079802,0 days 00:00:00.570537,92.5494942291105,0.038127411120473714,0.013978703220325097,rbf,TPESampler,COMPLETE
531,0.28874344917083744,2025-04-24 21:08:14.302219,2025-04-24 21:08:14.859082,0 days 00:00:00.556863,98.4607632456065,0.011639731613268395,0.03868437818273115,rbf,TPESampler,COMPLETE
532,0.3071137257850035,2025-04-24 21:08:15.040960,2025-04-24 21:08:15.572536,0 days 00:00:00.531576,98.33872450250355,0.020325014245619995,0.06992562037713272,rbf,TPESampler,COMPLETE
533,0.37252734409942406,2025-04-24 21:08:15.771682,2025-04-24 21:08:16.307866,0 days 00:00:00.536184,13.028660196828376,0.041033358525110086,0.009451273821223145,rbf,TPESampler,COMPLETE
534,0.4742905487326085,2025-04-24 21:08:16.522655,2025-04-24 21:08:16.989450,0 days 00:00:00.466795,1.2259114289645714,0.46751879308555694,0.11172158961860623,rbf,TPESampler,COMPLETE
535,0.6748731446708817,2025-04-24 21:08:17.172743,2025-04-24 21:08:17.741354,0 days 00:00:00.568611,0.37487200577258956,0.057863485139406805,0.0067660478134364535,sigmoid,TPESampler,COMPLETE
536,0.3105242495387305,2025-04-24 21:08:18.025660,2025-04-24 21:08:18.569478,0 days 00:00:00.543818,15.265423448737241,0.018187233289080534,0.03355785771799824,rbf,TPESampler,COMPLETE
537,0.8750202575874678,2025-04-24 21:08:18.752976,2025-04-24 21:08:19.258358,0 days 00:00:00.505382,0.2733976871868959,0.0013501353011425115,0.004515441316766396,poly,TPESampler,COMPLETE
538,0.2939540919799377,2025-04-24 21:08:19.520403,2025-04-24 21:08:20.048806,0 days 00:00:00.528403,78.49151506036988,0.1724892126746897,0.11284967268299495,rbf,TPESampler,COMPLETE
539,0.28626567060312574,2025-04-24 21:08:20.260150,2025-04-24 21:08:20.856888,0 days 00:00:00.596738,98.62309500219101,0.024059734870988114,0.01882660349540251,rbf,TPESampler,COMPLETE
540,0.2824931123431894,2025-04-24 21:08:21.067263,2025-04-24 21:08:21.635578,0 days 00:00:00.568315,93.39060959425078,0.02603498205254831,0.030579722616723273,rbf,TPESampler,COMPLETE
541,0.7005432746964811,2025-04-24 21:08:21.805895,2025-04-24 21:08:22.290313,0 days 00:00:00.484418,0.0011894057741632983,0.35111797248545845,0.07135345588905717,linear,TPESampler,COMPLETE
542,0.3036328152234237,2025-04-24 21:08:22.477625,2025-04-24 21:08:22.985789,0 days 00:00:00.508164,22.531398297761186,0.04572008540718276,0.013712022546636721,rbf,TPESampler,COMPLETE
543,0.45107600332250936,2025-04-24 21:08:23.164467,2025-04-24 21:08:23.647848,0 days 00:00:00.483381,1.0390719210457258,0.039593432636133206,0.08582813141107627,rbf,TPESampler,COMPLETE
544,0.30460514960774515,2025-04-24 21:08:23.833958,2025-04-24 21:08:24.366254,0 days 00:00:00.532296,14.661174310695475,0.023401182813026625,0.04756169528748387,rbf,TPESampler,COMPLETE
545,0.2962455867144147,2025-04-24 21:08:24.548278,2025-04-24 21:08:25.061177,0 days 00:00:00.512899,50.53644431347209,0.13266378604833093,0.04596209409006189,rbf,TPESampler,COMPLETE
546,0.30328291945303737,2025-04-24 21:08:25.243056,2025-04-24 21:08:25.762780,0 days 00:00:00.519724,24.010786086235445,0.030529417419177873,0.018621697762293866,rbf,TPESampler,COMPLETE
547,0.2895784814558048,2025-04-24 21:08:25.942448,2025-04-24 21:08:26.451565,0 days 00:00:00.509117,74.48219462949339,0.10816073441331897,0.020045236036606913,rbf,TPESampler,COMPLETE
548,0.33219257627558313,2025-04-24 21:08:26.761211,2025-04-24 21:08:27.264671,0 days 00:00:00.503460,91.54174835219642,0.026328511692247224,0.26320283986635673,rbf,TPESampler,COMPLETE
549,0.3627827585023675,2025-04-24 21:08:27.454112,2025-04-24 21:08:27.928143,0 days 00:00:00.474031,94.41869016636775,0.3616137553423509,0.0116406746692788,rbf,TPESampler,COMPLETE
550,0.28169883780520033,2025-04-24 21:08:28.107761,2025-04-24 21:08:28.673681,0 days 00:00:00.565920,90.15417188614902,0.026796050918263318,0.02495058138235583,rbf,TPESampler,COMPLETE
551,2.300668100530976,2025-04-24 21:08:28.860639,2025-04-24 21:08:29.352456,0 days 00:00:00.491817,0.2246817349112113,0.0013867303564932662,0.4477735230509301,sigmoid,TPESampler,COMPLETE
552,0.30678854276123546,2025-04-24 21:08:29.546708,2025-04-24 21:08:30.124389,0 days 00:00:00.577681,94.34634183005862,0.053094904095748484,0.054291568342714834,rbf,TPESampler,COMPLETE
553,0.5297154567961145,2025-04-24 21:08:30.338636,2025-04-24 21:08:30.824906,0 days 00:00:00.486270,14.088316891260419,0.03184987770054187,0.0020932569505992854,rbf,TPESampler,COMPLETE
554,0.3942388821929175,2025-04-24 21:08:31.006895,2025-04-24 21:08:31.501379,0 days 00:00:00.494484,15.968715413422265,0.01497569905573469,0.006019893491648603,rbf,TPESampler,COMPLETE
555,0.2864560824707587,2025-04-24 21:08:31.681029,2025-04-24 21:08:32.201197,0 days 00:00:00.520168,99.53138236345238,0.11764601857998498,0.016124043539576055,rbf,TPESampler,COMPLETE
556,0.30290890900091944,2025-04-24 21:08:32.378424,2025-04-24 21:08:32.910959,0 days 00:00:00.532535,85.97699331465832,0.045214048338363,0.07846246710336377,rbf,TPESampler,COMPLETE
557,0.3057232090804007,2025-04-24 21:08:33.091827,2025-04-24 21:08:33.600284,0 days 00:00:00.508457,18.079516057362465,0.03589604488825338,0.016986449865026444,rbf,TPESampler,COMPLETE
558,0.30421914203943545,2025-04-24 21:08:33.783937,2025-04-24 21:08:34.304669,0 days 00:00:00.520732,67.7905435208363,0.030274598968464586,0.011604157464222229,rbf,TPESampler,COMPLETE
559,0.5837591636347089,2025-04-24 21:08:34.496673,2025-04-24 21:08:34.996005,0 days 00:00:00.499332,0.034375055873866425,0.014093861892947717,0.10119243681913813,linear,TPESampler,COMPLETE
560,0.4168636349342577,2025-04-24 21:08:35.196684,2025-04-24 21:08:35.695708,0 days 00:00:00.499024,17.21933913107653,0.08929781305734996,0.004195111769292697,rbf,TPESampler,COMPLETE
561,0.2979252512413147,2025-04-24 21:08:35.877746,2025-04-24 21:08:36.385019,0 days 00:00:00.507273,81.47985485420678,0.051619430256015085,0.00695348228228371,rbf,TPESampler,COMPLETE
562,0.304595463036998,2025-04-24 21:08:36.564776,2025-04-24 21:08:37.082061,0 days 00:00:00.517285,97.45635388414168,0.03741524026980595,0.05085656802836441,rbf,TPESampler,COMPLETE
563,0.29447390483092006,2025-04-24 21:08:37.264609,2025-04-24 21:08:37.763659,0 days 00:00:00.499050,16.78406928484841,0.03067699133514795,0.12871899751110988,rbf,TPESampler,COMPLETE
564,0.36111765423742276,2025-04-24 21:08:37.951834,2025-04-24 21:08:38.958969,0 days 00:00:01.007135,5.322116495701943,0.032607770274937324,0.1257573436900969,linear,TPESampler,COMPLETE
565,0.28990987236380905,2025-04-24 21:08:39.137315,2025-04-24 21:08:39.653611,0 days 00:00:00.516296,95.3512635470546,0.07540130863833185,0.031285977211682726,rbf,TPESampler,COMPLETE
566,0.3082080884433768,2025-04-24 21:08:39.838348,2025-04-24 21:08:40.365846,0 days 00:00:00.527498,17.871480822751884,0.025043504155973787,0.027190809915833922,rbf,TPESampler,COMPLETE
567,0.5426819773829824,2025-04-24 21:08:40.549916,2025-04-24 21:08:41.055960,0 days 00:00:00.506044,0.05186678515158754,0.002183138707422978,0.18186282135008539,linear,TPESampler,COMPLETE
568,0.318414874266254,2025-04-24 21:08:41.238025,2025-04-24 21:08:41.749740,0 days 00:00:00.511715,67.30326643878341,0.016082330179532152,0.004486833059488899,rbf,TPESampler,COMPLETE
569,0.29138265124727103,2025-04-24 21:08:41.939338,2025-04-24 21:08:42.469044,0 days 00:00:00.529706,96.45417517352759,0.04278954320615392,0.013708731484852249,rbf,TPESampler,COMPLETE
570,0.29060118624543724,2025-04-24 21:08:42.641739,2025-04-24 21:08:43.198456,0 days 00:00:00.556717,91.1842897230756,0.02107933528262941,0.016081557892439348,rbf,TPESampler,COMPLETE
571,0.3080096174398616,2025-04-24 21:08:43.381618,2025-04-24 21:08:43.880999,0 days 00:00:00.499381,96.01720311353134,0.06265571073497626,0.11710269714094022,rbf,TPESampler,COMPLETE
572,0.3633118554388701,2025-04-24 21:08:44.056512,2025-04-24 21:08:53.518361,0 days 00:00:09.461849,96.1448858719053,0.030335529778166045,0.009694663410159165,linear,TPESampler,COMPLETE
573,0.29303224253663324,2025-04-24 21:08:53.703959,2025-04-24 21:08:54.213335,0 days 00:00:00.509376,16.062755166917903,0.011915144071613868,0.07090592437982095,rbf,TPESampler,COMPLETE
574,0.28340768502107777,2025-04-24 21:08:54.396074,2025-04-24 21:08:54.956050,0 days 00:00:00.559976,96.46365304908817,0.018343470398099585,0.024949660885787647,rbf,TPESampler,COMPLETE
575,125.75300242150198,2025-04-24 21:08:55.140222,2025-04-24 21:08:55.651840,0 days 00:00:00.511618,13.09199670222606,0.022959144705878773,0.23493106506359296,sigmoid,TPESampler,COMPLETE
576,0.3684215850501272,2025-04-24 21:08:55.831096,2025-04-24 21:08:56.327884,0 days 00:00:00.496788,13.027685783494412,0.019531931248302232,0.010523970975102373,rbf,TPESampler,COMPLETE
577,0.9970924424564613,2025-04-24 21:08:56.533007,2025-04-24 21:08:57.030754,0 days 00:00:00.497747,0.021956611190456523,0.002492060132455727,0.0001715594604376789,sigmoid,TPESampler,COMPLETE
578,0.29553781676494706,2025-04-24 21:08:57.227015,2025-04-24 21:08:57.810938,0 days 00:00:00.583923,89.4133675500824,0.011246019681600715,0.018824157221797158,rbf,TPESampler,COMPLETE
579,0.9866792953876343,2025-04-24 21:08:58.000595,2025-04-24 21:08:58.503179,0 days 00:00:00.502584,4.369323450475953,0.0012406577146400473,0.0007018980200072485,poly,TPESampler,COMPLETE
580,0.3433747960719176,2025-04-24 21:08:58.692320,2025-04-24 21:08:59.202123,0 days 00:00:00.509803,18.848275294772918,0.01313819332873183,0.010009973681672146,rbf,TPESampler,COMPLETE
581,0.9801041126287824,2025-04-24 21:08:59.391562,2025-04-24 21:08:59.899829,0 days 00:00:00.508267,0.021878033338183927,0.3394703616876153,0.00045834974607405815,rbf,TPESampler,COMPLETE
582,0.295637537044534,2025-04-24 21:09:00.081313,2025-04-24 21:09:00.726074,0 days 00:00:00.644761,93.06393431967564,0.014963980796037188,0.04592980493910165,rbf,TPESampler,COMPLETE
583,0.31231518692417476,2025-04-24 21:09:01.040480,2025-04-24 21:09:01.558929,0 days 00:00:00.518449,15.185631811521372,0.015245043171512302,0.0274949012945448,rbf,TPESampler,COMPLETE
584,0.9728692976603259,2025-04-24 21:09:01.752818,2025-04-24 21:09:02.239175,0 days 00:00:00.486357,0.003775021201172252,0.5922369923984137,0.0051382990020390085,poly,TPESampler,COMPLETE
585,0.30895582177228503,2025-04-24 21:09:02.428980,2025-04-24 21:09:02.948355,0 days 00:00:00.519375,78.57170507429078,0.04380235026874395,0.004896810427961261,rbf,TPESampler,COMPLETE
586,0.30418963090273804,2025-04-24 21:09:03.149710,2025-04-24 21:09:03.692633,0 days 00:00:00.542923,21.590826669926788,0.0272249752256308,0.019847312306541354,rbf,TPESampler,COMPLETE
587,0.2977557086401438,2025-04-24 21:09:03.885755,2025-04-24 21:09:04.449402,0 days 00:00:00.563647,83.73201607045881,0.033232671130106736,0.012904425529250233,rbf,TPESampler,COMPLETE
588,0.2949667693668612,2025-04-24 21:09:04.646310,2025-04-24 21:09:05.186135,0 days 00:00:00.539825,81.07334873555088,0.04095122768858617,0.042653473478069324,rbf,TPESampler,COMPLETE
