number,value,datetime_start,datetime_complete,duration,params_C,params_epsilon,params_gamma,params_kernel,system_attrs_auto:sampler,state
0,14.174756996737106,2025-04-24 20:58:59.800864,2025-04-24 20:59:00.323823,0 days 00:00:00.522959,1.6470964898894922,0.10511700612620957,0.8135211897548091,sigmoid,RandomSampler,COMPLETE
1,0.7858832109280011,2025-04-24 20:58:59.815697,2025-04-24 20:59:00.270330,0 days 00:00:00.454633,0.12043805182841273,0.09075465578614403,0.0018267863471542612,rbf,RandomSampler,COMPLETE
2,0.42973030531230655,2025-04-24 20:58:59.886905,2025-04-24 20:59:00.295491,0 days 00:00:00.408586,0.1362111626360191,0.001049278067927531,0.006337109707644735,linear,RandomSampler,COMPLETE
3,0.8611807905633957,2025-04-24 20:59:00.436005,2025-04-24 20:59:00.928394,0 days 00:00:00.492389,0.048032161223411904,0.5048221429982653,0.1720448392121025,sigmoid,TPESampler,COMPLETE
4,0.9495959625828285,2025-04-24 20:59:00.445244,2025-04-24 20:59:00.987423,0 days 00:00:00.542179,0.11089381365282636,0.20183924004775727,0.000517081641699537,sigmoid,TPESampler,COMPLETE
5,0.600478070725565,2025-04-24 20:59:00.449863,2025-04-24 20:59:01.128668,0 days 00:00:00.678805,0.18023892676190298,0.9900586488520043,0.013838610271042742,linear,TPESampler,COMPLETE
6,0.37834244822343444,2025-04-24 20:59:01.089562,2025-04-24 20:59:01.697529,0 days 00:00:00.607967,97.2568083949786,0.46956894449252506,0.08002928966591275,rbf,TPESampler,COMPLETE
7,0.9486110983226114,2025-04-24 20:59:01.177163,2025-04-24 20:59:01.695964,0 days 00:00:00.518801,0.036145235237683974,0.0016500588585415794,0.9936479834534898,sigmoid,TPESampler,COMPLETE
8,0.6571924796950384,2025-04-24 20:59:01.305533,2025-04-24 20:59:01.927752,0 days 00:00:00.622219,13.42087795794705,0.030151347150907126,0.0006532130761051877,sigmoid,TPESampler,COMPLETE
9,0.35293370620069325,2025-04-24 20:59:01.888555,2025-04-24 20:59:02.443696,0 days 00:00:00.555141,2.315043441389853,0.481040143497038,0.0005653326786561808,linear,TPESampler,COMPLETE
10,0.5431065135848214,2025-04-24 20:59:01.937769,2025-04-24 20:59:02.434260,0 days 00:00:00.496491,0.0517302315863135,0.004050271078261391,0.06640975612566499,linear,TPESampler,COMPLETE
11,3.7286546308887814,2025-04-24 20:59:02.250924,2025-04-24 20:59:02.662915,0 days 00:00:00.411991,0.40913428782388733,0.003926061047534559,0.10208414275064179,sigmoid,TPESampler,COMPLETE
12,0.369589462081328,2025-04-24 20:59:02.626580,2025-04-24 20:59:03.258097,0 days 00:00:00.631517,64.5361479284325,0.43067437239633305,0.008003999156740696,rbf,TPESampler,COMPLETE
13,0.3697719042392573,2025-04-24 20:59:02.655977,2025-04-24 20:59:03.263125,0 days 00:00:00.607148,11.096892597718428,0.390621375972813,0.0006836502524690376,linear,TPESampler,COMPLETE
14,0.2942218302273165,2025-04-24 20:59:02.925796,2025-04-24 20:59:03.467970,0 days 00:00:00.542174,7.318078604666204,0.031823854649136916,0.12658788589506356,rbf,TPESampler,COMPLETE
15,0.3464618748589106,2025-04-24 20:59:03.428618,2025-04-24 20:59:04.109161,0 days 00:00:00.680543,29.49684792570118,0.017276857055994084,0.30236398432616385,rbf,TPESampler,COMPLETE
16,0.7479589315658312,2025-04-24 20:59:03.539109,2025-04-24 20:59:04.227592,0 days 00:00:00.688483,90.6006840719343,0.027753027102950485,0.008872737636648302,poly,TPESampler,COMPLETE
17,0.587858282975104,2025-04-24 20:59:03.670674,2025-04-24 20:59:04.321193,0 days 00:00:00.650519,0.27895109793230694,0.02701396133623498,0.06395266187478928,rbf,TPESampler,COMPLETE
18,0.3110718458918839,2025-04-24 20:59:04.292022,2025-04-24 20:59:04.839353,0 days 00:00:00.547331,26.89569893112846,0.0038766492661553476,0.17686528635837104,rbf,TPESampler,COMPLETE
19,1.3156210967572293,2025-04-24 20:59:04.415327,2025-04-24 22:00:02.547265,0 days 01:00:58.131938,78.76174549513647,0.008244157551624075,0.5014487591580301,poly,TPESampler,COMPLETE
20,0.3124469978053381,2025-04-24 20:59:04.729633,2025-04-24 20:59:05.286649,0 days 00:00:00.557016,16.654109154364782,0.002647525963805147,0.02458156891135231,rbf,TPESampler,COMPLETE
21,622.3712305333015,2025-04-24 20:59:05.029344,2025-04-24 20:59:05.604695,0 days 00:00:00.575351,85.54225222254355,0.0017663787022313237,0.04178256467991872,sigmoid,TPESampler,COMPLETE
22,0.31641064696116133,2025-04-24 20:59:05.538503,2025-04-24 20:59:06.165174,0 days 00:00:00.626671,8.765419319976084,0.002626477267506016,0.03439793435164529,rbf,TPESampler,COMPLETE
23,0.36426781103729017,2025-04-24 20:59:05.883771,2025-04-24 20:59:08.064910,0 days 00:00:02.181139,27.156512334774035,0.017319474376558543,0.026455336660109137,linear,TPESampler,COMPLETE
24,0.4728889529456186,2025-04-24 20:59:06.497897,2025-04-24 20:59:06.959059,0 days 00:00:00.461162,3.1566346711445883,0.0012784206818632327,0.6112571784088531,rbf,TPESampler,COMPLETE
25,0.36728611052411775,2025-04-24 20:59:07.128855,2025-04-24 20:59:13.719952,0 days 00:00:06.591097,88.57653459494793,0.0011176922471243485,0.7569062469056914,linear,TPESampler,COMPLETE
26,0.6709178393034294,2025-04-24 20:59:08.227674,2025-04-24 20:59:08.657566,0 days 00:00:00.429892,1.3724759009155265,0.005443617026751717,0.0026710652500167636,rbf,TPESampler,COMPLETE
27,0.3076806548061951,2025-04-24 20:59:08.815635,2025-04-24 20:59:09.263216,0 days 00:00:00.447581,50.7379456175405,0.00557723204335659,0.00932347873089435,rbf,TPESampler,COMPLETE
28,0.3204912463658254,2025-04-24 20:59:09.430361,2025-04-24 20:59:09.892425,0 days 00:00:00.462064,5.621371381417771,0.11245975702825563,0.07277696932391603,rbf,TPESampler,COMPLETE
29,0.48402638268469833,2025-04-24 20:59:10.060423,2025-04-24 20:59:10.480344,0 days 00:00:00.419921,72.0736669796415,0.005229394911791172,0.0005947841372213058,rbf,TPESampler,COMPLETE
30,0.8799879707857283,2025-04-24 20:59:10.635305,2025-04-24 20:59:11.320559,0 days 00:00:00.685254,0.7021064047378093,0.05046720192583861,0.10223673453678514,poly,TPESampler,COMPLETE
31,0.973590623004948,2025-04-24 20:59:11.480726,2025-04-24 20:59:11.945028,0 days 00:00:00.464302,0.002921444036155133,0.0010179238518482367,0.008861197206542618,rbf,TPESampler,COMPLETE
32,0.3599919415274943,2025-04-24 20:59:12.104964,2025-04-24 20:59:12.628030,0 days 00:00:00.523066,1.6827617925955338,0.04582610319694448,0.7413225376703699,linear,TPESampler,COMPLETE
33,0.30319033714137106,2025-04-24 20:59:12.781614,2025-04-24 20:59:13.255712,0 days 00:00:00.474098,48.98078489291466,0.004920129420254892,0.019167554313703768,rbf,TPESampler,COMPLETE
34,0.3031388153190781,2025-04-24 20:59:13.415343,2025-04-24 20:59:13.920809,0 days 00:00:00.505466,31.761545391477334,0.014558774961716038,0.022085679842155294,rbf,TPESampler,COMPLETE
35,0.28911666089588844,2025-04-24 20:59:13.880467,2025-04-24 20:59:14.479656,0 days 00:00:00.599189,98.66146916521016,0.007715417166323405,0.02506588710422558,rbf,TPESampler,COMPLETE
36,29.892096669183573,2025-04-24 20:59:14.092758,2025-04-24 20:59:14.607060,0 days 00:00:00.514302,6.288881353312009,0.08109633152049572,0.025547644351467683,sigmoid,TPESampler,COMPLETE
37,0.3757783760753189,2025-04-24 20:59:14.653965,2025-04-24 20:59:15.448372,0 days 00:00:00.794407,30.776445837386703,0.02694292728231693,0.0043524344917050305,rbf,TPESampler,COMPLETE
38,0.2894246315791451,2025-04-24 20:59:14.776919,2025-04-24 20:59:15.653934,0 days 00:00:00.877015,88.87482994555972,0.011281120748006452,0.02322646307467653,rbf,TPESampler,COMPLETE
39,0.29618884724300815,2025-04-24 20:59:15.623498,2025-04-24 20:59:16.113444,0 days 00:00:00.489946,30.140931555994136,0.019681640050341828,0.07224578934117187,rbf,TPESampler,COMPLETE
40,0.29160043474862496,2025-04-24 20:59:15.839958,2025-04-24 20:59:16.335057,0 days 00:00:00.495099,83.3755918984149,0.02443512849728832,0.016165144462320417,rbf,TPESampler,COMPLETE
41,124.8807679758347,2025-04-24 20:59:16.277829,2025-04-24 20:59:16.733771,0 days 00:00:00.455942,17.059210179222056,0.6224175479576773,0.9714013631761935,sigmoid,TPESampler,COMPLETE
42,0.3006786115311979,2025-04-24 20:59:16.547258,2025-04-24 20:59:16.977910,0 days 00:00:00.430652,66.15966075842655,0.07708055595221842,0.054827915831913904,rbf,TPESampler,COMPLETE
43,0.30183653716475484,2025-04-24 20:59:16.910529,2025-04-24 20:59:17.448926,0 days 00:00:00.538397,56.52439695276593,0.01968774127132879,0.014968522176328774,rbf,TPESampler,COMPLETE
44,0.388952367725827,2025-04-24 20:59:17.139678,2025-04-24 20:59:17.653745,0 days 00:00:00.514067,0.3660647201212295,0.0031025846562111313,0.00012845227132635248,linear,TPESampler,COMPLETE
45,0.9922858233183274,2025-04-24 20:59:17.609912,2025-04-24 20:59:18.090873,0 days 00:00:00.480961,0.0030107938656284377,0.22137926057663743,0.0003017155462828727,rbf,TPESampler,COMPLETE
46,99.41603166514109,2025-04-24 20:59:17.833917,2025-04-24 20:59:18.321128,0 days 00:00:00.487211,11.418564469541863,0.014761271355231436,0.7979734708359627,sigmoid,TPESampler,COMPLETE
47,0.9997583560353345,2025-04-24 20:59:18.268649,2025-04-24 20:59:18.653781,0 days 00:00:00.385132,0.004901397536982132,0.004505065447522778,0.00010421385266025173,rbf,TPESampler,COMPLETE
48,0.3105691092441873,2025-04-24 20:59:18.518066,2025-04-24 20:59:18.981404,0 days 00:00:00.463338,91.7598316180441,0.013372459308017243,0.09104737566046428,rbf,TPESampler,COMPLETE
49,0.7026038506520865,2025-04-24 20:59:18.795903,2025-04-24 20:59:19.380388,0 days 00:00:00.584485,0.0011099173837203235,0.006257995833969504,0.0016985565454864804,linear,TPESampler,COMPLETE
50,0.29544302389000315,2025-04-24 20:59:19.202185,2025-04-24 20:59:19.868577,0 days 00:00:00.666392,5.5167166252060404,0.020345580922215802,0.13595044747279092,rbf,TPESampler,COMPLETE
51,0.9685081096981105,2025-04-24 20:59:19.549191,2025-04-24 20:59:20.087251,0 days 00:00:00.538060,0.009514338265815958,0.06299137679295083,0.004795446449639571,sigmoid,TPESampler,COMPLETE
52,0.34614159138622325,2025-04-24 20:59:20.041421,2025-04-24 20:59:20.450528,0 days 00:00:00.409107,3.227900374190679,0.026004015045530657,0.0682576818705775,rbf,TPESampler,COMPLETE
53,0.34319321888879367,2025-04-24 20:59:20.275800,2025-04-24 20:59:20.683452,0 days 00:00:00.407652,7.276426497791737,0.0178253260934607,0.2939048742450316,rbf,TPESampler,COMPLETE
54,165.7921471278105,2025-04-24 20:59:20.603652,2025-04-24 20:59:21.056893,0 days 00:00:00.453241,83.89632654293257,0.040015441028547455,0.01241296796237474,sigmoid,TPESampler,COMPLETE
55,0.31641756083337474,2025-04-24 20:59:20.880773,2025-04-24 20:59:21.297353,0 days 00:00:00.416580,9.213769508358434,0.013948846350715118,0.05071574935911528,rbf,TPESampler,COMPLETE
56,0.7580991157733822,2025-04-24 20:59:21.241476,2025-04-24 20:59:21.777421,0 days 00:00:00.535945,5.956108101583001,0.005436982334982753,0.0262631692455118,poly,TPESampler,COMPLETE
57,0.6534403765057942,2025-04-24 20:59:21.453640,2025-04-24 20:59:21.891961,0 days 00:00:00.438321,0.009485338537476,0.03345351560618088,0.5684441112579435,linear,TPESampler,COMPLETE
58,0.48357236141509347,2025-04-24 20:59:21.939300,2025-04-24 20:59:22.502380,0 days 00:00:00.563080,2.3560090091806347,0.04768574221307874,0.6021543440733219,rbf,TPESampler,COMPLETE
59,0.3139446632471799,2025-04-24 20:59:22.075068,2025-04-24 20:59:22.629322,0 days 00:00:00.554254,8.350371249643597,0.05008012326017935,0.02883572596480602,rbf,TPESampler,COMPLETE
60,0.8665605030026348,2025-04-24 20:59:22.668409,2025-04-24 20:59:23.214198,0 days 00:00:00.545789,0.12273239177105383,0.31674311724194854,0.5893522367817724,rbf,TPESampler,COMPLETE
61,0.3170480718651584,2025-04-24 20:59:22.783441,2025-04-24 20:59:23.368481,0 days 00:00:00.585040,37.01817752467347,0.02268019796532516,0.18855263102627048,rbf,TPESampler,COMPLETE
62,0.32695655727106404,2025-04-24 20:59:23.378256,2025-04-24 20:59:23.852865,0 days 00:00:00.474609,16.640130403971998,0.16773327523840625,0.20169289467477036,rbf,TPESampler,COMPLETE
63,0.29033270141841516,2025-04-24 20:59:23.534900,2025-04-24 20:59:24.060470,0 days 00:00:00.525570,80.0898580013368,0.10158387738357039,0.017101432187007867,rbf,TPESampler,COMPLETE
64,0.8783470086325305,2025-04-24 20:59:24.020046,2025-04-24 20:59:26.164644,0 days 00:00:02.144598,57.25603358952886,0.06847519254122204,0.10538871317365085,poly,TPESampler,COMPLETE
65,0.3579938296727633,2025-04-24 20:59:24.232808,2025-04-24 20:59:25.955572,0 days 00:00:01.722764,22.510855365944735,0.17048703766345774,0.018445376737790502,linear,TPESampler,COMPLETE
66,0.4353878515817875,2025-04-24 20:59:26.118564,2025-04-24 20:59:26.734733,0 days 00:00:00.616169,13.131117014358528,0.06743056131429603,0.004709415525605569,rbf,TPESampler,COMPLETE
67,0.30201221079767127,2025-04-24 20:59:26.412152,2025-04-24 20:59:27.010459,0 days 00:00:00.598307,71.13708307325305,0.12570675853602462,0.006797949337390587,rbf,TPESampler,COMPLETE
68,0.2853351411611932,2025-04-24 20:59:26.926729,2025-04-24 20:59:27.466744,0 days 00:00:00.540015,90.15771974131668,0.006934133605377101,0.035729105735621026,rbf,TPESampler,COMPLETE
69,293.1591629415301,2025-04-24 20:59:27.184219,2025-04-24 20:59:27.633102,0 days 00:00:00.448883,38.2752463110676,0.007611955790782755,0.049284276780360715,sigmoid,TPESampler,COMPLETE
70,0.9831483295633308,2025-04-24 20:59:27.640816,2025-04-24 20:59:28.069643,0 days 00:00:00.428827,0.0016140967676806458,0.041125130405761115,0.035712497737096796,rbf,TPESampler,COMPLETE
71,0.3055862382767779,2025-04-24 20:59:27.802276,2025-04-24 20:59:28.355322,0 days 00:00:00.553046,70.75874469713801,0.014693002201475569,0.006616668942993379,rbf,TPESampler,COMPLETE
72,0.3328364381669343,2025-04-24 20:59:28.267802,2025-04-24 20:59:28.788067,0 days 00:00:00.520265,96.21736546999637,0.0027652636504831127,0.258824355737096,rbf,TPESampler,COMPLETE
73,0.7463214571497522,2025-04-24 20:59:28.540097,2025-04-24 20:59:29.111151,0 days 00:00:00.571054,2.9906271443682955,0.0010225223796895477,0.00017472168839974318,sigmoid,TPESampler,COMPLETE
74,0.3639161319044878,2025-04-24 20:59:29.048833,2025-04-24 20:59:29.686909,0 days 00:00:00.638076,1.90862829124099,0.008934805012030702,0.026265700959208788,linear,TPESampler,COMPLETE
75,0.8639866899588052,2025-04-24 20:59:29.287860,2025-04-24 20:59:29.790151,0 days 00:00:00.502291,46.886525489765894,0.0032859745939385963,0.0016744819999409473,poly,TPESampler,COMPLETE
76,0.290389567784519,2025-04-24 20:59:29.881992,2025-04-24 20:59:30.608566,0 days 00:00:00.726574,38.319058582304955,0.0051999942561703465,0.03488554448313264,rbf,TPESampler,COMPLETE
77,0.7238961905907422,2025-04-24 20:59:29.980256,2025-04-24 20:59:30.766479,0 days 00:00:00.786223,0.37123996364557077,0.6822158012570338,0.0012877802215218112,rbf,TPESampler,COMPLETE
78,0.36516285427580814,2025-04-24 20:59:30.821228,2025-04-24 20:59:48.727839,0 days 00:00:17.906611,93.55027386432076,0.014630159643767023,0.09155396370737465,linear,TPESampler,COMPLETE
79,0.36675420831983063,2025-04-24 20:59:30.975587,2025-04-24 20:59:38.556242,0 days 00:00:07.580655,70.36913516183286,0.002353750210329951,0.03863319853254683,linear,TPESampler,COMPLETE
80,0.2875589645211174,2025-04-24 20:59:38.717670,2025-04-24 20:59:39.255801,0 days 00:00:00.538131,93.8570493031213,0.0029019600349675817,0.028978893461809915,rbf,TPESampler,COMPLETE
81,0.30851227539219184,2025-04-24 20:59:39.418979,2025-04-24 20:59:39.885426,0 days 00:00:00.466447,44.09737978701709,0.006563807319089921,0.009203179871599673,rbf,TPESampler,COMPLETE
82,0.30569511964720075,2025-04-24 20:59:40.044059,2025-04-24 20:59:40.522730,0 days 00:00:00.478671,28.85879783588418,0.0011604360367663121,0.023639676440318023,rbf,TPESampler,COMPLETE
83,0.9997318743245265,2025-04-24 20:59:40.690215,2025-04-24 20:59:41.145975,0 days 00:00:00.455760,0.018734387579625648,0.046503249600152737,0.00024244127862562602,poly,TPESampler,COMPLETE
84,0.2982979588101516,2025-04-24 20:59:41.306860,2025-04-24 20:59:41.812940,0 days 00:00:00.506080,44.152290772681056,0.0034509941023085286,0.06185847666733413,rbf,TPESampler,COMPLETE
85,0.8225844391029311,2025-04-24 20:59:41.981197,2025-04-24 20:59:42.435390,0 days 00:00:00.454193,0.03374407634111975,0.001022153021958571,0.011260166540157992,sigmoid,TPESampler,COMPLETE
86,0.2962194416670268,2025-04-24 20:59:42.599633,2025-04-24 20:59:43.104164,0 days 00:00:00.504531,86.30919561491451,0.004901330553358494,0.04792683890655863,rbf,TPESampler,COMPLETE
87,0.2832846097247946,2025-04-24 20:59:43.270379,2025-04-24 20:59:43.764150,0 days 00:00:00.493771,68.98742706499384,0.020141232139552927,0.030360872612862425,rbf,TPESampler,COMPLETE
88,0.959047118914155,2025-04-24 20:59:43.928433,2025-04-24 20:59:44.378354,0 days 00:00:00.449921,2.2023501704629114,0.05128472190598669,0.0012926453466283704,poly,TPESampler,COMPLETE
89,0.3016782270352652,2025-04-24 20:59:44.532873,2025-04-24 20:59:44.999756,0 days 00:00:00.466883,45.41178358965644,0.00936979400324348,0.020719388938276836,rbf,TPESampler,COMPLETE
90,0.7782904933784063,2025-04-24 20:59:45.166469,2025-04-24 20:59:45.615094,0 days 00:00:00.448625,0.004004740849095852,0.686316887769571,0.20512627447229037,poly,TPESampler,COMPLETE
91,0.9004216356995937,2025-04-24 20:59:45.771923,2025-04-24 20:59:53.835007,0 days 00:00:08.063084,60.30931873502159,0.010840751844343155,0.04555654700841308,poly,TPESampler,COMPLETE
92,0.2898852619221504,2025-04-24 20:59:48.889058,2025-04-24 20:59:49.415853,0 days 00:00:00.526795,76.52358113598113,0.02554141303786587,0.01905705933176169,rbf,TPESampler,COMPLETE
93,0.28320035175618286,2025-04-24 20:59:49.590128,2025-04-24 20:59:50.060305,0 days 00:00:00.470177,90.71454710950891,0.05050082892441494,0.024683048060256802,rbf,TPESampler,COMPLETE
94,0.2889358944493621,2025-04-24 20:59:50.213903,2025-04-24 20:59:50.639930,0 days 00:00:00.426027,60.806044532742625,0.06889867173277099,0.024099359404164904,rbf,TPESampler,COMPLETE
95,0.2943532148622287,2025-04-24 20:59:50.793184,2025-04-24 20:59:51.243378,0 days 00:00:00.450194,85.47497528632275,0.07410291287331586,0.014290718309687814,rbf,TPESampler,COMPLETE
96,0.33492110155323257,2025-04-24 20:59:51.397858,2025-04-24 20:59:51.819408,0 days 00:00:00.421550,67.35348143910933,0.2680692795828926,0.027289059938650377,rbf,TPESampler,COMPLETE
97,0.9433902470900385,2025-04-24 20:59:51.975571,2025-04-24 20:59:53.498491,0 days 00:00:01.522920,0.005497891720130528,0.00468957899295165,0.7365312426861396,poly,TPESampler,COMPLETE
98,0.295769294446904,2025-04-24 20:59:53.659018,2025-04-24 20:59:54.139929,0 days 00:00:00.480911,44.29671547019719,0.06701763483339063,0.023745837434302856,rbf,TPESampler,COMPLETE
99,0.3065880563456524,2025-04-24 20:59:54.014251,2025-04-24 20:59:54.519577,0 days 00:00:00.505326,98.49917080888872,0.022432318551118477,0.07534417438772431,rbf,TPESampler,COMPLETE
100,0.9372536790713375,2025-04-24 20:59:54.299901,2025-04-24 20:59:56.615404,0 days 00:00:02.315503,80.94841239571142,0.0013161502747998843,0.03353253220847528,poly,TPESampler,COMPLETE
101,0.41560152482887414,2025-04-24 20:59:54.700536,2025-04-24 20:59:55.184052,0 days 00:00:00.483516,65.22155633664268,0.001045738641005681,0.0011902615106596601,rbf,TPESampler,COMPLETE
102,0.555620233974354,2025-04-24 20:59:55.350917,2025-04-24 20:59:55.772841,0 days 00:00:00.421924,64.35733660674161,0.6433668182053515,0.0007605425401558474,sigmoid,TPESampler,COMPLETE
103,0.3030651350947285,2025-04-24 20:59:55.929915,2025-04-24 20:59:56.416178,0 days 00:00:00.486263,94.93473592683817,0.022239067661540653,0.008169782456954704,rbf,TPESampler,COMPLETE
104,0.3014450746744557,2025-04-24 20:59:56.581707,2025-04-24 20:59:57.073945,0 days 00:00:00.492238,24.173200228967737,0.037933001358291266,0.01807970524037844,rbf,TPESampler,COMPLETE
105,0.28777462473942256,2025-04-24 20:59:56.815448,2025-04-24 20:59:57.377455,0 days 00:00:00.562007,71.02690250150027,0.011352873335929952,0.042274760742099515,rbf,TPESampler,COMPLETE
106,0.7998046592216664,2025-04-24 20:59:57.244444,2025-04-24 20:59:57.724680,0 days 00:00:00.480236,2.1064269088446013,0.4495186971379123,0.028092170087442393,poly,TPESampler,COMPLETE
107,900.3867016239689,2025-04-24 20:59:57.584333,2025-04-24 20:59:58.068599,0 days 00:00:00.484266,94.9409545053541,0.07250552292631687,0.19579822629076668,sigmoid,TPESampler,COMPLETE
108,0.2841034352174468,2025-04-24 20:59:57.870493,2025-04-24 20:59:58.412744,0 days 00:00:00.542251,60.82543652130159,0.013918849066812441,0.03893520467287666,rbf,TPESampler,COMPLETE
109,0.36676758999103665,2025-04-24 20:59:58.231129,2025-04-24 21:00:03.832952,0 days 00:00:05.601823,65.86692064714565,0.004042780975114467,0.0016974742615763132,linear,TPESampler,COMPLETE
110,15.3032742124944,2025-04-24 20:59:58.593046,2025-04-24 20:59:59.072997,0 days 00:00:00.479951,79.91426469644563,0.0024414821151977155,0.0043751517994665414,sigmoid,TPESampler,COMPLETE
111,0.471710876414808,2025-04-24 20:59:59.231328,2025-04-24 20:59:59.662858,0 days 00:00:00.431530,0.08974054218777315,0.22007105396551221,0.0001363278259908088,linear,TPESampler,COMPLETE
112,0.3061298692899708,2025-04-24 20:59:59.839100,2025-04-24 21:00:00.635395,0 days 00:00:00.796295,67.33530009368458,0.017923639043483472,0.0641834413784551,rbf,TPESampler,COMPLETE
113,0.3083849862456562,2025-04-24 21:00:00.806830,2025-04-24 21:00:01.269940,0 days 00:00:00.463110,85.59624749400555,0.002419070325436074,0.006369088115594277,rbf,TPESampler,COMPLETE
114,0.36016794423597825,2025-04-24 21:00:01.428695,2025-04-24 21:00:02.285001,0 days 00:00:00.856306,4.855488527010119,0.041475085721058236,0.00018100202090362298,linear,TPESampler,COMPLETE
115,0.28874413018462247,2025-04-24 21:00:02.454013,2025-04-24 21:00:02.959310,0 days 00:00:00.505297,44.1277727479694,0.007384318997598544,0.03318134747747755,rbf,TPESampler,COMPLETE
116,0.29974916229103876,2025-04-24 21:00:03.127613,2025-04-24 21:00:03.637504,0 days 00:00:00.509891,83.43719494642129,0.008200984483081132,0.018680782287507323,rbf,TPESampler,COMPLETE
