number,value,datetime_start,datetime_complete,duration,params_C,params_epsilon,params_gamma,params_kernel,system_attrs_auto:sampler,state
2240,0.2962848756002571,2025-04-24 21:33:42.444126,2025-04-24 21:33:43.011267,0 days 00:00:00.567141,96.4507284742255,0.031038683897250265,0.043574689713423244,rbf,TPESampler,COMPLETE
2241,0.3625870626009619,2025-04-24 21:33:43.198254,2025-04-24 21:33:44.931874,0 days 00:00:01.733620,14.410780884792368,0.01238136854854905,0.0031213998137756154,linear,TPESampler,COMPLETE
2242,0.35288629143486616,2025-04-24 21:33:44.742906,2025-04-24 21:33:45.246432,0 days 00:00:00.503526,4.631020222919172,0.028967715636152927,0.03478259981708063,rbf,TPESampler,COMPLETE
2243,95.06263025678908,2025-04-24 21:33:45.173307,2025-04-24 21:33:45.686276,0 days 00:00:00.512969,11.644881329523143,0.02888063616335645,0.05549191724797358,sigmoid,TPESampler,COMPLETE
2244,0.3024323901836575,2025-04-24 21:33:45.481171,2025-04-24 21:33:45.992155,0 days 00:00:00.510984,20.898565367428095,0.04887020307007143,0.032698858984702976,rbf,TPESampler,COMPLETE
2245,0.940218404150262,2025-04-24 21:33:45.919770,2025-04-24 21:37:02.655772,0 days 00:03:16.736002,77.27165838372211,0.006977631161327769,0.15626204348539122,poly,TPESampler,COMPLETE
2246,0.39838914856858754,2025-04-24 21:33:46.220744,2025-04-24 21:33:46.786927,0 days 00:00:00.566183,26.15297161149532,0.02610467262592731,0.003786895569093393,rbf,TPESampler,COMPLETE
2247,0.3065639308676781,2025-04-24 21:33:46.982886,2025-04-24 21:33:47.537138,0 days 00:00:00.554252,28.362691244598587,0.015386042252752674,0.01838127770880611,rbf,TPESampler,COMPLETE
2248,0.2994935529625498,2025-04-24 21:33:47.740977,2025-04-24 21:33:48.286868,0 days 00:00:00.545891,23.369839244443043,0.025917054972052662,0.03367311240471952,rbf,TPESampler,COMPLETE
2249,0.3053049574291194,2025-04-24 21:33:48.476233,2025-04-24 21:33:48.998557,0 days 00:00:00.522324,20.340575180796765,0.03653142656079553,0.016636450297119895,rbf,TPESampler,COMPLETE
2250,0.2920541693127764,2025-04-24 21:33:49.190120,2025-04-24 21:33:49.712674,0 days 00:00:00.522554,19.954819889488817,0.027442330322014274,0.067697943440766,rbf,TPESampler,COMPLETE
2251,0.2986412297437326,2025-04-24 21:33:49.901424,2025-04-24 21:33:50.427981,0 days 00:00:00.526557,20.819230941241496,0.01136088963209994,0.0416179643504968,rbf,TPESampler,COMPLETE
2252,0.2879478621729509,2025-04-24 21:33:50.611213,2025-04-24 21:33:51.185079,0 days 00:00:00.573866,92.1232750643873,0.03255264123505568,0.01724682762974127,rbf,TPESampler,COMPLETE
2253,0.2945167247676686,2025-04-24 21:33:51.371094,2025-04-24 21:33:51.938433,0 days 00:00:00.567339,84.71656702483317,0.01838464484621323,0.04647192880620063,rbf,TPESampler,COMPLETE
2254,0.29521384542147716,2025-04-24 21:33:52.126483,2025-04-24 21:33:52.760109,0 days 00:00:00.633626,93.50328299230192,0.00691322204485938,0.045781910099538074,rbf,TPESampler,COMPLETE
2255,9.891401090093654,2025-04-24 21:33:53.108366,2025-04-24 21:33:53.663201,0 days 00:00:00.554835,93.13896122853261,0.41352308411305955,0.0035900028955230573,sigmoid,TPESampler,COMPLETE
2256,0.2966276840871737,2025-04-24 21:33:53.866315,2025-04-24 21:33:54.443954,0 days 00:00:00.577639,93.50941790298437,0.05310213067787139,0.008490021492055182,rbf,TPESampler,COMPLETE
2257,0.8723727316840456,2025-04-24 21:33:54.634582,2025-04-24 21:34:51.961085,0 days 00:00:57.326503,80.84870870361193,0.021444265914185596,0.06453148117235409,poly,TPESampler,COMPLETE
2258,0.2867563496246022,2025-04-24 21:34:52.146107,2025-04-24 21:34:52.746635,0 days 00:00:00.600528,98.79764064529928,0.02397873717987879,0.01827867892850053,rbf,TPESampler,COMPLETE
2259,0.29531168885630854,2025-04-24 21:34:52.937403,2025-04-24 21:34:53.532491,0 days 00:00:00.595088,95.3237310772397,0.025184869694218705,0.013371335336497937,rbf,TPESampler,COMPLETE
2260,0.28309261551130815,2025-04-24 21:34:53.721695,2025-04-24 21:34:54.304308,0 days 00:00:00.582613,91.2509080726092,0.025168086190815786,0.022697904731552164,rbf,TPESampler,COMPLETE
2261,0.3629038593990569,2025-04-24 21:34:54.494393,2025-04-24 21:34:56.287981,0 days 00:00:01.793588,16.3436576482739,0.018004970791628584,0.023499059227299723,linear,TPESampler,COMPLETE
2262,0.42132085384812507,2025-04-24 21:34:56.468197,2025-04-24 21:34:57.212287,0 days 00:00:00.744090,20.581712953226106,0.06857867028825824,0.0033468564074246193,rbf,TPESampler,COMPLETE
2263,0.32991243561669314,2025-04-24 21:34:57.400477,2025-04-24 21:34:57.948232,0 days 00:00:00.547755,98.81993215921288,0.03910881133480636,0.25655275962967455,rbf,TPESampler,COMPLETE
2264,0.46498305417977603,2025-04-24 21:34:58.138677,2025-04-24 21:34:58.686079,0 days 00:00:00.547402,0.10228415740874505,0.0279561762050931,0.007791227433340976,linear,TPESampler,COMPLETE
2265,0.30673215296042916,2025-04-24 21:34:58.872503,2025-04-24 21:34:59.391588,0 days 00:00:00.519085,97.87704826349747,0.06036935336484899,0.10812976645434375,rbf,TPESampler,COMPLETE
2266,0.9863075311627202,2025-04-24 21:34:59.585126,2025-04-24 21:35:00.091799,0 days 00:00:00.506673,0.02637306343265137,0.40621702464027154,0.00019377654560561683,sigmoid,TPESampler,COMPLETE
2267,0.2872734121710392,2025-04-24 21:35:00.294201,2025-04-24 21:35:00.908324,0 days 00:00:00.614123,95.81224762205908,0.012414131931415077,0.023976587696519676,rbf,TPESampler,COMPLETE
2268,0.3737349588117468,2025-04-24 21:35:01.088922,2025-04-24 21:35:01.603046,0 days 00:00:00.514124,18.66645943913497,0.019751170578108778,0.00712095042585731,rbf,TPESampler,COMPLETE
2269,0.3628978590453936,2025-04-24 21:35:01.800716,2025-04-24 21:35:03.887948,0 days 00:00:02.087232,18.032474705884383,0.027777642493982173,0.07615355603530931,linear,TPESampler,COMPLETE
2270,0.9926717546576431,2025-04-24 21:35:04.107702,2025-04-24 21:35:04.626109,0 days 00:00:00.518407,0.08549691475076297,0.1423472319168839,0.0015501708132770115,poly,TPESampler,COMPLETE
2271,0.2850078916601172,2025-04-24 21:35:04.818184,2025-04-24 21:35:05.494027,0 days 00:00:00.675843,97.154410914791,0.014029477701110177,0.03418900943579899,rbf,TPESampler,COMPLETE
2272,0.3230460833132579,2025-04-24 21:35:05.689582,2025-04-24 21:35:06.292744,0 days 00:00:00.603162,96.15774264979926,0.0169840182959076,0.003214634845372306,rbf,TPESampler,COMPLETE
2273,0.3034278215772116,2025-04-24 21:35:06.479682,2025-04-24 21:35:07.077200,0 days 00:00:00.597518,96.13712404307698,0.01384322519966976,0.011155961569521557,rbf,TPESampler,COMPLETE
2274,0.31498107959760935,2025-04-24 21:35:07.281466,2025-04-24 21:35:07.842909,0 days 00:00:00.561443,20.81433218112231,0.04034630772140914,0.010751881169280164,rbf,TPESampler,COMPLETE
2275,0.301802409547341,2025-04-24 21:35:08.082212,2025-04-24 21:35:08.804528,0 days 00:00:00.722316,21.17193652214096,0.11309107940637406,0.03173106951387996,rbf,TPESampler,COMPLETE
2276,0.2972170721988657,2025-04-24 21:35:09.001294,2025-04-24 21:35:09.588530,0 days 00:00:00.587236,25.860230139074005,0.025708088951871388,0.08303366701411476,rbf,TPESampler,COMPLETE
2277,0.2963001152084117,2025-04-24 21:35:09.795233,2025-04-24 21:35:10.499059,0 days 00:00:00.703826,12.148092991046243,0.0054035066417540386,0.11878295326858443,rbf,TPESampler,COMPLETE
2278,0.2938629705273213,2025-04-24 21:35:10.768943,2025-04-24 21:35:11.325098,0 days 00:00:00.556155,27.153861722612174,0.05884814345234917,0.03992945863178458,rbf,TPESampler,COMPLETE
2279,0.9243441110214379,2025-04-24 21:35:11.526935,2025-04-24 21:35:12.032346,0 days 00:00:00.505411,0.02302034020608732,0.6288201221834461,0.0030316281732656086,sigmoid,TPESampler,COMPLETE
2280,0.28595725450327436,2025-04-24 21:35:12.221829,2025-04-24 21:35:12.769836,0 days 00:00:00.548007,98.57795152196694,0.052137898460835816,0.031073153780798182,rbf,TPESampler,COMPLETE
2281,0.3315988483136628,2025-04-24 21:35:12.961805,2025-04-24 21:35:13.505462,0 days 00:00:00.543657,5.0314907516873575,0.010721053622654183,0.042948910006605216,rbf,TPESampler,COMPLETE
2282,0.3050661913031617,2025-04-24 21:35:13.705333,2025-04-24 21:35:14.311210,0 days 00:00:00.605877,21.58959472639694,0.03515475115846406,0.013917759078038662,rbf,TPESampler,COMPLETE
2283,0.30675929082389963,2025-04-24 21:35:14.530139,2025-04-24 21:35:15.104200,0 days 00:00:00.574061,19.87197046336597,0.024747618743199053,0.01725287343416888,rbf,TPESampler,COMPLETE
2284,0.8838846461587405,2025-04-24 21:35:15.301864,2025-04-24 21:35:15.829621,0 days 00:00:00.527757,0.015544416119369932,0.03400250002913654,0.010166120509675644,rbf,TPESampler,COMPLETE
2285,0.2892884922503754,2025-04-24 21:35:16.007019,2025-04-24 21:35:16.592170,0 days 00:00:00.585151,99.68515121739865,0.01881376512838204,0.017227883901204416,rbf,TPESampler,COMPLETE
2286,0.29795277860537933,2025-04-24 21:35:16.790047,2025-04-24 21:35:17.392459,0 days 00:00:00.602412,98.10549989803317,0.01711828082214998,0.013212672749939956,rbf,TPESampler,COMPLETE
2287,0.6136901193161605,2025-04-24 21:35:17.794403,2025-04-24 21:35:18.318884,0 days 00:00:00.524481,65.69278420439326,0.3965636683118614,0.6686995644819992,rbf,TPESampler,COMPLETE
2288,0.2946082603766111,2025-04-24 21:35:18.509383,2025-04-24 21:35:19.035126,0 days 00:00:00.525743,28.01606087951166,0.05401262009636855,0.1207487901491188,rbf,TPESampler,COMPLETE
2289,0.3207572241007478,2025-04-24 21:35:19.235332,2025-04-24 21:35:19.919809,0 days 00:00:00.684477,82.68337528061792,0.022559971367707862,0.15052125130903263,rbf,TPESampler,COMPLETE
2290,0.3078944818651279,2025-04-24 21:35:20.121054,2025-04-24 21:35:20.726285,0 days 00:00:00.605231,91.72683870026206,0.004445819539319048,0.009138356435472181,rbf,TPESampler,COMPLETE
2291,0.39912256504075133,2025-04-24 21:35:20.905222,2025-04-24 21:35:21.420311,0 days 00:00:00.515089,0.27392827910748246,0.007349884021549809,0.0008536306919974632,linear,TPESampler,COMPLETE
2292,0.2837945931809792,2025-04-24 21:35:21.610767,2025-04-24 21:35:22.161837,0 days 00:00:00.551070,99.23091463780749,0.055221259860993806,0.01986302238976923,rbf,TPESampler,COMPLETE
2293,0.2885433258551978,2025-04-24 21:35:22.370182,2025-04-24 21:35:22.936510,0 days 00:00:00.566328,96.55495315119377,0.03111181348242214,0.016177075006657004,rbf,TPESampler,COMPLETE
2294,0.2992777023995241,2025-04-24 21:35:23.133975,2025-04-24 21:35:23.706186,0 days 00:00:00.572211,22.3266952429556,0.021563670722543102,0.037196429407115296,rbf,TPESampler,COMPLETE
2295,0.2986258481460856,2025-04-24 21:35:23.907004,2025-04-24 21:35:24.433384,0 days 00:00:00.526380,24.956274453420328,0.06169656198172101,0.016703007771138985,rbf,TPESampler,COMPLETE
2296,0.3056138008956232,2025-04-24 21:35:24.627409,2025-04-24 21:35:25.218412,0 days 00:00:00.591003,99.92481985249064,0.038008462022823444,0.0538685551537137,rbf,TPESampler,COMPLETE
2297,0.2824319521079379,2025-04-24 21:35:25.413798,2025-04-24 21:35:26.052917,0 days 00:00:00.639119,94.13693693827275,0.02727961251545637,0.028227191169370267,rbf,TPESampler,COMPLETE
2298,0.3047368599394637,2025-04-24 21:35:26.400392,2025-04-24 21:35:26.982437,0 days 00:00:00.582045,98.18343328600605,0.05846759016869623,0.057497321592413095,rbf,TPESampler,COMPLETE
2299,0.32487493822817914,2025-04-24 21:35:27.199107,2025-04-24 21:35:27.760676,0 days 00:00:00.561569,95.52744903549274,0.014634446548197627,0.13441345176632924,rbf,TPESampler,COMPLETE
2300,0.29202283946321045,2025-04-24 21:35:27.949299,2025-04-24 21:35:28.540890,0 days 00:00:00.591591,99.00769533360938,0.018943157420083682,0.04190426418989917,rbf,TPESampler,COMPLETE
2301,0.30882736774828484,2025-04-24 21:35:28.732176,2025-04-24 21:35:29.280638,0 days 00:00:00.548462,19.40122964147356,0.009934879729817672,0.018153951875401336,rbf,TPESampler,COMPLETE
2302,0.3717903308927942,2025-04-24 21:35:29.526133,2025-04-24 21:35:30.092781,0 days 00:00:00.566648,19.5151905927951,0.05817185694038505,0.006124276268002321,rbf,TPESampler,COMPLETE
2303,0.45807985937175993,2025-04-24 21:35:30.292365,2025-04-24 21:35:30.825492,0 days 00:00:00.533127,4.68018672113476,0.015971924291244326,0.012407593891719868,rbf,TPESampler,COMPLETE
2304,0.3130950311525187,2025-04-24 21:35:31.293943,2025-04-24 21:35:31.860110,0 days 00:00:00.566167,89.45243722154189,0.03810245154056024,0.0039836845414780225,rbf,TPESampler,COMPLETE
2305,0.3203567951698622,2025-04-24 21:35:32.078416,2025-04-24 21:35:32.650048,0 days 00:00:00.571632,97.9732221634305,0.012843769342259344,0.1795267692728365,rbf,TPESampler,COMPLETE
2306,0.361485760964806,2025-04-24 21:35:32.902200,2025-04-24 21:35:40.124030,0 days 00:00:07.221830,93.32579078000276,0.03743783211235575,0.012646130485313248,linear,TPESampler,COMPLETE
2307,0.32669598439235564,2025-04-24 21:35:40.325032,2025-04-24 21:35:40.862540,0 days 00:00:00.537508,92.02004525753824,0.1614950648176814,0.20499258246240648,rbf,TPESampler,COMPLETE
2308,0.3073777933638252,2025-04-24 21:35:41.067503,2025-04-24 21:35:41.696096,0 days 00:00:00.628593,99.79113921537473,0.021946429086214584,0.0571365108926397,rbf,TPESampler,COMPLETE
2309,0.3173948111172407,2025-04-24 21:35:41.917500,2025-04-24 21:35:42.519869,0 days 00:00:00.602369,95.33907924746154,0.21982523898382272,0.015268535423999433,rbf,TPESampler,COMPLETE
2310,0.8353827948982342,2025-04-24 21:35:42.721123,2025-04-24 21:35:43.243592,0 days 00:00:00.522469,1.34390263320318,0.7970812821523078,0.005470664578914447,poly,TPESampler,COMPLETE
2311,0.2925669482454504,2025-04-24 21:35:43.437298,2025-04-24 21:35:43.969887,0 days 00:00:00.532589,24.92812367985568,0.040361109252234,0.04450768454508199,rbf,TPESampler,COMPLETE
2312,0.28286764233626654,2025-04-24 21:35:44.165102,2025-04-24 21:35:44.810283,0 days 00:00:00.645181,97.09821319876804,0.02093912929775516,0.02722101625443779,rbf,TPESampler,COMPLETE
2313,0.714533458947345,2025-04-24 21:35:44.998035,2025-04-24 21:35:45.523075,0 days 00:00:00.525040,0.0013566064605102634,0.7322171927504048,0.0007025477680560937,linear,TPESampler,COMPLETE
2314,0.3017078932648863,2025-04-24 21:35:45.717127,2025-04-24 21:35:46.260155,0 days 00:00:00.543028,20.035929934472406,0.0881117850012157,0.02713749931400559,rbf,TPESampler,COMPLETE
2315,0.3061344598484409,2025-04-24 21:35:46.466787,2025-04-24 21:35:47.026758,0 days 00:00:00.559971,18.799855562844336,0.00875368338430108,0.032972592565572896,rbf,TPESampler,COMPLETE
2316,0.30370943592487293,2025-04-24 21:35:47.217500,2025-04-24 21:35:47.759341,0 days 00:00:00.541841,23.480722931618228,0.0972130761769095,0.009885561540157644,rbf,TPESampler,COMPLETE
2317,0.30118655920203324,2025-04-24 21:35:47.954532,2025-04-24 21:35:48.543067,0 days 00:00:00.588535,24.66396055402382,0.012794817278961543,0.03018034526262121,rbf,TPESampler,COMPLETE
2318,0.3163035154693497,2025-04-24 21:35:48.759947,2025-04-24 21:35:49.329376,0 days 00:00:00.569429,84.66930707193329,0.0026182113518252496,0.11954025080707091,rbf,TPESampler,COMPLETE
2319,0.30172086123292025,2025-04-24 21:35:49.527317,2025-04-24 21:35:50.056804,0 days 00:00:00.529487,18.42281877566576,0.05161613185901257,0.019066992246747263,rbf,TPESampler,COMPLETE
2320,0.29693870903347436,2025-04-24 21:35:50.260322,2025-04-24 21:35:50.800158,0 days 00:00:00.539836,25.89519671684914,0.05275622364120996,0.0648705667593013,rbf,TPESampler,COMPLETE
2321,0.30492266934770274,2025-04-24 21:35:51.020729,2025-04-24 21:35:51.580889,0 days 00:00:00.560160,94.97355954646594,0.04784294245648649,0.06183441497775006,rbf,TPESampler,COMPLETE
2322,0.4911517161907618,2025-04-24 21:35:51.769786,2025-04-24 21:35:52.333974,0 days 00:00:00.564188,6.10619649480741,0.020106007690477632,0.006424276194946377,rbf,TPESampler,COMPLETE
2323,0.7538972896357713,2025-04-24 21:35:52.542726,2025-04-24 21:35:53.132359,0 days 00:00:00.589633,76.47485082060317,0.026502404221790125,0.008433038754975709,poly,TPESampler,COMPLETE
2324,0.3143593327642408,2025-04-24 21:35:53.339689,2025-04-24 21:35:53.872801,0 days 00:00:00.533112,27.40536147666285,0.04655614116441848,0.20322535469053937,rbf,TPESampler,COMPLETE
2325,0.8274446114959203,2025-04-24 21:35:54.068078,2025-04-24 21:35:54.702868,0 days 00:00:00.634790,65.7545406580436,0.08286721662792007,0.019663922173794323,poly,TPESampler,COMPLETE
2326,0.2983349663484036,2025-04-24 21:35:54.896412,2025-04-24 21:35:55.505759,0 days 00:00:00.609347,99.22671967758083,0.01496207597539703,0.013675574127038131,rbf,TPESampler,COMPLETE
2327,0.2966333386044979,2025-04-24 21:35:55.703487,2025-04-24 21:35:56.266573,0 days 00:00:00.563086,17.608299850615563,0.014042427094156752,0.10372875862524485,rbf,TPESampler,COMPLETE
2328,0.32570627309716516,2025-04-24 21:35:56.465050,2025-04-24 21:35:57.016727,0 days 00:00:00.551677,31.027180397847903,0.05038196896244513,0.0067266574756949075,rbf,TPESampler,COMPLETE
2329,0.29486274292599923,2025-04-24 21:35:57.215933,2025-04-24 21:35:57.818843,0 days 00:00:00.602910,97.8914053266455,0.05316884418989215,0.011409760865101126,rbf,TPESampler,COMPLETE
2330,0.4006660860358485,2025-04-24 21:35:58.028411,2025-04-24 21:35:58.601530,0 days 00:00:00.573119,15.4170543386854,0.02275920324829381,0.005678900596402739,rbf,TPESampler,COMPLETE
2331,0.2923999326423958,2025-04-24 21:35:58.835674,2025-04-24 21:35:59.471364,0 days 00:00:00.635690,99.24944099342255,0.004509015627355964,0.04284164410507775,rbf,TPESampler,COMPLETE
2332,0.30465958482555533,2025-04-24 21:35:59.664833,2025-04-24 21:36:00.260545,0 days 00:00:00.595712,95.36626179013413,0.016676010574407225,0.051541587531402935,rbf,TPESampler,COMPLETE
2333,0.28450423425577837,2025-04-24 21:36:00.447129,2025-04-24 21:36:00.990080,0 days 00:00:00.542951,93.00228894802643,0.050337378361976964,0.020479836043456982,rbf,TPESampler,COMPLETE
2334,0.3033186000247262,2025-04-24 21:36:01.187650,2025-04-24 21:36:01.725359,0 days 00:00:00.537709,19.620595678659317,0.04842587959643337,0.03138403726081969,rbf,TPESampler,COMPLETE
2335,0.357316786428074,2025-04-24 21:36:01.929602,2025-04-24 21:36:02.485428,0 days 00:00:00.555826,25.19848689949448,0.016624295109452437,0.006716069780428221,rbf,TPESampler,COMPLETE
2336,0.2856291290092594,2025-04-24 21:36:02.686957,2025-04-24 21:36:03.301198,0 days 00:00:00.614241,97.39939068866379,0.018756845305499162,0.021044359956450195,rbf,TPESampler,COMPLETE
2337,0.2929714256518516,2025-04-24 21:36:03.500571,2025-04-24 21:36:04.069857,0 days 00:00:00.569286,96.4365923999918,0.07969615660060697,0.013554538787607411,rbf,TPESampler,COMPLETE
2338,19.608079025517114,2025-04-24 21:36:04.281119,2025-04-24 21:36:04.858860,0 days 00:00:00.577741,2.5216242530849136,0.0021355276357481034,0.9083796618391006,sigmoid,TPESampler,COMPLETE
2339,0.2945986894897295,2025-04-24 21:36:05.053645,2025-04-24 21:36:05.623285,0 days 00:00:00.569640,98.87114293982943,0.08786602549233952,0.007513621897964263,rbf,TPESampler,COMPLETE
2340,0.3950659206353708,2025-04-24 21:36:05.827346,2025-04-24 21:36:06.480770,0 days 00:00:00.653424,79.76672214287373,0.022926836471312575,0.0013883497499498122,rbf,TPESampler,COMPLETE
2341,577.4932143898212,2025-04-24 21:36:06.675930,2025-04-24 21:36:07.200729,0 days 00:00:00.524799,73.57307746896153,0.04752007517627899,0.09403654215543036,sigmoid,TPESampler,COMPLETE
2342,1.0002629366335218,2025-04-24 21:36:07.399767,2025-04-24 21:36:07.947983,0 days 00:00:00.548216,0.001296269397414414,0.03983345904080533,0.00014731011742039328,rbf,TPESampler,COMPLETE
2343,0.9466051102019197,2025-04-24 21:36:08.150438,2025-04-24 21:36:08.675202,0 days 00:00:00.524764,0.0022620645647459603,0.020097655063382885,0.014066038461505854,poly,TPESampler,COMPLETE
2344,0.29007107241144847,2025-04-24 21:36:08.928975,2025-04-24 21:36:09.787547,0 days 00:00:00.858572,23.905343584578947,0.024532353988981237,0.04707761463644981,rbf,TPESampler,COMPLETE
2345,0.30875531652528526,2025-04-24 21:36:10.103475,2025-04-24 21:36:10.870357,0 days 00:00:00.766882,94.2793347468473,0.01683062893548774,0.07724803482380146,rbf,TPESampler,COMPLETE
2346,0.2994552799007727,2025-04-24 21:36:11.065156,2025-04-24 21:36:11.863478,0 days 00:00:00.798322,26.184605343643362,0.023793523491417265,0.029044163766453905,rbf,TPESampler,COMPLETE
2347,0.494587593686291,2025-04-24 21:36:12.079800,2025-04-24 21:36:12.605929,0 days 00:00:00.526129,8.385841445637285,0.4332437544687077,0.004020441138303155,rbf,TPESampler,COMPLETE
2348,0.2977742396503851,2025-04-24 21:36:12.813365,2025-04-24 21:36:13.406981,0 days 00:00:00.593616,20.440575988835334,0.022295325969356343,0.04286657200300262,rbf,TPESampler,COMPLETE
2349,0.36947370889723563,2025-04-24 21:36:13.619695,2025-04-24 21:36:14.183763,0 days 00:00:00.564068,23.849835272993396,0.026953661481172002,0.00612893007334683,rbf,TPESampler,COMPLETE
2350,0.29311966617192786,2025-04-24 21:36:14.425367,2025-04-24 21:36:15.026766,0 days 00:00:00.601399,27.487441887027458,0.10655290990372593,0.03980721314101158,rbf,TPESampler,COMPLETE
2351,0.36298355543780547,2025-04-24 21:36:15.293130,2025-04-24 21:36:15.852863,0 days 00:00:00.559733,4.780631900050263,0.042783342637120365,0.02847609614255464,rbf,TPESampler,COMPLETE
2352,0.3142966049595859,2025-04-24 21:36:16.076051,2025-04-24 21:36:16.636774,0 days 00:00:00.560723,92.45793189404746,0.022456057852135433,0.0038893538092471206,rbf,TPESampler,COMPLETE
2353,0.3464532565735627,2025-04-24 21:36:16.842327,2025-04-24 21:36:17.403990,0 days 00:00:00.561663,97.30797121100143,0.0352781175139388,0.0020913790992141434,rbf,TPESampler,COMPLETE
2354,0.30021512268547085,2025-04-24 21:36:17.740842,2025-04-24 21:36:18.448276,0 days 00:00:00.707434,95.13216453039173,0.10761478229119223,0.03780117620032618,rbf,TPESampler,COMPLETE
2355,0.28347910828677214,2025-04-24 21:36:18.658092,2025-04-24 21:36:19.250109,0 days 00:00:00.592017,96.81214796060517,0.057524514327876926,0.022265493673775037,rbf,TPESampler,COMPLETE
2356,0.3100896491503826,2025-04-24 21:36:19.520598,2025-04-24 21:36:20.106382,0 days 00:00:00.585784,99.6828799238842,0.041078617358717796,0.11184811694093426,rbf,TPESampler,COMPLETE
2357,0.3302026526978556,2025-04-24 21:36:20.318931,2025-04-24 21:36:20.910735,0 days 00:00:00.591804,28.700957625973167,0.006041213469036757,0.007616552818726983,rbf,TPESampler,COMPLETE
