number,value,datetime_start,datetime_complete,duration,params_C,params_epsilon,params_gamma,params_kernel,system_attrs_auto:sampler,state
353,0.7280117731768989,2025-04-24 21:02:43.256699,2025-04-24 21:02:43.724512,0 days 00:00:00.467813,2.3208604470697773,0.14962602432640484,0.00027476493635231577,sigmoid,TPESampler,COMPLETE
354,0.3058208178735263,2025-04-24 21:02:43.915801,2025-04-24 21:02:44.465967,0 days 00:00:00.550166,76.21998130457996,0.015296105025773632,0.007315657013427145,rbf,TPESampler,COMPLETE
355,508.53207001611406,2025-04-24 21:02:44.647506,2025-04-24 21:02:45.159800,0 days 00:00:00.512294,86.78583174971023,0.04461451324545354,0.029359687728741608,sigmoid,TPESampler,COMPLETE
356,16.88366051599164,2025-04-24 21:02:45.358609,2025-04-24 21:10:40.802778,0 days 00:07:55.444169,81.84041679613358,0.04101234996556082,0.927936110487861,poly,TPESampler,COMPLETE
357,0.28766824316827144,2025-04-24 21:02:47.196320,2025-04-24 21:02:48.038698,0 days 00:00:00.842378,98.5257695550449,0.053612509146135065,0.017039692908650855,rbf,TPESampler,COMPLETE
358,0.3409282175736626,2025-04-24 21:02:48.356529,2025-04-24 21:02:49.806511,0 days 00:00:01.449982,12.996328591912526,0.0073439633506122886,0.014260954154563629,rbf,TPESampler,COMPLETE
359,0.2974946519980356,2025-04-24 21:02:50.393128,2025-04-24 21:02:51.260184,0 days 00:00:00.867056,15.011117397072805,0.016547929704778554,0.05736796630585744,rbf,TPESampler,COMPLETE
360,0.3048164840362506,2025-04-24 21:02:51.539408,2025-04-24 21:02:52.540456,0 days 00:00:01.001048,92.63503302032393,0.03756863284977949,0.06612873161694126,rbf,TPESampler,COMPLETE
361,0.6701146943363028,2025-04-24 21:02:52.769433,2025-04-24 21:02:53.652086,0 days 00:00:00.882653,0.006476689709472692,0.004089840459126563,0.021035010404792075,linear,TPESampler,COMPLETE
362,0.3178688226334652,2025-04-24 21:02:53.830598,2025-04-24 21:02:54.571916,0 days 00:00:00.741318,74.70174214668141,0.003865275269409025,0.0047366196043377665,rbf,TPESampler,COMPLETE
363,0.30775847411985185,2025-04-24 21:02:54.963440,2025-04-24 21:02:55.827236,0 days 00:00:00.863796,88.71411181252077,0.020742839836218812,0.09235389111672865,rbf,TPESampler,COMPLETE
364,0.3026166066346065,2025-04-24 21:02:56.111975,2025-04-24 21:02:57.026235,0 days 00:00:00.914260,84.96599999219316,0.006748716149071971,0.013377269421742088,rbf,TPESampler,COMPLETE
365,0.30655748767305724,2025-04-24 21:02:57.300953,2025-04-24 21:02:58.150675,0 days 00:00:00.849722,17.665223354275703,0.03038429272736986,0.01782194212913418,rbf,TPESampler,COMPLETE
366,0.622401641751145,2025-04-24 21:02:58.354510,2025-04-24 21:02:59.003290,0 days 00:00:00.648780,80.89255106242244,0.10695148784040763,0.0001178300216029699,rbf,TPESampler,COMPLETE
367,0.28523336142889477,2025-04-24 21:02:59.387527,2025-04-24 21:03:00.155656,0 days 00:00:00.768129,93.84737918989299,0.008942790334599713,0.028391940222770518,rbf,TPESampler,COMPLETE
368,0.9664677360260159,2025-04-24 21:03:00.459987,2025-04-24 21:04:58.625967,0 days 00:01:58.165980,9.57836435010957,0.008484060929630124,0.23194571716278314,poly,TPESampler,COMPLETE
369,0.2888227096826021,2025-04-24 21:04:58.824879,2025-04-24 21:04:59.340639,0 days 00:00:00.515760,88.3567992755281,0.07345548062488996,0.031610853839032914,rbf,TPESampler,COMPLETE
370,0.28456690748523167,2025-04-24 21:04:59.517257,2025-04-24 21:05:00.068694,0 days 00:00:00.551437,90.75681279543481,0.04026512015747169,0.019621325070772303,rbf,TPESampler,COMPLETE
371,0.7114354705308873,2025-04-24 21:05:00.253550,2025-04-24 21:05:00.879511,0 days 00:00:00.625961,0.08157196311581946,0.006263511073440563,0.0439776021058369,rbf,TPESampler,COMPLETE
372,0.3094689136428151,2025-04-24 21:05:01.073530,2025-04-24 21:05:01.568781,0 days 00:00:00.495251,12.818257783526889,0.00963126654732805,0.022331580664556032,rbf,TPESampler,COMPLETE
373,1.0007427947034944,2025-04-24 21:05:01.750854,2025-04-24 21:05:02.213959,0 days 00:00:00.463105,0.015722228904752278,0.007873938193457842,0.00013577031992497639,poly,TPESampler,COMPLETE
374,0.307699484263311,2025-04-24 21:05:02.395645,2025-04-24 21:05:02.912594,0 days 00:00:00.516949,12.646354751625122,0.04287914887744349,0.038619176047344314,rbf,TPESampler,COMPLETE
375,0.3163578249390875,2025-04-24 21:05:03.117994,2025-04-24 21:05:03.626881,0 days 00:00:00.508887,94.58574187670128,0.01508902948045426,0.12369927912501986,rbf,TPESampler,COMPLETE
376,0.2834061348902723,2025-04-24 21:05:03.797782,2025-04-24 21:05:04.366547,0 days 00:00:00.568765,79.634697717428,0.024335766721163478,0.03346686154894829,rbf,TPESampler,COMPLETE
377,0.6069669466642846,2025-04-24 21:05:04.541731,2025-04-24 21:05:04.997466,0 days 00:00:00.455735,0.01772864582688908,0.5194362038833138,0.3812011220710201,linear,TPESampler,COMPLETE
378,0.3653076682484361,2025-04-24 21:05:05.250959,2025-04-24 21:05:05.877593,0 days 00:00:00.626634,1.7012363495249057,0.0016073897583411406,0.018853457745535183,linear,TPESampler,COMPLETE
379,0.36047060553337423,2025-04-24 21:05:06.307027,2025-04-24 21:05:07.761140,0 days 00:00:01.454113,15.229518634042977,0.09203275722067457,0.04784083100038302,linear,TPESampler,COMPLETE
380,27.507650931018798,2025-04-24 21:05:07.947911,2025-04-24 21:05:08.434936,0 days 00:00:00.487025,3.136194047970332,0.06381061358493959,0.06371152793958043,sigmoid,TPESampler,COMPLETE
381,0.2875326804200793,2025-04-24 21:05:08.640261,2025-04-24 21:05:09.183667,0 days 00:00:00.543406,82.00363849068486,0.021141460060535026,0.03944416696035452,rbf,TPESampler,COMPLETE
382,0.33715674411855767,2025-04-24 21:05:09.362927,2025-04-24 21:05:09.851019,0 days 00:00:00.488092,57.328423712750265,0.19979920767835513,0.20198860049641185,rbf,TPESampler,COMPLETE
383,0.8106544124784247,2025-04-24 21:05:10.044778,2025-04-24 21:05:10.991544,0 days 00:00:00.946766,0.005844381766309929,0.10350553612530178,0.8105297463460462,poly,TPESampler,COMPLETE
384,1.0007319472391871,2025-04-24 21:05:11.172522,2025-04-24 21:05:11.655525,0 days 00:00:00.483003,0.45807428621952934,0.0055156354089031315,0.00013735948288209446,poly,TPESampler,COMPLETE
385,0.36449001983068735,2025-04-24 21:05:11.836553,2025-04-24 21:05:13.371857,0 days 00:00:01.535304,18.405875435593693,0.0020396274189012774,0.00022346903791108246,linear,TPESampler,COMPLETE
386,0.30443782573007844,2025-04-24 21:05:13.819804,2025-04-24 21:05:14.735735,0 days 00:00:00.915931,15.703944710149669,0.03141836075539673,0.0170496795827914,rbf,TPESampler,COMPLETE
387,0.29300374471337093,2025-04-24 21:05:15.297536,2025-04-24 21:05:16.610575,0 days 00:00:01.313039,89.57927837114728,0.1358648269031235,0.00897967599319335,rbf,TPESampler,COMPLETE
388,0.3349224068433209,2025-04-24 21:05:16.828063,2025-04-24 21:05:17.330491,0 days 00:00:00.502428,11.909677605144719,0.013084038935114081,0.2692085313263512,rbf,TPESampler,COMPLETE
389,0.29608021072230434,2025-04-24 21:05:17.513266,2025-04-24 21:05:18.143135,0 days 00:00:00.629869,93.67474890501747,0.05157643176758217,0.0076487230882936845,rbf,TPESampler,COMPLETE
390,0.301277115463182,2025-04-24 21:05:18.326799,2025-04-24 21:05:18.871636,0 days 00:00:00.544837,95.39578718791488,0.010241112100738829,0.01401725520242317,rbf,TPESampler,COMPLETE
391,0.29469695481464375,2025-04-24 21:05:19.052177,2025-04-24 21:05:19.652382,0 days 00:00:00.600205,10.477608895918449,0.04465731019696743,0.08478050685862303,rbf,TPESampler,COMPLETE
392,0.8895632121355572,2025-04-24 21:05:19.839883,2025-04-24 21:05:20.324157,0 days 00:00:00.484274,0.07654844022708719,0.2700444970784741,0.8323810079559928,sigmoid,TPESampler,COMPLETE
393,0.9051677101874223,2025-04-24 21:05:20.514193,2025-04-24 21:05:27.968131,0 days 00:00:07.453938,0.2336993139046053,0.00326486685394307,0.3294944380252663,poly,TPESampler,COMPLETE
394,0.6979751903983245,2025-04-24 21:05:28.149169,2025-04-24 21:05:28.628559,0 days 00:00:00.479390,0.0012943711385837726,0.07838502874746062,0.000408771491605146,linear,TPESampler,COMPLETE
395,0.28622417160673824,2025-04-24 21:05:28.799897,2025-04-24 21:05:29.358546,0 days 00:00:00.558649,96.14453609910859,0.013374182503861496,0.024337755025415072,rbf,TPESampler,COMPLETE
396,0.29894857290660376,2025-04-24 21:05:29.567084,2025-04-24 21:05:30.115534,0 days 00:00:00.548450,20.848640498423222,0.025435336182982243,0.040345665952860335,rbf,TPESampler,COMPLETE
397,0.3043523713330419,2025-04-24 21:05:30.359498,2025-04-24 21:05:30.891897,0 days 00:00:00.532399,76.92099211185011,0.052810867712756455,0.11065538847175395,rbf,TPESampler,COMPLETE
398,0.308127589404599,2025-04-24 21:05:31.110637,2025-04-24 21:05:31.688011,0 days 00:00:00.577374,88.31433879966971,0.01846726759233545,0.05920666731776334,rbf,TPESampler,COMPLETE
399,0.2821861526348669,2025-04-24 21:05:31.878318,2025-04-24 21:05:32.641368,0 days 00:00:00.763050,96.70750939000163,0.03546202252092109,0.02371564730890538,rbf,TPESampler,COMPLETE
400,0.31034339503888586,2025-04-24 21:05:32.820711,2025-04-24 21:05:33.326832,0 days 00:00:00.506121,19.419430142029164,0.06719644348322144,0.010873371994677031,rbf,TPESampler,COMPLETE
401,0.29824141915076635,2025-04-24 21:05:33.518067,2025-04-24 21:05:34.009229,0 days 00:00:00.491162,29.40983427175464,0.08066592734036433,0.02587492088410927,rbf,TPESampler,COMPLETE
402,0.2873928119988859,2025-04-24 21:05:34.196468,2025-04-24 21:05:34.728829,0 days 00:00:00.532361,92.55146769187924,0.0450054202663143,0.017606526837863453,rbf,TPESampler,COMPLETE
403,0.6796490938889966,2025-04-24 21:05:34.917946,2025-04-24 21:05:35.401318,0 days 00:00:00.483372,4.142732636040167,0.013161997593429998,0.0006123373650575163,rbf,TPESampler,COMPLETE
404,0.29483461479981316,2025-04-24 21:05:35.576893,2025-04-24 21:05:36.110199,0 days 00:00:00.533306,95.13723127653105,0.07326457047801212,0.03389856957942984,rbf,TPESampler,COMPLETE
405,0.3022423222824484,2025-04-24 21:05:36.287590,2025-04-24 21:05:36.868552,0 days 00:00:00.580962,92.91651269838513,0.021286431786331234,0.01071317901491224,rbf,TPESampler,COMPLETE
406,0.7547580665197251,2025-04-24 21:05:37.053652,2025-04-24 21:05:37.545247,0 days 00:00:00.491595,12.522570911863463,0.027687279209914248,0.015273347710163913,poly,TPESampler,COMPLETE
407,0.361058375931769,2025-04-24 21:05:37.725774,2025-04-24 21:05:41.410601,0 days 00:00:03.684827,56.01921914487921,0.03616774831011382,0.02336358871410306,linear,TPESampler,COMPLETE
408,0.3614753093111346,2025-04-24 21:05:41.601456,2025-04-24 21:05:43.186974,0 days 00:00:01.585518,10.441186316726018,0.011934208134717603,0.41659260149741967,linear,TPESampler,COMPLETE
409,0.6999161607785671,2025-04-24 21:05:43.372565,2025-04-24 21:05:43.852936,0 days 00:00:00.480371,0.001405153392894744,0.036886556499799855,0.06526501786936964,linear,TPESampler,COMPLETE
410,0.2890898637127784,2025-04-24 21:05:44.036109,2025-04-24 21:05:44.618843,0 days 00:00:00.582734,80.8918777860095,0.020987836778820976,0.019895447048331367,rbf,TPESampler,COMPLETE
411,0.3829500829382755,2025-04-24 21:05:44.801637,2025-04-24 21:05:45.293864,0 days 00:00:00.492227,16.59707963847854,0.023761174442811304,0.006844163570249869,rbf,TPESampler,COMPLETE
412,0.7436056324883596,2025-04-24 21:05:45.495388,2025-04-24 21:05:46.027023,0 days 00:00:00.531635,32.79669417121364,0.15999941106995072,0.02329355793304622,poly,TPESampler,COMPLETE
413,0.29363688615496075,2025-04-24 21:05:46.212027,2025-04-24 21:05:46.798524,0 days 00:00:00.586497,91.06108623571947,0.01592932304777644,0.04485436958294129,rbf,TPESampler,COMPLETE
414,0.303767816072954,2025-04-24 21:05:46.990240,2025-04-24 21:05:47.516594,0 days 00:00:00.526354,92.76972567095603,0.0265483386646962,0.006027405179481482,rbf,TPESampler,COMPLETE
415,0.31684166961599897,2025-04-24 21:05:47.693168,2025-04-24 21:05:48.200238,0 days 00:00:00.507070,84.3451892126416,0.03812885790919754,0.13187081118576607,rbf,TPESampler,COMPLETE
416,0.29677853224452366,2025-04-24 21:05:48.396737,2025-04-24 21:05:48.938617,0 days 00:00:00.541880,22.569898421507425,0.018915375446467257,0.041099056609523114,rbf,TPESampler,COMPLETE
417,0.33030834175319423,2025-04-24 21:05:49.117919,2025-04-24 21:05:49.685099,0 days 00:00:00.567180,91.28227114419967,0.005663300467614686,0.1496169898074587,rbf,TPESampler,COMPLETE
418,0.30580339282412755,2025-04-24 21:05:49.870379,2025-04-24 21:05:50.425542,0 days 00:00:00.555163,96.8192608876483,0.05086182596597494,0.05157451345235794,rbf,TPESampler,COMPLETE
419,0.28999672808949756,2025-04-24 21:05:50.635825,2025-04-24 21:05:51.214830,0 days 00:00:00.579005,81.21970331903174,0.027863961046591525,0.017568407259624417,rbf,TPESampler,COMPLETE
420,0.28683106811658265,2025-04-24 21:05:51.413976,2025-04-24 21:05:51.960206,0 days 00:00:00.546230,90.74257180687803,0.049654278032746926,0.03266783736563281,rbf,TPESampler,COMPLETE
421,0.3055939937809572,2025-04-24 21:05:52.134521,2025-04-24 21:05:52.689471,0 days 00:00:00.554950,14.563801536455097,0.040070959980874156,0.022987689047782315,rbf,TPESampler,COMPLETE
422,0.7421423311707525,2025-04-24 21:05:52.873015,2025-04-24 21:05:53.394123,0 days 00:00:00.521108,0.05241720284148047,0.06364660036723153,0.016014861965214577,rbf,TPESampler,COMPLETE
423,0.294830113879573,2025-04-24 21:05:53.584930,2025-04-24 21:05:54.121340,0 days 00:00:00.536410,11.469523136468728,0.009216176355678419,0.08745039389270559,rbf,TPESampler,COMPLETE
424,0.30740231439759297,2025-04-24 21:05:54.296756,2025-04-24 21:05:54.817193,0 days 00:00:00.520437,12.479265157889374,0.016814531372364206,0.020176543806353406,rbf,TPESampler,COMPLETE
425,0.3009981399195019,2025-04-24 21:05:55.000848,2025-04-24 21:05:55.562101,0 days 00:00:00.561253,76.84783618342146,0.020839106064673395,0.052885312105323525,rbf,TPESampler,COMPLETE
426,0.30043583649022293,2025-04-24 21:05:55.746304,2025-04-24 21:05:56.276948,0 days 00:00:00.530644,13.264217539358325,0.0044650291407215955,0.06102580938103137,rbf,TPESampler,COMPLETE
427,0.29229362199869474,2025-04-24 21:05:56.456375,2025-04-24 21:05:57.023661,0 days 00:00:00.567286,96.07928804588175,0.0167649091650413,0.0428701664624727,rbf,TPESampler,COMPLETE
428,0.3038652173558281,2025-04-24 21:05:57.214923,2025-04-24 21:05:57.849988,0 days 00:00:00.635065,81.82719040005713,0.01642614152263058,0.011753983034584888,rbf,TPESampler,COMPLETE
429,0.2909847773508818,2025-04-24 21:05:58.042747,2025-04-24 21:05:58.668689,0 days 00:00:00.625942,98.64371800325193,0.008114772211064037,0.04152788510892856,rbf,TPESampler,COMPLETE
430,0.3000699264171003,2025-04-24 21:05:58.850231,2025-04-24 21:05:59.367439,0 days 00:00:00.517208,15.836039851670932,0.032192139476556025,0.048897044055670254,rbf,TPESampler,COMPLETE
431,0.9631692101147631,2025-04-24 21:05:59.551072,2025-04-24 21:06:00.091559,0 days 00:00:00.540487,0.009951207063818355,0.48967421059442834,0.42017182135361,rbf,TPESampler,COMPLETE
432,0.997778162598356,2025-04-24 21:06:00.291178,2025-04-24 21:06:00.971389,0 days 00:00:00.680211,0.007050534760740588,0.02766609517946384,0.00011632280377515005,rbf,TPESampler,COMPLETE
433,0.28736608942591324,2025-04-24 21:06:01.164799,2025-04-24 21:06:01.727924,0 days 00:00:00.563125,96.63692908482297,0.033627090450542726,0.016999659298626676,rbf,TPESampler,COMPLETE
434,0.30425211854508716,2025-04-24 21:06:01.917739,2025-04-24 21:06:02.471347,0 days 00:00:00.553608,94.55169575557471,0.017045243230385376,0.007009141280654948,rbf,TPESampler,COMPLETE
435,0.29614807467968085,2025-04-24 21:06:02.681390,2025-04-24 21:06:03.232497,0 days 00:00:00.551107,13.12323656881833,0.04104552751064445,0.08089490814382497,rbf,TPESampler,COMPLETE
436,0.305944716542772,2025-04-24 21:06:03.424595,2025-04-24 21:06:03.948099,0 days 00:00:00.523504,19.449785591191674,0.020729981732905533,0.015310632692349732,rbf,TPESampler,COMPLETE
437,419.15315674529495,2025-04-24 21:06:04.137763,2025-04-24 21:06:04.790275,0 days 00:00:00.652512,54.92984087881341,0.2021936204460236,0.0891662493617773,sigmoid,TPESampler,COMPLETE
438,0.2837533757712238,2025-04-24 21:06:05.027279,2025-04-24 21:06:05.620681,0 days 00:00:00.593402,96.79572345037853,0.019752752983425565,0.03275327637583732,rbf,TPESampler,COMPLETE
439,0.30400958106519327,2025-04-24 21:06:05.796209,2025-04-24 21:06:06.467928,0 days 00:00:00.671719,82.58765956887015,0.04386905065998831,0.062477287614832816,rbf,TPESampler,COMPLETE
440,0.30276143554606794,2025-04-24 21:06:06.780999,2025-04-24 21:06:07.431970,0 days 00:00:00.650971,50.064408295954436,0.18442608463406862,0.01972236175829061,rbf,TPESampler,COMPLETE
441,0.3035897776580691,2025-04-24 21:06:07.700506,2025-04-24 21:06:08.251140,0 days 00:00:00.550634,95.43790525012496,0.10652855096788172,0.07828465898168228,rbf,TPESampler,COMPLETE
442,0.5917921865867712,2025-04-24 21:06:08.447423,2025-04-24 21:06:08.993359,0 days 00:00:00.545936,1.9176527605736458,0.07799119136508344,0.007337894807429919,rbf,TPESampler,COMPLETE
443,0.36085436339647525,2025-04-24 21:06:09.177326,2025-04-24 21:06:12.940721,0 days 00:00:03.763395,87.46882999803707,0.09426589017641979,0.007545582451610594,linear,TPESampler,COMPLETE
444,0.4165566023466139,2025-04-24 21:06:13.127056,2025-04-24 21:06:13.647659,0 days 00:00:00.520603,99.13950475768006,0.03081384711053161,0.45133192678054407,rbf,TPESampler,COMPLETE
445,0.28432639267659315,2025-04-24 21:06:13.837100,2025-04-24 21:06:14.429426,0 days 00:00:00.592326,79.56224229175378,0.058854953805463475,0.024381810017277634,rbf,TPESampler,COMPLETE
446,0.5286875918503732,2025-04-24 21:06:14.606746,2025-04-24 21:06:15.392069,0 days 00:00:00.785323,97.72268101267896,0.007856803935020331,0.0006043290632185732,sigmoid,TPESampler,COMPLETE
447,17.940537217890167,2025-04-24 21:06:15.573595,2025-04-24 21:06:16.054831,0 days 00:00:00.481236,6.963213561421519,0.04387881458566694,0.014951822919599353,sigmoid,TPESampler,COMPLETE
448,0.2823635693714907,2025-04-24 21:06:16.240151,2025-04-24 21:06:16.787152,0 days 00:00:00.547001,93.60651948925052,0.023911879937859995,0.023423151240665754,rbf,TPESampler,COMPLETE
449,0.76673356219742,2025-04-24 21:06:16.959924,2025-04-24 21:06:17.499759,0 days 00:00:00.539835,89.63283612940393,0.04490415114393909,0.011100524633453734,poly,TPESampler,COMPLETE
450,0.8330829247281467,2025-04-24 21:06:17.744916,2025-04-24 21:06:24.043669,0 days 00:00:06.298753,4.702839490770231,0.06658965823807254,0.1734886672523124,poly,TPESampler,COMPLETE
451,0.2859840188274487,2025-04-24 21:06:24.240954,2025-04-24 21:06:24.809586,0 days 00:00:00.568632,99.64150800719354,0.024250645335062798,0.018906794025909883,rbf,TPESampler,COMPLETE
452,0.624757894657622,2025-04-24 21:06:25.017768,2025-04-24 21:06:25.494471,0 days 00:00:00.476703,0.018763229708508786,0.03381765716422343,0.0058628396262400285,linear,TPESampler,COMPLETE
453,0.36156810275224394,2025-04-24 21:06:25.686644,2025-04-24 21:06:26.176882,0 days 00:00:00.490238,16.685124125746285,0.08865778136034554,0.007243148176533684,rbf,TPESampler,COMPLETE
454,0.2836216245962532,2025-04-24 21:06:26.353963,2025-04-24 21:06:27.105393,0 days 00:00:00.751430,96.77209347987375,0.03422111038756545,0.02012376017486839,rbf,TPESampler,COMPLETE
455,0.3813934040423528,2025-04-24 21:06:27.278237,2025-04-24 21:06:27.773212,0 days 00:00:00.494975,93.60146182163696,0.024686482782558705,0.0015682333186191383,rbf,TPESampler,COMPLETE
456,0.29442542097732205,2025-04-24 21:06:27.944923,2025-04-24 21:06:28.452455,0 days 00:00:00.507532,76.4008084817529,0.06735699614949434,0.01500961071023694,rbf,TPESampler,COMPLETE
457,0.282869176850311,2025-04-24 21:06:28.630575,2025-04-24 21:06:29.144106,0 days 00:00:00.513531,98.15300860139239,0.06650118101245288,0.02301789059793878,rbf,TPESampler,COMPLETE
458,0.30222289528784063,2025-04-24 21:06:29.322290,2025-04-24 21:06:29.850233,0 days 00:00:00.527943,99.47873626941302,0.04402002059818276,0.005172129108272014,rbf,TPESampler,COMPLETE
459,0.3082135902638403,2025-04-24 21:06:30.042499,2025-04-24 21:06:30.583167,0 days 00:00:00.540668,15.462081247243512,0.12826234516891782,0.03167264935012674,rbf,TPESampler,COMPLETE
460,0.29138041006294546,2025-04-24 21:06:30.868068,2025-04-24 21:06:31.380844,0 days 00:00:00.512776,88.54188224335219,0.06439530186325525,0.01636039420772128,rbf,TPESampler,COMPLETE
461,0.30073905983971644,2025-04-24 21:06:31.556770,2025-04-24 21:06:32.065136,0 days 00:00:00.508366,94.71291828669277,0.10662227839127596,0.042374070016899794,rbf,TPESampler,COMPLETE
462,0.38073875735146573,2025-04-24 21:06:32.241900,2025-04-24 21:06:32.729789,0 days 00:00:00.487889,14.597818810285098,0.03324167224281792,0.007825600944328987,rbf,TPESampler,COMPLETE
463,0.2919424976790604,2025-04-24 21:06:32.907879,2025-04-24 21:06:33.402915,0 days 00:00:00.495036,22.461104363630785,0.044060284797072705,0.05162985664624352,rbf,TPESampler,COMPLETE
464,0.3037186690030216,2025-04-24 21:06:33.587161,2025-04-24 21:06:34.116513,0 days 00:00:00.529352,96.15981996221701,0.059436932398960855,0.044648752893835575,rbf,TPESampler,COMPLETE
465,0.690286402905242,2025-04-24 21:06:34.306129,2025-04-24 21:06:34.927702,0 days 00:00:00.621573,1.2838121022585898,0.001800995102793815,0.0014257608265970908,rbf,TPESampler,COMPLETE
466,0.3373263370566446,2025-04-24 21:06:35.129803,2025-04-24 21:06:35.664330,0 days 00:00:00.534527,99.78788000548792,0.15620801878126145,0.0020202851873209727,rbf,TPESampler,COMPLETE
467,0.30566281686702246,2025-04-24 21:06:35.864606,2025-04-24 21:06:36.389837,0 days 00:00:00.525231,19.040956811486886,0.03702702162831086,0.016806641440855974,rbf,TPESampler,COMPLETE
468,0.2919775405460288,2025-04-24 21:06:36.572084,2025-04-24 21:06:37.076304,0 days 00:00:00.504220,93.66599688738027,0.07507178896326445,0.007390474604067776,rbf,TPESampler,COMPLETE
469,0.284468287504143,2025-04-24 21:06:37.256608,2025-04-24 21:06:37.786010,0 days 00:00:00.529402,92.02068834090842,0.03669481746958041,0.019825954491318326,rbf,TPESampler,COMPLETE
470,0.2943926098845436,2025-04-24 21:06:37.970835,2025-04-24 21:06:38.485350,0 days 00:00:00.514515,21.20479831527807,0.04080469468629375,0.11765585700455304,rbf,TPESampler,COMPLETE
