number,value,datetime_start,datetime_complete,duration,params_C,params_epsilon,params_gamma,params_kernel,system_attrs_auto:sampler,state
943,0.4888263758674644,2025-04-24 21:15:16.010849,2025-04-24 21:15:16.501501,0 days 00:00:00.490652,2.6750579984444194,0.0724722001960536,0.016195262072078432,rbf,TPESampler,COMPLETE
944,0.28507514540528506,2025-04-24 21:15:16.346172,2025-04-24 21:15:16.869198,0 days 00:00:00.523026,87.40251768924146,0.07175375287285464,0.021783717370753186,rbf,TPESampler,COMPLETE
945,0.31904065790387587,2025-04-24 21:15:16.677651,2025-04-24 21:15:17.307575,0 days 00:00:00.629924,12.973674106263827,0.02088196029914566,0.016466150656700627,rbf,TPESampler,COMPLETE
946,0.302255319443537,2025-04-24 21:15:17.227486,2025-04-24 21:15:17.833279,0 days 00:00:00.605793,82.46645679454473,0.029122496254227907,0.008377949884716102,rbf,TPESampler,COMPLETE
947,0.8684838513022667,2025-04-24 21:15:17.525641,2025-04-24 21:15:18.091734,0 days 00:00:00.566093,0.10461569350448757,0.7876716679890539,0.005578975097074782,poly,TPESampler,COMPLETE
948,0.2924263568259282,2025-04-24 21:15:18.047284,2025-04-24 21:15:18.553915,0 days 00:00:00.506631,20.61428700980466,0.02329553252049326,0.05003372297394188,rbf,TPESampler,COMPLETE
949,0.3189561942049855,2025-04-24 21:15:18.358289,2025-04-24 21:15:18.825321,0 days 00:00:00.467032,23.441678152179847,0.2324324346207664,0.018040964375237563,rbf,TPESampler,COMPLETE
950,0.30108835843947507,2025-04-24 21:15:18.767941,2025-04-24 21:15:19.247787,0 days 00:00:00.479846,94.09415879051157,0.04618646331874207,0.0055931176713410235,rbf,TPESampler,COMPLETE
951,0.29175809970634875,2025-04-24 21:15:19.024803,2025-04-24 21:15:19.621827,0 days 00:00:00.597024,88.20785086544272,0.02977031488422539,0.015272309568568593,rbf,TPESampler,COMPLETE
952,0.2836246125709389,2025-04-24 21:15:19.477680,2025-04-24 21:15:20.035762,0 days 00:00:00.558082,87.25173137078308,0.054146437750218546,0.029166081470214836,rbf,TPESampler,COMPLETE
953,0.31831071165263125,2025-04-24 21:15:19.802977,2025-04-24 21:15:20.318868,0 days 00:00:00.515891,95.9857730942498,0.2174842244328471,0.031199040198404485,rbf,TPESampler,COMPLETE
954,0.3182420339286164,2025-04-24 21:15:20.271709,2025-04-24 21:15:20.737471,0 days 00:00:00.465762,19.795437886103777,0.03896976810243159,0.010992336138165566,rbf,TPESampler,COMPLETE
955,0.3633589021404422,2025-04-24 21:15:20.535775,2025-04-24 21:15:23.048963,0 days 00:00:02.513188,16.550877038708116,0.022113078432841427,0.013903073668519533,linear,TPESampler,COMPLETE
956,0.2824491365348891,2025-04-24 21:15:20.943269,2025-04-24 21:15:21.530385,0 days 00:00:00.587116,90.77126621918738,0.02773236104391248,0.02944055630291797,rbf,TPESampler,COMPLETE
957,0.8314709283273052,2025-04-24 21:15:21.718490,2025-04-24 21:15:22.222590,0 days 00:00:00.504100,12.522619187948283,0.018122448245072288,0.006880320820668319,poly,TPESampler,COMPLETE
958,0.3089236132111947,2025-04-24 21:15:22.413131,2025-04-24 21:15:22.946020,0 days 00:00:00.532889,96.12607483269437,0.05268689108436084,0.11271967388965988,rbf,TPESampler,COMPLETE
959,0.3219522812018444,2025-04-24 21:15:23.109919,2025-04-24 21:15:23.810166,0 days 00:00:00.700247,96.34887361901333,0.009594983341154549,0.17428793215892266,rbf,TPESampler,COMPLETE
960,0.9988343465556624,2025-04-24 21:15:23.253620,2025-04-24 21:15:23.967066,0 days 00:00:00.713446,19.11603258885798,0.031154418168581742,0.00019216397429595213,poly,TPESampler,COMPLETE
961,0.3081509684990105,2025-04-24 21:15:24.012143,2025-04-24 21:15:24.583876,0 days 00:00:00.571733,93.97987424211426,0.02335857013010197,0.004845906417760319,rbf,TPESampler,COMPLETE
962,0.3027908495459733,2025-04-24 21:15:24.183897,2025-04-24 21:15:24.752735,0 days 00:00:00.568838,24.90835370734423,0.02936296597360505,0.026084095140358986,rbf,TPESampler,COMPLETE
963,0.28217531600758344,2025-04-24 21:15:24.759408,2025-04-24 21:15:25.362416,0 days 00:00:00.603008,96.867472566687,0.029561807002911413,0.028458512878746595,rbf,TPESampler,COMPLETE
964,0.29085645626026896,2025-04-24 21:15:24.960784,2025-04-24 21:15:25.602163,0 days 00:00:00.641379,86.02029075646875,0.0144332736582029,0.0206801011483833,rbf,TPESampler,COMPLETE
965,0.8589764773493759,2025-04-24 21:15:25.567020,2025-04-24 21:15:26.070375,0 days 00:00:00.503355,0.059155442401042736,0.07175058561388171,0.0019840582044262944,rbf,TPESampler,COMPLETE
966,0.2949807699421485,2025-04-24 21:15:25.826352,2025-04-24 21:15:26.429953,0 days 00:00:00.603601,13.76398373334782,0.017521339327978065,0.12520747486686692,rbf,TPESampler,COMPLETE
967,0.2870918328647375,2025-04-24 21:15:26.350048,2025-04-24 21:15:27.049723,0 days 00:00:00.699675,95.3257162321348,0.02215523151281585,0.03690731796601457,rbf,TPESampler,COMPLETE
968,0.2982833618947956,2025-04-24 21:15:26.724645,2025-04-24 21:15:27.318335,0 days 00:00:00.593690,81.2807276443084,0.006168276112614899,0.020758396890059667,rbf,TPESampler,COMPLETE
969,0.7480562951200813,2025-04-24 21:15:27.250155,2025-04-24 21:15:27.764533,0 days 00:00:00.514378,0.27333364596186777,0.010433029412190662,0.014470011747316722,sigmoid,TPESampler,COMPLETE
970,0.8968665909239806,2025-04-24 21:15:27.533668,2025-04-24 21:15:28.203766,0 days 00:00:00.670098,95.99549272004816,0.015788941305720016,0.01563755165612397,poly,TPESampler,COMPLETE
971,0.290244335374515,2025-04-24 21:15:27.972968,2025-04-24 21:15:28.653096,0 days 00:00:00.680128,80.04010700880126,0.011225865731862645,0.04345495130075715,rbf,TPESampler,COMPLETE
972,0.28439990547379834,2025-04-24 21:15:28.440101,2025-04-24 21:15:29.042674,0 days 00:00:00.602573,99.76195509884973,0.012214464573768125,0.032056838980447186,rbf,TPESampler,COMPLETE
973,0.2833435939464525,2025-04-24 21:15:28.889948,2025-04-24 21:15:29.470778,0 days 00:00:00.580830,99.7175436705333,0.01858428914807273,0.03021372258726867,rbf,TPESampler,COMPLETE
974,0.3089128414409854,2025-04-24 21:15:29.241362,2025-04-24 21:15:29.863202,0 days 00:00:00.621840,98.84995775124827,0.016954778165520712,0.060895117635816905,rbf,TPESampler,COMPLETE
975,0.31482228108637555,2025-04-24 21:15:29.667613,2025-04-24 21:15:30.161110,0 days 00:00:00.493497,23.01040632177638,0.04133221018402693,0.20062768489031352,rbf,TPESampler,COMPLETE
976,0.3779705996198521,2025-04-24 21:15:30.084066,2025-04-24 21:15:30.637216,0 days 00:00:00.553150,13.00020325365783,0.017972254854461914,0.009321460528067042,rbf,TPESampler,COMPLETE
977,0.3109197231573944,2025-04-24 21:15:30.424365,2025-04-24 21:15:30.900536,0 days 00:00:00.476171,11.41140263050625,0.024809529453335862,0.04415390492334071,rbf,TPESampler,COMPLETE
978,0.4769711156481326,2025-04-24 21:15:30.854246,2025-04-24 21:15:31.347708,0 days 00:00:00.493462,2.6854007732923972,0.016810078960556092,0.01943307943067116,rbf,TPESampler,COMPLETE
979,0.30821263021566864,2025-04-24 21:15:31.096350,2025-04-24 21:15:31.641739,0 days 00:00:00.545389,13.276860323273825,0.009889603606792557,0.020340797040397696,rbf,TPESampler,COMPLETE
980,65.04018561492903,2025-04-24 21:15:31.579007,2025-04-24 21:15:32.051914,0 days 00:00:00.472907,7.863001695683163,0.02666965600769655,0.05609733858206135,sigmoid,TPESampler,COMPLETE
981,0.2936378586273122,2025-04-24 21:15:31.856186,2025-04-24 21:15:32.310899,0 days 00:00:00.454713,17.361283253225018,0.03758703313413537,0.06676144450459365,rbf,TPESampler,COMPLETE
982,0.2950604126048978,2025-04-24 21:15:32.253419,2025-04-24 21:15:32.864694,0 days 00:00:00.611275,23.718086494551866,0.030969379011659828,0.0416736761723838,rbf,TPESampler,COMPLETE
983,0.2840476484936751,2025-04-24 21:15:32.538138,2025-04-24 21:15:33.182278,0 days 00:00:00.644140,82.81150244235556,0.021195788931916808,0.0243684952873964,rbf,TPESampler,COMPLETE
984,0.29782623108568146,2025-04-24 21:15:33.046965,2025-04-24 21:15:33.729419,0 days 00:00:00.682454,28.17244079849521,0.01849773305243024,0.079195387071681,rbf,TPESampler,COMPLETE
985,0.3146300120558516,2025-04-24 21:15:33.384214,2025-04-24 21:15:34.166597,0 days 00:00:00.782383,93.66257384375234,0.03610728940907408,0.1505268727022367,rbf,TPESampler,COMPLETE
986,0.2985430951167566,2025-04-24 21:15:33.944276,2025-04-24 21:15:34.533129,0 days 00:00:00.588853,82.60944974646482,0.023836686653645987,0.013001027978525675,rbf,TPESampler,COMPLETE
987,0.29399598657380144,2025-04-24 21:15:34.393626,2025-04-24 21:15:34.960572,0 days 00:00:00.566946,91.6181843759976,0.06109842513282961,0.03532725383270839,rbf,TPESampler,COMPLETE
988,0.3461666402500449,2025-04-24 21:15:34.720561,2025-04-24 21:15:35.246010,0 days 00:00:00.525449,15.105771888008634,0.03735574259183356,0.011321286214695803,rbf,TPESampler,COMPLETE
989,0.3174889805001007,2025-04-24 21:15:35.157117,2025-04-24 21:15:35.906269,0 days 00:00:00.749152,22.187022742910756,0.015369444149590872,0.010276061439381092,rbf,TPESampler,COMPLETE
990,0.2857565214535005,2025-04-24 21:15:35.491277,2025-04-24 21:15:36.280304,0 days 00:00:00.789027,96.71392309179119,0.03579553044027617,0.018122391212786713,rbf,TPESampler,COMPLETE
991,0.3191199471988986,2025-04-24 21:15:36.138365,2025-04-24 21:15:36.664324,0 days 00:00:00.525959,93.96772262792345,0.01619913756323244,0.17972370176204974,rbf,TPESampler,COMPLETE
992,0.39261570457395745,2025-04-24 21:15:36.458395,2025-04-24 21:15:36.961653,0 days 00:00:00.503258,0.2523222971360473,0.02589764246075329,0.0015748557212368263,linear,TPESampler,COMPLETE
993,0.2872821054970737,2025-04-24 21:15:36.885452,2025-04-24 21:15:37.556844,0 days 00:00:00.671392,89.49871356991073,0.020294807562271536,0.03806273236982107,rbf,TPESampler,COMPLETE
994,0.3217125167383493,2025-04-24 21:15:37.164958,2025-04-24 21:15:37.754224,0 days 00:00:00.589266,99.07981234997828,0.026006664691888046,0.13989048781005253,rbf,TPESampler,COMPLETE
995,0.30263751173283854,2025-04-24 21:15:37.876438,2025-04-24 21:15:38.530883,0 days 00:00:00.654445,21.666137709299782,0.0557656634290184,0.02011883142463099,rbf,TPESampler,COMPLETE
996,0.3028683848962886,2025-04-24 21:15:38.021609,2025-04-24 21:15:38.701285,0 days 00:00:00.679676,92.79290940198842,0.027312602609642144,0.007982355824811832,rbf,TPESampler,COMPLETE
997,0.30258385986180425,2025-04-24 21:15:38.708320,2025-04-24 21:15:39.252041,0 days 00:00:00.543721,93.9848070807677,0.09851328909087279,0.06208006717820906,rbf,TPESampler,COMPLETE
998,0.29075261206358544,2025-04-24 21:15:38.881757,2025-04-24 21:15:39.488994,0 days 00:00:00.607237,23.4486580658362,0.011604150877007918,0.04860620349789795,rbf,TPESampler,COMPLETE
999,0.915736497066485,2025-04-24 21:15:39.442807,2025-04-24 21:15:43.625168,0 days 00:00:04.182361,42.492178765350474,0.004115970440016732,0.05011596741155286,poly,TPESampler,COMPLETE
1000,0.29873409905266707,2025-04-24 21:15:39.752405,2025-04-24 21:15:40.329753,0 days 00:00:00.577348,23.740129710458415,0.029730499621696063,0.035739994293486,rbf,TPESampler,COMPLETE
1001,0.28462139168436806,2025-04-24 21:15:40.520408,2025-04-24 21:15:41.117846,0 days 00:00:00.597438,83.76488427702716,0.036172616008395095,0.021422743738674664,rbf,TPESampler,COMPLETE
1002,0.29564381666134676,2025-04-24 21:15:41.313743,2025-04-24 21:15:41.847248,0 days 00:00:00.533505,17.270106649297013,0.06476036719918411,0.05077179488557197,rbf,TPESampler,COMPLETE
1003,0.3232959203789154,2025-04-24 21:15:42.037895,2025-04-24 21:15:42.560580,0 days 00:00:00.522685,91.71466703475633,0.012881442082432379,0.003375417050483299,rbf,TPESampler,COMPLETE
1004,0.3082616708002268,2025-04-24 21:15:42.736628,2025-04-24 21:15:43.249148,0 days 00:00:00.512520,15.481148627891159,0.025259486922476516,0.025423185777586586,rbf,TPESampler,COMPLETE
1005,0.28444907831506655,2025-04-24 21:15:43.427052,2025-04-24 21:15:44.040020,0 days 00:00:00.612968,85.59666952025583,0.026223737866843736,0.03604581345176725,rbf,TPESampler,COMPLETE
1006,159.7845484517328,2025-04-24 21:15:43.836635,2025-04-24 21:15:44.346829,0 days 00:00:00.510194,94.02089201416096,0.022841209982183662,0.011387526333600512,sigmoid,TPESampler,COMPLETE
1007,0.3011850232809267,2025-04-24 21:15:44.298096,2025-04-24 21:15:44.778915,0 days 00:00:00.480819,92.81235251300204,0.04428211185102794,0.04516586056626401,rbf,TPESampler,COMPLETE
1008,0.3047408572054336,2025-04-24 21:15:44.568885,2025-04-24 21:15:45.104322,0 days 00:00:00.535437,92.06480002653949,0.04508563614061226,0.05100417795165163,rbf,TPESampler,COMPLETE
1009,0.2985244635350067,2025-04-24 21:15:44.994253,2025-04-24 21:15:45.608655,0 days 00:00:00.614402,95.52559777403029,0.025876415781320713,0.011883573011589077,rbf,TPESampler,COMPLETE
1010,0.9922296727836575,2025-04-24 21:15:45.343649,2025-04-24 21:15:45.885986,0 days 00:00:00.542337,0.0011965349526916417,0.013896421410548294,0.24773483379894318,rbf,TPESampler,COMPLETE
1011,0.4493152243586399,2025-04-24 21:15:45.812096,2025-04-24 21:15:46.267986,0 days 00:00:00.455890,11.705226370782691,0.05474927285786803,0.0047817997578338935,rbf,TPESampler,COMPLETE
1012,0.6958006972474259,2025-04-24 21:15:46.111848,2025-04-24 21:15:46.590838,0 days 00:00:00.478990,0.0019338322231807464,0.010089669696588546,0.0002569322009442553,linear,TPESampler,COMPLETE
1013,0.36363785546735256,2025-04-24 21:15:46.445423,2025-04-24 21:15:51.428086,0 days 00:00:04.982663,92.25899020553955,0.02708261501506248,0.009701901730705694,linear,TPESampler,COMPLETE
1014,0.7018575050550376,2025-04-24 21:15:46.780947,2025-04-24 21:15:47.310210,0 days 00:00:00.529263,6.305409154682523,0.014257561473773798,0.00010041598712992944,rbf,TPESampler,COMPLETE
1015,0.2930009870936223,2025-04-24 21:15:47.496968,2025-04-24 21:15:48.050330,0 days 00:00:00.553362,26.648961097389684,0.006188758661161345,0.04109275399205846,rbf,TPESampler,COMPLETE
1016,0.29867638209306807,2025-04-24 21:15:48.238748,2025-04-24 21:15:48.742176,0 days 00:00:00.503428,19.53288441890293,0.07435405111145424,0.0750526607694269,rbf,TPESampler,COMPLETE
1017,0.2885569192679681,2025-04-24 21:15:48.935130,2025-04-24 21:15:49.502105,0 days 00:00:00.566975,91.42330990331013,0.02007104494235952,0.01865362250733957,rbf,TPESampler,COMPLETE
1018,0.3891699374649089,2025-04-24 21:15:49.691590,2025-04-24 21:15:50.204441,0 days 00:00:00.512851,2.4737988577605767,0.003210451103354899,0.3931260259390055,rbf,TPESampler,COMPLETE
1019,0.9692379845913112,2025-04-24 21:15:50.398210,2025-04-24 21:15:50.933407,0 days 00:00:00.535197,0.006083928071058423,0.14486911445712594,0.005864729271772358,sigmoid,TPESampler,COMPLETE
1020,0.3692216787926754,2025-04-24 21:15:51.179431,2025-04-24 21:15:51.776718,0 days 00:00:00.597287,0.6896807370223761,0.011369051057347647,0.04950547050020075,linear,TPESampler,COMPLETE
1021,0.2876365393041874,2025-04-24 21:15:51.623077,2025-04-24 21:15:52.194808,0 days 00:00:00.571731,95.3774488655556,0.06753579144217975,0.03084225016608295,rbf,TPESampler,COMPLETE
1022,0.29108325688403225,2025-04-24 21:15:51.953074,2025-04-24 21:15:52.484234,0 days 00:00:00.531160,99.02690322971611,0.10729121680212238,0.01287334296809639,rbf,TPESampler,COMPLETE
1023,0.3731743150852837,2025-04-24 21:15:52.443345,2025-04-24 21:15:52.959980,0 days 00:00:00.516635,18.357249919248535,0.046258588529018575,0.006755507481717082,rbf,TPESampler,COMPLETE
1024,0.3031153049349106,2025-04-24 21:15:52.731264,2025-04-24 21:15:53.244490,0 days 00:00:00.513226,15.63131589021547,0.068169392068632,0.03871261372500318,rbf,TPESampler,COMPLETE
1025,0.28662879957525167,2025-04-24 21:15:53.169958,2025-04-24 21:15:53.844583,0 days 00:00:00.674625,94.46310495042613,0.013109171334319063,0.02427055765603618,rbf,TPESampler,COMPLETE
1026,0.2901497020461472,2025-04-24 21:15:53.490268,2025-04-24 21:15:54.114429,0 days 00:00:00.624161,97.53830239338753,0.018371514010387894,0.016742024604630867,rbf,TPESampler,COMPLETE
1027,0.28784616065478835,2025-04-24 21:15:54.053665,2025-04-24 21:15:54.798828,0 days 00:00:00.745163,94.48798451932004,0.028860646908806825,0.03750660784280101,rbf,TPESampler,COMPLETE
1028,0.3300721537364165,2025-04-24 21:15:54.378724,2025-04-24 21:15:55.060375,0 days 00:00:00.681651,14.66866487297657,0.012594204961521523,0.013742446576379205,rbf,TPESampler,COMPLETE
1029,0.3000224437089998,2025-04-24 21:15:55.010400,2025-04-24 21:15:55.522247,0 days 00:00:00.511847,14.634214477082347,0.02547910625884794,0.05275330069993867,rbf,TPESampler,COMPLETE
1030,0.29910640485248247,2025-04-24 21:15:55.308219,2025-04-24 21:15:55.806596,0 days 00:00:00.498377,21.59198149015242,0.07618621550118562,0.01563082097456802,rbf,TPESampler,COMPLETE
1031,0.3081922729511518,2025-04-24 21:15:55.762388,2025-04-24 21:15:56.280541,0 days 00:00:00.518153,89.89932045539277,0.016396847014890983,0.06238491456254608,rbf,TPESampler,COMPLETE
1032,0.3053185837514232,2025-04-24 21:15:56.050553,2025-04-24 21:15:56.642206,0 days 00:00:00.591653,99.0255193308288,0.011378955562691931,0.006866719200171564,rbf,TPESampler,COMPLETE
1033,0.500828171937897,2025-04-24 21:15:56.568046,2025-04-24 21:15:57.138581,0 days 00:00:00.570535,26.167547821886128,0.12207450486535917,0.5871735021216755,rbf,TPESampler,COMPLETE
1034,0.2944644706664666,2025-04-24 21:15:56.937967,2025-04-24 21:15:57.469236,0 days 00:00:00.531269,15.376639362387985,0.02267374047810522,0.10028697147838078,rbf,TPESampler,COMPLETE
1035,0.3055976743976738,2025-04-24 21:15:57.378738,2025-04-24 21:15:57.948122,0 days 00:00:00.569384,16.891269580693248,0.019322762333267074,0.022169226121488216,rbf,TPESampler,COMPLETE
1036,592.7474910855522,2025-04-24 21:15:57.711903,2025-04-24 21:15:58.243307,0 days 00:00:00.531404,87.72324282339244,0.1304898234774697,0.03555731070540924,sigmoid,TPESampler,COMPLETE
1037,0.2945298067931713,2025-04-24 21:15:58.194689,2025-04-24 21:15:58.981901,0 days 00:00:00.787212,86.20654922944126,0.07493061745107846,0.004756937074046475,rbf,TPESampler,COMPLETE
1038,0.2932341018942169,2025-04-24 21:15:58.465142,2025-04-24 21:15:59.356214,0 days 00:00:00.891072,17.843081457113342,0.038961266167456425,0.06326745266443529,rbf,TPESampler,COMPLETE
1039,0.2916859861320316,2025-04-24 21:15:59.271749,2025-04-24 21:15:59.843182,0 days 00:00:00.571433,91.75056906811062,0.03775101022070915,0.014481331000713941,rbf,TPESampler,COMPLETE
1040,0.2827802734328754,2025-04-24 21:15:59.600327,2025-04-24 21:16:00.150641,0 days 00:00:00.550314,84.42449361832206,0.04644456445724838,0.02702369196593099,rbf,TPESampler,COMPLETE
1041,0.30261342990736784,2025-04-24 21:16:00.069095,2025-04-24 21:16:00.613561,0 days 00:00:00.544466,88.57119842587906,0.03855576092206383,0.04936603016096674,rbf,TPESampler,COMPLETE
1042,0.3027737806148146,2025-04-24 21:16:00.381173,2025-04-24 21:16:00.885942,0 days 00:00:00.504769,22.651419144839398,0.050906641855465,0.01330608983834597,rbf,TPESampler,COMPLETE
1043,0.2857159288255778,2025-04-24 21:16:00.833428,2025-04-24 21:16:01.494543,0 days 00:00:00.661115,96.25663045076628,0.006776012292586556,0.0350500950510693,rbf,TPESampler,COMPLETE
1044,58.7692646697099,2025-04-24 21:16:01.102325,2025-04-24 21:16:01.768472,0 days 00:00:00.666147,15.402441758534161,0.0029281939456875235,0.02033184525902461,sigmoid,TPESampler,COMPLETE
1045,0.2936738603688164,2025-04-24 21:16:01.733413,2025-04-24 21:16:02.325539,0 days 00:00:00.592126,91.18454988797477,0.07871965310777837,0.013539152070348176,rbf,TPESampler,COMPLETE
1046,0.2815130631575174,2025-04-24 21:16:02.008071,2025-04-24 21:16:02.572176,0 days 00:00:00.564105,98.15436732305918,0.02817757422938289,0.02384350799182808,rbf,TPESampler,COMPLETE
1047,0.29997724482645816,2025-04-24 21:16:02.517285,2025-04-24 21:16:02.929706,0 days 00:00:00.412421,96.10859618924846,0.13332027713880185,0.09361886345361779,rbf,TPESampler,COMPLETE
1048,0.3452688236663387,2025-04-24 21:16:02.783199,2025-04-24 21:16:03.318260,0 days 00:00:00.535061,18.1830433088832,0.02671498220414087,0.009846527555334656,rbf,TPESampler,COMPLETE
1049,0.7395786646892981,2025-04-24 21:16:03.113719,2025-04-24 21:16:03.644538,0 days 00:00:00.530819,96.98233596711074,0.17178956856288968,0.015242627178846994,poly,TPESampler,COMPLETE
1050,0.29396865110702736,2025-04-24 21:16:03.568223,2025-04-24 21:16:04.112373,0 days 00:00:00.544150,97.78366270063455,0.06930606400269819,0.011253108295194393,rbf,TPESampler,COMPLETE
1051,0.3016587396330909,2025-04-24 21:16:03.876004,2025-04-24 21:16:04.558491,0 days 00:00:00.682487,97.83035854139729,0.018032205482735018,0.04844836324418638,rbf,TPESampler,COMPLETE
1052,0.8239717003454861,2025-04-24 21:16:04.367663,2025-04-24 21:16:04.839909,0 days 00:00:00.472246,0.019697595016389156,0.08013659548658901,0.06168012759997128,poly,TPESampler,COMPLETE
1053,0.29397798617867865,2025-04-24 21:16:04.784066,2025-04-24 21:16:05.412777,0 days 00:00:00.628711,98.49676433611717,0.05694725207595596,0.007215577147693688,rbf,TPESampler,COMPLETE
1054,0.35902589621407544,2025-04-24 21:16:05.038040,2025-04-24 21:16:09.198949,0 days 00:00:04.160909,63.5547615897028,0.05965177543835996,0.43783975769971506,linear,TPESampler,COMPLETE
1055,0.9133677220488825,2025-04-24 21:16:05.716281,2025-04-24 21:16:06.255052,0 days 00:00:00.538771,0.007739557834178464,0.0045099929413161795,0.011205636246172077,poly,TPESampler,COMPLETE
1056,0.32955056659632254,2025-04-24 21:16:06.472902,2025-04-24 21:16:07.145785,0 days 00:00:00.672883,18.62973526663857,0.01157678334364417,0.011154080330168147,rbf,TPESampler,COMPLETE
1057,0.29386392880786727,2025-04-24 21:16:07.337603,2025-04-24 21:16:07.859130,0 days 00:00:00.521527,23.13334533269394,0.048299068058397655,0.04618321916094843,rbf,TPESampler,COMPLETE
1058,0.30449089128137896,2025-04-24 21:16:08.040490,2025-04-24 21:16:08.688266,0 days 00:00:00.647776,94.00889256184503,0.041100401261169685,0.06070859549487354,rbf,TPESampler,COMPLETE
1059,0.2927314630369357,2025-04-24 21:16:08.877528,2025-04-24 21:16:09.424802,0 days 00:00:00.547274,24.295109256609127,0.06478214895793805,0.11201781745818697,rbf,TPESampler,COMPLETE
1060,0.3046534504015191,2025-04-24 21:16:09.381932,2025-04-24 21:16:09.869866,0 days 00:00:00.487934,18.017394236607878,0.023969607237886506,0.020215861357792676,rbf,TPESampler,COMPLETE
