number,value,datetime_start,datetime_complete,duration,params_C,params_epsilon,params_gamma,params_kernel,system_attrs_auto:sampler,state
2358,0.3077163000104902,2025-04-24 21:36:21.118122,2025-04-24 21:36:21.899962,0 days 00:00:00.781840,5.249989823213072,0.06154685313949279,0.0966211169963591,rbf,TPESampler,COMPLETE
2359,0.3050870938127638,2025-04-24 21:36:22.107269,2025-04-24 21:36:22.698669,0 days 00:00:00.591400,17.428422728744053,0.04087731951669833,0.018325927739648258,rbf,TPESampler,COMPLETE
2360,0.2927188697958673,2025-04-24 21:36:22.909865,2025-04-24 21:36:23.495042,0 days 00:00:00.585177,19.15369350702648,0.03957304023615025,0.060745141357467905,rbf,TPESampler,COMPLETE
2361,0.36228457464798514,2025-04-24 21:36:23.690915,2025-04-24 21:36:24.314067,0 days 00:00:00.623152,1.0983435236005294,0.04816081253468697,0.007661741041303572,linear,TPESampler,COMPLETE
2362,0.8619057936361955,2025-04-24 21:36:24.510001,2025-04-24 21:36:25.052523,0 days 00:00:00.542522,2.2699206781884067,0.020296245812623386,0.002997690056019365,poly,TPESampler,COMPLETE
2363,0.36412093681580127,2025-04-24 21:36:25.253875,2025-04-24 21:36:26.108147,0 days 00:00:00.854272,3.228988767675813,0.0054800767201785006,0.03133001581494345,linear,TPESampler,COMPLETE
2364,0.30317418427640214,2025-04-24 21:36:26.309882,2025-04-24 21:36:26.920922,0 days 00:00:00.611040,98.45784241737147,0.020411697334543,0.006989801398445453,rbf,TPESampler,COMPLETE
2365,0.2853279726156954,2025-04-24 21:36:27.106954,2025-04-24 21:36:27.713438,0 days 00:00:00.606484,99.76834522215968,0.030162911053725122,0.01857195309011032,rbf,TPESampler,COMPLETE
2366,1.0013757586006304,2025-04-24 21:36:27.919182,2025-04-24 21:36:28.667957,0 days 00:00:00.748775,0.07342543713328316,0.01918091541457642,0.0002963965505840937,poly,TPESampler,COMPLETE
2367,0.2906326494935267,2025-04-24 21:36:28.853716,2025-04-24 21:36:29.461105,0 days 00:00:00.607389,95.69870653174051,0.011028642413689152,0.04161368633465444,rbf,TPESampler,COMPLETE
2368,0.2870072281872177,2025-04-24 21:36:29.659345,2025-04-24 21:36:30.221408,0 days 00:00:00.562063,96.80026503719098,0.08812056630586518,0.021018153120268886,rbf,TPESampler,COMPLETE
2369,0.28291823216343015,2025-04-24 21:36:30.409737,2025-04-24 21:36:31.013943,0 days 00:00:00.604206,95.89743832032345,0.04087110087887678,0.029105121575583003,rbf,TPESampler,COMPLETE
2370,0.28586682485447873,2025-04-24 21:36:31.217497,2025-04-24 21:36:31.816460,0 days 00:00:00.598963,93.50797227381338,0.0319173646871139,0.03592350414559813,rbf,TPESampler,COMPLETE
2371,0.33157159362292005,2025-04-24 21:36:32.022705,2025-04-24 21:36:32.571230,0 days 00:00:00.548525,4.66722600696032,0.009368945783394828,0.049686364678629275,rbf,TPESampler,COMPLETE
2372,0.6077709852278781,2025-04-24 21:36:32.765803,2025-04-24 21:36:33.359970,0 days 00:00:00.594167,0.024017699623849108,0.0010505470780951618,0.00014366975431888093,linear,TPESampler,COMPLETE
2373,0.2825959175844607,2025-04-24 21:36:33.561100,2025-04-24 21:36:34.174656,0 days 00:00:00.613556,92.66306534194916,0.03124497460556129,0.022346668926175105,rbf,TPESampler,COMPLETE
2374,0.308586039046631,2025-04-24 21:36:34.361335,2025-04-24 21:36:34.921645,0 days 00:00:00.560310,24.452091714187564,0.01444744394560158,0.011831883883001312,rbf,TPESampler,COMPLETE
2375,0.3021149657698477,2025-04-24 21:36:35.119914,2025-04-24 21:36:35.798988,0 days 00:00:00.679074,97.88937523779478,0.1009043903728012,0.0425216733747952,rbf,TPESampler,COMPLETE
2376,0.29652316522689776,2025-04-24 21:36:35.992300,2025-04-24 21:36:36.647990,0 days 00:00:00.655690,18.770581542929534,0.03940694953364653,0.14475446743709589,rbf,TPESampler,COMPLETE
2377,3.050930165491659,2025-04-24 21:36:36.890897,2025-04-24 21:36:37.520410,0 days 00:00:00.629513,0.3427211798748489,0.022400627665865903,0.06406318910510118,sigmoid,TPESampler,COMPLETE
2378,0.3542519498548989,2025-04-24 21:36:37.739765,2025-04-24 21:36:38.681124,0 days 00:00:00.941359,23.46010617517104,0.04932555029215611,0.006915980734192446,rbf,TPESampler,COMPLETE
2379,0.3020787569435226,2025-04-24 21:36:38.931926,2025-04-24 21:36:39.498357,0 days 00:00:00.566431,26.30004295870828,0.010774040999583026,0.14043261191111012,rbf,TPESampler,COMPLETE
2380,0.30788364989751626,2025-04-24 21:36:39.694755,2025-04-24 21:36:40.232580,0 days 00:00:00.537825,22.08954627085391,0.008456349928419989,0.01970902958023338,rbf,TPESampler,COMPLETE
2381,0.29353973461001365,2025-04-24 21:36:40.424991,2025-04-24 21:36:40.980776,0 days 00:00:00.555785,26.338174199874054,0.030803073987955835,0.06807344706449628,rbf,TPESampler,COMPLETE
2382,0.29003578899315974,2025-04-24 21:36:41.176178,2025-04-24 21:36:41.798432,0 days 00:00:00.622254,96.80379739732903,0.022307163099696485,0.015542459046639015,rbf,TPESampler,COMPLETE
2383,0.30499920703324535,2025-04-24 21:36:42.012264,2025-04-24 21:36:42.574671,0 days 00:00:00.562407,21.17957688852924,0.02223997121177623,0.01783940783484787,rbf,TPESampler,COMPLETE
2384,0.48573718711651037,2025-04-24 21:36:42.771804,2025-04-24 21:36:43.305568,0 days 00:00:00.533764,3.193536775321528,0.10876919387821107,0.013095105774764665,rbf,TPESampler,COMPLETE
2385,0.33183399164206934,2025-04-24 21:36:43.496016,2025-04-24 21:36:44.047294,0 days 00:00:00.551278,5.785778833373027,0.023692928001698265,0.035127634984491084,rbf,TPESampler,COMPLETE
2386,0.303645210921339,2025-04-24 21:36:44.276876,2025-04-24 21:36:44.824427,0 days 00:00:00.547551,22.361133256634503,0.03432851246958285,0.01665025648843065,rbf,TPESampler,COMPLETE
2387,0.2995444299059771,2025-04-24 21:36:45.024361,2025-04-24 21:36:45.592467,0 days 00:00:00.568106,22.20107406130331,0.011917348552463717,0.09478187555866464,rbf,TPESampler,COMPLETE
2388,0.29291582999625104,2025-04-24 21:36:45.792380,2025-04-24 21:36:46.427826,0 days 00:00:00.635446,96.12876333530879,0.008357548876490688,0.043712386738751864,rbf,TPESampler,COMPLETE
2389,13.975917812375764,2025-04-24 21:36:46.627075,2025-04-24 21:55:18.647478,0 days 00:18:32.020403,60.30850475181364,0.006327152305464474,0.8437810693569254,poly,TPESampler,COMPLETE
2390,0.9037705798890637,2025-04-24 21:37:02.862917,2025-04-24 21:37:03.642277,0 days 00:00:00.779360,88.85417672556517,0.03862992454776552,0.020320611328338165,poly,TPESampler,COMPLETE
2391,0.4520397415716135,2025-04-24 21:37:03.834110,2025-04-24 21:37:04.350614,0 days 00:00:00.516504,26.705373930530236,0.008496303150579436,0.002067092411384224,rbf,TPESampler,COMPLETE
2392,0.4002462130508653,2025-04-24 21:37:04.535686,2025-04-24 21:37:05.058066,0 days 00:00:00.522380,5.8855836213762185,0.05716501575722685,0.014940704960020219,rbf,TPESampler,COMPLETE
2393,0.3014974688196142,2025-04-24 21:37:05.261862,2025-04-24 21:37:05.913198,0 days 00:00:00.651336,93.01290022178621,0.00970001304127705,0.013996053822522272,rbf,TPESampler,COMPLETE
2394,0.6322421409923507,2025-04-24 21:37:06.113843,2025-04-24 21:37:10.509084,0 days 00:00:04.395241,5.428800712106989,0.3531562939495394,0.999681697422853,poly,TPESampler,COMPLETE
2395,0.2978905272233223,2025-04-24 21:37:10.835934,2025-04-24 21:37:11.738362,0 days 00:00:00.902428,13.920009681755037,0.14223274827051202,0.14504944069095319,rbf,TPESampler,COMPLETE
2396,0.3034773253644838,2025-04-24 21:37:11.933044,2025-04-24 21:37:12.489094,0 days 00:00:00.556050,97.07914092823688,0.06911631965000142,0.09759405268241834,rbf,TPESampler,COMPLETE
2397,559.325804537618,2025-04-24 21:37:12.683653,2025-04-24 21:37:13.532586,0 days 00:00:00.848933,82.69092995172146,0.027333139710953237,0.035632406621670484,sigmoid,TPESampler,COMPLETE
2398,0.876409841348976,2025-04-24 21:37:13.729719,2025-04-24 21:37:14.300647,0 days 00:00:00.570928,0.010128889936653849,0.1547365673560645,0.012514242656091025,poly,TPESampler,COMPLETE
2399,0.30280131237255115,2025-04-24 21:37:14.501808,2025-04-24 21:37:15.065332,0 days 00:00:00.563524,23.605027233778692,0.014461794876787162,0.029020847446940275,rbf,TPESampler,COMPLETE
2400,0.39931544818835446,2025-04-24 21:37:15.257858,2025-04-24 21:37:15.762222,0 days 00:00:00.504364,20.260835384917975,0.036410283933552307,0.004763949968545646,rbf,TPESampler,COMPLETE
2401,0.29406280444128435,2025-04-24 21:37:15.950916,2025-04-24 21:37:16.476860,0 days 00:00:00.525944,24.90686421930953,0.03162064741745884,0.04134203138276023,rbf,TPESampler,COMPLETE
2402,0.2867800753467615,2025-04-24 21:37:16.663463,2025-04-24 21:37:17.217120,0 days 00:00:00.553657,95.68088548865666,0.06850564429483258,0.0300409337810699,rbf,TPESampler,COMPLETE
2403,0.2997250664004302,2025-04-24 21:37:17.419762,2025-04-24 21:37:18.161051,0 days 00:00:00.741289,85.37095665577512,0.05049927632674935,0.005857719731511044,rbf,TPESampler,COMPLETE
2404,0.2854505283014508,2025-04-24 21:37:18.366382,2025-04-24 21:37:18.970908,0 days 00:00:00.604526,88.6460992582291,0.02706839951275483,0.03659648721860132,rbf,TPESampler,COMPLETE
2405,0.3009197537211461,2025-04-24 21:37:19.162981,2025-04-24 21:37:19.696600,0 days 00:00:00.533619,99.00090577308357,0.04598348961784481,0.005505572981978987,rbf,TPESampler,COMPLETE
2406,0.3190612051749347,2025-04-24 21:37:20.029200,2025-04-24 21:37:20.626488,0 days 00:00:00.597288,91.47770694374756,0.018039780928916362,0.17204878482543148,rbf,TPESampler,COMPLETE
2407,0.29384646658297586,2025-04-24 21:37:20.820762,2025-04-24 21:37:21.409003,0 days 00:00:00.588241,99.92476483472844,0.02563804093038883,0.013454017808809463,rbf,TPESampler,COMPLETE
2408,14.315684798638692,2025-04-24 21:37:21.602540,2025-04-24 21:37:22.137179,0 days 00:00:00.534639,1.3855906032029135,0.01296208316974984,0.5435987602564865,sigmoid,TPESampler,COMPLETE
2409,0.29522538823624683,2025-04-24 21:37:22.339244,2025-04-24 21:37:22.866304,0 days 00:00:00.527060,25.951478928216247,0.111602762533856,0.037893161424023096,rbf,TPESampler,COMPLETE
2410,18.670172481478975,2025-04-24 21:37:23.054042,2025-04-24 21:37:23.588099,0 days 00:00:00.534057,5.159929354625166,0.02095338877032896,0.01980939736177558,sigmoid,TPESampler,COMPLETE
2411,0.2900232484922932,2025-04-24 21:37:23.776614,2025-04-24 21:37:24.332310,0 days 00:00:00.555696,29.97378370892071,0.046607985619679264,0.0459211905793388,rbf,TPESampler,COMPLETE
2412,0.3062410613962487,2025-04-24 21:37:24.530894,2025-04-24 21:37:25.103614,0 days 00:00:00.572720,26.60601558163128,0.008920664617411004,0.016802902921986298,rbf,TPESampler,COMPLETE
2413,0.29721505534259923,2025-04-24 21:37:25.290348,2025-04-24 21:37:25.837262,0 days 00:00:00.546914,24.179072192664297,0.07951619845353519,0.01702477595511179,rbf,TPESampler,COMPLETE
2414,0.36539182194800657,2025-04-24 21:37:26.026910,2025-04-24 21:37:38.988978,0 days 00:00:12.962068,55.86381585267393,0.010712847623940633,0.022120935356650634,linear,TPESampler,COMPLETE
2415,0.3022434542438811,2025-04-24 21:37:39.177785,2025-04-24 21:37:39.724960,0 days 00:00:00.547175,90.91286181463028,0.03273685407266816,0.04985845204695095,rbf,TPESampler,COMPLETE
2416,0.3602613366162778,2025-04-24 21:37:39.918133,2025-04-24 21:37:45.662252,0 days 00:00:05.744119,86.6249659979306,0.05597285896918251,0.08963400885072945,linear,TPESampler,COMPLETE
2417,0.3036838690510789,2025-04-24 21:37:46.132938,2025-04-24 21:37:47.233605,0 days 00:00:01.100667,95.7862490576177,0.04187503910640812,0.0778720388209997,rbf,TPESampler,COMPLETE
2418,0.3001160432628535,2025-04-24 21:37:47.638677,2025-04-24 21:37:48.693094,0 days 00:00:01.054417,20.28846052278029,0.06549403590873415,0.017676843191984645,rbf,TPESampler,COMPLETE
2419,0.5573224780995472,2025-04-24 21:37:49.041854,2025-04-24 21:37:50.137545,0 days 00:00:01.095691,9.398893435734017,0.11665993994645626,0.002283720584709316,rbf,TPESampler,COMPLETE
2420,0.30504546943521677,2025-04-24 21:37:50.663042,2025-04-24 21:37:51.380645,0 days 00:00:00.717603,14.503560989509719,0.02681713991979959,0.017860770696983847,rbf,TPESampler,COMPLETE
2421,0.30888205442060734,2025-04-24 21:37:51.664244,2025-04-24 21:37:52.411026,0 days 00:00:00.746782,87.27548256704097,0.015385419759635983,0.08388619637033631,rbf,TPESampler,COMPLETE
2422,0.929733171221392,2025-04-24 21:37:52.734856,2025-04-24 21:37:53.553449,0 days 00:00:00.818593,15.763960029549734,0.006104799964633639,0.0008053319842510089,poly,TPESampler,COMPLETE
2423,0.36091883233991634,2025-04-24 21:37:53.816152,2025-04-24 21:37:56.464694,0 days 00:00:02.648542,26.61462784826351,0.039267699756010056,0.031869528673667866,linear,TPESampler,COMPLETE
2424,0.3057523497103169,2025-04-24 21:37:56.776380,2025-04-24 21:37:57.519048,0 days 00:00:00.742668,99.85975154417399,0.040257880462811764,0.05426869559007263,rbf,TPESampler,COMPLETE
2425,0.7804663779140916,2025-04-24 21:37:57.802585,2025-04-24 21:37:58.412885,0 days 00:00:00.610300,0.01087155769416021,0.005933796583879236,0.12298470485285802,poly,TPESampler,COMPLETE
2426,0.3629372255273138,2025-04-24 21:37:58.615809,2025-04-24 21:38:00.156246,0 days 00:00:01.540437,11.19493172635454,0.0016915031252918266,0.9181731219760487,linear,TPESampler,COMPLETE
2427,0.3051375053447646,2025-04-24 21:38:00.351454,2025-04-24 21:38:00.905971,0 days 00:00:00.554517,33.84736975868261,0.024049000258623627,0.011978944664039298,rbf,TPESampler,COMPLETE
2428,0.36511117072109533,2025-04-24 21:38:01.100841,2025-04-24 21:38:09.868182,0 days 00:00:08.767341,78.94331407120983,0.020175487665546353,0.035897939415749036,linear,TPESampler,COMPLETE
2429,0.3164269832574425,2025-04-24 21:38:10.072561,2025-04-24 21:38:10.611499,0 days 00:00:00.538938,25.470618001291484,0.25277750472522514,0.06410399911378534,rbf,TPESampler,COMPLETE
2430,0.3144451668485071,2025-04-24 21:38:10.971843,2025-04-24 21:38:11.606929,0 days 00:00:00.635086,98.54603526585738,0.03968396712308859,0.13984123290832887,rbf,TPESampler,COMPLETE
2431,0.3279111954526532,2025-04-24 21:38:11.808182,2025-04-24 21:38:12.350145,0 days 00:00:00.541963,4.410921989556884,0.024545562651636176,0.08041803123646943,rbf,TPESampler,COMPLETE
2432,0.2957392611300904,2025-04-24 21:38:12.553904,2025-04-24 21:38:13.129018,0 days 00:00:00.575114,30.654887800382923,0.015346589665349807,0.06951413020011221,rbf,TPESampler,COMPLETE
2433,0.3039089268366034,2025-04-24 21:38:13.327629,2025-04-24 21:38:13.876882,0 days 00:00:00.549253,23.530966832326232,0.02166861406311464,0.01703162440773065,rbf,TPESampler,COMPLETE
2434,0.2988372861400838,2025-04-24 21:38:14.099415,2025-04-24 21:38:14.677980,0 days 00:00:00.578565,19.665832453912504,0.07332409708043813,0.07395098435788688,rbf,TPESampler,COMPLETE
2435,153.27759176062293,2025-04-24 21:38:14.868259,2025-04-24 21:38:15.390935,0 days 00:00:00.522676,18.986698302233492,0.00823366930157042,0.054982858691145886,sigmoid,TPESampler,COMPLETE
2436,0.2817504256551878,2025-04-24 21:38:15.584581,2025-04-24 21:38:16.181876,0 days 00:00:00.597295,91.91632283586769,0.026317183844404245,0.02566527445767049,rbf,TPESampler,COMPLETE
2437,0.31109100667801476,2025-04-24 21:38:16.393035,2025-04-24 21:38:16.961663,0 days 00:00:00.568628,24.29755367867937,0.049905449234275416,0.009396097420585399,rbf,TPESampler,COMPLETE
2438,0.3404667121269954,2025-04-24 21:38:17.159942,2025-04-24 21:38:17.720489,0 days 00:00:00.560547,24.316544912596378,0.021278353806515337,0.007949489877373083,rbf,TPESampler,COMPLETE
2439,0.30569145358998395,2025-04-24 21:38:18.171662,2025-04-24 21:38:18.735656,0 days 00:00:00.563994,29.82992255053841,0.019087584229660497,0.013602367483686961,rbf,TPESampler,COMPLETE
2440,0.28456592383660473,2025-04-24 21:38:18.946830,2025-04-24 21:38:19.649468,0 days 00:00:00.702638,95.63982048303669,0.01102715878824466,0.0291688778601259,rbf,TPESampler,COMPLETE
2441,0.30608622027960336,2025-04-24 21:38:19.851237,2025-04-24 21:38:20.412184,0 days 00:00:00.560947,78.07535878854472,0.011825724028828696,0.007546310643085658,rbf,TPESampler,COMPLETE
2442,0.29143043513671896,2025-04-24 21:38:20.608789,2025-04-24 21:38:21.155133,0 days 00:00:00.546344,19.445467526277383,0.011959057337214911,0.05715482447013145,rbf,TPESampler,COMPLETE
2443,0.295430023446154,2025-04-24 21:38:21.344445,2025-04-24 21:38:21.903438,0 days 00:00:00.558993,96.37366197298604,0.03773968962449959,0.012462168020938096,rbf,TPESampler,COMPLETE
2444,0.292977909654656,2025-04-24 21:38:22.092070,2025-04-24 21:38:22.645663,0 days 00:00:00.553593,29.502708439501692,0.009924912114995509,0.0375598015827238,rbf,TPESampler,COMPLETE
2445,37.77139125605834,2025-04-24 21:38:22.843328,2025-04-24 21:38:23.374630,0 days 00:00:00.531302,17.76494788397952,0.027585256089606776,0.01298891316101289,sigmoid,TPESampler,COMPLETE
2446,0.3041088611876717,2025-04-24 21:38:23.567967,2025-04-24 21:38:24.123610,0 days 00:00:00.555643,16.815467654007918,0.03725047205503656,0.03584011944687821,rbf,TPESampler,COMPLETE
2447,0.3032075979552917,2025-04-24 21:38:24.312458,2025-04-24 21:38:24.905386,0 days 00:00:00.592928,84.35998794207157,0.00492008451168635,0.013256101047791938,rbf,TPESampler,COMPLETE
2448,0.28856246832188787,2025-04-24 21:38:25.102435,2025-04-24 21:38:25.695605,0 days 00:00:00.593170,88.28272786422924,0.013272289511409569,0.039731568931798585,rbf,TPESampler,COMPLETE
2449,0.3079669702667576,2025-04-24 21:38:25.908417,2025-04-24 21:38:26.490891,0 days 00:00:00.582474,26.400228107374108,0.0115881518317202,0.01198396188189266,rbf,TPESampler,COMPLETE
2450,62.6901963332356,2025-04-24 21:38:26.722856,2025-04-24 21:38:27.262936,0 days 00:00:00.540080,13.402085305832358,0.2873509258388285,0.025214869602448148,sigmoid,TPESampler,COMPLETE
2451,0.29474173983821655,2025-04-24 21:38:27.462114,2025-04-24 21:38:28.027917,0 days 00:00:00.565803,98.34769506609398,0.07793490729187763,0.0042686088066206255,rbf,TPESampler,COMPLETE
2452,0.3035198846204467,2025-04-24 21:38:28.223692,2025-04-24 21:38:28.771531,0 days 00:00:00.547839,16.3561816360425,0.04661464797408256,0.016396290532471425,rbf,TPESampler,COMPLETE
2453,0.4050575616516425,2025-04-24 21:38:28.967361,2025-04-24 21:38:29.546809,0 days 00:00:00.579448,4.384945604696243,0.02476263175776088,0.019926521793803494,rbf,TPESampler,COMPLETE
2454,0.5471728170652651,2025-04-24 21:38:29.755569,2025-04-24 21:38:30.313924,0 days 00:00:00.558355,4.8654549546662205,0.008999646420512293,0.004943053333361259,rbf,TPESampler,COMPLETE
2455,0.6603141953721102,2025-04-24 21:38:30.528748,2025-04-24 21:38:31.068577,0 days 00:00:00.539829,17.89020490959374,0.06729389839010373,0.00023092651005951863,rbf,TPESampler,COMPLETE
2456,0.3028081372098117,2025-04-24 21:38:31.267264,2025-04-24 21:38:31.830161,0 days 00:00:00.562897,23.288633646542646,0.039323025081426606,0.15866734274087824,rbf,TPESampler,COMPLETE
2457,0.7677778738804927,2025-04-24 21:38:32.038931,2025-04-24 21:38:32.602570,0 days 00:00:00.563639,18.723431151166466,0.0259129927435996,0.018779843138122865,poly,TPESampler,COMPLETE
2458,0.3003938818041885,2025-04-24 21:38:32.807066,2025-04-24 21:38:33.381742,0 days 00:00:00.574676,99.22696809576834,0.06988708026887637,0.03693535802548178,rbf,TPESampler,COMPLETE
2459,0.30729475909328047,2025-04-24 21:38:33.591886,2025-04-24 21:38:34.205105,0 days 00:00:00.613219,89.66738391875917,0.020893728149425004,0.05792761126594049,rbf,TPESampler,COMPLETE
2460,0.9766485145722079,2025-04-24 21:38:34.405811,2025-04-24 21:38:34.942078,0 days 00:00:00.536267,0.004955364535172019,0.004524494627811259,0.9129320321008185,sigmoid,TPESampler,COMPLETE
2461,0.2941301136193956,2025-04-24 21:38:35.141401,2025-04-24 21:38:35.826932,0 days 00:00:00.685531,26.344627666519408,0.02112698919896991,0.03898757652866461,rbf,TPESampler,COMPLETE
2462,0.29907110378595364,2025-04-24 21:38:36.007916,2025-04-24 21:38:36.559975,0 days 00:00:00.552059,97.30769816272246,0.04144412400178799,0.007601891187390436,rbf,TPESampler,COMPLETE
2463,0.2893297735327032,2025-04-24 21:38:36.767740,2025-04-24 21:38:37.389992,0 days 00:00:00.622252,90.47277977929257,0.023502390662368935,0.017251270794040055,rbf,TPESampler,COMPLETE
2464,0.3053020754354497,2025-04-24 21:38:37.587098,2025-04-24 21:38:38.138708,0 days 00:00:00.551610,23.92605296819608,0.04184406770875375,0.022515262506789833,rbf,TPESampler,COMPLETE
2465,0.3116517652977146,2025-04-24 21:38:38.333001,2025-04-24 21:38:38.927366,0 days 00:00:00.594365,97.89157300944406,0.011083040236699421,0.062091372239712804,rbf,TPESampler,COMPLETE
2466,0.2995736163968695,2025-04-24 21:38:39.119276,2025-04-24 21:38:39.703372,0 days 00:00:00.584096,90.49955316577447,0.015587351268359228,0.013132656660486294,rbf,TPESampler,COMPLETE
2467,0.2880388852057449,2025-04-24 21:38:39.906944,2025-04-24 21:38:40.518654,0 days 00:00:00.611710,91.75163069548053,0.02065932119323236,0.03835806601614472,rbf,TPESampler,COMPLETE
2468,0.2908891103387791,2025-04-24 21:38:40.719643,2025-04-24 21:38:41.280656,0 days 00:00:00.561013,96.40908708258068,0.08319006893732481,0.03108068475226976,rbf,TPESampler,COMPLETE
2469,0.39081876816074007,2025-04-24 21:38:41.473116,2025-04-24 21:38:42.004478,0 days 00:00:00.531362,2.756273381748291,0.0011001361439791557,0.04318742956205738,rbf,TPESampler,COMPLETE
2470,0.3000242779093732,2025-04-24 21:38:42.210467,2025-04-24 21:38:42.808171,0 days 00:00:00.597704,25.272653307921086,0.01718224206458473,0.030370235440273046,rbf,TPESampler,COMPLETE
2471,0.3045585634681021,2025-04-24 21:38:43.011489,2025-04-24 21:38:43.558075,0 days 00:00:00.546586,25.277345954990395,0.042042977009381005,0.022458841448577117,rbf,TPESampler,COMPLETE
2472,27.1816908570431,2025-04-24 21:38:43.746908,2025-04-24 21:38:44.306109,0 days 00:00:00.559201,21.494863198146643,0.01143030353188292,0.009619102584243944,sigmoid,TPESampler,COMPLETE
2473,0.3018785821215853,2025-04-24 21:38:44.508275,2025-04-24 21:38:45.074242,0 days 00:00:00.565967,94.00899496919176,0.041061185743239866,0.009512930550365232,rbf,TPESampler,COMPLETE
2474,0.30506903763039933,2025-04-24 21:38:45.267669,2025-04-24 21:38:45.803835,0 days 00:00:00.536166,98.97105911843835,0.07265244655569673,0.10543697403109897,rbf,TPESampler,COMPLETE
2475,0.3027805966590374,2025-04-24 21:38:46.007400,2025-04-24 21:38:46.569001,0 days 00:00:00.561601,95.34851419553766,0.026384292461957528,0.008096695053719563,rbf,TPESampler,COMPLETE
