number,value,datetime_start,datetime_complete,duration,params_C,params_epsilon,params_gamma,params_kernel,system_attrs_auto:sampler,state
1533,0.6561098169939464,2025-04-24 21:23:05.358966,2025-04-24 21:23:05.867044,0 days 00:00:00.508078,30.648615750447348,0.0013468406461802035,0.00015682512463835506,rbf,TPESampler,COMPLETE
1534,0.9979645234275917,2025-04-24 21:23:05.791635,2025-04-24 21:23:06.278081,0 days 00:00:00.486446,0.05047850719552764,0.12295444207885531,0.000229059018575377,poly,TPESampler,COMPLETE
1535,0.30019757677054054,2025-04-24 21:23:06.118549,2025-04-24 21:23:06.688965,0 days 00:00:00.570416,94.63763270658946,0.08012504377871534,0.13276142460712648,rbf,TPESampler,COMPLETE
1536,0.30401612074464024,2025-04-24 21:23:06.464703,2025-04-24 21:23:06.995102,0 days 00:00:00.530399,25.201886066562135,0.03654433822289713,0.024460093220846645,rbf,TPESampler,COMPLETE
1537,0.9804010206491065,2025-04-24 21:23:06.926759,2025-04-24 21:23:07.480237,0 days 00:00:00.553478,0.0012467043044534416,0.15737322071251825,0.031664251542113414,sigmoid,TPESampler,COMPLETE
1538,0.29391144447332723,2025-04-24 21:23:07.235756,2025-04-24 21:23:07.758837,0 days 00:00:00.523081,85.09580057523338,0.17288777719450493,0.012124047735975843,rbf,TPESampler,COMPLETE
1539,0.29570207689702344,2025-04-24 21:23:07.715701,2025-04-24 21:23:08.458334,0 days 00:00:00.742633,19.5632889403641,0.030697986513452902,0.0470318341349711,rbf,TPESampler,COMPLETE
1540,0.3610231164478747,2025-04-24 21:23:08.201487,2025-04-24 21:23:11.567505,0 days 00:00:03.366018,23.44986746435122,0.03514866306250528,0.02128917958123605,linear,TPESampler,COMPLETE
1541,0.43505005087364557,2025-04-24 21:23:08.692106,2025-04-24 21:23:09.397340,0 days 00:00:00.705234,13.257660749830187,0.03098712644106767,0.0047084352418596395,rbf,TPESampler,COMPLETE
1542,0.2839186361205346,2025-04-24 21:23:09.596472,2025-04-24 21:23:10.165819,0 days 00:00:00.569347,97.391166338781,0.059148298677675896,0.020904633391109147,rbf,TPESampler,COMPLETE
1543,0.38847096617614757,2025-04-24 21:23:10.379177,2025-04-24 21:23:10.962456,0 days 00:00:00.583279,13.133038603499003,0.005034912641246066,0.008658963590623354,rbf,TPESampler,COMPLETE
1544,0.358650447849126,2025-04-24 21:23:11.160068,2025-04-24 21:23:11.814883,0 days 00:00:00.654815,1.8435503790412213,0.10168663534601274,0.00010038026111131802,linear,TPESampler,COMPLETE
1545,0.31369215599717537,2025-04-24 21:23:11.774947,2025-04-24 21:23:12.260088,0 days 00:00:00.485141,25.683553926171967,0.014362233627936222,0.00955834077400174,rbf,TPESampler,COMPLETE
1546,0.28513165644927374,2025-04-24 21:23:12.057772,2025-04-24 21:23:12.639116,0 days 00:00:00.581344,99.80181946839632,0.012024650522994123,0.026647100959026424,rbf,TPESampler,COMPLETE
1547,0.29492948230733673,2025-04-24 21:23:12.488827,2025-04-24 21:23:13.073257,0 days 00:00:00.584430,98.79654158007294,0.014335764551184372,0.015506347253377035,rbf,TPESampler,COMPLETE
1548,0.2955247481539009,2025-04-24 21:23:12.841660,2025-04-24 21:23:13.437174,0 days 00:00:00.595514,93.75668099291578,0.06400644013544032,0.03544457714894425,rbf,TPESampler,COMPLETE
1549,0.2934980232539308,2025-04-24 21:23:13.299136,2025-04-24 21:23:13.839063,0 days 00:00:00.539927,96.60279095993965,0.025474638592419635,0.042598142283790504,rbf,TPESampler,COMPLETE
1550,0.2978258274150653,2025-04-24 21:23:13.618418,2025-04-24 21:23:14.128855,0 days 00:00:00.510437,24.18203825929359,0.051628181838321574,0.03928533381207161,rbf,TPESampler,COMPLETE
1551,0.3894369190368413,2025-04-24 21:23:14.069081,2025-04-24 21:23:14.561114,0 days 00:00:00.492033,5.491251969414282,0.06623442241377277,0.01845076489596083,rbf,TPESampler,COMPLETE
1552,0.39135673569995516,2025-04-24 21:23:14.355422,2025-04-24 21:23:14.842220,0 days 00:00:00.486798,19.282939997783153,0.015107461917562192,0.005401259926284066,rbf,TPESampler,COMPLETE
1553,0.8443233170031744,2025-04-24 21:23:14.787186,2025-04-24 21:23:15.263344,0 days 00:00:00.476158,0.18925647697984394,0.08562891196429899,0.0012349973336894455,sigmoid,TPESampler,COMPLETE
1554,0.4031150630292954,2025-04-24 21:23:15.052680,2025-04-24 21:23:15.532175,0 days 00:00:00.479495,3.1586632055363832,0.02899680740018916,0.02971140889804956,rbf,TPESampler,COMPLETE
1555,0.2836724323844991,2025-04-24 21:23:15.490507,2025-04-24 21:23:16.094724,0 days 00:00:00.604217,99.1328650056932,0.04453565494655805,0.01948001312874352,rbf,TPESampler,COMPLETE
1556,0.294585497850544,2025-04-24 21:23:15.760689,2025-04-24 21:23:16.270080,0 days 00:00:00.509391,17.0194245149186,0.03462006332155557,0.12964310019916636,rbf,TPESampler,COMPLETE
1557,0.30785328911649595,2025-04-24 21:23:16.279475,2025-04-24 21:23:16.851914,0 days 00:00:00.572439,99.94485394728804,0.028302717738395357,0.004619348381124007,rbf,TPESampler,COMPLETE
1558,0.2908136507807775,2025-04-24 21:23:16.445712,2025-04-24 21:23:17.012053,0 days 00:00:00.566341,20.751011146215582,0.010198582621946919,0.05589199156224592,rbf,TPESampler,COMPLETE
1559,0.4113371740532172,2025-04-24 21:23:17.049543,2025-04-24 21:23:17.814855,0 days 00:00:00.765312,14.461526226055158,0.06773930747593111,0.005326777094694115,rbf,TPESampler,COMPLETE
1560,0.2894492161701345,2025-04-24 21:23:17.451393,2025-04-24 21:23:18.046432,0 days 00:00:00.595039,84.32894635304646,0.12006000931154925,0.02284517010706454,rbf,TPESampler,COMPLETE
1561,0.685027685546946,2025-04-24 21:23:18.012910,2025-04-24 21:23:18.795408,0 days 00:00:00.782498,5.588475292186958,0.34881164812186594,0.069208826758459,poly,TPESampler,COMPLETE
1562,0.3057898086662768,2025-04-24 21:23:18.276614,2025-04-24 21:23:18.819640,0 days 00:00:00.543026,24.987586885920987,0.018196120103854064,0.015701669678929154,rbf,TPESampler,COMPLETE
1563,0.28678084570672036,2025-04-24 21:23:18.943709,2025-04-24 21:23:19.643797,0 days 00:00:00.700088,77.02367280948232,0.0024276647411199392,0.030515345312902564,rbf,TPESampler,COMPLETE
1564,0.29116336548983435,2025-04-24 21:23:18.979720,2025-04-24 21:23:19.693580,0 days 00:00:00.713860,21.860952861904295,0.016766588916676987,0.061134045321026106,rbf,TPESampler,COMPLETE
1565,0.29654147178627566,2025-04-24 21:23:19.800932,2025-04-24 21:23:20.396975,0 days 00:00:00.596043,22.88156613806944,0.025030523348982227,0.1280223415636515,rbf,TPESampler,COMPLETE
1566,0.30459114823713873,2025-04-24 21:23:19.916134,2025-04-24 21:23:20.515331,0 days 00:00:00.599197,16.78774280517612,0.10385333823803437,0.018578413631247608,rbf,TPESampler,COMPLETE
1567,0.30444544744685276,2025-04-24 21:23:20.569141,2025-04-24 21:23:21.190377,0 days 00:00:00.621236,25.035627696252412,0.026079478118988676,0.02391973733543236,rbf,TPESampler,COMPLETE
1568,0.894908449410889,2025-04-24 21:23:20.697490,2025-04-24 21:23:21.431352,0 days 00:00:00.733862,14.923761750840304,0.01795180472185369,0.028631990754313233,poly,TPESampler,COMPLETE
1569,0.29960854729120334,2025-04-24 21:23:21.386353,2025-04-24 21:23:21.910778,0 days 00:00:00.524425,24.585210528486346,0.059471235063847466,0.013298610170978999,rbf,TPESampler,COMPLETE
1570,0.2822232250270752,2025-04-24 21:23:21.667719,2025-04-24 21:23:22.267145,0 days 00:00:00.599426,98.43265017024822,0.035071942375249555,0.0229808204859109,rbf,TPESampler,COMPLETE
1571,0.40733040138486065,2025-04-24 21:23:22.137642,2025-04-24 21:23:22.611982,0 days 00:00:00.474340,0.2048099382453781,0.4027152187680797,0.00019049545615214768,linear,TPESampler,COMPLETE
1572,0.29791499378466185,2025-04-24 21:23:22.447810,2025-04-24 21:23:22.993008,0 days 00:00:00.545198,32.05330305831041,0.011769578799316378,0.029612927008059578,rbf,TPESampler,COMPLETE
1573,0.2842757278720367,2025-04-24 21:23:22.858568,2025-04-24 21:23:23.394749,0 days 00:00:00.536181,85.53440722911735,0.0369966135014431,0.033308948047657175,rbf,TPESampler,COMPLETE
1574,0.29431218630416534,2025-04-24 21:23:23.195303,2025-04-24 21:23:23.694249,0 days 00:00:00.498946,22.012357965931272,0.031933050868343416,0.0752024677539452,rbf,TPESampler,COMPLETE
1575,920.4630841528273,2025-04-24 21:23:23.646566,2025-04-24 21:23:24.164718,0 days 00:00:00.518152,82.75949724961531,0.39358922927597195,0.3651296259764711,sigmoid,TPESampler,COMPLETE
1576,0.9996133458849809,2025-04-24 21:23:23.923050,2025-04-24 21:23:24.420841,0 days 00:00:00.497791,0.6736768266939238,0.029827164321238355,0.00011902832685716414,poly,TPESampler,COMPLETE
1577,0.2937013005287912,2025-04-24 21:23:24.364474,2025-04-24 21:23:24.912892,0 days 00:00:00.548418,99.53207096762969,0.01987587864270565,0.014173986941822724,rbf,TPESampler,COMPLETE
1578,0.3180595248700547,2025-04-24 21:23:24.685334,2025-04-24 21:23:25.228506,0 days 00:00:00.543172,97.10415275334542,0.011887121729028947,0.12371759240539812,rbf,TPESampler,COMPLETE
1579,0.2888594680163324,2025-04-24 21:23:25.152890,2025-04-24 21:23:25.683333,0 days 00:00:00.530443,95.65662207658615,0.05202275690747321,0.01642008702969313,rbf,TPESampler,COMPLETE
1580,0.7952721002036315,2025-04-24 21:23:25.462713,2025-04-24 21:23:25.958790,0 days 00:00:00.496077,84.74137951974616,0.10417108100717784,0.005168449587716201,poly,TPESampler,COMPLETE
1581,42.97939963686175,2025-04-24 21:23:25.913183,2025-04-24 21:23:26.485852,0 days 00:00:00.572669,10.820215020127431,0.037032091183376865,0.021107344724997205,sigmoid,TPESampler,COMPLETE
1582,0.36507228566984795,2025-04-24 21:23:26.170478,2025-04-24 21:23:33.395880,0 days 00:00:07.225402,60.31654652023313,0.01842878938907634,0.07829132600364312,linear,TPESampler,COMPLETE
1583,0.287714512538248,2025-04-24 21:23:26.679053,2025-04-24 21:23:27.323782,0 days 00:00:00.644729,94.00374597812086,0.017121363583572417,0.02066234319384918,rbf,TPESampler,COMPLETE
1584,0.3268400982674881,2025-04-24 21:23:27.508441,2025-04-24 21:23:28.018883,0 days 00:00:00.510442,19.728548056045714,0.04314723678670409,0.010178258620794802,rbf,TPESampler,COMPLETE
1585,0.3090283393471138,2025-04-24 21:23:28.206621,2025-04-24 21:23:28.768347,0 days 00:00:00.561726,95.49207324245981,0.015556377022998521,0.07145742272074679,rbf,TPESampler,COMPLETE
1586,0.28576966121585995,2025-04-24 21:23:28.962879,2025-04-24 21:23:29.490699,0 days 00:00:00.527820,94.20817342575774,0.03866510736629416,0.034493449333530504,rbf,TPESampler,COMPLETE
1587,0.3293213627734589,2025-04-24 21:23:29.668153,2025-04-24 21:23:30.159549,0 days 00:00:00.491396,99.8724646166248,0.06517609566281982,0.002481268525814184,rbf,TPESampler,COMPLETE
1588,0.37256534790606244,2025-04-24 21:23:30.341106,2025-04-24 21:23:30.830635,0 days 00:00:00.489529,17.871496737357603,0.01807674427289176,0.007588827819467794,rbf,TPESampler,COMPLETE
1589,0.3053437821167482,2025-04-24 21:23:31.009909,2025-04-24 21:23:31.545341,0 days 00:00:00.535432,97.48935534161001,0.07521359968831033,0.04803837828733142,rbf,TPESampler,COMPLETE
1590,0.30721459759516045,2025-04-24 21:23:31.729360,2025-04-24 21:23:32.352494,0 days 00:00:00.623134,16.2790321763341,0.022766117513998218,0.02081712319385884,rbf,TPESampler,COMPLETE
1591,0.28264936289211906,2025-04-24 21:23:32.534046,2025-04-24 21:23:33.076892,0 days 00:00:00.542846,96.90290824219723,0.0251808835431667,0.02225402827359817,rbf,TPESampler,COMPLETE
1592,0.6845976032536615,2025-04-24 21:23:33.271921,2025-04-24 21:23:33.776854,0 days 00:00:00.504933,0.38047178320778013,0.1336455463035049,0.5490977348850219,rbf,TPESampler,COMPLETE
1593,0.29699143548940593,2025-04-24 21:23:33.597653,2025-04-24 21:23:34.164324,0 days 00:00:00.566671,23.418896031554297,0.03252324673201219,0.04013303477445387,rbf,TPESampler,COMPLETE
1594,0.28694370049566376,2025-04-24 21:23:33.961051,2025-04-24 21:23:34.530129,0 days 00:00:00.569078,99.17872814257495,0.038728155851490836,0.016949233515079088,rbf,TPESampler,COMPLETE
1595,0.30313675570556353,2025-04-24 21:23:34.398977,2025-04-24 21:23:34.930442,0 days 00:00:00.531465,12.509562542179609,0.06320586476637027,0.050494128033759106,rbf,TPESampler,COMPLETE
1596,0.772432551816134,2025-04-24 21:23:34.726471,2025-04-24 21:23:35.235774,0 days 00:00:00.509303,12.364045677166137,0.11008449810691957,0.012428494110605624,poly,TPESampler,COMPLETE
1597,0.30720606672343376,2025-04-24 21:23:35.163679,2025-04-24 21:23:35.858243,0 days 00:00:00.694564,94.06304488423407,0.006246611682153685,0.0531224374184875,rbf,TPESampler,COMPLETE
1598,0.282513217684564,2025-04-24 21:23:35.515730,2025-04-24 21:23:36.031784,0 days 00:00:00.516054,96.39765281698996,0.04011223783976254,0.02131936397675858,rbf,TPESampler,COMPLETE
1599,0.38086854512429863,2025-04-24 21:23:36.037530,2025-04-24 21:23:36.518423,0 days 00:00:00.480893,33.78866537615627,0.030582011133640098,0.003754397435634718,rbf,TPESampler,COMPLETE
1600,0.4110088981099224,2025-04-24 21:23:36.197246,2025-04-24 21:23:36.743747,0 days 00:00:00.546501,99.6809067093378,0.02348541934682694,0.4436665613484355,rbf,TPESampler,COMPLETE
1601,0.30374255515003423,2025-04-24 21:23:36.709423,2025-04-24 21:23:37.185333,0 days 00:00:00.475910,26.727847021751142,0.01999360130076444,0.023387775183686975,rbf,TPESampler,COMPLETE
1602,0.9187948894842195,2025-04-24 21:23:36.949885,2025-04-24 21:23:37.472135,0 days 00:00:00.522250,0.008810846843012891,0.008868232281103977,0.020745067218719798,rbf,TPESampler,COMPLETE
1603,0.2836799502883191,2025-04-24 21:23:37.433101,2025-04-24 21:23:38.026600,0 days 00:00:00.593499,93.79979156141896,0.035888692862298635,0.032485332607592426,rbf,TPESampler,COMPLETE
1604,88.49424711103242,2025-04-24 21:23:37.699775,2025-04-24 21:23:38.259738,0 days 00:00:00.559963,11.381142331290496,0.015960148947666678,0.10676824760265835,sigmoid,TPESampler,COMPLETE
1605,0.3489854854002718,2025-04-24 21:23:38.214591,2025-04-24 21:23:38.721263,0 days 00:00:00.506672,14.96724755039394,0.039192881941218866,0.011161768651977898,rbf,TPESampler,COMPLETE
1606,0.6135024936169677,2025-04-24 21:23:38.520427,2025-04-24 21:23:39.005254,0 days 00:00:00.484827,0.02251833917380091,0.006637871549912101,0.006708193313128262,linear,TPESampler,COMPLETE
1607,0.3335881156323457,2025-04-24 21:23:38.958038,2025-04-24 21:23:39.472871,0 days 00:00:00.514833,23.43652207561006,0.06653512174948006,0.007706822057357849,rbf,TPESampler,COMPLETE
1608,0.30395710988026187,2025-04-24 21:23:39.238085,2025-04-24 21:23:39.835097,0 days 00:00:00.597012,92.95437208953356,0.01835138192617898,0.007407827606529627,rbf,TPESampler,COMPLETE
1609,0.3004646298879667,2025-04-24 21:23:39.689355,2025-04-24 21:23:40.226605,0 days 00:00:00.537250,88.64667943902083,0.008287261765642796,0.016250918725401187,rbf,TPESampler,COMPLETE
1610,0.3010162162087419,2025-04-24 21:23:40.013119,2025-04-24 21:23:40.527118,0 days 00:00:00.513999,89.99153781496287,0.050947607853672486,0.005090891994237273,rbf,TPESampler,COMPLETE
1611,0.31443690419459813,2025-04-24 21:23:40.458102,2025-04-24 21:23:40.955626,0 days 00:00:00.497524,97.42589518299775,0.016954804631512225,0.0040792994056402816,rbf,TPESampler,COMPLETE
1612,0.30455945745972246,2025-04-24 21:23:40.753171,2025-04-24 21:23:41.303140,0 days 00:00:00.549969,16.97079483142023,0.010528273563938173,0.0399644318632659,rbf,TPESampler,COMPLETE
1613,0.29797171441947906,2025-04-24 21:23:41.173986,2025-04-24 21:23:41.720683,0 days 00:00:00.546697,95.79480962345082,0.024829450956302793,0.012144497722755762,rbf,TPESampler,COMPLETE
1614,0.28515672583635654,2025-04-24 21:23:41.496693,2025-04-24 21:23:42.095970,0 days 00:00:00.599277,95.901638792749,0.02159373616586812,0.020838661957916907,rbf,TPESampler,COMPLETE
1615,0.2844746160721538,2025-04-24 21:23:41.968363,2025-04-24 21:23:42.523256,0 days 00:00:00.554893,99.70316839580262,0.009099439695913918,0.03145623792056102,rbf,TPESampler,COMPLETE
1616,0.2977955353113612,2025-04-24 21:23:42.298511,2025-04-24 21:23:42.797893,0 days 00:00:00.499382,29.133726672960343,0.10085523895907979,0.14350993054880473,rbf,TPESampler,COMPLETE
1617,0.3060891074179303,2025-04-24 21:23:42.745610,2025-04-24 21:23:43.243125,0 days 00:00:00.497515,17.320634567869135,0.04431554891872178,0.030767839099314947,rbf,TPESampler,COMPLETE
1618,0.3653524242326276,2025-04-24 21:23:43.011943,2025-04-24 21:23:49.278327,0 days 00:00:06.266384,98.90962493066749,0.017894937424425786,0.04178342911722712,linear,TPESampler,COMPLETE
1619,0.46904346466790175,2025-04-24 21:23:43.483798,2025-04-24 21:23:43.986920,0 days 00:00:00.503122,4.092989980906009,0.019670789324372738,0.013026619371423659,rbf,TPESampler,COMPLETE
1620,0.29632086947913183,2025-04-24 21:23:44.167046,2025-04-24 21:23:44.793607,0 days 00:00:00.626561,92.36155095367073,0.02007921245677376,0.04617134296547521,rbf,TPESampler,COMPLETE
1621,0.313968947745331,2025-04-24 21:23:44.981416,2025-04-24 21:23:45.482172,0 days 00:00:00.500756,18.996129336044362,0.15775703228285584,0.020417095435245107,rbf,TPESampler,COMPLETE
1622,0.28265893259614516,2025-04-24 21:23:45.660008,2025-04-24 21:23:46.228507,0 days 00:00:00.568499,93.79398923896886,0.021665328810503717,0.02743985851503557,rbf,TPESampler,COMPLETE
1623,0.2954604418632632,2025-04-24 21:23:46.411767,2025-04-24 21:23:46.913963,0 days 00:00:00.502196,22.27764214250782,0.04826398905480276,0.06519176909670246,rbf,TPESampler,COMPLETE
1624,0.3429467882010241,2025-04-24 21:23:47.097021,2025-04-24 21:23:47.605478,0 days 00:00:00.508457,17.1128065988254,0.03877305172172493,0.010369155938113129,rbf,TPESampler,COMPLETE
1625,0.2885947965728039,2025-04-24 21:23:47.797536,2025-04-24 21:23:48.323902,0 days 00:00:00.526366,94.87117094019239,0.09148286002653717,0.01739179628432312,rbf,TPESampler,COMPLETE
1626,0.3185365260267117,2025-04-24 21:23:48.504909,2025-04-24 21:23:49.021711,0 days 00:00:00.516802,26.17611269381609,0.02946412468182263,0.21086765696805176,rbf,TPESampler,COMPLETE
1627,0.3037541490873263,2025-04-24 21:23:49.235233,2025-04-24 21:23:49.844299,0 days 00:00:00.609066,95.20494023377668,0.03917106707277266,0.0768690926166515,rbf,TPESampler,COMPLETE
1628,0.7626372028938668,2025-04-24 21:23:49.491418,2025-04-24 21:23:50.056097,0 days 00:00:00.564679,0.0012110468830632943,0.18126715275441876,0.30549590630797124,poly,TPESampler,COMPLETE
1629,0.28230012168928104,2025-04-24 21:23:50.029283,2025-04-24 21:23:50.649526,0 days 00:00:00.620243,98.56246037460328,0.03076907802192247,0.02747797277721214,rbf,TPESampler,COMPLETE
1630,0.3048377868915166,2025-04-24 21:23:50.256555,2025-04-24 21:23:50.774903,0 days 00:00:00.518348,21.659851005290523,0.039935483484343844,0.01453143498648985,rbf,TPESampler,COMPLETE
1631,1.0000127839645059,2025-04-24 21:23:50.826394,2025-04-24 21:23:51.476406,0 days 00:00:00.650012,0.020669021804041905,0.01262507009887388,0.00155250709269931,poly,TPESampler,COMPLETE
1632,0.33823953331186113,2025-04-24 21:23:50.912742,2025-04-24 21:23:51.650032,0 days 00:00:00.737290,3.9036030375847206,0.0146862023265946,0.06992249051170168,rbf,TPESampler,COMPLETE
1633,0.3088587799211133,2025-04-24 21:23:51.661770,2025-04-24 21:23:52.220792,0 days 00:00:00.559022,91.55256846221171,0.19923947987044985,0.14957594192717064,rbf,TPESampler,COMPLETE
1634,0.2934778205825644,2025-04-24 21:23:51.837527,2025-04-24 21:23:52.450663,0 days 00:00:00.613136,98.26047077606574,0.0885546761664414,0.011573952023406884,rbf,TPESampler,COMPLETE
1635,0.30671165304401127,2025-04-24 21:23:52.402543,2025-04-24 21:23:53.049136,0 days 00:00:00.646593,94.15146119798037,0.02386400850367228,0.05742904107718278,rbf,TPESampler,COMPLETE
1636,0.293330213595501,2025-04-24 21:23:52.678752,2025-04-24 21:23:53.202694,0 days 00:00:00.523942,97.61576937905879,0.060091976127110515,0.012231931906963723,rbf,TPESampler,COMPLETE
1637,0.2876525589919341,2025-04-24 21:23:53.251538,2025-04-24 21:23:53.837566,0 days 00:00:00.586028,95.74377125672784,0.015620601149021345,0.02120932290731329,rbf,TPESampler,COMPLETE
1638,0.2947916137740326,2025-04-24 21:23:53.429823,2025-04-24 21:23:53.971975,0 days 00:00:00.542152,90.66424041740582,0.12221759364562634,0.03382593753669561,rbf,TPESampler,COMPLETE
1639,0.883148923719225,2025-04-24 21:23:54.032745,2025-04-24 21:23:57.164477,0 days 00:00:03.131732,21.927552933018962,0.02650206274643063,0.06210036737495068,poly,TPESampler,COMPLETE
1640,0.38022930583457754,2025-04-24 21:23:54.166117,2025-04-24 21:23:54.816245,0 days 00:00:00.650128,15.788933752540308,0.010109279452443429,0.007862710545319757,rbf,TPESampler,COMPLETE
1641,0.342177466555488,2025-04-24 21:23:54.995792,2025-04-24 21:23:55.513944,0 days 00:00:00.518152,15.794288513535419,0.028728906451858358,0.01133555561555642,rbf,TPESampler,COMPLETE
1642,0.29294645846077594,2025-04-24 21:23:55.700418,2025-04-24 21:23:56.207204,0 days 00:00:00.506786,21.383361222166606,0.07450405422721014,0.04984065587447745,rbf,TPESampler,COMPLETE
1643,0.2844875254121095,2025-04-24 21:23:56.398385,2025-04-24 21:23:56.918932,0 days 00:00:00.520547,95.60301646195603,0.06820942199498499,0.02052584857735235,rbf,TPESampler,COMPLETE
1644,0.31788524963799253,2025-04-24 21:23:57.090746,2025-04-24 21:23:57.622890,0 days 00:00:00.532144,98.6687200362303,0.021647595399979874,0.1702168760282942,rbf,TPESampler,COMPLETE
1645,0.3193407890958514,2025-04-24 21:23:57.404277,2025-04-24 21:23:57.924586,0 days 00:00:00.520309,99.60740597598429,0.036087583560432575,0.12616883904462808,rbf,TPESampler,COMPLETE
1646,0.8493453014107847,2025-04-24 21:23:57.862194,2025-04-24 21:23:58.476469,0 days 00:00:00.614275,94.70085610044484,0.05114852202633602,0.012060228954599971,poly,TPESampler,COMPLETE
1647,0.3097170837405111,2025-04-24 21:23:58.145745,2025-04-24 21:23:58.720456,0 days 00:00:00.574711,18.909017798568758,0.01664984057082961,0.0241333671384546,rbf,TPESampler,COMPLETE
1648,0.36750647159180716,2025-04-24 21:23:58.680564,2025-04-24 21:23:59.189591,0 days 00:00:00.509027,18.280409265083712,0.04377774622063685,0.0074045796624241395,rbf,TPESampler,COMPLETE
1649,0.3174120073530511,2025-04-24 21:23:58.981040,2025-04-24 21:23:59.473973,0 days 00:00:00.492933,98.87327325108306,0.0774327312108528,0.22095863746916153,rbf,TPESampler,COMPLETE
1650,199.4252860525749,2025-04-24 21:23:59.400260,2025-04-24 21:23:59.931557,0 days 00:00:00.531297,25.683459548929598,0.07890865916286474,0.10535590714378598,sigmoid,TPESampler,COMPLETE
