number,value,datetime_start,datetime_complete,duration,params_C,params_epsilon,params_gamma,params_kernel,system_attrs_auto:sampler,state
2122,0.30288102320849886,2025-04-24 21:31:14.702289,2025-04-24 21:31:15.275994,0 days 00:00:00.573705,92.17958016172044,0.027419992970062722,0.010348044234439907,rbf,TPESampler,COMPLETE
2123,0.28438622746633907,2025-04-24 21:31:15.467610,2025-04-24 21:31:16.001864,0 days 00:00:00.534254,97.06293810942967,0.07010746068221842,0.021125385055027812,rbf,TPESampler,COMPLETE
2124,0.30686239209501076,2025-04-24 21:31:16.197243,2025-04-24 21:31:16.776681,0 days 00:00:00.579438,96.60049229052645,0.02371032321085179,0.057324394803303445,rbf,TPESampler,COMPLETE
2125,0.3006634884031565,2025-04-24 21:31:16.964899,2025-04-24 21:31:17.690923,0 days 00:00:00.726024,22.267285546758842,0.022449438523121555,0.033182226541025886,rbf,TPESampler,COMPLETE
2126,2.9490102283303257,2025-04-24 21:31:17.879103,2025-04-24 21:31:18.385269,0 days 00:00:00.506166,12.780215920202254,0.022955753181687764,0.004978501932498986,sigmoid,TPESampler,COMPLETE
2127,0.3593913877382241,2025-04-24 21:31:18.584666,2025-04-24 21:31:19.114109,0 days 00:00:00.529443,19.78686156561859,0.01301859844636183,0.008325549853703824,rbf,TPESampler,COMPLETE
2128,0.3409704828346277,2025-04-24 21:31:19.531412,2025-04-24 21:31:20.063843,0 days 00:00:00.532431,3.662701800630458,0.023947255110110355,0.061581486239721775,rbf,TPESampler,COMPLETE
2129,0.39950473573471407,2025-04-24 21:31:20.262565,2025-04-24 21:31:20.804323,0 days 00:00:00.541758,19.890538717091044,0.034163287272333975,0.004781121708748841,rbf,TPESampler,COMPLETE
2130,0.30741403972574044,2025-04-24 21:31:21.020475,2025-04-24 21:31:21.553272,0 days 00:00:00.532797,94.02806951762516,0.010076384815953554,0.005794532597266586,rbf,TPESampler,COMPLETE
2131,0.3027678808897757,2025-04-24 21:31:21.736974,2025-04-24 21:31:22.273957,0 days 00:00:00.536983,99.6277213550433,0.05530463460441009,0.0835994082265607,rbf,TPESampler,COMPLETE
2132,0.3646390315411422,2025-04-24 21:31:22.465006,2025-04-24 21:31:22.973599,0 days 00:00:00.508593,14.872881149382163,0.09520353574076394,0.0077555198434051285,rbf,TPESampler,COMPLETE
2133,0.289959503840056,2025-04-24 21:31:23.166133,2025-04-24 21:31:23.751022,0 days 00:00:00.584889,98.76717968088205,0.010106928369917806,0.022616014663104186,rbf,TPESampler,COMPLETE
2134,0.2972194613629369,2025-04-24 21:31:23.950461,2025-04-24 21:31:24.525965,0 days 00:00:00.575504,92.1063400264266,0.02630246166540268,0.045983205787643845,rbf,TPESampler,COMPLETE
2135,0.29580986577646223,2025-04-24 21:31:24.724960,2025-04-24 21:31:25.273879,0 days 00:00:00.548919,24.982302433632483,0.028609544625914116,0.117168920520475,rbf,TPESampler,COMPLETE
2136,0.2916970248436569,2025-04-24 21:31:25.459104,2025-04-24 21:31:26.036138,0 days 00:00:00.577034,99.43093387828083,0.033026976368901735,0.03912984895708719,rbf,TPESampler,COMPLETE
2137,310.95840795349307,2025-04-24 21:31:26.225349,2025-04-24 21:31:26.786570,0 days 00:00:00.561221,73.95717933947965,0.013979681137395328,0.022438851958150385,sigmoid,TPESampler,COMPLETE
2138,0.3149925057152403,2025-04-24 21:31:27.047055,2025-04-24 21:31:27.611678,0 days 00:00:00.564623,99.48920262596185,0.017165854665521896,0.003917931934605981,rbf,TPESampler,COMPLETE
2139,0.29212176100113174,2025-04-24 21:31:27.802695,2025-04-24 21:31:28.375215,0 days 00:00:00.572520,17.47486456205133,0.015606961245051254,0.06374721682059162,rbf,TPESampler,COMPLETE
2140,0.3956810571655956,2025-04-24 21:31:28.627622,2025-04-24 21:31:29.247190,0 days 00:00:00.619568,4.1159311119013315,0.020132792358800368,0.023839889893451136,rbf,TPESampler,COMPLETE
2141,0.29934204952794957,2025-04-24 21:31:29.483232,2025-04-24 21:31:30.105628,0 days 00:00:00.622396,98.06344526072915,0.04113929917379071,0.008018537932086633,rbf,TPESampler,COMPLETE
2142,0.36708338614727165,2025-04-24 21:31:30.338001,2025-04-24 21:31:35.326579,0 days 00:00:04.988578,66.65397608574257,0.005011142994087214,0.006530636707195321,linear,TPESampler,COMPLETE
2143,0.3433186029116703,2025-04-24 21:31:35.523032,2025-04-24 21:31:36.026040,0 days 00:00:00.503008,4.789989928093351,0.06614909602333117,0.03557631900219103,rbf,TPESampler,COMPLETE
2144,0.30204522542148854,2025-04-24 21:31:36.212212,2025-04-24 21:31:36.721872,0 days 00:00:00.509660,16.97282340697698,0.07776654778536252,0.03521626561969366,rbf,TPESampler,COMPLETE
2145,0.2906561610966933,2025-04-24 21:31:36.904726,2025-04-24 21:31:37.420948,0 days 00:00:00.516222,91.09492766464946,0.11364451270013193,0.01319050589584975,rbf,TPESampler,COMPLETE
2146,0.7522715509491478,2025-04-24 21:31:37.608106,2025-04-24 21:31:38.101024,0 days 00:00:00.492918,0.7820132213113684,0.8918272169204734,0.009392975064763545,sigmoid,TPESampler,COMPLETE
2147,0.3596647910653376,2025-04-24 21:31:38.394956,2025-04-24 21:31:46.075365,0 days 00:00:07.680409,89.28740239347611,0.0745168556069764,0.006018711610843947,linear,TPESampler,COMPLETE
2148,0.7937150537711254,2025-04-24 21:31:46.266979,2025-04-24 21:31:46.783340,0 days 00:00:00.516361,18.637707986501212,0.009557920781415537,0.008642390332033064,poly,TPESampler,COMPLETE
2149,0.3023650583413129,2025-04-24 21:31:46.968746,2025-04-24 21:31:47.508634,0 days 00:00:00.539888,25.55646866012261,0.016855579854633762,0.02646707009242155,rbf,TPESampler,COMPLETE
2150,0.3156600420575739,2025-04-24 21:31:47.700217,2025-04-24 21:31:48.244750,0 days 00:00:00.544533,91.62063672436898,0.011109463103430323,0.12133672701858991,rbf,TPESampler,COMPLETE
2151,0.8081228302089207,2025-04-24 21:31:48.433438,2025-04-24 21:31:48.948428,0 days 00:00:00.514990,88.76276156842775,0.5819992083040356,0.015749012618188694,poly,TPESampler,COMPLETE
2152,0.28776921309867065,2025-04-24 21:31:49.132573,2025-04-24 21:31:49.717372,0 days 00:00:00.584799,95.01335149906407,0.03421350915980908,0.036727961460333414,rbf,TPESampler,COMPLETE
2153,0.29683314828336504,2025-04-24 21:31:49.916956,2025-04-24 21:31:50.471563,0 days 00:00:00.554607,26.893852403457448,0.07844756144105451,0.07819117397338989,rbf,TPESampler,COMPLETE
2154,0.29940337795039274,2025-04-24 21:31:50.662688,2025-04-24 21:31:51.237216,0 days 00:00:00.574528,94.48188607579903,0.037644305107044515,0.04470871287984931,rbf,TPESampler,COMPLETE
2155,0.3631519544485527,2025-04-24 21:31:51.430007,2025-04-24 21:31:51.959302,0 days 00:00:00.529295,16.114305762772716,0.02203727246744023,0.00936419096227489,rbf,TPESampler,COMPLETE
2156,0.29610431218062205,2025-04-24 21:31:52.150201,2025-04-24 21:31:52.700333,0 days 00:00:00.550132,95.67016798278352,0.05099341613246752,0.011239973948507459,rbf,TPESampler,COMPLETE
2157,0.31141781689877585,2025-04-24 21:31:52.900405,2025-04-24 21:31:53.425733,0 days 00:00:00.525328,17.055748428362527,0.07323423817916774,0.011930556766775735,rbf,TPESampler,COMPLETE
2158,0.28312542844960004,2025-04-24 21:31:53.612087,2025-04-24 21:31:54.178053,0 days 00:00:00.565966,99.33400846151343,0.0716299387558724,0.025856070264525577,rbf,TPESampler,COMPLETE
2159,0.3018762586165753,2025-04-24 21:31:54.377694,2025-04-24 21:31:54.959711,0 days 00:00:00.582017,17.985455604058178,0.01670593597431487,0.04223331813898299,rbf,TPESampler,COMPLETE
2160,0.3014481413108867,2025-04-24 21:31:55.148685,2025-04-24 21:31:55.723309,0 days 00:00:00.574624,95.60831137635708,0.01711716410970411,0.011480017246337479,rbf,TPESampler,COMPLETE
2161,0.8253965255947516,2025-04-24 21:31:55.917578,2025-04-24 21:31:56.417431,0 days 00:00:00.499853,18.934633532986947,0.03857800898843962,0.006336600881720645,poly,TPESampler,COMPLETE
2162,0.28227436730509364,2025-04-24 21:31:56.598030,2025-04-24 21:31:57.181109,0 days 00:00:00.583079,99.3036186328209,0.02538092552553823,0.027194024448814844,rbf,TPESampler,COMPLETE
2163,0.3062607980850405,2025-04-24 21:31:57.373297,2025-04-24 21:31:57.974939,0 days 00:00:00.601642,94.02005069937019,0.01154521315429858,0.05262723547586576,rbf,TPESampler,COMPLETE
2164,0.2963742924423276,2025-04-24 21:31:58.169424,2025-04-24 21:31:58.730016,0 days 00:00:00.560592,30.842240644700613,0.007898381129578838,0.03338413195369237,rbf,TPESampler,COMPLETE
2165,0.30473586765692967,2025-04-24 21:31:58.910449,2025-04-24 21:31:59.676824,0 days 00:00:00.766375,20.538252973202265,0.006801356612628829,0.03159834263536321,rbf,TPESampler,COMPLETE
2166,0.3272035716488698,2025-04-24 21:31:59.878328,2025-04-24 21:32:00.479133,0 days 00:00:00.600805,14.095226776573616,0.015783146730865966,0.014507136215801133,rbf,TPESampler,COMPLETE
2167,0.29154928641328437,2025-04-24 21:32:00.681219,2025-04-24 21:32:01.321452,0 days 00:00:00.640233,90.7056658214515,0.02262200054149896,0.04219356874372999,rbf,TPESampler,COMPLETE
2168,0.30218547146652913,2025-04-24 21:32:01.511644,2025-04-24 21:32:02.047577,0 days 00:00:00.535933,29.052298478844627,0.010668045183066303,0.12399763639112697,rbf,TPESampler,COMPLETE
2169,0.365031147968245,2025-04-24 21:32:02.235425,2025-04-24 21:32:08.336229,0 days 00:00:06.100804,25.894849593762896,0.010574966854551561,0.043831130832748866,linear,TPESampler,COMPLETE
2170,0.9044084129887402,2025-04-24 21:32:08.523323,2025-04-24 21:32:10.728154,0 days 00:00:02.204831,34.98204438691948,0.030644257441459027,0.04256280898846498,poly,TPESampler,COMPLETE
2171,0.6392712316926328,2025-04-24 21:32:10.910097,2025-04-24 21:32:11.580164,0 days 00:00:00.670067,3.677099969541007,0.026851774312653603,0.0019339967783785761,rbf,TPESampler,COMPLETE
2172,1.0006830849301729,2025-04-24 21:32:11.764525,2025-04-24 21:32:12.258501,0 days 00:00:00.493976,0.009578823749038252,0.0010979101050757056,0.0008722992689645676,poly,TPESampler,COMPLETE
2173,0.5567501286220318,2025-04-24 21:32:12.449584,2025-04-24 21:32:12.965043,0 days 00:00:00.515459,0.0439092443866016,0.02401485791307677,0.7095977679144233,linear,TPESampler,COMPLETE
2174,0.2908234070399127,2025-04-24 21:32:13.149277,2025-04-24 21:32:13.720049,0 days 00:00:00.570772,89.78568462123059,0.01046369374988952,0.022308682716894207,rbf,TPESampler,COMPLETE
2175,123.93300367874362,2025-04-24 21:32:13.918318,2025-04-24 21:32:14.417211,0 days 00:00:00.498893,92.05153440826832,0.028685057983689675,0.00995644057926264,sigmoid,TPESampler,COMPLETE
2176,0.29774288557070494,2025-04-24 21:32:14.604430,2025-04-24 21:32:15.218757,0 days 00:00:00.614327,94.81176020646903,0.024331197148994985,0.01230213333153127,rbf,TPESampler,COMPLETE
2177,0.30688228119894784,2025-04-24 21:32:15.399065,2025-04-24 21:32:15.970404,0 days 00:00:00.571339,98.26520338003719,0.030348384964707438,0.059047195811292794,rbf,TPESampler,COMPLETE
2178,741.9574563724083,2025-04-24 21:32:16.152877,2025-04-24 21:32:16.642997,0 days 00:00:00.490120,95.05121671801187,0.010928393307128798,0.057371211401538245,sigmoid,TPESampler,COMPLETE
2179,0.39879427549611646,2025-04-24 21:32:16.824610,2025-04-24 21:32:17.362230,0 days 00:00:00.537620,17.48921561518723,0.02656772677327757,0.005289087565055797,rbf,TPESampler,COMPLETE
2180,0.30059414651259464,2025-04-24 21:32:17.706814,2025-04-24 21:32:18.279361,0 days 00:00:00.572547,95.32508686315151,0.022466727996026746,0.011013178887477148,rbf,TPESampler,COMPLETE
2181,0.8064502467937581,2025-04-24 21:32:18.460890,2025-04-24 21:32:18.976706,0 days 00:00:00.515816,1.3835886208529873,0.06114723121765787,0.00021897193489764906,sigmoid,TPESampler,COMPLETE
2182,0.3041739431050542,2025-04-24 21:32:19.170235,2025-04-24 21:32:19.758283,0 days 00:00:00.588048,29.452596732074426,0.012039827126306074,0.02316574153284903,rbf,TPESampler,COMPLETE
2183,0.8643788115757284,2025-04-24 21:32:19.937606,2025-04-24 21:33:44.525542,0 days 00:01:24.587936,85.78074828152242,0.05557967404827936,0.15385082986693827,poly,TPESampler,COMPLETE
2184,0.282215672636508,2025-04-24 21:32:54.696263,2025-04-24 21:32:55.270588,0 days 00:00:00.574325,91.94768333314829,0.022435062239378738,0.026703194766034284,rbf,TPESampler,COMPLETE
2185,0.30659024985228794,2025-04-24 21:32:55.457473,2025-04-24 21:32:56.036882,0 days 00:00:00.579409,98.39720447559715,0.018006119129339037,0.05344133428977612,rbf,TPESampler,COMPLETE
2186,0.29402360141650463,2025-04-24 21:32:56.223257,2025-04-24 21:32:56.735640,0 days 00:00:00.512383,23.128796989739286,0.045619658601779974,0.06169260149686817,rbf,TPESampler,COMPLETE
2187,0.37830088401511697,2025-04-24 21:32:56.918379,2025-04-24 21:32:57.436093,0 days 00:00:00.517714,93.60829472702731,0.025453772696773458,0.36806146847327387,rbf,TPESampler,COMPLETE
2188,0.3591199141366876,2025-04-24 21:32:57.623837,2025-04-24 21:32:58.659472,0 days 00:00:01.035635,42.60195059126434,0.18719998808675264,0.00022610285680437075,linear,TPESampler,COMPLETE
2189,0.3001932523477157,2025-04-24 21:32:58.858263,2025-04-24 21:32:59.422146,0 days 00:00:00.563883,21.013893097634554,0.018218345532891252,0.15359664209828464,rbf,TPESampler,COMPLETE
2190,0.3079183810812771,2025-04-24 21:32:59.605655,2025-04-24 21:33:00.144973,0 days 00:00:00.539318,18.06901815675718,0.014663259554727288,0.03270504860199681,rbf,TPESampler,COMPLETE
2191,0.36382405741589824,2025-04-24 21:33:00.335223,2025-04-24 21:33:04.708922,0 days 00:00:04.373699,88.41501507647051,0.02630735290613849,0.007477710472671709,linear,TPESampler,COMPLETE
2192,0.29805244253620194,2025-04-24 21:33:04.905432,2025-04-24 21:33:05.841487,0 days 00:00:00.936055,21.59252475737625,0.01989266731825946,0.13719829873959863,rbf,TPESampler,COMPLETE
2193,0.31806792053206095,2025-04-24 21:33:06.053200,2025-04-24 21:33:06.585972,0 days 00:00:00.532772,93.98127358105296,0.01194877865601473,0.12555236932663003,rbf,TPESampler,COMPLETE
2194,0.28403455534617494,2025-04-24 21:33:06.774427,2025-04-24 21:33:07.361495,0 days 00:00:00.587068,98.92418309974451,0.011931174109865958,0.0296647299113011,rbf,TPESampler,COMPLETE
2195,0.32941556580046916,2025-04-24 21:33:07.557020,2025-04-24 21:33:08.078831,0 days 00:00:00.521811,21.850520871327234,0.025648938444850534,0.009449661747613747,rbf,TPESampler,COMPLETE
2196,0.3802498005303674,2025-04-24 21:33:08.269312,2025-04-24 21:33:08.916460,0 days 00:00:00.647148,18.29560829418513,0.00978580231155116,0.00690612347957565,rbf,TPESampler,COMPLETE
2197,0.31975335613903355,2025-04-24 21:33:09.105990,2025-04-24 21:33:09.648173,0 days 00:00:00.542183,23.65146392002583,0.0050560127021836414,0.009804914297740313,rbf,TPESampler,COMPLETE
2198,0.2917487966896016,2025-04-24 21:33:09.848066,2025-04-24 21:33:10.402617,0 days 00:00:00.554551,23.22021812649871,0.027224964234381664,0.04588874140842395,rbf,TPESampler,COMPLETE
2199,0.3076404046042713,2025-04-24 21:33:10.597698,2025-04-24 21:33:11.450257,0 days 00:00:00.852559,25.36747982265929,0.017211096148516358,0.013536002076826497,rbf,TPESampler,COMPLETE
2200,0.2997996743122157,2025-04-24 21:33:11.631008,2025-04-24 21:33:12.136785,0 days 00:00:00.505777,24.680542980504452,0.05620909020928367,0.014132833958369612,rbf,TPESampler,COMPLETE
2201,0.3066728412025466,2025-04-24 21:33:12.313928,2025-04-24 21:33:12.815555,0 days 00:00:00.501627,15.043763641299403,0.029302812036067803,0.02447177252998554,rbf,TPESampler,COMPLETE
2202,0.30236455731989936,2025-04-24 21:33:12.994492,2025-04-24 21:33:13.497545,0 days 00:00:00.503053,27.380482473402544,0.029593999746023242,0.017130112923247107,rbf,TPESampler,COMPLETE
2203,19.551607563545005,2025-04-24 21:33:13.684585,2025-04-24 21:33:14.209205,0 days 00:00:00.524620,2.656362111935747,0.004451862075026911,0.043852357073913745,sigmoid,TPESampler,COMPLETE
2204,0.48971946951063905,2025-04-24 21:33:14.429732,2025-04-24 21:33:14.979215,0 days 00:00:00.549483,12.212526237102105,0.04151457286308692,0.62320739287256,rbf,TPESampler,COMPLETE
2205,0.3047516767685695,2025-04-24 21:33:15.186551,2025-04-24 21:33:15.777956,0 days 00:00:00.591405,91.63608492332979,0.018612946777630292,0.008753216173295116,rbf,TPESampler,COMPLETE
2206,0.3378902317023652,2025-04-24 21:33:15.962366,2025-04-24 21:33:16.469662,0 days 00:00:00.507296,4.34763085470976,0.04625835138580042,0.04726741221596466,rbf,TPESampler,COMPLETE
2207,0.2959677850565988,2025-04-24 21:33:16.655675,2025-04-24 21:33:17.184407,0 days 00:00:00.528732,99.77776735481388,0.05999809927962418,0.008614012373450131,rbf,TPESampler,COMPLETE
2208,0.42148410127762076,2025-04-24 21:33:17.490349,2025-04-24 21:33:18.000405,0 days 00:00:00.510056,4.231908488633597,0.008025843501105622,0.018273417564494566,rbf,TPESampler,COMPLETE
2209,0.4517129034565199,2025-04-24 21:33:18.190661,2025-04-24 21:33:18.721980,0 days 00:00:00.531319,26.94518264303876,0.03440555186403351,0.0020707630074373435,rbf,TPESampler,COMPLETE
2210,0.2906164258296577,2025-04-24 21:33:18.922383,2025-04-24 21:33:19.478604,0 days 00:00:00.556221,27.240170335022526,0.01837728915726816,0.058596161453610573,rbf,TPESampler,COMPLETE
2211,0.2914890082624956,2025-04-24 21:33:19.850289,2025-04-24 21:33:20.380839,0 days 00:00:00.530550,19.65704958504126,0.01749685228639724,0.06155860407577495,rbf,TPESampler,COMPLETE
2212,0.3072532824187136,2025-04-24 21:33:20.572664,2025-04-24 21:33:21.133163,0 days 00:00:00.560499,98.77555670915396,0.007922460325701302,0.0062009502795560365,rbf,TPESampler,COMPLETE
2213,0.7339835435253854,2025-04-24 21:33:21.344218,2025-04-24 21:33:21.845443,0 days 00:00:00.501225,0.5893528796498392,0.005107823204380035,0.0010433951141432635,sigmoid,TPESampler,COMPLETE
2214,0.2824665752228229,2025-04-24 21:33:22.028095,2025-04-24 21:33:22.576536,0 days 00:00:00.548441,91.6310568821984,0.03452524713606756,0.030361051105947456,rbf,TPESampler,COMPLETE
2215,264.8190636875795,2025-04-24 21:33:22.760541,2025-04-24 21:33:23.262498,0 days 00:00:00.501957,99.0858407284453,0.05622959218387901,0.01522097112026664,sigmoid,TPESampler,COMPLETE
2216,0.3035589449639133,2025-04-24 21:33:23.448283,2025-04-24 21:33:23.974218,0 days 00:00:00.525935,99.08429138640462,0.07667052079995289,0.05673152010120875,rbf,TPESampler,COMPLETE
2217,0.30076935008810596,2025-04-24 21:33:24.153592,2025-04-24 21:33:24.693237,0 days 00:00:00.539645,22.521981453796272,0.04534950259757778,0.03503897299435495,rbf,TPESampler,COMPLETE
2218,0.9421936042846378,2025-04-24 21:33:24.899141,2025-04-24 21:33:26.718146,0 days 00:00:01.819005,14.73273148782678,0.006827140037581244,0.04972007790809692,poly,TPESampler,COMPLETE
2219,0.3004389930572374,2025-04-24 21:33:26.981536,2025-04-24 21:33:27.609322,0 days 00:00:00.627786,27.52882009708259,0.006008943279665426,0.08189209537527073,rbf,TPESampler,COMPLETE
2220,0.3035292837797815,2025-04-24 21:33:27.806143,2025-04-24 21:33:28.356136,0 days 00:00:00.549993,98.11215252556062,0.028267197645683095,0.009775115013492527,rbf,TPESampler,COMPLETE
2221,0.2817729251697099,2025-04-24 21:33:28.535269,2025-04-24 21:33:29.099345,0 days 00:00:00.564076,97.68623743201466,0.02794702465648495,0.02586913116043062,rbf,TPESampler,COMPLETE
2222,0.31359876563448347,2025-04-24 21:33:29.276145,2025-04-24 21:33:29.792478,0 days 00:00:00.516333,99.57503879513214,0.027728335567174855,0.11946053356144375,rbf,TPESampler,COMPLETE
2223,0.28198378631076415,2025-04-24 21:33:29.976968,2025-04-24 21:33:30.528083,0 days 00:00:00.551115,89.39106728672783,0.02402981937244515,0.02696668968979449,rbf,TPESampler,COMPLETE
2224,0.28391765408041036,2025-04-24 21:33:30.706645,2025-04-24 21:33:31.250864,0 days 00:00:00.544219,54.00976315380026,0.007642527582628342,0.038731012080964015,rbf,TPESampler,COMPLETE
2225,0.36471958723351006,2025-04-24 21:33:31.431722,2025-04-24 21:33:31.956868,0 days 00:00:00.525146,23.832575511596506,0.010290932037678596,0.006751792127952762,rbf,TPESampler,COMPLETE
2226,0.29112710649219903,2025-04-24 21:33:32.142330,2025-04-24 21:33:32.761419,0 days 00:00:00.619089,90.01874938140327,0.0071887950581364535,0.04291747292316101,rbf,TPESampler,COMPLETE
2227,0.29075532845627255,2025-04-24 21:33:32.946335,2025-04-24 21:33:33.540720,0 days 00:00:00.594385,86.30076671329569,0.00599480189861546,0.025206801742463394,rbf,TPESampler,COMPLETE
2228,0.3077584043520325,2025-04-24 21:33:33.727707,2025-04-24 21:33:34.248201,0 days 00:00:00.520494,22.421591285276882,0.024943191142956574,0.02226989776888684,rbf,TPESampler,COMPLETE
2229,0.2914895562594597,2025-04-24 21:33:34.439294,2025-04-24 21:33:35.022416,0 days 00:00:00.583122,98.24243104107529,0.029801172927682442,0.03971651769557888,rbf,TPESampler,COMPLETE
2230,0.2915657637370194,2025-04-24 21:33:35.208389,2025-04-24 21:33:35.767775,0 days 00:00:00.559386,28.788733312314392,0.015025761982607608,0.0397522976010689,rbf,TPESampler,COMPLETE
2231,0.3170250466657881,2025-04-24 21:33:35.957326,2025-04-24 21:33:36.465594,0 days 00:00:00.508268,28.496779277951852,0.012069701158308365,0.008416631413351179,rbf,TPESampler,COMPLETE
2232,0.30257486853828824,2025-04-24 21:33:36.646992,2025-04-24 21:33:37.187052,0 days 00:00:00.540060,98.1642925323017,0.028532348063118215,0.007848954818068138,rbf,TPESampler,COMPLETE
2233,0.2971876260439557,2025-04-24 21:33:37.377913,2025-04-24 21:33:37.971756,0 days 00:00:00.593843,98.84782097043164,0.011482640008257165,0.016284015217808853,rbf,TPESampler,COMPLETE
2234,0.2903560474568309,2025-04-24 21:33:38.179767,2025-04-24 21:33:38.712385,0 days 00:00:00.532618,21.47266390535276,0.019966895125076652,0.05363385541864599,rbf,TPESampler,COMPLETE
2235,0.30504875770369455,2025-04-24 21:33:38.894018,2025-04-24 21:33:39.411884,0 days 00:00:00.517866,29.541024855153275,0.01611645503855003,0.01695370596151912,rbf,TPESampler,COMPLETE
2236,0.2952723100558569,2025-04-24 21:33:39.589132,2025-04-24 21:33:40.166289,0 days 00:00:00.577157,90.95510540483507,0.013699008275368296,0.016631169114308314,rbf,TPESampler,COMPLETE
2237,0.2979709910474176,2025-04-24 21:33:40.354308,2025-04-24 21:33:40.860668,0 days 00:00:00.506360,4.649874579469492,0.026376951190294436,0.1837002677148847,rbf,TPESampler,COMPLETE
2238,0.29680194683759503,2025-04-24 21:33:41.049611,2025-04-24 21:33:41.584228,0 days 00:00:00.534617,21.202688797455526,0.03816233181086245,0.08939200787802044,rbf,TPESampler,COMPLETE
2239,0.4969946485604754,2025-04-24 21:33:41.769625,2025-04-24 21:33:42.260342,0 days 00:00:00.490717,4.534043473654645,0.04102069042776386,0.008567949423155488,rbf,TPESampler,COMPLETE
