number,value,datetime_start,datetime_complete,duration,params_C,params_epsilon,params_gamma,params_kernel,system_attrs_auto:sampler,state
1651,0.3028102446874703,2025-04-24 21:23:59.726227,2025-04-24 21:24:00.275902,0 days 00:00:00.549675,99.74836068126382,0.015765539110655622,0.04880660067775732,rbf,TPESampler,COMPLETE
1652,0.37337226877214647,2025-04-24 21:24:00.150801,2025-04-24 21:24:00.703721,0 days 00:00:00.552920,21.523927873986214,0.011870430321783495,0.0065335550643489506,rbf,TPESampler,COMPLETE
1653,0.30216652293929597,2025-04-24 21:24:00.501832,2025-04-24 21:24:01.187054,0 days 00:00:00.685222,95.57630732446799,0.031280686936814496,0.049020690320519957,rbf,TPESampler,COMPLETE
1654,0.3665687013591086,2025-04-24 21:24:00.911047,2025-04-24 21:24:01.582588,0 days 00:00:00.671541,0.4116529781708078,0.1428772335221153,0.664725314527865,linear,TPESampler,COMPLETE
1655,0.30394164961909265,2025-04-24 21:24:01.376003,2025-04-24 21:24:01.885318,0 days 00:00:00.509315,24.72072176022492,0.031479500081018796,0.0249334652968389,rbf,TPESampler,COMPLETE
1656,0.3920294648454064,2025-04-24 21:24:01.811472,2025-04-24 21:24:02.307225,0 days 00:00:00.495753,68.90236218598858,0.003614878915337471,0.41128415536007457,rbf,TPESampler,COMPLETE
1657,0.29179402434289636,2025-04-24 21:24:02.110754,2025-04-24 21:24:02.755984,0 days 00:00:00.645230,99.52577627142637,0.019693647820554192,0.014818117825796482,rbf,TPESampler,COMPLETE
1658,0.29397537795283385,2025-04-24 21:24:02.521039,2025-04-24 21:24:02.997557,0 days 00:00:00.476518,25.314644450903877,0.06852432566714665,0.040542503249407204,rbf,TPESampler,COMPLETE
1659,0.2826638226066266,2025-04-24 21:24:02.924713,2025-04-24 21:24:03.460983,0 days 00:00:00.536270,96.9452050103214,0.04166885191813679,0.024108038539843165,rbf,TPESampler,COMPLETE
1660,0.3606588960054749,2025-04-24 21:24:03.225467,2025-04-24 21:24:06.372615,0 days 00:00:03.147148,96.36430898020022,0.12087670518206207,0.01804175792073728,linear,TPESampler,COMPLETE
1661,0.35528482687214075,2025-04-24 21:24:03.707820,2025-04-24 21:24:04.215428,0 days 00:00:00.507608,4.1757818058577545,0.027421117981074546,0.038511859169065646,rbf,TPESampler,COMPLETE
1662,0.4115978371003092,2025-04-24 21:24:04.403377,2025-04-24 21:24:04.892014,0 days 00:00:00.488637,14.756512739175767,0.18703369022101216,0.004752446288674324,rbf,TPESampler,COMPLETE
1663,0.4146508526505597,2025-04-24 21:24:05.069262,2025-04-24 21:24:05.591302,0 days 00:00:00.522040,25.090256253800874,0.019742106944109047,0.0030454243681056164,rbf,TPESampler,COMPLETE
1664,0.2978096183515113,2025-04-24 21:24:05.775726,2025-04-24 21:24:06.300701,0 days 00:00:00.524975,95.7455067109726,0.04525568529628857,0.007599305839507445,rbf,TPESampler,COMPLETE
1665,0.29036602660642397,2025-04-24 21:24:06.469116,2025-04-24 21:24:07.120798,0 days 00:00:00.651682,95.38615105756055,0.1300080059352846,0.018859645968010333,rbf,TPESampler,COMPLETE
1666,0.30494433017860156,2025-04-24 21:24:06.626019,2025-04-24 21:24:07.268842,0 days 00:00:00.642823,97.69676277430642,0.06126761765552148,0.04737350951311017,rbf,TPESampler,COMPLETE
1667,0.3048939472126808,2025-04-24 21:24:07.317050,2025-04-24 21:24:07.901213,0 days 00:00:00.584163,25.622587056874014,0.018703814989065606,0.01585902966301745,rbf,TPESampler,COMPLETE
1668,0.2930518827162927,2025-04-24 21:24:07.497120,2025-04-24 21:24:08.051459,0 days 00:00:00.554339,22.40199905864564,0.015153390203318448,0.07127719057781381,rbf,TPESampler,COMPLETE
1669,0.3209746397549642,2025-04-24 21:24:08.099663,2025-04-24 21:24:08.637690,0 days 00:00:00.538027,27.136268885429295,0.09271261956827988,0.007042176130296899,rbf,TPESampler,COMPLETE
1670,0.30749161260930374,2025-04-24 21:24:08.262857,2025-04-24 21:24:08.903711,0 days 00:00:00.640854,96.0389164382467,0.006717893622738147,0.00881910651991693,rbf,TPESampler,COMPLETE
1671,0.7407531138216511,2025-04-24 21:24:08.864803,2025-04-24 21:24:09.327505,0 days 00:00:00.462702,0.17264095968241389,0.004373479491185906,0.0017556778285740121,rbf,TPESampler,COMPLETE
1672,0.2915355402836095,2025-04-24 21:24:09.170867,2025-04-24 21:24:09.805863,0 days 00:00:00.634996,20.670872804283178,0.01641899629113333,0.06259454176142076,rbf,TPESampler,COMPLETE
1673,398.0237488585181,2025-04-24 21:24:09.517457,2025-04-24 21:24:10.222833,0 days 00:00:00.705376,88.10543581828743,0.08677137744922492,0.024242673697945714,sigmoid,TPESampler,COMPLETE
1674,0.2999289231612633,2025-04-24 21:24:10.173383,2025-04-24 21:24:10.709438,0 days 00:00:00.536055,22.085319294047174,0.0807186231586806,0.03408779778903506,rbf,TPESampler,COMPLETE
1675,0.2976665134283088,2025-04-24 21:24:10.464420,2025-04-24 21:24:11.047555,0 days 00:00:00.583135,26.853968321809415,0.031151716394419486,0.09667601521478406,rbf,TPESampler,COMPLETE
1676,0.28573594811284886,2025-04-24 21:24:10.961421,2025-04-24 21:24:11.494697,0 days 00:00:00.533276,99.91286160554752,0.06378352077799951,0.018080788614229903,rbf,TPESampler,COMPLETE
1677,0.3096063587618705,2025-04-24 21:24:11.276129,2025-04-24 21:24:11.770630,0 days 00:00:00.494501,15.471006753762044,0.005066022438801285,0.020732442271418447,rbf,TPESampler,COMPLETE
1678,0.30640316777404686,2025-04-24 21:24:11.707612,2025-04-24 21:24:12.214908,0 days 00:00:00.507296,85.27253889718754,0.024004002061782822,0.005432870244729369,rbf,TPESampler,COMPLETE
1679,0.3091808348558834,2025-04-24 21:24:12.012654,2025-04-24 21:24:12.512904,0 days 00:00:00.500250,16.268261283130627,0.03659602396549489,0.025167409507960595,rbf,TPESampler,COMPLETE
1680,0.31040938853601646,2025-04-24 21:24:12.451269,2025-04-24 21:24:12.975921,0 days 00:00:00.524652,94.47459636350163,0.01163304185986353,0.07276278322495128,rbf,TPESampler,COMPLETE
1681,0.30070322800175875,2025-04-24 21:24:12.745831,2025-04-24 21:24:13.270434,0 days 00:00:00.524603,92.18887230190519,0.04287757129279038,0.006302628466561058,rbf,TPESampler,COMPLETE
1682,0.3020512440029578,2025-04-24 21:24:13.199309,2025-04-24 21:24:13.717469,0 days 00:00:00.518160,99.53986631873903,0.08093755373533963,0.08583020868079647,rbf,TPESampler,COMPLETE
1683,0.35894793706913397,2025-04-24 21:24:13.499734,2025-04-24 21:24:14.419743,0 days 00:00:00.920009,23.49962288356349,0.17682399530825715,0.0034551528879396254,linear,TPESampler,COMPLETE
1684,0.786126038158045,2025-04-24 21:24:13.948917,2025-04-24 21:24:14.499647,0 days 00:00:00.550730,0.13812870450897033,0.0011421403578802075,0.024105195125612603,sigmoid,TPESampler,COMPLETE
1685,0.302311788038048,2025-04-24 21:24:14.579629,2025-04-24 21:24:15.228375,0 days 00:00:00.648746,88.60692926207474,0.017950421269248732,0.011393463927080284,rbf,TPESampler,COMPLETE
1686,57.47406393893803,2025-04-24 21:24:14.694911,2025-04-24 21:24:15.321914,0 days 00:00:00.627003,14.985229344482953,0.012600132205109736,0.02039304959160944,sigmoid,TPESampler,COMPLETE
1687,278.8381140729761,2025-04-24 21:24:15.382110,2025-04-24 21:24:16.018766,0 days 00:00:00.636656,77.06763379449403,0.0039981408345005146,0.019721394781416407,sigmoid,TPESampler,COMPLETE
1688,5.2194644280332945,2025-04-24 21:24:15.508532,2025-04-24 21:24:16.145572,0 days 00:00:00.637040,94.90864516011756,0.04645272563108734,0.002894595112404216,sigmoid,TPESampler,COMPLETE
1689,0.2895282527373976,2025-04-24 21:24:16.211099,2025-04-24 21:24:16.882898,0 days 00:00:00.671799,23.01634303989815,0.02196831269795264,0.0501551894281718,rbf,TPESampler,COMPLETE
1690,0.3060455999059869,2025-04-24 21:24:16.346767,2025-04-24 21:24:17.017151,0 days 00:00:00.670384,21.701846602505082,0.026229439745798486,0.014624674700068691,rbf,TPESampler,COMPLETE
1691,0.999857644827865,2025-04-24 21:24:17.077978,2025-04-24 21:24:17.695844,0 days 00:00:00.617866,0.0016049815912426728,0.0011861263054940227,0.00028960755103025516,rbf,TPESampler,COMPLETE
1692,0.33944826566273323,2025-04-24 21:24:17.228497,2025-04-24 21:24:17.908575,0 days 00:00:00.680078,23.115450030685434,0.046736383900444066,0.00790975159724598,rbf,TPESampler,COMPLETE
1693,0.31986145970044727,2025-04-24 21:24:18.020457,2025-04-24 21:24:18.674807,0 days 00:00:00.654350,6.598708557741083,0.05555691465526368,0.035889433161707424,rbf,TPESampler,COMPLETE
1694,0.46948036738058196,2025-04-24 21:24:18.193299,2025-04-24 21:24:18.781443,0 days 00:00:00.588144,0.09696799461597219,0.3911979367399959,0.16858859195580236,linear,TPESampler,COMPLETE
1695,0.3040928568095698,2025-04-24 21:24:18.855030,2025-04-24 21:24:19.489671,0 days 00:00:00.634641,25.444905439915715,0.018139472954921722,0.01742972454526703,rbf,TPESampler,COMPLETE
1696,0.3015246939049976,2025-04-24 21:24:18.974026,2025-04-24 21:24:19.629487,0 days 00:00:00.655461,21.46962924756979,0.05888334577231567,0.026442790967913993,rbf,TPESampler,COMPLETE
1697,0.2881438178512322,2025-04-24 21:24:19.687824,2025-04-24 21:24:20.268184,0 days 00:00:00.580360,87.50018744282471,0.02367811632399746,0.018917361987648082,rbf,TPESampler,COMPLETE
1698,0.29222090317651056,2025-04-24 21:24:19.849320,2025-04-24 21:24:20.396183,0 days 00:00:00.546863,22.88631707408448,0.058341556980749845,0.05113536855407082,rbf,TPESampler,COMPLETE
1699,0.3109484901890286,2025-04-24 21:24:20.455230,2025-04-24 21:24:21.132793,0 days 00:00:00.677563,89.89745632206565,0.01010206907427537,0.08394670493209253,rbf,TPESampler,COMPLETE
1700,0.2934620293087984,2025-04-24 21:24:20.590996,2025-04-24 21:24:21.262762,0 days 00:00:00.671766,22.302993134347467,0.021711955304192614,0.07382090722129457,rbf,TPESampler,COMPLETE
1701,0.29082268301907244,2025-04-24 21:24:21.320709,2025-04-24 21:24:21.889971,0 days 00:00:00.569262,84.96100130457586,0.028405612599504304,0.01616643935119917,rbf,TPESampler,COMPLETE
1702,0.29645329281867083,2025-04-24 21:24:21.484479,2025-04-24 21:24:22.108255,0 days 00:00:00.623776,23.144668639811854,0.033407574142111894,0.041231087110280326,rbf,TPESampler,COMPLETE
1703,0.3103581304142688,2025-04-24 21:24:22.075940,2025-04-24 21:24:22.584739,0 days 00:00:00.508799,18.719307933297518,0.006571201638869723,0.013469094433755891,rbf,TPESampler,COMPLETE
1704,0.7452841187646262,2025-04-24 21:24:22.320275,2025-04-24 21:24:22.910966,0 days 00:00:00.590691,14.076279281783226,0.041474633532548114,0.018421184673136543,poly,TPESampler,COMPLETE
1705,0.2959295393324492,2025-04-24 21:24:22.839209,2025-04-24 21:24:23.354588,0 days 00:00:00.515379,95.63616708644837,0.051656957949012074,0.007304120089407777,rbf,TPESampler,COMPLETE
1706,0.3590130222611362,2025-04-24 21:24:23.140891,2025-04-24 21:24:24.734394,0 days 00:00:01.593503,14.671207447848072,0.06301346877430351,0.033571735677100166,linear,TPESampler,COMPLETE
1707,0.3055618474040492,2025-04-24 21:24:23.602008,2025-04-24 21:24:24.148271,0 days 00:00:00.546263,99.70199935645401,0.031210140110257918,0.06167224301358973,rbf,TPESampler,COMPLETE
1708,0.3459221202178281,2025-04-24 21:24:24.338830,2025-04-24 21:24:24.850029,0 days 00:00:00.511199,73.62581774874924,0.004448594100627634,0.0028118805312509648,rbf,TPESampler,COMPLETE
1709,0.9126845423994555,2025-04-24 21:24:24.927920,2025-04-24 21:24:25.699636,0 days 00:00:00.771716,79.09569675235333,0.01888274717623663,0.01969194706900997,poly,TPESampler,COMPLETE
1710,0.30464660481993383,2025-04-24 21:24:25.054574,2025-04-24 21:24:25.731255,0 days 00:00:00.676681,23.32854237925041,0.012856914870450407,0.027409577734621493,rbf,TPESampler,COMPLETE
1711,0.2903841565254163,2025-04-24 21:24:25.841338,2025-04-24 21:24:26.508212,0 days 00:00:00.666874,99.8277075428664,0.09498480558413688,0.014589301263416121,rbf,TPESampler,COMPLETE
1712,0.2860920922820502,2025-04-24 21:24:25.884659,2025-04-24 21:24:26.756411,0 days 00:00:00.871752,92.86116071157798,0.018431570396036025,0.021435323605045766,rbf,TPESampler,COMPLETE
1713,0.3595771045794666,2025-04-24 21:24:26.716595,2025-04-24 21:24:27.145640,0 days 00:00:00.429045,3.068106282584711,0.2018952029126569,0.06876359748388665,rbf,TPESampler,COMPLETE
1714,0.405036768586643,2025-04-24 21:24:27.022912,2025-04-24 21:24:27.479118,0 days 00:00:00.456206,24.06609128416795,0.05490612113433137,0.0037099202744632215,rbf,TPESampler,COMPLETE
1715,0.2910633028522093,2025-04-24 21:24:27.336795,2025-04-24 21:24:27.983280,0 days 00:00:00.646485,91.90302396128999,0.018595812791101233,0.04213345994284953,rbf,TPESampler,COMPLETE
1716,0.48822793653691887,2025-04-24 21:24:27.676001,2025-04-24 21:24:28.229029,0 days 00:00:00.553028,2.997793135363296,0.08110607620158383,0.014161146125135814,rbf,TPESampler,COMPLETE
1717,0.36285644389954924,2025-04-24 21:24:28.187385,2025-04-24 21:24:35.079879,0 days 00:00:06.892494,92.2024244264988,0.04305914052528375,0.05882810202027484,linear,TPESampler,COMPLETE
1718,0.30574645012597046,2025-04-24 21:24:28.480012,2025-04-24 21:24:29.052914,0 days 00:00:00.572902,98.25876998781334,0.016421167537609034,0.005327672363495978,rbf,TPESampler,COMPLETE
1719,0.3030192734678764,2025-04-24 21:24:29.242311,2025-04-24 21:24:29.767931,0 days 00:00:00.525620,96.55254034728502,0.05594888548338194,0.06703257028647408,rbf,TPESampler,COMPLETE
1720,0.7293072840274957,2025-04-24 21:24:29.951586,2025-04-24 21:24:30.444756,0 days 00:00:00.493170,3.8951930059512696,0.036228191394406924,0.004472306029405496,sigmoid,TPESampler,COMPLETE
1721,0.30518052860264205,2025-04-24 21:24:30.628153,2025-04-24 21:24:31.144405,0 days 00:00:00.516252,97.37702476571543,0.02494667565112341,0.005249301275264547,rbf,TPESampler,COMPLETE
1722,88.42249273154152,2025-04-24 21:24:31.317309,2025-04-24 21:24:31.800960,0 days 00:00:00.483651,33.29285740150456,0.04188331697668815,0.015149233211105189,sigmoid,TPESampler,COMPLETE
1723,0.30160330983473144,2025-04-24 21:24:31.983001,2025-04-24 21:24:32.501159,0 days 00:00:00.518158,26.236649547678507,0.058090780049973624,0.02222446034009069,rbf,TPESampler,COMPLETE
1724,0.28809094250761685,2025-04-24 21:24:32.739512,2025-04-24 21:24:33.285256,0 days 00:00:00.545744,96.88817444037637,0.05561722807454416,0.032512406321110715,rbf,TPESampler,COMPLETE
1725,0.2983734652672087,2025-04-24 21:24:33.464461,2025-04-24 21:24:33.986299,0 days 00:00:00.521838,29.101754311131035,0.04032361061081833,0.13441587719702602,rbf,TPESampler,COMPLETE
1726,0.3053862416457763,2025-04-24 21:24:34.170652,2025-04-24 21:24:34.693158,0 days 00:00:00.522506,98.22297161083681,0.043432191597458536,0.09294926200462035,rbf,TPESampler,COMPLETE
1727,0.2998928273567468,2025-04-24 21:24:34.885503,2025-04-24 21:24:35.372273,0 days 00:00:00.486770,26.238362403416893,0.10787025297446026,0.02658066377986662,rbf,TPESampler,COMPLETE
1728,0.30867920297764395,2025-04-24 21:24:35.325767,2025-04-24 21:24:35.838807,0 days 00:00:00.513040,20.14772034577196,0.037523389401781806,0.011706580136936956,rbf,TPESampler,COMPLETE
1729,0.30506059948623027,2025-04-24 21:24:35.615872,2025-04-24 21:24:36.285712,0 days 00:00:00.669840,95.3083752079145,0.010581350833048628,0.05115766704705684,rbf,TPESampler,COMPLETE
1730,0.2823946889115256,2025-04-24 21:24:36.101236,2025-04-24 21:24:36.643303,0 days 00:00:00.542067,98.13900591360733,0.04401523632939319,0.02768932714305318,rbf,TPESampler,COMPLETE
1731,0.31024069641766017,2025-04-24 21:24:36.498472,2025-04-24 21:24:37.023574,0 days 00:00:00.525102,21.79812259001815,0.0361121491650444,0.01074367736670493,rbf,TPESampler,COMPLETE
1732,0.28526758034348737,2025-04-24 21:24:36.831963,2025-04-24 21:24:37.397494,0 days 00:00:00.565531,97.78444076008243,0.033985894806870365,0.018544557927920178,rbf,TPESampler,COMPLETE
1733,0.3124287089472218,2025-04-24 21:24:37.256768,2025-04-24 21:24:37.775502,0 days 00:00:00.518734,21.25196444953757,0.13277842705285087,0.014837202768296686,rbf,TPESampler,COMPLETE
1734,0.3121517765616931,2025-04-24 21:24:37.583788,2025-04-24 21:24:38.065397,0 days 00:00:00.481609,95.3503738697866,0.18045991297950406,0.0424589964503685,rbf,TPESampler,COMPLETE
1735,0.2999319589893534,2025-04-24 21:24:37.994747,2025-04-24 21:24:38.526819,0 days 00:00:00.532072,96.87527362544697,0.023319717460386167,0.011197951604012655,rbf,TPESampler,COMPLETE
1736,0.3046394058704036,2025-04-24 21:24:38.315703,2025-04-24 21:24:38.822442,0 days 00:00:00.506739,25.603242645325036,0.049216543956944636,0.020381014350358256,rbf,TPESampler,COMPLETE
1737,0.30146438249323265,2025-04-24 21:24:38.759146,2025-04-24 21:24:39.288750,0 days 00:00:00.529604,29.480261519018164,0.029068128356331897,0.02361380621974807,rbf,TPESampler,COMPLETE
1738,0.2964455913791427,2025-04-24 21:24:39.073532,2025-04-24 21:24:39.566856,0 days 00:00:00.493324,15.355881261268657,0.10282186374308808,0.0626022936962057,rbf,TPESampler,COMPLETE
1739,0.28639893514500064,2025-04-24 21:24:39.522471,2025-04-24 21:24:40.120859,0 days 00:00:00.598388,91.33450628663273,0.039338054664856674,0.01837027035862374,rbf,TPESampler,COMPLETE
1740,0.2882979749516833,2025-04-24 21:24:39.796616,2025-04-24 21:24:40.362417,0 days 00:00:00.565801,99.63566927878391,0.1060380516103901,0.018429378025848545,rbf,TPESampler,COMPLETE
1741,0.29358731432887264,2025-04-24 21:24:40.327306,2025-04-24 21:24:40.775452,0 days 00:00:00.448146,18.823481984073506,0.08598534099817996,0.08684478075538431,rbf,TPESampler,COMPLETE
1742,0.30412982908176905,2025-04-24 21:24:40.556039,2025-04-24 21:24:41.075233,0 days 00:00:00.519194,94.79922298224504,0.05046466530867002,0.06550071721329657,rbf,TPESampler,COMPLETE
1743,0.36499947632401664,2025-04-24 21:24:41.008882,2025-04-24 21:24:41.530960,0 days 00:00:00.522078,17.035486488561105,0.08971388388239268,0.00684168568356147,rbf,TPESampler,COMPLETE
1744,0.2822250291002784,2025-04-24 21:24:41.286492,2025-04-24 21:24:41.957593,0 days 00:00:00.671101,92.44417673184877,0.0327341629693471,0.029209166968720685,rbf,TPESampler,COMPLETE
1745,0.7987924917515,2025-04-24 21:24:41.768576,2025-04-24 21:24:42.244000,0 days 00:00:00.475424,2.3822585544055834,0.016377621725960502,0.016356523149698054,poly,TPESampler,COMPLETE
1746,0.36270206552332185,2025-04-24 21:24:42.169872,2025-04-24 21:24:42.688294,0 days 00:00:00.518422,0.5760762533605461,0.2509856741325581,0.011629392012016126,linear,TPESampler,COMPLETE
1747,0.3608764903969254,2025-04-24 21:24:42.485713,2025-04-24 21:24:43.638853,0 days 00:00:01.153140,5.705036498256335,0.023588417711821654,0.003459484460986779,linear,TPESampler,COMPLETE
1748,760.8952574411644,2025-04-24 21:24:42.922198,2025-04-24 21:24:43.415514,0 days 00:00:00.493316,95.29936706566318,0.03760573692142995,0.060313887847770295,sigmoid,TPESampler,COMPLETE
1749,0.2967941512976684,2025-04-24 21:24:43.597448,2025-04-24 21:24:44.061781,0 days 00:00:00.464333,16.827427213744336,0.051409927729744405,0.086857746882034,rbf,TPESampler,COMPLETE
1750,0.8795617221569219,2025-04-24 21:24:43.852227,2025-04-24 21:29:44.677063,0 days 00:05:00.824836,99.7137485078599,0.021453201419290406,0.19567973304801328,poly,TPESampler,COMPLETE
1751,0.36470204553291075,2025-04-24 21:24:44.324430,2025-04-24 21:24:45.159353,0 days 00:00:00.834923,3.2960708003642276,0.0018957942230417818,0.0026417798825891254,linear,TPESampler,COMPLETE
1752,0.308219185803649,2025-04-24 21:24:45.329405,2025-04-24 21:24:45.812452,0 days 00:00:00.483047,14.264310793652067,0.010247040637050012,0.017956780912050985,rbf,TPESampler,COMPLETE
1753,0.2879610586234723,2025-04-24 21:24:45.989134,2025-04-24 21:24:46.509206,0 days 00:00:00.520072,98.29408614613772,0.03539732513365709,0.03619591870725504,rbf,TPESampler,COMPLETE
1754,0.29397873964694843,2025-04-24 21:24:46.687602,2025-04-24 21:24:47.184939,0 days 00:00:00.497337,12.283141220483149,0.011257126000998551,0.08097957083734705,rbf,TPESampler,COMPLETE
1755,0.30661840252502803,2025-04-24 21:24:47.366199,2025-04-24 21:24:47.884200,0 days 00:00:00.518001,22.954318220945247,0.007170940012073128,0.0271266534195084,rbf,TPESampler,COMPLETE
1756,0.3007427725146459,2025-04-24 21:24:48.064959,2025-04-24 21:24:48.592006,0 days 00:00:00.527047,97.34369213292285,0.044542095277602306,0.04373568077437028,rbf,TPESampler,COMPLETE
1757,0.3451913640305468,2025-04-24 21:24:48.774078,2025-04-24 21:24:49.284922,0 days 00:00:00.510844,2.9584887776956013,0.027398780512702295,0.0859240245834086,rbf,TPESampler,COMPLETE
1758,0.3133525385461145,2025-04-24 21:24:49.499203,2025-04-24 21:24:50.027472,0 days 00:00:00.528269,95.18290272410455,0.02328342857340542,0.12106981894148126,rbf,TPESampler,COMPLETE
1759,0.30658655773833404,2025-04-24 21:24:50.199418,2025-04-24 21:24:50.733432,0 days 00:00:00.534014,93.96703246852205,0.010801383727641172,0.006639001605509744,rbf,TPESampler,COMPLETE
1760,796.6462819962719,2025-04-24 21:24:50.918271,2025-04-24 21:24:51.407418,0 days 00:00:00.489147,89.25820490244311,0.01517407900986171,0.21149357826090012,sigmoid,TPESampler,COMPLETE
1761,0.28461663893996103,2025-04-24 21:24:51.651172,2025-04-24 21:24:52.222882,0 days 00:00:00.571710,99.26934115445873,0.02116931977298234,0.02091140500220754,rbf,TPESampler,COMPLETE
1762,197.013917533445,2025-04-24 21:24:52.400870,2025-04-24 21:24:52.904222,0 days 00:00:00.503352,81.6151500725376,0.024928514827553244,0.014067321627972052,sigmoid,TPESampler,COMPLETE
1763,0.29473169263449583,2025-04-24 21:24:53.082915,2025-04-24 21:24:53.592761,0 days 00:00:00.509846,18.94842598919311,0.031377228648043994,0.08297800816902065,rbf,TPESampler,COMPLETE
1764,0.30700262073994955,2025-04-24 21:24:53.776041,2025-04-24 21:24:54.281732,0 days 00:00:00.505691,13.962257777936326,0.02344500202472504,0.023286747657491585,rbf,TPESampler,COMPLETE
1765,0.28855340048469696,2025-04-24 21:24:54.465281,2025-04-24 21:24:55.017116,0 days 00:00:00.551835,25.675315873897656,0.01507965719339288,0.052354441715475375,rbf,TPESampler,COMPLETE
1766,0.3441203234080183,2025-04-24 21:24:55.192850,2025-04-24 21:24:55.687728,0 days 00:00:00.494878,94.81914715917539,0.2859172444220651,0.020169047174798872,rbf,TPESampler,COMPLETE
1767,0.39952208315839266,2025-04-24 21:24:55.877971,2025-04-24 21:24:56.378879,0 days 00:00:00.500908,4.855004624117897,0.04238324876022229,0.018545871253379254,rbf,TPESampler,COMPLETE
1768,0.30639784021469085,2025-04-24 21:24:56.563621,2025-04-24 21:24:57.069168,0 days 00:00:00.505547,90.86063223187111,0.12867764770291998,0.0768925236352915,rbf,TPESampler,COMPLETE
