number,value,datetime_start,datetime_complete,duration,params_C,params_epsilon,params_gamma,params_kernel,system_attrs_auto:sampler,state
1415,0.2941175906549108,2025-04-24 21:21:29.470972,2025-04-24 21:21:29.974080,0 days 00:00:00.503108,92.78324350678876,0.06631897824616133,0.011733841136587504,rbf,TPESampler,COMPLETE
1416,0.31630386089019924,2025-04-24 21:21:30.154671,2025-04-24 21:21:30.646077,0 days 00:00:00.491406,98.16096367754545,0.02828309643174419,0.16390248333297636,rbf,TPESampler,COMPLETE
1417,0.2984140187791309,2025-04-24 21:21:30.824083,2025-04-24 21:21:31.303309,0 days 00:00:00.479226,20.683214443919052,0.08308995130338945,0.0709248457691224,rbf,TPESampler,COMPLETE
1418,0.5065171980570228,2025-04-24 21:21:31.478248,2025-04-24 21:21:31.943676,0 days 00:00:00.465428,26.50882537584516,0.05442358454105235,0.001314711742307653,rbf,TPESampler,COMPLETE
1419,20.95001510496627,2025-04-24 21:21:32.266049,2025-04-24 21:21:32.740389,0 days 00:00:00.474340,13.40165806928017,0.06445164989930223,0.01086197885237418,sigmoid,TPESampler,COMPLETE
1420,0.30582478852195943,2025-04-24 21:21:32.541335,2025-04-24 21:21:33.100996,0 days 00:00:00.559661,21.663487558117176,0.038805824507297325,0.025722053452439338,rbf,TPESampler,COMPLETE
1421,0.30785894655743956,2025-04-24 21:21:32.959857,2025-04-24 21:21:33.501408,0 days 00:00:00.541551,19.918479394030285,0.015304757603634419,0.01786210560784962,rbf,TPESampler,COMPLETE
1422,299.41883004224684,2025-04-24 21:21:33.290773,2025-04-24 21:21:33.795500,0 days 00:00:00.504727,98.876825965481,0.022260761771856444,0.016840683522529345,sigmoid,TPESampler,COMPLETE
1423,31.542202648147896,2025-04-24 21:21:33.760558,2025-04-24 21:21:34.228134,0 days 00:00:00.467576,76.56467107837607,0.10864102672987067,0.005848576254031965,sigmoid,TPESampler,COMPLETE
1424,0.9444047582862208,2025-04-24 21:21:34.014883,2025-04-24 21:21:34.481976,0 days 00:00:00.467093,0.007459023197535312,0.936407045089572,0.00014779985072719567,rbf,TPESampler,COMPLETE
1425,1.0007285291639774,2025-04-24 21:21:34.444957,2025-04-24 21:21:34.922737,0 days 00:00:00.477780,0.0010226351908793614,0.012883903721119284,0.0011484090498940329,poly,TPESampler,COMPLETE
1426,0.3052289630772367,2025-04-24 21:21:34.687265,2025-04-24 21:21:35.290466,0 days 00:00:00.603201,78.91774959874253,0.013364305622386894,0.00773900222630853,rbf,TPESampler,COMPLETE
1427,0.8955677820842248,2025-04-24 21:21:35.158502,2025-04-24 21:22:10.826607,0 days 00:00:35.668105,0.03704682509583218,0.001248440111990902,0.7783451511654336,poly,TPESampler,COMPLETE
1428,0.3249039240192313,2025-04-24 21:21:35.481774,2025-04-24 21:21:36.025454,0 days 00:00:00.543680,4.062855098331307,0.041551849838045836,0.09415647793458683,rbf,TPESampler,COMPLETE
1429,0.28731333212601484,2025-04-24 21:21:36.217634,2025-04-24 21:21:36.814305,0 days 00:00:00.596671,97.62900565874133,0.030023665262026947,0.017074365029988544,rbf,TPESampler,COMPLETE
1430,0.2918218998678318,2025-04-24 21:21:37.033350,2025-04-24 21:21:37.601775,0 days 00:00:00.568425,89.62347700014541,0.03343705057758153,0.040518674557311875,rbf,TPESampler,COMPLETE
1431,0.2998821784676432,2025-04-24 21:21:37.788529,2025-04-24 21:21:38.367856,0 days 00:00:00.579327,94.92680456882027,0.009741596919849212,0.01601189376132278,rbf,TPESampler,COMPLETE
1432,0.30220951623073566,2025-04-24 21:21:38.563919,2025-04-24 21:21:39.135635,0 days 00:00:00.571716,18.37911861987723,0.023323070654264033,0.03850988128989756,rbf,TPESampler,COMPLETE
1433,0.3019438372545335,2025-04-24 21:21:39.320305,2025-04-24 21:21:39.844844,0 days 00:00:00.524539,22.692895479222408,0.009794321077819308,0.14908865197504637,rbf,TPESampler,COMPLETE
1434,0.41346172970173534,2025-04-24 21:21:40.024757,2025-04-24 21:21:40.515647,0 days 00:00:00.490890,20.035027465125715,0.06267802386415652,0.0038043797079842174,rbf,TPESampler,COMPLETE
1435,0.30165678022782577,2025-04-24 21:21:40.704378,2025-04-24 21:21:41.207788,0 days 00:00:00.503410,19.92712487370743,0.05690476843640689,0.019780224548959734,rbf,TPESampler,COMPLETE
1436,0.36555442606070376,2025-04-24 21:21:41.396783,2025-04-24 21:21:48.721793,0 days 00:00:07.325010,73.6580962766937,0.01145840948956306,0.008662683359542114,linear,TPESampler,COMPLETE
1437,0.29409144389779873,2025-04-24 21:21:48.908289,2025-04-24 21:21:49.453684,0 days 00:00:00.545395,93.12407000449875,0.09063548341542155,0.0327500383999688,rbf,TPESampler,COMPLETE
1438,0.2917148781581792,2025-04-24 21:21:49.635013,2025-04-24 21:21:50.165377,0 days 00:00:00.530364,19.982069876228984,0.004151616951632819,0.056383488714145995,rbf,TPESampler,COMPLETE
1439,0.32745365987729413,2025-04-24 21:21:50.341341,2025-04-24 21:21:50.854297,0 days 00:00:00.512956,97.10618723421317,0.015402515411501247,0.0028291284526695093,rbf,TPESampler,COMPLETE
1440,0.3037527932878508,2025-04-24 21:21:51.039640,2025-04-24 21:21:51.574011,0 days 00:00:00.534371,95.78661387225559,0.06335138712564413,0.043518169423746124,rbf,TPESampler,COMPLETE
1441,0.29556507348871264,2025-04-24 21:21:51.769810,2025-04-24 21:21:52.259422,0 days 00:00:00.489612,20.9877342350212,0.037397348288209176,0.1026227926430687,rbf,TPESampler,COMPLETE
1442,0.3002496008404028,2025-04-24 21:21:52.431336,2025-04-24 21:21:52.932103,0 days 00:00:00.500767,23.720725775340934,0.016392767903684012,0.03391455090245307,rbf,TPESampler,COMPLETE
1443,0.28276532152229555,2025-04-24 21:21:53.112260,2025-04-24 21:21:53.651410,0 days 00:00:00.539150,89.46042587078509,0.03355230876592859,0.03164851823838002,rbf,TPESampler,COMPLETE
1444,0.7806210772138975,2025-04-24 21:21:53.842435,2025-04-24 21:21:54.331694,0 days 00:00:00.489259,0.048279916362862024,0.027212442367614248,0.019419469605583026,sigmoid,TPESampler,COMPLETE
1445,0.2860698284965384,2025-04-24 21:21:54.533584,2025-04-24 21:21:55.094197,0 days 00:00:00.560613,99.06970809778223,0.023963704102464473,0.01899535841522072,rbf,TPESampler,COMPLETE
1446,0.38325028716145254,2025-04-24 21:21:55.260741,2025-04-24 21:21:55.743123,0 days 00:00:00.482382,99.1095323057219,0.03382631631433453,0.001374892310281972,rbf,TPESampler,COMPLETE
1447,0.3013431741459792,2025-04-24 21:21:55.917994,2025-04-24 21:21:56.457069,0 days 00:00:00.539075,98.07152511368342,0.008002209839791387,0.014208857831103807,rbf,TPESampler,COMPLETE
1448,0.29989600355752105,2025-04-24 21:21:56.631319,2025-04-24 21:21:57.115134,0 days 00:00:00.483815,98.11535931609718,0.19642730610359985,0.010121572138337928,rbf,TPESampler,COMPLETE
1449,0.30249709397290164,2025-04-24 21:21:57.286490,2025-04-24 21:21:57.774260,0 days 00:00:00.487770,98.45617690658544,0.07498325929548855,0.11954271116275095,rbf,TPESampler,COMPLETE
1450,0.5809189310195882,2025-04-24 21:21:57.949796,2025-04-24 21:21:58.430609,0 days 00:00:00.480813,2.452763071408698,0.11744783674079796,0.006447668088041465,rbf,TPESampler,COMPLETE
1451,0.3056625468954813,2025-04-24 21:21:58.606210,2025-04-24 21:21:59.125708,0 days 00:00:00.519498,97.59802897704262,0.02879371961156873,0.06215069999184619,rbf,TPESampler,COMPLETE
1452,0.3067630773297993,2025-04-24 21:21:59.305565,2025-04-24 21:21:59.861372,0 days 00:00:00.555807,97.70246062397975,0.022377860681726387,0.0778945436413088,rbf,TPESampler,COMPLETE
1453,0.28926158537124763,2025-04-24 21:22:00.042889,2025-04-24 21:22:00.553713,0 days 00:00:00.510824,97.42704857959858,0.07747157147934061,0.030489046633157747,rbf,TPESampler,COMPLETE
1454,0.3197410702107915,2025-04-24 21:22:00.731932,2025-04-24 21:22:01.223330,0 days 00:00:00.491398,20.963868552059367,0.02091299215477917,0.010544366697134076,rbf,TPESampler,COMPLETE
1455,0.4143982085532776,2025-04-24 21:22:01.391020,2025-04-24 21:22:01.880776,0 days 00:00:00.489756,4.1169820396440775,0.027605735802726242,0.0194619393570334,rbf,TPESampler,COMPLETE
1456,0.2981789668542645,2025-04-24 21:22:02.190781,2025-04-24 21:22:02.726392,0 days 00:00:00.535611,94.7080026830782,0.03578120991888997,0.011176675315169441,rbf,TPESampler,COMPLETE
1457,0.3042346720027786,2025-04-24 21:22:02.905540,2025-04-24 21:22:03.380730,0 days 00:00:00.475190,17.15798442170112,0.17249728108526421,0.04466202274521291,rbf,TPESampler,COMPLETE
1458,0.2948101625262687,2025-04-24 21:22:03.572765,2025-04-24 21:22:04.090158,0 days 00:00:00.517393,22.366908285519806,0.02700182855383887,0.0434409861415108,rbf,TPESampler,COMPLETE
1459,0.36886471119872843,2025-04-24 21:22:04.303522,2025-04-24 21:22:04.802342,0 days 00:00:00.498820,22.334448567521886,0.03359828986193957,0.006391537065475039,rbf,TPESampler,COMPLETE
1460,0.6091788740131956,2025-04-24 21:22:04.971271,2025-04-24 21:22:05.450601,0 days 00:00:00.479330,3.9938229089249573,0.013060758515596804,0.0031327401795550867,rbf,TPESampler,COMPLETE
1461,0.283010317475296,2025-04-24 21:22:05.628409,2025-04-24 21:22:06.224039,0 days 00:00:00.595630,94.59503405839362,0.07399956074175039,0.023778254198220276,rbf,TPESampler,COMPLETE
1462,0.3050374754469707,2025-04-24 21:22:06.408770,2025-04-24 21:22:06.948368,0 days 00:00:00.539598,13.787363098743699,0.011735311353355022,0.05270061280578099,rbf,TPESampler,COMPLETE
1463,0.30265245927769957,2025-04-24 21:22:07.255815,2025-04-24 21:22:07.811200,0 days 00:00:00.555385,17.784491950537877,0.06035103788233464,0.0210110105814349,rbf,TPESampler,COMPLETE
1464,0.363614437181272,2025-04-24 21:22:08.006711,2025-04-24 21:22:14.273982,0 days 00:00:06.267271,93.46150972195925,0.025193625116143405,0.02130662135876281,linear,TPESampler,COMPLETE
1465,0.32182521776571404,2025-04-24 21:22:11.084491,2025-04-24 21:22:11.652179,0 days 00:00:00.567688,96.48806416662919,0.02822942407797488,0.1304318845713148,rbf,TPESampler,COMPLETE
1466,0.30413798315783414,2025-04-24 21:22:11.834329,2025-04-24 21:22:12.328260,0 days 00:00:00.493931,21.51314458810758,0.02012816687236129,0.0187931232072185,rbf,TPESampler,COMPLETE
1467,0.41694551453716616,2025-04-24 21:22:12.503231,2025-04-24 21:22:13.019114,0 days 00:00:00.515883,18.13399847937771,0.001057137580407782,0.004089799602624399,rbf,TPESampler,COMPLETE
1468,0.296017246109588,2025-04-24 21:22:13.201729,2025-04-24 21:22:13.734847,0 days 00:00:00.533118,22.08078131031446,0.031765883801175,0.08686851470464112,rbf,TPESampler,COMPLETE
1469,0.2863251481723506,2025-04-24 21:22:13.917999,2025-04-24 21:22:14.511142,0 days 00:00:00.593143,96.63250553795734,0.017185769011259868,0.02138624942014531,rbf,TPESampler,COMPLETE
1470,0.30445588691485803,2025-04-24 21:22:14.471524,2025-04-24 21:22:14.947942,0 days 00:00:00.476418,17.63915032650719,0.04572144348465478,0.018151062221388667,rbf,TPESampler,COMPLETE
1471,0.30502633333047596,2025-04-24 21:22:14.718482,2025-04-24 21:22:15.294695,0 days 00:00:00.576213,99.27544690312972,0.0368950564856151,0.09133295143224637,rbf,TPESampler,COMPLETE
1472,0.3601155460518636,2025-04-24 21:22:15.151980,2025-04-24 21:22:15.614710,0 days 00:00:00.462730,99.01976416519693,0.40891307829480966,0.10357565374213988,rbf,TPESampler,COMPLETE
1473,0.8614503066561084,2025-04-24 21:22:15.467183,2025-04-24 21:22:15.997623,0 days 00:00:00.530440,0.021901371561182395,0.0011580770719372556,0.08605057602707543,rbf,TPESampler,COMPLETE
1474,0.2987838984591757,2025-04-24 21:22:15.796102,2025-04-24 21:22:16.369144,0 days 00:00:00.573042,89.43289032226764,0.019048280576318376,0.012574805580699252,rbf,TPESampler,COMPLETE
1475,0.3173136313558717,2025-04-24 21:22:16.231397,2025-04-24 21:22:16.774947,0 days 00:00:00.543550,85.9343581181739,0.007726042021102142,0.12668032401733542,rbf,TPESampler,COMPLETE
1476,0.2972274849612865,2025-04-24 21:22:16.566582,2025-04-24 21:22:17.074983,0 days 00:00:00.508401,93.78950297572334,0.057859033874407724,0.005525522578944626,rbf,TPESampler,COMPLETE
1477,0.30510296616953725,2025-04-24 21:22:17.009020,2025-04-24 21:22:17.764385,0 days 00:00:00.755365,99.29056362011349,0.027868225087979877,0.07949066028681318,rbf,TPESampler,COMPLETE
1478,0.30396184611661076,2025-04-24 21:22:17.385964,2025-04-24 21:22:18.033873,0 days 00:00:00.647909,88.84427154244969,0.14652126459131462,0.04368835095976009,rbf,TPESampler,COMPLETE
1479,0.32545998815831234,2025-04-24 21:22:17.985107,2025-04-24 21:22:18.556126,0 days 00:00:00.571019,24.280804410481263,0.03720500083316632,0.008695066763330964,rbf,TPESampler,COMPLETE
1480,0.305199891197847,2025-04-24 21:22:18.311559,2025-04-24 21:22:18.838347,0 days 00:00:00.526788,99.63806751992058,0.0696023630465845,0.0036707399067641444,rbf,TPESampler,COMPLETE
1481,183.31678373255843,2025-04-24 21:22:18.789902,2025-04-24 21:22:19.290942,0 days 00:00:00.501040,20.799551656559036,0.09021215648187876,0.7760347745452687,sigmoid,TPESampler,COMPLETE
1482,0.2931611674448675,2025-04-24 21:22:19.058402,2025-04-24 21:22:19.572871,0 days 00:00:00.514469,17.782006649168938,0.009399271236355526,0.057413167309379336,rbf,TPESampler,COMPLETE
1483,0.3010832377510338,2025-04-24 21:22:19.504186,2025-04-24 21:22:20.016774,0 days 00:00:00.512588,21.794324600989892,0.04584098531416917,0.01744024162410612,rbf,TPESampler,COMPLETE
1484,0.2926306420496688,2025-04-24 21:22:19.781602,2025-04-24 21:22:20.288720,0 days 00:00:00.507118,25.959705578942582,0.06650225068162441,0.04200940819314188,rbf,TPESampler,COMPLETE
1485,0.32829936401087706,2025-04-24 21:22:20.233437,2025-04-24 21:22:20.634885,0 days 00:00:00.401448,19.310801656455563,0.17437009351345428,0.010689730951667214,rbf,TPESampler,COMPLETE
1486,0.3000572537966974,2025-04-24 21:22:20.490157,2025-04-24 21:22:21.071931,0 days 00:00:00.581774,94.0293989157747,0.0085726418791664,0.017410530856830687,rbf,TPESampler,COMPLETE
1487,0.2945736111107094,2025-04-24 21:22:20.822547,2025-04-24 21:22:21.372683,0 days 00:00:00.550136,22.909522755200236,0.05688237057699194,0.09493746351911578,rbf,TPESampler,COMPLETE
1488,0.9013736837320055,2025-04-24 21:22:21.333578,2025-04-24 21:22:21.814505,0 days 00:00:00.480927,0.03816265936529744,0.06751106420553679,0.007038252808271626,poly,TPESampler,COMPLETE
1489,0.2939010656562677,2025-04-24 21:22:21.571500,2025-04-24 21:22:22.096986,0 days 00:00:00.525486,97.72078601111357,0.08918504318088419,0.009604784806093176,rbf,TPESampler,COMPLETE
1490,0.3049093276749707,2025-04-24 21:22:22.037182,2025-04-24 21:22:22.622632,0 days 00:00:00.585450,20.60873526367,0.01882494931180717,0.0201241613691103,rbf,TPESampler,COMPLETE
1491,0.2898337252782311,2025-04-24 21:22:22.301620,2025-04-24 21:22:22.949885,0 days 00:00:00.648265,97.48945917084764,0.039109336275051663,0.014955253418144252,rbf,TPESampler,COMPLETE
1492,0.2843415922773906,2025-04-24 21:22:22.904383,2025-04-24 21:22:23.414045,0 days 00:00:00.509662,96.63732567161304,0.020974249945522706,0.021517564801555,rbf,TPESampler,COMPLETE
1493,0.8210399732122506,2025-04-24 21:22:23.200490,2025-04-24 21:22:23.663719,0 days 00:00:00.463229,0.015485272268359117,0.4390782035943402,0.06941487919720692,poly,TPESampler,COMPLETE
1494,0.3589946843347433,2025-04-24 21:22:23.613116,2025-04-24 21:22:24.953403,0 days 00:00:01.340287,34.54485802787567,0.14208529459333294,0.03369516443336566,linear,TPESampler,COMPLETE
1495,0.29357745699179005,2025-04-24 21:22:23.886443,2025-04-24 21:22:24.450749,0 days 00:00:00.564306,22.860212929335784,0.031946449582010296,0.04470552530480756,rbf,TPESampler,COMPLETE
1496,0.3171369844235955,2025-04-24 21:22:24.626322,2025-04-24 21:22:25.174895,0 days 00:00:00.548573,96.6992527539965,0.011220279875615784,0.003910975060133902,rbf,TPESampler,COMPLETE
1497,0.3041765711778099,2025-04-24 21:22:25.137639,2025-04-24 21:22:25.613344,0 days 00:00:00.475705,91.74506753020468,0.01787975070337555,0.008122416341420406,rbf,TPESampler,COMPLETE
1498,0.31198848528149636,2025-04-24 21:22:25.410118,2025-04-24 21:22:25.977999,0 days 00:00:00.567881,98.33776010458777,0.011104883251322108,0.09101992546377856,rbf,TPESampler,COMPLETE
1499,0.3060014000797756,2025-04-24 21:22:25.836400,2025-04-24 21:22:26.369733,0 days 00:00:00.533333,97.8891264110315,0.0335351515095373,0.05927085793312797,rbf,TPESampler,COMPLETE
1500,0.28988901134245537,2025-04-24 21:22:26.171080,2025-04-24 21:22:26.657449,0 days 00:00:00.486369,86.28243556035439,0.06085355456549763,0.03404349315057755,rbf,TPESampler,COMPLETE
1501,0.7448152675586966,2025-04-24 21:22:26.597897,2025-04-24 21:22:27.146100,0 days 00:00:00.548203,1.3646296452732656,0.004657032549040349,0.00019524217390536194,rbf,TPESampler,COMPLETE
1502,0.3004848589898399,2025-04-24 21:22:26.859322,2025-04-24 21:22:27.495832,0 days 00:00:00.636510,23.16276294808774,0.09868476960661941,0.024730522394317733,rbf,TPESampler,COMPLETE
1503,0.3087564886393734,2025-04-24 21:22:27.452272,2025-04-24 21:22:28.021701,0 days 00:00:00.569429,96.5862419769757,0.015432647044223282,0.06586042251459062,rbf,TPESampler,COMPLETE
1504,0.3054124481669896,2025-04-24 21:22:27.713753,2025-04-24 21:22:28.275021,0 days 00:00:00.561268,14.528447813756022,0.03506436878203135,0.04171508028627,rbf,TPESampler,COMPLETE
1505,0.5355611148516701,2025-04-24 21:22:28.233223,2025-04-24 21:22:28.635233,0 days 00:00:00.402010,14.200740308488829,0.015599728325607541,0.7752935057758193,rbf,TPESampler,COMPLETE
1506,0.31944606754859933,2025-04-24 21:22:28.511668,2025-04-24 21:22:29.035976,0 days 00:00:00.524308,25.806309019032028,0.10271169812014053,0.2184093986480331,rbf,TPESampler,COMPLETE
1507,0.8520731348231535,2025-04-24 21:22:28.824017,2025-04-24 21:22:46.342943,0 days 00:00:17.518926,99.14055582333332,0.04927738973513883,0.05568125231960871,poly,TPESampler,COMPLETE
1508,0.991815992811303,2025-04-24 21:22:29.262857,2025-04-24 21:22:29.768512,0 days 00:00:00.505655,0.0021924197945213143,0.24913103087509755,0.0009583265366439879,rbf,TPESampler,COMPLETE
1509,0.8777831217245173,2025-04-24 21:22:29.947552,2025-04-24 21:23:00.721468,0 days 00:00:30.773916,3.4610075934053044,0.01947002709216862,0.19265074451719322,poly,TPESampler,COMPLETE
1510,0.8943129865235194,2025-04-24 21:22:46.764981,2025-04-24 21:22:47.767926,0 days 00:00:01.002945,91.13229978404298,0.008493566666256806,0.013813152076183681,poly,TPESampler,COMPLETE
1511,679.238156935934,2025-04-24 21:22:48.229118,2025-04-24 21:22:48.933921,0 days 00:00:00.704803,88.17200474512468,0.03592865645298412,0.05067118871940893,sigmoid,TPESampler,COMPLETE
1512,0.29889357760395685,2025-04-24 21:22:49.110585,2025-04-24 21:22:49.798156,0 days 00:00:00.687571,87.29325523846089,0.03856594285806373,0.011267501921183209,rbf,TPESampler,COMPLETE
1513,0.7850954812425833,2025-04-24 21:22:50.020299,2025-04-24 21:22:51.129356,0 days 00:00:01.109057,0.37006335354814707,0.7500895428024609,0.08176156738413279,poly,TPESampler,COMPLETE
1514,0.2957060179636258,2025-04-24 21:22:51.330405,2025-04-24 21:22:52.164742,0 days 00:00:00.834337,17.026845366735387,0.022434993675649512,0.1142599033923615,rbf,TPESampler,COMPLETE
1515,0.3055291480676588,2025-04-24 21:22:52.528020,2025-04-24 21:22:53.275162,0 days 00:00:00.747142,94.37089622521076,0.021926550070279195,0.009641127028112392,rbf,TPESampler,COMPLETE
1516,0.3381035029426326,2025-04-24 21:22:53.485180,2025-04-24 21:22:54.574508,0 days 00:00:01.089328,20.574708894273193,0.041076710805653435,0.009013859006727276,rbf,TPESampler,COMPLETE
1517,0.3045945033669254,2025-04-24 21:22:55.552114,2025-04-24 21:22:56.129304,0 days 00:00:00.577190,21.22978303982966,0.02131145568230625,0.020244934283037846,rbf,TPESampler,COMPLETE
1518,0.2932780617951316,2025-04-24 21:22:56.334749,2025-04-24 21:22:56.961264,0 days 00:00:00.626515,96.22702881047131,0.058197256355401995,0.01241893050927278,rbf,TPESampler,COMPLETE
1519,0.3012503520187653,2025-04-24 21:22:57.140783,2025-04-24 21:22:57.654534,0 days 00:00:00.513751,25.523518085511466,0.006222092166925465,0.029963714189931018,rbf,TPESampler,COMPLETE
1520,0.30829899984572073,2025-04-24 21:22:57.834823,2025-04-24 21:22:58.341125,0 days 00:00:00.506302,19.960998948568392,0.023476839737329388,0.02443549111277966,rbf,TPESampler,COMPLETE
1521,0.35937407062916477,2025-04-24 21:22:58.523869,2025-04-24 21:23:00.094044,0 days 00:00:01.570175,8.587061287873778,0.06257068566250708,0.2508874463898517,linear,TPESampler,COMPLETE
1522,0.2961229668908763,2025-04-24 21:23:00.667731,2025-04-24 21:23:01.649278,0 days 00:00:00.981547,25.48081187780331,0.08241737425042747,0.0574732872474941,rbf,TPESampler,COMPLETE
1523,0.2973132505947945,2025-04-24 21:23:01.079609,2025-04-24 21:23:02.054186,0 days 00:00:00.974577,99.68769600220841,0.02200583934391627,0.012222589750906253,rbf,TPESampler,COMPLETE
1524,0.4987586180418331,2025-04-24 21:23:01.851956,2025-04-24 21:23:02.413420,0 days 00:00:00.561464,0.07651663699323052,0.0011601613744928237,0.03489205512389642,linear,TPESampler,COMPLETE
1525,0.2834209673090061,2025-04-24 21:23:02.370665,2025-04-24 21:23:02.973396,0 days 00:00:00.602731,84.10131387044999,0.04824721842760085,0.029090752922955498,rbf,TPESampler,COMPLETE
1526,0.28753596543349597,2025-04-24 21:23:02.656843,2025-04-24 21:23:03.220922,0 days 00:00:00.564079,97.20303827638412,0.048367091855493344,0.03343158987083611,rbf,TPESampler,COMPLETE
1527,0.3019198822761316,2025-04-24 21:23:03.175691,2025-04-24 21:23:03.663684,0 days 00:00:00.487993,97.27392363739033,0.07900902535591224,0.07251247350780202,rbf,TPESampler,COMPLETE
1528,0.2979999075273339,2025-04-24 21:23:03.454858,2025-04-24 21:23:03.994113,0 days 00:00:00.539255,96.03589276285324,0.04129143609535706,0.010962718193459856,rbf,TPESampler,COMPLETE
1529,0.30401927569456566,2025-04-24 21:23:03.905250,2025-04-24 21:23:04.424104,0 days 00:00:00.518854,98.51738320347627,0.034639007045008635,0.07454937391403804,rbf,TPESampler,COMPLETE
1530,0.2847982993534703,2025-04-24 21:23:04.212016,2025-04-24 21:23:04.861282,0 days 00:00:00.649266,99.25159616144555,0.00809955161615975,0.03135273791665898,rbf,TPESampler,COMPLETE
1531,0.3411093556952982,2025-04-24 21:23:04.657966,2025-04-24 21:23:05.143689,0 days 00:00:00.485723,3.953807934974331,0.07634868894000924,0.05114060267107268,rbf,TPESampler,COMPLETE
1532,0.2916872765111224,2025-04-24 21:23:05.100969,2025-04-24 21:23:05.573856,0 days 00:00:00.472887,25.01447531475577,0.01978189644547372,0.06552923964305112,rbf,TPESampler,COMPLETE
