number,value,datetime_start,datetime_complete,duration,params_C,params_epsilon,params_gamma,params_kernel,system_attrs_auto:sampler,state
825,0.30619609501614214,2025-04-24 21:11:49.296087,2025-04-24 21:11:49.808602,0 days 00:00:00.512515,14.725478763782963,0.05256072224721126,0.0242783173986617,rbf,TPESampler,COMPLETE
826,0.28415631063725205,2025-04-24 21:11:49.724166,2025-04-24 21:11:50.269795,0 days 00:00:00.545629,93.25928021654747,0.043989398062672415,0.019781401482828618,rbf,TPESampler,COMPLETE
827,0.9467686102818359,2025-04-24 21:11:50.043936,2025-04-24 21:14:20.665996,0 days 00:02:30.622060,30.198443973962405,0.017531126624244282,0.18028854562471255,poly,TPESampler,COMPLETE
828,0.30145592454016773,2025-04-24 21:11:50.532159,2025-04-24 21:11:51.297982,0 days 00:00:00.765823,93.93737159775955,0.09540060247406673,0.046397911436183804,rbf,TPESampler,COMPLETE
829,0.30944442390313326,2025-04-24 21:11:51.503469,2025-04-24 21:11:52.028102,0 days 00:00:00.524633,16.629506606944293,0.020687469514837336,0.02871008662080137,rbf,TPESampler,COMPLETE
830,0.41650727357850253,2025-04-24 21:11:52.209145,2025-04-24 21:11:52.742724,0 days 00:00:00.533579,2.3892244076318887,0.052342155773649944,0.03608606646368227,rbf,TPESampler,COMPLETE
831,0.30673814806068966,2025-04-24 21:11:53.016268,2025-04-24 21:11:53.558485,0 days 00:00:00.542217,22.70629027546264,0.019973463391808673,0.015878462614938103,rbf,TPESampler,COMPLETE
832,0.3973874981925955,2025-04-24 21:11:53.747358,2025-04-24 21:11:54.289507,0 days 00:00:00.542149,18.23001705862484,0.050726971576844866,0.005346462158857845,rbf,TPESampler,COMPLETE
833,63.016152916088316,2025-04-24 21:11:54.497822,2025-04-24 21:11:55.001233,0 days 00:00:00.503411,18.19560422128635,0.029659784606839573,0.01896437537569605,sigmoid,TPESampler,COMPLETE
834,0.30641041192561264,2025-04-24 21:11:55.185885,2025-04-24 21:11:55.742302,0 days 00:00:00.556417,98.83313658374514,0.021497673022737685,0.06795981541733812,rbf,TPESampler,COMPLETE
835,0.2927415321934881,2025-04-24 21:11:55.940083,2025-04-24 21:11:56.467727,0 days 00:00:00.527644,20.94090499918701,0.05459419938676885,0.05477944043498669,rbf,TPESampler,COMPLETE
836,0.31556089132470083,2025-04-24 21:11:56.650619,2025-04-24 21:11:57.191624,0 days 00:00:00.541005,95.48753818652754,0.011523702520753607,0.004225538453896073,rbf,TPESampler,COMPLETE
837,0.31202045982649157,2025-04-24 21:11:57.379138,2025-04-24 21:11:57.918984,0 days 00:00:00.539846,83.13368575316397,0.04449437629410584,0.13913547465682785,rbf,TPESampler,COMPLETE
838,0.29752310251086933,2025-04-24 21:11:58.105673,2025-04-24 21:11:58.634420,0 days 00:00:00.528747,99.68251175491568,0.05000272275451079,0.008335340329125184,rbf,TPESampler,COMPLETE
839,0.30008239093587247,2025-04-24 21:11:58.823278,2025-04-24 21:11:59.370895,0 days 00:00:00.547617,25.060948298568274,0.010266115985142966,0.031249900481248188,rbf,TPESampler,COMPLETE
840,0.2897792992829955,2025-04-24 21:11:59.569466,2025-04-24 21:12:00.132349,0 days 00:00:00.562883,77.88826864852717,0.04646871665751452,0.03764228282855933,rbf,TPESampler,COMPLETE
841,0.9051474862337339,2025-04-24 21:12:00.331798,2025-04-24 21:12:01.266620,0 days 00:00:00.934822,14.17231487508705,0.023869268989965674,0.03466838491356433,poly,TPESampler,COMPLETE
842,0.36082019417539074,2025-04-24 21:12:01.463061,2025-04-24 21:12:04.963550,0 days 00:00:03.500489,81.95823766983726,0.11790714086455348,0.01920448332382431,linear,TPESampler,COMPLETE
843,0.2919669735563054,2025-04-24 21:12:05.152769,2025-04-24 21:12:05.728272,0 days 00:00:00.575503,89.3317923473074,0.01924111449609044,0.01594351812158057,rbf,TPESampler,COMPLETE
844,0.3042002649957595,2025-04-24 21:12:05.913161,2025-04-24 21:12:06.709123,0 days 00:00:00.795962,21.204930710576768,0.08442837379906633,0.010328241839350659,rbf,TPESampler,COMPLETE
845,0.3000165924308921,2025-04-24 21:12:06.906967,2025-04-24 21:12:07.441147,0 days 00:00:00.534180,99.6448293184362,0.04534557351643884,0.00953760913009035,rbf,TPESampler,COMPLETE
846,0.29227287922519035,2025-04-24 21:12:07.734566,2025-04-24 21:12:08.404860,0 days 00:00:00.670294,96.46708840293657,0.10586458529820231,0.010910147208744758,rbf,TPESampler,COMPLETE
847,0.28974677006615107,2025-04-24 21:12:08.610452,2025-04-24 21:12:09.318317,0 days 00:00:00.707865,35.39095605912157,0.02477320923286648,0.03492269941568915,rbf,TPESampler,COMPLETE
848,0.29529517072854816,2025-04-24 21:12:09.529462,2025-04-24 21:12:10.264189,0 days 00:00:00.734727,27.37582599067449,0.08425362626719698,0.08354691213299664,rbf,TPESampler,COMPLETE
849,0.307146033151782,2025-04-24 21:12:10.597150,2025-04-24 21:12:11.190715,0 days 00:00:00.593565,98.16712695091736,0.010695340769074666,0.009889034507483312,rbf,TPESampler,COMPLETE
850,0.2847079605253467,2025-04-24 21:12:11.392920,2025-04-24 21:12:12.060668,0 days 00:00:00.667748,86.83794027432765,0.031055433334613223,0.0359088553981315,rbf,TPESampler,COMPLETE
851,0.30471498864164775,2025-04-24 21:12:12.239719,2025-04-24 21:12:12.809424,0 days 00:00:00.569705,98.73881679705033,0.059110251741215834,0.05976937039408349,rbf,TPESampler,COMPLETE
852,0.34752788786822375,2025-04-24 21:12:13.000401,2025-04-24 21:12:13.541609,0 days 00:00:00.541208,1.4348540456808385,0.2976962504228228,0.0016271238572244215,linear,TPESampler,COMPLETE
853,0.3042798590086309,2025-04-24 21:12:13.724440,2025-04-24 21:12:14.288239,0 days 00:00:00.563799,19.571239617968555,0.035358503801664866,0.020983678110270087,rbf,TPESampler,COMPLETE
854,0.3086335761669228,2025-04-24 21:12:14.468117,2025-04-24 21:12:14.981194,0 days 00:00:00.513077,19.40982597766882,0.013393873280250672,0.0222563246019153,rbf,TPESampler,COMPLETE
855,0.30598924127988064,2025-04-24 21:12:15.158028,2025-04-24 21:12:15.694930,0 days 00:00:00.536902,18.67454531482125,0.03561967274452648,0.022195849309278436,rbf,TPESampler,COMPLETE
856,0.30267716611354717,2025-04-24 21:12:15.887499,2025-04-24 21:12:16.435291,0 days 00:00:00.547792,15.491286358936494,0.039372451287527886,0.045989310931382234,rbf,TPESampler,COMPLETE
857,0.4344894651749883,2025-04-24 21:12:16.647556,2025-04-24 21:12:17.146487,0 days 00:00:00.498931,14.681100530526349,0.02299709294326587,0.004279515957307228,rbf,TPESampler,COMPLETE
858,0.28605313732019594,2025-04-24 21:12:17.334904,2025-04-24 21:12:18.209815,0 days 00:00:00.874911,86.97744139128729,0.02118173765911815,0.021587731866146972,rbf,TPESampler,COMPLETE
859,415.3491845332183,2025-04-24 21:12:18.427922,2025-04-24 21:12:18.940179,0 days 00:00:00.512257,76.82378461144562,0.03362216794848866,0.027866929478812166,sigmoid,TPESampler,COMPLETE
860,0.30508495648222644,2025-04-24 21:12:19.125033,2025-04-24 21:12:19.737576,0 days 00:00:00.612543,18.221149485994598,0.05621928117052519,0.025335045342487265,rbf,TPESampler,COMPLETE
861,0.35969607625356514,2025-04-24 21:12:19.921199,2025-04-24 21:12:21.027203,0 days 00:00:01.106004,5.009160580770494,0.05820819012575182,0.044613447227599655,linear,TPESampler,COMPLETE
862,0.30903732428867053,2025-04-24 21:12:21.223543,2025-04-24 21:12:21.754755,0 days 00:00:00.531212,85.36786350759314,0.18533137191230778,0.03475588284636041,rbf,TPESampler,COMPLETE
863,0.3151233503157408,2025-04-24 21:12:21.940683,2025-04-24 21:12:22.484901,0 days 00:00:00.544218,71.58934752377243,0.010141803914387694,0.1348659751932529,rbf,TPESampler,COMPLETE
864,0.922434664514374,2025-04-24 21:12:22.665335,2025-04-24 21:14:51.852534,0 days 00:02:29.187199,69.07037568180756,0.04041552376515515,0.13246584428365152,poly,TPESampler,COMPLETE
865,444.02821531997967,2025-04-24 21:14:20.847031,2025-04-24 21:14:21.330761,0 days 00:00:00.483730,97.55135344876986,0.012356972338485192,0.02445458026875612,sigmoid,TPESampler,COMPLETE
866,0.28355455260770696,2025-04-24 21:14:21.507012,2025-04-24 21:14:22.071107,0 days 00:00:00.564095,92.86972188581998,0.018224588808530225,0.025793715937820243,rbf,TPESampler,COMPLETE
867,0.2830626879331435,2025-04-24 21:14:22.274968,2025-04-24 21:14:22.819702,0 days 00:00:00.544734,85.38915604751224,0.04395598624641037,0.02506093935210335,rbf,TPESampler,COMPLETE
868,0.28219200080733214,2025-04-24 21:14:23.010717,2025-04-24 21:14:23.558020,0 days 00:00:00.547303,98.26858148526567,0.049842731859309694,0.025215510939263795,rbf,TPESampler,COMPLETE
869,0.30495396725535334,2025-04-24 21:14:23.743071,2025-04-24 21:14:24.271055,0 days 00:00:00.527984,70.71509723684221,0.07938971524098676,0.004380380529775438,rbf,TPESampler,COMPLETE
870,0.301617136191282,2025-04-24 21:14:24.458253,2025-04-24 21:14:24.979493,0 days 00:00:00.521240,16.643872661403353,0.07398564782410823,0.014777811988735994,rbf,TPESampler,COMPLETE
871,0.3402698253730219,2025-04-24 21:14:25.180351,2025-04-24 21:14:26.001675,0 days 00:00:00.821324,17.677943595818668,0.19624682261069634,0.008841734155674932,rbf,TPESampler,COMPLETE
872,0.3008612809006087,2025-04-24 21:14:26.238774,2025-04-24 21:14:26.914112,0 days 00:00:00.675338,91.58129449485949,0.043972425223114626,0.009701179821255838,rbf,TPESampler,COMPLETE
873,0.2940553273167802,2025-04-24 21:14:27.118076,2025-04-24 21:14:27.678890,0 days 00:00:00.560814,13.34829969736178,0.03379412986393679,0.13262054928401384,rbf,TPESampler,COMPLETE
874,0.28240736529442945,2025-04-24 21:14:27.869581,2025-04-24 21:14:28.443222,0 days 00:00:00.573641,96.72726081612372,0.0358452286085323,0.025490169551477614,rbf,TPESampler,COMPLETE
875,0.30593263718285635,2025-04-24 21:14:28.639116,2025-04-24 21:14:29.167577,0 days 00:00:00.528461,18.193523884212848,0.11061584794394012,0.019181956489656964,rbf,TPESampler,COMPLETE
876,0.3038997727903879,2025-04-24 21:14:29.358236,2025-04-24 21:14:29.877348,0 days 00:00:00.519112,93.18412777973437,0.05757994446203491,0.04533721062615208,rbf,TPESampler,COMPLETE
877,0.29720702540920446,2025-04-24 21:14:30.066241,2025-04-24 21:14:30.580514,0 days 00:00:00.514273,91.01894656878355,0.12352399623291689,0.037958106884115494,rbf,TPESampler,COMPLETE
878,0.30207028513897116,2025-04-24 21:14:30.762055,2025-04-24 21:14:31.264030,0 days 00:00:00.501975,96.71822009568366,0.03930985194167451,0.005735317243693498,rbf,TPESampler,COMPLETE
879,0.3019026231317255,2025-04-24 21:14:31.568751,2025-04-24 21:14:32.117960,0 days 00:00:00.549209,93.14830210444975,0.10049551280464675,0.09510994629616336,rbf,TPESampler,COMPLETE
880,0.31382644885738065,2025-04-24 21:14:32.321060,2025-04-24 21:14:32.814093,0 days 00:00:00.493033,25.17583931468045,0.02556544527081561,0.00921735069053804,rbf,TPESampler,COMPLETE
881,0.2886474990449695,2025-04-24 21:14:32.991604,2025-04-24 21:14:33.506524,0 days 00:00:00.514920,28.19073206738366,0.03427475711002165,0.04481601245797613,rbf,TPESampler,COMPLETE
882,0.3655196584935044,2025-04-24 21:14:33.699479,2025-04-24 21:14:40.170924,0 days 00:00:06.471445,99.19793209265852,0.018490169477698232,0.053695276508479495,linear,TPESampler,COMPLETE
883,0.3003153414276666,2025-04-24 21:14:40.347522,2025-04-24 21:14:40.878747,0 days 00:00:00.531225,18.646310743719454,0.02889726289811647,0.04231926788263097,rbf,TPESampler,COMPLETE
884,0.2945745124384058,2025-04-24 21:14:41.075266,2025-04-24 21:14:41.599258,0 days 00:00:00.523992,80.51539254742138,0.07600600630196636,0.008992362945549458,rbf,TPESampler,COMPLETE
885,0.30666857041545903,2025-04-24 21:14:41.772432,2025-04-24 21:14:42.328909,0 days 00:00:00.556477,97.14494583791341,0.02633920878712104,0.060192881913497746,rbf,TPESampler,COMPLETE
886,0.29881879503797765,2025-04-24 21:14:42.514862,2025-04-24 21:14:43.024078,0 days 00:00:00.509216,96.54984768108648,0.08853049931438442,0.13015648528521345,rbf,TPESampler,COMPLETE
887,0.6939834437948391,2025-04-24 21:14:43.208270,2025-04-24 21:14:43.698752,0 days 00:00:00.490482,0.0023970898900207275,0.0021807970001239837,0.0033931744007716104,linear,TPESampler,COMPLETE
888,0.36505792353457384,2025-04-24 21:14:43.885464,2025-04-24 21:14:51.856569,0 days 00:00:07.971105,93.01096934830329,0.01930750066656571,0.0031512367498997933,linear,TPESampler,COMPLETE
889,0.29473883558022745,2025-04-24 21:14:52.009254,2025-04-24 21:14:52.667140,0 days 00:00:00.657886,90.05914057517525,0.022467336393368204,0.014378093156668811,rbf,TPESampler,COMPLETE
890,0.8734009138177055,2025-04-24 21:14:52.057290,2025-04-24 21:14:52.750760,0 days 00:00:00.693470,0.12730679806536943,0.994404598479258,0.586653776636122,rbf,TPESampler,COMPLETE
891,0.3013056219916141,2025-04-24 21:14:52.825416,2025-04-24 21:14:53.456967,0 days 00:00:00.631551,87.58734050504832,0.052921526099870705,0.07585961097337376,rbf,TPESampler,COMPLETE
892,0.3082588871189176,2025-04-24 21:14:52.894916,2025-04-24 21:14:53.559172,0 days 00:00:00.664256,92.18995080890262,0.019539869783076865,0.1063021327757166,rbf,TPESampler,COMPLETE
893,0.2855662359317505,2025-04-24 21:14:53.632094,2025-04-24 21:14:54.272735,0 days 00:00:00.640641,97.08740908167287,0.013456102778179857,0.03526751460503731,rbf,TPESampler,COMPLETE
894,0.3016535197446501,2025-04-24 21:14:53.700878,2025-04-24 21:14:54.345472,0 days 00:00:00.644594,14.62781167936598,0.09919305038338082,0.04737258123261948,rbf,TPESampler,COMPLETE
895,0.3019755500815161,2025-04-24 21:14:54.417381,2025-04-24 21:14:55.080443,0 days 00:00:00.663062,21.739455047333674,0.03224231122600653,0.018471168616027267,rbf,TPESampler,COMPLETE
896,0.3037032605098816,2025-04-24 21:14:54.498526,2025-04-24 21:14:55.257148,0 days 00:00:00.758622,16.288595776838633,0.07938637446648153,0.026739266829409372,rbf,TPESampler,COMPLETE
897,0.305567767003106,2025-04-24 21:14:55.260497,2025-04-24 21:14:55.798783,0 days 00:00:00.538286,98.1230934526666,0.06640421323193271,0.04828110681236726,rbf,TPESampler,COMPLETE
898,0.8616977361044496,2025-04-24 21:14:55.417879,2025-04-24 21:14:56.046702,0 days 00:00:00.628823,4.808083014889258,0.10402961755396337,0.002904925265347802,poly,TPESampler,COMPLETE
899,0.2825417152538409,2025-04-24 21:14:55.999969,2025-04-24 21:14:56.568961,0 days 00:00:00.568992,99.3016912630447,0.03286300527432335,0.031411094390956365,rbf,TPESampler,COMPLETE
900,0.28307741590267377,2025-04-24 21:14:56.284596,2025-04-24 21:14:56.935089,0 days 00:00:00.650493,99.64298751899607,0.024662229615270172,0.03226225310620627,rbf,TPESampler,COMPLETE
901,0.37614813622396776,2025-04-24 21:14:56.780446,2025-04-24 21:14:57.317198,0 days 00:00:00.536752,2.432392087059453,0.012662515546918739,0.0650452716779046,rbf,TPESampler,COMPLETE
902,0.34200328528324286,2025-04-24 21:14:57.109119,2025-04-24 21:14:57.597367,0 days 00:00:00.488248,67.23651402166391,0.3144544349100671,0.0064537954246256385,rbf,TPESampler,COMPLETE
903,0.7505446275256825,2025-04-24 21:14:57.553021,2025-04-24 21:14:58.033343,0 days 00:00:00.480322,44.18047046737141,0.11396978623426296,0.010951393258901961,poly,TPESampler,COMPLETE
904,337.3540587218778,2025-04-24 21:14:57.833508,2025-04-24 21:14:58.306111,0 days 00:00:00.472603,43.975451640089645,0.07421932134486339,0.04971778366369115,sigmoid,TPESampler,COMPLETE
905,0.33692145124903483,2025-04-24 21:14:58.259562,2025-04-24 21:14:58.723911,0 days 00:00:00.464349,4.459965763593323,0.07334194896916066,0.2678515479065924,rbf,TPESampler,COMPLETE
906,0.30167375969952975,2025-04-24 21:14:58.547097,2025-04-24 21:14:59.093671,0 days 00:00:00.546574,94.44310841692281,0.03942748846664293,0.04688779249182389,rbf,TPESampler,COMPLETE
907,0.9762177716839043,2025-04-24 21:14:58.948379,2025-04-24 21:14:59.428415,0 days 00:00:00.480036,0.0018880352840948687,0.019799141568501964,0.04937272937245815,sigmoid,TPESampler,COMPLETE
908,0.6943157061897123,2025-04-24 21:14:59.283733,2025-04-24 21:14:59.754991,0 days 00:00:00.471258,0.0016645407674113128,0.36626765364026564,0.0001370714636690009,linear,TPESampler,COMPLETE
909,0.31731968168178376,2025-04-24 21:14:59.601411,2025-04-24 21:15:00.134250,0 days 00:00:00.532839,25.262301162286338,0.03459522473697892,0.20877063200711304,rbf,TPESampler,COMPLETE
910,0.3758447980775072,2025-04-24 21:14:59.946342,2025-04-24 21:15:00.530241,0 days 00:00:00.583899,13.580480640210565,0.012212929625119025,0.00951477722182908,rbf,TPESampler,COMPLETE
911,0.2869115418489148,2025-04-24 21:15:00.311833,2025-04-24 21:15:00.900291,0 days 00:00:00.588458,98.15853721288124,0.056501838572665726,0.031379259504972536,rbf,TPESampler,COMPLETE
912,0.2890513512458814,2025-04-24 21:15:00.752729,2025-04-24 21:15:01.660273,0 days 00:00:00.907544,83.41580574529509,0.007205328178796419,0.026221601144049835,rbf,TPESampler,COMPLETE
913,0.4479603312942019,2025-04-24 21:15:01.307861,2025-04-24 21:15:01.963251,0 days 00:00:00.655390,13.31323963415594,0.06659263428520007,0.004238446005029692,rbf,TPESampler,COMPLETE
914,0.2920429520597133,2025-04-24 21:15:01.896201,2025-04-24 21:15:02.368837,0 days 00:00:00.472636,82.7377815037834,0.1070911907817899,0.012650581045903678,rbf,TPESampler,COMPLETE
915,0.2982308532686178,2025-04-24 21:15:02.165641,2025-04-24 21:15:02.670282,0 days 00:00:00.504641,21.630952845820705,0.01831365052226869,0.1060211457925204,rbf,TPESampler,COMPLETE
916,0.3173095854710688,2025-04-24 21:15:02.609426,2025-04-24 21:15:03.107678,0 days 00:00:00.498252,95.31500356036172,0.022372419190738763,0.19208222634136796,rbf,TPESampler,COMPLETE
917,0.3837073675697879,2025-04-24 21:15:02.858209,2025-04-24 21:15:03.433040,0 days 00:00:00.574831,61.60854355493637,0.03354297679554675,0.0021342463212760043,rbf,TPESampler,COMPLETE
918,0.2952604399830215,2025-04-24 21:15:03.353807,2025-04-24 21:15:03.911907,0 days 00:00:00.558100,87.1951853329991,0.07570609387712997,0.010784635251615255,rbf,TPESampler,COMPLETE
919,0.28873805106942496,2025-04-24 21:15:03.692628,2025-04-24 21:15:04.196232,0 days 00:00:00.503604,94.73655757204256,0.051959534092688914,0.016652793096493514,rbf,TPESampler,COMPLETE
920,0.9017387581163596,2025-04-24 21:15:04.137246,2025-04-24 21:15:05.299574,0 days 00:00:01.162328,84.75297595739832,0.04176300184498195,0.02959674323178325,poly,TPESampler,COMPLETE
921,0.28978349055260705,2025-04-24 21:15:04.406571,2025-04-24 21:15:04.990789,0 days 00:00:00.584218,23.04212017238996,0.01128172824782379,0.0557931040178331,rbf,TPESampler,COMPLETE
922,0.4058154675116852,2025-04-24 21:15:05.179940,2025-04-24 21:15:05.690703,0 days 00:00:00.510763,97.2147508767332,0.07429771982572261,0.0009559266173820248,rbf,TPESampler,COMPLETE
923,0.29604323863885634,2025-04-24 21:15:05.477207,2025-04-24 21:15:06.130442,0 days 00:00:00.653235,83.83963413195072,0.011158767504568113,0.019038748726050783,rbf,TPESampler,COMPLETE
924,0.36283780724441145,2025-04-24 21:15:05.926408,2025-04-24 21:15:10.599310,0 days 00:00:04.672902,89.35489551126119,0.04337413516858789,0.0351298500135084,linear,TPESampler,COMPLETE
925,0.36489214773007084,2025-04-24 21:15:06.501539,2025-04-24 21:15:08.887347,0 days 00:00:02.385808,24.798420455697087,0.011324641286032536,0.0004054272724464722,linear,TPESampler,COMPLETE
926,0.5364761089687572,2025-04-24 21:15:09.086856,2025-04-24 21:15:09.577320,0 days 00:00:00.490464,0.052214257891464014,0.1803746506995694,0.0024787351311710616,linear,TPESampler,COMPLETE
927,0.30395351558082156,2025-04-24 21:15:09.754211,2025-04-24 21:15:10.269333,0 days 00:00:00.515122,94.6932726766333,0.04218601332278104,0.08449839920116212,rbf,TPESampler,COMPLETE
928,0.39852008330946537,2025-04-24 21:15:10.468289,2025-04-24 21:15:10.983179,0 days 00:00:00.514890,16.63857351287465,0.02542570853455705,0.005539508325305813,rbf,TPESampler,COMPLETE
929,0.2888711816687266,2025-04-24 21:15:10.768882,2025-04-24 21:15:11.321469,0 days 00:00:00.552587,85.59433927160966,0.024324351544339796,0.018390626530558205,rbf,TPESampler,COMPLETE
930,0.30973917496634656,2025-04-24 21:15:11.195021,2025-04-24 21:15:11.734619,0 days 00:00:00.539598,15.529144787905718,0.03542162688230912,0.029515319878690587,rbf,TPESampler,COMPLETE
931,0.3050268682479185,2025-04-24 21:15:11.504429,2025-04-24 21:15:12.104163,0 days 00:00:00.599734,96.43625338494687,0.009856165640021106,0.007770875413987275,rbf,TPESampler,COMPLETE
932,0.28471790723329726,2025-04-24 21:15:11.957127,2025-04-24 21:15:12.538509,0 days 00:00:00.581382,95.39511589677689,0.016873306878265777,0.03410897363635839,rbf,TPESampler,COMPLETE
933,0.30191935870052616,2025-04-24 21:15:12.286038,2025-04-24 21:15:12.835215,0 days 00:00:00.549177,23.615497253130403,0.03811007335422915,0.01638721031363289,rbf,TPESampler,COMPLETE
934,0.6885186851069799,2025-04-24 21:15:12.765972,2025-04-24 21:15:13.254289,0 days 00:00:00.488317,0.22197698938465507,0.3357952140340193,0.007453450901562061,rbf,TPESampler,COMPLETE
935,0.2971253034206133,2025-04-24 21:15:13.053092,2025-04-24 21:15:13.543880,0 days 00:00:00.490788,22.86626284348572,0.09290986238493704,0.062472564671152454,rbf,TPESampler,COMPLETE
936,0.2988247478472223,2025-04-24 21:15:13.485407,2025-04-24 21:15:13.995848,0 days 00:00:00.510441,27.85582735575563,0.06561264379615701,0.025665666980416228,rbf,TPESampler,COMPLETE
937,0.3027700763006318,2025-04-24 21:15:13.776436,2025-04-24 21:15:14.300099,0 days 00:00:00.523663,93.29970347787885,0.04748060357649024,0.08213473022112192,rbf,TPESampler,COMPLETE
938,0.30776860710487286,2025-04-24 21:15:14.264568,2025-04-24 21:15:14.741557,0 days 00:00:00.476989,26.036719887808033,0.014554678064577602,0.013401509397367308,rbf,TPESampler,COMPLETE
939,0.3084760259295542,2025-04-24 21:15:14.491008,2025-04-24 21:15:15.097987,0 days 00:00:00.606979,92.33102441063619,0.017149472391893704,0.0737770838428447,rbf,TPESampler,COMPLETE
940,0.6171098730990632,2025-04-24 21:15:14.966973,2025-04-24 21:15:15.421488,0 days 00:00:00.454515,6.842662511994645,0.005148562536059113,0.0016054471300004476,rbf,TPESampler,COMPLETE
941,967.5639980586653,2025-04-24 21:15:15.281636,2025-04-24 21:15:15.798452,0 days 00:00:00.516816,98.74523903526774,0.044906073331003084,0.24268810059294676,sigmoid,TPESampler,COMPLETE
942,0.29178968756102996,2025-04-24 21:15:15.595928,2025-04-24 21:15:16.163104,0 days 00:00:00.567176,17.732140921475047,0.020627839194836288,0.06224722228880618,rbf,TPESampler,COMPLETE
