number,value,datetime_start,datetime_complete,duration,params_C,params_epsilon,params_gamma,params_kernel,system_attrs_auto:sampler,state
589,0.6307122878714483,2025-04-24 21:09:05.366621,2025-04-24 21:09:05.875792,0 days 00:00:00.509171,71.49532981335942,0.12518382232637387,0.00020850368529053032,sigmoid,TPESampler,COMPLETE
590,0.2975620118848983,2025-04-24 21:09:06.137034,2025-04-24 21:09:06.747736,0 days 00:00:00.610702,19.7092350885933,0.05741006354814333,0.06666711571368944,rbf,TPESampler,COMPLETE
591,0.2911369787320264,2025-04-24 21:09:07.021200,2025-04-24 21:09:07.610478,0 days 00:00:00.589278,19.75791958540191,0.02470235518402672,0.05576828521980714,rbf,TPESampler,COMPLETE
592,0.29140986706419314,2025-04-24 21:09:07.818940,2025-04-24 21:09:08.406641,0 days 00:00:00.587701,93.68161568003863,0.019684484006666975,0.04208861593414348,rbf,TPESampler,COMPLETE
593,0.30940060142598524,2025-04-24 21:09:08.589967,2025-04-24 21:09:09.135439,0 days 00:00:00.545472,63.59398137921027,0.005478072555807724,0.006905438292787987,rbf,TPESampler,COMPLETE
594,0.514588249571141,2025-04-24 21:09:09.319323,2025-04-24 21:09:09.826913,0 days 00:00:00.507590,0.2205315233722494,0.7910763254445163,0.023498166421126964,linear,TPESampler,COMPLETE
595,0.8127468830358782,2025-04-24 21:09:10.007422,2025-04-24 21:09:10.492311,0 days 00:00:00.484889,7.9962451488608695,0.006796579071468953,0.009745656902243398,poly,TPESampler,COMPLETE
596,0.2957549004857628,2025-04-24 21:09:10.676266,2025-04-24 21:09:11.221140,0 days 00:00:00.544874,97.12263418394646,0.02360629711642565,0.013087407735214827,rbf,TPESampler,COMPLETE
597,0.30037176195151327,2025-04-24 21:09:11.415941,2025-04-24 21:09:11.916138,0 days 00:00:00.500197,24.752700526636655,0.013654575748504006,0.13407674128504987,rbf,TPESampler,COMPLETE
598,0.8726849305308353,2025-04-24 21:09:12.091373,2025-04-24 21:09:20.644195,0 days 00:00:08.552822,64.92149575817919,0.032419246686735514,0.047877391466913805,poly,TPESampler,COMPLETE
599,0.2971993660486846,2025-04-24 21:09:20.825477,2025-04-24 21:09:21.326348,0 days 00:00:00.500871,98.6746199066438,0.0500554538380156,0.008152902504744085,rbf,TPESampler,COMPLETE
600,0.3020457881826841,2025-04-24 21:09:21.509122,2025-04-24 21:09:22.064123,0 days 00:00:00.555001,95.89765423934337,0.014819964681103413,0.011855859409387779,rbf,TPESampler,COMPLETE
601,0.30779221835498305,2025-04-24 21:09:22.238134,2025-04-24 21:09:22.723054,0 days 00:00:00.484920,11.875480273253451,0.06961403145843764,0.025219643900037825,rbf,TPESampler,COMPLETE
602,0.2997998883643651,2025-04-24 21:09:22.901527,2025-04-24 21:09:23.416912,0 days 00:00:00.515385,90.18322954770913,0.06469723380546877,0.03837022500514385,rbf,TPESampler,COMPLETE
603,0.2842567378181273,2025-04-24 21:09:23.603673,2025-04-24 21:09:24.197474,0 days 00:00:00.593801,93.42418568185025,0.017817793861561057,0.03345629805301601,rbf,TPESampler,COMPLETE
604,0.3617915902613574,2025-04-24 21:09:24.373962,2025-04-24 21:09:24.902600,0 days 00:00:00.528638,0.6691495359630311,0.07820463321246376,0.0004729058292889843,linear,TPESampler,COMPLETE
605,0.30526904601480576,2025-04-24 21:09:25.086181,2025-04-24 21:09:25.580929,0 days 00:00:00.494748,15.670601410773436,0.07490849820355046,0.025706998626854445,rbf,TPESampler,COMPLETE
606,0.2823521523672,2025-04-24 21:09:25.812206,2025-04-24 21:09:26.351068,0 days 00:00:00.538862,96.80721563773828,0.04731320041200966,0.026880584640713398,rbf,TPESampler,COMPLETE
607,0.3198958446485263,2025-04-24 21:09:26.522613,2025-04-24 21:09:27.200505,0 days 00:00:00.677892,85.61965479327567,0.01659974116018355,0.20587383057766667,rbf,TPESampler,COMPLETE
608,0.7695944487094991,2025-04-24 21:09:27.391315,2025-04-24 21:09:27.898794,0 days 00:00:00.507479,63.68140544440758,0.01647341115125289,0.007614184132247109,poly,TPESampler,COMPLETE
609,0.2919412406175367,2025-04-24 21:09:28.091575,2025-04-24 21:09:28.624991,0 days 00:00:00.533416,89.70743948137688,0.06480224175866907,0.03413657218117274,rbf,TPESampler,COMPLETE
610,0.30813976997942794,2025-04-24 21:09:28.819742,2025-04-24 21:09:29.331429,0 days 00:00:00.511687,18.441812676882428,0.003975326887507688,0.017092822985707745,rbf,TPESampler,COMPLETE
611,0.29139515464200544,2025-04-24 21:09:29.501573,2025-04-24 21:09:30.012360,0 days 00:00:00.510787,11.18231871425225,0.11209047550723214,0.10277959482202477,rbf,TPESampler,COMPLETE
612,0.28985665133239724,2025-04-24 21:09:30.210269,2025-04-24 21:09:30.827357,0 days 00:00:00.617088,87.64581840454115,0.0040128817025476705,0.026578999726670462,rbf,TPESampler,COMPLETE
613,0.30665307675770037,2025-04-24 21:09:31.014773,2025-04-24 21:09:31.543962,0 days 00:00:00.529189,16.58003275539291,0.025852770386218454,0.03499028858526276,rbf,TPESampler,COMPLETE
614,0.2949400596941926,2025-04-24 21:09:31.726359,2025-04-24 21:09:32.266467,0 days 00:00:00.540108,16.922724975181122,0.029947450471282798,0.11407017446135752,rbf,TPESampler,COMPLETE
615,112.14123315033183,2025-04-24 21:09:32.455801,2025-04-24 21:09:33.004318,0 days 00:00:00.548517,42.528779003388685,0.011790685129807797,0.015055048894208384,sigmoid,TPESampler,COMPLETE
616,0.2835099872090943,2025-04-24 21:09:33.178614,2025-04-24 21:09:33.724352,0 days 00:00:00.545738,89.77261043795293,0.02353888394048196,0.022753831382547225,rbf,TPESampler,COMPLETE
617,0.3032080446907935,2025-04-24 21:09:33.907980,2025-04-24 21:09:34.403183,0 days 00:00:00.495203,97.72126287291694,0.0756605220403021,0.05568326674543733,rbf,TPESampler,COMPLETE
618,0.3077819646626229,2025-04-24 21:09:34.594978,2025-04-24 21:09:35.086761,0 days 00:00:00.491783,26.211162003156886,0.05609572177100036,0.009119155229265952,rbf,TPESampler,COMPLETE
619,0.36638084783656477,2025-04-24 21:09:35.284187,2025-04-24 21:09:56.177955,0 days 00:00:20.893768,97.49822841836865,0.006795786589670731,0.024735102881679828,linear,TPESampler,COMPLETE
620,10.627959460463291,2025-04-24 21:09:56.369774,2025-04-24 21:09:56.853663,0 days 00:00:00.483889,1.1397692244354667,0.3686552515827141,0.22562887235225867,sigmoid,TPESampler,COMPLETE
621,0.31462928745967467,2025-04-24 21:09:57.037899,2025-04-24 21:09:57.530237,0 days 00:00:00.492338,95.40042113128153,0.04059336675209052,0.1987465650946133,rbf,TPESampler,COMPLETE
622,0.3011024664299934,2025-04-24 21:09:57.716851,2025-04-24 21:09:58.254681,0 days 00:00:00.537830,94.0646279909376,0.032221144347103006,0.010483826896016698,rbf,TPESampler,COMPLETE
623,106.67469070518815,2025-04-24 21:09:58.436730,2025-04-24 21:09:58.950768,0 days 00:00:00.514038,16.708442281139355,0.09713095332699358,0.03321983197972667,sigmoid,TPESampler,COMPLETE
624,0.2975459204157279,2025-04-24 21:09:59.143014,2025-04-24 21:09:59.704452,0 days 00:00:00.561438,17.341584865261353,0.04767234872978897,0.04900370069041009,rbf,TPESampler,COMPLETE
625,0.3087178477953708,2025-04-24 21:09:59.873992,2025-04-24 21:10:00.622257,0 days 00:00:00.748265,18.175983049121502,0.010157762942291015,0.017910878984160192,rbf,TPESampler,COMPLETE
626,527.5648051139538,2025-04-24 21:10:00.884998,2025-04-24 21:10:01.370196,0 days 00:00:00.485198,77.03400725983913,0.025422735880808626,0.03662253072690072,sigmoid,TPESampler,COMPLETE
627,0.6360759126212914,2025-04-24 21:10:01.558654,2025-04-24 21:10:02.059474,0 days 00:00:00.500820,0.8164478276632176,0.018495557426706735,0.009336363369949377,rbf,TPESampler,COMPLETE
628,0.28304042322010514,2025-04-24 21:10:02.244320,2025-04-24 21:10:02.789823,0 days 00:00:00.545503,74.13565920940351,0.026147303741573466,0.026491903069607633,rbf,TPESampler,COMPLETE
629,0.3158898274304595,2025-04-24 21:10:02.976168,2025-04-24 21:10:03.471440,0 days 00:00:00.495272,99.34993067236958,0.20712558245105814,0.020064703148378465,rbf,TPESampler,COMPLETE
630,0.2954860061313763,2025-04-24 21:10:03.658334,2025-04-24 21:10:04.385991,0 days 00:00:00.727657,99.27546820086803,0.10006606267094889,0.004769600752208781,rbf,TPESampler,COMPLETE
631,0.35494096706821826,2025-04-24 21:10:04.577565,2025-04-24 21:10:05.085804,0 days 00:00:00.508239,15.823246131371194,0.057753545975562065,0.009259033607651504,rbf,TPESampler,COMPLETE
632,0.29469468245197017,2025-04-24 21:10:05.277122,2025-04-24 21:10:05.796334,0 days 00:00:00.519212,19.513775795834214,0.04267058259917483,0.0502574044064631,rbf,TPESampler,COMPLETE
633,0.3070477099382104,2025-04-24 21:10:06.147329,2025-04-24 21:10:06.853460,0 days 00:00:00.706131,83.56868365136071,0.019432351698226727,0.07511013474979804,rbf,TPESampler,COMPLETE
634,0.288238917507427,2025-04-24 21:10:07.032117,2025-04-24 21:10:07.688044,0 days 00:00:00.655927,89.78250045152184,0.04810689229419038,0.034677496841824626,rbf,TPESampler,COMPLETE
635,0.3074689303991222,2025-04-24 21:10:07.869403,2025-04-24 21:10:08.364076,0 days 00:00:00.494673,14.708397887396128,0.01855374353704101,0.021426636787054268,rbf,TPESampler,COMPLETE
636,0.28188159281318637,2025-04-24 21:10:08.546923,2025-04-24 21:10:09.112196,0 days 00:00:00.565273,92.0437501097485,0.026300131237919196,0.027124130022618806,rbf,TPESampler,COMPLETE
637,0.29801526932949063,2025-04-24 21:10:09.314242,2025-04-24 21:10:09.832907,0 days 00:00:00.518665,27.340156121758458,0.03872218976242438,0.03484437700973345,rbf,TPESampler,COMPLETE
638,0.28565284791604867,2025-04-24 21:10:10.017657,2025-04-24 21:10:10.543825,0 days 00:00:00.526168,89.65013661179687,0.023735944646221765,0.020915177709613188,rbf,TPESampler,COMPLETE
639,0.28910846905927445,2025-04-24 21:10:10.723770,2025-04-24 21:10:11.246972,0 days 00:00:00.523202,88.65493589982705,0.04890959518869657,0.01729469910709874,rbf,TPESampler,COMPLETE
640,0.8044364109882438,2025-04-24 21:10:11.439446,2025-04-24 21:10:11.932930,0 days 00:00:00.493484,0.16476581537126417,0.002004738496515158,0.0018929835316230292,sigmoid,TPESampler,COMPLETE
641,0.39856297697356186,2025-04-24 21:10:12.116855,2025-04-24 21:10:12.612527,0 days 00:00:00.495672,8.802960991614826,0.03793910578719255,0.010456617386021843,rbf,TPESampler,COMPLETE
642,0.30492525431033984,2025-04-24 21:10:12.801756,2025-04-24 21:10:13.347120,0 days 00:00:00.545364,86.82505415383271,0.028189817745555505,0.08641759062732372,rbf,TPESampler,COMPLETE
643,0.3343815909690917,2025-04-24 21:10:13.531245,2025-04-24 21:10:14.061888,0 days 00:00:00.530643,83.46135583246215,0.01475737115780849,0.0027211530259311045,rbf,TPESampler,COMPLETE
644,0.3008787274315615,2025-04-24 21:10:14.296376,2025-04-24 21:10:14.854369,0 days 00:00:00.557993,97.11332755266872,0.03464904064735307,0.04681488488222055,rbf,TPESampler,COMPLETE
645,0.28289396845700754,2025-04-24 21:10:15.039386,2025-04-24 21:10:15.611036,0 days 00:00:00.571650,99.34770828582434,0.03707634191162017,0.020059963782868683,rbf,TPESampler,COMPLETE
646,0.3013080622105586,2025-04-24 21:10:15.801030,2025-04-24 21:10:16.296380,0 days 00:00:00.495350,19.18227405851367,0.09913047393591012,0.01670054859789994,rbf,TPESampler,COMPLETE
647,0.3043614280686459,2025-04-24 21:10:16.473313,2025-04-24 21:10:16.999270,0 days 00:00:00.525957,15.210036059081293,0.057057095751938215,0.019828036184082173,rbf,TPESampler,COMPLETE
648,0.9853185117929775,2025-04-24 21:10:17.446940,2025-04-24 21:10:17.934167,0 days 00:00:00.487227,0.0034401463447127066,0.02451854764190077,0.9100352341148705,sigmoid,TPESampler,COMPLETE
649,0.2910233912822125,2025-04-24 21:10:18.120437,2025-04-24 21:10:18.642981,0 days 00:00:00.522544,90.29662153739922,0.05743734356315332,0.014694245946788111,rbf,TPESampler,COMPLETE
650,0.2930531167832035,2025-04-24 21:10:18.827925,2025-04-24 21:10:19.369118,0 days 00:00:00.541193,92.83956989796299,0.03641698617992821,0.01372463710903569,rbf,TPESampler,COMPLETE
651,0.33049563590943654,2025-04-24 21:10:19.556041,2025-04-24 21:10:20.068064,0 days 00:00:00.512023,98.69281412362044,0.12045458335836484,0.2347124751661466,rbf,TPESampler,COMPLETE
652,0.3595991295198308,2025-04-24 21:10:20.253941,2025-04-24 21:10:23.427993,0 days 00:00:03.174052,27.133558946694777,0.07286409063669104,0.0011609185619450436,linear,TPESampler,COMPLETE
653,0.2947980278047819,2025-04-24 21:10:23.610680,2025-04-24 21:10:24.112530,0 days 00:00:00.501850,12.080170004627941,0.0650715782834371,0.06745175173398874,rbf,TPESampler,COMPLETE
654,0.294781333461909,2025-04-24 21:10:24.288567,2025-04-24 21:10:24.792902,0 days 00:00:00.504335,74.60372351776726,0.13209162426983265,0.03860870474814777,rbf,TPESampler,COMPLETE
655,0.282762285219821,2025-04-24 21:10:24.965953,2025-04-24 21:10:25.508511,0 days 00:00:00.542558,92.09689508737537,0.06617392839241541,0.025317002356008013,rbf,TPESampler,COMPLETE
656,0.2862804266628306,2025-04-24 21:10:25.695116,2025-04-24 21:10:26.249573,0 days 00:00:00.554457,92.78942150414292,0.07816289544968369,0.019212590926473292,rbf,TPESampler,COMPLETE
657,0.9988358994945872,2025-04-24 21:10:26.437782,2025-04-24 21:10:27.106973,0 days 00:00:00.669191,0.32346929799420654,0.052696189231272464,0.000686777828108067,poly,TPESampler,COMPLETE
658,0.2956896940235641,2025-04-24 21:10:27.301993,2025-04-24 21:10:27.831508,0 days 00:00:00.529515,45.30679423796393,0.10342282050959796,0.02186166505701571,rbf,TPESampler,COMPLETE
659,0.36007110602577064,2025-04-24 21:10:28.011846,2025-04-24 21:10:33.697656,0 days 00:00:05.685810,58.436409793853834,0.08285057865712915,0.044254286586785256,linear,TPESampler,COMPLETE
660,0.2969803652463067,2025-04-24 21:10:33.883638,2025-04-24 21:10:34.411249,0 days 00:00:00.527611,71.40357243909466,0.06512141978514688,0.01103668674379443,rbf,TPESampler,COMPLETE
661,0.7791409179466161,2025-04-24 21:10:34.603832,2025-04-24 21:10:35.118817,0 days 00:00:00.514985,25.89040854569888,0.04940628620445108,0.009436612273396115,poly,TPESampler,COMPLETE
662,0.29538230640099217,2025-04-24 21:10:35.304447,2025-04-24 21:10:35.826948,0 days 00:00:00.522501,83.87468233272538,0.15200660241905173,0.0997544102304972,rbf,TPESampler,COMPLETE
663,0.9775127064876424,2025-04-24 21:10:36.023434,2025-04-24 21:10:36.521647,0 days 00:00:00.498213,0.003975127829189598,0.0032283027400767986,0.007505643974050068,sigmoid,TPESampler,COMPLETE
664,1.0007422845201301,2025-04-24 21:10:36.737883,2025-04-24 21:10:37.253311,0 days 00:00:00.515428,0.0014358799216116361,0.0030001224255354697,0.0004020733552984232,poly,TPESampler,COMPLETE
665,0.30191540235675035,2025-04-24 21:10:37.442262,2025-04-24 21:10:37.954491,0 days 00:00:00.512229,22.980624196884634,0.07382091895392867,0.010373327124263206,rbf,TPESampler,COMPLETE
666,0.29287646006118706,2025-04-24 21:10:38.176307,2025-04-24 21:10:38.741113,0 days 00:00:00.564806,22.535657349612745,0.045455686025571054,0.048927536265904605,rbf,TPESampler,COMPLETE
667,0.29401621114606213,2025-04-24 21:10:38.938455,2025-04-24 21:10:39.482189,0 days 00:00:00.543734,74.3703957730821,0.0890594781888909,0.00623491036953798,rbf,TPESampler,COMPLETE
668,0.39770267585681557,2025-04-24 21:10:39.683892,2025-04-24 21:10:40.233297,0 days 00:00:00.549405,11.002096141332743,0.029087444297747626,0.008534079613129474,rbf,TPESampler,COMPLETE
669,0.3029028034099342,2025-04-24 21:10:40.427968,2025-04-24 21:10:40.997626,0 days 00:00:00.569658,92.41987151240293,0.0324874150208719,0.010034786068507676,rbf,TPESampler,COMPLETE
670,0.2993701325848171,2025-04-24 21:10:41.005399,2025-04-24 21:10:41.594352,0 days 00:00:00.588953,25.728151568404364,0.061004397798449725,0.028350792881562663,rbf,TPESampler,COMPLETE
671,0.36910456842216,2025-04-24 21:10:41.190048,2025-04-24 21:10:41.820197,0 days 00:00:00.630149,0.5915457995927912,0.0011296200998158923,0.0006041859082052764,linear,TPESampler,COMPLETE
672,0.3417470127023662,2025-04-24 21:10:41.783896,2025-04-24 21:10:42.255721,0 days 00:00:00.471825,8.894171217725582,0.18605903175846725,0.015317478174506067,rbf,TPESampler,COMPLETE
673,0.2888592291750767,2025-04-24 21:10:42.016079,2025-04-24 21:10:42.555452,0 days 00:00:00.539373,72.58426337427275,0.07655610157012499,0.032689693599584416,rbf,TPESampler,COMPLETE
674,0.2915030618325623,2025-04-24 21:10:42.467397,2025-04-24 21:10:43.076250,0 days 00:00:00.608853,91.12006659139055,0.027528114432190314,0.0151758627043621,rbf,TPESampler,COMPLETE
675,0.29005014910195265,2025-04-24 21:10:42.760135,2025-04-24 21:10:43.304896,0 days 00:00:00.544761,94.59215098362306,0.12227423320293182,0.0119201917898512,rbf,TPESampler,COMPLETE
676,0.30049725536350436,2025-04-24 21:10:43.258160,2025-04-24 21:10:43.734066,0 days 00:00:00.475906,15.452065640939857,0.02165089725857598,0.050861834659620624,rbf,TPESampler,COMPLETE
677,0.2940808628986862,2025-04-24 21:10:43.523681,2025-04-24 21:10:43.997204,0 days 00:00:00.473523,39.89446449980502,0.07823083715194507,0.09953301703002691,rbf,TPESampler,COMPLETE
678,0.30798260092545054,2025-04-24 21:10:43.942927,2025-04-24 21:10:44.488800,0 days 00:00:00.545873,85.36831757054445,0.05410750385483646,0.13586921009388836,rbf,TPESampler,COMPLETE
679,0.45458502783076443,2025-04-24 21:10:44.193848,2025-04-24 21:10:44.763544,0 days 00:00:00.569696,13.635407831631118,0.022590636256720746,0.0039353499434135785,rbf,TPESampler,COMPLETE
680,0.28977358983241686,2025-04-24 21:10:44.734547,2025-04-24 21:10:45.216659,0 days 00:00:00.482112,98.61532775247514,0.11160902868738835,0.026627229642467883,rbf,TPESampler,COMPLETE
681,0.30550124402261897,2025-04-24 21:10:44.977168,2025-04-24 21:10:45.501439,0 days 00:00:00.524271,20.30642487030054,0.021903830876331444,0.02123444696759453,rbf,TPESampler,COMPLETE
682,0.2981555946575323,2025-04-24 21:10:45.446779,2025-04-24 21:10:45.976485,0 days 00:00:00.529706,95.1593573486266,0.03926194756864142,0.043054919209456824,rbf,TPESampler,COMPLETE
683,0.30282060007159023,2025-04-24 21:10:45.736866,2025-04-24 21:10:46.323436,0 days 00:00:00.586570,91.89344295275737,0.03261321339507311,0.006256147915328165,rbf,TPESampler,COMPLETE
684,0.30990857628719715,2025-04-24 21:10:46.172487,2025-04-24 21:10:46.722164,0 days 00:00:00.549677,21.76328349244298,0.0200622226534756,0.011161563778204578,rbf,TPESampler,COMPLETE
685,0.2834940895147483,2025-04-24 21:10:46.505921,2025-04-24 21:10:46.996452,0 days 00:00:00.490531,81.93921245156767,0.06639444623586341,0.026817671040723204,rbf,TPESampler,COMPLETE
686,0.3043539752594425,2025-04-24 21:10:46.920221,2025-04-24 21:10:47.428895,0 days 00:00:00.508674,88.14055308524372,0.016875419037355788,0.007471644530594192,rbf,TPESampler,COMPLETE
687,0.9860817194923964,2025-04-24 21:10:47.220545,2025-04-24 21:10:47.674985,0 days 00:00:00.454440,0.05829062022313898,0.00774327006481941,0.00013158345340533132,rbf,TPESampler,COMPLETE
688,0.9925020239764286,2025-04-24 21:10:47.638842,2025-04-24 21:10:48.168472,0 days 00:00:00.529630,0.0014060071821687156,0.154418717918084,0.00039445781034262755,sigmoid,TPESampler,COMPLETE
689,0.3062781088931028,2025-04-24 21:10:47.854361,2025-04-24 21:10:48.381538,0 days 00:00:00.527177,10.674902712887674,0.012582298601128071,0.06165400515709835,rbf,TPESampler,COMPLETE
690,0.30640387011380266,2025-04-24 21:10:48.342173,2025-04-24 21:10:48.856894,0 days 00:00:00.514721,91.00116719040362,0.02831539482450222,0.10659807963284276,rbf,TPESampler,COMPLETE
691,0.3038865724283473,2025-04-24 21:10:48.639770,2025-04-24 21:10:49.175584,0 days 00:00:00.535814,93.83274625183967,0.06377412436928552,0.04408248311876134,rbf,TPESampler,COMPLETE
692,0.362902925833168,2025-04-24 21:10:49.076734,2025-04-24 21:10:53.338134,0 days 00:00:04.261400,23.722001399245844,0.017989073503243413,0.05368393202439138,linear,TPESampler,COMPLETE
693,0.30379765444336443,2025-04-24 21:10:49.412729,2025-04-24 21:10:50.076534,0 days 00:00:00.663805,96.88134918898697,0.024125389135387615,0.050934499734404656,rbf,TPESampler,COMPLETE
694,0.3077711640260886,2025-04-24 21:10:50.259239,2025-04-24 21:10:50.896108,0 days 00:00:00.636869,20.260692790234497,0.02868149221272322,0.024101666186333987,rbf,TPESampler,COMPLETE
695,0.36618973947572525,2025-04-24 21:10:51.078507,2025-04-24 21:10:51.635208,0 days 00:00:00.556701,7.793783297909618,0.3745301858328744,0.010668184272252672,linear,TPESampler,COMPLETE
696,0.30463809303022565,2025-04-24 21:10:51.824425,2025-04-24 21:10:52.347795,0 days 00:00:00.523370,97.3489691814544,0.04906432724081051,0.08856617631364913,rbf,TPESampler,COMPLETE
697,0.35843785207470286,2025-04-24 21:10:52.527209,2025-04-24 21:10:53.031621,0 days 00:00:00.504412,6.067722502121487,0.3782647221546411,0.2573005883389223,linear,TPESampler,COMPLETE
698,0.31180934060770554,2025-04-24 21:10:53.214427,2025-04-24 21:10:53.737775,0 days 00:00:00.523348,92.86792764070887,0.008454170054606304,0.07350722403241308,rbf,TPESampler,COMPLETE
699,0.31042823889728766,2025-04-24 21:10:53.513478,2025-04-24 21:10:54.004164,0 days 00:00:00.490686,15.835481191579014,0.02985036477796472,0.027360417986779975,rbf,TPESampler,COMPLETE
700,0.2825733335640566,2025-04-24 21:10:53.954728,2025-04-24 21:10:54.460099,0 days 00:00:00.505371,98.86794880723008,0.041162480746557394,0.02435970880304582,rbf,TPESampler,COMPLETE
701,0.866737699626276,2025-04-24 21:10:54.252246,2025-04-24 21:10:54.931048,0 days 00:00:00.678802,93.0534168436848,0.05387115085077778,0.02060603288441041,poly,TPESampler,COMPLETE
702,0.2894945144869388,2025-04-24 21:10:54.702328,2025-04-24 21:10:55.263455,0 days 00:00:00.561127,79.6132922215364,0.036856409492595894,0.01847037367195298,rbf,TPESampler,COMPLETE
703,0.36326205349721846,2025-04-24 21:10:55.171434,2025-04-24 21:10:55.750863,0 days 00:00:00.579429,31.5022734988625,0.06643319702274081,0.004610607534729062,rbf,TPESampler,COMPLETE
704,0.292792344561779,2025-04-24 21:10:55.510621,2025-04-24 21:10:56.107881,0 days 00:00:00.597260,92.78786847317326,0.06008597779631082,0.012891173388588702,rbf,TPESampler,COMPLETE
705,0.284129098551369,2025-04-24 21:10:55.969222,2025-04-24 21:10:56.523505,0 days 00:00:00.554283,90.25569166915524,0.0758184592159372,0.026396950080599623,rbf,TPESampler,COMPLETE
706,0.3087395767592352,2025-04-24 21:10:56.291112,2025-04-24 21:10:56.825549,0 days 00:00:00.534437,94.99223584641722,0.02700457284249045,0.00465859781424792,rbf,TPESampler,COMPLETE
