number,value,datetime_start,datetime_complete,duration,params_C,params_epsilon,params_gamma,params_kernel,system_attrs_auto:sampler,state
2476,0.8523070383772517,2025-04-24 21:38:46.759093,2025-04-24 21:38:47.299986,0 days 00:00:00.540893,0.2242829744426313,0.1700799434499866,0.012131409713533159,poly,TPESampler,COMPLETE
2477,0.32974111075859536,2025-04-24 21:38:47.514440,2025-04-24 21:38:48.031150,0 days 00:00:00.516710,20.34821280372584,0.1827096733787893,0.01099950396699913,rbf,TPESampler,COMPLETE
2478,0.6024899604104627,2025-04-24 21:38:48.229601,2025-04-24 21:38:48.731694,0 days 00:00:00.502093,0.024469922633863862,0.18594036085379884,0.0005420549451931687,linear,TPESampler,COMPLETE
2479,0.36552191782151255,2025-04-24 21:38:48.925663,2025-04-24 21:38:52.278445,0 days 00:00:03.352782,43.4229459741632,0.011118430254328208,0.18493224648151582,linear,TPESampler,COMPLETE
2480,0.28560306263624896,2025-04-24 21:38:52.478425,2025-04-24 21:38:53.101404,0 days 00:00:00.622979,96.76809683212733,0.03486700277366004,0.01829520908305587,rbf,TPESampler,COMPLETE
2481,0.282558903676724,2025-04-24 21:38:53.322889,2025-04-24 21:38:53.914642,0 days 00:00:00.591753,97.27876710128773,0.021161667527932346,0.0251424611087234,rbf,TPESampler,COMPLETE
2482,0.3034592892662509,2025-04-24 21:38:54.109879,2025-04-24 21:38:54.693302,0 days 00:00:00.583423,91.36884414989551,0.008201688130321839,0.011926734953731736,rbf,TPESampler,COMPLETE
2483,0.2881824235676656,2025-04-24 21:38:54.885379,2025-04-24 21:38:55.553182,0 days 00:00:00.667803,98.29145321167482,0.02156172641714707,0.01760636251201414,rbf,TPESampler,COMPLETE
2484,0.2925847741842922,2025-04-24 21:38:55.755819,2025-04-24 21:38:56.295851,0 days 00:00:00.540032,97.26973761073671,0.07752467826308176,0.01412712292741189,rbf,TPESampler,COMPLETE
2485,0.3010211342622162,2025-04-24 21:38:56.492775,2025-04-24 21:38:57.045810,0 days 00:00:00.553035,24.72859528446898,0.08990263983943826,0.02138326418408513,rbf,TPESampler,COMPLETE
2486,0.8243817131621456,2025-04-24 21:38:57.268860,2025-04-24 21:38:57.806228,0 days 00:00:00.537368,0.029862990475585285,0.263063636097859,0.03099639590665591,sigmoid,TPESampler,COMPLETE
2487,0.34807459224634735,2025-04-24 21:38:58.098381,2025-04-24 21:38:58.660123,0 days 00:00:00.561742,19.510424397499214,0.01805693251181715,0.30633707102746216,rbf,TPESampler,COMPLETE
2488,0.30721063993071784,2025-04-24 21:38:58.853160,2025-04-24 21:38:59.428061,0 days 00:00:00.574901,98.25474253210989,0.02200165555506009,0.07966142333614466,rbf,TPESampler,COMPLETE
2489,0.2932961687706983,2025-04-24 21:38:59.622166,2025-04-24 21:39:00.227613,0 days 00:00:00.605447,21.507164199152754,0.0518018758146118,0.11955956169368397,rbf,TPESampler,COMPLETE
2490,0.32992612556926604,2025-04-24 21:39:00.427746,2025-04-24 21:39:00.971240,0 days 00:00:00.543494,21.307385099887085,0.03852331117991795,0.00936588169411709,rbf,TPESampler,COMPLETE
2491,0.30811607603678437,2025-04-24 21:39:01.163268,2025-04-24 21:39:01.748031,0 days 00:00:00.584763,98.87213962678415,0.008518369900745677,0.00945166598800639,rbf,TPESampler,COMPLETE
2492,0.3136438074668573,2025-04-24 21:39:01.949336,2025-04-24 21:39:02.529602,0 days 00:00:00.580266,98.53332107865458,0.007814237324755805,0.0922015314572225,rbf,TPESampler,COMPLETE
2493,0.38199353480492426,2025-04-24 21:39:02.735143,2025-04-24 21:39:03.298964,0 days 00:00:00.563821,22.593837892594518,0.015331729998246743,0.005274183675303899,rbf,TPESampler,COMPLETE
2494,0.297145565749841,2025-04-24 21:39:03.494845,2025-04-24 21:39:04.028333,0 days 00:00:00.533488,20.224293460303812,0.048495573284512504,0.07832245126521022,rbf,TPESampler,COMPLETE
2495,0.36211812255568787,2025-04-24 21:39:04.225945,2025-04-24 21:39:04.768423,0 days 00:00:00.542478,3.9781304848378873,0.013226056679610528,0.03788818686088308,rbf,TPESampler,COMPLETE
2496,0.4050160555607854,2025-04-24 21:39:04.955209,2025-04-24 21:39:05.506806,0 days 00:00:00.551597,28.018828132101973,0.7529770258480963,0.014386339248051421,linear,TPESampler,COMPLETE
2497,0.7159691957648671,2025-04-24 21:39:05.700188,2025-04-24 21:39:06.503813,0 days 00:00:00.803625,14.561624299731626,0.13485275773794472,0.0412603466448046,poly,TPESampler,COMPLETE
2498,0.290970131214737,2025-04-24 21:39:06.704112,2025-04-24 21:39:07.436105,0 days 00:00:00.731993,93.44660317285954,0.020846833474919352,0.0413547473918272,rbf,TPESampler,COMPLETE
2499,0.29265826007295953,2025-04-24 21:39:07.660794,2025-04-24 21:39:08.238105,0 days 00:00:00.577311,21.192925590553127,0.03303464728587186,0.06593948282407487,rbf,TPESampler,COMPLETE
