number,value,datetime_start,datetime_complete,duration,params_C,params_epsilon,params_gamma,params_kernel,system_attrs_auto:sampler,state
707,0.29994336204604666,2025-04-24 21:10:56.748513,2025-04-24 21:10:57.279071,0 days 00:00:00.530558,23.929514971452484,0.02824241714125189,0.03063822453061788,rbf,TPESampler,COMPLETE
708,0.2904309556570969,2025-04-24 21:10:57.064280,2025-04-24 21:10:57.639468,0 days 00:00:00.575188,96.6085034455932,0.017054498317142938,0.017588944518966136,rbf,TPESampler,COMPLETE
709,0.305652484926023,2025-04-24 21:10:57.487098,2025-04-24 21:10:58.027191,0 days 00:00:00.540093,89.1595353363037,0.03158244912806776,0.05594055661089495,rbf,TPESampler,COMPLETE
710,0.30148514873627796,2025-04-24 21:10:57.808691,2025-04-24 21:10:58.330749,0 days 00:00:00.522058,21.19929483747237,0.04212168330941347,0.01796449986559426,rbf,TPESampler,COMPLETE
711,0.2866480669254354,2025-04-24 21:10:58.271535,2025-04-24 21:10:58.872755,0 days 00:00:00.601220,99.2330967290612,0.041207557069033195,0.017062912423041678,rbf,TPESampler,COMPLETE
712,0.2977092415807967,2025-04-24 21:10:58.534507,2025-04-24 21:10:59.120956,0 days 00:00:00.586449,95.94674716545774,0.053313814172878664,0.03865834595086347,rbf,TPESampler,COMPLETE
713,0.30529153105838985,2025-04-24 21:10:59.076405,2025-04-24 21:10:59.639808,0 days 00:00:00.563403,93.79930062246403,0.0077281433746922,0.007552211058057572,rbf,TPESampler,COMPLETE
714,0.3627699660228035,2025-04-24 21:10:59.345191,2025-04-24 21:10:59.900456,0 days 00:00:00.555265,54.18948788468318,0.43214152274445317,0.049532925048125065,rbf,TPESampler,COMPLETE
715,0.29269034356140705,2025-04-24 21:10:59.847757,2025-04-24 21:11:00.368965,0 days 00:00:00.521208,16.289336164064004,0.06525957634626955,0.12968251460881575,rbf,TPESampler,COMPLETE
716,0.2999220107223427,2025-04-24 21:11:00.143115,2025-04-24 21:11:00.875444,0 days 00:00:00.732329,93.50689847453809,0.009604545990095501,0.01583249296362566,rbf,TPESampler,COMPLETE
717,0.29704632406582465,2025-04-24 21:11:00.705855,2025-04-24 21:11:01.247619,0 days 00:00:00.541764,12.756987783598177,0.057016671578061555,0.08398587876153239,rbf,TPESampler,COMPLETE
718,0.30844083113942117,2025-04-24 21:11:01.044112,2025-04-24 21:11:01.541345,0 days 00:00:00.497233,12.619717977113154,0.0926850302636793,0.02074126845575397,rbf,TPESampler,COMPLETE
719,258.62106047902034,2025-04-24 21:11:01.468301,2025-04-24 21:11:01.931552,0 days 00:00:00.463251,34.85242944565446,0.05278082971488687,0.08171180429331866,sigmoid,TPESampler,COMPLETE
720,245.27462926870714,2025-04-24 21:11:01.780403,2025-04-24 21:11:02.262943,0 days 00:00:00.482540,84.29841874371782,0.12003721938035662,0.01629909952472294,sigmoid,TPESampler,COMPLETE
721,0.28688804778914034,2025-04-24 21:11:02.104653,2025-04-24 21:11:02.638643,0 days 00:00:00.533990,95.51940715571007,0.02452118630032946,0.018528909597294297,rbf,TPESampler,COMPLETE
722,0.30533290646083006,2025-04-24 21:11:02.428219,2025-04-24 21:11:02.983736,0 days 00:00:00.555517,97.59496118149211,0.02654715818823894,0.07649732458362958,rbf,TPESampler,COMPLETE
723,0.3621026652149384,2025-04-24 21:11:02.832367,2025-04-24 21:11:06.923782,0 days 00:00:04.091415,74.33554667140038,0.047783634336872306,0.02180091985436765,linear,TPESampler,COMPLETE
724,0.7499420288132443,2025-04-24 21:11:03.184216,2025-04-24 21:11:03.725764,0 days 00:00:00.541548,3.0256858527862547,0.10897455256796248,0.02715505382126982,poly,TPESampler,COMPLETE
725,0.37197737811972365,2025-04-24 21:11:03.929852,2025-04-24 21:11:04.473319,0 days 00:00:00.543467,14.188945888490462,0.045938840315056975,0.008606803031818515,rbf,TPESampler,COMPLETE
726,0.5578899190108256,2025-04-24 21:11:04.677112,2025-04-24 21:11:05.171706,0 days 00:00:00.494594,19.68140040605136,0.09345653815502616,0.001108149310228543,rbf,TPESampler,COMPLETE
727,0.29831774200652456,2025-04-24 21:11:05.350210,2025-04-24 21:11:05.900142,0 days 00:00:00.549932,18.035271110639233,0.016138687815776386,0.04724986084450574,rbf,TPESampler,COMPLETE
728,0.30435797818309646,2025-04-24 21:11:06.249432,2025-04-24 21:11:06.914084,0 days 00:00:00.664652,93.19896542781107,0.029729330284404405,0.051811721777529664,rbf,TPESampler,COMPLETE
729,0.31059024226673404,2025-04-24 21:11:07.077586,2025-04-24 21:11:07.814139,0 days 00:00:00.736553,15.770950996291022,0.03660475946564433,0.026761408244171603,rbf,TPESampler,COMPLETE
730,0.2922011215497151,2025-04-24 21:11:07.124071,2025-04-24 21:11:07.978364,0 days 00:00:00.854293,87.48377279015877,0.0408540897950634,0.014391199954994075,rbf,TPESampler,COMPLETE
731,0.2922187124877028,2025-04-24 21:11:08.066883,2025-04-24 21:11:08.753938,0 days 00:00:00.687055,87.01369587735152,0.12552798296747028,0.010594935841398076,rbf,TPESampler,COMPLETE
732,0.3068212692341568,2025-04-24 21:11:08.246528,2025-04-24 21:11:08.876121,0 days 00:00:00.629593,9.769584514774873,0.19864866652337113,0.0689013434897414,rbf,TPESampler,COMPLETE
733,0.2820087160284472,2025-04-24 21:11:08.946102,2025-04-24 21:11:09.655285,0 days 00:00:00.709183,98.34844436954633,0.03311258740693875,0.028583049334604513,rbf,TPESampler,COMPLETE
734,0.3623626148477605,2025-04-24 21:11:09.040710,2025-04-24 21:11:10.447349,0 days 00:00:01.406639,5.345356644036223,0.010778295642969116,0.007800033679196441,linear,TPESampler,COMPLETE
735,0.3051884072866143,2025-04-24 21:11:09.867008,2025-04-24 21:11:10.363268,0 days 00:00:00.496260,16.530876057576034,0.11379679864208923,0.015619023053877489,rbf,TPESampler,COMPLETE
736,0.508562889766705,2025-04-24 21:11:10.517168,2025-04-24 21:11:11.272711,0 days 00:00:00.755543,1.2685017259811313,0.026813203544929144,0.03263063762862666,rbf,TPESampler,COMPLETE
737,0.29584290828222365,2025-04-24 21:11:10.590803,2025-04-24 21:11:11.319587,0 days 00:00:00.728784,18.689726808609286,0.03126966113612636,0.04847082735990792,rbf,TPESampler,COMPLETE
738,0.2942355916462332,2025-04-24 21:11:11.413534,2025-04-24 21:11:12.045730,0 days 00:00:00.632196,75.80648006537355,0.05573818745106943,0.039134377811146565,rbf,TPESampler,COMPLETE
739,0.4070223739688275,2025-04-24 21:11:11.456440,2025-04-24 21:11:12.264621,0 days 00:00:00.808181,15.872347278408549,0.026411722689402232,0.005130971352209156,rbf,TPESampler,COMPLETE
740,0.3150727893564668,2025-04-24 21:11:12.224219,2025-04-24 21:11:12.706027,0 days 00:00:00.481808,92.03025381519286,0.05180693097201598,0.003351171215162244,rbf,TPESampler,COMPLETE
741,0.29840376567824095,2025-04-24 21:11:12.452998,2025-04-24 21:11:12.991347,0 days 00:00:00.538349,80.27931234326557,0.11255257341215019,0.04470821089392132,rbf,TPESampler,COMPLETE
742,0.3658361786175235,2025-04-24 21:11:12.914561,2025-04-24 21:11:13.470792,0 days 00:00:00.556231,71.2533082748209,0.4412646374682297,0.06101754124758546,linear,TPESampler,COMPLETE
743,0.2924121798997382,2025-04-24 21:11:13.193614,2025-04-24 21:11:13.710107,0 days 00:00:00.516493,95.08362801956164,0.13454433318650094,0.021925647839082057,rbf,TPESampler,COMPLETE
744,0.9009502369519766,2025-04-24 21:11:13.664788,2025-04-24 21:11:14.169223,0 days 00:00:00.504435,0.1450490702002175,0.43405475047577463,0.0009027059803083135,sigmoid,TPESampler,COMPLETE
745,0.542749510202598,2025-04-24 21:11:13.960493,2025-04-24 21:11:14.516956,0 days 00:00:00.556463,0.05259466604578589,0.012251012234616698,0.00026263372818479666,linear,TPESampler,COMPLETE
746,0.34497213231471785,2025-04-24 21:11:14.459637,2025-04-24 21:11:14.960277,0 days 00:00:00.500640,20.051955504842095,0.018205770973378544,0.2984612046575921,rbf,TPESampler,COMPLETE
747,0.3047873206276632,2025-04-24 21:11:14.731821,2025-04-24 21:11:15.268449,0 days 00:00:00.536628,17.0360944108381,0.03788458484037365,0.016867878034335537,rbf,TPESampler,COMPLETE
748,0.2936548545041291,2025-04-24 21:11:15.179644,2025-04-24 21:11:15.759158,0 days 00:00:00.579514,88.6003789126217,0.061896210281330334,0.012921221530143787,rbf,TPESampler,COMPLETE
749,0.9083412370081193,2025-04-24 21:11:15.544084,2025-04-24 21:11:16.034139,0 days 00:00:00.490055,1.2516956487158235,0.00922855622455728,0.002089592949523691,poly,TPESampler,COMPLETE
750,0.30612896693503133,2025-04-24 21:11:15.969985,2025-04-24 21:11:16.567475,0 days 00:00:00.597490,97.0622063622704,0.012009876448270332,0.05192688608405441,rbf,TPESampler,COMPLETE
751,0.8594477508354088,2025-04-24 21:11:16.243039,2025-04-24 21:11:16.986092,0 days 00:00:00.743053,57.648838671322316,0.8388281389827071,0.0008144518804904141,poly,TPESampler,COMPLETE
752,0.28849413405898505,2025-04-24 21:11:16.778999,2025-04-24 21:11:17.675738,0 days 00:00:00.896739,94.14850787857912,0.03272312206183771,0.01657242215967564,rbf,TPESampler,COMPLETE
753,0.3003460177183507,2025-04-24 21:11:17.461704,2025-04-24 21:11:18.043731,0 days 00:00:00.582027,99.74511201879342,0.026318361732415474,0.010715743010070678,rbf,TPESampler,COMPLETE
754,98.10736322734391,2025-04-24 21:11:17.877104,2025-04-24 21:11:18.353052,0 days 00:00:00.475948,62.69928570629922,0.029979278453294327,0.010817757406935663,sigmoid,TPESampler,COMPLETE
755,0.28527193911525645,2025-04-24 21:11:18.287301,2025-04-24 21:11:18.846850,0 days 00:00:00.559549,96.71431535898195,0.023037395730395125,0.03507291288736204,rbf,TPESampler,COMPLETE
756,0.29411008131999805,2025-04-24 21:11:18.576139,2025-04-24 21:11:19.137325,0 days 00:00:00.561186,25.72995555950714,0.05001669638808971,0.059166700969660584,rbf,TPESampler,COMPLETE
757,0.3103168271483221,2025-04-24 21:11:19.085620,2025-04-24 21:11:19.628477,0 days 00:00:00.542857,15.06293342631143,0.0148118967626583,0.026315986513011844,rbf,TPESampler,COMPLETE
758,0.9169116076802091,2025-04-24 21:11:19.359330,2025-04-24 21:11:20.276912,0 days 00:00:00.917582,83.7426482376007,0.022358488993561597,0.022666404591604968,poly,TPESampler,COMPLETE
759,0.3011539193169219,2025-04-24 21:11:19.847236,2025-04-24 21:11:20.521223,0 days 00:00:00.673987,99.54916278261655,0.04275883158606866,0.008879274936970534,rbf,TPESampler,COMPLETE
760,0.28339222973503825,2025-04-24 21:11:20.472967,2025-04-24 21:11:20.945482,0 days 00:00:00.472515,89.60333026258742,0.06079828658887117,0.027902331376541294,rbf,TPESampler,COMPLETE
761,0.3750143528641915,2025-04-24 21:11:20.747810,2025-04-24 21:11:21.212132,0 days 00:00:00.464322,18.028247767259835,0.021825517517148146,0.007198180414357985,rbf,TPESampler,COMPLETE
762,0.29947180931576584,2025-04-24 21:11:21.163976,2025-04-24 21:11:21.689478,0 days 00:00:00.525502,94.69709149803225,0.015952735929234664,0.04790040172107269,rbf,TPESampler,COMPLETE
763,0.29373818640807736,2025-04-24 21:11:21.440335,2025-04-24 21:11:21.981071,0 days 00:00:00.540736,14.60229688166558,0.041023450593521985,0.10219583965109902,rbf,TPESampler,COMPLETE
764,0.30086476392308875,2025-04-24 21:11:21.904663,2025-04-24 21:11:22.426264,0 days 00:00:00.521601,92.24817733818276,0.0163621466247608,0.012157919999168229,rbf,TPESampler,COMPLETE
765,0.29585419054698997,2025-04-24 21:11:22.200430,2025-04-24 21:11:22.782546,0 days 00:00:00.582116,91.85675359249363,0.036508271460062636,0.042636649499532255,rbf,TPESampler,COMPLETE
766,0.9997370852668667,2025-04-24 21:11:22.642607,2025-04-24 21:11:23.098211,0 days 00:00:00.455604,0.0017948003521915945,0.11413909814658547,0.0020802216246499005,poly,TPESampler,COMPLETE
767,0.9478475088853333,2025-04-24 21:11:22.965717,2025-04-24 21:11:23.411002,0 days 00:00:00.445285,0.006469063033348369,0.0010276510261802427,0.12705074211791784,sigmoid,TPESampler,COMPLETE
768,0.6629310563007744,2025-04-24 21:11:23.270638,2025-04-24 21:11:23.780827,0 days 00:00:00.510189,4.300868403625932,0.35055646911214133,0.9110978043557499,rbf,TPESampler,COMPLETE
769,0.30086439364275097,2025-04-24 21:11:23.601497,2025-04-24 21:11:24.105974,0 days 00:00:00.504477,73.10624537245965,0.07456568704231516,0.10329458745624161,rbf,TPESampler,COMPLETE
770,0.29567855919361974,2025-04-24 21:11:24.052663,2025-04-24 21:11:24.620712,0 days 00:00:00.568049,20.3582166525471,0.02551647724790061,0.11584245235825823,rbf,TPESampler,COMPLETE
771,0.8564126603888379,2025-04-24 21:11:24.362915,2025-04-24 21:11:24.936078,0 days 00:00:00.573163,0.0017695425149572496,0.010524160115209326,0.07543481894905328,poly,TPESampler,COMPLETE
772,0.3181156645040086,2025-04-24 21:11:24.891993,2025-04-24 21:11:25.410489,0 days 00:00:00.518496,16.314274854750813,0.09246615419850986,0.011484520655615232,rbf,TPESampler,COMPLETE
773,0.3109897377533559,2025-04-24 21:11:25.203225,2025-04-24 21:11:25.691283,0 days 00:00:00.488058,17.574461125374878,0.012246542224705672,0.027451277451672647,rbf,TPESampler,COMPLETE
774,0.2831221832773655,2025-04-24 21:11:25.640499,2025-04-24 21:11:26.120063,0 days 00:00:00.479564,92.3205399914575,0.03830381662773927,0.03049314667496975,rbf,TPESampler,COMPLETE
775,0.9914679611315772,2025-04-24 21:11:25.908491,2025-04-24 21:11:26.391421,0 days 00:00:00.482930,0.0015844100782014731,0.001955767333131583,0.27739147263950575,rbf,TPESampler,COMPLETE
776,0.30846997659877357,2025-04-24 21:11:26.336475,2025-04-24 21:11:26.928405,0 days 00:00:00.591930,17.835930434234168,0.03829610255739752,0.026935144182290545,rbf,TPESampler,COMPLETE
777,0.29137862178457874,2025-04-24 21:11:26.601197,2025-04-24 21:11:27.329829,0 days 00:00:00.728632,86.35625919292268,0.05698427353832852,0.035332316909375196,rbf,TPESampler,COMPLETE
778,0.2989701283030667,2025-04-24 21:11:27.281718,2025-04-24 21:11:27.771501,0 days 00:00:00.489783,16.434425396582366,0.13423177579049125,0.05270962661516371,rbf,TPESampler,COMPLETE
779,0.844549421993607,2025-04-24 21:11:27.557978,2025-04-24 21:11:28.052791,0 days 00:00:00.494813,95.20877722251416,0.05992582256957925,0.0023462000784225524,poly,TPESampler,COMPLETE
780,0.8457939261775578,2025-04-24 21:11:27.987369,2025-04-24 21:11:28.661356,0 days 00:00:00.673987,11.70049205028663,0.06652098260765382,0.035231426708295877,poly,TPESampler,COMPLETE
781,0.3441421223904257,2025-04-24 21:11:28.265710,2025-04-24 21:11:28.802066,0 days 00:00:00.536356,25.804553589362143,0.13791428936563438,0.0052856791880648655,rbf,TPESampler,COMPLETE
782,0.2903985869877708,2025-04-24 21:11:28.848476,2025-04-24 21:11:29.388005,0 days 00:00:00.539529,88.77166375113967,0.09997232930349469,0.021247068248553602,rbf,TPESampler,COMPLETE
783,0.3058633311164761,2025-04-24 21:11:29.017888,2025-04-24 21:11:29.629120,0 days 00:00:00.611232,99.81797194715621,0.12355645505879055,0.07344862226724194,rbf,TPESampler,COMPLETE
784,0.3161738065532973,2025-04-24 21:11:29.580530,2025-04-24 21:11:30.086568,0 days 00:00:00.506038,99.43419305605865,0.028217506510489168,0.0034076967109411146,rbf,TPESampler,COMPLETE
785,0.31921609092258035,2025-04-24 21:11:29.877959,2025-04-24 21:11:30.400037,0 days 00:00:00.522078,89.61139422979164,0.030059653540083518,0.14200150660998428,rbf,TPESampler,COMPLETE
786,0.30031584616938223,2025-04-24 21:11:30.287322,2025-04-24 21:11:30.831512,0 days 00:00:00.544190,22.443745148354367,0.06290718508071495,0.02979353483636807,rbf,TPESampler,COMPLETE
787,0.30462076164896035,2025-04-24 21:11:30.622449,2025-04-24 21:11:31.193687,0 days 00:00:00.571238,99.06121578809991,0.03807852991722161,0.05059668654607777,rbf,TPESampler,COMPLETE
788,0.30336333147541555,2025-04-24 21:11:31.049422,2025-04-24 21:11:31.599908,0 days 00:00:00.550486,93.41586495348513,0.01965670322553467,0.008104572631201786,rbf,TPESampler,COMPLETE
789,0.3089192146522986,2025-04-24 21:11:31.376013,2025-04-24 21:11:31.874860,0 days 00:00:00.498847,22.459186112769142,0.04399029433244216,0.010673934779028262,rbf,TPESampler,COMPLETE
790,761.6881198964941,2025-04-24 21:11:31.817587,2025-04-24 21:11:32.307885,0 days 00:00:00.490298,92.4529632176925,0.01575503520196221,0.12216027933026842,sigmoid,TPESampler,COMPLETE
791,0.2986672430908008,2025-04-24 21:11:32.089885,2025-04-24 21:11:32.589807,0 days 00:00:00.499922,99.35970312427543,0.12102638329991935,0.007365025300228846,rbf,TPESampler,COMPLETE
792,0.3593368939989254,2025-04-24 21:11:32.533700,2025-04-24 21:11:33.926153,0 days 00:00:01.392453,18.481234711230076,0.04911732302560854,0.010124267843053867,linear,TPESampler,COMPLETE
793,0.2824762871722874,2025-04-24 21:11:32.809149,2025-04-24 21:11:33.369114,0 days 00:00:00.559965,98.09373536490898,0.05656327679725852,0.026446094763517513,rbf,TPESampler,COMPLETE
794,0.6987302609274013,2025-04-24 21:11:33.551904,2025-04-24 21:11:34.032492,0 days 00:00:00.480588,0.001506702174979525,0.3798349483241582,0.006047537820364642,linear,TPESampler,COMPLETE
795,0.30110987048693544,2025-04-24 21:11:34.106738,2025-04-24 21:11:34.820451,0 days 00:00:00.713713,21.468233944030843,0.052584834273898644,0.03344437583704244,rbf,TPESampler,COMPLETE
796,0.29234681776251653,2025-04-24 21:11:34.174540,2025-04-24 21:11:34.967144,0 days 00:00:00.792604,91.40232377115804,0.07987042345537859,0.032645011309092,rbf,TPESampler,COMPLETE
797,0.3024814345087144,2025-04-24 21:11:35.046576,2025-04-24 21:11:35.751006,0 days 00:00:00.704430,95.71329015296813,0.024330407462501428,0.010339122522675845,rbf,TPESampler,COMPLETE
798,0.3061319493290317,2025-04-24 21:11:35.168669,2025-04-24 21:11:35.869010,0 days 00:00:00.700341,25.02503251235992,0.025759618604549266,0.014508779132292923,rbf,TPESampler,COMPLETE
799,0.2907511062260241,2025-04-24 21:11:35.937760,2025-04-24 21:11:36.570997,0 days 00:00:00.633237,97.76910603349138,0.04928902771902888,0.013795845781849832,rbf,TPESampler,COMPLETE
800,0.2938747372527598,2025-04-24 21:11:36.080183,2025-04-24 21:11:36.711821,0 days 00:00:00.631638,15.0110462333156,0.03363200982002638,0.071325094164296,rbf,TPESampler,COMPLETE
801,0.30623210754843694,2025-04-24 21:11:36.811774,2025-04-24 21:11:37.637329,0 days 00:00:00.825555,98.43889594464427,0.02665913543493607,0.08984730177487597,rbf,TPESampler,COMPLETE
802,0.30548630707221486,2025-04-24 21:11:37.005837,2025-04-24 21:11:37.956607,0 days 00:00:00.950770,89.19862186636216,0.022912641988900233,0.05467326546125558,rbf,TPESampler,COMPLETE
803,0.3651124079270762,2025-04-24 21:11:37.894552,2025-04-24 21:11:41.954582,0 days 00:00:04.060030,56.56017133247699,0.023113042099154896,0.09009009086781293,linear,TPESampler,COMPLETE
804,0.2902963913428605,2025-04-24 21:11:38.276278,2025-04-24 21:11:39.063050,0 days 00:00:00.786772,90.37683586861648,0.03465143223260589,0.015475634133434571,rbf,TPESampler,COMPLETE
805,0.29010594053732747,2025-04-24 21:11:39.338245,2025-04-24 21:11:40.082968,0 days 00:00:00.744723,91.10198564504833,0.06530934046325579,0.01687331110970684,rbf,TPESampler,COMPLETE
806,0.707983522538073,2025-04-24 21:11:40.375342,2025-04-24 21:11:41.082087,0 days 00:00:00.706745,1.640342640633959,0.019085433230571155,0.0005208427669439076,sigmoid,TPESampler,COMPLETE
807,0.3041671008333603,2025-04-24 21:11:41.400876,2025-04-24 21:11:42.145347,0 days 00:00:00.744471,20.187020293887525,0.006290918015443087,0.03257539959567214,rbf,TPESampler,COMPLETE
808,0.7322687567012118,2025-04-24 21:11:42.212874,2025-04-24 21:11:43.464121,0 days 00:00:01.251247,45.356543911186435,0.14369442901349835,0.06312467637677302,poly,TPESampler,COMPLETE
809,0.9122688579792706,2025-04-24 21:11:42.412344,2025-04-24 21:11:43.488802,0 days 00:00:01.076458,0.034416691952011455,0.020856685275573668,0.3814861885406262,poly,TPESampler,COMPLETE
810,0.29921383494524745,2025-04-24 21:11:43.629544,2025-04-24 21:11:44.271059,0 days 00:00:00.641515,12.689151856015185,0.07753241523880808,0.05623770101743318,rbf,TPESampler,COMPLETE
811,0.6308685821774559,2025-04-24 21:11:43.680437,2025-04-24 21:11:44.395335,0 days 00:00:00.714898,13.495364669952842,0.044891110466896506,0.001210959019284709,sigmoid,TPESampler,COMPLETE
812,0.295385309228255,2025-04-24 21:11:44.455917,2025-04-24 21:11:45.069717,0 days 00:00:00.613800,98.47084301033478,0.02672175429206011,0.012969105928708714,rbf,TPESampler,COMPLETE
813,0.30566706871211435,2025-04-24 21:11:44.588447,2025-04-24 21:11:45.290282,0 days 00:00:00.701835,88.60328913348337,0.05007224431528705,0.05279140352445591,rbf,TPESampler,COMPLETE
814,0.29731166679629395,2025-04-24 21:11:45.256119,2025-04-24 21:11:45.737895,0 days 00:00:00.481776,18.628094630308183,0.015884734630285904,0.10630928102775661,rbf,TPESampler,COMPLETE
815,0.3785058781823919,2025-04-24 21:11:45.459733,2025-04-24 21:11:45.992497,0 days 00:00:00.532764,13.190716220327094,0.012469430906323067,0.009392356658960965,rbf,TPESampler,COMPLETE
816,0.7093119845409328,2025-04-24 21:11:45.963176,2025-04-24 21:11:46.466867,0 days 00:00:00.503691,0.08571190282826478,0.001217203955944749,0.013506919746284396,rbf,TPESampler,COMPLETE
817,0.30271349930425906,2025-04-24 21:11:46.143641,2025-04-24 21:11:46.705999,0 days 00:00:00.562358,99.95405522850959,0.09709749637847843,0.04079633793954653,rbf,TPESampler,COMPLETE
818,0.30548118891378157,2025-04-24 21:11:46.661501,2025-04-24 21:11:47.277088,0 days 00:00:00.615587,25.982684992625227,0.04047326172298065,0.0203681523181559,rbf,TPESampler,COMPLETE
819,0.30508712915501035,2025-04-24 21:11:46.941406,2025-04-24 21:11:47.535942,0 days 00:00:00.594536,23.27870709274416,0.03963079745227696,0.012204749728287704,rbf,TPESampler,COMPLETE
820,0.28224411333055255,2025-04-24 21:11:47.488374,2025-04-24 21:11:48.073123,0 days 00:00:00.584749,99.14495602312205,0.03661613105423112,0.02562715709774069,rbf,TPESampler,COMPLETE
821,0.3539330487757259,2025-04-24 21:11:47.787182,2025-04-24 21:11:48.303993,0 days 00:00:00.516811,88.9912776727676,0.05491625781539806,0.30768708396713523,rbf,TPESampler,COMPLETE
822,0.6011152344664994,2025-04-24 21:11:48.264126,2025-04-24 21:11:48.712248,0 days 00:00:00.448122,2.3993712050945453,0.04261633567607281,0.005551865982441778,rbf,TPESampler,COMPLETE
823,0.30818322998149583,2025-04-24 21:11:48.536107,2025-04-24 21:11:49.054071,0 days 00:00:00.517964,16.94019536098532,0.1977274887392504,0.04052339473443182,rbf,TPESampler,COMPLETE
824,0.29580261393248913,2025-04-24 21:11:48.992740,2025-04-24 21:11:49.520749,0 days 00:00:00.528009,99.9727688556793,0.05705311708006073,0.01044411578113222,rbf,TPESampler,COMPLETE
