number,value,datetime_start,datetime_complete,duration,params_C,params_epsilon,params_gamma,params_kernel,system_attrs_auto:sampler,state
2005,52.927681207911114,2025-04-24 21:30:04.734144,2025-04-24 21:30:05.220721,0 days 00:00:00.486577,97.32865270508869,0.006116426651821327,0.006544557540554197,sigmoid,TPESampler,COMPLETE
2006,0.36075122180398655,2025-04-24 21:30:05.007415,2025-04-24 21:30:08.827526,0 days 00:00:03.820111,63.25263949736656,0.05228237483669228,0.01531567584767752,linear,TPESampler,COMPLETE
2007,0.3049687466553968,2025-04-24 21:30:05.491799,2025-04-24 21:30:06.005665,0 days 00:00:00.513866,29.39939134209355,0.023698753420623334,0.01391901099987336,rbf,TPESampler,COMPLETE
2008,0.30477630388926563,2025-04-24 21:30:06.187287,2025-04-24 21:30:06.843919,0 days 00:00:00.656632,89.6045171216852,0.04489070227624524,0.051687504149643224,rbf,TPESampler,COMPLETE
2009,0.30678821934486744,2025-04-24 21:30:07.040576,2025-04-24 21:30:07.579745,0 days 00:00:00.539169,28.161347059389342,0.02717250135991937,0.16407920114518496,rbf,TPESampler,COMPLETE
2010,0.29714359600466916,2025-04-24 21:30:07.766945,2025-04-24 21:30:08.345476,0 days 00:00:00.578531,96.95791495457604,0.037006936776481265,0.01162769689484314,rbf,TPESampler,COMPLETE
2011,0.3308759465154405,2025-04-24 21:30:08.697757,2025-04-24 21:30:09.229397,0 days 00:00:00.531640,2.906884802315245,0.05090525399960235,0.12874674397590327,rbf,TPESampler,COMPLETE
2012,0.7575919952681421,2025-04-24 21:30:09.026789,2025-04-24 21:30:09.843767,0 days 00:00:00.816978,10.032511677639752,0.0010130100030460406,0.021972793747972022,poly,TPESampler,COMPLETE
2013,0.9589915070313425,2025-04-24 21:30:09.563902,2025-04-24 21:30:10.224325,0 days 00:00:00.660423,0.21770608379139142,0.27887070111109835,0.00022818027660282352,sigmoid,TPESampler,COMPLETE
2014,0.3101985000335755,2025-04-24 21:30:10.073486,2025-04-24 21:30:10.619647,0 days 00:00:00.546161,18.687844443141685,0.016433666163263094,0.024619319732002973,rbf,TPESampler,COMPLETE
2015,0.2911850204816726,2025-04-24 21:30:10.394778,2025-04-24 21:30:10.946735,0 days 00:00:00.551957,24.1708086022127,0.024480298630498692,0.06351606745383143,rbf,TPESampler,COMPLETE
2016,0.29801123483998987,2025-04-24 21:30:10.890034,2025-04-24 21:30:11.422050,0 days 00:00:00.532016,25.717935108428605,0.038208547166696485,0.036603611656696684,rbf,TPESampler,COMPLETE
2017,0.28217696989185326,2025-04-24 21:30:11.191087,2025-04-24 21:30:11.765943,0 days 00:00:00.574856,97.1904440111745,0.05465122799190848,0.025479924936677216,rbf,TPESampler,COMPLETE
2018,0.30550427047475426,2025-04-24 21:30:11.639187,2025-04-24 21:30:12.192437,0 days 00:00:00.553250,96.10393660215132,0.00998219688019732,0.007087350426896444,rbf,TPESampler,COMPLETE
2019,0.29160259384721116,2025-04-24 21:30:11.971629,2025-04-24 21:30:12.568843,0 days 00:00:00.597214,32.401146526346395,0.09546959068340431,0.036359991601483364,rbf,TPESampler,COMPLETE
2020,0.36097383678047634,2025-04-24 21:30:12.492092,2025-04-24 21:30:13.087274,0 days 00:00:00.595182,24.05439472927724,0.06702484984579861,0.005932938717336358,rbf,TPESampler,COMPLETE
2021,0.9648544066131274,2025-04-24 21:30:12.826738,2025-04-24 21:30:13.382645,0 days 00:00:00.555907,0.005817208148355462,0.12301750738568545,0.5186623972789477,sigmoid,TPESampler,COMPLETE
2022,0.30239891817004916,2025-04-24 21:30:13.335787,2025-04-24 21:30:13.875217,0 days 00:00:00.539430,30.565101166619154,0.18092369611440656,0.027518767188270878,rbf,TPESampler,COMPLETE
2023,0.3061325091730759,2025-04-24 21:30:13.628290,2025-04-24 21:30:14.203725,0 days 00:00:00.575435,21.819571550778424,0.11740725109841325,0.01524513532894457,rbf,TPESampler,COMPLETE
2024,0.32445290650701153,2025-04-24 21:30:14.157336,2025-04-24 21:30:14.666920,0 days 00:00:00.509584,10.806723646684093,0.21541755557582,0.17102306386266397,rbf,TPESampler,COMPLETE
2025,0.30146652763229803,2025-04-24 21:30:14.509077,2025-04-24 21:30:15.067121,0 days 00:00:00.558044,99.86881015462264,0.1206408756520399,0.04821151261774753,rbf,TPESampler,COMPLETE
2026,0.2989623248912116,2025-04-24 21:30:14.858137,2025-04-24 21:30:15.352522,0 days 00:00:00.494385,25.48319603229568,0.08100903121461751,0.02655777560501978,rbf,TPESampler,COMPLETE
2027,0.6243391125433498,2025-04-24 21:30:15.284501,2025-04-24 21:30:15.743440,0 days 00:00:00.458939,0.07492007071167138,0.9794551816817566,0.0021161855031789872,linear,TPESampler,COMPLETE
2028,0.2991800176797212,2025-04-24 21:30:15.596022,2025-04-24 21:30:16.146184,0 days 00:00:00.550162,75.74274747508676,0.11664220028397687,0.006374345438591406,rbf,TPESampler,COMPLETE
2029,0.3066349969364863,2025-04-24 21:30:15.934930,2025-04-24 21:30:16.513951,0 days 00:00:00.579021,26.940644370673084,0.030172114752853627,0.020083830509506476,rbf,TPESampler,COMPLETE
2030,0.28859313049746166,2025-04-24 21:30:16.372640,2025-04-24 21:30:16.943829,0 days 00:00:00.571189,98.95923481612441,0.0343200091016394,0.03679012524597011,rbf,TPESampler,COMPLETE
2031,0.31463763954106944,2025-04-24 21:30:16.728718,2025-04-24 21:30:17.244100,0 days 00:00:00.515382,94.68751212070177,0.036186896201768716,0.14978687556045447,rbf,TPESampler,COMPLETE
2032,0.3100001372895281,2025-04-24 21:30:17.194320,2025-04-24 21:30:17.971763,0 days 00:00:00.777443,31.997471846197012,0.13617891546462102,0.011846641004039649,rbf,TPESampler,COMPLETE
2033,0.30789757807756035,2025-04-24 21:30:17.484437,2025-04-24 21:30:18.281786,0 days 00:00:00.797349,96.45830182378256,0.06513379621371675,0.11329326892105324,rbf,TPESampler,COMPLETE
2034,0.32411264864260764,2025-04-24 21:30:18.224298,2025-04-24 21:30:18.798680,0 days 00:00:00.574382,6.5541073117346045,0.08929850846883011,0.0488381361197451,rbf,TPESampler,COMPLETE
2035,0.2911128658798889,2025-04-24 21:30:18.575030,2025-04-24 21:30:19.177805,0 days 00:00:00.602775,92.58469619934584,0.0387047541511787,0.038421024833979606,rbf,TPESampler,COMPLETE
2036,0.4931923033865336,2025-04-24 21:30:19.050436,2025-04-24 21:30:19.581105,0 days 00:00:00.530669,5.586116449146161,0.042600756021338754,0.007077346525793656,rbf,TPESampler,COMPLETE
2037,0.3677514856483974,2025-04-24 21:30:19.375526,2025-04-24 21:30:19.876527,0 days 00:00:00.501001,25.171968138012883,0.04750822817845411,0.005474842092148121,rbf,TPESampler,COMPLETE
2038,0.2874153127218507,2025-04-24 21:30:19.830310,2025-04-24 21:30:20.571712,0 days 00:00:00.741402,94.97985500167424,0.007797314181937462,0.03783295858329209,rbf,TPESampler,COMPLETE
2039,0.30625134476566035,2025-04-24 21:30:20.105576,2025-04-24 21:30:20.801971,0 days 00:00:00.696395,23.986868599919372,0.038251941527097016,0.021566164319876426,rbf,TPESampler,COMPLETE
2040,0.30974423702825243,2025-04-24 21:30:20.769743,2025-04-24 21:30:21.274690,0 days 00:00:00.504947,21.129367759021513,0.010249157913348836,0.025268120341000094,rbf,TPESampler,COMPLETE
2041,0.3647724517218858,2025-04-24 21:30:21.016059,2025-04-24 21:30:21.573260,0 days 00:00:00.557201,32.27263480251611,0.020727255653132236,0.004920170264117266,rbf,TPESampler,COMPLETE
2042,0.3054922763876605,2025-04-24 21:30:21.529036,2025-04-24 21:30:22.158308,0 days 00:00:00.629272,99.55602196141197,0.029357557878875222,0.09008693117934544,rbf,TPESampler,COMPLETE
2043,0.9836271578954251,2025-04-24 21:30:21.795844,2025-04-24 21:30:22.388711,0 days 00:00:00.592867,0.008615736220887245,0.0051356172571964806,0.0011082839690918019,rbf,TPESampler,COMPLETE
2044,0.30445662699357984,2025-04-24 21:30:22.349827,2025-04-24 21:30:22.919556,0 days 00:00:00.569729,96.47642991416294,0.02442824277732891,0.0054702663146617555,rbf,TPESampler,COMPLETE
2045,0.3031670437935778,2025-04-24 21:30:22.624949,2025-04-24 21:30:23.156458,0 days 00:00:00.531509,90.87104988661856,0.036060100764699704,0.009386218058826962,rbf,TPESampler,COMPLETE
2046,0.2962445523103535,2025-04-24 21:30:23.120742,2025-04-24 21:30:23.675116,0 days 00:00:00.554374,19.505758909544596,0.012732530299959986,0.08828687516970674,rbf,TPESampler,COMPLETE
2047,0.3004987935218929,2025-04-24 21:30:23.426318,2025-04-24 21:30:23.953781,0 days 00:00:00.527463,24.47514142046624,0.08072434518883552,0.022539736398773023,rbf,TPESampler,COMPLETE
2048,0.9953212760840889,2025-04-24 21:30:23.908031,2025-04-24 21:30:24.331336,0 days 00:00:00.423305,0.0042625256372218435,0.0628680262247652,0.7215577208067904,rbf,TPESampler,COMPLETE
2049,0.299037603576754,2025-04-24 21:30:24.198200,2025-04-24 21:30:24.736572,0 days 00:00:00.538372,92.35815833628405,0.035152684106280405,0.011030304574104945,rbf,TPESampler,COMPLETE
2050,0.29759172505939313,2025-04-24 21:30:24.519492,2025-04-24 21:30:25.034173,0 days 00:00:00.514681,24.124271180002925,0.049958900053099956,0.0713267348556135,rbf,TPESampler,COMPLETE
2051,0.3073676158743082,2025-04-24 21:30:24.949136,2025-04-24 21:30:25.462694,0 days 00:00:00.513558,21.876442575205928,0.017061786947000095,0.016631802151387234,rbf,TPESampler,COMPLETE
2052,0.28259489235668916,2025-04-24 21:30:25.270359,2025-04-24 21:30:25.835921,0 days 00:00:00.565562,91.08912531393146,0.0504989751494363,0.02646307564564087,rbf,TPESampler,COMPLETE
2053,0.29067512828618475,2025-04-24 21:30:25.707662,2025-04-24 21:30:26.255979,0 days 00:00:00.548317,94.12009882141798,0.07281485950754296,0.016279120884736622,rbf,TPESampler,COMPLETE
2054,0.9879315325927029,2025-04-24 21:30:26.038014,2025-04-24 21:30:26.532473,0 days 00:00:00.494459,0.0010454285675258023,0.0014690761466367467,0.3192528246190981,sigmoid,TPESampler,COMPLETE
2055,0.29312255869327236,2025-04-24 21:30:26.487847,2025-04-24 21:30:27.155216,0 days 00:00:00.667369,99.32044777742556,0.021150713349448874,0.04244489393881697,rbf,TPESampler,COMPLETE
2056,0.9980330532107702,2025-04-24 21:30:26.818472,2025-04-24 21:30:27.387786,0 days 00:00:00.569314,0.32294872780521744,0.001695408367562277,0.0009620746121685997,poly,TPESampler,COMPLETE
2057,0.2909873479778269,2025-04-24 21:30:27.346686,2025-04-24 21:30:27.856456,0 days 00:00:00.509770,89.40792997926988,0.11031129853219852,0.012446248834465387,rbf,TPESampler,COMPLETE
2058,0.36144662861540694,2025-04-24 21:30:27.593378,2025-04-24 21:30:33.672809,0 days 00:00:06.079431,88.77241171460197,0.037303407425888564,0.39622013112305615,linear,TPESampler,COMPLETE
2059,0.6972635533158462,2025-04-24 21:30:28.081684,2025-04-24 21:30:28.595761,0 days 00:00:00.514077,0.0015106532849692167,0.017082477365751608,0.014363077273899296,linear,TPESampler,COMPLETE
2060,123.72545776655268,2025-04-24 21:30:28.814479,2025-04-24 21:30:29.335770,0 days 00:00:00.521291,26.727195695715807,0.02911955875030582,0.024921153901940576,sigmoid,TPESampler,COMPLETE
2061,0.29726861188870407,2025-04-24 21:30:29.531631,2025-04-24 21:30:30.060203,0 days 00:00:00.528572,25.574420039144435,0.022243335271220625,0.11668777900955449,rbf,TPESampler,COMPLETE
2062,0.3697123680117363,2025-04-24 21:30:30.236171,2025-04-24 21:30:30.706732,0 days 00:00:00.470561,42.52104143514855,0.4737592391020805,0.021537700475242418,rbf,TPESampler,COMPLETE
2063,0.30395593920656433,2025-04-24 21:30:30.883290,2025-04-24 21:30:31.399871,0 days 00:00:00.516581,90.19719251057242,0.056316025434981376,0.0645087612308726,rbf,TPESampler,COMPLETE
2064,0.3466817216286666,2025-04-24 21:30:31.584180,2025-04-24 21:30:32.081700,0 days 00:00:00.497520,4.25973164158144,0.07269273305660016,0.038718285059392205,rbf,TPESampler,COMPLETE
2065,0.36687172485303404,2025-04-24 21:30:32.282367,2025-04-24 21:30:41.267408,0 days 00:00:08.985041,61.04036707481373,0.0034462734065027613,0.0001270373870306824,linear,TPESampler,COMPLETE
2066,0.3023283209636307,2025-04-24 21:30:33.856512,2025-04-24 21:30:34.445901,0 days 00:00:00.589389,99.27385907633543,0.07595843048394998,0.08765040611674611,rbf,TPESampler,COMPLETE
2067,0.41831656995222916,2025-04-24 21:30:34.881336,2025-04-24 21:30:35.429584,0 days 00:00:00.548248,3.6533865821293974,0.012170417026198598,0.02196641997689192,rbf,TPESampler,COMPLETE
2068,0.2982523920555068,2025-04-24 21:30:35.620543,2025-04-24 21:30:36.182544,0 days 00:00:00.562001,95.23546642251357,0.016672226865006422,0.013366024053317145,rbf,TPESampler,COMPLETE
2069,0.30196040419147,2025-04-24 21:30:36.365559,2025-04-24 21:30:36.883813,0 days 00:00:00.518254,19.754893631939062,0.022554474177410116,0.035849807761814866,rbf,TPESampler,COMPLETE
2070,0.35900877727757663,2025-04-24 21:30:37.062945,2025-04-24 21:30:39.917903,0 days 00:00:02.854958,15.383865858399878,0.06230444894538633,0.10629063598413777,linear,TPESampler,COMPLETE
2071,85.29855858648524,2025-04-24 21:30:40.102881,2025-04-24 21:30:40.602027,0 days 00:00:00.499146,12.807751245015798,0.09750823666846178,0.03496929114808721,sigmoid,TPESampler,COMPLETE
2072,2.3959706212236926,2025-04-24 21:30:40.787126,2025-04-24 21:30:41.295115,0 days 00:00:00.507989,0.2593553652330718,0.003177819897766994,0.16518645518693384,sigmoid,TPESampler,COMPLETE
2073,0.29343367676193666,2025-04-24 21:30:41.428976,2025-04-24 21:30:42.080079,0 days 00:00:00.651103,17.784502636172302,0.030205421097580152,0.07487064643999634,rbf,TPESampler,COMPLETE
2074,0.30467190129875404,2025-04-24 21:30:41.477900,2025-04-24 21:30:42.204252,0 days 00:00:00.726352,25.22324902260714,0.04070575807705267,0.013170397223848374,rbf,TPESampler,COMPLETE
2075,0.30018735459169626,2025-04-24 21:30:42.259332,2025-04-24 21:30:42.909352,0 days 00:00:00.650020,88.98400226913934,0.17248424390853145,0.023458301817182673,rbf,TPESampler,COMPLETE
2076,0.913488101610353,2025-04-24 21:30:42.393871,2025-04-24 21:30:43.018643,0 days 00:00:00.624772,0.012861638139138624,0.008856170721030425,0.12189690419486175,sigmoid,TPESampler,COMPLETE
2077,0.30929970125711587,2025-04-24 21:30:43.093683,2025-04-24 21:30:43.766453,0 days 00:00:00.672770,96.04704699231009,0.014652366589903851,0.06157921522563783,rbf,TPESampler,COMPLETE
2078,0.35943487760479725,2025-04-24 21:30:43.213591,2025-04-24 21:30:49.559189,0 days 00:00:06.345598,97.93087789964719,0.058109432788813496,0.05100875926079399,linear,TPESampler,COMPLETE
2079,0.310251450617123,2025-04-24 21:30:43.965095,2025-04-24 21:30:44.522826,0 days 00:00:00.557731,24.238049122483456,0.06967186531548696,0.008924862300050502,rbf,TPESampler,COMPLETE
2080,0.3024020194278402,2025-04-24 21:30:44.711451,2025-04-24 21:30:45.259958,0 days 00:00:00.548507,99.73373367036143,0.03671659935236501,0.005668558613259009,rbf,TPESampler,COMPLETE
2081,0.30914318509400107,2025-04-24 21:30:45.438159,2025-04-24 21:30:45.946250,0 days 00:00:00.508091,26.233918701390547,0.011853829665942155,0.01142012257410339,rbf,TPESampler,COMPLETE
2082,0.30819363081083506,2025-04-24 21:30:46.131570,2025-04-24 21:30:46.640902,0 days 00:00:00.509332,15.853523141632124,0.03963267039111353,0.024830229727864462,rbf,TPESampler,COMPLETE
2083,0.29665697659479223,2025-04-24 21:30:46.829071,2025-04-24 21:30:47.408413,0 days 00:00:00.579342,97.35962986774933,0.008675998566483517,0.01908058863959117,rbf,TPESampler,COMPLETE
2084,0.8780583404674344,2025-04-24 21:30:47.588290,2025-04-24 21:30:48.744905,0 days 00:00:01.156615,3.7029658288706804,0.040171242074874665,0.0782632410383012,poly,TPESampler,COMPLETE
2085,0.3003924121896443,2025-04-24 21:30:48.924001,2025-04-24 21:30:49.452794,0 days 00:00:00.528793,21.730210422101795,0.07227459218980757,0.15400266597399906,rbf,TPESampler,COMPLETE
2086,0.3040320319701065,2025-04-24 21:30:49.610947,2025-04-24 21:30:50.322174,0 days 00:00:00.711227,88.75678467008883,0.06037232343052236,0.04541428754589889,rbf,TPESampler,COMPLETE
2087,0.2843960566296123,2025-04-24 21:30:49.694575,2025-04-24 21:30:50.562294,0 days 00:00:00.867719,92.68834453149371,0.019977506704818064,0.022551142712998046,rbf,TPESampler,COMPLETE
2088,0.2977754741632333,2025-04-24 21:30:50.524963,2025-04-24 21:30:51.098560,0 days 00:00:00.573597,25.0057318022043,0.040617063548343914,0.08243827652063625,rbf,TPESampler,COMPLETE
2089,0.3066232312640011,2025-04-24 21:30:50.788317,2025-04-24 21:30:51.336662,0 days 00:00:00.548345,90.6836304649773,0.030083913373361592,0.05887803041674592,rbf,TPESampler,COMPLETE
2090,0.2903491365352056,2025-04-24 21:30:51.292545,2025-04-24 21:30:51.798995,0 days 00:00:00.506450,88.99077026428199,0.053465091215166564,0.016245804438844248,rbf,TPESampler,COMPLETE
2091,0.4710262375090839,2025-04-24 21:30:51.576747,2025-04-24 21:30:52.095429,0 days 00:00:00.518682,98.70369156521645,0.0944530093014051,0.5296256780583988,rbf,TPESampler,COMPLETE
2092,0.8815222266244889,2025-04-24 21:30:52.027661,2025-04-24 21:32:54.321272,0 days 00:02:02.293611,19.495222534078444,0.028320932050451997,0.12352060456136447,poly,TPESampler,COMPLETE
2093,0.30636931424307823,2025-04-24 21:30:52.336944,2025-04-24 21:30:52.915276,0 days 00:00:00.578332,21.766616343894366,0.031130992957337456,0.011854721735585737,rbf,TPESampler,COMPLETE
2094,0.28751020411439887,2025-04-24 21:30:53.104088,2025-04-24 21:30:53.686315,0 days 00:00:00.582227,89.76213512474942,0.010242109857468243,0.025638287614796175,rbf,TPESampler,COMPLETE
2095,0.3020900514670077,2025-04-24 21:30:53.869960,2025-04-24 21:30:54.382087,0 days 00:00:00.512127,26.386047318227618,0.03801510432754147,0.02603840380076493,rbf,TPESampler,COMPLETE
2096,0.33514995111373197,2025-04-24 21:30:54.565617,2025-04-24 21:30:55.087459,0 days 00:00:00.521842,94.19666657143608,0.01043536589556525,0.2692604830433844,rbf,TPESampler,COMPLETE
2097,0.2909690876303818,2025-04-24 21:30:55.277780,2025-04-24 21:30:55.873252,0 days 00:00:00.595472,23.132232585495004,0.008082865253737201,0.060547357233341245,rbf,TPESampler,COMPLETE
2098,0.8406689924098681,2025-04-24 21:30:56.066839,2025-04-24 21:30:56.588234,0 days 00:00:00.521395,36.726044969894126,0.10449350408345623,0.018396943339788127,poly,TPESampler,COMPLETE
2099,0.30447230327357416,2025-04-24 21:30:56.773507,2025-04-24 21:30:57.418797,0 days 00:00:00.645290,97.17162009271077,0.01773704027578211,0.006566886727078312,rbf,TPESampler,COMPLETE
2100,0.30644588462831884,2025-04-24 21:30:57.603782,2025-04-24 21:30:58.137815,0 days 00:00:00.534033,21.742380491150463,0.03871395756152621,0.021453732975923498,rbf,TPESampler,COMPLETE
2101,0.31210903148203084,2025-04-24 21:30:58.320596,2025-04-24 21:30:58.867075,0 days 00:00:00.546479,22.311052287064356,0.004382021441346853,0.022392467506390415,rbf,TPESampler,COMPLETE
2102,0.5595941266308802,2025-04-24 21:30:59.064338,2025-04-24 21:30:59.589962,0 days 00:00:00.525624,19.471129459574197,0.01775805124997871,0.00111903842046428,rbf,TPESampler,COMPLETE
2103,0.28414539967228475,2025-04-24 21:30:59.778006,2025-04-24 21:31:00.331091,0 days 00:00:00.553085,95.00080719078156,0.07540118289637211,0.022288466218347267,rbf,TPESampler,COMPLETE
2104,0.2999145311221311,2025-04-24 21:31:00.530707,2025-04-24 21:31:01.075010,0 days 00:00:00.544303,22.929767089364574,0.08286974868036165,0.026704108676848453,rbf,TPESampler,COMPLETE
2105,0.3069308271404995,2025-04-24 21:31:01.258345,2025-04-24 21:31:01.763955,0 days 00:00:00.505610,16.865364903804124,0.18531985057828132,0.03456965974530575,rbf,TPESampler,COMPLETE
2106,0.3096526418089131,2025-04-24 21:31:01.958506,2025-04-24 21:31:02.541820,0 days 00:00:00.583314,92.45148091175739,0.013060152532265189,0.06888873440808711,rbf,TPESampler,COMPLETE
2107,0.3052759538867396,2025-04-24 21:31:02.731244,2025-04-24 21:31:03.306977,0 days 00:00:00.575733,96.29810713928137,0.029264296485057486,0.09279261392950927,rbf,TPESampler,COMPLETE
2108,0.30753588618239225,2025-04-24 21:31:03.494077,2025-04-24 21:31:04.094368,0 days 00:00:00.600291,23.041448435639133,0.029976474884444358,0.021632618770233755,rbf,TPESampler,COMPLETE
2109,0.29560672487778594,2025-04-24 21:31:04.278470,2025-04-24 21:31:04.784766,0 days 00:00:00.506296,96.69678823949214,0.09998761540795817,0.005305363360203066,rbf,TPESampler,COMPLETE
2110,0.28950919236361605,2025-04-24 21:31:04.968889,2025-04-24 21:31:05.544368,0 days 00:00:00.575479,93.6675098753714,0.02605735723527251,0.016005115540318554,rbf,TPESampler,COMPLETE
2111,0.3063714103299192,2025-04-24 21:31:05.839303,2025-04-24 21:31:06.450946,0 days 00:00:00.611643,25.187029087735834,0.02768179993124144,0.021382463306116487,rbf,TPESampler,COMPLETE
2112,0.6964594616056506,2025-04-24 21:31:06.630370,2025-04-24 21:31:07.121098,0 days 00:00:00.490728,0.001991549248559487,0.02306835156698501,0.6260755026472031,linear,TPESampler,COMPLETE
2113,0.4957142654324552,2025-04-24 21:31:07.307329,2025-04-24 21:31:07.810675,0 days 00:00:00.503346,4.0342156624689745,0.04455682903334772,0.009903850740420047,rbf,TPESampler,COMPLETE
2114,0.30529975439890655,2025-04-24 21:31:07.987781,2025-04-24 21:31:08.508799,0 days 00:00:00.521018,25.39365560046981,0.032195947948353745,0.021913823288778538,rbf,TPESampler,COMPLETE
2115,0.2906195980581113,2025-04-24 21:31:08.730541,2025-04-24 21:31:09.448615,0 days 00:00:00.718074,98.82637369302395,0.06095178174012563,0.015248530308487034,rbf,TPESampler,COMPLETE
2116,0.29453488180444304,2025-04-24 21:31:09.634909,2025-04-24 21:31:10.384611,0 days 00:00:00.749702,21.197983249544148,0.08100816673189543,0.13429905828907324,rbf,TPESampler,COMPLETE
2117,0.28612299591232815,2025-04-24 21:31:10.597622,2025-04-24 21:31:11.423485,0 days 00:00:00.825863,97.28963414193227,0.017735475060053036,0.021049272374793992,rbf,TPESampler,COMPLETE
2118,0.3066047054285863,2025-04-24 21:31:11.608090,2025-04-24 21:31:12.170432,0 days 00:00:00.562342,58.425949897136114,0.002734427396433917,0.009374851280668707,rbf,TPESampler,COMPLETE
2119,0.2839327232686613,2025-04-24 21:31:12.375972,2025-04-24 21:31:12.958768,0 days 00:00:00.582796,97.17511231672756,0.037889304156310456,0.03206195205060919,rbf,TPESampler,COMPLETE
2120,0.5400026207616312,2025-04-24 21:31:13.153234,2025-04-24 21:31:13.667078,0 days 00:00:00.513844,9.157996117988663,0.009660262076668551,0.0028737457671978214,rbf,TPESampler,COMPLETE
2121,0.3628858076530557,2025-04-24 21:31:13.854153,2025-04-24 21:31:14.409912,0 days 00:00:00.555759,2.334172550422241,0.004374863521380049,0.09149236791851745,rbf,TPESampler,COMPLETE
