number,value,datetime_start,datetime_complete,duration,params_C,params_epsilon,params_gamma,params_kernel,system_attrs_auto:sampler,state
235,0.991726734571215,2025-04-24 21:01:24.070393,2025-04-24 21:01:24.546111,0 days 00:00:00.475718,0.008169533767823606,0.042144959352082026,0.004836915492007501,poly,TPESampler,COMPLETE
236,0.28913229695307374,2025-04-24 21:01:24.738719,2025-04-24 21:01:25.313377,0 days 00:00:00.574658,42.119809756438315,0.02756197124250673,0.051744666782156376,rbf,TPESampler,COMPLETE
237,0.344657441913724,2025-04-24 21:01:25.511931,2025-04-24 21:01:26.037030,0 days 00:00:00.525099,19.63988435742487,0.011875664737524716,0.009600290547233695,rbf,TPESampler,COMPLETE
238,0.28777027227546287,2025-04-24 21:01:26.240815,2025-04-24 21:01:26.807253,0 days 00:00:00.566438,97.15677557007534,0.03326986716373958,0.03660606582958259,rbf,TPESampler,COMPLETE
239,0.2943418219508934,2025-04-24 21:01:27.000838,2025-04-24 21:01:27.711113,0 days 00:00:00.710275,97.5726794807837,0.05721693247085016,0.03553262575330678,rbf,TPESampler,COMPLETE
240,0.2934904084961428,2025-04-24 21:01:27.897935,2025-04-24 21:01:28.487145,0 days 00:00:00.589210,70.02337344771115,0.009114131440046112,0.04879077582554292,rbf,TPESampler,COMPLETE
241,0.4273081190028239,2025-04-24 21:01:28.687991,2025-04-24 21:01:29.183974,0 days 00:00:00.495983,13.786309212675018,0.0373123587394797,0.0048027794059689434,rbf,TPESampler,COMPLETE
242,0.3279983874442767,2025-04-24 21:01:29.363680,2025-04-24 21:01:29.911601,0 days 00:00:00.547921,15.463732897427558,0.00689283409297544,0.013487488946775227,rbf,TPESampler,COMPLETE
243,0.3018960532059274,2025-04-24 21:01:30.112156,2025-04-24 21:01:30.777098,0 days 00:00:00.664942,55.71780801215182,0.01037561531204972,0.018266596798128983,rbf,TPESampler,COMPLETE
244,0.3356199877179987,2025-04-24 21:01:30.994971,2025-04-24 21:01:31.538559,0 days 00:00:00.543588,90.67105622134478,0.01070034317636038,0.002545770183981006,rbf,TPESampler,COMPLETE
245,0.3054837078320655,2025-04-24 21:01:31.727303,2025-04-24 21:01:32.323025,0 days 00:00:00.595722,99.25192323260909,0.009611959793610342,0.010443530597164427,rbf,TPESampler,COMPLETE
246,0.28364209080458114,2025-04-24 21:01:32.514142,2025-04-24 21:01:33.094324,0 days 00:00:00.580182,91.13156624127588,0.025444095496852955,0.03416446811362963,rbf,TPESampler,COMPLETE
247,0.30506770888791734,2025-04-24 21:01:33.280495,2025-04-24 21:01:33.828504,0 days 00:00:00.548009,69.44751253199475,0.021537229905351753,0.07629102892173618,rbf,TPESampler,COMPLETE
248,0.28461809277813654,2025-04-24 21:01:34.007794,2025-04-24 21:01:34.568270,0 days 00:00:00.560476,70.50428227758628,0.021588297696288023,0.026447738150725555,rbf,TPESampler,COMPLETE
249,0.30598659527578914,2025-04-24 21:01:34.767049,2025-04-24 21:01:35.405095,0 days 00:00:00.638046,98.06949717075938,0.02577679423701921,0.06288567342442898,rbf,TPESampler,COMPLETE
250,0.32681585761687754,2025-04-24 21:01:35.602971,2025-04-24 21:01:36.131311,0 days 00:00:00.528340,10.398112266569491,0.019385224410456866,0.019162728231968455,rbf,TPESampler,COMPLETE
251,0.28408809301684473,2025-04-24 21:01:36.304644,2025-04-24 21:01:36.917109,0 days 00:00:00.612465,83.4983263389508,0.015933153113458845,0.0339583958475981,rbf,TPESampler,COMPLETE
252,0.30457820142602005,2025-04-24 21:01:37.105824,2025-04-24 21:01:37.629955,0 days 00:00:00.524131,35.633739362440814,0.03222992034607944,0.011509518384824136,rbf,TPESampler,COMPLETE
253,0.29773580905499614,2025-04-24 21:01:37.842820,2025-04-24 21:01:38.355028,0 days 00:00:00.512208,10.242614454075749,0.09513180194024569,0.07347941407523274,rbf,TPESampler,COMPLETE
254,0.38776787567542176,2025-04-24 21:01:38.542093,2025-04-24 21:01:39.112705,0 days 00:00:00.570612,63.82069245568937,0.5897685742664969,0.8772465332459154,linear,TPESampler,COMPLETE
255,0.6826597490124195,2025-04-24 21:01:39.312478,2025-04-24 21:01:39.832927,0 days 00:00:00.520449,0.0040158554481797655,0.002411982849054205,0.00012148136048217034,linear,TPESampler,COMPLETE
256,0.2890660585897361,2025-04-24 21:01:40.028188,2025-04-24 21:01:40.609729,0 days 00:00:00.581541,78.44897117316698,0.027238018495555977,0.0192659575796547,rbf,TPESampler,COMPLETE
257,0.29043586725391146,2025-04-24 21:01:40.789030,2025-04-24 21:01:41.340259,0 days 00:00:00.551229,91.34097580647746,0.03666602577472543,0.03854110255876413,rbf,TPESampler,COMPLETE
258,0.2880941042833105,2025-04-24 21:01:41.565331,2025-04-24 21:01:42.218152,0 days 00:00:00.652821,99.22982291677887,0.007701573284038294,0.02575435969324585,rbf,TPESampler,COMPLETE
259,0.2960312081973889,2025-04-24 21:01:42.423620,2025-04-24 21:01:42.966907,0 days 00:00:00.543287,14.386162358626311,0.007335463263418414,0.09766773118794492,rbf,TPESampler,COMPLETE
260,316.3104048950515,2025-04-24 21:01:43.160549,2025-04-24 21:01:43.675338,0 days 00:00:00.514789,41.04926599306038,0.03374753415597822,0.05084511470577826,sigmoid,TPESampler,COMPLETE
261,0.8437082666033495,2025-04-24 21:01:43.882312,2025-04-24 21:01:44.450952,0 days 00:00:00.568640,91.71384167329056,0.013752645744472804,0.003145608986433508,poly,TPESampler,COMPLETE
262,0.3060057997135471,2025-04-24 21:01:44.638173,2025-04-24 21:01:45.193081,0 days 00:00:00.554908,93.45399161789696,0.025186830473745914,0.06174077636843661,rbf,TPESampler,COMPLETE
263,0.3015737152578854,2025-04-24 21:01:45.393665,2025-04-24 21:01:45.936210,0 days 00:00:00.542545,82.21355227336252,0.0346539610238778,0.008884614027679096,rbf,TPESampler,COMPLETE
264,0.8923442962181297,2025-04-24 21:01:46.132509,2025-04-24 21:01:47.048866,0 days 00:00:00.916357,47.50248925504534,0.03280532037153958,0.028193156928254737,poly,TPESampler,COMPLETE
265,0.29353021446673766,2025-04-24 21:01:47.485439,2025-04-24 21:01:48.132729,0 days 00:00:00.647290,9.404695293500398,0.022812773685409318,0.0955919535074699,rbf,TPESampler,COMPLETE
266,0.7753909173580409,2025-04-24 21:01:48.341666,2025-04-24 21:01:48.871399,0 days 00:00:00.529733,0.05995531354962097,0.9115510041142639,0.01724172523421092,rbf,TPESampler,COMPLETE
267,0.3072023028175744,2025-04-24 21:01:49.064075,2025-04-24 21:01:49.684555,0 days 00:00:00.620480,96.1562640506994,0.009942463702426855,0.05283549344020429,rbf,TPESampler,COMPLETE
268,0.33720836428956047,2025-04-24 21:01:49.886971,2025-04-24 21:01:50.465646,0 days 00:00:00.578675,11.010548818936464,0.007333852382596526,0.0171687726770801,rbf,TPESampler,COMPLETE
269,0.28461523554682394,2025-04-24 21:01:50.663934,2025-04-24 21:01:51.238871,0 days 00:00:00.574937,80.6449450663535,0.014733960076312782,0.03609502819362024,rbf,TPESampler,COMPLETE
270,0.32627038981509643,2025-04-24 21:01:51.433065,2025-04-24 21:01:51.945694,0 days 00:00:00.512629,7.494981874320568,0.02247417547723927,0.027429531785013853,rbf,TPESampler,COMPLETE
271,0.3120434771605243,2025-04-24 21:01:52.133605,2025-04-24 21:01:52.699525,0 days 00:00:00.565920,75.8101082229614,0.017038944759051686,0.12860717323959595,rbf,TPESampler,COMPLETE
272,0.2891316187414097,2025-04-24 21:01:52.895500,2025-04-24 21:01:53.455589,0 days 00:00:00.560089,90.45138010699242,0.01982536579471897,0.03955123853763011,rbf,TPESampler,COMPLETE
273,0.42963998702228656,2025-04-24 21:01:53.650239,2025-04-24 21:01:54.159623,0 days 00:00:00.509384,0.13524949108416254,0.005385296001113714,0.0029573043596179795,linear,TPESampler,COMPLETE
274,0.3017761249941734,2025-04-24 21:01:54.361895,2025-04-24 21:01:54.906658,0 days 00:00:00.544763,90.8765170929581,0.11202619022950475,0.05390247698652217,rbf,TPESampler,COMPLETE
275,0.30500928121945464,2025-04-24 21:01:55.092564,2025-04-24 21:01:55.615978,0 days 00:00:00.523414,14.692372733920749,0.05677364878874387,0.02074643762515279,rbf,TPESampler,COMPLETE
276,13.125366452612546,2025-04-24 21:01:55.817705,2025-04-24 21:01:56.344742,0 days 00:00:00.527037,1.7523487045263115,0.009973605593171765,0.04495196561967223,sigmoid,TPESampler,COMPLETE
277,21.744082968331405,2025-04-24 21:01:56.554667,2025-04-24 21:01:57.102839,0 days 00:00:00.548172,88.94628611750848,0.03843862317595684,0.004772467097717928,sigmoid,TPESampler,COMPLETE
278,0.28351305535358623,2025-04-24 21:01:57.303013,2025-04-24 21:01:57.937995,0 days 00:00:00.634982,92.41622351251561,0.015355694737419975,0.03006872196829934,rbf,TPESampler,COMPLETE
279,0.3098026021139041,2025-04-24 21:01:58.148266,2025-04-24 21:01:58.884348,0 days 00:00:00.736082,99.59958676546884,0.006329037092124924,0.05421717608315586,rbf,TPESampler,COMPLETE
280,0.36190617016680465,2025-04-24 21:01:59.080522,2025-04-24 21:02:02.623205,0 days 00:00:03.542683,59.31358723460168,0.03385921639032815,0.16615369147875111,linear,TPESampler,COMPLETE
281,0.28955927367593465,2025-04-24 21:02:02.817362,2025-04-24 21:02:03.348257,0 days 00:00:00.530895,82.19749274149257,0.06285504322791106,0.01855203530729071,rbf,TPESampler,COMPLETE
282,0.30370613624414816,2025-04-24 21:02:03.540740,2025-04-24 21:02:04.080553,0 days 00:00:00.539813,96.99042506625652,0.016958082314528524,0.007435918826130012,rbf,TPESampler,COMPLETE
283,0.3061816583331612,2025-04-24 21:02:03.872265,2025-04-24 21:02:04.453497,0 days 00:00:00.581232,94.78908672386896,0.02712944834677958,0.056049878465316734,rbf,TPESampler,COMPLETE
284,0.28568981970735735,2025-04-24 21:02:04.297348,2025-04-24 21:02:04.868575,0 days 00:00:00.571227,96.74506376314892,0.007425059302369693,0.02876381025935531,rbf,TPESampler,COMPLETE
285,0.30391157846905187,2025-04-24 21:02:04.630074,2025-04-24 21:02:05.175046,0 days 00:00:00.544972,76.23195376851355,0.046038754437729666,0.005515562126466629,rbf,TPESampler,COMPLETE
286,0.30722542782038254,2025-04-24 21:02:05.089294,2025-04-24 21:02:05.746646,0 days 00:00:00.657352,12.332127148142902,0.019443251272107276,0.021566461587317474,rbf,TPESampler,COMPLETE
287,0.2903906999024723,2025-04-24 21:02:05.423986,2025-04-24 21:02:06.024539,0 days 00:00:00.600553,97.0142516310322,0.05314125819969684,0.014629645877089568,rbf,TPESampler,COMPLETE
288,0.3082423567049614,2025-04-24 21:02:05.968522,2025-04-24 21:02:06.713305,0 days 00:00:00.744783,9.338288890393244,0.012201088312689814,0.06576901815704951,rbf,TPESampler,COMPLETE
289,0.30753224149635744,2025-04-24 21:02:06.239389,2025-04-24 21:02:07.135010,0 days 00:00:00.895621,92.56736906087515,0.013684554429378245,0.009709081586971308,rbf,TPESampler,COMPLETE
290,0.33804729815491047,2025-04-24 21:02:07.018912,2025-04-24 21:02:07.692877,0 days 00:00:00.673965,91.26722637124118,0.010324345810234897,0.2782414079000455,rbf,TPESampler,COMPLETE
291,637.4888357038197,2025-04-24 21:02:07.474200,2025-04-24 21:02:07.981395,0 days 00:00:00.507195,67.29343697671288,0.00514255789729466,0.22925462921816944,sigmoid,TPESampler,COMPLETE
292,0.28812916250361553,2025-04-24 21:02:07.920064,2025-04-24 21:02:08.460912,0 days 00:00:00.540848,61.842415286970414,0.022614279988291037,0.04444564209278758,rbf,TPESampler,COMPLETE
293,0.31356372618156353,2025-04-24 21:02:08.229947,2025-04-24 21:02:08.719664,0 days 00:00:00.489717,24.644318786462218,0.053252199525042634,0.2043809184855792,rbf,TPESampler,COMPLETE
294,0.3102783136581765,2025-04-24 21:02:08.645841,2025-04-24 21:02:09.179922,0 days 00:00:00.534081,10.939492082086353,0.009205458078288332,0.02293125831016553,rbf,TPESampler,COMPLETE
295,0.2840066224504816,2025-04-24 21:02:08.954558,2025-04-24 21:02:09.848157,0 days 00:00:00.893599,91.93978565302032,0.021333924835704714,0.02251316300625659,rbf,TPESampler,COMPLETE
296,0.2838157182489213,2025-04-24 21:02:09.704411,2025-04-24 21:02:10.399601,0 days 00:00:00.695190,94.85822564027568,0.017817644250550185,0.0322840513081148,rbf,TPESampler,COMPLETE
297,0.3045844675458034,2025-04-24 21:02:10.036360,2025-04-24 21:02:10.888640,0 days 00:00:00.852280,97.53260419949042,0.05908823283057693,0.046784821400086336,rbf,TPESampler,COMPLETE
298,0.8411994179404297,2025-04-24 21:02:10.816765,2025-04-24 21:02:11.403786,0 days 00:00:00.587021,0.04254613547164121,0.10308188612467016,0.055927417702255344,sigmoid,TPESampler,COMPLETE
299,0.30340038824850357,2025-04-24 21:02:11.174910,2025-04-24 21:02:11.769544,0 days 00:00:00.594634,99.28513816588845,0.014540982627058887,0.049212701868337864,rbf,TPESampler,COMPLETE
300,0.3110074630116052,2025-04-24 21:02:11.615729,2025-04-24 21:02:12.068218,0 days 00:00:00.452489,16.522353317920828,0.04013644491956916,0.013784854253346994,rbf,TPESampler,COMPLETE
301,0.3654102513642556,2025-04-24 21:02:12.011731,2025-04-24 21:02:19.762810,0 days 00:00:07.751079,77.59682640025326,0.013488181626743307,0.00402718691487712,linear,TPESampler,COMPLETE
302,0.28453015332288123,2025-04-24 21:02:12.331913,2025-04-24 21:02:13.022898,0 days 00:00:00.690985,76.72939833288783,0.028626432129591216,0.023936269977407505,rbf,TPESampler,COMPLETE
303,0.3135238921924057,2025-04-24 21:02:13.243003,2025-04-24 21:02:13.791774,0 days 00:00:00.548771,13.264154848172954,0.02632740154015239,0.016858554182822793,rbf,TPESampler,COMPLETE
304,0.2827167437005598,2025-04-24 21:02:13.995698,2025-04-24 21:02:14.658128,0 days 00:00:00.662430,66.72601765723367,0.028387922581420102,0.0298142506447844,rbf,TPESampler,COMPLETE
305,0.2844285724227525,2025-04-24 21:02:14.849714,2025-04-24 21:02:15.493163,0 days 00:00:00.643449,64.41290254439903,0.02470924651019466,0.027589968052488895,rbf,TPESampler,COMPLETE
306,0.2944879601935879,2025-04-24 21:02:15.715359,2025-04-24 21:02:16.565280,0 days 00:00:00.849921,23.78705302916517,0.030466079245408173,0.07469220400917687,rbf,TPESampler,COMPLETE
307,0.3535817345753428,2025-04-24 21:02:16.767991,2025-04-24 21:02:17.276914,0 days 00:00:00.508923,16.23449743519042,0.036635809219340496,0.010032092983015887,rbf,TPESampler,COMPLETE
308,0.2976610493655214,2025-04-24 21:02:17.474461,2025-04-24 21:02:18.015881,0 days 00:00:00.541420,80.23435107918891,0.056047262967014386,0.010017490213336,rbf,TPESampler,COMPLETE
309,0.28575585167703116,2025-04-24 21:02:18.227704,2025-04-24 21:02:18.809499,0 days 00:00:00.581795,97.03219015879155,0.025475122893702486,0.019318347393345557,rbf,TPESampler,COMPLETE
310,0.31532539286624783,2025-04-24 21:02:18.984906,2025-04-24 21:02:19.508665,0 days 00:00:00.523759,60.459311513955335,0.04976357418926814,0.20964964575534678,rbf,TPESampler,COMPLETE
311,0.30437801279376053,2025-04-24 21:02:19.835125,2025-04-24 21:02:20.483993,0 days 00:00:00.648868,87.73588418081906,0.08300643873521607,0.044691918313414646,rbf,TPESampler,COMPLETE
312,0.2937484659635948,2025-04-24 21:02:19.935339,2025-04-24 21:02:20.637370,0 days 00:00:00.702031,15.617341065449052,0.038933350283757655,0.06618408668799346,rbf,TPESampler,COMPLETE
313,0.2902960914067374,2025-04-24 21:02:20.675117,2025-04-24 21:02:21.332547,0 days 00:00:00.657430,60.69959994797908,0.024543618390866703,0.02333174099330087,rbf,TPESampler,COMPLETE
314,0.30406161287514377,2025-04-24 21:02:20.862779,2025-04-24 21:02:21.504722,0 days 00:00:00.641943,83.84400732260059,0.04093590019751564,0.06696794565750498,rbf,TPESampler,COMPLETE
315,0.36265958367072143,2025-04-24 21:02:21.508709,2025-04-24 21:02:23.368662,0 days 00:00:01.859953,21.587673271069523,0.016762688349971397,0.04443099116277329,linear,TPESampler,COMPLETE
316,0.8701054109188139,2025-04-24 21:02:21.707553,2025-04-24 21:02:24.900374,0 days 00:00:03.192821,97.84745762987089,0.04467402025366028,0.037631725584636434,poly,TPESampler,COMPLETE
317,0.30815907568112905,2025-04-24 21:02:23.563498,2025-04-24 21:02:24.093114,0 days 00:00:00.529616,17.803663830827755,0.019385476514578795,0.029939024386617476,rbf,TPESampler,COMPLETE
318,0.2957636079834411,2025-04-24 21:02:24.269355,2025-04-24 21:02:24.852172,0 days 00:00:00.582817,84.53108901083063,0.02467552011549038,0.0466620636381984,rbf,TPESampler,COMPLETE
319,0.3744320780629949,2025-04-24 21:02:24.997761,2025-04-24 21:02:25.679168,0 days 00:00:00.681407,20.527123121281946,0.018709563922688556,0.006509123099100798,rbf,TPESampler,COMPLETE
320,0.4195398479387514,2025-04-24 21:02:25.050709,2025-04-24 21:02:26.069960,0 days 00:00:01.019251,12.674190812743191,0.24679769731453324,0.0054306840014612945,rbf,TPESampler,COMPLETE
321,0.28391894465837,2025-04-24 21:02:26.136991,2025-04-24 21:02:26.869757,0 days 00:00:00.732766,90.2386730428905,0.023612852523333797,0.022245147424438904,rbf,TPESampler,COMPLETE
322,0.2868686596609841,2025-04-24 21:02:26.278555,2025-04-24 21:02:27.136025,0 days 00:00:00.857470,85.78640201894432,0.02469026719176439,0.020335158307242945,rbf,TPESampler,COMPLETE
323,0.30424111450374386,2025-04-24 21:02:27.090656,2025-04-24 21:02:27.556177,0 days 00:00:00.465521,92.24296513745637,0.04564558993947865,0.04947373162826591,rbf,TPESampler,COMPLETE
324,0.29622740454271734,2025-04-24 21:02:27.347499,2025-04-24 21:02:27.883223,0 days 00:00:00.535724,91.04556237226736,0.02659152100239244,0.013313087442113397,rbf,TPESampler,COMPLETE
325,0.30176920275908203,2025-04-24 21:02:27.738109,2025-04-24 21:02:28.271373,0 days 00:00:00.533264,91.87346991378682,0.011078981695880643,0.012727287626892254,rbf,TPESampler,COMPLETE
326,0.30950114011108504,2025-04-24 21:02:28.043756,2025-04-24 21:02:28.557627,0 days 00:00:00.513871,10.450192960706527,0.05795003817394473,0.043647103849499505,rbf,TPESampler,COMPLETE
327,0.2956417439958398,2025-04-24 21:02:28.473875,2025-04-24 21:02:28.980405,0 days 00:00:00.506530,89.38563956598959,0.0583409862127454,0.006087204482560549,rbf,TPESampler,COMPLETE
328,0.29176033728645107,2025-04-24 21:02:28.778570,2025-04-24 21:02:29.405087,0 days 00:00:00.626517,91.31425841202478,0.017300487282721193,0.04311932337455137,rbf,TPESampler,COMPLETE
329,0.31340761259920663,2025-04-24 21:02:29.178865,2025-04-24 21:02:29.710570,0 days 00:00:00.531705,10.04076549261927,0.020534472917575444,0.04813962388710457,rbf,TPESampler,COMPLETE
330,0.2832846009306736,2025-04-24 21:02:29.616664,2025-04-24 21:02:30.189014,0 days 00:00:00.572350,93.8135009664021,0.020682563944890816,0.030400681436224822,rbf,TPESampler,COMPLETE
331,0.28194702736922644,2025-04-24 21:02:29.932890,2025-04-24 21:02:30.842955,0 days 00:00:00.910065,95.84458178442058,0.031103557768806907,0.023010590621289823,rbf,TPESampler,COMPLETE
332,0.30720563388270056,2025-04-24 21:02:30.677354,2025-04-24 21:02:31.254782,0 days 00:00:00.577428,18.253877628640616,0.017426095311737062,0.023046850238585364,rbf,TPESampler,COMPLETE
333,0.9979031321785442,2025-04-24 21:02:31.045532,2025-04-24 21:02:31.509786,0 days 00:00:00.464254,0.01045747082281348,0.018894674004664016,0.0004058694524860417,sigmoid,TPESampler,COMPLETE
334,0.28303176890123777,2025-04-24 21:02:31.444703,2025-04-24 21:02:31.973631,0 days 00:00:00.528928,89.40329461376646,0.037084890803527774,0.02309741299123362,rbf,TPESampler,COMPLETE
335,52.70968790376993,2025-04-24 21:02:31.742671,2025-04-24 21:02:32.250308,0 days 00:00:00.507637,73.16064146015283,0.012859697967788625,0.00744705374327803,sigmoid,TPESampler,COMPLETE
336,510.0904631677231,2025-04-24 21:02:32.209879,2025-04-24 21:02:32.727311,0 days 00:00:00.517432,54.082988089763674,0.012245530858818625,0.06991208367831193,sigmoid,TPESampler,COMPLETE
337,0.3601439213955566,2025-04-24 21:02:32.437850,2025-04-24 21:02:33.233806,0 days 00:00:00.795956,3.6444096719005317,0.05452953046471632,0.004597785175451221,linear,TPESampler,COMPLETE
338,0.2887113249607307,2025-04-24 21:02:32.901204,2025-04-24 21:02:33.489904,0 days 00:00:00.588700,95.28665360148284,0.04071008058458512,0.016239878085351347,rbf,TPESampler,COMPLETE
339,0.9358143849631847,2025-04-24 21:02:33.444030,2025-04-24 21:02:34.307248,0 days 00:00:00.863218,96.17616379626145,0.012837228079360087,0.02321564978599483,poly,TPESampler,COMPLETE
340,0.3657406814622708,2025-04-24 21:02:33.721483,2025-04-24 21:02:46.958196,0 days 00:00:13.236713,81.08792975005335,0.012081334598532924,0.02696318922532097,linear,TPESampler,COMPLETE
341,0.31867939334645345,2025-04-24 21:02:34.490760,2025-04-24 21:02:35.026674,0 days 00:00:00.535914,97.2227532102235,0.01945242751585106,0.17018864372571652,rbf,TPESampler,COMPLETE
342,0.9503768949427743,2025-04-24 21:02:35.264991,2025-04-24 21:02:35.915349,0 days 00:00:00.650358,0.058012551300776524,0.03645387922805086,0.8533117486922106,rbf,TPESampler,COMPLETE
343,0.30850540635890866,2025-04-24 21:02:36.089717,2025-04-24 21:02:36.596654,0 days 00:00:00.506937,15.29272921542777,0.18864278224054135,0.03757176960217275,rbf,TPESampler,COMPLETE
344,0.2874077738053511,2025-04-24 21:02:36.780046,2025-04-24 21:02:37.316266,0 days 00:00:00.536220,94.69931249880335,0.03881297395730889,0.017292562169368725,rbf,TPESampler,COMPLETE
345,0.3050612047750512,2025-04-24 21:02:37.517534,2025-04-24 21:02:38.054131,0 days 00:00:00.536597,99.81696589690196,0.03557375538630295,0.08745261211947218,rbf,TPESampler,COMPLETE
346,0.28916179276981235,2025-04-24 21:02:38.253803,2025-04-24 21:02:38.807471,0 days 00:00:00.553668,94.00316734701555,0.021237466712372043,0.017432280068557605,rbf,TPESampler,COMPLETE
347,0.3043483023068299,2025-04-24 21:02:38.988280,2025-04-24 21:02:39.494240,0 days 00:00:00.505960,16.4495177126592,0.06319428889619083,0.026501029548553046,rbf,TPESampler,COMPLETE
348,0.35643500067326844,2025-04-24 21:02:39.691512,2025-04-24 21:02:40.216815,0 days 00:00:00.525303,22.746127324751114,0.023975331374530926,0.007362841154124254,rbf,TPESampler,COMPLETE
349,0.2933302804461129,2025-04-24 21:02:40.419306,2025-04-24 21:02:40.964393,0 days 00:00:00.545087,16.431757034563674,0.01711974511509243,0.0777516873859327,rbf,TPESampler,COMPLETE
350,0.855558328969171,2025-04-24 21:02:41.159570,2025-04-24 21:02:41.655939,0 days 00:00:00.496369,0.0014601123110082165,0.15567562430802234,0.03850549204575979,poly,TPESampler,COMPLETE
351,0.8514488201411747,2025-04-24 21:02:41.843466,2025-04-24 21:02:42.356999,0 days 00:00:00.513533,0.5270258623375776,0.08242095094391075,0.010480137373976888,poly,TPESampler,COMPLETE
352,0.3230500815558458,2025-04-24 21:02:42.542493,2025-04-24 21:02:43.064933,0 days 00:00:00.522440,76.06227367519868,0.023562130081853906,0.0035649313058616007,rbf,TPESampler,COMPLETE
