number,value,datetime_start,datetime_complete,duration,params_C,params_epsilon,params_gamma,params_kernel,system_attrs_auto:sampler,state
350,0.1627107981223421,2025-04-24 21:43:34.563244,2025-04-24 21:43:44.134654,0 days 00:00:09.571410,73.21920625373268,0.05748979881469877,0.10457820067839474,linear,TPESampler,COMPLETE
351,0.15551062461633172,2025-04-24 21:43:44.339922,2025-04-24 21:43:58.654008,0 days 00:00:14.314086,40.970388207585806,0.003049832791872992,0.2968377779282779,linear,TPESampler,COMPLETE
352,0.15730055786302724,2025-04-24 21:43:58.864320,2025-04-24 21:44:00.933211,0 days 00:00:02.068891,7.222309768050839,0.04580768810029278,0.007816020815133889,linear,TPESampler,COMPLETE
353,0.1482582507871706,2025-04-24 21:44:01.109817,2025-04-24 21:44:15.913075,0 days 00:00:14.803258,92.6335662611834,0.031103907740992608,0.13272567991663264,linear,TPESampler,COMPLETE
354,0.15001251912696442,2025-04-24 21:44:16.086008,2025-04-24 21:44:39.955960,0 days 00:00:23.869952,93.16719566811462,0.02588834512142103,0.015987373442889,linear,TPESampler,COMPLETE
355,0.14952517934283202,2025-04-24 21:44:40.125954,2025-04-24 21:44:53.154164,0 days 00:00:13.028210,87.56018051744442,0.03684756781832019,0.10231880643075958,linear,TPESampler,COMPLETE
356,0.15737252853814301,2025-04-24 21:44:53.334464,2025-04-24 21:45:11.905428,0 days 00:00:18.570964,96.27385304704606,0.047991532606699736,0.32505394875979854,linear,TPESampler,COMPLETE
357,0.8707829144103533,2025-04-24 21:45:12.088681,2025-04-24 21:45:12.668286,0 days 00:00:00.579605,0.6498883352549792,0.30127181284955257,0.00021490299971741933,rbf,TPESampler,COMPLETE
358,0.15408934471465702,2025-04-24 21:45:12.847701,2025-04-24 21:45:22.028718,0 days 00:00:09.181017,43.27161544644283,0.013828022658809334,0.10871172311292246,linear,TPESampler,COMPLETE
359,0.18165428059044048,2025-04-24 21:45:22.192326,2025-04-24 21:45:23.481497,0 days 00:00:01.289171,16.379328424724616,0.10829321754863387,0.015047463153094354,linear,TPESampler,COMPLETE
360,0.5212069709031224,2025-04-24 21:45:23.658413,2025-04-24 21:46:46.080926,0 days 00:01:22.422513,0.18925808824609439,0.0012894357597499483,0.41066014294205894,poly,TPESampler,COMPLETE
361,0.6007607939609018,2025-04-24 21:46:46.246787,2025-04-24 21:46:46.794568,0 days 00:00:00.547781,15.504507137098235,0.025667499849717716,0.12235778572019523,rbf,TPESampler,COMPLETE
362,0.17040581593125273,2025-04-24 21:46:46.989801,2025-04-24 21:46:51.160012,0 days 00:00:04.170211,63.13583859895395,0.09205282344969741,0.017728504820606675,linear,TPESampler,COMPLETE
363,0.16333449886282264,2025-04-24 21:46:51.342782,2025-04-24 21:47:05.544291,0 days 00:00:14.201509,99.00654301279698,0.060703872783598935,0.9783095824273005,linear,TPESampler,COMPLETE
364,1.3885103749823418,2025-04-24 21:47:05.748985,2025-04-24 21:47:06.311245,0 days 00:00:00.562260,0.0035582584952229906,0.009202361145736485,0.424201258234182,sigmoid,TPESampler,COMPLETE
365,0.1499367885714467,2025-04-24 21:47:06.477769,2025-04-24 21:47:34.549842,0 days 00:00:28.072073,99.27056419359477,0.020899375547862423,0.01149826769902898,linear,TPESampler,COMPLETE
366,0.1486729745842184,2025-04-24 21:47:34.727091,2025-04-24 21:47:50.685987,0 days 00:00:15.958896,90.05840952451015,0.031959018322454215,0.08538872531360929,linear,TPESampler,COMPLETE
367,0.15680677288959152,2025-04-24 21:47:50.982735,2025-04-24 21:48:04.873259,0 days 00:00:13.890524,74.67053083050037,0.052842570921015915,0.06336584887210836,linear,TPESampler,COMPLETE
368,0.14876876134342398,2025-04-24 21:47:54.383972,2025-04-24 21:48:07.867871,0 days 00:00:13.483899,71.73902399059318,0.03133533393271025,0.07827026674503534,linear,TPESampler,COMPLETE
369,0.15411820200745385,2025-04-24 21:48:05.046609,2025-04-24 21:48:47.514723,0 days 00:00:42.468114,94.25859253357378,0.010983217512980748,0.10641128535931553,linear,TPESampler,COMPLETE
370,0.1517067141931901,2025-04-24 21:48:08.053999,2025-04-24 21:48:44.416584,0 days 00:00:36.362585,95.61848476862018,0.01799275938101887,0.0706064208819917,linear,TPESampler,COMPLETE
371,0.14836351605151385,2025-04-24 21:48:44.598103,2025-04-24 21:49:01.942858,0 days 00:00:17.344755,91.86996346016835,0.03106312994679721,0.07416897193085704,linear,TPESampler,COMPLETE
372,0.14978363445343545,2025-04-24 21:48:47.696220,2025-04-24 21:49:14.777315,0 days 00:00:27.081095,93.04399827781276,0.02416106707910153,0.06051846489484042,linear,TPESampler,COMPLETE
373,0.1596636777736058,2025-04-24 21:49:02.123535,2025-04-24 21:49:17.939067,0 days 00:00:15.815532,80.75415655478254,0.06767281147505616,0.05316731799349985,linear,TPESampler,COMPLETE
374,0.15333180346435,2025-04-24 21:49:14.952350,2025-04-24 21:49:40.047289,0 days 00:00:25.094939,82.1043831303708,0.013649261671056553,0.03546740891936396,linear,TPESampler,COMPLETE
375,0.16025469155084965,2025-04-24 21:49:18.101681,2025-04-24 21:49:31.879396,0 days 00:00:13.777715,81.90339762383705,0.06730137325690401,0.03108792939283819,linear,TPESampler,COMPLETE
376,0.15225063306041992,2025-04-24 21:49:32.043544,2025-04-24 21:49:48.769769,0 days 00:00:16.726225,68.14166711762952,0.04185083523258218,0.005419081571158145,linear,TPESampler,COMPLETE
377,0.1497811110141471,2025-04-24 21:49:40.207455,2025-04-24 21:49:55.431023,0 days 00:00:15.223568,66.55594040633804,0.02833508930313961,0.1255108458770876,linear,TPESampler,COMPLETE
378,0.14977542731110102,2025-04-24 21:49:48.944007,2025-04-24 21:49:53.824496,0 days 00:00:04.880489,16.5846841010601,0.029638064095469204,0.005063741273899112,linear,TPESampler,COMPLETE
379,0.15505229880312124,2025-04-24 21:49:54.007638,2025-04-24 21:50:11.268340,0 days 00:00:17.260702,76.55579286050109,0.045431104739252964,0.030373806154577913,linear,TPESampler,COMPLETE
380,0.15367698002867938,2025-04-24 21:49:55.594080,2025-04-24 21:50:31.223696,0 days 00:00:35.629616,92.17233146601275,0.0050871830572931445,0.018679868398642135,linear,TPESampler,COMPLETE
381,0.4374182168126359,2025-04-24 21:50:11.627151,2025-04-24 21:50:12.263343,0 days 00:00:00.636192,0.004205314292131306,0.0280034263491733,0.20223592899483447,linear,TPESampler,COMPLETE
382,0.15093051484446462,2025-04-24 21:50:12.449115,2025-04-24 21:50:34.606266,0 days 00:00:22.157151,96.12036994578267,0.0183913063719599,0.117835046346193,linear,TPESampler,COMPLETE
383,0.16309188712409836,2025-04-24 21:50:31.411459,2025-04-24 21:50:45.509783,0 days 00:00:14.098324,89.45383307097815,0.06405788948707608,0.1347121230667296,linear,TPESampler,COMPLETE
384,0.1527067078123804,2025-04-24 21:50:34.831192,2025-04-24 21:51:02.969626,0 days 00:00:28.138434,92.14941872306692,0.013795226727270809,0.02760881826484924,linear,TPESampler,COMPLETE
385,0.15118614024146063,2025-04-24 21:50:45.687691,2025-04-24 21:51:02.428375,0 days 00:00:16.740684,97.33087318913627,0.03895126876129982,0.0038541846204838315,linear,TPESampler,COMPLETE
386,0.35270378541204234,2025-04-24 21:51:02.617169,2025-04-24 21:51:03.305227,0 days 00:00:00.688058,51.96052702523199,0.021114802605772143,0.020164945050072654,rbf,TPESampler,COMPLETE
387,0.16309737315724754,2025-04-24 21:51:03.166737,2025-04-24 21:51:14.805724,0 days 00:00:11.638987,90.89807811860271,0.06369551375828753,0.021203121611631584,linear,TPESampler,COMPLETE
388,1.4110680027398206,2025-04-24 21:51:03.452388,2025-04-24 21:51:03.955939,0 days 00:00:00.503551,0.01112713517265447,0.035924314028746664,0.001549647607687482,poly,TPESampler,COMPLETE
389,0.1702751005242304,2025-04-24 21:51:04.131339,2025-04-24 21:51:06.009564,0 days 00:00:01.878225,19.71436194864182,0.09212619976288731,0.12742536444704566,linear,TPESampler,COMPLETE
390,0.15042264432032545,2025-04-24 21:51:06.221642,2025-04-24 21:51:10.337204,0 days 00:00:04.115562,14.677623665359258,0.0283101901217978,0.021642898492989875,linear,TPESampler,COMPLETE
391,0.6666911692164098,2025-04-24 21:51:10.515411,2025-04-24 21:51:11.047897,0 days 00:00:00.532486,0.11326649533347287,0.0018737591398388792,0.0038057403542433436,rbf,TPESampler,COMPLETE
392,0.19302280011474995,2025-04-24 21:51:11.215136,2025-04-24 21:51:12.668721,0 days 00:00:01.453585,16.437072347417658,0.1264892734113167,0.0024387246985532714,linear,TPESampler,COMPLETE
393,0.15242036596282865,2025-04-24 21:51:12.875742,2025-04-24 21:51:16.475915,0 days 00:00:03.600173,13.574763428915862,0.018399365737741966,0.01279456513143508,linear,TPESampler,COMPLETE
394,0.5750900397096481,2025-04-24 21:51:14.982774,2025-04-24 21:51:15.544206,0 days 00:00:00.561432,0.7408044526423605,0.0020133100314467865,0.002136869310838775,sigmoid,TPESampler,COMPLETE
395,1.3735918661241477,2025-04-24 21:51:15.729893,2025-04-24 21:51:16.247979,0 days 00:00:00.518086,0.0018543152498633666,0.22454452444580517,0.014127276513073892,sigmoid,TPESampler,COMPLETE
396,0.3959623479336316,2025-04-24 21:51:16.425053,2025-04-24 21:51:17.003382,0 days 00:00:00.578329,22.512456865630945,0.0177775396404612,0.014987737785039815,poly,TPESampler,COMPLETE
397,0.4646671649982035,2025-04-24 21:51:16.674996,2025-04-24 21:51:17.176506,0 days 00:00:00.501510,0.0028231638952435417,0.006350945794534342,0.005680429350754144,linear,TPESampler,COMPLETE
398,0.15359242774521548,2025-04-24 21:51:17.170204,2025-04-24 21:51:49.276039,0 days 00:00:32.105835,95.05708199765958,0.009630516089934283,0.0034183225297498903,linear,TPESampler,COMPLETE
399,0.1502451472246428,2025-04-24 21:51:17.357029,2025-04-24 21:51:21.002220,0 days 00:00:03.645191,15.281216611017232,0.02873571062862932,0.21546022102134002,linear,TPESampler,COMPLETE
400,0.34934750988711255,2025-04-24 21:51:21.185668,2025-04-24 21:51:21.693851,0 days 00:00:00.508183,5.0966378746915675,0.0012829628687687383,0.0009218693763493296,rbf,TPESampler,COMPLETE
401,0.15194839927994833,2025-04-24 21:51:21.867052,2025-04-24 21:51:47.058294,0 days 00:00:25.191242,89.30204494787156,0.01574537180368265,0.20049754728727429,linear,TPESampler,COMPLETE
402,2.325847313091559,2025-04-24 21:51:47.234157,2025-04-24 22:01:12.280265,0 days 00:09:25.046108,29.27881745048661,0.03753361412603683,0.26823780510412387,poly,TPESampler,COMPLETE
403,0.1980388682443187,2025-04-24 21:51:49.450843,2025-04-24 21:51:51.306144,0 days 00:00:01.855301,78.55281669809229,0.13586229189091145,0.00028503092447174495,linear,TPESampler,COMPLETE
404,0.5284515759058994,2025-04-24 21:51:51.479023,2025-04-24 21:53:28.632793,0 days 00:01:37.153770,15.912489681252088,0.0028761443977069917,0.09234169978648983,poly,TPESampler,COMPLETE
405,0.15258800222818514,2025-04-24 21:53:28.825450,2025-04-24 21:53:34.041951,0 days 00:00:05.216501,23.79795251372839,0.0411613562540759,0.14289098860217753,linear,TPESampler,COMPLETE
406,1.4142177497198298,2025-04-24 21:53:34.209534,2025-04-24 21:53:34.727908,0 days 00:00:00.518374,0.001395555401017965,0.12130858417296883,0.7322042576997012,rbf,TPESampler,COMPLETE
407,0.39379932976820564,2025-04-24 21:53:34.904794,2025-04-24 21:53:35.434494,0 days 00:00:00.529700,59.54867141496819,0.019193175958439303,0.0003959266221787627,sigmoid,TPESampler,COMPLETE
408,1.331716682112674,2025-04-24 21:53:35.614796,2025-04-24 21:53:36.123895,0 days 00:00:00.509099,0.20750982058491163,0.004047438271489953,0.0016014458532888172,poly,TPESampler,COMPLETE
409,0.35470354991296277,2025-04-24 21:53:36.299791,2025-04-24 21:53:36.820797,0 days 00:00:00.521006,0.2664373439706145,0.2706096773525185,0.040894653162249064,poly,TPESampler,COMPLETE
410,0.23094540319557944,2025-04-24 21:53:37.016294,2025-04-24 21:53:38.913044,0 days 00:00:01.896750,92.34296482646417,0.19542720573696037,0.10565053187909203,linear,TPESampler,COMPLETE
411,0.14968693877183673,2025-04-24 21:53:39.098188,2025-04-24 21:53:56.894966,0 days 00:00:17.796778,72.19658783663931,0.028402555608754144,0.05109007013872947,linear,TPESampler,COMPLETE
412,1.5371212274954136,2025-04-24 21:53:57.064213,2025-04-24 21:53:57.579415,0 days 00:00:00.515202,0.040714742679028935,0.04899932549999627,0.04516025162055097,sigmoid,TPESampler,COMPLETE
413,0.35848599507359324,2025-04-24 21:53:57.755598,2025-04-24 21:53:58.328534,0 days 00:00:00.572936,10.957750433159664,0.12761952636826232,0.015111964984858662,poly,TPESampler,COMPLETE
414,0.22705851456951193,2025-04-24 21:53:58.508303,2025-04-24 21:54:01.690778,0 days 00:00:03.182475,96.856600013912,0.18792976378721174,0.00949601301899762,linear,TPESampler,COMPLETE
415,0.15064590580342987,2025-04-24 21:54:01.868175,2025-04-24 21:54:06.234965,0 days 00:00:04.366790,18.59498162623452,0.03702052699911238,0.09606222017258395,linear,TPESampler,COMPLETE
416,0.15324633770891224,2025-04-24 21:54:06.410231,2025-04-24 21:54:09.584044,0 days 00:00:03.173813,13.646379286816048,0.041316558311927744,0.00925741166230227,linear,TPESampler,COMPLETE
417,0.14971926592288623,2025-04-24 21:54:09.753592,2025-04-24 21:54:23.811861,0 days 00:00:14.058269,72.937974546847,0.036162298988784876,0.1679594473674822,linear,TPESampler,COMPLETE
418,0.15562869868449894,2025-04-24 21:54:23.986789,2025-04-24 21:54:29.561774,0 days 00:00:05.574985,15.112071251112873,0.0056295899439059854,0.16016207689792145,linear,TPESampler,COMPLETE
419,0.15027936704885766,2025-04-24 21:54:29.732705,2025-04-24 21:54:44.823715,0 days 00:00:15.091010,86.9749129990348,0.037668695856455575,0.013015662703560353,linear,TPESampler,COMPLETE
420,0.15553464102579956,2025-04-24 21:54:44.997864,2025-04-24 21:55:04.655507,0 days 00:00:19.657643,85.97176560703294,0.046007018575514674,0.1435542348966672,linear,TPESampler,COMPLETE
421,0.1569082171721474,2025-04-24 21:55:04.825617,2025-04-24 21:55:09.134604,0 days 00:00:04.308987,13.407127330200066,0.013106493204828273,0.055108126928128366,linear,TPESampler,COMPLETE
422,0.15498264326070055,2025-04-24 21:55:09.340224,2025-04-24 21:55:31.790846,0 days 00:00:22.450622,59.1543132462881,0.009475387633132751,0.5952155463614416,linear,TPESampler,COMPLETE
423,0.15066698576948212,2025-04-24 21:55:31.959312,2025-04-24 21:55:43.338088,0 days 00:00:11.378776,86.99567535924015,0.03821046001507416,0.02972958783745725,linear,TPESampler,COMPLETE
424,151.28082268156643,2025-04-24 21:55:43.511676,2025-04-24 21:55:44.018934,0 days 00:00:00.507258,9.929849959556398,0.014237862564099459,0.11563315497481848,sigmoid,TPESampler,COMPLETE
425,0.15031394312483215,2025-04-24 21:55:44.188992,2025-04-24 21:55:53.333267,0 days 00:00:09.144275,27.20742869655433,0.021118282008989644,0.007921725025372795,linear,TPESampler,COMPLETE
426,0.14831652244763216,2025-04-24 21:55:53.512319,2025-04-24 21:56:09.153716,0 days 00:00:15.641397,96.86855796308463,0.03094209701245374,0.3504166297687096,linear,TPESampler,COMPLETE
427,0.16144726443529175,2025-04-24 21:56:09.321365,2025-04-24 21:56:17.421810,0 days 00:00:08.100445,53.79396433263304,0.056547499596051896,0.25605472122562095,linear,TPESampler,COMPLETE
428,0.15026630481037212,2025-04-24 21:56:17.594653,2025-04-24 21:56:26.001038,0 days 00:00:08.406385,27.54778414631258,0.020780725875363483,0.12879409452842513,linear,TPESampler,COMPLETE
429,0.1635776136546975,2025-04-24 21:56:26.181213,2025-04-24 21:56:35.795033,0 days 00:00:09.613820,88.8086268526029,0.0614113840899626,0.2199965691933435,linear,TPESampler,COMPLETE
430,0.14961525534200668,2025-04-24 21:56:35.972209,2025-04-24 21:56:58.571289,0 days 00:00:22.599080,90.246802976203,0.024490482535071387,0.5968687488303563,linear,TPESampler,COMPLETE
431,0.153401019317416,2025-04-24 21:56:58.744989,2025-04-24 21:57:20.905029,0 days 00:00:22.160040,84.71159609268265,0.017783915649060063,0.32626661248363004,linear,TPESampler,COMPLETE
432,0.1837546330507548,2025-04-24 21:57:21.081687,2025-04-24 21:57:22.023130,0 days 00:00:00.941443,7.93969943847706,0.11015740409118106,0.7406361677187319,linear,TPESampler,COMPLETE
433,0.15003266890997097,2025-04-24 21:57:22.201000,2025-04-24 21:57:41.058016,0 days 00:00:18.857016,70.66002389554399,0.025462967074106224,0.09512298877860498,linear,TPESampler,COMPLETE
434,0.15107879437896257,2025-04-24 21:57:41.248271,2025-04-24 21:57:44.407985,0 days 00:00:03.159714,14.417396169238518,0.024836156298272884,0.43091446962412655,linear,TPESampler,COMPLETE
435,388.87343987986304,2025-04-24 21:57:44.784332,2025-04-24 21:57:45.576777,0 days 00:00:00.792445,43.74743776482038,0.07499671010242553,0.014888725246675115,sigmoid,TPESampler,COMPLETE
436,1057.5396983246544,2025-04-24 21:57:45.923781,2025-04-24 21:57:46.982690,0 days 00:00:01.058909,68.51498493909965,0.03596242485180928,0.11239800312888491,sigmoid,TPESampler,COMPLETE
437,0.15460824223875094,2025-04-24 21:57:47.337837,2025-04-24 21:58:15.683378,0 days 00:00:28.345541,98.26676361502707,0.012774053889620279,0.21375678187486105,linear,TPESampler,COMPLETE
438,0.16302065042631814,2025-04-24 21:58:15.858370,2025-04-24 21:58:17.448456,0 days 00:00:01.590086,10.232457247435846,0.05617670135260902,0.12051092135714123,linear,TPESampler,COMPLETE
439,0.16225376278606793,2025-04-24 21:58:17.638064,2025-04-24 21:58:19.666043,0 days 00:00:02.027979,13.308109631407056,0.05581055956051856,0.04268634474204316,linear,TPESampler,COMPLETE
440,0.15202877036827303,2025-04-24 21:58:19.843014,2025-04-24 21:58:38.320903,0 days 00:00:18.477889,85.10127659181944,0.04064327447620195,0.09441787601753139,linear,TPESampler,COMPLETE
441,1.4100476402133562,2025-04-24 21:58:38.503330,2025-04-24 21:58:39.023129,0 days 00:00:00.519799,0.00371713274930229,0.03625848947817947,0.00025233876997256586,rbf,TPESampler,COMPLETE
442,0.16393011222466664,2025-04-24 21:58:39.218239,2025-04-24 21:58:50.911876,0 days 00:00:11.693637,98.30890704028907,0.06530367407601306,0.012360050901514623,linear,TPESampler,COMPLETE
443,1.0379978438729953,2025-04-24 21:58:51.100148,2025-04-24 21:58:51.668818,0 days 00:00:00.568670,0.02153312534757988,0.021100106424570244,0.010475606037563782,rbf,TPESampler,COMPLETE
444,0.1515095616832316,2025-04-24 21:58:51.862661,2025-04-24 21:59:15.168896,0 days 00:00:23.306235,97.60743592506692,0.03971285045043649,0.08767464265575865,linear,TPESampler,COMPLETE
445,0.15488961319158087,2025-04-24 21:59:15.357805,2025-04-24 21:59:19.641785,0 days 00:00:04.283980,9.821081586112834,0.010322734494417904,0.03153268244794667,linear,TPESampler,COMPLETE
446,0.14832920810158196,2025-04-24 21:59:19.833261,2025-04-24 21:59:37.364243,0 days 00:00:17.530982,87.57353689739215,0.030840866174354126,0.002162731678151592,linear,TPESampler,COMPLETE
447,0.15030093212109052,2025-04-24 21:59:37.540543,2025-04-24 21:59:57.380644,0 days 00:00:19.840101,97.18153939533066,0.03777230988861354,0.004068567002262576,linear,TPESampler,COMPLETE
448,0.7810450908994863,2025-04-24 21:59:57.549976,2025-04-24 21:59:58.001116,0 days 00:00:00.451140,10.873246159545058,0.5799740674690591,0.24407302882911774,rbf,TPESampler,COMPLETE
449,0.1533338107898619,2025-04-24 21:59:58.164810,2025-04-24 22:00:38.671890,0 days 00:00:40.507080,96.62060466503807,0.009595287894792878,0.03500455683809645,linear,TPESampler,COMPLETE
450,0.15312800920082692,2025-04-24 22:00:38.843200,2025-04-24 22:01:06.561182,0 days 00:00:27.717982,73.56103588314588,0.009797905671368314,0.0015779444339601996,linear,TPESampler,COMPLETE
451,0.1623187856617317,2025-04-24 22:01:06.745552,2025-04-24 22:01:16.512462,0 days 00:00:09.766910,87.25324006308739,0.06659113836939076,0.0022776552936139903,linear,TPESampler,COMPLETE
452,0.15012585650905666,2025-04-24 22:01:12.452542,2025-04-24 22:01:27.338374,0 days 00:00:14.885832,70.02297052704984,0.02707630559163111,0.014438352692273074,linear,TPESampler,COMPLETE
453,0.15022268389767066,2025-04-24 22:01:16.673498,2025-04-24 22:01:21.151245,0 days 00:00:04.477747,20.465820611153006,0.028031864518287833,0.04659072876633217,linear,TPESampler,COMPLETE
454,0.14940036698693412,2025-04-24 22:01:21.326469,2025-04-24 22:01:30.413750,0 days 00:00:09.087281,48.30868282293421,0.035376171834952945,0.00034389849116829113,linear,TPESampler,COMPLETE
455,0.4378893079334709,2025-04-24 22:01:27.510340,2025-04-24 22:02:04.927359,0 days 00:00:37.417019,82.48975463731216,0.06893977580618699,0.04162331972305317,poly,TPESampler,COMPLETE
456,0.21214457869183784,2025-04-24 22:01:30.581106,2025-04-24 22:01:31.088752,0 days 00:00:00.507646,50.01778173771805,0.054203130713314125,0.0011778414829084838,rbf,TPESampler,COMPLETE
457,0.6562353645184651,2025-04-24 22:01:31.256009,2025-04-24 22:01:31.768494,0 days 00:00:00.512485,62.409539357475715,0.03168472639325414,0.18020610133160064,rbf,TPESampler,COMPLETE
458,0.15219840874718985,2025-04-24 22:01:31.952828,2025-04-24 22:01:50.221599,0 days 00:00:18.268771,71.20720109530403,0.016424715829167512,0.005835155839854993,linear,TPESampler,COMPLETE
459,0.14954711771747262,2025-04-24 22:01:50.407151,2025-04-24 22:02:14.595936,0 days 00:00:24.188785,99.04863893924764,0.024909350838451826,0.012867260775283489,linear,TPESampler,COMPLETE
460,0.15370211271765874,2025-04-24 22:02:05.105689,2025-04-24 22:02:22.388321,0 days 00:00:17.282632,61.86681094068518,0.01719658883024271,0.001182761766889756,linear,TPESampler,COMPLETE
461,0.1726449479419363,2025-04-24 22:02:14.803413,2025-04-24 22:02:15.807559,0 days 00:00:01.004146,9.26905933352975,0.08931843947286239,0.05173762926560452,linear,TPESampler,COMPLETE
462,0.14795681902857125,2025-04-24 22:02:15.976141,2025-04-24 22:02:31.525590,0 days 00:00:15.549449,99.88524216338685,0.03358081598759315,0.15639216257078695,linear,TPESampler,COMPLETE
463,0.14865272423944276,2025-04-24 22:02:22.564408,2025-04-24 22:02:34.299787,0 days 00:00:11.735379,70.04661996188338,0.0303005449128853,0.0021513077270147126,linear,TPESampler,COMPLETE
464,0.15108481855682535,2025-04-24 22:02:31.696900,2025-04-24 22:03:06.022959,0 days 00:00:34.326059,99.16930489845917,0.01781188263192292,0.05249010202995896,linear,TPESampler,COMPLETE
465,983.0418878095471,2025-04-24 22:02:34.490064,2025-04-24 22:02:35.017235,0 days 00:00:00.527171,77.0970750662234,0.01627983140831024,0.023212770338564587,sigmoid,TPESampler,COMPLETE
466,0.14909535913303743,2025-04-24 22:02:35.183477,2025-04-24 22:02:41.361947,0 days 00:00:06.178470,39.94036595446931,0.034786602594375285,0.0008118920212904157,linear,TPESampler,COMPLETE
