number,value,datetime_start,datetime_complete,duration,params_C,params_epsilon,params_gamma,params_kernel,system_attrs_auto:sampler,state
2322,0.14997953767482158,2025-04-25 01:49:26.864451,2025-04-25 01:49:41.151307,0 days 00:00:14.286856,69.51165720308926,0.027382586969182304,0.25231529103399847,linear,TPESampler,COMPLETE
2323,0.1500888946291214,2025-04-25 01:49:36.868107,2025-04-25 01:49:53.624917,0 days 00:00:16.756810,96.63776735238191,0.028185378717511343,0.28967955598808237,linear,TPESampler,COMPLETE
2324,1.2468694457576988,2025-04-25 01:49:41.341698,2025-04-25 01:49:41.853288,0 days 00:00:00.511590,89.81688274734402,0.024430671309610748,0.00026995114488839543,poly,TPESampler,COMPLETE
2325,0.15108245432628473,2025-04-25 01:49:42.045659,2025-04-25 01:50:13.395776,0 days 00:00:31.350117,98.75665496115235,0.01788817609685067,0.29362690298359106,linear,TPESampler,COMPLETE
2326,0.1537819728040677,2025-04-25 01:49:53.811917,2025-04-25 01:50:22.816476,0 days 00:00:29.004559,83.7422016078143,0.008644255172918086,0.15942881439454967,linear,TPESampler,COMPLETE
2327,0.16040295068922206,2025-04-25 01:50:13.589805,2025-04-25 01:50:17.567653,0 days 00:00:03.977848,29.535402225980604,0.05558519692333895,0.7417206635919008,linear,TPESampler,COMPLETE
2328,0.1501359447994953,2025-04-25 01:50:17.755357,2025-04-25 01:50:32.656204,0 days 00:00:14.900847,54.374839715520196,0.02079804224428078,0.8101100247563574,linear,TPESampler,COMPLETE
2329,0.16481818657281977,2025-04-25 01:50:23.013073,2025-04-25 01:50:24.711219,0 days 00:00:01.698146,26.157148525289497,0.08714534127258211,0.16165741388246152,linear,TPESampler,COMPLETE
2330,0.15025078236272627,2025-04-25 01:50:24.898112,2025-04-25 01:50:30.447227,0 days 00:00:05.549115,16.473976481554022,0.02148437257951518,0.22605440191661724,linear,TPESampler,COMPLETE
2331,39.90413068367822,2025-04-25 01:50:30.632596,2025-04-25 02:48:12.653229,0 days 00:57:42.020633,62.92701784098271,0.02402796722357018,0.7791671222812062,poly,TPESampler,COMPLETE
2332,0.15840502754604668,2025-04-25 01:50:32.839148,2025-04-25 01:50:36.168601,0 days 00:00:03.329453,17.47219629584378,0.049064225743430494,0.05615697299600863,linear,TPESampler,COMPLETE
2333,0.15899029180380977,2025-04-25 01:50:36.359944,2025-04-25 01:50:40.414149,0 days 00:00:04.054205,20.69061383803775,0.05297264208168103,0.2037290675528285,linear,TPESampler,COMPLETE
2334,0.15366157737271124,2025-04-25 01:50:40.602976,2025-04-25 01:51:13.329577,0 days 00:00:32.726601,77.50584198725186,0.009015645688617208,0.882436120919243,linear,TPESampler,COMPLETE
2335,0.1608230359331353,2025-04-25 01:51:13.520586,2025-04-25 01:51:26.434851,0 days 00:00:12.914265,90.02468446837324,0.055691257947165666,0.22277381950272873,linear,TPESampler,COMPLETE
2336,0.14882947167489458,2025-04-25 01:51:26.625027,2025-04-25 01:51:50.987791,0 days 00:00:24.362764,86.16958981903686,0.029702422205148092,0.21674513493171138,linear,TPESampler,COMPLETE
2337,0.1492589887562121,2025-04-25 01:51:51.175525,2025-04-25 01:52:13.376347,0 days 00:00:22.200822,98.01951066236666,0.035219455830909185,0.04955173088885426,linear,TPESampler,COMPLETE
2338,0.22382658389108961,2025-04-25 01:52:13.577110,2025-04-25 01:52:15.481913,0 days 00:00:01.904803,79.42530662154243,0.18188000502059837,0.13677459773558637,linear,TPESampler,COMPLETE
2339,0.14909582136502578,2025-04-25 01:52:15.667800,2025-04-25 01:52:18.884927,0 days 00:00:03.217127,13.37616209455331,0.033829249255397376,0.13080644589977566,linear,TPESampler,COMPLETE
2340,0.2896197858269373,2025-04-25 01:52:19.069287,2025-04-25 01:52:19.576116,0 days 00:00:00.506829,0.15109786039853026,0.0924444917100281,0.6437327399556662,linear,TPESampler,COMPLETE
2341,0.2706964920559269,2025-04-25 01:52:19.768039,2025-04-25 01:52:20.911600,0 days 00:00:01.143561,65.82107168828891,0.2534090029485967,0.6516479172483479,linear,TPESampler,COMPLETE
2342,0.15366001963022302,2025-04-25 01:52:21.098415,2025-04-25 01:52:22.528121,0 days 00:00:01.429706,5.192249877782628,0.03618465235846465,0.42776354878672224,linear,TPESampler,COMPLETE
2343,0.14955110506150182,2025-04-25 01:52:22.718486,2025-04-25 01:52:44.221169,0 days 00:00:21.502683,94.80338453327744,0.021130400271382084,0.1196669772558164,linear,TPESampler,COMPLETE
2344,0.15332791077450741,2025-04-25 01:52:44.604531,2025-04-25 01:53:03.824413,0 days 00:00:19.219882,99.87698088458288,0.043288001609907235,0.060575156076912814,linear,TPESampler,COMPLETE
2345,0.19032464507722446,2025-04-25 01:53:04.020588,2025-04-25 01:53:09.508001,0 days 00:00:05.487413,78.57042297403048,0.12980201206337322,0.3737703629566696,linear,TPESampler,COMPLETE
2346,0.16579045326012096,2025-04-25 01:53:09.696211,2025-04-25 01:53:10.745980,0 days 00:00:01.049769,6.03091809727832,0.058056652941262596,0.06602092313949429,linear,TPESampler,COMPLETE
2347,0.18711045916211594,2025-04-25 01:53:10.969761,2025-04-25 01:53:12.246249,0 days 00:00:01.276488,16.35242247269454,0.1207560798043734,0.17508683667802818,linear,TPESampler,COMPLETE
2348,0.17204505551133584,2025-04-25 01:53:12.440024,2025-04-25 01:53:16.962581,0 days 00:00:04.522557,97.19725153028966,0.10217483988340625,0.356116906369391,linear,TPESampler,COMPLETE
2349,0.15790214328923077,2025-04-25 01:53:17.149279,2025-04-25 01:53:22.561381,0 days 00:00:05.412102,30.361825817327194,0.05316758586529999,0.9921888614168406,linear,TPESampler,COMPLETE
2350,0.48864018869975095,2025-04-25 01:53:22.749043,2025-04-25 01:53:23.224753,0 days 00:00:00.475710,3.9890355103306483,0.8442638412414343,0.0957695435038215,linear,TPESampler,COMPLETE
2351,0.1568309385553081,2025-04-25 01:53:23.405425,2025-04-25 01:53:38.433666,0 days 00:00:15.028241,98.50439079105958,0.07005443613009892,0.62966739001147,linear,TPESampler,COMPLETE
2352,1.3536079094099385,2025-04-25 01:53:38.637092,2025-04-25 01:53:39.206429,0 days 00:00:00.569337,0.0022585593289209858,0.5820390674888507,0.024332622192634254,rbf,TPESampler,COMPLETE
2353,0.14811536630722755,2025-04-25 01:53:39.391944,2025-04-25 01:53:58.521610,0 days 00:00:19.129666,93.58047126445112,0.03204647382023798,0.19796137167969527,linear,TPESampler,COMPLETE
2354,0.15788848684981957,2025-04-25 01:53:58.711170,2025-04-25 01:53:59.807318,0 days 00:00:01.096148,2.597519320113869,0.014004267946974224,0.1458544832020431,linear,TPESampler,COMPLETE
2355,0.14934442671399104,2025-04-25 01:53:59.994667,2025-04-25 01:54:03.469965,0 days 00:00:03.475298,20.461106927618367,0.03218849410235775,0.2687793245617184,linear,TPESampler,COMPLETE
2356,0.15045730129699975,2025-04-25 01:54:03.660750,2025-04-25 01:54:08.417336,0 days 00:00:04.756586,27.794368885876125,0.036188961536902785,0.15488527534184154,linear,TPESampler,COMPLETE
2357,7.400243534382707,2025-04-25 01:54:08.615066,2025-04-25 01:54:09.139887,0 days 00:00:00.524821,0.41050456010271863,0.001735381870489236,0.0348879179879642,sigmoid,TPESampler,COMPLETE
2358,0.1483824814345998,2025-04-25 01:54:09.330390,2025-04-25 01:54:28.147591,0 days 00:00:18.817201,98.29689690689624,0.030869613099272372,0.48795623654534337,linear,TPESampler,COMPLETE
2359,0.14994651744840903,2025-04-25 01:54:28.342672,2025-04-25 01:54:42.103569,0 days 00:00:13.760897,79.22362745451629,0.027700413757416983,0.25553353772666265,linear,TPESampler,COMPLETE
2360,0.15657006866701173,2025-04-25 01:54:42.298533,2025-04-25 01:54:53.377292,0 days 00:00:11.078759,88.44370789258964,0.07012698974521551,0.14342813059729975,linear,TPESampler,COMPLETE
2361,1.4113998619024348,2025-04-25 01:54:53.573292,2025-04-25 01:54:54.071371,0 days 00:00:00.498079,0.3106344112494202,0.24348464957113708,0.0003144802013890109,poly,TPESampler,COMPLETE
2362,0.14992004058412073,2025-04-25 01:54:54.261610,2025-04-25 01:55:05.849970,0 days 00:00:11.588360,67.03968764479598,0.027387658104061862,0.09400357185846064,linear,TPESampler,COMPLETE
2363,0.1522621227155551,2025-04-25 01:55:06.034999,2025-04-25 01:55:29.030917,0 days 00:00:22.995918,85.54947323808764,0.01792568079348697,0.08529440923635541,linear,TPESampler,COMPLETE
2364,0.1541151119814598,2025-04-25 01:55:29.222589,2025-04-25 01:55:37.290455,0 days 00:00:08.067866,16.788708635531613,0.017405170648939403,0.13688242837497894,linear,TPESampler,COMPLETE
2365,0.15148254109973533,2025-04-25 01:55:37.479147,2025-04-25 01:56:05.414094,0 days 00:00:27.934947,92.19434475943,0.01819603895574431,0.08102960870800593,linear,TPESampler,COMPLETE
2366,0.15372775367740085,2025-04-25 01:56:05.612807,2025-04-25 01:56:43.296103,0 days 00:00:37.683296,90.20289489247304,0.008184235789036053,0.5740106747385647,linear,TPESampler,COMPLETE
2367,0.15209361812377875,2025-04-25 01:56:43.485794,2025-04-25 01:56:56.178335,0 days 00:00:12.692541,69.12929238107111,0.04166208449252266,0.14972065030238674,linear,TPESampler,COMPLETE
2368,0.1498030630342666,2025-04-25 01:56:56.367118,2025-04-25 01:57:17.187739,0 days 00:00:20.820621,87.38271708317782,0.027805421150124788,0.12536151217933916,linear,TPESampler,COMPLETE
2369,0.1553109892194283,2025-04-25 01:57:17.370727,2025-04-25 01:57:22.645092,0 days 00:00:05.274365,21.183556448389027,0.045408554587688894,0.05807063359443137,linear,TPESampler,COMPLETE
2370,0.17264638664554224,2025-04-25 01:57:22.829813,2025-04-25 01:57:28.152580,0 days 00:00:05.322767,94.80559478159105,0.10424604292749956,0.16195603811991624,linear,TPESampler,COMPLETE
2371,0.14986559823424103,2025-04-25 01:57:28.345778,2025-04-25 01:57:42.153600,0 days 00:00:13.807822,84.16371185681949,0.027820323408658407,0.30790727310973176,linear,TPESampler,COMPLETE
2372,1.3783785817273375,2025-04-25 01:57:42.352831,2025-04-25 01:57:42.966369,0 days 00:00:00.613538,0.018755327521946887,0.09582440252438622,0.0006473898321360031,sigmoid,TPESampler,COMPLETE
2373,0.15081698836428312,2025-04-25 01:57:43.155556,2025-04-25 01:57:47.089658,0 days 00:00:03.934102,13.039045208211704,0.0264867263503757,0.6013147402627099,linear,TPESampler,COMPLETE
2374,0.15388127167617502,2025-04-25 01:57:47.550076,2025-04-25 01:58:15.983747,0 days 00:00:28.433671,90.33414945583245,0.0076146230963087015,0.1669354597609193,linear,TPESampler,COMPLETE
2375,0.15200164541462374,2025-04-25 01:58:16.175833,2025-04-25 01:58:40.028835,0 days 00:00:23.853002,91.04118832411518,0.018456528662645057,0.7925389717834598,linear,TPESampler,COMPLETE
2376,0.16270400406091243,2025-04-25 01:58:40.330075,2025-04-25 01:58:51.496053,0 days 00:00:11.165978,92.9209585378605,0.06647025444455847,0.39265741337571763,linear,TPESampler,COMPLETE
2377,0.15029110759172243,2025-04-25 01:58:51.680868,2025-04-25 01:59:22.080141,0 days 00:00:30.399273,80.72048223513768,0.019954014444212333,0.23033335171157074,linear,TPESampler,COMPLETE
2378,0.15624723376230948,2025-04-25 01:59:22.276027,2025-04-25 01:59:37.767180,0 days 00:00:15.491153,92.21052227961482,0.051697236331263496,0.08680858665247153,linear,TPESampler,COMPLETE
2379,0.1610458954736005,2025-04-25 01:59:37.964521,2025-04-25 01:59:39.234090,0 days 00:00:01.269569,11.155234798979732,0.07237113030517718,0.12675107396058147,linear,TPESampler,COMPLETE
2380,0.16134411549461422,2025-04-25 01:59:39.481154,2025-04-25 01:59:52.338282,0 days 00:00:12.857128,98.85811882079177,0.056529942776542885,0.23825517980928623,linear,TPESampler,COMPLETE
2381,0.14939944288088014,2025-04-25 01:59:52.543018,2025-04-25 01:59:55.884862,0 days 00:00:03.341844,20.738588289921214,0.03195151567757559,0.08737452176385524,linear,TPESampler,COMPLETE
2382,0.15558545662865453,2025-04-25 01:59:56.079216,2025-04-25 02:00:01.777104,0 days 00:00:05.697888,18.34756798774486,0.012815262539894774,0.28109865222811625,linear,TPESampler,COMPLETE
2383,0.6304858688717531,2025-04-25 02:00:01.978682,2025-04-25 02:00:02.520914,0 days 00:00:00.542232,13.566111747784552,0.026326492787692744,0.15046337914577537,rbf,TPESampler,COMPLETE
2384,1.3120598419717917,2025-04-25 02:00:02.709737,2025-04-25 02:00:03.259767,0 days 00:00:00.550030,0.14616375530660533,0.0026532523996850984,0.8857500407746982,rbf,TPESampler,COMPLETE
2385,0.30426965033616443,2025-04-25 02:00:03.511123,2025-04-25 02:00:04.633221,0 days 00:00:01.122098,98.663098417954,0.29377714824347134,0.05917924979524276,linear,TPESampler,COMPLETE
2386,0.14905420162571192,2025-04-25 02:00:05.347409,2025-04-25 02:00:22.595737,0 days 00:00:17.248328,79.00281897384811,0.03515581645447466,0.3147292047742495,linear,TPESampler,COMPLETE
2387,619.0902188642013,2025-04-25 02:00:25.226395,2025-04-25 02:00:27.589963,0 days 00:00:02.363568,41.588049321540986,0.25697331439470805,0.0740185588736063,sigmoid,TPESampler,COMPLETE
2388,0.15081253958874852,2025-04-25 02:00:28.643384,2025-04-25 02:00:35.647399,0 days 00:00:07.004015,22.070759042297713,0.020382968277197887,0.22320862998199817,linear,TPESampler,COMPLETE
2389,0.15029562743141237,2025-04-25 02:00:36.577240,2025-04-25 02:00:55.321508,0 days 00:00:18.744268,71.64508180343248,0.02003893046639678,0.9081099590063564,linear,TPESampler,COMPLETE
2390,0.16233508394803486,2025-04-25 02:00:55.835217,2025-04-25 02:00:57.808502,0 days 00:00:01.973285,20.038641980366613,0.0800605343691345,0.9653185132242048,linear,TPESampler,COMPLETE
2391,1.8950144386381402,2025-04-25 02:00:58.313555,2025-04-25 02:00:59.297734,0 days 00:00:00.984179,0.5752622578018188,0.015339524958915336,0.006953338843710705,sigmoid,TPESampler,COMPLETE
2392,0.23343006252023354,2025-04-25 02:00:59.490838,2025-04-25 02:01:00.692934,0 days 00:00:01.202096,10.305507488805446,0.18264075401037816,0.8982813202695316,linear,TPESampler,COMPLETE
2393,0.16459452404586405,2025-04-25 02:01:00.932270,2025-04-25 02:01:04.678802,0 days 00:00:03.746532,21.750225953565316,0.06338648451337676,0.16391138347313328,linear,TPESampler,COMPLETE
2394,0.15404345260639604,2025-04-25 02:01:06.294671,2025-04-25 02:01:09.631216,0 days 00:00:03.336545,7.214267466262844,0.04067170826882661,0.236994781005207,linear,TPESampler,COMPLETE
2395,0.15487586501994174,2025-04-25 02:01:09.834394,2025-04-25 02:01:15.539373,0 days 00:00:05.704979,18.094561956345594,0.015474096830688382,0.0389301651425749,linear,TPESampler,COMPLETE
2396,0.15550388219332004,2025-04-25 02:01:15.961828,2025-04-25 02:01:33.030389,0 days 00:00:17.068561,92.2262375967866,0.04588013696322122,0.00013346075188060903,linear,TPESampler,COMPLETE
2397,0.15396130886842804,2025-04-25 02:01:33.219054,2025-04-25 02:01:53.803943,0 days 00:00:20.584889,54.59389261007068,0.008616222802045532,0.07581871727920989,linear,TPESampler,COMPLETE
2398,0.14935753722573183,2025-04-25 02:01:53.998493,2025-04-25 02:01:58.274686,0 days 00:00:04.276193,20.882385931615822,0.033131376407086376,0.21886688672753915,linear,TPESampler,COMPLETE
2399,2040.3470053698982,2025-04-25 02:01:58.462491,2025-04-25 02:01:59.153067,0 days 00:00:00.690576,90.61145069551227,0.0235855121394051,0.46087767658016965,sigmoid,TPESampler,COMPLETE
2400,0.15072536899813613,2025-04-25 02:01:59.350381,2025-04-25 02:02:03.266577,0 days 00:00:03.916196,17.79715050244636,0.038350154704051724,0.000224685006041938,linear,TPESampler,COMPLETE
2401,0.150017558257738,2025-04-25 02:02:03.454381,2025-04-25 02:02:24.393626,0 days 00:00:20.939245,87.12003495235324,0.02105173104329747,0.1480232728443509,linear,TPESampler,COMPLETE
2402,0.1502314262833158,2025-04-25 02:02:24.570912,2025-04-25 02:02:51.741879,0 days 00:00:27.170967,90.24649646880778,0.020470749520448486,0.4331170752350139,linear,TPESampler,COMPLETE
2403,0.15345575126116814,2025-04-25 02:02:51.930159,2025-04-25 02:03:21.222907,0 days 00:00:29.292748,76.67103572278374,0.0107905595950956,0.14117844060717868,linear,TPESampler,COMPLETE
2404,0.15458858072307188,2025-04-25 02:03:19.831664,2025-04-25 02:03:22.377947,0 days 00:00:02.546283,14.485387990537628,0.04294633468741141,0.38266041299047765,linear,TPESampler,COMPLETE
2405,0.15339037281169995,2025-04-25 02:03:21.416550,2025-04-25 02:03:30.554196,0 days 00:00:09.137646,28.653080720674236,0.017372219336209558,0.00013121387810969767,linear,TPESampler,COMPLETE
2406,0.15455507871365654,2025-04-25 02:03:22.564264,2025-04-25 02:03:43.408741,0 days 00:00:20.844477,96.98552714836939,0.04473875676935521,0.6166018094227257,linear,TPESampler,COMPLETE
2407,0.15041187721052401,2025-04-25 02:03:30.746454,2025-04-25 02:03:36.411746,0 days 00:00:05.665292,24.399429875055294,0.02378104951948516,0.1079630353067621,linear,TPESampler,COMPLETE
2408,0.15038737361804344,2025-04-25 02:03:36.596706,2025-04-25 02:03:58.728260,0 days 00:00:22.131554,92.81438301257141,0.019741129121028513,0.06932529498557569,linear,TPESampler,COMPLETE
2409,0.15907901302910502,2025-04-25 02:03:43.597195,2025-04-25 02:03:45.426133,0 days 00:00:01.828938,3.236673124224486,0.0013109560974019598,0.7943729898113032,linear,TPESampler,COMPLETE
2410,0.16087438115448963,2025-04-25 02:03:45.753180,2025-04-25 02:03:50.914556,0 days 00:00:05.161376,24.61203887876757,0.06756095585999322,0.0003043572930899554,linear,TPESampler,COMPLETE
2411,0.15404966371422996,2025-04-25 02:03:51.105921,2025-04-25 02:04:27.251672,0 days 00:00:36.145751,91.38565859825286,0.013296816405273738,0.19389952290778426,linear,TPESampler,COMPLETE
2412,0.15891422817220602,2025-04-25 02:03:58.917139,2025-04-25 02:04:01.824344,0 days 00:00:02.907205,16.676451128791534,0.07485368597081014,0.05257237251339573,linear,TPESampler,COMPLETE
2413,0.1501650613921891,2025-04-25 02:04:02.021238,2025-04-25 02:04:31.438427,0 days 00:00:29.417189,99.44105444550343,0.027319250127593335,0.06603032765794312,linear,TPESampler,COMPLETE
2414,572.0937165270572,2025-04-25 02:04:27.439748,2025-04-25 02:04:27.995127,0 days 00:00:00.555379,37.05658560941182,0.025739356007985614,0.11023625575100268,sigmoid,TPESampler,COMPLETE
2415,0.15000535008601334,2025-04-25 02:04:28.187726,2025-04-25 02:04:52.350879,0 days 00:00:24.163153,95.92673459428346,0.020990683206589266,0.8274233391268306,linear,TPESampler,COMPLETE
2416,0.7672103391354679,2025-04-25 02:04:31.629658,2025-04-25 02:05:45.108627,0 days 00:01:13.478969,46.51366435873368,0.12997053621101942,0.1282220887049911,poly,TPESampler,COMPLETE
2417,0.15714696668098252,2025-04-25 02:04:52.629172,2025-04-25 02:04:55.171204,0 days 00:00:02.542032,5.6349611305630924,0.0055157589253346665,0.07874626468196437,linear,TPESampler,COMPLETE
2418,0.4984993874136227,2025-04-25 02:04:55.374194,2025-04-25 02:04:55.889898,0 days 00:00:00.515704,1.6707647853873253,0.06838298345828352,0.0010426762817658912,sigmoid,TPESampler,COMPLETE
2419,0.15648288493421256,2025-04-25 02:04:56.071776,2025-04-25 02:04:58.803342,0 days 00:00:02.731566,10.483258003624046,0.014543801641516838,0.8925750480248018,linear,TPESampler,COMPLETE
2420,0.15034654182315313,2025-04-25 02:04:58.984309,2025-04-25 02:05:04.863489,0 days 00:00:05.879180,21.44815721694372,0.023568428261906083,0.0004628901100616948,linear,TPESampler,COMPLETE
2421,0.1579166715063164,2025-04-25 02:05:05.056305,2025-04-25 02:05:17.763898,0 days 00:00:12.707593,83.74738937592062,0.05306074972650556,0.0001952478504180853,linear,TPESampler,COMPLETE
2422,0.16733747059650608,2025-04-25 02:05:17.949004,2025-04-25 02:05:22.446738,0 days 00:00:04.497734,89.69770335531476,0.08927591800011038,0.05373391448267971,linear,TPESampler,COMPLETE
2423,0.15422503232596102,2025-04-25 02:05:22.648251,2025-04-25 02:05:36.930382,0 days 00:00:14.282131,84.99960683191891,0.044301406890492834,0.00043690406271758146,linear,TPESampler,COMPLETE
2424,0.21355322149782158,2025-04-25 02:05:37.263307,2025-04-25 02:05:39.344629,0 days 00:00:02.081322,97.8639569704203,0.16203612406796283,0.16430689952268696,linear,TPESampler,COMPLETE
2425,0.15913682020678166,2025-04-25 02:05:39.541337,2025-04-25 02:05:57.369978,0 days 00:00:17.828641,97.50285879123908,0.05390992486163179,0.0005644003597527633,linear,TPESampler,COMPLETE
2426,0.1539222265929129,2025-04-25 02:05:45.300423,2025-04-25 02:06:24.002226,0 days 00:00:38.701803,97.14896144326012,0.0065495064979039785,0.0358153136636011,linear,TPESampler,COMPLETE
2427,0.15470701137413428,2025-04-25 02:05:57.551864,2025-04-25 02:06:21.117154,0 days 00:00:23.565290,94.25512723485582,0.04516960155025754,0.1689360087624324,linear,TPESampler,COMPLETE
2428,0.15454558833697377,2025-04-25 02:06:21.315044,2025-04-25 02:06:52.048950,0 days 00:00:30.733906,91.53851820793706,0.012775246698443777,0.0002242968606561459,linear,TPESampler,COMPLETE
2429,0.15224611784680528,2025-04-25 02:06:24.186650,2025-04-25 02:06:27.576366,0 days 00:00:03.389716,19.064692798562753,0.042229538732801046,0.18442193381222302,linear,TPESampler,COMPLETE
2430,0.14987966203645836,2025-04-25 02:06:27.773222,2025-04-25 02:06:50.677343,0 days 00:00:22.904121,99.81491131953135,0.023330243248371477,0.5101864141531393,linear,TPESampler,COMPLETE
2431,0.16097353543319584,2025-04-25 02:06:50.873629,2025-04-25 02:06:52.831826,0 days 00:00:01.958197,22.901002815069948,0.07902665406117261,0.15601020669931026,linear,TPESampler,COMPLETE
2432,0.9481059372543427,2025-04-25 02:06:52.243471,2025-04-25 02:06:52.788673,0 days 00:00:00.545202,22.590123884373554,0.008539567380372188,0.7926706681423997,rbf,TPESampler,COMPLETE
2433,0.5843643370026876,2025-04-25 02:06:52.950860,2025-04-25 02:06:53.571692,0 days 00:00:00.620832,99.79604476638562,0.08124609595547701,0.10676807764869523,rbf,TPESampler,COMPLETE
2434,0.49074655529025796,2025-04-25 02:06:52.992130,2025-04-25 02:06:53.900982,0 days 00:00:00.908852,62.1785949342169,0.017495234722616004,0.060695641559579995,rbf,TPESampler,COMPLETE
2435,0.1583916257689444,2025-04-25 02:06:53.781472,2025-04-25 02:06:57.510175,0 days 00:00:03.728703,21.712139540506563,0.04973425807963459,0.0008150148133550331,linear,TPESampler,COMPLETE
2436,0.159892355494087,2025-04-25 02:06:54.096833,2025-04-25 02:06:57.893874,0 days 00:00:03.797041,16.69248598234349,0.05278008294021302,0.37122794255590175,linear,TPESampler,COMPLETE
2437,0.1588025157242589,2025-04-25 02:06:57.706158,2025-04-25 02:07:10.672261,0 days 00:00:12.966103,98.17347302105932,0.07445776980395476,0.11312266003286257,linear,TPESampler,COMPLETE
