number,value,datetime_start,datetime_complete,duration,params_C,params_epsilon,params_gamma,params_kernel,system_attrs_auto:sampler,state
1858,0.3780541554972396,2025-04-25 01:06:09.947728,2025-04-25 01:06:10.560759,0 days 00:00:00.613031,85.70469057429074,0.0366423422111019,0.029230949690299348,rbf,TPESampler,COMPLETE
1859,0.15005576912473148,2025-04-25 01:06:10.748169,2025-04-25 01:06:35.331288,0 days 00:00:24.583119,96.79318495090126,0.019426611286606797,0.0012147801619185083,linear,TPESampler,COMPLETE
1860,0.2290362004901849,2025-04-25 01:06:12.691510,2025-04-25 01:06:14.358597,0 days 00:00:01.667087,97.92594771382964,0.19189019568583068,0.0009394028820629547,linear,TPESampler,COMPLETE
1861,0.15789546800265147,2025-04-25 01:06:14.559658,2025-04-25 01:06:16.097442,0 days 00:00:01.537784,2.637337913468363,0.006849350786900777,0.00020105389532257397,linear,TPESampler,COMPLETE
1862,1844.3028436887598,2025-04-25 01:06:16.275001,2025-04-25 01:06:16.785485,0 days 00:00:00.510484,85.85575985367825,0.07416120433622884,0.9696489035827185,sigmoid,TPESampler,COMPLETE
1863,0.16078838845455512,2025-04-25 01:06:16.967041,2025-04-25 01:06:28.268865,0 days 00:00:11.301824,89.511555681202,0.0678795643429564,0.001128077372662543,linear,TPESampler,COMPLETE
1864,0.15050130662335034,2025-04-25 01:06:28.154248,2025-04-25 01:06:33.147992,0 days 00:00:04.993744,17.978443313150006,0.024342254528569186,0.0014515886243163226,linear,TPESampler,COMPLETE
1865,0.15305732230302027,2025-04-25 01:06:28.455473,2025-04-25 01:06:31.448879,0 days 00:00:02.993406,16.021359293396355,0.04107843653236079,0.11419650440361036,linear,TPESampler,COMPLETE
1866,0.14999688055572927,2025-04-25 01:06:31.634420,2025-04-25 01:06:48.394500,0 days 00:00:16.760080,93.39166185420063,0.02740928268906254,0.004743629648867366,linear,TPESampler,COMPLETE
1867,0.15142311915741952,2025-04-25 01:06:33.320929,2025-04-25 01:07:02.279470,0 days 00:00:28.958541,99.83801893419101,0.0168468667960833,0.06012548729652358,linear,TPESampler,COMPLETE
1868,0.1586967055722271,2025-04-25 01:06:35.508149,2025-04-25 01:06:50.025280,0 days 00:00:14.517131,98.916529767172,0.05335479826362115,0.0006338263793703984,linear,TPESampler,COMPLETE
1869,0.45811979955362925,2025-04-25 01:06:48.574060,2025-04-25 01:06:50.045067,0 days 00:00:01.471007,23.33006339325333,0.2668942407524048,0.6711399452931537,poly,TPESampler,COMPLETE
1870,0.15601161822064002,2025-04-25 01:06:50.164710,2025-04-25 01:06:59.410605,0 days 00:00:09.245895,94.9597781790914,0.07071013972550873,0.17620940757931583,linear,TPESampler,COMPLETE
1871,1.4031958471501396,2025-04-25 01:06:50.216890,2025-04-25 01:06:50.920858,0 days 00:00:00.703968,0.007759099146775367,0.13840399138517107,0.0025615863233414563,poly,TPESampler,COMPLETE
1872,0.15524647373964431,2025-04-25 01:06:51.103233,2025-04-25 01:06:59.048010,0 days 00:00:07.944777,19.98905334568708,0.013020877448631821,0.001143590911530878,linear,TPESampler,COMPLETE
1873,0.14955956508385262,2025-04-25 01:06:59.225008,2025-04-25 01:07:16.801091,0 days 00:00:17.576083,96.26616708615929,0.023949918111785186,0.003377316249429892,linear,TPESampler,COMPLETE
1874,0.15385725805253392,2025-04-25 01:06:59.622446,2025-04-25 01:07:03.346330,0 days 00:00:03.723884,16.254604156985753,0.01639445742211309,0.00037052193235141505,linear,TPESampler,COMPLETE
1875,0.39704105085400837,2025-04-25 01:07:02.460459,2025-04-25 01:07:02.900944,0 days 00:00:00.440485,0.8627803018781549,0.4386542395532723,0.02913387223485227,linear,TPESampler,COMPLETE
1876,0.1667537276025397,2025-04-25 01:07:03.077298,2025-04-25 01:07:03.995186,0 days 00:00:00.917888,4.619810618309335,0.0586153007985102,0.00046160876581891497,linear,TPESampler,COMPLETE
1877,0.15341459990009682,2025-04-25 01:07:03.564301,2025-04-25 01:07:48.170418,0 days 00:00:44.606117,99.7447131342784,0.009693571044605024,0.001276498326734885,linear,TPESampler,COMPLETE
1878,0.15206393993667938,2025-04-25 01:07:04.175542,2025-04-25 01:07:29.586673,0 days 00:00:25.411131,87.74665512416952,0.01601298319057424,0.0006594281977224903,linear,TPESampler,COMPLETE
1879,0.15009397204307484,2025-04-25 01:07:16.992854,2025-04-25 01:07:36.326578,0 days 00:00:19.333724,99.84939094074319,0.026601549094882864,0.0001657817961662312,linear,TPESampler,COMPLETE
1880,0.15510005539878877,2025-04-25 01:07:29.765935,2025-04-25 01:07:55.712630,0 days 00:00:25.946695,98.78416500764197,0.04565704049135794,0.00024284203501295809,linear,TPESampler,COMPLETE
1881,0.16252890915101686,2025-04-25 01:07:36.509745,2025-04-25 01:07:41.739366,0 days 00:00:05.229621,91.99320037242384,0.08162352719766047,0.000834555567520735,linear,TPESampler,COMPLETE
1882,0.15075464299424607,2025-04-25 01:07:41.920055,2025-04-25 01:07:47.602668,0 days 00:00:05.682613,21.84934668221293,0.026622106240604324,0.3654555942730046,linear,TPESampler,COMPLETE
1883,0.2216992996827206,2025-04-25 01:07:48.035328,2025-04-25 01:07:49.506146,0 days 00:00:01.470818,26.415144510717205,0.16659892756082595,0.009966712543429476,linear,TPESampler,COMPLETE
1884,0.14994757713380605,2025-04-25 01:07:48.549594,2025-04-25 01:08:21.683214,0 days 00:00:33.133620,99.23397464030025,0.025887025134398046,0.0034776351966831977,linear,TPESampler,COMPLETE
1885,0.1500103635568919,2025-04-25 01:07:49.743415,2025-04-25 01:07:54.221132,0 days 00:00:04.477717,19.053068297872596,0.024684093854759108,0.009885887782240638,linear,TPESampler,COMPLETE
1886,0.15437013302565797,2025-04-25 01:07:54.609667,2025-04-25 01:08:25.706306,0 days 00:00:31.096639,98.37984135960771,0.01288289525469187,0.0004115547878005833,linear,TPESampler,COMPLETE
1887,0.2119998960634393,2025-04-25 01:07:56.077527,2025-04-25 01:07:56.829949,0 days 00:00:00.752422,2.0976399035510567,0.12401232461648548,0.06317367765440954,linear,TPESampler,COMPLETE
1888,0.15807013263008185,2025-04-25 01:07:57.015102,2025-04-25 01:07:58.720563,0 days 00:00:01.705461,2.4939701068426015,0.012897815574876894,0.001510462952708785,linear,TPESampler,COMPLETE
1889,0.1935011127520193,2025-04-25 01:07:58.908790,2025-04-25 01:07:59.880866,0 days 00:00:00.972076,26.073266465879126,0.1268817958271685,0.004298651122665398,linear,TPESampler,COMPLETE
1890,0.16348857218363688,2025-04-25 01:08:00.069218,2025-04-25 01:08:04.382941,0 days 00:00:04.313723,23.174499917571225,0.06593686056811952,0.0008110010321774941,linear,TPESampler,COMPLETE
1891,0.17924003736867125,2025-04-25 01:08:04.566420,2025-04-25 01:08:09.482325,0 days 00:00:04.915905,99.16995263609103,0.12115277508464244,0.006469385112901076,linear,TPESampler,COMPLETE
1892,0.30859552851211053,2025-04-25 01:08:09.664148,2025-04-25 01:08:10.111274,0 days 00:00:00.447126,69.67688617020828,0.396530924835512,0.0037525477737763513,rbf,TPESampler,COMPLETE
1893,0.15270654065086212,2025-04-25 01:08:10.290633,2025-04-25 01:08:46.373140,0 days 00:00:36.082507,95.31182251044099,0.014910753608396025,0.0012151696358311183,linear,TPESampler,COMPLETE
1894,0.17122701779194496,2025-04-25 01:08:21.866104,2025-04-25 01:08:26.786000,0 days 00:00:04.919896,97.27898051200582,0.09983993178002815,0.7163025392622967,linear,TPESampler,COMPLETE
1895,0.1496900042540414,2025-04-25 01:08:25.890407,2025-04-25 01:08:47.417618,0 days 00:00:21.527211,97.9087444152149,0.028295278849835532,0.004999843046395985,linear,TPESampler,COMPLETE
1896,587.6590173084483,2025-04-25 01:08:26.960585,2025-04-25 01:08:27.468002,0 days 00:00:00.507417,29.02490829974417,0.0012514131467381787,0.23246642174731283,sigmoid,TPESampler,COMPLETE
1897,0.1514349202135923,2025-04-25 01:08:27.652557,2025-04-25 01:08:31.086139,0 days 00:00:03.433582,17.552817526793053,0.03920635361883387,0.03044343224776757,linear,TPESampler,COMPLETE
1898,0.15015970831255146,2025-04-25 01:08:31.264450,2025-04-25 01:08:34.683450,0 days 00:00:03.419000,17.202423215606494,0.028476859592920012,0.00040785969915505785,linear,TPESampler,COMPLETE
1899,0.15004484876604016,2025-04-25 01:08:34.871231,2025-04-25 01:08:40.465446,0 days 00:00:05.594215,21.226247253701132,0.02290886358979179,0.0016419986623921281,linear,TPESampler,COMPLETE
1900,0.15022924539188182,2025-04-25 01:08:40.656392,2025-04-25 01:09:02.089012,0 days 00:00:21.432620,99.06533113368283,0.020419809158056634,0.0006718617853825849,linear,TPESampler,COMPLETE
1901,0.1564326705177682,2025-04-25 01:08:46.555040,2025-04-25 01:08:53.976760,0 days 00:00:07.421720,22.63082099782069,0.04697972707701709,0.0035153184003420715,linear,TPESampler,COMPLETE
1902,0.15548299890538667,2025-04-25 01:08:47.602077,2025-04-25 01:08:54.888383,0 days 00:00:07.286306,16.040652789688327,0.009352726607874744,0.005067754797632572,linear,TPESampler,COMPLETE
1903,0.15223825107103378,2025-04-25 01:08:54.158373,2025-04-25 01:08:59.479114,0 days 00:00:05.320741,16.854172358213294,0.019915376681371482,0.3664066617916947,linear,TPESampler,COMPLETE
1904,0.15013846515940546,2025-04-25 01:08:55.073941,2025-04-25 01:09:10.199586,0 days 00:00:15.125645,77.55372013164258,0.026075232468410856,0.1089674224375795,linear,TPESampler,COMPLETE
1905,0.37256410312099086,2025-04-25 01:08:59.657841,2025-04-25 01:09:00.173813,0 days 00:00:00.515972,94.67991379382052,0.00992572308217991,0.0003205827909228976,sigmoid,TPESampler,COMPLETE
1906,0.16282797186006695,2025-04-25 01:09:00.349643,2025-04-25 01:09:02.545003,0 days 00:00:02.195360,15.631635135668107,0.0580062986823479,0.00034365042838099873,linear,TPESampler,COMPLETE
1907,0.15038456845066253,2025-04-25 01:09:02.272875,2025-04-25 01:09:28.428630,0 days 00:00:26.155755,96.42826500425504,0.019699337303293686,0.07461342581172657,linear,TPESampler,COMPLETE
1908,0.16420004200365038,2025-04-25 01:09:02.731377,2025-04-25 01:09:07.646118,0 days 00:00:04.914741,85.63770944251368,0.08384515761054324,0.002628780937265514,linear,TPESampler,COMPLETE
1909,0.15067743235356992,2025-04-25 01:09:07.828109,2025-04-25 01:09:23.928193,0 days 00:00:16.100084,73.69004945041841,0.018680425097693014,0.7685624624248297,linear,TPESampler,COMPLETE
1910,0.1544454120057119,2025-04-25 01:09:10.375807,2025-04-25 01:09:56.159845,0 days 00:00:45.784038,93.37212049635363,0.012373499349532573,0.01392363478594864,linear,TPESampler,COMPLETE
1911,1.3886121334112729,2025-04-25 01:09:24.107310,2025-04-25 01:09:24.621135,0 days 00:00:00.513825,0.0020683015295138905,0.0015745462024781293,0.18510298985354093,sigmoid,TPESampler,COMPLETE
1912,0.15041489161429855,2025-04-25 01:09:24.799970,2025-04-25 01:09:31.170119,0 days 00:00:06.370149,24.11753559375347,0.027551711561961182,0.0008104345572526319,linear,TPESampler,COMPLETE
1913,1.1640609678509617,2025-04-25 01:09:28.608612,2025-04-25 01:09:29.112666,0 days 00:00:00.504054,0.7373629164462661,0.14291785695557863,0.7656651806226951,rbf,TPESampler,COMPLETE
1914,0.1501162815604826,2025-04-25 01:09:29.298920,2025-04-25 01:09:32.854245,0 days 00:00:03.555325,17.677749014676714,0.028224347913265353,0.19492217165833384,linear,TPESampler,COMPLETE
1915,0.16311637234104603,2025-04-25 01:09:31.353713,2025-04-25 01:09:41.904782,0 days 00:00:10.551069,96.38877968434646,0.058327197726131666,0.009357220128189075,linear,TPESampler,COMPLETE
1916,0.4532409679465814,2025-04-25 01:09:33.041151,2025-04-25 01:09:33.677254,0 days 00:00:00.636103,98.70548237285885,0.010186518293805005,0.0034021049948897144,poly,TPESampler,COMPLETE
1917,0.15354389586411876,2025-04-25 01:09:33.859799,2025-04-25 01:10:02.784597,0 days 00:00:28.924798,99.55478416318299,0.014741898251203055,0.0003472461335384029,linear,TPESampler,COMPLETE
1918,0.1503682763415108,2025-04-25 01:09:42.088721,2025-04-25 01:09:45.750514,0 days 00:00:03.661793,20.302527827791966,0.03618841946818035,0.0064279881097217524,linear,TPESampler,COMPLETE
1919,0.15749754517795828,2025-04-25 01:09:45.938004,2025-04-25 01:09:48.692269,0 days 00:00:02.754265,24.166823801023188,0.06981498313360208,0.0018046143040829133,linear,TPESampler,COMPLETE
1920,0.1514452654253638,2025-04-25 01:09:48.876738,2025-04-25 01:10:06.306696,0 days 00:00:17.429958,98.11106251163541,0.039415525959867345,0.001455596824614667,linear,TPESampler,COMPLETE
1921,0.16511476905410727,2025-04-25 01:09:56.340066,2025-04-25 01:09:57.991157,0 days 00:00:01.651091,18.632938082380523,0.0847180513862926,0.00018937957999124662,linear,TPESampler,COMPLETE
1922,0.6974387040919136,2025-04-25 01:09:58.172681,2025-04-25 01:09:58.627194,0 days 00:00:00.454513,9.983109462009509,0.7976437512828262,0.0032153680665738464,poly,TPESampler,COMPLETE
1923,0.2697220370028533,2025-04-25 01:09:58.805120,2025-04-25 01:09:59.322805,0 days 00:00:00.517685,77.34166856647549,0.020332243667402033,0.000329243562071597,rbf,TPESampler,COMPLETE
1924,0.159255132308888,2025-04-25 01:09:59.506001,2025-04-25 01:10:08.159765,0 days 00:00:08.653764,99.36840938773237,0.07506957622773319,0.23077882965376806,linear,TPESampler,COMPLETE
1925,0.14974359969959036,2025-04-25 01:10:02.961972,2025-04-25 01:10:27.165800,0 days 00:00:24.203828,89.78983957188301,0.0228985628993769,0.0017103666923368437,linear,TPESampler,COMPLETE
1926,0.14922276175873714,2025-04-25 01:10:06.515366,2025-04-25 01:10:11.994026,0 days 00:00:05.478660,18.543961322353994,0.032594735828926004,0.001565748922767012,linear,TPESampler,COMPLETE
1927,0.1526026758692292,2025-04-25 01:10:08.338245,2025-04-25 01:10:32.901133,0 days 00:00:24.562888,92.04148620083566,0.015505848227602178,0.158968101337994,linear,TPESampler,COMPLETE
1928,0.1498154652768793,2025-04-25 01:10:12.177058,2025-04-25 01:10:30.574198,0 days 00:00:18.397140,95.61584869391744,0.03730450585593562,0.0040380832128680535,linear,TPESampler,COMPLETE
1929,49.83689867581761,2025-04-25 01:10:27.349030,2025-04-25 01:43:27.613034,0 days 00:33:00.264004,73.16467458318637,0.06512911584058768,0.9548728878961092,poly,TPESampler,COMPLETE
1930,0.15525235667101434,2025-04-25 01:10:30.748390,2025-04-25 01:10:37.226944,0 days 00:00:06.478554,22.719955396537504,0.045696254131702946,0.00024126402550054242,linear,TPESampler,COMPLETE
1931,0.36976028582085285,2025-04-25 01:10:33.153061,2025-04-25 01:10:33.840760,0 days 00:00:00.687699,7.484915475621277,0.023244714489378957,0.0004945426187466877,rbf,TPESampler,COMPLETE
1932,0.15423230945780106,2025-04-25 01:10:34.077616,2025-04-25 01:10:47.339025,0 days 00:00:13.261409,24.419409746584037,0.01110356589134748,0.001486752978121828,linear,TPESampler,COMPLETE
1933,0.5955121634903082,2025-04-25 01:10:37.414746,2025-04-25 01:13:39.615847,0 days 00:03:02.201101,83.12650501293227,0.0492833209415429,0.08157204401432212,poly,TPESampler,COMPLETE
1934,0.4981942122912551,2025-04-25 01:10:47.522559,2025-04-25 01:10:48.236191,0 days 00:00:00.713632,91.98470240363349,0.033708015695413325,0.012448965306560391,poly,TPESampler,COMPLETE
1935,0.16201772025563205,2025-04-25 01:10:48.413409,2025-04-25 01:11:05.331658,0 days 00:00:16.918249,97.88742099280141,0.05684492576654908,0.001596279318103015,linear,TPESampler,COMPLETE
1936,3.6066878340325297,2025-04-25 01:11:05.524497,2025-04-25 01:11:06.114404,0 days 00:00:00.589907,10.441555683105891,0.024240446009860007,0.002563920416612216,sigmoid,TPESampler,COMPLETE
1937,1.4074128391120422,2025-04-25 01:11:06.381852,2025-04-25 01:11:06.877126,0 days 00:00:00.495274,27.596602686636924,0.015597084733860511,0.000142244585410509,poly,TPESampler,COMPLETE
1938,0.38188199720444993,2025-04-25 01:11:07.057805,2025-04-25 01:11:07.528062,0 days 00:00:00.470257,9.568771387761805,0.24827983165914166,0.0005542520775558045,rbf,TPESampler,COMPLETE
1939,0.15116302456366848,2025-04-25 01:11:07.709366,2025-04-25 01:11:12.772108,0 days 00:00:05.062742,25.66258926053574,0.0239700207302299,0.0018860873028475698,linear,TPESampler,COMPLETE
1940,0.15373812657172065,2025-04-25 01:11:12.954949,2025-04-25 01:11:46.373439,0 days 00:00:33.418490,99.41621289837711,0.008612522503778341,0.010369634601384885,linear,TPESampler,COMPLETE
1941,0.14916603044203275,2025-04-25 01:11:46.550433,2025-04-25 01:12:02.602152,0 days 00:00:16.051719,91.59559935988807,0.03511007608727155,0.5053713237177608,linear,TPESampler,COMPLETE
1942,0.15037610011473956,2025-04-25 01:12:02.787037,2025-04-25 01:12:09.029188,0 days 00:00:06.242151,25.7241998757872,0.024287728151716738,0.029730247942909616,linear,TPESampler,COMPLETE
1943,0.16163313489826014,2025-04-25 01:12:09.238049,2025-04-25 01:12:11.381135,0 days 00:00:02.143086,18.697741318897346,0.07914708799007596,0.09346926345116557,linear,TPESampler,COMPLETE
1944,0.15354911035317562,2025-04-25 01:12:11.586045,2025-04-25 01:12:20.192169,0 days 00:00:08.606124,27.500496047349916,0.016758127902166887,0.0002755530118247919,linear,TPESampler,COMPLETE
1945,0.1642809520792389,2025-04-25 01:12:20.373724,2025-04-25 01:12:22.088128,0 days 00:00:01.714404,22.172486461238115,0.08478853586013839,0.00034018808502269397,linear,TPESampler,COMPLETE
1946,0.17120708344691407,2025-04-25 01:12:22.274539,2025-04-25 01:12:27.053285,0 days 00:00:04.778746,99.74093859350737,0.09951424011004974,0.00013561002430147916,linear,TPESampler,COMPLETE
1947,0.1759991997003863,2025-04-25 01:12:27.238234,2025-04-25 01:12:36.784052,0 days 00:00:09.545818,99.2986467941212,0.11322935435663932,0.0008668459639994834,linear,TPESampler,COMPLETE
1948,1.353461063291111,2025-04-25 01:12:36.960588,2025-04-25 01:12:37.479024,0 days 00:00:00.518436,0.012646732350970531,0.0071360388005201674,0.0016030314128752344,sigmoid,TPESampler,COMPLETE
1949,0.14936665820288705,2025-04-25 01:12:37.659629,2025-04-25 01:12:52.212899,0 days 00:00:14.553270,98.70815349588004,0.036492072703552744,0.00039589115310634476,linear,TPESampler,COMPLETE
1950,9.030741884382,2025-04-25 01:12:52.533504,2025-04-25 01:12:53.440690,0 days 00:00:00.907186,24.1104384088753,0.12545779513254557,0.0026336092025626115,sigmoid,TPESampler,COMPLETE
1951,0.1585288696636684,2025-04-25 01:12:53.625623,2025-04-25 01:12:55.749436,0 days 00:00:02.123813,16.4966049272044,0.06897494058102334,0.0019114039034723617,linear,TPESampler,COMPLETE
1952,0.15366999235213286,2025-04-25 01:12:55.937504,2025-04-25 01:12:57.215424,0 days 00:00:01.277920,3.9241500880883473,0.03165161904545764,0.0012984871660876919,linear,TPESampler,COMPLETE
1953,0.16204907705385677,2025-04-25 01:12:57.404825,2025-04-25 01:12:58.822410,0 days 00:00:01.417585,12.764046849742037,0.07579865314938487,0.22043179298533072,linear,TPESampler,COMPLETE
1954,0.1607074163852652,2025-04-25 01:12:59.005754,2025-04-25 01:13:03.634879,0 days 00:00:04.629125,82.29385316291382,0.07913268653542817,0.0006001830198347073,linear,TPESampler,COMPLETE
1955,0.16279335125702646,2025-04-25 01:13:03.823694,2025-04-25 01:13:06.295196,0 days 00:00:02.471502,22.38430914523982,0.06680859636011274,0.04613838288336576,linear,TPESampler,COMPLETE
1956,0.1506345117701132,2025-04-25 01:13:06.478430,2025-04-25 01:13:13.330258,0 days 00:00:06.851828,27.78610797498546,0.036156655572935986,0.0014994249473150067,linear,TPESampler,COMPLETE
1957,0.15020809573062713,2025-04-25 01:13:13.515460,2025-04-25 01:13:18.127108,0 days 00:00:04.611648,19.058843328440023,0.023074484927347726,0.00034660163577187106,linear,TPESampler,COMPLETE
1958,0.6150731931312861,2025-04-25 01:13:18.306354,2025-04-25 01:13:18.948909,0 days 00:00:00.642555,84.48480854880536,0.009903017230546806,0.13476444196623905,rbf,TPESampler,COMPLETE
1959,0.15423104140918745,2025-04-25 01:13:19.133459,2025-04-25 01:14:00.528492,0 days 00:00:41.395033,97.48710949133208,0.01192641459631995,0.2894176197598804,linear,TPESampler,COMPLETE
1960,0.8587175889752475,2025-04-25 01:13:39.802196,2025-04-25 01:13:40.331947,0 days 00:00:00.529751,67.3282518981889,0.0025764859537002476,0.0005878671388173056,poly,TPESampler,COMPLETE
1961,0.15245053861192762,2025-04-25 01:13:40.512997,2025-04-25 01:13:49.315451,0 days 00:00:08.802454,20.324424279843484,0.018254251909946475,0.15342208438594376,linear,TPESampler,COMPLETE
1962,0.15184546375096894,2025-04-25 01:13:49.500535,2025-04-25 01:13:56.922591,0 days 00:00:07.422056,26.204142359912378,0.019167644157125897,0.006861741793348356,linear,TPESampler,COMPLETE
1963,0.1564552879900644,2025-04-25 01:13:57.104052,2025-04-25 01:13:59.474204,0 days 00:00:02.370152,6.074883092890186,0.013478758213195356,0.036501603405092196,linear,TPESampler,COMPLETE
1964,1.3533416840910495,2025-04-25 01:13:59.656865,2025-04-25 01:14:00.159619,0 days 00:00:00.502754,0.05442117445511153,0.010258817463923991,0.0022723294163986035,poly,TPESampler,COMPLETE
1965,0.14935858995395573,2025-04-25 01:14:00.341086,2025-04-25 01:14:18.433429,0 days 00:00:18.092343,96.89311022714332,0.02867252340130187,0.0015132090672557359,linear,TPESampler,COMPLETE
1966,0.1549424451443418,2025-04-25 01:14:00.753681,2025-04-25 01:14:09.277645,0 days 00:00:08.523964,20.620419918309132,0.012450598567595953,0.002052798412704856,linear,TPESampler,COMPLETE
1967,0.32430072444946606,2025-04-25 01:14:09.466111,2025-04-25 01:14:09.994216,0 days 00:00:00.528105,99.18245120661953,0.02675811860135858,0.00010902742863841862,rbf,TPESampler,COMPLETE
1968,0.15075693838115353,2025-04-25 01:14:10.170421,2025-04-25 01:14:31.090580,0 days 00:00:20.920159,95.33650675872559,0.017706796007706412,0.0003782301239420959,linear,TPESampler,COMPLETE
1969,0.1546963934420324,2025-04-25 01:14:18.621439,2025-04-25 01:15:03.247087,0 days 00:00:44.625648,93.79615321816496,0.01134449643228689,0.003949516832285096,linear,TPESampler,COMPLETE
1970,0.15587431182275424,2025-04-25 01:14:31.269350,2025-04-25 01:14:50.708555,0 days 00:00:19.439205,89.0692485549225,0.04638942069024824,0.04980305735852729,linear,TPESampler,COMPLETE
1971,0.15470306048120014,2025-04-25 01:14:50.895653,2025-04-25 01:14:58.815815,0 days 00:00:07.920162,18.484513761412863,0.005354432192850272,0.0006652791367855001,linear,TPESampler,COMPLETE
1972,0.17516201616462054,2025-04-25 01:14:59.002933,2025-04-25 01:15:05.843399,0 days 00:00:06.840466,98.73286016779662,0.10896018503446299,0.011852379350387717,linear,TPESampler,COMPLETE
1973,0.14858390414050449,2025-04-25 01:15:03.434850,2025-04-25 01:15:12.970166,0 days 00:00:09.535316,41.07879093345995,0.031074014454153757,0.00010587619095622966,linear,TPESampler,COMPLETE
