number,value,datetime_start,datetime_complete,duration,params_C,params_epsilon,params_gamma,params_kernel,system_attrs_auto:sampler,state
1048,0.1553490131706619,2025-04-24 23:31:41.707780,2025-04-24 23:31:59.502989,0 days 00:00:17.795209,79.49556880655744,0.045821999783719494,0.016403793649553598,linear,TPESampler,COMPLETE
1049,0.1613639022978046,2025-04-24 23:31:57.628158,2025-04-24 23:32:01.238242,0 days 00:00:03.610084,21.066379995807516,0.056038102132868896,0.0021807291792691223,linear,TPESampler,COMPLETE
1050,0.15226418928600804,2025-04-24 23:31:59.672740,2025-04-24 23:32:04.163861,0 days 00:00:04.491121,14.565697903627974,0.019823875566590595,0.0014159201028314946,linear,TPESampler,COMPLETE
1051,0.152703609483465,2025-04-24 23:32:01.409912,2025-04-24 23:32:21.971064,0 days 00:00:20.561152,79.46023457448116,0.01379733444682431,0.006034884062086955,linear,TPESampler,COMPLETE
1052,0.14941358943359884,2025-04-24 23:32:04.341940,2025-04-24 23:32:08.652944,0 days 00:00:04.311004,17.535918084033643,0.030842022864130927,0.006136348229444076,linear,TPESampler,COMPLETE
1053,0.15593600219920906,2025-04-24 23:32:08.836724,2025-04-24 23:32:19.169659,0 days 00:00:10.332935,72.62029455416643,0.05184755103816296,0.004777709963713666,linear,TPESampler,COMPLETE
1054,0.1641396263281801,2025-04-24 23:32:19.345340,2025-04-24 23:32:23.074460,0 days 00:00:03.729120,25.63277056684296,0.06320924156276159,0.002398278512229504,linear,TPESampler,COMPLETE
1055,0.1553486415956371,2025-04-24 23:32:22.209272,2025-04-24 23:32:27.606756,0 days 00:00:05.397484,20.800721653211387,0.013434656299346788,0.00011953864295228968,linear,TPESampler,COMPLETE
1056,0.14867281878236907,2025-04-24 23:32:23.267869,2025-04-24 23:32:36.498618,0 days 00:00:13.230749,87.07656860480351,0.032068737068277245,0.004050239514465802,linear,TPESampler,COMPLETE
1057,0.14993304223510023,2025-04-24 23:32:27.779129,2025-04-24 23:32:48.950762,0 days 00:00:21.171633,98.43830527520562,0.03754545162607535,0.0009659941310457683,linear,TPESampler,COMPLETE
1058,0.14929137694470127,2025-04-24 23:32:36.673544,2025-04-24 23:32:58.446292,0 days 00:00:21.772748,92.33601584375971,0.0352964105283767,0.0009618267437126599,linear,TPESampler,COMPLETE
1059,0.15445717981281043,2025-04-24 23:32:49.399699,2025-04-24 23:32:51.229029,0 days 00:00:01.829330,4.402222764568636,0.036181682333093095,0.0031421474757051607,linear,TPESampler,COMPLETE
1060,0.774823123127357,2025-04-24 23:32:51.589768,2025-04-24 23:32:52.360044,0 days 00:00:00.770276,81.0635817665905,0.026022686163428267,0.0012994534681012892,poly,TPESampler,COMPLETE
1061,0.2925498964105294,2025-04-24 23:32:52.637605,2025-04-24 23:32:53.658060,0 days 00:00:01.020455,0.1037845205271673,0.003946644079424424,0.032393870269154426,linear,TPESampler,COMPLETE
1062,0.8469483486955341,2025-04-24 23:32:53.893394,2025-04-24 23:32:54.395227,0 days 00:00:00.501833,9.021549607138219,0.004131382475561392,0.0012482163040430198,poly,TPESampler,COMPLETE
1063,0.15394084110371722,2025-04-24 23:32:54.574684,2025-04-24 23:32:56.701807,0 days 00:00:02.127123,6.106213256160505,0.02558685970631248,0.00027032376120943825,linear,TPESampler,COMPLETE
1064,0.14849492496877884,2025-04-24 23:32:56.890267,2025-04-24 23:33:13.216590,0 days 00:00:16.326323,99.28477991744312,0.03221800308049283,0.0015085731846318487,linear,TPESampler,COMPLETE
1065,0.20952296489334188,2025-04-24 23:32:58.623853,2025-04-24 23:33:00.321943,0 days 00:00:01.698090,81.5298186110898,0.15224776329541592,0.005057499068797548,linear,TPESampler,COMPLETE
1066,0.148095242359505,2025-04-24 23:33:00.495113,2025-04-24 23:33:18.362955,0 days 00:00:17.867842,88.89123514846517,0.03310082585162911,0.0026004732757175003,linear,TPESampler,COMPLETE
1067,0.4880837130780036,2025-04-24 23:33:13.400750,2025-04-24 23:33:13.906176,0 days 00:00:00.505426,0.0015120023741709658,0.048390669934385525,0.0010682957769655936,linear,TPESampler,COMPLETE
1068,0.15475993345018427,2025-04-24 23:33:14.077103,2025-04-24 23:33:20.196073,0 days 00:00:06.118970,15.487561850765934,0.005441859561127943,0.0037649091695279645,linear,TPESampler,COMPLETE
1069,0.15404786612704038,2025-04-24 23:33:18.553676,2025-04-24 23:33:56.485417,0 days 00:00:37.931741,96.91893205212753,0.007079661125867933,0.0010150874093955416,linear,TPESampler,COMPLETE
1070,0.15768341793173252,2025-04-24 23:33:20.390923,2025-04-24 23:33:37.128973,0 days 00:00:16.738050,88.52868025260078,0.05342525886965011,0.0013813913852269496,linear,TPESampler,COMPLETE
1071,0.15283592831252468,2025-04-24 23:33:37.312381,2025-04-24 23:34:10.575087,0 days 00:00:33.262706,82.24107268498038,0.016745516998367956,0.002543164089648431,linear,TPESampler,COMPLETE
1072,0.15326139017820142,2025-04-24 23:33:56.662285,2025-04-24 23:34:30.718904,0 days 00:00:34.056619,90.60844849838787,0.013161088190461101,0.00032092792816012025,linear,TPESampler,COMPLETE
1073,0.15112220967238618,2025-04-24 23:34:10.750931,2025-04-24 23:34:35.303639,0 days 00:00:24.552708,95.21337594924073,0.01783343960262722,0.001118187753853638,linear,TPESampler,COMPLETE
1074,0.15314446929503628,2025-04-24 23:34:30.889793,2025-04-24 23:34:56.494388,0 days 00:00:25.604595,92.2113007528381,0.016428433422866165,0.0018918174811764896,linear,TPESampler,COMPLETE
1075,0.17815571229618885,2025-04-24 23:34:35.476579,2025-04-24 23:34:41.473079,0 days 00:00:05.996500,95.39962835350445,0.12006105523771107,0.0005470528625952822,linear,TPESampler,COMPLETE
1076,0.16369961811137992,2025-04-24 23:34:41.647487,2025-04-24 23:34:43.679583,0 days 00:00:02.032096,14.456408751949274,0.0609671519223477,0.0007324400956331352,linear,TPESampler,COMPLETE
1077,0.15126308274342004,2025-04-24 23:34:43.857269,2025-04-24 23:34:46.424629,0 days 00:00:02.567360,9.404135991116046,0.023594566584365713,0.002172875618241932,linear,TPESampler,COMPLETE
1078,0.15015718474394849,2025-04-24 23:34:46.594691,2025-04-24 23:34:50.220781,0 days 00:00:03.626090,21.917193117379952,0.03567552023128987,0.0015827448004245206,linear,TPESampler,COMPLETE
1079,0.14910395112958238,2025-04-24 23:34:50.393662,2025-04-24 23:34:53.416002,0 days 00:00:03.022340,16.294856285460757,0.03151565809860574,0.000374338656303469,linear,TPESampler,COMPLETE
1080,0.15699391740498228,2025-04-24 23:34:53.586771,2025-04-24 23:35:10.428806,0 days 00:00:16.842035,93.18327612869979,0.04834315348495757,0.0001514822314107724,linear,TPESampler,COMPLETE
1081,0.16030115550635143,2025-04-24 23:34:56.677061,2025-04-24 23:35:03.744530,0 days 00:00:07.067469,85.52935850495906,0.07857303978723496,0.0011315892985210233,linear,TPESampler,COMPLETE
1082,1.39689527667365,2025-04-24 23:35:03.982800,2025-04-24 23:35:04.649311,0 days 00:00:00.666511,0.0015038535034898979,0.01983254709518252,0.005022020901062647,poly,TPESampler,COMPLETE
1083,0.4934572578826315,2025-04-24 23:35:04.824606,2025-04-24 23:35:13.529267,0 days 00:00:08.704661,0.21610160578858634,0.1454519626662133,0.4990811095640827,poly,TPESampler,COMPLETE
1084,0.15034115454968858,2025-04-24 23:35:10.603807,2025-04-24 23:35:35.030923,0 days 00:00:24.427116,92.34504244552873,0.01963808378473728,0.0004446769710676581,linear,TPESampler,COMPLETE
1085,0.1521350924061568,2025-04-24 23:35:13.712529,2025-04-24 23:35:20.888896,0 days 00:00:07.176367,32.31572410521508,0.04136314586441125,0.0013879313021077288,linear,TPESampler,COMPLETE
1086,0.15427786012548503,2025-04-24 23:35:21.061202,2025-04-24 23:35:45.303152,0 days 00:00:24.241950,91.84888347501585,0.0151201990232146,0.00459052317424551,linear,TPESampler,COMPLETE
1087,0.16423957914432455,2025-04-24 23:35:35.210546,2025-04-24 23:35:39.096700,0 days 00:00:03.886154,84.57422539214244,0.08434444347473193,0.008266013174097227,linear,TPESampler,COMPLETE
1088,0.15078051658876715,2025-04-24 23:35:39.269662,2025-04-24 23:35:44.105947,0 days 00:00:04.836285,12.757714262521764,0.024157654763101034,0.0018165982218538094,linear,TPESampler,COMPLETE
1089,0.17135171975028202,2025-04-24 23:35:44.279695,2025-04-24 23:35:48.553395,0 days 00:00:04.273700,89.62148855194415,0.10087185430938718,0.0009190140999193632,linear,TPESampler,COMPLETE
1090,0.15010716926984352,2025-04-24 23:35:45.483416,2025-04-24 23:35:51.026889,0 days 00:00:05.543473,17.320366439346433,0.022660549907609746,0.001610388957511276,linear,TPESampler,COMPLETE
1091,0.1510185760050191,2025-04-24 23:35:48.722015,2025-04-24 23:36:01.809423,0 days 00:00:13.087408,94.07333078161824,0.03899177971897287,0.0014311588690049896,linear,TPESampler,COMPLETE
1092,0.14991409279920592,2025-04-24 23:35:51.200738,2025-04-24 23:36:08.885970,0 days 00:00:17.685232,94.5090882394369,0.027718455433505523,0.0006992017201965068,linear,TPESampler,COMPLETE
1093,0.4639532421580476,2025-04-24 23:36:01.983999,2025-04-24 23:36:02.497322,0 days 00:00:00.513323,4.7040816474759,0.03435193582104495,0.0009084093788527245,sigmoid,TPESampler,COMPLETE
1094,0.15226071576278266,2025-04-24 23:36:02.668039,2025-04-24 23:36:17.238544,0 days 00:00:14.570505,90.25522115618831,0.04198804056443587,0.0013748735301258028,linear,TPESampler,COMPLETE
1095,0.14905858900529312,2025-04-24 23:36:09.061444,2025-04-24 23:36:19.452440,0 days 00:00:10.390996,78.13832827884173,0.034986548758647144,0.002583725402611078,linear,TPESampler,COMPLETE
1096,119.16355963887109,2025-04-24 23:36:17.405833,2025-04-24 23:36:17.916536,0 days 00:00:00.510703,60.35996758979752,0.02572119000277077,0.005384466823554528,sigmoid,TPESampler,COMPLETE
1097,0.16424559733337135,2025-04-24 23:36:18.101250,2025-04-24 23:36:22.534068,0 days 00:00:04.432818,97.66135099333349,0.08407915268980129,0.003424735955291846,linear,TPESampler,COMPLETE
1098,0.14988135181642753,2025-04-24 23:36:19.622676,2025-04-24 23:36:45.991130,0 days 00:00:26.368454,74.77696611500012,0.022036957616566058,0.005671052603017627,linear,TPESampler,COMPLETE
1099,0.15205087120176122,2025-04-24 23:36:22.762846,2025-04-24 23:36:44.784982,0 days 00:00:22.022136,96.84866329419552,0.04127659170959734,0.005597914528280336,linear,TPESampler,COMPLETE
1100,0.1553083463287061,2025-04-24 23:36:44.980482,2025-04-24 23:36:49.997001,0 days 00:00:05.016519,11.915644041249825,0.006542531441229174,0.0007106728578046141,linear,TPESampler,COMPLETE
1101,0.15087969194676157,2025-04-24 23:36:46.171748,2025-04-24 23:36:51.892939,0 days 00:00:05.721191,14.286230984802337,0.026479779513324177,0.000712067023328288,linear,TPESampler,COMPLETE
1102,0.1551559040618736,2025-04-24 23:36:50.176436,2025-04-24 23:36:54.142035,0 days 00:00:03.965599,17.01333799837977,0.04550520989839795,0.0003801095557380265,linear,TPESampler,COMPLETE
1103,0.7740176781449092,2025-04-24 23:36:52.067125,2025-04-24 23:36:52.559512,0 days 00:00:00.492387,6.713292923901824,0.06371638247194798,0.0027951757773787412,poly,TPESampler,COMPLETE
1104,0.15465899843354577,2025-04-24 23:36:52.729693,2025-04-24 23:37:21.591789,0 days 00:00:28.862096,72.9239532868677,0.012691095455160669,0.0010757599431809237,linear,TPESampler,COMPLETE
1105,0.30886865938334196,2025-04-24 23:36:54.321713,2025-04-24 23:36:54.851459,0 days 00:00:00.529746,88.77155206264933,0.005738898291917393,0.0001547378905644094,rbf,TPESampler,COMPLETE
1106,1.3983333945660639,2025-04-24 23:36:55.023598,2025-04-24 23:36:55.532560,0 days 00:00:00.508962,0.0014442879463412988,0.0011646024310769851,0.003902928682251742,sigmoid,TPESampler,COMPLETE
1107,0.6886486882116933,2025-04-24 23:36:55.712369,2025-04-24 23:36:56.251627,0 days 00:00:00.539258,12.842162394207243,0.0377725577982942,0.2262574590352624,rbf,TPESampler,COMPLETE
1108,0.608946518456594,2025-04-24 23:36:56.423424,2025-04-24 23:36:56.871655,0 days 00:00:00.448231,4.763701054300815,0.9335566202986649,0.0003096629833010853,rbf,TPESampler,COMPLETE
1109,0.3510779580747448,2025-04-24 23:36:57.044933,2025-04-24 23:36:57.568699,0 days 00:00:00.523766,62.495593143951574,0.03121724431334595,0.0070126013207021005,poly,TPESampler,COMPLETE
1110,0.15471527239012062,2025-04-24 23:36:57.748797,2025-04-24 23:37:32.487192,0 days 00:00:34.738395,94.40894219543539,0.004430936027282433,0.006449218002214081,linear,TPESampler,COMPLETE
1111,0.15384115059659673,2025-04-24 23:37:21.808468,2025-04-24 23:37:57.572040,0 days 00:00:35.763572,98.35904135768014,0.008063733760690613,0.0024435824075373126,linear,TPESampler,COMPLETE
1112,0.15065583001684205,2025-04-24 23:37:32.660141,2025-04-24 23:37:37.904160,0 days 00:00:05.244019,20.046095032902254,0.03690773204035097,0.0017976513266268754,linear,TPESampler,COMPLETE
1113,0.15050106476021272,2025-04-24 23:37:38.072036,2025-04-24 23:37:42.876366,0 days 00:00:04.804330,25.552047964426773,0.03581987953948649,0.005653842921685013,linear,TPESampler,COMPLETE
1114,0.15315624804546027,2025-04-24 23:37:43.093503,2025-04-24 23:37:48.812844,0 days 00:00:05.719341,19.42465289822405,0.04309521166763041,0.0021489756475750596,linear,TPESampler,COMPLETE
1115,0.1639244561211215,2025-04-24 23:37:49.033624,2025-04-24 23:38:00.978047,0 days 00:00:11.944423,93.20376130400956,0.06531771852844426,0.006698441370828705,linear,TPESampler,COMPLETE
1116,0.15573423053013588,2025-04-24 23:37:57.744063,2025-04-24 23:38:14.220199,0 days 00:00:16.476136,87.69410760876461,0.046186495270152096,0.004034778819786927,linear,TPESampler,COMPLETE
1117,0.4526039320645283,2025-04-24 23:38:01.150769,2025-04-24 23:38:01.634068,0 days 00:00:00.483299,0.0036202588550606875,0.0012929567843101397,0.02357101904079618,linear,TPESampler,COMPLETE
1118,0.150021712509393,2025-04-24 23:38:01.807058,2025-04-24 23:38:21.289528,0 days 00:00:19.482470,85.22277237000903,0.02368497468547019,0.0020676798289085635,linear,TPESampler,COMPLETE
1119,0.16376094962729718,2025-04-24 23:38:14.409140,2025-04-24 23:38:27.713819,0 days 00:00:13.304679,99.74225010556643,0.05837980109099607,0.002092895398456153,linear,TPESampler,COMPLETE
1120,0.1502103988845854,2025-04-24 23:38:21.460211,2025-04-24 23:38:44.753852,0 days 00:00:23.293641,98.91951671492025,0.020084747683697876,0.011762917458519139,linear,TPESampler,COMPLETE
1121,0.2810450999399998,2025-04-24 23:38:27.890287,2025-04-24 23:38:28.423279,0 days 00:00:00.532992,9.74456406811714,0.02740547521806668,0.0014556835478838177,rbf,TPESampler,COMPLETE
1122,0.15544456992331612,2025-04-24 23:38:28.592041,2025-04-24 23:38:32.731220,0 days 00:00:04.139179,18.1600280364099,0.014858905410627652,0.00048062066544928635,linear,TPESampler,COMPLETE
1123,0.15271868191852045,2025-04-24 23:38:32.897826,2025-04-24 23:39:03.669925,0 days 00:00:30.772099,94.16659981972062,0.013842365517369715,0.001758507866175689,linear,TPESampler,COMPLETE
1124,0.3643741113728962,2025-04-24 23:38:44.928655,2025-04-24 23:38:45.515359,0 days 00:00:00.586704,60.089472451364,0.007517920414482618,0.009127097014461181,poly,TPESampler,COMPLETE
1125,0.2073603869503136,2025-04-24 23:38:45.687166,2025-04-24 23:38:46.527713,0 days 00:00:00.840547,19.170288531214705,0.13808963341717456,0.0007737444442808981,linear,TPESampler,COMPLETE
1126,0.15465783656317378,2025-04-24 23:38:46.701260,2025-04-24 23:38:54.158431,0 days 00:00:07.457171,18.40929298302235,0.011922967176713033,0.0072001216942029315,linear,TPESampler,COMPLETE
1127,0.1503000136859165,2025-04-24 23:38:54.330122,2025-04-24 23:39:07.172116,0 days 00:00:12.841994,82.95210612338158,0.03776586361173669,0.0004657984170464607,linear,TPESampler,COMPLETE
1128,0.1523615784776403,2025-04-24 23:39:03.882249,2025-04-24 23:39:07.173081,0 days 00:00:03.290832,10.959299964337005,0.01877305467236453,0.0028096055661128642,linear,TPESampler,COMPLETE
1129,0.14968892892581506,2025-04-24 23:39:07.292458,2025-04-24 23:39:29.283861,0 days 00:00:21.991403,87.85366545031238,0.024401287298303573,0.006630520325478803,linear,TPESampler,COMPLETE
1130,0.1493752908999113,2025-04-24 23:39:07.342412,2025-04-24 23:39:10.885736,0 days 00:00:03.543324,19.377508526301032,0.03263636931222496,0.8342541497999624,linear,TPESampler,COMPLETE
1131,0.2410110711221179,2025-04-24 23:39:11.065037,2025-04-24 23:39:11.567536,0 days 00:00:00.502499,14.569971067171867,0.06858261641580454,0.005064656901273753,rbf,TPESampler,COMPLETE
1132,0.1635808277741767,2025-04-24 23:39:11.738660,2025-04-24 23:39:22.005699,0 days 00:00:10.267039,91.63265458880007,0.061389102822262155,0.017073078134578003,linear,TPESampler,COMPLETE
1133,0.14900106211172057,2025-04-24 23:39:22.181477,2025-04-24 23:39:40.648116,0 days 00:00:18.466639,90.20561006190246,0.03486850061791197,0.014488725529550387,linear,TPESampler,COMPLETE
1134,0.16982648033549222,2025-04-24 23:39:29.450052,2025-04-24 23:39:31.353699,0 days 00:00:01.903647,20.535912661447924,0.09119615541204212,0.002170379936077331,linear,TPESampler,COMPLETE
1135,0.14956056331985962,2025-04-24 23:39:31.524624,2025-04-24 23:39:47.748372,0 days 00:00:16.223748,95.87020558323364,0.035920173493526775,0.0027789188318055194,linear,TPESampler,COMPLETE
1136,0.15199554085771927,2025-04-24 23:39:40.816996,2025-04-24 23:39:47.239689,0 days 00:00:06.422693,22.195733679840657,0.019000631530032282,0.00043543825332117595,linear,TPESampler,COMPLETE
1137,0.14896317473550236,2025-04-24 23:39:47.424080,2025-04-24 23:40:06.221175,0 days 00:00:18.797095,84.75315995371373,0.0292276173342469,0.001104815277961592,linear,TPESampler,COMPLETE
1138,0.14909876645907108,2025-04-24 23:39:47.919589,2025-04-24 23:39:51.260576,0 days 00:00:03.340987,15.86032470416046,0.03291477050941316,0.009877458435824906,linear,TPESampler,COMPLETE
1139,1.3884073372941401,2025-04-24 23:39:51.433117,2025-04-24 23:39:51.946697,0 days 00:00:00.513580,0.018993451559902685,0.17238528152527874,0.00024622409732133233,rbf,TPESampler,COMPLETE
1140,0.1518646809999574,2025-04-24 23:39:52.126415,2025-04-24 23:40:23.079107,0 days 00:00:30.952692,99.83523652194155,0.01693277943445912,0.0003677639464003238,linear,TPESampler,COMPLETE
1141,0.1653973867211434,2025-04-24 23:40:06.394499,2025-04-24 23:40:08.013347,0 days 00:00:01.618848,17.802797634207664,0.08514768649161754,0.0008862771405605885,linear,TPESampler,COMPLETE
1142,0.17012337634031466,2025-04-24 23:40:08.203895,2025-04-24 23:40:08.891474,0 days 00:00:00.687579,2.063875129129962,0.06092506261140838,0.012956917505920174,linear,TPESampler,COMPLETE
1143,0.1529557962176554,2025-04-24 23:40:09.091077,2025-04-24 23:40:36.552782,0 days 00:00:27.461705,94.18556028415288,0.015194050034398355,0.005981164722786703,linear,TPESampler,COMPLETE
1144,1.3938622098341442,2025-04-24 23:40:23.269784,2025-04-24 23:40:23.731562,0 days 00:00:00.461778,0.0022438390955224143,0.6293321153160705,0.00035834475471054067,sigmoid,TPESampler,COMPLETE
1145,0.14837166005070276,2025-04-24 23:40:23.900604,2025-04-24 23:40:36.313415,0 days 00:00:12.412811,94.04374434823153,0.03296222114021423,0.003064343934721315,linear,TPESampler,COMPLETE
1146,0.15028577826048733,2025-04-24 23:40:36.511233,2025-04-24 23:40:40.601190,0 days 00:00:04.089957,18.50402822029394,0.02327585536404945,0.0019688699418015368,linear,TPESampler,COMPLETE
1147,0.4436006477776373,2025-04-24 23:40:36.779513,2025-04-24 23:40:37.269493,0 days 00:00:00.489980,99.62942905266576,0.48208878866094856,0.0020557730009341094,linear,TPESampler,COMPLETE
1148,0.1506431312241102,2025-04-24 23:40:37.445899,2025-04-24 23:40:40.439248,0 days 00:00:02.993349,12.261842178569067,0.027352715843067917,0.005718324220835321,linear,TPESampler,COMPLETE
1149,1.4028034323969454,2025-04-24 23:40:40.610143,2025-04-24 23:40:41.107463,0 days 00:00:00.497320,0.0015624942446677474,0.009876579521726554,0.259621945108821,rbf,TPESampler,COMPLETE
1150,0.15443616430676854,2025-04-24 23:40:40.769748,2025-04-24 23:40:50.976794,0 days 00:00:10.207046,21.802151622526694,0.0107930017439108,0.0015140857501224874,linear,TPESampler,COMPLETE
1151,1.3938954803692607,2025-04-24 23:40:41.289900,2025-04-24 23:40:41.806703,0 days 00:00:00.516803,0.0021326576390440183,0.019271393813795213,0.0035693692895763054,sigmoid,TPESampler,COMPLETE
1152,0.14873994334978552,2025-04-24 23:40:41.984347,2025-04-24 23:40:54.110888,0 days 00:00:12.126541,94.18123273727144,0.034642397867471246,0.0023270584223327104,linear,TPESampler,COMPLETE
1153,0.18637433131565476,2025-04-24 23:40:43.232534,2025-04-24 23:40:43.779494,0 days 00:00:00.546960,99.6712283674249,0.011696082950280491,0.0009739150880625962,rbf,TPESampler,COMPLETE
1154,0.15006210108281445,2025-04-24 23:40:43.964376,2025-04-24 23:41:06.479544,0 days 00:00:22.515168,94.3473650924113,0.02147198206533963,0.006788891587288433,linear,TPESampler,COMPLETE
1155,0.15608083124644478,2025-04-24 23:40:51.149938,2025-04-24 23:40:55.270980,0 days 00:00:04.121042,15.284639840837333,0.0465832487122071,0.00017980912829097183,linear,TPESampler,COMPLETE
1156,0.15433030830926284,2025-04-24 23:40:54.291727,2025-04-24 23:41:38.123653,0 days 00:00:43.831926,92.68286235818728,0.009594393396864099,0.001269680183261754,linear,TPESampler,COMPLETE
1157,0.14894469421200573,2025-04-24 23:40:55.435325,2025-04-24 23:41:08.872648,0 days 00:00:13.437323,88.12282375296785,0.034521853070006714,0.003842017931770091,linear,TPESampler,COMPLETE
1158,0.15800589635839674,2025-04-24 23:41:06.646953,2025-04-24 23:41:21.128580,0 days 00:00:14.481627,94.09994826453864,0.069581250919504,0.0003035576338215486,linear,TPESampler,COMPLETE
1159,0.16106780365178872,2025-04-24 23:41:09.059526,2025-04-24 23:41:12.874992,0 days 00:00:03.815466,19.82721747880445,0.056168397043542935,0.0013132604314164953,linear,TPESampler,COMPLETE
1160,1.3890043739416122,2025-04-24 23:41:13.048790,2025-04-24 23:41:13.539424,0 days 00:00:00.490634,0.0045937001746418574,0.03827917519717514,0.47230101404943986,sigmoid,TPESampler,COMPLETE
1161,0.15980590406962084,2025-04-24 23:41:13.716304,2025-04-24 23:41:22.398879,0 days 00:00:08.682575,96.79828181897668,0.07575325537590435,0.0013808421597666703,linear,TPESampler,COMPLETE
1162,1.3884558020635254,2025-04-24 23:41:21.296195,2025-04-24 23:41:21.900124,0 days 00:00:00.603929,0.0023829510724650785,0.03225319754489587,0.0025659211538158334,rbf,TPESampler,COMPLETE
