number,value,datetime_start,datetime_complete,duration,params_C,params_epsilon,params_gamma,params_kernel,system_attrs_auto:sampler,state
467,0.1602680505728009,2025-04-24 22:02:41.536747,2025-04-24 22:02:50.497482,0 days 00:00:08.960735,73.48846826128202,0.07768184198223582,0.0044297352076614165,linear,TPESampler,COMPLETE
468,0.16780092016903067,2025-04-24 22:02:50.875291,2025-04-24 22:02:52.484393,0 days 00:00:01.609102,10.791162690176519,0.08214735933836137,0.00325443861049117,linear,TPESampler,COMPLETE
469,0.153697715785482,2025-04-24 22:02:53.061459,2025-04-24 22:02:58.508902,0 days 00:00:05.447443,18.686833899648057,0.04405034694392992,0.0015510058422583072,linear,TPESampler,COMPLETE
470,0.15831293194679746,2025-04-24 22:02:58.818609,2025-04-24 22:03:09.213851,0 days 00:00:10.395242,88.33079414289926,0.07404381798008015,0.002443608185570702,linear,TPESampler,COMPLETE
471,0.15009062903074144,2025-04-24 22:03:06.198615,2025-04-24 22:03:24.708594,0 days 00:00:18.509979,64.5479188353194,0.02132257595458187,0.0019698988623226723,linear,TPESampler,COMPLETE
472,0.1567873553621407,2025-04-24 22:03:09.393804,2025-04-24 22:03:14.308991,0 days 00:00:04.915187,19.457191038391876,0.04737736048421111,0.008401437248033581,linear,TPESampler,COMPLETE
473,0.14853438345136522,2025-04-24 22:03:14.560402,2025-04-24 22:03:27.447834,0 days 00:00:12.887432,73.61609275144356,0.033550501294966936,0.0009427527453590591,linear,TPESampler,COMPLETE
474,2.6396418240741935,2025-04-24 22:03:24.900614,2025-04-24 22:03:25.377486,0 days 00:00:00.476872,3.069809825319253,0.42266219487264073,0.004037304458387758,sigmoid,TPESampler,COMPLETE
475,0.1530823524796324,2025-04-24 22:03:25.544397,2025-04-24 22:03:53.326743,0 days 00:00:27.782346,91.20434122951137,0.014235697523870649,0.008018251190866204,linear,TPESampler,COMPLETE
476,0.15383530688444966,2025-04-24 22:03:27.646700,2025-04-24 22:03:45.144944,0 days 00:00:17.498244,67.25803451913455,0.014488145869068445,0.00044195103331751465,linear,TPESampler,COMPLETE
477,0.14918152048746378,2025-04-24 22:03:45.321385,2025-04-24 22:03:52.326013,0 days 00:00:07.004628,35.476197434259454,0.034194498439630204,0.0003817535287153204,linear,TPESampler,COMPLETE
478,0.7609153118962471,2025-04-24 22:03:52.513662,2025-04-24 22:03:53.026976,0 days 00:00:00.513314,21.886733601690892,0.02966017134163446,0.0013547795173966966,poly,TPESampler,COMPLETE
479,0.16266981306328387,2025-04-24 22:03:53.198606,2025-04-24 22:04:07.813164,0 days 00:00:14.614558,85.33665078261491,0.05776441846320945,0.0012427837556771072,linear,TPESampler,COMPLETE
480,0.15104467817096492,2025-04-24 22:03:53.503968,2025-04-24 22:03:55.766984,0 days 00:00:02.263016,9.700194608918366,0.02450622144133005,0.0010127820449828098,linear,TPESampler,COMPLETE
481,0.1502751560168925,2025-04-24 22:03:55.946548,2025-04-24 22:04:09.812083,0 days 00:00:13.865535,53.5459057528698,0.026658259974279182,0.0007242076569733633,linear,TPESampler,COMPLETE
482,0.15197412014498352,2025-04-24 22:04:07.998231,2025-04-24 22:04:11.764212,0 days 00:00:03.765981,15.760337950539782,0.018838681423331522,0.005926301481977583,linear,TPESampler,COMPLETE
483,1.40819282452458,2025-04-24 22:04:10.006513,2025-04-24 22:04:10.522227,0 days 00:00:00.515714,1.013496288521738,0.001091214019448263,0.00038687511033191733,poly,TPESampler,COMPLETE
484,0.14903943655423554,2025-04-24 22:04:10.836887,2025-04-24 22:04:29.157463,0 days 00:00:18.320576,61.05069741959287,0.02911815273841426,0.0027029306219928475,linear,TPESampler,COMPLETE
485,0.14886258695257226,2025-04-24 22:04:11.947836,2025-04-24 22:04:35.149778,0 days 00:00:23.201942,93.68446053832085,0.029610456194260837,0.0033763556053156172,linear,TPESampler,COMPLETE
486,0.3695937377624056,2025-04-24 22:04:29.333656,2025-04-24 22:04:29.833685,0 days 00:00:00.500029,2.7967597116006684,0.08001526570482159,0.0012941200370269143,rbf,TPESampler,COMPLETE
487,0.14956921063021694,2025-04-24 22:04:30.003925,2025-04-24 22:04:43.190093,0 days 00:00:13.186168,98.99773010522475,0.03693153861067934,0.0018791418865881997,linear,TPESampler,COMPLETE
488,19.597336129290433,2025-04-24 22:04:35.318750,2025-04-24 22:04:35.833026,0 days 00:00:00.514276,75.97387814035267,0.0158512132119242,0.0022657065525774696,sigmoid,TPESampler,COMPLETE
489,0.15498315171602875,2025-04-24 22:04:36.005095,2025-04-24 22:04:42.192530,0 days 00:00:06.187435,10.535152007134023,0.009116507625191988,0.0023894220212251154,linear,TPESampler,COMPLETE
490,1.3427975884887435,2025-04-24 22:04:42.365431,2025-04-24 22:04:42.847646,0 days 00:00:00.482215,1.5982415695518954,0.7739878070123587,0.0006470967728801834,poly,TPESampler,COMPLETE
491,0.48311594428548993,2025-04-24 22:04:43.021904,2025-04-24 22:04:43.481130,0 days 00:00:00.459226,54.37409401344233,0.019439743529916564,0.003952338820916876,poly,TPESampler,COMPLETE
492,0.14970084761450805,2025-04-24 22:04:43.394026,2025-04-24 22:05:00.843389,0 days 00:00:17.449363,84.24102615396059,0.024724954302478928,0.002222158819887947,linear,TPESampler,COMPLETE
493,0.14979497331724112,2025-04-24 22:04:43.714825,2025-04-24 22:05:04.931362,0 days 00:00:21.216537,98.22831030090379,0.027589499932699463,0.022673376667748588,linear,TPESampler,COMPLETE
494,0.17130252777980365,2025-04-24 22:05:01.031250,2025-04-24 22:05:03.861893,0 days 00:00:02.830643,43.723711825923495,0.095319424823889,0.0006204764778169426,linear,TPESampler,COMPLETE
495,0.15514287700257148,2025-04-24 22:05:04.083190,2025-04-24 22:05:11.535650,0 days 00:00:07.452460,18.976931025845854,0.012167573112476144,0.005933420187912212,linear,TPESampler,COMPLETE
496,0.1501615510016494,2025-04-24 22:05:05.107217,2025-04-24 22:05:18.834641,0 days 00:00:13.727424,53.324107713264844,0.025969112221478057,0.004660787331184325,linear,TPESampler,COMPLETE
497,1.4124345394592224,2025-04-24 22:05:11.718728,2025-04-24 22:05:12.541702,0 days 00:00:00.822974,0.004474056453004549,0.0010735022552576504,0.00010543090665445882,sigmoid,TPESampler,COMPLETE
498,0.14870021208016268,2025-04-24 22:05:12.728403,2025-04-24 22:05:24.885247,0 days 00:00:12.156844,93.91289624232738,0.03179940132566862,0.004959469311764904,linear,TPESampler,COMPLETE
499,0.17267886472812766,2025-04-24 22:05:19.008970,2025-04-24 22:05:20.406121,0 days 00:00:01.397151,14.71229267761481,0.09219272156000173,0.014703460776126843,linear,TPESampler,COMPLETE
500,1.153724097172626,2025-04-24 22:05:20.676593,2025-04-24 22:05:21.376754,0 days 00:00:00.700161,0.09028994303791245,0.44844786229158673,0.1866785497160286,rbf,TPESampler,COMPLETE
501,0.4915170203907569,2025-04-24 22:05:21.564613,2025-04-24 22:05:22.104979,0 days 00:00:00.540366,10.71208530100023,0.34338170606847834,0.0002259895434374448,sigmoid,TPESampler,COMPLETE
502,0.15027374769775975,2025-04-24 22:05:22.275173,2025-04-24 22:05:39.403582,0 days 00:00:17.128409,78.36147284577675,0.026196689775224883,0.001461158894984231,linear,TPESampler,COMPLETE
503,0.15253812759427093,2025-04-24 22:05:25.100040,2025-04-24 22:05:27.850011,0 days 00:00:02.749971,16.049332122066478,0.04054665886418151,0.026608252377385243,linear,TPESampler,COMPLETE
504,0.15839608169361258,2025-04-24 22:05:28.046135,2025-04-24 22:05:32.824654,0 days 00:00:04.778519,51.22875226396608,0.07403717029760606,0.01809091045888443,linear,TPESampler,COMPLETE
505,0.15060922151917325,2025-04-24 22:05:32.995674,2025-04-24 22:05:35.287644,0 days 00:00:02.291970,10.384341360997817,0.028371470511716578,0.01675346176275759,linear,TPESampler,COMPLETE
506,0.4826154963071321,2025-04-24 22:05:35.471495,2025-04-24 22:05:35.954355,0 days 00:00:00.482860,0.0018851134427162466,0.15197168101223174,0.00012111984465061737,linear,TPESampler,COMPLETE
507,0.17113789868795382,2025-04-24 22:05:36.127566,2025-04-24 22:05:41.449904,0 days 00:00:05.322338,97.33481964756534,0.09902523623375041,0.008726681576251016,linear,TPESampler,COMPLETE
508,0.1543532177085918,2025-04-24 22:05:39.589932,2025-04-24 22:06:18.000165,0 days 00:00:38.410233,98.9471578532913,0.005810267910279108,0.00015369156170775595,linear,TPESampler,COMPLETE
509,0.15471163730420692,2025-04-24 22:05:41.621560,2025-04-24 22:06:17.304886,0 days 00:00:35.683326,91.98742283122212,0.012451108256217015,0.002638264920023229,linear,TPESampler,COMPLETE
510,0.15670179507466953,2025-04-24 22:06:17.491440,2025-04-24 22:06:34.267405,0 days 00:00:16.775965,91.76501327096554,0.04997516170946754,0.006144139628744925,linear,TPESampler,COMPLETE
511,0.16333983475502378,2025-04-24 22:06:18.171361,2025-04-24 22:06:34.064092,0 days 00:00:15.892731,99.66048681440571,0.0619286969579909,0.07917063289013655,linear,TPESampler,COMPLETE
512,0.15294177934067746,2025-04-24 22:06:34.230699,2025-04-24 22:06:57.385037,0 days 00:00:23.154338,67.84831306019419,0.01573537336793693,0.01429105505799687,linear,TPESampler,COMPLETE
513,0.1550395848953699,2025-04-24 22:06:34.461268,2025-04-24 22:06:57.038066,0 days 00:00:22.576798,92.96847757287333,0.045498429140911435,0.015511801385055046,linear,TPESampler,COMPLETE
514,0.15418295814882602,2025-04-24 22:06:57.211789,2025-04-24 22:07:04.000494,0 days 00:00:06.788705,16.05398077034134,0.009066238469161008,0.03978154180725265,linear,TPESampler,COMPLETE
515,0.14997848732869998,2025-04-24 22:06:57.587470,2025-04-24 22:07:04.514182,0 days 00:00:06.926712,36.27200047639973,0.028206346471968576,0.04269755442418389,linear,TPESampler,COMPLETE
516,0.1619119676704576,2025-04-24 22:07:04.170804,2025-04-24 22:07:14.525441,0 days 00:00:10.354637,71.95601546883628,0.0669393307448571,0.00048354846994603303,linear,TPESampler,COMPLETE
517,85.73112003414298,2025-04-24 22:07:04.702340,2025-04-24 22:07:05.227141,0 days 00:00:00.524801,97.82331543739343,0.05173797336705359,0.0036866586686911547,sigmoid,TPESampler,COMPLETE
518,0.15122959257831284,2025-04-24 22:07:05.400406,2025-04-24 22:07:07.917579,0 days 00:00:02.517173,12.13618518583123,0.038693434041847614,0.002532195330307932,linear,TPESampler,COMPLETE
519,0.1571861494306457,2025-04-24 22:07:08.088245,2025-04-24 22:07:24.578884,0 days 00:00:16.490639,91.13170496905445,0.048966405387122304,0.000939999895893409,linear,TPESampler,COMPLETE
520,0.3633736509801705,2025-04-24 22:07:14.701978,2025-04-24 22:07:15.179128,0 days 00:00:00.477150,0.10648987512396717,0.3174890994901681,0.12996223595555198,linear,TPESampler,COMPLETE
521,0.19464687681459233,2025-04-24 22:07:15.353997,2025-04-24 22:07:17.211170,0 days 00:00:01.857173,89.84088541906605,0.13329986135597383,0.0363565152660125,linear,TPESampler,COMPLETE
522,0.14983822117935738,2025-04-24 22:07:17.377489,2025-04-24 22:07:49.312110,0 days 00:00:31.934621,96.97470466567366,0.023803575085584255,0.0003388891838263594,linear,TPESampler,COMPLETE
523,0.15168186449349985,2025-04-24 22:07:25.062686,2025-04-24 22:07:33.382321,0 days 00:00:08.319635,27.228068015677778,0.018735142505825635,0.0486564514813443,linear,TPESampler,COMPLETE
524,0.15637361309170772,2025-04-24 22:07:33.576659,2025-04-24 22:07:35.991444,0 days 00:00:02.414785,9.745640364476326,0.04624280730051279,0.0028987136871111182,linear,TPESampler,COMPLETE
525,1.380247101606237,2025-04-24 22:07:36.171586,2025-04-24 22:07:36.692798,0 days 00:00:00.521212,0.0021934422728394675,0.001918682579777484,0.11647674354862647,rbf,TPESampler,COMPLETE
526,0.148922938768453,2025-04-24 22:07:36.860015,2025-04-24 22:07:47.523159,0 days 00:00:10.663144,67.85561320289032,0.03301521389081384,0.01513812522092646,linear,TPESampler,COMPLETE
527,0.15286998256302262,2025-04-24 22:07:47.983346,2025-04-24 22:08:11.318849,0 days 00:00:23.335503,74.42407616069008,0.018022687818298074,0.1468611640583491,linear,TPESampler,COMPLETE
528,0.15472206880155234,2025-04-24 22:07:49.641532,2025-04-24 22:08:20.407105,0 days 00:00:30.765573,88.79886983898508,0.012765636741742007,0.0039437848528272226,linear,TPESampler,COMPLETE
529,0.3655230877356672,2025-04-24 22:08:11.497274,2025-04-24 22:08:11.964838,0 days 00:00:00.467564,54.885016572614084,0.17657199624447906,0.023185658872189787,rbf,TPESampler,COMPLETE
530,0.1494691499254577,2025-04-24 22:08:12.130353,2025-04-24 22:08:15.621439,0 days 00:00:03.491086,13.159304692796528,0.03451758909188376,0.016192500318883783,linear,TPESampler,COMPLETE
531,0.1498960787839462,2025-04-24 22:08:15.807077,2025-04-24 22:08:34.469437,0 days 00:00:18.662360,65.58481213837094,0.021742772800930964,0.05363461170625806,linear,TPESampler,COMPLETE
532,0.14978132824576415,2025-04-24 22:08:20.679605,2025-04-24 22:08:38.248663,0 days 00:00:17.569058,84.79207717775637,0.023374894252163304,0.10366245631284857,linear,TPESampler,COMPLETE
533,0.14866959585076817,2025-04-24 22:08:34.646818,2025-04-24 22:08:48.853972,0 days 00:00:14.207154,89.9280682991504,0.03185897283789287,0.055346487531516365,linear,TPESampler,COMPLETE
534,1.4141821029145523,2025-04-24 22:08:38.429866,2025-04-24 22:08:38.934435,0 days 00:00:00.504569,0.0039689761810264785,0.13434355096104325,0.00011050014794928392,sigmoid,TPESampler,COMPLETE
535,0.1745276657548168,2025-04-24 22:08:39.110493,2025-04-24 22:08:43.565109,0 days 00:00:04.454616,73.52078719097959,0.10815727377600338,0.19282118354297897,linear,TPESampler,COMPLETE
536,0.15409625490165674,2025-04-24 22:08:43.738906,2025-04-24 22:08:56.254604,0 days 00:00:12.515698,72.21387856125727,0.04440057753717692,0.014991931603497027,linear,TPESampler,COMPLETE
537,0.5169282090113695,2025-04-24 22:08:49.030018,2025-04-24 22:08:49.887988,0 days 00:00:00.857970,63.74586082957362,0.033177788653800354,0.017005432348989588,poly,TPESampler,COMPLETE
538,0.20793589547777988,2025-04-24 22:08:50.064923,2025-04-24 22:08:50.621692,0 days 00:00:00.556769,49.331022512641404,0.01755525091401831,0.002436274685632481,rbf,TPESampler,COMPLETE
539,0.19539350623058782,2025-04-24 22:08:50.787918,2025-04-24 22:08:51.616047,0 days 00:00:00.828129,5.5984565607100345,0.11470985639248531,0.00037814892731399986,linear,TPESampler,COMPLETE
540,0.14902147313322048,2025-04-24 22:08:51.790573,2025-04-24 22:09:15.627789,0 days 00:00:23.837216,96.7238326761118,0.029177938218611376,0.012845846345947976,linear,TPESampler,COMPLETE
541,0.34131134079392783,2025-04-24 22:08:56.430260,2025-04-24 22:08:57.135802,0 days 00:00:00.705542,91.62179520947613,0.020928333054895644,0.0158840746989012,rbf,TPESampler,COMPLETE
542,0.15417628099564018,2025-04-24 22:08:57.306481,2025-04-24 22:09:25.819993,0 days 00:00:28.513512,77.2025216088461,0.014115611641972654,0.04155112154490053,linear,TPESampler,COMPLETE
543,0.15097414308956678,2025-04-24 22:09:15.804390,2025-04-24 22:09:36.400622,0 days 00:00:20.596232,96.6671986992331,0.018173720240745806,0.0007513671661335754,linear,TPESampler,COMPLETE
544,0.15800312827704094,2025-04-24 22:09:25.990228,2025-04-24 22:09:27.973917,0 days 00:00:01.983689,17.11073640743657,0.07013615318988876,0.038693813152614824,linear,TPESampler,COMPLETE
545,0.15515492776560957,2025-04-24 22:09:28.140389,2025-04-24 22:09:36.189649,0 days 00:00:08.049260,14.968407800616031,0.012080302200744497,0.017599119096884632,linear,TPESampler,COMPLETE
546,0.9117485680467733,2025-04-24 22:09:36.425249,2025-04-24 22:09:37.034162,0 days 00:00:00.608913,0.10056777208714923,0.012187964780865958,0.002293858115788216,sigmoid,TPESampler,COMPLETE
547,0.16952640294833893,2025-04-24 22:09:36.669034,2025-04-24 22:09:42.804326,0 days 00:00:06.135292,91.09558649352522,0.09327087675900854,0.04329549086455267,linear,TPESampler,COMPLETE
548,0.15756640420289877,2025-04-24 22:09:37.218417,2025-04-24 22:09:52.636892,0 days 00:00:15.418475,83.9930059866411,0.07328982903051583,0.004011156474788753,linear,TPESampler,COMPLETE
549,0.1480017067908157,2025-04-24 22:09:42.987609,2025-04-24 22:09:56.892249,0 days 00:00:13.904640,96.75182313914164,0.03340869987584597,0.09116001513110043,linear,TPESampler,COMPLETE
550,0.1568553444713052,2025-04-24 22:09:52.815920,2025-04-24 22:09:56.397320,0 days 00:00:03.581400,11.390978599077199,0.015409145005527604,0.002118731541826133,linear,TPESampler,COMPLETE
551,1.263153280945344,2025-04-24 22:09:56.573228,2025-04-24 22:09:57.128931,0 days 00:00:00.555703,0.014901339124939956,0.00233519425996415,0.004141734193976149,sigmoid,TPESampler,COMPLETE
552,0.25559161049502777,2025-04-24 22:09:57.087574,2025-04-24 22:09:59.640827,0 days 00:00:02.553253,97.81300612356422,0.2305904925013012,0.0011662556771476953,linear,TPESampler,COMPLETE
553,0.3598504887422255,2025-04-24 22:09:57.353480,2025-04-24 22:09:57.859407,0 days 00:00:00.505927,1.5880092275581605,0.3475565337630469,0.007691565394637542,linear,TPESampler,COMPLETE
554,0.1642870940799878,2025-04-24 22:09:58.027118,2025-04-24 22:10:00.271200,0 days 00:00:02.244082,17.353942024020572,0.05931108450887301,0.06716879408141563,linear,TPESampler,COMPLETE
555,0.14886056774814188,2025-04-24 22:09:59.816265,2025-04-24 22:10:14.499943,0 days 00:00:14.683678,97.20277400364003,0.03267737954210412,0.00941956309269437,linear,TPESampler,COMPLETE
556,22.40493833178309,2025-04-24 22:10:00.496435,2025-04-24 22:10:01.011407,0 days 00:00:00.514972,0.9983868678341833,0.08764141956851783,0.37350313517831935,sigmoid,TPESampler,COMPLETE
557,0.14977975073633845,2025-04-24 22:10:01.180586,2025-04-24 22:10:20.227072,0 days 00:00:19.046486,84.71816981554868,0.024072784557492368,0.044584779612700985,linear,TPESampler,COMPLETE
558,1.167779011880983,2025-04-24 22:10:14.752281,2025-04-24 22:10:15.275549,0 days 00:00:00.523268,0.027673036523272257,0.007844174009314673,0.0921470070161735,rbf,TPESampler,COMPLETE
559,0.15200890214637577,2025-04-24 22:10:15.452004,2025-04-24 22:10:18.867627,0 days 00:00:03.415623,12.613773349836473,0.025560789699620556,0.08624342858951785,linear,TPESampler,COMPLETE
560,0.15562930448232906,2025-04-24 22:10:19.043483,2025-04-24 22:10:51.504706,0 days 00:00:32.461223,85.68636321474982,0.0029226950715471683,0.0023958699185820703,linear,TPESampler,COMPLETE
561,1.875704790530291,2025-04-24 22:10:20.448255,2025-04-24 22:19:07.891749,0 days 00:08:47.443494,90.30935895317292,0.04928676513633419,0.18684362978356284,poly,TPESampler,COMPLETE
562,0.39008905458619697,2025-04-24 22:10:51.671037,2025-04-24 22:10:52.145819,0 days 00:00:00.474782,0.04165890963066112,0.3174883726041872,0.0006133128926842867,linear,TPESampler,COMPLETE
563,0.1497246390362653,2025-04-24 22:10:52.318875,2025-04-24 22:11:23.781085,0 days 00:00:31.462210,95.98000425010123,0.024007417529544176,0.05941401569157843,linear,TPESampler,COMPLETE
564,0.15421975481102076,2025-04-24 22:11:23.953426,2025-04-24 22:11:34.992996,0 days 00:00:11.039570,29.48186026070076,0.008724132891529303,0.13448999148066804,linear,TPESampler,COMPLETE
565,0.16329744884219602,2025-04-24 22:11:35.204966,2025-04-24 22:11:43.639003,0 days 00:00:08.434037,67.6021900679499,0.062453614289531834,0.09516926705911323,linear,TPESampler,COMPLETE
566,0.16838955918622006,2025-04-24 22:11:43.817394,2025-04-24 22:11:45.246675,0 days 00:00:01.429281,15.438863106972331,0.08709270939546718,0.002302929583634764,linear,TPESampler,COMPLETE
567,0.1631794710103663,2025-04-24 22:11:45.484538,2025-04-24 22:11:49.740447,0 days 00:00:04.255909,22.59784673207543,0.060601072090562993,0.19831421449928782,linear,TPESampler,COMPLETE
568,0.15436496334685212,2025-04-24 22:11:49.913844,2025-04-24 22:12:34.745259,0 days 00:00:44.831415,97.87337411565412,0.012122679405733697,0.23289496593906922,linear,TPESampler,COMPLETE
569,0.5789461004229838,2025-04-24 22:12:34.928674,2025-04-24 22:12:50.242628,0 days 00:00:15.313954,79.34821407975782,0.008615418730254532,0.031830322074755384,poly,TPESampler,COMPLETE
570,0.15975523435662892,2025-04-24 22:12:50.426039,2025-04-24 22:12:54.473653,0 days 00:00:04.047614,19.551186456455344,0.05247631289801411,0.07693808515772477,linear,TPESampler,COMPLETE
571,0.14834837501486,2025-04-24 22:12:54.721891,2025-04-24 22:13:09.550504,0 days 00:00:14.828613,64.54499132883505,0.030801022582788617,0.002077100014149719,linear,TPESampler,COMPLETE
572,0.15139173621383784,2025-04-24 22:13:09.730420,2025-04-24 22:13:15.255292,0 days 00:00:05.524872,16.824116031578356,0.020133470562464253,0.0009534245484948921,linear,TPESampler,COMPLETE
573,0.1501130766600386,2025-04-24 22:13:15.435871,2025-04-24 22:13:32.895051,0 days 00:00:17.459180,61.86199770944096,0.023651386764882806,0.0017115447145103033,linear,TPESampler,COMPLETE
574,0.14818019567617605,2025-04-24 22:13:33.074709,2025-04-24 22:13:47.453442,0 days 00:00:14.378733,75.91957259332122,0.03132750056063091,0.001682230721327357,linear,TPESampler,COMPLETE
575,0.16350338080285287,2025-04-24 22:13:47.631666,2025-04-24 22:13:49.793612,0 days 00:00:02.161946,26.352647991084655,0.08137742842629116,0.0008426238130725863,linear,TPESampler,COMPLETE
576,0.15605317467896115,2025-04-24 22:13:49.963573,2025-04-24 22:14:05.793697,0 days 00:00:15.830124,60.38565414120916,0.04666278586566036,0.0008843602302686692,linear,TPESampler,COMPLETE
577,0.7801846495780377,2025-04-24 22:14:05.977334,2025-04-24 22:14:06.515939,0 days 00:00:00.538605,74.06012291320394,0.06706854799701811,0.0010898858579644014,poly,TPESampler,COMPLETE
578,0.15398947617180417,2025-04-24 22:14:06.741348,2025-04-24 22:14:27.315919,0 days 00:00:20.574571,53.17752495444461,0.010879099998124775,0.0006258274689795339,linear,TPESampler,COMPLETE
579,0.1502725692094023,2025-04-24 22:14:27.505810,2025-04-24 22:14:46.156191,0 days 00:00:18.650381,97.00247058971517,0.03773169657167224,0.0006909504377943457,linear,TPESampler,COMPLETE
580,0.14937838240340495,2025-04-24 22:14:46.327140,2025-04-24 22:14:55.829388,0 days 00:00:09.502248,59.456217154088236,0.03620337906139011,0.0022781552411334943,linear,TPESampler,COMPLETE
581,0.15466687371831242,2025-04-24 22:14:55.997633,2025-04-24 22:15:00.826400,0 days 00:00:04.828767,20.11030093198736,0.04493758821654662,0.0023022184182455276,linear,TPESampler,COMPLETE
582,0.16062637484471176,2025-04-24 22:15:01.007541,2025-04-24 22:15:02.310979,0 days 00:00:01.303438,7.072050337894811,0.05110830812710048,0.00019480436201131846,linear,TPESampler,COMPLETE
