number,value,datetime_start,datetime_complete,duration,params_C,params_epsilon,params_gamma,params_kernel,system_attrs_auto:sampler,state
816,0.20454408010027292,2025-04-24 23:02:03.941339,2025-04-24 23:02:05.012865,0 days 00:00:01.071526,28.903771906959065,0.13561084188615696,0.0002720859998723743,linear,TPESampler,COMPLETE
817,0.1504770836289288,2025-04-24 23:02:05.183525,2025-04-24 23:02:22.879078,0 days 00:00:17.695553,97.04174205193138,0.018829994664341765,0.000868531900272807,linear,TPESampler,COMPLETE
818,0.15202767201133865,2025-04-24 23:02:23.047327,2025-04-24 23:02:42.559132,0 days 00:00:19.511805,99.5720280683665,0.04103078274833979,0.40126443133368034,linear,TPESampler,COMPLETE
819,0.15151780758923664,2025-04-24 23:02:42.737035,2025-04-24 23:02:49.441992,0 days 00:00:06.704957,19.855755423254724,0.02012413930662498,0.05373463603740568,linear,TPESampler,COMPLETE
820,0.15005346201386985,2025-04-24 23:02:49.845668,2025-04-24 23:03:09.786889,0 days 00:00:19.941221,97.30311731175716,0.027236912594231565,0.06504919779123408,linear,TPESampler,COMPLETE
821,0.161834188751056,2025-04-24 23:03:09.960442,2025-04-24 23:03:11.961299,0 days 00:00:02.000857,13.36224096553661,0.05635623624835546,0.001298047696833724,linear,TPESampler,COMPLETE
822,1.2266548724950446,2025-04-24 23:03:12.132344,2025-04-24 23:03:12.631346,0 days 00:00:00.499002,0.12389655140606935,0.04083738426784227,0.45162887356171355,rbf,TPESampler,COMPLETE
823,0.15396573739789088,2025-04-24 23:03:12.801837,2025-04-24 23:03:40.259421,0 days 00:00:27.457584,92.90778930081973,0.015251723813184554,0.9494416322334546,linear,TPESampler,COMPLETE
824,0.19516747530450115,2025-04-24 23:03:40.431702,2025-04-24 23:03:41.005662,0 days 00:00:00.573960,0.40835766916668154,0.018468758881287507,0.0006129948032120671,linear,TPESampler,COMPLETE
825,0.15069644212060931,2025-04-24 23:03:41.170381,2025-04-24 23:03:45.951851,0 days 00:00:04.781470,16.39584668781383,0.03840269165516844,0.0023949529537216933,linear,TPESampler,COMPLETE
826,0.1522440329919773,2025-04-24 23:03:46.116117,2025-04-24 23:04:16.831435,0 days 00:00:30.715318,88.13725369616886,0.015846381523985285,0.00438797688932468,linear,TPESampler,COMPLETE
827,1.4155286528971573,2025-04-24 23:04:17.003687,2025-04-24 23:04:17.617297,0 days 00:00:00.613610,0.12596565442071206,0.0820664614104078,0.000196840133747565,poly,TPESampler,COMPLETE
828,0.15644421327480604,2025-04-24 23:04:17.801579,2025-04-24 23:04:22.291508,0 days 00:00:04.489929,8.588321447079839,0.0011028617280410137,0.001547439750735637,linear,TPESampler,COMPLETE
829,0.1674383788546063,2025-04-24 23:04:22.463305,2025-04-24 23:04:24.106035,0 days 00:00:01.642730,22.240883004988362,0.08898561650658147,0.16157791677225483,linear,TPESampler,COMPLETE
830,42.7815293026068,2025-04-24 23:04:24.276738,2025-04-24 23:04:24.769535,0 days 00:00:00.492797,9.467934930127056,0.031039498414367806,0.008610633216808685,sigmoid,TPESampler,COMPLETE
831,2.0955401791347597,2025-04-24 23:04:24.929451,2025-04-24 23:04:25.428312,0 days 00:00:00.498861,0.07678993210198139,0.002188989711189843,0.12301748792217075,sigmoid,TPESampler,COMPLETE
832,0.15484310711218435,2025-04-24 23:04:25.596424,2025-04-24 23:04:33.525264,0 days 00:00:07.928840,20.343822308138297,0.011975503858700944,0.0005858301403882471,linear,TPESampler,COMPLETE
833,1.3955617250696184,2025-04-24 23:04:33.694883,2025-04-24 23:04:34.134923,0 days 00:00:00.440040,0.0034358709359014737,0.6479800713846857,0.00047217364439588886,poly,TPESampler,COMPLETE
834,0.15920434254850455,2025-04-24 23:04:34.298085,2025-04-24 23:04:35.184459,0 days 00:00:00.886374,1.665076728968848,0.014315241219642833,0.07052027499427443,linear,TPESampler,COMPLETE
835,0.15010031492884204,2025-04-24 23:04:35.350066,2025-04-24 23:04:48.499474,0 days 00:00:13.149408,63.88390668365306,0.03734939101131055,0.002249922888072304,linear,TPESampler,COMPLETE
836,0.34901575682927055,2025-04-24 23:04:48.674244,2025-04-24 23:04:49.193800,0 days 00:00:00.519556,35.565457480468446,0.03915538815463183,0.008117453018375393,poly,TPESampler,COMPLETE
837,0.3986218069806723,2025-04-24 23:04:49.372505,2025-04-24 23:04:49.868743,0 days 00:00:00.496238,0.08761117990024499,0.010912827840044152,0.03923988235736616,poly,TPESampler,COMPLETE
838,0.23639944194314547,2025-04-24 23:04:50.036029,2025-04-24 23:04:50.590708,0 days 00:00:00.554679,86.00492901741745,0.028934540130582505,0.0038215808711190295,rbf,TPESampler,COMPLETE
839,0.16262466814590215,2025-04-24 23:04:50.757750,2025-04-24 23:05:02.781641,0 days 00:00:12.023891,98.01133442943905,0.06610469684628624,0.0010956278139129649,linear,TPESampler,COMPLETE
840,0.15958611509923634,2025-04-24 23:05:02.952342,2025-04-24 23:05:04.223682,0 days 00:00:01.271340,2.4687269458909253,0.003207072399138335,0.017993362309925272,linear,TPESampler,COMPLETE
841,0.14946579790445086,2025-04-24 23:05:04.389130,2025-04-24 23:05:07.412309,0 days 00:00:03.023179,18.315367964506382,0.03198384154306959,0.20233721839341307,linear,TPESampler,COMPLETE
842,0.15121600312059627,2025-04-24 23:05:07.572919,2025-04-24 23:05:13.811075,0 days 00:00:06.238156,16.80126038091912,0.02595310948680197,0.008501052339581788,linear,TPESampler,COMPLETE
843,0.16107613311717298,2025-04-24 23:05:13.971828,2025-04-24 23:05:25.463339,0 days 00:00:11.491511,92.0797593827515,0.05490843430764781,0.14509774385311733,linear,TPESampler,COMPLETE
844,0.15860549387615577,2025-04-24 23:05:25.648792,2025-04-24 23:05:26.635325,0 days 00:00:00.986533,1.5940920528292926,0.018681788751965748,0.001776390337632408,linear,TPESampler,COMPLETE
845,0.19927057794375982,2025-04-24 23:05:26.820111,2025-04-24 23:05:29.527379,0 days 00:00:02.707268,90.42027674406502,0.13722444277769577,0.02092365272979106,linear,TPESampler,COMPLETE
846,0.15387851553209317,2025-04-24 23:05:29.932106,2025-04-24 23:06:07.152970,0 days 00:00:37.220864,86.83462799478576,0.010769417522278656,0.14043174785403567,linear,TPESampler,COMPLETE
847,0.42210998020742035,2025-04-24 23:06:07.326549,2025-04-24 23:06:07.816859,0 days 00:00:00.490310,64.58577796952618,0.03939056966087591,0.00010931441757184749,sigmoid,TPESampler,COMPLETE
848,0.15453361937142265,2025-04-24 23:06:07.994358,2025-04-24 23:06:42.349848,0 days 00:00:34.355490,92.05807280962284,0.011844673540673643,0.015443299877142349,linear,TPESampler,COMPLETE
849,0.19814854281858885,2025-04-24 23:06:42.517748,2025-04-24 23:06:43.041829,0 days 00:00:00.524081,80.0646844061943,0.026421238133140894,0.000866291292999307,rbf,TPESampler,COMPLETE
850,0.4925032739798668,2025-04-24 23:06:43.212586,2025-04-24 23:06:43.747683,0 days 00:00:00.535097,65.14875922249534,0.059599322489223096,0.06120372295745115,rbf,TPESampler,COMPLETE
851,1.3144108354480342,2025-04-24 23:06:43.923738,2025-04-24 23:06:44.407725,0 days 00:00:00.483987,7.54985370110784,0.12947361666282445,0.0019972499904916687,sigmoid,TPESampler,COMPLETE
852,0.15313852057117855,2025-04-24 23:06:44.569026,2025-04-24 23:06:50.764505,0 days 00:00:06.195479,18.87520129981968,0.016297352612849033,0.00028388086264482853,linear,TPESampler,COMPLETE
853,0.19627940437522265,2025-04-24 23:06:50.941624,2025-04-24 23:06:52.795646,0 days 00:00:01.854022,89.47061453890267,0.13453506596395168,0.002444432455757699,linear,TPESampler,COMPLETE
854,0.15685576413759422,2025-04-24 23:06:52.967514,2025-04-24 23:07:04.417506,0 days 00:00:11.449992,95.87086992438486,0.07257221768414872,0.029559170201512615,linear,TPESampler,COMPLETE
855,0.14981509540079208,2025-04-24 23:07:04.587347,2025-04-24 23:07:25.349178,0 days 00:00:20.761831,99.95541131478636,0.020945195387159464,0.0003800704672608569,linear,TPESampler,COMPLETE
856,0.15412708063144168,2025-04-24 23:07:25.521546,2025-04-24 23:07:31.636904,0 days 00:00:06.115358,14.890133191050836,0.009063701337705093,0.005838020099904791,linear,TPESampler,COMPLETE
857,0.15662089484276542,2025-04-24 23:07:31.808020,2025-04-24 23:07:46.369298,0 days 00:00:14.561278,94.52530428481167,0.05175147831060163,0.23399526639474114,linear,TPESampler,COMPLETE
858,0.1493971078529509,2025-04-24 23:07:46.857393,2025-04-24 23:07:50.820274,0 days 00:00:03.962881,16.636961098895444,0.032345847434366186,0.0009567208814414296,linear,TPESampler,COMPLETE
859,0.15011265841910834,2025-04-24 23:07:51.035482,2025-04-24 23:07:55.050377,0 days 00:00:04.014895,15.455946595128768,0.028443935915782047,0.019627742012086166,linear,TPESampler,COMPLETE
860,0.15033677608433524,2025-04-24 23:07:55.404082,2025-04-24 23:08:03.436347,0 days 00:00:08.032265,26.615768282890464,0.02208455766240919,0.04469445677963894,linear,TPESampler,COMPLETE
861,0.4451944938737582,2025-04-24 23:08:03.605357,2025-04-24 23:08:04.050583,0 days 00:00:00.445226,3.825334503205556,0.5222441655879485,0.00015556062511452398,linear,TPESampler,COMPLETE
862,0.15017219491355452,2025-04-24 23:08:04.218860,2025-04-24 23:08:10.682251,0 days 00:00:06.463391,22.15653734409357,0.02444636388231684,0.002953549224493704,linear,TPESampler,COMPLETE
863,0.1490934884024757,2025-04-24 23:08:10.848854,2025-04-24 23:08:15.923264,0 days 00:00:05.074410,19.18339875400052,0.032773770375501894,0.08684596442794411,linear,TPESampler,COMPLETE
864,0.4426664852902534,2025-04-24 23:08:16.087759,2025-04-24 23:08:16.540678,0 days 00:00:00.452919,78.96794594143496,0.4626367614003033,0.000181489030854194,linear,TPESampler,COMPLETE
865,0.15056745228169022,2025-04-24 23:08:16.715281,2025-04-24 23:08:21.388960,0 days 00:00:04.673679,24.035402203452577,0.036124566469121,0.008308757753041943,linear,TPESampler,COMPLETE
866,0.5011389016385939,2025-04-24 23:08:21.554705,2025-04-24 23:08:22.045900,0 days 00:00:00.491195,5.101214754454903,0.0043912197207767786,0.0002541148170265497,sigmoid,TPESampler,COMPLETE
867,0.15432211234705043,2025-04-24 23:08:22.212472,2025-04-24 23:08:59.572983,0 days 00:00:37.360511,95.584713221453,0.012068498305040152,0.00232983905073975,linear,TPESampler,COMPLETE
868,0.14858602416072328,2025-04-24 23:08:59.746309,2025-04-24 23:09:20.347888,0 days 00:00:20.601579,90.90608583764204,0.030154640632292912,0.21445775354168645,linear,TPESampler,COMPLETE
869,0.17221373516380886,2025-04-24 23:09:20.512630,2025-04-24 23:09:21.341146,0 days 00:00:00.828516,9.114224634572743,0.08610361152931086,0.796102585299905,linear,TPESampler,COMPLETE
870,0.1517095503503391,2025-04-24 23:09:21.508940,2025-04-24 23:09:27.737950,0 days 00:00:06.229010,21.712121805900605,0.018708975864931067,0.30777275867694015,linear,TPESampler,COMPLETE
871,0.15001451916603462,2025-04-24 23:09:27.904503,2025-04-24 23:09:40.969727,0 days 00:00:13.065224,60.62535100541579,0.025327347763733847,0.9639725266747501,linear,TPESampler,COMPLETE
872,0.15796548351141726,2025-04-24 23:09:41.134699,2025-04-24 23:09:50.856309,0 days 00:00:09.721610,88.01145445728694,0.0684074766833782,0.001213753340175083,linear,TPESampler,COMPLETE
873,0.31992167035646585,2025-04-24 23:09:51.024406,2025-04-24 23:09:51.821514,0 days 00:00:00.797108,88.00746487424543,0.3094042298186156,0.4104337597420904,linear,TPESampler,COMPLETE
874,0.1493073639619538,2025-04-24 23:09:51.993487,2025-04-24 23:09:58.099257,0 days 00:00:06.105770,25.991820742797906,0.03434023469620707,0.34041737705598607,linear,TPESampler,COMPLETE
875,0.14962207149105605,2025-04-24 23:09:58.270562,2025-04-24 23:10:12.310421,0 days 00:00:14.039859,55.40429885619048,0.02445096348082187,0.29742669057158266,linear,TPESampler,COMPLETE
876,0.4736894697820436,2025-04-24 23:10:12.485722,2025-04-24 23:10:15.731766,0 days 00:00:03.246044,2.8924537392769776,0.08298166237771569,0.08367521912214064,poly,TPESampler,COMPLETE
877,0.1641957659567416,2025-04-24 23:10:15.909499,2025-04-24 23:10:20.371686,0 days 00:00:04.462187,90.6336557212279,0.08391279966970155,0.21805665739973823,linear,TPESampler,COMPLETE
878,0.15634133852554843,2025-04-24 23:10:20.543936,2025-04-24 23:10:24.696775,0 days 00:00:04.152839,15.804240646747125,0.01417449185385394,0.43502832577330897,linear,TPESampler,COMPLETE
879,0.1488377772552102,2025-04-24 23:10:24.871934,2025-04-24 23:10:45.225829,0 days 00:00:20.353895,89.99414909792614,0.029721960848913435,0.007215423438081249,linear,TPESampler,COMPLETE
880,0.14998783249825293,2025-04-24 23:10:45.397178,2025-04-24 23:11:08.551914,0 days 00:00:23.154736,88.35847441225434,0.025611261195786664,0.0026068626265987774,linear,TPESampler,COMPLETE
881,40.170798175229955,2025-04-24 23:11:08.723171,2025-04-24 23:11:09.241293,0 days 00:00:00.518122,2.009138859789845,0.004580417602788399,0.7311246809922997,sigmoid,TPESampler,COMPLETE
882,0.15298639673728814,2025-04-24 23:11:09.425605,2025-04-24 23:11:11.793264,0 days 00:00:02.367659,14.65327828753308,0.04067983216524521,0.0008835801442295083,linear,TPESampler,COMPLETE
883,0.1502560828475463,2025-04-24 23:11:11.973948,2025-04-24 23:11:18.787847,0 days 00:00:06.813899,24.51043538434709,0.02133103416337522,0.0010175295997304457,linear,TPESampler,COMPLETE
884,92.98294344269901,2025-04-24 23:11:18.965288,2025-04-24 23:11:19.474473,0 days 00:00:00.509185,65.14983229172225,0.021812084506502332,0.004596135265749788,sigmoid,TPESampler,COMPLETE
885,0.150721820463001,2025-04-24 23:11:19.675044,2025-04-24 23:11:25.473126,0 days 00:00:05.798082,30.41439606629099,0.03694537156589088,0.20663955597051933,linear,TPESampler,COMPLETE
886,0.1506455746569529,2025-04-24 23:11:25.670709,2025-04-24 23:11:41.890406,0 days 00:00:16.219697,61.5616640915829,0.01879757731496732,0.1985457465018673,linear,TPESampler,COMPLETE
887,0.29536164612219046,2025-04-24 23:11:42.063711,2025-04-24 23:11:42.725017,0 days 00:00:00.661306,63.13353830837102,0.00779182322127214,0.006569915087697457,rbf,TPESampler,COMPLETE
888,0.5375695023267115,2025-04-24 23:11:42.897315,2025-04-24 23:12:22.074238,0 days 00:00:39.176923,20.362758005807148,0.03654824366913727,0.06860157574238931,poly,TPESampler,COMPLETE
889,0.3399816942717893,2025-04-24 23:12:22.242473,2025-04-24 23:12:22.738716,0 days 00:00:00.496243,0.03822293944122808,0.014743179879336746,0.3495691642990968,linear,TPESampler,COMPLETE
890,0.14838768774682637,2025-04-24 23:12:22.908193,2025-04-24 23:12:40.471083,0 days 00:00:17.562890,95.67654232902106,0.03073045522131247,0.0013124945034140648,linear,TPESampler,COMPLETE
891,673.5787935191477,2025-04-24 23:12:40.649825,2025-04-24 23:12:41.156177,0 days 00:00:00.506352,29.685721013177197,0.007935822854574018,0.43036551532305245,sigmoid,TPESampler,COMPLETE
892,0.3049884057107021,2025-04-24 23:12:41.411981,2025-04-24 23:12:42.186001,0 days 00:00:00.774020,1.6299296824068579,0.001469442384470507,0.008049528535258837,rbf,TPESampler,COMPLETE
893,0.15723068088905315,2025-04-24 23:12:42.493765,2025-04-24 23:12:54.452099,0 days 00:00:11.958334,77.89185656111724,0.05318189971724848,0.00020461265146825235,linear,TPESampler,COMPLETE
894,0.15554391690792946,2025-04-24 23:12:54.625286,2025-04-24 23:13:00.564449,0 days 00:00:05.939163,16.219407667360922,0.005499587034794971,0.0006993929024564739,linear,TPESampler,COMPLETE
895,0.15034439802605012,2025-04-24 23:13:00.736201,2025-04-24 23:13:19.929679,0 days 00:00:19.193478,89.9364849450925,0.019681570021038267,0.22149452078363832,linear,TPESampler,COMPLETE
896,0.17807294266564483,2025-04-24 23:13:20.110813,2025-04-24 23:13:22.425991,0 days 00:00:02.315178,54.745422349698906,0.11641316940719058,0.0004399087822435948,linear,TPESampler,COMPLETE
897,0.15275924930063606,2025-04-24 23:13:22.592562,2025-04-24 23:13:47.511886,0 days 00:00:24.919324,79.1992226431356,0.016729561514395447,0.18769985823895133,linear,TPESampler,COMPLETE
898,0.15104583516654313,2025-04-24 23:13:47.684506,2025-04-24 23:13:51.575129,0 days 00:00:03.890623,21.184956875437216,0.03871262991401926,0.0007117026665357248,linear,TPESampler,COMPLETE
899,0.1578470594604556,2025-04-24 23:13:51.735963,2025-04-24 23:13:59.432229,0 days 00:00:07.696266,82.69103687454009,0.07345832311783042,0.0007535186661635953,linear,TPESampler,COMPLETE
900,0.14843048186801372,2025-04-24 23:13:59.613595,2025-04-24 23:14:21.532789,0 days 00:00:21.919194,93.33631641253942,0.03096226892717519,0.000959515287174871,linear,TPESampler,COMPLETE
901,1.2597918632302807,2025-04-24 23:14:21.699676,2025-04-24 23:14:22.255899,0 days 00:00:00.556223,0.005339153195554912,0.004806244786035136,0.006719954009909465,poly,TPESampler,COMPLETE
902,0.14917698476238872,2025-04-24 23:14:22.431544,2025-04-24 23:14:28.306101,0 days 00:00:05.874557,29.94623756836689,0.03183407932622567,0.00024973447864689907,linear,TPESampler,COMPLETE
903,0.15186750804759347,2025-04-24 23:14:28.473978,2025-04-24 23:14:46.965007,0 days 00:00:18.491029,95.97952676028974,0.04010695805994945,0.0007267830671912984,linear,TPESampler,COMPLETE
904,0.15355233085741216,2025-04-24 23:14:47.141586,2025-04-24 23:15:38.615910,0 days 00:00:51.474324,93.1773652564137,0.010542539428415959,0.0007690206074268425,linear,TPESampler,COMPLETE
905,640.0850277537829,2025-04-24 23:15:38.794001,2025-04-24 23:15:39.293913,0 days 00:00:00.499912,31.976584508483462,0.08895718044280808,0.8396787569096137,sigmoid,TPESampler,COMPLETE
906,0.15510446469739703,2025-04-24 23:15:39.461581,2025-04-24 23:15:48.135301,0 days 00:00:08.673720,25.78496769075426,0.012974329021395567,0.0010794482967197193,linear,TPESampler,COMPLETE
907,0.7736926759049835,2025-04-24 23:15:48.309436,2025-04-24 23:15:48.802081,0 days 00:00:00.492645,0.29229394352829385,0.037717577129011276,0.00485187521676799,poly,TPESampler,COMPLETE
908,0.16046756719450136,2025-04-24 23:15:48.969356,2025-04-24 23:15:51.373057,0 days 00:00:02.403701,11.57717297462739,0.05220444864849239,0.0018562988273428816,linear,TPESampler,COMPLETE
909,0.15017539479385325,2025-04-24 23:15:51.548652,2025-04-24 23:16:00.255811,0 days 00:00:08.707159,42.56899060846163,0.027900617688232373,0.000805685712866258,linear,TPESampler,COMPLETE
910,0.1611207348483387,2025-04-24 23:16:00.432805,2025-04-24 23:16:09.964090,0 days 00:00:09.531285,95.61500975853508,0.05425805880515474,0.0031230814277118197,linear,TPESampler,COMPLETE
911,0.47597667898511764,2025-04-24 23:16:10.129989,2025-04-24 23:16:10.625534,0 days 00:00:00.495545,2.412732350362542,0.028090811518622943,0.00033269871315264087,rbf,TPESampler,COMPLETE
912,0.14938775415819008,2025-04-24 23:16:10.793339,2025-04-24 23:16:32.375714,0 days 00:00:21.582375,76.63421731740289,0.021463335302601243,0.000555547955011094,linear,TPESampler,COMPLETE
913,0.4304732330460051,2025-04-24 23:16:32.545003,2025-04-24 23:16:32.976277,0 days 00:00:00.431274,0.03304383401564558,0.5205292576013267,0.01146818399694181,linear,TPESampler,COMPLETE
914,0.15753601338529652,2025-04-24 23:16:33.143221,2025-04-24 23:16:47.247868,0 days 00:00:14.104647,97.39845006063318,0.05291558409340962,0.0031316003223605523,linear,TPESampler,COMPLETE
915,0.16451796466395302,2025-04-24 23:16:47.424233,2025-04-24 23:16:50.812213,0 days 00:00:03.387980,94.78814202072014,0.08577585172896536,0.0009753856477247024,linear,TPESampler,COMPLETE
916,0.15013410740239078,2025-04-24 23:16:50.990617,2025-04-24 23:17:03.055857,0 days 00:00:12.065240,33.939784214222236,0.0262204890246327,0.002318254659254602,linear,TPESampler,COMPLETE
917,0.15022998610942437,2025-04-24 23:17:03.222557,2025-04-24 23:17:16.158805,0 days 00:00:12.936248,36.035358408338546,0.022699950212460736,0.00011997669741848775,linear,TPESampler,COMPLETE
918,0.1540493707737083,2025-04-24 23:17:16.333106,2025-04-24 23:17:24.222133,0 days 00:00:07.889027,24.54868511367934,0.017338152406699326,0.0013518766648893663,linear,TPESampler,COMPLETE
919,0.16352295689035892,2025-04-24 23:17:24.392588,2025-04-24 23:17:34.838604,0 days 00:00:10.446016,93.55412203139893,0.061795742452460264,0.0017392568427365205,linear,TPESampler,COMPLETE
920,0.15189029498029266,2025-04-24 23:17:35.016408,2025-04-24 23:17:50.107580,0 days 00:00:15.091172,99.7872026451123,0.0405597187790631,0.0012180384519043512,linear,TPESampler,COMPLETE
921,0.5350439703483082,2025-04-24 23:17:50.340787,2025-04-24 23:18:24.842119,0 days 00:00:34.501332,0.01110956024855083,0.034350320178093946,0.8405285060538357,poly,TPESampler,COMPLETE
922,1.3110658608262669,2025-04-24 23:18:25.015217,2025-04-24 23:18:25.519144,0 days 00:00:00.503927,10.556795420468632,0.01986525773027719,0.0004684005855715645,poly,TPESampler,COMPLETE
923,0.16535281239839777,2025-04-24 23:18:25.694267,2025-04-24 23:18:27.885444,0 days 00:00:02.191177,15.053962550160515,0.06271567652537291,0.5143907612575759,linear,TPESampler,COMPLETE
924,0.15499441360632546,2025-04-24 23:18:28.058071,2025-04-24 23:18:48.228763,0 days 00:00:20.170692,67.1286309415649,0.004086234995362522,0.0009531909008177926,linear,TPESampler,COMPLETE
925,0.1503384793084849,2025-04-24 23:18:48.402927,2025-04-24 23:18:53.553107,0 days 00:00:05.150180,18.269160913472263,0.021050498647251767,0.000993101732604425,linear,TPESampler,COMPLETE
926,0.15310290379639258,2025-04-24 23:18:53.731226,2025-04-24 23:19:08.351226,0 days 00:00:14.620000,89.70884538501365,0.0431707569935584,0.42349882657581994,linear,TPESampler,COMPLETE
927,1.1688256414111975,2025-04-24 23:19:08.520100,2025-04-24 23:19:08.961295,0 days 00:00:00.441195,1.0124529421985244,0.920420412422268,0.00012603316928781608,sigmoid,TPESampler,COMPLETE
928,0.15215793298804453,2025-04-24 23:19:09.125474,2025-04-24 23:19:30.465838,0 days 00:00:21.340364,88.96520392372572,0.04183638013485048,0.0015699167054289574,linear,TPESampler,COMPLETE
929,0.14973900327249748,2025-04-24 23:19:30.645069,2025-04-24 23:19:48.462466,0 days 00:00:17.817397,87.66065268180697,0.025305973428089257,0.00020663037438322645,linear,TPESampler,COMPLETE
930,0.15022921531100916,2025-04-24 23:19:48.642838,2025-04-24 23:20:09.359503,0 days 00:00:20.716665,85.0489373206813,0.026251420662959934,0.002346554819236065,linear,TPESampler,COMPLETE
931,0.15034393876016777,2025-04-24 23:20:09.533492,2025-04-24 23:20:36.181287,0 days 00:00:26.647795,97.09766323143897,0.020167706685803546,0.0037582828084888353,linear,TPESampler,COMPLETE
