number,value,datetime_start,datetime_complete,duration,params_C,params_epsilon,params_gamma,params_kernel,system_attrs_auto:sampler,state
0,1.4140017443720314,2025-04-24 20:59:24.526329,2025-04-24 20:59:25.093427,0 days 00:00:00.567098,0.002665006551442968,0.003174415662479116,0.0002768052408637356,poly,RandomSampler,COMPLETE
1,1.4140516612424432,2025-04-24 20:59:24.539473,2025-04-24 20:59:25.019969,0 days 00:00:00.480496,0.003464924382317082,0.0257926057157229,0.0001655155909368738,poly,RandomSampler,COMPLETE
2,1.0979112794183887,2025-04-24 20:59:24.606916,2025-04-24 20:59:25.155806,0 days 00:00:00.548890,0.6813824003032415,0.6756195957603794,0.00024855004959330515,sigmoid,RandomSampler,COMPLETE
3,0.6638995408102485,2025-04-24 20:59:25.192949,2025-04-24 20:59:27.211406,0 days 00:00:02.018457,72.64701541972542,0.19435689006209084,0.29926888946607794,poly,TPESampler,COMPLETE
4,0.6038972119386444,2025-04-24 20:59:25.260948,2025-04-24 20:59:25.850089,0 days 00:00:00.589141,11.93899631547964,0.3188058869869686,0.10013793474714362,rbf,TPESampler,COMPLETE
5,1.35900884766877,2025-04-24 20:59:25.395095,2025-04-24 20:59:25.895243,0 days 00:00:00.500148,0.04956254694106734,0.5717256677786202,0.8393709098200345,rbf,TPESampler,COMPLETE
6,0.7562037575202837,2025-04-24 20:59:25.964950,2025-04-24 20:59:26.657135,0 days 00:00:00.692185,0.17665145967007334,0.0864720317752256,0.006593603670979703,poly,TPESampler,COMPLETE
7,1.3660773679053422,2025-04-24 20:59:26.013827,2025-04-24 20:59:26.736061,0 days 00:00:00.722234,0.07961781322474354,0.0016560336813108948,0.0177559431083097,sigmoid,TPESampler,COMPLETE
8,13.062779019719901,2025-04-24 20:59:26.797721,2025-04-24 20:59:27.276915,0 days 00:00:00.479194,0.7503386961291497,0.0994929886421028,0.0369423178569603,sigmoid,TPESampler,COMPLETE
9,4.972931497034285,2025-04-24 20:59:26.863752,2025-04-24 20:59:27.404983,0 days 00:00:00.541231,0.6433945083601664,0.3670421882878561,0.01320637120444505,sigmoid,TPESampler,COMPLETE
10,0.7299191471966792,2025-04-24 20:59:27.360341,2025-04-24 20:59:28.149934,0 days 00:00:00.789593,65.26683351787513,0.01443267273832715,0.3003565086411615,rbf,TPESampler,COMPLETE
11,0.40823486349294485,2025-04-24 20:59:27.440931,2025-04-24 20:59:28.130849,0 days 00:00:00.689918,15.120054200867049,0.7682656428128096,0.003738478018311723,rbf,TPESampler,COMPLETE
12,0.5331913369256097,2025-04-24 20:59:27.568684,2025-04-24 20:59:28.481878,0 days 00:00:00.913194,33.72990827079923,0.011947041527591616,0.07871413518872392,rbf,TPESampler,COMPLETE
13,0.37830077222766856,2025-04-24 20:59:28.279445,2025-04-24 20:59:28.971038,0 days 00:00:00.691593,47.259047499135924,0.5239106815566232,0.0008365141097201112,rbf,TPESampler,COMPLETE
14,0.38253501619522606,2025-04-24 20:59:28.328113,2025-04-24 20:59:29.114338,0 days 00:00:00.786225,10.378899187556504,0.48973286033981855,0.0012611591415246527,rbf,TPESampler,COMPLETE
15,0.3780047404837218,2025-04-24 20:59:28.836870,2025-04-24 20:59:29.472307,0 days 00:00:00.635437,38.592647785158555,0.10960102246523865,0.00013051062016456225,rbf,TPESampler,COMPLETE
16,0.46190190196748443,2025-04-24 20:59:29.220773,2025-04-24 20:59:29.916572,0 days 00:00:00.695799,7.426492737963885,0.07735994584113257,0.0001342989568565181,rbf,TPESampler,COMPLETE
17,0.4079694280060819,2025-04-24 20:59:29.319802,2025-04-24 20:59:30.060156,0 days 00:00:00.740354,5.673440682819915,0.030157341721843648,0.00037657304140501034,rbf,TPESampler,COMPLETE
18,1.395451411452836,2025-04-24 20:59:29.671077,2025-04-24 20:59:30.513301,0 days 00:00:00.842224,14.385626724997692,0.0028069229064367316,0.00023645770768201206,poly,TPESampler,COMPLETE
19,1.3612456059962148,2025-04-24 20:59:30.184987,2025-04-24 20:59:31.008964,0 days 00:00:00.823977,8.160047966035377,0.5024429778707901,0.000367780881731403,poly,TPESampler,COMPLETE
20,1.4066977483518874,2025-04-24 20:59:30.389678,2025-04-24 20:59:31.223414,0 days 00:00:00.833736,30.23826418521529,0.223157363261537,0.00011603872143982305,poly,TPESampler,COMPLETE
21,0.2525223391681855,2025-04-24 20:59:30.834913,2025-04-24 20:59:33.639655,0 days 00:00:02.804742,74.93781708279712,0.2265388148905807,0.001167468166734954,linear,TPESampler,COMPLETE
22,0.503983808883986,2025-04-24 20:59:31.269201,2025-04-24 20:59:31.909607,0 days 00:00:00.640406,41.42707049054917,0.852674934274234,0.0001551594901367578,rbf,TPESampler,COMPLETE
23,0.33482603814094913,2025-04-24 20:59:31.458071,2025-04-24 20:59:32.054238,0 days 00:00:00.596167,65.07445087996261,0.22679786236047975,0.00025176462080805755,rbf,TPESampler,COMPLETE
24,1.2660584037259857,2025-04-24 20:59:32.102083,2025-04-24 20:59:32.596151,0 days 00:00:00.494068,43.56658348654418,0.39955650993562486,0.0011712043913533422,sigmoid,TPESampler,COMPLETE
25,0.3331493277241657,2025-04-24 20:59:32.290652,2025-04-24 20:59:32.829593,0 days 00:00:00.538941,47.7561052163645,0.1337088604051966,0.000224874985278592,rbf,TPESampler,COMPLETE
26,0.4226245362186158,2025-04-24 20:59:32.785294,2025-04-24 20:59:33.270494,0 days 00:00:00.485200,34.36792757778461,0.034538619024642225,0.00019760984273063992,sigmoid,TPESampler,COMPLETE
27,0.1916098667182807,2025-04-24 20:59:33.073276,2025-04-24 20:59:33.745899,0 days 00:00:00.672623,3.6068784208892932,0.101971751344815,0.0001683128729405052,linear,TPESampler,COMPLETE
28,0.14872553803067323,2025-04-24 20:59:33.457958,2025-04-24 20:59:47.497913,0 days 00:00:14.039955,95.6472378148736,0.03470840260364074,0.008640163367389955,linear,TPESampler,COMPLETE
29,0.24944366388364853,2025-04-24 20:59:33.836625,2025-04-24 20:59:34.466130,0 days 00:00:00.629505,0.20645233117131553,0.04771917886141974,0.00017626671012856225,linear,TPESampler,COMPLETE
30,0.20549323030288688,2025-04-24 20:59:33.910896,2025-04-24 20:59:34.589283,0 days 00:00:00.678387,3.1025898227076554,0.12058100580829531,0.002451230515234252,linear,TPESampler,COMPLETE
31,0.28407718809739363,2025-04-24 20:59:34.607624,2025-04-24 20:59:35.076031,0 days 00:00:00.468407,0.16668373673175405,0.08588801593917991,0.0008406870103716236,linear,TPESampler,COMPLETE
32,0.2043276255683916,2025-04-24 20:59:34.779104,2025-04-24 20:59:35.441851,0 days 00:00:00.662747,0.38606641272680725,0.0033589611969169117,0.00010796905953255198,linear,TPESampler,COMPLETE
33,0.18319441295540753,2025-04-24 20:59:35.263418,2025-04-24 20:59:35.954832,0 days 00:00:00.691414,0.55283750652777,0.002756473528849865,0.0003263385167425331,linear,TPESampler,COMPLETE
34,0.15957381289987563,2025-04-24 20:59:35.639595,2025-04-24 20:59:36.393133,0 days 00:00:00.753538,1.416985729506559,0.02685567627740251,0.000161185255444878,linear,TPESampler,COMPLETE
35,0.21696827630129226,2025-04-24 20:59:36.135606,2025-04-24 20:59:36.738355,0 days 00:00:00.602749,0.3237214095746973,0.0033438958472581056,0.000378292516515751,linear,TPESampler,COMPLETE
36,0.15677142580603193,2025-04-24 20:59:36.555758,2025-04-24 20:59:41.428713,0 days 00:00:04.872955,10.009242024300523,0.0016139147937660682,0.00010247416622435857,linear,TPESampler,COMPLETE
37,0.6396061441815731,2025-04-24 20:59:36.937785,2025-04-24 20:59:37.426782,0 days 00:00:00.488997,1.6639714572518205,0.003481957645852147,0.00016506848458705986,rbf,TPESampler,COMPLETE
38,1.3604968033973193,2025-04-24 20:59:37.587769,2025-04-24 20:59:38.092763,0 days 00:00:00.504994,0.06645992760440181,0.0014403030198586895,0.0002611933634087771,sigmoid,TPESampler,COMPLETE
39,1.4151632454118537,2025-04-24 20:59:38.253815,2025-04-24 20:59:38.762314,0 days 00:00:00.508499,0.06380874382411839,0.00794773070900974,0.00033755477841715127,poly,TPESampler,COMPLETE
40,0.15575799252319208,2025-04-24 20:59:38.923034,2025-04-24 20:59:39.963353,0 days 00:00:01.040319,3.058880569069616,0.03408384953837738,0.0003564757358846761,linear,TPESampler,COMPLETE
41,0.156437403225014,2025-04-24 20:59:40.126216,2025-04-24 20:59:44.976398,0 days 00:00:04.850182,9.493645467502855,0.012039842938270488,0.0005846219840317127,linear,TPESampler,COMPLETE
42,0.5447416751029129,2025-04-24 20:59:41.592642,2025-04-24 20:59:42.083154,0 days 00:00:00.490512,4.645903220291398,0.0013383618633515976,0.00017606705283164186,sigmoid,TPESampler,COMPLETE
43,0.1557497472540479,2025-04-24 20:59:42.254192,2025-04-24 21:00:15.103118,0 days 00:00:32.848926,82.46183996458116,0.0018569987667548706,0.00042506292800760363,linear,TPESampler,COMPLETE
44,0.15450079868506209,2025-04-24 20:59:45.147986,2025-04-24 20:59:50.036401,0 days 00:00:04.888415,9.285517066292027,0.008545236988962215,0.00010848929566591887,linear,TPESampler,COMPLETE
45,0.150147100658052,2025-04-24 20:59:47.656962,2025-04-24 20:59:59.368796,0 days 00:00:11.711834,43.31520625148377,0.025957857609049312,0.01815818394200885,linear,TPESampler,COMPLETE
46,0.15268755799459788,2025-04-24 20:59:50.196352,2025-04-24 20:59:55.236900,0 days 00:00:05.040548,14.989774734751569,0.018148118317890413,0.002399459289817289,linear,TPESampler,COMPLETE
47,0.15153846861451162,2025-04-24 20:59:55.402228,2025-04-24 21:00:05.189525,0 days 00:00:09.787297,38.00274876077554,0.019550512193447653,0.0003746443509596576,linear,TPESampler,COMPLETE
48,0.14882946198961283,2025-04-24 20:59:59.533604,2025-04-24 21:00:07.810170,0 days 00:00:08.276566,27.314567725528757,0.030683851498333383,0.013377315979425078,linear,TPESampler,COMPLETE
49,103.69228121139793,2025-04-24 21:00:05.354492,2025-04-24 21:00:05.895374,0 days 00:00:00.540882,9.33563695340017,0.016047639912679133,0.018911184285203095,sigmoid,TPESampler,COMPLETE
50,0.6261089931662169,2025-04-24 21:00:06.301222,2025-04-24 21:00:07.023200,0 days 00:00:00.721978,12.168618185503842,0.016086569984073158,0.004917191780119746,poly,TPESampler,COMPLETE
51,0.14905293637464317,2025-04-24 21:00:07.192544,2025-04-24 21:00:19.071944,0 days 00:00:11.879400,47.738454585502254,0.0347636181569758,0.2965685222160153,linear,TPESampler,COMPLETE
52,0.15453632179087,2025-04-24 21:00:07.975153,2025-04-24 21:00:15.616529,0 days 00:00:07.641376,19.435560045993217,0.015164865740093037,0.011630638611335802,linear,TPESampler,COMPLETE
53,0.14989855152969064,2025-04-24 21:00:15.347545,2025-04-24 21:00:28.265845,0 days 00:00:12.918300,71.08925140890273,0.027443824269551078,0.004133418560795141,linear,TPESampler,COMPLETE
54,0.15001658583728786,2025-04-24 21:00:15.802251,2025-04-24 21:00:33.374480,0 days 00:00:17.572229,72.73148272434925,0.021966252596611842,0.00011629146380845533,linear,TPESampler,COMPLETE
55,0.15784973562328006,2025-04-24 21:00:19.236287,2025-04-24 21:00:24.812572,0 days 00:00:05.576285,42.880591300767904,0.06949087889815476,0.38225044063350344,linear,TPESampler,COMPLETE
56,0.16051722140861271,2025-04-24 21:00:25.000514,2025-04-24 21:00:26.322393,0 days 00:00:01.321879,1.959060303640012,0.0052081249388860815,0.08253629353788056,linear,TPESampler,COMPLETE
57,0.2079955578507933,2025-04-24 21:00:26.524009,2025-04-24 21:00:28.314660,0 days 00:00:01.790651,75.00607594016752,0.14944424698843675,0.020172556917461795,linear,TPESampler,COMPLETE
58,0.15449374649929,2025-04-24 21:00:28.387262,2025-04-24 21:00:51.984684,0 days 00:00:23.597422,66.28331840164174,0.01190439769681498,0.026137324253566623,linear,TPESampler,COMPLETE
59,0.15337906453905753,2025-04-24 21:00:28.455957,2025-04-24 21:00:59.421079,0 days 00:00:30.965122,90.99557712873744,0.01432389898986138,0.010375579684869669,linear,TPESampler,COMPLETE
60,0.15528189374005444,2025-04-24 21:00:33.577815,2025-04-24 21:00:47.853441,0 days 00:00:14.275626,30.44650571843287,0.005509079797796117,0.6563131732842078,linear,TPESampler,COMPLETE
61,3.3512677176356545,2025-04-24 21:00:48.037722,2025-04-24 21:17:29.913731,0 days 00:16:41.876009,14.078488497587488,0.020123449986564672,0.5211436628134212,poly,TPESampler,COMPLETE
62,209.51936020698454,2025-04-24 21:00:52.167679,2025-04-24 21:00:52.688777,0 days 00:00:00.521098,63.36805247334611,0.06895824260761095,0.007149867608007836,sigmoid,TPESampler,COMPLETE
63,0.15751495887301956,2025-04-24 21:00:52.873931,2025-04-24 21:01:09.488969,0 days 00:00:16.615038,93.33701406802045,0.048685243382235066,0.0001025302287667282,linear,TPESampler,COMPLETE
64,0.20171385054501503,2025-04-24 21:00:59.593672,2025-04-24 21:01:00.243437,0 days 00:00:00.649765,85.12677515815454,0.010127896361829454,0.002077501385739083,rbf,TPESampler,COMPLETE
65,0.15688815266215012,2025-04-24 21:01:00.433822,2025-04-24 21:01:01.723131,0 days 00:00:01.289309,2.5810641471052125,0.034818582854872125,0.06900751740071485,linear,TPESampler,COMPLETE
66,126.52791413215658,2025-04-24 21:01:01.908492,2025-04-24 21:01:02.448920,0 days 00:00:00.540428,7.05238391309654,0.17071985845761908,0.7415645031670225,sigmoid,TPESampler,COMPLETE
67,0.9155481130359978,2025-04-24 21:01:02.627576,2025-04-24 21:01:03.165323,0 days 00:00:00.537747,83.18778955050284,0.015012485295902173,0.0004198031292204257,poly,TPESampler,COMPLETE
68,1.5795843136184122,2025-04-24 21:01:03.349846,2025-04-24 21:01:03.865067,0 days 00:00:00.515221,0.03632459100242835,0.03351556574581712,0.38872869485053063,sigmoid,TPESampler,COMPLETE
69,0.15988829134730964,2025-04-24 21:01:04.072961,2025-04-24 21:01:08.035298,0 days 00:00:03.962337,20.153887486899325,0.05175859304210523,0.01339846026293706,linear,TPESampler,COMPLETE
70,1.4029754157956007,2025-04-24 21:01:08.232430,2025-04-24 21:01:08.770344,0 days 00:00:00.537914,0.001086018956901452,0.2625338775389934,0.8347396450212058,sigmoid,TPESampler,COMPLETE
71,0.15750893264324073,2025-04-24 21:01:08.952309,2025-04-24 21:01:19.475846,0 days 00:00:10.523537,89.76613675405513,0.050291905320351146,0.001329008006383633,linear,TPESampler,COMPLETE
72,0.1494219451657673,2025-04-24 21:01:09.674719,2025-04-24 21:01:32.835108,0 days 00:00:23.160389,80.36714632568281,0.021838157076857947,0.0008710442234794168,linear,TPESampler,COMPLETE
73,0.15214677177785713,2025-04-24 21:01:19.687005,2025-04-24 21:01:22.351828,0 days 00:00:02.664823,9.196763279441743,0.0377238367420452,0.0023077637077425404,linear,TPESampler,COMPLETE
74,1.370439108803623,2025-04-24 21:01:22.543390,2025-04-24 21:01:23.085062,0 days 00:00:00.541672,0.0026958266083408912,0.009451977645953989,0.004511129256979375,rbf,TPESampler,COMPLETE
75,0.6938675479986955,2025-04-24 21:01:23.266820,2025-04-24 21:01:23.819912,0 days 00:00:00.553092,0.47128905382647557,0.0011869297938494289,0.054582731779474404,rbf,TPESampler,COMPLETE
76,0.16155418317157352,2025-04-24 21:01:23.996392,2025-04-24 21:01:25.258961,0 days 00:00:01.262569,2.6487661148120862,0.04476536558009012,0.003959771793237493,linear,TPESampler,COMPLETE
77,0.5499446426054099,2025-04-24 21:01:25.462442,2025-04-24 21:01:25.962428,0 days 00:00:00.499986,0.001129347077141516,0.3294252142133903,0.0009717592587176641,linear,TPESampler,COMPLETE
78,0.34984266263640723,2025-04-24 21:01:26.154399,2025-04-24 21:01:26.743665,0 days 00:00:00.589266,50.569321152885706,0.06580281152400276,0.009123650298393675,poly,TPESampler,COMPLETE
79,0.27547516292308105,2025-04-24 21:01:26.932991,2025-04-24 21:01:27.637492,0 days 00:00:00.704501,6.47180424791229,0.04630105297333386,0.010678463681592096,rbf,TPESampler,COMPLETE
80,0.14961736923774163,2025-04-24 21:01:27.812037,2025-04-24 21:01:30.615039,0 days 00:00:02.803002,12.660239641852229,0.03255111799468943,0.11909371851701873,linear,TPESampler,COMPLETE
81,0.38014003659832374,2025-04-24 21:01:30.828078,2025-04-24 21:01:31.410003,0 days 00:00:00.581925,0.017085969786141814,0.0016510840270868422,0.3091261066193809,linear,TPESampler,COMPLETE
82,0.8912931389649926,2025-04-24 21:01:31.593124,2025-04-24 21:01:32.079558,0 days 00:00:00.486434,0.024231950711136176,0.6115592964594259,0.006858046264571836,poly,TPESampler,COMPLETE
83,0.1551868143210564,2025-04-24 21:01:32.263083,2025-04-24 21:01:44.078465,0 days 00:00:11.815382,28.950232122753302,0.012978074698665567,0.1655419635972795,linear,TPESampler,COMPLETE
84,0.9502783187636441,2025-04-24 21:01:33.017418,2025-04-24 21:01:33.569706,0 days 00:00:00.552288,5.5889187020266045,0.05664068355282539,0.7836636174222684,rbf,TPESampler,COMPLETE
85,0.15093114584351794,2025-04-24 21:01:33.745250,2025-04-24 21:01:57.938105,0 days 00:00:24.192855,99.83328482214834,0.01831956184210898,0.0003344763072199801,linear,TPESampler,COMPLETE
86,0.1522202328697272,2025-04-24 21:01:44.325674,2025-04-24 21:02:07.599428,0 days 00:00:23.273754,95.79374356126785,0.04178022597038076,0.0471762534640395,linear,TPESampler,COMPLETE
87,0.15337210783206712,2025-04-24 21:01:58.146105,2025-04-24 21:02:11.770575,0 days 00:00:13.624470,77.42777813049229,0.04330337326472518,0.00043565738462988566,linear,TPESampler,COMPLETE
88,0.15381936372420676,2025-04-24 21:02:07.782169,2025-04-24 21:02:27.933917,0 days 00:00:20.151748,64.46167843732732,0.016114380003651577,0.0004091861150423205,linear,TPESampler,COMPLETE
89,0.15464735038723565,2025-04-24 21:02:11.953531,2025-04-24 21:02:45.617040,0 days 00:00:33.663509,78.14788792943364,0.012698502618967421,0.0013077496038309288,linear,TPESampler,COMPLETE
90,0.1507752128548056,2025-04-24 21:02:28.116882,2025-04-24 21:02:43.972402,0 days 00:00:15.855520,84.5986530450487,0.03853053935250561,0.6973418531244177,linear,TPESampler,COMPLETE
91,0.15745812768634274,2025-04-24 21:02:44.155284,2025-04-24 21:02:45.857898,0 days 00:00:01.702614,5.917552861169774,0.04391472460387637,0.5212115099166901,linear,TPESampler,COMPLETE
92,0.1499463707192775,2025-04-24 21:02:45.807170,2025-04-24 21:02:51.520693,0 days 00:00:05.713523,29.910485462821413,0.028181857012639266,0.3064995206781679,linear,TPESampler,COMPLETE
93,0.1524601695941003,2025-04-24 21:02:46.117237,2025-04-24 21:02:54.303229,0 days 00:00:08.185992,34.600947993770355,0.04235700090648549,0.034618615302724275,linear,TPESampler,COMPLETE
94,0.16545386268095155,2025-04-24 21:02:51.973218,2025-04-24 21:02:54.299681,0 days 00:00:02.326463,33.44354709430269,0.0880997816460687,0.4967139383902384,linear,TPESampler,COMPLETE
95,0.14925839995333462,2025-04-24 21:02:54.558305,2025-04-24 21:02:58.238162,0 days 00:00:03.679857,14.76795262532768,0.03463854135093643,0.7771496222452045,linear,TPESampler,COMPLETE
96,0.1507668050420814,2025-04-24 21:02:54.637194,2025-04-24 21:03:00.651720,0 days 00:00:06.014526,16.00926496658181,0.024513362434819337,0.04045659761443766,linear,TPESampler,COMPLETE
97,428.1791933156456,2025-04-24 21:02:58.426268,2025-04-24 21:02:59.267815,0 days 00:00:00.841547,19.212507654276795,0.03303848283604872,0.2881451406469628,sigmoid,TPESampler,COMPLETE
98,0.549726402371074,2025-04-24 21:02:59.503874,2025-04-24 21:04:39.414919,0 days 00:01:39.911045,55.56136346197545,0.01395790705121654,0.05132394602327312,poly,TPESampler,COMPLETE
99,0.20863707955992153,2025-04-24 21:03:00.840466,2025-04-24 21:03:01.727412,0 days 00:00:00.886946,0.7168021367521811,0.08960702064506948,0.6266462198979098,linear,TPESampler,COMPLETE
100,0.15327797259947878,2025-04-24 21:03:01.912096,2025-04-24 21:03:04.133909,0 days 00:00:02.221813,6.878038969554401,0.02001725783405435,0.34772307291399707,linear,TPESampler,COMPLETE
101,0.16298235315828863,2025-04-24 21:03:04.309066,2025-04-24 21:03:10.525802,0 days 00:00:06.216736,37.78912074191395,0.05936877889716899,0.006328808700397154,linear,TPESampler,COMPLETE
102,0.1499980793452004,2025-04-24 21:03:10.711007,2025-04-24 21:03:38.450870,0 days 00:00:27.739863,93.138896308608,0.02170326730290212,0.004202260773177426,linear,TPESampler,COMPLETE
103,0.5331571469469851,2025-04-24 21:03:38.630045,2025-04-24 21:03:39.136777,0 days 00:00:00.506732,45.07227828055084,0.09039739290173629,0.07692265443731022,rbf,TPESampler,COMPLETE
104,0.16475538771026374,2025-04-24 21:03:39.317708,2025-04-24 21:03:44.093328,0 days 00:00:04.775620,94.00624264076505,0.08651726910002208,0.005080128974833391,linear,TPESampler,COMPLETE
105,50.084673700717005,2025-04-24 21:03:44.313075,2025-04-24 21:03:44.836703,0 days 00:00:00.523628,63.5236783009697,0.015538214205580164,0.0035261259894261506,sigmoid,TPESampler,COMPLETE
106,0.1556659304135539,2025-04-24 21:03:45.023900,2025-04-24 21:03:52.100600,0 days 00:00:07.076700,23.328008231897368,0.0026639536514486994,0.012574464433876146,linear,TPESampler,COMPLETE
107,0.1492799198474689,2025-04-24 21:03:52.271964,2025-04-24 21:03:57.265303,0 days 00:00:04.993339,28.27584493517134,0.03433800948531758,0.19244001906551386,linear,TPESampler,COMPLETE
108,0.5153535220408662,2025-04-24 21:03:57.693782,2025-04-24 21:05:10.026754,0 days 00:01:12.332972,10.927011343522615,0.10719688189727827,0.13506520452901552,poly,TPESampler,COMPLETE
109,0.15221825952600065,2025-04-24 21:04:39.603343,2025-04-24 21:04:41.852245,0 days 00:00:02.248902,7.429737842619313,0.029959978963192094,0.10750228215804053,linear,TPESampler,COMPLETE
110,0.15456915323691303,2025-04-24 21:04:42.037187,2025-04-24 21:05:18.684713,0 days 00:00:36.647526,90.67318977738461,0.012308627950519773,0.16132929949450509,linear,TPESampler,COMPLETE
111,0.15026751358419194,2025-04-24 21:05:10.211981,2025-04-24 21:05:14.392387,0 days 00:00:04.180406,17.071536306715025,0.021694337942386236,0.6628706446264245,linear,TPESampler,COMPLETE
112,0.14971283477946232,2025-04-24 21:05:14.674027,2025-04-24 21:05:35.250186,0 days 00:00:20.576159,74.51369880216964,0.024048838652244133,0.0018956607480346687,linear,TPESampler,COMPLETE
113,1.379487417047992,2025-04-24 21:05:18.858970,2025-04-24 21:05:19.357761,0 days 00:00:00.498791,0.024900321884177724,0.6295047533386564,0.0002802521867680785,sigmoid,TPESampler,COMPLETE
114,0.1485284937573482,2025-04-24 21:05:19.633085,2025-04-24 21:05:32.837576,0 days 00:00:13.204491,77.35259063575566,0.03297632585897073,0.01606625699079841,linear,TPESampler,COMPLETE
115,0.15111818589778583,2025-04-24 21:05:33.026501,2025-04-24 21:06:03.415093,0 days 00:00:30.388592,90.61257632555377,0.017829233888092034,0.0047745299834838035,linear,TPESampler,COMPLETE
