number,value,datetime_start,datetime_complete,duration,params_C,params_epsilon,params_gamma,params_kernel,system_attrs_auto:sampler,state
1163,0.21269120886242132,2025-04-24 23:41:22.073395,2025-04-24 23:41:22.920091,0 days 00:00:00.846696,12.725872123870321,0.14513041831781084,0.009728522681049479,linear,TPESampler,COMPLETE
1164,0.14912316324793692,2025-04-24 23:41:22.682928,2025-04-24 23:41:26.442215,0 days 00:00:03.759287,17.899764870010504,0.03377329681523279,0.000808097212476106,linear,TPESampler,COMPLETE
1165,0.15316744730338822,2025-04-24 23:41:23.189387,2025-04-24 23:42:00.998210,0 days 00:00:37.808823,88.61742437171054,0.009702968248482925,0.0037285746683526433,linear,TPESampler,COMPLETE
1166,0.1547848150839052,2025-04-24 23:41:26.621364,2025-04-24 23:41:31.235999,0 days 00:00:04.614635,17.42313731678621,0.01565863274857708,0.005731704577067184,linear,TPESampler,COMPLETE
1167,0.17327506322069547,2025-04-24 23:41:31.404064,2025-04-24 23:41:34.732944,0 days 00:00:03.328880,92.86637934216668,0.10525254296642422,0.006283126786854991,linear,TPESampler,COMPLETE
1168,0.15291261883788584,2025-04-24 23:41:34.916537,2025-04-24 23:41:41.417210,0 days 00:00:06.500673,21.120786811255943,0.018221100115759205,0.0025546159223456917,linear,TPESampler,COMPLETE
1169,0.15204719151272306,2025-04-24 23:41:38.304384,2025-04-24 23:41:58.587863,0 days 00:00:20.283479,92.4888416813909,0.041551264536938,0.0016976005783130546,linear,TPESampler,COMPLETE
1170,0.16066501681743192,2025-04-24 23:41:41.589307,2025-04-24 23:41:45.246754,0 days 00:00:03.657447,92.98217398834183,0.07900706121791326,0.0021574689178777795,linear,TPESampler,COMPLETE
1171,0.15235065934850164,2025-04-24 23:41:45.417216,2025-04-24 23:41:48.919812,0 days 00:00:03.502596,16.336884558129412,0.04177630055973841,0.0034685702835228777,linear,TPESampler,COMPLETE
1172,0.14855890133607522,2025-04-24 23:41:49.086161,2025-04-24 23:42:06.506377,0 days 00:00:17.420216,92.62018499015957,0.030105423846386797,0.0005824514461569511,linear,TPESampler,COMPLETE
1173,0.14948290533909545,2025-04-24 23:41:58.755321,2025-04-24 23:42:01.860782,0 days 00:00:03.105461,14.30981568308535,0.03245461636276038,0.011564947341505922,linear,TPESampler,COMPLETE
1174,1.337866419167732,2025-04-24 23:42:01.169378,2025-04-24 23:42:01.651111,0 days 00:00:00.481733,97.60041577208534,0.0942029152771123,0.0008280723014010774,sigmoid,TPESampler,COMPLETE
1175,0.1558284774929144,2025-04-24 23:42:01.823395,2025-04-24 23:42:26.453140,0 days 00:00:24.629745,93.5153235078921,0.04631053125201164,0.0029003373491728423,linear,TPESampler,COMPLETE
1176,0.15101286375086337,2025-04-24 23:42:02.062990,2025-04-24 23:42:06.721736,0 days 00:00:04.658746,22.53256946671919,0.03880835054366508,0.00046543919936801906,linear,TPESampler,COMPLETE
1177,1.126671671287964,2025-04-24 23:42:06.675999,2025-04-24 23:42:07.057121,0 days 00:00:00.381122,0.14721974508547994,0.6830516003065271,0.012529320321740551,sigmoid,TPESampler,COMPLETE
1178,0.1512584416979548,2025-04-24 23:42:06.932816,2025-04-24 23:42:11.810948,0 days 00:00:04.878132,24.64433772117993,0.039117508328628633,0.010809424321040597,linear,TPESampler,COMPLETE
1179,0.15196262715944572,2025-04-24 23:42:07.267419,2025-04-24 23:42:30.405630,0 days 00:00:23.138211,98.41909937216887,0.01629141255885028,0.001565829973051635,linear,TPESampler,COMPLETE
1180,0.15356488050835387,2025-04-24 23:42:11.987154,2025-04-24 23:42:17.679146,0 days 00:00:05.691992,20.035482041191244,0.01750556736221468,0.0025659284580974895,linear,TPESampler,COMPLETE
1181,0.18164541772533177,2025-04-24 23:42:17.856694,2025-04-24 23:42:19.466418,0 days 00:00:01.609724,21.500560288034272,0.10905416476462873,0.002882694685491494,linear,TPESampler,COMPLETE
1182,0.3944173155196779,2025-04-24 23:42:19.646652,2025-04-24 23:42:20.144773,0 days 00:00:00.498121,75.09308803440283,0.02805806783320009,0.0004106946887657446,sigmoid,TPESampler,COMPLETE
1183,0.3263211260398119,2025-04-24 23:42:20.319105,2025-04-24 23:42:20.806341,0 days 00:00:00.487236,0.06627019224960512,0.11471668404083832,0.02077054882650444,linear,TPESampler,COMPLETE
1184,0.15100014851300797,2025-04-24 23:42:21.105271,2025-04-24 23:42:36.094711,0 days 00:00:14.989440,98.65490351875978,0.038590630246707947,0.022089301153867272,linear,TPESampler,COMPLETE
1185,0.1498400898750771,2025-04-24 23:42:26.623419,2025-04-24 23:42:53.270363,0 days 00:00:26.646944,96.68335401449946,0.024110637175350263,0.0037427024974181584,linear,TPESampler,COMPLETE
1186,1.413943300496524,2025-04-24 23:42:30.578357,2025-04-24 23:42:31.050450,0 days 00:00:00.472093,1.032727463486419,0.0041137997800373615,0.00012438986862762773,poly,TPESampler,COMPLETE
1187,0.1499908489230044,2025-04-24 23:42:31.213850,2025-04-24 23:43:08.638088,0 days 00:00:37.424238,97.60006951271961,0.025695199529728277,0.0007948065119263335,linear,TPESampler,COMPLETE
1188,0.15860699399846537,2025-04-24 23:42:36.266457,2025-04-24 23:42:37.222094,0 days 00:00:00.955637,1.668804390663667,0.020911946592937266,0.6683064530449979,linear,TPESampler,COMPLETE
1189,0.15208831368507936,2025-04-24 23:42:37.391131,2025-04-24 23:42:57.766489,0 days 00:00:20.375358,97.95949247107315,0.041272115795057567,0.0017788770798969895,linear,TPESampler,COMPLETE
1190,1.0399690386332499,2025-04-24 23:42:53.596740,2025-04-24 23:42:54.296472,0 days 00:00:00.699732,89.21463482503484,0.03001243683313123,0.0003611246128388324,poly,TPESampler,COMPLETE
1191,0.15379062082829476,2025-04-24 23:42:54.486481,2025-04-24 23:43:20.896857,0 days 00:00:26.410376,94.4880650966115,0.015180864880129236,0.009495913493342034,linear,TPESampler,COMPLETE
1192,0.1792041746510632,2025-04-24 23:42:58.013565,2025-04-24 23:43:02.252243,0 days 00:00:04.238678,30.97489565013008,0.11441214121387695,0.0006928264371285317,linear,TPESampler,COMPLETE
1193,0.31140152281866423,2025-04-24 23:43:02.429020,2025-04-24 23:43:02.950065,0 days 00:00:00.521045,24.66856937179527,0.04723047171194646,0.010812226396952436,rbf,TPESampler,COMPLETE
1194,0.14983955049741027,2025-04-24 23:43:03.116840,2025-04-24 23:43:26.566838,0 days 00:00:23.449998,94.69966349026042,0.02206853587564366,0.004793967938979798,linear,TPESampler,COMPLETE
1195,0.15959115440489008,2025-04-24 23:43:08.811395,2025-04-24 23:43:24.086993,0 days 00:00:15.275598,99.03628632703631,0.05362693071713225,0.006525390664538528,linear,TPESampler,COMPLETE
1196,0.16385309636748238,2025-04-24 23:43:21.138541,2025-04-24 23:43:25.448893,0 days 00:00:04.310352,99.90740618222436,0.0838561261681609,0.000746121870880263,linear,TPESampler,COMPLETE
1197,45.874876405997824,2025-04-24 23:43:24.258989,2025-04-24 23:43:24.761541,0 days 00:00:00.502552,64.69976860343134,0.057162036585777606,0.003375284628339532,sigmoid,TPESampler,COMPLETE
1198,0.15321727890376996,2025-04-24 23:43:24.934245,2025-04-24 23:43:29.605803,0 days 00:00:04.671558,16.20659027036619,0.017689951733209107,0.001192592842221415,linear,TPESampler,COMPLETE
1199,0.29346851639676913,2025-04-24 23:43:25.614556,2025-04-24 23:43:26.085259,0 days 00:00:00.470703,19.996604808813366,0.09556254769196654,0.0007414423123609015,rbf,TPESampler,COMPLETE
1200,0.18995575170700602,2025-04-24 23:43:26.264713,2025-04-24 23:43:33.286798,0 days 00:00:07.022085,93.41562562125591,0.1298580594877952,0.01526860621003684,linear,TPESampler,COMPLETE
1201,0.15277381393548786,2025-04-24 23:43:26.736952,2025-04-24 23:43:30.865221,0 days 00:00:04.128269,17.36250284441795,0.042396963380616305,0.0012079412281853028,linear,TPESampler,COMPLETE
1202,0.7378495098017607,2025-04-24 23:43:29.780924,2025-04-24 23:43:30.234676,0 days 00:00:00.453752,1.0964039686576306,0.3862344038881427,0.005367506498470114,poly,TPESampler,COMPLETE
1203,0.15513611923577295,2025-04-24 23:43:30.407112,2025-04-24 23:43:35.346495,0 days 00:00:04.939383,14.947732885775332,0.00540735062831443,0.016419067206588416,linear,TPESampler,COMPLETE
1204,0.15445816135658097,2025-04-24 23:43:31.041736,2025-04-24 23:43:43.280159,0 days 00:00:12.238423,25.66523305081785,0.012174161615680372,0.0005571474969348411,linear,TPESampler,COMPLETE
1205,0.15015940007399506,2025-04-24 23:43:33.455355,2025-04-24 23:43:36.299477,0 days 00:00:02.844122,11.479118934520695,0.028883816299698897,0.0036272014183088624,linear,TPESampler,COMPLETE
1206,177.310248541567,2025-04-24 23:43:35.513937,2025-04-24 23:43:36.011975,0 days 00:00:00.498038,10.55048975719143,0.2239388026507282,0.04271491122862411,sigmoid,TPESampler,COMPLETE
1207,0.15355568968493766,2025-04-24 23:43:36.186483,2025-04-24 23:43:56.255224,0 days 00:00:20.068741,75.98657365841304,0.017051225902979264,0.00013047471279783323,linear,TPESampler,COMPLETE
1208,0.1637110345279726,2025-04-24 23:43:36.464029,2025-04-24 23:43:37.247446,0 days 00:00:00.783417,0.9752048239151132,0.017649970374306767,0.00011244327435684125,linear,TPESampler,COMPLETE
1209,0.40046200594773607,2025-04-24 23:43:37.424470,2025-04-24 23:43:37.920220,0 days 00:00:00.495750,0.011069932765600832,0.003015406856478646,0.0014309134696163259,linear,TPESampler,COMPLETE
1210,0.1549721252524623,2025-04-24 23:43:38.089393,2025-04-24 23:43:43.457059,0 days 00:00:05.367666,20.627721089964624,0.04530764936695437,0.005330837096476637,linear,TPESampler,COMPLETE
1211,0.15230182595184968,2025-04-24 23:43:43.517317,2025-04-24 23:44:06.618358,0 days 00:00:23.101041,89.4270189682798,0.016910753545762942,0.000664902487691246,linear,TPESampler,COMPLETE
1212,0.26280430108024366,2025-04-24 23:43:43.680896,2025-04-24 23:43:44.320344,0 days 00:00:00.639448,8.01905818918822,0.009627952397767304,0.0034004099485204662,rbf,TPESampler,COMPLETE
1213,0.1633127456689273,2025-04-24 23:43:44.520844,2025-04-24 23:43:57.029619,0 days 00:00:12.508775,99.3438047632213,0.06196917758085683,0.010601722376975082,linear,TPESampler,COMPLETE
1214,0.48990969242298416,2025-04-24 23:43:56.423456,2025-04-24 23:43:56.890744,0 days 00:00:00.467288,0.5193074750451494,0.18444849955915316,0.001567180583919704,rbf,TPESampler,COMPLETE
1215,0.1630474254685068,2025-04-24 23:43:57.036105,2025-04-24 23:43:59.282269,0 days 00:00:02.246164,16.428438249905305,0.06030030299379229,0.000470396071518449,linear,TPESampler,COMPLETE
1216,0.15035633381583088,2025-04-24 23:43:57.186586,2025-04-24 23:44:01.815869,0 days 00:00:04.629283,25.808953868403922,0.03775965682475819,0.004953646752438423,linear,TPESampler,COMPLETE
1217,0.15416054314137498,2025-04-24 23:43:59.447036,2025-04-24 23:44:08.532222,0 days 00:00:09.085186,18.554712642264867,0.011074963174888085,0.012313790625982588,linear,TPESampler,COMPLETE
1218,0.2056658642283936,2025-04-24 23:44:01.987572,2025-04-24 23:44:03.670718,0 days 00:00:01.683146,89.91508027193801,0.1448535014230795,0.003694469750328545,linear,TPESampler,COMPLETE
1219,0.15552803418493463,2025-04-24 23:44:03.838687,2025-04-24 23:44:10.009035,0 days 00:00:06.170348,19.584859120397628,0.013391238705532509,0.0014945043392748515,linear,TPESampler,COMPLETE
1220,0.1500235349364612,2025-04-24 23:44:06.790936,2025-04-24 23:44:11.022911,0 days 00:00:04.231975,22.76726267227615,0.03539949136243459,0.0006914324153403582,linear,TPESampler,COMPLETE
1221,0.15792837852070832,2025-04-24 23:44:08.706726,2025-04-24 23:44:21.951534,0 days 00:00:13.244808,87.90713338198744,0.05086335620038752,0.00092466742717013,linear,TPESampler,COMPLETE
1222,0.18223289855972052,2025-04-24 23:44:10.182342,2025-04-24 23:44:10.727641,0 days 00:00:00.545299,1.3094297797984458,0.0779664846672093,0.0033802486321391407,linear,TPESampler,COMPLETE
1223,0.14858477269730733,2025-04-24 23:44:10.918685,2025-04-24 23:44:35.973113,0 days 00:00:25.054428,92.69777192387403,0.029953041717070802,0.0029738442433661165,linear,TPESampler,COMPLETE
1224,0.15827564023553836,2025-04-24 23:44:11.213581,2025-04-24 23:44:14.275332,0 days 00:00:03.061751,20.892458234181316,0.05341159613957961,0.00874343451054652,linear,TPESampler,COMPLETE
1225,3.8033528194756276,2025-04-24 23:44:14.466307,2025-04-24 23:44:14.980040,0 days 00:00:00.513733,4.159722764001549,0.007327226557073915,0.0038188523538450164,sigmoid,TPESampler,COMPLETE
1226,0.15093503029452535,2025-04-24 23:44:15.154466,2025-04-24 23:44:46.431063,0 days 00:00:31.276597,99.93448980708804,0.018067393360522495,0.011515887281078753,linear,TPESampler,COMPLETE
1227,0.1542189569961863,2025-04-24 23:44:22.369877,2025-04-24 23:44:50.495296,0 days 00:00:28.125419,98.3913885519584,0.014760951591057683,0.00057072055320776,linear,TPESampler,COMPLETE
1228,0.14941381699584722,2025-04-24 23:44:36.149813,2025-04-24 23:44:50.208147,0 days 00:00:14.058334,97.6574231879527,0.03612728185609657,0.9187134224408047,linear,TPESampler,COMPLETE
1229,0.7651763260743378,2025-04-24 23:44:46.608792,2025-04-24 23:44:47.080956,0 days 00:00:00.472164,98.97928972815895,0.0581456585110118,0.001522191804242448,poly,TPESampler,COMPLETE
1230,0.14835166611233527,2025-04-24 23:44:47.252054,2025-04-24 23:44:59.246960,0 days 00:00:11.994906,87.9963325433239,0.033987355809972114,0.0007905551592490821,linear,TPESampler,COMPLETE
1231,0.15005913869153611,2025-04-24 23:44:50.382629,2025-04-24 23:45:09.596026,0 days 00:00:19.213397,91.1387738566072,0.025582781424146994,0.0019185879664893133,linear,TPESampler,COMPLETE
1232,0.8012948559975774,2025-04-24 23:44:50.676536,2025-04-24 23:44:51.199110,0 days 00:00:00.522574,20.377894080301417,0.013993317636664185,0.003258865858134033,poly,TPESampler,COMPLETE
1233,0.14990439218914942,2025-04-24 23:44:51.376694,2025-04-24 23:44:55.833957,0 days 00:00:04.457263,25.102703483121463,0.03515145976986669,0.0024671192185048135,linear,TPESampler,COMPLETE
1234,0.15593807355633438,2025-04-24 23:44:56.003550,2025-04-24 23:45:01.256015,0 days 00:00:05.252465,18.77234419591364,0.013975441315989854,0.001724790838476594,linear,TPESampler,COMPLETE
1235,0.15092292164651336,2025-04-24 23:44:59.431943,2025-04-24 23:45:03.143669,0 days 00:00:03.711726,14.505404056532928,0.0208299918000535,0.0002651303047399514,linear,TPESampler,COMPLETE
1236,0.15497210185114133,2025-04-24 23:45:01.422009,2025-04-24 23:45:35.975092,0 days 00:00:34.553083,96.46305358880116,0.008847227735320682,0.39332287694791424,linear,TPESampler,COMPLETE
1237,0.1479674273827032,2025-04-24 23:45:03.331777,2025-04-24 23:45:16.145243,0 days 00:00:12.813466,97.40140811051651,0.03334864352039168,0.0013766392766647322,linear,TPESampler,COMPLETE
1238,0.6918945159584591,2025-04-24 23:45:09.793561,2025-04-24 23:45:10.262913,0 days 00:00:00.469352,71.38091981942326,0.1402515821239427,0.21660220741431666,rbf,TPESampler,COMPLETE
1239,0.15367115082227573,2025-04-24 23:45:10.432926,2025-04-24 23:45:31.116681,0 days 00:00:20.683755,96.5200263138168,0.043624087562854075,0.0073508055490507165,linear,TPESampler,COMPLETE
1240,0.15940369217340303,2025-04-24 23:45:16.319987,2025-04-24 23:45:20.404751,0 days 00:00:04.084764,33.48892678758641,0.06845299302893576,0.00043656638232460307,linear,TPESampler,COMPLETE
1241,0.1589744827325479,2025-04-24 23:45:20.770124,2025-04-24 23:45:21.963643,0 days 00:00:01.193519,2.2605253786343464,0.040242114749883984,0.0007663547803436335,linear,TPESampler,COMPLETE
1242,0.14863477148591056,2025-04-24 23:45:22.154712,2025-04-24 23:45:35.932506,0 days 00:00:13.777794,82.99834694218063,0.03447939914618729,0.0007103696458214793,linear,TPESampler,COMPLETE
1243,7.055669607013376,2025-04-24 23:45:31.335196,2025-04-24 23:45:31.890372,0 days 00:00:00.555176,91.15910307255486,0.014321367289221168,0.0014671392216857888,sigmoid,TPESampler,COMPLETE
1244,0.163369386574952,2025-04-24 23:45:32.070250,2025-04-24 23:45:43.563293,0 days 00:00:11.493043,92.6245026624502,0.06241738095261852,0.0002591369119686029,linear,TPESampler,COMPLETE
1245,0.15624844221756112,2025-04-24 23:45:36.070020,2025-04-24 23:46:06.406857,0 days 00:00:30.336837,90.27502961336923,0.046926411893669126,0.00033481433529717876,linear,TPESampler,COMPLETE
1246,0.15047103475245735,2025-04-24 23:45:36.196478,2025-04-24 23:45:43.721201,0 days 00:00:07.524723,32.436881744141225,0.03777356425884472,0.0009431449578692065,linear,TPESampler,COMPLETE
1247,0.14983026855077428,2025-04-24 23:45:43.723860,2025-04-24 23:46:04.540056,0 days 00:00:20.816196,90.03119555921414,0.02100712825225973,0.0006101634345516429,linear,TPESampler,COMPLETE
1248,0.23294429721789023,2025-04-24 23:45:43.889889,2025-04-24 23:45:47.013948,0 days 00:00:03.124059,94.52846251259106,0.1985951156249479,0.001167366476091316,linear,TPESampler,COMPLETE
1249,0.1493318376272868,2025-04-24 23:45:47.199029,2025-04-24 23:45:50.541363,0 days 00:00:03.342334,21.15981148708384,0.03229642633079392,0.001846531216725471,linear,TPESampler,COMPLETE
1250,0.17110402603267313,2025-04-24 23:45:50.722203,2025-04-24 23:45:52.598918,0 days 00:00:01.876715,16.741202199129127,0.09259107675918801,0.0016620460594518932,linear,TPESampler,COMPLETE
1251,0.14999286461760417,2025-04-24 23:45:52.783282,2025-04-24 23:46:22.318883,0 days 00:00:29.535601,99.42416156549685,0.020558478780628917,0.0006625559742094316,linear,TPESampler,COMPLETE
1252,0.16056283031066096,2025-04-24 23:46:04.721234,2025-04-24 23:46:13.718508,0 days 00:00:08.997274,97.9292931646406,0.07754296055588374,0.0006543342878042381,linear,TPESampler,COMPLETE
1253,0.15491772189050715,2025-04-24 23:46:06.595498,2025-04-24 23:46:34.878807,0 days 00:00:28.283309,61.90250734739502,0.00914261524538152,0.0019008868463428147,linear,TPESampler,COMPLETE
1254,0.14976052686149527,2025-04-24 23:46:13.888801,2025-04-24 23:46:32.062328,0 days 00:00:18.173527,94.87259441363703,0.027759074502049307,0.0011637277568996125,linear,TPESampler,COMPLETE
1255,0.16332027538791602,2025-04-24 23:46:22.498631,2025-04-24 23:46:33.210149,0 days 00:00:10.711518,99.70889355548343,0.06247153339525336,0.002486665127113002,linear,TPESampler,COMPLETE
1256,1.3978805701513228,2025-04-24 23:46:32.238271,2025-04-24 23:46:32.730443,0 days 00:00:00.492172,95.44144281035891,0.0062167893868957606,0.00012204535516114377,poly,TPESampler,COMPLETE
1257,0.1512380963044978,2025-04-24 23:46:32.899414,2025-04-24 23:46:39.756212,0 days 00:00:06.856798,25.064613552827517,0.03895569366873804,0.0022039642281427175,linear,TPESampler,COMPLETE
1258,683.7940064770941,2025-04-24 23:46:33.401011,2025-04-24 23:46:33.907814,0 days 00:00:00.506803,83.71146917477708,0.015881915525734012,0.013657648410948756,sigmoid,TPESampler,COMPLETE
1259,0.16106834300408868,2025-04-24 23:46:34.084377,2025-04-24 23:46:37.840055,0 days 00:00:03.755678,73.34548315610381,0.07957668588953487,0.8531903388393236,linear,TPESampler,COMPLETE
1260,0.15224320406866976,2025-04-24 23:46:35.053450,2025-04-24 23:46:54.027670,0 days 00:00:18.974220,99.69656143223989,0.04203391435108284,0.001545292452266773,linear,TPESampler,COMPLETE
1261,0.1500866666320879,2025-04-24 23:46:38.006464,2025-04-24 23:47:05.787292,0 days 00:00:27.780828,93.43150305002037,0.020717174682305654,0.004329942047068632,linear,TPESampler,COMPLETE
1262,0.15501378920645337,2025-04-24 23:46:39.933000,2025-04-24 23:47:09.199855,0 days 00:00:29.266855,84.80322868871112,0.005872525056549507,0.0006214207538344022,linear,TPESampler,COMPLETE
1263,0.1500292534766439,2025-04-24 23:46:54.214961,2025-04-24 23:46:58.138056,0 days 00:00:03.923095,25.111626250446104,0.03539559775933677,0.0008645334468632758,linear,TPESampler,COMPLETE
1264,0.1558183116858037,2025-04-24 23:46:58.311142,2025-04-24 23:47:20.021824,0 days 00:00:21.710682,94.65134495883986,0.04638176156238831,0.001348025264919452,linear,TPESampler,COMPLETE
1265,0.15761072776804655,2025-04-24 23:47:05.964881,2025-04-24 23:47:22.999726,0 days 00:00:17.034845,94.76130789024185,0.048012553206664074,0.000964799487472335,linear,TPESampler,COMPLETE
1266,0.1545593599084654,2025-04-24 23:47:09.456596,2025-04-24 23:47:15.125052,0 days 00:00:05.668456,10.339029251840644,0.00943089534967858,0.0010889371096761637,linear,TPESampler,COMPLETE
1267,0.1602426087768923,2025-04-24 23:47:15.304840,2025-04-24 23:47:22.375391,0 days 00:00:07.070551,98.49214650889517,0.07837535288670652,0.0016679414958197423,linear,TPESampler,COMPLETE
1268,0.152848900104944,2025-04-24 23:47:20.214935,2025-04-24 23:47:38.280884,0 days 00:00:18.065949,72.787728496593,0.016654116218069708,0.00171751026473451,linear,TPESampler,COMPLETE
1269,0.173324381609159,2025-04-24 23:47:22.564324,2025-04-24 23:47:23.477641,0 days 00:00:00.913317,4.631873809782471,0.07584855182832732,0.002175602998585055,linear,TPESampler,COMPLETE
1270,0.14992174241720108,2025-04-24 23:47:23.430837,2025-04-24 23:47:42.123830,0 days 00:00:18.692993,98.75793017912957,0.02764686711505241,0.00275533127243567,linear,TPESampler,COMPLETE
1271,0.15033216215049283,2025-04-24 23:47:23.677005,2025-04-24 23:47:30.797427,0 days 00:00:07.120422,24.805372271011976,0.02457350236720411,0.00032569688860704276,linear,TPESampler,COMPLETE
1272,6.599869516632233,2025-04-24 23:47:30.977839,2025-04-24 23:47:31.486342,0 days 00:00:00.508503,14.345001173390887,0.03184479586511249,0.0028549410468239386,sigmoid,TPESampler,COMPLETE
1273,0.15217668945674737,2025-04-24 23:47:31.659788,2025-04-24 23:47:57.663033,0 days 00:00:26.003245,95.6843630293195,0.04099611699540283,0.0001354367091618219,linear,TPESampler,COMPLETE
1274,0.16396863551155622,2025-04-24 23:47:38.458592,2025-04-24 23:47:41.000135,0 days 00:00:02.541543,19.51480100467332,0.05911781004836429,0.0014117862106750219,linear,TPESampler,COMPLETE
1275,0.15410086774551332,2025-04-24 23:47:41.172940,2025-04-24 23:47:49.694455,0 days 00:00:08.521515,24.147101122045935,0.007301716610599504,0.48029371844707086,linear,TPESampler,COMPLETE
1276,0.7892581343485026,2025-04-24 23:47:42.299389,2025-04-24 23:47:42.784300,0 days 00:00:00.484911,28.149893981579737,0.22850842767573964,0.0009498246296082939,poly,TPESampler,COMPLETE
1277,0.1560277406477998,2025-04-24 23:47:42.958270,2025-04-24 23:47:48.039472,0 days 00:00:05.081202,16.22825426338613,0.014615362585962658,0.851814872586521,linear,TPESampler,COMPLETE
1278,1.3812311157248935,2025-04-24 23:47:48.268190,2025-04-24 23:47:49.329846,0 days 00:00:01.061656,0.1343819868712009,0.7978997835732664,0.0006959573700301002,poly,TPESampler,COMPLETE
