number,value,datetime_start,datetime_complete,duration,params_C,params_epsilon,params_gamma,params_kernel,system_attrs_auto:sampler,state
233,0.16280823874649475,2025-04-24 21:17:01.202377,2025-04-24 21:17:16.310053,0 days 00:00:15.107676,89.76068849995374,0.05761202315873474,0.11457852944001264,linear,TPESampler,COMPLETE
234,0.27231600323388494,2025-04-24 21:17:16.493240,2025-04-24 21:17:18.063985,0 days 00:00:01.570745,46.824421122081425,0.2558694665094484,0.0616822557989601,linear,TPESampler,COMPLETE
235,0.1607869691572721,2025-04-24 21:17:18.237769,2025-04-24 21:17:31.463693,0 days 00:00:13.225924,98.17584753294675,0.0559835819359712,0.3441561776036631,linear,TPESampler,COMPLETE
236,0.1547566446624096,2025-04-24 21:17:30.086657,2025-04-24 21:17:35.250206,0 days 00:00:05.163549,12.970123617044006,0.010867450562077696,0.0619290835900515,linear,TPESampler,COMPLETE
237,0.14975361836557205,2025-04-24 21:17:31.642612,2025-04-24 21:17:59.007387,0 days 00:00:27.364775,83.90312947831738,0.024790961849212204,0.1607782163398946,linear,TPESampler,COMPLETE
238,0.15635657447146795,2025-04-24 21:17:35.429755,2025-04-24 21:17:37.430809,0 days 00:00:02.001054,7.183829142351676,0.043876905086396724,0.023779612528532588,linear,TPESampler,COMPLETE
239,0.14923899044566044,2025-04-24 21:17:37.609650,2025-04-24 21:17:40.859158,0 days 00:00:03.249508,15.354909117959108,0.03237650761308643,0.041499736800905934,linear,TPESampler,COMPLETE
240,21.369078341798588,2025-04-24 21:17:41.028023,2025-04-24 22:27:27.565532,0 days 01:09:46.537509,89.708824998205,0.014345445484703274,0.6260753565693546,poly,TPESampler,COMPLETE
241,11.408482530338167,2025-04-24 21:17:59.175281,2025-04-24 21:17:59.670299,0 days 00:00:00.495018,0.628279447110847,0.006157892834114827,0.04196144710588649,sigmoid,TPESampler,COMPLETE
242,0.7827440605754691,2025-04-24 21:17:59.834884,2025-04-24 21:18:00.337572,0 days 00:00:00.502688,69.97988901155688,0.0167719578535334,0.40324449781170624,rbf,TPESampler,COMPLETE
243,0.14945234209726435,2025-04-24 21:18:00.503286,2025-04-24 21:18:15.825464,0 days 00:00:15.322178,89.80004083428389,0.03539431437450228,0.32815636222465433,linear,TPESampler,COMPLETE
244,0.15476885087370043,2025-04-24 21:18:16.002403,2025-04-24 21:18:17.868522,0 days 00:00:01.866119,5.50428245758413,0.017251330573147327,0.016866787403876097,linear,TPESampler,COMPLETE
245,0.15313988501204734,2025-04-24 21:18:18.041149,2025-04-24 21:18:33.823538,0 days 00:00:15.782389,65.44277082234599,0.017571122194396813,0.05168339299474066,linear,TPESampler,COMPLETE
246,0.5299855169350588,2025-04-24 21:18:33.991319,2025-04-24 21:18:44.648973,0 days 00:00:10.657654,26.982310155826955,0.04175835490680643,0.05437889503389079,poly,TPESampler,COMPLETE
247,0.14972517191331494,2025-04-24 21:18:44.813911,2025-04-24 21:18:58.804108,0 days 00:00:13.990197,60.14579126055924,0.036925198589064,0.038163542131619696,linear,TPESampler,COMPLETE
248,0.15010106712476343,2025-04-24 21:18:58.962756,2025-04-24 21:19:21.818441,0 days 00:00:22.855685,93.59382012804375,0.02542673825273728,0.036205544275012,linear,TPESampler,COMPLETE
249,0.16583301430762015,2025-04-24 21:19:21.993049,2025-04-24 21:19:23.151101,0 days 00:00:01.158052,13.73296297752761,0.08098186198797423,0.051801483046921,linear,TPESampler,COMPLETE
250,1.410962618770229,2025-04-24 21:19:23.306561,2025-04-24 21:19:23.819232,0 days 00:00:00.512671,0.004022298720675446,0.003590398194086985,0.0001278536531983485,rbf,TPESampler,COMPLETE
251,0.15171294695845058,2025-04-24 21:19:23.982530,2025-04-24 21:19:26.737017,0 days 00:00:02.754487,8.437418926049757,0.024085527051286706,0.1311367982561525,linear,TPESampler,COMPLETE
252,0.15233082833427403,2025-04-24 21:19:27.113937,2025-04-24 21:19:29.325919,0 days 00:00:02.211982,9.764875876943444,0.03948460174415083,0.02535898318488953,linear,TPESampler,COMPLETE
253,0.35257173293494615,2025-04-24 21:19:29.492045,2025-04-24 21:19:29.986960,0 days 00:00:00.494915,40.46340544056153,0.014172457117628575,0.00015545676207363675,rbf,TPESampler,COMPLETE
254,0.16356845901168263,2025-04-24 21:19:30.156364,2025-04-24 21:19:40.562570,0 days 00:00:10.406206,76.54564102399064,0.061068010090052964,0.9073859406099487,linear,TPESampler,COMPLETE
255,0.16321160167228368,2025-04-24 21:19:40.753094,2025-04-24 21:19:45.490891,0 days 00:00:04.737797,78.61879853633097,0.08239880987364831,0.022545705246247036,linear,TPESampler,COMPLETE
256,0.1571571735992436,2025-04-24 21:19:45.648082,2025-04-24 21:20:03.029938,0 days 00:00:17.381856,88.93773312151873,0.05280406373852384,0.0007432967615249738,linear,TPESampler,COMPLETE
257,0.15651286181267643,2025-04-24 21:20:03.194266,2025-04-24 21:20:05.062304,0 days 00:00:01.868038,4.450009757185588,0.00900445871492938,0.0009580798065652055,linear,TPESampler,COMPLETE
258,0.1537444586650415,2025-04-24 21:20:05.239116,2025-04-24 21:20:17.556387,0 days 00:00:12.317271,36.5843465635012,0.01352684330419926,0.0008692968995786834,linear,TPESampler,COMPLETE
259,0.1502869448629605,2025-04-24 21:20:17.719827,2025-04-24 21:20:29.527786,0 days 00:00:11.807959,36.80231933504791,0.020741816803978744,0.024047929253849434,linear,TPESampler,COMPLETE
260,704.4575530827273,2025-04-24 21:20:29.708203,2025-04-24 21:20:30.248034,0 days 00:00:00.539831,35.89376131387902,0.01937253102070922,0.7875677236619699,sigmoid,TPESampler,COMPLETE
261,0.42025459317366204,2025-04-24 21:20:30.400441,2025-04-24 21:20:30.851770,0 days 00:00:00.451329,28.53989654823633,0.4285452448228591,0.002515680438933972,linear,TPESampler,COMPLETE
262,0.15028274761663304,2025-04-24 21:20:31.022821,2025-04-24 21:20:40.998801,0 days 00:00:09.975980,34.27022962871067,0.02377128950669571,0.15515253012950547,linear,TPESampler,COMPLETE
263,0.15363126877308725,2025-04-24 21:20:41.170301,2025-04-24 21:21:10.352126,0 days 00:00:29.181825,73.15690497841766,0.008063358858224347,0.05175796833569787,linear,TPESampler,COMPLETE
264,0.1635811990518107,2025-04-24 21:21:10.522355,2025-04-24 21:21:13.580672,0 days 00:00:03.058317,15.41070702905478,0.06640406884950616,0.010548900133888109,linear,TPESampler,COMPLETE
265,0.15021909324926083,2025-04-24 21:21:13.758742,2025-04-24 21:21:18.684370,0 days 00:00:04.925628,15.207266332126839,0.02284587036054354,0.00027140577353153625,linear,TPESampler,COMPLETE
266,0.15484358497332015,2025-04-24 21:21:18.861407,2025-04-24 21:21:47.684167,0 days 00:00:28.822760,72.84478947442204,0.012566679315176084,0.756100391499531,linear,TPESampler,COMPLETE
267,0.3243506783758744,2025-04-24 21:21:47.864410,2025-04-24 21:21:48.395011,0 days 00:00:00.530601,43.8010450044634,0.05855900726768836,0.01719939663380897,rbf,TPESampler,COMPLETE
268,0.1501820456638882,2025-04-24 21:21:48.567962,2025-04-24 21:22:13.018036,0 days 00:00:24.450074,76.22889774668275,0.022388234300251022,0.010103112145135902,linear,TPESampler,COMPLETE
269,0.15049619306886466,2025-04-24 21:22:13.184683,2025-04-24 21:22:15.928234,0 days 00:00:02.743551,10.036398990662038,0.02890786741166782,0.0013574438412736376,linear,TPESampler,COMPLETE
270,0.25881563498974536,2025-04-24 21:22:16.100330,2025-04-24 21:22:16.619512,0 days 00:00:00.519182,3.3567032250570907,0.19829282590668523,0.3198112753996293,linear,TPESampler,COMPLETE
271,0.37954916548129486,2025-04-24 21:22:16.783305,2025-04-24 21:22:17.672335,0 days 00:00:00.889030,72.21218208401991,0.0015843796539940884,0.02554654862330801,rbf,TPESampler,COMPLETE
272,2250.4597115274455,2025-04-24 21:22:17.845031,2025-04-24 21:22:18.387477,0 days 00:00:00.542446,99.83493950641633,0.09684874406273336,0.34064368383081733,sigmoid,TPESampler,COMPLETE
273,0.1742010386174704,2025-04-24 21:22:18.557140,2025-04-24 21:22:19.377781,0 days 00:00:00.820641,3.225673539505909,0.07233869382503141,0.1864235352069522,linear,TPESampler,COMPLETE
274,0.15042565053564771,2025-04-24 21:22:19.537908,2025-04-24 21:22:22.768490,0 days 00:00:03.230582,16.675808528084353,0.027573426245944235,0.12887981106623253,linear,TPESampler,COMPLETE
275,0.25819514828501205,2025-04-24 21:22:22.977763,2025-04-24 21:22:23.507702,0 days 00:00:00.529939,6.378852029115129,0.006823309393456404,0.007516390078940178,rbf,TPESampler,COMPLETE
276,1.3751298394052272,2025-04-24 21:22:23.686228,2025-04-24 21:22:24.167910,0 days 00:00:00.481682,0.0017693331814466163,0.41242623497945263,0.0046046607444707255,rbf,TPESampler,COMPLETE
277,0.1634534802346016,2025-04-24 21:22:24.325419,2025-04-24 21:22:28.902892,0 days 00:00:04.577473,95.52924667785088,0.0828157210948444,0.005381389802566273,linear,TPESampler,COMPLETE
278,0.16054957095119146,2025-04-24 21:22:29.059685,2025-04-24 21:22:41.895231,0 days 00:00:12.835546,72.46325785542813,0.06796820953450414,0.11502646653894914,linear,TPESampler,COMPLETE
279,0.1559787759834805,2025-04-24 21:22:42.144604,2025-04-24 21:22:44.380481,0 days 00:00:02.235877,6.260966367439659,0.01665394215861021,0.018653609221525386,linear,TPESampler,COMPLETE
280,0.1504833882295772,2025-04-24 21:22:44.728383,2025-04-24 21:23:08.453883,0 days 00:00:23.725500,68.96483865823637,0.019050065483075935,0.0016269735057724455,linear,TPESampler,COMPLETE
281,0.14905804296240807,2025-04-24 21:23:08.632150,2025-04-24 21:23:24.922336,0 days 00:00:16.290186,94.65819289275801,0.034648719569181294,0.10514771685778103,linear,TPESampler,COMPLETE
282,0.14919629799721687,2025-04-24 21:23:25.094645,2025-04-24 21:23:38.472965,0 days 00:00:13.378320,81.43648244037009,0.03500545433934737,0.31182898638549517,linear,TPESampler,COMPLETE
283,1.4052511281175788,2025-04-24 21:23:38.648501,2025-04-24 21:23:39.124539,0 days 00:00:00.476038,0.047878617263837374,0.3584098361270477,0.00014155189235562436,poly,TPESampler,COMPLETE
284,3.2306668823730558,2025-04-24 21:23:39.297693,2025-04-24 21:23:39.756414,0 days 00:00:00.458721,0.16773921224387706,0.9547412639264704,0.08932033933885948,sigmoid,TPESampler,COMPLETE
285,0.940251975085618,2025-04-24 21:23:39.919911,2025-04-24 21:23:40.379719,0 days 00:00:00.459808,0.05230267363791113,0.19146952606925585,0.005972304195219591,sigmoid,TPESampler,COMPLETE
286,0.1503775114824981,2025-04-24 21:23:40.540367,2025-04-24 21:24:03.383787,0 days 00:00:22.843420,71.07060773418944,0.019266065946088987,0.23328428920492753,linear,TPESampler,COMPLETE
287,0.15197130039387297,2025-04-24 21:24:03.565831,2025-04-24 21:24:18.802610,0 days 00:00:15.236779,89.79184402775853,0.04043329473511643,0.10585244211032685,linear,TPESampler,COMPLETE
288,0.8772660013522879,2025-04-24 21:24:18.973997,2025-04-24 21:24:19.470032,0 days 00:00:00.496035,80.70162137348056,0.05627003970032802,0.6037474009505416,rbf,TPESampler,COMPLETE
289,0.14895606773333153,2025-04-24 21:24:19.639973,2025-04-24 21:24:34.831943,0 days 00:00:15.191970,71.24289352875148,0.029937737471331657,0.7424517462602799,linear,TPESampler,COMPLETE
290,0.14937677827211224,2025-04-24 21:24:35.007774,2025-04-24 21:24:38.908358,0 days 00:00:03.900584,21.37526765605499,0.03447229183999356,0.7359540658095431,linear,TPESampler,COMPLETE
291,0.15427997506541763,2025-04-24 21:24:39.078736,2025-04-24 21:24:58.788896,0 days 00:00:19.710160,65.18123310460008,0.01504901233132193,0.7054984658315795,linear,TPESampler,COMPLETE
292,0.1490947454486227,2025-04-24 21:24:58.965509,2025-04-24 21:25:05.413493,0 days 00:00:06.447984,41.55319300835551,0.03242086589579583,0.4296216334825568,linear,TPESampler,COMPLETE
293,0.1560818889109924,2025-04-24 21:25:05.577209,2025-04-24 21:25:24.332536,0 days 00:00:18.755327,61.96016909718465,0.046671231435506944,0.21521806981613661,linear,TPESampler,COMPLETE
294,0.14996221071135493,2025-04-24 21:25:24.502439,2025-04-24 21:25:56.157001,0 days 00:00:31.654562,94.46671929823104,0.019214159491172358,0.2796725099560895,linear,TPESampler,COMPLETE
295,0.15019669902794577,2025-04-24 21:25:56.321193,2025-04-24 21:26:21.376926,0 days 00:00:25.055733,93.03306367976903,0.02617431777484516,0.3903734842368723,linear,TPESampler,COMPLETE
296,0.16336972212423784,2025-04-24 21:26:21.546349,2025-04-24 21:26:27.028933,0 days 00:00:05.482584,42.33093633149504,0.06426218658232143,0.5994663550047308,linear,TPESampler,COMPLETE
297,0.14928074312958953,2025-04-24 21:26:27.200871,2025-04-24 21:26:31.012846,0 days 00:00:03.811975,12.558415100214042,0.03457744273456297,0.06454634442299645,linear,TPESampler,COMPLETE
298,0.15222029158914727,2025-04-24 21:26:31.180708,2025-04-24 21:26:32.988559,0 days 00:00:01.807851,6.17142285039761,0.030818413539067467,0.18025609505402598,linear,TPESampler,COMPLETE
299,0.7615620938550427,2025-04-24 21:26:33.155989,2025-04-24 21:26:33.624594,0 days 00:00:00.468605,96.5447127346225,0.2604755073103023,0.0009608637394808342,poly,TPESampler,COMPLETE
300,0.16156519370820685,2025-04-24 21:26:33.793767,2025-04-24 21:26:39.648826,0 days 00:00:05.855059,90.29948206029029,0.08038701894838124,0.07180141202530047,linear,TPESampler,COMPLETE
301,0.16658871194363528,2025-04-24 21:26:39.825024,2025-04-24 21:26:41.187933,0 days 00:00:01.362909,14.697812565957154,0.08298285482567569,0.13065718557417047,linear,TPESampler,COMPLETE
302,0.5137736789225327,2025-04-24 21:26:41.360073,2025-04-24 21:26:41.875005,0 days 00:00:00.514932,2.0694554027179963,0.04648359786713021,0.061839008159221824,rbf,TPESampler,COMPLETE
303,0.1717801095489381,2025-04-24 21:26:42.035231,2025-04-24 21:26:48.267902,0 days 00:00:06.232671,92.47640788588188,0.09667842347264258,0.15070667700941873,linear,TPESampler,COMPLETE
304,0.15021983087127916,2025-04-24 21:26:48.432189,2025-04-24 21:27:11.738948,0 days 00:00:23.306759,74.5578466113626,0.02008132213706549,0.14218986398406386,linear,TPESampler,COMPLETE
305,0.15202977764998474,2025-04-24 21:27:11.914724,2025-04-24 21:27:13.751592,0 days 00:00:01.836868,6.5694959329349745,0.0317728323792333,0.06508859309785509,linear,TPESampler,COMPLETE
306,0.1504027093081574,2025-04-24 21:27:13.913365,2025-04-24 21:27:20.326145,0 days 00:00:06.412780,22.443557554253815,0.02397183200149078,0.02940117423801032,linear,TPESampler,COMPLETE
307,0.15232525493550161,2025-04-24 21:27:20.506616,2025-04-24 21:27:28.337763,0 days 00:00:07.831147,32.68045603818824,0.041610594433853336,0.8653615396328603,linear,TPESampler,COMPLETE
308,1.8730775549107952,2025-04-24 21:27:28.511700,2025-04-24 21:27:29.011767,0 days 00:00:00.500067,4.441257482738162,0.04556843639039713,0.0027770215312363533,sigmoid,TPESampler,COMPLETE
309,0.15323158626192482,2025-04-24 21:27:29.177393,2025-04-24 21:27:50.516123,0 days 00:00:21.338730,71.08524154648146,0.017409164950651833,0.06541429743008945,linear,TPESampler,COMPLETE
310,0.14971929030606115,2025-04-24 21:27:51.009840,2025-04-24 21:27:55.133093,0 days 00:00:04.123253,17.20188322928066,0.030130285379755307,0.11552743908909083,linear,TPESampler,COMPLETE
311,0.4682472258150115,2025-04-24 21:27:55.371156,2025-04-24 21:29:18.394166,0 days 00:01:23.023010,80.40151042961422,0.031806833132065226,0.06245042080374468,poly,TPESampler,COMPLETE
312,0.1497288331142692,2025-04-24 21:29:18.568914,2025-04-24 21:29:35.639801,0 days 00:00:17.070887,85.23512481992249,0.02862331939062927,0.35131585254353376,linear,TPESampler,COMPLETE
313,0.1487921846892601,2025-04-24 21:29:35.805897,2025-04-24 21:29:49.383662,0 days 00:00:13.577765,96.74027350208824,0.03204817905802759,0.028947488373870397,linear,TPESampler,COMPLETE
314,0.149545130862817,2025-04-24 21:29:49.543634,2025-04-24 21:30:02.698499,0 days 00:00:13.154865,64.80195941085265,0.03665457174527665,0.028177958403413077,linear,TPESampler,COMPLETE
315,0.1653433745252193,2025-04-24 21:30:02.866292,2025-04-24 21:30:04.246425,0 days 00:00:01.380133,9.78987056738366,0.07330595909605331,0.02033957720234003,linear,TPESampler,COMPLETE
316,0.14992827075871235,2025-04-24 21:30:04.417326,2025-04-24 21:30:23.130697,0 days 00:00:18.713371,65.27295956276461,0.021404498654434594,0.02752872538508638,linear,TPESampler,COMPLETE
317,0.1567000270356248,2025-04-24 21:30:23.327184,2025-04-24 21:30:41.330926,0 days 00:00:18.003742,87.69941590216841,0.04958999195242887,0.4795758187565717,linear,TPESampler,COMPLETE
318,0.1563675975631668,2025-04-24 21:30:41.496166,2025-04-24 21:30:45.667741,0 days 00:00:04.171575,9.833621593970102,0.01006850692507583,0.16609912258687762,linear,TPESampler,COMPLETE
319,0.16363359690338092,2025-04-24 21:30:45.832653,2025-04-24 21:30:52.074853,0 days 00:00:06.242200,42.06334717329722,0.05882303384026693,0.04326601185400172,linear,TPESampler,COMPLETE
320,213.69423746574333,2025-04-24 21:30:52.247914,2025-04-24 21:30:52.757593,0 days 00:00:00.509679,13.878420044709205,0.05395093094199053,0.1233199697780226,sigmoid,TPESampler,COMPLETE
321,0.1531565526316992,2025-04-24 21:30:52.928326,2025-04-24 21:31:25.134326,0 days 00:00:32.206000,92.62277790253208,0.014182061401226255,0.04993861797026167,linear,TPESampler,COMPLETE
322,0.1500666605035355,2025-04-24 21:31:25.301009,2025-04-24 21:31:28.089121,0 days 00:00:02.788112,13.494781477027711,0.035392274681680234,0.13561293158784343,linear,TPESampler,COMPLETE
323,1.371450540012176,2025-04-24 21:31:28.266455,2025-04-24 21:31:28.822175,0 days 00:00:00.555720,0.00935141294201566,0.7914180871393162,0.00038256227706973567,rbf,TPESampler,COMPLETE
324,0.18018877092463886,2025-04-24 21:31:29.053616,2025-04-24 21:31:29.738820,0 days 00:00:00.685204,0.5287307855072206,0.030920549008028195,0.09129663758570816,linear,TPESampler,COMPLETE
325,0.15132682998731395,2025-04-24 21:31:29.942651,2025-04-24 21:31:32.049782,0 days 00:00:02.107131,7.147429516472309,0.03597491213625805,0.45954557853622857,linear,TPESampler,COMPLETE
326,1286.5400351526926,2025-04-24 21:31:32.300670,2025-04-24 21:31:33.241788,0 days 00:00:00.941118,86.60213559910993,0.007709258046860966,0.09950494015275362,sigmoid,TPESampler,COMPLETE
327,0.15854486803919546,2025-04-24 21:31:33.571444,2025-04-24 21:31:37.432465,0 days 00:00:03.861021,19.00854547311812,0.050978664296275615,0.01655483608656929,linear,TPESampler,COMPLETE
328,0.15918442316503237,2025-04-24 21:31:37.596641,2025-04-24 21:31:52.927843,0 days 00:00:15.331202,99.78365436762613,0.06791569438425603,0.0694359783313731,linear,TPESampler,COMPLETE
329,0.5430232380132072,2025-04-24 21:31:53.095375,2025-04-24 21:32:00.370874,0 days 00:00:07.275499,0.1033795966344158,0.03167840255720367,0.2912961281771195,poly,TPESampler,COMPLETE
330,0.152601801297695,2025-04-24 21:32:00.547218,2025-04-24 21:32:18.873356,0 days 00:00:18.326138,99.48666820892562,0.042869211861094714,0.013382590574606869,linear,TPESampler,COMPLETE
331,0.7641922026361929,2025-04-24 21:32:19.044094,2025-04-24 21:32:19.557568,0 days 00:00:00.513474,0.00903083791264013,0.06070440711854687,0.034492828499426864,poly,TPESampler,COMPLETE
332,0.14957713331641964,2025-04-24 21:32:19.725296,2025-04-24 21:32:38.679648,0 days 00:00:18.954352,87.83870715567535,0.036489263584941846,0.4793137249705422,linear,TPESampler,COMPLETE
333,0.15125827618169682,2025-04-24 21:32:38.835296,2025-04-24 21:32:43.002818,0 days 00:00:04.167522,16.932890434765405,0.025485084483593382,0.056681521206068806,linear,TPESampler,COMPLETE
334,0.5182053231207807,2025-04-24 21:32:43.343414,2025-04-24 21:32:44.283781,0 days 00:00:00.940367,3.575839452538889,0.021285182915565165,0.00920713252661489,poly,TPESampler,COMPLETE
335,0.15115401403485515,2025-04-24 21:32:44.732359,2025-04-24 21:33:13.828992,0 days 00:00:29.096633,87.62599228507594,0.01835054323307458,0.008673876353304119,linear,TPESampler,COMPLETE
336,0.15601965380065347,2025-04-24 21:33:13.994128,2025-04-24 21:33:17.201163,0 days 00:00:03.207035,11.313791429629148,0.01597853436491422,0.7943244079262026,linear,TPESampler,COMPLETE
337,0.1527597115454402,2025-04-24 21:33:17.496429,2025-04-24 21:33:20.109563,0 days 00:00:02.613134,7.501857992141802,0.02232796591980622,0.04404404321449743,linear,TPESampler,COMPLETE
338,0.14862905150999442,2025-04-24 21:33:20.269985,2025-04-24 21:33:33.537279,0 days 00:00:13.267294,99.90282269069556,0.03432281336718431,0.037474181123701794,linear,TPESampler,COMPLETE
339,0.16063660959980652,2025-04-24 21:33:33.701438,2025-04-24 21:33:43.827939,0 days 00:00:10.126501,86.50405417986653,0.055549572621610005,0.039565515576468924,linear,TPESampler,COMPLETE
340,0.15029118226433955,2025-04-24 21:33:43.989633,2025-04-24 21:34:07.526214,0 days 00:00:23.536581,85.60340045739535,0.020001215910517886,0.12599059879286523,linear,TPESampler,COMPLETE
341,0.15219878656594885,2025-04-24 21:34:07.691654,2025-04-24 21:34:25.450473,0 days 00:00:17.758819,97.10522536377488,0.041192277564622015,0.031206406070380385,linear,TPESampler,COMPLETE
342,200.85302170200987,2025-04-24 21:34:25.622849,2025-04-24 21:34:26.109954,0 days 00:00:00.487105,39.775265795193256,0.03397278503996489,0.00930099470166619,sigmoid,TPESampler,COMPLETE
343,1.2495939711747928,2025-04-24 21:34:26.409266,2025-04-24 21:42:33.810161,0 days 00:08:07.400895,2.0164566403156337,0.019296127949113805,0.4131192787556579,poly,TPESampler,COMPLETE
344,0.1539502838019207,2025-04-24 21:42:33.988497,2025-04-24 21:42:36.197062,0 days 00:00:02.208565,7.216954587803144,0.018786362181893966,0.0073915114868233454,linear,TPESampler,COMPLETE
345,0.21923931911882014,2025-04-24 21:42:36.382169,2025-04-24 21:42:37.569593,0 days 00:00:01.187424,44.576278002947426,0.16822245645949782,0.3582525811255309,linear,TPESampler,COMPLETE
346,0.15452784052245716,2025-04-24 21:42:37.754880,2025-04-24 21:42:45.028793,0 days 00:00:07.273913,21.639685279990132,0.006615368192349097,0.01348355635667378,linear,TPESampler,COMPLETE
347,0.1502415905373752,2025-04-24 21:42:45.437037,2025-04-24 21:43:05.993178,0 days 00:00:20.556141,89.7366395957157,0.026358391579182586,0.7501938778636321,linear,TPESampler,COMPLETE
348,20.9805958632826,2025-04-24 21:43:06.185980,2025-04-24 21:43:06.696911,0 days 00:00:00.510931,1.0492867402230117,0.001232688501849305,0.20965892214717308,sigmoid,TPESampler,COMPLETE
349,0.15021127281013735,2025-04-24 21:43:06.862204,2025-04-24 21:43:34.384214,0 days 00:00:27.522010,89.20048236595505,0.02064398700014553,0.055317058357321085,linear,TPESampler,COMPLETE
