number,value,datetime_start,datetime_complete,duration,params_C,params_epsilon,params_gamma,params_kernel,system_attrs_auto:sampler,state
1279,0.15012389469174836,2025-04-24 23:47:49.859267,2025-04-24 23:47:56.367344,0 days 00:00:06.508077,24.187598740102874,0.021836180801799235,0.003554601055934239,linear,TPESampler,COMPLETE
1280,0.14967676807645958,2025-04-24 23:47:50.148258,2025-04-24 23:48:16.617598,0 days 00:00:26.469340,88.4098234539118,0.025168996629431818,0.0013924305201310834,linear,TPESampler,COMPLETE
1281,0.15431757181572964,2025-04-24 23:47:56.679422,2025-04-24 23:48:18.704695,0 days 00:00:22.025273,88.46825129623197,0.044566469660134944,0.006042014391673421,linear,TPESampler,COMPLETE
1282,0.1546973977180061,2025-04-24 23:47:57.931130,2025-04-24 23:48:03.008237,0 days 00:00:05.077107,16.01698804305699,0.016328406980454728,0.0007056666936115585,linear,TPESampler,COMPLETE
1283,0.1532759422069684,2025-04-24 23:48:03.180158,2025-04-24 23:48:31.015825,0 days 00:00:27.835667,88.70782707422961,0.015080792605849139,0.0024034337032003907,linear,TPESampler,COMPLETE
1284,0.21237832612283705,2025-04-24 23:48:16.793104,2025-04-24 23:48:17.632644,0 days 00:00:00.839540,20.49127533760438,0.14950012440264424,0.001702317425047699,linear,TPESampler,COMPLETE
1285,1.7810829692889574,2025-04-24 23:48:17.810458,2025-04-25 00:08:55.517997,0 days 00:20:37.707539,68.5177866152183,0.02346793873206823,0.263268763975621,poly,TPESampler,COMPLETE
1286,0.18685353902102264,2025-04-24 23:48:18.887581,2025-04-24 23:48:19.565492,0 days 00:00:00.677911,2.7594315633322832,0.09280809813088567,0.0002022919042183659,linear,TPESampler,COMPLETE
1287,0.3285074699772185,2025-04-24 23:48:19.742722,2025-04-24 23:48:20.591882,0 days 00:00:00.849160,99.59612591005404,0.022350258271718652,0.006534995755675204,rbf,TPESampler,COMPLETE
1288,1.4120491228341314,2025-04-24 23:48:20.773370,2025-04-24 23:48:21.390826,0 days 00:00:00.617456,24.32824751935012,0.055295917626946654,0.00011998432264489848,poly,TPESampler,COMPLETE
1289,0.15291726942404615,2025-04-24 23:48:21.578415,2025-04-24 23:48:25.569701,0 days 00:00:03.991286,22.217657446757634,0.042977574858315264,0.00044004891723495207,linear,TPESampler,COMPLETE
1290,0.14914760420818343,2025-04-24 23:48:25.754400,2025-04-24 23:48:49.463566,0 days 00:00:23.709166,96.29898623355199,0.02922381369792143,0.002011135937795736,linear,TPESampler,COMPLETE
1291,0.15867527708096107,2025-04-24 23:48:31.252339,2025-04-24 23:48:42.543644,0 days 00:00:11.291305,87.9500146715658,0.07430871053623883,0.39708928117031617,linear,TPESampler,COMPLETE
1292,0.15063234029540973,2025-04-24 23:48:42.727720,2025-04-24 23:48:47.552747,0 days 00:00:04.825027,15.397165662402566,0.03727400449303367,0.18939427399119044,linear,TPESampler,COMPLETE
1293,0.15124547316496806,2025-04-24 23:48:47.740446,2025-04-24 23:48:52.601961,0 days 00:00:04.861515,14.74133856853548,0.026156934149261582,0.0019842295707890845,linear,TPESampler,COMPLETE
1294,0.15485743477227965,2025-04-24 23:48:49.655071,2025-04-24 23:49:29.326887,0 days 00:00:39.671816,95.86162023212191,0.00947733000285733,0.0017292068123650954,linear,TPESampler,COMPLETE
1295,0.15396858916894482,2025-04-24 23:48:52.786823,2025-04-24 23:48:59.955599,0 days 00:00:07.168776,19.971569156497345,0.016494432958743005,0.0006636128289544003,linear,TPESampler,COMPLETE
1296,0.15071051791051518,2025-04-24 23:49:00.137026,2025-04-24 23:49:25.695454,0 days 00:00:25.558428,97.91786748090497,0.017509028611421625,0.002346485482045834,linear,TPESampler,COMPLETE
1297,0.1529831928407812,2025-04-24 23:49:25.881811,2025-04-24 23:49:34.496983,0 days 00:00:08.615172,19.762607317772652,0.018005963725335524,0.01029668069555975,linear,TPESampler,COMPLETE
1298,0.1977056107227424,2025-04-24 23:49:29.528930,2025-04-24 23:49:30.884553,0 days 00:00:01.355623,15.104196567138551,0.12929169438697957,0.00314953600979478,linear,TPESampler,COMPLETE
1299,0.15569973932744746,2025-04-24 23:49:31.067071,2025-04-24 23:49:35.754289,0 days 00:00:04.687218,17.59328639928487,0.04614989364834113,0.00016259785202383617,linear,TPESampler,COMPLETE
1300,0.15502108488097627,2025-04-24 23:49:34.701111,2025-04-24 23:49:36.120645,0 days 00:00:01.419534,3.1550227782189126,0.02385035993272678,0.0021558873147062996,linear,TPESampler,COMPLETE
1301,1567.048228514523,2025-04-24 23:49:35.935705,2025-04-24 23:49:36.421459,0 days 00:00:00.485754,69.44323306805698,0.029959049352635946,0.35621288721755456,sigmoid,TPESampler,COMPLETE
1302,0.7367364436140654,2025-04-24 23:49:36.354722,2025-04-24 23:49:36.837208,0 days 00:00:00.482486,0.05676429173826316,0.08998167723756179,0.025429823292182567,poly,TPESampler,COMPLETE
1303,0.7051547598341608,2025-04-24 23:49:36.624276,2025-04-24 23:49:37.135126,0 days 00:00:00.510850,0.31016470159820675,0.2686992490774121,0.0015539739762576964,sigmoid,TPESampler,COMPLETE
1304,0.1499666719283751,2025-04-24 23:49:37.067132,2025-04-24 23:50:00.768187,0 days 00:00:23.701055,92.25277787319204,0.020901169375614176,0.23852961552619908,linear,TPESampler,COMPLETE
1305,0.29535155250723194,2025-04-24 23:49:37.330620,2025-04-24 23:49:37.865850,0 days 00:00:00.535230,99.00054755257014,0.09889252371756921,0.0055323157669379995,rbf,TPESampler,COMPLETE
1306,0.16424834400978494,2025-04-24 23:49:38.237357,2025-04-24 23:49:42.655374,0 days 00:00:04.418017,99.95820801153563,0.08440186074393094,0.001120389313193004,linear,TPESampler,COMPLETE
1307,0.14968486977462386,2025-04-24 23:49:42.868493,2025-04-24 23:50:17.400632,0 days 00:00:34.532139,94.72556712379809,0.025901104414091818,0.00634713766886303,linear,TPESampler,COMPLETE
1308,0.16667492091730074,2025-04-24 23:50:00.992426,2025-04-24 23:50:03.265140,0 days 00:00:02.272714,15.726190626671865,0.06471730141222934,0.0008509567894090355,linear,TPESampler,COMPLETE
1309,0.15121145804057134,2025-04-24 23:50:03.444930,2025-04-24 23:50:06.642936,0 days 00:00:03.198006,13.044163724947179,0.03689357357754444,0.0012723841346518872,linear,TPESampler,COMPLETE
1310,0.1496033642592525,2025-04-24 23:50:06.860184,2025-04-24 23:50:27.636982,0 days 00:00:20.776798,95.46427644507705,0.02390968215017549,0.00017083589811824691,linear,TPESampler,COMPLETE
1311,0.22730804263110202,2025-04-24 23:50:17.629146,2025-04-24 23:50:18.432917,0 days 00:00:00.803771,18.171410431961046,0.17469798579716012,0.08478771397183416,linear,TPESampler,COMPLETE
1312,0.1550911786331777,2025-04-24 23:50:18.620682,2025-04-24 23:50:24.986707,0 days 00:00:06.366025,17.71363837651441,0.006457064127125778,0.007560462016932061,linear,TPESampler,COMPLETE
1313,0.16172850424692542,2025-04-24 23:50:25.172561,2025-04-24 23:50:27.884052,0 days 00:00:02.711491,17.103541132187217,0.0568900858631349,0.0048984272455063595,linear,TPESampler,COMPLETE
1314,438.6239404695942,2025-04-24 23:50:27.829589,2025-04-24 23:50:28.525281,0 days 00:00:00.695692,23.654888707935857,0.7148174306940125,0.8450545182755672,sigmoid,TPESampler,COMPLETE
1315,0.15363632870770155,2025-04-24 23:50:28.140210,2025-04-24 23:50:59.564208,0 days 00:00:31.423998,98.18847843653089,0.008717240237584318,0.019510434459393555,linear,TPESampler,COMPLETE
1316,0.6327027704608615,2025-04-24 23:50:28.749428,2025-04-24 23:50:29.359010,0 days 00:00:00.609582,4.877954400291862,0.0010283297285214187,0.148938120916607,rbf,TPESampler,COMPLETE
1317,0.16027319215253064,2025-04-24 23:50:29.587154,2025-04-24 23:50:37.719939,0 days 00:00:08.132785,95.70453461007973,0.07612132463778146,0.00043523875298148105,linear,TPESampler,COMPLETE
1318,0.41503207040985063,2025-04-24 23:50:37.909720,2025-04-24 23:50:38.387286,0 days 00:00:00.477566,0.07009771165834171,0.5207403338829996,0.9672412205128634,linear,TPESampler,COMPLETE
1319,0.16907893655388198,2025-04-24 23:50:38.572349,2025-04-24 23:50:40.711589,0 days 00:00:02.139240,31.847497811255163,0.09019098822407487,0.0031194271424666727,linear,TPESampler,COMPLETE
1320,0.16159352887696457,2025-04-24 23:50:40.898103,2025-04-24 23:50:51.825179,0 days 00:00:10.927076,91.98036397362486,0.05665606146113355,0.004465290294505054,linear,TPESampler,COMPLETE
1321,0.15100645558260117,2025-04-24 23:50:52.007030,2025-04-24 23:51:16.622925,0 days 00:00:24.615895,96.40133077355067,0.017770085414477676,0.003185416519314107,linear,TPESampler,COMPLETE
1322,0.14919444883608907,2025-04-24 23:50:59.753800,2025-04-24 23:51:03.194468,0 days 00:00:03.440668,16.817990578094552,0.033201450083172684,0.9918884769225647,linear,TPESampler,COMPLETE
1323,0.14873215226183975,2025-04-24 23:51:03.381117,2025-04-24 23:51:18.313380,0 days 00:00:14.932263,98.8589070477777,0.034509178938336584,0.000757720960803286,linear,TPESampler,COMPLETE
1324,0.15052350622761096,2025-04-24 23:51:16.812994,2025-04-24 23:51:23.254546,0 days 00:00:06.441552,19.776818040779915,0.020544623129214578,0.0006311017063368174,linear,TPESampler,COMPLETE
1325,0.1517337305608051,2025-04-24 23:51:18.499597,2025-04-24 23:51:21.739148,0 days 00:00:03.239551,10.518611818164622,0.02224729075039555,0.006239581643813785,linear,TPESampler,COMPLETE
1326,0.1549960570460404,2025-04-24 23:51:21.930457,2025-04-24 23:51:24.745120,0 days 00:00:02.814663,11.460746722689251,0.016958947077438058,0.1798093635089642,linear,TPESampler,COMPLETE
1327,0.1714604933401197,2025-04-24 23:51:23.579605,2025-04-24 23:51:28.297986,0 days 00:00:04.718381,97.63004408758081,0.10188151987652024,0.0032247236384059905,linear,TPESampler,COMPLETE
1328,0.15087827133099568,2025-04-24 23:51:24.920390,2025-04-24 23:51:29.824263,0 days 00:00:04.903873,18.248047070548495,0.020454510850148513,0.0021215812079308513,linear,TPESampler,COMPLETE
1329,0.4430347782873158,2025-04-24 23:51:28.516058,2025-04-24 23:51:29.104169,0 days 00:00:00.588111,13.39336910659889,0.0838082963094262,0.0003598529439751766,sigmoid,TPESampler,COMPLETE
1330,0.1538685233390116,2025-04-24 23:51:29.284810,2025-04-24 23:52:06.489746,0 days 00:00:37.204936,94.27294121387725,0.0067671761554647355,0.00489247854571318,linear,TPESampler,COMPLETE
1331,0.36618578718059397,2025-04-24 23:51:30.007777,2025-04-24 23:51:30.907154,0 days 00:00:00.899377,83.76803112549217,0.35490573214563925,0.09151980640926087,linear,TPESampler,COMPLETE
1332,2.171073299465071,2025-04-24 23:51:31.091070,2025-04-24 23:51:31.639678,0 days 00:00:00.548608,0.09019549542001795,0.008895421613661865,0.03502750103724129,sigmoid,TPESampler,COMPLETE
1333,0.162058008783979,2025-04-24 23:51:31.817574,2025-04-24 23:51:33.678568,0 days 00:00:01.860994,11.612761172665918,0.06774529552632907,0.22990286579830585,linear,TPESampler,COMPLETE
1334,0.15395044159270918,2025-04-24 23:51:33.850853,2025-04-24 23:52:06.019096,0 days 00:00:32.168243,82.21020931667155,0.010715267263310582,0.00021432117754537232,linear,TPESampler,COMPLETE
1335,0.1644170296565873,2025-04-24 23:52:06.204822,2025-04-24 23:52:07.940480,0 days 00:00:01.735658,30.131621306203883,0.08544678170905431,0.06048313480302646,linear,TPESampler,COMPLETE
1336,0.15448866938513034,2025-04-24 23:52:06.691498,2025-04-24 23:52:12.902217,0 days 00:00:06.210719,18.205902403912695,0.006698615706487142,0.0002386753743515025,linear,TPESampler,COMPLETE
1337,0.15491138397890247,2025-04-24 23:52:08.133089,2025-04-24 23:52:15.726678,0 days 00:00:07.593589,17.02517419645565,0.010974565275502444,0.0027283959963121038,linear,TPESampler,COMPLETE
1338,0.1607357751421197,2025-04-24 23:52:13.102015,2025-04-24 23:52:23.458109,0 days 00:00:10.356094,96.58094773356672,0.05569436973080114,0.04789470945417834,linear,TPESampler,COMPLETE
1339,0.15035496525533554,2025-04-24 23:52:15.919112,2025-04-24 23:52:36.541555,0 days 00:00:20.622443,95.30470552766087,0.01962448708608347,0.7452969639820245,linear,TPESampler,COMPLETE
1340,0.1547570205494705,2025-04-24 23:52:23.647762,2025-04-24 23:52:27.951642,0 days 00:00:04.303880,18.93708090544971,0.045050056261574836,0.0018132239856940248,linear,TPESampler,COMPLETE
1341,0.20079759499790453,2025-04-24 23:52:28.143117,2025-04-24 23:52:28.707920,0 days 00:00:00.564803,59.30594145971483,0.025066571547479308,0.0013982904594864844,rbf,TPESampler,COMPLETE
1342,0.15374042837546853,2025-04-24 23:52:28.909952,2025-04-24 23:53:02.359940,0 days 00:00:33.449988,96.19865130047597,0.015171986422414728,0.0011726338765422832,linear,TPESampler,COMPLETE
1343,0.15743072915337417,2025-04-24 23:52:36.783252,2025-04-24 23:52:51.064800,0 days 00:00:14.281548,83.42479889597398,0.05329608111424254,0.12951761832528383,linear,TPESampler,COMPLETE
1344,0.1556640911608269,2025-04-24 23:52:51.399037,2025-04-24 23:53:14.138033,0 days 00:00:22.738996,92.10369499063569,0.04619865161773496,0.007264889600432321,linear,TPESampler,COMPLETE
1345,0.14996089617940217,2025-04-24 23:53:02.561629,2025-04-24 23:53:20.093803,0 days 00:00:17.532174,97.95401399513615,0.025614178002500692,0.255224190370929,linear,TPESampler,COMPLETE
1346,0.1498456655217819,2025-04-24 23:53:14.324578,2025-04-24 23:53:19.867934,0 days 00:00:05.543356,23.16026940793089,0.02943740964947945,0.0006980145791901543,linear,TPESampler,COMPLETE
1347,0.48435852003149094,2025-04-24 23:53:20.050360,2025-04-24 23:53:20.474772,0 days 00:00:00.424412,80.87806740024092,0.02599673358885352,0.0034540573038609446,poly,TPESampler,COMPLETE
1348,0.14977536301719072,2025-04-24 23:53:20.278355,2025-04-24 23:53:40.803846,0 days 00:00:20.525491,92.00261318129732,0.026345116729039844,0.0009448863343344443,linear,TPESampler,COMPLETE
1349,0.16294961338225697,2025-04-24 23:53:20.852416,2025-04-24 23:53:23.311118,0 days 00:00:02.458702,23.740713713154253,0.08062850293680031,0.005248065746104981,linear,TPESampler,COMPLETE
1350,0.1629778287789907,2025-04-24 23:53:23.593683,2025-04-24 23:53:39.741490,0 days 00:00:16.147807,99.01997111636743,0.05775990778738896,0.0008746961977792712,linear,TPESampler,COMPLETE
1351,0.5339592338444973,2025-04-24 23:53:39.956992,2025-04-24 23:53:45.466639,0 days 00:00:05.509647,71.0322998992881,0.029944138036387687,0.030199738073008176,poly,TPESampler,COMPLETE
1352,0.1506631469122311,2025-04-24 23:53:41.015125,2025-04-24 23:53:44.702131,0 days 00:00:03.687006,19.408598731999337,0.02748588975619218,0.003717913214501051,linear,TPESampler,COMPLETE
1353,0.14857475644164964,2025-04-24 23:53:44.903150,2025-04-24 23:53:56.436622,0 days 00:00:11.533472,84.19461372207603,0.034022887009875935,0.0027888329177317562,linear,TPESampler,COMPLETE
1354,0.15378552637942458,2025-04-24 23:53:45.663669,2025-04-24 23:54:26.789665,0 days 00:00:41.125996,94.25788241958713,0.006879472409953992,0.1503240178793273,linear,TPESampler,COMPLETE
1355,0.1535874520944926,2025-04-24 23:53:56.681649,2025-04-24 23:54:33.623490,0 days 00:00:36.941841,97.82101933321533,0.008251363521793197,0.0015588771766267648,linear,TPESampler,COMPLETE
1356,0.16132762305109968,2025-04-24 23:54:26.987142,2025-04-24 23:54:40.480821,0 days 00:00:13.493679,99.07049196644054,0.05646913027445768,0.09172319406330467,linear,TPESampler,COMPLETE
1357,1.414913594576376,2025-04-24 23:54:33.807799,2025-04-24 23:54:34.346511,0 days 00:00:00.538712,0.001068742720519763,0.15820493997955076,0.00039008956501822983,rbf,TPESampler,COMPLETE
1358,0.15013802089748643,2025-04-24 23:54:34.534542,2025-04-24 23:54:57.074574,0 days 00:00:22.540032,98.27309656189455,0.026060499066589117,0.0048612936992929005,linear,TPESampler,COMPLETE
1359,0.21218829252752203,2025-04-24 23:54:40.685919,2025-04-24 23:54:41.275224,0 days 00:00:00.589305,84.33341349348466,0.08534017448992917,0.001539545881474377,rbf,TPESampler,COMPLETE
1360,0.1669075445172071,2025-04-24 23:54:41.475395,2025-04-24 23:54:43.938401,0 days 00:00:02.463006,23.85107247047553,0.08906858527291056,0.0009606949846656898,linear,TPESampler,COMPLETE
1361,0.1548747258439395,2025-04-24 23:54:44.132975,2025-04-24 23:54:51.781857,0 days 00:00:07.648882,25.06107656124128,0.04512893080317588,0.004928882892887866,linear,TPESampler,COMPLETE
1362,0.15035370022244637,2025-04-24 23:54:51.967560,2025-04-24 23:54:56.845009,0 days 00:00:04.877449,23.02028439971583,0.026519340424466978,0.06159832981218516,linear,TPESampler,COMPLETE
1363,0.448463147155673,2025-04-24 23:54:57.030573,2025-04-24 23:54:57.410066,0 days 00:00:00.379493,0.822222490855698,0.6862928835605698,0.0015230288371631258,linear,TPESampler,COMPLETE
1364,0.15502864521655016,2025-04-24 23:54:57.276874,2025-04-24 23:55:03.204474,0 days 00:00:05.927600,17.96731984828665,0.015064166228794982,0.012087250610485524,linear,TPESampler,COMPLETE
1365,0.15408872513849453,2025-04-24 23:54:57.599129,2025-04-24 23:55:28.851289,0 days 00:00:31.252160,95.06385025111199,0.01475006537670375,0.000888756207371545,linear,TPESampler,COMPLETE
1366,1.413925613936199,2025-04-24 23:55:03.393298,2025-04-24 23:55:03.930687,0 days 00:00:00.537389,0.0019338670523589363,0.005937541720136588,0.0001296444459279038,sigmoid,TPESampler,COMPLETE
1367,1.3609326022933121,2025-04-24 23:55:04.119935,2025-04-24 23:55:04.671571,0 days 00:00:00.551636,0.012877907854710779,0.0014091003288212378,0.0007415020633085607,rbf,TPESampler,COMPLETE
1368,0.8619281094657267,2025-04-24 23:55:04.856872,2025-04-24 23:55:05.386311,0 days 00:00:00.529439,20.129082932422275,0.008976999812262446,0.0008118068629550137,poly,TPESampler,COMPLETE
1369,0.14856207056919682,2025-04-24 23:55:05.562268,2025-04-24 23:55:19.412044,0 days 00:00:13.849776,99.5377979883148,0.03404498335129059,0.0004432825037683172,linear,TPESampler,COMPLETE
1370,0.5542000631282915,2025-04-24 23:55:19.620688,2025-04-24 23:55:20.362578,0 days 00:00:00.741890,69.43335940448493,0.02427667024706991,0.09050074754158646,rbf,TPESampler,COMPLETE
1371,1.1298418697333878,2025-04-24 23:55:20.553067,2025-04-24 23:55:21.189149,0 days 00:00:00.636082,92.01263328834959,0.13402261466059262,0.00032312049407668905,poly,TPESampler,COMPLETE
1372,0.16131400771991627,2025-04-24 23:55:21.430024,2025-04-24 23:55:24.179470,0 days 00:00:02.749446,21.052386023045784,0.05599191889665196,0.29403629842611123,linear,TPESampler,COMPLETE
1373,0.14939844235326263,2025-04-24 23:55:24.369565,2025-04-24 23:55:43.415810,0 days 00:00:19.046245,91.3804362469775,0.02876105911210143,0.00048029792061417476,linear,TPESampler,COMPLETE
1374,0.15228479293950895,2025-04-24 23:55:29.055097,2025-04-24 23:55:59.518225,0 days 00:00:30.463128,77.59973730277729,0.01818287030294415,0.023016226649302425,linear,TPESampler,COMPLETE
1375,0.1536524731169579,2025-04-24 23:55:43.604155,2025-04-24 23:55:48.288153,0 days 00:00:04.683998,22.18992496346513,0.043684526487459706,0.0030553749133283843,linear,TPESampler,COMPLETE
1376,1.5300298330251119,2025-04-24 23:55:48.484745,2025-04-24 23:55:48.978245,0 days 00:00:00.493500,0.04550527992393969,0.983624783247944,0.9759502946925805,sigmoid,TPESampler,COMPLETE
1377,0.1506065768801802,2025-04-24 23:55:49.162936,2025-04-24 23:55:53.748373,0 days 00:00:04.585437,20.193290527952627,0.03677739247796398,0.018660636771694605,linear,TPESampler,COMPLETE
1378,0.1509176680095731,2025-04-24 23:55:53.945790,2025-04-24 23:56:00.299959,0 days 00:00:06.354169,19.2724100952867,0.026400272049893998,0.0008457485678881534,linear,TPESampler,COMPLETE
1379,0.1601685990670358,2025-04-24 23:55:59.711860,2025-04-24 23:56:00.781182,0 days 00:00:01.069322,1.6088992814072993,0.006527526763492078,0.002397213608161446,linear,TPESampler,COMPLETE
1380,0.15231790703853143,2025-04-24 23:56:00.496389,2025-04-24 23:56:20.595307,0 days 00:00:20.098918,99.77034941466566,0.04224053968957794,0.78879276490495,linear,TPESampler,COMPLETE
1381,0.1595519763401921,2025-04-24 23:56:01.009168,2025-04-24 23:56:07.525113,0 days 00:00:06.515945,89.14953294937453,0.0755078828388092,0.0025206097040388104,linear,TPESampler,COMPLETE
1382,0.15410889964595928,2025-04-24 23:56:07.717335,2025-04-24 23:56:18.256114,0 days 00:00:10.538779,26.447037963261675,0.007958129495031944,0.0032660639070555765,linear,TPESampler,COMPLETE
1383,0.15226445291000051,2025-04-24 23:56:18.454258,2025-04-24 23:56:39.706107,0 days 00:00:21.251849,95.97312610817778,0.04188460849670088,0.019385621098190205,linear,TPESampler,COMPLETE
1384,0.14922520624333466,2025-04-24 23:56:20.781130,2025-04-24 23:56:36.216884,0 days 00:00:15.435754,95.96690169977884,0.03540781555677879,0.014266437060330114,linear,TPESampler,COMPLETE
1385,0.856861219665615,2025-04-24 23:56:36.397817,2025-04-24 23:56:36.919462,0 days 00:00:00.521645,15.436512094872262,0.04073452573314913,0.0010269653932783833,poly,TPESampler,COMPLETE
1386,0.1493868488950499,2025-04-24 23:56:37.104865,2025-04-24 23:56:42.408793,0 days 00:00:05.303928,22.388868825549594,0.03472867241075675,0.00044989645453246286,linear,TPESampler,COMPLETE
1387,97.92664771948833,2025-04-24 23:56:39.885375,2025-04-24 23:56:40.416423,0 days 00:00:00.531048,6.555900425976667,0.001305155671219211,0.029472074481129186,sigmoid,TPESampler,COMPLETE
1388,0.14864126645038986,2025-04-24 23:56:40.598663,2025-04-24 23:56:56.389003,0 days 00:00:15.790340,92.97195980108351,0.03408396598450756,0.001188312687481025,linear,TPESampler,COMPLETE
1389,0.1485790968096154,2025-04-24 23:56:42.590481,2025-04-24 23:57:01.956652,0 days 00:00:19.366171,97.48875126772126,0.031856087247630414,0.19159982100172102,linear,TPESampler,COMPLETE
1390,0.16438527882066212,2025-04-24 23:56:56.578713,2025-04-24 23:57:09.082787,0 days 00:00:12.504074,97.15012762560846,0.06512813853327849,0.0003700324079941109,linear,TPESampler,COMPLETE
1391,0.9257932759502706,2025-04-24 23:57:02.150633,2025-04-24 23:57:02.683966,0 days 00:00:00.533333,0.13044337859956007,0.10714103800938259,0.05486248825504584,rbf,TPESampler,COMPLETE
1392,0.1631115170024578,2025-04-24 23:57:02.876538,2025-04-24 23:57:15.531873,0 days 00:00:12.655335,97.33727503027984,0.05983985138787646,0.0010088882829100143,linear,TPESampler,COMPLETE
1393,0.29577724044909054,2025-04-24 23:57:09.293749,2025-04-24 23:57:10.408481,0 days 00:00:01.114732,22.72951090768442,0.0361804306340664,0.0005716745256112022,rbf,TPESampler,COMPLETE
1394,0.15215227133758605,2025-04-24 23:57:10.958231,2025-04-24 23:57:35.630041,0 days 00:00:24.671810,92.0457539022119,0.01595528930162244,0.11100823271632185,linear,TPESampler,COMPLETE
