number,value,datetime_start,datetime_complete,duration,params_C,params_epsilon,params_gamma,params_kernel,system_attrs_auto:sampler,state
2090,0.15610179539179023,2025-04-25 01:24:17.070501,2025-04-25 01:24:19.065729,0 days 00:00:01.995228,4.542508286453012,0.009561641929321156,0.6732324380725915,linear,TPESampler,COMPLETE
2091,0.15483288767535205,2025-04-25 01:24:19.245960,2025-04-25 01:24:27.188533,0 days 00:00:07.942573,20.53390383476406,0.012557079289202315,0.1767678128313292,linear,TPESampler,COMPLETE
2092,0.20054963356024072,2025-04-25 01:24:19.917363,2025-04-25 01:24:20.474229,0 days 00:00:00.556866,88.09555211355894,0.03164823284287412,0.001533970922976638,rbf,TPESampler,COMPLETE
2093,0.9921705603796631,2025-04-25 01:24:20.657384,2025-04-25 01:24:21.170219,0 days 00:00:00.512835,62.081131729697894,0.08936679194274849,0.8962342100760989,rbf,TPESampler,COMPLETE
2094,0.15229086702895608,2025-04-25 01:24:21.369073,2025-04-25 01:24:24.576405,0 days 00:00:03.207332,18.028233427587942,0.04235786157025466,0.3846495097680726,linear,TPESampler,COMPLETE
2095,0.5084039094832093,2025-04-25 01:24:24.754720,2025-04-25 01:25:36.955056,0 days 00:01:12.200336,62.218545113752675,0.003182619687388965,0.061103955787128135,poly,TPESampler,COMPLETE
2096,0.15331655071458455,2025-04-25 01:24:27.375928,2025-04-25 01:25:05.815319,0 days 00:00:38.439391,94.10611039242156,0.009867876667279521,0.09713458712687109,linear,TPESampler,COMPLETE
2097,0.149509393415864,2025-04-25 01:25:06.005391,2025-04-25 01:25:22.694428,0 days 00:00:16.689037,70.99097967657032,0.023771127955344806,0.19431945215803903,linear,TPESampler,COMPLETE
2098,0.15164146755890814,2025-04-25 01:25:22.883740,2025-04-25 01:25:33.501845,0 days 00:00:10.618105,72.18593593835686,0.03965212560870872,0.18114939282448583,linear,TPESampler,COMPLETE
2099,0.4891497053747375,2025-04-25 01:25:33.717454,2025-04-25 01:25:34.246358,0 days 00:00:00.528904,22.154241310012985,0.06921707862301896,0.05947760757265177,rbf,TPESampler,COMPLETE
2100,0.16363582651569525,2025-04-25 01:25:34.437945,2025-04-25 01:25:36.109483,0 days 00:00:01.671538,18.34361427388195,0.08152734708992576,0.014061246219402693,linear,TPESampler,COMPLETE
2101,0.17285016375902928,2025-04-25 01:25:36.302804,2025-04-25 01:25:38.076430,0 days 00:00:01.773626,33.1420904620401,0.10026572672671008,0.9785479580333132,linear,TPESampler,COMPLETE
2102,0.1640211920527287,2025-04-25 01:25:37.146957,2025-04-25 01:25:50.947536,0 days 00:00:13.800579,93.44081779983007,0.06430832644077969,0.5873426118768007,linear,TPESampler,COMPLETE
2103,1.3240908202259647,2025-04-25 01:25:38.311272,2025-04-25 01:30:19.208901,0 days 00:04:40.897629,83.76214297571917,0.009308197141924867,0.12279924855018257,poly,TPESampler,COMPLETE
2104,0.15269183162243333,2025-04-25 01:25:51.135357,2025-04-25 01:25:57.852917,0 days 00:00:06.717560,19.632019952640004,0.018125374632063516,0.006534270298697058,linear,TPESampler,COMPLETE
2105,0.14990441398298893,2025-04-25 01:25:58.037864,2025-04-25 01:26:03.529441,0 days 00:00:05.491577,22.00797587808312,0.022039279673775506,0.4438510095618771,linear,TPESampler,COMPLETE
2106,0.9183253082084015,2025-04-25 01:26:03.714887,2025-04-25 01:26:04.229879,0 days 00:00:00.514992,0.0017082007002675312,0.05807181921685358,0.015941034726965557,poly,TPESampler,COMPLETE
2107,0.15651692128379632,2025-04-25 01:26:04.417075,2025-04-25 01:26:24.233366,0 days 00:00:19.816291,95.46806990622544,0.04714264941971182,0.021671266771472353,linear,TPESampler,COMPLETE
2108,0.1488674259491751,2025-04-25 01:26:24.420080,2025-04-25 01:26:39.165251,0 days 00:00:14.745171,94.43863641277967,0.034481532204190375,0.7186890380233207,linear,TPESampler,COMPLETE
2109,0.15702604509534795,2025-04-25 01:26:39.346214,2025-04-25 01:26:42.929788,0 days 00:00:03.583574,7.90213097638007,0.002395329480509808,0.0048968689988524,linear,TPESampler,COMPLETE
2110,0.15789725633215512,2025-04-25 01:26:43.112092,2025-04-25 01:26:48.258043,0 days 00:00:05.145951,33.99975271835772,0.051034881015206285,0.15941720115028193,linear,TPESampler,COMPLETE
2111,0.3100177159062848,2025-04-25 01:26:48.441254,2025-04-25 01:26:48.974916,0 days 00:00:00.533662,0.07797595992757031,0.0020152856454476726,0.00010618653977675128,linear,TPESampler,COMPLETE
2112,0.15073679081899313,2025-04-25 01:26:49.162459,2025-04-25 01:26:52.197253,0 days 00:00:03.034794,14.812162926921513,0.027192717261610874,0.09122374753064505,linear,TPESampler,COMPLETE
2113,0.14954802467381884,2025-04-25 01:26:52.390150,2025-04-25 01:27:06.702837,0 days 00:00:14.312687,97.54096660083437,0.03669409729612961,0.12467914685609034,linear,TPESampler,COMPLETE
2114,0.14857074890085578,2025-04-25 01:27:06.890676,2025-04-25 01:27:22.125804,0 days 00:00:15.235128,97.02763722191453,0.03222292429870124,0.11776783036199459,linear,TPESampler,COMPLETE
2115,0.17358293449010292,2025-04-25 01:27:22.310203,2025-04-25 01:27:26.413834,0 days 00:00:04.103631,96.42802159246345,0.10689292585751313,0.0028503320969770272,linear,TPESampler,COMPLETE
2116,0.16794329529450575,2025-04-25 01:27:26.599607,2025-04-25 01:27:27.416367,0 days 00:00:00.816760,3.8879865189199827,0.05804874769070912,0.03408381171212408,linear,TPESampler,COMPLETE
2117,0.1547577855296528,2025-04-25 01:27:27.601196,2025-04-25 01:27:36.865651,0 days 00:00:09.264455,25.445544649366006,0.012539573274880799,0.04761236407907452,linear,TPESampler,COMPLETE
2118,0.15191298208761142,2025-04-25 01:27:37.061509,2025-04-25 01:28:05.438718,0 days 00:00:28.377209,91.13754350573875,0.01806874359178896,0.3977523809555544,linear,TPESampler,COMPLETE
2119,0.15008746666583378,2025-04-25 01:28:05.631804,2025-04-25 01:28:27.232921,0 days 00:00:21.601117,97.75672937454746,0.027062196726557942,0.15017897701591687,linear,TPESampler,COMPLETE
2120,0.15064322011862388,2025-04-25 01:28:27.492263,2025-04-25 01:28:37.331901,0 days 00:00:09.839638,54.9209067595581,0.03834089155506019,0.004202651493429225,linear,TPESampler,COMPLETE
2121,0.15533469835272468,2025-04-25 01:28:37.574920,2025-04-25 01:28:39.204945,0 days 00:00:01.630025,4.258800579332294,0.019090916644273245,0.07805952324265236,linear,TPESampler,COMPLETE
2122,0.15855246774156034,2025-04-25 01:28:39.389083,2025-04-25 01:28:48.561422,0 days 00:00:09.172339,33.794336676752216,0.05094542716669565,0.007791529739571021,linear,TPESampler,COMPLETE
2123,0.14937662914809788,2025-04-25 01:28:48.745362,2025-04-25 01:28:53.752613,0 days 00:00:05.007251,25.3759601535171,0.032173499256029664,0.010016548818725596,linear,TPESampler,COMPLETE
2124,0.1540142901781468,2025-04-25 01:28:53.944525,2025-04-25 01:29:29.116785,0 days 00:00:35.172260,78.59343036590832,0.0071915493112584454,0.033907941449331236,linear,TPESampler,COMPLETE
2125,0.15329769537016186,2025-04-25 01:29:29.304764,2025-04-25 01:30:08.798274,0 days 00:00:39.493510,93.68256299557375,0.008508052617790359,0.0042846464070444455,linear,TPESampler,COMPLETE
2126,0.1641681682693941,2025-04-25 01:30:08.993909,2025-04-25 01:30:11.915444,0 days 00:00:02.921535,18.357068030806914,0.06262687784878826,0.004208571736371356,linear,TPESampler,COMPLETE
2127,0.15062268225681807,2025-04-25 01:30:12.140325,2025-04-25 01:30:17.557949,0 days 00:00:05.417624,18.22401339821642,0.020887321365869658,0.002671843755758442,linear,TPESampler,COMPLETE
2128,0.15019159264742143,2025-04-25 01:30:17.751712,2025-04-25 01:30:23.540942,0 days 00:00:05.789230,24.444145896728482,0.022286192528895042,0.005028200769028669,linear,TPESampler,COMPLETE
2129,0.17943586086456684,2025-04-25 01:30:19.394765,2025-04-25 01:30:21.042724,0 days 00:00:01.647959,21.20955521287684,0.10446939765180037,0.2495857649710805,linear,TPESampler,COMPLETE
2130,0.1485745988117817,2025-04-25 01:30:21.225380,2025-04-25 01:30:37.272590,0 days 00:00:16.047210,88.25766242964572,0.031191653033520426,0.46939141893828024,linear,TPESampler,COMPLETE
2131,0.15578735730329532,2025-04-25 01:30:23.732661,2025-04-25 01:30:43.373822,0 days 00:00:19.641161,81.43841816196277,0.04632814294336178,0.005001271561289701,linear,TPESampler,COMPLETE
2132,0.16274903219335743,2025-04-25 01:30:37.484252,2025-04-25 01:30:41.071562,0 days 00:00:03.587310,18.16944055216487,0.06001233095224421,0.001744585709882929,linear,TPESampler,COMPLETE
2133,0.14948160674851307,2025-04-25 01:30:41.260354,2025-04-25 01:30:45.641458,0 days 00:00:04.381104,30.478756762539938,0.032647836116246644,0.0022108346137652067,linear,TPESampler,COMPLETE
2134,0.5081315477990878,2025-04-25 01:30:43.565047,2025-04-25 01:30:44.096925,0 days 00:00:00.531878,0.017898130644287878,0.002710421385807272,0.05501101020496718,poly,TPESampler,COMPLETE
2135,0.1518262312135704,2025-04-25 01:30:44.286161,2025-04-25 01:31:03.748218,0 days 00:00:19.462057,99.53186514364633,0.040501382116692505,0.1710547266027022,linear,TPESampler,COMPLETE
2136,0.15058503879511725,2025-04-25 01:30:45.831244,2025-04-25 01:30:50.043894,0 days 00:00:04.212650,20.885166977100347,0.03623633779724273,0.03245846940967986,linear,TPESampler,COMPLETE
2137,1000.7662397434324,2025-04-25 01:30:50.227408,2025-04-25 01:30:50.756369,0 days 00:00:00.528961,83.3013528515075,0.04615100397309324,0.02102289898705207,sigmoid,TPESampler,COMPLETE
2138,0.1485535780365884,2025-04-25 01:30:50.948719,2025-04-25 01:31:13.917381,0 days 00:00:22.968662,91.29067061494109,0.030117903617126573,0.027211461157852432,linear,TPESampler,COMPLETE
2139,0.15488143362614568,2025-04-25 01:31:03.936713,2025-04-25 01:31:35.273204,0 days 00:00:31.336491,93.25104742342863,0.006148511871018843,0.0035590357443887315,linear,TPESampler,COMPLETE
2140,0.16075637600743953,2025-04-25 01:31:14.099619,2025-04-25 01:31:25.818999,0 days 00:00:11.719380,79.76818540539739,0.0559371510412942,0.0032991736973828445,linear,TPESampler,COMPLETE
2141,1.3599688714253153,2025-04-25 01:31:26.004458,2025-04-25 01:36:21.191558,0 days 00:04:55.187100,34.679422675722726,0.029228520766180138,0.17166510728995646,poly,TPESampler,COMPLETE
2142,0.15521706756138803,2025-04-25 01:31:35.587662,2025-04-25 01:31:47.676330,0 days 00:00:12.088668,32.88334860712539,0.009232412113985948,0.0014433175854990465,linear,TPESampler,COMPLETE
2143,0.15710334594733855,2025-04-25 01:31:47.865762,2025-04-25 01:31:50.226014,0 days 00:00:02.360252,19.942188327713193,0.07284361865926607,0.0010912459024440286,linear,TPESampler,COMPLETE
2144,1.2995414540896144,2025-04-25 01:31:50.413433,2025-04-25 01:31:50.941949,0 days 00:00:00.528516,0.00946027099328845,0.05320096798614271,0.005039635386907843,sigmoid,TPESampler,COMPLETE
2145,0.15028496312522413,2025-04-25 01:31:51.156260,2025-04-25 01:32:15.180695,0 days 00:00:24.024435,83.2616588040092,0.02307385706241322,0.001339214118756985,linear,TPESampler,COMPLETE
2146,0.15439928321803228,2025-04-25 01:32:15.372049,2025-04-25 01:32:19.805279,0 days 00:00:04.433230,14.81516783537143,0.016060373514516144,0.45641262422815165,linear,TPESampler,COMPLETE
2147,0.15385911434112573,2025-04-25 01:32:19.992930,2025-04-25 01:33:07.147835,0 days 00:00:47.154905,94.0576994659005,0.010362192994649848,0.3551646079364513,linear,TPESampler,COMPLETE
2148,0.1535860607386838,2025-04-25 01:33:07.368508,2025-04-25 01:33:13.549681,0 days 00:00:06.181173,27.303753311717923,0.01726399542831767,0.12595728108632925,linear,TPESampler,COMPLETE
2149,0.16051756071808515,2025-04-25 01:33:13.737344,2025-04-25 01:33:18.560696,0 days 00:00:04.823352,94.37056271647211,0.07881211483869902,0.000578821179214031,linear,TPESampler,COMPLETE
2150,0.15838241600809647,2025-04-25 01:33:18.750330,2025-04-25 01:33:31.960371,0 days 00:00:13.210041,87.76653563909186,0.0532324460754869,0.0029751293789525464,linear,TPESampler,COMPLETE
2151,0.15342248144495674,2025-04-25 01:33:32.147052,2025-04-25 01:34:07.043901,0 days 00:00:34.896849,95.95530945390891,0.010075911681262964,0.0005493850692091367,linear,TPESampler,COMPLETE
2152,0.15868196283584823,2025-04-25 01:34:07.234703,2025-04-25 01:34:27.402650,0 days 00:00:20.167947,97.53822378888603,0.05372621802223561,0.0010893320623618368,linear,TPESampler,COMPLETE
2153,0.6720568617916491,2025-04-25 01:34:27.601267,2025-04-25 01:34:28.120346,0 days 00:00:00.519079,27.427925309620395,0.02580093481629611,0.0035508781495396805,poly,TPESampler,COMPLETE
2154,0.14875791701997637,2025-04-25 01:34:28.305796,2025-04-25 01:34:50.511950,0 days 00:00:22.206154,88.25108120349259,0.03138827767115559,0.0013054524742185407,linear,TPESampler,COMPLETE
2155,0.15218267676325423,2025-04-25 01:34:50.715413,2025-04-25 01:35:11.705371,0 days 00:00:20.989958,98.99188622604005,0.042140231958799325,0.0022385468129606043,linear,TPESampler,COMPLETE
2156,0.16330985348230467,2025-04-25 01:35:11.898861,2025-04-25 01:35:13.271896,0 days 00:00:01.373035,3.053087419241203,0.048202989616244,0.1555161896453622,linear,TPESampler,COMPLETE
2157,0.15203368842772924,2025-04-25 01:35:13.466161,2025-04-25 01:35:30.222684,0 days 00:00:16.756523,97.81663882627662,0.040350212395346766,0.0008345282295331146,linear,TPESampler,COMPLETE
2158,0.1508216725657408,2025-04-25 01:35:30.411303,2025-04-25 01:35:56.505988,0 days 00:00:26.094685,96.14274890213538,0.018632029429020102,0.0014706435629173176,linear,TPESampler,COMPLETE
2159,0.21027167608036995,2025-04-25 01:35:56.691888,2025-04-25 01:35:58.193227,0 days 00:00:01.501339,58.72540579864654,0.1498153977286937,0.09368346587896574,linear,TPESampler,COMPLETE
2160,0.17148733601505023,2025-04-25 01:35:58.380022,2025-04-25 01:35:59.220650,0 days 00:00:00.840628,3.273337548856404,0.0668850872786505,0.0015375728896750796,linear,TPESampler,COMPLETE
2161,0.14874185418037136,2025-04-25 01:35:59.413153,2025-04-25 01:36:14.218970,0 days 00:00:14.805817,97.3287192914498,0.031927039097342506,0.003486078666679535,linear,TPESampler,COMPLETE
2162,0.15749750628205167,2025-04-25 01:36:14.401790,2025-04-25 01:36:31.174680,0 days 00:00:16.772890,89.38254267916531,0.04810781284760103,0.8740266837732192,linear,TPESampler,COMPLETE
2163,0.1496608099306088,2025-04-25 01:36:21.382075,2025-04-25 01:36:40.030749,0 days 00:00:18.648674,92.32861383422265,0.025088039223849296,0.013490029862168506,linear,TPESampler,COMPLETE
2164,0.1589869876518006,2025-04-25 01:36:31.367648,2025-04-25 01:36:42.705794,0 days 00:00:11.338146,95.3881056970183,0.07487120401039157,0.18307073325452355,linear,TPESampler,COMPLETE
2165,0.16941205771837084,2025-04-25 01:36:40.220582,2025-04-25 01:36:44.919368,0 days 00:00:04.698786,93.33945726582645,0.09272760801078568,0.12859390369080778,linear,TPESampler,COMPLETE
2166,0.14966201081409333,2025-04-25 01:36:42.897109,2025-04-25 01:37:09.766969,0 days 00:00:26.869860,96.74595492691275,0.024511738130285673,0.05937663398682794,linear,TPESampler,COMPLETE
2167,0.16065386742930768,2025-04-25 01:36:45.166132,2025-04-25 01:36:48.586493,0 days 00:00:03.420361,26.423219595463788,0.05581582792503224,0.03378213187488251,linear,TPESampler,COMPLETE
2168,0.15455368702098196,2025-04-25 01:36:48.772891,2025-04-25 01:37:14.521623,0 days 00:00:25.748732,92.39455891717733,0.01419288689622796,0.31229194563458046,linear,TPESampler,COMPLETE
2169,1049.2036116863233,2025-04-25 01:37:10.042245,2025-04-25 01:37:10.872061,0 days 00:00:00.829816,70.62114898537789,0.00895244698919941,0.030124983610420753,sigmoid,TPESampler,COMPLETE
2170,0.17004330601772324,2025-04-25 01:37:11.056491,2025-04-25 01:37:15.715536,0 days 00:00:04.659045,91.8695957475664,0.09225892901414068,0.00067428370879786,linear,TPESampler,COMPLETE
2171,0.15474500158618193,2025-04-25 01:37:14.707467,2025-04-25 01:37:50.840598,0 days 00:00:36.133131,92.17106418819964,0.009331706198141977,0.0024374811233495923,linear,TPESampler,COMPLETE
2172,93.88304525825085,2025-04-25 01:37:15.906688,2025-04-25 01:37:16.434684,0 days 00:00:00.527996,4.144054501089929,0.01241272957804185,0.43657414327546945,sigmoid,TPESampler,COMPLETE
2173,0.16415640219411345,2025-04-25 01:37:16.628309,2025-04-25 01:37:18.465232,0 days 00:00:01.836923,10.477812143559001,0.061838557872427674,0.4212135293660437,linear,TPESampler,COMPLETE
2174,0.1522953360448602,2025-04-25 01:37:18.657379,2025-04-25 01:37:25.832125,0 days 00:00:07.174746,21.444763866842838,0.018578075702330235,0.07333549210951217,linear,TPESampler,COMPLETE
2175,0.1541760639494016,2025-04-25 01:37:26.027254,2025-04-25 01:37:58.291880,0 days 00:00:32.264626,98.09702604604394,0.01521472847488933,0.26906569878933256,linear,TPESampler,COMPLETE
2176,0.333703292422456,2025-04-25 01:37:51.060973,2025-04-25 01:37:52.435291,0 days 00:00:01.374318,91.94416198725686,0.01724293123040363,0.00983540111376614,rbf,TPESampler,COMPLETE
2177,0.14952215774132302,2025-04-25 01:37:52.630888,2025-04-25 01:38:17.057416,0 days 00:00:24.426528,90.60181454569143,0.02503917300024649,0.004918913941576423,linear,TPESampler,COMPLETE
2178,0.17787869347577145,2025-04-25 01:37:58.480857,2025-04-25 01:37:59.874108,0 days 00:00:01.393251,19.797073294325926,0.10078192118742267,0.005554466103900428,linear,TPESampler,COMPLETE
2179,250.49589140671856,2025-04-25 01:38:00.062862,2025-04-25 01:38:00.591479,0 days 00:00:00.528617,13.072328417110942,0.10283047136016389,0.1974915359571833,sigmoid,TPESampler,COMPLETE
2180,0.15181736867063417,2025-04-25 01:38:00.774716,2025-04-25 01:38:03.433482,0 days 00:00:02.658766,11.395890184134256,0.020956921958480357,0.9959143953021989,linear,TPESampler,COMPLETE
2181,0.680212552380186,2025-04-25 01:38:03.621890,2025-04-25 01:38:04.151109,0 days 00:00:00.529219,91.12788245867199,0.049290937928947315,0.21157653320225456,rbf,TPESampler,COMPLETE
2182,0.18058537602014307,2025-04-25 01:38:04.338759,2025-04-25 01:38:06.522433,0 days 00:00:02.183674,22.353153877863427,0.10802575917028726,0.0009349780366429538,linear,TPESampler,COMPLETE
2183,0.46300361932396433,2025-04-25 01:38:06.709978,2025-04-25 01:38:07.547895,0 days 00:00:00.837917,0.0022174989245508795,0.007605329999865518,0.4166722537042606,poly,TPESampler,COMPLETE
2184,30.15465985576325,2025-04-25 01:38:07.735054,2025-04-25 01:38:08.264810,0 days 00:00:00.529756,80.00534598973724,0.0374386413474466,0.0026155616269200434,sigmoid,TPESampler,COMPLETE
2185,0.15505008587992425,2025-04-25 01:38:08.453018,2025-04-25 01:38:17.613189,0 days 00:00:09.160171,23.532156359744825,0.010446202948154583,0.006701475506498782,linear,TPESampler,COMPLETE
2186,0.15799636829145616,2025-04-25 01:38:17.247900,2025-04-25 01:38:19.074864,0 days 00:00:01.826964,4.524461263855772,0.013303963220013194,0.014222202378295343,linear,TPESampler,COMPLETE
2187,0.15003946315092848,2025-04-25 01:38:17.820987,2025-04-25 01:38:56.770221,0 days 00:00:38.949234,99.75107659334549,0.01935950022243045,0.0006264739696056521,linear,TPESampler,COMPLETE
2188,0.15638041136551906,2025-04-25 01:38:19.259585,2025-04-25 01:38:25.516673,0 days 00:00:06.257088,23.985421824777944,0.04702940773821094,0.000986604066315316,linear,TPESampler,COMPLETE
2189,0.5265619583191592,2025-04-25 01:38:25.704613,2025-04-25 01:38:26.226829,0 days 00:00:00.522216,0.0010334589531127607,0.0030299707942348588,0.0007817340471650375,linear,TPESampler,COMPLETE
2190,0.1502637934493582,2025-04-25 01:38:26.410993,2025-04-25 01:38:31.709087,0 days 00:00:05.298094,18.598233135276534,0.021558231478353434,0.002550395236722275,linear,TPESampler,COMPLETE
2191,0.1506098448143072,2025-04-25 01:38:31.898292,2025-04-25 01:38:35.824599,0 days 00:00:03.926307,20.174930470973205,0.03757128056569026,0.16830122045240462,linear,TPESampler,COMPLETE
2192,1.1221149707950249,2025-04-25 01:38:36.011153,2025-04-25 01:41:14.132664,0 days 00:02:38.121511,11.063559979409025,0.07748312045553207,0.23585432447045843,poly,TPESampler,COMPLETE
2193,0.15109269517898266,2025-04-25 01:38:56.965554,2025-04-25 01:39:00.089604,0 days 00:00:03.124050,17.582735260316255,0.03871372194114194,0.00225178606102197,linear,TPESampler,COMPLETE
2194,0.20947259326100653,2025-04-25 01:39:00.281117,2025-04-25 01:39:02.173299,0 days 00:00:01.892182,92.37353187915242,0.15210332028013615,0.010656002332692557,linear,TPESampler,COMPLETE
2195,0.16286252327653342,2025-04-25 01:39:02.366467,2025-04-25 01:39:16.614113,0 days 00:00:14.247646,89.25692230990325,0.05768632284528262,0.0003342934132223351,linear,TPESampler,COMPLETE
2196,0.155395757258763,2025-04-25 01:39:16.806012,2025-04-25 01:39:23.793986,0 days 00:00:06.987974,26.011100246071777,0.04575494904045291,0.05186503703463785,linear,TPESampler,COMPLETE
2197,0.15346879495800086,2025-04-25 01:39:23.975562,2025-04-25 01:39:57.506410,0 days 00:00:33.530848,95.05660406301484,0.008852998332910325,0.00010159333825552336,linear,TPESampler,COMPLETE
2198,0.3954414235563219,2025-04-25 01:39:57.697767,2025-04-25 01:39:58.196966,0 days 00:00:00.499199,0.01553486211045554,0.1595896965556944,0.002858670817706951,linear,TPESampler,COMPLETE
2199,0.15006917268633221,2025-04-25 01:39:58.381712,2025-04-25 01:40:22.157222,0 days 00:00:23.775510,98.24123802550692,0.02589454760166676,0.00655609746542658,linear,TPESampler,COMPLETE
2200,0.15304253412885677,2025-04-25 01:40:22.343814,2025-04-25 01:40:49.476937,0 days 00:00:27.133123,90.78256030856093,0.015377386467069805,0.0016418971732996648,linear,TPESampler,COMPLETE
2201,0.15257120612120234,2025-04-25 01:40:49.665376,2025-04-25 01:40:54.404642,0 days 00:00:04.739266,19.194074002005646,0.04232867515819417,0.25574206605484145,linear,TPESampler,COMPLETE
2202,0.15470251424512357,2025-04-25 01:40:54.596816,2025-04-25 01:41:29.200229,0 days 00:00:34.603413,87.30615669039632,0.004237879423544156,0.13878004589650308,linear,TPESampler,COMPLETE
2203,0.1501947559707311,2025-04-25 01:41:14.319449,2025-04-25 01:41:18.652562,0 days 00:00:04.333113,20.38182367059012,0.028966069547135303,0.001385205029133013,linear,TPESampler,COMPLETE
2204,0.1534411521636899,2025-04-25 01:41:18.835679,2025-04-25 01:41:33.940298,0 days 00:00:15.104619,86.40929283071227,0.043337210057932396,0.00010302941439726057,linear,TPESampler,COMPLETE
2205,0.1564989920937157,2025-04-25 01:41:29.386114,2025-04-25 01:41:32.327391,0 days 00:00:02.941277,4.310142291419637,0.009661891259889354,0.0014697196463902406,linear,TPESampler,COMPLETE
