number,value,datetime_start,datetime_complete,duration,params_C,params_epsilon,params_gamma,params_kernel,system_attrs_auto:sampler,state
1974,0.14880968857847793,2025-04-25 01:15:06.027093,2025-04-25 01:15:24.689536,0 days 00:00:18.662443,94.15970476560089,0.034707573775266405,0.05868228871002237,linear,TPESampler,COMPLETE
1975,0.1533225166674919,2025-04-25 01:15:13.157120,2025-04-25 01:15:22.789165,0 days 00:00:09.632045,30.332350258670175,0.01719959337151352,0.000742220346494903,linear,TPESampler,COMPLETE
1976,0.15825959592789943,2025-04-25 01:15:22.978845,2025-04-25 01:15:27.747843,0 days 00:00:04.768998,28.069606473085965,0.04881215718907052,0.0010441386661718078,linear,TPESampler,COMPLETE
1977,0.14850786623302073,2025-04-25 01:15:24.884948,2025-04-25 01:15:42.741468,0 days 00:00:17.856520,86.76967259121803,0.03026623269066287,0.012965717673004138,linear,TPESampler,COMPLETE
1978,0.1530866040398965,2025-04-25 01:15:27.934957,2025-04-25 01:15:44.651144,0 days 00:00:16.716187,94.27717384192337,0.042988462077335615,0.004654048156354693,linear,TPESampler,COMPLETE
1979,0.40327362642856146,2025-04-25 01:15:42.933812,2025-04-25 01:15:43.475473,0 days 00:00:00.541661,1.989441359603801,0.0035107159394669896,0.000892118278098588,rbf,TPESampler,COMPLETE
1980,0.1585443984994367,2025-04-25 01:15:43.655900,2025-04-25 01:15:47.805627,0 days 00:00:04.149727,24.09351575845769,0.04929301481645862,0.9355024391438116,linear,TPESampler,COMPLETE
1981,0.15092996663898556,2025-04-25 01:15:44.834988,2025-04-25 01:15:51.330863,0 days 00:00:06.495875,18.840697543132155,0.021056956955745398,0.36400889748852827,linear,TPESampler,COMPLETE
1982,0.1544544346694701,2025-04-25 01:15:47.989662,2025-04-25 01:16:26.975426,0 days 00:00:38.985764,97.50974005144458,0.011461617226926984,0.8097908385793773,linear,TPESampler,COMPLETE
1983,0.15114132416940645,2025-04-25 01:15:51.511021,2025-04-25 01:16:23.291426,0 days 00:00:31.780405,98.49061551067965,0.0183717025815917,0.0047516010263450575,linear,TPESampler,COMPLETE
1984,0.1615969591181648,2025-04-25 01:16:23.502378,2025-04-25 01:16:25.579629,0 days 00:00:02.077251,14.079293978938354,0.05611193043914848,0.010896130670379105,linear,TPESampler,COMPLETE
1985,0.1552470936017503,2025-04-25 01:16:25.767896,2025-04-25 01:16:27.053754,0 days 00:00:01.285858,3.2943815798559073,0.027477945922099692,0.00034188373342510875,linear,TPESampler,COMPLETE
1986,0.1665075191487505,2025-04-25 01:16:27.131436,2025-04-25 01:16:28.854874,0 days 00:00:01.723438,22.705560976755923,0.0869594929355091,0.26526226199839953,linear,TPESampler,COMPLETE
1987,0.15303043921041498,2025-04-25 01:16:27.254667,2025-04-25 01:16:45.156411,0 days 00:00:17.901744,97.0132820376166,0.04292588557344963,0.002721195413491686,linear,TPESampler,COMPLETE
1988,0.15582993656688396,2025-04-25 01:16:29.045775,2025-04-25 01:16:53.477804,0 days 00:00:24.432029,99.14328343980449,0.04628254113866327,0.016788940640726745,linear,TPESampler,COMPLETE
1989,0.15269798342934057,2025-04-25 01:16:45.346199,2025-04-25 01:17:17.262303,0 days 00:00:31.916104,99.61747909570911,0.015012505869124945,0.0018976718916644268,linear,TPESampler,COMPLETE
1990,0.15261912523340238,2025-04-25 01:16:53.658593,2025-04-25 01:17:11.610046,0 days 00:00:17.951453,99.23016399132935,0.042387077081714054,0.002858639208898064,linear,TPESampler,COMPLETE
1991,0.14960163698581563,2025-04-25 01:17:11.832220,2025-04-25 01:17:29.769232,0 days 00:00:17.937012,98.56348768823754,0.023456391645147248,0.0004833788488365432,linear,TPESampler,COMPLETE
1992,0.34712862245563747,2025-04-25 01:17:17.441649,2025-04-25 01:17:17.936431,0 days 00:00:00.494782,38.46251854696662,0.08751236251020623,0.0001977962983973845,rbf,TPESampler,COMPLETE
1993,0.1877425258027106,2025-04-25 01:17:18.117078,2025-04-25 01:17:20.254392,0 days 00:00:02.137314,72.51291449535634,0.1269466344535058,0.05066584559023792,linear,TPESampler,COMPLETE
1994,0.14895788726841874,2025-04-25 01:17:20.433007,2025-04-25 01:17:44.034572,0 days 00:00:23.601565,87.47634898117293,0.029411608454700974,0.9434442131395493,linear,TPESampler,COMPLETE
1995,11.960249865924954,2025-04-25 01:17:29.947965,2025-04-25 01:17:30.476264,0 days 00:00:00.528299,92.85293868711064,0.08024260628032905,0.0017599727576684196,sigmoid,TPESampler,COMPLETE
1996,0.15390921413888947,2025-04-25 01:17:30.657749,2025-04-25 01:17:35.051370,0 days 00:00:04.393621,17.92355314232302,0.016600354194000178,0.0003717266544618683,linear,TPESampler,COMPLETE
1997,0.46690837998919255,2025-04-25 01:17:35.261417,2025-04-25 01:17:35.722281,0 days 00:00:00.460864,97.6221644875008,0.7917940964944548,0.0006226960350449419,rbf,TPESampler,COMPLETE
1998,0.14858853303922126,2025-04-25 01:17:35.904555,2025-04-25 01:17:55.782265,0 days 00:00:19.877710,88.39105544561153,0.031809445805001564,0.27753160900952567,linear,TPESampler,COMPLETE
1999,0.16194421683891375,2025-04-25 01:17:44.221370,2025-04-25 01:17:57.520854,0 days 00:00:13.299484,92.38078607569825,0.05689227652816038,0.00046632275381965017,linear,TPESampler,COMPLETE
2000,0.19175845452423304,2025-04-25 01:17:55.973018,2025-04-25 01:17:56.670616,0 days 00:00:00.697598,6.246763134969948,0.1098033974680875,0.0005990756895329761,linear,TPESampler,COMPLETE
2001,0.15285918368032142,2025-04-25 01:17:56.861900,2025-04-25 01:18:00.750879,0 days 00:00:03.888979,16.522675598224506,0.04092451203901211,0.00010315957594582514,linear,TPESampler,COMPLETE
2002,0.15569413687127773,2025-04-25 01:17:57.829673,2025-04-25 01:18:16.548062,0 days 00:00:18.718389,54.20043394229369,0.0027233191244177748,0.11870058773117777,linear,TPESampler,COMPLETE
2003,0.38438498431476226,2025-04-25 01:18:00.933842,2025-04-25 01:18:01.435102,0 days 00:00:00.501260,96.98658670540894,0.06592843622779931,0.0001989348081986311,sigmoid,TPESampler,COMPLETE
2004,0.198015237086213,2025-04-25 01:18:01.623650,2025-04-25 01:18:02.223325,0 days 00:00:00.599675,92.68212501313462,0.006242800230041707,0.0019060048071588768,rbf,TPESampler,COMPLETE
2005,0.3451937654548801,2025-04-25 01:18:02.408965,2025-04-25 01:18:02.952544,0 days 00:00:00.543579,17.131059099678314,0.007617820797362455,0.0003609485415656192,rbf,TPESampler,COMPLETE
2006,0.15676629831017014,2025-04-25 01:18:03.139854,2025-04-25 01:18:14.604371,0 days 00:00:11.464517,96.00359054113989,0.07249539582892768,0.00047259721756160133,linear,TPESampler,COMPLETE
2007,0.17044513198453373,2025-04-25 01:18:14.792122,2025-04-25 01:18:15.762468,0 days 00:00:00.970346,5.316415664156925,0.06603862936915116,0.007254125250007808,linear,TPESampler,COMPLETE
2008,0.5383523365678896,2025-04-25 01:18:15.952022,2025-04-25 01:18:28.586684,0 days 00:00:12.634662,5.726399422551329,0.03600138994982405,0.08570139979359499,poly,TPESampler,COMPLETE
2009,0.14989284006966225,2025-04-25 01:18:16.737318,2025-04-25 01:18:40.080134,0 days 00:00:23.342816,96.98760162666251,0.022663715538505273,0.06314825887076492,linear,TPESampler,COMPLETE
2010,0.1577357541150181,2025-04-25 01:18:28.777389,2025-04-25 01:18:44.686919,0 days 00:00:15.909530,98.66907390174877,0.05117059191735825,0.2592017146699501,linear,TPESampler,COMPLETE
2011,0.16195784318654957,2025-04-25 01:18:40.260960,2025-04-25 01:18:41.444114,0 days 00:00:01.183154,1.5345242476429661,0.0010543103006845683,0.00020650940682284945,linear,TPESampler,COMPLETE
2012,0.1554172494295869,2025-04-25 01:18:41.641335,2025-04-25 01:18:47.192039,0 days 00:00:05.550704,19.9360166069831,0.04584262348366078,0.0005740820730482667,linear,TPESampler,COMPLETE
2013,0.15162137736406098,2025-04-25 01:18:44.881679,2025-04-25 01:18:53.099359,0 days 00:00:08.217680,24.39238809527859,0.018972739405162194,0.0014943620489813291,linear,TPESampler,COMPLETE
2014,0.252642123438242,2025-04-25 01:18:47.377104,2025-04-25 01:18:48.224559,0 days 00:00:00.847455,17.560206772790107,0.218778675151627,0.0027085042807217766,linear,TPESampler,COMPLETE
2015,0.1578422449210373,2025-04-25 01:18:48.407053,2025-04-25 01:18:50.491585,0 days 00:00:02.084532,18.770297016862074,0.07335671953991639,0.00273827803143068,linear,TPESampler,COMPLETE
2016,0.15443829824839383,2025-04-25 01:18:50.672078,2025-04-25 01:18:55.650998,0 days 00:00:04.978920,22.63723453729665,0.04458035424580992,0.001789229447556602,linear,TPESampler,COMPLETE
2017,0.6097504704064879,2025-04-25 01:18:53.287457,2025-04-25 01:18:53.744853,0 days 00:00:00.457396,0.0016606286785167124,0.7391708508051698,0.07653865671078819,linear,TPESampler,COMPLETE
2018,0.14993253029328152,2025-04-25 01:18:53.928033,2025-04-25 01:19:16.466620,0 days 00:00:22.538587,98.47851206953897,0.021453185670828684,0.1813080436018563,linear,TPESampler,COMPLETE
2019,0.14950903764041007,2025-04-25 01:18:55.831288,2025-04-25 01:19:10.767253,0 days 00:00:14.935965,94.28070474398632,0.03569353323544971,0.0013132936106433736,linear,TPESampler,COMPLETE
2020,0.15031272736138465,2025-04-25 01:19:10.962158,2025-04-25 01:19:16.236440,0 days 00:00:05.274282,18.30493793022503,0.021643627202192227,0.0010278074814745403,linear,TPESampler,COMPLETE
2021,0.15278887366298632,2025-04-25 01:19:16.425775,2025-04-25 01:19:19.193413,0 days 00:00:02.767638,15.606723952151427,0.04070649121058722,0.07710225156092923,linear,TPESampler,COMPLETE
2022,0.1500873175146699,2025-04-25 01:19:16.658027,2025-04-25 01:19:43.101787,0 days 00:00:26.443760,90.09501569558863,0.02147813575899861,0.00013335393288739378,linear,TPESampler,COMPLETE
2023,0.1546000149940385,2025-04-25 01:19:19.387811,2025-04-25 01:19:24.470279,0 days 00:00:05.082468,18.654637611579584,0.015470746051797232,0.00295308768209558,linear,TPESampler,COMPLETE
2024,0.15661848815082563,2025-04-25 01:19:24.658367,2025-04-25 01:19:26.021966,0 days 00:00:01.363599,3.2902867647875644,0.011061513072055872,0.004366328974524122,linear,TPESampler,COMPLETE
2025,0.1545334983118408,2025-04-25 01:19:26.207133,2025-04-25 01:19:31.556477,0 days 00:00:05.349344,13.88349107411332,0.0049027764723455335,0.00016058780084716957,linear,TPESampler,COMPLETE
2026,0.14893858710327237,2025-04-25 01:19:31.740837,2025-04-25 01:19:51.334417,0 days 00:00:19.593580,92.64441599896999,0.02964813614452201,0.00041298449159734164,linear,TPESampler,COMPLETE
2027,0.21955541717763394,2025-04-25 01:19:43.291405,2025-04-25 01:19:43.835060,0 days 00:00:00.543655,34.518801101720705,0.03207687913677748,0.0015743843884032088,rbf,TPESampler,COMPLETE
2028,0.1555200110209307,2025-04-25 01:19:44.018739,2025-04-25 01:19:45.255607,0 days 00:00:01.236868,3.384612054611491,0.02776817125177443,0.2523877529071543,linear,TPESampler,COMPLETE
2029,0.1559314147166031,2025-04-25 01:19:45.442485,2025-04-25 01:19:50.062298,0 days 00:00:04.619813,13.900200418756725,0.011245793730156621,0.06561201202807249,linear,TPESampler,COMPLETE
2030,0.16088483296760214,2025-04-25 01:19:50.255468,2025-04-25 01:19:54.560497,0 days 00:00:04.305029,26.617790941832354,0.05429008948808209,0.0003495503773510183,linear,TPESampler,COMPLETE
2031,1.336045820955579,2025-04-25 01:19:51.510765,2025-04-25 01:19:52.026776,0 days 00:00:00.516011,0.004512949491985838,0.03756812710041717,0.06136269251841493,sigmoid,TPESampler,COMPLETE
2032,0.7662638651607573,2025-04-25 01:19:52.209691,2025-04-25 01:19:52.702643,0 days 00:00:00.492952,60.08979668577087,0.04101834811502292,0.0018377869647983583,poly,TPESampler,COMPLETE
2033,0.659084761906149,2025-04-25 01:19:52.884294,2025-04-25 01:19:53.359191,0 days 00:00:00.474897,0.001749599090496397,0.287521858443118,0.10421002180856286,poly,TPESampler,COMPLETE
2034,0.7077126587715644,2025-04-25 01:19:53.535802,2025-04-25 01:19:54.065684,0 days 00:00:00.529882,63.030374846264,0.024869218615368904,0.2591827186199834,rbf,TPESampler,COMPLETE
2035,0.14835023021801408,2025-04-25 01:19:54.242398,2025-04-25 01:20:18.847428,0 days 00:00:24.605030,92.94378506959306,0.03031196568370727,0.0018926482568644087,linear,TPESampler,COMPLETE
2036,0.15030896576673197,2025-04-25 01:19:54.830937,2025-04-25 01:20:17.963009,0 days 00:00:23.132072,95.91705439726553,0.019851378937135792,0.00032047229125521675,linear,TPESampler,COMPLETE
2037,0.17607021411140736,2025-04-25 01:20:18.154937,2025-04-25 01:20:22.640622,0 days 00:00:04.485685,81.24637974771673,0.11510475937589715,0.001977919137498491,linear,TPESampler,COMPLETE
2038,1.3982014965828578,2025-04-25 01:20:19.032416,2025-04-25 01:20:19.556867,0 days 00:00:00.524451,0.03796332346045732,0.0206473344717449,0.0001431264073823295,sigmoid,TPESampler,COMPLETE
2039,0.15814225281759958,2025-04-25 01:20:19.744188,2025-04-25 01:20:21.664013,0 days 00:00:01.919825,15.32084099184145,0.06954170627324424,0.007209654359621192,linear,TPESampler,COMPLETE
2040,0.15096462584920253,2025-04-25 01:20:21.845132,2025-04-25 01:20:27.960036,0 days 00:00:06.114904,24.65409109768499,0.024058433562783126,0.018368552474905087,linear,TPESampler,COMPLETE
2041,0.15313223361611844,2025-04-25 01:20:22.824123,2025-04-25 01:20:31.199463,0 days 00:00:08.375340,29.93950750176181,0.01659007609919163,0.0071072301512721805,linear,TPESampler,COMPLETE
2042,0.1490214821213676,2025-04-25 01:20:28.147209,2025-04-25 01:20:35.334216,0 days 00:00:07.187007,29.240683673944062,0.032460189747286955,0.003052595582726468,linear,TPESampler,COMPLETE
2043,0.24249938247406622,2025-04-25 01:20:31.385134,2025-04-25 01:20:31.899053,0 days 00:00:00.513919,17.779853722983038,0.07749345482472789,0.002124512049430793,rbf,TPESampler,COMPLETE
2044,0.14965841839421856,2025-04-25 01:20:32.081162,2025-04-25 01:20:55.118555,0 days 00:00:23.037393,97.57131381794042,0.023896592511490896,0.0011332269004538588,linear,TPESampler,COMPLETE
2045,0.5166667960883761,2025-04-25 01:20:35.721149,2025-04-25 01:20:36.255306,0 days 00:00:00.534157,7.080131039345305,0.04119153624723629,0.0001560624215851316,sigmoid,TPESampler,COMPLETE
2046,0.15142331118166755,2025-04-25 01:20:36.434663,2025-04-25 01:20:42.534194,0 days 00:00:06.099531,32.36991393625425,0.039493566862047046,0.010319299570391556,linear,TPESampler,COMPLETE
2047,0.38584263841611777,2025-04-25 01:20:42.714107,2025-04-25 01:20:43.228367,0 days 00:00:00.514260,0.01523189546807314,0.005258316170335659,0.12492778733197614,linear,TPESampler,COMPLETE
2048,0.175814775217933,2025-04-25 01:20:43.410958,2025-04-25 01:20:53.211156,0 days 00:00:09.800198,99.15627299374735,0.11420692158511253,0.0023766184193008194,linear,TPESampler,COMPLETE
2049,0.17130545281360088,2025-04-25 01:20:53.398349,2025-04-25 01:20:58.497164,0 days 00:00:05.098815,94.8075556500664,0.0955461926645464,0.04142397766198425,linear,TPESampler,COMPLETE
2050,0.15418854342203206,2025-04-25 01:20:55.303883,2025-04-25 01:21:20.452935,0 days 00:00:25.149052,90.7001297959779,0.014792680242991067,0.008250204742659547,linear,TPESampler,COMPLETE
2051,0.9580757595653567,2025-04-25 01:20:58.690458,2025-04-25 01:20:59.245575,0 days 00:00:00.555117,7.978959807534336,0.0013834519094965715,0.0016858040971311195,sigmoid,TPESampler,COMPLETE
2052,0.14921926650259112,2025-04-25 01:20:59.439206,2025-04-25 01:21:02.565617,0 days 00:00:03.126411,17.97134828434353,0.03386650240957406,0.0032079173352220444,linear,TPESampler,COMPLETE
2053,0.15395386750940376,2025-04-25 01:21:02.754141,2025-04-25 01:21:12.554650,0 days 00:00:09.800509,26.989746917309095,0.007448981921481199,0.1888510583684212,linear,TPESampler,COMPLETE
2054,0.15066339929579964,2025-04-25 01:21:12.740271,2025-04-25 01:21:17.803031,0 days 00:00:05.062760,25.88143287359567,0.03645632971500115,0.20113488858325518,linear,TPESampler,COMPLETE
2055,0.1494536716115127,2025-04-25 01:21:17.985583,2025-04-25 01:21:50.616936,0 days 00:00:32.631353,96.28139886087993,0.02236335154292675,0.0012162141809603812,linear,TPESampler,COMPLETE
2056,0.1525912294486822,2025-04-25 01:21:20.656319,2025-04-25 01:21:23.799899,0 days 00:00:03.143580,16.114120349397666,0.04257665489138774,0.11162339262133471,linear,TPESampler,COMPLETE
2057,0.15446295077222236,2025-04-25 01:21:23.986879,2025-04-25 01:21:33.494273,0 days 00:00:09.507394,24.214468801359793,0.009372342021998393,0.04374500872465845,linear,TPESampler,COMPLETE
2058,42.669677396554945,2025-04-25 01:21:33.680010,2025-04-25 01:21:34.347874,0 days 00:00:00.667864,89.50685714752032,0.017741569503714482,0.00286853084793687,sigmoid,TPESampler,COMPLETE
2059,0.15012990522841435,2025-04-25 01:21:34.530592,2025-04-25 01:21:58.892403,0 days 00:00:24.361811,93.29088681784711,0.020909385169361812,0.033344570900743345,linear,TPESampler,COMPLETE
2060,0.15489239800473223,2025-04-25 01:21:50.804763,2025-04-25 01:21:58.524981,0 days 00:00:07.720218,21.837294066333524,0.014149688278249634,0.0015289048045611245,linear,TPESampler,COMPLETE
2061,0.15322462854400254,2025-04-25 01:21:58.707890,2025-04-25 01:22:00.474303,0 days 00:00:01.766413,5.024175970199403,0.020435252940037864,0.003083866627544241,linear,TPESampler,COMPLETE
2062,0.46305366425479133,2025-04-25 01:21:59.126585,2025-04-25 01:21:59.608183,0 days 00:00:00.481598,34.66529156777845,0.36834333996103436,0.000676083872108964,sigmoid,TPESampler,COMPLETE
2063,0.15381634895220114,2025-04-25 01:21:59.789889,2025-04-25 01:22:33.048600,0 days 00:00:33.258711,97.90342855404302,0.007738586147657416,0.0002826964814909839,linear,TPESampler,COMPLETE
2064,1281.4384771423072,2025-04-25 01:22:00.656276,2025-04-25 01:22:01.163963,0 days 00:00:00.507687,83.40133556420615,0.029034995693490367,0.11588266200214781,sigmoid,TPESampler,COMPLETE
2065,1.301004975091499,2025-04-25 01:22:01.344130,2025-04-25 01:22:01.839550,0 days 00:00:00.495420,0.9045779607380435,0.007871961344018557,0.001095568493895573,poly,TPESampler,COMPLETE
2066,0.14799242622214204,2025-04-25 01:22:02.015949,2025-04-25 01:22:16.031315,0 days 00:00:14.015366,86.98760372933494,0.03304605518647164,0.16573948722438744,linear,TPESampler,COMPLETE
2067,0.15677720968116224,2025-04-25 01:22:16.241027,2025-04-25 01:22:32.728063,0 days 00:00:16.487036,99.78676443748843,0.04753893882498021,0.33632417366428624,linear,TPESampler,COMPLETE
2068,0.1497887417394997,2025-04-25 01:22:32.937408,2025-04-25 01:22:42.627768,0 days 00:00:09.690360,26.880410112984723,0.02492870559556558,0.1015725294441411,linear,TPESampler,COMPLETE
2069,0.15020107021602083,2025-04-25 01:22:33.246624,2025-04-25 01:22:37.661054,0 days 00:00:04.414430,16.988719385853862,0.027774740840569828,0.18709706987624466,linear,TPESampler,COMPLETE
2070,0.1490374202914582,2025-04-25 01:22:37.878976,2025-04-25 01:22:59.235168,0 days 00:00:21.356192,98.03932577683865,0.029548453015195066,0.06538287617544708,linear,TPESampler,COMPLETE
2071,0.15024955691753025,2025-04-25 01:22:42.816101,2025-04-25 01:23:08.764817,0 days 00:00:25.948716,89.85779960528029,0.01987560770145619,0.14334777820986425,linear,TPESampler,COMPLETE
2072,0.15780772706217924,2025-04-25 01:22:59.439634,2025-04-25 01:23:15.313254,0 days 00:00:15.873620,94.31044193910218,0.0483744998239439,0.045717263664959144,linear,TPESampler,COMPLETE
2073,0.20553109024625388,2025-04-25 01:23:08.950942,2025-04-25 01:23:09.689906,0 days 00:00:00.738964,4.384636994972614,0.12339959827472136,0.1486947309888078,linear,TPESampler,COMPLETE
2074,0.22933637689059957,2025-04-25 01:23:09.869137,2025-04-25 01:23:10.781916,0 days 00:00:00.912779,23.0470838580516,0.17846250960371635,0.18562968675641298,linear,TPESampler,COMPLETE
2075,0.15059559473251827,2025-04-25 01:23:10.969413,2025-04-25 01:23:16.154206,0 days 00:00:05.184793,19.264849858369384,0.03812651586206702,0.16585214605255294,linear,TPESampler,COMPLETE
2076,0.18937403210999243,2025-04-25 01:23:15.497241,2025-04-25 01:23:17.692080,0 days 00:00:02.194839,50.02424215934416,0.12498511471971559,0.22639154015874105,linear,TPESampler,COMPLETE
2077,0.15030704719477286,2025-04-25 01:23:16.338886,2025-04-25 01:23:28.442028,0 days 00:00:12.103142,29.61589452287026,0.02281350083729802,0.2795189090904873,linear,TPESampler,COMPLETE
2078,0.1899959143421794,2025-04-25 01:23:17.881998,2025-04-25 01:23:21.034430,0 days 00:00:03.152432,96.11626829914714,0.1299651976997908,0.43596594313156367,linear,TPESampler,COMPLETE
2079,0.15982539622105912,2025-04-25 01:23:21.228938,2025-04-25 01:23:24.098307,0 days 00:00:02.869369,21.81765449356242,0.05290274782295451,0.10174040463938562,linear,TPESampler,COMPLETE
2080,0.1537017962775954,2025-04-25 01:23:24.282746,2025-04-25 01:23:26.098625,0 days 00:00:01.815879,4.496912914927778,0.024095110487572253,0.8819689038937473,linear,TPESampler,COMPLETE
2081,0.16747292173765754,2025-04-25 01:23:26.288947,2025-04-25 01:23:28.420602,0 days 00:00:02.131655,35.51471853563563,0.08911040337061477,0.09993341050341485,linear,TPESampler,COMPLETE
2082,0.16418208108194854,2025-04-25 01:23:28.573755,2025-04-25 01:23:41.394666,0 days 00:00:12.820911,85.50536419441326,0.08472898700867958,0.07579479487864307,linear,TPESampler,COMPLETE
2083,0.15396992860339448,2025-04-25 01:23:28.626441,2025-04-25 01:23:42.134418,0 days 00:00:13.507977,25.3541945797298,0.010836109044745162,0.24400097394754994,linear,TPESampler,COMPLETE
2084,0.41915366483942845,2025-04-25 01:23:41.580285,2025-04-25 01:23:42.109493,0 days 00:00:00.529208,0.8922177425977214,0.024532132510456335,0.0034429465273340945,rbf,TPESampler,COMPLETE
2085,0.1503944494989031,2025-04-25 01:23:42.261052,2025-04-25 01:23:47.312011,0 days 00:00:05.050959,25.22530879557039,0.028896107604128165,0.30112894985748234,linear,TPESampler,COMPLETE
2086,0.15470041603552287,2025-04-25 01:23:42.315885,2025-04-25 01:24:06.862158,0 days 00:00:24.546273,89.66993035684058,0.04522234222777304,0.1649115160315822,linear,TPESampler,COMPLETE
2087,0.1531152522014079,2025-04-25 01:23:47.492332,2025-04-25 01:24:11.788987,0 days 00:00:24.296655,94.59059678092801,0.01553686912103621,0.034692870626263424,linear,TPESampler,COMPLETE
2088,0.15013532033688484,2025-04-25 01:24:07.044605,2025-04-25 01:24:19.738945,0 days 00:00:12.694340,72.04328341437378,0.02586809527778659,0.2366206009281275,linear,TPESampler,COMPLETE
2089,0.15060351945344957,2025-04-25 01:24:12.093523,2025-04-25 01:24:16.884115,0 days 00:00:04.790592,23.97395859170029,0.0376003045519306,0.043423835866875586,linear,TPESampler,COMPLETE
