number,value,datetime_start,datetime_complete,duration,params_C,params_epsilon,params_gamma,params_kernel,system_attrs_auto:sampler,state
932,0.2732586462555178,2025-04-24 23:20:36.358067,2025-04-24 23:20:37.010836,0 days 00:00:00.652769,18.573762272384315,0.2505634616932658,0.005933946051308685,linear,TPESampler,COMPLETE
933,0.15256546805515486,2025-04-24 23:20:37.181829,2025-04-24 23:20:39.717795,0 days 00:00:02.535966,8.652428198145628,0.03950891487973614,0.000305090642542229,linear,TPESampler,COMPLETE
934,0.19329086474717788,2025-04-24 23:20:39.888327,2025-04-24 23:20:40.758898,0 days 00:00:00.870571,9.402696218635365,0.12270661587901285,0.0012574900632492023,linear,TPESampler,COMPLETE
935,0.15575371498969845,2025-04-24 23:20:40.932197,2025-04-24 23:20:46.645115,0 days 00:00:05.712918,14.450968741882779,0.005601171732909932,0.8129053058093683,linear,TPESampler,COMPLETE
936,0.15832699123043495,2025-04-24 23:20:46.820927,2025-04-24 23:20:50.939553,0 days 00:00:04.118626,22.729750383861543,0.049796007839088295,0.0035266340383274617,linear,TPESampler,COMPLETE
937,0.15386981851539103,2025-04-24 23:20:51.115667,2025-04-24 23:21:05.243295,0 days 00:00:14.127628,88.33671778707745,0.04392832038088473,0.00031713843344349454,linear,TPESampler,COMPLETE
938,0.1522343119306546,2025-04-24 23:21:05.415336,2025-04-24 23:21:09.580982,0 days 00:00:04.165646,19.96223480639403,0.040136150567379535,0.13244945784819176,linear,TPESampler,COMPLETE
939,0.15277269158474183,2025-04-24 23:21:09.748111,2025-04-24 23:21:32.754368,0 days 00:00:23.006257,81.45201795528132,0.01564106993695129,0.12297395781902443,linear,TPESampler,COMPLETE
940,0.6386890844461821,2025-04-24 23:21:32.930916,2025-04-24 23:21:33.588049,0 days 00:00:00.657133,91.8899416141457,0.005447387024425392,0.1574531102616739,rbf,TPESampler,COMPLETE
941,0.15011377276311108,2025-04-24 23:21:33.763683,2025-04-24 23:21:54.325000,0 days 00:00:20.561317,52.92915140013122,0.023035717725019264,0.0005743499879578194,linear,TPESampler,COMPLETE
942,0.16487240411261192,2025-04-24 23:21:54.499752,2025-04-24 23:21:58.997411,0 days 00:00:04.497659,97.87790549963515,0.08528461558381965,0.22719084964792854,linear,TPESampler,COMPLETE
943,0.17771790406464408,2025-04-24 23:21:59.173375,2025-04-24 23:21:59.761883,0 days 00:00:00.588508,1.2404245319338043,0.06604294800167182,0.001281371864864583,linear,TPESampler,COMPLETE
944,1.4046442928319767,2025-04-24 23:21:59.934154,2025-04-24 23:22:00.428657,0 days 00:00:00.494503,0.0034473511195355863,0.15566643013946344,0.0012671970558345942,sigmoid,TPESampler,COMPLETE
945,0.150392800868144,2025-04-24 23:22:00.615467,2025-04-24 23:22:10.243145,0 days 00:00:09.627678,28.47280097071347,0.02103332042970055,0.0009779281072186364,linear,TPESampler,COMPLETE
946,63.48610106921107,2025-04-24 23:22:10.422281,2025-04-24 23:22:11.122923,0 days 00:00:00.700642,51.53714046329964,0.004456105490236486,0.004291829548060753,sigmoid,TPESampler,COMPLETE
947,0.1533180034376815,2025-04-24 23:22:11.312424,2025-04-24 23:22:15.190923,0 days 00:00:03.878499,15.137069423608825,0.04133271096558221,0.003452466303472975,linear,TPESampler,COMPLETE
948,0.5651016633441377,2025-04-24 23:22:15.938766,2025-04-24 23:22:16.386739,0 days 00:00:00.447973,0.0012857397625440792,0.5287079902115069,0.0056981357833333504,linear,TPESampler,COMPLETE
949,0.15452751119480368,2025-04-24 23:22:16.567878,2025-04-24 23:22:51.104276,0 days 00:00:34.536398,85.4233697450054,0.004784845045599354,0.002594984636170263,linear,TPESampler,COMPLETE
950,2.4538309975035055,2025-04-24 23:22:51.467696,2025-04-24 23:22:52.121163,0 days 00:00:00.653467,0.08737467303372073,0.15394892510990155,0.2891684185595585,sigmoid,TPESampler,COMPLETE
951,0.15514299356104883,2025-04-24 23:22:52.362534,2025-04-24 23:22:59.080807,0 days 00:00:06.718273,16.15551139754531,0.0062581320649392385,0.10536612606249735,linear,TPESampler,COMPLETE
952,0.15065812926289648,2025-04-24 23:22:59.249430,2025-04-24 23:23:03.819161,0 days 00:00:04.569731,17.348371264044605,0.025026155159184355,0.7588956543923162,linear,TPESampler,COMPLETE
953,0.1701472193993932,2025-04-24 23:23:03.995586,2025-04-24 23:23:04.958717,0 days 00:00:00.963131,5.1326964114376,0.06676384203108433,0.0687555611634895,linear,TPESampler,COMPLETE
954,0.15401328204683987,2025-04-24 23:23:05.129869,2025-04-24 23:23:35.167100,0 days 00:00:30.037231,76.8173906888426,0.0074454782069704045,0.0004788372897405555,linear,TPESampler,COMPLETE
955,0.3949928340909649,2025-04-24 23:23:35.338802,2025-04-24 23:23:35.851870,0 days 00:00:00.513068,47.88166189958637,0.00438824259002087,0.00041446477012028267,sigmoid,TPESampler,COMPLETE
956,0.15021199193540358,2025-04-24 23:23:36.023062,2025-04-24 23:23:49.729708,0 days 00:00:13.706646,75.97742630470808,0.02738221502668417,0.0011369157557076695,linear,TPESampler,COMPLETE
957,0.14949880493548484,2025-04-24 23:23:49.906181,2025-04-24 23:24:11.529793,0 days 00:00:21.623612,92.55390954130176,0.023742402674484797,0.0018339103039930907,linear,TPESampler,COMPLETE
958,0.15388859752131723,2025-04-24 23:23:52.040922,2025-04-24 23:23:55.254190,0 days 00:00:03.213268,13.300138878169502,0.017607480997944392,0.004535815580263719,linear,TPESampler,COMPLETE
959,135.94724974656134,2025-04-24 23:23:55.425872,2025-04-24 23:23:55.929264,0 days 00:00:00.503392,8.11001993532019,0.027043571948389977,0.041692126831238414,sigmoid,TPESampler,COMPLETE
960,0.15235953744752992,2025-04-24 23:23:56.104686,2025-04-24 23:24:19.891842,0 days 00:00:23.787156,88.86834581815114,0.017004227162973732,0.1175541310125069,linear,TPESampler,COMPLETE
961,0.321477464560538,2025-04-24 23:24:11.701830,2025-04-24 23:24:12.215705,0 days 00:00:00.513875,9.714556466539761,0.01420709550465062,0.0007906954995798008,rbf,TPESampler,COMPLETE
962,0.17098745871344972,2025-04-24 23:24:12.387583,2025-04-24 23:24:16.322793,0 days 00:00:03.935210,92.66823802336548,0.09391733911595472,0.0003098749366168015,linear,TPESampler,COMPLETE
963,0.15015416355316422,2025-04-24 23:24:16.493600,2025-04-24 23:24:33.682046,0 days 00:00:17.188446,79.32569208063336,0.027794661352845515,0.249180718054026,linear,TPESampler,COMPLETE
964,0.5475183916922088,2025-04-24 23:24:20.065939,2025-04-24 23:24:20.520242,0 days 00:00:00.454303,1.4260616852737302,0.9676549061392408,0.5885978981412341,linear,TPESampler,COMPLETE
965,0.16352271985314593,2025-04-24 23:24:20.706478,2025-04-24 23:24:23.564305,0 days 00:00:02.857827,17.40168134851815,0.06097964337643699,0.004511856956924766,linear,TPESampler,COMPLETE
966,0.16165826203791692,2025-04-24 23:24:23.734097,2025-04-24 23:24:26.880841,0 days 00:00:03.146744,17.070297741766407,0.06727307512312239,0.0005583614513309401,linear,TPESampler,COMPLETE
967,0.16182904166847165,2025-04-24 23:24:27.056745,2025-04-24 23:24:40.089051,0 days 00:00:13.032306,92.53101440345459,0.056766537540145746,0.005277619977628635,linear,TPESampler,COMPLETE
968,0.15542222584897644,2025-04-24 23:24:33.857346,2025-04-24 23:24:37.844536,0 days 00:00:03.987190,14.986290138329153,0.04505612981782077,0.2263113716115615,linear,TPESampler,COMPLETE
969,0.20836489212438966,2025-04-24 23:24:38.019098,2025-04-24 23:24:39.511116,0 days 00:00:01.492018,49.11446735099195,0.14278511120199053,0.9549651590039544,linear,TPESampler,COMPLETE
970,0.1480637584692054,2025-04-24 23:24:39.686716,2025-04-24 23:24:59.969838,0 days 00:00:20.283122,98.74907210514733,0.03330579617370746,0.009688413158931765,linear,TPESampler,COMPLETE
971,1.369077910998441,2025-04-24 23:24:40.262589,2025-04-24 23:24:40.748411,0 days 00:00:00.485822,0.006366678132146892,0.2005100699207183,0.16680793133175995,sigmoid,TPESampler,COMPLETE
972,0.29398594477494194,2025-04-24 23:24:40.929205,2025-04-24 23:24:41.444766,0 days 00:00:00.515561,81.91543400200193,0.04580063540142154,0.00022473247079678876,rbf,TPESampler,COMPLETE
973,0.14995349518452428,2025-04-24 23:24:41.620080,2025-04-24 23:25:06.314817,0 days 00:00:24.694737,86.14286558084638,0.021046447795012625,0.3267221148463076,linear,TPESampler,COMPLETE
974,0.4293368787280635,2025-04-24 23:25:00.162376,2025-04-24 23:25:00.643140,0 days 00:00:00.480764,14.904228801261043,0.7256998118750643,0.02069171181818395,rbf,TPESampler,COMPLETE
975,0.15036297462821877,2025-04-24 23:25:00.817773,2025-04-24 23:25:11.566884,0 days 00:00:10.749111,35.336078475752075,0.021933552684640752,0.030494132333771226,linear,TPESampler,COMPLETE
976,0.1535175859897504,2025-04-24 23:25:06.481675,2025-04-24 23:25:13.273701,0 days 00:00:06.792026,26.253257248302468,0.01694100347759051,0.012886041272786674,linear,TPESampler,COMPLETE
977,0.14995518022321172,2025-04-24 23:25:11.743176,2025-04-24 23:25:27.606648,0 days 00:00:15.863472,94.16121445489995,0.027890985431344363,0.047433619456532836,linear,TPESampler,COMPLETE
978,1.399638277246108,2025-04-24 23:25:13.451059,2025-04-24 23:25:13.980036,0 days 00:00:00.528977,0.010120393397059085,0.0011477072233286086,0.7111486150027747,rbf,TPESampler,COMPLETE
979,0.15786321897032515,2025-04-24 23:25:14.164681,2025-04-24 23:25:35.460716,0 days 00:00:21.296035,99.31186335544801,0.051022462498164126,0.005918411270523009,linear,TPESampler,COMPLETE
980,0.18378959678313359,2025-04-24 23:25:27.781520,2025-04-24 23:25:29.272461,0 days 00:00:01.490941,21.168759141365843,0.11846547771555206,0.008202547382376335,linear,TPESampler,COMPLETE
981,0.17581867346910887,2025-04-24 23:25:29.440429,2025-04-24 23:25:30.980254,0 days 00:00:01.539825,14.877771927821682,0.09914366651094589,0.056366569351825366,linear,TPESampler,COMPLETE
982,0.1538174175619397,2025-04-24 23:25:31.152149,2025-04-24 23:26:05.776992,0 days 00:00:34.624843,87.77414404618536,0.006314542342501908,0.01783795984416309,linear,TPESampler,COMPLETE
983,242.62448989347263,2025-04-24 23:25:35.666969,2025-04-24 23:25:36.276343,0 days 00:00:00.609374,87.7303999674462,0.27215215884223143,0.006462315257413656,sigmoid,TPESampler,COMPLETE
984,0.1566927102250736,2025-04-24 23:25:36.479933,2025-04-24 23:25:55.390314,0 days 00:00:18.910381,94.62241372710184,0.04731107120081836,0.08611789623838559,linear,TPESampler,COMPLETE
985,0.16480117178951922,2025-04-24 23:25:55.565381,2025-04-24 23:25:59.690339,0 days 00:00:04.124958,94.48780828501448,0.08597556095174792,0.08745288976230191,linear,TPESampler,COMPLETE
986,366.8061573811378,2025-04-24 23:25:59.862584,2025-04-24 23:26:00.377276,0 days 00:00:00.514692,22.5408969563126,0.06918472618979263,0.13899136646231186,sigmoid,TPESampler,COMPLETE
987,0.1521429776661671,2025-04-24 23:26:00.556537,2025-04-24 23:26:03.767401,0 days 00:00:03.210864,13.274139245452579,0.019381733990472865,0.020733243661090615,linear,TPESampler,COMPLETE
988,0.15681204787123854,2025-04-24 23:26:03.943719,2025-04-24 23:26:15.462627,0 days 00:00:11.518908,81.04534221593201,0.05298080798210173,0.011301483976066359,linear,TPESampler,COMPLETE
989,0.45090712955683476,2025-04-24 23:26:05.972668,2025-04-24 23:26:06.495572,0 days 00:00:00.522904,98.08774817012639,0.058433783635779016,0.003433111005798332,poly,TPESampler,COMPLETE
990,0.14982736094777155,2025-04-24 23:26:06.669601,2025-04-24 23:26:32.921807,0 days 00:00:26.252206,99.16270564575709,0.026958526640768782,0.008210537917728924,linear,TPESampler,COMPLETE
991,0.8639833865288868,2025-04-24 23:26:15.689777,2025-04-24 23:26:16.192120,0 days 00:00:00.502343,46.12991167583135,0.032909673229488706,0.000621409257221023,poly,TPESampler,COMPLETE
992,0.14860003783736978,2025-04-24 23:26:16.366662,2025-04-24 23:26:32.476137,0 days 00:00:16.109475,93.92359699644973,0.03442629547163536,0.0005976914839973342,linear,TPESampler,COMPLETE
993,0.15180714154128763,2025-04-24 23:26:32.649890,2025-04-24 23:26:40.099571,0 days 00:00:07.449681,22.88536942548851,0.018675320202617744,0.06137198954137978,linear,TPESampler,COMPLETE
994,0.1498231984163523,2025-04-24 23:26:33.108693,2025-04-24 23:26:51.359172,0 days 00:00:18.250479,70.65527625379971,0.022398004212889365,0.013396238730781957,linear,TPESampler,COMPLETE
995,0.1493297970117992,2025-04-24 23:26:40.275441,2025-04-24 23:26:59.209818,0 days 00:00:18.934377,99.85607516560364,0.028554094865922107,0.5372686120203923,linear,TPESampler,COMPLETE
996,1.413965518248261,2025-04-24 23:26:51.531775,2025-04-24 23:26:52.028491,0 days 00:00:00.496716,0.0010506176827634784,0.0012244741843414906,0.0002270033499103282,poly,TPESampler,COMPLETE
997,0.152902663221456,2025-04-24 23:26:52.198141,2025-04-24 23:26:56.038781,0 days 00:00:03.840640,17.839594950781045,0.01817853573465889,0.004075871981696061,linear,TPESampler,COMPLETE
998,0.18365391901361028,2025-04-24 23:26:56.208100,2025-04-24 23:26:59.284905,0 days 00:00:03.076805,82.35808275116338,0.12487985470385568,0.0041321325817320655,linear,TPESampler,COMPLETE
999,0.14935978182917492,2025-04-24 23:26:59.356348,2025-04-24 23:27:23.881467,0 days 00:00:24.525119,99.75058083357959,0.02870679900790241,0.014235268886842404,linear,TPESampler,COMPLETE
1000,0.16304577958753097,2025-04-24 23:26:59.421540,2025-04-24 23:27:01.172723,0 days 00:00:01.751183,22.458744989469345,0.08121159245219159,0.3250989270327824,linear,TPESampler,COMPLETE
1001,1.414873913455141,2025-04-24 23:27:01.347393,2025-04-24 23:27:01.855609,0 days 00:00:00.508216,0.01438693633108515,0.006692545396822773,0.0004329071679579594,poly,TPESampler,COMPLETE
1002,0.1780588724521171,2025-04-24 23:27:02.023718,2025-04-24 23:27:03.295180,0 days 00:00:01.271462,15.653356321781592,0.10094992741032865,0.00010522729235025627,linear,TPESampler,COMPLETE
1003,0.16117747315536002,2025-04-24 23:27:03.469540,2025-04-24 23:27:15.710409,0 days 00:00:12.240869,91.7785437799831,0.05480469039525056,0.2679512780269892,linear,TPESampler,COMPLETE
1004,0.15333166780139088,2025-04-24 23:27:15.888220,2025-04-24 23:27:31.717123,0 days 00:00:15.828903,51.24209147199989,0.013438545482601826,0.006827800245263557,linear,TPESampler,COMPLETE
1005,0.15483484988991078,2025-04-24 23:27:25.070792,2025-04-24 23:28:10.597478,0 days 00:00:45.526686,95.08654306158778,0.01050905506121165,0.06210233084076025,linear,TPESampler,COMPLETE
1006,0.1566199901088775,2025-04-24 23:27:31.942989,2025-04-24 23:27:35.710323,0 days 00:00:03.767334,14.864028095780736,0.04732034590899376,0.01696945253313229,linear,TPESampler,COMPLETE
1007,0.1485061846591128,2025-04-24 23:27:35.885637,2025-04-24 23:27:52.213331,0 days 00:00:16.327694,83.82287431094184,0.03114698420868416,0.00341999256684253,linear,TPESampler,COMPLETE
1008,0.15077261934501182,2025-04-24 23:27:52.540463,2025-04-24 23:28:00.838685,0 days 00:00:08.298222,25.45909737549822,0.02058786650436118,0.0041535967098342156,linear,TPESampler,COMPLETE
1009,0.15015527827360486,2025-04-24 23:28:01.015370,2025-04-24 23:28:31.908606,0 days 00:00:30.893236,94.64405705905067,0.020874905817925806,0.014242357270953708,linear,TPESampler,COMPLETE
1010,0.15005786972519725,2025-04-24 23:28:10.772089,2025-04-24 23:28:36.033005,0 days 00:00:25.260916,94.35629309995036,0.021419173155203804,0.0010632938686221348,linear,TPESampler,COMPLETE
1011,0.15430058679152706,2025-04-24 23:28:32.083355,2025-04-24 23:28:44.697144,0 days 00:00:12.613789,31.48855146258422,0.01119975106453314,0.004161919701484314,linear,TPESampler,COMPLETE
1012,0.15136049627730133,2025-04-24 23:28:36.208422,2025-04-24 23:28:40.952580,0 days 00:00:04.744158,22.673850362442423,0.03918693376434096,0.004793107812754214,linear,TPESampler,COMPLETE
1013,0.16534993640823756,2025-04-24 23:28:41.130569,2025-04-24 23:28:42.522862,0 days 00:00:01.392293,16.493904721319613,0.08368802359452622,0.004099609533325257,linear,TPESampler,COMPLETE
1014,0.1483669596891153,2025-04-24 23:28:42.692045,2025-04-24 23:29:04.115887,0 days 00:00:21.423842,94.55688872130882,0.031001024616678197,0.004291161714218309,linear,TPESampler,COMPLETE
1015,0.16773359572710683,2025-04-24 23:28:44.862556,2025-04-24 23:28:46.740778,0 days 00:00:01.878222,21.11957276971797,0.08928563970905606,0.0018072946532263414,linear,TPESampler,COMPLETE
1016,0.15043527320093641,2025-04-24 23:28:46.929938,2025-04-24 23:29:09.935268,0 days 00:00:23.005330,69.33716697076936,0.019250458814568026,0.004181111460096555,linear,TPESampler,COMPLETE
1017,0.14903573206222512,2025-04-24 23:29:04.289163,2025-04-24 23:29:09.730221,0 days 00:00:05.441058,25.341124738831443,0.03026102489752742,0.0052995178800191965,linear,TPESampler,COMPLETE
1018,6.889319334812093,2025-04-24 23:29:09.896888,2025-04-24 23:29:10.355852,0 days 00:00:00.458964,54.33265643821433,0.0853640200398808,0.0017554965160219052,sigmoid,TPESampler,COMPLETE
1019,0.1546604761531821,2025-04-24 23:29:10.146351,2025-04-24 23:29:25.339254,0 days 00:00:15.192903,30.35489018219296,0.009863448704932712,0.003004276033664457,linear,TPESampler,COMPLETE
1020,0.14989394501059938,2025-04-24 23:29:10.566154,2025-04-24 23:29:34.662195,0 days 00:00:24.096041,99.02716367369678,0.02333531170241712,0.0023478115366202994,linear,TPESampler,COMPLETE
1021,0.15203537249758464,2025-04-24 23:29:25.514783,2025-04-24 23:29:46.810063,0 days 00:00:21.295280,97.28510867413836,0.040386491700502826,0.0017610358373158453,linear,TPESampler,COMPLETE
1022,0.15894332365412006,2025-04-24 23:29:34.849417,2025-04-24 23:29:43.807466,0 days 00:00:08.958049,74.63302189885741,0.0679762326228061,0.006916750850612129,linear,TPESampler,COMPLETE
1023,0.14929634826242622,2025-04-24 23:29:43.981448,2025-04-24 23:29:55.576207,0 days 00:00:11.594759,65.97609721325907,0.03262403089037314,0.00611783390352388,linear,TPESampler,COMPLETE
1024,0.15762584201988278,2025-04-24 23:29:46.980963,2025-04-24 23:30:07.809618,0 days 00:00:20.828655,85.75490138234949,0.048239856242540985,0.004667034703070012,linear,TPESampler,COMPLETE
1025,0.15336203390868283,2025-04-24 23:29:55.757806,2025-04-24 23:30:15.530346,0 days 00:00:19.772540,85.18231820449941,0.014073068330234662,0.0029026883375909193,linear,TPESampler,COMPLETE
1026,0.15735667246632162,2025-04-24 23:30:07.979160,2025-04-24 23:30:09.885822,0 days 00:00:01.906662,3.221789162133304,0.013832034582285973,0.0006109189743332486,linear,TPESampler,COMPLETE
1027,0.2516843940133867,2025-04-24 23:30:10.060603,2025-04-24 23:30:10.615958,0 days 00:00:00.555355,0.18563685269494296,0.001383020673747977,0.0005932609778925945,linear,TPESampler,COMPLETE
1028,0.30307575251135843,2025-04-24 23:30:10.787536,2025-04-24 23:30:11.267912,0 days 00:00:00.480376,6.23023182826967,0.09676880835895244,0.012596828805056571,rbf,TPESampler,COMPLETE
1029,0.1509922070593326,2025-04-24 23:30:11.432265,2025-04-24 23:30:37.620058,0 days 00:00:26.187793,97.21102427079852,0.017734707861595506,0.00285144981246595,linear,TPESampler,COMPLETE
1030,1.2145023322246535,2025-04-24 23:30:15.727871,2025-04-24 23:30:16.235719,0 days 00:00:00.507848,0.044752155779240604,0.0108139230701005,0.0009039620373157741,rbf,TPESampler,COMPLETE
1031,0.16096008533638237,2025-04-24 23:30:16.420124,2025-04-24 23:30:18.266292,0 days 00:00:01.846168,12.193371671963748,0.05337434400308306,0.006475348559437768,linear,TPESampler,COMPLETE
1032,0.1616678445575187,2025-04-24 23:30:18.436567,2025-04-24 23:30:23.806605,0 days 00:00:05.370038,94.90850242291195,0.08050401165324611,0.0021073804459532264,linear,TPESampler,COMPLETE
1033,1.2876693598935478,2025-04-24 23:30:23.984458,2025-04-24 23:30:24.501580,0 days 00:00:00.517122,0.16079224351499452,0.004116313697967818,0.0002725899077666833,sigmoid,TPESampler,COMPLETE
1034,0.1557472648316557,2025-04-24 23:30:24.667182,2025-04-24 23:30:28.830737,0 days 00:00:04.163555,10.580377406623285,0.010980527304947614,0.0019252280523370448,linear,TPESampler,COMPLETE
1035,0.16330308810244945,2025-04-24 23:30:29.006279,2025-04-24 23:30:32.169231,0 days 00:00:03.162952,17.18974163618979,0.06069758710243955,0.0075983574558712375,linear,TPESampler,COMPLETE
1036,0.14957977144786602,2025-04-24 23:30:32.340825,2025-04-24 23:31:04.428809,0 days 00:00:32.087984,95.903925542816,0.02254305601317064,0.0010961068523988387,linear,TPESampler,COMPLETE
1037,0.21641113432146383,2025-04-24 23:30:37.820659,2025-04-24 23:30:38.393140,0 days 00:00:00.572481,98.93440936784941,0.03454613905772669,0.00255553094598527,rbf,TPESampler,COMPLETE
1038,0.14954398478096337,2025-04-24 23:30:38.564301,2025-04-24 23:30:57.581205,0 days 00:00:19.016904,88.45860304001849,0.03693453105427472,0.0005623643865691659,linear,TPESampler,COMPLETE
1039,0.1521178027424131,2025-04-24 23:30:57.756073,2025-04-24 23:31:28.897541,0 days 00:00:31.141468,99.16729002476517,0.01516117939655015,0.0004782599098414457,linear,TPESampler,COMPLETE
1040,0.15754920018760277,2025-04-24 23:31:04.596229,2025-04-24 23:31:06.106689,0 days 00:00:01.510460,2.802681186332698,0.009372462157115593,0.0077016755385520335,linear,TPESampler,COMPLETE
1041,1.254743193934998,2025-04-24 23:31:06.274749,2025-04-24 23:31:06.771574,0 days 00:00:00.496825,37.25467520168717,0.01830875492855775,0.0011025999731935415,sigmoid,TPESampler,COMPLETE
1042,0.16649906499772327,2025-04-24 23:31:06.940135,2025-04-24 23:31:08.729856,0 days 00:00:01.789721,16.50091041389155,0.06535600505088292,0.0011427857192942087,linear,TPESampler,COMPLETE
1043,0.15465029643022699,2025-04-24 23:31:08.892410,2025-04-24 23:31:39.899141,0 days 00:00:31.006731,71.77268322397288,0.011469638947576572,0.010251122645296975,linear,TPESampler,COMPLETE
1044,0.1628519000001523,2025-04-24 23:31:29.134719,2025-04-24 23:31:31.923487,0 days 00:00:02.788768,21.779319140966862,0.06004624185084278,0.007895677418797173,linear,TPESampler,COMPLETE
1045,0.15173461692492574,2025-04-24 23:31:32.086403,2025-04-24 23:31:35.267745,0 days 00:00:03.181342,12.919426190941767,0.025354191974720715,0.0009631423717182667,linear,TPESampler,COMPLETE
1046,0.15240983627442498,2025-04-24 23:31:35.443549,2025-04-24 23:31:57.454170,0 days 00:00:22.010621,78.95097785538954,0.016183759514157323,0.010131250212243694,linear,TPESampler,COMPLETE
1047,0.21138937425396773,2025-04-24 23:31:40.068159,2025-04-24 23:31:41.534039,0 days 00:00:01.465880,66.67592477945804,0.1546658533446799,0.0006788594489538588,linear,TPESampler,COMPLETE
