number,value,datetime_start,datetime_complete,duration,params_C,params_epsilon,params_gamma,params_kernel,system_attrs_auto:sampler,state
2206,0.5371202311242712,2025-04-25 01:41:32.515212,2025-04-25 01:41:33.130649,0 days 00:00:00.615437,19.400143538461034,0.015368682506036933,0.08041269142837687,rbf,TPESampler,COMPLETE
2207,0.565333763548999,2025-04-25 01:41:33.322827,2025-04-25 01:41:33.806298,0 days 00:00:00.483471,8.610634986437008,0.22552917329563346,0.08446474834783074,rbf,TPESampler,COMPLETE
2208,0.1539962632377963,2025-04-25 01:41:33.995138,2025-04-25 01:41:42.525841,0 days 00:00:08.530703,25.733451059625427,0.015588464720519262,0.0033398971042796766,linear,TPESampler,COMPLETE
2209,0.1506037658718578,2025-04-25 01:41:34.147167,2025-04-25 01:41:38.290720,0 days 00:00:04.143553,18.523775460326938,0.027428573572784474,0.060728727318481446,linear,TPESampler,COMPLETE
2210,0.16342808693787003,2025-04-25 01:41:38.479059,2025-04-25 01:41:59.041349,0 days 00:00:20.562290,87.88794899119391,0.06174372841839872,0.008440552869722315,linear,TPESampler,COMPLETE
2211,0.15286613195737972,2025-04-25 01:41:42.716065,2025-04-25 01:41:44.018482,0 days 00:00:01.302417,4.8593750410565955,0.02799240488102268,0.0037399309278749264,linear,TPESampler,COMPLETE
2212,1.398003220252635,2025-04-25 01:41:44.205979,2025-04-25 01:41:44.741899,0 days 00:00:00.535920,0.047514128654566584,0.0019480355002924599,0.0015111798470679322,poly,TPESampler,COMPLETE
2213,0.15486927564365566,2025-04-25 01:41:44.931610,2025-04-25 01:41:54.575990,0 days 00:00:09.644380,26.899835822305654,0.010389120728945734,0.9869421688609087,linear,TPESampler,COMPLETE
2214,0.15632116010419303,2025-04-25 01:41:54.759760,2025-04-25 01:42:00.110280,0 days 00:00:05.350520,22.04930269690487,0.04688856160028323,0.3713690086930296,linear,TPESampler,COMPLETE
2215,0.1543922410128105,2025-04-25 01:41:59.231845,2025-04-25 01:42:35.023905,0 days 00:00:35.792060,92.38955616640376,0.012270548897079687,0.03663105533153212,linear,TPESampler,COMPLETE
2216,0.15537715717114894,2025-04-25 01:42:00.297816,2025-04-25 01:42:20.633767,0 days 00:00:20.335951,97.04526684986685,0.04577007002805388,0.0005469430092909212,linear,TPESampler,COMPLETE
2217,0.14861061372064266,2025-04-25 01:42:20.821272,2025-04-25 01:42:33.142486,0 days 00:00:12.321214,94.58997545784278,0.032400081078436636,0.0005283301348794387,linear,TPESampler,COMPLETE
2218,0.16102873901932607,2025-04-25 01:42:33.329999,2025-04-25 01:42:43.540921,0 days 00:00:10.210922,93.17679031320834,0.0773774931254085,0.0020918697012742285,linear,TPESampler,COMPLETE
2219,0.15525034865722914,2025-04-25 01:42:35.208066,2025-04-25 01:42:36.844923,0 days 00:00:01.636857,3.934125160632829,0.02149316927659514,0.0009734443465744142,linear,TPESampler,COMPLETE
2220,0.16304491717433636,2025-04-25 01:42:37.077586,2025-04-25 01:42:52.505760,0 days 00:00:15.428174,96.16467519673341,0.06308418112233719,0.016241116421412474,linear,TPESampler,COMPLETE
2221,0.15301853035627666,2025-04-25 01:42:43.845632,2025-04-25 01:43:13.755247,0 days 00:00:29.909615,97.67425106552288,0.013777460829243447,0.05585220062186424,linear,TPESampler,COMPLETE
2222,0.1506573612434515,2025-04-25 01:42:52.713368,2025-04-25 01:42:58.951272,0 days 00:00:06.237904,18.153494738868105,0.037144711913861685,0.0008317885679795105,linear,TPESampler,COMPLETE
2223,1.4110276346836839,2025-04-25 01:42:59.143890,2025-04-25 01:42:59.676452,0 days 00:00:00.532562,4.504125345106541,0.06773086584997019,0.00022288791592447283,poly,TPESampler,COMPLETE
2224,0.1515439560481259,2025-04-25 01:42:59.862762,2025-04-25 01:43:29.321176,0 days 00:00:29.458414,93.19165806651343,0.017952526315312987,0.002287251991932305,linear,TPESampler,COMPLETE
2225,0.15847203028718962,2025-04-25 01:43:13.944627,2025-04-25 01:43:26.367819,0 days 00:00:12.423192,92.93937516127413,0.0741746235757091,0.09222756230198946,linear,TPESampler,COMPLETE
2226,0.15042684203609658,2025-04-25 01:43:26.555200,2025-04-25 01:43:56.116201,0 days 00:00:29.561001,95.0646448762214,0.018742659971597683,0.47873700889439375,linear,TPESampler,COMPLETE
2227,0.14977726183145867,2025-04-25 01:43:27.803106,2025-04-25 01:43:45.627932,0 days 00:00:17.824826,99.3337651480831,0.027679932820302018,0.014175315415866308,linear,TPESampler,COMPLETE
2228,0.15851872316824303,2025-04-25 01:43:29.508045,2025-04-25 01:43:31.034648,0 days 00:00:01.526603,15.487057000892653,0.07289759538385494,0.0032424843964628195,linear,TPESampler,COMPLETE
2229,0.15467879493777623,2025-04-25 01:43:31.226709,2025-04-25 01:43:39.064073,0 days 00:00:07.837364,20.789896945146594,0.008450925280050587,0.00039332806039630685,linear,TPESampler,COMPLETE
2230,1.1668206288629266,2025-04-25 01:43:39.294747,2025-04-25 01:43:39.824772,0 days 00:00:00.530025,0.02169453671153062,0.0025406037238388966,0.02356655189745408,sigmoid,TPESampler,COMPLETE
2231,0.15828175882827691,2025-04-25 01:43:40.011954,2025-04-25 01:43:43.256439,0 days 00:00:03.244485,25.179936970084682,0.07434573258103677,0.0014256084205143066,linear,TPESampler,COMPLETE
2232,0.15467670966850303,2025-04-25 01:43:43.447345,2025-04-25 01:43:51.797830,0 days 00:00:08.350485,19.743642015962283,0.010829082510190624,0.0007803572729678265,linear,TPESampler,COMPLETE
2233,0.15956962128083685,2025-04-25 01:43:45.809159,2025-04-25 01:43:49.277008,0 days 00:00:03.467849,21.939073766797936,0.052466023139786405,0.0006004503595614425,linear,TPESampler,COMPLETE
2234,0.22184388043576359,2025-04-25 01:43:49.461343,2025-04-25 01:43:50.474736,0 days 00:00:01.013393,17.642214080912684,0.1660609076825676,0.0002873559336666707,linear,TPESampler,COMPLETE
2235,0.1637099425171665,2025-04-25 01:43:50.657333,2025-04-25 01:43:55.245018,0 days 00:00:04.587685,89.1207952257478,0.08313543678837453,0.14857534466193734,linear,TPESampler,COMPLETE
2236,0.1484461746565032,2025-04-25 01:43:51.986337,2025-04-25 01:44:13.055742,0 days 00:00:21.069405,98.74293038230769,0.032249620992825495,0.0012496358671855244,linear,TPESampler,COMPLETE
2237,0.150484209003487,2025-04-25 01:43:55.438862,2025-04-25 01:44:00.876266,0 days 00:00:05.437404,30.424238349106545,0.03611297656376003,0.003707797924631815,linear,TPESampler,COMPLETE
2238,0.15392334706985522,2025-04-25 01:43:56.308092,2025-04-25 01:44:06.823267,0 days 00:00:10.515175,25.51399286199908,0.008322502220630306,0.1632913161283237,linear,TPESampler,COMPLETE
2239,0.14955891534541949,2025-04-25 01:44:01.057477,2025-04-25 01:44:04.951996,0 days 00:00:03.894519,22.49985613092901,0.03071154286308505,0.09622507418114919,linear,TPESampler,COMPLETE
2240,0.15338334206102874,2025-04-25 01:44:05.135919,2025-04-25 01:44:31.860538,0 days 00:00:26.724619,97.72058034923818,0.013288611791639475,0.0023138641382221157,linear,TPESampler,COMPLETE
2241,0.1517285829206475,2025-04-25 01:44:07.009195,2025-04-25 01:44:17.119322,0 days 00:00:10.110127,27.0033491582275,0.019322316007318614,0.0006463904897565924,linear,TPESampler,COMPLETE
2242,0.1540678204030313,2025-04-25 01:44:13.246097,2025-04-25 01:44:36.719907,0 days 00:00:23.473810,93.38399761200402,0.014839521357085302,0.17334884476969276,linear,TPESampler,COMPLETE
2243,0.7757777936358112,2025-04-25 01:44:17.313436,2025-04-25 01:44:17.813135,0 days 00:00:00.499699,12.828133695949568,0.08210263875861006,0.003627089911360122,poly,TPESampler,COMPLETE
2244,0.14987509263458143,2025-04-25 01:44:17.999098,2025-04-25 01:44:23.561039,0 days 00:00:05.561941,28.691423297609884,0.029801991897111836,0.001054986351632667,linear,TPESampler,COMPLETE
2245,0.7551813581632548,2025-04-25 01:44:23.746361,2025-04-25 01:44:24.245026,0 days 00:00:00.498665,90.26192414860195,0.12628714507179303,0.0007795463339576136,poly,TPESampler,COMPLETE
2246,0.14888214475169112,2025-04-25 01:44:24.440419,2025-04-25 01:44:36.410119,0 days 00:00:11.969700,96.0659355870963,0.034709565924032154,0.36051392734118687,linear,TPESampler,COMPLETE
2247,0.16309549110632385,2025-04-25 01:44:32.052301,2025-04-25 01:44:46.828411,0 days 00:00:14.776110,93.59611881353285,0.0639786417714082,0.0016416545420266436,linear,TPESampler,COMPLETE
2248,0.1541596432410998,2025-04-25 01:44:36.718372,2025-04-25 01:44:43.797778,0 days 00:00:07.079406,19.684932556614502,0.007453307493304616,0.0028057269107089394,linear,TPESampler,COMPLETE
2249,0.156766674448307,2025-04-25 01:44:37.012972,2025-04-25 01:44:41.416563,0 days 00:00:04.403591,19.67931969784563,0.04733215417755298,0.0042806080323394,linear,TPESampler,COMPLETE
2250,0.15456350343644693,2025-04-25 01:44:41.598840,2025-04-25 01:44:52.177724,0 days 00:00:10.578884,26.491200635305223,0.01050110770838634,0.00933420475644214,linear,TPESampler,COMPLETE
2251,0.15677797757925901,2025-04-25 01:44:43.986596,2025-04-25 01:45:01.068735,0 days 00:00:17.082139,90.10016890239969,0.04939626860508733,0.11045248158292607,linear,TPESampler,COMPLETE
2252,0.1633770706152056,2025-04-25 01:44:47.008165,2025-04-25 01:44:58.345900,0 days 00:00:11.337735,98.91506476039618,0.0617166700888767,0.0030009723233686515,linear,TPESampler,COMPLETE
2253,0.15096921292994525,2025-04-25 01:44:52.365075,2025-04-25 01:45:21.458325,0 days 00:00:29.093250,82.99645151541249,0.018478732497917698,0.00664612266927863,linear,TPESampler,COMPLETE
2254,0.22498401036036958,2025-04-25 01:44:58.531462,2025-04-25 01:44:59.116423,0 days 00:00:00.584961,0.27869795015606874,0.0014887915886364587,0.006417460510989813,linear,TPESampler,COMPLETE
2255,0.2141860069661845,2025-04-25 01:44:59.302548,2025-04-25 01:44:59.843724,0 days 00:00:00.541176,92.33204660008377,0.0710722060176553,0.0021059088211506753,rbf,TPESampler,COMPLETE
2256,0.15202086226055103,2025-04-25 01:45:00.061868,2025-04-25 01:45:31.095664,0 days 00:00:31.033796,95.12965810933652,0.015602163392854109,0.0018380781055013003,linear,TPESampler,COMPLETE
2257,0.1492826689146686,2025-04-25 01:45:01.251943,2025-04-25 01:45:04.558575,0 days 00:00:03.306632,17.926820758215037,0.03269489839174515,0.00034567570581703653,linear,TPESampler,COMPLETE
2258,0.15233000166175573,2025-04-25 01:45:04.747539,2025-04-25 01:45:07.785762,0 days 00:00:03.038223,13.775509427503334,0.04020374640171872,0.9716916335688575,linear,TPESampler,COMPLETE
2259,0.16548299230245442,2025-04-25 01:45:07.969242,2025-04-25 01:45:09.681504,0 days 00:00:01.712262,17.03410420107885,0.0851516949354848,0.32161406694485567,linear,TPESampler,COMPLETE
2260,1.412852774198002,2025-04-25 01:45:09.901579,2025-04-25 01:45:10.467771,0 days 00:00:00.566192,0.01801291237029249,0.003321818345210789,0.5263207657812988,sigmoid,TPESampler,COMPLETE
2261,0.15001066030562304,2025-04-25 01:45:10.655536,2025-04-25 01:45:17.660321,0 days 00:00:07.004785,21.466627741519357,0.024872258616463336,0.019000419293807386,linear,TPESampler,COMPLETE
2262,0.15688453365726948,2025-04-25 01:45:17.850328,2025-04-25 01:45:30.377639,0 days 00:00:12.527311,97.39309293410399,0.049948710980733044,0.0007755789786100607,linear,TPESampler,COMPLETE
2263,0.15065478943024252,2025-04-25 01:45:21.644582,2025-04-25 01:45:39.392272,0 days 00:00:17.747690,97.69541567865745,0.038301899135665514,0.00022145697588170983,linear,TPESampler,COMPLETE
2264,0.1576035692097686,2025-04-25 01:45:30.561638,2025-04-25 01:45:41.850849,0 days 00:00:11.289211,96.22421172041945,0.06956050853064095,0.05128713555340668,linear,TPESampler,COMPLETE
2265,0.6847435314662339,2025-04-25 01:45:31.289334,2025-04-25 01:45:31.817299,0 days 00:00:00.527965,94.33351309629137,0.01972625332720685,0.0023236517229700358,poly,TPESampler,COMPLETE
2266,0.1631052871322951,2025-04-25 01:45:32.000473,2025-04-25 01:45:46.375630,0 days 00:00:14.375157,97.81111218568161,0.06307355876181939,0.003112327232454864,linear,TPESampler,COMPLETE
2267,0.14842824829938972,2025-04-25 01:45:39.580392,2025-04-25 01:45:58.165678,0 days 00:00:18.585286,94.61078628834841,0.030749448249012292,0.04430575765109659,linear,TPESampler,COMPLETE
2268,0.1502091818599716,2025-04-25 01:45:42.052448,2025-04-25 01:45:49.807406,0 days 00:00:07.754958,29.590965392098227,0.02318413874950424,0.001803534543797004,linear,TPESampler,COMPLETE
2269,0.21280360311336155,2025-04-25 01:45:46.582962,2025-04-25 01:45:47.369386,0 days 00:00:00.786424,15.741256724162422,0.14764884522565033,0.039436395175762216,linear,TPESampler,COMPLETE
2270,0.2032639137243323,2025-04-25 01:45:47.560912,2025-04-25 01:45:52.305500,0 days 00:00:04.744588,91.47284740865899,0.14033917982086486,0.0002697607019456174,linear,TPESampler,COMPLETE
2271,0.15022779624768612,2025-04-25 01:45:50.009846,2025-04-25 01:46:11.861878,0 days 00:00:21.852032,97.8636169403464,0.019785067472534803,0.00318928319063087,linear,TPESampler,COMPLETE
2272,0.18014315823088023,2025-04-25 01:45:52.503536,2025-04-25 01:45:54.378366,0 days 00:00:01.874830,22.300783470491222,0.10750573272207745,0.0014754277963144374,linear,TPESampler,COMPLETE
2273,0.16452214326489106,2025-04-25 01:45:54.564037,2025-04-25 01:46:04.255854,0 days 00:00:09.691817,86.20840717529632,0.0649342624360898,0.41604373719625554,linear,TPESampler,COMPLETE
2274,0.15425306377304226,2025-04-25 01:45:58.352319,2025-04-25 01:46:13.046616,0 days 00:00:14.694297,90.56774086168733,0.04444622428774462,0.14588997462436495,linear,TPESampler,COMPLETE
2275,0.1499386326466775,2025-04-25 01:46:04.447566,2025-04-25 01:46:07.038722,0 days 00:00:02.591156,9.994667091010486,0.031711929441504486,0.00949851741383811,linear,TPESampler,COMPLETE
2276,0.6791724126771266,2025-04-25 01:46:07.235144,2025-04-25 01:46:07.727330,0 days 00:00:00.492186,0.020873480307282127,0.9538839054144175,0.03406835375354622,poly,TPESampler,COMPLETE
2277,0.15220283598524706,2025-04-25 01:46:07.914537,2025-04-25 01:46:29.523824,0 days 00:00:21.609287,83.86516266424631,0.016058434782178055,0.00042999938914175975,linear,TPESampler,COMPLETE
2278,0.15085823506376678,2025-04-25 01:46:12.051188,2025-04-25 01:46:16.733148,0 days 00:00:04.681960,22.23602720898987,0.027218686469739812,0.0005058398620428487,linear,TPESampler,COMPLETE
2279,369.50371432452687,2025-04-25 01:46:13.241590,2025-04-25 01:46:13.752977,0 days 00:00:00.511387,16.93226037669528,0.03058487719615175,0.26310472194951945,sigmoid,TPESampler,COMPLETE
2280,0.16336761393457733,2025-04-25 01:46:13.934235,2025-04-25 01:46:17.242336,0 days 00:00:03.308101,23.487858443824763,0.0609331890173143,0.007291169397964939,linear,TPESampler,COMPLETE
2281,0.15425867190946438,2025-04-25 01:46:16.918222,2025-04-25 01:46:25.995859,0 days 00:00:09.077637,24.253911708737736,0.012102909656722258,0.0006791815841610294,linear,TPESampler,COMPLETE
2282,0.16411505628597434,2025-04-25 01:46:17.450440,2025-04-25 01:46:20.951100,0 days 00:00:03.500660,18.977784787405305,0.06174044078798105,0.0004526865998316273,linear,TPESampler,COMPLETE
2283,0.14958629310002008,2025-04-25 01:46:21.141948,2025-04-25 01:46:43.760931,0 days 00:00:22.618983,91.68538870691674,0.024707743696982146,0.0007434718510877686,linear,TPESampler,COMPLETE
2284,0.30923597514369516,2025-04-25 01:46:26.184386,2025-04-25 01:46:26.711573,0 days 00:00:00.527187,59.2540243527708,0.06684034422378558,0.010843226389940572,rbf,TPESampler,COMPLETE
2285,0.15098435647606834,2025-04-25 01:46:26.906455,2025-04-25 01:46:31.251580,0 days 00:00:04.345125,19.186444479108673,0.027032342663713592,0.0009208061972996562,linear,TPESampler,COMPLETE
2286,0.15132517785159907,2025-04-25 01:46:29.710355,2025-04-25 01:46:46.371229,0 days 00:00:16.660874,99.91139066663357,0.03938270570406923,0.11625765005017802,linear,TPESampler,COMPLETE
2287,0.15009100542918044,2025-04-25 01:46:31.434808,2025-04-25 01:46:53.278978,0 days 00:00:21.844170,93.47793407523938,0.027346779155987187,0.0027589816616793764,linear,TPESampler,COMPLETE
2288,0.17653963220521343,2025-04-25 01:46:43.951351,2025-04-25 01:46:54.942956,0 days 00:00:10.991605,97.2445568233983,0.1111494167537284,0.0002549125894182789,linear,TPESampler,COMPLETE
2289,0.9122018474585919,2025-04-25 01:46:46.554529,2025-04-25 01:46:47.050006,0 days 00:00:00.495477,3.604132222277395,0.02356516448746447,0.0013454784485886977,poly,TPESampler,COMPLETE
2290,0.27120104980867427,2025-04-25 01:46:47.231703,2025-04-25 01:46:48.662666,0 days 00:00:01.430963,97.51106136186937,0.25415036380504474,0.0010996805516774119,linear,TPESampler,COMPLETE
2291,0.15403447168934578,2025-04-25 01:46:48.846407,2025-04-25 01:47:29.810400,0 days 00:00:40.963993,98.0228058005446,0.011056140233651068,0.0013810298995308077,linear,TPESampler,COMPLETE
2292,0.16422210457808675,2025-04-25 01:46:53.459962,2025-04-25 01:46:55.398081,0 days 00:00:01.938119,22.102544805513073,0.08376369969268468,0.0290753639456893,linear,TPESampler,COMPLETE
2293,0.2500662069145819,2025-04-25 01:46:55.126850,2025-04-25 01:46:55.654081,0 days 00:00:00.527231,2.1814842588848165,0.17170355218177363,0.005972256503445476,linear,TPESampler,COMPLETE
2294,1.6545796313620746,2025-04-25 01:46:55.591310,2025-04-25 02:03:19.629291,0 days 00:16:24.037981,85.92649722572712,0.023448618127125967,0.1401873584414271,poly,TPESampler,COMPLETE
2295,0.8798251184937823,2025-04-25 01:46:55.883552,2025-04-25 01:46:56.442027,0 days 00:00:00.558475,90.5244733827326,0.025227832377451773,0.0007119833445681048,sigmoid,TPESampler,COMPLETE
2296,0.15491615288574176,2025-04-25 01:46:56.627335,2025-04-25 01:47:32.107706,0 days 00:00:35.480371,97.05053095095323,0.00594650705150235,0.0010837944990538706,linear,TPESampler,COMPLETE
2297,0.15373816238609214,2025-04-25 01:47:30.000654,2025-04-25 01:47:36.604717,0 days 00:00:06.604063,21.150074082465153,0.015808850081494383,0.35834406360466764,linear,TPESampler,COMPLETE
2298,0.14834480775062783,2025-04-25 01:47:32.289633,2025-04-25 01:47:49.789304,0 days 00:00:17.499671,99.32362760996399,0.0314828696261875,0.383256057993806,linear,TPESampler,COMPLETE
2299,0.15657560517112054,2025-04-25 01:47:36.788197,2025-04-25 01:47:40.817078,0 days 00:00:04.028881,11.416781987551797,0.01322866814865563,0.0955753861066281,linear,TPESampler,COMPLETE
2300,0.1498885244791165,2025-04-25 01:47:41.003080,2025-04-25 01:48:07.077057,0 days 00:00:26.073977,90.99877826668407,0.025485611361222717,0.008086932567824305,linear,TPESampler,COMPLETE
2301,0.15448064795901792,2025-04-25 01:47:50.014094,2025-04-25 01:47:59.254748,0 days 00:00:09.240654,19.79195655985621,0.010390965426785323,0.20667220202676895,linear,TPESampler,COMPLETE
2302,0.15211160732768203,2025-04-25 01:47:59.441580,2025-04-25 01:48:19.985116,0 days 00:00:20.543536,67.09961457946392,0.01801218335661589,0.5071593259153004,linear,TPESampler,COMPLETE
2303,1.2324797215112233,2025-04-25 01:48:07.263627,2025-04-25 01:48:07.758337,0 days 00:00:00.494710,0.014339374288513626,0.23675835989602917,0.08982130513103351,rbf,TPESampler,COMPLETE
2304,0.15650474967158717,2025-04-25 01:48:07.940453,2025-04-25 01:48:10.532891,0 days 00:00:02.592438,25.11740413159195,0.07217285991987794,0.5327960336072515,linear,TPESampler,COMPLETE
2305,0.14935050989754495,2025-04-25 01:48:10.733846,2025-04-25 01:48:14.581962,0 days 00:00:03.848116,22.0559382905968,0.033776450027636955,0.40463479502179195,linear,TPESampler,COMPLETE
2306,0.15611306182027732,2025-04-25 01:48:14.763343,2025-04-25 01:48:19.476760,0 days 00:00:04.713417,15.849054930000555,0.014668278443767224,0.21813184972054578,linear,TPESampler,COMPLETE
2307,0.15247721063238526,2025-04-25 01:48:19.657487,2025-04-25 01:48:33.497880,0 days 00:00:13.840393,39.327998256777306,0.01843915756088642,0.12754968902573685,linear,TPESampler,COMPLETE
2308,1.351634567403544,2025-04-25 01:48:20.183178,2025-04-25 01:48:20.706987,0 days 00:00:00.523809,0.002458892873578648,0.1276256192977497,0.022822128857717835,rbf,TPESampler,COMPLETE
2309,0.16230117775008862,2025-04-25 01:48:20.901331,2025-04-25 01:48:34.458615,0 days 00:00:13.557284,87.0947656654137,0.06672659751295042,0.8508736097726716,linear,TPESampler,COMPLETE
2310,0.15635255042111212,2025-04-25 01:48:33.692900,2025-04-25 01:48:36.613828,0 days 00:00:02.920928,28.257101304926394,0.07163445537994743,0.5232556578631492,linear,TPESampler,COMPLETE
2311,0.16346185199407431,2025-04-25 01:48:34.643725,2025-04-25 01:48:48.531584,0 days 00:00:13.887859,99.21631492829404,0.0610909839198493,0.3917492205435415,linear,TPESampler,COMPLETE
2312,0.15044924242144592,2025-04-25 01:48:36.799031,2025-04-25 01:48:41.117713,0 days 00:00:04.318682,15.99236398136872,0.025215615110916773,0.28819259605558545,linear,TPESampler,COMPLETE
2313,0.15554745457532076,2025-04-25 01:48:41.302817,2025-04-25 01:48:47.161698,0 days 00:00:05.858881,15.797184580172463,0.005872007759769021,0.48084345678742163,linear,TPESampler,COMPLETE
2314,0.15690441740418118,2025-04-25 01:48:47.349503,2025-04-25 01:49:01.349250,0 days 00:00:13.999747,81.68465991936849,0.04988506808453882,0.32779186742347727,linear,TPESampler,COMPLETE
2315,0.15032254927986125,2025-04-25 01:48:48.719439,2025-04-25 01:48:59.633295,0 days 00:00:10.913856,31.31143181714618,0.021584055150085064,0.7596107745205714,linear,TPESampler,COMPLETE
2316,0.15009750601386534,2025-04-25 01:48:59.824638,2025-04-25 01:49:36.674511,0 days 00:00:36.849873,79.38675168938073,0.02330920939198351,0.8886046459445662,linear,TPESampler,COMPLETE
2317,1.0026001049465252,2025-04-25 01:49:01.541827,2025-04-25 01:49:02.066315,0 days 00:00:00.524488,99.05320474834555,0.04205434502122071,0.9395734201673277,rbf,TPESampler,COMPLETE
2318,0.15087539469349812,2025-04-25 01:49:02.248295,2025-04-25 01:49:08.428527,0 days 00:00:06.180232,26.99532084969561,0.019911519217926936,0.2371693334300304,linear,TPESampler,COMPLETE
2319,0.15322628415308073,2025-04-25 01:49:08.612306,2025-04-25 01:49:24.610469,0 days 00:00:15.998163,56.93301104836305,0.017538282505889798,0.1642593626965889,linear,TPESampler,COMPLETE
2320,0.5034613849929473,2025-04-25 01:49:24.800896,2025-04-25 01:49:25.341192,0 days 00:00:00.540296,8.510733549565566,0.009252118041907181,0.00014848799470412039,sigmoid,TPESampler,COMPLETE
2321,0.16208747343207516,2025-04-25 01:49:25.519409,2025-04-25 01:49:26.681784,0 days 00:00:01.162375,3.8464476768283893,0.05207507446247977,0.29411600712466746,linear,TPESampler,COMPLETE
