number,value,datetime_start,datetime_complete,duration,params_C,params_epsilon,params_gamma,params_kernel,system_attrs_auto:sampler,state
1626,0.16200530907932859,2025-04-25 00:20:14.720134,2025-04-25 00:20:25.506340,0 days 00:00:10.786206,78.79853343670516,0.0664620975559316,0.0001856874595505713,linear,TPESampler,COMPLETE
1627,0.21713513368444345,2025-04-25 00:20:18.172020,2025-04-25 00:20:18.698604,0 days 00:00:00.526584,99.10093468229972,0.03791752209955135,0.0005307475248764533,rbf,TPESampler,COMPLETE
1628,0.1552879079596212,2025-04-25 00:20:18.879142,2025-04-25 00:20:26.084714,0 days 00:00:07.205572,18.20346436282715,0.01053022653182576,0.00010367477741736403,linear,TPESampler,COMPLETE
1629,0.15129090932056885,2025-04-25 00:20:25.857672,2025-04-25 00:20:28.676315,0 days 00:00:02.818643,11.987724515158387,0.03666014557042762,0.00016900422948214444,linear,TPESampler,COMPLETE
1630,0.15614888410976266,2025-04-25 00:20:26.310335,2025-04-25 00:20:29.763362,0 days 00:00:03.453027,12.985884362104589,0.04640038218419915,0.09803736204271778,linear,TPESampler,COMPLETE
1631,0.2829335543222377,2025-04-25 00:20:28.861534,2025-04-25 00:20:29.543652,0 days 00:00:00.682118,24.01608413061966,0.2666295598290835,0.0009203238918375034,linear,TPESampler,COMPLETE
1632,0.14983818011015768,2025-04-25 00:20:29.723321,2025-04-25 00:20:57.005023,0 days 00:00:27.281702,99.34158864970055,0.02539585109286165,0.0913382419598528,linear,TPESampler,COMPLETE
1633,0.15017928889606705,2025-04-25 00:20:29.967653,2025-04-25 00:20:35.554224,0 days 00:00:05.586571,26.11901543481773,0.028599770788789138,0.0003311114627415892,linear,TPESampler,COMPLETE
1634,0.14994670098336357,2025-04-25 00:20:35.726105,2025-04-25 00:20:59.754313,0 days 00:00:24.028208,92.51169487428356,0.020626682582538126,0.00030116562747002163,linear,TPESampler,COMPLETE
1635,0.14872074417698647,2025-04-25 00:20:57.184270,2025-04-25 00:21:16.621949,0 days 00:00:19.437679,86.55937441402833,0.032654993069508434,0.0004441715635410273,linear,TPESampler,COMPLETE
1636,0.1566139383512309,2025-04-25 00:20:59.937369,2025-04-25 00:21:04.163438,0 days 00:00:04.226069,13.283756415035185,0.012917312456867034,0.0003420664312721354,linear,TPESampler,COMPLETE
1637,0.17577071853881077,2025-04-25 00:21:04.345390,2025-04-25 00:21:15.206995,0 days 00:00:10.861605,97.3321246417799,0.11436213705460445,0.0002608107044787953,linear,TPESampler,COMPLETE
1638,1.24470669373712,2025-04-25 00:21:15.386696,2025-04-25 00:21:15.918000,0 days 00:00:00.531304,0.21494892559520046,0.0013588335602188278,0.00014219601839362026,rbf,TPESampler,COMPLETE
1639,0.18010777420459856,2025-04-25 00:21:16.097955,2025-04-25 00:21:17.632986,0 days 00:00:01.535031,20.821293942458706,0.10628616640200321,0.054960887472503106,linear,TPESampler,COMPLETE
1640,0.15437250262009392,2025-04-25 00:21:16.803399,2025-04-25 00:21:50.408530,0 days 00:00:33.605131,69.48548043169474,0.011243145147992604,0.00011633536838869645,linear,TPESampler,COMPLETE
1641,0.15265420573383398,2025-04-25 00:21:17.815211,2025-04-25 00:21:24.130414,0 days 00:00:06.315203,27.95873261952971,0.042243611098669816,0.00015660129624629144,linear,TPESampler,COMPLETE
1642,0.15051544316880378,2025-04-25 00:21:24.324196,2025-04-25 00:21:31.076763,0 days 00:00:06.752567,34.233785248438856,0.03709159108196308,0.00010289609114148268,linear,TPESampler,COMPLETE
1643,0.18575142056461527,2025-04-25 00:21:31.271817,2025-04-25 00:21:32.526644,0 days 00:00:01.254827,20.516281874111023,0.12050958672824269,0.0006345592708036659,linear,TPESampler,COMPLETE
1644,0.15327620269425885,2025-04-25 00:21:32.711612,2025-04-25 00:22:08.391649,0 days 00:00:35.680037,97.2755536732088,0.00970629654194343,0.0003300529400694856,linear,TPESampler,COMPLETE
1645,0.15028718944552938,2025-04-25 00:21:50.589106,2025-04-25 00:22:08.234925,0 days 00:00:17.645819,73.98012987198713,0.01972300773675816,0.0001738350585582984,linear,TPESampler,COMPLETE
1646,0.15016202377526644,2025-04-25 00:22:08.394249,2025-04-25 00:22:31.062405,0 days 00:00:22.668156,98.13141998527783,0.020272234696741633,0.00043283599085155745,linear,TPESampler,COMPLETE
1647,0.16363682834543541,2025-04-25 00:22:08.571907,2025-04-25 00:22:23.246605,0 days 00:00:14.674698,86.14718078985739,0.05813990933950233,0.29744984568116195,linear,TPESampler,COMPLETE
1648,0.15082827346923794,2025-04-25 00:22:23.430689,2025-04-25 00:22:28.887221,0 days 00:00:05.456532,20.676420254869832,0.02670333943984665,0.10982365404719135,linear,TPESampler,COMPLETE
1649,0.15565155353896287,2025-04-25 00:22:29.074522,2025-04-25 00:23:00.898285,0 days 00:00:31.823763,86.99974217263369,0.002612021289842166,0.00011889536013488535,linear,TPESampler,COMPLETE
1650,0.15367767400180016,2025-04-25 00:22:31.343088,2025-04-25 00:22:34.557179,0 days 00:00:03.214091,13.025824137747898,0.041612041595334937,0.0006764071413212463,linear,TPESampler,COMPLETE
1651,0.15000000205279473,2025-04-25 00:22:34.736697,2025-04-25 00:22:56.317767,0 days 00:00:21.581070,88.17866725603056,0.02107752120412328,0.0002512707629353883,linear,TPESampler,COMPLETE
1652,0.14911622545061723,2025-04-25 00:22:56.506295,2025-04-25 00:23:01.195412,0 days 00:00:04.689117,27.936013731897248,0.031604941472056176,0.05880563212265449,linear,TPESampler,COMPLETE
1653,0.1549044234038891,2025-04-25 00:23:01.080340,2025-04-25 00:23:08.166311,0 days 00:00:07.085971,19.40988875398446,0.012071516691881048,0.9095631761156685,linear,TPESampler,COMPLETE
1654,0.17848747809256135,2025-04-25 00:23:01.383959,2025-04-25 00:23:02.849818,0 days 00:00:01.465859,18.18623532118948,0.10242417712567053,0.0005793014061034592,linear,TPESampler,COMPLETE
1655,0.1539441538908781,2025-04-25 00:23:03.028877,2025-04-25 00:23:34.403452,0 days 00:00:31.374575,96.2803372470794,0.013411724596433397,0.10294623659388333,linear,TPESampler,COMPLETE
1656,0.152104286711312,2025-04-25 00:23:08.482621,2025-04-25 00:23:12.818660,0 days 00:00:04.336039,12.541231585601317,0.020567025379533,0.0004446546702298361,linear,TPESampler,COMPLETE
1657,0.15806488964300958,2025-04-25 00:23:12.999599,2025-04-25 00:23:25.500048,0 days 00:00:12.500449,82.64799023949266,0.06892215879048917,0.0003559731661076467,linear,TPESampler,COMPLETE
1658,0.15014608932780657,2025-04-25 00:23:25.704656,2025-04-25 00:23:47.896664,0 days 00:00:22.192008,94.44932640510633,0.026049727878229345,0.0014555789524799757,linear,TPESampler,COMPLETE
1659,0.16311316994048014,2025-04-25 00:23:34.590072,2025-04-25 00:23:37.147380,0 days 00:00:02.557308,22.016983473222222,0.06034793448966237,0.0011193651808309752,linear,TPESampler,COMPLETE
1660,0.14848622791282082,2025-04-25 00:23:37.319870,2025-04-25 00:23:57.891114,0 days 00:00:20.571244,98.24763319878491,0.030392482073616663,0.34824925217651,linear,TPESampler,COMPLETE
1661,0.151468576699933,2025-04-25 00:23:48.085697,2025-04-25 00:24:02.510449,0 days 00:00:14.424752,86.12508233076747,0.03968753541443048,0.00013047551966901484,linear,TPESampler,COMPLETE
1662,0.14999869055523468,2025-04-25 00:23:58.071504,2025-04-25 00:24:21.537960,0 days 00:00:23.466456,97.91811981915511,0.025777942415422927,0.0008505153676461079,linear,TPESampler,COMPLETE
1663,0.19874274203318265,2025-04-25 00:24:02.690932,2025-04-25 00:24:04.749939,0 days 00:00:02.059007,18.50627831449181,0.13000505539334997,0.21562276484625492,linear,TPESampler,COMPLETE
1664,0.15211215610321133,2025-04-25 00:24:04.926209,2025-04-25 00:24:33.619292,0 days 00:00:28.693083,93.99145188775675,0.016425493652659294,0.0001027091714432255,linear,TPESampler,COMPLETE
1665,0.16266347100199904,2025-04-25 00:24:21.720004,2025-04-25 00:24:23.981883,0 days 00:00:02.261879,16.96157793271975,0.07808574439379495,0.0025687620726835684,linear,TPESampler,COMPLETE
1666,0.1500475206629943,2025-04-25 00:24:24.162048,2025-04-25 00:24:58.082250,0 days 00:00:33.920202,96.72966182044185,0.022936993427422083,0.056596941046007966,linear,TPESampler,COMPLETE
1667,0.760938573271548,2025-04-25 00:24:33.800787,2025-04-25 00:24:34.313187,0 days 00:00:00.512400,64.81834762953594,0.01364282817516301,0.0008982621844206031,poly,TPESampler,COMPLETE
1668,0.19804193038154985,2025-04-25 00:24:34.491667,2025-04-25 00:24:37.063329,0 days 00:00:02.571662,95.08010700117768,0.1359267693360143,0.03267537634378101,linear,TPESampler,COMPLETE
1669,1.7975415564911876,2025-04-25 00:24:37.236037,2025-04-25 00:24:37.747712,0 days 00:00:00.511675,66.33714555441865,0.027130739089800054,0.001027797468039335,sigmoid,TPESampler,COMPLETE
1670,0.15413972747929894,2025-04-25 00:24:37.922866,2025-04-25 00:25:07.712873,0 days 00:00:29.790007,90.07058426163745,0.0048707856347107595,0.0005457347444147414,linear,TPESampler,COMPLETE
1671,0.7736589121876903,2025-04-25 00:24:58.261735,2025-04-25 00:24:58.755045,0 days 00:00:00.493310,87.54183036139163,0.033865639098317246,0.0007286221678336007,poly,TPESampler,COMPLETE
1672,0.14977196092525807,2025-04-25 00:24:58.927196,2025-04-25 00:25:02.306526,0 days 00:00:03.379330,11.335403673630202,0.032484254236217494,0.0010699548276082115,linear,TPESampler,COMPLETE
1673,0.1505844520760401,2025-04-25 00:25:02.484355,2025-04-25 00:25:06.640125,0 days 00:00:04.155770,16.03684513972131,0.03772195887313757,0.0008841392610484912,linear,TPESampler,COMPLETE
1674,0.16127460239372027,2025-04-25 00:25:06.814924,2025-04-25 00:25:08.537232,0 days 00:00:01.722308,23.301818232718553,0.07879811344239734,0.11735244992686739,linear,TPESampler,COMPLETE
1675,0.14968716964076875,2025-04-25 00:25:07.898408,2025-04-25 00:25:13.691364,0 days 00:00:05.792956,30.90393472441743,0.03512222098878978,0.0018155251451852587,linear,TPESampler,COMPLETE
1676,0.1486511867805355,2025-04-25 00:25:08.718305,2025-04-25 00:25:22.179402,0 days 00:00:13.461097,88.95701028525782,0.03442720187161755,0.0005068034700440172,linear,TPESampler,COMPLETE
1677,0.15059481075738554,2025-04-25 00:25:13.869035,2025-04-25 00:25:18.006126,0 days 00:00:04.137091,22.55562811981508,0.03785921852066183,0.0025385639892103267,linear,TPESampler,COMPLETE
1678,0.4423753356290267,2025-04-25 00:25:18.184267,2025-04-25 00:25:18.638710,0 days 00:00:00.454443,0.06415704576142545,0.6389152473827463,0.00010014850669159452,linear,TPESampler,COMPLETE
1679,47.698867457197814,2025-04-25 00:25:18.820288,2025-04-25 00:58:15.967468,0 days 00:32:57.147180,72.35435671398703,0.01104616822081303,0.7493773822958109,poly,TPESampler,COMPLETE
1680,0.15718910811124095,2025-04-25 00:25:22.363268,2025-04-25 00:25:39.586536,0 days 00:00:17.223268,94.26504480070477,0.04782159380106845,0.001171370211974863,linear,TPESampler,COMPLETE
1681,0.3261780342622565,2025-04-25 00:25:39.767892,2025-04-25 00:25:40.296153,0 days 00:00:00.528261,0.05568389804330276,0.008423788730547057,0.0006546890700037399,linear,TPESampler,COMPLETE
1682,1.2125084167569793,2025-04-25 00:25:40.472976,2025-04-25 00:25:40.998644,0 days 00:00:00.525668,0.008763194754217524,0.0058682814629073075,0.025364935688663114,rbf,TPESampler,COMPLETE
1683,0.1590929716861319,2025-04-25 00:25:41.189854,2025-04-25 00:25:44.457554,0 days 00:00:03.267700,16.91822434339667,0.05019520494810415,0.8443658755665061,linear,TPESampler,COMPLETE
1684,0.15060554160815268,2025-04-25 00:25:44.662480,2025-04-25 00:25:48.333544,0 days 00:00:03.671064,14.328582598412197,0.03819908766669554,0.18864986068416895,linear,TPESampler,COMPLETE
1685,0.15655318208211527,2025-04-25 00:25:48.533107,2025-04-25 00:25:49.554414,0 days 00:00:01.021307,1.9936239616838052,0.028311576770584757,0.0062104832988528836,linear,TPESampler,COMPLETE
1686,0.15284842083356281,2025-04-25 00:25:49.737326,2025-04-25 00:25:55.085765,0 days 00:00:05.348439,25.054101606252768,0.042578076083124056,0.0005516597783325132,linear,TPESampler,COMPLETE
1687,0.19963644354992252,2025-04-25 00:25:55.266192,2025-04-25 00:25:58.021931,0 days 00:00:02.755739,95.10965722891258,0.13752291597543448,0.0016755371823587593,linear,TPESampler,COMPLETE
1688,0.9673053264121617,2025-04-25 00:25:58.209021,2025-04-25 00:25:58.677925,0 days 00:00:00.468904,0.1084451390911078,0.6855000326334397,0.001622567192701046,rbf,TPESampler,COMPLETE
1689,0.15108493473704998,2025-04-25 00:25:58.859910,2025-04-25 00:26:03.906692,0 days 00:00:05.046782,18.933001941337654,0.026293283380531038,0.0029928070802310793,linear,TPESampler,COMPLETE
1690,0.15380576367687368,2025-04-25 00:26:04.081148,2025-04-25 00:26:11.791984,0 days 00:00:07.710836,20.447043392867585,0.008451305444225246,0.0004200104214347404,linear,TPESampler,COMPLETE
1691,0.15224669830425488,2025-04-25 00:26:11.971662,2025-04-25 00:26:40.039163,0 days 00:00:28.067501,91.38563223644222,0.016278081924868112,0.003972099226457949,linear,TPESampler,COMPLETE
1692,0.24968239635635,2025-04-25 00:26:40.226793,2025-04-25 00:26:40.739397,0 days 00:00:00.512604,23.78853777894326,0.038027134300842674,0.001130710608108793,rbf,TPESampler,COMPLETE
1693,0.21062277040219043,2025-04-25 00:26:40.921266,2025-04-25 00:26:42.722863,0 days 00:00:01.801597,93.47772093450048,0.15461513849771122,0.0004990096266507926,linear,TPESampler,COMPLETE
1694,0.15659484540783736,2025-04-25 00:26:42.908976,2025-04-25 00:26:46.318918,0 days 00:00:03.409942,13.888394518523837,0.014777366965255686,0.00130714167440027,linear,TPESampler,COMPLETE
1695,0.1483643343602846,2025-04-25 00:26:46.508612,2025-04-25 00:27:08.653272,0 days 00:00:22.144660,95.80125504572906,0.030984063054235574,0.36925036583360055,linear,TPESampler,COMPLETE
1696,0.15568435053198235,2025-04-25 00:27:08.837000,2025-04-25 00:27:13.365867,0 days 00:00:04.528867,17.853882561572366,0.04606627040979007,0.5357429458602939,linear,TPESampler,COMPLETE
1697,0.16365253541272795,2025-04-25 00:27:13.551969,2025-04-25 00:27:21.405773,0 days 00:00:07.853804,55.70728303505228,0.05884323407787736,0.10021607206452923,linear,TPESampler,COMPLETE
1698,0.15171582206371043,2025-04-25 00:27:21.842348,2025-04-25 00:27:35.742279,0 days 00:00:13.899931,71.54351660203058,0.03996544143677151,0.3582291172113867,linear,TPESampler,COMPLETE
1699,0.15721702108636915,2025-04-25 00:27:35.924901,2025-04-25 00:27:51.269030,0 days 00:00:15.344129,80.71475667219367,0.04785896121609973,0.2517772725427481,linear,TPESampler,COMPLETE
1700,0.1513441571027636,2025-04-25 00:27:51.456317,2025-04-25 00:27:58.687175,0 days 00:00:07.230858,25.73908056345214,0.019816368752995476,0.8551249127018111,linear,TPESampler,COMPLETE
1701,0.1537940090398319,2025-04-25 00:27:58.872057,2025-04-25 00:28:18.630829,0 days 00:00:19.758772,54.337721606001,0.018002393260352814,0.34279739751830623,linear,TPESampler,COMPLETE
1702,0.15021704931364413,2025-04-25 00:28:18.809419,2025-04-25 00:28:38.835690,0 days 00:00:20.026271,77.67631098873343,0.02014523888218787,0.6215046372506876,linear,TPESampler,COMPLETE
1703,0.1502475651607748,2025-04-25 00:28:39.019331,2025-04-25 00:29:01.289325,0 days 00:00:22.269994,91.05972140184664,0.02623636876627523,0.29313052085661323,linear,TPESampler,COMPLETE
1704,0.1552088128224634,2025-04-25 00:29:01.469971,2025-04-25 00:29:03.213691,0 days 00:00:01.743720,5.781078330127932,0.01718284555155185,0.33375439424257036,linear,TPESampler,COMPLETE
1705,0.15325937008388185,2025-04-25 00:29:03.398188,2025-04-25 00:29:07.511113,0 days 00:00:04.112925,22.011901897609047,0.04332954112373567,0.3164251186391636,linear,TPESampler,COMPLETE
1706,0.35883842843182073,2025-04-25 00:29:07.685793,2025-04-25 00:29:08.251531,0 days 00:00:00.565738,2.7801346222159817,0.008513305227226054,0.023537414441505967,poly,TPESampler,COMPLETE
1707,0.16231777413093873,2025-04-25 00:29:08.438575,2025-04-25 00:29:20.318269,0 days 00:00:11.879694,89.51023971655852,0.05713794786118109,0.6106709324749179,linear,TPESampler,COMPLETE
1708,0.15470981197798406,2025-04-25 00:29:20.500134,2025-04-25 00:30:00.847100,0 days 00:00:40.346966,81.88305840784021,0.01141973105383994,0.2854561712046082,linear,TPESampler,COMPLETE
1709,0.15416749804778,2025-04-25 00:30:01.037609,2025-04-25 00:30:02.569936,0 days 00:00:01.532327,4.437082193166162,0.03475216071655177,0.06259877614419666,linear,TPESampler,COMPLETE
1710,0.17745060772368856,2025-04-25 00:30:02.749003,2025-04-25 00:30:07.096426,0 days 00:00:04.347423,72.37789441699144,0.1155733660925512,0.12051530716017478,linear,TPESampler,COMPLETE
1711,0.15451560727847644,2025-04-25 00:30:07.279076,2025-04-25 00:30:09.942635,0 days 00:00:02.663559,8.920363889631892,0.0174123977287912,0.1583103719402141,linear,TPESampler,COMPLETE
1712,0.14981527926288918,2025-04-25 00:30:10.124343,2025-04-25 00:30:18.228319,0 days 00:00:08.103976,40.231700538533715,0.027660179963357994,0.2145804117068361,linear,TPESampler,COMPLETE
1713,0.14851598658746473,2025-04-25 00:30:18.416234,2025-04-25 00:30:39.910427,0 days 00:00:21.494193,96.45673302366801,0.03191148607057583,0.27581769044574983,linear,TPESampler,COMPLETE
1714,8.969606710434356,2025-04-25 00:30:40.094633,2025-04-25 00:30:40.608893,0 days 00:00:00.514260,0.49188816978434574,0.020146073930086706,0.15752832157569463,sigmoid,TPESampler,COMPLETE
1715,0.1489232562262111,2025-04-25 00:30:40.787605,2025-04-25 00:30:53.766382,0 days 00:00:12.978777,87.51702697101796,0.034784060145978186,0.14094516814933242,linear,TPESampler,COMPLETE
1716,0.41730553644683516,2025-04-25 00:30:53.948338,2025-04-25 00:30:54.432750,0 days 00:00:00.484412,66.56899482543479,0.15195165302026548,0.00015269069888034433,sigmoid,TPESampler,COMPLETE
1717,0.18653505377744964,2025-04-25 00:30:54.616163,2025-04-25 00:30:55.275074,0 days 00:00:00.658911,2.8223925461252506,0.09242701739702266,0.9070796719832874,linear,TPESampler,COMPLETE
1718,0.21714461628651435,2025-04-25 00:30:55.452078,2025-04-25 00:30:56.786153,0 days 00:00:01.334075,65.40842132773975,0.1683063342488179,0.6184776979712817,linear,TPESampler,COMPLETE
1719,0.7950681929509296,2025-04-25 00:30:56.964692,2025-04-25 00:30:57.494879,0 days 00:00:00.530187,0.12434829051260833,0.0018660904082000301,0.022199656005638453,rbf,TPESampler,COMPLETE
1720,0.15728416870523432,2025-04-25 00:30:57.676590,2025-04-25 00:31:01.298278,0 days 00:00:03.621688,8.270728690874938,0.0023199309625124604,0.1535785444711003,linear,TPESampler,COMPLETE
1721,0.6971571837721912,2025-04-25 00:31:01.482097,2025-04-25 00:31:02.001093,0 days 00:00:00.518996,35.38907673344556,0.04880616242943848,0.23854859666429842,rbf,TPESampler,COMPLETE
1722,0.15020293298126844,2025-04-25 00:31:02.196677,2025-04-25 00:31:13.269190,0 days 00:00:11.072513,38.777902137513315,0.022941413736675853,0.10483484733148446,linear,TPESampler,COMPLETE
1723,0.14951616023767964,2025-04-25 00:31:13.450775,2025-04-25 00:31:35.211943,0 days 00:00:21.761168,95.1390085590989,0.03622026361279283,0.7988484312344521,linear,TPESampler,COMPLETE
1724,0.15342067355809755,2025-04-25 00:31:35.393353,2025-04-25 00:32:03.049681,0 days 00:00:27.656328,92.5075688325547,0.014441976887865703,0.04038750163829312,linear,TPESampler,COMPLETE
1725,0.15515302103617293,2025-04-25 00:32:03.229813,2025-04-25 00:32:11.132444,0 days 00:00:07.902631,18.225278208906225,0.011161060074737866,0.11239447889307898,linear,TPESampler,COMPLETE
1726,0.15638146774535377,2025-04-25 00:32:11.316554,2025-04-25 00:32:24.450183,0 days 00:00:13.133629,91.30424474024255,0.052063740560561754,0.2071528524417438,linear,TPESampler,COMPLETE
1727,0.1526102014308872,2025-04-25 00:32:24.632471,2025-04-25 00:32:38.476226,0 days 00:00:13.843755,66.64766315644397,0.04223397634127509,0.0708704228848517,linear,TPESampler,COMPLETE
1728,0.17601021475867315,2025-04-25 00:32:38.659062,2025-04-25 00:32:39.967764,0 days 00:00:01.308702,13.566930330676527,0.09811611342613305,0.3217636769036184,linear,TPESampler,COMPLETE
1729,0.15252945202324222,2025-04-25 00:32:40.153116,2025-04-25 00:32:43.242401,0 days 00:00:03.089285,14.525758289109502,0.04062424445849624,0.15319037748830694,linear,TPESampler,COMPLETE
1730,1.174575311469366,2025-04-25 00:32:43.588344,2025-04-25 00:32:44.644473,0 days 00:00:01.056129,0.01801386735255632,0.6678089661004891,0.009366399870337588,rbf,TPESampler,COMPLETE
1731,0.1672727820410608,2025-04-25 00:32:45.084034,2025-04-25 00:32:50.392863,0 days 00:00:05.308829,96.12346885585724,0.08892523743461948,0.045451273730521186,linear,TPESampler,COMPLETE
1732,0.15473843095827824,2025-04-25 00:32:50.586107,2025-04-25 00:33:19.824139,0 days 00:00:29.238032,65.47660088973186,0.006045872109449987,0.4239805039768729,linear,TPESampler,COMPLETE
1733,0.16403015810846022,2025-04-25 00:33:20.014297,2025-04-25 00:33:23.997370,0 days 00:00:03.983073,99.26134916230527,0.08375853181351291,0.00012302510184363565,linear,TPESampler,COMPLETE
1734,0.6070685821454134,2025-04-25 00:33:24.175334,2025-04-25 01:02:42.539273,0 days 00:29:18.363939,42.641798832842156,0.048879421403918516,0.24231294627231595,poly,TPESampler,COMPLETE
1735,1.1686434164145252,2025-04-25 00:56:33.786450,2025-04-25 00:56:34.312058,0 days 00:00:00.525608,0.016373218405411213,0.1090418492832487,0.005106874912236111,rbf,TPESampler,COMPLETE
1736,0.4919386028305044,2025-04-25 00:56:34.493897,2025-04-25 00:56:35.030329,0 days 00:00:00.536432,8.756522416939397,0.03362745895651311,0.06076659298929956,rbf,TPESampler,COMPLETE
1737,0.17029309882312949,2025-04-25 00:56:35.204271,2025-04-25 00:56:39.762149,0 days 00:00:04.557878,83.09671298359467,0.0921373409858323,0.8999940382126131,linear,TPESampler,COMPLETE
1738,358.228429773817,2025-04-25 00:56:39.943598,2025-04-25 00:56:40.453899,0 days 00:00:00.510301,23.564113216480226,0.013752918054763712,0.1090862809169739,sigmoid,TPESampler,COMPLETE
1739,0.15207178113282252,2025-04-25 00:56:40.634925,2025-04-25 00:56:48.189493,0 days 00:00:07.554568,34.66456690170347,0.04117824645841892,0.030574567324588294,linear,TPESampler,COMPLETE
1740,0.15199546934904148,2025-04-25 00:56:48.378960,2025-04-25 00:57:10.721208,0 days 00:00:22.342248,81.35463692015736,0.018048574076547544,0.3812145501601161,linear,TPESampler,COMPLETE
1741,0.5999889371170039,2025-04-25 00:57:10.970545,2025-04-25 00:57:11.555641,0 days 00:00:00.585096,0.0012593451599450536,0.6387763146349649,0.0006072339184776812,linear,TPESampler,COMPLETE
