number,value,datetime_start,datetime_complete,duration,params_C,params_epsilon,params_gamma,params_kernel,system_attrs_auto:sampler,state
2438,0.15491084415526146,2025-04-25 02:06:58.152305,2025-04-25 02:07:13.502156,0 days 00:00:15.349851,36.18720106514687,0.01034228461698836,0.0005680715226968977,linear,TPESampler,COMPLETE
2439,0.1544141509088893,2025-04-25 02:07:10.883625,2025-04-25 02:07:18.334098,0 days 00:00:07.450473,15.395181776259264,0.007540113054529116,0.18821507488288827,linear,TPESampler,COMPLETE
2440,0.21827278559814978,2025-04-25 02:07:13.691007,2025-04-25 02:07:14.569835,0 days 00:00:00.878828,26.423370520632215,0.15825528221620183,0.0006230000969231193,linear,TPESampler,COMPLETE
2441,0.14997174214398615,2025-04-25 02:07:14.756301,2025-04-25 02:07:34.421430,0 days 00:00:19.665129,95.65034122816486,0.025869818286570263,0.12368956010294595,linear,TPESampler,COMPLETE
2442,0.16157756458936917,2025-04-25 02:07:18.523344,2025-04-25 02:07:19.701686,0 days 00:00:01.178342,3.709298523585005,0.046991107275674175,0.0007923011277692611,linear,TPESampler,COMPLETE
2443,0.15473622436772425,2025-04-25 02:07:19.888479,2025-04-25 02:07:25.105593,0 days 00:00:05.217114,18.35492538988819,0.015568285296476386,0.0001833002621054755,linear,TPESampler,COMPLETE
2444,0.1566881333863125,2025-04-25 02:07:25.297432,2025-04-25 02:07:40.963470,0 days 00:00:15.666038,98.99874231764146,0.05292257072727347,0.0006696018110012326,linear,TPESampler,COMPLETE
2445,0.1562853850587736,2025-04-25 02:07:34.614600,2025-04-25 02:07:41.050762,0 days 00:00:06.436162,19.502531362153366,0.046942580143387785,0.000358876308073297,linear,TPESampler,COMPLETE
2446,0.2318368649064634,2025-04-25 02:07:41.127978,2025-04-25 02:07:41.801426,0 days 00:00:00.673448,0.24230319636446918,0.006783613001610399,0.6741173796829494,linear,TPESampler,COMPLETE
2447,0.1536903068583366,2025-04-25 02:07:41.250131,2025-04-25 02:07:43.826666,0 days 00:00:02.576535,8.85635634662638,0.018134095632886916,0.06319904604169313,linear,TPESampler,COMPLETE
2448,1.4054821964370467,2025-04-25 02:07:42.000698,2025-04-25 02:07:42.519780,0 days 00:00:00.519082,0.0025055463079518107,0.0014584472958376101,0.00326570177789974,poly,TPESampler,COMPLETE
2449,0.15368001925987473,2025-04-25 02:07:42.707559,2025-04-25 02:08:14.032791,0 days 00:00:31.325232,97.31156093438264,0.015313320448192388,0.000843384678226721,linear,TPESampler,COMPLETE
2450,0.15842086144454454,2025-04-25 02:07:44.413582,2025-04-25 02:07:51.837734,0 days 00:00:07.424152,20.530197373410285,0.04910360106258789,0.08668565143170379,linear,TPESampler,COMPLETE
2451,0.15280374443559624,2025-04-25 02:07:52.147988,2025-04-25 02:08:17.373377,0 days 00:00:25.225389,91.69033151822914,0.0166687859041809,0.0002628890744037174,linear,TPESampler,COMPLETE
2452,0.1504482736261836,2025-04-25 02:08:14.225729,2025-04-25 02:08:21.032453,0 days 00:00:06.806724,33.340406698221045,0.036152490093811634,0.40239842571787965,linear,TPESampler,COMPLETE
2453,0.14996752864170373,2025-04-25 02:08:17.564876,2025-04-25 02:08:38.578560,0 days 00:00:21.013684,92.1308806904732,0.021352917118800028,0.0001279666782034597,linear,TPESampler,COMPLETE
2454,0.15403365383341797,2025-04-25 02:08:21.224029,2025-04-25 02:08:26.435465,0 days 00:00:05.211436,16.54482727293825,0.016487017008780955,0.0006373914772403534,linear,TPESampler,COMPLETE
2455,0.14938977932047479,2025-04-25 02:08:26.628476,2025-04-25 02:08:30.499117,0 days 00:00:03.870641,18.688641131479518,0.033409123392704305,0.0005712265885765639,linear,TPESampler,COMPLETE
2456,0.1536178208653596,2025-04-25 02:08:30.690184,2025-04-25 02:09:11.306193,0 days 00:00:40.616009,84.29303196542747,0.009001240915602126,0.26512298262646333,linear,TPESampler,COMPLETE
2457,0.1543850820564762,2025-04-25 02:08:38.767294,2025-04-25 02:08:46.291859,0 days 00:00:07.524565,19.37782407426426,0.01472400966251611,0.04768934479182472,linear,TPESampler,COMPLETE
2458,0.1633708083373909,2025-04-25 02:08:46.485552,2025-04-25 02:08:56.328456,0 days 00:00:09.842904,90.17278727568012,0.06215651147876776,0.5679394452716937,linear,TPESampler,COMPLETE
2459,0.15033640023015624,2025-04-25 02:08:56.516090,2025-04-25 02:09:09.483790,0 days 00:00:12.967700,28.294293843404493,0.022086765778329166,0.000626493427180575,linear,TPESampler,COMPLETE
2460,0.14939379934243444,2025-04-25 02:09:09.671607,2025-04-25 02:09:13.083712,0 days 00:00:03.412105,17.19327541773015,0.03282463616101557,0.0001022542877795939,linear,TPESampler,COMPLETE
2461,0.15002790609105687,2025-04-25 02:09:11.499595,2025-04-25 02:09:17.639172,0 days 00:00:06.139577,22.667147265684918,0.022960757325050842,0.711711750449669,linear,TPESampler,COMPLETE
2462,1.9856346274257537,2025-04-25 02:09:13.275547,2025-04-25 02:29:54.443962,0 days 00:20:41.168415,19.846723257884108,0.043962387114288536,0.2700693641339367,poly,TPESampler,COMPLETE
2463,0.910276063424644,2025-04-25 02:09:17.834941,2025-04-25 02:09:18.359492,0 days 00:00:00.524551,26.493232096465043,0.07214235421740478,0.0006870351388524424,poly,TPESampler,COMPLETE
2464,0.1490556511726511,2025-04-25 02:09:18.550971,2025-04-25 02:09:46.221438,0 days 00:00:27.670467,92.80917035616221,0.029226521428746537,0.0003283245255245534,linear,TPESampler,COMPLETE
2465,0.15070420036378945,2025-04-25 02:09:46.421410,2025-04-25 02:10:14.460322,0 days 00:00:28.038912,97.54723312349641,0.017610422807196695,0.9453315516623177,linear,TPESampler,COMPLETE
2466,0.18001234391293933,2025-04-25 02:10:14.667051,2025-04-25 02:10:17.117565,0 days 00:00:02.450514,94.91751108907783,0.1215856950789979,0.0008511892179555646,linear,TPESampler,COMPLETE
2467,0.1512631275015536,2025-04-25 02:10:17.312927,2025-04-25 02:10:30.506255,0 days 00:00:13.193328,97.7038257616416,0.03895154840089001,0.0002655855908974148,linear,TPESampler,COMPLETE
2468,0.17245194219267834,2025-04-25 02:10:30.696680,2025-04-25 02:10:36.175867,0 days 00:00:05.479187,96.44786561418334,0.10387357835479186,0.03744448767278603,linear,TPESampler,COMPLETE
2469,71.95796354285389,2025-04-25 02:10:36.374497,2025-04-25 02:10:36.911253,0 days 00:00:00.536756,4.217693427141522,0.06162477302354825,0.06812929632381805,sigmoid,TPESampler,COMPLETE
2470,0.1500815844991909,2025-04-25 02:10:37.105338,2025-04-25 02:10:58.608091,0 days 00:00:21.502753,99.59195918348631,0.023366024910377866,0.0007095149355101494,linear,TPESampler,COMPLETE
2471,0.16227505598132064,2025-04-25 02:10:58.904117,2025-04-25 02:10:59.725294,0 days 00:00:00.821177,1.8076996489591441,0.044570597019841736,0.00013433181660589582,linear,TPESampler,COMPLETE
2472,0.16355300958029648,2025-04-25 02:10:59.915266,2025-04-25 02:11:12.706485,0 days 00:00:12.791219,96.14803307282428,0.06114182103747733,0.9227047462812045,linear,TPESampler,COMPLETE
2473,0.15026270308901915,2025-04-25 02:11:12.900537,2025-04-25 02:11:21.157013,0 days 00:00:08.256476,24.684357141884842,0.02084214405382418,0.052516908065389334,linear,TPESampler,COMPLETE
2474,1.196620480219919,2025-04-25 02:11:21.349373,2025-04-25 02:11:21.889145,0 days 00:00:00.539772,0.23270573207019005,0.013507637214991038,0.00017250738349297324,rbf,TPESampler,COMPLETE
2475,0.1499987122249175,2025-04-25 02:11:22.082370,2025-04-25 02:11:29.850845,0 days 00:00:07.768475,24.714049413482915,0.021464800547983758,0.13988828474492385,linear,TPESampler,COMPLETE
2476,0.16472185817675067,2025-04-25 02:11:30.046327,2025-04-25 02:11:32.509292,0 days 00:00:02.462965,29.74955131396504,0.08485808233728279,0.0003638690114779676,linear,TPESampler,COMPLETE
2477,0.15450926598019574,2025-04-25 02:11:32.702599,2025-04-25 02:11:38.002196,0 days 00:00:05.299597,26.87454645122676,0.0449125372583301,0.39789439367403723,linear,TPESampler,COMPLETE
2478,0.1532752133275156,2025-04-25 02:11:38.197292,2025-04-25 02:12:12.013174,0 days 00:00:33.815882,98.60146590905383,0.013371455393375087,0.039791800692848316,linear,TPESampler,COMPLETE
2479,0.15128579705269152,2025-04-25 02:12:12.211143,2025-04-25 02:12:28.820678,0 days 00:00:16.609535,97.02031171159105,0.039409335389288175,0.1134339530119688,linear,TPESampler,COMPLETE
2480,0.15006947880906762,2025-04-25 02:12:29.021109,2025-04-25 02:12:31.979859,0 days 00:00:02.958750,15.861591508244299,0.028757188329887832,0.0011805136499793197,linear,TPESampler,COMPLETE
2481,0.14858280917582783,2025-04-25 02:12:32.173309,2025-04-25 02:12:45.155873,0 days 00:00:12.982564,96.71605732336134,0.034034871519976286,0.03452042771199913,linear,TPESampler,COMPLETE
2482,0.155108832939329,2025-04-25 02:12:45.767645,2025-04-25 02:12:51.393025,0 days 00:00:05.625380,16.11440944263756,0.04529043797802741,0.0007712078523621847,linear,TPESampler,COMPLETE
2483,0.16424636177515076,2025-04-25 02:12:51.709807,2025-04-25 02:12:58.487028,0 days 00:00:06.777221,31.302465505584326,0.0636640993651828,0.1780249130333679,linear,TPESampler,COMPLETE
2484,0.15025913412670433,2025-04-25 02:12:58.682729,2025-04-25 02:13:24.390274,0 days 00:00:25.707545,93.21958771631323,0.02041626725368836,0.0007137664576191374,linear,TPESampler,COMPLETE
2485,0.1492677509161592,2025-04-25 02:13:24.587107,2025-04-25 02:13:29.342421,0 days 00:00:04.755314,19.72273592165729,0.03455174883748673,0.11202298119593937,linear,TPESampler,COMPLETE
2486,0.15844242968983563,2025-04-25 02:13:29.542374,2025-04-25 02:13:39.378827,0 days 00:00:09.836453,86.35976114602924,0.05366272600897796,0.001054219118750095,linear,TPESampler,COMPLETE
2487,0.14956107237172014,2025-04-25 02:13:39.570749,2025-04-25 02:13:58.093090,0 days 00:00:18.522341,96.04957366535227,0.028614414871766768,0.0007910616508745759,linear,TPESampler,COMPLETE
2488,0.1574785855462224,2025-04-25 02:13:58.288727,2025-04-25 02:13:59.879997,0 days 00:00:01.591270,2.94662486633434,0.01200012726174235,0.0006411401099674982,linear,TPESampler,COMPLETE
2489,1.415837933224801,2025-04-25 02:14:00.075356,2025-04-25 02:14:00.592190,0 days 00:00:00.516834,0.019555111575150143,0.11267597345230719,0.00040398158118107227,poly,TPESampler,COMPLETE
2490,0.155297580238913,2025-04-25 02:14:00.790917,2025-04-25 02:14:05.068579,0 days 00:00:04.277662,16.45634938951795,0.04534464208000001,0.0010165431454708202,linear,TPESampler,COMPLETE
2491,0.15022155494733755,2025-04-25 02:14:05.254166,2025-04-25 02:14:29.683229,0 days 00:00:24.429063,87.58806826926471,0.026269652506709047,0.10032568600777989,linear,TPESampler,COMPLETE
2492,0.19939963490566776,2025-04-25 02:14:29.882285,2025-04-25 02:14:30.485137,0 days 00:00:00.602852,92.56596118998031,0.01672483200058642,0.0017510486311849405,rbf,TPESampler,COMPLETE
2493,0.1496416717125252,2025-04-25 02:14:30.678967,2025-04-25 02:14:35.092493,0 days 00:00:04.413526,21.13442711441192,0.034999645620536556,0.03156816004970036,linear,TPESampler,COMPLETE
2494,74.50799089449569,2025-04-25 02:14:35.529419,2025-04-25 02:14:36.075403,0 days 00:00:00.545984,11.252528833076486,0.0158434050380539,0.011296582879690304,sigmoid,TPESampler,COMPLETE
2495,0.14850049768720372,2025-04-25 02:14:36.269354,2025-04-25 02:14:52.104798,0 days 00:00:15.835444,94.66751115098941,0.034165483153381075,0.0006638246621996286,linear,TPESampler,COMPLETE
2496,0.15410630399568678,2025-04-25 02:14:52.295472,2025-04-25 02:14:59.479637,0 days 00:00:07.184165,25.96639690467408,0.01619049373767932,0.00109824148575236,linear,TPESampler,COMPLETE
2497,0.17607269986150176,2025-04-25 02:14:59.672785,2025-04-25 02:15:01.421732,0 days 00:00:01.748947,28.2774129786577,0.1035908051739012,0.0013021773119425409,linear,TPESampler,COMPLETE
2498,0.1532595082154216,2025-04-25 02:15:01.613075,2025-04-25 02:15:42.628971,0 days 00:00:41.015896,90.47019369405734,0.009697631051926382,0.3422399363199098,linear,TPESampler,COMPLETE
2499,0.15657097665769532,2025-04-25 02:15:42.822342,2025-04-25 02:15:59.016975,0 days 00:00:16.194633,94.58600560281147,0.05265140876272811,0.7612233234095964,linear,TPESampler,COMPLETE
