number,value,datetime_start,datetime_complete,duration,params_C,params_epsilon,params_gamma,params_kernel,system_attrs_auto:sampler,state
1060,0.6354047948205372,2025-04-25 03:56:45.600282,2025-04-25 03:56:46.191051,0 days 00:00:00.590769,58.169493411865176,0.006820897907843745,0.9796584886736124,rbf,TPESampler,COMPLETE
1061,0.21254262491445303,2025-04-25 03:56:46.356736,2025-04-25 03:56:47.026337,0 days 00:00:00.669601,31.124152666984823,0.0010208130698050567,0.005264892904024709,rbf,TPESampler,COMPLETE
1062,0.1739499504102363,2025-04-25 03:56:47.194949,2025-04-25 03:56:48.817541,0 days 00:00:01.622592,94.3412572401342,0.0016407934079902165,0.031419896250080306,rbf,TPESampler,COMPLETE
1063,0.29612128121065884,2025-04-25 03:56:49.017492,2025-04-25 03:56:49.617872,0 days 00:00:00.600380,14.949068195168481,0.003128542188317088,0.00335840597594363,rbf,TPESampler,COMPLETE
1064,0.22692157445451117,2025-04-25 03:56:49.791542,2025-04-25 03:56:50.706800,0 days 00:00:00.915258,22.15482707195485,0.0027164769758840734,0.04908890104531671,rbf,TPESampler,COMPLETE
1065,0.8865608057455114,2025-04-25 03:56:50.877980,2025-04-25 03:56:51.416881,0 days 00:00:00.538901,0.385805172156104,0.036009187770974505,0.0011305811839273387,poly,TPESampler,COMPLETE
1066,473.9186718172526,2025-04-25 03:56:51.587395,2025-04-25 03:56:52.160889,0 days 00:00:00.573494,34.58261425863022,0.0024061379812063744,0.017867198692687998,sigmoid,TPESampler,COMPLETE
1067,0.1726566606004471,2025-04-25 03:56:52.436419,2025-04-25 03:56:54.028443,0 days 00:00:01.592024,84.62445409656306,0.0011882627245699154,0.03070404614616698,rbf,TPESampler,COMPLETE
1068,0.199106275390428,2025-04-25 03:56:54.204159,2025-04-25 03:56:55.164093,0 days 00:00:00.959934,80.12798315201101,0.0039874690463718564,0.009797169685526278,rbf,TPESampler,COMPLETE
1069,0.17663167720861606,2025-04-25 03:56:55.347768,2025-04-25 03:56:56.857902,0 days 00:00:01.510134,92.62485454529694,0.004301294324233733,0.032999228191378085,rbf,TPESampler,COMPLETE
1070,0.21140779540783572,2025-04-25 03:56:57.020779,2025-04-25 03:56:57.781653,0 days 00:00:00.760874,15.470672589025394,0.004979466440409322,0.03301231911329743,rbf,TPESampler,COMPLETE
1071,0.1707947646586373,2025-04-25 03:56:57.951890,2025-04-25 03:56:59.473690,0 days 00:00:01.521800,94.54432726022375,0.0028860160670029964,0.029486533072411426,rbf,TPESampler,COMPLETE
1072,0.36847587370099494,2025-04-25 03:56:59.644611,2025-04-25 03:57:00.704133,0 days 00:00:01.059522,60.743499349637105,0.0014044819845604286,0.17506760632256585,rbf,TPESampler,COMPLETE
1073,0.24218089531640116,2025-04-25 03:57:00.970925,2025-04-25 03:57:01.774906,0 days 00:00:00.803981,9.785331790638187,0.0025853573685379345,0.05591858935764857,rbf,TPESampler,COMPLETE
1074,0.8749629244002952,2025-04-25 03:57:01.943759,2025-04-25 03:57:02.496104,0 days 00:00:00.552345,0.04170926949011859,0.04438223559383545,0.00021220053615115725,sigmoid,TPESampler,COMPLETE
1075,0.3300962529227244,2025-04-25 03:57:02.696626,2025-04-25 03:57:03.500091,0 days 00:00:00.803465,16.323444835745775,0.0023075415743858568,0.12030010110564698,rbf,TPESampler,COMPLETE
1076,0.17721905755616957,2025-04-25 03:57:03.665954,2025-04-25 03:57:04.898970,0 days 00:00:01.233016,80.99773873706651,0.004047931782145522,0.02540456594931258,rbf,TPESampler,COMPLETE
1077,0.18013854277248725,2025-04-25 03:57:05.067329,2025-04-25 03:57:05.961455,0 days 00:00:00.894126,95.53562275220872,0.0014744936087762515,0.005453773671126605,rbf,TPESampler,COMPLETE
1078,0.19380041908122433,2025-04-25 03:57:06.131043,2025-04-25 03:57:06.868661,0 days 00:00:00.737618,17.470403437795515,0.002552714902208878,0.023318333117563116,rbf,TPESampler,COMPLETE
1079,0.20007643089300295,2025-04-25 03:57:07.040181,2025-04-25 03:57:07.757485,0 days 00:00:00.717304,12.497051535404989,0.0022178569821941275,0.027490508743521106,rbf,TPESampler,COMPLETE
1080,916.7650161253375,2025-04-25 03:57:07.931532,2025-04-25 03:57:08.506914,0 days 00:00:00.575382,34.55755498629538,0.18421269935225437,0.3126408586776331,sigmoid,TPESampler,COMPLETE
1081,0.287100149352946,2025-04-25 03:57:08.677759,2025-04-25 03:57:09.963440,0 days 00:00:01.285681,76.66576934712282,0.0035650290509991493,0.07847351016512036,rbf,TPESampler,COMPLETE
1082,0.21047789456841506,2025-04-25 03:57:10.137402,2025-04-25 03:57:10.822642,0 days 00:00:00.685240,21.04294946139841,0.0028618601436497587,0.008009842144825792,rbf,TPESampler,COMPLETE
1083,0.1975748690686424,2025-04-25 03:57:11.171176,2025-04-25 03:57:12.445151,0 days 00:00:01.273975,88.78149152508321,0.004446714388282586,0.013633412848970487,rbf,TPESampler,COMPLETE
1084,0.19099515575511236,2025-04-25 03:57:12.621439,2025-04-25 03:57:13.849203,0 days 00:00:01.227764,79.29418219073891,0.0012500288759396425,0.017067941972819592,rbf,TPESampler,COMPLETE
1085,0.25822959221895014,2025-04-25 03:57:14.024990,2025-04-25 03:57:14.900453,0 days 00:00:00.875463,15.72308182886269,0.0024970319285241628,0.06610493382209427,rbf,TPESampler,COMPLETE
1086,0.2762543889581617,2025-04-25 03:57:15.071296,2025-04-25 03:57:56.423693,0 days 00:00:41.352397,71.969396372047,0.002497663808931827,0.0932900218456282,linear,TPESampler,COMPLETE
1087,0.19218881792482853,2025-04-25 03:57:56.605957,2025-04-25 03:57:57.687509,0 days 00:00:01.081552,79.54912406744779,0.003939674652048586,0.016392357775671676,rbf,TPESampler,COMPLETE
1088,0.17299235061198798,2025-04-25 03:57:57.864062,2025-04-25 03:57:59.367635,0 days 00:00:01.503573,79.74079393801908,0.0013905902051493638,0.03011935442106275,rbf,TPESampler,COMPLETE
1089,0.2125373536612802,2025-04-25 03:57:59.540364,2025-04-25 03:58:00.888565,0 days 00:00:01.348201,80.14780385532663,0.0033197396262776607,0.0463487184250077,rbf,TPESampler,COMPLETE
1090,0.19216461741336827,2025-04-25 03:58:01.061269,2025-04-25 03:58:02.075176,0 days 00:00:01.013907,99.97911000271006,0.0034260572009046737,0.007894405496595959,rbf,TPESampler,COMPLETE
1091,0.237588491350647,2025-04-25 03:58:02.245297,2025-04-25 03:58:03.177614,0 days 00:00:00.932317,31.151401913925813,0.006106111158888165,0.0555903450288386,rbf,TPESampler,COMPLETE
1092,1331.1228725997703,2025-04-25 03:58:03.348199,2025-04-25 03:58:03.897558,0 days 00:00:00.549359,50.60433637774871,0.0020674920502829885,0.30473253135542067,sigmoid,TPESampler,COMPLETE
1093,0.31978214238864605,2025-04-25 03:58:04.061502,2025-04-25 03:58:05.154361,0 days 00:00:01.092859,97.34305944295707,0.002835925740433712,0.10541185592378154,rbf,TPESampler,COMPLETE
1094,0.20522910578504766,2025-04-25 03:58:05.323424,2025-04-25 03:58:06.103441,0 days 00:00:00.780017,20.005317769859964,0.0034917641210027092,0.028000335411001293,rbf,TPESampler,COMPLETE
1095,0.16806363027941534,2025-04-25 03:58:06.268588,2025-04-25 03:58:07.627910,0 days 00:00:01.359322,96.02772096376816,0.006155186337438374,0.027806812338019845,rbf,TPESampler,COMPLETE
1096,1107.2395449608443,2025-04-25 03:58:07.832607,2025-04-25 03:58:08.401280,0 days 00:00:00.568673,88.92614388629451,0.002063115619005454,0.01582338924243005,sigmoid,TPESampler,COMPLETE
1097,0.20454206061174063,2025-04-25 03:58:08.579275,2025-04-25 03:58:09.639893,0 days 00:00:01.060618,93.83146621644147,0.0026537393683796168,0.010791052149291592,rbf,TPESampler,COMPLETE
1098,0.22033115991386834,2025-04-25 03:58:09.814569,2025-04-25 03:58:10.796919,0 days 00:00:00.982350,26.814483211124802,0.002790568465871024,0.04668647156992606,rbf,TPESampler,COMPLETE
1099,0.18940552278112785,2025-04-25 03:58:10.970545,2025-04-25 03:58:12.166161,0 days 00:00:01.195616,98.66232008187023,0.0015826169569060468,0.015519071373624776,rbf,TPESampler,COMPLETE
1100,0.19531300734016377,2025-04-25 03:58:12.337273,2025-04-25 03:58:13.605579,0 days 00:00:01.268306,98.60938112666143,0.006772344912919773,0.04057364783448308,rbf,TPESampler,COMPLETE
1101,0.2576997727632903,2025-04-25 03:58:13.780385,2025-04-25 03:58:15.539456,0 days 00:00:01.759071,93.01399789266696,0.0015251603326527296,0.06241301840804914,rbf,TPESampler,COMPLETE
1102,0.2760193135456441,2025-04-25 03:58:15.707110,2025-04-25 03:59:26.285046,0 days 00:01:10.577936,98.61151557819423,0.0017248171746272324,0.011393513007067842,linear,TPESampler,COMPLETE
1103,0.20934353729006205,2025-04-25 03:59:26.449819,2025-04-25 03:59:27.080944,0 days 00:00:00.631125,14.220916779526679,0.003110064085048421,0.011687746435173134,rbf,TPESampler,COMPLETE
1104,0.2472209246258746,2025-04-25 03:59:27.250970,2025-04-25 03:59:28.857801,0 days 00:00:01.606831,90.48980859277836,0.002586231090892693,0.057951590503384234,rbf,TPESampler,COMPLETE
1105,0.7694787475361432,2025-04-25 03:59:29.028609,2025-04-25 04:08:05.030770,0 days 00:08:36.002161,85.34048655356746,0.009093434715174677,0.04779224084089554,poly,TPESampler,COMPLETE
1106,0.18441687316482125,2025-04-25 04:08:05.206194,2025-04-25 04:08:05.947300,0 days 00:00:00.741106,29.507251049403983,0.007753878065891604,0.014909904729773117,rbf,TPESampler,COMPLETE
1107,0.18467318563211574,2025-04-25 04:08:06.120095,2025-04-25 04:08:07.445342,0 days 00:00:01.325247,95.75036058685515,0.0017297996306374283,0.020088631769333638,rbf,TPESampler,COMPLETE
1108,0.2129956245029091,2025-04-25 04:08:07.619195,2025-04-25 04:08:08.265500,0 days 00:00:00.646305,9.734570909202628,0.0010307281917924975,0.016798938460231446,rbf,TPESampler,COMPLETE
1109,0.17612383622014355,2025-04-25 04:08:08.433213,2025-04-25 04:08:09.733911,0 days 00:00:01.300698,90.63881619323732,0.0026887257389056115,0.02391845141575159,rbf,TPESampler,COMPLETE
1110,0.20986038745460492,2025-04-25 04:08:09.903269,2025-04-25 04:08:10.713231,0 days 00:00:00.809962,22.979526581109248,0.00761197409232053,0.038265504065786,rbf,TPESampler,COMPLETE
1111,0.5557094742026063,2025-04-25 04:08:10.884734,2025-04-25 04:08:11.408240,0 days 00:00:00.523506,0.0013069960533272605,0.060794402279352504,0.0003502365243830957,linear,TPESampler,COMPLETE
1112,0.7697341055060429,2025-04-25 04:08:11.577220,2025-04-25 04:08:12.139485,0 days 00:00:00.562265,0.0061064434592543165,0.015166993338191104,0.009037623450260417,rbf,TPESampler,COMPLETE
1113,0.3740906578368333,2025-04-25 04:08:12.306893,2025-04-25 04:08:13.132240,0 days 00:00:00.825347,35.35572364159103,0.0030301939088259095,0.18939410037733997,rbf,TPESampler,COMPLETE
1114,0.2262168369725688,2025-04-25 04:08:13.300685,2025-04-25 04:08:14.492856,0 days 00:00:01.192171,96.04420445477764,0.010669425487373763,0.04965239214778861,rbf,TPESampler,COMPLETE
1115,0.17475703691200556,2025-04-25 04:08:14.670908,2025-04-25 04:08:16.363073,0 days 00:00:01.692165,92.87634031065515,0.0034432560846027853,0.03166637385444602,rbf,TPESampler,COMPLETE
1116,0.7747953536865633,2025-04-25 04:08:16.531431,2025-04-25 04:08:17.016389,0 days 00:00:00.484958,0.2588285439782114,0.6978270487384407,0.0086996906375062,poly,TPESampler,COMPLETE
1117,0.21525703712775485,2025-04-25 04:08:17.185920,2025-04-25 04:08:17.818826,0 days 00:00:00.632906,15.689840763551436,0.004655192736013309,0.00936053887477138,rbf,TPESampler,COMPLETE
1118,0.2093163571863135,2025-04-25 04:08:17.985755,2025-04-25 04:08:18.612437,0 days 00:00:00.626682,15.760360005641228,0.0037655323053204484,0.010573371274591343,rbf,TPESampler,COMPLETE
1119,0.32293084971333846,2025-04-25 04:08:18.778715,2025-04-25 04:08:19.351795,0 days 00:00:00.573080,1.664280560113639,0.00921558363142572,0.01647886115495762,rbf,TPESampler,COMPLETE
1120,2.235216961988994,2025-04-25 04:08:19.519829,2025-04-25 04:08:20.074521,0 days 00:00:00.554692,0.09388071629731154,0.1011485722283531,0.14763095507803595,sigmoid,TPESampler,COMPLETE
1121,0.19551074502627808,2025-04-25 04:08:20.319970,2025-04-25 04:08:21.236434,0 days 00:00:00.916464,93.25764758634199,0.00644415640441277,0.008566093501496376,rbf,TPESampler,COMPLETE
1122,0.27851233403675235,2025-04-25 04:08:21.428540,2025-04-25 04:08:22.388791,0 days 00:00:00.960251,30.723769436372127,0.006274039818630079,0.0755043555617227,rbf,TPESampler,COMPLETE
1123,0.40654653464063123,2025-04-25 04:08:22.551328,2025-04-25 04:08:23.169151,0 days 00:00:00.617823,92.45385548273985,0.00814876707449001,0.26880298371397393,rbf,TPESampler,COMPLETE
1124,0.1724702107595111,2025-04-25 04:08:23.336876,2025-04-25 04:08:24.789870,0 days 00:00:01.452994,99.1882915870215,0.004402995910241893,0.023979888264125546,rbf,TPESampler,COMPLETE
1125,0.2162864539857721,2025-04-25 04:08:24.966224,2025-04-25 04:08:25.686633,0 days 00:00:00.720409,13.228417044952579,0.006708884312466131,0.03672400455848544,rbf,TPESampler,COMPLETE
1126,1925.159294684343,2025-04-25 04:08:25.855118,2025-04-25 04:08:26.424388,0 days 00:00:00.569270,82.36688514670178,0.0011965852360456457,0.060575109971603494,sigmoid,TPESampler,COMPLETE
1127,0.198475176352502,2025-04-25 04:08:26.587845,2025-04-25 04:08:27.253447,0 days 00:00:00.665602,16.53195580443125,0.0011106980655334476,0.012797458922620589,rbf,TPESampler,COMPLETE
1128,0.30573292330308766,2025-04-25 04:08:27.421378,2025-04-25 04:08:28.247543,0 days 00:00:00.826165,13.670793052206836,0.0011612809624953512,0.09819676595188344,rbf,TPESampler,COMPLETE
1129,0.7167985601600125,2025-04-25 04:08:28.420614,2025-04-25 04:08:28.887576,0 days 00:00:00.466962,0.019746369332757915,0.866347542354679,0.02472925621565716,rbf,TPESampler,COMPLETE
1130,0.18729081721748533,2025-04-25 04:08:29.062615,2025-04-25 04:08:30.344062,0 days 00:00:01.281447,93.05204558767132,0.002193329559200813,0.019512837831008916,rbf,TPESampler,COMPLETE
1131,0.28784334349757457,2025-04-25 04:08:30.513027,2025-04-25 04:08:31.505861,0 days 00:00:00.992834,17.825672426954476,0.008130299247098386,0.08367024528086921,rbf,TPESampler,COMPLETE
1132,0.34173079877054635,2025-04-25 04:08:31.674989,2025-04-25 04:08:32.681214,0 days 00:00:01.006225,78.23510196248898,0.0033933973686985064,0.1324598506497842,rbf,TPESampler,COMPLETE
1133,0.18809673386085027,2025-04-25 04:08:32.848840,2025-04-25 04:08:34.020653,0 days 00:00:01.171813,96.85661721007067,0.006019888751975344,0.016331136334276915,rbf,TPESampler,COMPLETE
1134,0.20849765306599896,2025-04-25 04:08:34.200236,2025-04-25 04:08:34.851366,0 days 00:00:00.651130,23.419183045904536,0.005098110890922062,0.007670017523697252,rbf,TPESampler,COMPLETE
1135,0.27386423862593,2025-04-25 04:08:35.014614,2025-04-25 04:08:36.783386,0 days 00:00:01.768772,91.69881420573373,0.0010515380187684263,0.07009981249110621,rbf,TPESampler,COMPLETE
1136,0.1731324275976369,2025-04-25 04:08:36.947988,2025-04-25 04:08:37.879115,0 days 00:00:00.931127,99.64381749927871,0.020100895234389356,0.030588991678983123,rbf,TPESampler,COMPLETE
1137,0.6306636586226257,2025-04-25 04:08:38.066301,2025-04-25 04:12:20.113041,0 days 00:03:42.046740,64.74246295641025,0.00282965017462198,0.022238598411567764,poly,TPESampler,COMPLETE
1138,0.17661070741457047,2025-04-25 04:12:20.286335,2025-04-25 04:12:21.564463,0 days 00:00:01.278128,91.10831693427609,0.0030767237286194434,0.023589624690077086,rbf,TPESampler,COMPLETE
1139,0.21566427319717899,2025-04-25 04:12:21.818064,2025-04-25 04:12:22.623294,0 days 00:00:00.805230,15.596017647601123,0.003504849773226776,0.039997479567559245,rbf,TPESampler,COMPLETE
1140,0.18139093618252716,2025-04-25 04:12:22.800006,2025-04-25 04:12:23.778289,0 days 00:00:00.978283,99.60511718388446,0.00262080938725762,0.007122776007370172,rbf,TPESampler,COMPLETE
1141,0.17912786978490794,2025-04-25 04:12:23.944406,2025-04-25 04:12:25.216666,0 days 00:00:01.272260,97.11583264378686,0.002622850044986431,0.021709141592147648,rbf,TPESampler,COMPLETE
1142,0.28975036657530384,2025-04-25 04:12:25.383773,2025-04-25 04:12:26.821066,0 days 00:00:01.437293,96.92796863531304,0.003097177365015937,0.07841730457139542,rbf,TPESampler,COMPLETE
1143,0.1975384148978854,2025-04-25 04:12:26.996526,2025-04-25 04:12:28.372790,0 days 00:00:01.376264,83.78877704827659,0.006525996797101866,0.04155422954453321,rbf,TPESampler,COMPLETE
1144,0.3436021789390766,2025-04-25 04:12:28.542432,2025-04-25 04:12:29.489116,0 days 00:00:00.946684,95.18336302591948,0.004465896697681252,0.1345666614349866,rbf,TPESampler,COMPLETE
1145,0.19949793341946623,2025-04-25 04:12:29.655102,2025-04-25 04:12:30.309068,0 days 00:00:00.653966,10.259566174448372,0.006100591223896728,0.024812729771217085,rbf,TPESampler,COMPLETE
1146,0.19219749563429128,2025-04-25 04:12:30.517681,2025-04-25 04:12:31.271073,0 days 00:00:00.753392,15.30181409002366,0.008764634883120652,0.01576717694111065,rbf,TPESampler,COMPLETE
1147,0.18864289931000813,2025-04-25 04:12:31.444122,2025-04-25 04:12:32.700692,0 days 00:00:01.256570,97.33121651976441,0.0034128210888180457,0.01580547896340727,rbf,TPESampler,COMPLETE
1148,0.28490997268768975,2025-04-25 04:12:32.867498,2025-04-25 04:12:34.214741,0 days 00:00:01.347243,88.21195969392076,0.003204334448709186,0.07630898178049401,rbf,TPESampler,COMPLETE
1149,0.1863715036343304,2025-04-25 04:12:34.391044,2025-04-25 04:12:36.149893,0 days 00:00:01.758849,98.08481868150555,0.0010938404287219093,0.03805530518476381,rbf,TPESampler,COMPLETE
1150,0.18823000082333746,2025-04-25 04:12:36.317360,2025-04-25 04:12:37.570261,0 days 00:00:01.252901,98.605655373587,0.004212539950005982,0.017260481992908003,rbf,TPESampler,COMPLETE
1151,0.1889386967596803,2025-04-25 04:12:37.827660,2025-04-25 04:12:39.348512,0 days 00:00:01.520852,96.76632885333824,0.008919801793727285,0.01541709739095445,rbf,TPESampler,COMPLETE
1152,0.2948512642789496,2025-04-25 04:12:39.515731,2025-04-25 04:12:40.708738,0 days 00:00:01.193007,93.56949054505414,0.005473298159843114,0.08273368275879008,rbf,TPESampler,COMPLETE
1153,0.2075227611727228,2025-04-25 04:12:40.882012,2025-04-25 04:12:41.654742,0 days 00:00:00.772730,18.100224220415335,0.0032423066202647995,0.030147769343966013,rbf,TPESampler,COMPLETE
1154,0.24331369744220285,2025-04-25 04:12:41.866454,2025-04-25 04:12:43.111836,0 days 00:00:01.245382,7.965755106004296,0.0010033630131498505,0.053921950715321264,rbf,TPESampler,COMPLETE
1155,0.28951530595371555,2025-04-25 04:12:43.592208,2025-04-25 04:12:45.291208,0 days 00:00:01.699000,93.59941221425255,0.0018202689394301427,0.0007996986440135524,rbf,TPESampler,COMPLETE
1156,0.17042363353040008,2025-04-25 04:12:45.737419,2025-04-25 04:12:47.349295,0 days 00:00:01.611876,93.81846581245641,0.007451113442473915,0.02654888145490104,rbf,TPESampler,COMPLETE
1157,0.32787055785603925,2025-04-25 04:12:47.666814,2025-04-25 04:12:49.074854,0 days 00:00:01.408040,89.4498314062026,0.008135100466427235,0.11541103447806549,rbf,TPESampler,COMPLETE
1158,0.227099815252874,2025-04-25 04:12:49.286602,2025-04-25 04:12:50.092507,0 days 00:00:00.805905,12.718089855401386,0.0064987235189346675,0.008399858526661226,rbf,TPESampler,COMPLETE
1159,0.3597148771088582,2025-04-25 04:12:50.525468,2025-04-25 04:12:51.466798,0 days 00:00:00.941330,2.3864460467626767,0.008457355736445911,0.16762109253486163,rbf,TPESampler,COMPLETE
1160,0.1986524245089284,2025-04-25 04:12:51.727379,2025-04-25 04:12:52.842878,0 days 00:00:01.115499,37.74137410511281,0.011337122212810437,0.03213291185447221,rbf,TPESampler,COMPLETE
1161,0.24904806057266143,2025-04-25 04:12:53.086398,2025-04-25 04:12:53.991091,0 days 00:00:00.904693,19.478321296698834,0.009766650100451288,0.060908851606644214,rbf,TPESampler,COMPLETE
1162,0.18847209077318625,2025-04-25 04:12:54.231073,2025-04-25 04:12:54.924240,0 days 00:00:00.693167,27.24325597086019,0.008833505794609937,0.009788779134952514,rbf,TPESampler,COMPLETE
1163,1972.7260497875386,2025-04-25 04:12:55.147501,2025-04-25 04:12:55.714233,0 days 00:00:00.566732,92.0393964104049,0.011815049137694841,0.04056459699985966,sigmoid,TPESampler,COMPLETE
1164,2.954981290273266,2025-04-25 04:12:55.884578,2025-04-25 06:31:10.640749,0 days 02:18:14.756171,8.716206644647434,0.01552086357493605,0.4875175307391324,poly,TPESampler,COMPLETE
1165,0.27304296860127836,2025-04-25 04:34:52.048996,2025-04-25 04:34:53.104532,0 days 00:00:01.055536,65.48076692599123,0.011348402625217077,0.07193378018298413,rbf,TPESampler,COMPLETE
1166,0.22333866042888434,2025-04-25 04:34:53.288323,2025-04-25 04:34:54.687927,0 days 00:00:01.399604,96.59399140245212,0.0060674225322793944,0.04889557542987345,rbf,TPESampler,COMPLETE
1167,0.2275423364397659,2025-04-25 04:34:55.330329,2025-04-25 04:34:56.490869,0 days 00:00:01.160540,92.88909459964587,0.012734136756391862,0.05017882405654589,rbf,TPESampler,COMPLETE
1168,0.19976077288049535,2025-04-25 04:34:56.668533,2025-04-25 04:34:57.335929,0 days 00:00:00.667396,15.891278437489149,0.0049979984087210405,0.01280827119981991,rbf,TPESampler,COMPLETE
1169,0.3603036064074952,2025-04-25 04:34:57.502659,2025-04-25 04:34:58.217099,0 days 00:00:00.714440,14.446969435812854,0.006403514098301793,0.16622607824794763,rbf,TPESampler,COMPLETE
1170,0.2767318535869588,2025-04-25 04:34:58.427177,2025-04-25 04:36:01.376871,0 days 00:01:02.949694,98.26281331717128,0.004747529983604517,0.053249283097052034,linear,TPESampler,COMPLETE
1171,0.901537505261502,2025-04-25 04:36:01.556284,2025-04-25 04:36:02.100485,0 days 00:00:00.544201,0.05685055226322551,0.0011866027145273855,0.00010733591579607857,poly,TPESampler,COMPLETE
1172,0.17472311933855333,2025-04-25 04:36:02.268600,2025-04-25 04:36:03.754263,0 days 00:00:01.485663,96.63677018504868,0.0026342361106817926,0.03187976149376596,rbf,TPESampler,COMPLETE
1173,0.5946651221534173,2025-04-25 04:36:03.923905,2025-04-25 04:36:04.612699,0 days 00:00:00.688794,0.19813446809522012,0.012143791427290202,0.0011607215868982839,rbf,TPESampler,COMPLETE
1174,0.2739360966744932,2025-04-25 04:36:04.781096,2025-04-25 04:36:14.639486,0 days 00:00:09.858390,11.985572119509321,0.004467877121090038,0.0037772266570742633,linear,TPESampler,COMPLETE
1175,0.19046985050489107,2025-04-25 04:36:14.824438,2025-04-25 04:36:15.810651,0 days 00:00:00.986213,17.547356285670592,0.002434424714432549,0.022118584921287026,rbf,TPESampler,COMPLETE
1176,0.1816415564196486,2025-04-25 04:36:16.281340,2025-04-25 04:36:17.216649,0 days 00:00:00.935309,73.95645665348505,0.0010308303343571697,0.008436712387002467,rbf,TPESampler,COMPLETE
