number,value,datetime_start,datetime_complete,duration,params_C,params_epsilon,params_gamma,params_kernel,system_attrs_auto:sampler,state
825,0.20937361339233496,2025-04-25 00:33:12.694469,2025-04-25 00:33:13.664865,0 days 00:00:00.970396,85.56923213067881,0.01718990117624126,0.04469861802898612,rbf,TPESampler,COMPLETE
826,0.19224694020171912,2025-04-25 00:33:13.835324,2025-04-25 00:33:14.814203,0 days 00:00:00.978879,97.79628033017845,0.012885492723343165,0.013988879247346627,rbf,TPESampler,COMPLETE
827,0.21001281845952186,2025-04-25 00:33:14.979235,2025-04-25 00:33:15.976718,0 days 00:00:00.997483,96.16013056379404,0.017277329696509386,0.044580328927753356,rbf,TPESampler,COMPLETE
828,0.31939716927765077,2025-04-25 00:33:16.139402,2025-04-25 00:33:17.271063,0 days 00:00:01.131661,89.97895552185034,0.0037957429964486943,0.10538530234668742,rbf,TPESampler,COMPLETE
829,0.23472645184592933,2025-04-25 00:33:17.432817,2025-04-25 00:33:18.281500,0 days 00:00:00.848683,26.25819877414287,0.005444062263617307,0.05456731620657241,rbf,TPESampler,COMPLETE
830,0.34186314850156385,2025-04-25 00:33:18.443658,2025-04-25 00:33:19.430979,0 days 00:00:00.987321,88.3459374215875,0.0037827614609982716,0.13241937435582893,rbf,TPESampler,COMPLETE
831,0.5614121301286541,2025-04-25 00:33:19.593820,2025-04-25 00:33:20.134779,0 days 00:00:00.540959,0.001217850778000347,0.0034016110141019684,0.00037694030817519086,linear,TPESampler,COMPLETE
832,0.18368761653045387,2025-04-25 00:33:20.296814,2025-04-25 00:33:21.205238,0 days 00:00:00.908424,82.68043124640553,0.003164664351725647,0.008072802924928991,rbf,TPESampler,COMPLETE
833,0.2045613499857723,2025-04-25 00:33:21.373446,2025-04-25 00:33:22.080101,0 days 00:00:00.706655,19.438501960723784,0.012700373436478412,0.03072369512615378,rbf,TPESampler,COMPLETE
834,489.6103462694221,2025-04-25 00:33:22.241794,2025-04-25 00:33:22.950880,0 days 00:00:00.709086,98.95559248795333,0.006114926111574246,0.006919452642269839,sigmoid,TPESampler,COMPLETE
835,0.6974486383963799,2025-04-25 00:33:23.111299,2025-04-25 00:35:35.829672,0 days 00:02:12.718373,0.04502144012574589,0.2863894671368824,0.3517852267241272,poly,TPESampler,COMPLETE
836,0.773855052060687,2025-04-25 00:35:36.007376,2025-04-25 00:58:14.116075,0 days 00:22:38.108699,0.06659642491689632,0.008554611566324801,0.6964869809458639,poly,TPESampler,COMPLETE
837,0.19661720500871446,2025-04-25 00:43:58.437634,2025-04-25 00:43:59.396615,0 days 00:00:00.958981,88.53557568205501,0.010711389342960042,0.01345222473967004,rbf,TPESampler,COMPLETE
838,0.864272835980914,2025-04-25 00:43:59.565852,2025-04-25 00:44:00.069001,0 days 00:00:00.503149,0.0234266566342384,0.5554522359654522,0.00059987306122625,sigmoid,TPESampler,COMPLETE
839,0.2034907518551708,2025-04-25 00:44:00.239367,2025-04-25 00:44:01.353372,0 days 00:00:01.114005,99.24097574509533,0.0013305650525119188,0.010604087982656458,rbf,TPESampler,COMPLETE
840,0.17222008653102552,2025-04-25 00:44:01.519721,2025-04-25 00:44:02.759182,0 days 00:00:01.239461,94.01959728567373,0.005943944390791492,0.02530417750919557,rbf,TPESampler,COMPLETE
841,0.2116363352847991,2025-04-25 00:44:02.934319,2025-04-25 00:44:03.605662,0 days 00:00:00.671343,9.79261952427875,0.005860165680347554,0.032801784064030844,rbf,TPESampler,COMPLETE
842,0.2118284804717986,2025-04-25 00:44:03.769466,2025-04-25 00:44:04.891169,0 days 00:00:01.121703,98.55252002415952,0.01057119261911476,0.045126955255598386,rbf,TPESampler,COMPLETE
843,74.64898805460128,2025-04-25 00:44:05.053766,2025-04-25 00:44:05.614843,0 days 00:00:00.561077,3.2949537743713333,0.005857925109250378,0.11200798604720498,sigmoid,TPESampler,COMPLETE
844,18.7846873193179,2025-04-25 00:44:05.774887,2025-04-25 03:09:13.988356,0 days 02:25:08.213469,48.719272995783335,0.07793529063198731,0.504392293039063,poly,TPESampler,COMPLETE
845,0.17529325824214156,2025-04-25 00:58:14.287451,2025-04-25 00:58:15.188638,0 days 00:00:00.901187,92.37551170090983,0.004563655537008299,0.006268579953770376,rbf,TPESampler,COMPLETE
846,0.17797359852449024,2025-04-25 00:58:15.350171,2025-04-25 00:58:16.687586,0 days 00:00:01.337415,82.34028327412398,0.0038413142827477013,0.03322578109584444,rbf,TPESampler,COMPLETE
847,0.20040067402490733,2025-04-25 00:58:16.856315,2025-04-25 00:58:17.688011,0 days 00:00:00.831696,30.208223164194667,0.0029199773247019127,0.019212762756965596,rbf,TPESampler,COMPLETE
848,0.7012401751066772,2025-04-25 00:58:17.864596,2025-04-25 00:58:19.904246,0 days 00:00:02.039650,13.15395448736261,0.004404085925175384,0.014947224738268577,poly,TPESampler,COMPLETE
849,0.19945632904634483,2025-04-25 00:58:20.072356,2025-04-25 00:58:20.783013,0 days 00:00:00.710657,15.37446599889746,0.012059182350230123,0.013682165483516714,rbf,TPESampler,COMPLETE
850,0.2019396531166324,2025-04-25 00:58:20.947986,2025-04-25 00:58:21.669727,0 days 00:00:00.721741,11.275120025143456,0.0026896538882235435,0.028631912273652856,rbf,TPESampler,COMPLETE
851,0.8790842460816216,2025-04-25 00:58:21.839680,2025-04-25 00:58:22.406944,0 days 00:00:00.567264,0.0011622122843951957,0.0011831706034080684,0.14786317703722707,rbf,TPESampler,COMPLETE
852,0.20561937595126567,2025-04-25 00:58:22.574567,2025-04-25 00:58:23.584284,0 days 00:00:01.009717,82.87056169369949,0.0036469353132429698,0.011492781209117932,rbf,TPESampler,COMPLETE
853,0.21607726775055192,2025-04-25 00:58:23.748475,2025-04-25 00:58:24.513317,0 days 00:00:00.764842,13.407192386230054,0.001467552984021458,0.03526323410067397,rbf,TPESampler,COMPLETE
854,0.21696897535471812,2025-04-25 00:58:24.683062,2025-04-25 00:58:25.307420,0 days 00:00:00.624358,11.955182061743518,0.004702364926191358,0.011838550797778782,rbf,TPESampler,COMPLETE
855,0.3584451546402236,2025-04-25 00:58:25.472663,2025-04-25 00:58:26.216873,0 days 00:00:00.744210,17.83428927393186,0.004636898139710151,0.16221532723176885,rbf,TPESampler,COMPLETE
856,0.19167655419682603,2025-04-25 00:58:26.379499,2025-04-25 00:58:27.072028,0 days 00:00:00.692529,18.21145721204623,0.010992975865126393,0.02160447581449452,rbf,TPESampler,COMPLETE
857,0.3916516710805316,2025-04-25 00:58:27.233418,2025-04-25 00:58:27.825787,0 days 00:00:00.592369,15.631696047731083,0.013285405521912942,0.23095530851895002,rbf,TPESampler,COMPLETE
858,0.1889697411084841,2025-04-25 00:58:27.995690,2025-04-25 00:58:29.273217,0 days 00:00:01.277527,81.7798499267295,0.0031959175751000842,0.019140073934147978,rbf,TPESampler,COMPLETE
859,0.23627983169034125,2025-04-25 00:58:29.432103,2025-04-25 00:58:30.896000,0 days 00:00:01.463897,92.84612893342302,0.004970895533373642,0.05369388027530325,rbf,TPESampler,COMPLETE
860,0.37727409532965794,2025-04-25 00:58:31.061564,2025-04-25 00:58:31.872458,0 days 00:00:00.810894,80.77000893665814,0.005039952425102964,0.1968998936396302,rbf,TPESampler,COMPLETE
861,0.17199053927295896,2025-04-25 00:58:32.075254,2025-04-25 00:58:33.490213,0 days 00:00:01.414959,96.55717662703375,0.004117090963181783,0.024884215462662715,rbf,TPESampler,COMPLETE
862,0.5308564500276269,2025-04-25 00:58:33.687176,2025-04-25 00:58:34.231264,0 days 00:00:00.544088,0.13550733270923598,0.19603682180916196,0.01002430267389908,rbf,TPESampler,COMPLETE
863,0.18531018938050117,2025-04-25 00:58:34.399098,2025-04-25 00:58:35.725489,0 days 00:00:01.326391,94.64486100987035,0.004686119518446221,0.01965031221558741,rbf,TPESampler,COMPLETE
864,0.18137226595720382,2025-04-25 00:58:35.929955,2025-04-25 00:58:37.333746,0 days 00:00:01.403791,88.72429405464572,0.004407669883702213,0.021931373529032388,rbf,TPESampler,COMPLETE
865,0.2077743755415598,2025-04-25 00:58:37.506935,2025-04-25 00:58:39.042634,0 days 00:00:01.535699,79.78646236777269,0.0023279253040558332,0.04505144369384851,rbf,TPESampler,COMPLETE
866,144.40459656416095,2025-04-25 00:58:39.205816,2025-04-25 00:58:39.765007,0 days 00:00:00.559191,9.22925164467506,0.009408032541436094,0.021408017727293678,sigmoid,TPESampler,COMPLETE
867,0.17161309204509798,2025-04-25 00:58:39.929833,2025-04-25 00:58:41.296114,0 days 00:00:01.366281,99.32772986780142,0.0040131884834718155,0.024566284304804464,rbf,TPESampler,COMPLETE
868,3.426776770104597,2025-04-25 00:58:41.460285,2025-04-25 00:58:42.005900,0 days 00:00:00.545615,0.1558593638806902,0.0028162021330753197,0.17858392479237553,sigmoid,TPESampler,COMPLETE
869,0.21850607871330127,2025-04-25 00:58:42.176732,2025-04-25 00:58:43.452319,0 days 00:00:01.275587,93.99118717933717,0.008977358582102876,0.04740449207933667,rbf,TPESampler,COMPLETE
870,0.27631346159675113,2025-04-25 00:58:43.621421,2025-04-25 00:59:23.747021,0 days 00:00:40.125600,67.11841164536976,0.003360274301453906,0.03174135199609696,linear,TPESampler,COMPLETE
871,1682.2634590118412,2025-04-25 00:59:23.919627,2025-04-25 00:59:24.481454,0 days 00:00:00.561827,73.79297776071023,0.01318084204790855,0.05386775061610777,sigmoid,TPESampler,COMPLETE
872,0.21090322627825575,2025-04-25 00:59:24.663169,2025-04-25 00:59:25.456078,0 days 00:00:00.792909,16.869482629768026,0.005284007834222337,0.03638731582011662,rbf,TPESampler,COMPLETE
873,0.25788808192616125,2025-04-25 00:59:25.618622,2025-04-25 00:59:26.235082,0 days 00:00:00.616460,10.981029073277671,0.003352248146578001,0.0062965403248042085,rbf,TPESampler,COMPLETE
874,0.21765406523815994,2025-04-25 00:59:26.395345,2025-04-25 00:59:27.013356,0 days 00:00:00.618011,17.35846522947344,0.004869227284831312,0.007959889774876886,rbf,TPESampler,COMPLETE
875,0.25509623736742754,2025-04-25 00:59:27.181656,2025-04-25 00:59:28.761701,0 days 00:00:01.580045,97.0144299095777,0.003797362480523321,0.06162196374484305,rbf,TPESampler,COMPLETE
876,0.8380923920573959,2025-04-25 00:59:28.932257,2025-04-25 01:14:04.354242,0 days 00:14:35.421985,23.952044642273364,0.004797927278016439,0.11834061690397493,poly,TPESampler,COMPLETE
877,0.4455390285869468,2025-04-25 01:14:04.524925,2025-04-25 01:14:05.090587,0 days 00:00:00.565662,93.95196967388105,0.058059042715571815,0.35598585524653953,rbf,TPESampler,COMPLETE
878,0.17203713359137476,2025-04-25 01:14:05.266659,2025-04-25 01:14:06.694010,0 days 00:00:01.427351,97.34522071956603,0.004729572119854028,0.02466584752287531,rbf,TPESampler,COMPLETE
879,0.19629471080364275,2025-04-25 01:14:06.863997,2025-04-25 01:14:07.544264,0 days 00:00:00.680267,14.98448678543353,0.003169159102164989,0.014941124861619701,rbf,TPESampler,COMPLETE
880,0.25326402193276903,2025-04-25 01:14:07.714485,2025-04-25 01:14:09.311554,0 days 00:00:01.597069,93.32364065188753,0.004518335412450446,0.06094624105438773,rbf,TPESampler,COMPLETE
881,0.17047200441192964,2025-04-25 01:14:09.480186,2025-04-25 01:14:10.709254,0 days 00:00:01.229068,90.07346929769687,0.0068958712607356506,0.027854349333528053,rbf,TPESampler,COMPLETE
882,0.20149255851394401,2025-04-25 01:14:10.879424,2025-04-25 01:14:11.971852,0 days 00:00:01.092428,86.22317188514437,0.002569972763737445,0.01244762131999049,rbf,TPESampler,COMPLETE
883,0.31668880321262366,2025-04-25 01:14:12.146707,2025-04-25 01:14:13.368216,0 days 00:00:01.221509,92.33609840101843,0.005023466442956067,0.10275538254928032,rbf,TPESampler,COMPLETE
884,0.21349041654224757,2025-04-25 01:14:13.533905,2025-04-25 01:14:14.269117,0 days 00:00:00.735212,14.63558363204475,0.0031400542957539866,0.03205968217623137,rbf,TPESampler,COMPLETE
885,0.2080257454059737,2025-04-25 01:14:14.432726,2025-04-25 01:14:15.147937,0 days 00:00:00.715211,78.10721005755232,0.0024694271585446303,0.0032308618132632074,rbf,TPESampler,COMPLETE
886,0.2197880342864088,2025-04-25 01:14:15.313365,2025-04-25 01:14:16.040683,0 days 00:00:00.727318,11.257026944830347,0.005461413507689331,0.035302402372451344,rbf,TPESampler,COMPLETE
887,0.20162486010198258,2025-04-25 01:14:16.205371,2025-04-25 01:14:16.834255,0 days 00:00:00.628884,20.656203299376134,0.007487019558265332,0.009626061512247845,rbf,TPESampler,COMPLETE
888,0.19859121523195816,2025-04-25 01:14:17.003017,2025-04-25 01:14:17.955673,0 days 00:00:00.952656,75.45787839963508,0.0073187651061775265,0.014365750438721306,rbf,TPESampler,COMPLETE
889,0.3084970413641896,2025-04-25 01:14:18.125729,2025-04-25 01:14:19.508357,0 days 00:00:01.382628,95.96594579965783,0.0014959053325700154,0.09360278915544035,rbf,TPESampler,COMPLETE
890,0.18885133749195615,2025-04-25 01:14:19.677198,2025-04-25 01:14:20.891984,0 days 00:00:01.214786,85.5421423927193,0.0015537426603894166,0.018410116799059663,rbf,TPESampler,COMPLETE
891,0.18077001169477425,2025-04-25 01:14:21.063733,2025-04-25 01:14:22.309100,0 days 00:00:01.245367,96.07939273468025,0.006284843838665312,0.0354849669791139,rbf,TPESampler,COMPLETE
892,0.1797376663447934,2025-04-25 01:14:22.479259,2025-04-25 01:14:23.797741,0 days 00:00:01.318482,91.98211534136477,0.009449382978378464,0.021961721167567897,rbf,TPESampler,COMPLETE
893,0.19948217037324154,2025-04-25 01:14:23.972425,2025-04-25 01:14:24.644218,0 days 00:00:00.671793,20.795488412218273,0.005349583861123668,0.010149932945842296,rbf,TPESampler,COMPLETE
894,0.32818988859949744,2025-04-25 01:14:24.809313,2025-04-25 01:14:25.939721,0 days 00:00:01.130408,96.09600384850428,0.005555345003060101,0.11533357659637389,rbf,TPESampler,COMPLETE
895,0.20740763165917095,2025-04-25 01:14:26.110795,2025-04-25 01:14:27.260603,0 days 00:00:01.149808,95.78337682444709,0.0023501704506490306,0.010161793088630305,rbf,TPESampler,COMPLETE
896,0.6272830113370715,2025-04-25 01:14:27.433462,2025-04-25 01:19:47.801649,0 days 00:05:20.368187,96.21186364581662,0.009404469196113397,0.019829523031588782,poly,TPESampler,COMPLETE
897,0.18894686082206688,2025-04-25 01:19:47.970531,2025-04-25 01:19:49.125426,0 days 00:00:01.154895,92.90097229621404,0.004197816282832347,0.016069853961564576,rbf,TPESampler,COMPLETE
898,0.1945267331578992,2025-04-25 01:19:49.284836,2025-04-25 01:19:50.001758,0 days 00:00:00.716922,13.268856099399313,0.001311898990726883,0.025379256042604638,rbf,TPESampler,COMPLETE
899,0.7223200377556704,2025-04-25 01:19:50.174249,2025-04-25 01:19:50.741744,0 days 00:00:00.567495,0.03896641688246186,0.0010421124390794267,0.002388846096538919,sigmoid,TPESampler,COMPLETE
900,0.28592850183484875,2025-04-25 01:19:50.923958,2025-04-25 01:19:58.095221,0 days 00:00:07.171263,27.79805924269968,0.22037740315918583,0.0002261094250884444,linear,TPESampler,COMPLETE
901,0.18887118702346428,2025-04-25 01:19:58.259905,2025-04-25 01:19:59.441079,0 days 00:00:01.181174,89.25337471450015,0.004963104056647361,0.019205767792379872,rbf,TPESampler,COMPLETE
902,0.35276216333411353,2025-04-25 01:19:59.614319,2025-04-25 01:20:00.180546,0 days 00:00:00.566227,0.11667319884924883,0.06650932296085056,0.008882151773149896,linear,TPESampler,COMPLETE
903,0.2990955329484456,2025-04-25 01:20:00.342504,2025-04-25 01:20:01.057497,0 days 00:00:00.714993,10.843695077304583,0.005165171021271834,0.09429080089197116,rbf,TPESampler,COMPLETE
904,0.19021444785113248,2025-04-25 01:20:01.221636,2025-04-25 01:20:02.420928,0 days 00:00:01.199292,96.5248635338027,0.001434829084903971,0.015487855896214597,rbf,TPESampler,COMPLETE
905,0.1842446703314618,2025-04-25 01:20:02.591457,2025-04-25 01:20:03.388513,0 days 00:00:00.797056,73.27131203471252,0.005372999734607196,0.005865335368188632,rbf,TPESampler,COMPLETE
906,0.3249958040999078,2025-04-25 01:20:03.561532,2025-04-25 01:20:04.398547,0 days 00:00:00.837015,14.71542435308073,0.002149627924407769,0.11503124217766006,rbf,TPESampler,COMPLETE
907,0.27416049435643264,2025-04-25 01:20:04.577179,2025-04-25 01:20:21.596409,0 days 00:00:17.019230,25.4463267170444,0.0010580224863785633,0.02283391798113516,linear,TPESampler,COMPLETE
908,0.6213083928169606,2025-04-25 01:20:21.762244,2025-04-25 01:20:22.316986,0 days 00:00:00.554742,1.5392525981999534,0.1027501134998004,0.00010666955010186954,rbf,TPESampler,COMPLETE
909,0.18488762397235325,2025-04-25 01:20:22.490316,2025-04-25 01:20:23.331658,0 days 00:00:00.841342,98.41267073083775,0.004874952594930116,0.0047092802003235595,rbf,TPESampler,COMPLETE
910,0.19965730092403786,2025-04-25 01:20:23.494488,2025-04-25 01:20:24.107318,0 days 00:00:00.612830,18.313482461256243,0.02637665039633365,0.02268783660400235,rbf,TPESampler,COMPLETE
911,1420.0099786496387,2025-04-25 01:20:24.271456,2025-04-25 01:20:24.818954,0 days 00:00:00.547498,68.78500349648019,0.001830494241801604,0.03592102366224474,sigmoid,TPESampler,COMPLETE
912,0.16848097072868626,2025-04-25 01:20:24.983837,2025-04-25 01:20:26.181125,0 days 00:00:01.197288,99.44835866583216,0.010197233637357741,0.02588775670012875,rbf,TPESampler,COMPLETE
913,0.17673462685036873,2025-04-25 01:20:26.345092,2025-04-25 01:20:27.637341,0 days 00:00:01.292249,99.46818387667417,0.009602587450962954,0.033005790148133006,rbf,TPESampler,COMPLETE
914,0.17385155499778357,2025-04-25 01:20:27.806808,2025-04-25 01:20:28.930343,0 days 00:00:01.123535,98.64941692581829,0.016060354034531557,0.031782263960479014,rbf,TPESampler,COMPLETE
915,0.18218317489084607,2025-04-25 01:20:29.091635,2025-04-25 01:20:30.246537,0 days 00:00:01.154902,90.27318292128989,0.007551309285130611,0.021332076605888293,rbf,TPESampler,COMPLETE
916,0.31737683775913195,2025-04-25 01:20:30.410059,2025-04-25 01:20:31.087535,0 days 00:00:00.677476,13.331048102312424,0.012495303858157843,0.10772628832414673,rbf,TPESampler,COMPLETE
917,0.22212579599124585,2025-04-25 01:20:31.263101,2025-04-25 01:20:32.082131,0 days 00:00:00.819030,18.496085954436236,0.0037113712569350928,0.04593356829956942,rbf,TPESampler,COMPLETE
918,0.27171071184093004,2025-04-25 01:20:32.267241,2025-04-25 01:20:33.240423,0 days 00:00:00.973182,22.567794878516807,0.008894331379448655,0.07316747200415609,rbf,TPESampler,COMPLETE
919,0.3102392524602426,2025-04-25 01:20:33.404535,2025-04-25 01:20:34.478075,0 days 00:00:01.073540,17.59085921742593,0.01066359498684368,0.10018610270785791,rbf,TPESampler,COMPLETE
920,0.18760249155756042,2025-04-25 01:20:34.669064,2025-04-25 01:20:36.322949,0 days 00:00:01.653885,88.63477941510152,0.0018012125887679107,0.038488511233756226,rbf,TPESampler,COMPLETE
921,0.3558671522470203,2025-04-25 01:20:36.489894,2025-04-25 01:20:37.479463,0 days 00:00:00.989569,99.76539097383595,0.016081299273379784,0.1566951444029417,rbf,TPESampler,COMPLETE
922,0.19466093090501865,2025-04-25 01:20:37.641048,2025-04-25 01:20:38.696872,0 days 00:00:01.055824,90.90575718908667,0.00858962511258597,0.013903911213763658,rbf,TPESampler,COMPLETE
923,0.2047953328298772,2025-04-25 01:20:39.177506,2025-04-25 01:20:40.021766,0 days 00:00:00.844260,23.26488391652165,0.005402470451060019,0.02275264232569953,rbf,TPESampler,COMPLETE
924,0.1768655846211109,2025-04-25 01:20:40.192133,2025-04-25 01:20:41.692270,0 days 00:00:01.500137,99.9605824436894,0.004079261868816393,0.03367494028012739,rbf,TPESampler,COMPLETE
925,0.7254795130594517,2025-04-25 01:20:41.864274,2025-04-25 01:20:42.435035,0 days 00:00:00.570761,0.8926386863108564,0.00526185410346299,0.00010727288170915425,sigmoid,TPESampler,COMPLETE
926,0.21740842436418858,2025-04-25 01:20:42.600369,2025-04-25 01:20:43.981410,0 days 00:00:01.381041,96.52036756682467,0.005836323829930973,0.0471307927631964,rbf,TPESampler,COMPLETE
927,0.2792825551197058,2025-04-25 01:20:44.144422,2025-04-25 01:20:45.437007,0 days 00:00:01.292585,89.31780700576014,0.004110883951270365,0.07363061088374835,rbf,TPESampler,COMPLETE
928,0.20412900881363336,2025-04-25 01:20:45.599866,2025-04-25 01:20:46.387087,0 days 00:00:00.787221,29.666850875432115,0.007204344504510773,0.020106252960333085,rbf,TPESampler,COMPLETE
929,0.28817532765933995,2025-04-25 01:20:46.554017,2025-04-25 01:20:47.374585,0 days 00:00:00.820568,13.088358635012053,0.0028127508807671247,0.08551699401750326,rbf,TPESampler,COMPLETE
930,0.20985673774712044,2025-04-25 01:20:47.547097,2025-04-25 01:20:48.173173,0 days 00:00:00.626076,13.34454039593904,0.005419871672172236,0.01229127014007005,rbf,TPESampler,COMPLETE
931,0.178314123189011,2025-04-25 01:20:48.337098,2025-04-25 01:20:49.598913,0 days 00:00:01.261815,89.46573526415838,0.010151722533600433,0.022806633537991037,rbf,TPESampler,COMPLETE
932,0.18509507097276554,2025-04-25 01:20:49.785221,2025-04-25 01:20:50.475382,0 days 00:00:00.690161,16.723117770318417,0.009998833996086922,0.017325162422988847,rbf,TPESampler,COMPLETE
933,0.19915253207256073,2025-04-25 01:20:50.649704,2025-04-25 01:20:51.663553,0 days 00:00:01.013849,95.76936962451184,0.006920419241959995,0.012421870457369286,rbf,TPESampler,COMPLETE
934,0.19404171431573689,2025-04-25 01:20:51.834943,2025-04-25 01:20:52.849952,0 days 00:00:01.015009,97.20806583502232,0.011936840708614548,0.01326172308457168,rbf,TPESampler,COMPLETE
935,0.21262527781640397,2025-04-25 01:20:53.018645,2025-04-25 01:20:53.669178,0 days 00:00:00.650533,12.19911475577291,0.0024011544860434142,0.012899174934558446,rbf,TPESampler,COMPLETE
936,0.3627482203682629,2025-04-25 01:20:53.839934,2025-04-25 01:20:54.718296,0 days 00:00:00.878362,78.2440912345386,0.007585307847912063,0.1667081369297191,rbf,TPESampler,COMPLETE
937,0.2364789649124063,2025-04-25 01:20:54.891508,2025-04-25 01:20:55.614534,0 days 00:00:00.723026,16.319002800921282,0.01447790942906463,0.052542965492979786,rbf,TPESampler,COMPLETE
938,0.5320447337220158,2025-04-25 01:20:55.782716,2025-04-25 01:20:56.238042,0 days 00:00:00.455326,1.0410837375803959,0.7967666345679033,0.0030654194854155387,rbf,TPESampler,COMPLETE
939,0.19183486002277933,2025-04-25 01:20:56.403298,2025-04-25 01:20:57.603971,0 days 00:00:01.200673,99.26401890796033,0.007222289528299876,0.014442876843476908,rbf,TPESampler,COMPLETE
940,0.19430843734377826,2025-04-25 01:20:57.776676,2025-04-25 01:20:59.292161,0 days 00:00:01.515485,92.92194521472632,0.003174751678183108,0.04084240201786706,rbf,TPESampler,COMPLETE
941,1.8076444545819286,2025-04-25 01:20:59.470149,2025-04-25 01:21:00.051362,0 days 00:00:00.581213,0.2491221896986081,0.03338566116231921,0.010019349027172036,sigmoid,TPESampler,COMPLETE
942,0.3248924616606861,2025-04-25 01:21:00.235813,2025-04-25 01:21:01.437063,0 days 00:00:01.201250,89.77406994995103,0.004500376662465596,0.11151704690001553,rbf,TPESampler,COMPLETE
