number,value,datetime_start,datetime_complete,duration,params_C,params_epsilon,params_gamma,params_kernel,system_attrs_auto:sampler,state
1177,1.3003402947656506,2025-04-25 04:36:17.384446,2025-04-25 04:54:40.371597,0 days 00:18:22.987151,94.76809735956566,0.010747789669757517,0.1505161138532778,poly,TPESampler,COMPLETE
1178,0.23083273222807335,2025-04-25 04:54:40.546156,2025-04-25 04:54:42.166652,0 days 00:00:01.620496,98.7349305460663,0.0066267055910726,0.0516696242471644,rbf,TPESampler,COMPLETE
1179,0.8825087566075306,2025-04-25 04:54:42.344685,2025-04-25 04:54:42.943903,0 days 00:00:00.599218,0.014358351918878272,0.7863623803109803,0.004247776071175137,poly,TPESampler,COMPLETE
1180,0.21837642911327415,2025-04-25 04:54:43.112788,2025-04-25 04:54:43.862533,0 days 00:00:00.749745,15.068727598196766,0.005956441289868904,0.04195561299191762,rbf,TPESampler,COMPLETE
1181,0.17508324699678188,2025-04-25 04:54:44.032858,2025-04-25 04:54:44.928594,0 days 00:00:00.895736,90.99796703669125,0.005792928094777314,0.006196857880214534,rbf,TPESampler,COMPLETE
1182,0.1838272030970969,2025-04-25 04:54:45.100553,2025-04-25 04:54:45.849369,0 days 00:00:00.748816,24.89738904854269,0.005998773887058443,0.016106441828486875,rbf,TPESampler,COMPLETE
1183,0.8872761102729176,2025-04-25 04:54:46.017943,2025-04-25 04:54:46.551886,0 days 00:00:00.533943,4.061591152331377,0.08682626296838088,0.000518570752569281,poly,TPESampler,COMPLETE
1184,0.20648074716450954,2025-04-25 04:54:46.720301,2025-04-25 04:54:47.740329,0 days 00:00:01.020028,20.015057349333176,0.011122581815375064,0.027305491527004545,rbf,TPESampler,COMPLETE
1185,0.20538816578414154,2025-04-25 04:54:47.913223,2025-04-25 04:54:48.749340,0 days 00:00:00.836117,21.761098673954383,0.0038316885622000766,0.03320043562790775,rbf,TPESampler,COMPLETE
1186,0.2799753366335365,2025-04-25 04:54:48.919941,2025-04-25 04:54:49.518460,0 days 00:00:00.598519,2.322151376702509,0.003239958077944631,0.05304091257731342,rbf,TPESampler,COMPLETE
1187,0.20765235575043198,2025-04-25 04:54:49.693096,2025-04-25 04:54:50.710102,0 days 00:00:01.017006,85.00958220792184,0.00584330453341601,0.010817367900034305,rbf,TPESampler,COMPLETE
1188,0.2671706360283121,2025-04-25 04:54:50.884746,2025-04-25 04:54:51.851835,0 days 00:00:00.967089,0.6123478995931381,0.01160430015860795,0.00038649464591188976,linear,TPESampler,COMPLETE
1189,0.20349854249445662,2025-04-25 04:54:52.024008,2025-04-25 04:54:53.109245,0 days 00:00:01.085237,98.76262507620947,0.003009057569082217,0.009043222564230024,rbf,TPESampler,COMPLETE
1190,0.17363957216004766,2025-04-25 04:54:53.284202,2025-04-25 04:54:54.541405,0 days 00:00:01.257203,98.37629043607178,0.006237480121765439,0.030878994031833393,rbf,TPESampler,COMPLETE
1191,0.3928752087706104,2025-04-25 04:54:54.714655,2025-04-25 04:54:55.442537,0 days 00:00:00.727882,98.18940780812721,0.0010125889384888153,0.23333447837443674,rbf,TPESampler,COMPLETE
1192,0.32126183732339064,2025-04-25 04:54:55.617083,2025-04-25 04:54:56.224735,0 days 00:00:00.607652,13.439716865479053,0.03953208038172005,0.11163410067755437,rbf,TPESampler,COMPLETE
1193,0.8342161453442696,2025-04-25 04:54:56.399258,2025-04-25 05:20:27.814488,0 days 00:25:31.415230,92.10703950751166,0.0019169774834124189,0.07725356718449604,poly,TPESampler,COMPLETE
1194,0.27788630515780954,2025-04-25 05:02:33.699253,2025-04-25 05:02:34.289569,0 days 00:00:00.590316,13.450025692452773,0.0030182102279151966,0.0044085647489553416,rbf,TPESampler,COMPLETE
1195,0.30516640288443747,2025-04-25 05:02:34.452464,2025-04-25 05:02:35.440164,0 days 00:00:00.987700,93.68595985027345,0.021039704905510107,0.09371769122005065,rbf,TPESampler,COMPLETE
1196,0.18834490433110795,2025-04-25 05:02:35.607896,2025-04-25 05:02:36.274487,0 days 00:00:00.666591,21.04769183757001,0.007790232149003336,0.012464400442149446,rbf,TPESampler,COMPLETE
1197,0.19842450906529177,2025-04-25 05:02:36.437962,2025-04-25 05:02:37.463387,0 days 00:00:01.025425,96.28251912520122,0.004136208996408001,0.012927773450266154,rbf,TPESampler,COMPLETE
1198,0.7030648526173855,2025-04-25 05:02:37.631434,2025-04-25 05:02:39.908638,0 days 00:00:02.277204,18.721469789968165,0.010815357391479203,0.013249215395531562,poly,TPESampler,COMPLETE
1199,1837.0755863063803,2025-04-25 05:02:40.079402,2025-04-25 05:02:40.622623,0 days 00:00:00.543221,81.63086810900921,0.00480186397101326,0.11563604881061479,sigmoid,TPESampler,COMPLETE
1200,0.1751841192700828,2025-04-25 05:02:40.786470,2025-04-25 05:02:42.189844,0 days 00:00:01.403374,99.04425075632518,0.00863331303803115,0.03198709367210243,rbf,TPESampler,COMPLETE
1201,0.2692026140737219,2025-04-25 05:02:42.572524,2025-04-25 05:02:46.653928,0 days 00:00:04.081404,4.258639891069515,0.02108897184701242,0.06038852735350079,linear,TPESampler,COMPLETE
1202,0.18589243199419592,2025-04-25 05:02:46.945855,2025-04-25 05:02:48.861417,0 days 00:00:01.915562,17.398626510373756,0.0028037349313744728,0.015878854803940464,rbf,TPESampler,COMPLETE
1203,0.21313050947173376,2025-04-25 05:02:49.290110,2025-04-25 05:02:50.370546,0 days 00:00:01.080436,20.872485933235815,0.007429023717149317,0.0400323863738061,rbf,TPESampler,COMPLETE
1204,0.36558241811182307,2025-04-25 05:02:50.730509,2025-04-25 05:02:52.104828,0 days 00:00:01.374319,21.333663042249352,0.0027411579402335006,0.17420661709499385,rbf,TPESampler,COMPLETE
1205,0.4793740122416432,2025-04-25 05:02:52.328933,2025-04-25 05:02:53.191822,0 days 00:00:00.862889,0.010594504498975725,0.23190283288913044,0.3060642310798325,linear,TPESampler,COMPLETE
1206,0.32187093915062504,2025-04-25 05:02:53.528711,2025-04-25 05:02:54.589453,0 days 00:00:01.060742,24.602483658711048,0.0024611640228737477,0.1096979293349149,rbf,TPESampler,COMPLETE
1207,0.8991840423889206,2025-04-25 05:02:54.934588,2025-04-25 05:02:55.495265,0 days 00:00:00.560677,0.001497298739980561,0.012046467165399736,0.00026788081467260104,rbf,TPESampler,COMPLETE
1208,0.19049275048827094,2025-04-25 05:02:55.664762,2025-04-25 05:02:56.363076,0 days 00:00:00.698314,14.392176853727262,0.002237738973609653,0.022634711130228292,rbf,TPESampler,COMPLETE
1209,0.18012171645510153,2025-04-25 05:02:56.529199,2025-04-25 05:02:58.270944,0 days 00:00:01.741745,83.94968612628136,0.001012286391465387,0.03490135176862349,rbf,TPESampler,COMPLETE
1210,0.33640297297383265,2025-04-25 05:02:58.560580,2025-04-25 05:02:59.819872,0 days 00:00:01.259292,98.6625171649319,0.004408805500534263,0.12490195264561114,rbf,TPESampler,COMPLETE
1211,0.17429912601633907,2025-04-25 05:02:59.993846,2025-04-25 05:03:01.642713,0 days 00:00:01.648867,93.13765216392655,0.002159218233365658,0.03149017832813598,rbf,TPESampler,COMPLETE
1212,0.23933679365893976,2025-04-25 05:03:01.811833,2025-04-25 05:03:03.448156,0 days 00:00:01.636323,98.43959809996916,0.004639522716012624,0.05490396053044407,rbf,TPESampler,COMPLETE
1213,0.1835224401954772,2025-04-25 05:03:03.624615,2025-04-25 05:03:04.871329,0 days 00:00:01.246714,96.51766819728843,0.010687554254771062,0.03615533786901922,rbf,TPESampler,COMPLETE
1214,0.187834302468732,2025-04-25 05:03:05.037957,2025-04-25 05:03:06.156989,0 days 00:00:01.119032,95.27220175285582,0.01042258701774147,0.016628696177069986,rbf,TPESampler,COMPLETE
1215,0.18554133952276594,2025-04-25 05:03:06.324636,2025-04-25 05:03:07.029837,0 days 00:00:00.705201,16.55860268377518,0.002258709871569182,0.01887742242015249,rbf,TPESampler,COMPLETE
1216,0.31978106311456045,2025-04-25 05:03:07.192308,2025-04-25 05:03:07.884891,0 days 00:00:00.692583,14.16926223021481,0.011868563758970052,0.10987770699770989,rbf,TPESampler,COMPLETE
1217,0.21185580469085497,2025-04-25 05:03:08.052430,2025-04-25 05:03:08.756137,0 days 00:00:00.703707,96.65498094374996,0.0030226296899758857,0.0023935786461321447,rbf,TPESampler,COMPLETE
1218,0.3087296041985159,2025-04-25 05:03:08.923977,2025-04-25 05:03:10.094216,0 days 00:00:01.170239,95.44280428400268,0.010600087266079082,0.09624454885082495,rbf,TPESampler,COMPLETE
1219,0.1856832708845129,2025-04-25 05:03:10.264358,2025-04-25 05:03:11.514127,0 days 00:00:01.249769,87.69732348464225,0.002096368609443332,0.020811903022577315,rbf,TPESampler,COMPLETE
1220,0.20399010031484335,2025-04-25 05:03:11.702216,2025-04-25 05:03:12.691110,0 days 00:00:00.988894,87.84728691722431,0.007876909258293612,0.011470416284249628,rbf,TPESampler,COMPLETE
1221,0.5519797110783172,2025-04-25 05:03:12.875161,2025-04-25 05:03:13.344351,0 days 00:00:00.469190,0.0018975291251578494,0.3397311724832307,0.008020446462974902,linear,TPESampler,COMPLETE
1222,0.22467552534227495,2025-04-25 05:03:13.506272,2025-04-25 05:03:14.322864,0 days 00:00:00.816592,19.83431064372392,0.0034669614523470723,0.04773773644083587,rbf,TPESampler,COMPLETE
1223,127.81088951749317,2025-04-25 05:03:14.520742,2025-04-25 05:03:15.153053,0 days 00:00:00.632311,18.426894491406212,0.006695934777157172,0.00907257685084914,sigmoid,TPESampler,COMPLETE
1224,0.27124787300127357,2025-04-25 05:03:15.320095,2025-04-25 05:03:20.351042,0 days 00:00:05.030947,6.373082523113035,0.0024362370765318602,0.02988687825562945,linear,TPESampler,COMPLETE
1225,0.2018401813338724,2025-04-25 05:03:20.522693,2025-04-25 05:03:21.479722,0 days 00:00:00.957029,89.78210568582034,0.005255636466494235,0.009448015867388006,rbf,TPESampler,COMPLETE
1226,0.1682033408323895,2025-04-25 05:03:21.645502,2025-04-25 05:03:23.037242,0 days 00:00:01.391740,98.40094142783026,0.0036261884553289415,0.027969795435245196,rbf,TPESampler,COMPLETE
1227,0.1898890440361452,2025-04-25 05:03:23.203707,2025-04-25 05:03:23.904889,0 days 00:00:00.701182,23.70605551372323,0.0121688145558517,0.01899467306103983,rbf,TPESampler,COMPLETE
1228,0.2641247088837826,2025-04-25 05:03:24.070304,2025-04-25 05:03:24.633434,0 days 00:00:00.563130,2.616426216366814,0.020545304285352478,0.038801239033367255,rbf,TPESampler,COMPLETE
1229,0.23832589177225208,2025-04-25 05:03:24.804397,2025-04-25 05:03:25.840899,0 days 00:00:01.036502,22.26124501003429,0.0029189205668041043,0.056229958783343685,rbf,TPESampler,COMPLETE
1230,0.21357827109144492,2025-04-25 05:03:26.020697,2025-04-25 05:03:26.836013,0 days 00:00:00.815316,24.569512519295166,0.004667059841944618,0.04189283343499877,rbf,TPESampler,COMPLETE
1231,0.4256207432867724,2025-04-25 05:03:27.007814,2025-04-25 05:03:27.548764,0 days 00:00:00.540950,0.028632787218259802,0.016913946487158858,0.03181549148508952,linear,TPESampler,COMPLETE
1232,0.2889776686869333,2025-04-25 05:03:27.717076,2025-04-25 05:03:29.165217,0 days 00:00:01.448141,93.95062633558653,0.002747384439230789,0.07791141285969165,rbf,TPESampler,COMPLETE
1233,0.19383572291582665,2025-04-25 05:03:29.338839,2025-04-25 05:03:30.386188,0 days 00:00:01.047349,96.56484153566073,0.0016555585538760556,0.008126514406260027,rbf,TPESampler,COMPLETE
1234,0.23345265083574437,2025-04-25 05:03:30.552623,2025-04-25 05:03:31.388035,0 days 00:00:00.835412,14.952797344595417,0.0010002479326621427,0.051981487275972495,rbf,TPESampler,COMPLETE
1235,0.20755837607547037,2025-04-25 05:03:31.555730,2025-04-25 05:03:32.258920,0 days 00:00:00.703190,17.976680705511725,0.014481359083801142,0.030242116030576797,rbf,TPESampler,COMPLETE
1236,0.19532834151418826,2025-04-25 05:03:32.436037,2025-04-25 05:03:33.503438,0 days 00:00:01.067401,95.65758349352356,0.005111112647196665,0.01376453753151326,rbf,TPESampler,COMPLETE
1237,0.2209585190626499,2025-04-25 05:03:33.670200,2025-04-25 05:03:34.465400,0 days 00:00:00.795200,19.420705308376693,0.005661854621131175,0.04524257183053025,rbf,TPESampler,COMPLETE
1238,0.24813897912662855,2025-04-25 05:03:34.637536,2025-04-25 05:03:35.763471,0 days 00:00:01.125935,86.9108997930684,0.008938559733970184,0.05913387131214788,rbf,TPESampler,COMPLETE
1239,0.18825498255052742,2025-04-25 05:03:35.931803,2025-04-25 05:03:36.660021,0 days 00:00:00.728218,20.98178391888803,0.0030055122915439315,0.019943833740631304,rbf,TPESampler,COMPLETE
1240,0.3114565653261311,2025-04-25 05:03:36.830016,2025-04-25 05:03:38.059476,0 days 00:00:01.229460,96.61705670073559,0.00498284560220649,0.09755304945037116,rbf,TPESampler,COMPLETE
1241,0.18866264519831547,2025-04-25 05:03:38.237715,2025-04-25 05:03:39.507625,0 days 00:00:01.269910,93.82412293874673,0.0017743826739867036,0.018411765566487617,rbf,TPESampler,COMPLETE
1242,0.18096985310448419,2025-04-25 05:03:39.777167,2025-04-25 05:03:41.602330,0 days 00:00:01.825163,96.3413519340103,0.003552359068019697,0.03575618406589045,rbf,TPESampler,COMPLETE
1243,0.18366608961994854,2025-04-25 05:03:41.772781,2025-04-25 05:03:42.425366,0 days 00:00:00.652585,18.124337142440567,0.012458735991291745,0.016502916148692617,rbf,TPESampler,COMPLETE
1244,0.2003110444617793,2025-04-25 05:03:42.660069,2025-04-25 05:03:43.461169,0 days 00:00:00.801100,95.20249743414637,0.024973167174562404,0.04174004568510554,rbf,TPESampler,COMPLETE
1245,0.19980101202017161,2025-04-25 05:03:43.634949,2025-04-25 05:03:44.667110,0 days 00:00:01.032161,94.36751659683843,0.004796535057492913,0.012196688437217102,rbf,TPESampler,COMPLETE
1246,0.1991173116411011,2025-04-25 05:03:44.851580,2025-04-25 05:03:45.493639,0 days 00:00:00.642059,19.551862519297217,0.006682696729537651,0.01073821531011793,rbf,TPESampler,COMPLETE
1247,0.24761779454787594,2025-04-25 05:03:45.689723,2025-04-25 05:03:46.296034,0 days 00:00:00.606311,12.166770487703051,0.0012247105863359984,0.006529529153169273,rbf,TPESampler,COMPLETE
1248,0.22123941835955127,2025-04-25 05:03:46.463353,2025-04-25 05:03:47.113160,0 days 00:00:00.649807,19.975131245402697,0.003423928109730633,0.006171990390092883,rbf,TPESampler,COMPLETE
1249,0.35143266363368014,2025-04-25 05:03:47.278503,2025-04-25 05:03:47.927771,0 days 00:00:00.649268,19.264546681949312,0.018139796215176314,0.15229981639388962,rbf,TPESampler,COMPLETE
1250,0.17049494825102354,2025-04-25 05:03:48.101575,2025-04-25 05:03:49.584491,0 days 00:00:01.482916,91.28311181184822,0.003720134993920669,0.029304653780125534,rbf,TPESampler,COMPLETE
1251,0.20757494138260155,2025-04-25 05:03:49.752464,2025-04-25 05:03:50.705241,0 days 00:00:00.952777,93.83455030708281,0.01038372561293262,0.010022360528904532,rbf,TPESampler,COMPLETE
1252,0.2003610943274752,2025-04-25 05:03:50.882717,2025-04-25 05:03:52.332481,0 days 00:00:01.449764,99.47529269785706,0.004589478342913198,0.04224169120872703,rbf,TPESampler,COMPLETE
1253,0.17525558009098288,2025-04-25 05:03:52.502317,2025-04-25 05:03:53.560664,0 days 00:00:01.058347,84.5262271090132,0.01256767556712843,0.031399848176538236,rbf,TPESampler,COMPLETE
1254,0.20322831367069613,2025-04-25 05:03:53.729466,2025-04-25 05:03:54.732741,0 days 00:00:01.003275,98.19128600016292,0.006472073032020845,0.010885096228746071,rbf,TPESampler,COMPLETE
1255,0.2088656259563246,2025-04-25 05:03:54.904500,2025-04-25 05:03:55.583783,0 days 00:00:00.679283,16.887416864596,0.01867375962620489,0.03342287876640343,rbf,TPESampler,COMPLETE
1256,0.9038248355703504,2025-04-25 05:03:55.754904,2025-04-25 05:03:56.262623,0 days 00:00:00.507719,0.0689602359754481,0.29013213434068735,0.00012594147503942546,poly,TPESampler,COMPLETE
1257,0.1986356364822257,2025-04-25 05:03:56.432193,2025-04-25 05:03:57.589721,0 days 00:00:01.157528,97.61378546923069,0.0058776780320600255,0.012710074362282657,rbf,TPESampler,COMPLETE
1258,0.2985264681869376,2025-04-25 05:03:57.767537,2025-04-25 05:03:58.939884,0 days 00:00:01.172347,93.43889718728423,0.006498197054784995,0.0859522883807339,rbf,TPESampler,COMPLETE
1259,0.5377477970520587,2025-04-25 05:03:59.109103,2025-04-25 05:03:59.547758,0 days 00:00:00.438655,0.10929519758283318,0.9685381854415841,0.0010641905548479404,linear,TPESampler,COMPLETE
1260,0.23348832707812187,2025-04-25 05:03:59.718958,2025-04-25 05:04:00.573703,0 days 00:00:00.854745,16.10852582790447,0.0027412909797995236,0.05232738292161844,rbf,TPESampler,COMPLETE
1261,0.3750201450752098,2025-04-25 05:04:00.743354,2025-04-25 05:04:01.467699,0 days 00:00:00.724345,18.97918366378274,0.0047386512079556735,0.1935935041486801,rbf,TPESampler,COMPLETE
1262,0.5426816540784901,2025-04-25 05:04:01.633163,2025-04-25 05:04:02.212465,0 days 00:00:00.579302,4.026653961259432,0.00308431127949508,0.6632423961294117,rbf,TPESampler,COMPLETE
1263,0.1829899685439152,2025-04-25 05:04:02.383669,2025-04-25 05:04:03.404575,0 days 00:00:01.020906,81.25525675240092,0.016307711564843334,0.02214025102564415,rbf,TPESampler,COMPLETE
1264,0.20436400031287968,2025-04-25 05:04:03.580130,2025-04-25 05:04:04.349822,0 days 00:00:00.769692,19.79833300148394,0.014349164263552225,0.031154716097179097,rbf,TPESampler,COMPLETE
1265,0.18666685185751003,2025-04-25 05:04:04.519495,2025-04-25 05:04:05.230571,0 days 00:00:00.711076,19.093605216391502,0.0031373249747201322,0.014020406330103216,rbf,TPESampler,COMPLETE
1266,0.19174722502859196,2025-04-25 05:04:05.437982,2025-04-25 05:04:06.147487,0 days 00:00:00.709505,14.47107716134012,0.0066862912643542586,0.023381574350140637,rbf,TPESampler,COMPLETE
1267,0.6372584468517736,2025-04-25 05:04:06.315007,2025-04-25 05:04:06.995025,0 days 00:00:00.680018,0.18685899361627928,0.11314016361439878,0.03455532777737178,poly,TPESampler,COMPLETE
1268,0.19264442238358984,2025-04-25 05:04:07.178415,2025-04-25 05:04:08.288866,0 days 00:00:01.110451,87.5431645165549,0.009430961989703932,0.03961095568080895,rbf,TPESampler,COMPLETE
1269,0.7284083157046561,2025-04-25 05:04:08.454089,2025-04-25 05:14:02.369024,0 days 00:09:53.914935,6.76482331257103,0.0019255635515894498,0.07048427482146925,poly,TPESampler,COMPLETE
1270,0.1712324971291893,2025-04-25 05:14:02.548407,2025-04-25 05:14:04.094011,0 days 00:00:01.545604,98.42379083132481,0.0012854827185104448,0.025165499548984647,rbf,TPESampler,COMPLETE
1271,0.2247568443680172,2025-04-25 05:14:04.267574,2025-04-25 05:14:05.099011,0 days 00:00:00.831437,14.853745233660945,0.0010240894706864316,0.04616443620345718,rbf,TPESampler,COMPLETE
1272,0.33997667829802014,2025-04-25 05:14:05.272268,2025-04-25 05:14:06.502664,0 days 00:00:01.230396,88.85860458803833,0.0017832823385764518,0.1291369799543757,rbf,TPESampler,COMPLETE
1273,0.18101996553467725,2025-04-25 05:14:06.669817,2025-04-25 05:14:08.038996,0 days 00:00:01.369179,62.65998381766434,0.0019389682424101184,0.03407775579638132,rbf,TPESampler,COMPLETE
1274,0.22552529106239957,2025-04-25 05:14:08.206153,2025-04-25 05:14:08.839093,0 days 00:00:00.632940,13.282014898185324,0.0011033619844689135,0.008397208187617333,rbf,TPESampler,COMPLETE
1275,0.20599672035751804,2025-04-25 05:14:09.002570,2025-04-25 05:14:10.105381,0 days 00:00:01.102811,86.26253522394948,0.0011025961059010127,0.010018423321544,rbf,TPESampler,COMPLETE
1276,0.6721986538282153,2025-04-25 05:14:10.280790,2025-04-25 05:14:10.881475,0 days 00:00:00.600685,23.36656535684032,0.0012584788626445185,0.0044985399824779915,poly,TPESampler,COMPLETE
1277,0.3449312818682205,2025-04-25 05:14:11.052922,2025-04-25 05:14:11.639824,0 days 00:00:00.586902,1.3406222929073361,0.0011968081688353079,0.01500323491597333,rbf,TPESampler,COMPLETE
1278,0.2008148076537227,2025-04-25 05:14:11.816720,2025-04-25 05:14:12.654903,0 days 00:00:00.838183,25.685694947360073,0.002278024759572967,0.030162220921829613,rbf,TPESampler,COMPLETE
1279,0.3729807034646325,2025-04-25 05:14:12.825265,2025-04-25 05:14:13.493536,0 days 00:00:00.668271,92.9198652545618,0.014775494080160758,0.1894771368883252,rbf,TPESampler,COMPLETE
1280,0.36882986126452383,2025-04-25 05:14:13.663799,2025-04-25 05:14:14.702580,0 days 00:00:01.038781,85.73997031369471,0.00173880708417103,0.17602203185775492,rbf,TPESampler,COMPLETE
1281,0.18428446667492873,2025-04-25 05:14:14.884657,2025-04-25 05:14:15.725989,0 days 00:00:00.841332,37.79178772871478,0.0010064224417081085,0.013370927960949547,rbf,TPESampler,COMPLETE
1282,480.1191121782783,2025-04-25 05:14:15.891719,2025-04-25 05:14:16.446672,0 days 00:00:00.554953,21.856357385829025,0.003995091699554485,0.04290107528096048,sigmoid,TPESampler,COMPLETE
1283,869.1433165402689,2025-04-25 05:14:16.611095,2025-04-25 05:14:17.165744,0 days 00:00:00.554649,98.5782986907963,0.003276804177954086,0.011085172758363139,sigmoid,TPESampler,COMPLETE
1284,0.21057028771318845,2025-04-25 05:14:17.335814,2025-04-25 05:14:17.964669,0 days 00:00:00.628855,21.588462035788815,0.0021409818055292277,0.007815404890111486,rbf,TPESampler,COMPLETE
1285,0.2599513047259817,2025-04-25 05:14:18.133623,2025-04-25 05:14:19.076135,0 days 00:00:00.942512,24.40454900936528,0.0019941920372459963,0.06673744228018753,rbf,TPESampler,COMPLETE
1286,0.29931525628217026,2025-04-25 05:14:19.251159,2025-04-25 05:14:20.534551,0 days 00:00:01.283392,72.26590417812449,0.0018963769585841012,0.08576816985314793,rbf,TPESampler,COMPLETE
1287,0.3575216561803033,2025-04-25 05:14:20.705885,2025-04-25 05:14:21.321494,0 days 00:00:00.615609,0.1060526676308039,0.0012653742091757604,0.0898768407863435,linear,TPESampler,COMPLETE
1288,0.18492293674454457,2025-04-25 05:14:21.500345,2025-04-25 05:14:22.282665,0 days 00:00:00.782320,23.98307263113973,0.0012387747689464376,0.016972030740138068,rbf,TPESampler,COMPLETE
1289,0.20868053093277633,2025-04-25 05:14:22.449417,2025-04-25 05:14:23.187870,0 days 00:00:00.738453,92.7398930678906,0.002682180533146607,0.0028083523900929736,rbf,TPESampler,COMPLETE
1290,0.20491114279610134,2025-04-25 05:14:23.361450,2025-04-25 05:14:24.515767,0 days 00:00:01.154317,95.68514284288554,0.00134135587329578,0.009318317375157415,rbf,TPESampler,COMPLETE
1291,0.18395907103247222,2025-04-25 05:14:24.699911,2025-04-25 05:14:25.950724,0 days 00:00:01.250813,93.47966265108157,0.0035705970099390214,0.020333749918679943,rbf,TPESampler,COMPLETE
1292,0.169820391890711,2025-04-25 05:14:26.116240,2025-04-25 05:14:27.639849,0 days 00:00:01.523609,89.29825461037609,0.0012875386968317151,0.029158153837630853,rbf,TPESampler,COMPLETE
1293,0.18163353347671082,2025-04-25 05:14:27.800388,2025-04-25 05:14:28.510400,0 days 00:00:00.710012,24.597606104019953,0.001973183441213894,0.013176242927114992,rbf,TPESampler,COMPLETE
