number,value,datetime_start,datetime_complete,duration,params_C,params_epsilon,params_gamma,params_kernel,system_attrs_auto:sampler,state
0,0.7894859241180064,2025-04-24 20:59:10.948292,2025-04-24 20:59:11.537962,0 days 00:00:00.589670,0.5800133824310928,0.005090439096047044,0.004907115998843565,poly,RandomSampler,COMPLETE
1,0.704895524211414,2025-04-24 20:59:10.960840,2025-04-24 20:59:11.966393,0 days 00:00:01.005553,3.2618108803844743,0.02793644081724864,0.018356947121573132,poly,RandomSampler,COMPLETE
2,0.5764236525669325,2025-04-24 20:59:11.022502,2025-04-24 20:59:11.570529,0 days 00:00:00.548027,2.293905126851257,0.13533908635786857,0.00016148634159960764,rbf,RandomSampler,COMPLETE
3,0.57951624371465,2025-04-24 20:59:11.702031,2025-04-24 20:59:12.215150,0 days 00:00:00.513119,4.26136546967334,0.624164632782229,0.0006708218154921089,sigmoid,TPESampler,COMPLETE
4,0.6984949893227295,2025-04-24 20:59:11.746029,2025-04-24 20:59:12.353461,0 days 00:00:00.607432,2.1269495977718753,0.0020016181679207144,0.008051028479705642,poly,TPESampler,COMPLETE
5,0.27652043210827854,2025-04-24 20:59:12.178732,2025-04-24 20:59:32.460191,0 days 00:00:20.281459,29.733834597260987,0.011211271640813193,0.02377211989537123,linear,TPESampler,COMPLETE
6,0.31496272388945157,2025-04-24 20:59:12.451417,2025-04-24 20:59:13.046981,0 days 00:00:00.595564,23.31801806398786,0.00572541134900018,0.0017331884034260743,rbf,TPESampler,COMPLETE
7,1.0647736289882581,2025-04-24 20:59:12.525815,2025-04-24 20:59:30.135871,0 days 00:00:17.610056,0.7913857217247817,0.9851768401481554,0.8370771835834402,poly,TPESampler,COMPLETE
8,0.8870255016405114,2025-04-24 20:59:13.210374,2025-04-24 20:59:13.664563,0 days 00:00:00.454189,0.0010231947757413395,0.11126865686830635,0.008245763189281838,poly,TPESampler,COMPLETE
9,0.262891712096597,2025-04-24 20:59:13.824733,2025-04-24 20:59:14.871320,0 days 00:00:01.046587,0.8393116271107669,0.004101329773643985,0.8521439379163919,linear,TPESampler,COMPLETE
10,0.8627959120292944,2025-04-24 20:59:15.301581,2025-04-24 20:59:15.806119,0 days 00:00:00.504538,0.004895922242473669,0.001378026099185703,0.2878301915417389,rbf,TPESampler,COMPLETE
11,0.7842836217763787,2025-04-24 20:59:15.961788,2025-04-24 20:59:16.435244,0 days 00:00:00.473456,0.0024260664555536956,0.0037912025552223564,0.03232444824962247,poly,TPESampler,COMPLETE
12,0.3518525654773928,2025-04-24 20:59:16.613698,2025-04-24 20:59:17.221790,0 days 00:00:00.608092,0.11565134635064091,0.002517967370381086,0.4538303729574535,linear,TPESampler,COMPLETE
13,0.3031989565206317,2025-04-24 20:59:17.390105,2025-04-24 20:59:17.996805,0 days 00:00:00.606700,73.17700840621299,0.003216447245274055,0.0008410489868662449,rbf,TPESampler,COMPLETE
14,0.2744107298409694,2025-04-24 20:59:18.162344,2025-04-24 20:59:32.177647,0 days 00:00:14.015303,19.309228934927294,0.0023862655924293307,0.5511397186517476,linear,TPESampler,COMPLETE
15,0.7560332735644762,2025-04-24 20:59:30.351266,2025-04-24 20:59:31.097760,0 days 00:00:00.746494,0.26887481701577093,0.018550396216544945,0.9436392871946809,rbf,TPESampler,COMPLETE
16,53.19747078767993,2025-04-24 20:59:31.281497,2025-04-24 20:59:31.911347,0 days 00:00:00.629850,1.741806397975041,0.0049257896184119136,0.5018534157767565,sigmoid,TPESampler,COMPLETE
17,0.2763236587070811,2025-04-24 20:59:32.104911,2025-04-24 21:00:11.051438,0 days 00:00:38.946527,67.89190415399233,0.0029025238847461277,0.8431772342708859,linear,TPESampler,COMPLETE
18,0.26293555669561997,2025-04-24 20:59:32.353368,2025-04-24 20:59:34.234375,0 days 00:00:01.881007,1.856910877094709,0.024520270749297815,0.2254836135142775,linear,TPESampler,COMPLETE
19,0.2726504039792563,2025-04-24 20:59:32.663757,2025-04-24 20:59:39.273840,0 days 00:00:06.610083,8.20382367692227,0.001362164489199423,0.05356348792581822,linear,TPESampler,COMPLETE
20,0.2927738480975311,2025-04-24 20:59:34.395437,2025-04-24 20:59:45.430982,0 days 00:00:11.035545,27.04801741565244,0.23968941070149166,0.774686308668055,linear,TPESampler,COMPLETE
21,0.2790695160925049,2025-04-24 20:59:39.430288,2025-04-24 20:59:40.258022,0 days 00:00:00.827734,0.36917022978724573,0.02318386904318831,0.04074623336686673,linear,TPESampler,COMPLETE
22,0.38021266304568563,2025-04-24 20:59:40.421699,2025-04-24 20:59:40.884642,0 days 00:00:00.462943,7.049776072615584,0.5165258454828209,0.01730685891405347,rbf,TPESampler,COMPLETE
23,0.27561234210922697,2025-04-24 20:59:41.044541,2025-04-24 20:59:42.018370,0 days 00:00:00.973829,0.5253325063188177,0.0016680450494989776,0.023857631402551954,linear,TPESampler,COMPLETE
24,0.26696711702046205,2025-04-24 20:59:42.185597,2025-04-24 20:59:43.095548,0 days 00:00:00.909951,0.5523422257350995,0.03868092901997097,0.7984822587223166,linear,TPESampler,COMPLETE
25,0.26341487718690365,2025-04-24 20:59:43.258258,2025-04-24 20:59:44.261532,0 days 00:00:01.003274,0.6646638702258444,0.039650259921931,0.9919062990180644,linear,TPESampler,COMPLETE
26,9.395715062391899,2025-04-24 20:59:44.410498,2025-04-24 20:59:44.925018,0 days 00:00:00.514520,0.3932854881861685,0.11099320464502425,0.23815869261950484,sigmoid,TPESampler,COMPLETE
27,11.555927849879664,2025-04-24 20:59:45.087876,2025-04-24 23:31:40.746412,0 days 02:31:55.658536,4.647974787160474,0.006710494303105048,0.9064694542239767,poly,TPESampler,COMPLETE
28,0.5140292794505185,2025-04-24 20:59:45.608117,2025-04-24 20:59:46.108034,0 days 00:00:00.499917,0.004059316992102368,0.07636266913470012,0.6406192180183642,linear,TPESampler,COMPLETE
29,0.5990246712841246,2025-04-24 20:59:46.260108,2025-04-24 20:59:46.794960,0 days 00:00:00.534852,12.078396735572335,0.06954921126457639,0.8108970605334599,rbf,TPESampler,COMPLETE
30,0.7489256416502602,2025-04-24 20:59:46.952632,2025-04-24 21:10:56.869180,0 days 00:11:09.916548,0.07144077251697485,0.048867164851335625,0.5897450407820432,poly,TPESampler,COMPLETE
31,0.8403700358990037,2025-04-24 21:00:11.222263,2025-04-24 21:00:11.763669,0 days 00:00:00.541406,0.08229622246357596,0.008594602108474436,0.00026523189268484943,sigmoid,TPESampler,COMPLETE
32,0.8724397063882301,2025-04-24 21:00:11.921854,2025-04-24 21:00:12.436292,0 days 00:00:00.514438,0.0013864053843778163,0.8868850491579657,0.3272823799568454,sigmoid,TPESampler,COMPLETE
33,0.2846377403672601,2025-04-24 21:00:12.609905,2025-04-24 21:00:13.345571,0 days 00:00:00.735666,0.31604453683453015,0.03428871626003877,0.9189244509988366,linear,TPESampler,COMPLETE
34,0.2635962188550845,2025-04-24 21:00:13.499891,2025-04-24 21:00:16.088649,0 days 00:00:02.588758,2.599271651473485,0.016760301131257815,0.15047571887494282,linear,TPESampler,COMPLETE
35,0.2730888148454045,2025-04-24 21:00:16.251901,2025-04-24 21:00:24.623154,0 days 00:00:08.371253,8.796921841343126,0.02787305085922509,0.18106840894715506,linear,TPESampler,COMPLETE
36,0.27829684408238736,2025-04-24 21:00:24.802579,2025-04-24 21:00:25.461996,0 days 00:00:00.659417,3.9382927290577823,0.015494723278326983,0.076533639139764,rbf,TPESampler,COMPLETE
37,0.2649865896504108,2025-04-24 21:00:25.646768,2025-04-24 21:00:28.639135,0 days 00:00:02.992367,2.994947513585291,0.01546326523636161,0.8670492601704036,linear,TPESampler,COMPLETE
38,0.5228465921931993,2025-04-24 21:00:28.815182,2025-04-24 21:00:29.270177,0 days 00:00:00.454995,0.23468516551501595,0.8912129821228113,0.06928709801506626,linear,TPESampler,COMPLETE
39,0.6922355273646281,2025-04-24 21:00:29.452571,2025-04-24 21:00:30.075775,0 days 00:00:00.623204,0.5967400781148786,0.0011382920141736314,0.00011703684297727065,rbf,TPESampler,COMPLETE
40,177.96790349048342,2025-04-24 21:00:30.273207,2025-04-24 21:00:30.987031,0 days 00:00:00.713824,7.912872463561587,0.01679805990990114,0.044421036573098274,sigmoid,TPESampler,COMPLETE
41,0.737186266800301,2025-04-24 21:00:31.200040,2025-04-24 21:00:31.761441,0 days 00:00:00.561401,0.03646460514286132,0.42612069196727376,0.002870243155805166,sigmoid,TPESampler,COMPLETE
42,0.9015111181677448,2025-04-24 21:00:31.952678,2025-04-24 21:00:32.712185,0 days 00:00:00.759507,0.0049627441403846135,0.0011522183778533142,0.0003234927926084171,poly,TPESampler,COMPLETE
43,0.26052938820427396,2025-04-24 21:00:32.945706,2025-04-24 21:00:35.170226,0 days 00:00:02.224520,2.0824167572583825,0.004420879340695988,0.7093613633929048,linear,TPESampler,COMPLETE
44,0.8888594156137889,2025-04-24 21:00:35.366972,2025-04-24 23:06:26.946750,0 days 02:05:51.579778,0.12096661470030017,0.0013791201729680598,0.8185449726357982,poly,TPESampler,COMPLETE
45,0.6265242271006979,2025-04-24 21:10:57.040250,2025-04-24 21:10:57.634640,0 days 00:00:00.594390,2.4153872744978915,0.0016400673162933878,0.9468381910678005,rbf,TPESampler,COMPLETE
46,0.3349610796599446,2025-04-24 21:10:57.810796,2025-04-24 21:10:58.393358,0 days 00:00:00.582562,0.1642713439926581,0.16666108801048213,0.00017776077619217147,linear,TPESampler,COMPLETE
47,0.25920725296345504,2025-04-24 21:10:58.563726,2025-04-24 21:11:00.263259,0 days 00:00:01.699533,1.737540442195731,0.006592159304752215,0.2903580478754052,linear,TPESampler,COMPLETE
48,0.29149071294986,2025-04-24 21:11:00.438243,2025-04-24 21:11:01.306082,0 days 00:00:00.867839,0.2634281568976857,0.011311928386186812,0.7917002253044683,linear,TPESampler,COMPLETE
49,0.2597624924380102,2025-04-24 21:11:01.477123,2025-04-24 21:11:03.061311,0 days 00:00:01.584188,1.379835124524947,0.004357176059779976,0.3368879291078975,linear,TPESampler,COMPLETE
50,0.2817645284982845,2025-04-24 21:11:03.246809,2025-04-24 21:11:04.087351,0 days 00:00:00.840542,0.3615118312576002,0.002548587413841419,0.10982446857948544,linear,TPESampler,COMPLETE
51,0.2598309396048255,2025-04-24 21:11:04.258414,2025-04-24 21:11:05.927663,0 days 00:00:01.669249,1.379023931118288,0.0043698769086143495,0.5620922618687281,linear,TPESampler,COMPLETE
52,0.2755227871884625,2025-04-24 21:11:06.256667,2025-04-24 21:11:07.290107,0 days 00:00:01.033440,0.510747642116954,0.0036334100560338595,0.7512981584028687,linear,TPESampler,COMPLETE
53,0.26761183600652094,2025-04-24 21:11:07.485140,2025-04-24 21:11:11.048863,0 days 00:00:03.563723,3.9982485517896187,0.0031305418379123802,0.3717812646905507,linear,TPESampler,COMPLETE
54,0.2603504623166474,2025-04-24 21:11:11.232687,2025-04-24 21:11:13.324692,0 days 00:00:02.092005,1.9574184709921425,0.0019174206498024096,0.9566616204789316,linear,TPESampler,COMPLETE
55,0.25959783218739374,2025-04-24 21:11:13.494585,2025-04-24 21:11:15.458549,0 days 00:00:01.963964,1.4681445585955146,0.0011448700377909408,0.2754950913864689,linear,TPESampler,COMPLETE
56,0.2638232139067426,2025-04-24 21:11:15.631918,2025-04-24 21:11:16.986232,0 days 00:00:01.354314,0.8089833553430152,0.0014100295965585004,0.7335290558225288,linear,TPESampler,COMPLETE
57,0.2628300736094756,2025-04-24 21:11:17.537062,2025-04-24 21:11:20.004678,0 days 00:00:02.467616,2.6182564436207065,0.003624005069497831,0.11783729273601659,linear,TPESampler,COMPLETE
58,0.9245198016712587,2025-04-24 21:11:20.183484,2025-04-24 21:11:20.744595,0 days 00:00:00.561111,26.21977840944058,0.0823496665040949,0.0007202837837516172,sigmoid,TPESampler,COMPLETE
59,32.611084017781906,2025-04-24 21:11:20.907645,2025-04-24 21:11:21.467366,0 days 00:00:00.559721,1.5343670364548034,0.0013117223557016506,0.03797651402963847,sigmoid,TPESampler,COMPLETE
60,0.6500469446849606,2025-04-24 21:11:21.639561,2025-04-24 21:11:29.125006,0 days 00:00:07.485445,0.479643924288647,0.0041092676180274216,0.06240598909124287,poly,TPESampler,COMPLETE
61,2.698798215455633,2025-04-24 21:11:29.307555,2025-04-24 22:59:59.408036,0 days 01:48:30.100481,4.97443840391934,0.001337241432938108,0.44869087547704994,poly,TPESampler,COMPLETE
62,0.27263556627051366,2025-04-24 22:59:59.561944,2025-04-24 23:00:06.124306,0 days 00:00:06.562362,9.181704018764178,0.0019655051875142387,0.9295300711734532,linear,TPESampler,COMPLETE
63,0.637234661616619,2025-04-24 23:00:06.286040,2025-04-24 23:00:07.220433,0 days 00:00:00.934393,0.04578572393513224,0.024787242068351464,0.0029739582850948003,rbf,TPESampler,COMPLETE
64,0.25966522690915167,2025-04-24 23:00:07.384093,2025-04-24 23:00:09.094409,0 days 00:00:01.710316,1.4311200592229951,0.0014281202779192195,0.14932346455510975,linear,TPESampler,COMPLETE
65,0.5160738081197431,2025-04-24 23:00:09.248276,2025-04-24 23:00:09.756526,0 days 00:00:00.508250,0.0036592658477482727,0.015903288872504452,0.0008548803452381802,linear,TPESampler,COMPLETE
66,0.2696934102063743,2025-04-24 23:00:09.910359,2025-04-24 23:00:10.797997,0 days 00:00:00.887638,0.6194990469588978,0.0010218880111995386,0.14163486714373907,linear,TPESampler,COMPLETE
67,0.41906131024631255,2025-04-24 23:00:10.956757,2025-04-24 23:00:11.483762,0 days 00:00:00.527005,0.33045927208202314,0.004352279072274273,0.11112657653280268,rbf,TPESampler,COMPLETE
68,0.264623615441262,2025-04-24 23:00:11.635760,2025-04-24 23:00:14.239003,0 days 00:00:02.603243,2.746198331157081,0.0038900272145308574,0.1893214342964367,linear,TPESampler,COMPLETE
69,0.7430292514173694,2025-04-24 23:00:14.426257,2025-04-24 23:00:14.890415,0 days 00:00:00.464158,0.01207317734968383,0.4160694951447365,0.09798491892453388,rbf,TPESampler,COMPLETE
70,0.26034974194246835,2025-04-24 23:00:15.046174,2025-04-24 23:00:17.115193,0 days 00:00:02.069019,2.0163299225757574,0.0031929103501056643,0.6844219266381233,linear,TPESampler,COMPLETE
71,57.44126605370265,2025-04-24 23:00:17.256980,2025-04-24 23:00:17.825134,0 days 00:00:00.568154,1.7788682866485048,0.0033967564794777343,0.6168541964511924,sigmoid,TPESampler,COMPLETE
72,0.27254541194756077,2025-04-24 23:00:18.082541,2025-04-24 23:00:23.246020,0 days 00:00:05.163479,8.295026535302412,0.0012403413119868253,0.09125463110936842,linear,TPESampler,COMPLETE
73,0.32065678542008635,2025-04-24 23:00:23.393971,2025-04-24 23:00:24.493736,0 days 00:00:01.099765,84.64508767580577,0.003855470551142835,0.10694839265600108,rbf,TPESampler,COMPLETE
74,0.2678528900759071,2025-04-24 23:00:24.648723,2025-04-24 23:00:27.860227,0 days 00:00:03.211504,4.029689795620631,0.003908291754591625,0.5169346206293848,linear,TPESampler,COMPLETE
75,0.26132192613315003,2025-04-24 23:00:28.011253,2025-04-24 23:00:30.316320,0 days 00:00:02.305067,2.2086742952100744,0.004443638992125302,0.8864033766215622,linear,TPESampler,COMPLETE
76,0.9039749554953036,2025-04-24 23:00:30.475867,2025-04-24 23:00:30.987575,0 days 00:00:00.511708,0.0015925301095089822,0.2221033102991416,0.00011502240795342832,rbf,TPESampler,COMPLETE
77,0.26778370226194925,2025-04-24 23:00:31.127858,2025-04-24 23:00:34.185769,0 days 00:00:03.057911,3.9403157800122486,0.0011294367751945962,0.5898910023439234,linear,TPESampler,COMPLETE
78,0.3448671519805411,2025-04-24 23:00:34.341915,2025-04-24 23:00:34.917329,0 days 00:00:00.575414,0.12623919161446678,0.0028468646500109996,0.3932103353954713,linear,TPESampler,COMPLETE
79,0.27378106840071503,2025-04-24 23:00:35.064027,2025-04-24 23:00:35.992380,0 days 00:00:00.928353,0.5601434103222716,0.005230696642959029,0.12759529137979841,linear,TPESampler,COMPLETE
80,0.2597653909930743,2025-04-24 23:00:36.170604,2025-04-24 23:00:37.806465,0 days 00:00:01.635861,1.4503492419806001,0.0049363084523711825,0.3830216516076641,linear,TPESampler,COMPLETE
81,1147.4068413098528,2025-04-24 23:00:37.956017,2025-04-24 23:00:38.468612,0 days 00:00:00.512595,35.45272107803612,0.001459827866077297,0.6307601190301791,sigmoid,TPESampler,COMPLETE
82,0.25994923643811985,2025-04-24 23:00:38.616823,2025-04-24 23:00:40.320072,0 days 00:00:01.703249,1.4380070472663165,0.01040169685251735,0.0536798691674452,linear,TPESampler,COMPLETE
83,0.25970777860795646,2025-04-24 23:00:40.470082,2025-04-24 23:00:41.910784,0 days 00:00:01.440702,1.2292166137613856,0.007466830817645444,0.023934324186556742,linear,TPESampler,COMPLETE
84,0.34026173685965216,2025-04-24 23:00:42.064540,2025-04-24 23:00:42.669585,0 days 00:00:00.605045,0.1339620482285271,0.008323256734585411,0.0037622391222464913,linear,TPESampler,COMPLETE
85,0.25786438301380876,2025-04-24 23:00:42.821412,2025-04-24 23:00:45.344713,0 days 00:00:02.523301,3.13855318009839,0.09278373372678997,0.03158962795500991,linear,TPESampler,COMPLETE
86,0.26333022565380726,2025-04-24 23:00:45.503592,2025-04-24 23:00:57.082659,0 days 00:00:11.579067,20.426135201045074,0.14061794142602715,0.012598712829170508,linear,TPESampler,COMPLETE
87,0.25437586201899753,2025-04-24 23:00:57.249845,2025-04-24 23:00:58.926419,0 days 00:00:01.676574,1.8424899997115298,0.10650644295672868,0.05687767632881659,linear,TPESampler,COMPLETE
88,0.2556263197748281,2025-04-24 23:00:59.082744,2025-04-24 23:01:00.298891,0 days 00:00:01.216147,2.2070619091114394,0.17721623528014732,0.01125488819297304,linear,TPESampler,COMPLETE
89,0.3443599605478371,2025-04-24 23:01:00.456076,2025-04-24 23:01:01.512614,0 days 00:00:01.056538,4.540778704232564,0.3419324949104169,0.08301849300899734,linear,TPESampler,COMPLETE
90,0.2539958421363612,2025-04-24 23:01:01.664938,2025-04-24 23:01:02.949919,0 days 00:00:01.284981,1.634812880657299,0.11635221178373904,0.017700821646832985,linear,TPESampler,COMPLETE
91,0.6818387229631826,2025-04-24 23:01:03.131345,2025-04-24 23:06:17.094028,0 days 00:05:13.962683,1.798540077259947,0.13093968220805785,0.10469678524208975,poly,TPESampler,COMPLETE
92,0.2558382536123187,2025-04-24 23:06:17.244747,2025-04-24 23:06:19.228910,0 days 00:00:01.984163,3.0943332632442977,0.12443106433720837,0.030573560711069484,linear,TPESampler,COMPLETE
93,0.2592129251581461,2025-04-24 23:06:19.483875,2025-04-24 23:06:22.195270,0 days 00:00:02.711395,4.132570171892506,0.0674414531275853,0.0013989584268773718,linear,TPESampler,COMPLETE
94,0.2604875940598971,2025-04-24 23:06:22.351620,2025-04-24 23:06:25.231295,0 days 00:00:02.879675,3.395638776809375,0.06633995714141863,0.0001308023006775798,linear,TPESampler,COMPLETE
95,0.264248807870413,2025-04-24 23:06:25.385926,2025-04-24 23:06:27.714250,0 days 00:00:02.328324,2.3754875020967354,0.0369860794752417,0.007957347984660594,linear,TPESampler,COMPLETE
96,0.25761762662509147,2025-04-24 23:06:27.098745,2025-04-24 23:06:28.159994,0 days 00:00:01.061249,1.075592262707548,0.10805009962333605,0.020316918983562023,linear,TPESampler,COMPLETE
97,0.7811044343927794,2025-04-24 23:06:27.863827,2025-04-24 23:06:28.359284,0 days 00:00:00.495457,0.3496142682533452,0.16739409835389593,0.006431321031580261,poly,TPESampler,COMPLETE
98,0.28241222978364017,2025-04-24 23:06:28.328146,2025-04-24 23:06:28.925938,0 days 00:00:00.597792,0.44100840402132246,0.1601496740725356,0.033087390386292145,linear,TPESampler,COMPLETE
99,0.2765520583607595,2025-04-24 23:06:28.507435,2025-04-24 23:06:29.473531,0 days 00:00:00.966096,1.6272907674295258,0.24602603049921468,0.007041137137779152,linear,TPESampler,COMPLETE
100,0.27235206528498285,2025-04-24 23:06:29.077090,2025-04-24 23:06:38.723849,0 days 00:00:09.646759,11.304868032139007,0.03461518188211847,0.0008248047800908915,linear,TPESampler,COMPLETE
101,0.2737731969510182,2025-04-24 23:06:29.681771,2025-04-24 23:06:30.448659,0 days 00:00:00.766888,0.5896063264991661,0.10297890580812387,0.03831105015917447,linear,TPESampler,COMPLETE
102,0.2602948599611157,2025-04-24 23:06:30.600924,2025-04-24 23:06:46.947763,0 days 00:00:16.346839,27.64549624277666,0.07754283757644807,0.04965429852889753,linear,TPESampler,COMPLETE
103,0.25579775782066205,2025-04-24 23:06:38.877278,2025-04-24 23:06:40.135734,0 days 00:00:01.258456,1.4231296519667944,0.0921801929644167,0.027761035430685217,linear,TPESampler,COMPLETE
104,0.2537573564668448,2025-04-24 23:06:40.282648,2025-04-24 23:06:41.862353,0 days 00:00:01.579705,1.854772823852859,0.10186160090375239,0.0570788695597524,linear,TPESampler,COMPLETE
105,0.46465807832587536,2025-04-24 23:06:42.012476,2025-04-24 23:06:42.522209,0 days 00:00:00.509733,0.2090859114680165,0.0861771854143609,0.04049227754416728,rbf,TPESampler,COMPLETE
106,0.787040199742525,2025-04-24 23:06:42.668790,2025-04-24 23:06:43.184647,0 days 00:00:00.515857,0.6981554977805083,0.03232648431096707,0.003004336952073716,sigmoid,TPESampler,COMPLETE
107,0.2582103540460332,2025-04-24 23:06:43.351233,2025-04-24 23:06:45.804320,0 days 00:00:02.453087,3.1176143320546092,0.08731951358741628,0.05808167520240191,linear,TPESampler,COMPLETE
108,0.2570264646908568,2025-04-24 23:06:45.954233,2025-04-24 23:06:49.391271,0 days 00:00:03.437038,5.9436144656505006,0.10785527757214665,0.03189808470639945,linear,TPESampler,COMPLETE
109,0.2625213883220149,2025-04-24 23:06:47.100238,2025-04-24 23:06:48.522449,0 days 00:00:01.422211,1.483820573785021,0.05456490025804304,0.06270476980612973,linear,TPESampler,COMPLETE
110,0.6805449308128658,2025-04-24 23:06:48.685489,2025-04-24 23:06:52.410688,0 days 00:00:03.725199,6.338075810045508,0.03905156270989613,0.02252007609058485,poly,TPESampler,COMPLETE
111,52.73790665322335,2025-04-24 23:06:49.541598,2025-04-24 23:06:50.069633,0 days 00:00:00.528035,3.2566803289389163,0.08836908797103218,0.022549639378659683,sigmoid,TPESampler,COMPLETE
112,0.21985697163271747,2025-04-24 23:06:50.219961,2025-04-24 23:06:50.760670,0 days 00:00:00.540709,12.01059315359173,0.05846745649573945,0.030889250123937548,rbf,TPESampler,COMPLETE
113,0.25809779515218156,2025-04-24 23:06:50.915770,2025-04-24 23:06:52.993837,0 days 00:00:02.078067,4.0265909687998,0.16850993841038422,0.014210731608702846,linear,TPESampler,COMPLETE
114,0.22172810328519757,2025-04-24 23:06:52.564550,2025-04-24 23:06:53.040670,0 days 00:00:00.476120,14.127209693963858,0.11091402254198982,0.011472253987931969,rbf,TPESampler,COMPLETE
115,0.279226831401866,2025-04-24 23:06:53.109636,2025-04-24 23:06:53.794269,0 days 00:00:00.684633,23.95982123656289,0.05976154068805353,0.0026205534340917507,rbf,TPESampler,COMPLETE
116,0.2130802252881007,2025-04-24 23:06:53.174383,2025-04-24 23:06:53.901620,0 days 00:00:00.727237,26.780364214613066,0.04019381113979827,0.037796830387761306,rbf,TPESampler,COMPLETE
