number,value,datetime_start,datetime_complete,duration,params_C,params_epsilon,params_gamma,params_kernel,system_attrs_auto:sampler,state
2231,0.26946673085443884,2025-04-25 11:46:33.262419,2025-04-25 11:46:34.064250,0 days 00:00:00.801831,31.35250079838111,0.012918410041692353,0.07092465489943423,rbf,TPESampler,COMPLETE
2232,0.9027025336340679,2025-04-25 11:46:34.248267,2025-04-25 11:46:34.791130,0 days 00:00:00.542863,0.02463235550448097,0.1182072358885675,0.0003736116260358837,poly,TPESampler,COMPLETE
2233,0.18004792175144899,2025-04-25 11:46:34.981414,2025-04-25 11:46:35.748847,0 days 00:00:00.767433,86.25569685039467,0.039118302130379236,0.021783687445690078,rbf,TPESampler,COMPLETE
2234,0.30699777688675695,2025-04-25 11:46:35.936050,2025-04-25 11:46:36.917704,0 days 00:00:00.981654,79.50780581944815,0.01305550388970405,0.09544055710956668,rbf,TPESampler,COMPLETE
2235,0.17870049919246683,2025-04-25 11:46:37.100901,2025-04-25 11:46:38.142328,0 days 00:00:01.041427,85.1573626113592,0.018409455066193185,0.022719576376524317,rbf,TPESampler,COMPLETE
2236,0.20160068857870295,2025-04-25 11:46:38.327164,2025-04-25 11:46:39.074992,0 days 00:00:00.747828,23.87928664367519,0.01711571536263617,0.026442066778169526,rbf,TPESampler,COMPLETE
2237,0.23734471062631976,2025-04-25 11:46:39.260134,2025-04-25 11:46:39.983753,0 days 00:00:00.723619,72.46959205511423,0.037493363449174644,0.05417087917542191,rbf,TPESampler,COMPLETE
2238,0.25894278387069847,2025-04-25 11:46:40.162807,2025-04-25 11:46:42.340621,0 days 00:00:02.177814,1.828808750911477,0.006050255230627904,0.04029672807884741,linear,TPESampler,COMPLETE
2239,0.8772020622524704,2025-04-25 11:46:42.528520,2025-04-25 11:46:43.084406,0 days 00:00:00.555886,0.001996702984039188,0.001161786590091804,0.005020610033031919,sigmoid,TPESampler,COMPLETE
2240,0.17353865439456082,2025-04-25 11:46:43.265832,2025-04-25 11:46:44.203194,0 days 00:00:00.937362,79.442067239346,0.018464748831962974,0.03023015802073941,rbf,TPESampler,COMPLETE
2241,0.21287505214234456,2025-04-25 11:46:44.387626,2025-04-25 11:46:44.992555,0 days 00:00:00.604929,7.638955182229696,0.02372612359709085,0.02667125385001158,rbf,TPESampler,COMPLETE
2242,0.21222089545861988,2025-04-25 11:46:45.174960,2025-04-25 11:46:45.972019,0 days 00:00:00.797059,19.88748291136986,0.017047960012933343,0.03846939861622611,rbf,TPESampler,COMPLETE
2243,0.38526504631044717,2025-04-25 11:46:46.163390,2025-04-25 11:46:46.722452,0 days 00:00:00.559062,68.64473145287944,0.12729360489632677,0.18248838029313955,rbf,TPESampler,COMPLETE
2244,0.21236621585049362,2025-04-25 11:46:46.924083,2025-04-25 11:46:47.515578,0 days 00:00:00.591495,16.93224226289177,0.06491874402156936,0.009783713192998362,rbf,TPESampler,COMPLETE
2245,0.19051996063311763,2025-04-25 11:46:47.697649,2025-04-25 11:46:48.599361,0 days 00:00:00.901712,92.86599518145803,0.02725735660968761,0.008336034361249446,rbf,TPESampler,COMPLETE
2246,0.1827308170958612,2025-04-25 11:46:48.782410,2025-04-25 11:46:49.467175,0 days 00:00:00.684765,27.629292112956993,0.015367152121489777,0.01126946284951694,rbf,TPESampler,COMPLETE
2247,0.18896279273441377,2025-04-25 11:46:49.656958,2025-04-25 11:46:50.637340,0 days 00:00:00.980382,76.99898360893376,0.01748869796593089,0.038486782016134646,rbf,TPESampler,COMPLETE
2248,0.22559099587635056,2025-04-25 11:46:50.817495,2025-04-25 11:46:51.695458,0 days 00:00:00.877963,84.83439183141003,0.01828098978570236,0.04981245480322314,rbf,TPESampler,COMPLETE
2249,0.2028462299978877,2025-04-25 11:46:51.884979,2025-04-25 11:46:52.658085,0 days 00:00:00.773106,98.57339447997865,0.03378262113387385,0.04143072492659831,rbf,TPESampler,COMPLETE
2250,0.37635777596746084,2025-04-25 11:46:52.849691,2025-04-25 11:46:53.492783,0 days 00:00:00.643092,0.0777625817069708,0.0023482111228092253,0.9908186754263189,linear,TPESampler,COMPLETE
2251,0.23685698745179823,2025-04-25 11:46:53.685407,2025-04-25 11:46:54.307581,0 days 00:00:00.622174,5.883710307673242,0.018533077432276054,0.016843118557351804,rbf,TPESampler,COMPLETE
2252,0.33155768840474537,2025-04-25 11:46:54.498941,2025-04-25 11:46:55.246510,0 days 00:00:00.747569,74.89744879963945,0.025796935171881596,0.12261177101837734,rbf,TPESampler,COMPLETE
2253,0.18581655603856528,2025-04-25 11:46:55.438196,2025-04-25 11:46:56.100126,0 days 00:00:00.661930,27.066941536769214,0.015488792926410965,0.010697760356900626,rbf,TPESampler,COMPLETE
2254,0.4645050730084485,2025-04-25 11:46:56.291648,2025-04-25 11:46:56.911493,0 days 00:00:00.619845,21.63647980611031,0.019557876799264986,0.4283747075137235,rbf,TPESampler,COMPLETE
2255,34.442380324863386,2025-04-25 11:46:57.094870,2025-04-25 11:46:57.679404,0 days 00:00:00.584534,22.00332925427293,0.010626295784711278,0.0034847831142974088,sigmoid,TPESampler,COMPLETE
2256,0.27676922912661417,2025-04-25 11:46:57.867072,2025-04-25 11:47:32.623739,0 days 00:00:34.756667,52.850894519009124,0.016604186914611477,0.0001020442078036986,linear,TPESampler,COMPLETE
2257,0.6222815048485983,2025-04-25 11:47:32.835322,2025-04-25 11:49:51.761248,0 days 00:02:18.925926,34.10404700300506,0.013371243409572794,0.029445851752750822,poly,TPESampler,COMPLETE
2258,0.8014909342158645,2025-04-25 11:49:51.954972,2025-04-25 11:49:52.562425,0 days 00:00:00.607453,0.008057344477892105,0.0015371228921848108,0.018118802445618004,poly,TPESampler,COMPLETE
2259,0.3562119986323541,2025-04-25 11:49:52.741491,2025-04-25 11:49:53.343254,0 days 00:00:00.601763,94.02478277133122,0.03681009607818046,0.15923718538251921,rbf,TPESampler,COMPLETE
2260,0.25067159245395426,2025-04-25 11:49:53.527861,2025-04-25 11:49:54.178315,0 days 00:00:00.650454,5.5972940189445275,0.01032293504931674,0.055039720039547206,rbf,TPESampler,COMPLETE
2261,0.1806072531592293,2025-04-25 11:49:54.374498,2025-04-25 11:49:55.143810,0 days 00:00:00.769312,35.34280995921852,0.010134253448483945,0.01267330557974713,rbf,TPESampler,COMPLETE
2262,0.23581973116811483,2025-04-25 11:49:55.329509,2025-04-25 11:49:56.362596,0 days 00:00:01.033087,86.02255423983381,0.013950805928227658,0.05392619930420173,rbf,TPESampler,COMPLETE
2263,0.21031103367131015,2025-04-25 11:49:56.547091,2025-04-25 11:49:57.464570,0 days 00:00:00.917479,90.87848995147654,0.023635342008180012,0.010191548789487857,rbf,TPESampler,COMPLETE
2264,0.21356229509326796,2025-04-25 11:49:57.645259,2025-04-25 11:49:58.379255,0 days 00:00:00.733996,16.47121740054323,0.010705406609878648,0.03885435539537189,rbf,TPESampler,COMPLETE
2265,0.17199227893886881,2025-04-25 11:49:58.569427,2025-04-25 11:49:59.395298,0 days 00:00:00.825871,96.06420478699299,0.026991047557405265,0.028106101222404728,rbf,TPESampler,COMPLETE
2266,0.34744191912211636,2025-04-25 11:49:59.579147,2025-04-25 11:50:00.558167,0 days 00:00:00.979020,89.37864489054542,0.009276738323252777,0.14097936129219735,rbf,TPESampler,COMPLETE
2267,0.21908384447520712,2025-04-25 11:50:00.743549,2025-04-25 11:50:01.367166,0 days 00:00:00.623617,22.259979308526503,0.014092250635137554,0.006063237043233757,rbf,TPESampler,COMPLETE
2268,1.195871024481562,2025-04-25 11:50:01.552783,2025-04-25 11:50:02.122217,0 days 00:00:00.569434,0.4048771494564234,0.0020380813623273454,0.005409474002742498,sigmoid,TPESampler,COMPLETE
2269,0.5177495310843504,2025-04-25 11:50:02.314852,2025-04-25 11:50:02.881046,0 days 00:00:00.566194,0.003451446384189157,0.031186190995634158,0.004228988839198515,linear,TPESampler,COMPLETE
2270,0.19074685763309748,2025-04-25 11:50:03.068277,2025-04-25 11:50:03.988828,0 days 00:00:00.920551,98.7462998093963,0.02602778940389761,0.01375897325033665,rbf,TPESampler,COMPLETE
2271,0.20669489914378117,2025-04-25 11:50:04.172006,2025-04-25 11:50:04.923114,0 days 00:00:00.751108,20.47219862635113,0.0076560200297674,0.02511852788163365,rbf,TPESampler,COMPLETE
2272,0.1938046345934436,2025-04-25 11:50:05.109031,2025-04-25 11:50:05.828095,0 days 00:00:00.719064,21.338724790406204,0.011763050270103095,0.020818319458197492,rbf,TPESampler,COMPLETE
2273,0.27689063749965664,2025-04-25 11:50:06.014297,2025-04-25 11:50:55.931469,0 days 00:00:49.917172,82.76402607227313,0.012943249367950767,0.04623109417826858,linear,TPESampler,COMPLETE
2274,0.26706041511858736,2025-04-25 11:50:56.115201,2025-04-25 11:50:56.973404,0 days 00:00:00.858203,27.356880211184325,0.00869586113358117,0.07012953084961188,rbf,TPESampler,COMPLETE
2275,0.18874171390703107,2025-04-25 11:50:57.162436,2025-04-25 11:50:58.161235,0 days 00:00:00.998799,86.29286077114314,0.00837351110876263,0.0047184273905500704,rbf,TPESampler,COMPLETE
2276,0.19039702945566866,2025-04-25 11:50:58.498486,2025-04-25 11:50:59.519189,0 days 00:00:01.020703,90.7807400432495,0.011822913906077086,0.015292290896454681,rbf,TPESampler,COMPLETE
2277,0.18964964862895534,2025-04-25 11:50:59.711938,2025-04-25 11:51:00.654878,0 days 00:00:00.942940,84.09750201686705,0.01865716259926336,0.018468292139721138,rbf,TPESampler,COMPLETE
2278,0.3663335904148695,2025-04-25 11:51:00.839960,2025-04-25 11:51:01.612896,0 days 00:00:00.772936,78.3709955176952,0.009195914872558804,0.1745462827851851,rbf,TPESampler,COMPLETE
2279,0.21678320761636927,2025-04-25 11:51:01.792143,2025-04-25 11:51:02.958998,0 days 00:00:01.166855,86.52750918420791,0.008053186911854795,0.047148473096744185,rbf,TPESampler,COMPLETE
2280,220.90760297757336,2025-04-25 11:51:03.145433,2025-04-25 11:51:03.715150,0 days 00:00:00.569717,7.487849064232497,0.4492648196658974,0.4708923751660929,sigmoid,TPESampler,COMPLETE
2281,0.20944968744184628,2025-04-25 11:51:03.896397,2025-04-25 11:51:04.573748,0 days 00:00:00.677351,93.23523701225962,0.05170653557360693,0.04272108823485706,rbf,TPESampler,COMPLETE
2282,0.2357901781868947,2025-04-25 11:51:04.840524,2025-04-25 11:51:05.470476,0 days 00:00:00.629952,11.853617288082232,0.034358967647674904,0.04975622899780693,rbf,TPESampler,COMPLETE
2283,0.21406717887912252,2025-04-25 11:51:05.648548,2025-04-25 11:51:06.823310,0 days 00:00:01.174762,92.73144739506849,0.010359521161828346,0.04597567076449458,rbf,TPESampler,COMPLETE
2284,0.22055660217414466,2025-04-25 11:51:07.276267,2025-04-25 11:51:08.193920,0 days 00:00:00.917653,28.461957186604387,0.08556375594899501,0.02917928360188187,rbf,TPESampler,COMPLETE
2285,0.2902002197398894,2025-04-25 11:51:08.382765,2025-04-25 11:51:08.977421,0 days 00:00:00.594656,4.689831741003048,0.009011689900006108,0.009507008881829466,rbf,TPESampler,COMPLETE
2286,0.2478604802379649,2025-04-25 11:51:09.161577,2025-04-25 11:51:10.298863,0 days 00:00:01.137286,83.68476813903325,0.014697792632158013,0.05929441490783775,rbf,TPESampler,COMPLETE
2287,0.1799823270000777,2025-04-25 11:51:10.485494,2025-04-25 11:51:11.682904,0 days 00:00:01.197410,97.59529505222989,0.00687996554229366,0.02105678100668699,rbf,TPESampler,COMPLETE
2288,54.720487469635735,2025-04-25 11:51:11.864038,2025-04-25 11:51:12.433693,0 days 00:00:00.569655,3.1802331415859553,0.1732712313502045,0.024810673776500623,sigmoid,TPESampler,COMPLETE
2289,0.20953928218880039,2025-04-25 11:51:12.617615,2025-04-25 11:51:13.299708,0 days 00:00:00.682093,24.344654457496727,0.026657470029574137,0.0366652913151548,rbf,TPESampler,COMPLETE
2290,0.2256390150203922,2025-04-25 11:51:13.481496,2025-04-25 11:51:14.870256,0 days 00:00:01.388760,86.15125775667143,0.008247848908299974,0.049971004488363044,rbf,TPESampler,COMPLETE
2291,0.22040228858100394,2025-04-25 11:51:15.049027,2025-04-25 11:51:15.932589,0 days 00:00:00.883562,93.76623901929398,0.026829747080200094,0.048291936869976945,rbf,TPESampler,COMPLETE
2292,0.288568379238206,2025-04-25 11:51:16.185917,2025-04-25 11:51:16.870756,0 days 00:00:00.684839,26.66969673266128,0.009738681372558115,0.002269529786399922,rbf,TPESampler,COMPLETE
2293,0.1852250472617929,2025-04-25 11:51:17.056093,2025-04-25 11:51:18.122695,0 days 00:00:01.066602,98.99908785342201,0.01780607964597278,0.03753118694475377,rbf,TPESampler,COMPLETE
2294,0.18362107646157041,2025-04-25 11:51:18.300291,2025-04-25 11:51:19.008663,0 days 00:00:00.708372,29.597000782393913,0.008486734160617902,0.01042679999669672,rbf,TPESampler,COMPLETE
2295,0.426447038140503,2025-04-25 11:51:19.204126,2025-04-25 11:51:19.816202,0 days 00:00:00.612076,21.409997510675897,0.05838805718344657,0.30223288189631425,rbf,TPESampler,COMPLETE
2296,0.43916528929912274,2025-04-25 11:51:20.018752,2025-04-25 11:51:20.611221,0 days 00:00:00.592469,67.1800584928772,0.0016675581435708728,0.00011588455901532482,rbf,TPESampler,COMPLETE
2297,1.7224581032070208,2025-04-25 11:51:20.801817,2025-04-25 11:51:21.390583,0 days 00:00:00.588766,2.5468474109563317,0.024237794013404285,0.002419142816836161,sigmoid,TPESampler,COMPLETE
2298,0.19728527559697798,2025-04-25 11:51:21.576715,2025-04-25 11:51:22.444020,0 days 00:00:00.867305,30.788308117895664,0.010399879236699185,0.025516433390520607,rbf,TPESampler,COMPLETE
2299,0.2638693818378454,2025-04-25 11:51:22.629440,2025-04-25 11:51:23.836125,0 days 00:00:01.206685,97.04433861924392,0.01019010334893295,0.06644593152330737,rbf,TPESampler,COMPLETE
2300,0.16826917355057489,2025-04-25 11:51:24.021326,2025-04-25 11:51:25.215927,0 days 00:00:01.194601,99.1795384224928,0.013119401251050624,0.025553220174045967,rbf,TPESampler,COMPLETE
2301,0.1782420236055961,2025-04-25 11:51:25.396739,2025-04-25 11:51:26.510993,0 days 00:00:01.114254,87.62751850212365,0.012721030249258027,0.0334392448064832,rbf,TPESampler,COMPLETE
2302,0.17665633483670914,2025-04-25 11:51:26.694827,2025-04-25 11:51:27.650923,0 days 00:00:00.956096,98.74907647715293,0.006984318804508092,0.006611292871198999,rbf,TPESampler,COMPLETE
2303,0.30045843527753946,2025-04-25 11:51:27.836522,2025-04-25 11:51:28.675115,0 days 00:00:00.838593,20.239956085664502,0.007910093919909498,0.09154313623360878,rbf,TPESampler,COMPLETE
2304,0.1772905681645579,2025-04-25 11:51:28.857029,2025-04-25 11:51:30.195266,0 days 00:00:01.338237,95.14346416623368,0.005798152678719927,0.033522579479921634,rbf,TPESampler,COMPLETE
2305,0.6224544429089085,2025-04-25 11:51:30.398729,2025-04-25 12:01:11.635670,0 days 00:09:41.236941,93.3121507543004,0.00821963548543076,0.02408675725019412,poly,TPESampler,COMPLETE
2306,0.1961122313063119,2025-04-25 12:01:11.845636,2025-04-25 12:01:12.827384,0 days 00:00:00.981748,89.87065481803934,0.005305623695359663,0.00880595425030627,rbf,TPESampler,COMPLETE
2307,0.2184176041778642,2025-04-25 12:01:13.030036,2025-04-25 12:01:13.713000,0 days 00:00:00.682964,20.00765242331869,0.007703319035102709,0.0066195909535362845,rbf,TPESampler,COMPLETE
2308,0.17579308764635448,2025-04-25 12:01:13.913458,2025-04-25 12:01:15.210769,0 days 00:00:01.297311,99.77495292172951,0.014667230251127115,0.021634706741377976,rbf,TPESampler,COMPLETE
2309,0.197150341252515,2025-04-25 12:01:15.540324,2025-04-25 12:01:16.341486,0 days 00:00:00.801162,86.80216029381616,0.01029765515223058,0.004053191766908054,rbf,TPESampler,COMPLETE
2310,0.8750814491403555,2025-04-25 12:01:16.530675,2025-04-25 12:01:17.112053,0 days 00:00:00.581378,0.0011035737969118408,0.22655639668089628,0.188886268614635,sigmoid,TPESampler,COMPLETE
2311,0.20712766729361087,2025-04-25 12:01:17.299851,2025-04-25 12:01:17.973051,0 days 00:00:00.673200,16.067147047429827,0.006068331418409679,0.010776362005137154,rbf,TPESampler,COMPLETE
2312,0.19239311896456293,2025-04-25 12:01:18.166436,2025-04-25 12:01:19.249835,0 days 00:00:01.083399,77.5998485960275,0.007740265652988161,0.01609853228397302,rbf,TPESampler,COMPLETE
2313,0.8675004349740609,2025-04-25 12:01:19.449043,2025-04-25 12:01:20.057611,0 days 00:00:00.608568,0.0050427670442009685,0.006193774693495753,0.002466836285522342,sigmoid,TPESampler,COMPLETE
2314,0.2756472460685702,2025-04-25 12:01:20.254140,2025-04-25 12:01:33.426073,0 days 00:00:13.171933,19.609747714349176,0.004955273455019799,0.04856484328575604,linear,TPESampler,COMPLETE
2315,0.2433509786551715,2025-04-25 12:01:33.607874,2025-04-25 12:01:34.285905,0 days 00:00:00.678031,5.7925656874563405,0.004599242437683255,0.04861545597293357,rbf,TPESampler,COMPLETE
2316,0.2547604836446829,2025-04-25 12:01:34.469409,2025-04-25 12:01:35.916640,0 days 00:00:01.447231,99.80123298913644,0.005681069267482247,0.061798130409446615,rbf,TPESampler,COMPLETE
2317,0.20340472069549476,2025-04-25 12:01:36.105792,2025-04-25 12:01:36.867541,0 days 00:00:00.761749,20.714263848460856,0.007952236638301068,0.02364850006594661,rbf,TPESampler,COMPLETE
2318,611.9172496225423,2025-04-25 12:01:37.047076,2025-04-25 12:01:37.634421,0 days 00:00:00.587345,31.638804698786874,0.014690947283181174,0.030978615598648337,sigmoid,TPESampler,COMPLETE
2319,0.30491083779367095,2025-04-25 12:01:37.819435,2025-04-25 12:01:38.609194,0 days 00:00:00.789759,18.597570810549175,0.008627601715984295,0.09542745761567531,rbf,TPESampler,COMPLETE
2320,0.7560171064492271,2025-04-25 12:01:38.792225,2025-04-25 12:01:39.376886,0 days 00:00:00.584661,0.0058137913132085516,0.006251445443683103,0.03947862551960422,rbf,TPESampler,COMPLETE
2321,0.18623472234212057,2025-04-25 12:01:39.554072,2025-04-25 12:01:40.215877,0 days 00:00:00.661805,15.784603080795911,0.012699302355542154,0.017918143913424354,rbf,TPESampler,COMPLETE
2322,0.2572401314677033,2025-04-25 12:01:40.398568,2025-04-25 12:01:41.094400,0 days 00:00:00.695832,4.934420267615153,0.0018337175957418121,0.05771511430142853,rbf,TPESampler,COMPLETE
2323,0.21721185543765753,2025-04-25 12:01:41.282214,2025-04-25 12:01:42.014306,0 days 00:00:00.732092,12.948049713900168,0.008123907693960455,0.03721678458651868,rbf,TPESampler,COMPLETE
2324,0.3748197631327677,2025-04-25 12:01:42.198167,2025-04-25 12:01:42.932637,0 days 00:00:00.734470,35.30181342304669,0.0069263733863403005,0.19238316075389478,rbf,TPESampler,COMPLETE
2325,0.24782669586911038,2025-04-25 12:01:43.117398,2025-04-25 12:01:44.188634,0 days 00:00:01.071236,97.88036540123116,0.01322818284861736,0.059091205690149425,rbf,TPESampler,COMPLETE
2326,0.2777299622020078,2025-04-25 12:01:44.372305,2025-04-25 12:01:45.371588,0 days 00:00:00.999283,23.22786417310222,0.002344986243053606,0.07648827125979714,rbf,TPESampler,COMPLETE
2327,0.20841933387000947,2025-04-25 12:01:45.567747,2025-04-25 12:01:46.634813,0 days 00:00:01.067066,93.3118489479142,0.015577414994610222,0.010065033713115042,rbf,TPESampler,COMPLETE
2328,0.4031986031787593,2025-04-25 12:01:46.816633,2025-04-25 12:01:47.430009,0 days 00:00:00.613376,5.855247608501314,0.01255194137594473,0.2610632738554271,rbf,TPESampler,COMPLETE
2329,0.24433796430310925,2025-04-25 12:01:47.612034,2025-04-25 12:01:48.224735,0 days 00:00:00.612701,4.036733342819011,0.011088070746779073,0.02627335784176129,rbf,TPESampler,COMPLETE
2330,0.21905155797328887,2025-04-25 12:01:48.407911,2025-04-25 12:01:49.196489,0 days 00:00:00.788578,17.60637801673289,0.006060408867413297,0.043102367709938125,rbf,TPESampler,COMPLETE
2331,0.18838637380679546,2025-04-25 12:01:49.381687,2025-04-25 12:01:50.115169,0 days 00:00:00.733482,24.485804342396246,0.002306481322019043,0.010828941535313857,rbf,TPESampler,COMPLETE
2332,0.2774640758779882,2025-04-25 12:01:50.299581,2025-04-25 12:02:33.697525,0 days 00:00:43.397944,69.47049149877233,0.02248315826592048,0.007069464743599559,linear,TPESampler,COMPLETE
2333,0.2586942615226873,2025-04-25 12:02:33.888716,2025-04-25 12:02:35.140536,0 days 00:00:01.251820,98.68952589478015,0.007138259402929091,0.06390619047889462,rbf,TPESampler,COMPLETE
2334,0.2718707510316615,2025-04-25 12:02:35.326079,2025-04-25 12:02:36.762871,0 days 00:00:01.436792,99.51645602836139,0.003200141002762697,0.06934989859591784,rbf,TPESampler,COMPLETE
2335,0.2090313831980854,2025-04-25 12:02:36.944866,2025-04-25 12:02:38.361326,0 days 00:00:01.416460,93.83053496346034,0.005011914189104306,0.04468595791319885,rbf,TPESampler,COMPLETE
2336,0.1695580890627282,2025-04-25 12:02:38.546331,2025-04-25 12:02:39.713374,0 days 00:00:01.167043,88.97466588232308,0.01520073161848496,0.027651033841383576,rbf,TPESampler,COMPLETE
2337,0.3287490026470005,2025-04-25 12:02:39.925525,2025-04-25 12:02:40.690513,0 days 00:00:00.764988,28.736242579281505,0.02025269942539021,0.12008533917739471,rbf,TPESampler,COMPLETE
2338,0.2302782355785075,2025-04-25 12:02:40.880847,2025-04-25 12:02:41.513778,0 days 00:00:00.632931,5.345758352420448,0.01746770700930197,0.03147071639268748,rbf,TPESampler,COMPLETE
2339,0.19203682684263565,2025-04-25 12:02:41.723624,2025-04-25 12:02:42.615923,0 days 00:00:00.892299,61.03677735050466,0.021356679758591655,0.018103289607989632,rbf,TPESampler,COMPLETE
2340,0.17945962296185053,2025-04-25 12:02:42.805834,2025-04-25 12:02:43.891142,0 days 00:00:01.085308,97.34932688682238,0.02875763671203702,0.019540234189062738,rbf,TPESampler,COMPLETE
2341,0.18781526191079037,2025-04-25 12:02:44.439828,2025-04-25 12:02:45.902596,0 days 00:00:01.462768,88.88691184812205,0.016559402687786752,0.016832500613040702,rbf,TPESampler,COMPLETE
2342,0.27592994268806154,2025-04-25 12:02:46.191190,2025-04-25 12:02:58.960753,0 days 00:00:12.769563,18.01127283721683,0.017322896620483905,0.02907116527522131,linear,TPESampler,COMPLETE
2343,0.1805802903752735,2025-04-25 12:02:59.223218,2025-04-25 12:03:00.277932,0 days 00:00:01.054714,24.449306575648123,0.012333155274698101,0.013767622420819617,rbf,TPESampler,COMPLETE
2344,0.3456350467798337,2025-04-25 12:03:00.497542,2025-04-25 12:03:01.158339,0 days 00:00:00.660797,5.551929753037599,0.02683115222988404,0.0037049113360678727,rbf,TPESampler,COMPLETE
2345,0.35278353404917,2025-04-25 12:03:01.366392,2025-04-25 12:03:02.039804,0 days 00:00:00.673412,13.547943674562898,0.022818721404837386,0.1560174454253105,rbf,TPESampler,COMPLETE
2346,0.19623852640513226,2025-04-25 12:03:02.234048,2025-04-25 12:03:02.934434,0 days 00:00:00.700386,34.94243344916287,0.016653228885013558,0.007237618057799764,rbf,TPESampler,COMPLETE
2347,0.4782026568527781,2025-04-25 12:03:03.138390,2025-04-25 12:03:03.757282,0 days 00:00:00.618892,0.1617614503636516,0.0019558869521900013,0.04652283899025665,rbf,TPESampler,COMPLETE
