number,value,datetime_start,datetime_complete,duration,params_C,params_epsilon,params_gamma,params_kernel,system_attrs_auto:sampler,state
707,1096.6066343659272,2025-04-25 00:10:13.536838,2025-04-25 00:10:14.120897,0 days 00:00:00.584059,70.09966759202646,0.010916401543631077,0.02137907828045667,sigmoid,TPESampler,COMPLETE
708,0.19253166924702309,2025-04-25 00:10:14.296915,2025-04-25 00:10:15.505994,0 days 00:00:01.209079,84.13432046288983,0.0036069898539353314,0.01585166840112876,rbf,TPESampler,COMPLETE
709,0.19487132596113332,2025-04-25 00:10:15.670475,2025-04-25 00:10:16.848449,0 days 00:00:01.177974,92.05833489326191,0.0024244145779978377,0.014486750472171047,rbf,TPESampler,COMPLETE
710,0.6838744665478195,2025-04-25 00:10:17.018643,2025-04-25 00:10:18.076099,0 days 00:00:01.057456,77.02162799894873,0.0015629842405789469,0.006152446784449665,poly,TPESampler,COMPLETE
711,2.0320096885046794,2025-04-25 00:10:18.253845,2025-04-25 00:10:18.800419,0 days 00:00:00.546574,37.83249428041674,0.2872269207467812,0.000838491555966885,sigmoid,TPESampler,COMPLETE
712,0.2313040601059244,2025-04-25 00:10:18.966127,2025-04-25 00:10:20.186781,0 days 00:00:01.220654,90.03168716562647,0.012096517574225496,0.05183224600973291,rbf,TPESampler,COMPLETE
713,0.21303208844815633,2025-04-25 00:10:20.363639,2025-04-25 00:10:21.035219,0 days 00:00:00.671580,17.703558220591695,0.005260354764444367,0.008831668028718648,rbf,TPESampler,COMPLETE
714,0.1697352022522148,2025-04-25 00:10:21.203574,2025-04-25 00:10:22.413549,0 days 00:00:01.209975,91.06885848196833,0.00790026574697884,0.028034193507987745,rbf,TPESampler,COMPLETE
715,0.27579542179214334,2025-04-25 00:10:22.584855,2025-04-25 00:10:33.456178,0 days 00:00:10.871323,16.821341036392194,0.005194699986221314,0.04808996229170434,linear,TPESampler,COMPLETE
716,0.2407348355413583,2025-04-25 00:10:33.625273,2025-04-25 00:10:34.778976,0 days 00:00:01.153703,69.83720157770922,0.0084237165893227,0.055611275653310616,rbf,TPESampler,COMPLETE
717,0.19441394284678565,2025-04-25 00:10:34.957247,2025-04-25 00:10:35.670736,0 days 00:00:00.713489,15.468029050555145,0.007179694277982333,0.01502354422110776,rbf,TPESampler,COMPLETE
718,0.1813223355666204,2025-04-25 00:10:35.844090,2025-04-25 00:10:37.037618,0 days 00:00:01.193528,91.55984329117402,0.011244994523997649,0.03486592751323152,rbf,TPESampler,COMPLETE
719,0.2734140597631803,2025-04-25 00:10:37.221979,2025-04-25 00:10:38.644530,0 days 00:00:01.422551,79.49560989542825,0.004120868157282965,0.07130726116829829,rbf,TPESampler,COMPLETE
720,0.19092788734799207,2025-04-25 00:10:38.816252,2025-04-25 00:10:39.985806,0 days 00:00:01.169554,79.10527994535326,0.008163123718540614,0.0389405090956598,rbf,TPESampler,COMPLETE
721,0.3176295543414551,2025-04-25 00:10:40.160239,2025-04-25 00:10:40.778617,0 days 00:00:00.618378,1.0071142036635776,0.006051733690858919,0.04212153584984813,rbf,TPESampler,COMPLETE
722,0.2759842804451328,2025-04-25 00:10:40.973870,2025-04-25 00:11:28.498991,0 days 00:00:47.525121,82.93000158748688,0.0013309379272337443,0.0670738453297446,linear,TPESampler,COMPLETE
723,0.49218663953052527,2025-04-25 00:11:28.673478,2025-04-25 00:11:29.272012,0 days 00:00:00.598534,9.959547788425546,0.015758669472983766,0.5094121741148853,rbf,TPESampler,COMPLETE
724,0.202837690713241,2025-04-25 00:11:29.441144,2025-04-25 00:11:30.135453,0 days 00:00:00.694309,9.921900493766776,0.005169004327752272,0.02761092239431948,rbf,TPESampler,COMPLETE
725,0.49079950215600776,2025-04-25 00:11:30.325926,2025-04-25 00:11:31.041350,0 days 00:00:00.715424,0.006689061226619198,0.02896767634309594,0.19296872571379217,linear,TPESampler,COMPLETE
726,0.20568533824659307,2025-04-25 00:11:31.209285,2025-04-25 00:11:32.310537,0 days 00:00:01.101252,82.41398288249333,0.005678126364663635,0.011553717693460974,rbf,TPESampler,COMPLETE
727,0.20698467465817175,2025-04-25 00:11:32.480901,2025-04-25 00:11:33.580087,0 days 00:00:01.099186,69.00093905281025,0.00215211244437791,0.012236109629938442,rbf,TPESampler,COMPLETE
728,400.5337830694993,2025-04-25 00:11:33.757176,2025-04-25 00:11:34.343352,0 days 00:00:00.586176,97.84481609568061,0.0013652560934585701,0.006095871666422016,sigmoid,TPESampler,COMPLETE
729,0.3444457008156232,2025-04-25 00:11:34.518123,2025-04-25 00:11:35.358413,0 days 00:00:00.840290,12.182969507764605,0.0017589888925732206,0.1395319103849809,rbf,TPESampler,COMPLETE
730,0.16998064271500085,2025-04-25 00:11:35.531677,2025-04-25 00:11:36.991983,0 days 00:00:01.460306,97.97353654107532,0.004244549967710355,0.02618646563884129,rbf,TPESampler,COMPLETE
731,0.24407888332761515,2025-04-25 00:11:37.168971,2025-04-25 00:11:38.015718,0 days 00:00:00.846747,15.313654926785475,0.0025923630909778336,0.05780503667688361,rbf,TPESampler,COMPLETE
732,0.2769900199516433,2025-04-25 00:11:38.188489,2025-04-25 00:12:35.397340,0 days 00:00:57.208851,81.82823797463739,0.005828066803782743,0.0373903026085629,linear,TPESampler,COMPLETE
733,0.18856041598646744,2025-04-25 00:12:35.567251,2025-04-25 00:12:36.922347,0 days 00:00:01.355096,93.1371132386077,0.003443827550689672,0.016769217152102136,rbf,TPESampler,COMPLETE
734,0.17692298258853179,2025-04-25 00:12:37.088031,2025-04-25 00:12:38.334483,0 days 00:00:01.246452,80.92048461992624,0.005492710857821979,0.03261377978691378,rbf,TPESampler,COMPLETE
735,0.27357135161277696,2025-04-25 00:12:38.501567,2025-04-25 00:12:40.051852,0 days 00:00:01.550285,87.64406273289916,0.0017668524878042572,0.07042293580748978,rbf,TPESampler,COMPLETE
736,0.6727601730267796,2025-04-25 00:12:40.219131,2025-04-25 00:12:40.812081,0 days 00:00:00.592950,0.3969833675393436,0.026325325430822458,0.01811987446054155,poly,TPESampler,COMPLETE
737,0.27671300516121966,2025-04-25 00:12:40.977435,2025-04-25 00:13:47.122534,0 days 00:01:06.145099,96.56976077367368,0.004597850304157911,0.00563318909608167,linear,TPESampler,COMPLETE
738,0.19761286353224972,2025-04-25 00:13:47.289885,2025-04-25 00:13:47.997935,0 days 00:00:00.708050,14.947744047692185,0.005973737188486457,0.02525448907547747,rbf,TPESampler,COMPLETE
739,0.32152944098609343,2025-04-25 00:13:48.161810,2025-04-25 00:13:49.254455,0 days 00:00:01.092645,82.77300877800856,0.006359179322617316,0.10846173131304172,rbf,TPESampler,COMPLETE
740,359.20931683446713,2025-04-25 00:13:49.416252,2025-04-25 00:13:49.958574,0 days 00:00:00.542322,14.936153548301158,0.0011653228093638543,0.07193470110663723,sigmoid,TPESampler,COMPLETE
741,0.8965240392295674,2025-04-25 00:13:50.116131,2025-04-25 00:13:50.601117,0 days 00:00:00.484986,0.0017766328336203021,0.7238227697095044,0.0004536978633501149,rbf,TPESampler,COMPLETE
742,1709.5419182961944,2025-04-25 00:13:50.759363,2025-04-25 00:13:51.309919,0 days 00:00:00.550556,98.03167187363397,0.0038780602361484016,0.02548019208877767,sigmoid,TPESampler,COMPLETE
743,0.3168842454259649,2025-04-25 00:13:51.469734,2025-04-25 00:13:53.017744,0 days 00:00:01.548010,98.77700102189353,0.0020129231774441664,0.10213392055778453,rbf,TPESampler,COMPLETE
744,0.2634457835900575,2025-04-25 00:13:53.192587,2025-04-25 00:13:53.903159,0 days 00:00:00.710572,80.28138128876175,0.03603503626887907,0.0662724875192007,rbf,TPESampler,COMPLETE
745,0.19512407913967084,2025-04-25 00:13:54.071351,2025-04-25 00:13:55.202638,0 days 00:00:01.131287,90.77331044245544,0.002634497377572043,0.014513895954430074,rbf,TPESampler,COMPLETE
746,0.18314550007062158,2025-04-25 00:13:55.368080,2025-04-25 00:13:56.067284,0 days 00:00:00.699204,18.769070306604092,0.006204397497044093,0.016773338593085295,rbf,TPESampler,COMPLETE
747,0.18987673363891272,2025-04-25 00:13:56.232203,2025-04-25 00:13:57.233125,0 days 00:00:01.000922,94.28192778746295,0.012043430964884855,0.015107424795581388,rbf,TPESampler,COMPLETE
748,0.765824097708643,2025-04-25 00:13:57.398494,2025-04-25 00:31:19.042205,0 days 00:17:21.643711,88.45784613294431,0.0022492762809040974,0.03601377226733069,poly,TPESampler,COMPLETE
749,116.3803012198467,2025-04-25 00:15:00.138457,2025-04-25 00:15:00.688666,0 days 00:00:00.550209,14.225764249563925,0.003660567629123504,0.01036092910967842,sigmoid,TPESampler,COMPLETE
750,0.16818734887088865,2025-04-25 00:15:00.856597,2025-04-25 00:15:02.083334,0 days 00:00:01.226737,98.60468272650678,0.008404996011102244,0.02668979734081027,rbf,TPESampler,COMPLETE
751,0.22469692468739005,2025-04-25 00:15:02.246757,2025-04-25 00:15:03.231601,0 days 00:00:00.984844,65.41137184319223,0.013312871144384293,0.050411976989321344,rbf,TPESampler,COMPLETE
752,0.18019008445431656,2025-04-25 00:15:03.395149,2025-04-25 00:15:04.737928,0 days 00:00:01.342779,97.07466677751499,0.008139251080641188,0.021060738600408933,rbf,TPESampler,COMPLETE
753,0.25995487887312474,2025-04-25 00:15:04.897313,2025-04-25 00:15:05.559375,0 days 00:00:00.662062,9.912310073980384,0.011256263525302155,0.06662114001989297,rbf,TPESampler,COMPLETE
754,0.21615095154203862,2025-04-25 00:15:05.719275,2025-04-25 00:15:07.143256,0 days 00:00:01.423981,99.15812085398973,0.003465496954609346,0.04679236495821398,rbf,TPESampler,COMPLETE
755,0.17339967973502082,2025-04-25 00:15:07.303113,2025-04-25 00:15:08.445113,0 days 00:00:01.142000,79.97683483645227,0.006109557342081642,0.030730401158387974,rbf,TPESampler,COMPLETE
756,0.8546445180345584,2025-04-25 00:15:08.610626,2025-04-25 00:15:09.095259,0 days 00:00:00.484633,0.04286176326536203,0.657718258023518,0.6740408668692791,rbf,TPESampler,COMPLETE
757,0.27582241403466673,2025-04-25 00:15:09.263697,2025-04-25 00:15:10.080254,0 days 00:00:00.816557,18.851943206985524,0.004080754087087739,0.07600336900815671,rbf,TPESampler,COMPLETE
758,0.19625451283409948,2025-04-25 00:15:10.242876,2025-04-25 00:15:11.881147,0 days 00:00:01.638271,94.76059405961625,0.001935661499280876,0.0413292475490694,rbf,TPESampler,COMPLETE
759,0.27657169434429596,2025-04-25 00:15:12.045577,2025-04-25 00:16:25.403353,0 days 00:01:13.357776,75.12477256682028,0.014309705387265358,0.15572599717561683,linear,TPESampler,COMPLETE
760,0.27092001840645297,2025-04-25 00:16:25.589684,2025-04-25 00:16:26.274245,0 days 00:00:00.684561,6.592782389391333,0.01578509768104105,0.07355985392433509,rbf,TPESampler,COMPLETE
761,0.2294351676912312,2025-04-25 00:16:26.438026,2025-04-25 00:16:27.747721,0 days 00:00:01.309695,82.81197193381414,0.006312930809725857,0.05134010665929989,rbf,TPESampler,COMPLETE
762,0.17383765051412567,2025-04-25 00:16:27.905323,2025-04-25 00:16:29.151870,0 days 00:00:01.246547,98.6415355062083,0.010483760639311356,0.022806823914170615,rbf,TPESampler,COMPLETE
763,0.306256417290082,2025-04-25 00:16:29.308530,2025-04-25 00:16:30.098181,0 days 00:00:00.789651,19.04415993404882,0.004848387049539983,0.09651520266171466,rbf,TPESampler,COMPLETE
764,0.8753321037040674,2025-04-25 00:16:30.466193,2025-04-25 00:16:30.976325,0 days 00:00:00.510132,0.0013651195762262494,0.05318905757402913,0.012438700499601624,poly,TPESampler,COMPLETE
765,0.2684378181100857,2025-04-25 00:16:31.136676,2025-04-25 00:16:31.823290,0 days 00:00:00.686614,20.667761416648855,0.01686198471010437,0.07109558824253993,rbf,TPESampler,COMPLETE
766,0.765505194185163,2025-04-25 00:16:31.989699,2025-04-25 00:21:22.333762,0 days 00:04:50.344063,7.337688579217832,0.026119151094146857,0.08945977690493105,poly,TPESampler,COMPLETE
767,0.18639049224802887,2025-04-25 00:21:22.491615,2025-04-25 00:21:23.959152,0 days 00:00:01.467537,90.18628047346385,0.0036284643508835792,0.03799366595105176,rbf,TPESampler,COMPLETE
768,0.19809801992056802,2025-04-25 00:21:24.127631,2025-04-25 00:21:24.788219,0 days 00:00:00.660588,13.636848844816322,0.007530945627873476,0.015849048327726222,rbf,TPESampler,COMPLETE
769,0.20517610168807612,2025-04-25 00:21:24.966192,2025-04-25 00:21:25.621550,0 days 00:00:00.655358,11.436986555770183,0.0021092220613829903,0.01653952377623223,rbf,TPESampler,COMPLETE
770,0.21666851790304423,2025-04-25 00:21:25.897343,2025-04-25 00:21:26.862009,0 days 00:00:00.964666,33.811663422047424,0.01735445279377607,0.04681833653130034,rbf,TPESampler,COMPLETE
771,0.20091318676226802,2025-04-25 00:21:27.044132,2025-04-25 00:21:28.162058,0 days 00:00:01.117926,95.61130867419118,0.004325868866037541,0.008996549826027645,rbf,TPESampler,COMPLETE
772,0.36997921463377514,2025-04-25 00:21:28.338249,2025-04-25 00:21:29.127171,0 days 00:00:00.788922,70.03688281666007,0.007026101640601877,0.18149572336188313,rbf,TPESampler,COMPLETE
773,0.17630592380524973,2025-04-25 00:21:29.293186,2025-04-25 00:21:30.305284,0 days 00:00:01.012098,74.60085933550684,0.016536300208629822,0.027390447731155614,rbf,TPESampler,COMPLETE
774,0.27099393360761215,2025-04-25 00:21:30.472851,2025-04-25 00:21:31.507343,0 days 00:00:01.034492,80.10839005907197,0.019755128739311602,0.07038724981988274,rbf,TPESampler,COMPLETE
775,0.17438096658927954,2025-04-25 00:21:31.672194,2025-04-25 00:21:32.826725,0 days 00:00:01.154531,78.21310639742977,0.006223364280496952,0.03118877362417686,rbf,TPESampler,COMPLETE
776,0.6033926145255492,2025-04-25 00:21:32.988589,2025-04-25 00:22:53.957774,0 days 00:01:20.969185,1.0399025836219677,0.0014054370815808838,0.06945624236782798,poly,TPESampler,COMPLETE
777,0.1900100139482752,2025-04-25 00:22:54.187394,2025-04-25 00:22:54.925265,0 days 00:00:00.737871,13.490061877941956,0.011079707928268102,0.020682273213536204,rbf,TPESampler,COMPLETE
778,0.23412111122931917,2025-04-25 00:22:55.121251,2025-04-25 00:22:56.382484,0 days 00:00:01.261233,77.95312311360445,0.008852259553983867,0.05295407795855044,rbf,TPESampler,COMPLETE
779,0.18092732676294715,2025-04-25 00:22:56.561968,2025-04-25 00:22:57.903801,0 days 00:00:01.341833,79.74689269181643,0.008972326406174503,0.023781368490734082,rbf,TPESampler,COMPLETE
780,0.17897985100384411,2025-04-25 00:22:58.076523,2025-04-25 00:22:59.334037,0 days 00:00:01.257514,85.0120341514035,0.007890577944851488,0.023512547489235383,rbf,TPESampler,COMPLETE
781,0.21877797729725285,2025-04-25 00:22:59.500883,2025-04-25 00:23:00.107023,0 days 00:00:00.606140,7.118038162629992,0.01653504677989086,0.023541786038812892,rbf,TPESampler,COMPLETE
782,0.7734833352084042,2025-04-25 00:23:00.274028,2025-04-25 00:43:58.275448,0 days 00:20:58.001420,51.788659953899696,0.02345756640989495,0.040086053432106354,poly,TPESampler,COMPLETE
783,0.24792286550264306,2025-04-25 00:31:19.207284,2025-04-25 00:31:20.058223,0 days 00:00:00.850939,26.04272320713088,0.005272768244960298,0.060219391922102045,rbf,TPESampler,COMPLETE
784,0.19147138746139103,2025-04-25 00:31:20.221348,2025-04-25 00:31:20.965238,0 days 00:00:00.743890,26.508365537351057,0.008070472553280424,0.01873313193175494,rbf,TPESampler,COMPLETE
785,0.26696004090936615,2025-04-25 00:31:21.122782,2025-04-25 00:31:22.230975,0 days 00:00:01.108193,71.87424234264978,0.010663658727697816,0.06857648847737549,rbf,TPESampler,COMPLETE
786,0.22743600263981764,2025-04-25 00:31:22.396048,2025-04-25 00:31:23.109610,0 days 00:00:00.713562,11.896179508351866,0.00478124842885371,0.04685872296934352,rbf,TPESampler,COMPLETE
787,0.18703858386342243,2025-04-25 00:31:23.273340,2025-04-25 00:31:24.487294,0 days 00:00:01.213954,82.7845233814075,0.009110400834434746,0.020651230062317453,rbf,TPESampler,COMPLETE
788,0.20024105039883097,2025-04-25 00:31:24.649115,2025-04-25 00:31:25.771560,0 days 00:00:01.122445,99.88231879332493,0.01169707299113772,0.041596389671876434,rbf,TPESampler,COMPLETE
789,0.24718323017824398,2025-04-25 00:31:25.931826,2025-04-25 00:31:26.581442,0 days 00:00:00.649616,91.49558740059273,0.06432375636757587,0.05888719698865534,rbf,TPESampler,COMPLETE
790,0.22924986010994788,2025-04-25 00:31:26.948346,2025-04-25 00:31:27.978591,0 days 00:00:01.030245,12.79547961415975,0.009492730478509166,0.04833504543923087,rbf,TPESampler,COMPLETE
791,0.19220072726342444,2025-04-25 00:31:28.188983,2025-04-25 00:31:29.336270,0 days 00:00:01.147287,95.00322832358141,0.012536118183033273,0.03936071022659338,rbf,TPESampler,COMPLETE
792,0.19472855521512294,2025-04-25 00:31:29.502290,2025-04-25 00:31:30.589668,0 days 00:00:01.087378,98.77459739114884,0.004236082544282756,0.013880117270088052,rbf,TPESampler,COMPLETE
793,0.19015888483873183,2025-04-25 00:31:30.751269,2025-04-25 00:31:32.303312,0 days 00:00:01.552043,94.6157963997163,0.003367081158720604,0.039503401342524225,rbf,TPESampler,COMPLETE
794,0.2827957341818459,2025-04-25 00:31:32.470561,2025-04-25 00:31:33.361329,0 days 00:00:00.890768,1.8103020152045832,0.2561176348944208,0.43466093734729777,linear,TPESampler,COMPLETE
795,0.8275494816104645,2025-04-25 00:31:33.523641,2025-04-25 00:31:34.066185,0 days 00:00:00.542544,0.004170657044275169,0.09359026264495317,0.011503278329115546,sigmoid,TPESampler,COMPLETE
796,0.1922841241734322,2025-04-25 00:31:34.224572,2025-04-25 00:31:34.889558,0 days 00:00:00.664986,14.671277959042985,0.006868164577557778,0.02350772968826458,rbf,TPESampler,COMPLETE
797,0.19456646729422644,2025-04-25 00:31:35.058324,2025-04-25 00:31:36.097566,0 days 00:00:01.039242,91.32194307512292,0.007531564187328467,0.014154727365070308,rbf,TPESampler,COMPLETE
798,0.18824190219657042,2025-04-25 00:31:36.262602,2025-04-25 00:31:37.021112,0 days 00:00:00.758510,65.14265328941147,0.02532299584228007,0.036831581515974064,rbf,TPESampler,COMPLETE
799,0.9548423818935516,2025-04-25 00:31:37.189199,2025-04-25 00:32:09.861245,0 days 00:00:32.672046,6.330733791236303,0.9173620241354649,0.19877359287692756,poly,TPESampler,COMPLETE
800,0.1875772917789396,2025-04-25 00:32:10.035570,2025-04-25 00:32:10.745511,0 days 00:00:00.709941,22.4036520259144,0.0036221832465656457,0.011868992922784476,rbf,TPESampler,COMPLETE
801,0.24388556704438968,2025-04-25 00:32:11.002811,2025-04-25 00:32:11.596896,0 days 00:00:00.594085,9.372058335198856,0.03160560460440116,0.054212885288749256,rbf,TPESampler,COMPLETE
802,0.3388764361939384,2025-04-25 00:32:11.761715,2025-04-25 00:32:12.581068,0 days 00:00:00.819353,17.617783700100066,0.009182756793853284,0.13199047313483328,rbf,TPESampler,COMPLETE
803,0.1991404084552745,2025-04-25 00:32:12.744026,2025-04-25 00:32:13.756230,0 days 00:00:01.012204,95.42011654266513,0.006613691475255895,0.0125687927934576,rbf,TPESampler,COMPLETE
804,0.23279532542867398,2025-04-25 00:32:13.922746,2025-04-25 00:32:14.712653,0 days 00:00:00.789907,16.14949905821236,0.0037370860947195735,0.05184448054553921,rbf,TPESampler,COMPLETE
805,0.20528130132840924,2025-04-25 00:32:14.873165,2025-04-25 00:32:15.803831,0 days 00:00:00.930666,84.36091825234976,0.010223213977883904,0.011520953100214455,rbf,TPESampler,COMPLETE
806,0.2694568659979228,2025-04-25 00:32:15.970187,2025-04-25 00:32:20.432940,0 days 00:00:04.462753,4.591219393477366,0.005492524131490663,0.012743222455155431,linear,TPESampler,COMPLETE
807,0.18095390295483751,2025-04-25 00:32:20.607900,2025-04-25 00:32:21.580793,0 days 00:00:00.972893,88.19621555371704,0.017350724808990844,0.03535454558963929,rbf,TPESampler,COMPLETE
808,0.31862565679763666,2025-04-25 00:32:21.750009,2025-04-25 00:32:22.740338,0 days 00:00:00.990329,94.33943875329503,0.007722352616535621,0.10508063994933789,rbf,TPESampler,COMPLETE
809,0.17819069297513365,2025-04-25 00:32:22.903828,2025-04-25 00:32:24.341881,0 days 00:00:01.438053,77.3335120269155,0.005497611410338228,0.025878535626234475,rbf,TPESampler,COMPLETE
810,0.756207486761179,2025-04-25 00:32:24.505968,2025-04-25 00:32:25.068230,0 days 00:00:00.562262,0.30736538465718666,0.004268973407993227,0.00010400236119099413,rbf,TPESampler,COMPLETE
811,0.23925179337253813,2025-04-25 00:32:25.230452,2025-04-25 00:32:27.096964,0 days 00:00:01.866512,97.3860940851843,0.0010681554238214572,0.05436235515347397,rbf,TPESampler,COMPLETE
812,0.18896962234521147,2025-04-25 00:32:27.305824,2025-04-25 00:32:28.630408,0 days 00:00:01.324584,89.05235175160408,0.00517915405555152,0.018660624321788742,rbf,TPESampler,COMPLETE
813,0.21503305500169198,2025-04-25 00:32:28.790826,2025-04-25 00:32:29.422653,0 days 00:00:00.631827,18.83174992744836,0.005337457098149771,0.00789837556221974,rbf,TPESampler,COMPLETE
814,0.21432045360220747,2025-04-25 00:32:29.590088,2025-04-25 00:32:30.253609,0 days 00:00:00.663521,28.246916311592518,0.0013027946785690776,0.005415970454950226,rbf,TPESampler,COMPLETE
815,0.20026149406611746,2025-04-25 00:32:30.423985,2025-04-25 00:32:31.187381,0 days 00:00:00.763396,12.004346561053898,0.011163492196180964,0.027178118937682287,rbf,TPESampler,COMPLETE
816,0.2728971136794213,2025-04-25 00:32:31.362263,2025-04-25 00:32:32.152042,0 days 00:00:00.789779,1.481754418492865,0.23608890594464232,0.00011219303044028572,linear,TPESampler,COMPLETE
817,0.21017283286806177,2025-04-25 00:32:32.311461,2025-04-25 00:32:33.063047,0 days 00:00:00.751586,16.86891975501827,0.0025765986242571345,0.028297313212533787,rbf,TPESampler,COMPLETE
818,0.4158246301499579,2025-04-25 00:32:33.224989,2025-04-25 00:32:33.844468,0 days 00:00:00.619479,56.76742773882205,0.0032231376965872176,0.2953494729875779,rbf,TPESampler,COMPLETE
819,0.2726430104698695,2025-04-25 00:32:34.011285,2025-04-25 00:33:06.769000,0 days 00:00:32.757715,48.28890377938586,0.04053931735675876,0.042094533955221676,linear,TPESampler,COMPLETE
820,0.27438903468844167,2025-04-25 00:33:06.934010,2025-04-25 00:33:07.586744,0 days 00:00:00.652734,18.12118367530795,0.02568689916666343,0.07405393654424218,rbf,TPESampler,COMPLETE
821,0.1733781977833619,2025-04-25 00:33:07.754599,2025-04-25 00:33:08.865965,0 days 00:00:01.111366,79.20865997566912,0.013713034775960808,0.030436331862656946,rbf,TPESampler,COMPLETE
822,0.3061975705871138,2025-04-25 00:33:09.036157,2025-04-25 00:33:09.952179,0 days 00:00:00.916022,90.42493463012303,0.022966189019896666,0.09474356791958027,rbf,TPESampler,COMPLETE
823,0.16745867019471414,2025-04-25 00:33:10.113299,2025-04-25 00:33:11.618441,0 days 00:00:01.505142,99.67180598711184,0.004863944082963838,0.02744241407529847,rbf,TPESampler,COMPLETE
824,0.24621089007608252,2025-04-25 00:33:11.789234,2025-04-25 00:33:12.530822,0 days 00:00:00.741588,91.44709861927214,0.033833317897888356,0.05818924373384203,rbf,TPESampler,COMPLETE
