number,value,datetime_start,datetime_complete,duration,params_C,params_epsilon,params_gamma,params_kernel,system_attrs_auto:sampler,state
471,0.5672777085488783,2025-04-24 23:22:37.072285,2025-04-24 23:22:37.596222,0 days 00:00:00.523937,0.0010361250213443535,0.007996984421118783,0.6529617153733392,linear,TPESampler,COMPLETE
472,0.2239803028848679,2025-04-24 23:22:37.754475,2025-04-24 23:22:38.355155,0 days 00:00:00.600680,12.783589557347266,0.018303957835680555,0.009238957196400374,rbf,TPESampler,COMPLETE
473,0.18604438688706743,2025-04-24 23:22:38.507660,2025-04-24 23:22:39.135186,0 days 00:00:00.627526,91.5939170752085,0.04964401831291649,0.004258056641634732,rbf,TPESampler,COMPLETE
474,0.6581279619167825,2025-04-24 23:22:39.295406,2025-04-24 23:22:39.874107,0 days 00:00:00.578701,23.10046720382445,0.007357600980870884,0.005193215077070711,poly,TPESampler,COMPLETE
475,0.26787819059369616,2025-04-24 23:22:40.037222,2025-04-24 23:23:35.326042,0 days 00:00:55.288820,75.13291266642048,0.048349211339341974,0.007293422247219479,linear,TPESampler,COMPLETE
476,0.23424805141352015,2025-04-24 23:23:35.491020,2025-04-24 23:23:36.153538,0 days 00:00:00.662518,93.13950191516459,0.008347323947393551,0.0015625111689826546,rbf,TPESampler,COMPLETE
477,0.20432861486896095,2025-04-24 23:23:36.313981,2025-04-24 23:23:37.212190,0 days 00:00:00.898209,71.47893022424385,0.007358755902151311,0.013136152939503381,rbf,TPESampler,COMPLETE
478,0.2937917717221253,2025-04-24 23:23:37.372972,2025-04-24 23:23:37.984554,0 days 00:00:00.611582,6.361366932628419,0.0020871213256236382,0.006803109137622077,rbf,TPESampler,COMPLETE
479,0.20011845566924077,2025-04-24 23:23:38.262473,2025-04-24 23:23:39.268478,0 days 00:00:01.006005,90.67267003965944,0.00984692626837466,0.01233610874710813,rbf,TPESampler,COMPLETE
480,0.29988092143287665,2025-04-24 23:23:39.435067,2025-04-24 23:23:40.023506,0 days 00:00:00.588439,22.68088740292366,0.0272704604709293,0.0022348291268494587,rbf,TPESampler,COMPLETE
481,0.3844106175572586,2025-04-24 23:23:40.179658,2025-04-24 23:23:40.679208,0 days 00:00:00.499550,0.07257228299990844,0.2205486729449805,0.0018920892085695742,linear,TPESampler,COMPLETE
482,0.900791837837109,2025-04-24 23:23:40.848130,2025-04-24 23:23:41.308627,0 days 00:00:00.460497,0.008416151304243329,0.789085763441164,0.00015254380048794155,poly,TPESampler,COMPLETE
483,0.27633978537955856,2025-04-24 23:23:41.468078,2025-04-24 23:24:28.221721,0 days 00:00:46.753643,85.84361668248332,0.003288592766304304,0.01829887411172016,linear,TPESampler,COMPLETE
484,0.18405227743650168,2025-04-24 23:24:28.390022,2025-04-24 23:24:29.006009,0 days 00:00:00.615987,99.82745865898936,0.06283045035940808,0.004434523992538969,rbf,TPESampler,COMPLETE
485,0.19586051736926288,2025-04-24 23:24:29.421656,2025-04-24 23:24:30.167442,0 days 00:00:00.745786,88.01701678489654,0.00989536004236381,0.004109306297252615,rbf,TPESampler,COMPLETE
486,0.19280536395306438,2025-04-24 23:24:30.329158,2025-04-24 23:24:30.957757,0 days 00:00:00.628599,18.93252141846992,0.027363850505003666,0.02011499395327526,rbf,TPESampler,COMPLETE
487,0.22134945755837218,2025-04-24 23:24:31.135758,2025-04-24 23:24:31.732795,0 days 00:00:00.597037,23.998741864066645,0.02625803393551737,0.00553726540088836,rbf,TPESampler,COMPLETE
488,0.1800129315469954,2025-04-24 23:24:31.896823,2025-04-24 23:24:32.579662,0 days 00:00:00.682839,88.40412510322612,0.028827821106115016,0.004929219031517864,rbf,TPESampler,COMPLETE
489,13.764491780210117,2025-04-24 23:24:32.746514,2025-04-24 23:24:33.300272,0 days 00:00:00.553758,11.721533420239748,0.011985340358317853,0.0029956357594650876,sigmoid,TPESampler,COMPLETE
490,0.19208686210528716,2025-04-24 23:24:33.461301,2025-04-24 23:24:34.377705,0 days 00:00:00.916404,82.18274803783066,0.019897408710356074,0.008981819026648559,rbf,TPESampler,COMPLETE
491,0.19883401002391218,2025-04-24 23:24:34.537976,2025-04-24 23:24:35.165714,0 days 00:00:00.627738,15.184487864489558,0.011873159414631173,0.014083858005630886,rbf,TPESampler,COMPLETE
492,0.16912333147933323,2025-04-24 23:24:35.327470,2025-04-24 23:24:36.474824,0 days 00:00:01.147354,95.02248781869594,0.015360418327734323,0.02580952320043718,rbf,TPESampler,COMPLETE
493,0.17366822950216848,2025-04-24 23:24:36.634176,2025-04-24 23:24:37.963197,0 days 00:00:01.329021,98.124632433441,0.003176822565106898,0.023534726335161404,rbf,TPESampler,COMPLETE
494,0.20716645199670902,2025-04-24 23:24:38.123747,2025-04-24 23:24:38.892636,0 days 00:00:00.768889,22.469803875249838,0.01370156063160301,0.03538290112119503,rbf,TPESampler,COMPLETE
495,0.2607148912860921,2025-04-24 23:24:39.058007,2025-04-24 23:24:39.729399,0 days 00:00:00.671392,5.173605911009828,0.0012159786820014455,0.06398270932029225,rbf,TPESampler,COMPLETE
496,0.22123465720657448,2025-04-24 23:24:39.895212,2025-04-24 23:24:40.522353,0 days 00:00:00.627141,6.599168802236792,0.004782540524144988,0.02632082752033666,rbf,TPESampler,COMPLETE
497,0.1834800576132333,2025-04-24 23:24:40.683445,2025-04-24 23:24:41.819621,0 days 00:00:01.136176,85.83555060714153,0.0072886399256394535,0.02154561593279027,rbf,TPESampler,COMPLETE
498,0.16904239286995223,2025-04-24 23:24:41.984000,2025-04-24 23:24:43.363569,0 days 00:00:01.379569,96.68349348142513,0.005028011874651758,0.026997267806188885,rbf,TPESampler,COMPLETE
499,0.19193695702609384,2025-04-24 23:24:43.523391,2025-04-24 23:24:44.691627,0 days 00:00:01.168236,90.29764270032663,0.0015133728702578328,0.015606347957272006,rbf,TPESampler,COMPLETE
500,0.2956151611246743,2025-04-24 23:24:44.848987,2025-04-24 23:24:45.936510,0 days 00:00:01.087523,77.13305753930148,0.009087541136252545,0.08457893055668855,rbf,TPESampler,COMPLETE
501,0.3990626588965187,2025-04-24 23:24:46.097129,2025-04-24 23:24:46.730122,0 days 00:00:00.632993,75.76190811579879,0.010377166177400924,0.24851409896854837,rbf,TPESampler,COMPLETE
502,0.18389947102606027,2025-04-24 23:24:46.891256,2025-04-24 23:24:47.641363,0 days 00:00:00.750107,40.560121264778005,0.0034631067365457364,0.008728864478733072,rbf,TPESampler,COMPLETE
503,0.21545869344228122,2025-04-24 23:24:47.807836,2025-04-24 23:24:49.200626,0 days 00:00:01.392790,97.05872684915822,0.003408511271025825,0.04666428697798627,rbf,TPESampler,COMPLETE
504,0.35660640874487104,2025-04-24 23:24:49.367186,2025-04-24 23:24:50.078377,0 days 00:00:00.711191,13.859245010503368,0.004583485129770533,0.1594393456101597,rbf,TPESampler,COMPLETE
505,0.1820097512314863,2025-04-24 23:24:50.237700,2025-04-24 23:24:51.648647,0 days 00:00:01.410947,95.12247824384724,0.0043195042126289995,0.03617807240182297,rbf,TPESampler,COMPLETE
506,1.2357189945681226,2025-04-24 23:24:51.821365,2025-04-24 23:39:21.667214,0 days 00:14:29.845849,4.904239814857035,0.17786872107586962,0.8954978962693276,poly,TPESampler,COMPLETE
507,0.3214383398430821,2025-04-24 23:31:40.922361,2025-04-24 23:31:41.924466,0 days 00:00:01.002105,35.542419192005426,0.0016837120204736687,0.10779694035237904,rbf,TPESampler,COMPLETE
508,0.820962334507694,2025-04-24 23:31:42.103397,2025-04-25 00:09:20.637967,0 days 00:37:38.534570,36.43646051605607,0.008242779690677104,0.09298930626101207,poly,TPESampler,COMPLETE
509,0.2758024553157713,2025-04-24 23:39:21.822291,2025-04-24 23:39:46.101173,0 days 00:00:24.278882,23.070810341196093,0.014651623279622399,0.04842699520075092,linear,TPESampler,COMPLETE
510,0.18786239319386508,2025-04-24 23:39:46.263313,2025-04-24 23:39:47.495737,0 days 00:00:01.232424,71.10799940460788,0.005647716570810199,0.03764721601859523,rbf,TPESampler,COMPLETE
511,6.194642983318198,2025-04-24 23:39:47.660678,2025-04-24 23:39:48.192143,0 days 00:00:00.531465,0.4662101689586038,0.004644237556069902,0.01752310452293659,sigmoid,TPESampler,COMPLETE
512,0.20546692143250517,2025-04-24 23:39:48.350395,2025-04-24 23:39:49.231561,0 days 00:00:00.881166,29.84212748216019,0.005403774763943004,0.0373412064930373,rbf,TPESampler,COMPLETE
513,0.31777085006758354,2025-04-24 23:39:49.391929,2025-04-24 23:39:50.016772,0 days 00:00:00.624843,0.18650141377897686,0.03961353079911011,0.00015058423726369604,linear,TPESampler,COMPLETE
514,0.20538578473489663,2025-04-24 23:39:50.177968,2025-04-24 23:39:50.969370,0 days 00:00:00.791402,19.977944016154154,0.0015158756237883544,0.027690395454970363,rbf,TPESampler,COMPLETE
515,176.7605177852189,2025-04-24 23:39:51.135419,2025-04-24 23:39:51.677285,0 days 00:00:00.541866,11.396091773219332,0.034285616287490085,0.021097084210847696,sigmoid,TPESampler,COMPLETE
516,0.4388630497045536,2025-04-24 23:39:51.841985,2025-04-24 23:39:52.325629,0 days 00:00:00.483644,0.8851542502050129,0.32227469314931007,0.1695133598111148,rbf,TPESampler,COMPLETE
517,0.27037578173662336,2025-04-24 23:39:52.490985,2025-04-24 23:39:53.526616,0 days 00:00:01.035631,68.36760919798857,0.010179613489525792,0.07037600350045753,rbf,TPESampler,COMPLETE
518,0.2033054210095339,2025-04-24 23:39:53.687127,2025-04-24 23:39:54.475161,0 days 00:00:00.788034,97.05431881516205,0.025024789869873696,0.04248032054767252,rbf,TPESampler,COMPLETE
519,0.2073867978996721,2025-04-24 23:39:54.634195,2025-04-24 23:39:55.393993,0 days 00:00:00.759798,71.88271313429694,0.022896666303514786,0.04411558197508702,rbf,TPESampler,COMPLETE
520,0.3758643195660523,2025-04-24 23:39:55.556900,2025-04-24 23:39:56.076109,0 days 00:00:00.519209,0.07752306757892839,0.13977674680750993,0.677368197895956,linear,TPESampler,COMPLETE
521,660.1418931494351,2025-04-24 23:39:56.232854,2025-04-24 23:39:56.764262,0 days 00:00:00.531408,31.386864070603178,0.006165058659063171,0.03733880851218807,sigmoid,TPESampler,COMPLETE
522,0.23356687109011137,2025-04-24 23:39:56.920243,2025-04-24 23:39:58.331675,0 days 00:00:01.411432,69.6194172665438,0.002640925662384344,0.05349819022510664,rbf,TPESampler,COMPLETE
523,0.18046418264871372,2025-04-24 23:39:58.485133,2025-04-24 23:39:59.234471,0 days 00:00:00.749338,85.7890401637378,0.03118245872749696,0.020934704132821915,rbf,TPESampler,COMPLETE
524,0.20240487549089417,2025-04-24 23:39:59.391275,2025-04-24 23:40:00.410212,0 days 00:00:01.018937,86.52866509445948,0.0025276090307236837,0.009661549197261829,rbf,TPESampler,COMPLETE
525,0.8567972857430974,2025-04-24 23:40:00.566629,2025-04-24 23:40:01.075893,0 days 00:00:00.509264,58.29395158598612,0.058434987716790385,0.0005000100806940675,poly,TPESampler,COMPLETE
526,255.13480638517927,2025-04-24 23:40:01.227059,2025-04-24 23:40:01.764210,0 days 00:00:00.537151,96.94242035956866,0.014179341568521613,0.00467865182477877,sigmoid,TPESampler,COMPLETE
527,0.8836293085052449,2025-04-24 23:40:01.921008,2025-04-24 23:40:02.384104,0 days 00:00:00.463096,0.001203577838313405,0.9699731128180518,0.028113957431702395,sigmoid,TPESampler,COMPLETE
528,0.23738290145047986,2025-04-24 23:40:02.541625,2025-04-24 23:40:03.123550,0 days 00:00:00.581925,8.859475157983356,0.008140087753086455,0.010249924026185351,rbf,TPESampler,COMPLETE
529,0.383748451443051,2025-04-24 23:40:03.279552,2025-04-24 23:40:03.848293,0 days 00:00:00.568741,19.546672367285158,0.023321397090577022,0.0008731288639604239,rbf,TPESampler,COMPLETE
530,0.19229845831466524,2025-04-24 23:40:04.002929,2025-04-24 23:40:04.917118,0 days 00:00:00.914189,91.71596207880916,0.005831208830131737,0.00830762247099384,rbf,TPESampler,COMPLETE
531,0.178984445655669,2025-04-24 23:40:05.073864,2025-04-24 23:40:06.193129,0 days 00:00:01.119265,93.77335309408568,0.01256722979456678,0.021741904699019536,rbf,TPESampler,COMPLETE
532,0.2775431000736439,2025-04-24 23:40:06.350360,2025-04-24 23:40:28.353971,0 days 00:00:22.003611,32.672552379099436,0.020890893435066338,0.0018736908466287228,linear,TPESampler,COMPLETE
533,0.30516134613585444,2025-04-24 23:40:28.513502,2025-04-24 23:40:29.088910,0 days 00:00:00.575408,14.036255795314013,0.013449934970045166,0.002938198890383299,rbf,TPESampler,COMPLETE
534,0.21038419498593514,2025-04-24 23:40:29.255072,2025-04-24 23:40:29.913551,0 days 00:00:00.658479,19.089781460517067,0.0475290690724919,0.008508781725562624,rbf,TPESampler,COMPLETE
535,0.20427551498120458,2025-04-24 23:40:30.092262,2025-04-24 23:40:30.713718,0 days 00:00:00.621456,15.588382926372603,0.021514027616914396,0.011498682544017402,rbf,TPESampler,COMPLETE
536,0.21968188425759752,2025-04-24 23:40:30.878718,2025-04-24 23:40:31.538025,0 days 00:00:00.659307,99.41074148241391,0.027185859681665585,0.002101312696405482,rbf,TPESampler,COMPLETE
537,0.23691744952228955,2025-04-24 23:40:31.709468,2025-04-24 23:40:32.315889,0 days 00:00:00.606421,17.99991070889453,0.012628729711018123,0.005261836830507253,rbf,TPESampler,COMPLETE
538,0.1978639003726525,2025-04-24 23:40:32.473514,2025-04-24 23:40:33.093242,0 days 00:00:00.619728,97.95102950618318,0.0737483971875576,0.01834407615604892,rbf,TPESampler,COMPLETE
539,0.19775685663551304,2025-04-24 23:40:33.253185,2025-04-24 23:40:33.852343,0 days 00:00:00.599158,22.58975956135523,0.03291387835641658,0.01042881485295411,rbf,TPESampler,COMPLETE
540,0.20779900228043338,2025-04-24 23:40:34.013326,2025-04-24 23:40:35.065179,0 days 00:00:01.051853,96.07290289610047,0.014580096262660797,0.009996058643631124,rbf,TPESampler,COMPLETE
541,0.1806276275711341,2025-04-24 23:40:35.283855,2025-04-24 23:40:36.003820,0 days 00:00:00.719965,60.734686109434186,0.028072472661709955,0.009344009322933155,rbf,TPESampler,COMPLETE
542,0.2152512078756487,2025-04-24 23:40:36.403562,2025-04-24 23:40:37.048368,0 days 00:00:00.644806,11.34331368066884,0.00591811513420451,0.013128291500265073,rbf,TPESampler,COMPLETE
543,0.9031698581615504,2025-04-24 23:40:37.212983,2025-04-24 23:40:37.732910,0 days 00:00:00.519927,0.0010646035279253717,0.0816359531978298,0.0007716512197733957,poly,TPESampler,COMPLETE
544,0.1824972021430596,2025-04-24 23:40:37.910504,2025-04-24 23:40:39.244636,0 days 00:00:01.334132,90.33861258521627,0.00395525186921926,0.021277501519095524,rbf,TPESampler,COMPLETE
545,0.47037434003882017,2025-04-24 23:40:39.421764,2025-04-24 23:40:40.010850,0 days 00:00:00.589086,0.29937368090748273,0.01729688746994753,0.011629793657449617,rbf,TPESampler,COMPLETE
546,0.6008353531227768,2025-04-24 23:40:40.171335,2025-04-24 23:40:40.768768,0 days 00:00:00.597433,0.0319997562292231,0.0014604260042741513,0.01924608779724146,rbf,TPESampler,COMPLETE
547,0.1957670513877249,2025-04-24 23:40:40.937997,2025-04-24 23:40:41.639993,0 days 00:00:00.701996,84.3276940391147,0.020706393889975545,0.00403403841988368,rbf,TPESampler,COMPLETE
548,0.7150831233478806,2025-04-24 23:40:41.813577,2025-04-24 23:40:43.332729,0 days 00:00:01.519152,86.46307044895207,0.005685606911668752,0.0072557477932048845,poly,TPESampler,COMPLETE
549,0.3425019972944924,2025-04-24 23:40:43.495678,2025-04-24 23:40:44.069871,0 days 00:00:00.574193,15.664760001230057,0.03067820602431621,0.0017437080565041601,rbf,TPESampler,COMPLETE
550,0.17287250766231058,2025-04-24 23:40:44.248775,2025-04-24 23:40:45.119038,0 days 00:00:00.870263,99.77485719152352,0.019130734585608503,0.005808840479150592,rbf,TPESampler,COMPLETE
551,0.19388046393827887,2025-04-24 23:40:45.295318,2025-04-24 23:40:46.432752,0 days 00:00:01.137434,99.70498008511623,0.00511969037233031,0.013993691101495825,rbf,TPESampler,COMPLETE
552,0.2349978981330639,2025-04-24 23:40:46.595445,2025-04-24 23:40:47.159171,0 days 00:00:00.563726,11.807487774106505,0.06955579900411767,0.009093518492710466,rbf,TPESampler,COMPLETE
553,0.3036685416384588,2025-04-24 23:40:47.341488,2025-04-24 23:40:47.933796,0 days 00:00:00.592308,84.62439284793075,0.03414878872405401,0.0007057674763868415,rbf,TPESampler,COMPLETE
554,0.19304135829019978,2025-04-24 23:40:48.091634,2025-04-24 23:40:49.071534,0 days 00:00:00.979900,82.42521662260306,0.01326964097879419,0.015122171252323936,rbf,TPESampler,COMPLETE
555,0.5719028267441586,2025-04-24 23:40:49.239555,2025-04-24 23:44:09.916960,0 days 00:03:20.677405,36.134792784708154,0.0995250568428263,0.02813307807826043,poly,TPESampler,COMPLETE
556,0.5065360558541975,2025-04-24 23:44:10.078113,2025-04-24 23:44:10.653152,0 days 00:00:00.575039,4.787778029035399,0.002985354338299539,0.000449592569313861,rbf,TPESampler,COMPLETE
557,0.18937600598729176,2025-04-24 23:44:10.832272,2025-04-24 23:44:11.645647,0 days 00:00:00.813375,87.29018838523368,0.029803938246237047,0.016002380532457082,rbf,TPESampler,COMPLETE
558,0.1911694706828705,2025-04-24 23:44:11.809757,2025-04-24 23:44:12.719693,0 days 00:00:00.909936,99.61984614602851,0.025437597357025506,0.013548303627246298,rbf,TPESampler,COMPLETE
559,0.18053923535747615,2025-04-24 23:44:12.881606,2025-04-24 23:44:13.593899,0 days 00:00:00.712293,24.973113243395268,0.01622141561499106,0.013830498454382386,rbf,TPESampler,COMPLETE
560,0.722044778122674,2025-04-24 23:44:13.759975,2025-04-24 23:44:14.376681,0 days 00:00:00.616706,12.283705110353692,0.027494885900368686,0.003734345293740234,poly,TPESampler,COMPLETE
561,0.26793909521573506,2025-04-24 23:44:14.542403,2025-04-24 23:44:15.112431,0 days 00:00:00.570028,18.85524679765484,0.04486843419096755,0.0035704039559445,rbf,TPESampler,COMPLETE
562,0.2290462144727187,2025-04-24 23:44:15.280050,2025-04-24 23:44:15.928728,0 days 00:00:00.648678,17.30160107628289,0.006490597662617616,0.00600930056929929,rbf,TPESampler,COMPLETE
563,0.20922979925766727,2025-04-24 23:44:16.103082,2025-04-24 23:44:16.849286,0 days 00:00:00.746204,96.4712589578151,0.010752834431154204,0.002763184277998938,rbf,TPESampler,COMPLETE
564,0.5960183628850585,2025-04-24 23:44:17.014419,2025-04-24 23:50:02.650229,0 days 00:05:45.635810,0.003250083843730904,0.10917997183218552,0.7280704724826611,poly,TPESampler,COMPLETE
565,0.22272942901162782,2025-04-24 23:50:02.882138,2025-04-24 23:50:03.579949,0 days 00:00:00.697811,84.81761322547152,0.047357987221539846,0.00230903693267362,rbf,TPESampler,COMPLETE
566,0.1969467784468219,2025-04-24 23:50:03.760337,2025-04-24 23:50:04.509677,0 days 00:00:00.749340,92.91634706233498,0.051769548721512196,0.016486429724551895,rbf,TPESampler,COMPLETE
567,0.18718753101015462,2025-04-24 23:50:04.687244,2025-04-24 23:50:05.427071,0 days 00:00:00.739827,96.824383627752,0.04030338300152273,0.007785506495264827,rbf,TPESampler,COMPLETE
568,0.2762979999526248,2025-04-24 23:50:05.627528,2025-04-24 23:50:06.360210,0 days 00:00:00.732682,11.908553216940584,0.01080445783840305,0.0769841757243037,rbf,TPESampler,COMPLETE
569,0.8832182512954181,2025-04-24 23:50:06.541467,2025-04-24 23:50:07.194626,0 days 00:00:00.653159,0.0308393404859898,0.5769247572413129,0.7014320346289902,sigmoid,TPESampler,COMPLETE
570,0.18576197845413966,2025-04-24 23:50:07.403982,2025-04-24 23:50:08.627574,0 days 00:00:01.223592,95.03519430855661,0.019272419562057767,0.01858701312095005,rbf,TPESampler,COMPLETE
571,0.21618688373811482,2025-04-24 23:50:08.815843,2025-04-24 23:50:09.654016,0 days 00:00:00.838173,83.74975393854483,0.005131594554277543,0.0023852356314543023,rbf,TPESampler,COMPLETE
572,0.2596276328724427,2025-04-24 23:50:09.855374,2025-04-24 23:50:11.462960,0 days 00:00:01.607586,1.1064680444994999,0.002030811994339209,0.003210879643617357,linear,TPESampler,COMPLETE
573,0.8873407764885523,2025-04-24 23:50:11.677743,2025-04-24 23:50:12.307299,0 days 00:00:00.629556,0.37280632328878516,0.0011597756323589192,0.0010127151185735095,poly,TPESampler,COMPLETE
574,0.2770068405225973,2025-04-24 23:50:12.488816,2025-04-24 23:51:08.611426,0 days 00:00:56.122610,90.70357775030463,0.005451886748792325,0.3183970842521686,linear,TPESampler,COMPLETE
575,0.20731984667933592,2025-04-24 23:51:08.783231,2025-04-24 23:51:09.427288,0 days 00:00:00.644057,11.672514406349045,0.01936136412806687,0.01563992196810713,rbf,TPESampler,COMPLETE
576,0.17701271532426704,2025-04-24 23:51:09.604216,2025-04-24 23:51:10.578586,0 days 00:00:00.974370,99.76663404256296,0.0072400383700490685,0.006609192431026228,rbf,TPESampler,COMPLETE
577,926.0810401858687,2025-04-24 23:51:10.760727,2025-04-24 23:51:11.380121,0 days 00:00:00.619394,72.35403152551106,0.03238870513343926,0.016434617248089953,sigmoid,TPESampler,COMPLETE
578,0.8065717211790694,2025-04-24 23:51:11.556318,2025-04-24 23:51:12.173131,0 days 00:00:00.616813,0.010351114584596557,0.006961902480113622,0.214641833323701,rbf,TPESampler,COMPLETE
579,0.20255135136112778,2025-04-24 23:51:12.350462,2025-04-24 23:51:13.085018,0 days 00:00:00.734556,95.87523133667679,0.016450181557973516,0.0031453811438353655,rbf,TPESampler,COMPLETE
580,0.1670241358120698,2025-04-24 23:51:13.266849,2025-04-24 23:51:14.465187,0 days 00:00:01.198338,98.0073068104139,0.017148980947143063,0.02674412226934767,rbf,TPESampler,COMPLETE
581,0.30736130576337833,2025-04-24 23:51:14.638402,2025-04-24 23:51:15.298169,0 days 00:00:00.659767,33.63578986442588,0.0397911388655452,0.0984691622177629,rbf,TPESampler,COMPLETE
582,0.1724749173268388,2025-04-24 23:51:15.476672,2025-04-24 23:51:16.655414,0 days 00:00:01.178742,80.31616290438738,0.012940617976529,0.0291813811122995,rbf,TPESampler,COMPLETE
583,0.6885626298831218,2025-04-24 23:51:16.835971,2025-04-24 23:51:17.332834,0 days 00:00:00.496863,0.8960663567614583,0.7521297886635867,0.00017238391820866296,rbf,TPESampler,COMPLETE
584,0.2390338494354287,2025-04-24 23:51:17.502879,2025-04-24 23:51:18.500107,0 days 00:00:00.997228,33.84620360164756,0.006972788506885355,0.05615443760545243,rbf,TPESampler,COMPLETE
585,0.19153771882873688,2025-04-24 23:51:18.674192,2025-04-24 23:51:19.774743,0 days 00:00:01.100551,70.91896410150623,0.011276514268496646,0.038499756229146045,rbf,TPESampler,COMPLETE
586,0.22150233214808515,2025-04-24 23:51:19.959622,2025-04-24 23:51:20.953505,0 days 00:00:00.993883,23.05045405585804,0.017435049681911546,0.04538402096389898,rbf,TPESampler,COMPLETE
587,0.39262589639569995,2025-04-24 23:51:21.128786,2025-04-24 23:51:21.770998,0 days 00:00:00.642212,61.624916634273816,0.015925916186136736,0.23178241080387182,rbf,TPESampler,COMPLETE
588,20.894440648146045,2025-04-24 23:51:21.948475,2025-04-24 23:51:22.511840,0 days 00:00:00.563365,6.0852614420090125,0.7476381320741617,0.005461311669646561,sigmoid,TPESampler,COMPLETE
