number,value,datetime_start,datetime_complete,duration,params_C,params_epsilon,params_gamma,params_kernel,system_attrs_auto:sampler,state
353,0.19217050400869382,2025-04-24 23:12:59.433718,2025-04-24 23:13:00.278825,0 days 00:00:00.845107,89.01554212637721,0.006322823822522253,0.004387788328365052,rbf,TPESampler,COMPLETE
354,0.21455045013503854,2025-04-24 23:13:00.431399,2025-04-24 23:13:01.053055,0 days 00:00:00.621656,19.136120422473628,0.004185233826622251,0.007876658432390092,rbf,TPESampler,COMPLETE
355,0.25665955310888816,2025-04-24 23:13:01.213558,2025-04-24 23:13:02.297585,0 days 00:00:01.084027,35.92680512179533,0.0030083428008696724,0.06451381008990942,rbf,TPESampler,COMPLETE
356,0.1915381837525288,2025-04-24 23:13:02.469205,2025-04-24 23:13:03.498141,0 days 00:00:01.028936,70.72885464860273,0.00431820769990289,0.017648914953525784,rbf,TPESampler,COMPLETE
357,0.27365273611190355,2025-04-24 23:13:03.652992,2025-04-24 23:13:56.931386,0 days 00:00:53.278394,84.31748455245464,0.03902360911657135,0.0003125861828243962,linear,TPESampler,COMPLETE
358,0.700919618417581,2025-04-24 23:13:57.090093,2025-04-24 23:13:57.643045,0 days 00:00:00.552952,12.115490652694872,0.07253452684411783,0.004672050403172795,poly,TPESampler,COMPLETE
359,0.19297205964481806,2025-04-24 23:13:57.805454,2025-04-24 23:13:58.452613,0 days 00:00:00.647159,63.98878487645084,0.04540189238923556,0.021943216492866093,rbf,TPESampler,COMPLETE
360,0.19375956734536945,2025-04-24 23:13:58.610950,2025-04-24 23:13:59.372256,0 days 00:00:00.761306,96.78760113517647,0.034235356965913004,0.013045166531305816,rbf,TPESampler,COMPLETE
361,0.4466420102238409,2025-04-24 23:13:59.539436,2025-04-24 23:14:00.078138,0 days 00:00:00.538702,0.013516043879046627,0.0028294137364341916,0.004122217977320009,linear,TPESampler,COMPLETE
362,0.6621759890802896,2025-04-24 23:14:00.236878,2025-04-24 23:14:05.345826,0 days 00:00:05.108948,20.932734573102064,0.0012878886218286969,0.016292495965371814,poly,TPESampler,COMPLETE
363,0.2634484848420653,2025-04-24 23:14:05.507341,2025-04-24 23:14:24.846091,0 days 00:00:19.338750,34.01516663810591,0.057758194277640215,0.013978579254051588,linear,TPESampler,COMPLETE
364,0.21702702526044018,2025-04-24 23:14:25.007367,2025-04-24 23:14:25.565413,0 days 00:00:00.558046,8.814897952865204,0.032103087532816973,0.016949306824611505,rbf,TPESampler,COMPLETE
365,0.2058130277242597,2025-04-24 23:14:25.722865,2025-04-24 23:14:26.427367,0 days 00:00:00.704502,73.75993186824898,0.005518455415857065,0.0036566995953853042,rbf,TPESampler,COMPLETE
366,0.198192539919374,2025-04-24 23:14:26.630612,2025-04-24 23:14:27.263889,0 days 00:00:00.633277,92.20731362363166,0.04244960702582448,0.003570060926977567,rbf,TPESampler,COMPLETE
367,0.19026396122505443,2025-04-24 23:14:27.425298,2025-04-24 23:14:28.375541,0 days 00:00:00.950243,93.44164379783467,0.004711919171987453,0.008071220381485214,rbf,TPESampler,COMPLETE
368,0.21917533922763513,2025-04-24 23:14:28.534353,2025-04-24 23:14:29.078258,0 days 00:00:00.543905,84.81586721327956,0.13112941329139835,0.03134416561571165,rbf,TPESampler,COMPLETE
369,0.20233515922074233,2025-04-24 23:14:29.239623,2025-04-24 23:14:29.938274,0 days 00:00:00.698651,78.22567130405771,0.021694195769468322,0.0035595306987947395,rbf,TPESampler,COMPLETE
370,0.1888560553556352,2025-04-24 23:14:30.178418,2025-04-24 23:14:30.740789,0 days 00:00:00.562371,16.549524378228583,0.03707985290729769,0.016045085600779153,rbf,TPESampler,COMPLETE
371,0.2530906697249129,2025-04-24 23:14:30.896166,2025-04-24 23:14:31.395444,0 days 00:00:00.499278,24.662516096704326,0.18619456493346087,0.0055051065065134614,rbf,TPESampler,COMPLETE
372,0.20213441815853386,2025-04-24 23:14:31.561227,2025-04-24 23:14:32.170024,0 days 00:00:00.608797,97.1044027158378,0.06367958643668808,0.012385576433741748,rbf,TPESampler,COMPLETE
373,0.17864840116884717,2025-04-24 23:14:32.329053,2025-04-24 23:14:33.169862,0 days 00:00:00.840809,93.48235360620816,0.029766692430384285,0.020354696661613617,rbf,TPESampler,COMPLETE
374,0.18266795914680012,2025-04-24 23:14:33.334605,2025-04-24 23:14:34.106608,0 days 00:00:00.772003,90.54862721585114,0.021705446547311002,0.0077284204900951396,rbf,TPESampler,COMPLETE
375,1087.3421380166837,2025-04-24 23:14:34.267699,2025-04-24 23:14:34.820311,0 days 00:00:00.552612,62.393085666498486,0.016825730247008456,0.02544476065627526,sigmoid,TPESampler,COMPLETE
376,0.2076241862110161,2025-04-24 23:14:34.977893,2025-04-24 23:14:36.015809,0 days 00:00:01.037916,91.48864730633419,0.016436274968818665,0.010558593581644122,rbf,TPESampler,COMPLETE
377,0.24621988055483104,2025-04-24 23:14:36.176994,2025-04-24 23:14:36.893582,0 days 00:00:00.716588,39.88384751618089,0.02458597706393011,0.05906597370038888,rbf,TPESampler,COMPLETE
378,0.17575409191684851,2025-04-24 23:14:37.049209,2025-04-24 23:14:37.759796,0 days 00:00:00.710587,86.45027365862737,0.02854005224965677,0.007262215683330557,rbf,TPESampler,COMPLETE
379,0.22007922547134715,2025-04-24 23:14:37.928593,2025-04-24 23:14:38.576025,0 days 00:00:00.647432,17.051740780510674,0.016086044832924737,0.007861416941100863,rbf,TPESampler,COMPLETE
380,0.2833780782322318,2025-04-24 23:14:38.731511,2025-04-24 23:14:39.337754,0 days 00:00:00.606243,89.26255208807315,0.04781222653845349,0.07824406791135881,rbf,TPESampler,COMPLETE
381,0.20501681701089422,2025-04-24 23:14:39.493403,2025-04-24 23:14:40.406693,0 days 00:00:00.913290,79.61405514591834,0.012801185449389699,0.012247703454769486,rbf,TPESampler,COMPLETE
382,0.1757137870055213,2025-04-24 23:14:40.558255,2025-04-24 23:14:41.286140,0 days 00:00:00.727885,69.94462684428579,0.023887872590619925,0.007882676098841567,rbf,TPESampler,COMPLETE
383,0.20148997714606406,2025-04-24 23:14:41.444150,2025-04-24 23:14:42.326784,0 days 00:00:00.882634,75.70457333038115,0.024155569209317773,0.0038200329713257548,rbf,TPESampler,COMPLETE
384,0.1923303596353552,2025-04-24 23:14:42.492480,2025-04-24 23:14:43.340058,0 days 00:00:00.847578,65.55904741284016,0.021003154419218767,0.017178445151327597,rbf,TPESampler,COMPLETE
385,0.18341458783186243,2025-04-24 23:14:43.514839,2025-04-24 23:14:44.490471,0 days 00:00:00.975632,84.91747609432895,0.015374334376169972,0.03641666507938602,rbf,TPESampler,COMPLETE
386,0.18168432358505515,2025-04-24 23:14:44.643188,2025-04-24 23:14:45.312713,0 days 00:00:00.669525,88.24176646104846,0.02616133034002483,0.004818812371000785,rbf,TPESampler,COMPLETE
387,0.22319011553395113,2025-04-24 23:14:45.470699,2025-04-24 23:14:46.062909,0 days 00:00:00.592210,17.751232006871575,0.014054717819091352,0.006643821959327534,rbf,TPESampler,COMPLETE
388,0.17220735220915184,2025-04-24 23:14:46.222070,2025-04-24 23:14:46.886870,0 days 00:00:00.664800,98.1397312791132,0.042801064492540966,0.0055490415867322845,rbf,TPESampler,COMPLETE
389,0.18111039936648782,2025-04-24 23:14:47.051708,2025-04-24 23:14:47.807939,0 days 00:00:00.756231,83.14743677974731,0.017988692191185374,0.0052491416155201484,rbf,TPESampler,COMPLETE
390,2.6715495162418716,2025-04-24 23:14:47.973373,2025-04-24 23:14:48.479415,0 days 00:00:00.506042,0.12898993352431692,0.7133240571926275,0.036075371505233975,sigmoid,TPESampler,COMPLETE
391,0.2474294327878039,2025-04-24 23:14:48.655366,2025-04-24 23:14:49.231251,0 days 00:00:00.575885,10.143044841432904,0.014957523759714764,0.007891306226548085,rbf,TPESampler,COMPLETE
392,0.24367901884988857,2025-04-24 23:14:49.390326,2025-04-24 23:14:50.006250,0 days 00:00:00.615924,89.4533134321071,0.02133124198785889,0.0013921444136277103,rbf,TPESampler,COMPLETE
393,0.2912852971411666,2025-04-24 23:14:50.164652,2025-04-24 23:14:50.756099,0 days 00:00:00.591447,49.56993841028634,0.017434897302736643,0.0012961942281129615,rbf,TPESampler,COMPLETE
394,0.19304731347601836,2025-04-24 23:14:50.912915,2025-04-24 23:14:51.778328,0 days 00:00:00.865413,81.24040421930353,0.01064699256689625,0.00908221294087807,rbf,TPESampler,COMPLETE
395,168.2938080174478,2025-04-24 23:14:51.944469,2025-04-24 23:14:52.515980,0 days 00:00:00.571511,99.24996600817526,0.025689229751034715,0.0036352631251859355,sigmoid,TPESampler,COMPLETE
396,0.6985493021535347,2025-04-24 23:14:52.673005,2025-04-24 23:14:55.002582,0 days 00:00:02.329577,56.93876696775152,0.017953816698842662,0.009512077798484604,poly,TPESampler,COMPLETE
397,0.19911976759768096,2025-04-24 23:14:55.167691,2025-04-24 23:14:55.853629,0 days 00:00:00.685938,78.72407270706901,0.024377258237334828,0.0039272977608235575,rbf,TPESampler,COMPLETE
398,0.2509962446186201,2025-04-24 23:14:56.011471,2025-04-24 23:14:56.668770,0 days 00:00:00.657299,99.50939517787043,0.006201337080750511,0.0011450190629882372,rbf,TPESampler,COMPLETE
399,0.9017097476958521,2025-04-24 23:14:56.828390,2025-04-24 23:14:57.355873,0 days 00:00:00.527483,0.012689913821512726,0.012181147051615318,0.00010667977853333311,poly,TPESampler,COMPLETE
400,0.3254688145942944,2025-04-24 23:14:57.513268,2025-04-24 23:14:58.086054,0 days 00:00:00.572786,10.35403973408224,0.014546148943501787,0.0028817344311152858,rbf,TPESampler,COMPLETE
401,0.17712023197720866,2025-04-24 23:14:58.247292,2025-04-24 23:14:58.971217,0 days 00:00:00.723925,93.26672432529652,0.024357095722319252,0.005065267960246813,rbf,TPESampler,COMPLETE
402,0.17815269106713455,2025-04-24 23:14:59.152088,2025-04-24 23:14:59.952357,0 days 00:00:00.800269,98.01608163834281,0.010213205369345113,0.005267676143084546,rbf,TPESampler,COMPLETE
403,0.43760470586603534,2025-04-24 23:15:00.142432,2025-04-24 23:15:00.716514,0 days 00:00:00.574082,6.41763224337307,0.04163157644609729,0.0010726874719317757,rbf,TPESampler,COMPLETE
404,0.1732371864039388,2025-04-24 23:15:00.873974,2025-04-24 23:15:01.674888,0 days 00:00:00.800914,92.44678327010278,0.017523167182858512,0.00610099037964418,rbf,TPESampler,COMPLETE
405,0.19979859847929296,2025-04-24 23:15:01.832629,2025-04-24 23:15:02.815139,0 days 00:00:00.982510,96.55459848482681,0.011074500970322698,0.012111552884859949,rbf,TPESampler,COMPLETE
406,0.19202229925871397,2025-04-24 23:15:02.972945,2025-04-24 23:15:03.681624,0 days 00:00:00.708679,95.65835044122846,0.023162517182206042,0.003926214900380264,rbf,TPESampler,COMPLETE
407,0.19343416549026612,2025-04-24 23:15:03.838702,2025-04-24 23:15:04.822281,0 days 00:00:00.983579,97.91432198651046,0.011101880784286125,0.013627163580999198,rbf,TPESampler,COMPLETE
408,0.25027348495442775,2025-04-24 23:15:04.979915,2025-04-24 23:15:05.568961,0 days 00:00:00.589046,22.13253646857306,0.006174624688309713,0.00380690920879614,rbf,TPESampler,COMPLETE
409,0.2078565756085707,2025-04-24 23:15:05.729005,2025-04-24 23:15:06.521652,0 days 00:00:00.792647,97.29361635064963,0.029732970764582214,0.010307315821800367,rbf,TPESampler,COMPLETE
410,0.7872380166876836,2025-04-24 23:15:06.681484,2025-04-24 23:15:07.222929,0 days 00:00:00.541445,34.90399805027828,0.011987360293697147,0.0012893139952268832,poly,TPESampler,COMPLETE
411,0.7708266667493147,2025-04-24 23:15:07.384529,2025-04-24 23:15:08.024327,0 days 00:00:00.639798,0.03802407993597095,0.002865100152645251,0.01623564013765412,poly,TPESampler,COMPLETE
412,0.20176803777378874,2025-04-24 23:15:08.178256,2025-04-24 23:15:08.795268,0 days 00:00:00.617012,16.470441609544437,0.013517175382889653,0.01174744523925713,rbf,TPESampler,COMPLETE
413,0.20107337994055374,2025-04-24 23:15:08.956412,2025-04-24 23:15:09.688633,0 days 00:00:00.732221,93.96607666176942,0.007230009124058614,0.0034701522900532646,rbf,TPESampler,COMPLETE
414,0.1992739821563683,2025-04-24 23:15:09.852034,2025-04-24 23:15:10.852590,0 days 00:00:01.000556,82.39715070681142,0.005193364195559112,0.01365923195054337,rbf,TPESampler,COMPLETE
415,0.26320027816528035,2025-04-24 23:15:11.014178,2025-04-24 23:15:11.578996,0 days 00:00:00.564818,11.7282887870985,0.020012141035471123,0.005579599430147986,rbf,TPESampler,COMPLETE
416,0.25895077607787226,2025-04-24 23:15:11.736029,2025-04-24 23:15:12.291917,0 days 00:00:00.555888,87.27003018683574,0.050954830719463336,0.001141822890648274,rbf,TPESampler,COMPLETE
417,0.26341766957137935,2025-04-24 23:15:12.450303,2025-04-24 23:16:24.882542,0 days 00:01:12.432239,95.9049589304736,0.06870256843805152,0.0019074170628891492,linear,TPESampler,COMPLETE
418,0.1932459516388198,2025-04-24 23:16:25.045453,2025-04-24 23:16:25.667321,0 days 00:00:00.621868,81.8116227675223,0.034674191161653184,0.00421710850403588,rbf,TPESampler,COMPLETE
419,10.800640679679521,2025-04-24 23:16:25.830272,2025-04-25 05:02:33.513398,0 days 05:46:07.683126,94.65693619581131,0.002142182396922421,0.2952264260151069,poly,TPESampler,COMPLETE
420,0.17253594387720234,2025-04-24 23:21:14.171981,2025-04-24 23:21:15.149862,0 days 00:00:00.977881,96.86871418206348,0.026527370067091494,0.00615609422868017,rbf,TPESampler,COMPLETE
421,0.8201495165392831,2025-04-24 23:21:15.449141,2025-04-24 23:21:15.918740,0 days 00:00:00.469599,83.36760056902136,0.5570673682095307,0.0007435346075287042,poly,TPESampler,COMPLETE
422,0.18297414777004178,2025-04-24 23:21:16.074701,2025-04-24 23:21:16.945666,0 days 00:00:00.870965,96.85601195729735,0.025466295431170693,0.01868706831815922,rbf,TPESampler,COMPLETE
423,0.702516526619497,2025-04-24 23:21:17.104216,2025-04-24 23:21:19.158700,0 days 00:00:02.054484,91.81313289494395,0.047645243498466654,0.00824924321155484,poly,TPESampler,COMPLETE
424,0.34805924350445994,2025-04-24 23:21:19.315261,2025-04-24 23:21:20.097241,0 days 00:00:00.781980,6.421674197113138,0.03755407043502753,0.0031392171835967434,rbf,TPESampler,COMPLETE
425,0.18340631804275592,2025-04-24 23:21:20.361271,2025-04-24 23:21:21.004740,0 days 00:00:00.643469,93.3512491024017,0.048048434893917136,0.004420163509702031,rbf,TPESampler,COMPLETE
426,0.27588595037218816,2025-04-24 23:21:21.163596,2025-04-24 23:21:21.721574,0 days 00:00:00.557978,19.434537631575125,0.03552365586387773,0.003167309088257179,rbf,TPESampler,COMPLETE
427,0.3026750783004557,2025-04-24 23:21:21.876622,2025-04-24 23:21:22.483008,0 days 00:00:00.606386,79.72410802279074,0.015189463922525808,0.0007619498987312251,rbf,TPESampler,COMPLETE
428,461.26149645779714,2025-04-24 23:21:22.640708,2025-04-24 23:21:23.196346,0 days 00:00:00.555638,60.71784111405694,0.06881893034449861,0.009795417863154203,sigmoid,TPESampler,COMPLETE
429,0.21933594452116453,2025-04-24 23:21:23.352717,2025-04-24 23:21:24.228378,0 days 00:00:00.875661,98.71242743407605,0.02241582742052874,0.002089422933614247,rbf,TPESampler,COMPLETE
430,0.27569687811870225,2025-04-24 23:21:24.390042,2025-04-24 23:21:39.876608,0 days 00:00:15.486566,17.255186184124113,0.016091117312801127,0.00992132728199797,linear,TPESampler,COMPLETE
431,0.22092101710238882,2025-04-24 23:21:40.036970,2025-04-24 23:21:40.627916,0 days 00:00:00.590946,11.305155404157544,0.03571894506669695,0.036503154678854004,rbf,TPESampler,COMPLETE
432,0.21108999841015075,2025-04-24 23:21:40.786165,2025-04-24 23:21:41.378646,0 days 00:00:00.592481,17.82601886063417,0.03144283152855986,0.008896479498386973,rbf,TPESampler,COMPLETE
433,0.20910105078519853,2025-04-24 23:21:41.540972,2025-04-24 23:21:42.382753,0 days 00:00:00.841781,74.2732526703491,0.026079429465955876,0.011988285789005916,rbf,TPESampler,COMPLETE
434,0.2350395016819396,2025-04-24 23:21:42.544474,2025-04-24 23:21:43.119228,0 days 00:00:00.574754,13.1861404896152,0.04038781689489448,0.007505659851311208,rbf,TPESampler,COMPLETE
435,0.55643473933085,2025-04-24 23:21:43.284294,2025-04-24 23:21:43.723492,0 days 00:00:00.439198,0.010313522547880939,0.9226924257675242,0.040711537202947255,linear,TPESampler,COMPLETE
436,0.21083465163098067,2025-04-24 23:21:43.880190,2025-04-24 23:21:44.594790,0 days 00:00:00.714600,89.31147359665559,0.0427757692235111,0.010814381389622369,rbf,TPESampler,COMPLETE
437,0.17553792548317468,2025-04-24 23:21:44.774196,2025-04-24 23:21:45.495447,0 days 00:00:00.721251,90.1663977073509,0.02279727924943173,0.005417417020328813,rbf,TPESampler,COMPLETE
438,0.3737405167122456,2025-04-24 23:21:45.659366,2025-04-24 23:21:46.224066,0 days 00:00:00.564700,17.641633824652104,0.01312218113871198,0.0010703157542911665,rbf,TPESampler,COMPLETE
439,0.20810279499301024,2025-04-24 23:21:46.382175,2025-04-24 23:21:47.063465,0 days 00:00:00.681290,84.27238511730394,0.02231073536506686,0.00301746060422836,rbf,TPESampler,COMPLETE
440,0.20686525138618939,2025-04-24 23:21:47.222087,2025-04-24 23:21:47.892121,0 days 00:00:00.670034,87.86396651321907,0.015459229607626506,0.003093283364749024,rbf,TPESampler,COMPLETE
441,0.25075342597822897,2025-04-24 23:21:48.054029,2025-04-24 23:21:48.650576,0 days 00:00:00.596547,22.292106222355393,0.01875512337728451,0.0037336538926580035,rbf,TPESampler,COMPLETE
442,0.5629545363006347,2025-04-24 23:21:48.809911,2025-04-24 23:21:49.347156,0 days 00:00:00.537245,5.163283232563071,0.8433583468709555,0.0012024059653962364,linear,TPESampler,COMPLETE
443,0.2057317336757123,2025-04-24 23:21:49.503138,2025-04-24 23:21:50.196474,0 days 00:00:00.693336,98.77574791134558,0.027441065696226206,0.0028691506162989,rbf,TPESampler,COMPLETE
444,0.19329055007891127,2025-04-24 23:21:50.353233,2025-04-24 23:21:51.260708,0 days 00:00:00.907475,91.36707328818565,0.017504275443754352,0.008661177612338266,rbf,TPESampler,COMPLETE
445,0.23292997187923864,2025-04-24 23:21:51.424701,2025-04-24 23:21:52.010239,0 days 00:00:00.585538,18.329028107284493,0.023636852212973177,0.005462557897561091,rbf,TPESampler,COMPLETE
446,0.2537982928598201,2025-04-24 23:21:52.164813,2025-04-24 23:21:52.702537,0 days 00:00:00.537724,60.1846398124801,0.08743974105869351,0.0017558777023387732,rbf,TPESampler,COMPLETE
447,0.3080184517743838,2025-04-24 23:21:52.859492,2025-04-24 23:21:53.436828,0 days 00:00:00.577336,13.026582982882928,0.013208169192687197,0.0030021247242231104,rbf,TPESampler,COMPLETE
448,0.2074488907850393,2025-04-24 23:21:53.598646,2025-04-24 23:21:54.132607,0 days 00:00:00.533961,97.99582879366568,0.14249932452138378,0.00390662778467649,rbf,TPESampler,COMPLETE
449,0.19007312408292645,2025-04-24 23:21:54.295237,2025-04-24 23:21:55.039989,0 days 00:00:00.744752,99.83459537881343,0.02107313277750579,0.003934398349531874,rbf,TPESampler,COMPLETE
450,0.216117627780608,2025-04-24 23:21:55.216929,2025-04-24 23:21:55.925739,0 days 00:00:00.708810,92.56094970187716,0.015397296389084844,0.0022974962094855396,rbf,TPESampler,COMPLETE
451,0.27576533798015745,2025-04-24 23:21:56.085962,2025-04-24 23:22:21.050976,0 days 00:00:24.965014,33.27168740276295,0.0037562501776012363,0.0002606657955397011,linear,TPESampler,COMPLETE
452,0.2079001748156168,2025-04-24 23:22:21.210236,2025-04-24 23:22:22.243226,0 days 00:00:01.032990,99.13521879967966,0.018958986879651436,0.010105313677700052,rbf,TPESampler,COMPLETE
453,0.21004794911392813,2025-04-24 23:22:22.403189,2025-04-24 23:22:23.125027,0 days 00:00:00.721838,16.05208372343802,0.006836878169251937,0.03280705023542044,rbf,TPESampler,COMPLETE
454,0.1978121315010955,2025-04-24 23:22:23.283877,2025-04-24 23:22:24.006179,0 days 00:00:00.722302,98.03861600293712,0.014331219875418962,0.0035912813875763634,rbf,TPESampler,COMPLETE
455,0.3225459686634992,2025-04-24 23:22:24.171789,2025-04-24 23:22:24.719067,0 days 00:00:00.547278,20.106365900310628,0.05501184292568486,0.0017969352484394744,rbf,TPESampler,COMPLETE
456,0.20703817056325957,2025-04-24 23:22:24.885895,2025-04-24 23:22:25.446626,0 days 00:00:00.560731,18.365286830482525,0.06609218393224012,0.010975052129767855,rbf,TPESampler,COMPLETE
457,0.18828732318566932,2025-04-24 23:22:25.607085,2025-04-24 23:22:26.264071,0 days 00:00:00.656986,19.944476922071573,0.019071643225901113,0.018962822869452545,rbf,TPESampler,COMPLETE
458,0.20887135964587314,2025-04-24 23:22:26.435559,2025-04-24 23:22:27.002560,0 days 00:00:00.567001,90.04248113520627,0.08388031315298898,0.002952772061042408,rbf,TPESampler,COMPLETE
459,0.19858730798103189,2025-04-24 23:22:27.163915,2025-04-24 23:22:28.210483,0 days 00:00:01.046568,99.37408778277599,0.0126370707404543,0.012313249935391414,rbf,TPESampler,COMPLETE
460,62.205332097098896,2025-04-24 23:22:28.371475,2025-04-24 23:22:28.912283,0 days 00:00:00.540808,74.93648276072767,0.0038572152197833545,0.0025309966092658606,sigmoid,TPESampler,COMPLETE
461,0.21145472468025914,2025-04-24 23:22:29.072003,2025-04-24 23:22:30.117070,0 days 00:00:01.045067,95.86852904721177,0.037350882519152875,0.009820383047158415,rbf,TPESampler,COMPLETE
462,0.5646440541964852,2025-04-24 23:22:30.272310,2025-04-24 23:22:30.802488,0 days 00:00:00.530178,2.7237647180242774,0.0789317466760015,0.00041496256935159777,sigmoid,TPESampler,COMPLETE
463,0.21016534497338285,2025-04-24 23:22:30.960813,2025-04-24 23:22:31.668556,0 days 00:00:00.707743,92.37017334960426,0.004146459061821175,0.0027003012124413575,rbf,TPESampler,COMPLETE
464,0.21188178153638973,2025-04-24 23:22:31.824890,2025-04-24 23:22:32.407175,0 days 00:00:00.582285,13.460527242865519,0.02991455563498256,0.01126983955133325,rbf,TPESampler,COMPLETE
465,0.26484607977287744,2025-04-24 23:22:32.569134,2025-04-24 23:22:33.135617,0 days 00:00:00.566483,12.744256645483516,0.04487273270341699,0.005240441808963428,rbf,TPESampler,COMPLETE
466,0.31146990315090556,2025-04-24 23:22:33.297863,2025-04-24 23:22:33.882065,0 days 00:00:00.584202,15.73564460052971,0.006435027433399876,0.0024699258092415115,rbf,TPESampler,COMPLETE
467,0.2135472955602982,2025-04-24 23:22:34.042977,2025-04-24 23:22:34.677232,0 days 00:00:00.634255,93.13188240823806,0.03789600339717359,0.00260070774776146,rbf,TPESampler,COMPLETE
468,0.2444410453150779,2025-04-24 23:22:34.840879,2025-04-24 23:22:35.420974,0 days 00:00:00.580095,14.015393892451156,0.013818384801844722,0.006027645915010539,rbf,TPESampler,COMPLETE
469,0.8381921937105113,2025-04-24 23:22:35.576547,2025-04-24 23:22:36.114496,0 days 00:00:00.537949,0.0025495674127271302,0.013245598972599491,0.22628759826677425,sigmoid,TPESampler,COMPLETE
470,0.1929051521569088,2025-04-24 23:22:36.273744,2025-04-24 23:22:36.915465,0 days 00:00:00.641721,91.86043854345282,0.05656313464764896,0.007965465474057938,rbf,TPESampler,COMPLETE
