number,value,datetime_start,datetime_complete,duration,params_C,params_epsilon,params_gamma,params_kernel,system_attrs_auto:sampler,state
2348,0.19044690430016387,2025-04-25 12:03:03.944256,2025-04-25 12:03:04.984065,0 days 00:00:01.039809,92.66001394917886,0.016417632691393156,0.014830500750618312,rbf,TPESampler,COMPLETE
2349,0.18884059785337598,2025-04-25 12:03:05.171725,2025-04-25 12:03:06.316976,0 days 00:00:01.145251,76.78724652823425,0.00812033508773352,0.018372530546725222,rbf,TPESampler,COMPLETE
2350,0.20512702479925637,2025-04-25 12:03:06.513049,2025-04-25 12:03:07.255730,0 days 00:00:00.742681,26.04437832786325,0.019445157713726284,0.022494298288411596,rbf,TPESampler,COMPLETE
2351,0.7692550065737649,2025-04-25 12:03:07.446229,2025-04-25 12:03:08.045412,0 days 00:00:00.599183,0.0243430779112265,0.08626832887288852,0.2809545907400782,rbf,TPESampler,COMPLETE
2352,0.21506890088625852,2025-04-25 12:03:08.233224,2025-04-25 12:03:09.062823,0 days 00:00:00.829599,29.154007533016664,0.013139275358576648,0.044309844324168436,rbf,TPESampler,COMPLETE
2353,0.8286774185079734,2025-04-25 12:03:09.253756,2025-04-25 12:03:09.838587,0 days 00:00:00.584831,0.11552685102289821,0.020929104704840235,0.006044391799130644,poly,TPESampler,COMPLETE
2354,0.405320570501978,2025-04-25 12:03:10.024234,2025-04-25 12:03:10.670496,0 days 00:00:00.646262,86.15729164397796,0.008164574931747246,0.26549865699081276,rbf,TPESampler,COMPLETE
2355,0.1699941278896334,2025-04-25 12:03:10.857355,2025-04-25 12:03:11.832023,0 days 00:00:00.974668,96.05360369981173,0.020776465339126242,0.024622172061503442,rbf,TPESampler,COMPLETE
2356,0.4306374324183564,2025-04-25 12:03:12.023607,2025-04-25 12:03:12.637477,0 days 00:00:00.613870,97.69774122109553,0.015137283352589197,0.3332923175978162,rbf,TPESampler,COMPLETE
2357,0.7437484250354197,2025-04-25 12:03:12.821578,2025-04-25 12:03:13.441322,0 days 00:00:00.619744,0.24677004543940978,0.2922491278790576,0.8032867209484563,rbf,TPESampler,COMPLETE
2358,0.21945406217868424,2025-04-25 12:03:13.622939,2025-04-25 12:03:14.425404,0 days 00:00:00.802465,16.76928940463857,0.008762242258567523,0.04299321788883138,rbf,TPESampler,COMPLETE
2359,0.17192004545346765,2025-04-25 12:03:14.615492,2025-04-25 12:03:15.898071,0 days 00:00:01.282579,97.5095096599173,0.01080458528240113,0.023802180278050467,rbf,TPESampler,COMPLETE
2360,0.5955522746504558,2025-04-25 12:03:16.235653,2025-04-25 12:05:08.356923,0 days 00:01:52.121270,1.4436391279199399,0.05706223594166186,0.06710525664711785,poly,TPESampler,COMPLETE
2361,0.9015571669656728,2025-04-25 12:05:08.545742,2025-04-25 12:05:09.126920,0 days 00:00:00.581178,0.003045028479454306,0.0024321078480897974,0.00011834590118383233,poly,TPESampler,COMPLETE
2362,0.22074197122068115,2025-04-25 12:05:09.319558,2025-04-25 12:05:09.966999,0 days 00:00:00.647441,19.26254356327123,0.01946422440134984,0.0069225960761232705,rbf,TPESampler,COMPLETE
2363,0.211152278878796,2025-04-25 12:05:10.162928,2025-04-25 12:05:10.866360,0 days 00:00:00.703432,16.35934565378937,0.02395223613655827,0.03526582508381202,rbf,TPESampler,COMPLETE
2364,0.18755406714276374,2025-04-25 12:05:11.061903,2025-04-25 12:05:12.308065,0 days 00:00:01.246162,96.47685144457955,0.014925118595717575,0.016386119806107616,rbf,TPESampler,COMPLETE
2365,0.20451379952552434,2025-04-25 12:05:12.493988,2025-04-25 12:05:13.278410,0 days 00:00:00.784422,22.635316113383908,0.008102092431858086,0.02445121127666764,rbf,TPESampler,COMPLETE
2366,0.222029359016949,2025-04-25 12:05:13.464544,2025-04-25 12:05:14.222699,0 days 00:00:00.758155,21.097288557673888,0.0153029494048197,0.04523445061047332,rbf,TPESampler,COMPLETE
2367,0.23590504567841858,2025-04-25 12:05:14.407288,2025-04-25 12:05:15.522199,0 days 00:00:01.114911,97.46475801984731,0.014308854059012025,0.053859768648006345,rbf,TPESampler,COMPLETE
2368,0.21948963599529298,2025-04-25 12:05:15.715912,2025-04-25 12:05:16.369012,0 days 00:00:00.653100,20.351452677684804,0.008057273989383605,0.006324791303033982,rbf,TPESampler,COMPLETE
2369,0.2187373078491355,2025-04-25 12:05:16.561341,2025-04-25 12:05:17.359253,0 days 00:00:00.797912,20.335943268864234,0.010416085273592834,0.04341024261335727,rbf,TPESampler,COMPLETE
2370,0.1944199138010394,2025-04-25 12:05:17.548980,2025-04-25 12:05:18.673127,0 days 00:00:01.124147,96.04984127655214,0.017398373377280195,0.013125178331244393,rbf,TPESampler,COMPLETE
2371,0.1870727359382248,2025-04-25 12:05:18.864392,2025-04-25 12:05:19.637256,0 days 00:00:00.772864,23.775422896319768,0.0073670367813722165,0.018501644038532047,rbf,TPESampler,COMPLETE
2372,0.1887061732014069,2025-04-25 12:05:19.831101,2025-04-25 12:05:20.934498,0 days 00:00:01.103397,83.7997943421635,0.011036355616717881,0.01819719663709357,rbf,TPESampler,COMPLETE
2373,0.3553714579842683,2025-04-25 12:05:21.118381,2025-04-25 12:05:21.921357,0 days 00:00:00.802976,75.09548696406192,0.013142330833292939,0.15496285717762132,rbf,TPESampler,COMPLETE
2374,0.18557668743964337,2025-04-25 12:05:22.114030,2025-04-25 12:05:22.878049,0 days 00:00:00.764019,95.66814448766048,0.0415984376000426,0.03454249654105607,rbf,TPESampler,COMPLETE
2375,186.71135324025548,2025-04-25 12:05:23.060483,2025-04-25 12:05:23.649228,0 days 00:00:00.588745,21.01266204244472,0.0073649445755688,0.011190522785865166,sigmoid,TPESampler,COMPLETE
2376,0.32821588338283625,2025-04-25 12:05:23.829638,2025-04-25 12:05:24.777438,0 days 00:00:00.947800,86.51945514053703,0.012218057401891505,0.11665673992034684,rbf,TPESampler,COMPLETE
2377,0.19317466223640872,2025-04-25 12:05:24.961041,2025-04-25 12:05:26.070553,0 days 00:00:01.109512,97.99702527714393,0.01230816701296173,0.013458681036179806,rbf,TPESampler,COMPLETE
2378,46.388116864681,2025-04-25 12:05:26.258051,2025-04-25 12:05:26.831530,0 days 00:00:00.573479,1.2855785983086838,0.0011802871919338687,0.9812977069660764,sigmoid,TPESampler,COMPLETE
2379,939.7876373809007,2025-04-25 12:05:27.021012,2025-04-25 12:05:27.607685,0 days 00:00:00.586673,74.69885308129545,0.013940401982817992,0.01605320641608713,sigmoid,TPESampler,COMPLETE
2380,0.2022050569750491,2025-04-25 12:05:27.792945,2025-04-25 12:05:28.396381,0 days 00:00:00.603436,16.44984572217915,0.04581834668401489,0.012907525531972894,rbf,TPESampler,COMPLETE
2381,0.20120495971472707,2025-04-25 12:05:28.582464,2025-04-25 12:05:29.421946,0 days 00:00:00.839482,24.850029047186077,0.008000792577159905,0.029668738028481,rbf,TPESampler,COMPLETE
2382,0.7725791579927986,2025-04-25 12:05:29.602094,2025-04-25 12:14:33.265447,0 days 00:09:03.663353,16.383802425420352,0.005574491790902972,0.08394577973888566,poly,TPESampler,COMPLETE
2383,0.2631732569915879,2025-04-25 12:14:33.554219,2025-04-25 12:15:34.118388,0 days 00:01:00.564169,88.69446532000936,0.06905391420021585,0.021116792226451984,linear,TPESampler,COMPLETE
2384,0.24981361551023157,2025-04-25 12:15:34.359624,2025-04-25 12:15:35.198828,0 days 00:00:00.839204,19.36001585519121,0.00880228476858848,0.06134485090497831,rbf,TPESampler,COMPLETE
2385,0.215351222063413,2025-04-25 12:15:35.396093,2025-04-25 12:15:36.249493,0 days 00:00:00.853400,22.882253687505095,0.006555548607765719,0.04243926820231811,rbf,TPESampler,COMPLETE
2386,0.19335317429512539,2025-04-25 12:15:36.431827,2025-04-25 12:15:37.253603,0 days 00:00:00.821776,87.49236193486594,0.0053964094584194365,0.00436586863224424,rbf,TPESampler,COMPLETE
2387,0.2385530458082171,2025-04-25 12:15:37.430147,2025-04-25 12:15:38.073916,0 days 00:00:00.643769,31.907916456183546,0.014195861730409022,0.0032096599711272595,rbf,TPESampler,COMPLETE
2388,0.18060489946790306,2025-04-25 12:15:38.257953,2025-04-25 12:15:39.052934,0 days 00:00:00.794981,91.45297561482796,0.01162651164664093,0.005152050034499139,rbf,TPESampler,COMPLETE
2389,0.22118703832505968,2025-04-25 12:15:39.236758,2025-04-25 12:15:39.834229,0 days 00:00:00.597471,11.665275370076792,0.04491266089364482,0.03584879007689233,rbf,TPESampler,COMPLETE
2390,0.27719491699518156,2025-04-25 12:15:40.022867,2025-04-25 12:16:16.427123,0 days 00:00:36.404256,43.86299463442205,0.010004832047110187,0.009850473055398047,linear,TPESampler,COMPLETE
2391,0.2639921972230365,2025-04-25 12:16:16.685192,2025-04-25 12:16:17.758093,0 days 00:00:01.072901,0.6358793276069777,0.047135200854390075,0.000499779535873717,linear,TPESampler,COMPLETE
2392,0.20398197550310873,2025-04-25 12:16:17.964286,2025-04-25 12:16:18.997759,0 days 00:00:01.033473,91.6085455616711,0.007401377931151233,0.011174861504325192,rbf,TPESampler,COMPLETE
2393,1.2067344987838295,2025-04-25 12:16:19.187136,2025-04-25 13:01:57.584920,0 days 00:45:38.397784,91.33966980791747,0.006051292404132912,0.1262373554425377,poly,TPESampler,COMPLETE
2394,0.1712140034543953,2025-04-25 13:01:57.777597,2025-04-25 13:01:59.004245,0 days 00:00:01.226648,94.03096904598532,0.009477457492192568,0.025309466900365354,rbf,TPESampler,COMPLETE
2395,0.6428574344803897,2025-04-25 13:01:59.187177,2025-04-25 13:02:00.220968,0 days 00:00:01.033791,12.185760063360263,0.013684069626871315,0.010136779452608252,poly,TPESampler,COMPLETE
2396,0.3017415615208226,2025-04-25 13:02:00.412579,2025-04-25 13:02:01.163471,0 days 00:00:00.750892,94.68513723505178,0.032058269527791894,0.09148011230184037,rbf,TPESampler,COMPLETE
2397,0.17440795345540644,2025-04-25 13:02:01.350848,2025-04-25 13:02:02.610495,0 days 00:00:01.259647,88.96886425671926,0.005577188646011207,0.024959600953913138,rbf,TPESampler,COMPLETE
2398,0.5918969530772122,2025-04-25 13:02:02.792601,2025-04-25 13:02:03.332347,0 days 00:00:00.539746,0.051546055895562125,0.25451432488439507,0.06096310296438907,rbf,TPESampler,COMPLETE
2399,0.23930018410526277,2025-04-25 13:02:03.519405,2025-04-25 13:02:04.147260,0 days 00:00:00.627855,6.304675214309783,0.005675109810250917,0.014803372982760273,rbf,TPESampler,COMPLETE
2400,0.7380586728822005,2025-04-25 13:02:04.334133,2025-04-25 13:02:05.502343,0 days 00:00:01.168210,80.97494215191392,0.006406986766166199,0.006608704223883558,poly,TPESampler,COMPLETE
2401,0.17258113604390074,2025-04-25 13:02:05.696085,2025-04-25 13:02:06.652896,0 days 00:00:00.956811,95.14636606613799,0.019943713039140793,0.029827779408357055,rbf,TPESampler,COMPLETE
2402,0.32610572892134676,2025-04-25 13:02:06.844209,2025-04-25 13:02:07.649335,0 days 00:00:00.805126,18.859584125522826,0.0041693092686971266,0.11545163672470045,rbf,TPESampler,COMPLETE
2403,0.20753363657560958,2025-04-25 13:02:07.832305,2025-04-25 13:02:08.725871,0 days 00:00:00.893566,33.29822114422629,0.011060157372950985,0.041165325335800224,rbf,TPESampler,COMPLETE
2404,645.0937373257658,2025-04-25 13:02:08.910564,2025-04-25 13:02:09.637261,0 days 00:00:00.726697,27.741360117243776,0.009174947913257495,0.09676383407051213,sigmoid,TPESampler,COMPLETE
2405,0.33738237103146446,2025-04-25 13:02:09.865102,2025-04-25 13:02:11.050836,0 days 00:00:01.185734,96.6034387141557,0.02110540038841108,0.12789990606783622,rbf,TPESampler,COMPLETE
2406,0.28408544584176304,2025-04-25 13:02:11.239958,2025-04-25 13:02:12.460569,0 days 00:00:01.220611,98.93063951280917,0.00828600711157711,0.07605103257683536,rbf,TPESampler,COMPLETE
2407,0.31182416558576226,2025-04-25 13:02:12.644496,2025-04-25 13:02:13.253805,0 days 00:00:00.609309,7.98615175962884,0.0058883050761032625,0.004259686568275254,rbf,TPESampler,COMPLETE
2408,0.19804406303719718,2025-04-25 13:02:13.439756,2025-04-25 13:02:14.501764,0 days 00:00:01.062008,97.39322707590209,0.0046810959552291195,0.012872358963893748,rbf,TPESampler,COMPLETE
2409,0.19393237475479422,2025-04-25 13:02:14.688151,2025-04-25 13:02:15.645065,0 days 00:00:00.956914,98.83790084105786,0.00882355278187598,0.008156750330572275,rbf,TPESampler,COMPLETE
2410,0.18966279627635724,2025-04-25 13:02:15.830877,2025-04-25 13:02:16.497652,0 days 00:00:00.666775,28.7952764426126,0.02475447806478835,0.009610389047553103,rbf,TPESampler,COMPLETE
2411,0.23237861729334588,2025-04-25 13:02:16.682105,2025-04-25 13:02:17.806228,0 days 00:00:01.124123,95.46860823208634,0.012822739925300058,0.052446829450058005,rbf,TPESampler,COMPLETE
2412,0.1887359788399908,2025-04-25 13:02:18.029859,2025-04-25 13:02:19.477286,0 days 00:00:01.447427,99.75987137900577,0.006258015232146718,0.015363837484879902,rbf,TPESampler,COMPLETE
2413,0.2516993011139721,2025-04-25 13:02:19.670941,2025-04-25 13:02:20.785273,0 days 00:00:01.114332,96.24513326919106,0.01493285698470242,0.06111450353568419,rbf,TPESampler,COMPLETE
2414,0.19430227186747243,2025-04-25 13:02:20.971644,2025-04-25 13:02:22.215146,0 days 00:00:01.243502,99.08848941869302,0.009123700998506217,0.04006616222200771,rbf,TPESampler,COMPLETE
2415,0.22446063703889127,2025-04-25 13:02:22.405821,2025-04-25 13:02:23.045402,0 days 00:00:00.639581,17.157655257114293,0.027926428204926444,0.006908337498862892,rbf,TPESampler,COMPLETE
2416,0.21632022978579596,2025-04-25 13:02:23.242007,2025-04-25 13:02:23.923203,0 days 00:00:00.681196,14.282031951336347,0.028731750109196805,0.038157183040193415,rbf,TPESampler,COMPLETE
2417,0.19996260010855627,2025-04-25 13:02:24.117963,2025-04-25 13:02:24.986245,0 days 00:00:00.868282,35.41821099038882,0.005112775907732904,0.020694408145032376,rbf,TPESampler,COMPLETE
2418,0.32304943137472586,2025-04-25 13:02:25.184233,2025-04-25 13:02:26.276665,0 days 00:00:01.092432,86.13671218535447,0.00632025566321956,0.10991524229396014,rbf,TPESampler,COMPLETE
2419,0.1995145413589338,2025-04-25 13:02:26.471553,2025-04-25 13:02:27.489987,0 days 00:00:01.018434,97.21924542942412,0.004893285105449283,0.008771444111819886,rbf,TPESampler,COMPLETE
2420,0.32883432136165774,2025-04-25 13:02:27.681833,2025-04-25 13:02:28.702546,0 days 00:00:01.020713,97.5381571656348,0.0073843007589105255,0.11620069530194706,rbf,TPESampler,COMPLETE
2421,0.20062963862934372,2025-04-25 13:02:29.114584,2025-04-25 13:02:29.951964,0 days 00:00:00.837380,24.625903341520484,0.004937380009372954,0.008748061495633133,rbf,TPESampler,COMPLETE
2422,0.2766917661998387,2025-04-25 13:02:30.144115,2025-04-25 13:03:28.574533,0 days 00:00:58.430418,90.22866858424446,0.0045584371374137195,0.0010697789083683226,linear,TPESampler,COMPLETE
2423,0.19817292285918414,2025-04-25 13:03:28.802299,2025-04-25 13:03:29.489905,0 days 00:00:00.687606,18.441546708277606,0.015044036919612286,0.011550344008024205,rbf,TPESampler,COMPLETE
2424,0.168585984536905,2025-04-25 13:03:29.689343,2025-04-25 13:03:31.021510,0 days 00:00:01.332167,96.53181603996438,0.009256444013371348,0.026806411654468912,rbf,TPESampler,COMPLETE
2425,0.2889958703644551,2025-04-25 13:03:31.214153,2025-04-25 13:03:31.861664,0 days 00:00:00.647511,16.645706989095775,0.03814482011284312,0.0814560975510378,rbf,TPESampler,COMPLETE
2426,0.20568317324557842,2025-04-25 13:03:32.054537,2025-04-25 13:03:32.748176,0 days 00:00:00.693639,20.89962267493255,0.02528138771667132,0.03189216472333362,rbf,TPESampler,COMPLETE
2427,0.22086574558563535,2025-04-25 13:03:32.937894,2025-04-25 13:03:33.605684,0 days 00:00:00.667790,18.060107616211596,0.006784711415856465,0.00684180897382341,rbf,TPESampler,COMPLETE
2428,0.3518090366069386,2025-04-25 13:03:33.787481,2025-04-25 13:03:34.453199,0 days 00:00:00.665718,5.856823720087023,0.014225305776337214,0.15320885222659275,rbf,TPESampler,COMPLETE
2429,0.2043223308174193,2025-04-25 13:03:34.642374,2025-04-25 13:03:35.331915,0 days 00:00:00.689541,18.001913615158767,0.021552763309249417,0.02433257160691073,rbf,TPESampler,COMPLETE
2430,0.2170130993479896,2025-04-25 13:03:35.520306,2025-04-25 13:03:36.592262,0 days 00:00:01.071956,26.06250933621415,0.019613244541629767,0.04375538583002743,rbf,TPESampler,COMPLETE
2431,0.2788624692181518,2025-04-25 13:03:36.879440,2025-04-25 13:03:37.694929,0 days 00:00:00.815489,23.377600267510296,0.008899991037408675,0.07714788353147904,rbf,TPESampler,COMPLETE
2432,0.20903861062784496,2025-04-25 13:03:37.883841,2025-04-25 13:03:38.548032,0 days 00:00:00.664191,19.10112319797187,0.017055417436073046,0.008803526386494637,rbf,TPESampler,COMPLETE
2433,0.20225947722166426,2025-04-25 13:03:38.734251,2025-04-25 13:03:39.495539,0 days 00:00:00.761288,22.519649965052878,0.014800515176765889,0.028883101551520428,rbf,TPESampler,COMPLETE
2434,0.6487791221581247,2025-04-25 13:03:39.686116,2025-04-25 13:03:40.379876,0 days 00:00:00.693760,8.526554672503146,0.0033619856812555256,0.008166544768549926,poly,TPESampler,COMPLETE
2435,0.2028565376194573,2025-04-25 13:03:40.570151,2025-04-25 13:03:41.350466,0 days 00:00:00.780315,23.354469765710252,0.009632838542717006,0.025805355099901273,rbf,TPESampler,COMPLETE
2436,0.22065752581969506,2025-04-25 13:03:41.541068,2025-04-25 13:03:42.380976,0 days 00:00:00.839908,22.90083982145643,0.007184256907616719,0.045661701390161145,rbf,TPESampler,COMPLETE
2437,0.2771309161511538,2025-04-25 13:03:42.570598,2025-04-25 13:04:41.456624,0 days 00:00:58.886026,91.17666133538866,0.018860005230655796,0.03098757315427104,linear,TPESampler,COMPLETE
2438,0.20771198837158122,2025-04-25 13:04:41.639837,2025-04-25 13:04:42.294654,0 days 00:00:00.654817,20.951965649635454,0.01283815693511657,0.008347167890368604,rbf,TPESampler,COMPLETE
2439,0.19703381091310287,2025-04-25 13:04:42.477658,2025-04-25 13:04:43.337314,0 days 00:00:00.859656,32.39817605865381,0.009827705330739435,0.024403268082394913,rbf,TPESampler,COMPLETE
2440,0.2197788924017184,2025-04-25 13:04:43.523552,2025-04-25 13:04:44.153984,0 days 00:00:00.630432,64.358671203374,0.07354136252148245,0.0114950823853638,rbf,TPESampler,COMPLETE
2441,0.17615922514191334,2025-04-25 13:04:44.339123,2025-04-25 13:04:45.409929,0 days 00:00:01.070806,94.93846204551198,0.015232034693414422,0.03325428992261969,rbf,TPESampler,COMPLETE
2442,0.20315861019411569,2025-04-25 13:04:45.597351,2025-04-25 13:04:46.524647,0 days 00:00:00.927296,23.9621381547299,0.006835723478153665,0.032333715916045634,rbf,TPESampler,COMPLETE
2443,0.38204905985779,2025-04-25 13:04:46.789061,2025-04-25 13:04:47.483145,0 days 00:00:00.694084,93.60036821529407,0.009873947873559526,0.20834313084053976,rbf,TPESampler,COMPLETE
2444,0.6722244876454085,2025-04-25 13:04:47.673338,2025-04-25 13:04:48.318109,0 days 00:00:00.644771,0.017484487479402473,0.00576483651066672,0.04968111507074197,poly,TPESampler,COMPLETE
2445,0.3415677469338337,2025-04-25 13:04:48.507884,2025-04-25 13:04:49.197776,0 days 00:00:00.689892,19.935071889921993,0.021345543330228523,0.13744078190887868,rbf,TPESampler,COMPLETE
2446,0.19398385622829153,2025-04-25 13:04:49.387974,2025-04-25 13:04:50.359147,0 days 00:00:00.971173,93.00744713067598,0.011105935811894688,0.013673752165040859,rbf,TPESampler,COMPLETE
2447,2150.039365110465,2025-04-25 13:04:50.547235,2025-04-25 13:04:51.128957,0 days 00:00:00.581722,88.67936839076802,0.017095006337383475,0.24856957136631547,sigmoid,TPESampler,COMPLETE
2448,0.2944547008119535,2025-04-25 13:04:51.316160,2025-04-25 13:04:51.928330,0 days 00:00:00.612170,3.4654848417885256,0.01743964725857858,0.011935324738829902,rbf,TPESampler,COMPLETE
2449,0.5421932418876186,2025-04-25 13:04:52.116913,2025-04-25 13:04:52.709184,0 days 00:00:00.592271,1.0144860306324082,0.010811153244083412,0.0007921834853238984,rbf,TPESampler,COMPLETE
2450,0.17486962439991938,2025-04-25 13:04:52.901234,2025-04-25 13:04:54.144465,0 days 00:00:01.243231,96.78119687163598,0.011422545855138414,0.022623197467852647,rbf,TPESampler,COMPLETE
2451,0.23127050003277422,2025-04-25 13:04:54.344624,2025-04-25 13:04:55.062757,0 days 00:00:00.718133,22.71144537189576,0.021712446406126844,0.05158010735088306,rbf,TPESampler,COMPLETE
2452,0.1859204565998763,2025-04-25 13:04:55.251168,2025-04-25 13:04:55.994783,0 days 00:00:00.743615,80.68171860172987,0.01841281227389643,0.004871423144406545,rbf,TPESampler,COMPLETE
2453,0.3568818216721072,2025-04-25 13:04:56.183460,2025-04-25 13:04:56.893680,0 days 00:00:00.710220,98.42946242806687,0.016229121589591375,0.15851934470490514,rbf,TPESampler,COMPLETE
2454,0.20233221570281457,2025-04-25 13:04:57.079276,2025-04-25 13:04:57.820587,0 days 00:00:00.741311,82.82597441581295,0.018921300542348602,0.0034170192162515964,rbf,TPESampler,COMPLETE
2455,0.2765291460374139,2025-04-25 13:04:58.005201,2025-04-25 13:04:58.845497,0 days 00:00:00.840296,21.7174755446106,0.0067481743792941196,0.07603367259604607,rbf,TPESampler,COMPLETE
2456,0.20145845817819472,2025-04-25 13:04:59.033184,2025-04-25 13:04:59.695679,0 days 00:00:00.662495,14.258220733021142,0.017196865798456647,0.014433977802146086,rbf,TPESampler,COMPLETE
2457,0.1985067955525164,2025-04-25 13:04:59.890642,2025-04-25 13:05:00.944885,0 days 00:00:01.054243,90.5634763893505,0.007787882151811151,0.01312183386401453,rbf,TPESampler,COMPLETE
2458,0.18266008345731302,2025-04-25 13:05:01.136430,2025-04-25 13:05:01.830709,0 days 00:00:00.694279,96.51766427734152,0.05305322039937586,0.030966122575984384,rbf,TPESampler,COMPLETE
2459,0.3937590160996504,2025-04-25 13:05:02.019930,2025-04-25 13:05:02.589963,0 days 00:00:00.570033,0.8227576489291348,0.44734118944563894,0.0006250332757614162,linear,TPESampler,COMPLETE
2460,0.26858547802620075,2025-04-25 13:05:02.772749,2025-04-25 13:05:03.565335,0 days 00:00:00.792586,24.51875904382553,0.013367263718224446,0.07126204108488682,rbf,TPESampler,COMPLETE
2461,0.1757399271259492,2025-04-25 13:05:03.744723,2025-04-25 13:05:04.829623,0 days 00:00:01.084900,93.47609634560133,0.012590535424205044,0.022733564390804584,rbf,TPESampler,COMPLETE
2462,0.18316204886531123,2025-04-25 13:05:05.012316,2025-04-25 13:05:06.254873,0 days 00:00:01.242557,95.13771021797498,0.015081347184139558,0.019931699325954354,rbf,TPESampler,COMPLETE
2463,0.17694249692740155,2025-04-25 13:05:06.441758,2025-04-25 13:05:07.796600,0 days 00:00:01.354842,91.46619961204202,0.004695603644421804,0.02328639437912575,rbf,TPESampler,COMPLETE
2464,0.2877301827089209,2025-04-25 13:05:07.985963,2025-04-25 13:05:09.211310,0 days 00:00:01.225347,95.98006004172188,0.005452200860383774,0.077977244859509,rbf,TPESampler,COMPLETE
