number,value,datetime_start,datetime_complete,duration,params_C,params_epsilon,params_gamma,params_kernel,system_attrs_auto:sampler,state
1879,0.21667191177619385,2025-04-25 08:21:20.788286,2025-04-25 08:21:21.410355,0 days 00:00:00.622069,29.364450499616556,0.05869279112846793,0.018900824491498512,rbf,TPESampler,COMPLETE
1880,0.2772258050656443,2025-04-25 08:21:21.586579,2025-04-25 08:22:06.559443,0 days 00:00:44.972864,84.41550631500313,0.024658112150034883,0.12446134736303989,linear,TPESampler,COMPLETE
1881,0.20085467457004955,2025-04-25 08:22:07.021056,2025-04-25 08:22:08.035325,0 days 00:00:01.014269,82.50223512703455,0.013680903034916245,0.013176412573775822,rbf,TPESampler,COMPLETE
1882,0.23182841243881958,2025-04-25 08:22:08.218196,2025-04-25 08:22:08.873826,0 days 00:00:00.655630,23.037595201809115,0.10047313945070273,0.034571761886019334,rbf,TPESampler,COMPLETE
1883,0.228315341021072,2025-04-25 08:22:09.261049,2025-04-25 08:22:10.270549,0 days 00:00:01.009500,78.37918757296265,0.057057244375874346,0.05035699348401867,rbf,TPESampler,COMPLETE
1884,0.1850320763894153,2025-04-25 08:22:10.482289,2025-04-25 08:22:11.208707,0 days 00:00:00.726418,30.589995049189262,0.0329655346215165,0.013961090626274486,rbf,TPESampler,COMPLETE
1885,0.19972159018434685,2025-04-25 08:22:11.568377,2025-04-25 08:22:12.597727,0 days 00:00:01.029350,96.32334945074147,0.010482460264784395,0.012119759516542535,rbf,TPESampler,COMPLETE
1886,0.1968027842040841,2025-04-25 08:22:12.781369,2025-04-25 08:22:13.786171,0 days 00:00:01.004802,95.07487332878712,0.023333948826621136,0.008767691263517672,rbf,TPESampler,COMPLETE
1887,20.092630164492785,2025-04-25 08:22:13.976037,2025-04-25 08:22:14.573013,0 days 00:00:00.596976,0.6112500032806661,0.18711678611123242,0.6203243682340444,sigmoid,TPESampler,COMPLETE
1888,0.180849355477789,2025-04-25 08:22:14.760602,2025-04-25 08:22:15.849412,0 days 00:00:01.088810,87.43268722950539,0.013571348290782497,0.022045672059488694,rbf,TPESampler,COMPLETE
1889,0.22040143419886704,2025-04-25 08:22:16.032553,2025-04-25 08:22:16.646298,0 days 00:00:00.613745,13.959703064602214,0.02110328579119776,0.009343229906573417,rbf,TPESampler,COMPLETE
1890,0.4045492630416212,2025-04-25 08:22:16.829047,2025-04-25 08:22:17.431755,0 days 00:00:00.602708,13.793041579278224,0.021254926503126926,0.2602324702164194,rbf,TPESampler,COMPLETE
1891,0.20511580756601444,2025-04-25 08:22:17.617296,2025-04-25 08:22:18.502216,0 days 00:00:00.884920,33.37764206798898,0.01393249764063597,0.038734508755157555,rbf,TPESampler,COMPLETE
1892,0.8999842595197076,2025-04-25 08:22:18.697314,2025-04-25 08:22:19.258504,0 days 00:00:00.561190,0.3079512118880399,0.003591402807808224,0.00028029089402314397,poly,TPESampler,COMPLETE
1893,0.2613975832382161,2025-04-25 08:22:19.437668,2025-04-25 08:22:20.182985,0 days 00:00:00.745317,20.759262883998954,0.01626879056744223,0.06718515680374625,rbf,TPESampler,COMPLETE
1894,0.27932764326242854,2025-04-25 08:22:20.369164,2025-04-25 08:22:21.170330,0 days 00:00:00.801166,27.746246401474718,0.017075414497622253,0.0764125521687642,rbf,TPESampler,COMPLETE
1895,0.20698623359316312,2025-04-25 08:22:21.360305,2025-04-25 08:22:22.036949,0 days 00:00:00.676644,19.601144441104633,0.03761656361441286,0.028203895429869723,rbf,TPESampler,COMPLETE
1896,0.3174842232678869,2025-04-25 08:22:22.234341,2025-04-25 08:22:22.984621,0 days 00:00:00.750280,82.62466645469378,0.030791397941495446,0.10727232751376048,rbf,TPESampler,COMPLETE
1897,0.1974206913076204,2025-04-25 08:22:23.180626,2025-04-25 08:22:24.073642,0 days 00:00:00.893016,96.07546344534771,0.024758911963853655,0.012285563410135647,rbf,TPESampler,COMPLETE
1898,0.19015786058826167,2025-04-25 08:22:24.259116,2025-04-25 08:22:25.064673,0 days 00:00:00.805557,98.76941311986921,0.02730653215194076,0.0384309174471749,rbf,TPESampler,COMPLETE
1899,0.1795984533204461,2025-04-25 08:22:25.243879,2025-04-25 08:22:26.324334,0 days 00:00:01.080455,93.1798508558831,0.011925794843485334,0.02171128195422921,rbf,TPESampler,COMPLETE
1900,0.19007809251305896,2025-04-25 08:22:26.512251,2025-04-25 08:22:27.477577,0 days 00:00:00.965326,89.03943475875776,0.014426831171124938,0.008373692835330095,rbf,TPESampler,COMPLETE
1901,0.1731095574632164,2025-04-25 08:22:27.885540,2025-04-25 08:22:29.036866,0 days 00:00:01.151326,88.4139073720372,0.0151524335854711,0.024881645219019213,rbf,TPESampler,COMPLETE
1902,0.18934546698347166,2025-04-25 08:22:29.219766,2025-04-25 08:22:30.054053,0 days 00:00:00.834287,97.05449885163011,0.029686659017708734,0.014895309925571337,rbf,TPESampler,COMPLETE
1903,262.63317833491476,2025-04-25 08:22:30.231744,2025-04-25 08:22:30.812151,0 days 00:00:00.580407,12.954432274890499,0.008830013280028732,0.03358910208598774,sigmoid,TPESampler,COMPLETE
1904,0.19231696271464815,2025-04-25 08:22:30.986913,2025-04-25 08:22:31.701823,0 days 00:00:00.714910,17.45025880197163,0.008722691819985582,0.022294640573078034,rbf,TPESampler,COMPLETE
1905,879.88835978318,2025-04-25 08:22:31.888952,2025-04-25 08:22:32.465847,0 days 00:00:00.576895,96.18389823851295,0.008211599696643257,0.011544214547699057,sigmoid,TPESampler,COMPLETE
1906,0.20338068815890814,2025-04-25 08:22:32.652748,2025-04-25 08:22:33.355887,0 days 00:00:00.703139,14.752256108935116,0.02091497824674283,0.012818217129588765,rbf,TPESampler,COMPLETE
1907,0.1712438311240627,2025-04-25 08:22:33.539795,2025-04-25 08:22:34.823902,0 days 00:00:01.284107,93.50114802238686,0.007963566128209469,0.02579020368800701,rbf,TPESampler,COMPLETE
1908,0.4119373830326355,2025-04-25 08:22:35.007896,2025-04-25 08:22:35.649098,0 days 00:00:00.641202,85.59640381673294,0.010181886513474639,0.28275627680293514,rbf,TPESampler,COMPLETE
1909,0.3431678360881456,2025-04-25 08:22:35.832743,2025-04-25 08:22:40.630451,0 days 00:00:04.797708,60.13254567286495,0.35661894525894006,0.4545764299911897,linear,TPESampler,COMPLETE
1910,0.25659304194621657,2025-04-25 08:22:40.813274,2025-04-25 08:22:41.374269,0 days 00:00:00.560995,94.63161449541558,0.1260322041566951,0.05734348019105246,rbf,TPESampler,COMPLETE
1911,0.18073275688922977,2025-04-25 08:22:41.547791,2025-04-25 08:22:43.103173,0 days 00:00:01.555382,91.77207240213046,0.001023760553490469,0.022043076836459296,rbf,TPESampler,COMPLETE
1912,0.2652248522659224,2025-04-25 08:22:43.295745,2025-04-25 08:22:44.018625,0 days 00:00:00.722880,14.90284655722319,0.017358527261159287,0.06947365298776287,rbf,TPESampler,COMPLETE
1913,0.16813997782578072,2025-04-25 08:22:44.254368,2025-04-25 08:22:45.957703,0 days 00:00:01.703335,97.39706757785474,0.013925170257737075,0.027807772910658637,rbf,TPESampler,COMPLETE
1914,0.18781978192605095,2025-04-25 08:22:46.385704,2025-04-25 08:22:48.211940,0 days 00:00:01.826236,93.74503647140004,0.0246315918940034,0.017471815353457137,rbf,TPESampler,COMPLETE
1915,0.37821893403627105,2025-04-25 08:22:48.657671,2025-04-25 08:22:49.660040,0 days 00:00:01.002369,54.49739039912136,0.022660697019790312,0.19981154625505687,rbf,TPESampler,COMPLETE
1916,0.277303910414464,2025-04-25 08:22:49.884769,2025-04-25 08:23:37.434146,0 days 00:00:47.549377,66.3430194434714,0.008669759168756523,0.07068154319708062,linear,TPESampler,COMPLETE
1917,0.20769413422498526,2025-04-25 08:23:37.629689,2025-04-25 08:23:38.297795,0 days 00:00:00.668106,21.822915848009153,0.03427996930863631,0.032213983550142176,rbf,TPESampler,COMPLETE
1918,0.2051876518185756,2025-04-25 08:23:38.480126,2025-04-25 08:23:39.411301,0 days 00:00:00.931175,97.73413963496861,0.021244300376507586,0.010895367256718575,rbf,TPESampler,COMPLETE
1919,0.20107100917475357,2025-04-25 08:23:39.603184,2025-04-25 08:23:40.338636,0 days 00:00:00.735452,27.941303527597114,0.024277442392867454,0.029472322574504488,rbf,TPESampler,COMPLETE
1920,0.2944589208448,2025-04-25 08:23:40.517580,2025-04-25 08:23:41.749913,0 days 00:00:01.232333,93.93054066004198,0.008372988514108136,0.08305406139691239,rbf,TPESampler,COMPLETE
1921,0.2729778388113564,2025-04-25 08:23:41.935404,2025-04-25 08:23:42.558878,0 days 00:00:00.623474,17.77804349864554,0.011022213176642096,0.0036360632577451817,rbf,TPESampler,COMPLETE
1922,0.17355482644018755,2025-04-25 08:23:42.754919,2025-04-25 08:23:43.872981,0 days 00:00:01.118062,99.04454678063894,0.0132919868348261,0.03125940522880199,rbf,TPESampler,COMPLETE
1923,0.26690056704978726,2025-04-25 08:23:44.063836,2025-04-25 08:23:46.714209,0 days 00:00:02.650373,3.325188369461848,0.009297426636833483,0.002755336677657343,linear,TPESampler,COMPLETE
1924,0.1903557413364654,2025-04-25 08:23:46.900714,2025-04-25 08:23:47.679938,0 days 00:00:00.779224,76.8227263292837,0.023979224711353442,0.038342012169970324,rbf,TPESampler,COMPLETE
1925,0.26533473959725973,2025-04-25 08:23:47.864982,2025-04-25 08:23:48.700808,0 days 00:00:00.835826,11.588478329526595,0.0010481593713705729,0.07028973945329714,rbf,TPESampler,COMPLETE
1926,1283.1319601294845,2025-04-25 08:23:48.894842,2025-04-25 08:23:49.489285,0 days 00:00:00.594443,57.06772045933232,0.03431719287925011,0.04814249328361639,sigmoid,TPESampler,COMPLETE
1927,0.8086817267847044,2025-04-25 08:23:49.670601,2025-04-25 09:47:08.969459,0 days 01:23:19.298858,22.484571248741965,0.022429753770041964,0.10759439525838237,poly,TPESampler,COMPLETE
1928,0.30401735650563233,2025-04-25 08:34:01.580702,2025-04-25 08:34:02.169550,0 days 00:00:00.588848,3.8478929290416137,0.023247787720980632,0.0091757616888209,rbf,TPESampler,COMPLETE
1929,0.2298557163040231,2025-04-25 08:34:02.361325,2025-04-25 08:34:03.004934,0 days 00:00:00.643609,6.809401518891458,0.022552217652304404,0.040836556166877445,rbf,TPESampler,COMPLETE
1930,28.835987106309382,2025-04-25 08:34:03.192358,2025-04-25 08:34:03.846873,0 days 00:00:00.654515,0.8098981890635285,0.006683184092519707,0.8862992160804865,sigmoid,TPESampler,COMPLETE
1931,0.667017595506555,2025-04-25 08:34:04.197095,2025-04-25 08:34:04.838371,0 days 00:00:00.641276,16.67835728446465,0.026437705385217957,0.005470394194677111,poly,TPESampler,COMPLETE
1932,0.1730790767884783,2025-04-25 08:34:05.035815,2025-04-25 08:34:06.329343,0 days 00:00:01.293528,96.31099154324681,0.006436834146285031,0.02413296165216993,rbf,TPESampler,COMPLETE
1933,0.28270978578392814,2025-04-25 08:34:06.512791,2025-04-25 08:34:07.549353,0 days 00:00:01.036562,91.01647946511216,0.018530696717060896,0.07673136173992738,rbf,TPESampler,COMPLETE
1934,0.17064196380892177,2025-04-25 08:34:07.731322,2025-04-25 08:34:08.669504,0 days 00:00:00.938182,97.95260506623008,0.023404524137772522,0.02366925974371465,rbf,TPESampler,COMPLETE
1935,0.25590825115260224,2025-04-25 08:34:08.850865,2025-04-25 08:34:09.488426,0 days 00:00:00.637561,15.157037653896966,0.03694184567167668,0.061870172285536505,rbf,TPESampler,COMPLETE
1936,0.27748241565793813,2025-04-25 08:34:09.683058,2025-04-25 08:35:00.011110,0 days 00:00:50.328052,80.92278323266196,0.010625303755116725,0.002958728018936044,linear,TPESampler,COMPLETE
1937,0.28401800879708367,2025-04-25 08:35:00.207104,2025-04-25 08:35:00.788423,0 days 00:00:00.581319,8.778523827331512,0.08355309343458328,0.07152106515060337,rbf,TPESampler,COMPLETE
1938,0.2171522219324153,2025-04-25 08:35:00.975081,2025-04-25 08:35:01.632577,0 days 00:00:00.657496,27.96774637525928,0.011271869802659656,0.005396513019177747,rbf,TPESampler,COMPLETE
1939,0.2743596199491802,2025-04-25 08:35:01.821388,2025-04-25 08:35:19.275374,0 days 00:00:17.453986,24.021334703555706,0.034602071606759224,0.026249848610627426,linear,TPESampler,COMPLETE
1940,0.19098344610878595,2025-04-25 08:35:19.458626,2025-04-25 08:35:20.145257,0 days 00:00:00.686631,13.578540237528358,0.009898819083205052,0.02212606178505938,rbf,TPESampler,COMPLETE
1941,0.39369361042229606,2025-04-25 08:35:20.326429,2025-04-25 08:35:20.950565,0 days 00:00:00.624136,93.42158061642675,0.015760868670381244,0.23424631069861138,rbf,TPESampler,COMPLETE
1942,0.18926078373435845,2025-04-25 08:35:21.131023,2025-04-25 08:35:21.775601,0 days 00:00:00.644578,97.80741638803158,0.07323606856794168,0.027866134116183713,rbf,TPESampler,COMPLETE
1943,0.7839849389059658,2025-04-25 08:35:21.952847,2025-04-25 08:35:22.543224,0 days 00:00:00.590377,2.1101151168399492,0.007411846753528856,0.0033890006910776427,poly,TPESampler,COMPLETE
1944,0.21152285246506863,2025-04-25 08:35:22.726505,2025-04-25 08:35:23.425899,0 days 00:00:00.699394,22.75578183559645,0.0019019647343230647,0.007274724542350316,rbf,TPESampler,COMPLETE
1945,0.6688348948267966,2025-04-25 08:35:23.605057,2025-04-25 08:35:24.212148,0 days 00:00:00.607091,68.34724178449139,0.011913909599779516,0.0032930485931416363,poly,TPESampler,COMPLETE
1946,0.3133559241858564,2025-04-25 08:35:24.396105,2025-04-25 08:35:25.392965,0 days 00:00:00.996860,24.365312669946242,0.0010352382270898703,0.10185499360385082,rbf,TPESampler,COMPLETE
1947,0.18135564634367618,2025-04-25 08:35:25.574930,2025-04-25 08:35:26.501598,0 days 00:00:00.926668,96.35710421987615,0.003954915275518547,0.0052067278646423885,rbf,TPESampler,COMPLETE
1948,0.3132388153657625,2025-04-25 08:35:26.683037,2025-04-25 08:35:27.362697,0 days 00:00:00.679660,74.72665711890345,0.03320687132905207,0.10308857222283221,rbf,TPESampler,COMPLETE
1949,0.4156723440590067,2025-04-25 08:35:27.545256,2025-04-25 08:35:28.165932,0 days 00:00:00.620676,14.526518729804575,0.003810562403181816,0.0007121302033567574,rbf,TPESampler,COMPLETE
1950,0.18669631506732537,2025-04-25 08:35:28.353743,2025-04-25 08:35:29.117537,0 days 00:00:00.763794,24.393597077223273,0.0064267017936777545,0.01814359756037657,rbf,TPESampler,COMPLETE
1951,0.20816969016264783,2025-04-25 08:35:29.300951,2025-04-25 08:35:30.081178,0 days 00:00:00.780227,17.546277998019022,0.005662853213833168,0.03057609920434641,rbf,TPESampler,COMPLETE
1952,0.30542255431777404,2025-04-25 08:35:30.266335,2025-04-25 08:35:30.866181,0 days 00:00:00.599846,3.116157535007445,0.002599353009836109,0.01124536429002105,rbf,TPESampler,COMPLETE
1953,0.35398736709466333,2025-04-25 08:35:31.045101,2025-04-25 08:35:32.196244,0 days 00:00:01.151143,98.78311407137987,0.001133362310462481,0.14859006283541665,rbf,TPESampler,COMPLETE
1954,0.2050169845960276,2025-04-25 08:35:32.378656,2025-04-25 08:35:33.068375,0 days 00:00:00.689719,20.298917514198163,0.006456097786507312,0.009139742073448599,rbf,TPESampler,COMPLETE
1955,0.2678811990052851,2025-04-25 08:35:33.290627,2025-04-25 08:35:33.917146,0 days 00:00:00.626519,9.40928316690343,0.0011666390791271882,0.006544040884308807,rbf,TPESampler,COMPLETE
1956,0.2526024194986529,2025-04-25 08:35:34.097328,2025-04-25 08:35:34.977745,0 days 00:00:00.880417,16.962791827773934,0.012638563068006602,0.06246179292126557,rbf,TPESampler,COMPLETE
1957,0.20247816817497147,2025-04-25 08:35:35.166236,2025-04-25 08:35:36.007806,0 days 00:00:00.841570,23.294392508522062,0.0028073281223734547,0.026180226982583644,rbf,TPESampler,COMPLETE
1958,0.17436027872574333,2025-04-25 08:35:36.186964,2025-04-25 08:35:37.033481,0 days 00:00:00.846517,83.31595848613397,0.01282053695002459,0.006806174406531076,rbf,TPESampler,COMPLETE
1959,0.18827945425402087,2025-04-25 08:35:37.223709,2025-04-25 08:35:38.415704,0 days 00:00:01.191995,92.02326642905665,0.011362477923944939,0.01744569916147157,rbf,TPESampler,COMPLETE
1960,0.2637662161640058,2025-04-25 08:35:38.604841,2025-04-25 08:35:39.527469,0 days 00:00:00.922628,18.69582391542705,0.0018273414669712903,0.06918453111000143,rbf,TPESampler,COMPLETE
1961,0.264191784112494,2025-04-25 08:35:39.715315,2025-04-25 08:35:41.267564,0 days 00:00:01.552249,99.46747633538777,0.003372383672816319,0.0658575529139306,rbf,TPESampler,COMPLETE
1962,0.2501419314166837,2025-04-25 08:35:41.455077,2025-04-25 08:35:42.542708,0 days 00:00:01.087631,96.32540908848446,0.017625998967595324,0.06046009456664213,rbf,TPESampler,COMPLETE
1963,0.19076001504587634,2025-04-25 08:35:42.723137,2025-04-25 08:35:43.954317,0 days 00:00:01.231180,93.03691703911397,0.008334247649880114,0.03914238020936691,rbf,TPESampler,COMPLETE
1964,0.8862367613821092,2025-04-25 08:35:44.136120,2025-04-25 08:35:44.699781,0 days 00:00:00.563661,0.015045240675410517,0.00453387385419714,0.0033448873663903768,poly,TPESampler,COMPLETE
1965,0.17212481627363815,2025-04-25 08:35:44.879984,2025-04-25 08:35:46.336199,0 days 00:00:01.456215,98.96517248978274,0.00945285584949198,0.02957932637623171,rbf,TPESampler,COMPLETE
1966,0.8251312342163603,2025-04-25 08:35:46.514891,2025-04-25 08:35:47.069869,0 days 00:00:00.554978,8.011549500026176,0.3990951508300829,0.0015207113778349123,poly,TPESampler,COMPLETE
1967,0.3628089633345418,2025-04-25 08:35:47.248074,2025-04-25 08:35:47.960152,0 days 00:00:00.712078,14.561226964194136,0.007342527461764073,0.1710387833708152,rbf,TPESampler,COMPLETE
1968,0.6500874392943761,2025-04-25 08:35:48.157989,2025-04-25 08:35:55.163724,0 days 00:00:07.005735,93.90057756976356,0.0015588570713402743,0.010717332518877938,poly,TPESampler,COMPLETE
1969,0.27724239109207965,2025-04-25 08:35:55.347608,2025-04-25 08:36:52.433340,0 days 00:00:57.085732,87.94648631735255,0.0076190712896268544,0.020240802505957976,linear,TPESampler,COMPLETE
1970,0.1794362879285253,2025-04-25 08:36:52.621125,2025-04-25 08:36:53.600830,0 days 00:00:00.979705,93.87707208996206,0.0023141095586080005,0.007170169668607609,rbf,TPESampler,COMPLETE
1971,0.19433673426372072,2025-04-25 08:36:53.784905,2025-04-25 08:36:54.472614,0 days 00:00:00.687709,14.06362474686073,0.01304377650241742,0.02396891102394077,rbf,TPESampler,COMPLETE
1972,0.22130446513443092,2025-04-25 08:36:54.659976,2025-04-25 08:36:55.220741,0 days 00:00:00.560765,10.100689479390676,0.12136362772639933,0.018606587453838325,rbf,TPESampler,COMPLETE
1973,0.20475466392008768,2025-04-25 08:36:55.406304,2025-04-25 08:36:56.248220,0 days 00:00:00.841916,20.817605687136478,0.0014273802276405434,0.02937502544809374,rbf,TPESampler,COMPLETE
1974,0.18785628820339906,2025-04-25 08:36:56.433075,2025-04-25 08:36:57.642505,0 days 00:00:01.209430,96.39944082543848,0.01214048341922031,0.016758346869936845,rbf,TPESampler,COMPLETE
1975,0.18641629040927377,2025-04-25 08:36:57.828447,2025-04-25 08:36:58.585203,0 days 00:00:00.756756,23.937014654399846,0.0031669593089197097,0.018117540616545427,rbf,TPESampler,COMPLETE
1976,0.19956597800923584,2025-04-25 08:36:58.779620,2025-04-25 08:36:59.431004,0 days 00:00:00.651384,20.166810865316204,0.02171853103199563,0.01023664016398283,rbf,TPESampler,COMPLETE
1977,0.17034327160958,2025-04-25 08:36:59.621437,2025-04-25 08:37:01.198845,0 days 00:00:01.577408,87.93996758826606,0.0011721036888601992,0.02884225229748363,rbf,TPESampler,COMPLETE
1978,0.22142552645679547,2025-04-25 08:37:01.382172,2025-04-25 08:37:02.290107,0 days 00:00:00.907935,18.898565654676467,0.0011728534856073373,0.045679431962350005,rbf,TPESampler,COMPLETE
1979,0.1931048705328195,2025-04-25 08:37:02.481208,2025-04-25 08:37:03.731757,0 days 00:00:01.250549,92.69804281007187,0.0012880637538221125,0.015047438482000769,rbf,TPESampler,COMPLETE
1980,0.21220989655759576,2025-04-25 08:37:03.918249,2025-04-25 08:37:04.945264,0 days 00:00:01.027015,26.15613830452955,0.0012034149380643082,0.04139930929367916,rbf,TPESampler,COMPLETE
1981,0.1983074040611631,2025-04-25 08:37:05.125771,2025-04-25 08:37:05.816655,0 days 00:00:00.690884,16.61601347145479,0.001054139598464143,0.012804207698759734,rbf,TPESampler,COMPLETE
1982,0.18315802842524412,2025-04-25 08:37:05.998451,2025-04-25 08:37:06.743113,0 days 00:00:00.744662,19.955848635518592,0.0010300493237244102,0.015326319484335424,rbf,TPESampler,COMPLETE
1983,0.7333513547477951,2025-04-25 08:37:06.925840,2025-04-25 08:37:07.505604,0 days 00:00:00.579764,0.011385751223451696,0.018558328139437325,0.01385620643096487,sigmoid,TPESampler,COMPLETE
1984,0.39698413608822386,2025-04-25 08:37:07.690164,2025-04-25 08:37:08.433739,0 days 00:00:00.743575,27.55330728115882,0.0012115458887912924,0.24409180496929306,rbf,TPESampler,COMPLETE
1985,0.23914732543755504,2025-04-25 08:37:08.618058,2025-04-25 08:37:09.977318,0 days 00:00:01.359260,62.799133897984156,0.001450698760084617,0.055827726942449335,rbf,TPESampler,COMPLETE
1986,0.19837066149927604,2025-04-25 08:37:10.184755,2025-04-25 08:37:11.149073,0 days 00:00:00.964318,13.48778358627003,0.0010435746797150943,0.02647287941926943,rbf,TPESampler,COMPLETE
1987,0.19050428895040578,2025-04-25 08:37:11.332796,2025-04-25 08:37:12.047978,0 days 00:00:00.715182,24.363019000372265,0.0015285419801752279,0.0105399321222808,rbf,TPESampler,COMPLETE
1988,0.3122102629517549,2025-04-25 08:37:12.441409,2025-04-25 08:37:13.494957,0 days 00:00:01.053548,25.99090915623907,0.00174444257004217,0.1006568791486359,rbf,TPESampler,COMPLETE
1989,0.17901886067847111,2025-04-25 08:37:13.764528,2025-04-25 08:37:15.431588,0 days 00:00:01.667060,96.7772582541773,0.001263769525660225,0.021935127532017835,rbf,TPESampler,COMPLETE
1990,0.18911753413763083,2025-04-25 08:37:15.619824,2025-04-25 08:37:16.432202,0 days 00:00:00.812378,50.64328587552351,0.0011089340038226633,0.006811705614704408,rbf,TPESampler,COMPLETE
1991,0.3721523776019605,2025-04-25 08:37:16.614549,2025-04-25 08:37:17.591673,0 days 00:00:00.977124,80.15791575770028,0.0019639484230914734,0.18366452346438494,rbf,TPESampler,COMPLETE
1992,0.7407870371203171,2025-04-25 08:37:17.773655,2025-04-25 09:20:31.749812,0 days 00:43:13.976157,41.09300576355508,0.3831891091221744,0.14415234769742238,poly,TPESampler,COMPLETE
1993,0.2537955728266385,2025-04-25 09:20:31.939302,2025-04-25 09:20:33.506827,0 days 00:00:01.567525,81.95854182776107,0.0010324785194220393,0.06073228236661832,rbf,TPESampler,COMPLETE
1994,0.20635968622354442,2025-04-25 09:20:33.694566,2025-04-25 09:20:34.583025,0 days 00:00:00.888459,22.974082417825727,0.002009797784688101,0.03517654092881277,rbf,TPESampler,COMPLETE
1995,0.20340286346346695,2025-04-25 09:20:34.781474,2025-04-25 09:20:35.616702,0 days 00:00:00.835228,30.788733289578023,0.0026766885950992793,0.019741677808299198,rbf,TPESampler,COMPLETE
