number,value,datetime_start,datetime_complete,duration,params_C,params_epsilon,params_gamma,params_kernel,system_attrs_auto:sampler,state
2113,0.24494910291244795,2025-04-25 11:01:34.974553,2025-04-25 11:01:36.531094,0 days 00:00:01.556541,98.17956235215549,0.00482978523231823,0.05721114556888683,rbf,TPESampler,COMPLETE
2114,0.18944098232058199,2025-04-25 11:01:36.710886,2025-04-25 11:01:37.883385,0 days 00:00:01.172499,99.59718055974913,0.004047339725003087,0.015269178190389091,rbf,TPESampler,COMPLETE
2115,1085.3415215394518,2025-04-25 11:01:38.063148,2025-04-25 11:01:38.640929,0 days 00:00:00.577781,46.21375168059223,0.01371700692492442,0.09216991253270806,sigmoid,TPESampler,COMPLETE
2116,0.1994683247323271,2025-04-25 11:01:38.828938,2025-04-25 11:01:39.922500,0 days 00:00:01.093562,91.99167332220495,0.003272414499776853,0.0129079516416042,rbf,TPESampler,COMPLETE
2117,0.2961321613154021,2025-04-25 11:01:40.103635,2025-04-25 11:01:41.091688,0 days 00:00:00.988053,98.92450066865524,0.018993125697989017,0.08531099867019443,rbf,TPESampler,COMPLETE
2118,0.2143473256773665,2025-04-25 11:01:41.272226,2025-04-25 11:01:42.096680,0 days 00:00:00.824454,19.51731344895555,0.003001158340378813,0.04056105496994302,rbf,TPESampler,COMPLETE
2119,0.28063768866752825,2025-04-25 11:01:42.277643,2025-04-25 11:01:43.698477,0 days 00:00:01.420834,97.42970135747962,0.0035353484030975165,0.07371486572664751,rbf,TPESampler,COMPLETE
2120,0.18018193302213575,2025-04-25 11:01:43.881628,2025-04-25 11:01:44.612004,0 days 00:00:00.730376,24.180526403673856,0.00711578348212544,0.014458307249007384,rbf,TPESampler,COMPLETE
2121,0.26805435147836876,2025-04-25 11:01:44.790069,2025-04-25 11:01:46.298135,0 days 00:00:01.508066,85.72680871217426,0.002561301761808529,0.0680322122714601,rbf,TPESampler,COMPLETE
2122,0.4229768987125482,2025-04-25 11:01:46.481123,2025-04-25 11:01:47.063180,0 days 00:00:00.582057,6.676095186618657,0.034726577375991226,0.3045727648545434,rbf,TPESampler,COMPLETE
2123,0.2558772291700521,2025-04-25 11:01:47.247271,2025-04-25 11:01:47.991045,0 days 00:00:00.743774,84.96352387825134,0.039759660316193164,0.06228672408031961,rbf,TPESampler,COMPLETE
2124,0.1977574457083877,2025-04-25 11:01:49.069312,2025-04-25 11:01:50.322649,0 days 00:00:01.253337,90.41227920916353,0.005810760380252538,0.013394425422511073,rbf,TPESampler,COMPLETE
2125,921.2480584037851,2025-04-25 11:01:50.507394,2025-04-25 11:01:51.158007,0 days 00:00:00.650613,41.83940704750378,0.0020322784110480127,0.04307411280574322,sigmoid,TPESampler,COMPLETE
2126,0.20808381725389408,2025-04-25 11:01:51.361116,2025-04-25 11:01:52.139762,0 days 00:00:00.778646,17.98591391751367,0.0029833229033352907,0.028650233415484772,rbf,TPESampler,COMPLETE
2127,0.2689042012474261,2025-04-25 11:01:52.323863,2025-04-25 11:01:52.989021,0 days 00:00:00.665158,96.61985889090775,0.046384316499610626,0.0688665438814155,rbf,TPESampler,COMPLETE
2128,0.17590550129401092,2025-04-25 11:01:53.179020,2025-04-25 11:01:54.646558,0 days 00:00:01.467538,93.6825273410594,0.0029162048845470852,0.0326047814778137,rbf,TPESampler,COMPLETE
2129,0.18163681999925071,2025-04-25 11:01:54.829890,2025-04-25 11:01:55.522676,0 days 00:00:00.692786,21.7660103712889,0.016805520100224913,0.014821520967775365,rbf,TPESampler,COMPLETE
2130,0.20347346837890956,2025-04-25 11:01:55.697837,2025-04-25 11:01:56.664665,0 days 00:00:00.966828,98.7026250466278,0.014003266330724616,0.009116364784811606,rbf,TPESampler,COMPLETE
2131,0.36448597458354676,2025-04-25 11:01:56.852485,2025-04-25 11:01:57.608373,0 days 00:00:00.755888,25.4555130022994,0.006358698706396903,0.17265711274977258,rbf,TPESampler,COMPLETE
2132,0.3320536809032783,2025-04-25 11:01:57.787404,2025-04-25 11:01:59.027718,0 days 00:00:01.240314,93.44562046711295,0.0018660731621670703,0.1189852912784702,rbf,TPESampler,COMPLETE
2133,0.20961394026561342,2025-04-25 11:01:59.206425,2025-04-25 11:01:59.869101,0 days 00:00:00.662676,21.83102397012644,0.00376770740389956,0.007903995698373972,rbf,TPESampler,COMPLETE
2134,0.1951168540809758,2025-04-25 11:02:00.056611,2025-04-25 11:02:00.728229,0 days 00:00:00.671618,19.928590883592356,0.01410025821419804,0.011516802346451537,rbf,TPESampler,COMPLETE
2135,0.17229419040093227,2025-04-25 11:02:00.903872,2025-04-25 11:02:02.400572,0 days 00:00:01.496700,95.37150015443036,0.002733723650269723,0.03028146588688488,rbf,TPESampler,COMPLETE
2136,0.18415752854454526,2025-04-25 11:02:02.581197,2025-04-25 11:02:03.974244,0 days 00:00:01.393047,94.82145100939987,0.005399484898582777,0.03702449770411343,rbf,TPESampler,COMPLETE
2137,0.19302142830074512,2025-04-25 11:02:04.164630,2025-04-25 11:02:05.294701,0 days 00:00:01.130071,88.19931869481125,0.007034938122881107,0.015119917631629556,rbf,TPESampler,COMPLETE
2138,0.4088542371193759,2025-04-25 11:02:05.477466,2025-04-25 11:02:06.131569,0 days 00:00:00.654103,18.284598912428272,0.0029262986741684384,0.2760213530546038,rbf,TPESampler,COMPLETE
2139,0.17631098005335508,2025-04-25 11:02:06.312013,2025-04-25 11:02:07.598349,0 days 00:00:01.286336,98.65110157661807,0.0027280682111869336,0.022508888831922463,rbf,TPESampler,COMPLETE
2140,2.0093348250360057,2025-04-25 11:02:07.780149,2025-04-25 11:02:08.328646,0 days 00:00:00.548497,3.892876914523235,0.10480176913179536,0.002115837733857158,sigmoid,TPESampler,COMPLETE
2141,0.27771636747524037,2025-04-25 11:02:08.507093,2025-04-25 11:02:09.588953,0 days 00:00:01.081860,0.3899570765510849,0.03500053227330446,0.07549709730418952,linear,TPESampler,COMPLETE
2142,0.3315411591545509,2025-04-25 11:02:09.883303,2025-04-25 11:02:10.846495,0 days 00:00:00.963192,22.518820872538793,0.00796343004027298,0.12182558548800218,rbf,TPESampler,COMPLETE
2143,0.26606392287675334,2025-04-25 11:02:11.031077,2025-04-25 11:02:11.951948,0 days 00:00:00.920871,14.773757959682465,0.016677292112466414,0.07000183371388506,rbf,TPESampler,COMPLETE
2144,1.0113370011201341,2025-04-25 11:02:12.137533,2025-04-25 13:06:12.163945,0 days 02:04:00.026412,55.320374928657124,0.0031459226410827804,0.1279555411378779,poly,TPESampler,COMPLETE
2145,0.2035147583891951,2025-04-25 11:08:04.370535,2025-04-25 11:08:05.176571,0 days 00:00:00.806036,20.897713609786997,0.008826667448381568,0.028884668034659416,rbf,TPESampler,COMPLETE
2146,0.27754833395867934,2025-04-25 11:08:05.363628,2025-04-25 11:08:05.965243,0 days 00:00:00.601615,3.9578575860620564,0.002183846018353092,0.013907605729492485,rbf,TPESampler,COMPLETE
2147,0.6094301073997804,2025-04-25 11:08:06.152216,2025-04-25 11:10:38.743877,0 days 00:02:32.591661,0.08407477819303688,0.058709663710686734,0.2595896153941114,poly,TPESampler,COMPLETE
2148,0.18848442070155885,2025-04-25 11:10:38.929925,2025-04-25 11:10:40.184359,0 days 00:00:01.254434,99.80954149699564,0.0029698757332854517,0.015746645444993487,rbf,TPESampler,COMPLETE
2149,0.20035160216284284,2025-04-25 11:10:40.372029,2025-04-25 11:10:41.140114,0 days 00:00:00.768085,99.89162371026153,0.04375836653087238,0.011538556884032655,rbf,TPESampler,COMPLETE
2150,0.3151138971759478,2025-04-25 11:10:41.327424,2025-04-25 11:10:42.550347,0 days 00:00:01.222923,96.10518155532583,0.002084272577721131,0.10046139994040167,rbf,TPESampler,COMPLETE
2151,0.20827798996767477,2025-04-25 11:10:42.734022,2025-04-25 11:10:43.872412,0 days 00:00:01.138390,99.68828375270745,0.0017659015646024772,0.009399268310277051,rbf,TPESampler,COMPLETE
2152,0.20664942434834319,2025-04-25 11:10:44.058784,2025-04-25 11:10:44.786580,0 days 00:00:00.727796,18.167376776457914,0.016164256539233892,0.032313344463381015,rbf,TPESampler,COMPLETE
2153,0.24715184659929265,2025-04-25 11:10:44.972297,2025-04-25 11:10:46.176406,0 days 00:00:01.204109,97.89431852845202,0.00938078470067776,0.058751741634914305,rbf,TPESampler,COMPLETE
2154,0.2010959260059429,2025-04-25 11:10:46.358149,2025-04-25 11:10:47.924188,0 days 00:00:01.566039,91.92653158092837,0.002292444990166557,0.0427855161025941,rbf,TPESampler,COMPLETE
2155,0.2153619556082514,2025-04-25 11:10:48.103016,2025-04-25 11:10:48.711103,0 days 00:00:00.608087,16.651267708044774,0.05555290509683579,0.03215257651812345,rbf,TPESampler,COMPLETE
2156,0.1978199729628463,2025-04-25 11:10:48.905760,2025-04-25 11:10:49.543132,0 days 00:00:00.637372,22.08105081002732,0.02389594054810916,0.009877308065939137,rbf,TPESampler,COMPLETE
2157,0.2005048043842324,2025-04-25 11:10:49.727431,2025-04-25 11:10:50.524268,0 days 00:00:00.796837,17.816331987048887,0.0029352639562576005,0.011480097572383432,rbf,TPESampler,COMPLETE
2158,0.2387996165142216,2025-04-25 11:10:50.707587,2025-04-25 11:10:51.322207,0 days 00:00:00.614620,4.70568429918039,0.002775663746331248,0.022719102163389213,rbf,TPESampler,COMPLETE
2159,0.18442202400343383,2025-04-25 11:10:51.504794,2025-04-25 11:10:52.514289,0 days 00:00:01.009495,94.7819690335032,0.00445005366289229,0.004888225605592183,rbf,TPESampler,COMPLETE
2160,28.05139771333545,2025-04-25 11:10:52.700943,2025-04-25 11:10:53.271879,0 days 00:00:00.570936,77.97875502969059,0.07833136737900982,0.0017106019041750738,sigmoid,TPESampler,COMPLETE
2161,0.19761341728272183,2025-04-25 11:10:53.456329,2025-04-25 11:10:54.687712,0 days 00:00:01.231383,94.00370179884912,0.008756416193357845,0.04117763182481621,rbf,TPESampler,COMPLETE
2162,0.32802090343944595,2025-04-25 11:10:54.893378,2025-04-25 11:10:55.896503,0 days 00:00:01.003125,22.047788979242252,0.0030389969154007135,0.11679055913873591,rbf,TPESampler,COMPLETE
2163,0.2006812018508237,2025-04-25 11:10:56.075366,2025-04-25 11:10:56.943253,0 days 00:00:00.867887,26.64072277977251,0.002728114621872151,0.02490505590675036,rbf,TPESampler,COMPLETE
2164,1474.07370121416,2025-04-25 11:10:57.133175,2025-04-25 11:10:57.710181,0 days 00:00:00.577006,83.85041472915486,0.0056647008120731535,0.025829014218887007,sigmoid,TPESampler,COMPLETE
2165,0.30933969683609114,2025-04-25 11:10:57.892521,2025-04-25 11:10:58.909265,0 days 00:00:01.016744,96.24172949769094,0.019868484357836263,0.09767917565857566,rbf,TPESampler,COMPLETE
2166,0.19209815499885624,2025-04-25 11:10:59.088466,2025-04-25 11:10:59.838646,0 days 00:00:00.750180,23.049736775541025,0.005715144735490526,0.02029965193661808,rbf,TPESampler,COMPLETE
2167,0.1806935665562296,2025-04-25 11:11:00.027231,2025-04-25 11:11:00.757634,0 days 00:00:00.730403,22.690638417953302,0.014547467768273111,0.014862166468905745,rbf,TPESampler,COMPLETE
2168,0.20313468220917483,2025-04-25 11:11:00.944636,2025-04-25 11:11:01.781101,0 days 00:00:00.836465,22.89084200482339,0.0027139863376493727,0.025736575724140207,rbf,TPESampler,COMPLETE
2169,0.2763849870333408,2025-04-25 11:11:01.969545,2025-04-25 11:11:02.571385,0 days 00:00:00.601840,3.3926202431331425,0.02312814104606549,0.0667161056571229,rbf,TPESampler,COMPLETE
2170,0.1841959620572559,2025-04-25 11:11:02.765715,2025-04-25 11:11:03.800587,0 days 00:00:01.034872,88.89421146103084,0.019425268111112233,0.036744357654228635,rbf,TPESampler,COMPLETE
2171,0.19223338884558622,2025-04-25 11:11:03.993720,2025-04-25 11:11:04.949663,0 days 00:00:00.955943,99.58135287657088,0.013393410120924149,0.008050837141505125,rbf,TPESampler,COMPLETE
2172,0.20837489977147705,2025-04-25 11:11:05.134937,2025-04-25 11:11:06.061941,0 days 00:00:00.927004,25.96709248475123,0.0023678552373315523,0.03865301022915478,rbf,TPESampler,COMPLETE
2173,0.2937340887527178,2025-04-25 11:11:06.242386,2025-04-25 11:11:07.729639,0 days 00:00:01.487253,88.43196999750595,0.002195048867907823,0.0810684325006088,rbf,TPESampler,COMPLETE
2174,0.3160442810170453,2025-04-25 11:11:07.911674,2025-04-25 11:11:08.874845,0 days 00:00:00.963171,88.94173688063907,0.011725178259801983,0.10349267679966083,rbf,TPESampler,COMPLETE
2175,0.18432364176485147,2025-04-25 11:11:09.058945,2025-04-25 11:11:09.883464,0 days 00:00:00.824519,27.782100032049325,0.0010477648369022752,0.015517045014184865,rbf,TPESampler,COMPLETE
2176,0.27635230406414835,2025-04-25 11:11:10.070681,2025-04-25 11:12:01.770472,0 days 00:00:51.699791,79.68570969858722,0.0026971794420189137,0.008323776181403396,linear,TPESampler,COMPLETE
2177,484.8181072677231,2025-04-25 11:12:01.960988,2025-04-25 11:12:02.547942,0 days 00:00:00.586954,30.191229175650218,0.02696288640336239,0.02228350815764244,sigmoid,TPESampler,COMPLETE
2178,0.6709265338715296,2025-04-25 11:12:02.734741,2025-04-25 11:12:03.365614,0 days 00:00:00.630873,95.48386597067768,0.0021025238038352087,0.0028721585675452297,poly,TPESampler,COMPLETE
2179,0.1798810047997916,2025-04-25 11:12:03.548206,2025-04-25 11:12:04.314831,0 days 00:00:00.766625,31.25516766831613,0.005623414474134157,0.013233701212182442,rbf,TPESampler,COMPLETE
2180,0.22098058178978275,2025-04-25 11:12:04.493299,2025-04-25 11:12:05.363151,0 days 00:00:00.869852,97.96678544513263,0.021737250251769737,0.04850869979502718,rbf,TPESampler,COMPLETE
2181,0.17161984981667264,2025-04-25 11:12:05.549447,2025-04-25 11:12:06.819478,0 days 00:00:01.270031,99.35429283597931,0.006497140352013581,0.02444066734134838,rbf,TPESampler,COMPLETE
2182,0.6153582577517634,2025-04-25 11:12:07.006991,2025-04-25 11:13:15.698742,0 days 00:01:08.691751,20.31837082448189,0.037466904807209024,0.022888534326106717,poly,TPESampler,COMPLETE
2183,0.18216641315038656,2025-04-25 11:13:15.888290,2025-04-25 11:13:16.654324,0 days 00:00:00.766034,25.20815778022069,0.006710922881398059,0.015554423256468263,rbf,TPESampler,COMPLETE
2184,0.27258874820146306,2025-04-25 11:13:16.841841,2025-04-25 11:13:22.990266,0 days 00:00:06.148425,7.458555167885284,0.001138468798529484,0.004465121371216972,linear,TPESampler,COMPLETE
2185,0.2734327452858745,2025-04-25 11:13:23.180026,2025-04-25 11:13:24.047728,0 days 00:00:00.867702,19.309520557104992,0.005299574674852712,0.07448965639740644,rbf,TPESampler,COMPLETE
2186,0.1886001878832154,2025-04-25 11:13:24.233481,2025-04-25 11:13:25.498570,0 days 00:00:01.265089,92.57847529486463,0.0023139015542531327,0.01820712608252522,rbf,TPESampler,COMPLETE
2187,0.21620146183757283,2025-04-25 11:13:25.728351,2025-04-25 11:13:27.338976,0 days 00:00:01.610625,94.79328772323599,0.0032583770830455633,0.046957767558810815,rbf,TPESampler,COMPLETE
2188,0.898325956877514,2025-04-25 11:13:27.525143,2025-04-25 11:13:28.116451,0 days 00:00:00.591308,0.003110421925068473,0.008703481005229675,0.8630279370012316,rbf,TPESampler,COMPLETE
2189,0.2642953270474465,2025-04-25 11:13:28.303242,2025-04-25 11:13:28.964743,0 days 00:00:00.661501,5.502155402282704,0.006388239369513223,0.06768394660031506,rbf,TPESampler,COMPLETE
2190,0.2577061349302124,2025-04-25 11:13:29.151858,2025-04-25 11:13:29.876009,0 days 00:00:00.724151,27.16913171350787,0.004603727093203806,0.002992997021089777,rbf,TPESampler,COMPLETE
2191,0.27625545802045565,2025-04-25 11:13:30.063530,2025-04-25 11:14:27.213205,0 days 00:00:57.149675,94.37455861691011,0.0021948098061368437,0.1045070923769959,linear,TPESampler,COMPLETE
2192,0.18018273384839353,2025-04-25 11:14:27.387376,2025-04-25 11:14:28.152918,0 days 00:00:00.765542,25.33523753267021,0.002774947323875571,0.013872905677620853,rbf,TPESampler,COMPLETE
2193,0.207392657165288,2025-04-25 11:14:28.337070,2025-04-25 11:14:29.376304,0 days 00:00:01.039234,99.09916168985926,0.011303099100369992,0.009346538601686305,rbf,TPESampler,COMPLETE
2194,0.21081960780748538,2025-04-25 11:14:29.573801,2025-04-25 11:14:30.787512,0 days 00:00:01.213711,84.47233839570124,0.0010756581893307854,0.010614709666206538,rbf,TPESampler,COMPLETE
2195,0.20651632552747282,2025-04-25 11:14:31.027660,2025-04-25 11:14:31.697504,0 days 00:00:00.669844,23.449033574029897,0.03277578250348359,0.023177221569837123,rbf,TPESampler,COMPLETE
2196,0.18838183526722327,2025-04-25 11:14:31.890639,2025-04-25 11:14:33.109770,0 days 00:00:01.219131,91.23386435875025,0.005948876564770904,0.017729241605870853,rbf,TPESampler,COMPLETE
2197,0.18131536876288848,2025-04-25 11:14:33.300774,2025-04-25 11:14:34.127920,0 days 00:00:00.827146,98.9280044165424,0.03306300674757016,0.018892244590096568,rbf,TPESampler,COMPLETE
2198,0.6270675372372978,2025-04-25 11:14:34.313543,2025-04-25 11:17:01.365338,0 days 00:02:27.051795,97.88546510669964,0.004275549056296161,0.02064036856543193,poly,TPESampler,COMPLETE
2199,0.33916936031049433,2025-04-25 11:17:01.554110,2025-04-25 11:17:02.304062,0 days 00:00:00.749952,23.100746629927407,0.010791750599202276,0.13261115883368618,rbf,TPESampler,COMPLETE
2200,0.23464276483298366,2025-04-25 11:17:02.482926,2025-04-25 11:17:04.089173,0 days 00:00:01.606247,98.04656797738855,0.0024646068589705174,0.052738110742251765,rbf,TPESampler,COMPLETE
2201,0.20846701126817288,2025-04-25 11:17:04.278350,2025-04-25 11:17:05.133236,0 days 00:00:00.854886,28.73541288065071,0.010319425820723191,0.03894738970919827,rbf,TPESampler,COMPLETE
2202,0.2428340936213626,2025-04-25 11:17:05.316078,2025-04-25 11:17:06.830648,0 days 00:00:01.514570,83.34992150661331,0.0010015601148308953,0.0559563477169365,rbf,TPESampler,COMPLETE
2203,0.2026407434565063,2025-04-25 11:17:07.020012,2025-04-25 11:17:08.035058,0 days 00:00:01.015046,88.78132409332618,0.004424627403841214,0.011793215319315044,rbf,TPESampler,COMPLETE
2204,,2025-04-25 11:17:08.220500,,,98.7938929280766,0.0012954633408214572,0.16291340320535078,poly,TPESampler,RUNNING
2205,0.26488262120629325,2025-04-25 11:45:42.822265,2025-04-25 11:45:43.448342,0 days 00:00:00.626077,6.070528569987802,0.007433312498444973,0.010381597610888246,rbf,TPESampler,COMPLETE
2206,0.9033875761016457,2025-04-25 11:45:43.637520,2025-04-25 11:45:44.180498,0 days 00:00:00.542978,0.0016546124527422016,0.1348651125103085,0.00014382152678615761,poly,TPESampler,COMPLETE
2207,0.16922013084895648,2025-04-25 11:45:44.371523,2025-04-25 11:45:45.714189,0 days 00:00:01.342666,99.82088368112964,0.011380168763803017,0.028023173780989046,rbf,TPESampler,COMPLETE
2208,0.1981400333861991,2025-04-25 11:45:45.903587,2025-04-25 11:45:46.663389,0 days 00:00:00.759802,30.13325305215305,0.023321865709026623,0.02650790093100663,rbf,TPESampler,COMPLETE
2209,0.21248816356061165,2025-04-25 11:45:46.851837,2025-04-25 11:45:47.460147,0 days 00:00:00.608310,17.532260805115428,0.03894592055993508,0.008849429321916055,rbf,TPESampler,COMPLETE
2210,0.20628107080216657,2025-04-25 11:45:47.651832,2025-04-25 11:45:48.680348,0 days 00:00:01.028516,55.80469553526186,0.015679621301726433,0.013153086852285875,rbf,TPESampler,COMPLETE
2211,0.18253668208491045,2025-04-25 11:45:48.870163,2025-04-25 11:45:49.539320,0 days 00:00:00.669157,21.182745898335696,0.021478670362312068,0.016524300623302485,rbf,TPESampler,COMPLETE
2212,0.654623964901599,2025-04-25 11:45:49.741681,2025-04-25 11:45:50.233301,0 days 00:00:00.491620,3.409488604806764,0.694974673409601,0.4733031443548951,rbf,TPESampler,COMPLETE
2213,0.2894718343191677,2025-04-25 11:45:50.422900,2025-04-25 11:45:51.231353,0 days 00:00:00.808453,24.048076361930942,0.014462554463699644,0.0832266415357783,rbf,TPESampler,COMPLETE
2214,0.5812078844601625,2025-04-25 11:45:51.442597,2025-04-25 11:45:52.050137,0 days 00:00:00.607540,0.12478224721478477,0.04736521394855006,0.002457549440248072,rbf,TPESampler,COMPLETE
2215,0.48289367798916877,2025-04-25 11:45:52.229027,2025-04-25 11:45:52.785907,0 days 00:00:00.556880,0.007934857387298782,0.07095080074773714,0.08242048735269931,linear,TPESampler,COMPLETE
2216,0.19159824926176788,2025-04-25 11:45:53.010615,2025-04-25 11:45:54.020513,0 days 00:00:01.009898,94.18078936627053,0.01856902405726355,0.008358246182925853,rbf,TPESampler,COMPLETE
2217,0.16856820533424713,2025-04-25 11:45:54.210351,2025-04-25 11:45:55.693782,0 days 00:00:01.483431,91.1573279877097,0.016598730198749197,0.027925684361277018,rbf,TPESampler,COMPLETE
2218,0.28860181091021486,2025-04-25 11:45:56.051788,2025-04-25 11:45:56.693787,0 days 00:00:00.641999,11.47014838185837,0.04336346614957136,0.0812448243275167,rbf,TPESampler,COMPLETE
2219,0.2240660742847302,2025-04-25 11:45:56.879800,2025-04-25 11:45:57.605474,0 days 00:00:00.725674,34.570917267798265,0.027201073873772665,0.04929441279865143,rbf,TPESampler,COMPLETE
2220,0.3000496882090845,2025-04-25 11:45:57.809717,2025-04-25 11:45:58.409642,0 days 00:00:00.599925,13.431363837895557,0.022034964295059186,0.0032578027318915636,rbf,TPESampler,COMPLETE
2221,0.19717801741022584,2025-04-25 11:45:58.596975,2025-04-25 11:45:59.289907,0 days 00:00:00.692932,81.53973299356169,0.05077965098362845,0.00885346171389982,rbf,TPESampler,COMPLETE
2222,0.2734971094052392,2025-04-25 11:45:59.481373,2025-04-25 11:46:00.145363,0 days 00:00:00.663990,22.584150081817242,0.03836797875854099,0.0712336735844317,rbf,TPESampler,COMPLETE
2223,0.19823895425435542,2025-04-25 11:46:00.328749,2025-04-25 11:46:01.354589,0 days 00:00:01.025840,93.43474392007047,0.013200259353932247,0.012809987688890972,rbf,TPESampler,COMPLETE
2224,0.20426584385473326,2025-04-25 11:46:01.537249,2025-04-25 11:46:02.343534,0 days 00:00:00.806285,28.243096918225497,0.01586581508047534,0.03436718102283193,rbf,TPESampler,COMPLETE
2225,0.5077802553128608,2025-04-25 11:46:02.529021,2025-04-25 11:46:03.047903,0 days 00:00:00.518882,0.005821084780375239,0.2787972114342873,0.00011094678491874002,linear,TPESampler,COMPLETE
2226,0.27486596203251445,2025-04-25 11:46:03.236730,2025-04-25 11:46:12.418427,0 days 00:00:09.181697,9.776525121542294,0.015402368358661768,0.012361769575679749,linear,TPESampler,COMPLETE
2227,1153.9771548416143,2025-04-25 11:46:12.632866,2025-04-25 11:46:13.296812,0 days 00:00:00.663946,70.01447278857457,0.022180325510851733,0.023022779006042233,sigmoid,TPESampler,COMPLETE
2228,0.6312048477278229,2025-04-25 11:46:13.489570,2025-04-25 11:46:31.477028,0 days 00:00:17.987458,0.01656578553117373,0.015221152586053067,0.21579249045679105,poly,TPESampler,COMPLETE
2229,0.4460188408738909,2025-04-25 11:46:31.658622,2025-04-25 11:46:32.229703,0 days 00:00:00.571081,0.020846285668971776,0.1710465203203185,0.008543631081681423,linear,TPESampler,COMPLETE
2230,0.18333207767819729,2025-04-25 11:46:32.419898,2025-04-25 11:46:33.078584,0 days 00:00:00.658686,22.6593581537134,0.033300186082605966,0.014517215890730018,rbf,TPESampler,COMPLETE
