number,value,datetime_start,datetime_complete,duration,params_C,params_epsilon,params_gamma,params_kernel,system_attrs_auto:sampler,state
1528,0.2762300459869965,2025-04-25 07:24:13.951267,2025-04-25 07:24:51.008691,0 days 00:00:37.057424,56.98038141469449,0.013514759662930656,0.02691518793894417,linear,TPESampler,COMPLETE
1529,0.6522341945384528,2025-04-25 07:24:51.174709,2025-04-25 07:24:51.704907,0 days 00:00:00.530198,0.03887545504662772,0.15987058347884694,0.010337113786869682,sigmoid,TPESampler,COMPLETE
1530,0.30627817664402374,2025-04-25 07:24:51.875867,2025-04-25 07:24:53.027783,0 days 00:00:01.151916,99.6399477765755,0.00924959860869402,0.09379030882884631,rbf,TPESampler,COMPLETE
1531,0.6385333521351245,2025-04-25 07:24:53.217738,2025-04-25 07:25:01.720712,0 days 00:00:08.502974,94.37782351271785,0.0074449362501643745,0.011545257372796436,poly,TPESampler,COMPLETE
1532,0.17998943178253377,2025-04-25 07:25:01.893907,2025-04-25 07:25:02.596567,0 days 00:00:00.702660,28.50441901018093,0.015184260724704676,0.013069614347464318,rbf,TPESampler,COMPLETE
1533,0.2549356310631619,2025-04-25 07:25:02.778818,2025-04-25 07:25:04.744230,0 days 00:00:01.965412,89.51612111623484,0.002216310863463466,0.06128192943082719,rbf,TPESampler,COMPLETE
1534,0.17063681856841464,2025-04-25 07:25:04.982133,2025-04-25 07:25:06.549278,0 days 00:00:01.567145,99.49124059384692,0.0010119661598492517,0.02536726478918791,rbf,TPESampler,COMPLETE
1535,0.30957315940017843,2025-04-25 07:25:06.723324,2025-04-25 07:25:07.644612,0 days 00:00:00.921288,25.04568422559132,0.001824418783058538,0.09845490725337466,rbf,TPESampler,COMPLETE
1536,1.5837773276346954,2025-04-25 07:25:07.817591,2025-04-25 07:25:08.400126,0 days 00:00:00.582535,14.116301094693233,0.0026456231655222697,0.0011090203509139989,sigmoid,TPESampler,COMPLETE
1537,0.1906158845691781,2025-04-25 07:25:08.572792,2025-04-25 07:25:09.275288,0 days 00:00:00.702496,14.380385614085938,0.0022291343244255175,0.022914136754991245,rbf,TPESampler,COMPLETE
1538,0.24263735392094535,2025-04-25 07:25:09.452494,2025-04-25 07:25:10.078612,0 days 00:00:00.626118,4.943519986937517,0.0010352231769476122,0.018955867482475776,rbf,TPESampler,COMPLETE
1539,0.2579317951683006,2025-04-25 07:25:10.251451,2025-04-25 07:25:10.999142,0 days 00:00:00.747691,15.30570870789193,0.0020681825898102276,0.004721174493353044,rbf,TPESampler,COMPLETE
1540,0.2480871140710655,2025-04-25 07:25:11.188927,2025-04-25 07:25:12.192144,0 days 00:00:01.003217,25.552213938509507,0.001128072647366465,0.06070418295597041,rbf,TPESampler,COMPLETE
1541,0.6775163534644881,2025-04-25 07:25:12.366309,2025-04-25 07:25:12.915079,0 days 00:00:00.548770,0.02537121288781401,0.10513111317980699,0.003703035030973472,rbf,TPESampler,COMPLETE
1542,0.2015701403272015,2025-04-25 07:25:13.045919,2025-04-25 07:25:14.239451,0 days 00:00:01.193532,81.88273080427236,0.0010263338139811472,0.012865426544670737,rbf,TPESampler,COMPLETE
1543,0.28913109611205073,2025-04-25 07:25:13.116848,2025-04-25 07:25:14.527006,0 days 00:00:01.410158,51.137047073107205,0.0010377733941893319,0.08045366901871534,rbf,TPESampler,COMPLETE
1544,0.1962191146829289,2025-04-25 07:25:14.415834,2025-04-25 07:25:15.342866,0 days 00:00:00.927032,35.675438889525076,0.0010290690774105802,0.02389122791046725,rbf,TPESampler,COMPLETE
1545,0.8557642911418621,2025-04-25 07:25:14.703950,2025-04-25 07:25:15.298826,0 days 00:00:00.594876,0.0182550930913366,0.011505352713557229,0.00046190579393578493,rbf,TPESampler,COMPLETE
1546,0.17708828613583782,2025-04-25 07:25:15.448138,2025-04-25 07:25:17.058161,0 days 00:00:01.610023,95.4500217378673,0.001222680908083612,0.022830108504916395,rbf,TPESampler,COMPLETE
1547,0.1932065786176553,2025-04-25 07:25:15.493834,2025-04-25 07:25:16.388706,0 days 00:00:00.894872,22.1390106443287,0.0034205320554037246,0.010940669616005087,rbf,TPESampler,COMPLETE
1548,0.271035456828228,2025-04-25 07:25:16.560819,2025-04-25 07:25:23.366609,0 days 00:00:06.805790,6.830462472386094,0.031005896834865928,0.008225087460500383,linear,TPESampler,COMPLETE
1549,0.195643946308951,2025-04-25 07:25:17.246538,2025-04-25 07:25:18.387567,0 days 00:00:01.141029,87.67870146108098,0.0011291981725295654,0.014715750510725203,rbf,TPESampler,COMPLETE
1550,0.19256812961414738,2025-04-25 07:25:18.559175,2025-04-25 07:25:19.708926,0 days 00:00:01.149751,77.31192265892284,0.0010249903401787798,0.01672827937847767,rbf,TPESampler,COMPLETE
1551,0.353076602022369,2025-04-25 07:25:19.886637,2025-04-25 07:25:20.991454,0 days 00:00:01.104817,92.47332324619121,0.0014142613486837926,0.14751197778449268,rbf,TPESampler,COMPLETE
1552,0.7710249677742962,2025-04-25 07:25:21.159060,2025-04-25 07:39:21.402742,0 days 00:14:00.243682,57.998858474815904,0.071713161120153,0.07436491185529986,poly,TPESampler,COMPLETE
1553,0.297518019494733,2025-04-25 07:25:23.553339,2025-04-25 07:25:25.341004,0 days 00:00:01.787665,84.9737012987816,0.001422679456309182,0.08361283574764948,rbf,TPESampler,COMPLETE
1554,0.23091321296213432,2025-04-25 07:25:25.511593,2025-04-25 07:25:26.834614,0 days 00:00:01.323021,52.76833342665067,0.0010270841668405086,0.05366561848563676,rbf,TPESampler,COMPLETE
1555,0.23838659071119198,2025-04-25 07:25:27.012509,2025-04-25 07:25:27.643006,0 days 00:00:00.630497,11.588217225232066,0.0021154740283089502,0.007770672414399976,rbf,TPESampler,COMPLETE
1556,0.26479348072897047,2025-04-25 07:25:27.830662,2025-04-25 07:25:30.218453,0 days 00:00:02.387791,2.800403442989969,0.0012182387097030188,0.016993811463064334,linear,TPESampler,COMPLETE
1557,694.9018899452919,2025-04-25 07:25:30.408554,2025-04-25 07:25:30.980039,0 days 00:00:00.571485,95.55264077941244,0.0055947889282796474,0.009452161695441792,sigmoid,TPESampler,COMPLETE
1558,0.26764517683212713,2025-04-25 07:25:31.152196,2025-04-25 07:25:31.774917,0 days 00:00:00.622721,25.601700438514115,0.0011171380478876447,0.002890737525375448,rbf,TPESampler,COMPLETE
1559,0.7994490032120729,2025-04-25 07:25:31.951445,2025-04-25 07:25:32.518168,0 days 00:00:00.566723,0.00484814235930468,0.0012344111768489425,0.025701618874517853,sigmoid,TPESampler,COMPLETE
1560,0.25117821304406646,2025-04-25 07:25:32.693735,2025-04-25 07:25:34.244717,0 days 00:00:01.550982,84.54137310028662,0.0024114421375445983,0.05973919661692196,rbf,TPESampler,COMPLETE
1561,101.64805274661585,2025-04-25 07:25:34.433148,2025-04-25 07:25:35.032618,0 days 00:00:00.599470,4.4569747383237415,0.01855361097504872,0.05328400573255772,sigmoid,TPESampler,COMPLETE
1562,0.17316242005236457,2025-04-25 07:25:35.208718,2025-04-25 07:25:36.599244,0 days 00:00:01.390526,99.60613941726288,0.003133497628792519,0.023531401412287586,rbf,TPESampler,COMPLETE
1563,0.20700761407294346,2025-04-25 07:25:36.777985,2025-04-25 07:25:38.137267,0 days 00:00:01.359282,99.36599605681397,0.005498167958812854,0.04385391819774735,rbf,TPESampler,COMPLETE
1564,0.2015974618051459,2025-04-25 07:25:38.313511,2025-04-25 07:25:39.114406,0 days 00:00:00.800895,95.0304552474256,0.005322432454356454,0.0034561991352182967,rbf,TPESampler,COMPLETE
1565,0.18877331258197394,2025-04-25 07:25:39.307031,2025-04-25 07:25:40.697781,0 days 00:00:01.390750,94.93064293534235,0.0019306593655676163,0.016659084544542596,rbf,TPESampler,COMPLETE
1566,0.2499602382117396,2025-04-25 07:25:40.887401,2025-04-25 07:25:41.572662,0 days 00:00:00.685261,17.613592641662063,0.027629694962847662,0.060313726179461034,rbf,TPESampler,COMPLETE
1567,0.20715837665149636,2025-04-25 07:25:41.756237,2025-04-25 07:25:42.565360,0 days 00:00:00.809123,19.12044985823839,0.0017889025412389584,0.026380009707720135,rbf,TPESampler,COMPLETE
1568,0.5419849818228436,2025-04-25 07:25:42.750596,2025-04-25 07:25:43.315926,0 days 00:00:00.565330,1.830742283384675,0.9387679109105401,0.03560167184375159,rbf,TPESampler,COMPLETE
1569,0.20122631789006407,2025-04-25 07:25:43.492360,2025-04-25 07:25:44.504819,0 days 00:00:01.012459,88.19620453120524,0.016863718720141103,0.012708690805345547,rbf,TPESampler,COMPLETE
1570,0.2609369714612406,2025-04-25 07:25:44.688035,2025-04-25 07:25:45.571014,0 days 00:00:00.882979,13.270368281404798,0.00114005774044792,0.06751119537291247,rbf,TPESampler,COMPLETE
1571,0.3809683799048852,2025-04-25 07:25:45.751816,2025-04-25 07:25:46.531430,0 days 00:00:00.779614,97.62117038109825,0.002751597205035138,0.20450699841664663,rbf,TPESampler,COMPLETE
1572,0.1830546190543276,2025-04-25 07:25:46.710918,2025-04-25 07:25:48.428698,0 days 00:00:01.717780,95.73992221165543,0.0010854756482572795,0.036808871267037094,rbf,TPESampler,COMPLETE
1573,0.6231481925360124,2025-04-25 07:25:48.608376,2025-04-25 07:26:20.522945,0 days 00:00:31.914569,5.794888600372471,0.01650957294012464,0.032259142602755614,poly,TPESampler,COMPLETE
1574,0.1983764689036253,2025-04-25 07:26:20.782584,2025-04-25 07:26:21.769273,0 days 00:00:00.986689,99.81683044836304,0.008242925196956295,0.008587998799809959,rbf,TPESampler,COMPLETE
1575,0.6143383176466635,2025-04-25 07:26:21.939323,2025-04-25 07:30:44.844227,0 days 00:04:22.904904,73.64499856738068,0.0013311429263112992,0.019210012858438236,poly,TPESampler,COMPLETE
1576,0.1823892016427559,2025-04-25 07:30:45.036888,2025-04-25 07:30:45.723548,0 days 00:00:00.686660,95.37344006720188,0.05158497351414552,0.031167333377250556,rbf,TPESampler,COMPLETE
1577,382.80999078711835,2025-04-25 07:30:45.895605,2025-04-25 07:30:46.506964,0 days 00:00:00.611359,58.73804263750206,0.0010369650707179726,0.008563520409503596,sigmoid,TPESampler,COMPLETE
1578,0.6947048991141297,2025-04-25 07:30:46.677067,2025-04-25 07:30:47.140141,0 days 00:00:00.463074,0.15205793973554638,0.7553421359708072,0.0017018921199951644,sigmoid,TPESampler,COMPLETE
1579,0.19743635391577183,2025-04-25 07:30:47.310047,2025-04-25 07:30:48.046972,0 days 00:00:00.736925,12.905162101192312,0.0010095532273709808,0.02649051785342886,rbf,TPESampler,COMPLETE
1580,0.20677484361226522,2025-04-25 07:30:48.217839,2025-04-25 07:30:48.948021,0 days 00:00:00.730182,20.793265185903063,0.012832301891465043,0.025170642726705716,rbf,TPESampler,COMPLETE
1581,0.4183941527251592,2025-04-25 07:30:49.126728,2025-04-25 07:30:49.683986,0 days 00:00:00.557258,0.03443989380515591,0.009513264709153013,0.00011382375343745993,linear,TPESampler,COMPLETE
1582,0.5755384290239602,2025-04-25 07:30:49.863893,2025-04-25 07:30:50.319469,0 days 00:00:00.455576,0.007884233028890778,0.9849154463098176,0.003880006247279507,linear,TPESampler,COMPLETE
1583,445.10116532318904,2025-04-25 07:30:50.494535,2025-04-25 07:30:51.099821,0 days 00:00:00.605286,21.95760435655999,0.007980233446216711,0.033584841440900785,sigmoid,TPESampler,COMPLETE
1584,0.188549484084942,2025-04-25 07:30:51.399146,2025-04-25 07:30:52.629314,0 days 00:00:01.230168,98.11573348260802,0.00224197539808988,0.01685242732745036,rbf,TPESampler,COMPLETE
1585,0.22243622222433218,2025-04-25 07:30:52.806162,2025-04-25 07:30:53.838184,0 days 00:00:01.032022,84.56692496071747,0.015398644599015965,0.048854229377660874,rbf,TPESampler,COMPLETE
1586,0.39387792643952313,2025-04-25 07:30:54.012716,2025-04-25 07:30:54.629904,0 days 00:00:00.617188,0.05787130690934586,0.013777979410973694,0.2669504848666017,linear,TPESampler,COMPLETE
1587,0.21067639389337972,2025-04-25 07:30:54.873943,2025-04-25 07:30:55.568376,0 days 00:00:00.694433,62.82611175594886,0.001162281241936684,0.003164113438511078,rbf,TPESampler,COMPLETE
1588,0.1894095788186936,2025-04-25 07:30:55.741842,2025-04-25 07:30:56.458179,0 days 00:00:00.716337,25.91462263025481,0.004281655225502009,0.010087357313154752,rbf,TPESampler,COMPLETE
1589,0.23842204830612929,2025-04-25 07:30:56.649872,2025-04-25 07:30:58.135728,0 days 00:00:01.485856,94.18287074811636,0.0020072085847168846,0.054220224579799726,rbf,TPESampler,COMPLETE
1590,0.8966839793294276,2025-04-25 07:30:58.307044,2025-04-25 07:30:58.801980,0 days 00:00:00.494936,0.001389875391523049,0.7916123629717137,0.001261008754443435,sigmoid,TPESampler,COMPLETE
1591,0.4191368460777142,2025-04-25 07:30:58.974692,2025-04-25 07:30:59.550674,0 days 00:00:00.575982,0.034476508594506836,0.001313056910781012,0.002097079812694928,linear,TPESampler,COMPLETE
1592,62.54484480225958,2025-04-25 07:30:59.730319,2025-04-25 11:01:30.379935,0 days 03:30:30.649616,33.93705930495133,0.004681956632404292,0.8793891213253293,poly,TPESampler,COMPLETE
1593,0.20400532819283299,2025-04-25 07:31:37.307994,2025-04-25 07:31:38.103097,0 days 00:00:00.795103,87.08121402566603,0.001052140309851075,0.003392007786092133,rbf,TPESampler,COMPLETE
1594,0.19614641466847643,2025-04-25 07:31:38.281271,2025-04-25 07:31:39.006891,0 days 00:00:00.725620,20.181047804254007,0.008067590299709741,0.022205404778034076,rbf,TPESampler,COMPLETE
1595,0.21667315106457055,2025-04-25 07:31:39.177891,2025-04-25 07:31:39.807050,0 days 00:00:00.629159,16.083428562200446,0.0010041979608262734,0.008922468249187071,rbf,TPESampler,COMPLETE
1596,0.20523382107908053,2025-04-25 07:31:39.981352,2025-04-25 07:31:40.793232,0 days 00:00:00.811880,22.64674751382465,0.002951044778440047,0.023675211281390156,rbf,TPESampler,COMPLETE
1597,2240.8960156356,2025-04-25 07:31:40.979416,2025-04-25 07:31:41.551185,0 days 00:00:00.571769,94.46635066687331,0.0037816483377158695,0.08623233241255301,sigmoid,TPESampler,COMPLETE
1598,0.18714124814538055,2025-04-25 07:31:41.723305,2025-04-25 07:31:42.633573,0 days 00:00:00.910268,80.5878561450169,0.003342156934763724,0.008497527352051493,rbf,TPESampler,COMPLETE
1599,0.1872208101635201,2025-04-25 07:31:42.809372,2025-04-25 07:31:43.653767,0 days 00:00:00.844395,75.46272879095872,0.02367772101185515,0.020871800805193155,rbf,TPESampler,COMPLETE
1600,0.29127668664102757,2025-04-25 07:31:43.834856,2025-04-25 07:31:44.705403,0 days 00:00:00.870547,21.963949458652454,0.005466339845915594,0.08483391837126197,rbf,TPESampler,COMPLETE
1601,0.1819002506013037,2025-04-25 07:31:44.879658,2025-04-25 07:31:45.879755,0 days 00:00:01.000097,98.36697359578025,0.006319172078047221,0.007176952858513656,rbf,TPESampler,COMPLETE
1602,0.2132020403031963,2025-04-25 07:31:46.057108,2025-04-25 07:31:47.204002,0 days 00:00:01.146894,91.96835298686293,0.011469292223177573,0.04564048549883372,rbf,TPESampler,COMPLETE
1603,0.20342919137783708,2025-04-25 07:31:47.394293,2025-04-25 07:31:48.250616,0 days 00:00:00.856323,25.427340199236397,0.003711692396755504,0.03418677437011266,rbf,TPESampler,COMPLETE
1604,0.3379804767211801,2025-04-25 07:31:48.426930,2025-04-25 07:31:49.808268,0 days 00:00:01.381338,83.0784340421079,0.0010559277173618554,0.12644607391450205,rbf,TPESampler,COMPLETE
1605,0.18831950276418605,2025-04-25 07:31:49.986698,2025-04-25 07:31:50.690430,0 days 00:00:00.703732,14.59702144659515,0.002526263024468189,0.020721038361306808,rbf,TPESampler,COMPLETE
1606,0.19019605557364958,2025-04-25 07:31:50.880937,2025-04-25 07:31:52.134745,0 days 00:00:01.253808,99.76973891115271,0.003021122830629874,0.015072028260821255,rbf,TPESampler,COMPLETE
1607,0.1835992986669714,2025-04-25 07:31:52.317949,2025-04-25 07:31:53.230465,0 days 00:00:00.912516,98.82519160365348,0.012422697014629646,0.007349709552229268,rbf,TPESampler,COMPLETE
1608,0.8986604910002792,2025-04-25 07:31:53.402391,2025-04-25 07:31:53.945870,0 days 00:00:00.543479,0.002385842343913985,0.006155305849286309,0.00039725240723854157,sigmoid,TPESampler,COMPLETE
1609,0.1892609488366775,2025-04-25 07:31:54.127048,2025-04-25 07:31:54.899310,0 days 00:00:00.772262,17.024355227713247,0.0011128925079030329,0.014839120667093237,rbf,TPESampler,COMPLETE
1610,0.27719115237489883,2025-04-25 07:31:55.079209,2025-04-25 07:31:56.652243,0 days 00:00:01.573034,92.81986030891433,0.0011342895637767136,0.07170127142267907,rbf,TPESampler,COMPLETE
1611,0.17105828151995148,2025-04-25 07:31:56.827793,2025-04-25 07:31:58.122640,0 days 00:00:01.294847,94.81053997998684,0.008091222189919907,0.025532974957115196,rbf,TPESampler,COMPLETE
1612,0.19910892722732682,2025-04-25 07:31:58.301593,2025-04-25 07:31:59.485934,0 days 00:00:01.184341,93.64747427367443,0.009780015585159493,0.041454962854821094,rbf,TPESampler,COMPLETE
1613,0.38000846295425206,2025-04-25 07:31:59.670290,2025-04-25 07:32:00.324510,0 days 00:00:00.654220,26.86797664408049,0.010015931151472307,0.20442068824092163,rbf,TPESampler,COMPLETE
1614,0.17540516094742015,2025-04-25 07:32:00.499241,2025-04-25 07:32:02.285356,0 days 00:00:01.786115,98.99019351936208,0.0022775293679313446,0.03274562304302374,rbf,TPESampler,COMPLETE
1615,0.2656642485694647,2025-04-25 07:32:02.456321,2025-04-25 07:32:03.088392,0 days 00:00:00.632071,4.552129910426013,0.008724663652982382,0.0668854442924839,rbf,TPESampler,COMPLETE
1616,0.4571116948007434,2025-04-25 07:32:03.525585,2025-04-25 07:32:05.228430,0 days 00:00:01.702845,6.15274812642986,0.5955844913375478,0.02194749057293947,linear,TPESampler,COMPLETE
1617,0.39066037054354885,2025-04-25 07:32:05.401625,2025-04-25 07:32:06.087545,0 days 00:00:00.685920,8.22460448888133,0.0010470672041242004,0.23079450084525097,rbf,TPESampler,COMPLETE
1618,0.49483021239702407,2025-04-25 07:32:06.263932,2025-04-25 07:32:06.794190,0 days 00:00:00.530258,0.005916071580820475,0.0010110629599423002,0.5045074070147404,linear,TPESampler,COMPLETE
1619,0.2523397940921871,2025-04-25 07:32:06.968853,2025-04-25 07:32:07.555376,0 days 00:00:00.586523,3.707344325193394,0.007081000913838469,0.02254910423280887,rbf,TPESampler,COMPLETE
1620,0.18983435197871773,2025-04-25 07:32:07.725853,2025-04-25 07:32:08.396929,0 days 00:00:00.671076,21.322239863981824,0.005715958965230881,0.011901423438094806,rbf,TPESampler,COMPLETE
1621,0.19263318239734817,2025-04-25 07:32:08.565658,2025-04-25 07:32:09.941009,0 days 00:00:01.375351,95.97301992550639,0.0036177438557012994,0.01472664831510896,rbf,TPESampler,COMPLETE
1622,0.8887392023948257,2025-04-25 07:32:10.319564,2025-04-25 07:32:10.872480,0 days 00:00:00.552916,0.02423296400018223,0.29870912237760305,0.00010718311226001211,rbf,TPESampler,COMPLETE
1623,0.20030936205645716,2025-04-25 07:32:11.107138,2025-04-25 07:32:12.351743,0 days 00:00:01.244605,92.76863546892798,0.0027747877269241016,0.012334598991745457,rbf,TPESampler,COMPLETE
1624,0.3486327956434599,2025-04-25 07:32:12.525389,2025-04-25 07:32:13.779383,0 days 00:00:01.253994,87.3399028076099,0.004481248399990129,0.1420582430876353,rbf,TPESampler,COMPLETE
1625,0.2648926494636468,2025-04-25 07:32:13.992734,2025-04-25 07:32:15.566224,0 days 00:00:01.573490,96.82461112325785,0.0041654783800881045,0.06639028742643692,rbf,TPESampler,COMPLETE
1626,0.2914582618008903,2025-04-25 07:32:15.743377,2025-04-25 07:32:16.601682,0 days 00:00:00.858305,14.43593471871375,0.0023963438204060252,0.08746105951839986,rbf,TPESampler,COMPLETE
1627,1.0400734107708072,2025-04-25 07:32:16.776669,2025-04-25 07:32:17.341921,0 days 00:00:00.565252,0.03314375814016741,0.007217587895999221,0.6111460732323528,sigmoid,TPESampler,COMPLETE
1628,0.2740689587901395,2025-04-25 07:32:17.515886,2025-04-25 07:32:32.357056,0 days 00:00:14.841170,20.66131877416397,0.0010098457861780837,0.023680847224024554,linear,TPESampler,COMPLETE
1629,0.21189149071775823,2025-04-25 07:32:32.533004,2025-04-25 07:32:33.163995,0 days 00:00:00.630991,16.455161374395374,0.03277022477920397,0.028655886445555452,rbf,TPESampler,COMPLETE
1630,0.22751445657849367,2025-04-25 07:32:33.337319,2025-04-25 07:32:34.113254,0 days 00:00:00.775935,20.49181373268104,0.011669376225243725,0.04852781941239317,rbf,TPESampler,COMPLETE
1631,0.1845771970440414,2025-04-25 07:32:34.294502,2025-04-25 07:32:35.580759,0 days 00:00:01.286257,97.59190233181347,0.002502560962601406,0.01979634416416685,rbf,TPESampler,COMPLETE
1632,0.18858582380004302,2025-04-25 07:32:35.752430,2025-04-25 07:32:37.004135,0 days 00:00:01.251705,99.41549048389182,0.001608799431724112,0.0174384349609514,rbf,TPESampler,COMPLETE
1633,0.18031792630609528,2025-04-25 07:32:37.179717,2025-04-25 07:32:37.879534,0 days 00:00:00.699817,24.112073851266747,0.007327772395837352,0.014084949597854675,rbf,TPESampler,COMPLETE
1634,0.18155057336537822,2025-04-25 07:32:38.052284,2025-04-25 07:32:38.797479,0 days 00:00:00.745195,22.98081788826666,0.0010085589129246637,0.01584085349236974,rbf,TPESampler,COMPLETE
1635,0.2858168503665749,2025-04-25 07:32:38.967461,2025-04-25 07:32:39.754450,0 days 00:00:00.786989,86.90521586090672,0.02635410786892802,0.07883823745181237,rbf,TPESampler,COMPLETE
1636,0.2059055920273572,2025-04-25 07:32:39.928349,2025-04-25 07:32:40.663730,0 days 00:00:00.735381,22.339988632812567,0.013640086562218684,0.02418705228983685,rbf,TPESampler,COMPLETE
1637,0.44866117239796266,2025-04-25 07:32:40.837821,2025-04-25 07:32:41.299988,0 days 00:00:00.462167,20.569013712526292,0.7603535243516145,0.0031762213609894297,rbf,TPESampler,COMPLETE
1638,0.21464568010490787,2025-04-25 07:32:41.474672,2025-04-25 07:32:42.324801,0 days 00:00:00.850129,18.419072921045625,0.0029437992542595782,0.008177939084428853,rbf,TPESampler,COMPLETE
1639,0.8554109557097058,2025-04-25 07:32:42.502867,2025-04-25 07:32:43.757310,0 days 00:00:01.254443,0.07410930275253265,0.0012344549141251808,0.00021473482807716335,sigmoid,TPESampler,COMPLETE
1640,0.9554436812320237,2025-04-25 07:32:44.436315,2025-04-25 07:32:45.315603,0 days 00:00:00.879288,0.49726475934159264,0.9820376885906038,0.10716926622261765,poly,TPESampler,COMPLETE
1641,0.21126693927934717,2025-04-25 07:32:45.616565,2025-04-25 07:32:47.322451,0 days 00:00:01.705886,20.911832996266785,0.001006973423707828,0.0389594413754828,rbf,TPESampler,COMPLETE
1642,0.834540148421073,2025-04-25 07:32:47.800354,2025-04-25 07:32:48.612696,0 days 00:00:00.812342,0.0023002761663798404,0.001139426201735044,0.014217411893385441,rbf,TPESampler,COMPLETE
1643,0.16938625750502534,2025-04-25 07:32:48.989169,2025-04-25 07:32:50.994887,0 days 00:00:02.005718,97.84762255113964,0.0015807187778798238,0.026648440391375136,rbf,TPESampler,COMPLETE
1644,0.18798224487641924,2025-04-25 07:32:51.243871,2025-04-25 07:32:52.163982,0 days 00:00:00.920111,15.825106252966247,0.0022730790144553687,0.016687073961521,rbf,TPESampler,COMPLETE
