number,value,datetime_start,datetime_complete,duration,params_C,params_epsilon,params_gamma,params_kernel,system_attrs_auto:sampler,state
1645,0.1862489912925864,2025-04-25 07:32:52.355417,2025-04-25 07:32:54.410490,0 days 00:00:02.055073,95.61153616235958,0.0013436282229015645,0.0380372057312485,rbf,TPESampler,COMPLETE
1646,0.17361211145601047,2025-04-25 07:32:54.584692,2025-04-25 07:32:55.555725,0 days 00:00:00.971033,85.46201309624232,0.020287969522412082,0.024729267980584568,rbf,TPESampler,COMPLETE
1647,0.1794157121991615,2025-04-25 07:32:55.898770,2025-04-25 07:32:57.498328,0 days 00:00:01.599558,76.05356287640058,0.0010178955938052283,0.034069190157725505,rbf,TPESampler,COMPLETE
1648,0.2847078720356254,2025-04-25 07:32:57.672720,2025-04-25 07:32:59.043621,0 days 00:00:01.370901,90.20441093872054,0.003109007251075941,0.07605675633014414,rbf,TPESampler,COMPLETE
1649,0.22542882391636598,2025-04-25 07:32:59.220688,2025-04-25 07:32:59.849767,0 days 00:00:00.629079,16.483263518293814,0.00917134757114888,0.006809740018279135,rbf,TPESampler,COMPLETE
1650,0.18788355649038624,2025-04-25 07:33:00.036898,2025-04-25 07:33:01.164434,0 days 00:00:01.127536,91.09282277064442,0.011316290199397474,0.016590319478063036,rbf,TPESampler,COMPLETE
1651,0.2081223025911492,2025-04-25 07:33:01.342689,2025-04-25 07:33:02.522481,0 days 00:00:01.179792,98.30982218054508,0.0015447374989401375,0.00946141276079867,rbf,TPESampler,COMPLETE
1652,0.2939372698388993,2025-04-25 07:33:02.701180,2025-04-25 07:33:03.644120,0 days 00:00:00.942940,24.162024618814044,0.0029715257860895216,0.08583820559349653,rbf,TPESampler,COMPLETE
1653,0.22616052005089682,2025-04-25 07:33:03.891037,2025-04-25 07:33:05.712350,0 days 00:00:01.821313,98.65288028407535,0.0014692854823291717,0.04971391726089618,rbf,TPESampler,COMPLETE
1654,0.3210474381787698,2025-04-25 07:33:05.886523,2025-04-25 07:33:06.722881,0 days 00:00:00.836358,23.183666472119377,0.002803627098824217,0.10926792192546673,rbf,TPESampler,COMPLETE
1655,0.21761242509182177,2025-04-25 07:33:06.896647,2025-04-25 07:33:07.635028,0 days 00:00:00.738381,14.642016713584095,0.008868093567743344,0.04125428762839281,rbf,TPESampler,COMPLETE
1656,0.19543403053697692,2025-04-25 07:33:07.814039,2025-04-25 07:33:08.581426,0 days 00:00:00.767387,17.464755925968205,0.001159111909348676,0.023855358020245007,rbf,TPESampler,COMPLETE
1657,0.3488555567733732,2025-04-25 07:33:08.754961,2025-04-25 07:33:09.342100,0 days 00:00:00.587139,3.7556150429448056,0.008119583970832315,0.004894798915429914,rbf,TPESampler,COMPLETE
1658,0.1800526862386902,2025-04-25 07:33:09.538860,2025-04-25 07:33:11.095146,0 days 00:00:01.556286,73.61524812409866,0.0010510751600007924,0.03429869502424587,rbf,TPESampler,COMPLETE
1659,0.2118477637057604,2025-04-25 07:33:11.273689,2025-04-25 07:33:12.157372,0 days 00:00:00.883683,19.464354242747945,0.004077778609325908,0.03846728067770874,rbf,TPESampler,COMPLETE
1660,0.27601765772519643,2025-04-25 07:33:12.337096,2025-04-25 07:33:47.626800,0 days 00:00:35.289704,61.27009220757759,0.0011037376147868233,0.02557137754629908,linear,TPESampler,COMPLETE
1661,0.2156708898902712,2025-04-25 07:33:47.814629,2025-04-25 07:33:48.481971,0 days 00:00:00.667342,31.459364498371123,0.0037919068301022043,0.004802649369788551,rbf,TPESampler,COMPLETE
1662,0.2789398196626758,2025-04-25 07:33:48.660164,2025-04-25 07:33:49.269612,0 days 00:00:00.609448,2.09297622528227,0.0020066002204526725,0.030081580713125333,rbf,TPESampler,COMPLETE
1663,0.18921785494166868,2025-04-25 07:33:49.445241,2025-04-25 07:33:50.683706,0 days 00:00:01.238465,96.50151375109677,0.002317207597798973,0.015772543242109777,rbf,TPESampler,COMPLETE
1664,0.18042479064872144,2025-04-25 07:33:50.871590,2025-04-25 07:33:51.654174,0 days 00:00:00.782584,24.763449391432218,0.0010675446736112288,0.014671483996953392,rbf,TPESampler,COMPLETE
1665,0.3463745622139597,2025-04-25 07:33:51.836451,2025-04-25 07:33:57.447782,0 days 00:00:05.611331,58.30118932919139,0.3619683137007124,0.002294617493536772,linear,TPESampler,COMPLETE
1666,0.6962387949670248,2025-04-25 07:33:57.623139,2025-04-25 07:37:55.995213,0 days 00:03:58.372074,44.15756499418789,0.01174057200099941,0.03619999806688732,poly,TPESampler,COMPLETE
1667,0.18535845042542953,2025-04-25 07:37:56.191465,2025-04-25 07:37:57.083232,0 days 00:00:00.891767,96.7087102309171,0.02314150415897895,0.03700304202172564,rbf,TPESampler,COMPLETE
1668,0.27691570332088133,2025-04-25 07:37:57.402902,2025-04-25 07:38:57.617849,0 days 00:01:00.214947,87.02149535859581,0.017827046134114007,0.035026669652466695,linear,TPESampler,COMPLETE
1669,0.316273572759346,2025-04-25 07:38:57.803984,2025-04-25 07:38:58.813463,0 days 00:00:01.009479,94.11031731781013,0.010254185585987204,0.10327597442008832,rbf,TPESampler,COMPLETE
1670,524.7830681953642,2025-04-25 07:38:58.988845,2025-04-25 07:38:59.564178,0 days 00:00:00.575333,82.51589128890178,0.019237431572702655,0.008396685786573592,sigmoid,TPESampler,COMPLETE
1671,0.19881337263876486,2025-04-25 07:38:59.749362,2025-04-25 07:39:00.578275,0 days 00:00:00.828913,96.679094419418,0.00158318027766547,0.0037553422459267855,rbf,TPESampler,COMPLETE
1672,0.21312618993398216,2025-04-25 07:39:00.757127,2025-04-25 07:39:01.557772,0 days 00:00:00.800645,17.085242089254418,0.003923547962146777,0.03863558342160885,rbf,TPESampler,COMPLETE
1673,0.27605778599022207,2025-04-25 07:39:01.734749,2025-04-25 07:39:03.409359,0 days 00:00:01.674610,94.86370097876238,0.001224328489622057,0.07105157511217693,rbf,TPESampler,COMPLETE
1674,0.19890442529028932,2025-04-25 07:39:03.584705,2025-04-25 07:39:04.890270,0 days 00:00:01.305565,98.42161633652299,0.001424509828273072,0.008525042138202515,rbf,TPESampler,COMPLETE
1675,0.2667684922477524,2025-04-25 07:39:05.068619,2025-04-25 07:39:05.685560,0 days 00:00:00.616941,24.28290019988137,0.008572732456901141,0.003017494076928377,rbf,TPESampler,COMPLETE
1676,0.22173304559008758,2025-04-25 07:39:05.876194,2025-04-25 07:39:06.657324,0 days 00:00:00.781130,17.30373225476896,0.00742942779566308,0.04484900355640517,rbf,TPESampler,COMPLETE
1677,0.20523663785749136,2025-04-25 07:39:06.831064,2025-04-25 07:39:07.611821,0 days 00:00:00.780757,22.114838713864874,0.0037011042269484555,0.024399334198714377,rbf,TPESampler,COMPLETE
1678,1955.78735318933,2025-04-25 07:39:07.787683,2025-04-25 07:39:08.377977,0 days 00:00:00.590294,95.65821989943635,0.003419554292240078,0.03470734675046299,sigmoid,TPESampler,COMPLETE
1679,0.2748179431892486,2025-04-25 07:39:08.556869,2025-04-25 07:39:10.290642,0 days 00:00:01.733773,98.00641847027869,0.0011223449814196421,0.07028360753450916,rbf,TPESampler,COMPLETE
1680,0.6928672731298487,2025-04-25 07:39:10.502350,2025-04-25 07:39:11.473075,0 days 00:00:00.970725,0.001109630548831961,0.022416698334839516,0.25786284855785196,poly,TPESampler,COMPLETE
1681,0.2760175376741115,2025-04-25 07:39:11.648611,2025-04-25 07:40:01.451897,0 days 00:00:49.803286,83.53090684674457,0.0010579257788331492,0.008202079488735184,linear,TPESampler,COMPLETE
1682,0.18473004820328098,2025-04-25 07:39:21.585449,2025-04-25 07:39:22.257923,0 days 00:00:00.672474,17.387728448206026,0.018801368331962984,0.01746596701486706,rbf,TPESampler,COMPLETE
1683,0.19193203662103964,2025-04-25 07:39:22.434884,2025-04-25 07:39:23.528617,0 days 00:00:01.093733,97.1901392031653,0.005933514528923466,0.014687301254397232,rbf,TPESampler,COMPLETE
1684,0.1748757895682474,2025-04-25 07:39:23.709633,2025-04-25 07:39:25.058529,0 days 00:00:01.348896,98.53129079494151,0.0021738664783112643,0.02310793569818547,rbf,TPESampler,COMPLETE
1685,1294.7551669511242,2025-04-25 07:39:25.238474,2025-04-25 07:39:25.795411,0 days 00:00:00.556937,69.11777373618236,0.03277584931674459,0.02895952896112681,sigmoid,TPESampler,COMPLETE
1686,0.22470509274101588,2025-04-25 07:39:25.978026,2025-04-25 07:39:27.133105,0 days 00:00:01.155079,94.27248129011475,0.014865080343792478,0.04937505198513661,rbf,TPESampler,COMPLETE
1687,0.2606034026364086,2025-04-25 07:39:27.310237,2025-04-25 07:39:28.906617,0 days 00:00:01.596380,86.92925196620126,0.004036183619420106,0.06460131283405109,rbf,TPESampler,COMPLETE
1688,0.19535725861218414,2025-04-25 07:39:29.083336,2025-04-25 07:39:30.327976,0 days 00:00:01.244640,95.73120066950413,0.0029396112714341477,0.013993483128484923,rbf,TPESampler,COMPLETE
1689,0.6672634135596391,2025-04-25 07:39:30.503947,2025-04-25 07:39:35.703494,0 days 00:00:05.199547,8.393367572172467,0.0016186020496704008,0.021306050099496765,poly,TPESampler,COMPLETE
1690,0.18722326719316099,2025-04-25 07:39:35.880060,2025-04-25 07:39:36.610354,0 days 00:00:00.730294,22.017998102746006,0.0033293579523630164,0.019074773999837858,rbf,TPESampler,COMPLETE
1691,0.7451556368445621,2025-04-25 07:39:36.788253,2025-04-25 07:39:37.261201,0 days 00:00:00.472948,63.975958893420156,0.9013305779763914,0.006689698488583545,poly,TPESampler,COMPLETE
1692,0.22608412960046362,2025-04-25 07:39:37.440903,2025-04-25 07:39:38.069602,0 days 00:00:00.628699,20.632716598041217,0.00979375183726192,0.005428380896660409,rbf,TPESampler,COMPLETE
1693,0.3071347891185468,2025-04-25 07:39:38.251026,2025-04-25 07:39:38.922556,0 days 00:00:00.671530,2.8459278966226553,0.0029945971907997873,0.09915689155085214,rbf,TPESampler,COMPLETE
1694,0.6184067717842185,2025-04-25 07:39:39.094808,2025-04-25 07:43:17.173753,0 days 00:03:38.078945,96.38943813727269,0.04118675434970425,0.018413161767062036,poly,TPESampler,COMPLETE
1695,0.19061668136818813,2025-04-25 07:40:01.654109,2025-04-25 07:40:02.711588,0 days 00:00:01.057479,86.87652479269333,0.01512485621162988,0.015391911678819205,rbf,TPESampler,COMPLETE
1696,0.1921359103768962,2025-04-25 07:40:02.887337,2025-04-25 07:40:04.115224,0 days 00:00:01.227887,78.6784367473128,0.001130428592937479,0.01675488283958489,rbf,TPESampler,COMPLETE
1697,0.18178731424255662,2025-04-25 07:40:04.291157,2025-04-25 07:40:05.000783,0 days 00:00:00.709626,21.632545248353637,0.006826504534610136,0.01625635996188724,rbf,TPESampler,COMPLETE
1698,0.22594726541483529,2025-04-25 07:40:05.179754,2025-04-25 07:40:06.042352,0 days 00:00:00.862598,18.136704443246796,0.002543361277270142,0.048219519048205664,rbf,TPESampler,COMPLETE
1699,0.1784621464202715,2025-04-25 07:40:06.230159,2025-04-25 07:40:08.093636,0 days 00:00:01.863477,98.03010309285315,0.002105387883177191,0.03468974171001166,rbf,TPESampler,COMPLETE
1700,0.36152530005839767,2025-04-25 07:40:08.267696,2025-04-25 07:40:09.015641,0 days 00:00:00.747945,25.628853840931832,0.005099050202143976,0.16711403359720578,rbf,TPESampler,COMPLETE
1701,0.2413859221750515,2025-04-25 07:40:09.195349,2025-04-25 07:40:10.801195,0 days 00:00:01.605846,96.65898096571709,0.002243740647203494,0.05542748177508164,rbf,TPESampler,COMPLETE
1702,0.19008016716760393,2025-04-25 07:40:11.017100,2025-04-25 07:40:12.254335,0 days 00:00:01.237235,95.67826073575439,0.009873780807210039,0.03866048546607675,rbf,TPESampler,COMPLETE
1703,0.1680788855360382,2025-04-25 07:40:12.437263,2025-04-25 07:40:13.975646,0 days 00:00:01.538383,97.9492321233543,0.002729950215714729,0.027915075518913503,rbf,TPESampler,COMPLETE
1704,635.0628827722084,2025-04-25 07:40:14.153768,2025-04-25 07:40:14.716256,0 days 00:00:00.562488,31.476729438775134,0.8871765771667941,0.03258885510603656,sigmoid,TPESampler,COMPLETE
1705,0.20826067027581752,2025-04-25 07:40:14.897384,2025-04-25 07:40:15.633893,0 days 00:00:00.736509,20.08082856571456,0.01713905487814359,0.024360064056513968,rbf,TPESampler,COMPLETE
1706,0.20225748425929438,2025-04-25 07:40:15.813763,2025-04-25 07:40:16.942397,0 days 00:00:01.128634,98.82177469991048,0.0055389215414432666,0.011089384113005368,rbf,TPESampler,COMPLETE
1707,0.8254885321601249,2025-04-25 07:40:17.125030,2025-04-25 07:40:17.709147,0 days 00:00:00.584117,0.05972257212417589,0.0055636952305523,0.7175514907800182,rbf,TPESampler,COMPLETE
1708,0.2990723806439454,2025-04-25 07:40:17.895980,2025-04-25 07:40:19.121347,0 days 00:00:01.225367,91.41440921655682,0.007212337791730463,0.08684103577334043,rbf,TPESampler,COMPLETE
1709,0.2151557732602893,2025-04-25 07:40:19.311073,2025-04-25 07:40:19.945836,0 days 00:00:00.634763,16.949298568413376,0.009009206345101587,0.00874617423144417,rbf,TPESampler,COMPLETE
1710,0.42764352549568746,2025-04-25 07:40:20.124076,2025-04-25 07:40:20.695162,0 days 00:00:00.571086,0.027134982388334627,0.013299380954390644,0.0012247760391429796,linear,TPESampler,COMPLETE
1711,0.44342413432781264,2025-04-25 07:40:20.874788,2025-04-25 07:40:21.369703,0 days 00:00:00.494915,0.027602169290237167,0.30779543678574517,0.04359066071233633,linear,TPESampler,COMPLETE
1712,0.18802275368867408,2025-04-25 07:40:21.549876,2025-04-25 07:40:22.815081,0 days 00:00:01.265205,99.58135453656237,0.00856056462566505,0.01638591035536118,rbf,TPESampler,COMPLETE
1713,0.2410155805129579,2025-04-25 07:40:22.991525,2025-04-25 07:40:24.666638,0 days 00:00:01.675113,93.88959785490354,0.005308173472067373,0.055684618838617535,rbf,TPESampler,COMPLETE
1714,0.3894816773262046,2025-04-25 07:40:24.841829,2025-04-25 07:40:25.718588,0 days 00:00:00.876759,92.81382955130191,0.0037337787119962767,0.22512380927248712,rbf,TPESampler,COMPLETE
1715,0.8955140464542246,2025-04-25 07:40:25.893849,2025-04-25 07:40:26.431116,0 days 00:00:00.537267,0.003781975710656047,0.0207278605516255,0.00197615476892011,poly,TPESampler,COMPLETE
1716,0.27704115559365394,2025-04-25 07:40:26.603235,2025-04-25 07:40:27.512738,0 days 00:00:00.909503,26.536177673741438,0.006431170016228405,0.07560752096340197,rbf,TPESampler,COMPLETE
1717,0.19764432956370065,2025-04-25 07:40:27.688912,2025-04-25 07:40:29.140749,0 days 00:00:01.451837,94.29407784756879,0.0047972657684349825,0.0416206431021718,rbf,TPESampler,COMPLETE
1718,0.18865125087380852,2025-04-25 07:40:29.316653,2025-04-25 07:40:29.996672,0 days 00:00:00.680019,14.623646971353393,0.0036066108188810516,0.018349127344758197,rbf,TPESampler,COMPLETE
1719,0.2068041503793834,2025-04-25 07:40:30.184491,2025-04-25 07:40:30.940299,0 days 00:00:00.755808,18.49977882364375,0.008067594355973765,0.02941988118556656,rbf,TPESampler,COMPLETE
1720,0.27531657385623315,2025-04-25 07:40:31.137982,2025-04-25 07:40:41.873951,0 days 00:00:10.735969,14.829780651146311,0.006074236492303283,0.026860730513174943,linear,TPESampler,COMPLETE
1721,0.7760221387290731,2025-04-25 07:40:42.054978,2025-04-25 08:34:01.392125,0 days 00:53:19.337147,25.295765744889387,0.002589477780960893,0.07366699783493617,poly,TPESampler,COMPLETE
1722,0.18819164830504387,2025-04-25 07:43:17.353162,2025-04-25 07:43:18.720286,0 days 00:00:01.367124,93.80343854380999,0.004767442381260224,0.017367388783121645,rbf,TPESampler,COMPLETE
1723,0.23907498038402122,2025-04-25 07:43:18.904943,2025-04-25 07:43:20.546065,0 days 00:00:01.641122,99.73980140162786,0.0026138329666428217,0.054533865881447485,rbf,TPESampler,COMPLETE
1724,0.20076884710594914,2025-04-25 07:43:20.729282,2025-04-25 07:43:21.628923,0 days 00:00:00.899641,26.94110449454772,0.005480409033312073,0.03193713194154318,rbf,TPESampler,COMPLETE
1725,0.18282355627445124,2025-04-25 07:43:21.809121,2025-04-25 07:43:22.519554,0 days 00:00:00.710433,19.63586252067635,0.004114794752841337,0.015872997463598368,rbf,TPESampler,COMPLETE
1726,0.19540380081247125,2025-04-25 07:43:22.700953,2025-04-25 07:43:23.371855,0 days 00:00:00.670902,20.43606221281208,0.007869557816317702,0.011089204964504865,rbf,TPESampler,COMPLETE
1727,0.18727901110702763,2025-04-25 07:43:23.553164,2025-04-25 07:43:24.735612,0 days 00:00:01.182448,89.29289852258356,0.008807764562393586,0.019512453384238782,rbf,TPESampler,COMPLETE
1728,0.2924526158818016,2025-04-25 07:43:24.911284,2025-04-25 07:43:25.607283,0 days 00:00:00.695999,17.302918081620806,0.015676153463389405,0.08650591102000568,rbf,TPESampler,COMPLETE
1729,0.19167148860475897,2025-04-25 07:43:25.788171,2025-04-25 07:43:26.474866,0 days 00:00:00.686695,21.348265455678014,0.003051542025952802,0.011546135452066036,rbf,TPESampler,COMPLETE
1730,0.18112638751438795,2025-04-25 07:43:26.650154,2025-04-25 07:43:27.511868,0 days 00:00:00.861714,91.64279497584519,0.0032459269534496314,0.005440833156080512,rbf,TPESampler,COMPLETE
1731,0.3177608264988352,2025-04-25 07:43:27.686251,2025-04-25 07:43:28.636328,0 days 00:00:00.950077,18.738273085377195,0.0032048261989541596,0.1069239369855855,rbf,TPESampler,COMPLETE
1732,0.17498848026777206,2025-04-25 07:43:28.811377,2025-04-25 07:43:29.684269,0 days 00:00:00.872892,99.05909892814215,0.0070101076609335325,0.006349466344759914,rbf,TPESampler,COMPLETE
1733,0.2076867045397268,2025-04-25 07:43:29.860966,2025-04-25 07:43:30.715814,0 days 00:00:00.854848,22.02312187418374,0.005808579514927607,0.03591934461845589,rbf,TPESampler,COMPLETE
1734,0.2730488021431774,2025-04-25 07:43:30.895895,2025-04-25 07:43:32.155071,0 days 00:00:01.259176,91.27324335466606,0.0049596660044309085,0.07055740107234547,rbf,TPESampler,COMPLETE
1735,0.37195877616433964,2025-04-25 07:43:32.339447,2025-04-25 07:43:33.024247,0 days 00:00:00.684800,30.939923918873095,0.01087152462562897,0.18736736940844625,rbf,TPESampler,COMPLETE
1736,0.20773296163321595,2025-04-25 07:43:33.200259,2025-04-25 07:43:34.003513,0 days 00:00:00.803254,18.595458458274425,0.002884276052061085,0.03179238218135948,rbf,TPESampler,COMPLETE
1737,0.23871011764576658,2025-04-25 07:43:34.180347,2025-04-25 07:43:34.802050,0 days 00:00:00.621703,14.89480938250664,0.0032965707085196973,0.006024031680949227,rbf,TPESampler,COMPLETE
1738,0.3101478216343815,2025-04-25 07:43:34.972475,2025-04-25 07:43:35.517748,0 days 00:00:00.545273,1.8091392978039378,0.08290031231358015,0.07521119713441042,rbf,TPESampler,COMPLETE
1739,0.6117223429583664,2025-04-25 07:43:35.698186,2025-04-25 07:44:21.305025,0 days 00:00:45.606839,32.15063346900817,0.004557948075367864,0.01976291480124241,poly,TPESampler,COMPLETE
1740,0.3100534873090165,2025-04-25 07:44:21.494415,2025-04-25 07:44:22.170015,0 days 00:00:00.675600,21.56343587822207,0.02502074744422895,0.10023119189057121,rbf,TPESampler,COMPLETE
1741,0.19803667246421436,2025-04-25 07:44:22.344616,2025-04-25 07:44:23.400582,0 days 00:00:01.055966,98.87535541440582,0.004000321873349258,0.008491787702757372,rbf,TPESampler,COMPLETE
1742,2468.0289256802,2025-04-25 07:44:23.578193,2025-04-25 07:44:24.144292,0 days 00:00:00.566099,82.61433790435808,0.007918843951463863,0.4842415279142796,sigmoid,TPESampler,COMPLETE
1743,0.3435768553803044,2025-04-25 07:44:24.327100,2025-04-25 07:44:25.343393,0 days 00:00:01.016293,93.73378241999467,0.0038786750649103066,0.13452108774075353,rbf,TPESampler,COMPLETE
1744,0.18362141342820004,2025-04-25 07:44:25.518190,2025-04-25 07:44:27.152602,0 days 00:00:01.634412,98.29025732343402,0.004166647507316342,0.03703363617507732,rbf,TPESampler,COMPLETE
1745,0.20695689957110328,2025-04-25 07:44:27.343929,2025-04-25 07:44:28.159305,0 days 00:00:00.815376,18.551746408858723,0.010330058378013476,0.033669883856353736,rbf,TPESampler,COMPLETE
1746,0.22302830824253386,2025-04-25 07:44:28.337331,2025-04-25 07:44:29.194568,0 days 00:00:00.857237,22.10343438238479,0.003488169485419981,0.04718479633177109,rbf,TPESampler,COMPLETE
1747,0.17776051643508506,2025-04-25 07:44:29.375773,2025-04-25 07:44:30.274818,0 days 00:00:00.899045,93.0001769892882,0.008641270590181533,0.006958360491187122,rbf,TPESampler,COMPLETE
1748,0.20383371132975345,2025-04-25 07:44:30.446981,2025-04-25 07:44:31.252393,0 days 00:00:00.805412,21.93196529260933,0.00275101081742009,0.026281095169215882,rbf,TPESampler,COMPLETE
1749,2289.457780974917,2025-04-25 07:44:31.431858,2025-04-25 07:44:32.005965,0 days 00:00:00.574107,98.4841503917988,0.008591765184775231,0.057369595655103134,sigmoid,TPESampler,COMPLETE
1750,0.7634127808509954,2025-04-25 07:44:32.184873,2025-04-25 08:05:22.991281,0 days 00:20:50.806408,92.84284269541328,0.006359527911071572,0.052662132925362655,poly,TPESampler,COMPLETE
1751,0.20826323791180767,2025-04-25 08:05:23.183335,2025-04-25 08:05:24.139995,0 days 00:00:00.956660,85.9867683439808,0.016919497013262293,0.010866799974711747,rbf,TPESampler,COMPLETE
1752,0.1904389280316686,2025-04-25 08:05:24.319542,2025-04-25 08:05:25.377983,0 days 00:00:01.058441,99.38407886186194,0.00238275893055463,0.007789777767564745,rbf,TPESampler,COMPLETE
1753,0.3177781041326216,2025-04-25 08:05:25.550177,2025-04-25 08:05:26.400058,0 days 00:00:00.849881,79.19336131795876,0.022799560278222743,0.10668859626914654,rbf,TPESampler,COMPLETE
1754,0.17812713596204696,2025-04-25 08:05:26.590342,2025-04-25 08:05:27.333258,0 days 00:00:00.742916,80.4271778021054,0.040941176423365984,0.025315816712465432,rbf,TPESampler,COMPLETE
1755,0.27430967495095476,2025-04-25 08:05:27.523656,2025-04-25 08:05:28.513012,0 days 00:00:00.989356,19.32794915047771,0.0024917374756202597,0.0751449078358405,rbf,TPESampler,COMPLETE
1756,0.19275233283120866,2025-04-25 08:05:28.693420,2025-04-25 08:05:30.367243,0 days 00:00:01.673823,99.37560847425414,0.0030524664993025843,0.0402508147593431,rbf,TPESampler,COMPLETE
1757,0.4646738527741859,2025-04-25 08:05:30.546233,2025-04-25 08:05:31.126313,0 days 00:00:00.580080,98.57097500603469,0.01915774195361546,0.42900104629312313,rbf,TPESampler,COMPLETE
1758,0.19687365651918967,2025-04-25 08:05:31.372472,2025-04-25 08:05:32.463213,0 days 00:00:01.090741,90.61694589249089,0.01152225528897174,0.040757963304526565,rbf,TPESampler,COMPLETE
1759,0.1904040320032301,2025-04-25 08:05:32.645114,2025-04-25 08:05:33.379625,0 days 00:00:00.734511,27.329396622327764,0.011534706847476683,0.01801897772404345,rbf,TPESampler,COMPLETE
1760,0.23500550216894447,2025-04-25 08:05:33.568232,2025-04-25 08:05:34.768079,0 days 00:00:01.199847,97.55877498526003,0.010949477207488945,0.053589914310201756,rbf,TPESampler,COMPLETE
1761,0.8994844572832884,2025-04-25 08:05:34.950012,2025-04-25 08:05:35.454785,0 days 00:00:00.504773,0.0013654264818388133,0.7188437043878876,0.0011083060302646162,poly,TPESampler,COMPLETE
