number,value,datetime_start,datetime_complete,duration,params_C,params_epsilon,params_gamma,params_kernel,system_attrs_auto:sampler,state
2465,0.18930867035273158,2025-04-25 13:05:09.400790,2025-04-25 13:05:10.294379,0 days 00:00:00.893589,90.844029109116,0.028126775340820663,0.016422496730367803,rbf,TPESampler,COMPLETE
2466,0.29937386932217525,2025-04-25 13:05:10.478250,2025-04-25 13:05:11.523110,0 days 00:00:01.044860,85.68374392243992,0.011218910990074138,0.08848053621097345,rbf,TPESampler,COMPLETE
2467,0.18883257361659117,2025-04-25 13:05:11.707411,2025-04-25 13:05:12.455855,0 days 00:00:00.748444,19.72100803075913,0.006983292333787902,0.020530557314331892,rbf,TPESampler,COMPLETE
2468,0.26835568148859945,2025-04-25 13:05:12.645496,2025-04-25 13:05:13.600826,0 days 00:00:00.955330,90.65307849714767,0.0260955714998597,0.06818508095004368,rbf,TPESampler,COMPLETE
2469,0.26762773374684623,2025-04-25 13:05:13.786248,2025-04-25 13:05:14.411947,0 days 00:00:00.625699,2.6591476974077093,0.00847910330775673,0.04383983529642341,rbf,TPESampler,COMPLETE
2470,0.9086082655526089,2025-04-25 13:05:14.600266,2025-04-25 13:23:11.906225,0 days 00:17:57.305959,63.749527079400174,0.013190397047983972,0.10616233493589254,poly,TPESampler,COMPLETE
2471,818.322009580774,2025-04-25 13:06:12.371485,2025-04-25 13:06:12.982918,0 days 00:00:00.611433,40.37001317213995,0.12768105395066442,0.03357634518457669,sigmoid,TPESampler,COMPLETE
2472,0.27736573524766034,2025-04-25 13:06:13.172612,2025-04-25 13:06:55.863536,0 days 00:00:42.690924,62.49601310728886,0.008657085501516917,0.3835456365890476,linear,TPESampler,COMPLETE
2473,0.19705262833735618,2025-04-25 13:06:56.049786,2025-04-25 13:06:56.895106,0 days 00:00:00.845320,82.03509012765255,0.006076877041071401,0.004279873804248929,rbf,TPESampler,COMPLETE
2474,0.20594899683916734,2025-04-25 13:06:57.072368,2025-04-25 13:06:58.340925,0 days 00:00:01.268557,99.22330862866859,0.008246650552884356,0.04335603361017937,rbf,TPESampler,COMPLETE
2475,0.19075407962345584,2025-04-25 13:06:58.529446,2025-04-25 13:06:59.165811,0 days 00:00:00.636365,16.75557613972114,0.04784581824028188,0.015622911229248866,rbf,TPESampler,COMPLETE
2476,0.888593234552748,2025-04-25 13:06:59.358104,2025-04-25 13:06:59.891541,0 days 00:00:00.533437,0.426184269800888,0.6564052466024319,0.0008169122937353505,poly,TPESampler,COMPLETE
2477,0.18720283572099028,2025-04-25 13:07:00.083996,2025-04-25 13:07:00.997689,0 days 00:00:00.913693,89.52040093710956,0.025075188839774328,0.018241754964556506,rbf,TPESampler,COMPLETE
2478,0.18817639927593477,2025-04-25 13:07:01.189460,2025-04-25 13:07:02.332190,0 days 00:00:01.142730,90.49136456503585,0.009772660854978629,0.017174632779323115,rbf,TPESampler,COMPLETE
2479,2172.1389893669934,2025-04-25 13:07:02.519553,2025-04-25 13:07:03.114778,0 days 00:00:00.595225,94.87384564028778,0.005269938972754105,0.1059158077406805,sigmoid,TPESampler,COMPLETE
2480,0.26162260333130954,2025-04-25 13:07:03.304994,2025-04-25 13:07:04.170208,0 days 00:00:00.865214,96.09519719444565,0.024741307555220103,0.06485100629771061,rbf,TPESampler,COMPLETE
2481,0.72351836589216,2025-04-25 13:07:04.362415,2025-04-25 13:07:04.964073,0 days 00:00:00.601658,2.048386381547145,0.03321953797155162,0.006719708534154202,poly,TPESampler,COMPLETE
2482,0.3455044087361891,2025-04-25 13:07:05.154931,2025-04-25 13:07:05.966044,0 days 00:00:00.811113,23.652060947010035,0.006458850366499954,0.14106583860917302,rbf,TPESampler,COMPLETE
2483,0.17433293770644437,2025-04-25 13:07:06.153153,2025-04-25 13:07:07.540495,0 days 00:00:01.387342,92.48815133269497,0.005189389138798554,0.02417874723922314,rbf,TPESampler,COMPLETE
2484,0.18544213011382066,2025-04-25 13:07:07.729608,2025-04-25 13:07:08.909608,0 days 00:00:01.180000,89.14348248842744,0.007910123188078325,0.02027021792747671,rbf,TPESampler,COMPLETE
2485,0.1812402614980758,2025-04-25 13:07:09.226248,2025-04-25 13:07:10.032865,0 days 00:00:00.806617,21.971375140943145,0.005955844244893258,0.015062121309887445,rbf,TPESampler,COMPLETE
2486,1787.9209847358438,2025-04-25 13:07:10.511948,2025-04-25 13:07:11.161620,0 days 00:00:00.649672,99.58225454706516,0.0013938689453199232,0.027080227861423025,sigmoid,TPESampler,COMPLETE
2487,0.37870200002458615,2025-04-25 13:07:11.345407,2025-04-25 13:07:12.221233,0 days 00:00:00.875826,98.47818630827355,0.007842439201953407,0.2007263257681496,rbf,TPESampler,COMPLETE
2488,0.6089741274295936,2025-04-25 13:07:12.405902,2025-04-25 13:10:58.917800,0 days 00:03:46.511898,24.864177387498223,0.0157564040458223,0.027758181274150695,poly,TPESampler,COMPLETE
2489,0.2022380088887656,2025-04-25 13:10:59.106802,2025-04-25 13:10:59.974025,0 days 00:00:00.867223,25.58660074608352,0.004264370726992811,0.032850454219533615,rbf,TPESampler,COMPLETE
2490,0.28502646317131675,2025-04-25 13:11:00.173963,2025-04-25 13:11:00.799385,0 days 00:00:00.625422,3.3149126569108565,0.015433499055206057,0.07575925358846397,rbf,TPESampler,COMPLETE
2491,1780.6985894325805,2025-04-25 13:11:00.987378,2025-04-25 13:11:01.573985,0 days 00:00:00.586607,87.05144152419166,0.008852436237256017,0.03477325288285772,sigmoid,TPESampler,COMPLETE
2492,0.42854729964096105,2025-04-25 13:11:01.761678,2025-04-25 13:11:02.381052,0 days 00:00:00.619374,8.05385456059485,0.0010453908386771674,0.0009489736390571514,rbf,TPESampler,COMPLETE
2493,0.25664542837321225,2025-04-25 13:11:02.563010,2025-04-25 13:11:03.166895,0 days 00:00:00.603885,4.413253799990449,0.012484884837754263,0.016542095453622466,rbf,TPESampler,COMPLETE
2494,0.2043080403558656,2025-04-25 13:11:03.354194,2025-04-25 13:11:04.228664,0 days 00:00:00.874470,92.37687527147061,0.03389106026082565,0.04193723147843524,rbf,TPESampler,COMPLETE
2495,0.277028252519608,2025-04-25 13:11:04.419672,2025-04-25 13:11:05.835027,0 days 00:00:01.415355,99.84640610508494,0.004391613790931131,0.07199613450067219,rbf,TPESampler,COMPLETE
2496,0.6365214037496579,2025-04-25 13:11:06.023739,2025-04-25 13:11:06.775434,0 days 00:00:00.751695,0.0016097197709857075,0.12345573924351043,0.17588858363110482,poly,TPESampler,COMPLETE
2497,0.2769515681728894,2025-04-25 13:11:06.966325,2025-04-25 13:12:08.465704,0 days 00:01:01.499379,98.28437221696582,0.005649537433430579,0.0703964813359186,linear,TPESampler,COMPLETE
2498,0.19978398510171957,2025-04-25 13:12:08.654990,2025-04-25 13:12:09.518362,0 days 00:00:00.863372,18.60830472947237,0.0123508580767316,0.010902636980022334,rbf,TPESampler,COMPLETE
2499,0.2682083814821596,2025-04-25 13:12:09.831079,2025-04-25 13:12:10.819379,0 days 00:00:00.988300,22.677532489053153,0.013800182285172819,0.07113232898587152,rbf,TPESampler,COMPLETE
