number,value,datetime_start,datetime_complete,duration,params_C,params_epsilon,params_gamma,params_kernel,system_attrs_auto:sampler,state
1996,0.5688278084271907,2025-04-25 09:20:35.797366,2025-04-25 09:20:36.399086,0 days 00:00:00.601720,28.348131529140435,0.0025486596425232087,0.7454861327782457,rbf,TPESampler,COMPLETE
1997,0.1793569498750309,2025-04-25 09:20:36.583315,2025-04-25 09:20:37.983819,0 days 00:00:01.400504,89.70813828335841,0.0014409574901384885,0.0228802049350877,rbf,TPESampler,COMPLETE
1998,27.266451151181226,2025-04-25 09:20:38.168896,2025-04-25 09:20:38.739438,0 days 00:00:00.570542,1.332432372212973,0.0011685806682085835,0.14607774478152227,sigmoid,TPESampler,COMPLETE
1999,0.1785293760805745,2025-04-25 09:20:38.925498,2025-04-25 09:20:40.524645,0 days 00:00:01.599147,81.2883267311658,0.0011189277873259653,0.03375352294411774,rbf,TPESampler,COMPLETE
2000,0.6967720891521318,2025-04-25 09:20:40.716787,2025-04-25 09:20:41.372878,0 days 00:00:00.656091,0.2745112376783443,0.035963743674760615,0.00023501268981354867,rbf,TPESampler,COMPLETE
2001,0.1734979189509369,2025-04-25 09:20:41.561253,2025-04-25 09:20:43.072811,0 days 00:00:01.511558,78.76882306436977,0.001286100268254056,0.031108332407652914,rbf,TPESampler,COMPLETE
2002,0.19797618265263028,2025-04-25 09:20:43.258418,2025-04-25 09:20:44.320628,0 days 00:00:01.062210,91.82145489195447,0.0018507614986679362,0.008790436602683343,rbf,TPESampler,COMPLETE
2003,0.18818234981092452,2025-04-25 09:20:44.498175,2025-04-25 09:20:45.258611,0 days 00:00:00.760436,21.24772490209451,0.004560570456089692,0.01985475242575253,rbf,TPESampler,COMPLETE
2004,0.19864477478881223,2025-04-25 09:20:45.444226,2025-04-25 09:20:46.582104,0 days 00:00:01.137878,81.15318321152898,0.0011457509765585544,0.014120479784303048,rbf,TPESampler,COMPLETE
2005,0.27588586234685275,2025-04-25 09:20:46.766501,2025-04-25 09:21:31.517668,0 days 00:00:44.751167,76.41573121034618,0.0014654230309134935,0.00012806047114421597,linear,TPESampler,COMPLETE
2006,0.2962974568065714,2025-04-25 09:21:31.711013,2025-04-25 09:21:32.704006,0 days 00:00:00.992993,27.577566391694617,0.0027115691927646363,0.08731495719425175,rbf,TPESampler,COMPLETE
2007,0.23534705564404768,2025-04-25 09:21:32.905818,2025-04-25 09:21:34.464248,0 days 00:00:01.558430,99.74927832478244,0.005426910311821045,0.05338601299031964,rbf,TPESampler,COMPLETE
2008,0.18168632280923183,2025-04-25 09:21:34.668507,2025-04-25 09:21:35.456410,0 days 00:00:00.787903,22.652974922349593,0.003045058412689989,0.014179474676577037,rbf,TPESampler,COMPLETE
2009,0.25763157246435897,2025-04-25 09:21:35.650454,2025-04-25 09:21:36.659735,0 days 00:00:01.009281,22.979139832866917,0.0020282803531494436,0.06556676678329601,rbf,TPESampler,COMPLETE
2010,0.30145841509739596,2025-04-25 09:21:36.853845,2025-04-25 09:21:37.477965,0 days 00:00:00.624120,2.667327929073839,0.0013575357185956745,0.01465818085884374,rbf,TPESampler,COMPLETE
2011,0.18762428156322927,2025-04-25 09:21:37.664782,2025-04-25 09:21:39.266261,0 days 00:00:01.601479,85.16620938858361,0.0014477210846033709,0.03842645221898946,rbf,TPESampler,COMPLETE
2012,0.1857341147938185,2025-04-25 09:21:39.466946,2025-04-25 09:21:40.215258,0 days 00:00:00.748312,23.264859699002088,0.0036211015731669387,0.01756776790450349,rbf,TPESampler,COMPLETE
2013,0.21690348316073452,2025-04-25 09:21:40.405991,2025-04-25 09:21:41.069359,0 days 00:00:00.663368,17.591413479363332,0.0014238419882749297,0.00801979699507401,rbf,TPESampler,COMPLETE
2014,0.3386093431046697,2025-04-25 09:21:41.260171,2025-04-25 09:21:42.113675,0 days 00:00:00.853504,2.0332877935972618,0.0016794108530408117,0.13134023557639737,rbf,TPESampler,COMPLETE
2015,346.07920606751355,2025-04-25 09:21:42.295522,2025-04-25 09:21:42.877810,0 days 00:00:00.582288,14.87906346094351,0.07300022631590693,0.05849543924223352,sigmoid,TPESampler,COMPLETE
2016,0.2627019255422688,2025-04-25 09:21:43.067345,2025-04-25 09:21:43.696307,0 days 00:00:00.628962,2.911892910483549,0.004970466807160485,0.026047003169508632,rbf,TPESampler,COMPLETE
2017,0.23185026380575238,2025-04-25 09:21:43.883496,2025-04-25 09:21:44.462770,0 days 00:00:00.579274,7.02539007387889,0.0594283171114673,0.015116233478310875,rbf,TPESampler,COMPLETE
2018,0.20789584119473284,2025-04-25 09:21:44.655305,2025-04-25 09:21:45.694576,0 days 00:00:01.039271,90.94406876934978,0.003335229901093661,0.010421036638423909,rbf,TPESampler,COMPLETE
2019,0.23404553204453105,2025-04-25 09:21:45.874570,2025-04-25 09:21:46.792120,0 days 00:00:00.917550,18.167882758055065,0.0011768227914786909,0.05262926920944693,rbf,TPESampler,COMPLETE
2020,0.23447733235015178,2025-04-25 09:21:46.973593,2025-04-25 09:21:48.006105,0 days 00:00:01.032512,27.912847692178815,0.0029296858565697474,0.054797783380029066,rbf,TPESampler,COMPLETE
2021,0.22596384446802326,2025-04-25 09:21:48.291542,2025-04-25 09:21:49.712545,0 days 00:00:01.421003,53.51631671200454,0.001038626603703648,0.05184099730118887,rbf,TPESampler,COMPLETE
2022,0.2019266979220357,2025-04-25 09:21:49.900536,2025-04-25 09:21:50.715905,0 days 00:00:00.815369,20.49705715249915,0.0010839803206515667,0.023952243137221264,rbf,TPESampler,COMPLETE
2023,0.2008109903426492,2025-04-25 09:21:50.893644,2025-04-25 09:21:52.063288,0 days 00:00:01.169644,94.67325514112449,0.004188979253494479,0.01185559240387117,rbf,TPESampler,COMPLETE
2024,0.19156434005741044,2025-04-25 09:21:52.247910,2025-04-25 09:21:53.353896,0 days 00:00:01.105986,95.45164203949577,0.005410271626181124,0.014973767651016212,rbf,TPESampler,COMPLETE
2025,0.1780422985564148,2025-04-25 09:21:53.552152,2025-04-25 09:21:54.385889,0 days 00:00:00.833737,98.36270459091193,0.04191784379296846,0.029722478531795785,rbf,TPESampler,COMPLETE
2026,0.33749576513007823,2025-04-25 09:21:54.567680,2025-04-25 09:21:55.597481,0 days 00:00:01.029801,98.90597448161249,0.005879889480296808,0.1267148904914246,rbf,TPESampler,COMPLETE
2027,123.87408422732078,2025-04-25 09:21:55.786354,2025-04-25 09:21:56.401814,0 days 00:00:00.615460,11.066721932241705,0.004342171412221142,0.0141636670113786,sigmoid,TPESampler,COMPLETE
2028,0.3288390092303811,2025-04-25 09:21:56.597401,2025-04-25 09:21:57.219551,0 days 00:00:00.622150,98.96784544963529,0.05154067759444833,0.11944853279438981,rbf,TPESampler,COMPLETE
2029,0.23055125182324496,2025-04-25 09:21:57.409121,2025-04-25 09:21:57.987986,0 days 00:00:00.578865,91.9235347956984,0.14714514158675696,0.009202544039225775,rbf,TPESampler,COMPLETE
2030,0.2043555015298035,2025-04-25 09:21:58.175891,2025-04-25 09:21:59.298660,0 days 00:00:01.122769,87.2837889971027,0.0015188832236244698,0.009792162537364368,rbf,TPESampler,COMPLETE
2031,0.25607598593426223,2025-04-25 09:21:59.491865,2025-04-25 09:22:00.414389,0 days 00:00:00.922524,21.985348872928927,0.004458470193892151,0.06451510407822734,rbf,TPESampler,COMPLETE
2032,0.20053180307535473,2025-04-25 09:22:00.604901,2025-04-25 09:22:01.383463,0 days 00:00:00.778562,21.673632909380434,0.0038030747211879263,0.022845515285314377,rbf,TPESampler,COMPLETE
2033,0.3504535927414842,2025-04-25 09:22:01.578900,2025-04-25 09:22:02.734045,0 days 00:00:01.155145,63.447939158376236,0.001019566126406958,0.14507662114634384,rbf,TPESampler,COMPLETE
2034,0.2845309825683189,2025-04-25 09:22:02.935206,2025-04-25 09:22:03.572773,0 days 00:00:00.637567,19.17287497924941,0.0055296588548452855,0.0031105932243980453,rbf,TPESampler,COMPLETE
2035,0.21899997805508456,2025-04-25 09:22:03.757183,2025-04-25 09:22:05.465108,0 days 00:00:01.707925,98.50370098796058,0.0012243573315164828,0.04774614252112611,rbf,TPESampler,COMPLETE
2036,0.20787753076426405,2025-04-25 09:22:05.662441,2025-04-25 09:22:06.537493,0 days 00:00:00.875052,21.915773648060537,0.003431287275970631,0.03605687436738235,rbf,TPESampler,COMPLETE
2037,0.1862627965361148,2025-04-25 09:22:06.737945,2025-04-25 09:22:07.783753,0 days 00:00:01.045808,96.79673250853563,0.0022982441960367,0.007618077618821524,rbf,TPESampler,COMPLETE
2038,0.27438364802864534,2025-04-25 09:22:07.975909,2025-04-25 09:22:08.936858,0 days 00:00:00.960949,0.4302544069520422,0.017775227791072386,0.0029306327524825974,linear,TPESampler,COMPLETE
2039,0.1690777390973204,2025-04-25 09:22:09.255789,2025-04-25 09:22:11.310490,0 days 00:00:02.054701,95.17933352883513,0.0046875567460665365,0.027375222393598388,rbf,TPESampler,COMPLETE
2040,0.20288065040539222,2025-04-25 09:22:11.507000,2025-04-25 09:22:12.343956,0 days 00:00:00.836956,23.095844580613335,0.007905078543941537,0.030531686045195003,rbf,TPESampler,COMPLETE
2041,0.24802496389848674,2025-04-25 09:22:12.531352,2025-04-25 09:22:13.358052,0 days 00:00:00.826700,20.962913870347997,0.011736416427776505,0.060483395977734195,rbf,TPESampler,COMPLETE
2042,0.21376345495553528,2025-04-25 09:22:13.539386,2025-04-25 09:22:14.968010,0 days 00:00:01.428624,91.40941467880421,0.003548803589126371,0.046354001475736574,rbf,TPESampler,COMPLETE
2043,0.33063339636397415,2025-04-25 09:22:15.176210,2025-04-25 09:22:16.061389,0 days 00:00:00.885179,20.943244529393994,0.006286634801629718,0.12038169912570942,rbf,TPESampler,COMPLETE
2044,0.21175062000287317,2025-04-25 09:22:16.244801,2025-04-25 09:22:16.933637,0 days 00:00:00.688836,22.321223609849326,0.009812249673099089,0.0074494934557661945,rbf,TPESampler,COMPLETE
2045,0.19583767177780917,2025-04-25 09:22:17.129315,2025-04-25 09:22:17.858671,0 days 00:00:00.729356,27.365470232303696,0.006622997189500536,0.008779450186145036,rbf,TPESampler,COMPLETE
2046,0.27104273802803847,2025-04-25 09:22:18.048408,2025-04-25 09:22:18.944296,0 days 00:00:00.895888,19.739664137772404,0.005642670665902355,0.0730102626355325,rbf,TPESampler,COMPLETE
2047,0.8608362443254828,2025-04-25 09:22:19.135277,2025-04-25 09:22:19.711789,0 days 00:00:00.576512,0.0026900687531808253,0.01342762031311842,0.012894610535113676,poly,TPESampler,COMPLETE
2048,0.7525998087832676,2025-04-25 09:22:19.905478,2025-04-25 09:51:18.237650,0 days 00:28:58.332172,84.7884570408049,0.002891830159271175,0.031185573850075036,poly,TPESampler,COMPLETE
2049,0.1995337035854148,2025-04-25 09:47:09.181968,2025-04-25 09:47:09.999428,0 days 00:00:00.817460,18.325162431916887,0.03775219963369221,0.012248496138936913,rbf,TPESampler,COMPLETE
2050,0.5572819725176094,2025-04-25 09:47:10.264395,2025-04-25 09:47:11.041655,0 days 00:00:00.777260,0.06353102752145978,0.008824504504842694,0.021897462858564778,rbf,TPESampler,COMPLETE
2051,0.20565943972621284,2025-04-25 09:47:11.257324,2025-04-25 09:47:12.111250,0 days 00:00:00.853926,97.92175545616364,0.07081017706581638,0.01298431552853391,rbf,TPESampler,COMPLETE
2052,0.2763892628812461,2025-04-25 09:47:12.326889,2025-04-25 09:47:54.024668,0 days 00:00:41.697779,74.46046206466403,0.003768011660581641,0.032635867436042694,linear,TPESampler,COMPLETE
2053,0.6139826903787302,2025-04-25 09:47:54.604711,2025-04-25 09:48:32.143060,0 days 00:00:37.538349,0.33722020611012216,0.004424453557590738,0.08895391938125538,poly,TPESampler,COMPLETE
2054,0.19039409185809347,2025-04-25 09:48:32.327435,2025-04-25 09:48:33.229979,0 days 00:00:00.902544,80.66348026436036,0.00726540292990205,0.008800118973992252,rbf,TPESampler,COMPLETE
2055,0.20833429739350423,2025-04-25 09:48:33.409580,2025-04-25 09:48:34.153612,0 days 00:00:00.744032,96.79754772067952,0.0025589063647498645,0.0028058602894465183,rbf,TPESampler,COMPLETE
2056,0.2113754292796461,2025-04-25 09:48:34.333299,2025-04-25 09:48:35.168665,0 days 00:00:00.835366,23.94004847353424,0.006473913264498424,0.03994458080133875,rbf,TPESampler,COMPLETE
2057,0.26961328005382984,2025-04-25 09:48:35.353941,2025-04-25 09:48:39.418369,0 days 00:00:04.064428,5.1742150474863475,0.0021239177149480148,0.14466928947649166,linear,TPESampler,COMPLETE
2058,0.20431242719984888,2025-04-25 09:48:39.608940,2025-04-25 09:48:40.535258,0 days 00:00:00.926318,30.483836902790078,0.006308111062832943,0.03652875913485462,rbf,TPESampler,COMPLETE
2059,0.18527973549202753,2025-04-25 09:48:40.721961,2025-04-25 09:48:41.638426,0 days 00:00:00.916465,91.25157181145924,0.014966870323980511,0.007841158720603383,rbf,TPESampler,COMPLETE
2060,0.42781205375028314,2025-04-25 09:48:41.821542,2025-04-25 09:48:42.294256,0 days 00:00:00.472714,39.98552449462441,0.560544319850546,0.04693052059520631,rbf,TPESampler,COMPLETE
2061,0.1946624149177821,2025-04-25 09:48:42.470916,2025-04-25 09:48:43.315956,0 days 00:00:00.845040,19.386014661977292,0.006534913142467003,0.022345063564389697,rbf,TPESampler,COMPLETE
2062,0.18232832105605118,2025-04-25 09:48:43.495155,2025-04-25 09:48:44.824931,0 days 00:00:01.329776,95.21081959422457,0.0032363653443033217,0.020675491949090335,rbf,TPESampler,COMPLETE
2063,0.28910144971399837,2025-04-25 09:48:45.007889,2025-04-25 09:48:46.205014,0 days 00:00:01.197125,95.7991407410238,0.007454665391476047,0.07926046234633728,rbf,TPESampler,COMPLETE
2064,0.18653896152813357,2025-04-25 09:48:46.394612,2025-04-25 09:48:47.734476,0 days 00:00:01.339864,85.8380059354263,0.008917660342553391,0.0373511484079584,rbf,TPESampler,COMPLETE
2065,0.18873195551192773,2025-04-25 09:48:47.909303,2025-04-25 09:48:48.742275,0 days 00:00:00.832972,91.90316940513588,0.03241962308951267,0.017676029745396348,rbf,TPESampler,COMPLETE
2066,31.372311795606738,2025-04-25 09:48:48.929200,2025-04-25 09:48:49.529544,0 days 00:00:00.600344,70.23600960289512,0.0018424129116677175,0.001885114287783632,sigmoid,TPESampler,COMPLETE
2067,0.21658989983034618,2025-04-25 09:48:49.714656,2025-04-25 09:48:50.384465,0 days 00:00:00.669809,22.887313523612395,0.004083344484938924,0.006166172178766731,rbf,TPESampler,COMPLETE
2068,0.1762407653543978,2025-04-25 09:48:50.573629,2025-04-25 09:48:51.626770,0 days 00:00:01.053141,90.38751797221477,0.0134321189725965,0.032667076629553427,rbf,TPESampler,COMPLETE
2069,0.17530902799259396,2025-04-25 09:48:51.811277,2025-04-25 09:48:52.650504,0 days 00:00:00.839227,94.04364677198733,0.011977677629049199,0.005771182140168921,rbf,TPESampler,COMPLETE
2070,406.32710849413314,2025-04-25 09:48:52.848669,2025-04-25 09:48:53.460052,0 days 00:00:00.611383,17.9031058866642,0.0020652754376323237,0.11094092090572236,sigmoid,TPESampler,COMPLETE
2071,0.18078275578140487,2025-04-25 09:48:53.643470,2025-04-25 09:48:54.920463,0 days 00:00:01.276993,85.050826672437,0.005654345926107216,0.022772816551472296,rbf,TPESampler,COMPLETE
2072,0.2714125799825188,2025-04-25 09:48:55.108055,2025-04-25 09:48:56.495756,0 days 00:00:01.387701,87.71058258114365,0.003020080201563365,0.06967543783744505,rbf,TPESampler,COMPLETE
2073,0.28988206662943594,2025-04-25 09:48:56.677578,2025-04-25 09:48:57.714533,0 days 00:00:01.036955,84.69362593827809,0.012012368473603218,0.08090098410206033,rbf,TPESampler,COMPLETE
2074,0.7035376287237802,2025-04-25 09:48:57.894581,2025-04-25 09:48:58.468596,0 days 00:00:00.574015,4.192468977235578,0.7064666897183155,0.01388306488364139,poly,TPESampler,COMPLETE
2075,0.17994207417907107,2025-04-25 09:48:58.649244,2025-04-25 09:48:59.984248,0 days 00:00:01.335004,87.28568081387219,0.004953203720190813,0.03466763850303378,rbf,TPESampler,COMPLETE
2076,0.1990521176849305,2025-04-25 09:49:00.181568,2025-04-25 09:49:01.394456,0 days 00:00:01.212888,96.45028384558647,0.0028565753405652284,0.012807012385375663,rbf,TPESampler,COMPLETE
2077,0.20956547534333378,2025-04-25 09:49:01.572991,2025-04-25 09:49:02.309231,0 days 00:00:00.736240,16.475676843410334,0.007360809656316798,0.027684652192126274,rbf,TPESampler,COMPLETE
2078,0.20510057021663441,2025-04-25 09:49:02.491064,2025-04-25 09:49:03.169018,0 days 00:00:00.677954,22.19172720058692,0.02830284929875916,0.03137527284985397,rbf,TPESampler,COMPLETE
2079,0.2020588577668613,2025-04-25 09:49:03.345584,2025-04-25 09:49:04.155497,0 days 00:00:00.809913,86.33159595205842,0.0010441140796099045,0.0037155023031484164,rbf,TPESampler,COMPLETE
2080,0.7531600526200164,2025-04-25 09:49:04.333242,2025-04-25 10:30:11.168251,0 days 00:41:06.835009,70.67048784567436,0.03078543811499388,0.04719958691450276,poly,TPESampler,COMPLETE
2081,0.24874872493921588,2025-04-25 09:51:18.419594,2025-04-25 09:51:19.075899,0 days 00:00:00.656305,4.65507675200361,0.004580753144671188,0.0461998625057803,rbf,TPESampler,COMPLETE
2082,0.27527475772307375,2025-04-25 09:51:19.251008,2025-04-25 09:51:19.868209,0 days 00:00:00.617201,3.257660425893179,0.008659035552090242,0.017737723602219285,rbf,TPESampler,COMPLETE
2083,0.21857343015453676,2025-04-25 09:51:20.047374,2025-04-25 09:51:20.698124,0 days 00:00:00.650750,21.182051436691562,0.013495276021693347,0.006802798865188123,rbf,TPESampler,COMPLETE
2084,0.620743633012855,2025-04-25 09:51:20.882059,2025-04-25 09:51:41.862974,0 days 00:00:20.980915,16.158578905739862,0.007187074832222492,0.02317655463310978,poly,TPESampler,COMPLETE
2085,0.8478887084470803,2025-04-25 09:51:42.144745,2025-04-25 09:51:42.735316,0 days 00:00:00.590571,0.002092929879303247,0.05433032832465554,0.08460840031619121,sigmoid,TPESampler,COMPLETE
2086,0.8571659953940367,2025-04-25 09:51:42.920137,2025-04-25 09:51:43.492204,0 days 00:00:00.572067,0.0019950309232335674,0.29650468629035376,0.09421574143033996,rbf,TPESampler,COMPLETE
2087,5.401133892807958,2025-04-25 09:51:43.673846,2025-04-25 10:16:53.967479,0 days 00:25:10.293633,90.43147223320275,0.022849239173569614,0.2802868678377357,poly,TPESampler,COMPLETE
2088,0.7672879338076957,2025-04-25 10:16:54.157420,2025-04-25 11:45:42.630602,0 days 01:28:48.473182,14.747717005759785,0.0012103637361277491,0.09620613473192748,poly,TPESampler,COMPLETE
2089,0.28698908832677666,2025-04-25 10:30:11.360895,2025-04-25 10:30:12.304439,0 days 00:00:00.943544,95.69428114149311,0.020952944317840626,0.07939185045785144,rbf,TPESampler,COMPLETE
2090,0.7467935595029846,2025-04-25 10:30:12.486141,2025-04-25 10:30:13.119287,0 days 00:00:00.633146,0.17251254980140113,0.020854899029252163,0.000430454173201873,sigmoid,TPESampler,COMPLETE
2091,0.1859471177168513,2025-04-25 10:30:13.315569,2025-04-25 10:30:14.436753,0 days 00:00:01.121184,84.40704096737889,0.007624397774926452,0.020839563008872016,rbf,TPESampler,COMPLETE
2092,194.6303600966215,2025-04-25 10:30:14.619452,2025-04-25 10:30:15.220281,0 days 00:00:00.600829,26.299381679590844,0.0031089151169250468,0.009615606456729623,sigmoid,TPESampler,COMPLETE
2093,0.1770381915696564,2025-04-25 10:30:15.409878,2025-04-25 10:30:16.378094,0 days 00:00:00.968216,98.67519362379717,0.008001009519070975,0.006646099918018043,rbf,TPESampler,COMPLETE
2094,0.8632003892893203,2025-04-25 10:30:16.567757,2025-04-25 10:30:17.211473,0 days 00:00:00.643716,0.006318944005797668,0.8156117705770264,0.0017852308642652803,rbf,TPESampler,COMPLETE
2095,0.4055013486275899,2025-04-25 10:30:17.393466,2025-04-25 10:30:18.133640,0 days 00:00:00.740174,86.61778188028612,0.0064477278335342185,0.26633384743121186,rbf,TPESampler,COMPLETE
2096,0.39730799452797344,2025-04-25 10:30:18.319201,2025-04-25 10:30:19.017008,0 days 00:00:00.697807,76.85488785885856,0.0032395383960398152,0.2449619918126358,rbf,TPESampler,COMPLETE
2097,0.3898788646392816,2025-04-25 10:30:19.196958,2025-04-25 10:30:20.081788,0 days 00:00:00.884830,3.2883464000041243,0.0032161077602949214,0.0029891956795308006,rbf,TPESampler,COMPLETE
2098,0.2085955790572557,2025-04-25 10:30:20.263378,2025-04-25 10:30:21.221097,0 days 00:00:00.957719,26.408319967224088,0.0024594897690011267,0.038970672909994036,rbf,TPESampler,COMPLETE
2099,0.21058436075812936,2025-04-25 10:30:21.405737,2025-04-25 10:30:22.085903,0 days 00:00:00.680166,15.159560604671746,0.01499046506964342,0.028192268224961375,rbf,TPESampler,COMPLETE
2100,0.18597176562934362,2025-04-25 10:30:22.264382,2025-04-25 10:30:22.994375,0 days 00:00:00.729993,26.448670474628322,0.0026623306010853196,0.010880550282445547,rbf,TPESampler,COMPLETE
2101,0.18549925886326904,2025-04-25 10:30:23.178257,2025-04-25 10:30:24.288905,0 days 00:00:01.110648,97.58796027157614,0.013879593440896293,0.01885467315636118,rbf,TPESampler,COMPLETE
2102,0.17761402240354193,2025-04-25 10:30:24.485906,2025-04-25 10:30:25.770938,0 days 00:00:01.285032,94.8425461394876,0.007692676267417717,0.0334906408563206,rbf,TPESampler,COMPLETE
2103,0.22753394676748553,2025-04-25 10:30:25.956792,2025-04-25 10:30:26.680109,0 days 00:00:00.723317,80.24857691390358,0.005326915976650467,0.0019598165074668594,rbf,TPESampler,COMPLETE
2104,0.20288989656110443,2025-04-25 10:30:26.866387,2025-04-25 10:30:27.559020,0 days 00:00:00.692633,24.242181951802934,0.003194636496447892,0.008486339475008016,rbf,TPESampler,COMPLETE
2105,0.237835095679463,2025-04-25 10:30:27.749513,2025-04-25 10:30:29.428920,0 days 00:00:01.679407,97.67640576545054,0.005771131693691049,0.05440492444508991,rbf,TPESampler,COMPLETE
2106,0.2013003067304357,2025-04-25 10:30:29.612456,2025-04-25 10:30:30.714865,0 days 00:00:01.102409,91.29046393560304,0.0024065108055188827,0.009249347132361582,rbf,TPESampler,COMPLETE
2107,0.28525198774234495,2025-04-25 10:30:30.902602,2025-04-25 10:30:31.634329,0 days 00:00:00.731727,18.438600015547266,0.016319664626455902,0.08147570113818188,rbf,TPESampler,COMPLETE
2108,0.7550918796527876,2025-04-25 10:30:31.817142,2025-04-25 11:08:04.180649,0 days 00:37:32.363507,2.2378363549634335,0.009317329639400627,0.20285422359517005,poly,TPESampler,COMPLETE
2109,0.22185254023718556,2025-04-25 11:01:30.589831,2025-04-25 11:01:32.096597,0 days 00:00:01.506766,99.8589758059809,0.008608913776826491,0.04816460778483136,rbf,TPESampler,COMPLETE
2110,0.22332466957816766,2025-04-25 11:01:32.277461,2025-04-25 11:01:33.082575,0 days 00:00:00.805114,21.466610531973714,0.006888163384586101,0.04698770799525685,rbf,TPESampler,COMPLETE
2111,0.5125864127841157,2025-04-25 11:01:33.260803,2025-04-25 11:01:33.790001,0 days 00:00:00.529198,2.8523655476766434,0.21509138190521185,0.0006717632035300117,rbf,TPESampler,COMPLETE
2112,0.21250053944343686,2025-04-25 11:01:33.977782,2025-04-25 11:01:34.796618,0 days 00:00:00.818836,19.090767355123596,0.0037936832618513804,0.0388599338394966,rbf,TPESampler,COMPLETE
