number,value,datetime_start,datetime_complete,duration,params_C,params_epsilon,params_gamma,params_kernel,system_attrs_auto:sampler,state
943,0.1692056995015549,2025-04-25 01:21:01.612722,2025-04-25 01:21:03.173937,0 days 00:00:01.561215,92.25546097158932,0.0015077668824995535,0.028759054682042203,rbf,TPESampler,COMPLETE
944,0.17492817038628222,2025-04-25 01:21:03.343536,2025-04-25 01:21:04.249967,0 days 00:00:00.906431,96.5481886257588,0.002636854647871243,0.006338934362595408,rbf,TPESampler,COMPLETE
945,0.20379156771598103,2025-04-25 01:21:04.413322,2025-04-25 01:21:05.237101,0 days 00:00:00.823779,27.141388084050387,0.0011634199134571753,0.021026787949486356,rbf,TPESampler,COMPLETE
946,0.21414772556899245,2025-04-25 01:21:05.402073,2025-04-25 01:21:06.559666,0 days 00:00:01.157593,32.116117513677096,0.0010125792894792802,0.04535240751693802,rbf,TPESampler,COMPLETE
947,0.23197116592260986,2025-04-25 01:21:06.732534,2025-04-25 01:21:07.473222,0 days 00:00:00.740688,10.454843585634276,0.0023704870745589724,0.04848524706519343,rbf,TPESampler,COMPLETE
948,0.30021699714594874,2025-04-25 01:21:07.644248,2025-04-25 01:21:08.253388,0 days 00:00:00.609140,13.156557058655679,0.0011448623197809031,0.003464027449627325,rbf,TPESampler,COMPLETE
949,0.2097925741099953,2025-04-25 01:21:08.436021,2025-04-25 01:21:09.520868,0 days 00:00:01.084847,33.665200491231744,0.0010203548306764376,0.04291218694442835,rbf,TPESampler,COMPLETE
950,0.18541158356640142,2025-04-25 01:21:09.694412,2025-04-25 01:21:11.244289,0 days 00:00:01.549877,81.30620095138224,0.002450830578032388,0.037343858918360916,rbf,TPESampler,COMPLETE
951,0.1806577523551376,2025-04-25 01:21:11.406045,2025-04-25 01:21:12.160706,0 days 00:00:00.754661,35.168568731506326,0.0017402359722931413,0.010511813006415648,rbf,TPESampler,COMPLETE
952,0.19492791836500814,2025-04-25 01:21:12.391475,2025-04-25 01:21:13.158232,0 days 00:00:00.766757,11.615398589990484,0.003874090318635515,0.022880784673160272,rbf,TPESampler,COMPLETE
953,0.20293153868363006,2025-04-25 01:21:13.337014,2025-04-25 01:21:14.097035,0 days 00:00:00.760021,22.21962885862615,0.0025206733995549813,0.023171627674096466,rbf,TPESampler,COMPLETE
954,0.18158999545872404,2025-04-25 01:21:14.265866,2025-04-25 01:21:15.929040,0 days 00:00:01.663174,84.9332215341939,0.001683258755458194,0.0356779789514611,rbf,TPESampler,COMPLETE
955,0.19218476705724635,2025-04-25 01:21:16.093629,2025-04-25 01:21:17.542598,0 days 00:00:01.448969,95.4165268597813,0.00498907873840123,0.03994321947458103,rbf,TPESampler,COMPLETE
956,0.7673520249350562,2025-04-25 01:21:17.707115,2025-04-25 01:21:18.261716,0 days 00:00:00.554601,0.015732379323508624,0.001219603107621647,0.2512439059191381,sigmoid,TPESampler,COMPLETE
957,0.42864909389344336,2025-04-25 01:21:18.435039,2025-04-25 01:21:19.058735,0 days 00:00:00.623696,68.05046551107554,0.0012233683160430358,0.3322485024086295,rbf,TPESampler,COMPLETE
958,0.2154047420812997,2025-04-25 01:21:19.218187,2025-04-25 01:21:20.805366,0 days 00:00:01.587179,93.07786409951395,0.0011716547359908681,0.04690790776641075,rbf,TPESampler,COMPLETE
959,0.17501913114022832,2025-04-25 01:21:20.971877,2025-04-25 01:21:22.349447,0 days 00:00:01.377570,80.5603658906837,0.003135292303016072,0.027279381592331557,rbf,TPESampler,COMPLETE
960,0.28872271970775515,2025-04-25 01:21:22.516015,2025-04-25 01:21:23.314831,0 days 00:00:00.798816,14.220491953917838,0.004082621712719319,0.08547787803483486,rbf,TPESampler,COMPLETE
961,0.20088819313366454,2025-04-25 01:21:23.477959,2025-04-25 01:21:24.529203,0 days 00:00:01.051244,86.85299380628732,0.0011252339892793897,0.012631035086351303,rbf,TPESampler,COMPLETE
962,0.18040726902204196,2025-04-25 01:21:24.695149,2025-04-25 01:21:26.312311,0 days 00:00:01.617162,93.82809938615001,0.002419157926936098,0.035506001422360184,rbf,TPESampler,COMPLETE
963,0.18837930237622533,2025-04-25 01:21:26.475527,2025-04-25 01:21:27.151023,0 days 00:00:00.675496,14.394799972839508,0.004234093312178384,0.020282333581834577,rbf,TPESampler,COMPLETE
964,0.6016476576641849,2025-04-25 01:21:27.320313,2025-04-25 01:24:16.647170,0 days 00:02:49.326857,22.890277704616498,0.0036764513843535033,0.02540963831155042,poly,TPESampler,COMPLETE
965,0.2503685057544182,2025-04-25 01:24:16.817992,2025-04-25 01:24:17.664904,0 days 00:00:00.846912,27.182565926666417,0.012648429740414798,0.06147574489396028,rbf,TPESampler,COMPLETE
966,0.3057444623010685,2025-04-25 01:24:17.833443,2025-04-25 01:24:19.148357,0 days 00:00:01.314914,99.74536278891424,0.005745154113105242,0.09237125448426395,rbf,TPESampler,COMPLETE
967,0.4137290636761731,2025-04-25 01:24:19.315396,2025-04-25 01:24:19.884537,0 days 00:00:00.569141,1.1509428312624983,0.011138197235765993,0.005924122279644383,rbf,TPESampler,COMPLETE
968,0.38459453294294227,2025-04-25 01:24:20.046672,2025-04-25 01:24:20.810502,0 days 00:00:00.763830,94.70580238009983,0.002094059108223107,0.21276389989592223,rbf,TPESampler,COMPLETE
969,0.2098861612934858,2025-04-25 01:24:20.974234,2025-04-25 01:24:21.688229,0 days 00:00:00.713995,21.43697541982599,0.01912442444436476,0.03701366633756918,rbf,TPESampler,COMPLETE
970,0.31122267380443,2025-04-25 01:24:21.860181,2025-04-25 01:24:22.459766,0 days 00:00:00.599585,1.2964358221181402,0.0012149003091456087,0.06863516977512903,rbf,TPESampler,COMPLETE
971,0.17295163264676688,2025-04-25 01:24:22.655759,2025-04-25 01:24:24.036145,0 days 00:00:01.380386,94.36530334006366,0.0026578908136037694,0.02478700129319508,rbf,TPESampler,COMPLETE
972,0.4970545647245481,2025-04-25 01:24:24.211471,2025-04-25 01:24:24.669664,0 days 00:00:00.458193,0.5194385601700421,0.7424911011959789,0.007806792123472472,linear,TPESampler,COMPLETE
973,175.65717104948956,2025-04-25 01:24:24.831990,2025-04-25 01:24:25.381562,0 days 00:00:00.549572,10.293389222635719,0.003549008713317897,0.024385178456945177,sigmoid,TPESampler,COMPLETE
974,0.27508592227234935,2025-04-25 01:24:25.547502,2025-04-25 01:24:37.006637,0 days 00:00:11.459135,16.47337398596581,0.003533322657613219,0.014494239919906313,linear,TPESampler,COMPLETE
975,0.6255501970827926,2025-04-25 01:24:37.175375,2025-04-25 01:24:52.117953,0 days 00:00:14.942578,95.50555677309903,0.003911300563784733,0.01232188015776712,poly,TPESampler,COMPLETE
976,0.2237856729065197,2025-04-25 01:24:52.283222,2025-04-25 01:24:53.855868,0 days 00:00:01.572646,93.90507184415384,0.0028124382776118823,0.049234281986868855,rbf,TPESampler,COMPLETE
977,0.27649153493107187,2025-04-25 01:24:54.021083,2025-04-25 01:25:17.008272,0 days 00:00:22.987189,26.77164462686426,0.009702242701491474,0.053236351061223555,linear,TPESampler,COMPLETE
978,0.23325039255816532,2025-04-25 01:25:17.177654,2025-04-25 01:25:18.514291,0 days 00:00:01.336637,84.95569250016986,0.007579647011512266,0.05260268421647489,rbf,TPESampler,COMPLETE
979,0.6729595954063012,2025-04-25 01:25:18.688136,2025-04-25 01:25:19.268543,0 days 00:00:00.580407,0.7826651316858415,0.03229120871088694,0.9881831667064421,rbf,TPESampler,COMPLETE
980,0.2047183298403118,2025-04-25 01:25:19.435752,2025-04-25 01:25:20.151285,0 days 00:00:00.715533,25.90413569552344,0.019521077237822582,0.03367451228975733,rbf,TPESampler,COMPLETE
981,0.1743410787230338,2025-04-25 01:25:20.321201,2025-04-25 01:25:21.655028,0 days 00:00:01.333827,86.55679627021361,0.007252413625838213,0.025625493546297545,rbf,TPESampler,COMPLETE
982,0.1827183756239535,2025-04-25 01:25:21.825534,2025-04-25 01:25:22.692197,0 days 00:00:00.866663,87.54070556667104,0.004529155609129634,0.005353407710948686,rbf,TPESampler,COMPLETE
983,0.29284807336698315,2025-04-25 01:25:22.866225,2025-04-25 01:25:23.717894,0 days 00:00:00.851669,96.288225081959,0.024303707987328362,0.08306717223335816,rbf,TPESampler,COMPLETE
984,0.26772907873460383,2025-04-25 01:25:23.880233,2025-04-25 01:25:24.721848,0 days 00:00:00.841615,19.513989090151323,0.00638189940534729,0.07103726604069537,rbf,TPESampler,COMPLETE
985,0.6826576530582095,2025-04-25 01:25:24.898472,2025-04-25 01:25:25.462362,0 days 00:00:00.563890,95.5142955162737,0.39219754890458336,0.8822685572931303,rbf,TPESampler,COMPLETE
986,0.17239408835122175,2025-04-25 01:25:25.637040,2025-04-25 01:25:26.955129,0 days 00:00:01.318089,92.11094848148171,0.0034852234392258007,0.025699290033326685,rbf,TPESampler,COMPLETE
987,0.21374807219602154,2025-04-25 01:25:27.127041,2025-04-25 01:25:27.746704,0 days 00:00:00.619663,14.417897264853707,0.009049463757268436,0.010445736371639085,rbf,TPESampler,COMPLETE
988,0.357423475218942,2025-04-25 01:25:27.914162,2025-04-25 01:25:28.758946,0 days 00:00:00.844784,96.87465379857903,0.011504107967589276,0.1580392384357381,rbf,TPESampler,COMPLETE
989,1752.2504871816436,2025-04-25 01:25:28.936656,2025-04-25 01:25:29.511141,0 days 00:00:00.574485,98.72862924867631,0.005594476915166727,0.026408210231570577,sigmoid,TPESampler,COMPLETE
990,0.20820909017180703,2025-04-25 01:25:29.675059,2025-04-25 01:25:30.329701,0 days 00:00:00.654642,11.046541772882122,0.0011226303883494016,0.01599628770517324,rbf,TPESampler,COMPLETE
991,0.17544737538361016,2025-04-25 01:25:30.501560,2025-04-25 01:25:31.710223,0 days 00:00:01.208663,80.2720636028369,0.004304318166981746,0.02699338364790564,rbf,TPESampler,COMPLETE
992,0.1808585729606163,2025-04-25 01:25:31.880883,2025-04-25 01:25:33.060971,0 days 00:00:01.180088,95.93826914562248,0.011985439284866214,0.03483083689387768,rbf,TPESampler,COMPLETE
993,0.9446665127536444,2025-04-25 01:25:33.549935,2025-04-25 04:34:51.864737,0 days 03:09:18.314802,90.47865073005882,0.003577129126098477,0.10636097442371743,poly,TPESampler,COMPLETE
994,0.23051875856481802,2025-04-25 03:09:14.168246,2025-04-25 03:09:14.814782,0 days 00:00:00.646536,22.4523300724458,0.003592834698238983,0.0046633298316320565,rbf,TPESampler,COMPLETE
995,0.19867825267276693,2025-04-25 03:09:14.991897,2025-04-25 03:09:15.969306,0 days 00:00:00.977409,81.29365666721195,0.005998212714467284,0.013959901613479465,rbf,TPESampler,COMPLETE
996,0.20258523595335842,2025-04-25 03:09:16.138133,2025-04-25 03:09:16.864914,0 days 00:00:00.726781,18.784981515425297,0.010752984023392162,0.02427299715925047,rbf,TPESampler,COMPLETE
997,0.8981325909299351,2025-04-25 03:09:17.032023,2025-04-25 03:09:17.582961,0 days 00:00:00.550938,0.0033363042562636978,0.05125707023897101,0.747780629738739,rbf,TPESampler,COMPLETE
998,0.8924283948937246,2025-04-25 03:09:17.751762,2025-04-25 03:09:18.289047,0 days 00:00:00.537285,5.789442316263271,0.01043333977865879,0.0002692999904006467,poly,TPESampler,COMPLETE
999,0.18135638446286587,2025-04-25 03:09:18.456182,2025-04-25 03:09:19.161625,0 days 00:00:00.705443,23.737905871758223,0.004243400682758451,0.015516149224130119,rbf,TPESampler,COMPLETE
1000,0.2774546437151999,2025-04-25 03:09:19.326916,2025-04-25 03:10:03.466839,0 days 00:00:44.139923,79.60397561945918,0.011373175199445206,0.011181076771867565,linear,TPESampler,COMPLETE
1001,0.19767504061143393,2025-04-25 03:10:03.630397,2025-04-25 03:10:04.668979,0 days 00:00:01.038582,94.66502990608343,0.0043830804289493675,0.013147673876224024,rbf,TPESampler,COMPLETE
1002,270.68634641402735,2025-04-25 03:10:04.836283,2025-04-25 03:10:05.387341,0 days 00:00:00.551058,11.805285589253733,0.012574717238849075,0.22122734001612537,sigmoid,TPESampler,COMPLETE
1003,0.26563774986563077,2025-04-25 03:10:05.552045,2025-04-25 03:10:06.349002,0 days 00:00:00.796957,17.16672677424519,0.004445876252395071,0.07020634455603848,rbf,TPESampler,COMPLETE
1004,0.18491634634782694,2025-04-25 03:10:06.518319,2025-04-25 03:10:07.212312,0 days 00:00:00.693993,16.949044044497516,0.003770112453574503,0.018303480744354506,rbf,TPESampler,COMPLETE
1005,0.20153466764187622,2025-04-25 03:10:07.393350,2025-04-25 03:10:08.495291,0 days 00:00:01.101941,91.60167553748184,0.0013249188765432256,0.011893860161110518,rbf,TPESampler,COMPLETE
1006,0.2774187577141758,2025-04-25 03:10:08.663040,2025-04-25 03:11:10.624988,0 days 00:01:01.961948,93.45329609127975,0.008508357409614939,0.06009578969560139,linear,TPESampler,COMPLETE
1007,0.1998995199229207,2025-04-25 03:11:10.796949,2025-04-25 03:11:11.487582,0 days 00:00:00.690633,17.339382326620207,0.012034489112200729,0.024112463559735127,rbf,TPESampler,COMPLETE
1008,0.31829095441851385,2025-04-25 03:11:11.653811,2025-04-25 03:11:12.445361,0 days 00:00:00.791550,12.923390516023115,0.0014069110516835728,0.10880725378307686,rbf,TPESampler,COMPLETE
1009,0.2630718693747593,2025-04-25 03:11:12.613850,2025-04-25 03:11:14.435604,0 days 00:00:01.821754,99.49376187911048,0.0011877835510351112,0.06466075052475072,rbf,TPESampler,COMPLETE
1010,0.19866666199969876,2025-04-25 03:11:14.617778,2025-04-25 03:11:15.409852,0 days 00:00:00.792074,95.96793567756616,0.0025271514246990915,0.003756532461088943,rbf,TPESampler,COMPLETE
1011,0.19088374691591437,2025-04-25 03:11:15.644030,2025-04-25 03:11:16.288065,0 days 00:00:00.644035,13.715185753814946,0.00973467803376779,0.022114021866479674,rbf,TPESampler,COMPLETE
1012,0.3474453061473653,2025-04-25 03:11:16.451120,2025-04-25 03:11:16.964626,0 days 00:00:00.513506,12.070217481105926,0.14194361535214006,0.12623805094620244,rbf,TPESampler,COMPLETE
1013,0.199153174922523,2025-04-25 03:11:17.129161,2025-04-25 03:11:17.803136,0 days 00:00:00.673975,21.313491277748994,0.0021153282833360917,0.010172703628787009,rbf,TPESampler,COMPLETE
1014,0.23126253139607492,2025-04-25 03:11:17.970588,2025-04-25 03:11:19.303121,0 days 00:00:01.332533,80.12530386471715,0.006526791584000423,0.05204047240579836,rbf,TPESampler,COMPLETE
1015,0.2662378833443931,2025-04-25 03:11:19.467400,2025-04-25 03:11:20.405594,0 days 00:00:00.938194,88.67168154458089,0.024900000966348746,0.0672785544922749,rbf,TPESampler,COMPLETE
1016,0.22943455825766546,2025-04-25 03:11:20.571864,2025-04-25 03:11:21.346333,0 days 00:00:00.774469,17.74962644395241,0.005673520004079176,0.05000388106503106,rbf,TPESampler,COMPLETE
1017,0.1697372022615667,2025-04-25 03:11:21.512876,2025-04-25 03:11:22.966382,0 days 00:00:01.453506,98.86374903138383,0.0021338039133935323,0.026149858941843712,rbf,TPESampler,COMPLETE
1018,0.2009085253917137,2025-04-25 03:11:23.126689,2025-04-25 03:11:24.066947,0 days 00:00:00.940258,53.24028301512253,0.0014757299404308951,0.01649726152773577,rbf,TPESampler,COMPLETE
1019,0.24319217163342172,2025-04-25 03:11:24.226998,2025-04-25 03:11:25.772984,0 days 00:00:01.545986,92.65967213007522,0.006066363685842722,0.05668704485344999,rbf,TPESampler,COMPLETE
1020,0.17235638149381713,2025-04-25 03:11:25.941329,2025-04-25 03:11:27.319461,0 days 00:00:01.378132,91.53597377356074,0.001960105546044279,0.02592554604144742,rbf,TPESampler,COMPLETE
1021,0.21212593900076973,2025-04-25 03:11:27.487406,2025-04-25 03:11:28.252263,0 days 00:00:00.764857,15.474745760679424,0.001417378668920782,0.03260502447969553,rbf,TPESampler,COMPLETE
1022,0.20625503328497685,2025-04-25 03:11:28.421922,2025-04-25 03:11:29.532473,0 days 00:00:01.110551,79.31410134218159,0.0017576178331585996,0.011578493709029173,rbf,TPESampler,COMPLETE
1023,0.21610200309814848,2025-04-25 03:11:29.699792,2025-04-25 03:11:31.298286,0 days 00:00:01.598494,72.56163456602624,0.0010017936769810035,0.04793557653877658,rbf,TPESampler,COMPLETE
1024,0.20529577349375544,2025-04-25 03:11:31.472090,2025-04-25 03:11:32.158908,0 days 00:00:00.686818,12.431927394476018,0.001066985797113945,0.01479532423048757,rbf,TPESampler,COMPLETE
1025,0.35737135666204056,2025-04-25 03:11:32.324587,2025-04-25 03:11:32.897874,0 days 00:00:00.573287,1.357057214552562,0.003080800166302563,0.011761599098357637,rbf,TPESampler,COMPLETE
1026,0.25146554263563536,2025-04-25 03:11:33.059334,2025-04-25 03:11:34.250377,0 days 00:00:01.191043,53.76609857591431,0.002110417017438007,0.06068033443408527,rbf,TPESampler,COMPLETE
1027,0.22530216040218307,2025-04-25 03:11:34.423980,2025-04-25 03:11:35.337873,0 days 00:00:00.913893,19.898693335674718,0.0017639252493676998,0.04816195609431941,rbf,TPESampler,COMPLETE
1028,0.18878172636975646,2025-04-25 03:11:35.515221,2025-04-25 03:11:36.622670,0 days 00:00:01.107449,73.02550939236775,0.0018047095204099214,0.019068292777805106,rbf,TPESampler,COMPLETE
1029,0.5645324381673344,2025-04-25 03:11:36.793026,2025-04-25 03:11:37.341765,0 days 00:00:00.548739,0.0011049034595492868,0.011263212878352299,0.003841696951649726,linear,TPESampler,COMPLETE
1030,0.1984765002969787,2025-04-25 03:11:37.507605,2025-04-25 03:11:38.299703,0 days 00:00:00.792098,26.179056973500195,0.002629037459439858,0.020610281613541635,rbf,TPESampler,COMPLETE
1031,0.18188185090087652,2025-04-25 03:11:38.466628,2025-04-25 03:11:39.391232,0 days 00:00:00.924604,21.07827216697047,0.002697629540286368,0.015858004653778873,rbf,TPESampler,COMPLETE
1032,0.2781701598822128,2025-04-25 03:11:39.566293,2025-04-25 03:11:40.920552,0 days 00:00:01.354259,98.94790526524073,0.0027198815648895413,0.07226829772395046,rbf,TPESampler,COMPLETE
1033,0.2671658524396433,2025-04-25 03:11:41.109988,2025-04-25 03:11:41.959639,0 days 00:00:00.849651,16.671206929126882,0.0028760531384534366,0.07133336631910715,rbf,TPESampler,COMPLETE
1034,0.6250305846313469,2025-04-25 03:11:42.129890,2025-04-25 03:11:42.582073,0 days 00:00:00.452183,19.690856272437006,0.9699260618621718,0.12894825306058527,linear,TPESampler,COMPLETE
1035,0.19376104764494664,2025-04-25 03:11:42.746015,2025-04-25 03:11:43.506405,0 days 00:00:00.760390,20.31935552192466,0.002552790669928272,0.022105563145856284,rbf,TPESampler,COMPLETE
1036,0.28860745580600344,2025-04-25 03:11:43.749815,2025-04-25 03:11:45.124504,0 days 00:00:01.374689,92.7227473546159,0.001909267598731537,0.07761466710011092,rbf,TPESampler,COMPLETE
1037,0.21097401151796666,2025-04-25 03:11:45.297130,2025-04-25 03:11:46.578433,0 days 00:00:01.281303,71.98811327933015,0.0042507055060520505,0.04607976138270027,rbf,TPESampler,COMPLETE
1038,0.18968862005830758,2025-04-25 03:11:46.756443,2025-04-25 03:11:47.775863,0 days 00:00:01.019420,94.13833431844475,0.00139507671211565,0.007974286287352552,rbf,TPESampler,COMPLETE
1039,0.36738201429079914,2025-04-25 03:11:47.947881,2025-04-25 03:11:48.748855,0 days 00:00:00.800974,20.79223561209394,0.0010338213196642786,0.17715116229943886,rbf,TPESampler,COMPLETE
1040,0.1986302134837822,2025-04-25 03:11:48.918928,2025-04-25 03:11:50.455019,0 days 00:00:01.536091,94.39669715835596,0.004913034030714313,0.041879576621372115,rbf,TPESampler,COMPLETE
1041,0.17214256763390764,2025-04-25 03:11:50.623847,2025-04-25 03:11:52.086341,0 days 00:00:01.462494,92.48604622048668,0.003425513482163583,0.025800133402309428,rbf,TPESampler,COMPLETE
1042,0.5500307502671198,2025-04-25 03:11:52.254375,2025-04-25 03:11:52.996316,0 days 00:00:00.741941,0.09403439588090885,0.015137268784876451,0.12977588547426022,rbf,TPESampler,COMPLETE
1043,0.1870711616002898,2025-04-25 03:11:53.202314,2025-04-25 03:11:54.497302,0 days 00:00:01.294988,56.15752534622934,0.0016967661270405202,0.03679692112108218,rbf,TPESampler,COMPLETE
1044,0.17050182108186185,2025-04-25 03:11:54.661770,2025-04-25 03:11:56.133069,0 days 00:00:01.471299,89.55691638865059,0.0024858252703743393,0.02822285916275979,rbf,TPESampler,COMPLETE
1045,1.1671031725517262,2025-04-25 03:11:56.297385,2025-04-25 03:48:50.324621,0 days 00:36:54.027236,19.66637840500955,0.00107136067074897,0.2410252096866014,poly,TPESampler,COMPLETE
1046,0.17582863378539065,2025-04-25 03:48:50.513955,2025-04-25 03:48:51.913482,0 days 00:00:01.399527,76.87856045231317,0.0011589675965545504,0.02828137068793867,rbf,TPESampler,COMPLETE
1047,0.6286377356562324,2025-04-25 03:48:52.081938,2025-04-25 03:55:25.279170,0 days 00:06:33.197232,30.82646927241103,0.001082757997692077,0.02782380021238327,poly,TPESampler,COMPLETE
1048,0.17801054459502924,2025-04-25 03:55:25.451082,2025-04-25 03:55:26.340151,0 days 00:00:00.889069,92.27783905662187,0.0030357614725464227,0.005838817047645268,rbf,TPESampler,COMPLETE
1049,0.19353800962987225,2025-04-25 03:55:26.512535,2025-04-25 03:55:27.219982,0 days 00:00:00.707447,21.550553075829004,0.003002299518197785,0.011137238128897645,rbf,TPESampler,COMPLETE
1050,0.276279651020603,2025-04-25 03:55:27.391956,2025-04-25 03:56:17.779790,0 days 00:00:50.387834,85.55079166801417,0.002483160727584723,0.015391270847745392,linear,TPESampler,COMPLETE
1051,0.20077737845472882,2025-04-25 03:56:17.950658,2025-04-25 03:56:18.973002,0 days 00:00:01.022344,98.5954500645013,0.003937594438945264,0.011585773971653097,rbf,TPESampler,COMPLETE
1052,1.4527855862611072,2025-04-25 03:56:19.143309,2025-04-25 03:56:19.734600,0 days 00:00:00.591291,0.050702492564450606,0.018386737017723982,0.09275145027364073,sigmoid,TPESampler,COMPLETE
1053,0.17007524199835264,2025-04-25 03:56:19.903080,2025-04-25 03:56:21.428900,0 days 00:00:01.525820,89.14579402776938,0.0020849538528644276,0.028780461345643254,rbf,TPESampler,COMPLETE
1054,0.19042433055914895,2025-04-25 03:56:21.592665,2025-04-25 03:56:22.833750,0 days 00:00:01.241085,99.71211233359317,0.0019517548668964455,0.01510822816856786,rbf,TPESampler,COMPLETE
1055,0.3149121952283011,2025-04-25 03:56:22.999831,2025-04-25 03:56:24.185249,0 days 00:00:01.185418,91.4918762291587,0.002075148026133616,0.10031631220067246,rbf,TPESampler,COMPLETE
1056,0.20267830409361434,2025-04-25 03:56:24.355411,2025-04-25 03:56:25.550492,0 days 00:00:01.195081,92.63126855768239,0.003819396421224696,0.011454771589924004,rbf,TPESampler,COMPLETE
1057,0.274307361190915,2025-04-25 03:56:25.716634,2025-04-25 03:56:42.749139,0 days 00:00:17.032505,21.4215253345232,0.0020362038920469084,0.23484167961369987,linear,TPESampler,COMPLETE
1058,0.2876536022782745,2025-04-25 03:56:42.919577,2025-04-25 03:56:43.730478,0 days 00:00:00.810901,11.580932869162162,0.0033670255302826863,0.08569690041369996,rbf,TPESampler,COMPLETE
1059,0.17981299432776413,2025-04-25 03:56:43.906323,2025-04-25 03:56:45.427379,0 days 00:00:01.521056,90.84749931023693,0.003948757771442207,0.03486584606453474,rbf,TPESampler,COMPLETE
