number,value,datetime_start,datetime_complete,duration,params_C,params_epsilon,params_gamma,params_kernel,system_attrs_auto:sampler,state
1762,396.1871484107117,2025-04-25 08:05:35.631532,2025-04-25 08:05:36.195283,0 days 00:00:00.563751,17.813682530167597,0.0024279884730208532,0.044252258997575816,sigmoid,TPESampler,COMPLETE
1763,0.27891817600888863,2025-04-25 08:05:36.366769,2025-04-25 08:05:36.943162,0 days 00:00:00.576393,2.4501584933149307,0.03449433216517948,0.023110121221747045,rbf,TPESampler,COMPLETE
1764,0.17221378646414068,2025-04-25 08:05:37.124784,2025-04-25 08:05:38.383650,0 days 00:00:01.258866,84.28775467367927,0.005362004029906964,0.028660834489477698,rbf,TPESampler,COMPLETE
1765,0.19355207009118777,2025-04-25 08:05:38.570303,2025-04-25 08:05:39.185317,0 days 00:00:00.615014,14.364483609708564,0.031043722926971874,0.01669176834280676,rbf,TPESampler,COMPLETE
1766,0.5577844942968688,2025-04-25 08:05:39.371085,2025-04-25 08:05:39.848674,0 days 00:00:00.477589,0.5857687871438739,0.9955538249114618,0.16067276657647273,linear,TPESampler,COMPLETE
1767,0.24914121768146547,2025-04-25 08:05:40.032830,2025-04-25 08:05:40.672650,0 days 00:00:00.639820,3.562422476862059,0.0028754576402958824,0.032268104447202836,rbf,TPESampler,COMPLETE
1768,0.25918968164334205,2025-04-25 08:05:40.852004,2025-04-25 08:05:42.374585,0 days 00:00:01.522581,1.2002276097264484,0.0014160974203811909,0.00013890692423277698,linear,TPESampler,COMPLETE
1769,0.269996329859125,2025-04-25 08:05:42.548133,2025-04-25 08:05:44.059898,0 days 00:00:01.511765,99.01152953154536,0.003501407306039527,0.06855704356242796,rbf,TPESampler,COMPLETE
1770,0.1768206532736379,2025-04-25 08:05:44.235220,2025-04-25 08:05:45.842664,0 days 00:00:01.607444,95.65087728080134,0.011157180147416663,0.03260370211314295,rbf,TPESampler,COMPLETE
1771,0.1776623416389904,2025-04-25 08:05:46.022028,2025-04-25 08:05:46.912553,0 days 00:00:00.890525,99.34740957820671,0.007348571173764235,0.005407387364539337,rbf,TPESampler,COMPLETE
1772,0.4988991197033269,2025-04-25 08:05:47.095630,2025-04-25 08:05:47.715914,0 days 00:00:00.620284,11.482566675320346,0.0059062206822324305,0.5327370739517019,rbf,TPESampler,COMPLETE
1773,0.6384233019885778,2025-04-25 08:05:47.902095,2025-04-25 08:05:48.449668,0 days 00:00:00.547573,0.5382642129910397,0.24739778480942226,0.000535648825112476,sigmoid,TPESampler,COMPLETE
1774,0.1754972263499467,2025-04-25 08:05:48.635255,2025-04-25 08:05:49.943542,0 days 00:00:01.308287,95.16707238250495,0.002984044596212618,0.023353598396973357,rbf,TPESampler,COMPLETE
1775,0.3745960800744611,2025-04-25 08:05:50.123489,2025-04-25 08:05:50.804366,0 days 00:00:00.680877,99.86673749980822,0.012067428063819283,0.192637840736425,rbf,TPESampler,COMPLETE
1776,0.18763970376969571,2025-04-25 08:05:50.982132,2025-04-25 08:05:52.270511,0 days 00:00:01.288379,98.44689441828739,0.0034692346291200367,0.018653121888723055,rbf,TPESampler,COMPLETE
1777,0.17199580051626515,2025-04-25 08:05:52.449092,2025-04-25 08:05:53.821581,0 days 00:00:01.372489,99.41604278684656,0.0029377877855782174,0.02431909654087763,rbf,TPESampler,COMPLETE
1778,0.30834923741681636,2025-04-25 08:05:54.003168,2025-04-25 08:05:54.623644,0 days 00:00:00.620476,15.280768678680744,0.0021702596356006736,0.002646539409849618,rbf,TPESampler,COMPLETE
1779,0.18179412553169175,2025-04-25 08:05:54.811480,2025-04-25 08:05:55.561232,0 days 00:00:00.749752,24.82207378266123,0.00478898841236783,0.015504997945871703,rbf,TPESampler,COMPLETE
1780,0.23046800986087151,2025-04-25 08:05:55.757400,2025-04-25 08:05:56.409970,0 days 00:00:00.652570,14.012257692015957,0.0027382663347617093,0.007208895261127411,rbf,TPESampler,COMPLETE
1781,0.2030466531061409,2025-04-25 08:05:56.584884,2025-04-25 08:05:57.424724,0 days 00:00:00.839840,22.544976543803894,0.006448218435978987,0.02976580669740143,rbf,TPESampler,COMPLETE
1782,0.20916654920980474,2025-04-25 08:05:57.602699,2025-04-25 08:05:58.393408,0 days 00:00:00.790709,17.677019808074693,0.002505582976238712,0.03250100650233282,rbf,TPESampler,COMPLETE
1783,0.1898499042489793,2025-04-25 08:05:58.569016,2025-04-25 08:05:59.452658,0 days 00:00:00.883642,95.24040807924554,0.014407312569085057,0.00805202623916983,rbf,TPESampler,COMPLETE
1784,0.17814397009916114,2025-04-25 08:05:59.637359,2025-04-25 08:06:00.845667,0 days 00:00:01.208308,96.77248653470608,0.009767281902712432,0.03365898362920395,rbf,TPESampler,COMPLETE
1785,0.36950787575919664,2025-04-25 08:06:01.033838,2025-04-25 08:06:01.825512,0 days 00:00:00.791674,12.780619475669456,0.001110230000955083,0.18284780605539122,rbf,TPESampler,COMPLETE
1786,0.20744908332374856,2025-04-25 08:06:02.008006,2025-04-25 08:06:02.682421,0 days 00:00:00.674415,19.741385517489068,0.0029478265697260716,0.008992230031824231,rbf,TPESampler,COMPLETE
1787,0.2751380720760533,2025-04-25 08:06:02.866457,2025-04-25 08:06:21.599054,0 days 00:00:18.732597,22.826847303424497,0.004011550488194495,0.13055937689528962,linear,TPESampler,COMPLETE
1788,0.2771914822200894,2025-04-25 08:06:21.778154,2025-04-25 08:06:22.733223,0 days 00:00:00.955069,21.630210745687965,0.0034266538019632805,0.0764975653525225,rbf,TPESampler,COMPLETE
1789,0.19813069731185157,2025-04-25 08:06:22.912632,2025-04-25 08:06:23.902345,0 days 00:00:00.989713,96.05110775216355,0.00996341450405065,0.01267840505482478,rbf,TPESampler,COMPLETE
1790,0.2055872864712098,2025-04-25 08:06:24.085526,2025-04-25 08:06:24.865585,0 days 00:00:00.780059,94.75233180811931,0.03023235884000574,0.042742657203506056,rbf,TPESampler,COMPLETE
1791,0.2093409159424211,2025-04-25 08:06:25.052953,2025-04-25 08:06:25.869813,0 days 00:00:00.816860,16.901196728146974,0.001721623520728154,0.030859667332571734,rbf,TPESampler,COMPLETE
1792,0.33149718485013,2025-04-25 08:06:26.046345,2025-04-25 08:06:26.831017,0 days 00:00:00.784672,20.927010796745506,0.0073438679462177634,0.12172478904856987,rbf,TPESampler,COMPLETE
1793,1006.5237201299282,2025-04-25 08:06:27.015760,2025-04-25 08:06:27.597065,0 days 00:00:00.581305,90.58874995968962,0.0010778630780523052,0.014061641753750843,sigmoid,TPESampler,COMPLETE
1794,0.6560018929984263,2025-04-25 08:06:27.769878,2025-04-25 08:06:28.408482,0 days 00:00:00.638604,34.276508901012676,0.00427055127371419,0.004624481176403321,poly,TPESampler,COMPLETE
1795,0.34583269174206394,2025-04-25 08:06:28.581199,2025-04-25 08:06:29.580541,0 days 00:00:00.999342,95.97858375810304,0.0033644314581033367,0.13745289670409822,rbf,TPESampler,COMPLETE
1796,0.21571481054670036,2025-04-25 08:06:29.760918,2025-04-25 08:06:30.422880,0 days 00:00:00.661962,17.385990083010107,0.001888688396475662,0.008456062839324586,rbf,TPESampler,COMPLETE
1797,0.27591634638804086,2025-04-25 08:06:30.602806,2025-04-25 08:07:13.930966,0 days 00:00:43.328160,77.7607656120487,0.0015652559493136474,0.045505223615860145,linear,TPESampler,COMPLETE
1798,0.8773601994712863,2025-04-25 08:07:14.109687,2025-04-25 08:07:14.697118,0 days 00:00:00.587431,0.015154278309993548,0.0013250944523543274,0.7077240277487679,rbf,TPESampler,COMPLETE
1799,0.2872983618007665,2025-04-25 08:07:15.007922,2025-04-25 08:07:16.118700,0 days 00:00:01.110778,96.98964138256771,0.012221456748259684,0.07882137538914981,rbf,TPESampler,COMPLETE
1800,0.1761081764427129,2025-04-25 08:07:16.296494,2025-04-25 08:07:17.706109,0 days 00:00:01.409615,99.60353921025941,0.0018094530194091418,0.022537583594946658,rbf,TPESampler,COMPLETE
1801,0.2202403657047968,2025-04-25 08:07:17.879653,2025-04-25 08:07:18.769276,0 days 00:00:00.889623,16.223080907535056,0.0010163072181729976,0.0435211494772689,rbf,TPESampler,COMPLETE
1802,0.27921928835726995,2025-04-25 08:07:18.942685,2025-04-25 08:07:19.572932,0 days 00:00:00.630247,3.276003236367025,0.007290357805702985,0.06842063088382777,rbf,TPESampler,COMPLETE
1803,0.2170920739479285,2025-04-25 08:07:19.759956,2025-04-25 08:07:20.576047,0 days 00:00:00.816091,22.934585036997767,0.005331414447703129,0.04373806692893907,rbf,TPESampler,COMPLETE
1804,0.19731009052729026,2025-04-25 08:07:20.751222,2025-04-25 08:07:21.538214,0 days 00:00:00.786992,95.98611175608752,0.003068794775778209,0.003867600479000699,rbf,TPESampler,COMPLETE
1805,0.18847936746238556,2025-04-25 08:07:21.717032,2025-04-25 08:07:22.986000,0 days 00:00:01.268968,89.83252233803789,0.002967669048210924,0.017963532093358797,rbf,TPESampler,COMPLETE
1806,0.18857859047431774,2025-04-25 08:07:23.206930,2025-04-25 08:07:24.573018,0 days 00:00:01.366088,98.83518324516812,0.0027920772463725027,0.017938603064641623,rbf,TPESampler,COMPLETE
1807,0.198353271431949,2025-04-25 08:07:24.754793,2025-04-25 08:07:25.549981,0 days 00:00:00.795188,28.64156736289228,0.013549543961077312,0.029130176663274065,rbf,TPESampler,COMPLETE
1808,0.17679353443899437,2025-04-25 08:07:25.732471,2025-04-25 08:07:27.061254,0 days 00:00:01.328783,91.45305491450263,0.005429412988045587,0.023376967972187544,rbf,TPESampler,COMPLETE
1809,0.1846806760020227,2025-04-25 08:07:28.380558,2025-04-25 08:07:29.129642,0 days 00:00:00.749084,18.77216868962437,0.007663641884917341,0.014793425867250458,rbf,TPESampler,COMPLETE
1810,0.2113264084364077,2025-04-25 08:07:29.300306,2025-04-25 08:07:29.931385,0 days 00:00:00.631079,19.39606898928887,0.013327876345028054,0.00837626162813342,rbf,TPESampler,COMPLETE
1811,0.20401131853298632,2025-04-25 08:07:30.107512,2025-04-25 08:07:31.655459,0 days 00:00:01.547947,94.7220137245272,0.0029718308172981024,0.04349858111550363,rbf,TPESampler,COMPLETE
1812,0.2881440592234085,2025-04-25 08:07:31.847310,2025-04-25 08:07:32.710170,0 days 00:00:00.862860,22.451244333497954,0.007579711578850862,0.08270732823037934,rbf,TPESampler,COMPLETE
1813,0.901015300506882,2025-04-25 08:07:32.889214,2025-04-25 08:07:33.435020,0 days 00:00:00.545806,0.0029028543050726436,0.0013559035698804522,0.0009194431244683043,poly,TPESampler,COMPLETE
1814,0.33647091738554336,2025-04-25 08:07:33.621471,2025-04-25 08:07:34.809311,0 days 00:00:01.187840,91.86423333734537,0.0023181647567345216,0.12463363566322419,rbf,TPESampler,COMPLETE
1815,0.1884819695292276,2025-04-25 08:07:34.997236,2025-04-25 08:07:36.242194,0 days 00:00:01.244958,98.46462811978216,0.0021749098746348863,0.01760255752169022,rbf,TPESampler,COMPLETE
1816,0.30747588947748444,2025-04-25 08:07:36.417756,2025-04-25 08:07:37.227701,0 days 00:00:00.809945,14.445731573270763,0.002311586755607773,0.09913407692839504,rbf,TPESampler,COMPLETE
1817,0.18477871550447117,2025-04-25 08:07:37.405730,2025-04-25 08:07:38.296681,0 days 00:00:00.890951,87.43477201366336,0.024238031806932847,0.01959117790770995,rbf,TPESampler,COMPLETE
1818,0.2724249806916067,2025-04-25 08:07:38.469616,2025-04-25 08:07:39.258639,0 days 00:00:00.789023,21.90441120726997,0.009152759739377174,0.07366604010936458,rbf,TPESampler,COMPLETE
1819,0.1987662731984729,2025-04-25 08:07:39.441803,2025-04-25 08:07:40.556473,0 days 00:00:01.114670,98.3872882658363,0.005701191419089686,0.012647819995541603,rbf,TPESampler,COMPLETE
1820,0.2881727978344593,2025-04-25 08:07:40.735463,2025-04-25 08:07:41.846643,0 days 00:00:01.111180,99.2518929179132,0.010865847436496833,0.07907087757811361,rbf,TPESampler,COMPLETE
1821,0.21629576014687255,2025-04-25 08:07:42.024002,2025-04-25 08:07:42.668640,0 days 00:00:00.644638,18.95158723907944,0.0055993260659607455,0.007660344415314325,rbf,TPESampler,COMPLETE
1822,0.27729844224153943,2025-04-25 08:07:42.850024,2025-04-25 08:07:44.186193,0 days 00:00:01.336169,94.84677625175296,0.0038041933882992573,0.07231677367562991,rbf,TPESampler,COMPLETE
1823,0.3093147455124993,2025-04-25 08:07:44.514253,2025-04-25 08:07:45.624936,0 days 00:00:01.110683,3.4387145185819294,0.009687293682240791,0.009363782784048202,rbf,TPESampler,COMPLETE
1824,0.2044447006880241,2025-04-25 08:07:46.600576,2025-04-25 08:07:47.769368,0 days 00:00:01.168792,23.772192958227283,0.001720348471967456,0.022706893277248803,rbf,TPESampler,COMPLETE
1825,0.28273517500954953,2025-04-25 08:07:48.470942,2025-04-25 08:07:50.203959,0 days 00:00:01.733017,94.23001289484253,0.004941957018793342,0.0752074391803605,rbf,TPESampler,COMPLETE
1826,0.16996255467553018,2025-04-25 08:07:50.479347,2025-04-25 08:07:51.726963,0 days 00:00:01.247616,92.32479867477717,0.023380113405118624,0.02650960787096883,rbf,TPESampler,COMPLETE
1827,0.20123678442249848,2025-04-25 08:07:51.910851,2025-04-25 08:07:53.061274,0 days 00:00:01.150423,32.84506294266405,0.02134851932074429,0.03165461528647035,rbf,TPESampler,COMPLETE
1828,0.3092976966892062,2025-04-25 08:07:53.361375,2025-04-25 08:07:54.099633,0 days 00:00:00.738258,10.519274230873235,0.03203007154388399,0.10004752061759202,rbf,TPESampler,COMPLETE
1829,0.19543493298822376,2025-04-25 08:07:54.395359,2025-04-25 08:07:55.378844,0 days 00:00:00.983485,12.717914661080275,0.03459095205536721,0.01867213630049711,rbf,TPESampler,COMPLETE
1830,0.33347728683988803,2025-04-25 08:07:55.745892,2025-04-25 08:07:56.831267,0 days 00:00:01.085375,44.393240517227326,0.02998577970530651,0.12668287930335878,rbf,TPESampler,COMPLETE
1831,0.2028735999925452,2025-04-25 08:07:57.130419,2025-04-25 08:07:58.073053,0 days 00:00:00.942634,50.99062066628954,0.020484718377151424,0.016481219458550703,rbf,TPESampler,COMPLETE
1832,0.19818109505766496,2025-04-25 08:07:58.259211,2025-04-25 08:07:59.200632,0 days 00:00:00.941421,80.12801793047619,0.013603139926524158,0.013907108254135839,rbf,TPESampler,COMPLETE
1833,0.2653563654672815,2025-04-25 08:07:59.381721,2025-04-25 08:07:59.963600,0 days 00:00:00.581879,34.21522692543932,0.10046304406324902,0.06356788681161109,rbf,TPESampler,COMPLETE
1834,0.2222204623907988,2025-04-25 08:08:00.149109,2025-04-25 08:08:00.799485,0 days 00:00:00.650376,16.550458791235606,0.0322534522896632,0.04317213730434693,rbf,TPESampler,COMPLETE
1835,0.27510216865214215,2025-04-25 08:08:00.995843,2025-04-25 08:08:12.842037,0 days 00:00:11.846194,17.74745680870011,0.003436846679193919,0.008590687749049435,linear,TPESampler,COMPLETE
1836,0.19182521255243024,2025-04-25 08:08:13.047530,2025-04-25 08:08:13.704987,0 days 00:00:00.657457,57.26645359607652,0.05645571649483731,0.032406154314354556,rbf,TPESampler,COMPLETE
1837,0.1998726704754902,2025-04-25 08:08:13.903081,2025-04-25 08:08:14.620027,0 days 00:00:00.716946,65.01781377193575,0.03924328102305496,0.040060657552993775,rbf,TPESampler,COMPLETE
1838,0.1680113711342921,2025-04-25 08:08:14.797704,2025-04-25 08:08:16.056868,0 days 00:00:01.259164,98.99237702636476,0.010107897271214908,0.026466206135252884,rbf,TPESampler,COMPLETE
1839,0.22321396493710888,2025-04-25 08:08:16.236850,2025-04-25 08:08:16.864101,0 days 00:00:00.627251,13.9963251271922,0.037533525282241194,0.04162137689403721,rbf,TPESampler,COMPLETE
1840,0.38459714449986665,2025-04-25 08:08:17.038269,2025-04-25 08:08:17.631793,0 days 00:00:00.593524,99.04624902178264,0.04535467448469619,0.2079879501311251,rbf,TPESampler,COMPLETE
1841,0.2007494310560198,2025-04-25 08:08:17.813023,2025-04-25 08:08:18.500805,0 days 00:00:00.687782,45.983572553368894,0.04139807296531433,0.01940429437688659,rbf,TPESampler,COMPLETE
1842,0.31212512792813785,2025-04-25 08:08:18.682010,2025-04-25 08:08:19.464999,0 days 00:00:00.782989,35.13102514157787,0.01977821715599219,0.10129737279939588,rbf,TPESampler,COMPLETE
1843,0.1785277372557947,2025-04-25 08:08:19.655986,2025-04-25 08:08:20.331621,0 days 00:00:00.675635,39.5686270737119,0.02871512314238881,0.010400509660616467,rbf,TPESampler,COMPLETE
1844,0.22561285668922804,2025-04-25 08:08:20.509147,2025-04-25 08:08:21.320661,0 days 00:00:00.811514,72.44955437009415,0.021874344069742955,0.050119689238905966,rbf,TPESampler,COMPLETE
1845,0.20441073759995282,2025-04-25 08:08:21.501448,2025-04-25 08:08:22.306149,0 days 00:00:00.804701,21.23655232638369,0.007968379070209346,0.031225451352169732,rbf,TPESampler,COMPLETE
1846,0.2650730104955417,2025-04-25 08:08:22.488120,2025-04-25 08:08:58.895081,0 days 00:00:36.406961,62.06283499954838,0.06012211102945479,0.08063432866324607,linear,TPESampler,COMPLETE
1847,0.22060916881363501,2025-04-25 08:08:59.075433,2025-04-25 08:09:00.198609,0 days 00:00:01.123176,96.26258125653547,0.013330019113221923,0.04770286543744545,rbf,TPESampler,COMPLETE
1848,0.23982102168805453,2025-04-25 08:09:00.378150,2025-04-25 08:09:00.979495,0 days 00:00:00.601345,6.376274723661545,0.016647295392757108,0.014112289879250553,rbf,TPESampler,COMPLETE
1849,0.7381849370161695,2025-04-25 08:09:01.185256,2025-04-25 08:20:00.608872,0 days 00:10:59.423616,98.72758871628658,0.01651323890364628,0.029135273610984003,poly,TPESampler,COMPLETE
1850,0.20242884947524395,2025-04-25 08:20:00.796410,2025-04-25 08:20:01.576622,0 days 00:00:00.780212,22.60810394129453,0.01758573277848061,0.02915804676735433,rbf,TPESampler,COMPLETE
1851,0.2089370322777355,2025-04-25 08:20:01.753441,2025-04-25 08:20:02.455605,0 days 00:00:00.702164,17.73580715719192,0.01777255463768986,0.02591239176892782,rbf,TPESampler,COMPLETE
1852,0.21171616726929998,2025-04-25 08:20:02.645762,2025-04-25 08:20:03.383379,0 days 00:00:00.737617,16.681339707510947,0.01644802563808042,0.028267085993245733,rbf,TPESampler,COMPLETE
1853,0.22244445173490557,2025-04-25 08:20:03.579708,2025-04-25 08:20:04.210510,0 days 00:00:00.630802,17.317559183008402,0.01651264425774477,0.006971742319664895,rbf,TPESampler,COMPLETE
1854,0.20770561667597995,2025-04-25 08:20:04.388716,2025-04-25 08:20:05.228742,0 days 00:00:00.840026,68.73047032695962,0.02149516240479802,0.012980710670868355,rbf,TPESampler,COMPLETE
1855,0.18895349252749402,2025-04-25 08:20:05.413114,2025-04-25 08:20:06.247550,0 days 00:00:00.834436,83.14980314477731,0.03396515125700141,0.018801702637252598,rbf,TPESampler,COMPLETE
1856,0.18090236806024546,2025-04-25 08:20:06.454153,2025-04-25 08:20:07.168242,0 days 00:00:00.714089,23.31951719750746,0.018607848148711754,0.014828094785987088,rbf,TPESampler,COMPLETE
1857,0.21862196167157155,2025-04-25 08:20:07.347019,2025-04-25 08:20:08.019439,0 days 00:00:00.672420,30.198150605649353,0.00978452341547317,0.0046177328013492225,rbf,TPESampler,COMPLETE
1858,0.17871592327056893,2025-04-25 08:20:08.197818,2025-04-25 08:20:09.414615,0 days 00:00:01.216797,98.85655507092478,0.011230351581506598,0.033889095236331046,rbf,TPESampler,COMPLETE
1859,0.17798633120355034,2025-04-25 08:20:09.601013,2025-04-25 08:20:10.893999,0 days 00:00:01.292986,98.56025424098617,0.007707674005392356,0.033968876662698703,rbf,TPESampler,COMPLETE
1860,0.30002478749894923,2025-04-25 08:20:11.077552,2025-04-25 08:20:11.833162,0 days 00:00:00.755610,21.800196611968293,0.013526447871210306,0.09127135719541164,rbf,TPESampler,COMPLETE
1861,0.7540703617257676,2025-04-25 08:20:12.035638,2025-04-25 08:20:12.629923,0 days 00:00:00.594285,0.007702002636833792,0.05766790828143782,0.7102484072952342,sigmoid,TPESampler,COMPLETE
1862,0.19953422169017868,2025-04-25 08:20:12.811894,2025-04-25 08:20:13.735892,0 days 00:00:00.923998,89.49206356940606,0.0197988664793029,0.04186871221489036,rbf,TPESampler,COMPLETE
1863,0.1776117645940878,2025-04-25 08:20:13.924124,2025-04-25 08:20:14.806819,0 days 00:00:00.882695,92.2708340821369,0.030157447139358994,0.020985879626259765,rbf,TPESampler,COMPLETE
1864,0.2686117110081719,2025-04-25 08:20:15.001139,2025-04-25 08:20:15.642415,0 days 00:00:00.641276,2.903590730809108,0.013141546094378974,0.048546954574418634,rbf,TPESampler,COMPLETE
1865,0.2015276697231367,2025-04-25 08:20:15.829305,2025-04-25 08:20:16.711895,0 days 00:00:00.882590,76.42567800494842,0.023338338008294397,0.013432751450555794,rbf,TPESampler,COMPLETE
1866,0.4997397641145691,2025-04-25 08:20:16.902744,2025-04-25 08:20:17.477954,0 days 00:00:00.575210,0.005296272488318287,0.0010479417466162158,0.000492585466591479,linear,TPESampler,COMPLETE
1867,0.962289818629359,2025-04-25 08:20:17.666523,2025-04-25 08:20:18.416467,0 days 00:00:00.749944,0.017945001650475977,0.9909339466125984,0.3069357237406144,poly,TPESampler,COMPLETE
1868,0.2769995655394211,2025-04-25 08:20:18.601002,2025-04-25 08:21:10.881433,0 days 00:00:52.280431,73.79576913826881,0.018173063949998493,0.011822134797065642,linear,TPESampler,COMPLETE
1869,0.19839423116540747,2025-04-25 08:21:11.070419,2025-04-25 08:21:11.863975,0 days 00:00:00.793556,95.4546148543128,0.008383092531643781,0.003688213654393799,rbf,TPESampler,COMPLETE
1870,0.19247735019764808,2025-04-25 08:21:12.045949,2025-04-25 08:21:12.695617,0 days 00:00:00.649668,95.57979430805916,0.06940301131706572,0.034212140156420656,rbf,TPESampler,COMPLETE
1871,0.1920639915845906,2025-04-25 08:21:12.887257,2025-04-25 08:21:13.670249,0 days 00:00:00.782992,33.238517005162436,0.015350511506641148,0.016300290300156933,rbf,TPESampler,COMPLETE
1872,0.16974679397270392,2025-04-25 08:21:14.074753,2025-04-25 08:21:14.970625,0 days 00:00:00.895872,97.30438128337937,0.023111767776909514,0.027525623196436484,rbf,TPESampler,COMPLETE
1873,0.27505914461038594,2025-04-25 08:21:15.182967,2025-04-25 08:21:15.827055,0 days 00:00:00.644088,40.24800210832895,0.0490036960718567,0.0725948527079994,rbf,TPESampler,COMPLETE
1874,0.19601513401609122,2025-04-25 08:21:16.012852,2025-04-25 08:21:16.739139,0 days 00:00:00.726287,81.812202969978,0.04591267146093073,0.01774042692665231,rbf,TPESampler,COMPLETE
1875,0.19815808783708577,2025-04-25 08:21:16.923455,2025-04-25 08:21:17.740321,0 days 00:00:00.816866,95.56391394111496,0.02461752794080284,0.04113473094102296,rbf,TPESampler,COMPLETE
1876,0.47144966989757736,2025-04-25 08:21:17.965410,2025-04-25 08:21:18.700419,0 days 00:00:00.735009,0.009808686556234169,0.04122513482286587,0.8630705936573775,linear,TPESampler,COMPLETE
1877,0.2956823513796011,2025-04-25 08:21:18.885580,2025-04-25 08:21:19.622731,0 days 00:00:00.737151,30.7823386532093,0.024059974782369913,0.08759680054672041,rbf,TPESampler,COMPLETE
1878,0.23180110496036962,2025-04-25 08:21:19.808588,2025-04-25 08:21:20.606189,0 days 00:00:00.797601,96.12640577735475,0.028943375909318537,0.052558461827983446,rbf,TPESampler,COMPLETE
