number,value,datetime_start,datetime_complete,duration,params_C,params_epsilon,params_gamma,params_kernel,system_attrs_auto:sampler,state
235,0.3419154672686893,2025-04-24 23:09:15.961625,2025-04-24 23:09:16.536012,0 days 00:00:00.574387,34.366079611260375,0.0011516095434756957,0.0009525176341918642,rbf,TPESampler,COMPLETE
236,0.17539210259173504,2025-04-24 23:09:16.695542,2025-04-24 23:09:17.426658,0 days 00:00:00.731116,94.79502346588055,0.02635694307635473,0.0052005845697695435,rbf,TPESampler,COMPLETE
237,0.1840021853289571,2025-04-24 23:09:17.682983,2025-04-24 23:09:18.276227,0 days 00:00:00.593244,53.35340888758341,0.054221387455459805,0.009391500106239035,rbf,TPESampler,COMPLETE
238,0.19326954939939384,2025-04-24 23:09:17.961789,2025-04-24 23:09:18.998795,0 days 00:00:01.037006,98.99292031797651,0.003039856758752848,0.008004223131703838,rbf,TPESampler,COMPLETE
239,0.20587947316738797,2025-04-24 23:09:18.452362,2025-04-24 23:09:19.058558,0 days 00:00:00.606196,32.50077250881443,0.03822504161873039,0.006281737793999992,rbf,TPESampler,COMPLETE
240,0.19725129456176382,2025-04-24 23:09:19.201287,2025-04-24 23:09:19.920097,0 days 00:00:00.718810,92.29012088130258,0.09798676879530455,0.0037574619364833693,rbf,TPESampler,COMPLETE
241,1.280431754034441,2025-04-24 23:09:19.260034,2025-04-24 23:09:19.943522,0 days 00:00:00.683488,1.7826218654268398,0.001619550112846627,0.0025100299210537697,sigmoid,TPESampler,COMPLETE
242,0.20607063220929953,2025-04-24 23:09:20.028020,2025-04-24 23:09:20.761062,0 days 00:00:00.733042,79.44346431945229,0.07481654362171743,0.008773682133547888,rbf,TPESampler,COMPLETE
243,0.2073937766962368,2025-04-24 23:09:20.069884,2025-04-24 23:09:20.884217,0 days 00:00:00.814333,92.62148760187856,0.027632619981305527,0.0028443221245615575,rbf,TPESampler,COMPLETE
244,0.20066821811840135,2025-04-24 23:09:20.912676,2025-04-24 23:09:21.656775,0 days 00:00:00.744099,89.14411774002005,0.0037428454624705435,0.003700537985832303,rbf,TPESampler,COMPLETE
245,0.2760749999947393,2025-04-24 23:09:21.072788,2025-04-24 23:09:54.525013,0 days 00:00:33.452225,51.89680667024746,0.001914820553068771,0.007511174655664917,linear,TPESampler,COMPLETE
246,0.18545808717677298,2025-04-24 23:09:21.812646,2025-04-24 23:09:22.482688,0 days 00:00:00.670042,92.32263166737032,0.031661462263852566,0.004362368458035393,rbf,TPESampler,COMPLETE
247,0.24354773274583105,2025-04-24 23:09:22.633279,2025-04-24 23:09:23.172365,0 days 00:00:00.539086,14.10441290854007,0.03213848221025902,0.006212654625335684,rbf,TPESampler,COMPLETE
248,0.18332263133186266,2025-04-24 23:09:23.322670,2025-04-24 23:09:23.915815,0 days 00:00:00.593145,82.40840572924786,0.05532778232772849,0.005050440056574592,rbf,TPESampler,COMPLETE
249,0.1941469633086396,2025-04-24 23:09:24.071615,2025-04-24 23:09:24.711907,0 days 00:00:00.640292,90.14992682513092,0.04879964722316985,0.008295192514705334,rbf,TPESampler,COMPLETE
250,0.19922052498091974,2025-04-24 23:09:24.871406,2025-04-24 23:09:25.392102,0 days 00:00:00.520696,96.38197572137054,0.11050866485210384,0.003758368704770427,rbf,TPESampler,COMPLETE
251,0.19286736016455436,2025-04-24 23:09:25.544128,2025-04-24 23:09:26.166275,0 days 00:00:00.622147,95.26414176236143,0.028941278244792847,0.003873216035177278,rbf,TPESampler,COMPLETE
252,0.8250784108834285,2025-04-24 23:09:26.321197,2025-04-24 23:21:14.002082,0 days 00:11:47.680885,94.48815365753661,0.025972291568014647,0.07645812665961801,poly,TPESampler,COMPLETE
253,0.43088832593534915,2025-04-24 23:09:54.684560,2025-04-24 23:09:55.251537,0 days 00:00:00.566977,14.077144265291007,0.019374203150753767,0.0005716007684842268,rbf,TPESampler,COMPLETE
254,0.25323294987388406,2025-04-24 23:09:55.412673,2025-04-24 23:09:56.013491,0 days 00:00:00.600818,14.089668202137435,0.013342587967372964,0.005309555317141707,rbf,TPESampler,COMPLETE
255,0.24003776198910626,2025-04-24 23:09:56.179741,2025-04-24 23:09:56.820390,0 days 00:00:00.640649,96.77309480432753,0.001960972653380762,0.0013374802479027737,rbf,TPESampler,COMPLETE
256,0.6897463984035905,2025-04-24 23:09:56.979937,2025-04-24 23:09:57.534886,0 days 00:00:00.554949,49.55947317825019,0.023047133796960665,0.0030604164704061154,poly,TPESampler,COMPLETE
257,0.3199706848966762,2025-04-24 23:09:57.689274,2025-04-24 23:09:58.211346,0 days 00:00:00.522072,10.56022670949077,0.07008059889828736,0.0030864842451122994,rbf,TPESampler,COMPLETE
258,0.7441010885853939,2025-04-24 23:09:58.359221,2025-04-24 23:09:58.892335,0 days 00:00:00.533114,0.010352240034225652,0.0041120302804322295,0.030694844979441267,sigmoid,TPESampler,COMPLETE
259,0.20095650068599402,2025-04-24 23:09:59.052960,2025-04-24 23:10:00.147791,0 days 00:00:01.094831,87.45297530239004,0.0010513016160834533,0.009370056851076536,rbf,TPESampler,COMPLETE
260,0.2522951977332602,2025-04-24 23:10:00.305538,2025-04-24 23:10:00.917813,0 days 00:00:00.612275,13.632929402323494,0.01105364636590545,0.005527989461356572,rbf,TPESampler,COMPLETE
261,368.4188646487802,2025-04-24 23:10:01.079301,2025-04-24 23:10:01.641929,0 days 00:00:00.562628,35.281523092703324,0.0012266042436295773,0.01308832102367562,sigmoid,TPESampler,COMPLETE
262,0.1875934071885577,2025-04-24 23:10:01.805189,2025-04-24 23:10:02.635755,0 days 00:00:00.830566,95.96687348676333,0.0163509267651227,0.007873583012548776,rbf,TPESampler,COMPLETE
263,0.1917620627553037,2025-04-24 23:10:02.789313,2025-04-24 23:10:03.375973,0 days 00:00:00.586660,22.407303729375347,0.03258310148969158,0.011767542525871045,rbf,TPESampler,COMPLETE
264,0.2258016008575177,2025-04-24 23:10:03.548556,2025-04-24 23:10:04.201134,0 days 00:00:00.652578,93.191144780035,0.011309252705555483,0.0019086171207574768,rbf,TPESampler,COMPLETE
265,0.20712415126736505,2025-04-24 23:10:04.468638,2025-04-24 23:10:05.168914,0 days 00:00:00.700276,18.692440685832523,0.017522007987270976,0.02828684634953525,rbf,TPESampler,COMPLETE
266,0.2686134341795391,2025-04-24 23:10:05.326755,2025-04-24 23:10:05.816501,0 days 00:00:00.489746,89.07152616239084,0.14676148950197165,0.001097660067827946,rbf,TPESampler,COMPLETE
267,0.2458170191728178,2025-04-24 23:10:05.976926,2025-04-24 23:10:06.528914,0 days 00:00:00.551988,10.47062099070626,0.0341652689017186,0.007931187060799625,rbf,TPESampler,COMPLETE
268,0.20324458697272196,2025-04-24 23:10:06.696170,2025-04-24 23:10:07.237641,0 days 00:00:00.541471,54.314334947267206,0.08446143112453239,0.004828887713638683,rbf,TPESampler,COMPLETE
269,0.24750765466890315,2025-04-24 23:10:07.399683,2025-04-24 23:10:07.990021,0 days 00:00:00.590338,9.885577493639925,0.007085677854352842,0.008042041687580307,rbf,TPESampler,COMPLETE
270,0.18443042258267892,2025-04-24 23:10:08.146878,2025-04-24 23:10:08.831627,0 days 00:00:00.684749,76.18566162130693,0.048119394076176436,0.005141369248272312,rbf,TPESampler,COMPLETE
271,0.8921415099547955,2025-04-24 23:10:08.987206,2025-04-24 23:10:09.483769,0 days 00:00:00.496563,0.01069704014773543,0.1700793900634301,0.002444008833205819,poly,TPESampler,COMPLETE
272,0.18949196655736894,2025-04-24 23:10:09.644257,2025-04-24 23:10:10.490329,0 days 00:00:00.846072,98.65522391179181,0.021324503735926845,0.007955945974637654,rbf,TPESampler,COMPLETE
273,0.20297737704080998,2025-04-24 23:10:10.649560,2025-04-24 23:10:11.265623,0 days 00:00:00.616063,80.64590659031539,0.061955609865878246,0.014190930401574858,rbf,TPESampler,COMPLETE
274,0.18982276385798807,2025-04-24 23:10:11.424834,2025-04-24 23:10:12.230791,0 days 00:00:00.805957,84.19024310533536,0.0028749977454115027,0.004805273010535287,rbf,TPESampler,COMPLETE
275,0.20850245306366305,2025-04-24 23:10:12.396072,2025-04-24 23:10:13.020370,0 days 00:00:00.624298,84.55476436163492,0.06844810942020475,0.011706254979240837,rbf,TPESampler,COMPLETE
276,0.4977733207277652,2025-04-24 23:10:13.186923,2025-04-24 23:10:13.771918,0 days 00:00:00.584995,0.005474114610344777,0.0037571018415810146,0.11088174603394602,linear,TPESampler,COMPLETE
277,0.2828607765316527,2025-04-24 23:10:13.927174,2025-04-24 23:10:14.581149,0 days 00:00:00.653975,86.63623690739963,0.04350175535410446,0.0008603042564075654,rbf,TPESampler,COMPLETE
278,0.568568032193211,2025-04-24 23:10:14.743654,2025-04-24 23:10:15.291873,0 days 00:00:00.548219,0.16753485297261375,0.0010058316442875265,0.0023281025990898405,rbf,TPESampler,COMPLETE
279,0.7140172722378941,2025-04-24 23:10:15.453110,2025-04-24 23:10:16.010953,0 days 00:00:00.557843,0.015495552620469779,0.035044954445466625,0.037793506396656525,poly,TPESampler,COMPLETE
280,0.6965640000825314,2025-04-24 23:10:16.167647,2025-04-24 23:10:16.706367,0 days 00:00:00.538720,3.2546217690613894,0.0036660276519857892,0.007115329665511928,poly,TPESampler,COMPLETE
281,0.21389582526073478,2025-04-24 23:10:16.865725,2025-04-24 23:10:17.617768,0 days 00:00:00.752043,85.32175283308477,0.04241728960525163,0.010134389445203078,rbf,TPESampler,COMPLETE
282,0.2751506321738906,2025-04-24 23:10:17.827445,2025-04-24 23:10:18.401079,0 days 00:00:00.573634,12.888741948941608,0.022794788572302164,0.004496415062951021,rbf,TPESampler,COMPLETE
283,0.8920170772249985,2025-04-24 23:10:18.562844,2025-04-24 23:10:19.074508,0 days 00:00:00.511664,0.00921674206376421,0.14718359017860538,0.000407244567045296,sigmoid,TPESampler,COMPLETE
284,0.2774908317664352,2025-04-24 23:10:19.236576,2025-04-24 23:11:06.827906,0 days 00:00:47.591330,70.14429181757077,0.024603187561024305,0.00740441548230086,linear,TPESampler,COMPLETE
285,0.1918400946168376,2025-04-24 23:11:06.987990,2025-04-24 23:11:07.610812,0 days 00:00:00.622822,13.349956267088473,0.012018826154735924,0.018636558460513673,rbf,TPESampler,COMPLETE
286,0.7187031076437632,2025-04-24 23:11:07.770929,2025-04-24 23:11:08.361132,0 days 00:00:00.590203,0.12648526827103224,0.07715007158296207,0.0003954799338113584,rbf,TPESampler,COMPLETE
287,0.858038263354038,2025-04-24 23:11:08.522799,2025-04-24 23:11:09.069890,0 days 00:00:00.547091,0.002378764858113335,0.003717321366693646,0.005018821945222907,rbf,TPESampler,COMPLETE
288,0.2297613802232533,2025-04-24 23:11:09.242442,2025-04-24 23:11:09.864353,0 days 00:00:00.621911,25.74907458314224,0.005892054943764612,0.00422867774410775,rbf,TPESampler,COMPLETE
289,0.19580186719612763,2025-04-24 23:11:10.022121,2025-04-24 23:11:10.722208,0 days 00:00:00.700087,74.98200631945772,0.009632387434971726,0.00458986010965235,rbf,TPESampler,COMPLETE
290,0.8335923295976799,2025-04-24 23:11:10.887462,2025-04-24 23:11:11.406753,0 days 00:00:00.519291,0.003465768251713383,0.41886579893486736,0.007503352145600225,rbf,TPESampler,COMPLETE
291,0.9032368316935194,2025-04-24 23:11:11.568793,2025-04-24 23:11:12.080394,0 days 00:00:00.511601,0.4394260219394746,0.07801457968908859,0.00011260993888046118,poly,TPESampler,COMPLETE
292,191.69562602982282,2025-04-24 23:11:12.247071,2025-04-24 23:11:12.784092,0 days 00:00:00.537021,45.817214663657516,0.1742537788816945,0.006188476391359458,sigmoid,TPESampler,COMPLETE
293,0.17674615929289259,2025-04-24 23:11:12.941759,2025-04-24 23:11:13.699686,0 days 00:00:00.757927,97.49734267687056,0.021406538016086264,0.005009338104518424,rbf,TPESampler,COMPLETE
294,0.19119741213507904,2025-04-24 23:11:13.859251,2025-04-24 23:11:14.656258,0 days 00:00:00.797007,64.12832219099658,0.02168807535551322,0.01038412371414083,rbf,TPESampler,COMPLETE
295,118.83941328534354,2025-04-24 23:11:14.816921,2025-04-24 23:11:16.025274,0 days 00:00:01.208353,37.4961856496549,0.012700232193434826,0.005174428155171925,sigmoid,TPESampler,COMPLETE
296,0.35494259371230774,2025-04-24 23:11:16.185567,2025-04-24 23:11:16.748377,0 days 00:00:00.562810,14.290279354213446,0.038149421306420725,0.0016315455453076357,rbf,TPESampler,COMPLETE
297,0.19754140058273448,2025-04-24 23:11:16.918401,2025-04-24 23:11:17.541043,0 days 00:00:00.622642,98.73783674236448,0.058889032599099035,0.0033388662514750277,rbf,TPESampler,COMPLETE
298,0.7945920449078647,2025-04-24 23:11:17.727338,2025-04-24 23:11:18.256414,0 days 00:00:00.529076,0.005741047623332226,0.172473959061456,0.12824959450704387,sigmoid,TPESampler,COMPLETE
299,0.20533720450511675,2025-04-24 23:11:18.419424,2025-04-24 23:11:19.331206,0 days 00:00:00.911782,39.68417081879763,0.011548782513957799,0.04260333766876778,rbf,TPESampler,COMPLETE
300,0.19899811261571856,2025-04-24 23:11:19.492679,2025-04-24 23:11:20.609982,0 days 00:00:01.117303,88.99813838675882,0.03193207491544487,0.012537988312584255,rbf,TPESampler,COMPLETE
301,0.3801908887628375,2025-04-24 23:11:20.766193,2025-04-24 23:11:21.316489,0 days 00:00:00.550296,15.48437364927322,0.010155548045121834,0.0010890796031613227,rbf,TPESampler,COMPLETE
302,0.21828874682933289,2025-04-24 23:11:21.474504,2025-04-24 23:11:22.093217,0 days 00:00:00.618713,76.18470548175594,0.018774765834509825,0.002487361496024518,rbf,TPESampler,COMPLETE
303,0.18765096803649323,2025-04-24 23:11:22.264451,2025-04-24 23:11:23.436211,0 days 00:00:01.171760,91.73516507491472,0.013542805762700318,0.016418772057131898,rbf,TPESampler,COMPLETE
304,0.18809262361066437,2025-04-24 23:11:23.597193,2025-04-24 23:11:24.631873,0 days 00:00:01.034680,90.11389199926259,0.014414497189643943,0.018830123526447893,rbf,TPESampler,COMPLETE
305,0.21038074716003605,2025-04-24 23:11:24.828734,2025-04-24 23:11:25.418772,0 days 00:00:00.590038,13.352926615736948,0.014348032353651232,0.011929767773348915,rbf,TPESampler,COMPLETE
306,0.18341231426084442,2025-04-24 23:11:25.597601,2025-04-24 23:11:26.452674,0 days 00:00:00.855073,89.65458206448236,0.017832424561435547,0.0077752698496068515,rbf,TPESampler,COMPLETE
307,0.20189774479049355,2025-04-24 23:11:26.613802,2025-04-24 23:11:27.458723,0 days 00:00:00.844921,60.160584199722024,0.009580226752213369,0.015333581349685337,rbf,TPESampler,COMPLETE
308,0.2212250596971645,2025-04-24 23:11:27.624014,2025-04-24 23:11:28.276500,0 days 00:00:00.652486,96.42352359068624,0.019625047996708188,0.0020221124426258816,rbf,TPESampler,COMPLETE
309,0.6991721263243559,2025-04-24 23:11:28.434823,2025-04-24 23:11:30.694570,0 days 00:00:02.259747,20.686305321647627,0.0172950785938447,0.0132740635714611,poly,TPESampler,COMPLETE
310,0.17382506681292179,2025-04-24 23:11:30.860354,2025-04-24 23:11:31.579035,0 days 00:00:00.718681,88.98810070351854,0.030959574835835283,0.006937590111417221,rbf,TPESampler,COMPLETE
311,0.5313310616546898,2025-04-24 23:11:31.731437,2025-04-24 23:11:32.170429,0 days 00:00:00.438992,0.004634724494195727,0.5034890736894512,0.0006802434749457044,linear,TPESampler,COMPLETE
312,0.17238483665290893,2025-04-24 23:11:32.325484,2025-04-24 23:11:33.038603,0 days 00:00:00.713119,82.29745563382208,0.029410880871666708,0.006773654118057282,rbf,TPESampler,COMPLETE
313,0.29145202272968945,2025-04-24 23:11:33.200085,2025-04-24 23:11:33.731706,0 days 00:00:00.531621,8.098459649710556,0.028783152623125467,0.005447215440640349,rbf,TPESampler,COMPLETE
314,0.6731806922971616,2025-04-24 23:11:33.884623,2025-04-24 23:11:37.163954,0 days 00:00:03.279331,0.005342798139247115,0.006175275700895771,0.24022747833540065,poly,TPESampler,COMPLETE
315,0.22847102319924953,2025-04-24 23:11:37.325938,2025-04-24 23:11:37.952269,0 days 00:00:00.626331,20.216553073659572,0.03422516008804863,0.005595381360830136,rbf,TPESampler,COMPLETE
316,0.21161244671987545,2025-04-24 23:11:38.110870,2025-04-24 23:11:38.719172,0 days 00:00:00.608302,98.64855539113532,0.0561514897195977,0.0026208020612526793,rbf,TPESampler,COMPLETE
317,0.22092793761045704,2025-04-24 23:11:38.876416,2025-04-24 23:11:39.440380,0 days 00:00:00.563964,25.670129452387123,0.03186453733226165,0.005620288887125517,rbf,TPESampler,COMPLETE
318,0.7462623133840219,2025-04-24 23:11:39.596995,2025-04-24 23:11:45.601916,0 days 00:00:06.004921,21.212021382304957,0.35846717664320144,0.01538466960733721,poly,TPESampler,COMPLETE
319,0.7482659197115016,2025-04-24 23:11:45.762661,2025-04-24 23:11:46.244472,0 days 00:00:00.481811,0.022264140839896637,0.6362502157381862,0.03876924048553064,poly,TPESampler,COMPLETE
320,0.17517564346814438,2025-04-24 23:11:46.401291,2025-04-24 23:11:47.080351,0 days 00:00:00.679060,71.30906688577453,0.03329876786833481,0.0066855664746536475,rbf,TPESampler,COMPLETE
321,0.8954179671197514,2025-04-24 23:11:47.270388,2025-04-24 23:11:47.793600,0 days 00:00:00.523212,0.050481529115618505,0.014224492781109321,0.001089839406189267,poly,TPESampler,COMPLETE
322,0.201532309698456,2025-04-24 23:11:47.952696,2025-04-24 23:11:48.545495,0 days 00:00:00.592799,91.80381370449368,0.05621992781796619,0.003295547277659558,rbf,TPESampler,COMPLETE
323,23.052208237845964,2025-04-24 23:11:48.704165,2025-04-24 23:11:49.227793,0 days 00:00:00.523628,22.453287494133352,0.04341252867023143,0.0027816439979562466,sigmoid,TPESampler,COMPLETE
324,0.21884958411999164,2025-04-24 23:11:49.387157,2025-04-24 23:11:50.025133,0 days 00:00:00.637976,63.32905330640486,0.009422107264836903,0.002780737164863456,rbf,TPESampler,COMPLETE
325,0.19012392527268468,2025-04-24 23:11:50.182941,2025-04-24 23:11:50.993074,0 days 00:00:00.810133,82.06055312930302,0.02885052057484966,0.016083862067362998,rbf,TPESampler,COMPLETE
326,0.20584963068996612,2025-04-24 23:11:51.152508,2025-04-24 23:11:51.664551,0 days 00:00:00.512043,17.605728550123988,0.09113093660751363,0.01737144654038283,rbf,TPESampler,COMPLETE
327,0.20088458064183062,2025-04-24 23:11:51.822551,2025-04-24 23:11:52.563712,0 days 00:00:00.741161,98.76260670446018,0.01420990095332073,0.00325715974735383,rbf,TPESampler,COMPLETE
328,0.18860541040422554,2025-04-24 23:11:52.729512,2025-04-24 23:11:53.329108,0 days 00:00:00.599596,51.49049704905593,0.06293884259666492,0.009611509750537869,rbf,TPESampler,COMPLETE
329,0.5697344234032088,2025-04-24 23:11:53.497976,2025-04-24 23:11:54.027143,0 days 00:00:00.529167,7.773043058930339,0.0025317049615923163,0.00012448211964197016,sigmoid,TPESampler,COMPLETE
330,0.33129222750056386,2025-04-24 23:11:54.205406,2025-04-24 23:11:54.740347,0 days 00:00:00.534941,17.03279780858745,0.04829765051208002,0.001865619189222565,rbf,TPESampler,COMPLETE
331,0.2318935321866967,2025-04-24 23:11:54.899852,2025-04-24 23:11:55.565883,0 days 00:00:00.666031,72.01804628405547,0.0428039423661406,0.0518465998713807,rbf,TPESampler,COMPLETE
332,0.2617899542153938,2025-04-24 23:11:55.724196,2025-04-24 23:11:56.255971,0 days 00:00:00.531775,9.181501841476326,0.04364649154423472,0.007217922099042241,rbf,TPESampler,COMPLETE
333,0.20373331387019722,2025-04-24 23:11:56.412424,2025-04-24 23:11:57.106564,0 days 00:00:00.694140,90.2303829045788,0.019271487255863994,0.003141762945073128,rbf,TPESampler,COMPLETE
334,0.20709696632327387,2025-04-24 23:11:57.263993,2025-04-24 23:11:57.941756,0 days 00:00:00.677763,89.47448481115994,0.04419676142874505,0.009281570148211895,rbf,TPESampler,COMPLETE
335,0.2062098891777711,2025-04-24 23:11:58.097748,2025-04-24 23:11:58.763451,0 days 00:00:00.665703,38.57897153547884,0.004517663860654688,0.005430500295240197,rbf,TPESampler,COMPLETE
336,0.21811474309903733,2025-04-24 23:11:58.924209,2025-04-24 23:11:59.552096,0 days 00:00:00.627887,31.470903910698258,0.03209737672521809,0.004967569932505474,rbf,TPESampler,COMPLETE
337,0.34746216528837387,2025-04-24 23:11:59.712313,2025-04-24 23:12:00.273926,0 days 00:00:00.561613,14.47937590640448,0.016938284616741992,0.0017460384514615785,rbf,TPESampler,COMPLETE
338,0.26699921104948143,2025-04-24 23:12:00.433207,2025-04-24 23:12:00.983392,0 days 00:00:00.550185,86.84640336143738,0.04845296387655468,0.001038855516894058,rbf,TPESampler,COMPLETE
339,0.17622988058827135,2025-04-24 23:12:01.144029,2025-04-24 23:12:01.803617,0 days 00:00:00.659588,84.46388191445267,0.03659301566215205,0.007468356874980659,rbf,TPESampler,COMPLETE
340,0.2774539990670279,2025-04-24 23:12:01.958780,2025-04-24 23:12:47.853704,0 days 00:00:45.894924,76.86471764156566,0.011078127830479104,0.0031128499027529054,linear,TPESampler,COMPLETE
341,0.2720199966899342,2025-04-24 23:12:48.163248,2025-04-24 23:12:48.910939,0 days 00:00:00.747691,14.967760497837622,0.07868898951934754,0.0044608148984418925,rbf,TPESampler,COMPLETE
342,0.20563056688463074,2025-04-24 23:12:49.071103,2025-04-24 23:12:49.841772,0 days 00:00:00.770669,57.77501404857483,0.028156632673361003,0.004223590756279839,rbf,TPESampler,COMPLETE
343,0.18791014916974055,2025-04-24 23:12:50.219608,2025-04-24 23:12:51.335171,0 days 00:00:01.115563,86.92657449618518,0.024653461094094626,0.018348687016661834,rbf,TPESampler,COMPLETE
344,0.1832205577480652,2025-04-24 23:12:51.532807,2025-04-24 23:12:52.516926,0 days 00:00:00.984119,84.65706458439168,0.05922216755334111,0.023973752047488035,rbf,TPESampler,COMPLETE
345,0.1798356017480837,2025-04-24 23:12:52.696436,2025-04-24 23:12:53.779196,0 days 00:00:01.082760,96.10052582478039,0.005760558400274131,0.007082889127766994,rbf,TPESampler,COMPLETE
346,0.2112636093310537,2025-04-24 23:12:53.943514,2025-04-24 23:12:54.574222,0 days 00:00:00.630708,20.736460417607432,0.10542826024240437,0.015503573121690399,rbf,TPESampler,COMPLETE
347,0.27275740464645193,2025-04-24 23:12:54.741554,2025-04-24 23:12:55.218418,0 days 00:00:00.476864,63.24919544503626,0.23203118845850604,0.04680551012578153,rbf,TPESampler,COMPLETE
348,0.21524011070877902,2025-04-24 23:12:55.379482,2025-04-24 23:12:56.178166,0 days 00:00:00.798684,75.36063248767822,0.030345181004378382,0.0458305877309309,rbf,TPESampler,COMPLETE
349,0.19058951375635,2025-04-24 23:12:56.487395,2025-04-24 23:12:57.047375,0 days 00:00:00.559980,59.85879563728866,0.0756802166960988,0.006300432125337713,rbf,TPESampler,COMPLETE
350,0.20787917902472444,2025-04-24 23:12:57.222365,2025-04-24 23:12:57.815880,0 days 00:00:00.593515,84.85444751121202,0.07297039457689858,0.012844772461212014,rbf,TPESampler,COMPLETE
351,0.20211976650428523,2025-04-24 23:12:57.976466,2025-04-24 23:12:58.589650,0 days 00:00:00.613184,88.13072642852616,0.05222785269735522,0.008831136873013914,rbf,TPESampler,COMPLETE
352,0.8706314187287293,2025-04-24 23:12:58.747790,2025-04-24 23:12:59.277054,0 days 00:00:00.529264,0.0020773338305607385,0.017792986691577303,0.006997699750859654,sigmoid,TPESampler,COMPLETE
