number,value,datetime_start,datetime_complete,duration,params_bootstrap,params_criterion,params_max_depth,params_max_features,params_min_samples_leaf,params_min_samples_split,params_n_estimators,system_attrs_auto:sampler,state
987,0.4750856320813737,2025-04-24 23:00:12.365455,2025-04-24 23:00:17.076445,0 days 00:00:04.710990,True,absolute_error,50,log2,1,4,336,TPESampler,COMPLETE
988,0.5565855893613119,2025-04-24 23:00:17.239201,2025-04-24 23:00:47.132357,0 days 00:00:29.893156,False,absolute_error,31,,8,39,939,TPESampler,COMPLETE
989,0.49157640437383954,2025-04-24 23:00:18.795038,2025-04-24 23:00:21.408939,0 days 00:00:02.613901,True,squared_error,25,,4,2,564,TPESampler,COMPLETE
990,0.913423745541346,2025-04-24 23:00:21.580988,2025-04-24 23:00:23.184780,0 days 00:00:01.603792,True,absolute_error,34,sqrt,13,10,624,TPESampler,COMPLETE
991,0.3693269759298929,2025-04-24 23:00:23.356807,2025-04-24 23:01:00.166013,0 days 00:00:36.809206,True,absolute_error,42,,1,2,313,TPESampler,COMPLETE
992,0.41159640781137397,2025-04-24 23:00:47.306728,2025-04-24 23:01:18.590320,0 days 00:00:31.283592,True,absolute_error,34,,2,2,510,TPESampler,COMPLETE
993,0.3688565899596876,2025-04-24 23:00:47.608132,2025-04-24 23:01:09.009436,0 days 00:00:21.401304,True,absolute_error,50,,1,2,196,TPESampler,COMPLETE
994,0.4346914387613976,2025-04-24 23:01:00.340271,2025-04-24 23:02:25.575461,0 days 00:01:25.235190,True,absolute_error,19,,1,16,943,TPESampler,COMPLETE
995,0.3744840120925312,2025-04-24 23:01:09.205165,2025-04-24 23:01:46.020280,0 days 00:00:36.815115,True,absolute_error,39,,1,4,355,TPESampler,COMPLETE
996,0.3681933247803877,2025-04-24 23:01:18.760578,2025-04-24 23:01:40.026777,0 days 00:00:21.266199,True,absolute_error,50,,1,2,232,TPESampler,COMPLETE
997,0.37051856972342667,2025-04-24 23:01:40.206911,2025-04-24 23:01:55.959150,0 days 00:00:15.752239,True,absolute_error,50,,1,3,172,TPESampler,COMPLETE
998,0.3717079183826205,2025-04-24 23:01:46.192372,2025-04-24 23:02:07.968441,0 days 00:00:21.776069,True,absolute_error,43,,1,2,223,TPESampler,COMPLETE
999,0.5010277220489202,2025-04-24 23:01:56.130586,2025-04-24 23:01:59.946208,0 days 00:00:03.815622,False,squared_error,28,,3,6,631,TPESampler,COMPLETE
1000,0.976840400538373,2025-04-24 23:02:00.124394,2025-04-24 23:02:01.286033,0 days 00:00:01.161639,True,squared_error,18,log2,14,8,610,TPESampler,COMPLETE
1001,0.3727999292935145,2025-04-24 23:02:01.453207,2025-04-24 23:02:41.993057,0 days 00:00:40.539850,True,absolute_error,50,,1,4,413,TPESampler,COMPLETE
1002,0.7808795559493741,2025-04-24 23:02:08.174268,2025-04-24 23:02:09.445857,0 days 00:00:01.271589,False,squared_error,45,sqrt,7,11,777,TPESampler,COMPLETE
1003,0.41492631250136447,2025-04-24 23:02:09.814731,2025-04-24 23:02:27.977783,0 days 00:00:18.163052,True,absolute_error,50,,2,2,288,TPESampler,COMPLETE
1004,0.369916847608108,2025-04-24 23:02:25.749150,2025-04-24 23:02:55.836097,0 days 00:00:30.086947,True,absolute_error,50,,1,2,319,TPESampler,COMPLETE
1005,0.3769034014158289,2025-04-24 23:02:28.144556,2025-04-24 23:02:37.836588,0 days 00:00:09.692032,True,absolute_error,44,,1,2,102,TPESampler,COMPLETE
1006,0.3760325987620562,2025-04-24 23:02:38.110804,2025-04-24 23:02:48.074535,0 days 00:00:09.963731,True,absolute_error,47,,1,2,103,TPESampler,COMPLETE
1007,0.3716340529962571,2025-04-24 23:02:42.163656,2025-04-24 23:02:52.868785,0 days 00:00:10.705129,True,absolute_error,49,,1,2,108,TPESampler,COMPLETE
1008,0.37291232604381697,2025-04-24 23:02:48.501144,2025-04-24 23:03:20.224085,0 days 00:00:31.722941,True,absolute_error,43,,1,4,329,TPESampler,COMPLETE
1009,0.36791049720860164,2025-04-24 23:02:53.036046,2025-04-24 23:03:17.252840,0 days 00:00:24.216794,True,absolute_error,50,,1,2,249,TPESampler,COMPLETE
1010,0.8450981702040608,2025-04-24 23:02:56.024304,2025-04-24 23:02:57.494352,0 days 00:00:01.470048,True,squared_error,44,log2,2,7,627,TPESampler,COMPLETE
1011,0.37529002098899883,2025-04-24 23:02:57.665422,2025-04-24 23:03:18.945347,0 days 00:00:21.279925,True,absolute_error,44,,1,4,221,TPESampler,COMPLETE
1012,0.41211418564107777,2025-04-24 23:03:17.541938,2025-04-24 23:03:39.667301,0 days 00:00:22.125363,True,absolute_error,42,,2,2,430,TPESampler,COMPLETE
1013,0.37095808286721443,2025-04-24 23:03:19.116941,2025-04-24 23:03:29.304815,0 days 00:00:10.187874,True,absolute_error,50,,1,2,105,TPESampler,COMPLETE
1014,0.36867343098260424,2025-04-24 23:03:20.398488,2025-04-24 23:03:41.521380,0 days 00:00:21.122892,True,absolute_error,50,,1,2,225,TPESampler,COMPLETE
1015,0.38465473938056877,2025-04-24 23:03:29.480166,2025-04-24 23:03:32.067674,0 days 00:00:02.587508,True,squared_error,50,,1,2,302,TPESampler,COMPLETE
1016,0.4198280111139265,2025-04-24 23:03:32.238637,2025-04-24 23:03:38.755231,0 days 00:00:06.516594,True,absolute_error,41,,2,2,109,TPESampler,COMPLETE
1017,0.36941533855573405,2025-04-24 23:03:38.926949,2025-04-24 23:03:51.191268,0 days 00:00:12.264319,True,absolute_error,50,,1,2,128,TPESampler,COMPLETE
1018,0.3685148658866311,2025-04-24 23:03:39.837207,2025-04-24 23:04:03.528556,0 days 00:00:23.691349,True,absolute_error,50,,1,2,243,TPESampler,COMPLETE
1019,0.3700147637944328,2025-04-24 23:03:41.694439,2025-04-24 23:04:09.948825,0 days 00:00:28.254386,True,absolute_error,41,,1,2,290,TPESampler,COMPLETE
1020,0.4112374988628839,2025-04-24 23:03:51.359848,2025-04-24 23:03:54.035797,0 days 00:00:02.675949,True,absolute_error,50,sqrt,1,3,120,TPESampler,COMPLETE
1021,0.41271810696393485,2025-04-24 23:03:54.210847,2025-04-24 23:04:15.818134,0 days 00:00:21.607287,True,absolute_error,50,,2,3,410,TPESampler,COMPLETE
1022,0.4763184085790086,2025-04-24 23:04:03.702784,2025-04-24 23:04:08.954221,0 days 00:00:05.251437,True,absolute_error,44,log2,1,2,351,TPESampler,COMPLETE
1023,0.38035184124444665,2025-04-24 23:04:09.125836,2025-04-24 23:04:11.720922,0 days 00:00:02.595086,False,squared_error,50,,1,5,273,TPESampler,COMPLETE
1024,0.37022038614269415,2025-04-24 23:04:10.119654,2025-04-24 23:04:30.929501,0 days 00:00:20.809847,True,absolute_error,50,,1,3,217,TPESampler,COMPLETE
1025,0.8451357621706753,2025-04-24 23:04:11.895789,2025-04-24 23:04:14.347363,0 days 00:00:02.451574,False,absolute_error,28,log2,3,9,349,TPESampler,COMPLETE
1026,0.3759086756318177,2025-04-24 23:04:14.518427,2025-04-24 23:04:29.895880,0 days 00:00:15.377453,True,absolute_error,42,,1,4,140,TPESampler,COMPLETE
1027,0.3677500030300636,2025-04-24 23:04:15.990997,2025-04-24 23:04:44.372959,0 days 00:00:28.381962,True,absolute_error,50,,1,2,282,TPESampler,COMPLETE
1028,0.9243542447085088,2025-04-24 23:04:30.066976,2025-04-24 23:04:31.400122,0 days 00:00:01.333146,False,squared_error,7,log2,4,45,917,TPESampler,COMPLETE
1029,0.3718030737864234,2025-04-24 23:04:31.113345,2025-04-24 23:04:57.133893,0 days 00:00:26.020548,True,absolute_error,49,,1,4,284,TPESampler,COMPLETE
1030,0.3690298914359634,2025-04-24 23:04:31.569652,2025-04-24 23:04:42.857892,0 days 00:00:11.288240,True,absolute_error,50,,1,2,114,TPESampler,COMPLETE
1031,0.41493718810847263,2025-04-24 23:04:43.028479,2025-04-24 23:04:54.890070,0 days 00:00:11.861591,True,absolute_error,50,,2,4,228,TPESampler,COMPLETE
1032,0.37319579956021265,2025-04-24 23:04:44.538681,2025-04-24 23:05:07.177461,0 days 00:00:22.638780,True,absolute_error,42,,1,4,246,TPESampler,COMPLETE
1033,0.4152420586746467,2025-04-24 23:04:55.063996,2025-04-24 23:05:07.795301,0 days 00:00:12.731305,True,absolute_error,44,,2,2,236,TPESampler,COMPLETE
1034,0.43776286124716424,2025-04-24 23:04:57.303202,2025-04-24 23:04:59.393321,0 days 00:00:02.090119,True,squared_error,39,sqrt,1,7,832,TPESampler,COMPLETE
1035,0.37048718956106946,2025-04-24 23:04:59.605963,2025-04-24 23:05:10.443675,0 days 00:00:10.837712,True,absolute_error,50,,1,3,115,TPESampler,COMPLETE
1036,0.41688274884549,2025-04-24 23:05:07.371022,2025-04-24 23:05:28.022964,0 days 00:00:20.651942,True,absolute_error,50,,2,4,264,TPESampler,COMPLETE
1037,0.4162449991556746,2025-04-24 23:05:08.123082,2025-04-24 23:05:29.419647,0 days 00:00:21.296565,True,absolute_error,41,,2,2,275,TPESampler,COMPLETE
1038,0.3705208022654407,2025-04-24 23:05:10.615375,2025-04-24 23:05:49.623083,0 days 00:00:39.007708,True,absolute_error,50,,1,2,337,TPESampler,COMPLETE
1039,0.37025334369997537,2025-04-24 23:05:28.195075,2025-04-24 23:06:05.768842,0 days 00:00:37.573767,True,absolute_error,42,,1,2,401,TPESampler,COMPLETE
1040,0.3705771130254511,2025-04-24 23:05:29.809470,2025-04-24 23:05:41.099660,0 days 00:00:11.290190,True,absolute_error,50,,1,2,109,TPESampler,COMPLETE
1041,0.4135226532101884,2025-04-24 23:05:41.278038,2025-04-24 23:05:52.548802,0 days 00:00:11.270764,True,absolute_error,50,,2,2,214,TPESampler,COMPLETE
1042,0.47993495081457116,2025-04-24 23:05:49.806277,2025-04-24 23:06:11.376419,0 days 00:00:21.570142,False,absolute_error,40,,2,4,228,TPESampler,COMPLETE
1043,0.36924414041687337,2025-04-24 23:05:52.735037,2025-04-24 23:06:13.779061,0 days 00:00:21.044024,True,absolute_error,42,,1,2,229,TPESampler,COMPLETE
1044,0.4180898874550789,2025-04-24 23:06:05.946137,2025-04-24 23:06:12.208370,0 days 00:00:06.262233,True,absolute_error,42,,2,5,113,TPESampler,COMPLETE
1045,0.3695706101162727,2025-04-24 23:06:11.549443,2025-04-24 23:07:11.595464,0 days 00:01:00.046021,True,absolute_error,50,,1,2,334,TPESampler,COMPLETE
1046,0.37439734242338146,2025-04-24 23:06:12.375054,2025-04-24 23:07:06.986707,0 days 00:00:54.611653,True,absolute_error,44,,1,4,279,TPESampler,COMPLETE
1047,0.3712319069452527,2025-04-24 23:06:13.956549,2025-04-24 23:07:06.473020,0 days 00:00:52.516471,True,absolute_error,43,,1,2,259,TPESampler,COMPLETE
1048,0.41641458004025766,2025-04-24 23:07:06.648300,2025-04-24 23:07:13.403271,0 days 00:00:06.754971,True,absolute_error,49,,2,2,116,TPESampler,COMPLETE
1049,0.6558537263550276,2025-04-24 23:07:07.185592,2025-04-24 23:07:08.601446,0 days 00:00:01.415854,False,squared_error,29,sqrt,4,7,689,TPESampler,COMPLETE
1050,0.37748978683800044,2025-04-24 23:07:08.774034,2025-04-24 23:07:20.026195,0 days 00:00:11.252161,True,absolute_error,44,,1,4,115,TPESampler,COMPLETE
1051,0.8245645561422676,2025-04-24 23:07:11.855315,2025-04-24 23:07:12.881958,0 days 00:00:01.026643,False,squared_error,15,log2,2,32,594,TPESampler,COMPLETE
1052,0.3683036712253051,2025-04-24 23:07:13.055144,2025-04-24 23:07:31.503638,0 days 00:00:18.448494,True,absolute_error,50,,1,2,200,TPESampler,COMPLETE
1053,0.38414422175664115,2025-04-24 23:07:13.640607,2025-04-24 23:07:42.141423,0 days 00:00:28.500816,True,absolute_error,27,,1,2,314,TPESampler,COMPLETE
1054,0.44127284806840344,2025-04-24 23:07:20.244684,2025-04-24 23:07:49.239931,0 days 00:00:28.995247,False,absolute_error,50,,1,2,186,TPESampler,COMPLETE
1055,0.8444602991338366,2025-04-24 23:07:31.678760,2025-04-24 23:07:35.498007,0 days 00:00:03.819247,False,absolute_error,5,sqrt,8,13,773,TPESampler,COMPLETE
1056,0.37097001528391327,2025-04-24 23:07:35.669791,2025-04-24 23:07:51.612151,0 days 00:00:15.942360,True,absolute_error,43,,1,2,167,TPESampler,COMPLETE
1057,0.45606500000464045,2025-04-24 23:07:42.312055,2025-04-24 23:07:44.986877,0 days 00:00:02.674822,True,absolute_error,50,log2,1,3,162,TPESampler,COMPLETE
1058,0.3722908325892385,2025-04-24 23:07:45.287761,2025-04-24 23:08:26.130571,0 days 00:00:40.842810,True,absolute_error,49,,1,4,412,TPESampler,COMPLETE
1059,0.36820802444579886,2025-04-24 23:07:49.595069,2025-04-24 23:08:20.419263,0 days 00:00:30.824194,True,absolute_error,50,,1,2,303,TPESampler,COMPLETE
1060,0.8095148653739705,2025-04-24 23:07:51.789241,2025-04-24 23:08:01.630163,0 days 00:00:09.840922,False,absolute_error,16,log2,2,17,922,TPESampler,COMPLETE
1061,0.36903866334108765,2025-04-24 23:08:01.798690,2025-04-24 23:08:13.127312,0 days 00:00:11.328622,True,absolute_error,50,,1,2,120,TPESampler,COMPLETE
1062,0.4588494937286759,2025-04-24 23:08:13.313383,2025-04-24 23:08:35.698014,0 days 00:00:22.384631,False,absolute_error,50,log2,1,5,937,TPESampler,COMPLETE
1063,0.8978291224260043,2025-04-24 23:08:20.594040,2025-04-24 23:08:23.090627,0 days 00:00:02.496587,True,absolute_error,25,log2,3,15,755,TPESampler,COMPLETE
1064,0.3693095199903066,2025-04-24 23:08:23.261481,2025-04-24 23:08:48.189469,0 days 00:00:24.927988,True,absolute_error,42,,1,2,270,TPESampler,COMPLETE
1065,0.37549766257446004,2025-04-24 23:08:26.300451,2025-04-24 23:08:42.935863,0 days 00:00:16.635412,True,absolute_error,50,,1,4,181,TPESampler,COMPLETE
1066,0.3709310976349603,2025-04-24 23:08:35.869874,2025-04-24 23:09:01.153553,0 days 00:00:25.283679,True,absolute_error,43,,1,2,278,TPESampler,COMPLETE
1067,0.368672381878569,2025-04-24 23:08:43.105246,2025-04-24 23:09:07.205148,0 days 00:00:24.099902,True,absolute_error,50,,1,2,262,TPESampler,COMPLETE
1068,0.3698236236567288,2025-04-24 23:08:48.361604,2025-04-24 23:09:07.573328,0 days 00:00:19.211724,True,absolute_error,50,,1,3,210,TPESampler,COMPLETE
1069,0.3714952381110082,2025-04-24 23:09:01.317761,2025-04-24 23:09:51.671309,0 days 00:00:50.353548,True,absolute_error,50,,1,2,371,TPESampler,COMPLETE
1070,0.36842915010517735,2025-04-24 23:09:07.374710,2025-04-24 23:09:48.885448,0 days 00:00:41.510738,True,absolute_error,50,,1,2,272,TPESampler,COMPLETE
1071,0.49650581718533715,2025-04-24 23:09:07.789858,2025-04-24 23:09:56.209350,0 days 00:00:48.419492,True,absolute_error,27,,2,43,685,TPESampler,COMPLETE
1072,0.5629417333781379,2025-04-24 23:09:49.058450,2025-04-24 23:09:51.125004,0 days 00:00:02.066554,True,squared_error,20,sqrt,1,16,976,TPESampler,COMPLETE
1073,0.9188707014673346,2025-04-24 23:09:51.292048,2025-04-24 23:09:53.091287,0 days 00:00:01.799239,True,squared_error,32,sqrt,11,3,651,TPESampler,COMPLETE
1074,0.946157308641971,2025-04-24 23:09:52.010945,2025-04-24 23:09:54.075840,0 days 00:00:02.064895,True,absolute_error,24,log2,12,8,864,TPESampler,COMPLETE
1075,0.37394932933088604,2025-04-24 23:09:53.283988,2025-04-24 23:10:04.264319,0 days 00:00:10.980331,True,absolute_error,43,,1,2,112,TPESampler,COMPLETE
1076,0.9580099474350589,2025-04-24 23:09:54.254311,2025-04-24 23:09:55.249465,0 days 00:00:00.995154,False,squared_error,37,log2,8,33,644,TPESampler,COMPLETE
1077,0.41550631562313234,2025-04-24 23:09:55.427113,2025-04-24 23:10:08.758883,0 days 00:00:13.331770,True,absolute_error,50,,2,2,253,TPESampler,COMPLETE
1078,0.37057933222898487,2025-04-24 23:09:56.382680,2025-04-24 23:10:51.094278,0 days 00:00:54.711598,True,absolute_error,50,,1,2,506,TPESampler,COMPLETE
1079,0.41475600359446585,2025-04-24 23:10:04.519189,2025-04-24 23:10:12.552249,0 days 00:00:08.033060,True,absolute_error,41,,2,2,147,TPESampler,COMPLETE
1080,0.40973689170827465,2025-04-24 23:10:08.924435,2025-04-24 23:10:12.453800,0 days 00:00:03.529365,True,absolute_error,42,sqrt,1,2,167,TPESampler,COMPLETE
1081,0.45626968341902413,2025-04-24 23:10:12.611437,2025-04-24 23:10:34.810418,0 days 00:00:22.198981,False,absolute_error,29,sqrt,1,6,517,TPESampler,COMPLETE
1082,0.37160181043873153,2025-04-24 23:10:12.738878,2025-04-24 23:10:34.526935,0 days 00:00:21.788057,True,absolute_error,41,,1,2,234,TPESampler,COMPLETE
1083,0.4130686871282846,2025-04-24 23:10:34.694555,2025-04-24 23:10:43.838808,0 days 00:00:09.144253,True,absolute_error,50,,2,3,166,TPESampler,COMPLETE
1084,0.8935655243849896,2025-04-24 23:10:35.002787,2025-04-24 23:10:36.059834,0 days 00:00:01.057047,True,squared_error,40,sqrt,8,49,264,TPESampler,COMPLETE
1085,0.5806734210520157,2025-04-24 23:10:36.238782,2025-04-24 23:10:37.114039,0 days 00:00:00.875257,True,squared_error,18,sqrt,1,9,220,TPESampler,COMPLETE
1086,0.4152498852187353,2025-04-24 23:10:37.286275,2025-04-24 23:10:48.230715,0 days 00:00:10.944440,True,absolute_error,50,,2,2,181,TPESampler,COMPLETE
1087,0.920813894059962,2025-04-24 23:10:44.011593,2025-04-24 23:10:45.022611,0 days 00:00:01.011018,True,squared_error,7,log2,3,40,436,TPESampler,COMPLETE
1088,0.3694831204422972,2025-04-24 23:10:45.195339,2025-04-24 23:11:18.378186,0 days 00:00:33.182847,True,absolute_error,50,,1,2,331,TPESampler,COMPLETE
1089,0.371620902955928,2025-04-24 23:10:48.406442,2025-04-24 23:11:14.367582,0 days 00:00:25.961140,True,absolute_error,42,,1,3,259,TPESampler,COMPLETE
1090,0.37385629122112,2025-04-24 23:10:51.272538,2025-04-24 23:11:17.001715,0 days 00:00:25.729177,True,absolute_error,49,,1,4,263,TPESampler,COMPLETE
1091,0.36901461280871867,2025-04-24 23:11:14.534913,2025-04-24 23:11:35.019732,0 days 00:00:20.484819,True,absolute_error,50,,1,2,223,TPESampler,COMPLETE
1092,0.3704334757279545,2025-04-24 23:11:17.179685,2025-04-24 23:11:29.794475,0 days 00:00:12.614790,True,absolute_error,50,,1,3,133,TPESampler,COMPLETE
1093,0.38534820896362215,2025-04-24 23:11:18.555856,2025-04-24 23:11:20.933487,0 days 00:00:02.377631,True,squared_error,43,,1,2,287,TPESampler,COMPLETE
1094,0.37269121071064654,2025-04-24 23:11:21.099625,2025-04-24 23:11:34.498821,0 days 00:00:13.399196,True,absolute_error,44,,1,2,143,TPESampler,COMPLETE
1095,0.549848143070022,2025-04-24 23:11:29.973294,2025-04-24 23:11:31.941388,0 days 00:00:01.968094,False,squared_error,14,,1,50,380,TPESampler,COMPLETE
1096,0.36884422439504194,2025-04-24 23:11:32.114545,2025-04-24 23:11:52.827844,0 days 00:00:20.713299,True,absolute_error,50,,1,2,224,TPESampler,COMPLETE
1097,0.36868963385822673,2025-04-24 23:11:34.672375,2025-04-24 23:11:51.248312,0 days 00:00:16.575937,True,absolute_error,50,,1,2,178,TPESampler,COMPLETE
1098,0.5197166600656885,2025-04-24 23:11:35.229601,2025-04-24 23:11:44.411369,0 days 00:00:09.181768,False,absolute_error,45,,7,4,253,TPESampler,COMPLETE
1099,0.3755994744084584,2025-04-24 23:11:44.588037,2025-04-24 23:11:56.851217,0 days 00:00:12.263180,True,absolute_error,49,,1,4,132,TPESampler,COMPLETE
1100,0.5648366597231651,2025-04-24 23:11:51.413828,2025-04-24 23:13:13.007590,0 days 00:01:21.593762,False,absolute_error,9,,1,27,665,TPESampler,COMPLETE
1101,0.44166132626540827,2025-04-24 23:11:53.007648,2025-04-24 23:12:19.830830,0 days 00:00:26.823182,False,absolute_error,40,,1,2,173,TPESampler,COMPLETE
1102,0.37317250310654354,2025-04-24 23:11:57.028013,2025-04-24 23:12:07.063479,0 days 00:00:10.035466,True,absolute_error,42,,1,2,107,TPESampler,COMPLETE
1103,0.37109463530721487,2025-04-24 23:12:07.233641,2025-04-24 23:12:31.749014,0 days 00:00:24.515373,True,absolute_error,43,,1,2,269,TPESampler,COMPLETE
1104,0.3701054849258154,2025-04-24 23:12:20.012797,2025-04-24 23:12:55.023361,0 days 00:00:35.010564,True,absolute_error,50,,1,2,343,TPESampler,COMPLETE
1105,0.3666639331482587,2025-04-24 23:12:31.923209,2025-04-24 23:12:46.302322,0 days 00:00:14.379113,True,absolute_error,50,,1,2,153,TPESampler,COMPLETE
1106,0.37029315435854915,2025-04-24 23:12:46.744815,2025-04-24 23:13:06.638688,0 days 00:00:19.893873,True,absolute_error,42,,1,2,195,TPESampler,COMPLETE
1107,0.925316820872409,2025-04-24 23:12:55.190387,2025-04-24 23:12:56.286669,0 days 00:00:01.096282,True,absolute_error,5,sqrt,15,8,337,TPESampler,COMPLETE
1108,0.3738512854372519,2025-04-24 23:12:56.467716,2025-04-24 23:13:06.849217,0 days 00:00:10.381501,True,absolute_error,48,,1,2,110,TPESampler,COMPLETE
1109,0.4148221079993417,2025-04-24 23:13:06.811181,2025-04-24 23:13:14.370400,0 days 00:00:07.559219,True,absolute_error,49,,2,3,139,TPESampler,COMPLETE
1110,0.4140135229815235,2025-04-24 23:13:07.060985,2025-04-24 23:13:24.446630,0 days 00:00:17.385645,True,absolute_error,44,,2,2,331,TPESampler,COMPLETE
1111,0.3688516163615531,2025-04-24 23:13:13.191173,2025-04-24 23:13:26.477578,0 days 00:00:13.286405,True,absolute_error,50,,1,2,139,TPESampler,COMPLETE
1112,0.878178813683293,2025-04-24 23:13:14.542108,2025-04-24 23:13:16.483271,0 days 00:00:01.941163,False,absolute_error,30,sqrt,14,10,455,TPESampler,COMPLETE
1113,0.3706209857812267,2025-04-24 23:13:16.660593,2025-04-24 23:13:27.465081,0 days 00:00:10.804488,True,absolute_error,50,,1,3,113,TPESampler,COMPLETE
1114,0.36836709451590105,2025-04-24 23:13:24.618301,2025-04-24 23:13:43.220205,0 days 00:00:18.601904,True,absolute_error,50,,1,2,182,TPESampler,COMPLETE
1115,0.8140220160844488,2025-04-24 23:13:26.654245,2025-04-24 23:13:32.507409,0 days 00:00:05.853164,True,absolute_error,6,sqrt,3,34,969,TPESampler,COMPLETE
1116,0.3664347215064991,2025-04-24 23:13:27.642498,2025-04-24 23:13:44.013606,0 days 00:00:16.371108,True,absolute_error,50,,1,2,156,TPESampler,COMPLETE
1117,0.37432259310726534,2025-04-24 23:13:32.681265,2025-04-24 23:13:51.304487,0 days 00:00:18.623222,True,absolute_error,50,,1,4,205,TPESampler,COMPLETE
1118,0.6161243427733679,2025-04-24 23:13:43.399822,2025-04-24 23:13:46.456109,0 days 00:00:03.056287,False,absolute_error,19,sqrt,3,22,193,TPESampler,COMPLETE
1119,0.3724967914568023,2025-04-24 23:13:44.182266,2025-04-24 23:13:53.749139,0 days 00:00:09.566873,True,absolute_error,49,,1,2,102,TPESampler,COMPLETE
1120,0.3692031859785476,2025-04-24 23:13:46.623021,2025-04-24 23:13:58.311545,0 days 00:00:11.688524,True,absolute_error,50,,1,2,122,TPESampler,COMPLETE
1121,0.4154387609903572,2025-04-24 23:13:51.484606,2025-04-24 23:13:58.881395,0 days 00:00:07.396789,True,absolute_error,50,,2,2,137,TPESampler,COMPLETE
1122,0.4796109501314999,2025-04-24 23:13:53.917229,2025-04-24 23:14:23.791996,0 days 00:00:29.874767,False,absolute_error,44,,2,2,320,TPESampler,COMPLETE
1123,0.7150457914098636,2025-04-24 23:13:58.482480,2025-04-24 23:14:02.347990,0 days 00:00:03.865510,False,absolute_error,48,sqrt,5,8,436,TPESampler,COMPLETE
1124,0.41407235304225204,2025-04-24 23:13:59.182292,2025-04-24 23:14:10.440182,0 days 00:00:11.257890,True,absolute_error,41,,2,4,211,TPESampler,COMPLETE
1125,0.41758690746543664,2025-04-24 23:14:02.520044,2025-04-24 23:14:08.744168,0 days 00:00:06.224124,True,absolute_error,44,,2,2,114,TPESampler,COMPLETE
1126,0.48086476497014863,2025-04-24 23:14:08.918940,2025-04-24 23:14:28.846908,0 days 00:00:19.927968,True,absolute_error,14,,3,4,500,TPESampler,COMPLETE
1127,0.661022919230806,2025-04-24 23:14:10.608097,2025-04-24 23:14:20.907350,0 days 00:00:10.299253,False,absolute_error,46,sqrt,4,7,894,TPESampler,COMPLETE
