number,value,datetime_start,datetime_complete,duration,params_bootstrap,params_criterion,params_max_depth,params_max_features,params_min_samples_leaf,params_min_samples_split,params_n_estimators,system_attrs_auto:sampler,state
1550,0.42071730038474336,2025-04-24 23:48:28.454968,2025-04-24 23:48:30.691321,0 days 00:00:02.236353,True,squared_error,50,,2,2,368,TPESampler,COMPLETE
1551,0.3701233282969755,2025-04-24 23:48:30.881320,2025-04-24 23:48:56.858709,0 days 00:00:25.977389,True,absolute_error,41,,1,2,285,TPESampler,COMPLETE
1552,0.41848307162213344,2025-04-24 23:48:31.766724,2025-04-24 23:48:37.831780,0 days 00:00:06.065056,True,absolute_error,40,,2,2,110,TPESampler,COMPLETE
1553,0.5000503003847673,2025-04-24 23:48:38.020172,2025-04-24 23:49:23.497376,0 days 00:00:45.477204,False,absolute_error,16,,2,2,500,TPESampler,COMPLETE
1554,0.3711471596726601,2025-04-24 23:48:53.753062,2025-04-24 23:49:03.691204,0 days 00:00:09.938142,True,absolute_error,50,,1,2,104,TPESampler,COMPLETE
1555,0.36959915105391766,2025-04-24 23:48:57.052094,2025-04-24 23:49:07.518378,0 days 00:00:10.466284,True,absolute_error,50,,1,2,110,TPESampler,COMPLETE
1556,0.3679933307734841,2025-04-24 23:49:03.887616,2025-04-24 23:49:36.082206,0 days 00:00:32.194590,True,absolute_error,50,,1,2,297,TPESampler,COMPLETE
1557,0.3700734496696529,2025-04-24 23:49:07.708231,2025-04-24 23:49:35.970352,0 days 00:00:28.262121,True,absolute_error,50,,1,3,260,TPESampler,COMPLETE
1558,0.8623403169768198,2025-04-24 23:49:23.694264,2025-04-24 23:49:28.633897,0 days 00:00:04.939633,True,absolute_error,7,log2,1,42,826,TPESampler,COMPLETE
1559,0.37698512552631475,2025-04-24 23:49:28.825527,2025-04-24 23:49:38.704985,0 days 00:00:09.879458,True,absolute_error,44,,1,2,103,TPESampler,COMPLETE
1560,0.3741618446428418,2025-04-24 23:49:36.140781,2025-04-24 23:49:57.641776,0 days 00:00:21.500995,True,absolute_error,50,,1,4,233,TPESampler,COMPLETE
1561,0.44202368821366683,2025-04-24 23:49:36.274917,2025-04-24 23:49:54.508429,0 days 00:00:18.233512,False,absolute_error,26,sqrt,1,2,632,TPESampler,COMPLETE
1562,0.9423498686950021,2025-04-24 23:49:38.891935,2025-04-24 23:49:40.241093,0 days 00:00:01.349158,True,absolute_error,14,log2,10,6,506,TPESampler,COMPLETE
1563,0.38146518299924964,2025-04-24 23:49:40.433154,2025-04-24 23:49:55.489248,0 days 00:00:15.056094,True,absolute_error,49,,1,9,164,TPESampler,COMPLETE
1564,0.41631175823410715,2025-04-24 23:49:54.697239,2025-04-24 23:50:24.236909,0 days 00:00:29.539670,True,absolute_error,36,,2,6,528,TPESampler,COMPLETE
1565,0.3718615437030291,2025-04-24 23:49:55.687454,2025-04-24 23:50:22.266571,0 days 00:00:26.579117,True,absolute_error,44,,1,2,257,TPESampler,COMPLETE
1566,0.3743576380712829,2025-04-24 23:49:57.827159,2025-04-24 23:50:11.280916,0 days 00:00:13.453757,True,absolute_error,50,,1,4,143,TPESampler,COMPLETE
1567,0.413713268908975,2025-04-24 23:50:11.506436,2025-04-24 23:50:20.495808,0 days 00:00:08.989372,True,absolute_error,50,,2,2,158,TPESampler,COMPLETE
1568,0.3710740293978717,2025-04-24 23:50:20.853370,2025-04-24 23:50:40.876465,0 days 00:00:20.023095,True,absolute_error,43,,1,2,215,TPESampler,COMPLETE
1569,0.41562636038106604,2025-04-24 23:50:22.456962,2025-04-24 23:50:35.333054,0 days 00:00:12.876092,True,absolute_error,42,,2,2,240,TPESampler,COMPLETE
1570,0.3723040202360185,2025-04-24 23:50:24.429989,2025-04-24 23:50:56.890677,0 days 00:00:32.460688,True,absolute_error,43,,1,2,357,TPESampler,COMPLETE
1571,0.36812491576164313,2025-04-24 23:50:35.525296,2025-04-24 23:50:56.491550,0 days 00:00:20.966254,True,absolute_error,50,,1,2,227,TPESampler,COMPLETE
1572,0.38344097160726626,2025-04-24 23:50:41.075768,2025-04-24 23:50:43.402502,0 days 00:00:02.326734,True,squared_error,49,,1,2,268,TPESampler,COMPLETE
1573,0.37165227925697736,2025-04-24 23:50:43.590672,2025-04-24 23:51:04.874933,0 days 00:00:21.284261,True,absolute_error,43,,1,3,232,TPESampler,COMPLETE
1574,0.41640939332372284,2025-04-24 23:50:56.687244,2025-04-24 23:51:03.488475,0 days 00:00:06.801231,True,absolute_error,50,,2,4,122,TPESampler,COMPLETE
1575,0.41443136497753447,2025-04-24 23:50:57.103231,2025-04-24 23:51:12.721543,0 days 00:00:15.618312,True,absolute_error,50,,2,4,297,TPESampler,COMPLETE
1576,0.37216442865530186,2025-04-24 23:51:03.688760,2025-04-24 23:51:34.820483,0 days 00:00:31.131723,True,absolute_error,43,,1,2,343,TPESampler,COMPLETE
1577,0.3725341380886624,2025-04-24 23:51:05.062494,2025-04-24 23:51:15.444262,0 days 00:00:10.381768,True,absolute_error,41,,1,2,110,TPESampler,COMPLETE
1578,0.3682979729590838,2025-04-24 23:51:12.911145,2025-04-24 23:51:31.248361,0 days 00:00:18.337216,True,absolute_error,50,,1,2,197,TPESampler,COMPLETE
1579,0.4470422634377363,2025-04-24 23:51:15.633268,2025-04-24 23:51:27.230092,0 days 00:00:11.596824,False,absolute_error,42,log2,1,2,479,TPESampler,COMPLETE
1580,0.36973179703422737,2025-04-24 23:51:27.445092,2025-04-24 23:51:57.029120,0 days 00:00:29.584028,True,absolute_error,50,,1,2,314,TPESampler,COMPLETE
1581,0.3707942011067702,2025-04-24 23:51:31.450610,2025-04-24 23:51:41.706967,0 days 00:00:10.256357,True,absolute_error,50,,1,2,107,TPESampler,COMPLETE
1582,0.3696202126748104,2025-04-24 23:51:35.011834,2025-04-24 23:52:02.125877,0 days 00:00:27.114043,True,absolute_error,50,,1,3,246,TPESampler,COMPLETE
1583,0.3736909346386258,2025-04-24 23:51:41.904619,2025-04-24 23:51:57.988262,0 days 00:00:16.083643,True,absolute_error,43,,1,4,144,TPESampler,COMPLETE
1584,0.37630209329029995,2025-04-24 23:51:57.232607,2025-04-24 23:52:07.137487,0 days 00:00:09.904880,True,absolute_error,42,,1,3,104,TPESampler,COMPLETE
1585,0.5096135389602489,2025-04-24 23:51:58.176712,2025-04-24 23:54:01.224398,0 days 00:02:03.047686,False,absolute_error,18,,1,2,860,TPESampler,COMPLETE
1586,0.3713843650765807,2025-04-24 23:52:02.344146,2025-04-24 23:52:30.403489,0 days 00:00:28.059343,True,absolute_error,43,,1,2,263,TPESampler,COMPLETE
1587,0.3681664631034293,2025-04-24 23:52:07.348992,2025-04-24 23:52:32.597578,0 days 00:00:25.248586,True,absolute_error,50,,1,2,231,TPESampler,COMPLETE
1588,0.42069606508063623,2025-04-24 23:52:30.617570,2025-04-24 23:52:37.686016,0 days 00:00:07.068446,True,absolute_error,48,,2,2,104,TPESampler,COMPLETE
1589,0.8294370250470722,2025-04-24 23:52:32.789199,2025-04-24 23:52:34.031876,0 days 00:00:01.242677,True,absolute_error,50,log2,2,2,145,TPESampler,COMPLETE
1590,0.41631345781506035,2025-04-24 23:52:34.248210,2025-04-24 23:52:52.232132,0 days 00:00:17.983922,True,absolute_error,50,,2,2,244,TPESampler,COMPLETE
1591,0.36933541099691775,2025-04-24 23:52:37.946409,2025-04-24 23:53:15.467666,0 days 00:00:37.521257,True,absolute_error,43,,1,2,287,TPESampler,COMPLETE
1592,0.3712991305921461,2025-04-24 23:52:52.454742,2025-04-24 23:53:21.358457,0 days 00:00:28.903715,True,absolute_error,43,,1,2,240,TPESampler,COMPLETE
1593,0.3684939322521658,2025-04-24 23:53:15.665473,2025-04-24 23:53:58.016698,0 days 00:00:42.351225,True,absolute_error,50,,1,2,302,TPESampler,COMPLETE
1594,0.3701896757601185,2025-04-24 23:53:21.550839,2025-04-24 23:53:59.188261,0 days 00:00:37.637422,True,absolute_error,43,,1,2,249,TPESampler,COMPLETE
1595,0.393860040274322,2025-04-24 23:53:58.223927,2025-04-24 23:54:10.190288,0 days 00:00:11.966361,True,absolute_error,47,sqrt,1,2,574,TPESampler,COMPLETE
1596,0.4379328993950002,2025-04-24 23:53:59.402363,2025-04-24 23:54:41.023929,0 days 00:00:41.621566,False,absolute_error,44,,1,2,269,TPESampler,COMPLETE
1597,0.3683178669624408,2025-04-24 23:54:01.442032,2025-04-24 23:54:27.997707,0 days 00:00:26.555675,True,absolute_error,50,,1,2,277,TPESampler,COMPLETE
1598,0.3749657913575097,2025-04-24 23:54:10.377838,2025-04-24 23:54:22.460230,0 days 00:00:12.082392,True,absolute_error,43,,1,2,126,TPESampler,COMPLETE
1599,0.36907810872834423,2025-04-24 23:54:22.645803,2025-04-24 23:54:45.877830,0 days 00:00:23.232027,True,absolute_error,50,,1,3,251,TPESampler,COMPLETE
1600,0.3682489249740574,2025-04-24 23:54:28.183600,2025-04-24 23:54:40.746056,0 days 00:00:12.562456,True,absolute_error,50,,1,2,133,TPESampler,COMPLETE
1601,0.38439235584587683,2025-04-24 23:54:40.978835,2025-04-24 23:54:42.339058,0 days 00:00:01.360223,True,squared_error,48,,1,3,106,TPESampler,COMPLETE
1602,0.41645214581715395,2025-04-24 23:54:41.285875,2025-04-24 23:54:54.281604,0 days 00:00:12.995729,True,absolute_error,44,,2,2,242,TPESampler,COMPLETE
1603,0.8728357043338443,2025-04-24 23:54:42.534298,2025-04-24 23:54:43.783566,0 days 00:00:01.249268,False,squared_error,22,sqrt,12,43,808,TPESampler,COMPLETE
1604,0.3758901659824864,2025-04-24 23:54:43.986614,2025-04-24 23:54:56.582557,0 days 00:00:12.595943,True,absolute_error,50,,1,4,133,TPESampler,COMPLETE
1605,0.3735509776246595,2025-04-24 23:54:46.066032,2025-04-24 23:54:55.672075,0 days 00:00:09.606043,True,absolute_error,41,,1,2,100,TPESampler,COMPLETE
1606,0.4294872958684929,2025-04-24 23:54:54.467884,2025-04-24 23:54:57.969330,0 days 00:00:03.501446,True,absolute_error,36,sqrt,1,2,143,TPESampler,COMPLETE
1607,0.3933431313564269,2025-04-24 23:54:55.858711,2025-04-24 23:55:03.135942,0 days 00:00:07.277231,True,absolute_error,49,sqrt,1,2,350,TPESampler,COMPLETE
1608,0.4947738619384657,2025-04-24 23:54:56.781661,2025-04-24 23:55:20.233122,0 days 00:00:23.451461,True,absolute_error,21,,5,6,959,TPESampler,COMPLETE
1609,0.4198270544550623,2025-04-24 23:54:58.159207,2025-04-24 23:55:04.520034,0 days 00:00:06.360827,True,absolute_error,50,,2,2,109,TPESampler,COMPLETE
1610,0.3711471596726601,2025-04-24 23:55:03.321499,2025-04-24 23:55:14.195411,0 days 00:00:10.873912,True,absolute_error,50,,1,2,104,TPESampler,COMPLETE
1611,0.41399113821532363,2025-04-24 23:55:04.705841,2025-04-24 23:55:16.789362,0 days 00:00:12.083521,True,absolute_error,50,,2,2,209,TPESampler,COMPLETE
1612,0.3702060192881115,2025-04-24 23:55:14.426849,2025-04-24 23:55:56.458797,0 days 00:00:42.031948,True,absolute_error,43,,1,3,465,TPESampler,COMPLETE
1613,0.37566771349770806,2025-04-24 23:55:16.972311,2025-04-24 23:55:27.728763,0 days 00:00:10.756452,True,absolute_error,49,,1,4,113,TPESampler,COMPLETE
1614,0.36734509800710313,2025-04-24 23:55:20.430558,2025-04-24 23:55:46.607943,0 days 00:00:26.177385,True,absolute_error,50,,1,2,283,TPESampler,COMPLETE
1615,0.36861000388284376,2025-04-24 23:55:27.917671,2025-04-24 23:55:50.000171,0 days 00:00:22.082500,True,absolute_error,50,,1,2,242,TPESampler,COMPLETE
1616,0.3741290058008231,2025-04-24 23:55:46.813287,2025-04-24 23:56:28.095893,0 days 00:00:41.282606,True,absolute_error,50,,1,4,398,TPESampler,COMPLETE
1617,0.497142959425629,2025-04-24 23:55:50.204633,2025-04-24 23:55:51.119794,0 days 00:00:00.915161,True,squared_error,33,sqrt,1,16,168,TPESampler,COMPLETE
1618,0.4420330747773693,2025-04-24 23:55:51.316095,2025-04-24 23:56:08.816330,0 days 00:00:17.500235,False,absolute_error,50,,1,2,111,TPESampler,COMPLETE
1619,0.40593063166632043,2025-04-24 23:55:56.660314,2025-04-24 23:55:59.266003,0 days 00:00:02.605689,True,absolute_error,50,sqrt,1,2,105,TPESampler,COMPLETE
1620,0.37018899578193376,2025-04-24 23:55:59.474765,2025-04-24 23:56:47.754931,0 days 00:00:48.280166,True,absolute_error,49,,1,3,431,TPESampler,COMPLETE
1621,0.37039051097754233,2025-04-24 23:56:09.019458,2025-04-24 23:57:01.525272,0 days 00:00:52.505814,True,absolute_error,43,,1,3,430,TPESampler,COMPLETE
1622,0.371315512206387,2025-04-24 23:56:28.300554,2025-04-24 23:57:32.941406,0 days 00:01:04.640852,True,absolute_error,48,,1,2,490,TPESampler,COMPLETE
1623,0.37482428731376227,2025-04-24 23:56:47.944490,2025-04-24 23:57:37.376203,0 days 00:00:49.431713,True,absolute_error,50,,1,4,384,TPESampler,COMPLETE
1624,0.9677863683493789,2025-04-24 23:57:01.720301,2025-04-24 23:57:02.457509,0 days 00:00:00.737208,False,squared_error,16,log2,11,2,159,TPESampler,COMPLETE
1625,0.41261514992793424,2025-04-24 23:57:02.648981,2025-04-24 23:57:38.068507,0 days 00:00:35.419526,True,absolute_error,43,,2,3,464,TPESampler,COMPLETE
1626,0.3727857458789064,2025-04-24 23:57:33.136153,2025-04-24 23:58:02.302363,0 days 00:00:29.166210,True,absolute_error,50,,1,4,309,TPESampler,COMPLETE
1627,0.9487658554287748,2025-04-24 23:57:37.576724,2025-04-24 23:57:38.744823,0 days 00:00:01.168099,True,absolute_error,31,log2,11,24,269,TPESampler,COMPLETE
1628,0.3694410246753596,2025-04-24 23:57:38.338741,2025-04-24 23:58:21.509160,0 days 00:00:43.170419,True,absolute_error,42,,1,2,434,TPESampler,COMPLETE
1629,0.4127675268372043,2025-04-24 23:57:39.022030,2025-04-24 23:58:04.127864,0 days 00:00:25.105834,True,absolute_error,50,,2,2,434,TPESampler,COMPLETE
1630,0.3711397463058182,2025-04-24 23:58:02.507661,2025-04-24 23:58:39.931133,0 days 00:00:37.423472,True,absolute_error,49,,1,2,393,TPESampler,COMPLETE
1631,0.37015895558719397,2025-04-24 23:58:04.340479,2025-04-24 23:58:38.074029,0 days 00:00:33.733550,True,absolute_error,50,,1,2,349,TPESampler,COMPLETE
1632,0.37072728979145275,2025-04-24 23:58:21.703864,2025-04-24 23:58:58.551835,0 days 00:00:36.847971,True,absolute_error,50,,1,2,387,TPESampler,COMPLETE
1633,0.4165101718231826,2025-04-24 23:58:38.270375,2025-04-24 23:58:54.610056,0 days 00:00:16.339681,True,absolute_error,42,,2,2,272,TPESampler,COMPLETE
1634,0.6085101950708534,2025-04-24 23:58:40.121863,2025-04-24 23:58:48.042467,0 days 00:00:07.920604,True,absolute_error,21,sqrt,2,3,633,TPESampler,COMPLETE
1635,0.367926001450527,2025-04-24 23:58:48.231078,2025-04-24 23:59:16.438586,0 days 00:00:28.207508,True,absolute_error,50,,1,2,300,TPESampler,COMPLETE
1636,0.369925551625986,2025-04-24 23:58:54.808535,2025-04-24 23:59:15.904078,0 days 00:00:21.095543,True,absolute_error,50,,1,3,228,TPESampler,COMPLETE
1637,0.8816700486101718,2025-04-24 23:58:58.740413,2025-04-24 23:58:59.865354,0 days 00:00:01.124941,False,absolute_error,9,sqrt,14,27,213,TPESampler,COMPLETE
1638,0.4503291961987116,2025-04-24 23:59:00.067592,2025-04-24 23:59:05.215907,0 days 00:00:05.148315,True,absolute_error,50,log2,1,2,344,TPESampler,COMPLETE
1639,0.4207277885274291,2025-04-24 23:59:05.410411,2025-04-24 23:59:11.622361,0 days 00:00:06.211950,True,absolute_error,50,,2,3,102,TPESampler,COMPLETE
1640,0.37144187006246515,2025-04-24 23:59:11.814641,2025-04-24 23:59:35.951887,0 days 00:00:24.137246,True,absolute_error,42,,1,3,263,TPESampler,COMPLETE
1641,0.37139274077502793,2025-04-24 23:59:16.097330,2025-04-24 23:59:37.001547,0 days 00:00:20.904217,True,absolute_error,43,,1,2,225,TPESampler,COMPLETE
1642,0.3686474438081919,2025-04-24 23:59:16.668106,2025-04-24 23:59:41.345317,0 days 00:00:24.677211,True,absolute_error,50,,1,2,264,TPESampler,COMPLETE
1643,0.4163010128602814,2025-04-24 23:59:36.134257,2025-04-24 23:59:50.019765,0 days 00:00:13.885508,True,absolute_error,44,,2,3,256,TPESampler,COMPLETE
1644,0.4278117412347471,2025-04-24 23:59:37.184397,2025-04-24 23:59:38.438752,0 days 00:00:01.254355,True,squared_error,28,,1,19,169,TPESampler,COMPLETE
1645,0.36986210689344956,2025-04-24 23:59:38.621003,2025-04-25 00:00:00.264732,0 days 00:00:21.643729,True,absolute_error,50,,1,3,231,TPESampler,COMPLETE
1646,0.3725304906191168,2025-04-24 23:59:41.538446,2025-04-25 00:00:09.324210,0 days 00:00:27.785764,True,absolute_error,42,,1,4,305,TPESampler,COMPLETE
1647,0.42320127697195253,2025-04-24 23:59:50.220056,2025-04-24 23:59:51.287592,0 days 00:00:01.067536,True,squared_error,47,,2,2,102,TPESampler,COMPLETE
1648,0.3679489159748797,2025-04-24 23:59:51.472473,2025-04-25 00:00:04.697822,0 days 00:00:13.225349,True,absolute_error,50,,1,2,141,TPESampler,COMPLETE
1649,0.3763696022282889,2025-04-25 00:00:00.478758,2025-04-25 00:00:11.320258,0 days 00:00:10.841500,True,absolute_error,50,,1,4,112,TPESampler,COMPLETE
1650,0.7749456917448249,2025-04-25 00:00:04.898057,2025-04-25 00:00:05.968163,0 days 00:00:01.070106,False,squared_error,35,log2,2,2,442,TPESampler,COMPLETE
1651,0.479794212543632,2025-04-25 00:00:06.167884,2025-04-25 00:00:27.085006,0 days 00:00:20.917122,False,absolute_error,48,,2,4,221,TPESampler,COMPLETE
1652,0.4447609276918198,2025-04-25 00:00:09.517362,2025-04-25 00:00:11.604547,0 days 00:00:02.087185,True,absolute_error,50,log2,1,2,113,TPESampler,COMPLETE
1653,0.36828334016276953,2025-04-25 00:00:11.547601,2025-04-25 00:00:41.705971,0 days 00:00:30.158370,True,absolute_error,50,,1,2,271,TPESampler,COMPLETE
1654,0.6531005522222005,2025-04-25 00:00:11.856968,2025-04-25 00:00:21.793531,0 days 00:00:09.936563,True,absolute_error,23,log2,1,5,791,TPESampler,COMPLETE
1655,0.37058119814898977,2025-04-25 00:00:21.999709,2025-04-25 00:00:56.820388,0 days 00:00:34.820679,True,absolute_error,50,,1,2,338,TPESampler,COMPLETE
1656,0.6313583067331752,2025-04-25 00:00:27.282697,2025-04-25 00:00:37.358006,0 days 00:00:10.075309,True,absolute_error,32,log2,1,39,647,TPESampler,COMPLETE
1657,0.5547651439768471,2025-04-25 00:00:37.569638,2025-04-25 00:01:02.161238,0 days 00:00:24.591600,True,absolute_error,9,,2,45,542,TPESampler,COMPLETE
1658,0.9683656210688852,2025-04-25 00:00:41.898271,2025-04-25 00:00:42.957837,0 days 00:00:01.059566,False,squared_error,24,log2,13,2,691,TPESampler,COMPLETE
1659,0.37129167224161164,2025-04-25 00:00:43.152328,2025-04-25 00:01:05.665744,0 days 00:00:22.513416,True,absolute_error,43,,1,2,216,TPESampler,COMPLETE
1660,0.4153359781024648,2025-04-25 00:00:57.007034,2025-04-25 00:01:12.558458,0 days 00:00:15.551424,True,absolute_error,50,,2,4,248,TPESampler,COMPLETE
1661,0.36803178294643896,2025-04-25 00:01:02.365432,2025-04-25 00:01:30.405549,0 days 00:00:28.040117,True,absolute_error,50,,1,2,306,TPESampler,COMPLETE
1662,0.3711471596726601,2025-04-25 00:01:05.852871,2025-04-25 00:01:16.204109,0 days 00:00:10.351238,True,absolute_error,50,,1,2,104,TPESampler,COMPLETE
1663,0.3690333357544915,2025-04-25 00:01:12.750333,2025-04-25 00:01:36.374192,0 days 00:00:23.623859,True,absolute_error,42,,1,2,253,TPESampler,COMPLETE
1664,0.3683635387495613,2025-04-25 00:01:16.406848,2025-04-25 00:01:36.623869,0 days 00:00:20.217021,True,absolute_error,50,,1,2,219,TPESampler,COMPLETE
1665,0.41477642424971595,2025-04-25 00:01:30.784218,2025-04-25 00:01:45.846530,0 days 00:00:15.062312,True,absolute_error,49,,2,2,286,TPESampler,COMPLETE
1666,0.36877531851715467,2025-04-25 00:01:36.574128,2025-04-25 00:02:08.348970,0 days 00:00:31.774842,True,absolute_error,50,,1,2,259,TPESampler,COMPLETE
1667,0.36975252550561344,2025-04-25 00:01:36.960665,2025-04-25 00:02:00.253372,0 days 00:00:23.292707,True,absolute_error,42,,1,2,184,TPESampler,COMPLETE
1668,0.53723018611224,2025-04-25 00:01:46.034475,2025-04-25 00:02:06.960303,0 days 00:00:20.925828,False,absolute_error,29,sqrt,2,6,845,TPESampler,COMPLETE
1669,0.37459251369508734,2025-04-25 00:02:00.436895,2025-04-25 00:02:31.180964,0 days 00:00:30.744069,True,absolute_error,50,,1,4,230,TPESampler,COMPLETE
1670,0.41761279261512096,2025-04-25 00:02:07.149184,2025-04-25 00:02:11.470139,0 days 00:00:04.320955,False,absolute_error,50,log2,1,2,132,TPESampler,COMPLETE
1671,0.36926975681753615,2025-04-25 00:02:08.537761,2025-04-25 00:02:27.733426,0 days 00:00:19.195665,True,absolute_error,50,,1,2,113,TPESampler,COMPLETE
1672,0.41188625721288735,2025-04-25 00:02:11.954762,2025-04-25 00:02:44.257193,0 days 00:00:32.302431,True,absolute_error,50,,2,2,417,TPESampler,COMPLETE
1673,0.3707730433372525,2025-04-25 00:02:27.922549,2025-04-25 00:02:56.693168,0 days 00:00:28.770619,True,absolute_error,43,,1,2,272,TPESampler,COMPLETE
1674,0.416468293733127,2025-04-25 00:02:31.382357,2025-04-25 00:02:47.080664,0 days 00:00:15.698307,True,absolute_error,50,,2,3,243,TPESampler,COMPLETE
1675,0.3720044163726067,2025-04-25 00:02:44.513781,2025-04-25 00:02:56.694446,0 days 00:00:12.180665,True,absolute_error,42,,1,2,120,TPESampler,COMPLETE
1676,0.378193258103553,2025-04-25 00:02:47.479848,2025-04-25 00:03:02.703367,0 days 00:00:15.223519,True,absolute_error,31,,1,2,145,TPESampler,COMPLETE
1677,0.5454369962185656,2025-04-25 00:02:56.901401,2025-04-25 00:03:00.655749,0 days 00:00:03.754348,False,squared_error,33,,3,49,786,TPESampler,COMPLETE
1678,0.41550867791975954,2025-04-25 00:02:56.949945,2025-04-25 00:03:11.165007,0 days 00:00:14.215062,True,absolute_error,43,,2,3,253,TPESampler,COMPLETE
1679,0.47965529724463285,2025-04-25 00:03:00.845466,2025-04-25 00:03:31.170640,0 days 00:00:30.325174,False,absolute_error,49,,2,2,319,TPESampler,COMPLETE
1680,0.41532378111824814,2025-04-25 00:03:02.904237,2025-04-25 00:03:12.141367,0 days 00:00:09.237130,True,absolute_error,50,,2,2,173,TPESampler,COMPLETE
1681,0.38337712372552424,2025-04-25 00:03:11.350827,2025-04-25 00:03:13.827472,0 days 00:00:02.476645,True,squared_error,49,,1,2,273,TPESampler,COMPLETE
1682,0.41635351658745506,2025-04-25 00:03:12.328367,2025-04-25 00:03:18.780824,0 days 00:00:06.452457,True,absolute_error,40,,2,2,116,TPESampler,COMPLETE
1683,0.5276890136564791,2025-04-25 00:03:14.025850,2025-04-25 00:03:18.754677,0 days 00:00:04.728827,True,absolute_error,24,,5,33,190,TPESampler,COMPLETE
1684,0.3706696105146895,2025-04-25 00:03:18.912233,2025-04-25 00:03:47.004319,0 days 00:00:28.092086,True,absolute_error,50,,1,3,242,TPESampler,COMPLETE
1685,0.3727258694853893,2025-04-25 00:03:18.961614,2025-04-25 00:03:52.914078,0 days 00:00:33.952464,True,absolute_error,44,,1,4,293,TPESampler,COMPLETE
1686,0.41555657989150385,2025-04-25 00:03:31.403801,2025-04-25 00:03:38.461104,0 days 00:00:07.057303,True,absolute_error,50,,2,2,118,TPESampler,COMPLETE
1687,0.4151769259486241,2025-04-25 00:03:38.650798,2025-04-25 00:04:00.412874,0 days 00:00:21.762076,True,absolute_error,50,,2,2,336,TPESampler,COMPLETE
1688,0.38671858886747107,2025-04-25 00:03:47.219507,2025-04-25 00:03:50.682799,0 days 00:00:03.463292,False,squared_error,45,sqrt,1,2,761,TPESampler,COMPLETE
1689,0.36901461280871867,2025-04-25 00:03:50.867946,2025-04-25 00:04:11.886302,0 days 00:00:21.018356,True,absolute_error,50,,1,2,223,TPESampler,COMPLETE
1690,0.44235528280419767,2025-04-25 00:03:53.092691,2025-04-25 00:04:37.929115,0 days 00:00:44.836424,False,absolute_error,50,,1,2,290,TPESampler,COMPLETE
