number,value,datetime_start,datetime_complete,duration,params_bootstrap,params_criterion,params_max_depth,params_max_features,params_min_samples_leaf,params_min_samples_split,params_n_estimators,system_attrs_auto:sampler,state
2114,0.7617317672375661,2025-04-25 00:44:31.993427,2025-04-25 00:44:33.000400,0 days 00:00:01.006973,True,squared_error,15,log2,1,13,157,TPESampler,COMPLETE
2115,0.36762509661876996,2025-04-25 00:44:32.570590,2025-04-25 00:44:55.533693,0 days 00:00:22.963103,True,absolute_error,50,,1,2,202,TPESampler,COMPLETE
2116,0.5507281878398866,2025-04-25 00:44:33.197167,2025-04-25 00:44:40.514166,0 days 00:00:07.316999,False,absolute_error,50,log2,1,48,305,TPESampler,COMPLETE
2117,0.36858642688951,2025-04-25 00:44:34.059286,2025-04-25 00:45:00.533191,0 days 00:00:26.473905,True,absolute_error,50,,1,2,265,TPESampler,COMPLETE
2118,0.42745355797503753,2025-04-25 00:44:40.700834,2025-04-25 00:44:43.056909,0 days 00:00:02.356075,True,absolute_error,48,sqrt,1,4,101,TPESampler,COMPLETE
2119,0.37620514626296114,2025-04-25 00:44:43.240549,2025-04-25 00:44:57.562443,0 days 00:00:14.321894,True,absolute_error,50,,1,4,131,TPESampler,COMPLETE
2120,0.3689348084913331,2025-04-25 00:44:55.727792,2025-04-25 00:45:08.548880,0 days 00:00:12.821088,True,absolute_error,50,,1,2,119,TPESampler,COMPLETE
2121,0.3692708333177682,2025-04-25 00:44:57.747146,2025-04-25 00:45:34.683678,0 days 00:00:36.936532,True,absolute_error,43,,1,2,294,TPESampler,COMPLETE
2122,0.37479611926621526,2025-04-25 00:45:00.721186,2025-04-25 00:45:23.035178,0 days 00:00:22.313992,True,absolute_error,44,,1,4,231,TPESampler,COMPLETE
2123,0.3712487474477736,2025-04-25 00:45:08.740204,2025-04-25 00:45:36.500402,0 days 00:00:27.760198,True,absolute_error,41,,1,3,259,TPESampler,COMPLETE
2124,0.367675852509013,2025-04-25 00:45:23.228929,2025-04-25 00:45:56.241165,0 days 00:00:33.012236,True,absolute_error,50,,1,2,291,TPESampler,COMPLETE
2125,0.3719570835272246,2025-04-25 00:45:34.896725,2025-04-25 00:45:50.921583,0 days 00:00:16.024858,True,absolute_error,41,,1,2,172,TPESampler,COMPLETE
2126,0.44562852828562266,2025-04-25 00:45:36.688453,2025-04-25 00:45:38.753540,0 days 00:00:02.065087,True,absolute_error,49,log2,1,2,100,TPESampler,COMPLETE
2127,0.4128730517166774,2025-04-25 00:45:38.935278,2025-04-25 00:46:03.613410,0 days 00:00:24.678132,True,absolute_error,50,,2,2,409,TPESampler,COMPLETE
2128,0.5302152693759871,2025-04-25 00:45:51.127720,2025-04-25 00:45:53.881132,0 days 00:00:02.753412,False,squared_error,37,,4,23,520,TPESampler,COMPLETE
2129,0.3705860577264978,2025-04-25 00:45:54.069761,2025-04-25 00:46:23.093443,0 days 00:00:29.023682,True,absolute_error,43,,1,2,308,TPESampler,COMPLETE
2130,0.5935521404200821,2025-04-25 00:45:56.428406,2025-04-25 00:45:58.340606,0 days 00:00:01.912200,True,absolute_error,29,,12,2,127,TPESampler,COMPLETE
2131,0.40172261919403357,2025-04-25 00:45:58.575098,2025-04-25 00:46:04.979887,0 days 00:00:06.404789,True,absolute_error,50,sqrt,1,2,298,TPESampler,COMPLETE
2132,0.3958354864380621,2025-04-25 00:46:03.804338,2025-04-25 00:46:05.934203,0 days 00:00:02.129865,False,squared_error,46,,1,3,174,TPESampler,COMPLETE
2133,0.36823715123140627,2025-04-25 00:46:05.185767,2025-04-25 00:46:33.344781,0 days 00:00:28.159014,True,absolute_error,50,,1,2,301,TPESampler,COMPLETE
2134,0.41472448922935107,2025-04-25 00:46:06.141901,2025-04-25 00:46:21.536554,0 days 00:00:15.394653,True,absolute_error,50,,2,2,295,TPESampler,COMPLETE
2135,0.37317250310654354,2025-04-25 00:46:21.720289,2025-04-25 00:46:32.461114,0 days 00:00:10.740825,True,absolute_error,42,,1,2,107,TPESampler,COMPLETE
2136,0.3749197804660906,2025-04-25 00:46:23.278539,2025-04-25 00:46:44.671867,0 days 00:00:21.393328,True,absolute_error,50,,1,4,229,TPESampler,COMPLETE
2137,0.36795752096153067,2025-04-25 00:46:32.653198,2025-04-25 00:46:52.990878,0 days 00:00:20.337680,True,absolute_error,50,,1,2,214,TPESampler,COMPLETE
2138,0.4207277885274291,2025-04-25 00:46:33.530332,2025-04-25 00:46:39.237310,0 days 00:00:05.706978,True,absolute_error,49,,2,2,102,TPESampler,COMPLETE
2139,0.9187328093836702,2025-04-25 00:46:39.435038,2025-04-25 00:46:40.541851,0 days 00:00:01.106813,False,squared_error,22,log2,4,9,726,TPESampler,COMPLETE
2140,0.37523181947771306,2025-04-25 00:46:40.733008,2025-04-25 00:46:51.103920,0 days 00:00:10.370912,True,absolute_error,43,,1,2,107,TPESampler,COMPLETE
2141,0.3730973638822413,2025-04-25 00:46:44.858968,2025-04-25 00:47:21.054768,0 days 00:00:36.195800,True,absolute_error,43,,1,4,405,TPESampler,COMPLETE
2142,0.36763180568217557,2025-04-25 00:46:51.287478,2025-04-25 00:47:14.573422,0 days 00:00:23.285944,True,absolute_error,50,,1,2,205,TPESampler,COMPLETE
2143,0.5639133729310045,2025-04-25 00:46:53.175644,2025-04-25 00:47:37.217162,0 days 00:00:44.041518,False,absolute_error,7,,5,3,960,TPESampler,COMPLETE
2144,0.41534707630485573,2025-04-25 00:47:14.821617,2025-04-25 00:47:27.944604,0 days 00:00:13.122987,True,absolute_error,43,,2,3,249,TPESampler,COMPLETE
2145,0.3742940086171032,2025-04-25 00:47:21.240150,2025-04-25 00:47:32.203842,0 days 00:00:10.963692,True,absolute_error,42,,1,3,114,TPESampler,COMPLETE
2146,0.3738755564854229,2025-04-25 00:47:28.305524,2025-04-25 00:48:08.992162,0 days 00:00:40.686638,True,absolute_error,33,,1,2,452,TPESampler,COMPLETE
2147,0.41530670935444364,2025-04-25 00:47:32.387616,2025-04-25 00:47:44.241659,0 days 00:00:11.854043,True,absolute_error,50,,2,4,223,TPESampler,COMPLETE
2148,0.3759167263421656,2025-04-25 00:47:37.401328,2025-04-25 00:47:47.153985,0 days 00:00:09.752657,True,absolute_error,43,,1,2,101,TPESampler,COMPLETE
2149,0.369880023225663,2025-04-25 00:47:44.601073,2025-04-25 00:48:22.731015,0 days 00:00:38.129942,True,absolute_error,50,,1,2,408,TPESampler,COMPLETE
2150,0.3717079183826205,2025-04-25 00:47:47.567776,2025-04-25 00:48:08.351570,0 days 00:00:20.783794,True,absolute_error,43,,1,2,223,TPESampler,COMPLETE
2151,0.37228867096938206,2025-04-25 00:48:08.543921,2025-04-25 00:48:19.296694,0 days 00:00:10.752773,True,absolute_error,50,,1,2,102,TPESampler,COMPLETE
2152,0.36762509661876996,2025-04-25 00:48:09.216890,2025-04-25 00:48:28.877285,0 days 00:00:19.660395,True,absolute_error,50,,1,2,202,TPESampler,COMPLETE
2153,0.43716045848805485,2025-04-25 00:48:19.484871,2025-04-25 00:48:22.615960,0 days 00:00:03.131089,True,squared_error,30,sqrt,1,2,977,TPESampler,COMPLETE
2154,0.4797932329719247,2025-04-25 00:48:22.795488,2025-04-25 00:48:33.431174,0 days 00:00:10.635686,False,absolute_error,43,,2,2,106,TPESampler,COMPLETE
2155,0.377899486267595,2025-04-25 00:48:22.921458,2025-04-25 00:48:32.865389,0 days 00:00:09.943931,True,absolute_error,43,,1,3,103,TPESampler,COMPLETE
2156,0.3764546040062385,2025-04-25 00:48:29.136232,2025-04-25 00:48:39.137870,0 days 00:00:10.001638,True,absolute_error,43,,1,3,105,TPESampler,COMPLETE
2157,0.4723046426746531,2025-04-25 00:48:33.049846,2025-04-25 00:48:34.655314,0 days 00:00:01.605468,False,squared_error,25,,2,3,134,TPESampler,COMPLETE
2158,0.37357589242179307,2025-04-25 00:48:33.631300,2025-04-25 00:49:00.958625,0 days 00:00:27.327325,True,absolute_error,50,,1,4,278,TPESampler,COMPLETE
2159,0.3704655569908258,2025-04-25 00:48:34.837416,2025-04-25 00:48:56.912396,0 days 00:00:22.074980,True,absolute_error,50,,1,3,224,TPESampler,COMPLETE
2160,0.41499115064123027,2025-04-25 00:48:39.353306,2025-04-25 00:48:54.696290,0 days 00:00:15.342984,True,absolute_error,44,,2,2,252,TPESampler,COMPLETE
2161,0.37064332588383586,2025-04-25 00:48:54.883075,2025-04-25 00:49:14.484735,0 days 00:00:19.601660,True,absolute_error,43,,1,2,209,TPESampler,COMPLETE
2162,0.4152420586746467,2025-04-25 00:48:57.098308,2025-04-25 00:49:09.781366,0 days 00:00:12.683058,True,absolute_error,50,,2,2,236,TPESampler,COMPLETE
2163,0.8939725645551956,2025-04-25 00:49:01.143833,2025-04-25 00:49:02.804296,0 days 00:00:01.660463,True,absolute_error,33,log2,3,16,394,TPESampler,COMPLETE
2164,0.42117304451673676,2025-04-25 00:49:02.987624,2025-04-25 00:49:08.677279,0 days 00:00:05.689655,True,absolute_error,50,,2,3,103,TPESampler,COMPLETE
2165,0.36872500871055197,2025-04-25 00:49:08.856653,2025-04-25 00:49:22.043315,0 days 00:00:13.186662,True,absolute_error,50,,1,2,140,TPESampler,COMPLETE
2166,0.3713654164792049,2025-04-25 00:49:09.970413,2025-04-25 00:49:33.893024,0 days 00:00:23.922611,True,absolute_error,43,,1,2,261,TPESampler,COMPLETE
2167,0.36976459767797554,2025-04-25 00:49:14.673208,2025-04-25 00:49:26.276967,0 days 00:00:11.603759,True,absolute_error,50,,1,2,123,TPESampler,COMPLETE
2168,0.37344680981040623,2025-04-25 00:49:22.229014,2025-04-25 00:49:32.068871,0 days 00:00:09.839857,True,absolute_error,50,,1,3,103,TPESampler,COMPLETE
2169,0.38620214083037846,2025-04-25 00:49:26.463853,2025-04-25 00:49:28.455672,0 days 00:00:01.991819,True,squared_error,43,,1,2,198,TPESampler,COMPLETE
2170,0.47991673221144876,2025-04-25 00:49:28.696040,2025-04-25 00:49:50.331048,0 days 00:00:21.635008,False,absolute_error,50,,2,2,229,TPESampler,COMPLETE
2171,0.37108987500603624,2025-04-25 00:49:32.256842,2025-04-25 00:49:55.851279,0 days 00:00:23.594437,True,absolute_error,42,,1,3,257,TPESampler,COMPLETE
2172,0.5310616446180354,2025-04-25 00:49:34.082108,2025-04-25 00:49:36.176477,0 days 00:00:02.094369,True,squared_error,16,,6,7,480,TPESampler,COMPLETE
2173,0.9004962139837418,2025-04-25 00:49:36.360523,2025-04-25 00:49:37.721823,0 days 00:00:01.361300,False,squared_error,5,log2,1,2,882,TPESampler,COMPLETE
2174,0.3770922367351997,2025-04-25 00:49:37.908909,2025-04-25 00:49:50.032204,0 days 00:00:12.123295,True,absolute_error,50,,1,4,130,TPESampler,COMPLETE
2175,0.8365589879794241,2025-04-25 00:49:50.220400,2025-04-25 00:49:51.901247,0 days 00:00:01.680847,True,absolute_error,48,log2,2,2,234,TPESampler,COMPLETE
2176,0.36823715123140627,2025-04-25 00:49:50.575403,2025-04-25 00:50:18.623213,0 days 00:00:28.047810,True,absolute_error,50,,1,2,301,TPESampler,COMPLETE
2177,0.3717254419691643,2025-04-25 00:49:52.094597,2025-04-25 00:50:17.912214,0 days 00:00:25.817617,True,absolute_error,44,,1,2,280,TPESampler,COMPLETE
2178,0.3678802085720337,2025-04-25 00:49:56.044260,2025-04-25 00:50:17.326655,0 days 00:00:21.282395,True,absolute_error,50,,1,2,233,TPESampler,COMPLETE
2179,0.37156398037641536,2025-04-25 00:50:17.519509,2025-04-25 00:50:56.658424,0 days 00:00:39.138915,True,absolute_error,50,,1,3,408,TPESampler,COMPLETE
2180,0.37088935017545654,2025-04-25 00:50:18.106324,2025-04-25 00:50:48.698104,0 days 00:00:30.591780,True,absolute_error,43,,1,3,310,TPESampler,COMPLETE
2181,0.47971813492135096,2025-04-25 00:50:18.860818,2025-04-25 00:50:24.543030,0 days 00:00:05.682212,True,absolute_error,42,log2,1,2,265,TPESampler,COMPLETE
2182,0.36926975681753615,2025-04-25 00:50:24.719335,2025-04-25 00:50:35.460500,0 days 00:00:10.741165,True,absolute_error,50,,1,2,113,TPESampler,COMPLETE
2183,0.38683167441935334,2025-04-25 00:50:35.646851,2025-04-25 00:50:39.280289,0 days 00:00:03.633438,True,squared_error,49,,1,3,503,TPESampler,COMPLETE
2184,0.3714952381110082,2025-04-25 00:50:39.458202,2025-04-25 00:51:13.129609,0 days 00:00:33.671407,True,absolute_error,50,,1,2,371,TPESampler,COMPLETE
2185,0.37102941602828454,2025-04-25 00:50:48.893386,2025-04-25 00:51:10.506289,0 days 00:00:21.612903,True,absolute_error,43,,1,2,237,TPESampler,COMPLETE
2186,0.4154303257334211,2025-04-25 00:50:56.848871,2025-04-25 00:51:13.350337,0 days 00:00:16.501466,True,absolute_error,44,,2,2,320,TPESampler,COMPLETE
2187,0.41650807614792373,2025-04-25 00:51:10.685668,2025-04-25 00:51:18.722396,0 days 00:00:08.036728,True,absolute_error,50,,2,3,121,TPESampler,COMPLETE
2188,0.42110914999441806,2025-04-25 00:51:13.317469,2025-04-25 00:51:20.707582,0 days 00:00:07.390113,True,absolute_error,39,,2,2,103,TPESampler,COMPLETE
2189,0.6585972298371252,2025-04-25 00:51:13.579623,2025-04-25 00:52:24.730716,0 days 00:01:11.151093,False,absolute_error,5,,2,15,949,TPESampler,COMPLETE
2190,0.4141457516473212,2025-04-25 00:51:18.904525,2025-04-25 00:51:31.140010,0 days 00:00:12.235485,True,absolute_error,50,,2,2,210,TPESampler,COMPLETE
2191,0.9525544771717979,2025-04-25 00:51:20.891977,2025-04-25 00:51:21.721817,0 days 00:00:00.829840,True,absolute_error,10,log2,14,4,181,TPESampler,COMPLETE
2192,0.36767225953044724,2025-04-25 00:51:21.901632,2025-04-25 00:51:41.131159,0 days 00:00:19.229527,True,absolute_error,50,,1,2,189,TPESampler,COMPLETE
2193,0.3678802085720337,2025-04-25 00:51:31.329347,2025-04-25 00:51:53.800478,0 days 00:00:22.471131,True,absolute_error,50,,1,2,233,TPESampler,COMPLETE
2194,0.3696018677958252,2025-04-25 00:51:41.321668,2025-04-25 00:52:06.312544,0 days 00:00:24.990876,True,absolute_error,50,,1,3,274,TPESampler,COMPLETE
2195,0.4179791787345741,2025-04-25 00:51:53.990453,2025-04-25 00:52:00.168195,0 days 00:00:06.177742,True,absolute_error,43,,2,2,112,TPESampler,COMPLETE
2196,0.9242908693135924,2025-04-25 00:52:00.359904,2025-04-25 00:52:01.821069,0 days 00:00:01.461165,True,absolute_error,39,sqrt,15,4,551,TPESampler,COMPLETE
2197,0.37245250364481614,2025-04-25 00:52:02.005649,2025-04-25 00:52:11.827170,0 days 00:00:09.821521,True,absolute_error,50,,1,3,104,TPESampler,COMPLETE
2198,0.3722472958104468,2025-04-25 00:52:06.508815,2025-04-25 00:52:39.665957,0 days 00:00:33.157142,True,absolute_error,50,,1,4,304,TPESampler,COMPLETE
2199,0.9110633255252701,2025-04-25 00:52:12.017176,2025-04-25 00:52:13.187027,0 days 00:00:01.169851,True,squared_error,15,log2,3,4,525,TPESampler,COMPLETE
2200,0.4152420586746467,2025-04-25 00:52:13.371614,2025-04-25 00:52:29.727091,0 days 00:00:16.355477,True,absolute_error,50,,2,3,236,TPESampler,COMPLETE
2201,0.3702438977498468,2025-04-25 00:52:24.913207,2025-04-25 00:53:02.340645,0 days 00:00:37.427438,True,absolute_error,42,,1,2,402,TPESampler,COMPLETE
2202,0.41486966670011305,2025-04-25 00:52:29.918576,2025-04-25 00:52:42.069934,0 days 00:00:12.151358,True,absolute_error,50,,2,2,229,TPESampler,COMPLETE
2203,0.590446021602874,2025-04-25 00:52:39.858601,2025-04-25 00:52:53.887371,0 days 00:00:14.028770,False,absolute_error,7,,10,5,530,TPESampler,COMPLETE
2204,0.3681797343305437,2025-04-25 00:52:42.495232,2025-04-25 00:53:04.690296,0 days 00:00:22.195064,True,absolute_error,50,,1,2,236,TPESampler,COMPLETE
2205,0.5855431304394023,2025-04-25 00:52:54.275414,2025-04-25 00:52:56.328393,0 days 00:00:02.052979,True,squared_error,5,,2,2,480,TPESampler,COMPLETE
2206,0.3690755944986468,2025-04-25 00:52:56.518286,2025-04-25 00:53:11.295714,0 days 00:00:14.777428,True,absolute_error,50,,1,3,159,TPESampler,COMPLETE
2207,0.3689348084913331,2025-04-25 00:53:02.530940,2025-04-25 00:53:14.270075,0 days 00:00:11.739135,True,absolute_error,50,,1,2,119,TPESampler,COMPLETE
2208,0.4164341399651234,2025-04-25 00:53:04.880083,2025-04-25 00:53:19.381937,0 days 00:00:14.501854,True,absolute_error,50,,2,2,276,TPESampler,COMPLETE
2209,0.3696202126748104,2025-04-25 00:53:11.480232,2025-04-25 00:53:34.576654,0 days 00:00:23.096422,True,absolute_error,50,,1,3,246,TPESampler,COMPLETE
2210,0.37329697195254197,2025-04-25 00:53:14.464846,2025-04-25 00:53:37.350942,0 days 00:00:22.886096,True,absolute_error,43,,1,4,248,TPESampler,COMPLETE
2211,0.7938774546085215,2025-04-25 00:53:19.566363,2025-04-25 00:53:20.475723,0 days 00:00:00.909360,False,squared_error,6,sqrt,2,2,345,TPESampler,COMPLETE
2212,0.9295026836011361,2025-04-25 00:53:20.662401,2025-04-25 00:53:22.046392,0 days 00:00:01.383991,True,squared_error,6,sqrt,13,2,689,TPESampler,COMPLETE
2213,0.3698646791916843,2025-04-25 00:53:22.239872,2025-04-25 00:53:51.072889,0 days 00:00:28.833017,True,absolute_error,50,,1,2,316,TPESampler,COMPLETE
2214,0.36986101468212895,2025-04-25 00:53:34.764777,2025-04-25 00:53:51.311836,0 days 00:00:16.547059,True,absolute_error,42,,1,2,179,TPESampler,COMPLETE
2215,0.3782170144712773,2025-04-25 00:53:37.533909,2025-04-25 00:53:47.376133,0 days 00:00:09.842224,True,absolute_error,50,,1,4,104,TPESampler,COMPLETE
2216,0.36955006482525743,2025-04-25 00:53:47.562756,2025-04-25 00:53:58.315768,0 days 00:00:10.753012,True,absolute_error,50,,1,2,111,TPESampler,COMPLETE
2217,0.5958949165516271,2025-04-25 00:53:51.269531,2025-04-25 00:53:55.008745,0 days 00:00:03.739214,False,squared_error,24,,7,2,752,TPESampler,COMPLETE
2218,0.5554590622151295,2025-04-25 00:53:51.621598,2025-04-25 00:54:13.192780,0 days 00:00:21.571182,False,absolute_error,11,,2,9,229,TPESampler,COMPLETE
2219,0.5053637990773261,2025-04-25 00:53:55.199059,2025-04-25 00:53:57.233165,0 days 00:00:02.034106,True,absolute_error,40,log2,1,4,122,TPESampler,COMPLETE
2220,0.36847056191199934,2025-04-25 00:53:57.420294,2025-04-25 00:54:26.626106,0 days 00:00:29.205812,True,absolute_error,50,,1,2,278,TPESampler,COMPLETE
2221,0.38110141536421843,2025-04-25 00:53:58.500661,2025-04-25 00:53:59.857891,0 days 00:00:01.357230,True,squared_error,50,,1,2,119,TPESampler,COMPLETE
2222,0.5521250052422817,2025-04-25 00:54:00.041945,2025-04-25 00:54:02.497922,0 days 00:00:02.455977,True,squared_error,9,,1,32,651,TPESampler,COMPLETE
2223,0.4174398333553935,2025-04-25 00:54:02.684304,2025-04-25 00:54:04.123956,0 days 00:00:01.439652,True,squared_error,50,,2,2,187,TPESampler,COMPLETE
2224,0.4153130027636932,2025-04-25 00:54:04.319521,2025-04-25 00:54:19.174524,0 days 00:00:14.855003,True,absolute_error,33,,2,3,254,TPESampler,COMPLETE
2225,0.371558347899092,2025-04-25 00:54:13.385352,2025-04-25 00:54:47.321232,0 days 00:00:33.935880,True,absolute_error,42,,1,2,374,TPESampler,COMPLETE
2226,0.46761608239277225,2025-04-25 00:54:19.369698,2025-04-25 00:54:37.537402,0 days 00:00:18.167704,True,absolute_error,45,sqrt,1,18,952,TPESampler,COMPLETE
2227,0.6575263223079264,2025-04-25 00:54:26.819063,2025-04-25 00:54:27.789034,0 days 00:00:00.969971,False,squared_error,47,sqrt,4,6,313,TPESampler,COMPLETE
2228,0.37139438622973175,2025-04-25 00:54:28.044776,2025-04-25 00:54:49.329779,0 days 00:00:21.285003,True,absolute_error,41,,1,2,228,TPESampler,COMPLETE
2229,0.37523181947771306,2025-04-25 00:54:37.730776,2025-04-25 00:54:47.921355,0 days 00:00:10.190579,True,absolute_error,43,,1,2,107,TPESampler,COMPLETE
2230,0.5197166600656883,2025-04-25 00:54:47.515342,2025-04-25 00:55:10.281145,0 days 00:00:22.765803,False,absolute_error,45,,7,14,644,TPESampler,COMPLETE
2231,0.37387989720067827,2025-04-25 00:54:48.159889,2025-04-25 00:55:13.668375,0 days 00:00:25.508486,True,absolute_error,44,,1,4,253,TPESampler,COMPLETE
2232,0.41502822614663987,2025-04-25 00:54:49.524549,2025-04-25 00:54:59.030938,0 days 00:00:09.506389,True,absolute_error,42,,2,2,179,TPESampler,COMPLETE
2233,0.37318427460257075,2025-04-25 00:54:59.219633,2025-04-25 00:55:26.131244,0 days 00:00:26.911611,True,absolute_error,33,,1,2,269,TPESampler,COMPLETE
2234,0.37407034785722226,2025-04-25 00:55:10.474271,2025-04-25 00:55:25.861817,0 days 00:00:15.387546,True,absolute_error,43,,1,4,168,TPESampler,COMPLETE
2235,0.5126484371304285,2025-04-25 00:55:13.856184,2025-04-25 00:55:18.611346,0 days 00:00:04.755162,True,absolute_error,48,,6,4,216,TPESampler,COMPLETE
2236,0.3682937296813074,2025-04-25 00:55:18.800189,2025-04-25 00:55:45.495662,0 days 00:00:26.695473,True,absolute_error,50,,1,2,281,TPESampler,COMPLETE
2237,0.3761407526543913,2025-04-25 00:55:26.059320,2025-04-25 00:55:38.576691,0 days 00:00:12.517371,True,absolute_error,50,,1,4,119,TPESampler,COMPLETE
2238,0.5132707507831957,2025-04-25 00:55:26.409214,2025-04-25 00:55:29.204013,0 days 00:00:02.794799,True,absolute_error,23,sqrt,1,3,135,TPESampler,COMPLETE
2239,0.36941533855573405,2025-04-25 00:55:29.566544,2025-04-25 00:55:43.281214,0 days 00:00:13.714670,True,absolute_error,50,,1,2,128,TPESampler,COMPLETE
2240,0.36872667675774295,2025-04-25 00:55:38.770813,2025-04-25 00:56:03.935705,0 days 00:00:25.164892,True,absolute_error,50,,1,2,269,TPESampler,COMPLETE
2241,0.37245704422773396,2025-04-25 00:55:43.467754,2025-04-25 00:56:23.192988,0 days 00:00:39.725234,True,absolute_error,50,,1,4,443,TPESampler,COMPLETE
2242,0.4371511718173879,2025-04-25 00:55:45.692364,2025-04-25 00:56:25.007617,0 days 00:00:39.315253,False,absolute_error,45,,1,3,254,TPESampler,COMPLETE
2243,0.36821529053790913,2025-04-25 00:56:04.124403,2025-04-25 00:56:22.336929,0 days 00:00:18.212526,True,absolute_error,50,,1,2,199,TPESampler,COMPLETE
2244,0.42069606508063623,2025-04-25 00:56:22.517555,2025-04-25 00:56:28.399696,0 days 00:00:05.882141,True,absolute_error,43,,2,2,104,TPESampler,COMPLETE
2245,0.3716960794254708,2025-04-25 00:56:23.372687,2025-04-25 00:56:42.400047,0 days 00:00:19.027360,True,absolute_error,41,,1,2,198,TPESampler,COMPLETE
2246,0.3740946686709435,2025-04-25 00:56:25.196187,2025-04-25 00:56:34.802119,0 days 00:00:09.605932,True,absolute_error,41,,1,2,101,TPESampler,COMPLETE
2247,0.47879074640750974,2025-04-25 00:56:28.602862,2025-04-25 00:56:36.347414,0 days 00:00:07.744552,True,absolute_error,44,log2,1,2,515,TPESampler,COMPLETE
2248,0.3715726252442986,2025-04-25 00:56:34.986760,2025-04-25 00:57:08.932296,0 days 00:00:33.945536,True,absolute_error,43,,1,3,329,TPESampler,COMPLETE
2249,0.36941533855573405,2025-04-25 00:56:36.544753,2025-04-25 00:56:49.742662,0 days 00:00:13.197909,True,absolute_error,50,,1,2,128,TPESampler,COMPLETE
2250,0.9158147561467602,2025-04-25 00:56:42.592481,2025-04-25 00:56:43.925440,0 days 00:00:01.332959,False,squared_error,39,log2,4,4,973,TPESampler,COMPLETE
2251,0.37102932510688785,2025-04-25 00:56:44.123027,2025-04-25 00:57:13.096931,0 days 00:00:28.973904,True,absolute_error,43,,1,2,265,TPESampler,COMPLETE
2252,0.37146125430056676,2025-04-25 00:56:49.933912,2025-04-25 00:57:23.372674,0 days 00:00:33.438762,True,absolute_error,50,,1,3,342,TPESampler,COMPLETE
2253,0.48243331077121715,2025-04-25 00:57:09.129041,2025-04-25 00:57:10.152643,0 days 00:00:01.023602,True,squared_error,48,log2,1,5,213,TPESampler,COMPLETE
2254,0.4149717673907113,2025-04-25 00:57:10.340007,2025-04-25 00:57:26.236575,0 days 00:00:15.896568,True,absolute_error,50,,2,2,290,TPESampler,COMPLETE
