number,value,datetime_start,datetime_complete,duration,params_bootstrap,params_criterion,params_max_depth,params_max_features,params_min_samples_leaf,params_min_samples_split,params_n_estimators,system_attrs_auto:sampler,state
1128,0.8344655867358246,2025-04-24 23:14:21.076838,2025-04-24 23:14:22.242955,0 days 00:00:01.166117,True,absolute_error,50,log2,2,3,163,TPESampler,COMPLETE
1129,0.3715850477718837,2025-04-24 23:14:22.423599,2025-04-24 23:14:34.540176,0 days 00:00:12.116577,True,absolute_error,50,,1,3,122,TPESampler,COMPLETE
1130,0.4680518016334461,2025-04-24 23:14:23.976646,2025-04-24 23:14:27.358006,0 days 00:00:03.381360,False,squared_error,42,log2,1,2,950,TPESampler,COMPLETE
1131,0.37125867418526587,2025-04-24 23:14:27.536828,2025-04-24 23:14:37.721680,0 days 00:00:10.184852,True,absolute_error,50,,1,2,106,TPESampler,COMPLETE
1132,0.4148532858587735,2025-04-24 23:14:29.037675,2025-04-24 23:14:45.873287,0 days 00:00:16.835612,True,absolute_error,50,,2,2,325,TPESampler,COMPLETE
1133,0.37173876592865174,2025-04-24 23:14:34.714971,2025-04-24 23:15:07.072209,0 days 00:00:32.357238,True,absolute_error,50,,1,3,355,TPESampler,COMPLETE
1134,0.36981947760565886,2025-04-24 23:14:37.896698,2025-04-24 23:15:05.042880,0 days 00:00:27.146182,True,absolute_error,43,,1,2,296,TPESampler,COMPLETE
1135,0.8614109321035531,2025-04-24 23:14:46.047099,2025-04-24 23:14:46.917885,0 days 00:00:00.870786,False,squared_error,39,sqrt,10,5,403,TPESampler,COMPLETE
1136,0.36959915105391766,2025-04-24 23:14:47.093276,2025-04-24 23:14:57.642843,0 days 00:00:10.549567,True,absolute_error,50,,1,2,110,TPESampler,COMPLETE
1137,0.49827994802585585,2025-04-24 23:14:57.819497,2025-04-24 23:15:18.534320,0 days 00:00:20.714823,False,absolute_error,43,,2,44,229,TPESampler,COMPLETE
1138,0.39470775707057737,2025-04-24 23:15:05.213568,2025-04-24 23:15:12.246747,0 days 00:00:07.033179,True,absolute_error,48,sqrt,1,2,356,TPESampler,COMPLETE
1139,0.4207277885274291,2025-04-24 23:15:07.239542,2025-04-24 23:15:13.020548,0 days 00:00:05.781006,True,absolute_error,50,,2,4,102,TPESampler,COMPLETE
1140,0.5313740738042798,2025-04-24 23:15:12.419442,2025-04-24 23:15:19.746874,0 days 00:00:07.327432,True,absolute_error,46,log2,1,10,556,TPESampler,COMPLETE
1141,0.3714843571468709,2025-04-24 23:15:13.242454,2025-04-24 23:15:36.864931,0 days 00:00:23.622477,True,absolute_error,41,,1,2,260,TPESampler,COMPLETE
1142,0.36835760854057814,2025-04-24 23:15:18.709995,2025-04-24 23:15:41.206852,0 days 00:00:22.496857,True,absolute_error,50,,1,2,245,TPESampler,COMPLETE
1143,0.4310646679706523,2025-04-24 23:15:19.980435,2025-04-24 23:15:56.796969,0 days 00:00:36.816534,True,absolute_error,35,,1,25,426,TPESampler,COMPLETE
1144,0.3739626873717241,2025-04-24 23:15:37.044835,2025-04-24 23:16:02.185850,0 days 00:00:25.141015,True,absolute_error,50,,1,4,269,TPESampler,COMPLETE
1145,0.5607429470880835,2025-04-24 23:15:41.382322,2025-04-24 23:15:42.174449,0 days 00:00:00.792127,True,squared_error,31,log2,1,4,132,TPESampler,COMPLETE
1146,0.8315793454241236,2025-04-24 23:15:42.352881,2025-04-24 23:15:43.974134,0 days 00:00:01.621253,True,squared_error,10,log2,1,14,924,TPESampler,COMPLETE
1147,0.4249473544281302,2025-04-24 23:15:44.144526,2025-04-24 23:15:45.172526,0 days 00:00:01.028000,True,squared_error,28,,2,5,109,TPESampler,COMPLETE
1148,0.3744939586199228,2025-04-24 23:15:45.345178,2025-04-24 23:15:57.178464,0 days 00:00:11.833286,True,absolute_error,40,,1,2,114,TPESampler,COMPLETE
1149,0.3682937296813074,2025-04-24 23:15:56.975318,2025-04-24 23:16:23.244253,0 days 00:00:26.268935,True,absolute_error,50,,1,2,281,TPESampler,COMPLETE
1150,0.38394330544384875,2025-04-24 23:15:57.422547,2025-04-24 23:15:59.147913,0 days 00:00:01.725366,True,squared_error,50,,1,3,183,TPESampler,COMPLETE
1151,0.6271663217341786,2025-04-24 23:15:59.318065,2025-04-24 23:16:00.945834,0 days 00:00:01.627769,True,squared_error,32,log2,1,43,792,TPESampler,COMPLETE
1152,0.37372722785186635,2025-04-24 23:16:01.126214,2025-04-24 23:16:25.099307,0 days 00:00:23.973093,True,absolute_error,41,,1,4,262,TPESampler,COMPLETE
1153,0.9358269444942907,2025-04-24 23:16:02.363875,2025-04-24 23:16:03.358356,0 days 00:00:00.994481,True,squared_error,30,log2,4,4,438,TPESampler,COMPLETE
1154,0.44275763718090966,2025-04-24 23:16:03.529639,2025-04-24 23:16:38.157597,0 days 00:00:34.627958,False,absolute_error,48,,1,4,226,TPESampler,COMPLETE
1155,0.37426477182183215,2025-04-24 23:16:23.419671,2025-04-24 23:16:55.889549,0 days 00:00:32.469878,True,absolute_error,50,,1,4,360,TPESampler,COMPLETE
1156,0.41892925948558923,2025-04-24 23:16:25.265895,2025-04-24 23:16:31.110610,0 days 00:00:05.844715,True,absolute_error,50,,2,2,107,TPESampler,COMPLETE
1157,0.3713526453554486,2025-04-24 23:16:31.283143,2025-04-24 23:16:53.613334,0 days 00:00:22.330191,True,absolute_error,42,,1,3,245,TPESampler,COMPLETE
1158,0.37317250310654354,2025-04-24 23:16:38.337626,2025-04-24 23:16:48.423161,0 days 00:00:10.085535,True,absolute_error,42,,1,2,107,TPESampler,COMPLETE
1159,0.36659177666053594,2025-04-24 23:16:48.594455,2025-04-24 23:17:02.418259,0 days 00:00:13.823804,True,absolute_error,50,,1,2,147,TPESampler,COMPLETE
1160,0.5747823971861393,2025-04-24 23:16:53.786830,2025-04-24 23:16:57.754774,0 days 00:00:03.967944,True,absolute_error,49,sqrt,2,5,358,TPESampler,COMPLETE
1161,0.3681306664129636,2025-04-24 23:16:56.060134,2025-04-24 23:17:14.498275,0 days 00:00:18.438141,True,absolute_error,50,,1,2,201,TPESampler,COMPLETE
1162,0.41525646279551537,2025-04-24 23:16:57.926042,2025-04-24 23:17:10.646229,0 days 00:00:12.720187,True,absolute_error,50,,2,2,239,TPESampler,COMPLETE
1163,0.5039992970456716,2025-04-24 23:17:02.589691,2025-04-24 23:17:04.393669,0 days 00:00:01.803978,True,absolute_error,38,log2,1,3,111,TPESampler,COMPLETE
1164,0.3683635387495613,2025-04-24 23:17:04.566407,2025-04-24 23:17:24.868235,0 days 00:00:20.301828,True,absolute_error,50,,1,2,219,TPESampler,COMPLETE
1165,0.37471778771690534,2025-04-24 23:17:10.829868,2025-04-24 23:17:21.369097,0 days 00:00:10.539229,True,absolute_error,42,,1,3,111,TPESampler,COMPLETE
1166,0.41650807614792373,2025-04-24 23:17:14.664344,2025-04-24 23:17:21.247179,0 days 00:00:06.582835,True,absolute_error,50,,2,2,121,TPESampler,COMPLETE
1167,0.7159513976594621,2025-04-24 23:17:21.420644,2025-04-24 23:17:27.701850,0 days 00:00:06.281206,False,absolute_error,30,sqrt,5,49,724,TPESampler,COMPLETE
1168,0.9314716262360907,2025-04-24 23:17:21.576355,2025-04-24 23:17:23.449029,0 days 00:00:01.872674,False,absolute_error,49,log2,8,5,469,TPESampler,COMPLETE
1169,0.5680776609261681,2025-04-24 23:17:23.616353,2025-04-24 23:17:25.166622,0 days 00:00:01.550269,True,absolute_error,43,sqrt,2,2,104,TPESampler,COMPLETE
1170,0.3723264526759704,2025-04-24 23:17:25.045787,2025-04-24 23:17:35.242878,0 days 00:00:10.197091,True,absolute_error,50,,1,3,108,TPESampler,COMPLETE
1171,0.3720044163726067,2025-04-24 23:17:25.355138,2025-04-24 23:17:36.809062,0 days 00:00:11.453924,True,absolute_error,42,,1,2,120,TPESampler,COMPLETE
1172,0.4128120854986149,2025-04-24 23:17:27.874179,2025-04-24 23:17:48.696326,0 days 00:00:20.822147,True,absolute_error,43,,2,3,408,TPESampler,COMPLETE
1173,0.45038005487639654,2025-04-24 23:17:35.404968,2025-04-24 23:17:40.603717,0 days 00:00:05.198749,True,absolute_error,50,log2,1,2,347,TPESampler,COMPLETE
1174,0.47956296325439773,2025-04-24 23:17:36.982746,2025-04-24 23:17:48.697731,0 days 00:00:11.714985,False,absolute_error,45,,2,2,122,TPESampler,COMPLETE
1175,0.3674474952065946,2025-04-24 23:17:40.781647,2025-04-24 23:18:08.641646,0 days 00:00:27.859999,True,absolute_error,50,,1,2,294,TPESampler,COMPLETE
1176,0.36969947295524247,2025-04-24 23:17:49.016670,2025-04-24 23:18:00.438942,0 days 00:00:11.422272,True,absolute_error,50,,1,3,116,TPESampler,COMPLETE
1177,0.3714031405817967,2025-04-24 23:17:49.092179,2025-04-24 23:18:12.123016,0 days 00:00:23.030837,True,absolute_error,41,,1,2,227,TPESampler,COMPLETE
1178,0.9320198742935532,2025-04-24 23:18:00.607851,2025-04-24 23:18:02.320864,0 days 00:00:01.713013,False,absolute_error,20,log2,8,2,497,TPESampler,COMPLETE
1179,0.38253751881454007,2025-04-24 23:18:02.499960,2025-04-24 23:18:04.188283,0 days 00:00:01.688323,True,squared_error,42,,1,2,179,TPESampler,COMPLETE
1180,0.37379423487692864,2025-04-24 23:18:04.378928,2025-04-24 23:18:15.504835,0 days 00:00:11.125907,True,absolute_error,44,,1,2,110,TPESampler,COMPLETE
1181,0.3721441358247188,2025-04-24 23:18:09.011612,2025-04-24 23:18:57.120134,0 days 00:00:48.108522,True,absolute_error,40,,1,2,436,TPESampler,COMPLETE
1182,0.36907935644727785,2025-04-24 23:18:12.295748,2025-04-24 23:19:02.819473,0 days 00:00:50.523725,True,absolute_error,49,,1,2,419,TPESampler,COMPLETE
1183,0.41298754899206974,2025-04-24 23:18:15.693867,2025-04-24 23:18:43.856103,0 days 00:00:28.162236,True,absolute_error,49,,2,2,400,TPESampler,COMPLETE
1184,0.37079094103280813,2025-04-24 23:18:44.031314,2025-04-24 23:19:30.465729,0 days 00:00:46.434415,True,absolute_error,50,,1,2,386,TPESampler,COMPLETE
1185,0.37311524208122276,2025-04-24 23:18:57.293949,2025-04-24 23:19:40.984322,0 days 00:00:43.690373,True,absolute_error,44,,1,2,360,TPESampler,COMPLETE
1186,0.41627508302385086,2025-04-24 23:19:02.991227,2025-04-24 23:19:13.490278,0 days 00:00:10.499051,True,absolute_error,30,,2,2,180,TPESampler,COMPLETE
1187,0.4141673473414703,2025-04-24 23:19:13.664659,2025-04-24 23:19:42.470736,0 days 00:00:28.806077,True,absolute_error,49,,2,4,384,TPESampler,COMPLETE
1188,0.4155250468509975,2025-04-24 23:19:30.643072,2025-04-24 23:19:46.901911,0 days 00:00:16.258839,True,absolute_error,50,,2,2,254,TPESampler,COMPLETE
1189,0.953326922337541,2025-04-24 23:19:41.168387,2025-04-24 23:19:42.946852,0 days 00:00:01.778465,True,squared_error,50,log2,6,2,987,TPESampler,COMPLETE
1190,0.40991459659068014,2025-04-24 23:19:42.656288,2025-04-24 23:19:45.214294,0 days 00:00:02.558006,True,absolute_error,46,sqrt,1,2,104,TPESampler,COMPLETE
1191,0.3681956138915034,2025-04-24 23:19:43.133191,2025-04-24 23:20:12.899318,0 days 00:00:29.766127,True,absolute_error,46,,1,2,289,TPESampler,COMPLETE
1192,0.37361579753856056,2025-04-24 23:19:45.389987,2025-04-24 23:20:13.041155,0 days 00:00:27.651168,True,absolute_error,43,,1,4,269,TPESampler,COMPLETE
1193,0.4985547352787834,2025-04-24 23:19:47.075985,2025-04-24 23:20:14.748787,0 days 00:00:27.672802,False,absolute_error,27,,2,9,224,TPESampler,COMPLETE
1194,0.3695849831665842,2025-04-24 23:20:13.059064,2025-04-24 23:20:46.274011,0 days 00:00:33.214947,True,absolute_error,43,,1,2,293,TPESampler,COMPLETE
1195,0.9644446885106254,2025-04-24 23:20:13.222611,2025-04-24 23:20:14.399435,0 days 00:00:01.176824,False,squared_error,6,log2,10,3,690,TPESampler,COMPLETE
1196,0.7601096374428888,2025-04-24 23:20:14.565839,2025-04-24 23:20:16.349288,0 days 00:00:01.783449,False,absolute_error,47,log2,2,3,121,TPESampler,COMPLETE
1197,0.4619713027250422,2025-04-24 23:20:15.057827,2025-04-24 23:20:17.354918,0 days 00:00:02.297091,False,squared_error,31,,1,28,351,TPESampler,COMPLETE
1198,0.6353298773205378,2025-04-24 23:20:16.523119,2025-04-24 23:20:17.283157,0 days 00:00:00.760038,True,squared_error,19,sqrt,2,38,148,TPESampler,COMPLETE
1199,0.3702949326455559,2025-04-24 23:20:17.428065,2025-04-24 23:20:49.613993,0 days 00:00:32.185928,True,absolute_error,50,,1,3,278,TPESampler,COMPLETE
1200,0.44440772522897415,2025-04-24 23:20:17.536909,2025-04-24 23:20:20.019643,0 days 00:00:02.482734,True,absolute_error,49,log2,1,2,116,TPESampler,COMPLETE
1201,0.661420962045218,2025-04-24 23:20:20.214609,2025-04-24 23:20:21.137074,0 days 00:00:00.922465,False,squared_error,12,sqrt,1,25,310,TPESampler,COMPLETE
1202,0.414871760546319,2025-04-24 23:20:21.318342,2025-04-24 23:20:38.837354,0 days 00:00:17.519012,True,absolute_error,41,,2,2,230,TPESampler,COMPLETE
1203,0.3697256285825488,2025-04-24 23:20:39.015531,2025-04-24 23:21:02.497358,0 days 00:00:23.481827,True,absolute_error,43,,1,2,251,TPESampler,COMPLETE
1204,0.3679782471480686,2025-04-24 23:20:46.454710,2025-04-24 23:21:11.578640,0 days 00:00:25.123930,True,absolute_error,50,,1,2,274,TPESampler,COMPLETE
1205,0.3790777088622092,2025-04-24 23:20:49.784772,2025-04-24 23:20:59.622958,0 days 00:00:09.838186,True,absolute_error,41,,1,4,103,TPESampler,COMPLETE
1206,0.3743576380712829,2025-04-24 23:20:59.799159,2025-04-24 23:21:13.138220,0 days 00:00:13.339061,True,absolute_error,50,,1,4,143,TPESampler,COMPLETE
1207,0.41496410343272466,2025-04-24 23:21:02.672074,2025-04-24 23:21:16.744264,0 days 00:00:14.072190,True,absolute_error,50,,2,2,250,TPESampler,COMPLETE
1208,0.3677429280449965,2025-04-24 23:21:11.780172,2025-04-24 23:21:45.871844,0 days 00:00:34.091672,True,absolute_error,50,,1,2,295,TPESampler,COMPLETE
1209,0.369916847608108,2025-04-24 23:21:13.333791,2025-04-24 23:21:51.285239,0 days 00:00:37.951448,True,absolute_error,50,,1,2,319,TPESampler,COMPLETE
1210,0.3714119224541391,2025-04-24 23:21:16.916562,2025-04-24 23:21:43.857479,0 days 00:00:26.940917,True,absolute_error,48,,1,4,298,TPESampler,COMPLETE
1211,0.4429458825675819,2025-04-24 23:21:44.035650,2025-04-24 23:22:00.031756,0 days 00:00:15.996106,False,absolute_error,50,,1,2,102,TPESampler,COMPLETE
1212,0.36922252153706214,2025-04-24 23:21:46.046364,2025-04-24 23:22:38.339232,0 days 00:00:52.292868,True,absolute_error,50,,1,2,470,TPESampler,COMPLETE
1213,0.37384646679745537,2025-04-24 23:21:51.461964,2025-04-24 23:22:16.203993,0 days 00:00:24.742029,True,absolute_error,50,,1,4,246,TPESampler,COMPLETE
1214,0.5038762256258065,2025-04-24 23:22:00.212194,2025-04-24 23:22:08.552557,0 days 00:00:08.340363,True,absolute_error,31,sqrt,1,17,350,TPESampler,COMPLETE
1215,0.788521132250372,2025-04-24 23:22:08.936619,2025-04-24 23:22:10.196768,0 days 00:00:01.260149,False,squared_error,9,sqrt,6,6,303,TPESampler,COMPLETE
1216,0.3688006208258982,2025-04-24 23:22:10.375796,2025-04-24 23:22:29.793476,0 days 00:00:19.417680,True,absolute_error,50,,1,2,192,TPESampler,COMPLETE
1217,0.3688532140341363,2025-04-24 23:22:16.382681,2025-04-24 23:22:48.039291,0 days 00:00:31.656610,True,absolute_error,50,,1,3,299,TPESampler,COMPLETE
1218,0.3672300057715447,2025-04-24 23:22:29.969459,2025-04-24 23:22:45.535268,0 days 00:00:15.565809,True,absolute_error,50,,1,2,167,TPESampler,COMPLETE
1219,0.8447122539156946,2025-04-24 23:22:38.508825,2025-04-24 23:22:39.627445,0 days 00:00:01.118620,True,squared_error,31,log2,2,19,512,TPESampler,COMPLETE
1220,0.37148650973038616,2025-04-24 23:22:39.793825,2025-04-24 23:22:49.776361,0 days 00:00:09.982536,True,absolute_error,49,,1,2,105,TPESampler,COMPLETE
1221,0.5548790114006088,2025-04-24 23:22:45.944380,2025-04-24 23:22:47.380890,0 days 00:00:01.436510,False,squared_error,25,,6,44,157,TPESampler,COMPLETE
1222,0.3693420233012815,2025-04-24 23:22:47.761498,2025-04-24 23:22:59.634067,0 days 00:00:11.872569,True,absolute_error,50,,1,2,121,TPESampler,COMPLETE
1223,0.41652439357099497,2025-04-24 23:22:48.408506,2025-04-24 23:23:02.822259,0 days 00:00:14.413753,True,absolute_error,43,,2,3,265,TPESampler,COMPLETE
1224,0.3702020774573369,2025-04-24 23:22:49.948319,2025-04-24 23:23:10.177843,0 days 00:00:20.229524,True,absolute_error,42,,1,2,196,TPESampler,COMPLETE
1225,0.37248475598438796,2025-04-24 23:22:59.812358,2025-04-24 23:23:12.694268,0 days 00:00:12.881910,True,absolute_error,46,,1,2,113,TPESampler,COMPLETE
1226,0.8996183396865871,2025-04-24 23:23:02.998663,2025-04-24 23:23:04.023056,0 days 00:00:01.024393,False,squared_error,45,sqrt,15,39,632,TPESampler,COMPLETE
1227,0.4144282522092182,2025-04-24 23:23:04.196904,2025-04-24 23:23:21.618698,0 days 00:00:17.421794,True,absolute_error,42,,2,2,297,TPESampler,COMPLETE
1228,0.3662201483369652,2025-04-24 23:23:10.354319,2025-04-24 23:23:25.681204,0 days 00:00:15.326885,True,absolute_error,50,,1,2,164,TPESampler,COMPLETE
1229,0.4158196845599253,2025-04-24 23:23:12.870823,2025-04-24 23:23:22.210149,0 days 00:00:09.339326,True,absolute_error,50,,2,4,174,TPESampler,COMPLETE
1230,0.68910451420702,2025-04-24 23:23:21.791243,2025-04-24 23:23:24.608785,0 days 00:00:02.817542,False,squared_error,5,,14,22,738,TPESampler,COMPLETE
1231,0.43661294266596756,2025-04-24 23:23:22.581340,2025-04-24 23:24:09.893252,0 days 00:00:47.311912,False,absolute_error,49,,1,2,306,TPESampler,COMPLETE
1232,0.3864520737465626,2025-04-24 23:23:24.780913,2025-04-24 23:23:50.350240,0 days 00:00:25.569327,True,absolute_error,49,,1,11,288,TPESampler,COMPLETE
1233,0.37462787041750595,2025-04-24 23:23:25.852625,2025-04-24 23:23:35.406559,0 days 00:00:09.553934,True,absolute_error,45,,1,3,102,TPESampler,COMPLETE
1234,0.3692015688017653,2025-04-24 23:23:35.580339,2025-04-24 23:23:47.767883,0 days 00:00:12.187544,True,absolute_error,50,,1,2,130,TPESampler,COMPLETE
1235,0.8001415351886588,2025-04-24 23:23:47.953479,2025-04-24 23:23:49.043808,0 days 00:00:01.090329,True,squared_error,49,sqrt,5,2,376,TPESampler,COMPLETE
1236,0.4201018890298708,2025-04-24 23:23:49.259639,2025-04-24 23:23:55.086684,0 days 00:00:05.827045,True,absolute_error,45,,2,2,106,TPESampler,COMPLETE
1237,0.36743302524744326,2025-04-24 23:23:50.525532,2025-04-24 23:24:03.883181,0 days 00:00:13.357649,True,absolute_error,50,,1,2,143,TPESampler,COMPLETE
1238,0.3698078779762143,2025-04-24 23:23:55.270102,2025-04-24 23:24:17.043746,0 days 00:00:21.773644,True,absolute_error,50,,1,3,239,TPESampler,COMPLETE
1239,0.37507493612333714,2025-04-24 23:24:04.064745,2025-04-24 23:24:14.779029,0 days 00:00:10.714284,True,absolute_error,43,,1,3,112,TPESampler,COMPLETE
1240,0.3734466542804507,2025-04-24 23:24:10.097576,2025-04-24 23:24:20.467303,0 days 00:00:10.369727,True,absolute_error,41,,1,2,107,TPESampler,COMPLETE
1241,0.36848092068968324,2025-04-24 23:24:14.963231,2025-04-24 23:24:27.723126,0 days 00:00:12.759895,True,absolute_error,50,,1,2,131,TPESampler,COMPLETE
1242,0.37394932933088604,2025-04-24 23:24:17.224610,2025-04-24 23:24:27.802194,0 days 00:00:10.577584,True,absolute_error,43,,1,2,112,TPESampler,COMPLETE
1243,0.3686877219238465,2025-04-24 23:24:20.674185,2025-04-24 23:24:33.139232,0 days 00:00:12.465047,True,absolute_error,49,,1,2,132,TPESampler,COMPLETE
1244,0.4154839691782877,2025-04-24 23:24:27.880998,2025-04-24 23:24:38.131317,0 days 00:00:10.250319,True,absolute_error,50,,2,2,190,TPESampler,COMPLETE
1245,0.3683036712253051,2025-04-24 23:24:27.992864,2025-04-24 23:24:46.616911,0 days 00:00:18.624047,True,absolute_error,50,,1,2,200,TPESampler,COMPLETE
1246,0.3690767742061877,2025-04-24 23:24:33.310564,2025-04-24 23:24:44.433702,0 days 00:00:11.123138,True,absolute_error,50,,1,3,118,TPESampler,COMPLETE
1247,0.4396176068604486,2025-04-24 23:24:38.305330,2025-04-24 23:24:55.544788,0 days 00:00:17.239458,False,absolute_error,49,,1,5,111,TPESampler,COMPLETE
1248,0.3981547742290269,2025-04-24 23:24:44.612716,2025-04-24 23:24:48.919351,0 days 00:00:04.306635,False,squared_error,31,,1,4,506,TPESampler,COMPLETE
1249,0.3691575273961152,2025-04-24 23:24:46.791525,2025-04-24 23:24:59.522740,0 days 00:00:12.731215,True,absolute_error,50,,1,2,135,TPESampler,COMPLETE
1250,0.42100911780941397,2025-04-24 23:24:49.092927,2025-04-24 23:24:50.167547,0 days 00:00:01.074620,True,squared_error,45,,2,2,114,TPESampler,COMPLETE
1251,0.3696293280490264,2025-04-24 23:24:50.342302,2025-04-24 23:25:13.789092,0 days 00:00:23.446790,True,absolute_error,42,,1,2,258,TPESampler,COMPLETE
1252,0.3718222711203207,2025-04-24 23:24:55.731491,2025-04-24 23:25:05.771073,0 days 00:00:10.039582,True,absolute_error,49,,1,2,106,TPESampler,COMPLETE
1253,0.41796162552520166,2025-04-24 23:24:59.706099,2025-04-24 23:25:06.705986,0 days 00:00:06.999887,True,absolute_error,41,,2,3,128,TPESampler,COMPLETE
1254,0.37037616877716584,2025-04-24 23:25:05.951678,2025-04-24 23:25:18.461173,0 days 00:00:12.509495,True,absolute_error,49,,1,2,124,TPESampler,COMPLETE
1255,0.3752370616241975,2025-04-24 23:25:06.882960,2025-04-24 23:25:16.510805,0 days 00:00:09.627845,True,absolute_error,48,,1,2,101,TPESampler,COMPLETE
1256,0.3676182657108608,2025-04-24 23:25:13.972196,2025-04-24 23:25:43.426459,0 days 00:00:29.454263,True,absolute_error,42,,1,2,287,TPESampler,COMPLETE
1257,0.8336852320668215,2025-04-24 23:25:16.685942,2025-04-24 23:25:18.492186,0 days 00:00:01.806244,True,absolute_error,35,log2,2,2,272,TPESampler,COMPLETE
1258,0.4207277885274291,2025-04-24 23:25:18.599255,2025-04-24 23:25:24.806542,0 days 00:00:06.207287,True,absolute_error,45,,2,2,102,TPESampler,COMPLETE
1259,0.41590220211014217,2025-04-24 23:25:18.650571,2025-04-24 23:25:25.702285,0 days 00:00:07.051714,True,absolute_error,44,,2,2,119,TPESampler,COMPLETE
1260,0.9588138953788035,2025-04-24 23:25:24.986928,2025-04-24 23:25:25.657290,0 days 00:00:00.670362,False,squared_error,34,log2,7,42,144,TPESampler,COMPLETE
1261,0.37107712146165955,2025-04-24 23:25:25.803537,2025-04-24 23:25:36.294673,0 days 00:00:10.491136,True,absolute_error,50,,1,3,110,TPESampler,COMPLETE
1262,0.36858642688951,2025-04-24 23:25:25.846594,2025-04-24 23:25:52.724445,0 days 00:00:26.877851,True,absolute_error,50,,1,2,265,TPESampler,COMPLETE
1263,0.3684101595934685,2025-04-24 23:25:36.504481,2025-04-24 23:26:04.662677,0 days 00:00:28.158196,True,absolute_error,50,,1,2,307,TPESampler,COMPLETE
1264,0.37228867096938206,2025-04-24 23:25:43.606488,2025-04-24 23:25:53.259485,0 days 00:00:09.652997,True,absolute_error,50,,1,2,102,TPESampler,COMPLETE
1265,0.36756246439513407,2025-04-24 23:25:52.898748,2025-04-24 23:26:20.078829,0 days 00:00:27.180081,True,absolute_error,50,,1,2,250,TPESampler,COMPLETE
1266,0.37414337485858534,2025-04-24 23:25:53.528785,2025-04-24 23:26:07.360920,0 days 00:00:13.832135,True,absolute_error,49,,1,4,150,TPESampler,COMPLETE
1267,0.3871294610070344,2025-04-24 23:26:04.836719,2025-04-24 23:26:08.701649,0 days 00:00:03.864930,True,squared_error,40,,1,2,485,TPESampler,COMPLETE
1268,0.3705825254778677,2025-04-24 23:26:07.535483,2025-04-24 23:26:39.873834,0 days 00:00:32.338351,True,absolute_error,44,,1,2,285,TPESampler,COMPLETE
