number,value,datetime_start,datetime_complete,duration,params_bootstrap,params_criterion,params_max_depth,params_max_features,params_min_samples_leaf,params_min_samples_split,params_n_estimators,system_attrs_auto:sampler,state
2255,0.3722132380128064,2025-04-25 00:57:13.333234,2025-04-25 00:57:23.649172,0 days 00:00:10.315938,True,absolute_error,50,,1,3,109,TPESampler,COMPLETE
2256,0.512432964196115,2025-04-25 00:57:23.603398,2025-04-25 00:57:27.905559,0 days 00:00:04.302161,True,absolute_error,50,,6,2,184,TPESampler,COMPLETE
2257,0.4228771256679887,2025-04-25 00:57:23.968439,2025-04-25 00:57:33.834922,0 days 00:00:09.866483,True,absolute_error,42,,2,9,184,TPESampler,COMPLETE
2258,0.41555657989150385,2025-04-25 00:57:26.427950,2025-04-25 00:57:32.990577,0 days 00:00:06.562627,True,absolute_error,42,,2,4,118,TPESampler,COMPLETE
2259,0.37219823753726833,2025-04-25 00:57:28.127337,2025-04-25 00:57:47.972723,0 days 00:00:19.845386,True,absolute_error,44,,1,2,213,TPESampler,COMPLETE
2260,0.37228867096938206,2025-04-25 00:57:33.172661,2025-04-25 00:57:42.878714,0 days 00:00:09.706053,True,absolute_error,50,,1,2,102,TPESampler,COMPLETE
2261,0.3712375501378945,2025-04-25 00:57:34.025887,2025-04-25 00:57:54.199668,0 days 00:00:20.173781,True,absolute_error,43,,1,2,219,TPESampler,COMPLETE
2262,0.4201018890298708,2025-04-25 00:57:43.070318,2025-04-25 00:57:49.228366,0 days 00:00:06.158048,True,absolute_error,50,,2,2,106,TPESampler,COMPLETE
2263,0.4352098288745387,2025-04-25 00:57:48.397101,2025-04-25 00:57:53.335698,0 days 00:00:04.938597,True,squared_error,25,,2,15,984,TPESampler,COMPLETE
2264,0.37470357305863533,2025-04-25 00:57:49.615833,2025-04-25 00:58:01.757321,0 days 00:00:12.141488,True,absolute_error,41,,1,4,118,TPESampler,COMPLETE
2265,0.37209385743115114,2025-04-25 00:57:53.604634,2025-04-25 00:58:25.195659,0 days 00:00:31.591025,True,absolute_error,43,,1,2,346,TPESampler,COMPLETE
2266,0.37319806593661226,2025-04-25 00:57:54.498890,2025-04-25 00:58:05.729591,0 days 00:00:11.230701,True,absolute_error,42,,1,2,105,TPESampler,COMPLETE
2267,0.4447813784050627,2025-04-25 00:58:01.945804,2025-04-25 00:58:06.458334,0 days 00:00:04.512530,True,absolute_error,50,log2,1,2,238,TPESampler,COMPLETE
2268,0.3836575766636332,2025-04-25 00:58:05.920059,2025-04-25 00:58:16.804166,0 days 00:00:10.884107,True,absolute_error,48,,1,10,117,TPESampler,COMPLETE
2269,0.367751304575083,2025-04-25 00:58:06.771116,2025-04-25 00:58:33.907490,0 days 00:00:27.136374,True,absolute_error,50,,1,2,293,TPESampler,COMPLETE
2270,0.37135576860415637,2025-04-25 00:58:16.996306,2025-04-25 00:58:26.555905,0 days 00:00:09.559599,True,absolute_error,50,,1,2,101,TPESampler,COMPLETE
2271,0.3679782471480686,2025-04-25 00:58:25.387646,2025-04-25 00:58:51.099366,0 days 00:00:25.711720,True,absolute_error,50,,1,2,274,TPESampler,COMPLETE
2272,0.8885195022226091,2025-04-25 00:58:26.744053,2025-04-25 00:58:30.478577,0 days 00:00:03.734524,False,absolute_error,5,log2,1,39,515,TPESampler,COMPLETE
2273,0.37055029901452635,2025-04-25 00:58:30.671296,2025-04-25 00:59:00.709346,0 days 00:00:30.038050,True,absolute_error,43,,1,3,307,TPESampler,COMPLETE
2274,0.4140716682546248,2025-04-25 00:58:34.103051,2025-04-25 00:58:45.230539,0 days 00:00:11.127488,True,absolute_error,43,,2,3,211,TPESampler,COMPLETE
2275,0.4154734306582222,2025-04-25 00:58:45.426373,2025-04-25 00:58:54.532018,0 days 00:00:09.105645,True,absolute_error,41,sqrt,1,3,307,TPESampler,COMPLETE
2276,0.3689090486705741,2025-04-25 00:58:51.295165,2025-04-25 00:59:14.360439,0 days 00:00:23.065274,True,absolute_error,50,,1,2,241,TPESampler,COMPLETE
2277,0.375765516802002,2025-04-25 00:58:54.775665,2025-04-25 00:59:05.181428,0 days 00:00:10.405763,True,absolute_error,44,,1,2,106,TPESampler,COMPLETE
2278,0.4155669253462588,2025-04-25 00:59:00.903180,2025-04-25 00:59:11.304548,0 days 00:00:10.401368,True,absolute_error,50,,2,4,192,TPESampler,COMPLETE
2279,0.37040915815819536,2025-04-25 00:59:05.399547,2025-04-25 00:59:36.244683,0 days 00:00:30.845136,True,absolute_error,50,,1,2,321,TPESampler,COMPLETE
2280,0.6661334641718416,2025-04-25 00:59:11.488925,2025-04-25 00:59:15.615064,0 days 00:00:04.126139,False,squared_error,39,,12,2,969,TPESampler,COMPLETE
2281,0.4167395491959733,2025-04-25 00:59:14.566501,2025-04-25 00:59:21.887468,0 days 00:00:07.320967,True,absolute_error,50,,2,2,131,TPESampler,COMPLETE
2282,0.4207277885274291,2025-04-25 00:59:15.799954,2025-04-25 00:59:21.612176,0 days 00:00:05.812222,True,absolute_error,50,,2,2,102,TPESampler,COMPLETE
2283,0.37365812295838635,2025-04-25 00:59:21.809972,2025-04-25 00:59:32.390199,0 days 00:00:10.580227,True,absolute_error,50,,1,3,102,TPESampler,COMPLETE
2284,0.7364999433659126,2025-04-25 00:59:22.165342,2025-04-25 00:59:23.744814,0 days 00:00:01.579472,True,squared_error,8,sqrt,1,2,713,TPESampler,COMPLETE
2285,0.40179491878923457,2025-04-25 00:59:23.934553,2025-04-25 00:59:29.036577,0 days 00:00:05.102024,True,absolute_error,44,sqrt,1,2,213,TPESampler,COMPLETE
2286,0.36960880593697626,2025-04-25 00:59:29.240081,2025-04-25 00:59:52.725132,0 days 00:00:23.485051,True,absolute_error,50,,1,3,248,TPESampler,COMPLETE
2287,0.3697689572244431,2025-04-25 00:59:32.648010,2025-04-25 01:00:19.096664,0 days 00:00:46.448654,True,absolute_error,50,,1,2,485,TPESampler,COMPLETE
2288,0.37135576860415637,2025-04-25 00:59:36.441584,2025-04-25 00:59:46.493513,0 days 00:00:10.051929,True,absolute_error,50,,1,2,101,TPESampler,COMPLETE
2289,0.4146594122801588,2025-04-25 00:59:46.689654,2025-04-25 01:00:07.931711,0 days 00:00:21.242057,True,absolute_error,50,,2,4,364,TPESampler,COMPLETE
2290,0.4147655605113216,2025-04-25 00:59:52.920330,2025-04-25 00:59:55.678998,0 days 00:00:02.758668,True,absolute_error,49,sqrt,1,3,121,TPESampler,COMPLETE
2291,0.44248914296537184,2025-04-25 00:59:55.871163,2025-04-25 01:00:11.698511,0 days 00:00:15.827348,False,absolute_error,50,,1,2,100,TPESampler,COMPLETE
2292,0.3788312473177924,2025-04-25 01:00:08.123510,2025-04-25 01:00:17.838637,0 days 00:00:09.715127,True,absolute_error,43,,1,4,103,TPESampler,COMPLETE
2293,0.4153421988288678,2025-04-25 01:00:11.904347,2025-04-25 01:00:24.148708,0 days 00:00:12.244361,True,absolute_error,50,,2,2,232,TPESampler,COMPLETE
2294,0.37224083562075555,2025-04-25 01:00:18.039628,2025-04-25 01:00:47.631351,0 days 00:00:29.591723,True,absolute_error,43,,1,2,322,TPESampler,COMPLETE
2295,0.3760372734651223,2025-04-25 01:00:19.285405,2025-04-25 01:00:29.693137,0 days 00:00:10.407732,True,absolute_error,42,,1,3,107,TPESampler,COMPLETE
2296,0.415007469228944,2025-04-25 01:00:24.337377,2025-04-25 01:00:39.322717,0 days 00:00:14.985340,True,absolute_error,50,,2,4,285,TPESampler,COMPLETE
2297,0.4147173909666637,2025-04-25 01:00:29.892387,2025-04-25 01:00:49.203440,0 days 00:00:19.311053,True,absolute_error,42,,2,3,376,TPESampler,COMPLETE
2298,0.4429770107401967,2025-04-25 01:00:39.519029,2025-04-25 01:01:24.961906,0 days 00:00:45.442877,False,absolute_error,40,,1,2,296,TPESampler,COMPLETE
2299,0.3689090486705741,2025-04-25 01:00:47.820880,2025-04-25 01:01:10.002936,0 days 00:00:22.182056,True,absolute_error,50,,1,2,241,TPESampler,COMPLETE
2300,0.37267686303527936,2025-04-25 01:00:49.400941,2025-04-25 01:01:12.213712,0 days 00:00:22.812771,True,absolute_error,42,,1,4,252,TPESampler,COMPLETE
2301,0.49345497709083963,2025-04-25 01:01:10.195638,2025-04-25 01:01:12.212738,0 days 00:00:02.017100,True,squared_error,47,log2,1,7,835,TPESampler,COMPLETE
2302,0.36822323800329243,2025-04-25 01:01:12.353931,2025-04-25 01:01:25.372703,0 days 00:00:13.018772,True,absolute_error,50,,1,2,117,TPESampler,COMPLETE
2303,0.37368314438133915,2025-04-25 01:01:12.408352,2025-04-25 01:01:36.570971,0 days 00:00:24.162619,True,absolute_error,43,,1,4,247,TPESampler,COMPLETE
2304,0.37218486904462195,2025-04-25 01:01:25.155190,2025-04-25 01:01:52.150148,0 days 00:00:26.994958,True,absolute_error,50,,1,4,298,TPESampler,COMPLETE
2305,0.4421132375571412,2025-04-25 01:01:25.637913,2025-04-25 01:01:45.137581,0 days 00:00:19.499668,False,absolute_error,49,,1,4,125,TPESampler,COMPLETE
2306,0.36810321448733624,2025-04-25 01:01:36.763443,2025-04-25 01:02:06.194395,0 days 00:00:29.430952,True,absolute_error,42,,1,2,299,TPESampler,COMPLETE
2307,0.36872667675774295,2025-04-25 01:01:45.327424,2025-04-25 01:02:11.398010,0 days 00:00:26.070586,True,absolute_error,50,,1,2,269,TPESampler,COMPLETE
2308,0.45018540955998104,2025-04-25 01:01:52.344589,2025-04-25 01:01:54.096136,0 days 00:00:01.751547,True,squared_error,46,sqrt,1,14,653,TPESampler,COMPLETE
2309,0.3829531738618748,2025-04-25 01:01:54.289533,2025-04-25 01:02:37.620540,0 days 00:00:43.331007,True,absolute_error,50,,1,9,434,TPESampler,COMPLETE
2310,0.4147075800421926,2025-04-25 01:02:06.385607,2025-04-25 01:02:22.726429,0 days 00:00:16.340822,True,absolute_error,42,,2,2,284,TPESampler,COMPLETE
2311,0.4404489684214697,2025-04-25 01:02:11.589171,2025-04-25 01:02:15.640064,0 days 00:00:04.050893,True,squared_error,48,,1,25,800,TPESampler,COMPLETE
2312,0.37836925706782243,2025-04-25 01:02:15.874919,2025-04-25 01:02:30.477762,0 days 00:00:14.602843,True,absolute_error,50,,1,4,125,TPESampler,COMPLETE
2313,0.5305632127636928,2025-04-25 01:02:22.948246,2025-04-25 01:02:33.859528,0 days 00:00:10.911282,False,absolute_error,30,sqrt,2,2,421,TPESampler,COMPLETE
2314,0.3688565899596876,2025-04-25 01:02:30.663675,2025-04-25 01:02:49.768867,0 days 00:00:19.105192,True,absolute_error,50,,1,2,196,TPESampler,COMPLETE
2315,0.3735598750913221,2025-04-25 01:02:34.049280,2025-04-25 01:02:43.670859,0 days 00:00:09.621579,True,absolute_error,42,,1,2,101,TPESampler,COMPLETE
2316,0.4163502674655036,2025-04-25 01:02:37.814967,2025-04-25 01:02:51.732457,0 days 00:00:13.917490,True,absolute_error,44,,2,2,257,TPESampler,COMPLETE
2317,0.8212124874286322,2025-04-25 01:02:43.863763,2025-04-25 01:02:45.086581,0 days 00:00:01.222818,True,absolute_error,49,log2,2,2,126,TPESampler,COMPLETE
2318,0.3696202126748104,2025-04-25 01:02:45.703508,2025-04-25 01:03:13.827073,0 days 00:00:28.123565,True,absolute_error,50,,1,3,246,TPESampler,COMPLETE
2319,0.5688618047258933,2025-04-25 01:02:50.129869,2025-04-25 01:02:54.000451,0 days 00:00:03.870582,True,absolute_error,43,sqrt,2,3,272,TPESampler,COMPLETE
2320,0.36953691948567546,2025-04-25 01:02:51.967828,2025-04-25 01:03:23.648444,0 days 00:00:31.680616,True,absolute_error,43,,1,2,291,TPESampler,COMPLETE
2321,0.6309995038867438,2025-04-25 01:02:54.191447,2025-04-25 01:03:10.678124,0 days 00:00:16.486677,False,absolute_error,27,,15,2,643,TPESampler,COMPLETE
2322,0.3696202126748104,2025-04-25 01:03:10.860467,2025-04-25 01:03:36.226245,0 days 00:00:25.365778,True,absolute_error,50,,1,3,246,TPESampler,COMPLETE
2323,0.7788296753827108,2025-04-25 01:03:14.021212,2025-04-25 01:03:15.246300,0 days 00:00:01.225088,False,squared_error,43,log2,2,7,627,TPESampler,COMPLETE
2324,0.372068439234401,2025-04-25 01:03:15.448996,2025-04-25 01:03:26.035392,0 days 00:00:10.586396,True,absolute_error,42,,1,2,111,TPESampler,COMPLETE
2325,0.44224299533247624,2025-04-25 01:03:23.833375,2025-04-25 01:04:07.481577,0 days 00:00:43.648202,False,absolute_error,50,,1,2,281,TPESampler,COMPLETE
2326,0.3702857862558931,2025-04-25 01:03:26.223193,2025-04-25 01:03:51.203768,0 days 00:00:24.980575,True,absolute_error,50,,1,3,245,TPESampler,COMPLETE
2327,0.3692137684970137,2025-04-25 01:03:36.415869,2025-04-25 01:03:59.938903,0 days 00:00:23.523034,True,absolute_error,42,,1,2,247,TPESampler,COMPLETE
2328,0.7470842852296035,2025-04-25 01:03:51.391920,2025-04-25 01:03:56.229059,0 days 00:00:04.837139,True,absolute_error,45,sqrt,4,3,841,TPESampler,COMPLETE
2329,0.8624064173670307,2025-04-25 01:03:56.415733,2025-04-25 01:03:57.529193,0 days 00:00:01.113460,False,absolute_error,34,sqrt,12,10,164,TPESampler,COMPLETE
2330,0.37159034679541325,2025-04-25 01:03:57.715001,2025-04-25 01:05:02.258070,0 days 00:01:04.543069,True,absolute_error,41,,1,2,617,TPESampler,COMPLETE
2331,0.36822323800329243,2025-04-25 01:04:00.137058,2025-04-25 01:04:12.752569,0 days 00:00:12.615511,True,absolute_error,50,,1,2,117,TPESampler,COMPLETE
2332,0.3683872561975951,2025-04-25 01:04:07.674070,2025-04-25 01:04:37.920347,0 days 00:00:30.246277,True,absolute_error,50,,1,2,220,TPESampler,COMPLETE
2333,0.49941660165291013,2025-04-25 01:04:12.941683,2025-04-25 01:04:17.857411,0 days 00:00:04.915728,False,absolute_error,35,log2,1,2,202,TPESampler,COMPLETE
2334,0.3708390772198242,2025-04-25 01:04:18.049438,2025-04-25 01:04:51.630725,0 days 00:00:33.581287,True,absolute_error,43,,1,2,270,TPESampler,COMPLETE
2335,0.37598138225107613,2025-04-25 01:04:38.109174,2025-04-25 01:04:48.715293,0 days 00:00:10.606119,True,absolute_error,50,,1,4,113,TPESampler,COMPLETE
2336,0.3701524251443083,2025-04-25 01:04:48.897655,2025-04-25 01:05:23.080058,0 days 00:00:34.182403,True,absolute_error,50,,1,2,326,TPESampler,COMPLETE
2337,0.4155669253462588,2025-04-25 01:04:51.819540,2025-04-25 01:05:01.965137,0 days 00:00:10.145597,True,absolute_error,50,,2,2,192,TPESampler,COMPLETE
2338,0.5189035070625427,2025-04-25 01:05:02.158792,2025-04-25 01:05:14.808903,0 days 00:00:12.650111,False,absolute_error,38,sqrt,2,4,631,TPESampler,COMPLETE
2339,0.45484883700261614,2025-04-25 01:05:02.563051,2025-04-25 01:05:36.399380,0 days 00:00:33.836329,True,absolute_error,13,,1,7,385,TPESampler,COMPLETE
2340,0.3710335942446606,2025-04-25 01:05:15.003123,2025-04-25 01:05:36.332728,0 days 00:00:21.329605,True,absolute_error,41,,1,2,233,TPESampler,COMPLETE
2341,0.5655614815458957,2025-04-25 01:05:23.273533,2025-04-25 01:05:25.677153,0 days 00:00:02.403620,True,absolute_error,50,sqrt,2,4,180,TPESampler,COMPLETE
2342,0.4156309277447421,2025-04-25 01:05:25.880366,2025-04-25 01:05:42.644085,0 days 00:00:16.763719,True,absolute_error,50,,2,3,315,TPESampler,COMPLETE
2343,0.36898753256515926,2025-04-25 01:05:36.497193,2025-04-25 01:06:15.850235,0 days 00:00:39.353042,True,absolute_error,42,,1,2,425,TPESampler,COMPLETE
2344,0.9156214157089133,2025-04-25 01:05:36.634164,2025-04-25 01:05:38.052589,0 days 00:00:01.418425,False,squared_error,47,log2,4,35,277,TPESampler,COMPLETE
2345,0.36975252550561344,2025-04-25 01:05:38.313051,2025-04-25 01:05:55.563259,0 days 00:00:17.250208,True,absolute_error,42,,1,2,184,TPESampler,COMPLETE
2346,0.8651853131817449,2025-04-25 01:05:42.841726,2025-04-25 01:05:43.733121,0 days 00:00:00.891395,False,squared_error,9,log2,2,4,324,TPESampler,COMPLETE
2347,0.38329677508000937,2025-04-25 01:05:43.927703,2025-04-25 01:05:46.109628,0 days 00:00:02.181925,True,squared_error,44,,1,3,262,TPESampler,COMPLETE
2348,0.3669206617234432,2025-04-25 01:05:46.301592,2025-04-25 01:06:00.009568,0 days 00:00:13.707976,True,absolute_error,50,,1,2,146,TPESampler,COMPLETE
2349,0.41471067375657633,2025-04-25 01:05:55.756479,2025-04-25 01:06:10.762628,0 days 00:00:15.006149,True,absolute_error,44,,2,2,284,TPESampler,COMPLETE
2350,0.817742241634556,2025-04-25 01:06:00.201452,2025-04-25 01:06:01.359788,0 days 00:00:01.158336,False,squared_error,10,log2,1,2,488,TPESampler,COMPLETE
2351,0.37653238935750866,2025-04-25 01:06:01.562742,2025-04-25 01:06:11.037464,0 days 00:00:09.474722,True,absolute_error,47,,1,4,100,TPESampler,COMPLETE
2352,0.3735509776246595,2025-04-25 01:06:10.965234,2025-04-25 01:06:20.505194,0 days 00:00:09.539960,True,absolute_error,41,,1,2,100,TPESampler,COMPLETE
2353,0.37051455927726706,2025-04-25 01:06:11.349427,2025-04-25 01:06:22.766244,0 days 00:00:11.416817,True,absolute_error,50,,1,3,119,TPESampler,COMPLETE
2354,0.44809119314141643,2025-04-25 01:06:16.050814,2025-04-25 01:07:15.355409,0 days 00:00:59.304595,False,absolute_error,25,,1,31,427,TPESampler,COMPLETE
2355,0.37329217609643617,2025-04-25 01:06:20.690617,2025-04-25 01:06:33.939959,0 days 00:00:13.249342,True,absolute_error,43,,1,2,137,TPESampler,COMPLETE
2356,0.37698512552631475,2025-04-25 01:06:22.952828,2025-04-25 01:06:33.121675,0 days 00:00:10.168847,True,absolute_error,44,,1,2,103,TPESampler,COMPLETE
2357,0.36802773726078775,2025-04-25 01:06:33.304653,2025-04-25 01:06:56.735809,0 days 00:00:23.431156,True,absolute_error,50,,1,2,210,TPESampler,COMPLETE
2358,0.3722132380128064,2025-04-25 01:06:34.172155,2025-04-25 01:06:45.809492,0 days 00:00:11.637337,True,absolute_error,50,,1,3,109,TPESampler,COMPLETE
2359,0.40691486707679725,2025-04-25 01:06:46.004259,2025-04-25 01:06:48.625907,0 days 00:00:02.621648,True,absolute_error,48,sqrt,1,2,108,TPESampler,COMPLETE
2360,0.4145621401349626,2025-04-25 01:06:48.819754,2025-04-25 01:07:01.119403,0 days 00:00:12.299649,True,absolute_error,50,,2,2,197,TPESampler,COMPLETE
2361,0.4148221079993417,2025-04-25 01:06:56.934651,2025-04-25 01:07:04.555283,0 days 00:00:07.620632,True,absolute_error,49,,2,4,139,TPESampler,COMPLETE
2362,0.36848092068968324,2025-04-25 01:07:01.314399,2025-04-25 01:07:13.678416,0 days 00:00:12.364017,True,absolute_error,50,,1,2,131,TPESampler,COMPLETE
2363,0.42117304451673676,2025-04-25 01:07:04.756833,2025-04-25 01:07:10.557004,0 days 00:00:05.800171,True,absolute_error,45,,2,2,103,TPESampler,COMPLETE
2364,0.3760284476175864,2025-04-25 01:07:10.748493,2025-04-25 01:07:20.379631,0 days 00:00:09.631138,True,absolute_error,44,,1,2,101,TPESampler,COMPLETE
2365,0.36632137572890483,2025-04-25 01:07:13.873361,2025-04-25 01:07:29.421696,0 days 00:00:15.548335,True,absolute_error,50,,1,2,165,TPESampler,COMPLETE
2366,0.4820714321065643,2025-04-25 01:07:15.550206,2025-04-25 01:07:17.850392,0 days 00:00:02.300186,True,absolute_error,40,log2,1,2,137,TPESampler,COMPLETE
2367,0.4198270544550623,2025-04-25 01:07:18.041477,2025-04-25 01:07:24.534662,0 days 00:00:06.493185,True,absolute_error,42,,2,2,109,TPESampler,COMPLETE
2368,0.3670524661456919,2025-04-25 01:07:20.565679,2025-04-25 01:07:36.617057,0 days 00:00:16.051378,True,absolute_error,50,,1,2,169,TPESampler,COMPLETE
2369,0.41478439522135246,2025-04-25 01:07:24.726152,2025-04-25 01:07:35.651287,0 days 00:00:10.925135,True,absolute_error,50,,2,4,200,TPESampler,COMPLETE
2370,0.9179360142849536,2025-04-25 01:07:29.609834,2025-04-25 01:07:30.763293,0 days 00:00:01.153459,True,absolute_error,40,sqrt,14,20,335,TPESampler,COMPLETE
2371,0.37148650973038616,2025-04-25 01:07:30.949974,2025-04-25 01:07:40.945065,0 days 00:00:09.995091,True,absolute_error,49,,1,2,105,TPESampler,COMPLETE
2372,0.3688565899596876,2025-04-25 01:07:35.839391,2025-04-25 01:07:54.236029,0 days 00:00:18.396638,True,absolute_error,50,,1,2,196,TPESampler,COMPLETE
2373,0.3687196715755145,2025-04-25 01:07:36.806830,2025-04-25 01:07:48.154699,0 days 00:00:11.347869,True,absolute_error,49,,1,2,118,TPESampler,COMPLETE
2374,0.4208312315228345,2025-04-25 01:07:41.132470,2025-04-25 01:07:46.844762,0 days 00:00:05.712292,True,absolute_error,47,,2,2,101,TPESampler,COMPLETE
2375,0.9135804748190692,2025-04-25 01:07:47.269283,2025-04-25 01:07:49.379963,0 days 00:00:02.110680,True,squared_error,49,log2,3,38,596,TPESampler,COMPLETE
2376,0.3763231888274251,2025-04-25 01:07:48.618508,2025-04-25 01:07:59.084271,0 days 00:00:10.465763,True,absolute_error,42,,1,3,106,TPESampler,COMPLETE
2377,0.36768330753691636,2025-04-25 01:07:49.731441,2025-04-25 01:08:07.064364,0 days 00:00:17.332923,True,absolute_error,50,,1,2,185,TPESampler,COMPLETE
2378,0.3669391796292271,2025-04-25 01:07:54.656657,2025-04-25 01:08:08.744012,0 days 00:00:14.087355,True,absolute_error,50,,1,2,145,TPESampler,COMPLETE
2379,0.36868105027638925,2025-04-25 01:07:59.274050,2025-04-25 01:08:14.011073,0 days 00:00:14.737023,True,absolute_error,49,,1,2,131,TPESampler,COMPLETE
2380,0.6524848356363508,2025-04-25 01:08:07.255711,2025-04-25 01:08:08.062840,0 days 00:00:00.807129,False,squared_error,39,sqrt,4,12,174,TPESampler,COMPLETE
2381,0.3755284644004249,2025-04-25 01:08:08.256662,2025-04-25 01:08:19.621812,0 days 00:00:11.365150,True,absolute_error,44,,1,2,100,TPESampler,COMPLETE
2382,0.5197166600656901,2025-04-25 01:08:08.983496,2025-04-25 01:08:42.422905,0 days 00:00:33.439409,False,absolute_error,49,,7,3,956,TPESampler,COMPLETE
2383,0.3738418124093073,2025-04-25 01:08:14.202812,2025-04-25 01:08:24.081226,0 days 00:00:09.878414,True,absolute_error,49,,1,3,105,TPESampler,COMPLETE
2384,0.37245250364481614,2025-04-25 01:08:19.812623,2025-04-25 01:08:29.637939,0 days 00:00:09.825316,True,absolute_error,50,,1,3,104,TPESampler,COMPLETE
2385,0.3755326334891408,2025-04-25 01:08:24.266463,2025-04-25 01:08:35.134403,0 days 00:00:10.867940,True,absolute_error,50,,1,4,116,TPESampler,COMPLETE
2386,0.37605329918014085,2025-04-25 01:08:29.841310,2025-04-25 01:08:39.737815,0 days 00:00:09.896505,True,absolute_error,44,,1,2,104,TPESampler,COMPLETE
2387,0.3690720934678071,2025-04-25 01:08:35.326282,2025-04-25 01:08:48.809859,0 days 00:00:13.483577,True,absolute_error,50,,1,2,134,TPESampler,COMPLETE
2388,0.37031858347546287,2025-04-25 01:08:39.916621,2025-04-25 01:08:51.485599,0 days 00:00:11.568978,True,absolute_error,49,,1,2,111,TPESampler,COMPLETE
2389,0.37148650973038616,2025-04-25 01:08:42.612118,2025-04-25 01:08:52.757467,0 days 00:00:10.145349,True,absolute_error,49,,1,2,105,TPESampler,COMPLETE
2390,0.384806747075369,2025-04-25 01:08:48.994981,2025-04-25 01:08:50.854992,0 days 00:00:01.860011,True,squared_error,50,,1,2,193,TPESampler,COMPLETE
2391,0.37213361598599604,2025-04-25 01:08:51.051571,2025-04-25 01:09:02.982697,0 days 00:00:11.931126,True,absolute_error,42,,1,2,122,TPESampler,COMPLETE
2392,0.4499830365917898,2025-04-25 01:08:51.715397,2025-04-25 01:08:53.807994,0 days 00:00:02.092597,True,absolute_error,50,log2,1,2,100,TPESampler,COMPLETE
2393,0.419989126575698,2025-04-25 01:08:52.954716,2025-04-25 01:08:59.162304,0 days 00:00:06.207588,True,absolute_error,43,,2,4,100,TPESampler,COMPLETE
2394,0.5855910378197322,2025-04-25 01:08:53.998258,2025-04-25 01:08:55.256217,0 days 00:00:01.257959,True,squared_error,30,log2,1,7,445,TPESampler,COMPLETE
2395,0.36707514806535846,2025-04-25 01:08:55.444556,2025-04-25 01:09:10.920119,0 days 00:00:15.475563,True,absolute_error,50,,1,2,149,TPESampler,COMPLETE
