number,value,datetime_start,datetime_complete,duration,params_bootstrap,params_criterion,params_max_depth,params_max_features,params_min_samples_leaf,params_min_samples_split,params_n_estimators,system_attrs_auto:sampler,state
1832,0.37537469121545586,2025-04-25 00:17:42.660343,2025-04-25 00:17:52.284593,0 days 00:00:09.624250,True,absolute_error,42,,1,3,100,TPESampler,COMPLETE
1833,0.41516987731630894,2025-04-25 00:17:45.056127,2025-04-25 00:18:01.685286,0 days 00:00:16.629159,True,absolute_error,50,,2,2,308,TPESampler,COMPLETE
1834,0.42022478902499166,2025-04-25 00:17:52.475425,2025-04-25 00:17:58.556457,0 days 00:00:06.081032,True,absolute_error,49,,2,3,105,TPESampler,COMPLETE
1835,0.5767880277901654,2025-04-25 00:17:58.750559,2025-04-25 00:18:24.061799,0 days 00:00:25.311240,False,absolute_error,7,,1,2,216,TPESampler,COMPLETE
1836,0.3746003888099879,2025-04-25 00:18:01.865931,2025-04-25 00:18:23.353451,0 days 00:00:21.487520,True,absolute_error,50,,1,4,236,TPESampler,COMPLETE
1837,0.37383377087931885,2025-04-25 00:18:04.024442,2025-04-25 00:18:15.353075,0 days 00:00:11.328633,True,absolute_error,43,,1,2,120,TPESampler,COMPLETE
1838,0.3718222711203207,2025-04-25 00:18:15.534352,2025-04-25 00:18:25.641079,0 days 00:00:10.106727,True,absolute_error,49,,1,2,106,TPESampler,COMPLETE
1839,0.4198280111139265,2025-04-25 00:18:23.533714,2025-04-25 00:18:32.021587,0 days 00:00:08.487873,True,absolute_error,41,,2,2,109,TPESampler,COMPLETE
1840,0.3713843650765807,2025-04-25 00:18:24.313925,2025-04-25 00:18:58.643879,0 days 00:00:34.329954,True,absolute_error,43,,1,2,263,TPESampler,COMPLETE
1841,0.4935465815644066,2025-04-25 00:18:26.000472,2025-04-25 00:18:53.743030,0 days 00:00:27.742558,True,absolute_error,34,,5,4,836,TPESampler,COMPLETE
1842,0.44584770438278293,2025-04-25 00:18:32.207540,2025-04-25 00:19:52.871834,0 days 00:01:20.664294,False,absolute_error,47,,1,10,473,TPESampler,COMPLETE
1843,0.4761632372694374,2025-04-25 00:18:53.921808,2025-04-25 00:18:56.863716,0 days 00:00:02.941908,True,absolute_error,42,log2,1,2,171,TPESampler,COMPLETE
1844,0.4204470812425147,2025-04-25 00:18:57.058059,2025-04-25 00:19:00.903281,0 days 00:00:03.845222,True,squared_error,26,,2,4,662,TPESampler,COMPLETE
1845,0.37004633752178573,2025-04-25 00:18:58.833502,2025-04-25 00:19:11.204072,0 days 00:00:12.370570,True,absolute_error,50,,1,2,127,TPESampler,COMPLETE
1846,0.3675279006300697,2025-04-25 00:19:01.083838,2025-04-25 00:19:29.456827,0 days 00:00:28.372989,True,absolute_error,50,,1,2,287,TPESampler,COMPLETE
1847,0.3697172496543859,2025-04-25 00:19:11.394511,2025-04-25 00:19:42.443070,0 days 00:00:31.048559,True,absolute_error,43,,1,2,297,TPESampler,COMPLETE
1848,0.3677137279188673,2025-04-25 00:19:29.636200,2025-04-25 00:19:51.908013,0 days 00:00:22.271813,True,absolute_error,50,,1,2,207,TPESampler,COMPLETE
1849,0.4146069668139468,2025-04-25 00:19:42.625524,2025-04-25 00:20:01.041627,0 days 00:00:18.416103,True,absolute_error,50,,2,4,334,TPESampler,COMPLETE
1850,0.4140716682546248,2025-04-25 00:19:52.092374,2025-04-25 00:20:03.486663,0 days 00:00:11.394289,True,absolute_error,43,,2,4,211,TPESampler,COMPLETE
1851,0.42524406261468073,2025-04-25 00:19:53.044307,2025-04-25 00:19:54.493865,0 days 00:00:01.449558,False,squared_error,34,sqrt,1,4,390,TPESampler,COMPLETE
1852,0.5508047155841362,2025-04-25 00:19:54.676430,2025-04-25 00:19:57.902826,0 days 00:00:03.226396,False,absolute_error,21,sqrt,1,44,112,TPESampler,COMPLETE
1853,0.419989126575698,2025-04-25 00:19:58.083625,2025-04-25 00:20:03.793396,0 days 00:00:05.709771,True,absolute_error,44,,2,2,100,TPESampler,COMPLETE
1854,0.4889308196228191,2025-04-25 00:20:01.224009,2025-04-25 00:20:25.631152,0 days 00:00:24.407143,True,absolute_error,46,,2,38,481,TPESampler,COMPLETE
1855,0.37537469121545586,2025-04-25 00:20:03.674266,2025-04-25 00:20:13.902917,0 days 00:00:10.228651,True,absolute_error,42,,1,3,100,TPESampler,COMPLETE
1856,0.5993563160406342,2025-04-25 00:20:04.016791,2025-04-25 00:20:07.090047,0 days 00:00:03.073256,True,squared_error,45,,12,2,892,TPESampler,COMPLETE
1857,0.4170208659543298,2025-04-25 00:20:07.268640,2025-04-25 00:20:14.492344,0 days 00:00:07.223704,True,absolute_error,50,,2,2,115,TPESampler,COMPLETE
1858,0.3698729605560364,2025-04-25 00:20:14.092611,2025-04-25 00:20:34.467343,0 days 00:00:20.374732,True,absolute_error,50,,1,3,221,TPESampler,COMPLETE
1859,0.37391362356693625,2025-04-25 00:20:14.722872,2025-04-25 00:20:25.672849,0 days 00:00:10.949977,True,absolute_error,43,,1,2,115,TPESampler,COMPLETE
1860,0.37125867418526587,2025-04-25 00:20:25.947576,2025-04-25 00:20:36.350588,0 days 00:00:10.403012,True,absolute_error,50,,1,2,106,TPESampler,COMPLETE
1861,0.5282242783349127,2025-04-25 00:20:25.991198,2025-04-25 00:20:29.537291,0 days 00:00:03.546093,False,squared_error,20,,3,21,617,TPESampler,COMPLETE
1862,0.3726392472512026,2025-04-25 00:20:29.723850,2025-04-25 00:21:02.514690,0 days 00:00:32.790840,True,absolute_error,44,,1,4,301,TPESampler,COMPLETE
1863,0.5696717372034374,2025-04-25 00:20:34.655290,2025-04-25 00:20:38.265870,0 days 00:00:03.610580,True,absolute_error,50,sqrt,2,2,308,TPESampler,COMPLETE
1864,0.37135576860415637,2025-04-25 00:20:36.536585,2025-04-25 00:20:47.397104,0 days 00:00:10.860519,True,absolute_error,50,,1,2,101,TPESampler,COMPLETE
1865,0.6183461127802824,2025-04-25 00:20:38.445004,2025-04-25 00:20:40.028983,0 days 00:00:01.583979,True,squared_error,27,,15,21,399,TPESampler,COMPLETE
1866,0.3698646791916843,2025-04-25 00:20:40.209465,2025-04-25 00:21:14.558472,0 days 00:00:34.349007,True,absolute_error,50,,1,2,316,TPESampler,COMPLETE
1867,0.3694807763083837,2025-04-25 00:20:47.578171,2025-04-25 00:21:35.359324,0 days 00:00:47.781153,True,absolute_error,50,,1,2,473,TPESampler,COMPLETE
1868,0.3753878138283316,2025-04-25 00:21:02.701403,2025-04-25 00:21:12.232482,0 days 00:00:09.531079,True,absolute_error,43,,1,2,100,TPESampler,COMPLETE
1869,0.44612267724292576,2025-04-25 00:21:12.418736,2025-04-25 00:21:16.836975,0 days 00:00:04.418239,True,absolute_error,49,log2,1,2,267,TPESampler,COMPLETE
1870,0.925517197560182,2025-04-25 00:21:14.744582,2025-04-25 00:21:15.540317,0 days 00:00:00.795735,True,squared_error,36,log2,3,43,194,TPESampler,COMPLETE
1871,0.5519690915599644,2025-04-25 00:21:15.727033,2025-04-25 00:21:17.861414,0 days 00:00:02.134381,True,squared_error,16,,5,39,458,TPESampler,COMPLETE
1872,0.3681797343305437,2025-04-25 00:21:17.031277,2025-04-25 00:21:38.705501,0 days 00:00:21.674224,True,absolute_error,50,,1,2,236,TPESampler,COMPLETE
1873,0.5197166600656888,2025-04-25 00:21:18.045727,2025-04-25 00:21:26.392872,0 days 00:00:08.347145,False,absolute_error,16,,7,7,225,TPESampler,COMPLETE
1874,0.41650807614792373,2025-04-25 00:21:26.611105,2025-04-25 00:21:33.422379,0 days 00:00:06.811274,True,absolute_error,50,,2,2,121,TPESampler,COMPLETE
1875,0.37095808286721443,2025-04-25 00:21:33.616350,2025-04-25 00:21:43.624665,0 days 00:00:10.008315,True,absolute_error,50,,1,2,105,TPESampler,COMPLETE
1876,0.37656893367287353,2025-04-25 00:21:35.546368,2025-04-25 00:21:45.779201,0 days 00:00:10.232833,True,absolute_error,45,,1,4,107,TPESampler,COMPLETE
1877,0.59789623303261,2025-04-25 00:21:38.896615,2025-04-25 00:21:58.035720,0 days 00:00:19.139105,False,absolute_error,35,log2,1,27,935,TPESampler,COMPLETE
1878,0.4154599821847978,2025-04-25 00:21:43.809089,2025-04-25 00:22:03.039449,0 days 00:00:19.230360,True,absolute_error,50,,2,2,317,TPESampler,COMPLETE
1879,0.36806709351781136,2025-04-25 00:21:45.961561,2025-04-25 00:22:11.017627,0 days 00:00:25.056066,True,absolute_error,50,,1,2,229,TPESampler,COMPLETE
1880,0.8718145368963396,2025-04-25 00:21:58.216136,2025-04-25 00:22:05.574868,0 days 00:00:07.358732,False,absolute_error,6,log2,1,29,978,TPESampler,COMPLETE
1881,0.376039638334013,2025-04-25 00:22:03.221544,2025-04-25 00:22:37.720483,0 days 00:00:34.498939,True,absolute_error,42,,1,4,370,TPESampler,COMPLETE
1882,0.5035783090295948,2025-04-25 00:22:05.758184,2025-04-25 00:22:09.408427,0 days 00:00:03.650243,True,squared_error,13,,1,23,910,TPESampler,COMPLETE
1883,0.37095808286721443,2025-04-25 00:22:09.793868,2025-04-25 00:22:19.825430,0 days 00:00:10.031562,True,absolute_error,50,,1,2,105,TPESampler,COMPLETE
1884,0.3768580700590658,2025-04-25 00:22:11.271672,2025-04-25 00:22:21.472940,0 days 00:00:10.201268,True,absolute_error,43,,1,2,102,TPESampler,COMPLETE
1885,0.47954796781662756,2025-04-25 00:22:20.002931,2025-04-25 00:22:36.658061,0 days 00:00:16.655130,False,absolute_error,50,,2,3,172,TPESampler,COMPLETE
1886,0.9265075504723043,2025-04-25 00:22:21.650240,2025-04-25 00:22:23.514659,0 days 00:00:01.864419,True,absolute_error,9,log2,5,2,776,TPESampler,COMPLETE
1887,0.37836925706782243,2025-04-25 00:22:23.700233,2025-04-25 00:22:35.328681,0 days 00:00:11.628448,True,absolute_error,50,,1,4,125,TPESampler,COMPLETE
1888,0.44270430332095745,2025-04-25 00:22:35.510438,2025-04-25 00:22:55.741775,0 days 00:00:20.231337,False,absolute_error,43,,1,2,129,TPESampler,COMPLETE
1889,0.37221515190352994,2025-04-25 00:22:36.828079,2025-04-25 00:22:46.811928,0 days 00:00:09.983849,True,absolute_error,50,,1,2,103,TPESampler,COMPLETE
1890,0.8919802154186748,2025-04-25 00:22:37.894175,2025-04-25 00:22:39.496683,0 days 00:00:01.602508,True,squared_error,43,sqrt,9,2,955,TPESampler,COMPLETE
1891,0.37477855575162233,2025-04-25 00:22:39.670814,2025-04-25 00:23:13.760124,0 days 00:00:34.089310,True,absolute_error,50,,1,4,382,TPESampler,COMPLETE
1892,0.3709676774889595,2025-04-25 00:22:47.124270,2025-04-25 00:23:29.511031,0 days 00:00:42.386761,True,absolute_error,43,,1,2,427,TPESampler,COMPLETE
1893,0.37327920105854573,2025-04-25 00:22:56.014824,2025-04-25 00:23:22.935028,0 days 00:00:26.920204,True,absolute_error,33,,1,2,266,TPESampler,COMPLETE
1894,0.37065623869277775,2025-04-25 00:23:13.948598,2025-04-25 00:23:37.019761,0 days 00:00:23.071163,True,absolute_error,42,,1,3,249,TPESampler,COMPLETE
1895,0.7978890433088813,2025-04-25 00:23:23.117758,2025-04-25 00:23:24.311406,0 days 00:00:01.193648,True,squared_error,36,sqrt,5,4,513,TPESampler,COMPLETE
1896,0.5877305536317221,2025-04-25 00:23:24.500000,2025-04-25 00:23:25.668358,0 days 00:00:01.168358,True,squared_error,25,sqrt,2,6,379,TPESampler,COMPLETE
1897,0.3879953369576229,2025-04-25 00:23:25.889756,2025-04-25 00:23:28.894039,0 days 00:00:03.004283,True,squared_error,43,,1,3,380,TPESampler,COMPLETE
1898,0.4000462538687464,2025-04-25 00:23:29.075385,2025-04-25 00:23:34.326838,0 days 00:00:05.251453,True,absolute_error,50,sqrt,1,2,243,TPESampler,COMPLETE
1899,0.37135576860415637,2025-04-25 00:23:29.775760,2025-04-25 00:23:39.554133,0 days 00:00:09.778373,True,absolute_error,50,,1,2,101,TPESampler,COMPLETE
1900,0.4165133937832164,2025-04-25 00:23:34.518221,2025-04-25 00:23:49.023971,0 days 00:00:14.505750,True,absolute_error,50,,2,2,272,TPESampler,COMPLETE
1901,0.38546248409087347,2025-04-25 00:23:37.197073,2025-04-25 00:23:38.611914,0 days 00:00:01.414841,True,squared_error,40,,1,2,133,TPESampler,COMPLETE
1902,0.49300490967911403,2025-04-25 00:23:38.791885,2025-04-25 00:23:40.831775,0 days 00:00:02.039890,True,squared_error,29,,4,4,346,TPESampler,COMPLETE
1903,0.42061384270795604,2025-04-25 00:23:39.739681,2025-04-25 00:23:54.837421,0 days 00:00:15.097740,True,absolute_error,26,,2,6,289,TPESampler,COMPLETE
1904,0.37036944236606306,2025-04-25 00:23:41.013068,2025-04-25 00:24:04.113361,0 days 00:00:23.100293,True,absolute_error,41,,1,2,252,TPESampler,COMPLETE
1905,0.8288277996241324,2025-04-25 00:23:49.209938,2025-04-25 00:23:51.033613,0 days 00:00:01.823675,True,absolute_error,45,log2,2,2,320,TPESampler,COMPLETE
1906,0.4146635134824989,2025-04-25 00:23:51.213130,2025-04-25 00:24:01.836226,0 days 00:00:10.623096,True,absolute_error,44,,2,4,199,TPESampler,COMPLETE
1907,0.37095808286721443,2025-04-25 00:23:55.026690,2025-04-25 00:24:05.074495,0 days 00:00:10.047805,True,absolute_error,50,,1,2,105,TPESampler,COMPLETE
1908,0.3745890888100204,2025-04-25 00:24:02.026942,2025-04-25 00:24:23.135290,0 days 00:00:21.108348,True,absolute_error,50,,1,4,231,TPESampler,COMPLETE
1909,0.36999582362219174,2025-04-25 00:24:04.302162,2025-04-25 00:24:43.805079,0 days 00:00:39.502917,True,absolute_error,50,,1,2,401,TPESampler,COMPLETE
1910,0.3696018677958252,2025-04-25 00:24:05.255884,2025-04-25 00:24:33.112764,0 days 00:00:27.856880,True,absolute_error,50,,1,3,274,TPESampler,COMPLETE
1911,0.414705791125361,2025-04-25 00:24:23.384324,2025-04-25 00:24:41.762476,0 days 00:00:18.378152,True,absolute_error,42,,2,2,291,TPESampler,COMPLETE
1912,0.3753421505877902,2025-04-25 00:24:33.295339,2025-04-25 00:24:53.147257,0 days 00:00:19.851918,True,absolute_error,50,,1,4,217,TPESampler,COMPLETE
1913,0.3719062304604526,2025-04-25 00:24:41.951132,2025-04-25 00:25:13.625941,0 days 00:00:31.674809,True,absolute_error,43,,1,2,319,TPESampler,COMPLETE
1914,0.4198270544550623,2025-04-25 00:24:43.989389,2025-04-25 00:24:49.953459,0 days 00:00:05.964070,True,absolute_error,43,,2,4,109,TPESampler,COMPLETE
1915,0.3679782471480686,2025-04-25 00:24:50.139028,2025-04-25 00:25:17.954557,0 days 00:00:27.815529,True,absolute_error,50,,1,2,274,TPESampler,COMPLETE
1916,0.3713015386702165,2025-04-25 00:24:53.335725,2025-04-25 00:25:21.430603,0 days 00:00:28.094878,True,absolute_error,43,,1,2,266,TPESampler,COMPLETE
1917,0.3708070357486508,2025-04-25 00:25:13.808772,2025-04-25 00:25:36.259143,0 days 00:00:22.450371,True,absolute_error,43,,1,2,236,TPESampler,COMPLETE
1918,0.3700482495395052,2025-04-25 00:25:18.137265,2025-04-25 00:25:53.124304,0 days 00:00:34.987039,True,absolute_error,50,,1,2,354,TPESampler,COMPLETE
1919,0.4465729209343493,2025-04-25 00:25:21.613906,2025-04-25 00:26:03.974010,0 days 00:00:42.360104,False,absolute_error,42,,1,5,269,TPESampler,COMPLETE
1920,0.49047835841811677,2025-04-25 00:25:36.495330,2025-04-25 00:25:45.394967,0 days 00:00:08.899637,False,absolute_error,40,sqrt,1,46,226,TPESampler,COMPLETE
1921,0.3791988291406186,2025-04-25 00:25:45.606344,2025-04-25 00:25:46.968383,0 days 00:00:01.362039,True,squared_error,50,,1,2,110,TPESampler,COMPLETE
1922,0.4149696014810057,2025-04-25 00:25:47.166013,2025-04-25 00:26:00.632988,0 days 00:00:13.466975,True,absolute_error,50,,2,2,235,TPESampler,COMPLETE
1923,0.667262573426053,2025-04-25 00:25:53.304746,2025-04-25 00:25:55.984008,0 days 00:00:02.679262,False,squared_error,5,,2,6,701,TPESampler,COMPLETE
1924,0.36787406666516487,2025-04-25 00:25:56.167483,2025-04-25 00:26:18.862082,0 days 00:00:22.694599,True,absolute_error,50,,1,2,246,TPESampler,COMPLETE
1925,0.36812182866461507,2025-04-25 00:26:00.824117,2025-04-25 00:26:24.454538,0 days 00:00:23.630421,True,absolute_error,50,,1,2,238,TPESampler,COMPLETE
1926,0.3760284476175864,2025-04-25 00:26:04.155350,2025-04-25 00:26:13.721058,0 days 00:00:09.565708,True,absolute_error,44,,1,2,101,TPESampler,COMPLETE
1927,0.8487253576721671,2025-04-25 00:26:13.904231,2025-04-25 00:26:14.784818,0 days 00:00:00.880587,True,squared_error,42,log2,2,6,239,TPESampler,COMPLETE
1928,0.3713654164792049,2025-04-25 00:26:14.999985,2025-04-25 00:26:40.428474,0 days 00:00:25.428489,True,absolute_error,43,,1,2,261,TPESampler,COMPLETE
1929,0.3856795614441925,2025-04-25 00:26:19.046620,2025-04-25 00:26:21.858231,0 days 00:00:02.811611,True,squared_error,50,,1,2,344,TPESampler,COMPLETE
1930,0.44878960801253237,2025-04-25 00:26:22.046163,2025-04-25 00:27:04.009173,0 days 00:00:41.963010,False,absolute_error,50,,1,4,275,TPESampler,COMPLETE
1931,0.373265536213868,2025-04-25 00:26:24.642492,2025-04-25 00:26:49.391118,0 days 00:00:24.748626,True,absolute_error,50,,1,4,273,TPESampler,COMPLETE
1932,0.4154387609903572,2025-04-25 00:26:40.611046,2025-04-25 00:26:48.028588,0 days 00:00:07.417542,True,absolute_error,50,,2,2,137,TPESampler,COMPLETE
1933,0.37334505175033345,2025-04-25 00:26:48.211377,2025-04-25 00:27:13.298488,0 days 00:00:25.087111,True,absolute_error,42,,1,4,270,TPESampler,COMPLETE
1934,0.36999046528848634,2025-04-25 00:26:49.575269,2025-04-25 00:27:11.526340,0 days 00:00:21.951071,True,absolute_error,50,,1,3,227,TPESampler,COMPLETE
1935,0.5298820995888749,2025-04-25 00:27:04.204275,2025-04-25 00:27:06.889742,0 days 00:00:02.685467,True,squared_error,20,,6,16,683,TPESampler,COMPLETE
1936,0.8233464459578779,2025-04-25 00:27:07.073521,2025-04-25 00:27:08.084847,0 days 00:00:01.011326,True,absolute_error,39,log2,2,2,111,TPESampler,COMPLETE
1937,0.4152090359308299,2025-04-25 00:27:08.277425,2025-04-25 00:27:21.369944,0 days 00:00:13.092519,True,absolute_error,50,,2,3,227,TPESampler,COMPLETE
1938,0.5888437597673553,2025-04-25 00:27:11.708842,2025-04-25 00:27:18.458062,0 days 00:00:06.749220,True,absolute_error,19,,11,2,498,TPESampler,COMPLETE
1939,0.41414025690994954,2025-04-25 00:27:13.485677,2025-04-25 00:27:24.603846,0 days 00:00:11.118169,True,absolute_error,42,,2,2,208,TPESampler,COMPLETE
1940,0.37059760597831154,2025-04-25 00:27:18.645413,2025-04-25 00:27:40.012267,0 days 00:00:21.366854,True,absolute_error,50,,1,3,223,TPESampler,COMPLETE
1941,0.37211359036638925,2025-04-25 00:27:21.810615,2025-04-25 00:27:47.588225,0 days 00:00:25.777610,True,absolute_error,44,,1,2,268,TPESampler,COMPLETE
1942,0.3739228443239424,2025-04-25 00:27:24.779425,2025-04-25 00:27:41.363334,0 days 00:00:16.583909,True,absolute_error,50,,1,4,166,TPESampler,COMPLETE
1943,0.4130691018587114,2025-04-25 00:27:40.192359,2025-04-25 00:28:02.728920,0 days 00:00:22.536561,True,absolute_error,43,,2,2,440,TPESampler,COMPLETE
1944,0.41854507836950566,2025-04-25 00:27:41.543926,2025-04-25 00:27:47.628840,0 days 00:00:06.084914,True,absolute_error,50,,2,3,110,TPESampler,COMPLETE
1945,0.3690298914359634,2025-04-25 00:27:47.789513,2025-04-25 00:27:59.255627,0 days 00:00:11.466114,True,absolute_error,50,,1,2,114,TPESampler,COMPLETE
1946,0.3677096833107751,2025-04-25 00:27:47.914948,2025-04-25 00:28:07.893945,0 days 00:00:19.978997,True,absolute_error,50,,1,2,206,TPESampler,COMPLETE
1947,0.3724818131986042,2025-04-25 00:27:59.443993,2025-04-25 00:28:20.183034,0 days 00:00:20.739041,True,absolute_error,44,,1,2,222,TPESampler,COMPLETE
1948,0.36901461280871867,2025-04-25 00:28:02.942265,2025-04-25 00:28:24.229787,0 days 00:00:21.287522,True,absolute_error,50,,1,2,223,TPESampler,COMPLETE
1949,0.36762509661876996,2025-04-25 00:28:08.079295,2025-04-25 00:28:27.589729,0 days 00:00:19.510434,True,absolute_error,50,,1,2,202,TPESampler,COMPLETE
1950,0.5732045863151074,2025-04-25 00:28:20.401062,2025-04-25 00:28:23.388588,0 days 00:00:02.987526,True,absolute_error,38,sqrt,2,2,205,TPESampler,COMPLETE
1951,0.3759749620169619,2025-04-25 00:28:23.576894,2025-04-25 00:28:42.680547,0 days 00:00:19.103653,True,absolute_error,40,,1,4,195,TPESampler,COMPLETE
1952,0.37105220352905655,2025-04-25 00:28:24.415822,2025-04-25 00:28:46.226893,0 days 00:00:21.811071,True,absolute_error,43,,1,2,228,TPESampler,COMPLETE
1953,0.3759454958909342,2025-04-25 00:28:27.766749,2025-04-25 00:28:38.301806,0 days 00:00:10.535057,True,absolute_error,33,,1,2,112,TPESampler,COMPLETE
1954,0.4585386649628509,2025-04-25 00:28:38.484063,2025-04-25 00:28:40.514054,0 days 00:00:02.029991,True,absolute_error,50,log2,1,3,115,TPESampler,COMPLETE
1955,0.4427672182958084,2025-04-25 00:28:40.697646,2025-04-25 00:29:44.157274,0 days 00:01:03.459628,False,absolute_error,50,,1,2,408,TPESampler,COMPLETE
1956,0.37640253049014966,2025-04-25 00:28:42.870462,2025-04-25 00:28:54.077583,0 days 00:00:11.207121,True,absolute_error,45,,1,4,109,TPESampler,COMPLETE
1957,0.4958597602957084,2025-04-25 00:28:46.418424,2025-04-25 00:28:53.364379,0 days 00:00:06.945955,True,absolute_error,44,log2,1,4,454,TPESampler,COMPLETE
1958,0.4201018890298708,2025-04-25 00:28:53.548272,2025-04-25 00:29:01.544632,0 days 00:00:07.996360,True,absolute_error,50,,2,4,106,TPESampler,COMPLETE
1959,0.36787406666516487,2025-04-25 00:28:54.300442,2025-04-25 00:29:21.473203,0 days 00:00:27.172761,True,absolute_error,50,,1,2,246,TPESampler,COMPLETE
1960,0.375765516802002,2025-04-25 00:29:01.731631,2025-04-25 00:29:14.186770,0 days 00:00:12.455139,True,absolute_error,44,,1,2,106,TPESampler,COMPLETE
1961,0.3697722521327707,2025-04-25 00:29:14.373477,2025-04-25 00:29:44.230302,0 days 00:00:29.856825,True,absolute_error,50,,1,2,329,TPESampler,COMPLETE
1962,0.3700725884180489,2025-04-25 00:29:21.660608,2025-04-25 00:29:44.821341,0 days 00:00:23.160733,True,absolute_error,43,,1,2,254,TPESampler,COMPLETE
1963,0.3753807496470871,2025-04-25 00:29:44.312898,2025-04-25 00:30:03.919243,0 days 00:00:19.606345,True,absolute_error,50,,1,4,193,TPESampler,COMPLETE
1964,0.5670104264939907,2025-04-25 00:29:44.433342,2025-04-25 00:29:54.795849,0 days 00:00:10.362507,True,absolute_error,21,sqrt,1,15,590,TPESampler,COMPLETE
1965,0.4146594122801588,2025-04-25 00:29:45.112673,2025-04-25 00:30:09.095754,0 days 00:00:23.983081,True,absolute_error,45,,2,4,364,TPESampler,COMPLETE
1966,0.4152090359308299,2025-04-25 00:29:54.975855,2025-04-25 00:30:10.193240,0 days 00:00:15.217385,True,absolute_error,43,,2,2,227,TPESampler,COMPLETE
1967,0.37125867418526587,2025-04-25 00:30:04.108938,2025-04-25 00:30:14.521084,0 days 00:00:10.412146,True,absolute_error,50,,1,2,106,TPESampler,COMPLETE
1968,0.5989600739923615,2025-04-25 00:30:09.275497,2025-04-25 00:30:32.450588,0 days 00:00:23.175091,False,absolute_error,16,,12,28,985,TPESampler,COMPLETE
1969,0.3708755021146187,2025-04-25 00:30:10.372757,2025-04-25 00:30:46.081803,0 days 00:00:35.709046,True,absolute_error,50,,1,2,392,TPESampler,COMPLETE
1970,0.3696018677958252,2025-04-25 00:30:14.703138,2025-04-25 00:30:39.752266,0 days 00:00:25.049128,True,absolute_error,50,,1,3,274,TPESampler,COMPLETE
1971,0.3717079183826205,2025-04-25 00:30:32.638573,2025-04-25 00:30:53.127911,0 days 00:00:20.489338,True,absolute_error,43,,1,2,223,TPESampler,COMPLETE
1972,0.36877531851715467,2025-04-25 00:30:39.932430,2025-04-25 00:31:03.566277,0 days 00:00:23.633847,True,absolute_error,50,,1,2,259,TPESampler,COMPLETE
