number,value,datetime_start,datetime_complete,duration,params_bootstrap,params_criterion,params_max_depth,params_max_features,params_min_samples_leaf,params_min_samples_split,params_n_estimators,system_attrs_auto:sampler,state
563,0.37027388699379005,2025-04-24 22:22:08.440094,2025-04-24 22:22:44.603706,0 days 00:00:36.163612,True,absolute_error,50,,1,2,325,TPESampler,COMPLETE
564,0.4152129161196761,2025-04-24 22:22:10.272418,2025-04-24 22:22:26.692003,0 days 00:00:16.419585,True,absolute_error,50,,2,2,220,TPESampler,COMPLETE
565,0.36930549488475295,2025-04-24 22:22:24.015106,2025-04-24 22:22:51.158963,0 days 00:00:27.143857,True,absolute_error,42,,1,2,280,TPESampler,COMPLETE
566,0.36926975681753615,2025-04-24 22:22:26.864463,2025-04-24 22:22:39.011375,0 days 00:00:12.146912,True,absolute_error,50,,1,2,113,TPESampler,COMPLETE
567,0.43512727490270076,2025-04-24 22:22:39.203051,2025-04-24 22:22:57.935792,0 days 00:00:18.732741,False,absolute_error,48,,1,2,119,TPESampler,COMPLETE
568,0.370960696461535,2025-04-24 22:22:44.892509,2025-04-24 22:22:56.115146,0 days 00:00:11.222637,True,absolute_error,50,,1,2,108,TPESampler,COMPLETE
569,0.4082229923441521,2025-04-24 22:22:51.564661,2025-04-24 22:22:55.914537,0 days 00:00:04.349876,True,squared_error,28,,1,11,764,TPESampler,COMPLETE
570,0.3839149244048182,2025-04-24 22:22:56.201223,2025-04-24 22:22:57.937063,0 days 00:00:01.735840,True,squared_error,49,,1,4,101,TPESampler,COMPLETE
571,0.36828334016276953,2025-04-24 22:22:56.444555,2025-04-24 22:23:25.997701,0 days 00:00:29.553146,True,absolute_error,50,,1,2,271,TPESampler,COMPLETE
572,0.750599120096428,2025-04-24 22:22:58.076853,2025-04-24 22:23:07.600361,0 days 00:00:09.523508,False,absolute_error,7,sqrt,1,5,702,TPESampler,COMPLETE
573,0.3715912079111693,2025-04-24 22:22:58.129142,2025-04-24 22:23:41.025787,0 days 00:00:42.896645,True,absolute_error,48,,1,4,417,TPESampler,COMPLETE
574,0.3719219221487873,2025-04-24 22:23:07.784962,2025-04-24 22:23:36.936594,0 days 00:00:29.151632,True,absolute_error,50,,1,4,297,TPESampler,COMPLETE
575,0.37038265719301816,2025-04-24 22:23:26.174761,2025-04-24 22:23:45.069626,0 days 00:00:18.894865,True,absolute_error,42,,1,2,181,TPESampler,COMPLETE
576,0.5588809569900016,2025-04-24 22:23:37.129981,2025-04-24 22:23:51.311833,0 days 00:00:14.181852,True,absolute_error,19,sqrt,1,5,867,TPESampler,COMPLETE
577,0.36989848635771927,2025-04-24 22:23:41.222272,2025-04-24 22:24:08.435375,0 days 00:00:27.213103,True,absolute_error,50,,1,3,272,TPESampler,COMPLETE
578,0.6774759832709997,2025-04-24 22:23:45.278075,2025-04-24 22:23:46.296867,0 days 00:00:01.018792,True,squared_error,25,log2,1,48,228,TPESampler,COMPLETE
579,0.41631345781506035,2025-04-24 22:23:46.513685,2025-04-24 22:24:00.618821,0 days 00:00:14.105136,True,absolute_error,50,,2,2,244,TPESampler,COMPLETE
580,0.515823412299006,2025-04-24 22:23:51.481649,2025-04-24 22:23:55.584989,0 days 00:00:04.103340,False,absolute_error,47,log2,1,15,164,TPESampler,COMPLETE
581,0.6195707854595254,2025-04-24 22:23:55.768344,2025-04-24 22:24:02.730777,0 days 00:00:06.962433,True,absolute_error,29,log2,1,10,529,TPESampler,COMPLETE
582,0.9253470954891609,2025-04-24 22:24:00.806434,2025-04-24 22:24:02.475545,0 days 00:00:01.669111,True,absolute_error,30,log2,5,4,568,TPESampler,COMPLETE
583,0.5734268636217256,2025-04-24 22:24:02.643573,2025-04-24 22:24:22.678746,0 days 00:00:20.035173,False,absolute_error,50,,10,33,667,TPESampler,COMPLETE
584,0.42567294939056666,2025-04-24 22:24:02.930060,2025-04-24 22:24:09.344151,0 days 00:00:06.414091,False,squared_error,45,,1,12,978,TPESampler,COMPLETE
585,0.40100209108239604,2025-04-24 22:24:08.616076,2025-04-24 22:24:15.741159,0 days 00:00:07.125083,True,absolute_error,47,sqrt,1,2,248,TPESampler,COMPLETE
586,0.5812616913628943,2025-04-24 22:24:09.511983,2025-04-24 22:24:22.224078,0 days 00:00:12.712095,False,absolute_error,20,sqrt,2,12,632,TPESampler,COMPLETE
587,0.36838585934384965,2025-04-24 22:24:15.926155,2025-04-24 22:24:41.566267,0 days 00:00:25.640112,True,absolute_error,50,,1,2,270,TPESampler,COMPLETE
588,0.37089415161601713,2025-04-24 22:24:22.411988,2025-04-24 22:24:50.221826,0 days 00:00:27.809838,True,absolute_error,40,,1,2,297,TPESampler,COMPLETE
589,0.6053626883778128,2025-04-24 22:24:22.856313,2025-04-24 22:24:30.324287,0 days 00:00:07.467974,False,absolute_error,13,sqrt,1,2,358,TPESampler,COMPLETE
590,0.41796055724859865,2025-04-24 22:24:30.729464,2025-04-24 22:24:37.897638,0 days 00:00:07.168174,True,absolute_error,50,,2,3,128,TPESampler,COMPLETE
591,0.370143755987125,2025-04-24 22:24:38.085141,2025-04-24 22:25:11.985840,0 days 00:00:33.900699,True,absolute_error,50,,1,2,336,TPESampler,COMPLETE
592,0.3695929836503364,2025-04-24 22:24:41.745867,2025-04-24 22:25:03.586065,0 days 00:00:21.840198,True,absolute_error,42,,1,2,237,TPESampler,COMPLETE
593,0.3715705984187656,2025-04-24 22:24:50.415749,2025-04-24 22:25:03.055862,0 days 00:00:12.640113,True,absolute_error,49,,1,2,101,TPESampler,COMPLETE
594,0.370960696461535,2025-04-24 22:25:03.233617,2025-04-24 22:25:13.723784,0 days 00:00:10.490167,True,absolute_error,50,,1,2,108,TPESampler,COMPLETE
595,0.4472333244342109,2025-04-24 22:25:03.817611,2025-04-24 22:25:07.962666,0 days 00:00:04.145055,False,squared_error,46,,2,5,598,TPESampler,COMPLETE
596,0.36842915010517735,2025-04-24 22:25:08.139814,2025-04-24 22:25:34.256138,0 days 00:00:26.116324,True,absolute_error,50,,1,2,272,TPESampler,COMPLETE
597,0.8612109603918302,2025-04-24 22:25:12.160153,2025-04-24 22:25:13.097209,0 days 00:00:00.937056,False,absolute_error,15,sqrt,13,2,122,TPESampler,COMPLETE
598,0.37347276063141577,2025-04-24 22:25:13.285316,2025-04-24 22:25:36.002179,0 days 00:00:22.716863,True,absolute_error,43,,1,4,239,TPESampler,COMPLETE
599,0.6720346578560931,2025-04-24 22:25:13.923766,2025-04-24 22:25:15.229552,0 days 00:00:01.305786,False,squared_error,20,sqrt,4,50,521,TPESampler,COMPLETE
600,0.5257251789904928,2025-04-24 22:25:15.406936,2025-04-24 22:25:20.161977,0 days 00:00:04.755041,False,absolute_error,33,sqrt,2,8,198,TPESampler,COMPLETE
601,0.584206381379438,2025-04-24 22:25:20.351400,2025-04-24 22:25:25.317388,0 days 00:00:04.965988,False,absolute_error,42,sqrt,3,36,312,TPESampler,COMPLETE
602,0.4783069754163283,2025-04-24 22:25:25.500800,2025-04-24 22:25:28.660079,0 days 00:00:03.159279,False,squared_error,18,,1,9,491,TPESampler,COMPLETE
603,0.44301463257613505,2025-04-24 22:25:28.856994,2025-04-24 22:26:22.209654,0 days 00:00:53.352660,False,absolute_error,49,,1,4,349,TPESampler,COMPLETE
604,0.41517939355565614,2025-04-24 22:25:34.452195,2025-04-24 22:25:54.179184,0 days 00:00:19.726989,True,absolute_error,42,,2,2,373,TPESampler,COMPLETE
605,0.4809626415396425,2025-04-24 22:25:36.190208,2025-04-24 22:25:38.828133,0 days 00:00:02.637925,True,squared_error,13,,2,8,507,TPESampler,COMPLETE
606,0.37587653602032844,2025-04-24 22:25:39.005150,2025-04-24 22:25:49.541622,0 days 00:00:10.536472,True,absolute_error,49,,1,4,112,TPESampler,COMPLETE
607,0.7041311234984994,2025-04-24 22:25:49.730302,2025-04-24 22:25:50.716715,0 days 00:00:00.986413,False,squared_error,9,sqrt,1,4,369,TPESampler,COMPLETE
608,0.3725341380886624,2025-04-24 22:25:50.892496,2025-04-24 22:26:01.709836,0 days 00:00:10.817340,True,absolute_error,41,,1,2,110,TPESampler,COMPLETE
609,0.4150226902618737,2025-04-24 22:25:54.362505,2025-04-24 22:26:06.617479,0 days 00:00:12.254974,True,absolute_error,50,,2,2,231,TPESampler,COMPLETE
610,0.6309995038867441,2025-04-24 22:26:01.901683,2025-04-24 22:26:08.332422,0 days 00:00:06.430739,False,absolute_error,28,,15,7,306,TPESampler,COMPLETE
611,0.3682937296813074,2025-04-24 22:26:06.850150,2025-04-24 22:26:33.839464,0 days 00:00:26.989314,True,absolute_error,50,,1,2,281,TPESampler,COMPLETE
612,0.36884422439504194,2025-04-24 22:26:08.515349,2025-04-24 22:26:29.620513,0 days 00:00:21.105164,True,absolute_error,50,,1,2,224,TPESampler,COMPLETE
613,0.45038010452699373,2025-04-24 22:26:22.382406,2025-04-24 22:26:29.095650,0 days 00:00:06.713244,True,absolute_error,50,log2,1,2,444,TPESampler,COMPLETE
614,0.368672381878569,2025-04-24 22:26:29.283185,2025-04-24 22:26:54.359886,0 days 00:00:25.076701,True,absolute_error,50,,1,2,262,TPESampler,COMPLETE
615,0.6346393863601895,2025-04-24 22:26:29.799832,2025-04-24 22:26:33.271891,0 days 00:00:03.472059,False,squared_error,49,,10,4,715,TPESampler,COMPLETE
616,0.6193482854291096,2025-04-24 22:26:33.456230,2025-04-24 22:26:34.369108,0 days 00:00:00.912878,False,squared_error,31,log2,1,18,187,TPESampler,COMPLETE
617,0.3739626873717241,2025-04-24 22:26:34.085943,2025-04-24 22:26:59.254743,0 days 00:00:25.168800,True,absolute_error,50,,1,4,269,TPESampler,COMPLETE
618,0.5266828304102644,2025-04-24 22:26:34.568102,2025-04-24 22:26:37.794348,0 days 00:00:03.226246,True,absolute_error,41,log2,1,5,226,TPESampler,COMPLETE
619,0.36939437460011365,2025-04-24 22:26:37.977390,2025-04-24 22:27:02.398332,0 days 00:00:24.420942,True,absolute_error,42,,1,2,264,TPESampler,COMPLETE
620,0.3849577274229671,2025-04-24 22:26:54.534276,2025-04-24 22:26:55.791797,0 days 00:00:01.257521,True,squared_error,40,,1,2,108,TPESampler,COMPLETE
621,0.4196430122544893,2025-04-24 22:26:55.967045,2025-04-24 22:26:58.448091,0 days 00:00:02.481046,True,absolute_error,47,sqrt,1,3,107,TPESampler,COMPLETE
622,0.37358649666314797,2025-04-24 22:26:58.631633,2025-04-24 22:27:10.056725,0 days 00:00:11.425092,True,absolute_error,44,,1,2,112,TPESampler,COMPLETE
623,0.4146188263198409,2025-04-24 22:26:59.445652,2025-04-24 22:27:15.658327,0 days 00:00:16.212675,True,absolute_error,40,,2,3,302,TPESampler,COMPLETE
624,0.3675100141082649,2025-04-24 22:27:02.574928,2025-04-24 22:27:20.268564,0 days 00:00:17.693636,True,absolute_error,50,,1,2,186,TPESampler,COMPLETE
625,0.41698181731024575,2025-04-24 22:27:10.232320,2025-04-24 22:27:24.177330,0 days 00:00:13.945010,True,absolute_error,50,,2,2,259,TPESampler,COMPLETE
626,0.4179196749129006,2025-04-24 22:27:15.835212,2025-04-24 22:27:23.073164,0 days 00:00:07.237952,True,absolute_error,50,,2,2,127,TPESampler,COMPLETE
627,0.3775206361953243,2025-04-24 22:27:20.442967,2025-04-24 22:27:32.770118,0 days 00:00:12.327151,True,absolute_error,50,,1,4,129,TPESampler,COMPLETE
628,0.6661399541341765,2025-04-24 22:27:23.263673,2025-04-24 22:27:25.308155,0 days 00:00:02.044482,True,squared_error,37,sqrt,3,2,929,TPESampler,COMPLETE
629,0.36988362430216254,2025-04-24 22:27:24.364498,2025-04-24 22:27:46.921999,0 days 00:00:22.557501,True,absolute_error,42,,1,2,241,TPESampler,COMPLETE
630,0.36857208795829477,2025-04-24 22:27:25.481757,2025-04-24 22:27:46.117060,0 days 00:00:20.635303,True,absolute_error,50,,1,2,222,TPESampler,COMPLETE
631,0.4146164037994765,2025-04-24 22:27:32.952140,2025-04-24 22:27:51.070736,0 days 00:00:18.118596,True,absolute_error,50,,2,4,344,TPESampler,COMPLETE
632,0.3707924962362185,2025-04-24 22:27:46.623731,2025-04-24 22:28:33.728399,0 days 00:00:47.104668,True,absolute_error,49,,1,2,494,TPESampler,COMPLETE
633,0.4420291026568783,2025-04-24 22:27:47.390039,2025-04-24 22:27:51.200977,0 days 00:00:03.810938,True,absolute_error,50,log2,1,2,196,TPESampler,COMPLETE
634,0.36916139191789915,2025-04-24 22:27:51.298564,2025-04-24 22:28:18.599186,0 days 00:00:27.300622,True,absolute_error,50,,1,3,285,TPESampler,COMPLETE
635,0.9060054451440915,2025-04-24 22:27:51.389333,2025-04-24 22:27:53.906514,0 days 00:00:02.517181,True,absolute_error,48,sqrt,12,7,818,TPESampler,COMPLETE
636,0.3682408964546516,2025-04-24 22:27:54.148985,2025-04-24 22:28:17.299663,0 days 00:00:23.150678,True,absolute_error,50,,1,2,239,TPESampler,COMPLETE
637,0.37284475976817993,2025-04-24 22:28:17.487751,2025-04-24 22:28:27.010028,0 days 00:00:09.522277,True,absolute_error,50,,1,3,101,TPESampler,COMPLETE
638,0.36901461280871867,2025-04-24 22:28:18.778754,2025-04-24 22:28:41.052729,0 days 00:00:22.273975,True,absolute_error,50,,1,2,223,TPESampler,COMPLETE
639,0.3709812381514683,2025-04-24 22:28:27.190640,2025-04-24 22:28:43.766932,0 days 00:00:16.576292,True,absolute_error,41,,1,2,170,TPESampler,COMPLETE
640,0.38174693326283626,2025-04-24 22:28:33.894786,2025-04-24 22:28:35.947289,0 days 00:00:02.052503,True,squared_error,50,,1,2,231,TPESampler,COMPLETE
641,0.36774425093151825,2025-04-24 22:28:36.147706,2025-04-24 22:28:55.416527,0 days 00:00:19.268821,True,absolute_error,50,,1,2,209,TPESampler,COMPLETE
642,0.3716623140503155,2025-04-24 22:28:41.266695,2025-04-24 22:28:51.972401,0 days 00:00:10.705706,True,absolute_error,42,,1,2,113,TPESampler,COMPLETE
643,0.36958400917276896,2025-04-24 22:28:43.951768,2025-04-24 22:29:22.068118,0 days 00:00:38.116350,True,absolute_error,42,,1,2,413,TPESampler,COMPLETE
644,0.36795752096153067,2025-04-24 22:28:52.154245,2025-04-24 22:29:12.310942,0 days 00:00:20.156697,True,absolute_error,50,,1,2,214,TPESampler,COMPLETE
645,0.3740186994578105,2025-04-24 22:28:55.597822,2025-04-24 22:29:21.642046,0 days 00:00:26.044224,True,absolute_error,43,,1,4,266,TPESampler,COMPLETE
646,0.4021188606756917,2025-04-24 22:29:12.483180,2025-04-24 22:29:15.548055,0 days 00:00:03.064875,True,absolute_error,49,sqrt,1,2,136,TPESampler,COMPLETE
647,0.37328988316519374,2025-04-24 22:29:15.733246,2025-04-24 22:29:51.385986,0 days 00:00:35.652740,True,absolute_error,43,,1,2,364,TPESampler,COMPLETE
648,0.532881756732059,2025-04-24 22:29:21.870687,2025-04-24 22:29:29.665480,0 days 00:00:07.794793,True,absolute_error,34,,7,16,418,TPESampler,COMPLETE
649,0.36974133630679273,2025-04-24 22:29:22.255015,2025-04-24 22:29:50.522084,0 days 00:00:28.267069,True,absolute_error,43,,1,2,299,TPESampler,COMPLETE
650,0.37172331866255126,2025-04-24 22:29:29.844683,2025-04-24 22:30:02.886780,0 days 00:00:33.042097,True,absolute_error,48,,1,2,348,TPESampler,COMPLETE
651,0.3701524251443083,2025-04-24 22:29:50.705202,2025-04-24 22:30:22.703621,0 days 00:00:31.998419,True,absolute_error,50,,1,2,326,TPESampler,COMPLETE
652,0.7583384876159868,2025-04-24 22:29:51.574121,2025-04-24 22:29:52.935481,0 days 00:00:01.361360,True,squared_error,8,sqrt,1,38,677,TPESampler,COMPLETE
653,0.36877531851715467,2025-04-24 22:29:53.099609,2025-04-24 22:30:18.588844,0 days 00:00:25.489235,True,absolute_error,50,,1,2,259,TPESampler,COMPLETE
654,0.4147931433044389,2025-04-24 22:30:03.064190,2025-04-24 22:30:11.616143,0 days 00:00:08.551953,True,absolute_error,49,,2,2,138,TPESampler,COMPLETE
655,0.3682489249740574,2025-04-24 22:30:11.867722,2025-04-24 22:30:25.213899,0 days 00:00:13.346177,True,absolute_error,50,,1,2,133,TPESampler,COMPLETE
656,0.37025644756084447,2025-04-24 22:30:18.763090,2025-04-24 22:30:59.480831,0 days 00:00:40.717741,True,absolute_error,50,,1,3,312,TPESampler,COMPLETE
657,0.413459888581136,2025-04-24 22:30:22.887485,2025-04-24 22:30:55.087949,0 days 00:00:32.200464,True,absolute_error,50,,2,2,397,TPESampler,COMPLETE
658,0.36774425093151825,2025-04-24 22:30:25.386314,2025-04-24 22:30:56.647497,0 days 00:00:31.261183,True,absolute_error,50,,1,2,209,TPESampler,COMPLETE
659,0.41433384005486723,2025-04-24 22:30:55.263284,2025-04-24 22:31:06.041471,0 days 00:00:10.778187,True,absolute_error,38,,2,4,198,TPESampler,COMPLETE
660,0.3704717251122091,2025-04-24 22:30:56.828222,2025-04-24 22:31:09.090149,0 days 00:00:12.261927,True,absolute_error,49,,1,2,127,TPESampler,COMPLETE
661,0.3681072761220499,2025-04-24 22:30:59.667143,2025-04-24 22:31:33.855596,0 days 00:00:34.188453,True,absolute_error,42,,1,2,285,TPESampler,COMPLETE
662,0.5129764035201684,2025-04-24 22:31:06.220525,2025-04-24 22:31:07.550633,0 days 00:00:01.330108,True,squared_error,13,,3,24,229,TPESampler,COMPLETE
663,0.4127408747235475,2025-04-24 22:31:07.743463,2025-04-24 22:31:19.742942,0 days 00:00:11.999479,True,absolute_error,41,,2,2,165,TPESampler,COMPLETE
664,0.4366913646308263,2025-04-24 22:31:09.265760,2025-04-24 22:32:02.263136,0 days 00:00:52.997376,False,absolute_error,48,,1,2,319,TPESampler,COMPLETE
665,0.6142802365612714,2025-04-24 22:31:19.934463,2025-04-24 22:31:36.306809,0 days 00:00:16.372346,False,absolute_error,16,sqrt,1,44,586,TPESampler,COMPLETE
666,0.36880341533448757,2025-04-24 22:31:34.030002,2025-04-24 22:32:04.575481,0 days 00:00:30.545479,True,absolute_error,50,,1,2,267,TPESampler,COMPLETE
667,0.4150736889071182,2025-04-24 22:31:36.478825,2025-04-24 22:31:53.262297,0 days 00:00:16.783472,True,absolute_error,50,,2,2,233,TPESampler,COMPLETE
668,0.4654864182962234,2025-04-24 22:31:53.432144,2025-04-24 22:31:54.890465,0 days 00:00:01.458321,True,squared_error,37,,2,28,279,TPESampler,COMPLETE
669,0.3744976082059554,2025-04-24 22:31:55.074660,2025-04-24 22:32:13.442006,0 days 00:00:18.367346,True,absolute_error,45,,1,4,193,TPESampler,COMPLETE
670,0.3702752142489182,2025-04-24 22:32:02.444054,2025-04-24 22:32:27.421267,0 days 00:00:24.977213,True,absolute_error,50,,1,3,268,TPESampler,COMPLETE
671,0.36873896099897047,2025-04-24 22:32:04.751491,2025-04-24 22:32:29.730007,0 days 00:00:24.978516,True,absolute_error,50,,1,2,266,TPESampler,COMPLETE
672,0.37036944236606306,2025-04-24 22:32:13.608180,2025-04-24 22:32:37.437141,0 days 00:00:23.828961,True,absolute_error,41,,1,2,252,TPESampler,COMPLETE
673,0.5724832558784154,2025-04-24 22:32:27.592350,2025-04-24 22:32:46.209758,0 days 00:00:18.617408,False,absolute_error,49,,11,3,673,TPESampler,COMPLETE
674,0.37365812295838635,2025-04-24 22:32:30.149156,2025-04-24 22:32:39.846181,0 days 00:00:09.697025,True,absolute_error,50,,1,3,102,TPESampler,COMPLETE
675,0.5914713590307148,2025-04-24 22:32:37.606910,2025-04-24 22:32:38.858379,0 days 00:00:01.251469,True,squared_error,23,sqrt,2,2,485,TPESampler,COMPLETE
676,0.6020294664645823,2025-04-24 22:32:39.064190,2025-04-24 22:32:49.063499,0 days 00:00:09.999309,True,absolute_error,46,,11,40,787,TPESampler,COMPLETE
677,0.5284549116667121,2025-04-24 22:32:40.029829,2025-04-24 22:32:43.585091,0 days 00:00:03.555262,True,squared_error,16,,6,9,888,TPESampler,COMPLETE
678,0.3735199552680528,2025-04-24 22:32:43.967866,2025-04-24 22:33:20.752005,0 days 00:00:36.784139,True,absolute_error,49,,1,4,317,TPESampler,COMPLETE
679,0.3682489249740574,2025-04-24 22:32:46.457124,2025-04-24 22:33:02.612374,0 days 00:00:16.155250,True,absolute_error,50,,1,2,133,TPESampler,COMPLETE
680,0.41553409428472243,2025-04-24 22:32:49.372862,2025-04-24 22:33:01.976666,0 days 00:00:12.603804,True,absolute_error,42,,2,2,178,TPESampler,COMPLETE
681,0.3681479644737666,2025-04-24 22:33:02.172113,2025-04-24 22:33:28.983963,0 days 00:00:26.811850,True,absolute_error,50,,1,2,215,TPESampler,COMPLETE
682,0.37150213922503084,2025-04-24 22:33:02.847199,2025-04-24 22:33:34.882039,0 days 00:00:32.034840,True,absolute_error,40,,1,3,269,TPESampler,COMPLETE
683,0.7847601238726002,2025-04-24 22:33:20.942527,2025-04-24 22:33:22.493769,0 days 00:00:01.551242,False,absolute_error,21,log2,2,4,120,TPESampler,COMPLETE
684,0.3674474952065946,2025-04-24 22:33:22.673192,2025-04-24 22:33:50.530768,0 days 00:00:27.857576,True,absolute_error,50,,1,2,294,TPESampler,COMPLETE
685,0.4187511723818031,2025-04-24 22:33:29.163917,2025-04-24 22:33:31.772329,0 days 00:00:02.608412,True,squared_error,50,,2,2,464,TPESampler,COMPLETE
686,0.3739484841955683,2025-04-24 22:33:31.956600,2025-04-24 22:33:41.575641,0 days 00:00:09.619041,True,absolute_error,39,,1,2,100,TPESampler,COMPLETE
687,0.3695707725054709,2025-04-24 22:33:35.062416,2025-04-24 22:34:16.285917,0 days 00:00:41.223501,True,absolute_error,50,,1,2,410,TPESampler,COMPLETE
688,0.5139132652801182,2025-04-24 22:33:41.758983,2025-04-24 22:33:45.934886,0 days 00:00:04.175903,True,absolute_error,36,log2,1,2,304,TPESampler,COMPLETE
689,0.415007469228944,2025-04-24 22:33:46.112345,2025-04-24 22:34:04.127625,0 days 00:00:18.015280,True,absolute_error,47,,2,4,285,TPESampler,COMPLETE
690,0.44928559302896487,2025-04-24 22:33:50.703123,2025-04-24 22:34:19.647976,0 days 00:00:28.944853,False,absolute_error,34,,1,3,181,TPESampler,COMPLETE
691,0.36876795353470143,2025-04-24 22:34:04.354030,2025-04-24 22:34:31.675675,0 days 00:00:27.321645,True,absolute_error,50,,1,3,295,TPESampler,COMPLETE
692,0.3911433604727776,2025-04-24 22:34:16.464681,2025-04-24 22:34:17.640103,0 days 00:00:01.175422,True,squared_error,46,sqrt,1,2,206,TPESampler,COMPLETE
693,0.4164271217824167,2025-04-24 22:34:17.811027,2025-04-24 22:34:32.037056,0 days 00:00:14.226029,True,absolute_error,43,,2,2,271,TPESampler,COMPLETE
694,0.4795028790605501,2025-04-24 22:34:19.833245,2025-04-24 22:34:34.952255,0 days 00:00:15.119010,False,absolute_error,50,,2,2,157,TPESampler,COMPLETE
695,0.41526192197261436,2025-04-24 22:34:31.846686,2025-04-24 22:34:49.432444,0 days 00:00:17.585758,True,absolute_error,50,,2,2,310,TPESampler,COMPLETE
696,0.8804330105894629,2025-04-24 22:34:32.240535,2025-04-24 22:34:33.145275,0 days 00:00:00.904740,True,absolute_error,28,sqrt,9,12,132,TPESampler,COMPLETE
697,0.4661204443066517,2025-04-24 22:34:33.318001,2025-04-24 22:35:52.101876,0 days 00:01:18.783875,False,absolute_error,22,,1,5,535,TPESampler,COMPLETE
698,0.4201018890298708,2025-04-24 22:34:35.127976,2025-04-24 22:34:40.996964,0 days 00:00:05.868988,True,absolute_error,50,,2,2,106,TPESampler,COMPLETE
699,0.369173353462661,2025-04-24 22:34:41.184592,2025-04-24 22:35:22.210296,0 days 00:00:41.025704,True,absolute_error,50,,1,2,440,TPESampler,COMPLETE
700,0.3700994213725744,2025-04-24 22:34:49.615104,2025-04-24 22:35:15.452465,0 days 00:00:25.837361,True,absolute_error,43,,1,2,282,TPESampler,COMPLETE
701,0.3726683821008731,2025-04-24 22:35:15.624094,2025-04-24 22:35:36.582952,0 days 00:00:20.958858,True,absolute_error,42,,1,3,181,TPESampler,COMPLETE
702,0.36880341533448757,2025-04-24 22:35:22.385709,2025-04-24 22:35:54.156290,0 days 00:00:31.770581,True,absolute_error,50,,1,2,267,TPESampler,COMPLETE
703,0.8394853955694795,2025-04-24 22:35:36.769808,2025-04-24 22:35:37.720661,0 days 00:00:00.950853,True,squared_error,21,sqrt,6,19,385,TPESampler,COMPLETE
704,0.8666498366512422,2025-04-24 22:35:37.895697,2025-04-24 22:35:38.721279,0 days 00:00:00.825582,False,squared_error,50,log2,3,10,338,TPESampler,COMPLETE
