number,value,datetime_start,datetime_complete,duration,params_bootstrap,params_criterion,params_max_depth,params_max_features,params_min_samples_leaf,params_min_samples_split,params_n_estimators,system_attrs_auto:sampler,state
281,0.6182197372458892,2025-04-24 21:59:34.131800,2025-04-24 21:59:35.460594,0 days 00:00:01.328794,True,squared_error,26,,15,6,306,TPESampler,COMPLETE
282,0.416959832515847,2025-04-24 21:59:35.628265,2025-04-24 21:59:42.185867,0 days 00:00:06.557602,True,absolute_error,40,,2,2,115,TPESampler,COMPLETE
283,0.7397348321830607,2025-04-24 21:59:41.919873,2025-04-24 21:59:47.053139,0 days 00:00:05.133266,False,absolute_error,48,sqrt,6,2,702,TPESampler,COMPLETE
284,0.3698190884687568,2025-04-24 21:59:42.361336,2025-04-24 22:00:10.066663,0 days 00:00:27.705327,True,absolute_error,38,,1,2,284,TPESampler,COMPLETE
285,0.4172627330053671,2025-04-24 21:59:47.216567,2025-04-24 21:59:55.658767,0 days 00:00:08.442200,True,absolute_error,48,,2,6,158,TPESampler,COMPLETE
286,0.37077887740137,2025-04-24 21:59:49.261205,2025-04-24 22:00:04.841266,0 days 00:00:15.580061,True,absolute_error,41,,1,2,169,TPESampler,COMPLETE
287,0.3876487537859646,2025-04-24 21:59:55.825265,2025-04-24 21:59:58.913647,0 days 00:00:03.088382,True,squared_error,49,,1,3,439,TPESampler,COMPLETE
288,0.3677137279188673,2025-04-24 21:59:59.081291,2025-04-24 22:00:19.825069,0 days 00:00:20.743778,True,absolute_error,50,,1,2,207,TPESampler,COMPLETE
289,0.9714219386130959,2025-04-24 22:00:05.014737,2025-04-24 22:00:05.638506,0 days 00:00:00.623769,True,squared_error,38,log2,12,31,103,TPESampler,COMPLETE
290,0.900011426105215,2025-04-24 22:00:05.801967,2025-04-24 22:00:09.873556,0 days 00:00:04.071589,False,absolute_error,9,log2,4,5,795,TPESampler,COMPLETE
291,0.5789134715353748,2025-04-24 22:00:10.039791,2025-04-24 22:00:13.061337,0 days 00:00:03.021546,True,squared_error,5,,1,2,793,TPESampler,COMPLETE
292,0.6766075570578685,2025-04-24 22:00:10.225393,2025-04-24 22:00:12.334445,0 days 00:00:02.109052,True,squared_error,21,sqrt,3,11,810,TPESampler,COMPLETE
293,0.8650891432200472,2025-04-24 22:00:12.868845,2025-04-24 22:00:15.933290,0 days 00:00:03.064445,False,absolute_error,49,sqrt,13,38,867,TPESampler,COMPLETE
294,0.3692488297107198,2025-04-24 22:00:13.270104,2025-04-24 22:00:25.929676,0 days 00:00:12.659572,True,absolute_error,49,,1,2,116,TPESampler,COMPLETE
295,0.9205614674487564,2025-04-24 22:00:16.101121,2025-04-24 22:00:16.780146,0 days 00:00:00.679025,False,squared_error,31,log2,4,8,203,TPESampler,COMPLETE
296,0.37294461993077727,2025-04-24 22:00:16.963082,2025-04-24 22:00:41.073581,0 days 00:00:24.110499,True,absolute_error,49,,1,4,254,TPESampler,COMPLETE
297,0.4151358798717744,2025-04-24 22:00:20.101975,2025-04-24 22:00:39.145634,0 days 00:00:19.043659,True,absolute_error,42,,2,3,372,TPESampler,COMPLETE
298,0.4154837532910082,2025-04-24 22:00:26.100155,2025-04-24 22:00:42.549042,0 days 00:00:16.448887,True,absolute_error,50,,2,2,322,TPESampler,COMPLETE
299,0.44166314955860364,2025-04-24 22:00:39.312293,2025-04-24 22:01:12.349771,0 days 00:00:33.037478,False,absolute_error,41,,1,2,211,TPESampler,COMPLETE
300,0.3711471596726601,2025-04-24 22:00:41.234547,2025-04-24 22:00:51.097494,0 days 00:00:09.862947,True,absolute_error,50,,1,2,104,TPESampler,COMPLETE
301,0.37072728979145275,2025-04-24 22:00:42.729177,2025-04-24 22:01:22.832019,0 days 00:00:40.102842,True,absolute_error,50,,1,2,387,TPESampler,COMPLETE
302,0.5371526359239887,2025-04-24 22:00:51.272413,2025-04-24 22:01:09.978775,0 days 00:00:18.706362,False,absolute_error,35,log2,1,6,630,TPESampler,COMPLETE
303,0.47981994359041374,2025-04-24 22:01:10.143081,2025-04-24 22:01:33.270334,0 days 00:00:23.127253,False,absolute_error,47,,2,2,246,TPESampler,COMPLETE
304,0.37141568892179905,2025-04-24 22:01:12.573587,2025-04-24 22:01:29.348466,0 days 00:00:16.774879,True,absolute_error,48,,1,2,176,TPESampler,COMPLETE
305,0.7552931164176723,2025-04-24 22:01:23.000021,2025-04-24 22:01:24.271589,0 days 00:00:01.271568,False,squared_error,14,log2,1,4,703,TPESampler,COMPLETE
306,0.369916847608108,2025-04-24 22:01:24.446767,2025-04-24 22:01:53.497255,0 days 00:00:29.050488,True,absolute_error,50,,1,2,319,TPESampler,COMPLETE
307,0.38393157871433586,2025-04-24 22:01:29.622447,2025-04-24 22:01:32.060175,0 days 00:00:02.437728,True,squared_error,46,,1,2,296,TPESampler,COMPLETE
308,0.3736631640372766,2025-04-24 22:01:32.232921,2025-04-24 22:01:55.611350,0 days 00:00:23.378429,True,absolute_error,41,,1,4,258,TPESampler,COMPLETE
309,0.3681306664129636,2025-04-24 22:01:33.459848,2025-04-24 22:01:51.889199,0 days 00:00:18.429351,True,absolute_error,50,,1,2,201,TPESampler,COMPLETE
310,0.3992763778163601,2025-04-24 22:01:52.055102,2025-04-24 22:01:53.522083,0 days 00:00:01.466981,False,squared_error,44,,1,2,108,TPESampler,COMPLETE
311,0.3684066957362781,2025-04-24 22:01:53.638999,2025-04-24 22:02:17.210798,0 days 00:00:23.571799,True,absolute_error,50,,1,2,237,TPESampler,COMPLETE
312,0.3683036712253051,2025-04-24 22:01:53.680439,2025-04-24 22:02:13.459720,0 days 00:00:19.779281,True,absolute_error,50,,1,2,200,TPESampler,COMPLETE
313,0.9503291867653038,2025-04-24 22:01:55.797355,2025-04-24 22:01:57.505030,0 days 00:00:01.707675,True,absolute_error,5,log2,15,3,831,TPESampler,COMPLETE
314,0.3782424233549317,2025-04-24 22:01:57.668335,2025-04-24 22:02:07.757571,0 days 00:00:10.089236,True,absolute_error,50,,1,4,108,TPESampler,COMPLETE
315,0.9126170156131821,2025-04-24 22:02:07.926209,2025-04-24 22:02:11.303005,0 days 00:00:03.376796,False,absolute_error,34,log2,5,34,928,TPESampler,COMPLETE
316,0.41521112086205525,2025-04-24 22:02:11.464928,2025-04-24 22:02:33.586455,0 days 00:00:22.121527,True,absolute_error,45,,2,2,309,TPESampler,COMPLETE
317,0.8274212696943429,2025-04-24 22:02:13.657124,2025-04-24 22:02:15.881850,0 days 00:00:02.224726,True,absolute_error,24,sqrt,6,8,461,TPESampler,COMPLETE
318,0.3724412829385382,2025-04-24 22:02:16.042665,2025-04-24 22:02:38.087339,0 days 00:00:22.044674,True,absolute_error,40,,1,2,174,TPESampler,COMPLETE
319,0.3964956607408482,2025-04-24 22:02:17.387331,2025-04-24 22:02:29.889256,0 days 00:00:12.501925,True,absolute_error,50,sqrt,1,2,383,TPESampler,COMPLETE
320,0.4139096693200063,2025-04-24 22:02:30.057638,2025-04-24 22:02:42.946208,0 days 00:00:12.888570,True,absolute_error,50,,2,3,215,TPESampler,COMPLETE
321,0.8285351715563927,2025-04-24 22:02:33.762728,2025-04-24 22:02:35.643588,0 days 00:00:01.880860,True,absolute_error,48,log2,2,2,299,TPESampler,COMPLETE
322,0.5425740284292294,2025-04-24 22:02:35.800982,2025-04-24 22:02:38.536864,0 days 00:00:02.735882,True,squared_error,41,,4,46,749,TPESampler,COMPLETE
323,0.4539704018035486,2025-04-24 22:02:38.269053,2025-04-24 22:02:40.608527,0 days 00:00:02.339474,True,absolute_error,49,log2,1,3,129,TPESampler,COMPLETE
324,0.369061306831593,2025-04-24 22:02:38.719401,2025-04-24 22:03:03.627024,0 days 00:00:24.907623,True,absolute_error,49,,1,2,264,TPESampler,COMPLETE
325,0.5119632624716027,2025-04-24 22:02:40.824206,2025-04-24 22:03:14.141376,0 days 00:00:33.317170,False,absolute_error,31,,6,7,813,TPESampler,COMPLETE
326,0.36699893860191507,2025-04-24 22:02:43.219379,2025-04-24 22:02:58.569563,0 days 00:00:15.350184,True,absolute_error,49,,1,2,161,TPESampler,COMPLETE
327,0.3720178739704896,2025-04-24 22:02:58.876042,2025-04-24 22:03:09.828222,0 days 00:00:10.952180,True,absolute_error,50,,1,3,105,TPESampler,COMPLETE
328,0.372878186026281,2025-04-24 22:03:03.804883,2025-04-24 22:03:16.395194,0 days 00:00:12.590311,True,absolute_error,39,,1,2,122,TPESampler,COMPLETE
329,0.5624219811823514,2025-04-24 22:03:10.003711,2025-04-24 22:03:11.868312,0 days 00:00:01.864601,True,squared_error,48,log2,1,45,953,TPESampler,COMPLETE
330,0.5327440663271819,2025-04-24 22:03:12.029528,2025-04-24 22:03:13.289236,0 days 00:00:01.259708,True,squared_error,8,,1,3,210,TPESampler,COMPLETE
331,0.42621741122336554,2025-04-24 22:03:13.468376,2025-04-24 22:03:15.930216,0 days 00:00:02.461840,True,absolute_error,39,sqrt,1,2,106,TPESampler,COMPLETE
332,0.4154785530944353,2025-04-24 22:03:14.358025,2025-04-24 22:03:22.834704,0 days 00:00:08.476679,True,absolute_error,49,,2,2,150,TPESampler,COMPLETE
333,0.6505400143404919,2025-04-24 22:03:16.107429,2025-04-24 22:03:17.704288,0 days 00:00:01.596859,True,squared_error,23,log2,1,7,610,TPESampler,COMPLETE
334,0.37017327804441497,2025-04-24 22:03:16.564162,2025-04-24 22:03:45.854894,0 days 00:00:29.290732,True,absolute_error,42,,1,2,320,TPESampler,COMPLETE
335,0.59475730027386,2025-04-24 22:03:17.871533,2025-04-24 22:03:20.333700,0 days 00:00:02.462167,True,absolute_error,5,,10,2,174,TPESampler,COMPLETE
336,0.36763180568217557,2025-04-24 22:03:20.508300,2025-04-24 22:03:39.444382,0 days 00:00:18.936082,True,absolute_error,50,,1,2,205,TPESampler,COMPLETE
337,0.3678121541733018,2025-04-24 22:03:23.017723,2025-04-24 22:03:34.174536,0 days 00:00:11.156813,True,absolute_error,50,,1,2,118,TPESampler,COMPLETE
338,0.36909585391674177,2025-04-24 22:03:34.347925,2025-04-24 22:03:46.990855,0 days 00:00:12.642930,True,absolute_error,49,,1,2,135,TPESampler,COMPLETE
339,0.3671925566909878,2025-04-24 22:03:39.729490,2025-04-24 22:03:53.905193,0 days 00:00:14.175703,True,absolute_error,49,,1,2,152,TPESampler,COMPLETE
340,0.419989126575698,2025-04-24 22:03:46.019230,2025-04-24 22:03:51.600589,0 days 00:00:05.581359,True,absolute_error,49,,2,2,100,TPESampler,COMPLETE
341,0.37544721244114376,2025-04-24 22:03:47.169535,2025-04-24 22:04:01.541535,0 days 00:00:14.372000,True,absolute_error,38,,1,4,154,TPESampler,COMPLETE
342,0.3689348084913331,2025-04-24 22:03:51.779645,2025-04-24 22:04:03.450797,0 days 00:00:11.671152,True,absolute_error,50,,1,2,119,TPESampler,COMPLETE
343,0.9756947440701514,2025-04-24 22:03:54.069459,2025-04-24 22:03:55.120681,0 days 00:00:01.051222,True,squared_error,21,log2,14,2,368,TPESampler,COMPLETE
344,0.3716874306345989,2025-04-24 22:03:55.291259,2025-04-24 22:04:11.482876,0 days 00:00:16.191617,True,absolute_error,40,,1,3,168,TPESampler,COMPLETE
345,0.44124430388485625,2025-04-24 22:04:01.719456,2025-04-24 22:04:08.783327,0 days 00:00:07.063871,False,squared_error,35,,2,2,1000,TPESampler,COMPLETE
346,0.4953475511028623,2025-04-24 22:04:03.626996,2025-04-24 22:04:04.823802,0 days 00:00:01.196806,True,squared_error,47,log2,1,8,383,TPESampler,COMPLETE
347,0.9114808586457457,2025-04-24 22:04:04.996269,2025-04-24 22:04:06.290451,0 days 00:00:01.294182,False,absolute_error,10,log2,5,3,260,TPESampler,COMPLETE
348,0.5730403007308305,2025-04-24 22:04:06.454057,2025-04-24 22:04:28.235894,0 days 00:00:21.781837,False,absolute_error,7,,4,46,420,TPESampler,COMPLETE
349,0.8251926945646133,2025-04-24 22:04:08.958468,2025-04-24 22:04:10.235043,0 days 00:00:01.276575,False,squared_error,11,log2,1,42,903,TPESampler,COMPLETE
350,0.5893458755833099,2025-04-24 22:04:10.416538,2025-04-24 22:04:13.050343,0 days 00:00:02.633805,True,absolute_error,43,sqrt,2,39,199,TPESampler,COMPLETE
351,0.3695925633337324,2025-04-24 22:04:11.652455,2025-04-24 22:04:27.204294,0 days 00:00:15.551839,True,absolute_error,46,,1,2,167,TPESampler,COMPLETE
352,0.37605329918014085,2025-04-24 22:04:13.223740,2025-04-24 22:04:22.969331,0 days 00:00:09.745591,True,absolute_error,44,,1,2,104,TPESampler,COMPLETE
353,0.9519896720942395,2025-04-24 22:04:23.136300,2025-04-24 22:04:24.470658,0 days 00:00:01.334358,True,absolute_error,25,log2,15,26,642,TPESampler,COMPLETE
354,0.3688516163615531,2025-04-24 22:04:24.636737,2025-04-24 22:04:39.173335,0 days 00:00:14.536598,True,absolute_error,50,,1,2,139,TPESampler,COMPLETE
355,0.9531281279924104,2025-04-24 22:04:27.420229,2025-04-24 22:04:28.187744,0 days 00:00:00.767515,True,squared_error,48,log2,5,4,223,TPESampler,COMPLETE
356,0.4780264287583683,2025-04-24 22:04:28.318867,2025-04-24 22:05:30.954715,0 days 00:01:02.635848,False,absolute_error,48,,2,13,682,TPESampler,COMPLETE
357,0.36905299074005854,2025-04-24 22:04:28.365127,2025-04-24 22:04:52.136405,0 days 00:00:23.771278,True,absolute_error,49,,1,2,242,TPESampler,COMPLETE
358,0.43642023982241235,2025-04-24 22:04:39.378172,2025-04-24 22:05:22.692570,0 days 00:00:43.314398,False,absolute_error,48,,1,2,283,TPESampler,COMPLETE
359,0.36798785255788213,2025-04-24 22:04:52.304210,2025-04-24 22:05:08.360367,0 days 00:00:16.056157,True,absolute_error,50,,1,2,173,TPESampler,COMPLETE
360,0.36941533855573405,2025-04-24 22:05:08.541007,2025-04-24 22:05:20.837875,0 days 00:00:12.296868,True,absolute_error,50,,1,2,128,TPESampler,COMPLETE
361,0.9658071874262667,2025-04-24 22:05:21.066320,2025-04-24 22:05:22.084365,0 days 00:00:01.018045,False,squared_error,49,log2,13,14,491,TPESampler,COMPLETE
362,0.38150050829054766,2025-04-24 22:05:22.249292,2025-04-24 22:05:23.672486,0 days 00:00:01.423194,True,squared_error,50,,1,2,123,TPESampler,COMPLETE
363,0.37413642885858006,2025-04-24 22:05:22.923723,2025-04-24 22:05:37.976373,0 days 00:00:15.052650,True,absolute_error,44,,1,4,162,TPESampler,COMPLETE
364,0.37460013139499226,2025-04-24 22:05:23.847280,2025-04-24 22:05:37.868750,0 days 00:00:14.021470,False,absolute_error,49,sqrt,1,2,412,TPESampler,COMPLETE
365,0.9607314251647983,2025-04-24 22:05:31.116701,2025-04-24 22:05:31.956537,0 days 00:00:00.839836,True,squared_error,12,log2,9,9,308,TPESampler,COMPLETE
366,0.3694905743325211,2025-04-24 22:05:32.115945,2025-04-24 22:05:44.600785,0 days 00:00:12.484840,True,absolute_error,49,,1,2,130,TPESampler,COMPLETE
367,0.953674030768037,2025-04-24 22:05:38.045104,2025-04-24 22:05:39.256589,0 days 00:00:01.211485,True,squared_error,31,log2,6,22,486,TPESampler,COMPLETE
368,0.37317858181781755,2025-04-24 22:05:38.160353,2025-04-24 22:06:07.786690,0 days 00:00:29.626337,True,absolute_error,48,,1,4,315,TPESampler,COMPLETE
369,0.860667013001594,2025-04-24 22:05:39.435205,2025-04-24 22:05:40.670357,0 days 00:00:01.235152,False,squared_error,8,sqrt,10,6,738,TPESampler,COMPLETE
370,0.3677096833107751,2025-04-24 22:05:40.844976,2025-04-24 22:06:00.482723,0 days 00:00:19.637747,True,absolute_error,50,,1,2,206,TPESampler,COMPLETE
371,0.41562636038106604,2025-04-24 22:05:44.781608,2025-04-24 22:05:57.732552,0 days 00:00:12.950944,True,absolute_error,42,,2,2,240,TPESampler,COMPLETE
372,0.3667211564672407,2025-04-24 22:05:57.900893,2025-04-24 22:06:12.643749,0 days 00:00:14.742856,True,absolute_error,50,,1,2,157,TPESampler,COMPLETE
373,0.37504916973484176,2025-04-24 22:06:00.670054,2025-04-24 22:06:16.639527,0 days 00:00:15.969473,True,absolute_error,49,,1,4,173,TPESampler,COMPLETE
374,0.4839490272713073,2025-04-24 22:06:07.966775,2025-04-24 22:06:10.480863,0 days 00:00:02.514088,True,absolute_error,40,log2,1,2,161,TPESampler,COMPLETE
375,0.3712612439089122,2025-04-24 22:06:10.664012,2025-04-24 22:06:41.364401,0 days 00:00:30.700389,True,absolute_error,40,,1,2,275,TPESampler,COMPLETE
376,0.8635873866116807,2025-04-24 22:06:12.905231,2025-04-24 22:06:14.045393,0 days 00:00:01.140162,False,squared_error,30,log2,3,21,778,TPESampler,COMPLETE
377,0.3689628657679296,2025-04-24 22:06:14.223929,2025-04-24 22:06:46.890946,0 days 00:00:32.667017,True,absolute_error,50,,1,2,312,TPESampler,COMPLETE
378,0.5057254401237853,2025-04-24 22:06:16.817115,2025-04-24 22:07:20.399890,0 days 00:01:03.582775,False,absolute_error,15,,3,47,919,TPESampler,COMPLETE
379,0.7380667116256416,2025-04-24 22:06:41.536415,2025-04-24 22:06:44.194814,0 days 00:00:02.658399,False,absolute_error,22,sqrt,6,9,331,TPESampler,COMPLETE
380,0.37362655632744474,2025-04-24 22:06:44.532957,2025-04-24 22:07:08.164560,0 days 00:00:23.631603,True,absolute_error,49,,1,4,262,TPESampler,COMPLETE
381,0.3696831904153646,2025-04-24 22:06:47.072043,2025-04-24 22:07:02.538317,0 days 00:00:15.466274,True,absolute_error,50,,1,3,170,TPESampler,COMPLETE
382,0.3687756942178923,2025-04-24 22:07:02.706066,2025-04-24 22:07:16.885880,0 days 00:00:14.179814,True,absolute_error,49,,1,2,140,TPESampler,COMPLETE
383,0.43531122881792833,2025-04-24 22:07:08.337417,2025-04-24 22:07:29.136584,0 days 00:00:20.799167,False,absolute_error,48,,1,2,123,TPESampler,COMPLETE
384,0.8963621331768672,2025-04-24 22:07:17.063965,2025-04-24 22:07:17.893399,0 days 00:00:00.829434,True,squared_error,5,sqrt,8,36,311,TPESampler,COMPLETE
385,0.41706229143045626,2025-04-24 22:07:18.052360,2025-04-24 22:07:31.986790,0 days 00:00:13.934430,True,absolute_error,49,,2,2,263,TPESampler,COMPLETE
386,0.3724270291379156,2025-04-24 22:07:20.562274,2025-04-24 22:07:33.154350,0 days 00:00:12.592076,True,absolute_error,42,,1,2,129,TPESampler,COMPLETE
387,0.9171218096089399,2025-04-24 22:07:29.318227,2025-04-24 22:07:31.622948,0 days 00:00:02.304721,True,absolute_error,49,log2,4,23,860,TPESampler,COMPLETE
388,0.3678785057891335,2025-04-24 22:07:31.795332,2025-04-24 22:07:51.976188,0 days 00:00:20.180856,True,absolute_error,49,,1,2,209,TPESampler,COMPLETE
389,0.554896584375508,2025-04-24 22:07:32.231611,2025-04-24 22:07:38.613195,0 days 00:00:06.381584,True,absolute_error,18,sqrt,1,2,427,TPESampler,COMPLETE
390,0.3677077321708779,2025-04-24 22:07:33.336578,2025-04-24 22:07:56.769327,0 days 00:00:23.432749,True,absolute_error,50,,1,2,254,TPESampler,COMPLETE
391,0.37772679794577296,2025-04-24 22:07:38.790077,2025-04-24 22:07:49.188222,0 days 00:00:10.398145,True,absolute_error,50,,1,4,105,TPESampler,COMPLETE
392,0.3713778086908851,2025-04-24 22:07:49.538378,2025-04-24 22:08:10.403970,0 days 00:00:20.865592,True,absolute_error,40,,1,2,207,TPESampler,COMPLETE
393,0.37148650973038616,2025-04-24 22:07:52.319582,2025-04-24 22:08:04.387433,0 days 00:00:12.067851,True,absolute_error,49,,1,2,105,TPESampler,COMPLETE
394,0.619647468129378,2025-04-24 22:07:56.944219,2025-04-24 22:08:04.608491,0 days 00:00:07.664272,True,absolute_error,17,sqrt,1,44,465,TPESampler,COMPLETE
395,0.4162422491673935,2025-04-24 22:08:04.558613,2025-04-24 22:08:20.616873,0 days 00:00:16.058260,True,absolute_error,50,,2,3,275,TPESampler,COMPLETE
396,0.4154060922279037,2025-04-24 22:08:04.798185,2025-04-24 22:08:16.580094,0 days 00:00:11.781909,True,absolute_error,50,,2,2,193,TPESampler,COMPLETE
397,0.3680814197219929,2025-04-24 22:08:10.580436,2025-04-24 22:08:49.790627,0 days 00:00:39.210191,True,absolute_error,42,,1,2,300,TPESampler,COMPLETE
398,0.42139463874194366,2025-04-24 22:08:16.739399,2025-04-24 22:08:19.329953,0 days 00:00:02.590554,False,squared_error,39,sqrt,1,5,954,TPESampler,COMPLETE
399,0.3704510436741181,2025-04-24 22:08:19.506211,2025-04-24 22:08:52.529779,0 days 00:00:33.023568,True,absolute_error,48,,1,2,235,TPESampler,COMPLETE
400,0.3681172543627907,2025-04-24 22:08:20.796359,2025-04-24 22:08:54.746981,0 days 00:00:33.950622,True,absolute_error,49,,1,2,250,TPESampler,COMPLETE
401,0.372266690939889,2025-04-24 22:08:49.971386,2025-04-24 22:09:22.234868,0 days 00:00:32.263482,True,absolute_error,41,,1,2,317,TPESampler,COMPLETE
402,0.6032277969989732,2025-04-24 22:08:52.722579,2025-04-24 22:08:55.440123,0 days 00:00:02.717544,True,absolute_error,21,,13,28,218,TPESampler,COMPLETE
403,0.8960759248038593,2025-04-24 22:08:54.921411,2025-04-24 22:08:55.800608,0 days 00:00:00.879197,True,absolute_error,22,log2,3,18,143,TPESampler,COMPLETE
404,0.7262912035612333,2025-04-24 22:08:55.612082,2025-04-24 22:08:56.779498,0 days 00:00:01.167416,False,squared_error,11,sqrt,4,13,455,TPESampler,COMPLETE
405,0.8455402644747043,2025-04-24 22:08:55.992666,2025-04-24 22:08:58.260110,0 days 00:00:02.267444,False,absolute_error,48,log2,3,2,281,TPESampler,COMPLETE
406,0.41371106858503415,2025-04-24 22:08:56.945306,2025-04-24 22:09:09.353442,0 days 00:00:12.408136,True,absolute_error,38,,2,4,212,TPESampler,COMPLETE
407,0.37159558807535065,2025-04-24 22:08:58.454896,2025-04-24 22:09:37.797025,0 days 00:00:39.342129,True,absolute_error,50,,1,2,369,TPESampler,COMPLETE
408,0.3706095156567645,2025-04-24 22:09:09.518640,2025-04-24 22:09:43.071071,0 days 00:00:33.552431,True,absolute_error,41,,1,2,303,TPESampler,COMPLETE
409,0.3706793954648111,2025-04-24 22:09:22.395946,2025-04-24 22:10:06.306350,0 days 00:00:43.910404,True,absolute_error,39,,1,2,429,TPESampler,COMPLETE
410,0.4185636203596232,2025-04-24 22:09:37.967027,2025-04-24 22:09:39.859177,0 days 00:00:01.892150,True,squared_error,44,,2,3,303,TPESampler,COMPLETE
411,0.36833710791882474,2025-04-24 22:09:40.025767,2025-04-24 22:10:06.788230,0 days 00:00:26.762463,True,absolute_error,49,,1,2,248,TPESampler,COMPLETE
412,0.3679782471480686,2025-04-24 22:09:43.243443,2025-04-24 22:10:10.673280,0 days 00:00:27.429837,True,absolute_error,50,,1,2,274,TPESampler,COMPLETE
413,0.4418426838403468,2025-04-24 22:10:06.468720,2025-04-24 22:10:27.454074,0 days 00:00:20.985354,False,absolute_error,49,,1,8,136,TPESampler,COMPLETE
414,0.372285465597474,2025-04-24 22:10:07.026035,2025-04-24 22:10:50.021342,0 days 00:00:42.995307,True,absolute_error,41,,1,3,396,TPESampler,COMPLETE
415,0.5297718446242338,2025-04-24 22:10:10.841041,2025-04-24 22:10:13.596267,0 days 00:00:02.755226,True,squared_error,37,,6,6,719,TPESampler,COMPLETE
416,0.3706664414166296,2025-04-24 22:10:13.762097,2025-04-24 22:10:58.792917,0 days 00:00:45.030820,True,absolute_error,50,,1,3,414,TPESampler,COMPLETE
417,0.4010152759401484,2025-04-24 22:10:27.618564,2025-04-24 22:10:30.569273,0 days 00:00:02.950709,True,absolute_error,47,sqrt,1,2,134,TPESampler,COMPLETE
418,0.3693631928516088,2025-04-24 22:10:30.727672,2025-04-24 22:11:01.904138,0 days 00:00:31.176466,True,absolute_error,42,,1,2,262,TPESampler,COMPLETE
419,0.37180393495119735,2025-04-24 22:10:50.203306,2025-04-24 22:11:21.043303,0 days 00:00:30.839997,True,absolute_error,49,,1,4,307,TPESampler,COMPLETE
420,0.41509301261576537,2025-04-24 22:10:58.966646,2025-04-24 22:11:10.604492,0 days 00:00:11.637846,True,absolute_error,41,,2,2,183,TPESampler,COMPLETE
421,0.674382861814021,2025-04-24 22:11:02.078080,2025-04-24 22:11:09.131373,0 days 00:00:07.053293,True,absolute_error,27,sqrt,3,16,779,TPESampler,COMPLETE
