number,value,datetime_start,datetime_complete,duration,params_bootstrap,params_criterion,params_max_depth,params_max_features,params_min_samples_leaf,params_min_samples_split,params_n_estimators,system_attrs_auto:sampler,state
705,0.36743124419201056,2025-04-24 22:35:38.899327,2025-04-24 22:36:11.436706,0 days 00:00:32.537379,True,absolute_error,50,,1,2,284,TPESampler,COMPLETE
706,0.8971480277513754,2025-04-24 22:35:52.300961,2025-04-24 22:35:54.527181,0 days 00:00:02.226220,False,absolute_error,19,log2,4,27,445,TPESampler,COMPLETE
707,0.3733786415074122,2025-04-24 22:35:54.333668,2025-04-24 22:36:36.833968,0 days 00:00:42.500300,True,absolute_error,44,,1,2,325,TPESampler,COMPLETE
708,0.5899664411273465,2025-04-24 22:35:54.735711,2025-04-24 22:36:02.770176,0 days 00:00:08.034465,True,absolute_error,11,,11,7,513,TPESampler,COMPLETE
709,0.9343849152129262,2025-04-24 22:36:02.992057,2025-04-24 22:36:04.577558,0 days 00:00:01.585501,False,absolute_error,33,log2,9,47,466,TPESampler,COMPLETE
710,0.5371100484898428,2025-04-24 22:36:04.751140,2025-04-24 22:36:09.836727,0 days 00:00:05.085587,False,squared_error,17,,4,6,996,TPESampler,COMPLETE
711,0.3738575063060289,2025-04-24 22:36:10.012179,2025-04-24 22:36:42.477445,0 days 00:00:32.465266,True,absolute_error,50,,1,4,257,TPESampler,COMPLETE
712,0.3723679554847699,2025-04-24 22:36:11.613797,2025-04-24 22:37:01.550338,0 days 00:00:49.936541,True,absolute_error,47,,1,4,434,TPESampler,COMPLETE
713,0.37068322197359804,2025-04-24 22:36:37.213581,2025-04-24 22:37:00.266726,0 days 00:00:23.053145,True,absolute_error,43,,1,2,244,TPESampler,COMPLETE
714,0.36767225953044724,2025-04-24 22:36:42.657336,2025-04-24 22:37:00.225920,0 days 00:00:17.568584,True,absolute_error,50,,1,2,189,TPESampler,COMPLETE
715,0.3704481502376233,2025-04-24 22:37:00.348980,2025-04-24 22:37:45.661756,0 days 00:00:45.312776,True,absolute_error,42,,1,2,322,TPESampler,COMPLETE
716,0.3709807998290601,2025-04-24 22:37:00.396821,2025-04-24 22:37:54.725214,0 days 00:00:54.328393,True,absolute_error,49,,1,2,390,TPESampler,COMPLETE
717,0.36969657685372037,2025-04-24 22:37:01.751560,2025-04-24 22:37:48.400951,0 days 00:00:46.649391,True,absolute_error,50,,1,2,330,TPESampler,COMPLETE
718,0.37492298282480235,2025-04-24 22:37:46.405942,2025-04-24 22:37:57.039252,0 days 00:00:10.633310,True,absolute_error,41,,1,3,101,TPESampler,COMPLETE
719,0.9372432559332505,2025-04-24 22:37:48.680990,2025-04-24 22:37:49.856337,0 days 00:00:01.175347,True,absolute_error,14,log2,9,14,117,TPESampler,COMPLETE
720,0.479440514932494,2025-04-24 22:37:50.110147,2025-04-24 22:37:52.206001,0 days 00:00:02.095854,True,absolute_error,49,log2,1,5,109,TPESampler,COMPLETE
721,0.6545264027325374,2025-04-24 22:37:52.489091,2025-04-24 22:37:54.032220,0 days 00:00:01.543129,False,squared_error,45,sqrt,4,2,795,TPESampler,COMPLETE
722,0.4797410319243753,2025-04-24 22:37:54.203957,2025-04-24 22:38:37.388109,0 days 00:00:43.184152,False,absolute_error,48,,2,2,453,TPESampler,COMPLETE
723,0.6314816590645491,2025-04-24 22:37:55.021642,2025-04-24 22:37:58.665825,0 days 00:00:03.644183,False,squared_error,8,,1,37,765,TPESampler,COMPLETE
724,0.5537768426853724,2025-04-24 22:37:57.237293,2025-04-24 22:38:09.442289,0 days 00:00:12.204996,True,absolute_error,48,,8,6,754,TPESampler,COMPLETE
725,0.5721000113204296,2025-04-24 22:37:58.843031,2025-04-24 22:38:03.655253,0 days 00:00:04.812222,True,absolute_error,50,sqrt,2,2,450,TPESampler,COMPLETE
726,0.8938881806870845,2025-04-24 22:38:03.831830,2025-04-24 22:38:05.420730,0 days 00:00:01.588900,True,squared_error,12,sqrt,9,2,893,TPESampler,COMPLETE
727,0.4178780782130663,2025-04-24 22:38:05.606352,2025-04-24 22:38:06.865931,0 days 00:00:01.259579,True,squared_error,46,,2,2,159,TPESampler,COMPLETE
728,0.3752370616241975,2025-04-24 22:38:07.039690,2025-04-24 22:38:16.567935,0 days 00:00:09.528245,True,absolute_error,48,,1,2,101,TPESampler,COMPLETE
729,0.37384082871249996,2025-04-24 22:38:09.615509,2025-04-24 22:38:23.976186,0 days 00:00:14.360677,True,absolute_error,50,,1,4,146,TPESampler,COMPLETE
730,0.443597739948725,2025-04-24 22:38:16.747368,2025-04-24 22:38:23.437397,0 days 00:00:06.690029,True,absolute_error,41,sqrt,1,7,334,TPESampler,COMPLETE
731,0.9177698027157495,2025-04-24 22:38:23.611189,2025-04-24 22:38:25.612635,0 days 00:00:02.001446,True,absolute_error,32,sqrt,14,2,763,TPESampler,COMPLETE
732,0.41514044225077146,2025-04-24 22:38:24.348556,2025-04-24 22:38:45.333298,0 days 00:00:20.984742,True,absolute_error,48,,2,2,367,TPESampler,COMPLETE
733,0.3706838465862199,2025-04-24 22:38:25.791900,2025-04-24 22:38:37.925304,0 days 00:00:12.133404,True,absolute_error,50,,1,2,126,TPESampler,COMPLETE
734,0.5947294029057463,2025-04-24 22:38:37.552795,2025-04-24 22:38:40.057355,0 days 00:00:02.504560,True,squared_error,5,,3,19,736,TPESampler,COMPLETE
735,0.3693095199903066,2025-04-24 22:38:38.280203,2025-04-24 22:39:05.086870,0 days 00:00:26.806667,True,absolute_error,42,,1,2,270,TPESampler,COMPLETE
736,0.5832283958847405,2025-04-24 22:38:40.231041,2025-04-24 22:38:54.563652,0 days 00:00:14.332611,True,absolute_error,8,,9,11,951,TPESampler,COMPLETE
737,0.4147504455591443,2025-04-24 22:38:45.501719,2025-04-24 22:39:00.780472,0 days 00:00:15.278753,True,absolute_error,50,,2,2,293,TPESampler,COMPLETE
738,0.36847169451556727,2025-04-24 22:38:54.736645,2025-04-24 22:39:22.937904,0 days 00:00:28.201259,True,absolute_error,49,,1,2,298,TPESampler,COMPLETE
739,0.8278193464182458,2025-04-24 22:39:00.967731,2025-04-24 22:39:02.780695,0 days 00:00:01.812964,True,absolute_error,47,log2,2,4,306,TPESampler,COMPLETE
740,0.8730926439166873,2025-04-24 22:39:02.982222,2025-04-24 22:39:04.340166,0 days 00:00:01.357944,False,absolute_error,13,log2,3,40,159,TPESampler,COMPLETE
741,0.3666639331482587,2025-04-24 22:39:04.521231,2025-04-24 22:39:19.303436,0 days 00:00:14.782205,True,absolute_error,50,,1,2,153,TPESampler,COMPLETE
742,0.7994753033090689,2025-04-24 22:39:05.270202,2025-04-24 22:39:06.762375,0 days 00:00:01.492173,True,squared_error,30,sqrt,5,42,778,TPESampler,COMPLETE
743,0.44659779285837997,2025-04-24 22:39:06.948046,2025-04-24 22:39:08.517302,0 days 00:00:01.569256,True,squared_error,50,log2,1,3,429,TPESampler,COMPLETE
744,0.42069606508063623,2025-04-24 22:39:08.710539,2025-04-24 22:39:14.569242,0 days 00:00:05.858703,True,absolute_error,42,,2,3,104,TPESampler,COMPLETE
745,0.4904843832563282,2025-04-24 22:39:14.744781,2025-04-24 22:39:18.725621,0 days 00:00:03.980840,True,squared_error,38,,4,9,999,TPESampler,COMPLETE
746,0.3711289878906034,2025-04-24 22:39:18.924568,2025-04-24 22:39:51.353860,0 days 00:00:32.429292,True,absolute_error,50,,1,3,347,TPESampler,COMPLETE
747,0.3690298914359634,2025-04-24 22:39:19.527928,2025-04-24 22:39:31.051275,0 days 00:00:11.523347,True,absolute_error,50,,1,2,114,TPESampler,COMPLETE
748,0.4150316018066053,2025-04-24 22:39:23.114018,2025-04-24 22:39:33.777873,0 days 00:00:10.663855,True,absolute_error,50,,2,2,188,TPESampler,COMPLETE
749,0.36873896099897047,2025-04-24 22:39:31.219031,2025-04-24 22:39:56.356740,0 days 00:00:25.137709,True,absolute_error,50,,1,2,266,TPESampler,COMPLETE
750,0.39691966869984985,2025-04-24 22:39:33.949492,2025-04-24 22:39:39.897206,0 days 00:00:05.947714,True,absolute_error,49,sqrt,1,2,284,TPESampler,COMPLETE
751,0.3682489249740574,2025-04-24 22:39:40.089700,2025-04-24 22:39:52.770336,0 days 00:00:12.680636,True,absolute_error,50,,1,2,133,TPESampler,COMPLETE
752,0.41620201881216523,2025-04-24 22:39:51.527732,2025-04-24 22:40:06.224566,0 days 00:00:14.696834,True,absolute_error,44,,2,4,274,TPESampler,COMPLETE
753,0.7619147768458283,2025-04-24 22:39:52.950099,2025-04-24 22:39:54.724300,0 days 00:00:01.774201,True,absolute_error,8,sqrt,1,23,152,TPESampler,COMPLETE
754,0.5769036614459575,2025-04-24 22:39:54.895414,2025-04-24 22:39:56.235948,0 days 00:00:01.340534,True,squared_error,7,,6,3,284,TPESampler,COMPLETE
755,0.3869570675711871,2025-04-24 22:39:56.404358,2025-04-24 22:39:59.723166,0 days 00:00:03.318808,True,squared_error,50,,1,2,384,TPESampler,COMPLETE
756,0.6568682070328008,2025-04-24 22:39:56.573414,2025-04-24 22:39:58.056484,0 days 00:00:01.483070,False,squared_error,13,,11,8,207,TPESampler,COMPLETE
757,0.4485985940989683,2025-04-24 22:39:58.239444,2025-04-24 22:39:59.514629,0 days 00:00:01.275185,True,squared_error,37,sqrt,1,8,388,TPESampler,COMPLETE
758,0.37074398477215736,2025-04-24 22:39:59.693489,2025-04-24 22:40:25.362024,0 days 00:00:25.668535,True,absolute_error,42,,1,3,274,TPESampler,COMPLETE
759,0.37459251369508734,2025-04-24 22:39:59.890979,2025-04-24 22:40:21.557818,0 days 00:00:21.666839,True,absolute_error,50,,1,4,230,TPESampler,COMPLETE
760,0.415541901991553,2025-04-24 22:40:06.417785,2025-04-24 22:40:17.932872,0 days 00:00:11.515087,True,absolute_error,50,,2,4,219,TPESampler,COMPLETE
761,0.6590646957655931,2025-04-24 22:40:18.127050,2025-04-24 22:40:21.838619,0 days 00:00:03.711569,False,squared_error,33,,13,5,923,TPESampler,COMPLETE
762,0.3705651427743805,2025-04-24 22:40:21.749438,2025-04-24 22:40:36.774122,0 days 00:00:15.024684,True,absolute_error,41,,1,2,159,TPESampler,COMPLETE
763,0.37457730874347805,2025-04-24 22:40:22.040170,2025-04-24 22:40:44.485644,0 days 00:00:22.445474,True,absolute_error,50,,1,4,232,TPESampler,COMPLETE
764,0.36963308553511376,2025-04-24 22:40:25.543190,2025-04-24 22:40:58.090436,0 days 00:00:32.547246,True,absolute_error,50,,1,2,318,TPESampler,COMPLETE
765,0.3776033669274811,2025-04-24 22:40:36.945622,2025-04-24 22:40:48.248064,0 days 00:00:11.302442,True,absolute_error,43,,1,4,105,TPESampler,COMPLETE
766,0.7484986966313047,2025-04-24 22:40:44.742910,2025-04-24 22:40:57.876288,0 days 00:00:13.133378,False,absolute_error,7,sqrt,1,2,981,TPESampler,COMPLETE
767,0.5368622985017452,2025-04-24 22:40:48.433531,2025-04-24 22:40:49.550583,0 days 00:00:01.117052,True,squared_error,41,,6,16,177,TPESampler,COMPLETE
768,0.36923458901947326,2025-04-24 22:40:49.726242,2025-04-24 22:41:13.513904,0 days 00:00:23.787662,True,absolute_error,42,,1,2,235,TPESampler,COMPLETE
769,0.37004633752178573,2025-04-24 22:40:58.058290,2025-04-24 22:41:10.036752,0 days 00:00:11.978462,True,absolute_error,50,,1,2,127,TPESampler,COMPLETE
770,0.4728496651097025,2025-04-24 22:40:58.290263,2025-04-24 22:41:00.840199,0 days 00:00:02.549936,True,absolute_error,42,log2,1,2,151,TPESampler,COMPLETE
771,0.4349526710861872,2025-04-24 22:41:01.013259,2025-04-24 22:41:34.867375,0 days 00:00:33.854116,False,absolute_error,49,,1,3,220,TPESampler,COMPLETE
772,0.4154839691782877,2025-04-24 22:41:10.207709,2025-04-24 22:41:20.343533,0 days 00:00:10.135824,True,absolute_error,50,,2,2,190,TPESampler,COMPLETE
773,0.3753807496470871,2025-04-24 22:41:13.696971,2025-04-24 22:41:31.360848,0 days 00:00:17.663877,True,absolute_error,50,,1,4,193,TPESampler,COMPLETE
774,0.3695479742201629,2025-04-24 22:41:20.512206,2025-04-24 22:41:39.542015,0 days 00:00:19.029809,True,absolute_error,42,,1,2,200,TPESampler,COMPLETE
775,0.36825440742794374,2025-04-24 22:41:31.540772,2025-04-24 22:41:50.141104,0 days 00:00:18.600332,True,absolute_error,50,,1,2,191,TPESampler,COMPLETE
776,0.6163669946735367,2025-04-24 22:41:35.048669,2025-04-24 22:41:38.057941,0 days 00:00:03.009272,False,squared_error,28,,8,13,643,TPESampler,COMPLETE
777,0.3714571051072444,2025-04-24 22:41:38.237163,2025-04-24 22:42:07.422780,0 days 00:00:29.185617,True,absolute_error,50,,1,3,320,TPESampler,COMPLETE
778,0.5690090545920172,2025-04-24 22:41:39.726477,2025-04-24 22:41:42.039404,0 days 00:00:02.312927,True,absolute_error,47,sqrt,2,2,160,TPESampler,COMPLETE
779,0.3694466786818912,2025-04-24 22:41:42.222790,2025-04-24 22:41:58.978065,0 days 00:00:16.755275,True,absolute_error,45,,1,2,181,TPESampler,COMPLETE
780,0.3747294452356988,2025-04-24 22:41:50.326626,2025-04-24 22:42:00.196357,0 days 00:00:09.869731,True,absolute_error,45,,1,2,103,TPESampler,COMPLETE
781,0.369880023225663,2025-04-24 22:41:59.164834,2025-04-24 22:42:39.917033,0 days 00:00:40.752199,True,absolute_error,50,,1,2,408,TPESampler,COMPLETE
782,0.41474736801291096,2025-04-24 22:42:00.377855,2025-04-24 22:42:16.516247,0 days 00:00:16.138392,True,absolute_error,42,,2,2,293,TPESampler,COMPLETE
783,0.36823338026372376,2025-04-24 22:42:07.691343,2025-04-24 22:42:26.817337,0 days 00:00:19.125994,True,absolute_error,50,,1,2,179,TPESampler,COMPLETE
784,0.565511730029513,2025-04-24 22:42:16.692839,2025-04-24 22:42:17.875641,0 days 00:00:01.182802,False,squared_error,11,,1,10,110,TPESampler,COMPLETE
785,0.8296586291426805,2025-04-24 22:42:18.135210,2025-04-24 22:42:22.873949,0 days 00:00:04.738739,True,absolute_error,9,log2,1,7,646,TPESampler,COMPLETE
786,0.5741405182416235,2025-04-24 22:42:23.223084,2025-04-24 22:42:25.347485,0 days 00:00:02.124401,False,squared_error,31,log2,1,8,941,TPESampler,COMPLETE
787,0.3688680771582412,2025-04-24 22:42:25.524113,2025-04-24 22:42:54.956449,0 days 00:00:29.432336,True,absolute_error,50,,1,3,297,TPESampler,COMPLETE
788,0.3683178669624408,2025-04-24 22:42:27.004124,2025-04-24 22:42:56.119546,0 days 00:00:29.115422,True,absolute_error,50,,1,2,277,TPESampler,COMPLETE
789,0.3698985668732648,2025-04-24 22:42:40.101152,2025-04-24 22:43:11.413638,0 days 00:00:31.312486,True,absolute_error,50,,1,2,327,TPESampler,COMPLETE
790,0.3696661572826009,2025-04-24 22:42:55.256117,2025-04-24 22:43:15.406595,0 days 00:00:20.150478,True,absolute_error,50,,1,3,215,TPESampler,COMPLETE
791,0.4000740051222205,2025-04-24 22:42:56.299665,2025-04-24 22:43:05.552226,0 days 00:00:09.252561,True,absolute_error,42,,1,15,102,TPESampler,COMPLETE
792,0.3662201483369652,2025-04-24 22:43:05.736869,2025-04-24 22:43:21.332902,0 days 00:00:15.596033,True,absolute_error,50,,1,2,164,TPESampler,COMPLETE
793,0.36715840508816305,2025-04-24 22:43:11.607849,2025-04-24 22:43:26.240749,0 days 00:00:14.632900,True,absolute_error,50,,1,2,151,TPESampler,COMPLETE
794,0.9415346340092191,2025-04-24 22:43:15.583653,2025-04-24 22:43:17.015223,0 days 00:00:01.431570,False,squared_error,13,log2,6,12,840,TPESampler,COMPLETE
795,0.37228867096938206,2025-04-24 22:43:17.218640,2025-04-24 22:43:26.916874,0 days 00:00:09.698234,True,absolute_error,50,,1,2,102,TPESampler,COMPLETE
796,0.4150736889071182,2025-04-24 22:43:21.504294,2025-04-24 22:43:33.721285,0 days 00:00:12.216991,True,absolute_error,50,,2,2,233,TPESampler,COMPLETE
797,0.37204184726282297,2025-04-24 22:43:26.419654,2025-04-24 22:43:37.121787,0 days 00:00:10.702133,True,absolute_error,41,,1,2,113,TPESampler,COMPLETE
798,0.3782279511195405,2025-04-24 22:43:27.139332,2025-04-24 22:43:36.601712,0 days 00:00:09.462380,True,absolute_error,50,,1,4,100,TPESampler,COMPLETE
799,0.3688006208258982,2025-04-24 22:43:33.905381,2025-04-24 22:43:51.854195,0 days 00:00:17.948814,True,absolute_error,50,,1,2,192,TPESampler,COMPLETE
800,0.3748717527549102,2025-04-24 22:43:36.780052,2025-04-24 22:43:48.462889,0 days 00:00:11.682837,True,absolute_error,43,,1,2,123,TPESampler,COMPLETE
801,0.4360534079626733,2025-04-24 22:43:37.301527,2025-04-24 22:44:09.825297,0 days 00:00:32.523770,False,absolute_error,49,,1,2,208,TPESampler,COMPLETE
802,0.4181253028833557,2025-04-24 22:43:48.639254,2025-04-24 22:43:54.988613,0 days 00:00:06.349359,True,absolute_error,48,,2,4,111,TPESampler,COMPLETE
803,0.4208312315228345,2025-04-24 22:43:52.043865,2025-04-24 22:43:57.886386,0 days 00:00:05.842521,True,absolute_error,44,,2,2,101,TPESampler,COMPLETE
804,0.41758690746543664,2025-04-24 22:43:55.172870,2025-04-24 22:44:01.513961,0 days 00:00:06.341091,True,absolute_error,49,,2,2,114,TPESampler,COMPLETE
805,0.3835771459975645,2025-04-24 22:43:58.064479,2025-04-24 22:43:59.497231,0 days 00:00:01.432752,True,squared_error,49,,1,2,138,TPESampler,COMPLETE
806,0.36806709351781136,2025-04-24 22:43:59.669926,2025-04-24 22:44:21.160972,0 days 00:00:21.491046,True,absolute_error,50,,1,2,229,TPESampler,COMPLETE
807,0.37284475976817993,2025-04-24 22:44:01.703033,2025-04-24 22:44:11.643864,0 days 00:00:09.940831,True,absolute_error,50,,1,3,101,TPESampler,COMPLETE
808,0.8297337769569471,2025-04-24 22:44:10.004059,2025-04-24 22:44:12.034188,0 days 00:00:02.030129,True,absolute_error,48,sqrt,6,26,408,TPESampler,COMPLETE
809,0.5557259005839728,2025-04-24 22:44:11.824299,2025-04-24 22:44:13.541556,0 days 00:00:01.717257,True,squared_error,18,sqrt,1,6,631,TPESampler,COMPLETE
810,0.36811619786120153,2025-04-24 22:44:12.255549,2025-04-24 22:44:28.497524,0 days 00:00:16.241975,True,absolute_error,50,,1,2,172,TPESampler,COMPLETE
811,0.36803811171045814,2025-04-24 22:44:13.723579,2025-04-24 22:44:36.232050,0 days 00:00:22.508471,True,absolute_error,50,,1,2,235,TPESampler,COMPLETE
812,0.3782948096680045,2025-04-24 22:44:21.347387,2025-04-24 22:44:25.138265,0 days 00:00:03.790878,False,absolute_error,49,sqrt,1,2,101,TPESampler,COMPLETE
813,0.36955006482525743,2025-04-24 22:44:25.314074,2025-04-24 22:44:36.609874,0 days 00:00:11.295800,True,absolute_error,50,,1,2,111,TPESampler,COMPLETE
814,0.8537607387004436,2025-04-24 22:44:28.681395,2025-04-24 22:44:32.675255,0 days 00:00:03.993860,False,absolute_error,28,sqrt,12,2,983,TPESampler,COMPLETE
815,0.768584167390034,2025-04-24 22:44:32.858721,2025-04-24 22:44:33.632453,0 days 00:00:00.773732,False,squared_error,12,sqrt,6,27,221,TPESampler,COMPLETE
816,0.37080588791624197,2025-04-24 22:44:33.813757,2025-04-24 22:45:20.802432,0 days 00:00:46.988675,True,absolute_error,41,,1,3,432,TPESampler,COMPLETE
817,0.5680180657693947,2025-04-24 22:44:36.412552,2025-04-24 22:44:50.407952,0 days 00:00:13.995400,True,absolute_error,44,log2,1,26,802,TPESampler,COMPLETE
818,0.37242762738883467,2025-04-24 22:44:36.794079,2025-04-24 22:45:12.911553,0 days 00:00:36.117474,True,absolute_error,43,,1,2,339,TPESampler,COMPLETE
819,0.44324224022581765,2025-04-24 22:44:50.587180,2025-04-24 22:44:54.934466,0 days 00:00:04.347286,True,absolute_error,49,log2,1,2,288,TPESampler,COMPLETE
820,0.3679686770126387,2025-04-24 22:44:55.119281,2025-04-24 22:45:26.582572,0 days 00:00:31.463291,True,absolute_error,50,,1,2,299,TPESampler,COMPLETE
821,0.49346124170909467,2025-04-24 22:45:13.101192,2025-04-24 22:45:26.349225,0 days 00:00:13.248033,True,absolute_error,36,sqrt,1,24,681,TPESampler,COMPLETE
822,0.37375706142213433,2025-04-24 22:45:20.988428,2025-04-24 22:45:40.205731,0 days 00:00:19.217303,True,absolute_error,43,,1,4,210,TPESampler,COMPLETE
823,0.7940853193381386,2025-04-24 22:45:26.529801,2025-04-24 22:45:28.291834,0 days 00:00:01.762033,True,squared_error,6,sqrt,1,3,962,TPESampler,COMPLETE
824,0.37542705231684165,2025-04-24 22:45:26.771111,2025-04-24 22:45:37.008149,0 days 00:00:10.237038,True,absolute_error,43,,1,2,105,TPESampler,COMPLETE
825,0.3705208022654407,2025-04-24 22:45:28.477207,2025-04-24 22:46:01.169794,0 days 00:00:32.692587,True,absolute_error,50,,1,2,337,TPESampler,COMPLETE
826,0.4145906592634788,2025-04-24 22:45:37.191549,2025-04-24 22:45:54.963593,0 days 00:00:17.772044,True,absolute_error,44,,2,2,306,TPESampler,COMPLETE
827,0.3689348084913331,2025-04-24 22:45:40.392803,2025-04-24 22:45:53.614936,0 days 00:00:13.222133,True,absolute_error,50,,1,2,119,TPESampler,COMPLETE
828,0.36923999305986605,2025-04-24 22:45:53.794157,2025-04-24 22:46:07.359449,0 days 00:00:13.565292,True,absolute_error,50,,1,2,138,TPESampler,COMPLETE
829,0.37423615930358106,2025-04-24 22:45:55.151813,2025-04-24 22:46:21.990708,0 days 00:00:26.838895,True,absolute_error,40,,1,4,269,TPESampler,COMPLETE
830,0.932532683316239,2025-04-24 22:46:01.347636,2025-04-24 22:46:02.401991,0 days 00:00:01.054355,False,absolute_error,33,log2,9,3,258,TPESampler,COMPLETE
831,0.4261017822625119,2025-04-24 22:46:02.598142,2025-04-24 22:46:07.892452,0 days 00:00:05.294310,True,absolute_error,36,sqrt,1,2,267,TPESampler,COMPLETE
832,0.44168294297984,2025-04-24 22:46:07.551833,2025-04-24 22:46:11.193290,0 days 00:00:03.641457,True,absolute_error,50,log2,1,2,172,TPESampler,COMPLETE
833,0.8454402537901837,2025-04-24 22:46:08.115113,2025-04-24 22:46:10.786897,0 days 00:00:02.671784,False,absolute_error,31,sqrt,10,3,469,TPESampler,COMPLETE
834,0.37215288406461383,2025-04-24 22:46:10.984414,2025-04-24 22:46:35.045873,0 days 00:00:24.061459,True,absolute_error,44,,1,2,226,TPESampler,COMPLETE
835,0.9400675293016878,2025-04-24 22:46:11.413147,2025-04-24 22:46:12.926526,0 days 00:00:01.513379,False,absolute_error,7,log2,11,10,559,TPESampler,COMPLETE
836,0.3688516163615531,2025-04-24 22:46:13.107736,2025-04-24 22:46:27.665220,0 days 00:00:14.557484,True,absolute_error,50,,1,2,139,TPESampler,COMPLETE
837,0.3720444773554857,2025-04-24 22:46:22.177665,2025-04-24 22:47:03.235980,0 days 00:00:41.058315,True,absolute_error,50,,1,4,424,TPESampler,COMPLETE
838,0.36812182866461507,2025-04-24 22:46:27.866053,2025-04-24 22:46:52.113273,0 days 00:00:24.247220,True,absolute_error,50,,1,2,238,TPESampler,COMPLETE
839,0.41819615465990867,2025-04-24 22:46:35.252522,2025-04-24 22:46:42.089030,0 days 00:00:06.836508,True,absolute_error,50,,2,3,126,TPESampler,COMPLETE
840,0.4147504455591443,2025-04-24 22:46:42.319973,2025-04-24 22:46:57.658921,0 days 00:00:15.338948,True,absolute_error,50,,2,4,293,TPESampler,COMPLETE
841,0.39786225706218775,2025-04-24 22:46:52.363845,2025-04-24 22:46:56.511998,0 days 00:00:04.148153,True,absolute_error,50,sqrt,1,2,187,TPESampler,COMPLETE
842,0.41820089215762657,2025-04-24 22:46:56.684294,2025-04-24 22:46:58.656877,0 days 00:00:01.972583,True,squared_error,50,,2,5,289,TPESampler,COMPLETE
843,0.37499903420578795,2025-04-24 22:46:57.832589,2025-04-24 22:47:18.211560,0 days 00:00:20.378971,True,absolute_error,43,,1,4,224,TPESampler,COMPLETE
844,0.37384646679745537,2025-04-24 22:46:58.839163,2025-04-24 22:47:21.932196,0 days 00:00:23.093033,True,absolute_error,50,,1,4,246,TPESampler,COMPLETE
845,0.41487087563830893,2025-04-24 22:47:03.423199,2025-04-24 22:47:13.803657,0 days 00:00:10.380458,True,absolute_error,50,,2,2,196,TPESampler,COMPLETE
