number,value,datetime_start,datetime_complete,duration,params_bootstrap,params_criterion,params_max_depth,params_max_features,params_min_samples_leaf,params_min_samples_split,params_n_estimators,system_attrs_auto:sampler,state
2396,0.374503337091793,2025-04-25 01:08:59.355171,2025-04-25 01:09:11.789309,0 days 00:00:12.434138,True,absolute_error,44,,1,2,125,TPESampler,COMPLETE
2397,0.36912353295880124,2025-04-25 01:09:03.168171,2025-04-25 01:09:14.974492,0 days 00:00:11.806321,True,absolute_error,49,,1,2,117,TPESampler,COMPLETE
2398,0.4153199465900031,2025-04-25 01:09:11.111143,2025-04-25 01:09:20.707386,0 days 00:00:09.596243,True,absolute_error,50,,2,3,172,TPESampler,COMPLETE
2399,0.5709011602861583,2025-04-25 01:09:11.980713,2025-04-25 01:09:18.976479,0 days 00:00:06.995766,True,absolute_error,44,,8,36,431,TPESampler,COMPLETE
2400,0.3722245042121573,2025-04-25 01:09:15.167289,2025-04-25 01:09:25.492377,0 days 00:00:10.325088,True,absolute_error,50,,1,3,107,TPESampler,COMPLETE
2401,0.6018459981430173,2025-04-25 01:09:19.176828,2025-04-25 01:09:23.498683,0 days 00:00:04.321855,False,squared_error,38,,7,36,993,TPESampler,COMPLETE
2402,0.3731206780948034,2025-04-25 01:09:20.898667,2025-04-25 01:09:33.416634,0 days 00:00:12.517967,True,absolute_error,44,,1,2,131,TPESampler,COMPLETE
2403,0.3767583281966103,2025-04-25 01:09:23.689647,2025-04-25 01:09:34.014923,0 days 00:00:10.325276,True,absolute_error,43,,1,3,108,TPESampler,COMPLETE
2404,0.3726874440519534,2025-04-25 01:09:25.682272,2025-04-25 01:09:36.047082,0 days 00:00:10.364810,True,absolute_error,49,,1,2,103,TPESampler,COMPLETE
2405,0.38449016475679987,2025-04-25 01:09:33.612343,2025-04-25 01:09:35.263329,0 days 00:00:01.650986,True,squared_error,44,,1,3,121,TPESampler,COMPLETE
2406,0.7425463740982667,2025-04-25 01:09:34.269216,2025-04-25 01:09:35.330066,0 days 00:00:01.060850,False,squared_error,17,log2,1,20,396,TPESampler,COMPLETE
2407,0.42588565144804874,2025-04-25 01:09:35.437785,2025-04-25 01:09:53.103827,0 days 00:00:17.666042,True,absolute_error,34,sqrt,1,2,923,TPESampler,COMPLETE
2408,0.41590220211014217,2025-04-25 01:09:35.576408,2025-04-25 01:09:42.748893,0 days 00:00:07.172485,True,absolute_error,44,,2,2,119,TPESampler,COMPLETE
2409,0.3740874361664689,2025-04-25 01:09:36.318128,2025-04-25 01:09:52.693931,0 days 00:00:16.375803,True,absolute_error,44,,1,4,163,TPESampler,COMPLETE
2410,0.36941533855573405,2025-04-25 01:09:42.938968,2025-04-25 01:09:55.076663,0 days 00:00:12.137695,True,absolute_error,50,,1,2,128,TPESampler,COMPLETE
2411,0.3741448141239788,2025-04-25 01:09:52.888246,2025-04-25 01:10:03.187434,0 days 00:00:10.299188,True,absolute_error,49,,1,3,108,TPESampler,COMPLETE
2412,0.4141576064067662,2025-04-25 01:09:53.321571,2025-04-25 01:10:01.582851,0 days 00:00:08.261280,True,absolute_error,48,,2,2,152,TPESampler,COMPLETE
2413,0.3738125303955876,2025-04-25 01:09:55.267440,2025-04-25 01:10:06.985036,0 days 00:00:11.717596,True,absolute_error,44,,1,2,124,TPESampler,COMPLETE
2414,0.37338275997293935,2025-04-25 01:10:01.766977,2025-04-25 01:10:20.306618,0 days 00:00:18.539641,True,absolute_error,32,,1,2,189,TPESampler,COMPLETE
2415,0.37344680981040623,2025-04-25 01:10:03.405987,2025-04-25 01:10:13.216054,0 days 00:00:09.810067,True,absolute_error,50,,1,3,103,TPESampler,COMPLETE
2416,0.41603950454901234,2025-04-25 01:10:07.173799,2025-04-25 01:10:14.691802,0 days 00:00:07.518003,True,absolute_error,50,,2,2,135,TPESampler,COMPLETE
2417,0.3731918817668151,2025-04-25 01:10:13.408026,2025-04-25 01:10:25.407408,0 days 00:00:11.999382,True,absolute_error,47,,1,2,115,TPESampler,COMPLETE
2418,0.8986608006347764,2025-04-25 01:10:14.885230,2025-04-25 01:10:18.161717,0 days 00:00:03.276487,False,absolute_error,19,log2,4,2,712,TPESampler,COMPLETE
2419,0.3991457474354841,2025-04-25 01:10:18.361320,2025-04-25 01:10:22.939093,0 days 00:00:04.577773,True,absolute_error,50,sqrt,1,2,205,TPESampler,COMPLETE
2420,0.3702539934246556,2025-04-25 01:10:20.503064,2025-04-25 01:10:32.698217,0 days 00:00:12.195153,True,absolute_error,49,,1,2,121,TPESampler,COMPLETE
2421,0.4161878189475562,2025-04-25 01:10:23.140002,2025-04-25 01:10:29.635921,0 days 00:00:06.495919,True,absolute_error,49,,2,2,117,TPESampler,COMPLETE
2422,0.36975178816921384,2025-04-25 01:10:25.600166,2025-04-25 01:10:42.016385,0 days 00:00:16.416219,True,absolute_error,42,,1,2,174,TPESampler,COMPLETE
2423,0.5914794228359188,2025-04-25 01:10:29.819582,2025-04-25 01:10:31.722780,0 days 00:00:01.903198,True,squared_error,30,sqrt,2,43,941,TPESampler,COMPLETE
2424,0.3727217870637517,2025-04-25 01:10:31.910980,2025-04-25 01:10:43.493529,0 days 00:00:11.582549,True,absolute_error,44,,1,3,114,TPESampler,COMPLETE
2425,0.9004233492794952,2025-04-25 01:10:32.928372,2025-04-25 01:10:34.263143,0 days 00:00:01.334771,False,squared_error,21,sqrt,15,10,562,TPESampler,COMPLETE
2426,0.3738418124093073,2025-04-25 01:10:34.661864,2025-04-25 01:10:44.797698,0 days 00:00:10.135834,True,absolute_error,49,,1,3,105,TPESampler,COMPLETE
2427,0.36822976948760117,2025-04-25 01:10:42.226674,2025-04-25 01:10:58.559933,0 days 00:00:16.333259,True,absolute_error,50,,1,2,174,TPESampler,COMPLETE
2428,0.41400609290255813,2025-04-25 01:10:43.705541,2025-04-25 01:10:52.736614,0 days 00:00:09.031073,True,absolute_error,42,,2,2,168,TPESampler,COMPLETE
2429,0.4198270544550623,2025-04-25 01:10:44.994500,2025-04-25 01:10:51.026405,0 days 00:00:06.031905,True,absolute_error,50,,2,2,109,TPESampler,COMPLETE
2430,0.3769086437945377,2025-04-25 01:10:51.216320,2025-04-25 01:11:01.083854,0 days 00:00:09.867534,True,absolute_error,43,,1,3,101,TPESampler,COMPLETE
2431,0.5688743610692165,2025-04-25 01:10:52.924288,2025-04-25 01:10:55.036592,0 days 00:00:02.112304,True,absolute_error,47,sqrt,2,2,140,TPESampler,COMPLETE
2432,0.36868963385822673,2025-04-25 01:10:55.228852,2025-04-25 01:11:11.808407,0 days 00:00:16.579555,True,absolute_error,50,,1,2,178,TPESampler,COMPLETE
2433,0.5316336662736367,2025-04-25 01:10:58.747212,2025-04-25 01:11:20.643836,0 days 00:00:21.896624,False,absolute_error,11,,7,2,628,TPESampler,COMPLETE
2434,0.37498577150530604,2025-04-25 01:11:01.272419,2025-04-25 01:11:18.594377,0 days 00:00:17.321958,True,absolute_error,42,,1,4,191,TPESampler,COMPLETE
2435,0.37095808286721443,2025-04-25 01:11:12.004045,2025-04-25 01:11:22.000091,0 days 00:00:09.996046,True,absolute_error,50,,1,2,105,TPESampler,COMPLETE
2436,0.569089424747869,2025-04-25 01:11:18.784606,2025-04-25 01:11:25.724091,0 days 00:00:06.939485,False,absolute_error,29,,10,3,236,TPESampler,COMPLETE
2437,0.36868963385822673,2025-04-25 01:11:20.837299,2025-04-25 01:11:37.523018,0 days 00:00:16.685719,True,absolute_error,50,,1,2,178,TPESampler,COMPLETE
2438,0.36909585391674177,2025-04-25 01:11:22.190295,2025-04-25 01:11:34.987071,0 days 00:00:12.796776,True,absolute_error,49,,1,2,135,TPESampler,COMPLETE
2439,0.41799250862041337,2025-04-25 01:11:25.929013,2025-04-25 01:11:27.262407,0 days 00:00:01.333394,True,squared_error,50,,2,2,164,TPESampler,COMPLETE
2440,0.9370868762133323,2025-04-25 01:11:27.450408,2025-04-25 01:11:28.432508,0 days 00:00:00.982100,False,squared_error,36,log2,5,12,520,TPESampler,COMPLETE
2441,0.41434127732595005,2025-04-25 01:11:28.626544,2025-04-25 01:11:36.423608,0 days 00:00:07.797064,True,absolute_error,50,,2,2,142,TPESampler,COMPLETE
2442,0.41819615465990867,2025-04-25 01:11:35.182645,2025-04-25 01:11:42.627909,0 days 00:00:07.445264,True,absolute_error,42,,2,2,126,TPESampler,COMPLETE
2443,0.37880613309217953,2025-04-25 01:11:36.624807,2025-04-25 01:11:49.974933,0 days 00:00:13.350126,True,absolute_error,34,,1,4,140,TPESampler,COMPLETE
2444,0.6654700444778481,2025-04-25 01:11:37.707902,2025-04-25 01:11:39.592185,0 days 00:00:01.884283,False,squared_error,19,sqrt,4,6,971,TPESampler,COMPLETE
2445,0.4880838705027564,2025-04-25 01:11:39.931654,2025-04-25 01:11:42.306995,0 days 00:00:02.375341,True,absolute_error,44,log2,1,4,121,TPESampler,COMPLETE
2446,0.3709933837760566,2025-04-25 01:11:42.571096,2025-04-25 01:12:01.744597,0 days 00:00:19.173501,True,absolute_error,42,,1,3,204,TPESampler,COMPLETE
2447,0.4154060922279037,2025-04-25 01:11:42.982063,2025-04-25 01:11:53.546040,0 days 00:00:10.563977,True,absolute_error,50,,2,2,193,TPESampler,COMPLETE
2448,0.37640253049014966,2025-04-25 01:11:50.162667,2025-04-25 01:12:00.891062,0 days 00:00:10.728395,True,absolute_error,45,,1,4,109,TPESampler,COMPLETE
2449,0.415557699409759,2025-04-25 01:11:53.729344,2025-04-25 01:12:00.660717,0 days 00:00:06.931373,True,absolute_error,41,,2,4,118,TPESampler,COMPLETE
2450,0.8359409136977713,2025-04-25 01:12:00.850395,2025-04-25 01:12:03.053539,0 days 00:00:02.203144,True,absolute_error,9,log2,1,18,241,TPESampler,COMPLETE
2451,0.36959915105391766,2025-04-25 01:12:01.204075,2025-04-25 01:12:12.065404,0 days 00:00:10.861329,True,absolute_error,50,,1,2,110,TPESampler,COMPLETE
2452,0.37551504193239305,2025-04-25 01:12:02.002439,2025-04-25 01:12:17.926430,0 days 00:00:15.923991,True,absolute_error,44,,1,4,171,TPESampler,COMPLETE
2453,0.3725281165446322,2025-04-25 01:12:03.245501,2025-04-25 01:12:20.422800,0 days 00:00:17.177299,True,absolute_error,44,,1,2,183,TPESampler,COMPLETE
2454,0.36911654131877764,2025-04-25 01:12:12.303655,2025-04-25 01:12:25.976732,0 days 00:00:13.673077,True,absolute_error,50,,1,3,143,TPESampler,COMPLETE
2455,0.9149819865408241,2025-04-25 01:12:18.118465,2025-04-25 01:12:19.545573,0 days 00:00:01.427108,True,squared_error,26,sqrt,11,11,733,TPESampler,COMPLETE
2456,0.36659177666053594,2025-04-25 01:12:19.737488,2025-04-25 01:12:33.698746,0 days 00:00:13.961258,True,absolute_error,50,,1,2,147,TPESampler,COMPLETE
2457,0.37457730874347805,2025-04-25 01:12:20.620628,2025-04-25 01:12:41.908495,0 days 00:00:21.287867,True,absolute_error,50,,1,4,232,TPESampler,COMPLETE
2458,0.9606343108790866,2025-04-25 01:12:26.164977,2025-04-25 01:12:27.106240,0 days 00:00:00.941263,True,squared_error,26,log2,9,7,306,TPESampler,COMPLETE
2459,0.37481634148337795,2025-04-25 01:12:27.298494,2025-04-25 01:12:37.651107,0 days 00:00:10.352613,True,absolute_error,44,,1,2,109,TPESampler,COMPLETE
2460,0.3664674719825823,2025-04-25 01:12:34.103312,2025-04-25 01:12:49.769305,0 days 00:00:15.665993,True,absolute_error,50,,1,2,163,TPESampler,COMPLETE
2461,0.3751771326231687,2025-04-25 01:12:37.837597,2025-04-25 01:12:55.747179,0 days 00:00:17.909582,True,absolute_error,50,,1,4,191,TPESampler,COMPLETE
2462,0.3722132380128064,2025-04-25 01:12:42.123110,2025-04-25 01:12:53.431418,0 days 00:00:11.308308,True,absolute_error,50,,1,3,109,TPESampler,COMPLETE
2463,0.3745160159236698,2025-04-25 01:12:49.990924,2025-04-25 01:12:59.924836,0 days 00:00:09.933912,True,absolute_error,45,,1,2,102,TPESampler,COMPLETE
2464,0.4415292714940524,2025-04-25 01:12:53.626751,2025-04-25 01:13:29.425405,0 days 00:00:35.798654,False,absolute_error,50,,1,2,198,TPESampler,COMPLETE
2465,0.3748717527549102,2025-04-25 01:12:55.945952,2025-04-25 01:13:11.708144,0 days 00:00:15.762192,True,absolute_error,43,,1,2,123,TPESampler,COMPLETE
2466,0.4126396125043574,2025-04-25 01:13:00.117106,2025-04-25 01:13:12.567654,0 days 00:00:12.450548,True,absolute_error,50,,2,2,161,TPESampler,COMPLETE
2467,0.370445872172525,2025-04-25 01:13:11.895800,2025-04-25 01:13:22.428169,0 days 00:00:10.532369,True,absolute_error,49,,1,2,110,TPESampler,COMPLETE
2468,0.3758932012002084,2025-04-25 01:13:12.755850,2025-04-25 01:13:23.422358,0 days 00:00:10.666508,True,absolute_error,34,,1,2,113,TPESampler,COMPLETE
2469,0.41984807321298306,2025-04-25 01:13:22.622085,2025-04-25 01:13:33.360215,0 days 00:00:10.738130,True,absolute_error,50,,2,7,190,TPESampler,COMPLETE
2470,0.3676257529517241,2025-04-25 01:13:23.604056,2025-04-25 01:13:41.550858,0 days 00:00:17.946802,True,absolute_error,50,,1,2,171,TPESampler,COMPLETE
2471,0.37551219185277396,2025-04-25 01:13:29.614232,2025-04-25 01:13:41.410135,0 days 00:00:11.795903,True,absolute_error,50,,1,4,114,TPESampler,COMPLETE
2472,0.36944838401480823,2025-04-25 01:13:33.604816,2025-04-25 01:13:47.524542,0 days 00:00:13.919726,True,absolute_error,50,,1,2,137,TPESampler,COMPLETE
2473,0.3811836252511922,2025-04-25 01:13:41.604883,2025-04-25 01:13:43.044147,0 days 00:00:01.439264,True,squared_error,48,,1,2,107,TPESampler,COMPLETE
2474,0.4816516461564988,2025-04-25 01:13:41.789223,2025-04-25 01:13:44.846110,0 days 00:00:03.056887,True,absolute_error,50,log2,1,5,175,TPESampler,COMPLETE
2475,0.37004633752178573,2025-04-25 01:13:43.236127,2025-04-25 01:13:56.087797,0 days 00:00:12.851670,True,absolute_error,50,,1,2,127,TPESampler,COMPLETE
2476,0.3694222957439175,2025-04-25 01:13:45.043811,2025-04-25 01:13:56.731328,0 days 00:00:11.687517,True,absolute_error,50,,1,2,112,TPESampler,COMPLETE
2477,0.8039571783844401,2025-04-25 01:13:47.725161,2025-04-25 01:13:51.137050,0 days 00:00:03.411889,False,absolute_error,37,sqrt,8,27,497,TPESampler,COMPLETE
2478,0.7029040158247,2025-04-25 01:13:51.322580,2025-04-25 01:13:52.138527,0 days 00:00:00.815947,False,squared_error,32,sqrt,5,2,188,TPESampler,COMPLETE
2479,0.3756866093558913,2025-04-25 01:13:52.326295,2025-04-25 01:14:03.248386,0 days 00:00:10.922091,True,absolute_error,43,,1,2,106,TPESampler,COMPLETE
2480,0.4146635134824989,2025-04-25 01:13:56.288535,2025-04-25 01:14:07.740221,0 days 00:00:11.451686,True,absolute_error,50,,2,2,199,TPESampler,COMPLETE
2481,0.5447238166885046,2025-04-25 01:13:56.952273,2025-04-25 01:13:58.457734,0 days 00:00:01.505461,False,squared_error,39,sqrt,2,20,650,TPESampler,COMPLETE
2482,0.42117415816726894,2025-04-25 01:13:58.645736,2025-04-25 01:14:04.945471,0 days 00:00:06.299735,True,absolute_error,41,,2,2,103,TPESampler,COMPLETE
2483,0.3741214428487543,2025-04-25 01:14:03.447050,2025-04-25 01:14:14.005542,0 days 00:00:10.558492,True,absolute_error,43,,1,2,110,TPESampler,COMPLETE
2484,0.36822976948760117,2025-04-25 01:14:05.144305,2025-04-25 01:14:21.461299,0 days 00:00:16.316994,True,absolute_error,50,,1,2,174,TPESampler,COMPLETE
2485,0.4140716682546248,2025-04-25 01:14:07.932899,2025-04-25 01:14:19.130339,0 days 00:00:11.197440,True,absolute_error,45,,2,4,211,TPESampler,COMPLETE
2486,0.37492298282480235,2025-04-25 01:14:14.198389,2025-04-25 01:14:24.150005,0 days 00:00:09.951616,True,absolute_error,41,,1,3,101,TPESampler,COMPLETE
2487,0.42117304451673676,2025-04-25 01:14:19.319108,2025-04-25 01:14:25.535237,0 days 00:00:06.216129,True,absolute_error,43,,2,3,103,TPESampler,COMPLETE
2488,0.528901326515623,2025-04-25 01:14:21.647157,2025-04-25 01:14:23.731505,0 days 00:00:02.084348,False,squared_error,36,sqrt,2,3,986,TPESampler,COMPLETE
2489,0.3695071968416499,2025-04-25 01:14:23.929452,2025-04-25 01:14:42.731442,0 days 00:00:18.801990,True,absolute_error,50,,1,3,189,TPESampler,COMPLETE
2490,0.36962113554824827,2025-04-25 01:14:24.375823,2025-04-25 01:14:36.772654,0 days 00:00:12.396831,True,absolute_error,50,,1,2,129,TPESampler,COMPLETE
2491,0.41555657989150385,2025-04-25 01:14:25.727854,2025-04-25 01:14:32.273305,0 days 00:00:06.545451,True,absolute_error,43,,2,2,118,TPESampler,COMPLETE
2492,0.36982673610326866,2025-04-25 01:14:32.462202,2025-04-25 01:14:44.675469,0 days 00:00:12.213267,True,absolute_error,50,,1,2,124,TPESampler,COMPLETE
2493,0.36763180568217557,2025-04-25 01:14:37.000010,2025-04-25 01:14:58.273063,0 days 00:00:21.273053,True,absolute_error,50,,1,2,205,TPESampler,COMPLETE
2494,0.473086454281732,2025-04-25 01:14:42.933352,2025-04-25 01:14:45.587281,0 days 00:00:02.653929,True,absolute_error,43,log2,1,2,152,TPESampler,COMPLETE
2495,0.42069606508063623,2025-04-25 01:14:44.868966,2025-04-25 01:14:50.693411,0 days 00:00:05.824445,True,absolute_error,45,,2,2,104,TPESampler,COMPLETE
2496,0.3734207338413434,2025-04-25 01:14:45.779766,2025-04-25 01:14:57.312120,0 days 00:00:11.532354,True,absolute_error,44,,1,2,120,TPESampler,COMPLETE
2497,0.370960696461535,2025-04-25 01:14:50.887587,2025-04-25 01:15:01.950485,0 days 00:00:11.062898,True,absolute_error,50,,1,2,108,TPESampler,COMPLETE
2498,0.6713641815066629,2025-04-25 01:14:57.504941,2025-04-25 01:15:00.427207,0 days 00:00:02.922266,True,absolute_error,23,sqrt,3,2,318,TPESampler,COMPLETE
2499,0.36959915105391766,2025-04-25 01:14:58.560550,2025-04-25 01:15:09.192716,0 days 00:00:10.632166,True,absolute_error,50,,1,2,110,TPESampler,COMPLETE
