number,value,datetime_start,datetime_complete,duration,params_bootstrap,params_criterion,params_max_depth,params_max_features,params_min_samples_leaf,params_min_samples_split,params_n_estimators,system_attrs_auto:sampler,state
846,0.37296417269540055,2025-04-24 22:47:13.989206,2025-04-24 22:48:04.654832,0 days 00:00:50.665626,True,absolute_error,43,,1,2,393,TPESampler,COMPLETE
847,0.4808055965833084,2025-04-24 22:47:18.398147,2025-04-24 22:48:04.270951,0 days 00:00:45.872804,True,absolute_error,27,,3,19,961,TPESampler,COMPLETE
848,0.3719088972039501,2025-04-24 22:47:22.117892,2025-04-24 22:47:54.306187,0 days 00:00:32.188295,True,absolute_error,40,,1,2,215,TPESampler,COMPLETE
849,0.4208312315228345,2025-04-24 22:47:54.499694,2025-04-24 22:48:01.410085,0 days 00:00:06.910391,True,absolute_error,49,,2,2,101,TPESampler,COMPLETE
850,0.3687712407510537,2025-04-24 22:48:01.584080,2025-04-24 22:48:37.644395,0 days 00:00:36.060315,True,absolute_error,50,,1,2,268,TPESampler,COMPLETE
851,0.3695706101162727,2025-04-24 22:48:04.448967,2025-04-24 22:48:46.355628,0 days 00:00:41.906661,True,absolute_error,50,,1,2,334,TPESampler,COMPLETE
852,0.41226410687996123,2025-04-24 22:48:04.891627,2025-04-24 22:48:36.723952,0 days 00:00:31.832325,True,absolute_error,50,,2,2,429,TPESampler,COMPLETE
853,0.5381316987365198,2025-04-24 22:48:36.898265,2025-04-24 22:48:38.268394,0 days 00:00:01.370129,False,squared_error,46,log2,1,22,512,TPESampler,COMPLETE
854,0.36882918492949746,2025-04-24 22:48:37.830714,2025-04-24 22:48:59.970555,0 days 00:00:22.139841,True,absolute_error,50,,1,2,240,TPESampler,COMPLETE
855,0.4368126861227788,2025-04-24 22:48:38.505082,2025-04-24 22:48:54.984280,0 days 00:00:16.479198,False,absolute_error,49,,1,2,105,TPESampler,COMPLETE
856,0.37643269560025827,2025-04-24 22:48:46.540757,2025-04-24 22:48:56.828639,0 days 00:00:10.287882,True,absolute_error,43,,1,3,109,TPESampler,COMPLETE
857,0.7729176452136972,2025-04-24 22:48:55.163480,2025-04-24 22:48:57.205923,0 days 00:00:02.042443,True,absolute_error,13,log2,1,3,212,TPESampler,COMPLETE
858,0.41631708524233507,2025-04-24 22:48:57.006205,2025-04-24 22:49:10.302264,0 days 00:00:13.296059,True,absolute_error,42,,2,2,241,TPESampler,COMPLETE
859,0.8165784840098829,2025-04-24 22:48:57.405017,2025-04-24 22:48:58.432379,0 days 00:00:01.027362,True,squared_error,6,sqrt,2,45,351,TPESampler,COMPLETE
860,0.40871510736143984,2025-04-24 22:48:58.610326,2025-04-24 22:49:04.163975,0 days 00:00:05.553649,False,squared_error,25,,1,8,814,TPESampler,COMPLETE
861,0.8057952377568925,2025-04-24 22:49:00.151426,2025-04-24 22:49:00.854177,0 days 00:00:00.702751,True,squared_error,35,sqrt,5,5,101,TPESampler,COMPLETE
862,0.3719529130632298,2025-04-24 22:49:01.037171,2025-04-24 22:49:11.990044,0 days 00:00:10.952873,True,absolute_error,42,,1,2,112,TPESampler,COMPLETE
863,0.5367602175658158,2025-04-24 22:49:04.331190,2025-04-24 22:49:07.150984,0 days 00:00:02.819794,False,squared_error,33,,6,2,538,TPESampler,COMPLETE
864,0.7035163816573033,2025-04-24 22:49:07.318549,2025-04-24 22:49:08.838645,0 days 00:00:01.520096,False,squared_error,10,sqrt,2,5,912,TPESampler,COMPLETE
865,0.415500471998789,2025-04-24 22:49:09.007639,2025-04-24 22:49:31.773927,0 days 00:00:22.766288,True,absolute_error,50,,2,2,316,TPESampler,COMPLETE
866,0.37051455927726706,2025-04-24 22:49:10.472013,2025-04-24 22:49:28.344556,0 days 00:00:17.872543,True,absolute_error,50,,1,3,119,TPESampler,COMPLETE
867,0.46645889362280224,2025-04-24 22:49:12.211637,2025-04-24 22:49:33.917354,0 days 00:00:21.705717,True,absolute_error,15,,1,20,190,TPESampler,COMPLETE
868,0.3694858782606468,2025-04-24 22:49:28.527682,2025-04-24 22:50:02.790985,0 days 00:00:34.263303,True,absolute_error,42,,1,2,331,TPESampler,COMPLETE
869,0.36955006482525743,2025-04-24 22:49:31.942695,2025-04-24 22:49:42.579445,0 days 00:00:10.636750,True,absolute_error,50,,1,2,111,TPESampler,COMPLETE
870,0.37087119780805095,2025-04-24 22:49:34.108457,2025-04-24 22:50:05.595165,0 days 00:00:31.486708,True,absolute_error,40,,1,2,290,TPESampler,COMPLETE
871,0.3717533399457012,2025-04-24 22:49:42.764125,2025-04-24 22:50:08.912364,0 days 00:00:26.148239,True,absolute_error,43,,1,3,229,TPESampler,COMPLETE
872,0.3707350336262747,2025-04-24 22:50:02.966441,2025-04-24 22:50:39.571153,0 days 00:00:36.604712,True,absolute_error,50,,1,2,362,TPESampler,COMPLETE
873,0.9002469346892813,2025-04-24 22:50:05.783981,2025-04-24 22:50:06.775657,0 days 00:00:00.991676,False,absolute_error,38,log2,4,29,122,TPESampler,COMPLETE
874,0.36823338026372376,2025-04-24 22:50:07.097280,2025-04-24 22:50:23.650165,0 days 00:00:16.552885,True,absolute_error,50,,1,2,179,TPESampler,COMPLETE
875,0.3684101595934685,2025-04-24 22:50:09.092407,2025-04-24 22:50:41.150184,0 days 00:00:32.057777,True,absolute_error,50,,1,2,307,TPESampler,COMPLETE
876,0.525701706963959,2025-04-24 22:50:23.825488,2025-04-24 22:50:24.593402,0 days 00:00:00.767914,False,squared_error,40,sqrt,2,3,138,TPESampler,COMPLETE
877,0.3725024061176803,2025-04-24 22:50:24.763280,2025-04-24 22:50:52.783265,0 days 00:00:28.019985,True,absolute_error,50,,1,4,303,TPESampler,COMPLETE
878,0.8565577996209764,2025-04-24 22:50:39.745678,2025-04-24 22:50:42.180873,0 days 00:00:02.435195,True,absolute_error,19,sqrt,7,48,650,TPESampler,COMPLETE
879,0.36926975681753615,2025-04-24 22:50:41.340934,2025-04-24 22:50:52.128614,0 days 00:00:10.787680,True,absolute_error,50,,1,2,113,TPESampler,COMPLETE
880,0.38444709768333524,2025-04-24 22:50:42.368133,2025-04-24 22:50:44.161409,0 days 00:00:01.793276,True,squared_error,49,,1,3,212,TPESampler,COMPLETE
881,0.3689621233948085,2025-04-24 22:50:44.367826,2025-04-24 22:51:14.005724,0 days 00:00:29.637898,True,absolute_error,42,,1,2,311,TPESampler,COMPLETE
882,0.5075217527542014,2025-04-24 22:50:52.306304,2025-04-24 22:50:56.898622,0 days 00:00:04.592318,False,absolute_error,36,log2,1,4,175,TPESampler,COMPLETE
883,0.942993241315088,2025-04-24 22:50:53.180118,2025-04-24 22:50:54.540061,0 days 00:00:01.359943,True,squared_error,6,log2,4,2,810,TPESampler,COMPLETE
884,0.41749449515837417,2025-04-24 22:50:54.709839,2025-04-24 22:51:01.556151,0 days 00:00:06.846312,True,absolute_error,42,,2,2,113,TPESampler,COMPLETE
885,0.9677323149072815,2025-04-24 22:50:57.072120,2025-04-24 22:50:58.366797,0 days 00:00:01.294677,True,squared_error,41,log2,10,9,737,TPESampler,COMPLETE
886,0.8676919092950414,2025-04-24 22:50:58.543955,2025-04-24 22:51:04.700380,0 days 00:00:06.156425,False,absolute_error,10,log2,3,2,982,TPESampler,COMPLETE
887,0.613183319039096,2025-04-24 22:51:01.731786,2025-04-24 22:51:03.533502,0 days 00:00:01.801716,True,squared_error,31,log2,1,13,855,TPESampler,COMPLETE
888,0.37068322197359804,2025-04-24 22:51:03.711371,2025-04-24 22:51:26.702703,0 days 00:00:22.991332,True,absolute_error,43,,1,2,244,TPESampler,COMPLETE
889,0.453727392998825,2025-04-24 22:51:04.874489,2025-04-24 22:51:07.919632,0 days 00:00:03.045143,True,absolute_error,37,sqrt,1,5,146,TPESampler,COMPLETE
890,0.37481306715182544,2025-04-24 22:51:08.092940,2025-04-24 22:51:26.125776,0 days 00:00:18.032836,True,absolute_error,50,,1,4,188,TPESampler,COMPLETE
891,0.36847800742176806,2025-04-24 22:51:14.192620,2025-04-24 22:51:31.001032,0 days 00:00:16.808412,True,absolute_error,50,,1,2,180,TPESampler,COMPLETE
892,0.36982673610326866,2025-04-24 22:51:26.305095,2025-04-24 22:51:38.311716,0 days 00:00:12.006621,True,absolute_error,50,,1,2,124,TPESampler,COMPLETE
893,0.3711471596726601,2025-04-24 22:51:26.943278,2025-04-24 22:51:36.834937,0 days 00:00:09.891659,True,absolute_error,50,,1,2,104,TPESampler,COMPLETE
894,0.3722798824576514,2025-04-24 22:51:31.176621,2025-04-24 22:51:55.849334,0 days 00:00:24.672713,True,absolute_error,44,,1,2,266,TPESampler,COMPLETE
895,0.9389946644927005,2025-04-24 22:51:37.002582,2025-04-24 22:51:37.799892,0 days 00:00:00.797310,True,absolute_error,32,log2,8,2,170,TPESampler,COMPLETE
896,0.5729496395806326,2025-04-24 22:51:37.972845,2025-04-24 22:51:39.397356,0 days 00:00:01.424511,True,squared_error,44,,8,3,236,TPESampler,COMPLETE
897,0.4147504455591443,2025-04-24 22:51:38.515776,2025-04-24 22:51:54.100324,0 days 00:00:15.584548,True,absolute_error,50,,2,2,293,TPESampler,COMPLETE
898,0.7762605885259799,2025-04-24 22:51:39.573745,2025-04-24 22:51:41.151334,0 days 00:00:01.577589,True,squared_error,11,sqrt,4,36,853,TPESampler,COMPLETE
899,0.3705858465045984,2025-04-24 22:51:41.326020,2025-04-24 22:52:11.966481,0 days 00:00:30.640461,True,absolute_error,49,,1,2,337,TPESampler,COMPLETE
900,0.44834452259154467,2025-04-24 22:51:54.294616,2025-04-24 22:52:11.921909,0 days 00:00:17.627293,False,absolute_error,42,,1,4,113,TPESampler,COMPLETE
901,0.37300602022290646,2025-04-24 22:51:56.040243,2025-04-24 22:52:10.767193,0 days 00:00:14.726950,True,absolute_error,42,,1,4,162,TPESampler,COMPLETE
902,0.44155134060845863,2025-04-24 22:52:10.939253,2025-04-24 22:52:13.034829,0 days 00:00:02.095576,False,squared_error,48,,2,2,183,TPESampler,COMPLETE
903,0.5531627809394318,2025-04-24 22:52:12.059295,2025-04-24 22:52:18.703737,0 days 00:00:06.644442,True,absolute_error,48,,8,2,388,TPESampler,COMPLETE
904,0.37459251369508734,2025-04-24 22:52:12.135810,2025-04-24 22:52:33.324047,0 days 00:00:21.188237,True,absolute_error,50,,1,4,230,TPESampler,COMPLETE
905,0.41472448922935107,2025-04-24 22:52:13.212162,2025-04-24 22:52:28.637378,0 days 00:00:15.425216,True,absolute_error,46,,2,4,295,TPESampler,COMPLETE
906,0.3681797343305437,2025-04-24 22:52:18.877875,2025-04-24 22:52:40.772421,0 days 00:00:21.894546,True,absolute_error,50,,1,2,236,TPESampler,COMPLETE
907,0.41487217895784884,2025-04-24 22:52:28.807269,2025-04-24 22:52:42.085906,0 days 00:00:13.278637,True,absolute_error,41,,2,2,251,TPESampler,COMPLETE
908,0.3702201001078653,2025-04-24 22:52:33.496561,2025-04-24 22:52:56.122174,0 days 00:00:22.625613,True,absolute_error,43,,1,2,246,TPESampler,COMPLETE
909,0.8277037985668126,2025-04-24 22:52:40.947395,2025-04-24 22:52:42.848070,0 days 00:00:01.900675,True,absolute_error,50,log2,2,2,289,TPESampler,COMPLETE
910,0.42035386520482854,2025-04-24 22:52:42.311414,2025-04-24 22:52:45.392725,0 days 00:00:03.081311,False,squared_error,32,sqrt,1,2,621,TPESampler,COMPLETE
911,0.4428419672681056,2025-04-24 22:52:43.223212,2025-04-24 22:53:27.248567,0 days 00:00:44.025355,False,absolute_error,40,,1,2,268,TPESampler,COMPLETE
912,0.38497379724724334,2025-04-24 22:52:45.736667,2025-04-24 22:52:48.289058,0 days 00:00:02.552391,True,squared_error,36,,1,4,280,TPESampler,COMPLETE
913,0.41443136497753447,2025-04-24 22:52:48.656721,2025-04-24 22:53:05.645250,0 days 00:00:16.988529,True,absolute_error,50,,2,2,297,TPESampler,COMPLETE
914,0.4148221079993417,2025-04-24 22:52:56.300791,2025-04-24 22:53:05.001141,0 days 00:00:08.700350,True,absolute_error,50,,2,3,139,TPESampler,COMPLETE
915,0.3677077321708779,2025-04-24 22:53:05.176858,2025-04-24 22:53:30.326920,0 days 00:00:25.150062,True,absolute_error,50,,1,2,254,TPESampler,COMPLETE
916,0.7511476544587765,2025-04-24 22:53:05.888359,2025-04-24 22:53:10.751591,0 days 00:00:04.863232,True,absolute_error,44,sqrt,4,18,760,TPESampler,COMPLETE
917,0.36803771844451905,2025-04-24 22:53:10.926469,2025-04-24 22:53:36.938471,0 days 00:00:26.012002,True,absolute_error,50,,1,2,273,TPESampler,COMPLETE
918,0.3701823797791027,2025-04-24 22:53:27.425749,2025-04-24 22:53:47.246239,0 days 00:00:19.820490,True,absolute_error,42,,1,2,178,TPESampler,COMPLETE
919,0.938442857435066,2025-04-24 22:53:30.514830,2025-04-24 22:53:31.532294,0 days 00:00:01.017464,False,squared_error,46,log2,5,4,649,TPESampler,COMPLETE
920,0.506159611292674,2025-04-24 22:53:31.708439,2025-04-24 22:53:35.928618,0 days 00:00:04.220179,False,squared_error,12,,1,3,658,TPESampler,COMPLETE
921,0.5078110072769144,2025-04-24 22:53:36.108750,2025-04-24 22:53:38.045737,0 days 00:00:01.936987,False,squared_error,33,sqrt,1,50,806,TPESampler,COMPLETE
922,0.6643554226725977,2025-04-24 22:53:37.127892,2025-04-24 22:54:14.486550,0 days 00:00:37.358658,False,absolute_error,5,,1,6,357,TPESampler,COMPLETE
923,0.3720229670336759,2025-04-24 22:53:38.221687,2025-04-24 22:54:21.977952,0 days 00:00:43.756265,True,absolute_error,44,,1,4,454,TPESampler,COMPLETE
924,0.4208312315228345,2025-04-24 22:53:47.412909,2025-04-24 22:53:53.025114,0 days 00:00:05.612205,True,absolute_error,50,,2,2,101,TPESampler,COMPLETE
925,0.41732243671138775,2025-04-24 22:53:53.198630,2025-04-24 22:54:00.193040,0 days 00:00:06.994410,True,absolute_error,46,sqrt,1,4,327,TPESampler,COMPLETE
926,0.5723909964528264,2025-04-24 22:54:00.371587,2025-04-24 22:54:07.719159,0 days 00:00:07.347572,False,absolute_error,12,,9,2,230,TPESampler,COMPLETE
927,0.3674251696761748,2025-04-24 22:54:07.905537,2025-04-24 22:54:36.493815,0 days 00:00:28.588278,True,absolute_error,50,,1,2,285,TPESampler,COMPLETE
928,0.598528320573549,2025-04-24 22:54:14.656068,2025-04-24 22:54:15.549309,0 days 00:00:00.893241,False,squared_error,6,,1,2,100,TPESampler,COMPLETE
929,0.37124360473513307,2025-04-24 22:54:15.723558,2025-04-24 22:54:38.096323,0 days 00:00:22.372765,True,absolute_error,43,,1,2,220,TPESampler,COMPLETE
930,0.37059760597831154,2025-04-24 22:54:22.155066,2025-04-24 22:54:43.690075,0 days 00:00:21.535009,True,absolute_error,50,,1,3,223,TPESampler,COMPLETE
931,0.37481306715182544,2025-04-24 22:54:36.663765,2025-04-24 22:54:57.152692,0 days 00:00:20.488927,True,absolute_error,50,,1,4,188,TPESampler,COMPLETE
932,0.9444881409262901,2025-04-24 22:54:38.280370,2025-04-24 22:54:39.466716,0 days 00:00:01.186346,True,absolute_error,9,log2,11,34,370,TPESampler,COMPLETE
933,0.37019292508737056,2025-04-24 22:54:39.649873,2025-04-24 22:55:24.765579,0 days 00:00:45.115706,True,absolute_error,50,,1,2,359,TPESampler,COMPLETE
934,0.935876950455351,2025-04-24 22:54:43.866835,2025-04-24 22:54:46.183974,0 days 00:00:02.317139,False,absolute_error,15,log2,10,6,915,TPESampler,COMPLETE
935,0.37211842699325315,2025-04-24 22:54:46.356458,2025-04-24 22:55:37.654828,0 days 00:00:51.298370,True,absolute_error,43,,1,2,493,TPESampler,COMPLETE
936,0.36911195879599473,2025-04-24 22:54:57.325162,2025-04-24 22:55:44.084252,0 days 00:00:46.759090,True,absolute_error,49,,1,2,424,TPESampler,COMPLETE
937,0.37565900915154865,2025-04-24 22:55:24.946251,2025-04-24 22:55:37.209542,0 days 00:00:12.263291,True,absolute_error,42,,1,3,109,TPESampler,COMPLETE
938,0.36903684401334214,2025-04-24 22:55:37.381927,2025-04-24 22:56:04.776198,0 days 00:00:27.394271,True,absolute_error,50,,1,3,283,TPESampler,COMPLETE
939,0.37004633752178573,2025-04-24 22:55:37.816286,2025-04-24 22:55:49.822005,0 days 00:00:12.005719,True,absolute_error,50,,1,2,127,TPESampler,COMPLETE
940,0.3713015386702165,2025-04-24 22:55:44.259219,2025-04-24 22:56:08.641465,0 days 00:00:24.382246,True,absolute_error,43,,1,2,266,TPESampler,COMPLETE
941,0.37693909961176963,2025-04-24 22:55:49.982420,2025-04-24 22:56:02.881197,0 days 00:00:12.898777,True,absolute_error,50,,1,4,122,TPESampler,COMPLETE
942,0.369916847608108,2025-04-24 22:56:03.058694,2025-04-24 22:56:36.635145,0 days 00:00:33.576451,True,absolute_error,50,,1,2,319,TPESampler,COMPLETE
943,0.5457611933554852,2025-04-24 22:56:04.955628,2025-04-24 22:56:31.755032,0 days 00:00:26.799404,False,absolute_error,7,,7,8,757,TPESampler,COMPLETE
944,0.4368305321954345,2025-04-24 22:56:08.813597,2025-04-24 22:57:09.676958,0 days 00:01:00.863361,False,absolute_error,49,,1,2,371,TPESampler,COMPLETE
945,0.6675729051476519,2025-04-24 22:56:31.927834,2025-04-24 22:56:38.772069,0 days 00:00:06.844235,True,absolute_error,29,sqrt,3,4,877,TPESampler,COMPLETE
946,0.4146672335458807,2025-04-24 22:56:36.814048,2025-04-24 22:56:51.905736,0 days 00:00:15.091688,True,absolute_error,50,,2,3,289,TPESampler,COMPLETE
947,0.367444819860748,2025-04-24 22:56:38.947661,2025-04-24 22:56:56.307337,0 days 00:00:17.359676,True,absolute_error,50,,1,2,187,TPESampler,COMPLETE
948,0.8855249409920178,2025-04-24 22:56:52.082465,2025-04-24 22:56:53.380880,0 days 00:00:01.298415,True,absolute_error,8,sqrt,10,2,348,TPESampler,COMPLETE
949,0.5719983316848002,2025-04-24 22:56:53.559958,2025-04-24 22:56:56.457491,0 days 00:00:02.897533,True,absolute_error,50,sqrt,2,2,250,TPESampler,COMPLETE
950,0.4148663768852057,2025-04-24 22:56:56.464713,2025-04-24 22:57:09.573701,0 days 00:00:13.108988,True,absolute_error,42,,2,2,251,TPESampler,COMPLETE
951,0.37233998346521685,2025-04-24 22:56:56.627998,2025-04-24 22:57:08.271014,0 days 00:00:11.643016,True,absolute_error,50,,1,3,123,TPESampler,COMPLETE
952,0.416812874016244,2025-04-24 22:57:08.489354,2025-04-24 22:57:10.283002,0 days 00:00:01.793648,True,squared_error,50,,2,2,213,TPESampler,COMPLETE
953,0.7736729663859195,2025-04-24 22:57:09.785595,2025-04-24 22:57:16.991600,0 days 00:00:07.206005,False,absolute_error,47,log2,2,4,676,TPESampler,COMPLETE
954,0.445946166779074,2025-04-24 22:57:09.856752,2025-04-24 22:57:11.691739,0 days 00:00:01.834987,True,squared_error,49,log2,1,2,140,TPESampler,COMPLETE
955,0.3692031859785476,2025-04-24 22:57:10.697786,2025-04-24 22:57:22.634503,0 days 00:00:11.936717,True,absolute_error,50,,1,2,122,TPESampler,COMPLETE
956,0.4157768891328172,2025-04-24 22:57:11.975677,2025-04-24 22:57:19.390162,0 days 00:00:07.414485,True,absolute_error,50,,2,2,136,TPESampler,COMPLETE
957,0.3797419816214367,2025-04-24 22:57:17.174842,2025-04-24 22:57:18.578381,0 days 00:00:01.403539,True,squared_error,50,,1,2,106,TPESampler,COMPLETE
958,0.8473978760893434,2025-04-24 22:57:18.938805,2025-04-24 22:57:20.279679,0 days 00:00:01.340874,True,squared_error,5,sqrt,4,5,516,TPESampler,COMPLETE
959,0.3681797343305437,2025-04-24 22:57:19.719696,2025-04-24 22:57:41.535438,0 days 00:00:21.815742,True,absolute_error,50,,1,2,236,TPESampler,COMPLETE
960,0.377159839138348,2025-04-24 22:57:20.511114,2025-04-24 22:57:30.397621,0 days 00:00:09.886507,True,absolute_error,40,,1,2,105,TPESampler,COMPLETE
961,0.3679340531051386,2025-04-24 22:57:22.812081,2025-04-24 22:57:48.112408,0 days 00:00:25.300327,True,absolute_error,50,,1,2,275,TPESampler,COMPLETE
962,0.4411584206004441,2025-04-24 22:57:30.566264,2025-04-24 22:59:21.733198,0 days 00:01:51.166934,False,absolute_error,42,,1,31,771,TPESampler,COMPLETE
963,0.36868963385822673,2025-04-24 22:57:41.701825,2025-04-24 22:57:58.171090,0 days 00:00:16.469265,True,absolute_error,50,,1,2,178,TPESampler,COMPLETE
964,0.41571645748065383,2025-04-24 22:57:48.504993,2025-04-24 22:58:02.169019,0 days 00:00:13.664026,True,absolute_error,50,,2,2,255,TPESampler,COMPLETE
965,0.37902913209108746,2025-04-24 22:57:58.346116,2025-04-24 22:58:07.984752,0 days 00:00:09.638636,True,absolute_error,50,,1,4,102,TPESampler,COMPLETE
966,0.3729916382750954,2025-04-24 22:58:02.357289,2025-04-24 22:58:15.854586,0 days 00:00:13.497297,True,absolute_error,42,,1,2,124,TPESampler,COMPLETE
967,0.37356411767323777,2025-04-24 22:58:08.160209,2025-04-24 22:58:22.073004,0 days 00:00:13.912795,True,absolute_error,42,,1,2,104,TPESampler,COMPLETE
968,0.40086338450267245,2025-04-24 22:58:16.029316,2025-04-24 22:58:23.416823,0 days 00:00:07.387507,True,absolute_error,50,sqrt,1,2,261,TPESampler,COMPLETE
969,0.9530920556965438,2025-04-24 22:58:22.266043,2025-04-24 22:58:24.027636,0 days 00:00:01.761593,True,squared_error,20,log2,6,7,981,TPESampler,COMPLETE
970,0.5290125779502967,2025-04-24 22:58:23.601636,2025-04-24 22:58:50.977535,0 days 00:00:27.375899,False,absolute_error,25,sqrt,1,29,849,TPESampler,COMPLETE
971,0.9634705674559592,2025-04-24 22:58:24.229563,2025-04-24 22:58:25.414819,0 days 00:00:01.185256,True,squared_error,47,log2,9,37,460,TPESampler,COMPLETE
972,0.4537515571684137,2025-04-24 22:58:25.612740,2025-04-24 22:58:27.797117,0 days 00:00:02.184377,True,absolute_error,47,log2,1,2,126,TPESampler,COMPLETE
973,0.37279284010543096,2025-04-24 22:58:27.968636,2025-04-24 22:58:58.719267,0 days 00:00:30.750631,True,absolute_error,50,,1,4,282,TPESampler,COMPLETE
974,0.37098454687522137,2025-04-24 22:58:51.158365,2025-04-24 22:59:16.478459,0 days 00:00:25.320094,True,absolute_error,43,,1,2,243,TPESampler,COMPLETE
975,0.3869368654778841,2025-04-24 22:58:58.904287,2025-04-24 22:59:01.263621,0 days 00:00:02.359334,True,squared_error,35,,1,2,281,TPESampler,COMPLETE
976,0.37041258817607675,2025-04-24 22:59:01.442402,2025-04-24 22:59:28.639922,0 days 00:00:27.197520,True,absolute_error,42,,1,3,255,TPESampler,COMPLETE
977,0.41533336255696446,2025-04-24 22:59:16.654147,2025-04-24 22:59:30.714097,0 days 00:00:14.059950,True,absolute_error,42,,2,4,248,TPESampler,COMPLETE
978,0.7319197415523936,2025-04-24 22:59:21.915008,2025-04-24 22:59:29.236963,0 days 00:00:07.321955,False,absolute_error,15,log2,1,6,469,TPESampler,COMPLETE
979,0.4165865093900445,2025-04-24 22:59:28.816034,2025-04-24 22:59:43.027972,0 days 00:00:14.211938,True,absolute_error,50,,2,2,269,TPESampler,COMPLETE
980,0.36880341533448757,2025-04-24 22:59:29.480531,2025-04-24 22:59:53.968050,0 days 00:00:24.487519,True,absolute_error,50,,1,2,267,TPESampler,COMPLETE
981,0.3692985366129779,2025-04-24 22:59:30.910679,2025-04-24 23:00:08.140975,0 days 00:00:37.230296,True,absolute_error,50,,1,2,412,TPESampler,COMPLETE
982,0.3688006208258982,2025-04-24 22:59:43.213840,2025-04-24 23:00:01.033241,0 days 00:00:17.819401,True,absolute_error,50,,1,2,192,TPESampler,COMPLETE
983,0.3688565899596876,2025-04-24 22:59:54.141863,2025-04-24 23:00:12.190451,0 days 00:00:18.048588,True,absolute_error,50,,1,2,196,TPESampler,COMPLETE
984,0.375507769159411,2025-04-24 23:00:01.214182,2025-04-24 23:00:11.400378,0 days 00:00:10.186196,True,absolute_error,43,,1,2,108,TPESampler,COMPLETE
985,0.37151917701972575,2025-04-24 23:00:08.326366,2025-04-24 23:00:47.425840,0 days 00:00:39.099474,True,absolute_error,50,,1,2,368,TPESampler,COMPLETE
986,0.41710334602694804,2025-04-24 23:00:11.575232,2025-04-24 23:00:18.614687,0 days 00:00:07.039455,True,absolute_error,50,,2,2,125,TPESampler,COMPLETE
