number,value,datetime_start,datetime_complete,duration,params_bootstrap,params_criterion,params_max_depth,params_max_features,params_min_samples_leaf,params_min_samples_split,params_n_estimators,system_attrs_auto:sampler,state
0,0.7408295896593907,2025-04-24 21:17:43.527673,2025-04-24 21:17:45.195753,0 days 00:00:01.668080,False,squared_error,22,sqrt,6,20,532,RandomSampler,COMPLETE
1,0.6649744744321603,2025-04-24 21:17:43.542335,2025-04-24 21:17:45.190836,0 days 00:00:01.648501,False,squared_error,9,,11,25,185,RandomSampler,COMPLETE
2,0.6598587210117527,2025-04-24 21:17:43.605160,2025-04-24 21:17:48.018403,0 days 00:00:04.413243,False,squared_error,7,,15,47,955,RandomSampler,COMPLETE
3,0.6283955771119427,2025-04-24 21:17:45.456156,2025-04-24 21:18:01.640505,0 days 00:00:16.184349,False,absolute_error,28,log2,1,16,789,TPESampler,COMPLETE
4,0.8604903459044672,2025-04-24 21:17:45.620435,2025-04-24 21:17:48.019932,0 days 00:00:02.399497,True,squared_error,42,sqrt,7,23,933,TPESampler,COMPLETE
5,0.7243059080687451,2025-04-24 21:17:48.250064,2025-04-24 21:17:51.233814,0 days 00:00:02.983750,True,squared_error,10,sqrt,2,26,999,TPESampler,COMPLETE
6,0.8514227742088778,2025-04-24 21:17:48.348161,2025-04-24 21:17:50.571798,0 days 00:00:02.223637,True,squared_error,50,log2,2,18,243,TPESampler,COMPLETE
7,0.9711363243872986,2025-04-24 21:17:50.798946,2025-04-24 21:17:52.442159,0 days 00:00:01.643213,True,squared_error,7,log2,11,5,607,TPESampler,COMPLETE
8,0.572751233629288,2025-04-24 21:17:51.421986,2025-04-24 21:17:59.772441,0 days 00:00:08.350455,True,absolute_error,11,,8,35,447,TPESampler,COMPLETE
9,0.5248068653099038,2025-04-24 21:17:52.792434,2025-04-24 21:18:07.982435,0 days 00:00:15.190001,True,absolute_error,37,,6,27,667,TPESampler,COMPLETE
10,0.938286901248003,2025-04-24 21:17:59.937770,2025-04-24 21:18:01.932584,0 days 00:00:01.994814,False,absolute_error,19,log2,11,2,857,TPESampler,COMPLETE
11,0.5168813452229517,2025-04-24 21:18:01.806640,2025-04-24 21:18:13.222731,0 days 00:00:11.416091,False,absolute_error,28,,7,15,292,TPESampler,COMPLETE
12,0.8420656699078768,2025-04-24 21:18:02.058842,2025-04-24 21:18:03.352209,0 days 00:00:01.293367,True,absolute_error,17,sqrt,6,24,224,TPESampler,COMPLETE
13,0.5839728897711854,2025-04-24 21:18:03.534584,2025-04-24 21:18:24.522953,0 days 00:00:20.988369,False,absolute_error,36,log2,1,20,842,TPESampler,COMPLETE
14,0.5712884080618045,2025-04-24 21:18:08.144340,2025-04-24 21:18:20.936942,0 days 00:00:12.792602,True,absolute_error,35,,8,36,610,TPESampler,COMPLETE
15,0.536489213682455,2025-04-24 21:18:13.382961,2025-04-24 21:18:24.868457,0 days 00:00:11.485496,False,absolute_error,29,,5,35,179,TPESampler,COMPLETE
16,0.6022785554188624,2025-04-24 21:18:21.095979,2025-04-24 21:18:37.529226,0 days 00:00:16.433247,False,absolute_error,36,,14,16,778,TPESampler,COMPLETE
17,0.5104465522193805,2025-04-24 21:18:24.690478,2025-04-24 21:18:55.589221,0 days 00:00:30.898743,False,absolute_error,22,,3,4,433,TPESampler,COMPLETE
18,0.4668174684189632,2025-04-24 21:18:25.058990,2025-04-24 21:18:36.253049,0 days 00:00:11.194059,True,absolute_error,43,,3,9,307,TPESampler,COMPLETE
19,0.4717328099565087,2025-04-24 21:18:36.425252,2025-04-24 21:18:42.415734,0 days 00:00:05.990482,True,absolute_error,43,,3,15,156,TPESampler,COMPLETE
20,0.6080191376643632,2025-04-24 21:18:37.695292,2025-04-24 21:18:39.998024,0 days 00:00:02.302732,True,absolute_error,28,,14,8,195,TPESampler,COMPLETE
21,0.9340889329419002,2025-04-24 21:18:40.163150,2025-04-24 21:18:40.953012,0 days 00:00:00.789862,False,absolute_error,36,log2,7,9,153,TPESampler,COMPLETE
22,0.44880001104928624,2025-04-24 21:18:41.118263,2025-04-24 21:19:01.150978,0 days 00:00:20.032715,False,absolute_error,40,,1,4,130,TPESampler,COMPLETE
23,0.46259292870024676,2025-04-24 21:18:42.580160,2025-04-24 21:18:49.002086,0 days 00:00:06.421926,True,absolute_error,39,,2,24,124,TPESampler,COMPLETE
24,0.43101676109693215,2025-04-24 21:18:49.154715,2025-04-24 21:18:58.571958,0 days 00:00:09.417243,True,absolute_error,43,,2,13,173,TPESampler,COMPLETE
25,0.6045673937430096,2025-04-24 21:18:55.747552,2025-04-24 21:18:59.466923,0 days 00:00:03.719371,True,absolute_error,34,log2,1,21,254,TPESampler,COMPLETE
26,0.4881984964957741,2025-04-24 21:18:58.730068,2025-04-24 21:18:59.765821,0 days 00:00:01.035753,True,squared_error,25,,2,36,171,TPESampler,COMPLETE
27,0.4712386542526541,2025-04-24 21:18:59.636798,2025-04-24 21:19:02.083827,0 days 00:00:02.447029,True,squared_error,44,,3,10,469,TPESampler,COMPLETE
28,0.449831942349336,2025-04-24 21:18:59.925928,2025-04-24 21:19:24.733671,0 days 00:00:24.807743,True,absolute_error,48,,1,32,295,TPESampler,COMPLETE
29,0.44877999137140784,2025-04-24 21:19:01.322204,2025-04-24 21:19:45.198986,0 days 00:00:43.876782,False,absolute_error,41,,1,4,289,TPESampler,COMPLETE
30,0.43880164474749983,2025-04-24 21:19:02.242004,2025-04-24 21:19:03.972921,0 days 00:00:01.730917,False,squared_error,28,,1,12,215,TPESampler,COMPLETE
31,0.4743936719764845,2025-04-24 21:19:04.143371,2025-04-24 21:19:05.859008,0 days 00:00:01.715637,False,squared_error,21,,2,10,249,TPESampler,COMPLETE
32,0.42208866161763353,2025-04-24 21:19:06.048976,2025-04-24 21:19:07.379955,0 days 00:00:01.330979,False,squared_error,41,,1,13,148,TPESampler,COMPLETE
33,0.41953503777946705,2025-04-24 21:19:07.610493,2025-04-24 21:19:09.498909,0 days 00:00:01.888416,False,squared_error,47,,1,18,222,TPESampler,COMPLETE
34,0.42002260471062364,2025-04-24 21:19:09.659917,2025-04-24 21:19:11.231672,0 days 00:00:01.571755,False,squared_error,45,,1,17,203,TPESampler,COMPLETE
35,0.4701489337155275,2025-04-24 21:19:11.412384,2025-04-24 21:19:12.087733,0 days 00:00:00.675349,False,squared_error,47,sqrt,1,25,111,TPESampler,COMPLETE
36,0.4224308143018334,2025-04-24 21:19:12.246468,2025-04-24 21:19:13.419909,0 days 00:00:01.173441,False,squared_error,48,,1,13,122,TPESampler,COMPLETE
37,0.4228252539024218,2025-04-24 21:19:13.575386,2025-04-24 21:19:16.250204,0 days 00:00:02.674818,False,squared_error,45,,1,14,398,TPESampler,COMPLETE
38,0.4651443087372209,2025-04-24 21:19:16.421385,2025-04-24 21:19:17.506482,0 days 00:00:01.085097,False,squared_error,44,,2,23,117,TPESampler,COMPLETE
39,0.5193768641885874,2025-04-24 21:19:17.690554,2025-04-24 21:19:18.512205,0 days 00:00:00.821651,False,squared_error,44,log2,1,12,213,TPESampler,COMPLETE
40,0.42664525298984085,2025-04-24 21:19:18.679045,2025-04-24 21:19:19.751585,0 days 00:00:01.072540,False,squared_error,46,,1,12,100,TPESampler,COMPLETE
41,0.433958064811667,2025-04-24 21:19:19.913805,2025-04-24 21:20:08.481578,0 days 00:00:48.567773,False,absolute_error,44,,1,24,337,TPESampler,COMPLETE
42,0.38323455045662635,2025-04-24 21:19:24.889592,2025-04-24 21:19:26.302697,0 days 00:00:01.413105,True,squared_error,38,,1,4,169,TPESampler,COMPLETE
43,0.39110065256478443,2025-04-24 21:19:26.471232,2025-04-24 21:19:28.175282,0 days 00:00:01.704050,True,squared_error,39,,1,6,201,TPESampler,COMPLETE
44,0.3837535335171272,2025-04-24 21:19:28.336158,2025-04-24 21:19:29.842009,0 days 00:00:01.505851,True,squared_error,44,,1,3,176,TPESampler,COMPLETE
45,0.384922150223261,2025-04-24 21:19:30.007983,2025-04-24 21:19:32.146129,0 days 00:00:02.138146,True,squared_error,38,,1,4,302,TPESampler,COMPLETE
46,0.38451243739741514,2025-04-24 21:19:32.406081,2025-04-24 21:19:33.953806,0 days 00:00:01.547725,True,squared_error,40,,1,2,168,TPESampler,COMPLETE
47,0.38243372118433544,2025-04-24 21:19:34.118339,2025-04-24 21:19:35.768831,0 days 00:00:01.650492,True,squared_error,41,,1,2,181,TPESampler,COMPLETE
48,0.3821985399823849,2025-04-24 21:19:35.929078,2025-04-24 21:19:38.033307,0 days 00:00:02.104229,True,squared_error,49,,1,2,249,TPESampler,COMPLETE
49,0.4783559562452192,2025-04-24 21:19:38.197679,2025-04-24 21:19:39.136716,0 days 00:00:00.939037,True,squared_error,35,,3,2,119,TPESampler,COMPLETE
50,0.5729348881413202,2025-04-24 21:19:39.296320,2025-04-24 21:19:40.217876,0 days 00:00:00.921556,True,squared_error,42,sqrt,2,4,276,TPESampler,COMPLETE
51,0.4146164037994765,2025-04-24 21:19:40.388615,2025-04-24 21:19:58.189866,0 days 00:00:17.801251,True,absolute_error,49,,2,2,344,TPESampler,COMPLETE
52,0.38135319280625235,2025-04-24 21:19:45.393114,2025-04-24 21:19:46.809173,0 days 00:00:01.416059,True,squared_error,50,,1,2,142,TPESampler,COMPLETE
53,0.44784832997336316,2025-04-24 21:19:46.971840,2025-04-24 21:19:48.323492,0 days 00:00:01.351652,True,squared_error,47,log2,1,2,310,TPESampler,COMPLETE
54,0.3994625293106143,2025-04-24 21:19:48.474148,2025-04-24 21:19:52.419826,0 days 00:00:03.945678,False,squared_error,41,,1,2,390,TPESampler,COMPLETE
55,0.38169172857459016,2025-04-24 21:19:52.624501,2025-04-24 21:19:53.827473,0 days 00:00:01.202972,True,squared_error,49,,1,2,108,TPESampler,COMPLETE
56,0.37248475598438796,2025-04-24 21:19:53.997094,2025-04-24 21:20:04.730349,0 days 00:00:10.733255,True,absolute_error,46,,1,2,113,TPESampler,COMPLETE
57,0.3873467551670735,2025-04-24 21:19:58.367621,2025-04-24 21:20:02.194846,0 days 00:00:03.827225,True,squared_error,49,,1,2,504,TPESampler,COMPLETE
58,0.3852917408240606,2025-04-24 21:20:02.356413,2025-04-24 21:20:03.693842,0 days 00:00:01.337429,True,squared_error,46,,1,3,124,TPESampler,COMPLETE
59,0.3814560290251299,2025-04-24 21:20:03.856257,2025-04-24 21:20:05.356207,0 days 00:00:01.499950,True,squared_error,47,,1,2,131,TPESampler,COMPLETE
60,0.5175098132542753,2025-04-24 21:20:04.897186,2025-04-24 21:20:07.566173,0 days 00:00:02.668987,True,absolute_error,39,log2,1,4,179,TPESampler,COMPLETE
61,0.37642444313220935,2025-04-24 21:20:05.572136,2025-04-24 21:20:15.432860,0 days 00:00:09.860724,True,absolute_error,35,,1,2,105,TPESampler,COMPLETE
62,0.4071254029021611,2025-04-24 21:20:07.804448,2025-04-24 21:20:14.121863,0 days 00:00:06.317415,True,absolute_error,42,sqrt,1,2,317,TPESampler,COMPLETE
63,0.37148650973038616,2025-04-24 21:20:08.674529,2025-04-24 21:20:18.861605,0 days 00:00:10.187076,True,absolute_error,49,,1,2,105,TPESampler,COMPLETE
64,0.41600048713116194,2025-04-24 21:20:14.323110,2025-04-24 21:20:15.875137,0 days 00:00:01.552027,True,squared_error,49,,2,2,229,TPESampler,COMPLETE
65,0.4153320891436102,2025-04-24 21:20:15.683932,2025-04-24 21:20:37.381876,0 days 00:00:21.697944,True,absolute_error,18,,1,2,254,TPESampler,COMPLETE
66,0.37775952772208815,2025-04-24 21:20:16.035987,2025-04-24 21:20:28.972494,0 days 00:00:12.936507,True,absolute_error,37,,1,2,107,TPESampler,COMPLETE
67,0.3684204841942153,2025-04-24 21:20:19.016968,2025-04-24 21:20:41.258681,0 days 00:00:22.241713,True,absolute_error,50,,1,2,212,TPESampler,COMPLETE
68,0.3748542284030312,2025-04-24 21:20:29.136098,2025-04-24 21:20:40.492459,0 days 00:00:11.356361,True,absolute_error,36,,1,3,122,TPESampler,COMPLETE
69,0.37106634936574895,2025-04-24 21:20:37.541860,2025-04-24 21:20:51.889485,0 days 00:00:14.347625,True,absolute_error,43,,1,2,154,TPESampler,COMPLETE
70,0.3774594958664966,2025-04-24 21:20:40.658589,2025-04-24 21:20:57.834538,0 days 00:00:17.175949,True,absolute_error,31,,1,2,184,TPESampler,COMPLETE
71,0.37527430331090894,2025-04-24 21:20:41.408603,2025-04-24 21:20:54.031447,0 days 00:00:12.622844,True,absolute_error,47,,1,4,136,TPESampler,COMPLETE
72,0.37116010149383627,2025-04-24 21:20:52.059208,2025-04-24 21:21:10.319324,0 days 00:00:18.260116,True,absolute_error,47,,1,2,194,TPESampler,COMPLETE
73,0.37416720143224075,2025-04-24 21:20:54.194209,2025-04-24 21:21:06.210060,0 days 00:00:12.015851,True,absolute_error,41,,1,3,125,TPESampler,COMPLETE
74,0.5100062323060643,2025-04-24 21:20:58.017146,2025-04-24 21:21:01.011721,0 days 00:00:02.994575,False,absolute_error,48,sqrt,2,2,130,TPESampler,COMPLETE
75,0.37685026606790484,2025-04-24 21:21:01.182037,2025-04-24 21:21:43.619122,0 days 00:00:42.437085,True,absolute_error,31,,1,2,437,TPESampler,COMPLETE
76,0.37791831306996004,2025-04-24 21:21:06.383415,2025-04-24 21:21:17.775864,0 days 00:00:11.392449,True,absolute_error,49,,1,4,106,TPESampler,COMPLETE
77,0.8283874353486977,2025-04-24 21:21:10.494017,2025-04-24 21:21:11.548548,0 days 00:00:01.054531,True,absolute_error,48,log2,2,2,142,TPESampler,COMPLETE
78,0.3681912900989029,2025-04-24 21:21:11.718052,2025-04-24 21:21:37.192730,0 days 00:00:25.474678,True,absolute_error,49,,1,2,254,TPESampler,COMPLETE
79,0.41710334602694804,2025-04-24 21:21:17.964365,2025-04-24 21:21:24.729506,0 days 00:00:06.765141,True,absolute_error,49,,2,2,125,TPESampler,COMPLETE
80,0.570142067188463,2025-04-24 21:21:24.890481,2025-04-24 21:21:26.944953,0 days 00:00:02.054472,True,absolute_error,46,sqrt,2,5,145,TPESampler,COMPLETE
81,0.40127613728439665,2025-04-24 21:21:27.107772,2025-04-24 21:21:56.523138,0 days 00:00:29.415366,True,absolute_error,26,,1,10,320,TPESampler,COMPLETE
82,0.37108656973026205,2025-04-24 21:21:37.371548,2025-04-24 21:21:58.141141,0 days 00:00:20.769593,True,absolute_error,47,,1,2,195,TPESampler,COMPLETE
83,0.3728235737267268,2025-04-24 21:21:43.797752,2025-04-24 21:22:34.890350,0 days 00:00:51.092598,True,absolute_error,49,,1,4,409,TPESampler,COMPLETE
84,0.43580211436185795,2025-04-24 21:21:56.679506,2025-04-24 21:22:28.993667,0 days 00:00:32.314161,False,absolute_error,48,,1,2,209,TPESampler,COMPLETE
85,0.367402771739391,2025-04-24 21:21:58.301761,2025-04-24 21:22:37.018595,0 days 00:00:38.716834,True,absolute_error,50,,1,2,292,TPESampler,COMPLETE
86,0.3675685311640558,2025-04-24 21:22:29.150980,2025-04-24 21:22:50.944337,0 days 00:00:21.793357,True,absolute_error,50,,1,2,208,TPESampler,COMPLETE
87,0.38094533564382405,2025-04-24 21:22:35.053793,2025-04-24 21:23:26.668408,0 days 00:00:51.614615,True,absolute_error,48,,1,8,399,TPESampler,COMPLETE
88,0.3719030248298662,2025-04-24 21:22:37.183992,2025-04-24 21:23:23.019534,0 days 00:00:45.835542,True,absolute_error,46,,1,2,358,TPESampler,COMPLETE
89,0.3692708333177682,2025-04-24 21:22:51.140640,2025-04-24 21:23:30.002351,0 days 00:00:38.861711,True,absolute_error,43,,1,2,294,TPESampler,COMPLETE
90,0.37023708307625747,2025-04-24 21:23:23.186652,2025-04-24 21:23:56.696238,0 days 00:00:33.509586,True,absolute_error,50,,1,2,358,TPESampler,COMPLETE
91,0.5630539159652702,2025-04-24 21:23:26.838156,2025-04-24 21:23:55.295230,0 days 00:00:28.457074,False,absolute_error,40,,4,2,531,TPESampler,COMPLETE
92,0.36840952804772426,2025-04-24 21:23:30.164784,2025-04-24 21:23:57.182305,0 days 00:00:27.017521,True,absolute_error,49,,1,2,296,TPESampler,COMPLETE
93,0.43145973223161393,2025-04-24 21:23:55.461059,2025-04-24 21:23:59.980653,0 days 00:00:04.519594,False,absolute_error,45,log2,1,2,160,TPESampler,COMPLETE
94,0.3731977791199048,2025-04-24 21:23:56.862551,2025-04-24 21:24:30.718448,0 days 00:00:33.855897,True,absolute_error,46,,1,2,367,TPESampler,COMPLETE
95,0.8120651138133431,2025-04-24 21:23:57.371613,2025-04-24 21:24:02.153798,0 days 00:00:04.782185,False,absolute_error,5,sqrt,1,18,403,TPESampler,COMPLETE
96,0.3690650317623949,2025-04-24 21:24:00.139827,2025-04-24 21:24:40.947906,0 days 00:00:40.808079,True,absolute_error,50,,1,2,414,TPESampler,COMPLETE
97,0.4140669881804371,2025-04-24 21:24:02.431078,2025-04-24 21:24:21.980693,0 days 00:00:19.549615,True,absolute_error,41,,2,2,353,TPESampler,COMPLETE
98,0.9622393383221485,2025-04-24 21:24:22.146467,2025-04-24 21:24:22.988086,0 days 00:00:00.841619,False,squared_error,22,log2,10,2,497,TPESampler,COMPLETE
99,0.4763796026827302,2025-04-24 21:24:23.152553,2025-04-24 21:24:28.098091,0 days 00:00:04.945538,True,absolute_error,44,log2,1,2,350,TPESampler,COMPLETE
100,0.9479822066131954,2025-04-24 21:24:28.256078,2025-04-24 21:24:29.684209,0 days 00:00:01.428131,True,squared_error,40,log2,5,2,849,TPESampler,COMPLETE
101,0.9563006883271985,2025-04-24 21:24:29.848089,2025-04-24 21:24:31.211983,0 days 00:00:01.363894,True,squared_error,16,log2,6,48,687,TPESampler,COMPLETE
102,0.37101617810812176,2025-04-24 21:24:30.893649,2025-04-24 21:24:57.629856,0 days 00:00:26.736207,True,absolute_error,47,,1,2,261,TPESampler,COMPLETE
103,0.3702957476065271,2025-04-24 21:24:31.452186,2025-04-24 21:24:48.413844,0 days 00:00:16.961658,True,absolute_error,48,,1,2,170,TPESampler,COMPLETE
104,0.3710952405866859,2025-04-24 21:24:41.118726,2025-04-24 21:25:23.149747,0 days 00:00:42.031021,True,absolute_error,49,,1,2,383,TPESampler,COMPLETE
105,0.9056591335412275,2025-04-24 21:24:48.573360,2025-04-24 21:24:50.568851,0 days 00:00:01.995491,True,absolute_error,12,sqrt,12,10,810,TPESampler,COMPLETE
106,0.369945621570506,2025-04-24 21:24:50.730552,2025-04-24 21:25:28.984427,0 days 00:00:38.253875,True,absolute_error,49,,1,2,335,TPESampler,COMPLETE
107,0.41921616461573047,2025-04-24 21:24:57.793675,2025-04-24 21:25:15.287628,0 days 00:00:17.493953,True,absolute_error,50,sqrt,1,5,672,TPESampler,COMPLETE
108,0.3692861179559771,2025-04-24 21:25:15.466545,2025-04-24 21:26:25.989195,0 days 00:01:10.522650,True,absolute_error,49,,1,2,713,TPESampler,COMPLETE
109,0.4762369363393269,2025-04-24 21:25:23.319444,2025-04-24 21:25:25.478891,0 days 00:00:02.159447,False,squared_error,43,log2,1,3,708,TPESampler,COMPLETE
110,0.5718336414377154,2025-04-24 21:25:25.638978,2025-04-24 21:25:28.572212,0 days 00:00:02.933234,True,absolute_error,50,sqrt,2,2,237,TPESampler,COMPLETE
111,0.6810799637078726,2025-04-24 21:25:28.755698,2025-04-24 21:25:32.518006,0 days 00:00:03.762308,False,squared_error,5,,11,7,977,TPESampler,COMPLETE
112,0.8944214735430416,2025-04-24 21:25:29.184306,2025-04-24 21:25:31.357109,0 days 00:00:02.172803,True,absolute_error,50,log2,3,6,534,TPESampler,COMPLETE
113,0.36838585934384965,2025-04-24 21:25:31.520350,2025-04-24 21:25:56.377296,0 days 00:00:24.856946,True,absolute_error,50,,1,2,270,TPESampler,COMPLETE
114,0.37295279307543255,2025-04-24 21:25:32.684799,2025-04-24 21:26:11.320559,0 days 00:00:38.635760,True,absolute_error,43,,1,2,395,TPESampler,COMPLETE
115,0.37297591398664715,2025-04-24 21:25:56.532688,2025-04-24 21:26:34.393386,0 days 00:00:37.860698,True,absolute_error,48,,1,2,372,TPESampler,COMPLETE
116,0.3705858465045984,2025-04-24 21:26:11.495706,2025-04-24 21:26:51.652922,0 days 00:00:40.157216,True,absolute_error,49,,1,2,337,TPESampler,COMPLETE
117,0.3684204841942153,2025-04-24 21:26:26.150795,2025-04-24 21:26:54.940156,0 days 00:00:28.789361,True,absolute_error,50,,1,2,212,TPESampler,COMPLETE
118,0.3686571692833636,2025-04-24 21:26:34.559503,2025-04-24 21:28:14.779237,0 days 00:01:40.219734,True,absolute_error,49,,1,2,829,TPESampler,COMPLETE
119,0.41131364980053053,2025-04-24 21:26:51.836205,2025-04-24 21:27:31.297589,0 days 00:00:39.461384,True,absolute_error,38,,2,4,694,TPESampler,COMPLETE
120,0.44353230390728676,2025-04-24 21:26:55.114464,2025-04-24 21:29:05.222782,0 days 00:02:10.108318,False,absolute_error,50,,1,3,781,TPESampler,COMPLETE
121,0.9151627857854716,2025-04-24 21:27:31.493927,2025-04-24 21:27:32.943216,0 days 00:00:01.449289,True,squared_error,38,log2,3,14,868,TPESampler,COMPLETE
122,0.3689129030171069,2025-04-24 21:27:33.118990,2025-04-24 21:29:01.331449,0 days 00:01:28.212459,True,absolute_error,49,,1,2,726,TPESampler,COMPLETE
123,0.37053051494073497,2025-04-24 21:28:14.946510,2025-04-24 21:29:21.125754,0 days 00:01:06.179244,True,absolute_error,48,,1,2,584,TPESampler,COMPLETE
124,0.41101580112610286,2025-04-24 21:29:01.528174,2025-04-24 21:29:43.285982,0 days 00:00:41.757808,True,absolute_error,47,,2,2,799,TPESampler,COMPLETE
125,0.37759010768561707,2025-04-24 21:29:05.379995,2025-04-24 21:30:17.420937,0 days 00:01:12.040942,True,absolute_error,44,,1,6,803,TPESampler,COMPLETE
126,0.8339233448905706,2025-04-24 21:29:21.289297,2025-04-24 21:29:24.708602,0 days 00:00:03.419305,False,absolute_error,8,log2,1,2,360,TPESampler,COMPLETE
127,0.38724221937668935,2025-04-24 21:29:24.891334,2025-04-24 21:29:30.635092,0 days 00:00:05.743758,True,squared_error,38,,1,2,819,TPESampler,COMPLETE
128,0.36836080684360867,2025-04-24 21:29:30.797425,2025-04-24 21:30:53.230018,0 days 00:01:22.432593,True,absolute_error,43,,1,3,772,TPESampler,COMPLETE
129,0.36906315139266327,2025-04-24 21:29:43.447593,2025-04-24 21:31:19.807743,0 days 00:01:36.360150,True,absolute_error,49,,1,2,921,TPESampler,COMPLETE
130,0.6764560507918908,2025-04-24 21:30:17.867021,2025-04-24 21:30:18.932997,0 days 00:00:01.065976,False,squared_error,25,log2,1,40,495,TPESampler,COMPLETE
131,0.3701870560713945,2025-04-24 21:30:19.089561,2025-04-24 21:31:26.894405,0 days 00:01:07.804844,True,absolute_error,49,,1,3,602,TPESampler,COMPLETE
132,0.36939125263975164,2025-04-24 21:30:53.389305,2025-04-24 21:31:58.635093,0 days 00:01:05.245788,True,absolute_error,48,,1,2,674,TPESampler,COMPLETE
133,0.3692921396486323,2025-04-24 21:31:19.974897,2025-04-24 21:33:16.045096,0 days 00:01:56.070199,True,absolute_error,43,,1,2,924,TPESampler,COMPLETE
134,0.36920697967395255,2025-04-24 21:31:27.074201,2025-04-24 21:33:02.603172,0 days 00:01:35.528971,True,absolute_error,48,,1,2,809,TPESampler,COMPLETE
135,0.5561831490704577,2025-04-24 21:31:58.794007,2025-04-24 21:32:11.831491,0 days 00:00:13.037484,True,absolute_error,37,log2,1,7,894,TPESampler,COMPLETE
136,0.4603289264515974,2025-04-24 21:32:11.995684,2025-04-24 21:32:30.404745,0 days 00:00:18.409061,True,absolute_error,48,log2,1,2,977,TPESampler,COMPLETE
137,0.4116832815601651,2025-04-24 21:32:30.571911,2025-04-24 21:33:32.882280,0 days 00:01:02.310369,True,absolute_error,50,,2,4,900,TPESampler,COMPLETE
138,0.37095134337452423,2025-04-24 21:33:02.761586,2025-04-24 21:34:36.556480,0 days 00:01:33.794894,True,absolute_error,44,,1,4,842,TPESampler,COMPLETE
139,0.36930679496119745,2025-04-24 21:33:16.208316,2025-04-24 21:34:45.358648,0 days 00:01:29.150332,True,absolute_error,46,,1,2,901,TPESampler,COMPLETE
