number,value,datetime_start,datetime_complete,duration,params_bootstrap,params_criterion,params_max_depth,params_max_features,params_min_samples_leaf,params_min_samples_split,params_n_estimators,system_attrs_auto:sampler,state
1973,0.36959915105391766,2025-04-25 00:30:46.267633,2025-04-25 00:30:56.678727,0 days 00:00:10.411094,True,absolute_error,50,,1,2,110,TPESampler,COMPLETE
1974,0.36959915105391766,2025-04-25 00:30:53.321123,2025-04-25 00:31:03.717466,0 days 00:00:10.396343,True,absolute_error,50,,1,2,110,TPESampler,COMPLETE
1975,0.37630209329029995,2025-04-25 00:30:56.861655,2025-04-25 00:31:06.685973,0 days 00:00:09.824318,True,absolute_error,42,,1,3,104,TPESampler,COMPLETE
1976,0.3690767742061877,2025-04-25 00:31:03.744085,2025-04-25 00:31:16.450335,0 days 00:00:12.706250,True,absolute_error,50,,1,3,118,TPESampler,COMPLETE
1977,0.4148408179454311,2025-04-25 00:31:03.913258,2025-04-25 00:31:14.863930,0 days 00:00:10.950672,True,absolute_error,50,,2,2,185,TPESampler,COMPLETE
1978,0.3750889671873913,2025-04-25 00:31:06.935079,2025-04-25 00:31:18.826790,0 days 00:00:11.891711,True,absolute_error,44,,1,2,107,TPESampler,COMPLETE
1979,0.7435457157760885,2025-04-25 00:31:15.046489,2025-04-25 00:31:16.346377,0 days 00:00:01.299888,True,squared_error,9,sqrt,2,18,600,TPESampler,COMPLETE
1980,0.5289775119825376,2025-04-25 00:31:16.502171,2025-04-25 00:31:18.481759,0 days 00:00:01.979588,False,squared_error,50,,5,9,203,TPESampler,COMPLETE
1981,0.7402981251003765,2025-04-25 00:31:16.620391,2025-04-25 00:31:17.931074,0 days 00:00:01.310683,False,squared_error,29,sqrt,6,3,484,TPESampler,COMPLETE
1982,0.44207745162317896,2025-04-25 00:31:18.111228,2025-04-25 00:31:38.958113,0 days 00:00:20.846885,False,absolute_error,50,,1,2,133,TPESampler,COMPLETE
1983,0.5993377447929225,2025-04-25 00:31:18.796873,2025-04-25 00:31:21.865308,0 days 00:00:03.068435,True,squared_error,25,,12,21,869,TPESampler,COMPLETE
1984,0.3711289878906034,2025-04-25 00:31:19.019312,2025-04-25 00:31:50.670113,0 days 00:00:31.650801,True,absolute_error,50,,1,3,347,TPESampler,COMPLETE
1985,0.3710432268236213,2025-04-25 00:31:22.047634,2025-04-25 00:31:53.922385,0 days 00:00:31.874751,True,absolute_error,42,,1,3,352,TPESampler,COMPLETE
1986,0.37467948595974304,2025-04-25 00:31:39.149459,2025-04-25 00:31:50.107405,0 days 00:00:10.957946,True,absolute_error,49,,1,4,117,TPESampler,COMPLETE
1987,0.36861000388284376,2025-04-25 00:31:50.289509,2025-04-25 00:32:13.694283,0 days 00:00:23.404774,True,absolute_error,50,,1,2,242,TPESampler,COMPLETE
1988,0.4394432850388891,2025-04-25 00:31:50.873962,2025-04-25 00:31:52.464579,0 days 00:00:01.590617,True,squared_error,50,log2,1,2,331,TPESampler,COMPLETE
1989,0.41937181335672835,2025-04-25 00:31:52.651621,2025-04-25 00:31:59.110268,0 days 00:00:06.458647,True,absolute_error,44,,2,2,108,TPESampler,COMPLETE
1990,0.41591647381839797,2025-04-25 00:31:54.106554,2025-04-25 00:32:09.904664,0 days 00:00:15.798110,True,absolute_error,50,,2,3,280,TPESampler,COMPLETE
1991,0.9005994726990438,2025-04-25 00:31:59.295954,2025-04-25 00:32:01.936363,0 days 00:00:02.640409,False,absolute_error,39,log2,4,26,622,TPESampler,COMPLETE
1992,0.3722074485859912,2025-04-25 00:32:02.120864,2025-04-25 00:32:36.092983,0 days 00:00:33.972119,True,absolute_error,43,,1,2,360,TPESampler,COMPLETE
1993,0.36774425093151825,2025-04-25 00:32:10.092021,2025-04-25 00:32:29.709717,0 days 00:00:19.617696,True,absolute_error,50,,1,2,209,TPESampler,COMPLETE
1994,0.37780671670838056,2025-04-25 00:32:13.876028,2025-04-25 00:32:25.285160,0 days 00:00:11.409132,True,absolute_error,50,,1,4,123,TPESampler,COMPLETE
1995,0.865261536871265,2025-04-25 00:32:25.464013,2025-04-25 00:32:26.404725,0 days 00:00:00.940712,True,squared_error,28,sqrt,7,2,313,TPESampler,COMPLETE
1996,0.41344207701569774,2025-04-25 00:32:26.589653,2025-04-25 00:32:47.110413,0 days 00:00:20.520760,True,absolute_error,50,,2,2,391,TPESampler,COMPLETE
1997,0.37076689923779027,2025-04-25 00:32:29.893637,2025-04-25 00:33:03.938967,0 days 00:00:34.045330,True,absolute_error,50,,1,2,377,TPESampler,COMPLETE
1998,0.370933435807431,2025-04-25 00:32:36.272144,2025-04-25 00:32:57.360125,0 days 00:00:21.087981,True,absolute_error,43,,1,2,231,TPESampler,COMPLETE
1999,0.4152079089344288,2025-04-25 00:32:47.660461,2025-04-25 00:33:04.029134,0 days 00:00:16.368673,True,absolute_error,42,,2,2,309,TPESampler,COMPLETE
2000,0.3720044163726067,2025-04-25 00:32:57.550192,2025-04-25 00:33:08.931356,0 days 00:00:11.381164,True,absolute_error,42,,1,2,120,TPESampler,COMPLETE
2001,0.3720044163726067,2025-04-25 00:33:04.102200,2025-04-25 00:33:16.275234,0 days 00:00:12.173034,True,absolute_error,42,,1,2,120,TPESampler,COMPLETE
2002,0.6267852259497729,2025-04-25 00:33:04.219511,2025-04-25 00:33:12.618092,0 days 00:00:08.398581,False,absolute_error,10,,14,19,368,TPESampler,COMPLETE
2003,0.8301147400672592,2025-04-25 00:33:09.114820,2025-04-25 00:33:11.086564,0 days 00:00:01.971744,True,absolute_error,49,log2,2,3,352,TPESampler,COMPLETE
2004,0.5112659121129836,2025-04-25 00:33:11.269292,2025-04-25 00:34:22.914294,0 days 00:01:11.645002,True,absolute_error,17,,1,50,812,TPESampler,COMPLETE
2005,0.36923458901947326,2025-04-25 00:33:12.799986,2025-04-25 00:33:37.356341,0 days 00:00:24.556355,True,absolute_error,42,,1,2,235,TPESampler,COMPLETE
2006,0.4071532256642638,2025-04-25 00:33:16.459410,2025-04-25 00:33:25.364334,0 days 00:00:08.904924,True,absolute_error,50,sqrt,1,3,334,TPESampler,COMPLETE
2007,0.37529654061212914,2025-04-25 00:33:25.547199,2025-04-25 00:33:54.032934,0 days 00:00:28.485735,True,absolute_error,50,,1,4,219,TPESampler,COMPLETE
2008,0.7297914253883442,2025-04-25 00:33:37.539481,2025-04-25 00:33:47.699050,0 days 00:00:10.159569,False,absolute_error,9,sqrt,3,4,707,TPESampler,COMPLETE
2009,0.533747567436675,2025-04-25 00:33:47.882596,2025-04-25 00:34:01.181615,0 days 00:00:13.299019,False,absolute_error,40,log2,1,13,515,TPESampler,COMPLETE
2010,0.486998953376338,2025-04-25 00:33:54.258070,2025-04-25 00:35:59.614363,0 days 00:02:05.356293,False,absolute_error,15,,1,6,924,TPESampler,COMPLETE
2011,0.38225701323307704,2025-04-25 00:34:01.360225,2025-04-25 00:34:03.152750,0 days 00:00:01.792525,True,squared_error,40,,1,4,222,TPESampler,COMPLETE
2012,0.8963188523240347,2025-04-25 00:34:03.337351,2025-04-25 00:34:04.617186,0 days 00:00:01.279835,True,absolute_error,14,log2,3,3,252,TPESampler,COMPLETE
2013,0.41487087563830893,2025-04-25 00:34:04.802667,2025-04-25 00:34:15.127346,0 days 00:00:10.324679,True,absolute_error,42,,2,2,196,TPESampler,COMPLETE
2014,0.3668288604757991,2025-04-25 00:34:15.317313,2025-04-25 00:34:30.286946,0 days 00:00:14.969633,True,absolute_error,50,,1,2,160,TPESampler,COMPLETE
2015,0.40281376939976093,2025-04-25 00:34:23.102733,2025-04-25 00:34:26.708116,0 days 00:00:03.605383,True,absolute_error,50,sqrt,1,2,155,TPESampler,COMPLETE
2016,0.36867048921269446,2025-04-25 00:34:27.035030,2025-04-25 00:34:47.227791,0 days 00:00:20.192761,True,absolute_error,50,,1,2,217,TPESampler,COMPLETE
2017,0.4201018890298708,2025-04-25 00:34:30.804779,2025-04-25 00:34:36.639534,0 days 00:00:05.834755,True,absolute_error,50,,2,2,106,TPESampler,COMPLETE
2018,0.6448354599184769,2025-04-25 00:34:36.822546,2025-04-25 00:34:39.558758,0 days 00:00:02.736212,True,absolute_error,26,log2,1,14,228,TPESampler,COMPLETE
2019,0.3694428018950621,2025-04-25 00:34:39.742498,2025-04-25 00:35:05.324586,0 days 00:00:25.582088,True,absolute_error,44,,1,3,253,TPESampler,COMPLETE
2020,0.7901576468679955,2025-04-25 00:34:47.417941,2025-04-25 00:34:48.391506,0 days 00:00:00.973565,False,squared_error,22,log2,2,7,423,TPESampler,COMPLETE
2021,0.6351106269637806,2025-04-25 00:34:48.581475,2025-04-25 00:35:00.451130,0 days 00:00:11.869655,True,absolute_error,13,sqrt,1,2,823,TPESampler,COMPLETE
2022,0.3759167263421656,2025-04-25 00:35:00.638558,2025-04-25 00:35:10.177594,0 days 00:00:09.539036,True,absolute_error,43,,1,2,101,TPESampler,COMPLETE
2023,0.3681310370917946,2025-04-25 00:35:05.510012,2025-04-25 00:35:25.228171,0 days 00:00:19.718159,True,absolute_error,50,,1,2,213,TPESampler,COMPLETE
2024,0.5793387285153648,2025-04-25 00:35:10.364871,2025-04-25 00:35:12.212585,0 days 00:00:01.847714,False,squared_error,10,,6,18,333,TPESampler,COMPLETE
2025,0.3689563502142743,2025-04-25 00:35:12.398599,2025-04-25 00:35:37.993713,0 days 00:00:25.595114,True,absolute_error,50,,1,2,263,TPESampler,COMPLETE
2026,0.41212909093384303,2025-04-25 00:35:25.414382,2025-04-25 00:35:51.724291,0 days 00:00:26.309909,True,absolute_error,50,,2,4,414,TPESampler,COMPLETE
2027,0.36857122095319406,2025-04-25 00:35:38.176183,2025-04-25 00:36:26.029501,0 days 00:00:47.853318,True,absolute_error,50,,1,2,424,TPESampler,COMPLETE
2028,0.4951337425737109,2025-04-25 00:35:51.910528,2025-04-25 00:35:54.828540,0 days 00:00:02.918012,True,squared_error,32,,1,49,730,TPESampler,COMPLETE
2029,0.4455217044302255,2025-04-25 00:35:55.021221,2025-04-25 00:35:58.466462,0 days 00:00:03.445241,True,absolute_error,50,log2,1,2,216,TPESampler,COMPLETE
2030,0.4153588354582208,2025-04-25 00:35:58.653915,2025-04-25 00:36:16.197047,0 days 00:00:17.543132,True,absolute_error,43,,2,3,246,TPESampler,COMPLETE
2031,0.3784805376624087,2025-04-25 00:35:59.811528,2025-04-25 00:36:25.497752,0 days 00:00:25.686224,True,absolute_error,33,,1,4,224,TPESampler,COMPLETE
2032,0.3734501728375931,2025-04-25 00:36:16.393625,2025-04-25 00:36:41.863712,0 days 00:00:25.470087,True,absolute_error,43,,1,4,272,TPESampler,COMPLETE
2033,0.37217079986459695,2025-04-25 00:36:25.689929,2025-04-25 00:36:45.901933,0 days 00:00:20.212004,True,absolute_error,43,,1,3,212,TPESampler,COMPLETE
2034,0.939433332701176,2025-04-25 00:36:26.392607,2025-04-25 00:36:28.746033,0 days 00:00:02.353426,False,absolute_error,25,log2,12,44,894,TPESampler,COMPLETE
2035,0.3713984103941831,2025-04-25 00:36:28.926722,2025-04-25 00:37:22.073143,0 days 00:00:53.146421,True,absolute_error,50,,1,4,552,TPESampler,COMPLETE
2036,0.37125867418526587,2025-04-25 00:36:42.049802,2025-04-25 00:36:52.132875,0 days 00:00:10.083073,True,absolute_error,50,,1,2,106,TPESampler,COMPLETE
2037,0.36919707947490027,2025-04-25 00:36:46.087710,2025-04-25 00:37:02.723929,0 days 00:00:16.636219,True,absolute_error,50,,1,3,154,TPESampler,COMPLETE
2038,0.41477642424971595,2025-04-25 00:36:52.316203,2025-04-25 00:37:12.016132,0 days 00:00:19.699929,True,absolute_error,50,,2,3,286,TPESampler,COMPLETE
2039,0.3692015170252718,2025-04-25 00:37:02.907089,2025-04-25 00:37:43.587320,0 days 00:00:40.680231,True,absolute_error,42,,1,2,417,TPESampler,COMPLETE
2040,0.37079301935746106,2025-04-25 00:37:12.228484,2025-04-25 00:37:21.833227,0 days 00:00:09.604743,True,absolute_error,50,,1,2,100,TPESampler,COMPLETE
2041,0.4791895097639558,2025-04-25 00:37:22.024026,2025-04-25 00:37:33.809750,0 days 00:00:11.785724,False,absolute_error,38,,2,3,118,TPESampler,COMPLETE
2042,0.6661334641718416,2025-04-25 00:37:22.342597,2025-04-25 00:37:24.672914,0 days 00:00:02.330317,False,squared_error,15,,12,2,391,TPESampler,COMPLETE
2043,0.3811582134524727,2025-04-25 00:37:24.856180,2025-04-25 00:37:26.287047,0 days 00:00:01.430867,True,squared_error,49,,1,4,148,TPESampler,COMPLETE
2044,0.42069606508063623,2025-04-25 00:37:26.687666,2025-04-25 00:37:32.626461,0 days 00:00:05.938795,True,absolute_error,50,,2,2,104,TPESampler,COMPLETE
2045,0.3716240512590562,2025-04-25 00:37:32.822105,2025-04-25 00:38:02.128678,0 days 00:00:29.306573,True,absolute_error,50,,1,3,321,TPESampler,COMPLETE
2046,0.3685355345759143,2025-04-25 00:37:33.996759,2025-04-25 00:38:01.523072,0 days 00:00:27.526313,True,absolute_error,42,,1,2,302,TPESampler,COMPLETE
2047,0.36823715123140627,2025-04-25 00:37:43.774836,2025-04-25 00:38:11.408704,0 days 00:00:27.633868,True,absolute_error,50,,1,2,301,TPESampler,COMPLETE
2048,0.36803811171045814,2025-04-25 00:38:01.713177,2025-04-25 00:38:29.435628,0 days 00:00:27.722451,True,absolute_error,50,,1,2,235,TPESampler,COMPLETE
2049,0.36838585934384965,2025-04-25 00:38:02.397768,2025-04-25 00:38:31.884471,0 days 00:00:29.486703,True,absolute_error,50,,1,2,270,TPESampler,COMPLETE
2050,0.9175463360764549,2025-04-25 00:38:11.590609,2025-04-25 00:38:12.748597,0 days 00:00:01.157988,False,squared_error,30,log2,4,2,770,TPESampler,COMPLETE
2051,0.36941324118924657,2025-04-25 00:38:12.937527,2025-04-25 00:38:43.732593,0 days 00:00:30.795066,True,absolute_error,42,,1,2,265,TPESampler,COMPLETE
2052,0.6227927709489214,2025-04-25 00:38:29.623671,2025-04-25 00:38:36.197278,0 days 00:00:06.573607,False,absolute_error,15,sqrt,2,5,393,TPESampler,COMPLETE
2053,0.9407598689542293,2025-04-25 00:38:32.072398,2025-04-25 00:38:32.980541,0 days 00:00:00.908143,False,absolute_error,35,log2,11,13,185,TPESampler,COMPLETE
2054,0.36802957684872123,2025-04-25 00:38:33.163964,2025-04-25 00:38:53.922905,0 days 00:00:20.758941,True,absolute_error,50,,1,2,211,TPESampler,COMPLETE
2055,0.4217231575054517,2025-04-25 00:38:36.382178,2025-04-25 00:38:38.780155,0 days 00:00:02.397977,True,absolute_error,42,sqrt,1,2,101,TPESampler,COMPLETE
2056,0.3742403328107831,2025-04-25 00:38:38.963341,2025-04-25 00:39:11.670757,0 days 00:00:32.707416,True,absolute_error,50,,1,4,340,TPESampler,COMPLETE
2057,0.48609545123237413,2025-04-25 00:38:43.923875,2025-04-25 00:38:52.035892,0 days 00:00:08.112017,True,absolute_error,13,,3,11,225,TPESampler,COMPLETE
2058,0.414809112002108,2025-04-25 00:38:52.221418,2025-04-25 00:39:14.689039,0 days 00:00:22.467621,True,absolute_error,45,,2,2,378,TPESampler,COMPLETE
2059,0.3760284476175864,2025-04-25 00:38:54.110927,2025-04-25 00:39:03.696296,0 days 00:00:09.585369,True,absolute_error,44,,1,2,101,TPESampler,COMPLETE
2060,0.4163468737312938,2025-04-25 00:39:03.877531,2025-04-25 00:39:20.849587,0 days 00:00:16.972056,True,absolute_error,42,,2,2,278,TPESampler,COMPLETE
2061,0.41499355743225413,2025-04-25 00:39:11.860222,2025-04-25 00:39:25.875126,0 days 00:00:14.014904,True,absolute_error,43,,2,2,252,TPESampler,COMPLETE
2062,0.4140887237459388,2025-04-25 00:39:14.872632,2025-04-25 00:39:24.441753,0 days 00:00:09.569121,True,absolute_error,44,,2,4,169,TPESampler,COMPLETE
2063,0.37205283336509337,2025-04-25 00:39:21.028319,2025-04-25 00:39:43.912947,0 days 00:00:22.884628,True,absolute_error,43,,1,3,226,TPESampler,COMPLETE
2064,0.4408897142410222,2025-04-25 00:39:24.624740,2025-04-25 00:40:09.897089,0 days 00:00:45.272349,True,absolute_error,19,,1,18,503,TPESampler,COMPLETE
2065,0.3744939586199228,2025-04-25 00:39:26.067028,2025-04-25 00:39:36.893869,0 days 00:00:10.826841,True,absolute_error,40,,1,2,114,TPESampler,COMPLETE
2066,0.41831165770759143,2025-04-25 00:39:37.082470,2025-04-25 00:39:46.770139,0 days 00:00:09.687669,True,absolute_error,40,sqrt,1,3,388,TPESampler,COMPLETE
2067,0.7940921597827563,2025-04-25 00:39:44.099093,2025-04-25 00:39:45.686951,0 days 00:00:01.587858,True,squared_error,31,sqrt,5,5,800,TPESampler,COMPLETE
2068,0.3679933307734841,2025-04-25 00:39:45.871210,2025-04-25 00:40:15.412180,0 days 00:00:29.540970,True,absolute_error,50,,1,2,297,TPESampler,COMPLETE
2069,0.4810501709573489,2025-04-25 00:39:46.958670,2025-04-25 00:41:13.540935,0 days 00:01:26.582265,False,absolute_error,35,,2,14,899,TPESampler,COMPLETE
2070,0.5789330378516001,2025-04-25 00:40:10.095682,2025-04-25 00:40:12.344970,0 days 00:00:02.249288,True,squared_error,42,,9,2,584,TPESampler,COMPLETE
2071,0.37135773021303387,2025-04-25 00:40:12.527453,2025-04-25 00:40:34.566411,0 days 00:00:22.038958,True,absolute_error,43,,1,2,241,TPESampler,COMPLETE
2072,0.37404497148187793,2025-04-25 00:40:15.617397,2025-04-25 00:40:43.979184,0 days 00:00:28.361787,True,absolute_error,50,,1,4,316,TPESampler,COMPLETE
2073,0.4168424192058287,2025-04-25 00:40:34.756966,2025-04-25 00:40:36.552324,0 days 00:00:01.795358,True,squared_error,43,,2,2,264,TPESampler,COMPLETE
2074,0.37230771816998676,2025-04-25 00:40:36.736355,2025-04-25 00:40:46.526235,0 days 00:00:09.789880,True,absolute_error,50,,1,3,100,TPESampler,COMPLETE
2075,0.4150736889071182,2025-04-25 00:40:44.166132,2025-04-25 00:40:59.098331,0 days 00:00:14.932199,True,absolute_error,49,,2,2,233,TPESampler,COMPLETE
2076,0.49994607972784183,2025-04-25 00:40:46.726505,2025-04-25 00:41:06.105376,0 days 00:00:19.378871,True,absolute_error,45,,5,19,734,TPESampler,COMPLETE
2077,0.3678121541733018,2025-04-25 00:40:59.288760,2025-04-25 00:41:10.562671,0 days 00:00:11.273911,True,absolute_error,50,,1,2,118,TPESampler,COMPLETE
2078,0.36797799659864006,2025-04-25 00:41:06.292666,2025-04-25 00:41:26.387377,0 days 00:00:20.094711,True,absolute_error,50,,1,2,184,TPESampler,COMPLETE
2079,0.4207277885274291,2025-04-25 00:41:10.758295,2025-04-25 00:41:17.590080,0 days 00:00:06.831785,True,absolute_error,50,,2,2,102,TPESampler,COMPLETE
2080,0.36787406666516487,2025-04-25 00:41:13.735123,2025-04-25 00:41:44.233797,0 days 00:00:30.498674,True,absolute_error,50,,1,2,246,TPESampler,COMPLETE
2081,0.3812195390214358,2025-04-25 00:41:17.774075,2025-04-25 00:41:19.874178,0 days 00:00:02.100103,True,squared_error,50,,1,2,233,TPESampler,COMPLETE
2082,0.494781723341753,2025-04-25 00:41:20.052675,2025-04-25 00:41:30.256401,0 days 00:00:10.203726,True,absolute_error,35,,5,5,364,TPESampler,COMPLETE
2083,0.36898422224414956,2025-04-25 00:41:26.771956,2025-04-25 00:41:45.037114,0 days 00:00:18.265158,True,absolute_error,50,,1,2,136,TPESampler,COMPLETE
2084,0.36963308553511376,2025-04-25 00:41:30.449617,2025-04-25 00:42:04.599145,0 days 00:00:34.149528,True,absolute_error,50,,1,2,318,TPESampler,COMPLETE
2085,0.3679340531051386,2025-04-25 00:41:44.426283,2025-04-25 00:42:09.898604,0 days 00:00:25.472321,True,absolute_error,50,,1,2,275,TPESampler,COMPLETE
2086,0.37399508406551174,2025-04-25 00:41:45.230965,2025-04-25 00:42:09.276896,0 days 00:00:24.045931,True,absolute_error,50,,1,4,264,TPESampler,COMPLETE
2087,0.3768673888258068,2025-04-25 00:42:04.789562,2025-04-25 00:42:16.389109,0 days 00:00:11.599547,True,absolute_error,43,,1,4,122,TPESampler,COMPLETE
2088,0.3703198296980101,2025-04-25 00:42:09.703979,2025-04-25 00:42:30.434456,0 days 00:00:20.730477,True,absolute_error,50,,1,3,225,TPESampler,COMPLETE
2089,0.3782279511195405,2025-04-25 00:42:10.135836,2025-04-25 00:42:20.030008,0 days 00:00:09.894172,True,absolute_error,50,,1,4,100,TPESampler,COMPLETE
2090,0.41556450501125874,2025-04-25 00:42:16.577382,2025-04-25 00:42:27.144285,0 days 00:00:10.566903,True,absolute_error,50,,2,2,195,TPESampler,COMPLETE
2091,0.44166216046590767,2025-04-25 00:42:20.211562,2025-04-25 00:42:53.414967,0 days 00:00:33.203405,False,absolute_error,41,,1,2,215,TPESampler,COMPLETE
2092,0.5441746247651077,2025-04-25 00:42:27.373300,2025-04-25 00:42:29.148955,0 days 00:00:01.775655,True,squared_error,48,,4,47,360,TPESampler,COMPLETE
2093,0.4146764947479909,2025-04-25 00:42:29.330617,2025-04-25 00:42:40.934677,0 days 00:00:11.604060,True,absolute_error,50,,2,2,217,TPESampler,COMPLETE
2094,0.9641337506794244,2025-04-25 00:42:30.616710,2025-04-25 00:42:31.998125,0 days 00:00:01.381415,True,squared_error,28,log2,9,12,804,TPESampler,COMPLETE
2095,0.3756743082261877,2025-04-25 00:42:32.186824,2025-04-25 00:42:41.611755,0 days 00:00:09.424931,False,absolute_error,45,sqrt,1,2,279,TPESampler,COMPLETE
2096,0.36975178816921384,2025-04-25 00:42:41.125511,2025-04-25 00:42:57.253902,0 days 00:00:16.128391,True,absolute_error,42,,1,2,174,TPESampler,COMPLETE
2097,0.3711486943024764,2025-04-25 00:42:41.855100,2025-04-25 00:43:03.293207,0 days 00:00:21.438107,True,absolute_error,41,,1,3,233,TPESampler,COMPLETE
2098,0.36841522245972486,2025-04-25 00:42:53.794258,2025-04-25 00:43:05.222596,0 days 00:00:11.428338,True,absolute_error,50,,1,2,116,TPESampler,COMPLETE
2099,0.4414108046033134,2025-04-25 00:42:57.441930,2025-04-25 00:43:27.902233,0 days 00:00:30.460303,False,absolute_error,50,,1,2,196,TPESampler,COMPLETE
2100,0.3755284644004249,2025-04-25 00:43:03.483441,2025-04-25 00:43:13.085964,0 days 00:00:09.602523,True,absolute_error,44,,1,2,100,TPESampler,COMPLETE
2101,0.419989126575698,2025-04-25 00:43:05.405536,2025-04-25 00:43:10.966868,0 days 00:00:05.561332,True,absolute_error,43,,2,3,100,TPESampler,COMPLETE
2102,0.370960696461535,2025-04-25 00:43:11.154864,2025-04-25 00:43:24.267943,0 days 00:00:13.113079,True,absolute_error,50,,1,2,108,TPESampler,COMPLETE
2103,0.37148953059953227,2025-04-25 00:43:13.272685,2025-04-25 00:43:58.813353,0 days 00:00:45.540668,True,absolute_error,43,,1,2,410,TPESampler,COMPLETE
2104,0.9421313477488376,2025-04-25 00:43:24.455295,2025-04-25 00:43:25.526745,0 days 00:00:01.071450,True,squared_error,26,sqrt,15,37,439,TPESampler,COMPLETE
2105,0.3690163723857629,2025-04-25 00:43:25.714781,2025-04-25 00:44:21.282184,0 days 00:00:55.567403,True,absolute_error,50,,1,2,448,TPESampler,COMPLETE
2106,0.36986210689344956,2025-04-25 00:43:28.207483,2025-04-25 00:44:00.782684,0 days 00:00:32.575201,True,absolute_error,50,,1,3,231,TPESampler,COMPLETE
2107,0.803588250278598,2025-04-25 00:43:59.004545,2025-04-25 00:44:06.353379,0 days 00:00:07.348834,False,absolute_error,19,log2,2,42,791,TPESampler,COMPLETE
2108,0.4161630108464403,2025-04-25 00:44:00.972547,2025-04-25 00:44:17.592630,0 days 00:00:16.620083,True,absolute_error,50,,2,2,273,TPESampler,COMPLETE
2109,0.8251318183093256,2025-04-25 00:44:06.545807,2025-04-25 00:44:07.436389,0 days 00:00:00.890582,True,squared_error,6,sqrt,2,8,240,TPESampler,COMPLETE
2110,0.3712991305921461,2025-04-25 00:44:07.621464,2025-04-25 00:44:31.812047,0 days 00:00:24.190583,True,absolute_error,43,,1,2,240,TPESampler,COMPLETE
2111,0.41571445191973216,2025-04-25 00:44:17.785755,2025-04-25 00:44:32.372673,0 days 00:00:14.586918,True,absolute_error,50,,2,3,247,TPESampler,COMPLETE
2112,0.459573106613729,2025-04-25 00:44:21.460644,2025-04-25 00:44:27.346550,0 days 00:00:05.885906,True,absolute_error,50,log2,1,3,300,TPESampler,COMPLETE
2113,0.42022587059600114,2025-04-25 00:44:27.685364,2025-04-25 00:44:33.765043,0 days 00:00:06.079679,True,absolute_error,41,,2,2,105,TPESampler,COMPLETE
