number,value,datetime_start,datetime_complete,duration,params_bootstrap,params_criterion,params_max_depth,params_max_features,params_min_samples_leaf,params_min_samples_split,params_n_estimators,system_attrs_auto:sampler,state
1691,0.47524547842102405,2025-04-25 00:04:00.603898,2025-04-25 00:04:05.196820,0 days 00:00:04.592922,True,absolute_error,43,log2,1,2,298,TPESampler,COMPLETE
1692,0.37587334007348316,2025-04-25 00:04:05.382427,2025-04-25 00:04:14.897370,0 days 00:00:09.514943,True,absolute_error,42,,1,3,101,TPESampler,COMPLETE
1693,0.36931181698740995,2025-04-25 00:04:12.093888,2025-04-25 00:04:41.261900,0 days 00:00:29.168012,True,absolute_error,50,,1,3,256,TPESampler,COMPLETE
1694,0.3682859138915439,2025-04-25 00:04:15.085437,2025-04-25 00:04:44.515958,0 days 00:00:29.430521,True,absolute_error,50,,1,2,257,TPESampler,COMPLETE
1695,0.36841522245972486,2025-04-25 00:04:38.118173,2025-04-25 00:04:49.684970,0 days 00:00:11.566797,True,absolute_error,50,,1,2,116,TPESampler,COMPLETE
1696,0.36923458901947326,2025-04-25 00:04:41.463142,2025-04-25 00:05:15.529999,0 days 00:00:34.066857,True,absolute_error,42,,1,2,235,TPESampler,COMPLETE
1697,0.371183261181214,2025-04-25 00:04:44.696649,2025-04-25 00:05:46.774590,0 days 00:01:02.077941,True,absolute_error,44,,1,2,431,TPESampler,COMPLETE
1698,0.36902818469845056,2025-04-25 00:04:49.873185,2025-04-25 00:05:56.976078,0 days 00:01:07.102893,True,absolute_error,50,,1,2,438,TPESampler,COMPLETE
1699,0.37382810190752336,2025-04-25 00:05:15.721367,2025-04-25 00:05:47.738672,0 days 00:00:32.017305,True,absolute_error,43,,1,4,213,TPESampler,COMPLETE
1700,0.49825740979366845,2025-04-25 00:05:46.963820,2025-04-25 00:06:44.057566,0 days 00:00:57.093746,False,absolute_error,26,,2,9,575,TPESampler,COMPLETE
1701,0.5079208298229095,2025-04-25 00:05:47.921490,2025-04-25 00:06:17.683192,0 days 00:00:29.761702,False,absolute_error,21,,6,15,672,TPESampler,COMPLETE
1702,0.36838585934384965,2025-04-25 00:05:57.163403,2025-04-25 00:06:22.867090,0 days 00:00:25.703687,True,absolute_error,50,,1,2,270,TPESampler,COMPLETE
1703,0.8066855786011579,2025-04-25 00:06:17.889624,2025-04-25 00:06:21.478232,0 days 00:00:03.588608,False,absolute_error,12,sqrt,8,26,493,TPESampler,COMPLETE
1704,0.37161355044144423,2025-04-25 00:06:21.667439,2025-04-25 00:06:48.125021,0 days 00:00:26.457582,True,absolute_error,44,,1,2,248,TPESampler,COMPLETE
1705,0.423874319961213,2025-04-25 00:06:23.069188,2025-04-25 00:06:24.161207,0 days 00:00:01.092019,True,squared_error,47,,2,6,114,TPESampler,COMPLETE
1706,0.41677471219634243,2025-04-25 00:06:24.491081,2025-04-25 00:06:32.344945,0 days 00:00:07.853864,True,absolute_error,50,,2,2,133,TPESampler,COMPLETE
1707,0.37252182137706147,2025-04-25 00:06:32.553713,2025-04-25 00:06:45.482756,0 days 00:00:12.929043,True,absolute_error,43,,1,2,132,TPESampler,COMPLETE
1708,0.3782075652550687,2025-04-25 00:06:44.257772,2025-04-25 00:06:55.788036,0 days 00:00:11.530264,True,absolute_error,44,,1,4,110,TPESampler,COMPLETE
1709,0.37221515190352994,2025-04-25 00:06:45.741421,2025-04-25 00:06:56.777676,0 days 00:00:11.036255,True,absolute_error,50,,1,2,103,TPESampler,COMPLETE
1710,0.3749102743582797,2025-04-25 00:06:48.308023,2025-04-25 00:07:11.571336,0 days 00:00:23.263313,True,absolute_error,50,,1,4,242,TPESampler,COMPLETE
1711,0.9388665737998942,2025-04-25 00:06:55.975337,2025-04-25 00:06:57.761948,0 days 00:00:01.786611,True,absolute_error,43,log2,8,45,648,TPESampler,COMPLETE
1712,0.3706375318869919,2025-04-25 00:06:56.974665,2025-04-25 00:07:07.764540,0 days 00:00:10.789875,True,absolute_error,50,,1,3,112,TPESampler,COMPLETE
1713,0.4812127559594866,2025-04-25 00:06:57.957534,2025-04-25 00:08:16.603938,0 days 00:01:18.646404,True,absolute_error,35,,1,40,912,TPESampler,COMPLETE
1714,0.4154599821847978,2025-04-25 00:07:07.959743,2025-04-25 00:07:29.063752,0 days 00:00:21.104009,True,absolute_error,50,,2,3,317,TPESampler,COMPLETE
1715,0.417052020084314,2025-04-25 00:07:11.972918,2025-04-25 00:07:29.669484,0 days 00:00:17.696566,True,absolute_error,41,,2,2,258,TPESampler,COMPLETE
1716,0.4169758941163489,2025-04-25 00:07:29.252728,2025-04-25 00:07:31.077471,0 days 00:00:01.824743,True,squared_error,50,,2,3,212,TPESampler,COMPLETE
1717,0.3714165485724563,2025-04-25 00:07:29.886915,2025-04-25 00:07:50.855752,0 days 00:00:20.968837,True,absolute_error,42,,1,3,229,TPESampler,COMPLETE
1718,0.36864494334305536,2025-04-25 00:07:31.265364,2025-04-25 00:07:55.202039,0 days 00:00:23.936675,True,absolute_error,50,,1,2,260,TPESampler,COMPLETE
1719,0.9577595619033044,2025-04-25 00:07:51.188701,2025-04-25 00:07:53.095601,0 days 00:00:01.906900,True,squared_error,46,log2,6,19,147,TPESampler,COMPLETE
1720,0.36988362430216254,2025-04-25 00:07:53.321131,2025-04-25 00:08:18.366311,0 days 00:00:25.045180,True,absolute_error,42,,1,2,241,TPESampler,COMPLETE
1721,0.4093852721490139,2025-04-25 00:07:55.504287,2025-04-25 00:08:00.596580,0 days 00:00:05.092293,True,absolute_error,50,sqrt,1,3,228,TPESampler,COMPLETE
1722,0.4162422491673935,2025-04-25 00:08:00.809321,2025-04-25 00:08:17.688778,0 days 00:00:16.879457,True,absolute_error,50,,2,2,275,TPESampler,COMPLETE
1723,0.8294473311692182,2025-04-25 00:08:16.797793,2025-04-25 00:08:17.922395,0 days 00:00:01.124602,True,absolute_error,50,log2,2,6,124,TPESampler,COMPLETE
1724,0.3694159322868665,2025-04-25 00:08:17.877553,2025-04-25 00:08:39.119101,0 days 00:00:21.241548,True,absolute_error,42,,1,2,228,TPESampler,COMPLETE
1725,0.36984043873428984,2025-04-25 00:08:18.206311,2025-04-25 00:08:40.171068,0 days 00:00:21.964757,True,absolute_error,50,,1,3,235,TPESampler,COMPLETE
1726,0.37079301935746106,2025-04-25 00:08:18.669010,2025-04-25 00:08:28.261165,0 days 00:00:09.592155,True,absolute_error,50,,1,2,100,TPESampler,COMPLETE
1727,0.7726864833110894,2025-04-25 00:08:28.444255,2025-04-25 00:08:35.715024,0 days 00:00:07.270769,False,absolute_error,30,log2,2,5,751,TPESampler,COMPLETE
1728,0.5580278085609957,2025-04-25 00:08:35.914399,2025-04-25 00:08:38.431463,0 days 00:00:02.517064,True,squared_error,10,,7,2,662,TPESampler,COMPLETE
1729,0.36805126885575884,2025-04-25 00:08:38.612593,2025-04-25 00:09:00.513800,0 days 00:00:21.901207,True,absolute_error,50,,1,2,226,TPESampler,COMPLETE
1730,0.4155250468509975,2025-04-25 00:08:39.396524,2025-04-25 00:08:54.867900,0 days 00:00:15.471376,True,absolute_error,50,,2,2,254,TPESampler,COMPLETE
1731,0.3750229433373595,2025-04-25 00:08:40.360155,2025-04-25 00:09:03.166447,0 days 00:00:22.806292,True,absolute_error,50,,1,4,227,TPESampler,COMPLETE
1732,0.37344680981040623,2025-04-25 00:08:55.057450,2025-04-25 00:09:04.944163,0 days 00:00:09.886713,True,absolute_error,50,,1,3,103,TPESampler,COMPLETE
1733,0.42117304451673676,2025-04-25 00:09:00.704540,2025-04-25 00:09:06.641240,0 days 00:00:05.936700,True,absolute_error,42,,2,2,103,TPESampler,COMPLETE
1734,0.9415130034879415,2025-04-25 00:09:03.356853,2025-04-25 00:09:04.275893,0 days 00:00:00.919040,False,squared_error,15,log2,6,6,459,TPESampler,COMPLETE
1735,0.36825440742794374,2025-04-25 00:09:04.455001,2025-04-25 00:09:22.445567,0 days 00:00:17.990566,True,absolute_error,50,,1,2,191,TPESampler,COMPLETE
1736,0.36921894793337856,2025-04-25 00:09:05.196695,2025-04-25 00:09:26.236408,0 days 00:00:21.039713,True,absolute_error,42,,1,2,226,TPESampler,COMPLETE
1737,0.37359842292559503,2025-04-25 00:09:06.826533,2025-04-25 00:09:17.667378,0 days 00:00:10.840845,True,absolute_error,43,,1,2,114,TPESampler,COMPLETE
1738,0.3683178669624408,2025-04-25 00:09:17.858055,2025-04-25 00:09:43.575622,0 days 00:00:25.717567,True,absolute_error,50,,1,2,277,TPESampler,COMPLETE
1739,0.36844891030230154,2025-04-25 00:09:22.640197,2025-04-25 00:10:04.795634,0 days 00:00:42.155437,True,absolute_error,50,,1,2,423,TPESampler,COMPLETE
1740,0.3750222684781188,2025-04-25 00:09:26.442717,2025-04-25 00:09:36.816548,0 days 00:00:10.373831,True,absolute_error,43,,1,2,109,TPESampler,COMPLETE
1741,0.3679782471480686,2025-04-25 00:09:37.005542,2025-04-25 00:10:06.763636,0 days 00:00:29.758094,True,absolute_error,50,,1,2,274,TPESampler,COMPLETE
1742,0.38256181832369734,2025-04-25 00:09:43.765109,2025-04-25 00:09:45.923873,0 days 00:00:02.158764,True,squared_error,38,,1,2,238,TPESampler,COMPLETE
1743,0.7696842850237173,2025-04-25 00:09:46.117894,2025-04-25 00:09:53.184340,0 days 00:00:07.066446,False,absolute_error,25,sqrt,7,8,881,TPESampler,COMPLETE
1744,0.36872500871055197,2025-04-25 00:09:53.392306,2025-04-25 00:10:08.851677,0 days 00:00:15.459371,True,absolute_error,50,,1,2,140,TPESampler,COMPLETE
1745,0.3872491291105286,2025-04-25 00:10:04.981660,2025-04-25 00:10:29.136023,0 days 00:00:24.154363,True,absolute_error,34,,1,10,260,TPESampler,COMPLETE
1746,0.4154785530944353,2025-04-25 00:10:06.946141,2025-04-25 00:10:15.204092,0 days 00:00:08.257951,True,absolute_error,50,,2,2,150,TPESampler,COMPLETE
1747,0.41645836808117787,2025-04-25 00:10:09.040249,2025-04-25 00:10:37.726008,0 days 00:00:28.685759,True,absolute_error,50,,2,6,517,TPESampler,COMPLETE
1748,0.36820802444579886,2025-04-25 00:10:15.387716,2025-04-25 00:10:44.055195,0 days 00:00:28.667479,True,absolute_error,50,,1,2,303,TPESampler,COMPLETE
1749,0.36831535233414536,2025-04-25 00:10:29.322731,2025-04-25 00:10:54.681018,0 days 00:00:25.358287,True,absolute_error,50,,1,2,247,TPESampler,COMPLETE
1750,0.5703027369133128,2025-04-25 00:10:37.920401,2025-04-25 00:10:42.538440,0 days 00:00:04.618039,False,absolute_error,45,sqrt,3,2,285,TPESampler,COMPLETE
1751,0.4145063903710026,2025-04-25 00:10:42.727085,2025-04-25 00:10:53.921840,0 days 00:00:11.194755,True,absolute_error,42,,2,4,205,TPESampler,COMPLETE
1752,0.37199411482981165,2025-04-25 00:10:44.236861,2025-04-25 00:10:55.619191,0 days 00:00:11.382330,True,absolute_error,41,,1,2,114,TPESampler,COMPLETE
1753,0.37345319717593695,2025-04-25 00:10:54.106641,2025-04-25 00:11:26.308031,0 days 00:00:32.201390,True,absolute_error,42,,1,4,330,TPESampler,COMPLETE
1754,0.37455766506323207,2025-04-25 00:10:54.952739,2025-04-25 00:11:06.847369,0 days 00:00:11.894630,True,absolute_error,43,,1,2,124,TPESampler,COMPLETE
1755,0.36812491576164313,2025-04-25 00:10:55.800755,2025-04-25 00:11:16.747735,0 days 00:00:20.946980,True,absolute_error,50,,1,2,227,TPESampler,COMPLETE
1756,0.44293546784784826,2025-04-25 00:11:07.045878,2025-04-25 00:12:02.010782,0 days 00:00:54.964904,False,absolute_error,35,,1,2,360,TPESampler,COMPLETE
1757,0.4150116669664989,2025-04-25 00:11:16.936331,2025-04-25 00:11:41.501450,0 days 00:00:24.565119,True,absolute_error,41,,2,2,368,TPESampler,COMPLETE
1758,0.5206975124965292,2025-04-25 00:11:26.499544,2025-04-25 00:11:44.803426,0 days 00:00:18.303882,True,absolute_error,29,sqrt,1,26,959,TPESampler,COMPLETE
1759,0.3685148658866311,2025-04-25 00:11:41.687090,2025-04-25 00:12:05.800886,0 days 00:00:24.113796,True,absolute_error,50,,1,2,243,TPESampler,COMPLETE
1760,0.5687452921518699,2025-04-25 00:11:45.000311,2025-04-25 00:11:46.785974,0 days 00:00:01.785663,True,absolute_error,49,sqrt,2,2,120,TPESampler,COMPLETE
1761,0.37232844036683144,2025-04-25 00:11:46.974057,2025-04-25 00:12:18.716391,0 days 00:00:31.742334,True,absolute_error,43,,1,2,321,TPESampler,COMPLETE
1762,0.6568682070328004,2025-04-25 00:12:02.239732,2025-04-25 00:12:06.359920,0 days 00:00:04.120188,False,squared_error,25,,11,16,982,TPESampler,COMPLETE
1763,0.41796055724859865,2025-04-25 00:12:05.990883,2025-04-25 00:12:13.146985,0 days 00:00:07.156102,True,absolute_error,50,,2,3,128,TPESampler,COMPLETE
1764,0.5085530684475832,2025-04-25 00:12:06.547146,2025-04-25 00:12:07.928644,0 days 00:00:01.381498,False,squared_error,45,,2,50,187,TPESampler,COMPLETE
1765,0.37135576860415637,2025-04-25 00:12:08.123292,2025-04-25 00:12:18.403226,0 days 00:00:10.279934,True,absolute_error,50,,1,2,101,TPESampler,COMPLETE
1766,0.37784054991505356,2025-04-25 00:12:13.337639,2025-04-25 00:12:23.599873,0 days 00:00:10.262234,True,absolute_error,43,,1,4,108,TPESampler,COMPLETE
1767,0.36835760854057814,2025-04-25 00:12:18.591699,2025-04-25 00:12:41.161229,0 days 00:00:22.569530,True,absolute_error,50,,1,2,245,TPESampler,COMPLETE
1768,0.38222017942206327,2025-04-25 00:12:18.955096,2025-04-25 00:12:21.216862,0 days 00:00:02.261766,True,squared_error,48,,1,4,298,TPESampler,COMPLETE
1769,0.4786541482968768,2025-04-25 00:12:21.401360,2025-04-25 00:12:24.862560,0 days 00:00:03.461200,True,absolute_error,48,log2,1,4,218,TPESampler,COMPLETE
1770,0.3741715081730347,2025-04-25 00:12:23.784181,2025-04-25 00:13:11.464434,0 days 00:00:47.680253,True,absolute_error,40,,1,2,385,TPESampler,COMPLETE
1771,0.36903866334108765,2025-04-25 00:12:25.167840,2025-04-25 00:12:36.570640,0 days 00:00:11.402800,True,absolute_error,50,,1,2,120,TPESampler,COMPLETE
1772,0.3750337110148484,2025-04-25 00:12:36.756998,2025-04-25 00:13:08.811909,0 days 00:00:32.054911,True,absolute_error,50,,1,4,226,TPESampler,COMPLETE
1773,0.4144282522092182,2025-04-25 00:12:41.346880,2025-04-25 00:13:03.392974,0 days 00:00:22.046094,True,absolute_error,42,,2,2,297,TPESampler,COMPLETE
1774,0.8964818749220294,2025-04-25 00:13:03.582382,2025-04-25 00:13:06.604593,0 days 00:00:03.022211,True,absolute_error,46,log2,3,2,784,TPESampler,COMPLETE
1775,0.5390328713735992,2025-04-25 00:13:06.779832,2025-04-25 00:13:24.401378,0 days 00:00:17.621546,False,absolute_error,37,sqrt,2,17,855,TPESampler,COMPLETE
1776,0.37537469121545586,2025-04-25 00:13:09.008268,2025-04-25 00:13:18.901607,0 days 00:00:09.893339,True,absolute_error,42,,1,3,100,TPESampler,COMPLETE
1777,0.9188969842585554,2025-04-25 00:13:11.780556,2025-04-25 00:13:13.850123,0 days 00:00:02.069567,True,absolute_error,13,log2,4,27,697,TPESampler,COMPLETE
1778,0.37836925706782243,2025-04-25 00:13:14.033916,2025-04-25 00:13:26.676098,0 days 00:00:12.642182,True,absolute_error,50,,1,4,125,TPESampler,COMPLETE
1779,0.41505738516300955,2025-04-25 00:13:19.086483,2025-04-25 00:13:19.975243,0 days 00:00:00.888760,True,squared_error,38,sqrt,1,2,104,TPESampler,COMPLETE
1780,0.36882949889873357,2025-04-25 00:13:20.161985,2025-04-25 00:13:49.967880,0 days 00:00:29.805895,True,absolute_error,42,,1,2,309,TPESampler,COMPLETE
1781,0.41819615465990867,2025-04-25 00:13:24.732212,2025-04-25 00:13:32.090285,0 days 00:00:07.358073,True,absolute_error,50,,2,2,126,TPESampler,COMPLETE
1782,0.9587567444673726,2025-04-25 00:13:26.857855,2025-04-25 00:13:28.284609,0 days 00:00:01.426754,True,squared_error,45,log2,7,31,858,TPESampler,COMPLETE
1783,0.3704292549753544,2025-04-25 00:13:28.462671,2025-04-25 00:13:56.097198,0 days 00:00:27.634527,True,absolute_error,43,,1,3,284,TPESampler,COMPLETE
1784,0.42904572222942394,2025-04-25 00:13:32.273624,2025-04-25 00:13:35.921566,0 days 00:00:03.647942,False,squared_error,49,,1,20,597,TPESampler,COMPLETE
1785,0.44505668185331293,2025-04-25 00:13:36.105682,2025-04-25 00:13:38.778638,0 days 00:00:02.672956,True,squared_error,48,,2,19,593,TPESampler,COMPLETE
1786,0.41645214581715395,2025-04-25 00:13:38.965621,2025-04-25 00:13:52.066512,0 days 00:00:13.100891,True,absolute_error,50,,2,4,242,TPESampler,COMPLETE
1787,0.5880656332747497,2025-04-25 00:13:50.145710,2025-04-25 00:13:52.309854,0 days 00:00:02.164144,True,squared_error,48,,10,7,560,TPESampler,COMPLETE
1788,0.5756173801712279,2025-04-25 00:13:52.248223,2025-04-25 00:13:55.496649,0 days 00:00:03.248426,False,absolute_error,15,sqrt,1,3,122,TPESampler,COMPLETE
1789,0.36803771844451905,2025-04-25 00:13:52.536370,2025-04-25 00:14:17.719816,0 days 00:00:25.183446,True,absolute_error,50,,1,2,273,TPESampler,COMPLETE
1790,0.372068439234401,2025-04-25 00:13:55.678112,2025-04-25 00:14:06.220308,0 days 00:00:10.542196,True,absolute_error,42,,1,2,111,TPESampler,COMPLETE
1791,0.36868963385822673,2025-04-25 00:13:56.327904,2025-04-25 00:14:12.901504,0 days 00:00:16.573600,True,absolute_error,50,,1,2,178,TPESampler,COMPLETE
1792,0.8391471658653766,2025-04-25 00:14:06.401307,2025-04-25 00:14:07.636587,0 days 00:00:01.235280,True,absolute_error,36,log2,2,6,172,TPESampler,COMPLETE
1793,0.37052525110967244,2025-04-25 00:14:07.817636,2025-04-25 00:14:34.994901,0 days 00:00:27.177265,True,absolute_error,42,,1,3,282,TPESampler,COMPLETE
1794,0.4154303257334211,2025-04-25 00:14:13.092763,2025-04-25 00:14:29.855985,0 days 00:00:16.763222,True,absolute_error,50,,2,2,320,TPESampler,COMPLETE
1795,0.37135576860415637,2025-04-25 00:14:17.905316,2025-04-25 00:14:27.469594,0 days 00:00:09.564278,True,absolute_error,50,,1,2,101,TPESampler,COMPLETE
1796,0.5651553039384571,2025-04-25 00:14:27.657953,2025-04-25 00:14:29.918035,0 days 00:00:02.260082,True,squared_error,6,,1,9,602,TPESampler,COMPLETE
1797,0.37066812992770104,2025-04-25 00:14:30.002039,2025-04-25 00:14:52.784761,0 days 00:00:22.782722,True,absolute_error,43,,1,2,238,TPESampler,COMPLETE
1798,0.37330968724818,2025-04-25 00:14:30.104716,2025-04-25 00:14:56.782667,0 days 00:00:26.677951,True,absolute_error,43,,1,4,270,TPESampler,COMPLETE
1799,0.37245250364481614,2025-04-25 00:14:35.178147,2025-04-25 00:14:45.008952,0 days 00:00:09.830805,True,absolute_error,50,,1,3,104,TPESampler,COMPLETE
1800,0.41645214581715395,2025-04-25 00:14:45.189334,2025-04-25 00:14:58.631287,0 days 00:00:13.441953,True,absolute_error,50,,2,2,242,TPESampler,COMPLETE
1801,0.5047420948556571,2025-04-25 00:14:52.965695,2025-04-25 00:14:54.729647,0 days 00:00:01.763952,True,squared_error,36,sqrt,1,44,761,TPESampler,COMPLETE
1802,0.3681933247803877,2025-04-25 00:14:54.914700,2025-04-25 00:15:18.673172,0 days 00:00:23.758472,True,absolute_error,50,,1,2,232,TPESampler,COMPLETE
1803,0.44224884182847957,2025-04-25 00:14:56.967814,2025-04-25 00:15:34.112665,0 days 00:00:37.144851,False,absolute_error,50,,1,2,241,TPESampler,COMPLETE
1804,0.3689090486705741,2025-04-25 00:14:58.812089,2025-04-25 00:15:23.389969,0 days 00:00:24.577880,True,absolute_error,50,,1,2,241,TPESampler,COMPLETE
1805,0.8565970026323018,2025-04-25 00:15:18.853883,2025-04-25 00:15:21.795250,0 days 00:00:02.941367,False,absolute_error,7,log2,1,22,270,TPESampler,COMPLETE
1806,0.3691537571046749,2025-04-25 00:15:21.976789,2025-04-25 00:15:52.308259,0 days 00:00:30.331470,True,absolute_error,50,,1,3,298,TPESampler,COMPLETE
1807,0.38175572861035767,2025-04-25 00:15:23.580015,2025-04-25 00:15:25.375279,0 days 00:00:01.795264,True,squared_error,50,,1,2,179,TPESampler,COMPLETE
1808,0.3715680032653066,2025-04-25 00:15:25.551793,2025-04-25 00:15:48.336207,0 days 00:00:22.784414,True,absolute_error,43,,1,2,217,TPESampler,COMPLETE
1809,0.9623105714880292,2025-04-25 00:15:34.297108,2025-04-25 00:15:35.625646,0 days 00:00:01.328538,True,squared_error,7,log2,8,8,718,TPESampler,COMPLETE
1810,0.4971718277992547,2025-04-25 00:15:35.810609,2025-04-25 00:15:39.223075,0 days 00:00:03.412466,True,absolute_error,41,log2,1,3,224,TPESampler,COMPLETE
1811,0.4167395491959733,2025-04-25 00:15:39.411026,2025-04-25 00:15:46.518259,0 days 00:00:07.107233,True,absolute_error,50,,2,2,131,TPESampler,COMPLETE
1812,0.4181397158296412,2025-04-25 00:15:46.697139,2025-04-25 00:15:54.437737,0 days 00:00:07.740598,True,absolute_error,40,,2,3,126,TPESampler,COMPLETE
1813,0.8605529045092203,2025-04-25 00:15:48.525305,2025-04-25 00:15:50.471908,0 days 00:00:01.946603,False,absolute_error,13,sqrt,12,4,402,TPESampler,COMPLETE
1814,0.4316667226711848,2025-04-25 00:15:50.658073,2025-04-25 00:15:53.242728,0 days 00:00:02.584655,True,absolute_error,42,sqrt,1,3,108,TPESampler,COMPLETE
1815,0.3746137746279769,2025-04-25 00:15:52.489402,2025-04-25 00:16:11.043678,0 days 00:00:18.554276,True,absolute_error,50,,1,4,189,TPESampler,COMPLETE
1816,0.8769747890845885,2025-04-25 00:15:53.426190,2025-04-25 00:15:54.863241,0 days 00:00:01.437051,True,squared_error,7,log2,1,36,671,TPESampler,COMPLETE
1817,0.3715210364161625,2025-04-25 00:15:54.634606,2025-04-25 00:16:40.594870,0 days 00:00:45.960264,True,absolute_error,50,,1,3,399,TPESampler,COMPLETE
1818,0.8304421200585773,2025-04-25 00:15:55.081941,2025-04-25 00:15:59.072025,0 days 00:00:03.990084,True,absolute_error,31,log2,2,2,620,TPESampler,COMPLETE
1819,0.36767225953044724,2025-04-25 00:15:59.483607,2025-04-25 00:16:17.192740,0 days 00:00:17.709133,True,absolute_error,50,,1,2,189,TPESampler,COMPLETE
1820,0.3695745704317422,2025-04-25 00:16:11.478693,2025-04-25 00:16:52.569528,0 days 00:00:41.090835,True,absolute_error,50,,1,2,411,TPESampler,COMPLETE
1821,0.3688565899596876,2025-04-25 00:16:17.372037,2025-04-25 00:16:44.250600,0 days 00:00:26.878563,True,absolute_error,50,,1,2,196,TPESampler,COMPLETE
1822,0.3707673888169398,2025-04-25 00:16:40.779262,2025-04-25 00:17:05.897257,0 days 00:00:25.117995,True,absolute_error,42,,1,3,238,TPESampler,COMPLETE
1823,0.37384082871249996,2025-04-25 00:16:44.456290,2025-04-25 00:17:00.165880,0 days 00:00:15.709590,True,absolute_error,50,,1,4,146,TPESampler,COMPLETE
1824,0.8778218315509169,2025-04-25 00:16:52.763364,2025-04-25 00:16:56.266749,0 days 00:00:03.503385,False,absolute_error,31,sqrt,15,19,957,TPESampler,COMPLETE
1825,0.36831535233414536,2025-04-25 00:16:56.450593,2025-04-25 00:17:19.226830,0 days 00:00:22.776237,True,absolute_error,50,,1,2,247,TPESampler,COMPLETE
1826,0.4002964437413766,2025-04-25 00:17:00.345896,2025-04-25 00:17:05.219743,0 days 00:00:04.873847,True,absolute_error,45,sqrt,1,2,237,TPESampler,COMPLETE
1827,0.37037706000363246,2025-04-25 00:17:05.400354,2025-04-25 00:17:42.472109,0 days 00:00:37.071755,True,absolute_error,42,,1,2,346,TPESampler,COMPLETE
1828,0.4150652254670294,2025-04-25 00:17:06.200855,2025-04-25 00:17:19.455253,0 days 00:00:13.254398,True,absolute_error,43,,2,2,226,TPESampler,COMPLETE
1829,0.372349792518792,2025-04-25 00:17:19.408206,2025-04-25 00:17:44.607484,0 days 00:00:25.199278,True,absolute_error,44,,1,2,219,TPESampler,COMPLETE
1830,0.41437855549562586,2025-04-25 00:17:19.698393,2025-04-25 00:17:35.368317,0 days 00:00:15.669924,True,absolute_error,43,,2,2,216,TPESampler,COMPLETE
1831,0.367675852509013,2025-04-25 00:17:35.556564,2025-04-25 00:18:03.837350,0 days 00:00:28.280786,True,absolute_error,50,,1,2,291,TPESampler,COMPLETE
