number,value,datetime_start,datetime_complete,duration,params_bootstrap,params_criterion,params_max_depth,params_max_features,params_min_samples_leaf,params_min_samples_split,params_n_estimators,system_attrs_auto:sampler,state
422,0.3740180233524129,2025-04-24 22:11:09.308954,2025-04-24 22:11:21.503406,0 days 00:00:12.194452,True,absolute_error,43,,1,2,129,TPESampler,COMPLETE
423,0.868670834499461,2025-04-24 22:11:10.781554,2025-04-24 22:11:11.645639,0 days 00:00:00.864085,False,squared_error,7,log2,1,9,434,TPESampler,COMPLETE
424,0.41521112086205525,2025-04-24 22:11:11.816865,2025-04-24 22:11:28.690842,0 days 00:00:16.873977,True,absolute_error,50,,2,2,309,TPESampler,COMPLETE
425,0.36987362558358755,2025-04-24 22:11:21.222605,2025-04-24 22:11:52.388086,0 days 00:00:31.165481,True,absolute_error,50,,1,2,335,TPESampler,COMPLETE
426,0.40694391183023787,2025-04-24 22:11:21.702021,2025-04-24 22:11:24.482001,0 days 00:00:02.779980,True,squared_error,24,,1,2,363,TPESampler,COMPLETE
427,0.4802448424721338,2025-04-24 22:11:24.658869,2025-04-24 22:11:27.940010,0 days 00:00:03.281141,False,squared_error,27,,1,42,653,TPESampler,COMPLETE
428,0.3677242985665114,2025-04-24 22:11:28.109023,2025-04-24 22:11:45.668852,0 days 00:00:17.559829,True,absolute_error,50,,1,2,188,TPESampler,COMPLETE
429,0.3676257529517241,2025-04-24 22:11:29.035953,2025-04-24 22:11:44.924122,0 days 00:00:15.888169,True,absolute_error,50,,1,2,171,TPESampler,COMPLETE
430,0.41758690746543664,2025-04-24 22:11:45.097089,2025-04-24 22:11:51.566443,0 days 00:00:06.469354,True,absolute_error,48,,2,4,114,TPESampler,COMPLETE
431,0.4550014246377057,2025-04-24 22:11:45.881970,2025-04-24 22:11:48.328931,0 days 00:00:02.446961,True,absolute_error,48,log2,1,2,144,TPESampler,COMPLETE
432,0.3714933111990124,2025-04-24 22:11:48.492061,2025-04-24 22:11:58.651797,0 days 00:00:10.159736,True,absolute_error,49,,1,2,107,TPESampler,COMPLETE
433,0.41937181335672835,2025-04-24 22:11:51.754930,2025-04-24 22:11:57.769857,0 days 00:00:06.014927,True,absolute_error,50,,2,2,108,TPESampler,COMPLETE
434,0.36770817716883314,2025-04-24 22:11:52.560273,2025-04-24 22:12:18.739884,0 days 00:00:26.179611,True,absolute_error,49,,1,2,208,TPESampler,COMPLETE
435,0.42954424017505466,2025-04-24 22:11:57.945225,2025-04-24 22:11:59.734634,0 days 00:00:01.789409,False,squared_error,50,log2,1,2,350,TPESampler,COMPLETE
436,0.36887944331693284,2025-04-24 22:11:58.820080,2025-04-24 22:12:19.629020,0 days 00:00:20.808940,True,absolute_error,50,,1,2,194,TPESampler,COMPLETE
437,0.3747693089589227,2025-04-24 22:11:59.905616,2025-04-24 22:12:20.920351,0 days 00:00:21.014735,True,absolute_error,48,,1,4,181,TPESampler,COMPLETE
438,0.8292631169995145,2025-04-24 22:12:18.925677,2025-04-24 22:12:20.405019,0 days 00:00:01.479342,False,squared_error,5,sqrt,4,28,814,TPESampler,COMPLETE
439,0.5316874960443417,2025-04-24 22:12:19.831071,2025-04-24 22:12:21.500949,0 days 00:00:01.669878,False,squared_error,49,sqrt,2,3,412,TPESampler,COMPLETE
440,0.3681797343305437,2025-04-24 22:12:20.720224,2025-04-24 22:12:43.246772,0 days 00:00:22.526548,True,absolute_error,50,,1,2,236,TPESampler,COMPLETE
441,0.8733460646284774,2025-04-24 22:12:21.107099,2025-04-24 22:12:22.530205,0 days 00:00:01.423106,False,absolute_error,49,sqrt,13,5,243,TPESampler,COMPLETE
442,0.5744960393294678,2025-04-24 22:12:21.763781,2025-04-24 22:12:26.794237,0 days 00:00:05.030456,True,absolute_error,35,sqrt,2,2,445,TPESampler,COMPLETE
443,0.3689563502142743,2025-04-24 22:12:22.735308,2025-04-24 22:12:47.649043,0 days 00:00:24.913735,True,absolute_error,50,,1,2,263,TPESampler,COMPLETE
444,0.3683635387495613,2025-04-24 22:12:26.982566,2025-04-24 22:12:47.598684,0 days 00:00:20.616118,True,absolute_error,50,,1,2,219,TPESampler,COMPLETE
445,0.37088503333356654,2025-04-24 22:12:43.526929,2025-04-24 22:12:54.467196,0 days 00:00:10.940267,True,absolute_error,50,,1,3,111,TPESampler,COMPLETE
446,0.3698646791916843,2025-04-24 22:12:47.843278,2025-04-24 22:13:19.069051,0 days 00:00:31.225773,True,absolute_error,50,,1,2,316,TPESampler,COMPLETE
447,0.3685575541982627,2025-04-24 22:12:47.913882,2025-04-24 22:13:16.118632,0 days 00:00:28.204750,True,absolute_error,50,,1,2,280,TPESampler,COMPLETE
448,0.6791172137656653,2025-04-24 22:12:54.654537,2025-04-24 22:12:56.844293,0 days 00:00:02.189756,False,squared_error,5,,3,33,506,TPESampler,COMPLETE
449,0.37137932036009375,2025-04-24 22:12:57.014372,2025-04-24 22:13:10.559733,0 days 00:00:13.545361,True,absolute_error,41,,1,2,143,TPESampler,COMPLETE
450,0.5746552016628268,2025-04-24 22:13:10.742256,2025-04-24 22:13:11.490927,0 days 00:00:00.748671,True,squared_error,50,sqrt,2,4,126,TPESampler,COMPLETE
451,0.8496196111858124,2025-04-24 22:13:11.660206,2025-04-24 22:13:15.471688,0 days 00:00:03.811482,False,absolute_error,7,sqrt,10,4,715,TPESampler,COMPLETE
452,0.36982680506436044,2025-04-24 22:13:15.643013,2025-04-24 22:13:53.005341,0 days 00:00:37.362328,True,absolute_error,50,,1,3,309,TPESampler,COMPLETE
453,0.615853694637055,2025-04-24 22:13:16.403064,2025-04-24 22:13:18.548587,0 days 00:00:02.145523,True,squared_error,15,,15,40,638,TPESampler,COMPLETE
454,0.45931910799356634,2025-04-24 22:13:18.712137,2025-04-24 22:15:36.779645,0 days 00:02:18.067508,False,absolute_error,28,,1,10,944,TPESampler,COMPLETE
455,0.41174003103846707,2025-04-24 22:13:19.506634,2025-04-24 22:13:54.638594,0 days 00:00:35.131960,True,absolute_error,50,,2,2,522,TPESampler,COMPLETE
456,0.5242492820917145,2025-04-24 22:13:53.181893,2025-04-24 22:13:56.952462,0 days 00:00:03.770569,True,squared_error,12,,5,2,968,TPESampler,COMPLETE
457,0.36959915105391766,2025-04-24 22:13:54.804833,2025-04-24 22:14:05.282531,0 days 00:00:10.477698,True,absolute_error,50,,1,2,110,TPESampler,COMPLETE
458,0.38635935323390036,2025-04-24 22:13:57.116257,2025-04-24 22:13:58.906053,0 days 00:00:01.789796,True,squared_error,49,,1,5,241,TPESampler,COMPLETE
459,0.634639386360189,2025-04-24 22:13:59.079419,2025-04-24 22:14:00.277469,0 days 00:00:01.198050,False,squared_error,41,,10,8,180,TPESampler,COMPLETE
460,0.3754272172190108,2025-04-24 22:14:00.442258,2025-04-24 22:14:25.910396,0 days 00:00:25.468138,True,absolute_error,50,,1,4,225,TPESampler,COMPLETE
461,0.3675685311640558,2025-04-24 22:14:05.540558,2025-04-24 22:14:29.555668,0 days 00:00:24.015110,True,absolute_error,50,,1,2,208,TPESampler,COMPLETE
462,0.41655603822254506,2025-04-24 22:14:26.090760,2025-04-24 22:14:43.776581,0 days 00:00:17.685821,True,absolute_error,40,,2,2,269,TPESampler,COMPLETE
463,0.37123627064604414,2025-04-24 22:14:29.725208,2025-04-24 22:15:07.171355,0 days 00:00:37.446147,True,absolute_error,50,,1,2,373,TPESampler,COMPLETE
464,0.3688565899596876,2025-04-24 22:14:43.954641,2025-04-24 22:15:01.939447,0 days 00:00:17.984806,True,absolute_error,50,,1,2,196,TPESampler,COMPLETE
465,0.4163010128602814,2025-04-24 22:15:02.110688,2025-04-24 22:15:15.329717,0 days 00:00:13.219029,True,absolute_error,50,,2,2,256,TPESampler,COMPLETE
466,0.569527649811085,2025-04-24 22:15:07.359218,2025-04-24 22:15:10.860371,0 days 00:00:03.501153,True,absolute_error,44,sqrt,2,2,316,TPESampler,COMPLETE
467,0.3761477672602988,2025-04-24 22:15:11.035853,2025-04-24 22:15:22.088501,0 days 00:00:11.052648,True,absolute_error,38,,1,4,118,TPESampler,COMPLETE
468,0.3859793480279961,2025-04-24 22:15:15.507564,2025-04-24 22:15:18.249720,0 days 00:00:02.742156,True,squared_error,46,,1,2,334,TPESampler,COMPLETE
469,0.37066236778182043,2025-04-24 22:15:18.430347,2025-04-24 22:15:41.437305,0 days 00:00:23.006958,True,absolute_error,49,,1,3,228,TPESampler,COMPLETE
470,0.3708768973215656,2025-04-24 22:15:22.268239,2025-04-24 22:15:45.930696,0 days 00:00:23.662457,True,absolute_error,41,,1,2,214,TPESampler,COMPLETE
471,0.3708569257553879,2025-04-24 22:15:36.953806,2025-04-24 22:16:01.347704,0 days 00:00:24.393898,True,absolute_error,43,,1,2,229,TPESampler,COMPLETE
472,0.936321047382703,2025-04-24 22:15:41.612669,2025-04-24 22:15:43.143933,0 days 00:00:01.531264,True,squared_error,15,sqrt,14,9,977,TPESampler,COMPLETE
473,0.9505128755895513,2025-04-24 22:15:43.315636,2025-04-24 22:15:44.878270,0 days 00:00:01.562634,True,absolute_error,46,log2,15,2,805,TPESampler,COMPLETE
474,0.37215946259913074,2025-04-24 22:15:45.046782,2025-04-24 22:16:20.683455,0 days 00:00:35.636673,True,absolute_error,42,,1,2,370,TPESampler,COMPLETE
475,0.9647894171156035,2025-04-24 22:15:46.106496,2025-04-24 22:15:47.634353,0 days 00:00:01.527857,True,squared_error,22,log2,10,2,966,TPESampler,COMPLETE
476,0.37010987398695194,2025-04-24 22:15:47.831367,2025-04-24 22:16:21.185306,0 days 00:00:33.353939,True,absolute_error,50,,1,2,360,TPESampler,COMPLETE
477,0.3686186917823344,2025-04-24 22:16:01.643667,2025-04-24 22:16:22.668171,0 days 00:00:21.024504,True,absolute_error,49,,1,2,226,TPESampler,COMPLETE
478,0.3717467679836885,2025-04-24 22:16:20.875041,2025-04-24 22:16:48.012428,0 days 00:00:27.137387,True,absolute_error,50,,1,4,294,TPESampler,COMPLETE
479,0.9020084230134966,2025-04-24 22:16:21.402333,2025-04-24 22:16:22.453920,0 days 00:00:01.051587,True,absolute_error,47,log2,3,9,191,TPESampler,COMPLETE
480,0.4169363291445061,2025-04-24 22:16:22.624383,2025-04-24 22:16:36.264006,0 days 00:00:13.639623,True,absolute_error,49,,2,2,260,TPESampler,COMPLETE
481,0.5223705800563574,2025-04-24 22:16:22.869094,2025-04-24 22:16:25.113589,0 days 00:00:02.244495,False,squared_error,14,,2,2,309,TPESampler,COMPLETE
482,0.6650656699421623,2025-04-24 22:16:25.279270,2025-04-24 22:16:32.979057,0 days 00:00:07.699787,False,absolute_error,24,sqrt,4,3,760,TPESampler,COMPLETE
483,0.8178666758430229,2025-04-24 22:16:33.155257,2025-04-24 22:16:34.918428,0 days 00:00:01.763171,True,absolute_error,6,sqrt,3,14,305,TPESampler,COMPLETE
484,0.36802773726078775,2025-04-24 22:16:35.080608,2025-04-24 22:16:55.523040,0 days 00:00:20.442432,True,absolute_error,50,,1,2,210,TPESampler,COMPLETE
485,0.9508154354196233,2025-04-24 22:16:36.447834,2025-04-24 22:16:37.166603,0 days 00:00:00.718769,False,squared_error,20,log2,7,21,257,TPESampler,COMPLETE
486,0.7654922881500152,2025-04-24 22:16:37.358790,2025-04-24 22:16:42.059924,0 days 00:00:04.701134,False,absolute_error,29,log2,2,2,457,TPESampler,COMPLETE
487,0.3683036712253051,2025-04-24 22:16:42.226475,2025-04-24 22:17:01.528223,0 days 00:00:19.301748,True,absolute_error,50,,1,2,200,TPESampler,COMPLETE
488,0.46137696540423717,2025-04-24 22:16:48.206795,2025-04-24 22:16:52.759773,0 days 00:00:04.552978,True,absolute_error,49,log2,1,3,293,TPESampler,COMPLETE
489,0.9437769350642045,2025-04-24 22:16:52.939928,2025-04-24 22:16:53.648162,0 days 00:00:00.708234,False,squared_error,9,log2,6,4,198,TPESampler,COMPLETE
490,0.4113401235438689,2025-04-24 22:16:53.826644,2025-04-24 22:16:57.843604,0 days 00:00:04.016960,True,absolute_error,50,sqrt,1,4,192,TPESampler,COMPLETE
491,0.3705771130254511,2025-04-24 22:16:55.700341,2025-04-24 22:17:06.306863,0 days 00:00:10.606522,True,absolute_error,50,,1,2,109,TPESampler,COMPLETE
492,0.7371858543232429,2025-04-24 22:16:58.019345,2025-04-24 22:17:05.069869,0 days 00:00:07.050524,False,absolute_error,17,log2,1,20,481,TPESampler,COMPLETE
493,0.4791895097639558,2025-04-24 22:17:01.701740,2025-04-24 22:17:13.244978,0 days 00:00:11.543238,False,absolute_error,47,,2,3,118,TPESampler,COMPLETE
494,0.9393620978949496,2025-04-24 22:17:05.240562,2025-04-24 22:17:06.979713,0 days 00:00:01.739151,False,absolute_error,32,log2,10,4,700,TPESampler,COMPLETE
495,0.3734531018866197,2025-04-24 22:17:06.489342,2025-04-24 22:17:31.640645,0 days 00:00:25.151303,True,absolute_error,42,,1,4,272,TPESampler,COMPLETE
496,0.8362939867391116,2025-04-24 22:17:07.218879,2025-04-24 22:17:09.324577,0 days 00:00:02.105698,True,absolute_error,32,log2,2,40,395,TPESampler,COMPLETE
497,0.4158196845599253,2025-04-24 22:17:09.575398,2025-04-24 22:17:19.016909,0 days 00:00:09.441511,True,absolute_error,42,,2,2,174,TPESampler,COMPLETE
498,0.41514472102211925,2025-04-24 22:17:13.424713,2025-04-24 22:17:21.778427,0 days 00:00:08.353714,True,absolute_error,50,,2,4,151,TPESampler,COMPLETE
499,0.44703094700403373,2025-04-24 22:17:19.190072,2025-04-24 22:18:17.852854,0 days 00:00:58.662782,False,absolute_error,39,,1,5,388,TPESampler,COMPLETE
500,0.37432725841051545,2025-04-24 22:17:21.949021,2025-04-24 22:17:34.735910,0 days 00:00:12.786889,True,absolute_error,40,,1,2,137,TPESampler,COMPLETE
501,0.3710329515689946,2025-04-24 22:17:31.874604,2025-04-24 22:18:09.249529,0 days 00:00:37.374925,True,absolute_error,50,,1,2,374,TPESampler,COMPLETE
502,0.5745372270930095,2025-04-24 22:17:34.920462,2025-04-24 22:17:52.579252,0 days 00:00:17.658790,True,absolute_error,6,,5,29,734,TPESampler,COMPLETE
503,0.37438958897744795,2025-04-24 22:17:52.905111,2025-04-24 22:18:02.618939,0 days 00:00:09.713828,True,absolute_error,42,,1,2,102,TPESampler,COMPLETE
504,0.4154546419020714,2025-04-24 22:18:02.792910,2025-04-24 22:18:13.050863,0 days 00:00:10.257953,True,absolute_error,50,,2,2,180,TPESampler,COMPLETE
505,0.6309995038867452,2025-04-24 22:18:09.421355,2025-04-24 22:18:28.566152,0 days 00:00:19.144797,False,absolute_error,20,,15,3,934,TPESampler,COMPLETE
506,0.36842915010517735,2025-04-24 22:18:13.246066,2025-04-24 22:18:39.880649,0 days 00:00:26.634583,True,absolute_error,50,,1,2,272,TPESampler,COMPLETE
507,0.3698519544466533,2025-04-24 22:18:18.027715,2025-04-24 22:18:39.652763,0 days 00:00:21.625048,True,absolute_error,50,,1,3,226,TPESampler,COMPLETE
508,0.4205947797060894,2025-04-24 22:18:28.744071,2025-04-24 22:18:40.014978,0 days 00:00:11.270907,False,absolute_error,48,sqrt,1,11,327,TPESampler,COMPLETE
509,0.36821529053790913,2025-04-24 22:18:39.837638,2025-04-24 22:18:58.312326,0 days 00:00:18.474688,True,absolute_error,50,,1,2,199,TPESampler,COMPLETE
510,0.37109463530721487,2025-04-24 22:18:40.112965,2025-04-24 22:19:05.114462,0 days 00:00:25.001497,True,absolute_error,43,,1,2,269,TPESampler,COMPLETE
511,0.37656893367287353,2025-04-24 22:18:40.282773,2025-04-24 22:18:50.734484,0 days 00:00:10.451711,True,absolute_error,45,,1,4,107,TPESampler,COMPLETE
512,0.436256869849846,2025-04-24 22:18:50.912915,2025-04-24 22:19:30.314702,0 days 00:00:39.401787,False,absolute_error,49,,1,2,253,TPESampler,COMPLETE
513,0.8432000514327702,2025-04-24 22:18:58.499695,2025-04-24 22:18:59.289726,0 days 00:00:00.790031,True,squared_error,48,log2,2,2,135,TPESampler,COMPLETE
514,0.37334505175033345,2025-04-24 22:18:59.462475,2025-04-24 22:19:23.948157,0 days 00:00:24.485682,True,absolute_error,42,,1,4,270,TPESampler,COMPLETE
515,0.8972020558521456,2025-04-24 22:19:05.282891,2025-04-24 22:19:06.333773,0 days 00:00:01.050882,True,squared_error,7,log2,2,2,368,TPESampler,COMPLETE
516,0.36715840508816305,2025-04-24 22:19:06.503925,2025-04-24 22:19:20.519536,0 days 00:00:14.015611,True,absolute_error,50,,1,2,151,TPESampler,COMPLETE
517,0.9613112573026873,2025-04-24 22:19:20.691832,2025-04-24 22:19:22.025989,0 days 00:00:01.334157,False,squared_error,29,log2,11,13,915,TPESampler,COMPLETE
518,0.6442173598868582,2025-04-24 22:19:22.196664,2025-04-24 22:19:23.118432,0 days 00:00:00.921768,False,squared_error,22,log2,1,3,252,TPESampler,COMPLETE
519,0.370960696461535,2025-04-24 22:19:23.291235,2025-04-24 22:19:33.607005,0 days 00:00:10.315770,True,absolute_error,50,,1,2,108,TPESampler,COMPLETE
520,0.5735429923843388,2025-04-24 22:19:24.126165,2025-04-24 22:19:38.171390,0 days 00:00:14.045225,False,absolute_error,42,log2,1,35,642,TPESampler,COMPLETE
521,0.37125867418526587,2025-04-24 22:19:30.488512,2025-04-24 22:19:41.946551,0 days 00:00:11.458039,True,absolute_error,50,,1,2,106,TPESampler,COMPLETE
522,0.3682859138915439,2025-04-24 22:19:33.781824,2025-04-24 22:20:00.736463,0 days 00:00:26.954639,True,absolute_error,50,,1,2,257,TPESampler,COMPLETE
523,0.3999595391065942,2025-04-24 22:19:38.352121,2025-04-24 22:19:44.834121,0 days 00:00:06.482000,True,absolute_error,45,sqrt,1,2,308,TPESampler,COMPLETE
524,0.47390320642658473,2025-04-24 22:19:42.108329,2025-04-24 22:19:43.515025,0 days 00:00:01.406696,False,squared_error,36,sqrt,1,18,536,TPESampler,COMPLETE
525,0.4164406313200127,2025-04-24 22:19:43.685877,2025-04-24 22:19:59.393103,0 days 00:00:15.707226,True,absolute_error,50,,2,4,268,TPESampler,COMPLETE
526,0.833775669861369,2025-04-24 22:19:45.000585,2025-04-24 22:19:50.487048,0 days 00:00:05.486463,True,absolute_error,29,log2,2,2,982,TPESampler,COMPLETE
527,0.3770033103303229,2025-04-24 22:19:50.672269,2025-04-24 22:20:01.187448,0 days 00:00:10.515179,True,absolute_error,50,,1,4,111,TPESampler,COMPLETE
528,0.8488511740863068,2025-04-24 22:19:59.569650,2025-04-24 22:20:04.328845,0 days 00:00:04.759195,True,absolute_error,16,log2,2,32,909,TPESampler,COMPLETE
529,0.41438501724976057,2025-04-24 22:20:00.920429,2025-04-24 22:20:20.849689,0 days 00:00:19.929260,True,absolute_error,49,,2,2,382,TPESampler,COMPLETE
530,0.7195788868637331,2025-04-24 22:20:01.358892,2025-04-24 22:20:02.431208,0 days 00:00:01.072316,False,squared_error,47,sqrt,5,27,405,TPESampler,COMPLETE
531,0.415541901991553,2025-04-24 22:20:02.602477,2025-04-24 22:20:14.323155,0 days 00:00:11.720678,True,absolute_error,50,,2,2,219,TPESampler,COMPLETE
532,0.3684066957362781,2025-04-24 22:20:04.501616,2025-04-24 22:20:26.429175,0 days 00:00:21.927559,True,absolute_error,50,,1,2,237,TPESampler,COMPLETE
533,0.36743302524744326,2025-04-24 22:20:14.503708,2025-04-24 22:20:27.950275,0 days 00:00:13.446567,True,absolute_error,50,,1,2,143,TPESampler,COMPLETE
534,0.41758690746543664,2025-04-24 22:20:21.020782,2025-04-24 22:20:27.338899,0 days 00:00:06.318117,True,absolute_error,45,,2,2,114,TPESampler,COMPLETE
535,0.4440934416461079,2025-04-24 22:20:26.604679,2025-04-24 22:20:30.725196,0 days 00:00:04.120517,True,absolute_error,50,log2,1,2,253,TPESampler,COMPLETE
536,0.6648161259670193,2025-04-24 22:20:27.511228,2025-04-24 22:20:28.790096,0 days 00:00:01.278868,True,absolute_error,49,sqrt,3,3,102,TPESampler,COMPLETE
537,0.36962113554824827,2025-04-24 22:20:28.185721,2025-04-24 22:20:40.547890,0 days 00:00:12.362169,True,absolute_error,50,,1,2,129,TPESampler,COMPLETE
538,0.3684781282106818,2025-04-24 22:20:28.957335,2025-04-24 22:20:41.529712,0 days 00:00:12.572377,True,absolute_error,50,,1,2,132,TPESampler,COMPLETE
539,0.37101000410328777,2025-04-24 22:20:30.901587,2025-04-24 22:20:41.903218,0 days 00:00:11.001631,True,absolute_error,45,,1,2,115,TPESampler,COMPLETE
540,0.3748387488670726,2025-04-24 22:20:40.720462,2025-04-24 22:21:03.573377,0 days 00:00:22.852915,True,absolute_error,50,,1,4,237,TPESampler,COMPLETE
541,0.3830139577485754,2025-04-24 22:20:41.700394,2025-04-24 22:20:43.763891,0 days 00:00:02.063497,True,squared_error,50,,1,2,217,TPESampler,COMPLETE
542,0.3682489249740574,2025-04-24 22:20:42.130571,2025-04-24 22:20:54.885103,0 days 00:00:12.754532,True,absolute_error,50,,1,2,133,TPESampler,COMPLETE
543,0.37455766506323207,2025-04-24 22:20:43.947993,2025-04-24 22:20:55.717725,0 days 00:00:11.769732,True,absolute_error,43,,1,2,124,TPESampler,COMPLETE
544,0.3695071968416499,2025-04-24 22:20:55.083547,2025-04-24 22:21:13.984990,0 days 00:00:18.901443,True,absolute_error,50,,1,3,189,TPESampler,COMPLETE
545,0.3684499985746386,2025-04-24 22:20:55.895158,2025-04-24 22:21:19.565113,0 days 00:00:23.669955,True,absolute_error,50,,1,2,234,TPESampler,COMPLETE
546,0.41634390397810445,2025-04-24 22:21:03.761318,2025-04-24 22:21:05.127670,0 days 00:00:01.366352,True,squared_error,41,,2,2,181,TPESampler,COMPLETE
547,0.5165202394449798,2025-04-24 22:21:05.340385,2025-04-24 22:21:15.335124,0 days 00:00:09.994739,False,absolute_error,40,,7,18,271,TPESampler,COMPLETE
548,0.36756246439513407,2025-04-24 22:21:14.154042,2025-04-24 22:21:42.528020,0 days 00:00:28.373978,True,absolute_error,50,,1,2,250,TPESampler,COMPLETE
549,0.9310147498891519,2025-04-24 22:21:15.516145,2025-04-24 22:21:16.536501,0 days 00:00:01.020356,False,absolute_error,50,log2,8,14,121,TPESampler,COMPLETE
550,0.41796055724859865,2025-04-24 22:21:16.734667,2025-04-24 22:21:26.107202,0 days 00:00:09.372535,True,absolute_error,46,,2,2,128,TPESampler,COMPLETE
551,0.7708827201684946,2025-04-24 22:21:19.735151,2025-04-24 22:21:29.546568,0 days 00:00:09.811417,False,absolute_error,36,log2,2,2,870,TPESampler,COMPLETE
552,0.36669946248498847,2025-04-24 22:21:26.282064,2025-04-24 22:21:43.417978,0 days 00:00:17.135914,True,absolute_error,50,,1,2,159,TPESampler,COMPLETE
553,0.4220746740026882,2025-04-24 22:21:29.762788,2025-04-24 22:21:39.289342,0 days 00:00:09.526554,False,absolute_error,50,log2,1,3,309,TPESampler,COMPLETE
554,0.940113772165985,2025-04-24 22:21:39.460305,2025-04-24 22:21:40.681711,0 days 00:00:01.221406,True,absolute_error,9,log2,9,2,421,TPESampler,COMPLETE
555,0.5964324141320484,2025-04-24 22:21:40.855094,2025-04-24 22:21:47.742254,0 days 00:00:06.887160,True,absolute_error,35,,12,2,597,TPESampler,COMPLETE
556,0.36857208795829477,2025-04-24 22:21:42.717840,2025-04-24 22:22:04.671041,0 days 00:00:21.953201,True,absolute_error,50,,1,2,222,TPESampler,COMPLETE
557,0.376459259118558,2025-04-24 22:21:43.590425,2025-04-24 22:21:54.700872,0 days 00:00:11.110447,True,absolute_error,42,,1,4,113,TPESampler,COMPLETE
558,0.37219660870918025,2025-04-24 22:21:47.910577,2025-04-24 22:22:01.884375,0 days 00:00:13.973798,True,absolute_error,42,,1,2,136,TPESampler,COMPLETE
559,0.36962113554824827,2025-04-24 22:21:54.884525,2025-04-24 22:22:08.270049,0 days 00:00:13.385524,True,absolute_error,50,,1,2,129,TPESampler,COMPLETE
560,0.8252742845507947,2025-04-24 22:22:02.082691,2025-04-24 22:22:03.110622,0 days 00:00:01.027931,True,absolute_error,47,log2,2,2,108,TPESampler,COMPLETE
561,0.41640939332372284,2025-04-24 22:22:03.309691,2025-04-24 22:22:10.095160,0 days 00:00:06.785469,True,absolute_error,48,,2,3,122,TPESampler,COMPLETE
562,0.37471398590330535,2025-04-24 22:22:04.838239,2025-04-24 22:22:23.824119,0 days 00:00:18.985880,True,absolute_error,50,,1,4,151,TPESampler,COMPLETE
