number,value,datetime_start,datetime_complete,duration,params_bootstrap,params_criterion,params_max_depth,params_max_features,params_min_samples_leaf,params_min_samples_split,params_n_estimators,system_attrs_auto:sampler,state
4948,0.3525941404253956,2025-04-24 22:24:23.092075,2025-04-24 22:24:26.548033,0 days 00:00:03.455958,True,squared_error,50,,1,5,531,TPESampler,COMPLETE
4949,0.34183001566377036,2025-04-24 22:24:23.273691,2025-04-24 22:24:26.574447,0 days 00:00:03.300756,True,squared_error,50,,1,3,467,TPESampler,COMPLETE
4950,0.34478899869200264,2025-04-24 22:24:26.752144,2025-04-24 22:24:30.875028,0 days 00:00:04.122884,True,squared_error,41,,1,2,522,TPESampler,COMPLETE
4951,0.34601232725212144,2025-04-24 22:24:26.798564,2025-04-24 22:24:30.811701,0 days 00:00:04.013137,True,squared_error,50,,1,4,542,TPESampler,COMPLETE
4952,0.4297818480979409,2025-04-24 22:24:31.003188,2025-04-24 22:24:33.782973,0 days 00:00:02.779785,True,squared_error,43,,2,3,320,TPESampler,COMPLETE
4953,0.4278508631265167,2025-04-24 22:24:31.013409,2025-04-24 22:24:33.918537,0 days 00:00:02.905128,True,squared_error,36,,2,4,295,TPESampler,COMPLETE
4954,0.49216778554617235,2025-04-24 22:24:31.334025,2025-04-24 22:24:35.935738,0 days 00:00:04.601713,False,squared_error,39,,5,2,732,TPESampler,COMPLETE
4955,0.4296534190212524,2025-04-24 22:24:34.016586,2025-04-24 22:24:37.427174,0 days 00:00:03.410588,True,squared_error,45,,2,4,433,TPESampler,COMPLETE
4956,0.42764494087521754,2025-04-24 22:24:34.203098,2025-04-24 22:24:37.827826,0 days 00:00:03.624728,True,squared_error,50,,2,2,548,TPESampler,COMPLETE
4957,0.34332044051431826,2025-04-24 22:24:36.190329,2025-04-24 22:24:39.996653,0 days 00:00:03.806324,True,squared_error,43,,1,2,424,TPESampler,COMPLETE
4958,0.3459525844155616,2025-04-24 22:24:37.683883,2025-04-24 22:24:41.288623,0 days 00:00:03.604740,True,squared_error,50,,1,4,457,TPESampler,COMPLETE
4959,0.4024239156826274,2025-04-24 22:24:38.232557,2025-04-24 22:24:41.374795,0 days 00:00:03.142238,True,squared_error,46,,1,12,471,TPESampler,COMPLETE
4960,0.4509397643519035,2025-04-24 22:24:40.246637,2025-04-24 22:24:42.681039,0 days 00:00:02.434402,True,squared_error,50,,2,10,297,TPESampler,COMPLETE
4961,0.3684744006998024,2025-04-24 22:24:41.525793,2025-04-24 22:24:45.197216,0 days 00:00:03.671423,True,squared_error,50,,1,7,428,TPESampler,COMPLETE
4962,0.3480399100672152,2025-04-24 22:24:41.715620,2025-04-24 22:24:45.223807,0 days 00:00:03.508187,True,squared_error,37,,1,4,409,TPESampler,COMPLETE
4963,0.3472205932921117,2025-04-24 22:24:43.018347,2025-04-24 22:24:46.844345,0 days 00:00:03.825998,True,squared_error,42,,1,4,531,TPESampler,COMPLETE
4964,0.35432828614021245,2025-04-24 22:24:45.527535,2025-04-24 22:24:49.528144,0 days 00:00:04.000609,True,squared_error,43,,1,5,461,TPESampler,COMPLETE
4965,0.43294888524752945,2025-04-24 22:24:45.571822,2025-04-24 22:24:48.597400,0 days 00:00:03.025578,True,squared_error,50,,2,5,324,TPESampler,COMPLETE
4966,0.3408494890436299,2025-04-24 22:24:47.175254,2025-04-24 22:24:51.509964,0 days 00:00:04.334710,True,squared_error,50,,1,3,594,TPESampler,COMPLETE
4967,0.3453979841420257,2025-04-24 22:24:48.859716,2025-04-24 22:25:19.336637,0 days 00:00:30.476921,True,absolute_error,50,,1,3,531,TPESampler,COMPLETE
4968,0.3416454801115358,2025-04-24 22:24:49.994625,2025-04-24 22:24:53.897588,0 days 00:00:03.902963,True,squared_error,50,,1,3,568,TPESampler,COMPLETE
4969,0.7864506755795304,2025-04-24 22:24:51.765378,2025-04-24 22:24:52.954733,0 days 00:00:01.189355,True,squared_error,6,sqrt,1,2,170,TPESampler,COMPLETE
4970,0.42749431079533123,2025-04-24 22:24:53.242323,2025-04-24 22:24:56.706968,0 days 00:00:03.464645,True,squared_error,50,,2,3,592,TPESampler,COMPLETE
4971,0.4248787658963175,2025-04-24 22:24:54.483863,2025-04-24 22:24:56.555255,0 days 00:00:02.071392,True,squared_error,50,log2,1,3,665,TPESampler,COMPLETE
4972,0.3440061782363799,2025-04-24 22:24:56.806754,2025-04-24 22:25:00.755771,0 days 00:00:03.949017,True,squared_error,43,,1,2,511,TPESampler,COMPLETE
4973,0.6659203966350488,2025-04-24 22:24:56.985766,2025-04-24 22:25:01.765792,0 days 00:00:04.780026,True,absolute_error,36,sqrt,2,46,927,TPESampler,COMPLETE
4974,0.9209626458498756,2025-04-24 22:25:01.014531,2025-04-24 22:25:02.593801,0 days 00:00:01.579270,True,squared_error,41,sqrt,15,4,421,TPESampler,COMPLETE
4975,0.4275435566108375,2025-04-24 22:25:02.155325,2025-04-24 22:25:05.191437,0 days 00:00:03.036112,True,squared_error,50,,2,4,512,TPESampler,COMPLETE
4976,0.3436353106849082,2025-04-24 22:25:02.977891,2025-04-24 22:25:06.990216,0 days 00:00:04.012325,True,squared_error,50,,1,2,575,TPESampler,COMPLETE
4977,0.42799486796796327,2025-04-24 22:25:05.449775,2025-04-24 22:25:08.890309,0 days 00:00:03.440534,True,squared_error,34,,2,3,611,TPESampler,COMPLETE
4978,0.3479824525463855,2025-04-24 22:25:07.246703,2025-04-24 22:25:10.178495,0 days 00:00:02.931792,True,squared_error,42,,1,4,399,TPESampler,COMPLETE
4979,0.4276846617938499,2025-04-24 22:25:09.149312,2025-04-24 22:25:12.332895,0 days 00:00:03.183583,True,squared_error,42,,2,2,608,TPESampler,COMPLETE
4980,0.43005664629148255,2025-04-24 22:25:10.435843,2025-04-24 22:25:12.541946,0 days 00:00:02.106103,True,squared_error,44,,2,2,395,TPESampler,COMPLETE
4981,0.34859635006130574,2025-04-24 22:25:12.589728,2025-04-24 22:25:16.051511,0 days 00:00:03.461783,True,squared_error,36,,1,4,506,TPESampler,COMPLETE
4982,0.4283738718822618,2025-04-24 22:25:12.882613,2025-04-24 22:25:16.482505,0 days 00:00:03.599892,True,squared_error,50,,2,4,639,TPESampler,COMPLETE
4983,0.34490763674901004,2025-04-24 22:25:16.344986,2025-04-24 22:25:21.505549,0 days 00:00:05.160563,True,squared_error,43,,1,2,690,TPESampler,COMPLETE
4984,0.3421653128472011,2025-04-24 22:25:16.922047,2025-04-24 22:25:19.549268,0 days 00:00:02.627221,True,squared_error,43,,1,3,375,TPESampler,COMPLETE
4985,0.34221820374957973,2025-04-24 22:25:19.618218,2025-04-24 22:25:23.354953,0 days 00:00:03.736735,True,squared_error,44,,1,3,456,TPESampler,COMPLETE
4986,0.34156738888531657,2025-04-24 22:25:19.961480,2025-04-24 22:25:24.431455,0 days 00:00:04.469975,True,squared_error,50,,1,3,570,TPESampler,COMPLETE
4987,0.3409540567591623,2025-04-24 22:25:21.809985,2025-04-24 22:25:25.319666,0 days 00:00:03.509681,True,squared_error,50,,1,3,443,TPESampler,COMPLETE
4988,0.8051361989613635,2025-04-24 22:25:23.616054,2025-04-24 22:25:27.765014,0 days 00:00:04.148960,True,absolute_error,12,log2,1,49,990,TPESampler,COMPLETE
4989,0.3836805580874426,2025-04-24 22:25:25.329782,2025-04-24 22:25:26.975200,0 days 00:00:01.645418,True,squared_error,42,sqrt,1,3,470,TPESampler,COMPLETE
