number,value,datetime_start,datetime_complete,duration,params_bootstrap,params_criterion,params_max_depth,params_max_features,params_min_samples_leaf,params_min_samples_split,params_n_estimators,system_attrs_auto:sampler,state
2121,0.34086365564542775,2025-04-24 21:44:18.059962,2025-04-24 21:44:21.003006,0 days 00:00:02.943044,True,squared_error,50,,1,3,449,TPESampler,COMPLETE
2122,0.42808407984721797,2025-04-24 21:44:18.508644,2025-04-24 21:44:20.976931,0 days 00:00:02.468287,True,squared_error,50,,2,3,501,TPESampler,COMPLETE
2123,0.34065308339660877,2025-04-24 21:44:20.282573,2025-04-24 21:44:24.317849,0 days 00:00:04.035276,True,squared_error,50,,1,3,597,TPESampler,COMPLETE
2124,0.8802540890160074,2025-04-24 21:44:20.922912,2025-04-24 21:44:22.726876,0 days 00:00:01.803964,True,squared_error,31,log2,2,9,713,TPESampler,COMPLETE
2125,0.34499226141944583,2025-04-24 21:44:21.123584,2025-04-24 21:44:23.760599,0 days 00:00:02.637015,True,squared_error,41,,1,2,365,TPESampler,COMPLETE
2126,0.34291727773421926,2025-04-24 21:44:21.176612,2025-04-24 21:44:24.320584,0 days 00:00:03.143972,True,squared_error,50,,1,2,443,TPESampler,COMPLETE
2127,0.8785956035597663,2025-04-24 21:44:22.924729,2025-04-24 21:44:26.448748,0 days 00:00:03.524019,False,absolute_error,15,log2,2,11,959,TPESampler,COMPLETE
2128,0.3789206656936325,2025-04-24 21:44:23.976123,2025-04-24 21:44:25.778959,0 days 00:00:01.802836,True,squared_error,46,sqrt,1,4,413,TPESampler,COMPLETE
2129,0.4270945010388828,2025-04-24 21:44:24.611857,2025-04-24 21:44:27.486515,0 days 00:00:02.874658,True,squared_error,50,log2,1,2,659,TPESampler,COMPLETE
2130,0.34173014955965375,2025-04-24 21:44:24.587879,2025-04-24 21:44:27.774296,0 days 00:00:03.186417,True,squared_error,50,,1,3,464,TPESampler,COMPLETE
2131,0.4325551710268788,2025-04-24 21:44:24.894883,2025-04-24 21:44:27.598105,0 days 00:00:02.703222,True,squared_error,42,,2,5,380,TPESampler,COMPLETE
2132,0.34648939355031777,2025-04-24 21:44:26.050660,2025-04-24 21:44:28.549903,0 days 00:00:02.499243,True,squared_error,43,,1,4,423,TPESampler,COMPLETE
2133,0.34290957535997263,2025-04-24 21:44:26.707609,2025-04-24 21:44:29.996736,0 days 00:00:03.289127,True,squared_error,50,,1,2,422,TPESampler,COMPLETE
2134,0.4295741346924413,2025-04-24 21:44:27.682839,2025-04-24 21:44:30.652008,0 days 00:00:02.969169,True,squared_error,50,,2,2,457,TPESampler,COMPLETE
2135,0.3532771980803828,2025-04-24 21:44:27.843500,2025-04-24 21:44:31.838219,0 days 00:00:03.994719,True,squared_error,50,,1,5,514,TPESampler,COMPLETE
2136,0.49137047926059746,2025-04-24 21:44:28.055210,2025-04-24 21:45:12.260626,0 days 00:00:44.205416,False,absolute_error,49,,2,46,983,TPESampler,COMPLETE
2137,0.4555356242567169,2025-04-24 21:44:29.191493,2025-04-24 21:44:30.172336,0 days 00:00:00.980843,True,squared_error,5,,1,6,191,TPESampler,COMPLETE
2138,0.34338801685575127,2025-04-24 21:44:30.217177,2025-04-24 21:44:35.138761,0 days 00:00:04.921584,True,squared_error,42,,1,3,791,TPESampler,COMPLETE
2139,0.3434788317404318,2025-04-24 21:44:30.390385,2025-04-24 21:44:34.110190,0 days 00:00:03.719805,True,squared_error,42,,1,3,688,TPESampler,COMPLETE
2140,0.3525215463521598,2025-04-24 21:44:30.888776,2025-04-24 21:44:34.824888,0 days 00:00:03.936112,True,squared_error,50,,1,5,528,TPESampler,COMPLETE
2141,0.59453680565086,2025-04-24 21:44:32.057594,2025-04-24 21:44:33.145191,0 days 00:00:01.087597,True,squared_error,27,log2,1,3,166,TPESampler,COMPLETE
2142,0.34283883811140564,2025-04-24 21:44:33.361556,2025-04-24 21:44:37.156680,0 days 00:00:03.795124,True,squared_error,43,,1,2,541,TPESampler,COMPLETE
2143,0.9857981912521977,2025-04-24 21:44:34.317900,2025-04-24 21:44:35.553806,0 days 00:00:01.235906,True,absolute_error,31,log2,9,4,513,TPESampler,COMPLETE
2144,0.42964588078470667,2025-04-24 21:44:35.091654,2025-04-24 21:44:37.758789,0 days 00:00:02.667135,True,squared_error,32,,2,4,458,TPESampler,COMPLETE
2145,0.3468884090439642,2025-04-24 21:44:35.396297,2025-04-24 21:44:39.094434,0 days 00:00:03.698137,True,squared_error,42,,1,4,539,TPESampler,COMPLETE
2146,0.5973860464567959,2025-04-24 21:44:35.846597,2025-04-24 21:44:53.577568,0 days 00:00:17.730971,False,absolute_error,24,,3,7,550,TPESampler,COMPLETE
2147,0.3459525844155616,2025-04-24 21:44:37.373076,2025-04-24 21:44:40.570391,0 days 00:00:03.197315,True,squared_error,50,,1,4,457,TPESampler,COMPLETE
2148,0.3433951859986348,2025-04-24 21:44:37.976318,2025-04-24 21:44:41.200682,0 days 00:00:03.224364,True,squared_error,43,,1,2,427,TPESampler,COMPLETE
2149,0.34694337807627307,2025-04-24 21:44:39.298992,2025-04-24 21:44:42.725787,0 days 00:00:03.426795,True,squared_error,50,,1,4,516,TPESampler,COMPLETE
2150,0.8317453283111736,2025-04-24 21:44:40.777031,2025-04-24 21:44:41.940201,0 days 00:00:01.163170,False,absolute_error,20,sqrt,5,3,128,TPESampler,COMPLETE
2151,0.42390052387899735,2025-04-24 21:44:41.424819,2025-04-24 21:44:44.666334,0 days 00:00:03.241515,False,squared_error,50,,1,6,384,TPESampler,COMPLETE
2152,0.39582395348039406,2025-04-24 21:44:41.904111,2025-04-24 21:44:45.709748,0 days 00:00:03.805637,False,squared_error,49,,1,7,657,TPESampler,COMPLETE
2153,0.4296541988638129,2025-04-24 21:44:42.161057,2025-04-24 21:44:47.041608,0 days 00:00:04.880551,False,squared_error,50,,1,3,612,TPESampler,COMPLETE
2154,0.3775577453840004,2025-04-24 21:44:42.947015,2025-04-24 21:44:44.751010,0 days 00:00:01.803995,True,squared_error,45,sqrt,1,3,555,TPESampler,COMPLETE
2155,0.4302723032902915,2025-04-24 21:44:44.845501,2025-04-24 21:44:47.120016,0 days 00:00:02.274515,True,squared_error,43,,2,3,394,TPESampler,COMPLETE
2156,0.3442059552248396,2025-04-24 21:44:44.983544,2025-04-24 21:44:48.945374,0 days 00:00:03.961830,True,squared_error,50,,1,2,482,TPESampler,COMPLETE
2157,0.3435761312955889,2025-04-24 21:44:46.062393,2025-04-24 21:44:50.416693,0 days 00:00:04.354300,True,squared_error,50,,1,2,861,TPESampler,COMPLETE
2158,0.3432847058935031,2025-04-24 21:44:47.230796,2025-04-24 21:44:51.725403,0 days 00:00:04.494607,True,squared_error,42,,1,3,703,TPESampler,COMPLETE
2159,0.3446193922173134,2025-04-24 21:44:47.365581,2025-04-24 21:44:52.189876,0 days 00:00:04.824295,True,squared_error,44,,1,2,705,TPESampler,COMPLETE
2160,0.3477938108500755,2025-04-24 21:44:49.146132,2025-04-24 21:45:26.883607,0 days 00:00:37.737475,True,absolute_error,49,,1,2,681,TPESampler,COMPLETE
2161,0.6480974245580567,2025-04-24 21:44:50.619086,2025-04-24 21:44:52.038109,0 days 00:00:01.419023,True,squared_error,48,sqrt,2,3,625,TPESampler,COMPLETE
2162,0.4282210008921288,2025-04-24 21:44:51.941047,2025-04-24 21:44:54.439601,0 days 00:00:02.498554,True,squared_error,43,,2,4,487,TPESampler,COMPLETE
2163,0.9800661924708035,2025-04-24 21:44:52.248665,2025-04-24 21:44:53.190119,0 days 00:00:00.941454,False,absolute_error,30,log2,10,31,149,TPESampler,COMPLETE
2164,0.3408494723725512,2025-04-24 21:44:52.452106,2025-04-24 21:44:55.335757,0 days 00:00:02.883651,True,squared_error,50,,1,3,450,TPESampler,COMPLETE
2165,0.4273386760894288,2025-04-24 21:44:53.434249,2025-04-24 21:44:56.606595,0 days 00:00:03.172346,True,squared_error,41,,2,3,686,TPESampler,COMPLETE
2166,0.3445009694450225,2025-04-24 21:44:53.834734,2025-04-24 21:44:58.085986,0 days 00:00:04.251252,True,squared_error,50,,1,2,688,TPESampler,COMPLETE
2167,0.348037472747343,2025-04-24 21:44:54.729491,2025-04-24 21:44:57.437331,0 days 00:00:02.707840,True,squared_error,42,,1,4,469,TPESampler,COMPLETE
2168,0.3535736630757398,2025-04-24 21:44:55.665326,2025-04-24 21:44:57.912918,0 days 00:00:02.247592,True,squared_error,49,,1,5,384,TPESampler,COMPLETE
2169,0.43269914352034317,2025-04-24 21:44:56.808124,2025-04-24 21:44:58.659744,0 days 00:00:01.851620,True,squared_error,50,,2,5,352,TPESampler,COMPLETE
2170,0.3425330958963063,2025-04-24 21:44:57.677182,2025-04-24 21:44:59.998680,0 days 00:00:02.321498,True,squared_error,45,,1,3,334,TPESampler,COMPLETE
2171,0.9912009896537461,2025-04-24 21:44:58.180539,2025-04-24 21:44:59.655827,0 days 00:00:01.475288,True,absolute_error,16,log2,14,2,403,TPESampler,COMPLETE
2172,0.4852274933809601,2025-04-24 21:44:58.396195,2025-04-24 21:45:09.093729,0 days 00:00:10.697534,False,absolute_error,24,sqrt,1,13,983,TPESampler,COMPLETE
2173,0.3422959276993533,2025-04-24 21:44:58.940307,2025-04-24 21:45:02.058303,0 days 00:00:03.117996,True,squared_error,50,,1,3,500,TPESampler,COMPLETE
2174,0.6760524011243011,2025-04-24 21:44:59.930032,2025-04-24 21:45:02.065526,0 days 00:00:02.135494,True,absolute_error,20,sqrt,2,5,385,TPESampler,COMPLETE
2175,0.34200253344530596,2025-04-24 21:45:00.259898,2025-04-24 21:45:02.933033,0 days 00:00:02.673135,True,squared_error,45,,1,3,403,TPESampler,COMPLETE
2176,0.4723281031235935,2025-04-24 21:45:02.274955,2025-04-24 21:45:03.818294,0 days 00:00:01.543339,True,squared_error,41,log2,1,3,411,TPESampler,COMPLETE
2177,0.34256461578669034,2025-04-24 21:45:02.283550,2025-04-24 21:45:04.924327,0 days 00:00:02.640777,True,squared_error,42,,1,3,404,TPESampler,COMPLETE
2178,0.3424913678675508,2025-04-24 21:45:03.264370,2025-04-24 21:45:05.574135,0 days 00:00:02.309765,True,squared_error,50,,1,3,319,TPESampler,COMPLETE
2179,0.5865795853302097,2025-04-24 21:45:04.131280,2025-04-24 21:45:05.288376,0 days 00:00:01.157096,True,squared_error,50,,7,2,220,TPESampler,COMPLETE
2180,0.40641958141269957,2025-04-24 21:45:05.129342,2025-04-24 21:45:07.815556,0 days 00:00:02.686214,False,absolute_error,35,sqrt,1,5,133,TPESampler,COMPLETE
2181,0.42855829842770476,2025-04-24 21:45:05.515345,2025-04-24 21:45:08.188767,0 days 00:00:02.673422,True,squared_error,50,,2,3,577,TPESampler,COMPLETE
2182,0.4274387564831465,2025-04-24 21:45:05.845743,2025-04-24 21:45:08.354437,0 days 00:00:02.508694,True,squared_error,50,,2,3,514,TPESampler,COMPLETE
2183,0.34412792349185967,2025-04-24 21:45:08.025057,2025-04-24 21:45:10.263672,0 days 00:00:02.238615,True,squared_error,44,,1,3,298,TPESampler,COMPLETE
2184,0.34287744991592883,2025-04-24 21:45:08.429447,2025-04-24 21:45:11.635956,0 days 00:00:03.206509,True,squared_error,50,,1,2,447,TPESampler,COMPLETE
2185,0.36089445987685076,2025-04-24 21:45:08.618255,2025-04-24 21:45:11.472674,0 days 00:00:02.854419,True,squared_error,42,,1,6,428,TPESampler,COMPLETE
2186,0.44851679781764925,2025-04-24 21:45:09.371587,2025-04-24 21:45:13.407579,0 days 00:00:04.035992,False,squared_error,50,,2,2,639,TPESampler,COMPLETE
2187,0.6376240802804355,2025-04-24 21:45:10.476054,2025-04-24 21:45:12.159884,0 days 00:00:01.683830,False,squared_error,11,,15,37,405,TPESampler,COMPLETE
2188,0.3627840462380368,2025-04-24 21:45:11.685988,2025-04-24 21:45:14.357064,0 days 00:00:02.671076,True,squared_error,46,,1,6,361,TPESampler,COMPLETE
2189,0.9101294101846643,2025-04-24 21:45:11.974348,2025-04-24 21:45:13.903654,0 days 00:00:01.929306,True,squared_error,31,log2,3,49,559,TPESampler,COMPLETE
2190,0.6439252277564953,2025-04-24 21:45:12.473595,2025-04-24 21:45:13.929618,0 days 00:00:01.456023,False,squared_error,17,sqrt,3,3,524,TPESampler,COMPLETE
2191,0.43001534408311676,2025-04-24 21:45:12.752715,2025-04-24 21:45:15.703543,0 days 00:00:02.950828,True,squared_error,49,,2,2,326,TPESampler,COMPLETE
2192,0.3536896477702474,2025-04-24 21:45:13.721075,2025-04-24 21:45:16.603287,0 days 00:00:02.882212,True,squared_error,50,,1,5,337,TPESampler,COMPLETE
2193,0.6532028257956247,2025-04-24 21:45:14.311383,2025-04-24 21:45:15.917534,0 days 00:00:01.606151,True,squared_error,43,sqrt,2,2,386,TPESampler,COMPLETE
2194,0.4275609661656752,2025-04-24 21:45:14.395431,2025-04-24 21:45:16.604709,0 days 00:00:02.209278,True,squared_error,50,log2,1,3,509,TPESampler,COMPLETE
2195,0.3425162267453898,2025-04-24 21:45:14.690342,2025-04-24 21:45:17.414871,0 days 00:00:02.724529,True,squared_error,42,,1,3,360,TPESampler,COMPLETE
2196,0.34118177451426007,2025-04-24 21:45:15.922531,2025-04-24 21:45:19.149773,0 days 00:00:03.227242,True,squared_error,50,,1,3,458,TPESampler,COMPLETE
2197,0.4296530896069787,2025-04-24 21:45:16.145221,2025-04-24 21:45:18.703915,0 days 00:00:02.558694,True,squared_error,41,,2,2,423,TPESampler,COMPLETE
2198,0.34276384679180144,2025-04-24 21:45:16.951293,2025-04-24 21:45:20.535832,0 days 00:00:03.584539,True,squared_error,43,,1,2,456,TPESampler,COMPLETE
2199,0.346627906195216,2025-04-24 21:45:17.018620,2025-04-24 21:45:20.262458,0 days 00:00:03.243838,True,squared_error,50,,1,4,431,TPESampler,COMPLETE
2200,0.42804139341679437,2025-04-24 21:45:17.619664,2025-04-24 21:45:20.330948,0 days 00:00:02.711284,True,squared_error,44,,2,3,498,TPESampler,COMPLETE
2201,0.34173014955965375,2025-04-24 21:45:18.906510,2025-04-24 21:45:21.847285,0 days 00:00:02.940775,True,squared_error,50,,1,3,464,TPESampler,COMPLETE
2202,0.34514223487074097,2025-04-24 21:45:19.363706,2025-04-24 21:45:22.044061,0 days 00:00:02.680355,True,squared_error,50,,1,2,315,TPESampler,COMPLETE
2203,0.571870040022245,2025-04-24 21:45:20.490955,2025-04-24 21:45:24.106448,0 days 00:00:03.615493,False,absolute_error,22,,5,2,139,TPESampler,COMPLETE
2204,0.34645587794174115,2025-04-24 21:45:20.581372,2025-04-24 21:45:23.448929,0 days 00:00:02.867557,True,squared_error,41,,1,4,455,TPESampler,COMPLETE
2205,0.38428295954248554,2025-04-24 21:45:20.839673,2025-04-24 21:45:22.759308,0 days 00:00:01.919635,True,squared_error,45,sqrt,1,2,404,TPESampler,COMPLETE
2206,0.4486726497621885,2025-04-24 21:45:22.050417,2025-04-24 21:45:23.281455,0 days 00:00:01.231038,True,squared_error,50,log2,1,5,332,TPESampler,COMPLETE
2207,0.9409394917778242,2025-04-24 21:45:22.270613,2025-04-24 21:45:23.374105,0 days 00:00:01.103492,True,squared_error,33,log2,9,8,181,TPESampler,COMPLETE
2208,0.34297819809454794,2025-04-24 21:45:22.968051,2025-04-24 21:45:27.130912,0 days 00:00:04.162861,True,squared_error,43,,1,2,595,TPESampler,COMPLETE
2209,0.5257452758910922,2025-04-24 21:45:23.492872,2025-04-24 21:45:28.012475,0 days 00:00:04.519603,True,absolute_error,36,log2,1,4,679,TPESampler,COMPLETE
2210,0.3418768358193907,2025-04-24 21:45:23.745957,2025-04-24 21:45:27.190517,0 days 00:00:03.444560,True,squared_error,43,,1,3,538,TPESampler,COMPLETE
2211,0.42891085822368336,2025-04-24 21:45:23.770061,2025-04-24 21:45:26.926761,0 days 00:00:03.156700,False,squared_error,45,,1,3,347,TPESampler,COMPLETE
2212,0.5407051803600067,2025-04-24 21:45:24.432655,2025-04-24 21:45:29.534053,0 days 00:00:05.101398,False,absolute_error,46,sqrt,2,10,635,TPESampler,COMPLETE
2213,0.3424468947709219,2025-04-24 21:45:27.062312,2025-04-24 21:45:32.336557,0 days 00:00:05.274245,True,squared_error,50,,1,3,694,TPESampler,COMPLETE
2214,0.3413830765870993,2025-04-24 21:45:27.117001,2025-04-24 21:45:30.693670,0 days 00:00:03.576669,True,squared_error,50,,1,3,415,TPESampler,COMPLETE
2215,0.3435463393335965,2025-04-24 21:45:27.295828,2025-04-24 21:45:31.112460,0 days 00:00:03.816632,True,squared_error,50,,1,2,461,TPESampler,COMPLETE
2216,0.43649091286963704,2025-04-24 21:45:27.440544,2025-04-24 21:45:36.838264,0 days 00:00:09.397720,False,absolute_error,33,sqrt,1,15,667,TPESampler,COMPLETE
2217,0.427173824348447,2025-04-24 21:45:28.787058,2025-04-24 21:45:31.388307,0 days 00:00:02.601249,True,squared_error,50,,2,3,517,TPESampler,COMPLETE
2218,0.6077340496687246,2025-04-24 21:45:29.736495,2025-04-24 21:45:32.533817,0 days 00:00:02.797322,True,absolute_error,15,,13,7,491,TPESampler,COMPLETE
2219,0.36148337814703224,2025-04-24 21:45:30.913618,2025-04-24 21:45:34.240406,0 days 00:00:03.326788,True,squared_error,50,,1,6,487,TPESampler,COMPLETE
2220,0.34275385547008635,2025-04-24 21:45:31.329722,2025-04-24 21:45:34.977714,0 days 00:00:03.647992,True,squared_error,43,,1,2,540,TPESampler,COMPLETE
2221,0.3414543832314912,2025-04-24 21:45:31.626523,2025-04-24 21:45:35.685669,0 days 00:00:04.059146,True,squared_error,50,,1,3,578,TPESampler,COMPLETE
2222,0.3431859748375013,2025-04-24 21:45:32.731904,2025-04-24 21:45:36.516997,0 days 00:00:03.785093,True,squared_error,50,,1,2,529,TPESampler,COMPLETE
2223,0.8079906017099606,2025-04-24 21:45:32.732506,2025-04-24 21:45:36.764565,0 days 00:00:04.032059,True,absolute_error,11,log2,1,6,931,TPESampler,COMPLETE
2224,0.3412148542760437,2025-04-24 21:45:34.711849,2025-04-24 21:45:38.360491,0 days 00:00:03.648642,True,squared_error,50,,1,3,524,TPESampler,COMPLETE
2225,0.6128201026976403,2025-04-24 21:45:35.184726,2025-04-24 21:45:39.517948,0 days 00:00:04.333222,True,absolute_error,50,,14,18,797,TPESampler,COMPLETE
2226,0.427920686296916,2025-04-24 21:45:35.986267,2025-04-24 21:45:39.558921,0 days 00:00:03.572654,True,squared_error,42,,2,4,618,TPESampler,COMPLETE
2227,0.36858715419423804,2025-04-24 21:45:36.936835,2025-04-24 21:45:40.346965,0 days 00:00:03.410130,True,squared_error,44,,1,7,530,TPESampler,COMPLETE
2228,0.3477641099868041,2025-04-24 21:45:36.972067,2025-04-24 21:45:40.401713,0 days 00:00:03.429646,True,squared_error,45,,1,4,513,TPESampler,COMPLETE
2229,0.3423284803360964,2025-04-24 21:45:37.084816,2025-04-24 21:45:40.831685,0 days 00:00:03.746869,True,squared_error,44,,1,3,539,TPESampler,COMPLETE
2230,0.42845223488738177,2025-04-24 21:45:38.569543,2025-04-24 21:45:41.907695,0 days 00:00:03.338152,True,squared_error,42,,2,2,576,TPESampler,COMPLETE
2231,0.4297663066953958,2025-04-24 21:45:39.731684,2025-04-24 21:45:42.457995,0 days 00:00:02.726311,True,squared_error,50,,2,3,380,TPESampler,COMPLETE
2232,0.7229635554806834,2025-04-24 21:45:39.780787,2025-04-24 21:45:43.774059,0 days 00:00:03.993272,True,absolute_error,10,sqrt,2,19,863,TPESampler,COMPLETE
2233,0.42849919369669204,2025-04-24 21:45:40.682290,2025-04-24 21:45:43.767419,0 days 00:00:03.085129,True,squared_error,41,,2,3,485,TPESampler,COMPLETE
2234,0.34951182559983196,2025-04-24 21:45:40.750539,2025-04-24 21:45:44.035053,0 days 00:00:03.284514,True,squared_error,33,,1,4,518,TPESampler,COMPLETE
2235,0.3529316653000506,2025-04-24 21:45:41.196960,2025-04-24 21:45:44.192108,0 days 00:00:02.995148,True,squared_error,50,,1,5,440,TPESampler,COMPLETE
2236,0.3464411655459183,2025-04-24 21:45:42.177330,2025-04-24 21:45:44.857038,0 days 00:00:02.679708,True,squared_error,50,,1,4,375,TPESampler,COMPLETE
2237,0.3423814970566107,2025-04-24 21:45:42.672129,2025-04-24 21:45:45.891062,0 days 00:00:03.218933,True,squared_error,44,,1,3,458,TPESampler,COMPLETE
2238,0.8838882785967745,2025-04-24 21:45:43.951784,2025-04-24 21:45:46.258440,0 days 00:00:02.306656,True,squared_error,47,sqrt,6,7,391,TPESampler,COMPLETE
2239,0.3721504218890855,2025-04-24 21:45:44.000442,2025-04-24 21:45:47.179261,0 days 00:00:03.178819,True,squared_error,50,sqrt,1,2,504,TPESampler,COMPLETE
2240,0.3818161081924832,2025-04-24 21:45:44.294293,2025-04-24 21:46:26.245964,0 days 00:00:41.951671,False,absolute_error,48,,1,4,444,TPESampler,COMPLETE
2241,0.3438611353703554,2025-04-24 21:45:44.541298,2025-04-24 21:45:48.955158,0 days 00:00:04.413860,True,squared_error,50,,1,2,657,TPESampler,COMPLETE
2242,0.9246292354111522,2025-04-24 21:45:45.167145,2025-04-24 21:45:47.575756,0 days 00:00:02.408611,True,absolute_error,26,log2,2,9,433,TPESampler,COMPLETE
2243,0.8075269396686002,2025-04-24 21:45:46.106191,2025-04-24 21:45:51.071874,0 days 00:00:04.965683,False,absolute_error,5,sqrt,1,2,932,TPESampler,COMPLETE
2244,0.6436434535433816,2025-04-24 21:45:46.628621,2025-04-24 21:45:49.493849,0 days 00:00:02.865228,True,absolute_error,13,sqrt,1,14,301,TPESampler,COMPLETE
2245,0.4277528014865493,2025-04-24 21:45:47.441479,2025-04-24 21:45:50.743171,0 days 00:00:03.301692,True,squared_error,43,,2,4,549,TPESampler,COMPLETE
2246,0.4310576086494818,2025-04-24 21:45:47.857467,2025-04-24 21:45:50.891533,0 days 00:00:03.034066,True,squared_error,50,,2,5,552,TPESampler,COMPLETE
2247,0.35283248413684093,2025-04-24 21:45:49.160779,2025-04-24 21:45:52.081574,0 days 00:00:02.920795,True,squared_error,50,,1,5,559,TPESampler,COMPLETE
2248,0.3437265124707034,2025-04-24 21:45:49.754753,2025-04-24 21:45:53.321502,0 days 00:00:03.566749,True,squared_error,43,,1,2,477,TPESampler,COMPLETE
2249,0.3480284923299787,2025-04-24 21:45:50.955567,2025-04-24 21:45:55.529865,0 days 00:00:04.574298,True,squared_error,50,,1,4,732,TPESampler,COMPLETE
2250,0.3427141474154724,2025-04-24 21:45:51.174831,2025-04-24 21:45:56.171853,0 days 00:00:04.997022,True,squared_error,50,,1,3,709,TPESampler,COMPLETE
2251,0.8728223273696025,2025-04-24 21:45:51.452248,2025-04-24 21:45:52.941203,0 days 00:00:01.488955,False,absolute_error,10,sqrt,6,33,340,TPESampler,COMPLETE
2252,0.8924717585451623,2025-04-24 21:45:52.414691,2025-04-24 21:45:53.495621,0 days 00:00:01.080930,True,squared_error,15,sqrt,6,2,224,TPESampler,COMPLETE
2253,0.3418862832664415,2025-04-24 21:45:53.232513,2025-04-24 21:45:56.665262,0 days 00:00:03.432749,True,squared_error,42,,1,3,603,TPESampler,COMPLETE
2254,0.8793824105011078,2025-04-24 21:45:53.576384,2025-04-24 21:45:55.244232,0 days 00:00:01.667848,True,squared_error,38,log2,2,3,595,TPESampler,COMPLETE
2255,0.3437324362844371,2025-04-24 21:45:53.765687,2025-04-24 21:45:55.976714,0 days 00:00:02.211027,True,squared_error,43,,1,2,297,TPESampler,COMPLETE
2256,0.5181807371114552,2025-04-24 21:45:55.453277,2025-04-24 21:45:58.051597,0 days 00:00:02.598320,False,absolute_error,21,sqrt,1,50,150,TPESampler,COMPLETE
2257,0.34755531527935124,2025-04-24 21:45:55.829170,2025-04-24 21:45:59.529126,0 days 00:00:03.699956,True,squared_error,42,,1,4,555,TPESampler,COMPLETE
2258,0.3472522901792869,2025-04-24 21:45:56.320882,2025-04-24 21:45:58.797183,0 days 00:00:02.476301,True,squared_error,50,,1,4,342,TPESampler,COMPLETE
2259,0.42741723658477826,2025-04-24 21:45:56.481302,2025-04-24 21:46:00.447658,0 days 00:00:03.966356,True,squared_error,50,,2,3,725,TPESampler,COMPLETE
2260,0.3460400161028918,2025-04-24 21:45:56.956117,2025-04-24 21:46:00.184644,0 days 00:00:03.228527,True,squared_error,50,,1,4,530,TPESampler,COMPLETE
2261,0.7841942085230064,2025-04-24 21:45:58.264189,2025-04-24 21:45:59.340257,0 days 00:00:01.076068,False,absolute_error,26,sqrt,4,11,108,TPESampler,COMPLETE
