number,value,datetime_start,datetime_complete,duration,params_bootstrap,params_criterion,params_max_depth,params_max_features,params_min_samples_leaf,params_min_samples_split,params_n_estimators,system_attrs_auto:sampler,state
992,0.3425341007494609,2025-04-24 21:29:59.465531,2025-04-24 21:30:03.825288,0 days 00:00:04.359757,True,squared_error,50,,1,3,695,TPESampler,COMPLETE
993,0.4302759225117505,2025-04-24 21:29:59.797086,2025-04-24 21:30:02.159367,0 days 00:00:02.362281,True,squared_error,45,,2,3,349,TPESampler,COMPLETE
994,0.4273471257958545,2025-04-24 21:30:00.484628,2025-04-24 21:30:03.399287,0 days 00:00:02.914659,True,squared_error,50,,2,3,513,TPESampler,COMPLETE
995,0.34383838797228816,2025-04-24 21:30:00.504307,2025-04-24 21:30:04.219655,0 days 00:00:03.715348,True,squared_error,43,,1,2,616,TPESampler,COMPLETE
996,0.34311781230074695,2025-04-24 21:30:00.558095,2025-04-24 21:30:03.691860,0 days 00:00:03.133765,True,squared_error,43,,1,3,508,TPESampler,COMPLETE
997,0.3428783543432791,2025-04-24 21:30:02.345247,2025-04-24 21:30:05.833301,0 days 00:00:03.488054,True,squared_error,50,,1,2,544,TPESampler,COMPLETE
998,0.34204281611995957,2025-04-24 21:30:03.583070,2025-04-24 21:30:05.899828,0 days 00:00:02.316758,True,squared_error,50,,1,3,344,TPESampler,COMPLETE
999,0.3530147207204251,2025-04-24 21:30:03.914559,2025-04-24 21:30:07.065764,0 days 00:00:03.151205,True,squared_error,50,,1,5,562,TPESampler,COMPLETE
1000,0.9951919450833431,2025-04-24 21:30:04.063751,2025-04-24 21:30:05.119932,0 days 00:00:01.056181,True,absolute_error,13,log2,15,48,116,TPESampler,COMPLETE
1001,0.344275108403983,2025-04-24 21:30:04.441197,2025-04-24 21:30:08.618775,0 days 00:00:04.177578,True,squared_error,50,,1,2,684,TPESampler,COMPLETE
1002,0.34674693267014595,2025-04-24 21:30:05.356340,2025-04-24 21:30:08.166500,0 days 00:00:02.810160,True,squared_error,43,,1,4,459,TPESampler,COMPLETE
1003,0.3566406245754766,2025-04-24 21:30:06.088497,2025-04-24 21:30:43.972973,0 days 00:00:37.884476,True,absolute_error,43,,1,5,672,TPESampler,COMPLETE
1004,0.6682840677735921,2025-04-24 21:30:06.166848,2025-04-24 21:30:08.257179,0 days 00:00:02.090331,True,absolute_error,48,sqrt,2,4,306,TPESampler,COMPLETE
1005,0.6040823442756906,2025-04-24 21:30:07.312166,2025-04-24 21:30:10.436925,0 days 00:00:03.124759,True,absolute_error,7,,11,3,540,TPESampler,COMPLETE
1006,0.3453952053631555,2025-04-24 21:30:08.339298,2025-04-24 21:30:11.495306,0 days 00:00:03.156008,True,squared_error,49,,1,2,400,TPESampler,COMPLETE
1007,0.7267077168412713,2025-04-24 21:30:08.632733,2025-04-24 21:30:10.267749,0 days 00:00:01.635016,False,squared_error,43,sqrt,4,5,678,TPESampler,COMPLETE
1008,0.34589768247315145,2025-04-24 21:30:08.899564,2025-04-24 21:30:12.312560,0 days 00:00:03.412996,True,squared_error,50,,1,4,533,TPESampler,COMPLETE
1009,0.3417731078955099,2025-04-24 21:30:10.435112,2025-04-24 21:30:13.614406,0 days 00:00:03.179294,True,squared_error,49,,1,3,558,TPESampler,COMPLETE
1010,0.7851208535733676,2025-04-24 21:30:10.666227,2025-04-24 21:30:12.310352,0 days 00:00:01.644125,True,squared_error,9,sqrt,3,26,624,TPESampler,COMPLETE
1011,0.41373642127679133,2025-04-24 21:30:11.686811,2025-04-24 21:30:13.295588,0 days 00:00:01.608777,True,squared_error,50,sqrt,1,9,594,TPESampler,COMPLETE
1012,0.5440886631128885,2025-04-24 21:30:12.485082,2025-04-24 21:30:21.126483,0 days 00:00:08.641401,True,absolute_error,18,,5,2,817,TPESampler,COMPLETE
1013,0.42707871187242996,2025-04-24 21:30:12.558145,2025-04-24 21:30:15.894320,0 days 00:00:03.336175,True,squared_error,42,,2,4,655,TPESampler,COMPLETE
1014,0.5064932160125536,2025-04-24 21:30:13.657815,2025-04-24 21:30:15.423681,0 days 00:00:01.765866,False,squared_error,36,log2,1,2,470,TPESampler,COMPLETE
1015,0.3542560736156967,2025-04-24 21:30:13.850371,2025-04-24 21:30:17.836904,0 days 00:00:03.986533,True,squared_error,50,,1,5,700,TPESampler,COMPLETE
1016,0.4298049942338747,2025-04-24 21:30:13.894655,2025-04-24 21:30:15.808694,0 days 00:00:01.914039,True,squared_error,49,,2,3,362,TPESampler,COMPLETE
1017,0.646660603200724,2025-04-24 21:30:15.618097,2025-04-24 21:30:17.070744,0 days 00:00:01.452647,True,squared_error,45,sqrt,2,2,611,TPESampler,COMPLETE
1018,0.4280302384827214,2025-04-24 21:30:15.977964,2025-04-24 21:30:18.758268,0 days 00:00:02.780304,True,squared_error,42,,2,2,582,TPESampler,COMPLETE
1019,0.3864876165621498,2025-04-24 21:30:16.094077,2025-04-24 21:30:55.485416,0 days 00:00:39.391339,False,absolute_error,49,,1,2,416,TPESampler,COMPLETE
1020,0.3410926111195977,2025-04-24 21:30:17.258242,2025-04-24 21:30:20.881252,0 days 00:00:03.623010,True,squared_error,50,,1,3,548,TPESampler,COMPLETE
1021,0.43194229854384686,2025-04-24 21:30:18.092680,2025-04-24 21:30:19.854395,0 days 00:00:01.761715,True,squared_error,50,log2,1,4,591,TPESampler,COMPLETE
1022,0.43023778917867594,2025-04-24 21:30:18.975068,2025-04-24 21:30:21.148891,0 days 00:00:02.173823,False,squared_error,50,,1,3,304,TPESampler,COMPLETE
1023,0.348412687785497,2025-04-24 21:30:20.031739,2025-04-24 21:30:21.509425,0 days 00:00:01.477686,True,squared_error,41,,1,4,217,TPESampler,COMPLETE
1024,0.37865888197093134,2025-04-24 21:30:21.066027,2025-04-24 21:30:22.844463,0 days 00:00:01.778436,False,squared_error,49,sqrt,1,6,535,TPESampler,COMPLETE
1025,0.5117754051710233,2025-04-24 21:30:21.264422,2025-04-24 21:30:22.852241,0 days 00:00:01.587819,False,squared_error,41,log2,1,27,547,TPESampler,COMPLETE
1026,0.8966135617401723,2025-04-24 21:30:21.319012,2025-04-24 21:30:22.611982,0 days 00:00:01.292970,False,absolute_error,50,sqrt,6,21,147,TPESampler,COMPLETE
1027,0.3409568000255312,2025-04-24 21:30:21.927074,2025-04-24 21:30:25.045734,0 days 00:00:03.118660,True,squared_error,50,,1,3,544,TPESampler,COMPLETE
1028,0.3442399829554631,2025-04-24 21:30:22.797996,2025-04-24 21:30:25.873075,0 days 00:00:03.075079,True,squared_error,41,,1,3,484,TPESampler,COMPLETE
1029,0.3573651427294181,2025-04-24 21:30:23.085550,2025-04-24 21:30:52.331162,0 days 00:00:29.245612,True,absolute_error,47,,1,5,499,TPESampler,COMPLETE
1030,0.361690485101023,2025-04-24 21:30:23.087584,2025-04-24 21:30:25.387053,0 days 00:00:02.299469,True,squared_error,42,,1,6,317,TPESampler,COMPLETE
1031,0.36197253478519126,2025-04-24 21:30:25.223408,2025-04-24 21:30:27.638174,0 days 00:00:02.414766,True,squared_error,41,,1,6,506,TPESampler,COMPLETE
1032,0.3442573740187665,2025-04-24 21:30:25.577193,2025-04-24 21:30:28.638097,0 days 00:00:03.060904,True,squared_error,50,,1,2,481,TPESampler,COMPLETE
1033,0.42777524426576446,2025-04-24 21:30:26.072618,2025-04-24 21:30:28.643416,0 days 00:00:02.570798,True,squared_error,43,,2,3,603,TPESampler,COMPLETE
1034,0.9783046763096522,2025-04-24 21:30:27.816285,2025-04-24 21:30:28.533825,0 days 00:00:00.717540,True,absolute_error,26,sqrt,15,5,136,TPESampler,COMPLETE
1035,0.3465061171893211,2025-04-24 21:30:28.791855,2025-04-24 21:30:31.229218,0 days 00:00:02.437363,True,squared_error,50,,1,4,415,TPESampler,COMPLETE
1036,0.34697436299511625,2025-04-24 21:30:28.801714,2025-04-24 21:30:31.488195,0 days 00:00:02.686481,True,squared_error,43,,1,4,463,TPESampler,COMPLETE
1037,0.3432595736641481,2025-04-24 21:30:28.859760,2025-04-24 21:30:32.240406,0 days 00:00:03.380646,True,squared_error,50,,1,2,527,TPESampler,COMPLETE
1038,0.42673337755510815,2025-04-24 21:30:31.400967,2025-04-24 21:30:34.381316,0 days 00:00:02.980349,True,squared_error,50,,2,3,774,TPESampler,COMPLETE
1039,0.5805618403664438,2025-04-24 21:30:31.681594,2025-04-24 21:30:38.164175,0 days 00:00:06.482581,False,absolute_error,7,,3,3,238,TPESampler,COMPLETE
1040,0.3681527564123876,2025-04-24 21:30:32.502501,2025-04-24 21:30:34.972034,0 days 00:00:02.469533,True,squared_error,50,,1,7,548,TPESampler,COMPLETE
1041,0.42846121358155315,2025-04-24 21:30:34.842840,2025-04-24 21:30:36.979425,0 days 00:00:02.136585,True,squared_error,50,,2,2,481,TPESampler,COMPLETE
1042,0.6348656087537933,2025-04-24 21:30:35.164858,2025-04-24 21:30:37.199264,0 days 00:00:02.034406,False,squared_error,20,,15,7,722,TPESampler,COMPLETE
1043,0.3686982959126569,2025-04-24 21:30:37.149001,2025-04-24 21:30:39.438013,0 days 00:00:02.289012,True,squared_error,50,,1,7,456,TPESampler,COMPLETE
1044,0.3409540567591623,2025-04-24 21:30:37.386809,2025-04-24 21:30:40.094562,0 days 00:00:02.707753,True,squared_error,50,,1,3,443,TPESampler,COMPLETE
1045,0.3748817276217763,2025-04-24 21:30:38.366408,2025-04-24 21:30:40.004322,0 days 00:00:01.637914,True,squared_error,44,sqrt,1,3,607,TPESampler,COMPLETE
1046,0.3442555236336917,2025-04-24 21:30:39.665919,2025-04-24 21:30:43.285620,0 days 00:00:03.619701,True,squared_error,50,,1,2,666,TPESampler,COMPLETE
1047,0.3433872221699684,2025-04-24 21:30:40.234742,2025-04-24 21:30:42.996622,0 days 00:00:02.761880,True,squared_error,50,,1,2,415,TPESampler,COMPLETE
1048,0.4275258212458562,2025-04-24 21:30:40.305870,2025-04-24 21:30:43.038924,0 days 00:00:02.733054,True,squared_error,50,,2,2,601,TPESampler,COMPLETE
1049,0.4285127053663268,2025-04-24 21:30:43.135607,2025-04-24 21:30:45.506576,0 days 00:00:02.370969,True,squared_error,43,,2,4,480,TPESampler,COMPLETE
1050,0.34177989633483913,2025-04-24 21:30:43.205716,2025-04-24 21:30:46.623061,0 days 00:00:03.417345,True,squared_error,50,,1,3,473,TPESampler,COMPLETE
1051,0.5946278953544085,2025-04-24 21:30:43.481282,2025-04-24 21:30:46.517900,0 days 00:00:03.036618,True,squared_error,38,,10,6,986,TPESampler,COMPLETE
1052,0.5902321153018322,2025-04-24 21:30:44.190021,2025-04-24 21:30:49.499417,0 days 00:00:05.309396,True,absolute_error,35,log2,1,39,913,TPESampler,COMPLETE
1053,0.3466390563063751,2025-04-24 21:30:45.687232,2025-04-24 21:30:48.303845,0 days 00:00:02.616613,True,squared_error,50,,1,4,462,TPESampler,COMPLETE
1054,0.34692753226811884,2025-04-24 21:30:46.718282,2025-04-24 21:30:49.255565,0 days 00:00:02.537283,True,squared_error,50,,1,4,484,TPESampler,COMPLETE
1055,0.3467030844733972,2025-04-24 21:30:46.823480,2025-04-24 21:31:11.114245,0 days 00:00:24.290765,True,absolute_error,50,,1,2,444,TPESampler,COMPLETE
1056,0.43033752646140183,2025-04-24 21:30:48.481346,2025-04-24 21:30:50.566277,0 days 00:00:02.084931,True,squared_error,50,,2,5,521,TPESampler,COMPLETE
1057,0.9773188805772552,2025-04-24 21:30:49.456767,2025-04-24 21:30:50.745314,0 days 00:00:01.288547,False,absolute_error,11,log2,12,20,521,TPESampler,COMPLETE
1058,0.3431731768222258,2025-04-24 21:30:49.705265,2025-04-24 21:30:53.633526,0 days 00:00:03.928261,True,squared_error,44,,1,3,656,TPESampler,COMPLETE
1059,0.6689775687958099,2025-04-24 21:30:50.740637,2025-04-24 21:30:52.877305,0 days 00:00:02.136668,False,squared_error,24,,8,21,655,TPESampler,COMPLETE
1060,0.34307122822929503,2025-04-24 21:30:50.961436,2025-04-24 21:30:53.936434,0 days 00:00:02.974998,True,squared_error,43,,1,3,481,TPESampler,COMPLETE
1061,0.4294569177518588,2025-04-24 21:30:52.531246,2025-04-24 21:30:54.959101,0 days 00:00:02.427855,True,squared_error,50,,2,4,431,TPESampler,COMPLETE
1062,0.4283021978942291,2025-04-24 21:30:53.126068,2025-04-24 21:30:55.258514,0 days 00:00:02.132446,True,squared_error,50,,2,3,497,TPESampler,COMPLETE
1063,0.3418083186618213,2025-04-24 21:30:53.857373,2025-04-24 21:30:56.543261,0 days 00:00:02.685888,True,squared_error,50,,1,3,391,TPESampler,COMPLETE
1064,0.34347665625038143,2025-04-24 21:30:54.170591,2025-04-24 21:30:57.463730,0 days 00:00:03.293139,True,squared_error,42,,1,3,505,TPESampler,COMPLETE
1065,0.347826183359818,2025-04-24 21:30:55.183292,2025-04-24 21:30:59.381934,0 days 00:00:04.198642,True,squared_error,42,,1,4,635,TPESampler,COMPLETE
1066,0.34627808664085163,2025-04-24 21:30:55.438863,2025-04-24 21:30:58.569852,0 days 00:00:03.130989,True,squared_error,50,,1,4,571,TPESampler,COMPLETE
1067,0.34206700053017963,2025-04-24 21:30:55.729403,2025-04-24 21:30:58.501107,0 days 00:00:02.771704,True,squared_error,49,,1,3,480,TPESampler,COMPLETE
1068,0.5937274398681096,2025-04-24 21:30:56.731140,2025-04-24 21:30:57.692840,0 days 00:00:00.961700,True,squared_error,44,,14,10,155,TPESampler,COMPLETE
1069,0.34237496201436457,2025-04-24 21:30:57.649970,2025-04-24 21:31:01.879766,0 days 00:00:04.229796,True,squared_error,50,,1,3,679,TPESampler,COMPLETE
1070,0.8309393164821006,2025-04-24 21:30:57.956599,2025-04-24 21:30:59.474005,0 days 00:00:01.517406,False,squared_error,28,log2,2,32,734,TPESampler,COMPLETE
1071,0.4145291525765717,2025-04-24 21:30:58.706260,2025-04-24 21:31:03.654560,0 days 00:00:04.948300,False,squared_error,35,,1,4,778,TPESampler,COMPLETE
1072,0.34410285398679974,2025-04-24 21:30:58.809877,2025-04-24 21:31:02.667427,0 days 00:00:03.857550,True,squared_error,50,,1,2,633,TPESampler,COMPLETE
1073,0.3445354677976813,2025-04-24 21:30:59.657943,2025-04-24 21:31:02.268170,0 days 00:00:02.610227,True,squared_error,50,,1,2,326,TPESampler,COMPLETE
1074,0.5195350416035359,2025-04-24 21:30:59.711916,2025-04-24 21:31:09.416543,0 days 00:00:09.704627,True,absolute_error,36,,4,5,751,TPESampler,COMPLETE
1075,0.3430139868806327,2025-04-24 21:31:02.066623,2025-04-24 21:31:05.087073,0 days 00:00:03.020450,True,squared_error,40,,1,2,531,TPESampler,COMPLETE
1076,0.3417079573694166,2025-04-24 21:31:02.490876,2025-04-24 21:31:04.964526,0 days 00:00:02.473650,True,squared_error,50,,1,3,411,TPESampler,COMPLETE
1077,0.3449260646363201,2025-04-24 21:31:02.858991,2025-04-24 21:31:06.059723,0 days 00:00:03.200732,True,squared_error,44,,1,2,497,TPESampler,COMPLETE
1078,0.34752385629960475,2025-04-24 21:31:03.827947,2025-04-24 21:31:07.595546,0 days 00:00:03.767599,True,squared_error,50,,1,4,709,TPESampler,COMPLETE
1079,0.34600591669939085,2025-04-24 21:31:05.149133,2025-04-24 21:31:08.437629,0 days 00:00:03.288496,True,squared_error,50,,1,4,551,TPESampler,COMPLETE
1080,0.4680607368561669,2025-04-24 21:31:05.327339,2025-04-24 21:31:06.780289,0 days 00:00:01.452950,True,squared_error,10,,1,21,202,TPESampler,COMPLETE
1081,0.4104210836215733,2025-04-24 21:31:06.352108,2025-04-24 21:31:09.882296,0 days 00:00:03.530188,False,squared_error,48,,1,4,541,TPESampler,COMPLETE
1082,0.645680979643671,2025-04-24 21:31:07.016161,2025-04-24 21:31:08.442214,0 days 00:00:01.426053,True,squared_error,49,sqrt,2,3,602,TPESampler,COMPLETE
1083,0.4297163460044661,2025-04-24 21:31:07.768833,2025-04-24 21:31:09.743284,0 days 00:00:01.974451,True,squared_error,43,,2,2,444,TPESampler,COMPLETE
1084,0.34456377240352576,2025-04-24 21:31:08.611991,2025-04-24 21:31:12.233081,0 days 00:00:03.621090,True,squared_error,50,,1,2,496,TPESampler,COMPLETE
1085,0.34119386221575226,2025-04-24 21:31:08.677409,2025-04-24 21:31:12.624341,0 days 00:00:03.946932,True,squared_error,50,,1,3,610,TPESampler,COMPLETE
1086,0.3465869816161555,2025-04-24 21:31:09.963425,2025-04-24 21:31:42.490260,0 days 00:00:32.526835,True,absolute_error,38,,1,3,602,TPESampler,COMPLETE
1087,0.6474415340112776,2025-04-24 21:31:09.990837,2025-04-24 21:31:10.841687,0 days 00:00:00.850850,False,squared_error,23,sqrt,3,7,147,TPESampler,COMPLETE
1088,0.34593547056795637,2025-04-24 21:31:10.164558,2025-04-24 21:31:13.323264,0 days 00:00:03.158706,True,squared_error,50,,1,4,446,TPESampler,COMPLETE
1089,0.3547796242627849,2025-04-24 21:31:11.185161,2025-04-24 21:31:13.880889,0 days 00:00:02.695728,True,squared_error,42,,1,5,462,TPESampler,COMPLETE
1090,0.35309285259701706,2025-04-24 21:31:11.386766,2025-04-24 21:31:14.637790,0 days 00:00:03.251024,True,squared_error,44,,1,5,535,TPESampler,COMPLETE
1091,0.3443636972576945,2025-04-24 21:31:12.425199,2025-04-24 21:31:16.177720,0 days 00:00:03.752521,True,squared_error,42,,1,3,739,TPESampler,COMPLETE
1092,0.3922040871271526,2025-04-24 21:31:12.844870,2025-04-24 21:31:24.747260,0 days 00:00:11.902390,False,absolute_error,46,sqrt,1,7,852,TPESampler,COMPLETE
1093,0.9183025798908208,2025-04-24 21:31:13.552127,2025-04-24 21:31:14.362222,0 days 00:00:00.810095,False,squared_error,49,log2,7,3,139,TPESampler,COMPLETE
1094,0.3716488821462092,2025-04-24 21:31:14.070967,2025-04-24 21:31:16.784166,0 days 00:00:02.713199,True,squared_error,49,sqrt,1,3,535,TPESampler,COMPLETE
1095,0.6383099968779304,2025-04-24 21:31:14.577348,2025-04-24 21:31:16.829322,0 days 00:00:02.251974,False,squared_error,49,sqrt,3,5,981,TPESampler,COMPLETE
1096,0.3429325080562901,2025-04-24 21:31:15.067370,2025-04-24 21:31:19.834676,0 days 00:00:04.767306,True,squared_error,50,,1,2,583,TPESampler,COMPLETE
1097,0.5864829106618437,2025-04-24 21:31:16.354069,2025-04-24 21:31:17.644337,0 days 00:00:01.290268,True,squared_error,35,,7,4,303,TPESampler,COMPLETE
1098,0.532883989162577,2025-04-24 21:31:17.004370,2025-04-24 21:31:18.971039,0 days 00:00:01.966669,False,squared_error,39,sqrt,2,2,612,TPESampler,COMPLETE
1099,0.5070586626844122,2025-04-24 21:31:17.053520,2025-04-24 21:31:19.006514,0 days 00:00:01.952994,True,squared_error,37,log2,1,3,481,TPESampler,COMPLETE
1100,0.3464956244950923,2025-04-24 21:31:17.921587,2025-04-24 21:31:20.352622,0 days 00:00:02.431035,True,squared_error,50,,1,4,426,TPESampler,COMPLETE
1101,0.34392543982898294,2025-04-24 21:31:19.122072,2025-04-24 21:31:22.804234,0 days 00:00:03.682162,True,squared_error,50,,1,2,514,TPESampler,COMPLETE
1102,0.34506473852487135,2025-04-24 21:31:19.194055,2025-04-24 21:31:22.873000,0 days 00:00:03.678945,True,squared_error,42,,1,2,503,TPESampler,COMPLETE
1103,0.44851248727015885,2025-04-24 21:31:20.261692,2025-04-24 21:31:22.349761,0 days 00:00:02.088069,False,squared_error,50,,2,2,308,TPESampler,COMPLETE
1104,0.4285825462663319,2025-04-24 21:31:20.535969,2025-04-24 21:31:23.028782,0 days 00:00:02.492813,True,squared_error,47,,2,3,569,TPESampler,COMPLETE
1105,0.42949996798094714,2025-04-24 21:31:22.534219,2025-04-24 21:31:25.041582,0 days 00:00:02.507363,True,squared_error,50,,2,4,419,TPESampler,COMPLETE
1106,0.3466105944673778,2025-04-24 21:31:23.047410,2025-04-24 21:31:25.808792,0 days 00:00:02.761382,True,squared_error,50,,1,4,366,TPESampler,COMPLETE
1107,0.34414731712939556,2025-04-24 21:31:23.099989,2025-04-24 21:31:26.813920,0 days 00:00:03.713931,True,squared_error,41,,1,3,517,TPESampler,COMPLETE
1108,0.434352691266318,2025-04-24 21:31:23.302731,2025-04-24 21:31:25.419641,0 days 00:00:02.116910,True,squared_error,48,log2,1,2,638,TPESampler,COMPLETE
1109,0.368327289391067,2025-04-24 21:31:24.937335,2025-04-24 21:31:28.137444,0 days 00:00:03.200109,True,squared_error,50,,1,7,621,TPESampler,COMPLETE
1110,0.4435711326475382,2025-04-24 21:31:25.238851,2025-04-24 21:31:43.816283,0 days 00:00:18.577432,True,absolute_error,49,,2,3,671,TPESampler,COMPLETE
1111,0.3420600170349302,2025-04-24 21:31:25.844747,2025-04-24 21:31:29.632773,0 days 00:00:03.788026,True,squared_error,50,,1,3,651,TPESampler,COMPLETE
1112,0.4311746913728912,2025-04-24 21:31:26.261063,2025-04-24 21:31:28.054650,0 days 00:00:01.793587,True,squared_error,49,log2,1,3,462,TPESampler,COMPLETE
1113,0.4285827023252431,2025-04-24 21:31:27.114019,2025-04-24 21:31:29.792803,0 days 00:00:02.678784,True,squared_error,50,,2,2,574,TPESampler,COMPLETE
1114,0.34163106927412107,2025-04-24 21:31:28.253029,2025-04-24 21:31:30.773181,0 days 00:00:02.520152,True,squared_error,50,,1,3,386,TPESampler,COMPLETE
1115,0.4280848992604036,2025-04-24 21:31:28.347678,2025-04-24 21:31:31.588908,0 days 00:00:03.241230,True,squared_error,50,,2,4,644,TPESampler,COMPLETE
1116,0.35463787092383986,2025-04-24 21:31:29.839425,2025-04-24 21:31:33.623999,0 days 00:00:03.784574,True,squared_error,41,,1,5,716,TPESampler,COMPLETE
1117,0.4457413059490486,2025-04-24 21:31:30.010011,2025-04-24 21:31:32.640208,0 days 00:00:02.630197,True,squared_error,50,,2,8,552,TPESampler,COMPLETE
1118,0.9075254523762234,2025-04-24 21:31:30.982897,2025-04-24 21:31:31.785496,0 days 00:00:00.802599,False,squared_error,23,sqrt,11,6,240,TPESampler,COMPLETE
1119,0.3435304703720711,2025-04-24 21:31:31.912588,2025-04-24 21:31:35.507689,0 days 00:00:03.595101,True,squared_error,42,,1,3,492,TPESampler,COMPLETE
1120,0.34176184225244366,2025-04-24 21:31:32.229350,2025-04-24 21:31:35.715710,0 days 00:00:03.486360,True,squared_error,50,,1,3,566,TPESampler,COMPLETE
1121,0.3456708035562845,2025-04-24 21:31:33.836176,2025-04-24 21:31:37.495920,0 days 00:00:03.659744,True,squared_error,50,,1,4,594,TPESampler,COMPLETE
1122,0.5693664790751762,2025-04-24 21:31:34.094428,2025-04-24 21:31:35.203727,0 days 00:00:01.109299,True,squared_error,50,,6,47,210,TPESampler,COMPLETE
1123,0.34822500179218496,2025-04-24 21:31:35.381471,2025-04-24 21:31:48.641552,0 days 00:00:13.260081,True,absolute_error,48,,1,3,234,TPESampler,COMPLETE
1124,0.42856728332929506,2025-04-24 21:31:35.703675,2025-04-24 21:31:37.831081,0 days 00:00:02.127406,True,squared_error,43,,2,3,483,TPESampler,COMPLETE
1125,0.6571665871564566,2025-04-24 21:31:35.984323,2025-04-24 21:31:40.118791,0 days 00:00:04.134468,True,absolute_error,28,sqrt,2,5,969,TPESampler,COMPLETE
1126,0.34097037084921544,2025-04-24 21:31:37.676042,2025-04-24 21:31:41.113553,0 days 00:00:03.437511,True,squared_error,50,,1,3,608,TPESampler,COMPLETE
1127,0.9916348422904947,2025-04-24 21:31:38.025379,2025-04-24 21:31:39.009128,0 days 00:00:00.983749,True,absolute_error,47,log2,13,38,253,TPESampler,COMPLETE
1128,0.35444930168908606,2025-04-24 21:31:39.178929,2025-04-24 21:31:41.445817,0 days 00:00:02.266888,True,squared_error,43,,1,5,466,TPESampler,COMPLETE
1129,0.4302723032902915,2025-04-24 21:31:40.306667,2025-04-24 21:31:42.441785,0 days 00:00:02.135118,True,squared_error,43,,2,3,394,TPESampler,COMPLETE
1130,0.3471283902458074,2025-04-24 21:31:41.295849,2025-04-24 21:31:45.186563,0 days 00:00:03.890714,True,squared_error,46,,1,4,671,TPESampler,COMPLETE
1131,0.37072491833213617,2025-04-24 21:31:41.650949,2025-04-24 21:32:01.013645,0 days 00:00:19.362696,True,absolute_error,48,,1,7,360,TPESampler,COMPLETE
1132,0.34494608002701393,2025-04-24 21:31:42.641998,2025-04-24 21:31:47.558893,0 days 00:00:04.916895,True,squared_error,50,,1,2,767,TPESampler,COMPLETE
