number,value,datetime_start,datetime_complete,duration,params_bootstrap,params_criterion,params_max_depth,params_max_features,params_min_samples_leaf,params_min_samples_split,params_n_estimators,system_attrs_auto:sampler,state
4382,0.342687839581712,2025-04-24 22:15:56.637039,2025-04-24 22:16:01.136371,0 days 00:00:04.499332,True,squared_error,50,,1,2,603,TPESampler,COMPLETE
4383,0.428477083272066,2025-04-24 22:15:57.081559,2025-04-24 22:15:59.513763,0 days 00:00:02.432204,True,squared_error,50,,2,3,486,TPESampler,COMPLETE
4384,0.42854260429446644,2025-04-24 22:15:57.728814,2025-04-24 22:16:00.518704,0 days 00:00:02.789890,True,squared_error,43,,2,2,555,TPESampler,COMPLETE
4385,0.34251222629684586,2025-04-24 22:15:59.749374,2025-04-24 22:16:03.860953,0 days 00:00:04.111579,True,squared_error,43,,1,3,640,TPESampler,COMPLETE
4386,0.42940809621486237,2025-04-24 22:16:00.189663,2025-04-24 22:16:04.137520,0 days 00:00:03.947857,False,squared_error,28,,1,2,444,TPESampler,COMPLETE
4387,0.35096973755021416,2025-04-24 22:16:00.692900,2025-04-24 22:16:37.616247,0 days 00:00:36.923347,True,absolute_error,43,,1,4,527,TPESampler,COMPLETE
4388,0.340836013791189,2025-04-24 22:16:01.081119,2025-04-24 22:16:05.119333,0 days 00:00:04.038214,True,squared_error,50,,1,3,547,TPESampler,COMPLETE
4389,0.34108522268720415,2025-04-24 22:16:01.633592,2025-04-24 22:16:04.716890,0 days 00:00:03.083298,True,squared_error,50,,1,3,437,TPESampler,COMPLETE
4390,0.9574224083370683,2025-04-24 22:16:04.101298,2025-04-24 22:16:06.007628,0 days 00:00:01.906330,True,absolute_error,18,log2,3,12,695,TPESampler,COMPLETE
4391,0.4288991425610744,2025-04-24 22:16:04.394086,2025-04-24 22:16:07.871651,0 days 00:00:03.477565,True,squared_error,50,,2,3,473,TPESampler,COMPLETE
4392,0.5901606432975119,2025-04-24 22:16:05.072183,2025-04-24 22:16:10.292500,0 days 00:00:05.220317,False,absolute_error,41,,6,8,255,TPESampler,COMPLETE
4393,0.9670562439066022,2025-04-24 22:16:05.642801,2025-04-24 22:16:06.983557,0 days 00:00:01.340756,False,absolute_error,8,log2,7,12,140,TPESampler,COMPLETE
4394,0.3470259952245534,2025-04-24 22:16:06.333950,2025-04-24 22:16:09.321330,0 days 00:00:02.987380,True,squared_error,42,,1,4,536,TPESampler,COMPLETE
4395,0.35456146359824064,2025-04-24 22:16:07.280782,2025-04-24 22:16:11.973504,0 days 00:00:04.692722,True,squared_error,50,,1,5,725,TPESampler,COMPLETE
4396,0.4272464366263511,2025-04-24 22:16:08.107759,2025-04-24 22:16:12.041340,0 days 00:00:03.933581,True,squared_error,43,,2,2,761,TPESampler,COMPLETE
4397,0.3565334467357038,2025-04-24 22:16:09.567604,2025-04-24 22:16:42.518555,0 days 00:00:32.950951,True,absolute_error,50,,1,5,446,TPESampler,COMPLETE
4398,0.3439056295021052,2025-04-24 22:16:10.649755,2025-04-24 22:16:14.781413,0 days 00:00:04.131658,True,squared_error,45,,1,2,512,TPESampler,COMPLETE
4399,0.3426114550939486,2025-04-24 22:16:10.698407,2025-04-24 22:16:13.384770,0 days 00:00:02.686363,True,squared_error,44,,1,3,422,TPESampler,COMPLETE
4400,0.3461776625133093,2025-04-24 22:16:12.164656,2025-04-24 22:16:16.491563,0 days 00:00:04.326907,True,squared_error,50,,1,4,528,TPESampler,COMPLETE
4401,0.35391981028358455,2025-04-24 22:16:12.333199,2025-04-24 22:16:15.110068,0 days 00:00:02.776869,True,squared_error,50,,1,5,335,TPESampler,COMPLETE
4402,0.34657976112921235,2025-04-24 22:16:13.771168,2025-04-24 22:16:59.750124,0 days 00:00:45.978956,True,absolute_error,50,,1,3,676,TPESampler,COMPLETE
4403,0.42987627595459904,2025-04-24 22:16:15.040521,2025-04-24 22:16:18.502794,0 days 00:00:03.462273,True,squared_error,44,,2,3,460,TPESampler,COMPLETE
4404,0.34363975496137605,2025-04-24 22:16:15.494213,2025-04-24 22:16:20.168110,0 days 00:00:04.673897,True,squared_error,50,,1,2,564,TPESampler,COMPLETE
4405,0.3415426463633244,2025-04-24 22:16:16.912850,2025-04-24 22:16:20.939998,0 days 00:00:04.027148,True,squared_error,43,,1,3,586,TPESampler,COMPLETE
4406,0.3483070197905385,2025-04-24 22:16:18.765829,2025-04-24 22:16:22.934801,0 days 00:00:04.168972,True,squared_error,35,,1,4,620,TPESampler,COMPLETE
4407,0.34346198101060565,2025-04-24 22:16:20.422306,2025-04-24 22:16:24.308067,0 days 00:00:03.885761,True,squared_error,50,,1,2,430,TPESampler,COMPLETE
4408,0.34565923218173794,2025-04-24 22:16:21.242137,2025-04-24 22:16:25.420977,0 days 00:00:04.178840,True,squared_error,50,,1,4,593,TPESampler,COMPLETE
4409,0.4331808353662238,2025-04-24 22:16:23.186274,2025-04-24 22:16:25.201162,0 days 00:00:02.014888,True,squared_error,50,log2,1,4,449,TPESampler,COMPLETE
4410,0.3422590118233981,2025-04-24 22:16:24.566506,2025-04-24 22:16:30.068495,0 days 00:00:05.501989,True,squared_error,43,,1,3,650,TPESampler,COMPLETE
4411,0.4975534133192609,2025-04-24 22:16:25.639648,2025-04-24 22:16:28.041147,0 days 00:00:02.401499,True,squared_error,24,,4,6,341,TPESampler,COMPLETE
4412,0.8791501929286244,2025-04-24 22:16:25.961158,2025-04-24 22:16:28.034150,0 days 00:00:02.072992,True,squared_error,41,log2,2,3,654,TPESampler,COMPLETE
4413,0.35364606682068234,2025-04-24 22:16:28.226131,2025-04-24 22:16:33.102618,0 days 00:00:04.876487,True,squared_error,50,,1,5,640,TPESampler,COMPLETE
4414,0.42860073322847775,2025-04-24 22:16:28.277280,2025-04-24 22:16:32.248569,0 days 00:00:03.971289,True,squared_error,42,,2,4,573,TPESampler,COMPLETE
4415,0.42660820667729815,2025-04-24 22:16:30.316967,2025-04-24 22:16:34.772584,0 days 00:00:04.455617,True,squared_error,50,,2,4,781,TPESampler,COMPLETE
4416,0.6530708948089995,2025-04-24 22:16:32.499883,2025-04-24 22:16:34.671633,0 days 00:00:02.171750,True,squared_error,50,sqrt,2,5,458,TPESampler,COMPLETE
4417,0.34435883669506157,2025-04-24 22:16:33.368055,2025-04-24 22:16:38.328300,0 days 00:00:04.960245,True,squared_error,43,,1,2,662,TPESampler,COMPLETE
4418,0.3411339384703894,2025-04-24 22:16:34.880958,2025-04-24 22:16:39.129521,0 days 00:00:04.248563,True,squared_error,50,,1,3,583,TPESampler,COMPLETE
4419,0.42791579136514146,2025-04-24 22:16:35.049872,2025-04-24 22:16:38.541628,0 days 00:00:03.491756,True,squared_error,50,,2,3,646,TPESampler,COMPLETE
4420,0.5456446801172509,2025-04-24 22:16:37.884987,2025-04-24 22:16:39.459598,0 days 00:00:01.574611,False,squared_error,32,sqrt,2,20,532,TPESampler,COMPLETE
4421,0.3478476195329369,2025-04-24 22:16:38.628029,2025-04-24 22:16:44.464665,0 days 00:00:05.836636,True,squared_error,43,,1,4,739,TPESampler,COMPLETE
4422,0.44012797811494064,2025-04-24 22:16:38.973498,2025-04-24 22:16:41.850518,0 days 00:00:02.877020,True,squared_error,31,sqrt,1,6,516,TPESampler,COMPLETE
4423,0.4692977837677513,2025-04-24 22:16:39.545881,2025-04-24 22:16:42.456812,0 days 00:00:02.910931,True,squared_error,41,log2,1,3,744,TPESampler,COMPLETE
4424,0.9596506659658955,2025-04-24 22:16:39.859591,2025-04-24 22:16:41.379921,0 days 00:00:01.520330,True,absolute_error,11,sqrt,10,27,537,TPESampler,COMPLETE
4425,0.34215335504104055,2025-04-24 22:16:41.635531,2025-04-24 22:16:45.753597,0 days 00:00:04.118066,True,squared_error,50,,1,3,662,TPESampler,COMPLETE
4426,0.34425770789326776,2025-04-24 22:16:42.401860,2025-04-24 22:16:46.182146,0 days 00:00:03.780286,True,squared_error,44,,1,2,339,TPESampler,COMPLETE
4427,0.9665460159797481,2025-04-24 22:16:42.851083,2025-04-24 22:16:44.826262,0 days 00:00:01.975179,False,absolute_error,9,log2,6,2,750,TPESampler,COMPLETE
4428,0.34510508487446384,2025-04-24 22:16:42.965646,2025-04-24 22:16:45.006671,0 days 00:00:02.041025,True,squared_error,44,,1,2,254,TPESampler,COMPLETE
4429,0.5192201179887375,2025-04-24 22:16:44.714596,2025-04-24 22:16:46.657890,0 days 00:00:01.943294,True,squared_error,19,sqrt,1,3,432,TPESampler,COMPLETE
4430,0.6496545720571033,2025-04-24 22:16:45.266254,2025-04-24 22:16:47.749983,0 days 00:00:02.483729,True,squared_error,48,sqrt,2,2,509,TPESampler,COMPLETE
4431,0.9113947489114109,2025-04-24 22:16:45.368205,2025-04-24 22:16:47.217319,0 days 00:00:01.849114,False,squared_error,39,sqrt,15,2,832,TPESampler,COMPLETE
4432,0.343151806474537,2025-04-24 22:16:46.085466,2025-04-24 22:16:51.153344,0 days 00:00:05.067878,True,squared_error,50,,1,3,751,TPESampler,COMPLETE
4433,0.4966276386332475,2025-04-24 22:16:46.718769,2025-04-24 22:16:50.371901,0 days 00:00:03.653132,False,squared_error,5,,1,4,840,TPESampler,COMPLETE
4434,0.3455634999946675,2025-04-24 22:16:47.064706,2025-04-24 22:16:51.950414,0 days 00:00:04.885708,True,squared_error,36,,1,2,521,TPESampler,COMPLETE
4435,0.4295592371389564,2025-04-24 22:16:47.801551,2025-04-24 22:16:50.284076,0 days 00:00:02.482525,True,squared_error,43,,2,2,413,TPESampler,COMPLETE
4436,0.7854550429690224,2025-04-24 22:16:48.301549,2025-04-24 22:16:50.182765,0 days 00:00:01.881216,True,absolute_error,42,sqrt,3,42,378,TPESampler,COMPLETE
4437,0.3474345187916765,2025-04-24 22:16:50.423167,2025-04-24 22:16:54.724488,0 days 00:00:04.301321,True,squared_error,50,,1,4,504,TPESampler,COMPLETE
4438,0.3468678388249644,2025-04-24 22:16:50.609675,2025-04-24 22:16:54.495381,0 days 00:00:03.885706,True,squared_error,43,,1,4,490,TPESampler,COMPLETE
4439,0.6459090949501758,2025-04-24 22:16:50.782524,2025-04-24 22:16:53.616052,0 days 00:00:02.833528,True,squared_error,38,sqrt,2,2,608,TPESampler,COMPLETE
4440,0.9916534087338886,2025-04-24 22:16:51.730731,2025-04-24 22:16:53.507941,0 days 00:00:01.777210,True,absolute_error,40,log2,14,2,616,TPESampler,COMPLETE
4441,0.3548883815243011,2025-04-24 22:16:52.265749,2025-04-24 22:16:55.343251,0 days 00:00:03.077502,True,squared_error,37,,1,5,372,TPESampler,COMPLETE
4442,0.37168202341248796,2025-04-24 22:16:53.765024,2025-04-24 22:16:56.305144,0 days 00:00:02.540120,True,squared_error,50,sqrt,1,3,630,TPESampler,COMPLETE
4443,0.42787760266015373,2025-04-24 22:16:53.903424,2025-04-24 22:16:57.872052,0 days 00:00:03.968628,True,squared_error,43,,2,3,610,TPESampler,COMPLETE
4444,0.3453830911617031,2025-04-24 22:16:54.969256,2025-04-24 22:16:59.610099,0 days 00:00:04.640843,True,squared_error,50,,1,2,732,TPESampler,COMPLETE
4445,0.42751618314516354,2025-04-24 22:16:55.178666,2025-04-24 22:16:58.828530,0 days 00:00:03.649864,True,squared_error,50,,2,2,652,TPESampler,COMPLETE
4446,0.43247890617257656,2025-04-24 22:16:55.774284,2025-04-24 22:16:58.412313,0 days 00:00:02.638029,True,squared_error,50,,2,5,439,TPESampler,COMPLETE
4447,0.43456969226843656,2025-04-24 22:16:56.535628,2025-04-24 22:17:02.246210,0 days 00:00:05.710582,True,absolute_error,32,sqrt,1,6,580,TPESampler,COMPLETE
4448,0.3545089037106917,2025-04-24 22:16:58.123604,2025-04-24 22:17:02.364328,0 days 00:00:04.240724,True,squared_error,43,,1,5,660,TPESampler,COMPLETE
4449,0.3431130820580408,2025-04-24 22:16:58.776726,2025-04-24 22:17:02.644995,0 days 00:00:03.868269,True,squared_error,44,,1,3,555,TPESampler,COMPLETE
4450,0.34350501628929037,2025-04-24 22:16:59.338303,2025-04-24 22:17:03.709862,0 days 00:00:04.371559,True,squared_error,43,,1,2,579,TPESampler,COMPLETE
4451,0.3439719699556045,2025-04-24 22:16:59.960322,2025-04-24 22:17:03.945738,0 days 00:00:03.985416,True,squared_error,50,,1,2,488,TPESampler,COMPLETE
4452,0.9450699386322965,2025-04-24 22:17:00.274415,2025-04-24 22:17:02.177831,0 days 00:00:01.903416,True,absolute_error,36,sqrt,7,2,536,TPESampler,COMPLETE
4453,0.4508194159349608,2025-04-24 22:17:02.375486,2025-04-24 22:17:07.218138,0 days 00:00:04.842652,True,squared_error,50,,2,11,674,TPESampler,COMPLETE
4454,0.798128102048916,2025-04-24 22:17:02.546455,2025-04-24 22:17:04.703796,0 days 00:00:02.157341,False,squared_error,47,sqrt,5,38,135,TPESampler,COMPLETE
4455,0.4455041077980923,2025-04-24 22:17:02.682290,2025-04-24 22:17:06.331110,0 days 00:00:03.648820,True,squared_error,49,,2,8,590,TPESampler,COMPLETE
4456,0.34077414510091536,2025-04-24 22:17:03.023278,2025-04-24 22:17:07.921218,0 days 00:00:04.897940,True,squared_error,50,,1,3,590,TPESampler,COMPLETE
4457,0.3415022491893724,2025-04-24 22:17:04.388822,2025-04-24 22:17:09.089541,0 days 00:00:04.700719,True,squared_error,50,,1,3,614,TPESampler,COMPLETE
4458,0.37791085697330906,2025-04-24 22:17:04.572005,2025-04-24 22:17:08.093731,0 days 00:00:03.521726,True,squared_error,43,,1,8,478,TPESampler,COMPLETE
4459,0.42731509296282166,2025-04-24 22:17:05.041499,2025-04-24 22:17:09.960052,0 days 00:00:04.918553,True,squared_error,43,,2,3,672,TPESampler,COMPLETE
4460,0.3474741894146045,2025-04-24 22:17:06.659762,2025-04-24 22:17:09.535560,0 days 00:00:02.875798,True,squared_error,44,,1,4,341,TPESampler,COMPLETE
4461,0.8807279849954098,2025-04-24 22:17:07.531769,2025-04-24 22:17:09.767817,0 days 00:00:02.236048,True,squared_error,50,log2,2,5,697,TPESampler,COMPLETE
4462,0.42785249311467327,2025-04-24 22:17:08.177097,2025-04-24 22:17:12.302641,0 days 00:00:04.125544,True,squared_error,50,,2,4,589,TPESampler,COMPLETE
4463,0.5310554642817362,2025-04-24 22:17:08.378187,2025-04-24 22:17:10.256915,0 days 00:00:01.878728,False,squared_error,50,sqrt,2,8,282,TPESampler,COMPLETE
4464,0.9343667480156949,2025-04-24 22:17:09.487107,2025-04-24 22:17:11.772102,0 days 00:00:02.284995,False,squared_error,9,log2,13,19,612,TPESampler,COMPLETE
4465,0.3438990480333396,2025-04-24 22:17:09.966296,2025-04-24 22:17:15.484009,0 days 00:00:05.517713,True,squared_error,50,,1,2,520,TPESampler,COMPLETE
4466,0.34574648089089083,2025-04-24 22:17:10.465827,2025-04-24 22:17:14.819876,0 days 00:00:04.354049,True,squared_error,43,,1,4,595,TPESampler,COMPLETE
4467,0.3434822309723199,2025-04-24 22:17:10.645609,2025-04-24 22:17:16.048763,0 days 00:00:05.403154,True,squared_error,43,,1,2,557,TPESampler,COMPLETE
4468,0.3445315596116826,2025-04-24 22:17:11.011751,2025-04-24 22:17:15.543631,0 days 00:00:04.531880,True,squared_error,43,,1,2,497,TPESampler,COMPLETE
4469,0.38341435625249737,2025-04-24 22:17:12.461302,2025-04-24 22:17:14.730181,0 days 00:00:02.268879,True,squared_error,44,sqrt,1,4,329,TPESampler,COMPLETE
4470,0.8687519175077566,2025-04-24 22:17:12.606543,2025-04-24 22:17:14.703951,0 days 00:00:02.097408,True,squared_error,7,sqrt,5,6,386,TPESampler,COMPLETE
4471,0.3420463957268892,2025-04-24 22:17:14.936588,2025-04-24 22:17:19.655983,0 days 00:00:04.719395,True,squared_error,50,,1,3,402,TPESampler,COMPLETE
4472,0.93437446972764,2025-04-24 22:17:15.071019,2025-04-24 22:17:17.882717,0 days 00:00:02.811698,False,squared_error,23,log2,14,21,732,TPESampler,COMPLETE
4473,0.346840095678754,2025-04-24 22:17:15.168008,2025-04-24 22:18:03.713489,0 days 00:00:48.545481,True,absolute_error,41,,1,2,807,TPESampler,COMPLETE
4474,0.44145627443095076,2025-04-24 22:17:15.988079,2025-04-24 22:17:42.176983,0 days 00:00:26.188904,True,absolute_error,22,,2,2,827,TPESampler,COMPLETE
4475,0.34734166685969464,2025-04-24 22:17:16.584982,2025-04-24 22:17:20.622049,0 days 00:00:04.037067,True,squared_error,44,,1,4,638,TPESampler,COMPLETE
4476,0.4298309239484086,2025-04-24 22:17:16.145147,2025-04-24 22:17:20.338196,0 days 00:00:04.193049,True,squared_error,50,,2,3,426,TPESampler,COMPLETE
4477,0.34697202967702234,2025-04-24 22:17:18.188131,2025-04-24 22:17:21.765355,0 days 00:00:03.577224,True,squared_error,43,,1,4,461,TPESampler,COMPLETE
4478,0.34139830117735714,2025-04-24 22:17:19.901327,2025-04-24 22:17:24.316893,0 days 00:00:04.415566,True,squared_error,50,,1,3,579,TPESampler,COMPLETE
4479,0.3435002857244829,2025-04-24 22:17:20.622730,2025-04-24 22:17:25.795800,0 days 00:00:05.173070,True,squared_error,43,,1,3,729,TPESampler,COMPLETE
4480,0.4272137508910384,2025-04-24 22:17:20.982177,2025-04-24 22:17:23.769358,0 days 00:00:02.787181,True,squared_error,50,,2,2,543,TPESampler,COMPLETE
4481,0.35364606682068234,2025-04-24 22:17:22.163201,2025-04-24 22:17:25.956335,0 days 00:00:03.793134,True,squared_error,50,,1,5,640,TPESampler,COMPLETE
4482,0.3467249783610929,2025-04-24 22:17:24.002898,2025-04-24 22:17:26.421544,0 days 00:00:02.418646,True,squared_error,50,,1,4,399,TPESampler,COMPLETE
4483,0.3434742041021265,2025-04-24 22:17:24.565140,2025-04-24 22:17:28.818155,0 days 00:00:04.253015,True,squared_error,50,,1,2,525,TPESampler,COMPLETE
4484,0.45915602699828345,2025-04-24 22:17:26.021128,2025-04-24 22:17:44.102001,0 days 00:00:18.080873,True,absolute_error,50,,2,9,662,TPESampler,COMPLETE
4485,0.42759343327086047,2025-04-24 22:17:26.338755,2025-04-24 22:17:29.834003,0 days 00:00:03.495248,True,squared_error,50,,2,4,607,TPESampler,COMPLETE
4486,0.5450894353140249,2025-04-24 22:17:26.684773,2025-04-24 22:17:34.733161,0 days 00:00:08.048388,True,absolute_error,20,,5,2,565,TPESampler,COMPLETE
4487,0.3416434293458803,2025-04-24 22:17:29.060424,2025-04-24 22:17:32.475313,0 days 00:00:03.414889,True,squared_error,50,,1,3,489,TPESampler,COMPLETE
4488,0.34394713770158164,2025-04-24 22:17:30.171340,2025-04-24 22:17:34.013514,0 days 00:00:03.842174,True,squared_error,44,,1,2,579,TPESampler,COMPLETE
4489,0.34582063052011985,2025-04-24 22:17:32.713591,2025-04-24 22:17:36.343255,0 days 00:00:03.629664,True,squared_error,43,,1,4,593,TPESampler,COMPLETE
4490,0.3449079855761762,2025-04-24 22:17:34.248418,2025-04-24 22:17:39.044893,0 days 00:00:04.796475,True,squared_error,50,,1,2,764,TPESampler,COMPLETE
4491,0.353714908785715,2025-04-24 22:17:35.067925,2025-04-24 22:17:37.773993,0 days 00:00:02.706068,True,squared_error,50,,1,5,480,TPESampler,COMPLETE
4492,0.3469919166485369,2025-04-24 22:17:36.583263,2025-04-24 22:17:39.662263,0 days 00:00:03.079000,True,squared_error,50,,1,4,521,TPESampler,COMPLETE
4493,0.34869853706118537,2025-04-24 22:17:38.015583,2025-04-24 22:17:40.682512,0 days 00:00:02.666929,True,squared_error,36,,1,4,501,TPESampler,COMPLETE
4494,0.5917150788289489,2025-04-24 22:17:39.288123,2025-04-24 22:17:46.923920,0 days 00:00:07.635797,False,absolute_error,32,log2,1,36,888,TPESampler,COMPLETE
4495,0.3441637382892515,2025-04-24 22:17:39.963022,2025-04-24 22:17:43.929522,0 days 00:00:03.966500,True,squared_error,43,,1,2,650,TPESampler,COMPLETE
4496,0.6627081524526114,2025-04-24 22:17:41.002676,2025-04-24 22:17:42.178023,0 days 00:00:01.175347,True,squared_error,46,sqrt,2,2,198,TPESampler,COMPLETE
4497,0.34619110869292113,2025-04-24 22:17:42.372950,2025-04-24 22:17:46.027405,0 days 00:00:03.654455,True,squared_error,50,,1,4,580,TPESampler,COMPLETE
4498,0.4278550704758107,2025-04-24 22:17:42.437617,2025-04-24 22:17:45.832293,0 days 00:00:03.394676,True,squared_error,43,,2,2,589,TPESampler,COMPLETE
4499,0.42694720099637923,2025-04-24 22:17:44.169236,2025-04-24 22:17:47.332764,0 days 00:00:03.163528,True,squared_error,44,,2,3,530,TPESampler,COMPLETE
4500,0.4299473972314693,2025-04-24 22:17:44.466502,2025-04-24 22:17:47.292454,0 days 00:00:02.825952,True,squared_error,50,log2,1,2,582,TPESampler,COMPLETE
4501,0.42738038109108367,2025-04-24 22:17:46.106509,2025-04-24 22:17:50.735370,0 days 00:00:04.628861,True,squared_error,50,,2,2,673,TPESampler,COMPLETE
4502,0.4279373211809151,2025-04-24 22:17:46.300677,2025-04-24 22:17:52.820181,0 days 00:00:06.519504,False,squared_error,42,,1,3,599,TPESampler,COMPLETE
4503,0.5406215413167692,2025-04-24 22:17:47.187959,2025-04-24 22:17:51.176585,0 days 00:00:03.988626,True,squared_error,50,,5,2,557,TPESampler,COMPLETE
4504,0.34571901894062496,2025-04-24 22:17:47.866227,2025-04-24 22:17:53.083517,0 days 00:00:05.217290,True,squared_error,50,,1,4,606,TPESampler,COMPLETE
4505,0.42741723658477826,2025-04-24 22:17:48.102998,2025-04-24 22:17:53.052974,0 days 00:00:04.949976,True,squared_error,50,,2,4,725,TPESampler,COMPLETE
4506,0.4398260859606199,2025-04-24 22:17:51.272328,2025-04-24 22:17:54.934508,0 days 00:00:03.662180,True,squared_error,28,sqrt,1,2,689,TPESampler,COMPLETE
4507,0.3434665952140041,2025-04-24 22:17:51.500078,2025-04-24 22:17:55.917597,0 days 00:00:04.417519,True,squared_error,44,,1,3,482,TPESampler,COMPLETE
4508,0.361964925868856,2025-04-24 22:17:53.263630,2025-04-24 22:17:58.594041,0 days 00:00:05.330411,True,squared_error,50,,1,6,756,TPESampler,COMPLETE
4509,0.3476820725793062,2025-04-24 22:17:53.327535,2025-04-24 22:17:59.098833,0 days 00:00:05.771298,True,squared_error,50,,1,4,753,TPESampler,COMPLETE
4510,0.3426919332865961,2025-04-24 22:17:53.396294,2025-04-24 22:17:58.516069,0 days 00:00:05.119775,True,squared_error,50,,1,2,588,TPESampler,COMPLETE
4511,0.512562241501585,2025-04-24 22:17:55.301799,2025-04-24 22:18:23.860100,0 days 00:00:28.558301,False,absolute_error,8,,1,36,521,TPESampler,COMPLETE
4512,0.5199363474283712,2025-04-24 22:17:56.206132,2025-04-24 22:18:04.580478,0 days 00:00:08.374346,True,absolute_error,21,,4,7,584,TPESampler,COMPLETE
4513,0.427697463203545,2025-04-24 22:17:58.778103,2025-04-24 22:18:02.447750,0 days 00:00:03.669647,True,squared_error,43,,2,4,596,TPESampler,COMPLETE
4514,0.4485197894945356,2025-04-24 22:17:58.921420,2025-04-24 22:18:03.100674,0 days 00:00:04.179254,False,squared_error,47,,2,2,759,TPESampler,COMPLETE
4515,0.7768120510949138,2025-04-24 22:17:59.429679,2025-04-24 22:18:00.717190,0 days 00:00:01.287511,True,squared_error,7,sqrt,1,50,140,TPESampler,COMPLETE
4516,0.34122168590553703,2025-04-24 22:18:00.976839,2025-04-24 22:18:04.544159,0 days 00:00:03.567320,True,squared_error,50,,1,3,525,TPESampler,COMPLETE
4517,0.42906359365452856,2025-04-24 22:18:02.700058,2025-04-24 22:18:05.245248,0 days 00:00:02.545190,True,squared_error,44,,2,3,469,TPESampler,COMPLETE
4518,0.3431431255381416,2025-04-24 22:18:03.350428,2025-04-24 22:18:07.834116,0 days 00:00:04.483688,True,squared_error,50,,1,3,725,TPESampler,COMPLETE
4519,0.34092232288595226,2025-04-24 22:18:04.035179,2025-04-24 22:18:06.866992,0 days 00:00:02.831813,True,squared_error,50,,1,3,422,TPESampler,COMPLETE
4520,0.4322986788948748,2025-04-24 22:18:04.769511,2025-04-24 22:18:08.123902,0 days 00:00:03.354391,True,squared_error,50,log2,1,4,690,TPESampler,COMPLETE
4521,0.3414543832314912,2025-04-24 22:18:04.818394,2025-04-24 22:18:09.877646,0 days 00:00:05.059252,True,squared_error,50,,1,3,578,TPESampler,COMPLETE
4522,0.34621427283840583,2025-04-24 22:18:05.868722,2025-04-24 22:18:11.326871,0 days 00:00:05.458149,True,squared_error,36,,1,2,701,TPESampler,COMPLETE
