number,value,datetime_start,datetime_complete,duration,params_bootstrap,params_criterion,params_max_depth,params_max_features,params_min_samples_leaf,params_min_samples_split,params_n_estimators,system_attrs_auto:sampler,state
1980,0.39461627159420426,2025-04-24 21:42:25.285466,2025-04-24 21:42:29.099530,0 days 00:00:03.814064,True,squared_error,38,sqrt,1,2,790,TPESampler,COMPLETE
1981,0.3432276185744758,2025-04-24 21:42:25.383424,2025-04-24 21:42:30.168804,0 days 00:00:04.785380,True,squared_error,50,,1,3,744,TPESampler,COMPLETE
1982,0.34651828573928134,2025-04-24 21:42:26.721400,2025-04-24 21:42:30.103464,0 days 00:00:03.382064,True,squared_error,50,,1,4,566,TPESampler,COMPLETE
1983,0.3531999098103265,2025-04-24 21:42:27.299318,2025-04-24 21:42:31.140557,0 days 00:00:03.841239,True,squared_error,44,,1,5,610,TPESampler,COMPLETE
1984,0.3416454801115358,2025-04-24 21:42:27.547487,2025-04-24 21:42:31.703762,0 days 00:00:04.156275,True,squared_error,50,,1,3,568,TPESampler,COMPLETE
1985,0.4743451431168884,2025-04-24 21:42:28.763893,2025-04-24 21:42:30.348749,0 days 00:00:01.584856,True,squared_error,15,,3,33,230,TPESampler,COMPLETE
1986,0.342073361408527,2025-04-24 21:42:29.335013,2025-04-24 21:42:33.050422,0 days 00:00:03.715409,True,squared_error,43,,1,3,618,TPESampler,COMPLETE
1987,0.4358220630214613,2025-04-24 21:42:30.266300,2025-04-24 21:42:34.333622,0 days 00:00:04.067322,True,squared_error,41,,2,6,523,TPESampler,COMPLETE
1988,0.6627138540542764,2025-04-24 21:42:30.415945,2025-04-24 21:42:32.844529,0 days 00:00:02.428584,True,squared_error,24,sqrt,2,2,229,TPESampler,COMPLETE
1989,0.3465000174093542,2025-04-24 21:42:31.795805,2025-04-24 21:42:35.362402,0 days 00:00:03.566597,True,squared_error,50,,1,4,558,TPESampler,COMPLETE
1990,0.4310161198739306,2025-04-24 21:42:32.097066,2025-04-24 21:42:35.097583,0 days 00:00:03.000517,True,squared_error,50,,2,5,489,TPESampler,COMPLETE
1991,0.353697676079727,2025-04-24 21:42:32.161291,2025-04-24 21:42:36.378745,0 days 00:00:04.217454,True,squared_error,43,,1,5,621,TPESampler,COMPLETE
1992,0.34708064718719284,2025-04-24 21:42:33.107089,2025-04-24 21:42:37.175970,0 days 00:00:04.068881,True,squared_error,50,,1,4,639,TPESampler,COMPLETE
1993,0.44612948170474126,2025-04-24 21:42:33.413684,2025-04-24 21:42:44.178974,0 days 00:00:10.765290,True,absolute_error,48,,2,3,388,TPESampler,COMPLETE
1994,0.4275590154308394,2025-04-24 21:42:34.531981,2025-04-24 21:42:37.432281,0 days 00:00:02.900300,True,squared_error,50,,2,2,597,TPESampler,COMPLETE
1995,0.3429663642169366,2025-04-24 21:42:35.324807,2025-04-24 21:42:38.985146,0 days 00:00:03.660339,True,squared_error,43,,1,2,588,TPESampler,COMPLETE
1996,0.8930143626178004,2025-04-24 21:42:35.592617,2025-04-24 21:42:36.873560,0 days 00:00:01.280943,False,absolute_error,36,sqrt,7,33,257,TPESampler,COMPLETE
1997,0.3628011112576289,2025-04-24 21:42:36.629612,2025-04-24 21:43:06.056013,0 days 00:00:29.426401,True,absolute_error,39,,1,6,522,TPESampler,COMPLETE
1998,0.34075810833057363,2025-04-24 21:42:37.070439,2025-04-24 21:42:40.526808,0 days 00:00:03.456369,True,squared_error,50,,1,3,540,TPESampler,COMPLETE
1999,0.4244282801705255,2025-04-24 21:42:37.595265,2025-04-24 21:42:41.308614,0 days 00:00:03.713349,True,squared_error,50,,2,4,862,TPESampler,COMPLETE
2000,0.3453316890732777,2025-04-24 21:42:37.804264,2025-04-24 21:43:08.536821,0 days 00:00:30.732557,True,absolute_error,50,,1,3,538,TPESampler,COMPLETE
2001,0.3446894288832096,2025-04-24 21:42:39.173405,2025-04-24 21:42:42.490374,0 days 00:00:03.316969,True,squared_error,42,,1,2,555,TPESampler,COMPLETE
2002,0.3430282975471682,2025-04-24 21:42:40.724498,2025-04-24 21:42:44.510181,0 days 00:00:03.785683,True,squared_error,50,,1,2,610,TPESampler,COMPLETE
2003,0.4370434488518397,2025-04-24 21:42:41.536998,2025-04-24 21:42:43.978890,0 days 00:00:02.441892,True,squared_error,38,,2,6,639,TPESampler,COMPLETE
2004,0.4284391872727625,2025-04-24 21:42:42.685740,2025-04-24 21:42:45.929822,0 days 00:00:03.244082,True,squared_error,44,,2,3,627,TPESampler,COMPLETE
2005,0.34065308339660877,2025-04-24 21:42:44.182325,2025-04-24 21:42:47.547939,0 days 00:00:03.365614,True,squared_error,50,,1,3,597,TPESampler,COMPLETE
2006,0.9314348425040673,2025-04-24 21:42:44.452482,2025-04-24 21:42:47.027256,0 days 00:00:02.574774,True,absolute_error,20,sqrt,6,43,807,TPESampler,COMPLETE
2007,0.3477590365383585,2025-04-24 21:42:44.910922,2025-04-24 21:42:49.610167,0 days 00:00:04.699245,True,squared_error,42,,1,4,674,TPESampler,COMPLETE
2008,0.36913113133577496,2025-04-24 21:42:46.485471,2025-04-24 21:42:50.692609,0 days 00:00:04.207138,True,squared_error,49,,1,7,688,TPESampler,COMPLETE
2009,0.7379324097239028,2025-04-24 21:42:47.404219,2025-04-24 21:42:49.584710,0 days 00:00:02.180491,False,squared_error,14,log2,1,17,359,TPESampler,COMPLETE
2010,0.6284345106600934,2025-04-24 21:42:47.811207,2025-04-24 21:42:48.974434,0 days 00:00:01.163227,False,squared_error,42,,13,15,174,TPESampler,COMPLETE
2011,0.3465523736679653,2025-04-24 21:42:49.195281,2025-04-24 21:42:52.983704,0 days 00:00:03.788423,True,squared_error,44,,1,4,794,TPESampler,COMPLETE
2012,0.6051034159215131,2025-04-24 21:42:49.933344,2025-04-24 21:42:55.510152,0 days 00:00:05.576808,True,absolute_error,44,,11,2,849,TPESampler,COMPLETE
2013,0.3421483289669683,2025-04-24 21:42:50.062634,2025-04-24 21:42:54.937178,0 days 00:00:04.874544,True,squared_error,43,,1,3,657,TPESampler,COMPLETE
2014,0.3431025970764521,2025-04-24 21:42:51.133518,2025-04-24 21:42:56.912969,0 days 00:00:05.779451,True,squared_error,50,,1,3,723,TPESampler,COMPLETE
2015,0.427552336203093,2025-04-24 21:42:53.236224,2025-04-24 21:42:55.795393,0 days 00:00:02.559169,True,squared_error,49,,2,4,599,TPESampler,COMPLETE
2016,0.3449548658302285,2025-04-24 21:42:55.358620,2025-04-24 21:43:00.209394,0 days 00:00:04.850774,True,squared_error,43,,1,2,707,TPESampler,COMPLETE
2017,0.34760174382392967,2025-04-24 21:42:55.894813,2025-04-24 21:43:00.237673,0 days 00:00:04.342860,True,squared_error,43,,1,4,717,TPESampler,COMPLETE
2018,0.3472100156309475,2025-04-24 21:42:56.015551,2025-04-24 21:42:59.390466,0 days 00:00:03.374915,True,squared_error,50,,1,4,666,TPESampler,COMPLETE
2019,0.34786470213044574,2025-04-24 21:42:57.268816,2025-04-24 21:43:01.133804,0 days 00:00:03.864988,True,squared_error,50,,1,4,722,TPESampler,COMPLETE
2020,0.4329831646204162,2025-04-24 21:42:59.601995,2025-04-24 21:43:01.176572,0 days 00:00:01.574577,True,squared_error,50,log2,1,4,629,TPESampler,COMPLETE
2021,0.4004054147023777,2025-04-24 21:43:00.368081,2025-04-24 21:43:03.111221,0 days 00:00:02.743140,True,squared_error,42,sqrt,1,5,679,TPESampler,COMPLETE
2022,0.3447657161511286,2025-04-24 21:43:00.413097,2025-04-24 21:43:06.240119,0 days 00:00:05.827022,True,squared_error,50,,1,2,709,TPESampler,COMPLETE
2023,0.342077719121033,2025-04-24 21:43:01.380586,2025-04-24 21:43:04.580932,0 days 00:00:03.200346,True,squared_error,43,,1,3,576,TPESampler,COMPLETE
2024,0.5887763675470944,2025-04-24 21:43:01.532969,2025-04-24 21:43:04.407347,0 days 00:00:02.874378,True,squared_error,9,,13,3,808,TPESampler,COMPLETE
2025,0.9334127027963772,2025-04-24 21:43:03.324483,2025-04-24 21:43:04.304069,0 days 00:00:00.979586,True,squared_error,44,log2,6,34,162,TPESampler,COMPLETE
2026,0.34176184225244366,2025-04-24 21:43:04.502099,2025-04-24 21:43:08.411181,0 days 00:00:03.909082,True,squared_error,50,,1,3,566,TPESampler,COMPLETE
2027,0.4539387694565214,2025-04-24 21:43:04.631196,2025-04-24 21:43:30.958981,0 days 00:00:26.327785,True,absolute_error,34,,2,8,990,TPESampler,COMPLETE
2028,0.34343324463989183,2025-04-24 21:43:04.826611,2025-04-24 21:43:08.678675,0 days 00:00:03.852064,True,squared_error,50,,1,2,612,TPESampler,COMPLETE
2029,0.3416896045100361,2025-04-24 21:43:06.260697,2025-04-24 21:43:10.183985,0 days 00:00:03.923288,True,squared_error,50,,1,3,620,TPESampler,COMPLETE
2030,0.34102657563929745,2025-04-24 21:43:06.451197,2025-04-24 21:43:09.980289,0 days 00:00:03.529092,True,squared_error,50,,1,3,609,TPESampler,COMPLETE
2031,0.4276364440871579,2025-04-24 21:43:08.612724,2025-04-24 21:43:11.686507,0 days 00:00:03.073783,True,squared_error,50,,2,2,605,TPESampler,COMPLETE
2032,0.42775000330118623,2025-04-24 21:43:08.737535,2025-04-24 21:43:12.011708,0 days 00:00:03.274173,True,squared_error,50,,2,2,549,TPESampler,COMPLETE
2033,0.35478477981632145,2025-04-24 21:43:08.944789,2025-04-24 21:43:13.363974,0 days 00:00:04.419185,True,squared_error,40,,1,5,671,TPESampler,COMPLETE
2034,0.7902714883167048,2025-04-24 21:43:10.389478,2025-04-24 21:43:13.465428,0 days 00:00:03.075950,True,absolute_error,12,log2,1,6,625,TPESampler,COMPLETE
2035,0.3439626815759167,2025-04-24 21:43:10.435180,2025-04-24 21:43:14.598348,0 days 00:00:04.163168,True,squared_error,50,,1,2,632,TPESampler,COMPLETE
2036,0.34491135726077443,2025-04-24 21:43:11.887246,2025-04-24 21:43:15.633716,0 days 00:00:03.746470,True,squared_error,41,,1,2,664,TPESampler,COMPLETE
2037,0.341801144224038,2025-04-24 21:43:12.252826,2025-04-24 21:43:16.812383,0 days 00:00:04.559557,True,squared_error,42,,1,3,601,TPESampler,COMPLETE
2038,0.9148869652045963,2025-04-24 21:43:13.543959,2025-04-24 21:43:14.889196,0 days 00:00:01.345237,False,squared_error,18,log2,5,2,189,TPESampler,COMPLETE
2039,0.4367226562424943,2025-04-24 21:43:13.681917,2025-04-24 21:43:17.121934,0 days 00:00:03.440017,True,squared_error,44,,2,6,621,TPESampler,COMPLETE
2040,0.3442843509062549,2025-04-24 21:43:14.958647,2025-04-24 21:43:18.642804,0 days 00:00:03.684157,True,squared_error,41,,1,3,642,TPESampler,COMPLETE
2041,0.8791533485985853,2025-04-24 21:43:15.112670,2025-04-24 21:43:16.908167,0 days 00:00:01.795497,True,squared_error,49,log2,2,2,695,TPESampler,COMPLETE
2042,0.4285250700971592,2025-04-24 21:43:15.987238,2025-04-24 21:43:18.496297,0 days 00:00:02.509059,True,squared_error,50,,2,3,579,TPESampler,COMPLETE
2043,0.340836013791189,2025-04-24 21:43:17.003239,2025-04-24 21:43:21.211442,0 days 00:00:04.208203,True,squared_error,50,,1,3,547,TPESampler,COMPLETE
2044,0.4272277095009098,2025-04-24 21:43:17.154413,2025-04-24 21:43:21.062250,0 days 00:00:03.907837,True,squared_error,41,,2,3,670,TPESampler,COMPLETE
2045,0.8839663343471964,2025-04-24 21:43:17.379588,2025-04-24 21:43:19.424069,0 days 00:00:02.044481,True,squared_error,14,log2,2,2,230,TPESampler,COMPLETE
2046,0.36885284548955677,2025-04-24 21:43:18.719012,2025-04-24 21:43:22.597298,0 days 00:00:03.878286,True,squared_error,47,,1,7,643,TPESampler,COMPLETE
2047,0.6506148505311834,2025-04-24 21:43:19.031763,2025-04-24 21:43:20.753608,0 days 00:00:01.721845,True,squared_error,47,sqrt,2,5,505,TPESampler,COMPLETE
2048,0.3421547505482407,2025-04-24 21:43:19.688733,2025-04-24 21:43:23.849596,0 days 00:00:04.160863,True,squared_error,50,,1,3,661,TPESampler,COMPLETE
2049,0.41187756357428096,2025-04-24 21:43:20.956610,2025-04-24 21:43:23.156085,0 days 00:00:02.199475,True,squared_error,50,sqrt,1,8,821,TPESampler,COMPLETE
2050,0.42739545727461614,2025-04-24 21:43:21.286816,2025-04-24 21:43:25.137436,0 days 00:00:03.850620,True,squared_error,49,,2,4,693,TPESampler,COMPLETE
2051,0.4290327521561977,2025-04-24 21:43:21.491049,2025-04-24 21:43:26.283818,0 days 00:00:04.792769,False,squared_error,45,,1,3,595,TPESampler,COMPLETE
2052,0.3443878793089445,2025-04-24 21:43:22.817731,2025-04-24 21:43:27.625548,0 days 00:00:04.807817,True,squared_error,50,,1,2,788,TPESampler,COMPLETE
2053,0.36088915688560974,2025-04-24 21:43:23.397448,2025-04-24 21:43:26.415854,0 days 00:00:03.018406,True,squared_error,43,,1,6,558,TPESampler,COMPLETE
2054,0.9300626040922431,2025-04-24 21:43:24.059409,2025-04-24 21:43:25.891338,0 days 00:00:01.831929,False,absolute_error,41,log2,3,3,634,TPESampler,COMPLETE
2055,0.3421827729226547,2025-04-24 21:43:25.335086,2025-04-24 21:43:29.028355,0 days 00:00:03.693269,True,squared_error,43,,1,3,575,TPESampler,COMPLETE
2056,0.341944318201381,2025-04-24 21:43:26.249274,2025-04-24 21:43:29.847787,0 days 00:00:03.598513,True,squared_error,43,,1,3,578,TPESampler,COMPLETE
2057,0.4317982098312176,2025-04-24 21:43:26.581063,2025-04-24 21:43:29.480200,0 days 00:00:02.899137,True,squared_error,50,,2,5,568,TPESampler,COMPLETE
2058,0.3457400959461984,2025-04-24 21:43:26.659883,2025-04-24 21:43:30.052855,0 days 00:00:03.392972,True,squared_error,43,,1,4,592,TPESampler,COMPLETE
2059,0.3428952144499478,2025-04-24 21:43:27.814917,2025-04-24 21:43:31.485469,0 days 00:00:03.670552,True,squared_error,50,,1,2,584,TPESampler,COMPLETE
2060,0.42753913639009233,2025-04-24 21:43:29.241316,2025-04-24 21:43:33.794014,0 days 00:00:04.552698,True,squared_error,42,,2,2,724,TPESampler,COMPLETE
2061,0.9619869668035694,2025-04-24 21:43:29.728832,2025-04-24 21:43:31.382137,0 days 00:00:01.653305,False,absolute_error,50,sqrt,14,7,516,TPESampler,COMPLETE
2062,0.3532492738535156,2025-04-24 21:43:30.297167,2025-04-24 21:43:34.225325,0 days 00:00:03.928158,True,squared_error,46,,1,5,618,TPESampler,COMPLETE
2063,0.4567784232531165,2025-04-24 21:43:30.391668,2025-04-24 21:43:32.238831,0 days 00:00:01.847163,True,squared_error,33,,2,12,177,TPESampler,COMPLETE
2064,0.4888650022848565,2025-04-24 21:43:31.405244,2025-04-24 21:43:33.748850,0 days 00:00:02.343606,False,squared_error,7,,2,4,561,TPESampler,COMPLETE
2065,0.4313736265504773,2025-04-24 21:43:31.675666,2025-04-24 21:43:35.566882,0 days 00:00:03.891216,True,squared_error,50,,2,5,625,TPESampler,COMPLETE
2066,0.4275258212458562,2025-04-24 21:43:31.832370,2025-04-24 21:43:35.607307,0 days 00:00:03.774937,True,squared_error,50,,2,3,601,TPESampler,COMPLETE
2067,0.9528944128265746,2025-04-24 21:43:32.473435,2025-04-24 21:43:35.004417,0 days 00:00:02.530982,True,absolute_error,29,log2,3,37,858,TPESampler,COMPLETE
2068,0.34488231632450655,2025-04-24 21:43:33.976102,2025-04-24 21:43:37.750917,0 days 00:00:03.774815,True,squared_error,42,,1,2,564,TPESampler,COMPLETE
2069,0.3419126649380855,2025-04-24 21:43:34.023430,2025-04-24 21:43:38.009444,0 days 00:00:03.986014,True,squared_error,50,,1,3,564,TPESampler,COMPLETE
2070,0.35754245906395127,2025-04-24 21:43:34.485587,2025-04-24 21:44:11.492780,0 days 00:00:37.007193,True,absolute_error,42,,1,5,688,TPESampler,COMPLETE
2071,0.34739125530581955,2025-04-24 21:43:35.341396,2025-04-24 21:43:39.809313,0 days 00:00:04.467917,True,squared_error,50,,1,4,768,TPESampler,COMPLETE
2072,0.35456146359824064,2025-04-24 21:43:35.835958,2025-04-24 21:43:39.999348,0 days 00:00:04.163390,True,squared_error,50,,1,5,725,TPESampler,COMPLETE
2073,0.4279890308587409,2025-04-24 21:43:35.879598,2025-04-24 21:43:39.138175,0 days 00:00:03.258577,True,squared_error,50,,2,3,645,TPESampler,COMPLETE
2074,0.44654204708170686,2025-04-24 21:43:37.948180,2025-04-24 21:43:40.516308,0 days 00:00:02.568128,True,squared_error,46,,1,39,543,TPESampler,COMPLETE
2075,0.38378048455043184,2025-04-24 21:43:38.220902,2025-04-24 21:43:41.526072,0 days 00:00:03.305170,True,squared_error,50,,1,9,548,TPESampler,COMPLETE
2076,0.44610098666484344,2025-04-24 21:43:39.321460,2025-04-24 21:43:45.295426,0 days 00:00:05.973966,False,absolute_error,39,sqrt,1,45,428,TPESampler,COMPLETE
2077,0.3473967891264332,2025-04-24 21:43:40.065183,2025-04-24 21:43:44.274316,0 days 00:00:04.209133,True,squared_error,50,,1,4,679,TPESampler,COMPLETE
2078,0.6968496066024853,2025-04-24 21:43:40.265534,2025-04-24 21:43:42.043034,0 days 00:00:01.777500,False,absolute_error,20,log2,1,49,107,TPESampler,COMPLETE
2079,0.4579983030003284,2025-04-24 21:43:40.824021,2025-04-24 21:43:42.186341,0 days 00:00:01.362320,False,squared_error,46,log2,1,2,215,TPESampler,COMPLETE
2080,0.3466205004564958,2025-04-24 21:43:41.803262,2025-04-24 21:43:45.465947,0 days 00:00:03.662685,True,squared_error,42,,1,4,588,TPESampler,COMPLETE
2081,0.44351661984243407,2025-04-24 21:43:42.293298,2025-04-24 21:44:02.482178,0 days 00:00:20.188880,True,absolute_error,46,,2,3,641,TPESampler,COMPLETE
2082,0.42673337755510815,2025-04-24 21:43:42.461600,2025-04-24 21:43:45.913661,0 days 00:00:03.452061,True,squared_error,50,,2,3,774,TPESampler,COMPLETE
2083,0.47541783526910253,2025-04-24 21:43:44.474451,2025-04-24 21:44:24.564279,0 days 00:00:40.089828,True,absolute_error,14,,1,32,955,TPESampler,COMPLETE
2084,0.34181207273305825,2025-04-24 21:43:45.494581,2025-04-24 21:43:49.025625,0 days 00:00:03.531044,True,squared_error,50,,1,3,565,TPESampler,COMPLETE
2085,0.9434031917181023,2025-04-24 21:43:45.697685,2025-04-24 21:43:47.366825,0 days 00:00:01.669140,True,absolute_error,5,log2,2,2,565,TPESampler,COMPLETE
2086,0.9121247616351447,2025-04-24 21:43:46.147073,2025-04-24 21:43:47.232605,0 days 00:00:01.085532,True,absolute_error,7,sqrt,4,6,104,TPESampler,COMPLETE
2087,0.3465410767402798,2025-04-24 21:43:47.455654,2025-04-24 21:43:50.912115,0 days 00:00:03.456461,True,squared_error,50,,1,4,624,TPESampler,COMPLETE
2088,0.6288104892058941,2025-04-24 21:43:47.602713,2025-04-24 21:43:54.307504,0 days 00:00:06.704791,False,absolute_error,12,sqrt,1,2,566,TPESampler,COMPLETE
2089,0.3436353106849082,2025-04-24 21:43:49.216147,2025-04-24 21:43:52.717329,0 days 00:00:03.501182,True,squared_error,50,,1,2,575,TPESampler,COMPLETE
2090,0.6539591922573705,2025-04-24 21:43:51.111569,2025-04-24 21:43:53.825214,0 days 00:00:02.713645,True,absolute_error,49,sqrt,2,3,546,TPESampler,COMPLETE
2091,0.36115256272252966,2025-04-24 21:43:52.909063,2025-04-24 21:43:55.648152,0 days 00:00:02.739089,True,squared_error,43,,1,6,490,TPESampler,COMPLETE
2092,0.34623922173265226,2025-04-24 21:43:54.025485,2025-04-24 21:43:57.536736,0 days 00:00:03.511251,True,squared_error,50,,1,4,615,TPESampler,COMPLETE
2093,0.4485164418399577,2025-04-24 21:43:54.503446,2025-04-24 21:43:58.803721,0 days 00:00:04.300275,False,squared_error,49,,2,3,854,TPESampler,COMPLETE
2094,0.46189556840146345,2025-04-24 21:43:55.847052,2025-04-24 21:43:57.571980,0 days 00:00:01.724928,True,squared_error,43,log2,1,3,629,TPESampler,COMPLETE
2095,0.34286409915956756,2025-04-24 21:43:57.724043,2025-04-24 21:44:01.365675,0 days 00:00:03.641632,True,squared_error,44,,1,3,577,TPESampler,COMPLETE
2096,0.34065308339660877,2025-04-24 21:43:57.768782,2025-04-24 21:44:01.458899,0 days 00:00:03.690117,True,squared_error,50,,1,3,597,TPESampler,COMPLETE
2097,0.9058820669718717,2025-04-24 21:43:59.061003,2025-04-24 21:44:00.066980,0 days 00:00:01.005977,True,squared_error,26,log2,3,7,350,TPESampler,COMPLETE
2098,0.34326496032856224,2025-04-24 21:44:00.265894,2025-04-24 21:44:03.496346,0 days 00:00:03.230452,True,squared_error,50,,1,2,531,TPESampler,COMPLETE
2099,0.4280360632790575,2025-04-24 21:44:01.536078,2025-04-24 21:44:04.369175,0 days 00:00:02.833097,True,squared_error,43,,2,3,582,TPESampler,COMPLETE
2100,0.34085331898688426,2025-04-24 21:44:01.665612,2025-04-24 21:44:05.058459,0 days 00:00:03.392847,True,squared_error,50,,1,3,529,TPESampler,COMPLETE
2101,0.42888573303276206,2025-04-24 21:44:02.739048,2025-04-24 21:44:05.240625,0 days 00:00:02.501577,True,squared_error,40,,2,2,473,TPESampler,COMPLETE
2102,0.4306109820314818,2025-04-24 21:44:03.713632,2025-04-24 21:44:06.091683,0 days 00:00:02.378051,True,squared_error,50,,2,5,511,TPESampler,COMPLETE
2103,0.34295282455485104,2025-04-24 21:44:04.567907,2025-04-24 21:44:07.519467,0 days 00:00:02.951560,True,squared_error,43,,1,3,491,TPESampler,COMPLETE
2104,0.345807444071314,2025-04-24 21:44:05.383148,2025-04-24 21:44:08.800017,0 days 00:00:03.416869,True,squared_error,44,,1,4,585,TPESampler,COMPLETE
2105,0.5466359330088816,2025-04-24 21:44:05.460240,2025-04-24 21:44:11.117310,0 days 00:00:05.657070,False,absolute_error,32,sqrt,2,2,695,TPESampler,COMPLETE
2106,0.3443573765461251,2025-04-24 21:44:06.500258,2025-04-24 21:44:09.553388,0 days 00:00:03.053130,True,squared_error,42,,1,2,553,TPESampler,COMPLETE
2107,0.3432456079671244,2025-04-24 21:44:07.834788,2025-04-24 21:44:11.504511,0 days 00:00:03.669723,True,squared_error,50,,1,2,528,TPESampler,COMPLETE
2108,0.7389203888380074,2025-04-24 21:44:09.024895,2025-04-24 21:44:10.588707,0 days 00:00:01.563812,True,squared_error,15,log2,1,42,681,TPESampler,COMPLETE
2109,0.3457656772235498,2025-04-24 21:44:09.794897,2025-04-24 21:44:12.993495,0 days 00:00:03.198598,True,squared_error,34,,1,2,487,TPESampler,COMPLETE
2110,0.35249661749181194,2025-04-24 21:44:10.795184,2025-04-24 21:44:14.304269,0 days 00:00:03.509085,True,squared_error,50,,1,5,532,TPESampler,COMPLETE
2111,0.959827687387603,2025-04-24 21:44:11.342962,2025-04-24 21:44:13.580909,0 days 00:00:02.237947,True,absolute_error,7,sqrt,11,2,973,TPESampler,COMPLETE
2112,0.34261702608840505,2025-04-24 21:44:11.910404,2025-04-24 21:44:15.359590,0 days 00:00:03.449186,True,squared_error,42,,1,3,459,TPESampler,COMPLETE
2113,0.46727087139879303,2025-04-24 21:44:11.972112,2025-04-24 21:44:13.925238,0 days 00:00:01.953126,False,squared_error,18,,3,7,241,TPESampler,COMPLETE
2114,0.36209025944943796,2025-04-24 21:44:13.195112,2025-04-24 21:44:16.759533,0 days 00:00:03.564421,True,squared_error,50,,1,6,671,TPESampler,COMPLETE
2115,0.3410197476914786,2025-04-24 21:44:13.825023,2025-04-24 21:44:17.385477,0 days 00:00:03.560454,True,squared_error,50,,1,3,588,TPESampler,COMPLETE
2116,0.3432010517891816,2025-04-24 21:44:14.272418,2025-04-24 21:44:17.849555,0 days 00:00:03.577137,True,squared_error,50,,1,2,532,TPESampler,COMPLETE
2117,0.34961886761209027,2025-04-24 21:44:14.576070,2025-04-24 21:44:41.678869,0 days 00:00:27.102799,True,absolute_error,43,,1,2,504,TPESampler,COMPLETE
2118,0.34593768511614137,2025-04-24 21:44:15.670520,2025-04-24 21:44:18.098339,0 days 00:00:02.427819,True,squared_error,49,,1,4,447,TPESampler,COMPLETE
2119,0.3458417592070083,2025-04-24 21:44:16.960104,2025-04-24 21:44:20.071705,0 days 00:00:03.111601,True,squared_error,50,,1,4,541,TPESampler,COMPLETE
2120,0.34714175738070374,2025-04-24 21:44:17.629448,2025-04-24 21:44:20.714730,0 days 00:00:03.085282,True,squared_error,41,,1,4,520,TPESampler,COMPLETE
