number,value,datetime_start,datetime_complete,duration,params_bootstrap,params_criterion,params_max_depth,params_max_features,params_min_samples_leaf,params_min_samples_split,params_n_estimators,system_attrs_auto:sampler,state
1839,0.34660787889563477,2025-04-24 21:40:25.148293,2025-04-24 21:40:28.280026,0 days 00:00:03.131733,True,squared_error,50,,1,4,561,TPESampler,COMPLETE
1840,0.4123449698391129,2025-04-24 21:40:25.368556,2025-04-24 21:40:29.085140,0 days 00:00:03.716584,False,squared_error,50,,1,4,497,TPESampler,COMPLETE
1841,0.34730275399380733,2025-04-24 21:40:25.550025,2025-04-24 21:40:28.978115,0 days 00:00:03.428090,True,squared_error,42,,1,4,624,TPESampler,COMPLETE
1842,0.3436775635641847,2025-04-24 21:40:28.336389,2025-04-24 21:40:32.557347,0 days 00:00:04.220958,True,squared_error,50,,1,2,522,TPESampler,COMPLETE
1843,0.3420960030327911,2025-04-24 21:40:28.526551,2025-04-24 21:40:31.851823,0 days 00:00:03.325272,True,squared_error,43,,1,3,542,TPESampler,COMPLETE
1844,0.34278620083170913,2025-04-24 21:40:29.198564,2025-04-24 21:40:34.373018,0 days 00:00:05.174454,True,squared_error,44,,1,3,868,TPESampler,COMPLETE
1845,0.5884681598299164,2025-04-24 21:40:29.370468,2025-04-24 21:40:32.126529,0 days 00:00:02.756061,True,squared_error,46,,13,22,855,TPESampler,COMPLETE
1846,0.3426417087635523,2025-04-24 21:40:32.047968,2025-04-24 21:40:35.708778,0 days 00:00:03.660810,True,squared_error,50,,1,2,593,TPESampler,COMPLETE
1847,0.4268565947686442,2025-04-24 21:40:32.337704,2025-04-24 21:40:35.012936,0 days 00:00:02.675232,True,squared_error,41,,2,3,536,TPESampler,COMPLETE
1848,0.3418375780937524,2025-04-24 21:40:32.960813,2025-04-24 21:40:36.297983,0 days 00:00:03.337170,True,squared_error,50,,1,3,479,TPESampler,COMPLETE
1849,0.3424089503388866,2025-04-24 21:40:34.565394,2025-04-24 21:40:38.540543,0 days 00:00:03.975149,True,squared_error,50,,1,3,687,TPESampler,COMPLETE
1850,0.4276422618729243,2025-04-24 21:40:35.212750,2025-04-24 21:40:38.130004,0 days 00:00:02.917254,True,squared_error,50,,2,4,650,TPESampler,COMPLETE
1851,0.4260106898036723,2025-04-24 21:40:35.950831,2025-04-24 21:40:38.589115,0 days 00:00:02.638284,True,squared_error,50,log2,1,2,781,TPESampler,COMPLETE
1852,0.353025345609316,2025-04-24 21:40:36.517062,2025-04-24 21:40:39.524938,0 days 00:00:03.007876,True,squared_error,43,,1,5,528,TPESampler,COMPLETE
1853,0.34102985908072986,2025-04-24 21:40:38.323018,2025-04-24 21:40:40.957440,0 days 00:00:02.634422,True,squared_error,50,,1,3,418,TPESampler,COMPLETE
1854,0.3471181738504021,2025-04-24 21:40:38.793489,2025-04-24 21:40:41.214033,0 days 00:00:02.420544,True,squared_error,39,,1,4,387,TPESampler,COMPLETE
1855,0.5365707151929643,2025-04-24 21:40:38.846722,2025-04-24 21:40:43.394134,0 days 00:00:04.547412,True,absolute_error,48,log2,1,45,704,TPESampler,COMPLETE
1856,0.3785130828938193,2025-04-24 21:40:39.926521,2025-04-24 21:41:16.708539,0 days 00:00:36.782018,False,absolute_error,32,,1,9,423,TPESampler,COMPLETE
1857,0.5246867216662247,2025-04-24 21:40:41.151821,2025-04-24 21:41:34.428188,0 days 00:00:53.276367,False,absolute_error,12,,1,34,750,TPESampler,COMPLETE
1858,0.35484441846048836,2025-04-24 21:40:41.461143,2025-04-24 21:40:43.202531,0 days 00:00:01.741388,True,squared_error,50,,1,5,228,TPESampler,COMPLETE
1859,0.44329742113318604,2025-04-24 21:40:43.387667,2025-04-24 21:41:09.896731,0 days 00:00:26.509064,True,absolute_error,43,,2,2,764,TPESampler,COMPLETE
1860,0.34721214023078534,2025-04-24 21:40:43.602738,2025-04-24 21:40:46.738459,0 days 00:00:03.135721,True,squared_error,50,,1,4,636,TPESampler,COMPLETE
1861,0.4294563779543889,2025-04-24 21:40:44.524916,2025-04-24 21:40:46.552756,0 days 00:00:02.027840,True,squared_error,50,,2,3,455,TPESampler,COMPLETE
1862,0.3458728808952608,2025-04-24 21:40:46.746964,2025-04-24 21:41:37.678287,0 days 00:00:50.931323,True,absolute_error,50,,1,3,772,TPESampler,COMPLETE
1863,0.4785707793500376,2025-04-24 21:40:46.948437,2025-04-24 21:40:49.490616,0 days 00:00:02.542179,True,squared_error,10,,3,26,917,TPESampler,COMPLETE
1864,0.42746250020874016,2025-04-24 21:40:49.671307,2025-04-24 21:40:52.518966,0 days 00:00:02.847659,True,squared_error,45,,2,2,737,TPESampler,COMPLETE
1865,0.9872643217071442,2025-04-24 21:40:52.714434,2025-04-24 21:40:53.916013,0 days 00:00:01.201579,True,absolute_error,17,log2,10,44,496,TPESampler,COMPLETE
1866,0.7821018835397086,2025-04-24 21:40:54.059972,2025-04-24 21:40:56.367196,0 days 00:00:02.307224,True,absolute_error,37,sqrt,3,5,700,TPESampler,COMPLETE
1867,0.42992010358847743,2025-04-24 21:40:54.108234,2025-04-24 21:40:56.672153,0 days 00:00:02.563919,True,squared_error,50,,2,3,459,TPESampler,COMPLETE
1868,0.4270749446271299,2025-04-24 21:40:56.554791,2025-04-24 21:40:59.416438,0 days 00:00:02.861647,True,squared_error,50,,2,3,538,TPESampler,COMPLETE
1869,0.9164894920249849,2025-04-24 21:40:56.900787,2025-04-24 21:40:58.784072,0 days 00:00:01.883285,True,squared_error,19,log2,4,21,926,TPESampler,COMPLETE
1870,0.34311781230074695,2025-04-24 21:40:58.981602,2025-04-24 21:41:02.006018,0 days 00:00:03.024416,True,squared_error,43,,1,3,508,TPESampler,COMPLETE
1871,0.343356046883984,2025-04-24 21:40:59.662676,2025-04-24 21:41:03.274836,0 days 00:00:03.612160,True,squared_error,50,,1,2,577,TPESampler,COMPLETE
1872,0.3469626521325709,2025-04-24 21:41:02.191390,2025-04-24 21:41:06.103477,0 days 00:00:03.912087,True,squared_error,50,,1,4,786,TPESampler,COMPLETE
1873,0.34525828379442575,2025-04-24 21:41:03.462450,2025-04-24 21:41:05.688475,0 days 00:00:02.226025,True,squared_error,50,,1,2,345,TPESampler,COMPLETE
1874,0.3423744475853711,2025-04-24 21:41:05.987722,2025-04-24 21:41:08.544832,0 days 00:00:02.557110,True,squared_error,42,,1,3,438,TPESampler,COMPLETE
1875,0.5168480897400871,2025-04-24 21:41:06.332661,2025-04-24 21:41:13.737043,0 days 00:00:07.404382,True,absolute_error,38,,4,47,637,TPESampler,COMPLETE
1876,0.35374189641577564,2025-04-24 21:41:08.727466,2025-04-24 21:41:11.358632,0 days 00:00:02.631166,True,squared_error,43,,1,5,454,TPESampler,COMPLETE
1877,0.342276121067727,2025-04-24 21:41:10.094080,2025-04-24 21:41:12.932313,0 days 00:00:02.838233,True,squared_error,50,,1,3,496,TPESampler,COMPLETE
1878,0.42851211339696765,2025-04-24 21:41:11.677578,2025-04-24 21:41:14.895150,0 days 00:00:03.217572,True,squared_error,50,,2,2,637,TPESampler,COMPLETE
1879,0.3472233021541197,2025-04-24 21:41:13.117225,2025-04-24 21:41:15.857047,0 days 00:00:02.739822,True,squared_error,42,,1,4,577,TPESampler,COMPLETE
1880,0.42739053761219,2025-04-24 21:41:13.925696,2025-04-24 21:41:17.812694,0 days 00:00:03.886998,False,squared_error,40,,1,2,504,TPESampler,COMPLETE
1881,0.34117815559129305,2025-04-24 21:41:15.077274,2025-04-24 21:41:18.408299,0 days 00:00:03.331025,True,squared_error,50,,1,3,542,TPESampler,COMPLETE
1882,0.34470340835912366,2025-04-24 21:41:16.054999,2025-04-24 21:41:20.014947,0 days 00:00:03.959948,True,squared_error,50,,1,2,772,TPESampler,COMPLETE
1883,0.34165928753335095,2025-04-24 21:41:16.897898,2025-04-24 21:41:20.414406,0 days 00:00:03.516508,True,squared_error,50,,1,3,517,TPESampler,COMPLETE
1884,0.35283248413684093,2025-04-24 21:41:18.008747,2025-04-24 21:41:22.152856,0 days 00:00:04.144109,True,squared_error,50,,1,5,559,TPESampler,COMPLETE
1885,0.4513915401687503,2025-04-24 21:41:18.595863,2025-04-24 21:41:20.653786,0 days 00:00:02.057923,True,squared_error,48,log2,1,5,663,TPESampler,COMPLETE
1886,0.4791014346597755,2025-04-24 21:41:20.210223,2025-04-24 21:41:28.201826,0 days 00:00:07.991603,False,absolute_error,48,log2,1,16,671,TPESampler,COMPLETE
1887,0.9116324810440738,2025-04-24 21:41:20.623110,2025-04-24 21:41:22.036651,0 days 00:00:01.413541,False,squared_error,36,log2,5,2,603,TPESampler,COMPLETE
1888,0.347935460523565,2025-04-24 21:41:20.970775,2025-04-24 21:41:39.730162,0 days 00:00:18.759387,True,absolute_error,49,,1,2,332,TPESampler,COMPLETE
1889,0.34754105577947736,2025-04-24 21:41:22.285410,2025-04-24 21:41:26.240455,0 days 00:00:03.955045,True,squared_error,50,,1,4,689,TPESampler,COMPLETE
1890,0.3425413429859776,2025-04-24 21:41:22.340607,2025-04-24 21:41:24.921162,0 days 00:00:02.580555,True,squared_error,42,,1,3,391,TPESampler,COMPLETE
1891,0.36148337814703224,2025-04-24 21:41:25.110186,2025-04-24 21:41:27.866862,0 days 00:00:02.756676,True,squared_error,50,,1,6,487,TPESampler,COMPLETE
1892,0.3440400618768156,2025-04-24 21:41:26.441666,2025-04-24 21:41:30.430495,0 days 00:00:03.988829,True,squared_error,42,,1,3,728,TPESampler,COMPLETE
1893,0.3565962856088258,2025-04-24 21:41:28.066408,2025-04-24 21:41:31.088298,0 days 00:00:03.021890,True,squared_error,32,,1,5,625,TPESampler,COMPLETE
1894,0.34143580942525276,2025-04-24 21:41:28.403408,2025-04-24 21:41:30.836522,0 days 00:00:02.433114,True,squared_error,50,,1,3,431,TPESampler,COMPLETE
1895,0.344059387219614,2025-04-24 21:41:30.621102,2025-04-24 21:41:35.046537,0 days 00:00:04.425435,True,squared_error,43,,1,2,656,TPESampler,COMPLETE
1896,0.4446947246438314,2025-04-24 21:41:31.031181,2025-04-24 21:41:32.798370,0 days 00:00:01.767189,True,squared_error,45,,2,7,322,TPESampler,COMPLETE
1897,0.8812169803052348,2025-04-24 21:41:31.335973,2025-04-24 21:41:32.546514,0 days 00:00:01.210541,True,squared_error,45,log2,2,2,337,TPESampler,COMPLETE
1898,0.8840599797919425,2025-04-24 21:41:32.741026,2025-04-24 21:41:33.902738,0 days 00:00:01.161712,True,squared_error,24,sqrt,6,6,410,TPESampler,COMPLETE
1899,0.43235017970527573,2025-04-24 21:41:32.989684,2025-04-24 21:41:34.727912,0 days 00:00:01.738228,True,squared_error,49,log2,1,2,527,TPESampler,COMPLETE
1900,0.3457018698273261,2025-04-24 21:41:34.093215,2025-04-24 21:41:37.671281,0 days 00:00:03.578066,True,squared_error,50,,1,4,608,TPESampler,COMPLETE
1901,0.3457109940547002,2025-04-24 21:41:34.679491,2025-04-24 21:41:36.976249,0 days 00:00:02.296758,True,squared_error,32,,1,2,327,TPESampler,COMPLETE
1902,0.3953963335949654,2025-04-24 21:41:34.972892,2025-04-24 21:41:36.908674,0 days 00:00:01.935782,True,squared_error,40,sqrt,1,2,508,TPESampler,COMPLETE
1903,0.43770644446627227,2025-04-24 21:41:35.317115,2025-04-24 21:41:36.785149,0 days 00:00:01.468034,True,squared_error,49,log2,1,4,457,TPESampler,COMPLETE
1904,0.34100020437240747,2025-04-24 21:41:37.055421,2025-04-24 21:41:40.470258,0 days 00:00:03.414837,True,squared_error,50,,1,3,451,TPESampler,COMPLETE
1905,0.42864300977310665,2025-04-24 21:41:37.071218,2025-04-24 21:41:40.875512,0 days 00:00:03.804294,True,squared_error,50,,2,3,482,TPESampler,COMPLETE
1906,0.9497729814282151,2025-04-24 21:41:37.178552,2025-04-24 21:41:39.886117,0 days 00:00:02.707565,False,absolute_error,14,log2,4,49,924,TPESampler,COMPLETE
1907,0.34357129543043513,2025-04-24 21:41:38.145675,2025-04-24 21:41:42.133557,0 days 00:00:03.987882,True,squared_error,50,,1,2,523,TPESampler,COMPLETE
1908,0.3447199070070267,2025-04-24 21:41:38.119852,2025-04-24 21:41:42.266307,0 days 00:00:04.146455,True,squared_error,44,,1,2,504,TPESampler,COMPLETE
1909,0.35361481354505325,2025-04-24 21:41:39.937731,2025-04-24 21:41:43.598626,0 days 00:00:03.660895,True,squared_error,43,,1,5,619,TPESampler,COMPLETE
1910,0.42770219024333167,2025-04-24 21:41:40.087125,2025-04-24 21:41:43.919132,0 days 00:00:03.832007,True,squared_error,44,,2,4,710,TPESampler,COMPLETE
1911,0.4276948888961663,2025-04-24 21:41:40.835789,2025-04-24 21:41:43.854034,0 days 00:00:03.018245,True,squared_error,50,,2,3,596,TPESampler,COMPLETE
1912,0.42979530387557385,2025-04-24 21:41:41.176637,2025-04-24 21:41:43.098686,0 days 00:00:01.922049,True,squared_error,42,,2,2,319,TPESampler,COMPLETE
1913,0.34355279077542694,2025-04-24 21:41:42.341511,2025-04-24 21:41:45.466274,0 days 00:00:03.124763,True,squared_error,43,,1,2,430,TPESampler,COMPLETE
1914,0.42732116876676807,2025-04-24 21:41:42.478746,2025-04-24 21:41:45.653233,0 days 00:00:03.174487,True,squared_error,41,,2,4,521,TPESampler,COMPLETE
1915,0.34708269352754184,2025-04-24 21:41:43.453238,2025-04-24 21:41:47.285741,0 days 00:00:03.832503,True,squared_error,42,,1,4,618,TPESampler,COMPLETE
1916,0.8069832668158046,2025-04-24 21:41:43.808314,2025-04-24 21:41:45.590252,0 days 00:00:01.781938,False,absolute_error,7,sqrt,4,4,354,TPESampler,COMPLETE
1917,0.34341806270447767,2025-04-24 21:41:44.124041,2025-04-24 21:41:48.179288,0 days 00:00:04.055247,True,squared_error,43,,1,2,580,TPESampler,COMPLETE
1918,0.35326608299716394,2025-04-24 21:41:44.199270,2025-04-24 21:41:47.288790,0 days 00:00:03.089520,True,squared_error,50,,1,5,393,TPESampler,COMPLETE
1919,0.3438758118217128,2025-04-24 21:41:45.654481,2025-04-24 21:41:49.306183,0 days 00:00:03.651702,True,squared_error,50,,1,2,518,TPESampler,COMPLETE
1920,0.42802320063563487,2025-04-24 21:41:45.876090,2025-04-24 21:41:49.226074,0 days 00:00:03.349984,True,squared_error,50,,2,4,611,TPESampler,COMPLETE
1921,0.34594374363076946,2025-04-24 21:41:45.951586,2025-04-24 21:41:49.628428,0 days 00:00:03.676842,True,squared_error,50,,1,4,550,TPESampler,COMPLETE
1922,0.36977828526692624,2025-04-24 21:41:47.497380,2025-04-24 21:41:50.302953,0 days 00:00:02.805573,True,squared_error,50,sqrt,1,2,637,TPESampler,COMPLETE
1923,0.34721214023078534,2025-04-24 21:41:47.517405,2025-04-24 21:41:51.398930,0 days 00:00:03.881525,True,squared_error,50,,1,4,636,TPESampler,COMPLETE
1924,0.41094702584416737,2025-04-24 21:41:48.545526,2025-04-24 21:41:53.052021,0 days 00:00:04.506495,False,squared_error,43,,1,4,692,TPESampler,COMPLETE
1925,0.3473018790761979,2025-04-24 21:41:49.391385,2025-04-24 21:41:51.751277,0 days 00:00:02.359892,True,squared_error,44,,1,4,336,TPESampler,COMPLETE
1926,0.35420278854033904,2025-04-24 21:41:49.512172,2025-04-24 21:41:52.011657,0 days 00:00:02.499485,True,squared_error,41,,1,5,357,TPESampler,COMPLETE
1927,0.344086346118705,2025-04-24 21:41:49.818416,2025-04-24 21:41:52.946562,0 days 00:00:03.128146,True,squared_error,31,,1,3,530,TPESampler,COMPLETE
1928,0.34415716171313304,2025-04-24 21:41:50.558555,2025-04-24 21:41:53.885442,0 days 00:00:03.326887,True,squared_error,44,,1,2,513,TPESampler,COMPLETE
1929,0.34541684105335807,2025-04-24 21:41:51.763432,2025-04-24 21:41:54.134384,0 days 00:00:02.370952,True,squared_error,50,,1,2,263,TPESampler,COMPLETE
1930,0.426933852693662,2025-04-24 21:41:51.978039,2025-04-24 21:41:54.978395,0 days 00:00:03.000356,True,squared_error,41,,2,2,530,TPESampler,COMPLETE
1931,0.9718104833609477,2025-04-24 21:41:52.320090,2025-04-24 21:41:53.860680,0 days 00:00:01.540590,True,absolute_error,31,log2,5,15,301,TPESampler,COMPLETE
1932,0.3445295793783391,2025-04-24 21:41:53.131407,2025-04-24 21:41:58.383534,0 days 00:00:05.252127,True,squared_error,50,,1,2,703,TPESampler,COMPLETE
1933,0.9179614138780775,2025-04-24 21:41:53.261020,2025-04-24 21:41:55.353035,0 days 00:00:02.092015,False,squared_error,10,log2,7,18,810,TPESampler,COMPLETE
1934,0.3432478140142203,2025-04-24 21:41:54.169743,2025-04-24 21:41:57.719101,0 days 00:00:03.549358,True,squared_error,43,,1,3,496,TPESampler,COMPLETE
1935,0.34726441802237873,2025-04-24 21:41:54.357111,2025-04-24 21:41:59.305730,0 days 00:00:04.948619,True,squared_error,43,,1,4,692,TPESampler,COMPLETE
1936,0.3443097091068259,2025-04-24 21:41:54.546171,2025-04-24 21:41:59.334400,0 days 00:00:04.788229,True,squared_error,41,,1,3,704,TPESampler,COMPLETE
1937,0.42734197167921767,2025-04-24 21:41:55.462769,2025-04-24 21:41:58.335908,0 days 00:00:02.873139,True,squared_error,44,,2,2,513,TPESampler,COMPLETE
1938,0.4265741404742056,2025-04-24 21:41:55.669070,2025-04-24 21:41:57.469038,0 days 00:00:01.799968,True,squared_error,49,,2,3,259,TPESampler,COMPLETE
1939,0.34663195040382866,2025-04-24 21:41:57.662033,2025-04-24 21:42:01.101323,0 days 00:00:03.439290,True,squared_error,43,,1,4,557,TPESampler,COMPLETE
1940,0.3433601908573153,2025-04-24 21:41:57.957182,2025-04-24 21:42:02.032111,0 days 00:00:04.074929,True,squared_error,50,,1,2,560,TPESampler,COMPLETE
1941,0.36138961051040297,2025-04-24 21:41:58.621321,2025-04-24 21:42:02.116998,0 days 00:00:03.495677,True,squared_error,50,,1,6,467,TPESampler,COMPLETE
1942,0.34721975129151833,2025-04-24 21:41:58.821550,2025-04-24 21:42:02.215988,0 days 00:00:03.394438,True,squared_error,42,,1,4,449,TPESampler,COMPLETE
1943,0.79506522514021,2025-04-24 21:41:59.654811,2025-04-24 21:42:00.856154,0 days 00:00:01.201343,True,absolute_error,36,sqrt,3,35,152,TPESampler,COMPLETE
1944,0.35313514751544095,2025-04-24 21:41:59.711765,2025-04-24 21:42:04.568960,0 days 00:00:04.857195,True,squared_error,50,,1,5,853,TPESampler,COMPLETE
1945,0.4310621156935606,2025-04-24 21:42:01.057280,2025-04-24 21:42:05.262602,0 days 00:00:04.205322,False,squared_error,50,,1,2,473,TPESampler,COMPLETE
1946,0.8787042801338655,2025-04-24 21:42:01.345105,2025-04-24 21:42:03.289219,0 days 00:00:01.944114,True,squared_error,48,log2,2,4,675,TPESampler,COMPLETE
1947,0.3522884186758917,2025-04-24 21:42:02.264432,2025-04-24 21:42:05.856102,0 days 00:00:03.591670,True,squared_error,50,,1,5,538,TPESampler,COMPLETE
1948,0.4283249119279836,2025-04-24 21:42:02.401448,2025-04-24 21:42:06.002146,0 days 00:00:03.600698,True,squared_error,44,,2,3,631,TPESampler,COMPLETE
1949,0.34263833252603915,2025-04-24 21:42:02.640378,2025-04-24 21:42:06.643273,0 days 00:00:04.002895,True,squared_error,42,,1,3,568,TPESampler,COMPLETE
1950,0.5468258338488535,2025-04-24 21:42:03.750500,2025-04-24 21:42:06.746618,0 days 00:00:02.996118,False,squared_error,7,,1,39,936,TPESampler,COMPLETE
1951,0.42735648937964194,2025-04-24 21:42:04.768065,2025-04-24 21:42:08.679717,0 days 00:00:03.911652,True,squared_error,50,,2,3,719,TPESampler,COMPLETE
1952,0.9318474711476907,2025-04-24 21:42:05.552215,2025-04-24 21:42:07.807179,0 days 00:00:02.254964,False,absolute_error,49,log2,3,44,694,TPESampler,COMPLETE
1953,0.3873385951888328,2025-04-24 21:42:06.069196,2025-04-24 21:42:08.214935,0 days 00:00:02.145739,True,squared_error,50,sqrt,1,5,570,TPESampler,COMPLETE
1954,0.34091962842992524,2025-04-24 21:42:06.385231,2025-04-24 21:42:10.365844,0 days 00:00:03.980613,True,squared_error,50,,1,3,599,TPESampler,COMPLETE
1955,0.4294569177518588,2025-04-24 21:42:06.868965,2025-04-24 21:42:09.758098,0 days 00:00:02.889133,True,squared_error,50,,2,3,431,TPESampler,COMPLETE
1956,0.4514985781521951,2025-04-24 21:42:06.980796,2025-04-24 21:42:09.831442,0 days 00:00:02.850646,True,squared_error,40,,2,10,474,TPESampler,COMPLETE
1957,0.3416257657669495,2025-04-24 21:42:08.313447,2025-04-24 21:42:11.269482,0 days 00:00:02.956035,True,squared_error,50,,1,3,409,TPESampler,COMPLETE
1958,0.5029325694720134,2025-04-24 21:42:08.426316,2025-04-24 21:42:12.122433,0 days 00:00:03.696117,True,absolute_error,11,,3,3,175,TPESampler,COMPLETE
1959,0.3422260282351976,2025-04-24 21:42:09.228034,2025-04-24 21:42:13.975046,0 days 00:00:04.747012,True,squared_error,50,,1,3,641,TPESampler,COMPLETE
1960,0.5889686808827465,2025-04-24 21:42:09.948655,2025-04-24 21:42:17.907546,0 days 00:00:07.958891,False,absolute_error,31,,7,5,466,TPESampler,COMPLETE
1961,0.34398471012817006,2025-04-24 21:42:10.183196,2025-04-24 21:42:15.840893,0 days 00:00:05.657697,True,squared_error,43,,1,2,788,TPESampler,COMPLETE
1962,0.34304759446212063,2025-04-24 21:42:10.993909,2025-04-24 21:42:16.421763,0 days 00:00:05.427854,True,squared_error,45,,1,3,758,TPESampler,COMPLETE
1963,0.4822801521776107,2025-04-24 21:42:12.066278,2025-04-24 21:42:13.643075,0 days 00:00:01.576797,False,squared_error,46,log2,1,9,681,TPESampler,COMPLETE
1964,0.5308208229314136,2025-04-24 21:42:12.522111,2025-04-24 21:42:14.683138,0 days 00:00:02.161027,False,squared_error,42,,2,23,382,TPESampler,COMPLETE
1965,0.5678572753500482,2025-04-24 21:42:13.829393,2025-04-24 21:42:27.058269,0 days 00:00:13.228876,False,absolute_error,26,,3,19,390,TPESampler,COMPLETE
1966,0.9352351508645053,2025-04-24 21:42:14.192106,2025-04-24 21:42:15.637947,0 days 00:00:01.445841,True,squared_error,14,log2,8,8,381,TPESampler,COMPLETE
1967,0.3435851769940302,2025-04-24 21:42:14.896812,2025-04-24 21:42:19.283285,0 days 00:00:04.386473,True,squared_error,44,,1,3,674,TPESampler,COMPLETE
1968,0.34195892911682524,2025-04-24 21:42:15.864568,2025-04-24 21:42:20.054758,0 days 00:00:04.190190,True,squared_error,50,,1,3,629,TPESampler,COMPLETE
1969,0.941704752094513,2025-04-24 21:42:16.045551,2025-04-24 21:42:17.900113,0 days 00:00:01.854562,False,absolute_error,5,log2,3,5,713,TPESampler,COMPLETE
1970,0.34433149124994833,2025-04-24 21:42:16.656282,2025-04-24 21:42:21.030265,0 days 00:00:04.373983,True,squared_error,45,,1,2,674,TPESampler,COMPLETE
1971,0.34454604350825946,2025-04-24 21:42:18.057944,2025-04-24 21:42:22.257399,0 days 00:00:04.199455,True,squared_error,50,,1,2,694,TPESampler,COMPLETE
1972,0.3428078426641624,2025-04-24 21:42:18.100733,2025-04-24 21:42:22.120040,0 days 00:00:04.019307,True,squared_error,50,,1,3,713,TPESampler,COMPLETE
1973,0.49889235087727823,2025-04-24 21:42:19.479572,2025-04-24 21:42:22.674055,0 days 00:00:03.194483,True,squared_error,30,,4,6,655,TPESampler,COMPLETE
1974,0.3542833875353261,2025-04-24 21:42:20.482761,2025-04-24 21:42:24.619735,0 days 00:00:04.136974,True,squared_error,50,,1,5,697,TPESampler,COMPLETE
1975,0.34571901894062496,2025-04-24 21:42:21.441463,2025-04-24 21:42:24.971799,0 days 00:00:03.530336,True,squared_error,50,,1,4,606,TPESampler,COMPLETE
1976,0.4285994186610302,2025-04-24 21:42:22.314943,2025-04-24 21:42:25.053017,0 days 00:00:02.738074,True,squared_error,44,,2,3,573,TPESampler,COMPLETE
1977,0.3417439757077381,2025-04-24 21:42:22.496573,2025-04-24 21:42:26.019741,0 days 00:00:03.523168,True,squared_error,50,,1,3,575,TPESampler,COMPLETE
1978,0.3442422457229321,2025-04-24 21:42:22.954690,2025-04-24 21:42:27.254991,0 days 00:00:04.300301,True,squared_error,50,,1,2,634,TPESampler,COMPLETE
1979,0.4270710251914219,2025-04-24 21:42:24.811520,2025-04-24 21:42:28.216054,0 days 00:00:03.404534,True,squared_error,50,,2,2,658,TPESampler,COMPLETE
