number,value,datetime_start,datetime_complete,duration,params_bootstrap,params_criterion,params_max_depth,params_max_features,params_min_samples_leaf,params_min_samples_split,params_n_estimators,system_attrs_auto:sampler,state
3533,0.6542410956669684,2025-04-24 22:03:36.004368,2025-04-24 22:03:39.469448,0 days 00:00:03.465080,False,absolute_error,35,sqrt,3,29,534,TPESampler,COMPLETE
3534,0.38381930849480095,2025-04-24 22:03:36.939254,2025-04-24 22:03:39.625322,0 days 00:00:02.686068,True,squared_error,41,sqrt,1,3,664,TPESampler,COMPLETE
3535,0.6753041824143159,2025-04-24 22:03:37.087253,2025-04-24 22:03:39.304501,0 days 00:00:02.217248,False,squared_error,27,,10,16,353,TPESampler,COMPLETE
3536,0.42874403768935,2025-04-24 22:03:38.132771,2025-04-24 22:03:41.798111,0 days 00:00:03.665340,True,squared_error,50,,2,4,568,TPESampler,COMPLETE
3537,0.8904055856064129,2025-04-24 22:03:39.576112,2025-04-24 22:03:41.485640,0 days 00:00:01.909528,True,squared_error,46,sqrt,6,2,266,TPESampler,COMPLETE
3538,0.7378864887297133,2025-04-24 22:03:39.856695,2025-04-24 22:03:41.799608,0 days 00:00:01.942913,False,squared_error,40,sqrt,4,2,317,TPESampler,COMPLETE
3539,0.4274119951808764,2025-04-24 22:03:39.957356,2025-04-24 22:03:45.256331,0 days 00:00:05.298975,False,squared_error,40,,1,2,621,TPESampler,COMPLETE
3540,0.3525941404253956,2025-04-24 22:03:39.992162,2025-04-24 22:03:44.498285,0 days 00:00:04.506123,True,squared_error,50,,1,5,531,TPESampler,COMPLETE
3541,0.346570031416562,2025-04-24 22:03:40.172185,2025-04-24 22:04:21.321540,0 days 00:00:41.149355,True,absolute_error,50,,1,3,733,TPESampler,COMPLETE
3542,0.34674693267014595,2025-04-24 22:03:42.041908,2025-04-24 22:03:45.382312,0 days 00:00:03.340404,True,squared_error,43,,1,4,459,TPESampler,COMPLETE
3543,0.42867943466934216,2025-04-24 22:03:42.135058,2025-04-24 22:03:45.357452,0 days 00:00:03.222394,True,squared_error,44,,2,3,572,TPESampler,COMPLETE
3544,0.34173786978441173,2025-04-24 22:03:42.191010,2025-04-24 22:03:45.985195,0 days 00:00:03.794185,True,squared_error,43,,1,3,581,TPESampler,COMPLETE
3545,0.3546314216996341,2025-04-24 22:03:44.722882,2025-04-24 22:03:48.493220,0 days 00:00:03.770338,True,squared_error,42,,1,5,661,TPESampler,COMPLETE
3546,0.34608326302024595,2025-04-24 22:03:45.550996,2025-04-24 22:04:11.835816,0 days 00:00:26.284820,True,absolute_error,50,,1,3,465,TPESampler,COMPLETE
3547,0.34326718753096286,2025-04-24 22:03:45.697133,2025-04-24 22:03:49.319547,0 days 00:00:03.622414,True,squared_error,43,,1,2,429,TPESampler,COMPLETE
3548,0.34435747241625114,2025-04-24 22:03:45.860588,2025-04-24 22:03:50.275002,0 days 00:00:04.414414,True,squared_error,50,,1,2,637,TPESampler,COMPLETE
3549,0.4485061129142958,2025-04-24 22:03:46.346722,2025-04-24 22:03:50.878823,0 days 00:00:04.532101,False,squared_error,36,,2,2,704,TPESampler,COMPLETE
3550,0.3418080688400328,2025-04-24 22:03:48.716340,2025-04-24 22:03:52.528527,0 days 00:00:03.812187,True,squared_error,50,,1,3,624,TPESampler,COMPLETE
3551,0.4109153600393498,2025-04-24 22:03:49.622307,2025-04-24 22:03:53.415776,0 days 00:00:03.793469,False,squared_error,43,,1,4,553,TPESampler,COMPLETE
3552,0.3473242732761719,2025-04-24 22:03:50.527363,2025-04-24 22:03:54.787139,0 days 00:00:04.259776,True,squared_error,43,,1,4,711,TPESampler,COMPLETE
3553,0.34747342602219256,2025-04-24 22:03:51.631639,2025-04-24 22:03:54.793452,0 days 00:00:03.161813,True,squared_error,50,,1,4,502,TPESampler,COMPLETE
3554,0.3408979486589745,2025-04-24 22:03:52.757875,2025-04-24 22:03:56.559443,0 days 00:00:03.801568,True,squared_error,50,,1,3,600,TPESampler,COMPLETE
3555,0.42809754178294795,2025-04-24 22:03:53.706558,2025-04-24 22:03:56.838517,0 days 00:00:03.131959,True,squared_error,44,,2,4,581,TPESampler,COMPLETE
3556,0.342662390950102,2025-04-24 22:03:55.039294,2025-04-24 22:03:59.524628,0 days 00:00:04.485334,True,squared_error,50,,1,3,777,TPESampler,COMPLETE
3557,0.494511117965296,2025-04-24 22:03:55.042832,2025-04-24 22:04:05.551579,0 days 00:00:10.508747,False,absolute_error,23,sqrt,1,4,916,TPESampler,COMPLETE
3558,0.4273373874901382,2025-04-24 22:03:56.783384,2025-04-24 22:03:59.697220,0 days 00:00:02.913836,True,squared_error,50,,2,4,675,TPESampler,COMPLETE
3559,0.3537863709666101,2025-04-24 22:03:57.081403,2025-04-24 22:04:00.634145,0 days 00:00:03.552742,True,squared_error,50,,1,5,664,TPESampler,COMPLETE
3560,0.3446111045598911,2025-04-24 22:03:59.810675,2025-04-24 22:04:03.492345,0 days 00:00:03.681670,True,squared_error,42,,1,2,559,TPESampler,COMPLETE
3561,0.5750126823339545,2025-04-24 22:03:59.968418,2025-04-24 22:04:01.184156,0 days 00:00:01.215738,False,squared_error,27,log2,1,5,320,TPESampler,COMPLETE
3562,0.34382853827995674,2025-04-24 22:04:01.020334,2025-04-24 22:04:04.940051,0 days 00:00:03.919717,True,squared_error,43,,1,2,615,TPESampler,COMPLETE
3563,0.4295852587607377,2025-04-24 22:04:01.425435,2025-04-24 22:04:03.590506,0 days 00:00:02.165071,True,squared_error,50,,2,3,420,TPESampler,COMPLETE
3564,0.34318418015640856,2025-04-24 22:04:03.753219,2025-04-24 22:04:06.721333,0 days 00:00:02.968114,True,squared_error,44,,1,3,430,TPESampler,COMPLETE
3565,0.3691233642137586,2025-04-24 22:04:03.886573,2025-04-24 22:04:07.959480,0 days 00:00:04.072907,True,squared_error,50,,1,7,748,TPESampler,COMPLETE
3566,0.4187514653457021,2025-04-24 22:04:05.193125,2025-04-24 22:04:06.682839,0 days 00:00:01.489714,True,squared_error,35,sqrt,1,2,254,TPESampler,COMPLETE
3567,0.3412174264776339,2025-04-24 22:04:05.794820,2025-04-24 22:04:09.409249,0 days 00:00:03.614429,True,squared_error,50,,1,3,550,TPESampler,COMPLETE
3568,0.34869910339545973,2025-04-24 22:04:06.900424,2025-04-24 22:04:09.962390,0 days 00:00:03.061966,True,squared_error,34,,1,4,490,TPESampler,COMPLETE
3569,0.4281578805305783,2025-04-24 22:04:06.953438,2025-04-24 22:04:09.887387,0 days 00:00:02.933949,True,squared_error,50,,2,2,500,TPESampler,COMPLETE
3570,0.34827042035533284,2025-04-24 22:04:08.295058,2025-04-24 22:04:10.834455,0 days 00:00:02.539397,True,squared_error,42,,1,4,347,TPESampler,COMPLETE
3571,0.34598551688820145,2025-04-24 22:04:09.640902,2025-04-24 22:04:13.123432,0 days 00:00:03.482530,True,squared_error,43,,1,4,551,TPESampler,COMPLETE
3572,0.34396502386467426,2025-04-24 22:04:10.104561,2025-04-24 22:04:14.838806,0 days 00:00:04.734245,True,squared_error,50,,1,2,647,TPESampler,COMPLETE
3573,0.3418156858756224,2025-04-24 22:04:10.150516,2025-04-24 22:04:14.585350,0 days 00:00:04.434834,True,squared_error,42,,1,3,602,TPESampler,COMPLETE
3574,0.3434779530638732,2025-04-24 22:04:11.119779,2025-04-24 22:04:15.969341,0 days 00:00:04.849562,True,squared_error,44,,1,3,791,TPESampler,COMPLETE
3575,0.4271128343362594,2025-04-24 22:04:12.174705,2025-04-24 22:04:15.519666,0 days 00:00:03.344961,True,squared_error,42,,2,3,664,TPESampler,COMPLETE
3576,0.5196476241271771,2025-04-24 22:04:13.365867,2025-04-24 22:04:14.672952,0 days 00:00:01.307085,False,squared_error,22,,6,2,182,TPESampler,COMPLETE
3577,0.3431969731608959,2025-04-24 22:04:14.955312,2025-04-24 22:04:20.203100,0 days 00:00:05.247788,True,squared_error,44,,1,3,653,TPESampler,COMPLETE
3578,0.34629340601826963,2025-04-24 22:04:14.998497,2025-04-24 22:04:18.818623,0 days 00:00:03.820126,True,squared_error,50,,1,4,460,TPESampler,COMPLETE
3579,0.34706554661895217,2025-04-24 22:04:15.121001,2025-04-24 22:04:20.195834,0 days 00:00:05.074833,True,squared_error,50,,1,4,633,TPESampler,COMPLETE
3580,0.8799596372800723,2025-04-24 22:04:16.060082,2025-04-24 22:04:18.358196,0 days 00:00:02.298114,True,squared_error,43,log2,2,4,578,TPESampler,COMPLETE
3581,0.3844760781087404,2025-04-24 22:04:16.377771,2025-04-24 22:04:20.078469,0 days 00:00:03.700698,True,squared_error,42,,1,9,599,TPESampler,COMPLETE
3582,0.3982235956651561,2025-04-24 22:04:18.594324,2025-04-24 22:04:20.601794,0 days 00:00:02.007470,True,squared_error,49,sqrt,1,6,598,TPESampler,COMPLETE
3583,0.3438361315730659,2025-04-24 22:04:19.062556,2025-04-24 22:04:21.521508,0 days 00:00:02.458952,True,squared_error,44,,1,2,287,TPESampler,COMPLETE
3584,0.9839530999333391,2025-04-24 22:04:20.347682,2025-04-24 22:04:22.263743,0 days 00:00:01.916061,False,absolute_error,48,log2,13,9,695,TPESampler,COMPLETE
3585,0.3415610617924918,2025-04-24 22:04:20.545796,2025-04-24 22:04:24.715795,0 days 00:00:04.169999,True,squared_error,50,,1,3,520,TPESampler,COMPLETE
3586,0.3435273723963822,2025-04-24 22:04:20.616815,2025-04-24 22:04:24.825563,0 days 00:00:04.208748,True,squared_error,43,,1,2,490,TPESampler,COMPLETE
3587,0.3463572276854308,2025-04-24 22:04:21.065372,2025-04-24 22:04:26.187588,0 days 00:00:05.122216,True,squared_error,50,,1,4,620,TPESampler,COMPLETE
3588,0.4278402358040495,2025-04-24 22:04:21.693513,2025-04-24 22:04:25.863552,0 days 00:00:04.170039,True,squared_error,50,,2,2,647,TPESampler,COMPLETE
3589,0.42742584513848136,2025-04-24 22:04:21.874565,2025-04-24 22:04:25.978299,0 days 00:00:04.103734,True,squared_error,43,,2,2,676,TPESampler,COMPLETE
3590,0.346008498614689,2025-04-24 22:04:22.782636,2025-04-24 22:04:25.920954,0 days 00:00:03.138318,True,squared_error,50,,1,4,419,TPESampler,COMPLETE
3591,0.4282048473605624,2025-04-24 22:04:24.948695,2025-04-24 22:04:29.099390,0 days 00:00:04.150695,True,squared_error,50,,2,3,640,TPESampler,COMPLETE
3592,0.34375938579152976,2025-04-24 22:04:25.106509,2025-04-24 22:04:30.012032,0 days 00:00:04.905523,True,squared_error,42,,1,3,716,TPESampler,COMPLETE
3593,0.42845542725096614,2025-04-24 22:04:26.179519,2025-04-24 22:04:29.876633,0 days 00:00:03.697114,True,squared_error,50,,2,3,576,TPESampler,COMPLETE
3594,0.34396502386467426,2025-04-24 22:04:26.238276,2025-04-24 22:04:31.624120,0 days 00:00:05.385844,True,squared_error,50,,1,2,647,TPESampler,COMPLETE
3595,0.34168214098422106,2025-04-24 22:04:26.768876,2025-04-24 22:04:31.217228,0 days 00:00:04.448352,True,squared_error,43,,1,3,610,TPESampler,COMPLETE
3596,0.37023930173857555,2025-04-24 22:04:26.881312,2025-04-24 22:04:29.316569,0 days 00:00:02.435257,True,squared_error,50,sqrt,1,3,577,TPESampler,COMPLETE
3597,0.3540187189239602,2025-04-24 22:04:29.356729,2025-04-24 22:04:34.086155,0 days 00:00:04.729426,True,squared_error,50,,1,5,703,TPESampler,COMPLETE
3598,0.8775352194916408,2025-04-24 22:04:29.564295,2025-04-24 22:04:31.520022,0 days 00:00:01.955727,True,squared_error,27,log2,2,2,439,TPESampler,COMPLETE
3599,0.34633018633361845,2025-04-24 22:04:30.297528,2025-04-24 22:04:34.431642,0 days 00:00:04.134114,True,squared_error,43,,1,4,441,TPESampler,COMPLETE
3600,0.8653724277932996,2025-04-24 22:04:30.622023,2025-04-24 22:04:31.865233,0 days 00:00:01.243210,False,squared_error,5,log2,1,6,129,TPESampler,COMPLETE
3601,0.3606827605655516,2025-04-24 22:04:31.516380,2025-04-24 22:04:35.504146,0 days 00:00:03.987766,True,squared_error,50,,1,6,549,TPESampler,COMPLETE
3602,0.3430866978882167,2025-04-24 22:04:32.098594,2025-04-24 22:04:36.223707,0 days 00:00:04.125113,True,squared_error,43,,1,3,494,TPESampler,COMPLETE
3603,0.3443806347757534,2025-04-24 22:04:32.228657,2025-04-24 22:04:36.448218,0 days 00:00:04.219561,True,squared_error,42,,1,2,522,TPESampler,COMPLETE
3604,0.43114663065057585,2025-04-24 22:04:32.321767,2025-04-24 22:04:35.530126,0 days 00:00:03.208359,True,squared_error,43,,2,5,559,TPESampler,COMPLETE
3605,0.593876998500891,2025-04-24 22:04:34.317128,2025-04-24 22:04:42.644232,0 days 00:00:08.327104,False,absolute_error,18,,8,2,593,TPESampler,COMPLETE
3606,0.41232777787334157,2025-04-24 22:04:34.680504,2025-04-24 22:04:39.124057,0 days 00:00:04.443553,False,squared_error,50,,1,4,570,TPESampler,COMPLETE
3607,0.6346028716447174,2025-04-24 22:04:35.687610,2025-04-24 22:04:37.782411,0 days 00:00:02.094801,False,squared_error,38,,8,47,351,TPESampler,COMPLETE
3608,0.34208223684190797,2025-04-24 22:04:35.730350,2025-04-24 22:04:40.268266,0 days 00:00:04.537916,True,squared_error,44,,1,3,595,TPESampler,COMPLETE
3609,0.34142762222678996,2025-04-24 22:04:36.468127,2025-04-24 22:04:39.926808,0 days 00:00:03.458681,True,squared_error,50,,1,3,459,TPESampler,COMPLETE
3610,0.5886652628252614,2025-04-24 22:04:36.800939,2025-04-24 22:04:39.426555,0 days 00:00:02.625616,True,squared_error,48,,13,5,777,TPESampler,COMPLETE
3611,0.42794287176309753,2025-04-24 22:04:38.073747,2025-04-24 22:04:40.390216,0 days 00:00:02.316469,True,squared_error,50,,2,3,495,TPESampler,COMPLETE
3612,0.5706368515181428,2025-04-24 22:04:39.369983,2025-04-24 22:04:54.462260,0 days 00:00:15.092277,False,absolute_error,33,,4,2,596,TPESampler,COMPLETE
3613,0.3457454613219754,2025-04-24 22:04:39.751064,2025-04-24 22:04:43.912784,0 days 00:00:04.161720,True,squared_error,50,,1,4,609,TPESampler,COMPLETE
3614,0.36365884104243484,2025-04-24 22:04:40.518382,2025-04-24 22:04:45.185285,0 days 00:00:04.666903,True,squared_error,36,,1,6,732,TPESampler,COMPLETE
3615,0.343120368415652,2025-04-24 22:04:40.560386,2025-04-24 22:04:44.671549,0 days 00:00:04.111163,True,squared_error,44,,1,2,607,TPESampler,COMPLETE
3616,0.44820977029239006,2025-04-24 22:04:40.693888,2025-04-24 22:04:45.047915,0 days 00:00:04.354027,False,squared_error,40,,2,6,638,TPESampler,COMPLETE
3617,0.3463346655597413,2025-04-24 22:04:42.897349,2025-04-24 22:05:16.863545,0 days 00:00:33.966196,True,absolute_error,50,,1,2,587,TPESampler,COMPLETE
3618,0.5419490861513093,2025-04-24 22:04:44.159456,2025-04-24 22:04:46.562844,0 days 00:00:02.403388,True,squared_error,50,,5,3,463,TPESampler,COMPLETE
3619,0.3436221019525179,2025-04-24 22:04:44.929064,2025-04-24 22:04:48.922394,0 days 00:00:03.993330,True,squared_error,50,,1,2,556,TPESampler,COMPLETE
3620,0.4563808396205026,2025-04-24 22:04:45.310639,2025-04-24 22:05:00.707023,0 days 00:00:15.396384,True,absolute_error,42,,2,8,500,TPESampler,COMPLETE
3621,0.3417982566196542,2025-04-24 22:04:45.490106,2025-04-24 22:04:49.186127,0 days 00:00:03.696021,True,squared_error,43,,1,3,580,TPESampler,COMPLETE
3622,0.3445009694450225,2025-04-24 22:04:46.841321,2025-04-24 22:04:51.473374,0 days 00:00:04.632053,True,squared_error,50,,1,2,688,TPESampler,COMPLETE
3623,0.9193577204072126,2025-04-24 22:04:49.146111,2025-04-24 22:04:50.185737,0 days 00:00:01.039626,False,absolute_error,38,sqrt,8,3,143,TPESampler,COMPLETE
3624,0.6452430274137483,2025-04-24 22:04:49.404844,2025-04-24 22:04:51.034147,0 days 00:00:01.629303,True,squared_error,46,sqrt,2,2,555,TPESampler,COMPLETE
3625,0.46880305712685155,2025-04-24 22:04:50.419519,2025-04-24 22:04:53.324415,0 days 00:00:02.904896,True,squared_error,38,sqrt,1,47,995,TPESampler,COMPLETE
3626,0.4274813872803042,2025-04-24 22:04:51.493000,2025-04-24 22:04:54.316187,0 days 00:00:02.823187,True,squared_error,50,,2,4,598,TPESampler,COMPLETE
3627,0.34778764612737045,2025-04-24 22:04:51.915172,2025-04-24 22:04:56.701490,0 days 00:00:04.786318,True,squared_error,50,,1,4,714,TPESampler,COMPLETE
3628,0.43267712888916704,2025-04-24 22:04:53.554821,2025-04-24 22:04:56.300490,0 days 00:00:02.745669,True,squared_error,50,,2,5,452,TPESampler,COMPLETE
3629,0.34366387257118736,2025-04-24 22:04:54.546679,2025-04-24 22:04:58.838717,0 days 00:00:04.292038,True,squared_error,43,,1,2,806,TPESampler,COMPLETE
3630,0.3439116721518483,2025-04-24 22:04:54.709077,2025-04-24 22:04:58.303249,0 days 00:00:03.594172,True,squared_error,50,,1,2,391,TPESampler,COMPLETE
3631,0.3420214220086437,2025-04-24 22:04:56.548468,2025-04-24 22:05:00.893929,0 days 00:00:04.345461,True,squared_error,50,,1,3,649,TPESampler,COMPLETE
3632,0.354299881856308,2025-04-24 22:04:57.056570,2025-04-24 22:05:00.957239,0 days 00:00:03.900669,True,squared_error,43,,1,5,643,TPESampler,COMPLETE
3633,0.37074992001322543,2025-04-24 22:04:58.529335,2025-04-24 22:05:01.198452,0 days 00:00:02.669117,True,squared_error,41,,1,7,478,TPESampler,COMPLETE
3634,0.3417396875534557,2025-04-24 22:04:59.073312,2025-04-24 22:05:02.065738,0 days 00:00:02.992426,True,squared_error,50,,1,3,469,TPESampler,COMPLETE
3635,0.36127224794848833,2025-04-24 22:05:00.960680,2025-04-24 22:05:03.457881,0 days 00:00:02.497201,True,squared_error,42,,1,6,290,TPESampler,COMPLETE
3636,0.4303573993540102,2025-04-24 22:05:01.102455,2025-04-24 22:05:04.243727,0 days 00:00:03.141272,True,squared_error,44,,2,4,391,TPESampler,COMPLETE
3637,0.3438211834012005,2025-04-24 22:05:01.284737,2025-04-24 22:05:05.223874,0 days 00:00:03.939137,True,squared_error,34,,1,3,480,TPESampler,COMPLETE
3638,0.42959941201221663,2025-04-24 22:05:02.024296,2025-04-24 22:05:04.633136,0 days 00:00:02.608840,True,squared_error,42,,2,2,367,TPESampler,COMPLETE
3639,0.4272706009081607,2025-04-24 22:05:02.507783,2025-04-24 22:05:06.231714,0 days 00:00:03.723931,True,squared_error,50,,2,3,679,TPESampler,COMPLETE
3640,0.36852673617070353,2025-04-24 22:05:04.007543,2025-04-24 22:05:07.033425,0 days 00:00:03.025882,True,squared_error,50,,1,7,528,TPESampler,COMPLETE
3641,0.5218746593563973,2025-04-24 22:05:04.496753,2025-04-24 22:05:05.841411,0 days 00:00:01.344658,False,squared_error,18,sqrt,1,3,159,TPESampler,COMPLETE
3642,0.3466738398016316,2025-04-24 22:05:05.051627,2025-04-24 22:05:10.494741,0 days 00:00:05.443114,True,squared_error,50,,1,4,853,TPESampler,COMPLETE
3643,0.3689879619306294,2025-04-24 22:05:05.655227,2025-04-24 22:05:07.732779,0 days 00:00:02.077552,False,squared_error,50,sqrt,1,3,406,TPESampler,COMPLETE
3644,0.34160831291658206,2025-04-24 22:05:06.421369,2025-04-24 22:05:10.873814,0 days 00:00:04.452445,True,squared_error,50,,1,3,617,TPESampler,COMPLETE
3645,0.34210060611535076,2025-04-24 22:05:06.505275,2025-04-24 22:05:10.037937,0 days 00:00:03.532662,True,squared_error,50,,1,3,501,TPESampler,COMPLETE
3646,0.4832288547372788,2025-04-24 22:05:07.372792,2025-04-24 22:05:09.774631,0 days 00:00:02.401839,True,squared_error,40,log2,1,2,696,TPESampler,COMPLETE
3647,0.34119386221575226,2025-04-24 22:05:08.125997,2025-04-24 22:05:12.273853,0 days 00:00:04.147856,True,squared_error,50,,1,3,610,TPESampler,COMPLETE
3648,0.35461691373882753,2025-04-24 22:05:09.995981,2025-04-24 22:05:13.773168,0 days 00:00:03.777187,True,squared_error,43,,1,5,682,TPESampler,COMPLETE
3649,0.35282733570650143,2025-04-24 22:05:10.369125,2025-04-24 22:05:13.942207,0 days 00:00:03.573082,True,squared_error,43,,1,5,590,TPESampler,COMPLETE
3650,0.42724463783739103,2025-04-24 22:05:10.764017,2025-04-24 22:05:14.604939,0 days 00:00:03.840922,True,squared_error,43,,2,3,670,TPESampler,COMPLETE
3651,0.3428849852422423,2025-04-24 22:05:11.325393,2025-04-24 22:05:14.958477,0 days 00:00:03.633084,True,squared_error,50,,1,2,444,TPESampler,COMPLETE
3652,0.5898169022464174,2025-04-24 22:05:12.674244,2025-04-24 22:05:16.595177,0 days 00:00:03.920933,True,absolute_error,46,,7,8,398,TPESampler,COMPLETE
3653,0.46187716224239295,2025-04-24 22:05:14.006222,2025-04-24 22:05:17.480409,0 days 00:00:03.474187,False,squared_error,49,,1,11,475,TPESampler,COMPLETE
3654,0.42978171036497903,2025-04-24 22:05:14.491604,2025-04-24 22:05:16.945153,0 days 00:00:02.453549,True,squared_error,43,,2,3,435,TPESampler,COMPLETE
3655,0.3443569560524757,2025-04-24 22:05:14.867771,2025-04-24 22:05:17.973321,0 days 00:00:03.105550,True,squared_error,44,,1,3,301,TPESampler,COMPLETE
3656,0.3423341288005347,2025-04-24 22:05:15.284608,2025-04-24 22:05:19.217033,0 days 00:00:03.932425,True,squared_error,43,,1,3,558,TPESampler,COMPLETE
3657,0.3423136666504432,2025-04-24 22:05:16.833898,2025-04-24 22:05:20.395120,0 days 00:00:03.561222,True,squared_error,43,,1,3,409,TPESampler,COMPLETE
3658,0.38438243372310754,2025-04-24 22:05:17.074248,2025-04-24 22:05:20.879292,0 days 00:00:03.805044,True,squared_error,50,,1,9,391,TPESampler,COMPLETE
3659,0.9011901824698427,2025-04-24 22:05:17.240514,2025-04-24 22:05:19.488147,0 days 00:00:02.247633,False,squared_error,42,log2,4,2,844,TPESampler,COMPLETE
3660,0.34444494720284025,2025-04-24 22:05:18.066358,2025-04-24 22:05:23.734738,0 days 00:00:05.668380,True,squared_error,42,,1,3,738,TPESampler,COMPLETE
3661,0.3453987746609778,2025-04-24 22:05:18.413329,2025-04-24 22:05:24.100495,0 days 00:00:05.687166,True,squared_error,50,,1,2,735,TPESampler,COMPLETE
3662,0.4273373874901382,2025-04-24 22:05:19.553397,2025-04-24 22:05:23.738967,0 days 00:00:04.185570,True,squared_error,50,,2,3,675,TPESampler,COMPLETE
3663,0.5057790334498922,2025-04-24 22:05:19.936068,2025-04-24 22:05:31.224424,0 days 00:00:11.288356,True,absolute_error,7,,3,2,708,TPESampler,COMPLETE
3664,0.8846714647964764,2025-04-24 22:05:20.653380,2025-04-24 22:05:23.742820,0 days 00:00:03.089440,True,absolute_error,5,sqrt,4,5,984,TPESampler,COMPLETE
3665,0.34659802405067264,2025-04-24 22:05:21.521747,2025-04-24 22:05:24.782598,0 days 00:00:03.260851,True,squared_error,50,,1,4,464,TPESampler,COMPLETE
3666,0.907996329334729,2025-04-24 22:05:23.945200,2025-04-24 22:05:26.958863,0 days 00:00:03.013663,True,absolute_error,17,sqrt,5,3,502,TPESampler,COMPLETE
3667,0.3529878938581029,2025-04-24 22:05:23.992450,2025-04-24 22:05:28.719406,0 days 00:00:04.726956,True,squared_error,43,,1,5,593,TPESampler,COMPLETE
3668,0.42777767375615317,2025-04-24 22:05:23.999797,2025-04-24 22:05:27.282418,0 days 00:00:03.282621,True,squared_error,42,,2,2,550,TPESampler,COMPLETE
3669,0.34158247242873624,2025-04-24 22:05:24.543170,2025-04-24 22:05:29.833516,0 days 00:00:05.290346,True,squared_error,50,,1,3,560,TPESampler,COMPLETE
3670,0.34355005154980445,2025-04-24 22:05:25.296122,2025-04-24 22:05:29.837664,0 days 00:00:04.541542,True,squared_error,50,,1,2,557,TPESampler,COMPLETE
3671,0.34320191329904487,2025-04-24 22:05:27.214704,2025-04-24 22:05:32.143447,0 days 00:00:04.928743,True,squared_error,50,,1,3,745,TPESampler,COMPLETE
3672,0.3436240550828549,2025-04-24 22:05:27.509774,2025-04-24 22:05:31.522120,0 days 00:00:04.012346,True,squared_error,44,,1,3,665,TPESampler,COMPLETE
3673,0.3613579082590432,2025-04-24 22:05:28.967602,2025-04-24 22:05:33.089275,0 days 00:00:04.121673,True,squared_error,50,,1,6,627,TPESampler,COMPLETE
3674,0.3444379221254767,2025-04-24 22:05:30.109028,2025-04-24 22:05:34.381263,0 days 00:00:04.272235,True,squared_error,42,,1,2,578,TPESampler,COMPLETE
