number,value,datetime_start,datetime_complete,duration,params_bootstrap,params_criterion,params_max_depth,params_max_features,params_min_samples_leaf,params_min_samples_split,params_n_estimators,system_attrs_auto:sampler,state
2403,0.6489657664466286,2025-04-24 21:48:02.329149,2025-04-24 21:48:04.206884,0 days 00:00:01.877735,True,squared_error,50,sqrt,2,2,655,TPESampler,COMPLETE
2404,0.342197108835652,2025-04-24 21:48:03.448441,2025-04-24 21:48:07.891081,0 days 00:00:04.442640,True,squared_error,50,,1,3,796,TPESampler,COMPLETE
2405,0.34737010137424973,2025-04-24 21:48:04.408487,2025-04-24 21:48:06.829893,0 days 00:00:02.421406,True,squared_error,44,,1,4,368,TPESampler,COMPLETE
2406,0.4281162364980183,2025-04-24 21:48:05.509804,2025-04-24 21:48:08.488127,0 days 00:00:02.978323,True,squared_error,43,,2,4,552,TPESampler,COMPLETE
2407,0.42973379022936686,2025-04-24 21:48:05.826611,2025-04-24 21:48:07.752291,0 days 00:00:01.925680,True,squared_error,43,,2,4,336,TPESampler,COMPLETE
2408,0.5861877803366676,2025-04-24 21:48:07.064238,2025-04-24 21:48:08.801200,0 days 00:00:01.736962,False,squared_error,27,log2,1,3,729,TPESampler,COMPLETE
2409,0.3438607652410411,2025-04-24 21:48:07.688322,2025-04-24 21:48:10.816870,0 days 00:00:03.128548,True,squared_error,43,,1,2,389,TPESampler,COMPLETE
2410,0.3611710415658473,2025-04-24 21:48:08.049275,2025-04-24 21:48:11.612746,0 days 00:00:03.563471,True,squared_error,43,,1,6,513,TPESampler,COMPLETE
2411,0.3438990480333396,2025-04-24 21:48:08.197428,2025-04-24 21:48:12.407893,0 days 00:00:04.210465,True,squared_error,50,,1,2,520,TPESampler,COMPLETE
2412,0.3415248107356694,2025-04-24 21:48:08.704511,2025-04-24 21:48:12.010551,0 days 00:00:03.306040,True,squared_error,50,,1,3,521,TPESampler,COMPLETE
2413,0.3476523214004071,2025-04-24 21:48:09.083415,2025-04-24 21:48:12.756264,0 days 00:00:03.672849,True,squared_error,42,,1,4,663,TPESampler,COMPLETE
2414,0.369161621414565,2025-04-24 21:48:11.017446,2025-04-24 21:48:15.421867,0 days 00:00:04.404421,True,squared_error,50,,1,7,753,TPESampler,COMPLETE
2415,0.36103035674317957,2025-04-24 21:48:12.157007,2025-04-24 21:48:14.720378,0 days 00:00:02.563371,True,squared_error,50,,1,6,387,TPESampler,COMPLETE
2416,0.34215335504104055,2025-04-24 21:48:12.320446,2025-04-24 21:48:16.327726,0 days 00:00:04.007280,True,squared_error,50,,1,3,662,TPESampler,COMPLETE
2417,0.4420982861992187,2025-04-24 21:48:12.687561,2025-04-24 21:48:15.749702,0 days 00:00:03.062141,True,absolute_error,47,sqrt,1,28,258,TPESampler,COMPLETE
2418,0.34177989633483913,2025-04-24 21:48:13.045296,2025-04-24 21:48:15.901007,0 days 00:00:02.855711,True,squared_error,50,,1,3,473,TPESampler,COMPLETE
2419,0.885048537385551,2025-04-24 21:48:14.926723,2025-04-24 21:48:16.231128,0 days 00:00:01.304405,True,squared_error,40,log2,2,5,289,TPESampler,COMPLETE
2420,0.34667730839268807,2025-04-24 21:48:15.690062,2025-04-24 21:48:19.525079,0 days 00:00:03.835017,True,squared_error,50,,1,4,470,TPESampler,COMPLETE
2421,0.344275108403983,2025-04-24 21:48:16.092872,2025-04-24 21:48:21.535648,0 days 00:00:05.442776,True,squared_error,50,,1,2,684,TPESampler,COMPLETE
2422,0.3474106998760332,2025-04-24 21:48:16.160514,2025-04-24 21:48:40.575196,0 days 00:00:24.414682,True,absolute_error,49,,1,2,421,TPESampler,COMPLETE
2423,0.9679472485710652,2025-04-24 21:48:16.650700,2025-04-24 21:48:18.763495,0 days 00:00:02.112795,True,absolute_error,46,log2,4,2,590,TPESampler,COMPLETE
2424,0.3606197736281374,2025-04-24 21:48:16.747931,2025-04-24 21:48:19.846483,0 days 00:00:03.098552,True,squared_error,50,,1,6,585,TPESampler,COMPLETE
2425,0.3475408554828571,2025-04-24 21:48:18.970940,2025-04-24 21:48:23.396026,0 days 00:00:04.425086,True,squared_error,42,,1,4,646,TPESampler,COMPLETE
2426,0.933672001110985,2025-04-24 21:48:19.947634,2025-04-24 21:48:21.099689,0 days 00:00:01.152055,False,squared_error,18,log2,14,2,409,TPESampler,COMPLETE
2427,0.34356681054659516,2025-04-24 21:48:20.062421,2025-04-24 21:48:22.653468,0 days 00:00:02.591047,True,squared_error,43,,1,2,431,TPESampler,COMPLETE
2428,0.34277696930179496,2025-04-24 21:48:21.305037,2025-04-24 21:48:26.139398,0 days 00:00:04.834361,True,squared_error,50,,1,2,586,TPESampler,COMPLETE
2429,0.43137739935665487,2025-04-24 21:48:21.786380,2025-04-24 21:48:24.036530,0 days 00:00:02.250150,True,squared_error,50,log2,1,2,553,TPESampler,COMPLETE
2430,0.42763933631129114,2025-04-24 21:48:22.850962,2025-04-24 21:48:26.003930,0 days 00:00:03.152968,True,squared_error,42,,2,2,650,TPESampler,COMPLETE
2431,0.8771886118982348,2025-04-24 21:48:23.668136,2025-04-24 21:48:26.086662,0 days 00:00:02.418526,True,squared_error,40,log2,2,7,939,TPESampler,COMPLETE
2432,0.3458065223213731,2025-04-24 21:48:24.094060,2025-04-24 21:48:27.647764,0 days 00:00:03.553704,True,squared_error,43,,1,4,602,TPESampler,COMPLETE
2433,0.3984899993509914,2025-04-24 21:48:24.285479,2025-04-24 21:48:28.338407,0 days 00:00:04.052928,True,squared_error,9,,1,2,766,TPESampler,COMPLETE
2434,0.3417079573694166,2025-04-24 21:48:26.231261,2025-04-24 21:48:28.996888,0 days 00:00:02.765627,True,squared_error,50,,1,3,411,TPESampler,COMPLETE
2435,0.34432352225713214,2025-04-24 21:48:26.308010,2025-04-24 21:48:30.334382,0 days 00:00:04.026372,True,squared_error,41,,1,2,527,TPESampler,COMPLETE
2436,0.3466263703097572,2025-04-24 21:48:26.370552,2025-04-24 21:48:29.508803,0 days 00:00:03.138251,True,squared_error,50,,1,4,386,TPESampler,COMPLETE
2437,0.34161982527992824,2025-04-24 21:48:27.849211,2025-04-24 21:48:31.472840,0 days 00:00:03.623629,True,squared_error,50,,1,3,618,TPESampler,COMPLETE
2438,0.42816898945917614,2025-04-24 21:48:28.604579,2025-04-24 21:48:31.810102,0 days 00:00:03.205523,True,squared_error,50,,2,3,503,TPESampler,COMPLETE
2439,0.43541784890467344,2025-04-24 21:48:29.243924,2025-04-24 21:48:31.542486,0 days 00:00:02.298562,True,squared_error,41,,2,6,527,TPESampler,COMPLETE
2440,0.47755221120621333,2025-04-24 21:48:29.714533,2025-04-24 21:48:32.769434,0 days 00:00:03.054901,False,squared_error,23,sqrt,1,2,915,TPESampler,COMPLETE
2441,0.42791579136514146,2025-04-24 21:48:30.794723,2025-04-24 21:48:34.449284,0 days 00:00:03.654561,True,squared_error,50,,2,4,646,TPESampler,COMPLETE
2442,0.34300273126596215,2025-04-24 21:48:31.649399,2025-04-24 21:48:34.676773,0 days 00:00:03.027374,True,squared_error,42,,1,3,469,TPESampler,COMPLETE
2443,0.3446412184749579,2025-04-24 21:48:31.796603,2025-04-24 21:48:35.641291,0 days 00:00:03.844688,True,squared_error,42,,1,2,571,TPESampler,COMPLETE
2444,0.3461449174659041,2025-04-24 21:48:32.050948,2025-04-24 21:48:35.558353,0 days 00:00:03.507405,True,squared_error,44,,1,4,441,TPESampler,COMPLETE
2445,0.4072308353967748,2025-04-24 21:48:33.188921,2025-04-24 21:48:34.493069,0 days 00:00:01.304148,False,squared_error,34,sqrt,1,5,307,TPESampler,COMPLETE
2446,0.43280498394406974,2025-04-24 21:48:34.613400,2025-04-24 21:48:37.450730,0 days 00:00:02.837330,True,squared_error,44,,2,5,418,TPESampler,COMPLETE
2447,0.4274179246392084,2025-04-24 21:48:34.673297,2025-04-24 21:48:38.924877,0 days 00:00:04.251580,True,squared_error,42,,2,4,723,TPESampler,COMPLETE
2448,0.4272643144018186,2025-04-24 21:48:34.915437,2025-04-24 21:48:38.621560,0 days 00:00:03.706123,True,squared_error,44,,2,3,678,TPESampler,COMPLETE
2449,0.3466171372302209,2025-04-24 21:48:36.024118,2025-04-24 21:48:38.903488,0 days 00:00:02.879370,True,squared_error,50,,1,4,463,TPESampler,COMPLETE
2450,0.4290623674741101,2025-04-24 21:48:36.163946,2025-04-24 21:48:39.780377,0 days 00:00:03.616431,False,squared_error,42,,1,2,436,TPESampler,COMPLETE
2451,0.34208526451242016,2025-04-24 21:48:37.874166,2025-04-24 21:48:41.827653,0 days 00:00:03.953487,True,squared_error,44,,1,3,592,TPESampler,COMPLETE
2452,0.36147874140975156,2025-04-24 21:48:38.823449,2025-04-24 21:48:42.303714,0 days 00:00:03.480265,True,squared_error,50,,1,6,565,TPESampler,COMPLETE
2453,0.3438611353703554,2025-04-24 21:48:39.146718,2025-04-24 21:48:43.997072,0 days 00:00:04.850354,True,squared_error,50,,1,2,657,TPESampler,COMPLETE
2454,0.3551321057911401,2025-04-24 21:48:39.204595,2025-04-24 21:48:43.780418,0 days 00:00:04.575823,True,squared_error,43,,1,5,715,TPESampler,COMPLETE
2455,0.39811173001303307,2025-04-24 21:48:40.237140,2025-04-24 21:48:41.970797,0 days 00:00:01.733657,True,squared_error,41,sqrt,1,5,549,TPESampler,COMPLETE
2456,0.35382456737872536,2025-04-24 21:48:40.797198,2025-04-24 21:48:44.728186,0 days 00:00:03.930988,True,squared_error,50,,1,5,667,TPESampler,COMPLETE
2457,0.42957610043556826,2025-04-24 21:48:42.033270,2025-04-24 21:48:44.777567,0 days 00:00:02.744297,True,squared_error,43,,2,3,466,TPESampler,COMPLETE
2458,0.34662799092314045,2025-04-24 21:48:42.248830,2025-04-24 21:49:18.206625,0 days 00:00:35.957795,True,absolute_error,44,,1,3,646,TPESampler,COMPLETE
2459,0.42850956535356155,2025-04-24 21:48:42.504338,2025-04-24 21:48:45.291875,0 days 00:00:02.787537,True,squared_error,50,,2,4,480,TPESampler,COMPLETE
2460,0.34648238815046,2025-04-24 21:48:44.001456,2025-04-24 21:48:47.943017,0 days 00:00:03.941561,True,squared_error,50,,1,4,555,TPESampler,COMPLETE
2461,0.3436301812859662,2025-04-24 21:48:44.221306,2025-04-24 21:48:47.700423,0 days 00:00:03.479117,True,squared_error,43,,1,2,471,TPESampler,COMPLETE
2462,0.37426106316246455,2025-04-24 21:48:45.120021,2025-04-24 21:48:47.000071,0 days 00:00:01.880050,True,squared_error,49,sqrt,1,3,424,TPESampler,COMPLETE
2463,0.8272808668844588,2025-04-24 21:48:45.190523,2025-04-24 21:48:47.094911,0 days 00:00:01.904388,False,squared_error,25,log2,2,2,996,TPESampler,COMPLETE
2464,0.34450975133070577,2025-04-24 21:48:45.600198,2025-04-24 21:48:48.367158,0 days 00:00:02.766960,True,squared_error,35,,1,3,350,TPESampler,COMPLETE
2465,0.34280150593733166,2025-04-24 21:48:47.222949,2025-04-24 21:48:50.944959,0 days 00:00:03.722010,True,squared_error,42,,1,3,653,TPESampler,COMPLETE
2466,0.4721970745019251,2025-04-24 21:48:47.340815,2025-04-24 21:48:51.522242,0 days 00:00:04.181427,True,absolute_error,42,,2,11,128,TPESampler,COMPLETE
2467,0.34410285398679974,2025-04-24 21:48:48.195016,2025-04-24 21:48:51.968592,0 days 00:00:03.773576,True,squared_error,50,,1,2,633,TPESampler,COMPLETE
2468,0.35285264250416487,2025-04-24 21:48:48.024644,2025-04-24 21:48:51.265579,0 days 00:00:03.240935,True,squared_error,43,,1,5,553,TPESampler,COMPLETE
2469,0.3415610617924918,2025-04-24 21:48:48.634655,2025-04-24 21:48:51.656339,0 days 00:00:03.021684,True,squared_error,50,,1,3,520,TPESampler,COMPLETE
2470,0.44777087286700445,2025-04-24 21:48:51.144688,2025-04-24 21:48:53.102999,0 days 00:00:01.958311,True,squared_error,49,log2,1,5,581,TPESampler,COMPLETE
2471,0.3420813166102764,2025-04-24 21:48:51.538622,2025-04-24 21:48:54.514922,0 days 00:00:02.976300,True,squared_error,50,,1,3,364,TPESampler,COMPLETE
2472,0.3421614183996907,2025-04-24 21:48:51.815283,2025-04-24 21:48:56.238124,0 days 00:00:04.422841,True,squared_error,50,,1,3,633,TPESampler,COMPLETE
2473,0.4956873909380853,2025-04-24 21:48:52.086803,2025-04-24 21:48:56.363451,0 days 00:00:04.276648,False,squared_error,46,,3,36,960,TPESampler,COMPLETE
2474,0.34435837751328474,2025-04-24 21:48:52.314218,2025-04-24 21:48:56.207619,0 days 00:00:03.893401,True,squared_error,50,,1,2,494,TPESampler,COMPLETE
2475,0.4271578307337334,2025-04-24 21:48:53.354445,2025-04-24 21:48:56.138479,0 days 00:00:02.784034,True,squared_error,50,,2,4,522,TPESampler,COMPLETE
2476,0.3429633172331201,2025-04-24 21:48:54.722667,2025-04-24 21:48:58.843221,0 days 00:00:04.120554,True,squared_error,50,,1,3,757,TPESampler,COMPLETE
2477,0.35458137855116373,2025-04-24 21:48:56.403021,2025-04-24 21:48:59.097301,0 days 00:00:02.694280,True,squared_error,42,,1,5,511,TPESampler,COMPLETE
2478,0.3467459101346821,2025-04-24 21:48:56.428986,2025-04-24 21:48:59.751921,0 days 00:00:03.322935,True,squared_error,50,,1,4,478,TPESampler,COMPLETE
2479,0.3552027960430544,2025-04-24 21:48:56.487084,2025-04-24 21:48:59.372238,0 days 00:00:02.885154,True,squared_error,43,,1,5,345,TPESampler,COMPLETE
2480,0.44293411839921865,2025-04-24 21:48:56.543231,2025-04-24 21:49:20.206009,0 days 00:00:23.662778,True,absolute_error,48,,2,4,788,TPESampler,COMPLETE
2481,0.3416172279420434,2025-04-24 21:48:59.054965,2025-04-24 21:49:02.779498,0 days 00:00:03.724533,True,squared_error,43,,1,3,583,TPESampler,COMPLETE
2482,0.9336285824812363,2025-04-24 21:48:59.440876,2025-04-24 21:49:01.199015,0 days 00:00:01.758139,True,squared_error,6,log2,8,14,568,TPESampler,COMPLETE
2483,0.4429025380156765,2025-04-24 21:48:59.697197,2025-04-24 21:49:18.475002,0 days 00:00:18.777805,True,absolute_error,50,,2,3,625,TPESampler,COMPLETE
2484,0.44324005515431814,2025-04-24 21:49:00.005060,2025-04-24 21:49:03.277144,0 days 00:00:03.272084,True,squared_error,50,,2,8,793,TPESampler,COMPLETE
2485,0.4734255604373416,2025-04-24 21:49:01.406756,2025-04-24 21:49:02.919652,0 days 00:00:01.512896,True,squared_error,41,log2,1,3,522,TPESampler,COMPLETE
2486,0.3436221019525179,2025-04-24 21:49:02.976594,2025-04-24 21:49:06.372662,0 days 00:00:03.396068,True,squared_error,50,,1,2,556,TPESampler,COMPLETE
2487,0.3460400161028918,2025-04-24 21:49:03.170261,2025-04-24 21:49:06.295456,0 days 00:00:03.125195,True,squared_error,50,,1,4,530,TPESampler,COMPLETE
2488,0.4273112293293777,2025-04-24 21:49:03.497414,2025-04-24 21:49:06.294358,0 days 00:00:02.796944,True,squared_error,43,,2,2,653,TPESampler,COMPLETE
2489,0.3410302047918888,2025-04-24 21:49:06.506368,2025-04-24 21:49:09.636221,0 days 00:00:03.129853,True,squared_error,50,,1,3,442,TPESampler,COMPLETE
2490,0.34097037084921544,2025-04-24 21:49:06.584217,2025-04-24 21:49:09.802087,0 days 00:00:03.217870,True,squared_error,50,,1,3,608,TPESampler,COMPLETE
2491,0.4252143848993506,2025-04-24 21:49:06.648575,2025-04-24 21:49:10.536542,0 days 00:00:03.887967,True,squared_error,50,,2,3,831,TPESampler,COMPLETE
2492,0.9148775561483848,2025-04-24 21:49:09.864262,2025-04-24 21:49:11.506216,0 days 00:00:01.641954,True,squared_error,41,sqrt,13,19,617,TPESampler,COMPLETE
2493,0.42687460939078575,2025-04-24 21:49:10.039268,2025-04-24 21:49:12.482386,0 days 00:00:02.443118,True,squared_error,50,,2,2,536,TPESampler,COMPLETE
2494,0.34410970172115973,2025-04-24 21:49:10.985773,2025-04-24 21:49:15.805382,0 days 00:00:04.819609,True,squared_error,43,,1,2,780,TPESampler,COMPLETE
2495,0.346808041564464,2025-04-24 21:49:11.765314,2025-04-24 21:49:13.933593,0 days 00:00:02.168279,True,squared_error,50,,1,4,294,TPESampler,COMPLETE
2496,0.9504466434932849,2025-04-24 21:49:12.977716,2025-04-24 21:49:14.818806,0 days 00:00:01.841090,False,absolute_error,39,log2,4,21,850,TPESampler,COMPLETE
2497,0.3451729522889151,2025-04-24 21:49:14.135295,2025-04-24 21:49:43.604235,0 days 00:00:29.468940,True,absolute_error,50,,1,3,525,TPESampler,COMPLETE
2498,0.4293404518808443,2025-04-24 21:49:15.042565,2025-04-24 21:49:17.009369,0 days 00:00:01.966804,True,squared_error,48,,2,2,412,TPESampler,COMPLETE
2499,0.7882639702744648,2025-04-24 21:49:16.002565,2025-04-24 21:49:17.420085,0 days 00:00:01.417520,False,squared_error,10,log2,1,43,992,TPESampler,COMPLETE
2500,0.3414263456523495,2025-04-24 21:49:17.211015,2025-04-24 21:49:20.759497,0 days 00:00:03.548482,True,squared_error,43,,1,3,604,TPESampler,COMPLETE
2501,0.3533667103954809,2025-04-24 21:49:17.650075,2025-04-24 21:49:21.205180,0 days 00:00:03.555105,True,squared_error,50,,1,5,630,TPESampler,COMPLETE
2502,0.4093735378948496,2025-04-24 21:49:18.616819,2025-04-24 21:50:06.379775,0 days 00:00:47.762956,False,absolute_error,21,,1,10,621,TPESampler,COMPLETE
2503,0.4303107370560204,2025-04-24 21:49:18.770108,2025-04-24 21:49:20.955963,0 days 00:00:02.185855,True,squared_error,40,,2,3,346,TPESampler,COMPLETE
2504,0.34295282455485104,2025-04-24 21:49:20.434176,2025-04-24 21:49:23.868331,0 days 00:00:03.434155,True,squared_error,43,,1,3,491,TPESampler,COMPLETE
2505,0.4280988139341179,2025-04-24 21:49:21.012094,2025-04-24 21:49:24.124581,0 days 00:00:03.112487,True,squared_error,42,,2,3,581,TPESampler,COMPLETE
2506,0.34407192858852154,2025-04-24 21:49:21.478906,2025-04-24 21:49:24.053181,0 days 00:00:02.574275,True,squared_error,44,,1,2,340,TPESampler,COMPLETE
2507,0.586302174956022,2025-04-24 21:49:21.526292,2025-04-24 21:49:24.732162,0 days 00:00:03.205870,False,squared_error,22,,7,5,965,TPESampler,COMPLETE
2508,0.34200579665032954,2025-04-24 21:49:24.087391,2025-04-24 21:49:28.826570,0 days 00:00:04.739179,True,squared_error,50,,1,3,647,TPESampler,COMPLETE
2509,0.3432844538310828,2025-04-24 21:49:24.413726,2025-04-24 21:49:30.164861,0 days 00:00:05.751135,True,squared_error,50,,1,3,733,TPESampler,COMPLETE
2510,0.3752872740663417,2025-04-24 21:49:24.471209,2025-04-24 21:49:26.721009,0 days 00:00:02.249800,True,squared_error,50,sqrt,1,3,230,TPESampler,COMPLETE
2511,0.3428900655776083,2025-04-24 21:49:24.996620,2025-04-24 21:49:27.727386,0 days 00:00:02.730766,True,squared_error,44,,1,2,418,TPESampler,COMPLETE
2512,0.881735204930829,2025-04-24 21:49:26.933906,2025-04-24 21:49:27.972115,0 days 00:00:01.038209,False,squared_error,8,log2,3,5,359,TPESampler,COMPLETE
2513,0.3409177926843658,2025-04-24 21:49:27.935214,2025-04-24 21:49:30.792067,0 days 00:00:02.856853,True,squared_error,50,,1,3,528,TPESampler,COMPLETE
2514,0.3846252508446439,2025-04-24 21:49:28.187997,2025-04-24 21:49:31.430936,0 days 00:00:03.242939,True,squared_error,43,,1,9,440,TPESampler,COMPLETE
2515,0.34277815420325985,2025-04-24 21:49:29.201220,2025-04-24 21:49:33.022112,0 days 00:00:03.820892,True,squared_error,34,,1,3,600,TPESampler,COMPLETE
2516,0.34102091344858726,2025-04-24 21:49:30.397428,2025-04-24 21:49:33.669000,0 days 00:00:03.271572,True,squared_error,50,,1,3,456,TPESampler,COMPLETE
2517,0.3438474152728896,2025-04-24 21:49:31.063778,2025-04-24 21:49:34.104484,0 days 00:00:03.040706,True,squared_error,42,,1,2,547,TPESampler,COMPLETE
2518,0.3442647870345694,2025-04-24 21:49:31.694663,2025-04-24 21:49:35.949088,0 days 00:00:04.254425,True,squared_error,43,,1,2,633,TPESampler,COMPLETE
2519,0.3463887251387868,2025-04-24 21:49:33.237370,2025-04-24 21:49:36.231250,0 days 00:00:02.993880,True,squared_error,43,,1,4,452,TPESampler,COMPLETE
2520,0.4367189404367696,2025-04-24 21:49:33.928432,2025-04-24 21:49:37.454455,0 days 00:00:03.526023,True,squared_error,42,,2,6,621,TPESampler,COMPLETE
2521,0.42763336517097195,2025-04-24 21:49:34.336806,2025-04-24 21:49:36.917907,0 days 00:00:02.581101,True,squared_error,42,,2,4,605,TPESampler,COMPLETE
2522,0.34344542713599735,2025-04-24 21:49:36.168807,2025-04-24 21:49:40.316788,0 days 00:00:04.147981,True,squared_error,50,,1,2,559,TPESampler,COMPLETE
2523,0.3698341923525979,2025-04-24 21:49:36.594215,2025-04-24 21:49:40.982135,0 days 00:00:04.387920,True,squared_error,43,,1,7,669,TPESampler,COMPLETE
2524,0.9316098070255585,2025-04-24 21:49:37.222267,2025-04-24 21:49:39.080879,0 days 00:00:01.858612,True,absolute_error,35,sqrt,6,17,746,TPESampler,COMPLETE
2525,0.4327001764554311,2025-04-24 21:49:37.707087,2025-04-24 21:49:39.818603,0 days 00:00:02.111516,True,squared_error,50,,2,5,362,TPESampler,COMPLETE
2526,0.3434203720059492,2025-04-24 21:49:39.277331,2025-04-24 21:49:41.840921,0 days 00:00:02.563590,True,squared_error,43,,1,2,425,TPESampler,COMPLETE
2527,0.35223108906003514,2025-04-24 21:49:40.078777,2025-04-24 21:49:43.598047,0 days 00:00:03.519270,True,squared_error,50,,1,5,548,TPESampler,COMPLETE
2528,0.36104472701105383,2025-04-24 21:49:40.603252,2025-04-24 21:49:43.879161,0 days 00:00:03.275909,True,squared_error,44,,1,6,529,TPESampler,COMPLETE
2529,0.4273862355798921,2025-04-24 21:49:41.251904,2025-04-24 21:49:45.165127,0 days 00:00:03.913223,True,squared_error,50,,2,2,738,TPESampler,COMPLETE
2530,0.42687460939078575,2025-04-24 21:49:42.107676,2025-04-24 21:49:44.729222,0 days 00:00:02.621546,True,squared_error,50,,2,2,536,TPESampler,COMPLETE
2531,0.3480019938922085,2025-04-24 21:49:43.830891,2025-04-24 21:49:48.234440,0 days 00:00:04.403549,True,squared_error,50,,1,4,735,TPESampler,COMPLETE
2532,0.3705212941943587,2025-04-24 21:49:43.838348,2025-04-24 21:49:47.119475,0 days 00:00:03.281127,True,squared_error,49,sqrt,1,2,919,TPESampler,COMPLETE
2533,0.34815642589775275,2025-04-24 21:49:44.160919,2025-04-24 21:49:48.343796,0 days 00:00:04.182877,True,squared_error,42,,1,4,719,TPESampler,COMPLETE
2534,0.39609124962791076,2025-04-24 21:49:45.098860,2025-04-24 21:49:47.150712,0 days 00:00:02.051852,False,squared_error,37,sqrt,1,4,782,TPESampler,COMPLETE
2535,0.3505678132063203,2025-04-24 21:49:45.549089,2025-04-24 21:50:01.114421,0 days 00:00:15.565332,True,absolute_error,50,,1,4,284,TPESampler,COMPLETE
2536,0.9775389716188084,2025-04-24 21:49:47.287822,2025-04-24 21:49:49.228955,0 days 00:00:01.941133,False,absolute_error,30,log2,10,3,923,TPESampler,COMPLETE
2537,0.3420507072075086,2025-04-24 21:49:47.333858,2025-04-24 21:49:50.975862,0 days 00:00:03.642004,True,squared_error,50,,1,3,506,TPESampler,COMPLETE
2538,0.3617474280244884,2025-04-24 21:49:48.471083,2025-04-24 21:49:51.410889,0 days 00:00:02.939806,True,squared_error,50,,1,6,475,TPESampler,COMPLETE
2539,0.4284423250194347,2025-04-24 21:49:48.618375,2025-04-24 21:49:51.753453,0 days 00:00:03.135078,True,squared_error,50,,2,3,636,TPESampler,COMPLETE
2540,0.34412165226520586,2025-04-24 21:49:49.483048,2025-04-24 21:49:52.414850,0 days 00:00:02.931802,True,squared_error,50,,1,2,393,TPESampler,COMPLETE
2541,0.4547914062644831,2025-04-24 21:49:51.181391,2025-04-24 21:50:28.827275,0 days 00:00:37.645884,False,absolute_error,11,,2,19,978,TPESampler,COMPLETE
2542,0.44850052667795537,2025-04-24 21:49:51.685350,2025-04-24 21:49:55.117381,0 days 00:00:03.432031,False,squared_error,50,,2,2,493,TPESampler,COMPLETE
2543,0.5340532033531625,2025-04-24 21:49:52.088395,2025-04-24 21:49:53.677450,0 days 00:00:01.589055,False,squared_error,50,sqrt,2,5,491,TPESampler,COMPLETE
