number,value,datetime_start,datetime_complete,duration,params_bootstrap,params_criterion,params_max_depth,params_max_features,params_min_samples_leaf,params_min_samples_split,params_n_estimators,system_attrs_auto:sampler,state
1415,0.344747734704363,2025-04-24 21:35:10.926595,2025-04-24 21:35:14.316581,0 days 00:00:03.389986,True,squared_error,42,,1,2,557,TPESampler,COMPLETE
1416,0.3461286678053566,2025-04-24 21:35:11.074453,2025-04-24 21:35:14.051660,0 days 00:00:02.977207,True,squared_error,41,,1,4,604,TPESampler,COMPLETE
1417,0.6167061091576245,2025-04-24 21:35:13.426534,2025-04-24 21:35:16.967610,0 days 00:00:03.541076,True,absolute_error,13,sqrt,1,2,550,TPESampler,COMPLETE
1418,0.42931995693158587,2025-04-24 21:35:14.218515,2025-04-24 21:35:19.451308,0 days 00:00:05.232793,False,squared_error,50,,1,3,764,TPESampler,COMPLETE
1419,0.347670786515061,2025-04-24 21:35:14.304123,2025-04-24 21:35:18.160328,0 days 00:00:03.856205,True,squared_error,50,,1,4,713,TPESampler,COMPLETE
1420,0.35382456737872536,2025-04-24 21:35:14.548501,2025-04-24 21:35:18.253268,0 days 00:00:03.704767,True,squared_error,50,,1,5,667,TPESampler,COMPLETE
1421,0.34423911687758685,2025-04-24 21:35:17.157860,2025-04-24 21:35:20.968016,0 days 00:00:03.810156,True,squared_error,50,,1,2,642,TPESampler,COMPLETE
1422,0.42706729443026054,2025-04-24 21:35:18.368782,2025-04-24 21:35:21.352178,0 days 00:00:02.983396,True,squared_error,41,,2,3,657,TPESampler,COMPLETE
1423,0.3612030508897152,2025-04-24 21:35:18.468168,2025-04-24 21:35:20.941897,0 days 00:00:02.473729,True,squared_error,43,,1,6,486,TPESampler,COMPLETE
1424,0.4275590154308394,2025-04-24 21:35:19.686921,2025-04-24 21:35:22.442218,0 days 00:00:02.755297,True,squared_error,50,,2,4,597,TPESampler,COMPLETE
1425,0.3414472884080586,2025-04-24 21:35:21.091795,2025-04-24 21:35:24.328985,0 days 00:00:03.237190,True,squared_error,50,,1,3,554,TPESampler,COMPLETE
1426,0.34207860377231214,2025-04-24 21:35:21.136540,2025-04-24 21:35:24.462743,0 days 00:00:03.326203,True,squared_error,43,,1,3,554,TPESampler,COMPLETE
1427,0.34605938939699743,2025-04-24 21:35:21.539836,2025-04-24 21:35:24.760593,0 days 00:00:03.220757,True,squared_error,43,,1,4,583,TPESampler,COMPLETE
1428,0.34222110172269016,2025-04-24 21:35:22.653209,2025-04-24 21:35:24.766830,0 days 00:00:02.113621,True,squared_error,42,,1,3,327,TPESampler,COMPLETE
1429,0.8566652652856962,2025-04-24 21:35:24.527174,2025-04-24 21:35:26.399445,0 days 00:00:01.872271,False,squared_error,39,sqrt,8,12,684,TPESampler,COMPLETE
1430,0.6333061310557423,2025-04-24 21:35:24.728982,2025-04-24 21:35:35.819145,0 days 00:00:11.090163,False,absolute_error,5,,7,2,881,TPESampler,COMPLETE
1431,0.3420574422996373,2025-04-24 21:35:24.912294,2025-04-24 21:35:28.739552,0 days 00:00:03.827258,True,squared_error,50,,1,3,495,TPESampler,COMPLETE
1432,0.4328936137634795,2025-04-24 21:35:24.997171,2025-04-24 21:35:27.167694,0 days 00:00:02.170523,False,squared_error,49,sqrt,1,37,500,TPESampler,COMPLETE
1433,0.3604141818104565,2025-04-24 21:35:26.604967,2025-04-24 21:35:29.364343,0 days 00:00:02.759376,True,squared_error,43,,1,6,593,TPESampler,COMPLETE
1434,0.45496798565576557,2025-04-24 21:35:27.381729,2025-04-24 21:35:28.684497,0 days 00:00:01.302768,True,squared_error,42,,2,29,259,TPESampler,COMPLETE
1435,0.4923764535308184,2025-04-24 21:35:28.847281,2025-04-24 21:35:30.986863,0 days 00:00:02.139582,False,squared_error,46,log2,1,14,938,TPESampler,COMPLETE
1436,0.3424459528590997,2025-04-24 21:35:28.919821,2025-04-24 21:35:33.558525,0 days 00:00:04.638704,True,squared_error,50,,1,3,677,TPESampler,COMPLETE
1437,0.3422872079926341,2025-04-24 21:35:29.652839,2025-04-24 21:35:33.044031,0 days 00:00:03.391192,True,squared_error,49,,1,3,652,TPESampler,COMPLETE
1438,0.35258616826518147,2025-04-24 21:35:31.256541,2025-04-24 21:35:35.353753,0 days 00:00:04.097212,True,squared_error,50,,1,5,580,TPESampler,COMPLETE
1439,0.3434825174281527,2025-04-24 21:35:31.878547,2025-04-24 21:35:35.650246,0 days 00:00:03.771699,True,squared_error,50,,1,2,567,TPESampler,COMPLETE
1440,0.3991696593178003,2025-04-24 21:35:33.001404,2025-04-24 21:35:34.986923,0 days 00:00:01.985519,True,squared_error,50,,1,11,325,TPESampler,COMPLETE
1441,0.4198925575462734,2025-04-24 21:35:33.338334,2025-04-24 21:35:37.391218,0 days 00:00:04.052884,False,squared_error,42,,1,8,651,TPESampler,COMPLETE
1442,0.6481686450953381,2025-04-24 21:35:33.767729,2025-04-24 21:35:35.476158,0 days 00:00:01.708429,True,squared_error,49,sqrt,2,5,751,TPESampler,COMPLETE
1443,0.3427848887115718,2025-04-24 21:35:35.322238,2025-04-24 21:35:39.170499,0 days 00:00:03.848261,True,squared_error,42,,1,3,629,TPESampler,COMPLETE
1444,0.34158611604148936,2025-04-24 21:35:35.538955,2025-04-24 21:35:39.950994,0 days 00:00:04.412039,True,squared_error,50,,1,3,612,TPESampler,COMPLETE
1445,0.4295683165284772,2025-04-24 21:35:35.673161,2025-04-24 21:35:38.867993,0 days 00:00:03.194832,True,squared_error,44,,2,3,457,TPESampler,COMPLETE
1446,0.42976883800541615,2025-04-24 21:35:35.963547,2025-04-24 21:35:38.358265,0 days 00:00:02.394718,True,squared_error,41,,2,3,319,TPESampler,COMPLETE
1447,0.3421218560343314,2025-04-24 21:35:36.166784,2025-04-24 21:35:39.247602,0 days 00:00:03.080818,True,squared_error,42,,1,3,451,TPESampler,COMPLETE
1448,0.4800094324048515,2025-04-24 21:35:37.582842,2025-04-24 21:35:48.757477,0 days 00:00:11.174635,False,absolute_error,7,,2,10,316,TPESampler,COMPLETE
1449,0.3604351635533328,2025-04-24 21:35:38.549506,2025-04-24 21:35:41.362461,0 days 00:00:02.812955,True,squared_error,50,,1,6,449,TPESampler,COMPLETE
1450,0.9145879923798942,2025-04-24 21:35:39.074522,2025-04-24 21:35:41.062030,0 days 00:00:01.987508,False,squared_error,17,sqrt,15,48,433,TPESampler,COMPLETE
1451,0.34308611588366483,2025-04-24 21:35:39.346077,2025-04-24 21:35:43.810755,0 days 00:00:04.464678,True,squared_error,50,,1,3,754,TPESampler,COMPLETE
1452,0.7842564825997905,2025-04-24 21:35:39.481343,2025-04-24 21:35:41.784224,0 days 00:00:02.302881,False,absolute_error,6,sqrt,1,3,279,TPESampler,COMPLETE
1453,0.981480151815804,2025-04-24 21:35:40.278784,2025-04-24 21:35:43.120690,0 days 00:00:02.841906,True,absolute_error,35,log2,7,11,868,TPESampler,COMPLETE
1454,0.9875767939999057,2025-04-24 21:35:41.510109,2025-04-24 21:35:42.911104,0 days 00:00:01.400995,True,absolute_error,44,log2,8,2,261,TPESampler,COMPLETE
1455,0.3433330684458151,2025-04-24 21:35:41.721762,2025-04-24 21:35:46.936929,0 days 00:00:05.215167,True,squared_error,43,,1,2,560,TPESampler,COMPLETE
1456,0.37292404672688456,2025-04-24 21:35:41.981553,2025-04-24 21:35:44.392142,0 days 00:00:02.410589,True,squared_error,49,sqrt,1,2,708,TPESampler,COMPLETE
1457,0.8946829832901444,2025-04-24 21:35:43.240124,2025-04-24 21:35:45.227257,0 days 00:00:01.987133,False,squared_error,20,sqrt,10,8,986,TPESampler,COMPLETE
1458,0.4487123820907295,2025-04-24 21:35:43.291520,2025-04-24 21:35:48.388639,0 days 00:00:05.097119,True,squared_error,35,,2,11,992,TPESampler,COMPLETE
1459,0.9588683720618769,2025-04-24 21:35:44.101396,2025-04-24 21:35:46.314246,0 days 00:00:02.212850,False,absolute_error,15,sqrt,14,19,994,TPESampler,COMPLETE
1460,0.39951230677012384,2025-04-24 21:35:44.708975,2025-04-24 21:35:47.077830,0 days 00:00:02.368855,True,squared_error,38,sqrt,1,4,638,TPESampler,COMPLETE
1461,0.9905391975699276,2025-04-24 21:35:45.462921,2025-04-24 21:35:47.316275,0 days 00:00:01.853354,True,absolute_error,19,log2,15,2,722,TPESampler,COMPLETE
1462,0.3979704764733205,2025-04-24 21:35:46.517731,2025-04-24 21:35:48.135778,0 days 00:00:01.618047,True,squared_error,49,sqrt,1,6,499,TPESampler,COMPLETE
1463,0.761778884373947,2025-04-24 21:35:47.256073,2025-04-24 21:35:49.865126,0 days 00:00:02.609053,False,absolute_error,46,sqrt,4,28,603,TPESampler,COMPLETE
1464,0.42868075431560604,2025-04-24 21:35:47.410249,2025-04-24 21:35:50.684912,0 days 00:00:03.274663,True,squared_error,42,,2,2,572,TPESampler,COMPLETE
1465,0.963773547750335,2025-04-24 21:35:47.591359,2025-04-24 21:35:49.014013,0 days 00:00:01.422654,True,absolute_error,9,sqrt,7,19,167,TPESampler,COMPLETE
1466,0.3438990480333396,2025-04-24 21:35:48.642287,2025-04-24 21:35:52.506859,0 days 00:00:03.864572,True,squared_error,50,,1,2,520,TPESampler,COMPLETE
1467,0.3423049043337177,2025-04-24 21:35:48.747122,2025-04-24 21:35:52.116360,0 days 00:00:03.369238,True,squared_error,42,,1,3,406,TPESampler,COMPLETE
1468,0.42741994316279697,2025-04-24 21:35:49.074125,2025-04-24 21:35:52.649083,0 days 00:00:03.574958,True,squared_error,50,,2,4,691,TPESampler,COMPLETE
1469,0.9102787359363413,2025-04-24 21:35:49.341203,2025-04-24 21:35:51.856148,0 days 00:00:02.514945,True,squared_error,35,sqrt,10,12,940,TPESampler,COMPLETE
1470,0.34174970234591623,2025-04-24 21:35:50.150767,2025-04-24 21:35:54.264558,0 days 00:00:04.113791,True,squared_error,50,,1,3,555,TPESampler,COMPLETE
1471,0.42817601572953823,2025-04-24 21:35:50.881910,2025-04-24 21:35:54.197488,0 days 00:00:03.315578,True,squared_error,42,,2,3,622,TPESampler,COMPLETE
1472,0.3408473073476281,2025-04-24 21:35:52.073819,2025-04-24 21:35:55.600729,0 days 00:00:03.526910,True,squared_error,50,,1,3,532,TPESampler,COMPLETE
1473,0.5850057452954611,2025-04-24 21:35:52.416478,2025-04-24 21:35:55.180624,0 days 00:00:02.764146,True,squared_error,47,,7,2,702,TPESampler,COMPLETE
1474,0.3456771725046282,2025-04-24 21:35:52.777471,2025-04-24 21:35:56.843015,0 days 00:00:04.065544,True,squared_error,50,,1,4,601,TPESampler,COMPLETE
1475,0.3416390477484435,2025-04-24 21:35:52.885727,2025-04-24 21:35:56.283344,0 days 00:00:03.397617,True,squared_error,50,,1,3,471,TPESampler,COMPLETE
1476,0.44068459860146353,2025-04-24 21:35:54.409431,2025-04-24 21:35:59.016547,0 days 00:00:04.607116,True,absolute_error,50,log2,1,3,630,TPESampler,COMPLETE
1477,0.9247089990366042,2025-04-24 21:35:54.500600,2025-04-24 21:35:56.120911,0 days 00:00:01.620311,True,absolute_error,23,log2,2,42,448,TPESampler,COMPLETE
1478,0.3742596254327222,2025-04-24 21:35:55.525904,2025-04-24 21:35:58.065028,0 days 00:00:02.539124,True,squared_error,50,sqrt,1,4,522,TPESampler,COMPLETE
1479,0.9154638532495366,2025-04-24 21:35:56.076187,2025-04-24 21:35:57.719246,0 days 00:00:01.643059,False,squared_error,8,sqrt,15,3,409,TPESampler,COMPLETE
1480,0.3435682580791099,2025-04-24 21:35:56.387584,2025-04-24 21:36:01.003161,0 days 00:00:04.615577,True,squared_error,50,,1,2,561,TPESampler,COMPLETE
1481,0.34173786978441173,2025-04-24 21:35:56.790922,2025-04-24 21:36:00.633383,0 days 00:00:03.842461,True,squared_error,43,,1,3,581,TPESampler,COMPLETE
1482,0.34431940561175073,2025-04-24 21:35:57.210331,2025-04-24 21:36:02.022535,0 days 00:00:04.812204,True,squared_error,50,,1,2,665,TPESampler,COMPLETE
1483,0.35302124779083716,2025-04-24 21:35:58.147488,2025-04-24 21:36:01.415877,0 days 00:00:03.268389,True,squared_error,43,,1,5,584,TPESampler,COMPLETE
1484,0.3607815479021494,2025-04-24 21:35:58.416350,2025-04-24 21:36:01.722609,0 days 00:00:03.306259,True,squared_error,50,,1,6,583,TPESampler,COMPLETE
1485,0.3417404486887402,2025-04-24 21:35:59.239628,2025-04-24 21:36:02.711702,0 days 00:00:03.472074,True,squared_error,50,,1,3,574,TPESampler,COMPLETE
1486,0.34251222629684586,2025-04-24 21:36:00.819054,2025-04-24 21:36:04.949594,0 days 00:00:04.130540,True,squared_error,43,,1,3,640,TPESampler,COMPLETE
1487,0.4432234408129518,2025-04-24 21:36:01.217458,2025-04-24 21:36:15.947396,0 days 00:00:14.729938,True,absolute_error,48,,2,2,534,TPESampler,COMPLETE
1488,0.34623932739810714,2025-04-24 21:36:01.736509,2025-04-24 21:36:05.406023,0 days 00:00:03.669514,True,squared_error,50,,1,4,578,TPESampler,COMPLETE
1489,0.7992764532938571,2025-04-24 21:36:02.033950,2025-04-24 21:36:03.666104,0 days 00:00:01.632154,False,squared_error,41,sqrt,5,18,232,TPESampler,COMPLETE
1490,0.34644041771290707,2025-04-24 21:36:02.334318,2025-04-24 21:36:06.326896,0 days 00:00:03.992578,True,squared_error,30,,1,3,662,TPESampler,COMPLETE
1491,0.34709774838185325,2025-04-24 21:36:03.034460,2025-04-24 21:36:06.352310,0 days 00:00:03.317850,True,squared_error,50,,1,4,512,TPESampler,COMPLETE
1492,0.34330695135098566,2025-04-24 21:36:03.941068,2025-04-24 21:36:07.682377,0 days 00:00:03.741309,True,squared_error,44,,1,3,649,TPESampler,COMPLETE
1493,0.3441781292285279,2025-04-24 21:36:05.147921,2025-04-24 21:36:09.342336,0 days 00:00:04.194415,True,squared_error,50,,1,2,639,TPESampler,COMPLETE
1494,0.427690288462491,2025-04-24 21:36:05.626908,2025-04-24 21:36:08.711594,0 days 00:00:03.084686,True,squared_error,43,,2,3,608,TPESampler,COMPLETE
1495,0.4290086484203392,2025-04-24 21:36:06.564930,2025-04-24 21:36:09.043818,0 days 00:00:02.478888,True,squared_error,50,,2,4,475,TPESampler,COMPLETE
1496,0.42808407984721797,2025-04-24 21:36:06.705283,2025-04-24 21:36:09.347770,0 days 00:00:02.642487,True,squared_error,50,,2,3,501,TPESampler,COMPLETE
1497,0.3412373754915582,2025-04-24 21:36:07.887108,2025-04-24 21:36:11.050363,0 days 00:00:03.163255,True,squared_error,50,,1,3,523,TPESampler,COMPLETE
1498,0.427376105674854,2025-04-24 21:36:09.348792,2025-04-24 21:36:12.917261,0 days 00:00:03.568469,True,squared_error,50,,2,3,718,TPESampler,COMPLETE
1499,0.34367446947829805,2025-04-24 21:36:09.447731,2025-04-24 21:36:13.385859,0 days 00:00:03.938128,True,squared_error,42,,1,2,442,TPESampler,COMPLETE
1500,0.44697942809950403,2025-04-24 21:36:09.556410,2025-04-24 21:36:13.449693,0 days 00:00:03.893283,True,squared_error,45,,2,9,720,TPESampler,COMPLETE
1501,0.4274567179046616,2025-04-24 21:36:09.605431,2025-04-24 21:36:13.451194,0 days 00:00:03.845763,True,squared_error,50,,2,3,593,TPESampler,COMPLETE
1502,0.5899344141241618,2025-04-24 21:36:11.321972,2025-04-24 21:36:15.253241,0 days 00:00:03.931269,True,absolute_error,24,,7,17,493,TPESampler,COMPLETE
1503,0.4689794047661588,2025-04-24 21:36:13.113125,2025-04-24 21:36:16.192029,0 days 00:00:03.078904,True,absolute_error,27,sqrt,1,9,347,TPESampler,COMPLETE
1504,0.34721214023078534,2025-04-24 21:36:13.583886,2025-04-24 21:36:17.429714,0 days 00:00:03.845828,True,squared_error,50,,1,4,636,TPESampler,COMPLETE
1505,0.34266287568814796,2025-04-24 21:36:13.639043,2025-04-24 21:36:17.501565,0 days 00:00:03.862522,True,squared_error,41,,1,3,590,TPESampler,COMPLETE
1506,0.4729238684298441,2025-04-24 21:36:13.688846,2025-04-24 21:36:21.714925,0 days 00:00:08.026079,True,absolute_error,15,,2,24,292,TPESampler,COMPLETE
1507,0.976568830534484,2025-04-24 21:36:15.459328,2025-04-24 21:36:16.756249,0 days 00:00:01.296921,False,absolute_error,25,log2,10,9,535,TPESampler,COMPLETE
1508,0.3470787927943892,2025-04-24 21:36:16.285050,2025-04-24 21:36:47.016222,0 days 00:00:30.731172,True,absolute_error,42,,1,3,565,TPESampler,COMPLETE
1509,0.47419998345124,2025-04-24 21:36:16.434932,2025-04-24 21:36:20.121556,0 days 00:00:03.686624,False,squared_error,20,,4,13,828,TPESampler,COMPLETE
1510,0.34474003204122916,2025-04-24 21:36:17.034177,2025-04-24 21:36:22.192925,0 days 00:00:05.158748,True,squared_error,50,,1,2,708,TPESampler,COMPLETE
1511,0.34790753317155954,2025-04-24 21:36:17.604248,2025-04-24 21:36:21.712115,0 days 00:00:04.107867,True,squared_error,50,,1,4,715,TPESampler,COMPLETE
1512,0.3426502546440289,2025-04-24 21:36:17.804905,2025-04-24 21:36:21.710647,0 days 00:00:03.905742,True,squared_error,50,,1,2,602,TPESampler,COMPLETE
1513,0.4276281782833507,2025-04-24 21:36:20.336033,2025-04-24 21:36:23.820624,0 days 00:00:03.484591,True,squared_error,50,,2,2,744,TPESampler,COMPLETE
1514,0.4279146107465431,2025-04-24 21:36:21.864562,2025-04-24 21:36:26.178791,0 days 00:00:04.314229,True,squared_error,49,,2,2,506,TPESampler,COMPLETE
1515,0.6891674929801415,2025-04-24 21:36:21.935944,2025-04-24 21:36:23.664722,0 days 00:00:01.728778,False,squared_error,8,sqrt,1,2,413,TPESampler,COMPLETE
1516,0.3435587763989449,2025-04-24 21:36:21.998890,2025-04-24 21:36:25.877581,0 days 00:00:03.878691,True,squared_error,50,,1,2,408,TPESampler,COMPLETE
1517,0.9155326860162073,2025-04-24 21:36:22.419457,2025-04-24 21:36:23.736351,0 days 00:00:01.316894,False,squared_error,38,sqrt,14,9,410,TPESampler,COMPLETE
1518,0.3687330993435544,2025-04-24 21:36:23.957267,2025-04-24 21:36:27.148848,0 days 00:00:03.191581,True,squared_error,50,,1,7,522,TPESampler,COMPLETE
1519,0.4339983180243961,2025-04-24 21:36:24.006442,2025-04-24 21:36:26.136575,0 days 00:00:02.130133,True,squared_error,49,log2,1,2,489,TPESampler,COMPLETE
1520,0.9103008493459129,2025-04-24 21:36:24.055547,2025-04-24 21:36:26.180191,0 days 00:00:02.124644,True,squared_error,28,sqrt,10,2,799,TPESampler,COMPLETE
1521,0.3421154996103557,2025-04-24 21:36:26.137352,2025-04-24 21:36:29.900626,0 days 00:00:03.763274,True,squared_error,42,,1,3,541,TPESampler,COMPLETE
1522,0.34717963762986404,2025-04-24 21:36:26.396040,2025-04-24 21:36:29.589444,0 days 00:00:03.193404,True,squared_error,42,,1,4,569,TPESampler,COMPLETE
1523,0.46519685530876637,2025-04-24 21:36:26.440290,2025-04-24 21:36:28.238095,0 days 00:00:01.797805,False,squared_error,50,log2,1,11,316,TPESampler,COMPLETE
1524,0.38777330249779096,2025-04-24 21:36:26.579336,2025-04-24 21:37:32.326634,0 days 00:01:05.747298,False,absolute_error,47,,1,2,701,TPESampler,COMPLETE
1525,0.3467249783610929,2025-04-24 21:36:27.559889,2025-04-24 21:36:29.828094,0 days 00:00:02.268205,True,squared_error,50,,1,4,399,TPESampler,COMPLETE
1526,0.3534549265089696,2025-04-24 21:36:28.442019,2025-04-24 21:36:32.019335,0 days 00:00:03.577316,True,squared_error,50,,1,5,631,TPESampler,COMPLETE
1527,0.34558625793165687,2025-04-24 21:36:29.784664,2025-04-24 21:36:33.372600,0 days 00:00:03.587936,True,squared_error,50,,1,4,595,TPESampler,COMPLETE
1528,0.3699163391674567,2025-04-24 21:36:30.054102,2025-04-24 21:36:33.876456,0 days 00:00:03.822354,True,squared_error,40,,1,7,684,TPESampler,COMPLETE
1529,0.3697664974151625,2025-04-24 21:36:30.446616,2025-04-24 21:36:34.144452,0 days 00:00:03.697836,True,squared_error,42,,1,7,747,TPESampler,COMPLETE
1530,0.4380860016878792,2025-04-24 21:36:32.432812,2025-04-24 21:36:34.392301,0 days 00:00:01.959489,True,squared_error,41,,2,6,454,TPESampler,COMPLETE
1531,0.3466318191599732,2025-04-24 21:36:33.567967,2025-04-24 21:36:36.650040,0 days 00:00:03.082073,True,squared_error,50,,1,4,523,TPESampler,COMPLETE
1532,0.34230560499126295,2025-04-24 21:36:34.089769,2025-04-24 21:36:38.534846,0 days 00:00:04.445077,True,squared_error,43,,1,3,812,TPESampler,COMPLETE
1533,0.3410197476914786,2025-04-24 21:36:34.343970,2025-04-24 21:36:37.777456,0 days 00:00:03.433486,True,squared_error,50,,1,3,588,TPESampler,COMPLETE
1534,0.3445427380364908,2025-04-24 21:36:34.650273,2025-04-24 21:36:37.781256,0 days 00:00:03.130983,True,squared_error,44,,1,2,507,TPESampler,COMPLETE
1535,0.34370649503539547,2025-04-24 21:36:36.904112,2025-04-24 21:36:39.915097,0 days 00:00:03.010985,True,squared_error,50,,1,2,468,TPESampler,COMPLETE
1536,0.47578896727798126,2025-04-24 21:36:37.913767,2025-04-24 21:36:40.696501,0 days 00:00:02.782734,True,squared_error,42,,3,49,698,TPESampler,COMPLETE
1537,0.4822971017590854,2025-04-24 21:36:37.959976,2025-04-24 21:36:40.044398,0 days 00:00:02.084422,True,squared_error,8,,3,2,409,TPESampler,COMPLETE
1538,0.34434329098971406,2025-04-24 21:36:38.938387,2025-04-24 21:36:42.103880,0 days 00:00:03.165493,True,squared_error,50,,1,2,507,TPESampler,COMPLETE
1539,0.4000583285858999,2025-04-24 21:36:40.112935,2025-04-24 21:36:43.875442,0 days 00:00:03.762507,True,absolute_error,48,sqrt,1,6,406,TPESampler,COMPLETE
1540,0.42708161885320334,2025-04-24 21:36:40.272155,2025-04-24 21:36:43.344196,0 days 00:00:03.072041,True,squared_error,50,,2,3,655,TPESampler,COMPLETE
1541,0.3786808232748718,2025-04-24 21:36:40.954696,2025-04-24 21:36:52.119100,0 days 00:00:11.164404,False,absolute_error,50,sqrt,1,2,790,TPESampler,COMPLETE
1542,0.4583571503832889,2025-04-24 21:36:42.304481,2025-04-24 21:36:45.809530,0 days 00:00:03.505049,False,squared_error,40,,3,4,733,TPESampler,COMPLETE
1543,0.384157386790574,2025-04-24 21:36:43.531746,2025-04-24 21:37:46.638457,0 days 00:01:03.106711,False,absolute_error,50,,1,7,679,TPESampler,COMPLETE
1544,0.4399649492459363,2025-04-24 21:36:44.124591,2025-04-24 21:36:46.039770,0 days 00:00:01.915179,False,squared_error,49,log2,1,2,592,TPESampler,COMPLETE
1545,0.35481017374525575,2025-04-24 21:36:45.999444,2025-04-24 21:36:49.224542,0 days 00:00:03.225098,True,squared_error,43,,1,5,500,TPESampler,COMPLETE
1546,0.4448663778279875,2025-04-24 21:36:46.567211,2025-04-24 21:37:03.300895,0 days 00:00:16.733684,True,absolute_error,50,,2,5,606,TPESampler,COMPLETE
1547,0.42789080288646675,2025-04-24 21:36:47.257655,2025-04-24 21:36:49.793379,0 days 00:00:02.535724,True,squared_error,50,,2,2,490,TPESampler,COMPLETE
1548,0.3450743232224384,2025-04-24 21:36:49.415510,2025-04-24 21:36:53.176680,0 days 00:00:03.761170,True,squared_error,41,,1,2,670,TPESampler,COMPLETE
1549,0.42863515044702455,2025-04-24 21:36:49.981659,2025-04-24 21:36:54.468489,0 days 00:00:04.486830,False,squared_error,49,,1,3,599,TPESampler,COMPLETE
1550,0.34244066472731516,2025-04-24 21:36:52.314389,2025-04-24 21:36:55.761758,0 days 00:00:03.447369,True,squared_error,50,,1,3,693,TPESampler,COMPLETE
1551,0.9388743442313703,2025-04-24 21:36:53.376126,2025-04-24 21:36:54.855638,0 days 00:00:01.479512,True,squared_error,33,log2,14,4,704,TPESampler,COMPLETE
1552,0.3735772901448292,2025-04-24 21:36:54.690555,2025-04-24 21:36:57.253153,0 days 00:00:02.562598,True,squared_error,30,,1,7,496,TPESampler,COMPLETE
1553,0.42798124103186785,2025-04-24 21:36:55.072524,2025-04-24 21:36:57.932695,0 days 00:00:02.860171,True,squared_error,43,,2,4,613,TPESampler,COMPLETE
1554,0.37721651083884444,2025-04-24 21:36:55.981505,2025-04-24 21:36:57.864507,0 days 00:00:01.883002,False,squared_error,49,sqrt,1,2,576,TPESampler,COMPLETE
1555,0.6031568143693814,2025-04-24 21:36:57.454229,2025-04-24 21:37:00.260916,0 days 00:00:02.806687,True,absolute_error,32,,11,3,384,TPESampler,COMPLETE
