number,value,datetime_start,datetime_complete,duration,params_bootstrap,params_criterion,params_max_depth,params_max_features,params_min_samples_leaf,params_min_samples_split,params_n_estimators,system_attrs_auto:sampler,state
282,0.34614371491037227,2025-04-24 21:21:36.337933,2025-04-24 21:21:39.650619,0 days 00:00:03.312686,True,squared_error,49,,1,4,552,TPESampler,COMPLETE
283,0.3410926111195977,2025-04-24 21:21:37.171566,2025-04-24 21:21:41.073917,0 days 00:00:03.902351,True,squared_error,50,,1,3,548,TPESampler,COMPLETE
284,0.44986090471329004,2025-04-24 21:21:37.229866,2025-04-24 21:21:40.223171,0 days 00:00:02.993305,True,absolute_error,37,sqrt,1,23,312,TPESampler,COMPLETE
285,0.9086112069809263,2025-04-24 21:21:37.663857,2025-04-24 21:21:38.853100,0 days 00:00:01.189243,True,squared_error,46,log2,3,3,247,TPESampler,COMPLETE
286,0.3751685118198821,2025-04-24 21:21:38.383160,2025-04-24 21:21:40.211259,0 days 00:00:01.828099,True,squared_error,48,sqrt,1,4,557,TPESampler,COMPLETE
287,0.4263452608190023,2025-04-24 21:21:39.119141,2025-04-24 21:21:41.144618,0 days 00:00:02.025477,True,squared_error,50,log2,1,3,581,TPESampler,COMPLETE
288,0.34386663721723926,2025-04-24 21:21:39.622391,2025-04-24 21:21:42.947420,0 days 00:00:03.325029,True,squared_error,40,,1,2,479,TPESampler,COMPLETE
289,0.3443328300742359,2025-04-24 21:21:40.030089,2025-04-24 21:21:44.280951,0 days 00:00:04.250862,True,squared_error,49,,1,2,569,TPESampler,COMPLETE
290,0.9710469147821748,2025-04-24 21:21:40.484304,2025-04-24 21:21:42.795489,0 days 00:00:02.311185,True,absolute_error,21,log2,5,6,725,TPESampler,COMPLETE
291,0.3472350253495102,2025-04-24 21:21:40.558191,2025-04-24 21:21:44.107885,0 days 00:00:03.549694,True,squared_error,49,,1,4,506,TPESampler,COMPLETE
292,0.3422782320560506,2025-04-24 21:21:41.367092,2025-04-24 21:21:44.721944,0 days 00:00:03.354852,True,squared_error,49,,1,3,509,TPESampler,COMPLETE
293,0.43530641284205757,2025-04-24 21:21:41.365638,2025-04-24 21:21:42.667614,0 days 00:00:01.301976,False,squared_error,41,sqrt,1,16,135,TPESampler,COMPLETE
294,0.3417731078955099,2025-04-24 21:21:42.874661,2025-04-24 21:21:46.373883,0 days 00:00:03.499222,True,squared_error,49,,1,3,558,TPESampler,COMPLETE
295,0.4283021978942291,2025-04-24 21:21:43.009409,2025-04-24 21:21:45.736742,0 days 00:00:02.727333,True,squared_error,45,,2,3,497,TPESampler,COMPLETE
296,0.4287330750492048,2025-04-24 21:21:43.175285,2025-04-24 21:21:46.251231,0 days 00:00:03.075946,True,squared_error,40,,2,4,568,TPESampler,COMPLETE
297,0.3412245288723547,2025-04-24 21:21:44.354912,2025-04-24 21:21:47.749159,0 days 00:00:03.394247,True,squared_error,45,,1,3,536,TPESampler,COMPLETE
298,0.34424190290613654,2025-04-24 21:21:44.469656,2025-04-24 21:21:47.789241,0 days 00:00:03.319585,True,squared_error,50,,1,2,483,TPESampler,COMPLETE
299,0.34099144596583175,2025-04-24 21:21:44.995537,2025-04-24 21:21:48.222820,0 days 00:00:03.227283,True,squared_error,50,,1,3,527,TPESampler,COMPLETE
300,0.3417943555309093,2025-04-24 21:21:45.920798,2025-04-24 21:21:49.228582,0 days 00:00:03.307784,True,squared_error,45,,1,3,557,TPESampler,COMPLETE
301,0.34724140386962216,2025-04-24 21:21:46.514075,2025-04-24 21:21:50.495767,0 days 00:00:03.981692,True,squared_error,48,,1,4,645,TPESampler,COMPLETE
302,0.3459009859929894,2025-04-24 21:21:47.106195,2025-04-24 21:21:50.622143,0 days 00:00:03.515948,True,squared_error,50,,1,4,610,TPESampler,COMPLETE
303,0.44242295545574073,2025-04-24 21:21:47.958083,2025-04-24 21:21:50.619431,0 days 00:00:02.661348,True,squared_error,46,,2,7,592,TPESampler,COMPLETE
304,0.44779148898252347,2025-04-24 21:21:48.158892,2025-04-24 21:21:50.701618,0 days 00:00:02.542726,False,squared_error,47,,2,5,391,TPESampler,COMPLETE
305,0.34574346190394906,2025-04-24 21:21:48.490408,2025-04-24 21:22:15.783800,0 days 00:00:27.293392,True,absolute_error,45,,1,3,451,TPESampler,COMPLETE
306,0.3467532586281495,2025-04-24 21:21:49.433194,2025-04-24 21:21:52.771093,0 days 00:00:03.337899,True,squared_error,48,,1,4,616,TPESampler,COMPLETE
307,0.34046577105443837,2025-04-24 21:21:50.668858,2025-04-24 21:21:53.970355,0 days 00:00:03.301497,True,squared_error,48,,1,3,603,TPESampler,COMPLETE
308,0.3591261243246615,2025-04-24 21:21:50.784282,2025-04-24 21:21:52.892223,0 days 00:00:02.107941,True,squared_error,19,,1,2,240,TPESampler,COMPLETE
309,0.3455977483442619,2025-04-24 21:21:50.857680,2025-04-24 21:22:29.140393,0 days 00:00:38.282713,True,absolute_error,49,,1,3,646,TPESampler,COMPLETE
310,0.4277176602690674,2025-04-24 21:21:50.862423,2025-04-24 21:21:54.233821,0 days 00:00:03.371398,True,squared_error,47,,2,3,510,TPESampler,COMPLETE
311,0.3414375157704845,2025-04-24 21:21:52.936572,2025-04-24 21:21:56.596130,0 days 00:00:03.659558,True,squared_error,43,,1,3,608,TPESampler,COMPLETE
312,0.34269978050402,2025-04-24 21:21:53.073729,2025-04-24 21:21:56.294930,0 days 00:00:03.221201,True,squared_error,45,,1,3,499,TPESampler,COMPLETE
313,0.3414766126371877,2025-04-24 21:21:54.140742,2025-04-24 21:21:57.463819,0 days 00:00:03.323077,True,squared_error,48,,1,3,654,TPESampler,COMPLETE
314,0.539749681367322,2025-04-24 21:21:54.423286,2025-04-24 21:21:57.742006,0 days 00:00:03.318720,True,squared_error,19,,5,9,879,TPESampler,COMPLETE
315,0.5632517128739785,2025-04-24 21:21:56.470529,2025-04-24 21:22:02.827751,0 days 00:00:06.357222,False,absolute_error,37,log2,1,47,753,TPESampler,COMPLETE
316,0.3426417087635523,2025-04-24 21:21:56.787875,2025-04-24 21:22:00.445666,0 days 00:00:03.657791,True,squared_error,50,,1,2,593,TPESampler,COMPLETE
317,0.3415071090116074,2025-04-24 21:21:57.668373,2025-04-24 21:22:00.686456,0 days 00:00:03.018083,True,squared_error,43,,1,3,600,TPESampler,COMPLETE
318,0.34100166370620855,2025-04-24 21:21:57.920223,2025-04-24 21:22:00.753107,0 days 00:00:02.832884,True,squared_error,50,,1,3,537,TPESampler,COMPLETE
319,0.35377241941427584,2025-04-24 21:22:00.623524,2025-04-24 21:22:03.973368,0 days 00:00:03.349844,True,squared_error,40,,1,5,612,TPESampler,COMPLETE
320,0.7641894279736309,2025-04-24 21:22:00.876736,2025-04-24 21:22:02.258620,0 days 00:00:01.381884,True,squared_error,45,sqrt,3,3,466,TPESampler,COMPLETE
321,0.34361056675902313,2025-04-24 21:22:00.928627,2025-04-24 21:22:04.990381,0 days 00:00:04.061754,True,squared_error,40,,1,3,690,TPESampler,COMPLETE
322,0.34206987393895655,2025-04-24 21:22:02.432460,2025-04-24 21:22:05.692751,0 days 00:00:03.260291,True,squared_error,50,,1,3,646,TPESampler,COMPLETE
323,0.3465490509697001,2025-04-24 21:22:03.048025,2025-04-24 21:22:06.460970,0 days 00:00:03.412945,True,squared_error,42,,1,4,592,TPESampler,COMPLETE
324,0.34362162790593836,2025-04-24 21:22:04.159963,2025-04-24 21:22:07.844286,0 days 00:00:03.684323,True,squared_error,41,,1,2,590,TPESampler,COMPLETE
325,0.34155657809053286,2025-04-24 21:22:05.166430,2025-04-24 21:22:08.527822,0 days 00:00:03.361392,True,squared_error,40,,1,3,602,TPESampler,COMPLETE
326,0.9166110280481543,2025-04-24 21:22:05.862684,2025-04-24 21:22:06.728048,0 days 00:00:00.865364,True,squared_error,13,log2,4,14,311,TPESampler,COMPLETE
327,0.34372825524457873,2025-04-24 21:22:06.637210,2025-04-24 21:22:10.908317,0 days 00:00:04.271107,True,squared_error,50,,1,2,626,TPESampler,COMPLETE
328,0.3419959252776409,2025-04-24 21:22:06.928924,2025-04-24 21:22:10.244230,0 days 00:00:03.315306,True,squared_error,50,,1,3,659,TPESampler,COMPLETE
329,0.9323763751542252,2025-04-24 21:22:08.036592,2025-04-24 21:22:08.837160,0 days 00:00:00.800568,False,squared_error,46,log2,13,10,287,TPESampler,COMPLETE
330,0.5223293719852959,2025-04-24 21:22:08.882303,2025-04-24 21:22:15.179725,0 days 00:00:06.297422,True,absolute_error,13,,4,3,450,TPESampler,COMPLETE
331,0.34249019067495545,2025-04-24 21:22:09.027625,2025-04-24 21:22:13.160430,0 days 00:00:04.132805,True,squared_error,40,,1,3,621,TPESampler,COMPLETE
332,0.34789216360423225,2025-04-24 21:22:10.408712,2025-04-24 21:22:13.055117,0 days 00:00:02.646405,True,squared_error,27,,1,3,557,TPESampler,COMPLETE
333,0.5525024657997548,2025-04-24 21:22:11.244112,2025-04-24 21:22:12.263690,0 days 00:00:01.019578,False,squared_error,25,sqrt,2,29,449,TPESampler,COMPLETE
334,0.3466230912104748,2025-04-24 21:22:12.429678,2025-04-24 21:22:15.350410,0 days 00:00:02.920732,True,squared_error,36,,1,4,547,TPESampler,COMPLETE
335,0.427897540081785,2025-04-24 21:22:13.238344,2025-04-24 21:22:15.676687,0 days 00:00:02.438343,True,squared_error,46,,2,3,588,TPESampler,COMPLETE
336,0.5206921971112078,2025-04-24 21:22:13.341731,2025-04-24 21:22:14.628835,0 days 00:00:01.287104,True,squared_error,36,log2,1,2,333,TPESampler,COMPLETE
337,0.7722327353439156,2025-04-24 21:22:14.805605,2025-04-24 21:22:15.598724,0 days 00:00:00.793119,True,squared_error,7,sqrt,2,2,135,TPESampler,COMPLETE
338,0.39695766883914907,2025-04-24 21:22:15.427771,2025-04-24 21:22:18.601460,0 days 00:00:03.173689,True,squared_error,48,,1,11,591,TPESampler,COMPLETE
339,0.39316685875775803,2025-04-24 21:22:15.518138,2025-04-24 21:22:18.597872,0 days 00:00:03.079734,True,squared_error,49,,1,10,505,TPESampler,COMPLETE
340,0.3430872768234457,2025-04-24 21:22:15.865165,2025-04-24 21:22:20.064456,0 days 00:00:04.199291,True,squared_error,43,,1,2,534,TPESampler,COMPLETE
341,0.6004992037979979,2025-04-24 21:22:15.862996,2025-04-24 21:22:19.816280,0 days 00:00:03.953284,True,absolute_error,7,,8,20,444,TPESampler,COMPLETE
342,0.7574870218435652,2025-04-24 21:22:16.299083,2025-04-24 21:22:17.385835,0 days 00:00:01.086752,False,squared_error,9,sqrt,4,28,118,TPESampler,COMPLETE
343,0.3765638407506981,2025-04-24 21:22:17.671253,2025-04-24 21:22:19.772190,0 days 00:00:02.100937,True,squared_error,44,sqrt,1,2,724,TPESampler,COMPLETE
344,0.34746420383135196,2025-04-24 21:22:18.739121,2025-04-24 21:22:22.216677,0 days 00:00:03.477556,True,squared_error,39,,1,4,625,TPESampler,COMPLETE
345,0.4276364440871579,2025-04-24 21:22:18.785491,2025-04-24 21:22:21.859540,0 days 00:00:03.074049,True,squared_error,48,,2,4,605,TPESampler,COMPLETE
346,0.34226817837362566,2025-04-24 21:22:19.931013,2025-04-24 21:22:23.166969,0 days 00:00:03.235956,True,squared_error,42,,1,3,533,TPESampler,COMPLETE
347,0.4294545255191052,2025-04-24 21:22:19.987429,2025-04-24 21:22:22.394407,0 days 00:00:02.406978,True,squared_error,41,,2,2,454,TPESampler,COMPLETE
348,0.41351472551900514,2025-04-24 21:22:20.263994,2025-04-24 21:22:23.442290,0 days 00:00:03.178296,False,squared_error,46,,1,4,425,TPESampler,COMPLETE
349,0.9241550450449566,2025-04-24 21:22:22.035166,2025-04-24 21:22:22.945633,0 days 00:00:00.910467,True,absolute_error,5,log2,1,23,153,TPESampler,COMPLETE
350,0.5022155838984068,2025-04-24 21:22:22.413523,2025-04-24 21:22:34.067610,0 days 00:00:11.654087,True,absolute_error,25,,3,20,689,TPESampler,COMPLETE
351,0.49642691153686375,2025-04-24 21:22:22.645704,2025-04-24 21:22:25.007751,0 days 00:00:02.362047,True,squared_error,39,log2,1,5,684,TPESampler,COMPLETE
352,0.34292455089976603,2025-04-24 21:22:23.142130,2025-04-24 21:22:26.411528,0 days 00:00:03.269398,True,squared_error,50,,1,2,454,TPESampler,COMPLETE
353,0.4729843260167671,2025-04-24 21:22:23.570602,2025-04-24 21:22:30.462658,0 days 00:00:06.892056,True,absolute_error,24,sqrt,1,2,792,TPESampler,COMPLETE
354,0.34764026362405404,2025-04-24 21:22:23.745707,2025-04-24 21:22:27.516403,0 days 00:00:03.770696,True,squared_error,48,,1,4,667,TPESampler,COMPLETE
355,0.4294762643868302,2025-04-24 21:22:25.175078,2025-04-24 21:22:27.142316,0 days 00:00:01.967238,True,squared_error,50,,2,2,454,TPESampler,COMPLETE
356,0.34623775626233233,2025-04-24 21:22:26.579297,2025-04-24 21:22:29.776557,0 days 00:00:03.197260,True,squared_error,49,,1,4,613,TPESampler,COMPLETE
357,0.42792731015546,2025-04-24 21:22:27.310526,2025-04-24 21:22:31.334036,0 days 00:00:04.023510,False,squared_error,38,,1,2,571,TPESampler,COMPLETE
358,0.3428720509093617,2025-04-24 21:22:27.718002,2025-04-24 21:22:30.371379,0 days 00:00:02.653377,True,squared_error,39,,1,3,513,TPESampler,COMPLETE
359,0.8772728108603133,2025-04-24 21:22:29.316458,2025-04-24 21:22:30.505473,0 days 00:00:01.189015,True,squared_error,44,log2,2,2,452,TPESampler,COMPLETE
360,0.5981625490675878,2025-04-24 21:22:29.993907,2025-04-24 21:22:32.375485,0 days 00:00:02.381578,True,absolute_error,29,log2,1,3,323,TPESampler,COMPLETE
361,0.34240165158276153,2025-04-24 21:22:30.618090,2025-04-24 21:22:34.686000,0 days 00:00:04.067910,True,squared_error,42,,1,3,579,TPESampler,COMPLETE
362,0.8692293765839806,2025-04-24 21:22:30.666684,2025-04-24 21:22:32.055282,0 days 00:00:01.388598,False,squared_error,6,log2,2,2,199,TPESampler,COMPLETE
363,0.3471829391160752,2025-04-24 21:22:30.820650,2025-04-24 21:22:33.953582,0 days 00:00:03.132932,True,squared_error,44,,1,4,494,TPESampler,COMPLETE
364,0.8958573920689499,2025-04-24 21:22:31.685641,2025-04-24 21:22:33.465223,0 days 00:00:01.779582,False,absolute_error,25,sqrt,7,17,592,TPESampler,COMPLETE
365,0.4437034908380527,2025-04-24 21:22:32.258182,2025-04-24 21:22:46.130947,0 days 00:00:13.872765,True,absolute_error,38,,2,2,514,TPESampler,COMPLETE
366,0.983591049542137,2025-04-24 21:22:32.555950,2025-04-24 21:22:33.948720,0 days 00:00:01.392770,False,absolute_error,50,log2,13,10,926,TPESampler,COMPLETE
367,0.4612605301898256,2025-04-24 21:22:33.636822,2025-04-24 21:22:36.831960,0 days 00:00:03.195138,True,squared_error,16,,1,39,936,TPESampler,COMPLETE
368,0.34123420690753936,2025-04-24 21:22:34.153919,2025-04-24 21:22:37.735579,0 days 00:00:03.581660,True,squared_error,45,,1,3,532,TPESampler,COMPLETE
369,0.3535303601790414,2025-04-24 21:22:34.208577,2025-04-24 21:22:37.502111,0 days 00:00:03.293534,True,squared_error,49,,1,5,519,TPESampler,COMPLETE
370,0.3430074216900146,2025-04-24 21:22:34.320231,2025-04-24 21:22:38.182692,0 days 00:00:03.862461,True,squared_error,43,,1,2,602,TPESampler,COMPLETE
371,0.3408473073476281,2025-04-24 21:22:34.934754,2025-04-24 21:22:38.188756,0 days 00:00:03.254002,True,squared_error,50,,1,3,532,TPESampler,COMPLETE
372,0.34591308839752727,2025-04-24 21:22:37.010231,2025-04-24 21:22:39.170187,0 days 00:00:02.159956,True,squared_error,36,,1,2,365,TPESampler,COMPLETE
373,0.43012019976435173,2025-04-24 21:22:37.694861,2025-04-24 21:22:40.421260,0 days 00:00:02.726399,True,squared_error,48,,2,5,538,TPESampler,COMPLETE
374,0.34286764315803714,2025-04-24 21:22:37.954145,2025-04-24 21:22:41.205773,0 days 00:00:03.251628,True,squared_error,40,,1,3,473,TPESampler,COMPLETE
375,0.6045219317748008,2025-04-24 21:22:38.532428,2025-04-24 21:22:43.273392,0 days 00:00:04.740964,True,absolute_error,14,,12,8,864,TPESampler,COMPLETE
376,0.34196054896483064,2025-04-24 21:22:38.639151,2025-04-24 21:22:42.325948,0 days 00:00:03.686797,True,squared_error,48,,1,3,641,TPESampler,COMPLETE
377,0.3427700958470413,2025-04-24 21:22:39.553621,2025-04-24 21:22:42.624821,0 days 00:00:03.071200,True,squared_error,50,,1,2,547,TPESampler,COMPLETE
378,0.3459618495222167,2025-04-24 21:22:41.076528,2025-04-24 21:22:44.269415,0 days 00:00:03.192887,True,squared_error,50,,1,4,535,TPESampler,COMPLETE
379,0.4296771785214944,2025-04-24 21:22:41.444087,2025-04-24 21:22:43.305072,0 days 00:00:01.860985,True,squared_error,41,,2,5,250,TPESampler,COMPLETE
380,0.3410775426201463,2025-04-24 21:22:42.574710,2025-04-24 21:22:45.799288,0 days 00:00:03.224578,True,squared_error,50,,1,3,534,TPESampler,COMPLETE
381,0.42851519602921423,2025-04-24 21:22:42.898195,2025-04-24 21:22:45.921259,0 days 00:00:03.023064,True,squared_error,50,,2,2,635,TPESampler,COMPLETE
382,0.34122168590553703,2025-04-24 21:22:43.449811,2025-04-24 21:22:47.492703,0 days 00:00:04.042892,True,squared_error,50,,1,3,525,TPESampler,COMPLETE
383,0.7892489733552416,2025-04-24 21:22:43.533716,2025-04-24 21:22:47.236626,0 days 00:00:03.702910,True,absolute_error,32,sqrt,3,27,818,TPESampler,COMPLETE
384,0.42784288039713897,2025-04-24 21:22:44.945085,2025-04-24 21:22:48.633420,0 days 00:00:03.688335,True,squared_error,39,,2,3,589,TPESampler,COMPLETE
385,0.6522156073752293,2025-04-24 21:22:46.044297,2025-04-24 21:22:48.067819,0 days 00:00:02.023522,False,squared_error,10,sqrt,1,15,961,TPESampler,COMPLETE
386,0.6025660474874286,2025-04-24 21:22:46.325445,2025-04-24 21:22:49.114428,0 days 00:00:02.788983,True,absolute_error,33,,9,13,236,TPESampler,COMPLETE
387,0.5110817812992658,2025-04-24 21:22:46.454690,2025-04-24 21:22:55.310356,0 days 00:00:08.855666,False,absolute_error,5,,1,42,178,TPESampler,COMPLETE
388,0.8823844883223928,2025-04-24 21:22:47.770913,2025-04-24 21:22:49.798945,0 days 00:00:02.028032,True,squared_error,48,log2,2,5,631,TPESampler,COMPLETE
389,0.911648670532384,2025-04-24 21:22:48.282759,2025-04-24 21:22:50.559764,0 days 00:00:02.277005,False,squared_error,50,log2,5,37,676,TPESampler,COMPLETE
390,0.3419630169351862,2025-04-24 21:22:48.308201,2025-04-24 21:22:52.104827,0 days 00:00:03.796626,True,squared_error,49,,1,3,564,TPESampler,COMPLETE
391,0.6654369034006408,2025-04-24 21:22:49.214282,2025-04-24 21:22:54.319776,0 days 00:00:05.105494,False,absolute_error,45,sqrt,3,3,810,TPESampler,COMPLETE
392,0.9520146277058964,2025-04-24 21:22:49.510595,2025-04-24 21:22:51.992716,0 days 00:00:02.482121,True,absolute_error,47,log2,3,18,984,TPESampler,COMPLETE
393,0.34772811147908617,2025-04-24 21:22:50.415452,2025-04-24 21:22:54.666873,0 days 00:00:04.251421,True,squared_error,48,,1,4,673,TPESampler,COMPLETE
394,0.45304117459596643,2025-04-24 21:22:51.284086,2025-04-24 21:23:01.272511,0 days 00:00:09.988425,True,absolute_error,43,,1,22,173,TPESampler,COMPLETE
395,0.8736735980024304,2025-04-24 21:22:52.270014,2025-04-24 21:22:53.609300,0 days 00:00:01.339286,False,absolute_error,21,log2,2,30,244,TPESampler,COMPLETE
396,0.433028951375777,2025-04-24 21:22:52.361974,2025-04-24 21:23:00.478661,0 days 00:00:08.116687,False,absolute_error,27,,2,4,146,TPESampler,COMPLETE
397,0.4746616303995336,2025-04-24 21:22:53.774858,2025-04-24 21:22:58.359409,0 days 00:00:04.584551,True,absolute_error,50,log2,1,8,687,TPESampler,COMPLETE
398,0.9840045179317248,2025-04-24 21:22:55.409462,2025-04-24 21:22:57.205954,0 days 00:00:01.796492,False,absolute_error,7,log2,15,26,860,TPESampler,COMPLETE
399,0.438112028299343,2025-04-24 21:22:55.535712,2025-04-24 21:22:57.531507,0 days 00:00:01.995795,True,squared_error,49,,2,6,387,TPESampler,COMPLETE
400,0.3474276027386774,2025-04-24 21:22:55.596180,2025-04-24 21:22:59.845813,0 days 00:00:04.249633,True,squared_error,50,,1,4,687,TPESampler,COMPLETE
401,0.6212543798388657,2025-04-24 21:22:57.379192,2025-04-24 21:22:59.277134,0 days 00:00:01.897942,True,squared_error,25,log2,1,9,950,TPESampler,COMPLETE
402,0.4121560375767761,2025-04-24 21:22:57.725976,2025-04-24 21:23:41.991775,0 days 00:00:44.265799,False,absolute_error,14,,1,3,663,TPESampler,COMPLETE
403,0.9166826015454179,2025-04-24 21:22:58.623286,2025-04-24 21:22:59.755496,0 days 00:00:01.132210,False,squared_error,38,log2,6,8,954,TPESampler,COMPLETE
404,0.8077970639048699,2025-04-24 21:22:59.455648,2025-04-24 21:23:01.274023,0 days 00:00:01.818375,False,absolute_error,7,sqrt,4,12,378,TPESampler,COMPLETE
405,0.6491301227729739,2025-04-24 21:23:00.018132,2025-04-24 21:23:01.920170,0 days 00:00:01.902038,True,squared_error,48,sqrt,2,5,617,TPESampler,COMPLETE
406,0.37467648893712235,2025-04-24 21:23:00.465164,2025-04-24 21:23:02.551136,0 days 00:00:02.085972,True,squared_error,49,sqrt,1,4,415,TPESampler,COMPLETE
407,0.35337957835355815,2025-04-24 21:23:00.664319,2025-04-24 21:23:04.245692,0 days 00:00:03.581373,True,squared_error,41,,1,5,451,TPESampler,COMPLETE
408,0.42808351861148136,2025-04-24 21:23:01.607249,2025-04-24 21:23:05.258685,0 days 00:00:03.651436,True,squared_error,50,,2,3,612,TPESampler,COMPLETE
409,0.34200175978687464,2025-04-24 21:23:01.688376,2025-04-24 21:23:06.126654,0 days 00:00:04.438278,True,squared_error,50,,1,3,631,TPESampler,COMPLETE
410,0.34523000665121156,2025-04-24 21:23:02.579981,2025-04-24 21:23:06.594460,0 days 00:00:04.014479,True,squared_error,37,,1,2,686,TPESampler,COMPLETE
411,0.34161373196363853,2025-04-24 21:23:02.969073,2025-04-24 21:23:06.638102,0 days 00:00:03.669029,True,squared_error,50,,1,3,615,TPESampler,COMPLETE
412,0.34218612148158045,2025-04-24 21:23:04.414905,2025-04-24 21:23:07.104902,0 days 00:00:02.689997,True,squared_error,48,,1,3,497,TPESampler,COMPLETE
413,0.7606713675213099,2025-04-24 21:23:05.441084,2025-04-24 21:23:07.625237,0 days 00:00:02.184153,False,absolute_error,30,sqrt,4,3,520,TPESampler,COMPLETE
414,0.34668359748767763,2025-04-24 21:23:06.357605,2025-04-24 21:23:09.390473,0 days 00:00:03.032868,True,squared_error,49,,1,4,462,TPESampler,COMPLETE
415,0.36186989245299866,2025-04-24 21:23:06.845669,2025-04-24 21:23:09.954645,0 days 00:00:03.108976,True,squared_error,42,,1,6,483,TPESampler,COMPLETE
416,0.9507094430716213,2025-04-24 21:23:06.868050,2025-04-24 21:23:07.908192,0 days 00:00:01.040142,False,absolute_error,14,sqrt,11,3,355,TPESampler,COMPLETE
417,0.9733830235681358,2025-04-24 21:23:07.321596,2025-04-24 21:23:08.508173,0 days 00:00:01.186577,False,absolute_error,48,sqrt,15,2,226,TPESampler,COMPLETE
418,0.37515299610259845,2025-04-24 21:23:08.057876,2025-04-24 21:23:10.518708,0 days 00:00:02.460832,True,squared_error,47,sqrt,1,2,573,TPESampler,COMPLETE
419,0.3446963551777916,2025-04-24 21:23:08.292001,2025-04-24 21:23:11.548091,0 days 00:00:03.256090,True,squared_error,39,,1,2,556,TPESampler,COMPLETE
420,0.3417439757077381,2025-04-24 21:23:08.740834,2025-04-24 21:23:12.046089,0 days 00:00:03.305255,True,squared_error,50,,1,3,575,TPESampler,COMPLETE
421,0.41232172335620754,2025-04-24 21:23:09.633927,2025-04-24 21:23:13.516278,0 days 00:00:03.882351,False,squared_error,50,,1,4,529,TPESampler,COMPLETE
422,0.34735638940943575,2025-04-24 21:23:10.167471,2025-04-24 21:23:13.029030,0 days 00:00:02.861559,True,squared_error,38,,1,4,460,TPESampler,COMPLETE
423,0.974482602947799,2025-04-24 21:23:10.753938,2025-04-24 21:23:12.310515,0 days 00:00:01.556577,True,absolute_error,11,log2,5,29,619,TPESampler,COMPLETE
