number,value,datetime_start,datetime_complete,duration,params_bootstrap,params_criterion,params_max_depth,params_max_features,params_min_samples_leaf,params_min_samples_split,params_n_estimators,system_attrs_auto:sampler,state
2544,0.6494318859066016,2025-04-24 21:49:52.702762,2025-04-24 21:49:54.175812,0 days 00:00:01.473050,True,squared_error,49,sqrt,2,5,616,TPESampler,COMPLETE
2545,0.34223447112866057,2025-04-24 21:49:53.891611,2025-04-24 21:49:57.247055,0 days 00:00:03.355444,True,squared_error,44,,1,3,588,TPESampler,COMPLETE
2546,0.34357396852286565,2025-04-24 21:49:54.381400,2025-04-24 21:49:57.656095,0 days 00:00:03.274695,True,squared_error,50,,1,2,565,TPESampler,COMPLETE
2547,0.34814291702597955,2025-04-24 21:49:55.325941,2025-04-24 21:49:57.220302,0 days 00:00:01.894361,True,squared_error,40,,1,4,315,TPESampler,COMPLETE
2548,0.3416709863232672,2025-04-24 21:49:57.376340,2025-04-24 21:50:01.410832,0 days 00:00:04.034492,True,squared_error,50,,1,3,621,TPESampler,COMPLETE
2549,0.34869324951444985,2025-04-24 21:49:57.431558,2025-04-24 21:49:59.750026,0 days 00:00:02.318468,True,squared_error,50,,1,4,273,TPESampler,COMPLETE
2550,0.3475590504592689,2025-04-24 21:49:57.895726,2025-04-24 21:49:59.764063,0 days 00:00:01.868337,True,squared_error,50,,1,4,266,TPESampler,COMPLETE
2551,0.9152168472279564,2025-04-24 21:50:00.000032,2025-04-24 21:50:01.086078,0 days 00:00:01.086046,False,squared_error,31,log2,6,38,443,TPESampler,COMPLETE
2552,0.3436920765754302,2025-04-24 21:50:00.002933,2025-04-24 21:50:03.820226,0 days 00:00:03.817293,True,squared_error,41,,1,3,567,TPESampler,COMPLETE
2553,0.34287348299654136,2025-04-24 21:50:01.307707,2025-04-24 21:50:04.131617,0 days 00:00:02.823910,True,squared_error,43,,1,3,513,TPESampler,COMPLETE
2554,0.3434665952140041,2025-04-24 21:50:01.351202,2025-04-24 21:50:04.552251,0 days 00:00:03.201049,True,squared_error,44,,1,3,482,TPESampler,COMPLETE
2555,0.4295280359131222,2025-04-24 21:50:01.702281,2025-04-24 21:50:05.977066,0 days 00:00:04.274785,False,squared_error,50,,1,3,525,TPESampler,COMPLETE
2556,0.42873132790728574,2025-04-24 21:50:04.256413,2025-04-24 21:50:07.343750,0 days 00:00:03.087337,True,squared_error,50,,2,2,477,TPESampler,COMPLETE
2557,0.8808624889351561,2025-04-24 21:50:04.363588,2025-04-24 21:50:06.039125,0 days 00:00:01.675537,True,squared_error,50,log2,2,5,413,TPESampler,COMPLETE
2558,0.6479022126340238,2025-04-24 21:50:05.007519,2025-04-24 21:50:08.964685,0 days 00:00:03.957166,False,absolute_error,20,,15,9,347,TPESampler,COMPLETE
2559,0.3456822379704499,2025-04-24 21:50:06.477800,2025-04-24 21:50:10.132873,0 days 00:00:03.655073,True,squared_error,50,,1,4,607,TPESampler,COMPLETE
2560,0.3537863709666101,2025-04-24 21:50:06.535256,2025-04-24 21:50:10.873937,0 days 00:00:04.338681,True,squared_error,50,,1,5,664,TPESampler,COMPLETE
2561,0.9327046323618299,2025-04-24 21:50:06.708198,2025-04-24 21:50:08.018662,0 days 00:00:01.310464,False,squared_error,9,log2,15,48,314,TPESampler,COMPLETE
2562,0.3417059678663206,2025-04-24 21:50:07.819160,2025-04-24 21:50:11.269572,0 days 00:00:03.450412,True,squared_error,50,,1,3,513,TPESampler,COMPLETE
2563,0.4295888559792526,2025-04-24 21:50:08.243014,2025-04-24 21:50:10.389759,0 days 00:00:02.146745,True,squared_error,43,,2,2,420,TPESampler,COMPLETE
2564,0.34482414609667356,2025-04-24 21:50:09.186492,2025-04-24 21:50:11.639300,0 days 00:00:02.452808,True,squared_error,50,,1,2,323,TPESampler,COMPLETE
2565,0.3728858380945441,2025-04-24 21:50:10.348484,2025-04-24 21:50:12.184442,0 days 00:00:01.835958,True,squared_error,49,sqrt,1,4,528,TPESampler,COMPLETE
2566,0.35375690101402674,2025-04-24 21:50:10.726519,2025-04-24 21:50:14.006294,0 days 00:00:03.279775,True,squared_error,50,,1,5,495,TPESampler,COMPLETE
2567,0.43017085465601546,2025-04-24 21:50:11.214909,2025-04-24 21:50:14.922168,0 days 00:00:03.707259,True,squared_error,43,,2,5,516,TPESampler,COMPLETE
2568,0.36133504243879283,2025-04-24 21:50:11.767536,2025-04-24 21:50:17.510035,0 days 00:00:05.742499,True,squared_error,43,,1,6,917,TPESampler,COMPLETE
2569,0.34275706224037317,2025-04-24 21:50:11.991961,2025-04-24 21:50:16.943248,0 days 00:00:04.951287,True,squared_error,43,,1,3,672,TPESampler,COMPLETE
2570,0.3421655683377118,2025-04-24 21:50:12.565085,2025-04-24 21:50:16.338753,0 days 00:00:03.773668,True,squared_error,44,,1,3,593,TPESampler,COMPLETE
2571,0.4541010804470594,2025-04-24 21:50:14.230563,2025-04-24 21:50:15.753870,0 days 00:00:01.523307,False,squared_error,33,sqrt,1,33,652,TPESampler,COMPLETE
2572,0.3826492428706267,2025-04-24 21:50:15.159703,2025-04-24 21:50:17.045017,0 days 00:00:01.885314,True,squared_error,40,sqrt,1,3,590,TPESampler,COMPLETE
2573,0.42759343327086047,2025-04-24 21:50:16.003356,2025-04-24 21:50:18.942445,0 days 00:00:02.939089,True,squared_error,50,,2,4,607,TPESampler,COMPLETE
2574,0.3407867816395502,2025-04-24 21:50:16.564217,2025-04-24 21:50:20.361514,0 days 00:00:03.797297,True,squared_error,50,,1,3,589,TPESampler,COMPLETE
2575,0.34280643791569654,2025-04-24 21:50:17.169023,2025-04-24 21:50:20.778076,0 days 00:00:03.609053,True,squared_error,43,,1,3,474,TPESampler,COMPLETE
2576,0.42960296441377416,2025-04-24 21:50:17.255294,2025-04-24 21:50:20.229629,0 days 00:00:02.974335,True,squared_error,50,,2,3,434,TPESampler,COMPLETE
2577,0.3449400256069648,2025-04-24 21:50:17.812900,2025-04-24 21:50:23.147909,0 days 00:00:05.335009,True,squared_error,50,,1,2,760,TPESampler,COMPLETE
2578,0.344337734860416,2025-04-24 21:50:19.158644,2025-04-24 21:50:23.220916,0 days 00:00:04.062272,True,squared_error,44,,1,3,745,TPESampler,COMPLETE
2579,0.49216778554617185,2025-04-24 21:50:20.463511,2025-04-24 21:50:22.258429,0 days 00:00:01.794918,False,squared_error,35,,5,6,175,TPESampler,COMPLETE
2580,0.34434177164283314,2025-04-24 21:50:20.580994,2025-04-24 21:50:24.837439,0 days 00:00:04.256445,True,squared_error,50,,1,2,681,TPESampler,COMPLETE
2581,0.35401757282675145,2025-04-24 21:50:21.182547,2025-04-24 21:50:24.564888,0 days 00:00:03.382341,True,squared_error,50,,1,5,500,TPESampler,COMPLETE
2582,0.34224146347353884,2025-04-24 21:50:22.472826,2025-04-24 21:50:24.986653,0 days 00:00:02.513827,True,squared_error,50,,1,3,341,TPESampler,COMPLETE
2583,0.3429325080562901,2025-04-24 21:50:23.446721,2025-04-24 21:50:27.118796,0 days 00:00:03.672075,True,squared_error,50,,1,2,583,TPESampler,COMPLETE
2584,0.3486516081416171,2025-04-24 21:50:23.455568,2025-04-24 21:50:26.627597,0 days 00:00:03.172029,True,squared_error,34,,1,4,433,TPESampler,COMPLETE
2585,0.4272706009081607,2025-04-24 21:50:24.932779,2025-04-24 21:50:28.716933,0 days 00:00:03.784154,True,squared_error,50,,2,3,679,TPESampler,COMPLETE
2586,0.3540468569392378,2025-04-24 21:50:25.073078,2025-04-24 21:50:27.503631,0 days 00:00:02.430553,True,squared_error,43,,1,5,405,TPESampler,COMPLETE
2587,0.3458811856903597,2025-04-24 21:50:25.269227,2025-04-24 21:50:29.841205,0 days 00:00:04.571978,True,squared_error,34,,1,2,680,TPESampler,COMPLETE
2588,0.4270114492798187,2025-04-24 21:50:26.839771,2025-04-24 21:50:29.466223,0 days 00:00:02.626452,True,squared_error,43,,2,3,524,TPESampler,COMPLETE
2589,0.34203555312732054,2025-04-24 21:50:27.326862,2025-04-24 21:50:30.291541,0 days 00:00:02.964679,True,squared_error,50,,1,3,400,TPESampler,COMPLETE
2590,0.34488231632450655,2025-04-24 21:50:27.781014,2025-04-24 21:50:31.624802,0 days 00:00:03.843788,True,squared_error,42,,1,2,564,TPESampler,COMPLETE
2591,0.9225119525118658,2025-04-24 21:50:28.983696,2025-04-24 21:50:30.030380,0 days 00:00:01.046684,True,squared_error,42,sqrt,9,23,123,TPESampler,COMPLETE
2592,0.4484752510049414,2025-04-24 21:50:29.083750,2025-04-24 21:50:31.907911,0 days 00:00:02.824161,False,squared_error,50,,2,4,372,TPESampler,COMPLETE
2593,0.4429380354541809,2025-04-24 21:50:29.742358,2025-04-24 21:50:32.813749,0 days 00:00:03.071391,True,squared_error,50,,2,7,503,TPESampler,COMPLETE
2594,0.34638081248563973,2025-04-24 21:50:30.127499,2025-04-24 21:50:33.604926,0 days 00:00:03.477427,True,squared_error,50,,1,4,424,TPESampler,COMPLETE
2595,0.3472229258103204,2025-04-24 21:50:30.352824,2025-04-24 21:50:34.323975,0 days 00:00:03.971151,True,squared_error,43,,1,4,509,TPESampler,COMPLETE
2596,0.3408494723725512,2025-04-24 21:50:30.616596,2025-04-24 21:50:33.926120,0 days 00:00:03.309524,True,squared_error,50,,1,3,450,TPESampler,COMPLETE
2597,0.34614225204803484,2025-04-24 21:50:31.868880,2025-04-24 21:50:35.389441,0 days 00:00:03.520561,True,squared_error,43,,1,4,553,TPESampler,COMPLETE
2598,0.42664565411533345,2025-04-24 21:50:32.183177,2025-04-24 21:50:36.450260,0 days 00:00:04.267083,False,squared_error,41,,1,3,552,TPESampler,COMPLETE
2599,0.5624307193539423,2025-04-24 21:50:33.063695,2025-04-24 21:50:35.563269,0 days 00:00:02.499574,True,squared_error,30,log2,1,2,635,TPESampler,COMPLETE
2600,0.42956479505551204,2025-04-24 21:50:33.844616,2025-04-24 21:50:36.808282,0 days 00:00:02.963666,True,squared_error,49,,2,4,384,TPESampler,COMPLETE
2601,0.9114348140633688,2025-04-24 21:50:34.126465,2025-04-24 21:50:35.365625,0 days 00:00:01.239160,True,squared_error,23,sqrt,7,11,152,TPESampler,COMPLETE
2602,0.976421888516996,2025-04-24 21:50:34.717685,2025-04-24 21:50:36.287080,0 days 00:00:01.569395,False,absolute_error,18,log2,11,5,364,TPESampler,COMPLETE
2603,0.34421347621441567,2025-04-24 21:50:35.585369,2025-04-24 21:50:40.086199,0 days 00:00:04.500830,True,squared_error,44,,1,2,484,TPESampler,COMPLETE
2604,0.42992858086981667,2025-04-24 21:50:35.656138,2025-04-24 21:50:38.981738,0 days 00:00:03.325600,True,squared_error,50,,2,2,406,TPESampler,COMPLETE
2605,0.4298403103941753,2025-04-24 21:50:35.925058,2025-04-24 21:50:38.761387,0 days 00:00:02.836329,True,squared_error,45,,2,3,397,TPESampler,COMPLETE
2606,0.3426425179282081,2025-04-24 21:50:36.760862,2025-04-24 21:50:40.649071,0 days 00:00:03.888209,True,squared_error,42,,1,3,396,TPESampler,COMPLETE
2607,0.778446822702353,2025-04-24 21:50:36.872981,2025-04-24 21:50:38.696564,0 days 00:00:01.823583,True,squared_error,12,sqrt,3,23,241,TPESampler,COMPLETE
2608,0.5871433195686451,2025-04-24 21:50:37.342740,2025-04-24 21:50:38.933509,0 days 00:00:01.590769,True,absolute_error,35,log2,1,9,102,TPESampler,COMPLETE
2609,0.3475730277061886,2025-04-24 21:50:38.924411,2025-04-24 21:50:41.201734,0 days 00:00:02.277323,True,squared_error,43,,1,4,243,TPESampler,COMPLETE
2610,0.8767420895540555,2025-04-24 21:50:38.956903,2025-04-24 21:50:41.386553,0 days 00:00:02.429650,True,squared_error,37,log2,2,2,810,TPESampler,COMPLETE
2611,0.6523906695608721,2025-04-24 21:50:39.318394,2025-04-24 21:50:41.516937,0 days 00:00:02.198543,True,squared_error,49,sqrt,2,3,424,TPESampler,COMPLETE
2612,0.3457664931520605,2025-04-24 21:50:39.417093,2025-04-24 21:50:42.011312,0 days 00:00:02.594219,True,squared_error,50,,1,2,268,TPESampler,COMPLETE
2613,0.3467160406235208,2025-04-24 21:50:40.405867,2025-04-24 21:50:43.577922,0 days 00:00:03.172055,True,squared_error,50,,1,4,398,TPESampler,COMPLETE
2614,0.34388182657364985,2025-04-24 21:50:41.070078,2025-04-24 21:50:44.483671,0 days 00:00:03.413593,True,squared_error,50,,1,2,404,TPESampler,COMPLETE
2615,0.35354654277088365,2025-04-24 21:50:41.623908,2025-04-24 21:50:44.774407,0 days 00:00:03.150499,True,squared_error,44,,1,5,416,TPESampler,COMPLETE
2616,0.3435501246876056,2025-04-24 21:50:41.724435,2025-04-24 21:50:44.488137,0 days 00:00:02.763702,True,squared_error,40,,1,3,324,TPESampler,COMPLETE
2617,0.42794287176309753,2025-04-24 21:50:41.917453,2025-04-24 21:50:44.852127,0 days 00:00:02.934674,True,squared_error,50,,2,3,495,TPESampler,COMPLETE
2618,0.34252622674314587,2025-04-24 21:50:42.321814,2025-04-24 21:50:45.263865,0 days 00:00:02.942051,True,squared_error,42,,1,3,402,TPESampler,COMPLETE
2619,0.3430246869153116,2025-04-24 21:50:43.791230,2025-04-24 21:50:46.636534,0 days 00:00:02.845304,True,squared_error,44,,1,3,406,TPESampler,COMPLETE
2620,0.427625355975334,2025-04-24 21:50:44.662423,2025-04-24 21:50:48.238015,0 days 00:00:03.575592,True,squared_error,43,,2,2,606,TPESampler,COMPLETE
2621,0.34280643791569654,2025-04-24 21:50:44.711226,2025-04-24 21:50:48.300095,0 days 00:00:03.588869,True,squared_error,43,,1,3,474,TPESampler,COMPLETE
2622,0.3410698666927273,2025-04-24 21:50:44.993228,2025-04-24 21:50:49.186824,0 days 00:00:04.193596,True,squared_error,49,,1,3,448,TPESampler,COMPLETE
2623,0.3431567393076196,2025-04-24 21:50:45.531137,2025-04-24 21:50:49.000638,0 days 00:00:03.469501,True,squared_error,50,,1,2,458,TPESampler,COMPLETE
2624,0.8852232153583955,2025-04-24 21:50:45.824865,2025-04-24 21:50:47.619590,0 days 00:00:01.794725,True,squared_error,34,sqrt,6,19,417,TPESampler,COMPLETE
2625,0.34338993694648146,2025-04-24 21:50:47.006986,2025-04-24 21:50:51.199326,0 days 00:00:04.192340,True,squared_error,50,,1,2,569,TPESampler,COMPLETE
2626,0.3420610331005728,2025-04-24 21:50:47.859516,2025-04-24 21:50:52.064201,0 days 00:00:04.204685,True,squared_error,50,,1,3,650,TPESampler,COMPLETE
2627,0.34697671654095624,2025-04-24 21:50:48.433432,2025-04-24 21:50:51.444139,0 days 00:00:03.010707,True,squared_error,50,,1,4,372,TPESampler,COMPLETE
2628,0.34709134653151275,2025-04-24 21:50:48.586353,2025-04-24 21:50:51.750226,0 days 00:00:03.163873,True,squared_error,50,,1,4,361,TPESampler,COMPLETE
2629,0.38210813675416094,2025-04-24 21:50:49.547341,2025-04-24 21:50:56.236799,0 days 00:00:06.689458,True,absolute_error,50,sqrt,1,2,665,TPESampler,COMPLETE
2630,0.3558352027534167,2025-04-24 21:50:49.558131,2025-04-24 21:51:20.094606,0 days 00:00:30.536475,True,absolute_error,43,,1,5,557,TPESampler,COMPLETE
2631,0.6284345106600913,2025-04-24 21:50:51.412091,2025-04-24 21:50:53.527500,0 days 00:00:02.115409,False,squared_error,50,,13,4,446,TPESampler,COMPLETE
2632,0.4283738718822618,2025-04-24 21:50:51.690170,2025-04-24 21:50:54.862600,0 days 00:00:03.172430,True,squared_error,50,,2,4,639,TPESampler,COMPLETE
2633,0.34408384736281605,2025-04-24 21:50:52.047317,2025-04-24 21:50:54.532084,0 days 00:00:02.484767,True,squared_error,40,,1,2,289,TPESampler,COMPLETE
2634,0.5366637485710859,2025-04-24 21:50:52.496483,2025-04-24 21:50:54.882094,0 days 00:00:02.385611,False,squared_error,14,,1,18,407,TPESampler,COMPLETE
2635,0.48669770203041846,2025-04-24 21:50:53.736518,2025-04-24 21:50:54.875640,0 days 00:00:01.139122,True,squared_error,31,sqrt,1,42,313,TPESampler,COMPLETE
2636,0.9833520526174485,2025-04-24 21:50:54.736140,2025-04-24 21:50:56.217796,0 days 00:00:01.481656,False,absolute_error,13,log2,14,4,745,TPESampler,COMPLETE
2637,0.3409177926843658,2025-04-24 21:50:55.105248,2025-04-24 21:50:59.659679,0 days 00:00:04.554431,True,squared_error,50,,1,3,528,TPESampler,COMPLETE
2638,0.9152477314986719,2025-04-24 21:50:55.149582,2025-04-24 21:50:57.603554,0 days 00:00:02.453972,True,squared_error,7,sqrt,13,9,625,TPESampler,COMPLETE
2639,0.5975647228424243,2025-04-24 21:50:55.190410,2025-04-24 21:51:03.801891,0 days 00:00:08.611481,False,absolute_error,5,,4,2,475,TPESampler,COMPLETE
2640,0.4437778941903152,2025-04-24 21:50:56.605141,2025-04-24 21:51:10.969723,0 days 00:00:14.364582,True,absolute_error,46,,2,3,510,TPESampler,COMPLETE
2641,0.3542425073493639,2025-04-24 21:50:57.022005,2025-04-24 21:51:01.918050,0 days 00:00:04.896045,True,squared_error,50,,1,5,711,TPESampler,COMPLETE
2642,0.3613730719269593,2025-04-24 21:50:57.845169,2025-04-24 21:51:00.497285,0 days 00:00:02.652116,True,squared_error,50,,1,6,403,TPESampler,COMPLETE
2643,0.937216872823739,2025-04-24 21:50:59.874556,2025-04-24 21:51:01.850593,0 days 00:00:01.976037,True,squared_error,50,log2,10,21,689,TPESampler,COMPLETE
2644,0.34374257994641294,2025-04-24 21:51:00.871596,2025-04-24 21:51:04.688200,0 days 00:00:03.816604,True,squared_error,50,,1,2,413,TPESampler,COMPLETE
2645,0.44850532026491396,2025-04-24 21:51:02.256862,2025-04-24 21:51:06.635057,0 days 00:00:04.378195,False,squared_error,49,,2,4,650,TPESampler,COMPLETE
2646,0.42864300977310665,2025-04-24 21:51:02.314923,2025-04-24 21:51:05.259607,0 days 00:00:02.944684,True,squared_error,50,,2,3,482,TPESampler,COMPLETE
2647,0.3539105254458997,2025-04-24 21:51:04.013980,2025-04-24 21:51:06.607935,0 days 00:00:02.593955,True,squared_error,42,,1,5,525,TPESampler,COMPLETE
2648,0.428806863033069,2025-04-24 21:51:04.895468,2025-04-24 21:51:06.693176,0 days 00:00:01.797708,True,squared_error,47,,2,3,235,TPESampler,COMPLETE
2649,0.3409227414643666,2025-04-24 21:51:05.507192,2025-04-24 21:51:09.013752,0 days 00:00:03.506560,True,squared_error,50,,1,3,444,TPESampler,COMPLETE
2650,0.8269883612044219,2025-04-24 21:51:06.828831,2025-04-24 21:51:09.014709,0 days 00:00:02.185878,False,squared_error,33,log2,2,34,971,TPESampler,COMPLETE
2651,0.3443806347757534,2025-04-24 21:51:06.949424,2025-04-24 21:51:10.179256,0 days 00:00:03.229832,True,squared_error,42,,1,2,522,TPESampler,COMPLETE
2652,0.42886497440525295,2025-04-24 21:51:06.995472,2025-04-24 21:51:10.728331,0 days 00:00:03.732859,True,squared_error,50,,2,4,471,TPESampler,COMPLETE
2653,0.3441073545209383,2025-04-24 21:51:09.186200,2025-04-24 21:51:13.075903,0 days 00:00:03.889703,True,squared_error,50,,1,2,511,TPESampler,COMPLETE
2654,0.3429087320328253,2025-04-24 21:51:09.237964,2025-04-24 21:51:13.614504,0 days 00:00:04.376540,True,squared_error,43,,1,3,676,TPESampler,COMPLETE
2655,0.35351797720754913,2025-04-24 21:51:10.435112,2025-04-24 21:51:13.533799,0 days 00:00:03.098687,True,squared_error,42,,1,5,535,TPESampler,COMPLETE
2656,0.4325390044670116,2025-04-24 21:51:10.963072,2025-04-24 21:51:13.183917,0 days 00:00:02.220845,True,squared_error,43,,2,5,366,TPESampler,COMPLETE
2657,0.3607632629724918,2025-04-24 21:51:11.222015,2025-04-24 21:51:14.819778,0 days 00:00:03.597763,True,squared_error,50,,1,6,552,TPESampler,COMPLETE
2658,0.34256035205171614,2025-04-24 21:51:13.279725,2025-04-24 21:51:17.751266,0 days 00:00:04.471541,True,squared_error,50,,1,3,697,TPESampler,COMPLETE
2659,0.36236598437411427,2025-04-24 21:51:13.411721,2025-04-24 21:51:17.779827,0 days 00:00:04.368106,True,squared_error,42,,1,6,721,TPESampler,COMPLETE
2660,0.3407739233001388,2025-04-24 21:51:13.773212,2025-04-24 21:51:18.056985,0 days 00:00:04.283773,True,squared_error,50,,1,3,595,TPESampler,COMPLETE
2661,0.519220009703178,2025-04-24 21:51:13.996521,2025-04-24 21:51:24.444113,0 days 00:00:10.447592,True,absolute_error,17,,4,5,772,TPESampler,COMPLETE
2662,0.9891867345841553,2025-04-24 21:51:15.311885,2025-04-24 21:51:17.157027,0 days 00:00:01.845142,True,absolute_error,24,log2,14,39,888,TPESampler,COMPLETE
2663,0.5657336395077814,2025-04-24 21:51:17.407614,2025-04-24 21:51:26.219613,0 days 00:00:08.811999,True,absolute_error,47,,6,5,891,TPESampler,COMPLETE
2664,0.3453830911617031,2025-04-24 21:51:17.946013,2025-04-24 21:51:22.862132,0 days 00:00:04.916119,True,squared_error,50,,1,2,732,TPESampler,COMPLETE
2665,0.3446328128183645,2025-04-24 21:51:17.990769,2025-04-24 21:51:22.606471,0 days 00:00:04.615702,True,squared_error,41,,1,3,772,TPESampler,COMPLETE
2666,0.4756825179486186,2025-04-24 21:51:18.503803,2025-04-24 21:51:20.625341,0 days 00:00:02.121538,True,squared_error,28,,3,21,523,TPESampler,COMPLETE
2667,0.35362368903855645,2025-04-24 21:51:20.447644,2025-04-24 21:51:24.769107,0 days 00:00:04.321463,True,squared_error,50,,1,5,786,TPESampler,COMPLETE
2668,0.6681599445339103,2025-04-24 21:51:20.909817,2025-04-24 21:51:23.583404,0 days 00:00:02.673587,False,squared_error,50,,8,4,722,TPESampler,COMPLETE
2669,0.6822399884840641,2025-04-24 21:51:22.824159,2025-04-24 21:51:24.538732,0 days 00:00:01.714573,False,squared_error,9,,9,2,331,TPESampler,COMPLETE
2670,0.4343139825747166,2025-04-24 21:51:23.229765,2025-04-24 21:51:25.542159,0 days 00:00:02.312394,True,squared_error,48,log2,1,3,655,TPESampler,COMPLETE
2671,0.37170753204751655,2025-04-24 21:51:23.796663,2025-04-24 21:51:26.354814,0 days 00:00:02.558151,True,squared_error,49,sqrt,1,3,712,TPESampler,COMPLETE
2672,0.344841093809571,2025-04-24 21:51:24.665480,2025-04-24 21:51:29.565456,0 days 00:00:04.899976,True,squared_error,42,,1,2,685,TPESampler,COMPLETE
2673,0.34215335504104055,2025-04-24 21:51:24.836440,2025-04-24 21:51:29.465481,0 days 00:00:04.629041,True,squared_error,50,,1,3,662,TPESampler,COMPLETE
2674,0.3439485263662432,2025-04-24 21:51:25.196054,2025-04-24 21:51:30.942870,0 days 00:00:05.746816,True,squared_error,50,,1,2,649,TPESampler,COMPLETE
2675,0.4241085516351788,2025-04-24 21:51:26.095209,2025-04-24 21:51:30.230060,0 days 00:00:04.134851,True,squared_error,41,,2,2,875,TPESampler,COMPLETE
2676,0.9277371138367247,2025-04-24 21:51:26.754152,2025-04-24 21:51:28.731110,0 days 00:00:01.976958,False,absolute_error,36,log2,3,50,418,TPESampler,COMPLETE
2677,0.7808651704722873,2025-04-24 21:51:26.800327,2025-04-24 21:51:28.778214,0 days 00:00:01.977887,False,squared_error,21,sqrt,5,19,870,TPESampler,COMPLETE
2678,0.4283827234583631,2025-04-24 21:51:28.914485,2025-04-24 21:51:32.644351,0 days 00:00:03.729866,True,squared_error,43,,2,3,625,TPESampler,COMPLETE
2679,0.35359267195361427,2025-04-24 21:51:29.071517,2025-04-24 21:51:33.399687,0 days 00:00:04.328170,True,squared_error,50,,1,5,650,TPESampler,COMPLETE
2680,0.3417656747396757,2025-04-24 21:51:29.705638,2025-04-24 21:51:34.307089,0 days 00:00:04.601451,True,squared_error,42,,1,3,596,TPESampler,COMPLETE
2681,0.34339068074265666,2025-04-24 21:51:29.918034,2025-04-24 21:51:35.161641,0 days 00:00:05.243607,True,squared_error,50,,1,3,738,TPESampler,COMPLETE
2682,0.7189861189556356,2025-04-24 21:51:30.651233,2025-04-24 21:51:32.757646,0 days 00:00:02.106413,False,squared_error,8,sqrt,3,9,997,TPESampler,COMPLETE
2683,0.34335477190255814,2025-04-24 21:51:31.221194,2025-04-24 21:51:35.504320,0 days 00:00:04.283126,True,squared_error,42,,1,3,670,TPESampler,COMPLETE
2684,0.42768774211374444,2025-04-24 21:51:32.887213,2025-04-24 21:51:36.353536,0 days 00:00:03.466323,True,squared_error,49,,2,3,608,TPESampler,COMPLETE
