number,value,datetime_start,datetime_complete,duration,params_bootstrap,params_criterion,params_max_depth,params_max_features,params_min_samples_leaf,params_min_samples_split,params_n_estimators,system_attrs_auto:sampler,state
1556,0.47217097273432274,2025-04-24 21:36:58.194658,2025-04-24 21:36:59.563849,0 days 00:00:01.369191,True,squared_error,43,log2,1,4,496,TPESampler,COMPLETE
1557,0.3410926111195977,2025-04-24 21:36:58.295721,2025-04-24 21:37:01.519067,0 days 00:00:03.223346,True,squared_error,50,,1,3,548,TPESampler,COMPLETE
1558,0.42703315834902494,2025-04-24 21:36:59.750273,2025-04-24 21:37:01.974423,0 days 00:00:02.224150,True,squared_error,50,,2,3,529,TPESampler,COMPLETE
1559,0.34206736851865527,2025-04-24 21:37:00.494547,2025-04-24 21:37:03.297451,0 days 00:00:02.802904,True,squared_error,42,,1,3,443,TPESampler,COMPLETE
1560,0.3420600170349302,2025-04-24 21:37:01.730005,2025-04-24 21:37:06.008062,0 days 00:00:04.278057,True,squared_error,50,,1,3,651,TPESampler,COMPLETE
1561,0.34763017382736605,2025-04-24 21:37:02.171122,2025-04-24 21:37:04.560979,0 days 00:00:02.389857,True,squared_error,42,,1,4,460,TPESampler,COMPLETE
1562,0.42785420612035746,2025-04-24 21:37:03.472346,2025-04-24 21:37:05.699285,0 days 00:00:02.226939,True,squared_error,49,log2,1,3,630,TPESampler,COMPLETE
1563,0.34260552699642405,2025-04-24 21:37:03.522026,2025-04-24 21:37:05.963520,0 days 00:00:02.441494,True,squared_error,50,,1,3,311,TPESampler,COMPLETE
1564,0.3520356421444295,2025-04-24 21:37:04.747561,2025-04-24 21:37:07.390491,0 days 00:00:02.642930,True,squared_error,50,,1,5,545,TPESampler,COMPLETE
1565,0.3467002218721368,2025-04-24 21:37:05.933662,2025-04-24 21:37:08.925661,0 days 00:00:02.991999,True,squared_error,43,,1,4,429,TPESampler,COMPLETE
1566,0.41292225431139234,2025-04-24 21:37:06.187793,2025-04-24 21:37:11.022256,0 days 00:00:04.834463,False,squared_error,50,,1,5,639,TPESampler,COMPLETE
1567,0.3418343369739308,2025-04-24 21:37:06.240245,2025-04-24 21:37:10.238376,0 days 00:00:03.998131,True,squared_error,50,,1,3,562,TPESampler,COMPLETE
1568,0.3445840881182093,2025-04-24 21:37:07.579686,2025-04-24 21:37:10.861791,0 days 00:00:03.282105,True,squared_error,41,,1,2,567,TPESampler,COMPLETE
1569,0.44443076864249936,2025-04-24 21:37:09.119013,2025-04-24 21:37:11.868237,0 days 00:00:02.749224,True,squared_error,50,,2,7,464,TPESampler,COMPLETE
1570,0.3424876544867067,2025-04-24 21:37:10.440794,2025-04-24 21:37:15.057956,0 days 00:00:04.617162,True,squared_error,42,,1,3,617,TPESampler,COMPLETE
1571,0.3416345792542,2025-04-24 21:37:11.099907,2025-04-24 21:37:13.851760,0 days 00:00:02.751853,True,squared_error,50,,1,3,414,TPESampler,COMPLETE
1572,0.3799292124165256,2025-04-24 21:37:11.381205,2025-04-24 21:37:13.951280,0 days 00:00:02.570075,True,squared_error,48,sqrt,1,2,533,TPESampler,COMPLETE
1573,0.3439871298242044,2025-04-24 21:37:12.193438,2025-04-24 21:37:16.747632,0 days 00:00:04.554194,True,squared_error,44,,1,2,620,TPESampler,COMPLETE
1574,0.9398651001275417,2025-04-24 21:37:14.078599,2025-04-24 21:37:15.420660,0 days 00:00:01.342061,True,squared_error,28,log2,14,15,685,TPESampler,COMPLETE
1575,0.43148212135111647,2025-04-24 21:37:14.178046,2025-04-24 21:37:17.061017,0 days 00:00:02.882971,True,squared_error,42,,2,5,563,TPESampler,COMPLETE
1576,0.8390139246339828,2025-04-24 21:37:15.250354,2025-04-24 21:37:16.091292,0 days 00:00:00.840938,False,squared_error,35,sqrt,6,4,149,TPESampler,COMPLETE
1577,0.35121778860404196,2025-04-24 21:37:15.615739,2025-04-24 21:37:43.069196,0 days 00:00:27.453457,True,absolute_error,49,,1,4,503,TPESampler,COMPLETE
1578,0.4988474542863766,2025-04-24 21:37:16.350812,2025-04-24 21:37:18.113652,0 days 00:00:01.762840,False,absolute_error,43,log2,1,9,105,TPESampler,COMPLETE
1579,0.3481859600136289,2025-04-24 21:37:16.960525,2025-04-24 21:37:21.045111,0 days 00:00:04.084586,True,squared_error,42,,1,4,725,TPESampler,COMPLETE
1580,0.34238908068836643,2025-04-24 21:37:17.327036,2025-04-24 21:37:22.228730,0 days 00:00:04.901694,True,squared_error,50,,1,3,791,TPESampler,COMPLETE
1581,0.3435559017879393,2025-04-24 21:37:18.544543,2025-04-24 21:37:21.295033,0 days 00:00:02.750490,True,squared_error,42,,1,3,504,TPESampler,COMPLETE
1582,0.42960296441377416,2025-04-24 21:37:21.246918,2025-04-24 21:37:23.831588,0 days 00:00:02.584670,True,squared_error,50,,2,2,434,TPESampler,COMPLETE
1583,0.3416709863232672,2025-04-24 21:37:21.590982,2025-04-24 21:37:25.907738,0 days 00:00:04.316756,True,squared_error,50,,1,3,621,TPESampler,COMPLETE
1584,0.42956479505551204,2025-04-24 21:37:22.595190,2025-04-24 21:37:24.681291,0 days 00:00:02.086101,True,squared_error,50,,2,3,384,TPESampler,COMPLETE
1585,0.34589585587421173,2025-04-24 21:37:24.024880,2025-04-24 21:37:27.410904,0 days 00:00:03.386024,True,squared_error,44,,1,4,531,TPESampler,COMPLETE
1586,0.44847655264543534,2025-04-24 21:37:25.048184,2025-04-24 21:37:27.919207,0 days 00:00:02.871023,False,squared_error,32,,2,2,467,TPESampler,COMPLETE
1587,0.3540289596334745,2025-04-24 21:37:26.102328,2025-04-24 21:37:28.188811,0 days 00:00:02.086483,True,squared_error,50,,1,5,334,TPESampler,COMPLETE
1588,0.3432804444606279,2025-04-24 21:37:27.601874,2025-04-24 21:37:30.886368,0 days 00:00:03.284494,True,squared_error,44,,1,3,514,TPESampler,COMPLETE
1589,0.34311781230074695,2025-04-24 21:37:28.122072,2025-04-24 21:37:31.387959,0 days 00:00:03.265887,True,squared_error,43,,1,3,508,TPESampler,COMPLETE
1590,0.3542843473607585,2025-04-24 21:37:28.524793,2025-04-24 21:37:32.633675,0 days 00:00:04.108882,True,squared_error,50,,1,5,688,TPESampler,COMPLETE
1591,0.4294703837274301,2025-04-24 21:37:31.085145,2025-04-24 21:37:33.949317,0 days 00:00:02.864172,True,squared_error,44,,2,3,454,TPESampler,COMPLETE
1592,0.34672582321630063,2025-04-24 21:37:31.625832,2025-04-24 21:37:34.714658,0 days 00:00:03.088826,True,squared_error,50,,1,4,414,TPESampler,COMPLETE
1593,0.3887943020810489,2025-04-24 21:37:32.566477,2025-04-24 21:37:36.671076,0 days 00:00:04.104599,True,absolute_error,50,sqrt,1,2,372,TPESampler,COMPLETE
1594,0.46308290773344,2025-04-24 21:37:32.843269,2025-04-24 21:37:35.018476,0 days 00:00:02.175207,False,squared_error,28,sqrt,1,12,915,TPESampler,COMPLETE
1595,0.34214784414935034,2025-04-24 21:37:34.145243,2025-04-24 21:37:38.043753,0 days 00:00:03.898510,True,squared_error,50,,1,3,643,TPESampler,COMPLETE
1596,0.3442365925340804,2025-04-24 21:37:35.045343,2025-04-24 21:37:38.292881,0 days 00:00:03.247538,True,squared_error,50,,1,2,509,TPESampler,COMPLETE
1597,0.34694337807627307,2025-04-24 21:37:35.267753,2025-04-24 21:37:38.378082,0 days 00:00:03.110329,True,squared_error,50,,1,4,516,TPESampler,COMPLETE
1598,0.4305473299188206,2025-04-24 21:37:36.861105,2025-04-24 21:37:39.533253,0 days 00:00:02.672148,True,squared_error,50,,2,5,687,TPESampler,COMPLETE
1599,0.5339793928293534,2025-04-24 21:37:38.246904,2025-04-24 21:37:41.289947,0 days 00:00:03.043043,False,squared_error,6,,6,38,927,TPESampler,COMPLETE
1600,0.40124262243010567,2025-04-24 21:37:38.529330,2025-04-24 21:37:40.826458,0 days 00:00:02.297128,True,squared_error,36,sqrt,1,3,389,TPESampler,COMPLETE
1601,0.3464763626658358,2025-04-24 21:37:38.581977,2025-04-24 21:38:11.620655,0 days 00:00:33.038678,True,absolute_error,50,,1,2,577,TPESampler,COMPLETE
1602,0.3418343369739308,2025-04-24 21:37:39.843599,2025-04-24 21:37:42.759480,0 days 00:00:02.915881,True,squared_error,50,,1,3,562,TPESampler,COMPLETE
1603,0.42836159537406737,2025-04-24 21:37:41.026238,2025-04-24 21:37:43.908049,0 days 00:00:02.881811,True,squared_error,50,,2,2,633,TPESampler,COMPLETE
1604,0.34388182657364985,2025-04-24 21:37:41.533542,2025-04-24 21:37:44.567274,0 days 00:00:03.033732,True,squared_error,50,,1,2,404,TPESampler,COMPLETE
1605,0.8859956844356753,2025-04-24 21:37:42.948832,2025-04-24 21:37:44.340280,0 days 00:00:01.391448,True,squared_error,10,log2,2,9,588,TPESampler,COMPLETE
1606,0.3445955505527112,2025-04-24 21:37:43.307299,2025-04-24 21:37:47.737682,0 days 00:00:04.430383,True,squared_error,44,,1,2,636,TPESampler,COMPLETE
1607,0.34620296723198124,2025-04-24 21:37:44.406139,2025-04-24 21:37:48.206803,0 days 00:00:03.800664,True,squared_error,50,,1,4,552,TPESampler,COMPLETE
1608,0.42763336517097195,2025-04-24 21:37:44.813033,2025-04-24 21:37:48.216395,0 days 00:00:03.403362,True,squared_error,42,,2,3,605,TPESampler,COMPLETE
1609,0.9224630513260398,2025-04-24 21:37:45.066534,2025-04-24 21:37:46.809741,0 days 00:00:01.743207,False,absolute_error,35,log2,3,5,137,TPESampler,COMPLETE
1610,0.3426340801351697,2025-04-24 21:37:46.946628,2025-04-24 21:37:51.193900,0 days 00:00:04.247272,True,squared_error,50,,1,2,596,TPESampler,COMPLETE
1611,0.3442348872639782,2025-04-24 21:37:47.442402,2025-04-24 21:37:52.406953,0 days 00:00:04.964551,True,squared_error,44,,1,3,751,TPESampler,COMPLETE
1612,0.7611720690698583,2025-04-24 21:37:48.168316,2025-04-24 21:37:51.972620,0 days 00:00:03.804304,False,absolute_error,19,sqrt,4,19,916,TPESampler,COMPLETE
1613,0.34161962414804237,2025-04-24 21:37:48.665921,2025-04-24 21:37:53.305921,0 days 00:00:04.640000,True,squared_error,50,,1,3,519,TPESampler,COMPLETE
1614,0.3460478255870609,2025-04-24 21:37:48.720273,2025-04-24 21:37:53.116733,0 days 00:00:04.396460,True,squared_error,50,,1,4,549,TPESampler,COMPLETE
1615,0.37761199172297966,2025-04-24 21:37:51.408580,2025-04-24 21:37:54.644939,0 days 00:00:03.236359,True,squared_error,42,,1,8,517,TPESampler,COMPLETE
1616,0.49467956042842304,2025-04-24 21:37:52.326560,2025-04-24 21:38:08.537846,0 days 00:00:16.211286,True,absolute_error,41,,3,40,978,TPESampler,COMPLETE
1617,0.34600833358330435,2025-04-24 21:37:52.777558,2025-04-24 21:37:55.623713,0 days 00:00:02.846155,True,squared_error,50,,1,4,420,TPESampler,COMPLETE
1618,0.34186970755584967,2025-04-24 21:37:53.528854,2025-04-24 21:37:57.144917,0 days 00:00:03.616063,True,squared_error,50,,1,3,511,TPESampler,COMPLETE
1619,0.3453853794755911,2025-04-24 21:37:53.650158,2025-04-24 21:37:56.406080,0 days 00:00:02.755922,True,squared_error,42,,1,2,394,TPESampler,COMPLETE
1620,0.42813997560454026,2025-04-24 21:37:54.831574,2025-04-24 21:37:57.206719,0 days 00:00:02.375145,True,squared_error,41,,2,3,493,TPESampler,COMPLETE
1621,0.6614893341988566,2025-04-24 21:37:55.829764,2025-04-24 21:38:04.169641,0 days 00:00:08.339877,False,absolute_error,11,sqrt,1,27,925,TPESampler,COMPLETE
1622,0.7347302887383165,2025-04-24 21:37:56.681104,2025-04-24 21:37:58.783957,0 days 00:00:02.102853,False,squared_error,13,log2,1,3,820,TPESampler,COMPLETE
1623,0.42125296412199936,2025-04-24 21:37:57.459887,2025-04-24 21:38:01.111167,0 days 00:00:03.651280,True,squared_error,11,,1,10,991,TPESampler,COMPLETE
1624,0.4702268309993605,2025-04-24 21:37:57.503987,2025-04-24 21:38:04.888027,0 days 00:00:07.384040,False,absolute_error,45,log2,1,3,581,TPESampler,COMPLETE
1625,0.4298474963811779,2025-04-24 21:37:58.993831,2025-04-24 21:38:02.185925,0 days 00:00:03.192094,False,squared_error,50,,1,3,426,TPESampler,COMPLETE
1626,0.34421032771723564,2025-04-24 21:38:01.300052,2025-04-24 21:38:05.833093,0 days 00:00:04.533041,True,squared_error,50,,1,2,797,TPESampler,COMPLETE
1627,0.3621997022308934,2025-04-24 21:38:02.383752,2025-04-24 21:38:05.586222,0 days 00:00:03.202470,True,squared_error,50,,1,6,675,TPESampler,COMPLETE
1628,0.9858998267679343,2025-04-24 21:38:04.360203,2025-04-24 21:38:06.487485,0 days 00:00:02.127282,True,absolute_error,14,log2,10,7,894,TPESampler,COMPLETE
1629,0.4285853839955534,2025-04-24 21:38:05.324184,2025-04-24 21:38:08.346730,0 days 00:00:03.022546,True,squared_error,43,,2,2,574,TPESampler,COMPLETE
1630,0.34342147667042133,2025-04-24 21:38:05.785269,2025-04-24 21:38:09.124512,0 days 00:00:03.339243,True,squared_error,43,,1,2,433,TPESampler,COMPLETE
1631,0.9074644853305551,2025-04-24 21:38:06.213969,2025-04-24 21:38:07.754330,0 days 00:00:01.540361,False,squared_error,8,log2,5,2,942,TPESampler,COMPLETE
1632,0.42829685566036874,2025-04-24 21:38:06.817194,2025-04-24 21:38:09.938467,0 days 00:00:03.121273,True,squared_error,50,,2,4,632,TPESampler,COMPLETE
1633,0.37644067497318656,2025-04-24 21:38:07.949356,2025-04-24 21:38:15.553021,0 days 00:00:07.603665,False,absolute_error,47,sqrt,1,4,522,TPESampler,COMPLETE
1634,0.36160131094587916,2025-04-24 21:38:08.639806,2025-04-24 21:38:11.539555,0 days 00:00:02.899749,True,squared_error,50,,1,6,509,TPESampler,COMPLETE
1635,0.5890383660653443,2025-04-24 21:38:08.884717,2025-04-24 21:38:11.037028,0 days 00:00:02.152311,False,absolute_error,14,,7,14,104,TPESampler,COMPLETE
1636,0.34372825524457873,2025-04-24 21:38:09.426650,2025-04-24 21:38:13.272072,0 days 00:00:03.845422,True,squared_error,50,,1,2,626,TPESampler,COMPLETE
1637,0.34434329098971406,2025-04-24 21:38:10.210110,2025-04-24 21:38:14.072652,0 days 00:00:03.862542,True,squared_error,50,,1,2,507,TPESampler,COMPLETE
1638,0.8812474313254842,2025-04-24 21:38:11.266771,2025-04-24 21:38:13.324718,0 days 00:00:02.057947,False,absolute_error,24,log2,2,4,641,TPESampler,COMPLETE
1639,0.3611459645544541,2025-04-24 21:38:11.700402,2025-04-24 21:38:15.728055,0 days 00:00:04.027653,True,squared_error,43,,1,6,654,TPESampler,COMPLETE
1640,0.42841317457737804,2025-04-24 21:38:11.834682,2025-04-24 21:38:14.899468,0 days 00:00:03.064786,True,squared_error,50,,2,4,562,TPESampler,COMPLETE
1641,0.34301692890882884,2025-04-24 21:38:13.423700,2025-04-24 21:38:17.477269,0 days 00:00:04.053569,True,squared_error,41,,1,3,583,TPESampler,COMPLETE
1642,0.42959962764085413,2025-04-24 21:38:13.547191,2025-04-24 21:38:16.000808,0 days 00:00:02.453617,True,squared_error,50,,2,3,409,TPESampler,COMPLETE
1643,0.4989015383637669,2025-04-24 21:38:14.388029,2025-04-24 21:38:17.563632,0 days 00:00:03.175603,False,squared_error,47,,3,8,515,TPESampler,COMPLETE
1644,0.34761779393783804,2025-04-24 21:38:15.249436,2025-04-24 21:38:18.183886,0 days 00:00:02.934450,True,squared_error,45,,1,4,412,TPESampler,COMPLETE
1645,0.45691688765575234,2025-04-24 21:38:15.816853,2025-04-24 21:38:18.296171,0 days 00:00:02.479318,True,squared_error,43,log2,1,2,613,TPESampler,COMPLETE
1646,0.9511553137723496,2025-04-24 21:38:16.112935,2025-04-24 21:38:18.480656,0 days 00:00:02.367721,True,absolute_error,15,log2,3,2,845,TPESampler,COMPLETE
1647,0.34204256009155337,2025-04-24 21:38:16.267664,2025-04-24 21:38:20.137566,0 days 00:00:03.869902,True,squared_error,50,,1,3,482,TPESampler,COMPLETE
1648,0.3424730727370197,2025-04-24 21:38:17.717665,2025-04-24 21:38:22.558195,0 days 00:00:04.840530,True,squared_error,50,,1,3,675,TPESampler,COMPLETE
1649,0.4317043206618244,2025-04-24 21:38:17.960796,2025-04-24 21:38:22.481020,0 days 00:00:04.520224,False,squared_error,35,,1,3,608,TPESampler,COMPLETE
1650,0.35467078325249257,2025-04-24 21:38:18.533137,2025-04-24 21:38:22.477402,0 days 00:00:03.944265,True,squared_error,43,,1,5,671,TPESampler,COMPLETE
1651,0.3544576299387337,2025-04-24 21:38:18.855751,2025-04-24 21:38:23.373524,0 days 00:00:04.517773,True,squared_error,42,,1,5,650,TPESampler,COMPLETE
1652,0.3447193316302449,2025-04-24 21:38:19.198803,2025-04-24 21:38:23.294852,0 days 00:00:04.096049,True,squared_error,43,,1,2,689,TPESampler,COMPLETE
1653,0.9777384251869357,2025-04-24 21:38:20.345377,2025-04-24 21:38:21.900233,0 days 00:00:01.554856,False,absolute_error,44,log2,10,3,931,TPESampler,COMPLETE
1654,0.4443573564399486,2025-04-24 21:38:22.096634,2025-04-24 21:38:24.986369,0 days 00:00:02.889735,True,squared_error,47,log2,1,4,803,TPESampler,COMPLETE
1655,0.34841864678888845,2025-04-24 21:38:22.789242,2025-04-24 21:38:26.669418,0 days 00:00:03.880176,True,squared_error,32,,1,4,440,TPESampler,COMPLETE
1656,0.342027016063918,2025-04-24 21:38:22.812905,2025-04-24 21:38:27.071489,0 days 00:00:04.258584,True,squared_error,43,,1,3,569,TPESampler,COMPLETE
1657,0.652593522301618,2025-04-24 21:38:22.887907,2025-04-24 21:38:24.943231,0 days 00:00:02.055324,True,squared_error,47,sqrt,2,3,357,TPESampler,COMPLETE
1658,0.3478054571838293,2025-04-24 21:38:23.724491,2025-04-24 21:38:28.765225,0 days 00:00:05.040734,True,squared_error,50,,1,4,742,TPESampler,COMPLETE
1659,0.42862783913069413,2025-04-24 21:38:23.671623,2025-04-24 21:38:27.085268,0 days 00:00:03.413645,True,squared_error,50,,2,3,570,TPESampler,COMPLETE
1660,0.37484489581342806,2025-04-24 21:38:25.163496,2025-04-24 21:38:26.585819,0 days 00:00:01.422323,True,squared_error,50,sqrt,1,4,347,TPESampler,COMPLETE
1661,0.9775844826841537,2025-04-24 21:38:25.194692,2025-04-24 21:38:26.913830,0 days 00:00:01.719138,False,absolute_error,47,log2,10,31,986,TPESampler,COMPLETE
1662,0.36883937673577144,2025-04-24 21:38:26.795757,2025-04-24 21:38:29.659121,0 days 00:00:02.863364,True,squared_error,50,,1,7,411,TPESampler,COMPLETE
1663,0.6233675419729562,2025-04-24 21:38:26.922795,2025-04-24 21:38:30.413555,0 days 00:00:03.490760,False,squared_error,30,,12,16,924,TPESampler,COMPLETE
1664,0.3471300883686902,2025-04-24 21:38:27.199250,2025-04-24 21:38:30.328798,0 days 00:00:03.129548,True,squared_error,43,,1,4,378,TPESampler,COMPLETE
1665,0.3427435547987903,2025-04-24 21:38:27.376185,2025-04-24 21:38:31.451465,0 days 00:00:04.075280,True,squared_error,43,,1,3,475,TPESampler,COMPLETE
1666,0.3438052710963307,2025-04-24 21:38:27.446112,2025-04-24 21:38:31.164371,0 days 00:00:03.718259,True,squared_error,50,,1,2,386,TPESampler,COMPLETE
1667,0.3428188544404643,2025-04-24 21:38:28.969826,2025-04-24 21:38:32.575504,0 days 00:00:03.605678,True,squared_error,42,,1,3,574,TPESampler,COMPLETE
1668,0.9080544609683341,2025-04-24 21:38:29.868840,2025-04-24 21:38:31.843529,0 days 00:00:01.974689,True,squared_error,12,sqrt,9,3,727,TPESampler,COMPLETE
1669,0.3536725076968313,2025-04-24 21:38:30.570058,2025-04-24 21:38:33.676105,0 days 00:00:03.106047,True,squared_error,44,,1,5,429,TPESampler,COMPLETE
1670,0.45867819845930957,2025-04-24 21:38:30.672129,2025-04-24 21:38:32.572103,0 days 00:00:01.899974,True,squared_error,49,log2,1,6,454,TPESampler,COMPLETE
1671,0.3439023528772207,2025-04-24 21:38:31.623535,2025-04-24 21:38:34.729160,0 days 00:00:03.105625,True,squared_error,50,,1,2,390,TPESampler,COMPLETE
1672,0.38728745690873434,2025-04-24 21:38:31.888394,2025-04-24 21:38:34.160365,0 days 00:00:02.271971,True,squared_error,41,sqrt,1,4,541,TPESampler,COMPLETE
1673,0.3440782823701871,2025-04-24 21:38:32.105938,2025-04-24 21:38:36.024238,0 days 00:00:03.918300,True,squared_error,50,,1,2,474,TPESampler,COMPLETE
1674,0.41167008271691685,2025-04-24 21:38:32.785676,2025-04-24 21:38:36.147830,0 days 00:00:03.362154,False,squared_error,43,,1,5,422,TPESampler,COMPLETE
1675,0.34334877884090326,2025-04-24 21:38:32.848885,2025-04-24 21:38:37.006706,0 days 00:00:04.157821,True,squared_error,50,,1,2,552,TPESampler,COMPLETE
1676,0.3523498412037109,2025-04-24 21:38:33.962330,2025-04-24 21:38:37.615456,0 days 00:00:03.653126,True,squared_error,50,,1,5,586,TPESampler,COMPLETE
1677,0.3471218091121301,2025-04-24 21:38:34.375264,2025-04-24 21:39:02.181815,0 days 00:00:27.806551,True,absolute_error,38,,1,3,467,TPESampler,COMPLETE
1678,0.4484918809109847,2025-04-24 21:38:34.944270,2025-04-24 21:38:38.296615,0 days 00:00:03.352345,False,squared_error,46,,2,2,570,TPESampler,COMPLETE
1679,0.4971340037178188,2025-04-24 21:38:36.221730,2025-04-24 21:38:38.996367,0 days 00:00:02.774637,True,squared_error,20,,4,2,793,TPESampler,COMPLETE
1680,0.3431114286165757,2025-04-24 21:38:36.363631,2025-04-24 21:38:41.033324,0 days 00:00:04.669693,True,squared_error,43,,1,3,712,TPESampler,COMPLETE
1681,0.3426233608889816,2025-04-24 21:38:37.372908,2025-04-24 21:38:40.606293,0 days 00:00:03.233385,True,squared_error,43,,1,3,470,TPESampler,COMPLETE
1682,0.9612812919683319,2025-04-24 21:38:37.862255,2025-04-24 21:38:39.367224,0 days 00:00:01.504969,False,absolute_error,35,sqrt,15,43,685,TPESampler,COMPLETE
1683,0.34173014955965375,2025-04-24 21:38:38.530883,2025-04-24 21:38:41.403202,0 days 00:00:02.872319,True,squared_error,50,,1,3,464,TPESampler,COMPLETE
1684,0.34610798614052585,2025-04-24 21:38:39.224357,2025-04-24 21:38:42.192318,0 days 00:00:02.967961,True,squared_error,50,,1,4,529,TPESampler,COMPLETE
1685,0.4489941406446051,2025-04-24 21:38:39.576562,2025-04-24 21:38:51.571572,0 days 00:00:11.995010,True,absolute_error,50,,2,6,436,TPESampler,COMPLETE
1686,0.3446741983129493,2025-04-24 21:38:40.803463,2025-04-24 21:38:44.261993,0 days 00:00:03.458530,True,squared_error,42,,1,2,558,TPESampler,COMPLETE
1687,0.3440270883488647,2025-04-24 21:38:41.336144,2025-04-24 21:38:44.889985,0 days 00:00:03.553841,True,squared_error,41,,1,3,632,TPESampler,COMPLETE
1688,0.36995838396692843,2025-04-24 21:38:41.648300,2025-04-24 21:39:18.594624,0 days 00:00:36.946324,True,absolute_error,50,,1,7,636,TPESampler,COMPLETE
1689,0.43264759369678407,2025-04-24 21:38:42.591670,2025-04-24 21:38:44.594755,0 days 00:00:02.003085,True,squared_error,43,,2,5,467,TPESampler,COMPLETE
1690,0.3426028925305,2025-04-24 21:38:44.462722,2025-04-24 21:38:48.317587,0 days 00:00:03.854865,True,squared_error,50,,1,3,690,TPESampler,COMPLETE
1691,0.44557296171864447,2025-04-24 21:38:44.796027,2025-04-24 21:38:47.229041,0 days 00:00:02.433014,True,squared_error,50,,2,8,609,TPESampler,COMPLETE
1692,0.34388031192294655,2025-04-24 21:38:45.321503,2025-04-24 21:38:48.960382,0 days 00:00:03.638879,True,squared_error,50,,1,2,629,TPESampler,COMPLETE
1693,0.42564937190246593,2025-04-24 21:38:47.416735,2025-04-24 21:38:50.549853,0 days 00:00:03.133118,True,squared_error,34,,2,3,817,TPESampler,COMPLETE
1694,0.4611235464492385,2025-04-24 21:38:48.510302,2025-04-24 21:38:49.763747,0 days 00:00:01.253445,True,squared_error,43,log2,1,3,258,TPESampler,COMPLETE
1695,0.3423306437373002,2025-04-24 21:38:49.219200,2025-04-24 21:38:51.582225,0 days 00:00:02.363025,True,squared_error,43,,1,3,356,TPESampler,COMPLETE
1696,0.4272137508910384,2025-04-24 21:38:50.038198,2025-04-24 21:38:53.008982,0 days 00:00:02.970784,True,squared_error,50,,2,2,543,TPESampler,COMPLETE
