number,value,datetime_start,datetime_complete,duration,params_bootstrap,params_criterion,params_max_depth,params_max_features,params_min_samples_leaf,params_min_samples_split,params_n_estimators,system_attrs_auto:sampler,state
4240,0.5907517277187094,2025-04-24 22:13:48.165159,2025-04-24 22:13:50.880790,0 days 00:00:02.715631,True,squared_error,12,,12,10,948,TPESampler,COMPLETE
4241,0.43114206739018757,2025-04-24 22:13:50.363059,2025-04-24 22:13:52.735229,0 days 00:00:02.372170,True,squared_error,43,,2,5,493,TPESampler,COMPLETE
4242,0.34224815399417063,2025-04-24 22:13:50.741653,2025-04-24 22:13:55.080476,0 days 00:00:04.338823,True,squared_error,43,,1,3,652,TPESampler,COMPLETE
4243,0.34346452289238494,2025-04-24 22:13:51.293049,2025-04-24 22:13:55.162907,0 days 00:00:03.869858,True,squared_error,44,,1,2,529,TPESampler,COMPLETE
4244,0.34263553844549194,2025-04-24 22:13:52.516948,2025-04-24 22:13:55.974872,0 days 00:00:03.457924,True,squared_error,44,,1,3,550,TPESampler,COMPLETE
4245,0.3454262513570931,2025-04-24 22:13:52.961382,2025-04-24 22:14:26.610191,0 days 00:00:33.648809,True,absolute_error,50,,1,3,581,TPESampler,COMPLETE
4246,0.3437237041423906,2025-04-24 22:13:53.024956,2025-04-24 22:13:56.462330,0 days 00:00:03.437374,True,squared_error,50,,1,2,466,TPESampler,COMPLETE
4247,0.8811570239768376,2025-04-24 22:13:55.291475,2025-04-24 22:13:59.527877,0 days 00:00:04.236402,False,absolute_error,14,log2,2,3,953,TPESampler,COMPLETE
4248,0.3615545788091951,2025-04-24 22:13:55.474280,2025-04-24 22:14:00.371959,0 days 00:00:04.897679,True,squared_error,43,,1,6,660,TPESampler,COMPLETE
4249,0.34122168590553703,2025-04-24 22:13:56.373931,2025-04-24 22:14:00.445870,0 days 00:00:04.071939,True,squared_error,50,,1,3,525,TPESampler,COMPLETE
4250,0.3469919166485369,2025-04-24 22:13:56.818064,2025-04-24 22:13:59.813309,0 days 00:00:02.995245,True,squared_error,50,,1,4,521,TPESampler,COMPLETE
4251,0.37054095289132516,2025-04-24 22:13:59.773612,2025-04-24 22:14:33.117034,0 days 00:00:33.343422,True,absolute_error,38,,1,7,608,TPESampler,COMPLETE
4252,0.3423136666504432,2025-04-24 22:14:00.071305,2025-04-24 22:14:02.814556,0 days 00:00:02.743251,True,squared_error,43,,1,3,409,TPESampler,COMPLETE
4253,0.75481363212912,2025-04-24 22:14:00.727024,2025-04-24 22:14:03.929994,0 days 00:00:03.202970,True,absolute_error,8,sqrt,2,7,537,TPESampler,COMPLETE
4254,0.9346460813116113,2025-04-24 22:14:00.994352,2025-04-24 22:14:02.930329,0 days 00:00:01.935977,True,squared_error,6,log2,9,2,524,TPESampler,COMPLETE
4255,0.3610511360043214,2025-04-24 22:14:03.079641,2025-04-24 22:14:05.295656,0 days 00:00:02.216015,True,squared_error,43,,1,6,390,TPESampler,COMPLETE
4256,0.34223458311337646,2025-04-24 22:14:03.205588,2025-04-24 22:14:07.722491,0 days 00:00:04.516903,True,squared_error,43,,1,3,648,TPESampler,COMPLETE
4257,0.6462637974669448,2025-04-24 22:14:04.348131,2025-04-24 22:14:06.127664,0 days 00:00:01.779533,True,squared_error,48,sqrt,2,2,704,TPESampler,COMPLETE
4258,0.35997553761502243,2025-04-24 22:14:05.636003,2025-04-24 22:14:08.477833,0 days 00:00:02.841830,True,squared_error,43,,1,6,540,TPESampler,COMPLETE
4259,0.3474949629281803,2025-04-24 22:14:06.454924,2025-04-24 22:14:10.465495,0 days 00:00:04.010571,True,squared_error,50,,1,4,677,TPESampler,COMPLETE
4260,0.6040614288138076,2025-04-24 22:14:07.950479,2025-04-24 22:14:09.469780,0 days 00:00:01.519301,True,absolute_error,35,,10,2,146,TPESampler,COMPLETE
4261,0.5933908734393055,2025-04-24 22:14:08.786165,2025-04-24 22:14:11.269186,0 days 00:00:02.483021,True,squared_error,35,,8,23,652,TPESampler,COMPLETE
4262,0.42997457299168246,2025-04-24 22:14:10.055220,2025-04-24 22:14:12.966568,0 days 00:00:02.911348,True,squared_error,50,,2,5,518,TPESampler,COMPLETE
4263,0.4279890308587409,2025-04-24 22:14:10.808374,2025-04-24 22:14:14.175541,0 days 00:00:03.367167,True,squared_error,50,,2,4,645,TPESampler,COMPLETE
4264,0.4513459917314029,2025-04-24 22:14:11.515615,2025-04-24 22:14:13.590615,0 days 00:00:02.075000,True,squared_error,45,log2,1,2,654,TPESampler,COMPLETE
4265,0.6506378549850851,2025-04-24 22:14:13.216835,2025-04-24 22:14:14.812375,0 days 00:00:01.595540,True,squared_error,44,sqrt,2,6,451,TPESampler,COMPLETE
4266,0.4361819933647474,2025-04-24 22:14:13.828854,2025-04-24 22:14:17.053186,0 days 00:00:03.224332,True,squared_error,50,,2,6,674,TPESampler,COMPLETE
4267,0.4276948888961663,2025-04-24 22:14:14.490315,2025-04-24 22:14:17.692478,0 days 00:00:03.202163,True,squared_error,50,,2,4,596,TPESampler,COMPLETE
4268,0.34368692530501166,2025-04-24 22:14:15.104673,2025-04-24 22:14:20.292671,0 days 00:00:05.187998,True,squared_error,50,,1,2,831,TPESampler,COMPLETE
4269,0.3426065739337236,2025-04-24 22:14:16.391159,2025-04-24 22:14:20.401385,0 days 00:00:04.010226,True,squared_error,50,,1,2,595,TPESampler,COMPLETE
4270,0.3422254789309704,2025-04-24 22:14:17.447211,2025-04-24 22:14:20.894129,0 days 00:00:03.446918,True,squared_error,50,,1,3,639,TPESampler,COMPLETE
4271,0.4481591791006952,2025-04-24 22:14:17.952071,2025-04-24 22:15:05.605797,0 days 00:00:47.653726,True,absolute_error,39,,1,23,927,TPESampler,COMPLETE
4272,0.3433148798371733,2025-04-24 22:14:20.557210,2025-04-24 22:14:24.020211,0 days 00:00:03.463001,True,squared_error,50,,1,2,578,TPESampler,COMPLETE
4273,0.3434432475793045,2025-04-24 22:14:20.743141,2025-04-24 22:14:24.605846,0 days 00:00:03.862705,True,squared_error,43,,1,2,555,TPESampler,COMPLETE
4274,0.3465961262901914,2025-04-24 22:14:21.204142,2025-04-24 22:14:24.561757,0 days 00:00:03.357615,True,squared_error,43,,1,4,561,TPESampler,COMPLETE
4275,0.3466171372302209,2025-04-24 22:14:24.256218,2025-04-24 22:14:26.922002,0 days 00:00:02.665784,True,squared_error,50,,1,4,463,TPESampler,COMPLETE
4276,0.3439998530173007,2025-04-24 22:14:24.776950,2025-04-24 22:14:27.880388,0 days 00:00:03.103438,True,squared_error,44,,1,3,300,TPESampler,COMPLETE
4277,0.3868250765054517,2025-04-24 22:14:24.825788,2025-04-24 22:14:27.199348,0 days 00:00:02.373560,True,squared_error,50,sqrt,1,5,541,TPESampler,COMPLETE
4278,0.34405117970721827,2025-04-24 22:14:26.866671,2025-04-24 22:14:32.147349,0 days 00:00:05.280678,True,squared_error,44,,1,3,716,TPESampler,COMPLETE
4279,0.38715832522294896,2025-04-24 22:14:27.194819,2025-04-24 22:14:47.380301,0 days 00:00:20.185482,False,absolute_error,26,,1,2,227,TPESampler,COMPLETE
4280,0.34256035205171614,2025-04-24 22:14:27.575065,2025-04-24 22:14:32.468006,0 days 00:00:04.892941,True,squared_error,50,,1,3,697,TPESampler,COMPLETE
4281,0.43020903224006807,2025-04-24 22:14:28.441802,2025-04-24 22:14:30.760518,0 days 00:00:02.318716,True,squared_error,50,,2,4,369,TPESampler,COMPLETE
4282,0.3424807076342775,2025-04-24 22:14:31.003299,2025-04-24 22:14:35.697110,0 days 00:00:04.693811,True,squared_error,50,,1,3,691,TPESampler,COMPLETE
4283,0.42777477818543436,2025-04-24 22:14:32.395408,2025-04-24 22:14:36.317848,0 days 00:00:03.922440,True,squared_error,44,,2,3,709,TPESampler,COMPLETE
4284,0.36086734652976626,2025-04-24 22:14:32.846837,2025-04-24 22:14:37.147261,0 days 00:00:04.300424,True,squared_error,50,,1,6,622,TPESampler,COMPLETE
4285,0.3839008734630256,2025-04-24 22:14:33.475867,2025-04-24 22:14:36.120137,0 days 00:00:02.644270,True,squared_error,50,,1,9,524,TPESampler,COMPLETE
4286,0.42757005970592576,2025-04-24 22:14:35.943658,2025-04-24 22:14:39.657729,0 days 00:00:03.714071,True,squared_error,44,,2,2,595,TPESampler,COMPLETE
4287,0.34402172161507705,2025-04-24 22:14:36.419829,2025-04-24 22:14:39.754100,0 days 00:00:03.334271,True,squared_error,42,,1,2,535,TPESampler,COMPLETE
4288,0.34287402032731196,2025-04-24 22:14:36.684772,2025-04-24 22:14:40.223103,0 days 00:00:03.538331,True,squared_error,42,,1,3,463,TPESampler,COMPLETE
4289,0.3459096453221766,2025-04-24 22:14:37.521142,2025-04-24 22:14:42.241990,0 days 00:00:04.720848,True,squared_error,34,,1,2,678,TPESampler,COMPLETE
4290,0.3437307271668537,2025-04-24 22:14:39.914563,2025-04-24 22:14:43.741900,0 days 00:00:03.827337,True,squared_error,50,,1,2,465,TPESampler,COMPLETE
4291,0.3440424535889802,2025-04-24 22:14:40.039114,2025-04-24 22:14:42.736334,0 days 00:00:02.697220,True,squared_error,50,,1,2,388,TPESampler,COMPLETE
4292,0.44952594350746267,2025-04-24 22:14:40.543291,2025-04-24 22:14:43.212496,0 days 00:00:02.669205,True,squared_error,41,,2,9,442,TPESampler,COMPLETE
4293,0.3440913910930016,2025-04-24 22:14:42.498149,2025-04-24 22:14:46.386616,0 days 00:00:03.888467,True,squared_error,35,,1,3,525,TPESampler,COMPLETE
4294,0.3418156858756224,2025-04-24 22:14:42.990725,2025-04-24 22:14:46.510314,0 days 00:00:03.519589,True,squared_error,42,,1,3,602,TPESampler,COMPLETE
4295,0.3614830571653006,2025-04-24 22:14:43.658301,2025-04-24 22:14:47.225769,0 days 00:00:03.567468,True,squared_error,50,,1,6,488,TPESampler,COMPLETE
4296,0.342276121067727,2025-04-24 22:14:44.175309,2025-04-24 22:14:48.218977,0 days 00:00:04.043668,True,squared_error,50,,1,3,496,TPESampler,COMPLETE
4297,0.9704275663988472,2025-04-24 22:14:46.651771,2025-04-24 22:14:49.653947,0 days 00:00:03.002176,True,absolute_error,6,log2,5,13,833,TPESampler,COMPLETE
4298,0.42769067822334433,2025-04-24 22:14:46.784307,2025-04-24 22:14:49.298828,0 days 00:00:02.514521,True,squared_error,50,log2,1,3,563,TPESampler,COMPLETE
4299,0.3425196534657026,2025-04-24 22:14:47.748520,2025-04-24 22:14:51.632202,0 days 00:00:03.883682,True,squared_error,44,,1,3,548,TPESampler,COMPLETE
4300,0.3456637514004102,2025-04-24 22:14:47.567412,2025-04-24 22:14:52.473513,0 days 00:00:04.906101,True,squared_error,50,,1,4,605,TPESampler,COMPLETE
4301,0.3442559749853337,2025-04-24 22:14:48.571236,2025-04-24 22:14:53.893209,0 days 00:00:05.321973,True,squared_error,44,,1,2,664,TPESampler,COMPLETE
4302,0.3451451389046745,2025-04-24 22:14:49.539268,2025-04-24 22:14:54.157396,0 days 00:00:04.618128,True,squared_error,50,,1,2,725,TPESampler,COMPLETE
4303,0.3697275497419158,2025-04-24 22:14:50.140208,2025-04-24 22:14:52.513442,0 days 00:00:02.373234,True,squared_error,50,sqrt,1,2,636,TPESampler,COMPLETE
4304,0.4296526144456381,2025-04-24 22:14:51.884343,2025-04-24 22:14:56.519664,0 days 00:00:04.635321,False,squared_error,50,,1,3,610,TPESampler,COMPLETE
4305,0.42742584513848136,2025-04-24 22:14:52.765851,2025-04-24 22:14:56.890898,0 days 00:00:04.125047,True,squared_error,43,,2,4,676,TPESampler,COMPLETE
4306,0.4276071460914346,2025-04-24 22:14:52.886789,2025-04-24 22:14:57.094842,0 days 00:00:04.208053,True,squared_error,50,,2,3,695,TPESampler,COMPLETE
4307,0.3479082685861531,2025-04-24 22:14:54.300266,2025-04-24 22:14:57.032149,0 days 00:00:02.731883,True,squared_error,42,,1,4,387,TPESampler,COMPLETE
4308,0.34618600783528153,2025-04-24 22:14:54.595022,2025-04-24 22:14:57.589574,0 days 00:00:02.994552,True,squared_error,50,,1,4,458,TPESampler,COMPLETE
4309,0.9703093634920122,2025-04-24 22:14:56.756093,2025-04-24 22:14:59.273943,0 days 00:00:02.517850,True,absolute_error,12,log2,5,46,764,TPESampler,COMPLETE
4310,0.4980584514398073,2025-04-24 22:14:57.253181,2025-04-24 22:15:00.745969,0 days 00:00:03.492788,True,squared_error,26,sqrt,1,31,720,TPESampler,COMPLETE
4311,0.3420977263306773,2025-04-24 22:14:57.320883,2025-04-24 22:15:02.964591,0 days 00:00:05.643708,True,squared_error,50,,1,3,645,TPESampler,COMPLETE
4312,0.3442771275935179,2025-04-24 22:14:57.528884,2025-04-24 22:15:02.963104,0 days 00:00:05.434220,True,squared_error,42,,1,2,580,TPESampler,COMPLETE
4313,0.3536636125969718,2025-04-24 22:14:57.999845,2025-04-24 22:15:02.150327,0 days 00:00:04.150482,True,squared_error,50,,1,5,644,TPESampler,COMPLETE
4314,0.4300161446302788,2025-04-24 22:14:59.681102,2025-04-24 22:15:02.077406,0 days 00:00:02.396304,True,squared_error,50,,2,2,461,TPESampler,COMPLETE
4315,0.4283363977764274,2025-04-24 22:15:01.003840,2025-04-24 22:15:03.970781,0 days 00:00:02.966941,True,squared_error,50,,2,2,580,TPESampler,COMPLETE
4316,0.3430064427645577,2025-04-24 22:15:02.283271,2025-04-24 22:15:06.009322,0 days 00:00:03.726051,True,squared_error,44,,1,3,576,TPESampler,COMPLETE
4317,0.34094323809363597,2025-04-24 22:15:02.450988,2025-04-24 22:15:05.629941,0 days 00:00:03.178953,True,squared_error,50,,1,3,447,TPESampler,COMPLETE
4318,0.38531466496099936,2025-04-24 22:15:03.269166,2025-04-24 22:16:00.318321,0 days 00:00:57.049155,False,absolute_error,45,,1,2,598,TPESampler,COMPLETE
4319,0.35439292746578643,2025-04-24 22:15:03.326956,2025-04-24 22:15:08.576853,0 days 00:00:05.249897,True,squared_error,43,,1,5,784,TPESampler,COMPLETE
4320,0.3466833151700991,2025-04-24 22:15:04.391512,2025-04-24 22:15:07.512518,0 days 00:00:03.121006,True,squared_error,50,,1,4,390,TPESampler,COMPLETE
4321,0.4271820686950597,2025-04-24 22:15:05.882773,2025-04-24 22:15:09.950235,0 days 00:00:04.067462,True,squared_error,50,,2,4,540,TPESampler,COMPLETE
4322,0.5412498052227988,2025-04-24 22:15:05.955167,2025-04-24 22:15:10.218293,0 days 00:00:04.263126,True,squared_error,42,,5,4,706,TPESampler,COMPLETE
4323,0.9525770779451046,2025-04-24 22:15:06.396346,2025-04-24 22:15:08.424791,0 days 00:00:02.028445,False,absolute_error,47,log2,4,18,381,TPESampler,COMPLETE
4324,0.34087100346207855,2025-04-24 22:15:07.975578,2025-04-24 22:15:11.880366,0 days 00:00:03.904788,True,squared_error,50,,1,3,593,TPESampler,COMPLETE
4325,0.42442245059970757,2025-04-24 22:15:08.902901,2025-04-24 22:15:22.172097,0 days 00:00:13.269196,False,absolute_error,33,sqrt,1,2,912,TPESampler,COMPLETE
4326,0.3849250605287615,2025-04-24 22:15:08.969411,2025-04-24 22:15:12.618282,0 days 00:00:03.648871,True,squared_error,42,,1,9,639,TPESampler,COMPLETE
4327,0.42760778979710645,2025-04-24 22:15:10.352229,2025-04-24 22:15:13.981632,0 days 00:00:03.629403,True,squared_error,50,,2,3,707,TPESampler,COMPLETE
4328,0.34369440172276916,2025-04-24 22:15:10.525161,2025-04-24 22:15:14.766209,0 days 00:00:04.241048,True,squared_error,44,,1,3,676,TPESampler,COMPLETE
4329,0.4272202616958329,2025-04-24 22:15:12.125808,2025-04-24 22:15:15.271087,0 days 00:00:03.145279,True,squared_error,43,,2,2,520,TPESampler,COMPLETE
4330,0.9756293878316892,2025-04-24 22:15:12.863023,2025-04-24 22:15:14.171282,0 days 00:00:01.308259,True,absolute_error,40,sqrt,12,8,126,TPESampler,COMPLETE
4331,0.42900466444233326,2025-04-24 22:15:14.244529,2025-04-24 22:15:17.289249,0 days 00:00:03.044720,True,squared_error,42,,2,4,475,TPESampler,COMPLETE
4332,0.341874029663434,2025-04-24 22:15:14.466833,2025-04-24 22:15:17.392150,0 days 00:00:02.925317,True,squared_error,50,,1,3,327,TPESampler,COMPLETE
4333,0.35476006700448304,2025-04-24 22:15:15.127101,2025-04-24 22:15:19.221844,0 days 00:00:04.094743,True,squared_error,43,,1,5,675,TPESampler,COMPLETE
4334,0.4823865758365223,2025-04-24 22:15:15.551424,2025-04-24 22:15:17.102218,0 days 00:00:01.550794,False,squared_error,50,,4,48,251,TPESampler,COMPLETE
4335,0.5407747545238794,2025-04-24 22:15:17.353945,2025-04-24 22:15:19.618127,0 days 00:00:02.264182,False,squared_error,35,sqrt,2,15,891,TPESampler,COMPLETE
4336,0.3468260520342889,2025-04-24 22:15:17.562487,2025-04-24 22:15:21.398642,0 days 00:00:03.836155,True,squared_error,50,,1,4,627,TPESampler,COMPLETE
4337,0.34931356820131143,2025-04-24 22:15:17.760839,2025-04-24 22:15:21.864154,0 days 00:00:04.103315,True,squared_error,34,,1,4,671,TPESampler,COMPLETE
4338,0.3535447650958996,2025-04-24 22:15:19.468483,2025-04-24 22:15:22.450640,0 days 00:00:02.982157,True,squared_error,43,,1,5,449,TPESampler,COMPLETE
4339,0.3949205476283866,2025-04-24 22:15:19.883746,2025-04-24 22:15:23.128075,0 days 00:00:03.244329,False,squared_error,42,,1,7,436,TPESampler,COMPLETE
4340,0.41236650402451847,2025-04-24 22:15:21.638961,2025-04-24 22:15:25.481731,0 days 00:00:03.842770,False,squared_error,50,,1,4,405,TPESampler,COMPLETE
4341,0.4898016891543132,2025-04-24 22:15:22.124385,2025-04-24 22:15:24.633867,0 days 00:00:02.509482,True,squared_error,42,log2,1,6,733,TPESampler,COMPLETE
4342,0.3524241514109453,2025-04-24 22:15:22.490866,2025-04-24 22:15:26.624126,0 days 00:00:04.133260,True,squared_error,50,,1,5,533,TPESampler,COMPLETE
4343,0.3453084689506746,2025-04-24 22:15:22.884918,2025-04-24 22:15:28.528978,0 days 00:00:05.644060,True,squared_error,43,,1,2,741,TPESampler,COMPLETE
4344,0.35476844945055225,2025-04-24 22:15:23.564959,2025-04-24 22:15:28.452515,0 days 00:00:04.887556,True,squared_error,50,,1,5,739,TPESampler,COMPLETE
4345,0.5040626286039377,2025-04-24 22:15:25.016438,2025-04-24 22:15:26.732068,0 days 00:00:01.715630,True,squared_error,42,log2,1,7,534,TPESampler,COMPLETE
4346,0.3428240690068987,2025-04-24 22:15:25.777602,2025-04-24 22:15:30.059493,0 days 00:00:04.281891,True,squared_error,50,,1,2,545,TPESampler,COMPLETE
4347,0.344275108403983,2025-04-24 22:15:26.989149,2025-04-24 22:15:31.621267,0 days 00:00:04.632118,True,squared_error,50,,1,2,684,TPESampler,COMPLETE
4348,0.42763379692378634,2025-04-24 22:15:27.030616,2025-04-24 22:15:31.035541,0 days 00:00:04.004925,True,squared_error,50,,2,2,702,TPESampler,COMPLETE
4349,0.5016612348999222,2025-04-24 22:15:28.714921,2025-04-24 22:15:30.433432,0 days 00:00:01.718511,True,squared_error,37,log2,1,2,471,TPESampler,COMPLETE
4350,0.35426004167351505,2025-04-24 22:15:28.849736,2025-04-24 22:15:32.777698,0 days 00:00:03.927962,True,squared_error,42,,1,5,518,TPESampler,COMPLETE
4351,0.34304298101453295,2025-04-24 22:15:30.319861,2025-04-24 22:15:35.594171,0 days 00:00:05.274310,True,squared_error,50,,1,3,722,TPESampler,COMPLETE
4352,0.34139171634820364,2025-04-24 22:15:30.691766,2025-04-24 22:15:34.535657,0 days 00:00:03.843891,True,squared_error,43,,1,3,594,TPESampler,COMPLETE
4353,0.3435268806219045,2025-04-24 22:15:31.348003,2025-04-24 22:15:34.443733,0 days 00:00:03.095730,True,squared_error,44,,1,3,375,TPESampler,COMPLETE
4354,0.4281134658376571,2025-04-24 22:15:31.945447,2025-04-24 22:15:34.652867,0 days 00:00:02.707420,True,squared_error,50,,2,3,552,TPESampler,COMPLETE
4355,0.3419278671710908,2025-04-24 22:15:33.065346,2025-04-24 22:15:36.412913,0 days 00:00:03.347567,True,squared_error,50,,1,3,480,TPESampler,COMPLETE
4356,0.34281791742170603,2025-04-24 22:15:34.802861,2025-04-24 22:15:39.526767,0 days 00:00:04.723906,True,squared_error,50,,1,2,585,TPESampler,COMPLETE
4357,0.34196608383517535,2025-04-24 22:15:34.887391,2025-04-24 22:15:39.003506,0 days 00:00:04.116115,True,squared_error,50,,1,3,509,TPESampler,COMPLETE
4358,0.42951470303996503,2025-04-24 22:15:34.992582,2025-04-24 22:15:37.996557,0 days 00:00:03.003975,True,squared_error,36,,2,3,453,TPESampler,COMPLETE
4359,0.6018101468766824,2025-04-24 22:15:36.145400,2025-04-24 22:15:43.187099,0 days 00:00:07.041699,True,absolute_error,37,,9,24,953,TPESampler,COMPLETE
4360,0.42745539593402176,2025-04-24 22:15:36.831598,2025-04-24 22:15:38.830263,0 days 00:00:01.998665,True,squared_error,44,,2,2,266,TPESampler,COMPLETE
4361,0.34206819166876584,2025-04-24 22:15:38.241802,2025-04-24 22:15:43.605156,0 days 00:00:05.363354,True,squared_error,43,,1,3,858,TPESampler,COMPLETE
4362,0.3451397892022515,2025-04-24 22:15:39.151816,2025-04-24 22:15:44.731290,0 days 00:00:05.579474,True,squared_error,43,,1,2,719,TPESampler,COMPLETE
4363,0.9920915994158773,2025-04-24 22:15:39.328220,2025-04-24 22:15:41.079744,0 days 00:00:01.751524,True,absolute_error,47,log2,15,4,275,TPESampler,COMPLETE
4364,0.92838078090602,2025-04-24 22:15:39.778836,2025-04-24 22:15:41.537761,0 days 00:00:01.758925,True,squared_error,36,log2,6,20,569,TPESampler,COMPLETE
4365,0.34325524110559413,2025-04-24 22:15:41.325257,2025-04-24 22:15:44.712715,0 days 00:00:03.387458,True,squared_error,43,,1,2,436,TPESampler,COMPLETE
4366,0.34283886464824215,2025-04-24 22:15:41.788964,2025-04-24 22:15:46.232633,0 days 00:00:04.443669,True,squared_error,43,,1,3,680,TPESampler,COMPLETE
4367,0.34305363592430405,2025-04-24 22:15:43.435812,2025-04-24 22:15:48.957098,0 days 00:00:05.521286,True,squared_error,50,,1,3,758,TPESampler,COMPLETE
4368,0.42974297778915266,2025-04-24 22:15:43.880219,2025-04-24 22:15:46.474781,0 days 00:00:02.594562,True,squared_error,43,,2,5,532,TPESampler,COMPLETE
4369,0.34243246944539263,2025-04-24 22:15:44.966507,2025-04-24 22:15:48.670132,0 days 00:00:03.703625,True,squared_error,42,,1,3,439,TPESampler,COMPLETE
4370,0.9181754206004005,2025-04-24 22:15:45.014951,2025-04-24 22:15:47.177441,0 days 00:00:02.162490,True,squared_error,18,log2,4,6,579,TPESampler,COMPLETE
4371,0.43157319824127977,2025-04-24 22:15:46.506127,2025-04-24 22:15:49.722049,0 days 00:00:03.215922,True,squared_error,43,,2,5,636,TPESampler,COMPLETE
4372,0.3431130820580408,2025-04-24 22:15:46.796642,2025-04-24 22:15:50.610571,0 days 00:00:03.813929,True,squared_error,44,,1,3,555,TPESampler,COMPLETE
4373,0.3469898691426622,2025-04-24 22:15:47.536564,2025-04-24 22:15:51.275962,0 days 00:00:03.739398,True,squared_error,43,,1,4,477,TPESampler,COMPLETE
4374,0.35281578058346746,2025-04-24 22:15:48.916706,2025-04-24 22:15:52.735746,0 days 00:00:03.819040,True,squared_error,50,,1,5,524,TPESampler,COMPLETE
4375,0.368863893407448,2025-04-24 22:15:49.326172,2025-04-24 22:15:53.137418,0 days 00:00:03.811246,True,squared_error,50,,1,7,556,TPESampler,COMPLETE
4376,0.8725475685437655,2025-04-24 22:15:50.063758,2025-04-24 22:15:52.800039,0 days 00:00:02.736281,True,absolute_error,26,sqrt,4,3,674,TPESampler,COMPLETE
4377,0.46325195390974927,2025-04-24 22:15:50.864294,2025-04-24 22:16:10.298097,0 days 00:00:19.433803,True,absolute_error,7,,2,3,961,TPESampler,COMPLETE
4378,0.3420600170349302,2025-04-24 22:15:51.563796,2025-04-24 22:15:56.394060,0 days 00:00:04.830264,True,squared_error,50,,1,3,651,TPESampler,COMPLETE
4379,0.3542562984439145,2025-04-24 22:15:52.990825,2025-04-24 22:15:57.305264,0 days 00:00:04.314439,True,squared_error,44,,1,5,661,TPESampler,COMPLETE
4380,0.3469073864779194,2025-04-24 22:15:53.049421,2025-04-24 22:15:56.835881,0 days 00:00:03.786460,True,squared_error,50,,1,4,651,TPESampler,COMPLETE
4381,0.43093299890956555,2025-04-24 22:15:53.540106,2025-04-24 22:15:59.903713,0 days 00:00:06.363607,False,squared_error,50,,1,2,768,TPESampler,COMPLETE
