number,value,datetime_start,datetime_complete,duration,params_bootstrap,params_criterion,params_max_depth,params_max_features,params_min_samples_leaf,params_min_samples_split,params_n_estimators,system_attrs_auto:sampler,state
4523,0.39771192770566305,2025-04-24 22:18:07.129981,2025-04-24 22:18:11.162457,0 days 00:00:04.032476,True,squared_error,44,,1,11,749,TPESampler,COMPLETE
4524,0.34372825524457873,2025-04-24 22:18:08.116385,2025-04-24 22:18:12.147536,0 days 00:00:04.031151,True,squared_error,50,,1,2,626,TPESampler,COMPLETE
4525,0.35421054317279504,2025-04-24 22:18:08.394607,2025-04-24 22:18:12.532172,0 days 00:00:04.137565,True,squared_error,42,,1,5,630,TPESampler,COMPLETE
4526,0.4792724490077394,2025-04-24 22:18:10.129140,2025-04-24 22:18:12.866210,0 days 00:00:02.737070,False,squared_error,41,log2,1,2,646,TPESampler,COMPLETE
4527,0.344269014247354,2025-04-24 22:18:11.433169,2025-04-24 22:18:14.627918,0 days 00:00:03.194749,True,squared_error,37,,1,2,412,TPESampler,COMPLETE
4528,0.34279601580036767,2025-04-24 22:18:11.597237,2025-04-24 22:18:16.106934,0 days 00:00:04.509697,True,squared_error,42,,1,3,575,TPESampler,COMPLETE
4529,0.42759321006547774,2025-04-24 22:18:12.533835,2025-04-24 22:18:16.133774,0 days 00:00:03.599939,True,squared_error,50,,2,4,591,TPESampler,COMPLETE
4530,0.37675158142537807,2025-04-24 22:18:12.966491,2025-04-24 22:18:16.788134,0 days 00:00:03.821643,True,squared_error,50,,1,8,538,TPESampler,COMPLETE
4531,0.34455826450384,2025-04-24 22:18:13.198269,2025-04-24 22:18:18.710673,0 days 00:00:05.512404,True,squared_error,50,,1,2,702,TPESampler,COMPLETE
4532,0.3427624883393932,2025-04-24 22:18:14.997976,2025-04-24 22:18:17.211242,0 days 00:00:02.213266,True,squared_error,50,,1,3,263,TPESampler,COMPLETE
4533,0.4381702262050886,2025-04-24 22:18:16.368499,2025-04-24 22:18:19.193098,0 days 00:00:02.824599,True,squared_error,44,,2,6,370,TPESampler,COMPLETE
4534,0.34450609992778247,2025-04-24 22:18:16.375138,2025-04-24 22:18:20.230676,0 days 00:00:03.855538,True,squared_error,50,,1,2,368,TPESampler,COMPLETE
4535,0.34452254254122283,2025-04-24 22:18:17.138672,2025-04-24 22:18:22.567394,0 days 00:00:05.428722,True,squared_error,44,,1,3,739,TPESampler,COMPLETE
4536,0.34254694862054597,2025-04-24 22:18:17.716056,2025-04-24 22:18:22.252905,0 days 00:00:04.536849,True,squared_error,43,,1,3,784,TPESampler,COMPLETE
4537,0.5158190428160575,2025-04-24 22:18:18.960118,2025-04-24 22:18:26.054518,0 days 00:00:07.094400,True,absolute_error,40,log2,1,6,968,TPESampler,COMPLETE
4538,0.3608499395387906,2025-04-24 22:18:19.452852,2025-04-24 22:18:22.372913,0 days 00:00:02.920061,True,squared_error,43,,1,6,557,TPESampler,COMPLETE
4539,0.4253068125756653,2025-04-24 22:18:20.508382,2025-04-24 22:18:24.638052,0 days 00:00:04.129670,True,squared_error,44,,2,3,842,TPESampler,COMPLETE
4540,0.6233675419729564,2025-04-24 22:18:22.468144,2025-04-24 22:18:26.540678,0 days 00:00:04.072534,False,squared_error,23,,12,2,815,TPESampler,COMPLETE
4541,0.44581523354943603,2025-04-24 22:18:22.655536,2025-04-24 22:18:39.505845,0 days 00:00:16.850309,True,absolute_error,50,,2,5,548,TPESampler,COMPLETE
4542,0.3435569151263813,2025-04-24 22:18:22.851586,2025-04-24 22:18:26.827139,0 days 00:00:03.975553,True,squared_error,44,,1,3,510,TPESampler,COMPLETE
4543,0.42827712607559065,2025-04-24 22:18:24.365366,2025-04-24 22:18:27.203392,0 days 00:00:02.838026,True,squared_error,50,,2,2,499,TPESampler,COMPLETE
4544,0.4295728600285416,2025-04-24 22:18:24.916739,2025-04-24 22:18:28.197445,0 days 00:00:03.280706,True,squared_error,50,,2,4,466,TPESampler,COMPLETE
4545,0.3426300877306219,2025-04-24 22:18:26.303466,2025-04-24 22:18:30.520792,0 days 00:00:04.217326,True,squared_error,42,,1,3,524,TPESampler,COMPLETE
4546,0.3867180205478851,2025-04-24 22:18:26.794034,2025-04-24 22:18:29.462056,0 days 00:00:02.668022,True,squared_error,50,sqrt,1,5,720,TPESampler,COMPLETE
4547,0.48587860615241124,2025-04-24 22:18:27.218218,2025-04-24 22:18:31.527031,0 days 00:00:04.308813,False,squared_error,49,,2,9,645,TPESampler,COMPLETE
4548,0.6284345106600902,2025-04-24 22:18:27.565853,2025-04-24 22:18:30.218458,0 days 00:00:02.652605,False,squared_error,43,,13,20,606,TPESampler,COMPLETE
4549,0.35287499968660035,2025-04-24 22:18:28.690907,2025-04-24 22:18:32.591383,0 days 00:00:03.900476,True,squared_error,45,,1,5,605,TPESampler,COMPLETE
4550,0.34711487990201095,2025-04-24 22:18:29.768480,2025-04-24 22:18:33.976602,0 days 00:00:04.208122,True,squared_error,43,,1,4,642,TPESampler,COMPLETE
4551,0.37765531375599615,2025-04-24 22:18:30.544373,2025-04-24 22:18:32.847151,0 days 00:00:02.302778,True,squared_error,45,sqrt,1,3,519,TPESampler,COMPLETE
4552,0.47316372716808963,2025-04-24 22:18:30.834607,2025-04-24 22:18:33.538256,0 days 00:00:02.703649,True,absolute_error,31,sqrt,1,22,171,TPESampler,COMPLETE
4553,0.8851611793623638,2025-04-24 22:18:31.854241,2025-04-24 22:18:33.625902,0 days 00:00:01.771661,False,absolute_error,12,log2,2,5,234,TPESampler,COMPLETE
4554,0.35378414882856724,2025-04-24 22:18:32.945131,2025-04-24 22:18:37.965517,0 days 00:00:05.020386,True,squared_error,50,,1,5,636,TPESampler,COMPLETE
4555,0.3562702828199854,2025-04-24 22:18:33.110194,2025-04-24 22:19:08.937313,0 days 00:00:35.827119,True,absolute_error,50,,1,5,634,TPESampler,COMPLETE
4556,0.43027948150904605,2025-04-24 22:18:33.794299,2025-04-24 22:18:36.609323,0 days 00:00:02.815024,True,squared_error,44,,2,4,325,TPESampler,COMPLETE
4557,0.42696786871202447,2025-04-24 22:18:33.952177,2025-04-24 22:18:37.700098,0 days 00:00:03.747921,True,squared_error,36,,2,3,524,TPESampler,COMPLETE
4558,0.8777425775296679,2025-04-24 22:18:34.577866,2025-04-24 22:18:37.240230,0 days 00:00:02.662364,False,absolute_error,41,log2,2,11,617,TPESampler,COMPLETE
4559,0.3431801033076945,2025-04-24 22:18:36.854657,2025-04-24 22:18:41.008185,0 days 00:00:04.153528,True,squared_error,50,,1,2,530,TPESampler,COMPLETE
4560,0.34558061262142636,2025-04-24 22:18:37.477608,2025-04-24 22:18:41.251679,0 days 00:00:03.774071,True,squared_error,50,,1,4,598,TPESampler,COMPLETE
4561,0.3529856984697144,2025-04-24 22:18:38.048263,2025-04-24 22:18:43.566130,0 days 00:00:05.517867,True,squared_error,50,,1,5,861,TPESampler,COMPLETE
4562,0.5335512542773095,2025-04-24 22:18:38.235555,2025-04-24 22:18:41.886557,0 days 00:00:03.651002,False,absolute_error,43,log2,1,34,273,TPESampler,COMPLETE
4563,0.34538632678583625,2025-04-24 22:18:39.806194,2025-04-24 22:18:44.700766,0 days 00:00:04.894572,True,squared_error,42,,1,2,718,TPESampler,COMPLETE
4564,0.3417247437616614,2025-04-24 22:18:41.251004,2025-04-24 22:18:44.996226,0 days 00:00:03.745222,True,squared_error,50,,1,3,463,TPESampler,COMPLETE
4565,0.8800557038191632,2025-04-24 22:18:41.518973,2025-04-24 22:18:43.044910,0 days 00:00:01.525937,True,squared_error,46,log2,2,4,410,TPESampler,COMPLETE
4566,0.4293738408313771,2025-04-24 22:18:42.180201,2025-04-24 22:18:46.529395,0 days 00:00:04.349194,False,squared_error,49,,1,2,454,TPESampler,COMPLETE
4567,0.3695759420826368,2025-04-24 22:18:43.372827,2025-04-24 22:18:46.363610,0 days 00:00:02.990783,True,squared_error,45,,1,7,380,TPESampler,COMPLETE
4568,0.4271425436487127,2025-04-24 22:18:43.817822,2025-04-24 22:18:46.873305,0 days 00:00:03.055483,True,squared_error,43,,2,3,541,TPESampler,COMPLETE
4569,0.4273802158495718,2025-04-24 22:18:44.987997,2025-04-24 22:18:48.794880,0 days 00:00:03.806883,True,squared_error,43,,2,3,758,TPESampler,COMPLETE
4570,0.34346537805197075,2025-04-24 22:18:45.267929,2025-04-24 22:18:49.035748,0 days 00:00:03.767819,True,squared_error,43,,1,2,462,TPESampler,COMPLETE
4571,0.4136749927743289,2025-04-24 22:18:46.656452,2025-04-24 22:18:52.598216,0 days 00:00:05.941764,False,squared_error,46,,1,4,882,TPESampler,COMPLETE
4572,0.3469364215493425,2025-04-24 22:18:46.822673,2025-04-24 22:18:50.133924,0 days 00:00:03.311251,True,squared_error,43,,1,4,430,TPESampler,COMPLETE
4573,0.34665958662420293,2025-04-24 22:18:47.222616,2025-04-24 22:18:50.700969,0 days 00:00:03.478353,True,squared_error,43,,1,4,460,TPESampler,COMPLETE
4574,0.3447569373185759,2025-04-24 22:18:49.038243,2025-04-24 22:18:52.698249,0 days 00:00:03.660006,True,squared_error,42,,1,2,661,TPESampler,COMPLETE
4575,0.34248711192605735,2025-04-24 22:18:49.305542,2025-04-24 22:18:54.019735,0 days 00:00:04.714193,True,squared_error,50,,1,3,669,TPESampler,COMPLETE
4576,0.42804700451303695,2025-04-24 22:18:50.557206,2025-04-24 22:18:53.513046,0 days 00:00:02.955840,True,squared_error,50,,2,2,489,TPESampler,COMPLETE
4577,0.3446713760868206,2025-04-24 22:18:51.119376,2025-04-24 22:18:56.148125,0 days 00:00:05.028749,True,squared_error,50,,1,2,690,TPESampler,COMPLETE
4578,0.8322890320498079,2025-04-24 22:18:52.842367,2025-04-24 22:18:54.641885,0 days 00:00:01.799518,False,squared_error,23,log2,2,22,517,TPESampler,COMPLETE
4579,0.3465000174093542,2025-04-24 22:18:53.017337,2025-04-24 22:18:57.111581,0 days 00:00:04.094244,True,squared_error,50,,1,4,558,TPESampler,COMPLETE
4580,0.3416688691111574,2025-04-24 22:18:53.808051,2025-04-24 22:18:57.427434,0 days 00:00:03.619383,True,squared_error,43,,1,3,447,TPESampler,COMPLETE
4581,0.34100166370620855,2025-04-24 22:18:54.461499,2025-04-24 22:18:58.643829,0 days 00:00:04.182330,True,squared_error,50,,1,3,537,TPESampler,COMPLETE
4582,0.42742050907905926,2025-04-24 22:18:54.909998,2025-04-24 22:18:58.563162,0 days 00:00:03.653164,True,squared_error,50,,2,3,723,TPESampler,COMPLETE
4583,0.4278100523811672,2025-04-24 22:18:56.402454,2025-04-24 22:19:00.335608,0 days 00:00:03.933154,True,squared_error,34,,2,2,615,TPESampler,COMPLETE
4584,0.34313469421156795,2025-04-24 22:18:57.414637,2025-04-24 22:19:01.341464,0 days 00:00:03.926827,True,squared_error,43,,1,2,584,TPESampler,COMPLETE
4585,0.42851758861339634,2025-04-24 22:18:57.764210,2025-04-24 22:19:01.941760,0 days 00:00:04.177550,True,squared_error,43,,2,3,635,TPESampler,COMPLETE
4586,0.34262247509416077,2025-04-24 22:18:59.004084,2025-04-24 22:19:02.385642,0 days 00:00:03.381558,True,squared_error,44,,1,3,542,TPESampler,COMPLETE
4587,0.35266169425744176,2025-04-24 22:18:59.120908,2025-04-24 22:19:02.571069,0 days 00:00:03.450161,True,squared_error,50,,1,5,449,TPESampler,COMPLETE
4588,0.43149643934835136,2025-04-24 22:19:00.590914,2025-04-24 22:19:04.263209,0 days 00:00:03.672295,True,squared_error,44,,2,5,579,TPESampler,COMPLETE
4589,0.34174067828181337,2025-04-24 22:19:01.621224,2025-04-24 22:19:05.042088,0 days 00:00:03.420864,True,squared_error,50,,1,3,514,TPESampler,COMPLETE
4590,0.5277838041869762,2025-04-24 22:19:02.195106,2025-04-24 22:19:07.564855,0 days 00:00:05.369749,False,absolute_error,38,log2,1,8,461,TPESampler,COMPLETE
4591,0.3424688270230839,2025-04-24 22:19:02.814391,2025-04-24 22:19:06.774158,0 days 00:00:03.959767,True,squared_error,43,,1,3,642,TPESampler,COMPLETE
4592,0.3440604402490968,2025-04-24 22:19:02.932242,2025-04-24 22:19:06.728346,0 days 00:00:03.796104,True,squared_error,35,,1,3,573,TPESampler,COMPLETE
4593,0.47513429749357394,2025-04-24 22:19:04.505032,2025-04-24 22:19:06.438392,0 days 00:00:01.933360,True,squared_error,42,log2,1,3,582,TPESampler,COMPLETE
4594,0.3458757000315709,2025-04-24 22:19:05.345484,2025-04-24 22:19:09.017809,0 days 00:00:03.672325,True,squared_error,50,,1,4,584,TPESampler,COMPLETE
4595,0.34081969787559396,2025-04-24 22:19:06.681405,2025-04-24 22:19:11.064193,0 days 00:00:04.382788,True,squared_error,50,,1,3,605,TPESampler,COMPLETE
4596,0.3439142816128424,2025-04-24 22:19:07.086204,2025-04-24 22:19:12.094378,0 days 00:00:05.008174,True,squared_error,44,,1,3,713,TPESampler,COMPLETE
4597,0.3438612609218952,2025-04-24 22:19:07.086487,2025-04-24 22:19:11.230553,0 days 00:00:04.144066,True,squared_error,43,,1,2,475,TPESampler,COMPLETE
4598,0.353697676079727,2025-04-24 22:19:08.131155,2025-04-24 22:19:12.017244,0 days 00:00:03.886089,True,squared_error,43,,1,5,621,TPESampler,COMPLETE
4599,0.42751618314516354,2025-04-24 22:19:09.282894,2025-04-24 22:19:13.405527,0 days 00:00:04.122633,True,squared_error,50,,2,2,652,TPESampler,COMPLETE
4600,0.42777267017730264,2025-04-24 22:19:09.337808,2025-04-24 22:19:13.298846,0 days 00:00:03.961038,True,squared_error,50,,2,2,603,TPESampler,COMPLETE
4601,0.34161982527992824,2025-04-24 22:19:11.342307,2025-04-24 22:19:15.913959,0 days 00:00:04.571652,True,squared_error,50,,1,3,618,TPESampler,COMPLETE
4602,0.34419773843261275,2025-04-24 22:19:11.497125,2025-04-24 22:19:17.264773,0 days 00:00:05.767648,True,squared_error,50,,1,2,793,TPESampler,COMPLETE
4603,0.42762280818932186,2025-04-24 22:19:12.322045,2025-04-24 22:19:16.000149,0 days 00:00:03.678104,True,squared_error,50,,2,4,606,TPESampler,COMPLETE
4604,0.34304298101453295,2025-04-24 22:19:12.675407,2025-04-24 22:19:18.045097,0 days 00:00:05.369690,True,squared_error,50,,1,3,722,TPESampler,COMPLETE
4605,0.343092471643231,2025-04-24 22:19:13.551414,2025-04-24 22:19:18.383592,0 days 00:00:04.832178,True,squared_error,50,,1,2,549,TPESampler,COMPLETE
4606,0.34181369454764066,2025-04-24 22:19:13.838212,2025-04-24 22:19:18.477565,0 days 00:00:04.639353,True,squared_error,50,,1,3,623,TPESampler,COMPLETE
4607,0.3426578610277872,2025-04-24 22:19:16.141510,2025-04-24 22:19:20.965854,0 days 00:00:04.824344,True,squared_error,43,,1,3,635,TPESampler,COMPLETE
4608,0.35302124779083716,2025-04-24 22:19:16.321040,2025-04-24 22:19:20.548460,0 days 00:00:04.227420,True,squared_error,43,,1,5,584,TPESampler,COMPLETE
4609,0.4303619453015526,2025-04-24 22:19:17.613774,2025-04-24 22:19:20.736544,0 days 00:00:03.122770,True,squared_error,50,,2,2,353,TPESampler,COMPLETE
4610,0.3621375023885004,2025-04-24 22:19:18.302320,2025-04-24 22:19:23.336707,0 days 00:00:05.034387,True,squared_error,50,,1,6,751,TPESampler,COMPLETE
4611,0.36051018052509126,2025-04-24 22:19:18.761339,2025-04-24 22:19:22.839677,0 days 00:00:04.078338,True,squared_error,50,,1,6,538,TPESampler,COMPLETE
4612,0.34161373196363853,2025-04-24 22:19:18.807197,2025-04-24 22:19:23.452794,0 days 00:00:04.645597,True,squared_error,50,,1,3,615,TPESampler,COMPLETE
4613,0.8417807057464318,2025-04-24 22:19:20.807625,2025-04-24 22:19:22.907131,0 days 00:00:02.099506,True,squared_error,26,sqrt,4,38,399,TPESampler,COMPLETE
4614,0.3423963591495603,2025-04-24 22:19:21.167150,2025-04-24 22:19:23.950158,0 days 00:00:02.783008,True,squared_error,42,,1,3,356,TPESampler,COMPLETE
4615,0.45927530883638024,2025-04-24 22:19:21.302256,2025-04-24 22:19:30.581704,0 days 00:00:09.279448,True,absolute_error,32,sqrt,1,25,986,TPESampler,COMPLETE
4616,0.42838429449861043,2025-04-24 22:19:23.095946,2025-04-24 22:19:27.053885,0 days 00:00:03.957939,True,squared_error,50,,2,4,628,TPESampler,COMPLETE
4617,0.42980118250274346,2025-04-24 22:19:23.178461,2025-04-24 22:19:25.922150,0 days 00:00:02.743689,True,squared_error,45,,2,3,319,TPESampler,COMPLETE
4618,0.44517350480510903,2025-04-24 22:19:23.744910,2025-04-24 22:19:37.088666,0 days 00:00:13.343756,True,absolute_error,49,,2,2,448,TPESampler,COMPLETE
4619,0.34261198134083676,2025-04-24 22:19:23.756993,2025-04-24 22:19:28.946677,0 days 00:00:05.189684,True,squared_error,50,,1,3,783,TPESampler,COMPLETE
4620,0.3447548913404809,2025-04-24 22:19:24.515406,2025-04-24 22:19:28.985896,0 days 00:00:04.470490,True,squared_error,36,,1,3,743,TPESampler,COMPLETE
4621,0.4268880788384034,2025-04-24 22:19:26.171819,2025-04-24 22:19:28.767978,0 days 00:00:02.596159,True,squared_error,50,,2,4,527,TPESampler,COMPLETE
4622,0.4440515012530357,2025-04-24 22:19:27.301072,2025-04-24 22:19:30.798366,0 days 00:00:03.497294,True,squared_error,38,,2,8,762,TPESampler,COMPLETE
4623,0.34124847738974856,2025-04-24 22:19:29.019895,2025-04-24 22:19:33.288805,0 days 00:00:04.268910,True,squared_error,43,,1,3,597,TPESampler,COMPLETE
4624,0.3786962360966588,2025-04-24 22:19:29.254920,2025-04-24 22:19:32.731242,0 days 00:00:03.476322,True,squared_error,36,,1,8,576,TPESampler,COMPLETE
4625,0.3441604508489697,2025-04-24 22:19:29.365713,2025-04-24 22:19:34.155175,0 days 00:00:04.789462,True,squared_error,43,,1,2,652,TPESampler,COMPLETE
4626,0.346627906195216,2025-04-24 22:19:31.011614,2025-04-24 22:19:33.906850,0 days 00:00:02.895236,True,squared_error,50,,1,4,431,TPESampler,COMPLETE
4627,0.34844443485609894,2025-04-24 22:19:31.051390,2025-04-24 22:20:07.150336,0 days 00:00:36.098946,True,absolute_error,43,,1,2,654,TPESampler,COMPLETE
4628,0.906940783538358,2025-04-24 22:19:32.966581,2025-04-24 22:19:34.769581,0 days 00:00:01.803000,True,squared_error,47,log2,3,13,906,TPESampler,COMPLETE
4629,0.3477976296591139,2025-04-24 22:19:33.542919,2025-04-24 22:19:38.839806,0 days 00:00:05.296887,True,squared_error,44,,1,4,734,TPESampler,COMPLETE
4630,0.42598432884564763,2025-04-24 22:19:34.255736,2025-04-24 22:19:44.244318,0 days 00:00:09.988582,True,absolute_error,33,sqrt,1,2,921,TPESampler,COMPLETE
4631,0.9170618679942338,2025-04-24 22:19:34.533946,2025-04-24 22:19:37.089272,0 days 00:00:02.555326,True,squared_error,7,sqrt,14,4,370,TPESampler,COMPLETE
4632,0.43613747247013707,2025-04-24 22:19:35.069190,2025-04-24 22:19:38.701943,0 days 00:00:03.632753,True,squared_error,50,,2,6,748,TPESampler,COMPLETE
4633,0.34212497691063376,2025-04-24 22:19:37.349441,2025-04-24 22:19:41.781417,0 days 00:00:04.431976,True,squared_error,43,,1,3,616,TPESampler,COMPLETE
4634,0.45573757625617156,2025-04-24 22:19:37.349820,2025-04-24 22:19:40.266317,0 days 00:00:02.916497,True,squared_error,50,,2,26,556,TPESampler,COMPLETE
4635,0.34346086840368084,2025-04-24 22:19:38.967988,2025-04-24 22:19:42.828751,0 days 00:00:03.860763,True,squared_error,50,,1,2,571,TPESampler,COMPLETE
4636,0.8561301197902236,2025-04-24 22:19:39.097984,2025-04-24 22:19:40.720603,0 days 00:00:01.622619,False,squared_error,49,sqrt,8,35,844,TPESampler,COMPLETE
4637,0.344376614616821,2025-04-24 22:19:40.509038,2025-04-24 22:19:43.179008,0 days 00:00:02.669970,True,squared_error,45,,1,2,385,TPESampler,COMPLETE
4638,0.3438685767769901,2025-04-24 22:19:40.981997,2025-04-24 22:19:44.096783,0 days 00:00:03.114786,True,squared_error,50,,1,2,384,TPESampler,COMPLETE
4639,0.3415175149735954,2025-04-24 22:19:42.080333,2025-04-24 22:19:45.537803,0 days 00:00:03.457470,True,squared_error,50,,1,3,472,TPESampler,COMPLETE
4640,0.3470632576099702,2025-04-24 22:19:43.131272,2025-04-24 22:19:46.993978,0 days 00:00:03.862706,True,squared_error,50,,1,4,644,TPESampler,COMPLETE
4641,0.34396502386467426,2025-04-24 22:19:43.514153,2025-04-24 22:19:47.819834,0 days 00:00:04.305681,True,squared_error,50,,1,2,647,TPESampler,COMPLETE
4642,0.9109077131079144,2025-04-24 22:19:44.394842,2025-04-24 22:19:47.100112,0 days 00:00:02.705270,False,squared_error,35,sqrt,13,25,723,TPESampler,COMPLETE
4643,0.35332897935829743,2025-04-24 22:19:44.613043,2025-04-24 22:19:49.247138,0 days 00:00:04.634095,True,squared_error,43,,1,5,567,TPESampler,COMPLETE
4644,0.42959253121657576,2025-04-24 22:19:45.866847,2025-04-24 22:19:49.408531,0 days 00:00:03.541684,True,squared_error,42,,2,3,456,TPESampler,COMPLETE
4645,0.3418046139941826,2025-04-24 22:19:47.488878,2025-04-24 22:19:50.727692,0 days 00:00:03.238814,True,squared_error,43,,1,3,457,TPESampler,COMPLETE
4646,0.6076225422994541,2025-04-24 22:19:47.614425,2025-04-24 22:19:54.148679,0 days 00:00:06.534254,False,absolute_error,28,log2,1,7,657,TPESampler,COMPLETE
4647,0.42860660554236174,2025-04-24 22:19:48.153812,2025-04-24 22:19:51.011390,0 days 00:00:02.857578,True,squared_error,43,,2,3,573,TPESampler,COMPLETE
4648,0.3467520577563037,2025-04-24 22:19:49.488094,2025-04-24 22:19:52.815042,0 days 00:00:03.326948,True,squared_error,50,,1,4,490,TPESampler,COMPLETE
4649,0.3536108617921073,2025-04-24 22:19:49.642141,2025-04-24 22:19:52.482009,0 days 00:00:02.839868,True,squared_error,50,,1,5,372,TPESampler,COMPLETE
4650,0.4308277585863702,2025-04-24 22:19:51.083613,2025-04-24 22:19:56.084298,0 days 00:00:05.000685,False,squared_error,46,,1,3,687,TPESampler,COMPLETE
4651,0.3544146374763999,2025-04-24 22:19:51.386832,2025-04-24 22:19:55.115187,0 days 00:00:03.728355,True,squared_error,44,,1,5,675,TPESampler,COMPLETE
4652,0.34230853180265125,2025-04-24 22:19:52.773865,2025-04-24 22:19:57.249865,0 days 00:00:04.476000,True,squared_error,50,,1,3,636,TPESampler,COMPLETE
4653,0.3474399051088185,2025-04-24 22:19:53.132499,2025-04-24 22:19:57.878025,0 days 00:00:04.745526,True,squared_error,50,,1,4,675,TPESampler,COMPLETE
4654,0.442245150043441,2025-04-24 22:19:54.483099,2025-04-24 22:19:57.125573,0 days 00:00:02.642474,True,squared_error,41,,2,7,521,TPESampler,COMPLETE
4655,0.3804380851776735,2025-04-24 22:19:55.382156,2025-04-24 22:19:58.196116,0 days 00:00:02.813960,True,squared_error,43,sqrt,1,2,684,TPESampler,COMPLETE
4656,0.3439719699556045,2025-04-24 22:19:56.507630,2025-04-24 22:20:00.146633,0 days 00:00:03.639003,True,squared_error,50,,1,2,488,TPESampler,COMPLETE
4657,0.34421673137795467,2025-04-24 22:19:57.467221,2025-04-24 22:20:01.749063,0 days 00:00:04.281842,True,squared_error,43,,1,2,506,TPESampler,COMPLETE
4658,0.3476091582372985,2025-04-24 22:19:57.845263,2025-04-24 22:20:01.340282,0 days 00:00:03.495019,True,squared_error,42,,1,4,438,TPESampler,COMPLETE
4659,0.3467399750921087,2025-04-24 22:19:58.448834,2025-04-24 22:20:02.776138,0 days 00:00:04.327304,True,squared_error,50,,1,4,658,TPESampler,COMPLETE
4660,0.43077187285750346,2025-04-24 22:19:58.437985,2025-04-24 22:20:02.262739,0 days 00:00:03.824754,True,squared_error,41,,2,5,698,TPESampler,COMPLETE
4661,0.6512530514618841,2025-04-24 22:20:00.388386,2025-04-24 22:20:01.718143,0 days 00:00:01.329757,True,squared_error,50,sqrt,2,2,370,TPESampler,COMPLETE
4662,0.5447443002830605,2025-04-24 22:20:01.603192,2025-04-24 22:20:08.449887,0 days 00:00:06.846695,True,absolute_error,46,,5,3,557,TPESampler,COMPLETE
4663,0.42887922240377285,2025-04-24 22:20:02.000645,2025-04-24 22:20:05.030681,0 days 00:00:03.030036,True,squared_error,50,,2,4,474,TPESampler,COMPLETE
4664,0.34265486429677255,2025-04-24 22:20:02.203610,2025-04-24 22:20:06.570174,0 days 00:00:04.366564,True,squared_error,50,,1,2,601,TPESampler,COMPLETE
