number,value,datetime_start,datetime_complete,duration,params_bootstrap,params_criterion,params_max_depth,params_max_features,params_min_samples_leaf,params_min_samples_split,params_n_estimators,system_attrs_auto:sampler,state
2685,0.34582475731605705,2025-04-24 21:51:33.000446,2025-04-24 21:51:37.244604,0 days 00:00:04.244158,True,squared_error,44,,1,4,601,TPESampler,COMPLETE
2686,0.3423486567486652,2025-04-24 21:51:33.675279,2025-04-24 21:51:37.984436,0 days 00:00:04.309157,True,squared_error,44,,1,3,609,TPESampler,COMPLETE
2687,0.3431679321664077,2025-04-24 21:51:34.538292,2025-04-24 21:51:39.139744,0 days 00:00:04.601452,True,squared_error,50,,1,3,726,TPESampler,COMPLETE
2688,0.4273316065927458,2025-04-24 21:51:35.573916,2025-04-24 21:51:38.908536,0 days 00:00:03.334620,True,squared_error,42,,2,2,661,TPESampler,COMPLETE
2689,0.3542675331911972,2025-04-24 21:51:35.737357,2025-04-24 21:51:40.085793,0 days 00:00:04.348436,True,squared_error,50,,1,5,707,TPESampler,COMPLETE
2690,0.6033452157772624,2025-04-24 21:51:36.773108,2025-04-24 21:51:41.597301,0 days 00:00:04.824193,True,absolute_error,32,,9,3,694,TPESampler,COMPLETE
2691,0.42931965569764247,2025-04-24 21:51:37.506914,2025-04-24 21:51:43.161768,0 days 00:00:05.654854,False,squared_error,50,,1,3,762,TPESampler,COMPLETE
2692,0.3411873752471255,2025-04-24 21:51:38.264534,2025-04-24 21:51:41.975152,0 days 00:00:03.710618,True,squared_error,50,,1,3,582,TPESampler,COMPLETE
2693,0.8780250251883608,2025-04-24 21:51:39.180424,2025-04-24 21:51:40.776239,0 days 00:00:01.595815,True,squared_error,43,log2,2,3,465,TPESampler,COMPLETE
2694,0.4305498536538838,2025-04-24 21:51:39.427643,2025-04-24 21:51:43.158605,0 days 00:00:03.730962,True,squared_error,43,,2,5,692,TPESampler,COMPLETE
2695,0.4270949108853321,2025-04-24 21:51:40.310984,2025-04-24 21:51:44.174402,0 days 00:00:03.863418,True,squared_error,49,,2,2,667,TPESampler,COMPLETE
2696,0.8803443172324207,2025-04-24 21:51:41.045526,2025-04-24 21:51:42.626399,0 days 00:00:01.580873,True,squared_error,47,log2,2,2,575,TPESampler,COMPLETE
2697,0.3408351192221681,2025-04-24 21:51:41.881224,2025-04-24 21:51:46.275838,0 days 00:00:04.394614,True,squared_error,50,,1,3,596,TPESampler,COMPLETE
2698,0.3900774881773846,2025-04-24 21:51:42.341863,2025-04-24 21:51:44.669419,0 days 00:00:02.327556,False,squared_error,39,sqrt,1,3,581,TPESampler,COMPLETE
2699,0.34513207656485956,2025-04-24 21:51:42.976784,2025-04-24 21:52:11.956270,0 days 00:00:28.979486,True,absolute_error,50,,1,3,527,TPESampler,COMPLETE
2700,0.3466021468836622,2025-04-24 21:51:43.503883,2025-04-24 21:51:47.334213,0 days 00:00:03.830330,True,squared_error,43,,1,4,623,TPESampler,COMPLETE
2701,0.3451229459335959,2025-04-24 21:51:43.560573,2025-04-24 21:51:47.658102,0 days 00:00:04.097529,True,squared_error,42,,1,2,635,TPESampler,COMPLETE
2702,0.9297739024761742,2025-04-24 21:51:44.422413,2025-04-24 21:51:46.236100,0 days 00:00:01.813687,False,squared_error,41,log2,12,4,969,TPESampler,COMPLETE
2703,0.42808351861148136,2025-04-24 21:51:45.002911,2025-04-24 21:51:48.975157,0 days 00:00:03.972246,True,squared_error,50,,2,3,612,TPESampler,COMPLETE
2704,0.40952015244365364,2025-04-24 21:51:46.521580,2025-04-24 21:51:50.803661,0 days 00:00:04.282081,False,squared_error,41,,1,4,603,TPESampler,COMPLETE
2705,0.35485694100910115,2025-04-24 21:51:46.568050,2025-04-24 21:51:51.069175,0 days 00:00:04.501125,True,squared_error,43,,1,5,756,TPESampler,COMPLETE
2706,0.42793032634250205,2025-04-24 21:51:47.614714,2025-04-24 21:51:50.662458,0 days 00:00:03.047744,True,squared_error,50,,2,2,583,TPESampler,COMPLETE
2707,0.5855700219347469,2025-04-24 21:51:47.961247,2025-04-24 21:51:49.821902,0 days 00:00:01.860655,True,squared_error,46,,7,4,398,TPESampler,COMPLETE
2708,0.34675782134218025,2025-04-24 21:51:49.207212,2025-04-24 21:51:52.955265,0 days 00:00:03.748053,True,squared_error,50,,1,4,563,TPESampler,COMPLETE
2709,0.34334268151732383,2025-04-24 21:51:50.046384,2025-04-24 21:51:53.950180,0 days 00:00:03.903796,True,squared_error,43,,1,3,720,TPESampler,COMPLETE
2710,0.35230519443797165,2025-04-24 21:51:51.026305,2025-04-24 21:51:55.244877,0 days 00:00:04.218572,True,squared_error,50,,1,5,606,TPESampler,COMPLETE
2711,0.34228025217899366,2025-04-24 21:51:51.062717,2025-04-24 21:51:55.060913,0 days 00:00:03.998196,True,squared_error,50,,1,3,682,TPESampler,COMPLETE
2712,0.42760778979710645,2025-04-24 21:51:51.413919,2025-04-24 21:51:55.633482,0 days 00:00:04.219563,True,squared_error,49,,2,4,707,TPESampler,COMPLETE
2713,0.602405058357197,2025-04-24 21:51:53.177913,2025-04-24 21:51:54.689309,0 days 00:00:01.511396,True,squared_error,28,log2,1,9,464,TPESampler,COMPLETE
2714,0.4261885059451653,2025-04-24 21:51:54.159003,2025-04-24 21:51:57.534623,0 days 00:00:03.375620,False,squared_error,19,,2,2,625,TPESampler,COMPLETE
2715,0.34481109135775884,2025-04-24 21:51:54.965991,2025-04-24 21:51:59.787683,0 days 00:00:04.821692,True,squared_error,43,,1,2,701,TPESampler,COMPLETE
2716,0.48513185208085313,2025-04-24 21:51:55.287703,2025-04-24 21:51:57.536399,0 days 00:00:02.248696,True,squared_error,39,log2,1,2,714,TPESampler,COMPLETE
2717,0.34238092954130234,2025-04-24 21:51:55.534778,2025-04-24 21:52:00.076282,0 days 00:00:04.541504,True,squared_error,50,,1,3,692,TPESampler,COMPLETE
2718,0.42770056551131563,2025-04-24 21:51:56.177317,2025-04-24 21:51:58.220636,0 days 00:00:02.043319,True,squared_error,50,log2,1,3,549,TPESampler,COMPLETE
2719,0.34455844194043034,2025-04-24 21:51:57.707468,2025-04-24 21:52:01.947631,0 days 00:00:04.240163,True,squared_error,44,,1,2,675,TPESampler,COMPLETE
2720,0.34707795144090875,2025-04-24 21:51:57.753026,2025-04-24 21:52:01.473112,0 days 00:00:03.720086,True,squared_error,50,,1,4,640,TPESampler,COMPLETE
2721,0.5706153621963714,2025-04-24 21:51:58.487069,2025-04-24 21:52:01.803908,0 days 00:00:03.316839,False,absolute_error,28,,4,7,103,TPESampler,COMPLETE
2722,0.34338993694648146,2025-04-24 21:52:00.001452,2025-04-24 21:52:03.848119,0 days 00:00:03.846667,True,squared_error,50,,1,2,569,TPESampler,COMPLETE
2723,0.5652780049341698,2025-04-24 21:52:00.412008,2025-04-24 21:52:03.486324,0 days 00:00:03.074316,True,absolute_error,14,,6,38,291,TPESampler,COMPLETE
2724,0.3880168341149952,2025-04-24 21:52:01.681131,2025-04-24 21:52:03.882701,0 days 00:00:02.201570,True,squared_error,49,sqrt,1,5,662,TPESampler,COMPLETE
2725,0.3474276027386774,2025-04-24 21:52:02.044250,2025-04-24 21:52:06.453563,0 days 00:00:04.409313,True,squared_error,50,,1,4,687,TPESampler,COMPLETE
2726,0.4255591727086401,2025-04-24 21:52:02.186440,2025-04-24 21:52:05.930237,0 days 00:00:03.743797,True,squared_error,42,,2,3,795,TPESampler,COMPLETE
2727,0.42836159537406737,2025-04-24 21:52:03.708706,2025-04-24 21:52:07.194216,0 days 00:00:03.485510,True,squared_error,50,,2,3,633,TPESampler,COMPLETE
2728,0.6547996912098282,2025-04-24 21:52:04.147640,2025-04-24 21:52:08.067482,0 days 00:00:03.919842,False,absolute_error,12,sqrt,2,28,613,TPESampler,COMPLETE
2729,0.34188131483457546,2025-04-24 21:52:04.194049,2025-04-24 21:52:09.785738,0 days 00:00:05.591689,True,squared_error,49,,1,3,875,TPESampler,COMPLETE
2730,0.34675858090789763,2025-04-24 21:52:06.139866,2025-04-24 21:52:09.722299,0 days 00:00:03.582433,True,squared_error,42,,1,4,600,TPESampler,COMPLETE
2731,0.3611845542016043,2025-04-24 21:52:06.902198,2025-04-24 21:52:10.259315,0 days 00:00:03.357117,True,squared_error,42,,1,6,576,TPESampler,COMPLETE
2732,0.6479022126340226,2025-04-24 21:52:07.467849,2025-04-24 21:52:12.849013,0 days 00:00:05.381164,False,absolute_error,45,,14,6,620,TPESampler,COMPLETE
2733,0.42750665018723333,2025-04-24 21:52:08.321573,2025-04-24 21:52:11.537646,0 days 00:00:03.216073,True,squared_error,50,,2,3,687,TPESampler,COMPLETE
2734,0.3491325801963827,2025-04-24 21:52:10.038766,2025-04-24 21:52:43.060130,0 days 00:00:33.021364,True,absolute_error,37,,1,2,613,TPESampler,COMPLETE
2735,0.6755488892726392,2025-04-24 21:52:10.293341,2025-04-24 21:52:14.666013,0 days 00:00:04.372672,True,absolute_error,19,sqrt,2,39,939,TPESampler,COMPLETE
2736,0.34394713770158164,2025-04-24 21:52:10.713530,2025-04-24 21:52:15.028686,0 days 00:00:04.315156,True,squared_error,44,,1,2,579,TPESampler,COMPLETE
2737,0.3419190577624474,2025-04-24 21:52:11.873748,2025-04-24 21:52:15.691430,0 days 00:00:03.817682,True,squared_error,43,,1,3,550,TPESampler,COMPLETE
2738,0.6822399884840649,2025-04-24 21:52:12.328119,2025-04-24 21:52:13.859681,0 days 00:00:01.531562,False,squared_error,9,,9,13,124,TPESampler,COMPLETE
2739,0.4426778278176626,2025-04-24 21:52:13.094638,2025-04-24 21:52:31.282856,0 days 00:00:18.188218,True,absolute_error,29,,2,3,669,TPESampler,COMPLETE
2740,0.4305477825330265,2025-04-24 21:52:14.135244,2025-04-24 21:52:17.424485,0 days 00:00:03.289241,True,squared_error,50,,2,5,689,TPESampler,COMPLETE
2741,0.43007844677176343,2025-04-24 21:52:14.960927,2025-04-24 21:52:22.904221,0 days 00:00:07.943294,True,absolute_error,35,sqrt,1,7,903,TPESampler,COMPLETE
2742,0.34619110869292113,2025-04-24 21:52:15.331763,2025-04-24 21:52:18.755232,0 days 00:00:03.423469,True,squared_error,50,,1,4,580,TPESampler,COMPLETE
2743,0.3450422236504765,2025-04-24 21:52:16.000259,2025-04-24 21:52:20.703717,0 days 00:00:04.703458,True,squared_error,50,,1,2,752,TPESampler,COMPLETE
2744,0.9877672068887063,2025-04-24 21:52:17.626242,2025-04-24 21:52:18.505288,0 days 00:00:00.879046,False,absolute_error,29,log2,14,7,225,TPESampler,COMPLETE
2745,0.34166122879129873,2025-04-24 21:52:18.717676,2025-04-24 21:52:21.957846,0 days 00:00:03.240170,True,squared_error,50,,1,3,516,TPESampler,COMPLETE
2746,0.4180463461268026,2025-04-24 21:52:18.978606,2025-04-24 21:52:20.364476,0 days 00:00:01.385870,True,squared_error,45,sqrt,1,11,388,TPESampler,COMPLETE
2747,0.4917151752668788,2025-04-24 21:52:20.637945,2025-04-24 21:53:19.311630,0 days 00:00:58.673685,False,absolute_error,31,,1,45,746,TPESampler,COMPLETE
2748,0.540868922164854,2025-04-24 21:52:20.932770,2025-04-24 21:52:23.539494,0 days 00:00:02.606724,True,squared_error,49,,5,5,629,TPESampler,COMPLETE
2749,0.428109191871876,2025-04-24 21:52:22.158189,2025-04-24 21:52:24.682601,0 days 00:00:02.524412,True,squared_error,43,,2,4,491,TPESampler,COMPLETE
2750,0.34301372756165915,2025-04-24 21:52:23.109071,2025-04-24 21:52:26.419596,0 days 00:00:03.310525,True,squared_error,44,,1,2,597,TPESampler,COMPLETE
2751,0.4514599259016554,2025-04-24 21:52:23.837743,2025-04-24 21:52:28.864047,0 days 00:00:05.026304,True,absolute_error,39,,2,4,172,TPESampler,COMPLETE
2752,0.3422254789309704,2025-04-24 21:52:24.891165,2025-04-24 21:52:28.082639,0 days 00:00:03.191474,True,squared_error,50,,1,3,639,TPESampler,COMPLETE
2753,0.4446887383111689,2025-04-24 21:52:26.633240,2025-04-24 21:52:42.472539,0 days 00:00:15.839299,True,absolute_error,42,,2,5,590,TPESampler,COMPLETE
2754,0.42695219088691766,2025-04-24 21:52:28.286970,2025-04-24 21:52:31.073795,0 days 00:00:02.786825,True,squared_error,42,,2,3,537,TPESampler,COMPLETE
2755,0.34226216926974845,2025-04-24 21:52:29.204781,2025-04-24 21:52:32.820607,0 days 00:00:03.615826,True,squared_error,43,,1,3,647,TPESampler,COMPLETE
2756,0.3471640437966658,2025-04-24 21:52:31.290599,2025-04-24 21:52:34.528655,0 days 00:00:03.238056,True,squared_error,50,,1,4,482,TPESampler,COMPLETE
2757,0.3425115467698257,2025-04-24 21:52:31.517961,2025-04-24 21:52:34.988843,0 days 00:00:03.470882,True,squared_error,50,,1,2,591,TPESampler,COMPLETE
2758,0.3771467859578682,2025-04-24 21:52:33.046033,2025-04-24 21:52:36.306310,0 days 00:00:03.260277,True,squared_error,43,,1,8,624,TPESampler,COMPLETE
2759,0.4285037853481951,2025-04-24 21:52:34.744546,2025-04-24 21:52:37.175432,0 days 00:00:02.430886,True,squared_error,42,,2,2,478,TPESampler,COMPLETE
2760,0.9346116467924558,2025-04-24 21:52:35.195985,2025-04-24 21:52:36.553943,0 days 00:00:01.357958,True,squared_error,18,log2,8,2,645,TPESampler,COMPLETE
2761,0.4305347910368337,2025-04-24 21:52:36.511043,2025-04-24 21:52:39.332396,0 days 00:00:02.821353,True,squared_error,50,,2,5,546,TPESampler,COMPLETE
2762,0.9595705056688152,2025-04-24 21:52:36.778847,2025-04-24 21:52:38.527197,0 days 00:00:01.748350,True,absolute_error,13,sqrt,10,13,790,TPESampler,COMPLETE
2763,0.34347759545641415,2025-04-24 21:52:37.496902,2025-04-24 21:52:41.357337,0 days 00:00:03.860435,True,squared_error,50,,1,2,617,TPESampler,COMPLETE
2764,0.3529920805486554,2025-04-24 21:52:38.733261,2025-04-24 21:52:41.593335,0 days 00:00:02.860074,True,squared_error,44,,1,5,587,TPESampler,COMPLETE
2765,0.3473095406697629,2025-04-24 21:52:39.575195,2025-04-24 21:52:43.240370,0 days 00:00:03.665175,True,squared_error,50,,1,4,637,TPESampler,COMPLETE
2766,0.3411100900454232,2025-04-24 21:52:41.592632,2025-04-24 21:52:46.185591,0 days 00:00:04.592959,True,squared_error,50,,1,3,584,TPESampler,COMPLETE
2767,0.3475994622919723,2025-04-24 21:52:41.827999,2025-04-24 21:52:46.458939,0 days 00:00:04.630940,True,squared_error,43,,1,4,719,TPESampler,COMPLETE
2768,0.3425212127642527,2025-04-24 21:52:42.976472,2025-04-24 21:52:47.291644,0 days 00:00:04.315172,True,squared_error,42,,1,3,552,TPESampler,COMPLETE
2769,0.35219233170461695,2025-04-24 21:52:43.477537,2025-04-24 21:52:47.641697,0 days 00:00:04.164160,True,squared_error,50,,1,5,541,TPESampler,COMPLETE
2770,0.7625560027721597,2025-04-24 21:52:43.650651,2025-04-24 21:52:46.213580,0 days 00:00:02.562929,True,squared_error,21,sqrt,3,2,765,TPESampler,COMPLETE
2771,0.5960592052843663,2025-04-24 21:52:46.400776,2025-04-24 21:52:50.295544,0 days 00:00:03.894768,True,squared_error,19,,8,46,893,TPESampler,COMPLETE
2772,0.3408330128186471,2025-04-24 21:52:46.429194,2025-04-24 21:52:51.719682,0 days 00:00:05.290488,True,squared_error,50,,1,3,604,TPESampler,COMPLETE
2773,0.34213363369763783,2025-04-24 21:52:47.088995,2025-04-24 21:52:51.717944,0 days 00:00:04.628949,True,squared_error,42,,1,3,610,TPESampler,COMPLETE
2774,0.4283108859596399,2025-04-24 21:52:48.355542,2025-04-24 21:52:52.303947,0 days 00:00:03.948405,True,squared_error,33,,2,2,627,TPESampler,COMPLETE
2775,0.8962666081107248,2025-04-24 21:52:48.926817,2025-04-24 21:52:51.065996,0 days 00:00:02.139179,False,absolute_error,9,log2,2,2,476,TPESampler,COMPLETE
2776,0.5044793676849187,2025-04-24 21:52:50.509197,2025-04-24 21:52:52.796651,0 days 00:00:02.287454,True,squared_error,50,log2,1,30,807,TPESampler,COMPLETE
2777,0.3467269742719753,2025-04-24 21:52:51.830292,2025-04-24 21:52:57.338729,0 days 00:00:05.508437,True,squared_error,44,,1,4,886,TPESampler,COMPLETE
2778,0.3470289613328742,2025-04-24 21:52:52.093012,2025-04-24 21:52:56.472121,0 days 00:00:04.379109,True,squared_error,43,,1,4,639,TPESampler,COMPLETE
2779,0.3465586750585338,2025-04-24 21:52:52.472250,2025-04-24 21:52:57.386994,0 days 00:00:04.914744,True,squared_error,49,,1,4,822,TPESampler,COMPLETE
2780,0.34230241066443345,2025-04-24 21:52:52.702931,2025-04-24 21:52:57.282307,0 days 00:00:04.579376,True,squared_error,50,,1,3,667,TPESampler,COMPLETE
2781,0.3443596266969182,2025-04-24 21:52:53.196302,2025-04-24 21:52:58.155531,0 days 00:00:04.959229,True,squared_error,44,,1,3,750,TPESampler,COMPLETE
2782,0.36176815827276304,2025-04-24 21:52:56.683984,2025-04-24 21:53:00.700378,0 days 00:00:04.016394,True,squared_error,50,,1,6,662,TPESampler,COMPLETE
2783,0.4309989195296667,2025-04-24 21:52:57.536778,2025-04-24 21:53:01.089278,0 days 00:00:03.552500,True,squared_error,43,,2,5,750,TPESampler,COMPLETE
2784,0.3440222064804012,2025-04-24 21:52:57.597025,2025-04-24 21:53:01.760361,0 days 00:00:04.163336,True,squared_error,45,,1,2,633,TPESampler,COMPLETE
2785,0.4308355797493156,2025-04-24 21:52:57.638185,2025-04-24 21:53:00.982898,0 days 00:00:03.344713,True,squared_error,50,,2,5,651,TPESampler,COMPLETE
2786,0.34727059531402227,2025-04-24 21:52:58.395956,2025-04-24 21:53:02.982320,0 days 00:00:04.586364,True,squared_error,50,,1,4,635,TPESampler,COMPLETE
2787,0.5901606432975117,2025-04-24 21:53:00.917232,2025-04-24 21:53:06.996271,0 days 00:00:06.079039,False,absolute_error,50,,6,3,332,TPESampler,COMPLETE
2788,0.34367158100187006,2025-04-24 21:53:01.391219,2025-04-24 21:53:05.493293,0 days 00:00:04.102074,True,squared_error,43,,1,3,732,TPESampler,COMPLETE
2789,0.3432785380462545,2025-04-24 21:53:01.445522,2025-04-24 21:53:06.038184,0 days 00:00:04.592662,True,squared_error,50,,1,3,750,TPESampler,COMPLETE
2790,0.4725835772859162,2025-04-24 21:53:02.063878,2025-04-24 21:53:06.043786,0 days 00:00:03.979908,True,absolute_error,45,log2,1,2,535,TPESampler,COMPLETE
2791,0.42820076937491436,2025-04-24 21:53:03.226225,2025-04-24 21:53:05.967302,0 days 00:00:02.741077,True,squared_error,44,,2,3,640,TPESampler,COMPLETE
2792,0.4275590154308394,2025-04-24 21:53:05.717089,2025-04-24 21:53:08.692521,0 days 00:00:02.975432,True,squared_error,50,,2,4,597,TPESampler,COMPLETE
2793,0.6587984818474016,2025-04-24 21:53:06.156136,2025-04-24 21:53:08.878783,0 days 00:00:02.722647,False,squared_error,9,sqrt,1,2,735,TPESampler,COMPLETE
2794,0.3697310440618472,2025-04-24 21:53:06.356442,2025-04-24 21:53:47.209466,0 days 00:00:40.853024,True,absolute_error,47,,1,7,757,TPESampler,COMPLETE
2795,0.34197537729846383,2025-04-24 21:53:06.453162,2025-04-24 21:53:11.887091,0 days 00:00:05.433929,True,squared_error,50,,1,3,630,TPESampler,COMPLETE
2796,0.5866850947914224,2025-04-24 21:53:07.393139,2025-04-24 21:53:08.982142,0 days 00:00:01.589003,True,squared_error,15,,7,2,180,TPESampler,COMPLETE
2797,0.3431335405438611,2025-04-24 21:53:08.900465,2025-04-24 21:53:12.024015,0 days 00:00:03.123550,True,squared_error,50,,1,2,537,TPESampler,COMPLETE
2798,0.9351695248530999,2025-04-24 21:53:09.090114,2025-04-24 21:53:11.859725,0 days 00:00:02.769611,True,squared_error,19,log2,10,6,952,TPESampler,COMPLETE
2799,0.3760265025791992,2025-04-24 21:53:09.248061,2025-04-24 21:53:13.077873,0 days 00:00:03.829812,True,squared_error,47,sqrt,1,2,680,TPESampler,COMPLETE
2800,0.34229129734990205,2025-04-24 21:53:12.038318,2025-04-24 21:53:17.189836,0 days 00:00:05.151518,True,squared_error,50,,1,3,681,TPESampler,COMPLETE
2801,0.4307458772837778,2025-04-24 21:53:12.133549,2025-04-24 21:53:16.559343,0 days 00:00:04.425794,True,squared_error,50,,2,5,748,TPESampler,COMPLETE
2802,0.3444492119454787,2025-04-24 21:53:12.578249,2025-04-24 21:53:17.001548,0 days 00:00:04.423299,True,squared_error,45,,1,2,702,TPESampler,COMPLETE
2803,0.39726645989559234,2025-04-24 21:53:13.377947,2025-04-24 21:53:17.178660,0 days 00:00:03.800713,True,squared_error,50,,1,11,681,TPESampler,COMPLETE
2804,0.9033336299913427,2025-04-24 21:53:16.784927,2025-04-24 21:53:18.260627,0 days 00:00:01.475700,False,squared_error,50,log2,4,9,439,TPESampler,COMPLETE
2805,0.34395348119255265,2025-04-24 21:53:17.263120,2025-04-24 21:53:22.238973,0 days 00:00:04.975853,True,squared_error,50,,1,2,838,TPESampler,COMPLETE
2806,0.3452534584040893,2025-04-24 21:53:17.418190,2025-04-24 21:53:21.317934,0 days 00:00:03.899744,True,squared_error,33,,1,3,534,TPESampler,COMPLETE
2807,0.42718330121415893,2025-04-24 21:53:17.470631,2025-04-24 21:53:20.956147,0 days 00:00:03.485516,True,squared_error,44,,2,3,525,TPESampler,COMPLETE
2808,0.3474949629281803,2025-04-24 21:53:18.542926,2025-04-24 21:53:23.107687,0 days 00:00:04.564761,True,squared_error,50,,1,4,677,TPESampler,COMPLETE
2809,0.428104220376889,2025-04-24 21:53:19.629652,2025-04-24 21:53:22.369965,0 days 00:00:02.740313,True,squared_error,50,,2,2,621,TPESampler,COMPLETE
2810,0.4328458791055245,2025-04-24 21:53:21.185801,2025-04-24 21:54:02.377740,0 days 00:00:41.191939,False,absolute_error,27,,2,2,876,TPESampler,COMPLETE
2811,0.3433907730104441,2025-04-24 21:53:21.636219,2025-04-24 21:53:25.565025,0 days 00:00:03.928806,True,squared_error,50,,1,2,572,TPESampler,COMPLETE
2812,0.34202297898512984,2025-04-24 21:53:22.504200,2025-04-24 21:53:26.449133,0 days 00:00:03.944933,True,squared_error,50,,1,3,648,TPESampler,COMPLETE
2813,0.3420610331005728,2025-04-24 21:53:22.658888,2025-04-24 21:53:26.462766,0 days 00:00:03.803878,True,squared_error,50,,1,3,650,TPESampler,COMPLETE
2814,0.546802105882287,2025-04-24 21:53:23.364456,2025-04-24 21:53:27.166954,0 days 00:00:03.802498,True,absolute_error,40,log2,1,19,585,TPESampler,COMPLETE
2815,0.34637394551290995,2025-04-24 21:53:25.779891,2025-04-24 21:54:04.577575,0 days 00:00:38.797684,True,absolute_error,50,,1,3,722,TPESampler,COMPLETE
2816,0.8794802633433415,2025-04-24 21:53:26.631414,2025-04-24 21:53:28.568986,0 days 00:00:01.937572,True,squared_error,47,sqrt,6,2,528,TPESampler,COMPLETE
2817,0.4253893499278526,2025-04-24 21:53:26.680242,2025-04-24 21:53:31.083007,0 days 00:00:04.402765,True,squared_error,50,,2,2,800,TPESampler,COMPLETE
2818,0.346791903943541,2025-04-24 21:53:27.426000,2025-04-24 21:53:30.344933,0 days 00:00:02.918933,True,squared_error,41,,1,4,561,TPESampler,COMPLETE
2819,0.6363442243012556,2025-04-24 21:53:28.810909,2025-04-24 21:53:30.813343,0 days 00:00:02.002434,True,squared_error,12,sqrt,1,29,908,TPESampler,COMPLETE
2820,0.3499997379369446,2025-04-24 21:53:30.541546,2025-04-24 21:53:33.982001,0 days 00:00:03.440455,True,squared_error,34,,1,4,739,TPESampler,COMPLETE
2821,0.49723258874952864,2025-04-24 21:53:31.034092,2025-04-24 21:53:33.219406,0 days 00:00:02.185314,False,squared_error,32,,1,36,307,TPESampler,COMPLETE
2822,0.42862783913069413,2025-04-24 21:53:31.403145,2025-04-24 21:53:34.552075,0 days 00:00:03.148930,True,squared_error,50,,2,4,570,TPESampler,COMPLETE
2823,0.5887383479675112,2025-04-24 21:53:33.437242,2025-04-24 21:53:36.225607,0 days 00:00:02.788365,True,squared_error,21,,8,16,782,TPESampler,COMPLETE
2824,0.961734223549173,2025-04-24 21:53:34.240175,2025-04-24 21:53:35.475979,0 days 00:00:01.235804,False,absolute_error,26,sqrt,14,12,499,TPESampler,COMPLETE
2825,0.3441511775088422,2025-04-24 21:53:34.798156,2025-04-24 21:53:39.202241,0 days 00:00:04.404085,True,squared_error,43,,1,2,631,TPESampler,COMPLETE
