number,value,datetime_start,datetime_complete,duration,params_bootstrap,params_criterion,params_max_depth,params_max_features,params_min_samples_leaf,params_min_samples_split,params_n_estimators,system_attrs_auto:sampler,state
708,0.3413830765870993,2025-04-24 21:26:32.979834,2025-04-24 21:26:35.496484,0 days 00:00:02.516650,True,squared_error,50,,1,3,415,TPESampler,COMPLETE
709,0.589839114761817,2025-04-24 21:26:34.121966,2025-04-24 21:26:35.743577,0 days 00:00:01.621611,True,squared_error,26,,14,25,551,TPESampler,COMPLETE
710,0.3700101355242206,2025-04-24 21:26:34.305127,2025-04-24 21:26:36.320685,0 days 00:00:02.015558,True,squared_error,50,sqrt,1,2,579,TPESampler,COMPLETE
711,0.3473967891264332,2025-04-24 21:26:35.681199,2025-04-24 21:26:39.566550,0 days 00:00:03.885351,True,squared_error,50,,1,4,679,TPESampler,COMPLETE
712,0.4276071460914346,2025-04-24 21:26:35.935040,2025-04-24 21:26:38.937639,0 days 00:00:03.002599,True,squared_error,50,,2,3,695,TPESampler,COMPLETE
713,0.873043611888467,2025-04-24 21:26:36.674332,2025-04-24 21:26:39.297250,0 days 00:00:02.622918,False,absolute_error,32,log2,2,9,799,TPESampler,COMPLETE
714,0.3419847272211505,2025-04-24 21:26:36.756271,2025-04-24 21:26:39.963629,0 days 00:00:03.207358,True,squared_error,50,,1,3,507,TPESampler,COMPLETE
715,0.44542975454581446,2025-04-24 21:26:38.661118,2025-04-24 21:26:39.631304,0 days 00:00:00.970186,False,squared_error,9,,1,2,102,TPESampler,COMPLETE
716,0.44852324146006395,2025-04-24 21:26:39.123030,2025-04-24 21:26:43.477946,0 days 00:00:04.354916,False,squared_error,48,,2,2,767,TPESampler,COMPLETE
717,0.6025516684849211,2025-04-24 21:26:39.492654,2025-04-24 21:26:44.666093,0 days 00:00:05.173439,False,absolute_error,14,sqrt,1,11,559,TPESampler,COMPLETE
718,0.43229667633995605,2025-04-24 21:26:39.855027,2025-04-24 21:27:08.837942,0 days 00:00:28.982915,False,absolute_error,28,,2,2,525,TPESampler,COMPLETE
719,0.34128485007039794,2025-04-24 21:26:40.098355,2025-04-24 21:26:43.066276,0 days 00:00:02.967921,True,squared_error,50,,1,3,426,TPESampler,COMPLETE
720,0.34391096547995237,2025-04-24 21:26:40.292287,2025-04-24 21:26:42.597542,0 days 00:00:02.305255,True,squared_error,41,,1,3,331,TPESampler,COMPLETE
721,0.3442365925340804,2025-04-24 21:26:42.261451,2025-04-24 21:26:45.586152,0 days 00:00:03.324701,True,squared_error,50,,1,2,509,TPESampler,COMPLETE
722,0.5979032943279523,2025-04-24 21:26:42.883220,2025-04-24 21:26:43.779728,0 days 00:00:00.896508,True,squared_error,7,,11,4,146,TPESampler,COMPLETE
723,0.51605772721219,2025-04-24 21:26:43.255670,2025-04-24 21:27:15.826943,0 days 00:00:32.571273,False,absolute_error,23,,1,32,425,TPESampler,COMPLETE
724,0.3694097329241759,2025-04-24 21:26:43.714866,2025-04-24 21:26:46.120868,0 days 00:00:02.406002,True,squared_error,43,,1,7,425,TPESampler,COMPLETE
725,0.4282583513102147,2025-04-24 21:26:44.043483,2025-04-24 21:26:46.722095,0 days 00:00:02.678612,True,squared_error,50,,2,4,561,TPESampler,COMPLETE
726,0.819173203201676,2025-04-24 21:26:45.005405,2025-04-24 21:26:47.199511,0 days 00:00:02.194106,False,absolute_error,10,log2,1,6,444,TPESampler,COMPLETE
727,0.34200579665032954,2025-04-24 21:26:45.770797,2025-04-24 21:26:49.251612,0 days 00:00:03.480815,True,squared_error,50,,1,3,647,TPESampler,COMPLETE
728,0.35385707648835085,2025-04-24 21:26:46.313832,2025-04-24 21:26:48.873694,0 days 00:00:02.559862,True,squared_error,49,,1,5,471,TPESampler,COMPLETE
729,0.9295781692615869,2025-04-24 21:26:46.957050,2025-04-24 21:26:48.442519,0 days 00:00:01.485469,True,squared_error,49,log2,6,2,620,TPESampler,COMPLETE
730,0.428956090694884,2025-04-24 21:26:47.425231,2025-04-24 21:26:49.469472,0 days 00:00:02.044241,True,squared_error,44,,2,2,313,TPESampler,COMPLETE
731,0.3417605430458794,2025-04-24 21:26:48.622162,2025-04-24 21:26:51.075342,0 days 00:00:02.453180,True,squared_error,50,,1,3,387,TPESampler,COMPLETE
732,0.34323878631795157,2025-04-24 21:26:49.090249,2025-04-24 21:26:51.780503,0 days 00:00:02.690254,True,squared_error,43,,1,2,439,TPESampler,COMPLETE
733,0.4484864398342237,2025-04-24 21:26:49.433651,2025-04-24 21:26:52.053517,0 days 00:00:02.619866,False,squared_error,44,,2,2,445,TPESampler,COMPLETE
734,0.3482276339000157,2025-04-24 21:26:49.743127,2025-04-24 21:27:31.247070,0 days 00:00:41.503943,True,absolute_error,39,,1,2,774,TPESampler,COMPLETE
735,0.6159553061322576,2025-04-24 21:26:51.251621,2025-04-24 21:26:52.538607,0 days 00:00:01.286986,True,squared_error,14,sqrt,1,43,517,TPESampler,COMPLETE
736,0.3460715540442035,2025-04-24 21:26:52.006103,2025-04-24 21:26:55.499103,0 days 00:00:03.493000,True,squared_error,50,,1,4,531,TPESampler,COMPLETE
737,0.6457651990495227,2025-04-24 21:26:52.315841,2025-04-24 21:26:54.161636,0 days 00:00:01.845795,True,squared_error,50,sqrt,2,2,818,TPESampler,COMPLETE
738,0.343028903828812,2025-04-24 21:26:52.856633,2025-04-24 21:26:54.842654,0 days 00:00:01.986021,True,squared_error,40,,1,3,349,TPESampler,COMPLETE
739,0.8790375022741486,2025-04-24 21:26:54.343942,2025-04-24 21:26:55.787857,0 days 00:00:01.443915,True,squared_error,48,log2,2,2,694,TPESampler,COMPLETE
740,0.5130946729332534,2025-04-24 21:26:55.052542,2025-04-24 21:26:56.297777,0 days 00:00:01.245235,True,squared_error,38,log2,1,6,490,TPESampler,COMPLETE
741,0.34158247242873624,2025-04-24 21:26:55.744874,2025-04-24 21:26:58.909230,0 days 00:00:03.164356,True,squared_error,50,,1,3,560,TPESampler,COMPLETE
742,0.35608086150889046,2025-04-24 21:26:56.038298,2025-04-24 21:26:57.254502,0 days 00:00:01.216204,True,squared_error,42,,1,2,106,TPESampler,COMPLETE
743,0.35233982801030256,2025-04-24 21:26:56.564471,2025-04-24 21:26:59.193675,0 days 00:00:02.629204,True,squared_error,50,,1,5,553,TPESampler,COMPLETE
744,0.42851929624924806,2025-04-24 21:26:57.443314,2025-04-24 21:26:59.633290,0 days 00:00:02.189976,True,squared_error,50,,2,2,485,TPESampler,COMPLETE
745,0.6486733650575519,2025-04-24 21:26:59.086772,2025-04-24 21:27:00.877178,0 days 00:00:01.790406,True,squared_error,33,sqrt,2,3,657,TPESampler,COMPLETE
746,0.44296307185648204,2025-04-24 21:26:59.370746,2025-04-24 21:27:16.477416,0 days 00:00:17.106670,True,absolute_error,50,,2,3,526,TPESampler,COMPLETE
747,0.35272224621473225,2025-04-24 21:27:00.016055,2025-04-24 21:27:03.027331,0 days 00:00:03.011276,True,squared_error,41,,1,5,586,TPESampler,COMPLETE
748,0.34400221704077344,2025-04-24 21:27:01.056527,2025-04-24 21:27:03.393081,0 days 00:00:02.336554,True,squared_error,50,,1,2,379,TPESampler,COMPLETE
749,0.41139007095062596,2025-04-24 21:27:03.205342,2025-04-24 21:27:07.987016,0 days 00:00:04.781674,False,squared_error,49,,1,4,760,TPESampler,COMPLETE
750,0.34331626553839134,2025-04-24 21:27:03.589986,2025-04-24 21:27:07.030175,0 days 00:00:03.440189,True,squared_error,42,,1,3,666,TPESampler,COMPLETE
751,0.3419126649380855,2025-04-24 21:27:07.201611,2025-04-24 21:27:10.647447,0 days 00:00:03.445836,True,squared_error,50,,1,3,564,TPESampler,COMPLETE
752,0.4656814104823568,2025-04-24 21:27:08.159111,2025-04-24 21:27:09.836880,0 days 00:00:01.677769,True,squared_error,50,log2,1,8,766,TPESampler,COMPLETE
753,0.3476136329100363,2025-04-24 21:27:09.022582,2025-04-24 21:27:10.895188,0 days 00:00:01.872606,True,squared_error,45,,1,4,298,TPESampler,COMPLETE
754,0.35293122086913625,2025-04-24 21:27:10.035532,2025-04-24 21:27:13.247425,0 days 00:00:03.211893,True,squared_error,50,,1,5,618,TPESampler,COMPLETE
755,0.3411873752471255,2025-04-24 21:27:10.883729,2025-04-24 21:27:14.253681,0 days 00:00:03.369952,True,squared_error,50,,1,3,582,TPESampler,COMPLETE
756,0.44946650609234673,2025-04-24 21:27:11.243337,2025-04-24 21:27:13.072594,0 days 00:00:01.829257,True,squared_error,49,,2,9,423,TPESampler,COMPLETE
757,0.42973710999570147,2025-04-24 21:27:13.239381,2025-04-24 21:27:15.014945,0 days 00:00:01.775564,True,squared_error,39,,2,4,378,TPESampler,COMPLETE
758,0.4295601529898835,2025-04-24 21:27:13.436155,2025-04-24 21:27:15.781279,0 days 00:00:02.345124,True,squared_error,39,,2,2,466,TPESampler,COMPLETE
759,0.34091216264960283,2025-04-24 21:27:14.431213,2025-04-24 21:27:17.934332,0 days 00:00:03.503119,True,squared_error,50,,1,3,530,TPESampler,COMPLETE
760,0.42955553382105544,2025-04-24 21:27:15.196763,2025-04-24 21:27:17.066186,0 days 00:00:01.869423,True,squared_error,50,,2,3,413,TPESampler,COMPLETE
761,0.42428124847444787,2025-04-24 21:27:15.923195,2025-04-24 21:27:21.202832,0 days 00:00:05.279637,False,squared_error,28,,1,9,947,TPESampler,COMPLETE
762,0.9612926978386163,2025-04-24 21:27:15.981885,2025-04-24 21:27:17.821686,0 days 00:00:01.839801,True,absolute_error,22,sqrt,11,3,563,TPESampler,COMPLETE
763,0.9725046612762258,2025-04-24 21:27:16.746426,2025-04-24 21:27:17.770130,0 days 00:00:01.023704,True,absolute_error,38,log2,4,4,148,TPESampler,COMPLETE
764,0.38505501199438075,2025-04-24 21:27:17.350058,2025-04-24 21:28:32.897492,0 days 00:01:15.547434,False,absolute_error,39,,1,2,853,TPESampler,COMPLETE
765,0.34197537729846383,2025-04-24 21:27:18.088519,2025-04-24 21:27:22.341821,0 days 00:00:04.253302,True,squared_error,50,,1,3,630,TPESampler,COMPLETE
766,0.42746123656665996,2025-04-24 21:27:18.159311,2025-04-24 21:27:21.785271,0 days 00:00:03.625960,True,squared_error,50,,2,4,741,TPESampler,COMPLETE
767,0.34304298101453295,2025-04-24 21:27:18.210551,2025-04-24 21:27:21.738780,0 days 00:00:03.528229,True,squared_error,50,,1,3,722,TPESampler,COMPLETE
768,0.45292926228211633,2025-04-24 21:27:21.384743,2025-04-24 21:27:23.625962,0 days 00:00:02.241219,True,squared_error,45,log2,1,3,606,TPESampler,COMPLETE
769,0.34401677792397567,2025-04-24 21:27:22.047845,2025-04-24 21:27:25.102073,0 days 00:00:03.054228,True,squared_error,50,,1,2,484,TPESampler,COMPLETE
770,0.34711725261214543,2025-04-24 21:27:22.197856,2025-04-24 21:27:25.043814,0 days 00:00:02.845958,True,squared_error,50,,1,4,371,TPESampler,COMPLETE
771,0.4967226654788967,2025-04-24 21:27:22.580754,2025-04-24 21:27:29.399452,0 days 00:00:06.818698,True,absolute_error,45,,3,31,368,TPESampler,COMPLETE
772,0.49361632456934285,2025-04-24 21:27:23.809511,2025-04-24 21:27:26.690772,0 days 00:00:02.881261,True,squared_error,29,,4,49,954,TPESampler,COMPLETE
773,0.3437237041423906,2025-04-24 21:27:25.251483,2025-04-24 21:27:28.304173,0 days 00:00:03.052690,True,squared_error,50,,1,2,466,TPESampler,COMPLETE
774,0.34728208768080393,2025-04-24 21:27:25.298000,2025-04-24 21:27:28.480092,0 days 00:00:03.182092,True,squared_error,50,,1,4,668,TPESampler,COMPLETE
775,0.35266143739169015,2025-04-24 21:27:26.887699,2025-04-24 21:27:29.474326,0 days 00:00:02.586627,True,squared_error,50,,1,5,443,TPESampler,COMPLETE
776,0.6837822664049357,2025-04-24 21:27:28.481196,2025-04-24 21:27:30.422882,0 days 00:00:01.941686,True,squared_error,18,log2,1,2,587,TPESampler,COMPLETE
777,0.9503504312704466,2025-04-24 21:27:28.682609,2025-04-24 21:27:29.557144,0 days 00:00:00.874535,False,absolute_error,19,sqrt,9,21,202,TPESampler,COMPLETE
778,0.3479008048966848,2025-04-24 21:27:29.585677,2025-04-24 21:27:32.954183,0 days 00:00:03.368506,True,squared_error,40,,1,4,487,TPESampler,COMPLETE
779,0.3423486567486652,2025-04-24 21:27:29.656099,2025-04-24 21:27:33.633049,0 days 00:00:03.976950,True,squared_error,44,,1,3,609,TPESampler,COMPLETE
780,0.3439781196299,2025-04-24 21:27:29.773639,2025-04-24 21:27:33.305366,0 days 00:00:03.531727,True,squared_error,41,,1,2,541,TPESampler,COMPLETE
781,0.3467785871930533,2025-04-24 21:27:30.958754,2025-04-24 21:27:33.711478,0 days 00:00:02.752724,True,squared_error,50,,1,4,486,TPESampler,COMPLETE
782,0.9005241768726755,2025-04-24 21:27:31.491250,2025-04-24 21:27:32.540925,0 days 00:00:01.049675,False,absolute_error,6,log2,1,2,177,TPESampler,COMPLETE
783,0.3448857930476289,2025-04-24 21:27:32.718411,2025-04-24 21:27:36.793636,0 days 00:00:04.075225,True,squared_error,42,,1,2,667,TPESampler,COMPLETE
784,0.42748882830931245,2025-04-24 21:27:33.158131,2025-04-24 21:27:36.647029,0 days 00:00:03.488898,True,squared_error,46,,2,2,716,TPESampler,COMPLETE
785,0.4890950146522752,2025-04-24 21:27:33.670796,2025-04-24 21:27:34.885266,0 days 00:00:01.214470,True,squared_error,40,log2,1,4,311,TPESampler,COMPLETE
786,0.5154100777454873,2025-04-24 21:27:33.907176,2025-04-24 21:27:37.893035,0 days 00:00:03.985859,False,absolute_error,39,log2,1,2,313,TPESampler,COMPLETE
787,0.42820525496424483,2025-04-24 21:27:34.210731,2025-04-24 21:27:37.180051,0 days 00:00:02.969320,True,squared_error,50,,2,3,642,TPESampler,COMPLETE
788,0.894329062526375,2025-04-24 21:27:35.129117,2025-04-24 21:27:36.712379,0 days 00:00:01.583262,True,squared_error,6,sqrt,7,8,889,TPESampler,COMPLETE
789,0.42919298296097724,2025-04-24 21:27:36.871168,2025-04-24 21:27:38.667998,0 days 00:00:01.796830,False,squared_error,32,sqrt,1,8,568,TPESampler,COMPLETE
790,0.942792601603779,2025-04-24 21:27:36.882690,2025-04-24 21:27:38.723225,0 days 00:00:01.840535,True,squared_error,5,log2,14,12,115,TPESampler,COMPLETE
791,0.9188639491372563,2025-04-24 21:27:36.966759,2025-04-24 21:27:39.590596,0 days 00:00:02.623837,True,squared_error,29,log2,4,3,658,TPESampler,COMPLETE
792,0.9546586068273946,2025-04-24 21:27:37.401373,2025-04-24 21:27:40.415142,0 days 00:00:03.013769,True,absolute_error,34,sqrt,8,32,449,TPESampler,COMPLETE
793,0.3413295970944075,2025-04-24 21:27:38.600082,2025-04-24 21:27:42.274896,0 days 00:00:03.674814,True,squared_error,50,,1,3,522,TPESampler,COMPLETE
794,0.3417404486887402,2025-04-24 21:27:38.959017,2025-04-24 21:27:43.162866,0 days 00:00:04.203849,True,squared_error,50,,1,3,574,TPESampler,COMPLETE
795,0.4454282453200027,2025-04-24 21:27:39.208834,2025-04-24 21:28:10.951560,0 days 00:00:31.742726,True,absolute_error,50,,1,21,638,TPESampler,COMPLETE
796,0.3451556420476176,2025-04-24 21:27:39.809624,2025-04-24 21:27:41.976681,0 days 00:00:02.167057,True,squared_error,41,,1,2,327,TPESampler,COMPLETE
797,0.772362633186937,2025-04-24 21:27:40.645591,2025-04-24 21:27:41.916482,0 days 00:00:01.270891,False,absolute_error,40,sqrt,4,8,276,TPESampler,COMPLETE
798,0.3979728338023892,2025-04-24 21:27:42.111827,2025-04-24 21:27:43.926644,0 days 00:00:01.814817,True,squared_error,47,sqrt,1,6,472,TPESampler,COMPLETE
799,0.34442120287266487,2025-04-24 21:27:42.167141,2025-04-24 21:27:45.164994,0 days 00:00:02.997853,True,squared_error,42,,1,2,478,TPESampler,COMPLETE
800,0.605683046152228,2025-04-24 21:27:42.543981,2025-04-24 21:27:44.875409,0 days 00:00:02.331428,True,absolute_error,44,,11,42,268,TPESampler,COMPLETE
801,0.8703106346386548,2025-04-24 21:27:43.430879,2025-04-24 21:27:44.725153,0 days 00:00:01.294274,True,squared_error,15,sqrt,5,12,333,TPESampler,COMPLETE
802,0.35282291348718986,2025-04-24 21:27:44.310793,2025-04-24 21:27:47.627379,0 days 00:00:03.316586,True,squared_error,50,,1,5,577,TPESampler,COMPLETE
803,0.3914768112632874,2025-04-24 21:27:44.924554,2025-04-24 21:27:50.341254,0 days 00:00:05.416700,True,absolute_error,45,sqrt,1,3,555,TPESampler,COMPLETE
804,0.4298343043634175,2025-04-24 21:27:45.253006,2025-04-24 21:27:48.859040,0 days 00:00:03.606034,False,squared_error,50,,1,3,432,TPESampler,COMPLETE
805,0.3845274319032589,2025-04-24 21:27:45.482430,2025-04-24 21:27:47.779203,0 days 00:00:02.296773,True,squared_error,43,sqrt,1,2,415,TPESampler,COMPLETE
806,0.3471847242576857,2025-04-24 21:27:47.850166,2025-04-24 21:27:50.073212,0 days 00:00:02.223046,True,squared_error,50,,1,4,332,TPESampler,COMPLETE
807,0.3437841293358833,2025-04-24 21:27:48.202889,2025-04-24 21:27:52.210106,0 days 00:00:04.007217,True,squared_error,50,,1,2,659,TPESampler,COMPLETE
808,0.43515547341358674,2025-04-24 21:27:49.073715,2025-04-24 21:27:50.350594,0 days 00:00:01.276879,True,squared_error,50,,2,5,163,TPESampler,COMPLETE
809,0.3462773849357044,2025-04-24 21:27:50.291643,2025-04-24 21:27:53.375528,0 days 00:00:03.083885,True,squared_error,44,,1,4,460,TPESampler,COMPLETE
810,0.42817898263426746,2025-04-24 21:27:50.543276,2025-04-24 21:27:53.998089,0 days 00:00:03.454813,True,squared_error,50,,2,3,622,TPESampler,COMPLETE
811,0.42713971436664594,2025-04-24 21:27:50.607824,2025-04-24 21:27:53.636901,0 days 00:00:03.029077,True,squared_error,50,,2,4,541,TPESampler,COMPLETE
812,0.37784217960575034,2025-04-24 21:27:52.593016,2025-04-24 21:27:55.928316,0 days 00:00:03.335300,True,squared_error,50,,1,8,730,TPESampler,COMPLETE
813,0.5748510559587051,2025-04-24 21:27:53.563653,2025-04-24 21:28:12.374667,0 days 00:00:18.811014,False,absolute_error,8,,3,9,661,TPESampler,COMPLETE
814,0.4485659229385385,2025-04-24 21:27:53.898394,2025-04-24 21:28:01.589805,0 days 00:00:07.691411,True,absolute_error,49,,2,5,237,TPESampler,COMPLETE
815,0.36031996220348694,2025-04-24 21:27:54.475728,2025-04-24 21:27:57.238340,0 days 00:00:02.762612,True,squared_error,50,,1,6,547,TPESampler,COMPLETE
816,0.34346086840368084,2025-04-24 21:27:56.161582,2025-04-24 21:27:59.379769,0 days 00:00:03.218187,True,squared_error,50,,1,2,571,TPESampler,COMPLETE
817,0.3423835101510034,2025-04-24 21:27:57.416698,2025-04-24 21:27:59.496574,0 days 00:00:02.079876,True,squared_error,50,,1,3,369,TPESampler,COMPLETE
818,0.3429183639266682,2025-04-24 21:27:59.569876,2025-04-24 21:28:02.530513,0 days 00:00:02.960637,True,squared_error,50,,1,2,546,TPESampler,COMPLETE
819,0.8891562764509583,2025-04-24 21:27:59.679130,2025-04-24 21:28:00.449100,0 days 00:00:00.769970,True,squared_error,27,sqrt,5,35,109,TPESampler,COMPLETE
820,0.34089227931747224,2025-04-24 21:28:00.638947,2025-04-24 21:28:04.258390,0 days 00:00:03.619443,True,squared_error,50,,1,3,607,TPESampler,COMPLETE
821,0.4297177922456667,2025-04-24 21:28:01.778939,2025-04-24 21:28:03.435335,0 days 00:00:01.656396,True,squared_error,40,,2,3,339,TPESampler,COMPLETE
822,0.34252092921270155,2025-04-24 21:28:02.707543,2025-04-24 21:28:05.072641,0 days 00:00:02.365098,True,squared_error,40,,1,3,472,TPESampler,COMPLETE
823,0.43091194299609115,2025-04-24 21:28:03.618465,2025-04-24 21:28:22.828746,0 days 00:00:19.210281,False,absolute_error,48,,1,15,194,TPESampler,COMPLETE
824,0.7208096868724712,2025-04-24 21:28:04.435084,2025-04-24 21:28:05.463627,0 days 00:00:01.028543,False,squared_error,7,sqrt,2,7,593,TPESampler,COMPLETE
825,0.3476542446381655,2025-04-24 21:28:05.244745,2025-04-24 21:28:07.745824,0 days 00:00:02.501079,True,squared_error,41,,1,4,508,TPESampler,COMPLETE
826,0.44850140574672054,2025-04-24 21:28:05.673060,2025-04-24 21:28:08.465369,0 days 00:00:02.792309,False,squared_error,50,,2,3,531,TPESampler,COMPLETE
827,0.3418375780937524,2025-04-24 21:28:07.918903,2025-04-24 21:28:10.380433,0 days 00:00:02.461530,True,squared_error,50,,1,3,479,TPESampler,COMPLETE
828,0.34776644314154637,2025-04-24 21:28:08.637653,2025-04-24 21:28:11.694570,0 days 00:00:03.056917,True,squared_error,40,,1,4,659,TPESampler,COMPLETE
829,0.4308853322772997,2025-04-24 21:28:10.557494,2025-04-24 21:28:15.063039,0 days 00:00:04.505545,False,squared_error,50,,1,2,633,TPESampler,COMPLETE
830,0.3418080688400328,2025-04-24 21:28:11.294088,2025-04-24 21:28:14.447468,0 days 00:00:03.153380,True,squared_error,50,,1,3,624,TPESampler,COMPLETE
831,0.3447490694563961,2025-04-24 21:28:11.955187,2025-04-24 21:28:14.069515,0 days 00:00:02.114328,True,squared_error,50,,1,2,296,TPESampler,COMPLETE
832,0.34312609766933927,2025-04-24 21:28:12.651786,2025-04-24 21:28:15.333058,0 days 00:00:02.681272,True,squared_error,50,,1,2,436,TPESampler,COMPLETE
833,0.9637197194939606,2025-04-24 21:28:14.285451,2025-04-24 21:28:15.186583,0 days 00:00:00.901132,True,absolute_error,16,log2,3,30,178,TPESampler,COMPLETE
834,0.34960858532901445,2025-04-24 21:28:14.637230,2025-04-24 21:28:46.330382,0 days 00:00:31.693152,True,absolute_error,49,,1,4,599,TPESampler,COMPLETE
835,0.4296660716752709,2025-04-24 21:28:15.443804,2025-04-24 21:28:17.411273,0 days 00:00:01.967469,True,squared_error,48,,2,2,381,TPESampler,COMPLETE
836,0.4280230535434605,2025-04-24 21:28:15.498763,2025-04-24 21:28:17.925321,0 days 00:00:02.426558,True,squared_error,49,,2,2,504,TPESampler,COMPLETE
837,0.3619481374117566,2025-04-24 21:28:15.677180,2025-04-24 21:28:17.835966,0 days 00:00:02.158786,True,squared_error,43,,1,6,316,TPESampler,COMPLETE
838,0.35393182463344636,2025-04-24 21:28:17.620747,2025-04-24 21:28:20.482354,0 days 00:00:02.861607,True,squared_error,42,,1,5,623,TPESampler,COMPLETE
839,0.3460715540442035,2025-04-24 21:28:18.002252,2025-04-24 21:28:21.065610,0 days 00:00:03.063358,True,squared_error,50,,1,4,531,TPESampler,COMPLETE
840,0.3417059678663206,2025-04-24 21:28:18.123727,2025-04-24 21:28:21.136501,0 days 00:00:03.012774,True,squared_error,50,,1,3,513,TPESampler,COMPLETE
841,0.9354822705271157,2025-04-24 21:28:20.649079,2025-04-24 21:28:22.083609,0 days 00:00:01.434530,True,squared_error,11,log2,10,4,804,TPESampler,COMPLETE
842,0.34402037856790746,2025-04-24 21:28:21.256340,2025-04-24 21:28:23.838121,0 days 00:00:02.581781,True,squared_error,41,,1,3,340,TPESampler,COMPLETE
843,0.34277591022019493,2025-04-24 21:28:21.314518,2025-04-24 21:28:23.943089,0 days 00:00:02.628571,True,squared_error,43,,1,3,370,TPESampler,COMPLETE
844,0.3467495308324889,2025-04-24 21:28:22.278065,2025-04-24 21:28:25.925017,0 days 00:00:03.646952,True,squared_error,50,,1,4,808,TPESampler,COMPLETE
845,0.4296422033129247,2025-04-24 21:28:23.021886,2025-04-24 21:28:25.686744,0 days 00:00:02.664858,True,squared_error,50,,2,4,428,TPESampler,COMPLETE
846,0.37643996170600813,2025-04-24 21:28:24.001500,2025-04-24 21:28:26.120003,0 days 00:00:02.118503,True,squared_error,48,sqrt,1,4,592,TPESampler,COMPLETE
847,0.34166563129285715,2025-04-24 21:28:24.136488,2025-04-24 21:28:27.751759,0 days 00:00:03.615271,True,squared_error,50,,1,3,485,TPESampler,COMPLETE
848,0.5618501366074317,2025-04-24 21:28:25.880377,2025-04-24 21:28:32.794694,0 days 00:00:06.914317,False,absolute_error,32,log2,1,2,698,TPESampler,COMPLETE
849,0.34637702257363057,2025-04-24 21:28:26.111254,2025-04-24 21:28:28.849539,0 days 00:00:02.738285,True,squared_error,44,,1,4,524,TPESampler,COMPLETE
