number,value,datetime_start,datetime_complete,duration,params_bootstrap,params_criterion,params_max_depth,params_max_features,params_min_samples_leaf,params_min_samples_split,params_n_estimators,system_attrs_auto:sampler,state
1274,0.4059195845291288,2025-04-24 21:33:26.888451,2025-04-24 21:33:31.623826,0 days 00:00:04.735375,True,absolute_error,9,,1,2,102,TPESampler,COMPLETE
1275,0.49026695512860485,2025-04-24 21:33:27.086225,2025-04-24 21:33:29.192387,0 days 00:00:02.106162,True,squared_error,46,log2,1,8,504,TPESampler,COMPLETE
1276,0.4294872222037504,2025-04-24 21:33:27.459927,2025-04-24 21:33:29.790318,0 days 00:00:02.330391,True,squared_error,50,,2,2,334,TPESampler,COMPLETE
1277,0.4270802299220412,2025-04-24 21:33:29.365454,2025-04-24 21:33:32.820463,0 days 00:00:03.455009,True,squared_error,41,,2,2,667,TPESampler,COMPLETE
1278,0.43662219837633154,2025-04-24 21:33:29.564707,2025-04-24 21:34:01.032978,0 days 00:00:31.468271,False,absolute_error,37,,2,6,657,TPESampler,COMPLETE
1279,0.9287789681072386,2025-04-24 21:33:29.896493,2025-04-24 21:33:31.452202,0 days 00:00:01.555709,False,squared_error,49,log2,10,8,727,TPESampler,COMPLETE
1280,0.47897659743180926,2025-04-24 21:33:30.050021,2025-04-24 21:33:32.851055,0 days 00:00:02.801034,True,squared_error,40,log2,1,3,807,TPESampler,COMPLETE
1281,0.4761507214546651,2025-04-24 21:33:30.695520,2025-04-24 21:33:39.956442,0 days 00:00:09.260922,False,absolute_error,34,,1,29,102,TPESampler,COMPLETE
1282,0.9224953652242623,2025-04-24 21:33:31.665931,2025-04-24 21:33:32.491423,0 days 00:00:00.825492,True,absolute_error,17,log2,2,10,127,TPESampler,COMPLETE
1283,0.44491121717378873,2025-04-24 21:33:31.832985,2025-04-24 21:33:33.086523,0 days 00:00:01.253538,False,squared_error,14,,1,9,110,TPESampler,COMPLETE
1284,0.8356759558784603,2025-04-24 21:33:32.709948,2025-04-24 21:33:34.268686,0 days 00:00:01.558738,True,squared_error,45,sqrt,4,9,822,TPESampler,COMPLETE
1285,0.4538857627725357,2025-04-24 21:33:33.000234,2025-04-24 21:33:46.452723,0 days 00:00:13.452489,True,absolute_error,5,,1,4,472,TPESampler,COMPLETE
1286,0.4227502938986044,2025-04-24 21:33:33.047994,2025-04-24 21:33:38.499531,0 days 00:00:05.451537,False,absolute_error,40,sqrt,1,12,334,TPESampler,COMPLETE
1287,0.35275257636955004,2025-04-24 21:33:33.651041,2025-04-24 21:33:36.740128,0 days 00:00:03.089087,True,squared_error,44,,1,5,598,TPESampler,COMPLETE
1288,0.34161962414804237,2025-04-24 21:33:34.534837,2025-04-24 21:33:37.183177,0 days 00:00:02.648340,True,squared_error,50,,1,3,519,TPESampler,COMPLETE
1289,0.346727408162472,2025-04-24 21:33:36.915578,2025-04-24 21:33:39.819179,0 days 00:00:02.903601,True,squared_error,44,,1,4,476,TPESampler,COMPLETE
1290,0.4276880623594655,2025-04-24 21:33:37.404070,2025-04-24 21:33:40.685609,0 days 00:00:03.281539,True,squared_error,50,,2,5,882,TPESampler,COMPLETE
1291,0.8787185131303216,2025-04-24 21:33:38.683003,2025-04-24 21:33:39.983159,0 days 00:00:01.300156,True,squared_error,40,log2,2,2,586,TPESampler,COMPLETE
1292,0.4298061811172018,2025-04-24 21:33:40.028875,2025-04-24 21:33:42.538974,0 days 00:00:02.510099,True,squared_error,43,,2,5,528,TPESampler,COMPLETE
1293,0.35293179876795727,2025-04-24 21:33:40.193356,2025-04-24 21:33:43.452548,0 days 00:00:03.259192,True,squared_error,50,,1,5,613,TPESampler,COMPLETE
1294,0.34488276405238777,2025-04-24 21:33:40.216806,2025-04-24 21:33:44.510084,0 days 00:00:04.293278,True,squared_error,43,,1,2,700,TPESampler,COMPLETE
1295,0.34273995785915,2025-04-24 21:33:41.069852,2025-04-24 21:33:44.442608,0 days 00:00:03.372756,True,squared_error,42,,1,3,623,TPESampler,COMPLETE
1296,0.4302028554770444,2025-04-24 21:33:42.718023,2025-04-24 21:33:45.799733,0 days 00:00:03.081710,True,squared_error,45,,2,5,666,TPESampler,COMPLETE
1297,0.35236917413717767,2025-04-24 21:33:43.639548,2025-04-24 21:33:46.710606,0 days 00:00:03.071058,True,squared_error,50,,1,5,549,TPESampler,COMPLETE
1298,0.8781243099808888,2025-04-24 21:33:44.674345,2025-04-24 21:33:45.910857,0 days 00:00:01.236512,True,squared_error,50,log2,2,3,471,TPESampler,COMPLETE
1299,0.8771425577339282,2025-04-24 21:33:44.717228,2025-04-24 21:33:45.971624,0 days 00:00:01.254396,True,squared_error,49,log2,2,3,454,TPESampler,COMPLETE
1300,0.3474619579281299,2025-04-24 21:33:46.000795,2025-04-24 21:33:48.515013,0 days 00:00:02.514218,True,squared_error,43,,1,4,344,TPESampler,COMPLETE
1301,0.34328764185852506,2025-04-24 21:33:46.132506,2025-04-24 21:33:49.051527,0 days 00:00:02.919021,True,squared_error,42,,1,3,483,TPESampler,COMPLETE
1302,0.34100166370620855,2025-04-24 21:33:46.212050,2025-04-24 21:33:50.290699,0 days 00:00:04.078649,True,squared_error,50,,1,3,537,TPESampler,COMPLETE
1303,0.9758369689953023,2025-04-24 21:33:46.936022,2025-04-24 21:33:48.352598,0 days 00:00:01.416576,False,absolute_error,44,log2,9,28,559,TPESampler,COMPLETE
1304,0.3438930086018035,2025-04-24 21:33:47.055037,2025-04-24 21:33:50.325502,0 days 00:00:03.270465,True,squared_error,43,,1,2,491,TPESampler,COMPLETE
1305,0.42828749266940547,2025-04-24 21:33:48.542381,2025-04-24 21:33:51.147756,0 days 00:00:02.605375,True,squared_error,50,,2,2,492,TPESampler,COMPLETE
1306,0.3471940447325419,2025-04-24 21:33:48.722617,2025-04-24 21:33:52.539050,0 days 00:00:03.816433,True,squared_error,43,,1,4,507,TPESampler,COMPLETE
1307,0.4250378862255851,2025-04-24 21:33:49.287836,2025-04-24 21:33:52.764990,0 days 00:00:03.477154,True,squared_error,47,,2,2,847,TPESampler,COMPLETE
1308,0.9347894863319578,2025-04-24 21:33:50.496687,2025-04-24 21:33:53.072206,0 days 00:00:02.575519,True,squared_error,50,log2,9,6,973,TPESampler,COMPLETE
1309,0.3421247914974893,2025-04-24 21:33:50.507190,2025-04-24 21:33:52.636669,0 days 00:00:02.129479,True,squared_error,50,,1,3,338,TPESampler,COMPLETE
1310,0.43063810997691243,2025-04-24 21:33:51.667921,2025-04-24 21:33:56.017894,0 days 00:00:04.349973,True,squared_error,49,,2,5,706,TPESampler,COMPLETE
1311,0.3434922452422338,2025-04-24 21:33:52.880059,2025-04-24 21:33:56.440106,0 days 00:00:03.560047,True,squared_error,50,,1,2,558,TPESampler,COMPLETE
1312,0.4282490671372534,2025-04-24 21:33:52.953479,2025-04-24 21:33:55.601100,0 days 00:00:02.647621,True,squared_error,50,,2,4,502,TPESampler,COMPLETE
1313,0.9368345392051565,2025-04-24 21:33:53.151844,2025-04-24 21:33:54.845230,0 days 00:00:01.693386,True,absolute_error,47,sqrt,6,9,406,TPESampler,COMPLETE
1314,0.3429423487325915,2025-04-24 21:33:53.335779,2025-04-24 21:33:58.572086,0 days 00:00:05.236307,True,squared_error,50,,1,3,764,TPESampler,COMPLETE
1315,0.803579498768922,2025-04-24 21:33:55.046615,2025-04-24 21:33:57.509475,0 days 00:00:02.462860,False,absolute_error,7,sqrt,4,4,661,TPESampler,COMPLETE
1316,0.6329633346532472,2025-04-24 21:33:55.815955,2025-04-24 21:34:04.373545,0 days 00:00:08.557590,False,absolute_error,35,,12,17,938,TPESampler,COMPLETE
1317,0.4605670355976419,2025-04-24 21:33:56.241934,2025-04-24 21:34:17.059039,0 days 00:00:20.817105,True,absolute_error,49,,2,10,795,TPESampler,COMPLETE
1318,0.42862783913069413,2025-04-24 21:33:56.868018,2025-04-24 21:33:59.277122,0 days 00:00:02.409104,True,squared_error,50,,2,3,570,TPESampler,COMPLETE
1319,0.4484854685233382,2025-04-24 21:33:57.704611,2025-04-24 21:34:00.185372,0 days 00:00:02.480761,False,squared_error,43,,2,4,386,TPESampler,COMPLETE
1320,0.34196273359866586,2025-04-24 21:33:58.752330,2025-04-24 21:34:02.212498,0 days 00:00:03.460168,True,squared_error,50,,1,3,627,TPESampler,COMPLETE
1321,0.43298809121942694,2025-04-24 21:33:59.496109,2025-04-24 21:34:01.060581,0 days 00:00:01.564472,True,squared_error,50,log2,1,4,658,TPESampler,COMPLETE
1322,0.3468513988067164,2025-04-24 21:34:00.580455,2025-04-24 21:34:03.433236,0 days 00:00:02.852781,True,squared_error,50,,1,4,488,TPESampler,COMPLETE
1323,0.45454805241706164,2025-04-24 21:34:01.247943,2025-04-24 21:34:13.687090,0 days 00:00:12.439147,True,absolute_error,34,,2,7,444,TPESampler,COMPLETE
1324,0.9496051362982636,2025-04-24 21:34:01.296551,2025-04-24 21:34:03.174185,0 days 00:00:01.877634,False,absolute_error,46,sqrt,12,7,895,TPESampler,COMPLETE
1325,0.34357129543043513,2025-04-24 21:34:02.394665,2025-04-24 21:34:05.701169,0 days 00:00:03.306504,True,squared_error,50,,1,2,523,TPESampler,COMPLETE
1326,0.3478735456391878,2025-04-24 21:34:03.348125,2025-04-24 21:34:06.781041,0 days 00:00:03.432916,True,squared_error,42,,1,4,672,TPESampler,COMPLETE
1327,0.4435162903956558,2025-04-24 21:34:03.623416,2025-04-24 21:34:06.656181,0 days 00:00:03.032765,False,squared_error,8,,2,2,936,TPESampler,COMPLETE
1328,0.3433639144022393,2025-04-24 21:34:04.555312,2025-04-24 21:34:07.104250,0 days 00:00:02.548938,True,squared_error,50,,1,2,433,TPESampler,COMPLETE
1329,0.6302647285845787,2025-04-24 21:34:06.084287,2025-04-24 21:34:08.218538,0 days 00:00:02.134251,False,squared_error,7,,13,2,633,TPESampler,COMPLETE
1330,0.34178891452998345,2025-04-24 21:34:07.043211,2025-04-24 21:34:09.972085,0 days 00:00:02.928874,True,squared_error,43,,1,3,445,TPESampler,COMPLETE
1331,0.9682283620424172,2025-04-24 21:34:07.062909,2025-04-24 21:34:08.629421,0 days 00:00:01.566512,False,absolute_error,22,log2,8,15,800,TPESampler,COMPLETE
1332,0.4318039630896767,2025-04-24 21:34:07.314942,2025-04-24 21:34:09.231717,0 days 00:00:01.916775,True,squared_error,50,,2,5,314,TPESampler,COMPLETE
1333,0.341877955049926,2025-04-24 21:34:08.399396,2025-04-24 21:34:10.768390,0 days 00:00:02.368994,True,squared_error,50,,1,3,366,TPESampler,COMPLETE
1334,0.9743297910287542,2025-04-24 21:34:08.879632,2025-04-24 21:34:09.900747,0 days 00:00:01.021115,True,absolute_error,49,sqrt,9,17,137,TPESampler,COMPLETE
1335,0.3414543832314912,2025-04-24 21:34:09.425989,2025-04-24 21:34:12.874040,0 days 00:00:03.448051,True,squared_error,50,,1,3,578,TPESampler,COMPLETE
1336,0.3408330128186471,2025-04-24 21:34:10.259240,2025-04-24 21:34:13.989227,0 days 00:00:03.729987,True,squared_error,50,,1,3,604,TPESampler,COMPLETE
1337,0.35380612215131296,2025-04-24 21:34:10.366207,2025-04-24 21:34:13.620433,0 days 00:00:03.254226,True,squared_error,43,,1,5,624,TPESampler,COMPLETE
1338,0.6482271357444775,2025-04-24 21:34:11.165605,2025-04-24 21:34:12.443677,0 days 00:00:01.278072,True,squared_error,50,sqrt,2,2,492,TPESampler,COMPLETE
1339,0.35436608652177143,2025-04-24 21:34:12.632000,2025-04-24 21:34:15.488176,0 days 00:00:02.856176,True,squared_error,43,,1,5,508,TPESampler,COMPLETE
1340,0.6378156701754073,2025-04-24 21:34:13.089786,2025-04-24 21:34:15.148817,0 days 00:00:02.059031,False,squared_error,29,sqrt,3,6,943,TPESampler,COMPLETE
1341,0.9219111971493309,2025-04-24 21:34:14.003294,2025-04-24 21:34:17.260398,0 days 00:00:03.257104,True,absolute_error,18,log2,2,14,906,TPESampler,COMPLETE
1342,0.3448836472110912,2025-04-24 21:34:14.104473,2025-04-24 21:34:19.428075,0 days 00:00:05.323602,True,squared_error,42,,1,2,771,TPESampler,COMPLETE
1343,0.353550651561875,2025-04-24 21:34:14.211936,2025-04-24 21:34:18.368555,0 days 00:00:04.156619,True,squared_error,50,,1,5,659,TPESampler,COMPLETE
1344,0.35398376585335933,2025-04-24 21:34:15.564558,2025-04-24 21:34:20.264618,0 days 00:00:04.700060,True,squared_error,50,,1,5,765,TPESampler,COMPLETE
1345,0.4274826803793155,2025-04-24 21:34:15.683011,2025-04-24 21:34:19.360554,0 days 00:00:03.677543,True,squared_error,50,,2,3,728,TPESampler,COMPLETE
1346,0.34262878102147637,2025-04-24 21:34:17.271787,2025-04-24 21:34:21.305478,0 days 00:00:04.033691,True,squared_error,50,,1,2,594,TPESampler,COMPLETE
1347,0.5200716150507286,2025-04-24 21:34:17.530300,2025-04-24 21:34:19.512540,0 days 00:00:01.982240,True,squared_error,6,,4,11,651,TPESampler,COMPLETE
1348,0.6348656087537939,2025-04-24 21:34:18.545161,2025-04-24 21:34:20.610261,0 days 00:00:02.065100,False,squared_error,35,,15,8,525,TPESampler,COMPLETE
1349,0.45835715038328845,2025-04-24 21:34:19.607321,2025-04-24 21:34:22.170573,0 days 00:00:02.563252,False,squared_error,30,,3,6,412,TPESampler,COMPLETE
1350,0.3444805442450247,2025-04-24 21:34:19.616466,2025-04-24 21:34:24.233725,0 days 00:00:04.617259,True,squared_error,41,,1,2,654,TPESampler,COMPLETE
1351,0.3457454613219754,2025-04-24 21:34:19.729233,2025-04-24 21:34:23.506762,0 days 00:00:03.777529,True,squared_error,50,,1,4,609,TPESampler,COMPLETE
1352,0.35339919526279917,2025-04-24 21:34:20.651840,2025-04-24 21:34:23.427109,0 days 00:00:02.775269,True,squared_error,50,,1,5,398,TPESampler,COMPLETE
1353,0.34600833358330435,2025-04-24 21:34:20.850793,2025-04-24 21:34:23.976357,0 days 00:00:03.125564,True,squared_error,50,,1,4,420,TPESampler,COMPLETE
1354,0.34461647258667016,2025-04-24 21:34:21.533765,2025-04-24 21:34:26.027920,0 days 00:00:04.494155,True,squared_error,43,,1,2,679,TPESampler,COMPLETE
1355,0.4272247486562496,2025-04-24 21:34:22.539327,2025-04-24 21:34:25.630238,0 days 00:00:03.090911,True,squared_error,50,,2,2,663,TPESampler,COMPLETE
1356,0.44167148485163443,2025-04-24 21:34:23.596014,2025-04-24 21:34:26.540422,0 days 00:00:02.944408,True,squared_error,50,,2,7,537,TPESampler,COMPLETE
1357,0.34091962842992524,2025-04-24 21:34:23.718490,2025-04-24 21:34:27.920637,0 days 00:00:04.202147,True,squared_error,50,,1,3,599,TPESampler,COMPLETE
1358,0.3439087764169195,2025-04-24 21:34:24.230159,2025-04-24 21:34:28.902515,0 days 00:00:04.672356,True,squared_error,42,,1,3,725,TPESampler,COMPLETE
1359,0.3521045883133353,2025-04-24 21:34:24.589266,2025-04-24 21:34:28.144852,0 days 00:00:03.555586,True,squared_error,50,,1,5,592,TPESampler,COMPLETE
1360,0.37138880024284193,2025-04-24 21:34:25.812934,2025-04-24 21:34:28.213479,0 days 00:00:02.400545,True,squared_error,49,sqrt,1,3,735,TPESampler,COMPLETE
1361,0.34565923218173794,2025-04-24 21:34:26.317179,2025-04-24 21:34:30.176885,0 days 00:00:03.859706,True,squared_error,50,,1,4,593,TPESampler,COMPLETE
1362,0.6428530140441171,2025-04-24 21:34:26.757731,2025-04-24 21:34:33.241429,0 days 00:00:06.483698,False,absolute_error,26,,7,47,447,TPESampler,COMPLETE
1363,0.3425917904107838,2025-04-24 21:34:28.102385,2025-04-24 21:34:31.843976,0 days 00:00:03.741591,True,squared_error,49,,1,3,666,TPESampler,COMPLETE
1364,0.9692300311304494,2025-04-24 21:34:28.404795,2025-04-24 21:34:29.722853,0 days 00:00:01.318058,False,absolute_error,27,log2,6,2,199,TPESampler,COMPLETE
1365,0.34726775572871116,2025-04-24 21:34:28.457569,2025-04-24 21:34:33.005190,0 days 00:00:04.547621,True,squared_error,44,,1,4,767,TPESampler,COMPLETE
1366,0.34512939972327256,2025-04-24 21:34:29.147453,2025-04-24 21:34:32.203135,0 days 00:00:03.055682,True,squared_error,32,,1,2,446,TPESampler,COMPLETE
1367,0.3451838934115164,2025-04-24 21:34:29.962500,2025-04-24 21:34:34.572938,0 days 00:00:04.610438,True,squared_error,50,,1,2,727,TPESampler,COMPLETE
1368,0.3438853720777595,2025-04-24 21:34:30.383767,2025-04-24 21:34:34.611462,0 days 00:00:04.227695,True,squared_error,44,,1,3,712,TPESampler,COMPLETE
1369,0.4367238663367861,2025-04-24 21:34:32.035276,2025-04-24 21:35:06.594814,0 days 00:00:34.559538,True,absolute_error,29,,1,18,677,TPESampler,COMPLETE
1370,0.347121404259787,2025-04-24 21:34:32.414655,2025-04-24 21:34:36.501888,0 days 00:00:04.087233,True,squared_error,49,,1,4,693,TPESampler,COMPLETE
1371,0.42844332547498853,2025-04-24 21:34:33.390627,2025-04-24 21:34:36.494352,0 days 00:00:03.103725,True,squared_error,49,,2,3,627,TPESampler,COMPLETE
1372,0.9114613131993441,2025-04-24 21:34:33.431705,2025-04-24 21:34:34.563620,0 days 00:00:01.131915,False,squared_error,23,log2,5,13,592,TPESampler,COMPLETE
1373,0.4270949108853321,2025-04-24 21:34:34.741599,2025-04-24 21:34:38.374240,0 days 00:00:03.632641,True,squared_error,50,,2,3,667,TPESampler,COMPLETE
1374,0.7079212043476267,2025-04-24 21:34:34.793197,2025-04-24 21:34:36.853263,0 days 00:00:02.060066,True,squared_error,10,sqrt,2,2,579,TPESampler,COMPLETE
1375,0.3444410691756207,2025-04-24 21:34:34.869998,2025-04-24 21:34:39.250617,0 days 00:00:04.380619,True,squared_error,44,,1,2,682,TPESampler,COMPLETE
1376,0.3416958969309952,2025-04-24 21:34:36.638270,2025-04-24 21:34:40.752256,0 days 00:00:04.113986,True,squared_error,46,,1,3,618,TPESampler,COMPLETE
1377,0.34201882811241685,2025-04-24 21:34:36.692487,2025-04-24 21:34:40.118919,0 days 00:00:03.426432,True,squared_error,50,,1,3,508,TPESampler,COMPLETE
1378,0.4279543298326001,2025-04-24 21:34:37.085318,2025-04-24 21:34:39.809305,0 days 00:00:02.723987,True,squared_error,37,,2,2,505,TPESampler,COMPLETE
1379,0.3469873364337282,2025-04-24 21:34:38.563947,2025-04-24 21:34:42.536468,0 days 00:00:03.972521,True,squared_error,50,,1,4,784,TPESampler,COMPLETE
1380,0.34703651941310676,2025-04-24 21:34:39.437259,2025-04-24 21:34:43.098122,0 days 00:00:03.660863,True,squared_error,40,,1,4,549,TPESampler,COMPLETE
1381,0.3453579107920818,2025-04-24 21:34:40.066192,2025-04-24 21:34:44.423118,0 days 00:00:04.356926,True,squared_error,50,,1,2,733,TPESampler,COMPLETE
1382,0.6391403998076082,2025-04-24 21:34:40.388273,2025-04-24 21:34:42.231699,0 days 00:00:01.843426,False,squared_error,25,sqrt,3,42,788,TPESampler,COMPLETE
1383,0.43244767267931833,2025-04-24 21:34:40.968052,2025-04-24 21:34:43.029760,0 days 00:00:02.061708,True,squared_error,49,log2,1,3,503,TPESampler,COMPLETE
1384,0.3445079729673185,2025-04-24 21:34:42.431780,2025-04-24 21:34:46.116726,0 days 00:00:03.684946,True,squared_error,44,,1,2,508,TPESampler,COMPLETE
1385,0.8303686124378501,2025-04-24 21:34:42.726871,2025-04-24 21:34:43.985671,0 days 00:00:01.258800,False,squared_error,20,log2,2,3,508,TPESampler,COMPLETE
1386,0.5898834924077714,2025-04-24 21:34:43.362242,2025-04-24 21:34:45.882765,0 days 00:00:02.520523,True,squared_error,41,,8,10,574,TPESampler,COMPLETE
1387,0.42747832750630715,2025-04-24 21:34:43.490060,2025-04-24 21:34:47.083768,0 days 00:00:03.593708,True,squared_error,42,,2,4,598,TPESampler,COMPLETE
1388,0.34363975496137605,2025-04-24 21:34:44.368989,2025-04-24 21:34:47.900763,0 days 00:00:03.531774,True,squared_error,50,,1,2,564,TPESampler,COMPLETE
1389,0.4280802723505456,2025-04-24 21:34:44.689419,2025-04-24 21:34:47.147849,0 days 00:00:02.458430,True,squared_error,42,,2,2,501,TPESampler,COMPLETE
1390,0.3501102077347221,2025-04-24 21:34:46.074946,2025-04-24 21:35:32.810539,0 days 00:00:46.735593,True,absolute_error,48,,1,4,845,TPESampler,COMPLETE
1391,0.34206987393895655,2025-04-24 21:34:46.371801,2025-04-24 21:34:50.196470,0 days 00:00:03.824669,True,squared_error,50,,1,3,646,TPESampler,COMPLETE
1392,0.43197663657921986,2025-04-24 21:34:47.443306,2025-04-24 21:34:52.534748,0 days 00:00:05.091442,False,squared_error,46,,1,2,738,TPESampler,COMPLETE
1393,0.4294547241085556,2025-04-24 21:34:47.482993,2025-04-24 21:34:51.572385,0 days 00:00:04.089392,False,squared_error,50,,1,3,554,TPESampler,COMPLETE
1394,0.6329633346532513,2025-04-24 21:34:48.194347,2025-04-24 21:34:54.128795,0 days 00:00:05.934448,False,absolute_error,21,,12,17,575,TPESampler,COMPLETE
1395,0.34229369614341454,2025-04-24 21:34:50.378418,2025-04-24 21:34:53.885149,0 days 00:00:03.506731,True,squared_error,50,,1,3,634,TPESampler,COMPLETE
1396,0.4273436179456778,2025-04-24 21:34:51.760727,2025-04-24 21:34:54.659397,0 days 00:00:02.898670,True,squared_error,40,,2,3,686,TPESampler,COMPLETE
1397,0.5570317598106198,2025-04-24 21:34:52.734233,2025-04-24 21:34:54.169981,0 days 00:00:01.435748,True,absolute_error,45,,5,2,104,TPESampler,COMPLETE
1398,0.4439618845718945,2025-04-24 21:34:54.070746,2025-04-24 21:35:09.448125,0 days 00:00:15.377379,True,absolute_error,41,,2,3,511,TPESampler,COMPLETE
1399,0.42679287419232803,2025-04-24 21:34:54.292884,2025-04-24 21:34:57.675080,0 days 00:00:03.382196,False,squared_error,40,,1,3,464,TPESampler,COMPLETE
1400,0.3421369038721695,2025-04-24 21:34:54.358946,2025-04-24 21:34:57.690240,0 days 00:00:03.331294,True,squared_error,43,,1,3,571,TPESampler,COMPLETE
1401,0.42778494798008426,2025-04-24 21:34:55.006037,2025-04-24 21:34:57.290447,0 days 00:00:02.284410,True,squared_error,50,,2,4,507,TPESampler,COMPLETE
1402,0.34697321532593023,2025-04-24 21:34:57.476018,2025-04-24 21:35:00.177153,0 days 00:00:02.701135,True,squared_error,50,,1,4,513,TPESampler,COMPLETE
1403,0.42851519602921423,2025-04-24 21:34:57.869978,2025-04-24 21:35:00.970320,0 days 00:00:03.100342,True,squared_error,50,,2,4,635,TPESampler,COMPLETE
1404,0.3494630202263183,2025-04-24 21:34:57.929285,2025-04-24 21:35:31.668291,0 days 00:00:33.739006,True,absolute_error,50,,1,4,603,TPESampler,COMPLETE
1405,0.4285995084003172,2025-04-24 21:35:00.369461,2025-04-24 21:35:02.699476,0 days 00:00:02.330015,True,squared_error,50,,2,2,564,TPESampler,COMPLETE
1406,0.3439935872626371,2025-04-24 21:35:01.153566,2025-04-24 21:35:03.492779,0 days 00:00:02.339213,True,squared_error,50,,1,2,395,TPESampler,COMPLETE
1407,0.8826646453193572,2025-04-24 21:35:02.888990,2025-04-24 21:35:03.648837,0 days 00:00:00.759847,False,squared_error,33,log2,3,44,199,TPESampler,COMPLETE
1408,0.3408330128186471,2025-04-24 21:35:03.698862,2025-04-24 21:35:06.774001,0 days 00:00:03.075139,True,squared_error,50,,1,3,604,TPESampler,COMPLETE
1409,0.3459629253969411,2025-04-24 21:35:03.869704,2025-04-24 21:35:06.621844,0 days 00:00:02.752140,True,squared_error,50,,1,4,537,TPESampler,COMPLETE
1410,0.3437841293358833,2025-04-24 21:35:06.782089,2025-04-24 21:35:10.853062,0 days 00:00:04.070973,True,squared_error,50,,1,2,659,TPESampler,COMPLETE
1411,0.361683082883166,2025-04-24 21:35:06.813094,2025-04-24 21:35:10.726945,0 days 00:00:03.913851,True,squared_error,50,,1,6,777,TPESampler,COMPLETE
1412,0.5757223273268903,2025-04-24 21:35:06.990030,2025-04-24 21:35:08.856409,0 days 00:00:01.866379,True,absolute_error,20,sqrt,1,46,178,TPESampler,COMPLETE
1413,0.5975032745361017,2025-04-24 21:35:09.058200,2025-04-24 21:35:14.078291,0 days 00:00:05.020091,True,absolute_error,7,,8,43,829,TPESampler,COMPLETE
1414,0.3429563501552607,2025-04-24 21:35:09.723404,2025-04-24 21:35:13.231703,0 days 00:00:03.508299,True,squared_error,42,,1,3,633,TPESampler,COMPLETE
