number,value,datetime_start,datetime_complete,duration,params_bootstrap,params_criterion,params_max_depth,params_max_features,params_min_samples_leaf,params_min_samples_split,params_n_estimators,system_attrs_auto:sampler,state
566,0.3437452877256429,2025-04-24 21:24:46.040259,2025-04-24 21:24:48.702915,0 days 00:00:02.662656,True,squared_error,42,,1,2,455,TPESampler,COMPLETE
567,0.3427858006053113,2025-04-24 21:24:46.433010,2025-04-24 21:24:49.195202,0 days 00:00:02.762192,True,squared_error,42,,1,3,555,TPESampler,COMPLETE
568,0.5921726047353191,2025-04-24 21:24:47.485617,2025-04-24 21:24:50.317555,0 days 00:00:02.831938,False,absolute_error,11,,4,40,114,TPESampler,COMPLETE
569,0.4273303629566553,2025-04-24 21:24:48.875303,2025-04-24 21:24:51.991037,0 days 00:00:03.115734,True,squared_error,50,,2,4,759,TPESampler,COMPLETE
570,0.3529877151956584,2025-04-24 21:24:49.446890,2025-04-24 21:24:51.683502,0 days 00:00:02.236612,True,squared_error,50,,1,5,453,TPESampler,COMPLETE
571,0.4425630996330645,2025-04-24 21:24:50.494360,2025-04-24 21:25:06.087094,0 days 00:00:15.592734,True,absolute_error,47,,2,4,591,TPESampler,COMPLETE
572,0.34388501976903485,2025-04-24 21:24:51.849156,2025-04-24 21:24:55.297623,0 days 00:00:03.448467,True,squared_error,50,,1,2,652,TPESampler,COMPLETE
573,0.4266768248316367,2025-04-24 21:24:52.187390,2025-04-24 21:24:54.708410,0 days 00:00:02.521020,True,squared_error,50,,2,3,535,TPESampler,COMPLETE
574,0.3433283422977726,2025-04-24 21:24:53.060315,2025-04-24 21:24:55.774240,0 days 00:00:02.713925,True,squared_error,44,,1,3,480,TPESampler,COMPLETE
575,0.34664173840850754,2025-04-24 21:24:54.888378,2025-04-24 21:24:58.028083,0 days 00:00:03.139705,True,squared_error,43,,1,4,575,TPESampler,COMPLETE
576,0.3420507072075086,2025-04-24 21:24:55.507483,2025-04-24 21:24:58.136853,0 days 00:00:02.629370,True,squared_error,50,,1,3,506,TPESampler,COMPLETE
577,0.39829270098365366,2025-04-24 21:24:56.007942,2025-04-24 21:24:56.858360,0 days 00:00:00.850418,True,squared_error,50,sqrt,1,6,164,TPESampler,COMPLETE
578,0.34111127789429807,2025-04-24 21:24:57.043503,2025-04-24 21:24:59.995986,0 days 00:00:02.952483,True,squared_error,50,,1,3,526,TPESampler,COMPLETE
579,0.343468269236121,2025-04-24 21:24:58.226853,2025-04-24 21:25:01.530023,0 days 00:00:03.303170,True,squared_error,44,,1,2,549,TPESampler,COMPLETE
580,0.3443512302199903,2025-04-24 21:24:58.328482,2025-04-24 21:25:01.148102,0 days 00:00:02.819620,True,squared_error,50,,1,2,495,TPESampler,COMPLETE
581,0.3686485814458746,2025-04-24 21:25:00.177167,2025-04-24 21:25:02.913563,0 days 00:00:02.736396,True,squared_error,42,,1,7,534,TPESampler,COMPLETE
582,0.577463386415509,2025-04-24 21:25:01.324992,2025-04-24 21:25:02.135109,0 days 00:00:00.810117,True,squared_error,18,sqrt,1,28,176,TPESampler,COMPLETE
583,0.42754902510672876,2025-04-24 21:25:01.734880,2025-04-24 21:25:04.359873,0 days 00:00:02.624993,True,squared_error,49,,2,3,546,TPESampler,COMPLETE
584,0.341691646608622,2025-04-24 21:25:02.385651,2025-04-24 21:25:05.219120,0 days 00:00:02.833469,True,squared_error,49,,1,3,560,TPESampler,COMPLETE
585,0.43077854149420247,2025-04-24 21:25:03.101086,2025-04-24 21:25:04.615960,0 days 00:00:01.514874,True,squared_error,50,log2,1,2,454,TPESampler,COMPLETE
586,0.34692753226811884,2025-04-24 21:25:04.534864,2025-04-24 21:25:07.385203,0 days 00:00:02.850339,True,squared_error,50,,1,4,484,TPESampler,COMPLETE
587,0.3404917186702776,2025-04-24 21:25:04.818937,2025-04-24 21:25:07.645568,0 days 00:00:02.826631,True,squared_error,48,,1,3,444,TPESampler,COMPLETE
588,0.4543646726508004,2025-04-24 21:25:05.432165,2025-04-24 21:25:07.269358,0 days 00:00:01.837193,True,squared_error,22,,1,39,460,TPESampler,COMPLETE
589,0.34177607240125996,2025-04-24 21:25:06.267404,2025-04-24 21:25:09.586931,0 days 00:00:03.319527,True,squared_error,49,,1,3,523,TPESampler,COMPLETE
590,0.9217363785633388,2025-04-24 21:25:07.456276,2025-04-24 21:25:08.338555,0 days 00:00:00.882279,True,squared_error,27,log2,4,48,192,TPESampler,COMPLETE
591,0.3425066683679082,2025-04-24 21:25:07.608877,2025-04-24 21:25:11.954604,0 days 00:00:04.345727,True,squared_error,48,,1,2,611,TPESampler,COMPLETE
592,0.43248192032154403,2025-04-24 21:25:07.845765,2025-04-24 21:25:09.843972,0 days 00:00:01.998207,True,squared_error,50,log2,1,4,597,TPESampler,COMPLETE
593,0.6793516054062522,2025-04-24 21:25:08.539664,2025-04-24 21:25:09.623776,0 days 00:00:01.084112,False,absolute_error,11,sqrt,2,6,106,TPESampler,COMPLETE
594,0.9019056855892709,2025-04-24 21:25:09.786970,2025-04-24 21:25:10.819323,0 days 00:00:01.032353,False,squared_error,31,log2,4,3,356,TPESampler,COMPLETE
595,0.34255961134392177,2025-04-24 21:25:09.798711,2025-04-24 21:25:12.840675,0 days 00:00:03.041964,True,squared_error,49,,1,3,496,TPESampler,COMPLETE
596,0.3421210450868391,2025-04-24 21:25:10.078805,2025-04-24 21:25:14.308253,0 days 00:00:04.229448,True,squared_error,49,,1,3,624,TPESampler,COMPLETE
597,0.4289023421823429,2025-04-24 21:25:11.174220,2025-04-24 21:25:13.571581,0 days 00:00:02.397361,True,squared_error,43,,2,3,473,TPESampler,COMPLETE
598,0.8412113853680696,2025-04-24 21:25:12.145522,2025-04-24 21:25:13.082793,0 days 00:00:00.937271,False,squared_error,19,sqrt,7,2,329,TPESampler,COMPLETE
599,0.36878441685057967,2025-04-24 21:25:12.373076,2025-04-24 21:25:15.291703,0 days 00:00:02.918627,True,squared_error,50,,1,7,560,TPESampler,COMPLETE
600,0.3522171408722915,2025-04-24 21:25:13.175121,2025-04-24 21:25:16.617537,0 days 00:00:03.442416,True,squared_error,50,,1,5,605,TPESampler,COMPLETE
601,0.3428952144499478,2025-04-24 21:25:13.262892,2025-04-24 21:25:17.204232,0 days 00:00:03.941340,True,squared_error,50,,1,2,584,TPESampler,COMPLETE
602,0.3423100721856121,2025-04-24 21:25:13.815904,2025-04-24 21:25:17.146876,0 days 00:00:03.330972,True,squared_error,50,,1,3,498,TPESampler,COMPLETE
603,0.6674756639306472,2025-04-24 21:25:14.497691,2025-04-24 21:25:16.099195,0 days 00:00:01.601504,False,squared_error,24,,9,2,359,TPESampler,COMPLETE
604,0.43036429260424125,2025-04-24 21:25:15.356508,2025-04-24 21:25:17.455759,0 days 00:00:02.099251,True,squared_error,49,,2,2,391,TPESampler,COMPLETE
605,0.34700027737579375,2025-04-24 21:25:15.531770,2025-04-24 21:25:18.393698,0 days 00:00:02.861928,True,squared_error,41,,1,4,433,TPESampler,COMPLETE
606,0.34369563436317796,2025-04-24 21:25:16.339217,2025-04-24 21:25:20.179415,0 days 00:00:03.840198,True,squared_error,41,,1,2,602,TPESampler,COMPLETE
607,0.3435164532323331,2025-04-24 21:25:16.863894,2025-04-24 21:25:20.603457,0 days 00:00:03.739563,True,squared_error,50,,1,2,555,TPESampler,COMPLETE
608,0.9243195969501561,2025-04-24 21:25:17.555402,2025-04-24 21:25:19.068581,0 days 00:00:01.513179,True,squared_error,26,log2,5,21,539,TPESampler,COMPLETE
609,0.34888236070766027,2025-04-24 21:25:17.659424,2025-04-24 21:25:20.419177,0 days 00:00:02.759753,True,squared_error,42,,1,4,345,TPESampler,COMPLETE
610,0.3459852302865421,2025-04-24 21:25:17.835253,2025-04-24 21:25:20.711203,0 days 00:00:02.875950,True,squared_error,50,,1,4,451,TPESampler,COMPLETE
611,0.42899453700489687,2025-04-24 21:25:18.755755,2025-04-24 21:25:22.813690,0 days 00:00:04.057935,False,squared_error,45,,1,3,577,TPESampler,COMPLETE
612,0.372646378741352,2025-04-24 21:25:19.288348,2025-04-24 21:25:20.782978,0 days 00:00:01.494630,True,squared_error,50,sqrt,1,3,365,TPESampler,COMPLETE
613,0.34689157979894586,2025-04-24 21:25:20.377605,2025-04-24 21:25:23.838671,0 days 00:00:03.461066,True,squared_error,40,,1,4,606,TPESampler,COMPLETE
614,0.34590251893487683,2025-04-24 21:25:20.695840,2025-04-24 21:25:24.113981,0 days 00:00:03.418141,True,squared_error,43,,1,4,550,TPESampler,COMPLETE
615,0.34229369614341454,2025-04-24 21:25:20.847271,2025-04-24 21:25:25.021228,0 days 00:00:04.173957,True,squared_error,50,,1,3,634,TPESampler,COMPLETE
616,0.34204420408832104,2025-04-24 21:25:20.970940,2025-04-24 21:25:24.235246,0 days 00:00:03.264306,True,squared_error,49,,1,3,414,TPESampler,COMPLETE
617,0.3791201772360659,2025-04-24 21:25:21.313347,2025-04-24 21:25:23.368062,0 days 00:00:02.054715,True,squared_error,49,,1,8,302,TPESampler,COMPLETE
618,0.43115506381092666,2025-04-24 21:25:23.002605,2025-04-24 21:25:26.061722,0 days 00:00:03.059117,True,squared_error,45,,2,5,645,TPESampler,COMPLETE
619,0.42687460939078575,2025-04-24 21:25:23.620041,2025-04-24 21:25:26.340209,0 days 00:00:02.720168,True,squared_error,49,,2,2,536,TPESampler,COMPLETE
620,0.5040259060741464,2025-04-24 21:25:24.043284,2025-04-24 21:25:26.046996,0 days 00:00:02.003712,True,absolute_error,23,sqrt,1,2,170,TPESampler,COMPLETE
621,0.3772338522124574,2025-04-24 21:25:24.463123,2025-04-24 21:25:27.538887,0 days 00:00:03.075764,False,squared_error,46,sqrt,1,2,805,TPESampler,COMPLETE
622,0.34458913186550905,2025-04-24 21:25:24.530129,2025-04-24 21:25:28.071853,0 days 00:00:03.541724,True,squared_error,50,,1,2,500,TPESampler,COMPLETE
623,0.37411053822611917,2025-04-24 21:25:25.527117,2025-04-24 21:25:57.850722,0 days 00:00:32.323605,False,absolute_error,43,,1,5,340,TPESampler,COMPLETE
624,0.6985779658206974,2025-04-24 21:25:26.267979,2025-04-24 21:25:27.342636,0 days 00:00:01.074657,False,squared_error,8,sqrt,1,22,289,TPESampler,COMPLETE
625,0.4206770726254043,2025-04-24 21:25:26.405995,2025-04-24 21:25:28.786608,0 days 00:00:02.380613,False,squared_error,49,,1,8,287,TPESampler,COMPLETE
626,0.3416390477484435,2025-04-24 21:25:26.549106,2025-04-24 21:25:30.060383,0 days 00:00:03.511277,True,squared_error,50,,1,3,471,TPESampler,COMPLETE
627,0.9555238992928383,2025-04-24 21:25:27.648298,2025-04-24 21:25:28.426774,0 days 00:00:00.778476,False,absolute_error,16,log2,4,10,107,TPESampler,COMPLETE
628,0.6504446249188856,2025-04-24 21:25:27.763199,2025-04-24 21:25:29.043104,0 days 00:00:01.279905,True,squared_error,49,sqrt,2,3,441,TPESampler,COMPLETE
629,0.3527219681087938,2025-04-24 21:25:28.360944,2025-04-24 21:25:31.779125,0 days 00:00:03.418181,True,squared_error,50,,1,5,578,TPESampler,COMPLETE
630,0.43020903224006807,2025-04-24 21:25:28.673401,2025-04-24 21:25:31.072037,0 days 00:00:02.398636,True,squared_error,46,,2,4,369,TPESampler,COMPLETE
631,0.34794598590539616,2025-04-24 21:25:29.135827,2025-04-24 21:25:30.932818,0 days 00:00:01.796991,True,squared_error,50,,1,4,256,TPESampler,COMPLETE
632,0.4286307321659682,2025-04-24 21:25:29.332229,2025-04-24 21:25:31.761081,0 days 00:00:02.428852,True,squared_error,50,,2,4,484,TPESampler,COMPLETE
633,0.34238433415019387,2025-04-24 21:25:30.234434,2025-04-24 21:25:33.630865,0 days 00:00:03.396431,True,squared_error,40,,1,3,573,TPESampler,COMPLETE
634,0.4339226332848478,2025-04-24 21:25:31.124754,2025-04-24 21:25:33.582177,0 days 00:00:02.457423,True,squared_error,48,log2,1,2,821,TPESampler,COMPLETE
635,0.4435502125000916,2025-04-24 21:25:31.277236,2025-04-24 21:25:33.866234,0 days 00:00:02.588998,True,squared_error,35,,2,7,479,TPESampler,COMPLETE
636,0.3485852811324536,2025-04-24 21:25:32.141703,2025-04-24 21:25:54.390741,0 days 00:00:22.249038,True,absolute_error,38,,1,2,373,TPESampler,COMPLETE
637,0.3410197476914786,2025-04-24 21:25:32.238349,2025-04-24 21:25:35.890359,0 days 00:00:03.652010,True,squared_error,50,,1,3,588,TPESampler,COMPLETE
638,0.34784905638876423,2025-04-24 21:25:33.773194,2025-04-24 21:25:36.781017,0 days 00:00:03.007823,True,squared_error,40,,1,4,485,TPESampler,COMPLETE
639,0.4311083302930364,2025-04-24 21:25:33.814600,2025-04-24 21:25:36.962584,0 days 00:00:03.147984,True,squared_error,50,,2,5,646,TPESampler,COMPLETE
640,0.35056441344409367,2025-04-24 21:25:34.223852,2025-04-24 21:25:58.244788,0 days 00:00:24.020936,True,absolute_error,41,,1,4,435,TPESampler,COMPLETE
641,0.6559056181343697,2025-04-24 21:25:36.063876,2025-04-24 21:25:39.550788,0 days 00:00:03.486912,True,absolute_error,48,sqrt,2,3,786,TPESampler,COMPLETE
642,0.4281858267760457,2025-04-24 21:25:36.952080,2025-04-24 21:25:39.495971,0 days 00:00:02.543891,True,squared_error,50,,2,2,643,TPESampler,COMPLETE
643,0.3472937314676629,2025-04-24 21:25:37.161355,2025-04-24 21:25:41.007071,0 days 00:00:03.845716,True,squared_error,44,,1,4,757,TPESampler,COMPLETE
644,0.34206331180311855,2025-04-24 21:25:39.694115,2025-04-24 21:25:42.768308,0 days 00:00:03.074193,True,squared_error,43,,1,3,617,TPESampler,COMPLETE
645,0.3435399896217087,2025-04-24 21:25:39.742106,2025-04-24 21:25:43.574757,0 days 00:00:03.832651,True,squared_error,42,,1,3,708,TPESampler,COMPLETE
646,0.3462209155947221,2025-04-24 21:25:41.184220,2025-04-24 21:25:44.201564,0 days 00:00:03.017344,True,squared_error,49,,1,4,618,TPESampler,COMPLETE
647,0.34228025217899366,2025-04-24 21:25:42.942009,2025-04-24 21:25:46.216227,0 days 00:00:03.274218,True,squared_error,50,,1,3,682,TPESampler,COMPLETE
648,0.3439151940407702,2025-04-24 21:25:43.752562,2025-04-24 21:25:46.848279,0 days 00:00:03.095717,True,squared_error,42,,1,2,532,TPESampler,COMPLETE
649,0.345338231285594,2025-04-24 21:25:44.553040,2025-04-24 21:25:47.208853,0 days 00:00:02.655813,True,squared_error,41,,1,2,483,TPESampler,COMPLETE
650,0.4202844867342511,2025-04-24 21:25:46.390262,2025-04-24 21:25:57.820012,0 days 00:00:11.429750,False,absolute_error,34,sqrt,1,4,720,TPESampler,COMPLETE
651,0.3463093199812971,2025-04-24 21:25:47.072478,2025-04-24 21:25:49.600875,0 days 00:00:02.528397,True,squared_error,50,,1,4,436,TPESampler,COMPLETE
652,0.4279166923261917,2025-04-24 21:25:47.415831,2025-04-24 21:25:50.059428,0 days 00:00:02.643597,True,squared_error,49,,2,3,584,TPESampler,COMPLETE
653,0.8800532196811102,2025-04-24 21:25:49.776555,2025-04-24 21:25:50.878167,0 days 00:00:01.101612,True,squared_error,49,log2,2,4,414,TPESampler,COMPLETE
654,0.3411339384703894,2025-04-24 21:25:50.238470,2025-04-24 21:25:54.031546,0 days 00:00:03.793076,True,squared_error,50,,1,3,583,TPESampler,COMPLETE
655,0.8348043861944192,2025-04-24 21:25:51.196581,2025-04-24 21:25:53.022651,0 days 00:00:01.826070,True,squared_error,11,sqrt,4,2,941,TPESampler,COMPLETE
656,0.34126222860159494,2025-04-24 21:25:53.234504,2025-04-24 21:25:56.784018,0 days 00:00:03.549514,True,squared_error,50,,1,3,581,TPESampler,COMPLETE
657,0.9357296806868768,2025-04-24 21:25:54.210749,2025-04-24 21:25:55.382477,0 days 00:00:01.171728,True,squared_error,45,log2,11,5,360,TPESampler,COMPLETE
658,0.34476195252437536,2025-04-24 21:25:54.575908,2025-04-24 21:25:58.736762,0 days 00:00:04.160854,True,squared_error,50,,1,2,771,TPESampler,COMPLETE
659,0.8449749943534536,2025-04-24 21:25:55.559844,2025-04-24 21:25:56.694365,0 days 00:00:01.134521,False,squared_error,33,sqrt,7,2,745,TPESampler,COMPLETE
660,0.375341575005988,2025-04-24 21:25:56.868301,2025-04-24 21:25:58.990725,0 days 00:00:02.122424,True,squared_error,50,sqrt,1,4,724,TPESampler,COMPLETE
661,0.9952868744117818,2025-04-24 21:25:56.941840,2025-04-24 21:25:58.197350,0 days 00:00:01.255510,True,absolute_error,46,log2,14,9,134,TPESampler,COMPLETE
662,0.3434825174281527,2025-04-24 21:25:58.004026,2025-04-24 21:26:01.986836,0 days 00:00:03.982810,True,squared_error,50,,1,2,567,TPESampler,COMPLETE
663,0.3543190193307406,2025-04-24 21:25:58.060648,2025-04-24 21:26:02.501001,0 days 00:00:04.440353,True,squared_error,48,,1,5,775,TPESampler,COMPLETE
664,0.3433186645074882,2025-04-24 21:25:58.396881,2025-04-24 21:26:03.316490,0 days 00:00:04.919609,True,squared_error,50,,1,3,736,TPESampler,COMPLETE
665,0.6753041824143158,2025-04-24 21:25:58.456788,2025-04-24 21:26:01.863603,0 days 00:00:03.406815,False,squared_error,33,,10,2,725,TPESampler,COMPLETE
666,0.3534671753420071,2025-04-24 21:25:59.407365,2025-04-24 21:26:02.775748,0 days 00:00:03.368383,True,squared_error,44,,1,5,559,TPESampler,COMPLETE
667,0.3412357901552196,2025-04-24 21:25:59.536159,2025-04-24 21:26:03.026880,0 days 00:00:03.490721,True,squared_error,49,,1,3,538,TPESampler,COMPLETE
668,0.6038376107019624,2025-04-24 21:26:02.150090,2025-04-24 21:26:07.035150,0 days 00:00:04.885060,True,absolute_error,33,,9,18,746,TPESampler,COMPLETE
669,0.34424190290613654,2025-04-24 21:26:02.186489,2025-04-24 21:26:05.669155,0 days 00:00:03.482666,True,squared_error,50,,1,2,483,TPESampler,COMPLETE
670,0.3408702682859324,2025-04-24 21:26:02.708690,2025-04-24 21:26:06.273953,0 days 00:00:03.565263,True,squared_error,50,,1,3,541,TPESampler,COMPLETE
671,0.41139023104698574,2025-04-24 21:26:03.217542,2025-04-24 21:26:07.283766,0 days 00:00:04.066224,False,squared_error,49,,1,4,490,TPESampler,COMPLETE
672,0.35442103904734173,2025-04-24 21:26:03.240496,2025-04-24 21:26:06.959869,0 days 00:00:03.719373,True,squared_error,48,,1,5,677,TPESampler,COMPLETE
673,0.34158611604148936,2025-04-24 21:26:03.616819,2025-04-24 21:26:07.227271,0 days 00:00:03.610452,True,squared_error,50,,1,3,612,TPESampler,COMPLETE
674,0.3457666963882892,2025-04-24 21:26:05.846740,2025-04-24 21:26:38.485840,0 days 00:00:32.639100,True,absolute_error,47,,1,2,524,TPESampler,COMPLETE
675,0.4303004430645033,2025-04-24 21:26:06.599091,2025-04-24 21:26:09.097077,0 days 00:00:02.497986,True,squared_error,42,,2,5,513,TPESampler,COMPLETE
676,0.34207166530194566,2025-04-24 21:26:07.176984,2025-04-24 21:26:10.409303,0 days 00:00:03.232319,True,squared_error,49,,1,3,521,TPESampler,COMPLETE
677,0.42719541527765537,2025-04-24 21:26:07.266259,2025-04-24 21:26:10.152523,0 days 00:00:02.886264,True,squared_error,43,,2,3,542,TPESampler,COMPLETE
678,0.4280289712946486,2025-04-24 21:26:07.536455,2025-04-24 21:26:10.573222,0 days 00:00:03.036767,True,squared_error,44,,2,2,582,TPESampler,COMPLETE
679,0.4218562702774349,2025-04-24 21:26:07.648067,2025-04-24 21:26:11.672330,0 days 00:00:04.024263,False,absolute_error,49,sqrt,1,34,225,TPESampler,COMPLETE
680,0.955091433348485,2025-04-24 21:26:09.273241,2025-04-24 21:26:10.717566,0 days 00:00:01.444325,True,absolute_error,26,log2,3,2,567,TPESampler,COMPLETE
681,0.3534057359758972,2025-04-24 21:26:10.328667,2025-04-24 21:26:13.710446,0 days 00:00:03.381779,True,squared_error,49,,1,5,616,TPESampler,COMPLETE
682,0.34835404791730645,2025-04-24 21:26:10.629147,2025-04-24 21:26:13.571508,0 days 00:00:02.942361,True,squared_error,42,,1,4,483,TPESampler,COMPLETE
683,0.4907473372922223,2025-04-24 21:26:10.830413,2025-04-24 21:26:12.929678,0 days 00:00:02.099265,True,squared_error,39,log2,1,2,531,TPESampler,COMPLETE
684,0.3418343369739308,2025-04-24 21:26:11.000459,2025-04-24 21:26:14.653946,0 days 00:00:03.653487,True,squared_error,50,,1,3,562,TPESampler,COMPLETE
685,0.8461782661834145,2025-04-24 21:26:11.947772,2025-04-24 21:26:13.275485,0 days 00:00:01.327713,True,absolute_error,9,log2,1,3,266,TPESampler,COMPLETE
686,0.34566458155239876,2025-04-24 21:26:13.116527,2025-04-24 21:26:42.075423,0 days 00:00:28.958896,True,absolute_error,50,,1,3,456,TPESampler,COMPLETE
687,0.3445360665332062,2025-04-24 21:26:13.478024,2025-04-24 21:26:16.128548,0 days 00:00:02.650524,True,squared_error,50,,1,2,347,TPESampler,COMPLETE
688,0.43441531103600817,2025-04-24 21:26:13.824316,2025-04-24 21:26:36.568483,0 days 00:00:22.744167,False,absolute_error,46,,2,3,461,TPESampler,COMPLETE
689,0.3409023736672471,2025-04-24 21:26:13.970075,2025-04-24 21:26:17.403408,0 days 00:00:03.433333,True,squared_error,50,,1,3,545,TPESampler,COMPLETE
690,0.34370065327770377,2025-04-24 21:26:14.959603,2025-04-24 21:26:18.243400,0 days 00:00:03.283797,True,squared_error,43,,1,2,614,TPESampler,COMPLETE
691,0.9247757868755927,2025-04-24 21:26:16.309147,2025-04-24 21:26:17.366259,0 days 00:00:01.057112,False,absolute_error,42,log2,3,11,341,TPESampler,COMPLETE
692,0.3528470741723178,2025-04-24 21:26:17.494612,2025-04-24 21:26:20.571719,0 days 00:00:03.077107,True,squared_error,50,,1,5,436,TPESampler,COMPLETE
693,0.7979445156102151,2025-04-24 21:26:17.547637,2025-04-24 21:26:19.369432,0 days 00:00:01.821795,True,absolute_error,9,sqrt,3,2,370,TPESampler,COMPLETE
694,0.6250616913129374,2025-04-24 21:26:18.561009,2025-04-24 21:26:27.869233,0 days 00:00:09.308224,False,absolute_error,27,,11,2,763,TPESampler,COMPLETE
695,0.965204371937104,2025-04-24 21:26:19.556255,2025-04-24 21:26:20.709558,0 days 00:00:01.153303,True,absolute_error,11,log2,4,7,450,TPESampler,COMPLETE
696,0.4741999834512392,2025-04-24 21:26:20.755024,2025-04-24 21:26:24.241679,0 days 00:00:03.486655,False,squared_error,42,,4,13,920,TPESampler,COMPLETE
697,0.34078304532534853,2025-04-24 21:26:20.876683,2025-04-24 21:26:24.245447,0 days 00:00:03.368764,True,squared_error,50,,1,3,601,TPESampler,COMPLETE
698,0.34460460237719454,2025-04-24 21:26:24.388582,2025-04-24 21:26:28.369762,0 days 00:00:03.981180,True,squared_error,50,,1,2,704,TPESampler,COMPLETE
699,0.34434177164283314,2025-04-24 21:26:24.434332,2025-04-24 21:26:28.319344,0 days 00:00:03.885012,True,squared_error,50,,1,2,681,TPESampler,COMPLETE
700,0.3411525986784643,2025-04-24 21:26:28.049891,2025-04-24 21:26:30.502758,0 days 00:00:02.452867,True,squared_error,49,,1,3,443,TPESampler,COMPLETE
701,0.4274285278313566,2025-04-24 21:26:28.502503,2025-04-24 21:26:31.391497,0 days 00:00:02.888994,True,squared_error,50,,2,3,544,TPESampler,COMPLETE
702,0.960195550322145,2025-04-24 21:26:28.570521,2025-04-24 21:26:30.142592,0 days 00:00:01.572071,False,absolute_error,19,log2,5,37,594,TPESampler,COMPLETE
703,0.9377501418647266,2025-04-24 21:26:30.335783,2025-04-24 21:26:31.269168,0 days 00:00:00.933385,True,squared_error,22,log2,7,2,228,TPESampler,COMPLETE
704,0.9883257264249058,2025-04-24 21:26:30.709125,2025-04-24 21:26:32.140100,0 days 00:00:01.430975,True,absolute_error,34,log2,9,49,678,TPESampler,COMPLETE
705,0.6578376896633663,2025-04-24 21:26:31.455347,2025-04-24 21:26:32.713138,0 days 00:00:01.257791,True,squared_error,48,sqrt,2,21,336,TPESampler,COMPLETE
706,0.42846121358155315,2025-04-24 21:26:31.588262,2025-04-24 21:26:34.113165,0 days 00:00:02.524903,True,squared_error,50,,2,4,481,TPESampler,COMPLETE
707,0.4288660606414813,2025-04-24 21:26:32.399242,2025-04-24 21:26:33.939245,0 days 00:00:01.540003,True,squared_error,50,,2,3,309,TPESampler,COMPLETE
