number,value,datetime_start,datetime_complete,duration,params_bootstrap,params_criterion,params_max_depth,params_max_features,params_min_samples_leaf,params_min_samples_split,params_n_estimators,system_attrs_auto:sampler,state
4665,0.34536842850775246,2025-04-24 22:20:02.956059,2025-04-24 22:20:36.248741,0 days 00:00:33.292682,True,absolute_error,50,,1,3,582,TPESampler,COMPLETE
4666,0.34660712173855934,2025-04-24 22:20:03.189085,2025-04-24 22:20:07.051479,0 days 00:00:03.862394,True,squared_error,42,,1,4,605,TPESampler,COMPLETE
4667,0.9778945960602667,2025-04-24 22:20:05.276926,2025-04-24 22:20:06.867924,0 days 00:00:01.590998,True,absolute_error,21,log2,6,5,577,TPESampler,COMPLETE
4668,0.3624628618211815,2025-04-24 22:20:06.808732,2025-04-24 22:20:08.849156,0 days 00:00:02.040424,True,squared_error,18,,1,4,304,TPESampler,COMPLETE
4669,0.429979170116081,2025-04-24 22:20:07.108248,2025-04-24 22:20:54.297466,0 days 00:00:47.189218,False,absolute_error,9,,1,2,829,TPESampler,COMPLETE
4670,0.42754902510672876,2025-04-24 22:20:07.365247,2025-04-24 22:20:11.326187,0 days 00:00:03.960940,True,squared_error,50,,2,3,546,TPESampler,COMPLETE
4671,0.4216459479449368,2025-04-24 22:20:07.725969,2025-04-24 22:20:13.111691,0 days 00:00:05.385722,False,squared_error,50,,1,8,592,TPESampler,COMPLETE
4672,0.9157315417577082,2025-04-24 22:20:08.782462,2025-04-24 22:20:11.221939,0 days 00:00:02.439477,True,squared_error,24,sqrt,14,8,794,TPESampler,COMPLETE
4673,0.3411339384703894,2025-04-24 22:20:09.337995,2025-04-24 22:20:13.545730,0 days 00:00:04.207735,True,squared_error,50,,1,3,583,TPESampler,COMPLETE
4674,0.3412774667036614,2025-04-24 22:20:11.490101,2025-04-24 22:20:15.274773,0 days 00:00:03.784672,True,squared_error,43,,1,3,591,TPESampler,COMPLETE
4675,0.3447657087818346,2025-04-24 22:20:11.614397,2025-04-24 22:20:16.066161,0 days 00:00:04.451764,True,squared_error,43,,1,2,703,TPESampler,COMPLETE
4676,0.4368297552691006,2025-04-24 22:20:13.360723,2025-04-24 22:20:16.488858,0 days 00:00:03.128135,True,squared_error,50,,2,6,625,TPESampler,COMPLETE
4677,0.44306704705200545,2025-04-24 22:20:13.831518,2025-04-24 22:20:16.753057,0 days 00:00:02.921539,True,squared_error,50,,2,7,496,TPESampler,COMPLETE
4678,0.34180918708036484,2025-04-24 22:20:15.553648,2025-04-24 22:20:19.147754,0 days 00:00:03.594106,True,squared_error,50,,1,3,512,TPESampler,COMPLETE
4679,0.4294501568935189,2025-04-24 22:20:16.402175,2025-04-24 22:20:20.775273,0 days 00:00:04.373098,False,squared_error,50,,1,3,555,TPESampler,COMPLETE
4680,0.42769138590072264,2025-04-24 22:20:16.815227,2025-04-24 22:20:20.295852,0 days 00:00:03.480625,True,squared_error,39,,2,2,704,TPESampler,COMPLETE
4681,0.3414062579276538,2025-04-24 22:20:17.016000,2025-04-24 22:20:20.746059,0 days 00:00:03.730059,True,squared_error,43,,1,3,593,TPESampler,COMPLETE
4682,0.9278963523524795,2025-04-24 22:20:19.399329,2025-04-24 22:20:20.432943,0 days 00:00:01.033614,True,squared_error,15,sqrt,15,2,117,TPESampler,COMPLETE
4683,0.4279890308587409,2025-04-24 22:20:20.578359,2025-04-24 22:20:24.331758,0 days 00:00:03.753399,True,squared_error,50,,2,2,645,TPESampler,COMPLETE
4684,0.3415791551038717,2025-04-24 22:20:20.709061,2025-04-24 22:20:24.816123,0 days 00:00:04.107062,True,squared_error,50,,1,3,571,TPESampler,COMPLETE
4685,0.36100316810637895,2025-04-24 22:20:21.082609,2025-04-24 22:20:23.786115,0 days 00:00:02.703506,True,squared_error,43,,1,6,357,TPESampler,COMPLETE
4686,0.34361433362129373,2025-04-24 22:20:21.249118,2025-04-24 22:20:26.176129,0 days 00:00:04.927011,True,squared_error,44,,1,3,787,TPESampler,COMPLETE
4687,0.4285122485461496,2025-04-24 22:20:24.029027,2025-04-24 22:20:27.430953,0 days 00:00:03.401926,True,squared_error,42,,2,3,635,TPESampler,COMPLETE
4688,0.429568842360027,2025-04-24 22:20:24.577048,2025-04-24 22:20:27.420358,0 days 00:00:02.843310,True,squared_error,42,,2,3,466,TPESampler,COMPLETE
4689,0.3438611353703554,2025-04-24 22:20:25.188202,2025-04-24 22:20:29.492203,0 days 00:00:04.304001,True,squared_error,50,,1,2,657,TPESampler,COMPLETE
4690,0.3477358455826874,2025-04-24 22:20:26.420851,2025-04-24 22:20:29.245942,0 days 00:00:02.825091,True,squared_error,43,,1,4,369,TPESampler,COMPLETE
4691,0.8219337689748303,2025-04-24 22:20:27.677615,2025-04-24 22:20:31.674240,0 days 00:00:03.996625,True,absolute_error,10,log2,1,2,920,TPESampler,COMPLETE
4692,0.3442737920774111,2025-04-24 22:20:27.699802,2025-04-24 22:20:31.322990,0 days 00:00:03.623188,True,squared_error,43,,1,2,505,TPESampler,COMPLETE
4693,0.3469626521325709,2025-04-24 22:20:29.501403,2025-04-24 22:20:34.024175,0 days 00:00:04.522772,True,squared_error,50,,1,4,786,TPESampler,COMPLETE
4694,0.3417315905868193,2025-04-24 22:20:29.769030,2025-04-24 22:20:33.039158,0 days 00:00:03.270128,True,squared_error,43,,1,3,443,TPESampler,COMPLETE
4695,0.3530324304674572,2025-04-24 22:20:31.589853,2025-04-24 22:20:35.197847,0 days 00:00:03.607994,True,squared_error,50,,1,5,575,TPESampler,COMPLETE
4696,0.34313469421156795,2025-04-24 22:20:31.958234,2025-04-24 22:20:35.985555,0 days 00:00:04.027321,True,squared_error,43,,1,2,584,TPESampler,COMPLETE
4697,0.3417605430458794,2025-04-24 22:20:33.297597,2025-04-24 22:20:36.188139,0 days 00:00:02.890542,True,squared_error,50,,1,3,387,TPESampler,COMPLETE
4698,0.42887355007772854,2025-04-24 22:20:34.329002,2025-04-24 22:20:36.897388,0 days 00:00:02.568386,True,squared_error,44,,2,2,474,TPESampler,COMPLETE
4699,0.9859431072813686,2025-04-24 22:20:35.453282,2025-04-24 22:20:38.328782,0 days 00:00:02.875500,True,absolute_error,29,log2,10,6,816,TPESampler,COMPLETE
4700,0.3699207219840217,2025-04-24 22:20:36.284336,2025-04-24 22:20:38.992946,0 days 00:00:02.708610,True,squared_error,50,sqrt,1,3,558,TPESampler,COMPLETE
4701,0.361482693039533,2025-04-24 22:20:36.613074,2025-04-24 22:20:40.977020,0 days 00:00:04.363946,True,squared_error,50,,1,6,486,TPESampler,COMPLETE
4702,0.37799391391885945,2025-04-24 22:20:36.843454,2025-04-24 22:20:41.009545,0 days 00:00:04.166091,True,squared_error,44,,1,8,498,TPESampler,COMPLETE
4703,0.3601943089899369,2025-04-24 22:20:37.262345,2025-04-24 22:20:41.729632,0 days 00:00:04.467287,True,squared_error,43,,1,6,605,TPESampler,COMPLETE
4704,0.34301982967335193,2025-04-24 22:20:38.931934,2025-04-24 22:20:42.160330,0 days 00:00:03.228396,True,squared_error,36,,1,3,434,TPESampler,COMPLETE
4705,0.42820762663450734,2025-04-24 22:20:39.383629,2025-04-24 22:20:42.532671,0 days 00:00:03.149042,True,squared_error,43,,2,3,642,TPESampler,COMPLETE
4706,0.3435248012085122,2025-04-24 22:20:41.224704,2025-04-24 22:20:46.150174,0 days 00:00:04.925470,True,squared_error,50,,1,2,616,TPESampler,COMPLETE
4707,0.342687839581712,2025-04-24 22:20:41.281364,2025-04-24 22:20:46.155414,0 days 00:00:04.874050,True,squared_error,50,,1,2,603,TPESampler,COMPLETE
4708,0.4267137205562556,2025-04-24 22:20:42.036420,2025-04-24 22:20:46.284475,0 days 00:00:04.248055,True,squared_error,50,,2,2,776,TPESampler,COMPLETE
4709,0.34165928753335095,2025-04-24 22:20:42.530839,2025-04-24 22:20:46.147183,0 days 00:00:03.616344,True,squared_error,50,,1,3,517,TPESampler,COMPLETE
4710,0.4267298750814017,2025-04-24 22:20:43.209661,2025-04-24 22:20:47.041924,0 days 00:00:03.832263,False,squared_error,41,,1,3,502,TPESampler,COMPLETE
4711,0.9593731233217997,2025-04-24 22:20:46.448034,2025-04-24 22:20:50.013443,0 days 00:00:03.565409,True,absolute_error,39,log2,3,49,608,TPESampler,COMPLETE
4712,0.3427141474154724,2025-04-24 22:20:46.520039,2025-04-24 22:20:53.440441,0 days 00:00:06.920402,True,squared_error,50,,1,3,709,TPESampler,COMPLETE
4713,0.4279166923261917,2025-04-24 22:20:46.793376,2025-04-24 22:20:51.925482,0 days 00:00:05.132106,True,squared_error,50,,2,3,584,TPESampler,COMPLETE
4714,0.4278363968163064,2025-04-24 22:20:46.942507,2025-04-24 22:20:50.973960,0 days 00:00:04.031453,True,squared_error,44,,2,4,749,TPESampler,COMPLETE
4715,0.3472854761116869,2025-04-24 22:20:47.572266,2025-04-24 22:20:52.159086,0 days 00:00:04.586820,True,squared_error,50,,1,4,686,TPESampler,COMPLETE
4716,0.34948420472509306,2025-04-24 22:20:50.260819,2025-04-24 22:20:54.748895,0 days 00:00:04.488076,True,squared_error,35,,1,4,705,TPESampler,COMPLETE
4717,0.3463188055909872,2025-04-24 22:20:51.360183,2025-04-24 22:20:55.400576,0 days 00:00:04.040393,True,squared_error,44,,1,4,572,TPESampler,COMPLETE
4718,0.3420899651594021,2025-04-24 22:20:52.258813,2025-04-24 22:20:56.315852,0 days 00:00:04.057039,True,squared_error,43,,1,3,531,TPESampler,COMPLETE
4719,0.34268815668562674,2025-04-24 22:20:52.640537,2025-04-24 22:20:56.564319,0 days 00:00:03.923782,True,squared_error,43,,1,3,518,TPESampler,COMPLETE
4720,0.3480570826339742,2025-04-24 22:20:53.787381,2025-04-24 22:20:55.944015,0 days 00:00:02.156634,True,squared_error,44,,1,4,223,TPESampler,COMPLETE
4721,0.3410177205696887,2025-04-24 22:20:54.603980,2025-04-24 22:20:58.504570,0 days 00:00:03.900590,True,squared_error,50,,1,3,441,TPESampler,COMPLETE
4722,0.3440695740679297,2025-04-24 22:20:55.039535,2025-04-24 22:20:59.950984,0 days 00:00:04.911449,True,squared_error,37,,1,3,620,TPESampler,COMPLETE
4723,0.34481109135775884,2025-04-24 22:20:55.815044,2025-04-24 22:21:01.214332,0 days 00:00:05.399288,True,squared_error,43,,1,2,701,TPESampler,COMPLETE
4724,0.4719443801630408,2025-04-24 22:20:56.416048,2025-04-24 22:20:59.336901,0 days 00:00:02.920853,True,squared_error,50,log2,1,9,663,TPESampler,COMPLETE
4725,0.4278550704758107,2025-04-24 22:20:56.933582,2025-04-24 22:21:00.714401,0 days 00:00:03.780819,True,squared_error,43,,2,2,589,TPESampler,COMPLETE
4726,0.3823877287753212,2025-04-24 22:20:56.935249,2025-04-24 22:20:59.711979,0 days 00:00:02.776730,True,squared_error,44,sqrt,1,4,647,TPESampler,COMPLETE
4727,0.3431600809707671,2025-04-24 22:20:58.752387,2025-04-24 22:21:02.038135,0 days 00:00:03.285748,True,squared_error,43,,1,2,440,TPESampler,COMPLETE
4728,0.4273324370025797,2025-04-24 22:20:59.655580,2025-04-24 22:21:03.302819,0 days 00:00:03.647239,True,squared_error,50,,2,2,519,TPESampler,COMPLETE
4729,0.37705123080004305,2025-04-24 22:21:00.028370,2025-04-24 22:21:04.843314,0 days 00:00:04.814944,True,squared_error,43,,1,8,653,TPESampler,COMPLETE
4730,0.431386281807579,2025-04-24 22:21:00.383535,2025-04-24 22:21:04.437288,0 days 00:00:04.053753,True,squared_error,44,,2,5,626,TPESampler,COMPLETE
4731,0.5964757689169915,2025-04-24 22:21:01.078373,2025-04-24 22:21:04.131665,0 days 00:00:03.053292,True,squared_error,5,,15,6,534,TPESampler,COMPLETE
4732,0.35319035848266606,2025-04-24 22:21:01.818173,2025-04-24 22:21:06.216256,0 days 00:00:04.398083,True,squared_error,43,,1,5,555,TPESampler,COMPLETE
4733,0.3465075211336137,2025-04-24 22:21:02.653792,2025-04-24 22:21:04.788020,0 days 00:00:02.134228,True,squared_error,35,,1,3,211,TPESampler,COMPLETE
4734,0.34186970755584967,2025-04-24 22:21:03.585456,2025-04-24 22:21:07.958091,0 days 00:00:04.372635,True,squared_error,50,,1,3,511,TPESampler,COMPLETE
4735,0.3460825607796362,2025-04-24 22:21:04.444199,2025-04-24 22:21:29.464500,0 days 00:00:25.020301,True,absolute_error,50,,1,3,441,TPESampler,COMPLETE
4736,0.342205940039766,2025-04-24 22:21:04.863602,2025-04-24 22:21:11.557318,0 days 00:00:06.693716,True,squared_error,50,,1,3,824,TPESampler,COMPLETE
4737,0.34696946062321565,2025-04-24 22:21:05.243280,2025-04-24 22:21:10.474331,0 days 00:00:05.231051,True,squared_error,44,,1,4,788,TPESampler,COMPLETE
4738,0.9295303647523322,2025-04-24 22:21:05.418914,2025-04-24 22:21:07.649304,0 days 00:00:02.230390,False,squared_error,21,log2,12,2,804,TPESampler,COMPLETE
4739,0.6233675419729571,2025-04-24 22:21:06.740089,2025-04-24 22:21:08.759633,0 days 00:00:02.019544,False,squared_error,19,,12,3,524,TPESampler,COMPLETE
4740,0.9254999419604364,2025-04-24 22:21:07.911814,2025-04-24 22:21:10.147574,0 days 00:00:02.235760,True,squared_error,45,log2,5,4,589,TPESampler,COMPLETE
4741,0.6539231720856322,2025-04-24 22:21:08.365344,2025-04-24 22:21:13.051932,0 days 00:00:04.686588,True,absolute_error,40,sqrt,2,3,691,TPESampler,COMPLETE
4742,0.34229129734990205,2025-04-24 22:21:09.114826,2025-04-24 22:21:13.323111,0 days 00:00:04.208285,True,squared_error,50,,1,3,681,TPESampler,COMPLETE
4743,0.6694821514689231,2025-04-24 22:21:10.405258,2025-04-24 22:21:11.516714,0 days 00:00:01.111456,False,squared_error,13,sqrt,3,14,120,TPESampler,COMPLETE
4744,0.4273266352664123,2025-04-24 22:21:10.714232,2025-04-24 22:21:13.822410,0 days 00:00:03.108178,True,squared_error,44,,2,3,684,TPESampler,COMPLETE
4745,0.4298524275504376,2025-04-24 22:21:11.787936,2025-04-24 22:21:14.739725,0 days 00:00:02.951789,True,squared_error,50,,2,3,318,TPESampler,COMPLETE
4746,0.34582063052011985,2025-04-24 22:21:11.842545,2025-04-24 22:21:16.655564,0 days 00:00:04.813019,True,squared_error,43,,1,4,593,TPESampler,COMPLETE
4747,0.3430105018751537,2025-04-24 22:21:13.650612,2025-04-24 22:21:18.725160,0 days 00:00:05.074548,True,squared_error,50,,1,3,719,TPESampler,COMPLETE
4748,0.9363025864188823,2025-04-24 22:21:13.724898,2025-04-24 22:21:16.271899,0 days 00:00:02.547001,True,squared_error,27,log2,11,25,989,TPESampler,COMPLETE
4749,0.34577342844803977,2025-04-24 22:21:14.308166,2025-04-24 22:21:18.885648,0 days 00:00:04.577482,True,squared_error,44,,1,4,537,TPESampler,COMPLETE
4750,0.3438518126131058,2025-04-24 22:21:15.210673,2025-04-24 22:21:19.756919,0 days 00:00:04.546246,True,squared_error,50,,1,2,521,TPESampler,COMPLETE
4751,0.3769638764755963,2025-04-24 22:21:16.718393,2025-04-24 22:21:20.114761,0 days 00:00:03.396368,True,squared_error,50,,1,8,619,TPESampler,COMPLETE
4752,0.35526304254718155,2025-04-24 22:21:16.951223,2025-04-24 22:21:21.802884,0 days 00:00:04.851661,True,squared_error,42,,1,5,750,TPESampler,COMPLETE
4753,0.3530890148004528,2025-04-24 22:21:18.994136,2025-04-24 22:21:23.079569,0 days 00:00:04.085433,True,squared_error,50,,1,5,564,TPESampler,COMPLETE
4754,0.35451516413504797,2025-04-24 22:21:19.160037,2025-04-24 22:21:22.708302,0 days 00:00:03.548265,True,squared_error,43,,1,5,495,TPESampler,COMPLETE
4755,0.34154049173046136,2025-04-24 22:21:20.078845,2025-04-24 22:21:24.419043,0 days 00:00:04.340198,True,squared_error,50,,1,3,569,TPESampler,COMPLETE
4756,0.35246944346706877,2025-04-24 22:21:20.528733,2025-04-24 22:21:23.843037,0 days 00:00:03.314304,True,squared_error,50,,1,5,582,TPESampler,COMPLETE
4757,0.3427435547987903,2025-04-24 22:21:22.075296,2025-04-24 22:21:25.834536,0 days 00:00:03.759240,True,squared_error,43,,1,3,475,TPESampler,COMPLETE
4758,0.42742356707377455,2025-04-24 22:21:23.323420,2025-04-24 22:21:27.279815,0 days 00:00:03.956395,True,squared_error,50,,2,4,676,TPESampler,COMPLETE
4759,0.3430074216900146,2025-04-24 22:21:23.682418,2025-04-24 22:21:28.460242,0 days 00:00:04.777824,True,squared_error,43,,1,2,602,TPESampler,COMPLETE
4760,0.34203555312732054,2025-04-24 22:21:24.361995,2025-04-24 22:21:27.310064,0 days 00:00:02.948069,True,squared_error,50,,1,3,400,TPESampler,COMPLETE
4761,0.34352342233585603,2025-04-24 22:21:24.898673,2025-04-24 22:21:28.110894,0 days 00:00:03.212221,True,squared_error,50,,1,2,376,TPESampler,COMPLETE
4762,0.4328686376548347,2025-04-24 22:21:26.142053,2025-04-24 22:21:28.360681,0 days 00:00:02.218628,True,squared_error,43,,2,5,423,TPESampler,COMPLETE
4763,0.3429570887761166,2025-04-24 22:21:27.485889,2025-04-24 22:21:32.028531,0 days 00:00:04.542642,True,squared_error,44,,1,3,559,TPESampler,COMPLETE
4764,0.42948469325069444,2025-04-24 22:21:27.533494,2025-04-24 22:21:30.769602,0 days 00:00:03.236108,True,squared_error,50,,2,3,383,TPESampler,COMPLETE
4765,0.9255586425154604,2025-04-24 22:21:28.427012,2025-04-24 22:21:31.721498,0 days 00:00:03.294486,True,absolute_error,50,log2,2,30,507,TPESampler,COMPLETE
4766,0.34206987393895655,2025-04-24 22:21:28.768925,2025-04-24 22:21:34.047646,0 days 00:00:05.278721,True,squared_error,50,,1,3,646,TPESampler,COMPLETE
4767,0.34966123557951156,2025-04-24 22:21:29.213273,2025-04-24 22:22:04.349602,0 days 00:00:35.136329,True,absolute_error,41,,1,4,619,TPESampler,COMPLETE
4768,0.34402870011229214,2025-04-24 22:21:29.740729,2025-04-24 22:21:35.114849,0 days 00:00:05.374120,True,squared_error,44,,1,3,719,TPESampler,COMPLETE
4769,0.44851738881095904,2025-04-24 22:21:31.285645,2025-04-24 22:21:36.551259,0 days 00:00:05.265614,False,squared_error,38,,2,4,846,TPESampler,COMPLETE
4770,0.4252143848993506,2025-04-24 22:21:31.958891,2025-04-24 22:21:36.335995,0 days 00:00:04.377104,True,squared_error,50,,2,3,831,TPESampler,COMPLETE
4771,0.34669548605198935,2025-04-24 22:21:32.700570,2025-04-24 22:21:36.133497,0 days 00:00:03.432927,True,squared_error,50,,1,4,562,TPESampler,COMPLETE
4772,0.42733998706461096,2025-04-24 22:21:34.298093,2025-04-24 22:21:37.544221,0 days 00:00:03.246128,True,squared_error,50,,2,2,677,TPESampler,COMPLETE
4773,0.9416949077398098,2025-04-24 22:21:35.362509,2025-04-24 22:21:36.374270,0 days 00:00:01.011761,True,squared_error,46,log2,9,3,131,TPESampler,COMPLETE
4774,0.3430282975471682,2025-04-24 22:21:36.423244,2025-04-24 22:21:41.625688,0 days 00:00:05.202444,True,squared_error,50,,1,2,610,TPESampler,COMPLETE
4775,0.34410910844444276,2025-04-24 22:21:36.696821,2025-04-24 22:21:41.286325,0 days 00:00:04.589504,True,squared_error,44,,1,2,623,TPESampler,COMPLETE
4776,0.9181125856362942,2025-04-24 22:21:36.822237,2025-04-24 22:21:40.158526,0 days 00:00:03.336289,True,squared_error,14,log2,4,46,721,TPESampler,COMPLETE
4777,0.35482003092252756,2025-04-24 22:21:37.156806,2025-04-24 22:21:42.891763,0 days 00:00:05.734957,True,squared_error,50,,1,5,735,TPESampler,COMPLETE
4778,0.376863508164801,2025-04-24 22:21:38.268976,2025-04-24 22:21:41.619557,0 days 00:00:03.350581,True,squared_error,50,,1,8,646,TPESampler,COMPLETE
4779,0.3535736147963174,2025-04-24 22:21:40.407887,2025-04-24 22:21:42.952741,0 days 00:00:02.544854,True,squared_error,50,,1,5,360,TPESampler,COMPLETE
4780,0.4296441302723708,2025-04-24 22:21:41.549884,2025-04-24 22:21:44.473615,0 days 00:00:02.923731,True,squared_error,44,,2,2,442,TPESampler,COMPLETE
4781,0.8786944767854022,2025-04-24 22:21:42.015216,2025-04-24 22:21:44.468717,0 days 00:00:02.453501,True,squared_error,45,log2,2,2,681,TPESampler,COMPLETE
4782,0.5460086112677295,2025-04-24 22:21:42.020202,2025-04-24 22:21:53.635115,0 days 00:00:11.614913,True,absolute_error,12,,5,20,938,TPESampler,COMPLETE
4783,0.43441694572561323,2025-04-24 22:21:43.506997,2025-04-24 22:21:44.956488,0 days 00:00:01.449491,True,squared_error,49,log2,1,3,184,TPESampler,COMPLETE
4784,0.3877583681263981,2025-04-24 22:21:43.855242,2025-04-24 22:21:46.128427,0 days 00:00:02.273185,True,squared_error,41,sqrt,1,4,438,TPESampler,COMPLETE
4785,0.4269259597816843,2025-04-24 22:21:44.682277,2025-04-24 22:21:47.895252,0 days 00:00:03.212975,True,squared_error,41,,2,4,539,TPESampler,COMPLETE
4786,0.34277437286703744,2025-04-24 22:21:44.729573,2025-04-24 22:21:49.449059,0 days 00:00:04.719486,True,squared_error,43,,1,3,671,TPESampler,COMPLETE
4787,0.4305984917194279,2025-04-24 22:21:45.341602,2025-04-24 22:21:49.183562,0 days 00:00:03.841960,True,squared_error,44,,2,5,601,TPESampler,COMPLETE
4788,0.8805107573683048,2025-04-24 22:21:46.446822,2025-04-24 22:21:48.285062,0 days 00:00:01.838240,True,squared_error,50,log2,2,3,620,TPESampler,COMPLETE
4789,0.34511341844912796,2025-04-24 22:21:48.147661,2025-04-24 22:21:52.911894,0 days 00:00:04.764233,True,squared_error,50,,1,2,745,TPESampler,COMPLETE
4790,0.341775342066267,2025-04-24 22:21:48.559757,2025-04-24 22:21:51.861017,0 days 00:00:03.301260,True,squared_error,50,,1,3,405,TPESampler,COMPLETE
4791,0.5627150103978877,2025-04-24 22:21:49.490031,2025-04-24 22:21:56.514562,0 days 00:00:07.024531,True,absolute_error,17,sqrt,1,14,910,TPESampler,COMPLETE
4792,0.34208644269290517,2025-04-24 22:21:49.781720,2025-04-24 22:21:52.892644,0 days 00:00:03.110924,True,squared_error,43,,1,3,528,TPESampler,COMPLETE
4793,0.36173904118362066,2025-04-24 22:21:52.123014,2025-04-24 22:21:55.234831,0 days 00:00:03.111817,True,squared_error,43,,1,6,496,TPESampler,COMPLETE
4794,0.34355895266483993,2025-04-24 22:21:53.161468,2025-04-24 22:21:56.784122,0 days 00:00:03.622654,True,squared_error,43,,1,2,489,TPESampler,COMPLETE
4795,0.3444552241762487,2025-04-24 22:21:53.210759,2025-04-24 22:21:57.903551,0 days 00:00:04.692792,True,squared_error,50,,1,2,674,TPESampler,COMPLETE
4796,0.930364910227433,2025-04-24 22:21:53.990662,2025-04-24 22:21:55.152869,0 days 00:00:01.162207,False,squared_error,34,sqrt,14,14,109,TPESampler,COMPLETE
4797,0.8354432587120616,2025-04-24 22:21:55.372139,2025-04-24 22:21:58.981473,0 days 00:00:03.609334,True,squared_error,17,sqrt,4,27,838,TPESampler,COMPLETE
4798,0.6036369470933894,2025-04-24 22:21:55.548485,2025-04-24 22:21:59.364137,0 days 00:00:03.815652,True,squared_error,6,,8,44,815,TPESampler,COMPLETE
4799,0.3435851769940302,2025-04-24 22:21:57.112075,2025-04-24 22:22:01.256866,0 days 00:00:04.144791,True,squared_error,44,,1,3,674,TPESampler,COMPLETE
4800,0.3442365925340804,2025-04-24 22:21:57.310292,2025-04-24 22:22:02.078594,0 days 00:00:04.768302,True,squared_error,50,,1,2,509,TPESampler,COMPLETE
4801,0.3530839171051389,2025-04-24 22:21:58.356828,2025-04-24 22:22:01.069594,0 days 00:00:02.712766,True,squared_error,36,,1,5,451,TPESampler,COMPLETE
4802,0.4523095956056852,2025-04-24 22:21:59.315714,2025-04-24 22:22:01.509369,0 days 00:00:02.193655,False,squared_error,46,log2,1,3,456,TPESampler,COMPLETE
4803,0.4604810237090425,2025-04-24 22:21:59.703604,2025-04-24 22:22:01.849128,0 days 00:00:02.145524,True,squared_error,45,log2,1,4,508,TPESampler,COMPLETE
4804,0.35233982801030256,2025-04-24 22:22:01.322051,2025-04-24 22:22:05.213065,0 days 00:00:03.891014,True,squared_error,50,,1,5,553,TPESampler,COMPLETE
4805,0.6346028716447163,2025-04-24 22:22:01.672309,2025-04-24 22:22:04.539814,0 days 00:00:02.867505,False,squared_error,50,,8,47,602,TPESampler,COMPLETE
4806,0.34075810833057363,2025-04-24 22:22:01.801085,2025-04-24 22:22:06.339907,0 days 00:00:04.538822,True,squared_error,50,,1,3,540,TPESampler,COMPLETE
