number,value,datetime_start,datetime_complete,duration,params_bootstrap,params_criterion,params_max_depth,params_max_features,params_min_samples_leaf,params_min_samples_split,params_n_estimators,system_attrs_auto:sampler,state
1133,0.34460726203184777,2025-04-24 21:31:42.690022,2025-04-24 21:31:46.116754,0 days 00:00:03.426732,True,squared_error,41,,1,2,657,TPESampler,COMPLETE
1134,0.34720305223067766,2025-04-24 21:31:44.003697,2025-04-24 21:31:47.014150,0 days 00:00:03.010453,True,squared_error,50,,1,4,507,TPESampler,COMPLETE
1135,0.34525399134545187,2025-04-24 21:31:45.394558,2025-04-24 21:31:50.033570,0 days 00:00:04.639012,True,squared_error,43,,1,2,742,TPESampler,COMPLETE
1136,0.42810667128446933,2025-04-24 21:31:46.293779,2025-04-24 21:31:48.740441,0 days 00:00:02.446662,True,squared_error,43,,2,3,621,TPESampler,COMPLETE
1137,0.42751242267348855,2025-04-24 21:31:47.203906,2025-04-24 21:31:50.744862,0 days 00:00:03.540956,True,squared_error,43,,2,3,732,TPESampler,COMPLETE
1138,0.3438518126131058,2025-04-24 21:31:47.771058,2025-04-24 21:31:51.610858,0 days 00:00:03.839800,True,squared_error,50,,1,2,521,TPESampler,COMPLETE
1139,0.3423447669234907,2025-04-24 21:31:48.811874,2025-04-24 21:31:51.839360,0 days 00:00:03.027486,True,squared_error,42,,1,3,549,TPESampler,COMPLETE
1140,0.3440730022588536,2025-04-24 21:31:48.879453,2025-04-24 21:31:51.698335,0 days 00:00:02.818882,True,squared_error,42,,1,2,422,TPESampler,COMPLETE
1141,0.6541821659450557,2025-04-24 21:31:50.224463,2025-04-24 21:31:51.630709,0 days 00:00:01.406246,True,squared_error,49,sqrt,2,7,389,TPESampler,COMPLETE
1142,0.34373793193978175,2025-04-24 21:31:51.021292,2025-04-24 21:31:54.800530,0 days 00:00:03.779238,True,squared_error,50,,1,2,470,TPESampler,COMPLETE
1143,0.3464701163092188,2025-04-24 21:31:51.912378,2025-04-24 21:31:54.625980,0 days 00:00:02.713602,True,squared_error,50,,1,4,459,TPESampler,COMPLETE
1144,0.34337882445491263,2025-04-24 21:31:51.963155,2025-04-24 21:31:56.972156,0 days 00:00:05.009001,True,squared_error,49,,1,3,727,TPESampler,COMPLETE
1145,0.427897540081785,2025-04-24 21:31:51.985901,2025-04-24 21:31:54.877523,0 days 00:00:02.891622,True,squared_error,49,,2,3,588,TPESampler,COMPLETE
1146,0.9343811992050108,2025-04-24 21:31:52.029386,2025-04-24 21:31:53.596939,0 days 00:00:01.567553,False,squared_error,24,log2,15,9,428,TPESampler,COMPLETE
1147,0.34673476258863795,2025-04-24 21:31:53.781980,2025-04-24 21:31:56.915392,0 days 00:00:03.133412,True,squared_error,41,,1,4,558,TPESampler,COMPLETE
1148,0.4270949108853321,2025-04-24 21:31:54.834494,2025-04-24 21:31:58.050237,0 days 00:00:03.215743,True,squared_error,50,,2,2,667,TPESampler,COMPLETE
1149,0.34256035205171614,2025-04-24 21:31:55.069435,2025-04-24 21:31:59.133099,0 days 00:00:04.063664,True,squared_error,50,,1,3,697,TPESampler,COMPLETE
1150,0.3817680733022175,2025-04-24 21:31:55.142025,2025-04-24 21:31:56.588342,0 days 00:00:01.446317,True,squared_error,46,sqrt,1,2,274,TPESampler,COMPLETE
1151,0.3423486567486652,2025-04-24 21:31:56.775127,2025-04-24 21:32:00.131693,0 days 00:00:03.356566,True,squared_error,44,,1,3,609,TPESampler,COMPLETE
1152,0.42988840559431735,2025-04-24 21:31:57.077697,2025-04-24 21:31:59.288110,0 days 00:00:02.210413,True,squared_error,49,,2,3,372,TPESampler,COMPLETE
1153,0.36109646970071474,2025-04-24 21:31:57.150812,2025-04-24 21:32:00.274017,0 days 00:00:03.123205,True,squared_error,50,,1,6,431,TPESampler,COMPLETE
1154,0.3420627609788463,2025-04-24 21:31:58.271159,2025-04-24 21:32:00.702049,0 days 00:00:02.430890,True,squared_error,42,,1,3,417,TPESampler,COMPLETE
1155,0.9222923879424172,2025-04-24 21:31:59.310618,2025-04-24 21:32:01.419024,0 days 00:00:02.108406,True,absolute_error,50,log2,2,6,497,TPESampler,COMPLETE
1156,0.9139830807450299,2025-04-24 21:31:59.501321,2025-04-24 21:32:01.820356,0 days 00:00:02.319035,True,squared_error,21,sqrt,12,43,798,TPESampler,COMPLETE
1157,0.34080433411032884,2025-04-24 21:32:00.447972,2025-04-24 21:32:04.272423,0 days 00:00:03.824451,True,squared_error,50,,1,3,602,TPESampler,COMPLETE
1158,0.3469781761754069,2025-04-24 21:32:00.779608,2025-04-24 21:32:05.232031,0 days 00:00:04.452423,True,squared_error,50,,1,4,643,TPESampler,COMPLETE
1159,0.4418865076985622,2025-04-24 21:32:01.038123,2025-04-24 21:32:03.615491,0 days 00:00:02.577368,False,squared_error,19,,1,6,408,TPESampler,COMPLETE
1160,0.34274909681915544,2025-04-24 21:32:01.418140,2025-04-24 21:32:04.090622,0 days 00:00:02.672482,True,squared_error,43,,1,3,371,TPESampler,COMPLETE
1161,0.4652407410312208,2025-04-24 21:32:01.747441,2025-04-24 21:32:24.635649,0 days 00:00:22.888208,True,absolute_error,17,,2,13,914,TPESampler,COMPLETE
1162,0.4285077274622157,2025-04-24 21:32:02.269162,2025-04-24 21:32:04.783497,0 days 00:00:02.514335,True,squared_error,50,,2,3,478,TPESampler,COMPLETE
1163,0.3407867816395502,2025-04-24 21:32:03.796800,2025-04-24 21:32:07.368039,0 days 00:00:03.571239,True,squared_error,50,,1,3,589,TPESampler,COMPLETE
1164,0.34424190290613654,2025-04-24 21:32:04.326443,2025-04-24 21:32:07.643550,0 days 00:00:03.317107,True,squared_error,50,,1,2,483,TPESampler,COMPLETE
1165,0.3419959252776409,2025-04-24 21:32:04.682022,2025-04-24 21:32:08.919980,0 days 00:00:04.237958,True,squared_error,50,,1,3,659,TPESampler,COMPLETE
1166,0.3715985726125757,2025-04-24 21:32:05.041543,2025-04-24 21:32:06.680055,0 days 00:00:01.638512,False,squared_error,50,sqrt,1,2,284,TPESampler,COMPLETE
1167,0.3470288513588826,2025-04-24 21:32:05.516111,2025-04-24 21:32:07.786109,0 days 00:00:02.269998,True,squared_error,50,,1,4,323,TPESampler,COMPLETE
1168,0.34161295363608446,2025-04-24 21:32:06.861536,2025-04-24 21:32:09.350068,0 days 00:00:02.488532,True,squared_error,50,,1,3,375,TPESampler,COMPLETE
1169,0.5530721972200043,2025-04-24 21:32:07.570111,2025-04-24 21:32:09.247628,0 days 00:00:01.677517,False,squared_error,7,,2,40,305,TPESampler,COMPLETE
1170,0.34785970340959377,2025-04-24 21:32:07.910077,2025-04-24 21:32:12.169531,0 days 00:00:04.259454,True,squared_error,42,,1,4,689,TPESampler,COMPLETE
1171,0.39857653747426075,2025-04-24 21:32:08.024481,2025-04-24 21:32:10.355670,0 days 00:00:02.331189,True,squared_error,41,sqrt,1,5,859,TPESampler,COMPLETE
1172,0.34128678320829586,2025-04-24 21:32:09.339590,2025-04-24 21:32:13.815020,0 days 00:00:04.475430,True,squared_error,45,,1,3,622,TPESampler,COMPLETE
1173,0.3697101921962234,2025-04-24 21:32:09.609634,2025-04-24 21:32:13.602478,0 days 00:00:03.992844,True,squared_error,41,,1,7,642,TPESampler,COMPLETE
1174,0.3414319256027671,2025-04-24 21:32:09.753532,2025-04-24 21:32:13.810748,0 days 00:00:04.057216,True,squared_error,50,,1,3,553,TPESampler,COMPLETE
1175,0.916798327105105,2025-04-24 21:32:11.024102,2025-04-24 21:32:11.918645,0 days 00:00:00.894543,True,squared_error,34,sqrt,11,5,197,TPESampler,COMPLETE
1176,0.34757788106601756,2025-04-24 21:32:12.099685,2025-04-24 21:32:15.688329,0 days 00:00:03.588644,True,squared_error,48,,1,4,681,TPESampler,COMPLETE
1177,0.3431679321664077,2025-04-24 21:32:12.377281,2025-04-24 21:32:16.598131,0 days 00:00:04.220850,True,squared_error,50,,1,3,726,TPESampler,COMPLETE
1178,0.34423583434801336,2025-04-24 21:32:13.782431,2025-04-24 21:32:17.584602,0 days 00:00:03.802171,True,squared_error,43,,1,2,646,TPESampler,COMPLETE
1179,0.3448119131885244,2025-04-24 21:32:13.964990,2025-04-24 21:32:17.973816,0 days 00:00:04.008826,True,squared_error,42,,1,2,627,TPESampler,COMPLETE
1180,0.34328753106471466,2025-04-24 21:32:14.025162,2025-04-24 21:32:17.972350,0 days 00:00:03.947188,True,squared_error,50,,1,2,579,TPESampler,COMPLETE
1181,0.427552336203093,2025-04-24 21:32:15.865963,2025-04-24 21:32:18.602323,0 days 00:00:02.736360,True,squared_error,50,,2,3,599,TPESampler,COMPLETE
1182,0.35350587583185406,2025-04-24 21:32:16.783628,2025-04-24 21:32:20.141573,0 days 00:00:03.357945,True,squared_error,49,,1,5,563,TPESampler,COMPLETE
1183,0.345847091097066,2025-04-24 21:32:17.782015,2025-04-24 21:32:20.983346,0 days 00:00:03.201331,True,squared_error,50,,1,4,587,TPESampler,COMPLETE
1184,0.43683569246726944,2025-04-24 21:32:18.125055,2025-04-24 21:32:21.459956,0 days 00:00:03.334901,True,squared_error,44,,2,6,611,TPESampler,COMPLETE
1185,0.34089084959334304,2025-04-24 21:32:18.183725,2025-04-24 21:32:22.222119,0 days 00:00:04.038394,True,squared_error,50,,1,3,603,TPESampler,COMPLETE
1186,0.3422472065632608,2025-04-24 21:32:18.784555,2025-04-24 21:32:22.007018,0 days 00:00:03.222463,True,squared_error,43,,1,3,552,TPESampler,COMPLETE
1187,0.42751618314516354,2025-04-24 21:32:20.343749,2025-04-24 21:32:23.728431,0 days 00:00:03.384682,True,squared_error,49,,2,4,652,TPESampler,COMPLETE
1188,0.3605996337819954,2025-04-24 21:32:21.159685,2025-04-24 21:32:24.343087,0 days 00:00:03.183402,True,squared_error,50,,1,6,548,TPESampler,COMPLETE
1189,0.3426065739337236,2025-04-24 21:32:21.704714,2025-04-24 21:32:25.781578,0 days 00:00:04.076864,True,squared_error,50,,1,2,595,TPESampler,COMPLETE
1190,0.9673865941747339,2025-04-24 21:32:22.210334,2025-04-24 21:32:23.912531,0 days 00:00:01.702197,False,absolute_error,31,log2,7,34,994,TPESampler,COMPLETE
1191,0.3425712221211035,2025-04-24 21:32:22.614489,2025-04-24 21:32:27.054797,0 days 00:00:04.440308,True,squared_error,50,,1,3,780,TPESampler,COMPLETE
1192,0.3457400959461984,2025-04-24 21:32:23.916732,2025-04-24 21:32:27.755143,0 days 00:00:03.838411,True,squared_error,43,,1,4,592,TPESampler,COMPLETE
1193,0.34282677130107864,2025-04-24 21:32:24.114714,2025-04-24 21:32:28.262316,0 days 00:00:04.147602,True,squared_error,50,,1,2,609,TPESampler,COMPLETE
1194,0.34166122879129873,2025-04-24 21:32:24.669834,2025-04-24 21:32:28.165385,0 days 00:00:03.495551,True,squared_error,50,,1,3,516,TPESampler,COMPLETE
1195,0.34206987393895655,2025-04-24 21:32:25.035032,2025-04-24 21:32:29.418377,0 days 00:00:04.383345,True,squared_error,50,,1,3,646,TPESampler,COMPLETE
1196,0.37593933668345425,2025-04-24 21:32:26.391826,2025-04-24 21:32:29.245242,0 days 00:00:02.853416,True,squared_error,50,sqrt,1,4,634,TPESampler,COMPLETE
1197,0.3469461030756141,2025-04-24 21:32:27.271130,2025-04-24 21:33:01.648191,0 days 00:00:34.377061,True,absolute_error,47,,1,3,646,TPESampler,COMPLETE
1198,0.8954276684539262,2025-04-24 21:32:27.957590,2025-04-24 21:32:29.818694,0 days 00:00:01.861104,True,squared_error,45,sqrt,7,32,843,TPESampler,COMPLETE
1199,0.42928248611259845,2025-04-24 21:32:28.401215,2025-04-24 21:32:32.563451,0 days 00:00:04.162236,False,squared_error,49,,1,2,494,TPESampler,COMPLETE
1200,0.4267820841926691,2025-04-24 21:32:28.462824,2025-04-24 21:32:31.554056,0 days 00:00:03.091232,True,squared_error,31,,2,3,536,TPESampler,COMPLETE
1201,0.34750725691076173,2025-04-24 21:32:29.648972,2025-04-24 21:32:33.232416,0 days 00:00:03.583444,True,squared_error,50,,1,4,695,TPESampler,COMPLETE
1202,0.34454085724772116,2025-04-24 21:32:29.800437,2025-04-24 21:32:32.484598,0 days 00:00:02.684161,True,squared_error,50,,1,2,369,TPESampler,COMPLETE
1203,0.42733998706461096,2025-04-24 21:32:30.023666,2025-04-24 21:32:32.957960,0 days 00:00:02.934294,True,squared_error,50,,2,3,677,TPESampler,COMPLETE
1204,0.4295479726031605,2025-04-24 21:32:31.737758,2025-04-24 21:32:34.326867,0 days 00:00:02.589109,True,squared_error,41,,2,4,439,TPESampler,COMPLETE
1205,0.3440066578253306,2025-04-24 21:32:32.637480,2025-04-24 21:32:36.442839,0 days 00:00:03.805359,True,squared_error,42,,1,2,546,TPESampler,COMPLETE
1206,0.46764637513668755,2025-04-24 21:32:32.705493,2025-04-24 21:32:35.947412,0 days 00:00:03.241919,True,absolute_error,47,log2,1,2,343,TPESampler,COMPLETE
1207,0.9206773960422876,2025-04-24 21:32:33.148809,2025-04-24 21:32:34.257728,0 days 00:00:01.108919,False,squared_error,36,sqrt,14,47,267,TPESampler,COMPLETE
1208,0.44586045193287654,2025-04-24 21:32:33.535688,2025-04-24 21:32:44.081038,0 days 00:00:10.545350,True,absolute_error,42,,2,2,386,TPESampler,COMPLETE
1209,0.3690729013008483,2025-04-24 21:32:34.571989,2025-04-24 21:32:38.370271,0 days 00:00:03.798282,True,squared_error,50,,1,7,695,TPESampler,COMPLETE
1210,0.35421888803995527,2025-04-24 21:32:34.596157,2025-04-24 21:32:36.895754,0 days 00:00:02.299597,True,squared_error,42,,1,5,455,TPESampler,COMPLETE
1211,0.3616734767694338,2025-04-24 21:32:36.133845,2025-04-24 21:32:58.277747,0 days 00:00:22.143902,True,absolute_error,19,,1,2,452,TPESampler,COMPLETE
1212,0.3419055852338512,2025-04-24 21:32:36.627606,2025-04-24 21:32:39.850912,0 days 00:00:03.223306,True,squared_error,50,,1,3,484,TPESampler,COMPLETE
1213,0.9173009270454536,2025-04-24 21:32:37.101102,2025-04-24 21:32:37.961573,0 days 00:00:00.860471,True,squared_error,6,sqrt,10,8,219,TPESampler,COMPLETE
1214,0.341691646608622,2025-04-24 21:32:38.136385,2025-04-24 21:32:41.072686,0 days 00:00:02.936301,True,squared_error,49,,1,3,560,TPESampler,COMPLETE
1215,0.6553724784241713,2025-04-24 21:32:38.578612,2025-04-24 21:32:40.355303,0 days 00:00:01.776691,True,squared_error,22,sqrt,2,18,776,TPESampler,COMPLETE
1216,0.42738140860591695,2025-04-24 21:32:40.047051,2025-04-24 21:32:42.611468,0 days 00:00:02.564417,True,squared_error,43,,2,3,547,TPESampler,COMPLETE
1217,0.34970565325134934,2025-04-24 21:32:40.566462,2025-04-24 21:33:08.696121,0 days 00:00:28.129659,True,absolute_error,50,,1,4,444,TPESampler,COMPLETE
1218,0.4731481821866321,2025-04-24 21:32:41.628549,2025-04-24 21:32:43.066576,0 days 00:00:01.438027,False,squared_error,28,sqrt,1,33,114,TPESampler,COMPLETE
1219,0.3472605426017918,2025-04-24 21:32:42.860410,2025-04-24 21:32:46.008803,0 days 00:00:03.148393,True,squared_error,50,,1,4,638,TPESampler,COMPLETE
1220,0.42885927325938744,2025-04-24 21:32:43.519036,2025-04-24 21:32:46.420646,0 days 00:00:02.901610,True,squared_error,44,,2,2,471,TPESampler,COMPLETE
1221,0.34161982527992824,2025-04-24 21:32:44.515889,2025-04-24 21:32:48.375834,0 days 00:00:03.859945,True,squared_error,50,,1,3,618,TPESampler,COMPLETE
1222,0.4485159518093418,2025-04-24 21:32:46.183388,2025-04-24 21:32:49.383550,0 days 00:00:03.200162,False,squared_error,49,,2,3,607,TPESampler,COMPLETE
1223,0.3466136341552938,2025-04-24 21:32:46.911008,2025-04-24 21:32:50.512140,0 days 00:00:03.601132,True,squared_error,50,,1,4,524,TPESampler,COMPLETE
1224,0.4287865701835015,2025-04-24 21:32:48.551309,2025-04-24 21:32:51.078980,0 days 00:00:02.527671,True,squared_error,49,,2,2,472,TPESampler,COMPLETE
1225,0.3463500280808901,2025-04-24 21:32:49.608635,2025-04-24 21:33:24.639399,0 days 00:00:35.030764,True,absolute_error,50,,1,2,604,TPESampler,COMPLETE
1226,0.3474162393186096,2025-04-24 21:32:51.034577,2025-04-24 21:32:54.646445,0 days 00:00:03.611868,True,squared_error,42,,1,4,575,TPESampler,COMPLETE
1227,0.3446148137164051,2025-04-24 21:32:51.616829,2025-04-24 21:32:54.415494,0 days 00:00:02.798665,True,squared_error,41,,1,2,401,TPESampler,COMPLETE
1228,0.4376452235835705,2025-04-24 21:32:54.711854,2025-04-24 21:32:56.885154,0 days 00:00:02.173300,True,squared_error,46,sqrt,1,26,912,TPESampler,COMPLETE
1229,0.3420507072075086,2025-04-24 21:32:54.824094,2025-04-24 21:32:58.145643,0 days 00:00:03.321549,True,squared_error,50,,1,3,506,TPESampler,COMPLETE
1230,0.5870279005074257,2025-04-24 21:32:57.070596,2025-04-24 21:32:58.907040,0 days 00:00:01.836444,False,squared_error,46,,7,23,456,TPESampler,COMPLETE
1231,0.48028576032252795,2025-04-24 21:32:58.351554,2025-04-24 21:33:00.515503,0 days 00:00:02.163949,True,squared_error,41,log2,1,4,559,TPESampler,COMPLETE
1232,0.34158247242873624,2025-04-24 21:32:58.487832,2025-04-24 21:33:01.681352,0 days 00:00:03.193520,True,squared_error,50,,1,3,560,TPESampler,COMPLETE
1233,0.9057217495200695,2025-04-24 21:32:59.338786,2025-04-24 21:33:01.247017,0 days 00:00:01.908231,True,squared_error,25,log2,3,3,997,TPESampler,COMPLETE
1234,0.42829334884367504,2025-04-24 21:33:00.727230,2025-04-24 21:33:04.098296,0 days 00:00:03.371066,True,squared_error,50,,2,2,641,TPESampler,COMPLETE
1235,0.346802253379654,2025-04-24 21:33:01.448916,2025-04-24 21:33:04.096450,0 days 00:00:02.647534,True,squared_error,41,,1,4,390,TPESampler,COMPLETE
1236,0.34347759545641415,2025-04-24 21:33:01.896406,2025-04-24 21:33:06.363548,0 days 00:00:04.467142,True,squared_error,50,,1,2,617,TPESampler,COMPLETE
1237,0.39554167961844516,2025-04-24 21:33:01.901899,2025-04-24 21:33:03.201053,0 days 00:00:01.299154,True,squared_error,43,sqrt,1,5,409,TPESampler,COMPLETE
1238,0.49760401876471316,2025-04-24 21:33:03.369503,2025-04-24 21:33:06.628371,0 days 00:00:03.258868,False,squared_error,34,,2,33,868,TPESampler,COMPLETE
1239,0.4330952941625997,2025-04-24 21:33:04.255505,2025-04-24 21:33:06.638490,0 days 00:00:02.382985,True,squared_error,50,,2,5,369,TPESampler,COMPLETE
1240,0.9089332253946184,2025-04-24 21:33:04.315911,2025-04-24 21:33:06.342835,0 days 00:00:02.026924,True,squared_error,38,log2,3,27,753,TPESampler,COMPLETE
1241,0.3741032542188471,2025-04-24 21:33:06.499634,2025-04-24 21:33:09.887534,0 days 00:00:03.387900,True,squared_error,26,,1,7,652,TPESampler,COMPLETE
1242,0.34692753226811884,2025-04-24 21:33:06.545432,2025-04-24 21:33:09.948900,0 days 00:00:03.403468,True,squared_error,50,,1,4,484,TPESampler,COMPLETE
1243,0.36931657317756905,2025-04-24 21:33:06.818274,2025-04-24 21:33:10.029973,0 days 00:00:03.211699,True,squared_error,50,,1,7,512,TPESampler,COMPLETE
1244,0.8438240163863637,2025-04-24 21:33:06.844103,2025-04-24 21:33:11.167237,0 days 00:00:04.323134,False,absolute_error,9,log2,1,7,805,TPESampler,COMPLETE
1245,0.7860481039171411,2025-04-24 21:33:08.919607,2025-04-24 21:33:09.810731,0 days 00:00:00.891124,False,squared_error,27,sqrt,5,17,370,TPESampler,COMPLETE
1246,0.34518507647707575,2025-04-24 21:33:10.033585,2025-04-24 21:33:14.031329,0 days 00:00:03.997744,True,squared_error,41,,1,3,734,TPESampler,COMPLETE
1247,0.41534150933481123,2025-04-24 21:33:10.056762,2025-04-24 21:33:15.006302,0 days 00:00:04.949540,False,squared_error,47,,1,4,626,TPESampler,COMPLETE
1248,0.34407140085290044,2025-04-24 21:33:10.122072,2025-04-24 21:33:14.001590,0 days 00:00:03.879518,True,squared_error,43,,1,2,509,TPESampler,COMPLETE
1249,0.341801144224038,2025-04-24 21:33:10.252253,2025-04-24 21:33:14.494047,0 days 00:00:04.241794,True,squared_error,42,,1,3,601,TPESampler,COMPLETE
1250,0.3472233021541197,2025-04-24 21:33:11.511709,2025-04-24 21:33:14.391938,0 days 00:00:02.880229,True,squared_error,42,,1,4,577,TPESampler,COMPLETE
1251,0.3726862734770658,2025-04-24 21:33:14.217695,2025-04-24 21:33:16.802875,0 days 00:00:02.585180,True,squared_error,50,sqrt,1,2,437,TPESampler,COMPLETE
1252,0.34301044475963965,2025-04-24 21:33:14.248867,2025-04-24 21:33:17.771969,0 days 00:00:03.523102,True,squared_error,44,,1,2,437,TPESampler,COMPLETE
1253,0.8791273549119867,2025-04-24 21:33:14.636526,2025-04-24 21:33:16.578844,0 days 00:00:01.942318,True,squared_error,43,log2,2,5,714,TPESampler,COMPLETE
1254,0.9542555876117877,2025-04-24 21:33:14.735776,2025-04-24 21:33:16.744203,0 days 00:00:02.008427,False,absolute_error,37,sqrt,12,3,590,TPESampler,COMPLETE
1255,0.3974373063236061,2025-04-24 21:33:15.399325,2025-04-24 21:33:17.915900,0 days 00:00:02.516575,True,squared_error,38,sqrt,1,2,590,TPESampler,COMPLETE
1256,0.3430532698417839,2025-04-24 21:33:16.766096,2025-04-24 21:33:19.802720,0 days 00:00:03.036624,True,squared_error,43,,1,3,495,TPESampler,COMPLETE
1257,0.34196273359866586,2025-04-24 21:33:16.924818,2025-04-24 21:33:21.117868,0 days 00:00:04.193050,True,squared_error,50,,1,3,627,TPESampler,COMPLETE
1258,0.6134686123653204,2025-04-24 21:33:16.983723,2025-04-24 21:33:18.758512,0 days 00:00:01.774789,True,squared_error,5,,8,18,153,TPESampler,COMPLETE
1259,0.42685196959889943,2025-04-24 21:33:18.030376,2025-04-24 21:33:20.784587,0 days 00:00:02.754211,True,squared_error,50,,2,4,531,TPESampler,COMPLETE
1260,0.34472215053202143,2025-04-24 21:33:18.230856,2025-04-24 21:33:22.660813,0 days 00:00:04.429957,True,squared_error,50,,1,2,697,TPESampler,COMPLETE
1261,0.3467699488280349,2025-04-24 21:33:19.168807,2025-04-24 21:33:21.384018,0 days 00:00:02.215211,True,squared_error,49,,1,2,313,TPESampler,COMPLETE
1262,0.3413249877205611,2025-04-24 21:33:20.029406,2025-04-24 21:33:23.428056,0 days 00:00:03.398650,True,squared_error,50,,1,3,580,TPESampler,COMPLETE
1263,0.34330836008749355,2025-04-24 21:33:21.202005,2025-04-24 21:33:26.650602,0 days 00:00:05.448597,True,squared_error,50,,1,2,936,TPESampler,COMPLETE
1264,0.3605258932969098,2025-04-24 21:33:21.342158,2025-04-24 21:33:24.078542,0 days 00:00:02.736384,True,squared_error,42,,1,6,384,TPESampler,COMPLETE
1265,0.528077335693923,2025-04-24 21:33:21.642305,2025-04-24 21:33:22.692047,0 days 00:00:01.049742,False,squared_error,34,log2,1,3,149,TPESampler,COMPLETE
1266,0.34300273126596215,2025-04-24 21:33:22.813616,2025-04-24 21:33:26.027811,0 days 00:00:03.214195,True,squared_error,42,,1,3,469,TPESampler,COMPLETE
1267,0.4295565882133042,2025-04-24 21:33:22.874553,2025-04-24 21:33:25.611136,0 days 00:00:02.736583,True,squared_error,44,,2,4,453,TPESampler,COMPLETE
1268,0.34448194717821207,2025-04-24 21:33:23.706629,2025-04-24 21:33:26.814448,0 days 00:00:03.107819,True,squared_error,50,,1,2,505,TPESampler,COMPLETE
1269,0.34722551746939606,2025-04-24 21:33:24.322490,2025-04-24 21:33:26.630446,0 days 00:00:02.307956,True,squared_error,50,,1,4,321,TPESampler,COMPLETE
1270,0.3435891308510692,2025-04-24 21:33:24.873545,2025-04-24 21:33:27.146959,0 days 00:00:02.273414,True,squared_error,41,,1,3,374,TPESampler,COMPLETE
1271,0.3537593589437996,2025-04-24 21:33:25.803470,2025-04-24 21:33:30.140636,0 days 00:00:04.337166,True,squared_error,41,,1,5,826,TPESampler,COMPLETE
1272,0.34137947116291373,2025-04-24 21:33:26.259595,2025-04-24 21:33:29.363562,0 days 00:00:03.103967,True,squared_error,50,,1,3,425,TPESampler,COMPLETE
1273,0.4295778297631133,2025-04-24 21:33:26.886739,2025-04-24 21:33:29.629613,0 days 00:00:02.742874,True,squared_error,50,,2,3,446,TPESampler,COMPLETE
