number,value,datetime_start,datetime_complete,duration,params_bootstrap,params_criterion,params_max_depth,params_max_features,params_min_samples_leaf,params_min_samples_split,params_n_estimators,system_attrs_auto:sampler,state
2262,0.4281598332641713,2025-04-24 21:45:59.084144,2025-04-24 21:46:01.812520,0 days 00:00:02.728376,True,squared_error,50,,2,2,493,TPESampler,COMPLETE
2263,0.34731765472229303,2025-04-24 21:45:59.538063,2025-04-24 21:46:02.700463,0 days 00:00:03.162400,True,squared_error,42,,1,4,456,TPESampler,COMPLETE
2264,0.3578909290076073,2025-04-24 21:45:59.827484,2025-04-24 21:46:19.979899,0 days 00:00:20.152415,True,absolute_error,45,,1,5,353,TPESampler,COMPLETE
2265,0.3523407212522323,2025-04-24 21:46:00.496567,2025-04-24 21:46:03.986372,0 days 00:00:03.489805,True,squared_error,50,,1,5,603,TPESampler,COMPLETE
2266,0.3462645002119149,2025-04-24 21:46:00.764528,2025-04-24 21:46:04.218937,0 days 00:00:03.454409,True,squared_error,50,,1,4,573,TPESampler,COMPLETE
2267,0.3414472884080586,2025-04-24 21:46:02.018541,2025-04-24 21:46:05.274790,0 days 00:00:03.256249,True,squared_error,50,,1,3,554,TPESampler,COMPLETE
2268,0.42757088096888424,2025-04-24 21:46:02.927318,2025-04-24 21:46:08.025196,0 days 00:00:05.097878,False,squared_error,40,,1,2,702,TPESampler,COMPLETE
2269,0.34118162799698054,2025-04-24 21:46:04.216501,2025-04-24 21:46:07.113020,0 days 00:00:02.896519,True,squared_error,50,,1,3,439,TPESampler,COMPLETE
2270,0.44780962245530936,2025-04-24 21:46:04.457946,2025-04-24 21:46:07.333761,0 days 00:00:02.875815,False,squared_error,38,,2,5,528,TPESampler,COMPLETE
2271,0.34186970755584967,2025-04-24 21:46:05.495716,2025-04-24 21:46:08.610236,0 days 00:00:03.114520,True,squared_error,50,,1,3,511,TPESampler,COMPLETE
2272,0.8836061658995231,2025-04-24 21:46:07.344961,2025-04-24 21:46:09.243580,0 days 00:00:01.898619,False,squared_error,39,log2,3,14,683,TPESampler,COMPLETE
2273,0.9104175484528318,2025-04-24 21:46:07.559708,2025-04-24 21:46:09.139594,0 days 00:00:01.579886,True,squared_error,48,sqrt,10,46,475,TPESampler,COMPLETE
2274,0.42993652841628555,2025-04-24 21:46:08.269005,2025-04-24 21:46:11.052784,0 days 00:00:02.783779,True,squared_error,50,,2,4,371,TPESampler,COMPLETE
2275,0.4310161198739306,2025-04-24 21:46:09.052584,2025-04-24 21:46:11.726176,0 days 00:00:02.673592,True,squared_error,50,,2,5,489,TPESampler,COMPLETE
2276,0.3449680793732078,2025-04-24 21:46:09.392855,2025-04-24 21:46:13.062713,0 days 00:00:03.669858,True,squared_error,41,,1,2,521,TPESampler,COMPLETE
2277,0.34364857649915287,2025-04-24 21:46:09.698125,2025-04-24 21:46:12.547920,0 days 00:00:02.849795,True,squared_error,50,,1,2,414,TPESampler,COMPLETE
2278,0.9343162245156594,2025-04-24 21:46:11.262692,2025-04-24 21:46:12.961939,0 days 00:00:01.699247,False,squared_error,5,log2,15,6,869,TPESampler,COMPLETE
2279,0.4126152140636528,2025-04-24 21:46:11.955278,2025-04-24 21:46:15.561312,0 days 00:00:03.606034,False,squared_error,44,,1,5,483,TPESampler,COMPLETE
2280,0.3462268878551752,2025-04-24 21:46:12.797615,2025-04-24 21:46:16.303088,0 days 00:00:03.505473,True,squared_error,50,,1,4,617,TPESampler,COMPLETE
2281,0.34540056516058537,2025-04-24 21:46:13.192191,2025-04-24 21:46:41.535627,0 days 00:00:28.343436,True,absolute_error,46,,1,3,491,TPESampler,COMPLETE
2282,0.34279078284743664,2025-04-24 21:46:13.372750,2025-04-24 21:46:17.044453,0 days 00:00:03.671703,True,squared_error,50,,1,2,587,TPESampler,COMPLETE
2283,0.347427309991737,2025-04-24 21:46:15.845270,2025-04-24 21:46:19.564953,0 days 00:00:03.719683,True,squared_error,50,,1,4,678,TPESampler,COMPLETE
2284,0.3477329710323314,2025-04-24 21:46:16.556492,2025-04-24 21:46:20.124523,0 days 00:00:03.568031,True,squared_error,42,,1,4,701,TPESampler,COMPLETE
2285,0.4303619453015526,2025-04-24 21:46:17.284669,2025-04-24 21:46:19.069699,0 days 00:00:01.785030,True,squared_error,50,,2,2,353,TPESampler,COMPLETE
2286,0.6686895448211531,2025-04-24 21:46:19.285425,2025-04-24 21:46:22.589883,0 days 00:00:03.304458,True,absolute_error,49,sqrt,2,35,730,TPESampler,COMPLETE
2287,0.47610984222770797,2025-04-24 21:46:19.790483,2025-04-24 21:47:42.664856,0 days 00:01:22.874373,False,absolute_error,34,,1,29,998,TPESampler,COMPLETE
2288,0.42780159023180275,2025-04-24 21:46:20.406675,2025-04-24 21:46:24.005491,0 days 00:00:03.598816,True,squared_error,47,,2,2,696,TPESampler,COMPLETE
2289,0.342005855662404,2025-04-24 21:46:20.474167,2025-04-24 21:46:23.622857,0 days 00:00:03.148690,True,squared_error,43,,1,3,532,TPESampler,COMPLETE
2290,0.42955844141057004,2025-04-24 21:46:22.795692,2025-04-24 21:46:25.255683,0 days 00:00:02.459991,True,squared_error,42,,2,3,453,TPESampler,COMPLETE
2291,0.3426959900378399,2025-04-24 21:46:23.824075,2025-04-24 21:46:26.218842,0 days 00:00:02.394767,True,squared_error,44,,1,3,437,TPESampler,COMPLETE
2292,0.3439624050142577,2025-04-24 21:46:24.230660,2025-04-24 21:46:28.090207,0 days 00:00:03.859547,True,squared_error,44,,1,2,621,TPESampler,COMPLETE
2293,0.4273892569086771,2025-04-24 21:46:25.470347,2025-04-24 21:46:27.843583,0 days 00:00:02.373236,True,squared_error,50,,2,2,545,TPESampler,COMPLETE
2294,0.3428240690068987,2025-04-24 21:46:26.365048,2025-04-24 21:46:29.837745,0 days 00:00:03.472697,True,squared_error,50,,1,2,545,TPESampler,COMPLETE
2295,0.4347048216741372,2025-04-24 21:46:26.414098,2025-04-24 21:47:03.257212,0 days 00:00:36.843114,False,absolute_error,49,,2,3,778,TPESampler,COMPLETE
2296,0.5901606432975128,2025-04-24 21:46:28.052128,2025-04-24 21:46:41.074402,0 days 00:00:13.022274,False,absolute_error,24,,6,11,818,TPESampler,COMPLETE
2297,0.34193918551801383,2025-04-24 21:46:28.426549,2025-04-24 21:46:30.979613,0 days 00:00:02.553064,True,squared_error,42,,1,3,419,TPESampler,COMPLETE
2298,0.36068131356645294,2025-04-24 21:46:30.039589,2025-04-24 21:46:32.828519,0 days 00:00:02.788930,True,squared_error,50,,1,6,600,TPESampler,COMPLETE
2299,0.3436344983654923,2025-04-24 21:46:31.176354,2025-04-24 21:46:33.909244,0 days 00:00:02.732890,True,squared_error,50,,1,2,472,TPESampler,COMPLETE
2300,0.3711729742390229,2025-04-24 21:46:33.023574,2025-04-24 21:46:34.715853,0 days 00:00:01.692279,True,squared_error,40,,1,7,303,TPESampler,COMPLETE
2301,0.42743374848101096,2025-04-24 21:46:34.108491,2025-04-24 21:46:37.054576,0 days 00:00:02.946085,True,squared_error,44,,2,4,739,TPESampler,COMPLETE
2302,0.4316375261621926,2025-04-24 21:46:34.921236,2025-04-24 21:46:37.316603,0 days 00:00:02.395367,True,squared_error,50,,2,5,569,TPESampler,COMPLETE
2303,0.34571084466645347,2025-04-24 21:46:37.253381,2025-04-24 21:46:40.076806,0 days 00:00:02.823425,True,squared_error,44,,1,4,543,TPESampler,COMPLETE
2304,0.8794948645993278,2025-04-24 21:46:37.597818,2025-04-24 21:46:38.912712,0 days 00:00:01.314894,True,squared_error,50,log2,2,4,602,TPESampler,COMPLETE
2305,0.3431651830632041,2025-04-24 21:46:39.112709,2025-04-24 21:46:42.121547,0 days 00:00:03.008838,True,squared_error,50,,1,2,536,TPESampler,COMPLETE
2306,0.3413249877205611,2025-04-24 21:46:40.272056,2025-04-24 21:46:44.138580,0 days 00:00:03.866524,True,squared_error,50,,1,3,580,TPESampler,COMPLETE
2307,0.34456958935882154,2025-04-24 21:46:41.285639,2025-04-24 21:46:45.896198,0 days 00:00:04.610559,True,squared_error,43,,1,2,674,TPESampler,COMPLETE
2308,0.34225933496456346,2025-04-24 21:46:41.853364,2025-04-24 21:46:46.718569,0 days 00:00:04.865205,True,squared_error,50,,1,3,795,TPESampler,COMPLETE
2309,0.34223000061779235,2025-04-24 21:46:42.410014,2025-04-24 21:46:45.801499,0 days 00:00:03.391485,True,squared_error,50,,1,3,684,TPESampler,COMPLETE
2310,0.3420785785339546,2025-04-24 21:46:44.383474,2025-04-24 21:46:46.791798,0 days 00:00:02.408324,True,squared_error,50,,1,3,359,TPESampler,COMPLETE
2311,0.34200579665032954,2025-04-24 21:46:46.009626,2025-04-24 21:46:49.268471,0 days 00:00:03.258845,True,squared_error,50,,1,3,647,TPESampler,COMPLETE
2312,0.3469605283905361,2025-04-24 21:46:46.116933,2025-04-24 21:46:49.699207,0 days 00:00:03.582274,True,squared_error,43,,1,4,519,TPESampler,COMPLETE
2313,0.42829334884367504,2025-04-24 21:46:47.086530,2025-04-24 21:46:50.517388,0 days 00:00:03.430858,True,squared_error,50,,2,3,641,TPESampler,COMPLETE
2314,0.3684823972409073,2025-04-24 21:46:47.145280,2025-04-24 21:46:50.811824,0 days 00:00:03.666544,True,squared_error,42,,1,7,550,TPESampler,COMPLETE
2315,0.3458922464919114,2025-04-24 21:46:49.478407,2025-04-24 21:47:23.133170,0 days 00:00:33.654763,True,absolute_error,50,,1,3,640,TPESampler,COMPLETE
2316,0.36032777477444733,2025-04-24 21:46:49.926102,2025-04-24 21:46:53.036264,0 days 00:00:03.110162,True,squared_error,50,,1,6,419,TPESampler,COMPLETE
2317,0.3497441620905786,2025-04-24 21:46:50.902684,2025-04-24 21:46:52.736862,0 days 00:00:01.834178,True,squared_error,50,,1,3,152,TPESampler,COMPLETE
2318,0.34196608383517535,2025-04-24 21:46:51.123810,2025-04-24 21:46:55.186116,0 days 00:00:04.062306,True,squared_error,50,,1,3,509,TPESampler,COMPLETE
2319,0.665470853038237,2025-04-24 21:46:52.953879,2025-04-24 21:46:57.460936,0 days 00:00:04.507057,False,absolute_error,34,sqrt,3,6,808,TPESampler,COMPLETE
2320,0.3445194728582002,2025-04-24 21:46:53.346753,2025-04-24 21:46:58.033050,0 days 00:00:04.686297,True,squared_error,34,,1,3,761,TPESampler,COMPLETE
2321,0.4117714393630814,2025-04-24 21:46:55.398340,2025-04-24 21:47:00.175918,0 days 00:00:04.777578,True,squared_error,46,,1,15,965,TPESampler,COMPLETE
2322,0.3469898691426622,2025-04-24 21:46:57.690067,2025-04-24 21:47:00.729602,0 days 00:00:03.039535,True,squared_error,43,,1,4,477,TPESampler,COMPLETE
2323,0.3556692205741465,2025-04-24 21:46:58.297355,2025-04-24 21:47:02.606115,0 days 00:00:04.308760,True,squared_error,42,,1,5,738,TPESampler,COMPLETE
2324,0.3452836881651903,2025-04-24 21:47:00.381603,2025-04-24 21:47:03.428513,0 days 00:00:03.046910,True,squared_error,42,,1,2,387,TPESampler,COMPLETE
2325,0.42734266276443567,2025-04-24 21:47:01.015319,2025-04-24 21:47:03.923261,0 days 00:00:02.907942,True,squared_error,43,,2,2,521,TPESampler,COMPLETE
2326,0.427900117880775,2025-04-24 21:47:02.827889,2025-04-24 21:47:06.520341,0 days 00:00:03.692452,True,squared_error,43,,2,3,588,TPESampler,COMPLETE
2327,0.6123574765295013,2025-04-24 21:47:03.588432,2025-04-24 21:47:06.352516,0 days 00:00:02.764084,True,absolute_error,49,,14,2,526,TPESampler,COMPLETE
2328,0.6451172419500786,2025-04-24 21:47:03.844660,2025-04-24 21:47:06.376897,0 days 00:00:02.532237,True,squared_error,41,sqrt,2,2,730,TPESampler,COMPLETE
2329,0.3718379229083072,2025-04-24 21:47:04.222388,2025-04-24 21:47:06.823581,0 days 00:00:02.601193,True,squared_error,49,sqrt,1,3,572,TPESampler,COMPLETE
2330,0.3462845511338095,2025-04-24 21:47:06.576784,2025-04-24 21:47:09.727140,0 days 00:00:03.150356,True,squared_error,50,,1,4,568,TPESampler,COMPLETE
2331,0.9581129612531448,2025-04-24 21:47:06.598800,2025-04-24 21:47:08.324540,0 days 00:00:01.725740,False,absolute_error,13,log2,4,50,193,TPESampler,COMPLETE
2332,0.34506642732531917,2025-04-24 21:47:06.788810,2025-04-24 21:47:11.821259,0 days 00:00:05.032449,True,squared_error,50,,1,2,717,TPESampler,COMPLETE
2333,0.44849658062126485,2025-04-24 21:47:07.262752,2025-04-24 21:47:11.068608,0 days 00:00:03.805856,False,squared_error,40,,2,3,554,TPESampler,COMPLETE
2334,0.3409227414643666,2025-04-24 21:47:08.691441,2025-04-24 21:47:11.311016,0 days 00:00:02.619575,True,squared_error,50,,1,3,444,TPESampler,COMPLETE
2335,0.4123186852656614,2025-04-24 21:47:09.935932,2025-04-24 21:47:14.216321,0 days 00:00:04.280389,False,squared_error,50,,1,4,633,TPESampler,COMPLETE
2336,0.49430741473367,2025-04-24 21:47:11.270487,2025-04-24 21:47:13.712464,0 days 00:00:02.441977,True,squared_error,42,log2,1,6,598,TPESampler,COMPLETE
2337,0.3435559017879393,2025-04-24 21:47:11.697055,2025-04-24 21:47:15.474089,0 days 00:00:03.777034,True,squared_error,42,,1,3,504,TPESampler,COMPLETE
2338,0.603647511884808,2025-04-24 21:47:12.411228,2025-04-24 21:47:26.964385,0 days 00:00:14.553157,False,absolute_error,9,,3,28,501,TPESampler,COMPLETE
2339,0.3529378461341259,2025-04-24 21:47:13.925141,2025-04-24 21:47:16.666974,0 days 00:00:02.741833,True,squared_error,50,,1,5,435,TPESampler,COMPLETE
2340,0.43589638349778825,2025-04-24 21:47:14.489304,2025-04-24 21:47:17.162644,0 days 00:00:02.673340,True,squared_error,50,,2,6,681,TPESampler,COMPLETE
2341,0.4280860795789213,2025-04-24 21:47:15.679825,2025-04-24 21:47:18.196064,0 days 00:00:02.516239,True,squared_error,42,,2,4,496,TPESampler,COMPLETE
2342,0.4085094535197469,2025-04-24 21:47:16.890841,2025-04-24 21:47:18.052172,0 days 00:00:01.161331,True,squared_error,39,sqrt,1,6,227,TPESampler,COMPLETE
2343,0.34289118619187237,2025-04-24 21:47:17.388926,2025-04-24 21:47:20.035327,0 days 00:00:02.646401,True,squared_error,50,,1,2,421,TPESampler,COMPLETE
2344,0.8189913907725935,2025-04-24 21:47:18.280637,2025-04-24 21:47:20.514253,0 days 00:00:02.233616,False,absolute_error,47,sqrt,5,2,525,TPESampler,COMPLETE
2345,0.35454121349588613,2025-04-24 21:47:18.426588,2025-04-24 21:47:22.223985,0 days 00:00:03.797397,True,squared_error,42,,1,5,641,TPESampler,COMPLETE
2346,0.4283021978942291,2025-04-24 21:47:20.243419,2025-04-24 21:47:22.501199,0 days 00:00:02.257780,True,squared_error,50,,2,3,497,TPESampler,COMPLETE
2347,0.3419126649380855,2025-04-24 21:47:20.756588,2025-04-24 21:47:24.235401,0 days 00:00:03.478813,True,squared_error,50,,1,3,564,TPESampler,COMPLETE
2348,0.42764915207287707,2025-04-24 21:47:22.438425,2025-04-24 21:47:25.824389,0 days 00:00:03.385964,True,squared_error,50,,2,2,688,TPESampler,COMPLETE
2349,0.48172060403664857,2025-04-24 21:47:22.715798,2025-04-24 21:47:25.832522,0 days 00:00:03.116724,False,squared_error,24,,2,12,608,TPESampler,COMPLETE
2350,0.5144723906773025,2025-04-24 21:47:23.411528,2025-04-24 21:47:30.768447,0 days 00:00:07.356919,True,absolute_error,6,,3,7,550,TPESampler,COMPLETE
2351,0.34087100346207855,2025-04-24 21:47:24.437877,2025-04-24 21:47:28.291028,0 days 00:00:03.853151,True,squared_error,50,,1,3,593,TPESampler,COMPLETE
2352,0.5308332962651429,2025-04-24 21:47:26.049341,2025-04-24 21:47:28.569173,0 days 00:00:02.519832,False,squared_error,50,sqrt,2,4,776,TPESampler,COMPLETE
2353,0.3451097906651445,2025-04-24 21:47:26.054406,2025-04-24 21:47:30.211029,0 days 00:00:04.156623,True,squared_error,41,,1,2,638,TPESampler,COMPLETE
2354,0.34325033190781834,2025-04-24 21:47:27.511898,2025-04-24 21:47:31.573383,0 days 00:00:04.061485,True,squared_error,34,,1,3,535,TPESampler,COMPLETE
2355,0.9665200404066314,2025-04-24 21:47:28.565159,2025-04-24 21:47:30.138382,0 days 00:00:01.573223,True,absolute_error,44,sqrt,12,42,359,TPESampler,COMPLETE
2356,0.3924132649206706,2025-04-24 21:47:28.817160,2025-04-24 21:47:32.430935,0 days 00:00:03.613775,True,squared_error,50,,1,10,563,TPESampler,COMPLETE
2357,0.9159049106040545,2025-04-24 21:47:30.364858,2025-04-24 21:47:31.635953,0 days 00:00:01.271095,False,squared_error,49,log2,7,29,128,TPESampler,COMPLETE
2358,0.647902212634021,2025-04-24 21:47:30.468214,2025-04-24 21:47:35.858899,0 days 00:00:05.390685,False,absolute_error,50,,14,24,709,TPESampler,COMPLETE
2359,0.5950855459653124,2025-04-24 21:47:31.096059,2025-04-24 21:47:36.567817,0 days 00:00:05.471758,False,absolute_error,18,sqrt,2,3,792,TPESampler,COMPLETE
2360,0.9185441380271352,2025-04-24 21:47:31.759175,2025-04-24 21:47:33.045606,0 days 00:00:01.286431,False,squared_error,26,log2,8,14,120,TPESampler,COMPLETE
2361,0.3437508813580368,2025-04-24 21:47:31.804273,2025-04-24 21:47:36.852125,0 days 00:00:05.047852,True,squared_error,50,,1,2,625,TPESampler,COMPLETE
2362,0.3479082685861531,2025-04-24 21:47:32.784136,2025-04-24 21:47:35.534331,0 days 00:00:02.750195,True,squared_error,42,,1,4,387,TPESampler,COMPLETE
2363,0.34360405641970526,2025-04-24 21:47:33.438398,2025-04-24 21:47:36.712806,0 days 00:00:03.274408,True,squared_error,42,,1,3,496,TPESampler,COMPLETE
2364,0.3464061999008723,2025-04-24 21:47:35.739242,2025-04-24 21:47:39.436290,0 days 00:00:03.697048,True,squared_error,50,,1,4,560,TPESampler,COMPLETE
2365,0.3455084604835299,2025-04-24 21:47:36.088309,2025-04-24 21:47:39.731323,0 days 00:00:03.643014,True,squared_error,50,,1,4,597,TPESampler,COMPLETE
2366,0.3420282850184206,2025-04-24 21:47:36.951049,2025-04-24 21:47:40.862351,0 days 00:00:03.911302,True,squared_error,43,,1,3,655,TPESampler,COMPLETE
2367,0.4296209403838244,2025-04-24 21:47:37.015486,2025-04-24 21:47:39.832129,0 days 00:00:02.816643,True,squared_error,45,,2,4,418,TPESampler,COMPLETE
2368,0.36202400052762934,2025-04-24 21:47:37.158608,2025-04-24 21:47:41.883199,0 days 00:00:04.724591,True,squared_error,50,,1,6,682,TPESampler,COMPLETE
2369,0.34427917672131514,2025-04-24 21:47:39.660585,2025-04-24 21:47:42.626676,0 days 00:00:02.966091,True,squared_error,50,,1,2,362,TPESampler,COMPLETE
2370,0.3501191774682581,2025-04-24 21:47:39.952094,2025-04-24 21:47:41.661520,0 days 00:00:01.709426,True,squared_error,41,,1,4,201,TPESampler,COMPLETE
2371,0.37679911145715067,2025-04-24 21:47:40.118840,2025-04-24 21:47:42.563121,0 days 00:00:02.444281,True,squared_error,47,sqrt,1,4,752,TPESampler,COMPLETE
2372,0.3434691543272938,2025-04-24 21:47:41.140046,2025-04-24 21:47:44.680434,0 days 00:00:03.540388,True,squared_error,43,,1,3,497,TPESampler,COMPLETE
2373,0.4261352703788972,2025-04-24 21:47:42.055025,2025-04-24 21:47:43.971070,0 days 00:00:01.916045,True,squared_error,50,log2,1,3,374,TPESampler,COMPLETE
2374,0.34242857857296755,2025-04-24 21:47:42.262252,2025-04-24 21:47:45.297552,0 days 00:00:03.035300,True,squared_error,50,,1,3,333,TPESampler,COMPLETE
2375,0.3415336874360002,2025-04-24 21:47:43.197212,2025-04-24 21:47:47.774781,0 days 00:00:04.577569,True,squared_error,50,,1,3,622,TPESampler,COMPLETE
2376,0.42841584233554514,2025-04-24 21:47:42.988502,2025-04-24 21:47:46.947391,0 days 00:00:03.958889,True,squared_error,50,,2,3,557,TPESampler,COMPLETE
2377,0.343025778901123,2025-04-24 21:47:42.869565,2025-04-24 21:47:47.416275,0 days 00:00:04.546710,True,squared_error,50,,1,2,452,TPESampler,COMPLETE
2378,0.9172918878971825,2025-04-24 21:47:44.585337,2025-04-24 21:47:47.165265,0 days 00:00:02.579928,True,squared_error,35,log2,4,41,993,TPESampler,COMPLETE
2379,0.4299763677576624,2025-04-24 21:47:45.015179,2025-04-24 21:47:48.452119,0 days 00:00:03.436940,True,squared_error,50,,2,3,370,TPESampler,COMPLETE
2380,0.35219233170461695,2025-04-24 21:47:45.603421,2025-04-24 21:47:49.466795,0 days 00:00:03.863374,True,squared_error,50,,1,5,541,TPESampler,COMPLETE
2381,0.5352331029512257,2025-04-24 21:47:47.237951,2025-04-24 21:47:49.613971,0 days 00:00:02.376020,False,squared_error,18,sqrt,1,9,393,TPESampler,COMPLETE
2382,0.3421614183996907,2025-04-24 21:47:47.646686,2025-04-24 21:47:52.697637,0 days 00:00:05.050951,True,squared_error,50,,1,3,633,TPESampler,COMPLETE
2383,0.34614225204803484,2025-04-24 21:47:47.726453,2025-04-24 21:47:51.998277,0 days 00:00:04.271824,True,squared_error,43,,1,4,553,TPESampler,COMPLETE
2384,0.3419055852338512,2025-04-24 21:47:48.855889,2025-04-24 21:47:52.817029,0 days 00:00:03.961140,True,squared_error,50,,1,3,484,TPESampler,COMPLETE
2385,0.4280860795789213,2025-04-24 21:47:49.002580,2025-04-24 21:47:53.081467,0 days 00:00:04.078887,True,squared_error,42,,2,2,496,TPESampler,COMPLETE
2386,0.34470417187938107,2025-04-24 21:47:49.724043,2025-04-24 21:47:54.645389,0 days 00:00:04.921346,True,squared_error,42,,1,2,650,TPESampler,COMPLETE
2387,0.34396814164379186,2025-04-24 21:47:49.860575,2025-04-24 21:47:54.329123,0 days 00:00:04.468548,True,squared_error,44,,1,2,573,TPESampler,COMPLETE
2388,0.42715010320217583,2025-04-24 21:47:52.238272,2025-04-24 21:47:55.862349,0 days 00:00:03.624077,True,squared_error,50,,2,3,665,TPESampler,COMPLETE
2389,0.452301247998315,2025-04-24 21:47:53.228629,2025-04-24 21:47:57.154580,0 days 00:00:03.925951,True,squared_error,50,,2,11,376,TPESampler,COMPLETE
2390,0.4123465429872332,2025-04-24 21:47:53.315955,2025-04-24 21:47:58.023206,0 days 00:00:04.707251,False,squared_error,50,,1,4,430,TPESampler,COMPLETE
2391,0.361739230810236,2025-04-24 21:47:53.372227,2025-04-24 21:48:23.867961,0 days 00:00:30.495734,True,absolute_error,49,,1,6,531,TPESampler,COMPLETE
2392,0.34215700680757366,2025-04-24 21:47:54.573750,2025-04-24 21:47:57.926756,0 days 00:00:03.353006,True,squared_error,43,,1,3,395,TPESampler,COMPLETE
2393,0.3411603042644898,2025-04-24 21:47:55.074518,2025-04-24 21:47:58.613532,0 days 00:00:03.539014,True,squared_error,50,,1,3,429,TPESampler,COMPLETE
2394,0.43085474780197464,2025-04-24 21:47:56.177337,2025-04-24 21:47:59.206603,0 days 00:00:03.029266,True,squared_error,50,,2,5,583,TPESampler,COMPLETE
2395,0.34355130363506914,2025-04-24 21:47:57.470486,2025-04-24 21:48:01.354309,0 days 00:00:03.883823,True,squared_error,44,,1,3,667,TPESampler,COMPLETE
2396,0.4283021978942291,2025-04-24 21:47:58.393335,2025-04-24 21:48:01.889625,0 days 00:00:03.496290,True,squared_error,50,,2,2,497,TPESampler,COMPLETE
2397,0.34171783792286764,2025-04-24 21:47:58.570399,2025-04-24 21:48:02.013226,0 days 00:00:03.442827,True,squared_error,50,,1,3,567,TPESampler,COMPLETE
2398,0.42712237963857913,2025-04-24 21:47:58.903236,2025-04-24 21:48:03.116029,0 days 00:00:04.212793,True,squared_error,32,,2,4,662,TPESampler,COMPLETE
2399,0.5420523261746082,2025-04-24 21:47:59.586527,2025-04-24 21:48:01.517089,0 days 00:00:01.930562,False,squared_error,46,sqrt,2,39,816,TPESampler,COMPLETE
2400,0.34165928753335095,2025-04-24 21:48:01.570289,2025-04-24 21:48:05.278453,0 days 00:00:03.708164,True,squared_error,50,,1,3,517,TPESampler,COMPLETE
2401,0.3416632182920296,2025-04-24 21:48:01.748966,2025-04-24 21:48:05.590929,0 days 00:00:03.841963,True,squared_error,43,,1,3,547,TPESampler,COMPLETE
2402,0.4308567738259036,2025-04-24 21:48:02.303467,2025-04-24 21:48:07.437892,0 days 00:00:05.134425,False,squared_error,50,,1,2,588,TPESampler,COMPLETE
