number,value,datetime_start,datetime_complete,duration,params_bootstrap,params_criterion,params_max_depth,params_max_features,params_min_samples_leaf,params_min_samples_split,params_n_estimators,system_attrs_auto:sampler,state
3250,0.4849305652499778,2025-04-24 21:59:23.681890,2025-04-24 21:59:25.166091,0 days 00:00:01.484201,False,squared_error,41,log2,1,4,566,TPESampler,COMPLETE
3251,0.3613806298028553,2025-04-24 21:59:24.704503,2025-04-24 21:59:28.116416,0 days 00:00:03.411913,True,squared_error,50,,1,6,513,TPESampler,COMPLETE
3252,0.3470932885487412,2025-04-24 21:59:25.462871,2025-04-24 21:59:30.495390,0 days 00:00:05.032519,True,squared_error,35,,1,2,746,TPESampler,COMPLETE
3253,0.343888540333452,2025-04-24 21:59:25.569580,2025-04-24 21:59:28.545843,0 days 00:00:02.976263,True,squared_error,44,,1,2,465,TPESampler,COMPLETE
3254,0.34360307431730913,2025-04-24 21:59:27.784982,2025-04-24 21:59:31.493815,0 days 00:00:03.708833,True,squared_error,34,,1,3,565,TPESampler,COMPLETE
3255,0.35482960683978126,2025-04-24 21:59:28.403501,2025-04-24 21:59:32.846836,0 days 00:00:04.443335,True,squared_error,44,,1,5,715,TPESampler,COMPLETE
3256,0.4268680202752985,2025-04-24 21:59:28.784667,2025-04-24 21:59:30.623997,0 days 00:00:01.839330,True,squared_error,50,log2,1,3,573,TPESampler,COMPLETE
3257,0.34181207273305825,2025-04-24 21:59:30.752347,2025-04-24 21:59:34.636796,0 days 00:00:03.884449,True,squared_error,50,,1,3,565,TPESampler,COMPLETE
3258,0.3423623533627568,2025-04-24 21:59:30.817562,2025-04-24 21:59:35.161172,0 days 00:00:04.343610,True,squared_error,42,,1,3,530,TPESampler,COMPLETE
3259,0.4308355797493156,2025-04-24 21:59:30.887607,2025-04-24 21:59:34.918256,0 days 00:00:04.030649,True,squared_error,50,,2,5,651,TPESampler,COMPLETE
3260,0.4265178990066253,2025-04-24 21:59:32.096628,2025-04-24 21:59:35.707127,0 days 00:00:03.610499,False,squared_error,41,,1,3,391,TPESampler,COMPLETE
3261,0.34795490554543584,2025-04-24 21:59:32.158009,2025-04-24 21:59:36.909861,0 days 00:00:04.751852,True,squared_error,50,,1,4,720,TPESampler,COMPLETE
3262,0.42945934885641895,2025-04-24 21:59:33.097913,2025-04-24 21:59:35.466388,0 days 00:00:02.368475,True,squared_error,44,,2,3,421,TPESampler,COMPLETE
3263,0.4306852493914719,2025-04-24 21:59:35.080333,2025-04-24 21:59:38.776369,0 days 00:00:03.696036,True,squared_error,50,,2,5,586,TPESampler,COMPLETE
3264,0.36953130882484486,2025-04-24 21:59:35.273391,2025-04-24 21:59:38.849933,0 days 00:00:03.576542,True,squared_error,42,,1,7,464,TPESampler,COMPLETE
3265,0.3475788701572206,2025-04-24 21:59:35.418637,2025-04-24 21:59:39.220544,0 days 00:00:03.801907,True,squared_error,50,,1,4,500,TPESampler,COMPLETE
3266,0.34247580850831977,2025-04-24 21:59:35.763642,2025-04-24 21:59:41.010165,0 days 00:00:05.246523,True,squared_error,50,,1,2,597,TPESampler,COMPLETE
3267,0.344839171317639,2025-04-24 21:59:36.093831,2025-04-24 21:59:40.396099,0 days 00:00:04.302268,True,squared_error,42,,1,2,494,TPESampler,COMPLETE
3268,0.34292384235748424,2025-04-24 21:59:37.273859,2025-04-24 21:59:41.089919,0 days 00:00:03.816060,True,squared_error,50,,1,2,441,TPESampler,COMPLETE
3269,0.7081531083762609,2025-04-24 21:59:39.035290,2025-04-24 21:59:41.561590,0 days 00:00:02.526300,True,squared_error,15,log2,1,3,856,TPESampler,COMPLETE
3270,0.42874241318196693,2025-04-24 21:59:39.151188,2025-04-24 21:59:43.092467,0 days 00:00:03.941279,True,squared_error,50,,2,3,571,TPESampler,COMPLETE
3271,0.34562708319013885,2025-04-24 21:59:39.618807,2025-04-24 21:59:43.451149,0 days 00:00:03.832342,True,squared_error,50,,1,4,547,TPESampler,COMPLETE
3272,0.36229795912994683,2025-04-24 21:59:40.721096,2025-04-24 21:59:45.298923,0 days 00:00:04.577827,True,squared_error,50,,1,6,719,TPESampler,COMPLETE
3273,0.3419936265817964,2025-04-24 21:59:41.320525,2025-04-24 21:59:45.367448,0 days 00:00:04.046923,True,squared_error,50,,1,3,510,TPESampler,COMPLETE
3274,0.34407742358331117,2025-04-24 21:59:41.343041,2025-04-24 21:59:45.838091,0 days 00:00:04.495050,True,squared_error,43,,1,2,625,TPESampler,COMPLETE
3275,0.34278637175058496,2025-04-24 21:59:42.098815,2025-04-24 21:59:46.578765,0 days 00:00:04.479950,True,squared_error,43,,1,3,674,TPESampler,COMPLETE
3276,0.383508432750202,2025-04-24 21:59:43.389750,2025-04-24 21:59:59.975225,0 days 00:00:16.585475,False,absolute_error,35,,1,8,181,TPESampler,COMPLETE
3277,0.4603195901248704,2025-04-24 21:59:43.738105,2025-04-24 21:59:47.648451,0 days 00:00:03.910346,True,squared_error,21,,3,5,969,TPESampler,COMPLETE
3278,0.4126923001011099,2025-04-24 21:59:45.571013,2025-04-24 21:59:49.649754,0 days 00:00:04.078741,False,squared_error,44,,1,4,477,TPESampler,COMPLETE
3279,0.34424190290613654,2025-04-24 21:59:45.617382,2025-04-24 21:59:49.097206,0 days 00:00:03.479824,True,squared_error,50,,1,2,483,TPESampler,COMPLETE
3280,0.4485102417956985,2025-04-24 21:59:46.135934,2025-04-24 21:59:50.617531,0 days 00:00:04.481597,False,squared_error,45,,2,3,691,TPESampler,COMPLETE
3281,0.5677501742181978,2025-04-24 21:59:46.867418,2025-04-24 21:59:48.330721,0 days 00:00:01.463303,True,squared_error,31,,6,34,275,TPESampler,COMPLETE
3282,0.6629837216433864,2025-04-24 21:59:47.916140,2025-04-24 21:59:53.462665,0 days 00:00:05.546525,False,absolute_error,39,,10,13,505,TPESampler,COMPLETE
3283,0.43089452839550196,2025-04-24 21:59:48.595914,2025-04-24 21:59:53.973948,0 days 00:00:05.378034,False,squared_error,50,,1,2,682,TPESampler,COMPLETE
3284,0.4302469030813659,2025-04-24 21:59:49.394625,2025-04-24 21:59:51.362463,0 days 00:00:01.967838,True,squared_error,42,,2,3,390,TPESampler,COMPLETE
3285,0.42633483720613924,2025-04-24 21:59:49.872961,2025-04-24 21:59:53.674791,0 days 00:00:03.801830,True,squared_error,42,,2,2,787,TPESampler,COMPLETE
3286,0.3621319992659072,2025-04-24 21:59:51.070050,2025-04-24 21:59:55.146896,0 days 00:00:04.076846,True,squared_error,44,,1,6,700,TPESampler,COMPLETE
3287,0.7876457424348132,2025-04-24 21:59:51.611267,2025-04-24 21:59:52.630735,0 days 00:00:01.019468,False,squared_error,10,log2,1,46,134,TPESampler,COMPLETE
3288,0.34569488014620925,2025-04-24 21:59:52.854338,2025-04-24 21:59:56.407834,0 days 00:00:03.553496,True,squared_error,44,,1,4,598,TPESampler,COMPLETE
3289,0.4243483075939032,2025-04-24 21:59:53.875777,2025-04-24 21:59:57.971082,0 days 00:00:04.095305,True,squared_error,50,,2,4,867,TPESampler,COMPLETE
3290,0.44303380524725,2025-04-24 21:59:53.930109,2025-04-24 22:00:16.153508,0 days 00:00:22.223399,True,absolute_error,50,,2,2,795,TPESampler,COMPLETE
3291,0.34644627041468323,2025-04-24 21:59:54.309185,2025-04-24 21:59:58.261807,0 days 00:00:03.952622,True,squared_error,42,,1,4,597,TPESampler,COMPLETE
3292,0.42718493870828933,2025-04-24 21:59:55.417988,2025-04-24 21:59:58.424631,0 days 00:00:03.006643,True,squared_error,43,,2,3,656,TPESampler,COMPLETE
3293,0.3428670237780044,2025-04-24 21:59:56.638036,2025-04-24 22:00:00.095334,0 days 00:00:03.457298,True,squared_error,44,,1,3,569,TPESampler,COMPLETE
3294,0.7203514246251788,2025-04-24 21:59:58.193733,2025-04-24 21:59:59.905972,0 days 00:00:01.712239,False,absolute_error,9,sqrt,1,17,163,TPESampler,COMPLETE
3295,0.34363975496137605,2025-04-24 21:59:58.489915,2025-04-24 22:00:02.390745,0 days 00:00:03.900830,True,squared_error,50,,1,2,564,TPESampler,COMPLETE
3296,0.6927058345783488,2025-04-24 21:59:58.807271,2025-04-24 22:00:00.630799,0 days 00:00:01.823528,True,squared_error,9,sqrt,1,6,575,TPESampler,COMPLETE
3297,0.7074341783385958,2025-04-24 22:00:00.244433,2025-04-24 22:00:02.113811,0 days 00:00:01.869378,False,squared_error,8,sqrt,2,2,242,TPESampler,COMPLETE
3298,0.34625552022869793,2025-04-24 22:00:00.310367,2025-04-24 22:00:04.511686,0 days 00:00:04.201319,True,squared_error,44,,1,4,406,TPESampler,COMPLETE
3299,0.34770828763983846,2025-04-24 22:00:00.470675,2025-04-24 22:00:06.657006,0 days 00:00:06.186331,True,squared_error,50,,1,4,745,TPESampler,COMPLETE
3300,0.4283881385817919,2025-04-24 22:00:00.865411,2025-04-24 22:00:05.099772,0 days 00:00:04.234361,True,squared_error,50,,2,2,630,TPESampler,COMPLETE
3301,0.340699651564751,2025-04-24 22:00:02.901237,2025-04-24 22:00:06.848443,0 days 00:00:03.947206,True,squared_error,45,,1,3,604,TPESampler,COMPLETE
3302,0.3470190773147679,2025-04-24 22:00:03.089208,2025-04-24 22:00:06.964017,0 days 00:00:03.874809,True,squared_error,50,,1,4,663,TPESampler,COMPLETE
3303,0.38453098578218875,2025-04-24 22:00:04.730652,2025-04-24 22:00:06.417582,0 days 00:00:01.686930,True,squared_error,42,sqrt,1,4,468,TPESampler,COMPLETE
3304,0.34699718359160103,2025-04-24 22:00:05.351155,2025-04-24 22:00:08.611189,0 days 00:00:03.260034,True,squared_error,50,,1,4,517,TPESampler,COMPLETE
3305,0.36221647447413263,2025-04-24 22:00:06.736109,2025-04-24 22:00:10.770546,0 days 00:00:04.034437,True,squared_error,36,,1,6,626,TPESampler,COMPLETE
3306,0.3448501425763026,2025-04-24 22:00:06.877619,2025-04-24 22:00:12.040820,0 days 00:00:05.163201,True,squared_error,37,,1,3,783,TPESampler,COMPLETE
3307,0.34792622333230855,2025-04-24 22:00:07.183435,2025-04-24 22:00:12.229361,0 days 00:00:05.045926,True,squared_error,41,,1,4,749,TPESampler,COMPLETE
3308,0.4276990895181151,2025-04-24 22:00:07.278261,2025-04-24 22:00:10.581902,0 days 00:00:03.303641,True,squared_error,35,,2,2,549,TPESampler,COMPLETE
3309,0.4272678476791713,2025-04-24 22:00:08.962020,2025-04-24 22:00:12.789822,0 days 00:00:03.827802,True,squared_error,42,,2,2,679,TPESampler,COMPLETE
3310,0.9090098734507294,2025-04-24 22:00:10.815198,2025-04-24 22:00:14.360612,0 days 00:00:03.545414,False,absolute_error,5,log2,1,18,929,TPESampler,COMPLETE
3311,0.34456902882093926,2025-04-24 22:00:11.032580,2025-04-24 22:00:16.027059,0 days 00:00:04.994479,True,squared_error,42,,1,2,616,TPESampler,COMPLETE
3312,0.7672952963888549,2025-04-24 22:00:12.379845,2025-04-24 22:00:15.958152,0 days 00:00:03.578307,True,squared_error,27,sqrt,3,16,958,TPESampler,COMPLETE
3313,0.9631968695801203,2025-04-24 22:00:12.834009,2025-04-24 22:00:15.963291,0 days 00:00:03.129282,True,absolute_error,29,sqrt,12,5,759,TPESampler,COMPLETE
3314,0.34447186704215255,2025-04-24 22:00:13.098319,2025-04-24 22:00:17.517099,0 days 00:00:04.418780,True,squared_error,36,,1,2,601,TPESampler,COMPLETE
3315,0.34286525353392056,2025-04-24 22:00:14.650690,2025-04-24 22:00:18.637720,0 days 00:00:03.987030,True,squared_error,43,,1,3,677,TPESampler,COMPLETE
3316,0.42724297029498204,2025-04-24 22:00:16.144296,2025-04-24 22:00:20.783167,0 days 00:00:04.638871,True,squared_error,50,,2,3,762,TPESampler,COMPLETE
3317,0.3433088486718339,2025-04-24 22:00:16.302360,2025-04-24 22:00:21.666921,0 days 00:00:05.364561,True,squared_error,39,,1,3,668,TPESampler,COMPLETE
3318,0.44726248084148656,2025-04-24 22:00:16.417368,2025-04-24 22:00:23.647156,0 days 00:00:07.229788,True,absolute_error,14,,1,15,160,TPESampler,COMPLETE
3319,0.47757384009541815,2025-04-24 22:00:16.459934,2025-04-24 22:00:19.092927,0 days 00:00:02.632993,True,squared_error,42,log2,1,3,503,TPESampler,COMPLETE
3320,0.37902741779935584,2025-04-24 22:00:17.863557,2025-04-24 22:00:20.553304,0 days 00:00:02.689747,True,squared_error,45,sqrt,1,2,637,TPESampler,COMPLETE
3321,0.34512887695019445,2025-04-24 22:00:19.023523,2025-04-24 22:00:23.452924,0 days 00:00:04.429401,True,squared_error,44,,1,2,731,TPESampler,COMPLETE
3322,0.34600338104954637,2025-04-24 22:00:19.356947,2025-04-24 22:00:25.056267,0 days 00:00:05.699320,True,squared_error,41,,1,2,748,TPESampler,COMPLETE
3323,0.3463535307371143,2025-04-24 22:00:20.783444,2025-04-24 22:00:24.251411,0 days 00:00:03.467967,True,squared_error,35,,1,2,559,TPESampler,COMPLETE
3324,0.6538453181137366,2025-04-24 22:00:21.056150,2025-04-24 22:00:23.278637,0 days 00:00:02.222487,True,squared_error,49,sqrt,2,9,658,TPESampler,COMPLETE
3325,0.4286918296914906,2025-04-24 22:00:22.104925,2025-04-24 22:00:28.354666,0 days 00:00:06.249741,False,absolute_error,32,sqrt,1,4,455,TPESampler,COMPLETE
3326,0.34223352602176343,2025-04-24 22:00:23.506033,2025-04-24 22:00:28.268753,0 days 00:00:04.762720,True,squared_error,50,,1,3,842,TPESampler,COMPLETE
3327,0.4433590117000566,2025-04-24 22:00:23.677236,2025-04-24 22:00:42.588108,0 days 00:00:18.910872,True,absolute_error,50,,2,4,666,TPESampler,COMPLETE
3328,0.3607113623505307,2025-04-24 22:00:23.944734,2025-04-24 22:00:27.787244,0 days 00:00:03.842510,True,squared_error,42,,1,6,614,TPESampler,COMPLETE
3329,0.3540656461875589,2025-04-24 22:00:24.866302,2025-04-24 22:00:27.794821,0 days 00:00:02.928519,True,squared_error,35,,1,5,533,TPESampler,COMPLETE
3330,0.3492013727964487,2025-04-24 22:00:25.353996,2025-04-24 22:00:28.596010,0 days 00:00:03.242014,True,squared_error,35,,1,4,666,TPESampler,COMPLETE
3331,0.8596110759372297,2025-04-24 22:00:27.963815,2025-04-24 22:00:30.546516,0 days 00:00:02.582701,True,squared_error,50,sqrt,5,3,906,TPESampler,COMPLETE
3332,0.42867793206405075,2025-04-24 22:00:28.022706,2025-04-24 22:00:32.055353,0 days 00:00:04.032647,True,squared_error,42,,2,3,567,TPESampler,COMPLETE
3333,0.4285824096222088,2025-04-24 22:00:28.534785,2025-04-24 22:00:32.616424,0 days 00:00:04.081639,True,squared_error,41,,2,3,564,TPESampler,COMPLETE
3334,0.8746372807429824,2025-04-24 22:00:28.717338,2025-04-24 22:00:32.812203,0 days 00:00:04.094865,False,absolute_error,34,log2,2,2,864,TPESampler,COMPLETE
3335,0.9635850674055146,2025-04-24 22:00:29.378123,2025-04-24 22:00:31.554562,0 days 00:00:02.176439,False,absolute_error,12,sqrt,15,2,668,TPESampler,COMPLETE
3336,0.41291136727111644,2025-04-24 22:00:30.830133,2025-04-24 22:00:34.668719,0 days 00:00:03.838586,False,squared_error,50,,1,5,577,TPESampler,COMPLETE
3337,0.3514468310987855,2025-04-24 22:00:31.776284,2025-04-24 22:01:00.691975,0 days 00:00:28.915691,True,absolute_error,34,,1,4,491,TPESampler,COMPLETE
3338,0.43102961680017027,2025-04-24 22:00:32.275353,2025-04-24 22:00:34.712994,0 days 00:00:02.437641,True,squared_error,50,,2,5,504,TPESampler,COMPLETE
3339,0.3490875845744411,2025-04-24 22:00:32.889714,2025-04-24 22:01:13.941365,0 days 00:00:41.051651,True,absolute_error,43,,1,2,667,TPESampler,COMPLETE
3340,0.3421732961343749,2025-04-24 22:00:33.229349,2025-04-24 22:00:36.821044,0 days 00:00:03.591695,True,squared_error,44,,1,3,604,TPESampler,COMPLETE
3341,0.34432202767321407,2025-04-24 22:00:34.846608,2025-04-24 22:00:39.490591,0 days 00:00:04.643983,True,squared_error,50,,1,2,682,TPESampler,COMPLETE
3342,0.4277962409158488,2025-04-24 22:00:34.910563,2025-04-24 22:00:38.541670,0 days 00:00:03.631107,True,squared_error,50,,2,3,751,TPESampler,COMPLETE
3343,0.4298316210126602,2025-04-24 22:00:37.042092,2025-04-24 22:00:38.941330,0 days 00:00:01.899238,True,squared_error,43,,2,2,385,TPESampler,COMPLETE
3344,0.3472075074394376,2025-04-24 22:00:38.762314,2025-04-24 22:00:42.696002,0 days 00:00:03.933688,True,squared_error,43,,1,4,701,TPESampler,COMPLETE
3345,0.35314019621180925,2025-04-24 22:00:39.175322,2025-04-24 22:00:42.216720,0 days 00:00:03.041398,True,squared_error,43,,1,5,581,TPESampler,COMPLETE
3346,0.34248711192605735,2025-04-24 22:00:39.970738,2025-04-24 22:00:44.393705,0 days 00:00:04.422967,True,squared_error,50,,1,3,669,TPESampler,COMPLETE
3347,0.34427798532993936,2025-04-24 22:00:42.428897,2025-04-24 22:00:46.235926,0 days 00:00:03.807029,True,squared_error,42,,1,3,743,TPESampler,COMPLETE
3348,0.3845027114073622,2025-04-24 22:00:42.812635,2025-04-24 22:00:47.645616,0 days 00:00:04.832981,True,squared_error,43,,1,9,839,TPESampler,COMPLETE
3349,0.34671937200718467,2025-04-24 22:00:42.990392,2025-04-24 22:00:48.598335,0 days 00:00:05.607943,True,squared_error,43,,1,4,815,TPESampler,COMPLETE
3350,0.3430232906657927,2025-04-24 22:00:44.733758,2025-04-24 22:00:47.651217,0 days 00:00:02.917459,True,squared_error,42,,1,3,519,TPESampler,COMPLETE
3351,0.9066756733054755,2025-04-24 22:00:46.459019,2025-04-24 22:00:48.124554,0 days 00:00:01.665535,True,squared_error,7,log2,3,3,882,TPESampler,COMPLETE
3352,0.341579381976132,2025-04-24 22:00:47.836164,2025-04-24 22:00:52.366614,0 days 00:00:04.530450,True,squared_error,50,,1,3,613,TPESampler,COMPLETE
3353,0.4316921847944079,2025-04-24 22:00:47.883948,2025-04-24 22:00:51.504162,0 days 00:00:03.620214,True,squared_error,43,,2,5,570,TPESampler,COMPLETE
3354,0.49392506312725615,2025-04-24 22:00:48.352138,2025-04-24 22:00:50.324608,0 days 00:00:01.972470,True,squared_error,40,log2,1,5,687,TPESampler,COMPLETE
3355,0.4283618289767066,2025-04-24 22:00:49.059793,2025-04-24 22:00:52.340471,0 days 00:00:03.280678,True,squared_error,40,,2,4,626,TPESampler,COMPLETE
3356,0.34318905962733104,2025-04-24 22:00:50.539166,2025-04-24 22:00:53.883846,0 days 00:00:03.344680,True,squared_error,44,,1,3,626,TPESampler,COMPLETE
3357,0.46332891811838645,2025-04-24 22:00:51.738527,2025-04-24 22:00:53.830447,0 days 00:00:02.091920,False,squared_error,42,,1,12,183,TPESampler,COMPLETE
3358,0.34726977756498534,2025-04-24 22:00:52.719323,2025-04-24 22:00:56.978450,0 days 00:00:04.259127,True,squared_error,42,,1,4,529,TPESampler,COMPLETE
3359,0.34303758452884403,2025-04-24 22:00:52.797868,2025-04-24 22:00:57.139844,0 days 00:00:04.341976,True,squared_error,42,,1,3,520,TPESampler,COMPLETE
3360,0.3471737197664015,2025-04-24 22:00:54.184523,2025-04-24 22:00:57.149306,0 days 00:00:02.964783,True,squared_error,45,,1,4,572,TPESampler,COMPLETE
3361,0.8906244371144163,2025-04-24 22:00:54.391919,2025-04-24 22:00:56.009096,0 days 00:00:01.617177,False,squared_error,5,sqrt,9,4,925,TPESampler,COMPLETE
3362,0.4276230033768223,2025-04-24 22:00:56.252305,2025-04-24 22:01:00.221636,0 days 00:00:03.969331,True,squared_error,35,,2,3,688,TPESampler,COMPLETE
3363,0.6284345106600894,2025-04-24 22:00:57.381626,2025-04-24 22:01:01.115758,0 days 00:00:03.734132,False,squared_error,42,,13,4,963,TPESampler,COMPLETE
3364,0.3447657161511286,2025-04-24 22:00:57.471551,2025-04-24 22:01:02.849080,0 days 00:00:05.377529,True,squared_error,50,,1,2,709,TPESampler,COMPLETE
3365,0.9735774402702824,2025-04-24 22:00:57.536353,2025-04-24 22:00:58.731206,0 days 00:00:01.194853,True,absolute_error,23,sqrt,12,32,264,TPESampler,COMPLETE
3366,0.42820076937491436,2025-04-24 22:00:59.001453,2025-04-24 22:01:02.175013,0 days 00:00:03.173560,True,squared_error,44,,2,3,640,TPESampler,COMPLETE
3367,0.353635897608983,2025-04-24 22:01:00.451060,2025-04-24 22:01:03.783167,0 days 00:00:03.332107,True,squared_error,43,,1,5,447,TPESampler,COMPLETE
3368,0.3615654252654237,2025-04-24 22:01:00.926035,2025-04-24 22:01:04.479767,0 days 00:00:03.553732,True,squared_error,44,,1,6,648,TPESampler,COMPLETE
3369,0.9318263819669996,2025-04-24 22:01:01.523874,2025-04-24 22:01:02.683675,0 days 00:00:01.159801,True,absolute_error,7,log2,2,2,114,TPESampler,COMPLETE
3370,0.622367267407472,2025-04-24 22:01:02.502482,2025-04-24 22:01:04.807633,0 days 00:00:02.305151,True,absolute_error,13,sqrt,1,4,316,TPESampler,COMPLETE
3371,0.34283111265525795,2025-04-24 22:01:02.933904,2025-04-24 22:01:06.693965,0 days 00:00:03.760061,True,squared_error,43,,1,3,517,TPESampler,COMPLETE
3372,0.34790295475941974,2025-04-24 22:01:03.200349,2025-04-24 22:01:08.134503,0 days 00:00:04.934154,True,squared_error,44,,1,4,732,TPESampler,COMPLETE
3373,0.34309339688865204,2025-04-24 22:01:04.167834,2025-04-24 22:01:08.106894,0 days 00:00:03.939060,True,squared_error,44,,1,3,565,TPESampler,COMPLETE
3374,0.4446577025377076,2025-04-24 22:01:04.743835,2025-04-24 22:01:20.086511,0 days 00:00:15.342676,True,absolute_error,50,,2,4,492,TPESampler,COMPLETE
3375,0.34215541802512284,2025-04-24 22:01:05.179655,2025-04-24 22:01:08.926482,0 days 00:00:03.746827,True,squared_error,50,,1,3,664,TPESampler,COMPLETE
3376,0.4475662518761396,2025-04-24 22:01:06.942283,2025-04-24 22:01:11.529392,0 days 00:00:04.587109,True,squared_error,31,,1,36,935,TPESampler,COMPLETE
3377,0.3472854761116869,2025-04-24 22:01:08.296487,2025-04-24 22:01:12.954932,0 days 00:00:04.658445,True,squared_error,50,,1,4,686,TPESampler,COMPLETE
3378,0.6057301691836944,2025-04-24 22:01:08.346827,2025-04-24 22:01:14.498123,0 days 00:00:06.151296,True,absolute_error,27,log2,1,2,873,TPESampler,COMPLETE
3379,0.3445558306975601,2025-04-24 22:01:09.187788,2025-04-24 22:01:13.119308,0 days 00:00:03.931520,True,squared_error,43,,1,2,686,TPESampler,COMPLETE
3380,0.34738660630407486,2025-04-24 22:01:11.762114,2025-04-24 22:01:15.160301,0 days 00:00:03.398187,True,squared_error,43,,1,4,505,TPESampler,COMPLETE
3381,0.3797435527856345,2025-04-24 22:01:13.236070,2025-04-24 22:01:57.210130,0 days 00:00:43.974060,False,absolute_error,32,,1,3,499,TPESampler,COMPLETE
3382,0.3437060967350087,2025-04-24 22:01:13.368782,2025-04-24 22:01:17.505105,0 days 00:00:04.136323,True,squared_error,50,,1,2,624,TPESampler,COMPLETE
3383,0.34375846975454677,2025-04-24 22:01:14.228744,2025-04-24 22:01:17.584180,0 days 00:00:03.355436,True,squared_error,44,,1,2,523,TPESampler,COMPLETE
3384,0.4443088693016432,2025-04-24 22:01:14.739684,2025-04-24 22:01:17.169725,0 days 00:00:02.430041,True,squared_error,50,,2,7,448,TPESampler,COMPLETE
3385,0.4583571503832873,2025-04-24 22:01:15.465725,2025-04-24 22:01:16.809201,0 days 00:00:01.343476,False,squared_error,49,,3,4,133,TPESampler,COMPLETE
3386,0.3430040231866183,2025-04-24 22:01:17.039214,2025-04-24 22:01:20.641034,0 days 00:00:03.601820,True,squared_error,43,,1,2,533,TPESampler,COMPLETE
3387,0.42769999631095235,2025-04-24 22:01:17.490865,2025-04-24 22:01:20.527878,0 days 00:00:03.037013,True,squared_error,44,,2,2,585,TPESampler,COMPLETE
3388,0.4133273152024839,2025-04-24 22:01:17.750841,2025-04-24 22:01:47.026239,0 days 00:00:29.275398,False,absolute_error,16,,1,3,403,TPESampler,COMPLETE
3389,0.48117786509001087,2025-04-24 22:01:17.884043,2025-04-24 22:01:20.643359,0 days 00:00:02.759316,True,absolute_error,47,log2,1,5,308,TPESampler,COMPLETE
3390,0.4649886226143975,2025-04-24 22:01:20.555381,2025-04-24 22:01:25.211955,0 days 00:00:04.656574,False,absolute_error,49,log2,1,4,386,TPESampler,COMPLETE
