number,value,datetime_start,datetime_complete,duration,params_bootstrap,params_criterion,params_max_depth,params_max_features,params_min_samples_leaf,params_min_samples_split,params_n_estimators,system_attrs_auto:sampler,state
4807,0.9224306054965532,2025-04-24 22:22:02.243191,2025-04-24 22:22:04.397010,0 days 00:00:02.153819,True,squared_error,31,log2,4,12,178,TPESampler,COMPLETE
4808,0.3527741386855041,2025-04-24 22:22:02.485420,2025-04-24 22:22:06.833634,0 days 00:00:04.348214,True,squared_error,50,,1,5,570,TPESampler,COMPLETE
4809,0.9359833070000252,2025-04-24 22:22:04.645505,2025-04-24 22:22:06.417817,0 days 00:00:01.772312,False,squared_error,23,log2,15,34,107,TPESampler,COMPLETE
4810,0.34244940333052926,2025-04-24 22:22:04.755442,2025-04-24 22:22:08.960046,0 days 00:00:04.204604,True,squared_error,43,,1,3,524,TPESampler,COMPLETE
4811,0.3410775426201463,2025-04-24 22:22:04.857225,2025-04-24 22:22:09.545249,0 days 00:00:04.688024,True,squared_error,50,,1,3,534,TPESampler,COMPLETE
4812,0.34206857594491563,2025-04-24 22:22:05.950975,2025-04-24 22:22:09.664727,0 days 00:00:03.713752,True,squared_error,44,,1,3,450,TPESampler,COMPLETE
4813,0.5371478567638095,2025-04-24 22:22:06.766081,2025-04-24 22:22:08.837239,0 days 00:00:02.071158,False,squared_error,29,sqrt,2,2,417,TPESampler,COMPLETE
4814,0.9639274918730885,2025-04-24 22:22:06.895825,2025-04-24 22:22:09.367138,0 days 00:00:02.471313,True,absolute_error,37,sqrt,12,2,848,TPESampler,COMPLETE
4815,0.3421811973026608,2025-04-24 22:22:07.287041,2025-04-24 22:22:10.303047,0 days 00:00:03.016006,True,squared_error,46,,1,2,363,TPESampler,COMPLETE
4816,0.3545946205432646,2025-04-24 22:22:09.128812,2025-04-24 22:22:13.065425,0 days 00:00:03.936613,True,squared_error,41,,1,5,368,TPESampler,COMPLETE
4817,0.4295812204646603,2025-04-24 22:22:09.514549,2025-04-24 22:22:13.723469,0 days 00:00:04.208920,True,squared_error,43,,2,3,446,TPESampler,COMPLETE
4818,0.3421015243361363,2025-04-24 22:22:09.753092,2025-04-24 22:22:14.117483,0 days 00:00:04.364391,True,squared_error,50,,1,3,493,TPESampler,COMPLETE
4819,0.34245577407745165,2025-04-24 22:22:09.991735,2025-04-24 22:22:13.429409,0 days 00:00:03.437674,True,squared_error,50,,1,3,314,TPESampler,COMPLETE
4820,0.3444352562098114,2025-04-24 22:22:10.405093,2025-04-24 22:22:14.103503,0 days 00:00:03.698410,True,squared_error,47,,1,2,360,TPESampler,COMPLETE
4821,0.5159823841279867,2025-04-24 22:22:10.783836,2025-04-24 22:22:12.654522,0 days 00:00:01.870686,False,squared_error,39,log2,1,14,110,TPESampler,COMPLETE
4822,0.42959962764085413,2025-04-24 22:22:12.911723,2025-04-24 22:22:16.077567,0 days 00:00:03.165844,True,squared_error,50,,2,2,409,TPESampler,COMPLETE
4823,0.42962078429404243,2025-04-24 22:22:13.496346,2025-04-24 22:22:16.499922,0 days 00:00:03.003576,True,squared_error,45,,2,4,379,TPESampler,COMPLETE
4824,0.34520473412025227,2025-04-24 22:22:13.829486,2025-04-24 22:22:17.813770,0 days 00:00:03.984284,True,squared_error,36,,1,2,461,TPESampler,COMPLETE
4825,0.34106491897741553,2025-04-24 22:22:14.316900,2025-04-24 22:22:18.532620,0 days 00:00:04.215720,True,squared_error,50,,1,3,438,TPESampler,COMPLETE
4826,0.4484864398342237,2025-04-24 22:22:14.426171,2025-04-24 22:22:18.012467,0 days 00:00:03.586296,False,squared_error,50,,2,3,445,TPESampler,COMPLETE
4827,0.3465135479326565,2025-04-24 22:22:14.731010,2025-04-24 22:22:18.475858,0 days 00:00:03.744848,True,squared_error,50,,1,4,472,TPESampler,COMPLETE
4828,0.3440130838256585,2025-04-24 22:22:16.456213,2025-04-24 22:22:20.149636,0 days 00:00:03.693423,True,squared_error,44,,1,3,497,TPESampler,COMPLETE
4829,0.3412368191865123,2025-04-24 22:22:16.808427,2025-04-24 22:22:20.208483,0 days 00:00:03.400056,True,squared_error,50,,1,3,440,TPESampler,COMPLETE
4830,0.9906993058096925,2025-04-24 22:22:18.080616,2025-04-24 22:22:20.528207,0 days 00:00:02.447591,True,absolute_error,35,log2,14,20,444,TPESampler,COMPLETE
4831,0.3434133259721858,2025-04-24 22:22:18.230589,2025-04-24 22:22:22.629646,0 days 00:00:04.399057,True,squared_error,44,,1,2,459,TPESampler,COMPLETE
4832,0.7103704494261522,2025-04-24 22:22:18.836319,2025-04-24 22:22:22.397650,0 days 00:00:03.561331,True,absolute_error,19,log2,1,18,465,TPESampler,COMPLETE
4833,0.4438158094960882,2025-04-24 22:22:19.081408,2025-04-24 22:22:40.648832,0 days 00:00:21.567424,True,absolute_error,50,,2,3,738,TPESampler,COMPLETE
4834,0.4055526948310401,2025-04-24 22:22:20.391017,2025-04-24 22:23:14.180943,0 days 00:00:53.789926,False,absolute_error,22,,1,2,664,TPESampler,COMPLETE
4835,0.43257650526101976,2025-04-24 22:22:20.611955,2025-04-24 22:22:23.965464,0 days 00:00:03.353509,True,squared_error,36,,2,5,421,TPESampler,COMPLETE
4836,0.6193645585904124,2025-04-24 22:22:21.008821,2025-04-24 22:22:24.630505,0 days 00:00:03.621684,True,absolute_error,44,,15,8,615,TPESampler,COMPLETE
4837,0.3545107021821407,2025-04-24 22:22:22.660951,2025-04-24 22:22:24.937819,0 days 00:00:02.276868,True,squared_error,50,,1,5,284,TPESampler,COMPLETE
4838,0.35359685868074847,2025-04-24 22:22:22.904174,2025-04-24 22:22:25.894213,0 days 00:00:02.990039,True,squared_error,50,,1,5,476,TPESampler,COMPLETE
4839,0.6558804619112318,2025-04-24 22:22:24.230549,2025-04-24 22:22:25.451661,0 days 00:00:01.221112,False,squared_error,25,sqrt,3,2,174,TPESampler,COMPLETE
4840,0.34101665582402296,2025-04-24 22:22:24.945472,2025-04-24 22:22:28.651378,0 days 00:00:03.705906,True,squared_error,50,,1,3,446,TPESampler,COMPLETE
4841,0.4271959879296217,2025-04-24 22:22:25.288649,2025-04-24 22:22:29.017565,0 days 00:00:03.728916,True,squared_error,50,,2,3,682,TPESampler,COMPLETE
4842,0.5583847325340715,2025-04-24 22:22:25.885449,2025-04-24 22:22:31.622315,0 days 00:00:05.736866,False,absolute_error,38,log2,1,35,517,TPESampler,COMPLETE
4843,0.3428240690068987,2025-04-24 22:22:26.605489,2025-04-24 22:22:30.231270,0 days 00:00:03.625781,True,squared_error,50,,1,2,545,TPESampler,COMPLETE
4844,0.4287049056964055,2025-04-24 22:22:29.218092,2025-04-24 22:22:32.624419,0 days 00:00:03.406327,True,squared_error,42,,2,2,566,TPESampler,COMPLETE
4845,0.46738204571253694,2025-04-24 22:22:29.502342,2025-04-24 22:22:31.545214,0 days 00:00:02.042872,True,squared_error,44,log2,1,3,480,TPESampler,COMPLETE
4846,0.41287018410240217,2025-04-24 22:22:30.630479,2025-04-24 22:22:34.505001,0 days 00:00:03.874522,False,squared_error,50,,1,5,530,TPESampler,COMPLETE
4847,0.3759333734127163,2025-04-24 22:22:31.863663,2025-04-24 22:22:34.212620,0 days 00:00:02.348957,True,squared_error,50,sqrt,1,4,588,TPESampler,COMPLETE
4848,0.3421719877290419,2025-04-24 22:22:31.932881,2025-04-24 22:22:35.854430,0 days 00:00:03.921549,True,squared_error,50,,1,3,492,TPESampler,COMPLETE
4849,0.4270114492798187,2025-04-24 22:22:32.951208,2025-04-24 22:22:35.998683,0 days 00:00:03.047475,True,squared_error,43,,2,3,524,TPESampler,COMPLETE
4850,0.4271820686950597,2025-04-24 22:22:34.465738,2025-04-24 22:22:37.644688,0 days 00:00:03.178950,True,squared_error,49,,2,3,540,TPESampler,COMPLETE
4851,0.352600259097648,2025-04-24 22:22:34.794969,2025-04-24 22:22:38.410663,0 days 00:00:03.615694,True,squared_error,50,,1,5,527,TPESampler,COMPLETE
4852,0.3442267990528808,2025-04-24 22:22:36.122472,2025-04-24 22:22:39.789858,0 days 00:00:03.667386,True,squared_error,35,,1,3,575,TPESampler,COMPLETE
4853,0.4280483934297843,2025-04-24 22:22:36.273105,2025-04-24 22:22:39.343929,0 days 00:00:03.070824,True,squared_error,49,log2,1,2,834,TPESampler,COMPLETE
4854,0.37644896532305605,2025-04-24 22:22:37.893848,2025-04-24 22:22:40.693310,0 days 00:00:02.799462,True,squared_error,48,sqrt,1,2,807,TPESampler,COMPLETE
4855,0.42733980196039645,2025-04-24 22:22:38.718929,2025-04-24 22:22:42.363723,0 days 00:00:03.644794,True,squared_error,50,,2,2,521,TPESampler,COMPLETE
4856,0.3539591717733683,2025-04-24 22:22:39.656636,2025-04-24 22:22:43.246211,0 days 00:00:03.589575,True,squared_error,44,,1,5,460,TPESampler,COMPLETE
4857,0.34418904814107026,2025-04-24 22:22:40.172111,2025-04-24 22:22:44.559201,0 days 00:00:04.387090,True,squared_error,37,,1,2,590,TPESampler,COMPLETE
4858,0.34451206605689366,2025-04-24 22:22:41.107859,2025-04-24 22:22:43.988665,0 days 00:00:02.880806,True,squared_error,43,,1,3,283,TPESampler,COMPLETE
4859,0.7830934102599371,2025-04-24 22:22:41.178231,2025-04-24 22:22:45.862604,0 days 00:00:04.684373,False,absolute_error,6,sqrt,2,5,940,TPESampler,COMPLETE
4860,0.43677773431728817,2025-04-24 22:22:42.636715,2025-04-24 22:22:46.065406,0 days 00:00:03.428691,True,squared_error,50,,2,6,487,TPESampler,COMPLETE
4861,0.3417404486887402,2025-04-24 22:22:43.529527,2025-04-24 22:22:48.001600,0 days 00:00:04.472073,True,squared_error,50,,1,3,574,TPESampler,COMPLETE
4862,0.3486942652898799,2025-04-24 22:22:44.352594,2025-04-24 22:23:09.614408,0 days 00:00:25.261814,True,absolute_error,43,,1,2,447,TPESampler,COMPLETE
4863,0.34229784077617925,2025-04-24 22:22:45.090736,2025-04-24 22:22:49.765749,0 days 00:00:04.675013,True,squared_error,44,,1,3,599,TPESampler,COMPLETE
4864,0.8758991152536459,2025-04-24 22:22:46.440487,2025-04-24 22:22:48.870303,0 days 00:00:02.429816,False,absolute_error,34,log2,2,3,377,TPESampler,COMPLETE
4865,0.42743359752357446,2025-04-24 22:22:46.733274,2025-04-24 22:22:49.975215,0 days 00:00:03.241941,True,squared_error,44,,2,4,514,TPESampler,COMPLETE
4866,0.9768746785696203,2025-04-24 22:22:48.285873,2025-04-24 22:22:50.045725,0 days 00:00:01.759852,False,absolute_error,6,log2,10,8,753,TPESampler,COMPLETE
4867,0.3543872906506974,2025-04-24 22:22:49.402917,2025-04-24 22:22:52.659789,0 days 00:00:03.256872,True,squared_error,42,,1,5,440,TPESampler,COMPLETE
4868,0.3786281782686606,2025-04-24 22:22:50.218200,2025-04-24 22:23:48.328604,0 days 00:00:58.110404,False,absolute_error,36,,1,5,646,TPESampler,COMPLETE
4869,0.343468269236121,2025-04-24 22:22:50.418871,2025-04-24 22:22:55.959358,0 days 00:00:05.540487,True,squared_error,44,,1,2,549,TPESampler,COMPLETE
4870,0.3529096668173286,2025-04-24 22:22:50.381252,2025-04-24 22:22:54.849518,0 days 00:00:04.468266,True,squared_error,36,,1,5,604,TPESampler,COMPLETE
4871,0.3466290717050025,2025-04-24 22:22:53.257449,2025-04-24 22:22:57.592155,0 days 00:00:04.334706,True,squared_error,50,,1,4,654,TPESampler,COMPLETE
4872,0.4296997547111963,2025-04-24 22:22:55.116969,2025-04-24 22:22:57.222016,0 days 00:00:02.105047,True,squared_error,50,,2,3,400,TPESampler,COMPLETE
4873,0.4300692875321237,2025-04-24 22:22:56.509429,2025-04-24 22:23:01.860670,0 days 00:00:05.351241,False,squared_error,44,,1,2,601,TPESampler,COMPLETE
4874,0.34091216264960283,2025-04-24 22:22:57.589203,2025-04-24 22:23:00.758777,0 days 00:00:03.169574,True,squared_error,50,,1,3,530,TPESampler,COMPLETE
4875,0.42781331679004825,2025-04-24 22:22:58.028651,2025-04-24 22:23:00.555582,0 days 00:00:02.526931,True,squared_error,50,,2,2,508,TPESampler,COMPLETE
4876,0.3461427416401488,2025-04-24 22:23:00.801935,2025-04-24 22:23:04.389285,0 days 00:00:03.587350,True,squared_error,43,,1,4,554,TPESampler,COMPLETE
4877,0.3426065739337236,2025-04-24 22:23:01.032178,2025-04-24 22:23:04.493710,0 days 00:00:03.461532,True,squared_error,50,,1,2,595,TPESampler,COMPLETE
4878,0.42282543407239237,2025-04-24 22:23:02.120912,2025-04-24 22:23:03.766043,0 days 00:00:01.645131,True,squared_error,40,sqrt,1,8,499,TPESampler,COMPLETE
4879,0.3448152182152903,2025-04-24 22:23:04.018786,2025-04-24 22:23:06.746177,0 days 00:00:02.727391,True,squared_error,50,,1,2,321,TPESampler,COMPLETE
4880,0.3424096141777364,2025-04-24 22:23:04.759391,2025-04-24 22:23:07.775867,0 days 00:00:03.016476,True,squared_error,42,,1,3,401,TPESampler,COMPLETE
4881,0.3442365925340804,2025-04-24 22:23:04.815670,2025-04-24 22:23:08.063152,0 days 00:00:03.247482,True,squared_error,50,,1,2,509,TPESampler,COMPLETE
4882,0.34132020041393424,2025-04-24 22:23:07.002850,2025-04-24 22:23:11.054227,0 days 00:00:04.051377,True,squared_error,43,,1,3,592,TPESampler,COMPLETE
4883,0.6451468081926968,2025-04-24 22:23:08.133776,2025-04-24 22:23:09.999266,0 days 00:00:01.865490,True,squared_error,50,sqrt,2,2,600,TPESampler,COMPLETE
4884,0.9822131787796687,2025-04-24 22:23:08.359773,2025-04-24 22:23:09.729231,0 days 00:00:01.369458,False,absolute_error,43,log2,15,2,519,TPESampler,COMPLETE
4885,0.34318905962733104,2025-04-24 22:23:09.859898,2025-04-24 22:23:14.686084,0 days 00:00:04.826186,True,squared_error,44,,1,3,626,TPESampler,COMPLETE
4886,0.9190268229545961,2025-04-24 22:23:10.052552,2025-04-24 22:23:12.308146,0 days 00:00:02.255594,False,squared_error,42,log2,7,48,566,TPESampler,COMPLETE
4887,0.35453148687890135,2025-04-24 22:23:10.276843,2025-04-24 22:23:13.551454,0 days 00:00:03.274611,True,squared_error,43,,1,5,479,TPESampler,COMPLETE
4888,0.341698280613905,2025-04-24 22:23:11.527597,2025-04-24 22:23:15.590063,0 days 00:00:04.062466,True,squared_error,50,,1,3,558,TPESampler,COMPLETE
4889,0.3465993318312583,2025-04-24 22:23:12.622815,2025-04-24 22:23:15.186805,0 days 00:00:02.563990,True,squared_error,44,,1,4,390,TPESampler,COMPLETE
4890,0.4485083078825263,2025-04-24 22:23:13.812583,2025-04-24 22:23:18.316117,0 days 00:00:04.503534,False,squared_error,50,,2,3,646,TPESampler,COMPLETE
4891,0.42785303073048964,2025-04-24 22:23:14.646365,2025-04-24 22:23:18.419189,0 days 00:00:03.772824,True,squared_error,43,,2,4,614,TPESampler,COMPLETE
4892,0.3469073864779194,2025-04-24 22:23:15.043448,2025-04-24 22:23:19.042538,0 days 00:00:03.999090,True,squared_error,50,,1,4,651,TPESampler,COMPLETE
4893,0.34687535061776537,2025-04-24 22:23:15.532413,2025-04-24 22:23:18.980153,0 days 00:00:03.447740,True,squared_error,50,,1,4,515,TPESampler,COMPLETE
4894,0.3549808244499197,2025-04-24 22:23:16.088285,2025-04-24 22:23:20.704522,0 days 00:00:04.616237,True,squared_error,43,,1,5,713,TPESampler,COMPLETE
4895,0.5523427431422174,2025-04-24 22:23:18.559674,2025-04-24 22:23:22.094391,0 days 00:00:03.534717,False,absolute_error,34,log2,1,15,225,TPESampler,COMPLETE
4896,0.42761386366000304,2025-04-24 22:23:18.742846,2025-04-24 22:23:23.575197,0 days 00:00:04.832351,True,squared_error,44,,2,2,706,TPESampler,COMPLETE
4897,0.34513954897897614,2025-04-24 22:23:19.208198,2025-04-24 22:23:24.385801,0 days 00:00:05.177603,True,squared_error,43,,1,2,730,TPESampler,COMPLETE
4898,0.42713971436664594,2025-04-24 22:23:19.383456,2025-04-24 22:23:22.528518,0 days 00:00:03.145062,True,squared_error,50,,2,4,541,TPESampler,COMPLETE
4899,0.3438985089910846,2025-04-24 22:23:20.987337,2025-04-24 22:23:25.085533,0 days 00:00:04.098196,True,squared_error,50,,1,2,489,TPESampler,COMPLETE
4900,0.3462035591314935,2025-04-24 22:23:22.381592,2025-04-24 22:23:26.683944,0 days 00:00:04.302352,True,squared_error,43,,1,4,611,TPESampler,COMPLETE
4901,0.3547386866013262,2025-04-24 22:23:22.801563,2025-04-24 22:23:26.773015,0 days 00:00:03.971452,True,squared_error,43,,1,5,669,TPESampler,COMPLETE
4902,0.3444664290177514,2025-04-24 22:23:23.893443,2025-04-24 22:23:26.639905,0 days 00:00:02.746462,True,squared_error,44,,1,3,310,TPESampler,COMPLETE
4903,0.3522884186758917,2025-04-24 22:23:24.674241,2025-04-24 22:23:28.000069,0 days 00:00:03.325828,True,squared_error,50,,1,5,538,TPESampler,COMPLETE
4904,0.34349220608934605,2025-04-24 22:23:25.387545,2025-04-24 22:23:30.720083,0 days 00:00:05.332538,True,squared_error,43,,1,3,750,TPESampler,COMPLETE
4905,0.34409964656706993,2025-04-24 22:23:26.902271,2025-04-24 22:23:32.115134,0 days 00:00:05.212863,True,squared_error,43,,1,2,629,TPESampler,COMPLETE
4906,0.3782745113457356,2025-04-24 22:23:27.045733,2025-04-24 22:23:29.726597,0 days 00:00:02.680864,True,squared_error,49,sqrt,1,2,411,TPESampler,COMPLETE
4907,0.42849601155524,2025-04-24 22:23:27.096247,2025-04-24 22:23:30.430978,0 days 00:00:03.334731,True,squared_error,50,,2,3,565,TPESampler,COMPLETE
4908,0.421126906896836,2025-04-24 22:23:28.474858,2025-04-24 22:24:22.771642,0 days 00:00:54.296784,False,absolute_error,11,,1,10,917,TPESampler,COMPLETE
4909,0.3450203951667597,2025-04-24 22:23:29.993662,2025-04-24 22:23:34.487044,0 days 00:00:04.493382,True,squared_error,42,,1,2,502,TPESampler,COMPLETE
4910,0.35190626552497517,2025-04-24 22:23:30.713929,2025-04-24 22:23:53.582768,0 days 00:00:22.868839,True,absolute_error,42,,1,4,424,TPESampler,COMPLETE
4911,0.34166122879129873,2025-04-24 22:23:31.111016,2025-04-24 22:23:35.135157,0 days 00:00:04.024141,True,squared_error,50,,1,3,516,TPESampler,COMPLETE
4912,0.9147752842768848,2025-04-24 22:23:32.472745,2025-04-24 22:23:34.492842,0 days 00:00:02.020097,True,squared_error,44,sqrt,13,2,828,TPESampler,COMPLETE
4913,0.4315594959386381,2025-04-24 22:23:34.698583,2025-04-24 22:23:37.798543,0 days 00:00:03.099960,True,squared_error,50,log2,1,2,556,TPESampler,COMPLETE
4914,0.3468515765105078,2025-04-24 22:23:34.763153,2025-04-24 22:23:38.864905,0 days 00:00:04.101752,True,squared_error,44,,1,4,479,TPESampler,COMPLETE
4915,0.34242800862653194,2025-04-24 22:23:35.663363,2025-04-24 22:23:39.939761,0 days 00:00:04.276398,True,squared_error,43,,1,3,525,TPESampler,COMPLETE
4916,0.34207064602073217,2025-04-24 22:23:38.078926,2025-04-24 22:23:42.300416,0 days 00:00:04.221490,True,squared_error,43,,1,3,572,TPESampler,COMPLETE
4917,0.34255875029860816,2025-04-24 22:23:39.262304,2025-04-24 22:23:44.384295,0 days 00:00:05.121991,True,squared_error,50,,1,3,705,TPESampler,COMPLETE
4918,0.4326079580512232,2025-04-24 22:23:40.256990,2025-04-24 22:23:43.009971,0 days 00:00:02.752981,True,squared_error,50,,2,5,453,TPESampler,COMPLETE
4919,0.42867936920507116,2025-04-24 22:23:42.550584,2025-04-24 22:23:46.185727,0 days 00:00:03.635143,False,squared_error,49,,1,3,386,TPESampler,COMPLETE
4920,0.42761794493524313,2025-04-24 22:23:43.373047,2025-04-24 22:23:46.544577,0 days 00:00:03.171530,True,squared_error,50,,2,4,511,TPESampler,COMPLETE
4921,0.3616131572182017,2025-04-24 22:23:44.846387,2025-04-24 22:23:48.577640,0 days 00:00:03.731253,True,squared_error,50,,1,6,477,TPESampler,COMPLETE
4922,0.4284716696173754,2025-04-24 22:23:46.490174,2025-04-24 22:23:50.089282,0 days 00:00:03.599108,True,squared_error,44,,2,2,486,TPESampler,COMPLETE
4923,0.3429685454080067,2025-04-24 22:23:46.985203,2025-04-24 22:23:51.143646,0 days 00:00:04.158443,True,squared_error,50,,1,2,442,TPESampler,COMPLETE
4924,0.44374534572866997,2025-04-24 22:23:48.619427,2025-04-24 22:24:04.998109,0 days 00:00:16.378682,True,absolute_error,45,,2,3,577,TPESampler,COMPLETE
4925,0.42836159537406737,2025-04-24 22:23:48.853055,2025-04-24 22:23:52.906808,0 days 00:00:04.053753,True,squared_error,50,,2,3,633,TPESampler,COMPLETE
4926,0.3478373379845519,2025-04-24 22:23:50.344082,2025-04-24 22:23:55.317843,0 days 00:00:04.973761,True,squared_error,50,,1,4,743,TPESampler,COMPLETE
4927,0.42739745987448785,2025-04-24 22:23:51.650572,2025-04-24 22:23:55.617163,0 days 00:00:03.966591,True,squared_error,36,,2,3,729,TPESampler,COMPLETE
4928,0.3473127536089019,2025-04-24 22:23:53.156663,2025-04-24 22:23:55.615744,0 days 00:00:02.459081,True,squared_error,50,,1,4,335,TPESampler,COMPLETE
4929,0.3426801065304536,2025-04-24 22:23:53.853597,2025-04-24 22:23:57.377815,0 days 00:00:03.524218,True,squared_error,43,,1,3,665,TPESampler,COMPLETE
4930,0.34452488050899965,2025-04-24 22:23:55.571207,2025-04-24 22:24:00.220370,0 days 00:00:04.649163,True,squared_error,50,,1,2,673,TPESampler,COMPLETE
4931,0.3623569584443649,2025-04-24 22:23:55.929946,2025-04-24 22:24:00.297708,0 days 00:00:04.367762,True,squared_error,50,,1,6,731,TPESampler,COMPLETE
4932,0.3808475327714044,2025-04-24 22:23:56.115095,2025-04-24 22:24:07.830479,0 days 00:00:11.715384,True,absolute_error,16,,1,6,249,TPESampler,COMPLETE
4933,0.34075810833057363,2025-04-24 22:23:57.728672,2025-04-24 22:24:00.788802,0 days 00:00:03.060130,True,squared_error,50,,1,3,540,TPESampler,COMPLETE
4934,0.3447098333320172,2025-04-24 22:24:00.423060,2025-04-24 22:24:03.118662,0 days 00:00:02.695602,True,squared_error,40,,1,2,301,TPESampler,COMPLETE
4935,0.34496552728430235,2025-04-24 22:24:00.632996,2025-04-24 22:24:03.123842,0 days 00:00:02.490846,True,squared_error,40,,1,2,284,TPESampler,COMPLETE
4936,0.9465709829073338,2025-04-24 22:24:01.044501,2025-04-24 22:24:03.213049,0 days 00:00:02.168548,False,absolute_error,28,log2,4,4,936,TPESampler,COMPLETE
4937,0.4288991425610744,2025-04-24 22:24:03.364893,2025-04-24 22:24:05.764004,0 days 00:00:02.399111,True,squared_error,50,,2,3,473,TPESampler,COMPLETE
4938,0.3441157030863727,2025-04-24 22:24:03.577954,2025-04-24 22:24:07.036874,0 days 00:00:03.458920,True,squared_error,50,,1,2,475,TPESampler,COMPLETE
4939,0.3416390477484435,2025-04-24 22:24:05.250983,2025-04-24 22:24:08.565134,0 days 00:00:03.314151,True,squared_error,50,,1,3,471,TPESampler,COMPLETE
4940,0.41233575493140096,2025-04-24 22:24:07.304591,2025-04-24 22:24:12.404824,0 days 00:00:05.100233,False,squared_error,50,,1,4,683,TPESampler,COMPLETE
4941,0.5901962761176294,2025-04-24 22:24:08.814600,2025-04-24 22:24:10.418479,0 days 00:00:01.603879,True,squared_error,31,,14,6,411,TPESampler,COMPLETE
4942,0.3424167687386512,2025-04-24 22:24:10.664402,2025-04-24 22:24:12.941001,0 days 00:00:02.276599,True,squared_error,50,,1,3,312,TPESampler,COMPLETE
4943,0.34686126458638095,2025-04-24 22:24:12.652240,2025-04-24 22:24:15.557060,0 days 00:00:02.904820,True,squared_error,50,,1,4,358,TPESampler,COMPLETE
4944,0.342867223516309,2025-04-24 22:24:13.565199,2025-04-24 22:24:17.146450,0 days 00:00:03.581251,True,squared_error,43,,1,3,514,TPESampler,COMPLETE
4945,0.63833446476535,2025-04-24 22:24:15.811961,2025-04-24 22:24:30.782974,0 days 00:00:14.971013,False,absolute_error,48,,6,35,982,TPESampler,COMPLETE
4946,0.34388182657364985,2025-04-24 22:24:17.401765,2025-04-24 22:24:20.032725,0 days 00:00:02.630960,True,squared_error,50,,1,2,404,TPESampler,COMPLETE
4947,0.34305790515754503,2025-04-24 22:24:20.287410,2025-04-24 22:24:22.983822,0 days 00:00:02.696412,True,squared_error,44,,1,3,408,TPESampler,COMPLETE
