number,value,datetime_start,datetime_complete,duration,params_bootstrap,params_criterion,params_max_depth,params_max_features,params_min_samples_leaf,params_min_samples_split,params_n_estimators,system_attrs_auto:sampler,state
3108,0.44615529064687753,2025-04-24 21:57:28.062073,2025-04-24 21:57:31.229937,0 days 00:00:03.167864,True,squared_error,46,,2,8,562,TPESampler,COMPLETE
3109,0.43097034694252945,2025-04-24 21:57:28.189249,2025-04-24 21:57:31.679583,0 days 00:00:03.490334,True,squared_error,44,,2,5,610,TPESampler,COMPLETE
3110,0.34691169346769646,2025-04-24 21:57:28.460995,2025-04-24 21:57:32.831216,0 days 00:00:04.370221,True,squared_error,50,,1,4,646,TPESampler,COMPLETE
3111,0.34682645377269256,2025-04-24 21:57:30.406625,2025-04-24 21:57:34.890953,0 days 00:00:04.484328,True,squared_error,50,,1,4,628,TPESampler,COMPLETE
3112,0.4270718622450538,2025-04-24 21:57:31.030474,2025-04-24 21:57:35.133688,0 days 00:00:04.103214,True,squared_error,40,,2,2,655,TPESampler,COMPLETE
3113,0.39065869222475824,2025-04-24 21:57:31.555707,2025-04-24 21:57:33.949317,0 days 00:00:02.393610,True,squared_error,38,sqrt,1,3,487,TPESampler,COMPLETE
3114,0.4287378588896984,2025-04-24 21:57:32.301677,2025-04-24 21:57:35.519139,0 days 00:00:03.217462,True,squared_error,44,,2,2,571,TPESampler,COMPLETE
3115,0.42777267017730264,2025-04-24 21:57:32.924872,2025-04-24 21:57:37.269397,0 days 00:00:04.344525,True,squared_error,50,,2,2,603,TPESampler,COMPLETE
3116,0.987946320368136,2025-04-24 21:57:33.095854,2025-04-24 21:57:35.869577,0 days 00:00:02.773723,True,absolute_error,7,log2,13,34,952,TPESampler,COMPLETE
3117,0.3435613132432049,2025-04-24 21:57:34.269957,2025-04-24 21:57:38.855853,0 days 00:00:04.585896,True,squared_error,50,,1,2,618,TPESampler,COMPLETE
3118,0.3418541510841179,2025-04-24 21:57:35.202505,2025-04-24 21:57:40.459628,0 days 00:00:05.257123,True,squared_error,50,,1,3,833,TPESampler,COMPLETE
3119,0.42842503339684485,2025-04-24 21:57:35.465899,2025-04-24 21:57:38.984095,0 days 00:00:03.518196,True,squared_error,44,,2,3,638,TPESampler,COMPLETE
3120,0.34369749522238635,2025-04-24 21:57:35.795780,2025-04-24 21:57:40.888799,0 days 00:00:05.093019,True,squared_error,50,,1,2,653,TPESampler,COMPLETE
3121,0.3415336874360002,2025-04-24 21:57:36.198109,2025-04-24 21:57:40.429237,0 days 00:00:04.231128,True,squared_error,50,,1,3,622,TPESampler,COMPLETE
3122,0.34181369454764066,2025-04-24 21:57:37.654449,2025-04-24 21:57:41.175402,0 days 00:00:03.520953,True,squared_error,50,,1,3,623,TPESampler,COMPLETE
3123,0.34249326334814195,2025-04-24 21:57:39.044805,2025-04-24 21:57:42.788150,0 days 00:00:03.743345,True,squared_error,42,,1,3,526,TPESampler,COMPLETE
3124,0.4273471257958545,2025-04-24 21:57:39.215713,2025-04-24 21:57:42.501001,0 days 00:00:03.285288,True,squared_error,45,,2,4,513,TPESampler,COMPLETE
3125,0.44781213125085684,2025-04-24 21:57:40.607392,2025-04-24 21:57:44.471234,0 days 00:00:03.863842,False,squared_error,49,,2,5,503,TPESampler,COMPLETE
3126,0.542135285839906,2025-04-24 21:57:40.670097,2025-04-24 21:57:46.278271,0 days 00:00:05.608174,False,absolute_error,45,,4,23,182,TPESampler,COMPLETE
3127,0.34215541802512284,2025-04-24 21:57:41.175910,2025-04-24 21:57:46.010959,0 days 00:00:04.835049,True,squared_error,50,,1,3,664,TPESampler,COMPLETE
3128,0.927321696166429,2025-04-24 21:57:41.577626,2025-04-24 21:57:43.102249,0 days 00:00:01.524623,False,squared_error,33,log2,9,6,745,TPESampler,COMPLETE
3129,0.34319996098269234,2025-04-24 21:57:42.739648,2025-04-24 21:57:46.767613,0 days 00:00:04.027965,True,squared_error,50,,1,2,554,TPESampler,COMPLETE
3130,0.8445161599732028,2025-04-24 21:57:43.090220,2025-04-24 21:57:44.475003,0 days 00:00:01.384783,False,squared_error,23,log2,2,3,158,TPESampler,COMPLETE
3131,0.35445675745652044,2025-04-24 21:57:43.336991,2025-04-24 21:57:47.207905,0 days 00:00:03.870914,True,squared_error,44,,1,5,638,TPESampler,COMPLETE
3132,0.35464422475338553,2025-04-24 21:57:44.740902,2025-04-24 21:57:48.132602,0 days 00:00:03.391700,True,squared_error,43,,1,5,492,TPESampler,COMPLETE
3133,0.3423657132859829,2025-04-24 21:57:44.875324,2025-04-24 21:57:49.300829,0 days 00:00:04.425505,True,squared_error,43,,1,3,565,TPESampler,COMPLETE
3134,0.4275258212458562,2025-04-24 21:57:46.308984,2025-04-24 21:57:50.093381,0 days 00:00:03.784397,True,squared_error,50,,2,3,601,TPESampler,COMPLETE
3135,0.35293679244692355,2025-04-24 21:57:47.127945,2025-04-24 21:57:52.081858,0 days 00:00:04.953913,True,squared_error,50,,1,5,566,TPESampler,COMPLETE
3136,0.3417880699735418,2025-04-24 21:57:47.145765,2025-04-24 21:57:51.531904,0 days 00:00:04.386139,True,squared_error,50,,1,3,557,TPESampler,COMPLETE
3137,0.36970809436270907,2025-04-24 21:57:48.085297,2025-04-24 21:57:52.429012,0 days 00:00:04.343715,True,squared_error,43,,1,7,638,TPESampler,COMPLETE
3138,0.3447770417144802,2025-04-24 21:57:48.488690,2025-04-24 21:57:54.033656,0 days 00:00:05.544966,True,squared_error,42,,1,2,662,TPESampler,COMPLETE
3139,0.34260477151311264,2025-04-24 21:57:49.849447,2025-04-24 21:57:53.516351,0 days 00:00:03.666904,True,squared_error,43,,1,3,490,TPESampler,COMPLETE
3140,0.6754739278357575,2025-04-24 21:57:50.343692,2025-04-24 21:57:51.796806,0 days 00:00:01.453114,False,absolute_error,49,sqrt,3,4,115,TPESampler,COMPLETE
3141,0.37195888908174535,2025-04-24 21:57:51.752556,2025-04-24 21:57:54.791603,0 days 00:00:03.039047,True,squared_error,34,,1,7,503,TPESampler,COMPLETE
3142,0.647817181308093,2025-04-24 21:57:52.248024,2025-04-24 21:57:54.319482,0 days 00:00:02.071458,True,squared_error,48,sqrt,2,3,538,TPESampler,COMPLETE
3143,0.4274197176734321,2025-04-24 21:57:52.549631,2025-04-24 21:57:56.249458,0 days 00:00:03.699827,True,squared_error,44,,2,3,676,TPESampler,COMPLETE
3144,0.34727059531402227,2025-04-24 21:57:52.904396,2025-04-24 21:57:57.676170,0 days 00:00:04.771774,True,squared_error,50,,1,4,635,TPESampler,COMPLETE
3145,0.6348656087537963,2025-04-24 21:57:54.151080,2025-04-24 21:57:56.194646,0 days 00:00:02.043566,False,squared_error,43,,15,2,136,TPESampler,COMPLETE
3146,0.42825506419226256,2025-04-24 21:57:54.456069,2025-04-24 21:57:57.913283,0 days 00:00:03.457214,True,squared_error,42,,2,4,561,TPESampler,COMPLETE
3147,0.42732736180055986,2025-04-24 21:57:54.746411,2025-04-24 21:57:57.923782,0 days 00:00:03.177371,True,squared_error,44,,2,2,519,TPESampler,COMPLETE
3148,0.4113719768629103,2025-04-24 21:57:55.228977,2025-04-24 21:58:00.763752,0 days 00:00:05.534775,False,squared_error,49,,1,4,659,TPESampler,COMPLETE
3149,0.8800557038191632,2025-04-24 21:57:56.393216,2025-04-24 21:57:58.791327,0 days 00:00:02.398111,True,squared_error,49,log2,2,2,410,TPESampler,COMPLETE
3150,0.3410775426201463,2025-04-24 21:57:56.712678,2025-04-24 21:58:01.060347,0 days 00:00:04.347669,True,squared_error,50,,1,3,534,TPESampler,COMPLETE
3151,0.34456620169204544,2025-04-24 21:57:58.130430,2025-04-24 21:58:03.494935,0 days 00:00:05.364505,True,squared_error,50,,1,2,691,TPESampler,COMPLETE
3152,0.34321337453573625,2025-04-24 21:57:58.168278,2025-04-24 21:58:03.112582,0 days 00:00:04.944304,True,squared_error,50,,1,3,730,TPESampler,COMPLETE
3153,0.42762280818932186,2025-04-24 21:57:58.184279,2025-04-24 21:58:02.075960,0 days 00:00:03.891681,True,squared_error,50,,2,2,606,TPESampler,COMPLETE
3154,0.42781331679004825,2025-04-24 21:57:59.095361,2025-04-24 21:58:01.977905,0 days 00:00:02.882544,True,squared_error,50,,2,3,508,TPESampler,COMPLETE
3155,0.3445578163869114,2025-04-24 21:58:00.990638,2025-04-24 21:58:05.659915,0 days 00:00:04.669277,True,squared_error,41,,1,3,707,TPESampler,COMPLETE
3156,0.3439943776369363,2025-04-24 21:58:01.315981,2025-04-24 21:58:05.285646,0 days 00:00:03.969665,True,squared_error,43,,1,2,483,TPESampler,COMPLETE
3157,0.5355378604823454,2025-04-24 21:58:02.365977,2025-04-24 21:58:04.359610,0 days 00:00:01.993633,True,squared_error,44,,5,15,357,TPESampler,COMPLETE
3158,0.47368627627357696,2025-04-24 21:58:02.375998,2025-04-24 21:58:04.830458,0 days 00:00:02.454460,True,squared_error,24,sqrt,1,5,718,TPESampler,COMPLETE
3159,0.4434078799508316,2025-04-24 21:58:03.611903,2025-04-24 21:58:21.257529,0 days 00:00:17.645626,True,absolute_error,39,,2,3,634,TPESampler,COMPLETE
3160,0.3445670813474057,2025-04-24 21:58:03.728340,2025-04-24 21:58:07.942192,0 days 00:00:04.213852,True,squared_error,42,,1,2,560,TPESampler,COMPLETE
3161,0.4290715376082455,2025-04-24 21:58:04.773290,2025-04-24 21:58:07.680056,0 days 00:00:02.906766,True,squared_error,50,log2,1,2,611,TPESampler,COMPLETE
3162,0.34609150176977543,2025-04-24 21:58:05.111736,2025-04-24 21:58:09.034860,0 days 00:00:03.923124,True,squared_error,50,,1,4,611,TPESampler,COMPLETE
3163,0.42662053570279324,2025-04-24 21:58:05.601948,2025-04-24 21:58:11.005687,0 days 00:00:05.403739,False,squared_error,40,,1,3,729,TPESampler,COMPLETE
3164,0.42761794493524313,2025-04-24 21:58:06.134794,2025-04-24 21:58:09.386701,0 days 00:00:03.251907,True,squared_error,50,,2,2,511,TPESampler,COMPLETE
3165,0.34436042225262803,2025-04-24 21:58:07.897560,2025-04-24 21:58:11.541848,0 days 00:00:03.644288,True,squared_error,44,,1,2,482,TPESampler,COMPLETE
3166,0.34286409915956756,2025-04-24 21:58:08.358056,2025-04-24 21:58:12.800730,0 days 00:00:04.442674,True,squared_error,44,,1,3,577,TPESampler,COMPLETE
3167,0.3539754875833191,2025-04-24 21:58:09.368792,2025-04-24 21:58:13.503120,0 days 00:00:04.134328,True,squared_error,50,,1,5,776,TPESampler,COMPLETE
3168,0.8746546092274925,2025-04-24 21:58:09.704530,2025-04-24 21:58:11.532578,0 days 00:00:01.828048,False,absolute_error,28,sqrt,6,5,672,TPESampler,COMPLETE
3169,0.3548721999548034,2025-04-24 21:58:11.238576,2025-04-24 21:58:13.887051,0 days 00:00:02.648475,True,squared_error,42,,1,5,477,TPESampler,COMPLETE
3170,0.3776175394991073,2025-04-24 21:58:11.720307,2025-04-24 21:58:15.443319,0 days 00:00:03.723012,True,squared_error,50,,1,8,516,TPESampler,COMPLETE
3171,0.43045867423655043,2025-04-24 21:58:11.772906,2025-04-24 21:58:16.001340,0 days 00:00:04.228434,True,squared_error,42,,2,5,720,TPESampler,COMPLETE
3172,0.3479055656800319,2025-04-24 21:58:13.456921,2025-04-24 21:58:17.302144,0 days 00:00:03.845223,True,squared_error,35,,1,4,584,TPESampler,COMPLETE
3173,0.5694808576306061,2025-04-24 21:58:13.843249,2025-04-24 21:58:16.258824,0 days 00:00:02.415575,True,squared_error,29,log2,1,5,668,TPESampler,COMPLETE
3174,0.3451469369615078,2025-04-24 21:58:14.365019,2025-04-24 21:58:19.088360,0 days 00:00:04.723341,True,squared_error,43,,1,2,723,TPESampler,COMPLETE
3175,0.3426710386399843,2025-04-24 21:58:15.666463,2025-04-24 21:58:20.098279,0 days 00:00:04.431816,True,squared_error,50,,1,2,540,TPESampler,COMPLETE
3176,0.9112621593928862,2025-04-24 21:58:16.317687,2025-04-24 21:58:18.000978,0 days 00:00:01.683291,True,squared_error,16,log2,3,31,419,TPESampler,COMPLETE
3177,0.3430431452986773,2025-04-24 21:58:16.588562,2025-04-24 21:58:20.865992,0 days 00:00:04.277430,True,squared_error,43,,1,3,707,TPESampler,COMPLETE
3178,0.3410775426201463,2025-04-24 21:58:17.715807,2025-04-24 21:58:21.490602,0 days 00:00:03.774795,True,squared_error,50,,1,3,534,TPESampler,COMPLETE
3179,0.34796226874547137,2025-04-24 21:58:18.290623,2025-04-24 21:58:21.608075,0 days 00:00:03.317452,True,squared_error,42,,1,4,488,TPESampler,COMPLETE
3180,0.3463031749722893,2025-04-24 21:58:19.373369,2025-04-24 21:58:23.409628,0 days 00:00:04.036259,True,squared_error,50,,1,4,622,TPESampler,COMPLETE
3181,0.37990498062880534,2025-04-24 21:58:20.377319,2025-04-24 21:59:15.852049,0 days 00:00:55.474730,False,absolute_error,49,,1,4,593,TPESampler,COMPLETE
3182,0.5889706258541512,2025-04-24 21:58:21.162055,2025-04-24 21:58:34.557736,0 days 00:00:13.395681,False,absolute_error,40,,7,2,937,TPESampler,COMPLETE
3183,0.5031457742782445,2025-04-24 21:58:21.528659,2025-04-24 21:58:54.351142,0 days 00:00:32.822483,False,absolute_error,36,,1,35,379,TPESampler,COMPLETE
3184,0.44757010182037865,2025-04-24 21:58:21.726378,2025-04-24 21:58:24.076329,0 days 00:00:02.349951,True,squared_error,11,,1,18,439,TPESampler,COMPLETE
3185,0.34692753226811884,2025-04-24 21:58:21.913204,2025-04-24 21:58:25.339584,0 days 00:00:03.426380,True,squared_error,50,,1,4,484,TPESampler,COMPLETE
3186,0.428207074119678,2025-04-24 21:58:23.627770,2025-04-24 21:58:26.346944,0 days 00:00:02.719174,True,squared_error,50,,2,3,620,TPESampler,COMPLETE
3187,0.5027333216262366,2025-04-24 21:58:24.348897,2025-04-24 21:58:28.293090,0 days 00:00:03.944193,False,squared_error,18,,2,32,935,TPESampler,COMPLETE
3188,0.42742536409834997,2025-04-24 21:58:25.567017,2025-04-24 21:58:28.495789,0 days 00:00:02.928772,True,squared_error,50,,2,2,733,TPESampler,COMPLETE
3189,0.3614368033589624,2025-04-24 21:58:26.585430,2025-04-24 21:58:29.648720,0 days 00:00:03.063290,True,squared_error,50,,1,6,643,TPESampler,COMPLETE
3190,0.4388474156441201,2025-04-24 21:58:28.546014,2025-04-24 21:58:30.199873,0 days 00:00:01.653859,False,squared_error,21,,2,3,157,TPESampler,COMPLETE
3191,0.3415336874360002,2025-04-24 21:58:28.825757,2025-04-24 21:58:32.685491,0 days 00:00:03.859734,True,squared_error,50,,1,3,622,TPESampler,COMPLETE
3192,0.9138488717242377,2025-04-24 21:58:29.959831,2025-04-24 21:58:31.254055,0 days 00:00:01.294224,True,squared_error,31,sqrt,12,8,518,TPESampler,COMPLETE
3193,0.34344542713599735,2025-04-24 21:58:30.421331,2025-04-24 21:58:34.107881,0 days 00:00:03.686550,True,squared_error,50,,1,2,559,TPESampler,COMPLETE
3194,0.42695505482607393,2025-04-24 21:58:31.470249,2025-04-24 21:58:33.806184,0 days 00:00:02.335935,True,squared_error,43,,2,3,530,TPESampler,COMPLETE
3195,0.9596451386627836,2025-04-24 21:58:32.895752,2025-04-24 21:58:34.311349,0 days 00:00:01.415597,False,absolute_error,27,log2,5,6,692,TPESampler,COMPLETE
3196,0.3435682580791099,2025-04-24 21:58:34.029226,2025-04-24 21:58:37.732332,0 days 00:00:03.703106,True,squared_error,50,,1,2,561,TPESampler,COMPLETE
3197,0.42863908242328314,2025-04-24 21:58:34.356285,2025-04-24 21:58:37.185676,0 days 00:00:02.829391,True,squared_error,42,,2,3,482,TPESampler,COMPLETE
3198,0.3420507072075086,2025-04-24 21:58:34.615250,2025-04-24 21:58:38.409795,0 days 00:00:03.794545,True,squared_error,50,,1,3,506,TPESampler,COMPLETE
3199,0.3412373754915582,2025-04-24 21:58:34.801403,2025-04-24 21:58:38.021538,0 days 00:00:03.220135,True,squared_error,50,,1,3,523,TPESampler,COMPLETE
3200,0.3533965128636359,2025-04-24 21:58:37.391942,2025-04-24 21:58:40.460837,0 days 00:00:03.068895,True,squared_error,50,,1,5,512,TPESampler,COMPLETE
3201,0.36812939109550863,2025-04-24 21:58:37.969549,2025-04-24 21:58:41.105860,0 days 00:00:03.136311,True,squared_error,15,,1,2,505,TPESampler,COMPLETE
3202,0.8428563666536865,2025-04-24 21:58:38.326947,2025-04-24 21:58:39.782253,0 days 00:00:01.455306,False,squared_error,11,log2,2,46,437,TPESampler,COMPLETE
3203,0.4365951236490256,2025-04-24 21:58:38.691113,2025-04-24 21:58:41.292573,0 days 00:00:02.601460,True,squared_error,45,,2,6,505,TPESampler,COMPLETE
3204,0.36268901506577855,2025-04-24 21:58:39.991409,2025-04-24 21:58:43.957039,0 days 00:00:03.965630,True,squared_error,44,,1,6,740,TPESampler,COMPLETE
3205,0.9132554154327159,2025-04-24 21:58:40.724184,2025-04-24 21:58:42.205637,0 days 00:00:01.481453,False,squared_error,10,sqrt,14,11,632,TPESampler,COMPLETE
3206,0.4479685812091507,2025-04-24 21:58:41.341965,2025-04-24 21:58:44.119983,0 days 00:00:02.778018,True,squared_error,50,,2,9,625,TPESampler,COMPLETE
3207,0.9399499212529195,2025-04-24 21:58:41.763318,2025-04-24 21:58:43.356159,0 days 00:00:01.592841,True,squared_error,35,log2,15,2,455,TPESampler,COMPLETE
3208,0.3465557211004145,2025-04-24 21:58:42.514907,2025-04-24 21:58:46.686760,0 days 00:00:04.171853,True,squared_error,44,,1,4,621,TPESampler,COMPLETE
3209,0.7869604189143413,2025-04-24 21:58:43.794075,2025-04-24 21:58:45.004017,0 days 00:00:01.209942,False,squared_error,13,sqrt,5,9,317,TPESampler,COMPLETE
3210,0.42787508496165794,2025-04-24 21:58:44.185927,2025-04-24 21:58:47.257625,0 days 00:00:03.071698,True,squared_error,50,,2,4,610,TPESampler,COMPLETE
3211,0.3426713559820976,2025-04-24 21:58:44.477763,2025-04-24 21:58:48.328232,0 days 00:00:03.850469,True,squared_error,43,,1,2,545,TPESampler,COMPLETE
3212,0.3464061999008723,2025-04-24 21:58:45.257164,2025-04-24 21:58:48.659105,0 days 00:00:03.401941,True,squared_error,50,,1,4,560,TPESampler,COMPLETE
3213,0.34335341889054105,2025-04-24 21:58:46.923096,2025-04-24 21:58:50.802184,0 days 00:00:03.879088,True,squared_error,42,,1,3,668,TPESampler,COMPLETE
3214,0.35270794864097915,2025-04-24 21:58:47.489033,2025-04-24 21:58:50.743632,0 days 00:00:03.254599,True,squared_error,43,,1,5,551,TPESampler,COMPLETE
3215,0.427192007757137,2025-04-24 21:58:48.579587,2025-04-24 21:58:51.687683,0 days 00:00:03.108096,True,squared_error,50,,2,4,659,TPESampler,COMPLETE
3216,0.4276148986002271,2025-04-24 21:58:48.890489,2025-04-24 21:58:51.881615,0 days 00:00:02.991126,True,squared_error,50,,2,4,602,TPESampler,COMPLETE
3217,0.35007558398608235,2025-04-24 21:58:51.035367,2025-04-24 21:59:21.178746,0 days 00:00:30.143379,True,absolute_error,44,,1,4,538,TPESampler,COMPLETE
3218,0.42713971436664594,2025-04-24 21:58:51.047075,2025-04-24 21:58:54.324972,0 days 00:00:03.277897,True,squared_error,50,,2,2,541,TPESampler,COMPLETE
3219,0.34517561850528355,2025-04-24 21:58:52.003414,2025-04-24 21:58:56.420875,0 days 00:00:04.417461,True,squared_error,44,,1,2,730,TPESampler,COMPLETE
3220,0.34270149100441694,2025-04-24 21:58:52.232437,2025-04-24 21:58:56.061765,0 days 00:00:03.829328,True,squared_error,43,,1,3,638,TPESampler,COMPLETE
3221,0.3416807698021571,2025-04-24 21:58:54.556110,2025-04-24 21:58:58.119930,0 days 00:00:03.563820,True,squared_error,50,,1,3,559,TPESampler,COMPLETE
3222,0.5010564527358674,2025-04-24 21:58:54.559971,2025-04-24 21:58:56.056336,0 days 00:00:01.496365,True,squared_error,38,log2,1,5,380,TPESampler,COMPLETE
3223,0.3429524305398485,2025-04-24 21:58:56.340305,2025-04-24 21:59:00.698567,0 days 00:00:04.358262,True,squared_error,50,,1,3,767,TPESampler,COMPLETE
3224,0.34633018633361845,2025-04-24 21:58:56.360990,2025-04-24 21:58:59.250252,0 days 00:00:02.889262,True,squared_error,43,,1,4,441,TPESampler,COMPLETE
3225,0.341623611019489,2025-04-24 21:58:56.706091,2025-04-24 21:59:00.482319,0 days 00:00:03.776228,True,squared_error,50,,1,3,619,TPESampler,COMPLETE
3226,0.3438518126131058,2025-04-24 21:58:58.346724,2025-04-24 21:59:02.044537,0 days 00:00:03.697813,True,squared_error,50,,1,2,521,TPESampler,COMPLETE
3227,0.3419873997717884,2025-04-24 21:58:59.563884,2025-04-24 21:59:02.330684,0 days 00:00:02.766800,True,squared_error,43,,1,3,429,TPESampler,COMPLETE
3228,0.3455471297463016,2025-04-24 21:59:00.721237,2025-04-24 21:59:03.639265,0 days 00:00:02.918028,True,squared_error,34,,1,2,432,TPESampler,COMPLETE
3229,0.34396502386467426,2025-04-24 21:59:01.014434,2025-04-24 21:59:05.268330,0 days 00:00:04.253896,True,squared_error,50,,1,2,647,TPESampler,COMPLETE
3230,0.42873132790728574,2025-04-24 21:59:02.285738,2025-04-24 21:59:04.981500,0 days 00:00:02.695762,True,squared_error,50,,2,3,477,TPESampler,COMPLETE
3231,0.3463703141590922,2025-04-24 21:59:02.667076,2025-04-24 21:59:06.373496,0 days 00:00:03.706420,True,squared_error,43,,1,4,579,TPESampler,COMPLETE
3232,0.3434196823577842,2025-04-24 21:59:03.856366,2025-04-24 21:59:07.270594,0 days 00:00:03.414228,True,squared_error,43,,1,2,558,TPESampler,COMPLETE
3233,0.34285166649573307,2025-04-24 21:59:05.192003,2025-04-24 21:59:09.235291,0 days 00:00:04.043288,True,squared_error,43,,1,3,705,TPESampler,COMPLETE
3234,0.4605318378874262,2025-04-24 21:59:05.499271,2025-04-24 21:59:15.419643,0 days 00:00:09.920372,False,absolute_error,20,,1,17,126,TPESampler,COMPLETE
3235,0.3421671148333855,2025-04-24 21:59:06.635636,2025-04-24 21:59:10.540346,0 days 00:00:03.904710,True,squared_error,50,,1,3,663,TPESampler,COMPLETE
3236,0.3460366426288593,2025-04-24 21:59:07.549496,2025-04-24 21:59:31.742144,0 days 00:00:24.192648,True,absolute_error,40,,1,2,413,TPESampler,COMPLETE
3237,0.3429766496018246,2025-04-24 21:59:09.456138,2025-04-24 21:59:12.609111,0 days 00:00:03.152973,True,squared_error,43,,1,3,512,TPESampler,COMPLETE
3238,0.34170655141261064,2025-04-24 21:59:10.766953,2025-04-24 21:59:14.105824,0 days 00:00:03.338871,True,squared_error,43,,1,3,545,TPESampler,COMPLETE
3239,0.3449622372246507,2025-04-24 21:59:12.856167,2025-04-24 21:59:18.237684,0 days 00:00:05.381517,True,squared_error,50,,1,2,756,TPESampler,COMPLETE
3240,0.8809073346609996,2025-04-24 21:59:14.376869,2025-04-24 21:59:15.825519,0 days 00:00:01.448650,True,squared_error,49,log2,2,3,564,TPESampler,COMPLETE
3241,0.36901823504780557,2025-04-24 21:59:15.652514,2025-04-24 21:59:18.427134,0 days 00:00:02.774620,True,squared_error,50,,1,7,521,TPESampler,COMPLETE
3242,0.4241234380578799,2025-04-24 21:59:16.076550,2025-04-24 21:59:21.510643,0 days 00:00:05.434093,True,absolute_error,32,sqrt,1,2,512,TPESampler,COMPLETE
3243,0.3459618495222167,2025-04-24 21:59:16.141732,2025-04-24 21:59:20.058923,0 days 00:00:03.917191,True,squared_error,50,,1,4,535,TPESampler,COMPLETE
3244,0.42733995970632677,2025-04-24 21:59:18.472455,2025-04-24 21:59:22.171717,0 days 00:00:03.699262,True,squared_error,43,,2,4,727,TPESampler,COMPLETE
3245,0.5143769363096111,2025-04-24 21:59:18.659443,2025-04-24 21:59:30.647033,0 days 00:00:11.987590,True,absolute_error,25,,4,45,964,TPESampler,COMPLETE
3246,0.35334829294392023,2025-04-24 21:59:20.328299,2025-04-24 21:59:24.472583,0 days 00:00:04.144284,True,squared_error,50,,1,5,627,TPESampler,COMPLETE
3247,0.43822899437003193,2025-04-24 21:59:21.405851,2025-04-24 21:59:23.463441,0 days 00:00:02.057590,True,squared_error,43,,2,6,417,TPESampler,COMPLETE
3248,0.42855829842770476,2025-04-24 21:59:21.767588,2025-04-24 21:59:25.086437,0 days 00:00:03.318849,True,squared_error,50,,2,2,577,TPESampler,COMPLETE
3249,0.3445295793783391,2025-04-24 21:59:22.514821,2025-04-24 21:59:27.551226,0 days 00:00:05.036405,True,squared_error,50,,1,2,703,TPESampler,COMPLETE
