number,value,datetime_start,datetime_complete,duration,params_bootstrap,params_criterion,params_max_depth,params_max_features,params_min_samples_leaf,params_min_samples_split,params_n_estimators,system_attrs_auto:sampler,state
850,0.34485908277126837,2025-04-24 21:28:26.355656,2025-04-24 21:28:30.345752,0 days 00:00:03.990096,True,squared_error,41,,1,3,715,TPESampler,COMPLETE
851,0.3609023815282024,2025-04-24 21:28:27.928012,2025-04-24 21:28:30.094304,0 days 00:00:02.166292,True,squared_error,50,,1,6,414,TPESampler,COMPLETE
852,0.4087847653526845,2025-04-24 21:28:29.022611,2025-04-24 21:28:31.433623,0 days 00:00:02.411012,False,squared_error,39,,1,4,390,TPESampler,COMPLETE
853,0.428661350830403,2025-04-24 21:28:30.276235,2025-04-24 21:28:32.237449,0 days 00:00:01.961214,True,squared_error,49,log2,1,3,601,TPESampler,COMPLETE
854,0.34080433411032884,2025-04-24 21:28:30.565740,2025-04-24 21:28:34.507951,0 days 00:00:03.942211,True,squared_error,50,,1,3,602,TPESampler,COMPLETE
855,0.9286194958263903,2025-04-24 21:28:31.608164,2025-04-24 21:28:32.755138,0 days 00:00:01.146974,False,squared_error,29,log2,10,2,958,TPESampler,COMPLETE
856,0.4281132289498009,2025-04-24 21:28:32.419962,2025-04-24 21:28:35.435513,0 days 00:00:03.015551,True,squared_error,42,,2,3,560,TPESampler,COMPLETE
857,0.3430396752574998,2025-04-24 21:28:33.013055,2025-04-24 21:28:36.090732,0 days 00:00:03.077677,True,squared_error,42,,1,3,487,TPESampler,COMPLETE
858,0.344471609000628,2025-04-24 21:28:33.036277,2025-04-24 21:28:37.286796,0 days 00:00:04.250519,True,squared_error,41,,1,2,578,TPESampler,COMPLETE
859,0.34490731149369463,2025-04-24 21:28:33.172931,2025-04-24 21:28:36.687177,0 days 00:00:03.514246,True,squared_error,42,,1,2,563,TPESampler,COMPLETE
860,0.3446713760868206,2025-04-24 21:28:34.700149,2025-04-24 21:28:39.120184,0 days 00:00:04.420035,True,squared_error,50,,1,2,690,TPESampler,COMPLETE
861,0.3427506087706724,2025-04-24 21:28:35.686059,2025-04-24 21:28:40.409676,0 days 00:00:04.723617,True,squared_error,50,,1,3,775,TPESampler,COMPLETE
862,0.3476294533240189,2025-04-24 21:28:36.335990,2025-04-24 21:28:40.164643,0 days 00:00:03.828653,True,squared_error,42,,1,4,661,TPESampler,COMPLETE
863,0.5901606432975123,2025-04-24 21:28:36.909013,2025-04-24 21:28:46.805875,0 days 00:00:09.896862,False,absolute_error,50,,6,10,651,TPESampler,COMPLETE
864,0.9232234541423391,2025-04-24 21:28:37.506367,2025-04-24 21:28:38.483170,0 days 00:00:00.976803,True,squared_error,17,sqrt,14,33,207,TPESampler,COMPLETE
865,0.3420600170349302,2025-04-24 21:28:38.669760,2025-04-24 21:28:42.667600,0 days 00:00:03.997840,True,squared_error,50,,1,3,651,TPESampler,COMPLETE
866,0.42751618314516354,2025-04-24 21:28:39.489877,2025-04-24 21:28:42.581552,0 days 00:00:03.091675,True,squared_error,50,,2,3,652,TPESampler,COMPLETE
867,0.5932916987503934,2025-04-24 21:28:40.337141,2025-04-24 21:28:42.608638,0 days 00:00:02.271497,True,squared_error,25,,11,4,690,TPESampler,COMPLETE
868,0.34735431991459925,2025-04-24 21:28:40.633772,2025-04-24 21:28:44.581973,0 days 00:00:03.948201,True,squared_error,43,,1,4,672,TPESampler,COMPLETE
869,0.3462142086129345,2025-04-24 21:28:42.761274,2025-04-24 21:28:46.708628,0 days 00:00:03.947354,True,squared_error,50,,1,4,612,TPESampler,COMPLETE
870,0.42849601155524,2025-04-24 21:28:42.816394,2025-04-24 21:28:45.199005,0 days 00:00:02.382611,True,squared_error,50,,2,3,565,TPESampler,COMPLETE
871,0.8488225633631664,2025-04-24 21:28:42.839984,2025-04-24 21:28:45.962003,0 days 00:00:03.122019,True,absolute_error,9,log2,1,16,651,TPESampler,COMPLETE
872,0.3412981680921767,2025-04-24 21:28:44.771958,2025-04-24 21:28:48.634133,0 days 00:00:03.862175,True,squared_error,45,,1,3,614,TPESampler,COMPLETE
873,0.3410926111195977,2025-04-24 21:28:45.467470,2025-04-24 21:28:49.092370,0 days 00:00:03.624900,True,squared_error,50,,1,3,548,TPESampler,COMPLETE
874,0.3474009465757309,2025-04-24 21:28:46.187791,2025-04-24 21:28:51.096036,0 days 00:00:04.908245,True,squared_error,50,,1,4,757,TPESampler,COMPLETE
875,0.35400437123442186,2025-04-24 21:28:46.534721,2025-04-24 21:28:51.061308,0 days 00:00:04.526587,True,squared_error,50,,1,5,680,TPESampler,COMPLETE
876,0.43693913905982457,2025-04-24 21:28:47.166401,2025-04-24 21:28:50.149877,0 days 00:00:02.983476,True,squared_error,50,,2,6,641,TPESampler,COMPLETE
877,0.5311641510930967,2025-04-24 21:28:47.190982,2025-04-24 21:28:49.648366,0 days 00:00:02.457384,True,squared_error,18,sqrt,1,4,945,TPESampler,COMPLETE
878,0.9928577307617773,2025-04-24 21:28:48.816160,2025-04-24 21:28:49.914367,0 days 00:00:01.098207,True,absolute_error,16,log2,15,15,288,TPESampler,COMPLETE
879,0.34350501628929037,2025-04-24 21:28:49.328493,2025-04-24 21:28:52.958319,0 days 00:00:03.629826,True,squared_error,43,,1,2,579,TPESampler,COMPLETE
880,0.34214784414935034,2025-04-24 21:28:49.835874,2025-04-24 21:28:53.912592,0 days 00:00:04.076718,True,squared_error,50,,1,3,643,TPESampler,COMPLETE
881,0.3419715995898542,2025-04-24 21:28:50.106117,2025-04-24 21:28:54.363733,0 days 00:00:04.257616,True,squared_error,48,,1,2,593,TPESampler,COMPLETE
882,0.42676375597154664,2025-04-24 21:28:50.397045,2025-04-24 21:28:53.581630,0 days 00:00:03.184585,True,squared_error,40,,2,4,532,TPESampler,COMPLETE
883,0.34589768247315145,2025-04-24 21:28:51.463468,2025-04-24 21:28:54.885199,0 days 00:00:03.421731,True,squared_error,50,,1,4,533,TPESampler,COMPLETE
884,0.3410934892719314,2025-04-24 21:28:51.521378,2025-04-24 21:28:54.862193,0 days 00:00:03.340815,True,squared_error,50,,1,3,452,TPESampler,COMPLETE
885,0.9024362071165116,2025-04-24 21:28:53.151780,2025-04-24 21:28:54.058535,0 days 00:00:00.906755,False,squared_error,45,log2,4,21,353,TPESampler,COMPLETE
886,0.429700243650104,2025-04-24 21:28:53.825426,2025-04-24 21:28:56.517875,0 days 00:00:02.692449,True,squared_error,50,,2,4,438,TPESampler,COMPLETE
887,0.3442655079344584,2025-04-24 21:28:54.117646,2025-04-24 21:28:58.094798,0 days 00:00:03.977152,True,squared_error,50,,1,2,636,TPESampler,COMPLETE
888,0.6220637893487602,2025-04-24 21:28:54.332173,2025-04-24 21:28:57.428500,0 days 00:00:03.096327,False,absolute_error,27,,7,24,161,TPESampler,COMPLETE
889,0.36173001104708824,2025-04-24 21:28:54.805994,2025-04-24 21:28:57.666703,0 days 00:00:02.860709,True,squared_error,44,,1,6,413,TPESampler,COMPLETE
890,0.41665168323723145,2025-04-24 21:28:55.282460,2025-04-24 21:29:17.228822,0 days 00:00:21.946362,True,absolute_error,16,,1,12,518,TPESampler,COMPLETE
891,0.34231989062407747,2025-04-24 21:28:55.291785,2025-04-24 21:28:58.419985,0 days 00:00:03.128200,True,squared_error,44,,1,3,453,TPESampler,COMPLETE
892,0.36352451156241833,2025-04-24 21:28:56.710163,2025-04-24 21:28:58.353993,0 days 00:00:01.643830,True,squared_error,50,,1,6,237,TPESampler,COMPLETE
893,0.34512174611115937,2025-04-24 21:28:57.624663,2025-04-24 21:29:00.229332,0 days 00:00:02.604669,True,squared_error,42,,1,2,395,TPESampler,COMPLETE
894,0.9169997935382266,2025-04-24 21:28:57.874676,2025-04-24 21:28:58.994573,0 days 00:00:01.119897,False,squared_error,15,log2,6,6,414,TPESampler,COMPLETE
895,0.3465796363110672,2025-04-24 21:28:58.499742,2025-04-24 21:29:01.178157,0 days 00:00:02.678415,True,squared_error,50,,1,4,433,TPESampler,COMPLETE
896,0.9500168235846673,2025-04-24 21:28:58.753833,2025-04-24 21:29:00.859527,0 days 00:00:02.105694,False,absolute_error,11,sqrt,10,42,639,TPESampler,COMPLETE
897,0.34728728944668,2025-04-24 21:28:58.809315,2025-04-24 21:29:00.994163,0 days 00:00:02.184848,True,squared_error,50,,1,3,190,TPESampler,COMPLETE
898,0.34674851341068486,2025-04-24 21:28:59.357068,2025-04-24 21:29:02.805012,0 days 00:00:03.447944,True,squared_error,50,,1,4,485,TPESampler,COMPLETE
899,0.3420951769342291,2025-04-24 21:29:00.459988,2025-04-24 21:29:03.004728,0 days 00:00:02.544740,True,squared_error,49,,1,3,411,TPESampler,COMPLETE
900,0.34094851431056533,2025-04-24 21:29:01.090931,2025-04-24 21:29:04.316497,0 days 00:00:03.225566,True,squared_error,50,,1,3,457,TPESampler,COMPLETE
901,0.42745334430601933,2025-04-24 21:29:01.187526,2025-04-24 21:29:05.041651,0 days 00:00:03.854125,True,squared_error,40,,2,2,717,TPESampler,COMPLETE
902,0.3411809401039962,2025-04-24 21:29:01.437117,2025-04-24 21:29:04.232567,0 days 00:00:02.795450,True,squared_error,50,,1,3,423,TPESampler,COMPLETE
903,0.42943071963560675,2025-04-24 21:29:03.028019,2025-04-24 21:29:05.353332,0 days 00:00:02.325313,True,squared_error,50,,2,3,430,TPESampler,COMPLETE
904,0.4289023421823429,2025-04-24 21:29:03.248600,2025-04-24 21:29:05.816780,0 days 00:00:02.568180,True,squared_error,43,,2,2,473,TPESampler,COMPLETE
905,0.3430077383766126,2025-04-24 21:29:04.423765,2025-04-24 21:29:07.485930,0 days 00:00:03.062165,True,squared_error,45,,1,2,451,TPESampler,COMPLETE
906,0.3417880699735418,2025-04-24 21:29:04.520473,2025-04-24 21:29:08.031046,0 days 00:00:03.510573,True,squared_error,50,,1,3,557,TPESampler,COMPLETE
907,0.3439084645448405,2025-04-24 21:29:05.447919,2025-04-24 21:29:08.776206,0 days 00:00:03.328287,True,squared_error,50,,1,2,485,TPESampler,COMPLETE
908,0.34558094137073114,2025-04-24 21:29:05.529944,2025-04-24 21:29:32.257500,0 days 00:00:26.727556,True,absolute_error,49,,1,3,478,TPESampler,COMPLETE
909,0.5510718909453963,2025-04-24 21:29:06.010917,2025-04-24 21:29:13.328762,0 days 00:00:07.317845,False,absolute_error,37,sqrt,2,35,949,TPESampler,COMPLETE
910,0.8820285312960997,2025-04-24 21:29:07.665949,2025-04-24 21:29:09.297755,0 days 00:00:01.631806,True,absolute_error,9,sqrt,4,30,422,TPESampler,COMPLETE
911,0.4270403435609365,2025-04-24 21:29:08.386018,2025-04-24 21:29:11.412555,0 days 00:00:03.026537,True,squared_error,41,,2,4,668,TPESampler,COMPLETE
912,0.741267011242477,2025-04-24 21:29:08.969595,2025-04-24 21:29:12.668935,0 days 00:00:03.699340,False,absolute_error,16,log2,1,43,511,TPESampler,COMPLETE
913,0.6555818083360819,2025-04-24 21:29:09.809763,2025-04-24 21:29:10.916435,0 days 00:00:01.106672,True,squared_error,39,sqrt,2,5,390,TPESampler,COMPLETE
914,0.9380877910921589,2025-04-24 21:29:11.092594,2025-04-24 21:29:12.251632,0 days 00:00:01.159038,True,squared_error,21,log2,13,39,539,TPESampler,COMPLETE
915,0.3849391296392295,2025-04-24 21:29:11.658423,2025-04-24 21:29:14.570039,0 days 00:00:02.911616,True,squared_error,42,,1,9,569,TPESampler,COMPLETE
916,0.4281858267760457,2025-04-24 21:29:12.437303,2025-04-24 21:29:15.392735,0 days 00:00:02.955432,True,squared_error,50,,2,2,643,TPESampler,COMPLETE
917,0.9897415892319584,2025-04-24 21:29:12.889066,2025-04-24 21:29:14.487713,0 days 00:00:01.598647,True,absolute_error,50,log2,14,28,728,TPESampler,COMPLETE
918,0.3609718087408939,2025-04-24 21:29:13.582683,2025-04-24 21:29:16.754197,0 days 00:00:03.171514,True,squared_error,50,,1,6,621,TPESampler,COMPLETE
919,0.4310231574053313,2025-04-24 21:29:14.675749,2025-04-24 21:29:17.063286,0 days 00:00:02.387537,True,squared_error,44,,2,5,504,TPESampler,COMPLETE
920,0.3431785538829584,2025-04-24 21:29:14.743921,2025-04-24 21:29:17.695268,0 days 00:00:02.951347,True,squared_error,50,,1,2,429,TPESampler,COMPLETE
921,0.3426502546440289,2025-04-24 21:29:15.623606,2025-04-24 21:29:19.589683,0 days 00:00:03.966077,True,squared_error,50,,1,2,602,TPESampler,COMPLETE
922,0.47833656443706796,2025-04-24 21:29:16.933497,2025-04-24 21:29:18.272645,0 days 00:00:01.339148,True,squared_error,28,sqrt,1,19,439,TPESampler,COMPLETE
923,0.49819054070337637,2025-04-24 21:29:17.271227,2025-04-24 21:29:19.486646,0 days 00:00:02.215419,False,squared_error,12,,4,3,422,TPESampler,COMPLETE
924,0.3468213784670319,2025-04-24 21:29:17.438778,2025-04-24 21:29:20.617172,0 days 00:00:03.178394,True,squared_error,41,,1,4,413,TPESampler,COMPLETE
925,0.353285901955846,2025-04-24 21:29:17.968263,2025-04-24 21:29:21.087495,0 days 00:00:03.119232,True,squared_error,42,,1,5,551,TPESampler,COMPLETE
926,0.3463774344361371,2025-04-24 21:29:18.544756,2025-04-24 21:29:22.244822,0 days 00:00:03.700066,True,squared_error,50,,1,4,567,TPESampler,COMPLETE
927,0.3431849653554565,2025-04-24 21:29:19.701713,2025-04-24 21:29:22.540187,0 days 00:00:02.838474,True,squared_error,42,,1,3,480,TPESampler,COMPLETE
928,0.3423181673612798,2025-04-24 21:29:19.826209,2025-04-24 21:29:21.985230,0 days 00:00:02.159021,True,squared_error,45,,1,3,268,TPESampler,COMPLETE
929,0.8806069275484963,2025-04-24 21:29:20.803654,2025-04-24 21:29:22.252577,0 days 00:00:01.448923,True,squared_error,49,log2,2,3,554,TPESampler,COMPLETE
930,0.3721890929249717,2025-04-24 21:29:21.322038,2025-04-24 21:29:22.764507,0 days 00:00:01.442469,True,squared_error,50,sqrt,1,3,439,TPESampler,COMPLETE
931,0.9235180022163229,2025-04-24 21:29:22.210490,2025-04-24 21:29:24.789692,0 days 00:00:02.579202,True,absolute_error,44,log2,2,3,678,TPESampler,COMPLETE
932,0.8957718714953824,2025-04-24 21:29:22.457098,2025-04-24 21:29:24.686793,0 days 00:00:02.229695,False,squared_error,25,sqrt,10,47,953,TPESampler,COMPLETE
933,0.35318704132695267,2025-04-24 21:29:22.581528,2025-04-24 21:29:26.891929,0 days 00:00:04.310401,True,squared_error,50,,1,5,519,TPESampler,COMPLETE
934,0.8243304483531281,2025-04-24 21:29:22.819987,2025-04-24 21:29:24.380625,0 days 00:00:01.560638,False,squared_error,37,sqrt,6,26,928,TPESampler,COMPLETE
935,0.8119658747500138,2025-04-24 21:29:22.999782,2025-04-24 21:29:24.628945,0 days 00:00:01.629163,False,absolute_error,5,sqrt,2,34,195,TPESampler,COMPLETE
936,0.34179280361366254,2025-04-24 21:29:24.572698,2025-04-24 21:29:27.886308,0 days 00:00:03.313610,True,squared_error,42,,1,3,605,TPESampler,COMPLETE
937,0.9116752420811757,2025-04-24 21:29:24.869691,2025-04-24 21:29:26.869339,0 days 00:00:01.999648,True,squared_error,42,sqrt,10,3,669,TPESampler,COMPLETE
938,0.49155463347517514,2025-04-24 21:29:24.905311,2025-04-24 21:29:28.589760,0 days 00:00:03.684449,False,squared_error,50,,2,8,723,TPESampler,COMPLETE
939,0.6250616913129374,2025-04-24 21:29:25.040955,2025-04-24 21:29:32.046881,0 days 00:00:07.005926,False,absolute_error,13,,11,5,663,TPESampler,COMPLETE
940,0.5594714255258609,2025-04-24 21:29:27.015731,2025-04-24 21:29:28.852485,0 days 00:00:01.836754,True,squared_error,37,log2,1,33,629,TPESampler,COMPLETE
941,0.3419936265817964,2025-04-24 21:29:27.091435,2025-04-24 21:29:30.471517,0 days 00:00:03.380082,True,squared_error,50,,1,3,510,TPESampler,COMPLETE
942,0.4394271875955149,2025-04-24 21:29:28.164012,2025-04-24 21:29:29.422132,0 days 00:00:01.258120,True,squared_error,49,log2,1,4,356,TPESampler,COMPLETE
943,0.9004215096184442,2025-04-24 21:29:28.885701,2025-04-24 21:29:29.806997,0 days 00:00:00.921296,True,absolute_error,22,sqrt,4,3,167,TPESampler,COMPLETE
944,0.4288991425610744,2025-04-24 21:29:29.049667,2025-04-24 21:29:31.468159,0 days 00:00:02.418492,True,squared_error,50,,2,2,473,TPESampler,COMPLETE
945,0.3436091514808317,2025-04-24 21:29:29.767827,2025-04-24 21:29:33.037835,0 days 00:00:03.270008,True,squared_error,41,,1,3,568,TPESampler,COMPLETE
946,0.34247515454341976,2025-04-24 21:29:30.031244,2025-04-24 21:29:34.020865,0 days 00:00:03.989621,True,squared_error,50,,1,3,676,TPESampler,COMPLETE
947,0.34347764314195905,2025-04-24 21:29:30.748572,2025-04-24 21:29:32.890280,0 days 00:00:02.141708,True,squared_error,40,,1,3,307,TPESampler,COMPLETE
948,0.3533636503050426,2025-04-24 21:29:31.650249,2025-04-24 21:29:34.303241,0 days 00:00:02.652992,True,squared_error,50,,1,5,414,TPESampler,COMPLETE
949,0.346618958799399,2025-04-24 21:29:32.335529,2025-04-24 21:29:35.731384,0 days 00:00:03.395855,True,squared_error,50,,1,4,626,TPESampler,COMPLETE
950,0.6191312470239314,2025-04-24 21:29:32.500232,2025-04-24 21:29:36.136577,0 days 00:00:03.636345,False,absolute_error,27,log2,1,9,373,TPESampler,COMPLETE
951,0.37429172304440644,2025-04-24 21:29:33.308543,2025-04-24 21:29:45.036460,0 days 00:00:11.727917,True,absolute_error,30,,1,7,232,TPESampler,COMPLETE
952,0.3477699768597974,2025-04-24 21:29:33.510777,2025-04-24 21:30:13.475387,0 days 00:00:39.964610,True,absolute_error,48,,1,2,732,TPESampler,COMPLETE
953,0.4272165660997354,2025-04-24 21:29:34.400229,2025-04-24 21:29:36.806190,0 days 00:00:02.405961,True,squared_error,43,,2,4,543,TPESampler,COMPLETE
954,0.34219854878599165,2025-04-24 21:29:34.502124,2025-04-24 21:29:36.651948,0 days 00:00:02.149824,True,squared_error,48,,1,3,315,TPESampler,COMPLETE
955,0.4285398687077245,2025-04-24 21:29:35.908010,2025-04-24 21:29:38.495532,0 days 00:00:02.587522,True,squared_error,50,,2,4,555,TPESampler,COMPLETE
956,0.3437237041423906,2025-04-24 21:29:36.350885,2025-04-24 21:29:39.411607,0 days 00:00:03.060722,True,squared_error,50,,1,2,466,TPESampler,COMPLETE
957,0.3430785058788164,2025-04-24 21:29:36.879757,2025-04-24 21:29:40.282179,0 days 00:00:03.402422,True,squared_error,50,,1,2,550,TPESampler,COMPLETE
958,0.43250564047691653,2025-04-24 21:29:37.142530,2025-04-24 21:29:38.896458,0 days 00:00:01.753928,True,squared_error,41,,2,5,366,TPESampler,COMPLETE
959,0.4459106265229448,2025-04-24 21:29:38.682928,2025-04-24 21:29:40.520008,0 days 00:00:01.837080,False,squared_error,48,log2,1,3,744,TPESampler,COMPLETE
960,0.3475226899967711,2025-04-24 21:29:39.086869,2025-04-24 21:29:42.888904,0 days 00:00:03.802035,True,squared_error,42,,1,4,627,TPESampler,COMPLETE
961,0.9403945476221564,2025-04-24 21:29:39.610106,2025-04-24 21:29:41.705781,0 days 00:00:02.095675,True,absolute_error,50,sqrt,7,16,980,TPESampler,COMPLETE
962,0.3468353898539676,2025-04-24 21:29:40.478779,2025-04-24 21:29:42.264992,0 days 00:00:01.786213,True,squared_error,50,,1,4,296,TPESampler,COMPLETE
963,0.3585594058126129,2025-04-24 21:29:40.763311,2025-04-24 21:29:42.187646,0 days 00:00:01.424335,True,squared_error,29,,1,5,222,TPESampler,COMPLETE
964,0.3438235351692781,2025-04-24 21:29:41.890528,2025-04-24 21:29:46.334803,0 days 00:00:04.444275,True,squared_error,40,,1,2,799,TPESampler,COMPLETE
965,0.3426302099519837,2025-04-24 21:29:42.349343,2025-04-24 21:29:44.994456,0 days 00:00:02.645113,True,squared_error,40,,1,3,462,TPESampler,COMPLETE
966,0.6527871663533247,2025-04-24 21:29:42.467989,2025-04-24 21:29:45.649596,0 days 00:00:03.181607,False,absolute_error,50,,11,42,270,TPESampler,COMPLETE
967,0.3449677583018987,2025-04-24 21:29:43.145820,2025-04-24 21:29:45.575857,0 days 00:00:02.430037,True,squared_error,50,,1,2,331,TPESampler,COMPLETE
968,0.3483231799427895,2025-04-24 21:29:45.128723,2025-04-24 21:29:48.475735,0 days 00:00:03.347012,True,squared_error,42,,1,4,507,TPESampler,COMPLETE
969,0.35258616826518147,2025-04-24 21:29:45.181437,2025-04-24 21:29:48.706098,0 days 00:00:03.524661,True,squared_error,50,,1,5,580,TPESampler,COMPLETE
970,0.342330471543802,2025-04-24 21:29:45.973975,2025-04-24 21:29:49.958389,0 days 00:00:03.984414,True,squared_error,43,,1,3,625,TPESampler,COMPLETE
971,0.3409540567591623,2025-04-24 21:29:45.970442,2025-04-24 21:29:48.772768,0 days 00:00:02.802326,True,squared_error,50,,1,3,443,TPESampler,COMPLETE
972,0.342594268610845,2025-04-24 21:29:46.595078,2025-04-24 21:29:49.707720,0 days 00:00:03.112642,True,squared_error,42,,1,3,560,TPESampler,COMPLETE
973,0.34282737511966044,2025-04-24 21:29:48.664329,2025-04-24 21:29:51.515014,0 days 00:00:02.850685,True,squared_error,43,,1,3,369,TPESampler,COMPLETE
974,0.4281122880333227,2025-04-24 21:29:48.944105,2025-04-24 21:29:50.659583,0 days 00:00:01.715478,True,squared_error,49,,2,2,237,TPESampler,COMPLETE
975,0.4354188747241881,2025-04-24 21:29:49.010923,2025-04-24 21:29:50.341377,0 days 00:00:01.330454,True,squared_error,47,,2,2,131,TPESampler,COMPLETE
976,0.34445158403175774,2025-04-24 21:29:49.957056,2025-04-24 21:29:52.722650,0 days 00:00:02.765594,True,squared_error,41,,1,2,430,TPESampler,COMPLETE
977,0.9167643377160781,2025-04-24 21:29:50.169202,2025-04-24 21:29:51.836983,0 days 00:00:01.667781,False,squared_error,11,log2,6,7,958,TPESampler,COMPLETE
978,0.3462578499743068,2025-04-24 21:29:50.615889,2025-04-24 21:29:53.411069,0 days 00:00:02.795180,True,squared_error,50,,1,4,439,TPESampler,COMPLETE
979,0.39679783056639395,2025-04-24 21:29:50.890277,2025-04-24 21:29:54.751149,0 days 00:00:03.860872,False,squared_error,50,,1,7,482,TPESampler,COMPLETE
980,0.4320340907629377,2025-04-24 21:29:51.793668,2025-04-24 21:29:54.678820,0 days 00:00:02.885152,True,squared_error,50,,2,5,471,TPESampler,COMPLETE
981,0.6893028935818772,2025-04-24 21:29:52.166679,2025-04-24 21:29:54.039831,0 days 00:00:01.873152,False,squared_error,8,sqrt,1,3,989,TPESampler,COMPLETE
982,0.3532903258297491,2025-04-24 21:29:52.984816,2025-04-24 21:29:55.281024,0 days 00:00:02.296208,True,squared_error,50,,1,5,358,TPESampler,COMPLETE
983,0.9510724903025062,2025-04-24 21:29:53.697524,2025-04-24 21:29:55.146884,0 days 00:00:01.449360,False,absolute_error,5,sqrt,12,8,835,TPESampler,COMPLETE
984,0.34203555312732054,2025-04-24 21:29:54.315482,2025-04-24 21:29:57.010149,0 days 00:00:02.694667,True,squared_error,50,,1,3,400,TPESampler,COMPLETE
985,0.4300576526359658,2025-04-24 21:29:55.027117,2025-04-24 21:29:59.599262,0 days 00:00:04.572145,False,squared_error,44,,1,2,542,TPESampler,COMPLETE
986,0.4290042564155554,2025-04-24 21:29:55.085005,2025-04-24 21:29:57.224822,0 days 00:00:02.139817,True,squared_error,50,log2,1,2,383,TPESampler,COMPLETE
987,0.42939024048323643,2025-04-24 21:29:55.302111,2025-04-24 21:29:59.944010,0 days 00:00:04.641899,False,squared_error,44,,1,3,587,TPESampler,COMPLETE
988,0.9875092899382127,2025-04-24 21:29:55.513621,2025-04-24 21:29:57.462707,0 days 00:00:01.949086,True,absolute_error,35,log2,10,10,591,TPESampler,COMPLETE
989,0.34572657225151826,2025-04-24 21:29:57.186886,2025-04-24 21:29:59.276974,0 days 00:00:02.090088,True,squared_error,42,,1,2,303,TPESampler,COMPLETE
990,0.3435766455115825,2025-04-24 21:29:57.465986,2025-04-24 21:29:59.937518,0 days 00:00:02.471532,True,squared_error,44,,1,3,396,TPESampler,COMPLETE
991,0.3413838036371043,2025-04-24 21:29:57.720471,2025-04-24 21:30:00.078777,0 days 00:00:02.358306,True,squared_error,50,,1,3,430,TPESampler,COMPLETE
