number,value,datetime_start,datetime_complete,duration,params_bootstrap,params_criterion,params_max_depth,params_max_features,params_min_samples_leaf,params_min_samples_split,params_n_estimators,system_attrs_auto:sampler,state
3391,0.34166563129285715,2025-04-24 22:01:20.793246,2025-04-24 22:01:24.329523,0 days 00:00:03.536277,True,squared_error,50,,1,3,485,TPESampler,COMPLETE
3392,0.36837400486643196,2025-04-24 22:01:20.992972,2025-04-24 22:01:24.596239,0 days 00:00:03.603267,True,squared_error,50,,1,7,620,TPESampler,COMPLETE
3393,0.35225167284086206,2025-04-24 22:01:21.021334,2025-04-24 22:01:24.264622,0 days 00:00:03.243288,True,squared_error,50,,1,5,543,TPESampler,COMPLETE
3394,0.34476737599422297,2025-04-24 22:01:24.505342,2025-04-24 22:01:27.398915,0 days 00:00:02.893573,True,squared_error,41,,1,2,352,TPESampler,COMPLETE
3395,0.34232077999262017,2025-04-24 22:01:24.560712,2025-04-24 22:01:27.300450,0 days 00:00:02.739738,True,squared_error,42,,1,3,363,TPESampler,COMPLETE
3396,0.4484993791247892,2025-04-24 22:01:24.921047,2025-04-24 22:01:28.279218,0 days 00:00:03.358171,False,squared_error,40,,2,2,508,TPESampler,COMPLETE
3397,0.4243043670379985,2025-04-24 22:01:25.574225,2025-04-24 22:01:27.585673,0 days 00:00:02.011448,True,squared_error,50,log2,1,3,707,TPESampler,COMPLETE
3398,0.34351202364711225,2025-04-24 22:01:27.534481,2025-04-24 22:01:31.746714,0 days 00:00:04.212233,True,squared_error,42,,1,3,690,TPESampler,COMPLETE
3399,0.34742007159383625,2025-04-24 22:01:27.657382,2025-04-24 22:01:31.839782,0 days 00:00:04.182400,True,squared_error,50,,1,4,696,TPESampler,COMPLETE
3400,0.42795475869373856,2025-04-24 22:01:27.907229,2025-04-24 22:01:31.923843,0 days 00:00:04.016614,True,squared_error,43,,2,2,697,TPESampler,COMPLETE
3401,0.42851519602921423,2025-04-24 22:01:28.862117,2025-04-24 22:01:31.909743,0 days 00:00:03.047626,True,squared_error,50,,2,2,635,TPESampler,COMPLETE
3402,0.34325176016024356,2025-04-24 22:01:31.997148,2025-04-24 22:01:36.733298,0 days 00:00:04.736150,True,squared_error,44,,1,2,603,TPESampler,COMPLETE
3403,0.3956738080042188,2025-04-24 22:01:32.130920,2025-04-24 22:01:34.538013,0 days 00:00:02.407093,True,squared_error,44,sqrt,1,5,641,TPESampler,COMPLETE
3404,0.34931061158281224,2025-04-24 22:01:32.182014,2025-04-24 22:01:35.095061,0 days 00:00:02.913047,True,squared_error,33,,1,4,367,TPESampler,COMPLETE
3405,0.35293122086913625,2025-04-24 22:01:32.192521,2025-04-24 22:01:36.513011,0 days 00:00:04.320490,True,squared_error,50,,1,5,618,TPESampler,COMPLETE
3406,0.3420324315493904,2025-04-24 22:01:34.768326,2025-04-24 22:01:38.622663,0 days 00:00:03.854337,True,squared_error,50,,1,3,657,TPESampler,COMPLETE
3407,0.34382991111605804,2025-04-24 22:01:35.323618,2025-04-24 22:01:39.431985,0 days 00:00:04.108367,True,squared_error,50,,1,2,656,TPESampler,COMPLETE
3408,0.4542994839654144,2025-04-24 22:01:36.767668,2025-04-24 22:01:40.912353,0 days 00:00:04.144685,True,absolute_error,50,log2,1,5,582,TPESampler,COMPLETE
3409,0.3435164532323331,2025-04-24 22:01:36.982306,2025-04-24 22:01:40.417336,0 days 00:00:03.435030,True,squared_error,50,,1,2,555,TPESampler,COMPLETE
3410,0.42956875173702136,2025-04-24 22:01:38.861459,2025-04-24 22:01:40.995090,0 days 00:00:02.133631,True,squared_error,43,,2,3,384,TPESampler,COMPLETE
3411,0.4533344502292507,2025-04-24 22:01:39.751112,2025-04-24 22:01:42.920063,0 days 00:00:03.168951,True,squared_error,40,,2,15,725,TPESampler,COMPLETE
3412,0.3419126649380855,2025-04-24 22:01:40.786691,2025-04-24 22:01:44.344705,0 days 00:00:03.558014,True,squared_error,50,,1,3,564,TPESampler,COMPLETE
3413,0.4277797389166736,2025-04-24 22:01:41.135036,2025-04-24 22:01:44.072776,0 days 00:00:02.937740,True,squared_error,44,,2,4,507,TPESampler,COMPLETE
3414,0.4277784250549056,2025-04-24 22:01:41.285048,2025-04-24 22:01:44.888808,0 days 00:00:03.603760,True,squared_error,50,,2,3,709,TPESampler,COMPLETE
3415,0.3443927024514373,2025-04-24 22:01:43.160734,2025-04-24 22:01:46.512901,0 days 00:00:03.352167,True,squared_error,50,,1,2,493,TPESampler,COMPLETE
3416,0.5407844960351899,2025-04-24 22:01:44.372440,2025-04-24 22:01:46.838749,0 days 00:00:02.466309,True,squared_error,38,log2,1,19,885,TPESampler,COMPLETE
3417,0.42858510873075106,2025-04-24 22:01:44.596336,2025-04-24 22:01:47.367060,0 days 00:00:02.770724,True,squared_error,35,,2,3,482,TPESampler,COMPLETE
3418,0.3467178518055741,2025-04-24 22:01:45.163203,2025-04-24 22:01:48.774579,0 days 00:00:03.611376,True,squared_error,44,,1,4,488,TPESampler,COMPLETE
3419,0.37025270390491816,2025-04-24 22:01:46.732470,2025-04-24 22:01:49.191107,0 days 00:00:02.458637,True,squared_error,50,sqrt,1,3,581,TPESampler,COMPLETE
3420,0.34168214098422106,2025-04-24 22:01:47.077631,2025-04-24 22:01:51.349397,0 days 00:00:04.271766,True,squared_error,43,,1,3,610,TPESampler,COMPLETE
3421,0.6980724158372068,2025-04-24 22:01:47.444024,2025-04-24 22:01:53.467919,0 days 00:00:06.023895,False,absolute_error,18,log2,1,3,725,TPESampler,COMPLETE
3422,0.34180918708036484,2025-04-24 22:01:47.614419,2025-04-24 22:01:51.286806,0 days 00:00:03.672387,True,squared_error,50,,1,3,512,TPESampler,COMPLETE
3423,0.3440853948375738,2025-04-24 22:01:49.535228,2025-04-24 22:01:54.828485,0 days 00:00:05.293257,True,squared_error,50,,1,2,804,TPESampler,COMPLETE
3424,0.5411014979874909,2025-04-24 22:01:49.541615,2025-04-24 22:01:51.508504,0 days 00:00:01.966889,True,squared_error,25,,5,14,213,TPESampler,COMPLETE
3425,0.42934517571247827,2025-04-24 22:01:51.672153,2025-04-24 22:01:57.589934,0 days 00:00:05.917781,False,squared_error,50,,1,3,705,TPESampler,COMPLETE
3426,0.4271578307337334,2025-04-24 22:01:51.720263,2025-04-24 22:01:54.187204,0 days 00:00:02.466941,True,squared_error,50,,2,3,522,TPESampler,COMPLETE
3427,0.4296764600163997,2025-04-24 22:01:51.727859,2025-04-24 22:01:55.121610,0 days 00:00:03.393751,True,squared_error,50,,2,3,423,TPESampler,COMPLETE
3428,0.4484866764077555,2025-04-24 22:01:53.703560,2025-04-24 22:01:55.535649,0 days 00:00:01.832089,False,squared_error,37,,2,3,227,TPESampler,COMPLETE
3429,0.4299615949152022,2025-04-24 22:01:54.448831,2025-04-24 22:01:57.285560,0 days 00:00:02.836729,True,squared_error,50,,2,5,529,TPESampler,COMPLETE
3430,0.35314019621180925,2025-04-24 22:01:55.140674,2025-04-24 22:01:59.601781,0 days 00:00:04.461107,True,squared_error,43,,1,5,581,TPESampler,COMPLETE
3431,0.35083004937123197,2025-04-24 22:01:55.412625,2025-04-24 22:02:33.307170,0 days 00:00:37.894545,True,absolute_error,45,,1,4,673,TPESampler,COMPLETE
3432,0.487406465336101,2025-04-24 22:01:55.922240,2025-04-24 22:01:59.899917,0 days 00:00:03.977677,False,squared_error,38,,2,12,741,TPESampler,COMPLETE
3433,0.6428530140441152,2025-04-24 22:01:57.399235,2025-04-24 22:02:08.762007,0 days 00:00:11.362772,False,absolute_error,44,,6,46,698,TPESampler,COMPLETE
3434,0.8827271591168039,2025-04-24 22:01:57.553450,2025-04-24 22:01:59.600402,0 days 00:00:02.046952,True,squared_error,44,log2,2,19,516,TPESampler,COMPLETE
3435,0.428109191871876,2025-04-24 22:01:57.849678,2025-04-24 22:02:00.249084,0 days 00:00:02.399406,True,squared_error,43,,2,2,491,TPESampler,COMPLETE
3436,0.7918528343002149,2025-04-24 22:01:59.929755,2025-04-24 22:02:03.000542,0 days 00:00:03.070787,True,absolute_error,6,sqrt,1,31,561,TPESampler,COMPLETE
3437,0.3433227446193221,2025-04-24 22:01:59.995262,2025-04-24 22:02:04.662922,0 days 00:00:04.667660,True,squared_error,42,,1,3,694,TPESampler,COMPLETE
3438,0.38586395513629185,2025-04-24 22:02:00.162649,2025-04-24 22:02:02.883388,0 days 00:00:02.720739,True,squared_error,42,,1,9,343,TPESampler,COMPLETE
3439,0.34788622540785474,2025-04-24 22:02:00.574927,2025-04-24 22:02:04.828589,0 days 00:00:04.253662,True,squared_error,50,,1,4,716,TPESampler,COMPLETE
3440,0.3523553003864512,2025-04-24 22:02:03.125980,2025-04-24 22:02:06.306127,0 days 00:00:03.180147,True,squared_error,50,,1,5,554,TPESampler,COMPLETE
3441,0.4492852159587651,2025-04-24 22:02:03.243971,2025-04-24 22:02:04.829194,0 days 00:00:01.585223,True,squared_error,47,log2,1,2,387,TPESampler,COMPLETE
3442,0.3445364845110825,2025-04-24 22:02:04.909156,2025-04-24 22:02:08.010626,0 days 00:00:03.101470,True,squared_error,35,,1,3,516,TPESampler,COMPLETE
3443,0.4917643463088102,2025-04-24 22:02:05.089798,2025-04-24 22:02:06.335187,0 days 00:00:01.245389,False,squared_error,49,,5,12,122,TPESampler,COMPLETE
3444,0.34170655141261064,2025-04-24 22:02:05.153212,2025-04-24 22:02:08.635509,0 days 00:00:03.482297,True,squared_error,43,,1,3,545,TPESampler,COMPLETE
3445,0.42867943466934216,2025-04-24 22:02:06.487668,2025-04-24 22:02:09.593175,0 days 00:00:03.105507,True,squared_error,44,,2,3,572,TPESampler,COMPLETE
3446,0.34156738888531657,2025-04-24 22:02:06.542666,2025-04-24 22:02:10.169392,0 days 00:00:03.626726,True,squared_error,50,,1,3,570,TPESampler,COMPLETE
3447,0.343092471643231,2025-04-24 22:02:08.246621,2025-04-24 22:02:12.286779,0 days 00:00:04.040158,True,squared_error,50,,1,2,549,TPESampler,COMPLETE
3448,0.34197537729846383,2025-04-24 22:02:09.024098,2025-04-24 22:02:14.108936,0 days 00:00:05.084838,True,squared_error,50,,1,3,630,TPESampler,COMPLETE
3449,0.34373955646995097,2025-04-24 22:02:09.236447,2025-04-24 22:02:12.448979,0 days 00:00:03.212532,True,squared_error,44,,1,3,389,TPESampler,COMPLETE
3450,0.6479022126340188,2025-04-24 22:02:10.109596,2025-04-24 22:02:17.549576,0 days 00:00:07.439980,False,absolute_error,23,,15,6,889,TPESampler,COMPLETE
3451,0.36108905894180565,2025-04-24 22:02:10.594192,2025-04-24 22:02:13.493373,0 days 00:00:02.899181,True,squared_error,50,,1,6,432,TPESampler,COMPLETE
3452,0.3465105495555755,2025-04-24 22:02:12.507796,2025-04-24 22:03:14.349329,0 days 00:01:01.841533,True,absolute_error,50,,1,2,917,TPESampler,COMPLETE
3453,0.3431456503300517,2025-04-24 22:02:12.694120,2025-04-24 22:02:16.588746,0 days 00:00:03.894626,True,squared_error,44,,1,2,433,TPESampler,COMPLETE
3454,0.42769070408163123,2025-04-24 22:02:13.867198,2025-04-24 22:02:17.432156,0 days 00:00:03.564958,True,squared_error,42,,2,5,883,TPESampler,COMPLETE
3455,0.3523890163589833,2025-04-24 22:02:14.456669,2025-04-24 22:02:19.613518,0 days 00:00:05.156849,True,squared_error,22,,1,3,1000,TPESampler,COMPLETE
3456,0.9076556172845286,2025-04-24 22:02:16.806486,2025-04-24 22:02:18.355731,0 days 00:00:01.549245,False,squared_error,24,log2,5,14,991,TPESampler,COMPLETE
3457,0.34618432862466886,2025-04-24 22:02:17.711348,2025-04-24 22:02:20.826524,0 days 00:00:03.115176,True,squared_error,43,,1,4,445,TPESampler,COMPLETE
3458,0.34306809614677214,2025-04-24 22:02:17.923808,2025-04-24 22:02:22.570715,0 days 00:00:04.646907,True,squared_error,50,,1,3,752,TPESampler,COMPLETE
3459,0.4317215786343769,2025-04-24 22:02:18.635509,2025-04-24 22:02:21.770029,0 days 00:00:03.134520,True,squared_error,50,,2,5,567,TPESampler,COMPLETE
3460,0.4307322913712562,2025-04-24 22:02:19.906310,2025-04-24 22:02:23.191264,0 days 00:00:03.284954,True,squared_error,50,,2,5,699,TPESampler,COMPLETE
3461,0.4269522203318866,2025-04-24 22:02:21.056689,2025-04-24 22:02:23.940225,0 days 00:00:02.883536,True,squared_error,50,,2,3,530,TPESampler,COMPLETE
3462,0.3463157384937376,2025-04-24 22:02:22.026927,2025-04-24 22:03:02.010441,0 days 00:00:39.983514,True,absolute_error,43,,1,3,548,TPESampler,COMPLETE
3463,0.3417404486887402,2025-04-24 22:02:22.910971,2025-04-24 22:02:26.548152,0 days 00:00:03.637181,True,squared_error,50,,1,3,574,TPESampler,COMPLETE
3464,0.3415175149735954,2025-04-24 22:02:23.410968,2025-04-24 22:02:26.245831,0 days 00:00:02.834863,True,squared_error,50,,1,3,472,TPESampler,COMPLETE
3465,0.3477155947090601,2025-04-24 22:02:24.256714,2025-04-24 22:02:27.938771,0 days 00:00:03.682057,True,squared_error,42,,1,4,641,TPESampler,COMPLETE
3466,0.34631400813123947,2025-04-24 22:02:26.471967,2025-04-24 22:02:29.068194,0 days 00:00:02.596227,True,squared_error,50,,1,4,437,TPESampler,COMPLETE
3467,0.37750305237142195,2025-04-24 22:02:26.784333,2025-04-24 22:02:30.467578,0 days 00:00:03.683245,True,squared_error,50,,1,8,637,TPESampler,COMPLETE
3468,0.3452059496867594,2025-04-24 22:02:28.166185,2025-04-24 22:02:32.974237,0 days 00:00:04.808052,True,squared_error,50,,1,2,743,TPESampler,COMPLETE
3469,0.4310123246931354,2025-04-24 22:02:29.316435,2025-04-24 22:02:33.040278,0 days 00:00:03.723843,False,squared_error,50,,1,2,507,TPESampler,COMPLETE
3470,0.3546314216996341,2025-04-24 22:02:30.691297,2025-04-24 22:02:34.751080,0 days 00:00:04.059783,True,squared_error,42,,1,5,661,TPESampler,COMPLETE
3471,0.3433463495698878,2025-04-24 22:02:33.249349,2025-04-24 22:02:37.712533,0 days 00:00:04.463184,True,squared_error,44,,1,3,650,TPESampler,COMPLETE
3472,0.3533667103954809,2025-04-24 22:02:33.306543,2025-04-24 22:02:36.636593,0 days 00:00:03.330050,True,squared_error,50,,1,5,630,TPESampler,COMPLETE
3473,0.5607196520970353,2025-04-24 22:02:33.677771,2025-04-24 22:02:51.476954,0 days 00:00:17.799183,False,absolute_error,7,,4,6,856,TPESampler,COMPLETE
3474,0.3407425589161876,2025-04-24 22:02:35.214561,2025-04-24 22:02:38.620534,0 days 00:00:03.405973,True,squared_error,50,,1,3,591,TPESampler,COMPLETE
3475,0.34337722201915083,2025-04-24 22:02:36.862726,2025-04-24 22:02:39.590351,0 days 00:00:02.727625,True,squared_error,43,,1,3,498,TPESampler,COMPLETE
3476,0.45381474655379295,2025-04-24 22:02:37.941064,2025-04-24 22:02:39.704344,0 days 00:00:01.763280,True,squared_error,48,log2,1,5,461,TPESampler,COMPLETE
3477,0.3454912123011781,2025-04-24 22:02:38.917094,2025-04-24 22:02:43.582038,0 days 00:00:04.664944,True,squared_error,42,,1,2,727,TPESampler,COMPLETE
3478,0.6475392071533237,2025-04-24 22:02:39.986073,2025-04-24 22:02:41.619792,0 days 00:00:01.633719,True,squared_error,49,sqrt,2,4,675,TPESampler,COMPLETE
3479,0.43090268142995297,2025-04-24 22:02:40.198093,2025-04-24 22:02:43.469971,0 days 00:00:03.271878,True,squared_error,41,,2,5,697,TPESampler,COMPLETE
3480,0.3617716216272023,2025-04-24 22:02:41.841399,2025-04-24 22:03:22.859435,0 days 00:00:41.018036,True,absolute_error,50,,1,6,601,TPESampler,COMPLETE
3481,0.3470923995704063,2025-04-24 22:02:43.716080,2025-04-24 22:02:48.769898,0 days 00:00:05.053818,True,squared_error,50,,1,4,642,TPESampler,COMPLETE
3482,0.7731839744755918,2025-04-24 22:02:43.946027,2025-04-24 22:02:46.539447,0 days 00:00:02.593420,False,squared_error,5,sqrt,1,35,560,TPESampler,COMPLETE
3483,0.34723284474256,2025-04-24 22:02:47.002488,2025-04-24 22:02:51.267751,0 days 00:00:04.265263,True,squared_error,50,,1,4,667,TPESampler,COMPLETE
3484,0.3435976252605929,2025-04-24 22:02:49.092209,2025-04-24 22:02:53.078547,0 days 00:00:03.986338,True,squared_error,35,,1,3,622,TPESampler,COMPLETE
3485,0.9696264031098201,2025-04-24 22:02:51.704987,2025-04-24 22:02:54.340884,0 days 00:00:02.635897,False,absolute_error,31,log2,8,35,647,TPESampler,COMPLETE
3486,0.3429458355060204,2025-04-24 22:02:52.106665,2025-04-24 22:02:57.455316,0 days 00:00:05.348651,True,squared_error,42,,1,3,650,TPESampler,COMPLETE
3487,0.3546218739378497,2025-04-24 22:02:53.738737,2025-04-24 22:02:58.277365,0 days 00:00:04.538628,True,squared_error,50,,1,5,743,TPESampler,COMPLETE
3488,0.4283709534428066,2025-04-24 22:02:54.715490,2025-04-24 22:02:58.275509,0 days 00:00:03.560019,True,squared_error,42,,2,4,639,TPESampler,COMPLETE
3489,0.3423877234888821,2025-04-24 22:02:58.396374,2025-04-24 22:03:04.609687,0 days 00:00:06.213313,True,squared_error,43,,1,3,810,TPESampler,COMPLETE
3490,0.3419653337231173,2025-04-24 22:02:58.533723,2025-04-24 22:03:03.238291,0 days 00:00:04.704568,True,squared_error,42,,1,3,587,TPESampler,COMPLETE
3491,0.34406981227116407,2025-04-24 22:02:58.710771,2025-04-24 22:03:03.747735,0 days 00:00:05.036964,True,squared_error,50,,1,2,645,TPESampler,COMPLETE
3492,0.3479268998029159,2025-04-24 22:03:02.236489,2025-04-24 22:03:05.826898,0 days 00:00:03.590409,True,squared_error,50,,1,4,739,TPESampler,COMPLETE
3493,0.34505137391504614,2025-04-24 22:03:03.477251,2025-04-24 22:03:08.104113,0 days 00:00:04.626862,True,squared_error,42,,1,2,688,TPESampler,COMPLETE
3494,0.3442655079344584,2025-04-24 22:03:04.060990,2025-04-24 22:03:08.277465,0 days 00:00:04.216475,True,squared_error,50,,1,2,636,TPESampler,COMPLETE
3495,0.3429570887761166,2025-04-24 22:03:04.902160,2025-04-24 22:03:08.298728,0 days 00:00:03.396568,True,squared_error,44,,1,3,559,TPESampler,COMPLETE
3496,0.4788379050737913,2025-04-24 22:03:06.117841,2025-04-24 22:03:08.444918,0 days 00:00:02.327077,True,squared_error,40,log2,1,3,993,TPESampler,COMPLETE
3497,0.6073389556435356,2025-04-24 22:03:08.336291,2025-04-24 22:03:13.165956,0 days 00:00:04.829665,True,absolute_error,35,,13,8,802,TPESampler,COMPLETE
3498,0.34512793154794297,2025-04-24 22:03:08.632658,2025-04-24 22:03:13.604739,0 days 00:00:04.972081,True,squared_error,42,,1,2,637,TPESampler,COMPLETE
3499,0.3446113396913096,2025-04-24 22:03:08.735504,2025-04-24 22:03:12.397419,0 days 00:00:03.661915,True,squared_error,43,,1,2,637,TPESampler,COMPLETE
3500,0.42744165910625825,2025-04-24 22:03:08.805095,2025-04-24 22:03:12.097555,0 days 00:00:03.292460,True,squared_error,43,,2,3,514,TPESampler,COMPLETE
3501,0.3427506087706724,2025-04-24 22:03:12.331126,2025-04-24 22:03:17.413244,0 days 00:00:05.082118,True,squared_error,50,,1,3,775,TPESampler,COMPLETE
3502,0.3622724553294271,2025-04-24 22:03:12.619484,2025-04-24 22:03:16.168222,0 days 00:00:03.548738,True,squared_error,44,,1,6,506,TPESampler,COMPLETE
3503,0.4283649623712008,2025-04-24 22:03:13.707990,2025-04-24 22:03:16.720724,0 days 00:00:03.012734,True,squared_error,42,,2,2,554,TPESampler,COMPLETE
3504,0.4832652956485115,2025-04-24 22:03:14.003389,2025-04-24 22:03:26.297128,0 days 00:00:12.293739,True,absolute_error,23,,2,41,457,TPESampler,COMPLETE
3505,0.4269789645955948,2025-04-24 22:03:14.663963,2025-04-24 22:03:18.361202,0 days 00:00:03.697239,True,squared_error,50,,2,4,767,TPESampler,COMPLETE
3506,0.42752175925024555,2025-04-24 22:03:16.398203,2025-04-24 22:03:20.056263,0 days 00:00:03.658060,True,squared_error,50,,2,2,743,TPESampler,COMPLETE
3507,0.34669548605198935,2025-04-24 22:03:16.991331,2025-04-24 22:03:20.464561,0 days 00:00:03.473230,True,squared_error,50,,1,4,562,TPESampler,COMPLETE
3508,0.4286505934878434,2025-04-24 22:03:17.706883,2025-04-24 22:03:20.520442,0 days 00:00:02.813559,True,squared_error,50,,2,2,578,TPESampler,COMPLETE
3509,0.4269241447415541,2025-04-24 22:03:18.668804,2025-04-24 22:03:22.302109,0 days 00:00:03.633305,True,squared_error,43,,2,4,768,TPESampler,COMPLETE
3510,0.4274826803793155,2025-04-24 22:03:20.293855,2025-04-24 22:03:24.119421,0 days 00:00:03.825566,True,squared_error,50,,2,3,728,TPESampler,COMPLETE
3511,0.3426797428161913,2025-04-24 22:03:20.710752,2025-04-24 22:03:24.910953,0 days 00:00:04.200201,True,squared_error,42,,1,3,566,TPESampler,COMPLETE
3512,0.44309070627976216,2025-04-24 22:03:21.020637,2025-04-24 22:03:23.298525,0 days 00:00:02.277888,True,squared_error,50,log2,1,5,620,TPESampler,COMPLETE
3513,0.34410847452962817,2025-04-24 22:03:22.521532,2025-04-24 22:03:26.838187,0 days 00:00:04.316655,True,squared_error,44,,1,2,476,TPESampler,COMPLETE
3514,0.49406713900914956,2025-04-24 22:03:23.194198,2025-04-24 22:03:26.771313,0 days 00:00:03.577115,True,squared_error,5,,1,32,911,TPESampler,COMPLETE
3515,0.3437237041423906,2025-04-24 22:03:23.687812,2025-04-24 22:03:27.319309,0 days 00:00:03.631497,True,squared_error,50,,1,2,466,TPESampler,COMPLETE
3516,0.8776685518124994,2025-04-24 22:03:24.642309,2025-04-24 22:03:26.953845,0 days 00:00:02.311536,True,squared_error,47,log2,2,4,797,TPESampler,COMPLETE
3517,0.9108151609057775,2025-04-24 22:03:25.155853,2025-04-24 22:03:26.178894,0 days 00:00:01.023041,False,squared_error,13,log2,5,25,290,TPESampler,COMPLETE
3518,0.3428999122486138,2025-04-24 22:03:26.391649,2025-04-24 22:03:31.532660,0 days 00:00:05.141011,True,squared_error,50,,1,3,714,TPESampler,COMPLETE
3519,0.34190357847374275,2025-04-24 22:03:26.551146,2025-04-24 22:03:31.529680,0 days 00:00:04.978534,True,squared_error,50,,1,3,655,TPESampler,COMPLETE
3520,0.5438025679298042,2025-04-24 22:03:27.075085,2025-04-24 22:03:29.656753,0 days 00:00:02.581668,False,squared_error,48,sqrt,2,31,245,TPESampler,COMPLETE
3521,0.34672360662393387,2025-04-24 22:03:27.132156,2025-04-24 22:03:32.045063,0 days 00:00:04.912907,True,squared_error,50,,1,4,476,TPESampler,COMPLETE
3522,0.47311512439032694,2025-04-24 22:03:27.325383,2025-04-24 22:03:30.988755,0 days 00:00:03.663372,True,squared_error,41,log2,1,3,576,TPESampler,COMPLETE
3523,0.42857821945272356,2025-04-24 22:03:28.118528,2025-04-24 22:03:31.479052,0 days 00:00:03.360524,True,squared_error,44,,2,4,574,TPESampler,COMPLETE
3524,0.3468452381097428,2025-04-24 22:03:29.902304,2025-04-24 22:03:34.006037,0 days 00:00:04.103733,True,squared_error,44,,1,4,630,TPESampler,COMPLETE
3525,0.36140719863091875,2025-04-24 22:03:31.218411,2025-04-24 22:03:34.858623,0 days 00:00:03.640212,True,squared_error,42,,1,6,515,TPESampler,COMPLETE
3526,0.3460478255870609,2025-04-24 22:03:31.671287,2025-04-24 22:03:35.641144,0 days 00:00:03.969857,True,squared_error,50,,1,4,549,TPESampler,COMPLETE
3527,0.34434177164283314,2025-04-24 22:03:31.813134,2025-04-24 22:03:37.784809,0 days 00:00:05.971675,True,squared_error,50,,1,2,681,TPESampler,COMPLETE
3528,0.4298403103941753,2025-04-24 22:03:31.976093,2025-04-24 22:03:35.362654,0 days 00:00:03.386561,True,squared_error,50,,2,2,397,TPESampler,COMPLETE
3529,0.3442573740187665,2025-04-24 22:03:32.547777,2025-04-24 22:03:36.690162,0 days 00:00:04.142385,True,squared_error,50,,1,2,481,TPESampler,COMPLETE
3530,0.8920644831372839,2025-04-24 22:03:34.235049,2025-04-24 22:03:36.863576,0 days 00:00:02.628527,False,absolute_error,44,sqrt,7,2,879,TPESampler,COMPLETE
3531,0.3439320834802329,2025-04-24 22:03:35.574305,2025-04-24 22:03:39.798593,0 days 00:00:04.224288,True,squared_error,50,,1,2,515,TPESampler,COMPLETE
3532,0.34091216264960283,2025-04-24 22:03:35.586792,2025-04-24 22:03:39.596747,0 days 00:00:04.009955,True,squared_error,50,,1,3,530,TPESampler,COMPLETE
