number,value,datetime_start,datetime_complete,duration,params_bootstrap,params_criterion,params_max_depth,params_max_features,params_min_samples_leaf,params_min_samples_split,params_n_estimators,system_attrs_auto:sampler,state
0,0.9483364804883275,2025-04-24 21:17:42.800173,2025-04-24 21:17:44.287797,0 days 00:00:01.487624,False,absolute_error,41,sqrt,10,3,495,RandomSampler,COMPLETE
1,0.46312872980683184,2025-04-24 21:17:42.812809,2025-04-24 21:18:17.249787,0 days 00:00:34.436978,False,absolute_error,12,,1,11,563,RandomSampler,COMPLETE
2,0.589742469095658,2025-04-24 21:17:42.891018,2025-04-24 21:17:44.507963,0 days 00:00:01.616945,True,squared_error,12,,13,5,411,RandomSampler,COMPLETE
3,0.3911566663045272,2025-04-24 21:17:44.560489,2025-04-24 21:17:51.187877,0 days 00:00:06.627388,True,absolute_error,43,sqrt,1,2,727,TPESampler,COMPLETE
4,0.841385581964725,2025-04-24 21:17:44.828476,2025-04-24 21:17:46.195435,0 days 00:00:01.366959,False,squared_error,35,sqrt,7,4,315,TPESampler,COMPLETE
5,0.6479751575215905,2025-04-24 21:17:46.485067,2025-04-24 21:17:48.147593,0 days 00:00:01.662526,True,squared_error,32,sqrt,2,2,500,TPESampler,COMPLETE
6,0.8789591916791011,2025-04-24 21:17:48.527006,2025-04-24 21:17:50.229037,0 days 00:00:01.702031,False,squared_error,39,log2,3,27,364,TPESampler,COMPLETE
7,0.4096015515530008,2025-04-24 21:17:50.530804,2025-04-24 21:17:55.673497,0 days 00:00:05.142693,False,squared_error,37,,1,5,850,TPESampler,COMPLETE
8,0.9525703020265828,2025-04-24 21:17:51.677048,2025-04-24 21:17:53.480466,0 days 00:00:01.803418,True,absolute_error,14,log2,3,25,997,TPESampler,COMPLETE
9,0.5070359621798383,2025-04-24 21:17:53.653112,2025-04-24 21:17:55.706851,0 days 00:00:02.053739,False,squared_error,13,,4,8,499,TPESampler,COMPLETE
10,0.4142347219326914,2025-04-24 21:17:55.377908,2025-04-24 21:17:57.566203,0 days 00:00:02.188295,True,squared_error,49,sqrt,1,10,482,TPESampler,COMPLETE
11,0.6036104259198758,2025-04-24 21:17:55.421644,2025-04-24 21:18:02.309000,0 days 00:00:06.887356,True,absolute_error,21,,9,3,971,TPESampler,COMPLETE
12,0.43327896957869894,2025-04-24 21:17:55.468536,2025-04-24 21:18:09.832311,0 days 00:00:14.363775,False,absolute_error,31,sqrt,1,8,952,TPESampler,COMPLETE
13,0.9409763010939288,2025-04-24 21:17:55.896999,2025-04-24 21:17:58.056333,0 days 00:00:02.159334,False,absolute_error,11,sqrt,9,10,746,TPESampler,COMPLETE
14,0.8848938841798638,2025-04-24 21:17:55.966380,2025-04-24 21:17:57.801230,0 days 00:00:01.834850,True,squared_error,27,log2,2,3,270,TPESampler,COMPLETE
15,0.3928704037315715,2025-04-24 21:17:57.788524,2025-04-24 21:18:06.392406,0 days 00:00:08.603882,True,absolute_error,41,sqrt,1,2,851,TPESampler,COMPLETE
16,0.38502651924998094,2025-04-24 21:17:58.006834,2025-04-24 21:18:03.099655,0 days 00:00:05.092821,True,absolute_error,50,sqrt,1,2,552,TPESampler,COMPLETE
17,0.42102671184201784,2025-04-24 21:17:58.397355,2025-04-24 21:18:02.351781,0 days 00:00:03.954426,False,squared_error,37,,1,6,736,TPESampler,COMPLETE
18,0.5761815500505834,2025-04-24 21:18:02.490100,2025-04-24 21:18:04.712887,0 days 00:00:02.222787,False,squared_error,27,log2,1,2,981,TPESampler,COMPLETE
19,0.42597375052860337,2025-04-24 21:18:02.523167,2025-04-24 21:18:06.025883,0 days 00:00:03.502716,True,squared_error,27,,2,2,774,TPESampler,COMPLETE
20,0.9551711982601562,2025-04-24 21:18:03.464097,2025-04-24 21:18:04.882455,0 days 00:00:01.418358,True,absolute_error,39,log2,3,2,568,TPESampler,COMPLETE
21,0.387876090743735,2025-04-24 21:18:04.887796,2025-04-24 21:18:08.118615,0 days 00:00:03.230819,True,absolute_error,47,sqrt,1,2,282,TPESampler,COMPLETE
22,0.39378534419057404,2025-04-24 21:18:05.080028,2025-04-24 21:18:08.034334,0 days 00:00:02.954306,True,absolute_error,43,sqrt,1,2,294,TPESampler,COMPLETE
23,0.49042384916664095,2025-04-24 21:18:06.199640,2025-04-24 21:18:11.061979,0 days 00:00:04.862339,False,absolute_error,42,log2,1,5,532,TPESampler,COMPLETE
24,0.45292760174691243,2025-04-24 21:18:06.582477,2025-04-24 21:18:11.420764,0 days 00:00:04.838287,True,absolute_error,49,log2,1,3,644,TPESampler,COMPLETE
25,0.9090095257794899,2025-04-24 21:18:08.206485,2025-04-24 21:18:09.084456,0 days 00:00:00.877971,True,absolute_error,48,sqrt,4,3,108,TPESampler,COMPLETE
26,0.6632593140814383,2025-04-24 21:18:08.299144,2025-04-24 21:18:11.032654,0 days 00:00:02.733510,True,absolute_error,49,sqrt,2,6,520,TPESampler,COMPLETE
27,0.3509076420738022,2025-04-24 21:18:09.248009,2025-04-24 21:18:24.187171,0 days 00:00:14.939162,True,absolute_error,40,,1,3,282,TPESampler,COMPLETE
28,0.44848703897026965,2025-04-24 21:18:10.011768,2025-04-24 21:18:11.672283,0 days 00:00:01.660515,False,squared_error,38,,2,2,241,TPESampler,COMPLETE
29,0.3932300362561557,2025-04-24 21:18:11.214111,2025-04-24 21:18:21.090195,0 days 00:00:09.876084,False,absolute_error,42,sqrt,1,2,537,TPESampler,COMPLETE
30,0.38245278800033905,2025-04-24 21:18:11.224040,2025-04-24 21:18:13.390240,0 days 00:00:02.166200,False,absolute_error,50,sqrt,1,2,101,TPESampler,COMPLETE
31,0.4431725828384159,2025-04-24 21:18:11.597330,2025-04-24 21:18:32.187349,0 days 00:00:20.590019,True,absolute_error,49,,2,3,657,TPESampler,COMPLETE
32,0.6574658745344343,2025-04-24 21:18:12.077104,2025-04-24 21:18:14.950346,0 days 00:00:02.873242,True,absolute_error,44,sqrt,2,2,505,TPESampler,COMPLETE
33,0.8923785142616363,2025-04-24 21:18:13.555502,2025-04-24 21:18:14.285516,0 days 00:00:00.730014,False,absolute_error,49,log2,2,2,111,TPESampler,COMPLETE
34,0.40289027661004756,2025-04-24 21:18:14.446629,2025-04-24 21:18:16.698424,0 days 00:00:02.251795,False,absolute_error,37,sqrt,1,3,148,TPESampler,COMPLETE
35,0.542979182904985,2025-04-24 21:18:15.118122,2025-04-24 21:18:18.809721,0 days 00:00:03.691599,False,absolute_error,49,sqrt,2,4,272,TPESampler,COMPLETE
36,0.6613560165303011,2025-04-24 21:18:16.874832,2025-04-24 21:18:17.832101,0 days 00:00:00.957269,True,squared_error,48,sqrt,2,2,170,TPESampler,COMPLETE
37,0.44842525442167197,2025-04-24 21:18:17.428309,2025-04-24 21:18:19.980559,0 days 00:00:02.552250,True,absolute_error,50,log2,1,3,294,TPESampler,COMPLETE
38,0.34347124986704153,2025-04-24 21:18:17.981668,2025-04-24 21:18:21.025694,0 days 00:00:03.044026,True,squared_error,43,,1,2,523,TPESampler,COMPLETE
39,0.3853011790344117,2025-04-24 21:18:18.970789,2025-04-24 21:18:37.471785,0 days 00:00:18.500996,False,absolute_error,44,,1,2,183,TPESampler,COMPLETE
40,0.3813606709712452,2025-04-24 21:18:20.147679,2025-04-24 21:18:25.529994,0 days 00:00:05.382315,True,absolute_error,47,sqrt,1,2,590,TPESampler,COMPLETE
41,0.42833263466768107,2025-04-24 21:18:21.203049,2025-04-24 21:18:23.326492,0 days 00:00:02.123443,True,squared_error,33,,2,2,486,TPESampler,COMPLETE
42,0.34334432945115106,2025-04-24 21:18:21.270971,2025-04-24 21:18:24.023104,0 days 00:00:02.752133,True,squared_error,41,,1,3,531,TPESampler,COMPLETE
43,0.38211788605235025,2025-04-24 21:18:23.495030,2025-04-24 21:18:26.984028,0 days 00:00:03.488998,False,absolute_error,50,sqrt,1,2,219,TPESampler,COMPLETE
44,0.3444196952103753,2025-04-24 21:18:24.180894,2025-04-24 21:18:27.752889,0 days 00:00:03.571995,True,squared_error,50,,1,2,672,TPESampler,COMPLETE
45,0.35519086567420205,2025-04-24 21:18:24.379893,2025-04-24 21:18:26.003432,0 days 00:00:01.623539,True,squared_error,44,,1,5,266,TPESampler,COMPLETE
46,0.359418731629703,2025-04-24 21:18:25.706548,2025-04-24 21:18:45.048093,0 days 00:00:19.341545,True,absolute_error,34,,1,5,368,TPESampler,COMPLETE
47,0.44951425871534234,2025-04-24 21:18:26.272089,2025-04-24 21:18:27.080523,0 days 00:00:00.808434,True,squared_error,46,,2,7,109,TPESampler,COMPLETE
48,0.3468092455958094,2025-04-24 21:18:27.168524,2025-04-24 21:18:30.291397,0 days 00:00:03.122873,True,squared_error,42,,1,4,545,TPESampler,COMPLETE
49,0.4743649645006595,2025-04-24 21:18:27.291345,2025-04-24 21:18:28.773059,0 days 00:00:01.481714,True,squared_error,41,log2,1,3,445,TPESampler,COMPLETE
50,0.43099146109172265,2025-04-24 21:18:27.982133,2025-04-24 21:18:33.708842,0 days 00:00:05.726709,False,squared_error,50,,1,2,872,TPESampler,COMPLETE
51,0.34497013631215817,2025-04-24 21:18:28.932288,2025-04-24 21:18:32.904385,0 days 00:00:03.972097,True,squared_error,47,,1,2,725,TPESampler,COMPLETE
52,0.406880648693922,2025-04-24 21:18:30.452565,2025-04-24 21:18:33.306831,0 days 00:00:02.854266,True,squared_error,37,,1,13,706,TPESampler,COMPLETE
53,0.3634592002779667,2025-04-24 21:18:32.362534,2025-04-24 21:18:39.255977,0 days 00:00:06.893443,True,absolute_error,42,,1,3,124,TPESampler,COMPLETE
54,0.3436221019525179,2025-04-24 21:18:33.067723,2025-04-24 21:18:36.296628,0 days 00:00:03.228905,True,squared_error,50,,1,2,556,TPESampler,COMPLETE
55,0.342785750520717,2025-04-24 21:18:33.465771,2025-04-24 21:18:37.533993,0 days 00:00:04.068222,True,squared_error,43,,1,3,772,TPESampler,COMPLETE
56,0.37598888937164454,2025-04-24 21:18:33.883513,2025-04-24 21:18:35.806212,0 days 00:00:01.922699,True,squared_error,48,sqrt,1,3,782,TPESampler,COMPLETE
57,0.343640281680789,2025-04-24 21:18:35.962549,2025-04-24 21:18:39.300532,0 days 00:00:03.337983,True,squared_error,36,,1,3,644,TPESampler,COMPLETE
58,0.3441064294884471,2025-04-24 21:18:36.522510,2025-04-24 21:18:40.283429,0 days 00:00:03.760919,True,squared_error,50,,1,2,664,TPESampler,COMPLETE
59,0.34274829165262083,2025-04-24 21:18:37.647161,2025-04-24 21:18:42.735520,0 days 00:00:05.088359,True,squared_error,44,,1,3,899,TPESampler,COMPLETE
60,0.3438362759198808,2025-04-24 21:18:37.713839,2025-04-24 21:18:42.204338,0 days 00:00:04.490499,True,squared_error,47,,1,2,836,TPESampler,COMPLETE
61,0.8809257739375336,2025-04-24 21:18:39.388530,2025-04-24 21:18:41.219465,0 days 00:00:01.830935,True,squared_error,40,log2,2,8,740,TPESampler,COMPLETE
62,0.4308006387437341,2025-04-24 21:18:39.448590,2025-04-24 21:18:42.867491,0 days 00:00:03.418901,False,squared_error,46,,1,3,420,TPESampler,COMPLETE
63,0.3595523757880651,2025-04-24 21:18:40.454085,2025-04-24 21:19:15.259722,0 days 00:00:34.805637,True,absolute_error,19,,1,3,713,TPESampler,COMPLETE
64,0.3439842091942555,2025-04-24 21:18:41.401776,2025-04-24 21:18:44.611679,0 days 00:00:03.209903,True,squared_error,41,,1,2,447,TPESampler,COMPLETE
65,0.6370345022592325,2025-04-24 21:18:42.390526,2025-04-24 21:18:43.686511,0 days 00:00:01.295985,False,squared_error,33,,14,27,365,TPESampler,COMPLETE
66,0.3912622283101582,2025-04-24 21:18:42.954700,2025-04-24 21:18:47.521956,0 days 00:00:04.567256,True,squared_error,50,,1,10,886,TPESampler,COMPLETE
67,0.35391363344154364,2025-04-24 21:18:43.033840,2025-04-24 21:18:48.025229,0 days 00:00:04.991389,True,squared_error,43,,1,5,922,TPESampler,COMPLETE
68,0.43370812919500906,2025-04-24 21:18:43.858826,2025-04-24 21:18:46.383461,0 days 00:00:02.524635,True,squared_error,49,log2,1,4,989,TPESampler,COMPLETE
69,0.3426161759151616,2025-04-24 21:18:44.796117,2025-04-24 21:18:49.722856,0 days 00:00:04.926739,True,squared_error,38,,1,3,945,TPESampler,COMPLETE
70,0.4276690393998239,2025-04-24 21:18:45.284093,2025-04-24 21:18:48.128641,0 days 00:00:02.844548,True,squared_error,30,sqrt,1,2,908,TPESampler,COMPLETE
71,0.345733340896148,2025-04-24 21:18:46.552745,2025-04-24 21:19:42.918475,0 days 00:00:56.365730,True,absolute_error,50,,1,2,969,TPESampler,COMPLETE
72,0.3453663149948257,2025-04-24 21:18:47.707812,2025-04-24 21:18:51.657454,0 days 00:00:03.949642,True,squared_error,33,,1,3,633,TPESampler,COMPLETE
73,0.9218362765198509,2025-04-24 21:18:48.216549,2025-04-24 21:18:49.215053,0 days 00:00:00.998504,True,absolute_error,41,log2,2,17,117,TPESampler,COMPLETE
74,0.43021777008704076,2025-04-24 21:18:48.334726,2025-04-24 21:18:49.950167,0 days 00:00:01.615441,True,squared_error,50,,2,2,352,TPESampler,COMPLETE
75,0.4602888854037546,2025-04-24 21:18:49.392903,2025-04-24 21:18:53.711145,0 days 00:00:04.318242,True,squared_error,45,,3,3,961,TPESampler,COMPLETE
76,0.34437673491621584,2025-04-24 21:18:50.127045,2025-04-24 21:18:54.601899,0 days 00:00:04.474854,True,squared_error,38,,1,2,920,TPESampler,COMPLETE
77,0.4254180465037253,2025-04-24 21:18:50.195494,2025-04-24 21:18:54.307187,0 days 00:00:04.111693,True,squared_error,36,,2,3,828,TPESampler,COMPLETE
78,0.483097649768518,2025-04-24 21:18:51.840513,2025-04-24 21:18:53.735467,0 days 00:00:01.894954,False,squared_error,27,sqrt,1,41,873,TPESampler,COMPLETE
79,0.3488821765796931,2025-04-24 21:18:53.856729,2025-04-24 21:19:28.451495,0 days 00:00:34.594766,True,absolute_error,34,,1,2,621,TPESampler,COMPLETE
80,0.8717077893509467,2025-04-24 21:18:53.904262,2025-04-24 21:18:55.598377,0 days 00:00:01.694115,True,absolute_error,12,sqrt,4,8,358,TPESampler,COMPLETE
81,0.39280164586788574,2025-04-24 21:18:54.532207,2025-04-24 21:18:56.808136,0 days 00:00:02.275929,True,squared_error,39,sqrt,1,2,528,TPESampler,COMPLETE
82,0.3441399623346259,2025-04-24 21:18:54.909559,2025-04-24 21:18:59.728194,0 days 00:00:04.818635,True,squared_error,42,,1,2,969,TPESampler,COMPLETE
83,0.4692913715826377,2025-04-24 21:18:55.776649,2025-04-24 21:19:02.141326,0 days 00:00:06.364677,False,absolute_error,28,sqrt,1,28,526,TPESampler,COMPLETE
84,0.36321259869553085,2025-04-24 21:18:56.976916,2025-04-24 21:19:00.415462,0 days 00:00:03.438546,True,squared_error,32,,1,6,850,TPESampler,COMPLETE
85,0.43296871495161005,2025-04-24 21:18:59.904062,2025-04-24 21:19:04.396997,0 days 00:00:04.492935,False,squared_error,35,,1,2,734,TPESampler,COMPLETE
86,0.34491362604976356,2025-04-24 21:19:00.588245,2025-04-24 21:19:03.550762,0 days 00:00:02.962517,True,squared_error,41,,1,2,489,TPESampler,COMPLETE
87,0.4925302524151555,2025-04-24 21:19:02.305612,2025-04-24 21:19:04.709059,0 days 00:00:02.403447,True,squared_error,14,,4,41,782,TPESampler,COMPLETE
88,0.34623637401373747,2025-04-24 21:19:03.723150,2025-04-24 21:19:06.154182,0 days 00:00:02.431032,True,squared_error,39,,1,2,359,TPESampler,COMPLETE
89,0.34327854653060635,2025-04-24 21:19:04.574146,2025-04-24 21:19:07.949643,0 days 00:00:03.375497,True,squared_error,40,,1,3,686,TPESampler,COMPLETE
90,0.5860688519767882,2025-04-24 21:19:04.912018,2025-04-24 21:19:07.183054,0 days 00:00:02.271036,True,squared_error,26,log2,1,2,811,TPESampler,COMPLETE
91,0.44293026712437433,2025-04-24 21:19:06.334991,2025-04-24 21:19:08.687016,0 days 00:00:02.352025,True,squared_error,47,,2,7,498,TPESampler,COMPLETE
92,0.45818670250800125,2025-04-24 21:19:07.349386,2025-04-24 21:19:09.821410,0 days 00:00:02.472024,True,squared_error,44,log2,1,2,685,TPESampler,COMPLETE
93,0.3447464262046887,2025-04-24 21:19:08.168483,2025-04-24 21:19:11.283463,0 days 00:00:03.114980,True,squared_error,37,,1,3,670,TPESampler,COMPLETE
94,0.34202431009159046,2025-04-24 21:19:08.866024,2025-04-24 21:19:13.014252,0 days 00:00:04.148228,True,squared_error,46,,1,3,799,TPESampler,COMPLETE
95,0.37753789017686307,2025-04-24 21:19:09.999265,2025-04-24 21:19:58.642663,0 days 00:00:48.643398,True,absolute_error,45,,1,8,914,TPESampler,COMPLETE
96,0.34239764576685683,2025-04-24 21:19:11.453094,2025-04-24 21:19:14.244585,0 days 00:00:02.791491,True,squared_error,46,,1,2,512,TPESampler,COMPLETE
97,0.9786740968896346,2025-04-24 21:19:13.172955,2025-04-24 21:19:14.181254,0 days 00:00:01.008299,False,absolute_error,42,log2,10,6,607,TPESampler,COMPLETE
98,0.4636504342246532,2025-04-24 21:19:14.394364,2025-04-24 21:19:16.752936,0 days 00:00:02.358572,True,squared_error,43,,3,2,644,TPESampler,COMPLETE
99,0.3472663622933397,2025-04-24 21:19:14.424633,2025-04-24 21:19:39.592374,0 days 00:00:25.167741,True,absolute_error,50,,1,2,423,TPESampler,COMPLETE
100,0.9660767030826116,2025-04-24 21:19:15.424369,2025-04-24 21:19:16.411152,0 days 00:00:00.986783,False,absolute_error,15,log2,6,6,502,TPESampler,COMPLETE
101,0.3727293565123044,2025-04-24 21:19:16.581453,2025-04-24 21:19:18.078756,0 days 00:00:01.497303,False,squared_error,47,sqrt,1,3,531,TPESampler,COMPLETE
102,0.9261000406511251,2025-04-24 21:19:16.929175,2025-04-24 21:19:17.612635,0 days 00:00:00.683460,False,squared_error,18,log2,10,5,111,TPESampler,COMPLETE
103,0.5500683347792528,2025-04-24 21:19:17.778878,2025-04-24 21:19:19.155150,0 days 00:00:01.376272,True,squared_error,18,sqrt,1,9,631,TPESampler,COMPLETE
104,0.6340541305475506,2025-04-24 21:19:18.332566,2025-04-24 21:19:20.413178,0 days 00:00:02.080612,False,squared_error,49,,9,29,732,TPESampler,COMPLETE
105,0.6329633346532514,2025-04-24 21:19:19.320608,2025-04-24 21:19:22.891047,0 days 00:00:03.570439,False,absolute_error,11,,12,20,413,TPESampler,COMPLETE
106,0.6139210184577694,2025-04-24 21:19:20.579056,2025-04-24 21:19:21.654038,0 days 00:00:01.074982,False,squared_error,25,log2,1,11,611,TPESampler,COMPLETE
107,0.34316450811479315,2025-04-24 21:19:21.824358,2025-04-24 21:19:25.665975,0 days 00:00:03.841617,True,squared_error,44,,1,3,836,TPESampler,COMPLETE
108,0.5013113572394221,2025-04-24 21:19:23.067695,2025-04-24 21:19:25.180936,0 days 00:00:02.113241,False,squared_error,6,,1,3,731,TPESampler,COMPLETE
109,0.34021127647124577,2025-04-24 21:19:25.344618,2025-04-24 21:19:27.979373,0 days 00:00:02.634755,True,squared_error,48,,1,3,450,TPESampler,COMPLETE
110,0.35449080312799136,2025-04-24 21:19:25.897943,2025-04-24 21:19:29.361712,0 days 00:00:03.463769,True,squared_error,49,,1,5,759,TPESampler,COMPLETE
111,0.3468221613226958,2025-04-24 21:19:28.139727,2025-04-24 21:19:30.947263,0 days 00:00:02.807536,True,squared_error,45,,1,4,532,TPESampler,COMPLETE
112,0.34627808664085163,2025-04-24 21:19:28.780477,2025-04-24 21:19:31.627487,0 days 00:00:02.847010,True,squared_error,50,,1,4,571,TPESampler,COMPLETE
113,0.9588115046781067,2025-04-24 21:19:29.527823,2025-04-24 21:19:30.936827,0 days 00:00:01.409004,False,absolute_error,36,sqrt,14,3,940,TPESampler,COMPLETE
114,0.3446569271226191,2025-04-24 21:19:31.118556,2025-04-24 21:19:34.681172,0 days 00:00:03.562616,True,squared_error,40,,1,2,706,TPESampler,COMPLETE
115,0.5407748966067505,2025-04-24 21:19:31.130678,2025-04-24 21:19:35.884396,0 days 00:00:04.753718,False,absolute_error,18,sqrt,1,3,424,TPESampler,COMPLETE
116,0.992240773315842,2025-04-24 21:19:31.976766,2025-04-24 21:19:32.721172,0 days 00:00:00.744406,True,absolute_error,18,log2,10,4,193,TPESampler,COMPLETE
117,0.6005231274671629,2025-04-24 21:19:32.885653,2025-04-24 21:19:33.639574,0 days 00:00:00.753921,True,squared_error,33,,8,49,128,TPESampler,COMPLETE
118,0.3480086460524416,2025-04-24 21:19:33.799927,2025-04-24 21:19:37.208373,0 days 00:00:03.408446,True,squared_error,39,,1,4,677,TPESampler,COMPLETE
119,0.3441687213585102,2025-04-24 21:19:34.843695,2025-04-24 21:19:37.279720,0 days 00:00:02.436025,True,squared_error,49,,1,2,438,TPESampler,COMPLETE
120,0.34798167031567245,2025-04-24 21:19:36.057110,2025-04-24 21:19:40.028566,0 days 00:00:03.971456,True,squared_error,36,,1,4,837,TPESampler,COMPLETE
121,0.4603672194584903,2025-04-24 21:19:37.393460,2025-04-24 21:20:52.974831,0 days 00:01:15.581371,False,absolute_error,20,,1,18,954,TPESampler,COMPLETE
122,0.34298780754382524,2025-04-24 21:19:37.456524,2025-04-24 21:19:41.903707,0 days 00:00:04.447183,True,squared_error,42,,1,3,856,TPESampler,COMPLETE
123,0.9371430492261165,2025-04-24 21:19:39.775150,2025-04-24 21:19:41.349573,0 days 00:00:01.574423,True,squared_error,43,log2,12,2,839,TPESampler,COMPLETE
124,0.44779744704237606,2025-04-24 21:19:40.243682,2025-04-24 21:19:44.697576,0 days 00:00:04.453894,False,squared_error,42,,2,5,984,TPESampler,COMPLETE
125,0.34312609766933927,2025-04-24 21:19:41.527464,2025-04-24 21:19:44.633351,0 days 00:00:03.105887,True,squared_error,50,,1,2,436,TPESampler,COMPLETE
126,0.3443113173994185,2025-04-24 21:19:42.188922,2025-04-24 21:19:46.377898,0 days 00:00:04.188976,True,squared_error,42,,1,3,740,TPESampler,COMPLETE
127,0.6023836725212754,2025-04-24 21:19:43.091295,2025-04-24 21:19:48.285368,0 days 00:00:05.194073,True,absolute_error,28,log2,1,4,861,TPESampler,COMPLETE
128,0.44070865039019164,2025-04-24 21:19:44.840419,2025-04-24 21:20:08.380841,0 days 00:00:23.540422,True,absolute_error,35,,2,3,882,TPESampler,COMPLETE
129,0.3465479641447269,2025-04-24 21:19:44.873201,2025-04-24 21:19:49.052897,0 days 00:00:04.179696,True,squared_error,43,,1,4,921,TPESampler,COMPLETE
130,0.6452999072256137,2025-04-24 21:19:46.550253,2025-04-24 21:19:48.315267,0 days 00:00:01.765014,True,squared_error,42,sqrt,2,4,919,TPESampler,COMPLETE
131,0.9159386416315535,2025-04-24 21:19:48.411342,2025-04-24 21:19:50.214964,0 days 00:00:01.803622,True,squared_error,20,sqrt,14,14,713,TPESampler,COMPLETE
132,0.34266506424101556,2025-04-24 21:19:48.465219,2025-04-24 21:19:52.831516,0 days 00:00:04.366297,True,squared_error,45,,1,2,608,TPESampler,COMPLETE
133,0.3794623265169297,2025-04-24 21:19:49.272135,2025-04-24 21:20:50.668957,0 days 00:01:01.396822,False,absolute_error,45,,1,4,609,TPESampler,COMPLETE
134,0.8811050372869188,2025-04-24 21:19:50.383185,2025-04-24 21:19:51.502479,0 days 00:00:01.119294,False,squared_error,47,log2,3,2,708,TPESampler,COMPLETE
135,0.9686970345283026,2025-04-24 21:19:51.777668,2025-04-24 21:19:53.173624,0 days 00:00:01.395956,True,absolute_error,48,sqrt,14,26,657,TPESampler,COMPLETE
136,0.44849297293461815,2025-04-24 21:19:53.022921,2025-04-24 21:19:55.807413,0 days 00:00:02.784492,False,squared_error,50,,2,2,515,TPESampler,COMPLETE
137,0.34205377939103465,2025-04-24 21:19:53.330342,2025-04-24 21:19:55.313802,0 days 00:00:01.983460,True,squared_error,47,,1,3,319,TPESampler,COMPLETE
138,0.34813470233174426,2025-04-24 21:19:55.488142,2025-04-24 21:19:57.490847,0 days 00:00:02.002705,True,squared_error,43,,1,4,232,TPESampler,COMPLETE
139,0.9658121203934813,2025-04-24 21:19:56.244516,2025-04-24 21:19:57.762210,0 days 00:00:01.517694,False,absolute_error,13,log2,6,5,966,TPESampler,COMPLETE
