number,value,datetime_start,datetime_complete,duration,params_bootstrap,params_criterion,params_max_depth,params_max_features,params_min_samples_leaf,params_min_samples_split,params_n_estimators,system_attrs_auto:sampler,state
3816,0.34278637175058496,2025-04-24 22:07:31.678906,2025-04-24 22:07:37.001318,0 days 00:00:05.322412,True,squared_error,43,,1,3,674,TPESampler,COMPLETE
3817,0.34687115553932607,2025-04-24 22:07:33.017633,2025-04-24 22:07:38.349433,0 days 00:00:05.331800,True,squared_error,44,,1,4,657,TPESampler,COMPLETE
3818,0.6314214447915886,2025-04-24 22:07:33.404379,2025-04-24 22:07:36.435407,0 days 00:00:03.031028,False,absolute_error,24,log2,1,5,247,TPESampler,COMPLETE
3819,0.43027757890450535,2025-04-24 22:07:34.140223,2025-04-24 22:07:36.871657,0 days 00:00:02.731434,True,squared_error,50,,2,3,405,TPESampler,COMPLETE
3820,0.8825977390725355,2025-04-24 22:07:34.605459,2025-04-24 22:07:36.576107,0 days 00:00:01.970648,False,squared_error,8,log2,3,34,816,TPESampler,COMPLETE
3821,0.3435971855938874,2025-04-24 22:07:34.882403,2025-04-24 22:07:39.465286,0 days 00:00:04.582883,True,squared_error,44,,1,3,644,TPESampler,COMPLETE
3822,0.341877955049926,2025-04-24 22:07:36.681555,2025-04-24 22:07:39.951924,0 days 00:00:03.270369,True,squared_error,50,,1,3,366,TPESampler,COMPLETE
3823,0.34197537729846383,2025-04-24 22:07:36.830287,2025-04-24 22:07:41.542242,0 days 00:00:04.711955,True,squared_error,50,,1,3,630,TPESampler,COMPLETE
3824,0.3448977765598833,2025-04-24 22:07:37.246349,2025-04-24 22:07:42.883933,0 days 00:00:05.637584,True,squared_error,43,,1,2,691,TPESampler,COMPLETE
3825,0.5403639340399303,2025-04-24 22:07:37.343111,2025-04-24 22:07:40.318452,0 days 00:00:02.975341,True,squared_error,33,,5,3,551,TPESampler,COMPLETE
3826,0.3430282975471682,2025-04-24 22:07:38.659117,2025-04-24 22:07:43.328023,0 days 00:00:04.668906,True,squared_error,50,,1,2,610,TPESampler,COMPLETE
3827,0.3470977407827031,2025-04-24 22:07:39.897721,2025-04-24 22:07:43.331008,0 days 00:00:03.433287,True,squared_error,44,,1,4,509,TPESampler,COMPLETE
3828,0.4289742917219952,2025-04-24 22:07:40.256398,2025-04-24 22:07:44.538684,0 days 00:00:04.282286,False,squared_error,45,,1,3,511,TPESampler,COMPLETE
3829,0.34135458335262325,2025-04-24 22:07:40.643108,2025-04-24 22:07:46.698236,0 days 00:00:06.055128,True,squared_error,50,,1,3,939,TPESampler,COMPLETE
3830,0.42808351861148136,2025-04-24 22:07:41.847333,2025-04-24 22:07:45.667976,0 days 00:00:03.820643,True,squared_error,50,,2,3,612,TPESampler,COMPLETE
3831,0.34346086840368084,2025-04-24 22:07:43.119522,2025-04-24 22:07:47.832630,0 days 00:00:04.713108,True,squared_error,50,,1,2,571,TPESampler,COMPLETE
3832,0.5176989820877997,2025-04-24 22:07:43.534284,2025-04-24 22:07:46.086210,0 days 00:00:02.551926,False,squared_error,21,sqrt,1,31,750,TPESampler,COMPLETE
3833,0.8446907363531434,2025-04-24 22:07:43.594877,2025-04-24 22:07:45.618799,0 days 00:00:02.023922,False,squared_error,5,sqrt,6,3,252,TPESampler,COMPLETE
3834,0.3529100243851484,2025-04-24 22:07:44.991598,2025-04-24 22:07:49.096204,0 days 00:00:04.104606,True,squared_error,50,,1,5,619,TPESampler,COMPLETE
3835,0.4272706858088016,2025-04-24 22:07:45.885058,2025-04-24 22:09:21.162767,0 days 00:01:35.277709,False,absolute_error,44,,1,14,990,TPESampler,COMPLETE
3836,0.3457172885448026,2025-04-24 22:07:45.970650,2025-04-24 22:07:50.432189,0 days 00:00:04.461539,True,squared_error,43,,1,4,590,TPESampler,COMPLETE
3837,0.35679655086677425,2025-04-24 22:07:46.701801,2025-04-24 22:08:28.270250,0 days 00:00:41.568449,True,absolute_error,50,,1,5,765,TPESampler,COMPLETE
3838,0.34091216264960283,2025-04-24 22:07:48.253057,2025-04-24 22:07:52.999620,0 days 00:00:04.746563,True,squared_error,50,,1,3,530,TPESampler,COMPLETE
3839,0.4283508649946867,2025-04-24 22:07:48.457445,2025-04-24 22:07:52.596050,0 days 00:00:04.138605,True,squared_error,41,,2,2,554,TPESampler,COMPLETE
3840,0.41297146248846467,2025-04-24 22:07:49.777797,2025-04-24 22:07:55.670840,0 days 00:00:05.893043,False,squared_error,50,,1,5,734,TPESampler,COMPLETE
3841,0.3417079573694166,2025-04-24 22:07:50.872449,2025-04-24 22:07:53.517782,0 days 00:00:02.645333,True,squared_error,50,,1,3,411,TPESampler,COMPLETE
3842,0.9342500827171462,2025-04-24 22:07:52.901043,2025-04-24 22:07:54.900033,0 days 00:00:01.998990,False,squared_error,8,log2,15,19,940,TPESampler,COMPLETE
3843,0.34340983749468634,2025-04-24 22:07:53.430389,2025-04-24 22:07:57.678200,0 days 00:00:04.247811,True,squared_error,43,,1,2,384,TPESampler,COMPLETE
3844,0.6372777562933888,2025-04-24 22:07:53.864940,2025-04-24 22:07:56.547900,0 days 00:00:02.682960,False,squared_error,27,,10,38,809,TPESampler,COMPLETE
3845,0.4307275878919618,2025-04-24 22:07:55.309817,2025-04-24 22:07:59.880841,0 days 00:00:04.571024,True,squared_error,44,,2,5,699,TPESampler,COMPLETE
3846,0.4275590154308394,2025-04-24 22:07:56.155824,2025-04-24 22:07:59.945805,0 days 00:00:03.789981,True,squared_error,50,,2,3,597,TPESampler,COMPLETE
3847,0.3703717127386198,2025-04-24 22:07:56.794254,2025-04-24 22:07:58.693009,0 days 00:00:01.898755,True,squared_error,50,sqrt,1,2,538,TPESampler,COMPLETE
3848,0.9776940339275515,2025-04-24 22:07:57.998077,2025-04-24 22:07:59.912461,0 days 00:00:01.914384,True,absolute_error,16,log2,6,15,480,TPESampler,COMPLETE
3849,0.3442035667107901,2025-04-24 22:07:58.954502,2025-04-24 22:08:01.977240,0 days 00:00:03.022738,True,squared_error,50,,1,2,510,TPESampler,COMPLETE
3850,0.428021746894953,2025-04-24 22:08:00.075613,2025-04-24 22:08:03.490639,0 days 00:00:03.415026,True,squared_error,43,,2,3,505,TPESampler,COMPLETE
3851,0.34754685350052383,2025-04-24 22:08:00.248898,2025-04-24 22:08:05.766076,0 days 00:00:05.517178,True,squared_error,44,,1,4,747,TPESampler,COMPLETE
3852,0.3471152648326751,2025-04-24 22:08:00.441100,2025-04-24 22:08:04.583291,0 days 00:00:04.142191,True,squared_error,36,,1,4,553,TPESampler,COMPLETE
3853,0.4917524452417368,2025-04-24 22:08:02.201397,2025-04-24 22:08:03.655511,0 days 00:00:01.454114,True,squared_error,50,log2,1,17,548,TPESampler,COMPLETE
3854,0.34215335504104055,2025-04-24 22:08:03.754547,2025-04-24 22:08:08.624655,0 days 00:00:04.870108,True,squared_error,50,,1,3,662,TPESampler,COMPLETE
3855,0.47885785828372945,2025-04-24 22:08:03.900971,2025-04-24 22:08:10.163108,0 days 00:00:06.262137,True,absolute_error,28,sqrt,1,25,689,TPESampler,COMPLETE
3856,0.4306852493914719,2025-04-24 22:08:05.059435,2025-04-24 22:08:08.322059,0 days 00:00:03.262624,True,squared_error,50,,2,5,586,TPESampler,COMPLETE
3857,0.34299633852006717,2025-04-24 22:08:06.188260,2025-04-24 22:08:09.893193,0 days 00:00:03.704933,True,squared_error,42,,1,3,516,TPESampler,COMPLETE
3858,0.3440938309294967,2025-04-24 22:08:08.554360,2025-04-24 22:08:13.346214,0 days 00:00:04.791854,True,squared_error,44,,1,3,758,TPESampler,COMPLETE
3859,0.34790295224731493,2025-04-24 22:08:08.960109,2025-04-24 22:08:13.467544,0 days 00:00:04.507435,True,squared_error,50,,1,4,727,TPESampler,COMPLETE
3860,0.6261201657814186,2025-04-24 22:08:10.197949,2025-04-24 22:08:13.517693,0 days 00:00:03.319744,True,absolute_error,25,log2,1,3,527,TPESampler,COMPLETE
3861,0.34507637985066886,2025-04-24 22:08:10.408930,2025-04-24 22:08:14.604774,0 days 00:00:04.195844,True,squared_error,50,,1,2,746,TPESampler,COMPLETE
3862,0.34201882811241685,2025-04-24 22:08:13.644182,2025-04-24 22:08:17.571948,0 days 00:00:03.927766,True,squared_error,50,,1,3,508,TPESampler,COMPLETE
3863,0.3420777600724158,2025-04-24 22:08:13.714496,2025-04-24 22:08:17.313363,0 days 00:00:03.598867,True,squared_error,43,,1,3,428,TPESampler,COMPLETE
3864,0.418110466077582,2025-04-24 22:08:13.918996,2025-04-24 22:08:30.735876,0 days 00:00:16.816880,False,absolute_error,14,,1,7,227,TPESampler,COMPLETE
3865,0.4146968466866789,2025-04-24 22:08:15.312176,2025-04-24 22:09:30.097237,0 days 00:01:14.785061,False,absolute_error,17,,1,4,967,TPESampler,COMPLETE
3866,0.8814954426368914,2025-04-24 22:08:17.534777,2025-04-24 22:08:18.681534,0 days 00:00:01.146757,True,squared_error,46,log2,2,41,137,TPESampler,COMPLETE
3867,0.42793032634250205,2025-04-24 22:08:17.889571,2025-04-24 22:08:21.196028,0 days 00:00:03.306457,True,squared_error,50,,2,2,583,TPESampler,COMPLETE
3868,0.34139830117735714,2025-04-24 22:08:18.973240,2025-04-24 22:08:22.826673,0 days 00:00:03.853433,True,squared_error,50,,1,3,579,TPESampler,COMPLETE
3869,0.3435265159780922,2025-04-24 22:08:21.437475,2025-04-24 22:08:25.160833,0 days 00:00:03.723358,True,squared_error,43,,1,2,577,TPESampler,COMPLETE
3870,0.3415925561505432,2025-04-24 22:08:23.059935,2025-04-24 22:08:25.299316,0 days 00:00:02.239381,True,squared_error,50,,1,3,352,TPESampler,COMPLETE
3871,0.3467520577563037,2025-04-24 22:08:25.358830,2025-04-24 22:08:28.984563,0 days 00:00:03.625733,True,squared_error,50,,1,4,490,TPESampler,COMPLETE
3872,0.5603696366098188,2025-04-24 22:08:25.550373,2025-04-24 22:08:27.392575,0 days 00:00:01.842202,True,absolute_error,34,log2,1,2,128,TPESampler,COMPLETE
3873,0.4322476317314983,2025-04-24 22:08:27.616462,2025-04-24 22:08:29.619566,0 days 00:00:02.003104,True,squared_error,50,log2,1,4,593,TPESampler,COMPLETE
3874,0.3548772896711202,2025-04-24 22:08:28.562200,2025-04-24 22:08:31.981813,0 days 00:00:03.419613,True,squared_error,42,,1,5,669,TPESampler,COMPLETE
3875,0.3467063028263396,2025-04-24 22:08:29.582430,2025-04-24 22:09:02.173562,0 days 00:00:32.591132,True,absolute_error,41,,1,3,599,TPESampler,COMPLETE
3876,0.3419012290460361,2025-04-24 22:08:29.915108,2025-04-24 22:08:34.064036,0 days 00:00:04.148928,True,squared_error,50,,1,3,653,TPESampler,COMPLETE
3877,0.6479022126340237,2025-04-24 22:08:31.039493,2025-04-24 22:08:34.931600,0 days 00:00:03.892107,False,absolute_error,22,,14,3,421,TPESampler,COMPLETE
3878,0.3451627738189804,2025-04-24 22:08:32.204287,2025-04-24 22:08:36.070775,0 days 00:00:03.866488,True,squared_error,43,,1,2,728,TPESampler,COMPLETE
3879,0.34202196308817584,2025-04-24 22:08:34.287369,2025-04-24 22:08:37.917903,0 days 00:00:03.630534,True,squared_error,43,,1,3,549,TPESampler,COMPLETE
3880,0.41152783029011536,2025-04-24 22:08:35.312708,2025-04-24 22:08:36.683818,0 days 00:00:01.371110,False,squared_error,49,,1,4,108,TPESampler,COMPLETE
3881,0.352744684065047,2025-04-24 22:08:36.311483,2025-04-24 22:08:38.664870,0 days 00:00:02.353387,True,squared_error,50,,1,5,422,TPESampler,COMPLETE
3882,0.42836395608698585,2025-04-24 22:08:36.954828,2025-04-24 22:08:40.340933,0 days 00:00:03.386105,True,squared_error,40,,2,4,639,TPESampler,COMPLETE
3883,0.35294218691939394,2025-04-24 22:08:38.269782,2025-04-24 22:08:41.437438,0 days 00:00:03.167656,True,squared_error,43,,1,5,529,TPESampler,COMPLETE
3884,0.44546914115594577,2025-04-24 22:08:38.917429,2025-04-24 22:08:53.274693,0 days 00:00:14.357264,True,absolute_error,50,,2,3,307,TPESampler,COMPLETE
3885,0.3462809221957441,2025-04-24 22:08:40.575385,2025-04-24 22:08:43.923348,0 days 00:00:03.347963,True,squared_error,44,,1,4,567,TPESampler,COMPLETE
3886,0.43726380995693676,2025-04-24 22:08:41.719306,2025-04-24 22:09:04.150347,0 days 00:00:22.431041,False,absolute_error,5,,1,6,511,TPESampler,COMPLETE
3887,0.5548908389049192,2025-04-24 22:08:44.154204,2025-04-24 22:08:47.678358,0 days 00:00:03.524154,False,absolute_error,27,sqrt,2,12,477,TPESampler,COMPLETE
3888,0.34627808664085163,2025-04-24 22:08:47.904311,2025-04-24 22:08:50.878988,0 days 00:00:02.974677,True,squared_error,50,,1,4,571,TPESampler,COMPLETE
3889,0.34470388909021943,2025-04-24 22:08:51.125671,2025-04-24 22:08:54.333971,0 days 00:00:03.208300,True,squared_error,41,,1,2,562,TPESampler,COMPLETE
3890,0.3425196595650778,2025-04-24 22:08:53.522196,2025-04-24 22:08:57.435216,0 days 00:00:03.913020,True,squared_error,50,,1,3,789,TPESampler,COMPLETE
3891,0.4297389546196417,2025-04-24 22:08:54.559672,2025-04-24 22:08:56.717480,0 days 00:00:02.157808,True,squared_error,44,,2,2,458,TPESampler,COMPLETE
3892,0.43266994481533694,2025-04-24 22:08:56.949235,2025-04-24 22:08:59.187412,0 days 00:00:02.238177,True,squared_error,44,,2,5,452,TPESampler,COMPLETE
3893,0.42615164261186017,2025-04-24 22:08:57.745177,2025-04-24 22:08:59.328039,0 days 00:00:01.582862,True,squared_error,41,,2,3,254,TPESampler,COMPLETE
3894,0.3445064409251036,2025-04-24 22:08:59.457741,2025-04-24 22:09:02.918606,0 days 00:00:03.460865,True,squared_error,34,,1,2,593,TPESampler,COMPLETE
3895,0.4273346164477599,2025-04-24 22:08:59.570164,2025-04-24 22:09:02.481037,0 days 00:00:02.910873,True,squared_error,42,,2,2,675,TPESampler,COMPLETE
3896,0.4273960089406463,2025-04-24 22:09:02.402946,2025-04-24 22:09:06.975327,0 days 00:00:04.572381,True,squared_error,43,,2,2,735,TPESampler,COMPLETE
3897,0.42660820667729815,2025-04-24 22:09:02.721271,2025-04-24 22:09:06.084649,0 days 00:00:03.363378,True,squared_error,50,,2,3,781,TPESampler,COMPLETE
3898,0.7608374185833356,2025-04-24 22:09:03.199407,2025-04-24 22:09:05.148094,0 days 00:00:01.948687,True,squared_error,17,sqrt,3,3,403,TPESampler,COMPLETE
3899,0.4280848992604036,2025-04-24 22:09:04.448117,2025-04-24 22:09:08.337283,0 days 00:00:03.889166,True,squared_error,50,,2,3,644,TPESampler,COMPLETE
3900,0.34363522735903734,2025-04-24 22:09:05.371881,2025-04-24 22:09:08.398035,0 days 00:00:03.026154,True,squared_error,43,,1,2,354,TPESampler,COMPLETE
3901,0.6459466228429113,2025-04-24 22:09:06.395157,2025-04-24 22:09:07.942387,0 days 00:00:01.547230,True,squared_error,50,sqrt,2,4,571,TPESampler,COMPLETE
3902,0.8789086057755104,2025-04-24 22:09:07.278407,2025-04-24 22:09:09.017481,0 days 00:00:01.739074,True,absolute_error,24,sqrt,4,19,366,TPESampler,COMPLETE
3903,0.3435613132432049,2025-04-24 22:09:08.221749,2025-04-24 22:09:11.965995,0 days 00:00:03.744246,True,squared_error,50,,1,2,618,TPESampler,COMPLETE
3904,0.4270710251914219,2025-04-24 22:09:08.560028,2025-04-24 22:09:12.530090,0 days 00:00:03.970062,True,squared_error,50,,2,2,658,TPESampler,COMPLETE
3905,0.34092542199522563,2025-04-24 22:09:08.613753,2025-04-24 22:09:12.454199,0 days 00:00:03.840446,True,squared_error,50,,1,3,448,TPESampler,COMPLETE
3906,0.3542675331911972,2025-04-24 22:09:09.595765,2025-04-24 22:09:14.077485,0 days 00:00:04.481720,True,squared_error,50,,1,5,707,TPESampler,COMPLETE
3907,0.8802738661672016,2025-04-24 22:09:12.185003,2025-04-24 22:09:13.707109,0 days 00:00:01.522106,False,squared_error,50,log2,3,10,849,TPESampler,COMPLETE
3908,0.34691607859661544,2025-04-24 22:09:12.687140,2025-04-24 22:09:17.739819,0 days 00:00:05.052679,True,squared_error,43,,1,4,471,TPESampler,COMPLETE
3909,0.34613089758460697,2025-04-24 22:09:12.750719,2025-04-24 22:09:17.785208,0 days 00:00:05.034489,True,squared_error,43,,1,4,530,TPESampler,COMPLETE
3910,0.7872710068431896,2025-04-24 22:09:13.944774,2025-04-24 22:09:18.889951,0 days 00:00:04.945177,False,absolute_error,13,log2,1,47,909,TPESampler,COMPLETE
3911,0.8641925828117283,2025-04-24 22:09:14.483916,2025-04-24 22:09:16.237292,0 days 00:00:01.753376,False,squared_error,5,log2,1,23,561,TPESampler,COMPLETE
3912,0.7842148378622498,2025-04-24 22:09:16.478908,2025-04-24 22:09:17.734478,0 days 00:00:01.255570,False,squared_error,38,sqrt,5,6,468,TPESampler,COMPLETE
3913,0.3462268878551752,2025-04-24 22:09:17.915266,2025-04-24 22:09:22.468071,0 days 00:00:04.552805,True,squared_error,50,,1,4,617,TPESampler,COMPLETE
3914,0.6141876514344152,2025-04-24 22:09:17.966408,2025-04-24 22:09:20.515435,0 days 00:00:02.549027,True,squared_error,31,log2,1,43,181,TPESampler,COMPLETE
3915,0.35442242955560027,2025-04-24 22:09:18.030441,2025-04-24 22:09:23.098148,0 days 00:00:05.067707,True,squared_error,50,,1,5,712,TPESampler,COMPLETE
3916,0.6769403466644707,2025-04-24 22:09:19.353215,2025-04-24 22:09:23.711798,0 days 00:00:04.358583,False,absolute_error,20,log2,1,2,495,TPESampler,COMPLETE
3917,0.4299136653041461,2025-04-24 22:09:20.771638,2025-04-24 22:09:22.842205,0 days 00:00:02.070567,True,squared_error,50,,2,2,343,TPESampler,COMPLETE
3918,0.34426650257456415,2025-04-24 22:09:21.388199,2025-04-24 22:09:23.995153,0 days 00:00:02.606954,True,squared_error,50,,1,2,389,TPESampler,COMPLETE
3919,0.393792281815717,2025-04-24 22:09:22.705152,2025-04-24 22:09:47.434418,0 days 00:00:24.729266,True,absolute_error,45,,1,10,427,TPESampler,COMPLETE
3920,0.42805005991589634,2025-04-24 22:09:23.210003,2025-04-24 22:09:26.601206,0 days 00:00:03.391203,True,squared_error,43,,2,4,489,TPESampler,COMPLETE
3921,0.3424876544867067,2025-04-24 22:09:23.408791,2025-04-24 22:09:27.696332,0 days 00:00:04.287541,True,squared_error,42,,1,3,617,TPESampler,COMPLETE
3922,0.3416797608325408,2025-04-24 22:09:23.960215,2025-04-24 22:09:27.670890,0 days 00:00:03.710675,True,squared_error,43,,1,3,582,TPESampler,COMPLETE
3923,0.6494233637979285,2025-04-24 22:09:24.334459,2025-04-24 22:09:29.198278,0 days 00:00:04.863819,True,absolute_error,25,log2,1,15,833,TPESampler,COMPLETE
3924,0.3614467405734948,2025-04-24 22:09:26.829834,2025-04-24 22:09:30.308556,0 days 00:00:03.478722,True,squared_error,50,,1,6,628,TPESampler,COMPLETE
3925,0.3442365925340804,2025-04-24 22:09:27.910173,2025-04-24 22:09:32.085119,0 days 00:00:04.174946,True,squared_error,50,,1,2,509,TPESampler,COMPLETE
3926,0.44423067615729234,2025-04-24 22:09:27.977730,2025-04-24 22:09:44.689810,0 days 00:00:16.712080,True,absolute_error,41,,2,2,561,TPESampler,COMPLETE
3927,0.42718837335878745,2025-04-24 22:09:29.435010,2025-04-24 22:09:32.458169,0 days 00:00:03.023159,True,squared_error,50,,2,3,525,TPESampler,COMPLETE
3928,0.42167157888129164,2025-04-24 22:09:30.497182,2025-04-24 22:09:35.279462,0 days 00:00:04.782280,False,squared_error,38,,1,6,648,TPESampler,COMPLETE
3929,0.354156000132969,2025-04-24 22:09:30.629588,2025-04-24 22:09:33.362821,0 days 00:00:02.733233,True,squared_error,50,,1,5,499,TPESampler,COMPLETE
3930,0.395044515856456,2025-04-24 22:09:32.324426,2025-04-24 22:09:34.421449,0 days 00:00:02.097023,True,squared_error,44,sqrt,1,5,498,TPESampler,COMPLETE
3931,0.3436240550828549,2025-04-24 22:09:32.859171,2025-04-24 22:09:37.490345,0 days 00:00:04.631174,True,squared_error,44,,1,3,665,TPESampler,COMPLETE
3932,0.8824669900656852,2025-04-24 22:09:33.591936,2025-04-24 22:09:34.939898,0 days 00:00:01.347962,False,squared_error,24,log2,3,4,686,TPESampler,COMPLETE
3933,0.49216778554617174,2025-04-24 22:09:34.658215,2025-04-24 22:09:37.290681,0 days 00:00:02.632466,False,squared_error,42,,5,2,424,TPESampler,COMPLETE
3934,0.34223458311337646,2025-04-24 22:09:35.187723,2025-04-24 22:09:38.673932,0 days 00:00:03.486209,True,squared_error,43,,1,3,648,TPESampler,COMPLETE
3935,0.3793814584754512,2025-04-24 22:09:35.571484,2025-04-24 22:09:42.091907,0 days 00:00:06.520423,True,absolute_error,50,sqrt,1,4,572,TPESampler,COMPLETE
3936,0.343407185267286,2025-04-24 22:09:37.498628,2025-04-24 22:09:41.417071,0 days 00:00:03.918443,True,squared_error,50,,1,2,613,TPESampler,COMPLETE
3937,0.34732493035923184,2025-04-24 22:09:37.801622,2025-04-24 22:10:15.276114,0 days 00:00:37.474492,True,absolute_error,50,,1,2,650,TPESampler,COMPLETE
3938,0.34663164388780415,2025-04-24 22:09:39.010149,2025-04-24 22:09:42.166056,0 days 00:00:03.155907,True,squared_error,50,,1,4,556,TPESampler,COMPLETE
3939,0.4280988139341179,2025-04-24 22:09:41.667347,2025-04-24 22:09:44.725508,0 days 00:00:03.058161,True,squared_error,42,,2,4,581,TPESampler,COMPLETE
3940,0.34786398822315145,2025-04-24 22:09:42.369585,2025-04-24 22:09:44.595002,0 days 00:00:02.225417,True,squared_error,40,,1,4,266,TPESampler,COMPLETE
3941,0.3426959900378399,2025-04-24 22:09:42.599687,2025-04-24 22:09:45.396574,0 days 00:00:02.796887,True,squared_error,44,,1,3,437,TPESampler,COMPLETE
3942,0.35277656151682574,2025-04-24 22:09:44.825006,2025-04-24 22:09:48.614724,0 days 00:00:03.789718,True,squared_error,50,,1,5,568,TPESampler,COMPLETE
3943,0.9514152627423786,2025-04-24 22:09:45.002373,2025-04-24 22:09:47.265099,0 days 00:00:02.262726,False,absolute_error,48,sqrt,12,42,848,TPESampler,COMPLETE
3944,0.6031111086125007,2025-04-24 22:09:45.020049,2025-04-24 22:09:49.553588,0 days 00:00:04.533539,True,absolute_error,15,,10,24,589,TPESampler,COMPLETE
3945,0.3432520759519531,2025-04-24 22:09:45.726017,2025-04-24 22:09:51.085509,0 days 00:00:05.359492,True,squared_error,50,,1,3,729,TPESampler,COMPLETE
3946,0.3477728049183994,2025-04-24 22:09:47.500681,2025-04-24 22:09:51.571645,0 days 00:00:04.070964,True,squared_error,42,,1,4,687,TPESampler,COMPLETE
3947,0.43524386476850435,2025-04-24 22:09:47.812630,2025-04-24 22:09:51.647827,0 days 00:00:03.835197,True,squared_error,50,,2,6,782,TPESampler,COMPLETE
3948,0.3446905344943547,2025-04-24 22:09:48.933670,2025-04-24 22:09:53.113184,0 days 00:00:04.179514,True,squared_error,43,,1,2,673,TPESampler,COMPLETE
3949,0.3436214901613054,2025-04-24 22:09:49.971248,2025-04-24 22:09:53.228850,0 days 00:00:03.257602,True,squared_error,50,,1,2,562,TPESampler,COMPLETE
3950,0.4464860690452987,2025-04-24 22:09:51.355388,2025-04-24 22:09:54.246181,0 days 00:00:02.890793,False,squared_error,48,log2,1,4,705,TPESampler,COMPLETE
3951,0.9646808376559638,2025-04-24 22:09:51.956107,2025-04-24 22:09:54.623771,0 days 00:00:02.667664,True,absolute_error,12,sqrt,13,4,508,TPESampler,COMPLETE
3952,0.9743528287619002,2025-04-24 22:09:52.004149,2025-04-24 22:09:54.031236,0 days 00:00:02.027087,True,absolute_error,31,log2,4,2,170,TPESampler,COMPLETE
3953,0.6467865830154508,2025-04-24 22:09:53.566983,2025-04-24 22:09:55.880454,0 days 00:00:02.313471,False,squared_error,22,log2,1,16,744,TPESampler,COMPLETE
3954,0.3410926111195977,2025-04-24 22:09:53.387149,2025-04-24 22:09:57.937956,0 days 00:00:04.550807,True,squared_error,50,,1,3,548,TPESampler,COMPLETE
3955,0.341514658672451,2025-04-24 22:09:54.348982,2025-04-24 22:09:58.238979,0 days 00:00:03.889997,True,squared_error,50,,1,3,518,TPESampler,COMPLETE
3956,0.34336184963381583,2025-04-24 22:09:54.715602,2025-04-24 22:09:59.157525,0 days 00:00:04.441923,True,squared_error,43,,1,2,559,TPESampler,COMPLETE
