number,value,datetime_start,datetime_complete,duration,params_bootstrap,params_criterion,params_max_depth,params_max_features,params_min_samples_leaf,params_min_samples_split,params_n_estimators,system_attrs_auto:sampler,state
1697,0.35322012493129584,2025-04-24 21:38:50.803006,2025-04-24 21:38:53.176771,0 days 00:00:02.373765,True,squared_error,50,,1,5,431,TPESampler,COMPLETE
1698,0.42886497440525295,2025-04-24 21:38:51.727654,2025-04-24 21:38:54.556784,0 days 00:00:02.829130,True,squared_error,50,,2,4,471,TPESampler,COMPLETE
1699,0.4296233585989749,2025-04-24 21:38:51.787626,2025-04-24 21:38:54.560524,0 days 00:00:02.772898,True,squared_error,50,,2,3,425,TPESampler,COMPLETE
1700,0.3412460197915948,2025-04-24 21:38:53.220052,2025-04-24 21:38:56.960290,0 days 00:00:03.740238,True,squared_error,50,,1,3,549,TPESampler,COMPLETE
1701,0.34228025217899366,2025-04-24 21:38:53.385136,2025-04-24 21:38:56.794599,0 days 00:00:03.409463,True,squared_error,50,,1,3,682,TPESampler,COMPLETE
1702,0.3535338574056885,2025-04-24 21:38:54.707262,2025-04-24 21:38:58.646607,0 days 00:00:03.939345,True,squared_error,45,,1,5,613,TPESampler,COMPLETE
1703,0.8861119777180093,2025-04-24 21:38:54.766334,2025-04-24 21:38:56.190435,0 days 00:00:01.424101,False,absolute_error,39,log2,2,29,179,TPESampler,COMPLETE
1704,0.42733444025313144,2025-04-24 21:38:56.398406,2025-04-24 21:38:59.962536,0 days 00:00:03.564130,True,squared_error,50,,2,3,661,TPESampler,COMPLETE
1705,0.429504770271175,2025-04-24 21:38:57.080070,2025-04-24 21:38:58.896575,0 days 00:00:01.816505,True,squared_error,43,,2,2,360,TPESampler,COMPLETE
1706,0.35221667531783873,2025-04-24 21:38:57.341548,2025-04-24 21:39:01.250111,0 days 00:00:03.908563,True,squared_error,50,,1,5,596,TPESampler,COMPLETE
1707,0.34387394975229196,2025-04-24 21:38:58.852868,2025-04-24 21:39:03.033266,0 days 00:00:04.180398,True,squared_error,50,,1,2,627,TPESampler,COMPLETE
1708,0.4283830769470514,2025-04-24 21:38:59.093445,2025-04-24 21:39:01.704070,0 days 00:00:02.610625,True,squared_error,42,,2,2,623,TPESampler,COMPLETE
1709,0.3408494723725512,2025-04-24 21:39:00.156805,2025-04-24 21:39:03.060397,0 days 00:00:02.903592,True,squared_error,50,,1,3,450,TPESampler,COMPLETE
1710,0.3411100900454232,2025-04-24 21:39:01.447696,2025-04-24 21:39:05.157667,0 days 00:00:03.709971,True,squared_error,50,,1,3,584,TPESampler,COMPLETE
1711,0.4254775864397109,2025-04-24 21:39:01.903986,2025-04-24 21:39:05.821153,0 days 00:00:03.917167,True,squared_error,50,,2,2,808,TPESampler,COMPLETE
1712,0.7874873285919884,2025-04-24 21:39:02.427154,2025-04-24 21:39:04.333545,0 days 00:00:01.906391,True,squared_error,5,sqrt,1,15,729,TPESampler,COMPLETE
1713,0.4313763713053381,2025-04-24 21:39:03.282196,2025-04-24 21:39:05.233906,0 days 00:00:01.951710,True,squared_error,50,,2,5,307,TPESampler,COMPLETE
1714,0.34284695103241947,2025-04-24 21:39:03.342969,2025-04-24 21:39:07.146692,0 days 00:00:03.803723,True,squared_error,43,,1,2,452,TPESampler,COMPLETE
1715,0.3442648137777511,2025-04-24 21:39:04.531854,2025-04-24 21:39:06.683328,0 days 00:00:02.151474,True,squared_error,44,,1,3,338,TPESampler,COMPLETE
1716,0.34340182557531534,2025-04-24 21:39:05.318545,2025-04-24 21:39:08.594713,0 days 00:00:03.276168,True,squared_error,44,,1,3,391,TPESampler,COMPLETE
1717,0.9073620598863421,2025-04-24 21:39:05.448726,2025-04-24 21:39:07.962416,0 days 00:00:02.513690,True,squared_error,7,log2,3,9,899,TPESampler,COMPLETE
1718,0.3412350375868749,2025-04-24 21:39:06.110525,2025-04-24 21:39:08.752273,0 days 00:00:02.641748,True,squared_error,47,,1,3,382,TPESampler,COMPLETE
1719,0.3428689402402639,2025-04-24 21:39:06.886552,2025-04-24 21:39:09.794206,0 days 00:00:02.907654,True,squared_error,50,,1,2,420,TPESampler,COMPLETE
1720,0.34509348468041456,2025-04-24 21:39:07.399317,2025-04-24 21:39:11.502664,0 days 00:00:04.103347,True,squared_error,32,,1,2,593,TPESampler,COMPLETE
1721,0.36147721019035484,2025-04-24 21:39:08.217726,2025-04-24 21:39:10.698946,0 days 00:00:02.481220,True,squared_error,50,,1,6,360,TPESampler,COMPLETE
1722,0.4293248345523484,2025-04-24 21:39:08.833770,2025-04-24 21:39:11.033263,0 days 00:00:02.199493,True,squared_error,40,,2,3,412,TPESampler,COMPLETE
1723,0.8976580168845383,2025-04-24 21:39:09.140181,2025-04-24 21:39:10.363328,0 days 00:00:01.223147,True,squared_error,8,sqrt,7,48,354,TPESampler,COMPLETE
1724,0.8386395707098393,2025-04-24 21:39:10.181297,2025-04-24 21:39:11.479670,0 days 00:00:01.298373,False,squared_error,34,log2,2,7,229,TPESampler,COMPLETE
1725,0.34646970554842776,2025-04-24 21:39:10.749519,2025-04-24 21:39:13.770995,0 days 00:00:03.021476,True,squared_error,50,,1,4,428,TPESampler,COMPLETE
1726,0.34291633395105675,2025-04-24 21:39:10.929624,2025-04-24 21:39:13.650733,0 days 00:00:02.721109,True,squared_error,48,,1,3,262,TPESampler,COMPLETE
1727,0.3439935872626371,2025-04-24 21:39:11.342153,2025-04-24 21:39:14.720990,0 days 00:00:03.378837,True,squared_error,50,,1,2,395,TPESampler,COMPLETE
1728,0.6780511988423564,2025-04-24 21:39:11.876853,2025-04-24 21:39:13.949995,0 days 00:00:02.073142,False,absolute_error,32,sqrt,3,2,287,TPESampler,COMPLETE
1729,0.7714261701156974,2025-04-24 21:39:11.998741,2025-04-24 21:39:13.662602,0 days 00:00:01.663861,True,squared_error,37,sqrt,3,25,591,TPESampler,COMPLETE
1730,0.43091618831872935,2025-04-24 21:39:13.810293,2025-04-24 21:39:19.513084,0 days 00:00:05.702791,False,squared_error,50,,1,2,608,TPESampler,COMPLETE
1731,0.478732837949843,2025-04-24 21:39:13.868449,2025-04-24 21:39:17.083781,0 days 00:00:03.215332,False,squared_error,39,,6,44,697,TPESampler,COMPLETE
1732,0.9860487895685928,2025-04-24 21:39:13.959881,2025-04-24 21:39:15.154259,0 days 00:00:01.194378,True,absolute_error,18,log2,7,2,121,TPESampler,COMPLETE
1733,0.4295852587607377,2025-04-24 21:39:14.296758,2025-04-24 21:39:17.197154,0 days 00:00:02.900396,True,squared_error,50,,2,4,420,TPESampler,COMPLETE
1734,0.34733344533981314,2025-04-24 21:39:15.135203,2025-04-24 21:39:17.996799,0 days 00:00:02.861596,True,squared_error,45,,1,4,436,TPESampler,COMPLETE
1735,0.3718442730444791,2025-04-24 21:39:15.381471,2025-04-24 21:39:17.393788,0 days 00:00:02.012317,True,squared_error,49,sqrt,1,3,644,TPESampler,COMPLETE
1736,0.9397515152176118,2025-04-24 21:39:17.328091,2025-04-24 21:39:19.032953,0 days 00:00:01.704862,True,squared_error,41,log2,15,42,515,TPESampler,COMPLETE
1737,0.34289095204552716,2025-04-24 21:39:17.410235,2025-04-24 21:39:20.497485,0 days 00:00:03.087250,True,squared_error,44,,1,3,434,TPESampler,COMPLETE
1738,0.7815183078685451,2025-04-24 21:39:17.624340,2025-04-24 21:39:19.955824,0 days 00:00:02.331484,False,squared_error,10,log2,1,7,572,TPESampler,COMPLETE
1739,0.3474637576760957,2025-04-24 21:39:18.447835,2025-04-24 21:39:38.539773,0 days 00:00:20.091938,True,absolute_error,43,,1,3,347,TPESampler,COMPLETE
1740,0.3435869619781868,2025-04-24 21:39:19.118496,2025-04-24 21:39:23.306115,0 days 00:00:04.187619,True,squared_error,43,,1,2,486,TPESampler,COMPLETE
1741,0.39110534883184356,2025-04-24 21:39:19.648962,2025-04-24 21:39:26.481134,0 days 00:00:06.832172,True,absolute_error,50,sqrt,1,5,698,TPESampler,COMPLETE
1742,0.34795514440059794,2025-04-24 21:39:19.848067,2025-04-24 21:39:23.051254,0 days 00:00:03.203187,True,squared_error,41,,1,4,500,TPESampler,COMPLETE
1743,0.8228038913099042,2025-04-24 21:39:20.372069,2025-04-24 21:39:22.260157,0 days 00:00:01.888088,False,squared_error,23,sqrt,6,4,690,TPESampler,COMPLETE
1744,0.35373873459656974,2025-04-24 21:39:21.004673,2025-04-24 21:39:24.542078,0 days 00:00:03.537405,True,squared_error,50,,1,5,482,TPESampler,COMPLETE
1745,0.42874403768935,2025-04-24 21:39:22.464950,2025-04-24 21:39:25.569097,0 days 00:00:03.104147,True,squared_error,50,,2,2,568,TPESampler,COMPLETE
1746,0.34166221123331025,2025-04-24 21:39:23.260234,2025-04-24 21:39:25.402256,0 days 00:00:02.142022,True,squared_error,50,,1,3,349,TPESampler,COMPLETE
1747,0.342867223516309,2025-04-24 21:39:23.523870,2025-04-24 21:39:26.882014,0 days 00:00:03.358144,True,squared_error,43,,1,3,514,TPESampler,COMPLETE
1748,0.3419455221563197,2025-04-24 21:39:24.743538,2025-04-24 21:39:27.503142,0 days 00:00:02.759604,True,squared_error,49,,1,3,398,TPESampler,COMPLETE
1749,0.9719503126730912,2025-04-24 21:39:25.609957,2025-04-24 21:39:26.394603,0 days 00:00:00.784646,False,absolute_error,43,log2,9,10,110,TPESampler,COMPLETE
1750,0.3552381526175432,2025-04-24 21:39:25.788892,2025-04-24 21:39:28.920240,0 days 00:00:03.131348,True,squared_error,42,,1,5,500,TPESampler,COMPLETE
1751,0.3419256894131187,2025-04-24 21:39:26.600493,2025-04-24 21:39:29.912124,0 days 00:00:03.311631,True,squared_error,50,,1,3,563,TPESampler,COMPLETE
1752,0.353096174620431,2025-04-24 21:39:26.730931,2025-04-24 21:39:29.595379,0 days 00:00:02.864448,True,squared_error,49,,1,5,441,TPESampler,COMPLETE
1753,0.3535545942267922,2025-04-24 21:39:27.089946,2025-04-24 21:39:30.116174,0 days 00:00:03.026228,True,squared_error,43,,1,5,443,TPESampler,COMPLETE
1754,0.34860476724873646,2025-04-24 21:39:27.792583,2025-04-24 21:39:29.946660,0 days 00:00:02.154077,True,squared_error,45,,1,2,234,TPESampler,COMPLETE
1755,0.4309528932113512,2025-04-24 21:39:29.129008,2025-04-24 21:39:31.749648,0 days 00:00:02.620640,False,squared_error,45,,1,2,271,TPESampler,COMPLETE
1756,0.34144956700003054,2025-04-24 21:39:29.852792,2025-04-24 21:39:32.836266,0 days 00:00:02.983474,True,squared_error,50,,1,3,432,TPESampler,COMPLETE
1757,0.42828215666052794,2025-04-24 21:39:30.164284,2025-04-24 21:39:33.166165,0 days 00:00:03.001881,True,squared_error,44,,2,3,492,TPESampler,COMPLETE
1758,0.37045769791655236,2025-04-24 21:39:30.175170,2025-04-24 21:39:32.163700,0 days 00:00:01.988530,True,squared_error,50,sqrt,1,3,515,TPESampler,COMPLETE
1759,0.34093872116666835,2025-04-24 21:39:30.364721,2025-04-24 21:39:34.274105,0 days 00:00:03.909384,True,squared_error,50,,1,3,531,TPESampler,COMPLETE
1760,0.6459466228429113,2025-04-24 21:39:31.942718,2025-04-24 21:39:33.549185,0 days 00:00:01.606467,True,squared_error,44,sqrt,2,4,571,TPESampler,COMPLETE
1761,0.42717722817950904,2025-04-24 21:39:32.352085,2025-04-24 21:39:35.007448,0 days 00:00:02.655363,True,squared_error,44,,2,3,540,TPESampler,COMPLETE
1762,0.3430969295795814,2025-04-24 21:39:33.062989,2025-04-24 21:39:35.040540,0 days 00:00:01.977551,True,squared_error,50,,1,3,279,TPESampler,COMPLETE
1763,0.3424522420314917,2025-04-24 21:39:33.391094,2025-04-24 21:39:36.702929,0 days 00:00:03.311835,True,squared_error,50,,1,3,499,TPESampler,COMPLETE
1764,0.3412889358156966,2025-04-24 21:39:33.917784,2025-04-24 21:39:37.758302,0 days 00:00:03.840518,True,squared_error,43,,1,3,590,TPESampler,COMPLETE
1765,0.4281608344538068,2025-04-24 21:39:34.521393,2025-04-24 21:39:37.221606,0 days 00:00:02.700213,True,squared_error,43,,2,4,500,TPESampler,COMPLETE
1766,0.3440695438842916,2025-04-24 21:39:35.208159,2025-04-24 21:39:38.569115,0 days 00:00:03.360956,True,squared_error,42,,1,2,459,TPESampler,COMPLETE
1767,0.43156847644448537,2025-04-24 21:39:35.291015,2025-04-24 21:39:37.804756,0 days 00:00:02.513741,True,squared_error,50,,2,5,478,TPESampler,COMPLETE
1768,0.42671123905120306,2025-04-24 21:39:36.903804,2025-04-24 21:39:40.637882,0 days 00:00:03.734078,True,squared_error,42,,2,3,776,TPESampler,COMPLETE
1769,0.3519740231340922,2025-04-24 21:39:37.422175,2025-04-24 21:39:40.706089,0 days 00:00:03.283914,True,squared_error,50,,1,5,547,TPESampler,COMPLETE
1770,0.34371078784013626,2025-04-24 21:39:38.003245,2025-04-24 21:39:40.782885,0 days 00:00:02.779640,True,squared_error,50,,1,2,382,TPESampler,COMPLETE
1771,0.3469413676758314,2025-04-24 21:39:38.027694,2025-04-24 21:39:41.881174,0 days 00:00:03.853480,True,squared_error,50,,1,4,518,TPESampler,COMPLETE
1772,0.42681539249709155,2025-04-24 21:39:38.847391,2025-04-24 21:39:41.129349,0 days 00:00:02.281958,True,squared_error,50,,2,2,289,TPESampler,COMPLETE
1773,0.341514658672451,2025-04-24 21:39:38.908111,2025-04-24 21:39:42.698585,0 days 00:00:03.790474,True,squared_error,50,,1,3,518,TPESampler,COMPLETE
1774,0.3431651830632041,2025-04-24 21:39:40.846974,2025-04-24 21:39:45.242399,0 days 00:00:04.395425,True,squared_error,50,,1,2,536,TPESampler,COMPLETE
1775,0.34714471001095304,2025-04-24 21:39:40.898658,2025-04-24 21:39:44.338024,0 days 00:00:03.439366,True,squared_error,43,,1,4,466,TPESampler,COMPLETE
1776,0.34144956700003054,2025-04-24 21:39:41.000402,2025-04-24 21:39:44.669404,0 days 00:00:03.669002,True,squared_error,50,,1,3,432,TPESampler,COMPLETE
1777,0.34267566575238845,2025-04-24 21:39:41.344097,2025-04-24 21:39:45.347533,0 days 00:00:04.003436,True,squared_error,44,,1,3,549,TPESampler,COMPLETE
1778,0.44781165794571964,2025-04-24 21:39:42.210135,2025-04-24 21:39:45.753332,0 days 00:00:03.543197,False,squared_error,50,,2,5,575,TPESampler,COMPLETE
1779,0.34285806057690243,2025-04-24 21:39:42.996105,2025-04-24 21:39:46.566335,0 days 00:00:03.570230,True,squared_error,43,,1,2,548,TPESampler,COMPLETE
1780,0.9295545737529823,2025-04-24 21:39:44.541226,2025-04-24 21:39:46.592823,0 days 00:00:02.051597,True,absolute_error,12,sqrt,6,8,585,TPESampler,COMPLETE
1781,0.34102657563929745,2025-04-24 21:39:44.911145,2025-04-24 21:39:49.128639,0 days 00:00:04.217494,True,squared_error,50,,1,3,609,TPESampler,COMPLETE
1782,0.34706022011525756,2025-04-24 21:39:45.563012,2025-04-24 21:39:49.593658,0 days 00:00:04.030646,True,squared_error,44,,1,4,651,TPESampler,COMPLETE
1783,0.6619009963489232,2025-04-24 21:39:45.588322,2025-04-24 21:39:54.255437,0 days 00:00:08.667115,False,absolute_error,5,,11,19,960,TPESampler,COMPLETE
1784,0.42816381910584783,2025-04-24 21:39:46.097690,2025-04-24 21:39:49.295348,0 days 00:00:03.197658,True,squared_error,50,,2,2,559,TPESampler,COMPLETE
1785,0.34410659805784893,2025-04-24 21:39:46.876726,2025-04-24 21:39:51.588618,0 days 00:00:04.711892,True,squared_error,50,,1,2,663,TPESampler,COMPLETE
1786,0.34792738158330383,2025-04-24 21:39:47.102502,2025-04-24 21:39:50.969445,0 days 00:00:03.866943,True,squared_error,50,,1,4,730,TPESampler,COMPLETE
1787,0.42955553382105544,2025-04-24 21:39:49.327477,2025-04-24 21:39:51.741738,0 days 00:00:02.414261,True,squared_error,50,,2,2,413,TPESampler,COMPLETE
1788,0.8796926974060505,2025-04-24 21:39:49.518398,2025-04-24 21:39:51.131722,0 days 00:00:01.613324,True,squared_error,45,log2,2,6,487,TPESampler,COMPLETE
1789,0.34576067440614905,2025-04-24 21:39:49.897882,2025-04-24 21:40:14.710735,0 days 00:00:24.812853,True,absolute_error,49,,1,3,441,TPESampler,COMPLETE
1790,0.3418251632682217,2025-04-24 21:39:51.195933,2025-04-24 21:39:55.028634,0 days 00:00:03.832701,True,squared_error,43,,1,3,611,TPESampler,COMPLETE
1791,0.9613593253671128,2025-04-24 21:39:51.360926,2025-04-24 21:39:53.760620,0 days 00:00:02.399694,True,absolute_error,49,sqrt,11,5,875,TPESampler,COMPLETE
1792,0.3425074160548389,2025-04-24 21:39:52.192481,2025-04-24 21:39:56.517943,0 days 00:00:04.325462,True,squared_error,50,,1,3,701,TPESampler,COMPLETE
1793,0.38443308386847264,2025-04-24 21:39:52.349048,2025-04-24 21:39:56.084759,0 days 00:00:03.735711,True,squared_error,50,,1,9,681,TPESampler,COMPLETE
1794,0.4295139854008967,2025-04-24 21:39:53.956005,2025-04-24 21:39:57.442230,0 days 00:00:03.486225,True,squared_error,41,,2,5,787,TPESampler,COMPLETE
1795,0.7189660103907523,2025-04-24 21:39:54.493589,2025-04-24 21:39:59.617015,0 days 00:00:05.123426,True,absolute_error,8,sqrt,1,3,975,TPESampler,COMPLETE
1796,0.3459852302865421,2025-04-24 21:39:55.492856,2025-04-24 21:39:58.282592,0 days 00:00:02.789736,True,squared_error,50,,1,4,451,TPESampler,COMPLETE
1797,0.5280301945510599,2025-04-24 21:39:56.296629,2025-04-24 21:40:01.190228,0 days 00:00:04.893599,False,squared_error,48,,1,22,919,TPESampler,COMPLETE
1798,0.34122168590553703,2025-04-24 21:39:56.716092,2025-04-24 21:40:00.150283,0 days 00:00:03.434191,True,squared_error,50,,1,3,525,TPESampler,COMPLETE
1799,0.4313159192124146,2025-04-24 21:39:57.631266,2025-04-24 21:40:00.109967,0 days 00:00:02.478701,True,squared_error,45,,2,5,640,TPESampler,COMPLETE
1800,0.3418598638856337,2025-04-24 21:39:58.481265,2025-04-24 21:40:02.272460,0 days 00:00:03.791195,True,squared_error,42,,1,3,599,TPESampler,COMPLETE
1801,0.34663614716098745,2025-04-24 21:39:59.811008,2025-04-24 21:40:03.601616,0 days 00:00:03.790608,True,squared_error,50,,1,4,625,TPESampler,COMPLETE
1802,0.42793537845299157,2025-04-24 21:40:00.377051,2025-04-24 21:40:03.469578,0 days 00:00:03.092527,True,squared_error,50,,2,4,488,TPESampler,COMPLETE
1803,0.9652166747410329,2025-04-24 21:40:00.425621,2025-04-24 21:40:01.855079,0 days 00:00:01.429458,True,absolute_error,31,sqrt,12,7,444,TPESampler,COMPLETE
1804,0.8537541819134675,2025-04-24 21:40:01.502652,2025-04-24 21:40:04.065848,0 days 00:00:02.563196,True,absolute_error,9,log2,1,45,599,TPESampler,COMPLETE
1805,0.3421247914974893,2025-04-24 21:40:02.068801,2025-04-24 21:40:04.506926,0 days 00:00:02.438125,True,squared_error,50,,1,3,338,TPESampler,COMPLETE
1806,0.3447245887857217,2025-04-24 21:40:02.536587,2025-04-24 21:40:05.583869,0 days 00:00:03.047282,True,squared_error,41,,1,2,412,TPESampler,COMPLETE
1807,0.3419055852338512,2025-04-24 21:40:03.667299,2025-04-24 21:40:07.594651,0 days 00:00:03.927352,True,squared_error,50,,1,3,484,TPESampler,COMPLETE
1808,0.474779570720014,2025-04-24 21:40:03.805773,2025-04-24 21:40:05.741584,0 days 00:00:01.935811,True,squared_error,41,log2,1,2,339,TPESampler,COMPLETE
1809,0.4484879688437178,2025-04-24 21:40:04.466859,2025-04-24 21:40:07.352016,0 days 00:00:02.885157,False,squared_error,49,,2,3,427,TPESampler,COMPLETE
1810,0.440021078681886,2025-04-24 21:40:04.897075,2025-04-24 21:40:06.573465,0 days 00:00:01.676390,True,squared_error,47,log2,1,3,531,TPESampler,COMPLETE
1811,0.4275435566108375,2025-04-24 21:40:05.803422,2025-04-24 21:40:08.491241,0 days 00:00:02.687819,True,squared_error,50,,2,3,512,TPESampler,COMPLETE
1812,0.3550795246708395,2025-04-24 21:40:05.997241,2025-04-24 21:40:08.287435,0 days 00:00:02.290194,True,squared_error,44,,1,5,264,TPESampler,COMPLETE
1813,0.3467743719027042,2025-04-24 21:40:06.827043,2025-04-24 21:40:09.450180,0 days 00:00:02.623137,True,squared_error,50,,1,4,396,TPESampler,COMPLETE
1814,0.4314938718935758,2025-04-24 21:40:07.678829,2025-04-24 21:40:10.655796,0 days 00:00:02.976967,True,squared_error,49,,2,5,639,TPESampler,COMPLETE
1815,0.34375846975454677,2025-04-24 21:40:07.827964,2025-04-24 21:40:11.739860,0 days 00:00:03.911896,True,squared_error,44,,1,2,523,TPESampler,COMPLETE
1816,0.3614900882018564,2025-04-24 21:40:08.519426,2025-04-24 21:40:11.407863,0 days 00:00:02.888437,True,squared_error,40,,1,6,429,TPESampler,COMPLETE
1817,0.34724382265457815,2025-04-24 21:40:08.908885,2025-04-24 21:40:13.025547,0 days 00:00:04.116662,True,squared_error,42,,1,4,568,TPESampler,COMPLETE
1818,0.4346225109777219,2025-04-24 21:40:09.645847,2025-04-24 21:40:10.901339,0 days 00:00:01.255492,True,squared_error,40,,2,4,147,TPESampler,COMPLETE
1819,0.341576682607628,2025-04-24 21:40:10.844694,2025-04-24 21:40:13.324142,0 days 00:00:02.479448,True,squared_error,50,,1,3,406,TPESampler,COMPLETE
1820,0.34813677860057907,2025-04-24 21:40:11.165137,2025-04-24 21:40:44.332218,0 days 00:00:33.167081,True,absolute_error,43,,1,2,609,TPESampler,COMPLETE
1821,0.4300096472678428,2025-04-24 21:40:11.593351,2025-04-24 21:40:14.224049,0 days 00:00:02.630698,True,squared_error,42,,2,3,326,TPESampler,COMPLETE
1822,0.3443927024514373,2025-04-24 21:40:12.052943,2025-04-24 21:40:15.687444,0 days 00:00:03.634501,True,squared_error,50,,1,2,493,TPESampler,COMPLETE
1823,0.3442555236336917,2025-04-24 21:40:13.227628,2025-04-24 21:40:17.562273,0 days 00:00:04.334645,True,squared_error,50,,1,2,666,TPESampler,COMPLETE
1824,0.3448315650263775,2025-04-24 21:40:13.532057,2025-04-24 21:40:17.408816,0 days 00:00:03.876759,True,squared_error,41,,1,3,716,TPESampler,COMPLETE
1825,0.34738438380137693,2025-04-24 21:40:14.462696,2025-04-24 21:40:17.585529,0 days 00:00:03.122833,True,squared_error,50,,1,4,501,TPESampler,COMPLETE
1826,0.3420610331005728,2025-04-24 21:40:14.925523,2025-04-24 21:40:18.517751,0 days 00:00:03.592228,True,squared_error,50,,1,3,650,TPESampler,COMPLETE
1827,0.3919418713721597,2025-04-24 21:40:15.885997,2025-04-24 21:40:18.572862,0 days 00:00:02.686865,True,squared_error,43,,1,10,541,TPESampler,COMPLETE
1828,0.8667483335593996,2025-04-24 21:40:17.626010,2025-04-24 21:40:18.675694,0 days 00:00:01.049684,True,squared_error,50,sqrt,4,12,118,TPESampler,COMPLETE
1829,0.604606585651128,2025-04-24 21:40:17.749007,2025-04-24 21:40:21.160731,0 days 00:00:03.411724,True,absolute_error,36,log2,1,43,318,TPESampler,COMPLETE
1830,0.34996537803193617,2025-04-24 21:40:17.803946,2025-04-24 21:40:53.917090,0 days 00:00:36.113144,True,absolute_error,50,,1,4,634,TPESampler,COMPLETE
1831,0.3535445851368331,2025-04-24 21:40:18.744438,2025-04-24 21:40:22.184105,0 days 00:00:03.439667,True,squared_error,50,,1,5,467,TPESampler,COMPLETE
1832,0.4368297552691006,2025-04-24 21:40:19.014565,2025-04-24 21:40:22.405133,0 days 00:00:03.390568,True,squared_error,50,,2,6,625,TPESampler,COMPLETE
1833,0.3679635965869455,2025-04-24 21:40:19.027939,2025-04-24 21:40:22.853121,0 days 00:00:03.825182,True,squared_error,50,,1,7,601,TPESampler,COMPLETE
1834,0.3444631680550981,2025-04-24 21:40:21.347764,2025-04-24 21:40:24.925230,0 days 00:00:03.577466,True,squared_error,43,,1,2,640,TPESampler,COMPLETE
1835,0.42770250165484275,2025-04-24 21:40:22.377968,2025-04-24 21:40:25.205096,0 days 00:00:02.827128,True,squared_error,41,,2,2,590,TPESampler,COMPLETE
1836,0.3438994395476844,2025-04-24 21:40:22.608961,2025-04-24 21:40:24.779225,0 days 00:00:02.170264,True,squared_error,43,,1,2,306,TPESampler,COMPLETE
1837,0.4293973710682344,2025-04-24 21:40:23.258122,2025-04-24 21:40:25.259470,0 days 00:00:02.001348,True,squared_error,43,,2,4,416,TPESampler,COMPLETE
1838,0.34414613611493144,2025-04-24 21:40:24.953238,2025-04-24 21:40:28.156649,0 days 00:00:03.203411,True,squared_error,44,,1,2,519,TPESampler,COMPLETE
