number,value,datetime_start,datetime_complete,duration,params_bootstrap,params_criterion,params_max_depth,params_max_features,params_min_samples_leaf,params_min_samples_split,params_n_estimators,system_attrs_auto:sampler,state
3675,0.4274968825096976,2025-04-24 22:05:30.224816,2025-04-24 22:05:33.392828,0 days 00:00:03.168012,True,squared_error,43,,2,3,592,TPESampler,COMPLETE
3676,0.3470372435267919,2025-04-24 22:05:31.475238,2025-04-24 22:05:34.642637,0 days 00:00:03.167399,True,squared_error,43,,1,4,469,TPESampler,COMPLETE
3677,0.4285995084003172,2025-04-24 22:05:31.861607,2025-04-24 22:05:35.042055,0 days 00:00:03.180448,True,squared_error,50,,2,3,564,TPESampler,COMPLETE
3678,0.4320480033632864,2025-04-24 22:05:32.514692,2025-04-24 22:06:13.909729,0 days 00:00:41.395037,False,absolute_error,30,,2,6,864,TPESampler,COMPLETE
3679,0.3416779585956277,2025-04-24 22:05:33.341011,2025-04-24 22:05:36.721741,0 days 00:00:03.380730,True,squared_error,43,,1,3,444,TPESampler,COMPLETE
3680,0.3437948226105128,2025-04-24 22:05:33.957032,2025-04-24 22:05:37.576046,0 days 00:00:03.619014,True,squared_error,50,,1,2,467,TPESampler,COMPLETE
3681,0.7626426531202565,2025-04-24 22:05:34.780084,2025-04-24 22:05:37.852509,0 days 00:00:03.072425,False,absolute_error,18,sqrt,4,6,504,TPESampler,COMPLETE
3682,0.3467789267571793,2025-04-24 22:05:34.984555,2025-04-24 22:05:38.628561,0 days 00:00:03.644006,True,squared_error,50,,1,4,466,TPESampler,COMPLETE
3683,0.4289606370360733,2025-04-24 22:05:35.774652,2025-04-24 22:05:37.892661,0 days 00:00:02.118009,True,squared_error,50,log2,1,3,474,TPESampler,COMPLETE
3684,0.34583598494086587,2025-04-24 22:05:37.020200,2025-04-24 22:05:40.545434,0 days 00:00:03.525234,True,squared_error,50,,1,4,586,TPESampler,COMPLETE
3685,0.34638589660724745,2025-04-24 22:05:37.896135,2025-04-24 22:05:41.425045,0 days 00:00:03.528910,True,squared_error,43,,1,4,578,TPESampler,COMPLETE
3686,0.35715076066531304,2025-04-24 22:05:38.133824,2025-04-24 22:05:40.485399,0 days 00:00:02.351575,True,squared_error,29,,1,2,119,TPESampler,COMPLETE
3687,0.42896469238296314,2025-04-24 22:05:38.196169,2025-04-24 22:05:41.738955,0 days 00:00:03.542786,True,squared_error,50,,2,3,470,TPESampler,COMPLETE
3688,0.34373872923743826,2025-04-24 22:05:39.128422,2025-04-24 22:05:44.037867,0 days 00:00:04.909445,True,squared_error,42,,1,3,717,TPESampler,COMPLETE
3689,0.34087100346207855,2025-04-24 22:05:40.734318,2025-04-24 22:05:45.298570,0 days 00:00:04.564252,True,squared_error,50,,1,3,593,TPESampler,COMPLETE
3690,0.3435682580791099,2025-04-24 22:05:40.797133,2025-04-24 22:05:44.681389,0 days 00:00:03.884256,True,squared_error,50,,1,2,561,TPESampler,COMPLETE
3691,0.3423713971132128,2025-04-24 22:05:41.793861,2025-04-24 22:05:45.678618,0 days 00:00:03.884757,True,squared_error,50,,1,3,668,TPESampler,COMPLETE
3692,0.4304031131241358,2025-04-24 22:05:42.192408,2025-04-24 22:05:46.118837,0 days 00:00:03.926429,True,squared_error,44,,2,5,725,TPESampler,COMPLETE
3693,0.34282677130107864,2025-04-24 22:05:44.316857,2025-04-24 22:05:48.870894,0 days 00:00:04.554037,True,squared_error,50,,1,2,609,TPESampler,COMPLETE
3694,0.3784032054188938,2025-04-24 22:05:44.921829,2025-04-24 22:05:47.393692,0 days 00:00:02.471863,True,squared_error,43,sqrt,1,3,613,TPESampler,COMPLETE
3695,0.34380016014939974,2025-04-24 22:05:45.586126,2025-04-24 22:05:48.900349,0 days 00:00:03.314223,True,squared_error,35,,1,3,427,TPESampler,COMPLETE
3696,0.3467089812773165,2025-04-24 22:05:46.151767,2025-04-24 22:05:49.056728,0 days 00:00:02.904961,True,squared_error,50,,1,4,400,TPESampler,COMPLETE
3697,0.37015118411970827,2025-04-24 22:05:46.443668,2025-04-24 22:05:48.939474,0 days 00:00:02.495806,True,squared_error,50,sqrt,1,3,770,TPESampler,COMPLETE
3698,0.427916426549028,2025-04-24 22:05:47.612252,2025-04-24 22:05:52.141272,0 days 00:00:04.529020,False,squared_error,42,,1,3,665,TPESampler,COMPLETE
3699,0.42738460213288626,2025-04-24 22:05:49.069551,2025-04-24 22:05:53.636186,0 days 00:00:04.566635,True,squared_error,42,,2,3,674,TPESampler,COMPLETE
3700,0.34527053343649056,2025-04-24 22:05:49.188821,2025-04-24 22:05:53.305274,0 days 00:00:04.116453,True,squared_error,42,,1,2,403,TPESampler,COMPLETE
3701,0.5109413289207309,2025-04-24 22:05:49.315944,2025-04-24 22:05:52.234407,0 days 00:00:02.918463,False,squared_error,46,log2,1,39,801,TPESampler,COMPLETE
3702,0.34737174543421945,2025-04-24 22:05:49.341078,2025-04-24 22:05:53.606602,0 days 00:00:04.265524,True,squared_error,50,,1,4,674,TPESampler,COMPLETE
3703,0.4297163460044661,2025-04-24 22:05:52.395623,2025-04-24 22:05:54.955080,0 days 00:00:02.559457,True,squared_error,43,,2,2,444,TPESampler,COMPLETE
3704,0.3431347574865203,2025-04-24 22:05:52.526078,2025-04-24 22:05:57.423329,0 days 00:00:04.897251,True,squared_error,43,,1,2,599,TPESampler,COMPLETE
3705,0.9331569940323045,2025-04-24 22:05:53.754567,2025-04-24 22:05:55.579665,0 days 00:00:01.825098,False,squared_error,6,log2,15,4,440,TPESampler,COMPLETE
3706,0.34197537729846383,2025-04-24 22:05:53.938298,2025-04-24 22:05:58.136858,0 days 00:00:04.198560,True,squared_error,50,,1,3,630,TPESampler,COMPLETE
3707,0.4479345897659573,2025-04-24 22:05:53.950526,2025-04-24 22:05:57.511178,0 days 00:00:03.560652,True,squared_error,37,,2,9,603,TPESampler,COMPLETE
3708,0.9388330621535863,2025-04-24 22:05:55.248394,2025-04-24 22:05:56.229702,0 days 00:00:00.981308,True,squared_error,14,log2,7,7,150,TPESampler,COMPLETE
3709,0.4269950277131665,2025-04-24 22:05:55.847389,2025-04-24 22:05:59.199349,0 days 00:00:03.351960,True,squared_error,50,,2,2,518,TPESampler,COMPLETE
3710,0.36936230322976366,2025-04-24 22:05:56.460077,2025-04-24 22:05:58.809238,0 days 00:00:02.349161,True,squared_error,50,sqrt,1,2,667,TPESampler,COMPLETE
3711,0.44453171435489397,2025-04-24 22:05:57.641614,2025-04-24 22:06:01.431043,0 days 00:00:03.789429,True,squared_error,43,,2,8,663,TPESampler,COMPLETE
3712,0.3525456427564124,2025-04-24 22:05:57.816092,2025-04-24 22:06:01.692795,0 days 00:00:03.876703,True,squared_error,50,,1,5,530,TPESampler,COMPLETE
3713,0.34668110645191086,2025-04-24 22:05:58.397473,2025-04-24 22:06:02.217730,0 days 00:00:03.820257,True,squared_error,44,,1,4,624,TPESampler,COMPLETE
3714,0.3429262058052069,2025-04-24 22:05:59.205410,2025-04-24 22:06:02.303321,0 days 00:00:03.097911,True,squared_error,44,,1,3,468,TPESampler,COMPLETE
3715,0.34352477900686634,2025-04-24 22:05:59.545201,2025-04-24 22:06:04.030267,0 days 00:00:04.485066,True,squared_error,43,,1,2,578,TPESampler,COMPLETE
3716,0.3479216015429841,2025-04-24 22:06:01.658009,2025-04-24 22:06:06.349185,0 days 00:00:04.691176,True,squared_error,50,,1,4,729,TPESampler,COMPLETE
3717,0.42785631968559007,2025-04-24 22:06:01.981417,2025-04-24 22:06:05.731677,0 days 00:00:03.750260,True,squared_error,35,,2,3,587,TPESampler,COMPLETE
3718,0.4484921094855502,2025-04-24 22:06:02.444973,2025-04-24 22:06:06.206936,0 days 00:00:03.761963,False,squared_error,49,,2,4,541,TPESampler,COMPLETE
3719,0.4321288096101264,2025-04-24 22:06:02.594791,2025-04-24 22:06:05.295811,0 days 00:00:02.701020,True,squared_error,36,,2,5,475,TPESampler,COMPLETE
3720,0.44489811207249597,2025-04-24 22:06:04.286994,2025-04-24 22:06:16.084880,0 days 00:00:11.797886,True,absolute_error,40,,2,3,412,TPESampler,COMPLETE
3721,0.4239862601341001,2025-04-24 22:06:05.522191,2025-04-24 22:06:09.657938,0 days 00:00:04.135747,True,squared_error,50,,2,2,874,TPESampler,COMPLETE
3722,0.3604714008110144,2025-04-24 22:06:06.258481,2025-04-24 22:06:09.725567,0 days 00:00:03.467086,True,squared_error,43,,1,6,554,TPESampler,COMPLETE
3723,0.3451006211762406,2025-04-24 22:06:06.757248,2025-04-24 22:06:11.377978,0 days 00:00:04.620730,True,squared_error,44,,1,2,752,TPESampler,COMPLETE
3724,0.37762493604006736,2025-04-24 22:06:06.798344,2025-04-24 22:06:10.852126,0 days 00:00:04.053782,True,squared_error,43,,1,8,750,TPESampler,COMPLETE
3725,0.427518091646753,2025-04-24 22:06:09.905826,2025-04-24 22:06:13.616126,0 days 00:00:03.710300,True,squared_error,50,,2,2,755,TPESampler,COMPLETE
3726,0.9787084410471231,2025-04-24 22:06:09.987635,2025-04-24 22:06:12.095853,0 days 00:00:02.108218,True,absolute_error,28,log2,6,21,695,TPESampler,COMPLETE
3727,0.3419278671710908,2025-04-24 22:06:11.308410,2025-04-24 22:06:15.174561,0 days 00:00:03.866151,True,squared_error,50,,1,3,480,TPESampler,COMPLETE
3728,0.34444912310726605,2025-04-24 22:06:11.612853,2025-04-24 22:06:15.810949,0 days 00:00:04.198096,True,squared_error,50,,1,2,492,TPESampler,COMPLETE
3729,0.3442873897951455,2025-04-24 22:06:12.619963,2025-04-24 22:06:17.386870,0 days 00:00:04.766907,True,squared_error,50,,1,2,686,TPESampler,COMPLETE
3730,0.4363281644737526,2025-04-24 22:06:13.855439,2025-04-24 22:06:17.666298,0 days 00:00:03.810859,True,squared_error,46,,2,6,593,TPESampler,COMPLETE
3731,0.41998471669018117,2025-04-24 22:06:14.216941,2025-04-24 22:06:16.668700,0 days 00:00:02.451759,False,squared_error,43,sqrt,1,12,651,TPESampler,COMPLETE
3732,0.3541378245480556,2025-04-24 22:06:15.506931,2025-04-24 22:06:20.641434,0 days 00:00:05.134503,True,squared_error,42,,1,5,841,TPESampler,COMPLETE
3733,0.3434574322822576,2025-04-24 22:06:16.046608,2025-04-24 22:06:20.047865,0 days 00:00:04.001257,True,squared_error,42,,1,3,501,TPESampler,COMPLETE
3734,0.4370814524255781,2025-04-24 22:06:16.393686,2025-04-24 22:06:19.461578,0 days 00:00:03.067892,True,squared_error,43,,2,6,485,TPESampler,COMPLETE
3735,0.42733980196039645,2025-04-24 22:06:16.950371,2025-04-24 22:06:20.355550,0 days 00:00:03.405179,True,squared_error,50,,2,4,521,TPESampler,COMPLETE
3736,0.34196273359866586,2025-04-24 22:06:17.985837,2025-04-24 22:06:22.357338,0 days 00:00:04.371501,True,squared_error,50,,1,3,627,TPESampler,COMPLETE
3737,0.43005681155594566,2025-04-24 22:06:17.812044,2025-04-24 22:06:19.751730,0 days 00:00:01.939686,True,squared_error,49,,2,4,184,TPESampler,COMPLETE
3738,0.34607928271106164,2025-04-24 22:06:19.707073,2025-04-24 22:06:24.289316,0 days 00:00:04.582243,True,squared_error,34,,1,2,688,TPESampler,COMPLETE
3739,0.35630573651793346,2025-04-24 22:06:20.100801,2025-04-24 22:06:31.147375,0 days 00:00:11.046574,True,absolute_error,36,,1,2,178,TPESampler,COMPLETE
3740,0.42821696283930005,2025-04-24 22:06:20.298430,2025-04-24 22:06:24.368195,0 days 00:00:04.069765,True,squared_error,50,,2,4,558,TPESampler,COMPLETE
3741,0.4656148479648758,2025-04-24 22:06:20.880906,2025-04-24 22:07:10.869510,0 days 00:00:49.988604,True,absolute_error,27,,1,33,951,TPESampler,COMPLETE
3742,0.3495297708209897,2025-04-24 22:06:21.416326,2025-04-24 22:06:53.145958,0 days 00:00:31.729632,True,absolute_error,49,,1,4,570,TPESampler,COMPLETE
3743,0.4273529750422523,2025-04-24 22:06:22.799056,2025-04-24 22:06:26.189040,0 days 00:00:03.389984,True,squared_error,50,,2,4,686,TPESampler,COMPLETE
3744,0.3692214281287617,2025-04-24 22:06:24.608350,2025-04-24 22:06:26.905802,0 days 00:00:02.297452,True,squared_error,43,,1,7,414,TPESampler,COMPLETE
3745,0.346855161464008,2025-04-24 22:06:24.631267,2025-04-24 22:06:28.571228,0 days 00:00:03.939961,True,squared_error,50,,1,4,657,TPESampler,COMPLETE
3746,0.350459703827835,2025-04-24 22:06:26.411391,2025-04-24 22:07:14.563928,0 days 00:00:48.152537,True,absolute_error,38,,1,4,816,TPESampler,COMPLETE
3747,0.43603660082694856,2025-04-24 22:06:27.202279,2025-04-24 22:06:29.886707,0 days 00:00:02.684428,True,squared_error,50,,2,6,670,TPESampler,COMPLETE
3748,0.34571127281607805,2025-04-24 22:06:28.865609,2025-04-24 22:06:31.746542,0 days 00:00:02.880933,True,squared_error,50,,1,4,540,TPESampler,COMPLETE
3749,0.42700858940413045,2025-04-24 22:06:30.108719,2025-04-24 22:06:32.810183,0 days 00:00:02.701464,True,squared_error,50,,2,2,524,TPESampler,COMPLETE
3750,0.662983721643386,2025-04-24 22:06:31.364957,2025-04-24 22:06:34.676372,0 days 00:00:03.311415,False,absolute_error,35,,10,2,258,TPESampler,COMPLETE
3751,0.3421312727988302,2025-04-24 22:06:32.004654,2025-04-24 22:06:34.858430,0 days 00:00:02.853776,True,squared_error,50,,1,3,505,TPESampler,COMPLETE
3752,0.3443155092589979,2025-04-24 22:06:33.059006,2025-04-24 22:06:35.283050,0 days 00:00:02.224044,True,squared_error,44,,1,3,336,TPESampler,COMPLETE
3753,0.9707274841573765,2025-04-24 22:06:34.914527,2025-04-24 22:06:37.431542,0 days 00:00:02.517015,True,absolute_error,19,log2,5,14,989,TPESampler,COMPLETE
3754,0.7562929147777471,2025-04-24 22:06:35.092923,2025-04-24 22:06:36.981882,0 days 00:00:01.888959,True,absolute_error,16,log2,1,6,279,TPESampler,COMPLETE
3755,0.4955056777713473,2025-04-24 22:06:35.592081,2025-04-24 22:06:39.039837,0 days 00:00:03.447756,False,squared_error,14,,5,5,682,TPESampler,COMPLETE
3756,0.6049873029597853,2025-04-24 22:06:37.204569,2025-04-24 22:06:42.077818,0 days 00:00:04.873249,True,absolute_error,11,,11,2,750,TPESampler,COMPLETE
3757,0.3458533920471884,2025-04-24 22:06:37.682566,2025-04-24 22:06:41.346661,0 days 00:00:03.664095,True,squared_error,44,,1,4,604,TPESampler,COMPLETE
3758,0.34362351788790896,2025-04-24 22:06:39.312761,2025-04-24 22:06:43.808642,0 days 00:00:04.495881,True,squared_error,44,,1,3,786,TPESampler,COMPLETE
3759,0.3439238773878404,2025-04-24 22:06:41.588126,2025-04-24 22:06:45.560629,0 days 00:00:03.972503,True,squared_error,50,,1,2,631,TPESampler,COMPLETE
3760,0.34688122579658287,2025-04-24 22:06:42.390799,2025-04-24 22:06:45.852180,0 days 00:00:03.461381,True,squared_error,43,,1,4,648,TPESampler,COMPLETE
3761,0.5472214249041785,2025-04-24 22:06:44.183211,2025-04-24 22:06:46.018603,0 days 00:00:01.835392,False,absolute_error,34,sqrt,2,17,127,TPESampler,COMPLETE
3762,0.3422942057865998,2025-04-24 22:06:45.811136,2025-04-24 22:06:49.213045,0 days 00:00:03.401909,True,squared_error,43,,1,3,559,TPESampler,COMPLETE
3763,0.3434418263611581,2025-04-24 22:06:46.118589,2025-04-24 22:06:49.073187,0 days 00:00:02.954598,True,squared_error,36,,1,3,516,TPESampler,COMPLETE
3764,0.35392249151526156,2025-04-24 22:06:46.430523,2025-04-24 22:06:49.074485,0 days 00:00:02.643962,True,squared_error,44,,1,5,425,TPESampler,COMPLETE
3765,0.3430279446893389,2025-04-24 22:06:49.296362,2025-04-24 22:06:53.270744,0 days 00:00:03.974382,True,squared_error,43,,1,2,601,TPESampler,COMPLETE
3766,0.3533965128636359,2025-04-24 22:06:49.379808,2025-04-24 22:06:52.182768,0 days 00:00:02.802960,True,squared_error,50,,1,5,512,TPESampler,COMPLETE
3767,0.4546808888452865,2025-04-24 22:06:49.487544,2025-04-24 22:06:55.091101,0 days 00:00:05.603557,False,squared_error,17,,1,2,849,TPESampler,COMPLETE
3768,0.37447296833388466,2025-04-24 22:06:52.405253,2025-04-24 22:06:53.862551,0 days 00:00:01.457298,True,squared_error,49,sqrt,1,3,406,TPESampler,COMPLETE
3769,0.3439690807290203,2025-04-24 22:06:53.353853,2025-04-24 22:06:57.401292,0 days 00:00:04.047439,True,squared_error,50,,1,2,401,TPESampler,COMPLETE
3770,0.8800622193034852,2025-04-24 22:06:53.513808,2025-04-24 22:06:55.490539,0 days 00:00:01.976731,True,squared_error,50,log2,2,2,539,TPESampler,COMPLETE
3771,0.4283678019249297,2025-04-24 22:06:54.131810,2025-04-24 22:06:56.941546,0 days 00:00:02.809736,True,squared_error,44,,2,2,626,TPESampler,COMPLETE
3772,0.3422323897055767,2025-04-24 22:06:55.347258,2025-04-24 22:06:58.398288,0 days 00:00:03.051030,True,squared_error,50,,1,3,371,TPESampler,COMPLETE
3773,0.42884508151592166,2025-04-24 22:06:55.854846,2025-04-24 22:06:58.426990,0 days 00:00:02.572144,True,squared_error,50,log2,1,2,638,TPESampler,COMPLETE
3774,0.3425341007494609,2025-04-24 22:06:57.171049,2025-04-24 22:07:00.786978,0 days 00:00:03.615929,True,squared_error,50,,1,3,695,TPESampler,COMPLETE
3775,0.3435667612785542,2025-04-24 22:06:57.666099,2025-04-24 22:07:01.807816,0 days 00:00:04.141717,True,squared_error,43,,1,2,562,TPESampler,COMPLETE
3776,0.347941989668913,2025-04-24 22:06:58.782326,2025-04-24 22:07:24.370562,0 days 00:00:25.588236,True,absolute_error,42,,1,3,442,TPESampler,COMPLETE
3777,0.3438990480333396,2025-04-24 22:06:58.842671,2025-04-24 22:07:02.650477,0 days 00:00:03.807806,True,squared_error,50,,1,2,520,TPESampler,COMPLETE
3778,0.4740061951463853,2025-04-24 22:07:01.018262,2025-04-24 22:07:02.858321,0 days 00:00:01.840059,True,squared_error,42,log2,1,3,639,TPESampler,COMPLETE
3779,0.34326057385549474,2025-04-24 22:07:02.045598,2025-04-24 22:07:06.448209,0 days 00:00:04.402611,True,squared_error,50,,1,3,743,TPESampler,COMPLETE
3780,0.3492322024726455,2025-04-24 22:07:03.074497,2025-04-24 22:07:06.477834,0 days 00:00:03.403337,True,squared_error,34,,1,4,668,TPESampler,COMPLETE
3781,0.3624158259279703,2025-04-24 22:07:03.085821,2025-04-24 22:07:05.002642,0 days 00:00:01.916821,True,squared_error,50,,1,6,289,TPESampler,COMPLETE
3782,0.34089227931747224,2025-04-24 22:07:05.239958,2025-04-24 22:07:08.496136,0 days 00:00:03.256178,True,squared_error,50,,1,3,607,TPESampler,COMPLETE
3783,0.34268815668562674,2025-04-24 22:07:06.655802,2025-04-24 22:07:10.043592,0 days 00:00:03.387790,True,squared_error,43,,1,3,518,TPESampler,COMPLETE
3784,0.34270835018009427,2025-04-24 22:07:06.704152,2025-04-24 22:07:09.913004,0 days 00:00:03.208852,True,squared_error,43,,1,3,488,TPESampler,COMPLETE
3785,0.924661757297379,2025-04-24 22:07:08.723749,2025-04-24 22:07:09.836005,0 days 00:00:01.112256,True,squared_error,49,log2,5,6,340,TPESampler,COMPLETE
3786,0.9226903348643433,2025-04-24 22:07:10.169332,2025-04-24 22:07:11.691404,0 days 00:00:01.522072,True,absolute_error,33,log2,2,22,124,TPESampler,COMPLETE
3787,0.3613828061697141,2025-04-24 22:07:10.188760,2025-04-24 22:07:14.724059,0 days 00:00:04.535299,True,squared_error,50,,1,6,809,TPESampler,COMPLETE
3788,0.37689301760845295,2025-04-24 22:07:10.316493,2025-04-24 22:07:14.308655,0 days 00:00:03.992162,True,squared_error,50,,1,8,624,TPESampler,COMPLETE
3789,0.3843140268794575,2025-04-24 22:07:11.227216,2025-04-24 22:07:13.514954,0 days 00:00:02.287738,True,squared_error,43,sqrt,1,2,424,TPESampler,COMPLETE
3790,0.36078760096817464,2025-04-24 22:07:12.017540,2025-04-24 22:07:15.757922,0 days 00:00:03.740382,True,squared_error,43,,1,6,578,TPESampler,COMPLETE
3791,0.429526701931996,2025-04-24 22:07:13.750276,2025-04-24 22:07:16.742126,0 days 00:00:02.991850,True,squared_error,43,,2,3,447,TPESampler,COMPLETE
3792,0.34623922173265226,2025-04-24 22:07:14.653397,2025-04-24 22:07:18.637148,0 days 00:00:03.983751,True,squared_error,50,,1,4,615,TPESampler,COMPLETE
3793,0.7082866420464877,2025-04-24 22:07:15.034443,2025-04-24 22:07:16.951530,0 days 00:00:01.917087,True,absolute_error,18,sqrt,2,17,188,TPESampler,COMPLETE
3794,0.3417439757077381,2025-04-24 22:07:15.054206,2025-04-24 22:07:18.636105,0 days 00:00:03.581899,True,squared_error,50,,1,3,575,TPESampler,COMPLETE
3795,0.8202955889822722,2025-04-24 22:07:16.070559,2025-04-24 22:07:19.159992,0 days 00:00:03.089433,False,absolute_error,46,sqrt,5,8,651,TPESampler,COMPLETE
3796,0.448511896927052,2025-04-24 22:07:17.208430,2025-04-24 22:07:21.555070,0 days 00:00:04.346640,False,squared_error,50,,2,2,605,TPESampler,COMPLETE
3797,0.3429935565685976,2025-04-24 22:07:17.407839,2025-04-24 22:07:22.017828,0 days 00:00:04.609989,True,squared_error,43,,1,3,690,TPESampler,COMPLETE
3798,0.43242950199067476,2025-04-24 22:07:18.811194,2025-04-24 22:07:21.724641,0 days 00:00:02.913447,True,squared_error,50,,2,5,448,TPESampler,COMPLETE
3799,0.4256218358842061,2025-04-24 22:07:18.874882,2025-04-24 22:07:23.614971,0 days 00:00:04.740089,True,squared_error,44,,2,3,820,TPESampler,COMPLETE
3800,0.3522171408722915,2025-04-24 22:07:19.425554,2025-04-24 22:07:23.467789,0 days 00:00:04.042235,True,squared_error,50,,1,5,605,TPESampler,COMPLETE
3801,0.43208758261231905,2025-04-24 22:07:21.810899,2025-04-24 22:07:24.187277,0 days 00:00:02.376378,True,squared_error,50,,2,5,337,TPESampler,COMPLETE
3802,0.9212026292424966,2025-04-24 22:07:22.008077,2025-04-24 22:07:24.489977,0 days 00:00:02.481900,True,absolute_error,39,log2,2,3,481,TPESampler,COMPLETE
3803,0.42718493870828933,2025-04-24 22:07:22.389619,2025-04-24 22:07:26.174024,0 days 00:00:03.784405,True,squared_error,43,,2,3,656,TPESampler,COMPLETE
3804,0.34534925887485357,2025-04-24 22:07:23.875981,2025-04-24 22:07:30.113108,0 days 00:00:06.237127,True,squared_error,50,,1,2,738,TPESampler,COMPLETE
3805,0.4283363977764274,2025-04-24 22:07:24.609988,2025-04-24 22:07:28.458665,0 days 00:00:03.848677,True,squared_error,50,,2,3,580,TPESampler,COMPLETE
3806,0.3439013402170058,2025-04-24 22:07:24.668390,2025-04-24 22:07:30.280054,0 days 00:00:05.611664,True,squared_error,42,,1,2,585,TPESampler,COMPLETE
3807,0.35473698364435974,2025-04-24 22:07:25.183911,2025-04-24 22:07:29.117343,0 days 00:00:03.933432,True,squared_error,44,,1,5,503,TPESampler,COMPLETE
3808,0.345948908163483,2025-04-24 22:07:25.197048,2025-04-24 22:07:29.154374,0 days 00:00:03.957326,True,squared_error,44,,1,4,416,TPESampler,COMPLETE
3809,0.42762280818932186,2025-04-24 22:07:26.470619,2025-04-24 22:07:29.606516,0 days 00:00:03.135897,True,squared_error,50,,2,3,606,TPESampler,COMPLETE
3810,0.5924355758346859,2025-04-24 22:07:28.690386,2025-04-24 22:07:31.147779,0 days 00:00:02.457393,True,squared_error,46,,14,46,536,TPESampler,COMPLETE
3811,0.34446505518503656,2025-04-24 22:07:29.402830,2025-04-24 22:07:33.938288,0 days 00:00:04.535458,True,squared_error,44,,1,2,494,TPESampler,COMPLETE
3812,0.3465889222686178,2025-04-24 22:07:29.487209,2025-04-24 22:07:33.739491,0 days 00:00:04.252282,True,squared_error,50,,1,4,425,TPESampler,COMPLETE
3813,0.34620296723198124,2025-04-24 22:07:30.054585,2025-04-24 22:07:34.429114,0 days 00:00:04.374529,True,squared_error,50,,1,4,552,TPESampler,COMPLETE
3814,0.9893626812900701,2025-04-24 22:07:30.685187,2025-04-24 22:07:32.619154,0 days 00:00:01.933967,True,absolute_error,5,log2,12,47,452,TPESampler,COMPLETE
3815,0.9015328845347914,2025-04-24 22:07:30.885612,2025-04-24 22:07:32.933242,0 days 00:00:02.047630,False,squared_error,12,sqrt,12,18,883,TPESampler,COMPLETE
