number,value,datetime_start,datetime_complete,duration,params_bootstrap,params_criterion,params_max_depth,params_max_features,params_min_samples_leaf,params_min_samples_split,params_n_estimators,system_attrs_auto:sampler,state
424,0.4324976940834241,2025-04-24 21:23:11.728617,2025-04-24 21:23:13.055445,0 days 00:00:01.326828,True,squared_error,29,sqrt,1,4,388,TPESampler,COMPLETE
425,0.4283021978942291,2025-04-24 21:23:12.273909,2025-04-24 21:23:14.815518,0 days 00:00:02.541609,True,squared_error,45,,2,3,497,TPESampler,COMPLETE
426,0.3445377441191984,2025-04-24 21:23:12.579403,2025-04-24 21:23:16.018224,0 days 00:00:03.438821,True,squared_error,50,,1,2,504,TPESampler,COMPLETE
427,0.34797460652418655,2025-04-24 21:23:13.256822,2025-04-24 21:23:16.916619,0 days 00:00:03.659797,True,squared_error,40,,1,4,661,TPESampler,COMPLETE
428,0.9674048726337777,2025-04-24 21:23:13.338074,2025-04-24 21:23:14.457015,0 days 00:00:01.118941,False,absolute_error,46,log2,7,4,288,TPESampler,COMPLETE
429,0.34099180282384206,2025-04-24 21:23:13.748095,2025-04-24 21:23:16.702863,0 days 00:00:02.954768,True,squared_error,50,,1,3,455,TPESampler,COMPLETE
430,0.34279928175951874,2025-04-24 21:23:14.677299,2025-04-24 21:23:17.799219,0 days 00:00:03.121920,True,squared_error,41,,1,3,596,TPESampler,COMPLETE
431,0.3536105135076453,2025-04-24 21:23:15.046446,2025-04-24 21:23:17.774088,0 days 00:00:02.727642,True,squared_error,49,,1,5,516,TPESampler,COMPLETE
432,0.3465910386746507,2025-04-24 21:23:16.213172,2025-04-24 21:23:44.332933,0 days 00:00:28.119761,True,absolute_error,44,,1,2,520,TPESampler,COMPLETE
433,0.41461254509646367,2025-04-24 21:23:16.984764,2025-04-24 21:23:23.136581,0 days 00:00:06.151817,True,absolute_error,43,sqrt,1,7,642,TPESampler,COMPLETE
434,0.34292455089976603,2025-04-24 21:23:17.110060,2025-04-24 21:23:20.250526,0 days 00:00:03.140466,True,squared_error,50,,1,2,454,TPESampler,COMPLETE
435,0.42775000330118623,2025-04-24 21:23:17.965006,2025-04-24 21:23:20.641435,0 days 00:00:02.676429,True,squared_error,50,,2,4,549,TPESampler,COMPLETE
436,0.4294176470978802,2025-04-24 21:23:18.046156,2025-04-24 21:23:20.404270,0 days 00:00:02.358114,True,squared_error,49,,2,3,467,TPESampler,COMPLETE
437,0.43684439718732965,2025-04-24 21:23:20.429189,2025-04-24 21:23:22.180398,0 days 00:00:01.751209,True,squared_error,48,log2,1,2,572,TPESampler,COMPLETE
438,0.36256149583630276,2025-04-24 21:23:20.598826,2025-04-24 21:23:51.063930,0 days 00:00:30.465104,True,absolute_error,49,,1,6,559,TPESampler,COMPLETE
439,0.3797370146498277,2025-04-24 21:23:20.907099,2025-04-24 21:23:22.064777,0 days 00:00:01.157678,True,squared_error,43,,1,7,115,TPESampler,COMPLETE
440,0.34135183940183994,2025-04-24 21:23:22.253347,2025-04-24 21:23:24.840313,0 days 00:00:02.586966,True,squared_error,48,,1,3,488,TPESampler,COMPLETE
441,0.34042217296123284,2025-04-24 21:23:22.372709,2025-04-24 21:23:24.981031,0 days 00:00:02.608322,True,squared_error,48,,1,3,446,TPESampler,COMPLETE
442,0.34661361804326624,2025-04-24 21:23:23.334736,2025-04-24 21:23:25.558809,0 days 00:00:02.224073,True,squared_error,49,,1,4,398,TPESampler,COMPLETE
443,0.34370649503539547,2025-04-24 21:23:25.032143,2025-04-24 21:23:27.731078,0 days 00:00:02.698935,True,squared_error,50,,1,2,468,TPESampler,COMPLETE
444,0.42988343472515944,2025-04-24 21:23:25.173131,2025-04-24 21:23:27.140854,0 days 00:00:01.967723,True,squared_error,42,,2,4,372,TPESampler,COMPLETE
445,0.3607132507911105,2025-04-24 21:23:25.863079,2025-04-24 21:23:28.060348,0 days 00:00:02.197269,True,squared_error,48,,1,6,394,TPESampler,COMPLETE
446,0.3426425179282081,2025-04-24 21:23:27.335532,2025-04-24 21:23:29.632336,0 days 00:00:02.296804,True,squared_error,42,,1,3,396,TPESampler,COMPLETE
447,0.3416534182940228,2025-04-24 21:23:27.956699,2025-04-24 21:23:30.556416,0 days 00:00:02.599717,True,squared_error,50,,1,3,487,TPESampler,COMPLETE
448,0.3467198150024093,2025-04-24 21:23:28.253606,2025-04-24 21:23:30.501174,0 days 00:00:02.247568,True,squared_error,39,,1,2,332,TPESampler,COMPLETE
449,0.342295315985129,2025-04-24 21:23:29.798656,2025-04-24 21:23:32.694626,0 days 00:00:02.895970,True,squared_error,47,,1,3,516,TPESampler,COMPLETE
450,0.34630922585021595,2025-04-24 21:23:30.703497,2025-04-24 21:23:34.802456,0 days 00:00:04.098959,True,squared_error,49,,1,2,737,TPESampler,COMPLETE
451,0.4294838447990328,2025-04-24 21:23:30.745084,2025-04-24 21:23:35.375946,0 days 00:00:04.630862,False,squared_error,49,,1,2,673,TPESampler,COMPLETE
452,0.34192006950084514,2025-04-24 21:23:32.858049,2025-04-24 21:23:35.035611,0 days 00:00:02.177562,True,squared_error,49,,1,3,397,TPESampler,COMPLETE
453,0.40975004187811565,2025-04-24 21:23:34.970250,2025-04-24 21:23:36.707089,0 days 00:00:01.736839,True,squared_error,40,sqrt,1,6,638,TPESampler,COMPLETE
454,0.34270835018009427,2025-04-24 21:23:35.255301,2025-04-24 21:23:38.331258,0 days 00:00:03.075957,True,squared_error,43,,1,3,488,TPESampler,COMPLETE
455,0.34754358596739976,2025-04-24 21:23:35.605587,2025-04-24 21:23:37.476956,0 days 00:00:01.871369,True,squared_error,39,,1,4,329,TPESampler,COMPLETE
456,0.8278882577525598,2025-04-24 21:23:36.887535,2025-04-24 21:23:37.962108,0 days 00:00:01.074573,False,squared_error,34,log2,2,5,648,TPESampler,COMPLETE
457,0.9897755206935905,2025-04-24 21:23:37.644760,2025-04-24 21:23:39.211328,0 days 00:00:01.566568,True,absolute_error,42,log2,15,5,905,TPESampler,COMPLETE
458,0.3457681199673688,2025-04-24 21:23:38.205775,2025-04-24 21:23:41.237622,0 days 00:00:03.031847,True,squared_error,49,,1,4,600,TPESampler,COMPLETE
459,0.35281354603350173,2025-04-24 21:23:38.496003,2025-04-24 21:23:41.297222,0 days 00:00:02.801219,True,squared_error,50,,1,5,556,TPESampler,COMPLETE
460,0.597537556117599,2025-04-24 21:23:39.387392,2025-04-24 21:24:01.317064,0 days 00:00:21.929672,False,absolute_error,21,,3,41,683,TPESampler,COMPLETE
461,0.4275435566108375,2025-04-24 21:23:41.369372,2025-04-24 21:23:43.788753,0 days 00:00:02.419381,True,squared_error,50,,2,2,512,TPESampler,COMPLETE
462,0.42873132790728574,2025-04-24 21:23:41.442459,2025-04-24 21:23:43.829548,0 days 00:00:02.387089,True,squared_error,50,,2,2,477,TPESampler,COMPLETE
463,0.5527638199358593,2025-04-24 21:23:42.245192,2025-04-24 21:23:43.966028,0 days 00:00:01.720836,True,absolute_error,27,,5,2,134,TPESampler,COMPLETE
464,0.4530037213011555,2025-04-24 21:23:43.917499,2025-04-24 21:23:45.734487,0 days 00:00:01.816988,False,squared_error,47,log2,1,4,491,TPESampler,COMPLETE
465,0.3534978062886024,2025-04-24 21:23:43.996425,2025-04-24 21:23:47.069930,0 days 00:00:03.073505,True,squared_error,43,,1,5,419,TPESampler,COMPLETE
466,0.4266849661205245,2025-04-24 21:23:44.162331,2025-04-24 21:23:46.569922,0 days 00:00:02.407591,False,squared_error,39,,1,2,273,TPESampler,COMPLETE
467,0.3468736791433085,2025-04-24 21:23:44.606413,2025-04-24 21:23:47.771363,0 days 00:00:03.164950,True,squared_error,47,,1,4,503,TPESampler,COMPLETE
468,0.3404927408543307,2025-04-24 21:23:45.921294,2025-04-24 21:23:48.791827,0 days 00:00:02.870533,True,squared_error,48,,1,3,452,TPESampler,COMPLETE
469,0.3700667800496669,2025-04-24 21:23:46.736305,2025-04-24 21:23:49.724126,0 days 00:00:02.987821,True,squared_error,45,,1,7,688,TPESampler,COMPLETE
470,0.5559721438670678,2025-04-24 21:23:47.318815,2025-04-24 21:23:48.136462,0 days 00:00:00.817647,False,squared_error,34,log2,1,21,237,TPESampler,COMPLETE
471,0.3592867316340101,2025-04-24 21:23:48.059198,2025-04-24 21:24:24.613154,0 days 00:00:36.553956,True,absolute_error,33,,1,5,719,TPESampler,COMPLETE
472,0.3437261573871824,2025-04-24 21:23:48.346544,2025-04-24 21:23:51.854401,0 days 00:00:03.507857,True,squared_error,43,,1,2,574,TPESampler,COMPLETE
473,0.34167374984248494,2025-04-24 21:23:49.000394,2025-04-24 21:23:51.760850,0 days 00:00:02.760456,True,squared_error,50,,1,3,488,TPESampler,COMPLETE
474,0.4589793479392099,2025-04-24 21:23:49.906682,2025-04-24 21:23:51.139206,0 days 00:00:01.232524,True,squared_error,49,log2,1,6,508,TPESampler,COMPLETE
475,0.7360535693635925,2025-04-24 21:23:51.204674,2025-04-24 21:23:52.447915,0 days 00:00:01.243241,False,squared_error,48,sqrt,4,4,329,TPESampler,COMPLETE
476,0.43054740320990903,2025-04-24 21:23:51.280615,2025-04-24 21:23:54.598440,0 days 00:00:03.317825,True,squared_error,39,,2,5,713,TPESampler,COMPLETE
477,0.3408351192221681,2025-04-24 21:23:52.039765,2025-04-24 21:23:55.478690,0 days 00:00:03.438925,True,squared_error,50,,1,3,596,TPESampler,COMPLETE
478,0.3424954039224417,2025-04-24 21:23:52.148493,2025-04-24 21:23:55.891913,0 days 00:00:03.743420,True,squared_error,49,,1,3,683,TPESampler,COMPLETE
479,0.3440447833157058,2025-04-24 21:23:52.625116,2025-04-24 21:23:55.466029,0 days 00:00:02.840913,True,squared_error,42,,1,2,438,TPESampler,COMPLETE
480,0.34605510465637385,2025-04-24 21:23:54.771652,2025-04-24 21:23:57.231286,0 days 00:00:02.459634,True,squared_error,50,,1,4,421,TPESampler,COMPLETE
481,0.3433266792875223,2025-04-24 21:23:55.668646,2025-04-24 21:23:59.579251,0 days 00:00:03.910605,True,squared_error,50,,1,2,614,TPESampler,COMPLETE
482,0.9489956050053242,2025-04-24 21:23:55.671184,2025-04-24 21:23:57.441334,0 days 00:00:01.770150,False,absolute_error,30,log2,4,2,731,TPESampler,COMPLETE
483,0.9562214240492939,2025-04-24 21:23:56.079469,2025-04-24 21:23:57.710401,0 days 00:00:01.630932,True,absolute_error,41,log2,3,22,474,TPESampler,COMPLETE
484,0.35281578058346746,2025-04-24 21:23:57.570580,2025-04-24 21:24:00.775413,0 days 00:00:03.204833,True,squared_error,50,,1,5,524,TPESampler,COMPLETE
485,0.48343989530884596,2025-04-24 21:23:57.644609,2025-04-24 21:24:00.591124,0 days 00:00:02.946515,True,absolute_error,44,log2,1,4,439,TPESampler,COMPLETE
486,0.5485380498019494,2025-04-24 21:23:57.919387,2025-04-24 21:23:59.046332,0 days 00:00:01.126945,False,squared_error,7,,5,6,144,TPESampler,COMPLETE
487,0.3485254065546242,2025-04-24 21:23:59.230202,2025-04-24 21:24:00.713205,0 days 00:00:01.483003,True,squared_error,42,,1,2,216,TPESampler,COMPLETE
488,0.4696574008636179,2025-04-24 21:23:59.826262,2025-04-24 21:24:06.565482,0 days 00:00:06.739220,True,absolute_error,45,log2,1,2,916,TPESampler,COMPLETE
489,0.34189850498727337,2025-04-24 21:24:00.770459,2025-04-24 21:24:03.912063,0 days 00:00:03.141604,True,squared_error,49,,1,3,467,TPESampler,COMPLETE
490,0.42669478065565114,2025-04-24 21:24:00.903515,2025-04-24 21:24:02.485988,0 days 00:00:01.582473,True,squared_error,50,log2,1,3,367,TPESampler,COMPLETE
491,0.3442655079344584,2025-04-24 21:24:00.991035,2025-04-24 21:24:05.078857,0 days 00:00:04.087822,True,squared_error,50,,1,2,636,TPESampler,COMPLETE
492,0.4296660716752709,2025-04-24 21:24:01.599738,2025-04-24 21:24:03.700410,0 days 00:00:02.100672,True,squared_error,49,,2,4,381,TPESampler,COMPLETE
493,0.4533622128295388,2025-04-24 21:24:02.664862,2025-04-24 21:24:04.510972,0 days 00:00:01.846110,True,squared_error,5,,1,6,600,TPESampler,COMPLETE
494,0.682818538510737,2025-04-24 21:24:03.882647,2025-04-24 21:24:04.957561,0 days 00:00:01.074914,True,squared_error,22,log2,1,45,306,TPESampler,COMPLETE
495,0.38130383356607395,2025-04-24 21:24:04.107742,2025-04-24 21:24:05.761443,0 days 00:00:01.653701,True,squared_error,41,sqrt,1,3,460,TPESampler,COMPLETE
496,0.3410302047918888,2025-04-24 21:24:04.817204,2025-04-24 21:24:07.399681,0 days 00:00:02.582477,True,squared_error,50,,1,3,442,TPESampler,COMPLETE
497,0.4354086803733016,2025-04-24 21:24:05.121493,2025-04-24 21:24:08.608316,0 days 00:00:03.486823,True,squared_error,47,,2,6,774,TPESampler,COMPLETE
498,0.3416711825955121,2025-04-24 21:24:05.321057,2025-04-24 21:24:09.092252,0 days 00:00:03.771195,True,squared_error,50,,1,3,576,TPESampler,COMPLETE
499,0.3733319475175902,2025-04-24 21:24:05.984113,2025-04-24 21:24:07.244355,0 days 00:00:01.260242,False,squared_error,48,sqrt,1,5,323,TPESampler,COMPLETE
500,0.4295516206412698,2025-04-24 21:24:06.809167,2025-04-24 21:24:09.017254,0 days 00:00:02.208087,True,squared_error,41,,2,3,466,TPESampler,COMPLETE
501,0.3460817579367885,2025-04-24 21:24:07.466637,2025-04-24 21:24:09.829248,0 days 00:00:02.362611,True,squared_error,49,,1,2,347,TPESampler,COMPLETE
502,0.3444230966712603,2025-04-24 21:24:07.586973,2025-04-24 21:24:10.123287,0 days 00:00:02.536314,True,squared_error,42,,1,2,415,TPESampler,COMPLETE
503,0.34232364362725654,2025-04-24 21:24:08.792788,2025-04-24 21:24:11.918051,0 days 00:00:03.125263,True,squared_error,45,,1,3,481,TPESampler,COMPLETE
504,0.903352369492005,2025-04-24 21:24:09.259201,2025-04-24 21:24:11.085646,0 days 00:00:01.826445,True,squared_error,46,sqrt,8,21,348,TPESampler,COMPLETE
505,0.43156847644448537,2025-04-24 21:24:09.305380,2025-04-24 21:24:12.413116,0 days 00:00:03.107736,True,squared_error,49,,2,5,478,TPESampler,COMPLETE
506,0.34136883313109556,2025-04-24 21:24:10.194736,2025-04-24 21:24:12.806301,0 days 00:00:02.611565,True,squared_error,49,,1,3,419,TPESampler,COMPLETE
507,0.3604351635533328,2025-04-24 21:24:10.501275,2025-04-24 21:24:12.955781,0 days 00:00:02.454506,True,squared_error,50,,1,6,449,TPESampler,COMPLETE
508,0.3468536579649676,2025-04-24 21:24:11.319193,2025-04-24 21:24:13.852953,0 days 00:00:02.533760,True,squared_error,41,,1,4,374,TPESampler,COMPLETE
509,0.3439726584830844,2025-04-24 21:24:12.147168,2025-04-24 21:24:15.508641,0 days 00:00:03.361473,True,squared_error,50,,1,2,516,TPESampler,COMPLETE
510,0.3468746055654137,2025-04-24 21:24:12.592156,2025-04-24 21:24:15.248648,0 days 00:00:02.656492,True,squared_error,50,,1,4,404,TPESampler,COMPLETE
511,0.346877897091964,2025-04-24 21:24:13.007075,2025-04-24 21:24:31.918191,0 days 00:00:18.911116,True,absolute_error,49,,1,3,342,TPESampler,COMPLETE
512,0.6131604968293436,2025-04-24 21:24:13.201085,2025-04-24 21:24:14.410323,0 days 00:00:01.209238,True,absolute_error,7,,12,2,112,TPESampler,COMPLETE
513,0.6376408616298895,2025-04-24 21:24:14.071183,2025-04-24 21:24:15.195729,0 days 00:00:01.124546,False,squared_error,28,sqrt,3,6,457,TPESampler,COMPLETE
514,0.873632580988328,2025-04-24 21:24:14.637219,2025-04-24 21:24:15.946640,0 days 00:00:01.309421,False,absolute_error,22,log2,2,2,280,TPESampler,COMPLETE
515,0.8775727729809655,2025-04-24 21:24:15.346805,2025-04-24 21:24:17.379316,0 days 00:00:02.032511,True,squared_error,38,log2,2,5,444,TPESampler,COMPLETE
516,0.4282795339029473,2025-04-24 21:24:15.396703,2025-04-24 21:24:17.920285,0 days 00:00:02.523582,True,squared_error,49,,2,3,298,TPESampler,COMPLETE
517,0.9650113423282333,2025-04-24 21:24:15.718745,2025-04-24 21:24:18.435575,0 days 00:00:02.716830,True,absolute_error,13,sqrt,13,5,816,TPESampler,COMPLETE
518,0.3416345792542,2025-04-24 21:24:16.287238,2025-04-24 21:24:18.675122,0 days 00:00:02.387884,True,squared_error,50,,1,3,414,TPESampler,COMPLETE
519,0.3431618880610839,2025-04-24 21:24:17.581758,2025-04-24 21:24:20.851205,0 days 00:00:03.269447,True,squared_error,44,,1,3,405,TPESampler,COMPLETE
520,0.9354808390993081,2025-04-24 21:24:18.149609,2025-04-24 21:24:20.578721,0 days 00:00:02.429112,True,squared_error,11,log2,10,20,993,TPESampler,COMPLETE
521,0.8189278133666161,2025-04-24 21:24:18.663415,2025-04-24 21:24:21.815066,0 days 00:00:03.151651,False,absolute_error,43,sqrt,5,19,856,TPESampler,COMPLETE
522,0.5000313905257644,2025-04-24 21:24:18.952006,2025-04-24 21:24:20.028140,0 days 00:00:01.076134,False,squared_error,32,,3,47,166,TPESampler,COMPLETE
523,0.34608285654238885,2025-04-24 21:24:20.199815,2025-04-24 21:24:22.888395,0 days 00:00:02.688580,True,squared_error,50,,1,4,553,TPESampler,COMPLETE
524,0.8702050816429372,2025-04-24 21:24:20.808301,2025-04-24 21:24:22.275102,0 days 00:00:01.466801,True,squared_error,5,log2,1,34,491,TPESampler,COMPLETE
525,0.4039238741745791,2025-04-24 21:24:21.104281,2025-04-24 21:24:23.095862,0 days 00:00:01.991581,False,squared_error,34,sqrt,1,2,292,TPESampler,COMPLETE
526,0.8936081421440851,2025-04-24 21:24:22.113976,2025-04-24 21:24:24.500772,0 days 00:00:02.386796,False,absolute_error,11,sqrt,7,2,822,TPESampler,COMPLETE
527,0.6770789254548598,2025-04-24 21:24:22.470785,2025-04-24 21:24:29.356369,0 days 00:00:06.885584,False,absolute_error,10,sqrt,1,5,879,TPESampler,COMPLETE
528,0.34223238250532423,2025-04-24 21:24:23.071429,2025-04-24 21:24:25.663606,0 days 00:00:02.592177,True,squared_error,42,,1,3,376,TPESampler,COMPLETE
529,0.6310978531452406,2025-04-24 21:24:23.326200,2025-04-24 21:24:26.986250,0 days 00:00:03.660050,True,absolute_error,28,log2,1,20,594,TPESampler,COMPLETE
530,0.3417979068200993,2025-04-24 21:24:24.704814,2025-04-24 21:24:27.425067,0 days 00:00:02.720253,True,squared_error,50,,1,3,466,TPESampler,COMPLETE
531,0.34771955892266043,2025-04-24 21:24:24.817201,2025-04-24 21:24:27.564250,0 days 00:00:02.747049,True,squared_error,50,,1,4,499,TPESampler,COMPLETE
532,0.42820331083308966,2025-04-24 21:24:25.839176,2025-04-24 21:24:27.381528,0 days 00:00:01.542352,True,squared_error,40,,2,2,305,TPESampler,COMPLETE
533,0.44851318362981324,2025-04-24 21:24:27.163076,2025-04-24 21:24:30.681405,0 days 00:00:03.518329,False,squared_error,45,,2,4,597,TPESampler,COMPLETE
534,0.4766892950496142,2025-04-24 21:24:27.584592,2025-04-24 21:24:29.470779,0 days 00:00:01.886187,True,squared_error,15,,3,11,292,TPESampler,COMPLETE
535,0.35861228352347424,2025-04-24 21:24:27.644218,2025-04-24 21:24:29.420330,0 days 00:00:01.776112,True,squared_error,39,,1,5,215,TPESampler,COMPLETE
536,0.8295584605839037,2025-04-24 21:24:27.902983,2025-04-24 21:24:29.467015,0 days 00:00:01.564032,False,squared_error,7,log2,1,16,823,TPESampler,COMPLETE
537,0.3437380939354787,2025-04-24 21:24:29.536384,2025-04-24 21:24:33.063608,0 days 00:00:03.527224,True,squared_error,47,,1,2,411,TPESampler,COMPLETE
538,0.3443163491094506,2025-04-24 21:24:29.628779,2025-04-24 21:24:32.498717,0 days 00:00:02.869938,True,squared_error,47,,1,2,363,TPESampler,COMPLETE
539,0.34560416035282704,2025-04-24 21:24:29.687856,2025-04-24 21:24:31.927559,0 days 00:00:02.239703,True,squared_error,50,,1,2,261,TPESampler,COMPLETE
540,0.3434964764926016,2025-04-24 21:24:29.741068,2025-04-24 21:24:32.814584,0 days 00:00:03.073516,True,squared_error,50,,1,2,431,TPESampler,COMPLETE
541,0.6284345106600933,2025-04-24 21:24:30.960582,2025-04-24 21:24:31.771614,0 days 00:00:00.811032,False,squared_error,37,,13,5,104,TPESampler,COMPLETE
542,0.372023665771157,2025-04-24 21:24:31.973816,2025-04-24 21:24:33.923185,0 days 00:00:01.949369,True,squared_error,49,sqrt,1,3,578,TPESampler,COMPLETE
543,0.3413295970944075,2025-04-24 21:24:32.080906,2025-04-24 21:24:36.072383,0 days 00:00:03.991477,True,squared_error,50,,1,3,522,TPESampler,COMPLETE
544,0.9683697064852961,2025-04-24 21:24:32.132664,2025-04-24 21:24:34.836390,0 days 00:00:02.703726,True,absolute_error,34,sqrt,15,42,886,TPESampler,COMPLETE
545,0.34772751121591156,2025-04-24 21:24:32.890628,2025-04-24 21:24:36.204653,0 days 00:00:03.314025,True,squared_error,42,,1,4,433,TPESampler,COMPLETE
546,0.4270714968886311,2025-04-24 21:24:33.232382,2025-04-24 21:24:36.531489,0 days 00:00:03.299107,True,squared_error,42,,2,3,538,TPESampler,COMPLETE
547,0.42057549768651953,2025-04-24 21:24:33.479439,2025-04-24 21:24:37.579960,0 days 00:00:04.100521,False,squared_error,39,,1,6,552,TPESampler,COMPLETE
548,0.3528509382873143,2025-04-24 21:24:34.281134,2025-04-24 21:24:35.958976,0 days 00:00:01.677842,True,squared_error,46,,1,4,197,TPESampler,COMPLETE
549,0.34149505077826303,2025-04-24 21:24:35.076724,2025-04-24 21:24:38.203090,0 days 00:00:03.126366,True,squared_error,49,,1,3,435,TPESampler,COMPLETE
550,0.429269972385448,2025-04-24 21:24:36.147148,2025-04-24 21:24:39.609218,0 days 00:00:03.462070,False,squared_error,49,,1,2,416,TPESampler,COMPLETE
551,0.42956251594798783,2025-04-24 21:24:36.275472,2025-04-24 21:24:38.847625,0 days 00:00:02.572153,True,squared_error,50,,2,4,453,TPESampler,COMPLETE
552,0.3533622430061521,2025-04-24 21:24:36.405099,2025-04-24 21:24:39.975385,0 days 00:00:03.570286,True,squared_error,49,,1,5,615,TPESampler,COMPLETE
553,0.42816381910584783,2025-04-24 21:24:36.877774,2025-04-24 21:24:40.199408,0 days 00:00:03.321634,True,squared_error,48,,2,3,559,TPESampler,COMPLETE
554,0.3459679158777704,2025-04-24 21:24:37.781709,2025-04-24 21:25:12.177951,0 days 00:00:34.396242,True,absolute_error,50,,1,3,639,TPESampler,COMPLETE
555,0.3469408900710255,2025-04-24 21:24:38.438089,2025-04-24 21:24:41.007472,0 days 00:00:02.569383,True,squared_error,50,,1,4,411,TPESampler,COMPLETE
556,0.3417880699735418,2025-04-24 21:24:39.166598,2025-04-24 21:24:42.638482,0 days 00:00:03.471884,True,squared_error,50,,1,3,557,TPESampler,COMPLETE
557,0.3423386301463009,2025-04-24 21:24:39.836721,2025-04-24 21:24:43.418904,0 days 00:00:03.582183,True,squared_error,50,,1,3,680,TPESampler,COMPLETE
558,0.46364485167109337,2025-04-24 21:24:40.195180,2025-04-24 21:25:15.172035,0 days 00:00:34.976855,False,absolute_error,42,,2,26,729,TPESampler,COMPLETE
559,0.7029409209881033,2025-04-24 21:24:40.449213,2025-04-24 21:24:41.900027,0 days 00:00:01.450814,True,absolute_error,31,sqrt,2,10,165,TPESampler,COMPLETE
560,0.40689349754417586,2025-04-24 21:24:41.251915,2025-04-24 21:24:43.448118,0 days 00:00:02.196203,False,squared_error,50,sqrt,1,9,883,TPESampler,COMPLETE
561,0.3462142086129345,2025-04-24 21:24:42.213831,2025-04-24 21:24:45.867668,0 days 00:00:03.653837,True,squared_error,50,,1,4,612,TPESampler,COMPLETE
562,0.7534632638794726,2025-04-24 21:24:42.986194,2025-04-24 21:24:44.201442,0 days 00:00:01.215248,True,squared_error,7,sqrt,1,7,324,TPESampler,COMPLETE
563,0.34751906764893836,2025-04-24 21:24:43.649695,2025-04-24 21:24:46.247655,0 days 00:00:02.597960,True,squared_error,40,,1,4,525,TPESampler,COMPLETE
564,0.5835481454197115,2025-04-24 21:24:43.765841,2025-04-24 21:24:52.738202,0 days 00:00:08.972361,False,absolute_error,43,,4,28,388,TPESampler,COMPLETE
565,0.4285020787496997,2025-04-24 21:24:44.488005,2025-04-24 21:24:47.314979,0 days 00:00:02.826974,True,squared_error,40,,2,2,637,TPESampler,COMPLETE
