number,value,datetime_start,datetime_complete,duration,params_learning_rate,params_max_depth,params_max_features,params_min_samples_leaf,params_min_samples_split,params_n_estimators,params_subsample,system_attrs_auto:sampler,state
999,0.2839731949886818,2025-04-24 21:53:10.455100,2025-04-24 21:53:13.663337,0 days 00:00:03.208237,0.09873715831969042,9,,1,12,1018,0.7328196693124298,TPESampler,COMPLETE
1000,0.27464936021839476,2025-04-24 21:53:10.534664,2025-04-24 21:53:14.355501,0 days 00:00:03.820837,0.07623272497067317,9,,1,16,1274,0.6431148104172308,TPESampler,COMPLETE
1001,0.5746532755135255,2025-04-24 21:53:10.896052,2025-04-24 21:53:11.972286,0 days 00:00:01.076234,0.02545279497709884,7,sqrt,7,13,237,0.9507818114318836,TPESampler,COMPLETE
1002,0.32012576957324446,2025-04-24 21:53:12.414983,2025-04-24 21:53:16.003688,0 days 00:00:03.588705,0.07376220917319015,7,,3,16,1300,0.6664181427677844,TPESampler,COMPLETE
1003,0.27775125971534087,2025-04-24 21:53:13.861774,2025-04-24 21:53:16.901552,0 days 00:00:03.039778,0.07742771985228429,9,,1,17,1024,0.6620916456654057,TPESampler,COMPLETE
1004,0.28328515283124206,2025-04-24 21:53:14.566055,2025-04-24 21:53:17.045498,0 days 00:00:02.479443,0.056260901154375556,7,,1,12,887,0.7168886249288509,TPESampler,COMPLETE
1005,0.27910462111772755,2025-04-24 21:53:16.186983,2025-04-24 21:53:19.731797,0 days 00:00:03.544814,0.09506870216014922,8,,1,14,1149,0.6807577606029825,TPESampler,COMPLETE
1006,0.2934015562139334,2025-04-24 21:53:17.091365,2025-04-24 21:53:20.577373,0 days 00:00:03.486008,0.05124143744127265,6,,1,6,1213,0.6955927449631278,TPESampler,COMPLETE
1007,0.7205420677128621,2025-04-24 21:53:17.259216,2025-04-24 21:53:18.173273,0 days 00:00:00.914057,0.08186692552480856,10,log2,6,16,145,0.9309626104579032,TPESampler,COMPLETE
1008,0.7686296497020273,2025-04-24 21:53:18.360209,2025-04-24 21:53:19.403304,0 days 00:00:01.043095,0.02902740019978856,12,log2,5,19,337,0.6061422153157113,TPESampler,COMPLETE
1009,0.2860234669991847,2025-04-24 21:53:19.605547,2025-04-24 21:53:22.510661,0 days 00:00:02.905114,0.05079911126132293,8,,1,20,1053,0.6613859267043655,TPESampler,COMPLETE
1010,0.3318816666566277,2025-04-24 21:53:19.958263,2025-04-24 21:53:23.069882,0 days 00:00:03.111619,0.050474573382681506,8,,2,8,995,0.7206001831457014,TPESampler,COMPLETE
1011,0.3444874729874996,2025-04-24 21:53:20.862842,2025-04-24 21:53:24.280753,0 days 00:00:03.417911,0.06639265015121437,8,,2,7,1253,0.6714350942540109,TPESampler,COMPLETE
1012,0.27836246482105614,2025-04-24 21:53:22.711011,2025-04-24 21:53:26.320088,0 days 00:00:03.609077,0.06227143975123997,8,,1,13,1108,0.7146978981362804,TPESampler,COMPLETE
1013,0.3502217952709507,2025-04-24 21:53:23.271527,2025-04-24 21:53:25.637474,0 days 00:00:02.365947,0.07975412226983723,9,log2,1,19,1217,0.7124483191742111,TPESampler,COMPLETE
1014,0.34809638466713466,2025-04-24 21:53:24.476793,2025-04-24 21:53:28.736501,0 days 00:00:04.259708,0.06163254354365517,8,,3,9,1330,0.6800442443814103,TPESampler,COMPLETE
1015,0.3442037035715159,2025-04-24 21:53:25.838086,2025-04-24 21:53:28.377072,0 days 00:00:02.538986,0.06595086784877237,4,sqrt,1,10,1284,0.6747092387665249,TPESampler,COMPLETE
1016,0.3139798137704484,2025-04-24 21:53:26.549631,2025-04-24 21:53:29.213260,0 days 00:00:02.663629,0.0944975532141789,10,log2,1,11,1167,0.7881825399048675,TPESampler,COMPLETE
1017,0.3189792278495463,2025-04-24 21:53:28.576453,2025-04-24 21:53:31.727854,0 days 00:00:03.151401,0.049286994235169,6,,2,11,1176,0.7071064243867153,TPESampler,COMPLETE
1018,0.370352285382403,2025-04-24 21:53:28.969173,2025-04-24 21:53:32.149903,0 days 00:00:03.180730,0.09336565862558542,9,,2,7,1196,0.6200779125272629,TPESampler,COMPLETE
1019,0.3487882908317053,2025-04-24 21:53:29.465562,2025-04-24 21:53:32.837725,0 days 00:00:03.372163,0.05942222948771168,8,,3,13,1263,0.7601793067529468,TPESampler,COMPLETE
1020,0.6488230148052117,2025-04-24 21:53:31.927158,2025-04-24 21:53:33.606822,0 days 00:00:01.679664,0.08335839949682679,3,sqrt,9,5,837,0.9068004698886608,TPESampler,COMPLETE
1021,0.27901664012648636,2025-04-24 21:53:32.382719,2025-04-24 21:53:36.681106,0 days 00:00:04.298387,0.048242011915676335,6,,1,10,1280,0.7693423826136758,TPESampler,COMPLETE
1022,0.3267035603429829,2025-04-24 21:53:33.065314,2025-04-24 21:53:37.431383,0 days 00:00:04.366069,0.051959129429037805,9,,3,17,1336,0.6929562764374188,TPESampler,COMPLETE
1023,0.6672044143819864,2025-04-24 21:53:33.804994,2025-04-24 21:53:36.156721,0 days 00:00:02.351727,0.014309976721587825,3,sqrt,10,8,1265,0.9784652133969648,TPESampler,COMPLETE
1024,0.2997688433904922,2025-04-24 21:53:36.358312,2025-04-24 21:53:40.322127,0 days 00:00:03.963815,0.07929263095716614,5,,1,4,1177,0.7578765299787366,TPESampler,COMPLETE
1025,0.40805249234995516,2025-04-24 21:53:36.914045,2025-04-24 21:53:38.294163,0 days 00:00:01.380118,0.08807544877530038,4,log2,1,15,483,0.9393199478823899,TPESampler,COMPLETE
1026,0.6785705543665622,2025-04-24 21:53:37.663756,2025-04-24 21:53:40.068838,0 days 00:00:02.405082,0.05896214322024919,9,log2,10,13,1234,0.985728791305563,TPESampler,COMPLETE
1027,0.656963405532232,2025-04-24 21:53:38.498050,2025-04-24 21:53:40.974029,0 days 00:00:02.475979,0.09254908137329622,5,sqrt,9,20,1073,0.8570420995756615,TPESampler,COMPLETE
1028,0.2871588632349593,2025-04-24 21:53:40.272992,2025-04-24 21:53:43.996378,0 days 00:00:03.723386,0.07450118121933731,9,,1,8,1032,0.7399147884358731,TPESampler,COMPLETE
1029,0.6770648838929018,2025-04-24 21:53:40.618328,2025-04-24 21:53:43.448556,0 days 00:00:02.830228,0.03745452481985091,6,,9,4,1084,0.6058606203217511,TPESampler,COMPLETE
1030,0.6852862382730059,2025-04-24 21:53:41.213541,2025-04-24 21:53:44.366173,0 days 00:00:03.152632,0.05735253475614657,5,,10,2,1240,0.7662685592246959,TPESampler,COMPLETE
1031,0.2686013122686094,2025-04-24 21:53:43.642112,2025-04-24 21:53:48.049605,0 days 00:00:04.407493,0.05605500722600482,8,,1,10,1455,0.6258452146207135,TPESampler,COMPLETE
1032,0.32090329423197933,2025-04-24 21:53:44.295471,2025-04-24 21:53:46.492650,0 days 00:00:02.197179,0.08331315046198537,10,log2,1,11,1131,0.6050300152752154,TPESampler,COMPLETE
1033,0.2722251843093994,2025-04-24 21:53:44.664836,2025-04-24 21:53:48.921891,0 days 00:00:04.257055,0.049459388634461456,9,,1,15,1288,0.6766147967318181,TPESampler,COMPLETE
1034,0.6352337666923825,2025-04-24 21:53:46.679975,2025-04-24 21:53:48.020918,0 days 00:00:01.340943,0.0316840513408994,7,log2,5,16,594,0.7195006882379104,TPESampler,COMPLETE
1035,0.3717365383662472,2025-04-24 21:53:48.167577,2025-04-24 21:53:50.732358,0 days 00:00:02.564781,0.061567028432986094,12,log2,2,16,1042,0.7158965201055083,TPESampler,COMPLETE
1036,0.3184547238383546,2025-04-24 21:53:48.214196,2025-04-24 21:53:50.979355,0 days 00:00:02.765159,0.07673813872413758,9,sqrt,1,13,992,0.6059028678349911,TPESampler,COMPLETE
1037,0.27176790024321656,2025-04-24 21:53:49.164427,2025-04-24 21:53:52.444332,0 days 00:00:03.279905,0.06286483186856025,7,,1,9,953,0.6906901158078299,TPESampler,COMPLETE
1038,0.33308733071737223,2025-04-24 21:53:50.937962,2025-04-24 21:53:54.075116,0 days 00:00:03.137154,0.07764429382863211,6,,2,8,1241,0.6091048890578555,TPESampler,COMPLETE
1039,0.27723887898691774,2025-04-24 21:53:51.188798,2025-04-24 21:53:55.020481,0 days 00:00:03.831683,0.065450889799332,9,,1,16,1309,0.6986598838259903,TPESampler,COMPLETE
1040,0.2784746744710739,2025-04-24 21:53:52.635077,2025-04-24 21:53:56.461882,0 days 00:00:03.826805,0.05355769119988157,10,,1,10,1321,0.6673214236546753,TPESampler,COMPLETE
1041,0.2757517389536705,2025-04-24 21:53:54.266216,2025-04-24 21:53:57.686189,0 days 00:00:03.419973,0.05182677863975939,10,,1,18,1072,0.7645332881403987,TPESampler,COMPLETE
1042,0.2866685021428766,2025-04-24 21:53:55.247725,2025-04-24 21:53:58.859228,0 days 00:00:03.611503,0.08079316969559969,10,,1,9,1193,0.6819017035091465,TPESampler,COMPLETE
1043,0.2752830114198972,2025-04-24 21:53:56.648751,2025-04-24 21:53:59.764910,0 days 00:00:03.116159,0.08310784519424617,7,,1,14,1063,0.7190454013425757,TPESampler,COMPLETE
1044,0.2860179492683265,2025-04-24 21:53:57.882103,2025-04-24 21:54:01.569967,0 days 00:00:03.687864,0.059217072039249724,10,,1,8,1236,0.7146240979628865,TPESampler,COMPLETE
1045,0.3660872683766686,2025-04-24 21:53:59.069402,2025-04-24 21:54:02.345439,0 days 00:00:03.276037,0.0885476034481435,9,,3,13,1080,0.7789780792384523,TPESampler,COMPLETE
1046,0.27714363528660413,2025-04-24 21:53:59.969145,2025-04-24 21:54:02.921284,0 days 00:00:02.952139,0.06015629131774328,8,,1,16,915,0.7769357391396832,TPESampler,COMPLETE
1047,0.2754813332694957,2025-04-24 21:54:01.758989,2025-04-24 21:54:05.434953,0 days 00:00:03.675964,0.0697251966487686,9,,1,10,1131,0.6748707480534741,TPESampler,COMPLETE
1048,0.2858129293113668,2025-04-24 21:54:02.547671,2025-04-24 21:54:07.268851,0 days 00:00:04.721180,0.0674800584782468,10,,1,7,1448,0.6379055028549567,TPESampler,COMPLETE
1049,0.358955577597342,2025-04-24 21:54:03.137925,2025-04-24 21:54:05.260183,0 days 00:00:02.122258,0.0785949426712967,6,log2,1,19,1267,0.6896484761135734,TPESampler,COMPLETE
1050,0.3389264584952371,2025-04-24 21:54:05.458275,2025-04-24 21:54:08.033688,0 days 00:00:02.575413,0.07266873142700586,8,,3,10,705,0.7588437026793019,TPESampler,COMPLETE
1051,0.34589827556317965,2025-04-24 21:54:05.659548,2025-04-24 21:54:07.939269,0 days 00:00:02.279721,0.09040940737389465,7,sqrt,3,10,946,0.9716347815145041,TPESampler,COMPLETE
1052,0.3629563727388721,2025-04-24 21:54:07.475915,2025-04-24 21:54:10.771211,0 days 00:00:03.295296,0.08153472613857732,8,,2,2,1079,0.7591567168543394,TPESampler,COMPLETE
1053,0.2659401220301201,2025-04-24 21:54:08.177988,2025-04-24 21:54:12.180589,0 days 00:00:04.002601,0.09936062275713349,7,,1,9,1341,0.6172161341464837,TPESampler,COMPLETE
1054,0.300517170112793,2025-04-24 21:54:08.269235,2025-04-24 21:54:12.178995,0 days 00:00:03.909760,0.04391859318609235,8,,1,6,1204,0.8086308002191301,TPESampler,COMPLETE
1055,0.3365756028942047,2025-04-24 21:54:10.986349,2025-04-24 21:54:14.481740,0 days 00:00:03.495391,0.07384807532447449,8,,3,12,1222,0.6602974346868633,TPESampler,COMPLETE
1056,0.29733212603789966,2025-04-24 21:54:12.348851,2025-04-24 21:54:15.718347,0 days 00:00:03.369496,0.07779638915207832,9,sqrt,1,12,1499,0.6215077913599983,TPESampler,COMPLETE
1057,0.2982875583155484,2025-04-24 21:54:12.393014,2025-04-24 21:54:15.797386,0 days 00:00:03.404372,0.07646691312468991,8,sqrt,1,4,1349,0.6295682887103741,TPESampler,COMPLETE
1058,0.3459355033630821,2025-04-24 21:54:14.688190,2025-04-24 21:54:18.855901,0 days 00:00:04.167711,0.07107162786464609,7,,3,8,1343,0.623922078539443,TPESampler,COMPLETE
1059,0.35832201286428206,2025-04-24 21:54:15.867432,2025-04-24 21:54:19.459584,0 days 00:00:03.592152,0.08962275031302129,4,,2,4,1302,0.6517637654789012,TPESampler,COMPLETE
1060,0.3289557982489393,2025-04-24 21:54:16.008575,2025-04-24 21:54:18.522644,0 days 00:00:02.514069,0.07078668734250868,7,log2,1,8,1224,0.7202765723524596,TPESampler,COMPLETE
1061,0.2923917993824897,2025-04-24 21:54:18.719506,2025-04-24 21:54:22.141079,0 days 00:00:03.421573,0.0939955308797861,8,,1,5,1241,0.7260725559938769,TPESampler,COMPLETE
1062,0.3312461706100678,2025-04-24 21:54:19.055981,2025-04-24 21:54:22.083413,0 days 00:00:03.027432,0.06268906510998758,7,,3,14,1138,0.6291749419552134,TPESampler,COMPLETE
1063,0.29287816217964135,2025-04-24 21:54:19.674338,2025-04-24 21:54:22.964441,0 days 00:00:03.290103,0.092891385388847,8,,1,8,1212,0.6055047238881598,TPESampler,COMPLETE
1064,0.27627213294337666,2025-04-24 21:54:22.249107,2025-04-24 21:54:25.609453,0 days 00:00:03.360346,0.09334035204609403,9,,1,8,1134,0.6316136722199555,TPESampler,COMPLETE
1065,0.7109170171335448,2025-04-24 21:54:22.292916,2025-04-24 21:54:25.380018,0 days 00:00:03.087102,0.06502670212496116,10,,10,14,1164,0.6006728643852157,TPESampler,COMPLETE
1066,0.2724686359951667,2025-04-24 21:54:23.190093,2025-04-24 21:54:26.874127,0 days 00:00:03.684034,0.08222892346992146,8,,1,7,1375,0.6085318147604382,TPESampler,COMPLETE
1067,0.31832226693659527,2025-04-24 21:54:25.570634,2025-04-24 21:54:29.021937,0 days 00:00:03.451303,0.07834363608816462,6,,2,14,1328,0.6108954537581226,TPESampler,COMPLETE
1068,0.42690584077142213,2025-04-24 21:54:25.839036,2025-04-24 21:54:27.018828,0 days 00:00:01.179792,0.03912945439570827,7,log2,1,17,362,0.8223686421042657,TPESampler,COMPLETE
1069,0.2729573302434864,2025-04-24 21:54:27.072727,2025-04-24 21:54:30.461653,0 days 00:00:03.388926,0.08797334669319766,7,,1,8,1323,0.6645256826908346,TPESampler,COMPLETE
1070,0.26869531249342715,2025-04-24 21:54:27.248230,2025-04-24 21:54:30.489813,0 days 00:00:03.241583,0.08621876576794191,6,,1,10,1252,0.6508893614496172,TPESampler,COMPLETE
1071,0.37448113538699196,2025-04-24 21:54:29.215653,2025-04-24 21:54:32.977556,0 days 00:00:03.761903,0.07636333016637999,9,,3,9,1448,0.6553677542715596,TPESampler,COMPLETE
1072,0.3500797677080415,2025-04-24 21:54:30.604765,2025-04-24 21:54:34.176094,0 days 00:00:03.571329,0.09397718692462594,7,,3,11,1334,0.6306086959270266,TPESampler,COMPLETE
1073,0.334980472672048,2025-04-24 21:54:30.653541,2025-04-24 21:54:34.177676,0 days 00:00:03.524135,0.09532344715564164,6,,2,10,1276,0.6574331774104166,TPESampler,COMPLETE
1074,0.32460576241694655,2025-04-24 21:54:33.180050,2025-04-24 21:54:34.790069,0 days 00:00:01.610019,0.06558156444025895,11,,2,19,289,0.8877457933481725,TPESampler,COMPLETE
1075,0.6019612238412883,2025-04-24 21:54:34.309496,2025-04-24 21:54:37.834241,0 days 00:00:03.524745,0.04426954776065161,6,,9,13,1403,0.9534242270390091,TPESampler,COMPLETE
1076,0.27355196165082585,2025-04-24 21:54:34.352225,2025-04-24 21:54:37.896577,0 days 00:00:03.544352,0.06516093575440446,7,,1,15,1357,0.6555970288290934,TPESampler,COMPLETE
1077,0.27917762129089535,2025-04-24 21:54:35.070654,2025-04-24 21:54:37.663540,0 days 00:00:02.592886,0.052809214316383794,7,,1,11,1064,0.712937171090488,TPESampler,COMPLETE
1078,0.2789328057121366,2025-04-24 21:54:37.844774,2025-04-24 21:54:41.751947,0 days 00:00:03.907173,0.06105957330042167,9,,1,12,1144,0.6793718140386676,TPESampler,COMPLETE
1079,0.3983168900352496,2025-04-24 21:54:38.041679,2025-04-24 21:54:39.345159,0 days 00:00:01.303480,0.03990190937740477,12,sqrt,2,17,189,0.763382212626597,TPESampler,COMPLETE
1080,0.3439038433221604,2025-04-24 21:54:38.311157,2025-04-24 21:54:41.242342,0 days 00:00:02.931185,0.017341516343748628,12,sqrt,2,18,1470,0.6978811515670649,TPESampler,COMPLETE
1081,0.2727410481307995,2025-04-24 21:54:39.540266,2025-04-24 21:54:43.001806,0 days 00:00:03.461540,0.07494823016411292,8,,1,8,1172,0.615182556981845,TPESampler,COMPLETE
1082,0.27977524332927783,2025-04-24 21:54:41.437045,2025-04-24 21:54:45.064751,0 days 00:00:03.627706,0.06104736377371402,9,,1,9,1330,0.6307407906702804,TPESampler,COMPLETE
1083,0.2764685695210698,2025-04-24 21:54:41.967346,2025-04-24 21:54:44.665882,0 days 00:00:02.698536,0.04605080449178829,8,,1,5,990,0.6167131797903858,TPESampler,COMPLETE
1084,0.3687179720406086,2025-04-24 21:54:43.193188,2025-04-24 21:54:46.437070,0 days 00:00:03.243882,0.08823156269305737,7,,3,8,1206,0.7408755585452875,TPESampler,COMPLETE
1085,0.3421249483435347,2025-04-24 21:54:44.857873,2025-04-24 21:54:47.227547,0 days 00:00:02.369674,0.09816102317620229,6,,2,7,811,0.6166702724136596,TPESampler,COMPLETE
1086,0.3166199275725049,2025-04-24 21:54:45.269365,2025-04-24 21:54:48.413182,0 days 00:00:03.143817,0.03719002497489479,11,,3,17,1082,0.6349929758937116,TPESampler,COMPLETE
1087,0.2785876398714804,2025-04-24 21:54:46.628464,2025-04-24 21:54:50.188147,0 days 00:00:03.559683,0.07171473972725925,7,,1,9,1310,0.697141943476228,TPESampler,COMPLETE
1088,0.27043180401541733,2025-04-24 21:54:47.473118,2025-04-24 21:54:50.826302,0 days 00:00:03.353184,0.053293575584086574,8,,1,8,1153,0.6666157056508131,TPESampler,COMPLETE
1089,0.3640375409758958,2025-04-24 21:54:48.604719,2025-04-24 21:54:51.213760,0 days 00:00:02.609041,0.014300702807866432,12,,4,17,583,0.9994077179120018,TPESampler,COMPLETE
1090,0.27603512167653227,2025-04-24 21:54:50.376165,2025-04-24 21:54:54.145594,0 days 00:00:03.769429,0.0756975767845069,8,,1,10,1437,0.6262963517237558,TPESampler,COMPLETE
1091,0.2924792978837678,2025-04-24 21:54:51.176318,2025-04-24 21:54:54.767027,0 days 00:00:03.590709,0.09916596385528645,7,,1,6,1396,0.6552963144723088,TPESampler,COMPLETE
1092,0.28128227328661237,2025-04-24 21:54:51.462457,2025-04-24 21:54:55.066027,0 days 00:00:03.603570,0.063136581454118,10,,1,13,1388,0.6135214700121453,TPESampler,COMPLETE
1093,0.2966401356127607,2025-04-24 21:54:54.342718,2025-04-24 21:54:57.963958,0 days 00:00:03.621240,0.09273732933643569,5,,1,13,1480,0.7363127246015319,TPESampler,COMPLETE
1094,0.281518583673111,2025-04-24 21:54:54.992550,2025-04-24 21:54:58.263956,0 days 00:00:03.271406,0.09749945154428268,6,,1,9,1395,0.6338900400172124,TPESampler,COMPLETE
1095,0.2769128667675348,2025-04-24 21:54:55.321298,2025-04-24 21:54:58.449132,0 days 00:00:03.127834,0.09745064558343816,7,,1,14,1265,0.6375181704039043,TPESampler,COMPLETE
1096,0.34446701216839715,2025-04-24 21:54:58.161623,2025-04-24 21:55:00.494121,0 days 00:00:02.332498,0.051576151230525634,9,sqrt,3,16,1088,0.633120508012825,TPESampler,COMPLETE
1097,0.3299248762534043,2025-04-24 21:54:58.451524,2025-04-24 21:55:00.492744,0 days 00:00:02.041220,0.09157086297455862,11,log2,1,12,680,0.6915295977662481,TPESampler,COMPLETE
1098,0.27782098160483504,2025-04-24 21:54:58.737826,2025-04-24 21:55:02.971147,0 days 00:00:04.233321,0.06843524590198578,10,,1,8,1046,0.7826118004707174,TPESampler,COMPLETE
1099,0.4301597467640216,2025-04-24 21:55:00.639167,2025-04-24 21:55:02.458317,0 days 00:00:01.819150,0.034778144109402484,12,sqrt,6,3,884,0.759299086324252,TPESampler,COMPLETE
1100,0.32284241256316476,2025-04-24 21:55:00.682361,2025-04-24 21:55:03.268393,0 days 00:00:02.586032,0.09608576103629077,7,,3,15,699,0.7108768696698076,TPESampler,COMPLETE
1101,0.4053186866549808,2025-04-24 21:55:02.658650,2025-04-24 21:55:03.813191,0 days 00:00:01.154541,0.04956107887025546,4,sqrt,1,16,302,0.7561096878983806,TPESampler,COMPLETE
1102,0.3701961614646985,2025-04-24 21:55:03.194717,2025-04-24 21:55:06.870445,0 days 00:00:03.675728,0.07816805204329286,10,,3,9,1159,0.7159986454780077,TPESampler,COMPLETE
1103,0.279925491855449,2025-04-24 21:55:03.534041,2025-04-24 21:55:07.458681,0 days 00:00:03.924640,0.03884666763785749,11,,1,18,1234,0.7425676677381958,TPESampler,COMPLETE
1104,0.311745888860221,2025-04-24 21:55:04.082371,2025-04-24 21:55:07.277426,0 days 00:00:03.195055,0.025627848335506485,4,,1,3,1381,0.8251954903233566,TPESampler,COMPLETE
1105,0.37210651630591857,2025-04-24 21:55:07.064029,2025-04-24 21:55:11.547245,0 days 00:00:04.483216,0.09422851360480007,7,,4,7,1499,0.6286922863114733,TPESampler,COMPLETE
1106,0.31231951573559474,2025-04-24 21:55:07.508034,2025-04-24 21:55:10.504154,0 days 00:00:02.996120,0.09241825390841273,10,log2,1,6,1451,0.7300236247346347,TPESampler,COMPLETE
1107,0.6363329700798168,2025-04-24 21:55:07.715076,2025-04-24 21:55:09.149743,0 days 00:00:01.434667,0.07847110899982455,10,log2,6,3,373,0.7271339310236145,TPESampler,COMPLETE
1108,0.28765013207842555,2025-04-24 21:55:09.369456,2025-04-24 21:55:13.131570,0 days 00:00:03.762114,0.04509122213001709,10,,1,5,1114,0.6826375439876587,TPESampler,COMPLETE
1109,0.2857247931817205,2025-04-24 21:55:10.700205,2025-04-24 21:55:14.974565,0 days 00:00:04.274360,0.09881743868525182,11,,1,13,1203,0.7590842849812492,TPESampler,COMPLETE
1110,0.27962961741184533,2025-04-24 21:55:11.739727,2025-04-24 21:55:15.792634,0 days 00:00:04.052907,0.07779581147553873,8,,1,11,1293,0.606404114641718,TPESampler,COMPLETE
1111,0.337988352263678,2025-04-24 21:55:13.324840,2025-04-24 21:55:15.148302,0 days 00:00:01.823462,0.059785888674308965,7,sqrt,3,9,1005,0.6072640106056325,TPESampler,COMPLETE
1112,0.2767023380379556,2025-04-24 21:55:15.151720,2025-04-24 21:55:18.149963,0 days 00:00:02.998243,0.07536064324109233,8,,1,11,1016,0.7703231665659028,TPESampler,COMPLETE
1113,0.2987135639129336,2025-04-24 21:55:15.345009,2025-04-24 21:55:18.071238,0 days 00:00:02.726229,0.04305833660596033,5,,1,12,1040,0.6416049942539944,TPESampler,COMPLETE
1114,0.25948975439784827,2025-04-24 21:55:16.003432,2025-04-24 21:55:18.483088,0 days 00:00:02.479656,0.08421158195894525,8,,1,9,833,0.665387080501476,TPESampler,COMPLETE
1115,0.36916551766225636,2025-04-24 21:55:18.214713,2025-04-24 21:55:20.869538,0 days 00:00:02.654825,0.077410085614405,9,,2,6,802,0.7556329452619559,TPESampler,COMPLETE
1116,0.32063985917399734,2025-04-24 21:55:18.337539,2025-04-24 21:55:21.491667,0 days 00:00:03.154128,0.0412433604006147,12,,2,20,1035,0.6723307086579781,TPESampler,COMPLETE
1117,0.2810170072450258,2025-04-24 21:55:18.714259,2025-04-24 21:55:22.170268,0 days 00:00:03.456009,0.050941561479092415,8,,1,18,1217,0.6645005391573331,TPESampler,COMPLETE
1118,0.3415955343845624,2025-04-24 21:55:21.086830,2025-04-24 21:55:24.413138,0 days 00:00:03.326308,0.09163751862931457,7,,2,9,1031,0.6928877737369511,TPESampler,COMPLETE
1119,0.3972538526648847,2025-04-24 21:55:21.678877,2025-04-24 21:55:23.343185,0 days 00:00:01.664308,0.02031274834982288,6,sqrt,3,17,727,0.9296202527613608,TPESampler,COMPLETE
1120,0.27106635192810785,2025-04-24 21:55:22.396371,2025-04-24 21:55:25.558120,0 days 00:00:03.161749,0.057639063291838065,9,,1,13,873,0.7142814579765207,TPESampler,COMPLETE
1121,0.30911196983545475,2025-04-24 21:55:23.545628,2025-04-24 21:55:26.442932,0 days 00:00:02.897304,0.04003149589314496,11,sqrt,1,3,1356,0.8244584984360988,TPESampler,COMPLETE
1122,0.35875660614294874,2025-04-24 21:55:24.634452,2025-04-24 21:55:26.714184,0 days 00:00:02.079732,0.013729739329298433,8,sqrt,1,7,869,0.7331829013980964,TPESampler,COMPLETE
1123,0.29542546170404466,2025-04-24 21:55:25.781268,2025-04-24 21:55:28.082213,0 days 00:00:02.300945,0.0863218856267033,9,,1,12,355,0.742965553648476,TPESampler,COMPLETE
