number,value,datetime_start,datetime_complete,duration,params_learning_rate,params_max_depth,params_max_features,params_min_samples_leaf,params_min_samples_split,params_n_estimators,params_subsample,system_attrs_auto:sampler,state
749,0.27187131119283814,2025-04-24 21:48:40.131608,2025-04-24 21:48:44.090643,0 days 00:00:03.959035,0.07311996106977409,11,,1,9,1093,0.662401894793111,TPESampler,COMPLETE
750,0.3396810152710643,2025-04-24 21:48:41.074812,2025-04-24 21:48:44.646681,0 days 00:00:03.571869,0.05840471844199019,5,,2,5,1165,0.7965892978889214,TPESampler,COMPLETE
751,0.5920042082603476,2025-04-24 21:48:41.150310,2025-04-24 21:48:42.939137,0 days 00:00:01.788827,0.01621727084410513,10,,9,8,367,0.7665042267593579,TPESampler,COMPLETE
752,0.41534520109879874,2025-04-24 21:48:43.134967,2025-04-24 21:48:44.894470,0 days 00:00:01.759503,0.04557126062057794,10,sqrt,6,12,922,0.9156554259644744,TPESampler,COMPLETE
753,0.45757811765261935,2025-04-24 21:48:44.323891,2025-04-24 21:48:46.219132,0 days 00:00:01.895241,0.013261049541824084,9,,7,17,530,0.6385766395450824,TPESampler,COMPLETE
754,0.28446964514638684,2025-04-24 21:48:44.844901,2025-04-24 21:48:47.978330,0 days 00:00:03.133429,0.09847090140509096,6,,1,15,1196,0.7427294906008974,TPESampler,COMPLETE
755,0.3418433263706416,2025-04-24 21:48:45.145365,2025-04-24 21:48:48.286280,0 days 00:00:03.140915,0.0915557253366979,6,,3,10,1250,0.7132759739328405,TPESampler,COMPLETE
756,0.2708689707917679,2025-04-24 21:48:46.418229,2025-04-24 21:48:49.584910,0 days 00:00:03.166681,0.04611865339311673,10,,1,11,1178,0.6017256475979904,TPESampler,COMPLETE
757,0.27939719176223793,2025-04-24 21:48:48.187743,2025-04-24 21:48:51.021436,0 days 00:00:02.833693,0.08442804329828084,7,,1,14,1074,0.6498115055689978,TPESampler,COMPLETE
758,0.2793723038342952,2025-04-24 21:48:48.477069,2025-04-24 21:48:51.561635,0 days 00:00:03.084566,0.0673930410407755,9,,1,8,1064,0.6500188726605522,TPESampler,COMPLETE
759,0.3172373560915963,2025-04-24 21:48:49.769695,2025-04-24 21:48:52.970393,0 days 00:00:03.200698,0.03263781463687483,12,,3,20,1062,0.7362830733867899,TPESampler,COMPLETE
760,0.2846893469755338,2025-04-24 21:48:51.212179,2025-04-24 21:48:54.090532,0 days 00:00:02.878353,0.0983393533969757,9,,1,16,876,0.71285568455296,TPESampler,COMPLETE
761,0.2767447817841631,2025-04-24 21:48:51.808634,2025-04-24 21:48:54.982011,0 days 00:00:03.173377,0.09705853596088607,9,,1,11,958,0.6662917085037844,TPESampler,COMPLETE
762,0.37373945413922394,2025-04-24 21:48:53.167904,2025-04-24 21:48:55.416718,0 days 00:00:02.248814,0.08012561374509385,7,log2,2,11,1412,0.6009359093999433,TPESampler,COMPLETE
763,0.2752871955156796,2025-04-24 21:48:54.292741,2025-04-24 21:48:57.781895,0 days 00:00:03.489154,0.06320814610268469,6,,1,10,1266,0.7095737985349129,TPESampler,COMPLETE
764,0.27434693906203883,2025-04-24 21:48:55.182000,2025-04-24 21:48:59.043850,0 days 00:00:03.861850,0.05119387752357011,8,,1,14,1411,0.7294072028745748,TPESampler,COMPLETE
765,0.2720061743016168,2025-04-24 21:48:55.712807,2025-04-24 21:48:58.405752,0 days 00:00:02.692945,0.05583236593578694,9,,1,10,987,0.6457935040379612,TPESampler,COMPLETE
766,0.2725774204231749,2025-04-24 21:48:57.980020,2025-04-24 21:49:01.153151,0 days 00:00:03.173131,0.0726885776354266,8,,1,10,962,0.6284818398840245,TPESampler,COMPLETE
767,0.3766369548313156,2025-04-24 21:48:58.615063,2025-04-24 21:49:00.606507,0 days 00:00:01.991444,0.09680546577841853,8,log2,2,6,1132,0.6862195807708961,TPESampler,COMPLETE
768,0.26783699681086043,2025-04-24 21:48:59.249162,2025-04-24 21:49:04.012858,0 days 00:00:04.763696,0.0698717569499464,9,,1,8,1275,0.7121820957221483,TPESampler,COMPLETE
769,0.5982195250426389,2025-04-24 21:49:00.791053,2025-04-24 21:49:01.778481,0 days 00:00:00.987428,0.05332918444265358,7,sqrt,7,4,253,0.6757364919056255,TPESampler,COMPLETE
770,0.345980792859733,2025-04-24 21:49:01.343324,2025-04-24 21:49:04.315103,0 days 00:00:02.971779,0.06806683139418492,7,log2,1,17,1497,0.8128401710982246,TPESampler,COMPLETE
771,0.36835018543096193,2025-04-24 21:49:01.973585,2025-04-24 21:49:04.852070,0 days 00:00:02.878485,0.09513095966248634,7,log2,2,13,1487,0.7281170042579818,TPESampler,COMPLETE
772,0.7616919518011861,2025-04-24 21:49:04.240396,2025-04-24 21:49:05.450468,0 days 00:00:01.210072,0.06927109439805786,11,log2,10,6,358,0.8889459286807206,TPESampler,COMPLETE
773,0.3908143291154165,2025-04-24 21:49:04.589232,2025-04-24 21:49:06.950069,0 days 00:00:02.360837,0.03425782214722139,8,log2,3,5,1342,0.9747245105488642,TPESampler,COMPLETE
774,0.26808457977138855,2025-04-24 21:49:05.103032,2025-04-24 21:49:09.053182,0 days 00:00:03.950150,0.09431788882996692,9,,1,8,1199,0.6926089401635638,TPESampler,COMPLETE
775,0.2912659784795759,2025-04-24 21:49:05.674724,2025-04-24 21:49:09.394978,0 days 00:00:03.720254,0.05218739309207512,12,,1,20,1043,0.7602380467513019,TPESampler,COMPLETE
776,0.6180539677319965,2025-04-24 21:49:07.142355,2025-04-24 21:49:09.167990,0 days 00:00:02.025635,0.010402209215562822,3,,10,4,987,0.7190210362674614,TPESampler,COMPLETE
777,0.27864498204957083,2025-04-24 21:49:09.221800,2025-04-24 21:49:13.467952,0 days 00:00:04.246152,0.06732197656378375,11,,1,9,1173,0.6237514792776421,TPESampler,COMPLETE
778,0.32658728490343436,2025-04-24 21:49:09.362609,2025-04-24 21:49:11.559608,0 days 00:00:02.196999,0.0586598329646732,5,sqrt,1,10,1115,0.8197315464569366,TPESampler,COMPLETE
779,0.42492020218609783,2025-04-24 21:49:09.605668,2025-04-24 21:49:10.963597,0 days 00:00:01.357929,0.012070872863079602,12,sqrt,1,12,288,0.7654443046131889,TPESampler,COMPLETE
780,0.6418510707191629,2025-04-24 21:49:11.171177,2025-04-24 21:49:12.481935,0 days 00:00:01.310758,0.038487325202781426,8,log2,3,14,188,0.6901605537929909,TPESampler,COMPLETE
781,0.3351939182124368,2025-04-24 21:49:12.052935,2025-04-24 21:49:14.582260,0 days 00:00:02.529325,0.09264806354209067,10,sqrt,2,6,1275,0.6098429966174412,TPESampler,COMPLETE
782,0.28566913341022554,2025-04-24 21:49:12.923054,2025-04-24 21:49:16.441306,0 days 00:00:03.518252,0.07795645132877033,7,,1,7,1214,0.6303517654137053,TPESampler,COMPLETE
783,0.28228828689560714,2025-04-24 21:49:13.671267,2025-04-24 21:49:17.570361,0 days 00:00:03.899094,0.05268047992857786,10,,1,8,1193,0.7337023477644153,TPESampler,COMPLETE
784,0.28664699351147654,2025-04-24 21:49:14.775782,2025-04-24 21:49:18.160710,0 days 00:00:03.384928,0.09186282074401281,9,,1,6,1097,0.6990428673692964,TPESampler,COMPLETE
785,0.43352098482230883,2025-04-24 21:49:16.637730,2025-04-24 21:49:17.660114,0 days 00:00:01.022384,0.023445037819572436,12,sqrt,4,3,357,0.8882578882789857,TPESampler,COMPLETE
786,0.29955011405492077,2025-04-24 21:49:17.735296,2025-04-24 21:49:21.544387,0 days 00:00:03.809091,0.04883122791219671,7,,1,5,1478,0.8177046089056099,TPESampler,COMPLETE
787,0.3537761442190658,2025-04-24 21:49:17.821584,2025-04-24 21:49:21.301504,0 days 00:00:03.479920,0.07683421117604769,8,,2,9,1296,0.6543728604051964,TPESampler,COMPLETE
788,0.3256581185875915,2025-04-24 21:49:18.410963,2025-04-24 21:49:21.705604,0 days 00:00:03.294641,0.06049395194131824,8,,2,17,1287,0.7176984043027909,TPESampler,COMPLETE
789,0.27429405774058785,2025-04-24 21:49:21.488440,2025-04-24 21:49:24.611409,0 days 00:00:03.122969,0.0754311626039173,8,,1,20,1258,0.7339172363788095,TPESampler,COMPLETE
790,0.35573442345404316,2025-04-24 21:49:21.779335,2025-04-24 21:49:24.697614,0 days 00:00:02.918279,0.072048186959141,8,,3,7,1140,0.682989849662329,TPESampler,COMPLETE
791,0.37887968318470305,2025-04-24 21:49:21.926543,2025-04-24 21:49:25.305999,0 days 00:00:03.379456,0.08793946089864206,11,,3,9,1300,0.6002609093711818,TPESampler,COMPLETE
792,0.67927829483502,2025-04-24 21:49:24.761494,2025-04-24 21:49:27.107852,0 days 00:00:02.346358,0.010382513293951186,3,sqrt,10,15,1246,0.7853777328592431,TPESampler,COMPLETE
793,0.3476083500706267,2025-04-24 21:49:24.888928,2025-04-24 21:49:27.538092,0 days 00:00:02.649164,0.033048211911814465,12,sqrt,3,20,1064,0.6787357277371169,TPESampler,COMPLETE
794,0.3849517932266664,2025-04-24 21:49:25.551721,2025-04-24 21:49:30.729858,0 days 00:00:05.178137,0.07451536807712865,10,,2,4,1450,0.7253616948173149,TPESampler,COMPLETE
795,0.3913819609820948,2025-04-24 21:49:27.309458,2025-04-24 21:49:31.583410,0 days 00:00:04.273952,0.09342032385296566,7,,5,11,1478,0.8488731276950271,TPESampler,COMPLETE
796,0.6461462922331209,2025-04-24 21:49:27.769244,2025-04-24 21:49:29.340272,0 days 00:00:01.571028,0.08985837171093614,9,sqrt,10,2,852,0.6069431443126873,TPESampler,COMPLETE
797,0.29588083632242695,2025-04-24 21:49:29.552109,2025-04-24 21:49:33.262598,0 days 00:00:03.710489,0.05971754826878015,8,,1,2,1271,0.6820547614566489,TPESampler,COMPLETE
798,0.28456988874074124,2025-04-24 21:49:30.945042,2025-04-24 21:49:34.635658,0 days 00:00:03.690616,0.06232641157536907,9,,1,6,1318,0.6787744210936736,TPESampler,COMPLETE
799,0.30133216802866586,2025-04-24 21:49:31.796429,2025-04-24 21:49:34.579421,0 days 00:00:02.782992,0.08752849111020845,9,,1,7,1001,0.6301023147457677,TPESampler,COMPLETE
800,0.2638115713156202,2025-04-24 21:49:33.460591,2025-04-24 21:49:36.571635,0 days 00:00:03.111044,0.06517480483023316,8,,1,13,1013,0.7302089795814525,TPESampler,COMPLETE
801,0.8414096963482898,2025-04-24 21:49:34.741744,2025-04-24 21:49:36.395995,0 days 00:00:01.654251,0.011614886878375532,12,log2,8,15,661,0.6399086144542091,TPESampler,COMPLETE
802,0.36819125258872504,2025-04-24 21:49:34.792223,2025-04-24 21:49:38.717983,0 days 00:00:03.925760,0.0789250108295811,9,,2,9,1153,0.7032935280144956,TPESampler,COMPLETE
803,0.791733320387192,2025-04-24 21:49:36.666339,2025-04-24 21:49:38.367535,0 days 00:00:01.701196,0.012432506345901366,3,log2,10,9,791,0.9978179494453768,TPESampler,COMPLETE
804,0.2776186443648081,2025-04-24 21:49:36.800184,2025-04-24 21:49:41.285515,0 days 00:00:04.485331,0.05545438227661633,7,,1,12,1474,0.7309000576586548,TPESampler,COMPLETE
805,0.31072407865139884,2025-04-24 21:49:38.571156,2025-04-24 21:49:41.517950,0 days 00:00:02.946794,0.03604261559978741,9,,2,15,987,0.7493754599999106,TPESampler,COMPLETE
806,0.2802136977209223,2025-04-24 21:49:38.913648,2025-04-24 21:49:41.259581,0 days 00:00:02.345933,0.0634317304969984,9,,1,12,737,0.7740489040679462,TPESampler,COMPLETE
807,0.31438837480510623,2025-04-24 21:49:41.414133,2025-04-24 21:49:44.141172,0 days 00:00:02.727039,0.04970248934564482,7,,3,16,1013,0.7238010920190373,TPESampler,COMPLETE
808,0.3262115296274543,2025-04-24 21:49:41.461942,2025-04-24 21:49:44.488728,0 days 00:00:03.026786,0.056751878398215036,9,,3,16,1041,0.7158494659665348,TPESampler,COMPLETE
809,0.2772732950820085,2025-04-24 21:49:41.752961,2025-04-24 21:49:44.871505,0 days 00:00:03.118544,0.05578330413087907,6,,1,14,1151,0.7084537517592983,TPESampler,COMPLETE
810,0.27368979760788276,2025-04-24 21:49:44.362383,2025-04-24 21:49:48.395742,0 days 00:00:04.033359,0.07158143049913888,8,,1,11,1449,0.673863218370456,TPESampler,COMPLETE
811,0.32486205279725805,2025-04-24 21:49:44.705479,2025-04-24 21:49:47.508996,0 days 00:00:02.803517,0.07999579631761548,7,,2,14,973,0.7424354909233439,TPESampler,COMPLETE
812,0.8299863859036932,2025-04-24 21:49:45.101446,2025-04-24 21:49:45.956925,0 days 00:00:00.855479,0.02567922017300198,3,log2,2,8,132,0.7807338548784764,TPESampler,COMPLETE
813,0.41487564316160896,2025-04-24 21:49:46.157034,2025-04-24 21:49:49.254810,0 days 00:00:03.097776,0.045146744362789766,3,,6,3,1257,0.8988630795759407,TPESampler,COMPLETE
814,0.2761279680793863,2025-04-24 21:49:47.703293,2025-04-24 21:49:51.499778,0 days 00:00:03.796485,0.09424164728085047,8,,1,16,1400,0.6162571753577866,TPESampler,COMPLETE
815,0.30314395876848993,2025-04-24 21:49:48.588083,2025-04-24 21:49:52.391554,0 days 00:00:03.803471,0.08731562603617078,8,,1,6,1351,0.8109388134167336,TPESampler,COMPLETE
816,0.2819421155548694,2025-04-24 21:49:49.440162,2025-04-24 21:49:53.418999,0 days 00:00:03.978837,0.05656719485416843,10,,1,10,1467,0.611748246462585,TPESampler,COMPLETE
817,0.2846130408382457,2025-04-24 21:49:51.720274,2025-04-24 21:49:56.044117,0 days 00:00:04.323843,0.09539148282011413,10,,1,6,1362,0.7330404245549883,TPESampler,COMPLETE
818,0.35476986586291354,2025-04-24 21:49:52.599682,2025-04-24 21:49:55.312688,0 days 00:00:02.713006,0.05857019881261239,7,,4,10,979,0.7112171784716492,TPESampler,COMPLETE
819,0.27668706112066005,2025-04-24 21:49:53.607093,2025-04-24 21:49:56.979366,0 days 00:00:03.372273,0.06777778685131633,8,,1,8,1103,0.7397414317685961,TPESampler,COMPLETE
820,0.281055839246023,2025-04-24 21:49:55.507208,2025-04-24 21:49:59.213479,0 days 00:00:03.706271,0.07256177771772612,9,,1,15,1205,0.6737056511541023,TPESampler,COMPLETE
821,0.34604977170355794,2025-04-24 21:49:56.257656,2025-04-24 21:49:59.856100,0 days 00:00:03.598444,0.07427769882495383,9,,2,11,1111,0.7349485246208309,TPESampler,COMPLETE
822,0.3309381766763063,2025-04-24 21:49:57.170911,2025-04-24 21:49:59.764461,0 days 00:00:02.593550,0.09124036941495287,8,sqrt,3,8,1491,0.6780725005417967,TPESampler,COMPLETE
823,0.2706358608607226,2025-04-24 21:49:59.432871,2025-04-24 21:50:03.631567,0 days 00:00:04.198696,0.09450603996145282,7,,1,20,1393,0.6967303646871202,TPESampler,COMPLETE
824,0.2777656896615979,2025-04-24 21:50:00.025518,2025-04-24 21:50:04.300122,0 days 00:00:04.274604,0.08885841966746859,8,,1,7,1263,0.6470073466605524,TPESampler,COMPLETE
825,0.39674649230237297,2025-04-24 21:50:00.111257,2025-04-24 21:50:02.701060,0 days 00:00:02.589803,0.06705115424858374,10,log2,4,9,1462,0.7075287053830362,TPESampler,COMPLETE
826,0.8441011091701112,2025-04-24 21:50:02.891018,2025-04-24 21:50:04.084687,0 days 00:00:01.193669,0.010004837802174591,7,log2,5,16,437,0.7879636196640503,TPESampler,COMPLETE
827,0.35121443805131247,2025-04-24 21:50:04.021754,2025-04-24 21:50:07.692827,0 days 00:00:03.671073,0.08984395779576655,7,,3,10,1198,0.6224199046254356,TPESampler,COMPLETE
828,0.27721781264808165,2025-04-24 21:50:04.429850,2025-04-24 21:50:08.689010,0 days 00:00:04.259160,0.09590852164331105,9,,1,16,1067,0.7762615653934258,TPESampler,COMPLETE
829,0.4027549504792564,2025-04-24 21:50:04.749840,2025-04-24 21:50:07.178989,0 days 00:00:02.429149,0.06342253824997166,8,sqrt,6,3,1113,0.7772512957828627,TPESampler,COMPLETE
830,0.27751459648840593,2025-04-24 21:50:07.476496,2025-04-24 21:50:10.889011,0 days 00:00:03.412515,0.06576892262396021,7,,1,16,1354,0.6923000477273149,TPESampler,COMPLETE
831,0.3610534253371286,2025-04-24 21:50:07.907688,2025-04-24 21:50:11.375140,0 days 00:00:03.467452,0.08514600128033385,8,,4,18,1302,0.7860457886366724,TPESampler,COMPLETE
832,0.2831673480565227,2025-04-24 21:50:08.882541,2025-04-24 21:50:12.256321,0 days 00:00:03.373780,0.05997700066626511,7,,1,14,1243,0.7404854043758653,TPESampler,COMPLETE
833,0.2879217178100146,2025-04-24 21:50:11.080539,2025-04-24 21:50:14.551183,0 days 00:00:03.470644,0.08578381077526089,7,,1,8,1150,0.7504293114580524,TPESampler,COMPLETE
834,0.43862419582239415,2025-04-24 21:50:11.745505,2025-04-24 21:50:13.602579,0 days 00:00:01.857074,0.04726614467477447,9,,7,15,527,0.6410966737788293,TPESampler,COMPLETE
835,0.3409718156063186,2025-04-24 21:50:12.486923,2025-04-24 21:50:16.008742,0 days 00:00:03.521819,0.08605253299094884,6,,3,12,1153,0.6919807752315869,TPESampler,COMPLETE
836,0.4628359379406936,2025-04-24 21:50:13.796250,2025-04-24 21:50:15.975875,0 days 00:00:02.179625,0.06035029102020538,4,log2,7,20,1270,0.9085237382730275,TPESampler,COMPLETE
837,0.44924981308892525,2025-04-24 21:50:14.776279,2025-04-24 21:50:16.807022,0 days 00:00:02.030743,0.017511047077719007,8,sqrt,6,20,811,0.8883943565540167,TPESampler,COMPLETE
838,0.36507849602222975,2025-04-24 21:50:16.138565,2025-04-24 21:50:18.695170,0 days 00:00:02.556605,0.034485331333468726,6,sqrt,2,19,1302,0.7456748229977169,TPESampler,COMPLETE
839,0.3151665109537047,2025-04-24 21:50:16.181691,2025-04-24 21:50:19.489182,0 days 00:00:03.307491,0.04342578092663484,7,,2,12,907,0.708461481472298,TPESampler,COMPLETE
840,0.288429479505319,2025-04-24 21:50:17.046338,2025-04-24 21:50:20.529172,0 days 00:00:03.482834,0.06428107031170016,9,,1,14,984,0.7729582854323113,TPESampler,COMPLETE
841,0.29344724291055935,2025-04-24 21:50:18.903185,2025-04-24 21:50:22.476460,0 days 00:00:03.573275,0.05587371309576301,6,,1,9,1172,0.8022578990871634,TPESampler,COMPLETE
842,0.3432344460597172,2025-04-24 21:50:19.725083,2025-04-24 21:50:21.420246,0 days 00:00:01.695163,0.04259159446712018,6,sqrt,1,12,842,0.7151043288020762,TPESampler,COMPLETE
843,0.5426962417242102,2025-04-24 21:50:20.830691,2025-04-24 21:50:25.082095,0 days 00:00:04.251404,0.011205885524466386,7,,8,13,1457,0.6502437539657564,TPESampler,COMPLETE
844,0.38360218044755506,2025-04-24 21:50:21.604009,2025-04-24 21:50:23.645369,0 days 00:00:02.041360,0.05758830981747508,9,sqrt,4,8,1052,0.7432457684587216,TPESampler,COMPLETE
845,0.5337964426361415,2025-04-24 21:50:22.689797,2025-04-24 21:50:23.724184,0 days 00:00:01.034387,0.06854366226965229,3,sqrt,7,20,175,0.9163069806837794,TPESampler,COMPLETE
846,0.28302895201874995,2025-04-24 21:50:23.810765,2025-04-24 21:50:27.651586,0 days 00:00:03.840821,0.08502363845518932,5,,1,11,1351,0.6408326844435727,TPESampler,COMPLETE
847,0.32185891311902876,2025-04-24 21:50:23.892413,2025-04-24 21:50:26.755384,0 days 00:00:02.862971,0.09292654694859151,6,sqrt,1,13,1374,0.7587490739945519,TPESampler,COMPLETE
848,0.2704911909114872,2025-04-24 21:50:25.284565,2025-04-24 21:50:29.272435,0 days 00:00:03.987870,0.08035967744383532,7,,1,11,1325,0.7041465170997745,TPESampler,COMPLETE
849,0.28011169947268183,2025-04-24 21:50:26.962425,2025-04-24 21:50:31.149259,0 days 00:00:04.186834,0.07326617952211395,9,,1,8,1319,0.7409946466655247,TPESampler,COMPLETE
850,0.4905201373537561,2025-04-24 21:50:27.848605,2025-04-24 21:50:29.379482,0 days 00:00:01.530877,0.036823855387894476,11,log2,5,11,847,0.847415243770353,TPESampler,COMPLETE
851,0.27545301163967273,2025-04-24 21:50:29.464259,2025-04-24 21:50:32.656764,0 days 00:00:03.192505,0.08800103017913731,8,,1,12,1089,0.6922085114519708,TPESampler,COMPLETE
852,0.28648887684219143,2025-04-24 21:50:29.544900,2025-04-24 21:50:33.258362,0 days 00:00:03.713462,0.0987838917084107,10,,1,8,1185,0.7155512081575893,TPESampler,COMPLETE
853,0.2902645836174321,2025-04-24 21:50:31.349183,2025-04-24 21:50:35.461355,0 days 00:00:04.112172,0.06659705687827952,9,,1,17,1283,0.7421199858663305,TPESampler,COMPLETE
854,0.4224213017941836,2025-04-24 21:50:32.841832,2025-04-24 21:50:34.616210,0 days 00:00:01.774378,0.098061631075267,3,log2,6,2,1159,0.8219211229763446,TPESampler,COMPLETE
855,0.32783970207702334,2025-04-24 21:50:33.449016,2025-04-24 21:50:37.629379,0 days 00:00:04.180363,0.06304391892278266,8,,2,13,1104,0.7179251806374418,TPESampler,COMPLETE
856,0.3709996208483051,2025-04-24 21:50:34.861414,2025-04-24 21:50:37.325049,0 days 00:00:02.463635,0.033390566778327725,9,sqrt,4,10,1333,0.6381800220330545,TPESampler,COMPLETE
857,0.3702880630461553,2025-04-24 21:50:35.704932,2025-04-24 21:50:39.417596,0 days 00:00:03.712664,0.06722088444641768,10,,3,5,1077,0.743705107221536,TPESampler,COMPLETE
858,0.6409639114899829,2025-04-24 21:50:37.558400,2025-04-24 21:50:40.375197,0 days 00:00:02.816797,0.02083005624139275,12,,9,6,964,0.7497963411053695,TPESampler,COMPLETE
859,0.3261477389329673,2025-04-24 21:50:37.898596,2025-04-24 21:50:41.150145,0 days 00:00:03.251549,0.06124669126688756,9,,3,16,1183,0.6472132295590176,TPESampler,COMPLETE
860,0.2742723130788933,2025-04-24 21:50:39.611225,2025-04-24 21:50:43.948612,0 days 00:00:04.337387,0.09768079253773555,8,,1,14,1332,0.7045397893849459,TPESampler,COMPLETE
861,0.3016068258690813,2025-04-24 21:50:40.582921,2025-04-24 21:50:43.391467,0 days 00:00:02.808546,0.05909018038647834,9,sqrt,1,10,1355,0.7595341469623058,TPESampler,COMPLETE
862,0.7544195777252857,2025-04-24 21:50:41.405645,2025-04-24 21:50:43.134673,0 days 00:00:01.729028,0.01409338518413875,9,log2,8,20,746,0.9595743319946586,TPESampler,COMPLETE
863,0.44264181778281886,2025-04-24 21:50:43.330455,2025-04-24 21:50:44.957906,0 days 00:00:01.627451,0.07324751234976262,7,,7,5,463,0.7574350307584599,TPESampler,COMPLETE
864,0.33227214291365487,2025-04-24 21:50:43.612983,2025-04-24 21:50:47.258802,0 days 00:00:03.645819,0.05970398701134225,7,,3,15,1418,0.7682249286610945,TPESampler,COMPLETE
865,0.2742939752148918,2025-04-24 21:50:44.123339,2025-04-24 21:50:47.661470,0 days 00:00:03.538131,0.06188186912785664,8,,1,10,1334,0.6684516901693746,TPESampler,COMPLETE
866,0.28142367040921046,2025-04-24 21:50:45.138319,2025-04-24 21:50:50.385430,0 days 00:00:05.247111,0.026988344086308787,12,,1,16,1392,0.7893245380364254,TPESampler,COMPLETE
867,0.2837945893469255,2025-04-24 21:50:47.450600,2025-04-24 21:50:50.994213,0 days 00:00:03.543613,0.0706203897703604,8,,1,17,1118,0.6039469430173183,TPESampler,COMPLETE
868,0.7551226410567635,2025-04-24 21:50:47.879021,2025-04-24 21:50:49.989449,0 days 00:00:02.110428,0.014214066742881589,7,log2,10,3,1444,0.9581255835122839,TPESampler,COMPLETE
869,0.2814004465765362,2025-04-24 21:50:50.171657,2025-04-24 21:50:53.627450,0 days 00:00:03.455793,0.09970891406964089,6,,1,15,1427,0.6642901410935336,TPESampler,COMPLETE
870,0.3455093454297998,2025-04-24 21:50:50.616150,2025-04-24 21:50:54.023229,0 days 00:00:03.407079,0.09847569551799205,8,,2,10,1365,0.6193812552804592,TPESampler,COMPLETE
871,0.28160367218622,2025-04-24 21:50:51.204624,2025-04-24 21:50:53.688540,0 days 00:00:02.483916,0.0988194114049332,8,,1,12,950,0.7214740448845866,TPESampler,COMPLETE
872,0.8176854872773983,2025-04-24 21:50:53.779239,2025-04-24 21:50:54.862031,0 days 00:00:01.082792,0.013782671156482263,4,log2,3,9,284,0.6082641092229203,TPESampler,COMPLETE
873,0.36018353769419104,2025-04-24 21:50:53.857031,2025-04-24 21:50:55.120941,0 days 00:00:01.263910,0.08300508240910894,5,,3,5,184,0.7728482861847246,TPESampler,COMPLETE
