number,value,datetime_start,datetime_complete,duration,params_learning_rate,params_max_depth,params_max_features,params_min_samples_leaf,params_min_samples_split,params_n_estimators,params_subsample,system_attrs_auto:sampler,state
1498,0.299867467642039,2025-04-24 22:01:43.113884,2025-04-24 22:01:45.439844,0 days 00:00:02.325960,0.09118364590167778,8,sqrt,1,13,1104,0.6748445232965108,TPESampler,COMPLETE
1499,0.32900483785468243,2025-04-24 22:01:44.614180,2025-04-24 22:01:48.293083,0 days 00:00:03.678903,0.05893247252618022,7,,3,13,1413,0.6030734706834828,TPESampler,COMPLETE
1500,0.2858155100485368,2025-04-24 22:01:45.643354,2025-04-24 22:01:48.184222,0 days 00:00:02.540868,0.09879429288983732,8,,1,12,870,0.7042034113015405,TPESampler,COMPLETE
1501,0.28183704503702955,2025-04-24 22:01:46.733588,2025-04-24 22:01:49.175956,0 days 00:00:02.442368,0.07602851984977205,7,,1,10,791,0.6163620857829561,TPESampler,COMPLETE
1502,0.5366616494649438,2025-04-24 22:01:48.367803,2025-04-24 22:01:50.315126,0 days 00:00:01.947323,0.059263891465565974,7,log2,4,7,688,0.6415959044138811,TPESampler,COMPLETE
1503,0.3526106345272957,2025-04-24 22:01:48.516943,2025-04-24 22:01:52.535282,0 days 00:00:04.018339,0.09977865466641732,3,,3,9,1371,0.7320918931463052,TPESampler,COMPLETE
1504,0.2741592949903275,2025-04-24 22:01:50.164009,2025-04-24 22:01:54.218389,0 days 00:00:04.054380,0.0739185089099547,7,,1,13,1480,0.6578527910140324,TPESampler,COMPLETE
1505,0.27187411862501665,2025-04-24 22:01:50.590540,2025-04-24 22:01:52.667694,0 days 00:00:02.077154,0.06771940580752102,8,,1,16,647,0.7817272819948509,TPESampler,COMPLETE
1506,0.27710066082025725,2025-04-24 22:01:52.722802,2025-04-24 22:01:55.971124,0 days 00:00:03.248322,0.09405131830194939,8,,1,14,1171,0.7365348583276338,TPESampler,COMPLETE
1507,0.282157335694195,2025-04-24 22:01:52.900313,2025-04-24 22:01:55.681036,0 days 00:00:02.780723,0.06414858119550278,9,,1,10,906,0.6896888311081124,TPESampler,COMPLETE
1508,0.2771342715836326,2025-04-24 22:01:54.421647,2025-04-24 22:01:57.963887,0 days 00:00:03.542240,0.06132587260239402,9,,1,15,1153,0.623514528098132,TPESampler,COMPLETE
1509,0.6728924262953003,2025-04-24 22:01:55.901011,2025-04-24 22:01:57.265499,0 days 00:00:01.364488,0.02296028984298884,12,sqrt,10,12,601,0.9136644628996989,TPESampler,COMPLETE
1510,0.35651264247885434,2025-04-24 22:01:56.239801,2025-04-24 22:01:59.267919,0 days 00:00:03.028118,0.0631807425151226,7,,4,14,921,0.7666128107497185,TPESampler,COMPLETE
1511,0.2809930975620068,2025-04-24 22:01:57.468738,2025-04-24 22:02:00.308878,0 days 00:00:02.840140,0.07292476180694991,7,,1,10,850,0.777982023200213,TPESampler,COMPLETE
1512,0.276612234083553,2025-04-24 22:01:58.193795,2025-04-24 22:02:01.886068,0 days 00:00:03.692273,0.060718595192012864,10,,1,12,1059,0.7601760297929419,TPESampler,COMPLETE
1513,0.3275419363636052,2025-04-24 22:01:59.460012,2025-04-24 22:02:05.303801,0 days 00:00:05.843789,0.056249073900541686,12,,1,5,1378,0.8797069725841746,TPESampler,COMPLETE
1514,0.8014555500740074,2025-04-24 22:02:00.509405,2025-04-24 22:02:02.373496,0 days 00:00:01.864091,0.010909601052346587,10,log2,8,9,1350,0.6081959362602881,TPESampler,COMPLETE
1515,0.3273882578035089,2025-04-24 22:02:02.126265,2025-04-24 22:02:04.422003,0 days 00:00:02.295738,0.072863128006191,9,log2,1,13,1477,0.6921476401292016,TPESampler,COMPLETE
1516,0.27017672280422855,2025-04-24 22:02:02.612005,2025-04-24 22:02:06.069647,0 days 00:00:03.457642,0.04747262602499199,8,,1,11,1031,0.7287081308960675,TPESampler,COMPLETE
1517,0.2716884475128292,2025-04-24 22:02:04.610406,2025-04-24 22:02:08.253763,0 days 00:00:03.643357,0.09962414990189482,8,,1,10,1226,0.668023917797375,TPESampler,COMPLETE
1518,0.33066352080112615,2025-04-24 22:02:05.505108,2025-04-24 22:02:09.439510,0 days 00:00:03.934402,0.0911100311578771,5,,2,10,1394,0.6004062054491252,TPESampler,COMPLETE
1519,0.4212713890592404,2025-04-24 22:02:06.298152,2025-04-24 22:02:07.977500,0 days 00:00:01.679348,0.07150329174846849,11,sqrt,6,7,740,0.8966173577347768,TPESampler,COMPLETE
1520,0.2803313463163399,2025-04-24 22:02:08.181612,2025-04-24 22:02:11.962079,0 days 00:00:03.780467,0.09318843693821284,11,,1,11,1132,0.6892614758514812,TPESampler,COMPLETE
1521,0.30055638853464695,2025-04-24 22:02:08.531828,2025-04-24 22:02:11.251962,0 days 00:00:02.720134,0.09858614851819968,4,,2,14,1123,0.6095549065583015,TPESampler,COMPLETE
1522,0.28793438405204436,2025-04-24 22:02:09.945541,2025-04-24 22:02:13.242308,0 days 00:00:03.296767,0.09918753356508517,8,,1,12,1111,0.6533833215341505,TPESampler,COMPLETE
1523,0.28381120618799655,2025-04-24 22:02:11.460749,2025-04-24 22:02:14.751039,0 days 00:00:03.290290,0.05729580306838323,7,,1,6,1167,0.7434114119984557,TPESampler,COMPLETE
1524,0.328205522394391,2025-04-24 22:02:12.188751,2025-04-24 22:02:14.893527,0 days 00:00:02.704776,0.08243305757697116,9,,3,11,952,0.6026894129934368,TPESampler,COMPLETE
1525,0.33425444805828275,2025-04-24 22:02:13.472170,2025-04-24 22:02:17.405814,0 days 00:00:03.933644,0.0902937685224388,7,,3,16,1374,0.6443934130487141,TPESampler,COMPLETE
1526,0.5628707250533844,2025-04-24 22:02:15.007987,2025-04-24 22:02:17.122706,0 days 00:00:02.114719,0.011621411036918092,4,sqrt,8,2,1033,0.959000421489887,TPESampler,COMPLETE
1527,0.3566705693736566,2025-04-24 22:02:15.187889,2025-04-24 22:02:17.384713,0 days 00:00:02.196824,0.09376068367468088,5,sqrt,2,15,881,0.7469406696091359,TPESampler,COMPLETE
1528,0.37946325407841724,2025-04-24 22:02:17.341096,2025-04-24 22:02:18.885048,0 days 00:00:01.543952,0.017328746404273253,7,sqrt,1,13,652,0.6390019779033587,TPESampler,COMPLETE
1529,0.2759934282963733,2025-04-24 22:02:17.677212,2025-04-24 22:02:21.014283,0 days 00:00:03.337071,0.08255746419430221,7,,1,9,973,0.6659769870483528,TPESampler,COMPLETE
1530,0.35629743189356755,2025-04-24 22:02:17.735186,2025-04-24 22:02:21.766713,0 days 00:00:04.031527,0.09947418192185757,5,,2,7,1426,0.7103892117337741,TPESampler,COMPLETE
1531,0.43500449068317676,2025-04-24 22:02:19.087891,2025-04-24 22:02:22.867783,0 days 00:00:03.779892,0.01128914958778257,8,,8,5,1205,0.9634565435545482,TPESampler,COMPLETE
1532,0.27373850810098344,2025-04-24 22:02:21.219438,2025-04-24 22:02:24.362382,0 days 00:00:03.142944,0.0991246003228538,9,,1,13,1008,0.6321302607259589,TPESampler,COMPLETE
1533,0.27252967515563015,2025-04-24 22:02:21.998242,2025-04-24 22:02:24.323790,0 days 00:00:02.325548,0.07839920886493656,9,,1,10,673,0.7581032407934105,TPESampler,COMPLETE
1534,0.3306146186923349,2025-04-24 22:02:23.070816,2025-04-24 22:02:25.764132,0 days 00:00:02.693316,0.03847215197651166,7,,2,8,892,0.7506489258638641,TPESampler,COMPLETE
1535,0.34468017972433074,2025-04-24 22:02:24.498921,2025-04-24 22:02:27.806147,0 days 00:00:03.307226,0.07384249998039591,9,,3,11,1017,0.7445452352096387,TPESampler,COMPLETE
1536,0.3363812633405164,2025-04-24 22:02:24.549427,2025-04-24 22:02:28.232193,0 days 00:00:03.682766,0.06546766153779822,8,,3,14,1200,0.7041639382496133,TPESampler,COMPLETE
1537,0.7125560785915522,2025-04-24 22:02:25.963603,2025-04-24 22:02:26.993370,0 days 00:00:01.029767,0.02531549873933532,10,sqrt,8,2,300,0.6584084970636963,TPESampler,COMPLETE
1538,0.28634419372891956,2025-04-24 22:02:27.190199,2025-04-24 22:02:30.073038,0 days 00:00:02.882839,0.09978959879629622,9,,1,9,887,0.6269112972030524,TPESampler,COMPLETE
1539,0.32561510541331723,2025-04-24 22:02:28.014437,2025-04-24 22:02:31.093216,0 days 00:00:03.078779,0.06392911656984482,7,,2,12,1075,0.7027344057976345,TPESampler,COMPLETE
1540,0.2864922863872626,2025-04-24 22:02:28.461219,2025-04-24 22:02:32.191870,0 days 00:00:03.730651,0.09455179593113293,8,,1,15,1236,0.6619960052592008,TPESampler,COMPLETE
1541,0.4264266171039961,2025-04-24 22:02:30.269139,2025-04-24 22:02:35.082334,0 days 00:00:04.813195,0.01126452292138981,11,,7,13,1444,0.7975131240071063,TPESampler,COMPLETE
1542,0.446269931689972,2025-04-24 22:02:31.287070,2025-04-24 22:02:32.789645,0 days 00:00:01.502575,0.06574392034348928,9,sqrt,6,14,640,0.7207147539607387,TPESampler,COMPLETE
1543,0.35379472726528866,2025-04-24 22:02:32.425281,2025-04-24 22:02:34.835126,0 days 00:00:02.409845,0.09896502383388374,9,log2,2,19,1486,0.6233744138932233,TPESampler,COMPLETE
1544,0.3261360474831764,2025-04-24 22:02:33.039501,2025-04-24 22:02:35.939087,0 days 00:00:02.899586,0.052166946829265017,6,,3,9,784,0.6880253824675395,TPESampler,COMPLETE
1545,0.27913847376432677,2025-04-24 22:02:35.040012,2025-04-24 22:02:38.038224,0 days 00:00:02.998212,0.0946714403783637,8,,1,9,1081,0.7176582389217504,TPESampler,COMPLETE
1546,0.2838666780065768,2025-04-24 22:02:35.355649,2025-04-24 22:02:38.196662,0 days 00:00:02.841013,0.06408803985643309,8,,1,14,1053,0.6767497264078053,TPESampler,COMPLETE
1547,0.3314135938764607,2025-04-24 22:02:36.151722,2025-04-24 22:02:39.300623,0 days 00:00:03.148901,0.07556805696421788,8,,3,13,1150,0.679216159148723,TPESampler,COMPLETE
1548,0.3265463208022545,2025-04-24 22:02:38.222897,2025-04-24 22:02:40.840504,0 days 00:00:02.617607,0.0992834417022475,6,,2,13,860,0.7704738415151192,TPESampler,COMPLETE
1549,0.3352507183267649,2025-04-24 22:02:38.396613,2025-04-24 22:02:42.181661,0 days 00:00:03.785048,0.05674453008060806,7,,3,7,1418,0.601254496675322,TPESampler,COMPLETE
1550,0.3606652888397956,2025-04-24 22:02:39.502919,2025-04-24 22:02:42.492174,0 days 00:00:02.989255,0.09567107969111723,5,,3,10,1311,0.6028121507786721,TPESampler,COMPLETE
1551,0.2815369143697277,2025-04-24 22:02:41.170018,2025-04-24 22:02:45.061763,0 days 00:00:03.891745,0.07151167868422934,7,,1,12,1451,0.6717861561371692,TPESampler,COMPLETE
1552,0.28896081095927173,2025-04-24 22:02:42.922599,2025-04-24 22:02:47.660435,0 days 00:00:04.737836,0.09064069804810178,9,,1,11,1335,0.6880416944368262,TPESampler,COMPLETE
1553,0.32083242176549764,2025-04-24 22:02:43.125573,2025-04-24 22:02:45.984820,0 days 00:00:02.859247,0.05623651220447579,7,sqrt,1,13,1489,0.6564013819254682,TPESampler,COMPLETE
1554,0.2827158760304288,2025-04-24 22:02:45.673909,2025-04-24 22:02:49.964454,0 days 00:00:04.290545,0.08348830452487206,10,,1,13,1025,0.8029757709696674,TPESampler,COMPLETE
1555,0.6546618373744564,2025-04-24 22:02:46.434818,2025-04-24 22:02:49.243844,0 days 00:00:02.809026,0.01825686234265646,6,sqrt,9,2,1494,0.8374248481084913,TPESampler,COMPLETE
1556,0.6620125556189009,2025-04-24 22:02:48.049415,2025-04-24 22:02:49.759425,0 days 00:00:01.710010,0.03032143106002435,7,sqrt,8,17,382,0.792006473157507,TPESampler,COMPLETE
1557,0.2833354811861214,2025-04-24 22:02:49.612569,2025-04-24 22:02:52.123625,0 days 00:00:02.511056,0.09635872199571006,5,,1,10,987,0.6052426066373435,TPESampler,COMPLETE
1558,0.3578028420178045,2025-04-24 22:02:50.021366,2025-04-24 22:02:53.693495,0 days 00:00:03.672129,0.07549541064829367,8,,3,9,1275,0.6037246901798056,TPESampler,COMPLETE
1559,0.662735678302709,2025-04-24 22:02:50.251331,2025-04-24 22:02:53.380033,0 days 00:00:03.128702,0.09934474530269674,10,,9,13,635,0.7483166517354746,TPESampler,COMPLETE
1560,0.27174282668311217,2025-04-24 22:02:52.484380,2025-04-24 22:02:56.337101,0 days 00:00:03.852721,0.05904833230856601,7,,1,11,1312,0.6064124312244928,TPESampler,COMPLETE
1561,0.3601238261378342,2025-04-24 22:02:53.721383,2025-04-24 22:02:57.049329,0 days 00:00:03.327946,0.08843872658689321,7,,3,6,1206,0.6842811527944778,TPESampler,COMPLETE
1562,0.3523000067958156,2025-04-24 22:02:53.971717,2025-04-24 22:02:57.418853,0 days 00:00:03.447136,0.08285453667576102,7,,3,11,1246,0.7251453133842132,TPESampler,COMPLETE
1563,0.4496981710313892,2025-04-24 22:02:56.535143,2025-04-24 22:02:58.285774,0 days 00:00:01.750631,0.06066551652119772,4,,8,2,299,0.8005149753078525,TPESampler,COMPLETE
1564,0.4795842227411459,2025-04-24 22:02:57.271251,2025-04-24 22:02:59.164043,0 days 00:00:01.892792,0.049281143461998175,9,log2,5,13,664,0.9958486974870507,TPESampler,COMPLETE
1565,0.6445310497681684,2025-04-24 22:02:58.325820,2025-04-24 22:03:00.519435,0 days 00:00:02.193615,0.032711472070375044,7,,10,5,426,0.8099207811300845,TPESampler,COMPLETE
1566,0.279901339997345,2025-04-24 22:02:58.589385,2025-04-24 22:03:02.532605,0 days 00:00:03.943220,0.04392716453059904,9,,1,10,1113,0.7738407957547127,TPESampler,COMPLETE
1567,0.2729083744485716,2025-04-24 22:02:59.441529,2025-04-24 22:03:03.271709,0 days 00:00:03.830180,0.06618036271099331,9,,1,14,1182,0.7473173002184436,TPESampler,COMPLETE
1568,0.2771075620285547,2025-04-24 22:03:00.717942,2025-04-24 22:03:04.063114,0 days 00:00:03.345172,0.06822714907505743,5,,1,16,1237,0.7480628461387285,TPESampler,COMPLETE
1569,0.4503167566671999,2025-04-24 22:03:02.729781,2025-04-24 22:03:05.181145,0 days 00:00:02.451364,0.03425974485192822,3,log2,3,19,1409,0.7629996219265387,TPESampler,COMPLETE
1570,0.6597803954478803,2025-04-24 22:03:03.515682,2025-04-24 22:03:05.449032,0 days 00:00:01.933350,0.04219251045395654,5,sqrt,9,16,642,0.9963564489058796,TPESampler,COMPLETE
1571,0.35519339074675577,2025-04-24 22:03:04.301560,2025-04-24 22:03:08.327180,0 days 00:00:04.025620,0.07818376457932384,9,,3,13,1274,0.6914803480556613,TPESampler,COMPLETE
1572,0.2910758145008878,2025-04-24 22:03:05.419190,2025-04-24 22:03:07.658826,0 days 00:00:02.239636,0.06820249896224362,10,,1,16,756,0.6340714865759256,TPESampler,COMPLETE
1573,0.2831902576872405,2025-04-24 22:03:05.672942,2025-04-24 22:03:08.997110,0 days 00:00:03.324168,0.05336081974096944,8,,1,13,1078,0.696533143719299,TPESampler,COMPLETE
1574,0.7019234680397985,2025-04-24 22:03:07.850046,2025-04-24 22:03:09.599118,0 days 00:00:01.749072,0.036447757524693085,11,log2,9,3,977,0.8327886963515321,TPESampler,COMPLETE
1575,0.2821673562342851,2025-04-24 22:03:08.568228,2025-04-24 22:03:12.083326,0 days 00:00:03.515098,0.07549030845626928,6,,1,9,1155,0.674362569148722,TPESampler,COMPLETE
1576,0.2789712855167441,2025-04-24 22:03:09.253401,2025-04-24 22:03:12.860667,0 days 00:00:03.607266,0.06356826506503083,7,,1,10,1233,0.7313107365971936,TPESampler,COMPLETE
1577,0.429822528474971,2025-04-24 22:03:09.893296,2025-04-24 22:03:13.650583,0 days 00:00:03.757287,0.01064589305957697,12,,7,4,1049,0.9227187370582125,TPESampler,COMPLETE
1578,0.8674372231063937,2025-04-24 22:03:12.277845,2025-04-24 22:03:13.261346,0 days 00:00:00.983501,0.013380889143389538,6,sqrt,8,4,149,0.6385762030500644,TPESampler,COMPLETE
1579,0.34482532609687166,2025-04-24 22:03:13.187861,2025-04-24 22:03:16.351542,0 days 00:00:03.163681,0.06294229556626366,8,,3,7,1077,0.6666352828376034,TPESampler,COMPLETE
1580,0.28006008157806894,2025-04-24 22:03:13.503177,2025-04-24 22:03:17.270085,0 days 00:00:03.766908,0.09809790201953587,8,,1,13,1249,0.6990422487446707,TPESampler,COMPLETE
1581,0.3010518845013873,2025-04-24 22:03:13.949198,2025-04-24 22:03:16.516131,0 days 00:00:02.566933,0.09715281433739366,7,sqrt,1,12,1370,0.6452153905315989,TPESampler,COMPLETE
1582,0.2665343119684675,2025-04-24 22:03:16.543916,2025-04-24 22:03:19.782404,0 days 00:00:03.238488,0.09942023885746128,8,,1,11,1105,0.6284835624244473,TPESampler,COMPLETE
1583,0.28923296866324777,2025-04-24 22:03:16.717770,2025-04-24 22:03:19.853662,0 days 00:00:03.135892,0.09944184173585308,10,,1,8,948,0.699641985138398,TPESampler,COMPLETE
1584,0.32127346944134927,2025-04-24 22:03:17.462000,2025-04-24 22:03:21.159106,0 days 00:00:03.697106,0.06592424826488072,6,,3,15,1482,0.686572587073695,TPESampler,COMPLETE
1585,0.5638329452361158,2025-04-24 22:03:19.944193,2025-04-24 22:03:21.203348,0 days 00:00:01.259155,0.017552983916332476,12,sqrt,5,18,361,0.7841949831808114,TPESampler,COMPLETE
1586,0.2685420583005949,2025-04-24 22:03:20.061224,2025-04-24 22:03:23.559301,0 days 00:00:03.498077,0.09430977048495753,8,,1,8,1149,0.6776226552636283,TPESampler,COMPLETE
1587,0.28407020459804977,2025-04-24 22:03:21.319624,2025-04-24 22:03:24.392283,0 days 00:00:03.072659,0.06479363730603661,9,,1,11,1038,0.6058216535656207,TPESampler,COMPLETE
1588,0.3420107199906253,2025-04-24 22:03:21.372744,2025-04-24 22:03:24.225415,0 days 00:00:02.852671,0.08627373145497237,8,,3,8,931,0.6279747019545274,TPESampler,COMPLETE
1589,0.3077845382394071,2025-04-24 22:03:23.751552,2025-04-24 22:03:26.885694,0 days 00:00:03.134142,0.01747539710674795,6,,1,2,1203,0.6238345396787784,TPESampler,COMPLETE
1590,0.2886236511487718,2025-04-24 22:03:24.444073,2025-04-24 22:03:26.709650,0 days 00:00:02.265577,0.06931151769536115,7,,1,10,799,0.6758195540393886,TPESampler,COMPLETE
1591,0.3509451930529785,2025-04-24 22:03:24.644054,2025-04-24 22:03:27.206948,0 days 00:00:02.562894,0.07486581409766584,9,,2,10,900,0.6642044183865893,TPESampler,COMPLETE
1592,0.3573417160014258,2025-04-24 22:03:26.893078,2025-04-24 22:03:29.661819,0 days 00:00:02.768741,0.09527444794261984,8,,2,9,1028,0.6147812221636446,TPESampler,COMPLETE
1593,0.28518486614100397,2025-04-24 22:03:27.125728,2025-04-24 22:03:30.321224,0 days 00:00:03.195496,0.09551217513799401,8,,1,8,1188,0.628148768905273,TPESampler,COMPLETE
1594,0.33377527209255026,2025-04-24 22:03:27.469858,2025-04-24 22:03:30.230011,0 days 00:00:02.760153,0.09938322255293136,7,,2,11,1046,0.621107166029527,TPESampler,COMPLETE
1595,0.4399347472834709,2025-04-24 22:03:29.859275,2025-04-24 22:03:31.112858,0 days 00:00:01.253583,0.017876966847563874,11,sqrt,1,15,206,0.905671872947375,TPESampler,COMPLETE
1596,0.2926359858690833,2025-04-24 22:03:30.572333,2025-04-24 22:03:33.106861,0 days 00:00:02.534528,0.04631365664591915,7,,1,11,604,0.6104923896373928,TPESampler,COMPLETE
1597,0.8199141660541104,2025-04-24 22:03:30.759783,2025-04-24 22:03:32.065435,0 days 00:00:01.305652,0.017614750453880543,3,log2,7,9,453,0.6902256302061462,TPESampler,COMPLETE
1598,0.2872303037091874,2025-04-24 22:03:31.426190,2025-04-24 22:03:34.391243,0 days 00:00:02.965053,0.09775640920637517,6,,1,15,912,0.6845228678856865,TPESampler,COMPLETE
1599,0.3129828228141733,2025-04-24 22:03:32.294793,2025-04-24 22:03:34.061020,0 days 00:00:01.766227,0.0612603991703304,6,,1,7,438,0.6947623783745748,TPESampler,COMPLETE
1600,0.3481379108023771,2025-04-24 22:03:33.299027,2025-04-24 22:03:37.144925,0 days 00:00:03.845898,0.09319902814270033,8,,2,10,1462,0.6133662348299556,TPESampler,COMPLETE
1601,0.34144957119000596,2025-04-24 22:03:34.258982,2025-04-24 22:03:37.269843,0 days 00:00:03.010861,0.02654782908919391,8,,2,6,1055,0.8424373423547913,TPESampler,COMPLETE
1602,0.3431453681965018,2025-04-24 22:03:34.620894,2025-04-24 22:03:37.870442,0 days 00:00:03.249548,0.07980747710678601,9,,2,11,1124,0.7051937565878382,TPESampler,COMPLETE
1603,0.27840585837294757,2025-04-24 22:03:37.327213,2025-04-24 22:03:40.198551,0 days 00:00:02.871338,0.0886230253931184,10,,1,11,946,0.6053752571863638,TPESampler,COMPLETE
1604,0.3579166147285658,2025-04-24 22:03:37.493320,2025-04-24 22:03:41.126831,0 days 00:00:03.633511,0.09057363022817921,10,,2,12,1167,0.7437530253200508,TPESampler,COMPLETE
1605,0.6489439195832062,2025-04-24 22:03:38.165867,2025-04-24 22:03:41.714293,0 days 00:00:03.548426,0.05262667283291606,10,,10,16,1254,0.9569181635797256,TPESampler,COMPLETE
1606,0.28189286247920786,2025-04-24 22:03:40.391267,2025-04-24 22:03:43.081070,0 days 00:00:02.689803,0.06302131365770504,8,,1,14,839,0.7579447945814867,TPESampler,COMPLETE
1607,0.2748223359228274,2025-04-24 22:03:41.655423,2025-04-24 22:03:44.401070,0 days 00:00:02.745647,0.07330581224029661,7,,1,8,911,0.6020234471379942,TPESampler,COMPLETE
1608,0.2710830276513664,2025-04-24 22:03:41.928151,2025-04-24 22:03:45.230562,0 days 00:00:03.302411,0.0606929648348116,8,,1,9,1000,0.6752616835221071,TPESampler,COMPLETE
1609,0.3879692054175936,2025-04-24 22:03:43.284261,2025-04-24 22:03:45.412654,0 days 00:00:02.128393,0.04833772481049451,7,log2,2,11,1225,0.728102516022141,TPESampler,COMPLETE
1610,0.33097145239562004,2025-04-24 22:03:44.612665,2025-04-24 22:03:48.185206,0 days 00:00:03.572541,0.07649709417395095,5,,3,8,1094,0.6703884782056917,TPESampler,COMPLETE
1611,0.2744599854493389,2025-04-24 22:03:45.462643,2025-04-24 22:03:49.459403,0 days 00:00:03.996760,0.09657369524165386,8,,1,7,1381,0.6044731143185472,TPESampler,COMPLETE
1612,0.3819221656502399,2025-04-24 22:03:45.646249,2025-04-24 22:03:47.572053,0 days 00:00:01.925804,0.09881241104831885,10,log2,3,9,948,0.6991339734764334,TPESampler,COMPLETE
1613,0.329710270256023,2025-04-24 22:03:47.779647,2025-04-24 22:03:51.021169,0 days 00:00:03.241522,0.08622769318467378,8,,2,13,1119,0.6918898650732733,TPESampler,COMPLETE
1614,0.26871465934392375,2025-04-24 22:03:48.394755,2025-04-24 22:03:51.401492,0 days 00:00:03.006737,0.09164200160853492,7,,1,12,1087,0.7451729877379254,TPESampler,COMPLETE
1615,0.2771828013355546,2025-04-24 22:03:49.659827,2025-04-24 22:03:52.519388,0 days 00:00:02.859561,0.0671349333017891,5,,1,12,1165,0.6054468081453279,TPESampler,COMPLETE
1616,0.29265597572179236,2025-04-24 22:03:51.613902,2025-04-24 22:03:54.370467,0 days 00:00:02.756565,0.09785602779187856,8,,1,11,845,0.6225789276484935,TPESampler,COMPLETE
1617,0.2943291477531415,2025-04-24 22:03:51.748365,2025-04-24 22:03:54.311511,0 days 00:00:02.563146,0.03138137453937422,9,,1,9,661,0.767973894839133,TPESampler,COMPLETE
1618,0.34686843355949915,2025-04-24 22:03:52.746018,2025-04-24 22:03:56.504301,0 days 00:00:03.758283,0.05130060722593375,9,,3,13,1320,0.7798464196863003,TPESampler,COMPLETE
1619,0.668524981322944,2025-04-24 22:03:54.506915,2025-04-24 22:03:57.781866,0 days 00:00:03.274951,0.027531934180163878,4,,10,10,1404,0.7236246415938691,TPESampler,COMPLETE
1620,0.27432534998855734,2025-04-24 22:03:54.551541,2025-04-24 22:03:57.809173,0 days 00:00:03.257632,0.07088515752307654,8,,1,13,995,0.7377671609716749,TPESampler,COMPLETE
1621,0.27511779734704783,2025-04-24 22:03:56.703627,2025-04-24 22:04:00.746567,0 days 00:00:04.042940,0.09167295054429006,9,,1,13,1302,0.6428799064247378,TPESampler,COMPLETE
1622,0.444991040086409,2025-04-24 22:03:57.925496,2025-04-24 22:03:59.965365,0 days 00:00:02.039869,0.02954066058231146,3,log2,2,6,1078,0.826286422028071,TPESampler,COMPLETE
