number,value,datetime_start,datetime_complete,duration,params_learning_rate,params_max_depth,params_max_features,params_min_samples_leaf,params_min_samples_split,params_n_estimators,params_subsample,system_attrs_auto:sampler,state
624,0.27143018844354205,2025-04-24 21:46:26.726552,2025-04-24 21:46:30.451026,0 days 00:00:03.724474,0.07809362100828302,10,,1,15,1401,0.6675585842904261,TPESampler,COMPLETE
625,0.2858109227522484,2025-04-24 21:46:27.848056,2025-04-24 21:46:30.945922,0 days 00:00:03.097866,0.09770658824296666,10,,1,12,1114,0.6663468790925132,TPESampler,COMPLETE
626,0.36896282858658735,2025-04-24 21:46:28.334667,2025-04-24 21:46:32.008393,0 days 00:00:03.673726,0.0915287638218249,9,,2,10,1425,0.6409744534898307,TPESampler,COMPLETE
627,0.3540834553666891,2025-04-24 21:46:30.640802,2025-04-24 21:46:33.793042,0 days 00:00:03.152240,0.049484474742696016,8,,4,12,1216,0.7082122901925841,TPESampler,COMPLETE
628,0.35264716709339067,2025-04-24 21:46:31.122978,2025-04-24 21:46:34.954302,0 days 00:00:03.831324,0.08553206214480163,7,,2,8,1480,0.6994223417162263,TPESampler,COMPLETE
629,0.35165462078050636,2025-04-24 21:46:32.214504,2025-04-24 21:46:36.229800,0 days 00:00:04.015296,0.04859313254078939,9,,2,8,1448,0.6051009899970972,TPESampler,COMPLETE
630,0.3796382233099291,2025-04-24 21:46:33.983139,2025-04-24 21:46:36.150143,0 days 00:00:02.167004,0.09376206485833918,6,log2,2,15,1341,0.6338477372281316,TPESampler,COMPLETE
631,0.2695424105648331,2025-04-24 21:46:35.161585,2025-04-24 21:46:39.035196,0 days 00:00:03.873611,0.07827841488240793,8,,1,12,1263,0.6761491630189322,TPESampler,COMPLETE
632,0.7260299358087512,2025-04-24 21:46:36.296482,2025-04-24 21:46:37.677708,0 days 00:00:01.381226,0.012404155209091732,3,log2,2,14,552,0.7999383579881982,TPESampler,COMPLETE
633,0.28676389395128377,2025-04-24 21:46:36.426510,2025-04-24 21:46:40.153406,0 days 00:00:03.726896,0.09314470961462958,10,,1,15,1255,0.6129532772613252,TPESampler,COMPLETE
634,0.31272232365251745,2025-04-24 21:46:37.867959,2025-04-24 21:46:41.543307,0 days 00:00:03.675348,0.0604272810586038,6,,3,15,1302,0.7389823214259926,TPESampler,COMPLETE
635,0.2887668781337011,2025-04-24 21:46:39.229312,2025-04-24 21:46:41.797289,0 days 00:00:02.567977,0.08654163745897464,12,sqrt,1,14,1216,0.919564382549992,TPESampler,COMPLETE
636,0.2814764571780465,2025-04-24 21:46:40.353019,2025-04-24 21:46:44.031294,0 days 00:00:03.678275,0.06322309718712481,9,,1,16,1040,0.6911747530588659,TPESampler,COMPLETE
637,0.38523282875408243,2025-04-24 21:46:41.737946,2025-04-24 21:46:43.902111,0 days 00:00:02.164165,0.0544703873301381,8,log2,2,15,1340,0.6542537108322818,TPESampler,COMPLETE
638,0.26423531688370205,2025-04-24 21:46:42.100152,2025-04-24 21:46:46.139037,0 days 00:00:04.038885,0.08329271475469245,8,,1,11,1366,0.6727554352175055,TPESampler,COMPLETE
639,0.27815320013916717,2025-04-24 21:46:44.079033,2025-04-24 21:46:47.903647,0 days 00:00:03.824614,0.09271523768611822,8,,1,11,1379,0.6665549225881799,TPESampler,COMPLETE
640,0.6170796470857847,2025-04-24 21:46:44.281260,2025-04-24 21:46:47.829083,0 days 00:00:03.547823,0.024454918628791372,12,,9,17,1130,0.880520024711095,TPESampler,COMPLETE
641,0.39270355453120387,2025-04-24 21:46:46.323457,2025-04-24 21:46:47.830470,0 days 00:00:01.507013,0.08561177582755779,5,log2,2,13,761,0.7426694654705581,TPESampler,COMPLETE
642,0.399428708931368,2025-04-24 21:46:47.985736,2025-04-24 21:46:50.675806,0 days 00:00:02.690070,0.02009216646206487,6,,5,3,836,0.8808980632096107,TPESampler,COMPLETE
643,0.35018076827571576,2025-04-24 21:46:47.995025,2025-04-24 21:46:52.553675,0 days 00:00:04.558650,0.09583546652324491,8,,2,13,1403,0.7279365206147272,TPESampler,COMPLETE
644,0.3447264385718843,2025-04-24 21:46:48.073355,2025-04-24 21:46:49.762887,0 days 00:00:01.689532,0.055892541540196926,12,log2,1,7,435,0.9261492151677999,TPESampler,COMPLETE
645,0.6470446266200607,2025-04-24 21:46:49.959537,2025-04-24 21:46:51.729590,0 days 00:00:01.770053,0.03725112492970844,11,sqrt,10,5,1049,0.6290211703413302,TPESampler,COMPLETE
646,0.27469548644495706,2025-04-24 21:46:50.897075,2025-04-24 21:46:54.561670,0 days 00:00:03.664595,0.0930860992080439,8,,1,11,1266,0.6689454673802889,TPESampler,COMPLETE
647,0.35178813516031887,2025-04-24 21:46:51.948547,2025-04-24 21:46:55.958345,0 days 00:00:04.009798,0.06268035976606375,9,,3,11,1485,0.6672524854842038,TPESampler,COMPLETE
648,0.3286152630872094,2025-04-24 21:46:52.763906,2025-04-24 21:46:56.760587,0 days 00:00:03.996681,0.0581313052358942,7,,2,14,1488,0.691623580211786,TPESampler,COMPLETE
649,0.5697385102335584,2025-04-24 21:46:54.751966,2025-04-24 21:46:56.514733,0 days 00:00:01.762767,0.036395966768887164,8,log2,6,4,946,0.6877483673949336,TPESampler,COMPLETE
650,0.2736122741413702,2025-04-24 21:46:56.181727,2025-04-24 21:46:59.020566,0 days 00:00:02.838839,0.09459895802471406,6,,1,18,971,0.7091066385235117,TPESampler,COMPLETE
651,0.2782169113695837,2025-04-24 21:46:56.705262,2025-04-24 21:47:01.000752,0 days 00:00:04.295490,0.09188647239296809,10,,1,10,1490,0.6327211105195399,TPESampler,COMPLETE
652,0.7094078267699039,2025-04-24 21:46:56.967458,2025-04-24 21:46:57.937087,0 days 00:00:00.969629,0.0763140643666123,10,log2,8,20,245,0.8024662388994067,TPESampler,COMPLETE
653,0.2833044130654059,2025-04-24 21:46:58.136432,2025-04-24 21:47:01.972302,0 days 00:00:03.835870,0.031919573018227454,12,,1,19,1076,0.7906313569352287,TPESampler,COMPLETE
654,0.270896697820233,2025-04-24 21:46:59.239880,2025-04-24 21:47:02.688692,0 days 00:00:03.448812,0.07973737409687719,8,,1,14,1199,0.7070444376361836,TPESampler,COMPLETE
655,0.27528252686943655,2025-04-24 21:47:01.186106,2025-04-24 21:47:05.532749,0 days 00:00:04.346643,0.06658613151276119,9,,1,14,1317,0.7339893976781341,TPESampler,COMPLETE
656,0.7043168836449245,2025-04-24 21:47:02.156348,2025-04-24 21:47:03.429615,0 days 00:00:01.273267,0.011196933444223936,11,sqrt,8,3,535,0.8278262684078994,TPESampler,COMPLETE
657,0.3460082331514212,2025-04-24 21:47:02.929229,2025-04-24 21:47:04.953142,0 days 00:00:02.023913,0.04778080114327304,9,log2,1,8,1023,0.7201642192150377,TPESampler,COMPLETE
658,0.2648798335905819,2025-04-24 21:47:03.668847,2025-04-24 21:47:07.365230,0 days 00:00:03.696383,0.09133918176343299,6,,1,13,1333,0.708800464513887,TPESampler,COMPLETE
659,0.2773413081146929,2025-04-24 21:47:05.146548,2025-04-24 21:47:08.309846,0 days 00:00:03.163298,0.0815156760932723,7,,1,15,1162,0.6999343611464389,TPESampler,COMPLETE
660,0.3608163812674534,2025-04-24 21:47:05.743590,2025-04-24 21:47:08.381800,0 days 00:00:02.638210,0.010824219705901469,9,,2,3,627,0.9630799797410722,TPESampler,COMPLETE
661,0.36600979059838606,2025-04-24 21:47:07.572280,2025-04-24 21:47:09.645336,0 days 00:00:02.073056,0.06734160273976196,4,sqrt,2,4,1192,0.6975647865146046,TPESampler,COMPLETE
662,0.4276948749406663,2025-04-24 21:47:08.475945,2025-04-24 21:47:10.493771,0 days 00:00:02.017826,0.024998284317156214,11,,6,14,319,0.9697428525959322,TPESampler,COMPLETE
663,0.2769455526018941,2025-04-24 21:47:08.546121,2025-04-24 21:47:12.440618,0 days 00:00:03.894497,0.06941689975926099,7,,1,15,1374,0.7367594257213416,TPESampler,COMPLETE
664,0.3413690186927091,2025-04-24 21:47:09.855628,2025-04-24 21:47:14.264627,0 days 00:00:04.408999,0.09675824598049751,7,,2,14,1483,0.6840173585854074,TPESampler,COMPLETE
665,0.3811056157791856,2025-04-24 21:47:10.908278,2025-04-24 21:47:15.719380,0 days 00:00:04.811102,0.0718603247439848,10,,3,9,1485,0.7446908361797405,TPESampler,COMPLETE
666,0.8515106438466719,2025-04-24 21:47:12.824016,2025-04-24 21:47:13.982387,0 days 00:00:01.158371,0.015991757668058246,10,log2,10,15,460,0.8304475904228877,TPESampler,COMPLETE
667,0.3491529379622438,2025-04-24 21:47:14.186299,2025-04-24 21:47:17.124578,0 days 00:00:02.938279,0.08691107894727766,9,,3,14,782,0.7925204072219713,TPESampler,COMPLETE
668,0.6495224127254132,2025-04-24 21:47:14.509523,2025-04-24 21:47:16.546556,0 days 00:00:02.037033,0.021076282762928458,7,sqrt,10,20,1257,0.7483606880128453,TPESampler,COMPLETE
669,0.27166825932174654,2025-04-24 21:47:15.936824,2025-04-24 21:47:18.551292,0 days 00:00:02.614468,0.09806771257802807,7,,1,12,810,0.6389294257584317,TPESampler,COMPLETE
670,0.31460942401421127,2025-04-24 21:47:16.743116,2025-04-24 21:47:19.880931,0 days 00:00:03.137815,0.05996485768578437,7,,2,19,1192,0.6795021684257754,TPESampler,COMPLETE
671,0.27027351236136593,2025-04-24 21:47:17.329824,2025-04-24 21:47:21.219279,0 days 00:00:03.889455,0.08905670989231163,8,,1,14,1500,0.6921372215783677,TPESampler,COMPLETE
672,0.2804259858326923,2025-04-24 21:47:18.755964,2025-04-24 21:47:21.720458,0 days 00:00:02.964494,0.06813311677839755,7,,1,10,1060,0.6671050895525462,TPESampler,COMPLETE
673,0.276689998276327,2025-04-24 21:47:20.092228,2025-04-24 21:47:23.042462,0 days 00:00:02.950234,0.08733022893240877,8,,1,9,1018,0.7131995833840908,TPESampler,COMPLETE
674,0.2735628786212182,2025-04-24 21:47:21.411418,2025-04-24 21:47:24.658114,0 days 00:00:03.246696,0.06526450875409312,6,,1,11,1211,0.7744423051624648,TPESampler,COMPLETE
675,0.4025400904527077,2025-04-24 21:47:21.915122,2025-04-24 21:47:23.012311,0 days 00:00:01.097189,0.016395882242904485,6,,3,17,236,0.6098918384382868,TPESampler,COMPLETE
676,0.2687383284697834,2025-04-24 21:47:23.163096,2025-04-24 21:47:27.415841,0 days 00:00:04.252745,0.07269092235910544,8,,1,12,1475,0.7223847097386283,TPESampler,COMPLETE
677,0.2863462638606523,2025-04-24 21:47:23.207842,2025-04-24 21:47:26.971242,0 days 00:00:03.763400,0.09384870164536019,4,,1,14,1476,0.7121779792842597,TPESampler,COMPLETE
678,0.6831937710064264,2025-04-24 21:47:24.851352,2025-04-24 21:47:25.772588,0 days 00:00:00.921236,0.0936133526864829,6,sqrt,9,4,112,0.7979069541666294,TPESampler,COMPLETE
679,0.27684757622013345,2025-04-24 21:47:25.979029,2025-04-24 21:47:30.236799,0 days 00:00:04.257770,0.07292667332207992,10,,1,15,1235,0.7121865526396026,TPESampler,COMPLETE
680,0.32969105926478115,2025-04-24 21:47:27.284892,2025-04-24 21:47:30.844874,0 days 00:00:03.559982,0.07768916448259876,8,,2,12,1189,0.6546805783091711,TPESampler,COMPLETE
681,0.2930012172676316,2025-04-24 21:47:27.686973,2025-04-24 21:47:30.207781,0 days 00:00:02.520808,0.09880131251881889,4,,1,10,1127,0.6979897658604324,TPESampler,COMPLETE
682,0.2705214144737554,2025-04-24 21:47:30.371082,2025-04-24 21:47:34.271191,0 days 00:00:03.900109,0.09138925543152851,6,,1,11,1389,0.6920759024297956,TPESampler,COMPLETE
683,0.2911096238481762,2025-04-24 21:47:30.414500,2025-04-24 21:47:35.020665,0 days 00:00:04.606165,0.0917850385321297,7,,1,9,1465,0.7159033098819314,TPESampler,COMPLETE
684,0.7406251180386998,2025-04-24 21:47:31.117293,2025-04-24 21:47:32.901123,0 days 00:00:01.783830,0.011213507543430866,10,log2,6,12,995,0.8354888449177676,TPESampler,COMPLETE
685,0.42595151451134405,2025-04-24 21:47:33.096550,2025-04-24 21:47:36.079916,0 days 00:00:02.983366,0.09013565281713694,8,,7,8,856,0.9707633338196163,TPESampler,COMPLETE
686,0.3408577564121724,2025-04-24 21:47:34.463559,2025-04-24 21:47:38.302335,0 days 00:00:03.838776,0.08758402501123785,9,,3,16,1464,0.6465911702849907,TPESampler,COMPLETE
687,0.3920994068307762,2025-04-24 21:47:35.210913,2025-04-24 21:47:38.546775,0 days 00:00:03.335862,0.06404169915163696,4,,5,11,1466,0.761232849778731,TPESampler,COMPLETE
688,0.29001653663053567,2025-04-24 21:47:36.267966,2025-04-24 21:47:39.647418,0 days 00:00:03.379452,0.05829798232412916,6,,1,12,1321,0.72190498050736,TPESampler,COMPLETE
689,0.28414269496258343,2025-04-24 21:47:38.498566,2025-04-24 21:47:42.457487,0 days 00:00:03.958921,0.05805466784321401,9,,1,8,1450,0.7512717127249425,TPESampler,COMPLETE
690,0.2675218460194355,2025-04-24 21:47:38.780243,2025-04-24 21:47:42.073969,0 days 00:00:03.293726,0.08152356631027861,9,,1,10,1208,0.6642012609298688,TPESampler,COMPLETE
691,0.2747723094125798,2025-04-24 21:47:39.836214,2025-04-24 21:47:43.516265,0 days 00:00:03.680051,0.05032247412610483,10,,1,14,1222,0.7540663624275193,TPESampler,COMPLETE
692,0.3228573270444687,2025-04-24 21:47:42.315981,2025-04-24 21:47:44.563344,0 days 00:00:02.247363,0.04879742563834753,10,log2,1,12,1265,0.7545195329700628,TPESampler,COMPLETE
693,0.3837612675503003,2025-04-24 21:47:42.668565,2025-04-24 21:47:46.390676,0 days 00:00:03.722111,0.09384473492480078,8,,3,7,1304,0.6786268623277923,TPESampler,COMPLETE
694,0.2668868429426667,2025-04-24 21:47:43.724835,2025-04-24 21:47:47.053156,0 days 00:00:03.328321,0.07508852617823963,8,,1,9,1181,0.6609590991277668,TPESampler,COMPLETE
695,0.36510722282815555,2025-04-24 21:47:44.756141,2025-04-24 21:47:47.772603,0 days 00:00:03.016462,0.07666408558830548,10,,4,14,1013,0.6787775349406309,TPESampler,COMPLETE
696,0.690190291361432,2025-04-24 21:47:46.753496,2025-04-24 21:47:48.081396,0 days 00:00:01.327900,0.017170966175759347,9,sqrt,6,13,252,0.6875125890252292,TPESampler,COMPLETE
697,0.27748587471744635,2025-04-24 21:47:47.328745,2025-04-24 21:47:52.402432,0 days 00:00:05.073687,0.07720700878397671,9,,1,9,1465,0.6875830458255796,TPESampler,COMPLETE
698,0.30775146404526527,2025-04-24 21:47:48.399587,2025-04-24 21:47:51.839131,0 days 00:00:03.439544,0.07064929541179703,8,sqrt,1,13,1191,0.6939493717611654,TPESampler,COMPLETE
699,0.39426545147580755,2025-04-24 21:47:48.564491,2025-04-24 21:47:51.900542,0 days 00:00:03.336051,0.015236244266656611,3,,1,12,733,0.945399486574528,TPESampler,COMPLETE
700,0.3511215887272666,2025-04-24 21:47:52.002407,2025-04-24 21:47:54.534246,0 days 00:00:02.531839,0.09058816940736383,8,log2,1,15,1072,0.7089478410685662,TPESampler,COMPLETE
701,0.34618320263863966,2025-04-24 21:47:52.360368,2025-04-24 21:47:56.069484,0 days 00:00:03.709116,0.09090273564792517,7,,2,5,1113,0.6508535074831557,TPESampler,COMPLETE
702,0.5998285515835119,2025-04-24 21:47:53.083144,2025-04-24 21:47:55.453044,0 days 00:00:02.369900,0.011548368517851957,12,,10,7,432,0.9704593877037456,TPESampler,COMPLETE
703,0.7294904820587038,2025-04-24 21:47:54.934269,2025-04-24 21:47:56.670998,0 days 00:00:01.736729,0.026526870323803874,5,log2,9,16,999,0.9675699966283464,TPESampler,COMPLETE
704,0.516618627903409,2025-04-24 21:47:55.715162,2025-04-24 21:47:58.130397,0 days 00:00:02.415235,0.010793266913912618,6,sqrt,5,17,1114,0.6393759082504686,TPESampler,COMPLETE
705,0.27382001246061727,2025-04-24 21:47:56.454655,2025-04-24 21:48:00.322544,0 days 00:00:03.867889,0.05019439587618919,9,,1,9,1141,0.6776048306261121,TPESampler,COMPLETE
706,0.2788489627214904,2025-04-24 21:47:57.035761,2025-04-24 21:48:01.344908,0 days 00:00:04.309147,0.0980729447926772,9,,1,10,1238,0.728123651576439,TPESampler,COMPLETE
707,0.35119301644722994,2025-04-24 21:47:58.403319,2025-04-24 21:48:00.170036,0 days 00:00:01.766717,0.07503562017460601,6,log2,1,10,1005,0.6002974110514493,TPESampler,COMPLETE
708,0.3572179112220111,2025-04-24 21:48:00.324377,2025-04-24 21:48:04.516296,0 days 00:00:04.191919,0.08712064072613145,9,,2,9,1227,0.6751027691270719,TPESampler,COMPLETE
709,0.40053766346238356,2025-04-24 21:48:00.500409,2025-04-24 21:48:02.983374,0 days 00:00:02.482965,0.028215277294367288,4,log2,1,16,1219,0.9259766205594978,TPESampler,COMPLETE
710,0.3405757444022684,2025-04-24 21:48:01.548623,2025-04-24 21:48:03.409390,0 days 00:00:01.860767,0.08170102535712206,8,sqrt,2,4,696,0.6227630457415843,TPESampler,COMPLETE
711,0.26938121160343714,2025-04-24 21:48:03.197532,2025-04-24 21:48:06.824645,0 days 00:00:03.627113,0.06353070828047448,10,,1,10,1054,0.6447881418931785,TPESampler,COMPLETE
712,0.693318917433629,2025-04-24 21:48:03.617603,2025-04-24 21:48:04.785211,0 days 00:00:01.167608,0.04777944278754473,11,log2,9,17,521,0.6810185276348242,TPESampler,COMPLETE
713,0.3087575054672763,2025-04-24 21:48:04.743246,2025-04-24 21:48:06.917590,0 days 00:00:02.174344,0.09322407415627353,12,sqrt,1,4,1050,0.7619475319665876,TPESampler,COMPLETE
714,0.7669436733356311,2025-04-24 21:48:04.988236,2025-04-24 21:48:05.993170,0 days 00:00:01.004934,0.011578479502685542,4,sqrt,6,14,218,0.8262360532031418,TPESampler,COMPLETE
715,0.3474729881845336,2025-04-24 21:48:06.244211,2025-04-24 21:48:07.926950,0 days 00:00:01.682739,0.07501191506292504,9,sqrt,2,12,774,0.7047805391912966,TPESampler,COMPLETE
716,0.32434843782877343,2025-04-24 21:48:07.048878,2025-04-24 21:48:09.828483,0 days 00:00:02.779605,0.04883798316759691,11,,2,11,787,0.6533807607658311,TPESampler,COMPLETE
717,0.4228284064110083,2025-04-24 21:48:07.142992,2025-04-24 21:48:11.501443,0 days 00:00:04.358451,0.0969388257498744,10,,5,13,1245,0.9593592213849764,TPESampler,COMPLETE
718,0.2775518347577456,2025-04-24 21:48:08.149454,2025-04-24 21:48:11.535991,0 days 00:00:03.386537,0.08069854322056293,8,,1,12,1260,0.653502235644507,TPESampler,COMPLETE
719,0.27659794402717297,2025-04-24 21:48:10.024258,2025-04-24 21:48:13.015058,0 days 00:00:02.990800,0.07812379044245275,9,,1,13,1033,0.6630927071876096,TPESampler,COMPLETE
720,0.3510245632375819,2025-04-24 21:48:11.788783,2025-04-24 21:48:15.534189,0 days 00:00:03.745406,0.061674504916463015,10,,2,9,1068,0.672648998884132,TPESampler,COMPLETE
721,0.5301119328071455,2025-04-24 21:48:11.853139,2025-04-24 21:48:13.039535,0 days 00:00:01.186396,0.09497950406659385,12,sqrt,6,2,146,0.7452998937976035,TPESampler,COMPLETE
722,0.4137489470966672,2025-04-24 21:48:13.156066,2025-04-24 21:48:14.532889,0 days 00:00:01.376823,0.026489541167164697,12,sqrt,4,17,342,0.924049674569557,TPESampler,COMPLETE
723,0.28705068457204264,2025-04-24 21:48:13.202545,2025-04-24 21:48:17.148030,0 days 00:00:03.945485,0.08485273894847926,9,,1,7,1297,0.633830172074067,TPESampler,COMPLETE
724,0.34408616964560546,2025-04-24 21:48:14.721778,2025-04-24 21:48:18.503892,0 days 00:00:03.782114,0.06379973045500874,7,,3,10,1359,0.7618942023217278,TPESampler,COMPLETE
725,0.36236131190944504,2025-04-24 21:48:15.723382,2025-04-24 21:48:17.643373,0 days 00:00:01.919991,0.016921845049922803,6,sqrt,1,7,872,0.9883402361850351,TPESampler,COMPLETE
726,0.37057894664332497,2025-04-24 21:48:17.342862,2025-04-24 21:48:20.786039,0 days 00:00:03.443177,0.08902592542610054,8,,4,12,1201,0.6954557453399512,TPESampler,COMPLETE
727,0.36155850675414986,2025-04-24 21:48:17.841137,2025-04-24 21:48:20.382590,0 days 00:00:02.541453,0.027628228202217435,12,log2,1,2,1163,0.8618024424611729,TPESampler,COMPLETE
728,0.41396485079734896,2025-04-24 21:48:18.693618,2025-04-24 21:48:20.948880,0 days 00:00:02.255262,0.02253731274535001,4,,6,15,780,0.639214721796166,TPESampler,COMPLETE
729,0.3197069470560834,2025-04-24 21:48:20.574065,2025-04-24 21:48:23.473447,0 days 00:00:02.899382,0.09364376950235657,5,,3,16,1194,0.7356563046996777,TPESampler,COMPLETE
730,0.2869395419609938,2025-04-24 21:48:20.985619,2025-04-24 21:48:24.071059,0 days 00:00:03.085440,0.05762478582598561,11,,1,9,946,0.7154620926492681,TPESampler,COMPLETE
731,0.28434318814777176,2025-04-24 21:48:21.204045,2025-04-24 21:48:24.272509,0 days 00:00:03.068464,0.07399352584457511,10,,1,6,952,0.6816687456866827,TPESampler,COMPLETE
732,0.3359512662293379,2025-04-24 21:48:23.668228,2025-04-24 21:48:26.547769,0 days 00:00:02.879541,0.0877712474657225,8,,2,9,1086,0.6224282020329603,TPESampler,COMPLETE
733,0.36641805217323153,2025-04-24 21:48:24.282999,2025-04-24 21:48:26.806508,0 days 00:00:02.523509,0.07149168078102597,10,,3,9,903,0.6870566585426042,TPESampler,COMPLETE
734,0.34313512441081956,2025-04-24 21:48:24.475985,2025-04-24 21:48:27.694878,0 days 00:00:03.218893,0.09555361614385403,8,,3,15,1155,0.678930984190848,TPESampler,COMPLETE
735,0.2824493633954149,2025-04-24 21:48:26.741475,2025-04-24 21:48:29.922151,0 days 00:00:03.180676,0.07610293454127483,9,,1,12,1142,0.6786286797335133,TPESampler,COMPLETE
736,0.2810895377269396,2025-04-24 21:48:27.029751,2025-04-24 21:48:30.922841,0 days 00:00:03.893090,0.08074910550849328,10,,1,11,1382,0.7146321024097557,TPESampler,COMPLETE
737,0.26555549956049945,2025-04-24 21:48:27.875839,2025-04-24 21:48:30.962833,0 days 00:00:03.086994,0.0903149543696646,9,,1,9,1133,0.6490224790654294,TPESampler,COMPLETE
738,0.28227843065553737,2025-04-24 21:48:30.112526,2025-04-24 21:48:32.804181,0 days 00:00:02.691655,0.04672072906033637,10,,1,8,901,0.6387013550146553,TPESampler,COMPLETE
739,0.29518987445470757,2025-04-24 21:48:31.065417,2025-04-24 21:48:34.882568,0 days 00:00:03.817151,0.07236524138519262,10,,1,6,1187,0.6326338142235054,TPESampler,COMPLETE
740,0.2899483934886401,2025-04-24 21:48:31.120627,2025-04-24 21:48:35.434696,0 days 00:00:04.314069,0.06890828492379569,9,,1,4,1448,0.6042772577160581,TPESampler,COMPLETE
741,0.3407873413082724,2025-04-24 21:48:33.001242,2025-04-24 21:48:34.851498,0 days 00:00:01.850256,0.05764050288110142,9,log2,1,11,990,0.6248447702435064,TPESampler,COMPLETE
742,0.27965515536658203,2025-04-24 21:48:35.013802,2025-04-24 21:48:38.028252,0 days 00:00:03.014450,0.08820919381216338,7,,1,11,1131,0.7115709103104446,TPESampler,COMPLETE
743,0.35978329266630293,2025-04-24 21:48:35.061965,2025-04-24 21:48:37.776402,0 days 00:00:02.714437,0.09388982878201554,10,,2,9,881,0.6871570012629127,TPESampler,COMPLETE
744,0.28691142848655377,2025-04-24 21:48:35.696317,2025-04-24 21:48:38.026870,0 days 00:00:02.330553,0.08207617781596732,7,,1,6,870,0.7080567160177187,TPESampler,COMPLETE
745,0.5497173175709581,2025-04-24 21:48:37.973641,2025-04-24 21:48:39.290584,0 days 00:00:01.316943,0.01030801190396986,9,sqrt,6,13,644,0.8964657256589861,TPESampler,COMPLETE
746,0.3530366656126225,2025-04-24 21:48:38.250619,2025-04-24 21:48:41.009951,0 days 00:00:02.759332,0.09251617932995153,11,sqrt,2,17,1029,0.6035831303687271,TPESampler,COMPLETE
747,0.516298492734318,2025-04-24 21:48:38.284051,2025-04-24 21:48:39.921509,0 days 00:00:01.637458,0.09549450020565932,9,log2,5,14,408,0.7468179328763644,TPESampler,COMPLETE
748,0.41247524762601484,2025-04-24 21:48:39.522571,2025-04-24 21:48:40.914621,0 days 00:00:01.392050,0.052941946110865994,6,sqrt,4,16,374,0.9088738222135848,TPESampler,COMPLETE
