number,value,datetime_start,datetime_complete,duration,params_learning_rate,params_max_depth,params_max_features,params_min_samples_leaf,params_min_samples_split,params_n_estimators,params_subsample,system_attrs_auto:sampler,state
2248,0.31696187789528746,2025-04-24 22:15:50.141711,2025-04-24 22:15:53.502765,0 days 00:00:03.361054,0.03915036791996643,8,,2,11,1138,0.6050632606506178,TPESampler,COMPLETE
2249,0.27539529115379396,2025-04-24 22:15:51.112074,2025-04-24 22:15:54.754517,0 days 00:00:03.642443,0.0563593488016171,6,,1,8,1215,0.6616232941788753,TPESampler,COMPLETE
2250,0.34401377077826534,2025-04-24 22:15:51.401457,2025-04-24 22:15:54.110745,0 days 00:00:02.709288,0.08720247061595188,10,,3,13,762,0.6134442589591262,TPESampler,COMPLETE
2251,0.3601259200296578,2025-04-24 22:15:53.711250,2025-04-24 22:15:54.818194,0 days 00:00:01.106944,0.08798338527591373,9,sqrt,3,10,183,0.7915972033296755,TPESampler,COMPLETE
2252,0.3038779083029751,2025-04-24 22:15:54.346098,2025-04-24 22:15:57.871222,0 days 00:00:03.525124,0.06142662830692926,8,,1,3,985,0.6722076196530848,TPESampler,COMPLETE
2253,0.27417582278957847,2025-04-24 22:15:55.194664,2025-04-24 22:15:59.176439,0 days 00:00:03.981775,0.05636804573148608,10,,1,11,1044,0.6534775921972986,TPESampler,COMPLETE
2254,0.48761201018238337,2025-04-24 22:15:55.240481,2025-04-24 22:15:57.705785,0 days 00:00:02.465304,0.08426604419780556,5,sqrt,8,16,1311,0.7594398377896281,TPESampler,COMPLETE
2255,0.2904238012948528,2025-04-24 22:15:57.906013,2025-04-24 22:16:00.120008,0 days 00:00:02.213995,0.09510551202338867,8,sqrt,1,5,1030,0.6622680110475172,TPESampler,COMPLETE
2256,0.26997190171603613,2025-04-24 22:15:58.081219,2025-04-24 22:16:03.055184,0 days 00:00:04.973965,0.04756453487553059,9,,1,9,1490,0.6277018843966132,TPESampler,COMPLETE
2257,0.5047751838567714,2025-04-24 22:15:59.395471,2025-04-24 22:16:00.744882,0 days 00:00:01.349411,0.01962038171157677,8,,8,6,130,0.8951168483748432,TPESampler,COMPLETE
2258,0.33943054489437063,2025-04-24 22:16:00.350168,2025-04-24 22:16:03.667986,0 days 00:00:03.317818,0.0672716970549185,7,,3,9,1054,0.604788869235861,TPESampler,COMPLETE
2259,0.8597329270459362,2025-04-24 22:16:00.991970,2025-04-24 22:16:02.052911,0 days 00:00:01.060941,0.02569326676774065,6,log2,9,6,222,0.9165266494232659,TPESampler,COMPLETE
2260,0.36851294907554893,2025-04-24 22:16:02.276385,2025-04-24 22:16:05.857875,0 days 00:00:03.581490,0.044017953245918624,12,,4,13,1221,0.6009846070943496,TPESampler,COMPLETE
2261,0.2828237435512977,2025-04-24 22:16:03.258655,2025-04-24 22:16:07.326507,0 days 00:00:04.067852,0.04681762468188479,9,,1,14,1426,0.69745612019501,TPESampler,COMPLETE
2262,0.2678365632381432,2025-04-24 22:16:03.916151,2025-04-24 22:16:07.671305,0 days 00:00:03.755154,0.08165068574451587,7,,1,15,1426,0.6727020985483451,TPESampler,COMPLETE
2263,0.27538560405308266,2025-04-24 22:16:06.070136,2025-04-24 22:16:09.453073,0 days 00:00:03.382937,0.06201194361149472,9,,1,14,1148,0.6214671675495357,TPESampler,COMPLETE
2264,0.34811716177368884,2025-04-24 22:16:07.535760,2025-04-24 22:16:10.597323,0 days 00:00:03.061563,0.069610976293655,9,,3,9,1057,0.6156800008491511,TPESampler,COMPLETE
2265,0.35196483271796225,2025-04-24 22:16:07.961900,2025-04-24 22:16:11.526893,0 days 00:00:03.564993,0.07435099312559357,8,,2,9,1295,0.6129284830145272,TPESampler,COMPLETE
2266,0.26823873883732324,2025-04-24 22:16:09.665615,2025-04-24 22:16:13.494810,0 days 00:00:03.829195,0.07309024146911614,10,,1,15,1306,0.6245464155607068,TPESampler,COMPLETE
2267,0.28967589256592663,2025-04-24 22:16:10.808681,2025-04-24 22:16:14.714843,0 days 00:00:03.906162,0.03655811371149564,8,,1,12,1453,0.6006929039728346,TPESampler,COMPLETE
2268,0.2948219085884234,2025-04-24 22:16:11.736664,2025-04-24 22:16:14.056665,0 days 00:00:02.320001,0.05377983461135878,8,,1,12,748,0.6990087256107513,TPESampler,COMPLETE
2269,0.3578775552818449,2025-04-24 22:16:13.712044,2025-04-24 22:16:17.728934,0 days 00:00:04.016890,0.06788533923399612,8,,2,8,1477,0.6365770002221335,TPESampler,COMPLETE
2270,0.27755128550195823,2025-04-24 22:16:14.517545,2025-04-24 22:16:17.783746,0 days 00:00:03.266201,0.06172954867957711,8,,1,13,1250,0.6730351033050891,TPESampler,COMPLETE
2271,0.3431783112097888,2025-04-24 22:16:15.038611,2025-04-24 22:16:19.006287,0 days 00:00:03.967676,0.05869103644669231,10,,2,18,1483,0.6098055133143825,TPESampler,COMPLETE
2272,0.27987048164315254,2025-04-24 22:16:17.909327,2025-04-24 22:16:20.887161,0 days 00:00:02.977834,0.08352293477601269,10,,1,8,834,0.6553105185201278,TPESampler,COMPLETE
2273,0.27371157877618213,2025-04-24 22:16:17.953402,2025-04-24 22:16:22.215344,0 days 00:00:04.261942,0.055276076307079224,8,,1,8,1340,0.615933649926467,TPESampler,COMPLETE
2274,0.35374311766146055,2025-04-24 22:16:19.235587,2025-04-24 22:16:22.933458,0 days 00:00:03.697871,0.09877557620102029,10,,3,18,1160,0.7635788024877744,TPESampler,COMPLETE
2275,0.691132075008048,2025-04-24 22:16:21.242445,2025-04-24 22:16:22.868433,0 days 00:00:01.625988,0.016264964747616524,5,log2,6,13,758,0.9922324759361721,TPESampler,COMPLETE
2276,0.748029231658486,2025-04-24 22:16:22.445503,2025-04-24 22:16:23.425322,0 days 00:00:00.979819,0.010759462279617342,10,log2,1,9,137,0.8263149542345656,TPESampler,COMPLETE
2277,0.28491740901872026,2025-04-24 22:16:23.205396,2025-04-24 22:16:26.928565,0 days 00:00:03.723169,0.09077540180724025,9,,1,15,1042,0.6116472915303195,TPESampler,COMPLETE
2278,0.3438523564093755,2025-04-24 22:16:23.261286,2025-04-24 22:16:26.151002,0 days 00:00:02.889716,0.03143803261583366,9,log2,1,5,1290,0.6430095407266975,TPESampler,COMPLETE
2279,0.2684498488760151,2025-04-24 22:16:23.994272,2025-04-24 22:16:28.310125,0 days 00:00:04.315853,0.0762081297297705,7,,1,14,1416,0.6239214403804783,TPESampler,COMPLETE
2280,0.3298518122823388,2025-04-24 22:16:26.367278,2025-04-24 22:16:30.364609,0 days 00:00:03.997331,0.0526697323791653,9,,2,10,1342,0.6055012175888446,TPESampler,COMPLETE
2281,0.2958662516314972,2025-04-24 22:16:27.142917,2025-04-24 22:16:31.087021,0 days 00:00:03.944104,0.0720944482090613,10,,1,7,1235,0.6262901329623682,TPESampler,COMPLETE
2282,0.2912154004428046,2025-04-24 22:16:28.510219,2025-04-24 22:16:31.124448,0 days 00:00:02.614229,0.08689760757321634,10,,1,12,803,0.6749879693162414,TPESampler,COMPLETE
2283,0.2767712346113423,2025-04-24 22:16:30.573787,2025-04-24 22:16:33.453381,0 days 00:00:02.879594,0.07887354021677323,8,,1,9,945,0.6701168061081288,TPESampler,COMPLETE
2284,0.2888248782800277,2025-04-24 22:16:31.293605,2025-04-24 22:16:35.313904,0 days 00:00:04.020299,0.03235973994308149,10,,1,18,1483,0.6091130362812465,TPESampler,COMPLETE
2285,0.2767163499177911,2025-04-24 22:16:31.410406,2025-04-24 22:16:35.033241,0 days 00:00:03.622835,0.049675379974379125,8,,1,10,1307,0.626088719549808,TPESampler,COMPLETE
2286,0.2627494336499136,2025-04-24 22:16:33.659627,2025-04-24 22:16:37.538939,0 days 00:00:03.879312,0.06872475346672753,7,,1,13,1395,0.603177792180475,TPESampler,COMPLETE
2287,0.26919901157253734,2025-04-24 22:16:35.269201,2025-04-24 22:16:38.962954,0 days 00:00:03.693753,0.05480108186804062,9,,1,12,1228,0.6097162139389595,TPESampler,COMPLETE
2288,0.529255669481148,2025-04-24 22:16:35.650976,2025-04-24 22:16:36.624566,0 days 00:00:00.973590,0.01576787150308211,3,,6,10,116,0.6656596789124823,TPESampler,COMPLETE
2289,0.27519329212774324,2025-04-24 22:16:36.841976,2025-04-24 22:16:40.114125,0 days 00:00:03.272149,0.06355061809323358,7,,1,8,1112,0.6055167325873685,TPESampler,COMPLETE
2290,0.2922335378391964,2025-04-24 22:16:37.785055,2025-04-24 22:16:41.639970,0 days 00:00:03.854915,0.05967493630516093,7,,1,8,1416,0.6188485261769531,TPESampler,COMPLETE
2291,0.2870706755355773,2025-04-24 22:16:39.171082,2025-04-24 22:16:42.744467,0 days 00:00:03.573385,0.03482591414631995,5,,1,7,1382,0.6009093258375469,TPESampler,COMPLETE
2292,0.2718997724762919,2025-04-24 22:16:40.324708,2025-04-24 22:16:44.634198,0 days 00:00:04.309490,0.08415851343263958,9,,1,11,1405,0.6214715149229493,TPESampler,COMPLETE
2293,0.860055145597096,2025-04-24 22:16:41.861546,2025-04-24 22:16:42.870567,0 days 00:00:01.009021,0.022423731310358092,9,log2,6,20,205,0.9333746906371879,TPESampler,COMPLETE
2294,0.3534722260972089,2025-04-24 22:16:42.937013,2025-04-24 22:16:45.418474,0 days 00:00:02.481461,0.03819858016995618,3,,4,16,917,0.6562843162601298,TPESampler,COMPLETE
2295,0.3589060090784797,2025-04-24 22:16:43.070640,2025-04-24 22:16:45.620220,0 days 00:00:02.549580,0.019307823040743424,11,,4,10,573,0.6796277572785112,TPESampler,COMPLETE
2296,0.33637412700544506,2025-04-24 22:16:44.856359,2025-04-24 22:16:49.105802,0 days 00:00:04.249443,0.09212943292305416,7,,2,14,1387,0.622989333033504,TPESampler,COMPLETE
2297,0.42069672364714866,2025-04-24 22:16:45.675831,2025-04-24 22:16:47.898551,0 days 00:00:02.222720,0.0572205240292131,6,log2,3,12,1190,0.6209478485449312,TPESampler,COMPLETE
2298,0.28144510517786814,2025-04-24 22:16:45.870854,2025-04-24 22:16:50.350429,0 days 00:00:04.479575,0.08332299227318563,6,,1,11,1495,0.6659068725251552,TPESampler,COMPLETE
2299,0.42625051528505514,2025-04-24 22:16:48.128675,2025-04-24 22:16:51.461792,0 days 00:00:03.333117,0.030943518430652052,6,,7,19,947,0.8739087824875115,TPESampler,COMPLETE
2300,0.43835096057050094,2025-04-24 22:16:49.315552,2025-04-24 22:16:51.469893,0 days 00:00:02.154341,0.06192129044441395,6,log2,6,7,1281,0.9300204809955164,TPESampler,COMPLETE
2301,0.28381252804659624,2025-04-24 22:16:50.589473,2025-04-24 22:16:54.740610,0 days 00:00:04.151137,0.06625714172935894,5,,1,11,1267,0.6073082365394725,TPESampler,COMPLETE
2302,0.28250560883030956,2025-04-24 22:16:51.674815,2025-04-24 22:16:55.873505,0 days 00:00:04.198690,0.08795136091754173,9,,1,13,1163,0.6014266370266297,TPESampler,COMPLETE
2303,0.6895922634310707,2025-04-24 22:16:51.802087,2025-04-24 22:16:54.451716,0 days 00:00:02.649629,0.010026389362017623,7,log2,5,4,1403,0.6101590762797604,TPESampler,COMPLETE
2304,0.3168506624116064,2025-04-24 22:16:54.659264,2025-04-24 22:16:58.192314,0 days 00:00:03.533050,0.0848527632829064,5,,2,15,1293,0.6033691864084026,TPESampler,COMPLETE
2305,0.33167282620688393,2025-04-24 22:16:55.048815,2025-04-24 22:16:59.393970,0 days 00:00:04.345155,0.08916828177912546,7,,2,11,1411,0.6041238831405397,TPESampler,COMPLETE
2306,0.3365384241299989,2025-04-24 22:16:56.093395,2025-04-24 22:16:58.488913,0 days 00:00:02.395518,0.07305047813772182,8,log2,1,10,1288,0.6232865292433533,TPESampler,COMPLETE
2307,0.28351412702055073,2025-04-24 22:16:58.431606,2025-04-24 22:17:02.617157,0 days 00:00:04.185551,0.05599075865961651,8,,1,12,1364,0.6136028573465281,TPESampler,COMPLETE
2308,0.33193198060100365,2025-04-24 22:16:58.723514,2025-04-24 22:17:01.638373,0 days 00:00:02.914859,0.061527914007133165,10,log2,1,16,1450,0.6503567478607543,TPESampler,COMPLETE
2309,0.3455473324676289,2025-04-24 22:16:59.636821,2025-04-24 22:17:04.078148,0 days 00:00:04.441327,0.07929958700467812,7,,3,17,1495,0.6266856927950959,TPESampler,COMPLETE
2310,0.37401842525691115,2025-04-24 22:17:01.863496,2025-04-24 22:17:04.256720,0 days 00:00:02.393224,0.019901132147991978,11,log2,1,19,1236,0.9773389570594377,TPESampler,COMPLETE
2311,0.2794485818185885,2025-04-24 22:17:02.846670,2025-04-24 22:17:06.414729,0 days 00:00:03.568059,0.06390775349092767,8,,1,10,1146,0.683177453619513,TPESampler,COMPLETE
2312,0.273754877569979,2025-04-24 22:17:04.273846,2025-04-24 22:17:07.462248,0 days 00:00:03.188402,0.08187382280418803,6,,1,13,1168,0.615442077892516,TPESampler,COMPLETE
2313,0.2683295147765386,2025-04-24 22:17:04.469812,2025-04-24 22:17:08.176141,0 days 00:00:03.706329,0.09672724067319993,8,,1,16,1259,0.7016181613410941,TPESampler,COMPLETE
2314,0.33293888965177465,2025-04-24 22:17:06.637850,2025-04-24 22:17:10.476528,0 days 00:00:03.838678,0.056554847540461244,9,,3,15,1046,0.7587887094759181,TPESampler,COMPLETE
2315,0.3147934336057943,2025-04-24 22:17:07.678928,2025-04-24 22:17:11.842450,0 days 00:00:04.163522,0.055543884365294505,8,,2,17,1491,0.6041013663844808,TPESampler,COMPLETE
2316,0.7437709176071783,2025-04-24 22:17:08.415357,2025-04-24 22:17:09.925964,0 days 00:00:01.510607,0.01526062007873972,11,sqrt,9,5,582,0.6132801417595409,TPESampler,COMPLETE
2317,0.3202380458372313,2025-04-24 22:17:10.359576,2025-04-24 22:17:14.232838,0 days 00:00:03.873262,0.06927797771977282,6,,2,14,1414,0.6007457184397114,TPESampler,COMPLETE
2318,0.27414900902191996,2025-04-24 22:17:10.949996,2025-04-24 22:17:14.228989,0 days 00:00:03.278993,0.046340035962280285,9,,1,16,1193,0.6018789564377239,TPESampler,COMPLETE
2319,0.3170232485793562,2025-04-24 22:17:12.069990,2025-04-24 22:17:15.785252,0 days 00:00:03.715262,0.09125162256624209,6,,2,19,1250,0.8091457833084802,TPESampler,COMPLETE
2320,0.27694074623150616,2025-04-24 22:17:14.430949,2025-04-24 22:17:18.827335,0 days 00:00:04.396386,0.09643304451373615,8,,1,17,1417,0.6455471419297429,TPESampler,COMPLETE
2321,0.3339030804153597,2025-04-24 22:17:14.474287,2025-04-24 22:17:17.392261,0 days 00:00:02.917974,0.016764457936895006,10,,3,17,633,0.8354082169664375,TPESampler,COMPLETE
2322,0.27779035937663965,2025-04-24 22:17:16.037130,2025-04-24 22:17:20.088744,0 days 00:00:04.051614,0.047120922443747035,7,,1,9,1368,0.6194183576832116,TPESampler,COMPLETE
2323,0.4136076518392247,2025-04-24 22:17:17.603472,2025-04-24 22:17:19.967737,0 days 00:00:02.364265,0.03186476160865789,3,log2,1,2,1312,0.9327814203821644,TPESampler,COMPLETE
2324,0.42034419960506386,2025-04-24 22:17:19.056046,2025-04-24 22:17:21.468302,0 days 00:00:02.412256,0.0843494316075717,5,sqrt,6,4,1169,0.7308608540747581,TPESampler,COMPLETE
2325,0.269772651297257,2025-04-24 22:17:20.175830,2025-04-24 22:17:25.243315,0 days 00:00:05.067485,0.07006430493997486,8,,1,12,1476,0.6712152331767709,TPESampler,COMPLETE
2326,0.3289339057373661,2025-04-24 22:17:20.302390,2025-04-24 22:17:24.664215,0 days 00:00:04.361825,0.06864627556547086,7,,2,12,1215,0.6542346618417129,TPESampler,COMPLETE
2327,0.39573454720530393,2025-04-24 22:17:21.691821,2025-04-24 22:17:23.559476,0 days 00:00:01.867655,0.056162949211542135,4,log2,1,2,762,0.7646230895247339,TPESampler,COMPLETE
2328,0.6742847074750924,2025-04-24 22:17:23.755158,2025-04-24 22:17:24.823815,0 days 00:00:01.068657,0.0936875447240055,5,sqrt,10,2,303,0.9205899000818758,TPESampler,COMPLETE
2329,0.6579093754767924,2025-04-24 22:17:24.885143,2025-04-24 22:17:26.200489,0 days 00:00:01.315346,0.05642926482950771,9,sqrt,9,2,340,0.7717047316393303,TPESampler,COMPLETE
2330,0.7585684877355302,2025-04-24 22:17:25.107670,2025-04-24 22:17:26.719832,0 days 00:00:01.612162,0.010080980314852973,8,sqrt,8,8,327,0.9081563455570248,TPESampler,COMPLETE
2331,0.3618185832195911,2025-04-24 22:17:25.646569,2025-04-24 22:17:28.751116,0 days 00:00:03.104547,0.035305129653747894,12,,4,9,723,0.811361243617927,TPESampler,COMPLETE
2332,0.27435397061933303,2025-04-24 22:17:26.475389,2025-04-24 22:17:28.848262,0 days 00:00:02.372873,0.07210350404017624,9,,1,13,681,0.6552952770278053,TPESampler,COMPLETE
2333,0.28269804295203593,2025-04-24 22:17:26.990866,2025-04-24 22:17:30.584880,0 days 00:00:03.594014,0.04699362346410515,8,,1,5,1223,0.6044199135113241,TPESampler,COMPLETE
2334,0.27676027566437644,2025-04-24 22:17:28.938747,2025-04-24 22:17:33.228591,0 days 00:00:04.289844,0.06197900603172504,8,,1,7,1382,0.64624857946369,TPESampler,COMPLETE
2335,0.2895678278738299,2025-04-24 22:17:29.083266,2025-04-24 22:17:32.402247,0 days 00:00:03.318981,0.09927062028280087,3,,1,17,1409,0.6131858011036746,TPESampler,COMPLETE
2336,0.2593691654006791,2025-04-24 22:17:30.791311,2025-04-24 22:17:34.830127,0 days 00:00:04.038816,0.07349589206376055,9,,1,11,1232,0.6113053925054044,TPESampler,COMPLETE
2337,0.41981786051630426,2025-04-24 22:17:32.613376,2025-04-24 22:17:33.819741,0 days 00:00:01.206365,0.05368166025394794,6,sqrt,3,20,246,0.6343818277348988,TPESampler,COMPLETE
2338,0.6370582107883664,2025-04-24 22:17:33.465996,2025-04-24 22:17:35.856252,0 days 00:00:02.390256,0.027411984792738833,12,,10,10,570,0.8606030757396814,TPESampler,COMPLETE
2339,0.3482057242389232,2025-04-24 22:17:34.077368,2025-04-24 22:17:37.166782,0 days 00:00:03.089414,0.07891684798294539,11,,3,9,941,0.6144809664002402,TPESampler,COMPLETE
2340,0.28102733518720296,2025-04-24 22:17:35.053809,2025-04-24 22:17:38.906861,0 days 00:00:03.853052,0.05745952946122874,8,,1,13,1357,0.6063111334817821,TPESampler,COMPLETE
2341,0.2747249769844925,2025-04-24 22:17:36.069246,2025-04-24 22:17:39.974301,0 days 00:00:03.905055,0.06717813142911905,10,,1,12,1306,0.6559287028078101,TPESampler,COMPLETE
2342,0.3281892536275434,2025-04-24 22:17:37.367586,2025-04-24 22:17:40.643628,0 days 00:00:03.276042,0.05596225439252211,7,,2,12,1190,0.6002531117635691,TPESampler,COMPLETE
2343,0.3178441274916232,2025-04-24 22:17:39.120576,2025-04-24 22:17:41.986544,0 days 00:00:02.865968,0.05885178287988616,8,,3,13,932,0.6227715672689049,TPESampler,COMPLETE
2344,0.2880517727432618,2025-04-24 22:17:40.194103,2025-04-24 22:17:44.914641,0 days 00:00:04.720538,0.06884124318302182,6,,1,15,1411,0.7989630172920735,TPESampler,COMPLETE
2345,0.5417240182957999,2025-04-24 22:17:40.957626,2025-04-24 22:17:42.293957,0 days 00:00:01.336331,0.02075153882995415,7,sqrt,6,5,489,0.7614886112729188,TPESampler,COMPLETE
2346,0.4511833011104962,2025-04-24 22:17:42.212673,2025-04-24 22:17:45.265669,0 days 00:00:03.052996,0.010762141631750327,11,,8,19,832,0.7923581484282208,TPESampler,COMPLETE
2347,0.6247003024833467,2025-04-24 22:17:42.601506,2025-04-24 22:17:44.143016,0 days 00:00:01.541510,0.022638928095590823,4,,9,20,510,0.6426559533958389,TPESampler,COMPLETE
2348,0.263165008221748,2025-04-24 22:17:44.402318,2025-04-24 22:17:48.557092,0 days 00:00:04.154774,0.052911323231682586,7,,1,11,1481,0.6027537561264028,TPESampler,COMPLETE
2349,0.3460711051857605,2025-04-24 22:17:45.599398,2025-04-24 22:17:49.241450,0 days 00:00:03.642052,0.07400835966272283,9,,3,15,1122,0.6547018787029185,TPESampler,COMPLETE
2350,0.34244004633352343,2025-04-24 22:17:45.759565,2025-04-24 22:17:50.159305,0 days 00:00:04.399740,0.09672570798835947,9,,2,14,1257,0.6098110470826191,TPESampler,COMPLETE
2351,0.3723877866838172,2025-04-24 22:17:49.166217,2025-04-24 22:17:51.691458,0 days 00:00:02.525241,0.01272110355758142,12,sqrt,3,19,866,0.9972187032254867,TPESampler,COMPLETE
2352,0.2785699717425384,2025-04-24 22:17:49.775935,2025-04-24 22:17:54.325888,0 days 00:00:04.549953,0.05947906781125936,7,,1,13,1421,0.6133115611803309,TPESampler,COMPLETE
2353,0.2863233595623318,2025-04-24 22:17:50.580479,2025-04-24 22:17:54.478186,0 days 00:00:03.897707,0.07239996169243773,6,,1,11,1146,0.7072888369080386,TPESampler,COMPLETE
2354,0.27923524853500764,2025-04-24 22:17:52.580943,2025-04-24 22:17:56.389691,0 days 00:00:03.808748,0.04440276351714495,6,,1,11,1389,0.6093645589402197,TPESampler,COMPLETE
2355,0.27709135606858176,2025-04-24 22:17:54.787206,2025-04-24 22:17:58.790184,0 days 00:00:04.002978,0.0555047162101745,9,,1,12,1073,0.8412058072840642,TPESampler,COMPLETE
2356,0.2718074902707941,2025-04-24 22:17:54.829097,2025-04-24 22:17:58.759945,0 days 00:00:03.930848,0.05862776289358987,9,,1,14,984,0.6481176589561124,TPESampler,COMPLETE
2357,0.3475084719841181,2025-04-24 22:17:56.726652,2025-04-24 22:18:00.763207,0 days 00:00:04.036555,0.06895830216387769,7,,3,11,1422,0.6920145440032894,TPESampler,COMPLETE
2358,0.2819406361147069,2025-04-24 22:17:58.939495,2025-04-24 22:18:02.232218,0 days 00:00:03.292723,0.06219581880783212,6,,1,12,1226,0.6425804704890747,TPESampler,COMPLETE
2359,0.32324494954898686,2025-04-24 22:17:58.983237,2025-04-24 22:18:03.173221,0 days 00:00:04.189984,0.05578627910459066,7,,2,11,1491,0.6266183392414947,TPESampler,COMPLETE
2360,0.30443038413608153,2025-04-24 22:18:01.076147,2025-04-24 22:18:04.985800,0 days 00:00:03.909653,0.06601848373461111,5,,3,13,1406,0.6156890247792033,TPESampler,COMPLETE
2361,0.32547794634704375,2025-04-24 22:18:02.484166,2025-04-24 22:18:05.903707,0 days 00:00:03.419541,0.06772992669108843,8,,2,13,1035,0.6037834661135488,TPESampler,COMPLETE
2362,0.3622070320118132,2025-04-24 22:18:03.401124,2025-04-24 22:18:06.078521,0 days 00:00:02.677397,0.02815064685097054,4,sqrt,1,20,1332,0.8682539613100236,TPESampler,COMPLETE
2363,0.3364162236279969,2025-04-24 22:18:05.222736,2025-04-24 22:18:09.905450,0 days 00:00:04.682714,0.05191060553872683,7,,2,7,1434,0.6017398911866423,TPESampler,COMPLETE
2364,0.29451555259029216,2025-04-24 22:18:06.175804,2025-04-24 22:18:10.200728,0 days 00:00:04.024924,0.09878436538376312,9,,1,12,1214,0.6054080565392488,TPESampler,COMPLETE
2365,0.3316866489841946,2025-04-24 22:18:06.384893,2025-04-24 22:18:09.275395,0 days 00:00:02.890502,0.08784419556999915,7,sqrt,3,8,1424,0.6052397002122551,TPESampler,COMPLETE
2366,0.318042686235071,2025-04-24 22:18:09.488214,2025-04-24 22:18:13.440658,0 days 00:00:03.952444,0.050123142986170564,7,,3,13,1230,0.6013189076200758,TPESampler,COMPLETE
2367,0.2831967983929917,2025-04-24 22:18:10.147189,2025-04-24 22:18:14.162520,0 days 00:00:04.015331,0.06313272142081447,5,,1,14,1484,0.7070490479145198,TPESampler,COMPLETE
2368,0.6703696871722138,2025-04-24 22:18:10.516471,2025-04-24 22:18:12.692992,0 days 00:00:02.176521,0.07415656422441548,9,sqrt,10,9,1131,0.7667983687599542,TPESampler,COMPLETE
2369,0.2843088484346895,2025-04-24 22:18:12.903756,2025-04-24 22:18:17.513436,0 days 00:00:04.609680,0.07215427263293005,8,,1,13,1203,0.670552389334707,TPESampler,COMPLETE
2370,0.3663844505694136,2025-04-24 22:18:13.868572,2025-04-24 22:18:16.959996,0 days 00:00:03.091424,0.06103787693946859,8,sqrt,4,13,1462,0.7785124866805202,TPESampler,COMPLETE
2371,0.4655327082763876,2025-04-24 22:18:14.461916,2025-04-24 22:18:17.103290,0 days 00:00:02.641374,0.050630703219468706,9,log2,5,17,1287,0.60626247141501,TPESampler,COMPLETE
2372,0.28465094331521984,2025-04-24 22:18:17.161863,2025-04-24 22:18:21.455309,0 days 00:00:04.293446,0.06530769224501154,9,,1,11,1304,0.6004202961037971,TPESampler,COMPLETE
