number,value,datetime_start,datetime_complete,duration,params_learning_rate,params_max_depth,params_max_features,params_min_samples_leaf,params_min_samples_split,params_n_estimators,params_subsample,system_attrs_auto:sampler,state
0,0.5148211250847317,2025-04-24 21:35:23.462082,2025-04-24 21:35:24.514365,0 days 00:00:01.052283,0.05621511040717092,5,log2,2,2,287,0.6741090557544546,RandomSampler,COMPLETE
1,0.597576043954002,2025-04-24 21:35:23.474859,2025-04-24 21:35:25.146017,0 days 00:00:01.671158,0.013515114407117872,4,,9,16,498,0.8593351600845422,RandomSampler,COMPLETE
2,0.6056799933470818,2025-04-24 21:35:23.550058,2025-04-24 21:35:24.642687,0 days 00:00:01.092629,0.05027879133857618,3,,9,20,306,0.824970922655109,RandomSampler,COMPLETE
3,0.537332188399629,2025-04-24 21:35:24.689501,2025-04-24 21:35:26.060466,0 days 00:00:01.370965,0.020079417509736432,5,log2,2,20,663,0.8342094462586056,TPESampler,COMPLETE
4,0.3482971290027229,2025-04-24 21:35:24.897437,2025-04-24 21:35:26.363048,0 days 00:00:01.465611,0.037399273729280424,7,sqrt,1,20,493,0.6763022755583494,TPESampler,COMPLETE
5,0.7379773446738715,2025-04-24 21:35:25.364461,2025-04-24 21:35:26.196386,0 days 00:00:00.831925,0.012320978325719045,8,sqrt,4,4,163,0.7326978893137135,TPESampler,COMPLETE
6,0.30147318288501274,2025-04-24 21:35:26.247950,2025-04-24 21:35:27.809292,0 days 00:00:01.561342,0.03633472807271973,7,,1,4,413,0.618525329945269,TPESampler,COMPLETE
7,0.6600263410894074,2025-04-24 21:35:26.484561,2025-04-24 21:35:28.688133,0 days 00:00:02.203572,0.015407624872516696,5,sqrt,10,8,1082,0.6975187635349815,TPESampler,COMPLETE
8,0.3731402060354847,2025-04-24 21:35:26.566620,2025-04-24 21:35:29.188979,0 days 00:00:02.622359,0.04752893126029572,11,sqrt,4,19,1172,0.8005581526000674,TPESampler,COMPLETE
9,0.3466847543748029,2025-04-24 21:35:28.025872,2025-04-24 21:35:29.583630,0 days 00:00:01.557758,0.059063984557503266,12,sqrt,2,18,615,0.9400547147467336,TPESampler,COMPLETE
10,0.44058255634482096,2025-04-24 21:35:28.881611,2025-04-24 21:35:30.722079,0 days 00:00:01.840468,0.013627100426939412,4,sqrt,3,4,861,0.7894700108818995,TPESampler,COMPLETE
11,0.7065530036870162,2025-04-24 21:35:29.410262,2025-04-24 21:35:30.822399,0 days 00:00:01.412137,0.055858202298530675,10,log2,9,4,717,0.8802018078712355,TPESampler,COMPLETE
12,0.3745526471885229,2025-04-24 21:35:29.761238,2025-04-24 21:35:33.160804,0 days 00:00:03.399566,0.09362354304498939,9,,3,6,1019,0.7453367564775115,TPESampler,COMPLETE
13,0.3386058361323782,2025-04-24 21:35:30.880530,2025-04-24 21:35:32.604896,0 days 00:00:01.724366,0.031089093881854712,9,sqrt,1,15,770,0.9660844762445793,TPESampler,COMPLETE
14,0.39056406597657267,2025-04-24 21:35:31.118188,2025-04-24 21:35:32.058427,0 days 00:00:00.940239,0.0791015215046543,12,sqrt,2,13,133,0.911712254526071,TPESampler,COMPLETE
15,0.3108347809326442,2025-04-24 21:35:32.246969,2025-04-24 21:35:33.877889,0 days 00:00:01.630920,0.02768506777393917,8,,1,5,381,0.6120820854869344,TPESampler,COMPLETE
16,0.3356116133264608,2025-04-24 21:35:32.881817,2025-04-24 21:35:35.363089,0 days 00:00:02.481272,0.027120540360502175,8,sqrt,1,16,1421,0.9897329483906092,TPESampler,COMPLETE
17,0.37547109677203,2025-04-24 21:35:33.348651,2025-04-24 21:35:35.227589,0 days 00:00:01.878938,0.02407030094000927,9,sqrt,3,11,548,0.9336211772316835,TPESampler,COMPLETE
18,0.31830810706710355,2025-04-24 21:35:34.072169,2025-04-24 21:35:35.314802,0 days 00:00:01.242633,0.02898304607343533,9,,1,6,253,0.6515862408483916,TPESampler,COMPLETE
19,0.3274508313990407,2025-04-24 21:35:35.449903,2025-04-24 21:35:38.203062,0 days 00:00:02.753159,0.025412478465117523,7,,3,2,817,0.6521659649661175,TPESampler,COMPLETE
20,0.3537318956854278,2025-04-24 21:35:35.460514,2025-04-24 21:35:37.103541,0 days 00:00:01.643027,0.018645965989977482,6,,1,14,324,0.7071777230280782,TPESampler,COMPLETE
21,0.3296441960870891,2025-04-24 21:35:35.524078,2025-04-24 21:35:37.966919,0 days 00:00:02.442841,0.03250914335704977,6,,3,11,715,0.6417534794291825,TPESampler,COMPLETE
22,0.4924915842857428,2025-04-24 21:35:37.279358,2025-04-24 21:35:38.673226,0 days 00:00:01.393868,0.017043749620619116,12,log2,2,4,760,0.6952546572724646,TPESampler,COMPLETE
23,0.3278726290057013,2025-04-24 21:35:38.157624,2025-04-24 21:35:39.455953,0 days 00:00:01.298329,0.04945775271859119,11,,2,8,280,0.6433594844903573,TPESampler,COMPLETE
24,0.3164818560429605,2025-04-24 21:35:38.474033,2025-04-24 21:35:39.890942,0 days 00:00:01.416909,0.029362207935014352,9,,1,2,294,0.6436835402495686,TPESampler,COMPLETE
25,0.37108225804335354,2025-04-24 21:35:38.889808,2025-04-24 21:35:39.893155,0 days 00:00:01.003347,0.026671303179172247,5,,3,5,246,0.6686021884189637,TPESampler,COMPLETE
26,0.47622179116934,2025-04-24 21:35:39.628154,2025-04-24 21:35:40.667747,0 days 00:00:01.039593,0.03153101729845894,8,sqrt,2,2,134,0.6308188184536767,TPESampler,COMPLETE
27,0.3343654768418553,2025-04-24 21:35:40.070722,2025-04-24 21:35:42.197898,0 days 00:00:02.127176,0.05889915501769746,7,,2,4,564,0.6298412582332665,TPESampler,COMPLETE
28,0.3263637545610543,2025-04-24 21:35:40.116816,2025-04-24 21:35:41.686055,0 days 00:00:01.569239,0.06410842885697504,8,,3,3,372,0.6074735497448052,TPESampler,COMPLETE
29,0.45674248654840727,2025-04-24 21:35:40.849007,2025-04-24 21:35:41.846842,0 days 00:00:00.997835,0.024588252090187997,8,log2,1,3,278,0.7636973620063536,TPESampler,COMPLETE
30,0.40054005694479894,2025-04-24 21:35:41.865966,2025-04-24 21:35:43.063393,0 days 00:00:01.197427,0.02833515596006432,9,log2,1,10,455,0.6147438299284772,TPESampler,COMPLETE
31,0.4270453874598602,2025-04-24 21:35:42.069776,2025-04-24 21:35:43.098105,0 days 00:00:01.028329,0.018933971226784287,6,,1,4,108,0.6160543382933575,TPESampler,COMPLETE
32,0.35414960659267497,2025-04-24 21:35:42.404763,2025-04-24 21:35:43.876621,0 days 00:00:01.471858,0.03786177705817233,8,,2,2,307,0.7845262213425053,TPESampler,COMPLETE
33,0.3085491905466674,2025-04-24 21:35:43.195175,2025-04-24 21:35:45.173495,0 days 00:00:01.978320,0.029018531112347166,9,,1,6,530,0.6995112519801217,TPESampler,COMPLETE
34,0.3102382063504603,2025-04-24 21:35:43.249622,2025-04-24 21:35:45.231351,0 days 00:00:01.981729,0.016265589939994548,12,,1,6,461,0.6554119412723634,TPESampler,COMPLETE
35,0.341961079454192,2025-04-24 21:35:44.048950,2025-04-24 21:35:45.269453,0 days 00:00:01.220503,0.053994900830055315,6,sqrt,1,7,534,0.6671318673786542,TPESampler,COMPLETE
36,0.3205799136114089,2025-04-24 21:35:45.337188,2025-04-24 21:35:48.303734,0 days 00:00:02.966546,0.011039721572942387,12,,3,10,879,0.6524182804192393,TPESampler,COMPLETE
37,0.40412992442004164,2025-04-24 21:35:45.361606,2025-04-24 21:35:46.968222,0 days 00:00:01.606616,0.010057827796017629,12,,2,4,211,0.6828901369751786,TPESampler,COMPLETE
38,0.3138586114404659,2025-04-24 21:35:45.428795,2025-04-24 21:35:47.984150,0 days 00:00:02.555355,0.011591440766049892,9,,1,10,772,0.6345467731870337,TPESampler,COMPLETE
39,0.38288466782411446,2025-04-24 21:35:47.153846,2025-04-24 21:35:48.055587,0 days 00:00:00.901741,0.02092952062773717,11,,3,9,157,0.780762433762755,TPESampler,COMPLETE
40,0.34968528139183913,2025-04-24 21:35:48.120800,2025-04-24 21:35:51.305776,0 days 00:00:03.184976,0.02223352015644782,12,,2,5,851,0.7489048239301045,TPESampler,COMPLETE
41,0.3488415505474028,2025-04-24 21:35:48.214849,2025-04-24 21:35:49.477594,0 days 00:00:01.262745,0.01743378208591447,12,sqrt,1,5,376,0.7260435682879828,TPESampler,COMPLETE
42,0.2981626795872784,2025-04-24 21:35:48.573439,2025-04-24 21:35:51.169958,0 days 00:00:02.596519,0.028636155975545342,8,,1,9,759,0.7188127211339416,TPESampler,COMPLETE
43,0.37254024614815884,2025-04-24 21:35:49.648604,2025-04-24 21:35:51.942134,0 days 00:00:02.293530,0.01150919618318727,10,sqrt,2,13,1394,0.6490005952986998,TPESampler,COMPLETE
44,0.28713696445361314,2025-04-24 21:35:51.359525,2025-04-24 21:35:53.536053,0 days 00:00:02.176528,0.050701420404994056,8,,1,11,746,0.7291367315737263,TPESampler,COMPLETE
45,0.2779887685179879,2025-04-24 21:35:51.547402,2025-04-24 21:35:54.091221,0 days 00:00:02.543819,0.0361051235659189,9,,1,7,836,0.6899243602482494,TPESampler,COMPLETE
46,0.321984639636059,2025-04-24 21:35:52.116224,2025-04-24 21:35:53.911341,0 days 00:00:01.795117,0.020541827648168507,12,,3,6,571,0.6246934912344099,TPESampler,COMPLETE
47,0.37920638186628514,2025-04-24 21:35:53.712667,2025-04-24 21:35:55.581865,0 days 00:00:01.869198,0.037870072697335264,8,log2,2,13,1079,0.7360839070599836,TPESampler,COMPLETE
48,0.2849915225043713,2025-04-24 21:35:54.146337,2025-04-24 21:35:57.465044,0 days 00:00:03.318707,0.022773045082894586,7,,1,9,1143,0.6302560653884064,TPESampler,COMPLETE
49,0.295821054961973,2025-04-24 21:35:54.298300,2025-04-24 21:35:56.841252,0 days 00:00:02.542952,0.05057191986302407,7,,1,10,638,0.7550228280798481,TPESampler,COMPLETE
50,0.2845705789407477,2025-04-24 21:35:55.969188,2025-04-24 21:35:58.866280,0 days 00:00:02.897092,0.04297806141308887,9,,1,17,873,0.7663974020964663,TPESampler,COMPLETE
51,0.38212262031473077,2025-04-24 21:35:57.034141,2025-04-24 21:35:58.148674,0 days 00:00:01.114533,0.06263076278478433,7,log2,1,12,464,0.7768203344798106,TPESampler,COMPLETE
52,0.3191209435931541,2025-04-24 21:35:57.692128,2025-04-24 21:36:00.842365,0 days 00:00:03.150237,0.02748393326607257,7,,3,9,1293,0.6160467899326715,TPESampler,COMPLETE
53,0.29507202106676594,2025-04-24 21:35:58.347826,2025-04-24 21:36:00.829441,0 days 00:00:02.481615,0.05808737866684017,7,,1,7,828,0.745589050354938,TPESampler,COMPLETE
54,0.2947913303657056,2025-04-24 21:35:59.071660,2025-04-24 21:36:01.081406,0 days 00:00:02.009746,0.036520035478043875,9,,1,14,635,0.7739506857830254,TPESampler,COMPLETE
55,0.3273119432365342,2025-04-24 21:36:00.978170,2025-04-24 21:36:03.244726,0 days 00:00:02.266556,0.040815080203804574,9,,2,18,528,0.8108097210372186,TPESampler,COMPLETE
56,0.3113221450754365,2025-04-24 21:36:01.028449,2025-04-24 21:36:03.147153,0 days 00:00:02.118704,0.03546956896940967,10,,1,19,481,0.8546026865768016,TPESampler,COMPLETE
57,0.29487191777711125,2025-04-24 21:36:01.506836,2025-04-24 21:36:04.403329,0 days 00:00:02.896493,0.04761302782502495,9,,1,20,860,0.723411140171329,TPESampler,COMPLETE
58,0.3914259233933323,2025-04-24 21:36:03.308658,2025-04-24 21:36:05.465692,0 days 00:00:02.157034,0.04679174404471327,10,log2,2,6,1090,0.6179464564477039,TPESampler,COMPLETE
59,0.30534838588129043,2025-04-24 21:36:03.444506,2025-04-24 21:36:06.070280,0 days 00:00:02.625774,0.08305058290980931,8,sqrt,1,15,1115,0.7274343523183208,TPESampler,COMPLETE
60,0.3161331814067139,2025-04-24 21:36:04.614427,2025-04-24 21:36:08.240013,0 days 00:00:03.625586,0.040722023302672265,6,,2,20,1253,0.7827944168373996,TPESampler,COMPLETE
61,0.38452386306023933,2025-04-24 21:36:05.664766,2025-04-24 21:36:07.204628,0 days 00:00:01.539862,0.06977580802828043,11,log2,2,20,794,0.6935904744691759,TPESampler,COMPLETE
62,0.3181292140295582,2025-04-24 21:36:06.252438,2025-04-24 21:36:09.627918,0 days 00:00:03.375480,0.04247655744910184,10,,2,16,1071,0.780535971705628,TPESampler,COMPLETE
63,0.2738036958447026,2025-04-24 21:36:07.384127,2025-04-24 21:36:09.955601,0 days 00:00:02.571474,0.059544029804505634,9,,1,20,836,0.744591111876359,TPESampler,COMPLETE
64,0.3398063895675226,2025-04-24 21:36:08.418307,2025-04-24 21:36:11.190856,0 days 00:00:02.772549,0.01926408855650669,4,,2,11,1123,0.7202916294079813,TPESampler,COMPLETE
65,0.28963511754967697,2025-04-24 21:36:09.816765,2025-04-24 21:36:12.208251,0 days 00:00:02.391486,0.04616844788804888,9,,1,18,562,0.652130378959147,TPESampler,COMPLETE
66,0.3152384864229707,2025-04-24 21:36:10.247846,2025-04-24 21:36:12.971504,0 days 00:00:02.723658,0.06555735660581306,6,,2,16,872,0.6530717440828069,TPESampler,COMPLETE
67,0.3327434854773954,2025-04-24 21:36:11.397051,2025-04-24 21:36:14.102034,0 days 00:00:02.704983,0.07988677827168818,11,,3,20,851,0.757778277004904,TPESampler,COMPLETE
68,0.3010221542954619,2025-04-24 21:36:12.383269,2025-04-24 21:36:14.045439,0 days 00:00:01.662170,0.05329417673997363,9,,1,20,466,0.6439379979541568,TPESampler,COMPLETE
69,0.3173663002233313,2025-04-24 21:36:13.153230,2025-04-24 21:36:15.261498,0 days 00:00:02.108268,0.029532603853890393,7,sqrt,1,5,1324,0.7114796979603517,TPESampler,COMPLETE
70,0.3228461889834591,2025-04-24 21:36:14.204208,2025-04-24 21:36:16.920340,0 days 00:00:02.716132,0.04158566768384625,11,,2,13,700,0.66533598271822,TPESampler,COMPLETE
71,0.32590265517801587,2025-04-24 21:36:14.305874,2025-04-24 21:36:16.261023,0 days 00:00:01.955149,0.04673473415824268,11,sqrt,1,18,839,0.8072138389465955,TPESampler,COMPLETE
72,0.3315510424476723,2025-04-24 21:36:15.465461,2025-04-24 21:36:18.737685,0 days 00:00:03.272224,0.015211225473069256,8,,2,6,1271,0.6714093013980506,TPESampler,COMPLETE
73,0.2957158932857412,2025-04-24 21:36:16.443370,2025-04-24 21:36:18.732229,0 days 00:00:02.288859,0.09708745065273675,6,,1,20,877,0.7789086316629464,TPESampler,COMPLETE
74,0.31717491216522614,2025-04-24 21:36:17.127796,2025-04-24 21:36:19.788480,0 days 00:00:02.660684,0.04983559164760303,8,,3,19,930,0.7012180589678079,TPESampler,COMPLETE
75,0.3237070401467483,2025-04-24 21:36:18.878903,2025-04-24 21:36:21.153373,0 days 00:00:02.274470,0.030494598315495038,8,,2,17,592,0.6932717604135875,TPESampler,COMPLETE
76,0.2832084700171349,2025-04-24 21:36:18.921451,2025-04-24 21:36:22.930759,0 days 00:00:04.009308,0.05306278645832931,9,,1,20,1130,0.7424635219214583,TPESampler,COMPLETE
77,0.3525524442925871,2025-04-24 21:36:19.978917,2025-04-24 21:36:21.441403,0 days 00:00:01.462486,0.0575889484845179,9,sqrt,2,9,628,0.8261491308060137,TPESampler,COMPLETE
78,0.3336571803482427,2025-04-24 21:36:21.513365,2025-04-24 21:36:23.725780,0 days 00:00:02.212415,0.03666676272992949,8,sqrt,1,18,902,0.6575913135193461,TPESampler,COMPLETE
79,0.3828286593895825,2025-04-24 21:36:21.588309,2025-04-24 21:36:23.709404,0 days 00:00:02.121095,0.02811344118269581,6,sqrt,2,14,725,0.7500483807927014,TPESampler,COMPLETE
80,0.2884152079406006,2025-04-24 21:36:23.159006,2025-04-24 21:36:27.537718,0 days 00:00:04.378712,0.05205286347661361,11,,1,18,1443,0.6671818520220083,TPESampler,COMPLETE
81,0.292998688299458,2025-04-24 21:36:23.931227,2025-04-24 21:36:27.131361,0 days 00:00:03.200134,0.06368525828162884,12,,1,6,1017,0.6739772671222992,TPESampler,COMPLETE
82,0.30624745735964465,2025-04-24 21:36:23.975411,2025-04-24 21:36:27.250197,0 days 00:00:03.274786,0.013858051680786307,7,,1,17,1336,0.6126257575565615,TPESampler,COMPLETE
83,0.27397276665969994,2025-04-24 21:36:27.301999,2025-04-24 21:36:31.418607,0 days 00:00:04.116608,0.050438563387654095,11,,1,20,1428,0.6886633234014675,TPESampler,COMPLETE
84,0.3643667289144461,2025-04-24 21:36:27.442196,2025-04-24 21:36:30.750833,0 days 00:00:03.308637,0.062097047382088,12,,4,7,1175,0.6460336423288728,TPESampler,COMPLETE
85,0.2875064831423151,2025-04-24 21:36:27.827490,2025-04-24 21:36:30.719027,0 days 00:00:02.891537,0.050441176212829265,12,,1,7,825,0.6532380421138294,TPESampler,COMPLETE
86,0.39821212171858705,2025-04-24 21:36:30.861823,2025-04-24 21:36:33.285344,0 days 00:00:02.423521,0.06395007345431038,11,log2,3,15,1346,0.6466692727556114,TPESampler,COMPLETE
87,0.35927603961728766,2025-04-24 21:36:30.912362,2025-04-24 21:36:33.893373,0 days 00:00:02.981011,0.03643491873887848,10,log2,1,18,1338,0.6647147274929441,TPESampler,COMPLETE
88,0.2677266466509979,2025-04-24 21:36:31.608120,2025-04-24 21:36:36.138321,0 days 00:00:04.530201,0.04278495912881791,12,,1,19,1239,0.7179636112321324,TPESampler,COMPLETE
89,0.33969538061044463,2025-04-24 21:36:33.482506,2025-04-24 21:36:36.040124,0 days 00:00:02.557618,0.061219698228747454,11,sqrt,2,19,1433,0.6814600114004886,TPESampler,COMPLETE
90,0.3895793212019276,2025-04-24 21:36:34.100548,2025-04-24 21:36:37.736480,0 days 00:00:03.635932,0.04816267920914289,10,,5,19,1382,0.6503290244027803,TPESampler,COMPLETE
91,0.35550316689644257,2025-04-24 21:36:36.201535,2025-04-24 21:36:37.476512,0 days 00:00:01.274977,0.07427115093787032,12,log2,1,2,283,0.7097504955926359,TPESampler,COMPLETE
92,0.3260423452008131,2025-04-24 21:36:36.292352,2025-04-24 21:36:38.774320,0 days 00:00:02.481968,0.09064927742356743,9,,2,13,688,0.7285587608508437,TPESampler,COMPLETE
93,0.29069793114733233,2025-04-24 21:36:37.668424,2025-04-24 21:36:41.369878,0 days 00:00:03.701454,0.05995467431261901,10,,1,18,1399,0.6418927361669957,TPESampler,COMPLETE
94,0.2895405665395247,2025-04-24 21:36:37.969112,2025-04-24 21:36:41.273684,0 days 00:00:03.304572,0.0278197504856922,11,,1,18,1123,0.6841665778056425,TPESampler,COMPLETE
95,0.3431546503551009,2025-04-24 21:36:38.989787,2025-04-24 21:36:42.639216,0 days 00:00:03.649429,0.05465818270024125,12,,3,16,1386,0.7330447142401056,TPESampler,COMPLETE
96,0.3546545434181075,2025-04-24 21:36:41.439856,2025-04-24 21:36:45.685918,0 days 00:00:04.246062,0.08545528086497264,9,,2,20,1453,0.8510148664008845,TPESampler,COMPLETE
97,0.2974377127195109,2025-04-24 21:36:41.544859,2025-04-24 21:36:44.446166,0 days 00:00:02.901307,0.02331351080817742,7,,1,9,1030,0.6408941998940447,TPESampler,COMPLETE
98,0.31185512688468503,2025-04-24 21:36:42.820718,2025-04-24 21:36:46.797967,0 days 00:00:03.977249,0.022775317087307744,12,,3,20,1473,0.6813138016982963,TPESampler,COMPLETE
99,0.2789674329045821,2025-04-24 21:36:44.616847,2025-04-24 21:36:48.344961,0 days 00:00:03.728114,0.041910075640366584,12,,1,19,1114,0.7120520900281848,TPESampler,COMPLETE
100,0.45052178547304006,2025-04-24 21:36:45.869999,2025-04-24 21:36:47.978658,0 days 00:00:02.108659,0.012590332162439285,5,log2,1,11,1258,0.6633021095970193,TPESampler,COMPLETE
101,0.2739873575964563,2025-04-24 21:36:46.988260,2025-04-24 21:36:51.460394,0 days 00:00:04.472134,0.05860835868000111,10,,1,19,1388,0.7203043151170265,TPESampler,COMPLETE
102,0.28106170613670983,2025-04-24 21:36:48.153382,2025-04-24 21:36:51.709009,0 days 00:00:03.555627,0.03442045417461915,9,,1,13,1158,0.7007707124674972,TPESampler,COMPLETE
103,0.383298328775747,2025-04-24 21:36:48.561919,2025-04-24 21:36:50.011157,0 days 00:00:01.449238,0.054386041553687474,12,sqrt,4,5,801,0.6108438719504142,TPESampler,COMPLETE
104,0.2905627684311129,2025-04-24 21:36:50.180754,2025-04-24 21:36:54.229575,0 days 00:00:04.048821,0.036941582119099904,12,,1,19,1403,0.6992957098571737,TPESampler,COMPLETE
105,0.3177468792690143,2025-04-24 21:36:51.653515,2025-04-24 21:36:55.017163,0 days 00:00:03.363648,0.02260254563651439,10,,2,13,1218,0.6903626330177366,TPESampler,COMPLETE
106,0.27273369843229395,2025-04-24 21:36:51.917591,2025-04-24 21:36:55.793988,0 days 00:00:03.876397,0.032916458178797646,8,,1,19,1450,0.7322589361944486,TPESampler,COMPLETE
107,0.32585181225740534,2025-04-24 21:36:54.406030,2025-04-24 21:36:57.903563,0 days 00:00:03.497533,0.039469374249013735,11,,2,19,1193,0.757651887085309,TPESampler,COMPLETE
108,0.2798073300822863,2025-04-24 21:36:55.194344,2025-04-24 21:36:58.733936,0 days 00:00:03.539592,0.03227929120379036,10,,1,10,1181,0.7820952523422642,TPESampler,COMPLETE
109,0.28426615951739603,2025-04-24 21:36:55.971155,2025-04-24 21:36:59.326653,0 days 00:00:03.355498,0.0428538651637468,8,,1,20,1224,0.7066674758779622,TPESampler,COMPLETE
110,0.28638989114926344,2025-04-24 21:36:58.096537,2025-04-24 21:37:00.925326,0 days 00:00:02.828789,0.0434465339214996,12,,1,20,799,0.6943055846925464,TPESampler,COMPLETE
111,0.36255816907847915,2025-04-24 21:36:58.917927,2025-04-24 21:37:02.860471,0 days 00:00:03.942544,0.06046346494048742,8,,4,13,1401,0.7619933414917518,TPESampler,COMPLETE
112,0.3496619597445462,2025-04-24 21:36:59.511128,2025-04-24 21:37:01.946220,0 days 00:00:02.435092,0.025699209332142415,10,sqrt,2,19,1428,0.814924226119659,TPESampler,COMPLETE
113,0.29038346576076896,2025-04-24 21:37:01.109483,2025-04-24 21:37:04.422605,0 days 00:00:03.313122,0.026322022784675377,7,,1,15,1148,0.7295750233769682,TPESampler,COMPLETE
114,0.3598418469857637,2025-04-24 21:37:02.135069,2025-04-24 21:37:06.000399,0 days 00:00:03.865330,0.025431570917675353,9,,4,13,1179,0.9183199421560673,TPESampler,COMPLETE
115,0.34958456443458485,2025-04-24 21:37:03.031912,2025-04-24 21:37:05.181513,0 days 00:00:02.149601,0.02323392270246005,10,log2,1,10,1280,0.8295745712013826,TPESampler,COMPLETE
116,0.31457857236521997,2025-04-24 21:37:04.599494,2025-04-24 21:37:08.539512,0 days 00:00:03.940018,0.02425122570287648,8,,3,17,1474,0.788263301354648,TPESampler,COMPLETE
117,0.2823281445296267,2025-04-24 21:37:05.357278,2025-04-24 21:37:09.039729,0 days 00:00:03.682451,0.033098803772565896,11,,1,11,1046,0.8010125098901018,TPESampler,COMPLETE
118,0.3167640531025705,2025-04-24 21:37:06.185525,2025-04-24 21:37:09.843569,0 days 00:00:03.658044,0.04358828196017815,7,,2,16,1374,0.7089805797337302,TPESampler,COMPLETE
119,0.28796602623280937,2025-04-24 21:37:08.701823,2025-04-24 21:37:13.095097,0 days 00:00:04.393274,0.06708040713183124,11,,1,20,1459,0.7759286806784327,TPESampler,COMPLETE
120,0.290071415660954,2025-04-24 21:37:09.218049,2025-04-24 21:37:13.757976,0 days 00:00:04.539927,0.03935585741421698,11,,1,9,1404,0.7774361704680381,TPESampler,COMPLETE
121,0.29462110140200015,2025-04-24 21:37:10.197171,2025-04-24 21:37:13.088754,0 days 00:00:02.891583,0.02319469575506295,11,,1,12,848,0.8097904036184369,TPESampler,COMPLETE
122,0.3362502072300119,2025-04-24 21:37:13.261207,2025-04-24 21:37:16.712847,0 days 00:00:03.451640,0.03756623922928595,10,,3,10,1045,0.869983238566705,TPESampler,COMPLETE
123,0.2871134678000845,2025-04-24 21:37:13.328688,2025-04-24 21:37:16.959084,0 days 00:00:03.630396,0.02891576438259767,7,,1,20,1417,0.6821202325946941,TPESampler,COMPLETE
