number,value,datetime_start,datetime_complete,duration,params_learning_rate,params_max_depth,params_max_features,params_min_samples_leaf,params_min_samples_split,params_n_estimators,params_subsample,system_attrs_auto:sampler,state
1873,0.3538763685096194,2025-04-24 22:08:24.593570,2025-04-24 22:08:28.310160,0 days 00:00:03.716590,0.0986681097247416,8,,3,13,1395,0.6322255787617841,TPESampler,COMPLETE
1874,0.27568901090169695,2025-04-24 22:08:25.838712,2025-04-24 22:08:29.365368,0 days 00:00:03.526656,0.05235512636627724,8,,1,6,1086,0.710794650359322,TPESampler,COMPLETE
1875,0.6105572714710467,2025-04-24 22:08:27.575028,2025-04-24 22:08:29.190364,0 days 00:00:01.615336,0.05754613039382726,12,log2,8,12,828,0.7867379016779228,TPESampler,COMPLETE
1876,0.618853033793665,2025-04-24 22:08:28.590274,2025-04-24 22:08:32.740304,0 days 00:00:04.150030,0.012164010935184226,9,,9,18,1363,0.8075336764514961,TPESampler,COMPLETE
1877,0.32320850700786874,2025-04-24 22:08:29.457186,2025-04-24 22:08:31.476777,0 days 00:00:02.019591,0.06587471359058619,8,,2,13,493,0.844181360357041,TPESampler,COMPLETE
1878,0.27085739373367945,2025-04-24 22:08:29.593434,2025-04-24 22:08:32.408362,0 days 00:00:02.814928,0.09817156421718716,8,,1,7,841,0.6785951221701256,TPESampler,COMPLETE
1879,0.6568629792118781,2025-04-24 22:08:31.709406,2025-04-24 22:08:33.681572,0 days 00:00:01.972166,0.08186782324861262,6,log2,9,5,1126,0.6509285910229128,TPESampler,COMPLETE
1880,0.27270760875515426,2025-04-24 22:08:32.657446,2025-04-24 22:08:37.398058,0 days 00:00:04.740612,0.05199200788094667,9,,1,13,1332,0.6522264909848088,TPESampler,COMPLETE
1881,0.35006667970630084,2025-04-24 22:08:33.045287,2025-04-24 22:08:36.964183,0 days 00:00:03.918896,0.025060856012939413,4,,2,19,1233,0.982321842743198,TPESampler,COMPLETE
1882,0.3823153576573003,2025-04-24 22:08:33.941190,2025-04-24 22:08:35.170536,0 days 00:00:01.229346,0.05607391650315938,6,log2,1,6,406,0.8151479042340508,TPESampler,COMPLETE
1883,0.3922700774795082,2025-04-24 22:08:35.384448,2025-04-24 22:08:36.996756,0 days 00:00:01.612308,0.02524274074963206,4,sqrt,1,20,732,0.6536620721313007,TPESampler,COMPLETE
1884,0.28258029483006025,2025-04-24 22:08:37.133767,2025-04-24 22:08:40.498526,0 days 00:00:03.364759,0.09665309335644719,8,,1,12,812,0.7967499442656577,TPESampler,COMPLETE
1885,0.42020726617084114,2025-04-24 22:08:37.190442,2025-04-24 22:08:41.014262,0 days 00:00:03.823820,0.02453673121484686,3,,7,12,1298,0.9746153021483853,TPESampler,COMPLETE
1886,0.5388895871997151,2025-04-24 22:08:37.704362,2025-04-24 22:08:39.349038,0 days 00:00:01.644676,0.031178297822120435,5,log2,3,18,763,0.6408022889084674,TPESampler,COMPLETE
1887,0.2877422482887038,2025-04-24 22:08:39.684717,2025-04-24 22:08:43.801966,0 days 00:00:04.117249,0.09480540442845783,9,,1,12,1130,0.7486166072489702,TPESampler,COMPLETE
1888,0.32245026757723494,2025-04-24 22:08:40.707579,2025-04-24 22:08:42.977764,0 days 00:00:02.270185,0.08359186229301929,8,sqrt,3,13,1298,0.617243085461695,TPESampler,COMPLETE
1889,0.282729097338125,2025-04-24 22:08:41.279087,2025-04-24 22:08:45.842082,0 days 00:00:04.562995,0.06424267843386605,7,,1,6,1370,0.7134259869429841,TPESampler,COMPLETE
1890,0.6132280340858982,2025-04-24 22:08:43.178178,2025-04-24 22:08:45.314209,0 days 00:00:02.136031,0.016418056528318598,7,log2,5,6,1312,0.7226250771903987,TPESampler,COMPLETE
1891,0.3185775757684252,2025-04-24 22:08:44.027127,2025-04-24 22:08:47.485203,0 days 00:00:03.458076,0.09786705594079,4,,1,16,985,0.8476794320944033,TPESampler,COMPLETE
1892,0.3458307468434616,2025-04-24 22:08:45.516841,2025-04-24 22:08:47.585726,0 days 00:00:02.068885,0.09924675967734069,10,sqrt,2,10,978,0.6099043745379094,TPESampler,COMPLETE
1893,0.2733383017902283,2025-04-24 22:08:46.090323,2025-04-24 22:08:50.132549,0 days 00:00:04.042226,0.09434853874528637,6,,1,9,1413,0.7121360435384634,TPESampler,COMPLETE
1894,0.2941388274406227,2025-04-24 22:08:47.654472,2025-04-24 22:08:50.837625,0 days 00:00:03.183153,0.06020742692994597,5,,1,13,1184,0.6879059700092276,TPESampler,COMPLETE
1895,0.27616846359463154,2025-04-24 22:08:47.781878,2025-04-24 22:08:50.931098,0 days 00:00:03.149220,0.043993647913820974,10,,1,11,939,0.6641322968596542,TPESampler,COMPLETE
1896,0.2784596196085139,2025-04-24 22:08:50.336018,2025-04-24 22:08:53.944665,0 days 00:00:03.608647,0.0446131022174082,7,,1,15,1336,0.6229296231578462,TPESampler,COMPLETE
1897,0.26354416157449495,2025-04-24 22:08:51.079539,2025-04-24 22:08:54.640186,0 days 00:00:03.560647,0.07841696746480778,8,,1,15,1278,0.693963370216767,TPESampler,COMPLETE
1898,0.2683801955418472,2025-04-24 22:08:51.336729,2025-04-24 22:08:54.617939,0 days 00:00:03.281210,0.07268563176562516,8,,1,12,1170,0.6256866582213593,TPESampler,COMPLETE
1899,0.3625533713361434,2025-04-24 22:08:54.149479,2025-04-24 22:08:58.049805,0 days 00:00:03.900326,0.08684847637108652,7,,3,4,1423,0.6228575826771486,TPESampler,COMPLETE
1900,0.42733911517724904,2025-04-24 22:08:54.916030,2025-04-24 22:08:56.527236,0 days 00:00:01.611206,0.02471414506714428,10,,7,15,310,0.7526068049972282,TPESampler,COMPLETE
1901,0.3758884909708934,2025-04-24 22:08:54.964333,2025-04-24 22:08:59.163841,0 days 00:00:04.199508,0.08072222940917395,8,,3,10,1412,0.7612127792734156,TPESampler,COMPLETE
1902,0.28030151543496756,2025-04-24 22:08:56.731537,2025-04-24 22:09:01.047175,0 days 00:00:04.315638,0.04855752253867678,8,,1,10,1288,0.7632706393234262,TPESampler,COMPLETE
1903,0.6783036666151175,2025-04-24 22:08:58.256261,2025-04-24 22:09:00.598788,0 days 00:00:02.342527,0.019744909062601554,12,sqrt,10,7,1438,0.9543556836308102,TPESampler,COMPLETE
1904,0.43256186546074543,2025-04-24 22:08:59.418459,2025-04-24 22:09:00.920856,0 days 00:00:01.502397,0.027709669931728468,11,sqrt,4,18,456,0.654997050166332,TPESampler,COMPLETE
1905,0.3310186220261114,2025-04-24 22:09:00.876537,2025-04-24 22:09:04.224759,0 days 00:00:03.348222,0.06140576358009796,8,,2,14,1229,0.748909463395866,TPESampler,COMPLETE
1906,0.2844196227153366,2025-04-24 22:09:01.190896,2025-04-24 22:09:04.680104,0 days 00:00:03.489208,0.0742673592388826,8,,1,15,1295,0.6706119615678678,TPESampler,COMPLETE
1907,0.26693164949086545,2025-04-24 22:09:01.440021,2025-04-24 22:09:03.891501,0 days 00:00:02.451480,0.07021550537516925,9,,1,11,907,0.6440050429639321,TPESampler,COMPLETE
1908,0.3262949545208921,2025-04-24 22:09:04.086948,2025-04-24 22:09:07.578053,0 days 00:00:03.491105,0.050900465355054075,10,,2,9,1092,0.6021152402452596,TPESampler,COMPLETE
1909,0.2788245451913576,2025-04-24 22:09:04.501436,2025-04-24 22:09:07.821301,0 days 00:00:03.319865,0.07960491949594518,8,,1,15,1091,0.6040969531931043,TPESampler,COMPLETE
1910,0.5083320940083612,2025-04-24 22:09:04.961399,2025-04-24 22:09:06.477281,0 days 00:00:01.515882,0.016917000534109994,3,sqrt,5,7,678,0.9895045308784517,TPESampler,COMPLETE
1911,0.26557096709824435,2025-04-24 22:09:06.674386,2025-04-24 22:09:10.446515,0 days 00:00:03.772129,0.04095317968992886,8,,1,14,1473,0.6740679147854587,TPESampler,COMPLETE
1912,0.4233995741847272,2025-04-24 22:09:07.776826,2025-04-24 22:09:11.255137,0 days 00:00:03.478311,0.024840620481026036,8,,7,13,1361,0.7935665278822541,TPESampler,COMPLETE
1913,0.3190874917046812,2025-04-24 22:09:08.118612,2025-04-24 22:09:11.335585,0 days 00:00:03.216973,0.08507749352058468,7,,2,14,1297,0.6871010515623862,TPESampler,COMPLETE
1914,0.4323433212188506,2025-04-24 22:09:10.660561,2025-04-24 22:09:13.970576,0 days 00:00:03.310015,0.04794927603538296,8,,7,6,1185,0.8525174360627444,TPESampler,COMPLETE
1915,0.3190139928922952,2025-04-24 22:09:11.522911,2025-04-24 22:09:15.428400,0 days 00:00:03.905489,0.048182827151107936,7,,2,11,1309,0.7359173482505861,TPESampler,COMPLETE
1916,0.32206967843137635,2025-04-24 22:09:11.685159,2025-04-24 22:09:16.458992,0 days 00:00:04.773833,0.04962256377823468,9,,3,17,1494,0.6597654120607878,TPESampler,COMPLETE
1917,0.600997949395177,2025-04-24 22:09:14.186619,2025-04-24 22:09:15.455332,0 days 00:00:01.268713,0.015543409951651656,11,sqrt,4,2,308,0.6206468764583997,TPESampler,COMPLETE
1918,0.32571067788204877,2025-04-24 22:09:15.600887,2025-04-24 22:09:20.141336,0 days 00:00:04.540449,0.03898864411651676,10,,2,13,1445,0.6243786085043334,TPESampler,COMPLETE
1919,0.3458593512300812,2025-04-24 22:09:15.645650,2025-04-24 22:09:20.523091,0 days 00:00:04.877441,0.06936560773921716,9,,2,14,1477,0.6924041488965078,TPESampler,COMPLETE
1920,0.606127902191495,2025-04-24 22:09:16.692065,2025-04-24 22:09:18.934351,0 days 00:00:02.242286,0.018615084043389914,10,log2,7,3,1446,0.8756442120690543,TPESampler,COMPLETE
1921,0.3278861313689414,2025-04-24 22:09:19.139104,2025-04-24 22:09:22.863824,0 days 00:00:03.724720,0.04579628341357344,9,,2,13,1406,0.6723813076886361,TPESampler,COMPLETE
1922,0.27028266971793985,2025-04-24 22:09:20.461481,2025-04-24 22:09:23.817313,0 days 00:00:03.355832,0.03353814585669962,7,,1,15,1304,0.6328939873173972,TPESampler,COMPLETE
1923,0.3284903552879006,2025-04-24 22:09:20.852126,2025-04-24 22:09:24.668082,0 days 00:00:03.815956,0.05655571127511607,8,,3,16,1442,0.7102380098988694,TPESampler,COMPLETE
1924,0.3559210232627858,2025-04-24 22:09:23.060400,2025-04-24 22:09:26.439313,0 days 00:00:03.378913,0.011124217989411664,8,,4,11,1179,0.7385720754653051,TPESampler,COMPLETE
1925,0.32516089300639917,2025-04-24 22:09:24.010912,2025-04-24 22:09:27.522578,0 days 00:00:03.511666,0.02998721281939958,7,,3,11,1334,0.6419540279444412,TPESampler,COMPLETE
1926,0.32885190101855916,2025-04-24 22:09:24.883269,2025-04-24 22:09:28.456695,0 days 00:00:03.573426,0.0573112839312189,8,,2,16,1299,0.6336135730615725,TPESampler,COMPLETE
1927,0.3221487710939174,2025-04-24 22:09:26.641563,2025-04-24 22:09:30.363983,0 days 00:00:03.722420,0.04582359176043366,8,,2,17,1387,0.6424193385547605,TPESampler,COMPLETE
1928,0.27682500997619297,2025-04-24 22:09:27.721542,2025-04-24 22:09:32.016596,0 days 00:00:04.295054,0.06161244182615928,8,,1,12,1467,0.704988787122956,TPESampler,COMPLETE
1929,0.2842316397207032,2025-04-24 22:09:28.755522,2025-04-24 22:09:32.642213,0 days 00:00:03.886691,0.027653282205760493,9,,1,16,1309,0.7709945796138107,TPESampler,COMPLETE
1930,0.2767374213319769,2025-04-24 22:09:30.568554,2025-04-24 22:09:35.127120,0 days 00:00:04.558566,0.04476656520550424,8,,1,18,1487,0.6943807861612193,TPESampler,COMPLETE
1931,0.6620462517429395,2025-04-24 22:09:32.248170,2025-04-24 22:09:34.302089,0 days 00:00:02.053919,0.03752615060792101,11,sqrt,9,7,1067,0.914243729320796,TPESampler,COMPLETE
1932,0.2817611030639548,2025-04-24 22:09:32.858423,2025-04-24 22:09:36.926695,0 days 00:00:04.068272,0.042672096067948084,6,,1,16,1425,0.6673305082776737,TPESampler,COMPLETE
1933,0.3201926900174077,2025-04-24 22:09:34.510827,2025-04-24 22:09:38.699084,0 days 00:00:04.188257,0.03686199453414768,8,,3,13,1497,0.663174434669263,TPESampler,COMPLETE
1934,0.438963757858778,2025-04-24 22:09:35.363073,2025-04-24 22:09:36.954681,0 days 00:00:01.591608,0.04431735811054582,9,,6,5,328,0.9223399997548926,TPESampler,COMPLETE
1935,0.3683745669841147,2025-04-24 22:09:37.099668,2025-04-24 22:09:38.510547,0 days 00:00:01.410879,0.013199641711798668,10,,1,15,222,0.7153505871226667,TPESampler,COMPLETE
1936,0.2865424172060378,2025-04-24 22:09:37.141610,2025-04-24 22:09:41.562032,0 days 00:00:04.420422,0.03101036369837558,7,,1,16,1386,0.6759595478890347,TPESampler,COMPLETE
1937,0.43391972349997565,2025-04-24 22:09:38.706337,2025-04-24 22:09:40.995095,0 days 00:00:02.288758,0.014854976560687887,6,sqrt,6,7,1394,0.9375131155694792,TPESampler,COMPLETE
1938,0.28215073817365877,2025-04-24 22:09:38.906430,2025-04-24 22:09:44.137295,0 days 00:00:05.230865,0.02941615267289307,10,,1,15,1448,0.6961469721140287,TPESampler,COMPLETE
1939,0.35371570999501895,2025-04-24 22:09:41.205640,2025-04-24 22:09:43.793043,0 days 00:00:02.587403,0.09006488497208018,10,,3,5,675,0.6387493959671972,TPESampler,COMPLETE
1940,0.6135004078009171,2025-04-24 22:09:41.801889,2025-04-24 22:09:42.909548,0 days 00:00:01.107659,0.05055331593416499,3,log2,4,15,369,0.9482003943547987,TPESampler,COMPLETE
1941,0.2802590713962668,2025-04-24 22:09:43.120948,2025-04-24 22:09:47.145908,0 days 00:00:04.024960,0.04840186146097915,9,,1,16,1339,0.6837607168731508,TPESampler,COMPLETE
1942,0.276612384588415,2025-04-24 22:09:44.006374,2025-04-24 22:09:48.116541,0 days 00:00:04.110167,0.03815684907885887,8,,1,11,1393,0.6587280806130271,TPESampler,COMPLETE
1943,0.30529721083074013,2025-04-24 22:09:44.436456,2025-04-24 22:09:46.207190,0 days 00:00:01.770734,0.06255855406790872,6,,3,12,572,0.6068178266745949,TPESampler,COMPLETE
1944,0.3270835896513909,2025-04-24 22:09:46.411542,2025-04-24 22:09:50.417459,0 days 00:00:04.005917,0.09416755599861683,5,,2,15,1462,0.7173365743595382,TPESampler,COMPLETE
1945,0.3295998922432427,2025-04-24 22:09:47.364494,2025-04-24 22:09:51.524829,0 days 00:00:04.160335,0.04381876353853588,7,,3,11,1492,0.6358158057312381,TPESampler,COMPLETE
1946,0.4123646273319923,2025-04-24 22:09:48.350298,2025-04-24 22:09:49.703317,0 days 00:00:01.353019,0.028968499443847093,4,,5,3,330,0.8742807278363439,TPESampler,COMPLETE
1947,0.2878661340017144,2025-04-24 22:09:49.910138,2025-04-24 22:09:53.490884,0 days 00:00:03.580746,0.04815352163514069,5,,1,11,1420,0.650950761558514,TPESampler,COMPLETE
1948,0.2829791812556553,2025-04-24 22:09:50.673664,2025-04-24 22:09:54.730420,0 days 00:00:04.056756,0.050217578034227786,9,,1,11,1221,0.7231622610281093,TPESampler,COMPLETE
1949,0.4467639013121458,2025-04-24 22:09:51.805895,2025-04-24 22:09:55.856173,0 days 00:00:04.050278,0.0786918431286322,9,,8,3,1115,0.998093692358711,TPESampler,COMPLETE
1950,0.8000437622641045,2025-04-24 22:09:53.695947,2025-04-24 22:09:55.189078,0 days 00:00:01.493131,0.017580679941260367,10,log2,10,2,840,0.7689682036697745,TPESampler,COMPLETE
1951,0.3474565744078175,2025-04-24 22:09:54.961022,2025-04-24 22:09:58.556783,0 days 00:00:03.595761,0.08850580232274716,7,,2,11,1421,0.6979469639555848,TPESampler,COMPLETE
1952,0.3163788537475004,2025-04-24 22:09:55.453087,2025-04-24 22:09:58.838931,0 days 00:00:03.385844,0.04754757028913319,7,,3,14,1358,0.7291379375226164,TPESampler,COMPLETE
1953,0.2858381820579024,2025-04-24 22:09:56.074263,2025-04-24 22:09:59.403167,0 days 00:00:03.328904,0.06837203818381458,7,,1,14,1276,0.7168176883349039,TPESampler,COMPLETE
1954,0.2832600416043229,2025-04-24 22:09:58.760259,2025-04-24 22:10:02.310487,0 days 00:00:03.550228,0.0361392131169916,9,,1,15,1326,0.6687506859697365,TPESampler,COMPLETE
1955,0.26822105444447675,2025-04-24 22:09:59.106622,2025-04-24 22:10:03.250145,0 days 00:00:04.143523,0.07666462561775923,9,,1,15,1446,0.7195029706865906,TPESampler,COMPLETE
1956,0.27594065281684094,2025-04-24 22:09:59.647097,2025-04-24 22:10:02.230842,0 days 00:00:02.583745,0.0636431021496241,9,,1,10,927,0.7026050132507959,TPESampler,COMPLETE
1957,0.3730424808905613,2025-04-24 22:10:02.392172,2025-04-24 22:10:04.800308,0 days 00:00:02.408136,0.0554881648997895,8,log2,2,14,1407,0.6326345526596555,TPESampler,COMPLETE
1958,0.2763111136802045,2025-04-24 22:10:02.516824,2025-04-24 22:10:06.449492,0 days 00:00:03.932668,0.05576096043742938,7,,1,9,1126,0.6010838046516719,TPESampler,COMPLETE
1959,0.27590161255646195,2025-04-24 22:10:03.506847,2025-04-24 22:10:08.242815,0 days 00:00:04.735968,0.09339214007521514,9,,1,14,1265,0.7102629213344105,TPESampler,COMPLETE
1960,0.6722927532523324,2025-04-24 22:10:05.004256,2025-04-24 22:10:06.712260,0 days 00:00:01.708004,0.07050788111617111,6,log2,10,18,937,0.7904732303775469,TPESampler,COMPLETE
1961,0.2837501382839014,2025-04-24 22:10:06.667137,2025-04-24 22:10:10.572982,0 days 00:00:03.905845,0.03856614983789802,8,,1,15,1275,0.7752849408616495,TPESampler,COMPLETE
1962,0.7481126536765544,2025-04-24 22:10:07.010100,2025-04-24 22:10:08.132490,0 days 00:00:01.122390,0.016299984129399824,4,sqrt,9,13,352,0.9807394872212936,TPESampler,COMPLETE
1963,0.2811905858458574,2025-04-24 22:10:08.300832,2025-04-24 22:10:11.524600,0 days 00:00:03.223768,0.06908923968637877,9,,1,14,959,0.6998078431645034,TPESampler,COMPLETE
1964,0.29951828042118966,2025-04-24 22:10:08.439968,2025-04-24 22:10:10.536325,0 days 00:00:02.096357,0.04778785721170623,5,,1,10,695,0.6331749230873628,TPESampler,COMPLETE
1965,0.35067003860894647,2025-04-24 22:10:10.684566,2025-04-24 22:10:14.789038,0 days 00:00:04.104472,0.019785597299286185,4,,4,17,1441,0.7176691366401584,TPESampler,COMPLETE
1966,0.34541535340705937,2025-04-24 22:10:10.734246,2025-04-24 22:10:14.366411,0 days 00:00:03.632165,0.07177380878893609,8,,2,8,959,0.7173256921234094,TPESampler,COMPLETE
1967,0.6798578995112244,2025-04-24 22:10:11.754584,2025-04-24 22:10:13.833759,0 days 00:00:02.079175,0.09409792551505916,10,log2,10,9,935,0.7421283580686537,TPESampler,COMPLETE
1968,0.39339768997820745,2025-04-24 22:10:14.050188,2025-04-24 22:10:16.112361,0 days 00:00:02.062173,0.047798945772102565,12,,5,20,310,0.9843051297240396,TPESampler,COMPLETE
1969,0.3266403849935172,2025-04-24 22:10:14.716484,2025-04-24 22:10:18.291591,0 days 00:00:03.575107,0.030584351962582006,8,,3,12,1023,0.7390420431462056,TPESampler,COMPLETE
1970,0.7463334801398216,2025-04-24 22:10:15.105155,2025-04-24 22:10:16.378049,0 days 00:00:01.272894,0.013060951840706339,3,sqrt,9,5,581,0.6668289767653386,TPESampler,COMPLETE
1971,0.33446826314371403,2025-04-24 22:10:16.331274,2025-04-24 22:10:18.669753,0 days 00:00:02.338479,0.06052875941846995,6,sqrt,1,16,1297,0.6962998331444417,TPESampler,COMPLETE
1972,0.27809469548678867,2025-04-24 22:10:16.681032,2025-04-24 22:10:20.525529,0 days 00:00:03.844497,0.06388490276962788,6,,1,13,1303,0.6197060136309852,TPESampler,COMPLETE
1973,0.2812264149082765,2025-04-24 22:10:18.522433,2025-04-24 22:10:22.093963,0 days 00:00:03.571530,0.045157840382732344,8,,1,13,1309,0.6836618342860624,TPESampler,COMPLETE
1974,0.325010835455765,2025-04-24 22:10:18.918385,2025-04-24 22:10:22.993655,0 days 00:00:04.075270,0.02791728019915064,9,,3,11,1474,0.7164697611431798,TPESampler,COMPLETE
1975,0.28308649707442135,2025-04-24 22:10:20.738624,2025-04-24 22:10:24.613191,0 days 00:00:03.874567,0.06123705347437065,8,,1,18,1431,0.6111685097464632,TPESampler,COMPLETE
1976,0.281364413719825,2025-04-24 22:10:22.293114,2025-04-24 22:10:26.480342,0 days 00:00:04.187228,0.03740885629680085,7,,1,14,1416,0.7447987865064571,TPESampler,COMPLETE
1977,0.34249556870193526,2025-04-24 22:10:23.207125,2025-04-24 22:10:24.790502,0 days 00:00:01.583377,0.03337957604906849,9,sqrt,1,17,632,0.785371843297275,TPESampler,COMPLETE
1978,0.349886049389513,2025-04-24 22:10:24.808541,2025-04-24 22:10:29.390895,0 days 00:00:04.582354,0.09141937920134727,8,,2,15,1489,0.7824245274314104,TPESampler,COMPLETE
1979,0.3307586112056494,2025-04-24 22:10:25.005214,2025-04-24 22:10:30.063120,0 days 00:00:05.057906,0.03605831617476115,10,,2,13,1494,0.7410574274050763,TPESampler,COMPLETE
1980,0.6513411019026941,2025-04-24 22:10:26.687086,2025-04-24 22:10:28.724273,0 days 00:00:02.037187,0.0165940739774033,11,sqrt,10,14,1316,0.6417644557884656,TPESampler,COMPLETE
1981,0.35745301557311865,2025-04-24 22:10:28.963049,2025-04-24 22:10:31.035675,0 days 00:00:02.072626,0.08385785905613512,3,sqrt,1,16,1013,0.9208361247773678,TPESampler,COMPLETE
1982,0.26830339283701377,2025-04-24 22:10:29.617496,2025-04-24 22:10:33.305727,0 days 00:00:03.688231,0.0758212914114932,8,,1,14,1250,0.6955822542312462,TPESampler,COMPLETE
1983,0.6439440565234683,2025-04-24 22:10:30.304194,2025-04-24 22:10:33.562196,0 days 00:00:03.258002,0.09134643607147865,7,,10,10,1120,0.9234161422852352,TPESampler,COMPLETE
1984,0.2857910107952329,2025-04-24 22:10:31.261548,2025-04-24 22:10:35.058139,0 days 00:00:03.796591,0.04887678130604092,7,,1,14,1406,0.6725812341041512,TPESampler,COMPLETE
1985,0.2706844304490715,2025-04-24 22:10:33.515832,2025-04-24 22:10:37.437188,0 days 00:00:03.921356,0.061374657349181246,8,,1,11,1099,0.7541958967840736,TPESampler,COMPLETE
1986,0.3220945797726909,2025-04-24 22:10:33.871655,2025-04-24 22:10:36.431880,0 days 00:00:02.560225,0.04551318141296355,8,sqrt,1,19,1433,0.7062345936387443,TPESampler,COMPLETE
1987,0.34669673694110437,2025-04-24 22:10:35.415790,2025-04-24 22:10:37.636620,0 days 00:00:02.220830,0.09482818787543615,8,sqrt,3,10,1150,0.6906727114868837,TPESampler,COMPLETE
1988,0.34911411375270923,2025-04-24 22:10:36.648069,2025-04-24 22:10:38.859455,0 days 00:00:02.211386,0.014851193360236888,9,,2,10,408,0.8273170546000191,TPESampler,COMPLETE
1989,0.33004348764119606,2025-04-24 22:10:37.639564,2025-04-24 22:10:41.476694,0 days 00:00:03.837130,0.0548443331819325,8,,2,12,1227,0.6596075777155679,TPESampler,COMPLETE
1990,0.3379233189307166,2025-04-24 22:10:37.872989,2025-04-24 22:10:40.271658,0 days 00:00:02.398669,0.059678925312531356,6,,2,9,743,0.7038107046669196,TPESampler,COMPLETE
1991,0.9144019827292095,2025-04-24 22:10:39.058964,2025-04-24 22:10:40.068674,0 days 00:00:01.009710,0.01479978974783562,11,log2,8,12,225,0.6717347576020241,TPESampler,COMPLETE
1992,0.34426102452692064,2025-04-24 22:10:40.282830,2025-04-24 22:10:42.405075,0 days 00:00:02.122245,0.06566215184374011,9,log2,1,15,1039,0.6468746470366631,TPESampler,COMPLETE
1993,0.6303807859883037,2025-04-24 22:10:40.482451,2025-04-24 22:10:44.750004,0 days 00:00:04.267553,0.08173322326070624,8,,9,19,1126,0.8092828795810403,TPESampler,COMPLETE
1994,0.4581102252710287,2025-04-24 22:10:41.711835,2025-04-24 22:10:44.044297,0 days 00:00:02.332462,0.011542730617700492,3,,7,19,691,0.6310977302840026,TPESampler,COMPLETE
1995,0.6560206289722293,2025-04-24 22:10:42.623100,2025-04-24 22:10:44.922290,0 days 00:00:02.299190,0.016260356156705565,9,sqrt,10,19,1295,0.9162827390919275,TPESampler,COMPLETE
1996,0.34418328799778486,2025-04-24 22:10:44.297954,2025-04-24 22:10:45.893514,0 days 00:00:01.595560,0.08616413800047706,4,,3,9,256,0.6269558285276207,TPESampler,COMPLETE
1997,0.3172435442744913,2025-04-24 22:10:44.978810,2025-04-24 22:10:49.361578,0 days 00:00:04.382768,0.026399086946153998,6,,2,12,1261,0.7145938708479924,TPESampler,COMPLETE
