number,value,datetime_start,datetime_complete,duration,params_learning_rate,params_max_depth,params_max_features,params_min_samples_leaf,params_min_samples_split,params_n_estimators,params_subsample,system_attrs_auto:sampler,state
249,0.34835706906378894,2025-04-24 21:39:34.177696,2025-04-24 21:39:36.259268,0 days 00:00:02.081572,0.08252227693100617,6,sqrt,2,11,1264,0.6661595049209603,TPESampler,COMPLETE
250,0.31894589956691616,2025-04-24 21:39:35.139914,2025-04-24 21:39:38.815850,0 days 00:00:03.675936,0.06691094346574485,7,,2,15,1447,0.6060154599143517,TPESampler,COMPLETE
251,0.32037144271844964,2025-04-24 21:39:36.445247,2025-04-24 21:39:40.372364,0 days 00:00:03.927117,0.06480718817565022,7,,2,16,1495,0.705704842890729,TPESampler,COMPLETE
252,0.33897694744309764,2025-04-24 21:39:37.058772,2025-04-24 21:39:41.369231,0 days 00:00:04.310459,0.032841799585580915,12,,2,11,1409,0.6737287256634604,TPESampler,COMPLETE
253,0.35106734103391085,2025-04-24 21:39:39.017142,2025-04-24 21:39:41.416860,0 days 00:00:02.399718,0.06693601395875004,6,sqrt,3,17,1439,0.7779084971482897,TPESampler,COMPLETE
254,0.3758908554011703,2025-04-24 21:39:40.559361,2025-04-24 21:39:44.309168,0 days 00:00:03.749807,0.09445166488780266,10,,3,12,1456,0.6148580906410628,TPESampler,COMPLETE
255,0.28888113463599435,2025-04-24 21:39:41.496532,2025-04-24 21:39:45.321252,0 days 00:00:03.824720,0.09963432348883569,10,,1,12,1412,0.6825453724936027,TPESampler,COMPLETE
256,0.3506444837604251,2025-04-24 21:39:41.585885,2025-04-24 21:39:45.349895,0 days 00:00:03.764010,0.0308322338374498,10,,4,9,1427,0.6323886011604936,TPESampler,COMPLETE
257,0.33140436557813147,2025-04-24 21:39:44.494893,2025-04-24 21:39:46.704563,0 days 00:00:02.209670,0.03642016548353111,10,log2,1,10,1413,0.6350179168140064,TPESampler,COMPLETE
258,0.33161251653848683,2025-04-24 21:39:45.462277,2025-04-24 21:39:49.753893,0 days 00:00:04.291616,0.0631071260122973,9,,2,19,1467,0.7326117464268478,TPESampler,COMPLETE
259,0.3430062887413168,2025-04-24 21:39:45.504659,2025-04-24 21:39:49.547196,0 days 00:00:04.042537,0.07249942329498318,10,,2,18,1312,0.7050619615295891,TPESampler,COMPLETE
260,0.3172065104755566,2025-04-24 21:39:46.890467,2025-04-24 21:39:49.513550,0 days 00:00:02.623083,0.019991410106547793,11,sqrt,1,12,1418,0.6007203884435965,TPESampler,COMPLETE
261,0.34034434197627295,2025-04-24 21:39:49.671391,2025-04-24 21:39:54.266607,0 days 00:00:04.595216,0.02639508773850987,11,,2,8,1392,0.6023377274065255,TPESampler,COMPLETE
262,0.3704538195898719,2025-04-24 21:39:49.717234,2025-04-24 21:39:51.966627,0 days 00:00:02.249393,0.04259931920411361,6,log2,1,18,1302,0.6927699340291301,TPESampler,COMPLETE
263,0.27367475720114615,2025-04-24 21:39:49.997150,2025-04-24 21:39:54.506139,0 days 00:00:04.508989,0.05613410417949903,10,,1,17,1373,0.6585758671027543,TPESampler,COMPLETE
264,0.34705980898784394,2025-04-24 21:39:52.142583,2025-04-24 21:39:54.504688,0 days 00:00:02.362105,0.05221326920463459,12,log2,1,20,1406,0.716102282305338,TPESampler,COMPLETE
265,0.27247803680813887,2025-04-24 21:39:54.464964,2025-04-24 21:39:58.312263,0 days 00:00:03.847299,0.03936150639167738,11,,1,19,1438,0.6468213957152984,TPESampler,COMPLETE
266,0.26996457373130534,2025-04-24 21:39:54.722659,2025-04-24 21:39:58.389566,0 days 00:00:03.666907,0.060838162761472775,10,,1,12,1299,0.7289625977367645,TPESampler,COMPLETE
267,0.7277042925735795,2025-04-24 21:39:54.774361,2025-04-24 21:39:55.855007,0 days 00:00:01.080646,0.05694511746426801,4,log2,7,16,280,0.8340651829424978,TPESampler,COMPLETE
268,0.2765686998615413,2025-04-24 21:39:56.034923,2025-04-24 21:40:00.123794,0 days 00:00:04.088871,0.025710428733564324,11,,1,13,1459,0.6081774031109742,TPESampler,COMPLETE
269,0.41878507424161177,2025-04-24 21:39:58.462446,2025-04-24 21:39:59.963218,0 days 00:00:01.500772,0.09537530685689373,3,,5,18,392,0.7963659732893565,TPESampler,COMPLETE
270,0.5203440527025595,2025-04-24 21:39:58.536475,2025-04-24 21:40:00.490781,0 days 00:00:01.954306,0.01600955640245794,3,sqrt,7,10,1010,0.8400503030699111,TPESampler,COMPLETE
271,0.28595009147649847,2025-04-24 21:40:00.176110,2025-04-24 21:40:04.648361,0 days 00:00:04.472251,0.04204273124131611,10,,1,18,1442,0.7173947302205452,TPESampler,COMPLETE
272,0.3198454170927812,2025-04-24 21:40:00.397173,2025-04-24 21:40:04.300214,0 days 00:00:03.903041,0.04459206079123596,9,,3,18,1369,0.6042421150561743,TPESampler,COMPLETE
273,0.3089846049351669,2025-04-24 21:40:00.733649,2025-04-24 21:40:03.185884,0 days 00:00:02.452235,0.03577122590772337,11,sqrt,1,18,1384,0.6095704445408531,TPESampler,COMPLETE
274,0.28073015199674456,2025-04-24 21:40:03.369263,2025-04-24 21:40:07.321775,0 days 00:00:03.952512,0.04789738577419528,12,,1,17,1382,0.6413139125781437,TPESampler,COMPLETE
275,0.7484656864230507,2025-04-24 21:40:04.598343,2025-04-24 21:40:05.351895,0 days 00:00:00.753552,0.02927195591766017,3,log2,1,20,148,0.6336995119644138,TPESampler,COMPLETE
276,0.27539614921823496,2025-04-24 21:40:04.886627,2025-04-24 21:40:08.778896,0 days 00:00:03.892269,0.05510270088307619,10,,1,12,1402,0.7177500668954468,TPESampler,COMPLETE
277,0.34283279117554266,2025-04-24 21:40:05.538930,2025-04-24 21:40:09.544305,0 days 00:00:04.005375,0.04354862983314149,12,,2,20,1500,0.7098917998552249,TPESampler,COMPLETE
278,0.27242251404842627,2025-04-24 21:40:07.553037,2025-04-24 21:40:11.340748,0 days 00:00:03.787711,0.07891580028139547,9,,1,14,1409,0.7605786063096064,TPESampler,COMPLETE
279,0.28637502165261625,2025-04-24 21:40:08.980006,2025-04-24 21:40:11.371106,0 days 00:00:02.391100,0.09460814822814118,7,,1,12,848,0.777393726749698,TPESampler,COMPLETE
280,0.28584071520437315,2025-04-24 21:40:09.728588,2025-04-24 21:40:14.121638,0 days 00:00:04.393050,0.03193563311911181,11,,1,19,1424,0.6130501294348268,TPESampler,COMPLETE
281,0.34478094136123116,2025-04-24 21:40:11.485378,2025-04-24 21:40:15.922770,0 days 00:00:04.437392,0.07077665740673336,9,,2,13,1303,0.7553492673653349,TPESampler,COMPLETE
282,0.3778712723804672,2025-04-24 21:40:11.524053,2025-04-24 21:40:13.259354,0 days 00:00:01.735301,0.08000564891425067,6,sqrt,2,4,774,0.950591719410401,TPESampler,COMPLETE
283,0.561280580484555,2025-04-24 21:40:13.433820,2025-04-24 21:40:15.188889,0 days 00:00:01.755069,0.026603725713980675,7,log2,6,20,1152,0.8395086107944943,TPESampler,COMPLETE
284,0.32659852908717235,2025-04-24 21:40:14.385533,2025-04-24 21:40:16.988807,0 days 00:00:02.603274,0.04686007824204061,8,sqrt,1,15,1454,0.6655964846762877,TPESampler,COMPLETE
285,0.30077014873568125,2025-04-24 21:40:15.385634,2025-04-24 21:40:19.033428,0 days 00:00:03.647794,0.02454430417515675,7,,1,19,1318,0.7906848257740167,TPESampler,COMPLETE
286,0.2799984094826843,2025-04-24 21:40:16.147482,2025-04-24 21:40:20.099647,0 days 00:00:03.952165,0.08998574256955869,8,,1,15,1380,0.8322964346103081,TPESampler,COMPLETE
287,0.34235416142793296,2025-04-24 21:40:17.177087,2025-04-24 21:40:20.900181,0 days 00:00:03.723094,0.059073683554732984,9,,2,10,1283,0.7472902833102855,TPESampler,COMPLETE
288,0.5240267972792092,2025-04-24 21:40:19.216975,2025-04-24 21:40:21.316830,0 days 00:00:02.099855,0.020146487183184035,12,log2,4,5,1490,0.6631527027987851,TPESampler,COMPLETE
289,0.6337984252553182,2025-04-24 21:40:20.309144,2025-04-24 21:40:22.891783,0 days 00:00:02.582639,0.02619148280670836,8,,10,8,707,0.9963010306095559,TPESampler,COMPLETE
290,0.27807521680643993,2025-04-24 21:40:21.101586,2025-04-24 21:40:24.949870,0 days 00:00:03.848284,0.03891708269695282,11,,1,15,1291,0.711957183140036,TPESampler,COMPLETE
291,0.2881253327838474,2025-04-24 21:40:21.516055,2025-04-24 21:40:25.771628,0 days 00:00:04.255573,0.015225391281163247,10,,1,9,1463,0.7002544418098693,TPESampler,COMPLETE
292,0.285786426679292,2025-04-24 21:40:23.069799,2025-04-24 21:40:27.317793,0 days 00:00:04.247994,0.08185523166936533,11,,1,9,1346,0.7789224036147578,TPESampler,COMPLETE
293,0.2797869213837477,2025-04-24 21:40:25.130457,2025-04-24 21:40:28.689869,0 days 00:00:03.559412,0.04712415864575169,6,,1,13,1452,0.7035732473488908,TPESampler,COMPLETE
294,0.33956294286526434,2025-04-24 21:40:25.949330,2025-04-24 21:40:29.589568,0 days 00:00:03.640238,0.056768156064206154,10,,2,14,1238,0.7454420531721474,TPESampler,COMPLETE
295,0.2835306198974629,2025-04-24 21:40:27.496238,2025-04-24 21:40:31.652865,0 days 00:00:04.156627,0.05947901068654941,9,,1,11,1378,0.7738691576655189,TPESampler,COMPLETE
296,0.3261425569909054,2025-04-24 21:40:28.868135,2025-04-24 21:40:30.550439,0 days 00:00:01.682304,0.06172703120550936,6,sqrt,1,15,918,0.8255782366734127,TPESampler,COMPLETE
297,0.27399750370669196,2025-04-24 21:40:29.774364,2025-04-24 21:40:33.913175,0 days 00:00:04.138811,0.055367336170714564,11,,1,19,1272,0.6639071123414507,TPESampler,COMPLETE
298,0.6892129797760611,2025-04-24 21:40:30.722370,2025-04-24 21:40:32.924357,0 days 00:00:02.201987,0.050758257169003465,7,,10,7,752,0.7183814516836724,TPESampler,COMPLETE
299,0.3567590168777775,2025-04-24 21:40:31.848926,2025-04-24 21:40:34.078177,0 days 00:00:02.229251,0.08386619990070149,9,log2,2,18,1481,0.7370167521075754,TPESampler,COMPLETE
300,0.30070925014055083,2025-04-24 21:40:33.124003,2025-04-24 21:40:35.592509,0 days 00:00:02.468506,0.040823542110920326,6,,1,20,846,0.7512506381106043,TPESampler,COMPLETE
301,0.3339740255865995,2025-04-24 21:40:34.072111,2025-04-24 21:40:37.923329,0 days 00:00:03.851218,0.05440039764187716,10,,2,15,1240,0.6515966086935403,TPESampler,COMPLETE
302,0.29046125572206977,2025-04-24 21:40:34.255131,2025-04-24 21:40:38.830302,0 days 00:00:04.575171,0.07282714134449957,11,,1,19,1414,0.6239599643265004,TPESampler,COMPLETE
303,0.8012732335049944,2025-04-24 21:40:35.777357,2025-04-24 21:40:37.271883,0 days 00:00:01.494526,0.011624847997612223,3,log2,6,12,800,0.7208825428712741,TPESampler,COMPLETE
304,0.3331743077939013,2025-04-24 21:40:37.447485,2025-04-24 21:40:41.208964,0 days 00:00:03.761479,0.08797809705433367,8,,2,14,1169,0.7263931793432183,TPESampler,COMPLETE
305,0.6670165935267296,2025-04-24 21:40:38.117476,2025-04-24 21:40:39.254487,0 days 00:00:01.137011,0.037577451131118926,3,sqrt,10,8,466,0.6013502261462099,TPESampler,COMPLETE
306,0.8067700870275917,2025-04-24 21:40:39.047836,2025-04-24 21:40:40.582097,0 days 00:00:01.534261,0.012159095938933561,4,log2,9,19,886,0.8554401930578438,TPESampler,COMPLETE
307,0.2770850784893395,2025-04-24 21:40:39.455014,2025-04-24 21:40:43.812904,0 days 00:00:04.357890,0.051142541301514674,10,,1,12,1351,0.6868144155937905,TPESampler,COMPLETE
308,0.35163256762652767,2025-04-24 21:40:40.758731,2025-04-24 21:40:42.464934,0 days 00:00:01.706203,0.025513575882974752,12,log2,1,11,917,0.6380522335704324,TPESampler,COMPLETE
309,0.32794328430658104,2025-04-24 21:40:41.417273,2025-04-24 21:40:43.914106,0 days 00:00:02.496833,0.05159458745372848,7,,3,10,790,0.8930753737570564,TPESampler,COMPLETE
310,0.2883826399982232,2025-04-24 21:40:42.642322,2025-04-24 21:40:46.575233,0 days 00:00:03.932911,0.08025109829205966,11,,1,20,1468,0.6985372310275185,TPESampler,COMPLETE
311,0.2826083453626016,2025-04-24 21:40:43.975381,2025-04-24 21:40:47.945249,0 days 00:00:03.969868,0.05429900875617698,11,,1,7,1431,0.6034181901494503,TPESampler,COMPLETE
312,0.2742614811264301,2025-04-24 21:40:44.099232,2025-04-24 21:40:47.809993,0 days 00:00:03.710761,0.08087435547193185,7,,1,10,1482,0.6244026815827257,TPESampler,COMPLETE
313,0.2973387963280052,2025-04-24 21:40:46.754229,2025-04-24 21:40:51.159942,0 days 00:00:04.405713,0.03198008390587181,12,,1,5,1468,0.6579622130681131,TPESampler,COMPLETE
314,0.8996449936475215,2025-04-24 21:40:47.972528,2025-04-24 21:40:48.730422,0 days 00:00:00.757894,0.018125091535446745,12,log2,6,2,144,0.7420567302822249,TPESampler,COMPLETE
315,0.2742126298635569,2025-04-24 21:40:48.148494,2025-04-24 21:40:52.184369,0 days 00:00:04.035875,0.07143495329668498,9,,1,9,1390,0.614984837900824,TPESampler,COMPLETE
316,0.27789622633858346,2025-04-24 21:40:48.910384,2025-04-24 21:40:52.179490,0 days 00:00:03.269106,0.05408912112353306,5,,1,6,1483,0.6046139058072798,TPESampler,COMPLETE
317,0.2908814622477665,2025-04-24 21:40:51.457390,2025-04-24 21:40:55.906774,0 days 00:00:04.449384,0.05567374986388155,12,,1,18,1325,0.7578329522560832,TPESampler,COMPLETE
318,0.30221321326398903,2025-04-24 21:40:52.285061,2025-04-24 21:40:54.799968,0 days 00:00:02.514907,0.04012898301038854,12,sqrt,1,17,1399,0.7670093279330085,TPESampler,COMPLETE
319,0.2987585297802157,2025-04-24 21:40:52.334394,2025-04-24 21:40:56.782143,0 days 00:00:04.447749,0.09318942979796027,9,,1,7,1486,0.6779541280863498,TPESampler,COMPLETE
320,0.2866371709007018,2025-04-24 21:40:54.975459,2025-04-24 21:40:58.065772,0 days 00:00:03.090313,0.042711932508775405,10,,1,20,1098,0.6212788640068634,TPESampler,COMPLETE
321,0.2924783318754074,2025-04-24 21:40:56.085607,2025-04-24 21:40:59.110346,0 days 00:00:03.024739,0.07507423531265991,9,,1,6,1027,0.6402318385932543,TPESampler,COMPLETE
322,0.2752217024720028,2025-04-24 21:40:56.969382,2025-04-24 21:41:01.285008,0 days 00:00:04.315626,0.048692345520587335,10,,1,17,1460,0.6489893541004074,TPESampler,COMPLETE
323,0.5464235971742909,2025-04-24 21:40:58.249180,2025-04-24 21:41:00.159882,0 days 00:00:01.910702,0.04531907009659925,3,log2,7,11,1294,0.7554750766011497,TPESampler,COMPLETE
324,0.34824083536467687,2025-04-24 21:40:59.319980,2025-04-24 21:41:03.168391,0 days 00:00:03.848411,0.06868686255089985,8,,2,9,1451,0.6243143479297709,TPESampler,COMPLETE
325,0.26696925727048304,2025-04-24 21:41:00.340811,2025-04-24 21:41:03.887537,0 days 00:00:03.546726,0.08363173080707895,7,,1,13,1433,0.6271495433684211,TPESampler,COMPLETE
326,0.35246610992894123,2025-04-24 21:41:01.467136,2025-04-24 21:41:04.179180,0 days 00:00:02.712044,0.08635914688051836,12,,3,12,961,0.6553043396702289,TPESampler,COMPLETE
327,0.5533976254101505,2025-04-24 21:41:03.340817,2025-04-24 21:41:05.241812,0 days 00:00:01.900995,0.01028182114122821,6,,8,2,635,0.6507835797589251,TPESampler,COMPLETE
328,0.2836652225038701,2025-04-24 21:41:04.084407,2025-04-24 21:41:07.203346,0 days 00:00:03.118939,0.06525389899872104,8,,1,15,1198,0.7146245949091105,TPESampler,COMPLETE
329,0.33092337811771555,2025-04-24 21:41:04.394399,2025-04-24 21:41:07.797968,0 days 00:00:03.403569,0.031412118807655875,7,,2,9,1320,0.7690108481090957,TPESampler,COMPLETE
330,0.28226450317413826,2025-04-24 21:41:05.425164,2025-04-24 21:41:09.109022,0 days 00:00:03.683858,0.05478388400882105,6,,1,10,1440,0.6350842645280633,TPESampler,COMPLETE
331,0.4150739911531401,2025-04-24 21:41:07.388882,2025-04-24 21:41:11.077104,0 days 00:00:03.688222,0.09660643440056389,6,,5,12,1279,0.613738936123005,TPESampler,COMPLETE
332,0.6474895156038717,2025-04-24 21:41:08.016689,2025-04-24 21:41:10.272137,0 days 00:00:02.255448,0.056104614425073564,11,log2,8,12,1480,0.6733966870994652,TPESampler,COMPLETE
333,0.40902575483692966,2025-04-24 21:41:09.327642,2025-04-24 21:41:11.814732,0 days 00:00:02.487090,0.022607989459975247,10,,6,17,604,0.8321766053314062,TPESampler,COMPLETE
334,0.33283131275660627,2025-04-24 21:41:10.457618,2025-04-24 21:41:12.625364,0 days 00:00:02.167746,0.08233582964824794,12,log2,1,11,1111,0.7169480443309978,TPESampler,COMPLETE
335,0.2881429637665576,2025-04-24 21:41:11.342818,2025-04-24 21:41:13.479434,0 days 00:00:02.136616,0.09633306351771055,8,,1,13,450,0.9163483303545078,TPESampler,COMPLETE
336,0.33950304035855616,2025-04-24 21:41:12.033846,2025-04-24 21:41:15.406472,0 days 00:00:03.372626,0.06828293668966275,6,,3,11,1343,0.612511953640605,TPESampler,COMPLETE
337,0.2678584004306218,2025-04-24 21:41:12.815755,2025-04-24 21:41:16.657723,0 days 00:00:03.841968,0.07880162568169306,9,,1,9,1453,0.6107851861705501,TPESampler,COMPLETE
338,0.28018430650360016,2025-04-24 21:41:13.662240,2025-04-24 21:41:16.975563,0 days 00:00:03.313323,0.08755799635515238,7,,1,14,1233,0.7463535827923558,TPESampler,COMPLETE
339,0.2867069437619896,2025-04-24 21:41:15.607588,2025-04-24 21:41:19.447881,0 days 00:00:03.840293,0.056240707593748406,10,,1,20,1256,0.6975949302227523,TPESampler,COMPLETE
340,0.28061948290870914,2025-04-24 21:41:16.840106,2025-04-24 21:41:20.974240,0 days 00:00:04.134134,0.06281877467159412,8,,1,11,1458,0.6060117931818026,TPESampler,COMPLETE
341,0.7305982355160473,2025-04-24 21:41:17.161346,2025-04-24 21:41:18.688157,0 days 00:00:01.526811,0.030958570361647557,11,log2,10,18,868,0.9769620043933797,TPESampler,COMPLETE
342,0.73361278026077,2025-04-24 21:41:19.070155,2025-04-24 21:41:19.856432,0 days 00:00:00.786277,0.041227956199819685,8,sqrt,9,19,156,0.6608404879770924,TPESampler,COMPLETE
343,0.3105629643960882,2025-04-24 21:41:19.642392,2025-04-24 21:41:22.016497,0 days 00:00:02.374105,0.06495455876095547,8,sqrt,1,10,1339,0.6029976134182307,TPESampler,COMPLETE
344,0.3252092787292069,2025-04-24 21:41:20.051866,2025-04-24 21:41:22.927907,0 days 00:00:02.876041,0.055335318037154475,7,,3,13,926,0.8204169175036276,TPESampler,COMPLETE
345,0.2757282336570902,2025-04-24 21:41:21.169311,2025-04-24 21:41:24.323237,0 days 00:00:03.153926,0.09046583769781175,8,,1,14,1170,0.6022692344673963,TPESampler,COMPLETE
346,0.3087303565252151,2025-04-24 21:41:22.208478,2025-04-24 21:41:24.374178,0 days 00:00:02.165700,0.07868105866659675,8,,3,20,813,0.6230416035544569,TPESampler,COMPLETE
347,0.2857959593838553,2025-04-24 21:41:23.118494,2025-04-24 21:41:25.998107,0 days 00:00:02.879613,0.06010788628197113,6,,1,12,1034,0.8091835416174952,TPESampler,COMPLETE
348,0.6837863215805506,2025-04-24 21:41:24.453650,2025-04-24 21:41:25.780657,0 days 00:00:01.327007,0.0743385168924974,3,log2,10,7,466,0.8500154106589098,TPESampler,COMPLETE
349,0.34044961173024496,2025-04-24 21:41:24.509170,2025-04-24 21:41:27.970724,0 days 00:00:03.461554,0.06355464277575876,10,,3,11,1207,0.614485209451329,TPESampler,COMPLETE
350,0.28719541610297594,2025-04-24 21:41:25.956859,2025-04-24 21:41:29.682973,0 days 00:00:03.726114,0.08980330208525551,9,,1,13,1340,0.7745071740057441,TPESampler,COMPLETE
351,0.29452395021732297,2025-04-24 21:41:26.228434,2025-04-24 21:41:30.147039,0 days 00:00:03.918605,0.05046345223232102,12,,1,20,1354,0.6563497688438273,TPESampler,COMPLETE
352,0.2804121809743904,2025-04-24 21:41:28.156964,2025-04-24 21:41:32.425037,0 days 00:00:04.268073,0.035973804858946475,8,,1,16,1449,0.7543539552501347,TPESampler,COMPLETE
353,0.6553411368081838,2025-04-24 21:41:29.867812,2025-04-24 21:41:32.025463,0 days 00:00:02.157651,0.02811576261384599,7,sqrt,9,6,1461,0.6541768978694392,TPESampler,COMPLETE
354,0.3388457824648862,2025-04-24 21:41:30.318500,2025-04-24 21:41:34.689918,0 days 00:00:04.371418,0.06032146363159568,10,,3,19,1368,0.7139482306905858,TPESampler,COMPLETE
355,0.4467793355825833,2025-04-24 21:41:32.228089,2025-04-24 21:41:34.299689,0 days 00:00:02.071600,0.016792704192221012,8,sqrt,6,8,1233,0.7873168165185788,TPESampler,COMPLETE
356,0.2822188118717575,2025-04-24 21:41:32.617795,2025-04-24 21:41:35.791819,0 days 00:00:03.174024,0.08413687116330662,6,,1,10,1116,0.6072380262843181,TPESampler,COMPLETE
357,0.29223571880933785,2025-04-24 21:41:34.477661,2025-04-24 21:41:39.049425,0 days 00:00:04.571764,0.0719279530543,9,,1,7,1477,0.6450473132586242,TPESampler,COMPLETE
358,0.6164938851380947,2025-04-24 21:41:34.899759,2025-04-24 21:41:35.885502,0 days 00:00:00.985743,0.04375309583408737,8,,10,18,201,0.9141327439866803,TPESampler,COMPLETE
359,0.5855383203258601,2025-04-24 21:41:35.951138,2025-04-24 21:41:37.967619,0 days 00:00:02.016481,0.0132015185271239,5,log2,3,3,906,0.9880651166881811,TPESampler,COMPLETE
360,0.4428761945014647,2025-04-24 21:41:36.025384,2025-04-24 21:41:38.401522,0 days 00:00:02.376138,0.023905824601437864,9,sqrt,5,3,1143,0.6105598090074047,TPESampler,COMPLETE
361,0.2687492725243126,2025-04-24 21:41:38.185225,2025-04-24 21:41:42.328863,0 days 00:00:04.143638,0.08600719387457155,8,,1,15,1426,0.712350121222559,TPESampler,COMPLETE
362,0.28155342300873815,2025-04-24 21:41:38.631850,2025-04-24 21:41:42.249382,0 days 00:00:03.617532,0.047471337973621415,11,,1,17,1089,0.6751464011309347,TPESampler,COMPLETE
363,0.3381495400315776,2025-04-24 21:41:39.242447,2025-04-24 21:41:41.363663,0 days 00:00:02.121216,0.05726346482173226,10,log2,1,15,1252,0.6546824296524936,TPESampler,COMPLETE
364,0.2787724985905386,2025-04-24 21:41:41.560764,2025-04-24 21:41:45.232859,0 days 00:00:03.672095,0.06352536669894755,7,,1,11,1328,0.8949521345610801,TPESampler,COMPLETE
365,0.35605591720850577,2025-04-24 21:41:42.393457,2025-04-24 21:41:44.855279,0 days 00:00:02.461822,0.09604302771614245,5,,4,13,903,0.8454385882929356,TPESampler,COMPLETE
366,0.3635070177349076,2025-04-24 21:41:42.503142,2025-04-24 21:41:46.154719,0 days 00:00:03.651577,0.03904684356740715,11,,4,17,1365,0.6483292657754048,TPESampler,COMPLETE
367,0.34935073347772816,2025-04-24 21:41:45.047402,2025-04-24 21:41:47.837467,0 days 00:00:02.790065,0.028341396035817725,9,,4,18,1017,0.7467630489577668,TPESampler,COMPLETE
368,0.33506953113524174,2025-04-24 21:41:45.444910,2025-04-24 21:41:49.096296,0 days 00:00:03.651386,0.09564828423096151,7,,3,17,1461,0.6715752088075317,TPESampler,COMPLETE
369,0.3136352336519418,2025-04-24 21:41:46.344405,2025-04-24 21:41:48.575266,0 days 00:00:02.230861,0.04447155775859769,9,,3,19,783,0.736582419603209,TPESampler,COMPLETE
370,0.29067106044981095,2025-04-24 21:41:48.028113,2025-04-24 21:41:51.493737,0 days 00:00:03.465624,0.027809948727318894,10,,1,20,938,0.7669508585974031,TPESampler,COMPLETE
371,0.5476111983560442,2025-04-24 21:41:48.757065,2025-04-24 21:41:50.645969,0 days 00:00:01.888904,0.06362007435228235,12,log2,8,7,1292,0.9138366578276194,TPESampler,COMPLETE
372,0.27732534827300404,2025-04-24 21:41:49.266770,2025-04-24 21:41:52.886889,0 days 00:00:03.620119,0.04826488458854036,12,,1,14,1016,0.6197254535696793,TPESampler,COMPLETE
373,0.37052409956488,2025-04-24 21:41:50.829299,2025-04-24 21:41:52.798259,0 days 00:00:01.968960,0.013092320036548486,7,sqrt,3,2,1190,0.8986738027849409,TPESampler,COMPLETE
