number,value,datetime_start,datetime_complete,duration,params_learning_rate,params_max_depth,params_max_features,params_min_samples_leaf,params_min_samples_split,params_n_estimators,params_subsample,system_attrs_auto:sampler,state
1124,0.5715030753927495,2025-04-24 21:55:26.681860,2025-04-24 21:55:28.818680,0 days 00:00:02.136820,0.011368480273564463,7,sqrt,6,5,1134,0.6670767573150918,TPESampler,COMPLETE
1125,0.3234037375708053,2025-04-24 21:55:26.893561,2025-04-24 21:55:29.527300,0 days 00:00:02.633739,0.06930375874141398,7,,2,11,613,0.6703798569196928,TPESampler,COMPLETE
1126,0.33490036588598093,2025-04-24 21:55:28.299067,2025-04-24 21:55:31.302643,0 days 00:00:03.003576,0.0617582387797584,9,,2,9,977,0.6356992033188372,TPESampler,COMPLETE
1127,0.337727558709543,2025-04-24 21:55:29.031497,2025-04-24 21:55:32.652622,0 days 00:00:03.621125,0.052101111932365475,12,,3,15,1183,0.7038590769425256,TPESampler,COMPLETE
1128,0.3259340093908944,2025-04-24 21:55:29.730064,2025-04-24 21:55:31.817522,0 days 00:00:02.087458,0.06758042916429136,9,,2,7,646,0.7034351241051773,TPESampler,COMPLETE
1129,0.26630853013577815,2025-04-24 21:55:31.514542,2025-04-24 21:55:33.778623,0 days 00:00:02.264081,0.06774655785913686,6,,1,8,737,0.6126013490565881,TPESampler,COMPLETE
1130,0.3326134567248807,2025-04-24 21:55:32.037711,2025-04-24 21:55:34.715137,0 days 00:00:02.677426,0.06730276588391422,7,,3,10,864,0.6421316478371272,TPESampler,COMPLETE
1131,0.29605966249366966,2025-04-24 21:55:32.868226,2025-04-24 21:55:35.024063,0 days 00:00:02.155837,0.051260824688890996,7,,1,8,673,0.6836649360272571,TPESampler,COMPLETE
1132,0.3843145440775535,2025-04-24 21:55:33.983860,2025-04-24 21:55:35.775498,0 days 00:00:01.791638,0.026617499388785108,10,,5,5,243,0.6807944899103007,TPESampler,COMPLETE
1133,0.3234869615028282,2025-04-24 21:55:35.067131,2025-04-24 21:55:36.615573,0 days 00:00:01.548442,0.04489050976074405,4,,1,7,427,0.6667033035610513,TPESampler,COMPLETE
1134,0.27617942801494444,2025-04-24 21:55:35.253936,2025-04-24 21:55:37.874196,0 days 00:00:02.620260,0.07910698513565671,7,,1,8,780,0.7079531036022946,TPESampler,COMPLETE
1135,0.2849234872372244,2025-04-24 21:55:35.986166,2025-04-24 21:55:39.845213,0 days 00:00:03.859047,0.09760962107969846,7,,1,12,1383,0.6654831192065389,TPESampler,COMPLETE
1136,0.31792513383843735,2025-04-24 21:55:36.830614,2025-04-24 21:55:38.599134,0 days 00:00:01.768520,0.06269326101591374,8,,3,10,468,0.652878146278885,TPESampler,COMPLETE
1137,0.3415524576449192,2025-04-24 21:55:38.064558,2025-04-24 21:55:40.538989,0 days 00:00:02.474431,0.05760785844933821,3,,3,4,946,0.6253413675010423,TPESampler,COMPLETE
1138,0.40651956554050245,2025-04-24 21:55:38.913154,2025-04-24 21:55:40.618433,0 days 00:00:01.705279,0.015018786546069274,7,,5,10,378,0.7617236571948774,TPESampler,COMPLETE
1139,0.3375996344007799,2025-04-24 21:55:40.043915,2025-04-24 21:55:42.952825,0 days 00:00:02.908910,0.07159722395273165,6,,2,6,1035,0.6042154917033249,TPESampler,COMPLETE
1140,0.3386911437682153,2025-04-24 21:55:40.795395,2025-04-24 21:55:42.711387,0 days 00:00:01.915992,0.09871479081981906,5,,3,10,596,0.6940984405142084,TPESampler,COMPLETE
1141,0.3218295035742567,2025-04-24 21:55:40.849085,2025-04-24 21:55:42.736398,0 days 00:00:01.887313,0.06468758961529153,8,,2,8,505,0.6039855265660499,TPESampler,COMPLETE
1142,0.35787586106493374,2025-04-24 21:55:42.861985,2025-04-24 21:55:45.692094,0 days 00:00:02.830109,0.06519775293925734,9,,2,3,868,0.618062225131019,TPESampler,COMPLETE
1143,0.33011982659789746,2025-04-24 21:55:42.915341,2025-04-24 21:55:45.628115,0 days 00:00:02.712774,0.07309667911158865,7,,2,5,750,0.6481627031065771,TPESampler,COMPLETE
1144,0.33660257256904413,2025-04-24 21:55:43.164441,2025-04-24 21:55:45.755444,0 days 00:00:02.591003,0.08631283259528087,6,sqrt,2,14,1197,0.6437423457785484,TPESampler,COMPLETE
1145,0.3510436424553265,2025-04-24 21:55:45.825615,2025-04-24 21:55:48.105539,0 days 00:00:02.279924,0.0959185083640875,10,,2,9,668,0.708950395936322,TPESampler,COMPLETE
1146,0.31385006446481617,2025-04-24 21:55:45.874356,2025-04-24 21:55:48.526667,0 days 00:00:02.652311,0.057204526069643276,6,,2,12,870,0.6454903051821135,TPESampler,COMPLETE
1147,0.30062253545039913,2025-04-24 21:55:46.062885,2025-04-24 21:55:48.499936,0 days 00:00:02.437051,0.05203092193966046,7,,1,5,674,0.6879760757685608,TPESampler,COMPLETE
1148,0.293784301845007,2025-04-24 21:55:48.294940,2025-04-24 21:55:50.658346,0 days 00:00:02.363406,0.07279170790397807,4,,1,7,866,0.6545312945773659,TPESampler,COMPLETE
1149,0.29084097567846195,2025-04-24 21:55:48.732695,2025-04-24 21:55:51.120457,0 days 00:00:02.387762,0.07168870216212958,6,,1,13,685,0.6307375210798831,TPESampler,COMPLETE
1150,0.3381014490726649,2025-04-24 21:55:48.778918,2025-04-24 21:55:52.173014,0 days 00:00:03.394096,0.013592509857070684,4,,3,15,1321,0.6046784358748706,TPESampler,COMPLETE
1151,0.369280453556683,2025-04-24 21:55:50.859327,2025-04-24 21:55:52.993170,0 days 00:00:02.133843,0.012634107532827886,4,,3,18,725,0.6489125914547447,TPESampler,COMPLETE
1152,0.3556580363601205,2025-04-24 21:55:51.405666,2025-04-24 21:55:55.478633,0 days 00:00:04.072967,0.09744248961873929,9,,3,16,1229,0.7110900141634765,TPESampler,COMPLETE
1153,0.2762741945386067,2025-04-24 21:55:52.383533,2025-04-24 21:55:54.931175,0 days 00:00:02.547642,0.06180182983047288,10,,1,9,695,0.6329854483044973,TPESampler,COMPLETE
1154,0.31358109986129,2025-04-24 21:55:53.187733,2025-04-24 21:55:55.077127,0 days 00:00:01.889394,0.08493644131419195,6,sqrt,1,9,953,0.6579520898735197,TPESampler,COMPLETE
1155,0.3123556787355927,2025-04-24 21:55:55.120669,2025-04-24 21:55:57.990420,0 days 00:00:02.869751,0.0832607408828923,8,,2,16,839,0.6224407668368445,TPESampler,COMPLETE
1156,0.39329253789546703,2025-04-24 21:55:55.278681,2025-04-24 21:55:57.291247,0 days 00:00:02.012566,0.03430080800214415,4,,5,5,526,0.6397754281759855,TPESampler,COMPLETE
1157,0.37608355353774736,2025-04-24 21:55:55.816022,2025-04-24 21:55:57.639865,0 days 00:00:01.823843,0.05191629460088432,3,sqrt,3,18,867,0.8080953413573023,TPESampler,COMPLETE
1158,0.29981931234761844,2025-04-24 21:55:57.497920,2025-04-24 21:55:59.468537,0 days 00:00:01.970617,0.07830209598328744,4,,1,8,600,0.6329169894532576,TPESampler,COMPLETE
1159,0.36551942911470703,2025-04-24 21:55:57.876534,2025-04-24 21:56:01.227383,0 days 00:00:03.350849,0.01026953966624521,5,,4,5,1224,0.7103856691421371,TPESampler,COMPLETE
1160,0.273742895699613,2025-04-24 21:55:58.308502,2025-04-24 21:56:00.796318,0 days 00:00:02.487816,0.08986563019621406,8,,1,10,743,0.670575109722592,TPESampler,COMPLETE
1161,0.3491074721468566,2025-04-24 21:55:59.717797,2025-04-24 21:56:01.151322,0 days 00:00:01.433525,0.07264260032432483,6,sqrt,1,11,550,0.6877556933686427,TPESampler,COMPLETE
1162,0.27206870664225696,2025-04-24 21:56:01.008522,2025-04-24 21:56:04.133989,0 days 00:00:03.125467,0.050788788215724856,6,,1,8,1011,0.6624476071214478,TPESampler,COMPLETE
1163,0.3507338430837965,2025-04-24 21:56:01.379946,2025-04-24 21:56:03.705726,0 days 00:00:02.325780,0.08025496853402599,7,sqrt,2,7,1163,0.6992485433876489,TPESampler,COMPLETE
1164,0.28690006021574843,2025-04-24 21:56:01.592475,2025-04-24 21:56:04.872261,0 days 00:00:03.279786,0.08536233414615571,8,,1,7,1019,0.6844124464364426,TPESampler,COMPLETE
1165,0.27926531333931476,2025-04-24 21:56:03.909846,2025-04-24 21:56:08.120527,0 days 00:00:04.210681,0.05906751833032681,6,,1,20,1493,0.7317239878021524,TPESampler,COMPLETE
1166,0.27117092189972647,2025-04-24 21:56:04.385537,2025-04-24 21:56:07.159014,0 days 00:00:02.773477,0.06411557162295854,9,,1,10,772,0.6856301104438611,TPESampler,COMPLETE
1167,0.3813552773135225,2025-04-24 21:56:05.091719,2025-04-24 21:56:06.839595,0 days 00:00:01.747876,0.09435893201682717,8,log2,2,11,823,0.7189635803072265,TPESampler,COMPLETE
1168,0.2885654429694131,2025-04-24 21:56:07.025782,2025-04-24 21:56:10.156269,0 days 00:00:03.130487,0.027131972348031736,8,,1,18,1041,0.6637304264055759,TPESampler,COMPLETE
1169,0.33093075592912025,2025-04-24 21:56:07.398829,2025-04-24 21:56:09.174713,0 days 00:00:01.775884,0.08363709113023084,7,,2,6,509,0.6694740993293431,TPESampler,COMPLETE
1170,0.2834860393411093,2025-04-24 21:56:08.332894,2025-04-24 21:56:12.132856,0 days 00:00:03.799962,0.09198272463195897,9,,1,5,1036,0.6838730893292296,TPESampler,COMPLETE
1171,0.3281554162922448,2025-04-24 21:56:09.369371,2025-04-24 21:56:10.878938,0 days 00:00:01.509567,0.05255483318776091,9,sqrt,1,9,605,0.6323141688022341,TPESampler,COMPLETE
1172,0.4182628059717025,2025-04-24 21:56:10.355909,2025-04-24 21:56:11.406826,0 days 00:00:01.050917,0.07927760564920909,3,sqrt,1,16,215,0.9552491181485606,TPESampler,COMPLETE
1173,0.32613562420109915,2025-04-24 21:56:11.113666,2025-04-24 21:56:13.224129,0 days 00:00:02.110463,0.057152258724927955,7,,2,6,651,0.6108861823855715,TPESampler,COMPLETE
1174,0.28250824096283084,2025-04-24 21:56:11.660068,2025-04-24 21:56:14.007123,0 days 00:00:02.347055,0.08852695591835326,7,,1,9,593,0.6738193181055897,TPESampler,COMPLETE
1175,0.33010914438429667,2025-04-24 21:56:12.418762,2025-04-24 21:56:15.542882,0 days 00:00:03.124120,0.09229375014990406,8,,3,18,1014,0.7497345447974922,TPESampler,COMPLETE
1176,0.3407395094297005,2025-04-24 21:56:13.423469,2025-04-24 21:56:16.057847,0 days 00:00:02.634378,0.09738713607894346,8,,3,13,902,0.6486082869964324,TPESampler,COMPLETE
1177,0.3709798618321118,2025-04-24 21:56:14.209665,2025-04-24 21:56:18.507651,0 days 00:00:04.297986,0.09989848610639414,10,,4,6,1337,0.6948891878226581,TPESampler,COMPLETE
1178,0.3936595715539569,2025-04-24 21:56:15.745999,2025-04-24 21:56:17.135554,0 days 00:00:01.389555,0.05780763645827376,8,,5,18,296,0.7879001719368467,TPESampler,COMPLETE
1179,0.2914309061081071,2025-04-24 21:56:16.265125,2025-04-24 21:56:18.536676,0 days 00:00:02.271551,0.0851163798518259,5,,1,10,791,0.6819545533693836,TPESampler,COMPLETE
1180,0.29237620803058356,2025-04-24 21:56:17.337337,2025-04-24 21:56:21.287317,0 days 00:00:03.949980,0.08183602193347418,9,,1,8,1279,0.7187033310412821,TPESampler,COMPLETE
1181,0.3498323943799272,2025-04-24 21:56:18.669657,2025-04-24 21:56:21.558374,0 days 00:00:02.888717,0.053823996305231665,6,,4,5,1005,0.6794923539446431,TPESampler,COMPLETE
1182,0.2952226527728195,2025-04-24 21:56:18.714103,2025-04-24 21:56:20.343390,0 days 00:00:01.629287,0.07782913435640938,6,,1,10,338,0.6173163388476776,TPESampler,COMPLETE
1183,0.4003196297243576,2025-04-24 21:56:20.679695,2025-04-24 21:56:22.311552,0 days 00:00:01.631857,0.06607912061392276,5,log2,1,10,687,0.6716419798871216,TPESampler,COMPLETE
1184,0.4125836987396873,2025-04-24 21:56:21.505204,2025-04-24 21:56:23.460715,0 days 00:00:01.955511,0.05734683987621678,9,log2,3,11,1015,0.7132328345958239,TPESampler,COMPLETE
1185,0.3266709631129127,2025-04-24 21:56:21.825957,2025-04-24 21:56:24.188493,0 days 00:00:02.362536,0.07136239362742718,5,,2,9,709,0.6112860812403332,TPESampler,COMPLETE
1186,0.3278378942890402,2025-04-24 21:56:22.552307,2025-04-24 21:56:25.007468,0 days 00:00:02.455161,0.04069854170304168,5,,2,6,696,0.6032609014442781,TPESampler,COMPLETE
1187,0.3284644122831271,2025-04-24 21:56:23.887028,2025-04-24 21:56:27.599462,0 days 00:00:03.712434,0.06682240991212897,10,,3,19,1046,0.6517418403743591,TPESampler,COMPLETE
1188,0.886512407424351,2025-04-24 21:56:24.608251,2025-04-24 21:56:25.852010,0 days 00:00:01.243759,0.010821328137509871,9,log2,10,7,472,0.631410612374425,TPESampler,COMPLETE
1189,0.3595122999771338,2025-04-24 21:56:25.201944,2025-04-24 21:56:26.667300,0 days 00:00:01.465356,0.04492923453967595,9,sqrt,3,4,364,0.8470610275461831,TPESampler,COMPLETE
1190,0.32821956472599345,2025-04-24 21:56:26.075731,2025-04-24 21:56:27.864202,0 days 00:00:01.788471,0.056427553116609575,5,,2,13,469,0.762593814255232,TPESampler,COMPLETE
1191,0.36753120453316823,2025-04-24 21:56:26.883062,2025-04-24 21:56:30.231679,0 days 00:00:03.348617,0.09573020561815164,9,,3,12,1200,0.619926493340902,TPESampler,COMPLETE
1192,0.28465653186406414,2025-04-24 21:56:27.800403,2025-04-24 21:56:31.137027,0 days 00:00:03.336624,0.05027541775002481,6,,1,12,1230,0.6178139706971951,TPESampler,COMPLETE
1193,0.26526168615730494,2025-04-24 21:56:28.210233,2025-04-24 21:56:31.721949,0 days 00:00:03.511716,0.08519751344068935,6,,1,10,1314,0.6006005260109982,TPESampler,COMPLETE
1194,0.32867139244094085,2025-04-24 21:56:30.448536,2025-04-24 21:56:32.551401,0 days 00:00:02.102865,0.05593054482551072,9,log2,1,5,1042,0.6448781762705735,TPESampler,COMPLETE
1195,0.4040217867230123,2025-04-24 21:56:31.336510,2025-04-24 21:56:33.290449,0 days 00:00:01.953939,0.016100183844145417,3,,5,16,519,0.8756026299373452,TPESampler,COMPLETE
1196,0.32822761055484967,2025-04-24 21:56:32.007053,2025-04-24 21:56:35.054882,0 days 00:00:03.047829,0.08242822489123919,6,,2,10,900,0.62218348943805,TPESampler,COMPLETE
1197,0.689303324848518,2025-04-24 21:56:32.767179,2025-04-24 21:56:34.123927,0 days 00:00:01.356748,0.025796562966153354,3,sqrt,10,16,456,0.7788474852773346,TPESampler,COMPLETE
1198,0.3482024723976997,2025-04-24 21:56:33.519350,2025-04-24 21:56:35.137731,0 days 00:00:01.618381,0.08339234889084834,9,log2,1,6,555,0.719889027949949,TPESampler,COMPLETE
1199,0.26682086815280326,2025-04-24 21:56:34.355587,2025-04-24 21:56:37.721592,0 days 00:00:03.366005,0.09446493436803848,5,,1,9,1273,0.6188587783618542,TPESampler,COMPLETE
1200,0.332414733133517,2025-04-24 21:56:35.236534,2025-04-24 21:56:37.983966,0 days 00:00:02.747432,0.09808700007056452,7,,2,10,908,0.6047495697316738,TPESampler,COMPLETE
1201,0.329765751377623,2025-04-24 21:56:35.302785,2025-04-24 21:56:38.644925,0 days 00:00:03.342140,0.06844794354179295,4,,2,8,1280,0.6318162731638033,TPESampler,COMPLETE
1202,0.2993060765488975,2025-04-24 21:56:37.933830,2025-04-24 21:56:40.498091,0 days 00:00:02.564261,0.0729750270093587,4,,1,12,1066,0.6333402016571202,TPESampler,COMPLETE
1203,0.3184350013561409,2025-04-24 21:56:38.251559,2025-04-24 21:56:41.569948,0 days 00:00:03.318389,0.0671878549290732,5,,2,10,1359,0.6360550123176792,TPESampler,COMPLETE
1204,0.33774306490978917,2025-04-24 21:56:38.840323,2025-04-24 21:56:42.554884,0 days 00:00:03.714561,0.09762942813295862,6,,2,9,1279,0.7025916502781955,TPESampler,COMPLETE
1205,0.3332275826767458,2025-04-24 21:56:40.690772,2025-04-24 21:56:44.091561,0 days 00:00:03.400789,0.06772489474718167,5,,2,11,1377,0.6408793022643793,TPESampler,COMPLETE
1206,0.2998774462804416,2025-04-24 21:56:41.788571,2025-04-24 21:56:45.253454,0 days 00:00:03.464883,0.09219685168090694,6,,1,17,1219,0.6686851185981768,TPESampler,COMPLETE
1207,0.29223803244445246,2025-04-24 21:56:42.771780,2025-04-24 21:56:44.553212,0 days 00:00:01.781432,0.07349978522825222,5,,1,5,574,0.6163807692884665,TPESampler,COMPLETE
1208,0.371958335372099,2025-04-24 21:56:44.322911,2025-04-24 21:56:46.325010,0 days 00:00:02.002099,0.0716947414452375,5,log2,3,7,1146,0.6528575689711124,TPESampler,COMPLETE
1209,0.325836774319759,2025-04-24 21:56:44.799925,2025-04-24 21:56:48.885546,0 days 00:00:04.085621,0.08300146402329579,6,,2,13,1336,0.6173645034980799,TPESampler,COMPLETE
1210,0.27322892511290836,2025-04-24 21:56:45.494672,2025-04-24 21:56:49.165592,0 days 00:00:03.670920,0.07622790408317824,5,,1,11,1332,0.6021863618661563,TPESampler,COMPLETE
1211,0.644271796378596,2025-04-24 21:56:46.551118,2025-04-24 21:56:48.040211,0 days 00:00:01.489093,0.019669812986121884,4,sqrt,8,7,582,0.796493688145239,TPESampler,COMPLETE
1212,0.3130081016569291,2025-04-24 21:56:48.252517,2025-04-24 21:56:51.725285,0 days 00:00:03.472768,0.06828715445774872,3,,2,13,1423,0.6261264423571816,TPESampler,COMPLETE
1213,0.28526349130878015,2025-04-24 21:56:49.124779,2025-04-24 21:56:52.457146,0 days 00:00:03.332367,0.07568856465533082,4,,1,5,1225,0.6224928928092678,TPESampler,COMPLETE
1214,0.45749428479758514,2025-04-24 21:56:49.395443,2025-04-24 21:56:51.665383,0 days 00:00:02.269940,0.016932943916597262,3,sqrt,5,2,981,0.8437957407683071,TPESampler,COMPLETE
1215,0.26978029007757137,2025-04-24 21:56:51.827885,2025-04-24 21:56:55.260351,0 days 00:00:03.432466,0.08293546425307932,6,,1,12,1329,0.6140985276042016,TPESampler,COMPLETE
1216,0.2728299430248875,2025-04-24 21:56:51.969591,2025-04-24 21:56:55.413440,0 days 00:00:03.443849,0.07362422974694287,6,,1,6,1352,0.6023974871383182,TPESampler,COMPLETE
1217,0.271955373851914,2025-04-24 21:56:52.733150,2025-04-24 21:56:55.678940,0 days 00:00:02.945790,0.07645025364051845,7,,1,8,1205,0.6113024156511362,TPESampler,COMPLETE
1218,0.28425692729046537,2025-04-24 21:56:55.448333,2025-04-24 21:56:58.157444,0 days 00:00:02.709111,0.09998713122373774,6,sqrt,1,8,1327,0.6250341802908521,TPESampler,COMPLETE
1219,0.28357975491630205,2025-04-24 21:56:55.651840,2025-04-24 21:56:59.040089,0 days 00:00:03.388249,0.07259888820267313,6,,1,11,1038,0.6220118388358685,TPESampler,COMPLETE
1220,0.539222219046673,2025-04-24 21:56:55.917633,2025-04-24 21:56:57.879992,0 days 00:00:01.962359,0.011122054034605032,9,log2,2,17,634,0.9855771057321185,TPESampler,COMPLETE
1221,0.2901203613522603,2025-04-24 21:56:58.109642,2025-04-24 21:57:01.058394,0 days 00:00:02.948752,0.07644098220551429,4,,1,7,1087,0.6328686273374058,TPESampler,COMPLETE
1222,0.4259672066031178,2025-04-24 21:56:58.430798,2025-04-24 21:56:59.410222,0 days 00:00:00.979424,0.04434229687765485,7,,7,10,101,0.8227105127996581,TPESampler,COMPLETE
1223,0.37905943531821007,2025-04-24 21:56:59.278618,2025-04-24 21:57:01.848021,0 days 00:00:02.569403,0.032338569203566724,5,sqrt,4,2,1386,0.7887021601214432,TPESampler,COMPLETE
1224,0.2773784785041304,2025-04-24 21:56:59.634767,2025-04-24 21:57:03.674804,0 days 00:00:04.040037,0.09547296780150619,7,,1,11,1342,0.6180073559585103,TPESampler,COMPLETE
1225,0.3262685876965076,2025-04-24 21:57:01.281364,2025-04-24 21:57:04.139302,0 days 00:00:02.857938,0.06579386764679702,5,,3,14,1002,0.6970916159883509,TPESampler,COMPLETE
1226,0.40960292845177493,2025-04-24 21:57:02.069844,2025-04-24 21:57:03.576501,0 days 00:00:01.506657,0.011339363857610849,10,sqrt,3,4,508,0.9804831023945334,TPESampler,COMPLETE
1227,0.34045019932194714,2025-04-24 21:57:03.763220,2025-04-24 21:57:06.965340,0 days 00:00:03.202120,0.0765650253839291,5,,3,7,1329,0.6363954391365603,TPESampler,COMPLETE
1228,0.2865204554536737,2025-04-24 21:57:03.859854,2025-04-24 21:57:09.197319,0 days 00:00:05.337465,0.056993236323403265,11,,1,16,1494,0.7833159159041873,TPESampler,COMPLETE
1229,0.32405820283970344,2025-04-24 21:57:04.436956,2025-04-24 21:57:06.966519,0 days 00:00:02.529563,0.09883890327594644,5,,3,12,1041,0.6673124019221335,TPESampler,COMPLETE
1230,0.2771657631254467,2025-04-24 21:57:07.127992,2025-04-24 21:57:10.843986,0 days 00:00:03.715994,0.07011662208162033,5,,1,8,1468,0.6551230766767482,TPESampler,COMPLETE
1231,0.27042952612804344,2025-04-24 21:57:07.174659,2025-04-24 21:57:10.892170,0 days 00:00:03.717511,0.0832903720608989,5,,1,7,1458,0.6265068911631888,TPESampler,COMPLETE
1232,0.7405135004447394,2025-04-24 21:57:09.416117,2025-04-24 21:57:10.796145,0 days 00:00:01.380028,0.03675981068001638,4,log2,7,14,424,0.6351148475262707,TPESampler,COMPLETE
1233,0.33543211472579015,2025-04-24 21:57:10.963589,2025-04-24 21:57:14.176917,0 days 00:00:03.213328,0.08281105449407576,5,,2,9,1033,0.606366163404113,TPESampler,COMPLETE
1234,0.607591588219057,2025-04-24 21:57:10.976179,2025-04-24 21:57:13.091076,0 days 00:00:02.114897,0.010986470895499537,9,,10,16,256,0.9828229543624252,TPESampler,COMPLETE
1235,0.33022743699585544,2025-04-24 21:57:10.969051,2025-04-24 21:57:15.237594,0 days 00:00:04.268543,0.07818022576079159,5,,2,8,1358,0.6014683376759594,TPESampler,COMPLETE
1236,0.30213789560508203,2025-04-24 21:57:13.379008,2025-04-24 21:57:16.656764,0 days 00:00:03.277756,0.09705794097273265,12,,1,6,782,0.6202041879658884,TPESampler,COMPLETE
1237,0.3073032472329629,2025-04-24 21:57:14.438294,2025-04-24 21:57:16.930302,0 days 00:00:02.492008,0.05647721234290216,10,sqrt,1,20,1141,0.7214891215891419,TPESampler,COMPLETE
1238,0.6875568595423868,2025-04-24 21:57:15.435379,2025-04-24 21:57:17.636270,0 days 00:00:02.200891,0.02912727369841718,6,log2,9,18,1245,0.7596413994905196,TPESampler,COMPLETE
1239,0.27320962505579244,2025-04-24 21:57:16.876646,2025-04-24 21:57:20.531186,0 days 00:00:03.654540,0.06986325638476697,8,,1,20,1232,0.6631501622625318,TPESampler,COMPLETE
1240,0.3349777546967147,2025-04-24 21:57:17.254967,2025-04-24 21:57:20.013166,0 days 00:00:02.758199,0.09520759342555817,4,,3,6,1084,0.6130363909004087,TPESampler,COMPLETE
1241,0.29681972992501393,2025-04-24 21:57:17.892906,2025-04-24 21:57:20.117801,0 days 00:00:02.224895,0.06786888067068007,4,,1,16,791,0.7460525187564945,TPESampler,COMPLETE
1242,0.33760207342970794,2025-04-24 21:57:20.245109,2025-04-24 21:57:23.392445,0 days 00:00:03.147336,0.060957067226642646,8,,3,10,1004,0.7508668893471012,TPESampler,COMPLETE
1243,0.2834797376322934,2025-04-24 21:57:20.287762,2025-04-24 21:57:23.958816,0 days 00:00:03.671054,0.06737974109799734,6,,1,9,1224,0.6734182464906244,TPESampler,COMPLETE
1244,0.31123056406376925,2025-04-24 21:57:20.790987,2025-04-24 21:57:22.895420,0 days 00:00:02.104433,0.09469368352847177,9,sqrt,1,15,935,0.783370534290323,TPESampler,COMPLETE
1245,0.5812279748050545,2025-04-24 21:57:23.089942,2025-04-24 21:57:24.203920,0 days 00:00:01.113978,0.01619606048300711,8,,10,14,156,0.605367447663527,TPESampler,COMPLETE
1246,0.2903871655632663,2025-04-24 21:57:23.617924,2025-04-24 21:57:27.919722,0 days 00:00:04.301798,0.07052073532457118,6,,1,10,1442,0.6143158474745413,TPESampler,COMPLETE
1247,0.56356528531109,2025-04-24 21:57:24.201552,2025-04-24 21:57:26.330360,0 days 00:00:02.128808,0.08193832336585923,10,log2,8,19,1241,0.8159491838810758,TPESampler,COMPLETE
1248,0.32472101412628457,2025-04-24 21:57:24.471980,2025-04-24 21:57:27.891441,0 days 00:00:03.419461,0.09741742147486455,4,,2,11,1131,0.6390746107336838,TPESampler,COMPLETE
