number,value,datetime_start,datetime_complete,duration,params_learning_rate,params_max_depth,params_max_features,params_min_samples_leaf,params_min_samples_split,params_n_estimators,params_subsample,system_attrs_auto:sampler,state
2123,0.33771769528838463,2025-04-24 22:13:20.507205,2025-04-24 22:13:23.765220,0 days 00:00:03.258015,0.09322808081146318,8,,2,12,1147,0.6020093075025778,TPESampler,COMPLETE
2124,0.34901190077077193,2025-04-24 22:13:21.874925,2025-04-24 22:13:25.173345,0 days 00:00:03.298420,0.07676806360603766,6,,3,10,1277,0.6051618734348811,TPESampler,COMPLETE
2125,0.2779703461530381,2025-04-24 22:13:22.290346,2025-04-24 22:13:25.601918,0 days 00:00:03.311572,0.06599566131029391,8,,1,10,1211,0.6013957729697746,TPESampler,COMPLETE
2126,0.3732809828678398,2025-04-24 22:13:23.967963,2025-04-24 22:13:27.930358,0 days 00:00:03.962395,0.0648736449391749,10,,3,11,1260,0.6905322236027476,TPESampler,COMPLETE
2127,0.2739058577778766,2025-04-24 22:13:25.374770,2025-04-24 22:13:29.595932,0 days 00:00:04.221162,0.05700769912573975,9,,1,12,1440,0.616007614576116,TPESampler,COMPLETE
2128,0.5727519259305675,2025-04-24 22:13:25.875954,2025-04-24 22:13:26.940813,0 days 00:00:01.064859,0.019794084978376984,5,sqrt,4,8,245,0.7315225016673884,TPESampler,COMPLETE
2129,0.27638451674791575,2025-04-24 22:13:27.193741,2025-04-24 22:13:31.096584,0 days 00:00:03.902843,0.08325326300696735,7,,1,5,1474,0.6249030010063535,TPESampler,COMPLETE
2130,0.2770418933421072,2025-04-24 22:13:28.144040,2025-04-24 22:13:32.221747,0 days 00:00:04.077707,0.09139502592021978,11,,1,15,1474,0.6002859443807894,TPESampler,COMPLETE
2131,0.2689091662989449,2025-04-24 22:13:29.805664,2025-04-24 22:13:33.671218,0 days 00:00:03.865554,0.054148718999457786,9,,1,7,1388,0.6055710194161399,TPESampler,COMPLETE
2132,0.2791096909489845,2025-04-24 22:13:31.304291,2025-04-24 22:13:34.628013,0 days 00:00:03.323722,0.09359514697632522,7,,1,13,1178,0.6029843099649318,TPESampler,COMPLETE
2133,0.2891556497293509,2025-04-24 22:13:32.423181,2025-04-24 22:13:36.333748,0 days 00:00:03.910567,0.07155352447707289,6,,1,9,1470,0.6016594323849668,TPESampler,COMPLETE
2134,0.32664761270926984,2025-04-24 22:13:33.894346,2025-04-24 22:13:38.324764,0 days 00:00:04.430418,0.07141318283694553,5,,1,2,1427,0.9226435554593648,TPESampler,COMPLETE
2135,0.3525372072586693,2025-04-24 22:13:34.837354,2025-04-24 22:13:37.426690,0 days 00:00:02.589336,0.06324612729472098,12,sqrt,4,4,1385,0.9801234400887039,TPESampler,COMPLETE
2136,0.42329306923399856,2025-04-24 22:13:36.552841,2025-04-24 22:13:39.724084,0 days 00:00:03.171243,0.015276487252770402,12,,7,12,919,0.7547824930527133,TPESampler,COMPLETE
2137,0.26735496505779277,2025-04-24 22:13:37.635906,2025-04-24 22:13:41.223049,0 days 00:00:03.587143,0.06275067870427387,9,,1,12,1137,0.6146773784564747,TPESampler,COMPLETE
2138,0.2835556066943246,2025-04-24 22:13:38.562434,2025-04-24 22:13:43.110459,0 days 00:00:04.548025,0.07241517613152572,8,,1,17,1500,0.6954227137298702,TPESampler,COMPLETE
2139,0.3035519437078698,2025-04-24 22:13:39.930810,2025-04-24 22:13:42.866644,0 days 00:00:02.935834,0.0753262591811624,10,,1,4,736,0.6919755564291552,TPESampler,COMPLETE
2140,0.4075566204190142,2025-04-24 22:13:41.427750,2025-04-24 22:13:43.034282,0 days 00:00:01.606532,0.02775578831088566,3,sqrt,3,11,852,0.6010911390819434,TPESampler,COMPLETE
2141,0.2846219745751557,2025-04-24 22:13:43.065103,2025-04-24 22:13:46.042048,0 days 00:00:02.976945,0.055027749092027595,7,,1,12,987,0.6134941826219843,TPESampler,COMPLETE
2142,0.333821327329692,2025-04-24 22:13:43.253137,2025-04-24 22:13:47.115681,0 days 00:00:03.862544,0.05993804745510662,7,,3,14,1296,0.6060669461597147,TPESampler,COMPLETE
2143,0.3221948292143846,2025-04-24 22:13:43.462507,2025-04-24 22:13:47.150628,0 days 00:00:03.688121,0.05997334557951767,7,,2,12,1311,0.6051905850477133,TPESampler,COMPLETE
2144,0.34330561270209076,2025-04-24 22:13:46.264007,2025-04-24 22:13:48.588064,0 days 00:00:02.324057,0.0767140684766111,10,log2,2,11,1404,0.6364171836059185,TPESampler,COMPLETE
2145,0.3513287428321775,2025-04-24 22:13:47.320512,2025-04-24 22:13:51.017932,0 days 00:00:03.697420,0.09424111758010117,7,,2,9,1187,0.6034204460155893,TPESampler,COMPLETE
2146,0.2752022594671653,2025-04-24 22:13:47.371499,2025-04-24 22:13:51.274526,0 days 00:00:03.903027,0.06447760064033137,9,,1,8,1123,0.691550556531752,TPESampler,COMPLETE
2147,0.33891754885602415,2025-04-24 22:13:48.807716,2025-04-24 22:13:51.895242,0 days 00:00:03.087526,0.052284312580105914,9,,3,11,1048,0.6596718686296809,TPESampler,COMPLETE
2148,0.28352907959466817,2025-04-24 22:13:51.228804,2025-04-24 22:13:53.369779,0 days 00:00:02.140975,0.07837776900286392,7,,1,14,586,0.7200831425821713,TPESampler,COMPLETE
2149,0.2798501175403212,2025-04-24 22:13:51.676823,2025-04-24 22:13:55.447570,0 days 00:00:03.770747,0.039450869263875005,8,,1,13,1449,0.6102221421308024,TPESampler,COMPLETE
2150,0.3598561756419597,2025-04-24 22:13:52.155982,2025-04-24 22:13:55.466982,0 days 00:00:03.311000,0.07353132361009813,9,,3,11,1298,0.6000712322296544,TPESampler,COMPLETE
2151,0.28027810226699523,2025-04-24 22:13:53.591866,2025-04-24 22:13:57.086654,0 days 00:00:03.494788,0.060009646208086784,9,,1,8,1190,0.6257446770215682,TPESampler,COMPLETE
2152,0.3455076422191337,2025-04-24 22:13:55.632776,2025-04-24 22:13:57.851685,0 days 00:00:02.218909,0.04583997288158025,10,log2,1,13,1071,0.6055659110991548,TPESampler,COMPLETE
2153,0.2902458151303328,2025-04-24 22:13:55.673972,2025-04-24 22:13:58.952726,0 days 00:00:03.278754,0.09945849181934648,9,,1,9,764,0.7386257848254223,TPESampler,COMPLETE
2154,0.28393455400012635,2025-04-24 22:13:57.296019,2025-04-24 22:14:01.514781,0 days 00:00:04.218762,0.07197360949514973,9,,1,12,1302,0.7240933726690263,TPESampler,COMPLETE
2155,0.40932879964710356,2025-04-24 22:13:58.050791,2025-04-24 22:13:59.715326,0 days 00:00:01.664535,0.021426033396979145,5,,5,9,362,0.9756694921352321,TPESampler,COMPLETE
2156,0.287182778681227,2025-04-24 22:13:59.160045,2025-04-24 22:14:02.219057,0 days 00:00:03.059012,0.0909652238538481,10,,1,19,930,0.6073378807098695,TPESampler,COMPLETE
2157,0.35456075782606994,2025-04-24 22:13:59.946113,2025-04-24 22:14:03.835867,0 days 00:00:03.889754,0.06938632218561196,8,,3,14,1476,0.6013660536537405,TPESampler,COMPLETE
2158,0.27289198395665426,2025-04-24 22:14:01.725647,2025-04-24 22:14:05.002483,0 days 00:00:03.276836,0.09181366739022569,8,,1,8,1084,0.606115498916049,TPESampler,COMPLETE
2159,0.3484058084142483,2025-04-24 22:14:02.426896,2025-04-24 22:14:06.466859,0 days 00:00:04.039963,0.07440020957311386,7,,3,10,1437,0.6096321802457144,TPESampler,COMPLETE
2160,0.33879118727605284,2025-04-24 22:14:04.040169,2025-04-24 22:14:06.385447,0 days 00:00:02.345278,0.0548003678312099,10,sqrt,3,13,1263,0.6272613757637473,TPESampler,COMPLETE
2161,0.2711562126312826,2025-04-24 22:14:05.229723,2025-04-24 22:14:09.390555,0 days 00:00:04.160832,0.06721042894285181,10,,1,17,1139,0.6005898946307878,TPESampler,COMPLETE
2162,0.27955037608775885,2025-04-24 22:14:06.562547,2025-04-24 22:14:10.272694,0 days 00:00:03.710147,0.08562979842485718,8,,1,11,1037,0.6953191808425876,TPESampler,COMPLETE
2163,0.5231017872062929,2025-04-24 22:14:06.739945,2025-04-24 22:14:08.432057,0 days 00:00:01.692112,0.0648324907097843,7,log2,6,16,645,0.7881118416469444,TPESampler,COMPLETE
2164,0.26194893151664195,2025-04-24 22:14:08.635732,2025-04-24 22:14:12.764637,0 days 00:00:04.128905,0.06077994220286442,7,,1,9,1432,0.6001810311107655,TPESampler,COMPLETE
2165,0.2799696396462476,2025-04-24 22:14:09.641314,2025-04-24 22:14:13.035847,0 days 00:00:03.394533,0.0959768495347582,6,,1,11,1101,0.6240760988202756,TPESampler,COMPLETE
2166,0.3489800611846627,2025-04-24 22:14:10.511515,2025-04-24 22:14:12.066210,0 days 00:00:01.554695,0.060077505567392706,9,sqrt,2,15,527,0.9300276563408472,TPESampler,COMPLETE
2167,0.669779119554044,2025-04-24 22:14:12.277227,2025-04-24 22:14:14.050192,0 days 00:00:01.772965,0.08721935356368778,6,sqrt,10,3,568,0.6662876540013122,TPESampler,COMPLETE
2168,0.2777591074335558,2025-04-24 22:14:13.129750,2025-04-24 22:14:17.230060,0 days 00:00:04.100310,0.04465990716068633,7,,1,13,1312,0.6014533926083634,TPESampler,COMPLETE
2169,0.40944276192712614,2025-04-24 22:14:13.438199,2025-04-24 22:14:17.785072,0 days 00:00:04.346873,0.014899208608087479,12,,6,20,1255,0.8141879376906561,TPESampler,COMPLETE
2170,0.3558933538614415,2025-04-24 22:14:14.375313,2025-04-24 22:14:18.098758,0 days 00:00:03.723445,0.055733054809857484,7,,2,6,1408,0.6392907198770557,TPESampler,COMPLETE
2171,0.3696026429251506,2025-04-24 22:14:17.451098,2025-04-24 22:14:22.265228,0 days 00:00:04.814130,0.07497790799899381,9,,2,10,1439,0.6179009329173293,TPESampler,COMPLETE
2172,0.6557208585405122,2025-04-24 22:14:18.045467,2025-04-24 22:14:20.905130,0 days 00:00:02.859663,0.044303685364331616,11,sqrt,9,12,1475,0.6971368418400355,TPESampler,COMPLETE
2173,0.7904175338476557,2025-04-24 22:14:18.335922,2025-04-24 22:14:20.131060,0 days 00:00:01.795138,0.012691175824163882,10,log2,4,5,548,0.6750154957983845,TPESampler,COMPLETE
2174,0.29408192769295244,2025-04-24 22:14:20.370254,2025-04-24 22:14:23.765058,0 days 00:00:03.394804,0.061638528514679235,12,,1,12,967,0.6005886869145941,TPESampler,COMPLETE
2175,0.33333284656777123,2025-04-24 22:14:21.147922,2025-04-24 22:14:24.548954,0 days 00:00:03.401032,0.057683424627312255,7,,3,11,1226,0.6118142345729953,TPESampler,COMPLETE
2176,0.329581918114567,2025-04-24 22:14:22.472366,2025-04-24 22:14:26.321140,0 days 00:00:03.848774,0.06751438326516232,7,,2,11,1451,0.6633891652151811,TPESampler,COMPLETE
2177,0.2636211910674259,2025-04-24 22:14:23.971869,2025-04-24 22:14:27.885980,0 days 00:00:03.914111,0.05631221052870801,8,,1,8,1415,0.6177375461244302,TPESampler,COMPLETE
2178,0.31757424536393764,2025-04-24 22:14:24.784496,2025-04-24 22:14:27.617824,0 days 00:00:02.833328,0.0365636099320341,6,,3,9,1045,0.6144591793179189,TPESampler,COMPLETE
2179,0.2785025932611465,2025-04-24 22:14:26.541605,2025-04-24 22:14:30.136772,0 days 00:00:03.595167,0.0417960561272383,6,,1,7,1362,0.6445134312980838,TPESampler,COMPLETE
2180,0.3241223601362076,2025-04-24 22:14:27.835734,2025-04-24 22:14:31.181602,0 days 00:00:03.345868,0.04825670638450334,5,,3,11,1357,0.6169380717547863,TPESampler,COMPLETE
2181,0.27754630549123116,2025-04-24 22:14:28.206679,2025-04-24 22:14:32.072861,0 days 00:00:03.866182,0.045259251869173935,7,,1,11,1391,0.6897265745027107,TPESampler,COMPLETE
2182,0.2775772576041071,2025-04-24 22:14:30.350931,2025-04-24 22:14:35.341566,0 days 00:00:04.990635,0.04194203609442625,10,,1,7,1367,0.6542799328077943,TPESampler,COMPLETE
2183,0.5415884638202614,2025-04-24 22:14:31.382512,2025-04-24 22:14:33.392932,0 days 00:00:02.010420,0.033003132901247414,4,log2,5,11,1247,0.6438788187258258,TPESampler,COMPLETE
2184,0.3385533359620909,2025-04-24 22:14:32.320668,2025-04-24 22:14:35.263151,0 days 00:00:02.942483,0.03930014103008368,8,log2,1,11,1474,0.6353021005305687,TPESampler,COMPLETE
2185,0.29261193260433604,2025-04-24 22:14:33.636126,2025-04-24 22:14:37.860061,0 days 00:00:04.223935,0.05129994335959707,5,,1,5,1368,0.6506115009834385,TPESampler,COMPLETE
2186,0.34430368323286326,2025-04-24 22:14:35.424596,2025-04-24 22:14:39.926163,0 days 00:00:04.501567,0.04811994450268801,8,,2,7,1443,0.6256382273736437,TPESampler,COMPLETE
2187,0.3675968503316169,2025-04-24 22:14:35.563187,2025-04-24 22:14:38.508147,0 days 00:00:02.944960,0.05993260739128242,7,log2,1,2,1324,0.6942050579552306,TPESampler,COMPLETE
2188,0.3478389882754838,2025-04-24 22:14:38.141852,2025-04-24 22:14:42.213349,0 days 00:00:04.071497,0.05319913719239344,8,,3,7,1499,0.6909830525597214,TPESampler,COMPLETE
2189,0.28305623229339777,2025-04-24 22:14:38.763907,2025-04-24 22:14:41.776438,0 days 00:00:03.012531,0.03456357819566072,7,,1,10,1118,0.610397777722731,TPESampler,COMPLETE
2190,0.2719909924937417,2025-04-24 22:14:40.126099,2025-04-24 22:14:43.693683,0 days 00:00:03.567584,0.05275144766598329,7,,1,10,1259,0.6212270123384341,TPESampler,COMPLETE
2191,0.284739600821867,2025-04-24 22:14:41.988292,2025-04-24 22:14:46.412617,0 days 00:00:04.424325,0.04523355683773499,9,,1,9,1366,0.6143707765854723,TPESampler,COMPLETE
2192,0.3367557575699872,2025-04-24 22:14:42.500716,2025-04-24 22:14:44.734306,0 days 00:00:02.233590,0.04875690592909572,5,sqrt,1,9,1056,0.6068858552989336,TPESampler,COMPLETE
2193,0.45240176097738455,2025-04-24 22:14:43.915977,2025-04-24 22:14:46.233745,0 days 00:00:02.317768,0.04223518940309522,7,sqrt,8,5,1113,0.9625546206401049,TPESampler,COMPLETE
2194,0.2802768165636128,2025-04-24 22:14:44.975313,2025-04-24 22:14:50.145416,0 days 00:00:05.170103,0.05679037566029208,8,,1,12,1484,0.6939794691565573,TPESampler,COMPLETE
2195,0.7268640773040638,2025-04-24 22:14:46.414470,2025-04-24 22:14:48.548178,0 days 00:00:02.133708,0.017114482368752272,12,log2,9,12,1241,0.864029279848035,TPESampler,COMPLETE
2196,0.6307652839545095,2025-04-24 22:14:46.656727,2025-04-24 22:14:49.520831,0 days 00:00:02.864104,0.013081045031589338,7,,10,5,829,0.7631468610694874,TPESampler,COMPLETE
2197,0.3165268675540796,2025-04-24 22:14:48.762871,2025-04-24 22:14:52.566339,0 days 00:00:03.803468,0.06462774108649672,6,,2,12,1460,0.6923484425545063,TPESampler,COMPLETE
2198,0.3203180605349708,2025-04-24 22:14:49.734352,2025-04-24 22:14:52.913390,0 days 00:00:03.179038,0.048924277762196544,7,,3,6,1219,0.6005250473414769,TPESampler,COMPLETE
2199,0.36305423609214904,2025-04-24 22:14:50.388930,2025-04-24 22:14:54.228907,0 days 00:00:03.839977,0.06221025663549388,9,,3,8,1446,0.6080404959843564,TPESampler,COMPLETE
2200,0.32808459937871326,2025-04-24 22:14:52.785751,2025-04-24 22:14:56.384753,0 days 00:00:03.599002,0.03966981893021052,6,,2,10,1370,0.612599492388049,TPESampler,COMPLETE
2201,0.2721134593542781,2025-04-24 22:14:53.283693,2025-04-24 22:14:56.943205,0 days 00:00:03.659512,0.06108183821856897,7,,1,10,1367,0.6065364211511473,TPESampler,COMPLETE
2202,0.3400086230040295,2025-04-24 22:14:54.439142,2025-04-24 22:14:58.411032,0 days 00:00:03.971890,0.036077280844851546,9,,2,7,1445,0.6203423130676782,TPESampler,COMPLETE
2203,0.3297367252293749,2025-04-24 22:14:56.597006,2025-04-24 22:15:00.691527,0 days 00:00:04.094521,0.052053017003516736,6,,3,9,1336,0.673118853442346,TPESampler,COMPLETE
2204,0.33247460863778094,2025-04-24 22:14:57.224394,2025-04-24 22:14:59.693429,0 days 00:00:02.469035,0.06927634690412958,8,log2,1,14,1334,0.6088918956462483,TPESampler,COMPLETE
2205,0.2990137361132818,2025-04-24 22:14:58.641063,2025-04-24 22:15:01.535433,0 days 00:00:02.894370,0.0627873676326527,6,,1,14,871,0.6076909003747524,TPESampler,COMPLETE
2206,0.3352621283084915,2025-04-24 22:14:59.917082,2025-04-24 22:15:03.504290,0 days 00:00:03.587208,0.04186572727121978,8,,3,7,1233,0.6407490041745465,TPESampler,COMPLETE
2207,0.28362324005142237,2025-04-24 22:15:00.931647,2025-04-24 22:15:04.375117,0 days 00:00:03.443470,0.05785618405545961,9,,1,7,1150,0.6136791035862434,TPESampler,COMPLETE
2208,0.2763299019978192,2025-04-24 22:15:01.764687,2025-04-24 22:15:05.660508,0 days 00:00:03.895821,0.05028742590481945,8,,1,8,1438,0.67466345565244,TPESampler,COMPLETE
2209,0.2717474064982589,2025-04-24 22:15:03.724307,2025-04-24 22:15:07.616615,0 days 00:00:03.892308,0.06417923505391106,6,,1,10,1450,0.6694093291655694,TPESampler,COMPLETE
2210,0.27612441947596333,2025-04-24 22:15:04.612733,2025-04-24 22:15:07.653253,0 days 00:00:03.040520,0.04728227953132339,7,,1,6,1119,0.6278221193547969,TPESampler,COMPLETE
2211,0.3718631427944467,2025-04-24 22:15:05.867838,2025-04-24 22:15:09.902733,0 days 00:00:04.034895,0.058492170598454275,9,,2,2,1449,0.6593296316555896,TPESampler,COMPLETE
2212,0.2814423267879065,2025-04-24 22:15:07.783276,2025-04-24 22:15:11.936508,0 days 00:00:04.153232,0.052951028249431355,6,,1,13,1466,0.6103031702813494,TPESampler,COMPLETE
2213,0.28770425538800765,2025-04-24 22:15:07.828934,2025-04-24 22:15:12.114802,0 days 00:00:04.285868,0.054198848569553836,8,,1,3,1420,0.6313103719463596,TPESampler,COMPLETE
2214,0.33276770618161444,2025-04-24 22:15:10.118183,2025-04-24 22:15:11.679146,0 days 00:00:01.560963,0.04173214426678325,12,sqrt,1,15,553,0.6015727663835209,TPESampler,COMPLETE
2215,0.2838247587630265,2025-04-24 22:15:11.895740,2025-04-24 22:15:16.201121,0 days 00:00:04.305381,0.07457284455554879,11,,1,10,1384,0.6299193159927329,TPESampler,COMPLETE
2216,0.28570253559866493,2025-04-24 22:15:12.259433,2025-04-24 22:15:15.157054,0 days 00:00:02.897621,0.050728666321763226,8,,1,16,973,0.6436129832121477,TPESampler,COMPLETE
2217,0.301096468731404,2025-04-24 22:15:12.421302,2025-04-24 22:15:15.423004,0 days 00:00:03.001702,0.043644836093579484,8,,1,15,1039,0.6179781991216439,TPESampler,COMPLETE
2218,0.35230952041526087,2025-04-24 22:15:15.371716,2025-04-24 22:15:18.325568,0 days 00:00:02.953852,0.034133455277575414,6,sqrt,2,9,1416,0.6531391456511546,TPESampler,COMPLETE
2219,0.319307881107221,2025-04-24 22:15:15.663228,2025-04-24 22:15:19.181490,0 days 00:00:03.518262,0.022295658344409858,9,sqrt,1,13,1499,0.9375191310466073,TPESampler,COMPLETE
2220,0.28716153104586023,2025-04-24 22:15:16.457066,2025-04-24 22:15:21.015788,0 days 00:00:04.558722,0.058374608517703326,8,,1,7,1413,0.6895796669743642,TPESampler,COMPLETE
2221,0.3438702705955324,2025-04-24 22:15:18.546895,2025-04-24 22:15:22.333949,0 days 00:00:03.787054,0.05702036017929389,9,,3,13,1337,0.6002124532879634,TPESampler,COMPLETE
2222,0.3372432575012036,2025-04-24 22:15:19.407235,2025-04-24 22:15:23.068673,0 days 00:00:03.661438,0.05537671763963043,7,,2,9,1336,0.61288241773338,TPESampler,COMPLETE
2223,0.2771067543572399,2025-04-24 22:15:21.236542,2025-04-24 22:15:25.869474,0 days 00:00:04.632932,0.05966085550102454,9,,1,9,1490,0.6645672191056755,TPESampler,COMPLETE
2224,0.27933978185975483,2025-04-24 22:15:22.541089,2025-04-24 22:15:26.852366,0 days 00:00:04.311277,0.025212037911862384,8,,1,15,1382,0.6984560804735037,TPESampler,COMPLETE
2225,0.37290298367695773,2025-04-24 22:15:23.309747,2025-04-24 22:15:24.759456,0 days 00:00:01.449709,0.07827644935736736,11,log2,2,2,556,0.8864546993771405,TPESampler,COMPLETE
2226,0.4600039716031632,2025-04-24 22:15:24.967495,2025-04-24 22:15:26.559391,0 days 00:00:01.591896,0.01108821785649485,9,,7,14,235,0.8400800013622991,TPESampler,COMPLETE
2227,0.2805148936674022,2025-04-24 22:15:26.076973,2025-04-24 22:15:30.533898,0 days 00:00:04.456925,0.042118746239307316,8,,1,8,1339,0.6205361783232793,TPESampler,COMPLETE
2228,0.5210462477529911,2025-04-24 22:15:26.807029,2025-04-24 22:15:28.682669,0 days 00:00:01.875640,0.04770111574293724,10,log2,7,20,987,0.9108760464122803,TPESampler,COMPLETE
2229,0.399157262536322,2025-04-24 22:15:27.186579,2025-04-24 22:15:29.048873,0 days 00:00:01.862294,0.032076688042275064,6,sqrt,4,9,548,0.9197723480323513,TPESampler,COMPLETE
2230,0.26698641004108414,2025-04-24 22:15:28.902334,2025-04-24 22:15:32.621153,0 days 00:00:03.718819,0.07421734269889596,9,,1,9,1272,0.6497512067148346,TPESampler,COMPLETE
2231,0.3218232116240579,2025-04-24 22:15:29.330754,2025-04-24 22:15:33.538017,0 days 00:00:04.207263,0.015412705830241508,8,,2,10,1493,0.645345025560514,TPESampler,COMPLETE
2232,0.28397815442346214,2025-04-24 22:15:30.749300,2025-04-24 22:15:34.618359,0 days 00:00:03.869059,0.061634869311914434,8,,1,14,1271,0.6141127228949678,TPESampler,COMPLETE
2233,0.3319415850263043,2025-04-24 22:15:32.838986,2025-04-24 22:15:35.716942,0 days 00:00:02.877956,0.01186261961306689,11,sqrt,1,3,1335,0.7150065450070342,TPESampler,COMPLETE
2234,0.3445652075871655,2025-04-24 22:15:33.754389,2025-04-24 22:15:37.599991,0 days 00:00:03.845602,0.05431397774240367,6,,3,7,1431,0.6020927050070692,TPESampler,COMPLETE
2235,0.33804832022810044,2025-04-24 22:15:34.840167,2025-04-24 22:15:38.494473,0 days 00:00:03.654306,0.06175727418031317,8,,3,13,1189,0.6838581165994654,TPESampler,COMPLETE
2236,0.4306877921362929,2025-04-24 22:15:35.951663,2025-04-24 22:15:39.901070,0 days 00:00:03.949407,0.0613804621611257,8,,7,3,1337,0.7208620574097385,TPESampler,COMPLETE
2237,0.5291209618331776,2025-04-24 22:15:37.807637,2025-04-24 22:15:39.150182,0 days 00:00:01.342545,0.012045287035024672,9,sqrt,4,17,420,0.7403559330196231,TPESampler,COMPLETE
2238,0.33645305047913376,2025-04-24 22:15:38.734995,2025-04-24 22:15:42.666693,0 days 00:00:03.931698,0.06344923913637887,10,,2,12,1469,0.6091827435905073,TPESampler,COMPLETE
2239,0.2759543727903188,2025-04-24 22:15:39.391495,2025-04-24 22:15:42.594921,0 days 00:00:03.203426,0.06903797078301604,7,,1,7,1212,0.6442315922096737,TPESampler,COMPLETE
2240,0.2794833100309157,2025-04-24 22:15:40.137991,2025-04-24 22:15:43.956425,0 days 00:00:03.818434,0.04502930561130408,6,,1,8,1494,0.6667589049351321,TPESampler,COMPLETE
2241,0.28613904133183965,2025-04-24 22:15:42.765496,2025-04-24 22:15:46.238441,0 days 00:00:03.472945,0.06718493013507094,6,,1,16,1288,0.6059476584924922,TPESampler,COMPLETE
2242,0.3365292506032415,2025-04-24 22:15:42.907371,2025-04-24 22:15:46.522996,0 days 00:00:03.615625,0.05232066546240044,4,,3,15,1354,0.8423927414039446,TPESampler,COMPLETE
2243,0.2775804324621092,2025-04-24 22:15:44.174326,2025-04-24 22:15:47.719759,0 days 00:00:03.545433,0.05771697342951945,8,,1,11,1238,0.6685827319596661,TPESampler,COMPLETE
2244,0.3312998322630756,2025-04-24 22:15:46.455367,2025-04-24 22:15:48.628392,0 days 00:00:02.173025,0.06864685782449903,10,,3,10,572,0.6277391083960977,TPESampler,COMPLETE
2245,0.29548453853084855,2025-04-24 22:15:46.829272,2025-04-24 22:15:50.879463,0 days 00:00:04.050191,0.07220681172183972,5,,1,12,1273,0.6627120457081104,TPESampler,COMPLETE
2246,0.501095603296715,2025-04-24 22:15:47.948012,2025-04-24 22:15:49.930847,0 days 00:00:01.982835,0.04249435304064731,3,sqrt,7,9,986,0.708439478773052,TPESampler,COMPLETE
2247,0.34133990001328723,2025-04-24 22:15:48.867504,2025-04-24 22:15:51.067152,0 days 00:00:02.199648,0.053225920300983304,10,log2,1,10,893,0.9367582590964316,TPESampler,COMPLETE
