number,value,datetime_start,datetime_complete,duration,params_learning_rate,params_max_depth,params_max_features,params_min_samples_leaf,params_min_samples_split,params_n_estimators,params_subsample,system_attrs_auto:sampler,state
1623,0.33017819352484584,2025-04-24 22:03:57.966353,2025-04-24 22:04:01.013368,0 days 00:00:03.047015,0.09827500739312167,7,,2,11,885,0.703905902264925,TPESampler,COMPLETE
1624,0.3192499697023457,2025-04-24 22:04:00.160323,2025-04-24 22:04:02.471908,0 days 00:00:02.311585,0.08818171036610636,9,,3,15,711,0.6534301639158175,TPESampler,COMPLETE
1625,0.3187505158376736,2025-04-24 22:04:00.969616,2025-04-24 22:04:03.933717,0 days 00:00:02.964101,0.09479353693002045,7,,2,13,1123,0.6194518053764412,TPESampler,COMPLETE
1626,0.27595008724006603,2025-04-24 22:04:01.217489,2025-04-24 22:04:04.478503,0 days 00:00:03.261014,0.08379217322286964,9,,1,12,1182,0.6098375069288883,TPESampler,COMPLETE
1627,0.2958194363477379,2025-04-24 22:04:02.667788,2025-04-24 22:04:05.078425,0 days 00:00:02.410637,0.059606368489557825,5,,1,11,810,0.7446864998761665,TPESampler,COMPLETE
1628,0.3011726179934643,2025-04-24 22:04:04.158433,2025-04-24 22:04:06.931059,0 days 00:00:02.772626,0.039788970484011026,6,,1,3,936,0.7215237673423476,TPESampler,COMPLETE
1629,0.2870261092489765,2025-04-24 22:04:04.730673,2025-04-24 22:04:07.819458,0 days 00:00:03.088785,0.052277544520932445,9,,1,14,1026,0.6516682468425737,TPESampler,COMPLETE
1630,0.2725334712525602,2025-04-24 22:04:05.318306,2025-04-24 22:04:09.099556,0 days 00:00:03.781250,0.05191349826416395,9,,1,14,1292,0.6850915215767929,TPESampler,COMPLETE
1631,0.27204481381421386,2025-04-24 22:04:07.144042,2025-04-24 22:04:10.545227,0 days 00:00:03.401185,0.054181543976336795,8,,1,7,1162,0.6406508883154928,TPESampler,COMPLETE
1632,0.3527210713709364,2025-04-24 22:04:08.031595,2025-04-24 22:04:11.120814,0 days 00:00:03.089219,0.09736838425485658,9,,2,13,1029,0.6790028568933204,TPESampler,COMPLETE
1633,0.46505674976100925,2025-04-24 22:04:09.292788,2025-04-24 22:04:10.618294,0 days 00:00:01.325506,0.04108626767685975,4,sqrt,5,2,477,0.7199226982405725,TPESampler,COMPLETE
1634,0.2770504212122634,2025-04-24 22:04:10.829453,2025-04-24 22:04:14.277883,0 days 00:00:03.448430,0.03527789706738794,8,,1,12,1277,0.6084798481951759,TPESampler,COMPLETE
1635,0.3366403444179432,2025-04-24 22:04:10.881824,2025-04-24 22:04:14.545270,0 days 00:00:03.663446,0.087463156969275,7,,3,15,1353,0.7577020788565266,TPESampler,COMPLETE
1636,0.39096824388213425,2025-04-24 22:04:11.377018,2025-04-24 22:04:14.768565,0 days 00:00:03.391547,0.014903068276067669,11,,5,4,1302,0.7137087575736893,TPESampler,COMPLETE
1637,0.32480555831810487,2025-04-24 22:04:14.474901,2025-04-24 22:04:18.271380,0 days 00:00:03.796479,0.06467041034513443,7,,2,9,1196,0.6658818078184173,TPESampler,COMPLETE
1638,0.3295066746040102,2025-04-24 22:04:15.036671,2025-04-24 22:04:17.026919,0 days 00:00:01.990248,0.04035090094262647,6,,3,20,485,0.6431906295718431,TPESampler,COMPLETE
1639,0.4376722027869777,2025-04-24 22:04:15.200214,2025-04-24 22:04:16.500067,0 days 00:00:01.299853,0.09514667901959219,11,sqrt,6,12,305,0.781836271605124,TPESampler,COMPLETE
1640,0.27071155844064054,2025-04-24 22:04:16.706248,2025-04-24 22:04:19.403302,0 days 00:00:02.697054,0.08961229704280416,10,,1,11,724,0.709639555372923,TPESampler,COMPLETE
1641,0.44027794769609413,2025-04-24 22:04:17.242030,2025-04-24 22:04:19.726709,0 days 00:00:02.484679,0.012267098886510558,12,,7,3,760,0.6535167576000427,TPESampler,COMPLETE
1642,0.3350587120736135,2025-04-24 22:04:18.468801,2025-04-24 22:04:20.016407,0 days 00:00:01.547606,0.04750051875797022,12,,3,8,280,0.8523721606765058,TPESampler,COMPLETE
1643,0.34901037655777467,2025-04-24 22:04:19.606558,2025-04-24 22:04:22.805113,0 days 00:00:03.198555,0.023781410150661902,9,,2,8,745,0.9969215304891451,TPESampler,COMPLETE
1644,0.27788376235357665,2025-04-24 22:04:20.008075,2025-04-24 22:04:23.388375,0 days 00:00:03.380300,0.09413430762434516,5,,1,6,1191,0.6244583237848905,TPESampler,COMPLETE
1645,0.26714776008237173,2025-04-24 22:04:20.349813,2025-04-24 22:04:24.269675,0 days 00:00:03.919862,0.08984082423917054,8,,1,11,1188,0.6941505974399536,TPESampler,COMPLETE
1646,0.2861051726332394,2025-04-24 22:04:23.004089,2025-04-24 22:04:27.002012,0 days 00:00:03.997923,0.07728046426130229,7,,1,8,1472,0.752837989339242,TPESampler,COMPLETE
1647,0.27422703942473464,2025-04-24 22:04:23.597721,2025-04-24 22:04:26.318733,0 days 00:00:02.721012,0.0879339945755436,8,,1,11,1013,0.6549954632784482,TPESampler,COMPLETE
1648,0.4222550425011181,2025-04-24 22:04:24.473455,2025-04-24 22:04:27.639393,0 days 00:00:03.165938,0.01133118501939099,5,,7,13,1190,0.9241291476837628,TPESampler,COMPLETE
1649,0.3369126862914057,2025-04-24 22:04:26.525803,2025-04-24 22:04:29.740238,0 days 00:00:03.214435,0.04114619501418919,9,,3,7,978,0.7200245110556504,TPESampler,COMPLETE
1650,0.28962940267722603,2025-04-24 22:04:27.280612,2025-04-24 22:04:30.918676,0 days 00:00:03.638064,0.07066765246612816,9,,1,14,1124,0.7650895098746443,TPESampler,COMPLETE
1651,0.27805833036390937,2025-04-24 22:04:27.878115,2025-04-24 22:04:31.844724,0 days 00:00:03.966609,0.09418095946396614,7,,1,12,1327,0.781765903014243,TPESampler,COMPLETE
1652,0.42707928774945375,2025-04-24 22:04:30.073480,2025-04-24 22:04:33.325537,0 days 00:00:03.252057,0.02048832860749239,4,,7,2,1240,0.6985404834951017,TPESampler,COMPLETE
1653,0.34439131296688397,2025-04-24 22:04:31.115555,2025-04-24 22:04:32.890312,0 days 00:00:01.774757,0.06426265789733707,6,,3,4,385,0.9113295655288359,TPESampler,COMPLETE
1654,0.47168181124038006,2025-04-24 22:04:32.052173,2025-04-24 22:04:33.210655,0 days 00:00:01.158482,0.07604694117760438,6,log2,3,16,401,0.6272424270288799,TPESampler,COMPLETE
1655,0.2773392617509262,2025-04-24 22:04:33.119443,2025-04-24 22:04:36.200326,0 days 00:00:03.080883,0.09946452765347545,7,,1,11,918,0.7220173499271142,TPESampler,COMPLETE
1656,0.2736715801115822,2025-04-24 22:04:33.443121,2025-04-24 22:04:37.268286,0 days 00:00:03.825165,0.08208138780922057,9,,1,11,1014,0.7370186416277509,TPESampler,COMPLETE
1657,0.3465627012334217,2025-04-24 22:04:33.605278,2025-04-24 22:04:35.675590,0 days 00:00:02.070312,0.09118240855173594,9,log2,2,10,1106,0.6564861172811541,TPESampler,COMPLETE
1658,0.2881786897403647,2025-04-24 22:04:35.881060,2025-04-24 22:04:39.378848,0 days 00:00:03.497788,0.0923544784561348,8,,1,9,1209,0.7860683044556582,TPESampler,COMPLETE
1659,0.26418092952609024,2025-04-24 22:04:36.426940,2025-04-24 22:04:39.647177,0 days 00:00:03.220237,0.06355532919564069,8,,1,9,1146,0.6314444186478465,TPESampler,COMPLETE
1660,0.30261131993883456,2025-04-24 22:04:37.468980,2025-04-24 22:04:39.329143,0 days 00:00:01.860163,0.04507537759514935,6,,1,15,587,0.7168518338544729,TPESampler,COMPLETE
1661,0.34112589003271376,2025-04-24 22:04:39.494283,2025-04-24 22:04:42.629042,0 days 00:00:03.134759,0.06988540690497921,7,,2,11,1195,0.7554076642970052,TPESampler,COMPLETE
1662,0.2620332540194974,2025-04-24 22:04:39.545816,2025-04-24 22:04:42.687439,0 days 00:00:03.141623,0.09960099384604751,7,,1,11,1146,0.6455199711266828,TPESampler,COMPLETE
1663,0.2723606262360828,2025-04-24 22:04:39.902190,2025-04-24 22:04:43.023833,0 days 00:00:03.121643,0.06728318360252497,6,,1,10,1245,0.6505563860138559,TPESampler,COMPLETE
1664,0.335900969007915,2025-04-24 22:04:42.804594,2025-04-24 22:04:45.740875,0 days 00:00:02.936281,0.05434404386449102,7,,3,6,1059,0.6089476150177672,TPESampler,COMPLETE
1665,0.2799093123378457,2025-04-24 22:04:42.851422,2025-04-24 22:04:46.023813,0 days 00:00:03.172391,0.04805185262767264,7,,1,11,1114,0.6474839489348205,TPESampler,COMPLETE
1666,0.27403139065808124,2025-04-24 22:04:43.315333,2025-04-24 22:04:46.371177,0 days 00:00:03.055844,0.0797667443722958,9,,1,16,1058,0.7132152898053084,TPESampler,COMPLETE
1667,0.28438768100003514,2025-04-24 22:04:45.955770,2025-04-24 22:04:48.331521,0 days 00:00:02.375751,0.057475958528092265,8,,1,10,716,0.6971306336644485,TPESampler,COMPLETE
1668,0.2754365275146226,2025-04-24 22:04:46.246795,2025-04-24 22:04:49.535163,0 days 00:00:03.288368,0.06448537551014648,6,,1,8,1213,0.6115569644878698,TPESampler,COMPLETE
1669,0.27303058897663374,2025-04-24 22:04:46.738154,2025-04-24 22:04:49.807497,0 days 00:00:03.069343,0.05552677092058599,8,,1,12,1158,0.6569491281116627,TPESampler,COMPLETE
1670,0.2737577913053209,2025-04-24 22:04:48.538180,2025-04-24 22:04:51.349772,0 days 00:00:02.811592,0.057360603904539315,8,,1,7,823,0.6567013767877975,TPESampler,COMPLETE
1671,0.360739395491253,2025-04-24 22:04:49.738249,2025-04-24 22:04:51.957543,0 days 00:00:02.219294,0.046683084319827775,8,log2,1,16,1055,0.7374159117699757,TPESampler,COMPLETE
1672,0.33527205874213883,2025-04-24 22:04:50.059190,2025-04-24 22:04:52.775286,0 days 00:00:02.716096,0.0983919447547384,7,log2,1,16,1181,0.7687231283076983,TPESampler,COMPLETE
1673,0.3212476531494494,2025-04-24 22:04:51.614196,2025-04-24 22:04:54.728921,0 days 00:00:03.114725,0.07589008986601085,7,,2,16,1061,0.7057697613559945,TPESampler,COMPLETE
1674,0.32533019616533654,2025-04-24 22:04:52.217179,2025-04-24 22:04:54.758213,0 days 00:00:02.541034,0.06880966855288807,7,,2,14,882,0.6163923000387366,TPESampler,COMPLETE
1675,0.33125124724401445,2025-04-24 22:04:52.975083,2025-04-24 22:04:55.895159,0 days 00:00:02.920076,0.06994423993459464,6,,3,11,1096,0.6005486846759835,TPESampler,COMPLETE
1676,0.276141027839022,2025-04-24 22:04:54.902457,2025-04-24 22:04:58.315740,0 days 00:00:03.413283,0.09095203750283602,8,,1,8,1008,0.6274081543140763,TPESampler,COMPLETE
1677,0.44032266665347686,2025-04-24 22:04:54.953434,2025-04-24 22:04:56.461092,0 days 00:00:01.507658,0.04663057115055967,4,sqrt,4,8,455,0.6052912820549158,TPESampler,COMPLETE
1678,0.27317558223117516,2025-04-24 22:04:56.113787,2025-04-24 22:04:59.908298,0 days 00:00:03.794511,0.08282760861300727,7,,1,16,1215,0.7581527124169258,TPESampler,COMPLETE
1679,0.5770790351224495,2025-04-24 22:04:56.693927,2025-04-24 22:04:58.485556,0 days 00:00:01.791629,0.011081460424871152,11,log2,3,7,1005,0.9736656161571079,TPESampler,COMPLETE
1680,0.32077973647606206,2025-04-24 22:04:58.494950,2025-04-24 22:05:01.603394,0 days 00:00:03.108444,0.06435930126501835,7,,2,11,1217,0.6074392239063487,TPESampler,COMPLETE
1681,0.27743122547138166,2025-04-24 22:04:58.677505,2025-04-24 22:05:01.722172,0 days 00:00:03.044667,0.09553326549233492,7,,1,9,1136,0.6454499431513393,TPESampler,COMPLETE
1682,0.2887435476024139,2025-04-24 22:05:00.129779,2025-04-24 22:05:03.363291,0 days 00:00:03.233512,0.03399439904508874,8,,1,7,1149,0.6964552329626533,TPESampler,COMPLETE
1683,0.3316699607790291,2025-04-24 22:05:01.794032,2025-04-24 22:05:04.915277,0 days 00:00:03.121245,0.09568490183579557,6,,2,12,1172,0.6653341891776648,TPESampler,COMPLETE
1684,0.3326690192583997,2025-04-24 22:05:01.939672,2025-04-24 22:05:04.866121,0 days 00:00:02.926449,0.09241004077207986,6,,2,10,1012,0.687902026499604,TPESampler,COMPLETE
1685,0.3382319371715194,2025-04-24 22:05:03.567629,2025-04-24 22:05:06.902411,0 days 00:00:03.334782,0.05174479295663452,9,,3,10,1241,0.6164376308896613,TPESampler,COMPLETE
1686,0.267562595046425,2025-04-24 22:05:05.040044,2025-04-24 22:05:08.566352,0 days 00:00:03.526308,0.0954289514370621,6,,1,11,1274,0.6260490083146276,TPESampler,COMPLETE
1687,0.27189213616279023,2025-04-24 22:05:05.087761,2025-04-24 22:05:08.113937,0 days 00:00:03.026176,0.05886227089367868,9,,1,6,942,0.6146907505703249,TPESampler,COMPLETE
1688,0.3166093689223038,2025-04-24 22:05:07.101967,2025-04-24 22:05:09.139635,0 days 00:00:02.037668,0.07727224886766623,7,sqrt,1,12,918,0.7770781739493262,TPESampler,COMPLETE
1689,0.28603736541132213,2025-04-24 22:05:08.335956,2025-04-24 22:05:12.391728,0 days 00:00:04.055772,0.08705097822770157,7,,1,12,1283,0.6260868128894517,TPESampler,COMPLETE
1690,0.35838269092968883,2025-04-24 22:05:08.817827,2025-04-24 22:05:10.863769,0 days 00:00:02.045942,0.09866543062600876,8,log2,2,12,1129,0.6232708848057549,TPESampler,COMPLETE
1691,0.3699283486007987,2025-04-24 22:05:09.400579,2025-04-24 22:05:13.783298,0 days 00:00:04.382719,0.022978892876536757,7,,4,10,1336,0.9824897506381891,TPESampler,COMPLETE
1692,0.28299839347199585,2025-04-24 22:05:11.067962,2025-04-24 22:05:14.637519,0 days 00:00:03.569557,0.0627451877515398,9,,1,11,1252,0.617979184699699,TPESampler,COMPLETE
1693,0.27714566803368823,2025-04-24 22:05:12.601414,2025-04-24 22:05:16.132632,0 days 00:00:03.531218,0.07142936784156122,7,,1,11,1216,0.7168194305463531,TPESampler,COMPLETE
1694,0.3201137468071707,2025-04-24 22:05:13.989402,2025-04-24 22:05:17.631094,0 days 00:00:03.641692,0.08660745422720477,4,,3,16,1270,0.7139954272975849,TPESampler,COMPLETE
1695,0.37894995576037355,2025-04-24 22:05:14.833726,2025-04-24 22:05:16.731016,0 days 00:00:01.897290,0.013056945185722695,12,sqrt,3,14,758,0.8760420962821333,TPESampler,COMPLETE
1696,0.30250939356886686,2025-04-24 22:05:16.340441,2025-04-24 22:05:18.641712,0 days 00:00:02.301271,0.09263654760729495,5,,1,17,745,0.6012330238314627,TPESampler,COMPLETE
1697,0.26758422847236596,2025-04-24 22:05:16.947510,2025-04-24 22:05:20.543006,0 days 00:00:03.595496,0.09923059162133727,10,,1,9,1083,0.6010996919954112,TPESampler,COMPLETE
1698,0.29859163466182503,2025-04-24 22:05:17.878670,2025-04-24 22:05:20.335982,0 days 00:00:02.457312,0.08644174509508636,8,sqrt,1,17,1255,0.8104370928772276,TPESampler,COMPLETE
1699,0.3253573916697286,2025-04-24 22:05:18.859046,2025-04-24 22:05:21.900596,0 days 00:00:03.041550,0.04326160604121251,7,,2,12,924,0.7877933985665465,TPESampler,COMPLETE
1700,0.3356593696306671,2025-04-24 22:05:20.535867,2025-04-24 22:05:23.522558,0 days 00:00:02.986691,0.08564874985323205,7,log2,1,12,1048,0.7124302591573881,TPESampler,COMPLETE
1701,0.6542531999117881,2025-04-24 22:05:20.945993,2025-04-24 22:05:23.526755,0 days 00:00:02.580762,0.02009934378010404,8,log2,6,11,1061,0.6781695406172462,TPESampler,COMPLETE
1702,0.264570511126698,2025-04-24 22:05:22.174588,2025-04-24 22:05:26.083092,0 days 00:00:03.908504,0.05879587753480851,8,,1,14,1119,0.6006107053714124,TPESampler,COMPLETE
1703,0.37887967951295265,2025-04-24 22:05:23.710958,2025-04-24 22:05:25.240910,0 days 00:00:01.529952,0.027178661095198155,12,log2,1,14,531,0.809823908128442,TPESampler,COMPLETE
1704,0.35355477780620753,2025-04-24 22:05:23.758133,2025-04-24 22:05:27.186001,0 days 00:00:03.427868,0.09068830307697615,7,,3,9,1166,0.6683112604330682,TPESampler,COMPLETE
1705,0.34620454953832025,2025-04-24 22:05:25.455798,2025-04-24 22:05:28.064975,0 days 00:00:02.609177,0.055709991709521185,3,,2,20,842,0.9882488399410719,TPESampler,COMPLETE
1706,0.2945954179822719,2025-04-24 22:05:26.322938,2025-04-24 22:05:29.840761,0 days 00:00:03.517823,0.08588737987706485,7,,1,19,1256,0.6012454580513362,TPESampler,COMPLETE
1707,0.289187673647875,2025-04-24 22:05:27.393998,2025-04-24 22:05:29.701497,0 days 00:00:02.307499,0.034589732876164396,8,,1,16,737,0.6454691170752714,TPESampler,COMPLETE
1708,0.34872331547914126,2025-04-24 22:05:28.292455,2025-04-24 22:05:31.309773,0 days 00:00:03.017318,0.050347840100657466,8,,4,13,1099,0.6138439200787912,TPESampler,COMPLETE
1709,0.4582336524377639,2025-04-24 22:05:29.888793,2025-04-24 22:05:32.802693,0 days 00:00:02.913900,0.029062092174077056,9,,7,5,993,0.6506076766587967,TPESampler,COMPLETE
1710,0.3270796475209634,2025-04-24 22:05:30.070923,2025-04-24 22:05:33.751416,0 days 00:00:03.680493,0.06348532247799636,10,,2,13,1228,0.6138671360978609,TPESampler,COMPLETE
1711,0.4132712486904114,2025-04-24 22:05:31.533195,2025-04-24 22:05:33.319315,0 days 00:00:01.786120,0.07795052664403573,5,,6,18,444,0.9496036575124247,TPESampler,COMPLETE
1712,0.3241715561306121,2025-04-24 22:05:33.011623,2025-04-24 22:05:36.352250,0 days 00:00:03.340627,0.04614992950625412,9,,3,15,1244,0.6930821557183884,TPESampler,COMPLETE
1713,0.27197873110883797,2025-04-24 22:05:33.581182,2025-04-24 22:05:37.616689,0 days 00:00:04.035507,0.05915012889634132,9,,1,15,1409,0.6122019856985448,TPESampler,COMPLETE
1714,0.3218458692764329,2025-04-24 22:05:34.005112,2025-04-24 22:05:36.949250,0 days 00:00:02.944138,0.04492574861378519,9,,2,14,972,0.6519404691152023,TPESampler,COMPLETE
1715,0.6186074950700448,2025-04-24 22:05:36.555402,2025-04-24 22:05:37.680620,0 days 00:00:01.125218,0.013865916164218513,4,,10,17,131,0.7557939813975991,TPESampler,COMPLETE
1716,0.2875153917788083,2025-04-24 22:05:37.166451,2025-04-24 22:05:41.603099,0 days 00:00:04.436648,0.08795457928863412,9,,1,16,1341,0.7107818950592221,TPESampler,COMPLETE
1717,0.32027019313819155,2025-04-24 22:05:38.023306,2025-04-24 22:05:40.625811,0 days 00:00:02.602505,0.050313460686758404,9,sqrt,1,16,1244,0.6205523570605942,TPESampler,COMPLETE
1718,0.34460069700754753,2025-04-24 22:05:38.075796,2025-04-24 22:05:41.545172,0 days 00:00:03.469376,0.08674481082346028,8,,3,13,1068,0.6427590952876536,TPESampler,COMPLETE
1719,0.3212188459437373,2025-04-24 22:05:40.884079,2025-04-24 22:05:43.838220,0 days 00:00:02.954141,0.07532957647994896,9,,2,14,950,0.63548801211106,TPESampler,COMPLETE
1720,0.333079410529266,2025-04-24 22:05:41.768538,2025-04-24 22:05:45.171632,0 days 00:00:03.403094,0.039207573136465855,8,,3,9,1188,0.7092033704160141,TPESampler,COMPLETE
1721,0.27674325322075516,2025-04-24 22:05:41.848185,2025-04-24 22:05:44.831219,0 days 00:00:02.983034,0.061878264962476004,7,,1,14,1040,0.6539367568215924,TPESampler,COMPLETE
1722,0.28204242637034826,2025-04-24 22:05:44.040518,2025-04-24 22:05:48.011786,0 days 00:00:03.971268,0.08541015681118777,8,,1,13,1267,0.6310922853286323,TPESampler,COMPLETE
1723,0.28884322921662925,2025-04-24 22:05:45.060343,2025-04-24 22:05:48.584175,0 days 00:00:03.523832,0.09977617425800137,5,,1,13,1146,0.749418549429864,TPESampler,COMPLETE
1724,0.6625678945680344,2025-04-24 22:05:45.433260,2025-04-24 22:05:47.677663,0 days 00:00:02.244403,0.012518942676984897,11,sqrt,10,4,1369,0.6528599776101712,TPESampler,COMPLETE
1725,0.2686558170534542,2025-04-24 22:05:47.880104,2025-04-24 22:05:50.783640,0 days 00:00:02.903536,0.08651195769872828,8,,1,15,848,0.6190763446516316,TPESampler,COMPLETE
1726,0.6395508040862617,2025-04-24 22:05:48.274501,2025-04-24 22:05:49.639899,0 days 00:00:01.365398,0.03016139018581637,11,log2,5,5,541,0.8017352880473283,TPESampler,COMPLETE
1727,0.31161463207927004,2025-04-24 22:05:48.826329,2025-04-24 22:05:51.957525,0 days 00:00:03.131196,0.06930200843459014,7,,2,18,992,0.6239406147503779,TPESampler,COMPLETE
1728,0.28847128225262675,2025-04-24 22:05:49.847896,2025-04-24 22:05:52.963624,0 days 00:00:03.115728,0.04163926204871321,8,,1,10,1045,0.6073487866282932,TPESampler,COMPLETE
1729,0.30726868115202677,2025-04-24 22:05:51.183390,2025-04-24 22:05:53.929166,0 days 00:00:02.745776,0.026921192342257143,7,,3,14,939,0.6465864641542769,TPESampler,COMPLETE
1730,0.31745968208712166,2025-04-24 22:05:52.162843,2025-04-24 22:05:54.982221,0 days 00:00:02.819378,0.05960473086506613,8,,2,12,902,0.6503961037609848,TPESampler,COMPLETE
1731,0.2828293766287304,2025-04-24 22:05:53.185427,2025-04-24 22:05:56.108474,0 days 00:00:02.923047,0.03609575211030194,7,,1,15,927,0.6498649669926623,TPESampler,COMPLETE
1732,0.27752050217906626,2025-04-24 22:05:54.154559,2025-04-24 22:05:56.844194,0 days 00:00:02.689635,0.09929771331877907,10,,1,14,805,0.6108095519169776,TPESampler,COMPLETE
1733,0.35292637120359305,2025-04-24 22:05:55.192495,2025-04-24 22:05:57.476361,0 days 00:00:02.283866,0.057170875304948035,6,,4,5,694,0.650720754603629,TPESampler,COMPLETE
1734,0.8681075590252266,2025-04-24 22:05:56.314365,2025-04-24 22:05:57.304963,0 days 00:00:00.990598,0.03444282216644078,12,log2,10,19,209,0.8361447900038463,TPESampler,COMPLETE
1735,0.31470294225986967,2025-04-24 22:05:57.064874,2025-04-24 22:05:59.957991,0 days 00:00:02.893117,0.06177145683072296,6,sqrt,1,6,1496,0.7117649995245381,TPESampler,COMPLETE
1736,0.433586345999169,2025-04-24 22:05:57.531070,2025-04-24 22:05:59.518147,0 days 00:00:01.987077,0.055271366867429596,5,log2,3,20,595,0.8803714210821008,TPESampler,COMPLETE
1737,0.34226373272289895,2025-04-24 22:05:57.741212,2025-04-24 22:06:01.453567,0 days 00:00:03.712355,0.08956751634207215,6,,3,15,1150,0.684397997491211,TPESampler,COMPLETE
1738,0.27287457835250545,2025-04-24 22:05:59.736027,2025-04-24 22:06:03.201245,0 days 00:00:03.465218,0.06250949451763381,8,,1,16,1196,0.6109535244968347,TPESampler,COMPLETE
1739,0.294516567142302,2025-04-24 22:06:00.235861,2025-04-24 22:06:02.587793,0 days 00:00:02.351932,0.09507936599858186,5,,1,6,759,0.741201710157661,TPESampler,COMPLETE
1740,0.2850460192911612,2025-04-24 22:06:01.648833,2025-04-24 22:06:03.761346,0 days 00:00:02.112513,0.08303038086552363,6,,1,7,627,0.6048255046530568,TPESampler,COMPLETE
1741,0.27167579315847673,2025-04-24 22:06:02.793864,2025-04-24 22:06:06.555000,0 days 00:00:03.761136,0.0460786707139803,9,,1,12,1198,0.6830760652268358,TPESampler,COMPLETE
1742,0.3335191620140904,2025-04-24 22:06:03.415450,2025-04-24 22:06:06.453126,0 days 00:00:03.037676,0.06887447589490713,7,,2,11,1045,0.6026888475380215,TPESampler,COMPLETE
1743,0.7009999229607536,2025-04-24 22:06:03.975925,2025-04-24 22:06:04.896064,0 days 00:00:00.920139,0.06366093216099629,7,sqrt,10,10,151,0.9147673624164536,TPESampler,COMPLETE
1744,0.28106664413711846,2025-04-24 22:06:05.099626,2025-04-24 22:06:08.243681,0 days 00:00:03.144055,0.06849808768207336,7,,1,11,1135,0.66544436783696,TPESampler,COMPLETE
1745,0.26835987887463053,2025-04-24 22:06:06.693008,2025-04-24 22:06:09.553272,0 days 00:00:02.860264,0.0996103760558729,7,,1,11,1016,0.6379523275419844,TPESampler,COMPLETE
1746,0.2818645925862266,2025-04-24 22:06:06.737256,2025-04-24 22:06:09.635810,0 days 00:00:02.898554,0.04692797103873157,8,,1,12,954,0.6304045827173156,TPESampler,COMPLETE
1747,0.2814945828338525,2025-04-24 22:06:08.450392,2025-04-24 22:06:11.646497,0 days 00:00:03.196105,0.0391960902086227,7,,1,11,1130,0.747653111527905,TPESampler,COMPLETE
