number,value,datetime_start,datetime_complete,duration,params_learning_rate,params_max_depth,params_max_features,params_min_samples_leaf,params_min_samples_split,params_n_estimators,params_subsample,system_attrs_auto:sampler,state
1998,0.8776025080437903,2025-04-24 22:10:45.183124,2025-04-24 22:10:46.396406,0 days 00:00:01.213282,0.05906679433286131,7,log2,9,9,134,0.6465573683886998,TPESampler,COMPLETE
1999,0.37308853368373773,2025-04-24 22:10:46.147063,2025-04-24 22:10:48.584541,0 days 00:00:02.437478,0.06863023782739464,4,log2,1,10,1266,0.8686415447246233,TPESampler,COMPLETE
2000,0.2654035765367312,2025-04-24 22:10:46.664128,2025-04-24 22:10:50.945546,0 days 00:00:04.281418,0.07096916475044279,8,,1,11,1382,0.6030018619258208,TPESampler,COMPLETE
2001,0.3402409613435263,2025-04-24 22:10:48.794770,2025-04-24 22:10:51.801679,0 days 00:00:03.006909,0.06896059783369929,8,,3,12,936,0.7434628247927159,TPESampler,COMPLETE
2002,0.2912311982076098,2025-04-24 22:10:49.608044,2025-04-24 22:10:53.439169,0 days 00:00:03.831125,0.062256694529996125,7,,1,4,1297,0.6289019221460719,TPESampler,COMPLETE
2003,0.6063033169519371,2025-04-24 22:10:51.150684,2025-04-24 22:10:52.856270,0 days 00:00:01.705586,0.05309310778258502,10,sqrt,8,8,768,0.7278316533861061,TPESampler,COMPLETE
2004,0.33378915728511444,2025-04-24 22:10:52.053474,2025-04-24 22:10:56.325733,0 days 00:00:04.272259,0.050944509611266134,7,,2,7,1431,0.6038096341171318,TPESampler,COMPLETE
2005,0.2917200705597931,2025-04-24 22:10:53.100765,2025-04-24 22:10:54.961551,0 days 00:00:01.860786,0.04889192719295061,6,,1,8,544,0.6086464376269342,TPESampler,COMPLETE
2006,0.26640564539364686,2025-04-24 22:10:53.679193,2025-04-24 22:10:57.770032,0 days 00:00:04.090839,0.07020779931566319,8,,1,12,1401,0.636428455091514,TPESampler,COMPLETE
2007,0.34793784431852476,2025-04-24 22:10:55.166795,2025-04-24 22:10:56.871105,0 days 00:00:01.704310,0.07293351831488801,7,log2,1,11,686,0.8074451666284092,TPESampler,COMPLETE
2008,0.35279034897769396,2025-04-24 22:10:56.544847,2025-04-24 22:11:00.754570,0 days 00:00:04.209723,0.0683885058437394,8,,2,9,1462,0.6688124309132716,TPESampler,COMPLETE
2009,0.31398163882450025,2025-04-24 22:10:57.134510,2025-04-24 22:10:58.905850,0 days 00:00:01.771340,0.07261464642267866,9,sqrt,1,14,708,0.6769893329966702,TPESampler,COMPLETE
2010,0.3326664826518035,2025-04-24 22:10:58.013695,2025-04-24 22:11:01.407593,0 days 00:00:03.393898,0.05395775040864138,6,,3,12,1207,0.6827799227447712,TPESampler,COMPLETE
2011,0.36617589018989727,2025-04-24 22:10:59.114151,2025-04-24 22:11:02.641818,0 days 00:00:03.527667,0.06764679108634515,9,,3,8,1235,0.6528807526763974,TPESampler,COMPLETE
2012,0.2644769238469449,2025-04-24 22:11:00.961510,2025-04-24 22:11:04.736802,0 days 00:00:03.775292,0.06833094721907144,9,,1,13,1386,0.6011189678057779,TPESampler,COMPLETE
2013,0.2717432519464778,2025-04-24 22:11:01.614269,2025-04-24 22:11:05.153184,0 days 00:00:03.538915,0.06170959070402038,9,,1,15,1302,0.6724971934529884,TPESampler,COMPLETE
2014,0.2749408790979561,2025-04-24 22:11:02.896835,2025-04-24 22:11:06.782749,0 days 00:00:03.885914,0.06601811414329274,7,,1,9,1473,0.6484167515687387,TPESampler,COMPLETE
2015,0.3308781169628614,2025-04-24 22:11:04.934458,2025-04-24 22:11:08.988308,0 days 00:00:04.053850,0.05744410723733941,9,,2,13,1298,0.6041967157300302,TPESampler,COMPLETE
2016,0.3951090826983235,2025-04-24 22:11:05.421303,2025-04-24 22:11:06.435286,0 days 00:00:01.013983,0.04776577649687359,11,,6,18,115,0.6980259255453107,TPESampler,COMPLETE
2017,0.6554947403125992,2025-04-24 22:11:06.638161,2025-04-24 22:11:08.045327,0 days 00:00:01.407166,0.040662737633000746,3,sqrt,9,5,560,0.7680302572090457,TPESampler,COMPLETE
2018,0.37554372708955824,2025-04-24 22:11:07.056738,2025-04-24 22:11:11.075879,0 days 00:00:04.019141,0.08709271472777828,10,,4,11,1387,0.6004098538467779,TPESampler,COMPLETE
2019,0.336541169718129,2025-04-24 22:11:08.245208,2025-04-24 22:11:11.619218,0 days 00:00:03.374010,0.09975046283151763,6,,2,13,1284,0.7122940875957373,TPESampler,COMPLETE
2020,0.28056896541662363,2025-04-24 22:11:09.193513,2025-04-24 22:11:12.738239,0 days 00:00:03.544726,0.09700921375926344,7,,1,9,1283,0.714555301184938,TPESampler,COMPLETE
2021,0.281198749495906,2025-04-24 22:11:11.294851,2025-04-24 22:11:15.340586,0 days 00:00:04.045735,0.05552785916769383,12,,1,15,1394,0.6340806981395535,TPESampler,COMPLETE
2022,0.2623522670123623,2025-04-24 22:11:11.859873,2025-04-24 22:11:16.251117,0 days 00:00:04.391244,0.06235140141923485,9,,1,14,1492,0.6122819730444512,TPESampler,COMPLETE
2023,0.26804668461572645,2025-04-24 22:11:12.961841,2025-04-24 22:11:16.365714,0 days 00:00:03.403873,0.09016151061004019,11,,1,13,1192,0.6432985364516366,TPESampler,COMPLETE
2024,0.6258712626583456,2025-04-24 22:11:15.547169,2025-04-24 22:11:17.329946,0 days 00:00:01.782777,0.030004809634544754,4,,10,3,447,0.7175892892084593,TPESampler,COMPLETE
2025,0.27489975933586996,2025-04-24 22:11:16.427958,2025-04-24 22:11:20.835292,0 days 00:00:04.407334,0.03445203397730633,10,,1,14,1375,0.6378547944882498,TPESampler,COMPLETE
2026,0.35647000983659277,2025-04-24 22:11:16.559795,2025-04-24 22:11:21.252771,0 days 00:00:04.692976,0.05305796980124991,10,,3,11,1482,0.6424019631787447,TPESampler,COMPLETE
2027,0.5897081883464317,2025-04-24 22:11:17.546511,2025-04-24 22:11:18.846798,0 days 00:00:01.300287,0.01121447730376825,11,,9,2,279,0.7309492952861746,TPESampler,COMPLETE
2028,0.38550766550602256,2025-04-24 22:11:19.045551,2025-04-24 22:11:21.239970,0 days 00:00:02.194419,0.05820525262354756,8,log2,2,9,1321,0.6102445819080705,TPESampler,COMPLETE
2029,0.3280654465851776,2025-04-24 22:11:21.060419,2025-04-24 22:11:24.955938,0 days 00:00:03.895519,0.04993114854622569,9,,2,16,1475,0.6411022199452989,TPESampler,COMPLETE
2030,0.34029369538923754,2025-04-24 22:11:21.553502,2025-04-24 22:11:25.289637,0 days 00:00:03.736135,0.06674911760607237,9,,2,13,1369,0.647860180511832,TPESampler,COMPLETE
2031,0.3439791221631096,2025-04-24 22:11:21.606782,2025-04-24 22:11:25.432894,0 days 00:00:03.826112,0.06298339599570371,10,,2,13,1391,0.7141177815628703,TPESampler,COMPLETE
2032,0.26948351453915315,2025-04-24 22:11:25.156240,2025-04-24 22:11:28.910972,0 days 00:00:03.754732,0.04745479646392939,11,,1,13,1339,0.6149423759665661,TPESampler,COMPLETE
2033,0.2824625382949991,2025-04-24 22:11:25.522136,2025-04-24 22:11:29.677318,0 days 00:00:04.155182,0.04372366543042095,9,,1,14,1368,0.6188516398755389,TPESampler,COMPLETE
2034,0.3416883987612105,2025-04-24 22:11:25.690889,2025-04-24 22:11:28.761052,0 days 00:00:03.070163,0.01650971521998864,4,,2,19,1180,0.8298983267139347,TPESampler,COMPLETE
2035,0.27347073923314785,2025-04-24 22:11:28.987173,2025-04-24 22:11:32.745170,0 days 00:00:03.757997,0.047776369522066646,9,,1,10,1441,0.619519881278081,TPESampler,COMPLETE
2036,0.278211683117794,2025-04-24 22:11:29.173929,2025-04-24 22:11:33.071486,0 days 00:00:03.897557,0.04967823166687546,9,,1,12,1440,0.6666059102891497,TPESampler,COMPLETE
2037,0.28491768925778305,2025-04-24 22:11:29.938908,2025-04-24 22:11:33.908921,0 days 00:00:03.970013,0.09237926706599152,10,,1,11,1457,0.6416967565957187,TPESampler,COMPLETE
2038,0.2767842442531248,2025-04-24 22:11:32.947139,2025-04-24 22:11:36.721727,0 days 00:00:03.774588,0.06812980587263676,6,,1,10,1412,0.6109060484511031,TPESampler,COMPLETE
2039,0.28987563275428496,2025-04-24 22:11:33.352353,2025-04-24 22:11:36.666914,0 days 00:00:03.314561,0.06687766388443567,9,,1,13,1094,0.601875035483407,TPESampler,COMPLETE
2040,0.4054910963790951,2025-04-24 22:11:34.149776,2025-04-24 22:11:35.467027,0 days 00:00:01.317251,0.015201432795637211,9,sqrt,1,9,364,0.9944109691606527,TPESampler,COMPLETE
2041,0.27312842704861495,2025-04-24 22:11:35.676072,2025-04-24 22:11:39.431340,0 days 00:00:03.755268,0.0593136817809684,9,,1,13,1417,0.611859342438502,TPESampler,COMPLETE
2042,0.32408697675057346,2025-04-24 22:11:36.836627,2025-04-24 22:11:40.643780,0 days 00:00:03.807153,0.044374548821148545,7,,2,12,1482,0.7069474189998595,TPESampler,COMPLETE
2043,0.27388607529885634,2025-04-24 22:11:36.883454,2025-04-24 22:11:40.645847,0 days 00:00:03.762393,0.060844668932429756,9,,1,12,1343,0.640176563538791,TPESampler,COMPLETE
2044,0.308517959662843,2025-04-24 22:11:39.640348,2025-04-24 22:11:42.406604,0 days 00:00:02.766256,0.05432230211617292,8,sqrt,1,10,1413,0.648213544383989,TPESampler,COMPLETE
2045,0.276725256343209,2025-04-24 22:11:40.820917,2025-04-24 22:11:45.061804,0 days 00:00:04.240887,0.06294830942665049,9,,1,14,1458,0.6150267918994204,TPESampler,COMPLETE
2046,0.3334750881408635,2025-04-24 22:11:40.875490,2025-04-24 22:11:45.144975,0 days 00:00:04.269485,0.061332781516338516,9,,2,15,1471,0.650677496450716,TPESampler,COMPLETE
2047,0.2723066280532696,2025-04-24 22:11:42.605187,2025-04-24 22:11:46.528215,0 days 00:00:03.923028,0.07464985275409698,8,,1,12,1473,0.6390697403198395,TPESampler,COMPLETE
2048,0.3244734284944034,2025-04-24 22:11:45.268879,2025-04-24 22:11:48.925237,0 days 00:00:03.656358,0.05693247465929399,8,,2,11,1323,0.6203418773804643,TPESampler,COMPLETE
2049,0.3199998981369447,2025-04-24 22:11:45.457649,2025-04-24 22:11:48.565421,0 days 00:00:03.107772,0.04227589634736729,9,,3,13,1050,0.6045326546468288,TPESampler,COMPLETE
2050,0.28653198623831305,2025-04-24 22:11:46.734717,2025-04-24 22:11:50.315606,0 days 00:00:03.580889,0.04358236952926862,6,,1,10,1309,0.6151945785318008,TPESampler,COMPLETE
2051,0.3441048449734813,2025-04-24 22:11:48.776541,2025-04-24 22:11:51.411620,0 days 00:00:02.635079,0.09258826923573867,8,sqrt,3,17,1434,0.6603829723380115,TPESampler,COMPLETE
2052,0.28059458141158844,2025-04-24 22:11:49.186514,2025-04-24 22:11:53.082286,0 days 00:00:03.895772,0.06394729626292114,9,,1,10,1185,0.6115173323855208,TPESampler,COMPLETE
2053,0.62681711681592,2025-04-24 22:11:50.537535,2025-04-24 22:11:52.939775,0 days 00:00:02.402240,0.02132726322388482,3,,10,10,682,0.9569296028835476,TPESampler,COMPLETE
2054,0.2855500355528974,2025-04-24 22:11:51.656027,2025-04-24 22:11:56.045741,0 days 00:00:04.389714,0.06474894747664757,11,,1,15,1486,0.6668162023251477,TPESampler,COMPLETE
2055,0.3280440480608389,2025-04-24 22:11:53.148420,2025-04-24 22:11:56.768371,0 days 00:00:03.619951,0.05892360692986013,9,,2,12,1312,0.6175307297993956,TPESampler,COMPLETE
2056,0.6424466874449873,2025-04-24 22:11:53.305390,2025-04-24 22:11:57.555424,0 days 00:00:04.250034,0.01970439286030038,5,,10,7,1479,0.9987598882783868,TPESampler,COMPLETE
2057,0.3814259839748934,2025-04-24 22:11:56.250235,2025-04-24 22:12:00.872842,0 days 00:00:04.622607,0.053898810841362825,9,,4,11,1474,0.6111190011693267,TPESampler,COMPLETE
2058,0.3578958191812085,2025-04-24 22:11:56.978165,2025-04-24 22:11:59.478995,0 days 00:00:02.500830,0.03669460787122362,11,sqrt,4,12,1407,0.7428962366930261,TPESampler,COMPLETE
2059,0.2724983973683283,2025-04-24 22:11:57.771866,2025-04-24 22:12:02.939029,0 days 00:00:05.167163,0.052813169461713445,10,,1,14,1427,0.7156780939277122,TPESampler,COMPLETE
2060,0.7288180643978323,2025-04-24 22:11:59.698020,2025-04-24 22:12:01.643233,0 days 00:00:01.945213,0.02001126369177269,4,log2,8,14,1115,0.6998177914051595,TPESampler,COMPLETE
2061,0.2849930830012141,2025-04-24 22:12:01.128579,2025-04-24 22:12:05.081540,0 days 00:00:03.952961,0.0902523956460407,9,,1,14,1412,0.6062741305246301,TPESampler,COMPLETE
2062,0.36307589843558774,2025-04-24 22:12:01.864492,2025-04-24 22:12:04.914063,0 days 00:00:03.049571,0.07180898923098451,10,,4,17,1146,0.6020556950699169,TPESampler,COMPLETE
2063,0.29712863159941005,2025-04-24 22:12:03.167469,2025-04-24 22:12:07.423014,0 days 00:00:04.255545,0.09987305051146554,8,,1,8,1477,0.7048827535766914,TPESampler,COMPLETE
2064,0.27993260334700515,2025-04-24 22:12:05.246031,2025-04-24 22:12:09.197604,0 days 00:00:03.951573,0.055422582706119446,8,,1,9,1360,0.6499853256182503,TPESampler,COMPLETE
2065,0.3688804991464281,2025-04-24 22:12:05.547582,2025-04-24 22:12:09.166341,0 days 00:00:03.618759,0.09961779164767987,6,,3,11,1286,0.7844994602674964,TPESampler,COMPLETE
2066,0.2798972593183788,2025-04-24 22:12:07.625168,2025-04-24 22:12:10.987863,0 days 00:00:03.362695,0.04495253277050358,10,,1,16,1111,0.6475441441732396,TPESampler,COMPLETE
2067,0.7474484043620387,2025-04-24 22:12:09.476473,2025-04-24 22:12:11.175735,0 days 00:00:01.699262,0.034645273742015946,7,log2,8,16,218,0.9674682261539747,TPESampler,COMPLETE
2068,0.34342819273944325,2025-04-24 22:12:09.520258,2025-04-24 22:12:13.711877,0 days 00:00:04.191619,0.09396241603326679,11,,2,16,1129,0.601376932564577,TPESampler,COMPLETE
2069,0.35632500332694933,2025-04-24 22:12:11.240830,2025-04-24 22:12:15.105499,0 days 00:00:03.864669,0.07927927954927685,11,,2,13,1433,0.6372907172136026,TPESampler,COMPLETE
2070,0.2842484720362219,2025-04-24 22:12:11.393743,2025-04-24 22:12:15.353327,0 days 00:00:03.959584,0.0639367373430083,9,,1,15,1467,0.6008411396911,TPESampler,COMPLETE
2071,0.3393722185688526,2025-04-24 22:12:13.925786,2025-04-24 22:12:17.845938,0 days 00:00:03.920152,0.06859463695170037,10,,3,15,1274,0.6037945016406292,TPESampler,COMPLETE
2072,0.34377791327296153,2025-04-24 22:12:15.309053,2025-04-24 22:12:19.058507,0 days 00:00:03.749454,0.07712788638545011,8,,3,8,1266,0.6179800024374743,TPESampler,COMPLETE
2073,0.3755611303762655,2025-04-24 22:12:15.673671,2025-04-24 22:12:17.711479,0 days 00:00:02.037808,0.0881303769757737,5,sqrt,4,12,1014,0.6241761084665708,TPESampler,COMPLETE
2074,0.2789382997666274,2025-04-24 22:12:17.911551,2025-04-24 22:12:21.910809,0 days 00:00:03.999258,0.09593931324162122,8,,1,8,1490,0.6224927638231363,TPESampler,COMPLETE
2075,0.27425264619189754,2025-04-24 22:12:18.030779,2025-04-24 22:12:21.857362,0 days 00:00:03.826583,0.09906174634730441,8,,1,10,1398,0.6212446046247266,TPESampler,COMPLETE
2076,0.2817008892825084,2025-04-24 22:12:19.275348,2025-04-24 22:12:22.977186,0 days 00:00:03.701838,0.06703479166120245,7,,1,11,1453,0.6150464313469663,TPESampler,COMPLETE
2077,0.31049019164733194,2025-04-24 22:12:22.042249,2025-04-24 22:12:25.841247,0 days 00:00:03.798998,0.06735629230585498,7,,2,14,1235,0.6427554516391834,TPESampler,COMPLETE
2078,0.30548142377140136,2025-04-24 22:12:22.088925,2025-04-24 22:12:24.887479,0 days 00:00:02.798554,0.05960739870642624,10,sqrt,1,11,1175,0.6659475776190008,TPESampler,COMPLETE
2079,0.2752508875864845,2025-04-24 22:12:23.203653,2025-04-24 22:12:26.550244,0 days 00:00:03.346591,0.08370392407876728,7,,1,14,1045,0.7223259303273558,TPESampler,COMPLETE
2080,0.2967474641697412,2025-04-24 22:12:25.099688,2025-04-24 22:12:28.770488,0 days 00:00:03.670800,0.08978066039760205,6,,1,14,1252,0.6772677813022369,TPESampler,COMPLETE
2081,0.3332708175358598,2025-04-24 22:12:26.064403,2025-04-24 22:12:30.027361,0 days 00:00:03.962958,0.08602485534453837,9,,3,12,1223,0.6040534443655864,TPESampler,COMPLETE
2082,0.4409547145746164,2025-04-24 22:12:26.773596,2025-04-24 22:12:28.117764,0 days 00:00:01.344168,0.028794339327646197,11,sqrt,6,11,444,0.9923004192607576,TPESampler,COMPLETE
2083,0.6469284104969123,2025-04-24 22:12:28.315754,2025-04-24 22:12:30.126543,0 days 00:00:01.810789,0.027183229594472808,7,sqrt,8,8,883,0.6522574407849533,TPESampler,COMPLETE
2084,0.3088642569415035,2025-04-24 22:12:29.024838,2025-04-24 22:12:31.568931,0 days 00:00:02.544093,0.06940777797830933,7,sqrt,1,12,1083,0.6067862273648493,TPESampler,COMPLETE
2085,0.27933137984925666,2025-04-24 22:12:30.230006,2025-04-24 22:12:34.083159,0 days 00:00:03.853153,0.07484160980496926,9,,1,10,1284,0.6263761997987899,TPESampler,COMPLETE
2086,0.2708756103022354,2025-04-24 22:12:30.365490,2025-04-24 22:12:34.444858,0 days 00:00:04.079368,0.05725224021026777,9,,1,11,1395,0.6457840439216621,TPESampler,COMPLETE
2087,0.2720300503191069,2025-04-24 22:12:31.765821,2025-04-24 22:12:35.859957,0 days 00:00:04.094136,0.07072084930163063,10,,1,14,1479,0.6437072724672652,TPESampler,COMPLETE
2088,0.277612868957524,2025-04-24 22:12:34.292283,2025-04-24 22:12:37.644352,0 days 00:00:03.352069,0.055788719100702495,7,,1,13,1214,0.6019132366806316,TPESampler,COMPLETE
2089,0.37506915767090837,2025-04-24 22:12:34.695407,2025-04-24 22:12:37.618509,0 days 00:00:02.923102,0.0990188056711747,8,,3,10,980,0.8229486907775841,TPESampler,COMPLETE
2090,0.31933483126233647,2025-04-24 22:12:36.064870,2025-04-24 22:12:40.319232,0 days 00:00:04.254362,0.030398386819727147,8,,2,15,1496,0.6338890272255087,TPESampler,COMPLETE
2091,0.2710268967019965,2025-04-24 22:12:37.787995,2025-04-24 22:12:42.209630,0 days 00:00:04.421635,0.06029881677055633,7,,1,13,1495,0.6065781649026079,TPESampler,COMPLETE
2092,0.6516044708561946,2025-04-24 22:12:37.836150,2025-04-24 22:12:40.320295,0 days 00:00:02.484145,0.021737680306397174,8,sqrt,9,8,1196,0.8495062441171675,TPESampler,COMPLETE
2093,0.2830805905617521,2025-04-24 22:12:40.492048,2025-04-24 22:12:44.741862,0 days 00:00:04.249814,0.031190304299436974,7,,1,12,1469,0.6690245966716668,TPESampler,COMPLETE
2094,0.28433235224740433,2025-04-24 22:12:40.544251,2025-04-24 22:12:44.738055,0 days 00:00:04.193804,0.08929678291876084,9,,1,13,1439,0.6405300169295702,TPESampler,COMPLETE
2095,0.27721371148696783,2025-04-24 22:12:42.635954,2025-04-24 22:12:46.506887,0 days 00:00:03.870933,0.06550971678735405,7,,1,10,1346,0.6030473978810744,TPESampler,COMPLETE
2096,0.27290122176011855,2025-04-24 22:12:45.068109,2025-04-24 22:12:50.648554,0 days 00:00:05.580445,0.05937898302803195,9,,1,14,1493,0.6434062703058414,TPESampler,COMPLETE
2097,0.3385620614852845,2025-04-24 22:12:45.201577,2025-04-24 22:12:49.831994,0 days 00:00:04.630417,0.08360002656330016,7,,2,14,1306,0.6072317027580999,TPESampler,COMPLETE
2098,0.27836538197421573,2025-04-24 22:12:47.106814,2025-04-24 22:12:51.283656,0 days 00:00:04.176842,0.07610338348761107,9,,1,15,1262,0.6054633775917727,TPESampler,COMPLETE
2099,0.31592789047798203,2025-04-24 22:12:50.195681,2025-04-24 22:12:53.821715,0 days 00:00:03.626034,0.05705652781550936,8,,2,14,1234,0.6073063424626394,TPESampler,COMPLETE
2100,0.3471075854117413,2025-04-24 22:12:51.473875,2025-04-24 22:12:56.348761,0 days 00:00:04.874886,0.08691262712669011,8,,2,14,1453,0.6030054934349081,TPESampler,COMPLETE
2101,0.3935309821512299,2025-04-24 22:12:51.759027,2025-04-24 22:12:54.599017,0 days 00:00:02.839990,0.05745086561220312,3,sqrt,3,11,616,0.9971752375352896,TPESampler,COMPLETE
2102,0.3640092713138,2025-04-24 22:12:54.140124,2025-04-24 22:12:56.718241,0 days 00:00:02.578117,0.0716403100865831,10,log2,3,13,1420,0.806280066563917,TPESampler,COMPLETE
2103,0.2854715482370574,2025-04-24 22:12:54.984439,2025-04-24 22:12:59.481644,0 days 00:00:04.497205,0.0721540007484131,9,,1,10,1401,0.6157252685813986,TPESampler,COMPLETE
2104,0.36524171555287915,2025-04-24 22:12:56.585836,2025-04-24 22:13:00.211083,0 days 00:00:03.625247,0.0991150679092066,10,,2,9,1237,0.6619080576694223,TPESampler,COMPLETE
2105,0.28797409747650865,2025-04-24 22:12:57.009267,2025-04-24 22:13:00.746250,0 days 00:00:03.736983,0.07548042484137793,10,,1,16,1170,0.7323504775433318,TPESampler,COMPLETE
2106,0.26413954087960695,2025-04-24 22:12:59.699173,2025-04-24 22:13:03.463322,0 days 00:00:03.764149,0.07666563965138841,8,,1,11,1294,0.6031242242679398,TPESampler,COMPLETE
2107,0.26878586199895005,2025-04-24 22:13:00.436805,2025-04-24 22:13:04.206692,0 days 00:00:03.769887,0.06946183498627466,10,,1,12,1239,0.7110678908290146,TPESampler,COMPLETE
2108,0.28762261168164627,2025-04-24 22:13:00.986428,2025-04-24 22:13:04.280521,0 days 00:00:03.294093,0.057880968811810714,11,,1,6,1117,0.6005587842643354,TPESampler,COMPLETE
2109,0.2855407192497988,2025-04-24 22:13:03.665146,2025-04-24 22:13:08.093058,0 days 00:00:04.427912,0.0967847092242522,7,,1,12,1494,0.7219876907513838,TPESampler,COMPLETE
2110,0.684315720589904,2025-04-24 22:13:04.426255,2025-04-24 22:13:06.383572,0 days 00:00:01.957317,0.011951172000376936,11,log2,4,12,949,0.7070451541673363,TPESampler,COMPLETE
2111,0.3562752629524879,2025-04-24 22:13:04.557809,2025-04-24 22:13:08.191948,0 days 00:00:03.634139,0.036538710234590994,9,,4,5,1245,0.6182830766638401,TPESampler,COMPLETE
2112,0.3730676606684079,2025-04-24 22:13:06.598829,2025-04-24 22:13:10.423679,0 days 00:00:03.824850,0.07705476859814604,8,,3,12,1474,0.6887268177627661,TPESampler,COMPLETE
2113,0.27766670729429044,2025-04-24 22:13:08.276438,2025-04-24 22:13:11.524936,0 days 00:00:03.248498,0.09126361969450456,9,,1,10,1119,0.6080737813823116,TPESampler,COMPLETE
2114,0.34984098268653707,2025-04-24 22:13:08.401412,2025-04-24 22:13:12.255671,0 days 00:00:03.854259,0.06103973910762336,8,,3,10,1333,0.6531398901903003,TPESampler,COMPLETE
2115,0.34850804241364614,2025-04-24 22:13:10.650250,2025-04-24 22:13:14.202888,0 days 00:00:03.552638,0.0679713646757773,8,,2,7,1254,0.6131665547059005,TPESampler,COMPLETE
2116,0.33096886788572133,2025-04-24 22:13:11.725469,2025-04-24 22:13:14.872262,0 days 00:00:03.146793,0.08628581282872762,8,,3,12,1109,0.6048070880562634,TPESampler,COMPLETE
2117,0.3394286730607531,2025-04-24 22:13:12.471429,2025-04-24 22:13:16.534564,0 days 00:00:04.063135,0.07873597787994677,10,,3,14,1465,0.6038651098327987,TPESampler,COMPLETE
2118,0.26933068091678886,2025-04-24 22:13:14.438940,2025-04-24 22:13:18.005001,0 days 00:00:03.566061,0.09178660782304465,7,,1,14,1272,0.6417144399140726,TPESampler,COMPLETE
2119,0.32855211461190614,2025-04-24 22:13:15.115016,2025-04-24 22:13:18.057982,0 days 00:00:02.942966,0.055778451054966524,11,,2,12,961,0.6485989826483816,TPESampler,COMPLETE
2120,0.27655736410435816,2025-04-24 22:13:16.748826,2025-04-24 22:13:20.210059,0 days 00:00:03.461233,0.07041962568181713,8,,1,12,1282,0.6120807704129063,TPESampler,COMPLETE
2121,0.27028282903979595,2025-04-24 22:13:18.177647,2025-04-24 22:13:21.657918,0 days 00:00:03.480271,0.06255237537791922,9,,1,12,1265,0.6014044511903416,TPESampler,COMPLETE
2122,0.3684718348015394,2025-04-24 22:13:18.213555,2025-04-24 22:13:22.009027,0 days 00:00:03.795472,0.087011524447484,8,,3,8,1385,0.6616053442626885,TPESampler,COMPLETE
