number,value,datetime_start,datetime_complete,duration,params_learning_rate,params_max_depth,params_max_features,params_min_samples_leaf,params_min_samples_split,params_n_estimators,params_subsample,system_attrs_auto:sampler,state
2373,0.5645766291846744,2025-04-24 22:18:17.346530,2025-04-24 22:18:19.202473,0 days 00:00:01.855943,0.03370871741941799,11,log2,4,7,724,0.6381582273732628,TPESampler,COMPLETE
2374,0.2687916132293557,2025-04-24 22:18:17.832853,2025-04-24 22:18:22.289042,0 days 00:00:04.456189,0.04030126210577493,8,,1,11,1425,0.6008951918603072,TPESampler,COMPLETE
2375,0.49957476619214986,2025-04-24 22:18:19.413806,2025-04-24 22:18:20.493443,0 days 00:00:01.079637,0.053204124053756206,6,log2,2,10,246,0.9843014744942828,TPESampler,COMPLETE
2376,0.2647971024322188,2025-04-24 22:18:20.711668,2025-04-24 22:18:24.570761,0 days 00:00:03.859093,0.060012682381151095,8,,1,9,1229,0.616981000945836,TPESampler,COMPLETE
2377,0.2916554530077133,2025-04-24 22:18:21.719447,2025-04-24 22:18:24.622613,0 days 00:00:02.903166,0.05816691463948583,6,,1,14,1051,0.6399045903164465,TPESampler,COMPLETE
2378,0.2733144140112519,2025-04-24 22:18:22.535479,2025-04-24 22:18:27.095045,0 days 00:00:04.559566,0.04464578743999451,10,,1,11,1487,0.6047516710389912,TPESampler,COMPLETE
2379,0.2872995941445038,2025-04-24 22:18:24.735473,2025-04-24 22:18:29.135077,0 days 00:00:04.399604,0.03687625605337198,6,,1,13,1392,0.6128546428043878,TPESampler,COMPLETE
2380,0.34273111775803894,2025-04-24 22:18:24.870524,2025-04-24 22:18:27.909956,0 days 00:00:03.039432,0.07739572620242094,6,sqrt,2,11,1406,0.7240888593431556,TPESampler,COMPLETE
2381,0.2925303445026768,2025-04-24 22:18:27.310318,2025-04-24 22:18:31.064863,0 days 00:00:03.754545,0.06626073231998483,7,,1,16,1155,0.6094355724933441,TPESampler,COMPLETE
2382,0.3253868343903722,2025-04-24 22:18:28.138155,2025-04-24 22:18:30.805249,0 days 00:00:02.667094,0.037217211363262975,7,sqrt,1,3,1308,0.6325809684868593,TPESampler,COMPLETE
2383,0.2756873529731375,2025-04-24 22:18:29.367382,2025-04-24 22:18:32.951467,0 days 00:00:03.584085,0.043096650403183265,7,,1,8,1180,0.6655680029638572,TPESampler,COMPLETE
2384,0.3236668521207438,2025-04-24 22:18:31.016756,2025-04-24 22:18:34.748595,0 days 00:00:03.731839,0.0328043143854284,7,,2,7,1463,0.618929089526974,TPESampler,COMPLETE
2385,0.3382214432485752,2025-04-24 22:18:31.413295,2025-04-24 22:18:34.919545,0 days 00:00:03.506250,0.04163871590461949,8,,3,10,1358,0.6516891622438458,TPESampler,COMPLETE
2386,0.27620583991857584,2025-04-24 22:18:33.164604,2025-04-24 22:18:36.853994,0 days 00:00:03.689390,0.05674335215958578,7,,1,14,1389,0.6056413432087929,TPESampler,COMPLETE
2387,0.2818172644013076,2025-04-24 22:18:34.973970,2025-04-24 22:18:38.037526,0 days 00:00:03.063556,0.06525467669009496,7,,1,8,1069,0.6144393513819266,TPESampler,COMPLETE
2388,0.329167170002278,2025-04-24 22:18:35.159526,2025-04-24 22:18:39.096820,0 days 00:00:03.937294,0.044513665320419296,7,,3,13,1450,0.640162654913955,TPESampler,COMPLETE
2389,0.3363650872867314,2025-04-24 22:18:37.062623,2025-04-24 22:18:40.421401,0 days 00:00:03.358778,0.050654190306417254,9,,3,9,1101,0.6416353989554044,TPESampler,COMPLETE
2390,0.27307658271125196,2025-04-24 22:18:38.249377,2025-04-24 22:18:41.646099,0 days 00:00:03.396722,0.06300266479343725,10,,1,12,1034,0.6656397671391119,TPESampler,COMPLETE
2391,0.2811959730749742,2025-04-24 22:18:39.315509,2025-04-24 22:18:43.246724,0 days 00:00:03.931215,0.047489880815047195,9,,1,6,1311,0.6837203608765888,TPESampler,COMPLETE
2392,0.27624759475643323,2025-04-24 22:18:40.717012,2025-04-24 22:18:44.181459,0 days 00:00:03.464447,0.04756891947469181,8,,1,15,1093,0.7445258769566754,TPESampler,COMPLETE
2393,0.33778692346633493,2025-04-24 22:18:41.863464,2025-04-24 22:18:45.243656,0 days 00:00:03.380192,0.07506608489311617,10,,2,16,1032,0.718701293580746,TPESampler,COMPLETE
2394,0.28262769421918305,2025-04-24 22:18:43.441288,2025-04-24 22:18:48.395806,0 days 00:00:04.954518,0.09435433133523342,10,,1,15,1404,0.6998790863305033,TPESampler,COMPLETE
2395,0.46092332936769614,2025-04-24 22:18:44.429313,2025-04-24 22:18:46.326993,0 days 00:00:01.897680,0.0628977764150767,9,log2,5,4,1012,0.6320715965224615,TPESampler,COMPLETE
2396,0.27771847051511345,2025-04-24 22:18:45.490920,2025-04-24 22:18:50.929428,0 days 00:00:05.438508,0.09118528347590844,8,,1,14,1499,0.6426667153145705,TPESampler,COMPLETE
2397,0.7866817821919984,2025-04-24 22:18:46.600022,2025-04-24 22:18:48.150034,0 days 00:00:01.550012,0.01824644020319993,9,log2,8,16,753,0.7320140336187377,TPESampler,COMPLETE
2398,0.7597020808891849,2025-04-24 22:18:48.355090,2025-04-24 22:18:49.824302,0 days 00:00:01.469212,0.017769413613516395,10,log2,7,7,694,0.843069857246987,TPESampler,COMPLETE
2399,0.6656421060094964,2025-04-24 22:18:48.726733,2025-04-24 22:18:50.622548,0 days 00:00:01.895815,0.026415684781249248,7,log2,5,7,653,0.6241427566913982,TPESampler,COMPLETE
2400,0.42236785427469514,2025-04-24 22:18:50.071985,2025-04-24 22:18:53.134343,0 days 00:00:03.062358,0.09857698123013722,3,sqrt,6,10,1490,0.874518754433225,TPESampler,COMPLETE
2401,0.28344733041908726,2025-04-24 22:18:50.839736,2025-04-24 22:18:54.938110,0 days 00:00:04.098374,0.07166655305730163,7,,1,12,1067,0.608058980923784,TPESampler,COMPLETE
2402,0.7358709303557466,2025-04-24 22:18:51.252454,2025-04-24 22:18:53.822975,0 days 00:00:02.570521,0.010529844237066478,7,log2,7,19,1136,0.8578528052914096,TPESampler,COMPLETE
2403,0.28265546552785464,2025-04-24 22:18:53.382361,2025-04-24 22:18:57.323981,0 days 00:00:03.941620,0.044853125067068976,7,,1,9,1274,0.6083412631803126,TPESampler,COMPLETE
2404,0.5834971021237801,2025-04-24 22:18:54.093517,2025-04-24 22:18:55.273811,0 days 00:00:01.180294,0.08890403277623761,3,log2,7,13,366,0.9565937329504743,TPESampler,COMPLETE
2405,0.2877694050065975,2025-04-24 22:18:55.209430,2025-04-24 22:18:58.555672,0 days 00:00:03.346242,0.06189086320110982,10,,1,10,1143,0.621542479836504,TPESampler,COMPLETE
2406,0.2813205088292052,2025-04-24 22:18:55.556143,2025-04-24 22:18:59.642494,0 days 00:00:04.086351,0.05508243434371609,8,,1,9,1423,0.6057255332906114,TPESampler,COMPLETE
2407,0.35072153387608257,2025-04-24 22:18:57.532228,2025-04-24 22:18:59.939678,0 days 00:00:02.407450,0.077226169513349,9,sqrt,2,13,1270,0.6817706937303534,TPESampler,COMPLETE
2408,0.2678652996659812,2025-04-24 22:18:58.789710,2025-04-24 22:19:02.036276,0 days 00:00:03.246566,0.059601116010091895,9,,1,7,942,0.6112607972495568,TPESampler,COMPLETE
2409,0.37760640351193564,2025-04-24 22:18:59.905867,2025-04-24 22:19:03.851940,0 days 00:00:03.946073,0.06660575842333062,11,,3,6,1458,0.6375551207612239,TPESampler,COMPLETE
2410,0.2735486898231767,2025-04-24 22:19:00.162388,2025-04-24 22:19:03.937717,0 days 00:00:03.775329,0.046649321770271514,9,,1,15,1437,0.6031822475446305,TPESampler,COMPLETE
2411,0.27153471091800613,2025-04-24 22:19:02.240350,2025-04-24 22:19:05.591195,0 days 00:00:03.350845,0.04433571656933549,8,,1,9,1117,0.7003176228832891,TPESampler,COMPLETE
2412,0.2833287104490215,2025-04-24 22:19:04.036188,2025-04-24 22:19:07.599411,0 days 00:00:03.563223,0.05962438018803472,9,,1,9,1140,0.6032974666800054,TPESampler,COMPLETE
2413,0.3283090215063261,2025-04-24 22:19:04.174415,2025-04-24 22:19:07.735554,0 days 00:00:03.561139,0.0678876424483079,8,,3,16,1169,0.6856786847026595,TPESampler,COMPLETE
2414,0.2972252858162882,2025-04-24 22:19:05.846510,2025-04-24 22:19:08.524039,0 days 00:00:02.677529,0.09964267720985134,9,sqrt,1,14,1299,0.6046513321273869,TPESampler,COMPLETE
2415,0.2801490125151538,2025-04-24 22:19:07.795969,2025-04-24 22:19:12.231509,0 days 00:00:04.435540,0.057921530031947985,7,,1,12,1439,0.6192628798536318,TPESampler,COMPLETE
2416,0.7595120211637729,2025-04-24 22:19:07.935032,2025-04-24 22:19:09.653199,0 days 00:00:01.718167,0.026467721182982816,11,log2,10,2,451,0.868694747461401,TPESampler,COMPLETE
2417,0.3350154323215388,2025-04-24 22:19:08.815968,2025-04-24 22:19:11.592380,0 days 00:00:02.776412,0.057615036648375674,9,,3,10,754,0.7037409352773542,TPESampler,COMPLETE
2418,0.27447028764839865,2025-04-24 22:19:09.904816,2025-04-24 22:19:13.667019,0 days 00:00:03.762203,0.06825825552000198,8,,1,6,1270,0.6622966713327942,TPESampler,COMPLETE
2419,0.26567994044920057,2025-04-24 22:19:11.811157,2025-04-24 22:19:15.911043,0 days 00:00:04.099886,0.04517739963003053,7,,1,11,1462,0.6169743286456078,TPESampler,COMPLETE
2420,0.4275003516815794,2025-04-24 22:19:12.476893,2025-04-24 22:19:13.674461,0 days 00:00:01.197568,0.09394809166293158,8,sqrt,5,2,348,0.667679488907161,TPESampler,COMPLETE
2421,0.2805872254082403,2025-04-24 22:19:14.012855,2025-04-24 22:19:17.383037,0 days 00:00:03.370182,0.05600232469252657,8,,1,11,1060,0.6193927082333649,TPESampler,COMPLETE
2422,0.2759665772443935,2025-04-24 22:19:14.071830,2025-04-24 22:19:17.112097,0 days 00:00:03.040267,0.07398313366360969,7,,1,14,871,0.6007170930690207,TPESampler,COMPLETE
2423,0.2985006322913123,2025-04-24 22:19:16.122987,2025-04-24 22:19:19.447250,0 days 00:00:03.324263,0.09749041651056452,10,,1,14,833,0.7407371379801313,TPESampler,COMPLETE
2424,0.37401653429797516,2025-04-24 22:19:17.328043,2025-04-24 22:19:21.733222,0 days 00:00:04.405179,0.08667180418665772,10,,3,13,1481,0.6622587470952952,TPESampler,COMPLETE
2425,0.40891651755332076,2025-04-24 22:19:17.709381,2025-04-24 22:19:19.644506,0 days 00:00:01.935125,0.04558040503656176,8,log2,3,6,1198,0.6187870566110252,TPESampler,COMPLETE
2426,0.27562237915908294,2025-04-24 22:19:19.636005,2025-04-24 22:19:23.455223,0 days 00:00:03.819218,0.04463672289898449,8,,1,6,1291,0.6049339810592654,TPESampler,COMPLETE
2427,0.33340985609070195,2025-04-24 22:19:19.872088,2025-04-24 22:19:22.863589,0 days 00:00:02.991501,0.0925303537472275,7,,3,14,1056,0.6910795868493468,TPESampler,COMPLETE
2428,0.29362334542805546,2025-04-24 22:19:21.958797,2025-04-24 22:19:24.823050,0 days 00:00:02.864253,0.06925916972950877,9,sqrt,1,8,1311,0.6477333120371218,TPESampler,COMPLETE
2429,0.28063378288543667,2025-04-24 22:19:23.217738,2025-04-24 22:19:27.388069,0 days 00:00:04.170331,0.0710972944016048,8,,1,11,1406,0.6060153800214232,TPESampler,COMPLETE
2430,0.2729769549167572,2025-04-24 22:19:23.737036,2025-04-24 22:19:27.562291,0 days 00:00:03.825255,0.06634913980871353,10,,1,14,1216,0.6886856941632694,TPESampler,COMPLETE
2431,0.2855435423668794,2025-04-24 22:19:25.035056,2025-04-24 22:19:29.071525,0 days 00:00:04.036469,0.054878313189667245,7,,1,6,1445,0.6006118928518496,TPESampler,COMPLETE
2432,0.44187209683688683,2025-04-24 22:19:27.571671,2025-04-24 22:19:29.349945,0 days 00:00:01.778274,0.059207590582401076,4,,7,11,438,0.6975288941827866,TPESampler,COMPLETE
2433,0.44476875008371497,2025-04-24 22:19:27.811556,2025-04-24 22:19:30.068819,0 days 00:00:02.257263,0.020533368116800284,8,sqrt,6,3,986,0.7851138134258309,TPESampler,COMPLETE
2434,0.3299495449985239,2025-04-24 22:19:29.301068,2025-04-24 22:19:33.078015,0 days 00:00:03.776947,0.05922404862713545,9,,2,13,1082,0.6839081917193051,TPESampler,COMPLETE
2435,0.32211614617918716,2025-04-24 22:19:29.693253,2025-04-24 22:19:32.023963,0 days 00:00:02.330710,0.06637994860102059,10,sqrt,1,15,1000,0.6876600549096238,TPESampler,COMPLETE
2436,0.3239272267996916,2025-04-24 22:19:30.376831,2025-04-24 22:19:34.668380,0 days 00:00:04.291549,0.044235502052137034,8,,3,13,1388,0.605485497709689,TPESampler,COMPLETE
2437,0.3384919379380849,2025-04-24 22:19:32.231438,2025-04-24 22:19:34.303843,0 days 00:00:02.072405,0.06243388905365051,8,log2,1,9,1030,0.6476302489591882,TPESampler,COMPLETE
2438,0.28169329240768837,2025-04-24 22:19:33.301411,2025-04-24 22:19:37.851854,0 days 00:00:04.550443,0.06943341472100388,7,,1,10,1240,0.664935714974295,TPESampler,COMPLETE
2439,0.4341441699405241,2025-04-24 22:19:34.527814,2025-04-24 22:19:36.526122,0 days 00:00:01.998308,0.08385587333708697,12,log2,5,4,967,0.9299295555153055,TPESampler,COMPLETE
2440,0.4023103212394695,2025-04-24 22:19:34.958889,2025-04-24 22:19:37.094883,0 days 00:00:02.135994,0.07762202216610493,6,log2,3,20,784,0.7371948548947692,TPESampler,COMPLETE
2441,0.6646917733181308,2025-04-24 22:19:36.758516,2025-04-24 22:19:38.725068,0 days 00:00:01.966552,0.07412111600797894,4,,10,5,469,0.6606399914747346,TPESampler,COMPLETE
2442,0.2772307140521331,2025-04-24 22:19:37.415386,2025-04-24 22:19:41.983505,0 days 00:00:04.568119,0.08402789405022773,9,,1,13,1456,0.6017490349621638,TPESampler,COMPLETE
2443,0.38718255514549604,2025-04-24 22:19:38.118602,2025-04-24 22:19:40.277371,0 days 00:00:02.158769,0.040670215907980305,6,sqrt,4,16,1053,0.6950110283340813,TPESampler,COMPLETE
2444,0.2627093210621738,2025-04-24 22:19:38.942912,2025-04-24 22:19:42.940870,0 days 00:00:03.997958,0.05911843888594008,9,,1,12,1190,0.695393110709518,TPESampler,COMPLETE
2445,0.3643577925426818,2025-04-24 22:19:40.491021,2025-04-24 22:19:44.355276,0 days 00:00:03.864255,0.09686163316133325,8,,3,13,1356,0.7025934995347326,TPESampler,COMPLETE
2446,0.2733132689636143,2025-04-24 22:19:42.208626,2025-04-24 22:19:45.708387,0 days 00:00:03.499761,0.06287935769039402,7,,1,13,1144,0.7117177920893933,TPESampler,COMPLETE
2447,0.6538919012257363,2025-04-24 22:19:43.184109,2025-04-24 22:19:45.406752,0 days 00:00:02.222643,0.09615663876331566,8,,10,18,605,0.9272635485619231,TPESampler,COMPLETE
2448,0.6229264116699613,2025-04-24 22:19:44.574265,2025-04-24 22:19:45.841390,0 days 00:00:01.267125,0.0976425131027507,6,,9,14,208,0.7968587544971145,TPESampler,COMPLETE
2449,0.27598682098595745,2025-04-24 22:19:45.659151,2025-04-24 22:19:49.536280,0 days 00:00:03.877129,0.06115684582495879,8,,1,16,1094,0.6956464461968843,TPESampler,COMPLETE
2450,0.3471665944789968,2025-04-24 22:19:45.955821,2025-04-24 22:19:50.546240,0 days 00:00:04.590419,0.06084039773203756,9,,2,11,1326,0.74926316260499,TPESampler,COMPLETE
2451,0.49610980450710285,2025-04-24 22:19:46.257688,2025-04-24 22:19:48.389142,0 days 00:00:02.131454,0.06017642892001323,10,log2,5,12,1147,0.6005157388085464,TPESampler,COMPLETE
2452,0.27224548812686783,2025-04-24 22:19:48.611080,2025-04-24 22:19:52.487527,0 days 00:00:03.876447,0.05309986601432488,10,,1,14,1176,0.7325019847183903,TPESampler,COMPLETE
2453,0.27278743130874,2025-04-24 22:19:49.752102,2025-04-24 22:19:53.282696,0 days 00:00:03.530594,0.06552642341462375,10,,1,13,1106,0.6026158809833739,TPESampler,COMPLETE
2454,0.33922688329321365,2025-04-24 22:19:50.773734,2025-04-24 22:19:54.218791,0 days 00:00:03.445057,0.05880187447593611,6,,3,14,1100,0.7913468356894107,TPESampler,COMPLETE
2455,0.32318775029661234,2025-04-24 22:19:52.706668,2025-04-24 22:19:56.166465,0 days 00:00:03.459797,0.06534035862400461,10,,2,13,905,0.6009053774935298,TPESampler,COMPLETE
2456,0.4376925714498362,2025-04-24 22:19:53.563139,2025-04-24 22:19:55.380785,0 days 00:00:01.817646,0.03155149067109114,3,sqrt,5,7,820,0.8437132442349446,TPESampler,COMPLETE
2457,0.32867158586873685,2025-04-24 22:19:54.473826,2025-04-24 22:19:57.995485,0 days 00:00:03.521659,0.034339339180183684,10,,2,9,1032,0.6301912389588462,TPESampler,COMPLETE
2458,0.3299262988223573,2025-04-24 22:19:55.614420,2025-04-24 22:19:58.944427,0 days 00:00:03.330007,0.04059193619973415,8,,3,12,1100,0.6829481623626725,TPESampler,COMPLETE
2459,0.3150405957503588,2025-04-24 22:19:56.390568,2025-04-24 22:19:59.690933,0 days 00:00:03.300365,0.040896261386745514,7,,2,12,1139,0.6018514439460698,TPESampler,COMPLETE
2460,0.44861664400316237,2025-04-24 22:19:58.210230,2025-04-24 22:20:00.003387,0 days 00:00:01.793157,0.01075504112663596,6,sqrt,2,18,704,0.6153378375015736,TPESampler,COMPLETE
2461,0.3474244986834076,2025-04-24 22:19:59.167507,2025-04-24 22:20:02.711867,0 days 00:00:03.544360,0.07250931592089946,9,,3,15,1006,0.8802479293588749,TPESampler,COMPLETE
2462,0.27926430981841577,2025-04-24 22:19:59.920574,2025-04-24 22:20:03.775798,0 days 00:00:03.855224,0.06656179221533476,8,,1,15,1267,0.661962626365796,TPESampler,COMPLETE
2463,0.27544601905072885,2025-04-24 22:20:00.283721,2025-04-24 22:20:04.102232,0 days 00:00:03.818511,0.077721379685826,9,,1,13,1249,0.7724901055711553,TPESampler,COMPLETE
2464,0.2653171944237581,2025-04-24 22:20:02.926705,2025-04-24 22:20:07.078356,0 days 00:00:04.151651,0.05451733732640579,8,,1,12,1181,0.6822824445050061,TPESampler,COMPLETE
2465,0.3002084196294881,2025-04-24 22:20:03.990951,2025-04-24 22:20:07.171156,0 days 00:00:03.180205,0.07533505014115696,8,sqrt,1,14,1484,0.6914996971080307,TPESampler,COMPLETE
2466,0.46993429364665257,2025-04-24 22:20:04.433905,2025-04-24 22:20:07.090007,0 days 00:00:02.656102,0.024099164921629827,3,log2,2,19,1269,0.6149853283620981,TPESampler,COMPLETE
2467,0.3347575793425891,2025-04-24 22:20:07.242487,2025-04-24 22:20:10.291860,0 days 00:00:03.049373,0.06878694646440137,11,,3,15,1006,0.7174604728095767,TPESampler,COMPLETE
2468,0.2932004427761889,2025-04-24 22:20:07.250931,2025-04-24 22:20:11.094122,0 days 00:00:03.843191,0.06468445721486822,10,,1,11,1156,0.6013486283525636,TPESampler,COMPLETE
2469,0.2822394869699181,2025-04-24 22:20:07.380583,2025-04-24 22:20:11.147624,0 days 00:00:03.767041,0.047318020111502865,9,,1,14,1184,0.6076804649950177,TPESampler,COMPLETE
2470,0.38270496838376455,2025-04-24 22:20:10.506245,2025-04-24 22:20:12.808082,0 days 00:00:02.301837,0.09525325187207793,7,,5,10,539,0.7727768906022602,TPESampler,COMPLETE
2471,0.39489935504134627,2025-04-24 22:20:11.359330,2025-04-24 22:20:15.419440,0 days 00:00:04.060110,0.013444030023211798,7,,5,8,1404,0.8814157800401599,TPESampler,COMPLETE
2472,0.34415845002900713,2025-04-24 22:20:11.408725,2025-04-24 22:20:14.768868,0 days 00:00:03.360143,0.09801981978641904,9,,2,15,1026,0.7389308083107702,TPESampler,COMPLETE
2473,0.2801759376987543,2025-04-24 22:20:13.023594,2025-04-24 22:20:17.004917,0 days 00:00:03.981323,0.04697321972903816,9,,1,12,1221,0.683330420227065,TPESampler,COMPLETE
2474,0.40218356269615096,2025-04-24 22:20:14.994637,2025-04-24 22:20:17.202190,0 days 00:00:02.207553,0.024700462209226445,8,log2,2,4,1139,0.8519635508195296,TPESampler,COMPLETE
2475,0.2723104898936063,2025-04-24 22:20:15.695568,2025-04-24 22:20:18.636980,0 days 00:00:02.941412,0.07063967068890752,9,,1,10,737,0.6188325198001825,TPESampler,COMPLETE
2476,0.3312791651620042,2025-04-24 22:20:17.210009,2025-04-24 22:20:19.893676,0 days 00:00:02.683667,0.08606161087491086,8,,2,14,823,0.6856237312943176,TPESampler,COMPLETE
2477,0.2949528161252269,2025-04-24 22:20:17.445545,2025-04-24 22:20:21.505166,0 days 00:00:04.059621,0.09730521059671025,7,,1,17,1365,0.7605597920688417,TPESampler,COMPLETE
2478,0.2892172443472057,2025-04-24 22:20:18.852332,2025-04-24 22:20:22.793038,0 days 00:00:03.940706,0.07041765272955366,10,,1,12,1271,0.683148007709054,TPESampler,COMPLETE
2479,0.27996842721118065,2025-04-24 22:20:20.108084,2025-04-24 22:20:23.689148,0 days 00:00:03.581064,0.041796588161046686,9,,1,12,1106,0.7049220414828075,TPESampler,COMPLETE
2480,0.36222811647114517,2025-04-24 22:20:21.718129,2025-04-24 22:20:25.573282,0 days 00:00:03.855153,0.08328638159000103,11,,3,11,1060,0.7125034476068367,TPESampler,COMPLETE
2481,0.326817185209172,2025-04-24 22:20:23.001990,2025-04-24 22:20:25.545613,0 days 00:00:02.543623,0.07482424905772088,8,log2,1,10,1380,0.7102635321350939,TPESampler,COMPLETE
2482,0.31028592225633567,2025-04-24 22:20:23.912082,2025-04-24 22:20:28.036799,0 days 00:00:04.124717,0.03271972335227734,5,,3,14,1467,0.6141912031907352,TPESampler,COMPLETE
2483,0.2894832358871178,2025-04-24 22:20:25.871235,2025-04-24 22:20:28.295615,0 days 00:00:02.424380,0.07149652901794232,7,,1,14,721,0.7586429649070261,TPESampler,COMPLETE
2484,0.3275063147321777,2025-04-24 22:20:25.915175,2025-04-24 22:20:29.875094,0 days 00:00:03.959919,0.06250680010431353,8,,3,13,1244,0.6638605138383058,TPESampler,COMPLETE
2485,0.26563851731572924,2025-04-24 22:20:28.253447,2025-04-24 22:20:32.260140,0 days 00:00:04.006693,0.07525090749795622,7,,1,13,1281,0.7129703386041127,TPESampler,COMPLETE
2486,0.3313238497348741,2025-04-24 22:20:28.657819,2025-04-24 22:20:30.946565,0 days 00:00:02.288746,0.06863926145506029,6,sqrt,1,13,1078,0.6791657816959664,TPESampler,COMPLETE
2487,0.4169372842237609,2025-04-24 22:20:30.103848,2025-04-24 22:20:31.812648,0 days 00:00:01.708800,0.09527441304872425,10,sqrt,6,2,431,0.8703632644144045,TPESampler,COMPLETE
2488,0.28657544808404056,2025-04-24 22:20:31.237575,2025-04-24 22:20:35.208617,0 days 00:00:03.971042,0.0694029504899353,8,,1,11,1140,0.6059802321388387,TPESampler,COMPLETE
2489,0.3274037681411413,2025-04-24 22:20:32.149618,2025-04-24 22:20:34.625134,0 days 00:00:02.475516,0.059812643711193075,8,sqrt,2,10,1172,0.6023920086056317,TPESampler,COMPLETE
2490,0.3387372944063088,2025-04-24 22:20:32.589578,2025-04-24 22:20:36.633873,0 days 00:00:04.044295,0.047068008985098435,8,,3,10,1366,0.6138427357032152,TPESampler,COMPLETE
2491,0.43201900245772984,2025-04-24 22:20:34.852933,2025-04-24 22:20:37.926335,0 days 00:00:03.073402,0.06782139123410305,7,,6,17,918,0.6526551124154426,TPESampler,COMPLETE
2492,0.3306325347139956,2025-04-24 22:20:35.707870,2025-04-24 22:20:39.482882,0 days 00:00:03.775012,0.03590203375480643,11,,2,13,1154,0.6842907667377695,TPESampler,COMPLETE
2493,0.2951849764585064,2025-04-24 22:20:36.836863,2025-04-24 22:20:40.815763,0 days 00:00:03.978900,0.07883740227943598,8,,1,17,1399,0.6105956948981055,TPESampler,COMPLETE
2494,0.6469484335494066,2025-04-24 22:20:38.147174,2025-04-24 22:20:40.457560,0 days 00:00:02.310386,0.028013213777954078,8,,10,14,641,0.8565004603301762,TPESampler,COMPLETE
2495,0.30666743581322775,2025-04-24 22:20:39.705108,2025-04-24 22:20:43.351918,0 days 00:00:03.646810,0.09707733869654098,3,,1,11,1283,0.7851213650437991,TPESampler,COMPLETE
2496,0.3614374769481653,2025-04-24 22:20:40.673087,2025-04-24 22:20:43.787100,0 days 00:00:03.114013,0.057445124915653165,6,sqrt,2,10,1451,0.6295821228826508,TPESampler,COMPLETE
