number,value,datetime_start,datetime_complete,duration,params_learning_rate,params_max_depth,params_max_features,params_min_samples_leaf,params_min_samples_split,params_n_estimators,params_subsample,system_attrs_auto:sampler,state
2497,0.5707225718600717,2025-04-24 22:20:41.141347,2025-04-24 22:20:43.274603,0 days 00:00:02.133256,0.025400008335189874,7,log2,5,6,692,0.9862380106933031,TPESampler,COMPLETE
2498,0.3227924997365963,2025-04-24 22:20:43.449806,2025-04-24 22:20:46.251772,0 days 00:00:02.801966,0.048144230391489025,6,,2,13,1047,0.6825006595682057,TPESampler,COMPLETE
2499,0.3651425835182904,2025-04-24 22:20:43.584634,2025-04-24 22:20:47.107029,0 days 00:00:03.522395,0.06075605299100091,9,,3,7,1495,0.6043455893407176,TPESampler,COMPLETE
