number,value,datetime_start,datetime_complete,duration,params_learning_rate,params_max_depth,params_max_features,params_min_samples_leaf,params_min_samples_split,params_n_estimators,params_subsample,system_attrs_auto:sampler,state
874,0.29315616101259107,2025-04-24 21:50:54.265807,2025-04-24 21:50:58.948141,0 days 00:00:04.682334,0.04841349099857226,12,,1,17,1235,0.7269293838026176,TPESampler,COMPLETE
875,0.6736992715716786,2025-04-24 21:50:55.075362,2025-04-24 21:50:56.733797,0 days 00:00:01.658435,0.04737292659149467,8,log2,8,18,1073,0.6187388479648641,TPESampler,COMPLETE
876,0.26781555423020803,2025-04-24 21:50:55.359625,2025-04-24 21:50:59.082163,0 days 00:00:03.722538,0.06767708698241158,8,,1,18,1151,0.6748680742129153,TPESampler,COMPLETE
877,0.7579177452178092,2025-04-24 21:50:56.928280,2025-04-24 21:50:57.769201,0 days 00:00:00.840921,0.02666768769102557,12,sqrt,9,13,179,0.7093338817898363,TPESampler,COMPLETE
878,0.352219970599993,2025-04-24 21:50:57.963339,2025-04-24 21:51:01.896875,0 days 00:00:03.933536,0.09592133077144942,8,,2,12,1361,0.7666883192753494,TPESampler,COMPLETE
879,0.3017839611979569,2025-04-24 21:50:59.126591,2025-04-24 21:51:01.846425,0 days 00:00:02.719834,0.04863434844138229,9,sqrt,1,15,1462,0.7762408185783713,TPESampler,COMPLETE
880,0.3365328519970526,2025-04-24 21:50:59.316924,2025-04-24 21:51:03.189240,0 days 00:00:03.872316,0.07895467251936189,8,,3,19,1320,0.6761418965844548,TPESampler,COMPLETE
881,0.8566176487643268,2025-04-24 21:51:02.020696,2025-04-24 21:51:02.938012,0 days 00:00:00.917316,0.030889271765183638,10,log2,7,11,114,0.9208135771487742,TPESampler,COMPLETE
882,0.28474528205769123,2025-04-24 21:51:02.079462,2025-04-24 21:51:05.536027,0 days 00:00:03.456565,0.05324072619717528,7,,1,18,1241,0.7466277047233554,TPESampler,COMPLETE
883,0.2710238739798947,2025-04-24 21:51:03.137153,2025-04-24 21:51:06.441672,0 days 00:00:03.304519,0.0765109818891525,8,,1,18,1288,0.6766366332363065,TPESampler,COMPLETE
884,0.28381671905739797,2025-04-24 21:51:03.454298,2025-04-24 21:51:06.233824,0 days 00:00:02.779526,0.04861818901486406,8,,1,16,1058,0.689009850617587,TPESampler,COMPLETE
885,0.7158569135506659,2025-04-24 21:51:05.733833,2025-04-24 21:51:07.370131,0 days 00:00:01.636298,0.010552113440016922,6,sqrt,10,5,778,0.7950875048692152,TPESampler,COMPLETE
886,0.5643061385193231,2025-04-24 21:51:06.494281,2025-04-24 21:51:08.545695,0 days 00:00:02.051414,0.016818032409754644,10,sqrt,6,16,1079,0.6103496004970667,TPESampler,COMPLETE
887,0.3146052322929638,2025-04-24 21:51:06.713892,2025-04-24 21:51:10.605646,0 days 00:00:03.891754,0.03823248212861053,7,,2,20,1351,0.6251558516782791,TPESampler,COMPLETE
888,0.29045624149864185,2025-04-24 21:51:07.611154,2025-04-24 21:51:10.342868,0 days 00:00:02.731714,0.053515798940698585,9,,1,20,826,0.6113414639219593,TPESampler,COMPLETE
889,0.27878421985951357,2025-04-24 21:51:08.752604,2025-04-24 21:51:12.006530,0 days 00:00:03.253926,0.05620967331821281,8,,1,17,1161,0.7281588279135892,TPESampler,COMPLETE
890,0.30524531662208515,2025-04-24 21:51:10.541952,2025-04-24 21:51:13.653189,0 days 00:00:03.111237,0.05483032196376661,5,,3,14,1304,0.6321217025688214,TPESampler,COMPLETE
891,0.28220304392978013,2025-04-24 21:51:10.838986,2025-04-24 21:51:14.919415,0 days 00:00:04.080429,0.0877010051790699,10,,1,16,1195,0.6995346008759844,TPESampler,COMPLETE
892,0.36667496625954304,2025-04-24 21:51:12.212072,2025-04-24 21:51:14.405685,0 days 00:00:02.193613,0.09906250614205639,9,log2,2,3,1049,0.8430782077548185,TPESampler,COMPLETE
893,0.5665031450953348,2025-04-24 21:51:13.863028,2025-04-24 21:51:15.608543,0 days 00:00:01.745515,0.015593587841690574,6,log2,2,12,770,0.7031913890812617,TPESampler,COMPLETE
894,0.3159553151577374,2025-04-24 21:51:14.644927,2025-04-24 21:51:17.657858,0 days 00:00:03.012931,0.08989799823200172,7,,2,19,1039,0.6744859687091813,TPESampler,COMPLETE
895,0.2846405115988966,2025-04-24 21:51:15.220780,2025-04-24 21:51:17.809778,0 days 00:00:02.588998,0.07679598809922286,8,,1,19,958,0.684036695073927,TPESampler,COMPLETE
896,0.27766114218556964,2025-04-24 21:51:15.806612,2025-04-24 21:51:19.418197,0 days 00:00:03.611585,0.058752272974651444,7,,1,16,1286,0.6738455668494551,TPESampler,COMPLETE
897,0.4252526121274314,2025-04-24 21:51:17.829857,2025-04-24 21:51:20.564967,0 days 00:00:02.735110,0.03716523438864021,5,sqrt,7,9,1460,0.9196463684976538,TPESampler,COMPLETE
898,0.4476604820688725,2025-04-24 21:51:18.002028,2025-04-24 21:51:19.948660,0 days 00:00:01.946632,0.08149909442040583,6,log2,5,17,815,0.9979536768442308,TPESampler,COMPLETE
899,0.28245354090052294,2025-04-24 21:51:19.662318,2025-04-24 21:51:24.239547,0 days 00:00:04.577229,0.07390329682157891,8,,1,7,1449,0.6604718323764628,TPESampler,COMPLETE
900,0.3413593772022744,2025-04-24 21:51:20.218955,2025-04-24 21:51:24.372673,0 days 00:00:04.153718,0.0617305043253279,8,,3,12,1480,0.641052475616663,TPESampler,COMPLETE
901,0.799248958878199,2025-04-24 21:51:20.772521,2025-04-24 21:51:22.693495,0 days 00:00:01.920974,0.011207179435822846,12,log2,7,2,1044,0.6715752721055855,TPESampler,COMPLETE
902,0.28120973696059687,2025-04-24 21:51:22.891886,2025-04-24 21:51:26.674100,0 days 00:00:03.782214,0.09678454574661811,7,,1,13,1337,0.7603132390005571,TPESampler,COMPLETE
903,0.3309992557478139,2025-04-24 21:51:24.425165,2025-04-24 21:51:26.409867,0 days 00:00:01.984702,0.0727031219351737,7,sqrt,1,18,1059,0.6627634800314491,TPESampler,COMPLETE
904,0.3491916110172641,2025-04-24 21:51:24.614321,2025-04-24 21:51:28.251996,0 days 00:00:03.637675,0.07437415447564405,10,,3,14,1119,0.7496209337514714,TPESampler,COMPLETE
905,0.3537581676704939,2025-04-24 21:51:26.614926,2025-04-24 21:51:30.183634,0 days 00:00:03.568708,0.05019350852662392,9,,3,11,1399,0.6893061005228914,TPESampler,COMPLETE
906,0.2861168062922293,2025-04-24 21:51:26.900763,2025-04-24 21:51:31.009642,0 days 00:00:04.108879,0.09942556865665791,10,,1,9,1487,0.6116559528860178,TPESampler,COMPLETE
907,0.27449232514759275,2025-04-24 21:51:28.535479,2025-04-24 21:51:32.578919,0 days 00:00:04.043440,0.060155710383524984,8,,1,11,1409,0.7968519493100741,TPESampler,COMPLETE
908,0.26490331993877697,2025-04-24 21:51:30.371777,2025-04-24 21:51:33.848089,0 days 00:00:03.476312,0.07260318900299378,8,,1,8,1176,0.6750368455712387,TPESampler,COMPLETE
909,0.2765763773156379,2025-04-24 21:51:31.222753,2025-04-24 21:51:35.316690,0 days 00:00:04.093937,0.051952768034373174,9,,1,12,1467,0.718272590219249,TPESampler,COMPLETE
910,0.28254673465679925,2025-04-24 21:51:32.779742,2025-04-24 21:51:35.900255,0 days 00:00:03.120513,0.05918109910176534,10,,1,15,943,0.6857431609043164,TPESampler,COMPLETE
911,0.3248633497285674,2025-04-24 21:51:34.044823,2025-04-24 21:51:37.074667,0 days 00:00:03.029844,0.050227243573880656,3,,1,9,1303,0.7977319863114412,TPESampler,COMPLETE
912,0.34141495945223577,2025-04-24 21:51:35.517007,2025-04-24 21:51:37.755857,0 days 00:00:02.238850,0.05254256790748866,9,sqrt,2,8,1010,0.6696933527997977,TPESampler,COMPLETE
913,0.32645297011140745,2025-04-24 21:51:36.120742,2025-04-24 21:51:39.679779,0 days 00:00:03.559037,0.041908124308315836,9,,2,13,1170,0.7095941171395307,TPESampler,COMPLETE
914,0.35122874895471645,2025-04-24 21:51:37.273627,2025-04-24 21:51:40.658522,0 days 00:00:03.384895,0.045179792312395876,8,,2,5,1161,0.6980160702753972,TPESampler,COMPLETE
915,0.3572454048697611,2025-04-24 21:51:37.969960,2025-04-24 21:51:41.274820,0 days 00:00:03.304860,0.0643999023368842,9,,4,9,1211,0.6464617560411059,TPESampler,COMPLETE
916,0.2813416946742104,2025-04-24 21:51:39.883089,2025-04-24 21:51:42.705718,0 days 00:00:02.822629,0.052496253261489975,9,,1,10,895,0.7123394004483004,TPESampler,COMPLETE
917,0.2833096958981948,2025-04-24 21:51:40.855808,2025-04-24 21:51:44.088978,0 days 00:00:03.233170,0.07221214406691516,7,,1,6,1145,0.6728088814437054,TPESampler,COMPLETE
918,0.6351397877076841,2025-04-24 21:51:41.481367,2025-04-24 21:51:45.028123,0 days 00:00:03.546756,0.015093829582217087,6,,10,18,1293,0.9132094175432194,TPESampler,COMPLETE
919,0.28333972763064874,2025-04-24 21:51:42.901890,2025-04-24 21:51:46.301525,0 days 00:00:03.399635,0.0698518644270868,9,,1,9,1133,0.7290624226271036,TPESampler,COMPLETE
920,0.27629378838702523,2025-04-24 21:51:44.314472,2025-04-24 21:51:47.262013,0 days 00:00:02.947541,0.050658799447410745,7,,1,9,1046,0.6198732795856823,TPESampler,COMPLETE
921,0.36301865914899356,2025-04-24 21:51:45.236156,2025-04-24 21:51:48.082714,0 days 00:00:02.846558,0.08826736682549988,8,,3,5,937,0.6887869031079362,TPESampler,COMPLETE
922,0.27390829273189093,2025-04-24 21:51:46.487759,2025-04-24 21:51:49.833156,0 days 00:00:03.345397,0.05761997044624132,9,,1,14,1139,0.7117731212771767,TPESampler,COMPLETE
923,0.2750211194902307,2025-04-24 21:51:47.468299,2025-04-24 21:51:50.926823,0 days 00:00:03.458524,0.09030507950472498,9,,1,11,1240,0.6365515578111902,TPESampler,COMPLETE
924,0.3434334799425787,2025-04-24 21:51:48.285421,2025-04-24 21:51:51.913481,0 days 00:00:03.628060,0.06201138725642477,5,,2,9,1483,0.726842539240825,TPESampler,COMPLETE
925,0.2768807502902179,2025-04-24 21:51:50.025810,2025-04-24 21:51:53.649536,0 days 00:00:03.623726,0.08545489709382834,6,,1,11,1227,0.6740215539169453,TPESampler,COMPLETE
926,0.37178840435832805,2025-04-24 21:51:51.137470,2025-04-24 21:51:53.644862,0 days 00:00:02.507392,0.0533620649161941,9,log2,2,7,1490,0.6944227412401415,TPESampler,COMPLETE
927,0.35667138113843666,2025-04-24 21:51:52.143259,2025-04-24 21:51:55.724755,0 days 00:00:03.581496,0.0931757377554281,8,,2,9,1076,0.729564995687816,TPESampler,COMPLETE
928,0.2859456506805495,2025-04-24 21:51:53.794592,2025-04-24 21:51:56.316554,0 days 00:00:02.521962,0.08331436948162574,11,sqrt,1,9,979,0.6718655643350958,TPESampler,COMPLETE
929,0.3397487636700376,2025-04-24 21:51:53.842158,2025-04-24 21:51:55.889011,0 days 00:00:02.046853,0.05992614089084131,3,,3,12,657,0.6590773380774559,TPESampler,COMPLETE
930,0.276591226784975,2025-04-24 21:51:55.919058,2025-04-24 21:51:59.670041,0 days 00:00:03.750983,0.06265135617460485,8,,1,9,1222,0.7227063743930962,TPESampler,COMPLETE
931,0.4538902987113833,2025-04-24 21:51:56.098099,2025-04-24 21:51:58.305595,0 days 00:00:02.207496,0.018589828792421235,7,log2,2,19,1253,0.6901015738474999,TPESampler,COMPLETE
932,0.28770556755093857,2025-04-24 21:51:56.650118,2025-04-24 21:52:00.456744,0 days 00:00:03.806626,0.08184606201996188,5,,1,11,1280,0.7939900433443713,TPESampler,COMPLETE
933,0.543342194768396,2025-04-24 21:51:58.509030,2025-04-24 21:51:59.486068,0 days 00:00:00.977038,0.061952786032876316,10,,8,4,160,0.6140593750219995,TPESampler,COMPLETE
934,0.37701587468592673,2025-04-24 21:51:59.669024,2025-04-24 21:52:03.125794,0 days 00:00:03.456770,0.09535586532781257,10,,3,6,1043,0.6579583635863601,TPESampler,COMPLETE
935,0.2733082303076075,2025-04-24 21:51:59.918571,2025-04-24 21:52:04.160027,0 days 00:00:04.241456,0.08898890083262273,10,,1,8,1278,0.6502568553960846,TPESampler,COMPLETE
936,0.384686688022089,2025-04-24 21:52:00.665318,2025-04-24 21:52:02.568814,0 days 00:00:01.903496,0.07817505225844663,6,sqrt,4,11,1051,0.7511443479460899,TPESampler,COMPLETE
937,0.27557022576797857,2025-04-24 21:52:02.761058,2025-04-24 21:52:06.177422,0 days 00:00:03.416364,0.092873337106116,8,,1,7,1280,0.673018748560846,TPESampler,COMPLETE
938,0.3696987951487539,2025-04-24 21:52:03.316448,2025-04-24 21:52:06.046823,0 days 00:00:02.730375,0.0918153496379398,8,,3,11,1001,0.70111990945286,TPESampler,COMPLETE
939,0.2765750867790964,2025-04-24 21:52:04.375495,2025-04-24 21:52:07.538453,0 days 00:00:03.162958,0.07531630594212034,6,,1,14,1160,0.6670017444825069,TPESampler,COMPLETE
940,0.3535064366459687,2025-04-24 21:52:06.236319,2025-04-24 21:52:07.956230,0 days 00:00:01.719911,0.055762391490034195,9,log2,1,14,918,0.8114952446848385,TPESampler,COMPLETE
941,0.34226010116549765,2025-04-24 21:52:06.427301,2025-04-24 21:52:10.593794,0 days 00:00:04.166493,0.048077020479672924,12,,2,20,1263,0.7511424617759692,TPESampler,COMPLETE
942,0.28230056457284064,2025-04-24 21:52:07.731769,2025-04-24 21:52:10.814632,0 days 00:00:03.082863,0.09472504257796421,7,,1,9,1102,0.6701470790642031,TPESampler,COMPLETE
943,0.3403530627692469,2025-04-24 21:52:08.173899,2025-04-24 21:52:10.691812,0 days 00:00:02.517913,0.0626011181617756,5,,2,8,1029,0.7084633896180771,TPESampler,COMPLETE
944,0.3853234125259821,2025-04-24 21:52:10.761723,2025-04-24 21:52:12.972870,0 days 00:00:02.211147,0.016806229528406724,3,sqrt,1,4,1278,0.6484387200628687,TPESampler,COMPLETE
945,0.3021787574250677,2025-04-24 21:52:10.854873,2025-04-24 21:52:14.884882,0 days 00:00:04.030009,0.04817890531892459,9,,1,4,975,0.768284388008776,TPESampler,COMPLETE
946,0.27873038123084826,2025-04-24 21:52:11.061393,2025-04-24 21:52:15.038285,0 days 00:00:03.976892,0.0986358662732627,10,,1,11,1122,0.6081539172459619,TPESampler,COMPLETE
947,0.2728427923922424,2025-04-24 21:52:13.163049,2025-04-24 21:52:16.715611,0 days 00:00:03.552562,0.06435244146312098,8,,1,11,1140,0.6006339350566129,TPESampler,COMPLETE
948,0.46756837364587583,2025-04-24 21:52:15.084752,2025-04-24 21:52:16.372544,0 days 00:00:01.287792,0.02708302490586522,5,sqrt,4,12,433,0.6515816791422836,TPESampler,COMPLETE
949,0.6467230937990999,2025-04-24 21:52:15.256936,2025-04-24 21:52:16.665772,0 days 00:00:01.408836,0.09283906069952239,3,sqrt,9,11,514,0.6989464650226185,TPESampler,COMPLETE
950,0.45017603223945407,2025-04-24 21:52:16.587207,2025-04-24 21:52:17.819275,0 days 00:00:01.232068,0.012319812307560279,12,,6,16,208,0.7158566701158311,TPESampler,COMPLETE
951,0.2856750148865107,2025-04-24 21:52:16.891024,2025-04-24 21:52:20.716515,0 days 00:00:03.825491,0.030209227955812466,12,,1,18,1132,0.6946224734641793,TPESampler,COMPLETE
952,0.38250347526653417,2025-04-24 21:52:16.927902,2025-04-24 21:52:21.019221,0 days 00:00:04.091319,0.07906712296690149,9,,3,9,1363,0.727395571770349,TPESampler,COMPLETE
953,0.2911329116264945,2025-04-24 21:52:18.016762,2025-04-24 21:52:20.824302,0 days 00:00:02.807540,0.057799925641531906,6,,1,18,1128,0.6723132008318924,TPESampler,COMPLETE
954,0.5343830885832742,2025-04-24 21:52:20.931025,2025-04-24 21:52:23.051853,0 days 00:00:02.120828,0.08115872725455323,8,log2,8,9,1427,0.8853078609574396,TPESampler,COMPLETE
955,0.44305932995938413,2025-04-24 21:52:21.088583,2025-04-24 21:52:24.563169,0 days 00:00:03.474586,0.029091507397588687,4,,8,10,1015,0.8428516669499476,TPESampler,COMPLETE
956,0.3873240039211521,2025-04-24 21:52:21.253966,2025-04-24 21:52:26.551715,0 days 00:00:05.297749,0.01666828504166052,12,,5,7,1316,0.8415250662785357,TPESampler,COMPLETE
957,0.2785427980707877,2025-04-24 21:52:23.265637,2025-04-24 21:52:26.876949,0 days 00:00:03.611312,0.05672115450825812,8,,1,15,1214,0.6462859738432439,TPESampler,COMPLETE
958,0.4058710426084601,2025-04-24 21:52:24.761677,2025-04-24 21:52:26.491709,0 days 00:00:01.730032,0.05145515995465112,6,log2,2,15,992,0.6930561572609147,TPESampler,COMPLETE
959,0.28083446463758344,2025-04-24 21:52:26.665150,2025-04-24 21:52:30.231503,0 days 00:00:03.566353,0.05916938679285165,8,,1,7,1003,0.7107987958711057,TPESampler,COMPLETE
960,0.2979304963556708,2025-04-24 21:52:26.744316,2025-04-24 21:52:29.665876,0 days 00:00:02.921560,0.041126725018248156,9,sqrt,1,8,1464,0.6828355004525678,TPESampler,COMPLETE
961,0.31278596459994557,2025-04-24 21:52:27.132169,2025-04-24 21:52:30.618648,0 days 00:00:03.486479,0.012698990899105414,10,,1,4,874,0.7350641956325367,TPESampler,COMPLETE
962,0.5616232165231376,2025-04-24 21:52:29.865478,2025-04-24 21:52:31.506162,0 days 00:00:01.640684,0.02957302767173617,3,log2,5,8,827,0.9352994237232736,TPESampler,COMPLETE
963,0.28600077675968283,2025-04-24 21:52:30.461736,2025-04-24 21:52:35.216581,0 days 00:00:04.754845,0.05392844414909771,12,,1,13,1157,0.7197771128693137,TPESampler,COMPLETE
964,0.3872500887465847,2025-04-24 21:52:30.855791,2025-04-24 21:52:33.394301,0 days 00:00:02.538510,0.041157909489453054,9,log2,2,18,1437,0.740659942550124,TPESampler,COMPLETE
965,0.7327386000564646,2025-04-24 21:52:31.775079,2025-04-24 21:52:33.094062,0 days 00:00:01.318983,0.031847878361788026,6,log2,5,11,290,0.834582964082782,TPESampler,COMPLETE
966,0.2805872821863498,2025-04-24 21:52:33.323364,2025-04-24 21:52:37.724162,0 days 00:00:04.400798,0.06493372685708411,7,,1,11,1481,0.7042582617235735,TPESampler,COMPLETE
967,0.45674207955497526,2025-04-24 21:52:33.730661,2025-04-24 21:52:35.043603,0 days 00:00:01.312942,0.09251776608832973,7,log2,7,7,578,0.9843035371575838,TPESampler,COMPLETE
968,0.43445983951205636,2025-04-24 21:52:35.208147,2025-04-24 21:52:36.432751,0 days 00:00:01.224604,0.09847640421933088,10,sqrt,7,18,499,0.9767255870597031,TPESampler,COMPLETE
969,0.2796942248142686,2025-04-24 21:52:35.426564,2025-04-24 21:52:39.979171,0 days 00:00:04.552607,0.05881274452258286,11,,1,10,1416,0.7158710888255896,TPESampler,COMPLETE
970,0.3145883131796719,2025-04-24 21:52:36.615935,2025-04-24 21:52:41.080560,0 days 00:00:04.464625,0.09630842939395744,12,,1,4,1399,0.6467088868902551,TPESampler,COMPLETE
971,0.3190478453068822,2025-04-24 21:52:37.907408,2025-04-24 21:52:40.065535,0 days 00:00:02.158127,0.029630590170023192,5,,1,8,828,0.7904179453049316,TPESampler,COMPLETE
972,0.6645970277471033,2025-04-24 21:52:40.149586,2025-04-24 21:52:42.142553,0 days 00:00:01.992967,0.03147350782150001,8,sqrt,10,17,848,0.862180034548829,TPESampler,COMPLETE
973,0.549747168018672,2025-04-24 21:52:40.232022,2025-04-24 21:52:41.659222,0 days 00:00:01.427200,0.01556653045143347,5,sqrt,2,7,264,0.9674306629730767,TPESampler,COMPLETE
974,0.28297405612668075,2025-04-24 21:52:41.309847,2025-04-24 21:52:45.554053,0 days 00:00:04.244206,0.09181131365801927,7,,1,13,1409,0.6108089095400848,TPESampler,COMPLETE
975,0.27372130245425097,2025-04-24 21:52:41.948707,2025-04-24 21:52:45.656653,0 days 00:00:03.707946,0.08238048117999744,8,,1,11,1111,0.6927666961909419,TPESampler,COMPLETE
976,0.2833367669388766,2025-04-24 21:52:42.859026,2025-04-24 21:52:46.832072,0 days 00:00:03.973046,0.08524931476903398,10,,1,13,1068,0.7179523342363323,TPESampler,COMPLETE
977,0.35381307415195323,2025-04-24 21:52:45.997792,2025-04-24 21:52:49.773087,0 days 00:00:03.775295,0.09055696380982337,10,,3,14,1097,0.6549391967968968,TPESampler,COMPLETE
978,0.5374865034676447,2025-04-24 21:52:46.119138,2025-04-24 21:52:48.202334,0 days 00:00:02.083196,0.056604668014984816,3,sqrt,1,6,123,0.782145873401904,TPESampler,COMPLETE
979,0.266490186527573,2025-04-24 21:52:47.362719,2025-04-24 21:52:51.448959,0 days 00:00:04.086240,0.05037731173293111,8,,1,9,1086,0.7404819123376221,TPESampler,COMPLETE
980,0.32716807976099965,2025-04-24 21:52:48.658945,2025-04-24 21:52:51.258966,0 days 00:00:02.600021,0.05321781949906422,7,sqrt,3,12,1271,0.6981891176678667,TPESampler,COMPLETE
981,0.6086571433713006,2025-04-24 21:52:49.980801,2025-04-24 21:52:54.938494,0 days 00:00:04.957693,0.02837758030389462,11,,9,8,1424,0.9866232926423807,TPESampler,COMPLETE
982,0.3270431646171015,2025-04-24 21:52:51.714125,2025-04-24 21:52:55.292962,0 days 00:00:03.578837,0.044195093659796694,7,,3,9,1088,0.8080051120357027,TPESampler,COMPLETE
983,0.3406851615105943,2025-04-24 21:52:51.822014,2025-04-24 21:52:56.000809,0 days 00:00:04.178795,0.05247717870865991,8,,3,7,1191,0.771522826330828,TPESampler,COMPLETE
984,0.2849915362816783,2025-04-24 21:52:55.157914,2025-04-24 21:52:58.758809,0 days 00:00:03.600895,0.06322258963125854,8,,1,9,1257,0.7072377747515592,TPESampler,COMPLETE
985,0.3513514355510389,2025-04-24 21:52:55.610415,2025-04-24 21:52:59.212909,0 days 00:00:03.602494,0.0501712674936665,9,,2,7,1309,0.7488756545536377,TPESampler,COMPLETE
986,0.284413931339386,2025-04-24 21:52:56.226263,2025-04-24 21:52:58.832782,0 days 00:00:02.606519,0.054874917596020256,7,,1,12,984,0.8011627233667776,TPESampler,COMPLETE
987,0.3136363021579802,2025-04-24 21:52:58.920391,2025-04-24 21:53:01.232129,0 days 00:00:02.311738,0.029071899576350403,12,sqrt,1,8,848,0.8444486211099148,TPESampler,COMPLETE
988,0.4259400660549452,2025-04-24 21:52:58.999074,2025-04-24 21:53:01.309558,0 days 00:00:02.310484,0.029497500291683885,6,,7,18,484,0.9563992272536292,TPESampler,COMPLETE
989,0.655714874906453,2025-04-24 21:52:59.461162,2025-04-24 21:53:01.377566,0 days 00:00:01.916404,0.029560385890240567,5,sqrt,10,15,945,0.7353882344692244,TPESampler,COMPLETE
990,0.2770027799036272,2025-04-24 21:53:01.415440,2025-04-24 21:53:04.601098,0 days 00:00:03.185658,0.040264164465868627,8,,1,11,1072,0.7055817577409684,TPESampler,COMPLETE
991,0.6881462445316533,2025-04-24 21:53:01.500880,2025-04-24 21:53:03.025982,0 days 00:00:01.525102,0.07287386096232858,5,log2,7,7,341,0.6882286319409461,TPESampler,COMPLETE
992,0.28697049354057413,2025-04-24 21:53:01.608259,2025-04-24 21:53:04.826806,0 days 00:00:03.218547,0.03571656488456286,7,,1,10,967,0.7515520289042956,TPESampler,COMPLETE
993,0.29162313700017994,2025-04-24 21:53:03.223993,2025-04-24 21:53:06.620738,0 days 00:00:03.396745,0.08069078154864981,10,,1,10,1204,0.6644297261628234,TPESampler,COMPLETE
994,0.27341732934254315,2025-04-24 21:53:04.793893,2025-04-24 21:53:08.204819,0 days 00:00:03.410926,0.045174296270852204,9,,1,11,1133,0.7531312270430387,TPESampler,COMPLETE
995,0.3249814898396567,2025-04-24 21:53:05.017571,2025-04-24 21:53:07.594974,0 days 00:00:02.577403,0.03585739389203062,9,,3,10,821,0.7386749850169901,TPESampler,COMPLETE
996,0.33406981284813103,2025-04-24 21:53:06.811493,2025-04-24 21:53:10.370173,0 days 00:00:03.558680,0.04960911334208933,9,,3,11,1206,0.6738084908368888,TPESampler,COMPLETE
997,0.3282188033778896,2025-04-24 21:53:07.793616,2025-04-24 21:53:10.272437,0 days 00:00:02.478821,0.0977357918419566,9,,3,10,736,0.6051691326667353,TPESampler,COMPLETE
998,0.4107505858427648,2025-04-24 21:53:08.385347,2025-04-24 21:53:10.628184,0 days 00:00:02.242837,0.0336081742404438,9,sqrt,5,2,1224,0.9369931615267513,TPESampler,COMPLETE
