number,value,datetime_start,datetime_complete,duration,params_learning_rate,params_max_depth,params_max_features,params_min_samples_leaf,params_min_samples_split,params_n_estimators,params_subsample,system_attrs_auto:sampler,state
1748,0.2784962590157425,2025-04-24 22:06:09.727960,2025-04-24 22:06:12.829522,0 days 00:00:03.101562,0.09411255198652874,8,,1,17,1071,0.6764871008372366,TPESampler,COMPLETE
1749,0.3249928247719352,2025-04-24 22:06:09.855558,2025-04-24 22:06:13.200242,0 days 00:00:03.344684,0.04729813954651733,10,,2,13,1193,0.609640546254089,TPESampler,COMPLETE
1750,0.31591435845963584,2025-04-24 22:06:11.861730,2025-04-24 22:06:15.753859,0 days 00:00:03.892129,0.054208204273806335,7,,2,14,1108,0.6254405085918464,TPESampler,COMPLETE
1751,0.35542287129490857,2025-04-24 22:06:13.048096,2025-04-24 22:06:15.225320,0 days 00:00:02.177224,0.044664773621839404,7,log2,1,9,1170,0.6392238043285763,TPESampler,COMPLETE
1752,0.37120928794735414,2025-04-24 22:06:13.469590,2025-04-24 22:06:16.404013,0 days 00:00:02.934423,0.012020341260774104,12,,5,19,743,0.6495874185315927,TPESampler,COMPLETE
1753,0.8598953168042305,2025-04-24 22:06:15.437241,2025-04-24 22:06:16.469994,0 days 00:00:01.032753,0.01541738818045401,8,log2,7,3,268,0.8946778072707626,TPESampler,COMPLETE
1754,0.29715479520824434,2025-04-24 22:06:15.991116,2025-04-24 22:06:19.122516,0 days 00:00:03.131400,0.09261493270146011,5,,1,16,1188,0.6873278000354559,TPESampler,COMPLETE
1755,0.3147702604170991,2025-04-24 22:06:16.696473,2025-04-24 22:06:20.210531,0 days 00:00:03.514058,0.056599783008728005,7,,2,15,1266,0.6394118617779139,TPESampler,COMPLETE
1756,0.30179307633670666,2025-04-24 22:06:16.844087,2025-04-24 22:06:19.127385,0 days 00:00:02.283298,0.052804488492929715,5,,1,6,777,0.6947983069740087,TPESampler,COMPLETE
1757,0.338097437640824,2025-04-24 22:06:19.269415,2025-04-24 22:06:22.918248,0 days 00:00:03.648833,0.06057181989820005,10,,2,16,1098,0.6079056606432309,TPESampler,COMPLETE
1758,0.5219777559133273,2025-04-24 22:06:19.313365,2025-04-24 22:06:21.052413,0 days 00:00:01.739048,0.017642471165204444,3,sqrt,5,12,622,0.8646559063088773,TPESampler,COMPLETE
1759,0.2721538979589199,2025-04-24 22:06:20.483431,2025-04-24 22:06:24.114796,0 days 00:00:03.631365,0.051374628152244244,9,,1,8,1142,0.6441128372776359,TPESampler,COMPLETE
1760,0.2698582265740635,2025-04-24 22:06:21.386453,2025-04-24 22:06:24.002438,0 days 00:00:02.615985,0.05882322370841803,8,,1,10,812,0.6166641466234917,TPESampler,COMPLETE
1761,0.32734800796674113,2025-04-24 22:06:23.127156,2025-04-24 22:06:26.442567,0 days 00:00:03.315411,0.08642649295970417,8,,2,14,1132,0.6011634875654513,TPESampler,COMPLETE
1762,0.27539702256777265,2025-04-24 22:06:24.167792,2025-04-24 22:06:28.890049,0 days 00:00:04.722257,0.08690136962827712,9,,1,11,1475,0.7199726724543037,TPESampler,COMPLETE
1763,0.3515773157445796,2025-04-24 22:06:24.345457,2025-04-24 22:06:26.327204,0 days 00:00:01.981747,0.09800285983926815,7,log2,1,19,890,0.6151722162825014,TPESampler,COMPLETE
1764,0.31525047157514907,2025-04-24 22:06:26.492616,2025-04-24 22:06:29.654588,0 days 00:00:03.161972,0.038214476864951705,8,,2,17,1159,0.6008914721870174,TPESampler,COMPLETE
1765,0.2850643070733018,2025-04-24 22:06:26.644786,2025-04-24 22:06:29.583859,0 days 00:00:02.939073,0.09485312807652918,6,,1,12,1032,0.6748170381971683,TPESampler,COMPLETE
1766,0.4394159688097357,2025-04-24 22:06:29.112723,2025-04-24 22:06:31.065185,0 days 00:00:01.952462,0.010684439209001272,6,sqrt,4,19,984,0.8754259370932037,TPESampler,COMPLETE
1767,0.6017774404267864,2025-04-24 22:06:29.862769,2025-04-24 22:06:32.188919,0 days 00:00:02.326150,0.01003597290635351,12,,10,16,432,0.8569166928902251,TPESampler,COMPLETE
1768,0.366832464159098,2025-04-24 22:06:29.921550,2025-04-24 22:06:32.981480,0 days 00:00:03.059930,0.07552999808093494,9,,4,10,675,0.8636792366536753,TPESampler,COMPLETE
1769,0.2764150537598621,2025-04-24 22:06:31.255600,2025-04-24 22:06:34.328035,0 days 00:00:03.072435,0.05676092094411832,8,,1,13,1017,0.6142491480338879,TPESampler,COMPLETE
1770,0.2766280239974402,2025-04-24 22:06:32.386055,2025-04-24 22:06:37.054658,0 days 00:00:04.668603,0.06977733059412704,6,,1,16,1497,0.7032707214020286,TPESampler,COMPLETE
1771,0.4319746209515617,2025-04-24 22:06:33.205047,2025-04-24 22:06:35.261758,0 days 00:00:02.056711,0.01306828280999895,10,sqrt,5,3,1034,0.9055393547173725,TPESampler,COMPLETE
1772,0.5741048178119016,2025-04-24 22:06:34.544755,2025-04-24 22:06:37.006021,0 days 00:00:02.461266,0.013697057784412442,5,sqrt,8,20,1219,0.8700388672123991,TPESampler,COMPLETE
1773,0.32185394926929295,2025-04-24 22:06:35.476305,2025-04-24 22:06:37.593494,0 days 00:00:02.117189,0.064135885046962,7,sqrt,1,10,823,0.6115233186733551,TPESampler,COMPLETE
1774,0.2760258423210655,2025-04-24 22:06:37.184612,2025-04-24 22:06:40.456789,0 days 00:00:03.272177,0.04473492954707678,9,,1,15,887,0.7354423225958505,TPESampler,COMPLETE
1775,0.27132555230308797,2025-04-24 22:06:37.226854,2025-04-24 22:06:40.385118,0 days 00:00:03.158264,0.05278979110388415,8,,1,10,853,0.7554130408216656,TPESampler,COMPLETE
1776,0.6215214078984157,2025-04-24 22:06:37.884281,2025-04-24 22:06:39.029485,0 days 00:00:01.145204,0.014737967664293403,9,sqrt,5,20,243,0.9105895979908076,TPESampler,COMPLETE
1777,0.3391506453808372,2025-04-24 22:06:39.273285,2025-04-24 22:06:42.800376,0 days 00:00:03.527091,0.09235733736186566,8,,3,16,1233,0.6881513942616929,TPESampler,COMPLETE
1778,0.2825629300048423,2025-04-24 22:06:40.717959,2025-04-24 22:06:43.346860,0 days 00:00:02.628901,0.05825536817509978,9,,1,13,774,0.6006181477049823,TPESampler,COMPLETE
1779,0.30930907635405436,2025-04-24 22:06:40.865600,2025-04-24 22:06:44.617430,0 days 00:00:03.751830,0.06280035180553127,6,,2,14,1332,0.7403891330010851,TPESampler,COMPLETE
1780,0.2684468391910894,2025-04-24 22:06:43.009983,2025-04-24 22:06:46.719554,0 days 00:00:03.709571,0.07920457748559645,7,,1,11,1194,0.6166507560788695,TPESampler,COMPLETE
1781,0.6329775631202931,2025-04-24 22:06:43.592656,2025-04-24 22:06:46.130780,0 days 00:00:02.538124,0.013514354704482062,3,sqrt,8,7,1417,0.7230968739196629,TPESampler,COMPLETE
1782,0.2802224088089787,2025-04-24 22:06:44.939357,2025-04-24 22:06:47.932284,0 days 00:00:02.992927,0.05209466060433929,6,,1,8,865,0.6030803012328755,TPESampler,COMPLETE
1783,0.28193160801108086,2025-04-24 22:06:46.386013,2025-04-24 22:06:49.753401,0 days 00:00:03.367388,0.0401727332541669,9,,1,14,1212,0.6131263771358141,TPESampler,COMPLETE
1784,0.2812826356107812,2025-04-24 22:06:46.959844,2025-04-24 22:06:50.496076,0 days 00:00:03.536232,0.09957621929824073,7,,1,12,1296,0.7238560609775765,TPESampler,COMPLETE
1785,0.2758119869989576,2025-04-24 22:06:48.128598,2025-04-24 22:06:51.960724,0 days 00:00:03.832126,0.06265896007493743,7,,1,13,1376,0.6958126218865639,TPESampler,COMPLETE
1786,0.6620486961348541,2025-04-24 22:06:49.973010,2025-04-24 22:06:51.926526,0 days 00:00:01.953516,0.04599273302524385,7,sqrt,9,20,1063,0.7078682114612038,TPESampler,COMPLETE
1787,0.43211906812768314,2025-04-24 22:06:50.781343,2025-04-24 22:06:53.361828,0 days 00:00:02.580485,0.07245395618689815,9,sqrt,6,9,1057,0.6265415512195984,TPESampler,COMPLETE
1788,0.3263221313400661,2025-04-24 22:06:52.165944,2025-04-24 22:06:56.230971,0 days 00:00:04.065027,0.05806936206572329,10,,3,16,1333,0.6793099364407875,TPESampler,COMPLETE
1789,0.3627543767506326,2025-04-24 22:06:52.222863,2025-04-24 22:06:56.283124,0 days 00:00:04.060261,0.06227537996846783,10,,4,15,1432,0.6063539606480028,TPESampler,COMPLETE
1790,0.2770115817739904,2025-04-24 22:06:53.604468,2025-04-24 22:06:56.660532,0 days 00:00:03.056064,0.0471086442084642,8,,1,8,1248,0.6842929964908611,TPESampler,COMPLETE
1791,0.27459876816615447,2025-04-24 22:06:56.387296,2025-04-24 22:06:59.896367,0 days 00:00:03.509071,0.056688488564272985,7,,1,13,1282,0.679351034346704,TPESampler,COMPLETE
1792,0.3583930843718518,2025-04-24 22:06:56.433152,2025-04-24 22:06:59.454613,0 days 00:00:03.021461,0.06302079145815317,9,,3,7,1009,0.625222197808693,TPESampler,COMPLETE
1793,0.27806756535447524,2025-04-24 22:06:56.940637,2025-04-24 22:07:00.737208,0 days 00:00:03.796571,0.051579497409391245,8,,1,14,1325,0.7649106109489632,TPESampler,COMPLETE
1794,0.280445198503669,2025-04-24 22:06:59.668333,2025-04-24 22:07:03.374864,0 days 00:00:03.706531,0.06535945302973159,10,,1,13,1002,0.7233076399759463,TPESampler,COMPLETE
1795,0.3359548609020827,2025-04-24 22:07:00.144403,2025-04-24 22:07:04.229141,0 days 00:00:04.084738,0.061391111345530464,8,,2,11,1289,0.6872700710382512,TPESampler,COMPLETE
1796,0.7148237831836407,2025-04-24 22:07:00.942722,2025-04-24 22:07:02.578999,0 days 00:00:01.636277,0.0288179057474105,8,log2,10,5,907,0.6568140617703293,TPESampler,COMPLETE
1797,0.2851114642791439,2025-04-24 22:07:02.773646,2025-04-24 22:07:06.202448,0 days 00:00:03.428802,0.06322112759415371,9,,1,14,1183,0.6814254915577775,TPESampler,COMPLETE
1798,0.27723450781725234,2025-04-24 22:07:03.599622,2025-04-24 22:07:06.084532,0 days 00:00:02.484910,0.09844104879019898,8,,1,6,824,0.6134703001656754,TPESampler,COMPLETE
1799,0.3272502213559571,2025-04-24 22:07:04.444393,2025-04-24 22:07:07.715933,0 days 00:00:03.271540,0.05939542612657716,8,,3,14,1175,0.6645890342756658,TPESampler,COMPLETE
1800,0.35831890581215037,2025-04-24 22:07:06.306447,2025-04-24 22:07:09.778345,0 days 00:00:03.471898,0.04444682618120697,4,,2,3,944,0.9709079576849744,TPESampler,COMPLETE
1801,0.3480338747421559,2025-04-24 22:07:06.510161,2025-04-24 22:07:08.720575,0 days 00:00:02.210414,0.05988701735673371,7,log2,1,7,1001,0.7706142422035382,TPESampler,COMPLETE
1802,0.647705255249558,2025-04-24 22:07:07.934792,2025-04-24 22:07:10.109052,0 days 00:00:02.174260,0.04052337605994885,8,sqrt,10,11,1230,0.6173782533953461,TPESampler,COMPLETE
1803,0.32540027221897144,2025-04-24 22:07:08.944118,2025-04-24 22:07:12.788129,0 days 00:00:03.844011,0.05553452414317664,7,,3,10,1099,0.7233215537446308,TPESampler,COMPLETE
1804,0.27735505680858774,2025-04-24 22:07:10.068360,2025-04-24 22:07:14.324208,0 days 00:00:04.255848,0.09294264120816151,8,,1,11,1371,0.6585436246727454,TPESampler,COMPLETE
1805,0.3693099539032245,2025-04-24 22:07:10.313306,2025-04-24 22:07:12.706095,0 days 00:00:02.392789,0.058187717364567966,8,log2,2,17,1152,0.6185345234088354,TPESampler,COMPLETE
1806,0.34212346485791867,2025-04-24 22:07:13.070778,2025-04-24 22:07:16.028680,0 days 00:00:02.957902,0.017654041639479073,12,sqrt,3,20,1486,0.9887778883932279,TPESampler,COMPLETE
1807,0.34045206081949425,2025-04-24 22:07:13.112953,2025-04-24 22:07:16.898455,0 days 00:00:03.785502,0.09875305898256195,7,,3,10,1170,0.614636394277467,TPESampler,COMPLETE
1808,0.2946882914216262,2025-04-24 22:07:14.547175,2025-04-24 22:07:17.612355,0 days 00:00:03.065180,0.08125369994377732,6,,1,6,986,0.6951308845534343,TPESampler,COMPLETE
1809,0.2741204258696226,2025-04-24 22:07:16.238733,2025-04-24 22:07:20.375459,0 days 00:00:04.136726,0.08665212668102168,8,,1,9,1339,0.6095625763946173,TPESampler,COMPLETE
1810,0.4114502809720481,2025-04-24 22:07:17.117279,2025-04-24 22:07:20.995245,0 days 00:00:03.877966,0.05503970813691836,6,,6,9,1295,0.6677226764056549,TPESampler,COMPLETE
1811,0.6461520641606039,2025-04-24 22:07:17.843820,2025-04-24 22:07:20.036047,0 days 00:00:02.192227,0.04816815573895219,4,log2,10,14,1322,0.6028329906271847,TPESampler,COMPLETE
1812,0.38278462947568404,2025-04-24 22:07:20.236107,2025-04-24 22:07:24.393537,0 days 00:00:04.157430,0.0970114484414645,9,,4,14,1254,0.7798395868124102,TPESampler,COMPLETE
1813,0.3650477602698331,2025-04-24 22:07:20.640548,2025-04-24 22:07:23.335082,0 days 00:00:02.694534,0.0829282852457996,5,log2,2,16,1195,0.9510599121064464,TPESampler,COMPLETE
1814,0.4988209441840492,2025-04-24 22:07:21.402464,2025-04-24 22:07:23.485516,0 days 00:00:02.083052,0.06183342974389858,9,log2,7,5,796,0.8584739211910961,TPESampler,COMPLETE
1815,0.29602682170318084,2025-04-24 22:07:23.532331,2025-04-24 22:07:28.194896,0 days 00:00:04.662565,0.05789667104750674,8,,1,8,1037,0.8237111404686939,TPESampler,COMPLETE
1816,0.2694764431596337,2025-04-24 22:07:24.427991,2025-04-24 22:07:28.753033,0 days 00:00:04.325042,0.05468691353703118,7,,1,8,1262,0.6879662925856493,TPESampler,COMPLETE
1817,0.330989434909987,2025-04-24 22:07:24.667985,2025-04-24 22:07:27.030550,0 days 00:00:02.362565,0.0853140412695095,10,sqrt,3,11,943,0.7801561342484767,TPESampler,COMPLETE
1818,0.32179478908498804,2025-04-24 22:07:27.234416,2025-04-24 22:07:29.494645,0 days 00:00:02.260229,0.06401696556151028,6,,3,8,717,0.6504213480062148,TPESampler,COMPLETE
1819,0.3701301746659319,2025-04-24 22:07:28.416963,2025-04-24 22:07:31.047046,0 days 00:00:02.630083,0.07835629655489551,11,,4,12,744,0.661129045656666,TPESampler,COMPLETE
1820,0.32212253017083553,2025-04-24 22:07:29.102606,2025-04-24 22:07:32.504045,0 days 00:00:03.401439,0.056991718256264055,9,,2,17,1171,0.6062923854986625,TPESampler,COMPLETE
1821,0.2796574376227544,2025-04-24 22:07:29.714094,2025-04-24 22:07:33.262805,0 days 00:00:03.548711,0.09402688698804383,8,,1,11,1329,0.600109841378164,TPESampler,COMPLETE
1822,0.3432694070065632,2025-04-24 22:07:31.245966,2025-04-24 22:07:35.078919,0 days 00:00:03.832953,0.09675287074162807,9,,2,19,1458,0.6063584356311328,TPESampler,COMPLETE
1823,0.2783181808801205,2025-04-24 22:07:32.709166,2025-04-24 22:07:36.655052,0 days 00:00:03.945886,0.09360378642078476,10,,1,13,1179,0.6748269212931647,TPESampler,COMPLETE
1824,0.6382305536909738,2025-04-24 22:07:33.517355,2025-04-24 22:07:35.810661,0 days 00:00:02.293306,0.021814004697630802,9,,10,19,739,0.645188790734745,TPESampler,COMPLETE
1825,0.32684092689092437,2025-04-24 22:07:35.285715,2025-04-24 22:07:39.140723,0 days 00:00:03.855008,0.046652719045080275,9,,3,16,967,0.8386736749041593,TPESampler,COMPLETE
1826,0.8902387484523135,2025-04-24 22:07:36.034363,2025-04-24 22:07:36.947706,0 days 00:00:00.913343,0.05208052211742634,6,log2,10,3,215,0.7394680639365143,TPESampler,COMPLETE
1827,0.3708870808210326,2025-04-24 22:07:36.888372,2025-04-24 22:07:38.793558,0 days 00:00:01.905186,0.09795711142824755,12,log2,3,20,1025,0.9213040371100967,TPESampler,COMPLETE
1828,0.3351140191457875,2025-04-24 22:07:37.250185,2025-04-24 22:07:39.589649,0 days 00:00:02.339464,0.06950115263921751,10,log2,1,12,893,0.6847075201042928,TPESampler,COMPLETE
1829,0.42650326605604055,2025-04-24 22:07:39.006739,2025-04-24 22:07:42.506424,0 days 00:00:03.499685,0.06606250541249381,12,,7,13,1069,0.8579144918578839,TPESampler,COMPLETE
1830,0.37918830988972196,2025-04-24 22:07:39.419856,2025-04-24 22:07:43.942369,0 days 00:00:04.522513,0.09991358155941919,10,,3,13,1417,0.7425485758822632,TPESampler,COMPLETE
1831,0.3069704235636245,2025-04-24 22:07:40.041968,2025-04-24 22:07:43.173206,0 days 00:00:03.131238,0.05250749863913164,8,,2,15,1133,0.60965194937377,TPESampler,COMPLETE
1832,0.2766139290877048,2025-04-24 22:07:42.711857,2025-04-24 22:07:46.699740,0 days 00:00:03.987883,0.0946387127741438,7,,1,9,1274,0.6685630116079402,TPESampler,COMPLETE
1833,0.28979569349708667,2025-04-24 22:07:43.407030,2025-04-24 22:07:46.683545,0 days 00:00:03.276515,0.0530904465998101,6,,1,16,1063,0.7377734584489712,TPESampler,COMPLETE
1834,0.382423215185899,2025-04-24 22:07:44.176570,2025-04-24 22:07:45.742229,0 days 00:00:01.565659,0.0723899809154112,4,log2,1,5,528,0.6476325068569239,TPESampler,COMPLETE
1835,0.3971085877467158,2025-04-24 22:07:46.116195,2025-04-24 22:07:48.087843,0 days 00:00:01.971648,0.0921053271422638,10,sqrt,5,14,1209,0.6085770432847573,TPESampler,COMPLETE
1836,0.5855659753807935,2025-04-24 22:07:47.015538,2025-04-24 22:07:49.208579,0 days 00:00:02.193041,0.015148470408018798,3,sqrt,2,2,363,0.8527301522312485,TPESampler,COMPLETE
1837,0.690713388986523,2025-04-24 22:07:47.075660,2025-04-24 22:07:49.843251,0 days 00:00:02.767591,0.012092647254354466,6,sqrt,9,20,662,0.9886140236382442,TPESampler,COMPLETE
1838,0.7510467827343188,2025-04-24 22:07:48.611420,2025-04-24 22:07:51.200727,0 days 00:00:02.589307,0.014703030642800126,5,log2,9,14,1272,0.9142158855093703,TPESampler,COMPLETE
1839,0.6134113487617572,2025-04-24 22:07:49.777521,2025-04-24 22:07:51.964219,0 days 00:00:02.186698,0.05351697590046501,10,,10,20,146,0.7653655860467248,TPESampler,COMPLETE
1840,0.37403280816304346,2025-04-24 22:07:50.361531,2025-04-24 22:07:52.245163,0 days 00:00:01.883632,0.09476866985826791,6,log2,1,9,693,0.6080323706453198,TPESampler,COMPLETE
1841,0.33921940115181526,2025-04-24 22:07:51.528393,2025-04-24 22:07:55.251282,0 days 00:00:03.722889,0.0837316699095976,9,,2,15,825,0.759660800011418,TPESampler,COMPLETE
1842,0.5817081799222319,2025-04-24 22:07:52.674604,2025-04-24 22:07:55.155999,0 days 00:00:02.481395,0.020673799293996313,8,log2,6,10,1110,0.9429320057854121,TPESampler,COMPLETE
1843,0.3253531573164193,2025-04-24 22:07:52.727029,2025-04-24 22:07:55.619757,0 days 00:00:02.892728,0.03825655194412702,8,sqrt,1,15,1069,0.7165292863620707,TPESampler,COMPLETE
1844,0.36353178782717277,2025-04-24 22:07:55.404879,2025-04-24 22:07:58.916209,0 days 00:00:03.511330,0.09815087009095758,8,,3,10,1155,0.6997361235755328,TPESampler,COMPLETE
1845,0.3083207369686225,2025-04-24 22:07:55.618432,2025-04-24 22:07:58.113153,0 days 00:00:02.494721,0.050764645749498474,8,,1,4,571,0.613294925604842,TPESampler,COMPLETE
1846,0.28201944517774746,2025-04-24 22:07:56.066811,2025-04-24 22:07:59.319360,0 days 00:00:03.252549,0.0606904194052835,7,,1,14,984,0.7175889716890046,TPESampler,COMPLETE
1847,0.2821890554313849,2025-04-24 22:07:58.563235,2025-04-24 22:08:01.933000,0 days 00:00:03.369765,0.06790302344376173,7,,1,11,1134,0.6746777190773741,TPESampler,COMPLETE
1848,0.34704453713642336,2025-04-24 22:07:59.160309,2025-04-24 22:08:02.200457,0 days 00:00:03.040148,0.059084293990719176,10,,3,11,1077,0.7292652567754551,TPESampler,COMPLETE
1849,0.2849445401226244,2025-04-24 22:07:59.601845,2025-04-24 22:08:02.361743,0 days 00:00:02.759898,0.05402322188299121,7,,1,16,1034,0.6222479305915752,TPESampler,COMPLETE
1850,0.3597271817518514,2025-04-24 22:08:02.128168,2025-04-24 22:08:04.920936,0 days 00:00:02.792768,0.015958023249743217,9,sqrt,3,9,1462,0.7028895475412653,TPESampler,COMPLETE
1851,0.8457916529235626,2025-04-24 22:08:02.486833,2025-04-24 22:08:04.008622,0 days 00:00:01.521789,0.021672366844957592,4,log2,8,19,286,0.7176389462069833,TPESampler,COMPLETE
1852,0.4139222117682428,2025-04-24 22:08:02.665675,2025-04-24 22:08:05.201338,0 days 00:00:02.535663,0.05744737725662651,4,,5,12,562,0.9095682888507031,TPESampler,COMPLETE
1853,0.8944688110232839,2025-04-24 22:08:04.236093,2025-04-24 22:08:05.204219,0 days 00:00:00.968126,0.027242678966619742,8,log2,9,16,101,0.630314068562221,TPESampler,COMPLETE
1854,0.3760487275508065,2025-04-24 22:08:05.156684,2025-04-24 22:08:08.199749,0 days 00:00:03.043065,0.012422627309445055,10,log2,1,13,1487,0.6936642617824734,TPESampler,COMPLETE
1855,0.6631461070609611,2025-04-24 22:08:05.445283,2025-04-24 22:08:08.013950,0 days 00:00:02.568667,0.06223954915690033,5,sqrt,10,3,1065,0.8080634618416097,TPESampler,COMPLETE
1856,0.31638416213262444,2025-04-24 22:08:05.515727,2025-04-24 22:08:09.059486,0 days 00:00:03.543759,0.06286723263688199,7,,3,14,848,0.6847728236447316,TPESampler,COMPLETE
1857,0.33234585606656636,2025-04-24 22:08:08.190947,2025-04-24 22:08:10.536238,0 days 00:00:02.345291,0.08793232890627609,10,sqrt,2,15,1252,0.741076741435025,TPESampler,COMPLETE
1858,0.2789779821278153,2025-04-24 22:08:08.404838,2025-04-24 22:08:12.603499,0 days 00:00:04.198661,0.07663364238431251,9,,1,16,1293,0.7739287699331836,TPESampler,COMPLETE
1859,0.34887000635957566,2025-04-24 22:08:09.270437,2025-04-24 22:08:12.763094,0 days 00:00:03.492657,0.060886637187566615,9,,3,9,1167,0.7059424350696787,TPESampler,COMPLETE
1860,0.2791195361585338,2025-04-24 22:08:10.742432,2025-04-24 22:08:13.436078,0 days 00:00:02.693646,0.0885484933104242,7,,1,8,767,0.8025710375562873,TPESampler,COMPLETE
1861,0.2720285576943862,2025-04-24 22:08:12.867914,2025-04-24 22:08:16.466521,0 days 00:00:03.598607,0.09397493313466282,8,,1,16,1185,0.6400508937861318,TPESampler,COMPLETE
1862,0.3207792101097564,2025-04-24 22:08:12.983331,2025-04-24 22:08:15.349738,0 days 00:00:02.366407,0.0873317037584459,8,,3,9,696,0.6652517174093335,TPESampler,COMPLETE
1863,0.3292822274274383,2025-04-24 22:08:13.703959,2025-04-24 22:08:16.164419,0 days 00:00:02.460460,0.06375446556201383,8,,2,12,798,0.708140383343459,TPESampler,COMPLETE
1864,0.37170041266388,2025-04-24 22:08:15.564262,2025-04-24 22:08:19.028743,0 days 00:00:03.464481,0.07699773730352776,9,,3,10,1221,0.6491483142768314,TPESampler,COMPLETE
1865,0.27929967299159736,2025-04-24 22:08:16.410891,2025-04-24 22:08:19.188247,0 days 00:00:02.777356,0.06526150222107319,8,,1,13,1000,0.7519244528008765,TPESampler,COMPLETE
1866,0.2856767042241011,2025-04-24 22:08:16.799158,2025-04-24 22:08:20.052198,0 days 00:00:03.253040,0.08126006854648059,7,,1,16,1161,0.6951350036658158,TPESampler,COMPLETE
1867,0.3205708098854241,2025-04-24 22:08:19.219556,2025-04-24 22:08:22.942332,0 days 00:00:03.722776,0.06277531572690599,7,,2,13,1156,0.8019252903509683,TPESampler,COMPLETE
1868,0.4687525884957135,2025-04-24 22:08:19.419286,2025-04-24 22:08:21.624535,0 days 00:00:02.205249,0.036018024289505846,8,log2,4,11,1083,0.8376571221010111,TPESampler,COMPLETE
1869,0.2756207820142037,2025-04-24 22:08:20.396176,2025-04-24 22:08:24.338463,0 days 00:00:03.942287,0.06002224747351607,8,,1,10,1229,0.6381123797454306,TPESampler,COMPLETE
1870,0.2869359302120383,2025-04-24 22:08:21.910226,2025-04-24 22:08:24.058826,0 days 00:00:02.148600,0.09896028287604113,8,,1,12,636,0.6199483944501166,TPESampler,COMPLETE
1871,0.3195885131509855,2025-04-24 22:08:23.153436,2025-04-24 22:08:25.626223,0 days 00:00:02.472787,0.048381526727367785,7,,1,14,577,0.9934820202515089,TPESampler,COMPLETE
1872,0.33683222039151484,2025-04-24 22:08:24.256590,2025-04-24 22:08:27.381189,0 days 00:00:03.124599,0.09907359539597999,6,,3,14,1222,0.6714058305458781,TPESampler,COMPLETE
