number,value,datetime_start,datetime_complete,duration,params_learning_rate,params_max_depth,params_max_features,params_min_samples_leaf,params_min_samples_split,params_n_estimators,params_subsample,system_attrs_auto:sampler,state
1374,0.530864965426492,2025-04-24 21:59:37.330777,2025-04-24 21:59:38.537482,0 days 00:00:01.206705,0.010142154468371776,12,sqrt,4,9,360,0.9068075372561383,TPESampler,COMPLETE
1375,0.2772017225661482,2025-04-24 21:59:38.238351,2025-04-24 21:59:40.749687,0 days 00:00:02.511336,0.061494442263557283,7,,1,10,856,0.670851472193714,TPESampler,COMPLETE
1376,0.27471741599051686,2025-04-24 21:59:38.759010,2025-04-24 21:59:41.897543,0 days 00:00:03.138533,0.09597240835410592,6,,1,13,1149,0.613507610611888,TPESampler,COMPLETE
1377,0.2762490431621454,2025-04-24 21:59:40.283859,2025-04-24 21:59:43.765427,0 days 00:00:03.481568,0.06708671342815545,7,,1,15,1355,0.6177223006944007,TPESampler,COMPLETE
1378,0.27583545040594193,2025-04-24 21:59:40.956164,2025-04-24 21:59:44.636737,0 days 00:00:03.680573,0.0491834513677181,7,,1,13,1434,0.6284742190183917,TPESampler,COMPLETE
1379,0.3130685113421041,2025-04-24 21:59:42.098695,2025-04-24 21:59:45.356132,0 days 00:00:03.257437,0.04763583575536977,5,,2,17,1300,0.7390335981526908,TPESampler,COMPLETE
1380,0.2720379505054914,2025-04-24 21:59:43.961877,2025-04-24 21:59:46.492479,0 days 00:00:02.530602,0.09194052128613887,8,,1,12,768,0.6091883100401544,TPESampler,COMPLETE
1381,0.2598572131528116,2025-04-24 21:59:44.839162,2025-04-24 21:59:48.552856,0 days 00:00:03.713694,0.07385411977285396,7,,1,12,1271,0.6664767524884233,TPESampler,COMPLETE
1382,0.33344199476170183,2025-04-24 21:59:45.592074,2025-04-24 21:59:49.241540,0 days 00:00:03.649466,0.0821797905055299,8,,3,14,1250,0.6027741455706335,TPESampler,COMPLETE
1383,0.3324206676973794,2025-04-24 21:59:46.692073,2025-04-24 21:59:48.908872,0 days 00:00:02.216799,0.08860263322883731,6,log2,1,11,1303,0.6010570481378599,TPESampler,COMPLETE
1384,0.33801161923174877,2025-04-24 21:59:48.770163,2025-04-24 21:59:52.777311,0 days 00:00:04.007148,0.06788858150167773,6,,3,12,1362,0.6667718012239199,TPESampler,COMPLETE
1385,0.7596616708208812,2025-04-24 21:59:49.142938,2025-04-24 21:59:50.324776,0 days 00:00:01.181838,0.030093947266937763,11,log2,6,11,370,0.6848548921378226,TPESampler,COMPLETE
1386,0.6919296730708994,2025-04-24 21:59:49.563283,2025-04-24 21:59:51.557158,0 days 00:00:01.993875,0.013075438479714614,6,sqrt,9,15,856,0.6611363296266191,TPESampler,COMPLETE
1387,0.28668095230128593,2025-04-24 21:59:50.522357,2025-04-24 21:59:55.026859,0 days 00:00:04.504502,0.047340770861326265,6,,1,13,1262,0.6911885121431914,TPESampler,COMPLETE
1388,0.38520589790232934,2025-04-24 21:59:51.821141,2025-04-24 21:59:54.338663,0 days 00:00:02.517522,0.09195804031831037,3,log2,1,14,1452,0.6860596596740861,TPESampler,COMPLETE
1389,0.8630660562646293,2025-04-24 21:59:52.990908,2025-04-24 21:59:54.371637,0 days 00:00:01.380729,0.010525227862840653,10,log2,4,20,304,0.7097530613367566,TPESampler,COMPLETE
1390,0.3272293442813837,2025-04-24 21:59:54.499795,2025-04-24 21:59:58.033053,0 days 00:00:03.533258,0.05576234903638851,7,,3,13,1160,0.7069034717536695,TPESampler,COMPLETE
1391,0.5404969442410522,2025-04-24 21:59:54.546926,2025-04-24 21:59:56.329405,0 days 00:00:01.782479,0.06564580485115983,12,log2,7,19,773,0.7704977444792609,TPESampler,COMPLETE
1392,0.2827225133967988,2025-04-24 21:59:55.278851,2025-04-24 21:59:58.803528,0 days 00:00:03.524677,0.06743949380373157,7,,1,15,1143,0.6154313200540399,TPESampler,COMPLETE
1393,0.27024160754175447,2025-04-24 21:59:56.533247,2025-04-24 22:00:00.132475,0 days 00:00:03.599228,0.09921552080937085,6,,1,11,1468,0.6017247639038432,TPESampler,COMPLETE
1394,0.3408393789320196,2025-04-24 21:59:58.228455,2025-04-24 22:00:01.884364,0 days 00:00:03.655909,0.07896995683532584,7,,3,11,1422,0.680427113777832,TPESampler,COMPLETE
1395,0.31203198625008505,2025-04-24 21:59:59.017035,2025-04-24 22:00:02.016344,0 days 00:00:02.999309,0.050580926615984644,7,,3,16,1218,0.6227526997641385,TPESampler,COMPLETE
1396,0.32829436023682224,2025-04-24 22:00:00.367584,2025-04-24 22:00:03.332476,0 days 00:00:02.964892,0.06769066182278836,7,,2,11,1177,0.6074185643440773,TPESampler,COMPLETE
1397,0.3267946354279237,2025-04-24 22:00:02.225725,2025-04-24 22:00:06.224153,0 days 00:00:03.998428,0.06575263440449874,8,,3,16,1327,0.6969049827371776,TPESampler,COMPLETE
1398,0.4070438800296979,2025-04-24 22:00:02.443643,2025-04-24 22:00:04.278672,0 days 00:00:01.835029,0.06261027762264992,8,log2,2,12,700,0.6399805174573953,TPESampler,COMPLETE
1399,0.36934481567479616,2025-04-24 22:00:03.605790,2025-04-24 22:00:06.624351,0 days 00:00:03.018561,0.09774179429031903,9,,3,9,1028,0.6546507997931078,TPESampler,COMPLETE
1400,0.2832288905117583,2025-04-24 22:00:04.473504,2025-04-24 22:00:07.291096,0 days 00:00:02.817592,0.08864436740578008,8,,1,13,1076,0.6035562205744394,TPESampler,COMPLETE
1401,0.41475991405457674,2025-04-24 22:00:06.458392,2025-04-24 22:00:08.428217,0 days 00:00:01.969825,0.024712259802776818,8,sqrt,5,16,861,0.7288293484319518,TPESampler,COMPLETE
1402,0.6466745184458436,2025-04-24 22:00:06.898381,2025-04-24 22:00:08.996600,0 days 00:00:02.098219,0.042472225184501056,3,,10,15,618,0.6759285072722635,TPESampler,COMPLETE
1403,0.3489558452190888,2025-04-24 22:00:07.629568,2025-04-24 22:00:11.454643,0 days 00:00:03.825075,0.09734451865536918,7,,3,10,1147,0.6311747772579476,TPESampler,COMPLETE
1404,0.3476393875140405,2025-04-24 22:00:08.683184,2025-04-24 22:00:11.082935,0 days 00:00:02.399751,0.09416824141770588,3,sqrt,2,11,1444,0.6398773443117913,TPESampler,COMPLETE
1405,0.3308400399108106,2025-04-24 22:00:09.235747,2025-04-24 22:00:12.265981,0 days 00:00:03.030234,0.053830951574750964,9,,3,13,786,0.7312630325479655,TPESampler,COMPLETE
1406,0.279175582062716,2025-04-24 22:00:11.407587,2025-04-24 22:00:13.374034,0 days 00:00:01.966447,0.09300223037714046,10,,1,13,491,0.6456935789059982,TPESampler,COMPLETE
1407,0.35764627137597926,2025-04-24 22:00:11.705756,2025-04-24 22:00:15.139837,0 days 00:00:03.434081,0.08092442349854026,6,,4,16,1124,0.6159533440261157,TPESampler,COMPLETE
1408,0.39329280454194143,2025-04-24 22:00:12.838268,2025-04-24 22:00:15.013447,0 days 00:00:02.175179,0.010671175513684426,8,sqrt,3,12,982,0.9648823801031836,TPESampler,COMPLETE
1409,0.27751243074898063,2025-04-24 22:00:13.589951,2025-04-24 22:00:17.774207,0 days 00:00:04.184256,0.07057162055873059,7,,1,13,1348,0.7043837807103139,TPESampler,COMPLETE
1410,0.3280374779044529,2025-04-24 22:00:15.186419,2025-04-24 22:00:18.061645,0 days 00:00:02.875226,0.046186236306938584,9,,2,11,964,0.8037934003068814,TPESampler,COMPLETE
1411,0.2816444187680788,2025-04-24 22:00:15.373310,2025-04-24 22:00:18.499342,0 days 00:00:03.126032,0.06779344306687782,6,,1,10,1123,0.7269127090243797,TPESampler,COMPLETE
1412,0.4344209090364469,2025-04-24 22:00:17.982021,2025-04-24 22:00:19.854635,0 days 00:00:01.872614,0.012463844827448283,4,,6,5,564,0.8358405275688849,TPESampler,COMPLETE
1413,0.35731268485626505,2025-04-24 22:00:18.332322,2025-04-24 22:00:21.952188,0 days 00:00:03.619866,0.08678155473662097,8,,3,12,1450,0.6426270489564065,TPESampler,COMPLETE
1414,0.32839321081292006,2025-04-24 22:00:18.759840,2025-04-24 22:00:21.778369,0 days 00:00:03.018529,0.08664265341106885,8,,2,12,1142,0.6740003890312449,TPESampler,COMPLETE
1415,0.2840728532327133,2025-04-24 22:00:20.344015,2025-04-24 22:00:24.041079,0 days 00:00:03.697064,0.06857093330201806,5,,1,12,1329,0.7147917862743098,TPESampler,COMPLETE
1416,0.3443844484677127,2025-04-24 22:00:21.948643,2025-04-24 22:00:24.726738,0 days 00:00:02.778095,0.09208385075447603,7,,4,8,851,0.6641287429483442,TPESampler,COMPLETE
1417,0.5176156972210936,2025-04-24 22:00:22.165773,2025-04-24 22:00:24.067375,0 days 00:00:01.901602,0.028967373630108033,4,log2,5,14,1022,0.8684995916345756,TPESampler,COMPLETE
1418,0.764097115978457,2025-04-24 22:00:24.199499,2025-04-24 22:00:26.273494,0 days 00:00:02.073995,0.012269653581571355,12,log2,9,19,1200,0.9845255997642464,TPESampler,COMPLETE
1419,0.41991703575143047,2025-04-24 22:00:24.247454,2025-04-24 22:00:27.824218,0 days 00:00:03.576764,0.014237566197947912,9,,7,5,923,0.7755107485179047,TPESampler,COMPLETE
1420,0.2704142241680662,2025-04-24 22:00:24.975516,2025-04-24 22:00:28.462907,0 days 00:00:03.487391,0.05276993560849465,6,,1,9,1074,0.6560341684555975,TPESampler,COMPLETE
1421,0.3047650515607128,2025-04-24 22:00:26.599232,2025-04-24 22:00:32.831181,0 days 00:00:06.231949,0.030239448340020087,12,,1,20,1485,0.9807224808876864,TPESampler,COMPLETE
1422,0.26683107643164666,2025-04-24 22:00:28.014736,2025-04-24 22:00:31.564026,0 days 00:00:03.549290,0.09750964296415048,9,,1,11,1087,0.6896706194939608,TPESampler,COMPLETE
1423,0.47428574618322894,2025-04-24 22:00:28.677318,2025-04-24 22:00:30.339903,0 days 00:00:01.662585,0.012450790391949964,4,sqrt,6,13,1033,0.9858612999077134,TPESampler,COMPLETE
1424,0.28495845884788285,2025-04-24 22:00:30.551736,2025-04-24 22:00:34.251212,0 days 00:00:03.699476,0.08966302787462457,7,,1,14,1310,0.7022585807595432,TPESampler,COMPLETE
1425,0.27946234213403465,2025-04-24 22:00:31.756686,2025-04-24 22:00:34.493486,0 days 00:00:02.736800,0.07143113800001476,10,,1,11,844,0.7215033445319143,TPESampler,COMPLETE
1426,0.3452914862354792,2025-04-24 22:00:33.113507,2025-04-24 22:00:36.554177,0 days 00:00:03.440670,0.06686258691003412,9,,2,11,1073,0.6870475526588352,TPESampler,COMPLETE
1427,0.3967735170454869,2025-04-24 22:00:34.452584,2025-04-24 22:00:36.473597,0 days 00:00:02.021013,0.08996092551122171,9,log2,3,16,1204,0.6799685185247193,TPESampler,COMPLETE
1428,0.27554040450834255,2025-04-24 22:00:34.679887,2025-04-24 22:00:38.783897,0 days 00:00:04.104010,0.05557859931218093,6,,1,9,1461,0.6277804287170156,TPESampler,COMPLETE
1429,0.2657060351651528,2025-04-24 22:00:36.645355,2025-04-24 22:00:39.974413,0 days 00:00:03.329058,0.09019107115456808,8,,1,11,1135,0.7230481864310505,TPESampler,COMPLETE
1430,0.2619890269509696,2025-04-24 22:00:36.760827,2025-04-24 22:00:39.560769,0 days 00:00:02.799942,0.0715030962105883,8,,1,11,873,0.7610493020421452,TPESampler,COMPLETE
1431,0.3497721625802461,2025-04-24 22:00:38.984666,2025-04-24 22:00:41.215391,0 days 00:00:02.230725,0.07608321129565307,7,log2,1,12,1263,0.6785689436998747,TPESampler,COMPLETE
1432,0.4197455919348239,2025-04-24 22:00:39.816142,2025-04-24 22:00:42.388172,0 days 00:00:02.572030,0.015250278235214723,6,,7,16,735,0.7926687444891316,TPESampler,COMPLETE
1433,0.34389362919721106,2025-04-24 22:00:40.211680,2025-04-24 22:00:43.683873,0 days 00:00:03.472193,0.0986271178476326,8,,2,12,1084,0.7617777434619735,TPESampler,COMPLETE
1434,0.3522046884776965,2025-04-24 22:00:41.414870,2025-04-24 22:00:44.395916,0 days 00:00:02.981046,0.07848890687892192,10,,2,13,869,0.7950314633916488,TPESampler,COMPLETE
1435,0.2877289841692108,2025-04-24 22:00:42.586508,2025-04-24 22:00:45.707543,0 days 00:00:03.121035,0.06559655185603028,8,,1,7,928,0.7757571810671099,TPESampler,COMPLETE
1436,0.2889952971174324,2025-04-24 22:00:43.880440,2025-04-24 22:00:45.904794,0 days 00:00:02.024354,0.05458549423815991,8,,1,9,502,0.7563669617792579,TPESampler,COMPLETE
1437,0.4782479396581177,2025-04-24 22:00:44.609816,2025-04-24 22:00:45.796078,0 days 00:00:01.186262,0.013708282961695415,9,log2,1,17,491,0.8018332567546926,TPESampler,COMPLETE
1438,0.6506673470286546,2025-04-24 22:00:45.875289,2025-04-24 22:00:47.194139,0 days 00:00:01.318850,0.04150622017067809,12,sqrt,6,10,166,0.6283927775161785,TPESampler,COMPLETE
1439,0.3561115915183188,2025-04-24 22:00:46.023463,2025-04-24 22:00:48.369033,0 days 00:00:02.345570,0.05319528467383845,7,sqrt,2,13,1210,0.6192882491252076,TPESampler,COMPLETE
1440,0.36535354826601674,2025-04-24 22:00:46.269920,2025-04-24 22:00:49.754228,0 days 00:00:03.484308,0.09164387886432412,9,,3,9,1017,0.7514913838018971,TPESampler,COMPLETE
1441,0.2786719080469361,2025-04-24 22:00:47.392382,2025-04-24 22:00:50.679499,0 days 00:00:03.287117,0.08360660122178597,8,,1,10,1014,0.7601629877542496,TPESampler,COMPLETE
1442,0.2757634314814794,2025-04-24 22:00:48.571216,2025-04-24 22:00:52.035918,0 days 00:00:03.464702,0.061750827287868945,7,,1,9,1126,0.6043817258300943,TPESampler,COMPLETE
1443,0.5313612542462048,2025-04-24 22:00:49.956661,2025-04-24 22:00:52.102966,0 days 00:00:02.146305,0.019235796758827667,5,log2,5,6,1409,0.8737595305740719,TPESampler,COMPLETE
1444,0.4319518996351027,2025-04-24 22:00:50.915905,2025-04-24 22:00:53.064711,0 days 00:00:02.148806,0.041667535876111564,3,sqrt,5,20,855,0.9412129405526339,TPESampler,COMPLETE
1445,0.27727040285803306,2025-04-24 22:00:52.214898,2025-04-24 22:00:56.159078,0 days 00:00:03.944180,0.06995622653345802,8,,1,12,875,0.8107710009557745,TPESampler,COMPLETE
1446,0.3074061543507786,2025-04-24 22:00:52.258792,2025-04-24 22:00:55.241925,0 days 00:00:02.983133,0.05658480416572616,8,sqrt,1,11,1133,0.7491728841373736,TPESampler,COMPLETE
1447,0.39155385392176423,2025-04-24 22:00:53.294748,2025-04-24 22:00:55.915040,0 days 00:00:02.620292,0.05205377284810289,5,sqrt,5,16,1442,0.6082021809692345,TPESampler,COMPLETE
1448,0.28698332656804476,2025-04-24 22:00:55.453800,2025-04-24 22:00:57.715179,0 days 00:00:02.261379,0.07421036928079872,6,,1,11,655,0.8036178704626824,TPESampler,COMPLETE
1449,0.335422521296069,2025-04-24 22:00:56.124240,2025-04-24 22:00:58.623276,0 days 00:00:02.499036,0.04958845016646229,7,,3,5,807,0.8021835785677724,TPESampler,COMPLETE
1450,0.31494245675834276,2025-04-24 22:00:56.388011,2025-04-24 22:00:58.578183,0 days 00:00:02.190172,0.07084014143319423,8,,2,11,659,0.7285877402456792,TPESampler,COMPLETE
1451,0.29977134244012854,2025-04-24 22:00:57.913605,2025-04-24 22:00:59.808736,0 days 00:00:01.895131,0.048865004129539286,10,sqrt,1,11,895,0.8439247040122582,TPESampler,COMPLETE
1452,0.2683014441461177,2025-04-24 22:00:58.743649,2025-04-24 22:01:02.253020,0 days 00:00:03.509371,0.0988554004803189,7,,1,11,1152,0.6908691123374819,TPESampler,COMPLETE
1453,0.6634478953218832,2025-04-24 22:00:58.792597,2025-04-24 22:01:00.057918,0 days 00:00:01.265321,0.0962185241966546,10,sqrt,10,19,261,0.8305506846959194,TPESampler,COMPLETE
1454,0.6136422241352653,2025-04-24 22:01:00.013388,2025-04-24 22:01:03.084018,0 days 00:00:03.070630,0.02860000169728291,9,,9,3,1082,0.9080054816413626,TPESampler,COMPLETE
1455,0.3467161483461057,2025-04-24 22:01:00.316097,2025-04-24 22:01:04.071889,0 days 00:00:03.755792,0.09388368071479618,8,,2,11,1322,0.7082041323574481,TPESampler,COMPLETE
1456,0.3220576920668004,2025-04-24 22:01:02.461163,2025-04-24 22:01:04.217596,0 days 00:00:01.756433,0.01696788624871258,12,sqrt,1,5,842,0.6608077973295612,TPESampler,COMPLETE
1457,0.34635990764719393,2025-04-24 22:01:03.290394,2025-04-24 22:01:06.049487,0 days 00:00:02.759093,0.09970053177052988,8,,3,11,785,0.7100356741534388,TPESampler,COMPLETE
1458,0.2876018392607158,2025-04-24 22:01:04.267570,2025-04-24 22:01:07.694561,0 days 00:00:03.426991,0.09687334033559175,5,,1,11,1347,0.6893868039525213,TPESampler,COMPLETE
1459,0.2790583437480335,2025-04-24 22:01:04.422390,2025-04-24 22:01:07.601010,0 days 00:00:03.178620,0.05694918292153076,9,,1,9,891,0.7560104652140615,TPESampler,COMPLETE
1460,0.4125871926490949,2025-04-24 22:01:06.245597,2025-04-24 22:01:08.028730,0 days 00:00:01.783133,0.027416156877995083,3,sqrt,4,13,983,0.9919792680454731,TPESampler,COMPLETE
1461,0.3913753589977655,2025-04-24 22:01:07.788811,2025-04-24 22:01:09.946036,0 days 00:00:02.157225,0.024093591320305294,7,log2,1,20,1049,0.889154746539139,TPESampler,COMPLETE
1462,0.3410676291149031,2025-04-24 22:01:07.875640,2025-04-24 22:01:12.466842,0 days 00:00:04.591202,0.08682417995799843,8,,2,12,1499,0.6685441899346435,TPESampler,COMPLETE
1463,0.32727613054111937,2025-04-24 22:01:08.284777,2025-04-24 22:01:11.745084,0 days 00:00:03.460307,0.09828824465428489,7,,2,15,1105,0.7531030636631192,TPESampler,COMPLETE
1464,0.7087661851370975,2025-04-24 22:01:10.141756,2025-04-24 22:01:11.502760,0 days 00:00:01.361004,0.015525865583291136,7,log2,5,9,581,0.8825532620692151,TPESampler,COMPLETE
1465,0.3357624806731028,2025-04-24 22:01:11.692939,2025-04-24 22:01:14.307469,0 days 00:00:02.614530,0.07021466217249657,7,,3,10,873,0.7718469799552927,TPESampler,COMPLETE
1466,0.35616028967127517,2025-04-24 22:01:12.013676,2025-04-24 22:01:15.415516,0 days 00:00:03.401840,0.08819468737449004,9,,3,13,1035,0.7081146733626255,TPESampler,COMPLETE
1467,0.28528053441127066,2025-04-24 22:01:12.879620,2025-04-24 22:01:15.832844,0 days 00:00:02.953224,0.04678581049727717,9,,1,13,792,0.7974986455168868,TPESampler,COMPLETE
1468,0.36196055310694986,2025-04-24 22:01:14.504921,2025-04-24 22:01:16.987842,0 days 00:00:02.482921,0.06895151230379215,5,log2,1,7,1469,0.685545155785714,TPESampler,COMPLETE
1469,0.2853259838013172,2025-04-24 22:01:15.622053,2025-04-24 22:01:19.582816,0 days 00:00:03.960763,0.07025046921368217,8,,1,13,1215,0.6109355600799419,TPESampler,COMPLETE
1470,0.3735035729476541,2025-04-24 22:01:16.083508,2025-04-24 22:01:18.346409,0 days 00:00:02.262901,0.0938939880907451,8,sqrt,4,18,1102,0.7431180894508042,TPESampler,COMPLETE
1471,0.34249717501240473,2025-04-24 22:01:17.206663,2025-04-24 22:01:20.492092,0 days 00:00:03.285429,0.06804099364096537,8,,2,9,983,0.7108596422221559,TPESampler,COMPLETE
1472,0.30190492079164194,2025-04-24 22:01:18.542595,2025-04-24 22:01:20.768044,0 days 00:00:02.225449,0.06909979325389015,5,,1,11,761,0.6002627170516847,TPESampler,COMPLETE
1473,0.28796502858384254,2025-04-24 22:01:19.781578,2025-04-24 22:01:23.557892,0 days 00:00:03.776314,0.09844832684921107,8,,1,16,1062,0.8118118995555627,TPESampler,COMPLETE
1474,0.34030602253722686,2025-04-24 22:01:20.813371,2025-04-24 22:01:22.557486,0 days 00:00:01.744115,0.03290918805369014,9,,3,11,455,0.896686020492078,TPESampler,COMPLETE
1475,0.2731253835113377,2025-04-24 22:01:20.992247,2025-04-24 22:01:24.690069,0 days 00:00:03.697822,0.09842898584270499,8,,1,9,1260,0.709645723298394,TPESampler,COMPLETE
1476,0.37546507206224095,2025-04-24 22:01:22.755113,2025-04-24 22:01:26.146651,0 days 00:00:03.391538,0.09758929256061552,8,,2,5,1173,0.6004979255609082,TPESampler,COMPLETE
1477,0.26941372328579527,2025-04-24 22:01:23.771881,2025-04-24 22:01:26.995111,0 days 00:00:03.223230,0.09631931951407866,9,,1,13,979,0.7080932361855123,TPESampler,COMPLETE
1478,0.41880868925771564,2025-04-24 22:01:24.894377,2025-04-24 22:01:27.501849,0 days 00:00:02.607472,0.07543162698730722,11,,6,9,666,0.8502992815485751,TPESampler,COMPLETE
1479,0.27604495278189756,2025-04-24 22:01:26.338624,2025-04-24 22:01:29.400717,0 days 00:00:03.062093,0.08269382459539687,9,,1,9,896,0.6924325839737756,TPESampler,COMPLETE
1480,0.27314802523355913,2025-04-24 22:01:27.190719,2025-04-24 22:01:31.111476,0 days 00:00:03.920757,0.06145134402899429,8,,1,11,1308,0.6778316085190773,TPESampler,COMPLETE
1481,0.35775318363056074,2025-04-24 22:01:27.724684,2025-04-24 22:01:29.453632,0 days 00:00:01.728948,0.05302253576534857,9,log2,1,19,839,0.663144848006636,TPESampler,COMPLETE
1482,0.3269154057028529,2025-04-24 22:01:29.588872,2025-04-24 22:01:32.047731,0 days 00:00:02.458859,0.036000151583444814,7,,3,11,677,0.7894964981507795,TPESampler,COMPLETE
1483,0.3009137008465612,2025-04-24 22:01:29.641753,2025-04-24 22:01:31.681379,0 days 00:00:02.039626,0.08567705887338041,9,sqrt,1,9,774,0.7011408536162703,TPESampler,COMPLETE
1484,0.277836205828135,2025-04-24 22:01:31.309633,2025-04-24 22:01:34.550036,0 days 00:00:03.240403,0.09495460687142088,9,,1,9,885,0.8305565902702612,TPESampler,COMPLETE
1485,0.7996247828526221,2025-04-24 22:01:31.883497,2025-04-24 22:01:32.971198,0 days 00:00:01.087701,0.0244967616790176,11,log2,7,5,349,0.9554857929312054,TPESampler,COMPLETE
1486,0.28207628358402176,2025-04-24 22:01:32.312864,2025-04-24 22:01:36.191764,0 days 00:00:03.878900,0.0843710210822266,8,,1,10,1215,0.8187840707258544,TPESampler,COMPLETE
1487,0.28347014761979156,2025-04-24 22:01:33.230165,2025-04-24 22:01:36.880426,0 days 00:00:03.650261,0.07893563628558414,7,,1,10,1194,0.6973294042179946,TPESampler,COMPLETE
1488,0.28369323705840044,2025-04-24 22:01:34.756621,2025-04-24 22:01:38.155243,0 days 00:00:03.398622,0.09723596615554171,8,,1,12,1009,0.7787144170142296,TPESampler,COMPLETE
1489,0.7225150791616491,2025-04-24 22:01:36.389427,2025-04-24 22:01:38.089122,0 days 00:00:01.699695,0.030173122344243228,12,log2,8,8,953,0.6406889458766118,TPESampler,COMPLETE
1490,0.45518226820562224,2025-04-24 22:01:37.120288,2025-04-24 22:01:39.683224,0 days 00:00:02.562936,0.01123279111610499,11,sqrt,7,16,1439,0.9829186434403718,TPESampler,COMPLETE
1491,0.6035375889395962,2025-04-24 22:01:38.287579,2025-04-24 22:01:40.066072,0 days 00:00:01.778493,0.019109661110695706,12,,10,20,130,0.9778458591606695,TPESampler,COMPLETE
1492,0.3704333912145144,2025-04-24 22:01:38.335189,2025-04-24 22:01:40.990293,0 days 00:00:02.655104,0.038247227553999175,7,log2,1,14,1047,0.6327355890850925,TPESampler,COMPLETE
1493,0.5617132465413148,2025-04-24 22:01:39.902613,2025-04-24 22:01:42.671147,0 days 00:00:02.768534,0.010762219416105197,3,log2,2,14,1399,0.9281805850977931,TPESampler,COMPLETE
1494,0.35492211439845095,2025-04-24 22:01:40.288247,2025-04-24 22:01:42.697759,0 days 00:00:02.409512,0.08813575779959901,6,sqrt,3,7,745,0.7592683894458401,TPESampler,COMPLETE
1495,0.5087893863322676,2025-04-24 22:01:41.200370,2025-04-24 22:01:42.536477,0 days 00:00:01.336107,0.046132121037206854,9,log2,1,20,133,0.6167331050436003,TPESampler,COMPLETE
1496,0.4494121784460101,2025-04-24 22:01:42.742987,2025-04-24 22:01:44.392533,0 days 00:00:01.649546,0.08656621958444456,8,,7,20,408,0.6358389546608646,TPESampler,COMPLETE
1497,0.284789590332961,2025-04-24 22:01:42.905852,2025-04-24 22:01:46.530972,0 days 00:00:03.625120,0.09574793885082661,9,,1,9,1088,0.6500048342111299,TPESampler,COMPLETE
