number,value,datetime_start,datetime_complete,duration,params_learning_rate,params_max_depth,params_max_features,params_min_samples_leaf,params_min_samples_split,params_n_estimators,params_subsample,system_attrs_auto:sampler,state
374,0.2806142881383976,2025-04-24 21:41:51.886438,2025-04-24 21:41:55.795516,0 days 00:00:03.909078,0.08485811834349996,8,,1,12,1431,0.7313546291013038,TPESampler,COMPLETE
375,0.27630896796426707,2025-04-24 21:41:52.942872,2025-04-24 21:41:55.260939,0 days 00:00:02.318067,0.07503686586151251,8,,1,20,771,0.7320788150411329,TPESampler,COMPLETE
376,0.27735575684476904,2025-04-24 21:41:53.063715,2025-04-24 21:41:57.086500,0 days 00:00:04.022785,0.029808524688955368,12,,1,8,1352,0.6121138299733949,TPESampler,COMPLETE
377,0.3987866916825154,2025-04-24 21:41:55.446416,2025-04-24 21:41:57.058344,0 days 00:00:01.611928,0.012771337749154975,7,sqrt,2,20,809,0.7456332987549636,TPESampler,COMPLETE
378,0.44282261192670525,2025-04-24 21:41:55.987744,2025-04-24 21:41:58.059725,0 days 00:00:02.071981,0.03629239673865826,11,,8,3,513,0.8952401428495086,TPESampler,COMPLETE
379,0.28615972095837255,2025-04-24 21:41:57.189536,2025-04-24 21:42:00.891971,0 days 00:00:03.702435,0.0789054755548306,6,,1,14,1489,0.7983121168378327,TPESampler,COMPLETE
380,0.32814379624703127,2025-04-24 21:41:57.231024,2025-04-24 21:42:00.868197,0 days 00:00:03.637173,0.05583009439012957,9,,2,20,1465,0.6369350878227952,TPESampler,COMPLETE
381,0.3095444277629111,2025-04-24 21:41:58.254657,2025-04-24 21:42:01.662177,0 days 00:00:03.407520,0.019721146649644312,9,,3,19,1391,0.6915697189404406,TPESampler,COMPLETE
382,0.36314624356911196,2025-04-24 21:42:00.987688,2025-04-24 21:42:05.034664,0 days 00:00:04.046976,0.09092664105771478,10,,2,16,1445,0.750839411400836,TPESampler,COMPLETE
383,0.35363283202845414,2025-04-24 21:42:01.052152,2025-04-24 21:42:04.721805,0 days 00:00:03.669653,0.09600621753091651,12,,2,15,1347,0.737184206790313,TPESampler,COMPLETE
384,0.27990353154227965,2025-04-24 21:42:01.853516,2025-04-24 21:42:05.376470,0 days 00:00:03.522954,0.095257674830605,8,,1,16,1402,0.6614586905845062,TPESampler,COMPLETE
385,0.3808172013664821,2025-04-24 21:42:04.902020,2025-04-24 21:42:06.486338,0 days 00:00:01.584318,0.06729436363049608,8,log2,2,10,851,0.821545949770499,TPESampler,COMPLETE
386,0.28707018851894983,2025-04-24 21:42:05.227196,2025-04-24 21:42:10.477305,0 days 00:00:05.250109,0.031017113497915957,11,,1,20,1358,0.7818994994443802,TPESampler,COMPLETE
387,0.3368178155101438,2025-04-24 21:42:05.639060,2025-04-24 21:42:09.537527,0 days 00:00:03.898467,0.08704170811154713,7,,2,12,1196,0.8241470781516673,TPESampler,COMPLETE
388,0.29568526594599476,2025-04-24 21:42:06.668625,2025-04-24 21:42:09.118682,0 days 00:00:02.450057,0.08457082420702304,9,log2,1,7,1299,0.6117585497056491,TPESampler,COMPLETE
389,0.2761697682877041,2025-04-24 21:42:09.376182,2025-04-24 21:42:14.318097,0 days 00:00:04.941915,0.08658021319395699,7,,1,16,1496,0.7412344539287056,TPESampler,COMPLETE
390,0.6386163913393806,2025-04-24 21:42:09.854344,2025-04-24 21:42:12.132545,0 days 00:00:02.278201,0.0852569892673541,9,sqrt,9,10,838,0.9475178685227448,TPESampler,COMPLETE
391,0.286468958860795,2025-04-24 21:42:10.698486,2025-04-24 21:42:15.755632,0 days 00:00:05.057146,0.043175472227267135,11,,1,20,1383,0.6955994579787863,TPESampler,COMPLETE
392,0.41823477540993503,2025-04-24 21:42:12.323108,2025-04-24 21:42:14.393392,0 days 00:00:02.070284,0.018528214442079607,6,sqrt,6,19,1311,0.9724976530553402,TPESampler,COMPLETE
393,0.28279227956700076,2025-04-24 21:42:14.486122,2025-04-24 21:42:18.374641,0 days 00:00:03.888519,0.048790514026009354,9,,1,19,1350,0.7204426479215132,TPESampler,COMPLETE
394,0.3305755488972099,2025-04-24 21:42:14.560936,2025-04-24 21:42:17.407531,0 days 00:00:02.846595,0.05932152050402262,9,,2,19,869,0.8833619106808199,TPESampler,COMPLETE
395,0.3455646517717508,2025-04-24 21:42:15.933271,2025-04-24 21:42:20.285531,0 days 00:00:04.352260,0.07222114717244349,9,,2,13,1500,0.725544376088173,TPESampler,COMPLETE
396,0.45157395422416435,2025-04-24 21:42:17.605676,2025-04-24 21:42:18.673939,0 days 00:00:01.068263,0.07761002576138815,12,sqrt,5,19,327,0.6109137821028932,TPESampler,COMPLETE
397,0.7399330022312711,2025-04-24 21:42:18.598194,2025-04-24 21:42:20.764535,0 days 00:00:02.166341,0.011680586100142599,3,log2,8,20,1483,0.768751810096188,TPESampler,COMPLETE
398,0.26720391185909337,2025-04-24 21:42:18.918119,2025-04-24 21:42:23.257022,0 days 00:00:04.338903,0.05706391611963335,8,,1,17,1370,0.7025762750807313,TPESampler,COMPLETE
399,0.31952595070696693,2025-04-24 21:42:20.527614,2025-04-24 21:42:22.159068,0 days 00:00:01.631454,0.07799764809453613,10,sqrt,1,17,727,0.744789241913479,TPESampler,COMPLETE
400,0.28977046826253217,2025-04-24 21:42:21.017531,2025-04-24 21:42:24.420651,0 days 00:00:03.403120,0.08903826782047461,9,,1,13,1010,0.7760589347156241,TPESampler,COMPLETE
401,0.5897232427263087,2025-04-24 21:42:22.351948,2025-04-24 21:42:23.351526,0 days 00:00:00.999578,0.019070822682612374,9,log2,2,18,376,0.6405172662927381,TPESampler,COMPLETE
402,0.31821085215171896,2025-04-24 21:42:23.428394,2025-04-24 21:42:27.071800,0 days 00:00:03.643406,0.03652815363876706,8,,2,17,1464,0.7149117516000472,TPESampler,COMPLETE
403,0.284683829188424,2025-04-24 21:42:23.503736,2025-04-24 21:42:26.817115,0 days 00:00:03.313379,0.04457813230416759,8,,1,16,1299,0.6765547155691862,TPESampler,COMPLETE
404,0.34036961164468427,2025-04-24 21:42:24.596333,2025-04-24 21:42:28.234991,0 days 00:00:03.638658,0.06538240517863146,8,,2,15,1487,0.7089540185429766,TPESampler,COMPLETE
405,0.27744030500453015,2025-04-24 21:42:26.995302,2025-04-24 21:42:31.677937,0 days 00:00:04.682635,0.058168383609208146,7,,1,18,1397,0.7222982006605062,TPESampler,COMPLETE
406,0.8327865652194021,2025-04-24 21:42:27.362361,2025-04-24 21:42:28.110182,0 days 00:00:00.747821,0.021387677960476057,8,sqrt,10,5,100,0.8735298753810633,TPESampler,COMPLETE
407,0.3257255002748536,2025-04-24 21:42:28.286878,2025-04-24 21:42:31.673924,0 days 00:00:03.387046,0.044553788545023454,8,,2,10,1130,0.8241726749018967,TPESampler,COMPLETE
408,0.27533223933198125,2025-04-24 21:42:28.475511,2025-04-24 21:42:32.417744,0 days 00:00:03.942233,0.05845044284943865,9,,1,15,1494,0.7345130243608026,TPESampler,COMPLETE
409,0.3511712364404186,2025-04-24 21:42:31.827930,2025-04-24 21:42:35.354138,0 days 00:00:03.526208,0.06717807003991584,8,,4,16,1059,0.7655108814196236,TPESampler,COMPLETE
410,0.33643230260640306,2025-04-24 21:42:31.903925,2025-04-24 21:42:36.393388,0 days 00:00:04.489463,0.054973932362089716,11,,3,16,1464,0.6479190754488738,TPESampler,COMPLETE
411,0.3824541577942828,2025-04-24 21:42:32.720459,2025-04-24 21:42:34.830211,0 days 00:00:02.109752,0.06832760523394485,6,log2,3,14,1269,0.8031435907372088,TPESampler,COMPLETE
412,0.288067656687238,2025-04-24 21:42:35.014428,2025-04-24 21:42:37.692138,0 days 00:00:02.677710,0.08302581687293385,7,,1,13,861,0.9163649637643181,TPESampler,COMPLETE
413,0.26682028976582844,2025-04-24 21:42:35.538869,2025-04-24 21:42:38.829609,0 days 00:00:03.290740,0.07797406478163635,8,,1,16,1194,0.6838673841161449,TPESampler,COMPLETE
414,0.35764755192267467,2025-04-24 21:42:36.586302,2025-04-24 21:42:40.734416,0 days 00:00:04.148114,0.03314721781815178,8,,4,12,1494,0.7585159937218267,TPESampler,COMPLETE
415,0.28899082281022215,2025-04-24 21:42:37.887756,2025-04-24 21:42:41.990586,0 days 00:00:04.102830,0.02688824255865146,12,,1,17,1166,0.6928651579689844,TPESampler,COMPLETE
416,0.44053050998744975,2025-04-24 21:42:39.013255,2025-04-24 21:42:41.094072,0 days 00:00:02.080817,0.08907936817952951,4,sqrt,8,13,1390,0.9555176645434551,TPESampler,COMPLETE
417,0.4523328547390658,2025-04-24 21:42:40.955883,2025-04-24 21:42:43.310667,0 days 00:00:02.354784,0.01688694145957158,12,sqrt,6,2,1282,0.7664945687542265,TPESampler,COMPLETE
418,0.3595522320266141,2025-04-24 21:42:41.281216,2025-04-24 21:42:43.818253,0 days 00:00:02.537037,0.029980613731791447,12,log2,1,19,1015,0.6505473754290411,TPESampler,COMPLETE
419,0.28451388715013176,2025-04-24 21:42:42.207764,2025-04-24 21:42:46.144636,0 days 00:00:03.936872,0.09553072074199186,9,,1,12,1402,0.6139137149585564,TPESampler,COMPLETE
420,0.2735945094412825,2025-04-24 21:42:43.489030,2025-04-24 21:42:46.873986,0 days 00:00:03.384956,0.06953915192183976,6,,1,17,1314,0.6009152082099386,TPESampler,COMPLETE
421,0.33041963582721023,2025-04-24 21:42:44.211709,2025-04-24 21:42:47.342693,0 days 00:00:03.130984,0.06608819625824747,8,,2,17,1109,0.7492915464579263,TPESampler,COMPLETE
422,0.29793741889285363,2025-04-24 21:42:46.594407,2025-04-24 21:42:49.593657,0 days 00:00:02.999250,0.08042626384683584,4,,1,14,1127,0.6501650013911601,TPESampler,COMPLETE
423,0.30620950657846757,2025-04-24 21:42:47.137289,2025-04-24 21:42:50.890118,0 days 00:00:03.752829,0.04312900023180883,4,,1,17,1336,0.6098824342734012,TPESampler,COMPLETE
424,0.2850775668203295,2025-04-24 21:42:47.893755,2025-04-24 21:42:52.638245,0 days 00:00:04.744490,0.06464468537894544,7,,1,17,1455,0.6090127248909993,TPESampler,COMPLETE
425,0.39981847489609945,2025-04-24 21:42:49.827967,2025-04-24 21:42:53.100399,0 days 00:00:03.272432,0.09993058669246568,9,log2,4,6,1440,0.9504808950667619,TPESampler,COMPLETE
426,0.3199465209577009,2025-04-24 21:42:51.129631,2025-04-24 21:42:54.688803,0 days 00:00:03.559172,0.07993429037012295,6,,3,14,1437,0.6594067390881956,TPESampler,COMPLETE
427,0.34063910420281557,2025-04-24 21:42:53.236372,2025-04-24 21:42:56.666242,0 days 00:00:03.429870,0.060736851818809445,8,,2,10,1019,0.7250128956178201,TPESampler,COMPLETE
428,0.2936541776263444,2025-04-24 21:42:53.311854,2025-04-24 21:42:57.186098,0 days 00:00:03.874244,0.07933420080469455,5,,1,18,1327,0.6675932377046696,TPESampler,COMPLETE
429,0.2752577940426057,2025-04-24 21:42:55.201055,2025-04-24 21:42:59.224021,0 days 00:00:04.022966,0.07696116001619155,7,,1,13,1403,0.6730553488063344,TPESampler,COMPLETE
430,0.33437179919591475,2025-04-24 21:42:56.890179,2025-04-24 21:42:59.117172,0 days 00:00:02.226993,0.07279171741828677,8,log2,1,12,1210,0.7252989762038888,TPESampler,COMPLETE
431,0.40367419592537895,2025-04-24 21:42:57.383013,2025-04-24 21:43:00.937218,0 days 00:00:03.554205,0.024100862482417655,3,,6,20,1384,0.9365884241774521,TPESampler,COMPLETE
432,0.37452693951598315,2025-04-24 21:42:59.308246,2025-04-24 21:43:02.185630,0 days 00:00:02.877384,0.039359782566044534,6,log2,1,12,1351,0.663940322990435,TPESampler,COMPLETE
433,0.7012383183474565,2025-04-24 21:42:59.470453,2025-04-24 21:43:01.230251,0 days 00:00:01.759798,0.06060586367710455,10,log2,9,7,622,0.6260882138056663,TPESampler,COMPLETE
434,0.4198527546424541,2025-04-24 21:43:01.169262,2025-04-24 21:43:03.117594,0 days 00:00:01.948332,0.04358873307016378,4,,6,8,415,0.7780104425257943,TPESampler,COMPLETE
435,0.5296128260425688,2025-04-24 21:43:01.465366,2025-04-24 21:43:03.920375,0 days 00:00:02.455009,0.02187926336215218,11,log2,6,10,1492,0.8429805994911629,TPESampler,COMPLETE
436,0.28704676190739775,2025-04-24 21:43:02.549758,2025-04-24 21:43:07.126279,0 days 00:00:04.576521,0.04412167550773125,8,,1,10,1370,0.7855871958711333,TPESampler,COMPLETE
437,0.8602176381186355,2025-04-24 21:43:03.372541,2025-04-24 21:43:04.555813,0 days 00:00:01.183272,0.013724478055774855,8,log2,9,9,363,0.963822197890892,TPESampler,COMPLETE
438,0.7047528615792424,2025-04-24 21:43:04.152574,2025-04-24 21:43:05.696028,0 days 00:00:01.543454,0.03660800317669265,3,log2,10,6,834,0.6825239844572919,TPESampler,COMPLETE
439,0.2710696906812464,2025-04-24 21:43:04.734809,2025-04-24 21:43:08.572195,0 days 00:00:03.837386,0.04414482994210661,8,,1,10,1383,0.7114327597379403,TPESampler,COMPLETE
440,0.2819298627186077,2025-04-24 21:43:05.906296,2025-04-24 21:43:09.148180,0 days 00:00:03.241884,0.055038979742759765,8,,1,15,1237,0.6261735560784865,TPESampler,COMPLETE
441,0.2900644285893695,2025-04-24 21:43:07.360377,2025-04-24 21:43:10.664318,0 days 00:00:03.303941,0.08998498605718519,9,,1,20,1189,0.6262072458375718,TPESampler,COMPLETE
442,0.9154465649950019,2025-04-24 21:43:08.764063,2025-04-24 21:43:09.577452,0 days 00:00:00.813389,0.010766466052297982,7,log2,7,20,170,0.6399516530070823,TPESampler,COMPLETE
443,0.42943814351640436,2025-04-24 21:43:09.347433,2025-04-24 21:43:11.682749,0 days 00:00:02.335316,0.03260440195059602,4,,7,19,923,0.755416202353301,TPESampler,COMPLETE
444,0.2767671224845265,2025-04-24 21:43:09.788623,2025-04-24 21:43:13.775046,0 days 00:00:03.986423,0.08197416359690769,8,,1,15,1241,0.7373089740000678,TPESampler,COMPLETE
445,0.27097677794389885,2025-04-24 21:43:10.936118,2025-04-24 21:43:15.100783,0 days 00:00:04.164665,0.04024861232910645,7,,1,8,1455,0.6703823061540602,TPESampler,COMPLETE
446,0.5833421522947965,2025-04-24 21:43:11.872880,2025-04-24 21:43:13.805237,0 days 00:00:01.932357,0.014225101704168948,3,sqrt,6,3,1091,0.6008387652919748,TPESampler,COMPLETE
447,0.27934379680499016,2025-04-24 21:43:13.922573,2025-04-24 21:43:17.766271,0 days 00:00:03.843698,0.05542351549114342,9,,1,11,1198,0.7015345654882094,TPESampler,COMPLETE
448,0.2684976021880401,2025-04-24 21:43:13.970472,2025-04-24 21:43:17.905738,0 days 00:00:03.935266,0.05889413516963075,6,,1,9,1262,0.7805060885524455,TPESampler,COMPLETE
449,0.7618698880993882,2025-04-24 21:43:15.288132,2025-04-24 21:43:16.845540,0 days 00:00:01.557408,0.027025653381053557,8,log2,10,6,869,0.8729830997417244,TPESampler,COMPLETE
450,0.28106646979779726,2025-04-24 21:43:17.028670,2025-04-24 21:43:20.747413,0 days 00:00:03.718743,0.07686004579932122,5,,1,15,1458,0.6332293976704775,TPESampler,COMPLETE
451,0.2836422253602417,2025-04-24 21:43:17.949425,2025-04-24 21:43:21.761742,0 days 00:00:03.812317,0.07664694121452563,6,,1,8,1288,0.7531055177356767,TPESampler,COMPLETE
452,0.38746671966128987,2025-04-24 21:43:18.140575,2025-04-24 21:43:20.591580,0 days 00:00:02.451005,0.03984975854528035,6,log2,2,8,1286,0.8299774074663777,TPESampler,COMPLETE
453,0.3343286931851805,2025-04-24 21:43:20.754541,2025-04-24 21:43:24.044695,0 days 00:00:03.290154,0.038766712898275824,6,,3,7,1388,0.7026352444528216,TPESampler,COMPLETE
454,0.27812820172052816,2025-04-24 21:43:20.929684,2025-04-24 21:43:24.298434,0 days 00:00:03.368750,0.030250630452089092,6,,1,9,1385,0.668556908762839,TPESampler,COMPLETE
455,0.3523038764201595,2025-04-24 21:43:21.957707,2025-04-24 21:43:25.696273,0 days 00:00:03.738566,0.07669613864155633,5,,2,7,1494,0.8250773894129643,TPESampler,COMPLETE
456,0.6463914644602228,2025-04-24 21:43:24.255974,2025-04-24 21:43:26.630558,0 days 00:00:02.374584,0.04089954885579572,10,sqrt,9,15,1473,0.8993248148209321,TPESampler,COMPLETE
457,0.32639048206652654,2025-04-24 21:43:24.545260,2025-04-24 21:43:28.842404,0 days 00:00:04.297144,0.03484998800834674,7,,3,12,1410,0.6601945234994885,TPESampler,COMPLETE
458,0.33827705958129034,2025-04-24 21:43:25.894039,2025-04-24 21:43:29.564293,0 days 00:00:03.670254,0.0606713539982044,7,,2,9,1205,0.6771186758655053,TPESampler,COMPLETE
459,0.6313191557225899,2025-04-24 21:43:26.820247,2025-04-24 21:43:28.809406,0 days 00:00:01.989159,0.06290049790328206,4,sqrt,9,4,1128,0.6020176961652283,TPESampler,COMPLETE
460,0.35298867818846,2025-04-24 21:43:28.954644,2025-04-24 21:43:31.977265,0 days 00:00:03.022621,0.04044864279239993,3,,3,10,988,0.7877718523872516,TPESampler,COMPLETE
461,0.33077691618148003,2025-04-24 21:43:28.996384,2025-04-24 21:43:31.730341,0 days 00:00:02.733957,0.0775814219123363,7,sqrt,2,14,1346,0.7355321995418125,TPESampler,COMPLETE
462,0.27283544577436175,2025-04-24 21:43:29.779453,2025-04-24 21:43:33.812379,0 days 00:00:04.032926,0.08739347334878782,7,,1,12,1343,0.6107187251510096,TPESampler,COMPLETE
463,0.32537114418790053,2025-04-24 21:43:31.933182,2025-04-24 21:43:34.201347,0 days 00:00:02.268165,0.051701713720472386,9,sqrt,3,17,1192,0.7512341317392759,TPESampler,COMPLETE
464,0.848371351686377,2025-04-24 21:43:32.226955,2025-04-24 21:43:33.292660,0 days 00:00:01.065705,0.012811271291301657,6,log2,4,4,226,0.9964641177916985,TPESampler,COMPLETE
465,0.2794117555696827,2025-04-24 21:43:33.496078,2025-04-24 21:43:36.231870,0 days 00:00:02.735792,0.09412325719856804,6,,1,11,1041,0.7534410960072443,TPESampler,COMPLETE
466,0.3082706131584663,2025-04-24 21:43:34.027471,2025-04-24 21:43:37.484074,0 days 00:00:03.456603,0.03676902204904322,5,,1,10,1429,0.8343022108583734,TPESampler,COMPLETE
467,0.3317581433982053,2025-04-24 21:43:34.416876,2025-04-24 21:43:38.021516,0 days 00:00:03.604640,0.028350251615406413,7,,3,2,1481,0.7355162528497506,TPESampler,COMPLETE
468,0.2761952909403281,2025-04-24 21:43:36.435112,2025-04-24 21:43:39.498848,0 days 00:00:03.063736,0.09966563405416927,7,,1,11,1223,0.6108586343623333,TPESampler,COMPLETE
469,0.4666111571868171,2025-04-24 21:43:37.811462,2025-04-24 21:43:39.728391,0 days 00:00:01.916929,0.019821515387385358,10,,7,10,652,0.6028731167325024,TPESampler,COMPLETE
470,0.2913706215078114,2025-04-24 21:43:38.233552,2025-04-24 21:43:41.308558,0 days 00:00:03.075006,0.05272146295110161,6,,1,7,1021,0.8321180495570936,TPESampler,COMPLETE
471,0.7207829986646205,2025-04-24 21:43:39.678740,2025-04-24 21:43:41.584149,0 days 00:00:01.905409,0.01664580028889984,4,log2,10,4,1342,0.796182677770733,TPESampler,COMPLETE
472,0.3005446673353176,2025-04-24 21:43:39.977089,2025-04-24 21:43:42.996538,0 days 00:00:03.019449,0.06795933836076053,9,,1,8,672,0.853360559155224,TPESampler,COMPLETE
473,0.6671153321081673,2025-04-24 21:43:41.533497,2025-04-24 21:43:43.095191,0 days 00:00:01.561694,0.024161364050327257,6,sqrt,10,11,982,0.9113921569209468,TPESampler,COMPLETE
474,0.28500094471786097,2025-04-24 21:43:41.821770,2025-04-24 21:43:45.444202,0 days 00:00:03.622432,0.03219272139874452,7,,1,10,1394,0.7189437051772928,TPESampler,COMPLETE
475,0.2752063803586148,2025-04-24 21:43:43.164857,2025-04-24 21:43:46.792222,0 days 00:00:03.627365,0.043130406523697894,8,,1,10,1372,0.7040435037211379,TPESampler,COMPLETE
476,0.266017078730848,2025-04-24 21:43:43.295091,2025-04-24 21:43:46.414919,0 days 00:00:03.119828,0.07890532896063579,8,,1,13,1153,0.7118968107575263,TPESampler,COMPLETE
477,0.32358937484321476,2025-04-24 21:43:45.622498,2025-04-24 21:43:48.059387,0 days 00:00:02.436889,0.04822494146911568,7,sqrt,1,9,1374,0.7677728676711736,TPESampler,COMPLETE
478,0.2736219916788363,2025-04-24 21:43:46.652447,2025-04-24 21:43:50.371752,0 days 00:00:03.719305,0.08199631472297565,9,,1,13,1042,0.6435883743786115,TPESampler,COMPLETE
479,0.48802883752937465,2025-04-24 21:43:47.016075,2025-04-24 21:43:49.616871,0 days 00:00:02.600796,0.012820180327785884,9,sqrt,7,16,1463,0.8467410573083634,TPESampler,COMPLETE
480,0.3767749654171932,2025-04-24 21:43:48.270024,2025-04-24 21:43:51.033997,0 days 00:00:02.763973,0.010987700266509314,12,log2,1,20,1434,0.7563762699034142,TPESampler,COMPLETE
481,0.33018399134523896,2025-04-24 21:43:49.816693,2025-04-24 21:43:53.345750,0 days 00:00:03.529057,0.06322817334092573,7,,2,11,1318,0.6786744290673655,TPESampler,COMPLETE
482,0.26968206703346403,2025-04-24 21:43:50.576307,2025-04-24 21:43:54.166284,0 days 00:00:03.589977,0.08373346695308022,10,,1,12,1207,0.734248182132137,TPESampler,COMPLETE
483,0.286727986407823,2025-04-24 21:43:51.235150,2025-04-24 21:43:53.858999,0 days 00:00:02.623849,0.05283592568627388,8,,1,10,834,0.8215483526763886,TPESampler,COMPLETE
484,0.2814973322693624,2025-04-24 21:43:53.531996,2025-04-24 21:43:57.039146,0 days 00:00:03.507150,0.06506644076249342,8,,1,11,1276,0.7954228413811256,TPESampler,COMPLETE
485,0.2850626449127403,2025-04-24 21:43:54.035191,2025-04-24 21:43:57.148230,0 days 00:00:03.113039,0.04500635128601632,7,,1,6,1214,0.7284832057066929,TPESampler,COMPLETE
486,0.3743515854844309,2025-04-24 21:43:54.364757,2025-04-24 21:43:57.834553,0 days 00:00:03.469796,0.08405387162253447,11,,3,12,1200,0.8005259557778693,TPESampler,COMPLETE
487,0.3265767997489608,2025-04-24 21:43:57.245484,2025-04-24 21:43:59.951100,0 days 00:00:02.705616,0.0810097085412786,7,,2,16,870,0.6879181101606319,TPESampler,COMPLETE
488,0.32859328269734345,2025-04-24 21:43:57.332976,2025-04-24 21:44:00.353099,0 days 00:00:03.020123,0.08221739691051115,9,,2,14,919,0.7036596895762408,TPESampler,COMPLETE
489,0.2785366087084619,2025-04-24 21:43:58.195148,2025-04-24 21:44:01.703243,0 days 00:00:03.508095,0.03948126717989455,7,,1,6,1352,0.6453285803560999,TPESampler,COMPLETE
490,0.2766854301556317,2025-04-24 21:44:00.141183,2025-04-24 21:44:03.312398,0 days 00:00:03.171215,0.07006428524262678,8,,1,13,1046,0.8603015962435073,TPESampler,COMPLETE
491,0.28437060789337,2025-04-24 21:44:00.555170,2025-04-24 21:44:04.074321,0 days 00:00:03.519151,0.0710059834417329,10,,1,11,1183,0.745017786016552,TPESampler,COMPLETE
492,0.3593465750838867,2025-04-24 21:44:01.885906,2025-04-24 21:44:05.548437,0 days 00:00:03.662531,0.08684573863297745,8,,4,14,1335,0.7163880190187809,TPESampler,COMPLETE
493,0.2812162772730697,2025-04-24 21:44:03.534020,2025-04-24 21:44:07.300823,0 days 00:00:03.766803,0.0423211173845766,7,,1,15,1165,0.7692604498203547,TPESampler,COMPLETE
494,0.39253468523771645,2025-04-24 21:44:04.295384,2025-04-24 21:44:06.488630,0 days 00:00:02.193246,0.042138902285850266,6,log2,2,6,1335,0.6981110231101478,TPESampler,COMPLETE
495,0.4145530557028441,2025-04-24 21:44:05.757675,2025-04-24 21:44:08.163110,0 days 00:00:02.405435,0.019306840457555777,12,sqrt,6,6,1451,0.9934386069951263,TPESampler,COMPLETE
496,0.2676715395999779,2025-04-24 21:44:06.688424,2025-04-24 21:44:10.452635,0 days 00:00:03.764211,0.06981261351692838,10,,1,13,1194,0.6921705031440734,TPESampler,COMPLETE
497,0.283547585420025,2025-04-24 21:44:07.520387,2025-04-24 21:44:11.546032,0 days 00:00:04.025645,0.07525277125383979,7,,1,13,1455,0.7472473988658568,TPESampler,COMPLETE
498,0.36596064556961905,2025-04-24 21:44:08.363639,2025-04-24 21:44:12.312430,0 days 00:00:03.948791,0.05828079812282654,9,,3,6,1382,0.8360048573580868,TPESampler,COMPLETE
