number,value,datetime_start,datetime_complete,duration,params_learning_rate,params_max_depth,params_max_features,params_min_samples_leaf,params_min_samples_split,params_n_estimators,params_subsample,system_attrs_auto:sampler,state
499,0.2800691911993235,2025-04-24 21:44:10.682402,2025-04-24 21:44:14.735615,0 days 00:00:04.053213,0.0789771490133075,9,,1,14,1178,0.7055296940880018,TPESampler,COMPLETE
500,0.49113346200799823,2025-04-24 21:44:11.739773,2025-04-24 21:44:13.560987,0 days 00:00:01.821214,0.029033519231580377,12,log2,4,14,1170,0.7384576135649779,TPESampler,COMPLETE
501,0.2833385033115906,2025-04-24 21:44:12.523623,2025-04-24 21:44:17.023795,0 days 00:00:04.500172,0.09507546984009817,12,,1,12,1220,0.6499975437122945,TPESampler,COMPLETE
502,0.40763543031424393,2025-04-24 21:44:13.751642,2025-04-24 21:44:15.659524,0 days 00:00:01.907882,0.03450646005481263,5,sqrt,5,10,1094,0.786123806386108,TPESampler,COMPLETE
503,0.525216104516206,2025-04-24 21:44:14.937397,2025-04-24 21:44:16.934718,0 days 00:00:01.997321,0.013511276704481793,7,log2,3,13,1259,0.8359111469810321,TPESampler,COMPLETE
504,0.28021156499493965,2025-04-24 21:44:15.857445,2025-04-24 21:44:19.545332,0 days 00:00:03.687887,0.05977005900197854,7,,1,16,1232,0.8062265083382526,TPESampler,COMPLETE
505,0.3331503309587113,2025-04-24 21:44:17.080287,2025-04-24 21:44:20.557445,0 days 00:00:03.477158,0.06425752605546518,10,,2,14,1165,0.6873666578945334,TPESampler,COMPLETE
506,0.2957849801755263,2025-04-24 21:44:17.219264,2025-04-24 21:44:19.609216,0 days 00:00:02.389952,0.07039056127832886,12,sqrt,1,13,1161,0.7313813770635602,TPESampler,COMPLETE
507,0.35000474385546276,2025-04-24 21:44:19.699783,2025-04-24 21:44:23.201552,0 days 00:00:03.501769,0.09341086764797522,8,,2,9,1062,0.7039671621477104,TPESampler,COMPLETE
508,0.41889288410161485,2025-04-24 21:44:19.760096,2025-04-24 21:44:22.011029,0 days 00:00:02.250933,0.08154131893460682,5,log2,4,10,1337,0.6719593786189015,TPESampler,COMPLETE
509,0.3540015751966791,2025-04-24 21:44:20.773494,2025-04-24 21:44:24.702029,0 days 00:00:03.928535,0.0384016133134614,12,,4,17,1217,0.7820782340669686,TPESampler,COMPLETE
510,0.28293037010672933,2025-04-24 21:44:22.207284,2025-04-24 21:44:26.224281,0 days 00:00:04.016997,0.09498153015182163,10,,1,12,1284,0.7872871722097191,TPESampler,COMPLETE
511,0.37803682681191375,2025-04-24 21:44:23.388521,2025-04-24 21:44:26.561060,0 days 00:00:03.172539,0.08779429745195946,12,,2,7,897,0.7727980239387314,TPESampler,COMPLETE
512,0.4120337175219706,2025-04-24 21:44:24.896598,2025-04-24 21:44:26.980939,0 days 00:00:02.084341,0.09847434788944207,12,sqrt,5,3,1218,0.8589920669782506,TPESampler,COMPLETE
513,0.26185825278024266,2025-04-24 21:44:26.420864,2025-04-24 21:44:29.537283,0 days 00:00:03.116419,0.09011635223144668,9,,1,13,1126,0.7294783891376715,TPESampler,COMPLETE
514,0.2878642008135149,2025-04-24 21:44:26.778050,2025-04-24 21:44:30.553099,0 days 00:00:03.775049,0.023531160352219846,8,,1,20,1464,0.7315999995578496,TPESampler,COMPLETE
515,0.36269885340205194,2025-04-24 21:44:27.228855,2025-04-24 21:44:31.128109,0 days 00:00:03.899254,0.07341339209071586,9,,3,15,1493,0.8097182733529197,TPESampler,COMPLETE
516,0.2796431196852659,2025-04-24 21:44:29.720149,2025-04-24 21:44:32.844889,0 days 00:00:03.124740,0.07076412967426622,9,,1,10,1090,0.7233161640044846,TPESampler,COMPLETE
517,0.2865611256896412,2025-04-24 21:44:30.748440,2025-04-24 21:44:34.628970,0 days 00:00:03.880530,0.09536827741218681,8,,1,10,1401,0.7416092234841574,TPESampler,COMPLETE
518,0.36973173059028447,2025-04-24 21:44:31.331744,2025-04-24 21:44:33.148800,0 days 00:00:01.817056,0.010515307074727148,7,,4,19,601,0.7969410522038235,TPESampler,COMPLETE
519,0.4282306491911502,2025-04-24 21:44:33.021610,2025-04-24 21:44:34.395323,0 days 00:00:01.373713,0.07994484228768502,12,,7,15,336,0.8106935151989977,TPESampler,COMPLETE
520,0.2786253402028655,2025-04-24 21:44:33.341806,2025-04-24 21:44:37.160339,0 days 00:00:03.818533,0.06093570420411987,8,,1,12,1193,0.7786434269818722,TPESampler,COMPLETE
521,0.3333192297429666,2025-04-24 21:44:34.592660,2025-04-24 21:44:38.116125,0 days 00:00:03.523465,0.05544307703866852,10,,2,13,1074,0.7055801131883296,TPESampler,COMPLETE
522,0.43782283294598096,2025-04-24 21:44:34.833525,2025-04-24 21:44:36.915884,0 days 00:00:02.082359,0.03500714027747706,3,sqrt,7,16,1375,0.8306693478147024,TPESampler,COMPLETE
523,0.2783912674512053,2025-04-24 21:44:37.108966,2025-04-24 21:44:40.221532,0 days 00:00:03.112566,0.06526264517800827,10,,1,12,951,0.7419695978076614,TPESampler,COMPLETE
524,0.2898258521071077,2025-04-24 21:44:37.402960,2025-04-24 21:44:41.481612,0 days 00:00:04.078652,0.05296512585022902,12,,1,7,1221,0.7114216605901197,TPESampler,COMPLETE
525,0.2838127218963283,2025-04-24 21:44:38.297736,2025-04-24 21:44:40.916725,0 days 00:00:02.618989,0.05280353992748532,7,,1,16,977,0.6918066943881372,TPESampler,COMPLETE
526,0.35861327538899146,2025-04-24 21:44:40.413277,2025-04-24 21:44:44.571405,0 days 00:00:04.158128,0.0465702987638926,9,,3,7,1486,0.6826804569416048,TPESampler,COMPLETE
527,0.5510574635404408,2025-04-24 21:44:41.121921,2025-04-24 21:44:42.801221,0 days 00:00:01.679300,0.016382025989380534,8,sqrt,8,2,904,0.9043670590457348,TPESampler,COMPLETE
528,0.27611214831580483,2025-04-24 21:44:41.671215,2025-04-24 21:44:45.964684,0 days 00:00:04.293469,0.04252827832313172,8,,1,7,1499,0.6757927086817562,TPESampler,COMPLETE
529,0.3044026339683167,2025-04-24 21:44:42.999140,2025-04-24 21:44:46.163909,0 days 00:00:03.164769,0.059141221989195615,4,,1,13,1239,0.7783696368060475,TPESampler,COMPLETE
530,0.6526599228394825,2025-04-24 21:44:44.758526,2025-04-24 21:44:46.034259,0 days 00:00:01.275733,0.04154945493769944,8,log2,5,2,523,0.9448425327208915,TPESampler,COMPLETE
531,0.27824879897666344,2025-04-24 21:44:46.118324,2025-04-24 21:44:49.312237,0 days 00:00:03.193913,0.09353418235069517,9,,1,14,1066,0.7410314140750112,TPESampler,COMPLETE
532,0.303057619185797,2025-04-24 21:44:46.218890,2025-04-24 21:44:48.988722,0 days 00:00:02.769832,0.06863702091677068,3,,1,8,1335,0.6929328693516532,TPESampler,COMPLETE
533,0.27773927199835763,2025-04-24 21:44:46.395292,2025-04-24 21:44:49.770624,0 days 00:00:03.375332,0.08580735389544007,7,,1,14,1023,0.8235455271640173,TPESampler,COMPLETE
534,0.4238956969727881,2025-04-24 21:44:49.172758,2025-04-24 21:44:50.880137,0 days 00:00:01.707379,0.09827409352175583,4,log2,5,8,864,0.8723130672750281,TPESampler,COMPLETE
535,0.3182876496254341,2025-04-24 21:44:49.517622,2025-04-24 21:44:53.356441,0 days 00:00:03.838819,0.06240992451210408,7,,2,15,1169,0.7196871115909722,TPESampler,COMPLETE
536,0.32705557729893886,2025-04-24 21:44:50.210386,2025-04-24 21:44:52.850677,0 days 00:00:02.640291,0.09502693230981442,10,log2,1,12,1406,0.6850639414282135,TPESampler,COMPLETE
537,0.2748559704545556,2025-04-24 21:44:51.107610,2025-04-24 21:44:55.374577,0 days 00:00:04.266967,0.0899077420874346,8,,1,17,1288,0.7370381575366669,TPESampler,COMPLETE
538,0.2712525835243935,2025-04-24 21:44:53.049627,2025-04-24 21:44:57.203527,0 days 00:00:04.153900,0.08507670267963553,9,,1,14,1339,0.6929063796333642,TPESampler,COMPLETE
539,0.4434856434105722,2025-04-24 21:44:53.551812,2025-04-24 21:44:54.977752,0 days 00:00:01.425940,0.019365747802657287,3,sqrt,1,8,667,0.6628802465941543,TPESampler,COMPLETE
540,0.3629714941430769,2025-04-24 21:44:55.163603,2025-04-24 21:44:57.292837,0 days 00:00:02.129234,0.09148681508127954,9,sqrt,2,10,1192,0.7857564212150708,TPESampler,COMPLETE
541,0.3614562297849835,2025-04-24 21:44:55.592819,2025-04-24 21:44:59.346804,0 days 00:00:03.753985,0.05479456565085001,11,,3,11,1214,0.7585925950581205,TPESampler,COMPLETE
542,0.6191745421737757,2025-04-24 21:44:57.354530,2025-04-24 21:45:00.811271,0 days 00:00:03.456741,0.010456296098151708,11,,10,12,1216,0.912524535318733,TPESampler,COMPLETE
543,0.2816638698221222,2025-04-24 21:44:57.485110,2025-04-24 21:45:01.082264,0 days 00:00:03.597154,0.04928183571346922,8,,1,12,1300,0.7097006644524316,TPESampler,COMPLETE
544,0.2671400162674181,2025-04-24 21:44:59.532395,2025-04-24 21:45:02.744262,0 days 00:00:03.211867,0.06747614109115727,7,,1,12,1122,0.6821691576858457,TPESampler,COMPLETE
545,0.27580474250706366,2025-04-24 21:45:01.001910,2025-04-24 21:45:04.728182,0 days 00:00:03.726272,0.08610171975021196,9,,1,14,1327,0.7347122169286754,TPESampler,COMPLETE
546,0.6063448620581362,2025-04-24 21:45:01.299037,2025-04-24 21:45:02.043799,0 days 00:00:00.744762,0.04148269697378661,3,sqrt,4,9,117,0.9266177091791598,TPESampler,COMPLETE
547,0.27706650574567515,2025-04-24 21:45:02.230442,2025-04-24 21:45:05.769817,0 days 00:00:03.539375,0.05017141478796563,7,,1,13,1365,0.6380787689964166,TPESampler,COMPLETE
548,0.2808941557280082,2025-04-24 21:45:02.945201,2025-04-24 21:45:05.407405,0 days 00:00:02.462204,0.06185347212304119,7,,1,13,840,0.7168035416708979,TPESampler,COMPLETE
549,0.35456987395738065,2025-04-24 21:45:04.925053,2025-04-24 21:45:06.206996,0 days 00:00:01.281943,0.09224272305491404,7,sqrt,1,2,401,0.793017054217588,TPESampler,COMPLETE
550,0.33343035734631316,2025-04-24 21:45:05.617086,2025-04-24 21:45:07.895856,0 days 00:00:02.278770,0.09692639394569132,9,sqrt,2,11,1234,0.6587645450629127,TPESampler,COMPLETE
551,0.3438985301712506,2025-04-24 21:45:06.000183,2025-04-24 21:45:09.486488,0 days 00:00:03.486305,0.08295271032312643,7,,3,13,1168,0.749192447439198,TPESampler,COMPLETE
552,0.27343223907106307,2025-04-24 21:45:06.452734,2025-04-24 21:45:10.314044,0 days 00:00:03.861310,0.051276451350777845,10,,1,10,1209,0.6756506460834725,TPESampler,COMPLETE
553,0.2910302296572099,2025-04-24 21:45:08.078157,2025-04-24 21:45:10.325923,0 days 00:00:02.247766,0.037411671636493324,6,,1,10,805,0.6145946036169319,TPESampler,COMPLETE
554,0.2757383187712747,2025-04-24 21:45:09.681396,2025-04-24 21:45:13.237289,0 days 00:00:03.555893,0.08832034584357779,11,,1,17,1102,0.6948605871325275,TPESampler,COMPLETE
555,0.2692105975804253,2025-04-24 21:45:10.480364,2025-04-24 21:45:14.286570,0 days 00:00:03.806206,0.07441261836879458,8,,1,12,1240,0.6763374294047082,TPESampler,COMPLETE
556,0.8401923640244933,2025-04-24 21:45:10.534398,2025-04-24 21:45:11.907315,0 days 00:00:01.372917,0.024188688334981827,6,log2,10,12,380,0.6517782584654712,TPESampler,COMPLETE
557,0.3649183303405847,2025-04-24 21:45:12.102633,2025-04-24 21:45:15.994381,0 days 00:00:03.891748,0.0957737468885676,10,,3,10,1213,0.6615909487457656,TPESampler,COMPLETE
558,0.6665298003808064,2025-04-24 21:45:13.432666,2025-04-24 21:45:15.710471,0 days 00:00:02.277805,0.010584945498025692,12,sqrt,10,5,1388,0.8573182001113843,TPESampler,COMPLETE
559,0.33951453065528286,2025-04-24 21:45:14.516282,2025-04-24 21:45:17.178667,0 days 00:00:02.662385,0.08299248463028511,5,sqrt,1,19,1355,0.6847983206068181,TPESampler,COMPLETE
560,0.2751229112064321,2025-04-24 21:45:15.914500,2025-04-24 21:45:19.116930,0 days 00:00:03.202430,0.07011974267895106,8,,1,9,1157,0.7140839946124824,TPESampler,COMPLETE
561,0.28020243333510375,2025-04-24 21:45:16.208365,2025-04-24 21:45:19.702474,0 days 00:00:03.494109,0.08550315593935227,8,,1,14,1253,0.7203368558572902,TPESampler,COMPLETE
562,0.28063005416018233,2025-04-24 21:45:17.368635,2025-04-24 21:45:20.191680,0 days 00:00:02.823045,0.07646431183552839,6,,1,13,1082,0.6682061909629727,TPESampler,COMPLETE
563,0.35728086821297994,2025-04-24 21:45:19.322019,2025-04-24 21:45:23.056367,0 days 00:00:03.734348,0.04146760967176078,12,,3,5,1464,0.6115365075139546,TPESampler,COMPLETE
564,0.26071095803012684,2025-04-24 21:45:19.900759,2025-04-24 21:45:23.148027,0 days 00:00:03.247268,0.06977182672431294,8,,1,14,1334,0.6928277288593278,TPESampler,COMPLETE
565,0.27098935280162545,2025-04-24 21:45:20.382320,2025-04-24 21:45:23.057725,0 days 00:00:02.675405,0.05379837320986922,8,,1,12,1080,0.6169434345664668,TPESampler,COMPLETE
566,0.6945534528791582,2025-04-24 21:45:23.194896,2025-04-24 21:45:25.137505,0 days 00:00:01.942609,0.03996196009922231,6,log2,9,4,1378,0.9640513742573015,TPESampler,COMPLETE
567,0.35009462825313165,2025-04-24 21:45:23.240910,2025-04-24 21:45:26.662467,0 days 00:00:03.421557,0.05237008291640102,7,,4,12,969,0.6151447550262563,TPESampler,COMPLETE
568,0.32963364968000314,2025-04-24 21:45:23.394904,2025-04-24 21:45:26.952423,0 days 00:00:03.557519,0.06269904463812734,8,,3,11,989,0.6199369415383338,TPESampler,COMPLETE
569,0.42476533079090534,2025-04-24 21:45:25.334518,2025-04-24 21:45:26.283888,0 days 00:00:00.949370,0.025275495043772682,5,,6,16,176,0.7351237391787617,TPESampler,COMPLETE
570,0.35319230594874873,2025-04-24 21:45:26.459029,2025-04-24 21:45:30.044583,0 days 00:00:03.585554,0.09355030542152082,9,,2,13,1321,0.689537111292865,TPESampler,COMPLETE
571,0.2822375795169508,2025-04-24 21:45:26.898342,2025-04-24 21:45:30.879722,0 days 00:00:03.981380,0.07321739865330772,9,,1,12,1346,0.7044837484386111,TPESampler,COMPLETE
572,0.28456041220170813,2025-04-24 21:45:27.179631,2025-04-24 21:45:30.630406,0 days 00:00:03.450775,0.0861999042175846,12,,1,14,973,0.7822001991441335,TPESampler,COMPLETE
573,0.28575113910205896,2025-04-24 21:45:30.235269,2025-04-24 21:45:32.551980,0 days 00:00:02.316711,0.04976882579953155,7,,1,13,793,0.6225455457968404,TPESampler,COMPLETE
574,0.31714576316587234,2025-04-24 21:45:30.828163,2025-04-24 21:45:33.741171,0 days 00:00:02.913008,0.07076725862424174,7,,2,14,1083,0.6713434782804724,TPESampler,COMPLETE
575,0.3310403699233486,2025-04-24 21:45:31.105738,2025-04-24 21:45:34.492556,0 days 00:00:03.386818,0.08305509466873905,8,,2,16,1153,0.6679516783905715,TPESampler,COMPLETE
576,0.4447563425365916,2025-04-24 21:45:32.747160,2025-04-24 21:45:34.494112,0 days 00:00:01.746952,0.07755253831111523,9,log2,5,9,1011,0.7390071393673436,TPESampler,COMPLETE
577,0.3731058393076446,2025-04-24 21:45:33.977332,2025-04-24 21:45:38.246260,0 days 00:00:04.268928,0.0738201911132546,10,,3,3,1342,0.6025969437070074,TPESampler,COMPLETE
578,0.3918124051347803,2025-04-24 21:45:34.708346,2025-04-24 21:45:36.624480,0 days 00:00:01.916134,0.06795365094406536,9,log2,3,17,993,0.7379074562691637,TPESampler,COMPLETE
579,0.3508582964082897,2025-04-24 21:45:34.767520,2025-04-24 21:45:37.916792,0 days 00:00:03.149272,0.08793333571128634,7,,3,8,932,0.8203325838917706,TPESampler,COMPLETE
580,0.6972205897316059,2025-04-24 21:45:36.828402,2025-04-24 21:45:39.079652,0 days 00:00:02.251250,0.09183314612720543,6,,10,16,761,0.7118789467498113,TPESampler,COMPLETE
581,0.2814892817011251,2025-04-24 21:45:38.109416,2025-04-24 21:45:41.072121,0 days 00:00:02.962705,0.04951383115119044,7,,1,14,1162,0.6584913416512166,TPESampler,COMPLETE
582,0.2701880369084004,2025-04-24 21:45:38.431538,2025-04-24 21:45:42.085368,0 days 00:00:03.653830,0.06874156796651261,9,,1,13,1364,0.649800217725568,TPESampler,COMPLETE
583,0.28641241177789634,2025-04-24 21:45:39.277386,2025-04-24 21:45:42.403668,0 days 00:00:03.126282,0.05944258404235866,9,,1,14,1101,0.659850366846751,TPESampler,COMPLETE
584,0.8720762455159777,2025-04-24 21:45:41.278883,2025-04-24 21:45:42.176010,0 days 00:00:00.897127,0.015953677882453922,4,log2,8,17,297,0.8560608380287366,TPESampler,COMPLETE
585,0.5900020939014359,2025-04-24 21:45:42.243466,2025-04-24 21:45:43.432264,0 days 00:00:01.188798,0.028733206394066426,4,log2,2,2,394,0.6347884633455472,TPESampler,COMPLETE
586,0.3466368709967338,2025-04-24 21:45:42.313982,2025-04-24 21:45:45.976095,0 days 00:00:03.662113,0.058185142552031756,9,,3,13,1273,0.6146423768963727,TPESampler,COMPLETE
587,0.26818421178050234,2025-04-24 21:45:42.808077,2025-04-24 21:45:46.911322,0 days 00:00:04.103245,0.057566550151424076,9,,1,10,1423,0.6797110966197283,TPESampler,COMPLETE
588,0.27405521467629496,2025-04-24 21:45:43.635487,2025-04-24 21:45:46.743679,0 days 00:00:03.108192,0.0638756774756268,8,,1,12,1114,0.7213357309055377,TPESampler,COMPLETE
589,0.275671387267346,2025-04-24 21:45:46.176920,2025-04-24 21:45:49.413467,0 days 00:00:03.236547,0.08371760858514232,7,,1,15,1264,0.6708564739861417,TPESampler,COMPLETE
590,0.3460201480319927,2025-04-24 21:45:46.931349,2025-04-24 21:45:50.208528,0 days 00:00:03.277179,0.06804265925217456,9,,3,13,1306,0.7021899216085088,TPESampler,COMPLETE
591,0.26290211430422883,2025-04-24 21:45:47.096066,2025-04-24 21:45:50.448192,0 days 00:00:03.352126,0.06974445329601252,9,,1,14,1242,0.6772460599642395,TPESampler,COMPLETE
592,0.2769857315643258,2025-04-24 21:45:49.603308,2025-04-24 21:45:52.647563,0 days 00:00:03.044255,0.05450794348554226,8,,1,7,1137,0.6208670011649993,TPESampler,COMPLETE
593,0.34124180558301975,2025-04-24 21:45:50.396875,2025-04-24 21:45:53.897557,0 days 00:00:03.500682,0.05771614245586783,9,,2,14,1345,0.6940734435111583,TPESampler,COMPLETE
594,0.3221419084113941,2025-04-24 21:45:50.690674,2025-04-24 21:45:54.687139,0 days 00:00:03.996465,0.01500552778774725,9,,1,20,1021,0.996026649068902,TPESampler,COMPLETE
595,0.2744870507633323,2025-04-24 21:45:52.839322,2025-04-24 21:45:56.588400,0 days 00:00:03.749078,0.062494806597463745,8,,1,10,1389,0.686866904504598,TPESampler,COMPLETE
596,0.27088212267771933,2025-04-24 21:45:54.082866,2025-04-24 21:45:57.750794,0 days 00:00:03.667928,0.04216994872784709,8,,1,9,1382,0.6314449336551627,TPESampler,COMPLETE
597,0.3758264795406484,2025-04-24 21:45:54.886108,2025-04-24 21:45:59.226203,0 days 00:00:04.340095,0.01854867647869766,9,,4,3,1270,0.9685681556275151,TPESampler,COMPLETE
598,0.2871239520712357,2025-04-24 21:45:56.808539,2025-04-24 21:45:59.554291,0 days 00:00:02.745752,0.042875641702122935,9,,1,14,919,0.6324202405461115,TPESampler,COMPLETE
599,0.2869498673175564,2025-04-24 21:45:57.934442,2025-04-24 21:46:00.932071,0 days 00:00:02.997629,0.07160248713532641,8,,1,13,1001,0.6866899297638853,TPESampler,COMPLETE
600,0.3883384477819414,2025-04-24 21:45:59.417412,2025-04-24 21:46:00.247128,0 days 00:00:00.829716,0.0719251284177061,8,sqrt,1,10,122,0.6532343165482619,TPESampler,COMPLETE
601,0.3610601972874436,2025-04-24 21:45:59.753999,2025-04-24 21:46:03.932740,0 days 00:00:04.178741,0.06172741296317525,12,,2,12,1414,0.7355379380972564,TPESampler,COMPLETE
602,0.2903301878157829,2025-04-24 21:46:00.464531,2025-04-24 21:46:04.368032,0 days 00:00:03.903501,0.07819377890432445,11,,1,8,1324,0.6624556305407944,TPESampler,COMPLETE
603,0.6751417555175111,2025-04-24 21:46:01.203078,2025-04-24 21:46:04.369562,0 days 00:00:03.166484,0.03580289846005351,11,,9,11,1289,0.6803294373524666,TPESampler,COMPLETE
604,0.28005601519966566,2025-04-24 21:46:04.139996,2025-04-24 21:46:08.243030,0 days 00:00:04.103034,0.07321893611675825,11,,1,12,1428,0.6814515870301734,TPESampler,COMPLETE
605,0.28055317955519415,2025-04-24 21:46:04.551595,2025-04-24 21:46:08.694324,0 days 00:00:04.142729,0.04496286525732889,9,,1,13,1442,0.6577625778053424,TPESampler,COMPLETE
606,0.3189167705585719,2025-04-24 21:46:04.608127,2025-04-24 21:46:07.728281,0 days 00:00:03.120154,0.054952303647351534,8,,2,13,1113,0.6261834000702566,TPESampler,COMPLETE
607,0.3156013812941347,2025-04-24 21:46:07.933514,2025-04-24 21:46:10.296075,0 days 00:00:02.362561,0.08879881749589935,9,sqrt,1,16,1338,0.6781652621234966,TPESampler,COMPLETE
608,0.2814291152459665,2025-04-24 21:46:08.443253,2025-04-24 21:46:12.251403,0 days 00:00:03.808150,0.027453410872881882,9,,1,7,1240,0.6417361809309086,TPESampler,COMPLETE
609,0.27907471699869457,2025-04-24 21:46:08.948065,2025-04-24 21:46:12.494000,0 days 00:00:03.545935,0.09638719576842997,10,,1,9,1145,0.7295989594421295,TPESampler,COMPLETE
610,0.4188865275328485,2025-04-24 21:46:10.505799,2025-04-24 21:46:13.217678,0 days 00:00:02.711879,0.06609753565952374,6,,7,17,920,0.9263920357578685,TPESampler,COMPLETE
611,0.2805861249648606,2025-04-24 21:46:12.482202,2025-04-24 21:46:15.370240,0 days 00:00:02.888038,0.09561245210790716,11,,1,13,899,0.6548954852672539,TPESampler,COMPLETE
612,0.2791675403836424,2025-04-24 21:46:12.680449,2025-04-24 21:46:16.678155,0 days 00:00:03.997706,0.0678636125762381,8,,1,14,1406,0.6409227124796338,TPESampler,COMPLETE
613,0.3267102566215409,2025-04-24 21:46:13.399366,2025-04-24 21:46:16.001079,0 days 00:00:02.601713,0.044823334965780746,5,,2,10,1017,0.7091385905186168,TPESampler,COMPLETE
614,0.623526789281985,2025-04-24 21:46:15.718579,2025-04-24 21:46:18.300115,0 days 00:00:02.581536,0.01693172275618678,5,,10,2,930,0.9305675781612148,TPESampler,COMPLETE
615,0.2697084468257786,2025-04-24 21:46:16.196089,2025-04-24 21:46:19.902772,0 days 00:00:03.706683,0.09016197128804898,9,,1,11,1411,0.6740254043688161,TPESampler,COMPLETE
616,0.2726707805966061,2025-04-24 21:46:16.899607,2025-04-24 21:46:19.988944,0 days 00:00:03.089337,0.05684511517810079,8,,1,10,1231,0.6639258807444669,TPESampler,COMPLETE
617,0.325925862088899,2025-04-24 21:46:18.508167,2025-04-24 21:46:21.838124,0 days 00:00:03.329957,0.033179550083741856,7,,2,11,1182,0.6392905761115149,TPESampler,COMPLETE
618,0.3451967257986832,2025-04-24 21:46:20.074087,2025-04-24 21:46:24.185923,0 days 00:00:04.111836,0.0797325837391389,9,,2,10,1235,0.6100653239573205,TPESampler,COMPLETE
619,0.7491606137112112,2025-04-24 21:46:20.148612,2025-04-24 21:46:22.550555,0 days 00:00:02.401943,0.017149120949721968,5,log2,10,12,1493,0.6542856718440557,TPESampler,COMPLETE
620,0.7027155451002514,2025-04-24 21:46:22.073574,2025-04-24 21:46:24.189274,0 days 00:00:02.115700,0.02217300668483637,10,log2,9,17,1249,0.7828065368345972,TPESampler,COMPLETE
621,0.38505651231559695,2025-04-24 21:46:22.731945,2025-04-24 21:46:26.534300,0 days 00:00:03.802355,0.09615202946467805,9,,3,10,1310,0.6986648752669383,TPESampler,COMPLETE
622,0.29074591974390257,2025-04-24 21:46:24.329795,2025-04-24 21:46:27.661660,0 days 00:00:03.331865,0.06935379771341563,9,,1,12,1248,0.6492835107243892,TPESampler,COMPLETE
623,0.3260229092238806,2025-04-24 21:46:24.387391,2025-04-24 21:46:28.158939,0 days 00:00:03.771548,0.056468113394274544,8,,2,11,1435,0.6129046754081681,TPESampler,COMPLETE
