number,value,datetime_start,datetime_complete,duration,params_learning_rate,params_max_depth,params_max_features,params_min_samples_leaf,params_min_samples_split,params_n_estimators,params_subsample,system_attrs_auto:sampler,state
1249,0.2599884901510853,2025-04-24 21:57:26.678422,2025-04-24 21:57:29.548256,0 days 00:00:02.869834,0.0897879823509316,9,,1,12,877,0.6297911464301987,TPESampler,COMPLETE
1250,0.4681676000082856,2025-04-24 21:57:28.056475,2025-04-24 21:57:29.547339,0 days 00:00:01.490864,0.029186270421020285,6,log2,2,3,631,0.8869654427953679,TPESampler,COMPLETE
1251,0.27668117578770207,2025-04-24 21:57:28.104178,2025-04-24 21:57:31.535905,0 days 00:00:03.431727,0.09858512414100785,6,,1,9,1161,0.6293010062069925,TPESampler,COMPLETE
1252,0.2748354231278956,2025-04-24 21:57:29.700711,2025-04-24 21:57:32.638459,0 days 00:00:02.937748,0.06618088767754972,7,,1,12,1050,0.7013242133150627,TPESampler,COMPLETE
1253,0.32614805689898957,2025-04-24 21:57:29.744209,2025-04-24 21:57:32.564654,0 days 00:00:02.820445,0.08206469994694898,7,,2,14,943,0.6955204037296091,TPESampler,COMPLETE
1254,0.3462458289893749,2025-04-24 21:57:31.800193,2025-04-24 21:57:34.812909,0 days 00:00:03.012716,0.0971544004834274,10,,2,10,867,0.6642200767289917,TPESampler,COMPLETE
1255,0.26945738642442174,2025-04-24 21:57:32.718446,2025-04-24 21:57:35.760998,0 days 00:00:03.042552,0.05867868687043179,7,,1,15,924,0.6589714376289508,TPESampler,COMPLETE
1256,0.3470150099160478,2025-04-24 21:57:32.834182,2025-04-24 21:57:35.155905,0 days 00:00:02.321723,0.06311525236458872,4,sqrt,1,3,1170,0.9245963968626827,TPESampler,COMPLETE
1257,0.32404571881740973,2025-04-24 21:57:35.017678,2025-04-24 21:57:38.067801,0 days 00:00:03.050123,0.08468418562629937,6,,2,13,1153,0.7099692570909157,TPESampler,COMPLETE
1258,0.3449835298150525,2025-04-24 21:57:35.377361,2025-04-24 21:57:38.327980,0 days 00:00:02.950619,0.04267761915486523,7,,4,19,1085,0.6956804941751921,TPESampler,COMPLETE
1259,0.34331136349612756,2025-04-24 21:57:35.983048,2025-04-24 21:57:38.466494,0 days 00:00:02.483446,0.09154021394216094,11,,2,15,829,0.6597299508593045,TPESampler,COMPLETE
1260,0.42118318385325904,2025-04-24 21:57:38.266057,2025-04-24 21:57:40.609555,0 days 00:00:02.343498,0.038506896610849446,12,,6,11,577,0.6948260722225545,TPESampler,COMPLETE
1261,0.3890670572996343,2025-04-24 21:57:38.528061,2025-04-24 21:57:40.640319,0 days 00:00:02.112258,0.0987149048255993,3,log2,1,8,1128,0.6533679867652267,TPESampler,COMPLETE
1262,0.2814007652563918,2025-04-24 21:57:38.711609,2025-04-24 21:57:42.036126,0 days 00:00:03.324517,0.09309496937420395,11,,1,12,831,0.6420398487376404,TPESampler,COMPLETE
1263,0.2731215292966451,2025-04-24 21:57:40.768305,2025-04-24 21:57:44.213028,0 days 00:00:03.444723,0.06295698253345346,9,,1,16,1169,0.6859988204933407,TPESampler,COMPLETE
1264,0.27814584565659517,2025-04-24 21:57:40.807052,2025-04-24 21:57:44.655978,0 days 00:00:03.848926,0.09994975348311003,6,,1,10,1473,0.6447044443792089,TPESampler,COMPLETE
1265,0.3205138150841731,2025-04-24 21:57:42.227643,2025-04-24 21:57:44.207362,0 days 00:00:01.979719,0.05260342486344808,10,,2,13,639,0.6260837687649096,TPESampler,COMPLETE
1266,0.33976196236994105,2025-04-24 21:57:44.461275,2025-04-24 21:57:46.645437,0 days 00:00:02.184162,0.07553747938756261,4,sqrt,1,12,741,0.6029607452126103,TPESampler,COMPLETE
1267,0.32855892943268156,2025-04-24 21:57:44.577363,2025-04-24 21:57:47.817648,0 days 00:00:03.240285,0.058347161216567384,9,,3,13,778,0.6434085171444456,TPESampler,COMPLETE
1268,0.2722910850586997,2025-04-24 21:57:45.345679,2025-04-24 21:57:49.319152,0 days 00:00:03.973473,0.08117719172331075,9,,1,12,1010,0.6737675702204577,TPESampler,COMPLETE
1269,0.273832274650756,2025-04-24 21:57:47.263463,2025-04-24 21:57:50.758036,0 days 00:00:03.494573,0.08994031903092846,7,,1,11,973,0.6427950896915328,TPESampler,COMPLETE
1270,0.27779588209200146,2025-04-24 21:57:48.172457,2025-04-24 21:57:50.897864,0 days 00:00:02.725407,0.07517951668864493,9,,1,8,615,0.6505841128713186,TPESampler,COMPLETE
1271,0.27815200311666405,2025-04-24 21:57:49.590951,2025-04-24 21:57:53.490130,0 days 00:00:03.899179,0.036759259769483084,8,,1,16,1388,0.6605643637910593,TPESampler,COMPLETE
1272,0.2989598613390998,2025-04-24 21:57:51.039135,2025-04-24 21:57:54.284179,0 days 00:00:03.245044,0.04296998848870685,4,,1,9,1160,0.6175914425557811,TPESampler,COMPLETE
1273,0.2919246434201421,2025-04-24 21:57:51.487426,2025-04-24 21:57:54.697216,0 days 00:00:03.209790,0.07461966547874253,8,,1,13,919,0.6043611511737805,TPESampler,COMPLETE
1274,0.2842752319059924,2025-04-24 21:57:53.865331,2025-04-24 21:57:57.030497,0 days 00:00:03.165166,0.07865333414582588,8,,1,7,876,0.6573845037813048,TPESampler,COMPLETE
1275,0.33527792225391045,2025-04-24 21:57:54.649775,2025-04-24 21:57:58.163476,0 days 00:00:03.513701,0.09278355335985167,9,,2,17,1118,0.6727326603664643,TPESampler,COMPLETE
1276,0.5945463045395442,2025-04-24 21:57:55.070502,2025-04-24 21:57:56.672018,0 days 00:00:01.601516,0.010594808351387716,4,log2,1,13,687,0.9938570935520356,TPESampler,COMPLETE
1277,0.3565624277481772,2025-04-24 21:57:56.886706,2025-04-24 21:58:00.462545,0 days 00:00:03.575839,0.08964623763557442,11,,3,14,1298,0.6745973984493665,TPESampler,COMPLETE
1278,0.27729650132981315,2025-04-24 21:57:57.239682,2025-04-24 21:58:00.595817,0 days 00:00:03.356135,0.0669893859520993,11,,1,14,1193,0.6528744076342218,TPESampler,COMPLETE
1279,0.3199328045574114,2025-04-24 21:57:58.390410,2025-04-24 21:58:01.786667,0 days 00:00:03.396257,0.04890766520808324,8,,2,13,1183,0.6987031553519152,TPESampler,COMPLETE
1280,0.2845728727028995,2025-04-24 21:58:00.641218,2025-04-24 21:58:03.357579,0 days 00:00:02.716361,0.09200538088076389,9,,1,16,711,0.6922418880445683,TPESampler,COMPLETE
1281,0.34259621245031735,2025-04-24 21:58:00.819128,2025-04-24 21:58:02.645860,0 days 00:00:01.826732,0.032574086543004394,6,sqrt,1,7,794,0.8027555577630943,TPESampler,COMPLETE
1282,0.29790000672667777,2025-04-24 21:58:02.009494,2025-04-24 21:58:05.040821,0 days 00:00:03.031327,0.09689345342063989,3,,1,10,1385,0.6031820820240557,TPESampler,COMPLETE
1283,0.27062170718525647,2025-04-24 21:58:02.871743,2025-04-24 21:58:05.809209,0 days 00:00:02.937466,0.07094329307840663,9,,1,10,892,0.6091939119741292,TPESampler,COMPLETE
1284,0.27443977382049983,2025-04-24 21:58:03.569739,2025-04-24 21:58:06.132421,0 days 00:00:02.562682,0.06597008639973988,9,,1,14,740,0.7092746955270155,TPESampler,COMPLETE
1285,0.6593141703281815,2025-04-24 21:58:05.248929,2025-04-24 21:58:07.221127,0 days 00:00:01.972198,0.08230411013558585,12,sqrt,10,9,1183,0.669918708626962,TPESampler,COMPLETE
1286,0.28069597898711013,2025-04-24 21:58:06.198764,2025-04-24 21:58:09.957225,0 days 00:00:03.758461,0.0856453620785875,9,,1,12,1150,0.6750079398735582,TPESampler,COMPLETE
1287,0.2889039326682388,2025-04-24 21:58:06.456745,2025-04-24 21:58:09.201914,0 days 00:00:02.745169,0.05094497924682031,6,,1,6,815,0.6274423946620187,TPESampler,COMPLETE
1288,0.2663404994125359,2025-04-24 21:58:07.433540,2025-04-24 21:58:11.024326,0 days 00:00:03.590786,0.06093023442977499,8,,1,15,1357,0.6504385644024993,TPESampler,COMPLETE
1289,0.3101492825695164,2025-04-24 21:58:09.405570,2025-04-24 21:58:13.147547,0 days 00:00:03.741977,0.049669694011509745,8,,3,17,1198,0.729109696328945,TPESampler,COMPLETE
1290,0.2736350192435002,2025-04-24 21:58:10.183562,2025-04-24 21:58:13.764604,0 days 00:00:03.581042,0.09563108415661091,6,,1,8,1333,0.6074427961165928,TPESampler,COMPLETE
1291,0.4712758938308246,2025-04-24 21:58:11.226213,2025-04-24 21:58:13.143574,0 days 00:00:01.917361,0.05540196377707138,11,sqrt,8,18,1017,0.8496097528525308,TPESampler,COMPLETE
1292,0.34064268016424054,2025-04-24 21:58:13.368803,2025-04-24 21:58:17.636902,0 days 00:00:04.268099,0.06783932479534494,8,,2,14,1500,0.6234257775136306,TPESampler,COMPLETE
1293,0.39958250683787305,2025-04-24 21:58:13.427288,2025-04-24 21:58:15.822333,0 days 00:00:02.395045,0.04168105633252754,3,log2,1,10,1075,0.6098412555984137,TPESampler,COMPLETE
1294,0.284587786222123,2025-04-24 21:58:14.020332,2025-04-24 21:58:17.642689,0 days 00:00:03.622357,0.04973316536280835,7,,1,14,1210,0.6690903193640659,TPESampler,COMPLETE
1295,0.3400376109020482,2025-04-24 21:58:16.012979,2025-04-24 21:58:19.422770,0 days 00:00:03.409791,0.06924468068802538,7,,3,13,1349,0.7026831031410973,TPESampler,COMPLETE
1296,0.3248388675025814,2025-04-24 21:58:17.799284,2025-04-24 21:58:20.704754,0 days 00:00:02.905470,0.06441386690411202,9,,3,14,982,0.6082568806928639,TPESampler,COMPLETE
1297,0.30664741268642076,2025-04-24 21:58:17.839941,2025-04-24 21:58:20.032464,0 days 00:00:02.192523,0.09658109927435743,4,,1,2,662,0.7170043854063538,TPESampler,COMPLETE
1298,0.33029382844710253,2025-04-24 21:58:19.623931,2025-04-24 21:58:23.476631,0 days 00:00:03.852700,0.04675953562320355,8,,2,15,1471,0.6198709784978593,TPESampler,COMPLETE
1299,0.5347179527320367,2025-04-24 21:58:20.259655,2025-04-24 21:58:21.535416,0 days 00:00:01.275761,0.044361606404808976,3,sqrt,5,18,232,0.7733584544189311,TPESampler,COMPLETE
1300,0.2746488200558134,2025-04-24 21:58:20.949587,2025-04-24 21:58:24.807875,0 days 00:00:03.858288,0.0588406107764645,7,,1,16,1386,0.6902621701807434,TPESampler,COMPLETE
1301,0.2815066794643147,2025-04-24 21:58:21.757279,2025-04-24 21:58:24.476160,0 days 00:00:02.718881,0.07942147532495757,9,,1,13,969,0.6075804827381917,TPESampler,COMPLETE
1302,0.8637133283652959,2025-04-24 21:58:23.676344,2025-04-24 21:58:25.011366,0 days 00:00:01.335022,0.012129630107334761,5,log2,9,16,646,0.6395733129523878,TPESampler,COMPLETE
1303,0.2934263942030589,2025-04-24 21:58:24.765585,2025-04-24 21:58:27.109487,0 days 00:00:02.343902,0.06724778602179654,6,,1,7,732,0.6086282835296197,TPESampler,COMPLETE
1304,0.4034107952356446,2025-04-24 21:58:25.068595,2025-04-24 21:58:27.224634,0 days 00:00:02.156039,0.013414575814251251,3,,5,9,913,0.6129159413489791,TPESampler,COMPLETE
1305,0.3678507935022875,2025-04-24 21:58:25.291750,2025-04-24 21:58:28.603728,0 days 00:00:03.311978,0.01920013808973763,4,,4,10,1214,0.8473275897708863,TPESampler,COMPLETE
1306,0.35326879717878523,2025-04-24 21:58:27.272586,2025-04-24 21:58:30.858402,0 days 00:00:03.585816,0.0917441527723699,6,,4,11,1483,0.6201253989316363,TPESampler,COMPLETE
1307,0.2811015762345916,2025-04-24 21:58:27.418159,2025-04-24 21:58:30.105011,0 days 00:00:02.686852,0.09294158347514335,10,,1,9,808,0.6073893836461743,TPESampler,COMPLETE
1308,0.2801674896645101,2025-04-24 21:58:28.826962,2025-04-24 21:58:32.555243,0 days 00:00:03.728281,0.059042246969367614,8,,1,15,1327,0.6356767620241249,TPESampler,COMPLETE
1309,0.34669186866296686,2025-04-24 21:58:30.310067,2025-04-24 21:58:33.943921,0 days 00:00:03.633854,0.0651210240726688,9,,2,15,1182,0.7595289791836748,TPESampler,COMPLETE
1310,0.2853634049167961,2025-04-24 21:58:31.072956,2025-04-24 21:58:34.428423,0 days 00:00:03.355467,0.06953192129793731,8,,1,15,1110,0.725622217445954,TPESampler,COMPLETE
1311,0.29474937794123623,2025-04-24 21:58:32.748799,2025-04-24 21:58:34.970132,0 days 00:00:02.221333,0.08363637703228834,9,sqrt,1,9,1136,0.6713690619467088,TPESampler,COMPLETE
1312,0.2847924225598905,2025-04-24 21:58:34.160877,2025-04-24 21:58:38.026215,0 days 00:00:03.865338,0.062231642415987096,7,,1,12,1215,0.6642438699184362,TPESampler,COMPLETE
1313,0.2829946688652239,2025-04-24 21:58:34.690374,2025-04-24 21:58:38.023321,0 days 00:00:03.332947,0.09896521552324583,6,,1,8,1096,0.6864321223727421,TPESampler,COMPLETE
1314,0.4675748994778932,2025-04-24 21:58:35.230686,2025-04-24 21:58:37.304286,0 days 00:00:02.073600,0.040664061715762694,12,log2,5,2,1182,0.9796123373583099,TPESampler,COMPLETE
1315,0.2708825125573311,2025-04-24 21:58:37.495007,2025-04-24 21:58:40.374353,0 days 00:00:02.879346,0.08032485780743777,6,,1,12,1066,0.6097966051187155,TPESampler,COMPLETE
1316,0.34064913993852547,2025-04-24 21:58:38.231191,2025-04-24 21:58:41.121627,0 days 00:00:02.890436,0.06197632320933029,8,,3,10,1066,0.6943178423335402,TPESampler,COMPLETE
1317,0.301730021345796,2025-04-24 21:58:38.347339,2025-04-24 21:58:41.403020,0 days 00:00:03.055681,0.0919358722289517,5,,1,12,1176,0.7350212358945667,TPESampler,COMPLETE
1318,0.3290291271986891,2025-04-24 21:58:40.574634,2025-04-24 21:58:42.716506,0 days 00:00:02.141872,0.045331044015215226,5,,2,10,559,0.6028207777824948,TPESampler,COMPLETE
1319,0.7298609799524481,2025-04-24 21:58:41.340304,2025-04-24 21:58:42.762910,0 days 00:00:01.422606,0.04510355007650837,11,log2,10,10,744,0.9534229179122122,TPESampler,COMPLETE
1320,0.2720077014343458,2025-04-24 21:58:41.644045,2025-04-24 21:58:45.627061,0 days 00:00:03.983016,0.0870590855371316,6,,1,14,1500,0.611863998820651,TPESampler,COMPLETE
1321,0.28088185158358975,2025-04-24 21:58:42.868801,2025-04-24 21:58:46.652592,0 days 00:00:03.783791,0.06615406462334303,8,,1,16,1485,0.70255338983982,TPESampler,COMPLETE
1322,0.2783905954465205,2025-04-24 21:58:42.905247,2025-04-24 21:58:46.393173,0 days 00:00:03.487926,0.09346969063955786,6,,1,13,1316,0.711884199004551,TPESampler,COMPLETE
1323,0.3375633608708902,2025-04-24 21:58:45.824557,2025-04-24 21:58:48.791224,0 days 00:00:02.966667,0.05176649239983387,7,,3,10,1125,0.614693830334215,TPESampler,COMPLETE
1324,0.28343035536417616,2025-04-24 21:58:46.609361,2025-04-24 21:58:49.678274,0 days 00:00:03.068913,0.07595686558488418,8,,1,13,1173,0.6685138118997133,TPESampler,COMPLETE
1325,0.28049266410691087,2025-04-24 21:58:46.926483,2025-04-24 21:58:49.494196,0 days 00:00:02.567713,0.05376944415631062,7,,1,14,938,0.748570950820431,TPESampler,COMPLETE
1326,0.2765167660301641,2025-04-24 21:58:48.991242,2025-04-24 21:58:52.445193,0 days 00:00:03.453951,0.09840666776312539,5,,1,8,1192,0.6415505028136261,TPESampler,COMPLETE
1327,0.3669502272374729,2025-04-24 21:58:49.688433,2025-04-24 21:58:51.492130,0 days 00:00:01.803697,0.05564515405048721,6,log2,1,6,912,0.6345517801368151,TPESampler,COMPLETE
1328,0.3523807304149997,2025-04-24 21:58:49.868914,2025-04-24 21:58:51.584398,0 days 00:00:01.715484,0.02400714277160553,6,,2,13,327,0.8420067161884068,TPESampler,COMPLETE
1329,0.2691032676410089,2025-04-24 21:58:51.674233,2025-04-24 21:58:55.756228,0 days 00:00:04.081995,0.0595670375817449,8,,1,14,1211,0.7455396906927901,TPESampler,COMPLETE
1330,0.3688896078810578,2025-04-24 21:58:51.846542,2025-04-24 21:58:55.498602,0 days 00:00:03.652060,0.07726781909181504,12,,4,17,1037,0.774034611346148,TPESampler,COMPLETE
1331,0.30351648882495685,2025-04-24 21:58:52.703076,2025-04-24 21:58:54.984814,0 days 00:00:02.281738,0.04002502877035103,10,sqrt,1,13,1268,0.6872280380194588,TPESampler,COMPLETE
1332,0.271534701824579,2025-04-24 21:58:55.176369,2025-04-24 21:58:58.612774,0 days 00:00:03.436405,0.0995678595969792,6,,1,9,1244,0.6037253402723568,TPESampler,COMPLETE
1333,0.2840889685641073,2025-04-24 21:58:55.721854,2025-04-24 21:58:57.951300,0 days 00:00:02.229446,0.09520335288527258,8,,1,14,802,0.6846421468494808,TPESampler,COMPLETE
1334,0.2881576163724301,2025-04-24 21:58:56.046547,2025-04-24 21:58:57.920907,0 days 00:00:01.874360,0.09394014565930606,8,,1,9,643,0.6463709261211849,TPESampler,COMPLETE
1335,0.27664766529136897,2025-04-24 21:58:58.076781,2025-04-24 21:59:01.886629,0 days 00:00:03.809848,0.09093510103580754,9,,1,14,1334,0.606810458127083,TPESampler,COMPLETE
1336,0.264085555111841,2025-04-24 21:58:58.126517,2025-04-24 21:59:01.819065,0 days 00:00:03.692548,0.07834634037344756,8,,1,13,1191,0.6066568700465921,TPESampler,COMPLETE
1337,0.6187366550626796,2025-04-24 21:58:59.158575,2025-04-24 21:59:00.987458,0 days 00:00:01.828883,0.014071389488805224,4,,10,7,648,0.8398894474662522,TPESampler,COMPLETE
1338,0.2819800556002312,2025-04-24 21:59:01.181425,2025-04-24 21:59:04.604421,0 days 00:00:03.422996,0.07095779158561753,8,,1,12,1147,0.7488928483885046,TPESampler,COMPLETE
1339,0.3185198319526652,2025-04-24 21:59:02.003604,2025-04-24 21:59:03.276651,0 days 00:00:01.273047,0.031164908190793848,9,,1,14,242,0.6653632053741012,TPESampler,COMPLETE
1340,0.32568165471412747,2025-04-24 21:59:02.043498,2025-04-24 21:59:05.490216,0 days 00:00:03.446718,0.05821208170061102,7,,2,10,1192,0.6229437567832788,TPESampler,COMPLETE
1341,0.27480608147694074,2025-04-24 21:59:03.470732,2025-04-24 21:59:06.947304,0 days 00:00:03.476572,0.095382627221251,9,,1,16,1181,0.6597805806604843,TPESampler,COMPLETE
1342,0.2761747373682434,2025-04-24 21:59:04.794942,2025-04-24 21:59:09.300096,0 days 00:00:04.505154,0.07454706786297333,9,,1,15,1463,0.6399811321519259,TPESampler,COMPLETE
1343,0.37480393592712496,2025-04-24 21:59:05.694237,2025-04-24 21:59:08.119809,0 days 00:00:02.425572,0.05028801226651753,6,sqrt,4,7,1374,0.6106287272552265,TPESampler,COMPLETE
1344,0.2810291203687475,2025-04-24 21:59:07.156667,2025-04-24 21:59:10.242106,0 days 00:00:03.085439,0.09863230256002659,8,,1,9,850,0.7425188548630572,TPESampler,COMPLETE
1345,0.8472737630409714,2025-04-24 21:59:08.308409,2025-04-24 21:59:09.397970,0 days 00:00:01.089561,0.015529121830111908,4,log2,8,7,463,0.8730764181562368,TPESampler,COMPLETE
1346,0.4143644084578761,2025-04-24 21:59:09.474355,2025-04-24 21:59:11.947798,0 days 00:00:02.473443,0.07890103058269395,7,log2,4,12,1207,0.6675848616725519,TPESampler,COMPLETE
1347,0.36466073253534964,2025-04-24 21:59:09.692313,2025-04-24 21:59:13.383373,0 days 00:00:03.691060,0.08109866842202482,10,,3,13,1083,0.6005211734713464,TPESampler,COMPLETE
1348,0.29033666729833096,2025-04-24 21:59:10.486931,2025-04-24 21:59:13.796916,0 days 00:00:03.309985,0.08642886670881231,7,,1,15,1068,0.6158781297407544,TPESampler,COMPLETE
1349,0.2806766520962755,2025-04-24 21:59:12.156106,2025-04-24 21:59:15.546341,0 days 00:00:03.390235,0.0692625263548172,10,,1,13,1148,0.6346620346347372,TPESampler,COMPLETE
1350,0.288425268353486,2025-04-24 21:59:13.616178,2025-04-24 21:59:16.781542,0 days 00:00:03.165364,0.06013135506866365,6,,1,15,1157,0.653077296916668,TPESampler,COMPLETE
1351,0.36201922200104336,2025-04-24 21:59:14.084026,2025-04-24 21:59:17.832454,0 days 00:00:03.748428,0.09577791769605443,5,,4,11,1475,0.7444462232795848,TPESampler,COMPLETE
1352,0.7176200570786523,2025-04-24 21:59:15.762007,2025-04-24 21:59:16.696961,0 days 00:00:00.934954,0.030185901399615106,3,sqrt,7,11,116,0.8202028771951035,TPESampler,COMPLETE
1353,0.6553074870693416,2025-04-24 21:59:16.886307,2025-04-24 21:59:19.236273,0 days 00:00:02.349966,0.04605607407925117,5,,10,19,589,0.8541976713697763,TPESampler,COMPLETE
1354,0.6067041828313214,2025-04-24 21:59:17.022021,2025-04-24 21:59:18.967267,0 days 00:00:01.945246,0.06767206487735701,4,sqrt,8,18,936,0.6632144900200961,TPESampler,COMPLETE
1355,0.346213289250388,2025-04-24 21:59:18.064010,2025-04-24 21:59:21.637886,0 days 00:00:03.573876,0.09977147869544953,9,,3,13,1068,0.6494085867972078,TPESampler,COMPLETE
1356,0.841612049758884,2025-04-24 21:59:19.181811,2025-04-24 21:59:20.633046,0 days 00:00:01.451235,0.013071700069011089,12,log2,10,10,580,0.9719845543718242,TPESampler,COMPLETE
1357,0.2741330645732178,2025-04-24 21:59:19.538252,2025-04-24 21:59:23.629593,0 days 00:00:04.091341,0.06340575186140363,9,,1,12,1221,0.6598067892571905,TPESampler,COMPLETE
1358,0.33043110605172754,2025-04-24 21:59:20.854096,2025-04-24 21:59:23.213372,0 days 00:00:02.359276,0.044353728005546475,8,,2,9,811,0.6071749477126277,TPESampler,COMPLETE
1359,0.3880479773231774,2025-04-24 21:59:21.834506,2025-04-24 21:59:26.086030,0 days 00:00:04.251524,0.05504318590354119,8,,5,16,1389,0.6374093454985231,TPESampler,COMPLETE
1360,0.6047892562969449,2025-04-24 21:59:23.416609,2025-04-24 21:59:25.184886,0 days 00:00:01.768277,0.02269105046249394,12,sqrt,8,13,859,0.7485429693942728,TPESampler,COMPLETE
1361,0.3834875430838491,2025-04-24 21:59:23.863663,2025-04-24 21:59:26.347664,0 days 00:00:02.484001,0.06618976787405932,5,log2,2,12,1297,0.6900659576979842,TPESampler,COMPLETE
1362,0.2923734264653871,2025-04-24 21:59:25.399675,2025-04-24 21:59:30.650213,0 days 00:00:05.250538,0.09934214853213674,9,,1,13,1349,0.729076220973641,TPESampler,COMPLETE
1363,0.37193422002552395,2025-04-24 21:59:26.301678,2025-04-24 21:59:28.389016,0 days 00:00:02.087338,0.09229610983990237,7,log2,2,7,1203,0.610997264135941,TPESampler,COMPLETE
1364,0.26911426489110296,2025-04-24 21:59:26.628154,2025-04-24 21:59:29.828499,0 days 00:00:03.200345,0.08853903602660156,9,,1,13,822,0.6691042423211166,TPESampler,COMPLETE
1365,0.5783842738975273,2025-04-24 21:59:28.597902,2025-04-24 21:59:30.858061,0 days 00:00:02.260159,0.010523664115307155,4,sqrt,7,20,1449,0.7344993742798829,TPESampler,COMPLETE
1366,0.37594681406035474,2025-04-24 21:59:30.055429,2025-04-24 21:59:31.511518,0 days 00:00:01.456089,0.04940678004193906,4,,1,16,194,0.945053749348757,TPESampler,COMPLETE
1367,0.27486141443680495,2025-04-24 21:59:30.885446,2025-04-24 21:59:34.262030,0 days 00:00:03.376584,0.09283924615594565,8,,1,11,1134,0.6407477411745455,TPESampler,COMPLETE
1368,0.35971164907423603,2025-04-24 21:59:31.080663,2025-04-24 21:59:33.369646,0 days 00:00:02.288983,0.026204280349820766,8,log2,1,2,1027,0.6861249140396126,TPESampler,COMPLETE
1369,0.33630732409703,2025-04-24 21:59:31.786870,2025-04-24 21:59:34.849532,0 days 00:00:03.062662,0.05975175224793426,9,,3,10,938,0.6604496820629322,TPESampler,COMPLETE
1370,0.280747314572724,2025-04-24 21:59:33.573091,2025-04-24 21:59:36.470558,0 days 00:00:02.897467,0.043989395011848224,8,,1,12,988,0.6469134301251483,TPESampler,COMPLETE
1371,0.27095714052725617,2025-04-24 21:59:34.462001,2025-04-24 21:59:37.128837,0 days 00:00:02.666836,0.07832758631615819,7,,1,6,914,0.6313815351153037,TPESampler,COMPLETE
1372,0.29081411243911365,2025-04-24 21:59:35.045938,2025-04-24 21:59:38.027307,0 days 00:00:02.981369,0.09870926630407927,6,,1,2,1097,0.6153489375716701,TPESampler,COMPLETE
1373,0.27209997394994784,2025-04-24 21:59:36.709787,2025-04-24 21:59:40.089542,0 days 00:00:03.379755,0.06361191388855016,8,,1,12,1141,0.6176884885019567,TPESampler,COMPLETE
