number,value,datetime_start,datetime_complete,duration,params_C,params_epsilon,params_gamma,params_kernel,system_attrs_auto:sampler,state
236,0.39959005425528704,2025-04-24 21:55:56.936296,2025-04-24 21:55:57.472770,0 days 00:00:00.536474,1.007929459754738,0.028153086669910798,0.010061533241937246,rbf,TPESampler,COMPLETE
237,0.3007442377931907,2025-04-24 21:55:57.641965,2025-04-24 21:55:58.211538,0 days 00:00:00.569573,10.2144154227153,0.034575689770231975,0.013474623296547937,rbf,TPESampler,COMPLETE
238,0.26814666620494537,2025-04-24 21:55:58.380628,2025-04-24 21:55:59.012043,0 days 00:00:00.631415,8.263286181949507,0.013039757896571672,0.09159378862436825,rbf,TPESampler,COMPLETE
239,0.27042959336997613,2025-04-24 21:55:59.179278,2025-04-24 21:55:59.903802,0 days 00:00:00.724524,20.290907048073024,0.05200339631100619,0.05264562077974718,rbf,TPESampler,COMPLETE
240,146.73089084577958,2025-04-24 21:56:00.079090,2025-04-24 21:56:00.603673,0 days 00:00:00.524583,6.871759345943138,0.006268134609655101,0.05208206131004883,sigmoid,TPESampler,COMPLETE
241,0.9628564967512975,2025-04-24 21:56:00.770546,2025-04-24 21:56:01.303966,0 days 00:00:00.533420,0.0011224931165231685,0.008744742146059251,0.9659090085932347,rbf,TPESampler,COMPLETE
242,0.3389260044248506,2025-04-24 21:56:01.466331,2025-04-24 21:56:01.984572,0 days 00:00:00.518241,1.892866539404922,0.11251336060106631,0.019358066627820764,rbf,TPESampler,COMPLETE
243,0.27051000263404673,2025-04-24 21:56:02.160037,2025-04-24 21:56:02.735190,0 days 00:00:00.575153,6.030225865934332,0.021377383231445654,0.04589940612043545,rbf,TPESampler,COMPLETE
244,0.27952903819657776,2025-04-24 21:56:02.907764,2025-04-24 21:56:03.451294,0 days 00:00:00.543530,3.17542955761815,0.03389650363964842,0.052231117707083906,rbf,TPESampler,COMPLETE
245,0.2694841566514715,2025-04-24 21:56:03.617198,2025-04-24 21:56:04.252980,0 days 00:00:00.635782,12.197086541617168,0.01659318659961455,0.04887620511620407,rbf,TPESampler,COMPLETE
246,0.8521069118460646,2025-04-24 21:56:04.439669,2025-04-24 21:56:04.897867,0 days 00:00:00.458198,0.06460026036748279,0.9739391622060042,0.0034701125490207755,sigmoid,TPESampler,COMPLETE
247,0.7646236377792368,2025-04-24 21:56:05.078863,2025-04-24 22:10:54.800032,0 days 00:14:49.721169,31.019564844341623,0.014097819809630702,0.04592186003195796,poly,TPESampler,COMPLETE
248,0.2856388419688978,2025-04-24 22:10:54.967576,2025-04-24 22:10:55.520691,0 days 00:00:00.553115,6.22190851436989,0.04063475216928617,0.16643998299890708,rbf,TPESampler,COMPLETE
249,0.9293522317437973,2025-04-24 22:10:55.683685,2025-04-24 22:10:56.253936,0 days 00:00:00.570251,0.0010685254473656008,0.001586282572456545,0.019384453257968073,rbf,TPESampler,COMPLETE
250,0.29032969195414404,2025-04-24 22:10:56.417702,2025-04-24 22:10:56.981393,0 days 00:00:00.563691,4.600140316911435,0.017203812946758577,0.19802273025945613,rbf,TPESampler,COMPLETE
251,0.26788280424731237,2025-04-24 22:10:57.164204,2025-04-24 22:10:57.785719,0 days 00:00:00.621515,15.97627447173677,0.0359607247929656,0.07191340615013064,rbf,TPESampler,COMPLETE
252,0.2985910382134353,2025-04-24 22:10:57.957035,2025-04-24 22:10:58.519314,0 days 00:00:00.562279,2.999310190072263,0.009994032103913074,0.03037293109731297,rbf,TPESampler,COMPLETE
253,374.6303710188651,2025-04-24 22:10:58.688287,2025-04-24 22:10:59.224319,0 days 00:00:00.536032,17.213350438595473,0.023279328300238385,0.09531192563155438,sigmoid,TPESampler,COMPLETE
254,0.29716464385302793,2025-04-24 22:10:59.400472,2025-04-24 22:10:59.939933,0 days 00:00:00.539461,1.780040932352757,0.05631912259853741,0.04752413785572537,rbf,TPESampler,COMPLETE
255,0.9844418887697844,2025-04-24 22:11:00.118069,2025-04-24 22:11:00.606191,0 days 00:00:00.488122,0.00213806136958963,0.7397889650619793,0.0022938160554092078,rbf,TPESampler,COMPLETE
256,0.49984761032727826,2025-04-24 22:11:00.774318,2025-04-24 22:11:02.223401,0 days 00:00:01.449083,3.5892890423469788,0.010764510678504301,0.10377818352964015,linear,TPESampler,COMPLETE
257,0.3387393245266152,2025-04-24 22:11:02.393472,2025-04-24 22:11:03.026494,0 days 00:00:00.633022,15.109171762009115,0.03133161758494042,0.32174330955956854,rbf,TPESampler,COMPLETE
258,0.272834801542486,2025-04-24 22:11:03.203351,2025-04-24 22:11:03.858041,0 days 00:00:00.654690,20.663217925267464,0.024817967337058666,0.039064940610494654,rbf,TPESampler,COMPLETE
259,0.60704083067913,2025-04-24 22:11:04.029600,2025-04-24 22:11:04.555700,0 days 00:00:00.526100,1.2177898274967034,0.05623367456502674,0.973157623304347,rbf,TPESampler,COMPLETE
260,0.47557633478522787,2025-04-24 22:11:04.716360,2025-04-24 22:11:05.450941,0 days 00:00:00.734581,1.385571541417321,0.06818670405583822,0.24551148186594893,linear,TPESampler,COMPLETE
261,0.30865554074544116,2025-04-24 22:11:05.662265,2025-04-24 22:11:06.270682,0 days 00:00:00.608417,0.9199641307824551,0.014263513516670417,0.15430721375631068,rbf,TPESampler,COMPLETE
262,0.2711377288000919,2025-04-24 22:11:06.436083,2025-04-24 22:11:07.017023,0 days 00:00:00.580940,9.652470371356653,0.04075178639767549,0.04645102438479524,rbf,TPESampler,COMPLETE
263,0.27023268459859445,2025-04-24 22:11:07.192889,2025-04-24 22:11:07.745222,0 days 00:00:00.552333,3.8538972435051675,0.02729188412404914,0.05837550851638977,rbf,TPESampler,COMPLETE
264,0.3244433380717276,2025-04-24 22:11:07.927325,2025-04-24 22:11:08.449189,0 days 00:00:00.521864,30.03729406010543,0.117329076783094,0.196999162501843,rbf,TPESampler,COMPLETE
265,0.3062773176815425,2025-04-24 22:11:08.622661,2025-04-24 22:11:09.194645,0 days 00:00:00.571984,7.798869543682416,0.011553511092799753,0.014554425577648628,rbf,TPESampler,COMPLETE
266,0.2767493809757695,2025-04-24 22:11:09.362564,2025-04-24 22:11:09.936984,0 days 00:00:00.574420,2.85754752116061,0.031904651586900375,0.1524204577485247,rbf,TPESampler,COMPLETE
267,0.2732025324917644,2025-04-24 22:11:10.118198,2025-04-24 22:11:10.880082,0 days 00:00:00.761884,13.427413011243171,0.004903986904080937,0.09397773052047705,rbf,TPESampler,COMPLETE
268,0.2697410888751532,2025-04-24 22:11:11.043261,2025-04-24 22:11:11.615748,0 days 00:00:00.572487,4.42348898160441,0.02086338438631535,0.056078317357152845,rbf,TPESampler,COMPLETE
269,0.3025647778687661,2025-04-24 22:11:11.784656,2025-04-24 22:11:12.374109,0 days 00:00:00.589453,9.172880043974464,0.16678386492488728,0.025758977633949375,rbf,TPESampler,COMPLETE
270,0.3063256853252291,2025-04-24 22:11:12.762645,2025-04-24 22:11:13.356630,0 days 00:00:00.593985,21.120356011270285,0.01986348834233167,0.17198110408178593,rbf,TPESampler,COMPLETE
271,0.28132906429964616,2025-04-24 22:11:13.534729,2025-04-24 22:11:14.101294,0 days 00:00:00.566565,2.0507223948695237,0.07470644687245567,0.1258607988959004,rbf,TPESampler,COMPLETE
272,0.279287829288364,2025-04-24 22:11:14.367636,2025-04-24 22:11:15.050849,0 days 00:00:00.683213,2.669523811800917,0.0324675271169614,0.05952520590773862,rbf,TPESampler,COMPLETE
273,0.28931299572348185,2025-04-24 22:11:15.217459,2025-04-24 22:11:15.850865,0 days 00:00:00.633406,93.44744394809436,0.04379197628528684,0.0628030477356072,rbf,TPESampler,COMPLETE
274,0.266812393563086,2025-04-24 22:11:16.026510,2025-04-24 22:11:16.617901,0 days 00:00:00.591391,9.62487204470088,0.02814839361366692,0.055609669042583104,rbf,TPESampler,COMPLETE
275,0.28341183647302737,2025-04-24 22:11:16.798592,2025-04-24 22:11:17.323607,0 days 00:00:00.525015,5.759883945834776,0.09445764075915732,0.03603135424754825,rbf,TPESampler,COMPLETE
276,0.517827417541633,2025-04-24 22:11:17.499830,2025-04-24 22:14:09.716243,0 days 00:02:52.216413,6.2207038366000145,0.03276187288581357,0.05102484498491043,poly,TPESampler,COMPLETE
277,0.2690881627089389,2025-04-24 22:14:09.922442,2025-04-24 22:14:10.641254,0 days 00:00:00.718812,12.383443711519906,0.015242562884673459,0.08867204124885465,rbf,TPESampler,COMPLETE
278,0.2906383756647337,2025-04-24 22:14:10.818064,2025-04-24 22:14:11.381268,0 days 00:00:00.563204,8.277371913519877,0.04349796068836108,0.019003610432918833,rbf,TPESampler,COMPLETE
279,5.495071335399512,2025-04-24 22:14:11.551696,2025-04-24 22:14:12.078031,0 days 00:00:00.526335,0.2259687615530287,0.024906834918014563,0.06801826840932193,sigmoid,TPESampler,COMPLETE
280,0.3241705228036834,2025-04-24 22:14:12.243968,2025-04-24 22:14:12.790220,0 days 00:00:00.546252,11.583283519903505,0.04377495704285476,0.2506223873569324,rbf,TPESampler,COMPLETE
281,0.29316613135024433,2025-04-24 22:14:13.142887,2025-04-24 22:14:13.767415,0 days 00:00:00.624528,1.1488926002194926,0.030368914420530364,0.10047636025017104,rbf,TPESampler,COMPLETE
282,0.27458259308825916,2025-04-24 22:14:13.935800,2025-04-24 22:14:14.642111,0 days 00:00:00.706311,9.688090009428333,0.05184522903493923,0.04143088893301454,rbf,TPESampler,COMPLETE
283,0.3165201732463092,2025-04-24 22:14:14.834434,2025-04-24 22:14:15.428722,0 days 00:00:00.594288,6.193881408550106,0.009213714355611989,0.2695279817903866,rbf,TPESampler,COMPLETE
284,0.2737954888264229,2025-04-24 22:14:15.615463,2025-04-24 22:14:16.205685,0 days 00:00:00.590222,5.704801321888662,0.058782542974280656,0.12122162222675667,rbf,TPESampler,COMPLETE
285,0.5735306419638998,2025-04-24 22:14:16.379736,2025-04-24 22:14:16.907747,0 days 00:00:00.528011,0.002806927549953395,0.0013023112424123797,0.00028849745433482765,linear,TPESampler,COMPLETE
286,0.28906437113225675,2025-04-24 22:14:17.110303,2025-04-24 22:14:17.695189,0 days 00:00:00.584886,3.807845394883165,0.010310767782289293,0.03205395218958885,rbf,TPESampler,COMPLETE
287,0.4859373395484909,2025-04-24 22:14:17.859070,2025-04-24 22:14:19.356526,0 days 00:00:01.497456,4.81321129642958,0.08082883334449373,0.00976286048237145,linear,TPESampler,COMPLETE
288,0.6172573422777551,2025-04-24 22:14:19.524094,2025-04-24 22:14:20.076995,0 days 00:00:00.552901,6.864255533115877,0.01609783279033249,0.00012559183830841415,rbf,TPESampler,COMPLETE
289,0.32696481375302644,2025-04-24 22:14:20.244217,2025-04-24 22:14:20.892396,0 days 00:00:00.648179,1.23748050858192,0.028931262757785185,0.033862809644678714,rbf,TPESampler,COMPLETE
290,0.2705798760401143,2025-04-24 22:14:21.067331,2025-04-24 22:14:21.700718,0 days 00:00:00.633387,14.355913603300834,0.02420860059275455,0.09179549803701481,rbf,TPESampler,COMPLETE
291,0.36279977567277816,2025-04-24 22:14:21.884382,2025-04-24 22:14:22.456487,0 days 00:00:00.572105,3.209449532658894,0.01894887119251572,0.4190422814276568,rbf,TPESampler,COMPLETE
292,594.7963954939903,2025-04-24 22:14:22.620930,2025-04-24 22:14:23.161228,0 days 00:00:00.540298,28.29476295655608,0.12142719616224922,0.25228377327415313,sigmoid,TPESampler,COMPLETE
293,0.2867587235922811,2025-04-24 22:14:23.337817,2025-04-24 22:14:23.997787,0 days 00:00:00.659970,28.72242706445091,0.020660570604305074,0.02388122183464291,rbf,TPESampler,COMPLETE
294,0.2707884776087055,2025-04-24 22:14:24.167479,2025-04-24 22:14:24.751941,0 days 00:00:00.584462,13.687859618896697,0.04341270142088243,0.09810378272887132,rbf,TPESampler,COMPLETE
295,0.2913704675831489,2025-04-24 22:14:24.937447,2025-04-24 22:14:25.499863,0 days 00:00:00.562416,1.4004620010669502,0.009352263455835912,0.07960175693279675,rbf,TPESampler,COMPLETE
296,0.294417907926287,2025-04-24 22:14:25.666804,2025-04-24 22:14:26.198937,0 days 00:00:00.532133,3.1284503228782037,0.10485228493854477,0.16010273607268286,rbf,TPESampler,COMPLETE
297,0.5737853350922053,2025-04-24 22:14:26.375097,2025-04-24 22:14:46.659378,0 days 00:00:20.284281,0.41287890292054114,0.01373539422028212,0.0859365443998245,poly,TPESampler,COMPLETE
298,0.2803295124720411,2025-04-24 22:14:46.835811,2025-04-24 22:14:47.407025,0 days 00:00:00.571214,1.908660811038856,0.027975596302951943,0.12507417975126162,rbf,TPESampler,COMPLETE
299,0.3303188625116585,2025-04-24 22:14:47.582482,2025-04-24 22:14:48.140748,0 days 00:00:00.558266,1.8819849007464902,0.04171768581872939,0.021984308560090333,rbf,TPESampler,COMPLETE
300,0.2723326570914996,2025-04-24 22:14:48.323809,2025-04-24 22:14:49.017187,0 days 00:00:00.693378,18.065875417957557,0.016261625968913333,0.06939020020603204,rbf,TPESampler,COMPLETE
301,0.2709875448184868,2025-04-24 22:14:49.190158,2025-04-24 22:14:49.728764,0 days 00:00:00.538606,15.988149079537537,0.08185586618030834,0.0447628302572757,rbf,TPESampler,COMPLETE
302,34.71375278801725,2025-04-24 22:14:49.904660,2025-04-24 22:14:50.447452,0 days 00:00:00.542792,1.7834900421217106,0.1919712839125234,0.033635818602613644,sigmoid,TPESampler,COMPLETE
303,0.26575043668355985,2025-04-24 22:14:50.745964,2025-04-24 22:14:51.341130,0 days 00:00:00.595166,4.555385066612915,0.03339847838001477,0.06395771305480985,rbf,TPESampler,COMPLETE
304,0.30113842942390223,2025-04-24 22:14:51.508745,2025-04-24 22:14:52.040427,0 days 00:00:00.531682,3.142639257812456,0.06987201622853613,0.028380716343958067,rbf,TPESampler,COMPLETE
305,0.3670160178359491,2025-04-24 22:14:52.206551,2025-04-24 22:14:52.741296,0 days 00:00:00.534745,0.3156478254393031,0.05395859292659822,0.11191844695921671,rbf,TPESampler,COMPLETE
306,0.27321571426898733,2025-04-24 22:14:52.977654,2025-04-24 22:14:53.592295,0 days 00:00:00.614641,2.6176830414273744,0.06586598494490527,0.10836080175527785,rbf,TPESampler,COMPLETE
307,0.4975129549259366,2025-04-24 22:14:53.805428,2025-04-24 22:14:54.349809,0 days 00:00:00.544381,0.007514858945442217,0.011260701996351366,0.23739555634892667,linear,TPESampler,COMPLETE
308,0.36166618176093157,2025-04-24 22:14:54.506564,2025-04-24 22:14:55.029572,0 days 00:00:00.523008,1.719072099063517,0.01896702214910187,0.013191993950675877,rbf,TPESampler,COMPLETE
309,0.26887266894106465,2025-04-24 22:14:55.199452,2025-04-24 22:14:55.737905,0 days 00:00:00.538453,5.760299403664781,0.030472047570228408,0.049004050933816566,rbf,TPESampler,COMPLETE
310,0.27888346412189613,2025-04-24 22:14:55.897635,2025-04-24 22:14:56.455012,0 days 00:00:00.557377,6.285660008615333,0.026650562202867108,0.03299637051402735,rbf,TPESampler,COMPLETE
311,0.32454822683237383,2025-04-24 22:14:56.617240,2025-04-24 22:14:57.194997,0 days 00:00:00.577757,12.712170004353823,0.05069154315350967,0.24586442343785364,rbf,TPESampler,COMPLETE
312,0.278177947197518,2025-04-24 22:14:57.372457,2025-04-24 22:14:57.937497,0 days 00:00:00.565040,2.254416502325551,0.02329565343352564,0.13582004537164918,rbf,TPESampler,COMPLETE
313,0.26581734901721144,2025-04-24 22:14:58.096428,2025-04-24 22:14:58.661536,0 days 00:00:00.565108,8.223597497780858,0.041634530842223134,0.07641763168575583,rbf,TPESampler,COMPLETE
314,0.27780448200599583,2025-04-24 22:14:58.836704,2025-04-24 22:14:59.431734,0 days 00:00:00.595030,37.10933804234111,0.08001857745992905,0.07358208036649011,rbf,TPESampler,COMPLETE
315,0.2819200974136786,2025-04-24 22:14:59.615269,2025-04-24 22:15:00.174553,0 days 00:00:00.559284,4.502243865323587,0.06184947621189864,0.1487280311107755,rbf,TPESampler,COMPLETE
316,0.26578591451497113,2025-04-24 22:15:00.343958,2025-04-24 22:15:00.881889,0 days 00:00:00.537931,7.896023731943998,0.08938580137150408,0.08412377326168835,rbf,TPESampler,COMPLETE
317,0.6025369827330511,2025-04-24 22:15:01.052118,2025-04-24 22:15:12.765451,0 days 00:00:11.713333,0.4520592091457713,0.209327170727954,0.06260851201778922,poly,TPESampler,COMPLETE
318,0.28032998699169515,2025-04-24 22:15:12.933468,2025-04-24 22:15:13.498847,0 days 00:00:00.565379,6.045445368122378,0.10042041919361741,0.043345386485930344,rbf,TPESampler,COMPLETE
319,0.595285225854387,2025-04-24 22:15:13.804541,2025-04-24 22:15:34.658599,0 days 00:00:20.854058,10.863072606194033,0.08416967083303319,0.02179003820169959,poly,TPESampler,COMPLETE
320,0.2762847311475951,2025-04-24 22:15:34.822830,2025-04-24 22:15:35.362208,0 days 00:00:00.539378,11.565339918411905,0.14357076496134902,0.05381483234088596,rbf,TPESampler,COMPLETE
321,0.3480685119408528,2025-04-24 22:15:35.744705,2025-04-24 22:15:36.236542,0 days 00:00:00.491837,4.427207902115996,0.20632140760231996,0.21042669933077585,rbf,TPESampler,COMPLETE
322,80.75034473105637,2025-04-24 22:15:36.397744,2025-04-24 22:15:36.957284,0 days 00:00:00.559540,3.787536993407556,0.02904118499106282,0.04966856688940158,sigmoid,TPESampler,COMPLETE
323,0.48769592172325804,2025-04-24 22:15:37.121108,2025-04-24 22:16:13.311263,0 days 00:00:36.190155,93.18833939859275,0.09603119153736485,0.30605020214313555,linear,TPESampler,COMPLETE
324,0.2708726745419155,2025-04-24 22:16:13.538135,2025-04-24 22:16:14.230766,0 days 00:00:00.692631,19.136969073072304,0.03788574265165619,0.05193803002927314,rbf,TPESampler,COMPLETE
325,0.29316649946324014,2025-04-24 22:16:14.555430,2025-04-24 22:16:15.130635,0 days 00:00:00.575205,11.511588652188008,0.14054972566864915,0.1270707083398718,rbf,TPESampler,COMPLETE
326,0.28794540128078494,2025-04-24 22:16:15.419393,2025-04-24 22:16:16.013675,0 days 00:00:00.594282,6.043452804784868,0.06464686469001182,0.026125375973176088,rbf,TPESampler,COMPLETE
327,0.38422295324962835,2025-04-24 22:16:16.183046,2025-04-24 22:16:16.736620,0 days 00:00:00.553574,11.454255705539616,0.029699277448754516,0.46929346933967286,rbf,TPESampler,COMPLETE
328,0.3374475792703597,2025-04-24 22:16:16.908407,2025-04-24 22:16:17.449858,0 days 00:00:00.541451,0.6120113387101428,0.026812371830289245,0.057389962830086794,rbf,TPESampler,COMPLETE
329,0.5019442573914576,2025-04-24 22:16:17.613462,2025-04-24 22:16:23.108652,0 days 00:00:05.495190,17.522841412856927,0.024781916010132424,0.039591108056923126,linear,TPESampler,COMPLETE
330,0.3002266462027696,2025-04-24 22:16:23.276900,2025-04-24 22:16:23.929202,0 days 00:00:00.652302,85.27442457138339,0.05531968326353563,0.013980701023320658,rbf,TPESampler,COMPLETE
331,0.2888960667476243,2025-04-24 22:16:24.113446,2025-04-24 22:16:24.635159,0 days 00:00:00.521713,1.6328876758376119,0.04195764921730361,0.14941055387834806,rbf,TPESampler,COMPLETE
332,0.7608478987849759,2025-04-24 22:16:24.798315,2025-04-24 22:16:25.327029,0 days 00:00:00.528714,0.30390885340966317,0.0022110114002429596,0.00017534604387942253,rbf,TPESampler,COMPLETE
333,0.3101676639693403,2025-04-24 22:16:25.490862,2025-04-24 22:16:26.305274,0 days 00:00:00.814412,82.2203914147624,0.00586633737373026,0.011470745373999058,rbf,TPESampler,COMPLETE
334,0.27413386006315466,2025-04-24 22:16:26.477429,2025-04-24 22:16:27.034018,0 days 00:00:00.556589,11.997728529228265,0.05523825309372087,0.11171911324527682,rbf,TPESampler,COMPLETE
335,1.4384471835825237,2025-04-24 22:16:27.204615,2025-04-25 00:47:02.654891,0 days 02:30:35.450276,2.4959121118638374,0.07053523442957729,0.5857305238959974,poly,TPESampler,COMPLETE
336,0.2954076871869336,2025-04-24 23:16:19.040432,2025-04-24 23:16:19.625811,0 days 00:00:00.585379,1.9164261475267825,0.06730263265469326,0.04749895657115431,rbf,TPESampler,COMPLETE
337,0.2682384205329565,2025-04-24 23:16:19.944044,2025-04-24 23:16:20.532140,0 days 00:00:00.588096,3.2794408201912133,0.015046464818081409,0.08645962577858583,rbf,TPESampler,COMPLETE
338,0.5610933259387758,2025-04-24 23:16:20.695088,2025-04-24 23:16:21.168327,0 days 00:00:00.473239,0.0032672385791886623,0.08316671549668209,0.001274751640948775,linear,TPESampler,COMPLETE
339,0.8923757678702986,2025-04-24 23:16:21.323873,2025-04-24 23:40:10.584429,0 days 00:23:49.260556,0.13416557469541932,0.0010605706065002231,0.36259943824634144,poly,TPESampler,COMPLETE
340,0.2824937205898954,2025-04-24 23:40:10.740537,2025-04-24 23:40:11.489651,0 days 00:00:00.749114,39.26477248638365,0.01179626041179426,0.07655335472115078,rbf,TPESampler,COMPLETE
341,0.28407107385158015,2025-04-24 23:40:11.648365,2025-04-24 23:40:12.151053,0 days 00:00:00.502688,8.371253113766915,0.05159868464994785,0.023708889176090514,rbf,TPESampler,COMPLETE
342,0.2935773430314142,2025-04-24 23:40:12.320055,2025-04-24 23:40:12.882646,0 days 00:00:00.562591,29.46201726354066,0.03119844801091292,0.12159171283510374,rbf,TPESampler,COMPLETE
343,0.2874387481775248,2025-04-24 23:40:13.127259,2025-04-24 23:40:13.652629,0 days 00:00:00.525370,3.302378576150188,0.02633990489130902,0.03619135411583649,rbf,TPESampler,COMPLETE
344,0.26605929289491936,2025-04-24 23:40:13.809410,2025-04-24 23:40:14.396235,0 days 00:00:00.586825,8.982453711811845,0.02680623365411378,0.09269114894353468,rbf,TPESampler,COMPLETE
345,19.899250238140024,2025-04-24 23:40:14.548488,2025-04-24 23:40:15.045194,0 days 00:00:00.496706,10.067778894955438,0.039476936003477306,0.004127273982530526,sigmoid,TPESampler,COMPLETE
346,0.2693649819460755,2025-04-24 23:40:15.199472,2025-04-24 23:40:15.717787,0 days 00:00:00.518315,11.267950814135057,0.05065123973777043,0.09779737708348672,rbf,TPESampler,COMPLETE
347,0.3179307724206342,2025-04-24 23:40:15.884707,2025-04-24 23:40:16.403785,0 days 00:00:00.519078,5.031693409563056,0.02586268353995483,0.014476461307348079,rbf,TPESampler,COMPLETE
348,0.5684641528746133,2025-04-24 23:40:16.560544,2025-04-24 23:40:17.000212,0 days 00:00:00.439668,37.07902315442575,0.661337275245654,0.25536529940894276,rbf,TPESampler,COMPLETE
349,0.2918549569389585,2025-04-24 23:40:17.168545,2025-04-24 23:40:17.658664,0 days 00:00:00.490119,6.226815922181094,0.08476674397348748,0.1604280115973981,rbf,TPESampler,COMPLETE
350,0.3798202122833878,2025-04-24 23:40:17.816152,2025-04-24 23:40:18.280386,0 days 00:00:00.464234,0.4295660257756447,0.2055344356091836,0.055045254514648936,rbf,TPESampler,COMPLETE
351,0.958666291770251,2025-04-24 23:40:18.442014,2025-04-24 23:40:19.075272,0 days 00:00:00.633258,0.20333027892196087,0.0010027426805118416,0.0007678705107271085,poly,TPESampler,COMPLETE
352,0.27148496234855607,2025-04-24 23:40:19.234823,2025-04-24 23:40:19.931853,0 days 00:00:00.697030,20.267716957941772,0.027471442763767114,0.0493388678462946,rbf,TPESampler,COMPLETE
353,0.44360576432582266,2025-04-24 23:40:20.085147,2025-04-24 23:40:20.695830,0 days 00:00:00.610683,0.6745184427272771,0.035906468163085535,0.058055625307651036,linear,TPESampler,COMPLETE
