number,value,datetime_start,datetime_complete,duration,params_C,params_epsilon,params_gamma,params_kernel,system_attrs_auto:sampler,state
1653,0.47122931835723764,2025-04-25 05:16:34.719235,2025-04-25 05:16:35.257686,0 days 00:00:00.538451,38.59889830057057,0.017060341020443983,0.7073083606106705,rbf,TPESampler,COMPLETE
1654,0.2778126672524168,2025-04-25 05:16:35.437455,2025-04-25 05:16:36.044044,0 days 00:00:00.606589,21.400579781981683,0.027913397412277555,0.1043695298552866,rbf,TPESampler,COMPLETE
1655,0.2760620420067694,2025-04-25 05:16:36.221975,2025-04-25 05:16:36.759712,0 days 00:00:00.537737,23.462303791273502,0.09519392996920664,0.08683299546710699,rbf,TPESampler,COMPLETE
1656,0.3424580297269706,2025-04-25 05:16:36.937317,2025-04-25 05:16:37.494927,0 days 00:00:00.557610,4.825587248939303,0.04433814312572861,0.3340340007295798,rbf,TPESampler,COMPLETE
1657,0.2676385676993304,2025-04-25 05:16:37.670364,2025-04-25 05:16:38.281401,0 days 00:00:00.611037,9.25335218431274,0.01640427354253178,0.09327974314615702,rbf,TPESampler,COMPLETE
1658,0.3074997449175208,2025-04-25 05:16:38.458737,2025-04-25 05:16:38.961326,0 days 00:00:00.502589,1.1878070785761146,0.13673836146758664,0.06524376384528814,rbf,TPESampler,COMPLETE
1659,0.2740103409186788,2025-04-25 05:16:39.143968,2025-04-25 05:16:39.690761,0 days 00:00:00.546793,3.1476883626452996,0.04364537615870403,0.13545181898569228,rbf,TPESampler,COMPLETE
1660,0.29508431715120487,2025-04-25 05:16:39.869071,2025-04-25 05:16:40.506035,0 days 00:00:00.636964,1.4385550616510703,0.03552137719519042,0.06001369684119361,rbf,TPESampler,COMPLETE
1661,0.9793176211187478,2025-04-25 05:16:40.677538,2025-04-25 06:07:06.050545,0 days 00:50:25.373007,7.356222889913661,0.02598796199731877,0.3418004551114655,poly,TPESampler,COMPLETE
1662,0.3111116641967842,2025-04-25 05:33:41.731968,2025-04-25 05:33:42.329353,0 days 00:00:00.597385,10.306619798938195,0.06135699465686365,0.01163046365589385,rbf,TPESampler,COMPLETE
1663,0.45388574662178843,2025-04-25 05:33:42.513674,2025-04-25 05:33:43.025618,0 days 00:00:00.511944,0.024660812838661554,0.1634686422607789,0.0008539025389321386,linear,TPESampler,COMPLETE
1664,0.27127700631171653,2025-04-25 05:33:43.200031,2025-04-25 05:33:43.742653,0 days 00:00:00.542622,7.46536595103752,0.0388984669318059,0.041619494470288475,rbf,TPESampler,COMPLETE
1665,0.2706088587393923,2025-04-25 05:33:43.919581,2025-04-25 05:33:44.448211,0 days 00:00:00.528630,10.038150194338414,0.08750804253675765,0.056887194715916266,rbf,TPESampler,COMPLETE
1666,0.38352683550528405,2025-04-25 05:33:44.627695,2025-04-25 05:33:45.117164,0 days 00:00:00.489469,18.36742189445985,0.2794189768481691,0.22508808673074174,rbf,TPESampler,COMPLETE
1667,0.2788515788303708,2025-04-25 05:33:45.302155,2025-04-25 05:33:45.988871,0 days 00:00:00.686716,32.49577986640444,0.021968053031070824,0.05335975074033935,rbf,TPESampler,COMPLETE
1668,35.93019950982594,2025-04-25 05:33:46.162020,2025-04-25 05:33:46.686456,0 days 00:00:00.524436,1.5612833913609865,0.25736410594097325,0.06634100269409135,sigmoid,TPESampler,COMPLETE
1669,37.56923395792579,2025-04-25 05:33:46.880086,2025-04-25 06:22:27.124738,0 days 00:48:40.244652,21.71461337392346,0.007434409169630332,0.6467502331465658,poly,TPESampler,COMPLETE
1670,0.3747404342212054,2025-04-25 05:47:47.609722,2025-04-25 05:47:48.572579,0 days 00:00:00.962857,1.7884374635153975,0.016964431668725882,0.00993674817117125,rbf,TPESampler,COMPLETE
1671,0.32177501656754276,2025-04-25 05:47:49.007264,2025-04-25 05:47:49.860824,0 days 00:00:00.853560,82.39025529390449,0.061537040652019134,0.22335853351605006,rbf,TPESampler,COMPLETE
1672,0.284573870866155,2025-04-25 05:47:50.076318,2025-04-25 05:47:51.058333,0 days 00:00:00.982015,3.335241114556155,0.06478625765232371,0.04494895500919522,rbf,TPESampler,COMPLETE
1673,0.2941985119519119,2025-04-25 05:47:51.436133,2025-04-25 05:47:52.367027,0 days 00:00:00.930894,9.526564349605579,0.018187380514729075,0.1835587644104745,rbf,TPESampler,COMPLETE
1674,0.2881005255130667,2025-04-25 05:47:52.626511,2025-04-25 05:47:53.365241,0 days 00:00:00.738730,2.0177405829564696,0.021711383589440643,0.05662883187297902,rbf,TPESampler,COMPLETE
1675,0.6192732449347605,2025-04-25 05:47:53.739329,2025-04-25 05:47:58.329557,0 days 00:00:04.590228,79.02698968889202,0.019317010430318436,0.009358812049423688,poly,TPESampler,COMPLETE
1676,0.3034770111529009,2025-04-25 05:47:58.510940,2025-04-25 05:47:59.071366,0 days 00:00:00.560426,8.443294511482298,0.037513221483063595,0.20749912883068522,rbf,TPESampler,COMPLETE
1677,0.5068623679874955,2025-04-25 05:47:59.251914,2025-04-25 05:48:16.834061,0 days 00:00:17.582147,56.03499968928784,0.005060284679975775,0.07744909470255194,linear,TPESampler,COMPLETE
1678,0.3062166184293509,2025-04-25 05:48:17.020709,2025-04-25 05:48:17.522862,0 days 00:00:00.502153,6.031408063946328,0.16776501065385505,0.14211182885945747,rbf,TPESampler,COMPLETE
1679,0.27097956967498266,2025-04-25 05:48:17.704380,2025-04-25 05:48:18.281528,0 days 00:00:00.577148,25.63241445261295,0.05783006171227119,0.05373006153662742,rbf,TPESampler,COMPLETE
1680,0.26638800770952875,2025-04-25 05:48:18.456804,2025-04-25 05:48:19.036584,0 days 00:00:00.579780,6.574142610101923,0.02309857646893552,0.09571883273365481,rbf,TPESampler,COMPLETE
1681,0.29356480422749376,2025-04-25 05:48:19.216140,2025-04-25 05:48:19.818028,0 days 00:00:00.601888,13.086212629058453,0.0038199706534389733,0.014213950925033624,rbf,TPESampler,COMPLETE
1682,0.3038460710103956,2025-04-25 05:48:19.999776,2025-04-25 05:48:20.506250,0 days 00:00:00.506474,4.775156493328198,0.12456908896401321,0.022765113073375386,rbf,TPESampler,COMPLETE
1683,0.3082726345060472,2025-04-25 05:48:20.686163,2025-04-25 05:48:21.243464,0 days 00:00:00.557301,0.8855161049422186,0.026458556530200232,0.07458255200919037,rbf,TPESampler,COMPLETE
1684,0.2811370740037998,2025-04-25 05:48:21.426412,2025-04-25 05:48:22.084046,0 days 00:00:00.657634,24.142853671071876,0.023920924328075535,0.02882776936203656,rbf,TPESampler,COMPLETE
1685,0.3231173208520228,2025-04-25 05:48:22.265319,2025-04-25 05:48:22.813208,0 days 00:00:00.547889,1.744913922891903,0.056706208340691115,0.28563635355848216,rbf,TPESampler,COMPLETE
1686,0.2864458613901519,2025-04-25 05:48:22.992605,2025-04-25 05:48:23.566454,0 days 00:00:00.573849,4.462010809377444,0.014198083133014893,0.030602340911898625,rbf,TPESampler,COMPLETE
1687,0.2938173891309951,2025-04-25 05:48:23.745559,2025-04-25 05:48:24.277898,0 days 00:00:00.532339,7.732334408779909,0.08560250349298758,0.1601741718693985,rbf,TPESampler,COMPLETE
1688,0.266273855787467,2025-04-25 05:48:24.458650,2025-04-25 05:48:25.003238,0 days 00:00:00.544588,5.789138265721236,0.057056444092377576,0.07680118542267479,rbf,TPESampler,COMPLETE
1689,0.3340643394519519,2025-04-25 05:48:25.183132,2025-04-25 05:48:25.691372,0 days 00:00:00.508240,2.1633724446327123,0.07082757769875626,0.01827053696834884,rbf,TPESampler,COMPLETE
1690,0.3049596414351569,2025-04-25 05:48:25.868527,2025-04-25 05:48:26.485143,0 days 00:00:00.616616,62.69910267434209,0.01342883067680213,0.17799771547113966,rbf,TPESampler,COMPLETE
1691,103.1148948335767,2025-04-25 05:48:26.664696,2025-04-25 05:48:27.304937,0 days 00:00:00.640241,4.818882618645737,0.02961400581501232,0.11193422227450034,sigmoid,TPESampler,COMPLETE
1692,0.27270457028709505,2025-04-25 05:48:27.476687,2025-04-25 05:48:28.026339,0 days 00:00:00.549652,16.77072919883706,0.049318417144206976,0.09593650606651545,rbf,TPESampler,COMPLETE
1693,0.31494868858055713,2025-04-25 05:48:28.206361,2025-04-25 05:48:28.751867,0 days 00:00:00.545506,1.9395281789749657,0.03579812983561344,0.02935420811374514,rbf,TPESampler,COMPLETE
1694,0.29917983510561136,2025-04-25 05:48:28.930268,2025-04-25 05:48:29.978992,0 days 00:00:01.048724,85.87873805535925,0.008368475547450346,0.05401987442324842,rbf,TPESampler,COMPLETE
1695,0.27985083580476916,2025-04-25 05:48:30.158816,2025-04-25 05:48:30.738882,0 days 00:00:00.580066,10.430733132792549,0.029386438187609373,0.0278284659231211,rbf,TPESampler,COMPLETE
1696,0.4084521395142258,2025-04-25 05:48:30.912753,2025-04-25 05:48:31.438094,0 days 00:00:00.525341,18.457621491642218,0.07957666284042823,0.4975436115447452,rbf,TPESampler,COMPLETE
1697,0.26656879034108755,2025-04-25 05:48:31.620499,2025-04-25 05:48:32.215931,0 days 00:00:00.595432,7.3391441570512415,0.021059119972405456,0.10086252646211918,rbf,TPESampler,COMPLETE
1698,0.37537394233632787,2025-04-25 05:48:32.396225,2025-04-25 05:48:32.936685,0 days 00:00:00.540460,0.2928020944084769,0.04702581856327884,0.12738482048558267,rbf,TPESampler,COMPLETE
1699,0.7577128386527601,2025-04-25 05:48:33.115794,2025-04-25 05:48:33.679840,0 days 00:00:00.564046,3.659898964500877,0.08503434765158503,0.006181150880086418,poly,TPESampler,COMPLETE
1700,0.3401608227834815,2025-04-25 05:48:33.860656,2025-04-25 05:48:34.400955,0 days 00:00:00.540299,0.8482122596853588,0.038649157433812115,0.252197628488722,rbf,TPESampler,COMPLETE
1701,0.3153571334709309,2025-04-25 05:48:34.584612,2025-04-25 05:48:35.080440,0 days 00:00:00.495828,5.590437041603646,0.2589511017689548,0.03153553618090367,rbf,TPESampler,COMPLETE
1702,0.551928593344818,2025-04-25 05:48:35.254177,2025-04-25 05:49:18.438488,0 days 00:00:43.184311,15.513288299458717,0.01959867011421961,0.03188895559662081,poly,TPESampler,COMPLETE
1703,0.28630526147178126,2025-04-25 05:49:18.620359,2025-04-25 05:49:19.155036,0 days 00:00:00.534677,19.18981994673571,0.09953268847471457,0.02966090488358251,rbf,TPESampler,COMPLETE
1704,0.26477352994480097,2025-04-25 05:49:19.334207,2025-04-25 05:49:19.904790,0 days 00:00:00.570583,3.5679813560491223,0.03923052138278312,0.09053017548715876,rbf,TPESampler,COMPLETE
1705,0.2863392392715052,2025-04-25 05:49:20.095118,2025-04-25 05:49:20.633775,0 days 00:00:00.538657,2.0182864548019084,0.052391025622888075,0.1609520285603002,rbf,TPESampler,COMPLETE
1706,0.35571927141986137,2025-04-25 05:49:20.808146,2025-04-25 05:49:21.308099,0 days 00:00:00.499953,0.5185687530320175,0.08913800536269524,0.05010659593306822,rbf,TPESampler,COMPLETE
1707,0.9399010776671646,2025-04-25 05:49:21.478930,2025-04-25 05:49:21.985301,0 days 00:00:00.506371,0.002643985504537427,0.26048523723404643,0.003825081710040835,sigmoid,TPESampler,COMPLETE
1708,0.32110588714045574,2025-04-25 05:49:22.159357,2025-04-25 05:49:22.696012,0 days 00:00:00.536655,1.4040098630832243,0.02513607806070355,0.034617077510828015,rbf,TPESampler,COMPLETE
1709,324.6282596305831,2025-04-25 05:49:22.874143,2025-04-25 05:49:23.402472,0 days 00:00:00.528329,16.190929648628664,0.19099828803335614,0.15612141122326337,sigmoid,TPESampler,COMPLETE
1710,0.34158795366223604,2025-04-25 05:49:23.584455,2025-04-25 05:49:24.135532,0 days 00:00:00.551077,0.5496206183185192,0.02230167775298116,0.06030116269701336,rbf,TPESampler,COMPLETE
1711,0.313776021170335,2025-04-25 05:49:24.312762,2025-04-25 05:49:24.883653,0 days 00:00:00.570891,2.064010692208143,0.012899851091382085,0.29411623862779457,rbf,TPESampler,COMPLETE
1712,0.27395928163744815,2025-04-25 05:49:25.068366,2025-04-25 05:49:25.672557,0 days 00:00:00.604191,5.525205443781235,0.006486514282091163,0.13679101483860076,rbf,TPESampler,COMPLETE
1713,0.2803856148473614,2025-04-25 05:49:25.852432,2025-04-25 05:49:26.438427,0 days 00:00:00.585995,1.8927924781128658,0.024869978640585152,0.08668303282327824,rbf,TPESampler,COMPLETE
1714,0.3036510510809735,2025-04-25 05:49:26.618176,2025-04-25 05:49:27.165868,0 days 00:00:00.547692,1.9246581077725642,0.0589135794316507,0.2219079513312983,rbf,TPESampler,COMPLETE
1715,0.604050747404741,2025-04-25 05:49:27.342372,2025-04-25 05:49:48.438678,0 days 00:00:21.096306,0.9771181957035432,0.028340899359554805,0.046857983779694065,poly,TPESampler,COMPLETE
1716,0.30950897494801727,2025-04-25 05:49:48.617661,2025-04-25 05:49:49.169505,0 days 00:00:00.551844,1.2124322720571978,0.02401868841542781,0.20500252571842925,rbf,TPESampler,COMPLETE
1717,0.43398026545388596,2025-04-25 05:49:49.362857,2025-04-25 05:49:49.928396,0 days 00:00:00.565539,3.7589248133510798,0.059130146189430896,0.5834940931622433,rbf,TPESampler,COMPLETE
1718,705.9080238733892,2025-04-25 05:49:50.110387,2025-04-25 05:49:50.646619,0 days 00:00:00.536232,42.7632577684879,0.015410092388152523,0.026230860195945276,sigmoid,TPESampler,COMPLETE
1719,0.2673802402270498,2025-04-25 05:49:50.823435,2025-04-25 05:49:51.371640,0 days 00:00:00.548205,3.1613850186742574,0.03479367848435963,0.10180531613905454,rbf,TPESampler,COMPLETE
1720,0.412267820555596,2025-04-25 05:49:51.549584,2025-04-25 05:49:52.114186,0 days 00:00:00.564602,4.069350626177918,0.017549490682266935,0.5556514534185623,rbf,TPESampler,COMPLETE
1721,0.2840309133620233,2025-04-25 05:49:52.290266,2025-04-25 05:49:52.854775,0 days 00:00:00.564509,3.4009882555768196,0.012856566890091646,0.04067471331316964,rbf,TPESampler,COMPLETE
1722,0.2796823556396562,2025-04-25 05:49:53.036656,2025-04-25 05:49:53.653089,0 days 00:00:00.616433,11.474418641577428,0.025863420876324105,0.13963690471289125,rbf,TPESampler,COMPLETE
1723,0.33834014010116986,2025-04-25 05:49:53.835035,2025-04-25 05:49:54.325237,0 days 00:00:00.490202,1.4934260099378516,0.2915356544007995,0.14060111453081603,rbf,TPESampler,COMPLETE
1724,0.328279325514383,2025-04-25 05:49:54.504058,2025-04-25 05:49:55.022740,0 days 00:00:00.518682,0.7477127049368011,0.058739123663888206,0.0556456491247445,rbf,TPESampler,COMPLETE
1725,0.48570228401467724,2025-04-25 05:49:55.206469,2025-04-25 05:49:56.076038,0 days 00:00:00.869569,2.0002004753868987,0.08978540898750026,0.03582875882838238,linear,TPESampler,COMPLETE
1726,0.2869938432957971,2025-04-25 05:49:56.260584,2025-04-25 05:49:56.787266,0 days 00:00:00.526682,3.600049234870715,0.05880765327478839,0.03807721542924333,rbf,TPESampler,COMPLETE
1727,0.4377271015444137,2025-04-25 05:49:56.965763,2025-04-25 05:49:57.493318,0 days 00:00:00.527555,0.5103651898292705,0.0302399781445593,0.008950724012439841,rbf,TPESampler,COMPLETE
1728,0.2743809958518511,2025-04-25 05:49:57.674192,2025-04-25 05:49:58.190332,0 days 00:00:00.516140,3.2359209663718,0.09970915259557175,0.07325529049319736,rbf,TPESampler,COMPLETE
1729,0.2794564398514609,2025-04-25 05:49:58.372093,2025-04-25 05:49:58.956642,0 days 00:00:00.584549,5.673161931390565,0.02008452944234577,0.15669249719882214,rbf,TPESampler,COMPLETE
1730,0.33606808184129416,2025-04-25 05:49:59.129867,2025-04-25 05:49:59.678114,0 days 00:00:00.548247,0.5684459044050444,0.012197202184071037,0.06612288270773138,rbf,TPESampler,COMPLETE
1731,1.1689963627773545,2025-04-25 05:49:59.857775,2025-04-25 06:23:28.114923,0 days 00:33:28.257148,80.76138849793105,0.09802564362978242,0.16086270825555415,poly,TPESampler,COMPLETE
1732,0.28479491743029267,2025-04-25 06:07:06.236943,2025-04-25 06:07:06.788838,0 days 00:00:00.551895,4.86863957522318,0.029330198761769437,0.030079591761611017,rbf,TPESampler,COMPLETE
1733,0.36943657912093597,2025-04-25 06:07:06.969323,2025-04-25 06:07:07.520951,0 days 00:00:00.551628,18.940491126142014,0.039218089590299286,0.41625569209984986,rbf,TPESampler,COMPLETE
1734,0.2863893665320843,2025-04-25 06:07:07.703281,2025-04-25 06:07:08.315793,0 days 00:00:00.612512,16.101863498514742,0.011695143939008711,0.020547156418538565,rbf,TPESampler,COMPLETE
1735,0.9310123287922989,2025-04-25 06:07:08.503900,2025-04-25 06:07:09.035018,0 days 00:00:00.531118,1.9568452685974569,0.0022267034238810306,0.0018124579109192345,poly,TPESampler,COMPLETE
1736,0.2876860187780079,2025-04-25 06:07:09.221049,2025-04-25 06:07:10.101333,0 days 00:00:00.880284,5.000329153595429,0.04501603943127632,0.17274746746967665,rbf,TPESampler,COMPLETE
1737,0.27235904663305016,2025-04-25 06:07:10.488219,2025-04-25 06:07:11.192337,0 days 00:00:00.704118,6.573086096003954,0.013549273804778415,0.041790425669025834,rbf,TPESampler,COMPLETE
1738,127.6076336723694,2025-04-25 06:07:11.396969,2025-04-25 06:07:11.957751,0 days 00:00:00.560782,47.58020184760877,0.008231151333055743,0.004931795787943248,sigmoid,TPESampler,COMPLETE
1739,0.3242209436515116,2025-04-25 06:07:12.133488,2025-04-25 06:07:12.851460,0 days 00:00:00.717972,4.623298880178811,0.10405281413483049,0.228634626626725,rbf,TPESampler,COMPLETE
1740,0.2658708097989813,2025-04-25 06:07:13.028351,2025-04-25 06:07:13.594553,0 days 00:00:00.566202,6.49304253749778,0.03490552480082889,0.08403275339294287,rbf,TPESampler,COMPLETE
1741,81.5839953581814,2025-04-25 06:07:13.794851,2025-04-25 06:07:14.332336,0 days 00:00:00.537485,3.8299705717930475,0.07994797738263465,0.04910920706440337,sigmoid,TPESampler,COMPLETE
1742,0.356980948981615,2025-04-25 06:07:14.512160,2025-04-25 06:07:15.035907,0 days 00:00:00.523747,0.41975855727291717,0.1209622167197464,0.12964203917927172,rbf,TPESampler,COMPLETE
1743,0.27989258588159016,2025-04-25 06:07:15.213265,2025-04-25 06:07:15.734744,0 days 00:00:00.521479,2.8491200984024343,0.08138916359645247,0.056466794180461514,rbf,TPESampler,COMPLETE
1744,0.29758215587102244,2025-04-25 06:07:15.912157,2025-04-25 06:07:16.505211,0 days 00:00:00.593054,10.918559612795848,0.03156473309786047,0.18384939651475043,rbf,TPESampler,COMPLETE
1745,0.9642104296297799,2025-04-25 06:07:16.688996,2025-04-25 06:07:17.242269,0 days 00:00:00.553273,0.021366352172969703,0.12414195119592934,0.00010718094474496944,poly,TPESampler,COMPLETE
1746,0.26647718360709205,2025-04-25 06:07:17.419222,2025-04-25 06:07:18.000057,0 days 00:00:00.580835,4.601085449625278,0.012990063631969813,0.09775341211805023,rbf,TPESampler,COMPLETE
1747,0.2807485569161799,2025-04-25 06:07:18.179747,2025-04-25 06:07:18.688007,0 days 00:00:00.508260,11.4344782347422,0.14160752130931414,0.09578170473926262,rbf,TPESampler,COMPLETE
1748,0.2829824971144514,2025-04-25 06:07:18.858185,2025-04-25 06:07:19.412681,0 days 00:00:00.554496,30.51464050711068,0.06624413403306671,0.10421135686026169,rbf,TPESampler,COMPLETE
1749,0.284297215098953,2025-04-25 06:07:19.600664,2025-04-25 06:07:20.175806,0 days 00:00:00.575142,10.575609189960451,0.026249730217059106,0.01989719278216957,rbf,TPESampler,COMPLETE
1750,0.2935856508364069,2025-04-25 06:07:20.375578,2025-04-25 06:07:21.014578,0 days 00:00:00.639000,2.4058219716138107,0.023786754056366696,0.03879850738645825,rbf,TPESampler,COMPLETE
1751,0.2794421576411,2025-04-25 06:07:21.197423,2025-04-25 06:07:21.881790,0 days 00:00:00.684367,27.83448634765601,0.017963423069997306,0.09545358676305274,rbf,TPESampler,COMPLETE
1752,0.2960142554006455,2025-04-25 06:07:22.197443,2025-04-25 06:07:22.738492,0 days 00:00:00.541049,19.609838013854837,0.07237343500918965,0.015111674740410499,rbf,TPESampler,COMPLETE
1753,0.3258994846108544,2025-04-25 06:07:22.916664,2025-04-25 06:07:23.472484,0 days 00:00:00.555820,0.9043429929976627,0.052160198027173595,0.2039805002588776,rbf,TPESampler,COMPLETE
1754,0.4724575606107998,2025-04-25 06:07:23.647488,2025-04-25 06:07:24.364753,0 days 00:00:00.717265,1.2407615601634934,0.0359287744810518,0.06493156519756212,linear,TPESampler,COMPLETE
1755,0.2915060511866965,2025-04-25 06:07:24.543107,2025-04-25 06:07:25.100455,0 days 00:00:00.557348,1.5102223362068157,0.0244834316212656,0.06793351726789039,rbf,TPESampler,COMPLETE
1756,0.8761288057222223,2025-04-25 06:07:25.281550,2025-04-25 06:07:25.772928,0 days 00:00:00.491378,0.2421892725955361,0.8808256984719826,0.011401904039406838,poly,TPESampler,COMPLETE
1757,17.94166676374668,2025-04-25 06:07:25.951419,2025-04-25 06:46:58.274378,0 days 00:39:32.322959,40.281533730163765,0.0012752677545749623,0.5327023283525472,poly,TPESampler,COMPLETE
1758,0.27131325537055223,2025-04-25 06:22:27.323441,2025-04-25 06:22:27.942850,0 days 00:00:00.619409,5.102104023437535,0.0032520102876278465,0.05233618618860227,rbf,TPESampler,COMPLETE
1759,0.2669137427326747,2025-04-25 06:22:28.119232,2025-04-25 06:22:28.663573,0 days 00:00:00.544341,4.220148540013479,0.03751991906325663,0.09671583637979472,rbf,TPESampler,COMPLETE
1760,0.4010268757685426,2025-04-25 06:22:28.830109,2025-04-25 06:22:29.329416,0 days 00:00:00.499307,0.7827137467335077,0.06131103285017133,0.01205109173291861,rbf,TPESampler,COMPLETE
1761,0.2649372075290338,2025-04-25 06:22:29.500773,2025-04-25 06:22:30.028167,0 days 00:00:00.527394,6.2479905028223035,0.06344948434898409,0.09664690873215134,rbf,TPESampler,COMPLETE
1762,0.29924610967617243,2025-04-25 06:22:30.197628,2025-04-25 06:22:30.712086,0 days 00:00:00.514458,22.406458946019782,0.1403313169292458,0.12281662367646169,rbf,TPESampler,COMPLETE
1763,0.39964278898201533,2025-04-25 06:22:30.887590,2025-04-25 06:22:31.404159,0 days 00:00:00.516569,10.017051062041674,0.09151684471897172,0.4612026080642486,rbf,TPESampler,COMPLETE
1764,0.2766252250700085,2025-04-25 06:22:31.581484,2025-04-25 06:22:32.073626,0 days 00:00:00.492142,5.044084420819805,0.1191946742828698,0.07243634150483745,rbf,TPESampler,COMPLETE
1765,0.3061323929432139,2025-04-25 06:22:32.251177,2025-04-25 06:22:32.762569,0 days 00:00:00.511392,9.2157028640446,0.10385870768708755,0.17626810164897153,rbf,TPESampler,COMPLETE
1766,0.3716109705469694,2025-04-25 06:22:32.942597,2025-04-25 06:22:33.436369,0 days 00:00:00.493772,0.8206100119104647,0.14789839151536108,0.024022454156417593,rbf,TPESampler,COMPLETE
1767,0.3150843863753804,2025-04-25 06:22:33.623404,2025-04-25 06:22:34.174990,0 days 00:00:00.551586,27.822574615618556,0.0554244554337123,0.20173537981515532,rbf,TPESampler,COMPLETE
1768,0.6014048800610086,2025-04-25 06:22:34.358128,2025-04-25 06:22:34.908240,0 days 00:00:00.550112,0.5673792657677554,0.024121544231375507,0.7662767639642755,rbf,TPESampler,COMPLETE
1769,0.2924354963338277,2025-04-25 06:22:35.088920,2025-04-25 06:22:35.634641,0 days 00:00:00.545721,3.3829851980010175,0.06586050324815665,0.18076316518596733,rbf,TPESampler,COMPLETE
1770,0.8072165030528994,2025-04-25 06:22:35.818312,2025-04-25 06:22:36.378935,0 days 00:00:00.560623,0.13126866292401204,0.06279258099070432,0.0005148076660104646,sigmoid,TPESampler,COMPLETE
