number,value,datetime_start,datetime_complete,duration,params_C,params_epsilon,params_gamma,params_kernel,system_attrs_auto:sampler,state
2361,0.2778395901278479,2025-04-25 08:45:25.323011,2025-04-25 08:45:25.865822,0 days 00:00:00.542811,2.9525471142564697,0.10762535304906293,0.12290037851005622,rbf,TPESampler,COMPLETE
2362,0.5529413118234656,2025-04-25 08:45:26.054050,2025-04-25 08:47:51.680457,0 days 00:02:25.626407,6.397172514164953,0.013366403677464087,0.04453450541950152,poly,TPESampler,COMPLETE
2363,0.2749366786160693,2025-04-25 08:47:51.905244,2025-04-25 08:47:53.226190,0 days 00:00:01.320946,24.17918356206554,0.023036531466255564,0.03750874047868931,rbf,TPESampler,COMPLETE
2364,0.3002175912104422,2025-04-25 08:47:53.440938,2025-04-25 08:47:54.006796,0 days 00:00:00.565858,15.164722572165722,0.23065095642638692,0.060729804333258045,rbf,TPESampler,COMPLETE
2365,0.28646493679375834,2025-04-25 08:47:54.556341,2025-04-25 08:47:55.462768,0 days 00:00:00.906427,3.888100164807388,0.061049154651908015,0.16399577705349755,rbf,TPESampler,COMPLETE
2366,0.3065426700733214,2025-04-25 08:47:55.706033,2025-04-25 08:47:56.434249,0 days 00:00:00.728216,23.39370501711374,0.00811557338991824,0.1608512672750273,rbf,TPESampler,COMPLETE
2367,0.38966260137259295,2025-04-25 08:47:56.689984,2025-04-25 08:47:57.252324,0 days 00:00:00.562340,0.8952209657672786,0.030048815806861997,0.013172779107430291,rbf,TPESampler,COMPLETE
2368,0.31534447168804974,2025-04-25 08:47:57.454892,2025-04-25 08:47:58.055052,0 days 00:00:00.600160,15.148660249062335,0.055301229407702636,0.20294294746080507,rbf,TPESampler,COMPLETE
2369,6.21746385174342,2025-04-25 08:47:58.239863,2025-04-25 08:47:58.825317,0 days 00:00:00.585454,0.2692299726447813,0.04781661108035481,0.09688452503698956,sigmoid,TPESampler,COMPLETE
2370,0.2688438124275796,2025-04-25 08:47:59.019026,2025-04-25 08:47:59.881683,0 days 00:00:00.862657,10.84204972645471,0.02255410584150322,0.07807223622905465,rbf,TPESampler,COMPLETE
2371,0.7738610146389585,2025-04-25 08:48:00.075009,2025-04-25 08:48:00.651448,0 days 00:00:00.576439,0.024946995755755777,0.001955457823398862,0.0019162433119746627,rbf,TPESampler,COMPLETE
2372,0.34977309516666244,2025-04-25 08:48:00.862188,2025-04-25 08:48:01.434129,0 days 00:00:00.571941,0.4303311707604368,0.029328610653774755,0.1627805569811062,rbf,TPESampler,COMPLETE
2373,0.28599415700704917,2025-04-25 08:48:01.633617,2025-04-25 08:48:02.236698,0 days 00:00:00.603081,7.457381507609614,0.024310944960855358,0.021991909541494204,rbf,TPESampler,COMPLETE
2374,0.2914103992154087,2025-04-25 08:48:02.430656,2025-04-25 08:48:03.020716,0 days 00:00:00.590060,2.937890349679611,0.035366265808235244,0.03507510772058249,rbf,TPESampler,COMPLETE
2375,144.70493083654117,2025-04-25 08:48:03.222995,2025-04-25 08:48:03.801585,0 days 00:00:00.578590,6.716827765933416,0.11048460428257878,0.05584929745701841,sigmoid,TPESampler,COMPLETE
2376,0.34888467139303364,2025-04-25 08:48:04.010637,2025-04-25 08:48:04.520774,0 days 00:00:00.510137,2.8222083042927344,0.15466246305175396,0.012706990318430497,rbf,TPESampler,COMPLETE
2377,0.26887022727731286,2025-04-25 08:48:04.715609,2025-04-25 08:48:05.276078,0 days 00:00:00.560469,4.191573049537535,0.07480295465789646,0.06539604444233113,rbf,TPESampler,COMPLETE
2378,0.2877584187157787,2025-04-25 08:48:05.465596,2025-04-25 08:48:06.023889,0 days 00:00:00.558293,9.701054865450692,0.06905074480862465,0.02045988272952144,rbf,TPESampler,COMPLETE
2379,36.917526599114,2025-04-25 08:48:06.220796,2025-04-25 08:48:06.787207,0 days 00:00:00.566411,1.58994327500033,0.020345341152385118,0.06759701553407885,sigmoid,TPESampler,COMPLETE
2380,0.524716734278798,2025-04-25 08:48:06.979693,2025-04-25 08:48:07.562089,0 days 00:00:00.582396,2.189951737667147,0.026684923255774862,0.8337497903051333,rbf,TPESampler,COMPLETE
2381,0.299273150598861,2025-04-25 08:48:08.084153,2025-04-25 08:48:08.754479,0 days 00:00:00.670326,1.3375975776078306,0.022141614762640774,0.17790369997258873,rbf,TPESampler,COMPLETE
2382,0.27679419834188934,2025-04-25 08:48:08.950404,2025-04-25 08:48:09.604970,0 days 00:00:00.654566,16.564023106909328,0.013845187015684532,0.11472265446398203,rbf,TPESampler,COMPLETE
2383,0.5662829818168152,2025-04-25 08:48:09.791248,2025-04-25 08:48:10.381555,0 days 00:00:00.590307,6.520947503876954,0.0533282603663891,0.00020933802927173577,rbf,TPESampler,COMPLETE
2384,0.278621719847363,2025-04-25 08:48:10.582590,2025-04-25 08:48:11.144499,0 days 00:00:00.561909,31.532305085287444,0.08827011399274212,0.08722806793827022,rbf,TPESampler,COMPLETE
2385,0.3703117037891224,2025-04-25 08:48:11.344691,2025-04-25 08:48:11.924338,0 days 00:00:00.579647,25.25875386363937,0.0463535984664221,0.4124689718001912,rbf,TPESampler,COMPLETE
2386,0.32844460683124693,2025-04-25 08:48:12.126413,2025-04-25 08:48:12.652693,0 days 00:00:00.526280,18.177589696676478,0.21612536149709585,0.1335903423844618,rbf,TPESampler,COMPLETE
2387,0.3029246453732514,2025-04-25 08:48:12.842264,2025-04-25 08:48:13.428941,0 days 00:00:00.586677,1.118864514424421,0.015817939099029215,0.06550278862957745,rbf,TPESampler,COMPLETE
2388,0.2682369129030369,2025-04-25 08:48:13.643834,2025-04-25 08:48:14.380838,0 days 00:00:00.737004,3.5802473754661532,0.002204112832567484,0.11854587473088647,rbf,TPESampler,COMPLETE
2389,0.5020096985013006,2025-04-25 08:48:14.583714,2025-04-25 08:48:17.059959,0 days 00:00:02.476245,8.111649590047524,0.028478691836423174,0.10252982840146839,linear,TPESampler,COMPLETE
2390,0.26542176647971444,2025-04-25 08:48:17.250890,2025-04-25 08:48:17.838663,0 days 00:00:00.587773,6.058779041586464,0.04230304515059944,0.0757634469303297,rbf,TPESampler,COMPLETE
2391,0.2983408206214763,2025-04-25 08:48:18.026895,2025-04-25 08:48:18.653495,0 days 00:00:00.626600,26.791044169149842,0.035012472625766636,0.017150516620468473,rbf,TPESampler,COMPLETE
2392,0.32026588658969773,2025-04-25 08:48:18.847378,2025-04-25 08:48:19.431911,0 days 00:00:00.584533,4.693873455836503,0.03538189231418856,0.27632067523775516,rbf,TPESampler,COMPLETE
2393,0.2778552822559847,2025-04-25 08:48:19.633660,2025-04-25 08:48:20.268847,0 days 00:00:00.635187,5.192426145702243,0.02059489801324355,0.03759426759172067,rbf,TPESampler,COMPLETE
2394,0.32091462399067694,2025-04-25 08:48:20.462311,2025-04-25 08:48:21.057649,0 days 00:00:00.595338,3.029630220827196,0.007301995342848153,0.019354515907135727,rbf,TPESampler,COMPLETE
2395,0.2980024270126815,2025-04-25 08:48:21.247659,2025-04-25 08:48:22.076585,0 days 00:00:00.828926,79.49680839903519,0.023162393212341873,0.046825253078659056,rbf,TPESampler,COMPLETE
2396,0.424361732358882,2025-04-25 08:48:22.276890,2025-04-25 08:48:22.849379,0 days 00:00:00.572489,0.29288242058155955,0.25882256104973594,0.0017393195800567897,linear,TPESampler,COMPLETE
2397,0.2912722100935417,2025-04-25 08:48:23.046936,2025-04-25 08:48:23.613734,0 days 00:00:00.566798,1.2676979099018115,0.08658914016267155,0.12308816395630423,rbf,TPESampler,COMPLETE
2398,0.3364703222948035,2025-04-25 08:48:23.808513,2025-04-25 08:48:24.411568,0 days 00:00:00.603055,98.13642886387072,0.014359474244709286,0.3275855919089972,rbf,TPESampler,COMPLETE
2399,0.2727962854735988,2025-04-25 08:48:24.607009,2025-04-25 08:48:25.180816,0 days 00:00:00.573807,2.2660429999317255,0.04551570701435894,0.08719711414419921,rbf,TPESampler,COMPLETE
2400,0.274472248825263,2025-04-25 08:48:25.368755,2025-04-25 08:48:25.961700,0 days 00:00:00.592945,31.855614010906454,0.07282839115362796,0.04959411153534068,rbf,TPESampler,COMPLETE
2401,0.2786727841884238,2025-04-25 08:48:26.153388,2025-04-25 08:48:26.791637,0 days 00:00:00.638249,9.582987670845176,0.02071813147208781,0.1431561718659967,rbf,TPESampler,COMPLETE
2402,0.3500058108220654,2025-04-25 08:48:26.981677,2025-04-25 08:48:27.578566,0 days 00:00:00.596889,1.6032935124334142,0.00860623031087974,0.39199265095849833,rbf,TPESampler,COMPLETE
2403,0.2725916174500036,2025-04-25 08:48:27.812004,2025-04-25 08:48:28.397978,0 days 00:00:00.585974,10.640029360445714,0.06129716920800267,0.1093607327571021,rbf,TPESampler,COMPLETE
2404,0.9633759733065893,2025-04-25 08:48:28.591335,2025-04-25 08:48:29.178469,0 days 00:00:00.587134,0.7084166665806374,0.012097763977136942,0.00014813618194627586,poly,TPESampler,COMPLETE
2405,0.2793168579151873,2025-04-25 08:48:29.372146,2025-04-25 08:48:29.901979,0 days 00:00:00.529833,7.159019409084645,0.1645217328636609,0.07774802857925234,rbf,TPESampler,COMPLETE
2406,0.3572497859442485,2025-04-25 08:48:30.095554,2025-04-25 08:48:30.636488,0 days 00:00:00.540934,1.420793271759252,0.06140873937420114,0.017086559625962883,rbf,TPESampler,COMPLETE
2407,0.3153301261650785,2025-04-25 08:48:30.831793,2025-04-25 08:48:31.420540,0 days 00:00:00.588747,1.9566496718499353,0.019586655781394645,0.029227560650850054,rbf,TPESampler,COMPLETE
2408,0.6434239569061252,2025-04-25 08:48:31.611026,2025-04-25 08:50:52.718093,0 days 00:02:21.107067,1.6244050543976962,0.01953447857809361,0.10837532077013803,poly,TPESampler,COMPLETE
2409,0.2842644852979425,2025-04-25 08:50:52.918240,2025-04-25 08:50:53.529294,0 days 00:00:00.611054,22.659741294416413,0.03557520194498586,0.11858853133027229,rbf,TPESampler,COMPLETE
2410,0.2679729846539264,2025-04-25 08:50:53.718665,2025-04-25 08:50:54.364139,0 days 00:00:00.645474,10.772305645594825,0.01261400358730248,0.05709973223543347,rbf,TPESampler,COMPLETE
2411,0.98591827694728,2025-04-25 08:50:54.566674,2025-04-25 08:50:55.112481,0 days 00:00:00.545807,0.0011823815577611879,0.6143816778581724,0.0002084970466643456,rbf,TPESampler,COMPLETE
2412,0.32491767617115913,2025-04-25 08:50:55.310343,2025-04-25 08:50:55.894086,0 days 00:00:00.583743,5.57630069890818,0.08651108398214022,0.24150874893228833,rbf,TPESampler,COMPLETE
2413,0.26830139604606035,2025-04-25 08:50:56.088484,2025-04-25 08:50:56.675440,0 days 00:00:00.586956,3.0799944949542133,0.02151146282916,0.10608373549895062,rbf,TPESampler,COMPLETE
2414,0.2929392116866126,2025-04-25 08:50:56.861885,2025-04-25 08:50:57.396505,0 days 00:00:00.534620,9.955172935157073,0.10652837864006609,0.020609764161794355,rbf,TPESampler,COMPLETE
2415,0.29309811032907,2025-04-25 08:50:57.583963,2025-04-25 08:50:58.145105,0 days 00:00:00.561142,1.2629446127126045,0.045040592518961926,0.08015660297118941,rbf,TPESampler,COMPLETE
2416,3.166173304025697,2025-04-25 08:50:58.339564,2025-04-25 09:19:29.113804,0 days 00:28:30.774240,38.04046846358633,0.035970485505304996,0.23682145200518143,poly,TPESampler,COMPLETE
2417,0.2849803767033985,2025-04-25 08:59:23.480287,2025-04-25 08:59:24.048611,0 days 00:00:00.568324,5.25093012648684,0.04185370846209322,0.029620008058724258,rbf,TPESampler,COMPLETE
2418,2.8218825598187585,2025-04-25 08:59:24.241545,2025-04-25 08:59:24.798174,0 days 00:00:00.556629,0.11647514338372861,0.01029119122999702,0.11585980675751124,sigmoid,TPESampler,COMPLETE
2419,0.2653930248195159,2025-04-25 08:59:24.988025,2025-04-25 08:59:25.570590,0 days 00:00:00.582565,11.191299468196751,0.037633162795203505,0.0811932005416489,rbf,TPESampler,COMPLETE
2420,0.3884243667944565,2025-04-25 08:59:25.751773,2025-04-25 08:59:26.334083,0 days 00:00:00.582310,3.8153592782294106,0.017004693869303325,0.004150867985599853,rbf,TPESampler,COMPLETE
2421,0.6340615004890819,2025-04-25 08:59:26.522173,2025-04-25 08:59:27.004379,0 days 00:00:00.482206,12.629259546402663,0.7690061778050716,0.3458326606370386,rbf,TPESampler,COMPLETE
2422,0.29229437563136,2025-04-25 08:59:27.193084,2025-04-25 08:59:27.775257,0 days 00:00:00.582173,2.1414827374038468,0.013683264125683312,0.20991498254732666,rbf,TPESampler,COMPLETE
2423,0.4397708527568763,2025-04-25 08:59:27.960678,2025-04-25 08:59:28.643677,0 days 00:00:00.682999,0.5826243635912683,0.030510123069948672,0.002998676208844365,linear,TPESampler,COMPLETE
2424,0.5073366905085959,2025-04-25 08:59:28.839503,2025-04-25 08:59:29.433501,0 days 00:00:00.593998,1.4763323870354892,0.6366846153586101,0.11571002789366942,rbf,TPESampler,COMPLETE
2425,0.7965640110483151,2025-04-25 08:59:29.633899,2025-04-25 08:59:30.216701,0 days 00:00:00.582802,0.2708815875869813,0.00828463769206383,0.00012905913716939468,rbf,TPESampler,COMPLETE
2426,0.27029827550376184,2025-04-25 08:59:30.409037,2025-04-25 08:59:30.967344,0 days 00:00:00.558307,7.283947202999162,0.08498472742375057,0.0624434251920673,rbf,TPESampler,COMPLETE
2427,0.38654439157178144,2025-04-25 08:59:31.156091,2025-04-25 08:59:31.725896,0 days 00:00:00.569805,6.973452823497209,0.053580344931321446,0.4555445423638019,rbf,TPESampler,COMPLETE
2428,109.80663574609221,2025-04-25 08:59:31.916821,2025-04-25 08:59:32.468736,0 days 00:00:00.551915,5.044715453007468,0.043374875475342245,0.2684186386496412,sigmoid,TPESampler,COMPLETE
2429,0.32295618105726787,2025-04-25 08:59:32.661232,2025-04-25 08:59:33.237754,0 days 00:00:00.576522,40.45949040382167,0.06542215597843778,0.22417847800517485,rbf,TPESampler,COMPLETE
2430,0.2766242655904033,2025-04-25 08:59:33.426038,2025-04-25 08:59:34.045178,0 days 00:00:00.619140,41.08418566279121,0.053388717947564945,0.05261283451765842,rbf,TPESampler,COMPLETE
2431,0.2892900812602359,2025-04-25 08:59:34.234100,2025-04-25 08:59:34.803622,0 days 00:00:00.569522,1.7635687357243006,0.047655745979868026,0.062220768356407906,rbf,TPESampler,COMPLETE
2432,0.2699400351280001,2025-04-25 08:59:34.994805,2025-04-25 08:59:35.606021,0 days 00:00:00.611216,6.817213560371409,0.016757122219817434,0.11900605331702117,rbf,TPESampler,COMPLETE
2433,0.2808118256307129,2025-04-25 08:59:35.788418,2025-04-25 08:59:36.420673,0 days 00:00:00.632255,23.375878714324934,0.03177118779734408,0.028560673987466628,rbf,TPESampler,COMPLETE
2434,0.31419187211175087,2025-04-25 08:59:36.616802,2025-04-25 08:59:37.147140,0 days 00:00:00.530338,2.3707286533581247,0.10782746164177334,0.02846284305327849,rbf,TPESampler,COMPLETE
2435,0.2765517387632158,2025-04-25 08:59:37.337658,2025-04-25 08:59:37.943397,0 days 00:00:00.605739,7.238690629225527,0.015725301001816683,0.03329444953356689,rbf,TPESampler,COMPLETE
2436,0.27212047354947533,2025-04-25 08:59:38.132336,2025-04-25 08:59:38.705717,0 days 00:00:00.573381,6.23083959478855,0.06687304124511777,0.11241764635390547,rbf,TPESampler,COMPLETE
2437,0.2973968569040419,2025-04-25 08:59:38.896374,2025-04-25 08:59:39.451420,0 days 00:00:00.555046,1.7683552232411477,0.04495397143441604,0.2049772254485123,rbf,TPESampler,COMPLETE
2438,0.3327399168340634,2025-04-25 08:59:39.646087,2025-04-25 08:59:40.205246,0 days 00:00:00.559159,4.8014224604108255,0.0575304887876099,0.011019836376949615,rbf,TPESampler,COMPLETE
2439,0.2669084820267557,2025-04-25 08:59:40.394377,2025-04-25 08:59:40.996162,0 days 00:00:00.601785,11.583525857754543,0.04089684454324392,0.04843550023607207,rbf,TPESampler,COMPLETE
2440,0.3513618015172669,2025-04-25 08:59:41.185210,2025-04-25 08:59:41.718286,0 days 00:00:00.533076,4.099768670807598,0.1452888978934386,0.26984530695679626,rbf,TPESampler,COMPLETE
2441,0.6416113756116291,2025-04-25 08:59:41.905466,2025-04-25 08:59:43.300151,0 days 00:00:01.394685,12.834513187716182,0.12576892392751002,0.013781615191596182,poly,TPESampler,COMPLETE
2442,0.3860688801402083,2025-04-25 08:59:43.488355,2025-04-25 08:59:44.040664,0 days 00:00:00.552309,0.30365597564164154,0.027049024263891695,0.04604784942125839,rbf,TPESampler,COMPLETE
2443,0.3769176770861964,2025-04-25 08:59:44.229952,2025-04-25 08:59:44.764754,0 days 00:00:00.534802,0.2975608574599582,0.0891441207873689,0.06924499634993117,rbf,TPESampler,COMPLETE
2444,0.3151171096057135,2025-04-25 08:59:44.954204,2025-04-25 08:59:45.572910,0 days 00:00:00.618706,15.503652194542866,0.019849547218971027,0.22642720553927906,rbf,TPESampler,COMPLETE
2445,0.27132625399646293,2025-04-25 08:59:45.765559,2025-04-25 08:59:46.365700,0 days 00:00:00.600141,2.73668804184557,0.024964041279137743,0.08860325310836763,rbf,TPESampler,COMPLETE
2446,0.2908712198921711,2025-04-25 08:59:46.695649,2025-04-25 08:59:47.291775,0 days 00:00:00.596126,2.221475219308604,0.0071402959162813594,0.04571526869670255,rbf,TPESampler,COMPLETE
2447,0.27393178247710626,2025-04-25 08:59:47.483492,2025-04-25 08:59:48.044702,0 days 00:00:00.561210,7.631481765619839,0.05173792241739065,0.03929339538077321,rbf,TPESampler,COMPLETE
2448,0.6811640972673819,2025-04-25 08:59:48.243166,2025-04-25 08:59:48.800052,0 days 00:00:00.556886,0.7170882047273066,0.0011836447690905256,0.0004411022175850514,rbf,TPESampler,COMPLETE
2449,0.3127387805566334,2025-04-25 08:59:48.988559,2025-04-25 08:59:49.567218,0 days 00:00:00.578659,4.765382332707863,0.04140759541666981,0.24747127318497433,rbf,TPESampler,COMPLETE
2450,0.3367627955960712,2025-04-25 08:59:49.755425,2025-04-25 08:59:50.334382,0 days 00:00:00.578957,1.7348947985672856,0.029769474402383343,0.021514910078767182,rbf,TPESampler,COMPLETE
2451,0.7729576648031179,2025-04-25 08:59:50.530272,2025-04-25 09:18:07.960723,0 days 00:18:17.430451,15.32236780984334,0.0024573969923641554,0.05846836185771111,poly,TPESampler,COMPLETE
2452,0.49412960115908433,2025-04-25 09:10:46.806011,2025-04-25 09:10:47.873910,0 days 00:00:01.067899,2.4992828708336305,0.05033016246383362,0.0768497355476492,linear,TPESampler,COMPLETE
2453,0.30290591730438976,2025-04-25 09:10:48.069263,2025-04-25 09:10:48.606854,0 days 00:00:00.537591,21.082651781090537,0.09995394623269462,0.016037461199295302,rbf,TPESampler,COMPLETE
2454,0.34200440669496446,2025-04-25 09:10:48.793990,2025-04-25 09:10:49.304221,0 days 00:00:00.510231,11.436657858169312,0.19350550373456876,0.005886236740038553,rbf,TPESampler,COMPLETE
2455,0.4661303995421696,2025-04-25 09:10:49.489746,2025-04-25 09:10:49.977040,0 days 00:00:00.487294,0.6455021181270504,0.467647212345969,0.013640979909069534,rbf,TPESampler,COMPLETE
2456,0.4699996000842657,2025-04-25 09:10:50.159468,2025-04-25 09:10:50.670018,0 days 00:00:00.510550,0.01836944730573105,0.2480331114042045,0.962933733531436,linear,TPESampler,COMPLETE
2457,1695.7143762569829,2025-04-25 09:10:50.864532,2025-04-25 09:10:51.438243,0 days 00:00:00.573711,67.26985402227527,0.0407524426977684,0.4214852742411216,sigmoid,TPESampler,COMPLETE
2458,0.5643880862579568,2025-04-25 09:10:51.631193,2025-04-25 09:10:52.205490,0 days 00:00:00.574297,14.716465620862547,0.023017354712858693,0.944962944331921,rbf,TPESampler,COMPLETE
2459,0.2798250948970552,2025-04-25 09:10:52.550842,2025-04-25 09:10:53.317103,0 days 00:00:00.766261,34.02024614235189,0.02477268901982429,0.0854797197401587,rbf,TPESampler,COMPLETE
2460,0.2968217579786588,2025-04-25 09:10:53.517838,2025-04-25 09:10:54.052839,0 days 00:00:00.535001,7.508055576854458,0.15459983075973616,0.12984214744877914,rbf,TPESampler,COMPLETE
2461,0.29184906437761343,2025-04-25 09:10:54.243503,2025-04-25 09:10:54.884399,0 days 00:00:00.640896,19.85448258492454,0.025129106955088677,0.014048450205529046,rbf,TPESampler,COMPLETE
2462,0.2653814206758482,2025-04-25 09:10:55.076532,2025-04-25 09:10:55.664329,0 days 00:00:00.587797,5.7323648643591705,0.030643612822753824,0.06295214460508788,rbf,TPESampler,COMPLETE
2463,0.29537522080368106,2025-04-25 09:10:55.861212,2025-04-25 09:10:56.433072,0 days 00:00:00.571860,1.1983496847322308,0.023739954864137686,0.14170920400171472,rbf,TPESampler,COMPLETE
2464,0.4908522554471129,2025-04-25 09:10:56.719851,2025-04-25 09:11:03.926349,0 days 00:00:07.206498,26.921596255312803,0.07964733285869485,0.4540386251784628,linear,TPESampler,COMPLETE
2465,0.28084850048963234,2025-04-25 09:11:04.125229,2025-04-25 09:11:05.023537,0 days 00:00:00.898308,35.36123330879973,0.012021893010841663,0.08054491323068147,rbf,TPESampler,COMPLETE
2466,0.2761527622762292,2025-04-25 09:11:05.225112,2025-04-25 09:11:05.810952,0 days 00:00:00.585840,14.6231075634668,0.04030156912891855,0.11384920477750061,rbf,TPESampler,COMPLETE
2467,0.27922214532128586,2025-04-25 09:11:06.003095,2025-04-25 09:11:06.549386,0 days 00:00:00.546291,4.946236209764081,0.07096579530267477,0.04025007083085372,rbf,TPESampler,COMPLETE
2468,0.2923270392317938,2025-04-25 09:11:06.738361,2025-04-25 09:11:07.358220,0 days 00:00:00.619859,1.485283529639849,0.015099539219027435,0.06469299068765365,rbf,TPESampler,COMPLETE
2469,0.2813401299327795,2025-04-25 09:11:07.555725,2025-04-25 09:11:08.098899,0 days 00:00:00.543174,27.19772597856632,0.13490689064861935,0.07584778690755098,rbf,TPESampler,COMPLETE
2470,0.6797688316856069,2025-04-25 09:11:08.291643,2025-04-25 09:18:46.905764,0 days 00:07:38.614121,12.740854779746378,0.09425388102878428,0.06076815964416402,poly,TPESampler,COMPLETE
2471,0.2814537652393797,2025-04-25 09:18:08.216294,2025-04-25 09:18:08.872910,0 days 00:00:00.656616,12.281623418947214,0.005812110311950063,0.02428828423829182,rbf,TPESampler,COMPLETE
2472,0.32999869576570884,2025-04-25 09:18:09.065358,2025-04-25 09:18:09.611823,0 days 00:00:00.546465,24.378232730356476,0.06970690036327509,0.2480430636514106,rbf,TPESampler,COMPLETE
2473,0.33123131262718775,2025-04-25 09:18:09.800102,2025-04-25 09:18:10.348814,0 days 00:00:00.548712,1.405947478057819,0.07626645954897196,0.028198871123079526,rbf,TPESampler,COMPLETE
2474,0.2658873797772243,2025-04-25 09:18:10.540322,2025-04-25 09:18:11.130721,0 days 00:00:00.590399,6.328878410455398,0.03662918636593322,0.08373096025665597,rbf,TPESampler,COMPLETE
2475,0.2741957659779934,2025-04-25 09:18:11.327492,2025-04-25 09:18:11.921348,0 days 00:00:00.593856,2.516973888943417,0.08597301705438734,0.07897374519915731,rbf,TPESampler,COMPLETE
2476,0.5003894337663317,2025-04-25 09:18:12.134285,2025-04-25 09:18:14.366798,0 days 00:00:02.232513,6.516655868778002,0.011880649512032515,0.04108853919201484,linear,TPESampler,COMPLETE
2477,0.3807447785187677,2025-04-25 09:18:14.595437,2025-04-25 09:18:15.181940,0 days 00:00:00.586503,1.2304696248321607,0.0817420114003327,0.4016263648627441,rbf,TPESampler,COMPLETE
2478,0.28239932046133315,2025-04-25 09:18:15.393050,2025-04-25 09:18:16.011865,0 days 00:00:00.618815,4.5601120870832785,0.008454463488370522,0.1727505436570552,rbf,TPESampler,COMPLETE
