number,value,datetime_start,datetime_complete,duration,params_C,params_epsilon,params_gamma,params_kernel,system_attrs_auto:sampler,state
709,0.2720753613110927,2025-04-25 01:27:04.488543,2025-04-25 01:27:05.005095,0 days 00:00:00.516552,4.918871084075169,0.05878117043805843,0.04947650733943809,rbf,TPESampler,COMPLETE
710,0.26826925409720387,2025-04-25 01:27:05.163880,2025-04-25 01:27:05.712871,0 days 00:00:00.548991,12.115822419656595,0.03669861101413819,0.04677652290440819,rbf,TPESampler,COMPLETE
711,0.27989251550184907,2025-04-25 01:27:05.915679,2025-04-25 01:27:06.444115,0 days 00:00:00.528436,5.618435227570808,0.04335077398631883,0.14729835894872667,rbf,TPESampler,COMPLETE
712,0.2767702519629861,2025-04-25 01:27:06.608686,2025-04-25 01:27:07.356798,0 days 00:00:00.748112,25.094656958417396,0.014930135023993167,0.08169219455564519,rbf,TPESampler,COMPLETE
713,0.3588786510766024,2025-04-25 01:27:07.519793,2025-04-25 01:27:08.040514,0 days 00:00:00.520721,2.5863928455205727,0.026846935733910032,0.4048719313080268,rbf,TPESampler,COMPLETE
714,0.486507386844323,2025-04-25 01:27:08.204972,2025-04-25 01:27:09.774541,0 days 00:00:01.569569,5.141272948715827,0.08004067675262277,0.025526471900427592,linear,TPESampler,COMPLETE
715,0.28257219929109784,2025-04-25 01:27:10.113424,2025-04-25 01:27:10.844601,0 days 00:00:00.731177,58.257655596670915,0.07609743237443614,0.055571679893667236,rbf,TPESampler,COMPLETE
716,0.28052217135556884,2025-04-25 01:27:11.007990,2025-04-25 01:27:11.487465,0 days 00:00:00.479475,3.9063879143715954,0.1503093569716118,0.10327665438760099,rbf,TPESampler,COMPLETE
717,0.28614880148214183,2025-04-25 01:27:11.704753,2025-04-25 01:27:12.799454,0 days 00:00:01.094701,2.267316367203646,0.040721698497261614,0.053554595560424335,rbf,TPESampler,COMPLETE
718,0.4286535985304179,2025-04-25 01:27:12.981224,2025-04-25 01:27:13.476806,0 days 00:00:00.495582,0.4309334951200644,0.24001734631005717,0.619572021230498,linear,TPESampler,COMPLETE
719,0.2679482012133451,2025-04-25 01:27:13.632018,2025-04-25 01:27:14.175716,0 days 00:00:00.543698,10.190631587758181,0.034667359950904066,0.09351648390310974,rbf,TPESampler,COMPLETE
720,0.3845190469274229,2025-04-25 01:27:14.330777,2025-04-25 01:27:14.802982,0 days 00:00:00.472205,0.3073256434079301,0.10800973894779363,0.051930940892198386,rbf,TPESampler,COMPLETE
721,0.270248261986763,2025-04-25 01:27:14.962243,2025-04-25 01:27:15.445831,0 days 00:00:00.483588,9.961471808252274,0.12401957504989905,0.07274106539685214,rbf,TPESampler,COMPLETE
722,0.2750945772126378,2025-04-25 01:27:15.604076,2025-04-25 01:27:16.167920,0 days 00:00:00.563844,10.369208262071481,0.02291700803992824,0.03756011185227557,rbf,TPESampler,COMPLETE
723,0.28914820368707217,2025-04-25 01:27:16.323447,2025-04-25 01:27:16.888936,0 days 00:00:00.565489,16.19735007453478,0.026802854470213914,0.020865181811202792,rbf,TPESampler,COMPLETE
724,0.2899303029378782,2025-04-25 01:27:17.049901,2025-04-25 01:27:17.597977,0 days 00:00:00.548076,2.260194341159289,0.012580475978461627,0.04615086161461334,rbf,TPESampler,COMPLETE
725,0.28223535943657163,2025-04-25 01:27:17.753980,2025-04-25 01:27:19.257465,0 days 00:00:01.503485,2.2859386885880677,0.04002060772720769,0.15400840408111122,rbf,TPESampler,COMPLETE
726,0.2955030996922386,2025-04-25 01:27:19.479829,2025-04-25 01:27:20.005582,0 days 00:00:00.525753,23.217497196073385,0.04258566389687743,0.13748866575721463,rbf,TPESampler,COMPLETE
727,0.45685048626240327,2025-04-25 01:27:20.167154,2025-04-25 01:27:20.665836,0 days 00:00:00.498682,0.024315534702023255,0.005608340782808273,0.0001206220518858434,linear,TPESampler,COMPLETE
728,0.7047532650325874,2025-04-25 01:27:20.821037,2025-04-25 01:27:21.375394,0 days 00:00:00.554357,2.414115266419266,0.03218216119755989,0.010790757030584772,poly,TPESampler,COMPLETE
729,0.5869140511984868,2025-04-25 01:27:21.536643,2025-04-25 01:27:22.043793,0 days 00:00:00.507150,1.529537210093024,0.7170507399939596,0.03006776989494079,linear,TPESampler,COMPLETE
730,0.48006470537324464,2025-04-25 01:27:22.204065,2025-04-25 01:27:24.662167,0 days 00:00:02.458102,8.895945977713094,0.24756833809623258,0.15311105501337804,linear,TPESampler,COMPLETE
731,0.2766748792507572,2025-04-25 01:27:24.822287,2025-04-25 01:27:25.321355,0 days 00:00:00.499068,3.353440577274089,0.09669059463997126,0.06109935073098144,rbf,TPESampler,COMPLETE
732,0.28741629813794667,2025-04-25 01:27:25.484787,2025-04-25 01:27:26.024002,0 days 00:00:00.539215,14.80646891659504,0.04577831928558068,0.022635328703286047,rbf,TPESampler,COMPLETE
733,20.691420250865356,2025-04-25 01:27:26.191043,2025-04-25 01:27:26.702876,0 days 00:00:00.511833,0.9119225394044909,0.0625886428112678,0.08509405957303896,sigmoid,TPESampler,COMPLETE
734,0.3137827792880466,2025-04-25 01:27:26.864944,2025-04-25 01:27:27.392854,0 days 00:00:00.527910,0.7928491342378905,0.015113653648004006,0.15077702809194626,rbf,TPESampler,COMPLETE
735,8.395228721664827,2025-04-25 01:27:27.554079,2025-04-25 01:27:28.072480,0 days 00:00:00.518401,2.93587513610273,0.17514618003456062,0.005226242065237175,sigmoid,TPESampler,COMPLETE
736,0.33766179120846584,2025-04-25 01:27:28.231934,2025-04-25 01:27:28.712866,0 days 00:00:00.480932,56.12290689882898,0.15158614605462847,0.21220318864192436,rbf,TPESampler,COMPLETE
737,0.2917969576702501,2025-04-25 01:27:28.878681,2025-04-25 01:27:29.408134,0 days 00:00:00.529453,11.546424861958787,0.05481525276647847,0.16216522002335781,rbf,TPESampler,COMPLETE
738,0.26985048952439694,2025-04-25 01:27:29.575774,2025-04-25 01:27:30.111166,0 days 00:00:00.535392,3.3209478714928267,0.024626104174387424,0.06811957448801281,rbf,TPESampler,COMPLETE
739,0.38732320161640654,2025-04-25 01:27:30.271276,2025-04-25 01:27:30.736040,0 days 00:00:00.464764,7.771944716605212,0.4031277861572479,0.10295438054111809,rbf,TPESampler,COMPLETE
740,0.29557354331657537,2025-04-25 01:27:30.893925,2025-04-25 01:27:31.375666,0 days 00:00:00.481741,14.858387118289924,0.14792403142454535,0.029925748380752508,rbf,TPESampler,COMPLETE
741,0.3441747266818287,2025-04-25 01:27:31.549535,2025-04-25 01:27:32.050480,0 days 00:00:00.500945,2.6633539611346264,0.06503461407988698,0.012898669859705166,rbf,TPESampler,COMPLETE
742,0.37665475551059313,2025-04-25 01:27:32.221382,2025-04-25 01:27:32.748715,0 days 00:00:00.527333,52.99105190955585,0.057874872285702664,0.0006534910115340128,rbf,TPESampler,COMPLETE
743,0.2736489945838762,2025-04-25 01:27:32.907045,2025-04-25 01:27:33.468242,0 days 00:00:00.561197,13.64756523270459,0.02620288763906038,0.11169311417176948,rbf,TPESampler,COMPLETE
744,0.2891816226017799,2025-04-25 01:27:33.644968,2025-04-25 01:27:34.195273,0 days 00:00:00.550305,1.988389931476593,0.04296620366408401,0.1803970896902948,rbf,TPESampler,COMPLETE
745,0.3018585512052291,2025-04-25 01:27:34.359496,2025-04-25 01:27:34.943632,0 days 00:00:00.584136,71.87773145488035,0.03476980932766402,0.10349589861702,rbf,TPESampler,COMPLETE
746,0.9925771120422305,2025-04-25 01:27:35.115099,2025-04-25 01:27:35.572751,0 days 00:00:00.457652,0.08719336217818548,0.6751214394649218,0.00015386058192666101,poly,TPESampler,COMPLETE
747,0.26526890159692484,2025-04-25 01:27:35.779081,2025-04-25 01:27:36.531459,0 days 00:00:00.752378,4.905686193267458,0.052650844856652744,0.06313032427131288,rbf,TPESampler,COMPLETE
748,0.2837497120986175,2025-04-25 01:27:36.861631,2025-04-25 01:27:37.432274,0 days 00:00:00.570643,3.3633395706144134,0.08345247792159668,0.04694449227908938,rbf,TPESampler,COMPLETE
749,0.27264865152095075,2025-04-25 01:27:37.681691,2025-04-25 01:27:38.228885,0 days 00:00:00.547194,7.323046049461437,0.04335119940708851,0.039660573285270916,rbf,TPESampler,COMPLETE
750,0.2684363137527025,2025-04-25 01:27:38.480776,2025-04-25 01:27:39.094841,0 days 00:00:00.614065,15.153863305892946,0.060223846756260135,0.053969593318611814,rbf,TPESampler,COMPLETE
751,0.3431040348734449,2025-04-25 01:27:39.252431,2025-04-25 01:27:39.765554,0 days 00:00:00.513123,5.380717139044682,0.03245578393058975,0.008004151519105494,rbf,TPESampler,COMPLETE
752,0.3505610476369565,2025-04-25 01:27:39.925876,2025-04-25 01:27:40.427857,0 days 00:00:00.501981,10.655097081452766,0.10113890522715296,0.2926668919603957,rbf,TPESampler,COMPLETE
753,0.30472248680937153,2025-04-25 01:27:40.586931,2025-04-25 01:27:41.102579,0 days 00:00:00.515648,54.399817125133396,0.11796448873652983,0.016557286754121176,rbf,TPESampler,COMPLETE
754,0.49370604948309665,2025-04-25 01:27:41.256800,2025-04-25 01:27:45.025048,0 days 00:00:03.768248,11.228160466202118,0.06612269747256258,0.09290085264923062,linear,TPESampler,COMPLETE
755,0.2786941407945795,2025-04-25 01:27:45.336122,2025-04-25 01:27:46.821885,0 days 00:00:01.485763,19.75695227091227,0.017816072861677166,0.03201341150623347,rbf,TPESampler,COMPLETE
756,0.30772791145023454,2025-04-25 01:27:47.080909,2025-04-25 01:27:48.290843,0 days 00:00:01.209934,8.304527895663266,0.007540938620529974,0.2267041166076557,rbf,TPESampler,COMPLETE
757,0.3341568700054043,2025-04-25 01:27:48.673626,2025-04-25 01:27:49.608628,0 days 00:00:00.935002,1.6447210937649035,0.029959358201980427,0.023481516104389907,rbf,TPESampler,COMPLETE
758,0.2694069333939199,2025-04-25 01:27:49.939550,2025-04-25 01:27:50.829337,0 days 00:00:00.889787,11.073457674517407,0.07729683229214115,0.08440815888809178,rbf,TPESampler,COMPLETE
759,0.26518448688524754,2025-04-25 01:27:51.196813,2025-04-25 01:27:51.988304,0 days 00:00:00.791491,9.2714052016359,0.020928200045341572,0.06543395431291846,rbf,TPESampler,COMPLETE
760,0.31350457913955915,2025-04-25 01:27:52.154504,2025-04-25 01:27:52.757227,0 days 00:00:00.602723,2.47244939964092,0.006983427896061668,0.025417282024009318,rbf,TPESampler,COMPLETE
761,0.285915930624823,2025-04-25 01:27:52.935767,2025-04-25 01:27:53.923533,0 days 00:00:00.987766,35.94396719844508,0.008263509361508683,0.02551467236189948,rbf,TPESampler,COMPLETE
762,0.3047009986186525,2025-04-25 01:27:54.106536,2025-04-25 01:27:54.860298,0 days 00:00:00.753762,78.2211787661942,0.011064574382292719,0.1728805308170988,rbf,TPESampler,COMPLETE
763,0.27048953768167644,2025-04-25 01:27:55.373094,2025-04-25 01:27:55.928598,0 days 00:00:00.555504,6.0549872563490394,0.0257484595565797,0.045516701965970276,rbf,TPESampler,COMPLETE
764,0.5042075665861827,2025-04-25 01:27:56.348433,2025-04-25 01:27:57.079195,0 days 00:00:00.730762,2.0153514595804274,0.4727941059761699,0.00024322114469115387,linear,TPESampler,COMPLETE
765,0.2677117214766475,2025-04-25 01:27:57.356941,2025-04-25 01:27:57.934833,0 days 00:00:00.577892,4.507750351868862,0.010907810340102037,0.06663385860738101,rbf,TPESampler,COMPLETE
766,0.3135928065741057,2025-04-25 01:27:58.208284,2025-04-25 01:27:58.878456,0 days 00:00:00.670172,12.179989774865993,0.01659734981469289,0.21711828398345248,rbf,TPESampler,COMPLETE
767,0.4215975668864132,2025-04-25 01:27:59.181237,2025-04-25 01:27:59.694955,0 days 00:00:00.513718,0.11367106038549608,0.04701442762617854,0.21370603988946374,linear,TPESampler,COMPLETE
768,119.75186530684965,2025-04-25 01:27:59.864531,2025-04-25 01:28:00.396304,0 days 00:00:00.531773,5.018629665129786,0.19111322672699688,0.3315892041486862,sigmoid,TPESampler,COMPLETE
769,0.28756295133319226,2025-04-25 01:28:00.564543,2025-04-25 01:28:01.139464,0 days 00:00:00.574921,3.5705089861086536,0.017251999979199774,0.1931387753089794,rbf,TPESampler,COMPLETE
770,0.4297943863439625,2025-04-25 01:28:01.314448,2025-04-25 01:28:01.947088,0 days 00:00:00.632640,0.37918691737514454,0.0029709070311014123,0.01390200565461219,linear,TPESampler,COMPLETE
771,0.291619414765443,2025-04-25 01:28:02.138871,2025-04-25 01:28:02.900937,0 days 00:00:00.762066,65.90562855226482,0.023321594997877074,0.02192842902788507,rbf,TPESampler,COMPLETE
772,0.26602095317887103,2025-04-25 01:28:03.068912,2025-04-25 01:28:03.616834,0 days 00:00:00.547922,6.17685880859441,0.034211652301868935,0.08698167329150752,rbf,TPESampler,COMPLETE
773,0.3477910291472794,2025-04-25 01:28:03.790458,2025-04-25 01:28:04.275066,0 days 00:00:00.484608,2.4383559558906973,0.15788558561960067,0.014632973539876982,rbf,TPESampler,COMPLETE
774,0.7085358362542725,2025-04-25 01:28:04.443788,2025-04-25 01:28:04.975768,0 days 00:00:00.531980,0.015283594256722656,0.007025241973190555,0.0657734195820416,rbf,TPESampler,COMPLETE
775,0.5781580241068229,2025-04-25 01:28:05.140739,2025-04-25 01:28:42.904287,0 days 00:00:37.763548,0.002936119496555965,0.12353501798259017,0.3760626841885094,poly,TPESampler,COMPLETE
776,0.26762294648524354,2025-04-25 01:28:43.077987,2025-04-25 01:28:43.700544,0 days 00:00:00.622557,7.061960310564174,0.01968509094655785,0.053297424396431814,rbf,TPESampler,COMPLETE
777,0.5338738582083318,2025-04-25 01:28:43.888172,2025-04-25 01:28:44.399670,0 days 00:00:00.511498,0.004485660601170763,0.0020204331235431144,0.16410652125193645,linear,TPESampler,COMPLETE
778,152.0975764564368,2025-04-25 01:28:44.584327,2025-04-25 01:28:45.103593,0 days 00:00:00.519266,10.745463588229365,0.058484652802391665,0.020095362133970965,sigmoid,TPESampler,COMPLETE
779,0.34574443772273505,2025-04-25 01:28:45.273144,2025-04-25 01:28:45.762181,0 days 00:00:00.489037,0.9348908266926633,0.07942232832366665,0.03188006068032441,rbf,TPESampler,COMPLETE
780,0.2686334452706128,2025-04-25 01:28:45.932395,2025-04-25 01:28:46.493550,0 days 00:00:00.561155,18.570059107947785,0.04717133739122143,0.04146448637846799,rbf,TPESampler,COMPLETE
781,0.33369378613671363,2025-04-25 01:28:46.662234,2025-04-25 01:28:47.208411,0 days 00:00:00.546177,13.267796325578175,0.035472840222422385,0.29934629004606894,rbf,TPESampler,COMPLETE
782,0.3542156516179917,2025-04-25 01:28:47.399979,2025-04-25 01:28:47.926997,0 days 00:00:00.527018,5.256579280624187,0.013307005087800155,0.006268666912352211,rbf,TPESampler,COMPLETE
783,0.9854595026897347,2025-04-25 01:28:48.094785,2025-04-25 01:28:48.561171,0 days 00:00:00.466386,0.001118487225037681,0.8417523336201833,0.016593462872557266,poly,TPESampler,COMPLETE
784,0.3183887366299381,2025-04-25 01:28:48.725021,2025-04-25 01:28:49.333175,0 days 00:00:00.608154,3.867555573265895,0.09397794108308125,0.2230185567004145,rbf,TPESampler,COMPLETE
785,0.7351418594817387,2025-04-25 01:28:49.504677,2025-04-25 01:28:50.024535,0 days 00:00:00.519858,0.08951100395011734,0.018195124975928664,0.002085148559175253,sigmoid,TPESampler,COMPLETE
786,0.5635441833349083,2025-04-25 01:28:50.190743,2025-04-25 01:29:44.344292,0 days 00:00:54.153549,14.457726519037669,0.02736636256520477,0.02745766333489128,poly,TPESampler,COMPLETE
787,0.26746429617886835,2025-04-25 01:29:44.528543,2025-04-25 01:29:45.117296,0 days 00:00:00.588753,8.491167126651154,0.015073494866135772,0.06133843805531951,rbf,TPESampler,COMPLETE
788,0.2967237095742615,2025-04-25 01:29:45.287135,2025-04-25 01:29:45.810254,0 days 00:00:00.523119,4.2363827904547176,0.05381262906016959,0.02501896110350276,rbf,TPESampler,COMPLETE
789,0.3401853819738008,2025-04-25 01:29:45.980141,2025-04-25 01:29:46.501397,0 days 00:00:00.521256,0.5373683514016295,0.03885560433649185,0.06443604693756165,rbf,TPESampler,COMPLETE
790,0.7383296316159362,2025-04-25 01:29:46.669497,2025-04-25 01:29:47.182035,0 days 00:00:00.512538,0.34939593073117703,0.029692299588495556,0.00022549648544105375,rbf,TPESampler,COMPLETE
791,0.9000439973822357,2025-04-25 01:29:47.347122,2025-04-25 01:29:47.820020,0 days 00:00:00.472898,0.255381244428909,0.5782207018409369,0.00011605855840962784,sigmoid,TPESampler,COMPLETE
792,0.26791232917710706,2025-04-25 01:29:47.988527,2025-04-25 01:29:48.495915,0 days 00:00:00.507388,12.735375170811823,0.09032740627764588,0.059019375373749065,rbf,TPESampler,COMPLETE
793,0.2669501653851078,2025-04-25 01:29:48.672884,2025-04-25 01:29:49.253572,0 days 00:00:00.580688,13.49450271813289,0.03717747920371276,0.07733842799286769,rbf,TPESampler,COMPLETE
794,0.4788947520744189,2025-04-25 01:29:49.418227,2025-04-25 01:29:49.936505,0 days 00:00:00.518278,98.24565443037999,0.00730698297860352,0.00013954970606469715,sigmoid,TPESampler,COMPLETE
795,1.0010481358227075,2025-04-25 01:29:50.105337,2025-04-25 01:57:52.424065,0 days 00:28:02.318728,14.484579530758863,0.04291173203860799,0.20889368185952123,poly,TPESampler,COMPLETE
796,0.30052562046669956,2025-04-25 01:57:52.705663,2025-04-25 01:57:53.561856,0 days 00:00:00.856193,9.51041860129012,0.08795770192758354,0.014863136082236049,rbf,TPESampler,COMPLETE
797,0.29924831126101104,2025-04-25 01:57:53.732610,2025-04-25 01:57:54.423906,0 days 00:00:00.691296,2.0843894098325246,0.060830904691302784,0.2070281878545098,rbf,TPESampler,COMPLETE
798,0.2809805023250585,2025-04-25 01:57:54.657314,2025-04-25 01:57:55.596391,0 days 00:00:00.939077,14.451823913037588,0.004108997277635477,0.033992734959169636,rbf,TPESampler,COMPLETE
799,0.4363603525945567,2025-04-25 01:57:55.767322,2025-04-25 01:57:56.416205,0 days 00:00:00.648883,0.504272921346742,0.014644717535949113,0.02299009906446097,linear,TPESampler,COMPLETE
800,0.48791779563020493,2025-04-25 01:57:56.585266,2025-04-25 01:57:57.098296,0 days 00:00:00.513030,0.009091171445792,0.006627122059889961,0.004858154978818822,linear,TPESampler,COMPLETE
801,0.2897803739963226,2025-04-25 01:57:57.272639,2025-04-25 01:57:57.822070,0 days 00:00:00.549431,1.482126627446964,0.01238360214914402,0.08055333559565979,rbf,TPESampler,COMPLETE
802,0.2723113008139038,2025-04-25 01:57:57.990619,2025-04-25 01:57:58.504212,0 days 00:00:00.513593,2.6304825844573316,0.07125753718634702,0.07652667586365697,rbf,TPESampler,COMPLETE
803,0.27840038412750406,2025-04-25 01:57:58.670890,2025-04-25 01:57:59.233514,0 days 00:00:00.562624,17.02390510067128,0.03563324583664884,0.11728202947467793,rbf,TPESampler,COMPLETE
804,0.2807716522232748,2025-04-25 01:57:59.403575,2025-04-25 01:57:59.938800,0 days 00:00:00.535225,49.32390289623553,0.08769829972257419,0.06543788910853371,rbf,TPESampler,COMPLETE
805,0.26593862107006055,2025-04-25 01:58:00.111085,2025-04-25 01:58:00.745417,0 days 00:00:00.634332,9.539488543114913,0.012838762650687464,0.07217046627833476,rbf,TPESampler,COMPLETE
806,0.2933340855699313,2025-04-25 01:58:00.919116,2025-04-25 01:58:01.452397,0 days 00:00:00.533281,4.312981726886284,0.03804729510859901,0.026311335836954282,rbf,TPESampler,COMPLETE
807,3.4837058505124463,2025-04-25 01:58:01.625187,2025-04-25 01:58:02.155985,0 days 00:00:00.530798,0.41703727342309915,0.011599498102487277,0.011605474898872575,sigmoid,TPESampler,COMPLETE
808,0.29824677060279675,2025-04-25 01:58:02.334243,2025-04-25 01:58:02.808401,0 days 00:00:00.474158,2.3294213490928626,0.1786810488622429,0.05481383908379058,rbf,TPESampler,COMPLETE
809,352.9946250727052,2025-04-25 01:58:02.980813,2025-04-25 01:58:03.497944,0 days 00:00:00.517131,15.781891388723889,0.05990873160154616,0.29040213421028677,sigmoid,TPESampler,COMPLETE
810,0.5021052304881182,2025-04-25 01:58:03.671958,2025-04-25 01:58:10.630191,0 days 00:00:06.958233,19.313560684864516,0.025888921087840584,0.033255028958282154,linear,TPESampler,COMPLETE
811,0.2840511213740218,2025-04-25 01:58:10.804572,2025-04-25 01:58:11.413677,0 days 00:00:00.609105,29.33523944336311,0.03841648020756653,0.024937128385961606,rbf,TPESampler,COMPLETE
812,0.3253179674561297,2025-04-25 01:58:11.587964,2025-04-25 01:58:12.122115,0 days 00:00:00.534151,17.622563775438447,0.07742669777914447,0.22302588713412497,rbf,TPESampler,COMPLETE
813,0.4275919430805417,2025-04-25 01:58:12.289965,2025-04-25 01:58:12.830091,0 days 00:00:00.540126,3.0937522856700754,0.022203133950088143,0.5929099397695677,rbf,TPESampler,COMPLETE
814,0.6476733972041425,2025-04-25 01:58:13.030179,2025-04-25 01:58:14.359926,0 days 00:00:01.329747,0.027020929890740026,0.02896066769005533,0.10614165284862415,poly,TPESampler,COMPLETE
815,0.3875422200933925,2025-04-25 01:58:14.543225,2025-04-25 01:58:15.096777,0 days 00:00:00.553552,1.2518403783101109,0.013403937897577933,0.010552755084944363,rbf,TPESampler,COMPLETE
816,0.7511147181851425,2025-04-25 01:58:15.272335,2025-04-25 01:58:28.051125,0 days 00:00:12.778790,0.03804030256778173,0.26466518369986686,0.4516480109389158,poly,TPESampler,COMPLETE
817,0.27055217207550064,2025-04-25 01:58:28.232301,2025-04-25 01:58:28.759865,0 days 00:00:00.527564,2.605922225216845,0.028360337884582264,0.106303601583899,rbf,TPESampler,COMPLETE
818,0.2729451646982554,2025-04-25 01:58:28.926727,2025-04-25 01:58:29.554985,0 days 00:00:00.628258,22.323078514876105,0.031546569587729806,0.05782593923076209,rbf,TPESampler,COMPLETE
819,0.2743925958804137,2025-04-25 01:58:29.716005,2025-04-25 01:58:30.222757,0 days 00:00:00.506752,17.03175124031839,0.11748495598193039,0.08055177420911022,rbf,TPESampler,COMPLETE
820,0.2968686725470314,2025-04-25 01:58:30.386306,2025-04-25 01:58:30.914581,0 days 00:00:00.528275,1.3919281725731942,0.02871761282264482,0.05732227078897474,rbf,TPESampler,COMPLETE
821,0.3186497806454641,2025-04-25 01:58:31.076530,2025-04-25 01:58:31.610892,0 days 00:00:00.534362,4.167174064419443,0.03411131229919398,0.016280619325466414,rbf,TPESampler,COMPLETE
822,0.26970992607317257,2025-04-25 01:58:31.780188,2025-04-25 01:58:32.299634,0 days 00:00:00.519446,3.5123636327571948,0.0657401003126909,0.10837284259752526,rbf,TPESampler,COMPLETE
823,0.31370210733052656,2025-04-25 01:58:32.469266,2025-04-25 01:58:33.033591,0 days 00:00:00.564325,25.236052572259663,0.0290983536247807,0.21815717202591095,rbf,TPESampler,COMPLETE
824,0.2728138617494338,2025-04-25 01:58:33.204929,2025-04-25 01:58:33.775584,0 days 00:00:00.570655,7.845045685812236,0.026496947204806547,0.1263183478816467,rbf,TPESampler,COMPLETE
825,0.9984702538088172,2025-04-25 01:58:33.941703,2025-04-25 01:58:34.639355,0 days 00:00:00.697652,0.0028443894173649322,0.8059671522013504,0.00022546811994309822,poly,TPESampler,COMPLETE
826,0.3130555065640317,2025-04-25 01:58:34.852185,2025-04-25 01:58:35.332893,0 days 00:00:00.480708,19.28996845980121,0.25036493217695804,0.07417341464449376,rbf,TPESampler,COMPLETE
