number,value,datetime_start,datetime_complete,duration,params_C,params_epsilon,params_gamma,params_kernel,system_attrs_auto:sampler,state
0,0.5061893041596127,2025-04-24 20:59:18.732922,2025-04-24 20:59:27.033829,0 days 00:00:08.300907,29.58897108191009,0.0015112750024161993,0.34579926397319916,linear,RandomSampler,COMPLETE
1,0.7175755595364873,2025-04-24 20:59:18.746779,2025-04-24 20:59:19.373233,0 days 00:00:00.626454,0.23194494152392664,0.03895500175106487,0.020736757649539223,poly,RandomSampler,COMPLETE
2,0.7436178025924379,2025-04-24 20:59:18.815285,2025-04-24 20:59:19.455117,0 days 00:00:00.639832,0.002918912911200501,0.0016149934262824257,0.07349428184795857,poly,RandomSampler,COMPLETE
3,0.9493821543716722,2025-04-24 20:59:19.522956,2025-04-24 20:59:19.998781,0 days 00:00:00.475825,0.289279537626177,0.008602998414392006,0.0012233688795757498,poly,TPESampler,COMPLETE
4,0.6176972138218957,2025-04-24 20:59:19.711432,2025-04-24 20:59:23.965038,0 days 00:00:04.253606,24.51171944630659,0.01381456243625953,0.014032411166658708,poly,TPESampler,COMPLETE
5,0.5731928750184752,2025-04-24 20:59:20.188318,2025-04-24 20:59:20.621740,0 days 00:00:00.433422,0.11248426225552349,0.0058152990517799175,0.009061696585173118,rbf,TPESampler,COMPLETE
6,0.5675805584257645,2025-04-24 20:59:20.788871,2025-04-24 20:59:21.242901,0 days 00:00:00.454030,0.9293894394243175,0.02261134197779498,0.0013081723882043138,rbf,TPESampler,COMPLETE
7,0.930793932301096,2025-04-24 20:59:21.399890,2025-04-24 20:59:21.835304,0 days 00:00:00.435414,0.0014211493399133932,0.0036406848181320625,0.031520632394658396,sigmoid,TPESampler,COMPLETE
8,0.5049778768706651,2025-04-24 20:59:22.004671,2025-04-24 20:59:28.406094,0 days 00:00:06.401423,20.004950178138277,0.0012493795337533934,0.004309917636115583,linear,TPESampler,COMPLETE
9,0.5025216165752103,2025-04-24 20:59:24.133936,2025-04-24 20:59:24.505591,0 days 00:00:00.371655,9.74417507089712,0.6981959530232806,0.01177626917911661,rbf,TPESampler,COMPLETE
10,0.8740773118260153,2025-04-24 20:59:24.654014,2025-04-24 20:59:25.198473,0 days 00:00:00.544459,31.26279008652971,0.010711075410083757,0.0013623276993924623,poly,TPESampler,COMPLETE
11,0.9648833516006922,2025-04-24 20:59:25.352917,2025-04-24 20:59:25.768351,0 days 00:00:00.415434,0.003052500296423289,0.0026787623332953886,0.0002937743187623164,poly,TPESampler,COMPLETE
12,0.6634737218931531,2025-04-24 20:59:25.922409,2025-04-24 20:59:26.373302,0 days 00:00:00.450893,41.71578582837833,0.9100706609090474,0.001328920350334117,rbf,TPESampler,COMPLETE
13,0.374887875116568,2025-04-24 20:59:26.731882,2025-04-24 20:59:27.145929,0 days 00:00:00.414047,1.211565443329907,0.3540130326000864,0.1630476019538684,rbf,TPESampler,COMPLETE
14,0.3456240630453135,2025-04-24 20:59:27.201968,2025-04-24 20:59:27.802576,0 days 00:00:00.600608,0.9449622753489764,0.2657482810101448,0.13080551834745996,rbf,TPESampler,COMPLETE
15,0.37718131386808823,2025-04-24 20:59:27.329511,2025-04-24 20:59:27.927988,0 days 00:00:00.598477,5.493698531357996,0.1286594378796755,0.3528918139912685,rbf,TPESampler,COMPLETE
16,0.7074922568648128,2025-04-24 20:59:27.974639,2025-04-24 20:59:29.606064,0 days 00:00:01.631425,0.046042063450351514,0.6823210967488569,0.0884022233754188,poly,TPESampler,COMPLETE
17,0.500634034887068,2025-04-24 20:59:28.307271,2025-04-24 20:59:29.109187,0 days 00:00:00.801916,0.07273202150303475,0.13784840982158866,0.05397194379006058,rbf,TPESampler,COMPLETE
18,24.779249713310243,2025-04-24 20:59:28.608819,2025-04-24 20:59:29.338911,0 days 00:00:00.730092,0.9128664551284748,0.9007606728355241,0.4985910454368615,sigmoid,TPESampler,COMPLETE
19,3.815308903943741,2025-04-24 20:59:29.279430,2025-04-24 20:59:29.926631,0 days 00:00:00.647201,0.12897647083091449,0.023078415530554182,0.45217849622401685,sigmoid,TPESampler,COMPLETE
20,0.8351101266454652,2025-04-24 20:59:29.555815,2025-04-24 20:59:30.305752,0 days 00:00:00.749937,0.10359877461347715,0.40552189662412863,0.7081954578479569,rbf,TPESampler,COMPLETE
21,0.9653026867960628,2025-04-24 20:59:29.784535,2025-04-24 20:59:30.653235,0 days 00:00:00.868700,0.0021533933600222017,0.32510859226643557,0.0006471182386076915,sigmoid,TPESampler,COMPLETE
22,0.3427224808613316,2025-04-24 20:59:30.191511,2025-04-24 20:59:31.048864,0 days 00:00:00.857353,49.76633223941064,0.13900082233223515,0.23637313928245154,rbf,TPESampler,COMPLETE
23,0.4921375692353241,2025-04-24 20:59:30.547920,2025-04-24 20:59:32.905060,0 days 00:00:02.357140,5.941648647079877,0.05883316993010367,0.30236849917975195,linear,TPESampler,COMPLETE
24,385.3429869244089,2025-04-24 20:59:30.903111,2025-04-24 20:59:31.643371,0 days 00:00:00.740260,27.392146284749654,0.11870582527495413,0.019800053443985388,sigmoid,TPESampler,COMPLETE
25,15.18481474114495,2025-04-24 20:59:31.397350,2025-04-25 00:14:23.412696,0 days 03:14:52.015346,89.35144113636804,0.4277501456460335,0.5321551374376698,poly,TPESampler,COMPLETE
26,0.46794123454881353,2025-04-24 20:59:31.859207,2025-04-24 20:59:32.479907,0 days 00:00:00.620700,1.0573067550087187,0.2682629950280352,0.010856250004624377,linear,TPESampler,COMPLETE
27,0.391142676989122,2025-04-24 20:59:32.651617,2025-04-24 20:59:33.102210,0 days 00:00:00.450593,3.9469605198154993,0.3822300005035746,0.14615854139493292,rbf,TPESampler,COMPLETE
28,0.2878175578227839,2025-04-24 20:59:33.068826,2025-04-24 20:59:33.679576,0 days 00:00:00.610750,54.9145164403378,0.06026245958059586,0.02140997682895635,rbf,TPESampler,COMPLETE
29,0.2735215707086652,2025-04-24 20:59:33.348912,2025-04-24 20:59:33.924605,0 days 00:00:00.575693,4.081356617658129,0.01450739270054955,0.14467828606175348,rbf,TPESampler,COMPLETE
30,0.306616664163764,2025-04-24 20:59:33.854640,2025-04-24 20:59:34.677047,0 days 00:00:00.822407,90.32254947818228,0.0074333901021770565,0.11886668320150626,rbf,TPESampler,COMPLETE
31,0.32978596595261167,2025-04-24 20:59:34.099442,2025-04-24 20:59:34.636527,0 days 00:00:00.537085,14.128579142483884,0.03529205424833209,0.0060795502215974725,rbf,TPESampler,COMPLETE
32,0.34434848935238893,2025-04-24 20:59:34.742407,2025-04-24 20:59:35.474777,0 days 00:00:00.732370,14.781904580254855,0.02878965877338571,0.0038823264824406492,rbf,TPESampler,COMPLETE
33,0.30852828303485874,2025-04-24 20:59:34.806105,2025-04-24 20:59:35.763068,0 days 00:00:00.956963,68.50725726022964,0.004864723567872446,0.10862053179478123,rbf,TPESampler,COMPLETE
34,0.300808365269551,2025-04-24 20:59:35.640425,2025-04-24 20:59:36.713712,0 days 00:00:01.073287,88.78922011544628,0.0012696273267163703,0.06912188667733861,rbf,TPESampler,COMPLETE
35,0.3351626354706896,2025-04-24 20:59:35.917060,2025-04-24 20:59:36.475326,0 days 00:00:00.558266,3.110498435226635,0.008691089868307857,0.3475311162411266,rbf,TPESampler,COMPLETE
36,1137.750669516464,2025-04-24 20:59:36.631302,2025-04-24 20:59:37.131550,0 days 00:00:00.500248,55.51956309475804,0.005587498070508779,0.14685223322722338,sigmoid,TPESampler,COMPLETE
37,0.29521970955975635,2025-04-24 20:59:36.889589,2025-04-24 20:59:37.600450,0 days 00:00:00.710861,26.239845045285993,0.0010620959086644485,0.12716054845683497,rbf,TPESampler,COMPLETE
38,0.3182716055193816,2025-04-24 20:59:37.304266,2025-04-24 20:59:38.044834,0 days 00:00:00.740568,62.51541556607709,0.0012502397813761927,0.008263087802613065,rbf,TPESampler,COMPLETE
39,0.9684642708305499,2025-04-24 20:59:37.773444,2025-04-24 20:59:38.246721,0 days 00:00:00.473277,0.4516735789004377,0.2149120430982933,0.00013440340031928147,poly,TPESampler,COMPLETE
40,0.42978244230620566,2025-04-24 20:59:38.222109,2025-04-24 20:59:38.844754,0 days 00:00:00.622645,0.3847833945642167,0.0014465668437536026,0.11946098706988846,linear,TPESampler,COMPLETE
41,0.7875317000962634,2025-04-24 20:59:38.387409,2025-04-24 21:12:19.198001,0 days 00:12:40.810592,15.942103838752075,0.0010729453832144513,0.06146525457967322,poly,TPESampler,COMPLETE
42,0.31671625383736485,2025-04-24 20:59:39.017294,2025-04-24 20:59:39.578976,0 days 00:00:00.561682,6.6139430437555875,0.0015763194957367388,0.26861631860568613,rbf,TPESampler,COMPLETE
43,0.39328052565021965,2025-04-24 20:59:39.738057,2025-04-24 20:59:40.266700,0 days 00:00:00.528643,61.914520543232705,0.0010307609765613523,0.5150250183712003,rbf,TPESampler,COMPLETE
44,0.28940705052022697,2025-04-24 20:59:40.430481,2025-04-24 20:59:41.238952,0 days 00:00:00.808471,60.17732317056626,0.014204961000394395,0.031304560225325614,rbf,TPESampler,COMPLETE
45,0.2807380524963104,2025-04-24 20:59:41.410566,2025-04-24 20:59:42.013007,0 days 00:00:00.602441,47.07871686214007,0.042995754398360196,0.052982870762800026,rbf,TPESampler,COMPLETE
46,0.5044068504615367,2025-04-24 20:59:42.185823,2025-04-24 20:59:57.578967,0 days 00:00:15.393144,43.0313498275725,0.014946038531259559,0.05065427629975625,linear,TPESampler,COMPLETE
47,0.2758210586274241,2025-04-24 20:59:57.759533,2025-04-24 20:59:58.332844,0 days 00:00:00.573311,31.43311085846916,0.04899486419101591,0.0361023310958769,rbf,TPESampler,COMPLETE
48,0.2791358762911244,2025-04-24 20:59:58.503674,2025-04-24 20:59:59.017972,0 days 00:00:00.514298,42.115011002757804,0.11566065999744396,0.044554379631135864,rbf,TPESampler,COMPLETE
49,0.29035706023967794,2025-04-24 20:59:59.180083,2025-04-24 20:59:59.663398,0 days 00:00:00.483315,27.34009329413086,0.1391542640725048,0.028371940607685213,rbf,TPESampler,COMPLETE
50,0.48646017572834793,2025-04-24 20:59:59.839365,2025-04-24 21:00:16.712637,0 days 00:00:16.873272,70.81799587413838,0.10796068995311242,0.02345135396373432,linear,TPESampler,COMPLETE
51,0.31331731594478124,2025-04-24 21:00:16.877009,2025-04-24 21:00:17.380412,0 days 00:00:00.503403,1.9057319609604297,0.039308770276900426,0.030684531770960023,rbf,TPESampler,COMPLETE
52,0.2698749879198482,2025-04-24 21:00:17.544577,2025-04-24 21:00:18.124112,0 days 00:00:00.579535,21.054997364755046,0.039652186517931585,0.04111537777946816,rbf,TPESampler,COMPLETE
53,1.1440633594554972,2025-04-24 21:00:18.344543,2025-04-24 21:28:39.850638,0 days 00:28:21.506095,20.622556088308908,0.02993864119806934,0.14555317525717332,poly,TPESampler,COMPLETE
54,0.30023000225185414,2025-04-24 21:12:19.444066,2025-04-24 21:12:19.966133,0 days 00:00:00.522067,81.18622461992608,0.19499287923705677,0.023142429829119477,rbf,TPESampler,COMPLETE
55,0.2741235449417632,2025-04-24 21:12:20.132548,2025-04-24 21:12:20.657831,0 days 00:00:00.525283,6.555473780736532,0.055804847386022954,0.041035009493640785,rbf,TPESampler,COMPLETE
56,0.5834489150579623,2025-04-24 21:12:20.827940,2025-04-24 21:12:21.351901,0 days 00:00:00.523961,0.0025674285990505584,0.026014556990834548,0.00013523466659690777,linear,TPESampler,COMPLETE
57,0.650511196815095,2025-04-24 21:12:21.506197,2025-04-24 21:12:22.714564,0 days 00:00:01.208367,58.9872110637018,0.051869953888354185,0.0077095124126008085,poly,TPESampler,COMPLETE
58,0.26573347482324405,2025-04-24 21:12:22.909642,2025-04-24 21:12:23.523704,0 days 00:00:00.614062,8.634982045482882,0.03377184049573575,0.06943452815159772,rbf,TPESampler,COMPLETE
59,114.18737783596502,2025-04-24 21:12:23.703756,2025-04-24 21:12:24.221280,0 days 00:00:00.517524,4.961829063332367,0.04942761089999703,0.07298508603858149,sigmoid,TPESampler,COMPLETE
60,0.6624304996868607,2025-04-24 21:12:24.386154,2025-04-24 21:12:24.914641,0 days 00:00:00.528487,9.498120704509553,0.006432340383662145,0.00010524835348869604,sigmoid,TPESampler,COMPLETE
61,0.26651765958794466,2025-04-24 21:12:25.081749,2025-04-24 21:12:25.661144,0 days 00:00:00.579395,3.990053497083777,0.01894846094589895,0.10563983790481439,rbf,TPESampler,COMPLETE
62,0.3606051315808253,2025-04-24 21:12:25.841437,2025-04-24 21:12:26.391110,0 days 00:00:00.549673,1.0938389235719448,0.009096858082283898,0.02088072482799886,rbf,TPESampler,COMPLETE
63,0.2999373050037154,2025-04-24 21:12:26.568164,2025-04-24 21:12:27.204218,0 days 00:00:00.636054,1.2627657217996524,0.0363296695606594,0.16408035576869492,rbf,TPESampler,COMPLETE
64,0.3588273432276794,2025-04-24 21:12:27.383307,2025-04-24 21:12:27.936563,0 days 00:00:00.553256,18.223512247810604,0.030285869926565484,0.3903072818923073,rbf,TPESampler,COMPLETE
65,0.26625549658527176,2025-04-24 21:12:28.119150,2025-04-24 21:12:28.722745,0 days 00:00:00.603595,7.162628958875891,0.025412361463267075,0.09641886679435209,rbf,TPESampler,COMPLETE
66,0.9231110501335767,2025-04-24 21:12:28.921796,2025-04-24 21:20:52.069107,0 days 00:08:23.147311,0.33490804464198654,0.005959069914723641,0.29193603451022726,poly,TPESampler,COMPLETE
67,0.26746298551959213,2025-04-24 21:20:52.246765,2025-04-24 21:20:52.837705,0 days 00:00:00.590940,7.255981481315677,0.016336177755589137,0.10688619085049245,rbf,TPESampler,COMPLETE
68,0.29940906211845547,2025-04-24 21:20:53.002436,2025-04-24 21:20:53.519951,0 days 00:00:00.517515,1.0887767830030062,0.014530426336991989,0.1440187760433799,rbf,TPESampler,COMPLETE
69,14.830145500873193,2025-04-24 21:20:53.678581,2025-04-24 21:20:54.184531,0 days 00:00:00.505950,0.786413045158481,0.004713900613092898,0.030742409225904325,sigmoid,TPESampler,COMPLETE
70,0.2658835234541066,2025-04-24 21:20:54.351404,2025-04-24 21:20:54.900904,0 days 00:00:00.549500,6.970284108424937,0.03210189096219297,0.06158726573065027,rbf,TPESampler,COMPLETE
71,0.8247893384416523,2025-04-24 21:20:55.075395,2025-04-24 21:20:55.618969,0 days 00:00:00.543574,0.031831737822771954,0.005577094171641289,0.4276239437266655,rbf,TPESampler,COMPLETE
72,0.9548410208874889,2025-04-24 21:20:55.793737,2025-04-24 21:20:56.340472,0 days 00:00:00.546735,0.012449581055569646,0.0018287798694966682,0.00012924858167897188,rbf,TPESampler,COMPLETE
73,0.26870816717083135,2025-04-24 21:20:56.504673,2025-04-24 21:20:57.073618,0 days 00:00:00.568945,8.136220184511787,0.02219416878616633,0.054764063401771305,rbf,TPESampler,COMPLETE
74,0.26851436665868267,2025-04-24 21:20:57.230859,2025-04-24 21:20:57.801583,0 days 00:00:00.570724,4.770100029033287,0.020010576062545807,0.11626817052010521,rbf,TPESampler,COMPLETE
75,0.27082193253954473,2025-04-24 21:20:57.976382,2025-04-24 21:20:58.548608,0 days 00:00:00.572226,3.05869216385741,0.016697420605078537,0.07906883021351989,rbf,TPESampler,COMPLETE
76,0.7099008839617247,2025-04-24 21:20:58.716037,2025-04-24 21:20:59.205939,0 days 00:00:00.489902,0.39547580523068726,0.189944649313379,0.0012432060085482814,sigmoid,TPESampler,COMPLETE
77,0.7504638916113844,2025-04-24 21:20:59.367443,2025-04-24 21:20:59.925810,0 days 00:00:00.558367,1.5891103000093476,0.010442895558911305,0.008401073972492908,poly,TPESampler,COMPLETE
78,0.8793441046072968,2025-04-24 21:21:00.092572,2025-04-24 21:26:01.258563,0 days 00:05:01.165991,0.5325673421807325,0.06573336651824332,0.3216015915090748,poly,TPESampler,COMPLETE
79,0.4285151350565931,2025-04-24 21:26:01.421403,2025-04-24 21:26:02.051316,0 days 00:00:00.629913,0.34801905614942336,0.01712160615921563,0.06330872202253392,linear,TPESampler,COMPLETE
80,0.9020967106546098,2025-04-24 21:26:02.253357,2025-04-24 21:26:02.760063,0 days 00:00:00.506706,0.016388988403577286,0.006013365538347175,0.001173547418006169,sigmoid,TPESampler,COMPLETE
81,0.2693170619051397,2025-04-24 21:26:02.924847,2025-04-24 21:26:03.536355,0 days 00:00:00.611508,13.62685893412699,0.02084407887629318,0.08610778262060502,rbf,TPESampler,COMPLETE
82,0.2687932113939092,2025-04-24 21:26:03.696775,2025-04-24 21:26:04.275162,0 days 00:00:00.578387,3.406638395118018,0.009914328372921503,0.08445188437379261,rbf,TPESampler,COMPLETE
83,0.2729789769632381,2025-04-24 21:26:04.454754,2025-04-24 21:26:05.030189,0 days 00:00:00.575435,7.322782759009953,0.01438260114575898,0.03935795712660005,rbf,TPESampler,COMPLETE
84,0.8929243753671866,2025-04-24 21:26:05.199959,2025-04-24 21:26:05.732821,0 days 00:00:00.532862,0.03429473178255524,0.19321593013881186,0.0003361146159559527,rbf,TPESampler,COMPLETE
85,0.3129300246302545,2025-04-24 21:26:05.895825,2025-04-24 21:26:06.519026,0 days 00:00:00.623201,10.37538064241844,0.012925212678475935,0.22775794954396164,rbf,TPESampler,COMPLETE
86,0.2708919667621693,2025-04-24 21:26:06.706418,2025-04-24 21:26:07.258734,0 days 00:00:00.552316,2.6937228771418082,0.011302462998867956,0.10017741489214724,rbf,TPESampler,COMPLETE
87,0.30987571917974926,2025-04-24 21:26:07.427390,2025-04-24 21:26:08.021795,0 days 00:00:00.594405,4.5805056434338836,0.04447690637395532,0.2371069884430411,rbf,TPESampler,COMPLETE
88,0.2719546066137642,2025-04-24 21:26:08.189563,2025-04-24 21:26:08.876796,0 days 00:00:00.687233,12.685969084043862,0.009780392494562902,0.09565388019608685,rbf,TPESampler,COMPLETE
89,0.8370168853847708,2025-04-24 21:26:09.042669,2025-04-24 21:26:09.841034,0 days 00:00:00.798365,0.004566907485956897,0.03984477680324113,0.015164506966719195,rbf,TPESampler,COMPLETE
90,0.6495689448247868,2025-04-24 21:26:10.007664,2025-04-24 21:26:10.510593,0 days 00:00:00.502929,0.0012322330388707273,0.0045802623331232025,0.006778844032259563,linear,TPESampler,COMPLETE
91,0.7854336118815256,2025-04-24 21:26:10.693663,2025-04-24 21:26:11.156288,0 days 00:00:00.462625,0.0012140190369067068,0.804479436461413,0.006391272733046787,linear,TPESampler,COMPLETE
92,0.4976760954368708,2025-04-24 21:26:11.326986,2025-04-24 21:26:12.936867,0 days 00:00:01.609881,3.8900119651042315,0.025160573201185293,0.11299255788234976,linear,TPESampler,COMPLETE
93,0.34158348439407277,2025-04-24 21:26:13.103056,2025-04-24 21:26:13.618502,0 days 00:00:00.515446,2.317352714351827,0.025728776517292946,0.015602735102327155,rbf,TPESampler,COMPLETE
94,0.2773458695954417,2025-04-24 21:26:13.784754,2025-04-24 21:26:14.424306,0 days 00:00:00.639552,28.7744543879031,0.02307323820787183,0.08041893598762254,rbf,TPESampler,COMPLETE
95,0.26308953217152986,2025-04-24 21:26:14.584372,2025-04-24 21:26:15.169985,0 days 00:00:00.585613,5.225482045858339,0.03988105662036854,0.06715592273901477,rbf,TPESampler,COMPLETE
96,0.9043764960907674,2025-04-24 21:26:15.409422,2025-04-24 21:26:15.880829,0 days 00:00:00.471407,0.009080886311229728,0.66618470384051,0.04547503122106047,sigmoid,TPESampler,COMPLETE
97,0.27005717704408305,2025-04-24 21:26:16.037984,2025-04-24 21:26:16.556286,0 days 00:00:00.518302,3.72786612096258,0.043303218993379515,0.11294808860787733,rbf,TPESampler,COMPLETE
98,0.5810935642307986,2025-04-24 21:26:16.722037,2025-04-24 21:26:17.273655,0 days 00:00:00.551618,3.2259870517288314,0.021636498643511498,0.9926373945805533,rbf,TPESampler,COMPLETE
99,0.45777445366253505,2025-04-24 21:26:17.434071,2025-04-24 21:26:18.332500,0 days 00:00:00.898429,0.8444282333030456,0.003712539295277287,0.0008775504024930331,linear,TPESampler,COMPLETE
100,0.2755249653977935,2025-04-24 21:26:18.502961,2025-04-24 21:26:19.113695,0 days 00:00:00.610734,9.044457021166673,0.005852722719448477,0.03778655434974531,rbf,TPESampler,COMPLETE
101,0.4080803964821412,2025-04-24 21:26:19.394833,2025-04-24 21:26:19.891679,0 days 00:00:00.496846,0.18419469921233203,0.03782740535589264,0.06372520630303936,rbf,TPESampler,COMPLETE
102,0.9705543117311254,2025-04-24 21:26:20.062674,2025-04-24 21:47:12.294681,0 days 00:20:52.232007,12.713258795750438,0.008146849423816204,0.1234639888736849,poly,TPESampler,COMPLETE
103,0.3132320095837575,2025-04-24 21:28:40.030934,2025-04-24 21:28:40.545365,0 days 00:00:00.514431,4.4227644615577955,0.053876227017531364,0.017779632806153398,rbf,TPESampler,COMPLETE
104,0.9586436453483427,2025-04-24 21:28:40.796979,2025-04-24 21:28:41.344625,0 days 00:00:00.547646,44.036041308289015,0.0010163451248949363,0.00013271578236596354,poly,TPESampler,COMPLETE
105,295.0627723250541,2025-04-24 21:28:41.508698,2025-04-24 21:28:42.018324,0 days 00:00:00.509626,13.44118951597264,0.03420950988853158,0.27344217900513607,sigmoid,TPESampler,COMPLETE
106,0.2639585229446388,2025-04-24 21:28:42.178570,2025-04-24 21:28:42.713214,0 days 00:00:00.534644,5.032786445085413,0.04364217616005557,0.07636951086734384,rbf,TPESampler,COMPLETE
107,0.27201661753197504,2025-04-24 21:28:42.884451,2025-04-24 21:28:43.429169,0 days 00:00:00.544718,9.549123616901012,0.029783074005156514,0.11688656161697562,rbf,TPESampler,COMPLETE
108,0.267983872414636,2025-04-24 21:28:43.592556,2025-04-24 21:28:44.127381,0 days 00:00:00.534825,3.6987340518660314,0.0298188208085868,0.06710775065946689,rbf,TPESampler,COMPLETE
109,0.5026445442656192,2025-04-24 21:28:44.324744,2025-04-24 21:28:49.443618,0 days 00:00:05.118874,16.814389055882124,0.005121000130887965,0.7497921835373235,linear,TPESampler,COMPLETE
110,0.3038888806082362,2025-04-24 21:28:49.604542,2025-04-24 21:28:50.125381,0 days 00:00:00.520839,0.9171810897260322,0.03899640404336095,0.08631401263539162,rbf,TPESampler,COMPLETE
111,0.9497070398168053,2025-04-24 21:28:50.293626,2025-04-24 21:28:50.797707,0 days 00:00:00.504081,0.002338875101783815,0.09580976216556862,0.005390190708381673,poly,TPESampler,COMPLETE
112,0.3035613530164268,2025-04-24 21:28:50.961533,2025-04-24 21:28:51.460444,0 days 00:00:00.498911,2.1907900087275456,0.16574037325093283,0.04656663389179422,rbf,TPESampler,COMPLETE
113,0.2666992398881087,2025-04-24 21:28:51.626963,2025-04-24 21:28:52.330359,0 days 00:00:00.703396,6.519526601775224,0.029763000629494836,0.05703712852680218,rbf,TPESampler,COMPLETE
114,0.4919809779608697,2025-04-24 21:28:52.523097,2025-04-24 21:28:54.112375,0 days 00:00:01.589278,4.175618204607646,0.05245215677092679,0.0004791306853276586,linear,TPESampler,COMPLETE
115,0.2822525960907122,2025-04-24 21:28:54.290927,2025-04-24 21:28:54.800208,0 days 00:00:00.509281,2.9661618900505315,0.06448603328345012,0.05162163606060386,rbf,TPESampler,COMPLETE
116,0.6111572023733353,2025-04-24 21:28:54.955825,2025-04-24 21:34:35.485113,0 days 00:05:40.529288,2.9724148712199163,0.07294897717851932,0.08586247853386073,poly,TPESampler,COMPLETE
117,0.37708978217224703,2025-04-24 21:34:35.651870,2025-04-24 21:34:36.198217,0 days 00:00:00.546347,0.6866528904000818,0.0016302687463023294,0.023619023079624383,rbf,TPESampler,COMPLETE
