number,value,datetime_start,datetime_complete,duration,params_C,params_epsilon,params_gamma,params_kernel,system_attrs_auto:sampler,state
1181,0.28065380919859634,2025-04-25 03:34:09.867588,2025-04-25 03:34:10.481491,0 days 00:00:00.613903,13.285602622654686,0.011678329695790338,0.13661247518474395,rbf,TPESampler,COMPLETE
1182,0.27032649252826507,2025-04-25 03:34:10.655331,2025-04-25 03:34:11.271568,0 days 00:00:00.616237,7.952773087378936,0.008460311029902502,0.1105055632816346,rbf,TPESampler,COMPLETE
1183,0.2680356089422287,2025-04-25 03:34:11.440730,2025-04-25 03:34:12.016533,0 days 00:00:00.575803,5.3880778139615195,0.01550847220765774,0.11239583282878686,rbf,TPESampler,COMPLETE
1184,0.31567398900641364,2025-04-25 03:34:12.198116,2025-04-25 03:34:12.739174,0 days 00:00:00.541058,0.7032539205710571,0.0229859490286534,0.13946084204801784,rbf,TPESampler,COMPLETE
1185,0.30770884204435417,2025-04-25 03:34:12.909864,2025-04-25 03:34:13.459822,0 days 00:00:00.549958,3.0693717065068196,0.01718604160915917,0.02440152016577518,rbf,TPESampler,COMPLETE
1186,0.2640690373743903,2025-04-25 03:34:13.638113,2025-04-25 03:34:14.213547,0 days 00:00:00.575434,4.0115769231211935,0.02178728710553704,0.09285811010199789,rbf,TPESampler,COMPLETE
1187,0.3694320862806131,2025-04-25 03:34:14.397073,2025-04-25 03:34:14.955010,0 days 00:00:00.557937,0.29790289502885725,0.007671715066695681,0.08035690441694818,rbf,TPESampler,COMPLETE
1188,0.3828829328714318,2025-04-25 03:34:15.126842,2025-04-25 03:34:15.672475,0 days 00:00:00.545633,6.192385351667793,0.014445484024817079,0.47658117690014623,rbf,TPESampler,COMPLETE
1189,0.2745831576645371,2025-04-25 03:34:15.844348,2025-04-25 03:34:16.562710,0 days 00:00:00.718362,16.465576201562012,0.001421584971983812,0.07589269795254404,rbf,TPESampler,COMPLETE
1190,0.2784057075259177,2025-04-25 03:34:16.739226,2025-04-25 03:34:17.298205,0 days 00:00:00.558979,2.4611884346189874,0.0158330048390804,0.1517918879972914,rbf,TPESampler,COMPLETE
1191,0.32249017656432155,2025-04-25 03:34:17.471947,2025-04-25 03:34:18.006744,0 days 00:00:00.534797,0.6177009493453823,0.025437748956921243,0.08906171929843092,rbf,TPESampler,COMPLETE
1192,0.2900867532905605,2025-04-25 03:34:18.181540,2025-04-25 03:34:18.724745,0 days 00:00:00.543205,1.6488625165522057,0.030119684595586227,0.1613293095470748,rbf,TPESampler,COMPLETE
1193,240.1040267250784,2025-04-25 03:34:18.897864,2025-04-25 03:34:19.424604,0 days 00:00:00.526740,11.227530729039657,0.03710815534642798,0.05422271128839296,sigmoid,TPESampler,COMPLETE
1194,0.2672420919417304,2025-04-25 03:34:19.602386,2025-04-25 03:34:20.165765,0 days 00:00:00.563379,4.61482885078655,0.01104863504140158,0.06730642641767746,rbf,TPESampler,COMPLETE
1195,110.00578517641686,2025-04-25 03:34:20.346404,2025-04-25 03:34:20.887812,0 days 00:00:00.541408,4.301222442908979,0.018448272317602193,0.42967563856214663,sigmoid,TPESampler,COMPLETE
1196,0.280632357915493,2025-04-25 03:34:21.065704,2025-04-25 03:34:21.646474,0 days 00:00:00.580770,8.40601947376374,0.015322398356614416,0.02459602156018637,rbf,TPESampler,COMPLETE
1197,8.49711161198173,2025-04-25 03:34:21.825850,2025-04-25 05:33:41.543282,0 days 01:59:19.717432,35.57263900674156,0.04101939610675606,0.5960881841146628,poly,TPESampler,COMPLETE
1198,0.33970045827943124,2025-04-25 03:44:47.817099,2025-04-25 03:44:48.360076,0 days 00:00:00.542977,1.0128263712380992,0.05030355354212554,0.03279153994958909,rbf,TPESampler,COMPLETE
1199,0.338432783438702,2025-04-25 03:44:48.533760,2025-04-25 03:44:49.065127,0 days 00:00:00.531367,1.1441681640415977,0.0718544253489735,0.2759691032855922,rbf,TPESampler,COMPLETE
1200,0.2782984678544969,2025-04-25 03:44:49.241043,2025-04-25 03:44:49.814895,0 days 00:00:00.573852,2.825708286932614,0.023117787292474667,0.16515164451610165,rbf,TPESampler,COMPLETE
1201,0.3867441487199986,2025-04-25 03:44:49.996050,2025-04-25 03:44:50.537026,0 days 00:00:00.540976,1.8030978840246752,0.02449857430217325,0.007978324657459256,rbf,TPESampler,COMPLETE
1202,0.2761078098682604,2025-04-25 03:44:50.715149,2025-04-25 03:44:51.247790,0 days 00:00:00.532641,2.0220984677826355,0.0485243177254362,0.0873209326802977,rbf,TPESampler,COMPLETE
1203,0.30554848876760826,2025-04-25 03:44:51.425475,2025-04-25 03:44:52.274532,0 days 00:00:00.849057,41.67293736558307,0.007478063819080759,0.13571265276159786,rbf,TPESampler,COMPLETE
1204,0.7544471022828861,2025-04-25 03:44:52.466883,2025-04-25 03:44:52.998970,0 days 00:00:00.532087,1.097557153717439,0.0201421170947463,0.00011218179342605213,sigmoid,TPESampler,COMPLETE
1205,0.45878944491448315,2025-04-25 03:44:53.222054,2025-04-25 03:44:53.863207,0 days 00:00:00.641153,0.022829719284486797,0.0010288985997847725,0.9614784097838851,linear,TPESampler,COMPLETE
1206,0.2874481173778505,2025-04-25 03:44:54.068178,2025-04-25 03:44:54.697256,0 days 00:00:00.629078,1.462250020180187,0.004515495172138573,0.12081331403774956,rbf,TPESampler,COMPLETE
1207,0.3686849231980793,2025-04-25 03:44:54.863390,2025-04-25 03:44:55.406656,0 days 00:00:00.543266,4.955910795031536,0.034311992817524894,0.4192800089874937,rbf,TPESampler,COMPLETE
1208,0.27534398841516294,2025-04-25 03:44:55.576440,2025-04-25 03:44:56.155684,0 days 00:00:00.579244,3.176261088885887,0.005332729292450039,0.06372519632329371,rbf,TPESampler,COMPLETE
1209,0.2953779568413667,2025-04-25 03:44:56.330409,2025-04-25 03:44:56.880446,0 days 00:00:00.550037,3.404719852135351,0.024682330580962874,0.029021243027131195,rbf,TPESampler,COMPLETE
1210,0.2965070133562722,2025-04-25 03:44:57.054510,2025-04-25 03:44:57.549724,0 days 00:00:00.495214,2.2022565441851856,0.14633522849740127,0.15348940690010854,rbf,TPESampler,COMPLETE
1211,0.26724294461963854,2025-04-25 03:44:57.721469,2025-04-25 03:44:58.305139,0 days 00:00:00.583670,8.072158078866352,0.018272425984878996,0.08977255545231855,rbf,TPESampler,COMPLETE
1212,0.29977278386024386,2025-04-25 03:44:58.475646,2025-04-25 03:44:59.040261,0 days 00:00:00.564615,1.4461457422875434,0.011227845836016876,0.05150579810126373,rbf,TPESampler,COMPLETE
1213,0.8992391046654626,2025-04-25 03:44:59.214662,2025-04-25 03:44:59.826997,0 days 00:00:00.612335,0.08881839510210013,0.7380999857928251,0.72454794491563,rbf,TPESampler,COMPLETE
1214,0.5185611289088363,2025-04-25 03:45:00.009338,2025-04-25 03:45:00.588074,0 days 00:00:00.578736,23.653125488406737,0.6566790624501472,0.0013223308973206636,rbf,TPESampler,COMPLETE
1215,0.33598844475863154,2025-04-25 03:45:00.764373,2025-04-25 03:45:01.347973,0 days 00:00:00.583600,10.523444535288881,0.019854003504329976,0.3214541926901698,rbf,TPESampler,COMPLETE
1216,0.2664894119483294,2025-04-25 03:45:01.548829,2025-04-25 03:45:02.130016,0 days 00:00:00.581187,6.471455584972526,0.027490187923236386,0.06222062258714288,rbf,TPESampler,COMPLETE
1217,0.9664694895863533,2025-04-25 03:45:02.307296,2025-04-25 03:45:02.835697,0 days 00:00:00.528401,0.009966247606349815,0.007325208830234457,0.49814979745546384,sigmoid,TPESampler,COMPLETE
1218,0.802946040283849,2025-04-25 03:45:03.008680,2025-04-25 04:09:29.251966,0 days 00:24:26.243286,4.431302829565031,0.038332476356826795,0.11456554893159746,poly,TPESampler,COMPLETE
1219,0.2812207180148206,2025-04-25 03:56:14.657908,2025-04-25 03:56:15.645640,0 days 00:00:00.987732,36.6138906935324,0.0157021396664615,0.08537554350298451,rbf,TPESampler,COMPLETE
1220,0.4994269345030562,2025-04-25 03:56:15.827392,2025-04-25 03:56:16.338306,0 days 00:00:00.510914,0.07424549622519724,0.10325970401762821,0.043205730536021995,rbf,TPESampler,COMPLETE
1221,0.26326392193395554,2025-04-25 03:56:16.512144,2025-04-25 03:56:17.067068,0 days 00:00:00.554924,5.196507758240827,0.029187871292661184,0.07653780404709076,rbf,TPESampler,COMPLETE
1222,20.936302637492602,2025-04-25 03:56:17.250719,2025-04-25 03:56:17.791553,0 days 00:00:00.540834,0.9923816137585725,0.0021557556165896523,0.18165743193516046,sigmoid,TPESampler,COMPLETE
1223,0.3010294413208688,2025-04-25 03:56:17.960346,2025-04-25 03:56:18.498861,0 days 00:00:00.538515,1.2185939784620943,0.018521656187228373,0.16994555610612533,rbf,TPESampler,COMPLETE
1224,0.3510432282766587,2025-04-25 03:56:18.677565,2025-04-25 03:56:19.194725,0 days 00:00:00.517160,0.6065427891859152,0.03678573967460353,0.043701173926850995,rbf,TPESampler,COMPLETE
1225,0.26593432410538326,2025-04-25 03:56:19.363615,2025-04-25 03:56:20.030435,0 days 00:00:00.666820,6.861048321808875,0.028633988153008317,0.09729322908222801,rbf,TPESampler,COMPLETE
1226,0.270086390547932,2025-04-25 03:56:20.200482,2025-04-25 03:56:20.816491,0 days 00:00:00.616009,11.523338463325736,0.005595862438853512,0.052910349957522265,rbf,TPESampler,COMPLETE
1227,0.27425177923580873,2025-04-25 03:56:20.989966,2025-04-25 03:56:21.536795,0 days 00:00:00.546829,5.4660451096898095,0.019354703284665844,0.04134829599414626,rbf,TPESampler,COMPLETE
1228,0.2869346058823448,2025-04-25 03:56:21.706338,2025-04-25 03:56:22.237595,0 days 00:00:00.531257,2.3441546348331643,0.03392424707085033,0.050166659728171734,rbf,TPESampler,COMPLETE
1229,0.4099896605103841,2025-04-25 03:56:22.409966,2025-04-25 03:56:22.940211,0 days 00:00:00.530245,0.30619781683739805,0.009060729195857152,0.025511958437214734,rbf,TPESampler,COMPLETE
1230,0.30763624101931963,2025-04-25 03:56:23.116079,2025-04-25 03:56:23.688090,0 days 00:00:00.572011,3.007683918769927,0.002821538401008579,0.2710441735864605,rbf,TPESampler,COMPLETE
1231,0.35927504202458854,2025-04-25 03:56:23.856817,2025-04-25 03:56:24.395280,0 days 00:00:00.538463,0.46156659127467514,0.03229300949106721,0.20650697407867313,rbf,TPESampler,COMPLETE
1232,0.30047415135777866,2025-04-25 03:56:24.681672,2025-04-25 03:56:25.457808,0 days 00:00:00.776136,31.05624745857901,0.00986119783442883,0.01478902037811764,rbf,TPESampler,COMPLETE
1233,0.2821193498700457,2025-04-25 03:56:25.630587,2025-04-25 03:56:26.179829,0 days 00:00:00.549242,4.510201800925588,0.033858579018753276,0.16340932589944512,rbf,TPESampler,COMPLETE
1234,0.8413636919508379,2025-04-25 03:56:26.355858,2025-04-25 03:56:26.884734,0 days 00:00:00.528876,0.0019036060235255558,0.03676080222904416,0.04138707767187192,poly,TPESampler,COMPLETE
1235,0.30652138373684973,2025-04-25 03:56:27.058776,2025-04-25 03:56:27.599886,0 days 00:00:00.541110,2.0517457185429486,0.018951341696936776,0.03353050756179006,rbf,TPESampler,COMPLETE
1236,0.28044385517526876,2025-04-25 03:56:27.775461,2025-04-25 03:56:28.321564,0 days 00:00:00.546103,2.581611221066573,0.01733936056015939,0.06115033413980978,rbf,TPESampler,COMPLETE
1237,0.30695052854642174,2025-04-25 03:56:28.499481,2025-04-25 03:56:29.040992,0 days 00:00:00.541511,10.004249871346389,0.028422102346472317,0.012152048045109347,rbf,TPESampler,COMPLETE
1238,0.30653109435099807,2025-04-25 03:56:29.221742,2025-04-25 03:56:29.794469,0 days 00:00:00.572727,7.757836695774879,0.021235020970677605,0.22459259051132477,rbf,TPESampler,COMPLETE
1239,215.445244697993,2025-04-25 03:56:29.971955,2025-04-25 03:56:30.734539,0 days 00:00:00.762584,11.85628829777738,0.0042621920581851,0.029976655873001662,sigmoid,TPESampler,COMPLETE
1240,0.3313067389190208,2025-04-25 03:56:30.906313,2025-04-25 03:56:31.427364,0 days 00:00:00.521051,3.8766292050273377,0.05082212477306037,0.2974285539461082,rbf,TPESampler,COMPLETE
1241,0.2697848706237145,2025-04-25 03:56:31.599937,2025-04-25 03:56:32.182835,0 days 00:00:00.582898,7.136078585643149,0.012192870549827236,0.11576292920996639,rbf,TPESampler,COMPLETE
1242,0.2845894252030966,2025-04-25 03:56:32.360548,2025-04-25 03:56:32.899900,0 days 00:00:00.539352,2.3235230919450895,0.04009916071873455,0.056511211286995974,rbf,TPESampler,COMPLETE
1243,0.33120081076457,2025-04-25 03:56:33.073922,2025-04-25 03:56:33.557687,0 days 00:00:00.483765,3.597105872711499,0.12659510832113463,0.01405577558701408,rbf,TPESampler,COMPLETE
1244,0.2687266211140907,2025-04-25 03:56:33.734070,2025-04-25 03:56:34.287921,0 days 00:00:00.553851,3.0509310769277134,0.02031507180529959,0.08924738581056879,rbf,TPESampler,COMPLETE
1245,0.27539678345300395,2025-04-25 03:56:34.459006,2025-04-25 03:56:34.974488,0 days 00:00:00.515482,4.5190197751389665,0.07554980283993457,0.04951481995454288,rbf,TPESampler,COMPLETE
1246,0.2873718505682147,2025-04-25 03:56:35.140383,2025-04-25 03:56:35.638199,0 days 00:00:00.497816,1.8033947816111724,0.10181274031169749,0.0672733592363616,rbf,TPESampler,COMPLETE
1247,1.3506497943377755,2025-04-25 03:56:35.808831,2025-04-25 03:56:36.407495,0 days 00:00:00.598664,7.46710013167864,0.0024444784384977498,0.0013066888701246987,sigmoid,TPESampler,COMPLETE
1248,0.29790469006595993,2025-04-25 03:56:36.577065,2025-04-25 03:56:37.431653,0 days 00:00:00.854588,77.3143842039657,0.014688359549705102,0.037551830116043045,rbf,TPESampler,COMPLETE
1249,0.49657163140205324,2025-04-25 03:56:37.605925,2025-04-25 03:56:38.869380,0 days 00:00:01.263455,3.3078376443280164,0.03826564562452826,0.10745158618623131,linear,TPESampler,COMPLETE
1250,0.33566763031528274,2025-04-25 03:56:39.041747,2025-04-25 03:56:39.568295,0 days 00:00:00.526548,3.0163227166217643,0.02797706129699947,0.014416561638604646,rbf,TPESampler,COMPLETE
1251,0.3917407787078752,2025-04-25 03:56:39.747623,2025-04-25 03:56:40.294774,0 days 00:00:00.547151,56.52469838373378,0.005185631538997228,0.5079917276129805,rbf,TPESampler,COMPLETE
1252,0.3134546465000097,2025-04-25 03:56:40.465772,2025-04-25 03:56:41.012413,0 days 00:00:00.546641,17.422869037914662,0.03834973457823306,0.20754128190853383,rbf,TPESampler,COMPLETE
1253,0.6195803821287125,2025-04-25 03:56:41.207217,2025-04-25 03:56:43.979618,0 days 00:00:02.772401,2.1905163486112103,0.015901568344915563,0.03093116373768665,poly,TPESampler,COMPLETE
1254,0.26827565699351075,2025-04-25 03:56:44.169206,2025-04-25 03:56:44.760382,0 days 00:00:00.591176,9.713419274478827,0.020493234492935067,0.05327241782297679,rbf,TPESampler,COMPLETE
1255,0.8171334005258263,2025-04-25 03:56:44.940894,2025-04-25 03:56:45.448622,0 days 00:00:00.507728,0.010666112077221318,0.3398800259740179,0.01575165176245445,sigmoid,TPESampler,COMPLETE
1256,0.9431676312171511,2025-04-25 03:56:45.621826,2025-04-25 03:56:46.116063,0 days 00:00:00.494237,0.0011331610084504183,0.3395181120775776,0.06502954141098494,sigmoid,TPESampler,COMPLETE
1257,0.2705174588802239,2025-04-25 03:56:46.288816,2025-04-25 03:56:46.867442,0 days 00:00:00.578626,7.245041140886333,0.013367096957432566,0.04511164607926221,rbf,TPESampler,COMPLETE
1258,0.9694732291244272,2025-04-25 03:56:47.037056,2025-04-25 03:56:47.500596,0 days 00:00:00.463540,0.035988183665598895,0.9617686694020094,0.00042494745027255823,sigmoid,TPESampler,COMPLETE
1259,0.2787783561345208,2025-04-25 03:56:47.675355,2025-04-25 03:56:48.232568,0 days 00:00:00.557213,8.454942984931318,0.05097195870705755,0.135138603768649,rbf,TPESampler,COMPLETE
1260,0.38878044513696736,2025-04-25 03:56:48.406333,2025-04-25 03:56:48.968496,0 days 00:00:00.562163,0.8163925569018531,0.024292055289146786,0.38907452711154095,rbf,TPESampler,COMPLETE
1261,0.29327497662399943,2025-04-25 03:56:49.160069,2025-04-25 03:56:49.678246,0 days 00:00:00.518177,1.7553626930824235,0.058271528927203456,0.05371564402089516,rbf,TPESampler,COMPLETE
1262,0.2756312255886047,2025-04-25 03:56:49.861643,2025-04-25 03:56:50.486171,0 days 00:00:00.624528,16.586621150104836,0.021533276243620558,0.11094509500690934,rbf,TPESampler,COMPLETE
1263,0.31631484302662616,2025-04-25 03:56:50.661245,2025-04-25 03:56:51.219703,0 days 00:00:00.558458,2.8828702445923713,0.0048082918299304465,0.02187871593160738,rbf,TPESampler,COMPLETE
1264,0.34524631910671066,2025-04-25 03:56:51.394982,2025-04-25 03:56:51.915914,0 days 00:00:00.520932,6.933579164544632,0.10101130591126178,0.2802793691305288,rbf,TPESampler,COMPLETE
1265,0.2854424251737878,2025-04-25 03:56:52.089738,2025-04-25 03:56:52.770939,0 days 00:00:00.681201,13.59840492672517,0.029372232256860767,0.023244840437607796,rbf,TPESampler,COMPLETE
1266,0.5022764091375146,2025-04-25 03:56:52.950028,2025-04-25 03:56:55.775991,0 days 00:00:02.825963,8.073145741597495,0.008064578060800609,0.6252706623055057,linear,TPESampler,COMPLETE
1267,0.2673629877191574,2025-04-25 03:56:55.951662,2025-04-25 03:56:56.510629,0 days 00:00:00.558967,4.1592183935347595,0.036682538730366025,0.061200841438092006,rbf,TPESampler,COMPLETE
1268,0.5268575170988062,2025-04-25 03:56:56.687549,2025-04-25 03:56:57.221611,0 days 00:00:00.534062,13.411677278689185,0.0019451175057291247,0.00014925875143603542,rbf,TPESampler,COMPLETE
1269,0.2783064240002822,2025-04-25 03:56:57.399959,2025-04-25 03:56:57.975363,0 days 00:00:00.575404,3.5737946034957955,0.009435121652349507,0.16083240527260886,rbf,TPESampler,COMPLETE
1270,0.2767065285748713,2025-04-25 03:56:58.150808,2025-04-25 03:56:58.669314,0 days 00:00:00.518506,5.4195638120111465,0.07050095471372232,0.04234744801995325,rbf,TPESampler,COMPLETE
1271,0.433424378013055,2025-04-25 03:56:58.843319,2025-04-25 03:56:59.368011,0 days 00:00:00.524692,0.23667648497928565,0.08704001538147338,0.20423991958128146,rbf,TPESampler,COMPLETE
1272,0.27180707610561744,2025-04-25 03:56:59.548737,2025-04-25 03:57:00.094861,0 days 00:00:00.546124,4.210610573166034,0.04270766566914887,0.1283555171144845,rbf,TPESampler,COMPLETE
1273,0.4584569413986965,2025-04-25 03:57:00.269572,2025-04-25 03:57:00.970137,0 days 00:00:00.700565,1.050319288090295,0.05926908535421156,0.003497696365908771,rbf,TPESampler,COMPLETE
1274,0.33063814677260567,2025-04-25 03:57:01.191968,2025-04-25 03:57:01.730283,0 days 00:00:00.538315,0.6688755394834316,0.026065349635901704,0.05899769842687751,rbf,TPESampler,COMPLETE
1275,0.28687622216480374,2025-04-25 03:57:01.905420,2025-04-25 03:57:02.525480,0 days 00:00:00.620060,18.848277864232905,0.026325573184890382,0.025433039059973267,rbf,TPESampler,COMPLETE
1276,0.27979157307601227,2025-04-25 03:57:02.736410,2025-04-25 03:57:03.405975,0 days 00:00:00.669565,37.16704875770469,0.028930864385422885,0.07242271705053618,rbf,TPESampler,COMPLETE
1277,0.3360909664848277,2025-04-25 03:57:03.583257,2025-04-25 03:57:04.122484,0 days 00:00:00.539227,5.595877772910985,0.024831940441075093,0.32838235674176014,rbf,TPESampler,COMPLETE
1278,0.2897634683441295,2025-04-25 03:57:04.290896,2025-04-25 03:57:04.857413,0 days 00:00:00.566517,4.505347018850392,0.011095166754017888,0.028125653331421765,rbf,TPESampler,COMPLETE
1279,0.30859602421934634,2025-04-25 03:57:05.030324,2025-04-25 03:57:05.617026,0 days 00:00:00.586702,25.073225973131912,0.01843480753646565,0.19358400863754482,rbf,TPESampler,COMPLETE
1280,0.42022083142978445,2025-04-25 03:57:05.797454,2025-04-25 03:57:06.382800,0 days 00:00:00.585346,0.21523664575831625,0.0019240807773162924,0.0005000470892856945,linear,TPESampler,COMPLETE
1281,0.2917547458264695,2025-04-25 03:57:06.561316,2025-04-25 03:57:07.053537,0 days 00:00:00.492221,7.168706604237436,0.17739489697562838,0.04434085088765456,rbf,TPESampler,COMPLETE
1282,0.8516548318233679,2025-04-25 03:57:07.227971,2025-04-25 03:57:07.756075,0 days 00:00:00.528104,0.006012704438636127,0.017783684965459314,0.011013566169289727,sigmoid,TPESampler,COMPLETE
1283,17.515535982864577,2025-04-25 03:57:07.933721,2025-04-25 03:57:08.478381,0 days 00:00:00.544660,0.7781651611584943,0.08519912781493158,0.2212697357933173,sigmoid,TPESampler,COMPLETE
1284,0.2747501870833274,2025-04-25 03:57:08.653954,2025-04-25 03:57:09.155560,0 days 00:00:00.501606,3.330287110978749,0.10469929964881351,0.08988528133293311,rbf,TPESampler,COMPLETE
1285,0.2682808365453009,2025-04-25 03:57:09.333096,2025-04-25 03:57:09.885703,0 days 00:00:00.552607,2.9060111307831296,0.025551237858610323,0.09293154623398552,rbf,TPESampler,COMPLETE
1286,23.65407664840608,2025-04-25 03:57:10.064471,2025-04-25 03:57:10.621382,0 days 00:00:00.556911,1.2998894684230602,0.08689211225444901,0.029201984886661602,sigmoid,TPESampler,COMPLETE
1287,0.4433590229710331,2025-04-25 03:57:10.808710,2025-04-25 03:57:11.800195,0 days 00:00:00.991485,0.64206122295962,0.0222522593886806,0.1049901707484105,linear,TPESampler,COMPLETE
1288,8.459974826762933,2025-04-25 03:57:11.973101,2025-04-25 03:57:12.647615,0 days 00:00:00.674514,0.3314594223178754,0.01861382587350697,0.36709441067922954,sigmoid,TPESampler,COMPLETE
1289,0.34496924419819225,2025-04-25 03:57:12.830680,2025-04-25 03:57:13.480704,0 days 00:00:00.650024,1.307188611898804,0.06529904719977615,0.023959393364084532,rbf,TPESampler,COMPLETE
1290,0.3248134090641839,2025-04-25 03:57:13.654650,2025-04-25 03:57:14.192995,0 days 00:00:00.538345,10.942090252155996,0.07009829938587271,0.22842435682905446,rbf,TPESampler,COMPLETE
1291,0.47667444817414045,2025-04-25 03:57:14.368053,2025-04-25 03:57:16.198316,0 days 00:00:01.830263,6.951836777990995,0.16960990896565598,0.008666244834081993,linear,TPESampler,COMPLETE
1292,0.48662554195283275,2025-04-25 03:57:16.377184,2025-04-25 03:57:34.393492,0 days 00:00:18.016308,63.005528315728206,0.10185535209249469,0.003855930478457758,linear,TPESampler,COMPLETE
1293,0.3481032365531661,2025-04-25 03:57:34.566843,2025-04-25 03:57:35.122308,0 days 00:00:00.555465,1.7539620919362109,0.03679838290626714,0.017359653726755492,rbf,TPESampler,COMPLETE
1294,0.264858272876092,2025-04-25 03:57:35.300392,2025-04-25 03:57:35.855421,0 days 00:00:00.555029,6.5880120801290944,0.03966539677436619,0.0679915818720688,rbf,TPESampler,COMPLETE
1295,0.649226381567067,2025-04-25 03:57:36.027693,2025-04-25 03:57:36.479964,0 days 00:00:00.452271,0.013706754482242086,0.7581584962384024,0.0014303822807065463,linear,TPESampler,COMPLETE
1296,0.26987478686205885,2025-04-25 03:57:36.657237,2025-04-25 03:57:37.214833,0 days 00:00:00.557596,2.767399751076061,0.018182702612770142,0.10797218001913918,rbf,TPESampler,COMPLETE
1297,0.3419403350601799,2025-04-25 03:57:37.388091,2025-04-25 03:57:37.926463,0 days 00:00:00.538372,1.6942571385126382,0.05602066217161501,0.33953553719180396,rbf,TPESampler,COMPLETE
1298,0.311659004074381,2025-04-25 03:57:38.109364,2025-04-25 03:57:38.663664,0 days 00:00:00.554300,1.4675163272442007,0.01863814541330677,0.04003517249378544,rbf,TPESampler,COMPLETE
