number,value,datetime_start,datetime_complete,duration,params_C,params_epsilon,params_gamma,params_kernel,system_attrs_auto:sampler,state
2007,0.3078560399636945,2025-04-25 06:54:25.215295,2025-04-25 06:54:25.734260,0 days 00:00:00.518965,7.387218970696951,0.17590719109136305,0.018476092466260207,rbf,TPESampler,COMPLETE
2008,0.3060799556421446,2025-04-25 06:54:25.914153,2025-04-25 06:54:26.457412,0 days 00:00:00.543259,19.271149243509868,0.08814428236198887,0.1570037667205754,rbf,TPESampler,COMPLETE
2009,140.17368634795955,2025-04-25 06:54:26.653894,2025-04-25 06:54:27.207866,0 days 00:00:00.553972,14.008062542435344,0.1858374156864941,0.013644645136511773,sigmoid,TPESampler,COMPLETE
2010,0.29561943200179286,2025-04-25 06:54:27.390432,2025-04-25 06:54:27.955768,0 days 00:00:00.565336,1.537228794146603,0.02226522653579712,0.05362549480381993,rbf,TPESampler,COMPLETE
2011,0.3755720743914343,2025-04-25 06:54:28.148949,2025-04-25 06:54:28.690143,0 days 00:00:00.541194,0.917097703264653,0.05778791455995697,0.017956742843282945,rbf,TPESampler,COMPLETE
2012,0.26602109947373614,2025-04-25 06:54:28.877611,2025-04-25 06:54:29.492162,0 days 00:00:00.614551,8.314126170319877,0.023321885519543083,0.07454591092222683,rbf,TPESampler,COMPLETE
2013,0.2744558730600519,2025-04-25 06:54:29.677598,2025-04-25 06:54:30.274215,0 days 00:00:00.596617,8.747571001089684,0.03105483154983886,0.03567203251798256,rbf,TPESampler,COMPLETE
2014,0.2683145395668546,2025-04-25 06:54:30.450912,2025-04-25 06:54:30.995748,0 days 00:00:00.544836,8.719882321670767,0.08588531572366083,0.06622324151956044,rbf,TPESampler,COMPLETE
2015,0.35760304602376486,2025-04-25 06:54:31.182252,2025-04-25 06:54:31.699947,0 days 00:00:00.517695,0.3777324031111698,0.09601746182494465,0.08815405114999399,rbf,TPESampler,COMPLETE
2016,0.28417822299960294,2025-04-25 06:54:31.886086,2025-04-25 06:54:32.540763,0 days 00:00:00.654677,13.70604352559853,0.007530729868640149,0.02815945241297348,rbf,TPESampler,COMPLETE
2017,0.8586077873484831,2025-04-25 06:54:32.729737,2025-04-25 07:02:47.452678,0 days 00:08:14.722941,0.031592693734989914,0.04367384004860221,0.7755025478866013,poly,TPESampler,COMPLETE
2018,0.2912212864097347,2025-04-25 06:58:43.192469,2025-04-25 06:58:43.750054,0 days 00:00:00.557585,3.0270994152268442,0.06821330734774811,0.17516180846163465,rbf,TPESampler,COMPLETE
2019,0.2946796622791006,2025-04-25 06:58:43.955104,2025-04-25 06:58:44.503290,0 days 00:00:00.548186,93.87381101987404,0.15136767812105714,0.04646484968324571,rbf,TPESampler,COMPLETE
2020,0.2766748776816409,2025-04-25 06:58:44.690426,2025-04-25 06:58:45.269974,0 days 00:00:00.579548,3.2070203886450366,0.02734500082120691,0.056149322197888325,rbf,TPESampler,COMPLETE
2021,0.30061783113932644,2025-04-25 06:58:45.475573,2025-04-25 06:58:46.111493,0 days 00:00:00.635920,30.18549307012014,0.03256312630935332,0.016192587962062528,rbf,TPESampler,COMPLETE
2022,0.3104696504425637,2025-04-25 06:58:46.294361,2025-04-25 06:58:46.821399,0 days 00:00:00.527038,1.935814314904074,0.09418650115871333,0.03314986506710434,rbf,TPESampler,COMPLETE
2023,0.2859364724620582,2025-04-25 06:58:47.010221,2025-04-25 06:58:47.643430,0 days 00:00:00.633209,17.290641015967022,0.02307743073121898,0.13769448178247828,rbf,TPESampler,COMPLETE
2024,0.27725655312170905,2025-04-25 06:58:47.833209,2025-04-25 06:58:48.432834,0 days 00:00:00.599625,2.530279585125462,0.015503746292856146,0.07195333262209679,rbf,TPESampler,COMPLETE
2025,0.3021937307283395,2025-04-25 06:58:48.614618,2025-04-25 06:58:49.159909,0 days 00:00:00.545291,0.9816453236262227,0.06144736579177878,0.12861568747738739,rbf,TPESampler,COMPLETE
2026,0.27985377830631863,2025-04-25 06:58:49.346180,2025-04-25 06:58:50.081791,0 days 00:00:00.735611,41.306192710529054,0.020561359207839018,0.05500131945661309,rbf,TPESampler,COMPLETE
2027,69.41395389987606,2025-04-25 06:58:50.266697,2025-04-25 06:58:50.844060,0 days 00:00:00.577363,2.688677044530239,0.007059151017095082,0.4502882472629417,sigmoid,TPESampler,COMPLETE
2028,0.35733049055789184,2025-04-25 06:58:51.057733,2025-04-25 06:58:51.618184,0 days 00:00:00.560451,5.7905427611405615,0.02917651072130548,0.3875445255477767,rbf,TPESampler,COMPLETE
2029,0.26441582779688144,2025-04-25 06:58:51.802302,2025-04-25 06:58:52.359831,0 days 00:00:00.557529,9.09382990071544,0.07284366489732591,0.0734935821471444,rbf,TPESampler,COMPLETE
2030,0.34431609267990254,2025-04-25 06:58:52.544209,2025-04-25 06:58:53.034757,0 days 00:00:00.490548,4.772991619786918,0.31405589769055603,0.10738501092227859,rbf,TPESampler,COMPLETE
2031,0.27586672740584933,2025-04-25 06:58:53.217007,2025-04-25 06:58:53.771110,0 days 00:00:00.554103,21.894689420339606,0.09246217836027144,0.03827208345747144,rbf,TPESampler,COMPLETE
2032,0.2851442072985459,2025-04-25 06:58:53.952658,2025-04-25 06:58:54.460841,0 days 00:00:00.508183,3.279880741070839,0.15482764129879234,0.11593980995872732,rbf,TPESampler,COMPLETE
2033,0.2756461068300544,2025-04-25 06:58:54.640912,2025-04-25 06:58:55.171553,0 days 00:00:00.530641,3.1968139229331722,0.06584581155692526,0.056548078835217966,rbf,TPESampler,COMPLETE
2034,0.31441709062594364,2025-04-25 06:58:55.363119,2025-04-25 06:58:56.069351,0 days 00:00:00.706232,28.32306907389945,0.25460605371381084,0.054750925935250674,rbf,TPESampler,COMPLETE
2035,0.3345136824632447,2025-04-25 06:58:56.264991,2025-04-25 06:58:56.798781,0 days 00:00:00.533790,41.31795950971365,0.16064354941380848,0.19691306100871148,rbf,TPESampler,COMPLETE
2036,0.2912832603569508,2025-04-25 06:58:57.130496,2025-04-25 06:58:57.655442,0 days 00:00:00.524946,6.963215208700355,0.18035673447841438,0.09809304183086237,rbf,TPESampler,COMPLETE
2037,0.30127403445231676,2025-04-25 06:58:57.844846,2025-04-25 06:58:58.386952,0 days 00:00:00.542106,17.43647133808518,0.09630655758164958,0.1521204123375454,rbf,TPESampler,COMPLETE
2038,0.3055972080677924,2025-04-25 06:58:58.566459,2025-04-25 06:58:59.106235,0 days 00:00:00.539776,4.4257557521512645,0.11150438307857916,0.18098749680578163,rbf,TPESampler,COMPLETE
2039,0.28090810345873934,2025-04-25 06:58:59.289944,2025-04-25 06:58:59.839920,0 days 00:00:00.549976,9.762275421479869,0.07658482845369707,0.03675307566288602,rbf,TPESampler,COMPLETE
2040,0.46910606182022097,2025-04-25 06:59:00.025078,2025-04-25 06:59:00.829389,0 days 00:00:00.804311,1.0747481703196782,0.07525935726049011,0.16590132035616004,linear,TPESampler,COMPLETE
2041,0.2691524946868965,2025-04-25 06:59:01.016685,2025-04-25 06:59:01.542681,0 days 00:00:00.525996,6.7926877290559515,0.09895428821840438,0.09544528985174323,rbf,TPESampler,COMPLETE
2042,0.3182013711684588,2025-04-25 06:59:01.725812,2025-04-25 06:59:02.229979,0 days 00:00:00.504167,8.252987342982385,0.25171524316841704,0.021675976988972515,rbf,TPESampler,COMPLETE
2043,0.2919269955991507,2025-04-25 06:59:02.416014,2025-04-25 06:59:03.203496,0 days 00:00:00.787482,4.707378985548134,0.10243635671258762,0.0331944600032606,rbf,TPESampler,COMPLETE
2044,0.2736123968677449,2025-04-25 06:59:03.389190,2025-04-25 06:59:03.932331,0 days 00:00:00.543141,24.837526682437815,0.10426631581760833,0.058724712493277695,rbf,TPESampler,COMPLETE
2045,0.2756338755189816,2025-04-25 06:59:04.119380,2025-04-25 06:59:04.684876,0 days 00:00:00.565496,10.711422270793216,0.06101319599582029,0.11788389110341335,rbf,TPESampler,COMPLETE
2046,0.2912919657191493,2025-04-25 06:59:04.867599,2025-04-25 06:59:05.394777,0 days 00:00:00.527178,1.363363203194295,0.12355388783748308,0.09032228150610705,rbf,TPESampler,COMPLETE
2047,0.4243922612539692,2025-04-25 06:59:05.579640,2025-04-25 06:59:06.110667,0 days 00:00:00.531027,7.818437723253112,0.2317848009332939,0.39653331824509414,rbf,TPESampler,COMPLETE
2048,0.34308796911646233,2025-04-25 06:59:06.431337,2025-04-25 06:59:06.950175,0 days 00:00:00.518838,1.877036326355264,0.12388959848131018,0.018408538403796314,rbf,TPESampler,COMPLETE
2049,0.29064087996315546,2025-04-25 06:59:07.135024,2025-04-25 06:59:07.704006,0 days 00:00:00.568982,46.0483911550798,0.07320519401101969,0.09708006924021903,rbf,TPESampler,COMPLETE
2050,0.3442644057644521,2025-04-25 06:59:07.897496,2025-04-25 06:59:08.440125,0 days 00:00:00.542629,4.400996685458377,0.08385865044804507,0.008802295539093211,rbf,TPESampler,COMPLETE
2051,0.2797906376735334,2025-04-25 06:59:08.626535,2025-04-25 06:59:09.194379,0 days 00:00:00.567844,3.4780522887359258,0.04705561961760439,0.1512580021191292,rbf,TPESampler,COMPLETE
2052,0.9557476512678594,2025-04-25 06:59:09.494855,2025-04-25 06:59:10.061889,0 days 00:00:00.567034,0.004367381932284442,0.30043452443786456,0.5333181409499734,rbf,TPESampler,COMPLETE
2053,0.2670005705789606,2025-04-25 06:59:10.254661,2025-04-25 06:59:10.867041,0 days 00:00:00.612380,6.595094544046439,0.06625168160718967,0.07780246744999916,rbf,TPESampler,COMPLETE
2054,0.26878768446535617,2025-04-25 06:59:11.061193,2025-04-25 06:59:11.663393,0 days 00:00:00.602200,17.502858947189793,0.047134690499747806,0.07420973979564865,rbf,TPESampler,COMPLETE
2055,0.4518281620702358,2025-04-25 06:59:11.856997,2025-04-25 06:59:12.448963,0 days 00:00:00.591966,42.57985044669391,0.053033965821698725,0.6341301447471551,rbf,TPESampler,COMPLETE
2056,0.37045284172000464,2025-04-25 06:59:12.633488,2025-04-25 06:59:13.181421,0 days 00:00:00.547933,11.39312144849577,0.12213873429070761,0.33745795941504336,rbf,TPESampler,COMPLETE
2057,0.3273903358824255,2025-04-25 06:59:13.370423,2025-04-25 06:59:13.931987,0 days 00:00:00.561564,0.7062933297167715,0.04442045111197632,0.05966578840495694,rbf,TPESampler,COMPLETE
2058,0.2907941538414984,2025-04-25 06:59:14.120601,2025-04-25 06:59:14.688964,0 days 00:00:00.568363,10.757634807890001,0.06625629524206571,0.017536716287970624,rbf,TPESampler,COMPLETE
2059,0.5615782426285332,2025-04-25 06:59:14.890418,2025-04-25 06:59:15.509318,0 days 00:00:00.618900,3.309377068029605,0.06219550065322208,0.9101278068678443,rbf,TPESampler,COMPLETE
2060,0.3042351336066669,2025-04-25 06:59:15.692745,2025-04-25 06:59:16.254616,0 days 00:00:00.561871,10.87319506235322,0.06320095837019025,0.18829966078937227,rbf,TPESampler,COMPLETE
2061,0.27436584287434596,2025-04-25 06:59:16.443663,2025-04-25 06:59:17.007202,0 days 00:00:00.563539,6.876329026742302,0.05027956845669288,0.03860560068794319,rbf,TPESampler,COMPLETE
2062,0.2740450025344547,2025-04-25 06:59:17.191783,2025-04-25 06:59:17.746954,0 days 00:00:00.555171,3.2782850752267927,0.055245196567048384,0.05727204858101135,rbf,TPESampler,COMPLETE
2063,66.4043088043346,2025-04-25 06:59:17.939422,2025-04-25 06:59:18.500143,0 days 00:00:00.560721,2.945532775276029,0.0563861097140152,0.08250536957655454,sigmoid,TPESampler,COMPLETE
2064,0.28723215268026375,2025-04-25 06:59:18.683247,2025-04-25 06:59:19.183438,0 days 00:00:00.500191,11.992300464449313,0.19436655729030503,0.04932130677302047,rbf,TPESampler,COMPLETE
2065,0.7292278484364344,2025-04-25 06:59:19.370668,2025-04-25 07:19:17.274542,0 days 00:19:57.903874,9.002880638209588,0.041044346506560185,0.07109680439563924,poly,TPESampler,COMPLETE
2066,0.36698290188688737,2025-04-25 07:02:47.922950,2025-04-25 07:02:48.966423,0 days 00:00:01.043473,1.0996229970130804,0.031338625905424605,0.01792942767062349,rbf,TPESampler,COMPLETE
2067,0.2702859592465118,2025-04-25 07:02:49.357023,2025-04-25 07:02:50.343403,0 days 00:00:00.986380,22.31740762337377,0.05627965686403983,0.06944987692663142,rbf,TPESampler,COMPLETE
2068,0.31600017217178317,2025-04-25 07:02:50.713202,2025-04-25 07:02:52.227716,0 days 00:00:01.514514,1.3279479708759125,0.06574681814758399,0.2260764533755562,rbf,TPESampler,COMPLETE
2069,0.5012847438896171,2025-04-25 07:02:52.415238,2025-04-25 07:02:54.777212,0 days 00:00:02.361974,7.174918629349415,0.03550409440853116,0.2504144557151873,linear,TPESampler,COMPLETE
2070,0.30854305977464014,2025-04-25 07:02:54.980251,2025-04-25 07:02:55.653621,0 days 00:00:00.673370,1.2770909504029166,0.023409256014954426,0.21142808949465008,rbf,TPESampler,COMPLETE
2071,0.26542569018436174,2025-04-25 07:02:56.020744,2025-04-25 07:02:56.629861,0 days 00:00:00.609117,3.3874288683848426,0.033344743261320545,0.09414120271617465,rbf,TPESampler,COMPLETE
2072,0.6841860646903527,2025-04-25 07:02:56.813134,2025-04-25 07:02:57.467913,0 days 00:00:00.654779,0.9596879421281962,0.05784919860506559,0.017626607316639464,poly,TPESampler,COMPLETE
2073,0.2733860101199164,2025-04-25 07:02:57.658251,2025-04-25 07:02:58.202638,0 days 00:00:00.544387,4.172058391644498,0.07256036908519102,0.054518413752746415,rbf,TPESampler,COMPLETE
2074,0.34358069140902003,2025-04-25 07:02:58.387816,2025-04-25 07:02:58.960165,0 days 00:00:00.572349,15.021411786538621,0.05534405554143126,0.31570775029001313,rbf,TPESampler,COMPLETE
2075,0.3154408369227317,2025-04-25 07:02:59.151659,2025-04-25 07:02:59.710351,0 days 00:00:00.558692,4.919518926854364,0.033008418070564455,0.015423985925313407,rbf,TPESampler,COMPLETE
2076,0.3456880529973913,2025-04-25 07:02:59.898794,2025-04-25 07:03:00.398970,0 days 00:00:00.500176,0.81869775366163,0.25314641837600865,0.07336131124450983,rbf,TPESampler,COMPLETE
2077,0.27334161740380947,2025-04-25 07:03:00.583287,2025-04-25 07:03:01.186612,0 days 00:00:00.603325,23.292509968797024,0.048600431148004004,0.04746437521997643,rbf,TPESampler,COMPLETE
2078,0.26766866121729543,2025-04-25 07:03:01.366031,2025-04-25 07:03:01.990476,0 days 00:00:00.624445,5.119331904518461,0.035957757619475235,0.1103472285373715,rbf,TPESampler,COMPLETE
2079,0.2714620552510436,2025-04-25 07:03:02.402329,2025-04-25 07:03:02.940370,0 days 00:00:00.538041,9.221218016938836,0.12498820435992967,0.07908239417187136,rbf,TPESampler,COMPLETE
2080,0.2983536074087788,2025-04-25 07:03:03.129591,2025-04-25 07:03:03.665991,0 days 00:00:00.536400,2.2299486845956427,0.07178949012517989,0.038888862585646326,rbf,TPESampler,COMPLETE
2081,0.5034912388574698,2025-04-25 07:03:03.852412,2025-04-25 07:03:33.314472,0 days 00:00:29.462060,73.02070188132996,0.024458193413831885,0.22603249966120434,linear,TPESampler,COMPLETE
2082,0.47463385957067006,2025-04-25 07:03:33.508107,2025-04-25 07:03:35.224010,0 days 00:00:01.715903,4.001257376123496,0.22002950880153416,0.001159205870381116,linear,TPESampler,COMPLETE
2083,0.4377095581935149,2025-04-25 07:03:35.414374,2025-04-25 07:03:35.992155,0 days 00:00:00.577781,0.5469215962519127,0.24239277189600816,0.02209820531346833,linear,TPESampler,COMPLETE
2084,0.298911178877429,2025-04-25 07:03:36.179382,2025-04-25 07:03:36.723092,0 days 00:00:00.543710,2.824074179996845,0.0686911122125856,0.19940063764945662,rbf,TPESampler,COMPLETE
2085,0.29257886773562963,2025-04-25 07:03:36.908326,2025-04-25 07:03:37.484109,0 days 00:00:00.575783,17.75573885668534,0.06307332976533285,0.01608160496035579,rbf,TPESampler,COMPLETE
2086,0.3313369251763662,2025-04-25 07:03:37.673948,2025-04-25 07:03:38.236090,0 days 00:00:00.562142,1.509528902002661,0.02151383157750905,0.3251436651533157,rbf,TPESampler,COMPLETE
2087,0.9752084514397814,2025-04-25 07:03:38.429504,2025-04-25 07:03:38.928561,0 days 00:00:00.499057,0.5735972606762278,0.6175544376919826,0.0010050773240458729,poly,TPESampler,COMPLETE
2088,0.2866977752218694,2025-04-25 07:03:39.110361,2025-04-25 07:03:39.682934,0 days 00:00:00.572573,2.0651440725852246,0.029498516864077413,0.058965341756005,rbf,TPESampler,COMPLETE
2089,0.28272661844886215,2025-04-25 07:03:39.872438,2025-04-25 07:03:40.503675,0 days 00:00:00.631237,5.2004995328839545,0.02278142012484373,0.16838007970284452,rbf,TPESampler,COMPLETE
2090,0.5055239970439196,2025-04-25 07:03:40.693489,2025-04-25 07:03:41.219579,0 days 00:00:00.526090,1.3941243240333279,0.18799197167536927,0.001686924561456384,rbf,TPESampler,COMPLETE
2091,0.7153276998495062,2025-04-25 07:03:41.404003,2025-04-25 07:03:41.887485,0 days 00:00:00.483482,0.10025923629414422,0.9267890326038963,0.0005126504431578926,linear,TPESampler,COMPLETE
2092,0.29459242997868995,2025-04-25 07:03:42.070612,2025-04-25 07:03:42.646982,0 days 00:00:00.576370,76.93312853947766,0.07343782286880898,0.10362052289215593,rbf,TPESampler,COMPLETE
2093,0.3051084816311006,2025-04-25 07:03:42.828085,2025-04-25 07:03:43.405328,0 days 00:00:00.577243,5.410949559615236,0.05596012082688287,0.01904045277570726,rbf,TPESampler,COMPLETE
2094,0.28833526559299155,2025-04-25 07:03:43.594050,2025-04-25 07:03:44.167687,0 days 00:00:00.573637,13.474298819179618,0.041710429545696565,0.15115434612400377,rbf,TPESampler,COMPLETE
2095,0.35597684947936903,2025-04-25 07:03:44.354812,2025-04-25 07:03:44.914742,0 days 00:00:00.559930,0.3421402447428909,0.009652983546226882,0.09866855715105714,rbf,TPESampler,COMPLETE
2096,0.3565246499074132,2025-04-25 07:03:45.120651,2025-04-25 07:03:45.670880,0 days 00:00:00.550229,0.5966050241031916,0.04132002959506409,0.03957114598031315,rbf,TPESampler,COMPLETE
2097,12.791059511051667,2025-04-25 07:03:45.856567,2025-04-25 07:58:23.013091,0 days 00:54:37.156524,10.345638219415985,0.11738016926427206,0.6983099796807225,poly,TPESampler,COMPLETE
2098,0.28224254811972016,2025-04-25 07:19:17.474460,2025-04-25 07:19:18.041190,0 days 00:00:00.566730,7.305137555734223,0.13764108572709483,0.051218508977542904,rbf,TPESampler,COMPLETE
2099,0.2862679324237696,2025-04-25 07:19:18.224930,2025-04-25 07:19:18.795625,0 days 00:00:00.570695,5.326387052778255,0.028996714979911298,0.0274302447210122,rbf,TPESampler,COMPLETE
2100,0.2729545415551083,2025-04-25 07:19:18.987954,2025-04-25 07:19:19.570295,0 days 00:00:00.582341,12.617785093244759,0.03636534400647949,0.1089389371041453,rbf,TPESampler,COMPLETE
2101,0.2845779567346563,2025-04-25 07:19:19.756373,2025-04-25 07:19:20.299922,0 days 00:00:00.543549,2.316630513084226,0.08171196342744025,0.14927128800221617,rbf,TPESampler,COMPLETE
2102,0.39164388747091106,2025-04-25 07:19:20.482831,2025-04-25 07:19:20.979723,0 days 00:00:00.496892,75.24079950674059,0.3126336351240433,0.21394320348024973,rbf,TPESampler,COMPLETE
2103,0.29549208459436954,2025-04-25 07:19:21.168402,2025-04-25 07:19:21.757121,0 days 00:00:00.588719,90.28763657675267,0.09047255500365813,0.020763233298766132,rbf,TPESampler,COMPLETE
2104,0.33065244426412177,2025-04-25 07:19:21.992572,2025-04-25 07:19:22.541530,0 days 00:00:00.548958,18.25402916661002,0.09942754626171599,0.22524047881713818,rbf,TPESampler,COMPLETE
2105,0.27430022797903036,2025-04-25 07:19:22.723703,2025-04-25 07:19:23.295828,0 days 00:00:00.572125,5.230423746951659,0.02497432165156647,0.04263349755985443,rbf,TPESampler,COMPLETE
2106,0.30673459381747864,2025-04-25 07:19:23.481621,2025-04-25 07:19:24.053416,0 days 00:00:00.571795,3.7603089789389283,0.04585126748414176,0.23059509452714116,rbf,TPESampler,COMPLETE
2107,0.388845457956279,2025-04-25 07:19:24.240168,2025-04-25 07:19:24.802991,0 days 00:00:00.562823,0.22690185441977173,0.022544541324591126,0.09838165133354713,rbf,TPESampler,COMPLETE
2108,0.7650416507368865,2025-04-25 07:19:25.000102,2025-04-25 07:19:25.562074,0 days 00:00:00.561972,1.0495134785426536,0.003872374150782749,0.008660019497365301,poly,TPESampler,COMPLETE
2109,0.8157170828336351,2025-04-25 07:19:25.747124,2025-04-25 07:19:26.294983,0 days 00:00:00.547859,0.006397680245908863,0.0021450225664487923,0.033682996318095605,poly,TPESampler,COMPLETE
2110,0.5358866480105918,2025-04-25 07:19:26.480620,2025-04-25 07:19:27.040930,0 days 00:00:00.560310,2.092219059655251,0.577388115372493,0.18059273115460284,linear,TPESampler,COMPLETE
2111,0.4757226704832444,2025-04-25 07:19:27.229872,2025-04-25 07:19:27.749325,0 days 00:00:00.519453,0.9549776047543852,0.20691356810375627,0.5230981127363215,rbf,TPESampler,COMPLETE
2112,0.3021073819650952,2025-04-25 07:19:27.932889,2025-04-25 07:19:28.565953,0 days 00:00:00.633064,39.628456414091154,0.026321680183636224,0.12071505354168734,rbf,TPESampler,COMPLETE
2113,0.27432235875353256,2025-04-25 07:19:28.755950,2025-04-25 07:19:29.294144,0 days 00:00:00.538194,3.570714453042665,0.06345740803818246,0.05509254374669358,rbf,TPESampler,COMPLETE
2114,0.3685016214443832,2025-04-25 07:19:29.485951,2025-04-25 07:19:29.998570,0 days 00:00:00.512619,0.9648805142712512,0.1498496242428243,0.022221356453667598,rbf,TPESampler,COMPLETE
2115,0.2650669084598106,2025-04-25 07:19:30.181731,2025-04-25 07:19:30.780000,0 days 00:00:00.598269,9.192812927709696,0.031627900535220875,0.057945782835173064,rbf,TPESampler,COMPLETE
2116,0.5014847100856168,2025-04-25 07:19:30.966102,2025-04-25 07:19:34.267651,0 days 00:00:03.301549,9.198780216989585,0.010396779499055046,0.10435169890731275,linear,TPESampler,COMPLETE
2117,0.29159313206704224,2025-04-25 07:19:34.462412,2025-04-25 07:19:35.109458,0 days 00:00:00.647046,18.070831271207982,0.022649182556466006,0.02075490288895138,rbf,TPESampler,COMPLETE
2118,0.2919049914718266,2025-04-25 07:19:35.299030,2025-04-25 07:19:35.884492,0 days 00:00:00.585462,14.991260221252315,0.0862433607113824,0.025920069172089093,rbf,TPESampler,COMPLETE
2119,0.2691495431122813,2025-04-25 07:19:36.078035,2025-04-25 07:19:36.699857,0 days 00:00:00.621822,19.315722541158816,0.052625415873932185,0.04194248981159888,rbf,TPESampler,COMPLETE
2120,0.2788092008190416,2025-04-25 07:19:36.894972,2025-04-25 07:19:37.537017,0 days 00:00:00.642045,38.65679785916099,0.03879138083490932,0.06622412725025882,rbf,TPESampler,COMPLETE
2121,0.30035224191830073,2025-04-25 07:19:37.718428,2025-04-25 07:19:38.246485,0 days 00:00:00.528057,7.45664532897347,0.12973846353389631,0.02006093207988181,rbf,TPESampler,COMPLETE
2122,0.3011425492221949,2025-04-25 07:19:38.433669,2025-04-25 07:19:39.053189,0 days 00:00:00.619520,28.434609146413116,0.04409664770314792,0.01507612966917117,rbf,TPESampler,COMPLETE
2123,0.28416154326484544,2025-04-25 07:19:39.252884,2025-04-25 07:19:39.844159,0 days 00:00:00.591275,2.0891392922961525,0.01499148826712452,0.06614542821282644,rbf,TPESampler,COMPLETE
2124,0.27092796071894965,2025-04-25 07:19:40.041675,2025-04-25 07:19:40.669498,0 days 00:00:00.627823,16.513487848130143,0.02993946319177014,0.06471395739713691,rbf,TPESampler,COMPLETE
