number,value,datetime_start,datetime_complete,duration,params_C,params_epsilon,params_gamma,params_kernel,system_attrs_auto:sampler,state
1535,0.2909074148136062,2025-04-25 04:44:38.397290,2025-04-25 04:44:38.989815,0 days 00:00:00.592525,3.469348340988181,0.010003624191270455,0.20959419809581917,rbf,TPESampler,COMPLETE
1536,0.3186588730490472,2025-04-25 04:44:39.171901,2025-04-25 04:44:39.687549,0 days 00:00:00.515648,1.7132087614344789,0.15412618436124625,0.03704939029477969,rbf,TPESampler,COMPLETE
1537,0.28816188011035626,2025-04-25 04:44:40.083036,2025-04-25 04:44:40.756377,0 days 00:00:00.673341,87.6799973467028,0.046175439149905385,0.06370365184275165,rbf,TPESampler,COMPLETE
1538,0.3539503805135453,2025-04-25 04:44:40.940195,2025-04-25 04:44:41.568935,0 days 00:00:00.628740,12.385860086083698,0.013717169376031674,0.003531212366857366,rbf,TPESampler,COMPLETE
1539,0.3959275909281492,2025-04-25 04:44:41.761671,2025-04-25 04:44:42.289783,0 days 00:00:00.528112,5.8770860438439,0.11847951336410482,0.42423487203395693,rbf,TPESampler,COMPLETE
1540,0.2645193947357094,2025-04-25 04:44:42.467790,2025-04-25 04:44:43.044384,0 days 00:00:00.576594,6.678382306433301,0.02692632492014692,0.07237322069069545,rbf,TPESampler,COMPLETE
1541,0.26898832178479093,2025-04-25 04:44:43.219945,2025-04-25 04:44:43.824032,0 days 00:00:00.604087,8.153292899248443,0.006342989252156338,0.05899119638169344,rbf,TPESampler,COMPLETE
1542,0.3025809088643128,2025-04-25 04:44:44.005535,2025-04-25 04:44:44.634525,0 days 00:00:00.628990,16.570714231380645,0.014616762823376525,0.1713880415399592,rbf,TPESampler,COMPLETE
1543,0.33061922174078945,2025-04-25 04:44:44.821685,2025-04-25 04:44:45.377315,0 days 00:00:00.555630,0.6409178178765439,0.016322267216940214,0.06298267520706535,rbf,TPESampler,COMPLETE
1544,0.28075125558565267,2025-04-25 04:44:45.556745,2025-04-25 04:44:46.155705,0 days 00:00:00.598960,10.247845939128084,0.01135126733379718,0.02295313370407149,rbf,TPESampler,COMPLETE
1545,0.2750804309756099,2025-04-25 04:44:46.345634,2025-04-25 04:44:46.925494,0 days 00:00:00.579860,2.9381237412120806,0.019655365987289532,0.14981026282663842,rbf,TPESampler,COMPLETE
1546,0.28830404762571343,2025-04-25 04:44:47.107264,2025-04-25 04:44:47.801554,0 days 00:00:00.694290,28.57778924766564,0.01436323041753981,0.02345141485161253,rbf,TPESampler,COMPLETE
1547,0.266533816567283,2025-04-25 04:44:47.985225,2025-04-25 04:44:48.625182,0 days 00:00:00.639957,13.974077794983351,0.022380163923468033,0.05422032650543541,rbf,TPESampler,COMPLETE
1548,282.3176523537731,2025-04-25 04:44:48.806080,2025-04-25 04:44:49.356529,0 days 00:00:00.550449,12.665010514743475,0.017872220118610713,0.06370270947817991,sigmoid,TPESampler,COMPLETE
1549,0.285795309215697,2025-04-25 04:44:49.546287,2025-04-25 04:44:50.134439,0 days 00:00:00.588152,4.867972859202395,0.0176504871672316,0.1811288817066285,rbf,TPESampler,COMPLETE
1550,0.3350272591200655,2025-04-25 04:44:50.314712,2025-04-25 04:44:50.862884,0 days 00:00:00.548172,2.3687803265340985,0.023468969353775036,0.017487094191468593,rbf,TPESampler,COMPLETE
1551,0.2668010309420153,2025-04-25 04:44:51.045992,2025-04-25 04:44:51.655769,0 days 00:00:00.609777,8.888848521398893,0.026228519274588573,0.08715645533633638,rbf,TPESampler,COMPLETE
1552,0.275791583376858,2025-04-25 04:44:51.832390,2025-04-25 04:44:52.406728,0 days 00:00:00.574338,4.246800128098175,0.02048476628921042,0.046760623518190624,rbf,TPESampler,COMPLETE
1553,0.26784674179795975,2025-04-25 04:44:52.590858,2025-04-25 04:44:53.168699,0 days 00:00:00.577841,4.7908056471719105,0.027930212247445133,0.10702872878982019,rbf,TPESampler,COMPLETE
1554,0.29162511622791276,2025-04-25 04:44:53.346559,2025-04-25 04:44:53.890893,0 days 00:00:00.544334,1.5219759183919455,0.052818632001821145,0.15159923398919967,rbf,TPESampler,COMPLETE
1555,0.3105699136875468,2025-04-25 04:44:54.103222,2025-04-25 04:44:54.722417,0 days 00:00:00.619195,14.136349381415572,0.02602864140006421,0.009283630441808698,rbf,TPESampler,COMPLETE
1556,0.2904366973466299,2025-04-25 04:44:54.896873,2025-04-25 04:44:55.479696,0 days 00:00:00.582823,1.3613543876281893,0.00733304515551874,0.13742127047053532,rbf,TPESampler,COMPLETE
1557,0.36981312110193393,2025-04-25 04:44:55.660618,2025-04-25 04:44:56.285530,0 days 00:00:00.624912,16.09553998691555,0.01007190628460961,0.44065068197341645,rbf,TPESampler,COMPLETE
1558,0.34650986760309754,2025-04-25 04:44:56.494569,2025-04-25 04:44:57.342277,0 days 00:00:00.847708,1.2336183813410522,0.012233919601279107,0.025095432372323107,rbf,TPESampler,COMPLETE
1559,0.49938317088710843,2025-04-25 04:44:57.525070,2025-04-25 04:44:59.577373,0 days 00:00:02.052303,4.912729653833441,0.01279794213472418,0.028248182964523045,linear,TPESampler,COMPLETE
1560,0.3324313684574436,2025-04-25 04:44:59.758441,2025-04-25 04:45:00.380398,0 days 00:00:00.621957,21.771705495592688,0.029615860235805903,0.2998965381467514,rbf,TPESampler,COMPLETE
1561,0.28324141205041653,2025-04-25 04:45:00.559100,2025-04-25 04:45:01.398575,0 days 00:00:00.839475,39.60282166377593,0.011646219655515704,0.05497589594387207,rbf,TPESampler,COMPLETE
1562,0.2659978033727427,2025-04-25 04:45:01.575919,2025-04-25 04:45:02.178327,0 days 00:00:00.602408,4.710141184455978,0.013905068621923108,0.0735585328811392,rbf,TPESampler,COMPLETE
1563,0.3368941777623314,2025-04-25 04:45:02.363750,2025-04-25 04:45:02.918007,0 days 00:00:00.554257,0.7990740592122425,0.04023310609837465,0.04206967502613363,rbf,TPESampler,COMPLETE
1564,0.2724732414089179,2025-04-25 04:45:03.098869,2025-04-25 04:45:03.691809,0 days 00:00:00.592940,11.33877262109471,0.02744306508360391,0.04270147458718277,rbf,TPESampler,COMPLETE
1565,0.2892124797781699,2025-04-25 04:45:03.872572,2025-04-25 04:45:04.497471,0 days 00:00:00.624899,16.381559851473384,0.03980199912013396,0.017951339049066175,rbf,TPESampler,COMPLETE
1566,0.3669533974161524,2025-04-25 04:45:04.808207,2025-04-25 04:45:05.370834,0 days 00:00:00.562627,0.9210301619489614,0.020360073134126272,0.35459516665936314,rbf,TPESampler,COMPLETE
1567,0.4740377337109046,2025-04-25 04:45:05.570700,2025-04-25 04:45:06.326297,0 days 00:00:00.755597,1.3180333275771126,0.03833356114275733,0.3651833716146316,linear,TPESampler,COMPLETE
1568,0.3030295191983908,2025-04-25 04:45:06.502172,2025-04-25 04:45:07.115338,0 days 00:00:00.613166,80.98392075246262,0.026175273994686107,0.15891079306390798,rbf,TPESampler,COMPLETE
1569,0.2686764246248573,2025-04-25 04:45:07.288003,2025-04-25 04:45:07.831173,0 days 00:00:00.543170,3.0828560520728128,0.03985015745048721,0.07501823620925907,rbf,TPESampler,COMPLETE
1570,0.26710911104497953,2025-04-25 04:45:08.010701,2025-04-25 04:45:08.612889,0 days 00:00:00.602188,10.64971457379887,0.027412371989067617,0.07117661345092792,rbf,TPESampler,COMPLETE
1571,0.35415257402408207,2025-04-25 04:45:08.857447,2025-04-25 04:45:09.422223,0 days 00:00:00.564776,11.208976406719257,0.03221914058842216,0.3734152807881452,rbf,TPESampler,COMPLETE
1572,0.2723036781198536,2025-04-25 04:45:09.605438,2025-04-25 04:45:10.329650,0 days 00:00:00.724212,10.779539305214353,0.00861230026094764,0.10364947010145424,rbf,TPESampler,COMPLETE
1573,0.2670358997314277,2025-04-25 04:45:10.509351,2025-04-25 04:45:11.099713,0 days 00:00:00.590362,11.597328892092285,0.04058024286106329,0.06747431036691327,rbf,TPESampler,COMPLETE
1574,0.5228688984071648,2025-04-25 04:45:11.279353,2025-04-25 04:46:30.031273,0 days 00:01:18.751920,3.321494359141514,0.025276370654446847,0.06905984883864892,poly,TPESampler,COMPLETE
1575,1.098101680219021,2025-04-25 04:46:30.217004,2025-04-25 05:47:47.162509,0 days 01:01:16.945505,0.9781556453912699,0.024978893960332548,0.39814874478627005,poly,TPESampler,COMPLETE
1576,0.5009741435835829,2025-04-25 05:02:53.974233,2025-04-25 05:03:11.627979,0 days 00:00:17.653746,63.950773846926914,0.03101191513576405,0.0249303596472712,linear,TPESampler,COMPLETE
1577,0.4064821606932976,2025-04-25 05:03:11.822419,2025-04-25 05:03:12.380142,0 days 00:00:00.557723,0.8999894916629325,0.004968486180166533,0.009931309737612823,rbf,TPESampler,COMPLETE
1578,0.4157742851693619,2025-04-25 05:03:12.556177,2025-04-25 05:03:13.115929,0 days 00:00:00.559752,4.392359672838105,0.0327797174565918,0.5543849517611023,rbf,TPESampler,COMPLETE
1579,0.28650164714682375,2025-04-25 05:03:13.290724,2025-04-25 05:03:13.817217,0 days 00:00:00.526493,1.5582716592139587,0.04364422291616542,0.07863754758384646,rbf,TPESampler,COMPLETE
1580,0.2862605968010762,2025-04-25 05:03:13.993455,2025-04-25 05:03:14.607412,0 days 00:00:00.613957,1.6808238867439809,0.014085876039802584,0.0811305381848848,rbf,TPESampler,COMPLETE
1581,58.640760675746876,2025-04-25 05:03:14.817941,2025-04-25 05:03:15.354524,0 days 00:00:00.536583,3.4180070028680998,0.039818853596647705,0.027506601802375383,sigmoid,TPESampler,COMPLETE
1582,0.28152718653069847,2025-04-25 05:03:15.536271,2025-04-25 05:03:16.094386,0 days 00:00:00.558115,11.651953328127709,0.045507935052880505,0.026996073044203536,rbf,TPESampler,COMPLETE
1583,0.33795977919509,2025-04-25 05:03:16.273079,2025-04-25 05:03:16.803845,0 days 00:00:00.530766,1.7300422085149527,0.03436249250821558,0.02113314541067368,rbf,TPESampler,COMPLETE
1584,0.2658248916981728,2025-04-25 05:03:16.979498,2025-04-25 05:03:17.550175,0 days 00:00:00.570677,5.828754694521017,0.04107536494922202,0.10397305699212897,rbf,TPESampler,COMPLETE
1585,0.26626796843129097,2025-04-25 05:03:17.723988,2025-04-25 05:03:18.294684,0 days 00:00:00.570696,3.431938057099433,0.013851531373226995,0.0944841497285814,rbf,TPESampler,COMPLETE
1586,0.310781869532182,2025-04-25 05:03:18.474987,2025-04-25 05:03:19.021567,0 days 00:00:00.546580,6.675224565565469,0.05526026967403115,0.015146774681848638,rbf,TPESampler,COMPLETE
1587,0.49028471542425417,2025-04-25 05:03:19.206212,2025-04-25 05:03:20.315091,0 days 00:00:01.108879,8.48898763192466,0.34742511890099625,0.030953699690331266,linear,TPESampler,COMPLETE
1588,0.27721117207741397,2025-04-25 05:03:20.491790,2025-04-25 05:03:21.133699,0 days 00:00:00.641909,22.575931147341564,0.019047848994443662,0.09744160502630902,rbf,TPESampler,COMPLETE
1589,0.28723853372066777,2025-04-25 05:03:21.306530,2025-04-25 05:03:21.852943,0 days 00:00:00.546413,11.379174707356949,0.059972393339012234,0.1477256318868273,rbf,TPESampler,COMPLETE
1590,0.2909163013166032,2025-04-25 05:03:22.027774,2025-04-25 05:03:22.571294,0 days 00:00:00.543520,3.2001630426131444,0.04113061564129011,0.0338778442400252,rbf,TPESampler,COMPLETE
1591,0.3956208004821426,2025-04-25 05:03:22.750239,2025-04-25 05:03:23.275370,0 days 00:00:00.525131,0.31701267124238197,0.0508178229868192,0.03361876180979767,rbf,TPESampler,COMPLETE
1592,0.31762968010039244,2025-04-25 05:03:23.454016,2025-04-25 05:03:24.006463,0 days 00:00:00.552447,0.9141811125301967,0.031745228042480284,0.18487000574677984,rbf,TPESampler,COMPLETE
1593,0.5007053740967579,2025-04-25 05:03:24.183155,2025-04-25 05:03:26.535670,0 days 00:00:02.352515,6.719419482405644,0.019966130112015503,0.11248046572475828,linear,TPESampler,COMPLETE
1594,0.5017569970419521,2025-04-25 05:03:26.714658,2025-04-25 05:03:33.794369,0 days 00:00:07.079711,19.308365178240606,0.030740799161751674,0.9806053933061596,linear,TPESampler,COMPLETE
1595,0.2681523821342342,2025-04-25 05:03:33.982903,2025-04-25 05:03:34.597387,0 days 00:00:00.614484,16.318803488429012,0.03541807152680171,0.06697739001671439,rbf,TPESampler,COMPLETE
1596,0.29129424740861665,2025-04-25 05:03:34.773963,2025-04-25 05:03:35.341866,0 days 00:00:00.567903,3.086791000418746,0.03706497611221686,0.19580485644089293,rbf,TPESampler,COMPLETE
1597,0.4495948038542881,2025-04-25 05:03:35.525003,2025-04-25 05:03:36.070642,0 days 00:00:00.545639,0.18534352059352702,0.01402036684036382,0.19804049043633914,rbf,TPESampler,COMPLETE
1598,0.2757446352095653,2025-04-25 05:03:36.255655,2025-04-25 05:03:36.844553,0 days 00:00:00.588898,5.863415955960254,0.012811907512531273,0.037617919591515746,rbf,TPESampler,COMPLETE
1599,0.2997591451468048,2025-04-25 05:03:37.023439,2025-04-25 05:03:37.583080,0 days 00:00:00.559641,3.186229526700509,0.017095337711393366,0.027766560561651006,rbf,TPESampler,COMPLETE
1600,0.2654310708202159,2025-04-25 05:03:37.765175,2025-04-25 05:03:38.355064,0 days 00:00:00.589889,9.471806205365843,0.04549899919159991,0.0598509437819581,rbf,TPESampler,COMPLETE
1601,0.2916090619014904,2025-04-25 05:03:38.535175,2025-04-25 05:03:39.102916,0 days 00:00:00.567741,30.841462209087478,0.079484974986424,0.021444822443698316,rbf,TPESampler,COMPLETE
1602,0.6620535770349905,2025-04-25 05:03:39.345559,2025-04-25 05:03:40.207975,0 days 00:00:00.862416,0.0010098724994848669,0.020371320559232017,0.00031705580559804417,linear,TPESampler,COMPLETE
1603,0.30098867775328964,2025-04-25 05:03:40.441559,2025-04-25 05:03:40.945045,0 days 00:00:00.503486,3.8266065180083206,0.12376588245368218,0.03064582382199289,rbf,TPESampler,COMPLETE
1604,0.26720897837321295,2025-04-25 05:03:41.123555,2025-04-25 05:03:41.686912,0 days 00:00:00.563357,14.028127450423174,0.05553613505624957,0.07612777252924477,rbf,TPESampler,COMPLETE
1605,1486.575391099294,2025-04-25 05:03:41.867173,2025-04-25 05:03:42.409485,0 days 00:00:00.542312,94.1950421102155,0.6488566249540694,0.023937233779526106,sigmoid,TPESampler,COMPLETE
1606,0.2883949201063735,2025-04-25 05:03:42.651023,2025-04-25 05:03:43.308413,0 days 00:00:00.657390,85.97851886211086,0.05654139091268213,0.03132386826251523,rbf,TPESampler,COMPLETE
1607,0.2692114239729902,2025-04-25 05:03:43.488348,2025-04-25 05:03:44.034488,0 days 00:00:00.546140,8.323710100868592,0.07426335740206037,0.054066742663590295,rbf,TPESampler,COMPLETE
1608,0.3295334459456752,2025-04-25 05:03:44.220249,2025-04-25 05:03:44.800099,0 days 00:00:00.579850,3.1352387525102743,0.08653627146840381,0.26281895673845407,rbf,TPESampler,COMPLETE
1609,0.332636177233703,2025-04-25 05:03:44.974184,2025-04-25 05:03:45.502288,0 days 00:00:00.528104,3.105436918619298,0.06877403845953897,0.014367844739314637,rbf,TPESampler,COMPLETE
1610,53.048355191565754,2025-04-25 05:03:45.711283,2025-04-25 05:03:46.253485,0 days 00:00:00.542202,11.018845795028975,0.045313838527262805,0.007213801049256454,sigmoid,TPESampler,COMPLETE
1611,0.28544212469625074,2025-04-25 05:03:46.433855,2025-04-25 05:03:46.977830,0 days 00:00:00.543975,6.5734858155619955,0.10162081560364673,0.031964204384567214,rbf,TPESampler,COMPLETE
1612,0.30412384975941337,2025-04-25 05:03:47.153538,2025-04-25 05:03:47.788559,0 days 00:00:00.635021,34.98494656692033,0.028909054394320257,0.012963703573146771,rbf,TPESampler,COMPLETE
1613,1.1110472371591593,2025-04-25 05:03:47.971151,2025-04-25 05:03:48.523679,0 days 00:00:00.552528,0.017369938195351407,0.0012743987597993557,0.916933822271317,sigmoid,TPESampler,COMPLETE
1614,0.3230500322262534,2025-04-25 05:03:48.705050,2025-04-25 05:03:49.248910,0 days 00:00:00.543860,24.222240444054627,0.08970546188604923,0.20725302742726387,rbf,TPESampler,COMPLETE
1615,0.9191180706596092,2025-04-25 05:03:49.431217,2025-04-25 05:16:01.286691,0 days 00:12:11.855474,1.104891196976138,0.006187456489446006,0.21280381868266515,poly,TPESampler,COMPLETE
1616,0.2798977782722964,2025-04-25 05:16:01.470392,2025-04-25 05:16:02.076754,0 days 00:00:00.606362,22.974862824754744,0.05385375952029453,0.11002284600312204,rbf,TPESampler,COMPLETE
1617,0.4995492655287276,2025-04-25 05:16:02.256770,2025-04-25 05:16:03.198555,0 days 00:00:00.941785,2.1836420216634513,0.0050283973182392696,0.0002343177951908929,linear,TPESampler,COMPLETE
1618,0.28812554640343957,2025-04-25 05:16:03.376986,2025-04-25 05:16:04.083837,0 days 00:00:00.706851,17.90261232361624,0.032505610720001424,0.02400785229448734,rbf,TPESampler,COMPLETE
1619,0.2860626205495692,2025-04-25 05:16:04.261594,2025-04-25 05:16:04.776153,0 days 00:00:00.514559,1.8002135910457646,0.09342527492182737,0.06798694943546515,rbf,TPESampler,COMPLETE
1620,0.28183479829626307,2025-04-25 05:16:04.954016,2025-04-25 05:16:05.503144,0 days 00:00:00.549128,1.8319538578204553,0.08402529339347846,0.11664652598490127,rbf,TPESampler,COMPLETE
1621,0.2840557306490541,2025-04-25 05:16:05.678455,2025-04-25 05:16:06.227213,0 days 00:00:00.548758,3.8873376177439396,0.029429710588300136,0.037025088790146925,rbf,TPESampler,COMPLETE
1622,0.2665477161827132,2025-04-25 05:16:06.404650,2025-04-25 05:16:06.946473,0 days 00:00:00.541823,14.820458752547996,0.08765055462023147,0.06204305696063469,rbf,TPESampler,COMPLETE
1623,0.2801014194973658,2025-04-25 05:16:07.124366,2025-04-25 05:16:07.739222,0 days 00:00:00.614856,13.106039410485835,0.04288744570543375,0.03143320079284859,rbf,TPESampler,COMPLETE
1624,0.2681416905320252,2025-04-25 05:16:07.912156,2025-04-25 05:16:08.473700,0 days 00:00:00.561544,5.037593043465905,0.03586888989878575,0.10282279083017704,rbf,TPESampler,COMPLETE
1625,0.3034405839448249,2025-04-25 05:16:08.653033,2025-04-25 05:16:09.225896,0 days 00:00:00.572863,36.25691200327817,0.033862233135349806,0.15374159990179884,rbf,TPESampler,COMPLETE
1626,0.29837199873055514,2025-04-25 05:16:09.411537,2025-04-25 05:16:09.944872,0 days 00:00:00.533335,6.881624706677105,0.07597698545745929,0.018293918468762403,rbf,TPESampler,COMPLETE
1627,0.26913043752371213,2025-04-25 05:16:10.139094,2025-04-25 05:16:10.680500,0 days 00:00:00.541406,3.06644199528328,0.04409586449949672,0.10571355843408733,rbf,TPESampler,COMPLETE
1628,0.26549621564152565,2025-04-25 05:16:10.858558,2025-04-25 05:16:11.472234,0 days 00:00:00.613676,7.505996202880484,0.05175004621295295,0.062339093498549276,rbf,TPESampler,COMPLETE
1629,0.2773551479558118,2025-04-25 05:16:11.653678,2025-04-25 05:16:12.169569,0 days 00:00:00.515891,14.309237432631088,0.14703605592659585,0.0650685890891278,rbf,TPESampler,COMPLETE
1630,0.41476118157045044,2025-04-25 05:16:12.362593,2025-04-25 05:16:12.901527,0 days 00:00:00.538934,4.258329680961943,0.044626877994173225,0.0022254230256519704,rbf,TPESampler,COMPLETE
1631,0.31708755967376906,2025-04-25 05:16:13.079416,2025-04-25 05:16:13.616558,0 days 00:00:00.537142,10.388399874796677,0.06436526521094964,0.21718872636749206,rbf,TPESampler,COMPLETE
1632,567.4935733149753,2025-04-25 05:16:13.795630,2025-04-25 05:16:14.346349,0 days 00:00:00.550719,26.610444208575448,0.037858947112900505,0.11216186031256493,sigmoid,TPESampler,COMPLETE
1633,0.2923530144831174,2025-04-25 05:16:14.520331,2025-04-25 05:16:15.272253,0 days 00:00:00.751922,76.96734003417576,0.03430024836171736,0.03465805714150908,rbf,TPESampler,COMPLETE
1634,0.6419242836097085,2025-04-25 05:16:15.455649,2025-04-25 05:16:16.835040,0 days 00:00:01.379391,1.8867565499324983,0.2047748921361034,0.02649913699192793,poly,TPESampler,COMPLETE
1635,0.27853829455613077,2025-04-25 05:16:17.069726,2025-04-25 05:16:17.797452,0 days 00:00:00.727726,37.278118371123036,0.022205983175535605,0.05390484151645556,rbf,TPESampler,COMPLETE
1636,0.3590765688195413,2025-04-25 05:16:17.989972,2025-04-25 05:16:18.521145,0 days 00:00:00.531173,1.8879276523224549,0.05544748559911467,0.012789548916772895,rbf,TPESampler,COMPLETE
1637,0.27262328873096675,2025-04-25 05:16:18.697007,2025-04-25 05:16:19.249188,0 days 00:00:00.552181,3.3745570504821325,0.03964308599961216,0.057761863033642814,rbf,TPESampler,COMPLETE
1638,0.2834468350702215,2025-04-25 05:16:19.431468,2025-04-25 05:16:19.970621,0 days 00:00:00.539153,2.7264513645519117,0.07617854814549944,0.15219249233827692,rbf,TPESampler,COMPLETE
1639,0.9485500001273309,2025-04-25 05:16:20.153558,2025-04-25 05:16:20.684314,0 days 00:00:00.530756,0.013772102519062203,0.1265180685621152,0.0036726921370637874,poly,TPESampler,COMPLETE
1640,0.32069000574471374,2025-04-25 05:16:20.865359,2025-04-25 05:16:21.369362,0 days 00:00:00.504003,27.31688867168304,0.21278488285833713,0.019596692361913946,rbf,TPESampler,COMPLETE
1641,0.3605988568511835,2025-04-25 05:16:21.548053,2025-04-25 05:16:22.105759,0 days 00:00:00.557706,7.602162510401498,0.03994580269303524,0.38748462802275374,rbf,TPESampler,COMPLETE
1642,0.2817335337437621,2025-04-25 05:16:22.283819,2025-04-25 05:16:22.885630,0 days 00:00:00.601811,11.646081070498392,0.02991046493950213,0.14377397576880213,rbf,TPESampler,COMPLETE
1643,0.31661564452336294,2025-04-25 05:16:23.068753,2025-04-25 05:16:23.669821,0 days 00:00:00.601068,11.229582200728526,0.01582178912788096,0.009359525834014322,rbf,TPESampler,COMPLETE
1644,0.3561502211716898,2025-04-25 05:16:23.863617,2025-04-25 05:16:24.395807,0 days 00:00:00.532190,0.6234281932350654,0.05131644305812364,0.03739865857416006,rbf,TPESampler,COMPLETE
1645,0.2740819335218933,2025-04-25 05:16:24.572594,2025-04-25 05:16:25.127135,0 days 00:00:00.554541,29.892332837977822,0.08115281264298467,0.052601277146215,rbf,TPESampler,COMPLETE
1646,0.6476797543932508,2025-04-25 05:16:25.306918,2025-04-25 05:16:25.858987,0 days 00:00:00.552069,1.8493641359140018,0.04353234448747503,0.0009506753702369253,sigmoid,TPESampler,COMPLETE
1647,0.3155500329095402,2025-04-25 05:16:26.049577,2025-04-25 05:16:26.623334,0 days 00:00:00.573757,8.771357572199026,0.02752164930637089,0.011092640739985157,rbf,TPESampler,COMPLETE
1648,0.2681758088758844,2025-04-25 05:16:26.793507,2025-04-25 05:16:27.434418,0 days 00:00:00.640911,16.678088646260786,0.03422522813238823,0.07019166800685886,rbf,TPESampler,COMPLETE
1649,0.28075076375412417,2025-04-25 05:16:27.618375,2025-04-25 05:16:28.180753,0 days 00:00:00.562378,3.9931210084110695,0.024659952404251447,0.042096934830268086,rbf,TPESampler,COMPLETE
1650,0.2743558805080165,2025-04-25 05:16:28.358395,2025-04-25 05:16:28.881353,0 days 00:00:00.522958,2.437466465328193,0.08268416050714171,0.09570878406282468,rbf,TPESampler,COMPLETE
1651,0.4971688278423531,2025-04-25 05:16:29.161675,2025-04-25 05:16:33.770369,0 days 00:00:04.608694,18.455289064264825,0.05378240674873782,0.09389167834065663,linear,TPESampler,COMPLETE
1652,0.2846554337430554,2025-04-25 05:16:33.952405,2025-04-25 05:16:34.541184,0 days 00:00:00.588779,5.240803068156371,0.04667584151125595,0.031103605996531655,rbf,TPESampler,COMPLETE
