number,value,datetime_start,datetime_complete,duration,params_C,params_epsilon,params_gamma,params_kernel,system_attrs_auto:sampler,state
2243,0.7879796412534597,2025-04-25 08:36:06.150155,2025-04-25 08:36:06.704926,0 days 00:00:00.554771,0.03707770443152688,0.00266553290932318,0.0019838211133562994,sigmoid,TPESampler,COMPLETE
2244,0.26771645598748295,2025-04-25 08:36:06.891997,2025-04-25 08:36:07.540563,0 days 00:00:00.648566,3.487145097531528,0.010159415532790437,0.11497030795112193,rbf,TPESampler,COMPLETE
2245,0.30405840840438797,2025-04-25 08:36:07.730202,2025-04-25 08:36:08.319974,0 days 00:00:00.589772,6.78934309826499,0.011328869436746512,0.016542873874562193,rbf,TPESampler,COMPLETE
2246,0.5206729696883228,2025-04-25 08:36:08.506858,2025-04-25 08:38:03.224066,0 days 00:01:54.717208,3.2040722196630926,0.019800199389638565,0.06139600308264327,poly,TPESampler,COMPLETE
2247,0.26770282741537377,2025-04-25 08:38:03.418853,2025-04-25 08:38:04.029411,0 days 00:00:00.610558,4.164180343979816,0.015436702554436183,0.06943508555394745,rbf,TPESampler,COMPLETE
2248,0.3456458012142736,2025-04-25 08:38:04.348710,2025-04-25 08:38:04.919210,0 days 00:00:00.570500,0.5602333576651692,0.02012232259977126,0.05397803506431918,rbf,TPESampler,COMPLETE
2249,0.2833169660253907,2025-04-25 08:38:05.104200,2025-04-25 08:38:05.733652,0 days 00:00:00.629452,23.873016478418215,0.03601892716898722,0.026168345577930036,rbf,TPESampler,COMPLETE
2250,0.30691777433333806,2025-04-25 08:38:05.919375,2025-04-25 08:38:06.616047,0 days 00:00:00.696672,93.63570575639227,0.030892727185870054,0.08156219838359349,rbf,TPESampler,COMPLETE
2251,0.32325844014057753,2025-04-25 08:38:06.809846,2025-04-25 08:38:07.370028,0 days 00:00:00.560182,75.7126554409516,0.11285246998585771,0.003654097045011305,rbf,TPESampler,COMPLETE
2252,0.306219323921076,2025-04-25 08:38:07.750404,2025-04-25 08:38:08.346897,0 days 00:00:00.596493,5.001217957791018,0.01717877043941137,0.2408143917474239,rbf,TPESampler,COMPLETE
2253,0.2712460954235868,2025-04-25 08:38:08.538331,2025-04-25 08:38:09.121333,0 days 00:00:00.583002,2.656547155972816,0.027565679099608068,0.0896203683858193,rbf,TPESampler,COMPLETE
2254,0.2700493949716643,2025-04-25 08:38:09.306308,2025-04-25 08:38:09.941236,0 days 00:00:00.634928,11.0091711647475,0.01710378947341069,0.047367624109645935,rbf,TPESampler,COMPLETE
2255,0.2792530162326503,2025-04-25 08:38:10.126015,2025-04-25 08:38:10.711596,0 days 00:00:00.585581,2.892870880819409,0.02368257788044036,0.057200590954829704,rbf,TPESampler,COMPLETE
2256,0.31566222112759235,2025-04-25 08:38:10.908151,2025-04-25 08:38:11.514157,0 days 00:00:00.606006,3.6423780631859617,0.017061990896316135,0.27974046311188094,rbf,TPESampler,COMPLETE
2257,0.33477198941836944,2025-04-25 08:38:11.705603,2025-04-25 08:38:12.277245,0 days 00:00:00.571642,1.6493265394419832,0.01614229460722044,0.023552144183810977,rbf,TPESampler,COMPLETE
2258,0.9815446495850856,2025-04-25 08:38:12.512828,2025-04-25 08:38:13.069713,0 days 00:00:00.556885,0.003427474743496707,0.5833247359190434,0.0003071588250063922,sigmoid,TPESampler,COMPLETE
2259,0.2694123148843871,2025-04-25 08:38:13.461650,2025-04-25 08:38:14.221885,0 days 00:00:00.760235,11.012401881842067,0.0261815913603239,0.09479955228110198,rbf,TPESampler,COMPLETE
2260,0.3139793457587376,2025-04-25 08:38:14.415150,2025-04-25 08:38:15.033276,0 days 00:00:00.618126,34.0047648621697,0.01581729173741209,0.23130841931026175,rbf,TPESampler,COMPLETE
2261,0.2664038895168502,2025-04-25 08:38:15.241914,2025-04-25 08:38:15.960613,0 days 00:00:00.718699,8.220838578706656,0.02265845874057994,0.060896465255168036,rbf,TPESampler,COMPLETE
2262,0.5642656341270573,2025-04-25 08:38:16.154456,2025-04-25 08:38:16.720043,0 days 00:00:00.565587,0.08027583122153105,0.023958801953622665,0.013973236631206296,rbf,TPESampler,COMPLETE
2263,16.438822214776426,2025-04-25 08:38:16.915101,2025-04-25 08:38:17.489775,0 days 00:00:00.574674,0.7767886388365521,0.151662850842359,0.1362964556093669,sigmoid,TPESampler,COMPLETE
2264,0.48049799514681957,2025-04-25 08:38:17.689582,2025-04-25 08:38:20.929306,0 days 00:00:03.239724,11.57705351671976,0.16703524869813455,0.22006958466060944,linear,TPESampler,COMPLETE
2265,0.2795501301594303,2025-04-25 08:38:21.120479,2025-04-25 08:38:21.710039,0 days 00:00:00.589560,15.682001625792893,0.035029358938609284,0.12597668098893527,rbf,TPESampler,COMPLETE
2266,0.30004854100790035,2025-04-25 08:38:21.903422,2025-04-25 08:38:22.581253,0 days 00:00:00.677831,29.066195637909843,0.011886075674092321,0.016286232377103107,rbf,TPESampler,COMPLETE
2267,0.3258457515960067,2025-04-25 08:38:22.775322,2025-04-25 08:38:23.356997,0 days 00:00:00.581675,0.6322690039619031,0.01543741085774876,0.07376358811720092,rbf,TPESampler,COMPLETE
2268,0.9623923268821228,2025-04-25 08:38:23.550387,2025-04-25 08:38:24.090730,0 days 00:00:00.540343,0.0010843777284436525,0.041270357440146024,0.00037350290659589455,sigmoid,TPESampler,COMPLETE
2269,0.31370990931402076,2025-04-25 08:38:24.276560,2025-04-25 08:38:24.825453,0 days 00:00:00.548893,0.859902189003908,0.05095197231823363,0.15466412348541034,rbf,TPESampler,COMPLETE
2270,0.5506871278771595,2025-04-25 08:38:25.016529,2025-04-25 08:39:23.288966,0 days 00:00:58.272437,0.8931486745325684,0.06042994937688389,0.0762001208297711,poly,TPESampler,COMPLETE
2271,0.3388068308144764,2025-04-25 08:39:03.585642,2025-04-25 08:39:04.167552,0 days 00:00:00.581910,3.5226389907169846,0.02931931400485617,0.012007072169237193,rbf,TPESampler,COMPLETE
2272,0.3235318883813377,2025-04-25 08:39:04.360984,2025-04-25 08:39:05.021093,0 days 00:00:00.660109,4.452472708143186,0.0402763035533252,0.28261854762198346,rbf,TPESampler,COMPLETE
2273,0.27587544502676364,2025-04-25 08:39:05.211620,2025-04-25 08:39:05.810664,0 days 00:00:00.599044,17.617820767573495,0.04501901034874977,0.03370499681931538,rbf,TPESampler,COMPLETE
2274,0.2975496627253143,2025-04-25 08:39:05.999651,2025-04-25 08:39:06.559649,0 days 00:00:00.559998,1.3840954234661367,0.02488802137198551,0.055892623592081,rbf,TPESampler,COMPLETE
2275,0.6056811719050458,2025-04-25 08:39:06.747265,2025-04-25 08:39:13.226904,0 days 00:00:06.479639,4.997906718292738,0.04963799569865075,0.02585833689068852,poly,TPESampler,COMPLETE
2276,0.2975155075941914,2025-04-25 08:39:13.417522,2025-04-25 08:39:14.147629,0 days 00:00:00.730107,2.036587362299591,0.04115386267367775,0.03989495370102694,rbf,TPESampler,COMPLETE
2277,0.2660420671463475,2025-04-25 08:39:14.340277,2025-04-25 08:39:14.933213,0 days 00:00:00.592936,3.159489092519432,0.041202238999941077,0.09196267604136056,rbf,TPESampler,COMPLETE
2278,0.2726216060582389,2025-04-25 08:39:15.129665,2025-04-25 08:39:15.836172,0 days 00:00:00.706507,17.63649408034721,0.010043917545886254,0.044364629206129706,rbf,TPESampler,COMPLETE
2279,0.3812011344632404,2025-04-25 08:39:16.066654,2025-04-25 08:39:16.660655,0 days 00:00:00.594001,3.996394989398732,0.006648238101538545,0.00469318120729848,rbf,TPESampler,COMPLETE
2280,0.2887536236330019,2025-04-25 08:39:16.850720,2025-04-25 08:39:17.417671,0 days 00:00:00.566951,6.254190338209615,0.05964931366036442,0.024004441944115044,rbf,TPESampler,COMPLETE
2281,0.27995512320426597,2025-04-25 08:39:17.608504,2025-04-25 08:39:18.262544,0 days 00:00:00.654040,6.001802814798786,0.025924229821719116,0.1560767501104123,rbf,TPESampler,COMPLETE
2282,0.31703532914114657,2025-04-25 08:39:18.455924,2025-04-25 08:39:19.025190,0 days 00:00:00.569266,0.6509891574905317,0.005967907700023148,0.10861911797089069,rbf,TPESampler,COMPLETE
2283,0.6192365120794735,2025-04-25 08:39:19.212821,2025-04-25 08:39:19.697414,0 days 00:00:00.484593,5.506485524559629,0.8653723211754762,0.005625369435178915,rbf,TPESampler,COMPLETE
2284,0.2673655441403779,2025-04-25 08:39:19.883098,2025-04-25 08:39:20.492961,0 days 00:00:00.609863,13.205941800480558,0.02963147560947312,0.07983626406763702,rbf,TPESampler,COMPLETE
2285,0.28027262916573775,2025-04-25 08:39:20.684789,2025-04-25 08:39:21.233145,0 days 00:00:00.548356,3.7122929735293164,0.053328415680704365,0.0463031669615406,rbf,TPESampler,COMPLETE
2286,0.330452454512533,2025-04-25 08:39:21.419092,2025-04-25 08:39:22.002682,0 days 00:00:00.583590,1.7773933545206482,0.024813312587868033,0.33213033584592755,rbf,TPESampler,COMPLETE
2287,1933.511019049247,2025-04-25 08:39:22.204557,2025-04-25 08:39:22.769342,0 days 00:00:00.564785,92.71442008113243,0.1927402037394488,0.12579693771819997,sigmoid,TPESampler,COMPLETE
2288,0.4206465475773074,2025-04-25 08:39:22.953851,2025-04-25 08:39:23.635304,0 days 00:00:00.681453,0.3038096473900651,0.05430625186584849,0.8162879669052971,linear,TPESampler,COMPLETE
2289,0.325359879421165,2025-04-25 08:39:23.495801,2025-04-25 08:39:24.036629,0 days 00:00:00.540828,13.581835043567931,0.071163648263379,0.2284770540418632,rbf,TPESampler,COMPLETE
2290,0.28871407922513687,2025-04-25 08:39:23.819382,2025-04-25 08:39:24.473429,0 days 00:00:00.654047,4.41404390918432,0.016040325315658875,0.028903472174518878,rbf,TPESampler,COMPLETE
2291,0.271853681206388,2025-04-25 08:39:24.278321,2025-04-25 08:39:25.016825,0 days 00:00:00.738504,23.945202838313314,0.028331863888828128,0.04131047554809101,rbf,TPESampler,COMPLETE
2292,0.4479342892376699,2025-04-25 08:39:24.701057,2025-04-25 08:39:25.283329,0 days 00:00:00.582272,0.8485259253078026,0.05723949763964451,0.5163550041846553,rbf,TPESampler,COMPLETE
2293,225.52322024850116,2025-04-25 08:39:25.222131,2025-04-25 08:39:25.843293,0 days 00:00:00.621162,10.418199026104503,0.12354191288418478,0.2058361932174697,sigmoid,TPESampler,COMPLETE
2294,0.5817942263700581,2025-04-25 08:39:25.507279,2025-04-25 08:39:26.117285,0 days 00:00:00.610006,0.11601098997185212,0.042548204658578205,0.2927202038200188,rbf,TPESampler,COMPLETE
2295,0.28978634772750916,2025-04-25 08:39:26.046657,2025-04-25 08:39:26.557300,0 days 00:00:00.510643,24.34052381420159,0.15105762422129249,0.03118362100551317,rbf,TPESampler,COMPLETE
2296,0.4970135212106926,2025-04-25 08:39:26.356108,2025-04-25 08:39:36.847449,0 days 00:00:10.491341,24.555210597505795,0.05480246944517061,0.059777204544370424,linear,TPESampler,COMPLETE
2297,0.28977119366145165,2025-04-25 08:39:26.786572,2025-04-25 08:39:27.407001,0 days 00:00:00.620429,22.63198571892628,0.03039828807980632,0.13045434086501656,rbf,TPESampler,COMPLETE
2298,0.27468550503533556,2025-04-25 08:39:27.598949,2025-04-25 08:39:28.204944,0 days 00:00:00.605995,3.055026650822991,0.01102522201866316,0.06617132261642604,rbf,TPESampler,COMPLETE
2299,0.2744444478557065,2025-04-25 08:39:28.400196,2025-04-25 08:39:28.940315,0 days 00:00:00.540119,4.909873205936372,0.08881274902560342,0.05395867193883512,rbf,TPESampler,COMPLETE
2300,0.40709604617059486,2025-04-25 08:39:29.131723,2025-04-25 08:39:29.697176,0 days 00:00:00.565453,12.693892464152718,0.06928418727491058,0.5022288973153524,rbf,TPESampler,COMPLETE
2301,0.32327530437032503,2025-04-25 08:39:29.884189,2025-04-25 08:39:30.486985,0 days 00:00:00.602796,5.776477517414943,0.005645418988033294,0.29667508614641946,rbf,TPESampler,COMPLETE
2302,0.7872797450253591,2025-04-25 08:39:30.680132,2025-04-25 08:44:51.698474,0 days 00:05:21.018342,66.5167217884245,0.021555781217488988,0.03965295040311475,poly,TPESampler,COMPLETE
2303,0.3064933358469952,2025-04-25 08:39:37.038757,2025-04-25 08:39:37.593427,0 days 00:00:00.554670,2.3019382644506208,0.035323946266695785,0.03030645301934953,rbf,TPESampler,COMPLETE
2304,0.26962615596271483,2025-04-25 08:39:37.781564,2025-04-25 08:39:38.372564,0 days 00:00:00.591000,7.165921973041604,0.027959799772807697,0.044801751946908136,rbf,TPESampler,COMPLETE
2305,0.7132845521294169,2025-04-25 08:39:38.564494,2025-04-25 08:39:43.776809,0 days 00:00:05.212315,0.010391648228090638,0.7726123531829092,0.19643803938341864,poly,TPESampler,COMPLETE
2306,0.2952561925356009,2025-04-25 08:39:43.966807,2025-04-25 08:39:44.486991,0 days 00:00:00.520184,5.925622542972178,0.16163452584260682,0.03523051188658502,rbf,TPESampler,COMPLETE
2307,0.3004130995634478,2025-04-25 08:39:44.675514,2025-04-25 08:39:45.243832,0 days 00:00:00.568318,1.1705088381904005,0.04209885787102196,0.15360450052368446,rbf,TPESampler,COMPLETE
2308,0.29399210143410914,2025-04-25 08:39:45.443673,2025-04-25 08:39:46.145264,0 days 00:00:00.701591,67.2911850599552,0.049235252772839896,0.017515970599050478,rbf,TPESampler,COMPLETE
2309,0.31479267026091257,2025-04-25 08:39:46.354825,2025-04-25 08:39:46.905057,0 days 00:00:00.550232,1.1781022019086174,0.08376749815235919,0.044442972792639326,rbf,TPESampler,COMPLETE
2310,0.28271351344176665,2025-04-25 08:39:47.090818,2025-04-25 08:39:47.807299,0 days 00:00:00.716481,26.34902605347996,0.016349534209510318,0.10745957910394525,rbf,TPESampler,COMPLETE
2311,0.29825062947176034,2025-04-25 08:39:48.006538,2025-04-25 08:39:48.605263,0 days 00:00:00.598725,83.69168545491354,0.08055261185197933,0.07897734353139164,rbf,TPESampler,COMPLETE
2312,0.26603710383375284,2025-04-25 08:39:48.800183,2025-04-25 08:39:49.362405,0 days 00:00:00.562222,10.285862170806215,0.09454533381973007,0.06805606944402423,rbf,TPESampler,COMPLETE
2313,0.3933727645996819,2025-04-25 08:39:49.559796,2025-04-25 08:39:50.121752,0 days 00:00:00.561956,0.2842498628525698,0.048847253672817184,0.04228532270205642,rbf,TPESampler,COMPLETE
2314,0.27028679351181617,2025-04-25 08:39:50.316104,2025-04-25 08:39:50.917145,0 days 00:00:00.601041,4.777372324906938,0.025370326521468412,0.13112349218596162,rbf,TPESampler,COMPLETE
2315,0.4784941987164245,2025-04-25 08:39:51.115220,2025-04-25 08:39:52.103949,0 days 00:00:00.988729,2.5350398360422854,0.1511419834486342,0.04464615124270821,linear,TPESampler,COMPLETE
2316,0.28309252373391386,2025-04-25 08:39:52.314974,2025-04-25 08:39:52.898061,0 days 00:00:00.583087,8.144570704959186,0.0533566149116527,0.14757496782048568,rbf,TPESampler,COMPLETE
2317,0.3264520495940684,2025-04-25 08:39:53.094960,2025-04-25 08:39:53.681985,0 days 00:00:00.587025,0.8910808188917427,0.014452944040449856,0.21710417515989425,rbf,TPESampler,COMPLETE
2318,0.2910557724253415,2025-04-25 08:39:53.879209,2025-04-25 08:39:54.472261,0 days 00:00:00.593052,25.88845703361905,0.04927684979449359,0.12370958447676238,rbf,TPESampler,COMPLETE
2319,1.1441803441036118,2025-04-25 08:39:54.659279,2025-04-25 08:59:23.276128,0 days 00:19:28.616849,10.622281969056168,0.05708476940628097,0.16023712564574227,poly,TPESampler,COMPLETE
2320,0.2771894243259781,2025-04-25 08:44:51.912577,2025-04-25 08:44:52.536522,0 days 00:00:00.623945,5.286589337073336,0.03759442654826894,0.03848952969543862,rbf,TPESampler,COMPLETE
2321,0.9094974687041608,2025-04-25 08:44:52.730327,2025-04-25 08:44:53.278801,0 days 00:00:00.548474,0.012983212623488876,0.05510754782149495,0.0012253243763307583,sigmoid,TPESampler,COMPLETE
2322,0.27661818723363435,2025-04-25 08:44:53.470829,2025-04-25 08:44:54.058709,0 days 00:00:00.587880,11.46114565039958,0.045531428396055056,0.037270266976413564,rbf,TPESampler,COMPLETE
2323,0.3963939585202151,2025-04-25 08:44:54.246557,2025-04-25 08:44:54.836683,0 days 00:00:00.590126,15.474361068241054,0.02700187255803433,0.5056673660293443,rbf,TPESampler,COMPLETE
2324,0.2792496318533602,2025-04-25 08:44:55.031444,2025-04-25 08:44:55.629921,0 days 00:00:00.598477,2.120623115011302,0.011297221402264376,0.08648683952629345,rbf,TPESampler,COMPLETE
2325,0.273870874714367,2025-04-25 08:44:55.829133,2025-04-25 08:44:56.520595,0 days 00:00:00.691462,11.324815685682852,0.005520481261939984,0.10954084252494489,rbf,TPESampler,COMPLETE
2326,0.2786282484270125,2025-04-25 08:44:56.717997,2025-04-25 08:44:57.349648,0 days 00:00:00.631651,10.553657483556815,0.018567420919530408,0.03067679726890659,rbf,TPESampler,COMPLETE
2327,0.26856144934707205,2025-04-25 08:44:57.551397,2025-04-25 08:44:58.135656,0 days 00:00:00.584259,4.775528058247902,0.03239495820677681,0.10720692362163504,rbf,TPESampler,COMPLETE
2328,0.5803816853158188,2025-04-25 08:44:58.326305,2025-04-25 08:44:58.914953,0 days 00:00:00.588648,5.90842081520953,0.007434846805398817,0.999801947638137,rbf,TPESampler,COMPLETE
2329,0.9624706660676376,2025-04-25 08:44:59.104795,2025-04-25 08:44:59.649562,0 days 00:00:00.544767,0.09784032943247292,0.005671834812579341,0.00041065524124690494,poly,TPESampler,COMPLETE
2330,0.49657728035578685,2025-04-25 08:44:59.840865,2025-04-25 08:45:01.228723,0 days 00:00:01.387858,3.54954390113694,0.0387121827895215,0.2076468233225589,linear,TPESampler,COMPLETE
2331,0.34613763503159856,2025-04-25 08:45:01.415390,2025-04-25 08:45:01.980948,0 days 00:00:00.565558,3.38564028569791,0.08189024042011937,0.31447290333730615,rbf,TPESampler,COMPLETE
2332,325.13193889621857,2025-04-25 08:45:02.176785,2025-04-25 08:45:02.752940,0 days 00:00:00.576155,29.54279664715402,0.0010765213516561061,0.01495939348858623,sigmoid,TPESampler,COMPLETE
2333,0.2821516149859792,2025-04-25 08:45:02.951156,2025-04-25 08:45:03.653439,0 days 00:00:00.702283,40.01722610929552,0.024119998099938804,0.06078863619781156,rbf,TPESampler,COMPLETE
2334,0.6295709497049148,2025-04-25 08:45:03.843885,2025-04-25 08:45:04.488233,0 days 00:00:00.644348,0.0016169054644888932,0.0011312133874608703,0.04608827051906997,linear,TPESampler,COMPLETE
2335,0.2909657817780306,2025-04-25 08:45:04.679972,2025-04-25 08:45:05.250810,0 days 00:00:00.570838,1.2263951204358838,0.050724244542494565,0.09357760915188786,rbf,TPESampler,COMPLETE
2336,0.29874798311289746,2025-04-25 08:45:05.441522,2025-04-25 08:45:05.969575,0 days 00:00:00.528053,5.134845418024435,0.09957696320411193,0.023411003172538233,rbf,TPESampler,COMPLETE
2337,0.35239680437293663,2025-04-25 08:45:06.158986,2025-04-25 08:45:06.714198,0 days 00:00:00.555212,2.785332831236635,0.039678556739682465,0.01050101566033359,rbf,TPESampler,COMPLETE
2338,0.27108878958360183,2025-04-25 08:45:06.912927,2025-04-25 08:45:07.723675,0 days 00:00:00.810748,9.719961058112531,0.05244336228043974,0.10731303177486513,rbf,TPESampler,COMPLETE
2339,0.29669358487442415,2025-04-25 08:45:07.913198,2025-04-25 08:45:08.468722,0 days 00:00:00.555524,13.252662658652135,0.07042329987284483,0.013681057887968874,rbf,TPESampler,COMPLETE
2340,0.3021956668980749,2025-04-25 08:45:08.663617,2025-04-25 08:45:09.280136,0 days 00:00:00.616519,8.711958281743158,0.015157176395907853,0.20837539032014205,rbf,TPESampler,COMPLETE
2341,0.310441691293484,2025-04-25 08:45:09.473229,2025-04-25 08:45:10.054680,0 days 00:00:00.581451,2.8395944011950824,0.025940710831819216,0.2658858546322122,rbf,TPESampler,COMPLETE
2342,0.4221071591005213,2025-04-25 08:45:10.244328,2025-04-25 08:45:10.796449,0 days 00:00:00.552121,0.36956904708313126,0.013203538941365948,0.01602815780325917,rbf,TPESampler,COMPLETE
2343,266.69963432686325,2025-04-25 08:45:10.990236,2025-04-25 08:45:11.551319,0 days 00:00:00.561083,16.486506489816453,0.06788270495586118,0.025132561784470264,sigmoid,TPESampler,COMPLETE
2344,0.3101768094246859,2025-04-25 08:45:11.878453,2025-04-25 08:45:12.463892,0 days 00:00:00.585439,9.292453950065077,0.026025144496796826,0.011931625560553619,rbf,TPESampler,COMPLETE
2345,0.2994636133038112,2025-04-25 08:45:12.650157,2025-04-25 08:45:13.272675,0 days 00:00:00.622518,1.1224632638225704,0.10450880529669127,0.12947619675037675,rbf,TPESampler,COMPLETE
2346,0.276021336636639,2025-04-25 08:45:13.467213,2025-04-25 08:45:14.048628,0 days 00:00:00.581415,7.857948413242004,0.03618389372847352,0.034231323915462346,rbf,TPESampler,COMPLETE
2347,0.3987721506852042,2025-04-25 08:45:14.242350,2025-04-25 08:45:14.793629,0 days 00:00:00.551279,10.11059068795469,0.14853572643955582,0.403020371012156,rbf,TPESampler,COMPLETE
2348,0.2743426266025928,2025-04-25 08:45:14.985365,2025-04-25 08:45:15.609166,0 days 00:00:00.623801,4.310263326879246,0.010314712625340785,0.04905262997957691,rbf,TPESampler,COMPLETE
2349,0.27052848949924385,2025-04-25 08:45:15.822395,2025-04-25 08:45:16.402912,0 days 00:00:00.580517,3.7106066732049845,0.041372971456347905,0.11647296960542416,rbf,TPESampler,COMPLETE
2350,0.2711142877318989,2025-04-25 08:45:16.596321,2025-04-25 08:45:17.158575,0 days 00:00:00.562254,18.478268673746555,0.08394569564592506,0.08093314258877973,rbf,TPESampler,COMPLETE
2351,0.3621573685489512,2025-04-25 08:45:17.347086,2025-04-25 08:45:17.895097,0 days 00:00:00.548011,0.7156589677118254,0.05348552417332839,0.02972434860766646,rbf,TPESampler,COMPLETE
2352,0.31158334923482617,2025-04-25 08:45:18.084509,2025-04-25 08:45:18.647891,0 days 00:00:00.563382,1.5169627255292766,0.017955361046307,0.03903496253158469,rbf,TPESampler,COMPLETE
2353,0.30360780683796545,2025-04-25 08:45:18.836057,2025-04-25 08:45:19.348093,0 days 00:00:00.512036,2.3337269830351066,0.1773609847797527,0.046585311210774215,rbf,TPESampler,COMPLETE
2354,0.3063533667817402,2025-04-25 08:45:19.544738,2025-04-25 08:45:20.199643,0 days 00:00:00.654905,22.565130538287185,0.031924353957272424,0.1736115354545967,rbf,TPESampler,COMPLETE
2355,0.5722707076462786,2025-04-25 08:45:20.396819,2025-04-25 08:45:20.970617,0 days 00:00:00.573798,7.628357802605723,0.008045396947723887,0.0004482156550559296,sigmoid,TPESampler,COMPLETE
2356,0.2714595971589941,2025-04-25 08:45:21.172927,2025-04-25 08:45:21.774546,0 days 00:00:00.601619,3.5089070648076404,0.03586342485251476,0.05847646768575091,rbf,TPESampler,COMPLETE
2357,0.265654698223071,2025-04-25 08:45:21.975857,2025-04-25 08:45:22.585844,0 days 00:00:00.609987,14.977127320149869,0.06688223274756235,0.061237077345489076,rbf,TPESampler,COMPLETE
2358,0.9628863405189698,2025-04-25 08:45:22.774969,2025-04-25 08:45:23.326231,0 days 00:00:00.551262,0.019900882018200325,0.0014295075057461704,0.0007253530422627353,poly,TPESampler,COMPLETE
2359,0.2696566599695418,2025-04-25 08:45:23.515567,2025-04-25 08:45:24.125240,0 days 00:00:00.609673,3.996170615510423,0.01482219071554808,0.11919284589568556,rbf,TPESampler,COMPLETE
2360,0.2952296120507103,2025-04-25 08:45:24.318993,2025-04-25 08:45:25.125873,0 days 00:00:00.806880,50.06467426851218,0.010218577653107073,0.018946157981085766,rbf,TPESampler,COMPLETE
