number,value,datetime_start,datetime_complete,duration,params_C,params_epsilon,params_gamma,params_kernel,system_attrs_auto:sampler,state
354,0.2769522438534881,2025-04-24 23:40:20.861862,2025-04-24 23:40:21.542440,0 days 00:00:00.680578,2.5167312725159725,0.06253459155187995,0.06546796196033626,rbf,TPESampler,COMPLETE
355,0.27632790949108704,2025-04-24 23:40:21.695842,2025-04-24 23:40:22.223714,0 days 00:00:00.527872,3.827258596737366,0.016349375882739332,0.15415698266713695,rbf,TPESampler,COMPLETE
356,0.4185984490736927,2025-04-24 23:40:22.383281,2025-04-24 23:40:22.996112,0 days 00:00:00.612831,7.453454294279057,0.05404428157730507,0.5464697072111508,rbf,TPESampler,COMPLETE
357,0.26491173609946655,2025-04-24 23:40:23.199618,2025-04-24 23:40:23.756076,0 days 00:00:00.556458,9.601819687425936,0.03303663372847646,0.05760977807241474,rbf,TPESampler,COMPLETE
358,0.3461087784801781,2025-04-24 23:40:23.912257,2025-04-24 23:40:24.402510,0 days 00:00:00.490253,10.747958442241742,0.06364012562614381,0.004516360669713788,rbf,TPESampler,COMPLETE
359,0.31401911823009415,2025-04-24 23:40:24.566524,2025-04-24 23:40:25.095788,0 days 00:00:00.529264,7.6361827010786705,0.021766854554832297,0.012477012559260422,rbf,TPESampler,COMPLETE
360,0.9863461743604174,2025-04-24 23:40:25.255156,2025-04-24 23:40:25.712799,0 days 00:00:00.457643,7.958510413190226,0.6927181450300437,0.0002470269381823884,poly,TPESampler,COMPLETE
361,0.27422351034476383,2025-04-24 23:40:25.874232,2025-04-24 23:40:26.420953,0 days 00:00:00.546721,27.389993722599254,0.04417015834631264,0.039908867873389396,rbf,TPESampler,COMPLETE
362,0.2881182001396094,2025-04-24 23:40:26.579584,2025-04-24 23:40:27.234960,0 days 00:00:00.655376,29.987834919683763,0.013224013706768716,0.1116223746660903,rbf,TPESampler,COMPLETE
363,0.461922526499267,2025-04-24 23:40:27.392489,2025-04-24 23:40:27.841766,0 days 00:00:00.449277,0.054927159994960166,0.3598587303234591,0.003945894083856186,linear,TPESampler,COMPLETE
364,0.27009846585191805,2025-04-24 23:40:27.996903,2025-04-24 23:40:28.548316,0 days 00:00:00.551413,5.309820205112156,0.013829282817717817,0.05040009666508116,rbf,TPESampler,COMPLETE
365,0.2659040569120372,2025-04-24 23:40:28.706020,2025-04-24 23:40:29.219220,0 days 00:00:00.513200,7.873556641771069,0.058446239210256615,0.0607427316452009,rbf,TPESampler,COMPLETE
366,0.6373699878158984,2025-04-24 23:40:29.374390,2025-04-24 23:40:30.033949,0 days 00:00:00.659559,7.108996091207259,0.10031615002864523,0.00021072759083761068,sigmoid,TPESampler,COMPLETE
367,0.3736400412475978,2025-04-24 23:40:30.189652,2025-04-24 23:40:30.697277,0 days 00:00:00.507625,58.518819528529605,0.0928564539544823,0.37750617236782275,rbf,TPESampler,COMPLETE
368,475.52322322484815,2025-04-24 23:40:30.858224,2025-04-24 23:40:31.381060,0 days 00:00:00.522836,23.24212194368638,0.05729256587790886,0.04089741460648554,sigmoid,TPESampler,COMPLETE
369,0.4243608280756399,2025-04-24 23:40:31.547775,2025-04-24 23:40:32.116058,0 days 00:00:00.568283,0.305223157013019,0.017260071440816604,0.00010480916773073046,linear,TPESampler,COMPLETE
370,0.2972997453519938,2025-04-24 23:40:32.271250,2025-04-24 23:40:32.748734,0 days 00:00:00.477484,3.072234920495644,0.07986020430629602,0.032269277103593036,rbf,TPESampler,COMPLETE
371,0.2645616746691511,2025-04-24 23:40:32.911893,2025-04-24 23:40:33.431607,0 days 00:00:00.519714,8.589106854519347,0.059230374136711575,0.07497011081369402,rbf,TPESampler,COMPLETE
372,0.30113163519345937,2025-04-24 23:40:33.592804,2025-04-24 23:40:34.097594,0 days 00:00:00.504790,21.180015890392752,0.11377042811197705,0.020727652846197563,rbf,TPESampler,COMPLETE
373,0.3009595361679607,2025-04-24 23:40:34.252586,2025-04-24 23:40:34.772834,0 days 00:00:00.520248,40.431823360113675,0.0465915020823442,0.13431504354375948,rbf,TPESampler,COMPLETE
374,0.2655907048403053,2025-04-24 23:40:34.935991,2025-04-24 23:40:35.557949,0 days 00:00:00.621958,8.598955137194102,0.0402886398309041,0.07948195329291552,rbf,TPESampler,COMPLETE
375,0.27864057495476324,2025-04-24 23:40:35.714721,2025-04-24 23:40:36.493574,0 days 00:00:00.778853,34.44801831370815,0.13245162924919196,0.04576964177990656,rbf,TPESampler,COMPLETE
376,0.27513111185507066,2025-04-24 23:40:36.658719,2025-04-24 23:40:37.210004,0 days 00:00:00.551285,11.017613623453931,0.039127503291380046,0.12060261799374809,rbf,TPESampler,COMPLETE
377,0.2931379484664092,2025-04-24 23:40:37.374368,2025-04-24 23:40:37.892330,0 days 00:00:00.517962,12.770346655854667,0.11669266789500254,0.13580139244252562,rbf,TPESampler,COMPLETE
378,0.28730185284747783,2025-04-24 23:40:38.053641,2025-04-24 23:40:38.603946,0 days 00:00:00.550305,4.412959043358214,0.02348015347120324,0.18578991681588963,rbf,TPESampler,COMPLETE
379,0.2734999925321697,2025-04-24 23:40:38.770946,2025-04-24 23:40:39.311655,0 days 00:00:00.540709,18.408625633245965,0.045341347423919,0.09545839412689383,rbf,TPESampler,COMPLETE
380,0.276462587520826,2025-04-24 23:40:39.486234,2025-04-24 23:40:40.044513,0 days 00:00:00.558279,10.819905810133692,0.04646134075083856,0.03651702515919886,rbf,TPESampler,COMPLETE
381,0.9638722164657165,2025-04-24 23:40:40.203250,2025-04-24 23:40:40.724769,0 days 00:00:00.521519,0.0023759116323776516,0.09541889156622739,0.0005231961874681357,poly,TPESampler,COMPLETE
382,0.3847214337031937,2025-04-24 23:40:40.893369,2025-04-24 23:40:41.423762,0 days 00:00:00.530393,0.23730921844918978,0.009360496982425718,0.102609667503064,rbf,TPESampler,COMPLETE
383,0.3239190248228113,2025-04-24 23:40:41.583707,2025-04-24 23:40:42.144457,0 days 00:00:00.560750,10.019555752927484,0.011554601958630393,0.2734505441586272,rbf,TPESampler,COMPLETE
384,0.271581859236258,2025-04-24 23:40:42.312678,2025-04-24 23:40:42.831321,0 days 00:00:00.518643,2.9543466685208206,0.06881920790405464,0.10480142368702176,rbf,TPESampler,COMPLETE
385,0.3082188131998756,2025-04-24 23:40:43.030501,2025-04-24 23:40:43.586658,0 days 00:00:00.556157,1.0462388631063189,0.024543944960780936,0.058855360820413864,rbf,TPESampler,COMPLETE
386,0.2785269850592715,2025-04-24 23:40:43.745714,2025-04-24 23:40:44.352283,0 days 00:00:00.606569,6.4588372809359775,0.008402176317419418,0.031080691797935846,rbf,TPESampler,COMPLETE
387,0.26577635864412225,2025-04-24 23:40:44.549575,2025-04-24 23:40:45.101247,0 days 00:00:00.551672,8.692425063665535,0.044258693854134674,0.0757897428463374,rbf,TPESampler,COMPLETE
388,0.5027271226232594,2025-04-24 23:40:45.275751,2025-04-24 23:40:49.181430,0 days 00:00:03.905679,13.458063938074568,0.01658272370598042,0.34592817320416225,linear,TPESampler,COMPLETE
389,0.26546815996821965,2025-04-24 23:40:49.340323,2025-04-24 23:40:49.845712,0 days 00:00:00.505389,7.514944229969144,0.08386787658519579,0.08041148662718152,rbf,TPESampler,COMPLETE
390,0.3534300094465448,2025-04-24 23:40:50.011884,2025-04-24 23:40:50.474654,0 days 00:00:00.462770,26.812344722145532,0.33995941159807375,0.0784856611539795,rbf,TPESampler,COMPLETE
391,0.2689388263219819,2025-04-24 23:40:50.642261,2025-04-24 23:40:51.147325,0 days 00:00:00.505064,5.794055515808639,0.09860819713022917,0.0816752736849106,rbf,TPESampler,COMPLETE
392,0.29132429370369506,2025-04-24 23:40:51.332489,2025-04-24 23:40:51.798887,0 days 00:00:00.466398,2.736207395557053,0.159090962650782,0.05472789495267047,rbf,TPESampler,COMPLETE
393,0.3009983711583764,2025-04-24 23:40:51.959191,2025-04-24 23:40:52.467395,0 days 00:00:00.508204,35.74585721458495,0.05956882968705046,0.13685393559296669,rbf,TPESampler,COMPLETE
394,0.4337041841132135,2025-04-24 23:40:52.627920,2025-04-24 23:40:53.090323,0 days 00:00:00.462403,4.986645142527388,0.21169180689350334,0.4475648980114496,rbf,TPESampler,COMPLETE
395,0.3234411283483644,2025-04-24 23:40:53.244201,2025-04-24 23:40:53.747025,0 days 00:00:00.502824,1.05864164774573,0.07213169093050548,0.21029864751476082,rbf,TPESampler,COMPLETE
396,0.8595504548178424,2025-04-24 23:40:53.913104,2025-04-24 23:55:46.081873,0 days 00:14:52.168769,26.04537626461126,0.053207712427459336,0.07219856695297248,poly,TPESampler,COMPLETE
397,0.9600274243835948,2025-04-24 23:55:46.255089,2025-04-24 23:55:46.819018,0 days 00:00:00.563929,0.0048443917097557325,0.001175936476742791,0.00032652842103067406,sigmoid,TPESampler,COMPLETE
398,48.81235738280453,2025-04-24 23:55:46.991405,2025-04-24 23:55:47.543650,0 days 00:00:00.552245,1.339295489056795,0.03393331861395228,0.9190839256969366,sigmoid,TPESampler,COMPLETE
399,0.2671608257286262,2025-04-24 23:55:47.711509,2025-04-24 23:55:48.260922,0 days 00:00:00.549413,10.679091147589077,0.08536722557298784,0.06322267741923397,rbf,TPESampler,COMPLETE
400,0.33014274733727256,2025-04-24 23:55:48.440267,2025-04-24 23:55:48.971836,0 days 00:00:00.531569,1.762050787774458,0.07400240421458112,0.023409118182367454,rbf,TPESampler,COMPLETE
401,0.2945538931004644,2025-04-24 23:55:49.149758,2025-04-24 23:55:49.721332,0 days 00:00:00.571574,13.058682354508468,0.06170755233803453,0.01451294265780147,rbf,TPESampler,COMPLETE
402,0.4906417249046725,2025-04-24 23:55:49.902127,2025-04-24 23:55:52.667486,0 days 00:00:02.765359,9.911673149270973,0.07493694712056088,0.12060698787850876,linear,TPESampler,COMPLETE
403,0.3193950528163991,2025-04-24 23:55:52.853627,2025-04-24 23:55:53.430777,0 days 00:00:00.577150,11.808311404577841,0.04521758843639541,0.22727189372934054,rbf,TPESampler,COMPLETE
404,0.2873928352957263,2025-04-24 23:55:53.612294,2025-04-24 23:55:54.200009,0 days 00:00:00.587715,3.2642040730550046,0.0529550084076706,0.17039837893977233,rbf,TPESampler,COMPLETE
405,0.26926593494486517,2025-04-24 23:55:54.403489,2025-04-24 23:55:55.021961,0 days 00:00:00.618472,17.83591114517537,0.056683084536106564,0.039142054053307916,rbf,TPESampler,COMPLETE
406,0.2691577808136344,2025-04-24 23:55:55.199831,2025-04-24 23:55:55.835448,0 days 00:00:00.635617,14.28212916735943,0.037102868871655065,0.043755857773993045,rbf,TPESampler,COMPLETE
407,0.2784770411859497,2025-04-24 23:55:56.014640,2025-04-24 23:55:56.597475,0 days 00:00:00.582835,6.379594108205872,0.08026008304903288,0.1282960773397115,rbf,TPESampler,COMPLETE
408,0.2794496604435012,2025-04-24 23:55:56.780047,2025-04-24 23:55:57.398947,0 days 00:00:00.618900,6.292921294733027,0.030008628057831447,0.15172674584718382,rbf,TPESampler,COMPLETE
409,0.3980582693276764,2025-04-24 23:55:57.575750,2025-04-24 23:55:58.124106,0 days 00:00:00.548356,0.5357997165764892,0.060833268122455805,0.01798735785917769,rbf,TPESampler,COMPLETE
410,0.29300956141392276,2025-04-24 23:55:58.302044,2025-04-24 23:55:58.860168,0 days 00:00:00.558124,1.883874551646888,0.04207885570856549,0.05087007219237438,rbf,TPESampler,COMPLETE
411,0.302200341453798,2025-04-24 23:55:59.040855,2025-04-24 23:55:59.743721,0 days 00:00:00.702866,42.887115233964224,0.024350779335434728,0.13331368893613046,rbf,TPESampler,COMPLETE
412,0.508514880834897,2025-04-24 23:55:59.928239,2025-04-24 23:56:23.385712,0 days 00:00:23.457473,61.4705396575582,0.0012251648087098365,0.058391220560788784,linear,TPESampler,COMPLETE
413,0.26394802263340933,2025-04-24 23:56:23.615558,2025-04-24 23:56:24.309204,0 days 00:00:00.693646,11.506090190549276,0.06159807075965576,0.07044023233362778,rbf,TPESampler,COMPLETE
414,0.9589298991902508,2025-04-24 23:56:24.486683,2025-04-24 23:56:25.039577,0 days 00:00:00.552894,0.0021486478327918533,0.00196580593563735,0.0031428460313933167,poly,TPESampler,COMPLETE
415,0.2772973882454799,2025-04-24 23:56:25.222780,2025-04-24 23:56:25.775747,0 days 00:00:00.552967,25.549996930395327,0.08998563078646939,0.08970420489811999,rbf,TPESampler,COMPLETE
416,0.268598999451061,2025-04-24 23:56:25.954242,2025-04-24 23:56:26.518707,0 days 00:00:00.564465,10.506917504068033,0.06926286506998824,0.049275673505571174,rbf,TPESampler,COMPLETE
417,0.2949395787439761,2025-04-24 23:56:26.696251,2025-04-24 23:56:27.566909,0 days 00:00:00.870658,68.8415254374075,0.017794267732367287,0.03208667418190836,rbf,TPESampler,COMPLETE
418,6.999606515314652,2025-04-24 23:56:27.758722,2025-04-25 00:07:50.627016,0 days 00:11:22.868294,19.719676982521204,0.02068931607722926,0.34079852573945535,poly,TPESampler,COMPLETE
419,0.31947602708688966,2025-04-25 00:07:50.942412,2025-04-25 00:07:52.578212,0 days 00:00:01.635800,4.658496464845159,0.08566624416057066,0.015454309484297168,rbf,TPESampler,COMPLETE
420,0.34168483025555435,2025-04-25 00:07:52.941014,2025-04-25 00:07:53.489316,0 days 00:00:00.548302,2.3869942804118396,0.27236018558827,0.027072992642103316,rbf,TPESampler,COMPLETE
421,0.26536207599645933,2025-04-25 00:07:53.666954,2025-04-25 00:07:54.976692,0 days 00:00:01.309738,5.186633191546154,0.03893446147585859,0.06156804023528659,rbf,TPESampler,COMPLETE
422,0.2780074399209606,2025-04-25 00:07:55.329936,2025-04-25 00:07:56.120146,0 days 00:00:00.790210,7.437413334801383,0.14440618837183006,0.06247493484056899,rbf,TPESampler,COMPLETE
423,0.26914315335327144,2025-04-25 00:07:56.508059,2025-04-25 00:07:57.384394,0 days 00:00:00.876335,8.998982456666926,0.05057276007462638,0.048903292818563676,rbf,TPESampler,COMPLETE
424,0.2817240049698091,2025-04-25 00:07:57.592342,2025-04-25 00:07:58.338436,0 days 00:00:00.746094,2.9453101486193702,0.07098216963652769,0.14861243603531563,rbf,TPESampler,COMPLETE
425,0.9533305074963209,2025-04-25 00:07:58.753254,2025-04-25 00:07:59.478112,0 days 00:00:00.724858,0.001220936446341116,0.04311583937205664,0.0029287846162563344,sigmoid,TPESampler,COMPLETE
426,0.676400105594088,2025-04-25 00:07:59.649975,2025-04-25 00:08:00.322353,0 days 00:00:00.672378,18.671320287415586,0.0014505313834601598,0.0070095277054165,poly,TPESampler,COMPLETE
427,0.28963158153233537,2025-04-25 00:08:00.495102,2025-04-25 00:08:01.134869,0 days 00:00:00.639767,81.35773895359314,0.0611747848717187,0.045611894211391064,rbf,TPESampler,COMPLETE
428,0.31497814679816516,2025-04-25 00:08:01.311681,2025-04-25 00:08:01.872029,0 days 00:00:00.560348,1.8757482814688984,0.0368058017316204,0.030099117908255445,rbf,TPESampler,COMPLETE
429,3.1657603689884932,2025-04-25 00:08:02.044663,2025-04-25 00:08:02.582985,0 days 00:00:00.538322,0.12117787963368781,0.003344143938674412,0.243616235359204,sigmoid,TPESampler,COMPLETE
430,0.5410885651110443,2025-04-25 00:08:02.759176,2025-04-25 00:10:51.196808,0 days 00:02:48.437632,3.219474824608456,0.12042026671562892,0.06509019974898554,poly,TPESampler,COMPLETE
431,0.2662628643773803,2025-04-25 00:10:51.364948,2025-04-25 00:10:51.960283,0 days 00:00:00.595335,15.089271761059695,0.04258266805031686,0.04562247552585203,rbf,TPESampler,COMPLETE
432,0.29039956024458485,2025-04-25 00:10:52.113392,2025-04-25 00:10:52.686050,0 days 00:00:00.572658,12.542690462125595,0.023775609264975874,0.015618401615841663,rbf,TPESampler,COMPLETE
433,0.9461827662693866,2025-04-25 00:10:52.848677,2025-04-25 00:10:53.366255,0 days 00:00:00.517578,2.3687503421142306,0.008187647708116695,0.0010248010138919623,poly,TPESampler,COMPLETE
434,0.2994787318645501,2025-04-25 00:10:53.527939,2025-04-25 00:10:54.106263,0 days 00:00:00.578324,31.15760830736849,0.0446791795699951,0.016602930820588016,rbf,TPESampler,COMPLETE
435,0.35488789381649927,2025-04-25 00:10:54.275168,2025-04-25 00:10:54.844635,0 days 00:00:00.569467,27.716481804459605,0.0551570877620506,0.35405325294160545,rbf,TPESampler,COMPLETE
436,0.2764913815729018,2025-04-25 00:10:55.024445,2025-04-25 00:10:55.561710,0 days 00:00:00.537265,5.12929298216697,0.05533267968425044,0.041493597219644816,rbf,TPESampler,COMPLETE
437,0.26575107912158774,2025-04-25 00:10:55.729688,2025-04-25 00:10:56.295414,0 days 00:00:00.565726,7.383960724344355,0.04088437678166187,0.07608554512397789,rbf,TPESampler,COMPLETE
438,0.30276856770916827,2025-04-25 00:10:56.474346,2025-04-25 00:10:57.019129,0 days 00:00:00.544783,8.801788218397927,0.10070642721916655,0.17119587106328968,rbf,TPESampler,COMPLETE
439,0.428584334184285,2025-04-25 00:10:57.192541,2025-04-25 00:10:57.750123,0 days 00:00:00.557582,0.5491300018272599,0.026246565870148585,0.3965446257300826,rbf,TPESampler,COMPLETE
440,0.2955570251030834,2025-04-25 00:10:57.913439,2025-04-25 00:10:58.475327,0 days 00:00:00.561888,8.442772548875187,0.029319548599077122,0.19059141387700998,rbf,TPESampler,COMPLETE
441,0.6623336332978778,2025-04-25 00:10:58.644431,2025-04-25 00:10:59.382585,0 days 00:00:00.738154,0.6482674089448657,0.0556324917829626,0.026835790132476944,poly,TPESampler,COMPLETE
442,0.4973392165920192,2025-04-25 00:10:59.554677,2025-04-25 00:11:01.093547,0 days 00:00:01.538870,4.543193582435507,0.036562340383944125,0.019651514514843024,linear,TPESampler,COMPLETE
443,0.2951938635619431,2025-04-25 00:11:01.270497,2025-04-25 00:11:01.789227,0 days 00:00:00.518730,12.631424705298645,0.21613794688191842,0.06576924917880615,rbf,TPESampler,COMPLETE
444,0.47839534306702447,2025-04-25 00:11:01.950425,2025-04-25 00:11:02.888241,0 days 00:00:00.937816,2.071423970954159,0.15180322787004874,0.06119771241051059,linear,TPESampler,COMPLETE
445,0.3884602956438842,2025-04-25 00:11:03.054528,2025-04-25 00:11:03.604741,0 days 00:00:00.550213,2.752371650354521,0.070006301331944,0.45084816690473467,rbf,TPESampler,COMPLETE
446,0.9448603371384042,2025-04-25 00:11:03.772602,2025-04-25 00:11:04.288408,0 days 00:00:00.515806,0.007372762637733453,0.022980703252863548,0.007292453833507084,poly,TPESampler,COMPLETE
447,0.26576996587397855,2025-04-25 00:11:04.471169,2025-04-25 00:11:05.033831,0 days 00:00:00.562662,4.427276164311084,0.04843222095496946,0.06494718616574235,rbf,TPESampler,COMPLETE
448,827.7110021874256,2025-04-25 00:11:05.200392,2025-04-25 00:11:05.761173,0 days 00:00:00.560781,24.202699125389117,0.017478131498571418,0.8036007227449354,sigmoid,TPESampler,COMPLETE
449,0.31709297179400886,2025-04-25 00:11:05.935195,2025-04-25 00:11:06.469888,0 days 00:00:00.534693,0.8740151122852483,0.10289651085588139,0.06656145979516949,rbf,TPESampler,COMPLETE
450,0.2688248344613387,2025-04-25 00:11:06.652772,2025-04-25 00:11:07.228534,0 days 00:00:00.575762,7.326062354295019,0.04182228853883461,0.051060527755884655,rbf,TPESampler,COMPLETE
451,0.2786009606473137,2025-04-25 00:11:07.406632,2025-04-25 00:11:07.978074,0 days 00:00:00.571442,7.348405607721814,0.07793613747749073,0.1285813753574881,rbf,TPESampler,COMPLETE
452,0.31485413759298164,2025-04-25 00:11:08.147760,2025-04-25 00:11:08.656991,0 days 00:00:00.509231,24.956450690092407,0.1664884419969128,0.010730316793327734,rbf,TPESampler,COMPLETE
453,0.26569762231764693,2025-04-25 00:11:08.831468,2025-04-25 00:11:09.391988,0 days 00:00:00.560520,12.307087188463466,0.05089764883617718,0.0779460548623976,rbf,TPESampler,COMPLETE
454,2.419427615104884,2025-04-25 00:11:09.553211,2025-04-25 00:11:10.067264,0 days 00:00:00.514053,0.09640650218283521,0.1528060471899621,0.04889250529086043,sigmoid,TPESampler,COMPLETE
455,0.28185525807028594,2025-04-25 00:11:10.230609,2025-04-25 00:11:10.721802,0 days 00:00:00.491193,10.255016274189815,0.13067637333216112,0.045797494811349,rbf,TPESampler,COMPLETE
456,53.320684682146464,2025-04-25 00:11:10.941895,2025-04-25 00:11:11.592667,0 days 00:00:00.650772,2.544011806454594,0.08384920827508738,0.13784819267769782,sigmoid,TPESampler,COMPLETE
457,0.3007194278156398,2025-04-25 00:11:11.762372,2025-04-25 00:11:12.256757,0 days 00:00:00.494385,3.2323833285135675,0.10879205424220224,0.031087024221306922,rbf,TPESampler,COMPLETE
458,0.29982443046842727,2025-04-25 00:11:12.414798,2025-04-25 00:11:12.940500,0 days 00:00:00.525702,1.0159123125052225,0.05072994683707045,0.08584212936068401,rbf,TPESampler,COMPLETE
459,0.26746481788174803,2025-04-25 00:11:13.126146,2025-04-25 00:11:13.696378,0 days 00:00:00.570232,16.436014805426975,0.043578151112931306,0.06286688829733283,rbf,TPESampler,COMPLETE
460,0.29435925453085365,2025-04-25 00:11:13.872096,2025-04-25 00:11:14.363123,0 days 00:00:00.491027,2.7522628639251043,0.13429034513193613,0.1525174478446635,rbf,TPESampler,COMPLETE
461,0.3154468237122258,2025-04-25 00:11:14.556272,2025-04-25 00:11:15.080619,0 days 00:00:00.524347,72.17885895094467,0.07694325662371498,0.18976115490996034,rbf,TPESampler,COMPLETE
462,0.2671407055397869,2025-04-25 00:11:15.251624,2025-04-25 00:11:15.805856,0 days 00:00:00.554232,8.593229717217763,0.040776438329298025,0.05351357399655958,rbf,TPESampler,COMPLETE
463,0.30234267598231507,2025-04-25 00:11:15.966148,2025-04-25 00:11:16.547204,0 days 00:00:00.581056,1.271536169104761,0.04672643877062883,0.055407777574626546,rbf,TPESampler,COMPLETE
464,0.5055881372311601,2025-04-25 00:11:16.708193,2025-04-25 00:11:33.714710,0 days 00:00:17.006517,54.54358303844006,0.010398781116059892,0.00014869172847421498,linear,TPESampler,COMPLETE
465,0.28946944761519644,2025-04-25 00:11:33.895059,2025-04-25 00:11:34.434259,0 days 00:00:00.539200,5.36455187806536,0.05058704140393364,0.025531858159561566,rbf,TPESampler,COMPLETE
466,0.27061914982256896,2025-04-25 00:11:34.624604,2025-04-25 00:11:35.183178,0 days 00:00:00.558574,10.777847231622715,0.05801829415044545,0.1021665541818881,rbf,TPESampler,COMPLETE
467,0.34010933569100665,2025-04-25 00:11:35.350879,2025-04-25 00:11:35.894440,0 days 00:00:00.543561,11.522584844905833,0.06742588916750646,0.28966526518451463,rbf,TPESampler,COMPLETE
468,0.2842104291071134,2025-04-25 00:11:36.061576,2025-04-25 00:11:36.577834,0 days 00:00:00.516258,10.38824280041499,0.05739334137074685,0.023336486875718383,rbf,TPESampler,COMPLETE
469,0.27722235190640543,2025-04-25 00:11:36.740802,2025-04-25 00:11:37.269695,0 days 00:00:00.528893,22.138849009089228,0.10502566342273262,0.09131670346840662,rbf,TPESampler,COMPLETE
470,0.320809595403666,2025-04-25 00:11:37.431577,2025-04-25 00:11:37.957485,0 days 00:00:00.525908,3.6082994167413944,0.03539837703559555,0.01717686632873358,rbf,TPESampler,COMPLETE
471,0.3064228459963311,2025-04-25 00:11:38.127661,2025-04-25 00:11:38.712594,0 days 00:00:00.584933,38.5452011702657,0.02253408278633178,0.1810267480146875,rbf,TPESampler,COMPLETE
