number,value,datetime_start,datetime_complete,duration,params_C,params_epsilon,params_gamma,params_kernel,system_attrs_auto:sampler,state
1299,0.3761491356969817,2025-04-25 03:57:38.838773,2025-04-25 03:57:39.382535,0 days 00:00:00.543762,0.3908130615646095,0.010500044575111568,0.22148791280284394,rbf,TPESampler,COMPLETE
1300,0.5929080600218811,2025-04-25 03:57:39.563025,2025-04-25 03:58:44.316383,0 days 00:01:04.753358,3.5689372018366194,0.0013972125968521837,0.03389780493653908,poly,TPESampler,COMPLETE
1301,10.105325322034753,2025-04-25 03:58:44.502982,2025-04-25 03:58:45.069434,0 days 00:00:00.566452,1.3649690125740244,0.002539346841226456,0.010279087176300012,sigmoid,TPESampler,COMPLETE
1302,0.6286220042495629,2025-04-25 03:58:45.249453,2025-04-25 03:58:47.870836,0 days 00:00:02.621383,0.43105921251789453,0.09576506429473186,0.050997882695789906,poly,TPESampler,COMPLETE
1303,281.0607246280783,2025-04-25 03:58:48.043725,2025-04-25 03:58:48.569425,0 days 00:00:00.525700,15.408971824166823,0.007062819048963352,0.20191582291593865,sigmoid,TPESampler,COMPLETE
1304,0.7194810501659694,2025-04-25 03:58:48.741858,2025-04-25 03:58:49.243653,0 days 00:00:00.501795,0.1060810235625351,0.16048559676685795,0.006335826432424025,sigmoid,TPESampler,COMPLETE
1305,0.3020609153760852,2025-04-25 03:58:49.417898,2025-04-25 03:58:49.954991,0 days 00:00:00.537093,0.9834989003230404,0.03614636971693432,0.08081403063636702,rbf,TPESampler,COMPLETE
1306,0.7492126989690548,2025-04-25 03:58:50.127479,2025-04-25 03:58:50.666064,0 days 00:00:00.538585,0.013661539076084429,0.05885232690691534,0.006108790563468092,rbf,TPESampler,COMPLETE
1307,0.28509302718920904,2025-04-25 03:58:50.844546,2025-04-25 03:58:51.371795,0 days 00:00:00.527249,7.107255560460604,0.07654686280085612,0.027526912056248205,rbf,TPESampler,COMPLETE
1308,0.5400444875772638,2025-04-25 03:58:51.548478,2025-04-25 03:58:52.156999,0 days 00:00:00.608521,2.2846130453001647,0.4702151519003347,0.4638928124778177,rbf,TPESampler,COMPLETE
1309,0.9416776103918683,2025-04-25 03:58:52.352009,2025-04-25 03:58:52.966808,0 days 00:00:00.614799,0.0021808868626248474,0.13432402582302835,0.001907838786594557,rbf,TPESampler,COMPLETE
1310,0.2665929332251819,2025-04-25 03:58:53.223639,2025-04-25 03:58:53.845165,0 days 00:00:00.621526,5.336676241833175,0.02600159194648715,0.10039984870504565,rbf,TPESampler,COMPLETE
1311,0.5518806200141343,2025-04-25 03:58:54.021463,2025-04-25 04:00:33.932770,0 days 00:01:39.911307,4.698606596019529,0.006018736388893329,0.05024622107430961,poly,TPESampler,COMPLETE
1312,0.4081271597176976,2025-04-25 04:00:34.116529,2025-04-25 04:00:34.673504,0 days 00:00:00.556975,4.697580092811671,0.008396523276639591,0.5505824995515871,rbf,TPESampler,COMPLETE
1313,0.7728193220771856,2025-04-25 04:00:34.856230,2025-04-25 04:00:35.354122,0 days 00:00:00.497892,0.017375338649710845,0.5074929162197712,0.006086519726251426,rbf,TPESampler,COMPLETE
1314,0.29308356221010196,2025-04-25 04:00:35.533645,2025-04-25 04:00:36.113479,0 days 00:00:00.579834,1.8600474313964552,0.006630751690443818,0.049731190740199036,rbf,TPESampler,COMPLETE
1315,0.2768566090525598,2025-04-25 04:00:36.336426,2025-04-25 04:00:36.900455,0 days 00:00:00.564029,6.327427047690243,0.03469081191187358,0.03566925984513413,rbf,TPESampler,COMPLETE
1316,0.264460587389367,2025-04-25 04:00:37.073069,2025-04-25 04:00:37.632905,0 days 00:00:00.559836,6.7007231323286645,0.07067387521152368,0.08759562278342134,rbf,TPESampler,COMPLETE
1317,0.27046043223282334,2025-04-25 04:00:37.804490,2025-04-25 04:00:38.326732,0 days 00:00:00.522242,3.9214425581351415,0.08530413231553399,0.10263737716990483,rbf,TPESampler,COMPLETE
1318,0.3476702679356923,2025-04-25 04:00:38.632052,2025-04-25 04:00:39.161177,0 days 00:00:00.529125,2.3485124713043075,0.2985975923652028,0.027027661559795396,rbf,TPESampler,COMPLETE
1319,0.38691852894414214,2025-04-25 04:00:39.334866,2025-04-25 04:00:39.800042,0 days 00:00:00.465176,6.3271098325120745,0.43708946628517426,0.05985992172116505,rbf,TPESampler,COMPLETE
1320,0.28330085631800506,2025-04-25 04:00:39.975030,2025-04-25 04:00:40.474393,0 days 00:00:00.499363,11.906566779510602,0.157877250093285,0.08525114141570427,rbf,TPESampler,COMPLETE
1321,0.3023113326251105,2025-04-25 04:00:40.653544,2025-04-25 04:00:41.152924,0 days 00:00:00.499380,1.6677091965567745,0.19153025336405768,0.06894994224903966,rbf,TPESampler,COMPLETE
1322,0.37281279717878074,2025-04-25 04:00:41.381324,2025-04-25 04:00:41.957097,0 days 00:00:00.575773,13.476159597610978,0.003164948557074777,0.0020472789009954775,rbf,TPESampler,COMPLETE
1323,0.33120862127096684,2025-04-25 04:00:42.138652,2025-04-25 04:00:42.633328,0 days 00:00:00.494676,26.0880449492986,0.20364757282644397,0.15363508585141605,rbf,TPESampler,COMPLETE
1324,0.3033419111750232,2025-04-25 04:00:42.806821,2025-04-25 04:00:43.318433,0 days 00:00:00.511612,1.0874625977252097,0.08585652040465903,0.06876014487633063,rbf,TPESampler,COMPLETE
1325,0.4241332925399411,2025-04-25 04:00:43.508970,2025-04-25 04:00:44.360426,0 days 00:00:00.851456,0.10099129521686633,0.007289727526527742,0.08015225169871222,linear,TPESampler,COMPLETE
1326,0.32083697667948097,2025-04-25 04:00:44.533364,2025-04-25 04:00:45.089471,0 days 00:00:00.556107,2.794339335356035,0.04937362979174368,0.2761604954997419,rbf,TPESampler,COMPLETE
1327,0.2736172348531579,2025-04-25 04:00:45.265138,2025-04-25 04:00:45.815266,0 days 00:00:00.550128,17.469528585448632,0.08172534571147755,0.09186499001259989,rbf,TPESampler,COMPLETE
1328,0.2917172088981154,2025-04-25 04:00:45.995065,2025-04-25 04:00:46.530070,0 days 00:00:00.535005,1.793188665789951,0.05591029572081526,0.05507613899163778,rbf,TPESampler,COMPLETE
1329,0.4461132274644945,2025-04-25 04:00:46.703040,2025-04-25 04:00:47.369921,0 days 00:00:00.666881,0.6487098335074974,0.008611675904082445,0.31899102798295637,linear,TPESampler,COMPLETE
1330,71.63795835942251,2025-04-25 04:00:47.548018,2025-04-25 04:00:48.097922,0 days 00:00:00.549904,3.3440485311645287,0.02360220097252452,0.05306203838439535,sigmoid,TPESampler,COMPLETE
1331,0.5839785477764214,2025-04-25 04:00:48.280164,2025-04-25 04:00:48.845044,0 days 00:00:00.564880,4.784873740174999,0.02997428217228958,0.9956480174460078,rbf,TPESampler,COMPLETE
1332,0.3049461833627091,2025-04-25 04:00:49.022035,2025-04-25 04:00:49.557141,0 days 00:00:00.535106,18.883729950068776,0.08262414369185854,0.009656035218724343,rbf,TPESampler,COMPLETE
1333,0.2894746869467543,2025-04-25 04:00:49.733889,2025-04-25 04:00:50.316526,0 days 00:00:00.582637,14.530284876536534,0.08844159036666084,0.13708151152193296,rbf,TPESampler,COMPLETE
1334,0.27774814496525685,2025-04-25 04:00:50.495693,2025-04-25 04:00:51.020851,0 days 00:00:00.525158,3.6952768572268417,0.08229968586400035,0.1291002782006495,rbf,TPESampler,COMPLETE
1335,0.2798169930059465,2025-04-25 04:00:51.200669,2025-04-25 04:00:51.747824,0 days 00:00:00.547155,8.717822133879187,0.0630271677213426,0.0322280211117694,rbf,TPESampler,COMPLETE
1336,0.3939868385936177,2025-04-25 04:00:51.926635,2025-04-25 04:00:52.512552,0 days 00:00:00.585917,0.9287679163274758,0.019001800013489726,0.011827267351598036,rbf,TPESampler,COMPLETE
1337,1.4983036379243344,2025-04-25 04:00:52.688187,2025-04-25 04:00:53.220681,0 days 00:00:00.532494,45.71534282215517,0.03889788824197545,0.0006818736137209133,sigmoid,TPESampler,COMPLETE
1338,0.5404879739089585,2025-04-25 04:00:53.400253,2025-04-25 04:00:54.069936,0 days 00:00:00.669683,13.914820493020246,0.2040263820538435,0.00013393988394263393,rbf,TPESampler,COMPLETE
1339,0.27031749683652295,2025-04-25 04:00:54.261848,2025-04-25 04:00:54.873673,0 days 00:00:00.611825,4.9055424664603935,0.010855009022465136,0.12629370910677307,rbf,TPESampler,COMPLETE
1340,0.35502554907505085,2025-04-25 04:00:55.058093,2025-04-25 04:00:55.586254,0 days 00:00:00.528161,0.7747757169795534,0.09453068191583612,0.25154126786841147,rbf,TPESampler,COMPLETE
1341,0.27817033571267025,2025-04-25 04:00:55.768401,2025-04-25 04:00:56.381041,0 days 00:00:00.612640,2.5665277484321325,0.029522674862283424,0.1501455032470579,rbf,TPESampler,COMPLETE
1342,0.28316330060066547,2025-04-25 04:00:56.577107,2025-04-25 04:00:57.242593,0 days 00:00:00.665486,19.666662272939465,0.011009019582151636,0.029407244445604504,rbf,TPESampler,COMPLETE
1343,0.2884953919355977,2025-04-25 04:00:57.447670,2025-04-25 04:00:58.008224,0 days 00:00:00.560554,15.842098488306005,0.04852783716387062,0.14299372958176074,rbf,TPESampler,COMPLETE
1344,0.5001557622235531,2025-04-25 04:00:58.186851,2025-04-25 04:00:59.400793,0 days 00:00:01.213942,3.3615987947432227,0.004410566608686143,0.014489324914091337,linear,TPESampler,COMPLETE
1345,0.47211080337665284,2025-04-25 04:00:59.580070,2025-04-25 04:01:00.320351,0 days 00:00:00.740281,1.2465671672676317,0.009017316419482965,0.0017097111414257078,linear,TPESampler,COMPLETE
1346,0.31145664609803114,2025-04-25 04:01:00.498760,2025-04-25 04:01:01.213842,0 days 00:00:00.715082,2.208550080487938,0.051076290007126136,0.028838515908337116,rbf,TPESampler,COMPLETE
1347,0.29117546403559474,2025-04-25 04:01:01.392806,2025-04-25 04:01:01.926530,0 days 00:00:00.533724,19.58052993484395,0.08551062278227858,0.024895882367301843,rbf,TPESampler,COMPLETE
1348,0.34780357760194547,2025-04-25 04:01:02.110934,2025-04-25 04:01:02.650851,0 days 00:00:00.539917,21.32362388840942,0.048739025559012855,0.3368803585638966,rbf,TPESampler,COMPLETE
1349,0.2679751285574975,2025-04-25 04:01:02.922288,2025-04-25 04:01:03.479645,0 days 00:00:00.557357,4.55571297439003,0.025888061103484836,0.10542372762101611,rbf,TPESampler,COMPLETE
1350,0.2749516038446124,2025-04-25 04:01:03.659584,2025-04-25 04:01:04.367840,0 days 00:00:00.708256,16.637600247726585,0.004865488255251728,0.08805454235258023,rbf,TPESampler,COMPLETE
1351,0.28036005284497556,2025-04-25 04:01:04.538381,2025-04-25 04:01:05.099257,0 days 00:00:00.560876,5.4281547167114415,0.02777684787006456,0.03354806256692852,rbf,TPESampler,COMPLETE
1352,0.9608223313318698,2025-04-25 04:01:05.276177,2025-04-25 04:01:05.759735,0 days 00:00:00.483558,20.458402324050702,0.8397800558990283,0.0010844644492525959,poly,TPESampler,COMPLETE
1353,0.26548244227420364,2025-04-25 04:01:05.941715,2025-04-25 04:01:06.496129,0 days 00:00:00.554414,6.184757753270564,0.05873959277118436,0.08738370640615593,rbf,TPESampler,COMPLETE
1354,0.32566330330418086,2025-04-25 04:01:06.668771,2025-04-25 04:01:07.188739,0 days 00:00:00.519968,0.6919903890329183,0.09066880545080275,0.15280519702351994,rbf,TPESampler,COMPLETE
1355,0.2802290017369774,2025-04-25 04:01:07.370067,2025-04-25 04:01:07.886902,0 days 00:00:00.516835,22.154942497313872,0.13421987514096123,0.08229166916517018,rbf,TPESampler,COMPLETE
1356,0.2824653137429682,2025-04-25 04:01:08.065335,2025-04-25 04:01:08.579306,0 days 00:00:00.513971,5.4721428180494165,0.14844754112747638,0.06112387854597925,rbf,TPESampler,COMPLETE
1357,0.347479833735281,2025-04-25 04:01:08.753938,2025-04-25 04:01:09.292284,0 days 00:00:00.538346,5.941583323621136,0.06809104455780689,0.32184101259475656,rbf,TPESampler,COMPLETE
1358,0.27005503598843505,2025-04-25 04:01:09.470762,2025-04-25 04:01:09.990990,0 days 00:00:00.520228,3.2959784863281567,0.07880393404407214,0.08428305544080267,rbf,TPESampler,COMPLETE
1359,1739.3385284551664,2025-04-25 04:01:10.174125,2025-04-25 04:01:10.721173,0 days 00:00:00.547048,85.10320988658312,0.001707867140910556,0.14315379406199708,sigmoid,TPESampler,COMPLETE
1360,0.3272133443732142,2025-04-25 04:01:10.899643,2025-04-25 04:01:11.489170,0 days 00:00:00.589527,4.800671147646601,0.13259149266789783,0.01268092843148602,rbf,TPESampler,COMPLETE
1361,0.6034979674946787,2025-04-25 04:01:11.690045,2025-04-25 04:01:12.184277,0 days 00:00:00.494232,0.002215186375316966,0.19122741373121366,0.00025228941010239567,linear,TPESampler,COMPLETE
1362,0.3212937834798558,2025-04-25 04:01:12.362159,2025-04-25 04:01:12.912361,0 days 00:00:00.550202,5.104780682769144,0.13589060237483622,0.20039975806222274,rbf,TPESampler,COMPLETE
1363,0.27599340402311123,2025-04-25 04:01:13.087739,2025-04-25 04:01:13.639097,0 days 00:00:00.551358,16.234953622341017,0.06274819262561754,0.03474973483579575,rbf,TPESampler,COMPLETE
1364,0.30393005125918565,2025-04-25 04:01:13.815897,2025-04-25 04:01:14.398809,0 days 00:00:00.582912,42.2745669101469,0.04733220963059372,0.1523982920536628,rbf,TPESampler,COMPLETE
1365,0.34013329221531186,2025-04-25 04:01:14.577305,2025-04-25 04:01:15.231222,0 days 00:00:00.653917,2.67087292680685,0.2597316372258616,0.15988396680801462,rbf,TPESampler,COMPLETE
1366,0.43486425804114737,2025-04-25 04:01:15.407053,2025-04-25 04:01:16.115570,0 days 00:00:00.708517,0.6719863253712703,0.09794418699919272,0.0006779432046897234,linear,TPESampler,COMPLETE
1367,0.6859953761215511,2025-04-25 04:01:16.289481,2025-04-25 04:04:54.413143,0 days 00:03:38.123662,11.048101591002577,0.04723459578871712,0.061268201338073,poly,TPESampler,COMPLETE
1368,0.33788345947636256,2025-04-25 04:04:54.587563,2025-04-25 04:04:55.289095,0 days 00:00:00.701532,59.962481510220556,0.2843516662620788,0.09025448839603227,rbf,TPESampler,COMPLETE
1369,0.2657582607764182,2025-04-25 04:04:55.466649,2025-04-25 04:04:55.995330,0 days 00:00:00.528681,4.040499518399793,0.057604331651997465,0.08820984487362687,rbf,TPESampler,COMPLETE
1370,0.31767456011928136,2025-04-25 04:04:56.193257,2025-04-25 04:04:56.780732,0 days 00:00:00.587475,1.472461022936755,0.1106474091452943,0.03554262842892724,rbf,TPESampler,COMPLETE
1371,0.46188291704847584,2025-04-25 04:04:56.958783,2025-04-25 04:04:57.489876,0 days 00:00:00.531093,3.211379589360338,0.1258619191037809,0.6048391277125288,rbf,TPESampler,COMPLETE
1372,0.27085975558650693,2025-04-25 04:04:57.657029,2025-04-25 04:04:58.203218,0 days 00:00:00.546189,12.590988031357883,0.08515127982626071,0.09273860660300566,rbf,TPESampler,COMPLETE
1373,0.4870902970654066,2025-04-25 04:04:58.376391,2025-04-25 04:05:00.621793,0 days 00:00:02.245402,5.893220103289054,0.07844282876613454,0.051883861042169445,linear,TPESampler,COMPLETE
1374,0.5065815063654363,2025-04-25 04:05:00.859097,2025-04-25 04:05:26.074174,0 days 00:00:25.215077,80.37302329092789,0.004757006907503583,0.0037609821550292142,linear,TPESampler,COMPLETE
1375,0.35447352257103415,2025-04-25 04:05:26.316450,2025-04-25 04:05:26.847633,0 days 00:00:00.531183,0.3850830112199809,0.02325717687180588,0.14934461143235694,rbf,TPESampler,COMPLETE
1376,0.2815634126884632,2025-04-25 04:05:27.023217,2025-04-25 04:05:27.593307,0 days 00:00:00.570090,3.497469338211718,0.05943324013935646,0.14967516401903258,rbf,TPESampler,COMPLETE
1377,0.26408329437769595,2025-04-25 04:05:27.768700,2025-04-25 04:05:28.442245,0 days 00:00:00.673545,7.059957974235267,0.05751821906767937,0.08593200579788421,rbf,TPESampler,COMPLETE
1378,0.2794288035470864,2025-04-25 04:05:28.622681,2025-04-25 04:05:29.147226,0 days 00:00:00.524545,2.7901539056213496,0.12550602204512404,0.08759738045706283,rbf,TPESampler,COMPLETE
1379,0.30679359962461333,2025-04-25 04:05:29.324216,2025-04-25 04:05:30.084899,0 days 00:00:00.760683,34.810411084980544,0.07891071115270658,0.1590530612777329,rbf,TPESampler,COMPLETE
1380,0.3003267560246056,2025-04-25 04:05:30.405963,2025-04-25 04:05:30.911404,0 days 00:00:00.505441,15.170542323434384,0.13221053334309935,0.024348899388907375,rbf,TPESampler,COMPLETE
1381,0.27347867879516985,2025-04-25 04:05:31.087370,2025-04-25 04:05:31.608866,0 days 00:00:00.521496,21.239379076033032,0.10488720548914364,0.04427552551331467,rbf,TPESampler,COMPLETE
1382,0.3149628188103353,2025-04-25 04:05:31.786024,2025-04-25 04:05:32.306308,0 days 00:00:00.520284,14.350006142952774,0.10567849919813821,0.18103773784664964,rbf,TPESampler,COMPLETE
1383,0.2952988349564037,2025-04-25 04:05:32.479437,2025-04-25 04:05:32.996446,0 days 00:00:00.517009,4.496252055797422,0.093418229667848,0.02718139464206749,rbf,TPESampler,COMPLETE
1384,0.2725213274809864,2025-04-25 04:05:33.173813,2025-04-25 04:05:33.770997,0 days 00:00:00.597184,5.795456320900911,0.04370626260541152,0.12246626289632365,rbf,TPESampler,COMPLETE
1385,0.328606132643325,2025-04-25 04:05:33.958267,2025-04-25 04:05:34.507126,0 days 00:00:00.548859,4.298557772240902,0.03546962714383325,0.3031684030123549,rbf,TPESampler,COMPLETE
1386,0.3107562180381495,2025-04-25 04:05:34.691400,2025-04-25 04:05:35.214369,0 days 00:00:00.522969,1.9357541838492145,0.07727326621268184,0.03255459425739543,rbf,TPESampler,COMPLETE
1387,0.292889233308842,2025-04-25 04:05:35.390318,2025-04-25 04:05:35.907453,0 days 00:00:00.517135,1.1548048900426913,0.07720534864413656,0.09662766943750838,rbf,TPESampler,COMPLETE
1388,0.35589526572478214,2025-04-25 04:05:36.080484,2025-04-25 04:05:36.557539,0 days 00:00:00.477055,11.27792616511261,0.3735995925801034,0.01952638784595464,rbf,TPESampler,COMPLETE
1389,417.79726449139713,2025-04-25 04:05:36.763202,2025-04-25 04:05:37.351173,0 days 00:00:00.587971,23.258691721434364,0.07170258925517799,0.21212568404672072,sigmoid,TPESampler,COMPLETE
1390,0.2699610608915758,2025-04-25 04:05:37.530964,2025-04-25 04:05:38.071222,0 days 00:00:00.540258,11.401383675679812,0.07741094478988064,0.04823339313798302,rbf,TPESampler,COMPLETE
1391,0.45916212766198516,2025-04-25 04:05:38.298048,2025-04-25 04:05:38.927109,0 days 00:00:00.629061,42.69322056657886,0.03928956419056247,0.6623873685304545,rbf,TPESampler,COMPLETE
1392,0.352676462547445,2025-04-25 04:05:39.111383,2025-04-25 04:05:39.638879,0 days 00:00:00.527496,12.999284470342152,0.1322276198697903,0.27165956427399246,rbf,TPESampler,COMPLETE
1393,0.26807770323624935,2025-04-25 04:05:39.816169,2025-04-25 04:05:40.414506,0 days 00:00:00.598337,12.845973236747861,0.04577371797877388,0.04488575413216,rbf,TPESampler,COMPLETE
1394,0.2866868172736156,2025-04-25 04:05:40.591231,2025-04-25 04:05:41.160156,0 days 00:00:00.568925,11.703345509006475,0.03597974063413257,0.15493437552259653,rbf,TPESampler,COMPLETE
1395,0.33769906713950393,2025-04-25 04:05:41.338453,2025-04-25 04:05:41.863346,0 days 00:00:00.524893,4.346855454743161,0.04467778265033766,0.010622413575426592,rbf,TPESampler,COMPLETE
1396,0.29480535023390647,2025-04-25 04:05:42.046225,2025-04-25 04:05:42.615273,0 days 00:00:00.569048,3.8218841941247006,0.05141844096212887,0.19426725746787935,rbf,TPESampler,COMPLETE
1397,0.306710806909094,2025-04-25 04:05:42.790715,2025-04-25 04:05:43.338430,0 days 00:00:00.547715,0.952641897908147,0.02804312556141728,0.07048047853634948,rbf,TPESampler,COMPLETE
1398,0.3475755944380589,2025-04-25 04:05:43.596019,2025-04-25 04:05:44.411030,0 days 00:00:00.815011,0.7072605148458959,0.04709594949126948,0.24436372315725724,rbf,TPESampler,COMPLETE
1399,0.2675902485965794,2025-04-25 04:05:44.587944,2025-04-25 04:05:45.143154,0 days 00:00:00.555210,8.78733770189579,0.07228746528031448,0.0612533102174498,rbf,TPESampler,COMPLETE
1400,0.2860047218189446,2025-04-25 04:05:45.324904,2025-04-25 04:05:45.888596,0 days 00:00:00.563692,63.338619313753995,0.126431677391915,0.04082544401852574,rbf,TPESampler,COMPLETE
1401,0.30431120004695644,2025-04-25 04:05:46.072320,2025-04-25 04:05:46.898978,0 days 00:00:00.826658,74.41639320838104,0.019662174250795916,0.1042113263198209,rbf,TPESampler,COMPLETE
1402,0.32374357400169657,2025-04-25 04:05:47.078261,2025-04-25 04:05:47.696457,0 days 00:00:00.618196,7.764277344526419,0.0014248156036036103,0.009968829353168836,rbf,TPESampler,COMPLETE
1403,0.7892244317966397,2025-04-25 04:05:47.877891,2025-04-25 04:06:02.438954,0 days 00:00:14.561063,1.395666804175223,0.2953782810884771,0.13383269269938725,poly,TPESampler,COMPLETE
1404,0.5046682259313384,2025-04-25 04:06:02.666961,2025-04-25 04:06:03.172171,0 days 00:00:00.505210,32.65296224033463,0.2717905517506382,0.5902636933778116,rbf,TPESampler,COMPLETE
1405,0.353672108519148,2025-04-25 04:06:03.352987,2025-04-25 04:06:03.917197,0 days 00:00:00.564210,2.688337478391335,0.015530324420857677,0.3984334064413394,rbf,TPESampler,COMPLETE
1406,0.2670046919310795,2025-04-25 04:06:04.100778,2025-04-25 04:06:04.673913,0 days 00:00:00.573135,9.811262303402236,0.03692743001903915,0.09243514294122725,rbf,TPESampler,COMPLETE
1407,0.40040552287046777,2025-04-25 04:06:05.083295,2025-04-25 04:06:05.647629,0 days 00:00:00.564334,0.2176894974749836,0.0799288437115229,0.057885086460477735,rbf,TPESampler,COMPLETE
1408,0.2817011861168818,2025-04-25 04:06:05.863238,2025-04-25 04:06:06.517740,0 days 00:00:00.654502,48.029610620511974,0.04469712431786522,0.030006459940104736,rbf,TPESampler,COMPLETE
1409,0.2878612570748395,2025-04-25 04:06:06.692618,2025-04-25 04:06:07.254109,0 days 00:00:00.561491,19.190729939016872,0.040085263399951915,0.1340510314341208,rbf,TPESampler,COMPLETE
1410,0.28016780960137155,2025-04-25 04:06:07.428767,2025-04-25 04:06:07.958977,0 days 00:00:00.530210,3.743997509582845,0.05832372109673667,0.046445638101887315,rbf,TPESampler,COMPLETE
1411,0.344152027624563,2025-04-25 04:06:08.139074,2025-04-25 04:06:08.681198,0 days 00:00:00.542124,1.2492526572632308,0.0453892834989529,0.025173814779413262,rbf,TPESampler,COMPLETE
1412,0.2752176007488782,2025-04-25 04:06:08.860886,2025-04-25 04:06:09.422242,0 days 00:00:00.561356,2.2655923199859354,0.03571768020898249,0.07885783849984622,rbf,TPESampler,COMPLETE
1413,0.9642980947583669,2025-04-25 04:06:09.607914,2025-04-25 04:06:10.157916,0 days 00:00:00.550002,0.0020708723765828596,0.034204715110369606,0.0001380704624046613,poly,TPESampler,COMPLETE
1414,0.2839210854442002,2025-04-25 04:06:10.341635,2025-04-25 04:06:10.880764,0 days 00:00:00.539129,5.013736079306956,0.08936761348953845,0.14176552383015117,rbf,TPESampler,COMPLETE
1415,0.2990534290365224,2025-04-25 04:06:11.059188,2025-04-25 04:06:11.610675,0 days 00:00:00.551487,5.380196124362946,0.033485398223927675,0.020441654143792135,rbf,TPESampler,COMPLETE
1416,0.4432143216643715,2025-04-25 04:06:11.793525,2025-04-25 04:06:12.705617,0 days 00:00:00.912092,0.6018216394799157,0.0011605793853291387,0.1411153368927118,linear,TPESampler,COMPLETE
