number,value,datetime_start,datetime_complete,duration,params_C,params_epsilon,params_gamma,params_kernel,system_attrs_auto:sampler,state
1063,0.2841169218757429,2025-04-25 02:54:05.471245,2025-04-25 02:54:05.968175,0 days 00:00:00.496930,4.676118321676039,0.09073967968639254,0.03885955150510217,rbf,TPESampler,COMPLETE
1064,0.4997107493305717,2025-04-25 02:54:06.143126,2025-04-25 02:54:07.655822,0 days 00:00:01.512696,3.224222174971919,0.014290684929825609,0.06166377756823084,linear,TPESampler,COMPLETE
1065,0.2964971588041126,2025-04-25 02:54:07.830141,2025-04-25 02:54:08.384323,0 days 00:00:00.554182,1.6038831167339402,0.030636408448179154,0.049581433896695504,rbf,TPESampler,COMPLETE
1066,0.26476397558054665,2025-04-25 02:54:08.555439,2025-04-25 02:54:09.113192,0 days 00:00:00.557753,13.22405151350192,0.05153158268716685,0.07030384908173974,rbf,TPESampler,COMPLETE
1067,0.9580012767513174,2025-04-25 02:54:09.288884,2025-04-25 02:54:09.813279,0 days 00:00:00.524395,7.029387751168861,0.0024209777129692825,0.00026024676218428346,poly,TPESampler,COMPLETE
1068,1.1216467066290199,2025-04-25 02:54:09.985568,2025-04-25 03:34:02.548290,0 days 00:39:52.562722,63.753093338886636,0.009150857946315722,0.0934349844091267,poly,TPESampler,COMPLETE
1069,99.54403255958992,2025-04-25 03:07:43.892383,2025-04-25 03:07:44.712221,0 days 00:00:00.819838,4.636880798780242,0.08096345195236043,0.10978472927673914,sigmoid,TPESampler,COMPLETE
1070,0.48338537905492374,2025-04-25 03:07:44.889860,2025-04-25 03:08:01.101097,0 days 00:00:16.211237,93.34677193091305,0.24395444650913076,0.0005546711240916966,linear,TPESampler,COMPLETE
1071,0.27361981594291407,2025-04-25 03:08:01.276970,2025-04-25 03:08:01.884632,0 days 00:00:00.607662,32.659214912463526,0.049844719917357595,0.051559345088128455,rbf,TPESampler,COMPLETE
1072,0.32509861632095316,2025-04-25 03:08:02.057272,2025-04-25 03:08:02.570232,0 days 00:00:00.512960,74.77207625643646,0.11048899482394739,0.20282789696070375,rbf,TPESampler,COMPLETE
1073,0.29024916290612696,2025-04-25 03:08:02.743882,2025-04-25 03:08:03.638798,0 days 00:00:00.894916,56.17997481493119,0.012096679233339819,0.08444541414705319,rbf,TPESampler,COMPLETE
1074,0.3005410305766332,2025-04-25 03:08:03.815279,2025-04-25 03:08:04.341882,0 days 00:00:00.526603,8.69240580499692,0.06500267108580764,0.1857836093026356,rbf,TPESampler,COMPLETE
1075,0.2977323163725535,2025-04-25 03:08:04.516656,2025-04-25 03:08:05.076461,0 days 00:00:00.559805,2.8914308120673198,0.014626098843134944,0.2330447839713506,rbf,TPESampler,COMPLETE
1076,0.27377753727566134,2025-04-25 03:08:05.247190,2025-04-25 03:08:05.852066,0 days 00:00:00.604876,13.402230465056272,0.015677187378714954,0.039856491189119964,rbf,TPESampler,COMPLETE
1077,0.3548737816199504,2025-04-25 03:08:06.023809,2025-04-25 03:08:06.507306,0 days 00:00:00.483497,8.811634010370097,0.232324050233557,0.19361394166348678,rbf,TPESampler,COMPLETE
1078,0.3126571069022762,2025-04-25 03:08:06.677965,2025-04-25 03:08:07.170687,0 days 00:00:00.492722,9.132894951596741,0.09238358791534698,0.01171150191002625,rbf,TPESampler,COMPLETE
1079,0.2960874023082695,2025-04-25 03:08:07.345824,2025-04-25 03:08:07.838506,0 days 00:00:00.492682,18.42943694982852,0.19372896855547575,0.03370967734780679,rbf,TPESampler,COMPLETE
1080,0.2682558687476149,2025-04-25 03:08:08.018183,2025-04-25 03:08:08.590634,0 days 00:00:00.572451,14.413756276783625,0.04267678303076045,0.05957179845499345,rbf,TPESampler,COMPLETE
1081,0.32321590146137247,2025-04-25 03:08:08.763080,2025-04-25 03:08:09.310963,0 days 00:00:00.547883,13.928826979361403,0.0479246810352087,0.2436355424801526,rbf,TPESampler,COMPLETE
1082,0.28440468056065205,2025-04-25 03:08:09.479399,2025-04-25 03:08:10.021867,0 days 00:00:00.542468,10.250896435422773,0.034549840084190625,0.02024329544347098,rbf,TPESampler,COMPLETE
1083,0.2734503018599508,2025-04-25 03:08:10.193544,2025-04-25 03:08:10.717852,0 days 00:00:00.524308,2.3991822581296813,0.06164736972888991,0.07774874237193057,rbf,TPESampler,COMPLETE
1084,0.280670863589406,2025-04-25 03:08:10.890803,2025-04-25 03:08:11.445806,0 days 00:00:00.555003,1.8291202004490152,0.012978603655800136,0.10333514836856661,rbf,TPESampler,COMPLETE
1085,0.2736808793616164,2025-04-25 03:08:11.619058,2025-04-25 03:08:12.156190,0 days 00:00:00.537132,26.842121066595084,0.08903100280806785,0.057240233266882594,rbf,TPESampler,COMPLETE
1086,0.3127209849439333,2025-04-25 03:08:12.325395,2025-04-25 03:08:12.902112,0 days 00:00:00.576717,65.126759005502,0.020750597441335013,0.22199561036578086,rbf,TPESampler,COMPLETE
1087,0.5024949166648037,2025-04-25 03:08:13.076398,2025-04-25 03:08:19.395682,0 days 00:00:06.319284,16.509051601155978,0.018634796973413897,0.0931724064975173,linear,TPESampler,COMPLETE
1088,0.2876400320599764,2025-04-25 03:08:19.567967,2025-04-25 03:08:20.154899,0 days 00:00:00.586932,15.208836829892046,0.02476038621643091,0.022827449491191473,rbf,TPESampler,COMPLETE
1089,0.3844252134835991,2025-04-25 03:08:20.332672,2025-04-25 03:08:20.855479,0 days 00:00:00.522807,0.795973259992714,0.04778086986331097,0.016211104006642826,rbf,TPESampler,COMPLETE
1090,0.2655744781017131,2025-04-25 03:08:21.038692,2025-04-25 03:08:21.632103,0 days 00:00:00.593411,7.007689385828351,0.02292069478288285,0.06597729279165446,rbf,TPESampler,COMPLETE
1091,0.2715315007467655,2025-04-25 03:08:21.806648,2025-04-25 03:08:22.472587,0 days 00:00:00.665939,16.79121034538439,0.015513413637481476,0.05754857356828771,rbf,TPESampler,COMPLETE
1092,0.2696779584337195,2025-04-25 03:08:22.646233,2025-04-25 03:08:23.261558,0 days 00:00:00.615325,12.22850230961561,0.03417032833899097,0.0903140089839163,rbf,TPESampler,COMPLETE
1093,0.30716743633137766,2025-04-25 03:08:23.435857,2025-04-25 03:08:23.988403,0 days 00:00:00.552546,2.4914241264383024,0.004771971345117985,0.029124346615863755,rbf,TPESampler,COMPLETE
1094,0.27052954607795093,2025-04-25 03:08:24.156085,2025-04-25 03:08:24.698338,0 days 00:00:00.542253,3.9812737305948738,0.011757394396941769,0.06168045403672427,rbf,TPESampler,COMPLETE
1095,0.9635515359041434,2025-04-25 03:08:24.865247,2025-04-25 03:08:25.408048,0 days 00:00:00.542801,2.0091226371029753,0.06987829259189247,0.00011226972573713265,poly,TPESampler,COMPLETE
1096,0.31437266107055534,2025-04-25 03:08:25.575242,2025-04-25 03:08:26.162982,0 days 00:00:00.587740,15.5799425276038,0.008694355821203375,0.22603840976507417,rbf,TPESampler,COMPLETE
1097,0.28683408360728335,2025-04-25 03:08:26.341688,2025-04-25 03:08:26.950075,0 days 00:00:00.608387,68.39234504167825,0.05644845365410542,0.04779549861053831,rbf,TPESampler,COMPLETE
1098,0.3045903896702055,2025-04-25 03:08:27.122787,2025-04-25 03:08:27.689695,0 days 00:00:00.566908,9.328195079393135,0.027556908219420514,0.20948379548729673,rbf,TPESampler,COMPLETE
1099,0.2864778120707644,2025-04-25 03:08:27.863405,2025-04-25 03:08:28.494136,0 days 00:00:00.630731,23.178929259214563,0.026209737848562186,0.024513307486577256,rbf,TPESampler,COMPLETE
1100,157.9608920542727,2025-04-25 03:08:28.667081,2025-04-25 03:08:29.193879,0 days 00:00:00.526798,7.6129759436086895,0.02473304372506288,0.13087905408267636,sigmoid,TPESampler,COMPLETE
1101,0.3525485214044522,2025-04-25 03:08:29.367924,2025-04-25 03:08:29.905305,0 days 00:00:00.537381,5.799862561614961,0.01832329886753616,0.005997734222368377,rbf,TPESampler,COMPLETE
1102,0.38774734317401144,2025-04-25 03:08:30.080050,2025-04-25 03:08:30.603793,0 days 00:00:00.523743,2.844447052785376,0.094661874569338,0.42697279821194145,rbf,TPESampler,COMPLETE
1103,0.4372288882999924,2025-04-25 03:08:30.774940,2025-04-25 03:08:31.241910,0 days 00:00:00.466970,1.3288561964303727,0.3168032274967916,0.006117827224035426,rbf,TPESampler,COMPLETE
1104,0.2734075740681916,2025-04-25 03:08:31.419160,2025-04-25 03:08:31.930508,0 days 00:00:00.511348,5.985946789406072,0.0916400687410241,0.05613284283592838,rbf,TPESampler,COMPLETE
1105,0.2781123364741213,2025-04-25 03:08:32.097298,2025-04-25 03:08:32.674297,0 days 00:00:00.576999,30.140317854086067,0.04572847467088383,0.09299335029133134,rbf,TPESampler,COMPLETE
1106,312.89622715428163,2025-04-25 03:08:32.862053,2025-04-25 03:08:33.390312,0 days 00:00:00.528259,14.791279626667727,0.18406310786685615,0.04634168016621673,sigmoid,TPESampler,COMPLETE
1107,0.8763333099312935,2025-04-25 03:08:33.565660,2025-04-25 03:32:33.774913,0 days 00:24:00.209253,30.35741037339518,0.14144263243078592,0.09830541630413837,poly,TPESampler,COMPLETE
1108,0.6054530713145424,2025-04-25 03:32:33.954821,2025-04-25 03:32:34.428119,0 days 00:00:00.473298,0.007137268002001108,0.6067945746389705,0.1586653454351872,linear,TPESampler,COMPLETE
1109,0.28436622319093874,2025-04-25 03:32:34.599352,2025-04-25 03:32:35.368492,0 days 00:00:00.769140,40.97784111919772,0.004821558330531492,0.0381071055172103,rbf,TPESampler,COMPLETE
1110,0.27371990789695466,2025-04-25 03:32:35.537694,2025-04-25 03:32:36.157922,0 days 00:00:00.620228,12.444806425642808,0.008760268246196119,0.041812822855714346,rbf,TPESampler,COMPLETE
1111,0.26675254537622206,2025-04-25 03:32:36.330451,2025-04-25 03:32:36.860795,0 days 00:00:00.530344,6.517560108450324,0.03765217534083764,0.055714934835520556,rbf,TPESampler,COMPLETE
1112,0.5248642010242099,2025-04-25 03:32:37.030100,2025-04-25 03:32:37.581561,0 days 00:00:00.551461,1.685453544946743,0.028246283050171312,0.8179391532691191,rbf,TPESampler,COMPLETE
1113,0.28174498140551024,2025-04-25 03:32:37.752588,2025-04-25 03:32:38.328203,0 days 00:00:00.575615,6.045394837459469,0.01677063091938434,0.16442591368749648,rbf,TPESampler,COMPLETE
1114,0.2907373579727069,2025-04-25 03:32:38.525600,2025-04-25 03:32:39.173979,0 days 00:00:00.648379,9.837996862640106,0.11646882986429663,0.13549922273443585,rbf,TPESampler,COMPLETE
1115,0.2876991342710274,2025-04-25 03:32:39.344495,2025-04-25 03:32:39.877364,0 days 00:00:00.532869,4.867635302110646,0.04508263820257457,0.028856037822414825,rbf,TPESampler,COMPLETE
1116,0.2859529679364228,2025-04-25 03:32:40.046851,2025-04-25 03:32:40.690796,0 days 00:00:00.643945,22.729522562778808,0.016156747826627262,0.12299630732877806,rbf,TPESampler,COMPLETE
1117,2652.4420173481176,2025-04-25 03:32:40.861950,2025-04-25 03:32:41.383741,0 days 00:00:00.521791,76.85056196986146,0.13037406184041048,0.776737759445695,sigmoid,TPESampler,COMPLETE
1118,0.3100792873399733,2025-04-25 03:32:41.688247,2025-04-25 03:32:42.609339,0 days 00:00:00.921092,34.539943322931975,0.09854184344687114,0.0067204036172103425,rbf,TPESampler,COMPLETE
1119,0.2962221401948563,2025-04-25 03:32:42.998701,2025-04-25 03:32:43.955739,0 days 00:00:00.957038,1.3726139467995861,0.015089413525808773,0.06018913383128866,rbf,TPESampler,COMPLETE
1120,0.271330155475986,2025-04-25 03:32:44.249602,2025-04-25 03:32:45.395403,0 days 00:00:01.145801,3.8286212125333607,0.053098739027531386,0.12204749060742874,rbf,TPESampler,COMPLETE
1121,0.29503151338297745,2025-04-25 03:32:45.817990,2025-04-25 03:32:46.662777,0 days 00:00:00.844787,5.5774750990838795,0.1414640744962061,0.03193201982155321,rbf,TPESampler,COMPLETE
1122,0.30529836118721554,2025-04-25 03:32:47.047486,2025-04-25 03:32:47.977784,0 days 00:00:00.930298,18.92347800504506,0.07191090399253136,0.16077783874448168,rbf,TPESampler,COMPLETE
1123,0.2910534961324757,2025-04-25 03:32:48.837406,2025-04-25 03:32:49.702872,0 days 00:00:00.865466,3.8472827284585214,0.022981178863930453,0.029731517824326432,rbf,TPESampler,COMPLETE
1124,0.5095983178106701,2025-04-25 03:32:50.180240,2025-04-25 03:32:51.113770,0 days 00:00:00.933530,0.006325371126806523,0.11882669647376536,0.009467251346534401,linear,TPESampler,COMPLETE
1125,0.27078980389748925,2025-04-25 03:32:51.362582,2025-04-25 03:32:52.314152,0 days 00:00:00.951570,14.679257490805846,0.04370789496676043,0.04041976858073928,rbf,TPESampler,COMPLETE
1126,0.32159041257150617,2025-04-25 03:32:52.637641,2025-04-25 03:32:53.684935,0 days 00:00:01.047294,5.628621158426991,0.030221387766070102,0.27901519747605663,rbf,TPESampler,COMPLETE
1127,0.2697794196332714,2025-04-25 03:32:53.909908,2025-04-25 03:32:54.813527,0 days 00:00:00.903619,18.7902754314751,0.029848849844578373,0.06810763946027582,rbf,TPESampler,COMPLETE
1128,0.31067802838610525,2025-04-25 03:32:54.995394,2025-04-25 03:32:55.520533,0 days 00:00:00.525139,0.9380854961475059,0.06740347072548533,0.15083902289288256,rbf,TPESampler,COMPLETE
1129,0.30312681240896344,2025-04-25 03:32:55.696005,2025-04-25 03:32:56.438594,0 days 00:00:00.742589,86.32135426847063,0.029588407089182655,0.012880094703579675,rbf,TPESampler,COMPLETE
1130,13.718319100696677,2025-04-25 03:32:56.734402,2025-04-25 03:32:57.286264,0 days 00:00:00.551862,0.5808647290250704,0.018041781073286883,0.06702874423735115,sigmoid,TPESampler,COMPLETE
1131,0.3048841956926323,2025-04-25 03:32:57.460972,2025-04-25 03:32:58.011016,0 days 00:00:00.550044,2.183582312651363,0.01599976507040448,0.03288503823055442,rbf,TPESampler,COMPLETE
1132,0.34865092836321554,2025-04-25 03:32:58.200932,2025-04-25 03:32:58.702744,0 days 00:00:00.501812,1.1230134775766696,0.10219807595386807,0.025791875295116125,rbf,TPESampler,COMPLETE
1133,0.4817525503560003,2025-04-25 03:32:58.875903,2025-04-25 03:33:08.319361,0 days 00:00:09.443458,43.977721941834496,0.1686346877671939,0.09430835705574594,linear,TPESampler,COMPLETE
1134,0.2964181213774081,2025-04-25 03:33:08.516991,2025-04-25 03:33:09.052120,0 days 00:00:00.535129,5.581168599208661,0.05178151726863561,0.19087547723185916,rbf,TPESampler,COMPLETE
1135,0.40313159295780476,2025-04-25 03:33:09.227675,2025-04-25 03:33:09.750354,0 days 00:00:00.522679,34.42895897681495,0.08773348545773607,0.4750208434468322,rbf,TPESampler,COMPLETE
1136,26.383759731928986,2025-04-25 03:33:09.924557,2025-04-25 03:33:10.447975,0 days 00:00:00.523418,0.7812928564391065,0.6510626920076652,0.6772714974537631,sigmoid,TPESampler,COMPLETE
1137,0.27051811780699475,2025-04-25 03:33:10.629523,2025-04-25 03:33:11.255644,0 days 00:00:00.626121,6.660199098645273,0.062421989370405495,0.04842767353239328,rbf,TPESampler,COMPLETE
1138,0.48252104502649723,2025-04-25 03:33:11.431708,2025-04-25 03:33:12.994642,0 days 00:00:01.562934,6.928400582999981,0.14054873344461646,0.6765220615574867,linear,TPESampler,COMPLETE
1139,0.28160526656516593,2025-04-25 03:33:13.172496,2025-04-25 03:33:13.701349,0 days 00:00:00.528853,22.708310029755136,0.15207405440731434,0.05930838023061157,rbf,TPESampler,COMPLETE
1140,0.2999047925681311,2025-04-25 03:33:13.868923,2025-04-25 03:33:14.429387,0 days 00:00:00.560464,57.64127904211821,0.04924508423266324,0.12466284012071431,rbf,TPESampler,COMPLETE
1141,0.2937942856503686,2025-04-25 03:33:14.655451,2025-04-25 03:33:15.250387,0 days 00:00:00.594936,4.036980987735888,0.012729202416058225,0.2146138412459051,rbf,TPESampler,COMPLETE
1142,0.2721437891856327,2025-04-25 03:33:15.428567,2025-04-25 03:33:15.985221,0 days 00:00:00.556654,4.7283720879769175,0.023381955049817136,0.04937161065355024,rbf,TPESampler,COMPLETE
1143,0.30686864685717724,2025-04-25 03:33:16.200036,2025-04-25 03:33:16.758108,0 days 00:00:00.558072,1.0424172275999717,0.06910860509922208,0.06360519872054879,rbf,TPESampler,COMPLETE
1144,0.9514167837411812,2025-04-25 03:33:16.941592,2025-04-25 03:33:17.479818,0 days 00:00:00.538226,0.009899510483494887,0.047120807917043296,0.8952667750433776,rbf,TPESampler,COMPLETE
1145,0.2669271306743468,2025-04-25 03:33:17.653227,2025-04-25 03:33:18.217347,0 days 00:00:00.564120,5.125769908090411,0.02369660633192639,0.10203154304218628,rbf,TPESampler,COMPLETE
1146,0.2878734079113113,2025-04-25 03:33:18.392482,2025-04-25 03:33:18.926612,0 days 00:00:00.534130,9.54115084551871,0.04995420867874812,0.01900268968818859,rbf,TPESampler,COMPLETE
1147,0.2691000924214463,2025-04-25 03:33:19.102581,2025-04-25 03:33:19.702267,0 days 00:00:00.599686,15.923939907806743,0.023521943061933007,0.046651571694962785,rbf,TPESampler,COMPLETE
1148,0.31543176979455007,2025-04-25 03:33:19.883264,2025-04-25 03:33:20.445965,0 days 00:00:00.562701,7.967067344612854,0.01043996593485871,0.011685905899371548,rbf,TPESampler,COMPLETE
1149,0.85987019572908,2025-04-25 03:33:20.619124,2025-04-25 03:33:21.164684,0 days 00:00:00.545560,0.05376993713493119,0.005381818804713972,0.0003307045383039741,rbf,TPESampler,COMPLETE
1150,0.27979886882970145,2025-04-25 03:33:21.341177,2025-04-25 03:33:21.881552,0 days 00:00:00.540375,3.942277847217387,0.05116135602794383,0.1468408553579755,rbf,TPESampler,COMPLETE
1151,0.4589481242045128,2025-04-25 03:33:22.127488,2025-04-25 03:33:22.772026,0 days 00:00:00.644538,0.8916121915158877,0.06576651159360888,0.05582354831321946,linear,TPESampler,COMPLETE
1152,0.26750446397073624,2025-04-25 03:33:23.003955,2025-04-25 03:33:23.669577,0 days 00:00:00.665622,12.010234128135894,0.00928773383309113,0.06697674876768009,rbf,TPESampler,COMPLETE
1153,0.3152752043622569,2025-04-25 03:33:23.845490,2025-04-25 03:33:24.492100,0 days 00:00:00.646610,2.872435058980945,0.05888098270482176,0.022549084756088213,rbf,TPESampler,COMPLETE
1154,0.41252362316260816,2025-04-25 03:33:24.670899,2025-04-25 03:33:25.237441,0 days 00:00:00.566542,12.587239146622805,0.03378505854175272,0.5448071903246811,rbf,TPESampler,COMPLETE
1155,0.5019350048860077,2025-04-25 03:33:25.410049,2025-04-25 03:33:29.535767,0 days 00:00:04.125718,12.289466917972206,0.032571878342720045,0.18946789772074252,linear,TPESampler,COMPLETE
1156,0.26971423268630185,2025-04-25 03:33:29.718802,2025-04-25 03:33:30.297551,0 days 00:00:00.578749,20.04031830378885,0.06490104228279774,0.050282390333792275,rbf,TPESampler,COMPLETE
1157,0.30272408908761334,2025-04-25 03:33:30.477067,2025-04-25 03:33:30.971739,0 days 00:00:00.494672,7.468589939250442,0.167940313831446,0.13412020993798965,rbf,TPESampler,COMPLETE
1158,0.26418881118763343,2025-04-25 03:33:31.140859,2025-04-25 03:33:31.693033,0 days 00:00:00.552174,4.887851055357952,0.022982505921293243,0.0855271452228653,rbf,TPESampler,COMPLETE
1159,0.2843786300207597,2025-04-25 03:33:31.870355,2025-04-25 03:33:32.436736,0 days 00:00:00.566381,4.916472610035648,0.010739074582230715,0.17924404295728005,rbf,TPESampler,COMPLETE
1160,0.2935929580406832,2025-04-25 03:33:32.610948,2025-04-25 03:33:33.178905,0 days 00:00:00.567957,1.1644190942429713,0.013810723898974699,0.11782282374262233,rbf,TPESampler,COMPLETE
1161,0.28619806502528494,2025-04-25 03:33:33.355169,2025-04-25 03:33:33.925072,0 days 00:00:00.569903,1.4946326553562541,0.009257501532649537,0.1108182762509908,rbf,TPESampler,COMPLETE
1162,0.2774119078527854,2025-04-25 03:33:34.105310,2025-04-25 03:33:34.652011,0 days 00:00:00.546701,1.9480330856051267,0.02907422284199224,0.11136516391614153,rbf,TPESampler,COMPLETE
1163,0.3959464368476517,2025-04-25 03:33:34.832661,2025-04-25 03:33:35.522847,0 days 00:00:00.690186,0.3327406260695866,0.032363960211053186,0.031555373267944664,rbf,TPESampler,COMPLETE
1164,0.33225964000894453,2025-04-25 03:33:35.708971,2025-04-25 03:33:36.260419,0 days 00:00:00.551448,2.5567681774229123,0.012639667466052253,0.01729305277701946,rbf,TPESampler,COMPLETE
1165,0.26384545382857605,2025-04-25 03:33:36.434166,2025-04-25 03:33:37.008715,0 days 00:00:00.574549,4.169652887371394,0.014738849129209265,0.08829898948776667,rbf,TPESampler,COMPLETE
1166,0.2817727950944104,2025-04-25 03:33:37.179330,2025-04-25 03:33:37.735486,0 days 00:00:00.556156,2.003951278795416,0.005763736146462486,0.08559164816307964,rbf,TPESampler,COMPLETE
1167,0.32747393607780373,2025-04-25 03:33:37.905249,2025-04-25 03:33:38.480782,0 days 00:00:00.575533,25.46824327650901,0.012404755049316391,0.2942401060377751,rbf,TPESampler,COMPLETE
1168,0.5253536029465122,2025-04-25 03:33:38.662143,2025-04-25 03:33:39.250548,0 days 00:00:00.588405,0.8532247475557018,0.009317537551646621,0.7075652485667631,rbf,TPESampler,COMPLETE
1169,0.27920347414335517,2025-04-25 03:33:39.438940,2025-04-25 03:33:40.017861,0 days 00:00:00.578921,6.304257010411664,0.00852168087864479,0.030112423838022862,rbf,TPESampler,COMPLETE
1170,0.3545499993893869,2025-04-25 03:33:40.194871,2025-04-25 03:33:40.761754,0 days 00:00:00.566883,3.3169616377602975,0.0071552673967421885,0.40453101575616407,rbf,TPESampler,COMPLETE
1171,0.3069351234099753,2025-04-25 03:33:40.938741,2025-04-25 03:33:41.497068,0 days 00:00:00.558327,1.173064370652628,0.01179157343741609,0.19024891727749418,rbf,TPESampler,COMPLETE
1172,0.30118888415525197,2025-04-25 03:33:41.671042,2025-04-25 03:33:42.246225,0 days 00:00:00.575183,1.488947645832094,0.01818630046805347,0.048000236664208225,rbf,TPESampler,COMPLETE
1173,0.9278778932720946,2025-04-25 03:33:42.422922,2025-04-25 03:44:47.640918,0 days 00:11:05.217996,3.71159470739694,0.015212835280575918,0.16060855033741653,poly,TPESampler,COMPLETE
1174,0.5000765970484131,2025-04-25 03:34:02.724371,2025-04-25 03:34:05.060343,0 days 00:00:02.335972,6.73985115216603,0.01602951600026615,0.01418830846622544,linear,TPESampler,COMPLETE
1175,36.64405970587391,2025-04-25 03:34:05.252818,2025-04-25 03:34:05.778304,0 days 00:00:00.525486,9.6921985870084,0.8082420812380493,0.006168000579659657,sigmoid,TPESampler,COMPLETE
1176,0.7839818398338203,2025-04-25 03:34:05.947564,2025-04-25 03:34:06.489708,0 days 00:00:00.542144,0.23804084232838096,0.03016644804694276,0.0129369052662236,poly,TPESampler,COMPLETE
1177,0.2676770357185212,2025-04-25 03:34:06.664446,2025-04-25 03:34:07.314788,0 days 00:00:00.650342,9.604064048526508,0.012629582188717719,0.0828461122323948,rbf,TPESampler,COMPLETE
1178,0.2699791486217813,2025-04-25 03:34:07.637314,2025-04-25 03:34:08.273282,0 days 00:00:00.635968,9.465502935321243,0.024213639680522522,0.10410176895843126,rbf,TPESampler,COMPLETE
1179,0.2929810198887406,2025-04-25 03:34:08.452227,2025-04-25 03:34:08.992068,0 days 00:00:00.539841,1.6233341889983255,0.03566289437575604,0.17172286850901453,rbf,TPESampler,COMPLETE
1180,0.32862494074437704,2025-04-25 03:34:09.163714,2025-04-25 03:34:09.700251,0 days 00:00:00.536537,0.7808412735047018,0.014562504599360735,0.05278255954716759,rbf,TPESampler,COMPLETE
