number,value,datetime_start,datetime_complete,duration,params_C,params_epsilon,params_gamma,params_kernel,system_attrs_auto:sampler,state
827,0.28099005587502524,2025-04-25 01:58:35.498594,2025-04-25 01:58:35.987893,0 days 00:00:00.489299,5.083520806824437,0.12838825441962098,0.04960274583727875,rbf,TPESampler,COMPLETE
828,0.30031484606981734,2025-04-25 01:58:36.157676,2025-04-25 01:58:36.718580,0 days 00:00:00.560904,11.46540116499636,0.022886679838915604,0.012739333369972596,rbf,TPESampler,COMPLETE
829,0.2785240433001478,2025-04-25 01:58:36.880981,2025-04-25 01:58:37.404167,0 days 00:00:00.523186,6.40829213189045,0.06836918947116873,0.036988918900840224,rbf,TPESampler,COMPLETE
830,0.9444642305716296,2025-04-25 01:58:37.569299,2025-04-25 01:58:38.075593,0 days 00:00:00.506294,60.775389416360426,0.02833585474396896,0.00038050796732043494,poly,TPESampler,COMPLETE
831,0.2913034069614301,2025-04-25 01:58:38.242283,2025-04-25 01:58:38.987352,0 days 00:00:00.745069,13.499132285345592,0.009224093670543589,0.15801306518677008,rbf,TPESampler,COMPLETE
832,0.41408925156599763,2025-04-25 01:58:39.258201,2025-04-25 01:58:39.935295,0 days 00:00:00.677094,18.38068041145257,0.05959889950467551,0.5297680344657724,rbf,TPESampler,COMPLETE
833,0.2856952421295685,2025-04-25 01:58:40.124154,2025-04-25 01:58:41.010484,0 days 00:00:00.886330,63.163836982673544,0.03257458371625131,0.04058166876253871,rbf,TPESampler,COMPLETE
834,0.2794755786511499,2025-04-25 01:58:41.180029,2025-04-25 01:58:41.702806,0 days 00:00:00.522777,2.9276621251182293,0.04309546533507486,0.055000025336407514,rbf,TPESampler,COMPLETE
835,119.7794721646909,2025-04-25 01:58:41.874184,2025-04-25 01:58:42.400765,0 days 00:00:00.526581,5.730637019818082,0.03369452730313654,0.12604996701811177,sigmoid,TPESampler,COMPLETE
836,0.2665247457254165,2025-04-25 01:58:42.563457,2025-04-25 01:58:43.119527,0 days 00:00:00.556070,4.704253989365498,0.01649308561564751,0.06692681204175448,rbf,TPESampler,COMPLETE
837,21.36489995828927,2025-04-25 01:58:43.287697,2025-04-25 02:14:41.547549,0 days 00:15:58.259852,16.579720847101754,0.24778734492364615,0.6916346183682068,poly,TPESampler,COMPLETE
838,0.28588222801804775,2025-04-25 02:14:41.899874,2025-04-25 02:14:42.454187,0 days 00:00:00.554313,3.9629867269378587,0.055811250461796476,0.1647649115811356,rbf,TPESampler,COMPLETE
839,0.26572139255532023,2025-04-25 02:14:42.619486,2025-04-25 02:14:43.227556,0 days 00:00:00.608070,11.04643860987893,0.041465054401241146,0.06069097970244901,rbf,TPESampler,COMPLETE
840,0.30287657937618945,2025-04-25 02:14:43.394540,2025-04-25 02:14:44.005920,0 days 00:00:00.611380,28.11128626750684,0.02010351540481671,0.13951794354148778,rbf,TPESampler,COMPLETE
841,0.28699518428660864,2025-04-25 02:14:44.170989,2025-04-25 02:14:44.784266,0 days 00:00:00.613277,16.104091922095176,0.016523415353859785,0.02061289221694558,rbf,TPESampler,COMPLETE
842,0.2737532930202986,2025-04-25 02:14:44.953269,2025-04-25 02:14:45.505453,0 days 00:00:00.552184,2.3989131752083326,0.02031022740339157,0.08721035640823024,rbf,TPESampler,COMPLETE
843,0.26962623110772255,2025-04-25 02:14:45.703480,2025-04-25 02:14:46.541078,0 days 00:00:00.837598,18.512581991795194,0.038283861185821444,0.04024084109603115,rbf,TPESampler,COMPLETE
844,0.5054353139881752,2025-04-25 02:14:46.836534,2025-04-25 02:15:04.090286,0 days 00:00:17.253752,55.46667026400066,0.013181023762678672,0.2095561375207529,linear,TPESampler,COMPLETE
845,0.3031109593371123,2025-04-25 02:15:04.254319,2025-04-25 02:15:04.783286,0 days 00:00:00.528967,11.62998075023412,0.05068402115815041,0.012775192151521115,rbf,TPESampler,COMPLETE
846,0.2659288123440382,2025-04-25 02:15:04.944912,2025-04-25 02:15:05.553255,0 days 00:00:00.608343,10.706555000409647,0.02000662168000896,0.06575996857316577,rbf,TPESampler,COMPLETE
847,0.37517043385405796,2025-04-25 02:15:05.719253,2025-04-25 02:15:06.246657,0 days 00:00:00.527404,0.7485982745159769,0.03956050474969424,0.33398239360043086,rbf,TPESampler,COMPLETE
848,0.443519739680202,2025-04-25 02:15:06.407906,2025-04-25 02:15:07.035706,0 days 00:00:00.627800,0.6898245577586709,0.0542422916809534,0.01699380997309084,linear,TPESampler,COMPLETE
849,0.266462709393227,2025-04-25 02:15:07.202296,2025-04-25 02:15:07.729233,0 days 00:00:00.526937,10.299442633091159,0.05574975270507531,0.08713933433015252,rbf,TPESampler,COMPLETE
850,0.36311931092258504,2025-04-25 02:15:07.892108,2025-04-25 02:15:08.420948,0 days 00:00:00.528840,0.7456484468019399,0.034122255902575414,0.028788559265801938,rbf,TPESampler,COMPLETE
851,0.30281560222794757,2025-04-25 02:15:08.587438,2025-04-25 02:15:09.120080,0 days 00:00:00.532642,50.366348164348736,0.05369294891757078,0.14516653646643726,rbf,TPESampler,COMPLETE
852,0.28562944479905295,2025-04-25 02:15:09.283386,2025-04-25 02:15:09.824277,0 days 00:00:00.540891,5.207671468587071,0.029722458464519125,0.028326850836680306,rbf,TPESampler,COMPLETE
853,0.2855799065708212,2025-04-25 02:15:09.983849,2025-04-25 02:15:10.549635,0 days 00:00:00.565786,12.28985907944189,0.0200880213249178,0.15170340804996826,rbf,TPESampler,COMPLETE
854,0.30967617200490644,2025-04-25 02:15:10.710030,2025-04-25 02:15:11.215166,0 days 00:00:00.505136,1.1552181293053274,0.055246395137415125,0.04886155226079959,rbf,TPESampler,COMPLETE
855,0.2806437004854989,2025-04-25 02:15:11.376040,2025-04-25 02:15:12.085549,0 days 00:00:00.709509,29.05897514063035,0.011811551623200424,0.051351829870513496,rbf,TPESampler,COMPLETE
856,0.2669068336092282,2025-04-25 02:15:12.255171,2025-04-25 02:15:12.821111,0 days 00:00:00.565940,5.682293199870233,0.0228199363453985,0.1090360494614521,rbf,TPESampler,COMPLETE
857,0.28660408456397196,2025-04-25 02:15:12.989142,2025-04-25 02:15:13.547937,0 days 00:00:00.558795,41.675851577322724,0.07424094528049816,0.023309548236175665,rbf,TPESampler,COMPLETE
858,0.37290238075241927,2025-04-25 02:15:13.711194,2025-04-25 02:15:14.233226,0 days 00:00:00.522032,0.5518475456468822,0.009392532422441284,0.03245090949871206,rbf,TPESampler,COMPLETE
859,0.2667621658187207,2025-04-25 02:15:14.408965,2025-04-25 02:15:14.955752,0 days 00:00:00.546787,5.222433263799561,0.048446726150562204,0.057191594467633985,rbf,TPESampler,COMPLETE
860,0.27788363846043357,2025-04-25 02:15:15.125022,2025-04-25 02:15:15.703424,0 days 00:00:00.578402,6.552486888372152,0.017616164912392224,0.032636805051916164,rbf,TPESampler,COMPLETE
861,0.28874854571227276,2025-04-25 02:15:15.869499,2025-04-25 02:15:16.414832,0 days 00:00:00.545333,2.0978350378528026,0.021494122781492986,0.19343847130758357,rbf,TPESampler,COMPLETE
862,0.49832455671067294,2025-04-25 02:15:16.582057,2025-04-25 02:15:17.688075,0 days 00:00:01.106018,3.102808586681136,0.03526076509153967,0.08796672365411656,linear,TPESampler,COMPLETE
863,0.2672782996412631,2025-04-25 02:15:17.855687,2025-04-25 02:15:18.372890,0 days 00:00:00.517203,9.035933339061305,0.07140146279224824,0.0654889060504924,rbf,TPESampler,COMPLETE
864,0.27389361785595223,2025-04-25 02:15:18.542951,2025-04-25 02:15:19.098128,0 days 00:00:00.555177,9.356150545862768,0.03640346822159652,0.12213699501669477,rbf,TPESampler,COMPLETE
865,0.5259804099523634,2025-04-25 02:15:19.266157,2025-04-25 02:24:01.694098,0 days 00:08:42.427941,1.2072764862203351,0.043557208191215765,0.09954733044331131,poly,TPESampler,COMPLETE
866,0.28014729959784024,2025-04-25 02:24:01.857994,2025-04-25 02:24:02.436093,0 days 00:00:00.578099,44.17708338665912,0.0425469467999081,0.06739822937816495,rbf,TPESampler,COMPLETE
867,0.29691866341751055,2025-04-25 02:24:02.600026,2025-04-25 02:24:03.102265,0 days 00:00:00.502239,11.482991335543973,0.08135895775087658,0.014582075355300551,rbf,TPESampler,COMPLETE
868,0.5565086241292231,2025-04-25 02:24:03.266525,2025-04-25 02:24:03.807919,0 days 00:00:00.541394,2.7700585839314638,0.6573366116795443,0.003451243131045383,linear,TPESampler,COMPLETE
869,0.3251528029887346,2025-04-25 02:24:03.975791,2025-04-25 02:24:04.456022,0 days 00:00:00.480231,1.8109487429086133,0.17337685700801342,0.2124115722460479,rbf,TPESampler,COMPLETE
870,0.33072408623066046,2025-04-25 02:24:04.623613,2025-04-25 02:24:05.155051,0 days 00:00:00.531438,2.4898523271218846,0.022407761651797326,0.01810357342138037,rbf,TPESampler,COMPLETE
871,1682.971273579556,2025-04-25 02:24:05.321525,2025-04-25 02:24:05.832168,0 days 00:00:00.510643,87.63724566662171,0.029707151368965425,0.17705859928903922,sigmoid,TPESampler,COMPLETE
872,0.32837160022528317,2025-04-25 02:24:05.994542,2025-04-25 02:24:06.509857,0 days 00:00:00.515315,6.882778620663735,0.04770617819991443,0.2796280290646687,rbf,TPESampler,COMPLETE
873,0.5705240719079105,2025-04-25 02:24:06.670621,2025-04-25 02:24:27.085876,0 days 00:00:20.415255,13.812774766447665,0.007344667365185217,0.0273542493800428,poly,TPESampler,COMPLETE
874,0.2926085309402424,2025-04-25 02:24:27.255017,2025-04-25 02:24:27.757839,0 days 00:00:00.502822,1.1585339321627377,0.061038575900987685,0.11283489726412989,rbf,TPESampler,COMPLETE
875,0.3186398349978894,2025-04-25 02:24:28.104490,2025-04-25 02:24:28.668532,0 days 00:00:00.564042,36.49209576007958,0.023135350519354732,0.004667118184787193,rbf,TPESampler,COMPLETE
876,0.3018050459289082,2025-04-25 02:24:28.836118,2025-04-25 02:24:29.343724,0 days 00:00:00.507606,2.118450671757767,0.048117022657001136,0.03485542158892462,rbf,TPESampler,COMPLETE
877,0.2709160676905219,2025-04-25 02:24:29.508794,2025-04-25 02:24:30.096734,0 days 00:00:00.587940,5.680526924639968,0.005452791196853019,0.12083583951430293,rbf,TPESampler,COMPLETE
878,0.26855361676270517,2025-04-25 02:24:30.258164,2025-04-25 02:24:30.874695,0 days 00:00:00.616531,17.964482745643203,0.023502425472518847,0.04796209140800183,rbf,TPESampler,COMPLETE
879,0.2708650859623429,2025-04-25 02:24:31.036114,2025-04-25 02:24:31.550161,0 days 00:00:00.514047,14.369299709453431,0.07591558774295679,0.09129084508231759,rbf,TPESampler,COMPLETE
880,0.5622220347309188,2025-04-25 02:24:31.712356,2025-04-25 02:24:32.235169,0 days 00:00:00.522813,15.673233810795342,0.013601880467372644,0.9450254761235285,rbf,TPESampler,COMPLETE
881,0.3071811533047448,2025-04-25 02:24:32.397133,2025-04-25 02:24:33.099950,0 days 00:00:00.702817,99.86189299501974,0.024988062951441813,0.08413512203022872,rbf,TPESampler,COMPLETE
882,0.2725714504884221,2025-04-25 02:24:33.258735,2025-04-25 02:24:33.803880,0 days 00:00:00.545145,7.260818916886423,0.031286803162128986,0.039388745531246966,rbf,TPESampler,COMPLETE
883,0.2853187548678272,2025-04-25 02:24:33.962172,2025-04-25 02:24:34.481867,0 days 00:00:00.519695,6.9127834625007525,0.08016344238281563,0.14628605279350812,rbf,TPESampler,COMPLETE
884,0.28289360810003406,2025-04-25 02:24:34.643173,2025-04-25 02:24:35.195408,0 days 00:00:00.552235,2.845946531940913,0.010722702389049791,0.05136573720394409,rbf,TPESampler,COMPLETE
885,0.2747007288926555,2025-04-25 02:24:35.386966,2025-04-25 02:24:35.922400,0 days 00:00:00.535434,6.344450888408981,0.03253217050440461,0.1338169644102436,rbf,TPESampler,COMPLETE
886,0.27789429949865696,2025-04-25 02:24:36.088055,2025-04-25 02:24:36.899526,0 days 00:00:00.811471,8.688119981641545,0.05373981742668952,0.03296464565672857,rbf,TPESampler,COMPLETE
887,0.29478399112590137,2025-04-25 02:24:37.064018,2025-04-25 02:24:37.588721,0 days 00:00:00.524703,1.1264316031584458,0.01752786081279439,0.10731427631256062,rbf,TPESampler,COMPLETE
888,0.7741733764874441,2025-04-25 02:24:37.752670,2025-04-25 02:24:38.267915,0 days 00:00:00.515245,0.015753726348037084,0.0026416456592674377,0.01490922192729035,sigmoid,TPESampler,COMPLETE
889,0.2880463733859723,2025-04-25 02:24:38.426371,2025-04-25 02:24:38.928321,0 days 00:00:00.501950,1.3096365189006478,0.06046148725918258,0.11532428751215558,rbf,TPESampler,COMPLETE
890,0.4977675268019287,2025-04-25 02:24:39.093744,2025-04-25 02:24:40.245725,0 days 00:00:01.151981,2.2720347131091505,0.02387898777709737,0.4625191995922798,linear,TPESampler,COMPLETE
891,0.3738402170489367,2025-04-25 02:24:40.410682,2025-04-25 02:24:40.931925,0 days 00:00:00.521243,1.1981834743492508,0.05591563400872884,0.014464955502622705,rbf,TPESampler,COMPLETE
892,0.31519417617995815,2025-04-25 02:24:41.099473,2025-04-25 02:24:41.590417,0 days 00:00:00.490944,2.459582347112811,0.08366092351002112,0.02607180905899049,rbf,TPESampler,COMPLETE
893,1.09722793641185,2025-04-25 02:24:41.755619,2025-04-25 02:45:57.416024,0 days 00:21:15.660405,9.47666655283423,0.013316562133117667,0.1629815060586496,poly,TPESampler,COMPLETE
894,0.2655488388937166,2025-04-25 02:41:03.059235,2025-04-25 02:41:03.639466,0 days 00:00:00.580231,6.027122828505419,0.030805323050601994,0.06278742339178266,rbf,TPESampler,COMPLETE
895,0.29469529633573455,2025-04-25 02:41:03.806634,2025-04-25 02:41:04.378096,0 days 00:00:00.571462,6.597663666274437,0.018854405047162525,0.01995203274816901,rbf,TPESampler,COMPLETE
896,0.27211588863948777,2025-04-25 02:41:04.546583,2025-04-25 02:41:05.174781,0 days 00:00:00.628198,15.051135610833555,0.00788617319892251,0.044664771843664755,rbf,TPESampler,COMPLETE
897,0.34265483163711696,2025-04-25 02:41:05.360501,2025-04-25 02:41:05.915774,0 days 00:00:00.555273,3.8896682450892452,0.032191710609405136,0.34840412660534903,rbf,TPESampler,COMPLETE
898,1.2031052990846978,2025-04-25 02:41:06.083343,2025-04-25 02:41:14.508365,0 days 00:00:08.425022,0.41631375559491063,0.9711201851425775,0.5142355692203506,poly,TPESampler,COMPLETE
899,0.38897468055355183,2025-04-25 02:41:14.755008,2025-04-25 02:41:15.581898,0 days 00:00:00.826890,0.3658209319671475,0.004877936130181395,0.2356001496210527,rbf,TPESampler,COMPLETE
900,0.6761750000338803,2025-04-25 02:41:15.755344,2025-04-25 02:41:16.237846,0 days 00:00:00.482502,0.023692361452637947,0.329382823569706,0.06738050061780586,rbf,TPESampler,COMPLETE
901,187.057942640394,2025-04-25 02:41:16.405755,2025-04-25 02:41:16.935023,0 days 00:00:00.529268,8.687941694765085,0.06490881739012094,0.05530898173922485,sigmoid,TPESampler,COMPLETE
902,0.27793224455101456,2025-04-25 02:41:17.102664,2025-04-25 02:41:17.684095,0 days 00:00:00.581431,13.221448895937689,0.018914690348462923,0.13163489419905136,rbf,TPESampler,COMPLETE
903,0.2835223544699616,2025-04-25 02:41:17.853819,2025-04-25 02:41:18.395554,0 days 00:00:00.541735,3.767511558053271,0.029565475950281847,0.03903254838754667,rbf,TPESampler,COMPLETE
904,0.2917433733086518,2025-04-25 02:41:18.567762,2025-04-25 02:41:19.158138,0 days 00:00:00.590376,18.238099680331946,0.033195947946255064,0.020645471369549778,rbf,TPESampler,COMPLETE
905,0.2734448352167222,2025-04-25 02:41:19.324269,2025-04-25 02:41:19.893714,0 days 00:00:00.569445,2.6536982158925584,0.01250834264656107,0.12984563316817735,rbf,TPESampler,COMPLETE
906,0.26662420021243377,2025-04-25 02:41:20.060657,2025-04-25 02:41:20.722005,0 days 00:00:00.661348,10.307619057293236,0.027150934264597776,0.06937398950623304,rbf,TPESampler,COMPLETE
907,0.295179895465176,2025-04-25 02:41:20.885854,2025-04-25 02:41:21.398467,0 days 00:00:00.512613,91.91411903658725,0.09559404765665011,0.11319862054396748,rbf,TPESampler,COMPLETE
908,0.2986122496844591,2025-04-25 02:41:21.566795,2025-04-25 02:41:22.072542,0 days 00:00:00.505747,3.2571159918122925,0.07161691162930084,0.02946075124383738,rbf,TPESampler,COMPLETE
909,0.4987768957953808,2025-04-25 02:41:22.233050,2025-04-25 02:41:24.717440,0 days 00:00:02.484390,7.048187318900499,0.04206906031719521,0.0028988610471581432,linear,TPESampler,COMPLETE
910,0.294223530841495,2025-04-25 02:41:24.889131,2025-04-25 02:41:25.426630,0 days 00:00:00.537499,1.5427033973735838,0.022523127615508693,0.05648904736946936,rbf,TPESampler,COMPLETE
911,0.27588915605906733,2025-04-25 02:41:25.596785,2025-04-25 02:41:26.119333,0 days 00:00:00.522548,2.7969258298658417,0.049833157314632025,0.06119615560497903,rbf,TPESampler,COMPLETE
912,0.27088856885267054,2025-04-25 02:41:26.291434,2025-04-25 02:41:26.814509,0 days 00:00:00.523075,20.276353762068457,0.09690024086594337,0.0475089543195458,rbf,TPESampler,COMPLETE
913,0.26965372460818027,2025-04-25 02:41:26.985290,2025-04-25 02:41:27.581246,0 days 00:00:00.595956,17.306450840553886,0.02695203757679867,0.0712399138656167,rbf,TPESampler,COMPLETE
914,0.43184667670262267,2025-04-25 02:41:27.753390,2025-04-25 02:41:28.258607,0 days 00:00:00.505217,3.90133254417298,0.14316172763738738,0.5089412608048248,rbf,TPESampler,COMPLETE
915,0.859934668041033,2025-04-25 02:41:28.442372,2025-04-25 02:41:28.965277,0 days 00:00:00.522905,0.08911940267044097,0.0017491750600318204,0.010390008007649594,poly,TPESampler,COMPLETE
916,0.30784351610633254,2025-04-25 02:41:29.128803,2025-04-25 02:41:29.680625,0 days 00:00:00.551822,14.171407798863315,0.048827367488862974,0.1859111950774891,rbf,TPESampler,COMPLETE
917,0.30465297759530874,2025-04-25 02:41:29.888531,2025-04-25 02:41:30.450726,0 days 00:00:00.562195,3.4139937293973968,0.011610481862442977,0.02433913338730085,rbf,TPESampler,COMPLETE
918,0.26666070554037374,2025-04-25 02:41:30.621463,2025-04-25 02:41:31.157560,0 days 00:00:00.536097,4.0298303081377,0.042952583637981545,0.09708533852743315,rbf,TPESampler,COMPLETE
919,0.30080474262044715,2025-04-25 02:41:31.330154,2025-04-25 02:41:31.867340,0 days 00:00:00.537186,11.439108392502728,0.15487159316829838,0.017134309436123384,rbf,TPESampler,COMPLETE
920,0.31421386930601014,2025-04-25 02:41:32.046351,2025-04-25 02:41:32.590532,0 days 00:00:00.544181,7.361991304294604,0.036099989352624304,0.012646469700332274,rbf,TPESampler,COMPLETE
921,0.28203098419953093,2025-04-25 02:41:32.758757,2025-04-25 02:41:33.337378,0 days 00:00:00.578621,6.218711035949622,0.014315774745993985,0.16594982476973089,rbf,TPESampler,COMPLETE
922,0.28811175658730476,2025-04-25 02:41:33.509348,2025-04-25 02:41:34.045258,0 days 00:00:00.535910,1.9089229967197732,0.03321264462970836,0.17495443406817046,rbf,TPESampler,COMPLETE
923,0.5744884974052687,2025-04-25 02:41:34.209295,2025-04-25 02:41:34.739459,0 days 00:00:00.530164,0.19142818402440454,0.04641940373746052,0.0054220687182166055,rbf,TPESampler,COMPLETE
924,0.33967958109234303,2025-04-25 02:41:34.911547,2025-04-25 02:41:35.455073,0 days 00:00:00.543526,71.64223107017015,0.03116756308717059,0.3251932888911256,rbf,TPESampler,COMPLETE
925,0.2869509110053539,2025-04-25 02:41:35.625909,2025-04-25 02:41:36.122318,0 days 00:00:00.496409,1.9060969260385656,0.13637712008223746,0.07696569806176735,rbf,TPESampler,COMPLETE
926,0.267027852152121,2025-04-25 02:41:36.296088,2025-04-25 02:41:36.930562,0 days 00:00:00.634474,13.861357703482831,0.017373814284050597,0.05392091835812652,rbf,TPESampler,COMPLETE
927,0.4958643443382354,2025-04-25 02:41:37.107119,2025-04-25 02:41:47.597906,0 days 00:00:10.490787,25.606346991174668,0.057667584010228805,0.18421503119056948,linear,TPESampler,COMPLETE
928,0.28440515597793314,2025-04-25 02:41:47.840808,2025-04-25 02:41:48.645035,0 days 00:00:00.804227,13.66759204039058,0.055515178466451265,0.027972112707161555,rbf,TPESampler,COMPLETE
929,0.2727974130134667,2025-04-25 02:41:48.814172,2025-04-25 02:41:49.367943,0 days 00:00:00.553771,9.463310215766276,0.04841371776840121,0.11515307339406322,rbf,TPESampler,COMPLETE
930,0.4654579338822067,2025-04-25 02:41:49.540568,2025-04-25 02:41:50.074123,0 days 00:00:00.533555,0.01756750243489974,0.027947553631623885,0.9843832634096206,linear,TPESampler,COMPLETE
931,0.285289761295404,2025-04-25 02:41:50.246498,2025-04-25 02:41:50.738472,0 days 00:00:00.491974,13.983971746178632,0.14137658751721807,0.10707967505678899,rbf,TPESampler,COMPLETE
932,0.29643601176396006,2025-04-25 02:41:50.906551,2025-04-25 02:41:51.423726,0 days 00:00:00.517175,1.140048484947253,0.034137797161178145,0.078976010021527,rbf,TPESampler,COMPLETE
933,0.28227352114414606,2025-04-25 02:41:51.594338,2025-04-25 02:41:52.202300,0 days 00:00:00.607962,42.576145967943056,0.04967125908349098,0.037301702906986624,rbf,TPESampler,COMPLETE
934,0.43537341934955787,2025-04-25 02:41:52.439727,2025-04-25 02:41:53.140069,0 days 00:00:00.700342,5.449087488595522,0.055398380713185674,0.5899341348107098,rbf,TPESampler,COMPLETE
935,0.28326909129522965,2025-04-25 02:41:53.304762,2025-04-25 02:41:53.845706,0 days 00:00:00.540944,3.458083080743484,0.034743069131314724,0.0431527098787842,rbf,TPESampler,COMPLETE
936,0.3106470225004285,2025-04-25 02:41:54.010438,2025-04-25 02:41:54.577172,0 days 00:00:00.566734,13.817255857452935,0.021905674771636456,0.20030242420997316,rbf,TPESampler,COMPLETE
937,0.29065613643822164,2025-04-25 02:41:54.750613,2025-04-25 02:41:55.376057,0 days 00:00:00.625444,20.46940398387113,0.014180255041169824,0.01633551965589703,rbf,TPESampler,COMPLETE
938,0.2903730015839507,2025-04-25 02:41:55.549103,2025-04-25 02:41:56.038778,0 days 00:00:00.489675,7.023702685538353,0.14642978405073304,0.036567483273985554,rbf,TPESampler,COMPLETE
939,0.5003282004226925,2025-04-25 02:41:56.206252,2025-04-25 02:41:58.181662,0 days 00:00:01.975410,4.511989601450815,0.005827355951855007,0.10846432767490925,linear,TPESampler,COMPLETE
940,0.3573496383028454,2025-04-25 02:41:58.355720,2025-04-25 02:41:58.879725,0 days 00:00:00.524005,0.374770860481951,0.049030029006149584,0.14381120029547406,rbf,TPESampler,COMPLETE
941,0.6493227193748861,2025-04-25 02:41:59.047027,2025-04-25 02:42:00.422449,0 days 00:00:01.375422,20.988640681817984,0.06619363598387891,0.010777108323784729,poly,TPESampler,COMPLETE
942,0.30306248112480355,2025-04-25 02:42:00.704795,2025-04-25 02:42:01.254449,0 days 00:00:00.549654,3.87352914522912,0.02387511183323783,0.023034172628863814,rbf,TPESampler,COMPLETE
943,0.3171048168251278,2025-04-25 02:42:01.422648,2025-04-25 02:42:01.978911,0 days 00:00:00.556263,2.3995823313193987,0.014332534203145765,0.3018396920844579,rbf,TPESampler,COMPLETE
944,0.27598331339935817,2025-04-25 02:42:02.151148,2025-04-25 02:42:02.681328,0 days 00:00:00.530180,3.052498231495234,0.05295393967809871,0.0572504071186773,rbf,TPESampler,COMPLETE
