number,value,datetime_start,datetime_complete,duration,params_C,params_epsilon,params_gamma,params_kernel,system_attrs_auto:sampler,state
2479,290.1784222156496,2025-04-25 09:18:16.206366,2025-04-25 09:18:16.773491,0 days 00:00:00.567125,21.741382012376906,0.01989964522668397,0.018436937366680027,sigmoid,TPESampler,COMPLETE
2480,0.27315593523443343,2025-04-25 09:18:16.971960,2025-04-25 09:18:17.554522,0 days 00:00:00.582562,4.6648198361792055,0.022913591832764445,0.04811575240957334,rbf,TPESampler,COMPLETE
2481,0.7678216384756786,2025-04-25 09:18:17.745281,2025-04-25 09:18:18.314251,0 days 00:00:00.568970,0.00122223745703058,0.28210916467923214,0.09009579853538148,poly,TPESampler,COMPLETE
2482,0.31220135598496807,2025-04-25 09:18:18.509881,2025-04-25 09:18:19.089041,0 days 00:00:00.579160,7.227646574279667,0.020465629413231348,0.013407605968972352,rbf,TPESampler,COMPLETE
2483,0.5002369033454771,2025-04-25 09:18:19.282630,2025-04-25 09:18:23.567222,0 days 00:00:04.284592,9.6795636382934,0.03986000844779178,0.012421092679047714,linear,TPESampler,COMPLETE
2484,0.31569861888036554,2025-04-25 09:18:23.761261,2025-04-25 09:18:24.382551,0 days 00:00:00.621290,8.661111767023703,0.014954693295407905,0.24682759362344767,rbf,TPESampler,COMPLETE
2485,196.9203042582272,2025-04-25 09:18:24.585469,2025-04-25 09:18:25.163630,0 days 00:00:00.578161,8.623818210512786,0.010413505033942042,0.07518372549826649,sigmoid,TPESampler,COMPLETE
2486,0.4856506468643221,2025-04-25 09:18:25.356986,2025-04-25 09:18:26.287756,0 days 00:00:00.930770,1.7522841098558004,0.0018392227600154247,0.0019277282678219776,linear,TPESampler,COMPLETE
2487,0.27282299656877274,2025-04-25 09:18:26.481578,2025-04-25 09:18:27.023631,0 days 00:00:00.542053,2.7948284376125554,0.08285263385352434,0.07441790160685059,rbf,TPESampler,COMPLETE
2488,0.31831625337300073,2025-04-25 09:18:27.209864,2025-04-25 09:18:27.795473,0 days 00:00:00.585609,65.47037705902909,0.03446179161324003,0.23589128763331743,rbf,TPESampler,COMPLETE
2489,0.2875391469655152,2025-04-25 09:18:27.995934,2025-04-25 09:18:28.601089,0 days 00:00:00.605155,90.55653398143708,0.06342062931001755,0.06337572287575609,rbf,TPESampler,COMPLETE
2490,0.29639066301098593,2025-04-25 09:18:28.797369,2025-04-25 09:18:29.603886,0 days 00:00:00.806517,32.69581472340824,0.06693320329088881,0.018478969707344868,rbf,TPESampler,COMPLETE
2491,0.3037297637253344,2025-04-25 09:18:29.801409,2025-04-25 09:18:30.373335,0 days 00:00:00.571926,4.706090326850062,0.05489089447320122,0.21177869359297205,rbf,TPESampler,COMPLETE
2492,0.3052822459538883,2025-04-25 09:18:30.564800,2025-04-25 09:18:31.172138,0 days 00:00:00.607338,4.520835416465812,0.02431689163629434,0.23902561819085813,rbf,TPESampler,COMPLETE
2493,0.2728339453793755,2025-04-25 09:18:31.370831,2025-04-25 09:18:32.084369,0 days 00:00:00.713538,19.123362730192653,0.019232107594291163,0.03921645622164316,rbf,TPESampler,COMPLETE
2494,0.9747106735942432,2025-04-25 09:18:32.280589,2025-04-25 09:18:32.799987,0 days 00:00:00.519398,0.013084319327353355,0.5538424878289429,0.0013213785467825895,poly,TPESampler,COMPLETE
2495,0.2843323239532563,2025-04-25 09:18:33.002165,2025-04-25 09:18:33.594013,0 days 00:00:00.591848,13.987656573057805,0.05028087579185922,0.02755769444972768,rbf,TPESampler,COMPLETE
2496,0.6677892213832157,2025-04-25 09:18:33.784611,2025-04-25 09:18:34.533139,0 days 00:00:00.748528,0.05425111928280127,0.0010315819652298433,0.05418544469581098,poly,TPESampler,COMPLETE
2497,0.5967193524291936,2025-04-25 09:18:34.729619,2025-04-25 09:18:35.292177,0 days 00:00:00.562558,7.474460660646745,0.13854918288121398,0.9536201015058989,rbf,TPESampler,COMPLETE
2498,0.2768560496847897,2025-04-25 09:18:35.490732,2025-04-25 09:18:36.024097,0 days 00:00:00.533365,16.784353863951548,0.14661972732601836,0.05903666983453661,rbf,TPESampler,COMPLETE
2499,0.29177462613850536,2025-04-25 09:18:36.216322,2025-04-25 09:18:36.798608,0 days 00:00:00.582286,1.2907600658588034,0.033844149231681185,0.13578937254778137,rbf,TPESampler,COMPLETE
