number,value,datetime_start,datetime_complete,duration,params_C,params_epsilon,params_gamma,params_kernel,system_attrs_auto:sampler,state
945,0.2758345150329578,2025-04-25 02:42:02.860718,2025-04-25 02:42:03.394281,0 days 00:00:00.533563,5.997257833587694,0.08883375914566258,0.1175277412769302,rbf,TPESampler,COMPLETE
946,0.8037107808163615,2025-04-25 02:42:03.560348,2025-04-25 02:42:04.097735,0 days 00:00:00.537387,0.12122003426913278,0.02159441561965431,0.7903522511037914,rbf,TPESampler,COMPLETE
947,0.2785655308197134,2025-04-25 02:42:04.265549,2025-04-25 02:42:04.864486,0 days 00:00:00.598937,27.969161919613153,0.031904973491026146,0.09503728340804332,rbf,TPESampler,COMPLETE
948,0.419934438622266,2025-04-25 02:42:05.034251,2025-04-25 02:42:05.564680,0 days 00:00:00.530429,1.3322736143587008,0.022587471329969938,0.005498779430511551,rbf,TPESampler,COMPLETE
949,0.26629012628426374,2025-04-25 02:42:05.736073,2025-04-25 02:42:06.280934,0 days 00:00:00.544861,13.910963143438146,0.056774349149820484,0.050154833141818865,rbf,TPESampler,COMPLETE
950,0.266336258224905,2025-04-25 02:42:06.448675,2025-04-25 02:42:07.052471,0 days 00:00:00.603796,7.499378706303418,0.016528615503072747,0.06581586948052878,rbf,TPESampler,COMPLETE
951,0.29881550742197605,2025-04-25 02:42:07.276074,2025-04-25 02:42:07.824604,0 days 00:00:00.548530,24.645404660329554,0.041080906084009036,0.010260946279604801,rbf,TPESampler,COMPLETE
952,0.30773443215628427,2025-04-25 02:42:07.992420,2025-04-25 02:42:08.522068,0 days 00:00:00.529648,1.3557697696616244,0.015430596356555564,0.046460856114086915,rbf,TPESampler,COMPLETE
953,0.3259985690225582,2025-04-25 02:42:08.693552,2025-04-25 02:42:09.458997,0 days 00:00:00.765445,10.057490249836954,0.10843385795481007,0.2138829124159563,rbf,TPESampler,COMPLETE
954,0.2841254030742898,2025-04-25 02:42:09.843221,2025-04-25 02:42:10.457927,0 days 00:00:00.614706,2.5074447598589553,0.045632286125585945,0.1666408392889353,rbf,TPESampler,COMPLETE
955,0.26823854327807056,2025-04-25 02:42:10.625930,2025-04-25 02:42:11.308070,0 days 00:00:00.682140,7.167280720862792,0.034495529814452704,0.10854470923317237,rbf,TPESampler,COMPLETE
956,0.28669362548217164,2025-04-25 02:42:11.483375,2025-04-25 02:42:12.345777,0 days 00:00:00.862402,47.616860765984214,0.015492342476013575,0.06191188931396378,rbf,TPESampler,COMPLETE
957,40.59319022538418,2025-04-25 02:42:12.520784,2025-04-25 02:42:13.058308,0 days 00:00:00.537524,1.9891947811093844,0.010160776394211798,0.15384732318004074,sigmoid,TPESampler,COMPLETE
958,0.3503403077159339,2025-04-25 02:42:13.228499,2025-04-25 02:42:13.739769,0 days 00:00:00.511270,9.29849473531173,0.0827663844035781,0.004361619265987632,rbf,TPESampler,COMPLETE
959,0.5699699079325765,2025-04-25 02:42:13.905546,2025-04-25 02:42:22.215047,0 days 00:00:08.309501,6.477634544051089,0.1444857054556502,0.042459165807918,poly,TPESampler,COMPLETE
960,0.26967469589220094,2025-04-25 02:42:22.498282,2025-04-25 02:42:23.044184,0 days 00:00:00.545902,20.862664569504496,0.06304816184364279,0.06161977533921288,rbf,TPESampler,COMPLETE
961,0.36086271501394046,2025-04-25 02:42:23.215732,2025-04-25 02:42:23.762786,0 days 00:00:00.547054,1.9044908695835596,0.09214854533868228,0.012652903077704917,rbf,TPESampler,COMPLETE
962,0.28166482135610743,2025-04-25 02:42:23.945438,2025-04-25 02:42:24.460876,0 days 00:00:00.515438,5.8799265665725295,0.05670367358517402,0.0326971430392983,rbf,TPESampler,COMPLETE
963,0.4086648462191666,2025-04-25 02:42:24.632173,2025-04-25 02:42:25.164585,0 days 00:00:00.532412,0.20155579314496946,0.023214333360098153,0.048617558424076376,rbf,TPESampler,COMPLETE
964,0.299107560391831,2025-04-25 02:42:25.333646,2025-04-25 02:42:25.815679,0 days 00:00:00.482033,1.041195869784735,0.1102605183198071,0.10280544845353512,rbf,TPESampler,COMPLETE
965,0.35162860646668337,2025-04-25 02:42:25.982989,2025-04-25 02:42:26.459223,0 days 00:00:00.476234,79.91896283278047,0.3501000568595918,0.03143119931989031,rbf,TPESampler,COMPLETE
966,0.9364564547281505,2025-04-25 02:42:26.630083,2025-04-25 02:42:27.168102,0 days 00:00:00.538019,0.009743628077198871,0.0011455525124458965,0.5913364982541223,rbf,TPESampler,COMPLETE
967,0.2702753198947747,2025-04-25 02:42:27.339984,2025-04-25 02:42:27.895858,0 days 00:00:00.555874,3.6417272595160624,0.016264872232326973,0.06416311124333171,rbf,TPESampler,COMPLETE
968,0.2808669720816753,2025-04-25 02:42:28.065006,2025-04-25 02:42:28.622297,0 days 00:00:00.557291,20.20236783346123,0.04593660446139008,0.11677356334280872,rbf,TPESampler,COMPLETE
969,0.5012146025620277,2025-04-25 02:42:28.792002,2025-04-25 02:42:30.709304,0 days 00:00:01.917302,6.442032157813062,0.033225677348102924,0.022411471077757546,linear,TPESampler,COMPLETE
970,0.32688362191741976,2025-04-25 02:42:30.892659,2025-04-25 02:42:31.415018,0 days 00:00:00.522359,2.396891286949198,0.041518864994650996,0.019780893999140556,rbf,TPESampler,COMPLETE
971,21.517890173599717,2025-04-25 02:42:31.597435,2025-04-25 02:42:32.118496,0 days 00:00:00.521061,1.7960342850023743,0.02437176914689779,0.016369689635495767,sigmoid,TPESampler,COMPLETE
972,0.2728240783854176,2025-04-25 02:42:32.288966,2025-04-25 02:42:32.832367,0 days 00:00:00.543401,2.9749172293903023,0.020756946174202404,0.13313350057394646,rbf,TPESampler,COMPLETE
973,0.27475804287897865,2025-04-25 02:42:33.001561,2025-04-25 02:42:33.499448,0 days 00:00:00.497887,5.342819549173146,0.093321200060278,0.053855940215539015,rbf,TPESampler,COMPLETE
974,0.3642499499342849,2025-04-25 02:42:33.663656,2025-04-25 02:42:34.212744,0 days 00:00:00.549088,9.082753805492823,0.022709678360909095,0.41383422683539994,rbf,TPESampler,COMPLETE
975,0.2823779288575762,2025-04-25 02:42:34.394662,2025-04-25 02:42:35.012057,0 days 00:00:00.617395,28.99388922549817,0.03575187360426274,0.02633300160442776,rbf,TPESampler,COMPLETE
976,0.2722298785142336,2025-04-25 02:42:35.181678,2025-04-25 02:42:35.769461,0 days 00:00:00.587783,8.028234515279227,0.01962490748343762,0.03965165799602629,rbf,TPESampler,COMPLETE
977,0.9640970372181106,2025-04-25 02:42:35.937336,2025-04-25 02:42:36.463267,0 days 00:00:00.525931,0.0011533760122232966,0.006506540240348316,0.00023990865712320602,poly,TPESampler,COMPLETE
978,0.9679106927914007,2025-04-25 02:42:36.635136,2025-04-25 02:42:37.174961,0 days 00:00:00.539825,0.0016267490294014444,0.17980459877068664,0.00016736579645767346,sigmoid,TPESampler,COMPLETE
979,0.27328515853119895,2025-04-25 02:42:37.348184,2025-04-25 02:42:37.881994,0 days 00:00:00.533810,5.0475027359759,0.053099292407494524,0.12525615315363448,rbf,TPESampler,COMPLETE
980,0.3159921814636307,2025-04-25 02:42:38.351321,2025-04-25 02:42:38.888699,0 days 00:00:00.537378,17.634510727426438,0.04621271188910372,0.21374050244545886,rbf,TPESampler,COMPLETE
981,0.27068193865110046,2025-04-25 02:42:39.060010,2025-04-25 02:42:39.699695,0 days 00:00:00.639685,11.218654379548386,0.0056735493641272535,0.08363076097691899,rbf,TPESampler,COMPLETE
982,0.3288486881652236,2025-04-25 02:42:39.866676,2025-04-25 02:42:40.392219,0 days 00:00:00.525543,1.4762755080759633,0.08047338926105606,0.2732715358673396,rbf,TPESampler,COMPLETE
983,0.3915755041720242,2025-04-25 02:42:40.558391,2025-04-25 02:42:41.187400,0 days 00:00:00.629009,28.691233594286853,0.15546448500200366,0.3721246079181113,rbf,TPESampler,COMPLETE
984,0.35069106965133784,2025-04-25 02:42:41.455218,2025-04-25 02:42:42.225282,0 days 00:00:00.770064,0.9065852543832885,0.08626657062811573,0.030175181001415505,rbf,TPESampler,COMPLETE
985,837.0770866874392,2025-04-25 02:42:42.548288,2025-04-25 02:42:43.755181,0 days 00:00:01.206893,55.92258146882698,0.03373423326609866,0.021740311052811715,sigmoid,TPESampler,COMPLETE
986,0.31600115931097345,2025-04-25 02:42:44.125273,2025-04-25 02:42:45.479940,0 days 00:00:01.354667,25.770114576130148,0.009122104734113276,0.24513381949604615,rbf,TPESampler,COMPLETE
987,0.32059584569567107,2025-04-25 02:42:45.797397,2025-04-25 02:42:46.879391,0 days 00:00:01.081994,1.4353924782353298,0.027021438770179203,0.03442250518446537,rbf,TPESampler,COMPLETE
988,0.2740604580909362,2025-04-25 02:42:47.839460,2025-04-25 02:42:48.977326,0 days 00:00:01.137866,4.337611557170354,0.04775305626542816,0.04829490414547863,rbf,TPESampler,COMPLETE
989,0.2950475621315949,2025-04-25 02:42:49.288925,2025-04-25 02:42:50.477183,0 days 00:00:01.188258,93.91772212599892,0.0785022981217541,0.021624692584454683,rbf,TPESampler,COMPLETE
990,0.3081237840319758,2025-04-25 02:42:50.647129,2025-04-25 02:42:51.397171,0 days 00:00:00.750042,8.25700843092145,0.006394325485462126,0.013259247897061961,rbf,TPESampler,COMPLETE
991,0.3109913526236442,2025-04-25 02:42:51.694527,2025-04-25 02:42:52.530290,0 days 00:00:00.835763,1.0212323309994886,0.002731878792542759,0.06087349319860717,rbf,TPESampler,COMPLETE
992,0.2720012824333125,2025-04-25 02:42:52.700405,2025-04-25 02:42:53.631423,0 days 00:00:00.931018,15.904210107330833,0.11356486096148487,0.0651686535680567,rbf,TPESampler,COMPLETE
993,0.2716720113988452,2025-04-25 02:42:53.841710,2025-04-25 02:42:54.481254,0 days 00:00:00.639544,15.965089885258143,0.0139623345138544,0.044779081811483046,rbf,TPESampler,COMPLETE
994,0.26748896491685475,2025-04-25 02:42:54.651978,2025-04-25 02:42:55.260780,0 days 00:00:00.608802,16.833226429860716,0.04023626287616076,0.04891909670039769,rbf,TPESampler,COMPLETE
995,0.29805335601094174,2025-04-25 02:42:55.444999,2025-04-25 02:42:56.171448,0 days 00:00:00.726449,4.905500165976723,0.022742514339740984,0.21635814904796352,rbf,TPESampler,COMPLETE
996,0.27289711341311046,2025-04-25 02:42:56.347885,2025-04-25 02:42:56.892082,0 days 00:00:00.544197,3.058115500773826,0.028293364110651906,0.06359006292100901,rbf,TPESampler,COMPLETE
997,0.30424237949006505,2025-04-25 02:42:57.079661,2025-04-25 02:42:57.693336,0 days 00:00:00.613675,26.35398967962592,0.021993113158639808,0.15540272291888532,rbf,TPESampler,COMPLETE
998,0.2865713578321804,2025-04-25 02:42:57.865016,2025-04-25 02:42:58.396668,0 days 00:00:00.531652,12.335464436698969,0.07467454786537679,0.027838989451914795,rbf,TPESampler,COMPLETE
999,0.28302093481304513,2025-04-25 02:42:58.568238,2025-04-25 02:42:59.105200,0 days 00:00:00.536962,3.0443704103414273,0.03687555494146589,0.04822289144332682,rbf,TPESampler,COMPLETE
1000,0.3211717345882373,2025-04-25 02:42:59.276268,2025-04-25 02:42:59.820127,0 days 00:00:00.543859,18.47285431310052,0.05944350632441962,0.22336728324502889,rbf,TPESampler,COMPLETE
1001,0.694350759034225,2025-04-25 02:42:59.993120,2025-04-25 02:51:20.515617,0 days 00:08:20.522497,17.34024004568624,0.02439576517475375,0.051958430252271176,poly,TPESampler,COMPLETE
1002,0.331506929438715,2025-04-25 02:45:57.602345,2025-04-25 02:45:58.098064,0 days 00:00:00.495719,4.713817946047881,0.20265892203694508,0.17585048754393667,rbf,TPESampler,COMPLETE
1003,0.2688487072429669,2025-04-25 02:45:58.272955,2025-04-25 02:45:58.801050,0 days 00:00:00.528095,3.6375580463763484,0.07066510327175195,0.09458677959094053,rbf,TPESampler,COMPLETE
1004,0.28167254618812665,2025-04-25 02:45:58.978559,2025-04-25 02:45:59.673672,0 days 00:00:00.695113,35.69621364241726,0.02503587508231379,0.04722236897765064,rbf,TPESampler,COMPLETE
1005,0.4740336001556371,2025-04-25 02:45:59.844959,2025-04-25 02:46:00.601887,0 days 00:00:00.756928,1.543540717559479,0.13787640507485596,0.12763579859576235,linear,TPESampler,COMPLETE
1006,0.4351105829868948,2025-04-25 02:46:00.776412,2025-04-25 02:46:01.317446,0 days 00:00:00.541034,0.049644887442937956,0.03116493009531937,0.0005611834231581852,linear,TPESampler,COMPLETE
1007,0.3043357309066418,2025-04-25 02:46:01.495294,2025-04-25 02:46:02.048252,0 days 00:00:00.552958,0.944776530554511,0.015338243368203754,0.13997645792958682,rbf,TPESampler,COMPLETE
1008,0.26673527012660797,2025-04-25 02:46:02.231748,2025-04-25 02:46:02.763925,0 days 00:00:00.532177,6.244858489730994,0.06330473522556178,0.10151541382453934,rbf,TPESampler,COMPLETE
1009,0.304394377873077,2025-04-25 02:46:02.940339,2025-04-25 02:46:03.494914,0 days 00:00:00.554575,5.306943698772325,0.03010356076510589,0.01881419391426268,rbf,TPESampler,COMPLETE
1010,0.2738274458546798,2025-04-25 02:46:03.662315,2025-04-25 02:46:04.185568,0 days 00:00:00.523253,2.0999364121013637,0.03612096808348924,0.09594181610839936,rbf,TPESampler,COMPLETE
1011,0.2926291867393406,2025-04-25 02:46:04.360181,2025-04-25 02:46:04.842695,0 days 00:00:00.482514,9.816637940446,0.2173835437569302,0.054167544537144806,rbf,TPESampler,COMPLETE
1012,0.4616504911913863,2025-04-25 02:46:05.011637,2025-04-25 02:46:05.470456,0 days 00:00:00.458819,0.502718899063391,0.5172478354480343,0.07595264214798544,rbf,TPESampler,COMPLETE
1013,0.2651724707594884,2025-04-25 02:46:05.647773,2025-04-25 02:46:06.205744,0 days 00:00:00.557971,6.408483287767951,0.029526746489876306,0.07687107874394083,rbf,TPESampler,COMPLETE
1014,0.30928865654040394,2025-04-25 02:46:06.393615,2025-04-25 02:46:06.953657,0 days 00:00:00.560042,4.550769059198844,0.011906557377613163,0.01840441954591986,rbf,TPESampler,COMPLETE
1015,0.30491896083802295,2025-04-25 02:46:07.120970,2025-04-25 02:46:07.667921,0 days 00:00:00.546951,60.53424839157691,0.046017212572513365,0.1565661822718417,rbf,TPESampler,COMPLETE
1016,0.30740590264458356,2025-04-25 02:46:07.838405,2025-04-25 02:46:08.426048,0 days 00:00:00.587643,6.096064053697759,0.007958207131363852,0.24088513675379647,rbf,TPESampler,COMPLETE
1017,0.33414928768545565,2025-04-25 02:46:08.608063,2025-04-25 02:46:09.153242,0 days 00:00:00.545179,16.228528284139795,0.023948316142609106,0.3111740263866381,rbf,TPESampler,COMPLETE
1018,0.26671147007614654,2025-04-25 02:46:09.322127,2025-04-25 02:46:09.949485,0 days 00:00:00.627358,13.311651673974566,0.018055323539704644,0.056784479880638075,rbf,TPESampler,COMPLETE
1019,0.26994517797597545,2025-04-25 02:46:10.122975,2025-04-25 02:46:10.671900,0 days 00:00:00.548925,3.7875109566503977,0.021437315050427622,0.06115136924703406,rbf,TPESampler,COMPLETE
1020,0.7638442519472566,2025-04-25 02:46:10.846968,2025-04-25 02:52:33.947558,0 days 00:06:23.100590,8.692491696785249,0.05970423958909935,0.08581468522971589,poly,TPESampler,COMPLETE
1021,0.9144701496894347,2025-04-25 02:51:20.693623,2025-04-25 02:51:21.223064,0 days 00:00:00.529441,0.0014651149138122897,0.0842987490599733,0.03503232253105275,rbf,TPESampler,COMPLETE
1022,0.27511794789713334,2025-04-25 02:51:21.391253,2025-04-25 02:51:22.077009,0 days 00:00:00.685756,23.20249392675769,0.01904792142744723,0.06071673406488331,rbf,TPESampler,COMPLETE
1023,0.5710342219353977,2025-04-25 02:51:22.244042,2025-04-25 02:51:22.782261,0 days 00:00:00.538219,15.924322306289602,0.0622122611959453,0.9365674400102184,rbf,TPESampler,COMPLETE
1024,0.34644202706914523,2025-04-25 02:51:22.974897,2025-04-25 02:51:23.540734,0 days 00:00:00.565837,1.1277401286205146,0.02167569173322531,0.3275690906750137,rbf,TPESampler,COMPLETE
1025,0.2793236390837595,2025-04-25 02:51:23.924729,2025-04-25 02:51:24.488233,0 days 00:00:00.563504,14.207265726680037,0.041340615871232084,0.1255215132147266,rbf,TPESampler,COMPLETE
1026,0.2846098958203071,2025-04-25 02:51:24.662230,2025-04-25 02:51:25.204074,0 days 00:00:00.541844,10.553454696614427,0.07560507019767135,0.026573583776434092,rbf,TPESampler,COMPLETE
1027,0.2657572775615106,2025-04-25 02:51:25.382659,2025-04-25 02:51:25.985321,0 days 00:00:00.602662,5.854345559285272,0.007562414328265617,0.08510414454119566,rbf,TPESampler,COMPLETE
1028,0.28410518305522264,2025-04-25 02:51:26.161075,2025-04-25 02:51:26.713769,0 days 00:00:00.552694,10.425793193335656,0.045468548294638686,0.02317464878318336,rbf,TPESampler,COMPLETE
1029,0.9648990572265158,2025-04-25 02:51:26.889321,2025-04-25 02:51:27.409671,0 days 00:00:00.520350,0.0022842960195657057,0.0011379945976312457,0.00020073672119660075,poly,TPESampler,COMPLETE
1030,0.3053239559686561,2025-04-25 02:51:27.580042,2025-04-25 02:51:28.135880,0 days 00:00:00.555838,5.244816556338032,0.031953803398698175,0.23073248901864743,rbf,TPESampler,COMPLETE
1031,0.27596406346826546,2025-04-25 02:51:28.309560,2025-04-25 02:51:28.875377,0 days 00:00:00.565817,26.22522781896378,0.06651346916709644,0.09070605940741638,rbf,TPESampler,COMPLETE
1032,0.2957258665324251,2025-04-25 02:51:29.056651,2025-04-25 02:51:29.824974,0 days 00:00:00.768323,95.12667288650144,0.031895940907064046,0.03779286730868012,rbf,TPESampler,COMPLETE
1033,0.2673322575517455,2025-04-25 02:51:29.992534,2025-04-25 02:51:30.592599,0 days 00:00:00.600065,13.366441033354098,0.027868572562173278,0.06024794959055371,rbf,TPESampler,COMPLETE
1034,0.2660827107653523,2025-04-25 02:51:30.756869,2025-04-25 02:51:31.330134,0 days 00:00:00.573265,7.842281696006263,0.024340268612427222,0.08690885206939668,rbf,TPESampler,COMPLETE
1035,0.3742431072425164,2025-04-25 02:51:31.498089,2025-04-25 02:51:32.042451,0 days 00:00:00.544362,0.7346024963907597,0.01426785757234087,0.0232711871619651,rbf,TPESampler,COMPLETE
1036,0.32497177974269276,2025-04-25 02:51:32.206598,2025-04-25 02:51:32.737297,0 days 00:00:00.530699,2.799621432836917,0.061513225009965346,0.27638479975961927,rbf,TPESampler,COMPLETE
1037,0.3237771150422332,2025-04-25 02:51:32.907041,2025-04-25 02:51:33.410083,0 days 00:00:00.503042,0.7623847596601437,0.10222567551046245,0.06879502182505347,rbf,TPESampler,COMPLETE
1038,0.32632988241575933,2025-04-25 02:51:33.578801,2025-04-25 02:51:34.126898,0 days 00:00:00.548097,2.843916588090565,0.025536750031916522,0.01780469699108743,rbf,TPESampler,COMPLETE
1039,0.26822590203602736,2025-04-25 02:51:34.301057,2025-04-25 02:51:34.859774,0 days 00:00:00.558717,4.926105612373432,0.03500487521280982,0.11027177499860256,rbf,TPESampler,COMPLETE
1040,1.0886511120945048,2025-04-25 02:51:35.024685,2025-04-25 03:56:14.411122,0 days 01:04:39.386437,3.734098102762175,0.09921140349085798,0.25281162672481183,poly,TPESampler,COMPLETE
1041,0.49485207166121864,2025-04-25 02:52:34.126976,2025-04-25 02:52:40.975300,0 days 00:00:06.848324,19.822768779797695,0.060144471987180634,0.029050363724753864,linear,TPESampler,COMPLETE
1042,0.2827214250013563,2025-04-25 02:52:41.153411,2025-04-25 02:52:42.080136,0 days 00:00:00.926725,49.97226921521473,0.12106696361178639,0.05270274524956317,rbf,TPESampler,COMPLETE
1043,0.6532935786167596,2025-04-25 02:52:42.380760,2025-04-25 02:52:43.371024,0 days 00:00:00.990264,0.7444727119916413,0.005818906340202072,0.0006801873557082101,rbf,TPESampler,COMPLETE
1044,0.2943967060131652,2025-04-25 02:52:43.816663,2025-04-25 02:52:44.651918,0 days 00:00:00.835255,7.585070713527545,0.015167595026605595,0.19380033343601313,rbf,TPESampler,COMPLETE
1045,0.28326934853304364,2025-04-25 02:52:45.046468,2025-04-25 02:52:45.953416,0 days 00:00:00.906948,4.211717465222575,0.02025573950561557,0.03539389582703731,rbf,TPESampler,COMPLETE
1046,0.5655936003197307,2025-04-25 02:52:46.423824,2025-04-25 02:53:51.987555,0 days 00:01:05.563731,0.821394653546964,0.013561723052648347,0.07579246530350005,poly,TPESampler,COMPLETE
1047,0.2745315276909868,2025-04-25 02:53:52.163920,2025-04-25 02:53:52.676440,0 days 00:00:00.512520,4.632711403122959,0.10043190167253198,0.11368519290143442,rbf,TPESampler,COMPLETE
1048,0.2723442112433342,2025-04-25 02:53:52.847141,2025-04-25 02:53:53.396739,0 days 00:00:00.549598,13.27333192125271,0.05629204219349159,0.03969557157513506,rbf,TPESampler,COMPLETE
1049,0.32356078058742904,2025-04-25 02:53:53.574335,2025-04-25 02:53:54.262827,0 days 00:00:00.688492,0.6670409659565572,0.0340139780817587,0.07286062502252913,rbf,TPESampler,COMPLETE
1050,0.30394877812041027,2025-04-25 02:53:54.439792,2025-04-25 02:53:55.097449,0 days 00:00:00.657657,35.69037430200502,0.013425115473978216,0.01236464017027908,rbf,TPESampler,COMPLETE
1051,0.3165567570571253,2025-04-25 02:53:55.267885,2025-04-25 02:53:55.787929,0 days 00:00:00.520044,5.391153617030281,0.06430579338308913,0.014541466555615088,rbf,TPESampler,COMPLETE
1052,0.2749522534636101,2025-04-25 02:53:55.958468,2025-04-25 02:53:56.512201,0 days 00:00:00.553733,9.810169047749982,0.050126242729673635,0.12081203783577008,rbf,TPESampler,COMPLETE
1053,0.2666932664729064,2025-04-25 02:53:56.686955,2025-04-25 02:53:57.286977,0 days 00:00:00.600022,5.966141102840758,0.017163114751468745,0.06505473465532331,rbf,TPESampler,COMPLETE
1054,0.266482619380729,2025-04-25 02:53:57.474139,2025-04-25 02:53:58.008015,0 days 00:00:00.533876,6.095661829439536,0.0388792356078345,0.05446594717065441,rbf,TPESampler,COMPLETE
1055,0.3102679194936156,2025-04-25 02:53:58.184195,2025-04-25 02:53:58.666556,0 days 00:00:00.482361,2.573011584654302,0.18794215146037727,0.0379796680009332,rbf,TPESampler,COMPLETE
1056,0.9644595245343895,2025-04-25 02:53:58.842830,2025-04-25 02:53:59.358182,0 days 00:00:00.515352,0.38656233776589677,0.003563686629928307,0.00013846862917093425,poly,TPESampler,COMPLETE
1057,0.29922349482770005,2025-04-25 02:53:59.528473,2025-04-25 02:54:00.109745,0 days 00:00:00.581272,25.741550151294796,0.04182804882735309,0.013630117369143182,rbf,TPESampler,COMPLETE
1058,223.41518056733398,2025-04-25 02:54:00.281510,2025-04-25 02:54:00.810161,0 days 00:00:00.528651,11.187797251716166,0.013305150846353312,0.03644634901000627,sigmoid,TPESampler,COMPLETE
1059,0.29257217195074203,2025-04-25 02:54:00.983140,2025-04-25 02:54:01.518156,0 days 00:00:00.535016,1.2469302106446436,0.03523278671853158,0.13451291884336333,rbf,TPESampler,COMPLETE
1060,0.27658149660671566,2025-04-25 02:54:01.687502,2025-04-25 02:54:02.237129,0 days 00:00:00.549627,18.0517880830969,0.09775226866917404,0.09761705313937251,rbf,TPESampler,COMPLETE
1061,0.6348522545416078,2025-04-25 02:54:02.407648,2025-04-25 02:54:04.575691,0 days 00:00:02.168043,3.3957448193093143,0.04802950587249602,0.025183620626264464,poly,TPESampler,COMPLETE
1062,0.3061435936069687,2025-04-25 02:54:04.742411,2025-04-25 02:54:05.299502,0 days 00:00:00.557091,27.68861762401137,0.029155415440186634,0.1727063736671795,rbf,TPESampler,COMPLETE
