number,value,datetime_start,datetime_complete,duration,params_C,params_epsilon,params_gamma,params_kernel,system_attrs_auto:sampler,state
472,0.2800546077249929,2025-04-25 00:11:38.872865,2025-04-25 00:11:39.440205,0 days 00:00:00.567340,3.657686539648887,0.03176055940652631,0.15945618107748782,rbf,TPESampler,COMPLETE
473,0.2750471543632998,2025-04-25 00:11:39.613375,2025-04-25 00:11:40.176918,0 days 00:00:00.563543,37.16693362745647,0.06780096029800442,0.041962798233881174,rbf,TPESampler,COMPLETE
474,0.2691472934473217,2025-04-25 00:11:40.349172,2025-04-25 00:11:40.863011,0 days 00:00:00.513839,4.50141162610251,0.08127986244068466,0.09758853034152652,rbf,TPESampler,COMPLETE
475,0.26726125107064674,2025-04-25 00:11:41.030638,2025-04-25 00:11:41.553066,0 days 00:00:00.522428,3.6152584019110394,0.04463692254853322,0.06931755500213761,rbf,TPESampler,COMPLETE
476,0.27189011702400867,2025-04-25 00:11:41.726497,2025-04-25 00:11:42.278954,0 days 00:00:00.552457,4.440443793492396,0.025379460501593582,0.05155334202087258,rbf,TPESampler,COMPLETE
477,182.08230835633017,2025-04-25 00:11:42.441048,2025-04-25 00:11:42.976431,0 days 00:00:00.535383,8.37987246189497,0.01831217232749636,0.058842948619784036,sigmoid,TPESampler,COMPLETE
478,0.27316064427199976,2025-04-25 00:11:43.136526,2025-04-25 00:11:43.745188,0 days 00:00:00.608662,22.74078087594662,0.03857043888058929,0.04866186371486632,rbf,TPESampler,COMPLETE
479,0.28797431641906285,2025-04-25 00:11:43.906109,2025-04-25 00:11:44.446111,0 days 00:00:00.540002,1.306903065453503,0.07050177439510363,0.10572090225052672,rbf,TPESampler,COMPLETE
480,0.3317388028541956,2025-04-25 00:11:44.624455,2025-04-25 00:11:45.195770,0 days 00:00:00.571315,1.430407539019125,0.017935301780121583,0.027699853659822672,rbf,TPESampler,COMPLETE
481,0.2978624692073297,2025-04-25 00:11:45.372929,2025-04-25 00:11:45.891204,0 days 00:00:00.518275,5.183258978980304,0.15183558958064086,0.03179990348586679,rbf,TPESampler,COMPLETE
482,0.30885047920738895,2025-04-25 00:11:46.061432,2025-04-25 00:11:46.611933,0 days 00:00:00.550501,17.475470152036888,0.0395893183462549,0.18352238492137282,rbf,TPESampler,COMPLETE
483,0.3743617563967455,2025-04-25 00:11:46.780112,2025-04-25 00:11:47.330052,0 days 00:00:00.549940,3.169641466899328,0.03255879821715954,0.4415592650951459,rbf,TPESampler,COMPLETE
484,0.2912263348509985,2025-04-25 00:11:47.503089,2025-04-25 00:11:48.100264,0 days 00:00:00.597175,20.609451751903293,0.02126187973314384,0.02317201230427569,rbf,TPESampler,COMPLETE
485,0.28764163889697986,2025-04-25 00:11:48.264711,2025-04-25 00:11:48.776573,0 days 00:00:00.511862,2.8263381533623133,0.04304286846113972,0.0426247194337154,rbf,TPESampler,COMPLETE
486,0.4865436241014353,2025-04-25 00:11:48.942850,2025-04-25 00:12:01.313732,0 days 00:00:12.370882,28.783381693946865,0.10680354084606697,0.025984771932529297,linear,TPESampler,COMPLETE
487,46.492874273162066,2025-04-25 00:12:01.474430,2025-04-25 00:12:02.006108,0 days 00:00:00.531678,2.7483474596895947,0.08515105303640945,0.026465506517315697,sigmoid,TPESampler,COMPLETE
488,0.3664716660157146,2025-04-25 00:12:02.210669,2025-04-25 00:12:02.678525,0 days 00:00:00.467856,3.333954624134601,0.3076919235809464,0.16739562687314027,rbf,TPESampler,COMPLETE
489,0.2773083288925337,2025-04-25 00:12:02.845874,2025-04-25 00:12:03.360072,0 days 00:00:00.514198,5.3948583321026495,0.08791389407296041,0.1226427884820985,rbf,TPESampler,COMPLETE
490,0.271093306584663,2025-04-25 00:12:03.526466,2025-04-25 00:12:04.066570,0 days 00:00:00.540104,3.096110596931171,0.03085035130213236,0.12057531067391115,rbf,TPESampler,COMPLETE
491,0.2795433591943229,2025-04-25 00:12:04.233922,2025-04-25 00:12:04.888851,0 days 00:00:00.654929,32.89342016043168,0.02472355173099586,0.08774141585911613,rbf,TPESampler,COMPLETE
492,0.2923888233536677,2025-04-25 00:12:05.056184,2025-04-25 00:12:05.553568,0 days 00:00:00.497384,77.99400920838964,0.14962737376958476,0.04998442502482913,rbf,TPESampler,COMPLETE
493,0.27744999767162365,2025-04-25 00:12:05.718957,2025-04-25 00:12:06.240497,0 days 00:00:00.521540,9.256578088565181,0.09524003335801018,0.04495747552511093,rbf,TPESampler,COMPLETE
494,0.8578480918660008,2025-04-25 00:12:06.404914,2025-04-25 00:39:37.983366,0 days 00:27:31.578452,1.5923333055306017,0.04491083519797067,0.2062714143977752,poly,TPESampler,COMPLETE
495,0.34912866306576035,2025-04-25 00:14:23.578987,2025-04-25 00:14:24.283358,0 days 00:00:00.704371,2.4728091734759796,0.05005773817832629,0.012345161193396108,rbf,TPESampler,COMPLETE
496,0.2674160293701896,2025-04-25 00:14:24.504281,2025-04-25 00:14:25.160552,0 days 00:00:00.656271,9.63483386129572,0.018049657784363446,0.09201724990721719,rbf,TPESampler,COMPLETE
497,0.7093550210191396,2025-04-25 00:14:25.333159,2025-04-25 00:14:25.938387,0 days 00:00:00.605228,0.05601502945463384,0.18527176339339532,0.0024218576017728376,rbf,TPESampler,COMPLETE
498,0.27675908202525823,2025-04-25 00:14:26.094513,2025-04-25 00:14:26.626324,0 days 00:00:00.531811,8.229596779563584,0.03756684762112894,0.0330219501190559,rbf,TPESampler,COMPLETE
499,0.27312046721297456,2025-04-25 00:14:26.786406,2025-04-25 00:14:27.313305,0 days 00:00:00.526899,8.227208132401945,0.054348059841364045,0.11691872669056842,rbf,TPESampler,COMPLETE
500,0.2730631039944561,2025-04-25 00:14:27.475674,2025-04-25 00:14:28.004022,0 days 00:00:00.528348,2.701493651014837,0.027469609453256907,0.11973652250303557,rbf,TPESampler,COMPLETE
501,0.5589692440138498,2025-04-25 00:14:28.170636,2025-04-25 00:15:00.337921,0 days 00:00:32.167285,4.625003350053297,0.022704542205539392,0.04200570039091323,poly,TPESampler,COMPLETE
502,0.2783800057496828,2025-04-25 00:15:00.504534,2025-04-25 00:15:01.042395,0 days 00:00:00.537861,18.967696908979246,0.0563914712825798,0.10976850979044676,rbf,TPESampler,COMPLETE
503,0.42606191348914313,2025-04-25 00:15:01.207239,2025-04-25 00:15:01.728492,0 days 00:00:00.521253,5.306859159873673,0.017362980851487197,0.0015114861737288564,rbf,TPESampler,COMPLETE
504,0.31099030335822814,2025-04-25 00:15:01.909104,2025-04-25 00:15:02.397855,0 days 00:00:00.488751,1.0841779717814635,0.07600664067346108,0.053903160954263604,rbf,TPESampler,COMPLETE
505,0.2814226061827636,2025-04-25 00:15:02.562041,2025-04-25 00:15:03.113597,0 days 00:00:00.551556,9.547733717645803,0.021346298351231783,0.02293856420484459,rbf,TPESampler,COMPLETE
506,0.5832807966557491,2025-04-25 00:15:03.271841,2025-04-25 00:16:55.800358,0 days 00:01:52.528517,92.53371666019052,0.17412444932380713,0.014571312504932474,poly,TPESampler,COMPLETE
507,0.4212798258263817,2025-04-25 00:16:55.968766,2025-04-25 00:16:56.503532,0 days 00:00:00.534766,37.96709616547974,0.01677965389972679,0.5800716311652461,rbf,TPESampler,COMPLETE
508,0.5031225905233421,2025-04-25 00:16:56.667281,2025-04-25 00:17:00.165829,0 days 00:00:03.498548,10.06858433614617,0.0017593932983412115,0.0008549063584137523,linear,TPESampler,COMPLETE
509,0.29266767291435486,2025-04-25 00:17:00.325778,2025-04-25 00:17:00.799963,0 days 00:00:00.474185,10.478815852208273,0.08188565517235284,0.017789445727985853,rbf,TPESampler,COMPLETE
510,0.26798330320671154,2025-04-25 00:17:00.958482,2025-04-25 00:17:01.472780,0 days 00:00:00.514298,13.419156858684772,0.063625519007526,0.05377362593505257,rbf,TPESampler,COMPLETE
511,0.5023024506081557,2025-04-25 00:17:01.633645,2025-04-25 00:17:30.989721,0 days 00:00:29.356076,82.07910955013993,0.03095082194087285,0.058918264803751834,linear,TPESampler,COMPLETE
512,2.318954442624638,2025-04-25 00:17:31.156982,2025-04-25 03:07:43.709504,0 days 02:50:12.552522,5.932851716968337,0.0026846983173486757,0.4776332390293122,poly,TPESampler,COMPLETE
513,0.31789260755820475,2025-04-25 00:39:38.143603,2025-04-25 00:39:38.687471,0 days 00:00:00.543868,0.6503311928598359,0.041628370561467114,0.12059273598751373,rbf,TPESampler,COMPLETE
514,0.5370027238382188,2025-04-25 00:39:38.843338,2025-04-25 00:39:39.329609,0 days 00:00:00.486271,11.644699205474916,0.13613610045045654,0.791299485999826,rbf,TPESampler,COMPLETE
515,0.2674552496915218,2025-04-25 00:39:39.489932,2025-04-25 00:39:40.029218,0 days 00:00:00.539286,5.651219666327752,0.022986771514878275,0.05331242692577741,rbf,TPESampler,COMPLETE
516,0.3263061403395215,2025-04-25 00:39:40.187965,2025-04-25 00:39:40.679603,0 days 00:00:00.491638,10.419700001880646,0.057597534845588286,0.2450053380858608,rbf,TPESampler,COMPLETE
517,0.3780946721087009,2025-04-25 00:39:40.836906,2025-04-25 00:39:41.335684,0 days 00:00:00.498778,0.5317625944670759,0.022519088527362473,0.02989888715783399,rbf,TPESampler,COMPLETE
518,0.9211001781705995,2025-04-25 00:39:41.496216,2025-04-25 00:39:42.012304,0 days 00:00:00.516088,0.027238188540676743,0.04691871275606573,0.0002418240092911351,rbf,TPESampler,COMPLETE
519,0.2999813120917926,2025-04-25 00:39:42.175370,2025-04-25 00:39:42.633494,0 days 00:00:00.458124,12.672164854696117,0.19327354261461632,0.10065830546234633,rbf,TPESampler,COMPLETE
520,0.9731848338896267,2025-04-25 00:39:42.795301,2025-04-25 00:39:43.263668,0 days 00:00:00.468367,0.015672994650780855,0.9127159118362944,0.4448879631975725,sigmoid,TPESampler,COMPLETE
521,0.9467869922632238,2025-04-25 00:39:43.438564,2025-04-25 00:39:43.916277,0 days 00:00:00.477713,10.20711692279125,0.08235364961247697,0.0006008817589209708,poly,TPESampler,COMPLETE
522,0.28600019461323856,2025-04-25 00:39:44.080906,2025-04-25 00:39:44.678894,0 days 00:00:00.597988,32.72902667712256,0.024854773623595183,0.10339518042811209,rbf,TPESampler,COMPLETE
523,0.28073409325913856,2025-04-25 00:39:44.833701,2025-04-25 00:39:45.367237,0 days 00:00:00.533536,1.8910354791483621,0.008812586830559003,0.12994001239194633,rbf,TPESampler,COMPLETE
524,0.274132535048609,2025-04-25 00:39:45.521959,2025-04-25 00:39:46.007220,0 days 00:00:00.485261,3.0264597395163073,0.09913430775129618,0.08507372640738994,rbf,TPESampler,COMPLETE
525,0.2676658626933974,2025-04-25 00:39:46.164956,2025-04-25 00:39:46.714796,0 days 00:00:00.549840,10.175547082832615,0.027254354253618048,0.05339113295872792,rbf,TPESampler,COMPLETE
526,0.3683292674953409,2025-04-25 00:39:46.873853,2025-04-25 00:39:47.343333,0 days 00:00:00.469480,2.396213486011325,0.11065010913314247,0.00891896950178596,rbf,TPESampler,COMPLETE
527,0.6270355658224905,2025-04-25 00:39:47.507002,2025-04-25 00:39:48.018128,0 days 00:00:00.511126,0.077678163198269,0.0011283098848996393,0.006972026477105732,rbf,TPESampler,COMPLETE
528,0.28331473374239685,2025-04-25 00:39:48.178855,2025-04-25 00:39:48.753762,0 days 00:00:00.574907,1.7031301602944027,0.025662889561749665,0.08546986148269593,rbf,TPESampler,COMPLETE
529,0.312661435549203,2025-04-25 00:39:48.915081,2025-04-25 00:39:49.442191,0 days 00:00:00.527110,8.511189598162083,0.03508245911162171,0.23196941917623343,rbf,TPESampler,COMPLETE
530,0.29012125999197536,2025-04-25 00:39:49.595167,2025-04-25 00:39:50.074553,0 days 00:00:00.479386,4.303272020566366,0.09080885290677902,0.03508515087815751,rbf,TPESampler,COMPLETE
531,168.74714293757842,2025-04-25 00:39:50.234672,2025-04-25 00:39:50.738751,0 days 00:00:00.504079,7.9724642888228,0.035327688836325755,0.1892584449908491,sigmoid,TPESampler,COMPLETE
532,0.9632088299146117,2025-04-25 00:39:50.899363,2025-04-25 00:39:51.391763,0 days 00:00:00.492400,0.11189627474278308,0.07375709443787128,0.00021181617089641058,poly,TPESampler,COMPLETE
533,0.2862807535144749,2025-04-25 00:39:51.558540,2025-04-25 00:39:52.114239,0 days 00:00:00.555699,50.52768231604094,0.05094685568520377,0.08731520750193601,rbf,TPESampler,COMPLETE
534,0.2924529052706783,2025-04-25 00:39:52.271383,2025-04-25 00:39:52.903743,0 days 00:00:00.632360,36.03618639299497,0.019893536622487894,0.019896303124044157,rbf,TPESampler,COMPLETE
535,0.7322029577653592,2025-04-25 00:39:53.065581,2025-04-25 00:39:53.573946,0 days 00:00:00.508365,1.1608285970609242,0.007154486031047187,0.0018018586470997322,sigmoid,TPESampler,COMPLETE
536,0.2675855074832269,2025-04-25 00:39:53.734611,2025-04-25 00:39:54.244592,0 days 00:00:00.509981,4.9384715167424655,0.0743357941439988,0.09249197295897259,rbf,TPESampler,COMPLETE
537,0.3122366527355733,2025-04-25 00:39:54.412827,2025-04-25 00:39:54.928260,0 days 00:00:00.515433,4.994778602518341,0.03169779920536383,0.016328277940226656,rbf,TPESampler,COMPLETE
538,0.29758539797477596,2025-04-25 00:39:55.092065,2025-04-25 00:39:55.607104,0 days 00:00:00.515039,1.9551294787594362,0.056042126040895715,0.2021128562448217,rbf,TPESampler,COMPLETE
539,0.2659477437897939,2025-04-25 00:39:55.767557,2025-04-25 00:39:56.343667,0 days 00:00:00.576110,5.599202394243685,0.010874178678236672,0.08716248112367901,rbf,TPESampler,COMPLETE
540,0.48993734502611214,2025-04-25 00:39:56.512955,2025-04-25 00:39:58.733103,0 days 00:00:02.220148,7.245890279235475,0.0682823088416725,0.07848482392453839,linear,TPESampler,COMPLETE
541,0.26728467121262406,2025-04-25 00:39:58.891544,2025-04-25 00:39:59.426486,0 days 00:00:00.534942,5.5702936343881255,0.037147567905312304,0.09504773260570429,rbf,TPESampler,COMPLETE
542,0.2693433649487906,2025-04-25 00:39:59.586284,2025-04-25 00:40:00.104686,0 days 00:00:00.518402,12.711346602176814,0.06355796045192286,0.043260802151454794,rbf,TPESampler,COMPLETE
543,0.35339121577790206,2025-04-25 00:40:00.262172,2025-04-25 00:40:00.725407,0 days 00:00:00.463235,19.817921458291693,0.19274377065543924,0.22385556613416818,rbf,TPESampler,COMPLETE
544,0.46697681397459756,2025-04-25 00:40:00.884784,2025-04-25 00:40:01.343819,0 days 00:00:00.459035,0.4649655460324825,0.29059599844880507,0.3109951303994842,rbf,TPESampler,COMPLETE
545,0.9750699210958991,2025-04-25 00:40:01.504936,2025-04-25 00:40:01.952972,0 days 00:00:00.448036,0.027158219901443195,0.8207131433199834,0.0070354431982389025,poly,TPESampler,COMPLETE
546,0.4946518323284417,2025-04-25 00:40:02.195273,2025-04-25 00:40:03.928374,0 days 00:00:01.733101,6.188019998147703,0.04949292597795808,0.6345780368629029,linear,TPESampler,COMPLETE
547,0.2669112715400019,2025-04-25 00:40:04.090881,2025-04-25 00:40:04.630252,0 days 00:00:00.539371,6.487322091449648,0.02410865648415335,0.059277063450386504,rbf,TPESampler,COMPLETE
548,0.7347312527618107,2025-04-25 00:40:04.787877,2025-04-25 00:40:05.345027,0 days 00:00:00.557150,0.8585665768247184,0.4100589569779868,0.00021108997928617822,rbf,TPESampler,COMPLETE
549,0.9612625765388627,2025-04-25 00:40:05.506868,2025-04-25 00:40:05.953389,0 days 00:00:00.446521,0.0021168092535792413,0.6730110827820843,0.11898787876069057,rbf,TPESampler,COMPLETE
550,0.38019757712123375,2025-04-25 00:40:06.111114,2025-04-25 00:40:06.629337,0 days 00:00:00.518223,2.093345241237418,0.005127536134594015,0.008074310712814814,rbf,TPESampler,COMPLETE
551,0.35671668788848904,2025-04-25 00:40:06.786651,2025-04-25 00:40:07.321701,0 days 00:00:00.535050,9.86536913461578,0.015601814207085653,0.39562394365314363,rbf,TPESampler,COMPLETE
552,189.78130615100335,2025-04-25 00:40:07.481511,2025-04-25 00:40:07.977333,0 days 00:00:00.495822,8.726892540624688,0.1489181520659401,0.06028488203456248,sigmoid,TPESampler,COMPLETE
553,0.4896045726335191,2025-04-25 00:40:08.148750,2025-04-25 00:40:08.983115,0 days 00:00:00.834365,1.9379640772745608,0.02254245706889502,0.09153098699722777,linear,TPESampler,COMPLETE
554,0.3706342103951254,2025-04-25 00:40:09.141097,2025-04-25 00:40:09.627379,0 days 00:00:00.486282,0.5437117353099263,0.05721144914600906,0.03315447671287473,rbf,TPESampler,COMPLETE
555,0.30810419871535744,2025-04-25 00:40:09.785437,2025-04-25 00:40:10.358643,0 days 00:00:00.573206,39.69472363133285,0.048909510530470414,0.008103610086640914,rbf,TPESampler,COMPLETE
556,0.2820826189159711,2025-04-25 00:40:10.522358,2025-04-25 00:40:11.020456,0 days 00:00:00.498098,13.456327478310357,0.08377062933897833,0.1235303472095188,rbf,TPESampler,COMPLETE
557,0.7971672309031295,2025-04-25 00:40:11.175125,2025-04-25 01:04:52.203407,0 days 00:24:41.028282,9.406288710736286,0.08649576355498613,0.10470306499863484,poly,TPESampler,COMPLETE
558,0.31813522199716643,2025-04-25 00:47:02.819271,2025-04-25 00:47:03.324820,0 days 00:00:00.505549,1.6974677539936431,0.030460829956354542,0.28645867323365326,rbf,TPESampler,COMPLETE
559,0.5339142016272714,2025-04-25 00:47:03.481119,2025-04-25 00:47:03.887472,0 days 00:00:00.406353,3.3452282143019705,0.7542668068000491,0.02373598008826005,rbf,TPESampler,COMPLETE
560,0.2916335640895426,2025-04-25 00:47:04.043212,2025-04-25 00:47:04.547315,0 days 00:00:00.504103,2.3151958104482553,0.031172471638982843,0.04198186867291359,rbf,TPESampler,COMPLETE
561,0.8857392685216129,2025-04-25 00:47:04.704940,2025-04-25 00:47:05.173194,0 days 00:00:00.468254,0.7747561097228821,0.3784215621845465,0.004267236019306151,poly,TPESampler,COMPLETE
562,0.27096623926250313,2025-04-25 00:47:05.328332,2025-04-25 00:47:05.923724,0 days 00:00:00.595392,19.563273618668884,0.03009816914256035,0.049892370035393034,rbf,TPESampler,COMPLETE
563,0.287284666786074,2025-04-25 00:47:06.080895,2025-04-25 00:47:06.567914,0 days 00:00:00.487019,4.682289380375094,0.060205293736762824,0.03200527450416254,rbf,TPESampler,COMPLETE
564,0.27867009642375823,2025-04-25 00:47:06.727026,2025-04-25 00:47:07.262754,0 days 00:00:00.535728,37.80916141313991,0.06624702217598481,0.029600992427048223,rbf,TPESampler,COMPLETE
565,0.2735146200896939,2025-04-25 00:47:07.419894,2025-04-25 00:47:07.904645,0 days 00:00:00.484751,3.9841937797641562,0.07377428630423162,0.12167122743911835,rbf,TPESampler,COMPLETE
566,0.28212729129063074,2025-04-25 00:47:08.065367,2025-04-25 00:47:08.615854,0 days 00:00:00.550487,9.714166993847574,0.012703982987000415,0.022021941166132028,rbf,TPESampler,COMPLETE
567,0.29896931720125586,2025-04-25 00:47:08.781448,2025-04-25 00:47:09.292926,0 days 00:00:00.511478,10.508385008709382,0.03716151007617736,0.18719419393927467,rbf,TPESampler,COMPLETE
568,0.2864594524510615,2025-04-25 00:47:09.642022,2025-04-25 00:47:10.238066,0 days 00:00:00.596044,2.388794138368364,0.033866347754731956,0.05055310004616122,rbf,TPESampler,COMPLETE
569,0.2822419518212766,2025-04-25 00:47:10.497308,2025-04-25 00:47:11.267926,0 days 00:00:00.770618,15.014020411732222,0.1281708754483595,0.039165660716691746,rbf,TPESampler,COMPLETE
570,0.2999733304570909,2025-04-25 00:47:11.436939,2025-04-25 00:47:12.159041,0 days 00:00:00.722102,1.5461512647793716,0.14862529292899207,0.14012933834970112,rbf,TPESampler,COMPLETE
571,0.3037975993714532,2025-04-25 00:47:12.322941,2025-04-25 00:47:13.086876,0 days 00:00:00.763935,17.501347861205016,0.036818862807263375,0.16906632590066775,rbf,TPESampler,COMPLETE
572,0.43409600823567257,2025-04-25 00:47:13.244531,2025-04-25 00:47:13.737071,0 days 00:00:00.492540,0.04658298009691908,0.061512166951555175,0.022262733786471055,linear,TPESampler,COMPLETE
573,0.27423438004310646,2025-04-25 00:47:13.895615,2025-04-25 00:47:14.475022,0 days 00:00:00.579407,10.584907683461148,0.0098482415499803,0.04238126637256897,rbf,TPESampler,COMPLETE
574,0.2686608872373018,2025-04-25 00:47:14.661787,2025-04-25 00:47:15.193614,0 days 00:00:00.531827,3.918505948813035,0.04467374008717363,0.06099377710178754,rbf,TPESampler,COMPLETE
575,0.503934393783437,2025-04-25 00:47:15.357814,2025-04-25 00:47:26.257299,0 days 00:00:10.899485,33.92175336517918,0.015454748538586053,0.001710407117508093,linear,TPESampler,COMPLETE
576,0.3672481249528168,2025-04-25 00:47:26.415654,2025-04-25 00:47:26.917281,0 days 00:00:00.501627,4.419055539392265,0.04592737960462128,0.005514659420958085,rbf,TPESampler,COMPLETE
577,0.28571104468687436,2025-04-25 00:47:27.137936,2025-04-25 00:47:28.031682,0 days 00:00:00.893746,62.775099824787205,0.029781306669903345,0.04520021192839054,rbf,TPESampler,COMPLETE
578,0.290037773402112,2025-04-25 00:47:28.297501,2025-04-25 00:47:28.858573,0 days 00:00:00.561072,20.421794308145326,0.12737659387719288,0.11584972599820006,rbf,TPESampler,COMPLETE
579,0.36463818008931287,2025-04-25 00:47:29.019650,2025-04-25 00:47:29.527806,0 days 00:00:00.508156,2.579843030619649,0.05866069358860989,0.39321341127357573,rbf,TPESampler,COMPLETE
580,0.3010074666494798,2025-04-25 00:47:29.683737,2025-04-25 00:47:30.190977,0 days 00:00:00.507240,1.6728786470636856,0.013014481675846484,0.04421991169794841,rbf,TPESampler,COMPLETE
581,0.30091803469270884,2025-04-25 00:47:30.350028,2025-04-25 00:47:30.835900,0 days 00:00:00.485872,3.217990725011695,0.09431334683952357,0.02944335557754582,rbf,TPESampler,COMPLETE
582,0.26843522265893693,2025-04-25 00:47:30.994327,2025-04-25 00:47:31.558102,0 days 00:00:00.563775,5.24770675016952,0.014236583424723712,0.11251633707580087,rbf,TPESampler,COMPLETE
583,0.2688440034159712,2025-04-25 00:47:31.716984,2025-04-25 00:47:32.621382,0 days 00:00:00.904398,16.79812039880152,0.07050279089095668,0.08007612872308605,rbf,TPESampler,COMPLETE
584,0.6594300060646772,2025-04-25 00:47:32.777378,2025-04-25 00:47:33.503014,0 days 00:00:00.725636,51.250225179037805,0.01035571491980542,0.006296046614571403,poly,TPESampler,COMPLETE
585,0.2722537097780332,2025-04-25 00:47:33.665895,2025-04-25 00:47:34.199008,0 days 00:00:00.533113,8.79525751864194,0.034790751143850995,0.11665975159947031,rbf,TPESampler,COMPLETE
586,0.29588230623469364,2025-04-25 00:47:34.359814,2025-04-25 00:47:34.871700,0 days 00:00:00.511886,3.4831250703995282,0.033348535030063554,0.028105704928711138,rbf,TPESampler,COMPLETE
587,0.2737937450674931,2025-04-25 00:47:35.185131,2025-04-25 00:47:35.669926,0 days 00:00:00.484795,2.548047095505281,0.05731312278348472,0.1130836207301339,rbf,TPESampler,COMPLETE
588,0.2669021072465118,2025-04-25 00:47:35.830707,2025-04-25 00:47:36.373167,0 days 00:00:00.542460,8.16740350136859,0.02368292256583277,0.08784364085547476,rbf,TPESampler,COMPLETE
589,0.3630041363255812,2025-04-25 00:47:36.532536,2025-04-25 00:47:37.076241,0 days 00:00:00.543705,0.3473872140854285,0.020086139288021176,0.1490165667705807,rbf,TPESampler,COMPLETE
