number,value,datetime_start,datetime_complete,duration,params_C,params_epsilon,params_gamma,params_kernel,system_attrs_auto:sampler,state
1417,57.858961533032776,2025-04-25 04:06:12.881817,2025-04-25 04:06:13.420765,0 days 00:00:00.538948,2.759334602694338,0.05675787643970067,0.25019851041846,sigmoid,TPESampler,COMPLETE
1418,0.29402555621021575,2025-04-25 04:06:13.601840,2025-04-25 04:06:14.148328,0 days 00:00:00.546488,1.6270918312114941,0.026969541020676138,0.18413759781869507,rbf,TPESampler,COMPLETE
1419,0.33389780615885384,2025-04-25 04:06:14.324982,2025-04-25 04:06:15.014703,0 days 00:00:00.689721,5.854927761381903,0.2827285681598732,0.10665744161377644,rbf,TPESampler,COMPLETE
1420,0.3320170742463222,2025-04-25 04:06:15.307310,2025-04-25 04:06:15.868971,0 days 00:00:00.561661,17.462936663691917,0.02173934262783206,0.3049635898627695,rbf,TPESampler,COMPLETE
1421,0.2732332345870895,2025-04-25 04:06:16.047357,2025-04-25 04:06:16.699104,0 days 00:00:00.651747,21.223456700894477,0.02769544511332928,0.05240921274275028,rbf,TPESampler,COMPLETE
1422,0.27875544470780717,2025-04-25 04:06:16.881147,2025-04-25 04:06:17.424626,0 days 00:00:00.543479,5.311935619100855,0.10084142282994714,0.12116290688520655,rbf,TPESampler,COMPLETE
1423,0.30694086380259705,2025-04-25 04:06:17.599683,2025-04-25 04:06:18.131774,0 days 00:00:00.532091,64.28947680888885,0.06560375154867756,0.1612496591423824,rbf,TPESampler,COMPLETE
1424,0.2999860019525852,2025-04-25 04:06:18.307565,2025-04-25 04:06:18.818610,0 days 00:00:00.511045,4.560484743482188,0.1304690250207194,0.029480910840572576,rbf,TPESampler,COMPLETE
1425,0.2859539743922648,2025-04-25 04:06:18.995355,2025-04-25 04:06:19.587701,0 days 00:00:00.592346,10.54103983726624,0.01843894343151552,0.15888120490552743,rbf,TPESampler,COMPLETE
1426,0.39295646942714996,2025-04-25 04:06:19.767475,2025-04-25 04:06:20.273727,0 days 00:00:00.506252,0.5910131247594842,0.14213534112970339,0.021107049406117805,rbf,TPESampler,COMPLETE
1427,0.26564525530508293,2025-04-25 04:06:20.451262,2025-04-25 04:06:21.020219,0 days 00:00:00.568957,6.990431543888313,0.03541638242793367,0.07478317350986965,rbf,TPESampler,COMPLETE
1428,0.3004346696510002,2025-04-25 04:06:21.198195,2025-04-25 04:06:21.742803,0 days 00:00:00.544608,12.430301062203096,0.04634853596598591,0.012805458912457853,rbf,TPESampler,COMPLETE
1429,0.8341037670064385,2025-04-25 04:06:21.917700,2025-04-25 04:06:22.442021,0 days 00:00:00.524321,0.10878870884453534,0.002806391771031107,0.00043989688311173414,sigmoid,TPESampler,COMPLETE
1430,0.42481362908502207,2025-04-25 04:06:22.619560,2025-04-25 04:06:23.158545,0 days 00:00:00.538985,0.14293662885722494,0.16302998234383817,0.04879110842951003,linear,TPESampler,COMPLETE
1431,0.35672068731914336,2025-04-25 04:06:23.332919,2025-04-25 04:06:23.872264,0 days 00:00:00.539345,6.549729684993865,0.0614657101295784,0.3537096297570018,rbf,TPESampler,COMPLETE
1432,0.32251226019739393,2025-04-25 04:06:24.051411,2025-04-25 04:06:24.699891,0 days 00:00:00.648480,1.3026876302420927,0.03393309720637172,0.03591243618680036,rbf,TPESampler,COMPLETE
1433,0.29695698656477754,2025-04-25 04:06:24.870114,2025-04-25 04:06:25.418952,0 days 00:00:00.548838,1.110475818175175,0.00757559331064832,0.08771068920894164,rbf,TPESampler,COMPLETE
1434,0.27005283366291444,2025-04-25 04:06:25.599952,2025-04-25 04:06:26.200744,0 days 00:00:00.600792,14.30656841458933,0.030636968425363578,0.04394815380443412,rbf,TPESampler,COMPLETE
1435,0.29189288521971407,2025-04-25 04:06:26.377557,2025-04-25 04:06:26.889622,0 days 00:00:00.512065,1.33247339860711,0.10523142260443757,0.12103530142511272,rbf,TPESampler,COMPLETE
1436,0.2928126152442968,2025-04-25 04:06:27.062460,2025-04-25 04:06:27.621295,0 days 00:00:00.558835,1.8296586700490822,0.009934630902162747,0.05072178628469336,rbf,TPESampler,COMPLETE
1437,0.30376410434971357,2025-04-25 04:06:27.801040,2025-04-25 04:06:28.587796,0 days 00:00:00.786756,1.3866586175376912,0.02099994987882238,0.20812353436878125,rbf,TPESampler,COMPLETE
1438,0.704787024591968,2025-04-25 04:06:28.766674,2025-04-25 04:06:29.302853,0 days 00:00:00.536179,0.4577186724196061,0.07672745997842488,0.952928727591919,rbf,TPESampler,COMPLETE
1439,0.27449503198120245,2025-04-25 04:06:29.479662,2025-04-25 04:06:30.059026,0 days 00:00:00.579364,34.28130962240821,0.04885226954397614,0.05784104083634994,rbf,TPESampler,COMPLETE
1440,0.5020562674549255,2025-04-25 04:06:30.340898,2025-04-25 04:06:35.738454,0 days 00:00:05.397556,15.2235303613469,0.02808709621988761,0.060129485735744004,linear,TPESampler,COMPLETE
1441,0.8360710259596817,2025-04-25 04:06:35.911806,2025-04-25 04:16:34.402984,0 days 00:09:58.491178,0.019918655180182616,0.009259381489878751,0.6317373932606563,poly,TPESampler,COMPLETE
1442,0.2973572771228084,2025-04-25 04:09:29.443165,2025-04-25 04:09:30.006326,0 days 00:00:00.563161,3.3704493408781575,0.030912983903901122,0.02773064969007249,rbf,TPESampler,COMPLETE
1443,0.26702312547286067,2025-04-25 04:09:30.180475,2025-04-25 04:09:30.889966,0 days 00:00:00.709491,7.192599270963877,0.012942896957689621,0.06616779717931655,rbf,TPESampler,COMPLETE
1444,0.26850700064096333,2025-04-25 04:09:31.065201,2025-04-25 04:09:31.660337,0 days 00:00:00.595136,6.473514272197604,0.07809992133122244,0.0659571497449749,rbf,TPESampler,COMPLETE
1445,0.269401221205841,2025-04-25 04:09:31.838529,2025-04-25 04:09:32.377692,0 days 00:00:00.539163,2.7322627767224343,0.04822980554770796,0.1025365283596081,rbf,TPESampler,COMPLETE
1446,0.9340672927762388,2025-04-25 04:09:32.554165,2025-04-25 04:09:33.057912,0 days 00:00:00.503747,0.0205234056717431,0.48972437279380243,0.00037971581978687703,rbf,TPESampler,COMPLETE
1447,0.7799995830794724,2025-04-25 04:09:33.240242,2025-04-25 04:09:33.781899,0 days 00:00:00.541657,0.008889653874359891,0.00413410758849724,0.008673235667983354,rbf,TPESampler,COMPLETE
1448,0.292666820789824,2025-04-25 04:09:33.953426,2025-04-25 04:09:34.542797,0 days 00:00:00.589371,12.978730206008114,0.02036448537033756,0.014698601743480508,rbf,TPESampler,COMPLETE
1449,0.3127709087034332,2025-04-25 04:09:34.728047,2025-04-25 04:09:35.289092,0 days 00:00:00.561045,6.820547201827676,0.024794417459084638,0.24797548946261377,rbf,TPESampler,COMPLETE
1450,0.28271271007488746,2025-04-25 04:09:35.460828,2025-04-25 04:09:35.970343,0 days 00:00:00.509515,6.867329012122383,0.08838994776450589,0.03373688678846407,rbf,TPESampler,COMPLETE
1451,0.2957082307564021,2025-04-25 04:09:36.141080,2025-04-25 04:09:36.646079,0 days 00:00:00.504999,8.934886366842909,0.14656830816949815,0.13160609166016707,rbf,TPESampler,COMPLETE
1452,0.27185652412087874,2025-04-25 04:09:37.098310,2025-04-25 04:09:37.705094,0 days 00:00:00.606784,13.138951346880368,0.025720223121040484,0.1058717056490428,rbf,TPESampler,COMPLETE
1453,1.8000420155740708,2025-04-25 04:09:37.883866,2025-04-25 04:09:38.689204,0 days 00:00:00.805338,0.11648094802320567,0.0014689650520386649,0.02044978757949504,sigmoid,TPESampler,COMPLETE
1454,0.7736973083348875,2025-04-25 04:09:38.925397,2025-04-25 04:21:19.324351,0 days 00:11:40.398954,0.3593727574225535,0.10563509188191533,0.3186392230874289,poly,TPESampler,COMPLETE
1455,0.9297968841253209,2025-04-25 04:16:34.581002,2025-04-25 04:16:35.295000,0 days 00:00:00.713998,0.0010460208522642918,0.006098366693388228,0.04080636671306863,rbf,TPESampler,COMPLETE
1456,0.26533907075696705,2025-04-25 04:16:35.463306,2025-04-25 04:16:35.997753,0 days 00:00:00.534447,5.428066601642924,0.053340192557697966,0.0728506297102861,rbf,TPESampler,COMPLETE
1457,0.35179909887267097,2025-04-25 04:16:36.172561,2025-04-25 04:16:36.957459,0 days 00:00:00.784898,3.6224275556756864,0.04044753118822002,0.008464110938925217,rbf,TPESampler,COMPLETE
1458,0.2728702607060269,2025-04-25 04:16:37.133344,2025-04-25 04:16:37.698819,0 days 00:00:00.565475,3.2777710851418522,0.02054193067507598,0.06175396353250192,rbf,TPESampler,COMPLETE
1459,0.30123139257708287,2025-04-25 04:16:37.870710,2025-04-25 04:16:38.390553,0 days 00:00:00.519843,1.9837875088786698,0.0601573747675111,0.03828231124402288,rbf,TPESampler,COMPLETE
1460,0.3499755962656753,2025-04-25 04:16:38.562978,2025-04-25 04:16:39.443660,0 days 00:00:00.880682,0.6704844608017376,0.015994828905939902,0.04039148414777369,rbf,TPESampler,COMPLETE
1461,1.274226279211237,2025-04-25 04:16:39.612830,2025-04-25 05:02:53.631382,0 days 00:46:14.018552,7.081231536984179,0.06891062479669063,0.2627612211034738,poly,TPESampler,COMPLETE
1462,0.29291998779324074,2025-04-25 04:21:19.512714,2025-04-25 04:21:20.078560,0 days 00:00:00.565846,1.7919855808671548,0.010945249191005502,0.19924961916527012,rbf,TPESampler,COMPLETE
1463,0.283046147328388,2025-04-25 04:21:20.255499,2025-04-25 04:21:20.817062,0 days 00:00:00.561563,8.787663155854087,0.03332780746053708,0.02279557048068933,rbf,TPESampler,COMPLETE
1464,0.9585961008251707,2025-04-25 04:21:20.999769,2025-04-25 04:21:21.535963,0 days 00:00:00.536194,0.001446169284311014,0.00429758936368322,0.001294617408227721,sigmoid,TPESampler,COMPLETE
1465,0.2655838601678694,2025-04-25 04:21:21.713758,2025-04-25 04:21:22.328107,0 days 00:00:00.614349,7.73850120100576,0.012983155159941149,0.08556490743586667,rbf,TPESampler,COMPLETE
1466,0.5172754322366401,2025-04-25 04:21:22.502414,2025-04-25 04:25:33.830183,0 days 00:04:11.327769,2.996893900684129,0.0611053437110905,0.06891479924066404,poly,TPESampler,COMPLETE
1467,240.34339583637652,2025-04-25 04:25:34.017568,2025-04-25 04:25:34.610652,0 days 00:00:00.593084,12.142735133553666,0.07703234214548703,0.035440456330636035,sigmoid,TPESampler,COMPLETE
1468,0.2851006256346671,2025-04-25 04:25:34.791624,2025-04-25 04:25:35.343283,0 days 00:00:00.551659,26.473587877107956,0.08462763118057227,0.026624985579711834,rbf,TPESampler,COMPLETE
1469,0.27573875343539217,2025-04-25 04:25:35.523315,2025-04-25 04:25:36.254411,0 days 00:00:00.731096,21.506305041880427,0.010515498145845148,0.06512084790541724,rbf,TPESampler,COMPLETE
1470,0.3504184420927868,2025-04-25 04:25:36.434593,2025-04-25 04:25:36.935666,0 days 00:00:00.501073,0.6384113695441139,0.1793587895507482,0.1668888379553038,rbf,TPESampler,COMPLETE
1471,0.3171207871713676,2025-04-25 04:25:37.110024,2025-04-25 04:25:37.681946,0 days 00:00:00.571922,5.415026598330924,0.011706701948249174,0.014067261959126472,rbf,TPESampler,COMPLETE
1472,0.30873156831587306,2025-04-25 04:25:37.877902,2025-04-25 04:25:38.436735,0 days 00:00:00.558833,0.7815936576313598,0.03715988657870355,0.11293870503953299,rbf,TPESampler,COMPLETE
1473,0.29626369329682567,2025-04-25 04:25:38.617496,2025-04-25 04:25:39.618755,0 days 00:00:01.001259,25.992582446628372,0.039227703920223796,0.13279939377281716,rbf,TPESampler,COMPLETE
1474,0.26857477117813444,2025-04-25 04:25:39.840140,2025-04-25 04:25:40.381537,0 days 00:00:00.541397,3.4144353087948938,0.061106380991885326,0.07045585971321552,rbf,TPESampler,COMPLETE
1475,0.3011272347676802,2025-04-25 04:25:40.562998,2025-04-25 04:25:41.138143,0 days 00:00:00.575145,5.559385151947475,0.034183676714486466,0.21594583716132482,rbf,TPESampler,COMPLETE
1476,0.26589286616036933,2025-04-25 04:25:41.312742,2025-04-25 04:25:41.866411,0 days 00:00:00.553669,10.24170679413483,0.08466751594792235,0.06808720681840895,rbf,TPESampler,COMPLETE
1477,0.40985966519562544,2025-04-25 04:25:42.083661,2025-04-25 04:25:42.642975,0 days 00:00:00.559314,0.5009028318779224,0.027220525014806877,0.015238730677889271,rbf,TPESampler,COMPLETE
1478,0.27368091944969236,2025-04-25 04:25:42.824723,2025-04-25 04:25:43.606636,0 days 00:00:00.781913,34.113906310495466,0.04495888657722517,0.05495661045058561,rbf,TPESampler,COMPLETE
1479,0.2700141654677644,2025-04-25 04:25:43.782488,2025-04-25 04:25:44.329592,0 days 00:00:00.547104,4.603994892372905,0.04623158023895407,0.05224163625242124,rbf,TPESampler,COMPLETE
1480,0.32876193419450844,2025-04-25 04:25:44.508057,2025-04-25 04:25:45.079129,0 days 00:00:00.571072,18.599621855724493,0.06945656730022219,0.24338236350006823,rbf,TPESampler,COMPLETE
1481,0.2755777532997384,2025-04-25 04:25:45.257690,2025-04-25 04:25:45.820071,0 days 00:00:00.562381,2.370531241381081,0.02127682101331557,0.07973438201014126,rbf,TPESampler,COMPLETE
1482,0.4228362377475301,2025-04-25 04:25:45.999907,2025-04-25 04:25:46.537158,0 days 00:00:00.537251,1.3892000251897982,0.05350180599827126,0.5386332271669095,rbf,TPESampler,COMPLETE
1483,0.5556273717107783,2025-04-25 04:25:46.718432,2025-04-25 04:25:47.261888,0 days 00:00:00.543456,0.00333705058847858,0.015018262751232497,0.0645618258642539,linear,TPESampler,COMPLETE
1484,0.9611423338713605,2025-04-25 04:25:47.447555,2025-04-25 04:25:47.997737,0 days 00:00:00.550182,0.03452835879539702,0.021195943339210176,0.0008017886479536309,poly,TPESampler,COMPLETE
1485,0.4845003404168868,2025-04-25 04:25:48.180634,2025-04-25 04:25:49.765170,0 days 00:00:01.584536,4.642340049655336,0.0957238392987741,0.12122910358767991,linear,TPESampler,COMPLETE
1486,0.27738558764054017,2025-04-25 04:25:49.945735,2025-04-25 04:25:50.662761,0 days 00:00:00.717026,24.662613247212764,0.02697043251019756,0.03178259601596712,rbf,TPESampler,COMPLETE
1487,0.30640295333805695,2025-04-25 04:25:50.876647,2025-04-25 04:25:51.557843,0 days 00:00:00.681196,13.965533197860783,0.009994026316529542,0.18950527886784793,rbf,TPESampler,COMPLETE
1488,0.3076543131956797,2025-04-25 04:25:51.750084,2025-04-25 04:25:52.310887,0 days 00:00:00.560803,7.58348214558976,0.05450050437524106,0.21448823101898318,rbf,TPESampler,COMPLETE
1489,0.266797965733832,2025-04-25 04:25:52.487061,2025-04-25 04:25:53.063530,0 days 00:00:00.576469,3.6723115203486834,0.032704741996311244,0.1026177124854903,rbf,TPESampler,COMPLETE
1490,0.3273879195008848,2025-04-25 04:25:53.244396,2025-04-25 04:25:53.757041,0 days 00:00:00.512645,13.504467463084632,0.18345862637317562,0.00687258492253587,rbf,TPESampler,COMPLETE
1491,0.28618602846342994,2025-04-25 04:25:53.951426,2025-04-25 04:25:54.460793,0 days 00:00:00.509367,4.294082770749936,0.18550111387432738,0.08249217934989435,rbf,TPESampler,COMPLETE
1492,0.29526130369658216,2025-04-25 04:25:54.636144,2025-04-25 04:25:55.522141,0 days 00:00:00.885997,88.6304538691212,0.12417431523891577,0.09410388459669712,rbf,TPESampler,COMPLETE
1493,0.28407876245609476,2025-04-25 04:25:55.851574,2025-04-25 04:25:56.410449,0 days 00:00:00.558875,4.825043502091782,0.025828728955480364,0.03100080040752791,rbf,TPESampler,COMPLETE
1494,0.30844056512614576,2025-04-25 04:25:56.582960,2025-04-25 04:25:57.178610,0 days 00:00:00.595650,1.07161137924123,0.05479040556484514,0.056642778567274746,rbf,TPESampler,COMPLETE
1495,0.28086533567003463,2025-04-25 04:25:57.359530,2025-04-25 04:25:57.944874,0 days 00:00:00.585344,5.144728206216742,0.010222419447435639,0.032112187765386026,rbf,TPESampler,COMPLETE
1496,0.31187343898225434,2025-04-25 04:25:58.128912,2025-04-25 04:25:58.719167,0 days 00:00:00.590255,14.779197383804963,0.017382711298103603,0.20895339078100675,rbf,TPESampler,COMPLETE
1497,0.36827265565462025,2025-04-25 04:25:58.902513,2025-04-25 04:25:59.447940,0 days 00:00:00.545427,3.1139460779736052,0.10629231454605362,0.35660424055268514,rbf,TPESampler,COMPLETE
1498,0.2790052562599452,2025-04-25 04:25:59.635018,2025-04-25 04:26:00.216909,0 days 00:00:00.581891,10.025987148255423,0.05845134833808118,0.034029792408848306,rbf,TPESampler,COMPLETE
1499,0.3142851727188826,2025-04-25 04:26:00.412120,2025-04-25 04:26:01.034965,0 days 00:00:00.622845,2.5929453558985625,0.0965739267588865,0.026383383013936536,rbf,TPESampler,COMPLETE
1500,0.27266206442598,2025-04-25 04:26:01.218443,2025-04-25 04:26:01.856974,0 days 00:00:00.638531,18.24401733731881,0.025300804918399297,0.09132487016231879,rbf,TPESampler,COMPLETE
1501,0.6837617948024027,2025-04-25 04:26:02.044201,2025-04-25 04:26:02.541087,0 days 00:00:00.496886,2.2250081160468596,0.5214578695338709,0.0010136150839546803,sigmoid,TPESampler,COMPLETE
1502,0.26925018034196163,2025-04-25 04:26:02.721375,2025-04-25 04:26:03.290627,0 days 00:00:00.569252,6.229008499571481,0.04512568540380921,0.04749455878087734,rbf,TPESampler,COMPLETE
1503,0.3228171562356352,2025-04-25 04:26:03.469251,2025-04-25 04:26:04.108332,0 days 00:00:00.639081,9.582600229516052,0.0032765351335161874,0.2714290135904258,rbf,TPESampler,COMPLETE
1504,0.7457480904568832,2025-04-25 04:26:04.299283,2025-04-25 04:26:04.778112,0 days 00:00:00.478829,0.0365090151867779,0.9717980551377944,0.04906685084724932,linear,TPESampler,COMPLETE
1505,0.5638710847799734,2025-04-25 04:26:04.996108,2025-04-25 04:26:05.954348,0 days 00:00:00.958240,0.05258953068122723,0.002317315456122615,0.11567683083480057,rbf,TPESampler,COMPLETE
1506,0.28674117229356516,2025-04-25 04:26:06.232556,2025-04-25 04:26:06.814983,0 days 00:00:00.582427,2.9442595383522585,0.02106325461192769,0.1910685548287517,rbf,TPESampler,COMPLETE
1507,0.27424641096404473,2025-04-25 04:26:06.995415,2025-04-25 04:26:07.560151,0 days 00:00:00.564736,2.19223711962562,0.026390031064055314,0.10421355186306634,rbf,TPESampler,COMPLETE
1508,0.9469624455148978,2025-04-25 04:26:07.741631,2025-04-25 04:26:08.265090,0 days 00:00:00.523459,0.15299613620934452,0.2175842412437088,0.002668272027976081,poly,TPESampler,COMPLETE
1509,0.2939818550989935,2025-04-25 04:26:08.450214,2025-04-25 04:26:09.007108,0 days 00:00:00.556894,10.660272881328055,0.06976108909801601,0.16228592046590073,rbf,TPESampler,COMPLETE
1510,0.36191119108736347,2025-04-25 04:26:09.195543,2025-04-25 04:26:09.725788,0 days 00:00:00.530245,3.791193182871255,0.08602439332766594,0.006834975146685282,rbf,TPESampler,COMPLETE
1511,0.2721387467187971,2025-04-25 04:26:09.903964,2025-04-25 04:26:10.550794,0 days 00:00:00.646830,12.807660252347484,0.01301821478148771,0.04297277356493769,rbf,TPESampler,COMPLETE
1512,0.503419202138478,2025-04-25 04:26:10.731545,2025-04-25 04:26:11.288271,0 days 00:00:00.556726,0.0664912669181532,0.02631415570820112,0.07049775875208798,rbf,TPESampler,COMPLETE
1513,0.28888033261388274,2025-04-25 04:26:11.474098,2025-04-25 04:26:12.007838,0 days 00:00:00.533740,20.960089013311954,0.12558893178046976,0.029657009548340857,rbf,TPESampler,COMPLETE
1514,0.3130511693334725,2025-04-25 04:26:12.189185,2025-04-25 04:26:12.844814,0 days 00:00:00.655629,28.854405323803554,0.025025951841833274,0.2187478908755444,rbf,TPESampler,COMPLETE
1515,0.29459437557741275,2025-04-25 04:26:13.051876,2025-04-25 04:26:13.623301,0 days 00:00:00.571425,2.2893715535096018,0.01177075857149369,0.0402409656426691,rbf,TPESampler,COMPLETE
1516,0.31322631229767267,2025-04-25 04:26:13.805181,2025-04-25 04:26:14.407375,0 days 00:00:00.602194,60.395008784769985,0.05317173117965417,0.009336674652203272,rbf,TPESampler,COMPLETE
1517,0.3246738754932724,2025-04-25 04:26:14.587381,2025-04-25 04:26:15.328257,0 days 00:00:00.740876,0.622422160388958,0.04541370303512762,0.08331270180614031,rbf,TPESampler,COMPLETE
1518,0.4962221643640329,2025-04-25 04:26:15.670479,2025-04-25 04:26:16.880610,0 days 00:00:01.210131,2.785746446309774,0.04068575289716899,0.014248930665352637,linear,TPESampler,COMPLETE
1519,0.2750738481626112,2025-04-25 04:26:17.061800,2025-04-25 04:26:17.695497,0 days 00:00:00.633697,7.88899176870968,0.03211361569285611,0.03546826061683559,rbf,TPESampler,COMPLETE
1520,0.2709594962839604,2025-04-25 04:26:17.905614,2025-04-25 04:26:18.446949,0 days 00:00:00.541335,5.133970155296621,0.10435519315397924,0.08396920097317093,rbf,TPESampler,COMPLETE
1521,1.1711030260523194,2025-04-25 04:26:18.628761,2025-04-25 04:43:09.734120,0 days 00:16:51.105359,51.16375497619832,0.02073484660596483,0.1283165020614816,poly,TPESampler,COMPLETE
1522,0.26879439907543495,2025-04-25 04:43:09.926890,2025-04-25 04:43:10.592139,0 days 00:00:00.665249,18.206295525911,0.05987731405108648,0.07911910412156431,rbf,TPESampler,COMPLETE
1523,0.671825672356022,2025-04-25 04:43:10.788720,2025-04-25 04:43:11.463257,0 days 00:00:00.674537,5.160763393771554,0.015708029273489965,0.01125843711946725,poly,TPESampler,COMPLETE
1524,22.867704775305196,2025-04-25 04:43:11.643095,2025-04-25 04:43:12.183102,0 days 00:00:00.540007,1.0048376176225489,0.03605204412431285,0.08303374393247531,sigmoid,TPESampler,COMPLETE
1525,0.2747725795140645,2025-04-25 04:43:12.363063,2025-04-25 04:43:13.040093,0 days 00:00:00.677030,21.830328583669917,0.02214308236664999,0.05414653835156649,rbf,TPESampler,COMPLETE
1526,0.5425299947969134,2025-04-25 04:43:13.221326,2025-04-25 04:43:13.747803,0 days 00:00:00.526477,0.1727965984627674,0.1527080149266681,0.008687467572147497,rbf,TPESampler,COMPLETE
1527,0.3977131480855653,2025-04-25 04:43:13.928980,2025-04-25 04:43:14.470662,0 days 00:00:00.541682,35.01353722227191,0.08681875037265854,0.459894703571253,rbf,TPESampler,COMPLETE
1528,0.2702156549559792,2025-04-25 04:43:14.659000,2025-04-25 04:43:15.211225,0 days 00:00:00.552225,2.4970208205311684,0.048399705591986045,0.09406210776260192,rbf,TPESampler,COMPLETE
1529,0.31157219846072554,2025-04-25 04:43:15.642339,2025-04-25 04:43:16.259733,0 days 00:00:00.617394,3.2105362349695135,0.043051896893521194,0.0220846275501194,rbf,TPESampler,COMPLETE
1530,0.313910976200988,2025-04-25 04:43:16.452312,2025-04-25 04:43:17.041080,0 days 00:00:00.588768,2.6081411210635284,0.023022571204045734,0.2823176233816448,rbf,TPESampler,COMPLETE
1531,0.570588671927916,2025-04-25 04:43:17.218625,2025-04-25 04:44:35.905396,0 days 00:01:18.686771,15.707735318679955,0.06353968449082814,0.023405365777966085,poly,TPESampler,COMPLETE
1532,30.953068691892042,2025-04-25 04:44:36.092050,2025-04-25 04:44:36.652850,0 days 00:00:00.560800,1.595496279493968,0.007599818023710254,0.03351536676959804,sigmoid,TPESampler,COMPLETE
1533,0.274263197231074,2025-04-25 04:44:36.905333,2025-04-25 04:44:37.458130,0 days 00:00:00.552797,17.30317919265498,0.07709923535885756,0.09552053416326382,rbf,TPESampler,COMPLETE
1534,0.3081336986680866,2025-04-25 04:44:37.637625,2025-04-25 04:44:38.205817,0 days 00:00:00.568192,2.3240471039032853,0.024607762591452333,0.029220399669461855,rbf,TPESampler,COMPLETE
