number,value,datetime_start,datetime_complete,duration,params_C,params_epsilon,params_gamma,params_kernel,system_attrs_auto:sampler,state
590,0.2939552642756088,2025-04-25 00:47:37.232318,2025-04-25 00:47:37.715354,0 days 00:00:00.483036,18.421349126434325,0.10069139791433027,0.025319023977654957,rbf,TPESampler,COMPLETE
591,0.28318264588518627,2025-04-25 00:47:37.874297,2025-04-25 00:47:38.386758,0 days 00:00:00.512461,16.319992486491888,0.04883858038155462,0.028377262057299388,rbf,TPESampler,COMPLETE
592,0.30605882162285386,2025-04-25 00:47:38.552243,2025-04-25 00:47:39.209939,0 days 00:00:00.657696,24.462580005040977,0.02578244844846027,0.17196501013525894,rbf,TPESampler,COMPLETE
593,1141.9408380432976,2025-04-25 00:47:39.370046,2025-04-25 00:47:39.865901,0 days 00:00:00.495855,51.091815017034996,0.06532206320861195,0.06675151187810607,sigmoid,TPESampler,COMPLETE
594,0.2844248303352695,2025-04-25 00:47:40.024489,2025-04-25 00:47:40.494925,0 days 00:00:00.470436,1.5883314092512004,0.09918481162848694,0.10210473924853021,rbf,TPESampler,COMPLETE
595,0.5145533613651654,2025-04-25 00:47:40.659488,2025-04-25 00:47:41.202113,0 days 00:00:00.542625,2.0787802445482835,0.007338712108081623,0.8171704015950896,rbf,TPESampler,COMPLETE
596,0.2776560506201934,2025-04-25 00:47:41.367129,2025-04-25 00:47:41.912949,0 days 00:00:00.545820,9.248349543627988,0.02254181091449657,0.03101245148588674,rbf,TPESampler,COMPLETE
597,0.3159465224311725,2025-04-25 00:47:42.067634,2025-04-25 00:47:42.571192,0 days 00:00:00.503558,53.28148861942123,0.07939930348938727,0.19013299820440538,rbf,TPESampler,COMPLETE
598,0.6374580424210963,2025-04-25 00:47:42.730867,2025-04-25 00:47:44.559240,0 days 00:00:01.828373,0.7656171091109188,0.004137804775631089,0.037578829639715476,poly,TPESampler,COMPLETE
599,0.29129641639926396,2025-04-25 00:47:44.739336,2025-04-25 00:47:45.424641,0 days 00:00:00.685305,2.969925199957371,0.11101850522298995,0.04500000424852128,rbf,TPESampler,COMPLETE
600,0.8667136017913082,2025-04-25 00:47:45.872096,2025-04-25 00:58:47.448218,0 days 00:11:01.576122,9.545736113603262,0.030337761312457356,0.09790733075759904,poly,TPESampler,COMPLETE
601,0.40674654495390916,2025-04-25 00:58:47.617624,2025-04-25 00:58:48.124213,0 days 00:00:00.506589,6.482120714512528,0.06956325120411802,0.5010551468319538,rbf,TPESampler,COMPLETE
602,0.789575748608563,2025-04-25 00:58:48.285370,2025-04-25 00:58:56.714066,0 days 00:00:08.428696,20.896259078597417,0.3308906497478001,0.0858212538685924,poly,TPESampler,COMPLETE
603,0.28609712519822295,2025-04-25 00:58:56.891791,2025-04-25 00:58:57.478325,0 days 00:00:00.586534,1.4510637129707677,0.01832762822730253,0.11459694952414463,rbf,TPESampler,COMPLETE
604,0.26847973056192337,2025-04-25 00:58:57.648405,2025-04-25 00:58:58.161405,0 days 00:00:00.513000,4.501500913178036,0.05099699002878669,0.11339949889038851,rbf,TPESampler,COMPLETE
605,0.9503712078646737,2025-04-25 00:58:58.318876,2025-04-25 00:58:58.845459,0 days 00:00:00.526583,0.0019357290867938724,0.003223387730159387,0.001418651663736079,rbf,TPESampler,COMPLETE
606,0.26574754935826383,2025-04-25 00:58:59.003841,2025-04-25 00:58:59.542636,0 days 00:00:00.538795,9.726384403341171,0.04401688244437066,0.06824473623730358,rbf,TPESampler,COMPLETE
607,0.30127622252583375,2025-04-25 00:58:59.702441,2025-04-25 00:59:00.295419,0 days 00:00:00.592978,24.598019679500492,0.011570712983854071,0.144213610825554,rbf,TPESampler,COMPLETE
608,207.07861386832087,2025-04-25 00:59:00.452384,2025-04-25 00:59:00.957702,0 days 00:00:00.505318,9.401278033250883,0.002427127984646323,0.21809371086608398,sigmoid,TPESampler,COMPLETE
609,0.32294333019818,2025-04-25 00:59:01.121833,2025-04-25 00:59:01.639587,0 days 00:00:00.517754,6.692701319171468,0.02881585989745935,0.011115584870266338,rbf,TPESampler,COMPLETE
610,0.272230609685459,2025-04-25 00:59:01.802837,2025-04-25 00:59:02.421358,0 days 00:00:00.618521,19.079268814067426,0.014153893205627046,0.044489685878136905,rbf,TPESampler,COMPLETE
611,1058.9343237630817,2025-04-25 00:59:02.587425,2025-04-25 00:59:03.109353,0 days 00:00:00.521928,41.7866362012556,0.7955237191007891,0.42805063369575447,sigmoid,TPESampler,COMPLETE
612,0.26735988700855917,2025-04-25 00:59:03.271317,2025-04-25 00:59:03.828691,0 days 00:00:00.557374,16.900101265080004,0.0414325491516786,0.06785281646696348,rbf,TPESampler,COMPLETE
613,0.2682010315760614,2025-04-25 00:59:03.995145,2025-04-25 00:59:04.514964,0 days 00:00:00.519819,3.6231603727085155,0.028705423479880157,0.06862879357267221,rbf,TPESampler,COMPLETE
614,0.34167793512913053,2025-04-25 00:59:04.688126,2025-04-25 00:59:05.224417,0 days 00:00:00.536291,5.223449441949182,0.028553348107070806,0.3447199967282182,rbf,TPESampler,COMPLETE
615,0.2799260669039816,2025-04-25 00:59:05.447231,2025-04-25 00:59:06.135987,0 days 00:00:00.688756,37.94553828339826,0.03129328093366987,0.07267308849543734,rbf,TPESampler,COMPLETE
616,0.2867227087297391,2025-04-25 00:59:06.294914,2025-04-25 00:59:06.795953,0 days 00:00:00.501039,2.819215088858469,0.046661875862943375,0.04449323077997664,rbf,TPESampler,COMPLETE
617,52.45229859729571,2025-04-25 00:59:06.956108,2025-04-25 00:59:07.468162,0 days 00:00:00.512054,2.381924880238137,0.01970490002614659,0.0917853354707435,sigmoid,TPESampler,COMPLETE
618,0.7879148903536444,2025-04-25 00:59:07.626019,2025-04-25 00:59:08.137914,0 days 00:00:00.511895,0.011385072876394625,0.15842226197674925,0.034292958490961346,poly,TPESampler,COMPLETE
619,0.9434951468468735,2025-04-25 00:59:08.296750,2025-04-25 00:59:08.798408,0 days 00:00:00.501658,0.1304769866572696,0.006003228595871406,0.0031436842812862867,poly,TPESampler,COMPLETE
620,0.27851465740785786,2025-04-25 00:59:08.962394,2025-04-25 00:59:09.485243,0 days 00:00:00.522849,10.151429266293217,0.05487640119649269,0.12881263316018546,rbf,TPESampler,COMPLETE
621,0.27493722242732205,2025-04-25 00:59:09.651425,2025-04-25 00:59:10.203695,0 days 00:00:00.552270,4.384140036184941,0.022008286987486157,0.14641774355091605,rbf,TPESampler,COMPLETE
622,0.3904001741116385,2025-04-25 00:59:10.365138,2025-04-25 00:59:10.860630,0 days 00:00:00.495492,0.6841606762915949,0.04767692532793743,0.01645028937706795,rbf,TPESampler,COMPLETE
623,0.29531334122651565,2025-04-25 00:59:11.028373,2025-04-25 00:59:11.495948,0 days 00:00:00.467575,27.33146722240987,0.15625276016961503,0.10121164707855904,rbf,TPESampler,COMPLETE
624,0.3119205297237397,2025-04-25 00:59:11.658142,2025-04-25 00:59:12.194735,0 days 00:00:00.536593,4.474025552449718,0.013718671435628833,0.017538811462427407,rbf,TPESampler,COMPLETE
625,0.44991607577302195,2025-04-25 00:59:12.355950,2025-04-25 00:59:12.844346,0 days 00:00:00.488396,0.2674674520004176,0.07610781403443426,0.264452279782991,rbf,TPESampler,COMPLETE
626,0.7572149808851395,2025-04-25 00:59:13.004137,2025-04-25 00:59:13.517668,0 days 00:00:00.513531,0.012422701607740215,0.04274352331589747,0.09525843297451447,rbf,TPESampler,COMPLETE
627,0.2783623992712975,2025-04-25 00:59:13.678416,2025-04-25 00:59:14.165976,0 days 00:00:00.487560,5.837985274280475,0.15372326598451985,0.08747530780042445,rbf,TPESampler,COMPLETE
628,0.29527005435517517,2025-04-25 00:59:14.328551,2025-04-25 00:59:14.852732,0 days 00:00:00.524181,8.091869510708861,0.05445456472929445,0.017622558013189436,rbf,TPESampler,COMPLETE
629,0.2811087474258055,2025-04-25 00:59:15.019157,2025-04-25 00:59:15.541114,0 days 00:00:00.521957,16.23007817016865,0.05327642677139626,0.1251461297687485,rbf,TPESampler,COMPLETE
630,0.2711547609049385,2025-04-25 00:59:15.705061,2025-04-25 00:59:16.226101,0 days 00:00:00.521040,2.4966656711417055,0.0380038796999049,0.1063103142056988,rbf,TPESampler,COMPLETE
631,0.27385462626000795,2025-04-25 00:59:16.383948,2025-04-25 00:59:16.980364,0 days 00:00:00.596416,11.834098263196868,0.012426507072568684,0.11745314890915273,rbf,TPESampler,COMPLETE
632,0.2764326958860191,2025-04-25 00:59:17.144564,2025-04-25 00:59:17.764232,0 days 00:00:00.619668,33.58017311730514,0.03205074480602511,0.03453764682560196,rbf,TPESampler,COMPLETE
633,0.9006252922700085,2025-04-25 00:59:17.929819,2025-04-25 00:59:18.427844,0 days 00:00:00.498025,0.00926684048560217,0.03637046198756506,0.0764900658441326,sigmoid,TPESampler,COMPLETE
634,0.30515901596595224,2025-04-25 00:59:18.589109,2025-04-25 00:59:19.093226,0 days 00:00:00.504117,3.1932745585595397,0.05197407976835785,0.025445523442751333,rbf,TPESampler,COMPLETE
635,0.35615806727983146,2025-04-25 00:59:19.258016,2025-04-25 00:59:19.778922,0 days 00:00:00.520906,0.6726690727223943,0.018847016698090788,0.036373709749992905,rbf,TPESampler,COMPLETE
636,0.5049864350944911,2025-04-25 00:59:19.945018,2025-04-25 00:59:32.070251,0 days 00:00:12.125233,38.423043481931344,0.007446913556687911,0.027498503222318067,linear,TPESampler,COMPLETE
637,0.27071866701191044,2025-04-25 00:59:32.228488,2025-04-25 00:59:32.895770,0 days 00:00:00.667282,15.458136145944389,0.05642460457102813,0.09272679074466321,rbf,TPESampler,COMPLETE
638,0.29424029176918354,2025-04-25 00:59:33.132208,2025-04-25 00:59:33.908702,0 days 00:00:00.776494,1.9736840556088509,0.03499862395623509,0.2044004816857386,rbf,TPESampler,COMPLETE
639,0.3131606155327324,2025-04-25 00:59:34.088543,2025-04-25 00:59:34.614166,0 days 00:00:00.525623,4.391475134147768,0.23047064110898471,0.031079534714382434,rbf,TPESampler,COMPLETE
640,0.2755494751779493,2025-04-25 00:59:34.782915,2025-04-25 00:59:35.348630,0 days 00:00:00.565715,2.7904285043600785,0.004962541548431047,0.07275473453778519,rbf,TPESampler,COMPLETE
641,0.27988362088679986,2025-04-25 00:59:35.510543,2025-04-25 00:59:36.021862,0 days 00:00:00.511319,7.523314301154775,0.08240061831540146,0.12985609341908083,rbf,TPESampler,COMPLETE
642,0.26677922393767345,2025-04-25 00:59:36.188665,2025-04-25 00:59:36.812476,0 days 00:00:00.623811,10.437227931356233,0.026145380329591,0.0856425983538081,rbf,TPESampler,COMPLETE
643,0.299646546763222,2025-04-25 00:59:37.163903,2025-04-25 00:59:37.694190,0 days 00:00:00.530287,1.1264725318060573,0.05934648972779278,0.07172002710675406,rbf,TPESampler,COMPLETE
644,0.27890540631657684,2025-04-25 00:59:37.870282,2025-04-25 00:59:38.430108,0 days 00:00:00.559826,23.24665592046088,0.05772320729152611,0.029628152316073603,rbf,TPESampler,COMPLETE
645,0.6188130011990893,2025-04-25 00:59:38.594547,2025-04-25 00:59:39.152147,0 days 00:00:00.557600,0.14378565938649163,0.011716263401855342,0.004345594683937461,rbf,TPESampler,COMPLETE
646,71.3153304230255,2025-04-25 00:59:39.318626,2025-04-25 00:59:39.837296,0 days 00:00:00.518670,4.036213611853798,0.04030028307691532,0.029042018940699132,sigmoid,TPESampler,COMPLETE
647,0.3711694691085151,2025-04-25 00:59:40.006575,2025-04-25 00:59:40.549828,0 days 00:00:00.543253,28.283151988642985,0.03252674434973231,0.42741690023264634,rbf,TPESampler,COMPLETE
648,408.44383857709283,2025-04-25 00:59:40.722736,2025-04-25 00:59:41.242396,0 days 00:00:00.519660,93.65450321155443,0.09235810157337818,0.0067622328308779515,sigmoid,TPESampler,COMPLETE
649,0.5006880482496627,2025-04-25 00:59:41.410043,2025-04-25 00:59:44.192743,0 days 00:00:02.782700,6.628627322858086,0.0198682007320409,0.08983094908142245,linear,TPESampler,COMPLETE
650,0.27477244398721135,2025-04-25 00:59:44.367410,2025-04-25 00:59:44.959460,0 days 00:00:00.592050,5.01321297632102,0.041306578808788935,0.04303555297505034,rbf,TPESampler,COMPLETE
651,0.2720099533338071,2025-04-25 00:59:45.122369,2025-04-25 00:59:45.688833,0 days 00:00:00.566464,8.37121682023163,0.02417957181215767,0.040206116992818924,rbf,TPESampler,COMPLETE
652,0.9102553229603964,2025-04-25 00:59:45.856682,2025-04-25 01:27:04.324040,0 days 00:27:18.467358,92.37124531975849,0.04602732151623297,0.06488515422414999,poly,TPESampler,COMPLETE
653,0.31993681387574846,2025-04-25 01:04:52.369224,2025-04-25 01:04:52.848660,0 days 00:00:00.479436,12.451130278930208,0.10530539172152878,0.19582609702546744,rbf,TPESampler,COMPLETE
654,0.2734885419909215,2025-04-25 01:04:53.003549,2025-04-25 01:04:53.527576,0 days 00:00:00.524027,4.691524284412608,0.03037432547181107,0.047255893705549626,rbf,TPESampler,COMPLETE
655,0.37822507329898597,2025-04-25 01:04:53.705274,2025-04-25 01:04:54.141870,0 days 00:00:00.436596,37.0582482987013,0.39745338219375437,0.010352340382053717,rbf,TPESampler,COMPLETE
656,0.29141657865875137,2025-04-25 01:04:54.304557,2025-04-25 01:04:54.858888,0 days 00:00:00.554331,64.78870965685984,0.048191156284548446,0.08252652493255701,rbf,TPESampler,COMPLETE
657,0.316513587369614,2025-04-25 01:04:55.019020,2025-04-25 01:04:55.513735,0 days 00:00:00.494715,2.9054466992646355,0.1312317191263593,0.20104499350065422,rbf,TPESampler,COMPLETE
658,0.2830823378418851,2025-04-25 01:04:55.670215,2025-04-25 01:04:56.184707,0 days 00:00:00.514492,1.7085857029213716,0.023560093340289037,0.1300194730220424,rbf,TPESampler,COMPLETE
659,0.3007388357633051,2025-04-25 01:04:56.346073,2025-04-25 01:04:56.885322,0 days 00:00:00.539249,7.165932363863038,0.018149245672734057,0.2123233036197966,rbf,TPESampler,COMPLETE
660,0.2889114433887861,2025-04-25 01:04:57.045473,2025-04-25 01:04:57.542222,0 days 00:00:00.496749,10.92829857165475,0.09714947498596292,0.02869192946218336,rbf,TPESampler,COMPLETE
661,0.2962355377551649,2025-04-25 01:04:57.704201,2025-04-25 01:04:58.199006,0 days 00:00:00.494805,1.456305219892511,0.06288636860229632,0.058049577446547596,rbf,TPESampler,COMPLETE
662,0.2963106401042089,2025-04-25 01:04:58.367716,2025-04-25 01:04:59.320436,0 days 00:00:00.952720,72.72650634224783,0.013234008874279495,0.045867425031584044,rbf,TPESampler,COMPLETE
663,0.2751457923613345,2025-04-25 01:04:59.472994,2025-04-25 01:05:00.034205,0 days 00:00:00.561211,8.31807768427339,0.013221902195959314,0.03576717430965223,rbf,TPESampler,COMPLETE
664,0.2693564537234931,2025-04-25 01:05:00.198052,2025-04-25 01:05:00.739262,0 days 00:00:00.541210,11.039134486694813,0.06453914790584969,0.045692616875974,rbf,TPESampler,COMPLETE
665,0.3455374478456323,2025-04-25 01:05:00.900674,2025-04-25 01:05:01.409875,0 days 00:00:00.509201,10.673095049102725,0.07857806174903627,0.29736520996187066,rbf,TPESampler,COMPLETE
666,0.2934956702559489,2025-04-25 01:05:01.572884,2025-04-25 01:05:02.094661,0 days 00:00:00.521777,2.7310574689295666,0.021488474687431543,0.03532847868460913,rbf,TPESampler,COMPLETE
667,0.6421575051117455,2025-04-25 01:05:02.323325,2025-04-25 01:05:03.574236,0 days 00:00:01.250911,3.940640319728048,0.09840989964323993,0.020348738249839692,poly,TPESampler,COMPLETE
668,0.34446527850889114,2025-04-25 01:05:03.732629,2025-04-25 01:05:04.250705,0 days 00:00:00.518076,7.892685623921143,0.030164125572612124,0.3427307130388195,rbf,TPESampler,COMPLETE
669,0.2725736534837767,2025-04-25 01:05:04.410034,2025-04-25 01:05:05.056539,0 days 00:00:00.646505,3.8566631212030673,0.10051881619526952,0.07770884306716282,rbf,TPESampler,COMPLETE
670,0.36338614392898405,2025-04-25 01:05:05.216403,2025-04-25 01:05:05.670015,0 days 00:00:00.453612,0.7689170981594312,0.1948100871243348,0.0338493772559669,rbf,TPESampler,COMPLETE
671,0.5737267004016126,2025-04-25 01:05:05.830600,2025-04-25 01:05:43.519350,0 days 00:00:37.688750,0.0027326834664082532,0.0012516027040790309,0.5293526784905532,poly,TPESampler,COMPLETE
672,0.8643548562306249,2025-04-25 01:05:43.681648,2025-04-25 01:05:44.213304,0 days 00:00:00.531656,0.0010621091277954883,0.005995608039746846,0.04444657114565267,poly,TPESampler,COMPLETE
673,0.30180095683163083,2025-04-25 01:05:44.384064,2025-04-25 01:05:44.982805,0 days 00:00:00.598741,29.450931340509754,0.030398883834947443,0.009436121943552277,rbf,TPESampler,COMPLETE
674,0.27228565926467385,2025-04-25 01:05:45.151081,2025-04-25 01:05:45.712534,0 days 00:00:00.561453,21.095332282327593,0.04474943922784706,0.05196207570570114,rbf,TPESampler,COMPLETE
675,0.2842814645042375,2025-04-25 01:05:45.876724,2025-04-25 01:05:46.441881,0 days 00:00:00.565157,7.371971535764249,0.018512272887038318,0.16894673914388272,rbf,TPESampler,COMPLETE
676,0.2849246496743439,2025-04-25 01:05:46.602648,2025-04-25 01:05:47.128201,0 days 00:00:00.525553,1.526580241557127,0.03459035382694856,0.12541175762986517,rbf,TPESampler,COMPLETE
677,0.3488787615647666,2025-04-25 01:05:47.290773,2025-04-25 01:05:47.820341,0 days 00:00:00.529568,1.348333425450672,0.022605439040263412,0.021720888613594794,rbf,TPESampler,COMPLETE
678,0.2849726516888595,2025-04-25 01:05:47.995094,2025-04-25 01:05:48.488713,0 days 00:00:00.493619,30.337978708863073,0.12313772255522608,0.031617271276113725,rbf,TPESampler,COMPLETE
679,0.30767059362147103,2025-04-25 01:05:48.655113,2025-04-25 01:05:49.396723,0 days 00:00:00.741610,34.27137519953132,0.0038108112624681526,0.15511165197214963,rbf,TPESampler,COMPLETE
680,0.2839989991964597,2025-04-25 01:05:49.556092,2025-04-25 01:05:50.093001,0 days 00:00:00.536909,11.16325857734937,0.029830859385050312,0.15180222695361875,rbf,TPESampler,COMPLETE
681,0.277023912075033,2025-04-25 01:05:50.269970,2025-04-25 01:05:50.777002,0 days 00:00:00.507032,4.819466195268502,0.05752229604575947,0.04248215192009994,rbf,TPESampler,COMPLETE
682,0.2725248390132103,2025-04-25 01:05:50.949666,2025-04-25 01:05:51.488892,0 days 00:00:00.539226,5.877907117442107,0.050810994721536155,0.11958030285443348,rbf,TPESampler,COMPLETE
683,0.3745208950717025,2025-04-25 01:05:51.653328,2025-04-25 01:05:52.191481,0 days 00:00:00.538153,67.3273742066637,0.034369654501351564,0.43625876534800867,rbf,TPESampler,COMPLETE
684,0.2913021724743965,2025-04-25 01:05:52.356371,2025-04-25 01:05:52.907363,0 days 00:00:00.550992,6.555218510083265,0.019220370076608862,0.021529401303618263,rbf,TPESampler,COMPLETE
685,0.5000771070301985,2025-04-25 01:05:53.071942,2025-04-25 01:05:53.602564,0 days 00:00:00.530622,0.9633348283444666,0.12130511886277977,0.6260201910771321,rbf,TPESampler,COMPLETE
686,0.5170235876976015,2025-04-25 01:05:53.763294,2025-04-25 01:05:54.225818,0 days 00:00:00.462524,78.77412000947716,0.414970742005125,0.00020811464005706236,sigmoid,TPESampler,COMPLETE
687,942.0741380265612,2025-04-25 01:05:54.391573,2025-04-25 01:05:54.907627,0 days 00:00:00.516054,43.979602442363635,0.010721299054363103,0.10754023276313995,sigmoid,TPESampler,COMPLETE
688,0.3719976820380334,2025-04-25 01:05:55.073418,2025-04-25 01:05:55.581806,0 days 00:00:00.508388,2.861272326005281,0.06043906503268258,0.007231314175260931,rbf,TPESampler,COMPLETE
689,0.26414998112066446,2025-04-25 01:05:55.745304,2025-04-25 01:05:56.298524,0 days 00:00:00.553220,5.691632983665266,0.04573101774533355,0.06379680257140259,rbf,TPESampler,COMPLETE
690,0.2884613136660578,2025-04-25 01:05:56.471986,2025-04-25 01:05:56.961556,0 days 00:00:00.489570,2.4196119857389045,0.14941788772050213,0.06409561796081929,rbf,TPESampler,COMPLETE
691,0.27144900699815727,2025-04-25 01:05:57.129718,2025-04-25 01:05:57.643704,0 days 00:00:00.513986,7.08111448693401,0.0769868295619796,0.051397496328163685,rbf,TPESampler,COMPLETE
692,0.408754180142007,2025-04-25 01:05:57.803961,2025-04-25 01:05:58.347418,0 days 00:00:00.543457,71.78557461764389,0.007546289101672576,0.0002459473888537729,rbf,TPESampler,COMPLETE
693,49.35478893296409,2025-04-25 01:05:58.510810,2025-04-25 01:05:59.026493,0 days 00:00:00.515683,7.400418943852342,0.01280765014550106,0.009300751244835717,sigmoid,TPESampler,COMPLETE
694,0.3129215950591765,2025-04-25 01:05:59.191512,2025-04-25 01:05:59.696486,0 days 00:00:00.504974,15.159298479802496,0.12200163384046332,0.16745984596692812,rbf,TPESampler,COMPLETE
695,0.4007846308387632,2025-04-25 01:05:59.863215,2025-04-25 01:06:00.373838,0 days 00:00:00.510623,0.1962031283958862,0.03428107226489571,0.08163792590861849,rbf,TPESampler,COMPLETE
696,0.3231505190407597,2025-04-25 01:06:00.546976,2025-04-25 01:06:01.042320,0 days 00:00:00.495344,6.95303199828204,0.15109413092548932,0.011265784687217862,rbf,TPESampler,COMPLETE
697,0.5187181981400276,2025-04-25 01:06:01.218388,2025-04-25 01:06:05.189707,0 days 00:00:03.971319,69.43592895183781,0.44678052459986095,0.031201658209716567,linear,TPESampler,COMPLETE
698,0.2865887743769144,2025-04-25 01:06:05.619477,2025-04-25 01:06:06.152249,0 days 00:00:00.532772,1.55111515315241,0.052573704697243165,0.13599843076660167,rbf,TPESampler,COMPLETE
699,0.2746140997849034,2025-04-25 01:06:06.328258,2025-04-25 01:06:06.973493,0 days 00:00:00.645235,17.707904337913288,0.02589420269878279,0.10188915934421965,rbf,TPESampler,COMPLETE
700,0.28515210688927556,2025-04-25 01:06:07.145640,2025-04-25 01:06:07.692598,0 days 00:00:00.546958,10.673527913456642,0.05499344453061159,0.0220078701836561,rbf,TPESampler,COMPLETE
701,0.8863215559686668,2025-04-25 01:06:07.870856,2025-04-25 01:06:08.395854,0 days 00:00:00.524998,0.03498775011250241,0.17941753308908845,0.0006696476699701525,sigmoid,TPESampler,COMPLETE
702,0.2921977995455429,2025-04-25 01:06:08.574406,2025-04-25 01:06:09.119248,0 days 00:00:00.544842,30.954723184602457,0.07325232302265809,0.11596630863794563,rbf,TPESampler,COMPLETE
703,0.2793274991680771,2025-04-25 01:06:09.294805,2025-04-25 01:06:09.876798,0 days 00:00:00.581993,2.4571352542920897,0.00788589648515655,0.1562979660353894,rbf,TPESampler,COMPLETE
704,0.3619266882620438,2025-04-25 01:06:10.046575,2025-04-25 01:06:10.579040,0 days 00:00:00.532465,5.4089627048320414,0.0646544842541368,0.3696801798673708,rbf,TPESampler,COMPLETE
705,0.29435066216640393,2025-04-25 01:06:10.745402,2025-04-25 01:06:11.314995,0 days 00:00:00.569593,1.7058915294670893,0.022518063967558368,0.05029915436294181,rbf,TPESampler,COMPLETE
706,0.5373071069298951,2025-04-25 01:06:11.492422,2025-04-25 01:10:33.448550,0 days 00:04:21.956128,2.4627312736121807,0.026625879382569002,0.08117666926889906,poly,TPESampler,COMPLETE
707,0.35435382067532345,2025-04-25 01:10:33.620621,2025-04-25 01:10:34.196355,0 days 00:00:00.575734,1.1735652063548585,0.052939646997772115,0.02138818817356424,rbf,TPESampler,COMPLETE
708,5.115208673999056,2025-04-25 01:10:34.419970,2025-04-25 02:41:02.868424,0 days 01:30:28.448454,1.5047109085734076,0.012930717215971653,0.8668581458702489,poly,TPESampler,COMPLETE
