number,value,datetime_start,datetime_complete,duration,params_C,params_epsilon,params_gamma,params_kernel,system_attrs_auto:sampler,state
2125,0.799231695153807,2025-04-25 07:19:40.862548,2025-04-25 07:19:41.424443,0 days 00:00:00.561895,33.89105101758489,0.004950107675216052,0.0022194107286568963,poly,TPESampler,COMPLETE
2126,0.37004479407600455,2025-04-25 07:19:41.616781,2025-04-25 07:19:42.184993,0 days 00:00:00.568212,2.15226706012262,0.022819950595669308,0.009291721349939717,rbf,TPESampler,COMPLETE
2127,0.29704375425598406,2025-04-25 07:19:42.608608,2025-04-25 07:19:43.123186,0 days 00:00:00.514578,27.84855045237739,0.16130698394003237,0.10073080679526392,rbf,TPESampler,COMPLETE
2128,0.3659528314423463,2025-04-25 07:19:43.312214,2025-04-25 07:19:43.827611,0 days 00:00:00.515397,88.41677971235602,0.34474242466790894,0.0064983318800723566,rbf,TPESampler,COMPLETE
2129,0.2909142775152996,2025-04-25 07:19:44.014876,2025-04-25 07:19:44.607745,0 days 00:00:00.592869,5.520816188860141,0.04849176379434151,0.02409843671498581,rbf,TPESampler,COMPLETE
2130,0.29884958854220633,2025-04-25 07:19:44.794562,2025-04-25 07:19:45.743697,0 days 00:00:00.949135,87.6661472628248,0.021771530890935652,0.0345869638784105,rbf,TPESampler,COMPLETE
2131,0.28286950975486974,2025-04-25 07:19:45.931406,2025-04-25 07:19:46.505907,0 days 00:00:00.574501,11.384478073927426,0.06850326979831568,0.13246435889251162,rbf,TPESampler,COMPLETE
2132,0.31796273636289424,2025-04-25 07:19:46.693122,2025-04-25 07:19:47.288422,0 days 00:00:00.595300,14.445898102820475,0.019696128117057843,0.2419085513534112,rbf,TPESampler,COMPLETE
2133,0.28149354934889304,2025-04-25 07:19:47.488670,2025-04-25 07:19:48.036698,0 days 00:00:00.548028,1.9916886195119283,0.04086752792365656,0.07233400306808166,rbf,TPESampler,COMPLETE
2134,0.41980324879264114,2025-04-25 07:19:48.225611,2025-04-25 07:19:48.791740,0 days 00:00:00.566129,1.09110158527413,0.08109516916735539,0.006503852849321249,rbf,TPESampler,COMPLETE
2135,0.26980421583812636,2025-04-25 07:19:48.976029,2025-04-25 07:19:49.606886,0 days 00:00:00.630857,13.547924652356704,0.019146094751526732,0.0469972996235601,rbf,TPESampler,COMPLETE
2136,0.30014889731650113,2025-04-25 07:19:49.798684,2025-04-25 07:19:50.313593,0 days 00:00:00.514909,3.808220033925009,0.19694113808809188,0.041811711404259516,rbf,TPESampler,COMPLETE
2137,0.5759400918403897,2025-04-25 07:19:50.500604,2025-04-25 07:19:51.057117,0 days 00:00:00.556513,0.06694813578958778,0.006213927579597531,0.014857692434884983,rbf,TPESampler,COMPLETE
2138,0.3562181714578521,2025-04-25 07:19:51.248794,2025-04-25 07:19:51.801249,0 days 00:00:00.552455,10.074534419408206,0.07414292575973692,0.0036992263807034123,rbf,TPESampler,COMPLETE
2139,0.337582649924679,2025-04-25 07:19:52.058729,2025-04-25 07:19:52.612268,0 days 00:00:00.553539,11.851871566284233,0.10022923656773006,0.2478720848775027,rbf,TPESampler,COMPLETE
2140,0.2706678387173527,2025-04-25 07:19:52.805301,2025-04-25 07:19:53.373900,0 days 00:00:00.568599,4.474984821949185,0.04930419416769746,0.052777166089239415,rbf,TPESampler,COMPLETE
2141,0.2694012345241381,2025-04-25 07:19:53.581006,2025-04-25 07:19:54.171064,0 days 00:00:00.590058,3.5258312124163407,0.010879259941708469,0.1228718014301355,rbf,TPESampler,COMPLETE
2142,0.30926031812253296,2025-04-25 07:19:54.358108,2025-04-25 07:19:54.897761,0 days 00:00:00.539653,4.275104341467528,0.1604559055574373,0.15870388403392915,rbf,TPESampler,COMPLETE
2143,0.3140931023140977,2025-04-25 07:19:55.082173,2025-04-25 07:19:55.661607,0 days 00:00:00.579434,5.249559216327696,0.021481622501657076,0.015259886167459586,rbf,TPESampler,COMPLETE
2144,0.2934061456466588,2025-04-25 07:19:55.846795,2025-04-25 07:19:56.405566,0 days 00:00:00.558771,1.2053791049308062,0.0569481887384266,0.0856775428105549,rbf,TPESampler,COMPLETE
2145,0.35633619202445294,2025-04-25 07:19:56.604447,2025-04-25 07:19:57.183795,0 days 00:00:00.579348,7.441111905781215,0.0315343589249378,0.38115415860362617,rbf,TPESampler,COMPLETE
2146,0.27691379637234903,2025-04-25 07:19:57.368786,2025-04-25 07:19:57.955736,0 days 00:00:00.586950,8.764351101369353,0.046786920827454455,0.13020388457247492,rbf,TPESampler,COMPLETE
2147,0.4683653803822339,2025-04-25 07:19:58.142382,2025-04-25 07:19:58.946253,0 days 00:00:00.803871,0.9796876159841634,0.004337959157028373,0.05261387773686461,linear,TPESampler,COMPLETE
2148,0.4578542720392897,2025-04-25 07:19:59.137945,2025-04-25 07:19:59.704675,0 days 00:00:00.566730,0.023391481471665816,0.004541548416606249,0.0008395431862071343,linear,TPESampler,COMPLETE
2149,0.2651257072002276,2025-04-25 07:19:59.891506,2025-04-25 07:20:00.457979,0 days 00:00:00.566473,8.0956417666844,0.09560204250691984,0.07839457171182349,rbf,TPESampler,COMPLETE
2150,0.26805850758076616,2025-04-25 07:20:00.644273,2025-04-25 07:20:01.261717,0 days 00:00:00.617444,18.52295228062715,0.03563367351448044,0.043987243304398016,rbf,TPESampler,COMPLETE
2151,0.36622866809320803,2025-04-25 07:20:01.456042,2025-04-25 07:20:02.022423,0 days 00:00:00.566381,0.3313737115868578,0.053821087805707615,0.13206581409458715,rbf,TPESampler,COMPLETE
2152,0.5022103506505285,2025-04-25 07:20:02.216995,2025-04-25 07:20:09.253181,0 days 00:00:07.036186,19.095581792298038,0.02407235602326729,0.0004123844222755236,linear,TPESampler,COMPLETE
2153,0.2652057809194156,2025-04-25 07:20:09.447935,2025-04-25 07:20:10.037775,0 days 00:00:00.589840,11.382570471565474,0.04018259922843941,0.05783449998687981,rbf,TPESampler,COMPLETE
2154,0.5224337922337229,2025-04-25 07:20:10.233788,2025-04-25 07:25:13.419472,0 days 00:05:03.185684,30.727915075825663,0.062037407055997126,0.03281061425101768,poly,TPESampler,COMPLETE
2155,0.3567794097012867,2025-04-25 07:25:13.610482,2025-04-25 07:25:14.175383,0 days 00:00:00.564901,0.9135291492209455,0.027302139527167927,0.026640113046854565,rbf,TPESampler,COMPLETE
2156,0.28003356659401923,2025-04-25 07:25:14.362819,2025-04-25 07:25:14.958318,0 days 00:00:00.595499,5.817855008577211,0.01735722211872568,0.031210283226030398,rbf,TPESampler,COMPLETE
2157,0.30830367715543416,2025-04-25 07:25:15.163501,2025-04-25 07:25:15.689149,0 days 00:00:00.525648,1.0156559521408475,0.14443573121432637,0.08151430389348487,rbf,TPESampler,COMPLETE
2158,0.26931970764074453,2025-04-25 07:25:15.884548,2025-04-25 07:25:16.553716,0 days 00:00:00.669168,9.80873018162865,0.011499357609818312,0.09697228054277694,rbf,TPESampler,COMPLETE
2159,0.31076764594286393,2025-04-25 07:25:16.744222,2025-04-25 07:25:17.335455,0 days 00:00:00.591233,80.58755988748982,0.04022591192042193,0.19438958653717497,rbf,TPESampler,COMPLETE
2160,0.39637871318802714,2025-04-25 07:25:17.519320,2025-04-25 07:25:18.085670,0 days 00:00:00.566350,1.4706012962619086,0.04218091224769028,0.4843941697548873,rbf,TPESampler,COMPLETE
2161,0.2691939745984655,2025-04-25 07:25:18.277788,2025-04-25 07:25:18.831972,0 days 00:00:00.554184,12.611849432020446,0.07792012803067982,0.050239285923031535,rbf,TPESampler,COMPLETE
2162,0.28670459824339983,2025-04-25 07:25:19.022157,2025-04-25 07:25:19.596738,0 days 00:00:00.574581,3.04906375520348,0.03918524768781731,0.17838937480998202,rbf,TPESampler,COMPLETE
2163,0.2671875047738738,2025-04-25 07:25:19.780552,2025-04-25 07:25:20.360165,0 days 00:00:00.579613,3.1985665384574626,0.020714559699850206,0.10181212672197275,rbf,TPESampler,COMPLETE
2164,0.35829882873739505,2025-04-25 07:25:20.549480,2025-04-25 07:25:21.139634,0 days 00:00:00.590154,6.004875618136491,0.008948463767480364,0.40593044237804976,rbf,TPESampler,COMPLETE
2165,0.315856369383483,2025-04-25 07:25:21.330141,2025-04-25 07:25:21.860284,0 days 00:00:00.530143,19.82911163443348,0.16372986768071116,0.018842027241630827,rbf,TPESampler,COMPLETE
2166,32.303009977884464,2025-04-25 07:25:22.052201,2025-04-25 07:25:22.619445,0 days 00:00:00.567244,2.0798765595039894,0.04038091839287428,0.02308027530384605,sigmoid,TPESampler,COMPLETE
2167,0.3315801855917869,2025-04-25 07:25:22.806468,2025-04-25 07:25:23.383030,0 days 00:00:00.576562,10.234550533807981,0.05899266383567181,0.2657971405918242,rbf,TPESampler,COMPLETE
2168,0.32525616480610847,2025-04-25 07:25:23.579751,2025-04-25 07:25:24.209538,0 days 00:00:00.629787,2.498896367168667,0.07335615965557363,0.01962755288514545,rbf,TPESampler,COMPLETE
2169,0.30249688022079146,2025-04-25 07:25:24.395702,2025-04-25 07:25:24.953789,0 days 00:00:00.558087,3.3910150779123964,0.047523844932012844,0.025481015444090923,rbf,TPESampler,COMPLETE
2170,0.30173724347634173,2025-04-25 07:25:25.140654,2025-04-25 07:25:25.673496,0 days 00:00:00.532842,27.746615770218938,0.10301353268648566,0.13358601222852193,rbf,TPESampler,COMPLETE
2171,1.4401207147641895,2025-04-25 07:25:25.859869,2025-04-25 08:36:04.181765,0 days 01:10:38.321896,10.788777618960212,0.11953513093829728,0.1938833730726579,poly,TPESampler,COMPLETE
2172,0.28943009511810514,2025-04-25 07:51:31.520722,2025-04-25 07:51:32.155990,0 days 00:00:00.635268,16.862526950038795,0.021389446031360764,0.1457948088809079,rbf,TPESampler,COMPLETE
2173,0.28761470432978614,2025-04-25 07:51:32.339904,2025-04-25 07:51:32.872510,0 days 00:00:00.532606,2.485173229561735,0.07205757073782566,0.04894110882052038,rbf,TPESampler,COMPLETE
2174,0.28629311087978154,2025-04-25 07:51:33.063373,2025-04-25 07:51:33.723808,0 days 00:00:00.660435,50.98887844675571,0.044494470449808816,0.03519519032543406,rbf,TPESampler,COMPLETE
2175,0.2872268131059428,2025-04-25 07:51:33.907891,2025-04-25 07:51:34.463428,0 days 00:00:00.555537,1.3596062617075648,0.03784896866563465,0.1198382024133183,rbf,TPESampler,COMPLETE
2176,0.9504036659996239,2025-04-25 07:51:34.657054,2025-04-25 07:51:35.178252,0 days 00:00:00.521198,42.54342298393739,0.08824517636552714,0.00018258437740517074,poly,TPESampler,COMPLETE
2177,0.3193900273361229,2025-04-25 07:51:35.358626,2025-04-25 07:51:35.879432,0 days 00:00:00.520806,1.9075637665983327,0.13015082510281525,0.22521813959784398,rbf,TPESampler,COMPLETE
2178,0.31510802875950683,2025-04-25 07:51:36.059469,2025-04-25 07:51:36.650428,0 days 00:00:00.590959,48.13829517031386,0.0279699290203177,0.004357142579252116,rbf,TPESampler,COMPLETE
2179,0.4514550868583949,2025-04-25 07:51:36.834023,2025-04-25 07:51:37.370818,0 days 00:00:00.536795,75.96681900132396,0.11066829209933199,0.5893293344406393,rbf,TPESampler,COMPLETE
2180,0.2710228233954038,2025-04-25 07:51:37.556061,2025-04-25 07:51:38.202525,0 days 00:00:00.646464,17.359500531919362,0.02419427306498819,0.05581950315720352,rbf,TPESampler,COMPLETE
2181,915.682410047634,2025-04-25 07:51:38.392134,2025-04-25 07:51:38.946179,0 days 00:00:00.554045,40.028594288454585,0.034791352047745354,0.07616704901469047,sigmoid,TPESampler,COMPLETE
2182,0.29408745217513166,2025-04-25 07:51:39.143407,2025-04-25 07:51:39.707671,0 days 00:00:00.564264,1.1878718250344884,0.012820771270394608,0.1304489760591043,rbf,TPESampler,COMPLETE
2183,0.27378389857441404,2025-04-25 07:51:39.892695,2025-04-25 07:51:40.471014,0 days 00:00:00.578319,5.194804368237183,0.023835512250560346,0.04376181039456303,rbf,TPESampler,COMPLETE
2184,0.27366570734046086,2025-04-25 07:51:40.659840,2025-04-25 07:51:41.214403,0 days 00:00:00.554563,22.77324401713915,0.09194914548817876,0.07835253193233013,rbf,TPESampler,COMPLETE
2185,0.504206599656937,2025-04-25 07:51:41.403589,2025-04-25 07:51:53.926137,0 days 00:00:12.522548,38.26184951253699,0.013532271402878347,0.008807083911222074,linear,TPESampler,COMPLETE
2186,0.4019273301181717,2025-04-25 07:51:54.111649,2025-04-25 07:51:54.689273,0 days 00:00:00.577624,52.735509313409224,0.02346210719920898,0.5234009691330107,rbf,TPESampler,COMPLETE
2187,0.3131196118456212,2025-04-25 07:51:54.876847,2025-04-25 07:51:55.453146,0 days 00:00:00.576299,10.522815108600208,0.02850715379806793,0.010460755257509799,rbf,TPESampler,COMPLETE
2188,0.2762557154260453,2025-04-25 07:51:55.649543,2025-04-25 07:51:56.254536,0 days 00:00:00.604993,15.45859685695757,0.034337093761912005,0.113754610235554,rbf,TPESampler,COMPLETE
2189,0.286545871729392,2025-04-25 07:51:56.440267,2025-04-25 07:51:56.996965,0 days 00:00:00.556698,1.6577684605093992,0.030066097034386105,0.07591000454013071,rbf,TPESampler,COMPLETE
2190,0.2702254578957445,2025-04-25 07:51:57.187511,2025-04-25 07:51:57.830375,0 days 00:00:00.642864,3.6220463848072786,0.08314517339488368,0.07951881823439957,rbf,TPESampler,COMPLETE
2191,0.3374702430013426,2025-04-25 07:51:58.014824,2025-04-25 07:51:58.573952,0 days 00:00:00.559128,1.1985848928154437,0.00642636678961217,0.030474874083194492,rbf,TPESampler,COMPLETE
2192,0.34367720301504795,2025-04-25 07:51:58.752654,2025-04-25 07:51:59.324008,0 days 00:00:00.571354,2.3353119756173037,0.024508867976626734,0.36784319241446284,rbf,TPESampler,COMPLETE
2193,0.26663304960303197,2025-04-25 07:51:59.513171,2025-04-25 07:52:00.096841,0 days 00:00:00.583670,6.186725105291151,0.032013047847683475,0.09397238727760233,rbf,TPESampler,COMPLETE
2194,0.9493299079649873,2025-04-25 07:52:00.280284,2025-04-25 07:52:00.824568,0 days 00:00:00.544284,0.9713371604889183,0.144598196558386,0.0009426986744646157,poly,TPESampler,COMPLETE
2195,0.28023520872696817,2025-04-25 07:52:01.014980,2025-04-25 07:52:01.581777,0 days 00:00:00.566797,11.787376705305565,0.06870783409819664,0.035529633551347126,rbf,TPESampler,COMPLETE
2196,0.2704902838534387,2025-04-25 07:52:01.769643,2025-04-25 07:52:02.334383,0 days 00:00:00.564740,4.909706183502889,0.06193384519031103,0.11552576203922564,rbf,TPESampler,COMPLETE
2197,0.3826689669517642,2025-04-25 07:52:02.519940,2025-04-25 07:52:03.027249,0 days 00:00:00.507309,7.008255905952952,0.3807996572133558,0.12287042806821313,rbf,TPESampler,COMPLETE
2198,0.28519428819447934,2025-04-25 07:52:03.217085,2025-04-25 07:52:03.800283,0 days 00:00:00.583198,2.0626678319489966,0.014625680045400031,0.06347757192433982,rbf,TPESampler,COMPLETE
2199,0.3153051480007528,2025-04-25 07:52:03.996026,2025-04-25 07:52:04.682839,0 days 00:00:00.686813,2.6497375888354067,0.054593001303560214,0.02327556278834511,rbf,TPESampler,COMPLETE
2200,0.3070494218858191,2025-04-25 07:52:04.867047,2025-04-25 07:52:05.464368,0 days 00:00:00.597321,4.983612560520533,0.011065540840092444,0.01846796043738466,rbf,TPESampler,COMPLETE
2201,0.2668188405546196,2025-04-25 07:52:05.648856,2025-04-25 07:52:06.261794,0 days 00:00:00.612938,9.828275931074911,0.02572038036816424,0.08638393460195748,rbf,TPESampler,COMPLETE
2202,0.2944467528395266,2025-04-25 07:52:06.448044,2025-04-25 07:52:06.988835,0 days 00:00:00.540791,1.2527577657869533,0.06543944430326705,0.07642902893815383,rbf,TPESampler,COMPLETE
2203,0.2852587280467751,2025-04-25 07:52:07.174668,2025-04-25 07:52:07.717762,0 days 00:00:00.543094,11.302637108929055,0.11739645908430969,0.12198231515576763,rbf,TPESampler,COMPLETE
2204,0.41922955758586816,2025-04-25 07:52:07.908148,2025-04-25 07:52:08.464269,0 days 00:00:00.556121,0.3425810288099163,0.0010611362954107265,0.01809373005030187,rbf,TPESampler,COMPLETE
2205,0.3052921582087611,2025-04-25 07:52:08.759971,2025-04-25 07:52:09.914984,0 days 00:00:01.155013,76.99816093115271,0.007890759024869232,0.15828633771040287,rbf,TPESampler,COMPLETE
2206,0.40150375933685345,2025-04-25 07:52:10.101993,2025-04-25 07:52:10.994507,0 days 00:00:00.892514,11.317058419736448,0.03244963035707313,0.515498365978341,rbf,TPESampler,COMPLETE
2207,0.2680629234816237,2025-04-25 07:52:11.347852,2025-04-25 07:52:12.145370,0 days 00:00:00.797518,4.1848675739528725,0.005593897911827715,0.11030757302476486,rbf,TPESampler,COMPLETE
2208,0.2769565224665144,2025-04-25 07:52:12.329252,2025-04-25 07:52:12.885795,0 days 00:00:00.556543,39.15725706350523,0.08761834798709962,0.043730212274353426,rbf,TPESampler,COMPLETE
2209,0.27757796343500324,2025-04-25 07:52:13.067350,2025-04-25 07:52:13.705490,0 days 00:00:00.638140,9.951589136609304,0.010060610391803802,0.1378679457548175,rbf,TPESampler,COMPLETE
2210,0.4979450881843105,2025-04-25 07:52:14.039915,2025-04-25 07:52:15.473804,0 days 00:00:01.433889,4.0263721434825674,0.034159656498390534,0.03273696416929249,linear,TPESampler,COMPLETE
2211,0.352899308833013,2025-04-25 07:52:15.685922,2025-04-25 07:52:16.273482,0 days 00:00:00.587560,1.1945790041019242,0.018297906714826843,0.022183758013834435,rbf,TPESampler,COMPLETE
2212,0.26669050483754403,2025-04-25 07:52:16.459557,2025-04-25 07:52:17.029929,0 days 00:00:00.570372,6.1935553432248085,0.0396854755221425,0.08995930652148777,rbf,TPESampler,COMPLETE
2213,0.2883329173741422,2025-04-25 07:52:17.217709,2025-04-25 07:52:17.817709,0 days 00:00:00.600000,16.326641199244076,0.02774981271119272,0.02323383958622187,rbf,TPESampler,COMPLETE
2214,0.27218264581433393,2025-04-25 07:52:18.017349,2025-04-25 07:52:18.581531,0 days 00:00:00.564182,12.295114511415372,0.08731397138857934,0.04686182721685563,rbf,TPESampler,COMPLETE
2215,0.30228768420188484,2025-04-25 07:52:18.765593,2025-04-25 07:52:19.317364,0 days 00:00:00.551771,33.757537167015684,0.05650921893602806,0.14509683233429913,rbf,TPESampler,COMPLETE
2216,0.9958434072748813,2025-04-25 07:52:19.494762,2025-04-25 09:10:46.580967,0 days 01:18:27.086205,5.85467941111509,0.022621499223078784,0.2817477573468116,poly,TPESampler,COMPLETE
2217,0.472019033321519,2025-04-25 07:58:23.208754,2025-04-25 07:58:23.997999,0 days 00:00:00.789245,1.2437554258555283,0.015328820370405847,0.15308696013796094,linear,TPESampler,COMPLETE
2218,0.29552537909269966,2025-04-25 07:58:24.186979,2025-04-25 07:58:24.739688,0 days 00:00:00.552709,1.0672845826581214,0.029192178094597246,0.11097546511331326,rbf,TPESampler,COMPLETE
2219,0.2870407207712613,2025-04-25 07:58:24.921833,2025-04-25 07:58:25.467897,0 days 00:00:00.546064,6.694021608073149,0.05128144570827935,0.023905711982575663,rbf,TPESampler,COMPLETE
2220,0.2961112423534265,2025-04-25 07:58:25.653572,2025-04-25 07:58:26.237377,0 days 00:00:00.583805,10.249142500984703,0.025586922010261713,0.1846473271935292,rbf,TPESampler,COMPLETE
2221,0.30604911296237036,2025-04-25 07:58:26.418425,2025-04-25 07:58:26.937719,0 days 00:00:00.519294,3.368269780582641,0.14467684404220493,0.1677878084840416,rbf,TPESampler,COMPLETE
2222,0.27850892393970095,2025-04-25 07:58:27.129481,2025-04-25 07:58:27.725112,0 days 00:00:00.595631,8.009270031581961,0.019895368360007566,0.028822892296067763,rbf,TPESampler,COMPLETE
2223,0.33663829805927564,2025-04-25 07:58:27.912743,2025-04-25 07:58:28.533731,0 days 00:00:00.620988,4.2181026423473345,0.08803701890155861,0.27835775953223624,rbf,TPESampler,COMPLETE
2224,0.4243094662778382,2025-04-25 07:58:28.721086,2025-04-25 07:58:29.273394,0 days 00:00:00.552308,0.09628485752891386,0.027479971475683092,0.025303140654135154,linear,TPESampler,COMPLETE
2225,0.3400893559106623,2025-04-25 07:58:29.458681,2025-04-25 07:58:30.237668,0 days 00:00:00.778987,8.10922763114974,0.05073554239584047,0.006540573778404077,rbf,TPESampler,COMPLETE
2226,0.3096524139167539,2025-04-25 07:58:30.419747,2025-04-25 07:58:30.934847,0 days 00:00:00.515100,1.4328599847617183,0.14081189644269795,0.05166594505537835,rbf,TPESampler,COMPLETE
2227,26.293021351908592,2025-04-25 07:58:31.121500,2025-04-25 07:58:31.661129,0 days 00:00:00.539629,2.4055906591245506,0.1491964223278925,0.01489152691416075,sigmoid,TPESampler,COMPLETE
2228,0.27427202089572333,2025-04-25 07:58:31.846791,2025-04-25 07:58:32.552699,0 days 00:00:00.705908,17.418495767056722,0.00837754712636808,0.0654554285192073,rbf,TPESampler,COMPLETE
2229,0.4257188718710358,2025-04-25 07:58:32.740305,2025-04-25 07:58:33.280474,0 days 00:00:00.540169,0.43880453755087495,0.07715571422073567,0.012978935327824827,rbf,TPESampler,COMPLETE
2230,0.3162010432317153,2025-04-25 07:58:33.462434,2025-04-25 07:58:34.011612,0 days 00:00:00.549178,1.5717598380350564,0.04065488203259548,0.03410187021881566,rbf,TPESampler,COMPLETE
2231,0.6845581264634304,2025-04-25 07:58:34.202973,2025-04-25 07:58:34.820471,0 days 00:00:00.617498,0.029868945388915002,0.3292062919508734,0.06353975760041458,poly,TPESampler,COMPLETE
2232,0.31615162829140053,2025-04-25 07:58:35.007662,2025-04-25 07:58:35.570338,0 days 00:00:00.562676,3.3807552961114045,0.053478405120589864,0.2525534283435546,rbf,TPESampler,COMPLETE
2233,0.2648795587147359,2025-04-25 07:58:35.753133,2025-04-25 07:58:36.345047,0 days 00:00:00.591914,6.224806561059489,0.02751049658241698,0.07839870079377202,rbf,TPESampler,COMPLETE
2234,0.9430453511794062,2025-04-25 07:58:36.536329,2025-04-25 07:58:37.102578,0 days 00:00:00.566249,0.004286179725263582,0.005633756815317731,0.4363850487329116,rbf,TPESampler,COMPLETE
2235,0.26516127741282125,2025-04-25 07:58:37.300622,2025-04-25 07:58:37.912195,0 days 00:00:00.611573,4.364190516879928,0.014918935014354229,0.07863940760133815,rbf,TPESampler,COMPLETE
2236,0.47142626660741843,2025-04-25 07:58:38.102938,2025-04-25 07:58:38.869991,0 days 00:00:00.767053,1.1792402548105543,0.012663367607892221,0.008999804076850245,linear,TPESampler,COMPLETE
2237,0.3626202201834474,2025-04-25 07:58:39.053387,2025-04-25 07:58:39.633131,0 days 00:00:00.579744,0.4744824125874929,0.017069536738185943,0.22523331605712013,rbf,TPESampler,COMPLETE
2238,0.3352600931458393,2025-04-25 07:58:39.817532,2025-04-25 07:58:40.381298,0 days 00:00:00.563766,8.814836759697894,0.015000338770689273,0.3210455740972175,rbf,TPESampler,COMPLETE
2239,0.2844981871530216,2025-04-25 07:58:40.568876,2025-04-25 07:58:41.161333,0 days 00:00:00.592457,4.700124898838727,0.0055005919643682805,0.03148341881485869,rbf,TPESampler,COMPLETE
2240,1.0427693346815305,2025-04-25 07:58:41.341398,2025-04-25 08:39:03.393748,0 days 00:40:22.052350,1.0425546352152364,0.0015116543291249613,0.4186156601735645,poly,TPESampler,COMPLETE
2241,0.2754985573462376,2025-04-25 08:36:04.391877,2025-04-25 08:36:05.220044,0 days 00:00:00.828167,22.402769554967936,0.011768812511620633,0.06601040054282588,rbf,TPESampler,COMPLETE
2242,184.61858239913457,2025-04-25 08:36:05.408611,2025-04-25 08:36:05.965875,0 days 00:00:00.557264,8.008331534191312,0.02623010820780538,0.06876770050649594,sigmoid,TPESampler,COMPLETE
