number,value,datetime_start,datetime_complete,duration,params_bootstrap,params_criterion,params_max_depth,params_max_features,params_min_samples_leaf,params_min_samples_split,params_n_estimators,system_attrs_auto:sampler,state
3994,0.41915473324652514,2025-04-25 01:03:13.428138,2025-04-25 01:03:27.384078,0 days 00:00:13.955940,False,absolute_error,41,sqrt,2,3,566,TPESampler,COMPLETE
3995,0.3377431257107911,2025-04-25 01:03:14.730218,2025-04-25 01:03:29.500440,0 days 00:00:14.770222,False,absolute_error,42,sqrt,1,3,384,TPESampler,COMPLETE
3996,0.42034262704944736,2025-04-25 01:03:17.800286,2025-04-25 01:03:32.681312,0 days 00:00:14.881026,False,absolute_error,50,sqrt,2,5,593,TPESampler,COMPLETE
3997,0.41808504343173725,2025-04-25 01:03:26.979654,2025-04-25 01:03:41.914508,0 days 00:00:14.934854,False,absolute_error,43,sqrt,2,2,594,TPESampler,COMPLETE
3998,0.3460066171067459,2025-04-25 01:03:27.679927,2025-04-25 01:03:50.009226,0 days 00:00:22.329299,False,absolute_error,50,sqrt,1,2,520,TPESampler,COMPLETE
3999,0.34095098718788175,2025-04-25 01:03:28.692206,2025-04-25 01:03:47.966372,0 days 00:00:19.274166,False,absolute_error,43,sqrt,1,6,505,TPESampler,COMPLETE
4000,0.33459956620275116,2025-04-25 01:03:29.763200,2025-04-25 01:03:42.135893,0 days 00:00:12.372693,False,absolute_error,44,sqrt,1,3,319,TPESampler,COMPLETE
4001,0.34009719264354155,2025-04-25 01:03:32.945817,2025-04-25 01:03:58.580184,0 days 00:00:25.634367,False,absolute_error,44,sqrt,1,7,702,TPESampler,COMPLETE
4002,0.3319175390032576,2025-04-25 01:03:42.137474,2025-04-25 01:04:05.003498,0 days 00:00:22.866024,False,absolute_error,50,sqrt,1,3,596,TPESampler,COMPLETE
4003,0.32459020547947914,2025-04-25 01:03:42.386713,2025-04-25 01:04:06.134953,0 days 00:00:23.748240,False,absolute_error,50,sqrt,1,5,614,TPESampler,COMPLETE
4004,0.5120539513091675,2025-04-25 01:03:48.257941,2025-04-25 01:03:49.240103,0 days 00:00:00.982162,True,squared_error,32,sqrt,3,21,148,TPESampler,COMPLETE
4005,0.4204389249647894,2025-04-25 01:03:49.471576,2025-04-25 01:04:07.759657,0 days 00:00:18.288081,False,absolute_error,41,sqrt,2,4,690,TPESampler,COMPLETE
4006,0.35893023954769976,2025-04-25 01:03:50.390010,2025-04-25 01:04:11.310352,0 days 00:00:20.920342,False,absolute_error,41,sqrt,1,10,547,TPESampler,COMPLETE
4007,0.3386998767681929,2025-04-25 01:03:58.804805,2025-04-25 01:04:16.718577,0 days 00:00:17.913772,False,absolute_error,43,sqrt,1,3,470,TPESampler,COMPLETE
4008,0.3587725764762893,2025-04-25 01:04:05.329216,2025-04-25 01:04:29.873006,0 days 00:00:24.543790,False,absolute_error,33,sqrt,1,2,677,TPESampler,COMPLETE
4009,0.32562822073209846,2025-04-25 01:04:06.371929,2025-04-25 01:04:33.833798,0 days 00:00:27.461869,False,absolute_error,50,sqrt,1,5,732,TPESampler,COMPLETE
4010,0.4285755649847051,2025-04-25 01:04:07.412283,2025-04-25 01:04:22.718081,0 days 00:00:15.305798,False,absolute_error,50,sqrt,2,13,576,TPESampler,COMPLETE
4011,0.5043044992970345,2025-04-25 01:04:08.011632,2025-04-25 01:05:42.400978,0 days 00:01:34.389346,False,absolute_error,24,,1,42,471,TPESampler,COMPLETE
4012,0.3282054071774398,2025-04-25 01:04:11.541987,2025-04-25 01:04:19.539350,0 days 00:00:07.997363,False,absolute_error,45,sqrt,1,5,202,TPESampler,COMPLETE
4013,0.34113614784128315,2025-04-25 01:04:16.949382,2025-04-25 01:04:45.287999,0 days 00:00:28.338617,False,absolute_error,50,sqrt,1,8,740,TPESampler,COMPLETE
4014,0.34101207487848395,2025-04-25 01:04:19.769650,2025-04-25 01:04:45.460829,0 days 00:00:25.691179,False,absolute_error,43,sqrt,1,6,699,TPESampler,COMPLETE
4015,0.3330312283997828,2025-04-25 01:04:22.945666,2025-04-25 01:04:46.735042,0 days 00:00:23.789376,False,absolute_error,42,sqrt,1,4,641,TPESampler,COMPLETE
4016,0.6062581569984268,2025-04-25 01:04:30.104120,2025-04-25 01:04:33.309505,0 days 00:00:03.205385,True,absolute_error,23,sqrt,4,20,425,TPESampler,COMPLETE
4017,0.33129600364659006,2025-04-25 01:04:33.594564,2025-04-25 01:04:56.337762,0 days 00:00:22.743198,False,absolute_error,44,sqrt,1,4,507,TPESampler,COMPLETE
4018,0.3368624866179942,2025-04-25 01:04:34.106295,2025-04-25 01:05:07.336859,0 days 00:00:33.230564,False,absolute_error,39,sqrt,1,4,847,TPESampler,COMPLETE
4019,0.4188982423764727,2025-04-25 01:04:45.524851,2025-04-25 01:04:57.831010,0 days 00:00:12.306159,False,absolute_error,50,sqrt,2,5,478,TPESampler,COMPLETE
4020,0.3322677155732563,2025-04-25 01:04:45.712406,2025-04-25 01:04:55.318022,0 days 00:00:09.605616,False,absolute_error,50,sqrt,1,3,238,TPESampler,COMPLETE
4021,0.3655397491458797,2025-04-25 01:04:46.972558,2025-04-25 01:05:18.974237,0 days 00:00:32.001679,False,absolute_error,44,sqrt,1,14,775,TPESampler,COMPLETE
4022,0.331679261481479,2025-04-25 01:04:55.551101,2025-04-25 01:05:22.798061,0 days 00:00:27.246960,False,absolute_error,50,sqrt,1,3,635,TPESampler,COMPLETE
4023,0.3255111526794474,2025-04-25 01:04:56.567545,2025-04-25 01:05:09.169463,0 days 00:00:12.601918,False,absolute_error,50,sqrt,1,5,325,TPESampler,COMPLETE
4024,0.3254230927409564,2025-04-25 01:04:58.064032,2025-04-25 01:05:23.541276,0 days 00:00:25.477244,False,absolute_error,50,sqrt,1,5,654,TPESampler,COMPLETE
4025,0.332117204051707,2025-04-25 01:05:07.573887,2025-04-25 01:05:35.735275,0 days 00:00:28.161388,False,absolute_error,50,sqrt,1,6,743,TPESampler,COMPLETE
4026,0.5683559166676524,2025-04-25 01:05:09.404932,2025-04-25 01:05:14.498994,0 days 00:00:05.094062,False,absolute_error,23,sqrt,5,2,387,TPESampler,COMPLETE
4027,0.33382811653808175,2025-04-25 01:05:14.724187,2025-04-25 01:05:37.085389,0 days 00:00:22.361202,False,absolute_error,44,sqrt,1,5,583,TPESampler,COMPLETE
4028,0.4603481714233084,2025-04-25 01:05:19.206529,2025-04-25 01:05:21.165966,0 days 00:00:01.959437,True,squared_error,27,,7,2,345,TPESampler,COMPLETE
4029,0.3331332209383925,2025-04-25 01:05:21.404141,2025-04-25 01:05:48.400656,0 days 00:00:26.996515,False,absolute_error,42,sqrt,1,4,647,TPESampler,COMPLETE
4030,0.4169075988301378,2025-04-25 01:05:23.037761,2025-04-25 01:05:38.107966,0 days 00:00:15.070205,False,absolute_error,50,sqrt,2,4,595,TPESampler,COMPLETE
4031,0.41799721681250557,2025-04-25 01:05:23.865249,2025-04-25 01:05:47.128060,0 days 00:00:23.262811,False,absolute_error,46,sqrt,2,2,781,TPESampler,COMPLETE
4032,0.3264734280528894,2025-04-25 01:05:35.973918,2025-04-25 01:05:58.288436,0 days 00:00:22.314518,False,absolute_error,50,sqrt,1,4,585,TPESampler,COMPLETE
4033,0.3316711261817794,2025-04-25 01:05:37.325938,2025-04-25 01:06:05.484003,0 days 00:00:28.158065,False,absolute_error,44,sqrt,1,4,712,TPESampler,COMPLETE
4034,0.604761034256556,2025-04-25 01:05:38.416557,2025-04-25 01:05:41.160848,0 days 00:00:02.744291,True,absolute_error,11,sqrt,3,4,281,TPESampler,COMPLETE
4035,0.33176352570483564,2025-04-25 01:05:41.411134,2025-04-25 01:06:05.735640,0 days 00:00:24.324506,False,absolute_error,50,sqrt,1,3,624,TPESampler,COMPLETE
4036,0.34513277614386556,2025-04-25 01:05:42.640859,2025-04-25 01:05:57.321992,0 days 00:00:14.681133,False,absolute_error,50,sqrt,1,2,360,TPESampler,COMPLETE
4037,0.3311119264840847,2025-04-25 01:05:47.362588,2025-04-25 01:06:02.935850,0 days 00:00:15.573262,False,absolute_error,43,sqrt,1,5,412,TPESampler,COMPLETE
4038,0.4053799656596804,2025-04-25 01:05:48.632703,2025-04-25 01:05:50.038715,0 days 00:00:01.406012,True,squared_error,49,,2,32,160,TPESampler,COMPLETE
4039,0.331930061683165,2025-04-25 01:05:50.282495,2025-04-25 01:06:08.800479,0 days 00:00:18.517984,False,absolute_error,50,sqrt,1,3,472,TPESampler,COMPLETE
4040,0.4182243255604896,2025-04-25 01:05:57.558498,2025-04-25 01:06:00.310957,0 days 00:00:02.752459,False,squared_error,50,sqrt,2,7,994,TPESampler,COMPLETE
4041,0.33162435626689085,2025-04-25 01:05:58.750267,2025-04-25 01:06:17.161739,0 days 00:00:18.411472,False,absolute_error,50,sqrt,1,3,468,TPESampler,COMPLETE
4042,0.4180634146068349,2025-04-25 01:06:00.552287,2025-04-25 01:06:09.505979,0 days 00:00:08.953692,False,absolute_error,50,sqrt,2,5,343,TPESampler,COMPLETE
4043,0.409634461886968,2025-04-25 01:06:03.172985,2025-04-25 01:06:10.891068,0 days 00:00:07.718083,False,squared_error,49,,1,2,605,TPESampler,COMPLETE
4044,0.417879468759127,2025-04-25 01:06:05.785805,2025-04-25 01:06:25.764864,0 days 00:00:19.979059,False,absolute_error,50,sqrt,2,4,783,TPESampler,COMPLETE
4045,0.42430201742208784,2025-04-25 01:06:05.995189,2025-04-25 01:06:23.704190,0 days 00:00:17.709001,False,absolute_error,50,sqrt,2,8,711,TPESampler,COMPLETE
4046,0.33531571152297623,2025-04-25 01:06:09.045488,2025-04-25 01:06:26.048732,0 days 00:00:17.003244,False,absolute_error,50,sqrt,1,7,405,TPESampler,COMPLETE
4047,0.7084687199817152,2025-04-25 01:06:09.818256,2025-04-25 01:06:17.796180,0 days 00:00:07.977924,False,absolute_error,9,log2,1,30,704,TPESampler,COMPLETE
4048,0.3254230927409564,2025-04-25 01:06:11.149523,2025-04-25 01:06:36.794822,0 days 00:00:25.645299,False,absolute_error,50,sqrt,1,5,654,TPESampler,COMPLETE
4049,0.3825901053933965,2025-04-25 01:06:17.400295,2025-04-25 01:06:28.149584,0 days 00:00:10.749289,False,absolute_error,46,log2,1,5,371,TPESampler,COMPLETE
4050,0.33157196918979803,2025-04-25 01:06:18.091669,2025-04-25 01:06:38.827910,0 days 00:00:20.736241,False,absolute_error,50,sqrt,1,6,548,TPESampler,COMPLETE
4051,0.3399168870329272,2025-04-25 01:06:23.946427,2025-04-25 01:06:43.578000,0 days 00:00:19.631573,False,absolute_error,44,sqrt,1,6,531,TPESampler,COMPLETE
4052,0.41774702772889205,2025-04-25 01:06:25.991224,2025-04-25 01:06:37.011072,0 days 00:00:11.019848,False,absolute_error,42,sqrt,2,3,419,TPESampler,COMPLETE
4053,0.33976905014525316,2025-04-25 01:06:26.333236,2025-04-25 01:06:27.964735,0 days 00:00:01.631499,False,squared_error,43,sqrt,1,5,270,TPESampler,COMPLETE
4054,0.3401964725484331,2025-04-25 01:06:28.192037,2025-04-25 01:06:36.491950,0 days 00:00:08.299913,False,absolute_error,42,sqrt,1,6,213,TPESampler,COMPLETE
4055,0.3515146510314298,2025-04-25 01:06:28.389748,2025-04-25 01:06:48.126470,0 days 00:00:19.736722,False,absolute_error,50,sqrt,1,11,528,TPESampler,COMPLETE
4056,0.3997258864895143,2025-04-25 01:06:36.731728,2025-04-25 01:06:38.484229,0 days 00:00:01.752501,False,squared_error,26,sqrt,1,9,165,TPESampler,COMPLETE
4057,0.3318100694361979,2025-04-25 01:06:37.083897,2025-04-25 01:06:50.704492,0 days 00:00:13.620595,False,absolute_error,50,sqrt,1,3,317,TPESampler,COMPLETE
4058,0.8639430760270029,2025-04-25 01:06:37.333098,2025-04-25 01:06:39.319082,0 days 00:00:01.985984,True,absolute_error,11,log2,10,2,298,TPESampler,COMPLETE
4059,0.4582389026155726,2025-04-25 01:06:38.772999,2025-04-25 01:06:41.143285,0 days 00:00:02.370286,False,squared_error,32,sqrt,3,2,710,TPESampler,COMPLETE
4060,0.33188356383268425,2025-04-25 01:06:39.090061,2025-04-25 01:07:04.683488,0 days 00:00:25.593427,False,absolute_error,43,sqrt,1,4,687,TPESampler,COMPLETE
4061,0.36711146695500024,2025-04-25 01:06:39.550174,2025-04-25 01:06:55.990516,0 days 00:00:16.440342,True,absolute_error,40,sqrt,1,5,694,TPESampler,COMPLETE
4062,0.6916089807246699,2025-04-25 01:06:41.372103,2025-04-25 01:06:47.083463,0 days 00:00:05.711360,True,absolute_error,36,log2,2,5,930,TPESampler,COMPLETE
4063,0.3261718980644241,2025-04-25 01:06:43.821736,2025-04-25 01:07:04.746645,0 days 00:00:20.924909,False,absolute_error,50,sqrt,1,5,538,TPESampler,COMPLETE
4064,0.3294908162362913,2025-04-25 01:06:47.314008,2025-04-25 01:07:01.490266,0 days 00:00:14.176258,False,absolute_error,44,sqrt,1,4,369,TPESampler,COMPLETE
4065,0.3250946921453822,2025-04-25 01:06:48.361001,2025-04-25 01:07:11.267974,0 days 00:00:22.906973,False,absolute_error,50,sqrt,1,5,593,TPESampler,COMPLETE
4066,0.33861939908197897,2025-04-25 01:06:50.932064,2025-04-25 01:07:13.578742,0 days 00:00:22.646678,False,absolute_error,43,sqrt,1,3,560,TPESampler,COMPLETE
4067,0.34599954599778704,2025-04-25 01:06:56.222320,2025-04-25 01:07:27.824611,0 days 00:00:31.602291,False,absolute_error,43,sqrt,1,2,767,TPESampler,COMPLETE
4068,0.3608270545514018,2025-04-25 01:07:01.714527,2025-04-25 01:07:14.369607,0 days 00:00:12.655080,False,absolute_error,41,sqrt,1,11,343,TPESampler,COMPLETE
4069,0.5138388966971653,2025-04-25 01:07:04.902607,2025-04-25 01:07:18.033152,0 days 00:00:13.130545,True,absolute_error,47,,11,3,618,TPESampler,COMPLETE
4070,0.4233044291565726,2025-04-25 01:07:05.068580,2025-04-25 01:07:20.866845,0 days 00:00:15.798265,False,absolute_error,50,sqrt,2,8,559,TPESampler,COMPLETE
4071,0.34119680134173386,2025-04-25 01:07:11.503530,2025-04-25 01:07:36.400003,0 days 00:00:24.896473,False,absolute_error,43,sqrt,1,7,636,TPESampler,COMPLETE
4072,0.865082875227597,2025-04-25 01:07:13.811703,2025-04-25 01:07:16.456268,0 days 00:00:02.644565,True,absolute_error,8,log2,9,7,912,TPESampler,COMPLETE
4073,0.3316600759463842,2025-04-25 01:07:14.866233,2025-04-25 01:07:33.442985,0 days 00:00:18.576752,False,absolute_error,50,sqrt,1,3,469,TPESampler,COMPLETE
4074,0.3698516309474621,2025-04-25 01:07:16.691429,2025-04-25 01:07:40.172774,0 days 00:00:23.481345,False,absolute_error,50,log2,1,5,778,TPESampler,COMPLETE
4075,0.41510757487153827,2025-04-25 01:07:18.257643,2025-04-25 01:07:19.264661,0 days 00:00:01.007018,False,squared_error,50,sqrt,2,5,155,TPESampler,COMPLETE
4076,0.33192950431389234,2025-04-25 01:07:19.501675,2025-04-25 01:07:44.783712,0 days 00:00:25.282037,False,absolute_error,50,sqrt,1,6,662,TPESampler,COMPLETE
4077,0.666681441864982,2025-04-25 01:07:21.119259,2025-04-25 01:07:24.618306,0 days 00:00:03.499047,True,absolute_error,45,sqrt,5,4,632,TPESampler,COMPLETE
4078,0.3294648363935209,2025-04-25 01:07:24.873364,2025-04-25 01:07:29.650901,0 days 00:00:04.777537,False,absolute_error,49,sqrt,1,4,107,TPESampler,COMPLETE
4079,0.4198421793081564,2025-04-25 01:07:28.052900,2025-04-25 01:07:44.204819,0 days 00:00:16.151919,False,absolute_error,41,sqrt,2,4,642,TPESampler,COMPLETE
4080,0.3315868974414253,2025-04-25 01:07:29.890527,2025-04-25 01:07:45.829746,0 days 00:00:15.939219,False,absolute_error,43,sqrt,1,4,409,TPESampler,COMPLETE
4081,0.3252879099204192,2025-04-25 01:07:33.756796,2025-04-25 01:08:02.957281,0 days 00:00:29.200485,False,absolute_error,50,sqrt,1,5,778,TPESampler,COMPLETE
4082,0.42788318420777355,2025-04-25 01:07:36.638039,2025-04-25 01:07:49.882367,0 days 00:00:13.244328,False,absolute_error,43,sqrt,2,9,499,TPESampler,COMPLETE
4083,0.35966197743369244,2025-04-25 01:07:40.406657,2025-04-25 01:08:07.325159,0 days 00:00:26.918502,False,absolute_error,42,sqrt,1,11,755,TPESampler,COMPLETE
4084,0.34747165860957613,2025-04-25 01:07:44.760895,2025-04-25 01:08:08.438059,0 days 00:00:23.677164,False,absolute_error,35,sqrt,1,5,635,TPESampler,COMPLETE
4085,0.4133119028289626,2025-04-25 01:07:45.510666,2025-04-25 01:07:54.605879,0 days 00:00:09.095213,False,absolute_error,50,sqrt,2,2,312,TPESampler,COMPLETE
4086,0.3475752784911825,2025-04-25 01:07:46.483584,2025-04-25 01:07:57.614099,0 days 00:00:11.130515,False,absolute_error,43,sqrt,1,8,267,TPESampler,COMPLETE
4087,0.4255619958949601,2025-04-25 01:07:50.197712,2025-04-25 01:07:52.338251,0 days 00:00:02.140539,False,squared_error,35,sqrt,2,6,559,TPESampler,COMPLETE
4088,0.34015750314050136,2025-04-25 01:07:52.750282,2025-04-25 01:08:08.278071,0 days 00:00:15.527789,False,absolute_error,50,sqrt,1,8,391,TPESampler,COMPLETE
4089,0.34110251256094115,2025-04-25 01:07:55.147815,2025-04-25 01:08:22.473676,0 days 00:00:27.325861,False,absolute_error,50,sqrt,1,8,725,TPESampler,COMPLETE
4090,0.3561963686186119,2025-04-25 01:07:57.860546,2025-04-25 01:08:03.906137,0 days 00:00:06.045591,True,absolute_error,43,sqrt,1,4,261,TPESampler,COMPLETE
4091,0.37287636532302576,2025-04-25 01:08:03.186718,2025-04-25 01:08:10.672942,0 days 00:00:07.486224,False,absolute_error,50,log2,1,5,234,TPESampler,COMPLETE
4092,0.33284883837477297,2025-04-25 01:08:04.145718,2025-04-25 01:08:33.729022,0 days 00:00:29.583304,False,absolute_error,50,sqrt,1,3,769,TPESampler,COMPLETE
4093,0.3350139830080818,2025-04-25 01:08:07.552033,2025-04-25 01:08:17.891452,0 days 00:00:10.339419,False,absolute_error,43,sqrt,1,3,260,TPESampler,COMPLETE
4094,0.41598513226613015,2025-04-25 01:08:08.512590,2025-04-25 01:08:21.146235,0 days 00:00:12.633645,False,absolute_error,50,sqrt,2,3,499,TPESampler,COMPLETE
4095,0.4224932840538453,2025-04-25 01:08:08.678549,2025-04-25 01:08:25.738242,0 days 00:00:17.059693,False,absolute_error,42,sqrt,2,5,656,TPESampler,COMPLETE
4096,0.332033949415586,2025-04-25 01:08:10.901026,2025-04-25 01:08:35.704474,0 days 00:00:24.803448,False,absolute_error,50,sqrt,1,3,644,TPESampler,COMPLETE
4097,0.6787384228775111,2025-04-25 01:08:18.121110,2025-04-25 01:08:20.801330,0 days 00:00:02.680220,False,absolute_error,11,log2,1,11,169,TPESampler,COMPLETE
4098,0.4416040419121486,2025-04-25 01:08:21.036275,2025-04-25 01:10:33.529562,0 days 00:02:12.493287,False,absolute_error,50,,1,7,540,TPESampler,COMPLETE
4099,0.46297434957463024,2025-04-25 01:08:21.402347,2025-04-25 01:11:23.273561,0 days 00:03:01.871214,False,absolute_error,22,,1,14,860,TPESampler,COMPLETE
4100,0.47666705211637794,2025-04-25 01:08:22.719346,2025-04-25 01:08:26.855099,0 days 00:00:04.135753,False,squared_error,8,,1,2,674,TPESampler,COMPLETE
4101,0.3418154442543083,2025-04-25 01:08:25.973258,2025-04-25 01:08:45.000133,0 days 00:00:19.026875,False,absolute_error,43,sqrt,1,7,482,TPESampler,COMPLETE
4102,0.3318568717150468,2025-04-25 01:08:27.083954,2025-04-25 01:08:40.482367,0 days 00:00:13.398413,False,absolute_error,43,sqrt,1,4,352,TPESampler,COMPLETE
4103,0.3387687585527465,2025-04-25 01:08:34.089220,2025-04-25 01:08:53.836405,0 days 00:00:19.747185,False,absolute_error,43,sqrt,1,3,525,TPESampler,COMPLETE
4104,0.4183852510776298,2025-04-25 01:08:35.950962,2025-04-25 01:08:54.000134,0 days 00:00:18.049172,False,absolute_error,44,sqrt,2,3,645,TPESampler,COMPLETE
4105,0.47867954220262704,2025-04-25 01:08:40.732988,2025-04-25 01:09:16.556466,0 days 00:00:35.823478,False,absolute_error,33,,1,2,158,TPESampler,COMPLETE
4106,0.3357120165901044,2025-04-25 01:08:45.227685,2025-04-25 01:08:48.459775,0 days 00:00:03.232090,False,squared_error,50,sqrt,1,3,776,TPESampler,COMPLETE
4107,0.34097099914285794,2025-04-25 01:08:48.678317,2025-04-25 01:09:08.070034,0 days 00:00:19.391717,False,absolute_error,43,sqrt,1,6,519,TPESampler,COMPLETE
4108,0.4180869979953129,2025-04-25 01:08:54.081766,2025-04-25 01:09:11.174491,0 days 00:00:17.092725,False,absolute_error,50,sqrt,2,3,691,TPESampler,COMPLETE
4109,0.3359596304232718,2025-04-25 01:08:54.251863,2025-04-25 01:09:19.060864,0 days 00:00:24.809001,False,absolute_error,45,sqrt,1,3,648,TPESampler,COMPLETE
4110,0.3321618926864633,2025-04-25 01:09:08.298729,2025-04-25 01:09:30.166020,0 days 00:00:21.867291,False,absolute_error,43,sqrt,1,5,596,TPESampler,COMPLETE
4111,0.4205800186853446,2025-04-25 01:09:11.407956,2025-04-25 01:09:24.273639,0 days 00:00:12.865683,False,absolute_error,44,sqrt,2,5,515,TPESampler,COMPLETE
4112,0.3493599059509945,2025-04-25 01:09:16.793840,2025-04-25 01:09:28.648646,0 days 00:00:11.854806,True,absolute_error,50,sqrt,1,3,498,TPESampler,COMPLETE
4113,0.3357987333724809,2025-04-25 01:09:19.297147,2025-04-25 01:09:39.370333,0 days 00:00:20.073186,False,absolute_error,50,sqrt,1,7,521,TPESampler,COMPLETE
4114,0.3852541925542874,2025-04-25 01:09:24.515083,2025-04-25 01:11:35.684712,0 days 00:02:11.169629,False,absolute_error,49,,2,8,965,TPESampler,COMPLETE
4115,0.6206585340616498,2025-04-25 01:09:28.873483,2025-04-25 01:09:37.446209,0 days 00:00:08.572726,False,absolute_error,41,log2,2,5,618,TPESampler,COMPLETE
4116,0.41399330456706773,2025-04-25 01:09:30.399936,2025-04-25 01:09:40.155649,0 days 00:00:09.755713,False,absolute_error,44,sqrt,2,4,354,TPESampler,COMPLETE
4117,0.33141612887268207,2025-04-25 01:09:37.682999,2025-04-25 01:09:53.367427,0 days 00:00:15.684428,False,absolute_error,50,sqrt,1,3,404,TPESampler,COMPLETE
4118,0.3520915871503675,2025-04-25 01:09:39.605549,2025-04-25 01:10:18.243428,0 days 00:00:38.637879,True,absolute_error,49,,1,3,293,TPESampler,COMPLETE
4119,0.3430823997533836,2025-04-25 01:09:40.382057,2025-04-25 01:10:08.139193,0 days 00:00:27.757136,False,absolute_error,50,sqrt,1,9,629,TPESampler,COMPLETE
4120,0.3258715565558905,2025-04-25 01:09:53.607759,2025-04-25 01:10:11.512802,0 days 00:00:17.905043,False,absolute_error,50,sqrt,1,5,472,TPESampler,COMPLETE
4121,0.41996094139020584,2025-04-25 01:10:08.373394,2025-04-25 01:10:21.172647,0 days 00:00:12.799253,False,absolute_error,50,sqrt,2,6,508,TPESampler,COMPLETE
4122,0.3269726362530109,2025-04-25 01:10:11.746397,2025-04-25 01:10:41.513983,0 days 00:00:29.767586,False,absolute_error,50,sqrt,1,4,682,TPESampler,COMPLETE
4123,0.3314777288711796,2025-04-25 01:10:18.479962,2025-04-25 01:10:40.731192,0 days 00:00:22.251230,False,absolute_error,43,sqrt,1,4,589,TPESampler,COMPLETE
4124,0.3312776925207274,2025-04-25 01:10:21.401495,2025-04-25 01:10:27.817999,0 days 00:00:06.416504,False,absolute_error,50,sqrt,1,6,155,TPESampler,COMPLETE
4125,0.45642371136790366,2025-04-25 01:10:28.054259,2025-04-25 01:10:37.106962,0 days 00:00:09.052703,True,absolute_error,39,sqrt,2,4,658,TPESampler,COMPLETE
4126,0.343747976272664,2025-04-25 01:10:33.767351,2025-04-25 01:10:35.963780,0 days 00:00:02.196429,False,squared_error,50,sqrt,1,8,578,TPESampler,COMPLETE
4127,0.34698366013845566,2025-04-25 01:10:36.433374,2025-04-25 01:10:57.488346,0 days 00:00:21.054972,False,absolute_error,43,sqrt,1,2,538,TPESampler,COMPLETE
4128,0.3390809166666776,2025-04-25 01:10:37.486442,2025-04-25 01:11:04.487365,0 days 00:00:27.000923,False,absolute_error,45,sqrt,1,6,738,TPESampler,COMPLETE
4129,0.46760007412122284,2025-04-25 01:10:40.965392,2025-04-25 01:11:55.537353,0 days 00:01:14.571961,False,absolute_error,46,,1,3,323,TPESampler,COMPLETE
4130,0.33216197867643854,2025-04-25 01:10:41.829668,2025-04-25 01:11:09.272003,0 days 00:00:27.442335,False,absolute_error,50,sqrt,1,6,745,TPESampler,COMPLETE
