number,value,datetime_start,datetime_complete,duration,params_bootstrap,params_criterion,params_max_depth,params_max_features,params_min_samples_leaf,params_min_samples_split,params_n_estimators,system_attrs_auto:sampler,state
831,0.41990523098511373,2025-04-24 22:11:50.823336,2025-04-24 22:12:02.714849,0 days 00:00:11.891513,False,absolute_error,50,sqrt,2,6,467,TPESampler,COMPLETE
832,0.660584673637397,2025-04-24 22:11:51.822402,2025-04-24 22:11:53.203846,0 days 00:00:01.381444,False,squared_error,6,sqrt,2,3,513,TPESampler,COMPLETE
833,0.35776277164085213,2025-04-24 22:11:53.374935,2025-04-24 22:11:58.479628,0 days 00:00:05.104693,False,absolute_error,34,sqrt,1,2,127,TPESampler,COMPLETE
834,0.4100359425711289,2025-04-24 22:11:57.305243,2025-04-24 22:12:00.930447,0 days 00:00:03.625204,False,squared_error,50,,2,17,481,TPESampler,COMPLETE
835,0.467936282993732,2025-04-24 22:11:58.660854,2025-04-24 22:13:55.676789,0 days 00:01:57.015935,False,absolute_error,47,,1,3,503,TPESampler,COMPLETE
836,0.4178217504084299,2025-04-24 22:12:01.115177,2025-04-24 22:12:20.702891,0 days 00:00:19.587714,False,absolute_error,50,sqrt,2,2,755,TPESampler,COMPLETE
837,0.8548079338675346,2025-04-24 22:12:02.906887,2025-04-24 22:12:04.000849,0 days 00:00:01.093962,True,squared_error,24,log2,7,22,442,TPESampler,COMPLETE
838,0.33930493301519676,2025-04-24 22:12:04.327474,2025-04-24 22:12:34.481101,0 days 00:00:30.153627,False,absolute_error,40,sqrt,1,3,681,TPESampler,COMPLETE
839,0.5635009534112404,2025-04-24 22:12:05.909299,2025-04-24 22:12:06.662982,0 days 00:00:00.753683,True,squared_error,14,sqrt,3,19,131,TPESampler,COMPLETE
840,0.33461352745471895,2025-04-24 22:12:06.837214,2025-04-24 22:12:35.857736,0 days 00:00:29.020522,False,absolute_error,41,sqrt,1,4,658,TPESampler,COMPLETE
841,0.3710629733297381,2025-04-24 22:12:12.247753,2025-04-24 22:13:23.163185,0 days 00:01:10.915432,True,absolute_error,29,,2,8,825,TPESampler,COMPLETE
842,0.33098410041051674,2025-04-24 22:12:20.889452,2025-04-24 22:12:44.745074,0 days 00:00:23.855622,False,absolute_error,45,sqrt,1,4,600,TPESampler,COMPLETE
843,0.37014323468108284,2025-04-24 22:12:34.656614,2025-04-24 22:12:46.141978,0 days 00:00:11.485364,False,absolute_error,48,log2,1,4,398,TPESampler,COMPLETE
844,0.42534640513069716,2025-04-24 22:12:36.036989,2025-04-24 22:12:48.945491,0 days 00:00:12.908502,False,absolute_error,36,sqrt,2,5,526,TPESampler,COMPLETE
845,0.41865408912254465,2025-04-24 22:12:45.227047,2025-04-24 22:12:47.657835,0 days 00:00:02.430788,False,squared_error,48,sqrt,2,7,664,TPESampler,COMPLETE
846,0.3447690659569958,2025-04-24 22:12:46.523822,2025-04-24 22:13:10.330143,0 days 00:00:23.806321,False,absolute_error,46,sqrt,1,2,592,TPESampler,COMPLETE
847,0.32495596831482315,2025-04-24 22:12:48.165797,2025-04-24 22:13:18.421505,0 days 00:00:30.255708,False,absolute_error,50,sqrt,1,5,584,TPESampler,COMPLETE
848,0.32661519522037286,2025-04-24 22:12:49.665396,2025-04-24 22:13:12.593358,0 days 00:00:22.927962,False,absolute_error,50,sqrt,1,4,605,TPESampler,COMPLETE
849,0.802016709813082,2025-04-24 22:13:10.536254,2025-04-24 22:13:11.566745,0 days 00:00:01.030491,False,squared_error,30,log2,5,34,626,TPESampler,COMPLETE
850,0.3552225030643988,2025-04-24 22:13:11.741986,2025-04-24 22:13:28.725890,0 days 00:00:16.983904,True,absolute_error,50,sqrt,1,4,624,TPESampler,COMPLETE
851,0.7924434680731518,2025-04-24 22:13:12.898049,2025-04-24 22:13:16.516639,0 days 00:00:03.618590,True,absolute_error,5,log2,2,3,855,TPESampler,COMPLETE
852,0.349762930768906,2025-04-24 22:13:16.702162,2025-04-24 22:13:43.690450,0 days 00:00:26.988288,False,absolute_error,45,sqrt,1,9,659,TPESampler,COMPLETE
853,0.3337228431959088,2025-04-24 22:13:18.601954,2025-04-24 22:13:33.523315,0 days 00:00:14.921361,False,absolute_error,47,sqrt,1,6,365,TPESampler,COMPLETE
854,0.3287075696864405,2025-04-24 22:13:23.342520,2025-04-24 22:13:43.605164,0 days 00:00:20.262644,False,absolute_error,49,sqrt,1,5,504,TPESampler,COMPLETE
855,0.37569311203727485,2025-04-24 22:13:28.908241,2025-04-24 22:13:46.839529,0 days 00:00:17.931288,False,absolute_error,46,log2,1,4,635,TPESampler,COMPLETE
856,0.32513907527510577,2025-04-24 22:13:33.705356,2025-04-24 22:13:55.156690,0 days 00:00:21.451334,False,absolute_error,50,sqrt,1,5,572,TPESampler,COMPLETE
857,0.8639233354738569,2025-04-24 22:13:37.585956,2025-04-24 22:13:39.209038,0 days 00:00:01.623082,True,absolute_error,35,log2,8,49,631,TPESampler,COMPLETE
858,0.34460912930972587,2025-04-24 22:13:39.396738,2025-04-24 22:13:59.964414,0 days 00:00:20.567676,False,absolute_error,41,sqrt,1,7,571,TPESampler,COMPLETE
859,0.3403383090567297,2025-04-24 22:13:43.805112,2025-04-24 22:14:05.562577,0 days 00:00:21.757465,False,absolute_error,43,sqrt,1,6,591,TPESampler,COMPLETE
860,0.874191104185714,2025-04-24 22:13:43.899859,2025-04-24 22:13:45.292844,0 days 00:00:01.392985,True,squared_error,14,log2,13,13,704,TPESampler,COMPLETE
861,0.34149221397834184,2025-04-24 22:13:45.473870,2025-04-24 22:14:05.905184,0 days 00:00:20.431314,False,absolute_error,50,sqrt,1,8,552,TPESampler,COMPLETE
862,0.3365318090136558,2025-04-24 22:13:47.026846,2025-04-24 22:14:07.942079,0 days 00:00:20.915233,False,absolute_error,44,sqrt,1,3,558,TPESampler,COMPLETE
863,0.569703980307353,2025-04-24 22:13:55.336366,2025-04-24 22:14:00.772504,0 days 00:00:05.436138,False,absolute_error,21,sqrt,5,12,459,TPESampler,COMPLETE
864,0.32911295552104003,2025-04-24 22:13:55.977931,2025-04-24 22:14:15.052196,0 days 00:00:19.074265,False,absolute_error,48,sqrt,1,5,505,TPESampler,COMPLETE
865,0.4546616477934165,2025-04-24 22:14:00.159426,2025-04-24 22:14:09.798340,0 days 00:00:09.638914,True,absolute_error,50,sqrt,2,2,734,TPESampler,COMPLETE
866,0.3586181260499006,2025-04-24 22:14:00.964766,2025-04-24 22:14:19.016638,0 days 00:00:18.051872,False,absolute_error,50,sqrt,1,13,488,TPESampler,COMPLETE
867,0.4146441117340585,2025-04-24 22:14:05.765946,2025-04-24 22:14:18.621948,0 days 00:00:12.856002,True,absolute_error,37,sqrt,1,31,655,TPESampler,COMPLETE
868,0.32721153601426345,2025-04-24 22:14:06.116073,2025-04-24 22:14:24.331425,0 days 00:00:18.215352,False,absolute_error,48,sqrt,1,4,474,TPESampler,COMPLETE
869,0.3371162897985101,2025-04-24 22:14:08.123581,2025-04-24 22:14:09.917696,0 days 00:00:01.794115,False,squared_error,49,sqrt,1,5,504,TPESampler,COMPLETE
870,0.5354491325284139,2025-04-24 22:14:10.010515,2025-04-24 22:14:28.286087,0 days 00:00:18.275572,False,absolute_error,5,,11,10,537,TPESampler,COMPLETE
871,0.4209474159611634,2025-04-24 22:14:10.090950,2025-04-24 22:14:28.183294,0 days 00:00:18.092344,False,absolute_error,48,sqrt,2,5,682,TPESampler,COMPLETE
872,0.3354954724974643,2025-04-24 22:14:15.249258,2025-04-24 22:14:32.414105,0 days 00:00:17.164847,False,absolute_error,49,sqrt,1,3,352,TPESampler,COMPLETE
873,0.3409776443414656,2025-04-24 22:14:18.807080,2025-04-24 22:14:47.313047,0 days 00:00:28.505967,False,absolute_error,50,sqrt,1,8,599,TPESampler,COMPLETE
874,0.3257950984722187,2025-04-24 22:14:19.214732,2025-04-24 22:14:38.418082,0 days 00:00:19.203350,False,absolute_error,50,sqrt,1,4,394,TPESampler,COMPLETE
875,0.33619993934912107,2025-04-24 22:14:24.516915,2025-04-24 22:14:49.261361,0 days 00:00:24.744446,False,absolute_error,48,sqrt,1,3,625,TPESampler,COMPLETE
876,0.5945600358442447,2025-04-24 22:14:28.343126,2025-04-24 22:14:29.493368,0 days 00:00:01.150242,False,squared_error,16,log2,1,10,239,TPESampler,COMPLETE
877,0.33571994528359755,2025-04-24 22:14:28.493987,2025-04-24 22:14:47.701459,0 days 00:00:19.207472,False,absolute_error,50,sqrt,1,7,506,TPESampler,COMPLETE
878,0.3366586453811604,2025-04-24 22:14:29.663384,2025-04-24 22:14:46.008425,0 days 00:00:16.345041,False,absolute_error,41,sqrt,1,4,441,TPESampler,COMPLETE
879,0.3489723462956306,2025-04-24 22:14:32.591750,2025-04-24 22:14:58.198986,0 days 00:00:25.607236,False,absolute_error,43,sqrt,1,8,643,TPESampler,COMPLETE
880,0.6221400192026079,2025-04-24 22:14:38.601033,2025-04-24 22:14:44.894581,0 days 00:00:06.293548,False,absolute_error,37,log2,2,6,519,TPESampler,COMPLETE
881,0.4684684465803046,2025-04-24 22:14:45.230717,2025-04-24 22:16:02.785788,0 days 00:01:17.555071,False,absolute_error,49,,3,2,692,TPESampler,COMPLETE
882,0.41624379628616875,2025-04-24 22:14:46.185215,2025-04-24 22:14:59.782521,0 days 00:00:13.597306,False,absolute_error,50,sqrt,2,4,548,TPESampler,COMPLETE
883,0.47299437340177414,2025-04-24 22:14:47.522572,2025-04-24 22:14:55.030093,0 days 00:00:07.507521,False,absolute_error,24,,10,9,162,TPESampler,COMPLETE
884,0.3356209152915895,2025-04-24 22:14:47.927529,2025-04-24 22:15:14.332283,0 days 00:00:26.404754,False,absolute_error,50,sqrt,1,7,656,TPESampler,COMPLETE
885,0.33107655922453166,2025-04-24 22:14:49.444455,2025-04-24 22:15:11.371751,0 days 00:00:21.927296,False,absolute_error,44,sqrt,1,4,595,TPESampler,COMPLETE
886,0.733705734635037,2025-04-24 22:14:55.216487,2025-04-24 22:14:56.120177,0 days 00:00:00.903690,False,squared_error,8,log2,2,4,421,TPESampler,COMPLETE
887,0.3448728642194228,2025-04-24 22:14:56.306051,2025-04-24 22:15:23.510462,0 days 00:00:27.204411,False,absolute_error,50,sqrt,1,2,692,TPESampler,COMPLETE
888,0.32487305405534694,2025-04-24 22:14:58.385968,2025-04-24 22:15:21.729597,0 days 00:00:23.343629,False,absolute_error,50,sqrt,1,5,625,TPESampler,COMPLETE
889,0.326389885990146,2025-04-24 22:14:59.967281,2025-04-24 22:15:22.214754,0 days 00:00:22.247473,False,absolute_error,50,sqrt,1,5,520,TPESampler,COMPLETE
890,0.4044122302037141,2025-04-24 22:15:11.558767,2025-04-24 22:15:21.053642,0 days 00:00:09.494875,True,absolute_error,50,log2,1,6,563,TPESampler,COMPLETE
891,0.41780293101703814,2025-04-24 22:15:14.548465,2025-04-24 22:15:32.072593,0 days 00:00:17.524128,False,absolute_error,50,sqrt,2,4,704,TPESampler,COMPLETE
892,0.32609871661503664,2025-04-24 22:15:21.241878,2025-04-24 22:15:39.643135,0 days 00:00:18.401257,False,absolute_error,50,sqrt,1,5,486,TPESampler,COMPLETE
893,0.36888178657600407,2025-04-24 22:15:21.941249,2025-04-24 22:15:26.670522,0 days 00:00:04.729273,True,squared_error,35,,2,5,733,TPESampler,COMPLETE
894,0.3342814913555511,2025-04-24 22:15:22.435561,2025-04-24 22:15:44.054421,0 days 00:00:21.618860,False,absolute_error,49,sqrt,1,3,560,TPESampler,COMPLETE
895,0.4215740148653583,2025-04-24 22:15:23.710786,2025-04-24 22:15:44.006324,0 days 00:00:20.295538,False,absolute_error,43,sqrt,2,5,588,TPESampler,COMPLETE
896,0.37370741168551613,2025-04-24 22:15:26.868051,2025-04-24 22:16:37.105771,0 days 00:01:10.237720,True,absolute_error,45,,2,10,827,TPESampler,COMPLETE
897,0.3324486397503058,2025-04-24 22:15:32.249243,2025-04-24 22:15:53.034420,0 days 00:00:20.785177,False,absolute_error,42,sqrt,1,5,567,TPESampler,COMPLETE
898,0.33116421605452234,2025-04-24 22:15:39.823948,2025-04-24 22:16:02.146409,0 days 00:00:22.322461,False,absolute_error,50,sqrt,1,6,599,TPESampler,COMPLETE
899,0.8120816198994886,2025-04-24 22:15:44.208852,2025-04-24 22:15:45.876920,0 days 00:00:01.668068,True,squared_error,47,sqrt,13,37,857,TPESampler,COMPLETE
900,0.33521925672038455,2025-04-24 22:15:44.299942,2025-04-24 22:16:07.496401,0 days 00:00:23.196459,False,absolute_error,50,sqrt,1,7,623,TPESampler,COMPLETE
901,0.38361322863915576,2025-04-24 22:15:46.060922,2025-04-24 22:16:00.932514,0 days 00:00:14.871592,False,absolute_error,49,log2,1,6,470,TPESampler,COMPLETE
902,0.43548341280114927,2025-04-24 22:15:53.232219,2025-04-24 22:15:58.258177,0 days 00:00:05.025958,True,absolute_error,37,,5,3,137,TPESampler,COMPLETE
903,0.41967480277822533,2025-04-24 22:15:58.445200,2025-04-24 22:16:12.892747,0 days 00:00:14.447547,False,absolute_error,50,sqrt,2,5,550,TPESampler,COMPLETE
904,0.8471119877186571,2025-04-24 22:16:01.123426,2025-04-24 22:16:02.091726,0 days 00:00:00.968300,False,squared_error,12,log2,8,5,588,TPESampler,COMPLETE
905,0.4683944758058426,2025-04-24 22:16:02.298134,2025-04-24 22:16:36.512719,0 days 00:00:34.214585,False,absolute_error,24,,3,4,305,TPESampler,COMPLETE
906,0.32784579339222963,2025-04-24 22:16:02.351836,2025-04-24 22:16:23.910114,0 days 00:00:21.558278,False,absolute_error,50,sqrt,1,4,485,TPESampler,COMPLETE
907,0.43136586158089135,2025-04-24 22:16:03.092441,2025-04-24 22:16:18.002677,0 days 00:00:14.910236,False,absolute_error,49,sqrt,2,17,615,TPESampler,COMPLETE
908,0.33302175840397835,2025-04-24 22:16:07.679740,2025-04-24 22:16:32.106798,0 days 00:00:24.427058,False,absolute_error,42,sqrt,1,4,617,TPESampler,COMPLETE
909,0.619947953794001,2025-04-24 22:16:13.305562,2025-04-24 22:16:22.372754,0 days 00:00:09.067192,False,absolute_error,46,log2,2,3,542,TPESampler,COMPLETE
910,0.3249753296782672,2025-04-24 22:16:18.199125,2025-04-24 22:16:39.684361,0 days 00:00:21.485236,False,absolute_error,49,sqrt,1,4,556,TPESampler,COMPLETE
911,0.3317866825028061,2025-04-24 22:16:22.555530,2025-04-24 22:16:45.764225,0 days 00:00:23.208695,False,absolute_error,50,sqrt,1,3,606,TPESampler,COMPLETE
912,0.3267311699953032,2025-04-24 22:16:24.103739,2025-04-24 22:16:48.920501,0 days 00:00:24.816762,False,absolute_error,50,sqrt,1,4,657,TPESampler,COMPLETE
913,0.44334661306232315,2025-04-24 22:16:32.325691,2025-04-24 22:18:58.776476,0 days 00:02:26.450785,False,absolute_error,38,,1,6,652,TPESampler,COMPLETE
914,0.3271713932548112,2025-04-24 22:16:36.697491,2025-04-24 22:17:02.180622,0 days 00:00:25.483131,False,absolute_error,50,sqrt,1,4,675,TPESampler,COMPLETE
915,0.39121773045220054,2025-04-24 22:16:37.497235,2025-04-24 22:16:41.234189,0 days 00:00:03.736954,True,absolute_error,48,log2,1,3,191,TPESampler,COMPLETE
916,0.4179884532472277,2025-04-24 22:16:39.857923,2025-04-24 22:16:54.261682,0 days 00:00:14.403759,False,absolute_error,42,sqrt,2,3,550,TPESampler,COMPLETE
917,0.33171085654385374,2025-04-24 22:16:41.420519,2025-04-24 22:17:05.701732,0 days 00:00:24.281213,False,absolute_error,43,sqrt,1,4,606,TPESampler,COMPLETE
918,0.3317867438465126,2025-04-24 22:16:45.961388,2025-04-24 22:17:06.261004,0 days 00:00:20.299616,False,absolute_error,50,sqrt,1,6,538,TPESampler,COMPLETE
919,0.41620170003148643,2025-04-24 22:16:49.096190,2025-04-24 22:17:00.411213,0 days 00:00:11.315023,False,absolute_error,44,sqrt,2,2,455,TPESampler,COMPLETE
920,0.3349744419936809,2025-04-24 22:16:54.448746,2025-04-24 22:17:16.115995,0 days 00:00:21.667249,False,absolute_error,50,sqrt,1,7,581,TPESampler,COMPLETE
921,0.3444546098547591,2025-04-24 22:17:00.604659,2025-04-24 22:17:23.354158,0 days 00:00:22.749499,False,absolute_error,50,sqrt,1,2,581,TPESampler,COMPLETE
922,0.3457847251372088,2025-04-24 22:17:02.353547,2025-04-24 22:17:17.902384,0 days 00:00:15.548837,False,absolute_error,40,sqrt,1,7,401,TPESampler,COMPLETE
923,0.32644679690407785,2025-04-24 22:17:05.882408,2025-04-24 22:17:30.022124,0 days 00:00:24.139716,False,absolute_error,50,sqrt,1,4,624,TPESampler,COMPLETE
924,0.3396423675180726,2025-04-24 22:17:06.494359,2025-04-24 22:17:24.854328,0 days 00:00:18.359969,False,absolute_error,42,sqrt,1,3,488,TPESampler,COMPLETE
925,0.32624183704678006,2025-04-24 22:17:16.308912,2025-04-24 22:17:36.712892,0 days 00:00:20.403980,False,absolute_error,50,sqrt,1,5,529,TPESampler,COMPLETE
926,0.3384540589015525,2025-04-24 22:17:18.076472,2025-04-24 22:17:20.743854,0 days 00:00:02.667382,False,squared_error,49,sqrt,1,3,656,TPESampler,COMPLETE
927,0.3321345812819644,2025-04-24 22:17:20.995733,2025-04-24 22:17:41.304123,0 days 00:00:20.308390,False,absolute_error,50,sqrt,1,3,490,TPESampler,COMPLETE
928,0.33613622302689933,2025-04-24 22:17:23.528274,2025-04-24 22:17:41.910278,0 days 00:00:18.382004,False,absolute_error,41,sqrt,1,4,451,TPESampler,COMPLETE
929,0.38223452175969846,2025-04-24 22:17:25.049727,2025-04-24 22:17:43.654429,0 days 00:00:18.604702,False,absolute_error,50,log2,1,6,617,TPESampler,COMPLETE
930,0.5195106881027581,2025-04-24 22:17:30.205108,2025-04-24 22:17:31.247722,0 days 00:00:01.042614,True,squared_error,32,sqrt,3,24,348,TPESampler,COMPLETE
931,0.38867702961993716,2025-04-24 22:17:31.458747,2025-04-24 22:17:35.680629,0 days 00:00:04.221882,False,squared_error,42,,1,7,432,TPESampler,COMPLETE
932,0.3327712870083069,2025-04-24 22:17:35.876406,2025-04-24 22:18:00.228948,0 days 00:00:24.352542,False,absolute_error,43,sqrt,1,5,657,TPESampler,COMPLETE
933,0.4205499328661835,2025-04-24 22:17:36.901783,2025-04-24 22:17:53.483074,0 days 00:00:16.581291,False,absolute_error,49,sqrt,2,5,629,TPESampler,COMPLETE
934,0.4560258898849093,2025-04-24 22:17:41.521863,2025-04-24 22:17:47.836854,0 days 00:00:06.314991,True,absolute_error,49,sqrt,2,4,470,TPESampler,COMPLETE
935,0.35257805333547965,2025-04-24 22:17:42.148027,2025-04-24 22:18:05.103176,0 days 00:00:22.955149,False,absolute_error,50,sqrt,1,12,627,TPESampler,COMPLETE
936,0.42017472022223856,2025-04-24 22:17:43.829015,2025-04-24 22:17:58.179419,0 days 00:00:14.350404,False,absolute_error,50,sqrt,2,5,589,TPESampler,COMPLETE
937,0.5575454453163675,2025-04-24 22:17:48.251454,2025-04-24 22:17:52.564694,0 days 00:00:04.313240,True,squared_error,13,,15,10,913,TPESampler,COMPLETE
938,0.3271692460519978,2025-04-24 22:17:52.902400,2025-04-24 22:18:18.612225,0 days 00:00:25.709825,False,absolute_error,50,sqrt,1,4,674,TPESampler,COMPLETE
939,0.3406587349681163,2025-04-24 22:17:54.536261,2025-04-24 22:18:18.635150,0 days 00:00:24.098889,False,absolute_error,43,sqrt,1,6,655,TPESampler,COMPLETE
940,0.44963189912807733,2025-04-24 22:17:58.372053,2025-04-24 22:20:08.039719,0 days 00:02:09.667666,False,absolute_error,50,,1,4,553,TPESampler,COMPLETE
941,0.34744802141937076,2025-04-24 22:18:00.488254,2025-04-24 22:18:03.874159,0 days 00:00:03.385905,False,squared_error,37,sqrt,1,4,970,TPESampler,COMPLETE
942,0.3436884167743838,2025-04-24 22:18:04.060721,2025-04-24 22:18:23.706855,0 days 00:00:19.646134,False,absolute_error,41,sqrt,1,6,539,TPESampler,COMPLETE
943,0.3317866825028061,2025-04-24 22:18:05.303118,2025-04-24 22:18:28.371803,0 days 00:00:23.068685,False,absolute_error,50,sqrt,1,3,606,TPESampler,COMPLETE
944,0.42458494794442486,2025-04-24 22:18:18.760137,2025-04-24 22:18:33.466527,0 days 00:00:14.706390,False,absolute_error,45,sqrt,2,8,556,TPESampler,COMPLETE
945,0.42265170672356545,2025-04-24 22:18:18.805818,2025-04-24 22:18:31.086453,0 days 00:00:12.280635,False,absolute_error,40,sqrt,2,7,447,TPESampler,COMPLETE
946,0.33130582122637936,2025-04-24 22:18:23.931848,2025-04-24 22:18:43.733911,0 days 00:00:19.802063,False,absolute_error,50,sqrt,1,3,448,TPESampler,COMPLETE
947,0.3271692460519978,2025-04-24 22:18:28.562101,2025-04-24 22:18:53.730819,0 days 00:00:25.168718,False,absolute_error,50,sqrt,1,4,674,TPESampler,COMPLETE
948,0.42088711826230685,2025-04-24 22:18:31.264947,2025-04-24 22:18:44.480391,0 days 00:00:13.215444,False,absolute_error,50,sqrt,2,6,532,TPESampler,COMPLETE
949,0.33357155039399616,2025-04-24 22:18:33.644983,2025-04-24 22:19:02.869224,0 days 00:00:29.224241,False,absolute_error,49,sqrt,1,6,597,TPESampler,COMPLETE
950,0.3266611299607176,2025-04-24 22:18:43.923944,2025-04-24 22:19:11.535260,0 days 00:00:27.611316,False,absolute_error,50,sqrt,1,4,601,TPESampler,COMPLETE
951,0.8685046232625744,2025-04-24 22:18:44.830971,2025-04-24 22:18:45.754981,0 days 00:00:00.924010,True,absolute_error,29,log2,9,3,191,TPESampler,COMPLETE
952,0.4210590704073995,2025-04-24 22:18:45.942798,2025-04-24 22:19:11.283576,0 days 00:00:25.340778,False,absolute_error,50,sqrt,2,5,841,TPESampler,COMPLETE
953,0.3418345262591006,2025-04-24 22:18:53.910031,2025-04-24 22:19:11.023482,0 days 00:00:17.113451,False,absolute_error,50,sqrt,1,8,431,TPESampler,COMPLETE
954,0.4189812058575655,2025-04-24 22:18:59.046900,2025-04-24 22:19:18.673629,0 days 00:00:19.626729,False,absolute_error,43,sqrt,2,4,784,TPESampler,COMPLETE
955,0.33259158062095207,2025-04-24 22:19:03.048265,2025-04-24 22:19:37.387570,0 days 00:00:34.339305,False,absolute_error,42,sqrt,1,5,819,TPESampler,COMPLETE
956,0.3682404927155409,2025-04-24 22:19:11.204974,2025-04-24 22:19:25.315321,0 days 00:00:14.110347,True,absolute_error,43,sqrt,1,6,595,TPESampler,COMPLETE
957,0.3252493950511649,2025-04-24 22:19:11.476450,2025-04-24 22:19:40.841321,0 days 00:00:29.364871,False,absolute_error,50,sqrt,1,5,647,TPESampler,COMPLETE
958,0.3420152466511567,2025-04-24 22:19:11.844767,2025-04-24 22:19:14.014098,0 days 00:00:02.169331,False,squared_error,49,sqrt,1,7,589,TPESampler,COMPLETE
959,0.4197085146502309,2025-04-24 22:19:14.200606,2025-04-24 22:19:34.516515,0 days 00:00:20.315909,False,absolute_error,39,sqrt,2,2,610,TPESampler,COMPLETE
960,0.33594287610390966,2025-04-24 22:19:18.857099,2025-04-24 22:19:45.599142,0 days 00:00:26.742043,False,absolute_error,50,sqrt,1,7,677,TPESampler,COMPLETE
961,0.33339172294634845,2025-04-24 22:19:25.503267,2025-04-24 22:19:51.215152,0 days 00:00:25.711885,False,absolute_error,42,sqrt,1,4,703,TPESampler,COMPLETE
962,0.32665140659630315,2025-04-24 22:19:34.707405,2025-04-24 22:19:50.884886,0 days 00:00:16.177481,False,absolute_error,50,sqrt,1,4,413,TPESampler,COMPLETE
963,0.33324359063212494,2025-04-24 22:19:37.565247,2025-04-24 22:20:09.695742,0 days 00:00:32.130495,False,absolute_error,42,sqrt,1,4,883,TPESampler,COMPLETE
964,0.33185103632943896,2025-04-24 22:19:41.023759,2025-04-24 22:20:01.342749,0 days 00:00:20.318990,False,absolute_error,50,sqrt,1,3,526,TPESampler,COMPLETE
965,0.36803312796347293,2025-04-24 22:19:45.791456,2025-04-24 22:20:02.281689,0 days 00:00:16.490233,True,absolute_error,50,sqrt,1,7,696,TPESampler,COMPLETE
966,0.3396739218938728,2025-04-24 22:19:51.149966,2025-04-24 22:20:16.128503,0 days 00:00:24.978537,False,absolute_error,41,sqrt,1,3,650,TPESampler,COMPLETE
967,0.3469472314998828,2025-04-24 22:19:51.450759,2025-04-24 22:20:27.728583,0 days 00:00:36.277824,False,absolute_error,43,sqrt,1,2,893,TPESampler,COMPLETE
968,0.3411382047631188,2025-04-24 22:20:01.526415,2025-04-24 22:20:26.150317,0 days 00:00:24.623902,False,absolute_error,42,sqrt,1,6,657,TPESampler,COMPLETE
