number,value,datetime_start,datetime_complete,duration,params_bootstrap,params_criterion,params_max_depth,params_max_features,params_min_samples_leaf,params_min_samples_split,params_n_estimators,system_attrs_auto:sampler,state
1796,0.46422393938882156,2025-04-24 23:09:59.398235,2025-04-24 23:13:21.933736,0 days 00:03:22.535501,False,absolute_error,36,,1,3,845,TPESampler,COMPLETE
1797,0.4181833696945405,2025-04-24 23:10:01.128255,2025-04-24 23:10:18.849598,0 days 00:00:17.721343,False,absolute_error,50,sqrt,2,3,731,TPESampler,COMPLETE
1798,0.4151312904813303,2025-04-24 23:10:03.000285,2025-04-24 23:10:43.830987,0 days 00:00:40.830702,True,absolute_error,49,,4,6,969,TPESampler,COMPLETE
1799,0.49261462460563943,2025-04-24 23:10:08.884504,2025-04-24 23:10:11.042765,0 days 00:00:02.158261,False,squared_error,6,,3,5,427,TPESampler,COMPLETE
1800,0.42195567759753017,2025-04-24 23:10:11.245344,2025-04-24 23:10:29.928566,0 days 00:00:18.683222,False,absolute_error,41,sqrt,2,5,780,TPESampler,COMPLETE
1801,0.32592233743378674,2025-04-24 23:10:19.039818,2025-04-24 23:10:37.842245,0 days 00:00:18.802427,False,absolute_error,50,sqrt,1,5,502,TPESampler,COMPLETE
1802,0.3950723371470503,2025-04-24 23:10:30.113237,2025-04-24 23:10:45.072949,0 days 00:00:14.959712,False,absolute_error,40,log2,1,4,541,TPESampler,COMPLETE
1803,0.4207831946669951,2025-04-24 23:10:38.024729,2025-04-24 23:10:50.574397,0 days 00:00:12.549668,False,absolute_error,43,sqrt,2,6,515,TPESampler,COMPLETE
1804,0.4141408835529576,2025-04-24 23:10:44.013027,2025-04-24 23:10:53.023309,0 days 00:00:09.010282,False,absolute_error,50,sqrt,2,3,351,TPESampler,COMPLETE
1805,0.3262741406355306,2025-04-24 23:10:45.256939,2025-04-24 23:11:08.269500,0 days 00:00:23.012561,False,absolute_error,50,sqrt,1,4,612,TPESampler,COMPLETE
1806,0.34514151999227277,2025-04-24 23:10:46.133425,2025-04-24 23:11:03.214243,0 days 00:00:17.080818,False,absolute_error,50,sqrt,1,2,427,TPESampler,COMPLETE
1807,0.8600936407077067,2025-04-24 23:10:50.755319,2025-04-24 23:10:51.608620,0 days 00:00:00.853301,False,squared_error,7,log2,14,2,411,TPESampler,COMPLETE
1808,0.33151208611136734,2025-04-24 23:10:51.793960,2025-04-24 23:11:08.723600,0 days 00:00:16.929640,False,absolute_error,50,sqrt,1,3,436,TPESampler,COMPLETE
1809,0.3285259475257254,2025-04-24 23:10:53.208978,2025-04-24 23:11:29.576658,0 days 00:00:36.367680,False,absolute_error,49,sqrt,1,5,866,TPESampler,COMPLETE
1810,0.33239570298732757,2025-04-24 23:11:03.410880,2025-04-24 23:11:28.923597,0 days 00:00:25.512717,False,absolute_error,42,sqrt,1,5,565,TPESampler,COMPLETE
1811,0.32674080855348214,2025-04-24 23:11:08.468563,2025-04-24 23:11:35.240154,0 days 00:00:26.771591,False,absolute_error,50,sqrt,1,4,710,TPESampler,COMPLETE
1812,0.617860007293778,2025-04-24 23:11:08.934939,2025-04-24 23:11:18.878469,0 days 00:00:09.943530,False,absolute_error,46,log2,2,5,842,TPESampler,COMPLETE
1813,0.41797331352977274,2025-04-24 23:11:19.066369,2025-04-24 23:11:36.085326,0 days 00:00:17.018957,False,absolute_error,50,sqrt,2,4,700,TPESampler,COMPLETE
1814,0.348577369528406,2025-04-24 23:11:29.117506,2025-04-24 23:11:41.749119,0 days 00:00:12.631613,True,absolute_error,50,sqrt,1,2,522,TPESampler,COMPLETE
1815,0.3251689152469264,2025-04-24 23:11:29.759889,2025-04-24 23:12:04.298246,0 days 00:00:34.538357,False,absolute_error,50,sqrt,1,5,800,TPESampler,COMPLETE
1816,0.349349091973766,2025-04-24 23:11:35.434057,2025-04-24 23:12:03.253174,0 days 00:00:27.819117,False,absolute_error,43,sqrt,1,8,768,TPESampler,COMPLETE
1817,0.4045702266512213,2025-04-24 23:11:36.274115,2025-04-24 23:11:48.954653,0 days 00:00:12.680538,True,absolute_error,48,log2,1,5,826,TPESampler,COMPLETE
1818,0.3268598728383834,2025-04-24 23:11:41.939471,2025-04-24 23:12:13.353506,0 days 00:00:31.414035,False,absolute_error,50,sqrt,1,4,684,TPESampler,COMPLETE
1819,0.45404871247704937,2025-04-24 23:11:49.146816,2025-04-24 23:11:58.572654,0 days 00:00:09.425838,True,absolute_error,48,sqrt,2,5,749,TPESampler,COMPLETE
1820,0.33593501311338936,2025-04-24 23:11:58.757757,2025-04-24 23:12:25.352606,0 days 00:00:26.594849,False,absolute_error,50,sqrt,1,7,693,TPESampler,COMPLETE
1821,0.4199586047350021,2025-04-24 23:12:03.446653,2025-04-24 23:12:19.179732,0 days 00:00:15.733079,False,absolute_error,41,sqrt,2,3,636,TPESampler,COMPLETE
1822,0.33236583253608104,2025-04-24 23:12:04.488753,2025-04-24 23:12:20.585378,0 days 00:00:16.096625,False,absolute_error,42,sqrt,1,4,429,TPESampler,COMPLETE
1823,0.33691902531963197,2025-04-24 23:12:04.864246,2025-04-24 23:12:33.879334,0 days 00:00:29.015088,False,absolute_error,44,sqrt,1,3,748,TPESampler,COMPLETE
1824,0.3402127239930405,2025-04-24 23:12:13.559330,2025-04-24 23:12:15.569329,0 days 00:00:02.009999,False,squared_error,42,sqrt,1,4,554,TPESampler,COMPLETE
1825,0.32506129907959186,2025-04-24 23:12:15.755770,2025-04-24 23:12:37.888361,0 days 00:00:22.132591,False,absolute_error,50,sqrt,1,5,591,TPESampler,COMPLETE
1826,0.341088807724826,2025-04-24 23:12:19.452530,2025-04-24 23:12:39.004259,0 days 00:00:19.551729,False,absolute_error,42,sqrt,1,6,540,TPESampler,COMPLETE
1827,0.35089499481775477,2025-04-24 23:12:20.775947,2025-04-24 23:12:47.168047,0 days 00:00:26.392100,False,absolute_error,33,sqrt,1,4,769,TPESampler,COMPLETE
1828,0.3984395313851569,2025-04-24 23:12:25.535819,2025-04-24 23:12:44.179594,0 days 00:00:18.643775,True,absolute_error,12,,1,2,159,TPESampler,COMPLETE
1829,0.338633578261568,2025-04-24 23:12:34.065867,2025-04-24 23:13:09.197190,0 days 00:00:35.131323,False,absolute_error,43,sqrt,1,3,553,TPESampler,COMPLETE
1830,0.6761537118224789,2025-04-24 23:12:38.075169,2025-04-24 23:12:38.978641,0 days 00:00:00.903472,False,squared_error,47,sqrt,8,32,339,TPESampler,COMPLETE
1831,0.3900721744517939,2025-04-24 23:12:39.121036,2025-04-24 23:12:53.208266,0 days 00:00:14.087230,True,absolute_error,26,,3,2,227,TPESampler,COMPLETE
1832,0.34485895261911514,2025-04-24 23:12:39.166716,2025-04-24 23:13:03.497301,0 days 00:00:24.330585,False,absolute_error,50,sqrt,1,10,656,TPESampler,COMPLETE
1833,0.3360188848610589,2025-04-24 23:12:44.581380,2025-04-24 23:13:15.337145,0 days 00:00:30.755765,False,absolute_error,50,sqrt,1,7,492,TPESampler,COMPLETE
1834,0.32501034560370845,2025-04-24 23:12:47.569411,2025-04-24 23:13:10.427056,0 days 00:00:22.857645,False,absolute_error,50,sqrt,1,5,580,TPESampler,COMPLETE
1835,0.42225091459191266,2025-04-24 23:12:53.472913,2025-04-24 23:13:06.018723,0 days 00:00:12.545810,False,absolute_error,50,sqrt,2,7,503,TPESampler,COMPLETE
1836,0.3249543140761057,2025-04-24 23:13:03.689107,2025-04-24 23:13:27.078108,0 days 00:00:23.389001,False,absolute_error,50,sqrt,1,5,626,TPESampler,COMPLETE
1837,0.3316409154730385,2025-04-24 23:13:06.209023,2025-04-24 23:13:25.979299,0 days 00:00:19.770276,False,absolute_error,50,sqrt,1,6,533,TPESampler,COMPLETE
1838,0.3391984912567234,2025-04-24 23:13:09.386427,2025-04-24 23:13:33.580387,0 days 00:00:24.193960,False,absolute_error,42,sqrt,1,3,577,TPESampler,COMPLETE
1839,0.33168909470406194,2025-04-24 23:13:10.624131,2025-04-24 23:13:34.873868,0 days 00:00:24.249737,False,absolute_error,50,sqrt,1,6,652,TPESampler,COMPLETE
1840,0.37478287563570084,2025-04-24 23:13:15.526677,2025-04-24 23:13:19.720920,0 days 00:00:04.194243,True,squared_error,41,,1,19,725,TPESampler,COMPLETE
1841,0.35894580398137227,2025-04-24 23:13:19.987087,2025-04-24 23:13:41.526530,0 days 00:00:21.539443,False,absolute_error,41,sqrt,1,10,522,TPESampler,COMPLETE
1842,0.41854996903970776,2025-04-24 23:13:22.123612,2025-04-24 23:13:40.498746,0 days 00:00:18.375134,False,absolute_error,44,sqrt,2,4,649,TPESampler,COMPLETE
1843,0.34137905259491275,2025-04-24 23:13:26.168490,2025-04-24 23:13:42.988992,0 days 00:00:16.820502,False,absolute_error,50,sqrt,1,8,448,TPESampler,COMPLETE
1844,0.4200568787658759,2025-04-24 23:13:27.269803,2025-04-24 23:13:40.326630,0 days 00:00:13.056827,False,absolute_error,50,sqrt,2,5,529,TPESampler,COMPLETE
1845,0.3431235166716244,2025-04-24 23:13:33.792706,2025-04-24 23:14:08.478773,0 days 00:00:34.686067,False,absolute_error,50,sqrt,1,9,626,TPESampler,COMPLETE
1846,0.3390251291391265,2025-04-24 23:13:35.058480,2025-04-24 23:13:58.504472,0 days 00:00:23.445992,False,absolute_error,45,sqrt,1,7,610,TPESampler,COMPLETE
1847,0.32818159430756233,2025-04-24 23:13:40.520220,2025-04-24 23:14:01.510367,0 days 00:00:20.990147,False,absolute_error,49,sqrt,1,5,561,TPESampler,COMPLETE
1848,0.3322266747374523,2025-04-24 23:13:40.693567,2025-04-24 23:14:07.120222,0 days 00:00:26.426655,False,absolute_error,42,sqrt,1,5,573,TPESampler,COMPLETE
1849,0.3278323044968566,2025-04-24 23:13:41.708400,2025-04-24 23:14:09.612433,0 days 00:00:27.904033,False,absolute_error,50,sqrt,1,4,526,TPESampler,COMPLETE
1850,0.3739951890069151,2025-04-24 23:13:43.176908,2025-04-24 23:13:51.878349,0 days 00:00:08.701441,True,absolute_error,32,sqrt,1,3,374,TPESampler,COMPLETE
1851,0.4630521869262511,2025-04-24 23:13:52.070973,2025-04-24 23:13:53.855544,0 days 00:00:01.784571,True,squared_error,26,sqrt,2,5,800,TPESampler,COMPLETE
1852,0.3340861104702627,2025-04-24 23:13:54.045172,2025-04-24 23:14:15.739720,0 days 00:00:21.694548,False,absolute_error,46,sqrt,1,6,582,TPESampler,COMPLETE
1853,0.4160202133569623,2025-04-24 23:13:58.694259,2025-04-24 23:14:13.449916,0 days 00:00:14.755657,True,absolute_error,48,,3,29,261,TPESampler,COMPLETE
1854,0.340447869997119,2025-04-24 23:14:01.706737,2025-04-24 23:14:23.359885,0 days 00:00:21.653148,False,absolute_error,43,sqrt,1,6,592,TPESampler,COMPLETE
1855,0.42058217006368753,2025-04-24 23:14:07.307523,2025-04-24 23:14:22.706795,0 days 00:00:15.399272,False,absolute_error,48,sqrt,2,5,625,TPESampler,COMPLETE
1856,0.3341460513272329,2025-04-24 23:14:08.665969,2025-04-24 23:14:29.722724,0 days 00:00:21.056755,False,absolute_error,44,sqrt,1,5,573,TPESampler,COMPLETE
1857,0.33191323232202774,2025-04-24 23:14:09.794419,2025-04-24 23:14:28.630227,0 days 00:00:18.835808,False,absolute_error,50,sqrt,1,6,501,TPESampler,COMPLETE
1858,0.34508063452752896,2025-04-24 23:14:13.642232,2025-04-24 23:14:37.769282,0 days 00:00:24.127050,False,absolute_error,50,sqrt,1,2,613,TPESampler,COMPLETE
1859,0.33215468706340734,2025-04-24 23:14:15.932870,2025-04-24 23:14:35.861897,0 days 00:00:19.929027,False,absolute_error,50,sqrt,1,3,517,TPESampler,COMPLETE
1860,0.41782489636089704,2025-04-24 23:14:22.904219,2025-04-24 23:14:39.251845,0 days 00:00:16.347626,False,absolute_error,50,sqrt,2,4,658,TPESampler,COMPLETE
1861,0.3318695207367786,2025-04-24 23:14:23.614617,2025-04-24 23:14:45.832861,0 days 00:00:22.218244,False,absolute_error,43,sqrt,1,4,605,TPESampler,COMPLETE
1862,0.3394140234053609,2025-04-24 23:14:28.828705,2025-04-24 23:14:51.299464,0 days 00:00:22.470759,False,absolute_error,44,sqrt,1,7,612,TPESampler,COMPLETE
1863,0.32659664171440267,2025-04-24 23:14:29.908212,2025-04-24 23:14:54.229379,0 days 00:00:24.321167,False,absolute_error,50,sqrt,1,4,641,TPESampler,COMPLETE
1864,0.42556821928891925,2025-04-24 23:14:36.053589,2025-04-24 23:14:49.788491,0 days 00:00:13.734902,False,absolute_error,49,sqrt,2,9,560,TPESampler,COMPLETE
1865,0.32646047906552766,2025-04-24 23:14:37.962792,2025-04-24 23:15:00.903682,0 days 00:00:22.940890,False,absolute_error,50,sqrt,1,4,607,TPESampler,COMPLETE
1866,0.33829954665419576,2025-04-24 23:14:39.432872,2025-04-24 23:14:41.375640,0 days 00:00:01.942768,False,squared_error,48,sqrt,1,6,577,TPESampler,COMPLETE
1867,0.41437963102394304,2025-04-24 23:14:41.561735,2025-04-24 23:14:42.919547,0 days 00:00:01.357812,False,squared_error,50,sqrt,2,5,455,TPESampler,COMPLETE
1868,0.44694372735692045,2025-04-24 23:14:43.104663,2025-04-24 23:14:47.660940,0 days 00:00:04.556277,False,squared_error,36,,2,49,799,TPESampler,COMPLETE
1869,0.4285330812721999,2025-04-24 23:14:46.023090,2025-04-24 23:15:01.829508,0 days 00:00:15.806418,False,absolute_error,39,sqrt,2,8,638,TPESampler,COMPLETE
1870,0.630574364658711,2025-04-24 23:14:47.848406,2025-04-24 23:14:54.845037,0 days 00:00:06.996631,False,absolute_error,49,sqrt,7,3,857,TPESampler,COMPLETE
1871,0.8194298633072757,2025-04-24 23:14:49.975388,2025-04-24 23:14:51.533767,0 days 00:00:01.558379,True,squared_error,21,log2,4,5,942,TPESampler,COMPLETE
1872,0.3251014947919875,2025-04-24 23:14:51.483228,2025-04-24 23:15:12.531144,0 days 00:00:21.047916,False,absolute_error,49,sqrt,1,4,550,TPESampler,COMPLETE
1873,0.45060711490784333,2025-04-24 23:14:51.721976,2025-04-24 23:16:59.533536,0 days 00:02:07.811560,False,absolute_error,49,,1,4,558,TPESampler,COMPLETE
1874,0.3682865492392265,2025-04-24 23:14:54.413124,2025-04-24 23:15:07.166058,0 days 00:00:12.752934,False,absolute_error,49,log2,1,4,445,TPESampler,COMPLETE
1875,0.3406075929043238,2025-04-24 23:14:55.027392,2025-04-24 23:15:17.276626,0 days 00:00:22.249234,False,absolute_error,43,sqrt,1,6,606,TPESampler,COMPLETE
1876,0.4129657854489436,2025-04-24 23:15:01.095425,2025-04-24 23:15:02.394178,0 days 00:00:01.298753,True,squared_error,14,,3,6,131,TPESampler,COMPLETE
1877,0.4173036627356361,2025-04-24 23:15:02.024346,2025-04-24 23:15:16.219082,0 days 00:00:14.194736,False,absolute_error,43,log2,1,9,534,TPESampler,COMPLETE
1878,0.3419308934061406,2025-04-24 23:15:02.582808,2025-04-24 23:15:21.556906,0 days 00:00:18.974098,False,absolute_error,50,sqrt,1,8,511,TPESampler,COMPLETE
1879,0.7991386507221637,2025-04-24 23:15:07.356205,2025-04-24 23:15:09.157758,0 days 00:00:01.801553,True,absolute_error,33,sqrt,11,13,571,TPESampler,COMPLETE
1880,0.5161288462879196,2025-04-24 23:15:09.340820,2025-04-24 23:15:10.448574,0 days 00:00:01.107754,True,squared_error,16,sqrt,2,10,354,TPESampler,COMPLETE
1881,0.4102174345909993,2025-04-24 23:15:10.635577,2025-04-24 23:15:11.593474,0 days 00:00:00.957897,True,squared_error,36,sqrt,1,20,213,TPESampler,COMPLETE
1882,0.3657009345480146,2025-04-24 23:15:11.780373,2025-04-24 23:15:27.823410,0 days 00:00:16.043037,False,absolute_error,31,sqrt,1,6,466,TPESampler,COMPLETE
1883,0.3265413651234418,2025-04-24 23:15:12.714970,2025-04-24 23:15:34.659476,0 days 00:00:21.944506,False,absolute_error,50,sqrt,1,4,579,TPESampler,COMPLETE
1884,0.41838948248378177,2025-04-24 23:15:16.414421,2025-04-24 23:15:29.372896,0 days 00:00:12.958475,False,absolute_error,45,sqrt,2,4,528,TPESampler,COMPLETE
1885,0.6588606431727885,2025-04-24 23:15:17.450874,2025-04-24 23:15:18.961146,0 days 00:00:01.510272,False,squared_error,17,log2,2,22,985,TPESampler,COMPLETE
1886,0.43098102153411705,2025-04-24 23:15:19.154247,2025-04-24 23:15:34.036664,0 days 00:00:14.882417,False,absolute_error,31,sqrt,2,5,610,TPESampler,COMPLETE
1887,0.3460580254516562,2025-04-24 23:15:21.744684,2025-04-24 23:15:42.551053,0 days 00:00:20.806369,False,absolute_error,50,sqrt,1,2,530,TPESampler,COMPLETE
1888,0.7856802705982568,2025-04-24 23:15:28.015287,2025-04-24 23:15:29.544874,0 days 00:00:01.529587,True,squared_error,33,sqrt,10,3,858,TPESampler,COMPLETE
1889,0.8511995625568065,2025-04-24 23:15:29.564036,2025-04-24 23:15:31.013719,0 days 00:00:01.449683,False,absolute_error,33,log2,9,7,436,TPESampler,COMPLETE
1890,0.3253251849360244,2025-04-24 23:15:29.732793,2025-04-24 23:15:44.091551,0 days 00:00:14.358758,False,absolute_error,50,sqrt,1,5,377,TPESampler,COMPLETE
1891,0.3270931961415595,2025-04-24 23:15:31.206805,2025-04-24 23:15:48.510745,0 days 00:00:17.303940,False,absolute_error,50,sqrt,1,4,438,TPESampler,COMPLETE
1892,0.3495090711917369,2025-04-24 23:15:34.216033,2025-04-24 23:15:53.153575,0 days 00:00:18.937542,False,absolute_error,43,sqrt,1,8,519,TPESampler,COMPLETE
1893,0.3277042337947331,2025-04-24 23:15:35.001076,2025-04-24 23:15:56.898603,0 days 00:00:21.897527,False,absolute_error,49,sqrt,1,5,584,TPESampler,COMPLETE
1894,0.3311813158048836,2025-04-24 23:15:42.754837,2025-04-24 23:16:04.595567,0 days 00:00:21.840730,False,absolute_error,50,sqrt,1,6,575,TPESampler,COMPLETE
1895,0.3364853440151876,2025-04-24 23:15:44.285570,2025-04-24 23:15:46.581879,0 days 00:00:02.296309,False,squared_error,48,sqrt,1,3,533,TPESampler,COMPLETE
1896,0.3275137080805109,2025-04-24 23:15:46.772666,2025-04-24 23:16:05.139219,0 days 00:00:18.366553,False,absolute_error,50,sqrt,1,4,479,TPESampler,COMPLETE
1897,0.36529621775693083,2025-04-24 23:15:48.702727,2025-04-24 23:15:59.864854,0 days 00:00:11.162127,False,absolute_error,42,sqrt,1,13,307,TPESampler,COMPLETE
1898,0.4124329034638418,2025-04-24 23:15:53.338188,2025-04-24 23:15:56.860628,0 days 00:00:03.522440,True,squared_error,14,,1,14,719,TPESampler,COMPLETE
1899,0.35250116116856645,2025-04-24 23:15:57.013557,2025-04-24 23:16:26.181880,0 days 00:00:29.168323,True,absolute_error,43,,1,2,218,TPESampler,COMPLETE
1900,0.5015644310818999,2025-04-24 23:15:57.064367,2025-04-24 23:15:59.560150,0 days 00:00:02.495783,False,squared_error,6,,1,40,451,TPESampler,COMPLETE
1901,0.3320312737955416,2025-04-24 23:15:59.753079,2025-04-24 23:16:21.142842,0 days 00:00:21.389763,False,absolute_error,50,sqrt,1,3,558,TPESampler,COMPLETE
1902,0.7075261320658551,2025-04-24 23:16:00.074480,2025-04-24 23:16:01.503815,0 days 00:00:01.429335,True,squared_error,18,sqrt,6,3,694,TPESampler,COMPLETE
1903,0.341795316689103,2025-04-24 23:16:01.695666,2025-04-24 23:16:17.703478,0 days 00:00:16.007812,False,absolute_error,43,sqrt,1,6,431,TPESampler,COMPLETE
1904,0.8173532945703914,2025-04-24 23:16:04.784268,2025-04-24 23:16:05.796747,0 days 00:00:01.012479,True,squared_error,39,sqrt,14,43,356,TPESampler,COMPLETE
1905,0.41811137238093704,2025-04-24 23:16:05.380287,2025-04-24 23:16:18.175094,0 days 00:00:12.794807,False,absolute_error,42,sqrt,2,3,521,TPESampler,COMPLETE
1906,0.32471492924158746,2025-04-24 23:16:06.049275,2025-04-24 23:16:27.576305,0 days 00:00:21.527030,False,absolute_error,49,sqrt,1,4,576,TPESampler,COMPLETE
1907,0.3467725191867185,2025-04-24 23:16:17.895449,2025-04-24 23:16:40.588274,0 days 00:00:22.692825,False,absolute_error,43,sqrt,1,2,584,TPESampler,COMPLETE
1908,0.819282477162039,2025-04-24 23:16:18.396366,2025-04-24 23:16:19.216317,0 days 00:00:00.819951,True,squared_error,33,log2,4,3,155,TPESampler,COMPLETE
1909,0.45581607407297847,2025-04-24 23:16:19.418433,2025-04-24 23:16:25.952054,0 days 00:00:06.533621,True,absolute_error,45,sqrt,2,2,467,TPESampler,COMPLETE
1910,0.3251588098429994,2025-04-24 23:16:21.331353,2025-04-24 23:16:38.602485,0 days 00:00:17.271132,False,absolute_error,50,sqrt,1,5,451,TPESampler,COMPLETE
1911,0.33943124312461054,2025-04-24 23:16:26.141619,2025-04-24 23:16:47.152505,0 days 00:00:21.010886,False,absolute_error,42,sqrt,1,3,560,TPESampler,COMPLETE
1912,0.42662136897618896,2025-04-24 23:16:26.479565,2025-04-24 23:16:41.191353,0 days 00:00:14.711788,False,absolute_error,45,sqrt,2,9,597,TPESampler,COMPLETE
1913,0.8743366266505582,2025-04-24 23:16:27.769870,2025-04-24 23:16:28.531304,0 days 00:00:00.761434,True,absolute_error,17,log2,12,5,113,TPESampler,COMPLETE
1914,0.3270243983816538,2025-04-24 23:16:28.723003,2025-04-24 23:16:52.808827,0 days 00:00:24.085824,False,absolute_error,50,sqrt,1,4,563,TPESampler,COMPLETE
1915,0.33168644584237794,2025-04-24 23:16:38.790398,2025-04-24 23:17:03.442831,0 days 00:00:24.652433,False,absolute_error,50,sqrt,1,6,545,TPESampler,COMPLETE
1916,0.7315997486467943,2025-04-24 23:16:40.780602,2025-04-24 23:16:41.832462,0 days 00:00:01.051860,False,squared_error,8,sqrt,10,4,492,TPESampler,COMPLETE
1917,0.6957539342065082,2025-04-24 23:16:41.442021,2025-04-24 23:16:47.070689,0 days 00:00:05.628668,True,absolute_error,34,log2,2,17,969,TPESampler,COMPLETE
1918,0.4208302657245286,2025-04-24 23:16:42.045063,2025-04-24 23:16:57.655790,0 days 00:00:15.610727,False,absolute_error,50,sqrt,2,6,527,TPESampler,COMPLETE
1919,0.5939171195185275,2025-04-24 23:16:47.263438,2025-04-24 23:16:48.637299,0 days 00:00:01.373861,False,squared_error,25,sqrt,6,3,231,TPESampler,COMPLETE
1920,0.871846672876415,2025-04-24 23:16:47.387182,2025-04-24 23:16:49.407666,0 days 00:00:02.020484,True,squared_error,45,log2,12,2,808,TPESampler,COMPLETE
1921,0.4170852013851114,2025-04-24 23:16:48.843738,2025-04-24 23:17:09.917433,0 days 00:00:21.073695,False,absolute_error,50,sqrt,2,3,614,TPESampler,COMPLETE
1922,0.34503529180755893,2025-04-24 23:16:49.781646,2025-04-24 23:17:21.293612,0 days 00:00:31.511966,False,absolute_error,50,sqrt,1,2,612,TPESampler,COMPLETE
1923,0.3262355980176682,2025-04-24 23:16:53.004432,2025-04-24 23:17:18.212821,0 days 00:00:25.208389,False,absolute_error,50,sqrt,1,4,620,TPESampler,COMPLETE
1924,0.42166062215289324,2025-04-24 23:16:57.849772,2025-04-24 23:17:12.918552,0 days 00:00:15.068780,False,absolute_error,43,sqrt,2,6,567,TPESampler,COMPLETE
1925,0.331721187351056,2025-04-24 23:16:59.715760,2025-04-24 23:17:22.231260,0 days 00:00:22.515500,False,absolute_error,43,sqrt,1,4,571,TPESampler,COMPLETE
1926,0.4551203885608724,2025-04-24 23:17:03.646693,2025-04-24 23:17:11.503214,0 days 00:00:07.856521,True,absolute_error,49,sqrt,2,4,538,TPESampler,COMPLETE
1927,0.7983740453995015,2025-04-24 23:17:10.094235,2025-04-24 23:17:13.342340,0 days 00:00:03.248105,True,absolute_error,36,sqrt,11,7,967,TPESampler,COMPLETE
1928,0.32634875329260254,2025-04-24 23:17:11.692241,2025-04-24 23:17:35.884756,0 days 00:00:24.192515,False,absolute_error,50,sqrt,1,4,636,TPESampler,COMPLETE
1929,0.42590188454291683,2025-04-24 23:17:13.102002,2025-04-24 23:17:28.007887,0 days 00:00:14.905885,False,absolute_error,50,sqrt,2,9,588,TPESampler,COMPLETE
1930,0.42047009265895,2025-04-24 23:17:13.545004,2025-04-24 23:17:30.327808,0 days 00:00:16.782804,False,absolute_error,50,sqrt,2,5,602,TPESampler,COMPLETE
1931,0.3348450153569407,2025-04-24 23:17:18.396448,2025-04-24 23:17:48.432645,0 days 00:00:30.036197,False,absolute_error,41,sqrt,1,4,631,TPESampler,COMPLETE
1932,0.33993116108721116,2025-04-24 23:17:21.484483,2025-04-24 23:17:49.918262,0 days 00:00:28.433779,False,absolute_error,42,sqrt,1,3,680,TPESampler,COMPLETE
1933,0.33150841421600835,2025-04-24 23:17:22.419039,2025-04-24 23:17:52.261230,0 days 00:00:29.842191,False,absolute_error,50,sqrt,1,6,546,TPESampler,COMPLETE
