number,value,datetime_start,datetime_complete,duration,params_bootstrap,params_criterion,params_max_depth,params_max_features,params_min_samples_leaf,params_min_samples_split,params_n_estimators,system_attrs_auto:sampler,state
4131,0.3294044405003629,2025-04-25 01:10:57.726869,2025-04-25 01:11:13.321741,0 days 00:00:15.594872,False,absolute_error,44,sqrt,1,4,411,TPESampler,COMPLETE
4132,0.33275930223730105,2025-04-25 01:11:04.726268,2025-04-25 01:11:30.898393,0 days 00:00:26.172125,False,absolute_error,50,sqrt,1,3,682,TPESampler,COMPLETE
4133,0.3255109839775687,2025-04-25 01:11:09.507525,2025-04-25 01:11:23.934170,0 days 00:00:14.426645,False,absolute_error,50,sqrt,1,5,375,TPESampler,COMPLETE
4134,0.3465297745526436,2025-04-25 01:11:13.557276,2025-04-25 01:11:23.283814,0 days 00:00:09.726538,False,absolute_error,42,sqrt,1,2,242,TPESampler,COMPLETE
4135,0.41124464776827924,2025-04-25 01:11:23.530857,2025-04-25 01:11:43.784690,0 days 00:00:20.253833,True,absolute_error,41,log2,1,2,991,TPESampler,COMPLETE
4136,0.41852525345951375,2025-04-25 01:11:23.530081,2025-04-25 01:11:30.776096,0 days 00:00:07.246015,False,absolute_error,50,sqrt,2,5,251,TPESampler,COMPLETE
4137,0.32563783179766764,2025-04-25 01:11:24.273608,2025-04-25 01:11:51.298580,0 days 00:00:27.024972,False,absolute_error,50,sqrt,1,5,559,TPESampler,COMPLETE
4138,0.41458924255406304,2025-04-25 01:11:30.977781,2025-04-25 01:11:37.996841,0 days 00:00:07.019060,False,absolute_error,50,sqrt,2,3,246,TPESampler,COMPLETE
4139,0.3273853505641813,2025-04-25 01:11:31.143862,2025-04-25 01:11:51.211666,0 days 00:00:20.067804,False,absolute_error,50,sqrt,1,4,472,TPESampler,COMPLETE
4140,0.33742591878968375,2025-04-25 01:11:35.931419,2025-04-25 01:12:11.839728,0 days 00:00:35.908309,False,absolute_error,41,sqrt,1,5,902,TPESampler,COMPLETE
4141,0.4206846766109943,2025-04-25 01:11:38.235710,2025-04-25 01:11:55.600005,0 days 00:00:17.364295,False,absolute_error,50,sqrt,2,5,640,TPESampler,COMPLETE
4142,0.3308818171150689,2025-04-25 01:11:44.031051,2025-04-25 01:12:07.040171,0 days 00:00:23.009120,False,absolute_error,50,sqrt,1,6,590,TPESampler,COMPLETE
4143,0.4260354899567002,2025-04-25 01:11:51.481226,2025-04-25 01:12:08.390776,0 days 00:00:16.909550,False,absolute_error,42,sqrt,2,8,675,TPESampler,COMPLETE
4144,0.4179029165190072,2025-04-25 01:11:51.596615,2025-04-25 01:12:03.264160,0 days 00:00:11.667545,False,absolute_error,45,sqrt,2,2,460,TPESampler,COMPLETE
4145,0.3316022049651986,2025-04-25 01:11:55.718646,2025-04-25 01:12:08.386958,0 days 00:00:12.668312,False,absolute_error,50,sqrt,1,3,310,TPESampler,COMPLETE
4146,0.41698523051259434,2025-04-25 01:11:55.886075,2025-04-25 01:12:09.649120,0 days 00:00:13.763045,False,absolute_error,44,sqrt,2,4,525,TPESampler,COMPLETE
4147,0.3833336530765862,2025-04-25 01:12:03.499753,2025-04-25 01:12:22.514053,0 days 00:00:19.014300,False,absolute_error,43,log2,1,4,653,TPESampler,COMPLETE
4148,0.3332534894720774,2025-04-25 01:12:07.274977,2025-04-25 01:12:27.186457,0 days 00:00:19.911480,False,absolute_error,43,sqrt,1,5,512,TPESampler,COMPLETE
4149,0.3307302762786529,2025-04-25 01:12:08.578663,2025-04-25 01:12:18.388648,0 days 00:00:09.809985,False,absolute_error,50,sqrt,1,6,219,TPESampler,COMPLETE
4150,0.32721857526872955,2025-04-25 01:12:08.641296,2025-04-25 01:12:19.938138,0 days 00:00:11.296842,False,absolute_error,50,sqrt,1,4,251,TPESampler,COMPLETE
4151,0.5627549916963223,2025-04-25 01:12:10.185120,2025-04-25 01:12:11.864422,0 days 00:00:01.679302,False,squared_error,48,sqrt,5,6,406,TPESampler,COMPLETE
4152,0.33327049313865703,2025-04-25 01:12:12.144128,2025-04-25 01:12:42.166342,0 days 00:00:30.022214,False,absolute_error,43,sqrt,1,5,806,TPESampler,COMPLETE
4153,0.44401798597235054,2025-04-25 01:12:12.143902,2025-04-25 01:14:53.762545,0 days 00:02:41.618643,False,absolute_error,41,,1,5,709,TPESampler,COMPLETE
4154,0.3908215844590179,2025-04-25 01:12:18.621798,2025-04-25 01:12:24.401450,0 days 00:00:05.779652,False,squared_error,23,,1,15,724,TPESampler,COMPLETE
4155,0.33206140410465135,2025-04-25 01:12:20.166756,2025-04-25 01:12:44.822053,0 days 00:00:24.655297,False,absolute_error,50,sqrt,1,3,552,TPESampler,COMPLETE
4156,0.3377693164190944,2025-04-25 01:12:22.755520,2025-04-25 01:12:39.803525,0 days 00:00:17.048005,False,absolute_error,43,sqrt,1,3,446,TPESampler,COMPLETE
4157,0.3390774452067179,2025-04-25 01:12:24.628882,2025-04-25 01:12:54.188211,0 days 00:00:29.559329,False,absolute_error,43,sqrt,1,3,686,TPESampler,COMPLETE
4158,0.41953826657919735,2025-04-25 01:12:27.433524,2025-04-25 01:12:40.081751,0 days 00:00:12.648227,False,absolute_error,50,sqrt,2,5,504,TPESampler,COMPLETE
4159,0.44552259343203054,2025-04-25 01:12:40.039665,2025-04-25 01:12:47.047922,0 days 00:00:07.008257,False,squared_error,44,,5,2,978,TPESampler,COMPLETE
4160,0.33107311383128674,2025-04-25 01:12:40.449405,2025-04-25 01:13:02.806323,0 days 00:00:22.356918,False,absolute_error,50,sqrt,1,6,579,TPESampler,COMPLETE
4161,0.42663506611882557,2025-04-25 01:12:42.465994,2025-04-25 01:12:58.682285,0 days 00:00:16.216291,False,absolute_error,50,sqrt,2,9,645,TPESampler,COMPLETE
4162,0.33197113964005504,2025-04-25 01:12:45.289097,2025-04-25 01:13:07.056492,0 days 00:00:21.767395,False,absolute_error,50,sqrt,1,3,535,TPESampler,COMPLETE
4163,0.3317169461730801,2025-04-25 01:12:47.442439,2025-04-25 01:13:15.310753,0 days 00:00:27.868314,False,absolute_error,43,sqrt,1,4,715,TPESampler,COMPLETE
4164,0.5073860034777724,2025-04-25 01:12:54.527032,2025-04-25 01:12:58.238313,0 days 00:00:03.711281,False,squared_error,36,,15,11,620,TPESampler,COMPLETE
4165,0.3464533691721832,2025-04-25 01:12:58.482848,2025-04-25 01:13:19.000521,0 days 00:00:20.517673,False,absolute_error,36,sqrt,1,3,564,TPESampler,COMPLETE
4166,0.33094231334730667,2025-04-25 01:12:58.936696,2025-04-25 01:13:10.651187,0 days 00:00:11.714491,False,absolute_error,43,sqrt,1,5,305,TPESampler,COMPLETE
4167,0.32693006594088914,2025-04-25 01:13:03.042205,2025-04-25 01:13:20.040869,0 days 00:00:16.998664,False,absolute_error,50,sqrt,1,4,418,TPESampler,COMPLETE
4168,0.41963811596093736,2025-04-25 01:13:07.310570,2025-04-25 01:13:09.235414,0 days 00:00:01.924844,False,squared_error,43,sqrt,2,4,704,TPESampler,COMPLETE
4169,0.3530423088730831,2025-04-25 01:13:09.469473,2025-04-25 01:13:27.219632,0 days 00:00:17.750159,False,absolute_error,43,sqrt,1,9,483,TPESampler,COMPLETE
4170,0.3412751891826087,2025-04-25 01:13:10.884345,2025-04-25 01:13:38.500242,0 days 00:00:27.615897,False,absolute_error,50,sqrt,1,8,710,TPESampler,COMPLETE
4171,0.33223057990631716,2025-04-25 01:13:15.563479,2025-04-25 01:13:17.743614,0 days 00:00:02.180135,False,squared_error,50,sqrt,1,4,518,TPESampler,COMPLETE
4172,0.41621065547809993,2025-04-25 01:13:17.980204,2025-04-25 01:13:31.705137,0 days 00:00:13.724933,False,absolute_error,50,sqrt,2,2,550,TPESampler,COMPLETE
4173,0.3546545969701221,2025-04-25 01:13:19.235575,2025-04-25 01:13:36.145186,0 days 00:00:16.909611,False,absolute_error,44,sqrt,1,10,456,TPESampler,COMPLETE
4174,0.3310225304140235,2025-04-25 01:13:20.273914,2025-04-25 01:13:42.429555,0 days 00:00:22.155641,False,absolute_error,44,sqrt,1,4,564,TPESampler,COMPLETE
4175,0.3457353934298602,2025-04-25 01:13:27.449192,2025-04-25 01:13:41.501075,0 days 00:00:14.051883,False,absolute_error,43,sqrt,1,2,354,TPESampler,COMPLETE
4176,0.33411790484265896,2025-04-25 01:13:31.941898,2025-04-25 01:13:54.534201,0 days 00:00:22.592303,False,absolute_error,44,sqrt,1,5,599,TPESampler,COMPLETE
4177,0.4215875765929741,2025-04-25 01:13:36.513426,2025-04-25 01:13:46.189258,0 days 00:00:09.675832,False,absolute_error,44,sqrt,2,6,375,TPESampler,COMPLETE
4178,0.3322910817901345,2025-04-25 01:13:38.737977,2025-04-25 01:14:02.554401,0 days 00:00:23.816424,False,absolute_error,43,sqrt,1,5,637,TPESampler,COMPLETE
4179,0.3316278447380661,2025-04-25 01:13:41.744881,2025-04-25 01:14:06.243520,0 days 00:00:24.498639,False,absolute_error,50,sqrt,1,6,654,TPESampler,COMPLETE
4180,0.8323936405777251,2025-04-25 01:13:42.716822,2025-04-25 01:13:45.220813,0 days 00:00:02.503991,False,absolute_error,46,log2,7,4,675,TPESampler,COMPLETE
4181,0.6370488022289481,2025-04-25 01:13:45.465362,2025-04-25 01:13:46.475059,0 days 00:00:01.009697,False,squared_error,45,log2,2,2,218,TPESampler,COMPLETE
4182,0.3345098884215039,2025-04-25 01:13:46.435708,2025-04-25 01:14:00.186815,0 days 00:00:13.751107,False,absolute_error,50,sqrt,1,7,360,TPESampler,COMPLETE
4183,0.697329441358726,2025-04-25 01:13:46.713771,2025-04-25 01:13:48.188056,0 days 00:00:01.474285,False,squared_error,27,log2,3,33,824,TPESampler,COMPLETE
4184,0.3456377776808281,2025-04-25 01:13:48.430166,2025-04-25 01:14:05.488595,0 days 00:00:17.058429,False,absolute_error,36,sqrt,1,4,439,TPESampler,COMPLETE
4185,0.4195770082627809,2025-04-25 01:13:54.765929,2025-04-25 01:14:14.499785,0 days 00:00:19.733856,False,absolute_error,42,sqrt,2,4,747,TPESampler,COMPLETE
4186,0.4180869979953129,2025-04-25 01:14:00.415890,2025-04-25 01:14:17.568988,0 days 00:00:17.153098,False,absolute_error,50,sqrt,2,4,691,TPESampler,COMPLETE
4187,0.34379739050373953,2025-04-25 01:14:02.793761,2025-04-25 01:14:32.567103,0 days 00:00:29.773342,False,absolute_error,50,sqrt,1,2,755,TPESampler,COMPLETE
4188,0.32650355836311107,2025-04-25 01:14:05.744316,2025-04-25 01:14:28.634546,0 days 00:00:22.890230,False,absolute_error,50,sqrt,1,4,593,TPESampler,COMPLETE
4189,0.3310261940179907,2025-04-25 01:14:06.535127,2025-04-25 01:14:28.668868,0 days 00:00:22.133741,False,absolute_error,50,sqrt,1,6,593,TPESampler,COMPLETE
4190,0.33667589639365203,2025-04-25 01:14:14.743652,2025-04-25 01:14:37.071466,0 days 00:00:22.327814,False,absolute_error,44,sqrt,1,3,587,TPESampler,COMPLETE
4191,0.4261123752742901,2025-04-25 01:14:17.811122,2025-04-25 01:14:37.762887,0 days 00:00:19.951765,False,absolute_error,42,sqrt,2,8,819,TPESampler,COMPLETE
4192,0.3254460173255109,2025-04-25 01:14:28.882447,2025-04-25 01:14:57.113571,0 days 00:00:28.231124,False,absolute_error,50,sqrt,1,5,747,TPESampler,COMPLETE
4193,0.42140669511633605,2025-04-25 01:14:28.882520,2025-04-25 01:14:43.350239,0 days 00:00:14.467719,False,absolute_error,43,sqrt,2,6,577,TPESampler,COMPLETE
4194,0.3583955461180209,2025-04-25 01:14:32.848109,2025-04-25 01:14:34.771276,0 days 00:00:01.923167,True,squared_error,43,sqrt,1,4,428,TPESampler,COMPLETE
4195,0.3314992895475035,2025-04-25 01:14:35.011205,2025-04-25 01:14:58.037217,0 days 00:00:23.026012,False,absolute_error,43,sqrt,1,4,617,TPESampler,COMPLETE
4196,0.36516670630466896,2025-04-25 01:14:37.307238,2025-04-25 01:14:48.649604,0 days 00:00:11.342366,False,absolute_error,50,log2,1,4,386,TPESampler,COMPLETE
4197,0.32562276123552253,2025-04-25 01:14:38.035919,2025-04-25 01:14:49.337334,0 days 00:00:11.301415,False,absolute_error,50,sqrt,1,5,288,TPESampler,COMPLETE
4198,0.33082112108989464,2025-04-25 01:14:43.581207,2025-04-25 01:14:56.200495,0 days 00:00:12.619288,False,absolute_error,43,sqrt,1,5,329,TPESampler,COMPLETE
4199,0.3515461408776346,2025-04-25 01:14:48.885155,2025-04-25 01:15:08.505228,0 days 00:00:19.620073,False,absolute_error,50,sqrt,1,11,526,TPESampler,COMPLETE
4200,0.3665175680974732,2025-04-25 01:14:49.634422,2025-04-25 01:15:06.573814,0 days 00:00:16.939392,False,absolute_error,35,sqrt,1,8,475,TPESampler,COMPLETE
4201,0.3320312737955416,2025-04-25 01:14:53.993501,2025-04-25 01:15:16.939907,0 days 00:00:22.946406,False,absolute_error,50,sqrt,1,3,558,TPESampler,COMPLETE
4202,0.3719100965485258,2025-04-25 01:14:56.424483,2025-04-25 01:15:08.194349,0 days 00:00:11.769866,True,absolute_error,43,sqrt,1,7,494,TPESampler,COMPLETE
4203,0.4530628712105808,2025-04-25 01:14:57.405856,2025-04-25 01:15:08.532215,0 days 00:00:11.126359,True,absolute_error,19,sqrt,1,5,652,TPESampler,COMPLETE
4204,0.3252890798613266,2025-04-25 01:14:58.472962,2025-04-25 01:15:13.879371,0 days 00:00:15.406409,False,absolute_error,50,sqrt,1,5,399,TPESampler,COMPLETE
4205,0.3493031205112725,2025-04-25 01:15:06.805705,2025-04-25 01:15:33.148325,0 days 00:00:26.342620,False,absolute_error,43,sqrt,1,8,695,TPESampler,COMPLETE
4206,0.4161101475814881,2025-04-25 01:15:08.434335,2025-04-25 01:15:21.558442,0 days 00:00:13.124107,False,absolute_error,50,sqrt,2,4,464,TPESampler,COMPLETE
4207,0.33188724750616005,2025-04-25 01:15:08.680991,2025-04-25 01:15:21.850222,0 days 00:00:13.169231,False,absolute_error,50,sqrt,1,3,315,TPESampler,COMPLETE
4208,0.41984379925019366,2025-04-25 01:15:08.725190,2025-04-25 01:15:16.370784,0 days 00:00:07.645594,False,absolute_error,43,sqrt,2,5,267,TPESampler,COMPLETE
4209,0.4504340627779768,2025-04-25 01:15:14.111526,2025-04-25 01:17:10.143162,0 days 00:01:56.031636,False,absolute_error,49,,1,4,506,TPESampler,COMPLETE
4210,0.33231606333163,2025-04-25 01:15:16.603329,2025-04-25 01:15:42.301851,0 days 00:00:25.698522,False,absolute_error,50,sqrt,1,3,669,TPESampler,COMPLETE
4211,0.3271944357848284,2025-04-25 01:15:17.187272,2025-04-25 01:15:38.624395,0 days 00:00:21.437123,False,absolute_error,50,sqrt,1,4,561,TPESampler,COMPLETE
4212,0.34303719378745284,2025-04-25 01:15:21.790810,2025-04-25 01:15:28.149792,0 days 00:00:06.358982,False,absolute_error,42,sqrt,1,3,153,TPESampler,COMPLETE
4213,0.5214048467533566,2025-04-25 01:15:22.096283,2025-04-25 01:15:36.228143,0 days 00:00:14.131860,False,absolute_error,24,sqrt,4,38,965,TPESampler,COMPLETE
4214,0.3917622319102334,2025-04-25 01:15:28.379521,2025-04-25 01:16:05.506828,0 days 00:00:37.127307,False,absolute_error,39,,2,9,262,TPESampler,COMPLETE
4215,0.33243911719261243,2025-04-25 01:15:33.375212,2025-04-25 01:15:40.542399,0 days 00:00:07.167187,False,absolute_error,50,sqrt,1,3,163,TPESampler,COMPLETE
4216,0.3411026163309899,2025-04-25 01:15:36.479914,2025-04-25 01:15:57.365354,0 days 00:00:20.885440,False,absolute_error,43,sqrt,1,7,576,TPESampler,COMPLETE
4217,0.33075248402610424,2025-04-25 01:15:38.975625,2025-04-25 01:15:40.688519,0 days 00:00:01.712894,False,squared_error,50,sqrt,1,4,361,TPESampler,COMPLETE
4218,0.3471192633391373,2025-04-25 01:15:40.738702,2025-04-25 01:16:07.620132,0 days 00:00:26.881430,False,absolute_error,43,sqrt,1,2,682,TPESampler,COMPLETE
4219,0.6713563878464414,2025-04-25 01:15:40.953663,2025-04-25 01:15:44.179126,0 days 00:00:03.225463,True,absolute_error,12,log2,1,34,285,TPESampler,COMPLETE
4220,0.3268349211067121,2025-04-25 01:15:42.542422,2025-04-25 01:16:08.745274,0 days 00:00:26.202852,False,absolute_error,50,sqrt,1,4,697,TPESampler,COMPLETE
4221,0.328219332023049,2025-04-25 01:15:44.405157,2025-04-25 01:15:55.264893,0 days 00:00:10.859736,False,absolute_error,42,sqrt,1,4,252,TPESampler,COMPLETE
4222,0.3270585790208769,2025-04-25 01:15:55.557379,2025-04-25 01:16:13.367506,0 days 00:00:17.810127,False,absolute_error,50,sqrt,1,4,455,TPESampler,COMPLETE
4223,0.3332494214918939,2025-04-25 01:15:57.606734,2025-04-25 01:16:15.839576,0 days 00:00:18.232842,False,absolute_error,43,sqrt,1,5,491,TPESampler,COMPLETE
4224,0.3331793736244023,2025-04-25 01:16:05.734671,2025-04-25 01:16:45.395984,0 days 00:00:39.661313,False,absolute_error,50,sqrt,1,3,898,TPESampler,COMPLETE
4225,0.479160823069434,2025-04-25 01:16:07.852494,2025-04-25 01:16:09.632641,0 days 00:00:01.780147,False,squared_error,19,sqrt,2,15,783,TPESampler,COMPLETE
4226,0.3480771417409707,2025-04-25 01:16:08.985212,2025-04-25 01:16:29.958474,0 days 00:00:20.973262,False,absolute_error,44,sqrt,1,2,538,TPESampler,COMPLETE
4227,0.35975433971198767,2025-04-25 01:16:09.910406,2025-04-25 01:16:25.658849,0 days 00:00:15.748443,False,absolute_error,35,sqrt,1,2,419,TPESampler,COMPLETE
4228,0.33141612887268207,2025-04-25 01:16:13.598377,2025-04-25 01:16:29.438952,0 days 00:00:15.840575,False,absolute_error,50,sqrt,1,3,404,TPESampler,COMPLETE
4229,0.44518993874519036,2025-04-25 01:16:16.082776,2025-04-25 01:16:21.693133,0 days 00:00:05.610357,False,absolute_error,22,sqrt,1,31,171,TPESampler,COMPLETE
4230,0.41764435849239046,2025-04-25 01:16:21.936790,2025-04-25 01:16:33.012149,0 days 00:00:11.075359,False,absolute_error,45,sqrt,2,3,429,TPESampler,COMPLETE
4231,0.33167967410158333,2025-04-25 01:16:25.892318,2025-04-25 01:16:57.412758,0 days 00:00:31.520440,False,absolute_error,44,sqrt,1,4,685,TPESampler,COMPLETE
4232,0.4237398475658545,2025-04-25 01:16:29.667486,2025-04-25 01:16:51.213083,0 days 00:00:21.545597,False,absolute_error,50,sqrt,2,8,571,TPESampler,COMPLETE
4233,0.32800564790973014,2025-04-25 01:16:30.197590,2025-04-25 01:16:53.198042,0 days 00:00:23.000452,False,absolute_error,50,sqrt,1,4,539,TPESampler,COMPLETE
4234,0.34168428749026614,2025-04-25 01:16:33.313350,2025-04-25 01:16:54.423580,0 days 00:00:21.110230,False,absolute_error,50,sqrt,1,8,495,TPESampler,COMPLETE
4235,0.42154656278218866,2025-04-25 01:16:45.633376,2025-04-25 01:17:03.679426,0 days 00:00:18.046050,False,absolute_error,50,sqrt,2,6,662,TPESampler,COMPLETE
4236,0.3308913435864914,2025-04-25 01:16:51.433717,2025-04-25 01:17:06.670741,0 days 00:00:15.237024,False,absolute_error,43,sqrt,1,5,397,TPESampler,COMPLETE
4237,0.3388982551633469,2025-04-25 01:16:53.432262,2025-04-25 01:17:02.517837,0 days 00:00:09.085575,False,absolute_error,50,sqrt,1,8,230,TPESampler,COMPLETE
4238,0.37385270539694293,2025-04-25 01:16:54.681083,2025-04-25 01:17:11.355407,0 days 00:00:16.674324,False,absolute_error,50,log2,1,2,505,TPESampler,COMPLETE
4239,0.46830178812093315,2025-04-25 01:16:57.642527,2025-04-25 01:18:07.146651,0 days 00:01:09.504124,False,absolute_error,25,,1,4,325,TPESampler,COMPLETE
4240,0.41772400264809006,2025-04-25 01:17:02.752777,2025-04-25 01:17:25.706124,0 days 00:00:22.953347,False,absolute_error,49,sqrt,2,2,887,TPESampler,COMPLETE
4241,0.4696799874145835,2025-04-25 01:17:03.906894,2025-04-25 01:20:27.722580,0 days 00:03:23.815686,False,absolute_error,42,,1,3,884,TPESampler,COMPLETE
4242,0.3496809436683332,2025-04-25 01:17:06.898988,2025-04-25 01:17:31.383632,0 days 00:00:24.484644,False,absolute_error,43,sqrt,1,8,679,TPESampler,COMPLETE
4243,0.3332929997103141,2025-04-25 01:17:10.432806,2025-04-25 01:17:28.559175,0 days 00:00:18.126369,False,absolute_error,43,sqrt,1,4,463,TPESampler,COMPLETE
4244,0.350013334839668,2025-04-25 01:17:11.661085,2025-04-25 01:17:42.543157,0 days 00:00:30.882072,False,absolute_error,43,sqrt,1,8,852,TPESampler,COMPLETE
4245,0.413080906301921,2025-04-25 01:17:25.945695,2025-04-25 01:18:51.197300,0 days 00:01:25.251605,False,absolute_error,46,,2,2,620,TPESampler,COMPLETE
4246,0.3804714282954158,2025-04-25 01:17:28.793478,2025-04-25 01:17:49.648904,0 days 00:00:20.855426,False,absolute_error,35,sqrt,1,13,602,TPESampler,COMPLETE
4247,0.4197683830207382,2025-04-25 01:17:31.621940,2025-04-25 01:17:41.179970,0 days 00:00:09.558030,False,absolute_error,43,sqrt,2,5,374,TPESampler,COMPLETE
4248,0.3464290763615618,2025-04-25 01:17:41.406451,2025-04-25 01:17:52.500024,0 days 00:00:11.093573,False,absolute_error,50,sqrt,1,2,269,TPESampler,COMPLETE
4249,0.7174008516837992,2025-04-25 01:17:42.782400,2025-04-25 01:17:44.106496,0 days 00:00:01.324096,False,squared_error,21,sqrt,10,3,472,TPESampler,COMPLETE
4250,0.3648364406078829,2025-04-25 01:17:44.487192,2025-04-25 01:18:10.226783,0 days 00:00:25.739591,False,absolute_error,43,sqrt,1,13,685,TPESampler,COMPLETE
4251,0.5981434736333113,2025-04-25 01:17:49.928591,2025-04-25 01:17:52.265584,0 days 00:00:02.336993,False,absolute_error,33,sqrt,6,5,129,TPESampler,COMPLETE
4252,0.34088397621253563,2025-04-25 01:17:52.601844,2025-04-25 01:18:15.460377,0 days 00:00:22.858533,False,absolute_error,50,sqrt,1,8,601,TPESampler,COMPLETE
4253,0.33133266238032066,2025-04-25 01:17:52.924451,2025-04-25 01:18:16.185987,0 days 00:00:23.261536,False,absolute_error,43,sqrt,1,4,625,TPESampler,COMPLETE
4254,0.3317780869314339,2025-04-25 01:18:07.381127,2025-04-25 01:18:31.424091,0 days 00:00:24.042964,False,absolute_error,50,sqrt,1,3,619,TPESampler,COMPLETE
4255,0.8103730670487477,2025-04-25 01:18:10.462612,2025-04-25 01:18:11.885958,0 days 00:00:01.423346,False,absolute_error,50,log2,5,14,203,TPESampler,COMPLETE
4256,0.35668779930884104,2025-04-25 01:18:12.140378,2025-04-25 01:18:18.759508,0 days 00:00:06.619130,True,absolute_error,50,sqrt,1,5,279,TPESampler,COMPLETE
4257,0.32625754426827697,2025-04-25 01:18:15.701002,2025-04-25 01:18:39.330059,0 days 00:00:23.629057,False,absolute_error,50,sqrt,1,5,534,TPESampler,COMPLETE
4258,0.4182882621045428,2025-04-25 01:18:16.475773,2025-04-25 01:18:31.711837,0 days 00:00:15.236064,False,absolute_error,43,sqrt,2,3,616,TPESampler,COMPLETE
4259,0.421955206946061,2025-04-25 01:18:19.003627,2025-04-25 01:18:37.737202,0 days 00:00:18.733575,False,absolute_error,41,sqrt,2,5,635,TPESampler,COMPLETE
4260,0.7012853728444794,2025-04-25 01:18:31.670843,2025-04-25 01:18:33.922789,0 days 00:00:02.251946,True,squared_error,5,sqrt,1,30,934,TPESampler,COMPLETE
4261,0.41342330903024604,2025-04-25 01:18:32.057144,2025-04-25 01:18:40.694919,0 days 00:00:08.637775,False,absolute_error,50,sqrt,2,3,300,TPESampler,COMPLETE
4262,0.3335953788490822,2025-04-25 01:18:34.269348,2025-04-25 01:19:06.176681,0 days 00:00:31.907333,False,absolute_error,50,sqrt,1,3,835,TPESampler,COMPLETE
4263,0.32647922794805534,2025-04-25 01:18:37.975666,2025-04-25 01:19:03.592643,0 days 00:00:25.616977,False,absolute_error,50,sqrt,1,4,627,TPESampler,COMPLETE
4264,0.34017767441157837,2025-04-25 01:18:39.578014,2025-04-25 01:18:53.254559,0 days 00:00:13.676545,False,absolute_error,43,sqrt,1,6,362,TPESampler,COMPLETE
4265,0.4208625065423173,2025-04-25 01:18:40.927029,2025-04-25 01:18:54.207156,0 days 00:00:13.280127,False,absolute_error,50,sqrt,2,6,536,TPESampler,COMPLETE
4266,0.3620510538443248,2025-04-25 01:18:51.442549,2025-04-25 01:19:09.949299,0 days 00:00:18.506750,True,absolute_error,50,sqrt,1,6,643,TPESampler,COMPLETE
4267,0.3395759479650742,2025-04-25 01:18:53.503848,2025-04-25 01:19:19.911083,0 days 00:00:26.407235,False,absolute_error,44,sqrt,1,6,623,TPESampler,COMPLETE
