number,value,datetime_start,datetime_complete,duration,params_bootstrap,params_criterion,params_max_depth,params_max_features,params_min_samples_leaf,params_min_samples_split,params_n_estimators,system_attrs_auto:sampler,state
416,0.32639369724005357,2025-04-24 21:43:44.540090,2025-04-24 21:44:09.695339,0 days 00:00:25.155249,False,absolute_error,50,sqrt,1,4,623,TPESampler,COMPLETE
417,0.332117204051707,2025-04-24 21:43:49.748548,2025-04-24 21:44:17.154631,0 days 00:00:27.406083,False,absolute_error,50,sqrt,1,6,743,TPESampler,COMPLETE
418,0.4529411852843046,2025-04-24 21:43:56.003016,2025-04-24 21:43:58.685972,0 days 00:00:02.682956,False,squared_error,40,,6,6,412,TPESampler,COMPLETE
419,0.3265076647383269,2025-04-24 21:43:58.887217,2025-04-24 21:44:30.618180,0 days 00:00:31.730963,False,absolute_error,50,sqrt,1,4,725,TPESampler,COMPLETE
420,0.43695902518500757,2025-04-24 21:44:04.443510,2025-04-24 21:44:29.662307,0 days 00:00:25.218797,False,absolute_error,48,log2,1,24,906,TPESampler,COMPLETE
421,0.338532553739797,2025-04-24 21:44:07.570415,2025-04-24 21:44:36.481337,0 days 00:00:28.910922,False,absolute_error,40,sqrt,1,3,754,TPESampler,COMPLETE
422,0.861872120667007,2025-04-24 21:44:09.857242,2025-04-24 21:44:10.757284,0 days 00:00:00.900042,False,squared_error,19,log2,13,27,166,TPESampler,COMPLETE
423,0.41992463285133286,2025-04-24 21:44:10.955231,2025-04-24 21:44:23.812616,0 days 00:00:12.857385,False,absolute_error,47,sqrt,2,6,480,TPESampler,COMPLETE
424,0.4681534175780606,2025-04-24 21:44:11.505736,2025-04-24 21:46:51.778629,0 days 00:02:40.272893,False,absolute_error,46,,1,2,686,TPESampler,COMPLETE
425,0.6986120745940388,2025-04-24 21:44:17.326275,2025-04-24 21:44:21.863454,0 days 00:00:04.537179,True,absolute_error,10,log2,1,14,628,TPESampler,COMPLETE
426,0.33203150266186077,2025-04-24 21:44:22.036070,2025-04-24 21:44:52.354772,0 days 00:00:30.318702,False,absolute_error,50,sqrt,1,6,760,TPESampler,COMPLETE
427,0.42775134950135857,2025-04-24 21:44:23.999359,2025-04-24 21:44:42.779397,0 days 00:00:18.780038,False,absolute_error,50,sqrt,2,12,740,TPESampler,COMPLETE
428,0.4210299355248903,2025-04-24 21:44:29.828999,2025-04-24 21:44:48.137007,0 days 00:00:18.308008,False,absolute_error,50,sqrt,2,5,745,TPESampler,COMPLETE
429,0.3266259285262382,2025-04-24 21:44:30.789683,2025-04-24 21:44:58.429010,0 days 00:00:27.639327,False,absolute_error,50,sqrt,1,4,737,TPESampler,COMPLETE
430,0.5450268637781512,2025-04-24 21:44:36.650472,2025-04-24 21:44:39.988270,0 days 00:00:03.337798,True,absolute_error,21,log2,1,5,271,TPESampler,COMPLETE
431,0.33245271247825237,2025-04-24 21:44:40.152873,2025-04-24 21:45:04.777890,0 days 00:00:24.625017,False,absolute_error,42,sqrt,1,5,650,TPESampler,COMPLETE
432,0.4006122666468185,2025-04-24 21:44:42.965115,2025-04-24 21:44:51.062274,0 days 00:00:08.097159,False,squared_error,48,,1,3,766,TPESampler,COMPLETE
433,0.7826400882582968,2025-04-24 21:44:48.305910,2025-04-24 21:44:49.145447,0 days 00:00:00.839537,True,absolute_error,35,log2,3,12,110,TPESampler,COMPLETE
434,0.36271988607160055,2025-04-24 21:44:49.319124,2025-04-24 21:45:15.257226,0 days 00:00:25.938102,False,absolute_error,39,sqrt,1,10,728,TPESampler,COMPLETE
435,0.4207116145867488,2025-04-24 21:44:51.283835,2025-04-24 21:45:08.681789,0 days 00:00:17.397954,False,absolute_error,40,sqrt,2,3,706,TPESampler,COMPLETE
436,0.41942041229005295,2025-04-24 21:44:52.532994,2025-04-24 21:44:55.184304,0 days 00:00:02.651310,True,squared_error,43,,4,8,504,TPESampler,COMPLETE
437,0.33980456160060185,2025-04-24 21:44:55.362930,2025-04-24 21:45:20.884050,0 days 00:00:25.521120,False,absolute_error,41,sqrt,1,3,688,TPESampler,COMPLETE
438,0.33182441062380463,2025-04-24 21:44:58.620807,2025-04-24 21:45:27.080580,0 days 00:00:28.459773,False,absolute_error,43,sqrt,1,4,780,TPESampler,COMPLETE
439,0.6949143762842998,2025-04-24 21:45:04.951231,2025-04-24 21:45:06.317576,0 days 00:00:01.366345,False,squared_error,9,log2,1,6,919,TPESampler,COMPLETE
440,0.8620154520224369,2025-04-24 21:45:06.507895,2025-04-24 21:45:07.981175,0 days 00:00:01.473280,True,squared_error,5,log2,8,2,907,TPESampler,COMPLETE
441,0.32510710754935107,2025-04-24 21:45:08.150894,2025-04-24 21:45:50.629768,0 days 00:00:42.478874,False,absolute_error,50,sqrt,1,5,813,TPESampler,COMPLETE
442,0.44167334597838614,2025-04-24 21:45:08.872831,2025-04-24 21:48:05.254446,0 days 00:02:56.381615,False,absolute_error,48,,1,8,754,TPESampler,COMPLETE
443,0.34475002395085513,2025-04-24 21:45:15.421083,2025-04-24 21:45:53.060630,0 days 00:00:37.639547,False,absolute_error,50,sqrt,1,2,685,TPESampler,COMPLETE
444,0.3438459057202985,2025-04-24 21:45:21.057501,2025-04-24 21:45:50.961518,0 days 00:00:29.904017,False,absolute_error,41,sqrt,1,6,841,TPESampler,COMPLETE
445,0.32508274322851927,2025-04-24 21:45:27.255472,2025-04-24 21:45:55.781907,0 days 00:00:28.526435,False,absolute_error,49,sqrt,1,4,766,TPESampler,COMPLETE
446,0.42804729135359376,2025-04-24 21:45:50.828545,2025-04-24 21:46:13.528356,0 days 00:00:22.699811,False,absolute_error,43,sqrt,2,10,889,TPESampler,COMPLETE
447,0.3318909479859146,2025-04-24 21:45:51.161217,2025-04-24 21:46:17.576636,0 days 00:00:26.415419,False,absolute_error,45,sqrt,1,5,677,TPESampler,COMPLETE
448,0.32671009850206123,2025-04-24 21:45:53.233026,2025-04-24 21:46:22.052587,0 days 00:00:28.819561,False,absolute_error,50,sqrt,1,4,705,TPESampler,COMPLETE
449,0.32796921071096996,2025-04-24 21:45:55.971952,2025-04-24 21:46:18.017193,0 days 00:00:22.045241,False,absolute_error,47,sqrt,1,4,591,TPESampler,COMPLETE
450,0.7789891433059526,2025-04-24 21:46:13.726939,2025-04-24 21:46:15.144931,0 days 00:00:01.417992,True,squared_error,20,log2,3,44,783,TPESampler,COMPLETE
451,0.32784829013642997,2025-04-24 21:46:15.402775,2025-04-24 21:46:43.117957,0 days 00:00:27.715182,False,absolute_error,48,sqrt,1,4,742,TPESampler,COMPLETE
452,0.47529017919584554,2025-04-24 21:46:17.749823,2025-04-24 21:46:37.275432,0 days 00:00:19.525609,True,absolute_error,6,,2,24,357,TPESampler,COMPLETE
453,0.32562338863768076,2025-04-24 21:46:18.280690,2025-04-24 21:46:48.999464,0 days 00:00:30.718774,False,absolute_error,50,sqrt,1,5,723,TPESampler,COMPLETE
454,0.8393342694490046,2025-04-24 21:46:22.220060,2025-04-24 21:46:23.141201,0 days 00:00:00.921141,True,squared_error,7,log2,5,2,232,TPESampler,COMPLETE
455,0.3355022754079036,2025-04-24 21:46:23.316030,2025-04-24 21:46:53.004633,0 days 00:00:29.688603,False,absolute_error,48,sqrt,1,3,770,TPESampler,COMPLETE
456,0.41794769850490865,2025-04-24 21:46:37.529293,2025-04-24 21:47:01.005773,0 days 00:00:23.476480,False,absolute_error,50,sqrt,2,3,881,TPESampler,COMPLETE
457,0.32634386013832645,2025-04-24 21:46:43.287643,2025-04-24 21:47:14.173304,0 days 00:00:30.885661,False,absolute_error,50,sqrt,1,4,769,TPESampler,COMPLETE
458,0.5790609126544405,2025-04-24 21:46:49.171213,2025-04-24 21:46:59.169786,0 days 00:00:09.998573,True,absolute_error,10,sqrt,1,6,728,TPESampler,COMPLETE
459,0.3333451217806762,2025-04-24 21:46:51.957004,2025-04-24 21:47:21.913478,0 days 00:00:29.956474,False,absolute_error,43,sqrt,1,5,780,TPESampler,COMPLETE
460,0.4399113011745593,2025-04-24 21:46:53.208916,2025-04-24 21:46:55.227398,0 days 00:00:02.018482,True,squared_error,8,,2,2,421,TPESampler,COMPLETE
461,0.3429041622946249,2025-04-24 21:46:55.397044,2025-04-24 21:46:57.963940,0 days 00:00:02.566896,False,squared_error,40,sqrt,1,3,693,TPESampler,COMPLETE
462,0.42379179704717634,2025-04-24 21:46:58.146984,2025-04-24 21:47:19.940272,0 days 00:00:21.793288,False,absolute_error,50,sqrt,2,7,795,TPESampler,COMPLETE
463,0.34588050796434977,2025-04-24 21:46:59.339989,2025-04-24 21:47:01.710897,0 days 00:00:02.370908,False,squared_error,47,sqrt,1,8,816,TPESampler,COMPLETE
464,0.379645202649506,2025-04-24 21:47:01.178218,2025-04-24 21:47:18.821693,0 days 00:00:17.643475,True,absolute_error,49,sqrt,1,11,740,TPESampler,COMPLETE
465,0.4176473075718478,2025-04-24 21:47:01.888570,2025-04-24 21:47:18.166922,0 days 00:00:16.278352,False,absolute_error,49,sqrt,2,3,667,TPESampler,COMPLETE
466,0.32525325105659747,2025-04-24 21:47:14.392694,2025-04-24 21:47:47.639515,0 days 00:00:33.246821,False,absolute_error,50,sqrt,1,5,824,TPESampler,COMPLETE
467,0.3316319516957022,2025-04-24 21:47:18.348045,2025-04-24 21:47:42.571114,0 days 00:00:24.223069,False,absolute_error,50,sqrt,1,6,648,TPESampler,COMPLETE
468,0.4251321886546734,2025-04-24 21:47:19.053003,2025-04-24 21:47:39.595743,0 days 00:00:20.542740,False,absolute_error,39,sqrt,2,6,854,TPESampler,COMPLETE
469,0.34754153055485393,2025-04-24 21:47:20.138946,2025-04-24 21:47:51.104982,0 days 00:00:30.966036,False,absolute_error,42,sqrt,1,2,814,TPESampler,COMPLETE
470,0.3253103530219229,2025-04-24 21:47:22.076857,2025-04-24 21:47:50.228414,0 days 00:00:28.151557,False,absolute_error,50,sqrt,1,5,756,TPESampler,COMPLETE
471,0.33717078538201883,2025-04-24 21:47:39.774722,2025-04-24 21:48:13.818086,0 days 00:00:34.043364,False,absolute_error,41,sqrt,1,5,888,TPESampler,COMPLETE
472,0.3688335743153628,2025-04-24 21:47:42.755905,2025-04-24 21:47:59.598809,0 days 00:00:16.842904,True,absolute_error,42,sqrt,1,6,821,TPESampler,COMPLETE
473,0.33315001377027487,2025-04-24 21:47:48.066570,2025-04-24 21:48:20.928285,0 days 00:00:32.861715,False,absolute_error,50,sqrt,1,3,800,TPESampler,COMPLETE
474,0.3333525407035046,2025-04-24 21:47:50.601262,2025-04-24 21:48:15.790748,0 days 00:00:25.189486,False,absolute_error,49,sqrt,1,6,624,TPESampler,COMPLETE
475,0.3356445844310856,2025-04-24 21:47:51.946462,2025-04-24 21:48:16.236261,0 days 00:00:24.289799,False,absolute_error,45,sqrt,1,3,579,TPESampler,COMPLETE
476,0.375565369563396,2025-04-24 21:47:59.772878,2025-04-24 21:48:21.278924,0 days 00:00:21.506046,False,absolute_error,45,log2,1,3,724,TPESampler,COMPLETE
477,0.3362219678032653,2025-04-24 21:48:05.443663,2025-04-24 21:48:33.789131,0 days 00:00:28.345468,False,absolute_error,50,sqrt,1,7,735,TPESampler,COMPLETE
478,0.41797100656703373,2025-04-24 21:48:14.003746,2025-04-24 21:48:31.545478,0 days 00:00:17.541732,False,absolute_error,50,sqrt,2,3,707,TPESampler,COMPLETE
479,0.3318968353798163,2025-04-24 21:48:15.965542,2025-04-24 21:48:43.950855,0 days 00:00:27.985313,False,absolute_error,44,sqrt,1,4,760,TPESampler,COMPLETE
480,0.3321646380662596,2025-04-24 21:48:16.478774,2025-04-24 21:48:44.745312,0 days 00:00:28.266538,False,absolute_error,50,sqrt,1,3,660,TPESampler,COMPLETE
481,0.345411256954871,2025-04-24 21:48:21.095305,2025-04-24 21:48:49.649147,0 days 00:00:28.553842,False,absolute_error,41,sqrt,1,7,703,TPESampler,COMPLETE
482,0.3612238510945847,2025-04-24 21:48:21.462277,2025-04-24 21:48:23.525458,0 days 00:00:02.063181,True,squared_error,41,sqrt,1,4,656,TPESampler,COMPLETE
483,0.337862219486128,2025-04-24 21:48:23.689969,2025-04-24 21:48:54.205578,0 days 00:00:30.515609,False,absolute_error,48,sqrt,1,7,781,TPESampler,COMPLETE
484,0.7637726891819829,2025-04-24 21:48:31.735423,2025-04-24 21:48:33.393753,0 days 00:00:01.658330,False,absolute_error,7,sqrt,13,16,343,TPESampler,COMPLETE
485,0.32505665079074886,2025-04-24 21:48:33.569778,2025-04-24 21:48:59.195894,0 days 00:00:25.626116,False,absolute_error,49,sqrt,1,4,645,TPESampler,COMPLETE
486,0.42403980220802046,2025-04-24 21:48:33.988756,2025-04-24 21:48:52.883838,0 days 00:00:18.895082,False,absolute_error,50,sqrt,2,7,779,TPESampler,COMPLETE
487,0.33392151910194884,2025-04-24 21:48:44.117693,2025-04-24 21:49:10.259474,0 days 00:00:26.141781,False,absolute_error,49,sqrt,1,6,703,TPESampler,COMPLETE
488,0.7049933890950484,2025-04-24 21:48:44.922325,2025-04-24 21:48:48.124459,0 days 00:00:03.202134,False,absolute_error,24,log2,3,6,371,TPESampler,COMPLETE
489,0.32646449998948907,2025-04-24 21:48:48.308131,2025-04-24 21:49:18.664446,0 days 00:00:30.356315,False,absolute_error,50,sqrt,1,4,742,TPESampler,COMPLETE
490,0.3349756485083835,2025-04-24 21:48:49.815560,2025-04-24 21:49:22.233467,0 days 00:00:32.417907,False,absolute_error,41,sqrt,1,4,848,TPESampler,COMPLETE
491,0.3317642418979972,2025-04-24 21:48:53.057413,2025-04-24 21:49:12.345362,0 days 00:00:19.287949,False,absolute_error,50,sqrt,1,3,498,TPESampler,COMPLETE
492,0.4471400688430001,2025-04-24 21:48:54.373936,2025-04-24 21:49:53.740185,0 days 00:00:59.366249,False,absolute_error,50,,1,5,257,TPESampler,COMPLETE
493,0.4194835955047073,2025-04-24 21:48:59.377430,2025-04-24 21:49:13.738712,0 days 00:00:14.361282,False,absolute_error,40,sqrt,2,4,592,TPESampler,COMPLETE
494,0.3326879411060415,2025-04-24 21:49:10.425334,2025-04-24 21:49:36.519346,0 days 00:00:26.094012,False,absolute_error,50,sqrt,1,3,681,TPESampler,COMPLETE
495,0.3411455912485003,2025-04-24 21:49:12.653988,2025-04-24 21:49:32.837116,0 days 00:00:20.183128,False,absolute_error,43,sqrt,1,6,549,TPESampler,COMPLETE
496,0.618172778009115,2025-04-24 21:49:13.914379,2025-04-24 21:49:23.506992,0 days 00:00:09.592613,False,absolute_error,46,log2,2,5,780,TPESampler,COMPLETE
497,0.32793934688347914,2025-04-24 21:49:18.889485,2025-04-24 21:49:40.863807,0 days 00:00:21.974322,False,absolute_error,49,sqrt,1,5,588,TPESampler,COMPLETE
498,0.3318486256826329,2025-04-24 21:49:22.413329,2025-04-24 21:49:45.498910,0 days 00:00:23.085581,False,absolute_error,50,sqrt,1,3,601,TPESampler,COMPLETE
499,0.32641516945986165,2025-04-24 21:49:23.670434,2025-04-24 21:49:51.699775,0 days 00:00:28.029341,False,absolute_error,50,sqrt,1,4,749,TPESampler,COMPLETE
500,0.4194944068861692,2025-04-24 21:49:33.003184,2025-04-24 21:49:52.784358,0 days 00:00:19.781174,False,absolute_error,41,sqrt,2,3,815,TPESampler,COMPLETE
501,0.34505731451167676,2025-04-24 21:49:36.738810,2025-04-24 21:50:03.859589,0 days 00:00:27.120779,False,absolute_error,41,sqrt,1,7,757,TPESampler,COMPLETE
502,0.488850873108653,2025-04-24 21:49:41.048176,2025-04-24 21:49:43.561073,0 days 00:00:02.512897,True,squared_error,5,,2,25,761,TPESampler,COMPLETE
503,0.8579011479400483,2025-04-24 21:49:43.745115,2025-04-24 21:49:46.041794,0 days 00:00:02.296679,False,absolute_error,39,log2,11,10,850,TPESampler,COMPLETE
504,0.41841800965470094,2025-04-24 21:49:45.693167,2025-04-24 21:50:08.018315,0 days 00:00:22.325148,False,absolute_error,44,sqrt,2,4,790,TPESampler,COMPLETE
505,0.3331815230953713,2025-04-24 21:49:46.363972,2025-04-24 21:50:11.915010,0 days 00:00:25.551038,False,absolute_error,42,sqrt,1,4,650,TPESampler,COMPLETE
506,0.34924754337953395,2025-04-24 21:49:51.891613,2025-04-24 21:50:06.630403,0 days 00:00:14.738790,True,absolute_error,50,sqrt,1,3,651,TPESampler,COMPLETE
507,0.41441668344780097,2025-04-24 21:49:52.958640,2025-04-24 21:50:05.551075,0 days 00:00:12.592435,True,absolute_error,42,log2,1,4,814,TPESampler,COMPLETE
508,0.4211258477838512,2025-04-24 21:49:53.916172,2025-04-24 21:50:12.442383,0 days 00:00:18.526211,False,absolute_error,50,sqrt,2,5,754,TPESampler,COMPLETE
509,0.3330700816123796,2025-04-24 21:50:04.203958,2025-04-24 21:50:33.475613,0 days 00:00:29.271655,False,absolute_error,50,sqrt,1,3,764,TPESampler,COMPLETE
510,0.36179633119568705,2025-04-24 21:50:05.852523,2025-04-24 21:50:36.993568,0 days 00:00:31.141045,False,absolute_error,50,sqrt,1,15,854,TPESampler,COMPLETE
511,0.3254650245486932,2025-04-24 21:50:06.815213,2025-04-24 21:50:34.579796,0 days 00:00:27.764583,False,absolute_error,50,sqrt,1,5,746,TPESampler,COMPLETE
512,0.4503516449725038,2025-04-24 21:50:08.194616,2025-04-24 21:53:36.868509,0 days 00:03:28.673893,False,absolute_error,44,,1,4,831,TPESampler,COMPLETE
513,0.8504433283996573,2025-04-24 21:50:12.272133,2025-04-24 21:50:13.742667,0 days 00:00:01.470534,True,squared_error,47,log2,6,4,875,TPESampler,COMPLETE
514,0.447631161603179,2025-04-24 21:50:12.675017,2025-04-24 21:52:33.116221,0 days 00:02:20.441204,False,absolute_error,45,,1,5,596,TPESampler,COMPLETE
515,0.41612216347717657,2025-04-24 21:50:13.923731,2025-04-24 21:50:25.511956,0 days 00:00:11.588225,False,absolute_error,50,sqrt,2,3,465,TPESampler,COMPLETE
516,0.36746964670630505,2025-04-24 21:50:25.691947,2025-04-24 21:51:34.602682,0 days 00:01:08.910735,True,absolute_error,27,,2,2,604,TPESampler,COMPLETE
517,0.8534779120070177,2025-04-24 21:50:33.652591,2025-04-24 21:50:34.906342,0 days 00:00:01.253751,False,squared_error,27,log2,9,4,813,TPESampler,COMPLETE
518,0.4197211491245988,2025-04-24 21:50:34.811417,2025-04-24 21:50:51.896809,0 days 00:00:17.085392,False,absolute_error,48,sqrt,2,5,553,TPESampler,COMPLETE
519,0.37474196729319015,2025-04-24 21:50:35.118140,2025-04-24 21:50:44.116206,0 days 00:00:08.998066,False,absolute_error,47,log2,1,4,309,TPESampler,COMPLETE
520,0.4332261027599685,2025-04-24 21:50:37.160254,2025-04-24 21:50:38.837362,0 days 00:00:01.677108,True,squared_error,35,log2,1,4,582,TPESampler,COMPLETE
521,0.3433373617036292,2025-04-24 21:50:39.011148,2025-04-24 21:51:02.648663,0 days 00:00:23.637515,False,absolute_error,50,sqrt,1,9,642,TPESampler,COMPLETE
522,0.36782156025166257,2025-04-24 21:50:44.314745,2025-04-24 21:50:46.727151,0 days 00:00:02.412406,False,squared_error,50,log2,1,3,689,TPESampler,COMPLETE
523,0.32550840893247335,2025-04-24 21:50:46.934433,2025-04-24 21:51:13.489472,0 days 00:00:26.555039,False,absolute_error,50,sqrt,1,5,698,TPESampler,COMPLETE
524,0.33942748714115384,2025-04-24 21:50:52.074813,2025-04-24 21:51:31.087950,0 days 00:00:39.013137,False,absolute_error,42,sqrt,1,3,617,TPESampler,COMPLETE
525,0.3360540630071632,2025-04-24 21:51:02.826543,2025-04-24 21:51:32.262365,0 days 00:00:29.435822,False,absolute_error,50,sqrt,1,7,750,TPESampler,COMPLETE
526,0.3266744776143705,2025-04-24 21:51:13.657095,2025-04-24 21:51:42.920596,0 days 00:00:29.263501,False,absolute_error,50,sqrt,1,4,785,TPESampler,COMPLETE
527,0.33167967410158333,2025-04-24 21:51:31.265465,2025-04-24 21:51:57.083764,0 days 00:00:25.818299,False,absolute_error,44,sqrt,1,4,685,TPESampler,COMPLETE
528,0.32694196419849497,2025-04-24 21:51:32.434955,2025-04-24 21:51:59.007093,0 days 00:00:26.572138,False,absolute_error,50,sqrt,1,4,689,TPESampler,COMPLETE
529,0.33698355328868107,2025-04-24 21:51:34.790569,2025-04-24 21:52:05.112560,0 days 00:00:30.321991,False,absolute_error,44,sqrt,1,3,804,TPESampler,COMPLETE
530,0.3265966076726091,2025-04-24 21:51:43.107232,2025-04-24 21:52:13.480992,0 days 00:00:30.373760,False,absolute_error,50,sqrt,1,4,794,TPESampler,COMPLETE
531,0.34130981763304485,2025-04-24 21:51:57.260102,2025-04-24 21:52:23.169417,0 days 00:00:25.909315,False,absolute_error,50,sqrt,1,8,686,TPESampler,COMPLETE
532,0.32693210537738476,2025-04-24 21:51:59.182253,2025-04-24 21:52:31.979334,0 days 00:00:32.797081,False,absolute_error,50,sqrt,1,4,830,TPESampler,COMPLETE
533,0.3325436619458813,2025-04-24 21:52:05.285336,2025-04-24 21:52:35.391453,0 days 00:00:30.106117,False,absolute_error,50,sqrt,1,6,821,TPESampler,COMPLETE
534,0.8222528257675678,2025-04-24 21:52:13.741901,2025-04-24 21:52:15.991119,0 days 00:00:02.249218,False,absolute_error,9,log2,6,27,555,TPESampler,COMPLETE
535,0.3251514041077392,2025-04-24 21:52:16.160478,2025-04-24 21:52:40.140303,0 days 00:00:23.979825,False,absolute_error,50,sqrt,1,5,643,TPESampler,COMPLETE
536,0.3403106182608999,2025-04-24 21:52:23.363523,2025-04-24 21:52:44.793955,0 days 00:00:21.430432,False,absolute_error,43,sqrt,1,6,590,TPESampler,COMPLETE
537,0.3630184392527294,2025-04-24 21:52:32.218955,2025-04-24 21:52:54.878058,0 days 00:00:22.659103,True,absolute_error,49,sqrt,1,6,857,TPESampler,COMPLETE
538,0.3372525912692333,2025-04-24 21:52:33.291796,2025-04-24 21:53:05.345012,0 days 00:00:32.053216,False,absolute_error,41,sqrt,1,5,735,TPESampler,COMPLETE
539,0.7361576187715425,2025-04-24 21:52:35.567705,2025-04-24 21:52:37.580266,0 days 00:00:02.012561,False,absolute_error,30,sqrt,11,2,370,TPESampler,COMPLETE
540,0.4502587110321071,2025-04-24 21:52:37.765873,2025-04-24 21:55:19.648517,0 days 00:02:41.882644,False,absolute_error,11,,1,5,908,TPESampler,COMPLETE
541,0.4876229508294202,2025-04-24 21:52:40.320872,2025-04-24 21:52:43.730530,0 days 00:00:03.409658,True,squared_error,15,,9,2,872,TPESampler,COMPLETE
542,0.32565038683969266,2025-04-24 21:52:44.356788,2025-04-24 21:53:04.221003,0 days 00:00:19.864215,False,absolute_error,50,sqrt,1,5,444,TPESampler,COMPLETE
543,0.42247321511002517,2025-04-24 21:52:45.250851,2025-04-24 21:52:59.283185,0 days 00:00:14.032334,False,absolute_error,50,sqrt,2,7,540,TPESampler,COMPLETE
544,0.500217521957959,2025-04-24 21:52:55.080076,2025-04-24 21:55:17.347433,0 days 00:02:22.267357,False,absolute_error,20,,1,42,728,TPESampler,COMPLETE
545,0.32494058290546973,2025-04-24 21:52:59.464652,2025-04-24 21:53:21.834458,0 days 00:00:22.369806,False,absolute_error,49,sqrt,1,4,600,TPESampler,COMPLETE
546,0.8200304052189074,2025-04-24 21:53:04.395049,2025-04-24 21:53:05.693087,0 days 00:00:01.298038,False,absolute_error,47,log2,6,2,267,TPESampler,COMPLETE
547,0.3318800572460057,2025-04-24 21:53:05.553944,2025-04-24 21:53:24.203072,0 days 00:00:18.649128,False,absolute_error,50,sqrt,1,6,493,TPESampler,COMPLETE
548,0.6953819707857457,2025-04-24 21:53:05.865135,2025-04-24 21:53:06.856757,0 days 00:00:00.991622,True,squared_error,50,log2,2,16,245,TPESampler,COMPLETE
549,0.33313826770011673,2025-04-24 21:53:07.032607,2025-04-24 21:53:09.529954,0 days 00:00:02.497347,False,squared_error,50,sqrt,1,5,773,TPESampler,COMPLETE
550,0.42440109811208876,2025-04-24 21:53:09.702573,2025-04-24 21:53:27.189958,0 days 00:00:17.487385,False,absolute_error,44,sqrt,2,7,718,TPESampler,COMPLETE
551,0.3841124090618787,2025-04-24 21:53:22.026687,2025-04-24 21:53:41.792803,0 days 00:00:19.766116,False,absolute_error,50,log2,1,7,702,TPESampler,COMPLETE
552,0.3308712500819356,2025-04-24 21:53:24.371178,2025-04-24 21:53:45.635884,0 days 00:00:21.264706,False,absolute_error,44,sqrt,1,4,573,TPESampler,COMPLETE
553,0.33110484873509216,2025-04-24 21:53:27.385294,2025-04-24 21:53:47.541529,0 days 00:00:20.156235,False,absolute_error,46,sqrt,1,4,539,TPESampler,COMPLETE
