number,value,datetime_start,datetime_complete,duration,params_bootstrap,params_criterion,params_max_depth,params_max_features,params_min_samples_leaf,params_min_samples_split,params_n_estimators,system_attrs_auto:sampler,state
1245,0.3306019752210525,2025-04-24 22:34:15.472479,2025-04-24 22:34:44.885762,0 days 00:00:29.413283,False,absolute_error,46,sqrt,1,5,546,TPESampler,COMPLETE
1246,0.339698997385212,2025-04-24 22:34:17.269501,2025-04-24 22:34:35.567324,0 days 00:00:18.297823,False,absolute_error,42,sqrt,1,3,484,TPESampler,COMPLETE
1247,0.33448326785896904,2025-04-24 22:34:18.661739,2025-04-24 22:34:35.902717,0 days 00:00:17.240978,False,absolute_error,49,sqrt,1,6,456,TPESampler,COMPLETE
1248,0.8745323168014972,2025-04-24 22:34:24.336677,2025-04-24 22:34:25.279827,0 days 00:00:00.943150,True,absolute_error,45,log2,14,3,249,TPESampler,COMPLETE
1249,0.4090319779265432,2025-04-24 22:34:25.485239,2025-04-24 22:34:29.704972,0 days 00:00:04.219733,False,absolute_error,49,sqrt,2,4,151,TPESampler,COMPLETE
1250,0.3319897114369145,2025-04-24 22:34:29.902353,2025-04-24 22:34:45.740548,0 days 00:00:15.838195,False,absolute_error,42,sqrt,1,5,427,TPESampler,COMPLETE
1251,0.32802940358366883,2025-04-24 22:34:35.775651,2025-04-24 22:34:56.117784,0 days 00:00:20.342133,False,absolute_error,50,sqrt,1,4,541,TPESampler,COMPLETE
1252,0.46666780786602197,2025-04-24 22:34:36.118606,2025-04-24 22:34:59.391933,0 days 00:00:23.273327,False,absolute_error,43,,6,2,379,TPESampler,COMPLETE
1253,0.3253808404612941,2025-04-24 22:34:45.069348,2025-04-24 22:35:06.149617,0 days 00:00:21.080269,False,absolute_error,50,sqrt,1,5,565,TPESampler,COMPLETE
1254,0.32796961854526097,2025-04-24 22:34:45.920100,2025-04-24 22:35:06.272053,0 days 00:00:20.351953,False,absolute_error,50,sqrt,1,4,536,TPESampler,COMPLETE
1255,0.4190805685402776,2025-04-24 22:34:46.760657,2025-04-24 22:35:02.124148,0 days 00:00:15.363491,False,absolute_error,42,sqrt,2,4,630,TPESampler,COMPLETE
1256,0.3321277017191879,2025-04-24 22:34:56.317433,2025-04-24 22:35:14.588423,0 days 00:00:18.270990,False,absolute_error,42,sqrt,1,5,495,TPESampler,COMPLETE
1257,0.47005334105204555,2025-04-24 22:34:59.577982,2025-04-24 22:35:07.665715,0 days 00:00:08.087733,True,absolute_error,33,log2,1,8,564,TPESampler,COMPLETE
1258,0.36352954739825566,2025-04-24 22:35:02.320897,2025-04-24 22:35:03.958909,0 days 00:00:01.638012,True,squared_error,45,sqrt,1,2,302,TPESampler,COMPLETE
1259,0.4102575741876025,2025-04-24 22:35:04.198485,2025-04-24 22:35:16.059636,0 days 00:00:11.861151,False,absolute_error,41,log2,1,7,436,TPESampler,COMPLETE
1260,0.33549536990105755,2025-04-24 22:35:06.341395,2025-04-24 22:35:29.448633,0 days 00:00:23.107238,False,absolute_error,40,sqrt,1,4,636,TPESampler,COMPLETE
1261,0.3317741705753644,2025-04-24 22:35:06.479143,2025-04-24 22:35:31.988696,0 days 00:00:25.509553,False,absolute_error,50,sqrt,1,3,603,TPESampler,COMPLETE
1262,0.3344702566910952,2025-04-24 22:35:07.860178,2025-04-24 22:35:32.626175,0 days 00:00:24.765997,False,absolute_error,46,sqrt,1,6,622,TPESampler,COMPLETE
1263,0.42050212773813767,2025-04-24 22:35:14.779032,2025-04-24 22:35:27.523862,0 days 00:00:12.744830,False,absolute_error,50,sqrt,2,6,517,TPESampler,COMPLETE
1264,0.33265809237285965,2025-04-24 22:35:16.320527,2025-04-24 22:35:18.446784,0 days 00:00:02.126257,False,squared_error,50,sqrt,1,4,554,TPESampler,COMPLETE
1265,0.8609569952525531,2025-04-24 22:35:18.627502,2025-04-24 22:35:19.341766,0 days 00:00:00.714264,False,squared_error,22,log2,12,2,126,TPESampler,COMPLETE
1266,0.34588811927089175,2025-04-24 22:35:19.520905,2025-04-24 22:35:39.153609,0 days 00:00:19.632704,False,absolute_error,50,sqrt,1,2,496,TPESampler,COMPLETE
1267,0.4367873128650489,2025-04-24 22:35:27.713653,2025-04-24 22:35:31.596788,0 days 00:00:03.883135,False,squared_error,40,,1,40,589,TPESampler,COMPLETE
1268,0.33480335547762896,2025-04-24 22:35:29.652240,2025-04-24 22:35:46.904521,0 days 00:00:17.252281,False,absolute_error,49,sqrt,1,3,447,TPESampler,COMPLETE
1269,0.34574025407093617,2025-04-24 22:35:31.778147,2025-04-24 22:35:55.876806,0 days 00:00:24.098659,False,absolute_error,49,sqrt,1,9,534,TPESampler,COMPLETE
1270,0.4217206484386094,2025-04-24 22:35:32.212160,2025-04-24 22:35:49.205523,0 days 00:00:16.993363,False,absolute_error,50,sqrt,2,6,691,TPESampler,COMPLETE
1271,0.3450450708216744,2025-04-24 22:35:32.838408,2025-04-24 22:36:00.308889,0 days 00:00:27.470481,False,absolute_error,41,sqrt,1,7,618,TPESampler,COMPLETE
1272,0.35661880986449057,2025-04-24 22:35:39.350956,2025-04-24 22:35:48.488930,0 days 00:00:09.137974,True,absolute_error,43,sqrt,1,4,422,TPESampler,COMPLETE
1273,0.34178966133075794,2025-04-24 22:35:47.101361,2025-04-24 22:36:02.743085,0 days 00:00:15.641724,False,absolute_error,50,sqrt,1,9,394,TPESampler,COMPLETE
1274,0.33262364373154363,2025-04-24 22:35:48.675796,2025-04-24 22:36:11.297390,0 days 00:00:22.621594,False,absolute_error,42,sqrt,1,4,592,TPESampler,COMPLETE
1275,0.3388504361449157,2025-04-24 22:35:49.423444,2025-04-24 22:36:13.703004,0 days 00:00:24.279560,False,absolute_error,43,sqrt,1,3,647,TPESampler,COMPLETE
1276,0.6192716386690369,2025-04-24 22:35:56.066598,2025-04-24 22:36:07.811488,0 days 00:00:11.744890,False,absolute_error,36,log2,2,4,927,TPESampler,COMPLETE
1277,0.5096423125522078,2025-04-24 22:36:00.501587,2025-04-24 22:36:37.802905,0 days 00:00:37.301318,False,absolute_error,14,,13,9,989,TPESampler,COMPLETE
1278,0.33098661158777254,2025-04-24 22:36:02.953977,2025-04-24 22:36:21.446608,0 days 00:00:18.492631,False,absolute_error,45,sqrt,1,4,492,TPESampler,COMPLETE
1279,0.3436256881018581,2025-04-24 22:36:08.005160,2025-04-24 22:36:32.511925,0 days 00:00:24.506765,False,absolute_error,41,sqrt,1,6,683,TPESampler,COMPLETE
1280,0.46795697260079705,2025-04-24 22:36:11.471495,2025-04-24 22:38:02.248899,0 days 00:01:50.777404,False,absolute_error,49,,1,2,478,TPESampler,COMPLETE
1281,0.4231449222075629,2025-04-24 22:36:13.884027,2025-04-24 22:36:32.915931,0 days 00:00:19.031904,False,absolute_error,42,sqrt,2,7,629,TPESampler,COMPLETE
1282,0.5256273959911467,2025-04-24 22:36:21.642945,2025-04-24 22:36:26.676423,0 days 00:00:05.033478,True,absolute_error,40,sqrt,3,13,545,TPESampler,COMPLETE
1283,0.3267153648163538,2025-04-24 22:36:26.863435,2025-04-24 22:36:43.945204,0 days 00:00:17.081769,False,absolute_error,50,sqrt,1,4,448,TPESampler,COMPLETE
1284,0.4174731965878143,2025-04-24 22:36:28.677728,2025-04-24 22:36:43.941330,0 days 00:00:15.263602,False,absolute_error,50,sqrt,2,4,622,TPESampler,COMPLETE
1285,0.3320858055802908,2025-04-24 22:36:32.708200,2025-04-24 22:36:58.793420,0 days 00:00:26.085220,False,absolute_error,50,sqrt,1,3,538,TPESampler,COMPLETE
1286,0.33335364787333543,2025-04-24 22:36:33.159023,2025-04-24 22:36:55.596429,0 days 00:00:22.437406,False,absolute_error,48,sqrt,1,6,582,TPESampler,COMPLETE
1287,0.32939272020257604,2025-04-24 22:36:37.999662,2025-04-24 22:37:08.465017,0 days 00:00:30.465355,False,absolute_error,46,sqrt,1,4,670,TPESampler,COMPLETE
1288,0.33787729254343385,2025-04-24 22:36:44.082145,2025-04-24 22:37:11.548152,0 days 00:00:27.466007,False,absolute_error,49,sqrt,1,7,661,TPESampler,COMPLETE
1289,0.39424893249583987,2025-04-24 22:36:44.132964,2025-04-24 22:36:48.840783,0 days 00:00:04.707819,False,squared_error,24,,2,5,532,TPESampler,COMPLETE
1290,0.4184635792657902,2025-04-24 22:36:49.030307,2025-04-24 22:37:03.079275,0 days 00:00:14.048968,False,absolute_error,39,sqrt,2,4,457,TPESampler,COMPLETE
1291,0.4396618505557025,2025-04-24 22:36:55.792002,2025-04-24 22:37:14.617981,0 days 00:00:18.825979,False,absolute_error,27,sqrt,2,4,785,TPESampler,COMPLETE
1292,0.4169075988301378,2025-04-24 22:36:58.983293,2025-04-24 22:37:13.538123,0 days 00:00:14.554830,False,absolute_error,50,sqrt,2,4,595,TPESampler,COMPLETE
1293,0.32726281300009524,2025-04-24 22:37:03.269075,2025-04-24 22:37:26.321481,0 days 00:00:23.052406,False,absolute_error,49,sqrt,1,5,620,TPESampler,COMPLETE
1294,0.3414892079870463,2025-04-24 22:37:08.657753,2025-04-24 22:37:28.397821,0 days 00:00:19.740068,False,absolute_error,43,sqrt,1,6,471,TPESampler,COMPLETE
1295,0.479442406395994,2025-04-24 22:37:11.796539,2025-04-24 22:37:12.851150,0 days 00:00:01.054611,False,squared_error,20,,9,41,103,TPESampler,COMPLETE
1296,0.337414598557265,2025-04-24 22:37:13.038322,2025-04-24 22:37:24.021666,0 days 00:00:10.983344,False,absolute_error,38,sqrt,1,4,299,TPESampler,COMPLETE
1297,0.4179384985710714,2025-04-24 22:37:13.749334,2025-04-24 22:37:35.789127,0 days 00:00:22.039793,False,absolute_error,50,sqrt,2,3,712,TPESampler,COMPLETE
1298,0.3317656945248468,2025-04-24 22:37:14.808482,2025-04-24 22:37:41.841142,0 days 00:00:27.032660,False,absolute_error,50,sqrt,1,3,604,TPESampler,COMPLETE
1299,0.325087897123112,2025-04-24 22:37:24.207178,2025-04-24 22:37:47.988688,0 days 00:00:23.781510,False,absolute_error,50,sqrt,1,5,638,TPESampler,COMPLETE
1300,0.4583504381854213,2025-04-24 22:37:26.504953,2025-04-24 22:39:19.185352,0 days 00:01:52.680399,False,absolute_error,35,,1,4,504,TPESampler,COMPLETE
1301,0.6713022376052791,2025-04-24 22:37:28.593842,2025-04-24 22:37:33.723553,0 days 00:00:05.129711,True,absolute_error,11,log2,1,4,509,TPESampler,COMPLETE
1302,0.46972705907595397,2025-04-24 22:37:33.927759,2025-04-24 22:40:17.471602,0 days 00:02:43.543843,False,absolute_error,43,,1,3,714,TPESampler,COMPLETE
1303,0.5275087102571575,2025-04-24 22:37:35.977891,2025-04-24 22:37:39.093736,0 days 00:00:03.115845,True,absolute_error,50,sqrt,3,20,308,TPESampler,COMPLETE
1304,0.326333057731915,2025-04-24 22:37:39.276775,2025-04-24 22:37:58.720183,0 days 00:00:19.443408,False,absolute_error,50,sqrt,1,5,519,TPESampler,COMPLETE
1305,0.5013302618882002,2025-04-24 22:37:42.050271,2025-04-24 22:37:45.537137,0 days 00:00:03.486866,True,squared_error,46,,10,24,874,TPESampler,COMPLETE
1306,0.38741622041423956,2025-04-24 22:37:45.902016,2025-04-24 22:38:02.364153,0 days 00:00:16.462137,False,absolute_error,49,log2,1,7,558,TPESampler,COMPLETE
1307,0.3450952388065995,2025-04-24 22:37:48.405605,2025-04-24 22:38:14.172298,0 days 00:00:25.766693,False,absolute_error,50,sqrt,1,10,695,TPESampler,COMPLETE
1308,0.3265437362025347,2025-04-24 22:37:58.912560,2025-04-24 22:38:26.003615,0 days 00:00:27.091055,False,absolute_error,50,sqrt,1,4,728,TPESampler,COMPLETE
1309,0.3483048455009437,2025-04-24 22:38:02.439234,2025-04-24 22:38:04.398309,0 days 00:00:01.959075,False,squared_error,39,sqrt,1,6,599,TPESampler,COMPLETE
1310,0.3389725749076297,2025-04-24 22:38:02.573610,2025-04-24 22:38:27.911969,0 days 00:00:25.338359,False,absolute_error,40,sqrt,1,3,690,TPESampler,COMPLETE
1311,0.3379908237440639,2025-04-24 22:38:04.592471,2025-04-24 22:38:30.185347,0 days 00:00:25.592876,False,absolute_error,49,sqrt,1,7,697,TPESampler,COMPLETE
1312,0.3301719333188716,2025-04-24 22:38:14.398659,2025-04-24 22:38:39.815462,0 days 00:00:25.416803,False,absolute_error,48,sqrt,1,5,687,TPESampler,COMPLETE
1313,0.8578717057945454,2025-04-24 22:38:26.184693,2025-04-24 22:38:27.266969,0 days 00:00:01.082276,False,squared_error,41,log2,11,4,758,TPESampler,COMPLETE
1314,0.32554433967421337,2025-04-24 22:38:27.446622,2025-04-24 22:38:53.210538,0 days 00:00:25.763916,False,absolute_error,50,sqrt,1,5,692,TPESampler,COMPLETE
1315,0.3262355980176682,2025-04-24 22:38:28.263195,2025-04-24 22:38:51.388900,0 days 00:00:23.125705,False,absolute_error,50,sqrt,1,4,620,TPESampler,COMPLETE
1316,0.422773290366474,2025-04-24 22:38:30.384772,2025-04-24 22:38:45.211331,0 days 00:00:14.826559,False,absolute_error,50,sqrt,2,7,607,TPESampler,COMPLETE
1317,0.3503573093277597,2025-04-24 22:38:39.996094,2025-04-24 22:39:08.914395,0 days 00:00:28.918301,False,absolute_error,41,sqrt,1,2,767,TPESampler,COMPLETE
1318,0.3262825891179278,2025-04-24 22:38:45.395842,2025-04-24 22:39:05.519087,0 days 00:00:20.123245,False,absolute_error,50,sqrt,1,5,537,TPESampler,COMPLETE
1319,0.33257182114990763,2025-04-24 22:38:51.583388,2025-04-24 22:39:18.664189,0 days 00:00:27.080801,False,absolute_error,50,sqrt,1,3,709,TPESampler,COMPLETE
1320,0.33169325797186977,2025-04-24 22:38:53.391532,2025-04-24 22:39:06.464879,0 days 00:00:13.073347,False,absolute_error,50,sqrt,1,3,336,TPESampler,COMPLETE
1321,0.33438019881349684,2025-04-24 22:39:05.719478,2025-04-24 22:39:34.176294,0 days 00:00:28.456816,False,absolute_error,41,sqrt,1,4,769,TPESampler,COMPLETE
1322,0.3753368623381564,2025-04-24 22:39:06.659656,2025-04-24 22:39:17.538681,0 days 00:00:10.879025,False,absolute_error,50,log2,1,2,357,TPESampler,COMPLETE
1323,0.3330519928061237,2025-04-24 22:39:09.100287,2025-04-24 22:39:40.353307,0 days 00:00:31.253020,False,absolute_error,43,sqrt,1,5,768,TPESampler,COMPLETE
1324,0.7815177142448998,2025-04-24 22:39:17.735059,2025-04-24 22:39:19.895310,0 days 00:00:02.160251,True,squared_error,14,log2,3,19,995,TPESampler,COMPLETE
1325,0.4209801243445257,2025-04-24 22:39:18.881761,2025-04-24 22:39:38.311019,0 days 00:00:19.429258,False,absolute_error,39,sqrt,2,3,802,TPESampler,COMPLETE
1326,0.4202483056415781,2025-04-24 22:39:19.387005,2025-04-24 22:39:39.303431,0 days 00:00:19.916426,False,absolute_error,41,sqrt,2,4,741,TPESampler,COMPLETE
1327,0.42774444078552276,2025-04-24 22:39:20.140979,2025-04-24 22:39:31.919653,0 days 00:00:11.778674,False,absolute_error,41,sqrt,2,9,480,TPESampler,COMPLETE
1328,0.43856657090644,2025-04-24 22:39:32.108019,2025-04-24 22:39:54.534116,0 days 00:00:22.426097,False,absolute_error,50,sqrt,2,36,938,TPESampler,COMPLETE
1329,0.32671428596644597,2025-04-24 22:39:34.386278,2025-04-24 22:40:02.928362,0 days 00:00:28.542084,False,absolute_error,50,sqrt,1,4,723,TPESampler,COMPLETE
1330,0.3265647631691873,2025-04-24 22:39:38.495429,2025-04-24 22:40:00.993140,0 days 00:00:22.497711,False,absolute_error,50,sqrt,1,4,603,TPESampler,COMPLETE
1331,0.3317158169111923,2025-04-24 22:39:39.500030,2025-04-24 22:40:01.515173,0 days 00:00:22.015143,False,absolute_error,43,sqrt,1,4,601,TPESampler,COMPLETE
1332,0.4156605678085169,2025-04-24 22:39:40.568201,2025-04-24 22:39:54.049997,0 days 00:00:13.481796,False,absolute_error,49,sqrt,2,3,549,TPESampler,COMPLETE
1333,0.33295082888326744,2025-04-24 22:39:54.233589,2025-04-24 22:40:14.374182,0 days 00:00:20.140593,False,absolute_error,42,sqrt,1,4,548,TPESampler,COMPLETE
1334,0.35190269863017376,2025-04-24 22:39:54.771816,2025-04-24 22:40:17.164965,0 days 00:00:22.393149,False,absolute_error,42,sqrt,1,8,624,TPESampler,COMPLETE
1335,0.41605885948147114,2025-04-24 22:40:01.179542,2025-04-24 22:40:12.216172,0 days 00:00:11.036630,False,absolute_error,44,sqrt,2,4,429,TPESampler,COMPLETE
1336,0.35475271505707273,2025-04-24 22:40:01.779125,2025-04-24 22:40:19.363639,0 days 00:00:17.584514,False,absolute_error,41,sqrt,1,8,485,TPESampler,COMPLETE
1337,0.3312768525946676,2025-04-24 22:40:03.119120,2025-04-24 22:40:20.413554,0 days 00:00:17.294434,False,absolute_error,50,sqrt,1,3,444,TPESampler,COMPLETE
1338,0.3265413651234418,2025-04-24 22:40:12.409437,2025-04-24 22:40:34.180073,0 days 00:00:21.770636,False,absolute_error,50,sqrt,1,4,579,TPESampler,COMPLETE
1339,0.3422233734068895,2025-04-24 22:40:14.558535,2025-04-24 22:40:38.545099,0 days 00:00:23.986564,False,absolute_error,49,sqrt,1,8,650,TPESampler,COMPLETE
1340,0.468393283941895,2025-04-24 22:40:17.522765,2025-04-24 22:43:31.908747,0 days 00:03:14.385982,False,absolute_error,50,,1,3,832,TPESampler,COMPLETE
1341,0.4000442075893869,2025-04-24 22:40:17.722360,2025-04-24 22:40:22.019008,0 days 00:00:04.296648,True,squared_error,27,,3,13,815,TPESampler,COMPLETE
1342,0.3392211093687529,2025-04-24 22:40:19.568822,2025-04-24 22:40:47.547592,0 days 00:00:27.978770,False,absolute_error,42,sqrt,1,3,757,TPESampler,COMPLETE
1343,0.4239383662804429,2025-04-24 22:40:20.619662,2025-04-24 22:40:37.968578,0 days 00:00:17.348916,False,absolute_error,48,sqrt,2,7,718,TPESampler,COMPLETE
1344,0.32664010432438567,2025-04-24 22:40:22.213260,2025-04-24 22:40:51.501727,0 days 00:00:29.288467,False,absolute_error,50,sqrt,1,4,784,TPESampler,COMPLETE
1345,0.3618077724392654,2025-04-24 22:40:34.368539,2025-04-24 22:40:44.568259,0 days 00:00:10.199720,True,absolute_error,50,sqrt,1,6,480,TPESampler,COMPLETE
1346,0.3435562042229357,2025-04-24 22:40:38.152354,2025-04-24 22:41:09.094560,0 days 00:00:30.942206,False,absolute_error,50,sqrt,1,2,764,TPESampler,COMPLETE
1347,0.3276523773561657,2025-04-24 22:40:38.871158,2025-04-24 22:40:59.975730,0 days 00:00:21.104572,False,absolute_error,50,sqrt,1,4,527,TPESampler,COMPLETE
1348,0.47148293428527194,2025-04-24 22:40:44.810762,2025-04-24 22:41:21.517033,0 days 00:00:36.706271,True,absolute_error,6,,4,9,955,TPESampler,COMPLETE
1349,0.3688810859801196,2025-04-24 22:40:47.744855,2025-04-24 22:41:02.528111,0 days 00:00:14.783256,False,absolute_error,49,log2,1,4,522,TPESampler,COMPLETE
1350,0.3254291300002491,2025-04-24 22:40:51.692823,2025-04-24 22:41:23.957820,0 days 00:00:32.264997,False,absolute_error,50,sqrt,1,5,713,TPESampler,COMPLETE
1351,0.35062784598732305,2025-04-24 22:41:00.225194,2025-04-24 22:41:21.174502,0 days 00:00:20.949308,False,absolute_error,41,sqrt,1,2,548,TPESampler,COMPLETE
1352,0.41656218053492217,2025-04-24 22:41:02.723822,2025-04-24 22:41:13.171812,0 days 00:00:10.447990,False,absolute_error,50,sqrt,2,4,415,TPESampler,COMPLETE
1353,0.34366721986749593,2025-04-24 22:41:09.281168,2025-04-24 22:41:33.036789,0 days 00:00:23.755621,False,absolute_error,50,sqrt,1,9,511,TPESampler,COMPLETE
1354,0.3409828749956491,2025-04-24 22:41:13.360766,2025-04-24 22:41:45.822157,0 days 00:00:32.461391,False,absolute_error,42,sqrt,1,6,710,TPESampler,COMPLETE
1355,0.34079085622768596,2025-04-24 22:41:21.454979,2025-04-24 22:41:42.950339,0 days 00:00:21.495360,False,absolute_error,42,sqrt,1,6,488,TPESampler,COMPLETE
1356,0.362781731416382,2025-04-24 22:41:21.716580,2025-04-24 22:41:40.051695,0 days 00:00:18.335115,False,absolute_error,29,sqrt,1,3,541,TPESampler,COMPLETE
1357,0.33146132290079466,2025-04-24 22:41:24.151605,2025-04-24 22:41:55.371779,0 days 00:00:31.220174,False,absolute_error,43,sqrt,1,4,735,TPESampler,COMPLETE
1358,0.4169654186094524,2025-04-24 22:41:33.226458,2025-04-24 22:41:48.766805,0 days 00:00:15.540347,False,absolute_error,44,sqrt,2,3,523,TPESampler,COMPLETE
1359,0.33968105978638835,2025-04-24 22:41:40.242796,2025-04-24 22:42:07.498572,0 days 00:00:27.255776,False,absolute_error,41,sqrt,1,3,596,TPESampler,COMPLETE
1360,0.3353886565684904,2025-04-24 22:41:43.142478,2025-04-24 22:42:06.218846,0 days 00:00:23.076368,False,absolute_error,50,sqrt,1,7,592,TPESampler,COMPLETE
1361,0.42626637246746507,2025-04-24 22:41:46.010649,2025-04-24 22:42:01.334811,0 days 00:00:15.324162,False,absolute_error,50,sqrt,2,11,619,TPESampler,COMPLETE
1362,0.4340743255963417,2025-04-24 22:41:48.952570,2025-04-24 22:41:53.408714,0 days 00:00:04.456144,True,squared_error,9,,1,3,996,TPESampler,COMPLETE
1363,0.4202188125843856,2025-04-24 22:41:53.608850,2025-04-24 22:41:55.517023,0 days 00:00:01.908173,False,squared_error,42,sqrt,2,3,791,TPESampler,COMPLETE
1364,0.41642227341278937,2025-04-24 22:41:55.587214,2025-04-24 22:42:17.921592,0 days 00:00:22.334378,False,absolute_error,50,log2,1,15,768,TPESampler,COMPLETE
1365,0.32671009850206123,2025-04-24 22:41:55.728522,2025-04-24 22:42:22.602459,0 days 00:00:26.873937,False,absolute_error,50,sqrt,1,4,705,TPESampler,COMPLETE
1366,0.8526123721119556,2025-04-24 22:42:01.520906,2025-04-24 22:42:02.438885,0 days 00:00:00.917979,False,squared_error,38,log2,10,7,431,TPESampler,COMPLETE
1367,0.3681696675297702,2025-04-24 22:42:02.626237,2025-04-24 22:42:16.556907,0 days 00:00:13.930670,True,absolute_error,50,sqrt,1,7,619,TPESampler,COMPLETE
1368,0.3361479959881002,2025-04-24 22:42:06.406277,2025-04-24 22:42:22.697367,0 days 00:00:16.291090,False,absolute_error,50,sqrt,1,7,432,TPESampler,COMPLETE
1369,0.33277198489415605,2025-04-24 22:42:07.768148,2025-04-24 22:42:26.370862,0 days 00:00:18.602714,False,absolute_error,43,sqrt,1,4,502,TPESampler,COMPLETE
1370,0.32492828924793127,2025-04-24 22:42:16.746665,2025-04-24 22:42:38.505601,0 days 00:00:21.758936,False,absolute_error,50,sqrt,1,5,583,TPESampler,COMPLETE
1371,0.4180945748612471,2025-04-24 22:42:18.223081,2025-04-24 22:42:38.251020,0 days 00:00:20.027939,False,absolute_error,48,sqrt,2,3,666,TPESampler,COMPLETE
1372,0.33143918236893605,2025-04-24 22:42:22.781170,2025-04-24 22:42:47.344418,0 days 00:00:24.563248,False,absolute_error,50,sqrt,1,6,636,TPESampler,COMPLETE
1373,0.4560131561457086,2025-04-24 22:42:22.944808,2025-04-24 22:44:20.621228,0 days 00:01:57.676420,False,absolute_error,47,,1,18,523,TPESampler,COMPLETE
1374,0.3255115646673678,2025-04-24 22:42:26.563233,2025-04-24 22:42:47.381224,0 days 00:00:20.817991,False,absolute_error,50,sqrt,1,5,459,TPESampler,COMPLETE
1375,0.3271744969865513,2025-04-24 22:42:38.445257,2025-04-24 22:43:03.568729,0 days 00:00:25.123472,False,absolute_error,50,sqrt,1,4,671,TPESampler,COMPLETE
1376,0.35611012054274155,2025-04-24 22:42:38.705377,2025-04-24 22:42:54.237028,0 days 00:00:15.531651,True,absolute_error,46,sqrt,1,2,668,TPESampler,COMPLETE
1377,0.3331635364193754,2025-04-24 22:42:47.972739,2025-04-24 22:43:24.203676,0 days 00:00:36.230937,False,absolute_error,42,sqrt,1,4,967,TPESampler,COMPLETE
1378,0.41798915593308456,2025-04-24 22:42:47.971660,2025-04-24 22:43:10.048191,0 days 00:00:22.076531,False,absolute_error,50,sqrt,2,3,887,TPESampler,COMPLETE
1379,0.7878258341832637,2025-04-24 22:42:54.554403,2025-04-24 22:42:57.225521,0 days 00:00:02.671118,True,absolute_error,20,sqrt,10,3,856,TPESampler,COMPLETE
1380,0.41293845125506107,2025-04-24 22:42:57.418460,2025-04-24 22:44:17.751445,0 days 00:01:20.332985,False,absolute_error,50,,2,3,587,TPESampler,COMPLETE
1381,0.3829181358142181,2025-04-24 22:43:03.768455,2025-04-24 22:43:25.638837,0 days 00:00:21.870382,False,absolute_error,29,sqrt,1,8,661,TPESampler,COMPLETE
1382,0.4216241395492434,2025-04-24 22:43:10.235039,2025-04-24 22:43:24.755081,0 days 00:00:14.520042,False,absolute_error,43,sqrt,2,5,593,TPESampler,COMPLETE
