number,value,datetime_start,datetime_complete,duration,params_bootstrap,params_criterion,params_max_depth,params_max_features,params_min_samples_leaf,params_min_samples_split,params_n_estimators,system_attrs_auto:sampler,state
3719,0.33160914133133945,2025-04-25 00:47:28.824328,2025-04-25 00:47:46.732648,0 days 00:00:17.908320,False,absolute_error,50,sqrt,1,3,458,TPESampler,COMPLETE
3720,0.5154017066556161,2025-04-25 00:47:29.731569,2025-04-25 00:47:33.382738,0 days 00:00:03.651169,True,absolute_error,15,,11,14,154,TPESampler,COMPLETE
3721,0.3325897649443954,2025-04-25 00:47:29.773693,2025-04-25 00:47:53.626628,0 days 00:00:23.852935,False,absolute_error,43,sqrt,1,5,560,TPESampler,COMPLETE
3722,0.33228108269704415,2025-04-25 00:47:33.602786,2025-04-25 00:47:59.272942,0 days 00:00:25.670156,False,absolute_error,43,sqrt,1,5,636,TPESampler,COMPLETE
3723,0.3467319170529628,2025-04-25 00:47:41.968527,2025-04-25 00:48:09.456642,0 days 00:00:27.488115,False,absolute_error,43,sqrt,1,2,716,TPESampler,COMPLETE
3724,0.4219470667364078,2025-04-25 00:47:45.759312,2025-04-25 00:48:03.223850,0 days 00:00:17.464538,False,absolute_error,44,sqrt,2,5,681,TPESampler,COMPLETE
3725,0.4848255721395939,2025-04-25 00:47:47.318416,2025-04-25 00:47:54.406054,0 days 00:00:07.087638,False,absolute_error,15,,7,2,107,TPESampler,COMPLETE
3726,0.34329259457189276,2025-04-25 00:47:53.094835,2025-04-25 00:48:14.673359,0 days 00:00:21.578524,False,absolute_error,50,sqrt,1,9,552,TPESampler,COMPLETE
3727,0.41312187992788124,2025-04-25 00:47:53.852227,2025-04-25 00:49:24.219998,0 days 00:01:30.367771,False,absolute_error,50,,2,4,655,TPESampler,COMPLETE
3728,0.42547248252193953,2025-04-25 00:47:55.058408,2025-04-25 00:48:08.390076,0 days 00:00:13.331668,False,absolute_error,36,sqrt,2,5,528,TPESampler,COMPLETE
3729,0.32565038683969266,2025-04-25 00:47:59.551444,2025-04-25 00:48:16.980239,0 days 00:00:17.428795,False,absolute_error,50,sqrt,1,5,444,TPESampler,COMPLETE
3730,0.5643584494307192,2025-04-25 00:48:03.444653,2025-04-25 00:48:10.984010,0 days 00:00:07.539357,False,absolute_error,48,sqrt,5,3,639,TPESampler,COMPLETE
3731,0.3316351475975568,2025-04-25 00:48:08.613460,2025-04-25 00:48:35.007808,0 days 00:00:26.394348,False,absolute_error,50,sqrt,1,3,628,TPESampler,COMPLETE
3732,0.33126241763263,2025-04-25 00:48:09.684728,2025-04-25 00:48:30.698713,0 days 00:00:21.013985,False,absolute_error,50,sqrt,1,6,551,TPESampler,COMPLETE
3733,0.3256203501422447,2025-04-25 00:48:11.203481,2025-04-25 00:48:23.268927,0 days 00:00:12.065446,False,absolute_error,50,sqrt,1,5,312,TPESampler,COMPLETE
3734,0.33175358807357325,2025-04-25 00:48:14.892122,2025-04-25 00:48:37.651123,0 days 00:00:22.759001,False,absolute_error,50,sqrt,1,3,589,TPESampler,COMPLETE
3735,0.3927570629979619,2025-04-25 00:48:17.205907,2025-04-25 00:48:21.540899,0 days 00:00:04.334992,False,absolute_error,30,sqrt,1,12,113,TPESampler,COMPLETE
3736,0.3544188610889148,2025-04-25 00:48:21.763931,2025-04-25 00:48:33.298638,0 days 00:00:11.534707,False,absolute_error,32,sqrt,1,5,325,TPESampler,COMPLETE
3737,0.49020134099503904,2025-04-25 00:48:23.496984,2025-04-25 00:48:25.245022,0 days 00:00:01.748038,False,squared_error,7,,3,2,255,TPESampler,COMPLETE
3738,0.33970813388369553,2025-04-25 00:48:25.464447,2025-04-25 00:48:52.752416,0 days 00:00:27.287969,False,absolute_error,37,sqrt,1,4,702,TPESampler,COMPLETE
3739,0.3253375181368633,2025-04-25 00:48:30.925159,2025-04-25 00:49:03.638903,0 days 00:00:32.713744,False,absolute_error,50,sqrt,1,5,694,TPESampler,COMPLETE
3740,0.3349979687110006,2025-04-25 00:48:33.525279,2025-04-25 00:48:43.995017,0 days 00:00:10.469738,False,absolute_error,41,sqrt,1,5,278,TPESampler,COMPLETE
3741,0.4311267230883778,2025-04-25 00:48:35.223073,2025-04-25 00:48:54.404732,0 days 00:00:19.181659,False,absolute_error,34,sqrt,2,7,797,TPESampler,COMPLETE
3742,0.33870155699949067,2025-04-25 00:48:37.871468,2025-04-25 00:48:40.366396,0 days 00:00:02.494928,False,squared_error,49,sqrt,1,6,749,TPESampler,COMPLETE
3743,0.43506284619100577,2025-04-25 00:48:40.583146,2025-04-25 00:50:18.074818,0 days 00:01:37.491672,False,absolute_error,37,,1,12,350,TPESampler,COMPLETE
3744,0.3418775896819485,2025-04-25 00:48:44.215172,2025-04-25 00:49:05.727144,0 days 00:00:21.511972,False,absolute_error,50,sqrt,1,9,390,TPESampler,COMPLETE
3745,0.4499102951085794,2025-04-25 00:48:52.972922,2025-04-25 00:51:38.683802,0 days 00:02:45.710880,False,absolute_error,42,,1,4,657,TPESampler,COMPLETE
3746,0.4392022429159314,2025-04-25 00:48:54.620807,2025-04-25 00:48:57.825296,0 days 00:00:03.204489,True,squared_error,21,,5,9,642,TPESampler,COMPLETE
3747,0.42091829763189853,2025-04-25 00:48:58.039988,2025-04-25 00:49:13.631366,0 days 00:00:15.591378,False,absolute_error,50,sqrt,2,5,636,TPESampler,COMPLETE
3748,0.6221606351836075,2025-04-25 00:49:03.863829,2025-04-25 00:49:12.277356,0 days 00:00:08.413527,False,absolute_error,49,log2,2,4,683,TPESampler,COMPLETE
3749,0.3353943023015099,2025-04-25 00:49:05.955695,2025-04-25 00:49:29.672286,0 days 00:00:23.716591,False,absolute_error,50,sqrt,1,7,633,TPESampler,COMPLETE
3750,0.4179957240904916,2025-04-25 00:49:12.496580,2025-04-25 00:49:29.942392,0 days 00:00:17.445812,False,absolute_error,50,sqrt,2,3,711,TPESampler,COMPLETE
3751,0.3323213104264712,2025-04-25 00:49:13.846074,2025-04-25 00:49:39.454058,0 days 00:00:25.607984,False,absolute_error,42,sqrt,1,5,707,TPESampler,COMPLETE
3752,0.4234618525813698,2025-04-25 00:49:24.452544,2025-04-25 00:49:35.072121,0 days 00:00:10.619577,False,absolute_error,50,sqrt,2,8,415,TPESampler,COMPLETE
3753,0.3414730179764901,2025-04-25 00:49:29.898317,2025-04-25 00:49:52.471717,0 days 00:00:22.573400,False,absolute_error,43,sqrt,1,7,544,TPESampler,COMPLETE
3754,0.351545998338426,2025-04-25 00:49:30.246837,2025-04-25 00:49:53.267328,0 days 00:00:23.020491,False,absolute_error,42,sqrt,1,8,592,TPESampler,COMPLETE
3755,0.4023705676975515,2025-04-25 00:49:35.297834,2025-04-25 00:49:36.452590,0 days 00:00:01.154756,True,squared_error,50,log2,1,7,241,TPESampler,COMPLETE
3756,0.3675546745214085,2025-04-25 00:49:36.756057,2025-04-25 00:49:56.961472,0 days 00:00:20.205415,True,absolute_error,50,sqrt,1,7,827,TPESampler,COMPLETE
3757,0.34711972750799275,2025-04-25 00:49:39.682805,2025-04-25 00:50:13.311028,0 days 00:00:33.628223,False,absolute_error,43,sqrt,1,2,528,TPESampler,COMPLETE
3758,0.7816660785904043,2025-04-25 00:49:52.703361,2025-04-25 00:49:54.689350,0 days 00:00:01.985989,True,absolute_error,30,log2,3,5,259,TPESampler,COMPLETE
3759,0.3321345812819644,2025-04-25 00:49:53.542686,2025-04-25 00:50:12.696598,0 days 00:00:19.153912,False,absolute_error,50,sqrt,1,3,490,TPESampler,COMPLETE
3760,0.33767243245773804,2025-04-25 00:49:54.914925,2025-04-25 00:50:08.163840,0 days 00:00:13.248915,False,absolute_error,42,sqrt,1,3,301,TPESampler,COMPLETE
3761,0.33062012405228003,2025-04-25 00:49:57.189346,2025-04-25 00:50:13.409078,0 days 00:00:16.219732,False,absolute_error,43,sqrt,1,5,381,TPESampler,COMPLETE
3762,0.3321926970777505,2025-04-25 00:50:08.402833,2025-04-25 00:50:28.428169,0 days 00:00:20.025336,False,absolute_error,43,sqrt,1,4,536,TPESampler,COMPLETE
3763,0.4162581009128367,2025-04-25 00:50:12.922246,2025-04-25 00:50:25.832751,0 days 00:00:12.910505,False,absolute_error,50,sqrt,2,3,507,TPESampler,COMPLETE
3764,0.3366543181424252,2025-04-25 00:50:13.668097,2025-04-25 00:50:34.065085,0 days 00:00:20.396988,False,absolute_error,44,sqrt,1,3,529,TPESampler,COMPLETE
3765,0.4208726059487789,2025-04-25 00:50:13.670328,2025-04-25 00:50:26.721627,0 days 00:00:13.051299,False,absolute_error,44,sqrt,2,6,509,TPESampler,COMPLETE
3766,0.6922334303174125,2025-04-25 00:50:18.297882,2025-04-25 00:50:20.092334,0 days 00:00:01.794452,True,squared_error,47,log2,2,24,944,TPESampler,COMPLETE
3767,0.34385852095673575,2025-04-25 00:50:20.306738,2025-04-25 00:50:49.898050,0 days 00:00:29.591312,False,absolute_error,50,sqrt,1,2,752,TPESampler,COMPLETE
3768,0.7025499472684026,2025-04-25 00:50:26.062556,2025-04-25 00:50:29.694104,0 days 00:00:03.631548,True,absolute_error,5,sqrt,1,2,368,TPESampler,COMPLETE
3769,0.404764201960907,2025-04-25 00:50:26.974684,2025-04-25 00:50:44.725314,0 days 00:00:17.750630,False,absolute_error,49,log2,1,10,643,TPESampler,COMPLETE
3770,0.41659514139271436,2025-04-25 00:50:28.738671,2025-04-25 00:50:39.586303,0 days 00:00:10.847632,False,absolute_error,50,sqrt,2,4,405,TPESampler,COMPLETE
3771,0.35270612823145386,2025-04-25 00:50:30.018074,2025-04-25 00:50:35.243811,0 days 00:00:05.225737,False,absolute_error,42,sqrt,1,8,127,TPESampler,COMPLETE
3772,0.33223688195519374,2025-04-25 00:50:34.280390,2025-04-25 00:51:04.778570,0 days 00:00:30.498180,False,absolute_error,50,sqrt,1,6,799,TPESampler,COMPLETE
3773,0.34055580757682263,2025-04-25 00:50:35.462238,2025-04-25 00:50:58.278672,0 days 00:00:22.816434,False,absolute_error,43,sqrt,1,6,599,TPESampler,COMPLETE
3774,0.41697419961681803,2025-04-25 00:50:39.820811,2025-04-25 00:50:54.502742,0 days 00:00:14.681931,False,absolute_error,50,sqrt,2,4,596,TPESampler,COMPLETE
3775,0.4179200372786029,2025-04-25 00:50:44.952271,2025-04-25 00:50:52.397613,0 days 00:00:07.445342,False,absolute_error,50,sqrt,2,6,280,TPESampler,COMPLETE
3776,0.46569373438088074,2025-04-25 00:50:50.124814,2025-04-25 00:51:44.768505,0 days 00:00:54.643691,False,absolute_error,43,,3,31,501,TPESampler,COMPLETE
3777,0.41555836259810675,2025-04-25 00:50:52.611625,2025-04-25 00:51:01.434554,0 days 00:00:08.822929,False,absolute_error,42,sqrt,2,3,346,TPESampler,COMPLETE
3778,0.38286323397664584,2025-04-25 00:50:54.730387,2025-04-25 00:51:15.700935,0 days 00:00:20.970548,False,absolute_error,42,log2,1,3,752,TPESampler,COMPLETE
3779,0.32560334704781313,2025-04-25 00:50:58.502613,2025-04-25 00:51:23.548065,0 days 00:00:25.045452,False,absolute_error,50,sqrt,1,5,656,TPESampler,COMPLETE
3780,0.4607626874101376,2025-04-25 00:51:01.656536,2025-04-25 00:51:05.773752,0 days 00:00:04.117216,False,squared_error,27,,4,46,740,TPESampler,COMPLETE
3781,0.33171244683971046,2025-04-25 00:51:05.004945,2025-04-25 00:51:24.382804,0 days 00:00:19.377859,False,absolute_error,50,sqrt,1,3,499,TPESampler,COMPLETE
3782,0.4464716820444688,2025-04-25 00:51:05.991651,2025-04-25 00:53:28.633730,0 days 00:02:22.642079,False,absolute_error,50,,1,6,624,TPESampler,COMPLETE
3783,0.39324467835932636,2025-04-25 00:51:15.927807,2025-04-25 00:51:21.708273,0 days 00:00:05.780466,False,squared_error,32,,1,3,529,TPESampler,COMPLETE
3784,0.3257401044879113,2025-04-25 00:51:21.935388,2025-04-25 00:51:40.933029,0 days 00:00:18.997641,False,absolute_error,50,sqrt,1,5,495,TPESampler,COMPLETE
3785,0.33221258588496655,2025-04-25 00:51:23.766023,2025-04-25 00:51:39.548597,0 days 00:00:15.782574,False,absolute_error,43,sqrt,1,4,416,TPESampler,COMPLETE
3786,0.3250356763240181,2025-04-25 00:51:24.711960,2025-04-25 00:51:35.276911,0 days 00:00:10.564951,False,absolute_error,50,sqrt,1,5,271,TPESampler,COMPLETE
3787,0.421670799556723,2025-04-25 00:51:35.500840,2025-04-25 00:51:51.782715,0 days 00:00:16.281875,False,absolute_error,50,sqrt,2,6,653,TPESampler,COMPLETE
3788,0.3942190312098817,2025-04-25 00:51:38.903050,2025-04-25 00:51:43.967606,0 days 00:00:05.064556,False,absolute_error,40,log2,1,4,170,TPESampler,COMPLETE
3789,0.353700709819974,2025-04-25 00:51:39.789923,2025-04-25 00:52:10.229420,0 days 00:00:30.439497,False,absolute_error,50,sqrt,1,12,753,TPESampler,COMPLETE
3790,0.34798781738605394,2025-04-25 00:51:41.155950,2025-04-25 00:52:04.894322,0 days 00:00:23.738372,False,absolute_error,35,sqrt,1,4,672,TPESampler,COMPLETE
3791,0.38980481048518906,2025-04-25 00:51:44.181111,2025-04-25 00:51:46.642761,0 days 00:00:02.461650,True,squared_error,50,log2,1,5,674,TPESampler,COMPLETE
3792,0.42533764366890614,2025-04-25 00:51:45.152735,2025-04-25 00:51:54.293801,0 days 00:00:09.141066,False,absolute_error,41,sqrt,2,12,353,TPESampler,COMPLETE
3793,0.36141544804834436,2025-04-25 00:51:46.861486,2025-04-25 00:52:51.323624,0 days 00:01:04.462138,True,absolute_error,27,,1,2,480,TPESampler,COMPLETE
3794,0.33199366017974363,2025-04-25 00:51:52.016138,2025-04-25 00:52:22.075013,0 days 00:00:30.058875,False,absolute_error,44,sqrt,1,4,740,TPESampler,COMPLETE
3795,0.4134809067081098,2025-04-25 00:51:54.512118,2025-04-25 00:52:02.514451,0 days 00:00:08.002333,False,absolute_error,50,sqrt,2,3,310,TPESampler,COMPLETE
3796,0.3266061477205639,2025-04-25 00:52:02.731241,2025-04-25 00:52:31.261552,0 days 00:00:28.530311,False,absolute_error,50,sqrt,1,4,713,TPESampler,COMPLETE
3797,0.41816866377479023,2025-04-25 00:52:05.117076,2025-04-25 00:52:19.152629,0 days 00:00:14.035553,False,absolute_error,42,sqrt,2,4,541,TPESampler,COMPLETE
3798,0.8700436103350309,2025-04-25 00:52:10.445938,2025-04-25 00:52:12.128367,0 days 00:00:01.682429,True,squared_error,28,log2,12,9,510,TPESampler,COMPLETE
3799,0.8386330044526359,2025-04-25 00:52:12.362162,2025-04-25 00:52:13.621723,0 days 00:00:01.259561,True,squared_error,6,log2,5,9,520,TPESampler,COMPLETE
3800,0.3434482795855569,2025-04-25 00:52:13.847893,2025-04-25 00:52:34.002622,0 days 00:00:20.154729,False,absolute_error,50,sqrt,1,9,532,TPESampler,COMPLETE
3801,0.3312768525946676,2025-04-25 00:52:19.378442,2025-04-25 00:52:36.813585,0 days 00:00:17.435143,False,absolute_error,50,sqrt,1,3,444,TPESampler,COMPLETE
3802,0.3323230262396907,2025-04-25 00:52:22.298621,2025-04-25 00:52:47.928110,0 days 00:00:25.629489,False,absolute_error,50,sqrt,1,3,664,TPESampler,COMPLETE
3803,0.42300845926498126,2025-04-25 00:52:31.479290,2025-04-25 00:52:52.957616,0 days 00:00:21.478326,False,absolute_error,42,sqrt,2,6,725,TPESampler,COMPLETE
3804,0.5465356889637656,2025-04-25 00:52:34.233711,2025-04-25 00:52:36.674886,0 days 00:00:02.441175,True,squared_error,7,,14,5,623,TPESampler,COMPLETE
3805,0.3517247572045877,2025-04-25 00:52:36.866148,2025-04-25 00:52:48.894435,0 days 00:00:12.028287,False,absolute_error,44,sqrt,1,9,308,TPESampler,COMPLETE
3806,0.4683600435128914,2025-04-25 00:52:36.999606,2025-04-25 00:55:08.646807,0 days 00:02:31.647201,False,absolute_error,42,,1,2,646,TPESampler,COMPLETE
3807,0.3399618669574889,2025-04-25 00:52:48.196999,2025-04-25 00:53:03.374251,0 days 00:00:15.177252,False,absolute_error,43,sqrt,1,6,396,TPESampler,COMPLETE
3808,0.3480384711263121,2025-04-25 00:52:49.197043,2025-04-25 00:52:58.511079,0 days 00:00:09.314036,False,absolute_error,44,sqrt,1,2,218,TPESampler,COMPLETE
3809,0.33560125366468757,2025-04-25 00:52:51.635269,2025-04-25 00:53:01.975346,0 days 00:00:10.340077,False,absolute_error,43,sqrt,1,3,252,TPESampler,COMPLETE
3810,0.3327191032222335,2025-04-25 00:52:53.209955,2025-04-25 00:53:24.787171,0 days 00:00:31.577216,False,absolute_error,43,sqrt,1,5,655,TPESampler,COMPLETE
3811,0.32507634456696644,2025-04-25 00:52:58.739028,2025-04-25 00:53:09.303681,0 days 00:00:10.564653,False,absolute_error,50,sqrt,1,5,270,TPESampler,COMPLETE
3812,0.32955129117872917,2025-04-25 00:53:02.197097,2025-04-25 00:53:22.119391,0 days 00:00:19.922294,False,absolute_error,44,sqrt,1,4,360,TPESampler,COMPLETE
3813,0.3250619997885403,2025-04-25 00:53:03.604616,2025-04-25 00:53:27.600196,0 days 00:00:23.995580,False,absolute_error,50,sqrt,1,5,640,TPESampler,COMPLETE
3814,0.41540451338576617,2025-04-25 00:53:09.528539,2025-04-25 00:53:10.859992,0 days 00:00:01.331453,False,squared_error,49,sqrt,2,5,385,TPESampler,COMPLETE
3815,0.3412984901011386,2025-04-25 00:53:11.078133,2025-04-25 00:53:36.368357,0 days 00:00:25.290224,False,absolute_error,50,sqrt,1,8,684,TPESampler,COMPLETE
3816,0.32986904432581404,2025-04-25 00:53:22.347244,2025-04-25 00:53:37.304368,0 days 00:00:14.957124,False,absolute_error,50,sqrt,1,6,391,TPESampler,COMPLETE
3817,0.34093710870169325,2025-04-25 00:53:25.009431,2025-04-25 00:53:53.262380,0 days 00:00:28.252949,False,absolute_error,43,sqrt,1,6,561,TPESampler,COMPLETE
3818,0.33389355741006244,2025-04-25 00:53:27.842546,2025-04-25 00:53:54.939596,0 days 00:00:27.097050,False,absolute_error,44,sqrt,1,5,728,TPESampler,COMPLETE
3819,0.3261602549990975,2025-04-25 00:53:29.011088,2025-04-25 00:53:55.671358,0 days 00:00:26.660270,False,absolute_error,50,sqrt,1,5,505,TPESampler,COMPLETE
3820,0.40712048799810685,2025-04-25 00:53:36.627812,2025-04-25 00:53:51.227814,0 days 00:00:14.600002,False,absolute_error,41,log2,1,6,551,TPESampler,COMPLETE
3821,0.338260599337722,2025-04-25 00:53:37.536407,2025-04-25 00:54:04.166066,0 days 00:00:26.629659,False,absolute_error,43,sqrt,1,3,575,TPESampler,COMPLETE
3822,0.3989413666093507,2025-04-25 00:53:51.461619,2025-04-25 00:53:54.594116,0 days 00:00:03.132497,True,squared_error,18,,3,2,554,TPESampler,COMPLETE
3823,0.32553169193177456,2025-04-25 00:53:53.483670,2025-04-25 00:54:12.649893,0 days 00:00:19.166223,False,absolute_error,50,sqrt,1,5,456,TPESampler,COMPLETE
3824,0.33119054367591644,2025-04-25 00:53:54.817363,2025-04-25 00:54:15.620513,0 days 00:00:20.803150,False,absolute_error,50,sqrt,1,6,555,TPESampler,COMPLETE
3825,0.4213521260023755,2025-04-25 00:53:55.292072,2025-04-25 00:54:17.049471,0 days 00:00:21.757399,False,absolute_error,50,sqrt,2,5,762,TPESampler,COMPLETE
3826,0.3277783041062055,2025-04-25 00:53:55.896270,2025-04-25 00:54:08.704653,0 days 00:00:12.808383,False,absolute_error,50,sqrt,1,4,327,TPESampler,COMPLETE
3827,0.3446357561158136,2025-04-25 00:54:04.394592,2025-04-25 00:54:21.524403,0 days 00:00:17.129811,False,absolute_error,50,sqrt,1,2,413,TPESampler,COMPLETE
3828,0.34529050086680135,2025-04-25 00:54:08.933252,2025-04-25 00:54:28.685451,0 days 00:00:19.752199,False,absolute_error,36,sqrt,1,4,512,TPESampler,COMPLETE
3829,0.4411985194115107,2025-04-25 00:54:12.862564,2025-04-25 00:54:48.732868,0 days 00:00:35.870304,False,absolute_error,50,,1,7,155,TPESampler,COMPLETE
3830,0.344905668540662,2025-04-25 00:54:15.853615,2025-04-25 00:54:40.928145,0 days 00:00:25.074530,False,absolute_error,50,sqrt,1,2,632,TPESampler,COMPLETE
3831,0.8421703947388488,2025-04-25 00:54:17.277836,2025-04-25 00:54:18.644214,0 days 00:00:01.366378,True,absolute_error,35,log2,5,30,340,TPESampler,COMPLETE
3832,0.6847416582594928,2025-04-25 00:54:18.877341,2025-04-25 00:54:21.666071,0 days 00:00:02.788730,True,absolute_error,10,sqrt,5,22,522,TPESampler,COMPLETE
3833,0.331900165306605,2025-04-25 00:54:21.752845,2025-04-25 00:54:42.793420,0 days 00:00:21.040575,False,absolute_error,43,sqrt,1,4,567,TPESampler,COMPLETE
3834,0.3312183670689281,2025-04-25 00:54:21.895162,2025-04-25 00:54:44.743399,0 days 00:00:22.848237,False,absolute_error,44,sqrt,1,4,616,TPESampler,COMPLETE
3835,0.33175466547540283,2025-04-25 00:54:28.970752,2025-04-25 00:54:47.014530,0 days 00:00:18.043778,False,absolute_error,50,sqrt,1,6,471,TPESampler,COMPLETE
3836,0.3313673873090236,2025-04-25 00:54:41.155281,2025-04-25 00:54:55.682914,0 days 00:00:14.527633,False,absolute_error,50,sqrt,1,3,371,TPESampler,COMPLETE
3837,0.3559059994444632,2025-04-25 00:54:43.022545,2025-04-25 00:55:06.480377,0 days 00:00:23.457832,False,absolute_error,43,sqrt,1,10,644,TPESampler,COMPLETE
3838,0.42178541232673994,2025-04-25 00:54:44.979290,2025-04-25 00:54:57.439760,0 days 00:00:12.460470,False,absolute_error,50,sqrt,2,7,497,TPESampler,COMPLETE
3839,0.3270100629479947,2025-04-25 00:54:47.232053,2025-04-25 00:55:21.624501,0 days 00:00:34.392448,False,absolute_error,50,sqrt,1,4,833,TPESampler,COMPLETE
3840,0.4201201029925335,2025-04-25 00:54:48.956273,2025-04-25 00:55:03.433157,0 days 00:00:14.476884,False,absolute_error,50,sqrt,2,6,460,TPESampler,COMPLETE
3841,0.40848350328018196,2025-04-25 00:54:55.918695,2025-04-25 00:54:57.549138,0 days 00:00:01.630443,False,squared_error,35,log2,1,3,409,TPESampler,COMPLETE
3842,0.32576799068117457,2025-04-25 00:54:57.645999,2025-04-25 00:55:21.024646,0 days 00:00:23.378647,False,absolute_error,50,sqrt,1,5,499,TPESampler,COMPLETE
3843,0.3265340554782865,2025-04-25 00:54:57.809747,2025-04-25 00:55:30.556006,0 days 00:00:32.746259,False,absolute_error,50,sqrt,1,4,752,TPESampler,COMPLETE
3844,0.32715586192664203,2025-04-25 00:55:03.655764,2025-04-25 00:55:13.503182,0 days 00:00:09.847418,False,absolute_error,42,sqrt,1,4,199,TPESampler,COMPLETE
3845,0.33209938514449683,2025-04-25 00:55:06.707277,2025-04-25 00:55:17.942951,0 days 00:00:11.235674,False,absolute_error,50,sqrt,1,3,226,TPESampler,COMPLETE
3846,0.4164764604780664,2025-04-25 00:55:08.877439,2025-04-25 00:55:21.225643,0 days 00:00:12.348204,False,absolute_error,43,sqrt,2,4,487,TPESampler,COMPLETE
3847,0.3774282974183172,2025-04-25 00:55:13.727687,2025-04-25 00:55:42.695925,0 days 00:00:28.968238,False,absolute_error,33,sqrt,1,11,838,TPESampler,COMPLETE
3848,0.8176015628336439,2025-04-25 00:55:18.165712,2025-04-25 00:55:19.732197,0 days 00:00:01.566485,True,squared_error,16,sqrt,14,22,797,TPESampler,COMPLETE
3849,0.5088325685743333,2025-04-25 00:55:19.956277,2025-04-25 00:55:24.352590,0 days 00:00:04.396313,False,squared_error,42,,14,48,840,TPESampler,COMPLETE
3850,0.7406919618724913,2025-04-25 00:55:21.228296,2025-04-25 00:55:22.970820,0 days 00:00:01.742524,True,squared_error,21,sqrt,7,15,449,TPESampler,COMPLETE
3851,0.4189650525839384,2025-04-25 00:55:21.518009,2025-04-25 00:55:46.488395,0 days 00:00:24.970386,False,absolute_error,43,sqrt,2,3,745,TPESampler,COMPLETE
3852,0.3549420840981558,2025-04-25 00:55:21.885828,2025-04-25 00:55:38.641510,0 days 00:00:16.755682,True,absolute_error,50,sqrt,1,4,691,TPESampler,COMPLETE
3853,0.4699078558673375,2025-04-25 00:55:23.196076,2025-04-25 00:57:26.983849,0 days 00:02:03.787773,False,absolute_error,43,,1,3,517,TPESampler,COMPLETE
3854,0.36554657018308867,2025-04-25 00:55:24.656531,2025-04-25 00:55:42.012657,0 days 00:00:17.356126,False,absolute_error,50,log2,1,4,542,TPESampler,COMPLETE
3855,0.42180289223723955,2025-04-25 00:55:30.776452,2025-04-25 00:55:50.926601,0 days 00:00:20.150149,False,absolute_error,44,sqrt,2,5,634,TPESampler,COMPLETE
3856,0.3255473416832332,2025-04-25 00:55:38.868210,2025-04-25 00:56:03.605540,0 days 00:00:24.737330,False,absolute_error,50,sqrt,1,5,655,TPESampler,COMPLETE
