number,value,datetime_start,datetime_complete,duration,params_bootstrap,params_criterion,params_max_depth,params_max_features,params_min_samples_leaf,params_min_samples_split,params_n_estimators,system_attrs_auto:sampler,state
2622,0.32643903946574354,2025-04-24 23:50:57.924288,2025-04-24 23:51:14.041446,0 days 00:00:16.117158,False,absolute_error,50,sqrt,1,4,410,TPESampler,COMPLETE
2623,0.8230070159360382,2025-04-24 23:50:59.249181,2025-04-24 23:51:02.703496,0 days 00:00:03.454315,False,absolute_error,20,log2,6,2,968,TPESampler,COMPLETE
2624,0.34522313429298995,2025-04-24 23:51:02.918274,2025-04-24 23:51:17.231032,0 days 00:00:14.312758,False,absolute_error,50,sqrt,1,2,349,TPESampler,COMPLETE
2625,0.41789146472315913,2025-04-24 23:51:04.563873,2025-04-24 23:51:12.401434,0 days 00:00:07.837561,False,absolute_error,50,sqrt,2,6,305,TPESampler,COMPLETE
2626,0.357764447365664,2025-04-24 23:51:12.615442,2025-04-24 23:51:20.228917,0 days 00:00:07.613475,True,absolute_error,47,sqrt,1,5,341,TPESampler,COMPLETE
2627,0.4184678224047294,2025-04-24 23:51:12.964433,2025-04-24 23:51:22.720819,0 days 00:00:09.756386,False,absolute_error,41,sqrt,2,4,377,TPESampler,COMPLETE
2628,0.3256629788596714,2025-04-24 23:51:14.245442,2025-04-24 23:51:27.632572,0 days 00:00:13.387130,False,absolute_error,50,sqrt,1,5,344,TPESampler,COMPLETE
2629,0.4504482778222068,2025-04-24 23:51:17.432356,2025-04-24 23:51:46.975755,0 days 00:00:29.543399,False,absolute_error,49,,1,4,126,TPESampler,COMPLETE
2630,0.3787514333035749,2025-04-24 23:51:20.499520,2025-04-24 23:51:30.464805,0 days 00:00:09.965285,False,absolute_error,47,log2,1,5,349,TPESampler,COMPLETE
2631,0.4380624631308162,2025-04-24 23:51:22.935935,2025-04-24 23:51:25.983088,0 days 00:00:03.047153,False,squared_error,20,,3,3,342,TPESampler,COMPLETE
2632,0.3412021662185346,2025-04-24 23:51:26.190006,2025-04-24 23:51:35.563082,0 days 00:00:09.373076,False,absolute_error,39,sqrt,1,3,233,TPESampler,COMPLETE
2633,0.3932616717745886,2025-04-24 23:51:27.390583,2025-04-24 23:51:28.768865,0 days 00:00:01.378282,False,squared_error,37,sqrt,1,24,384,TPESampler,COMPLETE
2634,0.33185231775476887,2025-04-24 23:51:27.848000,2025-04-24 23:51:40.625136,0 days 00:00:12.777136,False,absolute_error,43,sqrt,1,4,332,TPESampler,COMPLETE
2635,0.32649725818968184,2025-04-24 23:51:28.990953,2025-04-24 23:51:43.267489,0 days 00:00:14.276536,False,absolute_error,50,sqrt,1,4,366,TPESampler,COMPLETE
2636,0.4160074271964401,2025-04-24 23:51:30.673546,2025-04-24 23:51:40.326426,0 days 00:00:09.652880,False,absolute_error,50,sqrt,2,3,378,TPESampler,COMPLETE
2637,0.3402012306328444,2025-04-24 23:51:35.760421,2025-04-24 23:51:52.389237,0 days 00:00:16.628816,False,absolute_error,37,sqrt,1,4,451,TPESampler,COMPLETE
2638,0.4217237614543169,2025-04-24 23:51:40.558129,2025-04-24 23:51:51.799717,0 days 00:00:11.241588,False,absolute_error,40,sqrt,2,5,443,TPESampler,COMPLETE
2639,0.32590248962062196,2025-04-24 23:51:40.862736,2025-04-24 23:51:55.887908,0 days 00:00:15.025172,False,absolute_error,50,sqrt,1,4,385,TPESampler,COMPLETE
2640,0.3968938196285309,2025-04-24 23:51:43.482319,2025-04-24 23:51:52.941528,0 days 00:00:09.459209,False,absolute_error,50,log2,1,8,327,TPESampler,COMPLETE
2641,0.4183164188716268,2025-04-24 23:51:47.190879,2025-04-24 23:51:59.354475,0 days 00:00:12.163596,False,absolute_error,41,sqrt,2,2,475,TPESampler,COMPLETE
2642,0.34140388205321603,2025-04-24 23:51:52.015371,2025-04-24 23:52:10.593075,0 days 00:00:18.577704,False,absolute_error,43,sqrt,1,6,490,TPESampler,COMPLETE
2643,0.33565023418836865,2025-04-24 23:51:52.646772,2025-04-24 23:52:09.932727,0 days 00:00:17.285955,False,absolute_error,45,sqrt,1,3,441,TPESampler,COMPLETE
2644,0.3392547267031037,2025-04-24 23:51:53.186359,2025-04-24 23:51:54.800403,0 days 00:00:01.614044,False,squared_error,42,sqrt,1,5,359,TPESampler,COMPLETE
2645,0.3315816125857277,2025-04-24 23:51:55.017758,2025-04-24 23:52:09.523100,0 days 00:00:14.505342,False,absolute_error,50,sqrt,1,3,373,TPESampler,COMPLETE
2646,0.6913252828131867,2025-04-24 23:51:56.092366,2025-04-24 23:51:57.226039,0 days 00:00:01.133673,True,squared_error,35,log2,2,5,353,TPESampler,COMPLETE
2647,0.3267153648163538,2025-04-24 23:51:57.464831,2025-04-24 23:52:14.889368,0 days 00:00:17.424537,False,absolute_error,50,sqrt,1,4,448,TPESampler,COMPLETE
2648,0.3474396292083944,2025-04-24 23:51:59.576899,2025-04-24 23:52:07.342348,0 days 00:00:07.765449,False,absolute_error,43,sqrt,1,2,187,TPESampler,COMPLETE
2649,0.3596643285449304,2025-04-24 23:52:07.594396,2025-04-24 23:52:18.698544,0 days 00:00:11.104148,False,absolute_error,33,sqrt,1,7,309,TPESampler,COMPLETE
2650,0.3442475296804883,2025-04-24 23:52:09.807279,2025-04-24 23:52:26.014094,0 days 00:00:16.206815,False,absolute_error,41,sqrt,1,7,408,TPESampler,COMPLETE
2651,0.3518394841261394,2025-04-24 23:52:10.699838,2025-04-24 23:52:20.197304,0 days 00:00:09.497466,True,absolute_error,49,sqrt,1,4,327,TPESampler,COMPLETE
2652,0.3252421961931312,2025-04-24 23:52:11.222725,2025-04-24 23:52:29.034773,0 days 00:00:17.812048,False,absolute_error,50,sqrt,1,5,450,TPESampler,COMPLETE
2653,0.41154580683774616,2025-04-24 23:52:15.102214,2025-04-24 23:52:21.717961,0 days 00:00:06.615747,False,absolute_error,50,sqrt,2,3,212,TPESampler,COMPLETE
2654,0.34036973913263424,2025-04-24 23:52:18.915271,2025-04-24 23:52:21.035907,0 days 00:00:02.120636,False,squared_error,44,sqrt,1,3,406,TPESampler,COMPLETE
2655,0.448678230669351,2025-04-24 23:52:20.501723,2025-04-24 23:52:25.028615,0 days 00:00:04.526892,True,absolute_error,22,sqrt,1,11,179,TPESampler,COMPLETE
2656,0.3392180602342652,2025-04-24 23:52:21.351515,2025-04-24 23:52:36.977426,0 days 00:00:15.625911,False,absolute_error,44,sqrt,1,6,404,TPESampler,COMPLETE
2657,0.45046592863895724,2025-04-24 23:52:21.972525,2025-04-24 23:52:27.749082,0 days 00:00:05.776557,False,squared_error,47,,4,23,928,TPESampler,COMPLETE
2658,0.3356794988856886,2025-04-24 23:52:25.240782,2025-04-24 23:52:48.578396,0 days 00:00:23.337614,False,absolute_error,50,sqrt,1,7,500,TPESampler,COMPLETE
2659,0.32991927335331644,2025-04-24 23:52:26.250327,2025-04-24 23:52:37.134567,0 days 00:00:10.884240,False,absolute_error,42,sqrt,1,4,280,TPESampler,COMPLETE
2660,0.4236415095515751,2025-04-24 23:52:27.970301,2025-04-24 23:52:42.785988,0 days 00:00:14.815687,False,absolute_error,48,sqrt,2,8,441,TPESampler,COMPLETE
2661,0.3314585732122195,2025-04-24 23:52:29.286990,2025-04-24 23:52:46.965095,0 days 00:00:17.678105,False,absolute_error,50,sqrt,1,3,378,TPESampler,COMPLETE
2662,0.3352147480250801,2025-04-24 23:52:37.216317,2025-04-24 23:52:57.744494,0 days 00:00:20.528177,False,absolute_error,44,sqrt,1,5,502,TPESampler,COMPLETE
2663,0.33235180955227234,2025-04-24 23:52:37.390322,2025-04-24 23:52:55.835555,0 days 00:00:18.445233,False,absolute_error,42,sqrt,1,5,489,TPESampler,COMPLETE
2664,0.4180864157208998,2025-04-24 23:52:38.871182,2025-04-24 23:52:51.037200,0 days 00:00:12.166018,False,absolute_error,41,sqrt,2,4,481,TPESampler,COMPLETE
2665,0.4209764394165023,2025-04-24 23:52:43.004501,2025-04-24 23:52:53.677813,0 days 00:00:10.673312,False,absolute_error,49,sqrt,2,6,412,TPESampler,COMPLETE
2666,0.4878151324514262,2025-04-24 23:52:47.287640,2025-04-24 23:52:50.636033,0 days 00:00:03.348393,False,squared_error,20,sqrt,3,3,961,TPESampler,COMPLETE
2667,0.40053228126104296,2025-04-24 23:52:49.039706,2025-04-24 23:52:53.607137,0 days 00:00:04.567431,False,squared_error,39,,2,2,456,TPESampler,COMPLETE
2668,0.8483115268534264,2025-04-24 23:52:51.115723,2025-04-24 23:52:54.055061,0 days 00:00:02.939338,False,absolute_error,42,log2,8,2,799,TPESampler,COMPLETE
2669,0.3276084655236576,2025-04-24 23:52:51.408230,2025-04-24 23:53:11.297167,0 days 00:00:19.888937,False,absolute_error,50,sqrt,1,4,497,TPESampler,COMPLETE
2670,0.3409627165697536,2025-04-24 23:52:53.832070,2025-04-24 23:53:04.876227,0 days 00:00:11.044157,False,absolute_error,39,sqrt,1,5,273,TPESampler,COMPLETE
2671,0.3310344162067806,2025-04-24 23:52:54.098382,2025-04-24 23:53:11.487575,0 days 00:00:17.389193,False,absolute_error,43,sqrt,1,4,394,TPESampler,COMPLETE
2672,0.86467994964675,2025-04-24 23:52:54.385950,2025-04-24 23:52:57.685910,0 days 00:00:03.299960,False,absolute_error,25,log2,14,50,897,TPESampler,COMPLETE
2673,0.34592954809182797,2025-04-24 23:52:56.348579,2025-04-24 23:53:17.122662,0 days 00:00:20.774083,False,absolute_error,50,sqrt,1,2,516,TPESampler,COMPLETE
2674,0.34213937720486787,2025-04-24 23:52:57.926551,2025-04-24 23:53:12.399199,0 days 00:00:14.472648,False,absolute_error,50,sqrt,1,9,377,TPESampler,COMPLETE
2675,0.33186018257648225,2025-04-24 23:52:57.978099,2025-04-24 23:53:17.419869,0 days 00:00:19.441770,False,absolute_error,50,sqrt,1,6,499,TPESampler,COMPLETE
2676,0.32527566002531094,2025-04-24 23:53:05.103025,2025-04-24 23:53:25.179722,0 days 00:00:20.076697,False,absolute_error,50,sqrt,1,5,417,TPESampler,COMPLETE
2677,0.4164312852182569,2025-04-24 23:53:11.556007,2025-04-24 23:53:23.920167,0 days 00:00:12.364160,False,absolute_error,50,sqrt,2,3,424,TPESampler,COMPLETE
2678,0.3400944197454282,2025-04-24 23:53:11.717501,2025-04-24 23:53:29.206622,0 days 00:00:17.489121,False,absolute_error,42,sqrt,1,6,453,TPESampler,COMPLETE
2679,0.4203457915513677,2025-04-24 23:53:12.692233,2025-04-24 23:53:24.897758,0 days 00:00:12.205525,False,absolute_error,43,sqrt,2,5,473,TPESampler,COMPLETE
2680,0.3572789857011293,2025-04-24 23:53:17.331312,2025-04-24 23:53:25.260232,0 days 00:00:07.928920,True,absolute_error,46,sqrt,1,2,278,TPESampler,COMPLETE
2681,0.32739829658893466,2025-04-24 23:53:17.634770,2025-04-24 23:53:38.696484,0 days 00:00:21.061714,False,absolute_error,50,sqrt,1,4,475,TPESampler,COMPLETE
2682,0.34768962313179264,2025-04-24 23:53:24.146178,2025-04-24 23:53:36.783344,0 days 00:00:12.637166,False,absolute_error,41,sqrt,1,2,321,TPESampler,COMPLETE
2683,0.3320534440450857,2025-04-24 23:53:25.113870,2025-04-24 23:53:42.272177,0 days 00:00:17.158307,False,absolute_error,42,sqrt,1,5,449,TPESampler,COMPLETE
2684,0.41776092551595684,2025-04-24 23:53:25.425046,2025-04-24 23:53:40.059279,0 days 00:00:14.634233,False,absolute_error,43,sqrt,2,4,577,TPESampler,COMPLETE
2685,0.4156297788214841,2025-04-24 23:53:25.580358,2025-04-24 23:53:37.137468,0 days 00:00:11.557110,False,absolute_error,50,sqrt,2,4,433,TPESampler,COMPLETE
2686,0.42183313411612744,2025-04-24 23:53:29.460967,2025-04-24 23:53:40.455148,0 days 00:00:10.994181,False,absolute_error,50,sqrt,2,7,429,TPESampler,COMPLETE
2687,0.329520241865289,2025-04-24 23:53:37.005517,2025-04-24 23:53:48.210375,0 days 00:00:11.204858,False,absolute_error,42,sqrt,1,5,294,TPESampler,COMPLETE
2688,0.3328618966299558,2025-04-24 23:53:37.458171,2025-04-24 23:53:38.991424,0 days 00:00:01.533253,False,squared_error,50,sqrt,1,5,278,TPESampler,COMPLETE
2689,0.3457628983149689,2025-04-24 23:53:38.922778,2025-04-24 23:53:45.930371,0 days 00:00:07.007593,False,absolute_error,49,sqrt,1,2,152,TPESampler,COMPLETE
2690,0.3310151284360574,2025-04-24 23:53:39.239503,2025-04-24 23:53:57.131924,0 days 00:00:17.892421,False,absolute_error,45,sqrt,1,4,472,TPESampler,COMPLETE
2691,0.3805078033041965,2025-04-24 23:53:40.305056,2025-04-24 23:53:43.180521,0 days 00:00:02.875465,False,squared_error,45,log2,1,2,528,TPESampler,COMPLETE
2692,0.3366989137464111,2025-04-24 23:53:40.774471,2025-04-24 23:53:59.402798,0 days 00:00:18.628327,False,absolute_error,41,sqrt,1,4,488,TPESampler,COMPLETE
2693,0.3263073839909234,2025-04-24 23:53:42.499958,2025-04-24 23:53:56.862322,0 days 00:00:14.362364,False,absolute_error,50,sqrt,1,4,369,TPESampler,COMPLETE
2694,0.3318858287895401,2025-04-24 23:53:43.449154,2025-04-24 23:53:56.054335,0 days 00:00:12.605181,False,absolute_error,50,sqrt,1,3,313,TPESampler,COMPLETE
2695,0.33653242162198765,2025-04-24 23:53:46.153633,2025-04-24 23:54:07.586626,0 days 00:00:21.432993,False,absolute_error,44,sqrt,1,3,562,TPESampler,COMPLETE
2696,0.3403074693326856,2025-04-24 23:53:48.430808,2025-04-24 23:54:07.104482,0 days 00:00:18.673674,False,absolute_error,44,sqrt,1,7,464,TPESampler,COMPLETE
2697,0.34588811927089175,2025-04-24 23:53:56.353172,2025-04-24 23:54:17.080442,0 days 00:00:20.727270,False,absolute_error,50,sqrt,1,2,496,TPESampler,COMPLETE
2698,0.36686688567272974,2025-04-24 23:53:57.201869,2025-04-24 23:54:16.893534,0 days 00:00:19.691665,False,absolute_error,40,sqrt,1,12,541,TPESampler,COMPLETE
2699,0.4178600298460832,2025-04-24 23:53:57.451500,2025-04-24 23:53:59.460376,0 days 00:00:02.008876,False,squared_error,50,sqrt,2,3,569,TPESampler,COMPLETE
2700,0.41777072314187264,2025-04-24 23:53:59.892780,2025-04-24 23:54:13.923358,0 days 00:00:14.030578,False,absolute_error,43,sqrt,2,4,534,TPESampler,COMPLETE
2701,0.4168876958435949,2025-04-24 23:53:59.953304,2025-04-24 23:54:15.826990,0 days 00:00:15.873686,False,absolute_error,44,sqrt,2,4,513,TPESampler,COMPLETE
2702,0.44739452222438314,2025-04-24 23:54:07.319148,2025-04-24 23:56:08.651985,0 days 00:02:01.332837,False,absolute_error,40,,1,4,524,TPESampler,COMPLETE
2703,0.331147992256191,2025-04-24 23:54:07.849345,2025-04-24 23:54:27.182863,0 days 00:00:19.333518,False,absolute_error,45,sqrt,1,4,508,TPESampler,COMPLETE
2704,0.3492846564687039,2025-04-24 23:54:14.126233,2025-04-24 23:54:15.347846,0 days 00:00:01.221613,False,squared_error,36,sqrt,1,3,171,TPESampler,COMPLETE
2705,0.37705210018882773,2025-04-24 23:54:15.557046,2025-04-24 23:54:30.825066,0 days 00:00:15.268020,False,absolute_error,46,log2,1,2,469,TPESampler,COMPLETE
2706,0.7731532326905625,2025-04-24 23:54:16.044019,2025-04-24 23:54:17.617871,0 days 00:00:01.573852,False,absolute_error,41,log2,4,5,150,TPESampler,COMPLETE
2707,0.4561275064329794,2025-04-24 23:54:17.125183,2025-04-24 23:54:18.207521,0 days 00:00:01.082338,True,squared_error,48,sqrt,2,8,123,TPESampler,COMPLETE
2708,0.4244577206369953,2025-04-24 23:54:17.310304,2025-04-24 23:54:30.365210,0 days 00:00:13.054906,False,absolute_error,33,sqrt,2,2,488,TPESampler,COMPLETE
2709,0.360216956844694,2025-04-24 23:54:17.911468,2025-04-24 23:54:40.384073,0 days 00:00:22.472605,False,absolute_error,50,sqrt,1,15,611,TPESampler,COMPLETE
2710,0.3583724152908729,2025-04-24 23:54:18.471033,2025-04-24 23:54:30.527948,0 days 00:00:12.056915,True,absolute_error,40,sqrt,1,3,564,TPESampler,COMPLETE
2711,0.42715801953988014,2025-04-24 23:54:27.401422,2025-04-24 23:54:33.913581,0 days 00:00:06.512159,False,absolute_error,50,sqrt,2,17,234,TPESampler,COMPLETE
2712,0.411593007317191,2025-04-24 23:54:30.587318,2025-04-24 23:54:36.028110,0 days 00:00:05.440792,False,absolute_error,48,sqrt,2,2,181,TPESampler,COMPLETE
2713,0.43411659367131256,2025-04-24 23:54:30.772688,2025-04-24 23:54:46.011981,0 days 00:00:15.239293,True,absolute_error,44,,5,15,437,TPESampler,COMPLETE
2714,0.33988524358353434,2025-04-24 23:54:31.243842,2025-04-24 23:54:49.921357,0 days 00:00:18.677515,False,absolute_error,44,sqrt,1,6,497,TPESampler,COMPLETE
2715,0.3320136042823486,2025-04-24 23:54:34.132704,2025-04-24 23:54:52.568676,0 days 00:00:18.435972,False,absolute_error,50,sqrt,1,6,479,TPESampler,COMPLETE
2716,0.32733917274603885,2025-04-24 23:54:36.241289,2025-04-24 23:54:47.717747,0 days 00:00:11.476458,False,absolute_error,50,sqrt,1,4,293,TPESampler,COMPLETE
2717,0.3272406626455843,2025-04-24 23:54:40.621501,2025-04-24 23:54:48.266088,0 days 00:00:07.644587,False,absolute_error,50,sqrt,1,4,186,TPESampler,COMPLETE
2718,0.3825108110261121,2025-04-24 23:54:46.232799,2025-04-24 23:54:59.288109,0 days 00:00:13.055310,False,absolute_error,50,log2,1,6,458,TPESampler,COMPLETE
2719,0.3855347166685984,2025-04-24 23:54:47.933384,2025-04-24 23:56:05.185333,0 days 00:01:17.251949,False,absolute_error,50,,2,8,567,TPESampler,COMPLETE
2720,0.3454636838663603,2025-04-24 23:54:48.515632,2025-04-24 23:55:09.242962,0 days 00:00:20.727330,False,absolute_error,45,sqrt,1,2,533,TPESampler,COMPLETE
2721,0.3478447437492171,2025-04-24 23:54:50.135122,2025-04-24 23:54:59.833995,0 days 00:00:09.698873,False,absolute_error,43,sqrt,1,8,253,TPESampler,COMPLETE
2722,0.4193897255694075,2025-04-24 23:54:52.784243,2025-04-24 23:54:59.943868,0 days 00:00:07.159625,False,absolute_error,41,sqrt,2,5,276,TPESampler,COMPLETE
2723,0.332140843948749,2025-04-24 23:54:59.503458,2025-04-24 23:55:19.213519,0 days 00:00:19.710061,False,absolute_error,50,sqrt,1,3,510,TPESampler,COMPLETE
2724,0.33020850302797,2025-04-24 23:55:00.042831,2025-04-24 23:55:11.380062,0 days 00:00:11.337231,False,absolute_error,50,sqrt,1,6,280,TPESampler,COMPLETE
2725,0.42425173171505026,2025-04-24 23:55:00.223529,2025-04-24 23:55:19.007849,0 days 00:00:18.784320,False,absolute_error,43,sqrt,2,7,643,TPESampler,COMPLETE
2726,0.3517166413246497,2025-04-24 23:55:09.446929,2025-04-24 23:55:29.298827,0 days 00:00:19.851898,False,absolute_error,50,sqrt,1,11,538,TPESampler,COMPLETE
2727,0.3386696738262347,2025-04-24 23:55:11.599462,2025-04-24 23:55:35.405790,0 days 00:00:23.806328,False,absolute_error,44,sqrt,1,7,582,TPESampler,COMPLETE
2728,0.333118591323639,2025-04-24 23:55:19.212764,2025-04-24 23:55:36.496122,0 days 00:00:17.283358,False,absolute_error,43,sqrt,1,4,458,TPESampler,COMPLETE
2729,0.6209367392300971,2025-04-24 23:55:19.447819,2025-04-24 23:55:25.821776,0 days 00:00:06.373957,False,absolute_error,42,log2,2,3,516,TPESampler,COMPLETE
2730,0.3322095448870845,2025-04-24 23:55:26.048122,2025-04-24 23:55:45.987201,0 days 00:00:19.939079,False,absolute_error,43,sqrt,1,4,539,TPESampler,COMPLETE
2731,0.41145597859730576,2025-04-24 23:55:29.535004,2025-04-24 23:55:38.279048,0 days 00:00:08.744044,True,absolute_error,32,,2,36,111,TPESampler,COMPLETE
2732,0.33228257635337805,2025-04-24 23:55:35.615228,2025-04-24 23:55:56.633286,0 days 00:00:21.018058,False,absolute_error,50,sqrt,1,3,545,TPESampler,COMPLETE
2733,0.3378203291032072,2025-04-24 23:55:36.706560,2025-04-24 23:55:46.809390,0 days 00:00:10.102830,False,absolute_error,42,sqrt,1,3,255,TPESampler,COMPLETE
2734,0.33135603447719914,2025-04-24 23:55:38.500654,2025-04-24 23:55:54.880490,0 days 00:00:16.379836,False,absolute_error,50,sqrt,1,6,429,TPESampler,COMPLETE
2735,0.33796099803953883,2025-04-24 23:55:46.194969,2025-04-24 23:55:48.961437,0 days 00:00:02.766468,False,squared_error,45,sqrt,1,3,665,TPESampler,COMPLETE
2736,0.44738610287270764,2025-04-24 23:55:47.066444,2025-04-24 23:55:49.339578,0 days 00:00:02.273134,True,absolute_error,47,sqrt,2,4,126,TPESampler,COMPLETE
2737,0.41320180721861743,2025-04-24 23:55:49.179065,2025-04-24 23:56:34.765008,0 days 00:00:45.585943,False,absolute_error,47,,2,4,330,TPESampler,COMPLETE
2738,0.3319413108725524,2025-04-24 23:55:49.581814,2025-04-24 23:56:08.930786,0 days 00:00:19.348972,False,absolute_error,50,sqrt,1,6,506,TPESampler,COMPLETE
2739,0.39945567376453023,2025-04-24 23:55:55.114909,2025-04-24 23:55:56.924165,0 days 00:00:01.809256,False,squared_error,50,log2,1,9,623,TPESampler,COMPLETE
2740,0.33612759192200026,2025-04-24 23:55:56.847646,2025-04-24 23:56:16.275164,0 days 00:00:19.427518,False,absolute_error,45,sqrt,1,3,506,TPESampler,COMPLETE
2741,0.4238256509013178,2025-04-24 23:55:57.179386,2025-04-24 23:56:08.746227,0 days 00:00:11.566841,False,absolute_error,43,sqrt,2,8,463,TPESampler,COMPLETE
2742,0.4241625773273282,2025-04-24 23:56:05.404521,2025-04-24 23:56:21.482872,0 days 00:00:16.078351,False,absolute_error,49,sqrt,2,8,564,TPESampler,COMPLETE
2743,0.3582865897325588,2025-04-24 23:56:08.860209,2025-04-24 23:56:11.561603,0 days 00:00:02.701394,False,squared_error,41,sqrt,1,9,620,TPESampler,COMPLETE
2744,0.41681960289851167,2025-04-24 23:56:09.038386,2025-04-24 23:56:27.301082,0 days 00:00:18.262696,False,absolute_error,50,sqrt,2,4,589,TPESampler,COMPLETE
2745,0.41518441786932425,2025-04-24 23:56:09.176884,2025-04-24 23:56:23.042304,0 days 00:00:13.865420,False,absolute_error,49,sqrt,2,4,465,TPESampler,COMPLETE
2746,0.33935806431228577,2025-04-24 23:56:11.812760,2025-04-24 23:56:34.684800,0 days 00:00:22.872040,False,absolute_error,42,sqrt,1,3,516,TPESampler,COMPLETE
2747,0.41895852161513325,2025-04-24 23:56:16.503643,2025-04-24 23:56:28.876623,0 days 00:00:12.372980,False,absolute_error,50,sqrt,2,5,471,TPESampler,COMPLETE
2748,0.3568803207411866,2025-04-24 23:56:21.702325,2025-04-24 23:56:34.285280,0 days 00:00:12.582955,True,absolute_error,50,sqrt,1,5,520,TPESampler,COMPLETE
2749,0.4609842636108946,2025-04-24 23:56:23.263368,2025-04-24 23:56:26.097745,0 days 00:00:02.834377,True,squared_error,10,,1,46,620,TPESampler,COMPLETE
2750,0.32809337262632154,2025-04-24 23:56:26.316709,2025-04-24 23:56:32.581940,0 days 00:00:06.265231,False,absolute_error,50,sqrt,1,4,146,TPESampler,COMPLETE
2751,0.3262881044763513,2025-04-24 23:56:27.530794,2025-04-24 23:56:47.417580,0 days 00:00:19.886786,False,absolute_error,50,sqrt,1,5,513,TPESampler,COMPLETE
2752,0.3690063167512257,2025-04-24 23:56:29.084894,2025-04-24 23:56:30.527436,0 days 00:00:01.442542,True,squared_error,37,,2,2,108,TPESampler,COMPLETE
2753,0.3518289148186689,2025-04-24 23:56:30.737165,2025-04-24 23:56:52.305972,0 days 00:00:21.568807,False,absolute_error,44,sqrt,1,9,581,TPESampler,COMPLETE
2754,0.42017932627835797,2025-04-24 23:56:32.805446,2025-04-24 23:56:37.404721,0 days 00:00:04.599275,False,absolute_error,49,sqrt,2,8,157,TPESampler,COMPLETE
2755,0.35103744179383156,2025-04-24 23:56:34.491429,2025-04-24 23:56:44.963289,0 days 00:00:10.471860,False,absolute_error,42,sqrt,1,8,272,TPESampler,COMPLETE
2756,0.3395159132822085,2025-04-24 23:56:34.890452,2025-04-24 23:56:53.750473,0 days 00:00:18.860021,False,absolute_error,42,sqrt,1,3,491,TPESampler,COMPLETE
2757,0.33982495009404634,2025-04-24 23:56:35.040077,2025-04-24 23:56:49.033967,0 days 00:00:13.993890,False,absolute_error,41,sqrt,1,3,358,TPESampler,COMPLETE
2758,0.34176355670054426,2025-04-24 23:56:37.622650,2025-04-24 23:56:58.353371,0 days 00:00:20.730721,False,absolute_error,50,sqrt,1,8,549,TPESampler,COMPLETE
