number,value,datetime_start,datetime_complete,duration,params_bootstrap,params_criterion,params_max_depth,params_max_features,params_min_samples_leaf,params_min_samples_split,params_n_estimators,system_attrs_auto:sampler,state
3034,0.5425222132880374,2025-04-25 00:11:18.084686,2025-04-25 00:11:29.314529,0 days 00:00:11.229843,False,absolute_error,23,log2,1,25,535,TPESampler,COMPLETE
3035,0.42144010367141743,2025-04-25 00:11:19.247945,2025-04-25 00:11:20.695771,0 days 00:00:01.447826,False,squared_error,50,sqrt,2,9,491,TPESampler,COMPLETE
3036,0.6749687017882107,2025-04-25 00:11:20.906089,2025-04-25 00:11:22.517396,0 days 00:00:01.611307,False,squared_error,14,sqrt,8,25,980,TPESampler,COMPLETE
3037,0.32734299367587455,2025-04-25 00:11:22.735070,2025-04-25 00:11:35.540246,0 days 00:00:12.805176,False,absolute_error,50,sqrt,1,4,282,TPESampler,COMPLETE
3038,0.33938728578902033,2025-04-25 00:11:23.051567,2025-04-25 00:11:44.560499,0 days 00:00:21.508932,False,absolute_error,42,sqrt,1,3,563,TPESampler,COMPLETE
3039,0.5025109495657034,2025-04-25 00:11:29.533588,2025-04-25 00:12:09.328758,0 days 00:00:39.795170,True,absolute_error,5,,3,42,969,TPESampler,COMPLETE
3040,0.3366978574651455,2025-04-25 00:11:33.643366,2025-04-25 00:11:55.233091,0 days 00:00:21.589725,False,absolute_error,44,sqrt,1,3,577,TPESampler,COMPLETE
3041,0.4138066720573232,2025-04-25 00:11:35.760831,2025-04-25 00:11:43.653154,0 days 00:00:07.892323,False,absolute_error,50,sqrt,2,4,307,TPESampler,COMPLETE
3042,0.6164153707331824,2025-04-25 00:11:43.865093,2025-04-25 00:11:47.214818,0 days 00:00:03.349725,False,absolute_error,9,sqrt,4,14,239,TPESampler,COMPLETE
3043,0.3320870434001592,2025-04-25 00:11:44.904462,2025-04-25 00:12:04.730449,0 days 00:00:19.825987,False,absolute_error,50,sqrt,1,3,515,TPESampler,COMPLETE
3044,0.4097186890693473,2025-04-25 00:11:47.443085,2025-04-25 00:12:57.663547,0 days 00:01:10.220462,False,absolute_error,27,,2,5,505,TPESampler,COMPLETE
3045,0.33190131981070525,2025-04-25 00:11:49.520159,2025-04-25 00:12:07.453976,0 days 00:00:17.933817,False,absolute_error,42,sqrt,1,5,444,TPESampler,COMPLETE
3046,0.3412984901011386,2025-04-25 00:11:55.458308,2025-04-25 00:12:26.547318,0 days 00:00:31.089010,False,absolute_error,50,sqrt,1,8,684,TPESampler,COMPLETE
3047,0.41801797676118335,2025-04-25 00:12:04.948181,2025-04-25 00:12:25.944756,0 days 00:00:20.996575,False,absolute_error,50,sqrt,2,4,667,TPESampler,COMPLETE
3048,0.3588610149013671,2025-04-25 00:12:07.671430,2025-04-25 00:12:31.941625,0 days 00:00:24.270195,False,absolute_error,44,sqrt,1,12,578,TPESampler,COMPLETE
3049,0.64154374940319,2025-04-25 00:12:09.580589,2025-04-25 00:12:12.680350,0 days 00:00:03.099761,False,absolute_error,39,log2,2,10,199,TPESampler,COMPLETE
3050,0.33138738923447725,2025-04-25 00:12:12.899446,2025-04-25 00:12:36.072324,0 days 00:00:23.172878,False,absolute_error,44,sqrt,1,4,512,TPESampler,COMPLETE
3051,0.33978945512443925,2025-04-25 00:12:16.246834,2025-04-25 00:12:30.786002,0 days 00:00:14.539168,False,absolute_error,43,sqrt,1,6,390,TPESampler,COMPLETE
3052,0.365266425438414,2025-04-25 00:12:26.159061,2025-04-25 00:12:43.602713,0 days 00:00:17.443652,False,absolute_error,50,log2,1,4,607,TPESampler,COMPLETE
3053,0.7784160765271473,2025-04-25 00:12:26.819059,2025-04-25 00:12:28.221644,0 days 00:00:01.402585,True,squared_error,27,log2,3,26,651,TPESampler,COMPLETE
3054,0.33187896555342034,2025-04-25 00:12:28.470935,2025-04-25 00:12:54.245907,0 days 00:00:25.774972,False,absolute_error,50,sqrt,1,6,689,TPESampler,COMPLETE
3055,0.4131286372024616,2025-04-25 00:12:30.998153,2025-04-25 00:13:23.944459,0 days 00:00:52.946306,False,absolute_error,47,,2,2,385,TPESampler,COMPLETE
3056,0.32601342702797087,2025-04-25 00:12:32.152952,2025-04-25 00:12:51.113641,0 days 00:00:18.960689,False,absolute_error,50,sqrt,1,5,503,TPESampler,COMPLETE
3057,0.3321837277649159,2025-04-25 00:12:36.283434,2025-04-25 00:13:03.424884,0 days 00:00:27.141450,False,absolute_error,50,sqrt,1,3,655,TPESampler,COMPLETE
3058,0.34039034389411416,2025-04-25 00:12:43.998913,2025-04-25 00:13:02.866946,0 days 00:00:18.868033,False,absolute_error,44,sqrt,1,7,433,TPESampler,COMPLETE
3059,0.47491893418975384,2025-04-25 00:12:51.335632,2025-04-25 00:12:59.517938,0 days 00:00:08.182306,True,absolute_error,29,sqrt,2,45,557,TPESampler,COMPLETE
3060,0.42979870761181566,2025-04-25 00:12:54.647930,2025-04-25 00:13:08.113271,0 days 00:00:13.465341,False,absolute_error,32,sqrt,2,6,527,TPESampler,COMPLETE
3061,0.34752977321829526,2025-04-25 00:12:57.884893,2025-04-25 00:13:28.402467,0 days 00:00:30.517574,False,absolute_error,42,sqrt,1,2,804,TPESampler,COMPLETE
3062,0.34512255104244083,2025-04-25 00:12:59.750854,2025-04-25 00:13:01.817053,0 days 00:00:02.066199,False,squared_error,40,sqrt,1,5,590,TPESampler,COMPLETE
3063,0.35358621427027015,2025-04-25 00:13:02.037998,2025-04-25 00:13:24.804039,0 days 00:00:22.766041,False,absolute_error,33,sqrt,1,3,641,TPESampler,COMPLETE
3064,0.4132312323592708,2025-04-25 00:13:03.090416,2025-04-25 00:14:56.499066,0 days 00:01:53.408650,False,absolute_error,49,,2,2,769,TPESampler,COMPLETE
3065,0.34499326837441646,2025-04-25 00:13:03.687616,2025-04-25 00:13:10.600402,0 days 00:00:06.912786,False,absolute_error,41,sqrt,1,7,170,TPESampler,COMPLETE
3066,0.34274804681159543,2025-04-25 00:13:08.334525,2025-04-25 00:13:20.049986,0 days 00:00:11.715461,False,absolute_error,50,sqrt,1,10,310,TPESampler,COMPLETE
3067,0.46474269102363175,2025-04-25 00:13:10.824135,2025-04-25 00:15:16.567615,0 days 00:02:05.743480,False,absolute_error,38,,1,2,500,TPESampler,COMPLETE
3068,0.32597626710990724,2025-04-25 00:13:20.269900,2025-04-25 00:13:35.089844,0 days 00:00:14.819944,False,absolute_error,50,sqrt,1,4,384,TPESampler,COMPLETE
3069,0.34928444198288117,2025-04-25 00:13:24.161553,2025-04-25 00:13:44.533181,0 days 00:00:20.371628,False,absolute_error,43,sqrt,1,8,469,TPESampler,COMPLETE
3070,0.331900165306605,2025-04-25 00:13:25.241841,2025-04-25 00:13:48.973436,0 days 00:00:23.731595,False,absolute_error,43,sqrt,1,4,567,TPESampler,COMPLETE
3071,0.35597565533540876,2025-04-25 00:13:28.615010,2025-04-25 00:13:52.930871,0 days 00:00:24.315861,False,absolute_error,35,sqrt,1,6,703,TPESampler,COMPLETE
3072,0.4208853596025415,2025-04-25 00:13:35.312149,2025-04-25 00:13:51.665088,0 days 00:00:16.352939,False,absolute_error,50,sqrt,2,5,662,TPESampler,COMPLETE
3073,0.3445676684554714,2025-04-25 00:13:44.764748,2025-04-25 00:14:05.855053,0 days 00:00:21.090305,False,absolute_error,50,sqrt,1,10,571,TPESampler,COMPLETE
3074,0.3321711161292972,2025-04-25 00:13:49.182309,2025-04-25 00:14:12.841823,0 days 00:00:23.659514,False,absolute_error,42,sqrt,1,5,633,TPESampler,COMPLETE
3075,0.5127418447501043,2025-04-25 00:13:51.871365,2025-04-25 00:14:05.406971,0 days 00:00:13.535606,False,absolute_error,16,,15,23,452,TPESampler,COMPLETE
3076,0.33904774765798923,2025-04-25 00:13:53.163870,2025-04-25 00:14:12.994323,0 days 00:00:19.830453,False,absolute_error,45,sqrt,1,6,542,TPESampler,COMPLETE
3077,0.33214301895192433,2025-04-25 00:14:05.625155,2025-04-25 00:14:15.308191,0 days 00:00:09.683036,False,absolute_error,50,sqrt,1,3,239,TPESampler,COMPLETE
3078,0.35871324982197,2025-04-25 00:14:06.125895,2025-04-25 00:14:33.500908,0 days 00:00:27.375013,False,absolute_error,42,sqrt,1,10,746,TPESampler,COMPLETE
3079,0.6001389121606041,2025-04-25 00:14:13.061644,2025-04-25 00:14:21.920695,0 days 00:00:08.859051,False,absolute_error,30,sqrt,6,9,924,TPESampler,COMPLETE
3080,0.33872138393719703,2025-04-25 00:14:13.270467,2025-04-25 00:14:37.120435,0 days 00:00:23.849968,False,absolute_error,45,sqrt,1,6,654,TPESampler,COMPLETE
3081,0.32792900680269815,2025-04-25 00:14:15.516395,2025-04-25 00:14:36.281114,0 days 00:00:20.764719,False,absolute_error,50,sqrt,1,4,547,TPESampler,COMPLETE
3082,0.32834661488081707,2025-04-25 00:14:22.131479,2025-04-25 00:14:32.092454,0 days 00:00:09.960975,False,absolute_error,42,sqrt,1,4,261,TPESampler,COMPLETE
3083,0.32581499414478393,2025-04-25 00:14:32.303168,2025-04-25 00:14:50.104080,0 days 00:00:17.800912,False,absolute_error,50,sqrt,1,5,463,TPESampler,COMPLETE
3084,0.33205584364052904,2025-04-25 00:14:33.719582,2025-04-25 00:14:52.809723,0 days 00:00:19.090141,False,absolute_error,50,sqrt,1,3,492,TPESampler,COMPLETE
3085,0.43789532196437986,2025-04-25 00:14:36.495147,2025-04-25 00:14:46.564850,0 days 00:00:10.069703,False,absolute_error,35,sqrt,2,24,411,TPESampler,COMPLETE
3086,0.33152952828819515,2025-04-25 00:14:37.335992,2025-04-25 00:15:10.317982,0 days 00:00:32.981990,False,absolute_error,50,sqrt,1,6,641,TPESampler,COMPLETE
3087,0.36440891677052106,2025-04-25 00:14:46.774202,2025-04-25 00:14:48.985595,0 days 00:00:02.211393,True,squared_error,39,sqrt,1,2,501,TPESampler,COMPLETE
3088,0.33411472775406637,2025-04-25 00:14:49.204520,2025-04-25 00:15:03.278909,0 days 00:00:14.074389,False,absolute_error,50,sqrt,1,7,368,TPESampler,COMPLETE
3089,0.3267947990132838,2025-04-25 00:14:50.319054,2025-04-25 00:15:08.397271,0 days 00:00:18.078217,False,absolute_error,50,sqrt,1,4,450,TPESampler,COMPLETE
3090,0.5399669899092232,2025-04-25 00:14:53.022966,2025-04-25 00:15:03.027145,0 days 00:00:10.004179,True,absolute_error,5,,12,49,715,TPESampler,COMPLETE
3091,0.40872264474474607,2025-04-25 00:14:56.727377,2025-04-25 00:14:59.938631,0 days 00:00:03.211254,False,absolute_error,45,sqrt,2,3,106,TPESampler,COMPLETE
3092,0.4154821838581108,2025-04-25 00:15:00.158585,2025-04-25 00:15:09.788449,0 days 00:00:09.629864,False,absolute_error,44,sqrt,2,4,382,TPESampler,COMPLETE
3093,0.35237906787300344,2025-04-25 00:15:03.240847,2025-04-25 00:15:13.878959,0 days 00:00:10.638112,True,absolute_error,49,sqrt,1,4,413,TPESampler,COMPLETE
3094,0.42031376078343763,2025-04-25 00:15:03.536121,2025-04-25 00:15:18.364917,0 days 00:00:14.828796,False,absolute_error,50,sqrt,2,5,567,TPESampler,COMPLETE
3095,0.45523871738896404,2025-04-25 00:15:08.614394,2025-04-25 00:15:10.319453,0 days 00:00:01.705059,True,squared_error,39,log2,1,14,651,TPESampler,COMPLETE
3096,0.41907807512889206,2025-04-25 00:15:10.000285,2025-04-25 00:15:29.820142,0 days 00:00:19.819857,False,absolute_error,41,log2,1,8,631,TPESampler,COMPLETE
3097,0.43381050252124603,2025-04-25 00:15:10.670964,2025-04-25 00:15:14.814354,0 days 00:00:04.143390,True,squared_error,9,,1,2,759,TPESampler,COMPLETE
3098,0.8640145512592426,2025-04-25 00:15:10.795437,2025-04-25 00:15:12.059308,0 days 00:00:01.263871,True,squared_error,11,log2,9,29,245,TPESampler,COMPLETE
3099,0.41534205471091945,2025-04-25 00:15:12.278440,2025-04-25 00:16:02.187273,0 days 00:00:49.908833,True,absolute_error,16,,1,28,424,TPESampler,COMPLETE
3100,0.33130879931543855,2025-04-25 00:15:14.109830,2025-04-25 00:15:25.468325,0 days 00:00:11.358495,False,absolute_error,43,sqrt,1,4,298,TPESampler,COMPLETE
3101,0.32508296111345775,2025-04-25 00:15:15.021304,2025-04-25 00:15:37.886577,0 days 00:00:22.865273,False,absolute_error,50,sqrt,1,5,602,TPESampler,COMPLETE
3102,0.3468758006206227,2025-04-25 00:15:16.786212,2025-04-25 00:15:42.024934,0 days 00:00:25.238722,False,absolute_error,43,sqrt,1,2,577,TPESampler,COMPLETE
3103,0.3437557393137025,2025-04-25 00:15:18.578793,2025-04-25 00:15:48.264961,0 days 00:00:29.686168,False,absolute_error,50,sqrt,1,2,758,TPESampler,COMPLETE
3104,0.4204721119227887,2025-04-25 00:15:25.894717,2025-04-25 00:15:42.474475,0 days 00:00:16.579758,False,absolute_error,43,sqrt,2,6,438,TPESampler,COMPLETE
3105,0.3945845824842927,2025-04-25 00:15:30.027227,2025-04-25 00:15:33.454980,0 days 00:00:03.427753,False,absolute_error,48,log2,1,6,102,TPESampler,COMPLETE
3106,0.42215230498822487,2025-04-25 00:15:33.658626,2025-04-25 00:15:51.507161,0 days 00:00:17.848535,False,absolute_error,43,sqrt,2,5,725,TPESampler,COMPLETE
3107,0.3254993335087361,2025-04-25 00:15:38.099074,2025-04-25 00:16:05.867830,0 days 00:00:27.768756,False,absolute_error,50,sqrt,1,5,741,TPESampler,COMPLETE
3108,0.6144983677575567,2025-04-25 00:15:42.221559,2025-04-25 00:15:43.951294,0 days 00:00:01.729735,False,squared_error,39,log2,2,2,977,TPESampler,COMPLETE
3109,0.8727051438860471,2025-04-25 00:15:42.685833,2025-04-25 00:15:44.451120,0 days 00:00:01.765287,True,squared_error,37,log2,12,10,994,TPESampler,COMPLETE
3110,0.33868760525139485,2025-04-25 00:15:44.181662,2025-04-25 00:16:00.099836,0 days 00:00:15.918174,False,absolute_error,42,sqrt,1,3,416,TPESampler,COMPLETE
3111,0.42012617310593675,2025-04-25 00:15:44.661782,2025-04-25 00:15:58.141682,0 days 00:00:13.479900,False,absolute_error,38,sqrt,2,3,547,TPESampler,COMPLETE
3112,0.3404547845782611,2025-04-25 00:15:48.481571,2025-04-25 00:16:14.466258,0 days 00:00:25.984687,False,absolute_error,43,sqrt,1,6,596,TPESampler,COMPLETE
3113,0.3386597346199827,2025-04-25 00:15:51.712415,2025-04-25 00:16:18.343980,0 days 00:00:26.631565,False,absolute_error,43,sqrt,1,3,713,TPESampler,COMPLETE
3114,0.3449276952336022,2025-04-25 00:15:58.364448,2025-04-25 00:16:22.058893,0 days 00:00:23.694445,False,absolute_error,50,sqrt,1,2,599,TPESampler,COMPLETE
3115,0.7996615394711636,2025-04-25 00:16:00.337101,2025-04-25 00:16:01.708662,0 days 00:00:01.371561,False,squared_error,16,log2,5,13,960,TPESampler,COMPLETE
3116,0.32657271980950225,2025-04-25 00:16:01.922799,2025-04-25 00:16:24.340605,0 days 00:00:22.417806,False,absolute_error,50,sqrt,1,4,589,TPESampler,COMPLETE
3117,0.4254895499783859,2025-04-25 00:16:02.445617,2025-04-25 00:16:17.812268,0 days 00:00:15.366651,False,absolute_error,50,sqrt,2,9,448,TPESampler,COMPLETE
3118,0.4160636531170235,2025-04-25 00:16:06.071284,2025-04-25 00:16:17.958260,0 days 00:00:11.886976,False,absolute_error,50,sqrt,2,3,474,TPESampler,COMPLETE
3119,0.3322350890276252,2025-04-25 00:16:14.679822,2025-04-25 00:16:37.261002,0 days 00:00:22.581180,False,absolute_error,50,sqrt,1,3,543,TPESampler,COMPLETE
3120,0.4103099585827041,2025-04-25 00:16:18.027565,2025-04-25 00:16:20.049289,0 days 00:00:02.021724,True,squared_error,24,sqrt,1,4,565,TPESampler,COMPLETE
3121,0.32673875549876363,2025-04-25 00:16:18.201138,2025-04-25 00:16:44.953112,0 days 00:00:26.751974,False,absolute_error,50,sqrt,1,4,651,TPESampler,COMPLETE
3122,0.3313673873090236,2025-04-25 00:16:18.651293,2025-04-25 00:16:36.602048,0 days 00:00:17.950755,False,absolute_error,50,sqrt,1,3,371,TPESampler,COMPLETE
3123,0.32495912067838995,2025-04-25 00:16:20.263358,2025-04-25 00:16:34.927140,0 days 00:00:14.663782,False,absolute_error,50,sqrt,1,5,384,TPESampler,COMPLETE
3124,0.41862586510619026,2025-04-25 00:16:22.265913,2025-04-25 00:16:39.615132,0 days 00:00:17.349219,False,absolute_error,44,sqrt,2,3,637,TPESampler,COMPLETE
3125,0.3322138250167629,2025-04-25 00:16:24.730831,2025-04-25 00:16:48.772852,0 days 00:00:24.042021,False,absolute_error,43,sqrt,1,5,597,TPESampler,COMPLETE
3126,0.33804172814802314,2025-04-25 00:16:35.150822,2025-04-25 00:16:51.674520,0 days 00:00:16.523698,False,absolute_error,43,sqrt,1,3,430,TPESampler,COMPLETE
3127,0.5280788599588387,2025-04-25 00:16:36.814068,2025-04-25 00:16:40.578438,0 days 00:00:03.764370,False,squared_error,5,,6,3,925,TPESampler,COMPLETE
3128,0.41577463170480805,2025-04-25 00:16:37.535388,2025-04-25 00:16:49.685407,0 days 00:00:12.150019,False,absolute_error,50,sqrt,2,4,481,TPESampler,COMPLETE
3129,0.3390774452067179,2025-04-25 00:16:39.830823,2025-04-25 00:17:08.734364,0 days 00:00:28.903541,False,absolute_error,43,sqrt,1,3,686,TPESampler,COMPLETE
3130,0.33282804541508954,2025-04-25 00:16:40.789407,2025-04-25 00:16:50.832889,0 days 00:00:10.043482,False,absolute_error,50,sqrt,1,7,255,TPESampler,COMPLETE
3131,0.8292163883258095,2025-04-25 00:16:45.172068,2025-04-25 00:16:46.501964,0 days 00:00:01.329896,False,squared_error,34,log2,7,2,942,TPESampler,COMPLETE
3132,0.37054705035774954,2025-04-25 00:16:46.706679,2025-04-25 00:17:09.016297,0 days 00:00:22.309618,False,absolute_error,50,log2,1,2,695,TPESampler,COMPLETE
3133,0.3352987071456863,2025-04-25 00:16:48.984520,2025-04-25 00:16:50.695776,0 days 00:00:01.711256,False,squared_error,43,sqrt,1,4,393,TPESampler,COMPLETE
3134,0.4176327908691215,2025-04-25 00:16:49.896585,2025-04-25 00:17:04.927363,0 days 00:00:15.030778,False,absolute_error,43,sqrt,2,3,573,TPESampler,COMPLETE
3135,0.42740995129907755,2025-04-25 00:16:50.908416,2025-04-25 00:17:06.286686,0 days 00:00:15.378270,False,absolute_error,43,sqrt,2,10,615,TPESampler,COMPLETE
3136,0.32637641512563803,2025-04-25 00:16:51.046357,2025-04-25 00:17:18.439824,0 days 00:00:27.393467,False,absolute_error,50,sqrt,1,4,618,TPESampler,COMPLETE
3137,0.33158046832452426,2025-04-25 00:16:52.038179,2025-04-25 00:17:08.294526,0 days 00:00:16.256347,False,absolute_error,50,sqrt,1,3,325,TPESampler,COMPLETE
3138,0.8223676326467251,2025-04-25 00:17:05.140716,2025-04-25 00:17:06.655806,0 days 00:00:01.515090,True,absolute_error,18,log2,4,48,382,TPESampler,COMPLETE
3139,0.6641906087791671,2025-04-25 00:17:06.500180,2025-04-25 00:17:10.722363,0 days 00:00:04.222183,True,absolute_error,39,sqrt,5,9,737,TPESampler,COMPLETE
3140,0.3487326001168018,2025-04-25 00:17:06.885016,2025-04-25 00:17:28.006120,0 days 00:00:21.121104,False,absolute_error,43,sqrt,1,8,573,TPESampler,COMPLETE
3141,0.7174113338898134,2025-04-25 00:17:08.503355,2025-04-25 00:17:09.734215,0 days 00:00:01.230860,False,squared_error,11,log2,2,2,195,TPESampler,COMPLETE
3142,0.4202441965458404,2025-04-25 00:17:09.020294,2025-04-25 00:17:20.516068,0 days 00:00:11.495774,False,absolute_error,50,sqrt,2,6,443,TPESampler,COMPLETE
3143,0.3310338716202925,2025-04-25 00:17:09.326815,2025-04-25 00:17:33.045149,0 days 00:00:23.718334,False,absolute_error,50,sqrt,1,6,616,TPESampler,COMPLETE
3144,0.3363751951729995,2025-04-25 00:17:10.117119,2025-04-25 00:17:28.262463,0 days 00:00:18.145344,False,absolute_error,50,sqrt,1,7,473,TPESampler,COMPLETE
3145,0.41783433031286693,2025-04-25 00:17:10.960254,2025-04-25 00:17:33.064337,0 days 00:00:22.104083,False,absolute_error,50,sqrt,2,3,787,TPESampler,COMPLETE
3146,0.3312833625464561,2025-04-25 00:17:18.647862,2025-04-25 00:17:32.277504,0 days 00:00:13.629642,False,absolute_error,42,sqrt,1,4,363,TPESampler,COMPLETE
3147,0.7579611766931749,2025-04-25 00:17:20.727146,2025-04-25 00:17:21.698214,0 days 00:00:00.971068,False,squared_error,13,sqrt,13,26,355,TPESampler,COMPLETE
3148,0.33293375093786093,2025-04-25 00:17:21.911525,2025-04-25 00:17:47.141356,0 days 00:00:25.229831,False,absolute_error,43,sqrt,1,5,689,TPESampler,COMPLETE
3149,0.3434361582555154,2025-04-25 00:17:28.218650,2025-04-25 00:17:48.093069,0 days 00:00:19.874419,False,absolute_error,50,sqrt,1,9,536,TPESampler,COMPLETE
3150,0.44788158708961834,2025-04-25 00:17:28.615764,2025-04-25 00:20:20.441987,0 days 00:02:51.826223,False,absolute_error,50,,1,5,703,TPESampler,COMPLETE
3151,0.603546962429357,2025-04-25 00:17:32.481574,2025-04-25 00:17:39.566740,0 days 00:00:07.085166,True,absolute_error,23,sqrt,4,50,918,TPESampler,COMPLETE
3152,0.3251329072827328,2025-04-25 00:17:33.597154,2025-04-25 00:17:43.010432,0 days 00:00:09.413278,False,absolute_error,50,sqrt,1,5,227,TPESampler,COMPLETE
3153,0.4682910656932147,2025-04-25 00:17:33.645221,2025-04-25 00:19:54.913896,0 days 00:02:21.268675,False,absolute_error,50,,1,3,609,TPESampler,COMPLETE
3154,0.33221849873840165,2025-04-25 00:17:39.774426,2025-04-25 00:18:05.074265,0 days 00:00:25.299839,False,absolute_error,50,sqrt,1,3,658,TPESampler,COMPLETE
3155,0.3409674664698077,2025-04-25 00:17:43.271981,2025-04-25 00:18:04.244599,0 days 00:00:20.972618,False,absolute_error,42,sqrt,1,6,570,TPESampler,COMPLETE
3156,0.6246899339145967,2025-04-25 00:17:47.526695,2025-04-25 00:17:52.915430,0 days 00:00:05.388735,False,absolute_error,34,log2,2,3,348,TPESampler,COMPLETE
3157,0.4193152604240868,2025-04-25 00:17:48.590402,2025-04-25 00:17:57.244985,0 days 00:00:08.654583,False,absolute_error,42,sqrt,2,6,313,TPESampler,COMPLETE
3158,0.33814953155184335,2025-04-25 00:17:53.212274,2025-04-25 00:17:58.701493,0 days 00:00:05.489219,False,absolute_error,40,sqrt,1,5,128,TPESampler,COMPLETE
3159,0.33596736745101125,2025-04-25 00:17:57.455026,2025-04-25 00:18:17.858888,0 days 00:00:20.403862,False,absolute_error,50,sqrt,1,7,549,TPESampler,COMPLETE
3160,0.4167876784127251,2025-04-25 00:17:58.922294,2025-04-25 00:18:09.717602,0 days 00:00:10.795308,False,absolute_error,43,sqrt,2,3,429,TPESampler,COMPLETE
3161,0.6670750778091243,2025-04-25 00:18:04.452953,2025-04-25 00:18:11.355401,0 days 00:00:06.902448,False,absolute_error,6,sqrt,2,3,593,TPESampler,COMPLETE
3162,0.42031376078343763,2025-04-25 00:18:05.479136,2025-04-25 00:18:19.525116,0 days 00:00:14.045980,False,absolute_error,50,sqrt,2,5,567,TPESampler,COMPLETE
3163,0.3393659256710345,2025-04-25 00:18:09.931471,2025-04-25 00:18:29.278334,0 days 00:00:19.346863,False,absolute_error,42,sqrt,1,3,519,TPESampler,COMPLETE
3164,0.3264697198130573,2025-04-25 00:18:11.564173,2025-04-25 00:18:41.649037,0 days 00:00:30.084864,False,absolute_error,50,sqrt,1,4,750,TPESampler,COMPLETE
3165,0.33211643651572936,2025-04-25 00:18:18.072580,2025-04-25 00:18:38.090275,0 days 00:00:20.017695,False,absolute_error,50,sqrt,1,3,521,TPESampler,COMPLETE
3166,0.34085522012478664,2025-04-25 00:18:19.736302,2025-04-25 00:18:47.811083,0 days 00:00:28.074781,False,absolute_error,43,sqrt,1,6,733,TPESampler,COMPLETE
3167,0.4239749805773036,2025-04-25 00:18:29.491214,2025-04-25 00:18:45.148582,0 days 00:00:15.657368,False,absolute_error,50,sqrt,2,8,639,TPESampler,COMPLETE
3168,0.32637869933670005,2025-04-25 00:18:38.304733,2025-04-25 00:19:06.339286,0 days 00:00:28.034553,False,absolute_error,50,sqrt,1,5,514,TPESampler,COMPLETE
3169,0.6310725895326189,2025-04-25 00:18:41.863212,2025-04-25 00:18:45.427581,0 days 00:00:03.564369,False,absolute_error,13,log2,1,4,220,TPESampler,COMPLETE
3170,0.40155288198948436,2025-04-25 00:18:45.361526,2025-04-25 00:18:46.357650,0 days 00:00:00.996124,False,squared_error,45,log2,1,7,142,TPESampler,COMPLETE
