number,value,datetime_start,datetime_complete,duration,params_bootstrap,params_criterion,params_max_depth,params_max_features,params_min_samples_leaf,params_min_samples_split,params_n_estimators,system_attrs_auto:sampler,state
0,0.6192594525299817,2025-04-24 21:11:16.046530,2025-04-24 21:11:20.682303,0 days 00:00:04.635773,True,absolute_error,8,sqrt,1,3,331,RandomSampler,COMPLETE
1,0.35220585927035614,2025-04-24 21:11:16.063947,2025-04-24 21:11:31.321393,0 days 00:00:15.257446,True,absolute_error,47,sqrt,1,3,569,RandomSampler,COMPLETE
2,0.7050716695120895,2025-04-24 21:11:16.137030,2025-04-24 21:11:17.351444,0 days 00:00:01.214414,True,squared_error,42,sqrt,6,34,376,RandomSampler,COMPLETE
3,0.537113088648637,2025-04-24 21:11:17.622317,2025-04-24 21:11:23.299111,0 days 00:00:05.676794,True,absolute_error,15,sqrt,2,48,448,TPESampler,COMPLETE
4,0.43889491410504433,2025-04-24 21:11:20.864086,2025-04-24 21:11:24.674916,0 days 00:00:03.810830,False,squared_error,50,,3,4,490,TPESampler,COMPLETE
5,0.5600137597069029,2025-04-24 21:11:23.473392,2025-04-24 21:11:32.229980,0 days 00:00:08.756588,True,absolute_error,21,log2,1,10,665,TPESampler,COMPLETE
6,0.645583508417306,2025-04-24 21:11:24.867597,2025-04-24 21:11:25.710541,0 days 00:00:00.842944,True,squared_error,12,log2,1,2,206,TPESampler,COMPLETE
7,0.8123308535362348,2025-04-24 21:11:25.889117,2025-04-24 21:11:28.149718,0 days 00:00:02.260601,True,absolute_error,39,sqrt,13,15,844,TPESampler,COMPLETE
8,0.863562659622611,2025-04-24 21:11:28.352380,2025-04-24 21:11:29.401243,0 days 00:00:01.048863,True,absolute_error,31,log2,10,27,346,TPESampler,COMPLETE
9,0.47293833568113863,2025-04-24 21:11:29.607400,2025-04-24 21:11:41.687563,0 days 00:00:12.080163,True,absolute_error,32,log2,1,7,831,TPESampler,COMPLETE
10,0.45636381166531553,2025-04-24 21:11:31.499720,2025-04-24 21:14:39.681220,0 days 00:03:08.181500,False,absolute_error,44,,1,19,767,TPESampler,COMPLETE
11,0.3992444448318815,2025-04-24 21:11:32.414805,2025-04-24 21:11:36.855694,0 days 00:00:04.440889,False,squared_error,47,,1,3,402,TPESampler,COMPLETE
12,0.4183351682108911,2025-04-24 21:11:37.054115,2025-04-24 21:11:39.198590,0 days 00:00:02.144475,False,squared_error,44,sqrt,2,4,951,TPESampler,COMPLETE
13,0.5228405460126457,2025-04-24 21:11:39.375000,2025-04-24 21:11:43.338738,0 days 00:00:03.963738,True,absolute_error,49,sqrt,3,2,349,TPESampler,COMPLETE
14,0.4641661478654133,2025-04-24 21:11:41.882048,2025-04-24 21:12:55.639133,0 days 00:01:13.757085,False,absolute_error,36,,1,3,305,TPESampler,COMPLETE
15,0.363850233798934,2025-04-24 21:11:43.520323,2025-04-24 21:11:49.134908,0 days 00:00:05.614585,True,squared_error,42,,1,2,656,TPESampler,COMPLETE
16,0.36411619458913247,2025-04-24 21:11:49.311648,2025-04-24 21:11:56.307483,0 days 00:00:06.995835,True,squared_error,38,,1,2,846,TPESampler,COMPLETE
17,0.3550145980123331,2025-04-24 21:11:56.518058,2025-04-24 21:12:15.317100,0 days 00:00:18.799042,True,absolute_error,45,sqrt,1,3,801,TPESampler,COMPLETE
18,0.36389881597168516,2025-04-24 21:12:15.514897,2025-04-24 21:12:33.500308,0 days 00:00:17.985411,True,absolute_error,47,sqrt,1,6,736,TPESampler,COMPLETE
19,0.5266197944769144,2025-04-24 21:12:33.702206,2025-04-24 21:12:42.263317,0 days 00:00:08.561111,True,absolute_error,31,sqrt,3,2,658,TPESampler,COMPLETE
20,0.7816058092734199,2025-04-24 21:12:42.437289,2025-04-24 21:12:46.504212,0 days 00:00:04.066923,True,absolute_error,42,log2,3,2,943,TPESampler,COMPLETE
21,0.41130144339123986,2025-04-24 21:12:46.762067,2025-04-24 21:12:56.893585,0 days 00:00:10.131518,True,absolute_error,38,sqrt,1,23,446,TPESampler,COMPLETE
22,0.4068179464895896,2025-04-24 21:12:55.941431,2025-04-24 21:12:58.486108,0 days 00:00:02.544677,True,squared_error,39,sqrt,1,22,846,TPESampler,COMPLETE
23,0.6861440765496392,2025-04-24 21:12:57.134689,2025-04-24 21:12:58.485098,0 days 00:00:01.350409,True,squared_error,44,log2,2,3,484,TPESampler,COMPLETE
24,0.3429093996812772,2025-04-24 21:12:58.639723,2025-04-24 21:13:25.882921,0 days 00:00:27.243198,False,absolute_error,39,sqrt,1,3,608,TPESampler,COMPLETE
25,0.3576337787290167,2025-04-24 21:12:58.688354,2025-04-24 21:14:15.473377,0 days 00:01:16.785023,True,absolute_error,37,,1,2,525,TPESampler,COMPLETE
26,0.3451095565126864,2025-04-24 21:13:26.055887,2025-04-24 21:13:52.923123,0 days 00:00:26.867236,False,absolute_error,45,sqrt,1,2,616,TPESampler,COMPLETE
27,0.3694568686611754,2025-04-24 21:13:53.108804,2025-04-24 21:14:18.086409,0 days 00:00:24.977605,False,absolute_error,49,log2,1,2,697,TPESampler,COMPLETE
28,0.4225339871759917,2025-04-24 21:14:15.678095,2025-04-24 21:14:33.324484,0 days 00:00:17.646389,False,absolute_error,38,sqrt,2,2,734,TPESampler,COMPLETE
29,0.34368391763942374,2025-04-24 21:14:18.278194,2025-04-24 21:14:38.056891,0 days 00:00:19.778697,False,absolute_error,41,sqrt,1,6,547,TPESampler,COMPLETE
30,0.3456097693239724,2025-04-24 21:14:33.513441,2025-04-24 21:14:36.965078,0 days 00:00:03.451637,False,squared_error,49,sqrt,1,2,668,TPESampler,COMPLETE
31,0.3451287151229186,2025-04-24 21:14:37.139655,2025-04-24 21:14:39.922310,0 days 00:00:02.782655,False,squared_error,41,sqrt,1,3,658,TPESampler,COMPLETE
32,0.3515082643125971,2025-04-24 21:14:38.234913,2025-04-24 21:14:59.410526,0 days 00:00:21.175613,False,absolute_error,42,sqrt,1,8,584,TPESampler,COMPLETE
33,0.4068622831218431,2025-04-24 21:14:39.866637,2025-04-24 21:14:41.880852,0 days 00:00:02.014215,False,squared_error,24,sqrt,1,8,683,TPESampler,COMPLETE
34,0.4266094580932766,2025-04-24 21:14:40.192614,2025-04-24 21:14:54.125100,0 days 00:00:13.932486,False,absolute_error,19,sqrt,1,3,474,TPESampler,COMPLETE
35,0.3470282433447185,2025-04-24 21:14:42.057757,2025-04-24 21:14:58.071775,0 days 00:00:16.014018,False,absolute_error,44,sqrt,1,2,410,TPESampler,COMPLETE
36,0.41978259376109733,2025-04-24 21:14:54.299055,2025-04-24 21:15:07.283252,0 days 00:00:12.984197,False,absolute_error,34,log2,1,4,516,TPESampler,COMPLETE
37,0.3590746401043625,2025-04-24 21:14:58.240776,2025-04-24 21:15:01.468360,0 days 00:00:03.227584,False,squared_error,33,sqrt,1,2,701,TPESampler,COMPLETE
38,0.3508994431447578,2025-04-24 21:14:59.585908,2025-04-24 21:15:01.254315,0 days 00:00:01.668407,False,squared_error,48,sqrt,1,9,481,TPESampler,COMPLETE
39,0.34286889365025774,2025-04-24 21:15:01.523574,2025-04-24 21:15:29.004002,0 days 00:00:27.480428,False,absolute_error,49,sqrt,1,2,692,TPESampler,COMPLETE
40,0.4685945513863286,2025-04-24 21:15:01.750552,2025-04-24 21:17:33.634238,0 days 00:02:31.883686,False,absolute_error,49,,1,3,661,TPESampler,COMPLETE
41,0.7189205802427817,2025-04-24 21:15:07.450214,2025-04-24 21:15:09.772194,0 days 00:00:02.321980,False,absolute_error,41,log2,3,25,253,TPESampler,COMPLETE
42,0.8396580669772657,2025-04-24 21:15:09.938235,2025-04-24 21:15:11.453764,0 days 00:00:01.515529,True,squared_error,9,log2,5,9,967,TPESampler,COMPLETE
43,0.3859504594048934,2025-04-24 21:15:11.642805,2025-04-24 21:15:18.891608,0 days 00:00:07.248803,False,squared_error,31,,1,4,761,TPESampler,COMPLETE
44,0.33844997175972236,2025-04-24 21:15:19.080176,2025-04-24 21:15:21.387329,0 days 00:00:02.307153,False,squared_error,49,sqrt,1,3,551,TPESampler,COMPLETE
45,0.34627780844272765,2025-04-24 21:15:21.573570,2025-04-24 21:15:23.729030,0 days 00:00:02.155460,False,squared_error,42,sqrt,1,2,396,TPESampler,COMPLETE
46,0.7498736583082792,2025-04-24 21:15:23.902870,2025-04-24 21:15:25.653063,0 days 00:00:01.750193,False,absolute_error,7,log2,1,6,147,TPESampler,COMPLETE
47,0.37322705127176425,2025-04-24 21:15:25.824014,2025-04-24 21:15:27.855745,0 days 00:00:02.031731,False,squared_error,47,log2,1,3,543,TPESampler,COMPLETE
48,0.45022507707178105,2025-04-24 21:15:28.034433,2025-04-24 21:15:29.549718,0 days 00:00:01.515285,True,squared_error,46,sqrt,2,3,496,TPESampler,COMPLETE
49,0.3314706144468613,2025-04-24 21:15:29.200380,2025-04-24 21:15:57.277044,0 days 00:00:28.076664,False,absolute_error,45,sqrt,1,5,753,TPESampler,COMPLETE
50,0.3446163596474882,2025-04-24 21:15:29.994023,2025-04-24 21:15:51.982441,0 days 00:00:21.988418,False,absolute_error,45,sqrt,1,2,573,TPESampler,COMPLETE
51,0.4306348918560843,2025-04-24 21:15:52.191636,2025-04-24 21:16:01.956079,0 days 00:00:09.764443,False,absolute_error,31,sqrt,2,6,372,TPESampler,COMPLETE
52,0.34551345899928476,2025-04-24 21:15:57.451173,2025-04-24 21:16:29.112528,0 days 00:00:31.661355,False,absolute_error,36,sqrt,1,5,881,TPESampler,COMPLETE
53,0.3302283059075371,2025-04-24 21:16:02.134640,2025-04-24 21:16:28.745414,0 days 00:00:26.610774,False,absolute_error,48,sqrt,1,5,698,TPESampler,COMPLETE
54,0.3328867710227215,2025-04-24 21:16:28.912233,2025-04-24 21:17:01.028229,0 days 00:00:32.115996,False,absolute_error,50,sqrt,1,6,876,TPESampler,COMPLETE
55,0.40937334866009045,2025-04-24 21:16:29.339241,2025-04-24 21:18:12.856727,0 days 00:01:43.517486,False,absolute_error,35,,2,5,760,TPESampler,COMPLETE
56,0.3816336903613663,2025-04-24 21:17:01.220525,2025-04-24 21:17:28.014860,0 days 00:00:26.794335,False,absolute_error,50,log2,1,6,975,TPESampler,COMPLETE
57,0.33669982762933176,2025-04-24 21:17:28.180230,2025-04-24 21:17:59.937748,0 days 00:00:31.757518,False,absolute_error,47,sqrt,1,7,868,TPESampler,COMPLETE
58,0.4293557681776437,2025-04-24 21:17:33.792630,2025-04-24 21:17:52.759441,0 days 00:00:18.966811,False,absolute_error,49,sqrt,2,13,794,TPESampler,COMPLETE
59,0.33593274720529676,2025-04-24 21:17:53.071880,2025-04-24 21:18:25.232103,0 days 00:00:32.160223,False,absolute_error,46,sqrt,1,3,803,TPESampler,COMPLETE
60,0.3888428133401333,2025-04-24 21:17:56.923041,2025-04-24 21:18:05.347120,0 days 00:00:08.424079,False,squared_error,50,,1,7,761,TPESampler,COMPLETE
61,0.7032189966487011,2025-04-24 21:17:56.977951,2025-04-24 21:17:59.262932,0 days 00:00:02.284981,False,squared_error,37,sqrt,9,3,576,TPESampler,COMPLETE
62,0.8752186927065658,2025-04-24 21:17:57.042261,2025-04-24 21:17:59.109576,0 days 00:00:02.067315,True,squared_error,10,log2,14,4,217,TPESampler,COMPLETE
63,0.3657655563584249,2025-04-24 21:17:59.269009,2025-04-24 21:18:00.795209,0 days 00:00:01.526200,True,squared_error,31,,1,7,138,TPESampler,COMPLETE
64,0.5013745140187416,2025-04-24 21:17:59.457044,2025-04-24 21:18:01.939307,0 days 00:00:02.482263,True,squared_error,22,,10,16,449,TPESampler,COMPLETE
65,0.41805584342601937,2025-04-24 21:18:00.133611,2025-04-24 21:18:22.417733,0 days 00:00:22.284122,False,absolute_error,50,sqrt,2,4,923,TPESampler,COMPLETE
66,0.3778849324483718,2025-04-24 21:18:00.969484,2025-04-24 21:18:35.486239,0 days 00:00:34.516755,False,absolute_error,43,sqrt,1,20,974,TPESampler,COMPLETE
67,0.32977836635222313,2025-04-24 21:18:02.104888,2025-04-24 21:18:31.945850,0 days 00:00:29.840962,False,absolute_error,48,sqrt,1,5,805,TPESampler,COMPLETE
68,0.3500384067212231,2025-04-24 21:18:05.533753,2025-04-24 21:18:07.908499,0 days 00:00:02.374746,False,squared_error,47,sqrt,1,9,856,TPESampler,COMPLETE
69,0.48247081432247857,2025-04-24 21:18:08.069162,2025-04-24 21:18:10.151328,0 days 00:00:02.082166,True,squared_error,5,,1,6,563,TPESampler,COMPLETE
70,0.43957837679198564,2025-04-24 21:18:10.315232,2025-04-24 21:21:12.038133,0 days 00:03:01.722901,False,absolute_error,49,,1,9,779,TPESampler,COMPLETE
71,0.8733839962721278,2025-04-24 21:18:13.029959,2025-04-24 21:18:14.284249,0 days 00:00:01.254290,True,squared_error,30,log2,13,2,724,TPESampler,COMPLETE
72,0.3414216208628044,2025-04-24 21:18:14.444448,2025-04-24 21:18:41.280165,0 days 00:00:26.835717,False,absolute_error,50,sqrt,1,8,687,TPESampler,COMPLETE
73,0.614676832767233,2025-04-24 21:18:22.572441,2025-04-24 21:18:24.290675,0 days 00:00:01.718234,True,squared_error,8,sqrt,1,4,950,TPESampler,COMPLETE
74,0.49397985036643244,2025-04-24 21:18:24.459820,2025-04-24 21:18:38.684230,0 days 00:00:14.224410,True,absolute_error,7,,9,2,677,TPESampler,COMPLETE
75,0.34834464255781133,2025-04-24 21:18:25.405763,2025-04-24 21:19:00.303732,0 days 00:00:34.897969,False,absolute_error,40,sqrt,1,2,893,TPESampler,COMPLETE
76,0.32752235912964206,2025-04-24 21:18:32.127608,2025-04-24 21:19:05.001725,0 days 00:00:32.874117,False,absolute_error,48,sqrt,1,4,823,TPESampler,COMPLETE
77,0.3454433448703571,2025-04-24 21:18:35.647844,2025-04-24 21:19:19.524469,0 days 00:00:43.876625,False,absolute_error,47,sqrt,1,8,981,TPESampler,COMPLETE
78,0.3274676361269366,2025-04-24 21:18:38.854693,2025-04-24 21:19:09.846480,0 days 00:00:30.991787,False,absolute_error,48,sqrt,1,4,801,TPESampler,COMPLETE
79,0.8607838705920127,2025-04-24 21:18:41.455659,2025-04-24 21:18:42.836066,0 days 00:00:01.380407,False,absolute_error,12,log2,13,6,494,TPESampler,COMPLETE
80,0.5594209119620546,2025-04-24 21:18:43.007427,2025-04-24 21:18:44.039917,0 days 00:00:01.032490,True,squared_error,47,,15,4,172,TPESampler,COMPLETE
81,0.43456436895747685,2025-04-24 21:18:44.243454,2025-04-24 21:18:45.831778,0 days 00:00:01.588324,False,squared_error,27,,4,2,186,TPESampler,COMPLETE
82,0.3410065953705816,2025-04-24 21:18:45.992689,2025-04-24 21:19:10.759926,0 days 00:00:24.767237,False,absolute_error,50,sqrt,1,8,573,TPESampler,COMPLETE
83,0.3799526964115316,2025-04-24 21:19:00.475587,2025-04-24 21:19:24.407210,0 days 00:00:23.931623,True,absolute_error,48,sqrt,1,11,999,TPESampler,COMPLETE
84,0.5944587939418184,2025-04-24 21:19:05.176665,2025-04-24 21:19:05.833875,0 days 00:00:00.657210,False,squared_error,33,sqrt,6,12,131,TPESampler,COMPLETE
85,0.46119253617305633,2025-04-24 21:19:06.020105,2025-04-24 21:19:20.691785,0 days 00:00:14.671680,False,absolute_error,38,sqrt,3,6,756,TPESampler,COMPLETE
86,0.3259683114033677,2025-04-24 21:19:10.021006,2025-04-24 21:19:43.595057,0 days 00:00:33.574051,False,absolute_error,49,sqrt,1,4,900,TPESampler,COMPLETE
87,0.33373166435223006,2025-04-24 21:19:10.939102,2025-04-24 21:19:41.711798,0 days 00:00:30.772696,False,absolute_error,44,sqrt,1,5,796,TPESampler,COMPLETE
88,0.49413282531480346,2025-04-24 21:19:19.695586,2025-04-24 21:19:23.871395,0 days 00:00:04.175809,False,squared_error,36,,13,9,819,TPESampler,COMPLETE
89,0.3341831196660524,2025-04-24 21:19:20.861886,2025-04-24 21:19:53.877495,0 days 00:00:33.015609,False,absolute_error,47,sqrt,1,6,843,TPESampler,COMPLETE
90,0.4318338103872668,2025-04-24 21:19:24.031982,2025-04-24 21:19:43.122413,0 days 00:00:19.090431,False,absolute_error,39,log2,1,10,671,TPESampler,COMPLETE
91,0.40394527353010085,2025-04-24 21:19:24.606292,2025-04-24 21:20:19.632042,0 days 00:00:55.025750,True,absolute_error,19,,2,21,760,TPESampler,COMPLETE
92,0.3343315504180627,2025-04-24 21:19:41.881145,2025-04-24 21:20:11.952299,0 days 00:00:30.071154,False,absolute_error,49,sqrt,1,3,800,TPESampler,COMPLETE
93,0.34863385649291045,2025-04-24 21:19:43.284025,2025-04-24 21:20:09.132097,0 days 00:00:25.848072,False,absolute_error,38,sqrt,1,6,729,TPESampler,COMPLETE
94,0.3328711938290082,2025-04-24 21:19:43.812314,2025-04-24 21:20:13.553138,0 days 00:00:29.740824,False,absolute_error,42,sqrt,1,4,817,TPESampler,COMPLETE
95,0.7606697513466344,2025-04-24 21:19:54.052275,2025-04-24 21:19:55.128912,0 days 00:00:01.076637,False,squared_error,14,sqrt,13,11,688,TPESampler,COMPLETE
96,0.33087220007136475,2025-04-24 21:19:55.299085,2025-04-24 21:20:25.147207,0 days 00:00:29.848122,False,absolute_error,45,sqrt,1,4,812,TPESampler,COMPLETE
97,0.4685853894714752,2025-04-24 21:20:09.410163,2025-04-24 21:21:48.544806,0 days 00:01:39.134643,False,absolute_error,50,,3,3,871,TPESampler,COMPLETE
98,0.3254948873881018,2025-04-24 21:20:12.126829,2025-04-24 21:20:45.075237,0 days 00:00:32.948408,False,absolute_error,50,sqrt,1,5,866,TPESampler,COMPLETE
99,0.42063825746108036,2025-04-24 21:20:13.716657,2025-04-24 21:20:29.156148,0 days 00:00:15.439491,False,absolute_error,47,sqrt,2,5,632,TPESampler,COMPLETE
100,0.49971849650552996,2025-04-24 21:20:19.791453,2025-04-24 21:20:20.851572,0 days 00:00:01.060119,False,squared_error,6,,1,49,164,TPESampler,COMPLETE
101,0.35672299817075764,2025-04-24 21:20:21.049877,2025-04-24 21:22:27.798327,0 days 00:02:06.748450,True,absolute_error,43,,1,2,868,TPESampler,COMPLETE
102,0.44668222394820734,2025-04-24 21:20:25.324293,2025-04-24 21:24:24.203722,0 days 00:03:58.879429,False,absolute_error,41,,1,4,959,TPESampler,COMPLETE
103,0.3284367300706021,2025-04-24 21:20:29.341405,2025-04-24 21:20:58.669147,0 days 00:00:29.327742,False,absolute_error,47,sqrt,1,4,707,TPESampler,COMPLETE
104,0.33669431979535863,2025-04-24 21:20:45.238180,2025-04-24 21:21:22.658790,0 days 00:00:37.420610,False,absolute_error,40,sqrt,1,4,933,TPESampler,COMPLETE
105,0.33702300958354553,2025-04-24 21:20:58.844886,2025-04-24 21:21:02.504508,0 days 00:00:03.659622,False,squared_error,49,sqrt,1,3,997,TPESampler,COMPLETE
106,0.5156498104924673,2025-04-24 21:21:02.667288,2025-04-24 21:21:04.496550,0 days 00:00:01.829262,True,squared_error,44,sqrt,3,3,915,TPESampler,COMPLETE
107,0.3269821964565152,2025-04-24 21:21:04.671775,2025-04-24 21:21:36.086954,0 days 00:00:31.415179,False,absolute_error,50,sqrt,1,4,832,TPESampler,COMPLETE
108,0.39938314238110173,2025-04-24 21:21:12.225154,2025-04-24 21:21:36.743351,0 days 00:00:24.518197,False,absolute_error,38,log2,1,3,833,TPESampler,COMPLETE
109,0.33110163338282445,2025-04-24 21:21:22.842851,2025-04-24 21:21:51.416175,0 days 00:00:28.573324,False,absolute_error,46,sqrt,1,5,688,TPESampler,COMPLETE
110,0.3439483085170856,2025-04-24 21:21:36.258582,2025-04-24 21:22:15.939965,0 days 00:00:39.681383,False,absolute_error,50,sqrt,1,2,956,TPESampler,COMPLETE
111,0.4549308232534492,2025-04-24 21:21:36.988881,2025-04-24 21:21:47.862980,0 days 00:00:10.874099,True,absolute_error,46,sqrt,2,2,871,TPESampler,COMPLETE
112,0.7020629093130739,2025-04-24 21:21:48.119971,2025-04-24 21:21:49.938664,0 days 00:00:01.818693,False,squared_error,19,sqrt,9,2,981,TPESampler,COMPLETE
113,0.5274067832507284,2025-04-24 21:21:48.941418,2025-04-24 21:21:50.523025,0 days 00:00:01.581607,True,squared_error,15,sqrt,2,46,610,TPESampler,COMPLETE
114,0.8326045883587498,2025-04-24 21:21:50.114471,2025-04-24 21:21:52.722458,0 days 00:00:02.607987,False,absolute_error,50,log2,7,41,650,TPESampler,COMPLETE
115,0.3253097395032762,2025-04-24 21:21:50.850331,2025-04-24 21:22:22.305133,0 days 00:00:31.454802,False,absolute_error,50,sqrt,1,5,776,TPESampler,COMPLETE
116,0.36676776935193445,2025-04-24 21:21:51.663023,2025-04-24 21:22:07.017712,0 days 00:00:15.354689,True,absolute_error,36,sqrt,1,3,619,TPESampler,COMPLETE
117,0.666880680151359,2025-04-24 21:21:52.893122,2025-04-24 21:22:03.020542,0 days 00:00:10.127420,False,absolute_error,6,sqrt,1,18,740,TPESampler,COMPLETE
118,0.40126351710530744,2025-04-24 21:22:03.174906,2025-04-24 21:22:12.771905,0 days 00:00:09.596999,True,absolute_error,44,log2,1,3,618,TPESampler,COMPLETE
119,0.3976439009516051,2025-04-24 21:22:07.337983,2025-04-24 21:22:25.359878,0 days 00:00:18.021895,True,absolute_error,34,,2,25,236,TPESampler,COMPLETE
120,0.3254746992878221,2025-04-24 21:22:12.942615,2025-04-24 21:22:41.731950,0 days 00:00:28.789335,False,absolute_error,49,sqrt,1,4,687,TPESampler,COMPLETE
121,0.32801844838859495,2025-04-24 21:22:16.110637,2025-04-24 21:22:43.954117,0 days 00:00:27.843480,False,absolute_error,49,sqrt,1,5,748,TPESampler,COMPLETE
122,0.3296545343165435,2025-04-24 21:22:22.479864,2025-04-24 21:22:55.730347,0 days 00:00:33.250483,False,absolute_error,47,sqrt,1,4,891,TPESampler,COMPLETE
123,0.3990129538899247,2025-04-24 21:22:25.525789,2025-04-24 21:22:27.661765,0 days 00:00:02.135976,False,squared_error,40,log2,1,5,880,TPESampler,COMPLETE
124,0.8420441218906316,2025-04-24 21:22:27.797175,2025-04-24 21:22:30.428240,0 days 00:00:02.631065,True,absolute_error,37,log2,5,31,960,TPESampler,COMPLETE
125,0.32549464471273054,2025-04-24 21:22:27.950604,2025-04-24 21:23:00.893402,0 days 00:00:32.942798,False,absolute_error,50,sqrt,1,5,875,TPESampler,COMPLETE
126,0.33320572866302206,2025-04-24 21:22:30.597409,2025-04-24 21:22:55.395242,0 days 00:00:24.797833,False,absolute_error,43,sqrt,1,5,676,TPESampler,COMPLETE
127,0.626340582510752,2025-04-24 21:22:41.971437,2025-04-24 21:22:51.681677,0 days 00:00:09.710240,False,absolute_error,50,log2,2,8,695,TPESampler,COMPLETE
128,0.32530850230660774,2025-04-24 21:22:44.263043,2025-04-24 21:23:10.400685,0 days 00:00:26.137642,False,absolute_error,49,sqrt,1,4,684,TPESampler,COMPLETE
129,0.35969198601538444,2025-04-24 21:22:51.927283,2025-04-24 21:23:09.049264,0 days 00:00:17.121981,True,absolute_error,48,sqrt,1,5,652,TPESampler,COMPLETE
130,0.48345764265233454,2025-04-24 21:22:55.606320,2025-04-24 21:23:28.249406,0 days 00:00:32.643086,False,absolute_error,23,,8,34,671,TPESampler,COMPLETE
131,0.33462912040219883,2025-04-24 21:22:55.944260,2025-04-24 21:23:31.002794,0 days 00:00:35.058534,False,absolute_error,48,sqrt,1,6,861,TPESampler,COMPLETE
132,0.7635304465585186,2025-04-24 21:23:01.256218,2025-04-24 21:23:02.559625,0 days 00:00:01.303407,True,absolute_error,26,sqrt,8,16,261,TPESampler,COMPLETE
133,0.4209920806479904,2025-04-24 21:23:02.735602,2025-04-24 21:23:23.389294,0 days 00:00:20.653692,False,absolute_error,47,sqrt,2,5,857,TPESampler,COMPLETE
134,0.49510022972666584,2025-04-24 21:23:09.385781,2025-04-24 21:23:10.896021,0 days 00:00:01.510240,False,squared_error,48,,11,16,217,TPESampler,COMPLETE
135,0.41755215652425215,2025-04-24 21:23:10.570133,2025-04-24 21:23:26.364209,0 days 00:00:15.794076,False,absolute_error,50,sqrt,2,2,644,TPESampler,COMPLETE
136,0.5979971861022042,2025-04-24 21:23:11.157399,2025-04-24 21:23:17.961375,0 days 00:00:06.803976,True,absolute_error,22,sqrt,4,7,982,TPESampler,COMPLETE
137,0.8166687894641774,2025-04-24 21:23:18.127199,2025-04-24 21:23:18.769580,0 days 00:00:00.642381,True,squared_error,31,log2,4,10,119,TPESampler,COMPLETE
