number,value,datetime_start,datetime_complete,duration,params_bootstrap,params_criterion,params_max_depth,params_max_features,params_min_samples_leaf,params_min_samples_split,params_n_estimators,system_attrs_auto:sampler,state
554,0.8639053118111601,2025-04-24 21:53:37.064169,2025-04-24 21:53:38.716910,0 days 00:00:01.652741,False,absolute_error,31,log2,13,3,679,TPESampler,COMPLETE
555,0.3415367510058206,2025-04-24 21:53:38.898145,2025-04-24 21:53:57.223966,0 days 00:00:18.325821,False,absolute_error,49,sqrt,1,2,445,TPESampler,COMPLETE
556,0.4294882618775167,2025-04-24 21:53:41.977845,2025-04-24 21:53:43.776765,0 days 00:00:01.798920,False,squared_error,34,sqrt,2,9,849,TPESampler,COMPLETE
557,0.36412882517448203,2025-04-24 21:53:43.988439,2025-04-24 21:53:45.543522,0 days 00:00:01.555083,False,squared_error,37,sqrt,1,9,454,TPESampler,COMPLETE
558,0.7529843409391871,2025-04-24 21:53:45.730214,2025-04-24 21:53:49.872234,0 days 00:00:04.142020,False,absolute_error,43,sqrt,12,39,860,TPESampler,COMPLETE
559,0.4207475729520259,2025-04-24 21:53:45.830308,2025-04-24 21:54:00.164041,0 days 00:00:14.333733,False,absolute_error,50,sqrt,2,6,579,TPESampler,COMPLETE
560,0.33589678884479773,2025-04-24 21:53:47.706221,2025-04-24 21:54:12.514050,0 days 00:00:24.807829,False,absolute_error,48,sqrt,1,3,578,TPESampler,COMPLETE
561,0.3332343321078132,2025-04-24 21:53:50.074842,2025-04-24 21:54:18.769245,0 days 00:00:28.694403,False,absolute_error,49,sqrt,1,6,587,TPESampler,COMPLETE
562,0.3278239743543277,2025-04-24 21:53:57.403573,2025-04-24 21:54:26.918721,0 days 00:00:29.515148,False,absolute_error,49,sqrt,1,5,587,TPESampler,COMPLETE
563,0.4179942116734799,2025-04-24 21:54:00.356427,2025-04-24 21:54:19.813384,0 days 00:00:19.456957,False,absolute_error,50,sqrt,2,3,694,TPESampler,COMPLETE
564,0.3385853329051635,2025-04-24 21:54:12.785218,2025-04-24 21:54:37.141501,0 days 00:00:24.356283,False,absolute_error,40,sqrt,1,5,676,TPESampler,COMPLETE
565,0.8742698228640897,2025-04-24 21:54:18.942364,2025-04-24 21:54:20.974536,0 days 00:00:02.032172,True,absolute_error,24,log2,13,7,972,TPESampler,COMPLETE
566,0.34687878134606476,2025-04-24 21:54:19.988067,2025-04-24 21:54:46.613816,0 days 00:00:26.625749,False,absolute_error,44,sqrt,1,2,695,TPESampler,COMPLETE
567,0.3277795845579997,2025-04-24 21:54:21.171546,2025-04-24 21:54:48.939901,0 days 00:00:27.768355,False,absolute_error,49,sqrt,1,5,668,TPESampler,COMPLETE
568,0.35627492754127393,2025-04-24 21:54:27.095057,2025-04-24 21:55:00.219707,0 days 00:00:33.124650,False,absolute_error,43,sqrt,1,10,737,TPESampler,COMPLETE
569,0.41747610937225077,2025-04-24 21:54:37.318764,2025-04-24 21:54:52.933073,0 days 00:00:15.614309,False,absolute_error,50,sqrt,2,4,631,TPESampler,COMPLETE
570,0.8703339699050766,2025-04-24 21:54:46.788307,2025-04-24 21:54:47.761951,0 days 00:00:00.973644,False,absolute_error,15,log2,15,13,185,TPESampler,COMPLETE
571,0.6522947591542849,2025-04-24 21:54:47.955259,2025-04-24 21:54:48.658114,0 days 00:00:00.702855,False,squared_error,7,sqrt,4,23,175,TPESampler,COMPLETE
572,0.33224185174311627,2025-04-24 21:54:48.826541,2025-04-24 21:55:21.737540,0 days 00:00:32.910999,False,absolute_error,50,sqrt,1,3,659,TPESampler,COMPLETE
573,0.3329468045659757,2025-04-24 21:54:49.130002,2025-04-24 21:55:19.604717,0 days 00:00:30.474715,False,absolute_error,42,sqrt,1,4,786,TPESampler,COMPLETE
574,0.3278141979090695,2025-04-24 21:54:53.103423,2025-04-24 21:55:26.055809,0 days 00:00:32.952386,False,absolute_error,49,sqrt,1,5,684,TPESampler,COMPLETE
575,0.46712761104787576,2025-04-24 21:55:00.390817,2025-04-24 21:57:43.801116,0 days 00:02:43.410299,False,absolute_error,48,,1,3,711,TPESampler,COMPLETE
576,0.8567535157818652,2025-04-24 21:55:17.512503,2025-04-24 21:55:18.832284,0 days 00:00:01.319781,True,absolute_error,46,log2,7,9,478,TPESampler,COMPLETE
577,0.3751739805969985,2025-04-24 21:55:19.020119,2025-04-24 21:55:29.395446,0 days 00:00:10.375327,True,absolute_error,48,sqrt,1,9,446,TPESampler,COMPLETE
578,0.41766915094630114,2025-04-24 21:55:19.752644,2025-04-24 21:55:40.177546,0 days 00:00:20.424902,False,absolute_error,50,sqrt,2,3,825,TPESampler,COMPLETE
579,0.41435924416470077,2025-04-24 21:55:19.798945,2025-04-24 21:55:38.363552,0 days 00:00:18.564607,False,absolute_error,36,log2,1,5,731,TPESampler,COMPLETE
580,0.3318619245897579,2025-04-24 21:55:21.918175,2025-04-24 21:55:47.417314,0 days 00:00:25.499139,False,absolute_error,50,sqrt,1,3,640,TPESampler,COMPLETE
581,0.49355553762479437,2025-04-24 21:55:26.218987,2025-04-24 21:55:49.911568,0 days 00:00:23.692581,False,absolute_error,29,log2,1,15,930,TPESampler,COMPLETE
582,0.7313724075976777,2025-04-24 21:55:29.570909,2025-04-24 21:55:33.061592,0 days 00:00:03.490683,False,absolute_error,7,sqrt,9,4,564,TPESampler,COMPLETE
583,0.3251094777574822,2025-04-24 21:55:33.242375,2025-04-24 21:56:10.833225,0 days 00:00:37.590850,False,absolute_error,50,sqrt,1,5,812,TPESampler,COMPLETE
584,0.3301517386084462,2025-04-24 21:55:38.538184,2025-04-24 21:56:05.535415,0 days 00:00:26.997231,False,absolute_error,48,sqrt,1,5,732,TPESampler,COMPLETE
585,0.32708797173796234,2025-04-24 21:55:40.367891,2025-04-24 21:56:11.427984,0 days 00:00:31.060093,False,absolute_error,50,sqrt,1,4,834,TPESampler,COMPLETE
586,0.42250970056379444,2025-04-24 21:55:47.586599,2025-04-24 21:56:12.335996,0 days 00:00:24.749397,False,absolute_error,42,sqrt,2,5,787,TPESampler,COMPLETE
587,0.45413248809792717,2025-04-24 21:55:50.083903,2025-04-24 21:55:54.810265,0 days 00:00:04.726362,False,squared_error,32,,4,17,799,TPESampler,COMPLETE
588,0.3328624374090532,2025-04-24 21:55:54.980446,2025-04-24 21:56:24.835460,0 days 00:00:29.855014,False,absolute_error,42,sqrt,1,5,829,TPESampler,COMPLETE
589,0.33196535552890016,2025-04-24 21:56:05.774786,2025-04-24 21:56:30.577312,0 days 00:00:24.802526,False,absolute_error,50,sqrt,1,6,670,TPESampler,COMPLETE
590,0.34242593657630505,2025-04-24 21:56:11.018488,2025-04-24 21:56:45.403420,0 days 00:00:34.384932,False,absolute_error,49,sqrt,1,8,773,TPESampler,COMPLETE
591,0.37824549357477694,2025-04-24 21:56:11.646717,2025-04-24 21:56:27.819821,0 days 00:00:16.173104,False,absolute_error,44,log2,1,3,570,TPESampler,COMPLETE
592,0.33408218802685563,2025-04-24 21:56:12.628153,2025-04-24 21:56:42.461203,0 days 00:00:29.833050,False,absolute_error,49,sqrt,1,6,807,TPESampler,COMPLETE
593,0.3393327108962528,2025-04-24 21:56:25.008808,2025-04-24 21:57:03.141118,0 days 00:00:38.132310,False,absolute_error,42,sqrt,1,3,843,TPESampler,COMPLETE
594,0.3255754595559429,2025-04-24 21:56:27.994749,2025-04-24 21:57:04.085642,0 days 00:00:36.090893,False,absolute_error,50,sqrt,1,5,863,TPESampler,COMPLETE
595,0.3265176664962847,2025-04-24 21:56:30.759456,2025-04-24 21:56:56.765431,0 days 00:00:26.005975,False,absolute_error,50,sqrt,1,4,586,TPESampler,COMPLETE
596,0.37982199984210663,2025-04-24 21:56:42.646677,2025-04-24 21:56:44.883037,0 days 00:00:02.236360,True,squared_error,31,,1,19,348,TPESampler,COMPLETE
597,0.45617905253563623,2025-04-24 21:56:45.066744,2025-04-24 21:56:57.270921,0 days 00:00:12.204177,True,absolute_error,36,sqrt,2,3,762,TPESampler,COMPLETE
598,0.46835796928393103,2025-04-24 21:56:45.733157,2025-04-24 21:56:46.969139,0 days 00:00:01.235982,False,squared_error,35,sqrt,3,50,466,TPESampler,COMPLETE
599,0.3456066191214313,2025-04-24 21:56:47.155737,2025-04-24 21:57:21.632572,0 days 00:00:34.476835,False,absolute_error,47,sqrt,1,2,832,TPESampler,COMPLETE
600,0.7138691079888966,2025-04-24 21:56:56.942753,2025-04-24 21:57:00.135479,0 days 00:00:03.192726,True,absolute_error,11,sqrt,6,31,776,TPESampler,COMPLETE
601,0.33706136867996284,2025-04-24 21:56:57.535997,2025-04-24 21:57:23.430999,0 days 00:00:25.895002,False,absolute_error,41,sqrt,1,5,716,TPESampler,COMPLETE
602,0.3456785044196023,2025-04-24 21:57:00.314542,2025-04-24 21:57:29.090769,0 days 00:00:28.776227,False,absolute_error,42,sqrt,1,7,807,TPESampler,COMPLETE
603,0.3252164189980091,2025-04-24 21:57:03.329056,2025-04-24 21:57:32.364326,0 days 00:00:29.035270,False,absolute_error,50,sqrt,1,5,772,TPESampler,COMPLETE
604,0.3270100629479947,2025-04-24 21:57:04.267016,2025-04-24 21:57:35.304959,0 days 00:00:31.037943,False,absolute_error,50,sqrt,1,4,833,TPESampler,COMPLETE
605,0.4277457905195268,2025-04-24 21:57:21.816852,2025-04-24 21:59:06.595268,0 days 00:01:44.778416,True,absolute_error,11,,1,20,970,TPESampler,COMPLETE
606,0.41838170103820344,2025-04-24 21:57:23.628882,2025-04-24 21:57:49.566022,0 days 00:00:25.937140,False,absolute_error,44,sqrt,2,4,840,TPESampler,COMPLETE
607,0.6736482934827993,2025-04-24 21:57:29.279237,2025-04-24 21:57:30.042931,0 days 00:00:00.763694,True,squared_error,6,sqrt,2,2,166,TPESampler,COMPLETE
608,0.42711683649858595,2025-04-24 21:57:30.213993,2025-04-24 21:57:50.881528,0 days 00:00:20.667535,False,absolute_error,50,sqrt,2,10,853,TPESampler,COMPLETE
609,0.33344818196587717,2025-04-24 21:57:32.547655,2025-04-24 21:58:08.800404,0 days 00:00:36.252749,False,absolute_error,50,sqrt,1,3,844,TPESampler,COMPLETE
610,0.33156036480768025,2025-04-24 21:57:35.477049,2025-04-24 21:57:59.660766,0 days 00:00:24.183717,False,absolute_error,50,sqrt,1,3,614,TPESampler,COMPLETE
611,0.4572237962316801,2025-04-24 21:57:44.046479,2025-04-24 21:57:51.555179,0 days 00:00:07.508700,True,absolute_error,48,sqrt,2,7,560,TPESampler,COMPLETE
612,0.4206209648728559,2025-04-24 21:57:49.913492,2025-04-24 21:58:12.477899,0 days 00:00:22.564407,False,absolute_error,50,sqrt,2,6,911,TPESampler,COMPLETE
613,0.7031016094726285,2025-04-24 21:57:51.497109,2025-04-24 21:57:53.397789,0 days 00:00:01.900680,True,squared_error,28,sqrt,6,19,909,TPESampler,COMPLETE
614,0.46284010458745306,2025-04-24 21:57:51.781763,2025-04-24 21:57:54.392428,0 days 00:00:02.610665,True,absolute_error,32,sqrt,2,14,114,TPESampler,COMPLETE
615,0.33199466090210455,2025-04-24 21:57:53.732853,2025-04-24 21:58:25.322367,0 days 00:00:31.589514,False,absolute_error,50,sqrt,1,6,761,TPESampler,COMPLETE
616,0.34161072986051494,2025-04-24 21:57:54.871017,2025-04-24 21:57:57.454185,0 days 00:00:02.583168,False,squared_error,41,sqrt,1,4,751,TPESampler,COMPLETE
617,0.7145191228237308,2025-04-24 21:57:57.637284,2025-04-24 21:57:58.523511,0 days 00:00:00.886227,True,squared_error,9,log2,1,39,270,TPESampler,COMPLETE
618,0.39358815550740456,2025-04-24 21:57:58.749722,2025-04-24 21:58:01.133031,0 days 00:00:02.383309,True,squared_error,21,,3,5,369,TPESampler,COMPLETE
619,0.5088477871860214,2025-04-24 21:57:59.834234,2025-04-24 21:58:05.026234,0 days 00:00:05.192000,False,absolute_error,7,,15,3,142,TPESampler,COMPLETE
620,0.346098975673859,2025-04-24 21:58:01.315368,2025-04-24 21:58:33.669426,0 days 00:00:32.354058,False,absolute_error,50,sqrt,1,10,854,TPESampler,COMPLETE
621,0.7379728561255514,2025-04-24 21:58:05.220998,2025-04-24 21:58:08.307646,0 days 00:00:03.086648,True,absolute_error,50,sqrt,7,3,748,TPESampler,COMPLETE
622,0.46783322965596064,2025-04-24 21:58:08.496745,2025-04-24 21:58:11.071923,0 days 00:00:02.575178,False,squared_error,34,,7,37,448,TPESampler,COMPLETE
623,0.32521133640972477,2025-04-24 21:58:09.059782,2025-04-24 21:58:39.098545,0 days 00:00:30.038763,False,absolute_error,50,sqrt,1,5,809,TPESampler,COMPLETE
624,0.33438019881349684,2025-04-24 21:58:11.251643,2025-04-24 21:58:42.032842,0 days 00:00:30.781199,False,absolute_error,41,sqrt,1,4,769,TPESampler,COMPLETE
625,0.4477106291163611,2025-04-24 21:58:12.766082,2025-04-24 22:01:28.194997,0 days 00:03:15.428915,False,absolute_error,48,,1,5,780,TPESampler,COMPLETE
626,0.3389557883510407,2025-04-24 21:58:25.496237,2025-04-24 21:58:51.647593,0 days 00:00:26.151356,False,absolute_error,43,sqrt,1,3,701,TPESampler,COMPLETE
627,0.5277138396033497,2025-04-24 21:58:33.852717,2025-04-24 21:58:35.826571,0 days 00:00:01.973854,True,squared_error,14,sqrt,1,44,906,TPESampler,COMPLETE
628,0.3255891402520073,2025-04-24 21:58:35.997068,2025-04-24 21:59:06.965984,0 days 00:00:30.968916,False,absolute_error,50,sqrt,1,5,835,TPESampler,COMPLETE
629,0.3696254587981958,2025-04-24 21:58:39.354836,2025-04-24 21:59:01.479908,0 days 00:00:22.125072,False,absolute_error,50,log2,1,5,789,TPESampler,COMPLETE
630,0.4210802090748454,2025-04-24 21:58:42.211935,2025-04-24 21:59:00.685473,0 days 00:00:18.473538,False,absolute_error,49,sqrt,2,5,764,TPESampler,COMPLETE
631,0.3469280119548995,2025-04-24 21:58:51.875794,2025-04-24 21:59:15.119392,0 days 00:00:23.243598,False,absolute_error,49,sqrt,1,10,612,TPESampler,COMPLETE
632,0.33320272871329765,2025-04-24 21:59:00.891658,2025-04-24 21:59:37.247897,0 days 00:00:36.356239,False,absolute_error,50,sqrt,1,3,808,TPESampler,COMPLETE
633,0.3648263528032587,2025-04-24 21:59:01.662105,2025-04-24 21:59:17.220937,0 days 00:00:15.558832,True,absolute_error,47,sqrt,1,6,643,TPESampler,COMPLETE
634,0.425965878032589,2025-04-24 21:59:06.779762,2025-04-24 21:59:25.073348,0 days 00:00:18.293586,False,absolute_error,39,sqrt,2,6,689,TPESampler,COMPLETE
635,0.42057301108257694,2025-04-24 21:59:07.158943,2025-04-24 21:59:24.756197,0 days 00:00:17.597254,False,absolute_error,50,sqrt,2,6,610,TPESampler,COMPLETE
636,0.44452643309573076,2025-04-24 21:59:15.324941,2025-04-24 21:59:31.418650,0 days 00:00:16.093709,True,absolute_error,47,,6,4,483,TPESampler,COMPLETE
637,0.3280387291260785,2025-04-24 21:59:17.395767,2025-04-24 21:59:51.953130,0 days 00:00:34.557363,False,absolute_error,49,sqrt,1,5,732,TPESampler,COMPLETE
638,0.3448439734282989,2025-04-24 21:59:24.928826,2025-04-24 21:59:54.003403,0 days 00:00:29.074577,False,absolute_error,50,sqrt,1,2,634,TPESampler,COMPLETE
639,0.41761518115692037,2025-04-24 21:59:25.270877,2025-04-24 21:59:53.201499,0 days 00:00:27.930622,False,absolute_error,50,sqrt,2,4,807,TPESampler,COMPLETE
640,0.3326438410892293,2025-04-24 21:59:31.609269,2025-04-24 21:59:58.100836,0 days 00:00:26.491567,False,absolute_error,43,sqrt,1,5,653,TPESampler,COMPLETE
641,0.4838002983354254,2025-04-24 21:59:37.443170,2025-04-24 22:00:00.314292,0 days 00:00:22.871122,True,absolute_error,49,,9,2,1000,TPESampler,COMPLETE
642,0.5044250412969288,2025-04-24 21:59:52.172691,2025-04-24 21:59:53.442246,0 days 00:00:01.269555,False,squared_error,28,sqrt,4,2,549,TPESampler,COMPLETE
643,0.35184730488016386,2025-04-24 21:59:53.393792,2025-04-24 22:00:28.035500,0 days 00:00:34.641708,False,absolute_error,42,sqrt,1,8,815,TPESampler,COMPLETE
644,0.4526889636740054,2025-04-24 21:59:53.656255,2025-04-24 21:59:56.351462,0 days 00:00:02.695207,False,squared_error,18,,3,36,362,TPESampler,COMPLETE
645,0.33715763706610574,2025-04-24 21:59:54.287378,2025-04-24 22:00:16.227696,0 days 00:00:21.940318,False,absolute_error,40,sqrt,1,5,586,TPESampler,COMPLETE
646,0.3437393152053386,2025-04-24 21:59:56.537353,2025-04-24 22:00:35.711659,0 days 00:00:39.174306,False,absolute_error,50,sqrt,1,2,837,TPESampler,COMPLETE
647,0.43801298123708665,2025-04-24 21:59:58.273090,2025-04-24 22:04:03.141132,0 days 00:04:04.868042,False,absolute_error,40,,1,8,999,TPESampler,COMPLETE
648,0.34623359459692776,2025-04-24 22:00:00.497864,2025-04-24 22:00:05.024439,0 days 00:00:04.526575,False,squared_error,50,sqrt,1,2,907,TPESampler,COMPLETE
649,0.326758484314474,2025-04-24 22:00:05.198249,2025-04-24 22:00:35.816943,0 days 00:00:30.618694,False,absolute_error,50,sqrt,1,4,802,TPESampler,COMPLETE
650,0.41755650713543463,2025-04-24 22:00:16.407609,2025-04-24 22:00:18.243835,0 days 00:00:01.836226,False,squared_error,49,sqrt,2,5,801,TPESampler,COMPLETE
651,0.3265712594188773,2025-04-24 22:00:18.425318,2025-04-24 22:00:46.966485,0 days 00:00:28.541167,False,absolute_error,50,sqrt,1,4,764,TPESampler,COMPLETE
652,0.33549000269222845,2025-04-24 22:00:28.235628,2025-04-24 22:00:30.052527,0 days 00:00:01.816899,False,squared_error,46,sqrt,1,4,439,TPESampler,COMPLETE
653,0.3251514041077392,2025-04-24 22:00:30.219038,2025-04-24 22:00:54.313647,0 days 00:00:24.094609,False,absolute_error,50,sqrt,1,5,643,TPESampler,COMPLETE
654,0.4828518849907805,2025-04-24 22:00:35.903090,2025-04-24 22:02:42.947512,0 days 00:02:07.044422,False,absolute_error,30,,1,2,571,TPESampler,COMPLETE
655,0.512470482045356,2025-04-24 22:00:36.034871,2025-04-24 22:00:46.437157,0 days 00:00:10.402286,False,absolute_error,14,sqrt,1,18,427,TPESampler,COMPLETE
656,0.3386597346199827,2025-04-24 22:00:46.622547,2025-04-24 22:01:18.763998,0 days 00:00:32.141451,False,absolute_error,43,sqrt,1,3,713,TPESampler,COMPLETE
657,0.7358883707698047,2025-04-24 22:00:47.243067,2025-04-24 22:00:48.348544,0 days 00:00:01.105477,False,absolute_error,47,sqrt,12,3,126,TPESampler,COMPLETE
658,0.3347772897751211,2025-04-24 22:00:48.532490,2025-04-24 22:01:26.291755,0 days 00:00:37.759265,False,absolute_error,41,sqrt,1,4,877,TPESampler,COMPLETE
659,0.3317393703938232,2025-04-24 22:00:54.483883,2025-04-24 22:01:18.547165,0 days 00:00:24.063282,False,absolute_error,50,sqrt,1,6,651,TPESampler,COMPLETE
660,0.34312676475001486,2025-04-24 22:01:18.727809,2025-04-24 22:01:38.252607,0 days 00:00:19.524798,False,absolute_error,39,sqrt,1,3,529,TPESampler,COMPLETE
661,0.4404739028693872,2025-04-24 22:01:18.960859,2025-04-24 22:04:01.617996,0 days 00:02:42.657137,False,absolute_error,50,,1,9,648,TPESampler,COMPLETE
662,0.3264827108515469,2025-04-24 22:01:26.469135,2025-04-24 22:01:48.101409,0 days 00:00:21.632274,False,absolute_error,50,sqrt,1,4,580,TPESampler,COMPLETE
663,0.41600829355059865,2025-04-24 22:01:28.394896,2025-04-24 22:01:29.738981,0 days 00:00:01.344085,False,squared_error,47,log2,1,12,375,TPESampler,COMPLETE
664,0.4660118590841464,2025-04-24 22:01:29.916482,2025-04-24 22:02:21.064548,0 days 00:00:51.148066,False,absolute_error,22,,3,33,469,TPESampler,COMPLETE
665,0.32560611326496885,2025-04-24 22:01:38.425131,2025-04-24 22:02:05.726961,0 days 00:00:27.301830,False,absolute_error,50,sqrt,1,5,733,TPESampler,COMPLETE
666,0.6429383940648303,2025-04-24 22:01:48.293204,2025-04-24 22:01:48.996518,0 days 00:00:00.703314,False,squared_error,35,log2,2,5,123,TPESampler,COMPLETE
667,0.727591834320487,2025-04-24 22:01:49.232349,2025-04-24 22:01:50.741733,0 days 00:00:01.509384,False,squared_error,39,sqrt,11,3,258,TPESampler,COMPLETE
668,0.4164552483021188,2025-04-24 22:01:50.925210,2025-04-24 22:02:06.078722,0 days 00:00:15.153512,False,absolute_error,49,sqrt,2,2,614,TPESampler,COMPLETE
669,0.32925344528191114,2025-04-24 22:02:05.926688,2025-04-24 22:02:25.181085,0 days 00:00:19.254397,False,absolute_error,48,sqrt,1,5,514,TPESampler,COMPLETE
670,0.45551961475310776,2025-04-24 22:02:06.289540,2025-04-24 22:02:08.016729,0 days 00:00:01.727189,True,squared_error,50,sqrt,2,9,736,TPESampler,COMPLETE
671,0.33499613244961557,2025-04-24 22:02:08.192193,2025-04-24 22:02:14.382948,0 days 00:00:06.190755,False,absolute_error,44,sqrt,1,5,157,TPESampler,COMPLETE
672,0.33528797148659273,2025-04-24 22:02:14.570229,2025-04-24 22:02:35.541032,0 days 00:00:20.970803,False,absolute_error,41,sqrt,1,5,581,TPESampler,COMPLETE
673,0.41747610937225077,2025-04-24 22:02:21.255569,2025-04-24 22:02:37.469790,0 days 00:00:16.214221,False,absolute_error,50,sqrt,2,3,631,TPESampler,COMPLETE
674,0.33394694215413095,2025-04-24 22:02:25.354843,2025-04-24 22:02:47.579982,0 days 00:00:22.225139,False,absolute_error,49,sqrt,1,6,563,TPESampler,COMPLETE
675,0.415689909583386,2025-04-24 22:02:35.714254,2025-04-24 22:02:49.997980,0 days 00:00:14.283726,False,absolute_error,48,log2,1,12,528,TPESampler,COMPLETE
676,0.4856694209312779,2025-04-24 22:02:37.635559,2025-04-24 22:02:48.493463,0 days 00:00:10.857904,True,absolute_error,22,,9,20,491,TPESampler,COMPLETE
677,0.3316255745137573,2025-04-24 22:02:43.232234,2025-04-24 22:03:18.374637,0 days 00:00:35.142403,False,absolute_error,43,sqrt,1,4,654,TPESampler,COMPLETE
678,0.325087897123112,2025-04-24 22:02:47.930221,2025-04-24 22:03:19.606408,0 days 00:00:31.676187,False,absolute_error,50,sqrt,1,5,638,TPESampler,COMPLETE
679,0.33207334252533255,2025-04-24 22:02:48.939205,2025-04-24 22:03:21.035596,0 days 00:00:32.096391,False,absolute_error,50,sqrt,1,3,643,TPESampler,COMPLETE
680,0.34334119342048297,2025-04-24 22:02:50.185394,2025-04-24 22:03:16.410418,0 days 00:00:26.225024,False,absolute_error,50,sqrt,1,9,707,TPESampler,COMPLETE
681,0.3322359860856325,2025-04-24 22:03:16.595968,2025-04-24 22:03:58.943862,0 days 00:00:42.347894,False,absolute_error,50,sqrt,1,3,661,TPESampler,COMPLETE
682,0.3472825034308214,2025-04-24 22:03:18.557979,2025-04-24 22:03:22.399328,0 days 00:00:03.841349,False,squared_error,48,sqrt,1,2,649,TPESampler,COMPLETE
683,0.4347081092731824,2025-04-24 22:03:19.777616,2025-04-24 22:03:26.747210,0 days 00:00:06.969594,False,squared_error,48,,3,7,947,TPESampler,COMPLETE
684,0.4252209070709459,2025-04-24 22:03:21.227264,2025-04-24 22:03:37.372957,0 days 00:00:16.145693,False,absolute_error,48,sqrt,2,8,657,TPESampler,COMPLETE
685,0.422438529839938,2025-04-24 22:03:22.568000,2025-04-24 22:03:38.583030,0 days 00:00:16.015030,False,absolute_error,42,sqrt,2,5,651,TPESampler,COMPLETE
686,0.3320132608592068,2025-04-24 22:03:26.936720,2025-04-24 22:03:53.100077,0 days 00:00:26.163357,False,absolute_error,50,sqrt,1,6,705,TPESampler,COMPLETE
687,0.3558026231536516,2025-04-24 22:03:37.551519,2025-04-24 22:03:56.084885,0 days 00:00:18.533366,True,absolute_error,42,sqrt,1,2,832,TPESampler,COMPLETE
688,0.35279368455700255,2025-04-24 22:03:38.756974,2025-04-24 22:04:00.763873,0 days 00:00:22.006899,False,absolute_error,43,sqrt,1,9,543,TPESampler,COMPLETE
689,0.7216495264151691,2025-04-24 22:03:53.272345,2025-04-24 22:03:58.623119,0 days 00:00:05.350774,False,absolute_error,13,sqrt,10,45,954,TPESampler,COMPLETE
690,0.3256252593709072,2025-04-24 22:03:56.258464,2025-04-24 22:04:21.135632,0 days 00:00:24.877168,False,absolute_error,50,sqrt,1,5,657,TPESampler,COMPLETE
691,0.8187583374464014,2025-04-24 22:03:58.828721,2025-04-24 22:04:00.401914,0 days 00:00:01.573193,True,absolute_error,30,sqrt,14,39,560,TPESampler,COMPLETE
