number,value,datetime_start,datetime_complete,duration,params_bootstrap,params_criterion,params_max_depth,params_max_features,params_min_samples_leaf,params_min_samples_split,params_n_estimators,system_attrs_auto:sampler,state
3857,0.3267554245379483,2025-04-25 00:55:42.232169,2025-04-25 00:56:05.461972,0 days 00:00:23.229803,False,absolute_error,50,sqrt,1,4,599,TPESampler,COMPLETE
3858,0.33971071201008496,2025-04-25 00:55:42.959554,2025-04-25 00:56:01.085518,0 days 00:00:18.125964,False,absolute_error,42,sqrt,1,3,476,TPESampler,COMPLETE
3859,0.33302586440159027,2025-04-25 00:55:46.715898,2025-04-25 00:56:05.503090,0 days 00:00:18.787192,False,absolute_error,43,sqrt,1,5,495,TPESampler,COMPLETE
3860,0.3367956134387426,2025-04-25 00:55:51.149112,2025-04-25 00:56:20.258161,0 days 00:00:29.109049,False,absolute_error,44,sqrt,1,3,780,TPESampler,COMPLETE
3861,0.3266203944884314,2025-04-25 00:56:01.314025,2025-04-25 00:56:24.610105,0 days 00:00:23.296080,False,absolute_error,50,sqrt,1,4,602,TPESampler,COMPLETE
3862,0.33417339975144283,2025-04-25 00:56:03.819551,2025-04-25 00:56:15.014119,0 days 00:00:11.194568,False,absolute_error,44,sqrt,1,5,294,TPESampler,COMPLETE
3863,0.41678757423045426,2025-04-25 00:56:05.694850,2025-04-25 00:56:19.122177,0 days 00:00:13.427327,False,absolute_error,50,sqrt,2,3,533,TPESampler,COMPLETE
3864,0.4204216013284787,2025-04-25 00:56:05.694468,2025-04-25 00:56:20.793011,0 days 00:00:15.098543,False,absolute_error,50,sqrt,2,5,603,TPESampler,COMPLETE
3865,0.33135861526299143,2025-04-25 00:56:15.272972,2025-04-25 00:56:38.992675,0 days 00:00:23.719703,False,absolute_error,50,sqrt,1,6,633,TPESampler,COMPLETE
3866,0.4143375041689248,2025-04-25 00:56:19.348457,2025-04-25 00:56:24.913579,0 days 00:00:05.565122,False,absolute_error,42,sqrt,2,4,199,TPESampler,COMPLETE
3867,0.42103964448819353,2025-04-25 00:56:20.482683,2025-04-25 00:56:35.194935,0 days 00:00:14.712252,False,absolute_error,50,sqrt,2,6,593,TPESampler,COMPLETE
3868,0.3399105435394035,2025-04-25 00:56:21.017497,2025-04-25 00:56:48.348487,0 days 00:00:27.330990,False,absolute_error,41,sqrt,1,3,667,TPESampler,COMPLETE
3869,0.3264107252055214,2025-04-25 00:56:24.828090,2025-04-25 00:56:40.635002,0 days 00:00:15.806912,False,absolute_error,50,sqrt,1,4,409,TPESampler,COMPLETE
3870,0.32773578121508723,2025-04-25 00:56:25.146109,2025-04-25 00:56:30.993619,0 days 00:00:05.847510,False,absolute_error,50,sqrt,1,4,138,TPESampler,COMPLETE
3871,0.3342113495757665,2025-04-25 00:56:31.224723,2025-04-25 00:56:43.069467,0 days 00:00:11.844744,False,absolute_error,50,sqrt,1,7,308,TPESampler,COMPLETE
3872,0.33609833927199173,2025-04-25 00:56:35.421413,2025-04-25 00:56:48.050468,0 days 00:00:12.629055,False,absolute_error,43,sqrt,1,3,328,TPESampler,COMPLETE
3873,0.33821983256716404,2025-04-25 00:56:39.211339,2025-04-25 00:57:01.308249,0 days 00:00:22.096910,False,absolute_error,43,sqrt,1,3,587,TPESampler,COMPLETE
3874,0.3416218657403857,2025-04-25 00:56:40.861383,2025-04-25 00:57:07.361567,0 days 00:00:26.500184,False,absolute_error,43,sqrt,1,7,662,TPESampler,COMPLETE
3875,0.3315148282934317,2025-04-25 00:56:43.305163,2025-04-25 00:56:57.622694,0 days 00:00:14.317531,False,absolute_error,50,sqrt,1,3,364,TPESampler,COMPLETE
3876,0.3416887226962436,2025-04-25 00:56:48.286319,2025-04-25 00:57:07.610051,0 days 00:00:19.323732,False,absolute_error,50,sqrt,1,8,518,TPESampler,COMPLETE
3877,0.40208960570352736,2025-04-25 00:56:48.585291,2025-04-25 00:57:12.189248,0 days 00:00:23.603957,False,absolute_error,23,,2,14,170,TPESampler,COMPLETE
3878,0.34456069555733115,2025-04-25 00:56:57.849522,2025-04-25 00:57:20.388620,0 days 00:00:22.539098,False,absolute_error,50,sqrt,1,2,571,TPESampler,COMPLETE
3879,0.33983619263016823,2025-04-25 00:57:01.534453,2025-04-25 00:57:16.082636,0 days 00:00:14.548183,False,absolute_error,43,sqrt,1,6,387,TPESampler,COMPLETE
3880,0.32663496898596706,2025-04-25 00:57:07.583986,2025-04-25 00:57:29.554178,0 days 00:00:21.970192,False,absolute_error,50,sqrt,1,4,577,TPESampler,COMPLETE
3881,0.33767913431288715,2025-04-25 00:57:07.898331,2025-04-25 00:57:23.050949,0 days 00:00:15.152618,False,absolute_error,42,sqrt,1,3,396,TPESampler,COMPLETE
3882,0.3433373617036292,2025-04-25 00:57:12.433223,2025-04-25 00:57:36.297859,0 days 00:00:23.864636,False,absolute_error,50,sqrt,1,9,642,TPESampler,COMPLETE
3883,0.34136628265336993,2025-04-25 00:57:16.308400,2025-04-25 00:57:21.950330,0 days 00:00:05.641930,False,absolute_error,50,sqrt,1,8,137,TPESampler,COMPLETE
3884,0.34804409826205907,2025-04-25 00:57:20.616322,2025-04-25 00:57:40.567249,0 days 00:00:19.950927,False,absolute_error,35,sqrt,1,5,546,TPESampler,COMPLETE
3885,0.3389791005090659,2025-04-25 00:57:22.170364,2025-04-25 00:57:46.062135,0 days 00:00:23.891771,False,absolute_error,43,sqrt,1,3,624,TPESampler,COMPLETE
3886,0.620649987456553,2025-04-25 00:57:23.302873,2025-04-25 00:57:29.099445,0 days 00:00:05.796572,False,absolute_error,49,log2,2,3,426,TPESampler,COMPLETE
3887,0.3318728299202945,2025-04-25 00:57:27.225875,2025-04-25 00:57:51.019034,0 days 00:00:23.793159,False,absolute_error,50,sqrt,1,3,599,TPESampler,COMPLETE
3888,0.5392126345375313,2025-04-25 00:57:29.604913,2025-04-25 00:57:34.239311,0 days 00:00:04.634398,True,absolute_error,19,sqrt,3,7,441,TPESampler,COMPLETE
3889,0.3347261136722301,2025-04-25 00:57:29.906294,2025-04-25 00:57:50.813185,0 days 00:00:20.906891,False,absolute_error,44,sqrt,1,5,520,TPESampler,COMPLETE
3890,0.41633001642239614,2025-04-25 00:57:34.494958,2025-04-25 00:57:47.148516,0 days 00:00:12.653558,False,absolute_error,44,sqrt,2,3,478,TPESampler,COMPLETE
3891,0.3465418281352305,2025-04-25 00:57:36.514821,2025-04-25 00:57:38.442868,0 days 00:00:01.928047,False,squared_error,42,sqrt,1,2,298,TPESampler,COMPLETE
3892,0.33617517131464003,2025-04-25 00:57:38.661608,2025-04-25 00:58:09.138820,0 days 00:00:30.477212,False,absolute_error,50,sqrt,1,7,791,TPESampler,COMPLETE
3893,0.601225152041553,2025-04-25 00:57:40.789552,2025-04-25 00:57:46.158141,0 days 00:00:05.368589,False,absolute_error,50,sqrt,6,9,542,TPESampler,COMPLETE
3894,0.3423995961018726,2025-04-25 00:57:46.486628,2025-04-25 00:57:49.789207,0 days 00:00:03.302579,False,squared_error,44,sqrt,1,6,678,TPESampler,COMPLETE
3895,0.4145959084642097,2025-04-25 00:57:46.547192,2025-04-25 00:57:58.811930,0 days 00:00:12.264738,False,absolute_error,50,sqrt,2,4,368,TPESampler,COMPLETE
3896,0.3616802122122448,2025-04-25 00:57:47.747069,2025-04-25 00:58:00.732117,0 days 00:00:12.985048,True,absolute_error,50,sqrt,1,6,460,TPESampler,COMPLETE
3897,0.42905759908505625,2025-04-25 00:57:50.130494,2025-04-25 00:58:09.256053,0 days 00:00:19.125559,False,absolute_error,43,sqrt,2,12,664,TPESampler,COMPLETE
3898,0.7539680450282066,2025-04-25 00:57:51.363226,2025-04-25 00:57:52.906505,0 days 00:00:01.543279,False,squared_error,6,sqrt,13,12,168,TPESampler,COMPLETE
3899,0.41808725528594914,2025-04-25 00:57:51.398849,2025-04-25 00:58:09.845654,0 days 00:00:18.446805,False,absolute_error,44,sqrt,2,4,627,TPESampler,COMPLETE
3900,0.3320961377495337,2025-04-25 00:57:53.209457,2025-04-25 00:58:16.867748,0 days 00:00:23.658291,False,absolute_error,50,sqrt,1,3,551,TPESampler,COMPLETE
3901,0.3309057785387905,2025-04-25 00:57:59.051265,2025-04-25 00:58:06.398519,0 days 00:00:07.347254,False,absolute_error,43,sqrt,1,5,181,TPESampler,COMPLETE
3902,0.3681112600446053,2025-04-25 00:58:00.969295,2025-04-25 00:58:16.857948,0 days 00:00:15.888653,True,absolute_error,50,sqrt,1,7,647,TPESampler,COMPLETE
3903,0.3523802530223694,2025-04-25 00:58:06.673948,2025-04-25 00:58:27.027731,0 days 00:00:20.353783,False,absolute_error,42,sqrt,1,8,543,TPESampler,COMPLETE
3904,0.3987590556443698,2025-04-25 00:58:09.346713,2025-04-25 00:58:19.751004,0 days 00:00:10.404291,False,absolute_error,38,log2,1,3,359,TPESampler,COMPLETE
3905,0.86636418278607,2025-04-25 00:58:09.512707,2025-04-25 00:58:11.227649,0 days 00:00:01.714942,True,absolute_error,28,log2,10,3,404,TPESampler,COMPLETE
3906,0.33335237058960515,2025-04-25 00:58:10.120239,2025-04-25 00:58:53.184244,0 days 00:00:43.064005,False,absolute_error,50,sqrt,1,3,823,TPESampler,COMPLETE
3907,0.32581499414478393,2025-04-25 00:58:11.449505,2025-04-25 00:58:30.624050,0 days 00:00:19.174545,False,absolute_error,50,sqrt,1,5,463,TPESampler,COMPLETE
3908,0.34104479532262266,2025-04-25 00:58:17.101264,2025-04-25 00:58:47.434279,0 days 00:00:30.333015,False,absolute_error,42,sqrt,1,6,785,TPESampler,COMPLETE
3909,0.780206606225573,2025-04-25 00:58:17.101135,2025-04-25 00:58:19.567301,0 days 00:00:02.466166,True,absolute_error,41,log2,3,46,517,TPESampler,COMPLETE
3910,0.4209199500976276,2025-04-25 00:58:19.803309,2025-04-25 00:58:29.448617,0 days 00:00:09.645308,False,absolute_error,42,sqrt,2,6,372,TPESampler,COMPLETE
3911,0.5604315877722232,2025-04-25 00:58:19.994111,2025-04-25 00:58:20.988587,0 days 00:00:00.994476,True,squared_error,14,sqrt,3,4,118,TPESampler,COMPLETE
3912,0.4174654658962225,2025-04-25 00:58:21.220412,2025-04-25 00:58:37.987010,0 days 00:00:16.766598,False,absolute_error,50,sqrt,2,3,623,TPESampler,COMPLETE
3913,0.4698764882319461,2025-04-25 00:58:27.260954,2025-04-25 01:00:07.931950,0 days 00:01:40.670996,False,absolute_error,42,,1,3,388,TPESampler,COMPLETE
3914,0.4983373451901942,2025-04-25 00:58:29.672901,2025-04-25 00:58:33.151864,0 days 00:00:03.478963,False,squared_error,9,,13,48,737,TPESampler,COMPLETE
3915,0.4204313022597355,2025-04-25 00:58:30.848257,2025-04-25 00:58:44.665296,0 days 00:00:13.817039,False,absolute_error,50,sqrt,2,6,554,TPESampler,COMPLETE
3916,0.33295450075377414,2025-04-25 00:58:33.386476,2025-04-25 00:59:10.752140,0 days 00:00:37.365664,False,absolute_error,50,sqrt,1,3,734,TPESampler,COMPLETE
3917,0.34102398896362557,2025-04-25 00:58:38.210470,2025-04-25 00:59:00.861867,0 days 00:00:22.651397,False,absolute_error,43,sqrt,1,6,530,TPESampler,COMPLETE
3918,0.4331103811502986,2025-04-25 00:58:44.902664,2025-04-25 00:59:08.314976,0 days 00:00:23.412312,True,absolute_error,33,,5,4,610,TPESampler,COMPLETE
3919,0.34661124121242354,2025-04-25 00:58:47.660431,2025-04-25 00:59:08.186542,0 days 00:00:20.526111,False,absolute_error,43,sqrt,1,2,456,TPESampler,COMPLETE
3920,0.3318631045405827,2025-04-25 00:58:53.416776,2025-04-25 00:59:09.261895,0 days 00:00:15.845119,False,absolute_error,50,sqrt,1,3,362,TPESampler,COMPLETE
3921,0.4302121768957064,2025-04-25 00:59:01.094014,2025-04-25 00:59:13.959234,0 days 00:00:12.865220,False,absolute_error,37,sqrt,2,9,516,TPESampler,COMPLETE
3922,0.41628639487509905,2025-04-25 00:59:08.380090,2025-04-25 00:59:20.889546,0 days 00:00:12.509456,False,absolute_error,50,sqrt,2,3,461,TPESampler,COMPLETE
3923,0.41577275353808085,2025-04-25 00:59:08.534764,2025-04-25 00:59:18.881654,0 days 00:00:10.346890,False,absolute_error,50,sqrt,2,4,386,TPESampler,COMPLETE
3924,0.3328159546015275,2025-04-25 00:59:09.571372,2025-04-25 00:59:41.807550,0 days 00:00:32.236178,False,absolute_error,43,sqrt,1,5,661,TPESampler,COMPLETE
3925,0.36576726560363443,2025-04-25 00:59:10.991492,2025-04-25 00:59:37.226326,0 days 00:00:26.234834,False,absolute_error,50,log2,1,3,638,TPESampler,COMPLETE
3926,0.33283619563370914,2025-04-25 00:59:14.202748,2025-04-25 00:59:38.538988,0 days 00:00:24.336240,False,absolute_error,43,sqrt,1,5,659,TPESampler,COMPLETE
3927,0.34052655741055443,2025-04-25 00:59:19.110030,2025-04-25 00:59:32.973113,0 days 00:00:13.863083,False,absolute_error,43,sqrt,1,7,370,TPESampler,COMPLETE
3928,0.33101936765584034,2025-04-25 00:59:21.112038,2025-04-25 00:59:44.958465,0 days 00:00:23.846427,False,absolute_error,50,sqrt,1,6,624,TPESampler,COMPLETE
3929,0.33277742513817715,2025-04-25 00:59:33.229595,2025-04-25 00:59:53.766547,0 days 00:00:20.536952,False,absolute_error,43,sqrt,1,4,503,TPESampler,COMPLETE
3930,0.3319746028523525,2025-04-25 00:59:37.490570,2025-04-25 01:00:04.257002,0 days 00:00:26.766432,False,absolute_error,50,sqrt,1,6,709,TPESampler,COMPLETE
3931,0.34947140678726807,2025-04-25 00:59:38.774234,2025-04-25 00:59:55.201739,0 days 00:00:16.427505,False,absolute_error,34,sqrt,1,3,428,TPESampler,COMPLETE
3932,0.32797954061693396,2025-04-25 00:59:42.043151,2025-04-25 01:00:01.408377,0 days 00:00:19.365226,False,absolute_error,50,sqrt,1,4,511,TPESampler,COMPLETE
3933,0.4135503749226385,2025-04-25 00:59:45.202139,2025-04-25 00:59:53.059002,0 days 00:00:07.856863,False,absolute_error,44,sqrt,2,4,304,TPESampler,COMPLETE
3934,0.46836093946376084,2025-04-25 00:59:53.287631,2025-04-25 01:02:19.455381,0 days 00:02:26.167750,False,absolute_error,50,,1,3,629,TPESampler,COMPLETE
3935,0.3318333070163553,2025-04-25 00:59:54.016167,2025-04-25 01:00:06.811928,0 days 00:00:12.795761,False,absolute_error,50,sqrt,1,3,316,TPESampler,COMPLETE
3936,0.33710663239759536,2025-04-25 00:59:55.420295,2025-04-25 00:59:58.749011,0 days 00:00:03.328716,False,squared_error,45,sqrt,1,3,838,TPESampler,COMPLETE
3937,0.3267207995257495,2025-04-25 00:59:58.989164,2025-04-25 01:00:29.304948,0 days 00:00:30.315784,False,absolute_error,50,sqrt,1,4,656,TPESampler,COMPLETE
3938,0.4245111905259545,2025-04-25 01:00:01.648474,2025-04-25 01:00:20.774244,0 days 00:00:19.125770,False,absolute_error,50,sqrt,2,8,772,TPESampler,COMPLETE
3939,0.33811596461050786,2025-04-25 01:00:04.501842,2025-04-25 01:00:15.779684,0 days 00:00:11.277842,False,absolute_error,43,sqrt,1,6,289,TPESampler,COMPLETE
3940,0.4161382523213348,2025-04-25 01:00:07.038437,2025-04-25 01:00:26.105377,0 days 00:00:19.066940,False,absolute_error,50,sqrt,2,4,515,TPESampler,COMPLETE
3941,0.3385606089135191,2025-04-25 01:00:08.167688,2025-04-25 01:00:44.116278,0 days 00:00:35.948590,False,absolute_error,43,sqrt,1,3,720,TPESampler,COMPLETE
3942,0.3270424277201201,2025-04-25 01:00:16.014011,2025-04-25 01:00:49.147063,0 days 00:00:33.133052,False,absolute_error,50,sqrt,1,4,677,TPESampler,COMPLETE
3943,0.3536920566008384,2025-04-25 01:00:21.013387,2025-04-25 01:00:43.121716,0 days 00:00:22.108329,True,absolute_error,43,sqrt,1,3,641,TPESampler,COMPLETE
3944,0.6149488824542287,2025-04-25 01:00:26.338146,2025-04-25 01:00:32.414023,0 days 00:00:06.075877,False,absolute_error,40,log2,2,5,459,TPESampler,COMPLETE
3945,0.32551920337067203,2025-04-25 01:00:29.560057,2025-04-25 01:00:43.044176,0 days 00:00:13.484119,False,absolute_error,50,sqrt,1,5,347,TPESampler,COMPLETE
3946,0.42170649105373187,2025-04-25 01:00:32.711476,2025-04-25 01:00:45.981754,0 days 00:00:13.270278,False,absolute_error,42,sqrt,2,6,521,TPESampler,COMPLETE
3947,0.3323443159137902,2025-04-25 01:00:43.286789,2025-04-25 01:01:02.225516,0 days 00:00:18.938727,False,absolute_error,42,sqrt,1,5,509,TPESampler,COMPLETE
3948,0.488747207810078,2025-04-25 01:00:43.431576,2025-04-25 01:00:53.145835,0 days 00:00:09.714259,True,absolute_error,5,,5,14,335,TPESampler,COMPLETE
3949,0.3316565424864937,2025-04-25 01:00:44.492003,2025-04-25 01:01:06.702495,0 days 00:00:22.210492,False,absolute_error,50,sqrt,1,3,575,TPESampler,COMPLETE
3950,0.3250356982107424,2025-04-25 01:00:46.212182,2025-04-25 01:00:56.283770,0 days 00:00:10.071588,False,absolute_error,50,sqrt,1,5,256,TPESampler,COMPLETE
3951,0.41357442655905663,2025-04-25 01:00:49.388864,2025-04-25 01:00:53.117633,0 days 00:00:03.728769,False,absolute_error,43,sqrt,2,7,125,TPESampler,COMPLETE
3952,0.33219655345387356,2025-04-25 01:00:53.314520,2025-04-25 01:01:13.906682,0 days 00:00:20.592162,False,absolute_error,43,sqrt,1,4,540,TPESampler,COMPLETE
3953,0.34532406665811916,2025-04-25 01:00:53.363061,2025-04-25 01:01:13.406992,0 days 00:00:20.043931,False,absolute_error,50,sqrt,1,10,526,TPESampler,COMPLETE
3954,0.3407387969866926,2025-04-25 01:00:56.556882,2025-04-25 01:01:20.552615,0 days 00:00:23.995733,False,absolute_error,50,sqrt,1,8,620,TPESampler,COMPLETE
3955,0.33920737577647503,2025-04-25 01:01:02.454328,2025-04-25 01:01:17.076087,0 days 00:00:14.621759,False,absolute_error,44,sqrt,1,7,393,TPESampler,COMPLETE
3956,0.4133240198978246,2025-04-25 01:01:06.957399,2025-04-25 01:01:10.308715,0 days 00:00:03.351316,False,absolute_error,49,sqrt,2,7,108,TPESampler,COMPLETE
3957,0.33319096593789355,2025-04-25 01:01:10.541197,2025-04-25 01:01:27.960032,0 days 00:00:17.418835,False,absolute_error,43,sqrt,1,4,461,TPESampler,COMPLETE
3958,0.3269178037328908,2025-04-25 01:01:13.636439,2025-04-25 01:01:30.215880,0 days 00:00:16.579441,False,absolute_error,50,sqrt,1,4,427,TPESampler,COMPLETE
3959,0.44641094470413206,2025-04-25 01:01:14.230971,2025-04-25 01:03:13.188708,0 days 00:01:58.957737,False,absolute_error,44,,1,6,505,TPESampler,COMPLETE
3960,0.3392705352065339,2025-04-25 01:01:17.308095,2025-04-25 01:01:19.612691,0 days 00:00:02.304596,False,squared_error,42,sqrt,1,3,514,TPESampler,COMPLETE
3961,0.3471855095533333,2025-04-25 01:01:19.844285,2025-04-25 01:01:41.139507,0 days 00:00:21.295222,False,absolute_error,43,sqrt,1,2,546,TPESampler,COMPLETE
3962,0.47538867632183024,2025-04-25 01:01:20.918930,2025-04-25 01:01:23.414584,0 days 00:00:02.495654,True,squared_error,6,,5,2,612,TPESampler,COMPLETE
3963,0.4563044444809069,2025-04-25 01:01:23.644961,2025-04-25 01:01:30.057068,0 days 00:00:06.412107,True,absolute_error,43,sqrt,2,4,477,TPESampler,COMPLETE
3964,0.33840075467232295,2025-04-25 01:01:28.201853,2025-04-25 01:01:30.266245,0 days 00:00:02.064392,False,squared_error,47,sqrt,1,5,533,TPESampler,COMPLETE
3965,0.3413188368906459,2025-04-25 01:01:30.307509,2025-04-25 01:01:54.259546,0 days 00:00:23.952037,False,absolute_error,50,sqrt,1,8,643,TPESampler,COMPLETE
3966,0.3488858669940304,2025-04-25 01:01:30.450969,2025-04-25 01:02:06.213259,0 days 00:00:35.762290,False,absolute_error,40,sqrt,1,2,909,TPESampler,COMPLETE
3967,0.32756281794326664,2025-04-25 01:01:30.510789,2025-04-25 01:01:51.951293,0 days 00:00:21.440504,False,absolute_error,50,sqrt,1,4,552,TPESampler,COMPLETE
3968,0.421728396881212,2025-04-25 01:01:41.367158,2025-04-25 01:02:00.565143,0 days 00:00:19.197985,False,absolute_error,45,sqrt,2,5,776,TPESampler,COMPLETE
3969,0.42347197367426437,2025-04-25 01:01:52.190507,2025-04-25 01:02:05.714112,0 days 00:00:13.523605,False,absolute_error,45,log2,1,12,453,TPESampler,COMPLETE
3970,0.4246183086530092,2025-04-25 01:01:54.485955,2025-04-25 01:01:59.852240,0 days 00:00:05.366285,False,absolute_error,32,sqrt,2,2,200,TPESampler,COMPLETE
3971,0.3338956509309926,2025-04-25 01:02:00.083869,2025-04-25 01:02:30.449315,0 days 00:00:30.365446,False,absolute_error,44,sqrt,1,5,791,TPESampler,COMPLETE
3972,0.4242704886050525,2025-04-25 01:02:00.829831,2025-04-25 01:02:16.886179,0 days 00:00:16.056348,False,absolute_error,43,sqrt,2,7,637,TPESampler,COMPLETE
3973,0.41759588186332486,2025-04-25 01:02:05.955327,2025-04-25 01:02:26.790541,0 days 00:00:20.835214,False,absolute_error,50,sqrt,2,4,800,TPESampler,COMPLETE
3974,0.335102651558344,2025-04-25 01:02:06.501954,2025-04-25 01:02:23.418946,0 days 00:00:16.916992,False,absolute_error,50,sqrt,1,7,409,TPESampler,COMPLETE
3975,0.4550078743407051,2025-04-25 01:02:17.131358,2025-04-25 01:02:22.987934,0 days 00:00:05.856576,True,absolute_error,50,sqrt,2,4,335,TPESampler,COMPLETE
3976,0.41935729758389173,2025-04-25 01:02:19.682617,2025-04-25 01:02:28.097126,0 days 00:00:08.414509,False,absolute_error,50,sqrt,2,7,288,TPESampler,COMPLETE
3977,0.32637869933670005,2025-04-25 01:02:23.241798,2025-04-25 01:02:42.867549,0 days 00:00:19.625751,False,absolute_error,50,sqrt,1,5,514,TPESampler,COMPLETE
3978,0.3479158977971707,2025-04-25 01:02:23.661771,2025-04-25 01:02:36.914070,0 days 00:00:13.252299,False,absolute_error,34,sqrt,1,5,369,TPESampler,COMPLETE
3979,0.33910225861455323,2025-04-25 01:02:27.018261,2025-04-25 01:02:52.353647,0 days 00:00:25.335386,False,absolute_error,43,sqrt,1,3,676,TPESampler,COMPLETE
3980,0.32671212369533825,2025-04-25 01:02:28.336754,2025-04-25 01:02:59.023501,0 days 00:00:30.686747,False,absolute_error,50,sqrt,1,4,808,TPESampler,COMPLETE
3981,0.33961260751869604,2025-04-25 01:02:30.675443,2025-04-25 01:02:55.210816,0 days 00:00:24.535373,False,absolute_error,44,sqrt,1,6,654,TPESampler,COMPLETE
3982,0.8097493514921167,2025-04-25 01:02:37.145664,2025-04-25 01:02:38.257377,0 days 00:00:01.111713,True,absolute_error,8,sqrt,12,5,189,TPESampler,COMPLETE
3983,0.3326181395459999,2025-04-25 01:02:38.491696,2025-04-25 01:03:05.765976,0 days 00:00:27.274280,False,absolute_error,50,sqrt,1,3,716,TPESampler,COMPLETE
3984,0.4813049903359867,2025-04-25 01:02:43.092967,2025-04-25 01:02:45.106306,0 days 00:00:02.013339,True,squared_error,35,log2,1,27,839,TPESampler,COMPLETE
3985,0.49444197280038477,2025-04-25 01:02:45.773052,2025-04-25 01:02:50.673045,0 days 00:00:04.899993,False,squared_error,7,,1,28,921,TPESampler,COMPLETE
3986,0.42027029440891234,2025-04-25 01:02:50.994956,2025-04-25 01:03:03.976416,0 days 00:00:12.981460,False,absolute_error,43,sqrt,2,5,485,TPESampler,COMPLETE
3987,0.41806751862860064,2025-04-25 01:02:52.607018,2025-04-25 01:03:14.495635,0 days 00:00:21.888617,False,absolute_error,50,sqrt,2,4,685,TPESampler,COMPLETE
3988,0.38571653834506997,2025-04-25 01:02:55.819161,2025-04-25 01:04:07.175241,0 days 00:01:11.356080,False,absolute_error,40,,2,8,520,TPESampler,COMPLETE
3989,0.4091845910424104,2025-04-25 01:02:59.254421,2025-04-25 01:03:03.486941,0 days 00:00:04.232520,False,absolute_error,50,sqrt,2,4,146,TPESampler,COMPLETE
3990,0.34506190395725794,2025-04-25 01:03:03.714675,2025-04-25 01:03:26.751191,0 days 00:00:23.036516,False,absolute_error,42,sqrt,1,7,630,TPESampler,COMPLETE
3991,0.414137039887505,2025-04-25 01:03:04.288680,2025-04-25 01:03:11.589984,0 days 00:00:07.301304,False,absolute_error,43,sqrt,2,3,272,TPESampler,COMPLETE
3992,0.3253241546376321,2025-04-25 01:03:06.000651,2025-04-25 01:03:28.383294,0 days 00:00:22.382643,False,absolute_error,50,sqrt,1,5,568,TPESampler,COMPLETE
3993,0.34425844834557773,2025-04-25 01:03:11.811174,2025-04-25 01:03:17.569899,0 days 00:00:05.758725,False,absolute_error,42,sqrt,1,3,139,TPESampler,COMPLETE
