number,value,datetime_start,datetime_complete,duration,params_bootstrap,params_criterion,params_max_depth,params_max_features,params_min_samples_leaf,params_min_samples_split,params_n_estimators,system_attrs_auto:sampler,state
3171,0.4425699442059011,2025-04-25 00:18:45.638812,2025-04-25 00:20:21.479500,0 days 00:01:35.840688,False,absolute_error,41,,1,6,423,TPESampler,COMPLETE
3172,0.4188862271598983,2025-04-25 00:18:46.567118,2025-04-25 00:19:08.708220,0 days 00:00:22.141102,False,absolute_error,42,sqrt,2,4,598,TPESampler,COMPLETE
3173,0.3382153676495671,2025-04-25 00:18:48.021718,2025-04-25 00:18:59.258592,0 days 00:00:11.236874,False,absolute_error,42,sqrt,1,3,288,TPESampler,COMPLETE
3174,0.6951204557993225,2025-04-25 00:18:59.470491,2025-04-25 00:19:00.708569,0 days 00:00:01.238078,True,absolute_error,31,log2,2,2,115,TPESampler,COMPLETE
3175,0.34706917471959065,2025-04-25 00:19:00.921304,2025-04-25 00:19:16.989358,0 days 00:00:16.068054,False,absolute_error,44,sqrt,1,2,411,TPESampler,COMPLETE
3176,0.33966162695152224,2025-04-25 00:19:06.559156,2025-04-25 00:19:22.340708,0 days 00:00:15.781552,False,absolute_error,42,sqrt,1,6,420,TPESampler,COMPLETE
3177,0.8174064613595821,2025-04-25 00:19:08.917052,2025-04-25 00:19:10.504238,0 days 00:00:01.587186,False,absolute_error,24,log2,6,11,301,TPESampler,COMPLETE
3178,0.3450961691740628,2025-04-25 00:19:10.721991,2025-04-25 00:19:25.756084,0 days 00:00:15.034093,False,absolute_error,50,sqrt,1,2,369,TPESampler,COMPLETE
3179,0.32544866718970855,2025-04-25 00:19:17.203212,2025-04-25 00:19:38.223991,0 days 00:00:21.020779,False,absolute_error,50,sqrt,1,5,563,TPESampler,COMPLETE
3180,0.4667023257673351,2025-04-25 00:19:22.554463,2025-04-25 00:20:02.377057,0 days 00:00:39.822594,False,absolute_error,38,,6,9,655,TPESampler,COMPLETE
3181,0.38548187803545697,2025-04-25 00:19:25.988841,2025-04-25 00:19:27.858292,0 days 00:00:01.869451,True,squared_error,35,sqrt,1,7,603,TPESampler,COMPLETE
3182,0.41760313614419237,2025-04-25 00:19:28.077490,2025-04-25 00:19:29.807065,0 days 00:00:01.729575,False,squared_error,46,sqrt,2,5,665,TPESampler,COMPLETE
3183,0.6879790775197473,2025-04-25 00:19:30.034602,2025-04-25 00:19:31.197514,0 days 00:00:01.162912,False,squared_error,5,sqrt,1,19,536,TPESampler,COMPLETE
3184,0.4582761118166124,2025-04-25 00:19:31.412542,2025-04-25 00:19:40.234581,0 days 00:00:08.822039,True,absolute_error,44,sqrt,2,8,695,TPESampler,COMPLETE
3185,0.325048025562376,2025-04-25 00:19:38.437133,2025-04-25 00:20:00.217837,0 days 00:00:21.780704,False,absolute_error,50,sqrt,1,5,585,TPESampler,COMPLETE
3186,0.33282293623842685,2025-04-25 00:19:40.453316,2025-04-25 00:19:43.081810,0 days 00:00:02.628494,False,squared_error,50,sqrt,1,4,720,TPESampler,COMPLETE
3187,0.386836871654551,2025-04-25 00:19:43.297467,2025-04-25 00:19:45.749159,0 days 00:00:02.451692,True,squared_error,42,sqrt,1,11,974,TPESampler,COMPLETE
3188,0.4697165386890878,2025-04-25 00:19:45.962531,2025-04-25 00:20:01.235738,0 days 00:00:15.273207,True,absolute_error,44,,8,17,686,TPESampler,COMPLETE
3189,0.3306006771170303,2025-04-25 00:19:55.129476,2025-04-25 00:20:04.709405,0 days 00:00:09.579929,False,absolute_error,50,sqrt,1,6,245,TPESampler,COMPLETE
3190,0.45691298887128534,2025-04-25 00:20:00.428783,2025-04-25 00:20:06.243458,0 days 00:00:05.814675,True,absolute_error,36,sqrt,2,2,418,TPESampler,COMPLETE
3191,0.41389843855593855,2025-04-25 00:20:01.444852,2025-04-25 00:20:02.401339,0 days 00:00:00.956487,False,squared_error,46,sqrt,2,3,170,TPESampler,COMPLETE
3192,0.32678524945855153,2025-04-25 00:20:02.539871,2025-04-25 00:20:28.778216,0 days 00:00:26.238345,False,absolute_error,50,sqrt,1,4,690,TPESampler,COMPLETE
3193,0.41883340406436553,2025-04-25 00:20:02.596192,2025-04-25 00:20:12.496941,0 days 00:00:09.900749,False,absolute_error,50,sqrt,2,5,370,TPESampler,COMPLETE
3194,0.40801361168734773,2025-04-25 00:20:04.933596,2025-04-25 00:20:08.432888,0 days 00:00:03.499292,False,absolute_error,50,sqrt,2,3,112,TPESampler,COMPLETE
3195,0.3754252547640041,2025-04-25 00:20:06.449842,2025-04-25 00:20:18.798911,0 days 00:00:12.349069,False,absolute_error,46,log2,1,3,429,TPESampler,COMPLETE
3196,0.3409031018316044,2025-04-25 00:20:08.636949,2025-04-25 00:20:34.232658,0 days 00:00:25.595709,False,absolute_error,43,sqrt,1,6,696,TPESampler,COMPLETE
3197,0.32815887020719486,2025-04-25 00:20:12.715242,2025-04-25 00:20:34.446588,0 days 00:00:21.731346,False,absolute_error,50,sqrt,1,4,516,TPESampler,COMPLETE
3198,0.3344504629338577,2025-04-25 00:20:19.013225,2025-04-25 00:20:23.514647,0 days 00:00:04.501422,False,absolute_error,50,sqrt,1,6,103,TPESampler,COMPLETE
3199,0.330889250350295,2025-04-25 00:20:20.656275,2025-04-25 00:20:38.021099,0 days 00:00:17.364824,False,absolute_error,44,sqrt,1,4,457,TPESampler,COMPLETE
3200,0.42109319440432535,2025-04-25 00:20:21.689401,2025-04-25 00:20:25.574865,0 days 00:00:03.885464,True,squared_error,38,,4,12,741,TPESampler,COMPLETE
3201,0.4144889376732634,2025-04-25 00:20:23.721744,2025-04-25 00:20:30.727427,0 days 00:00:07.005683,False,absolute_error,43,sqrt,2,3,264,TPESampler,COMPLETE
3202,0.33272280921364983,2025-04-25 00:20:25.957967,2025-04-25 00:20:44.982988,0 days 00:00:19.025021,False,absolute_error,43,sqrt,1,4,507,TPESampler,COMPLETE
3203,0.3573306714736386,2025-04-25 00:20:29.008311,2025-04-25 00:20:31.104459,0 days 00:00:02.096148,False,squared_error,50,sqrt,1,12,685,TPESampler,COMPLETE
3204,0.7685334502310254,2025-04-25 00:20:30.938455,2025-04-25 00:20:33.508719,0 days 00:00:02.570264,False,absolute_error,32,sqrt,14,10,604,TPESampler,COMPLETE
3205,0.35683156590287857,2025-04-25 00:20:31.327462,2025-04-25 00:20:44.346309,0 days 00:00:13.018847,True,absolute_error,50,sqrt,1,5,585,TPESampler,COMPLETE
3206,0.3386046429018911,2025-04-25 00:20:33.707458,2025-04-25 00:20:57.827443,0 days 00:00:24.119985,False,absolute_error,43,sqrt,1,3,604,TPESampler,COMPLETE
3207,0.42462943994570296,2025-04-25 00:20:34.693403,2025-04-25 00:20:53.290265,0 days 00:00:18.596862,False,absolute_error,44,sqrt,2,7,666,TPESampler,COMPLETE
3208,0.4181833696945405,2025-04-25 00:20:34.873442,2025-04-25 00:20:53.138038,0 days 00:00:18.264596,False,absolute_error,50,sqrt,2,2,731,TPESampler,COMPLETE
3209,0.332019023277173,2025-04-25 00:20:38.235897,2025-04-25 00:20:51.986820,0 days 00:00:13.750923,False,absolute_error,43,sqrt,1,4,362,TPESampler,COMPLETE
3210,0.42390826717004815,2025-04-25 00:20:44.576365,2025-04-25 00:21:05.115830,0 days 00:00:20.539465,False,absolute_error,50,sqrt,2,7,749,TPESampler,COMPLETE
3211,0.3572999545503099,2025-04-25 00:20:45.262396,2025-04-25 00:21:09.083680,0 days 00:00:23.821284,False,absolute_error,50,sqrt,1,13,633,TPESampler,COMPLETE
3212,0.32673661017387734,2025-04-25 00:20:52.200403,2025-04-25 00:21:20.002619,0 days 00:00:27.802216,False,absolute_error,50,sqrt,1,4,703,TPESampler,COMPLETE
3213,0.32823451252880037,2025-04-25 00:20:53.354662,2025-04-25 00:21:07.894458,0 days 00:00:14.539796,False,absolute_error,50,sqrt,1,4,318,TPESampler,COMPLETE
3214,0.3388945542210098,2025-04-25 00:20:53.529215,2025-04-25 00:21:05.229834,0 days 00:00:11.700619,False,absolute_error,44,sqrt,1,6,308,TPESampler,COMPLETE
3215,0.3300272978307033,2025-04-25 00:20:58.038678,2025-04-25 00:21:13.283737,0 days 00:00:15.245059,False,absolute_error,50,sqrt,1,6,400,TPESampler,COMPLETE
3216,0.3315275743098977,2025-04-25 00:21:05.366748,2025-04-25 00:21:19.824605,0 days 00:00:14.457857,False,absolute_error,50,sqrt,1,3,365,TPESampler,COMPLETE
3217,0.3390367602378261,2025-04-25 00:21:05.464501,2025-04-25 00:21:29.961485,0 days 00:00:24.496984,False,absolute_error,43,sqrt,1,3,641,TPESampler,COMPLETE
3218,0.8341572103100607,2025-04-25 00:21:08.102682,2025-04-25 00:21:09.432867,0 days 00:00:01.330185,False,absolute_error,5,log2,7,14,276,TPESampler,COMPLETE
3219,0.4167431264331171,2025-04-25 00:21:09.295876,2025-04-25 00:21:23.866222,0 days 00:00:14.570346,False,absolute_error,50,sqrt,2,3,585,TPESampler,COMPLETE
3220,0.38099330550529314,2025-04-25 00:21:09.662510,2025-04-25 00:21:24.735405,0 days 00:00:15.072895,False,absolute_error,32,sqrt,1,11,431,TPESampler,COMPLETE
3221,0.3359261242627444,2025-04-25 00:21:13.491200,2025-04-25 00:21:33.542199,0 days 00:00:20.050999,False,absolute_error,50,sqrt,1,7,533,TPESampler,COMPLETE
3222,0.34537768634776833,2025-04-25 00:21:20.036331,2025-04-25 00:21:49.200181,0 days 00:00:29.163850,False,absolute_error,45,sqrt,1,2,632,TPESampler,COMPLETE
3223,0.35232625442323223,2025-04-25 00:21:20.293313,2025-04-25 00:21:43.383339,0 days 00:00:23.090026,False,absolute_error,43,sqrt,1,9,632,TPESampler,COMPLETE
3224,0.3721310564649461,2025-04-25 00:21:24.083170,2025-04-25 00:21:36.193263,0 days 00:00:12.110093,True,absolute_error,43,sqrt,1,7,523,TPESampler,COMPLETE
3225,0.3529104220520384,2025-04-25 00:21:24.969993,2025-04-25 00:21:46.409830,0 days 00:00:21.439837,False,absolute_error,33,sqrt,1,4,500,TPESampler,COMPLETE
3226,0.8721228221054537,2025-04-25 00:21:30.197097,2025-04-25 00:21:31.394200,0 days 00:00:01.197103,True,absolute_error,23,log2,13,13,371,TPESampler,COMPLETE
3227,0.34084216018979085,2025-04-25 00:21:31.601106,2025-04-25 00:21:52.103785,0 days 00:00:20.502679,False,absolute_error,42,sqrt,1,6,523,TPESampler,COMPLETE
3228,0.3263476741916599,2025-04-25 00:21:33.743304,2025-04-25 00:21:57.677174,0 days 00:00:23.933870,False,absolute_error,50,sqrt,1,4,633,TPESampler,COMPLETE
3229,0.3437349525781275,2025-04-25 00:21:36.406640,2025-04-25 00:22:06.419439,0 days 00:00:30.012799,False,absolute_error,50,sqrt,1,9,789,TPESampler,COMPLETE
3230,0.41313577008213137,2025-04-25 00:21:43.592133,2025-04-25 00:22:55.613440,0 days 00:01:12.021307,False,absolute_error,48,,2,4,524,TPESampler,COMPLETE
3231,0.32739719077277973,2025-04-25 00:21:46.617713,2025-04-25 00:22:04.577536,0 days 00:00:17.959823,False,absolute_error,50,sqrt,1,4,469,TPESampler,COMPLETE
3232,0.4160213956180503,2025-04-25 00:21:49.422410,2025-04-25 00:22:00.517473,0 days 00:00:11.095063,False,absolute_error,44,sqrt,2,4,442,TPESampler,COMPLETE
3233,0.34763669999457664,2025-04-25 00:21:52.307795,2025-04-25 00:22:15.985831,0 days 00:00:23.678036,False,absolute_error,35,sqrt,1,4,636,TPESampler,COMPLETE
3234,0.33593501311338936,2025-04-25 00:21:57.880053,2025-04-25 00:22:23.681646,0 days 00:00:25.801593,False,absolute_error,50,sqrt,1,7,693,TPESampler,COMPLETE
3235,0.33031268999063745,2025-04-25 00:22:00.741356,2025-04-25 00:22:13.527504,0 days 00:00:12.786148,False,absolute_error,42,sqrt,1,4,338,TPESampler,COMPLETE
3236,0.3409574823792002,2025-04-25 00:22:04.791290,2025-04-25 00:22:26.399991,0 days 00:00:21.608701,False,absolute_error,50,sqrt,1,8,577,TPESampler,COMPLETE
3237,0.619708097232442,2025-04-25 00:22:06.632034,2025-04-25 00:22:17.164800,0 days 00:00:10.532766,False,absolute_error,48,log2,2,4,761,TPESampler,COMPLETE
3238,0.3352669356471401,2025-04-25 00:22:13.736887,2025-04-25 00:22:31.923671,0 days 00:00:18.186784,False,absolute_error,44,sqrt,1,5,453,TPESampler,COMPLETE
3239,0.42991560292847003,2025-04-25 00:22:16.199015,2025-04-25 00:22:31.928047,0 days 00:00:15.729032,False,absolute_error,34,sqrt,2,6,648,TPESampler,COMPLETE
3240,0.33180404766346827,2025-04-25 00:22:17.388212,2025-04-25 00:22:38.455367,0 days 00:00:21.067155,False,absolute_error,43,sqrt,1,4,570,TPESampler,COMPLETE
3241,0.3409290953638694,2025-04-25 00:22:23.895283,2025-04-25 00:22:51.536854,0 days 00:00:27.641571,False,absolute_error,42,sqrt,1,6,760,TPESampler,COMPLETE
3242,0.359524443294469,2025-04-25 00:22:26.612203,2025-04-25 00:22:44.246424,0 days 00:00:17.634221,True,absolute_error,42,sqrt,1,4,661,TPESampler,COMPLETE
3243,0.4794085615785056,2025-04-25 00:22:32.165756,2025-04-25 00:22:42.778001,0 days 00:00:10.612245,False,absolute_error,50,,6,40,161,TPESampler,COMPLETE
3244,0.3644370929985952,2025-04-25 00:22:32.165833,2025-04-25 00:22:48.241370,0 days 00:00:16.075537,False,absolute_error,50,log2,1,3,442,TPESampler,COMPLETE
3245,0.7107374876502265,2025-04-25 00:22:38.666726,2025-04-25 00:22:39.899456,0 days 00:00:01.232730,True,squared_error,24,sqrt,6,5,473,TPESampler,COMPLETE
3246,0.4212038093875116,2025-04-25 00:22:40.103364,2025-04-25 00:22:54.616407,0 days 00:00:14.513043,False,absolute_error,43,sqrt,2,6,544,TPESampler,COMPLETE
3247,0.8385408481801795,2025-04-25 00:22:43.313759,2025-04-25 00:22:44.849209,0 days 00:00:01.535450,True,squared_error,26,log2,5,3,361,TPESampler,COMPLETE
3248,0.35082471898160794,2025-04-25 00:22:44.734886,2025-04-25 00:23:04.842751,0 days 00:00:20.107865,True,absolute_error,31,,1,4,124,TPESampler,COMPLETE
3249,0.3268061286070785,2025-04-25 00:22:45.206082,2025-04-25 00:23:08.015329,0 days 00:00:22.809247,False,absolute_error,50,sqrt,1,4,569,TPESampler,COMPLETE
3250,0.4169453491627699,2025-04-25 00:22:48.670236,2025-04-25 00:23:08.543605,0 days 00:00:19.873369,False,absolute_error,50,sqrt,2,4,594,TPESampler,COMPLETE
3251,0.33174556413881456,2025-04-25 00:22:52.064367,2025-04-25 00:23:16.708067,0 days 00:00:24.643700,False,absolute_error,43,sqrt,1,4,611,TPESampler,COMPLETE
3252,0.7116441709535826,2025-04-25 00:22:54.894847,2025-04-25 00:22:57.843899,0 days 00:00:02.949052,False,absolute_error,24,sqrt,9,34,429,TPESampler,COMPLETE
3253,0.3360937434793735,2025-04-25 00:22:55.933769,2025-04-25 00:23:16.197947,0 days 00:00:20.264178,False,absolute_error,50,sqrt,1,7,433,TPESampler,COMPLETE
3254,0.3373157486908544,2025-04-25 00:22:58.059356,2025-04-25 00:23:23.727299,0 days 00:00:25.667943,False,absolute_error,44,sqrt,1,3,668,TPESampler,COMPLETE
3255,0.4138955313230345,2025-04-25 00:23:05.061384,2025-04-25 00:23:14.425706,0 days 00:00:09.364322,False,absolute_error,50,sqrt,2,4,339,TPESampler,COMPLETE
3256,0.3410551756389844,2025-04-25 00:23:08.232490,2025-04-25 00:23:31.544028,0 days 00:00:23.311538,False,absolute_error,43,sqrt,1,6,550,TPESampler,COMPLETE
3257,0.4168753180437131,2025-04-25 00:23:08.803060,2025-04-25 00:23:20.627500,0 days 00:00:11.824440,False,absolute_error,43,sqrt,2,2,463,TPESampler,COMPLETE
3258,0.4210488664127583,2025-04-25 00:23:14.633923,2025-04-25 00:23:32.824675,0 days 00:00:18.190752,False,absolute_error,50,sqrt,2,5,740,TPESampler,COMPLETE
3259,0.3457383766257596,2025-04-25 00:23:16.399277,2025-04-25 00:23:28.783159,0 days 00:00:12.383882,False,absolute_error,43,sqrt,1,2,313,TPESampler,COMPLETE
3260,0.4161536626050706,2025-04-25 00:23:16.941208,2025-04-25 00:23:32.868551,0 days 00:00:15.927343,False,absolute_error,50,sqrt,2,2,551,TPESampler,COMPLETE
3261,0.4217776244692929,2025-04-25 00:23:20.850129,2025-04-25 00:23:33.431240,0 days 00:00:12.581111,False,absolute_error,50,sqrt,2,7,496,TPESampler,COMPLETE
3262,0.33870753261962294,2025-04-25 00:23:23.932393,2025-04-25 00:23:51.609026,0 days 00:00:27.676633,False,absolute_error,43,sqrt,1,3,746,TPESampler,COMPLETE
3263,0.38395722143880356,2025-04-25 00:23:28.999216,2025-04-25 00:23:57.894935,0 days 00:00:28.895719,False,absolute_error,50,log2,1,7,791,TPESampler,COMPLETE
3264,0.33818407804164374,2025-04-25 00:23:31.755315,2025-04-25 00:23:40.655358,0 days 00:00:08.900043,False,absolute_error,43,sqrt,1,6,230,TPESampler,COMPLETE
3265,0.3350319009631834,2025-04-25 00:23:33.055400,2025-04-25 00:24:01.259640,0 days 00:00:28.204240,False,absolute_error,50,sqrt,1,7,585,TPESampler,COMPLETE
3266,0.32535965490253604,2025-04-25 00:23:33.088831,2025-04-25 00:23:57.984916,0 days 00:00:24.896085,False,absolute_error,50,sqrt,1,5,650,TPESampler,COMPLETE
3267,0.3418914925365819,2025-04-25 00:23:33.741657,2025-04-25 00:24:00.527101,0 days 00:00:26.785444,False,absolute_error,43,sqrt,1,7,739,TPESampler,COMPLETE
3268,0.3329181888291382,2025-04-25 00:23:40.861986,2025-04-25 00:23:57.208239,0 days 00:00:16.346253,False,absolute_error,43,sqrt,1,4,432,TPESampler,COMPLETE
3269,0.3471477720419269,2025-04-25 00:23:51.825455,2025-04-25 00:23:53.528979,0 days 00:00:01.703524,False,squared_error,42,sqrt,1,7,479,TPESampler,COMPLETE
3270,0.3869767812792917,2025-04-25 00:23:53.740022,2025-04-25 00:23:58.994380,0 days 00:00:05.254358,False,squared_error,35,,1,14,601,TPESampler,COMPLETE
3271,0.3459942523822802,2025-04-25 00:23:57.417468,2025-04-25 00:24:15.412451,0 days 00:00:17.994983,False,absolute_error,50,sqrt,1,2,441,TPESampler,COMPLETE
3272,0.6205224829378556,2025-04-25 00:23:58.260603,2025-04-25 00:24:05.700107,0 days 00:00:07.439504,False,absolute_error,48,log2,2,5,575,TPESampler,COMPLETE
3273,0.42168479806232134,2025-04-25 00:23:58.427796,2025-04-25 00:24:16.105240,0 days 00:00:17.677444,False,absolute_error,43,sqrt,2,6,595,TPESampler,COMPLETE
3274,0.3331003337550015,2025-04-25 00:23:59.240777,2025-04-25 00:24:31.610235,0 days 00:00:32.369458,False,absolute_error,50,sqrt,1,3,778,TPESampler,COMPLETE
3275,0.3446571647974936,2025-04-25 00:24:00.744386,2025-04-25 00:24:05.876096,0 days 00:00:05.131710,False,absolute_error,42,sqrt,1,3,120,TPESampler,COMPLETE
3276,0.4123669234955585,2025-04-25 00:24:01.528202,2025-04-25 00:24:09.162463,0 days 00:00:07.634261,False,absolute_error,49,sqrt,2,3,288,TPESampler,COMPLETE
3277,0.33419172256733876,2025-04-25 00:24:05.921826,2025-04-25 00:24:17.558277,0 days 00:00:11.636451,False,absolute_error,44,sqrt,1,3,297,TPESampler,COMPLETE
3278,0.3310524067672579,2025-04-25 00:24:06.198502,2025-04-25 00:24:31.190424,0 days 00:00:24.991922,False,absolute_error,50,sqrt,1,6,623,TPESampler,COMPLETE
3279,0.3282159937876332,2025-04-25 00:24:09.384660,2025-04-25 00:24:21.682677,0 days 00:00:12.298017,False,absolute_error,50,sqrt,1,4,316,TPESampler,COMPLETE
3280,0.3316227030715579,2025-04-25 00:24:15.622350,2025-04-25 00:24:42.471927,0 days 00:00:26.849577,False,absolute_error,50,sqrt,1,3,637,TPESampler,COMPLETE
3281,0.3320199454655559,2025-04-25 00:24:16.462612,2025-04-25 00:24:40.261637,0 days 00:00:23.799025,False,absolute_error,50,sqrt,1,3,564,TPESampler,COMPLETE
3282,0.6308394325587813,2025-04-25 00:24:17.777707,2025-04-25 00:24:28.169520,0 days 00:00:10.391813,False,absolute_error,40,log2,2,34,869,TPESampler,COMPLETE
3283,0.41908424905277386,2025-04-25 00:24:21.896682,2025-04-25 00:24:45.467197,0 days 00:00:23.570515,False,absolute_error,43,sqrt,2,3,728,TPESampler,COMPLETE
3284,0.3256180113778211,2025-04-25 00:24:28.398527,2025-04-25 00:24:46.126783,0 days 00:00:17.728256,False,absolute_error,50,sqrt,1,5,461,TPESampler,COMPLETE
3285,0.33187093409202933,2025-04-25 00:24:31.408837,2025-04-25 00:24:52.463153,0 days 00:00:21.054316,False,absolute_error,50,sqrt,1,6,438,TPESampler,COMPLETE
3286,0.4137602445823698,2025-04-25 00:24:31.845106,2025-04-25 00:24:40.899026,0 days 00:00:09.053920,False,absolute_error,50,sqrt,2,3,283,TPESampler,COMPLETE
3287,0.4241825828066958,2025-04-25 00:24:40.467833,2025-04-25 00:24:48.555817,0 days 00:00:08.087984,False,absolute_error,44,sqrt,2,9,305,TPESampler,COMPLETE
3288,0.3400239848492032,2025-04-25 00:24:41.128081,2025-04-25 00:25:10.212629,0 days 00:00:29.084548,False,absolute_error,44,sqrt,1,6,549,TPESampler,COMPLETE
3289,0.33385222208773596,2025-04-25 00:24:42.684572,2025-04-25 00:25:08.783672,0 days 00:00:26.099100,False,absolute_error,49,sqrt,1,6,707,TPESampler,COMPLETE
3290,0.3410551756389844,2025-04-25 00:24:45.757962,2025-04-25 00:25:06.036336,0 days 00:00:20.278374,False,absolute_error,43,sqrt,1,6,550,TPESampler,COMPLETE
3291,0.49012987799756863,2025-04-25 00:24:46.374007,2025-04-25 00:24:48.956989,0 days 00:00:02.582982,True,squared_error,5,,5,18,685,TPESampler,COMPLETE
3292,0.4493725875527353,2025-04-25 00:24:48.759902,2025-04-25 00:26:47.133922,0 days 00:01:58.374020,False,absolute_error,50,,1,4,481,TPESampler,COMPLETE
3293,0.33709952113641006,2025-04-25 00:24:49.196964,2025-04-25 00:25:07.661386,0 days 00:00:18.464422,False,absolute_error,44,sqrt,1,3,483,TPESampler,COMPLETE
3294,0.33099926164661336,2025-04-25 00:24:52.683057,2025-04-25 00:25:21.905955,0 days 00:00:29.222898,False,absolute_error,45,sqrt,1,4,793,TPESampler,COMPLETE
3295,0.3504476949645229,2025-04-25 00:25:06.252778,2025-04-25 00:25:12.362167,0 days 00:00:06.109389,True,absolute_error,49,sqrt,1,3,252,TPESampler,COMPLETE
3296,0.33262846807172347,2025-04-25 00:25:07.886764,2025-04-25 00:25:31.176741,0 days 00:00:23.289977,False,absolute_error,42,sqrt,1,4,579,TPESampler,COMPLETE
3297,0.41697611877428287,2025-04-25 00:25:09.001756,2025-04-25 00:25:14.788193,0 days 00:00:05.786437,False,absolute_error,50,sqrt,2,7,213,TPESampler,COMPLETE
3298,0.42186499930504456,2025-04-25 00:25:10.420498,2025-04-25 00:25:20.533752,0 days 00:00:10.113254,False,absolute_error,42,sqrt,2,6,401,TPESampler,COMPLETE
3299,0.33934526699585643,2025-04-25 00:25:12.576054,2025-04-25 00:25:23.615527,0 days 00:00:11.039473,False,absolute_error,42,sqrt,1,6,244,TPESampler,COMPLETE
3300,0.3278046475351432,2025-04-25 00:25:14.999522,2025-04-25 00:25:33.595476,0 days 00:00:18.595954,False,absolute_error,50,sqrt,1,4,487,TPESampler,COMPLETE
3301,0.4328783661591739,2025-04-25 00:25:20.749462,2025-04-25 00:25:53.533672,0 days 00:00:32.784210,True,absolute_error,35,,5,9,939,TPESampler,COMPLETE
3302,0.32559607009765956,2025-04-25 00:25:22.268997,2025-04-25 00:25:47.183088,0 days 00:00:24.914091,False,absolute_error,50,sqrt,1,5,660,TPESampler,COMPLETE
3303,0.53227547802918,2025-04-25 00:25:23.832444,2025-04-25 00:25:40.764940,0 days 00:00:16.932496,False,absolute_error,13,sqrt,2,6,901,TPESampler,COMPLETE
3304,0.41711969499161555,2025-04-25 00:25:31.396454,2025-04-25 00:25:46.410113,0 days 00:00:15.013659,False,absolute_error,44,sqrt,2,4,559,TPESampler,COMPLETE
3305,0.44371296337912325,2025-04-25 00:25:33.804803,2025-04-25 00:25:38.509613,0 days 00:00:04.704810,True,absolute_error,31,,5,21,125,TPESampler,COMPLETE
3306,0.45462513350137207,2025-04-25 00:25:38.727955,2025-04-25 00:25:48.017538,0 days 00:00:09.289583,True,absolute_error,43,sqrt,2,2,640,TPESampler,COMPLETE
3307,0.3310300099648622,2025-04-25 00:25:40.984417,2025-04-25 00:25:52.657302,0 days 00:00:11.672885,False,absolute_error,43,sqrt,1,4,303,TPESampler,COMPLETE
