number,value,datetime_start,datetime_complete,duration,params_bootstrap,params_criterion,params_max_depth,params_max_features,params_min_samples_leaf,params_min_samples_split,params_n_estimators,system_attrs_auto:sampler,state
4268,0.33130522994640926,2025-04-25 01:18:54.483562,2025-04-25 01:19:12.925285,0 days 00:00:18.441723,False,absolute_error,44,sqrt,1,4,490,TPESampler,COMPLETE
4269,0.3256249544371053,2025-04-25 01:19:03.835720,2025-04-25 01:19:34.573525,0 days 00:00:30.737805,False,absolute_error,50,sqrt,1,5,737,TPESampler,COMPLETE
4270,0.33640922369397586,2025-04-25 01:19:06.412108,2025-04-25 01:19:23.829591,0 days 00:00:17.417483,False,absolute_error,44,sqrt,1,3,453,TPESampler,COMPLETE
4271,0.4195723058599553,2025-04-25 01:19:10.198317,2025-04-25 01:19:17.895730,0 days 00:00:07.697413,False,absolute_error,50,sqrt,2,8,295,TPESampler,COMPLETE
4272,0.4178166242850424,2025-04-25 01:19:13.167989,2025-04-25 01:19:31.301930,0 days 00:00:18.133941,False,absolute_error,50,sqrt,2,3,671,TPESampler,COMPLETE
4273,0.3645999841395758,2025-04-25 01:19:18.140007,2025-04-25 01:20:39.352648,0 days 00:01:21.212641,True,absolute_error,37,,2,2,980,TPESampler,COMPLETE
4274,0.5995126953907945,2025-04-25 01:19:20.144711,2025-04-25 01:19:28.290194,0 days 00:00:08.145483,True,absolute_error,11,sqrt,3,14,962,TPESampler,COMPLETE
4275,0.6339369172117739,2025-04-25 01:19:24.059470,2025-04-25 01:19:27.165054,0 days 00:00:03.105584,False,absolute_error,49,log2,2,4,216,TPESampler,COMPLETE
4276,0.5824106296742817,2025-04-25 01:19:27.387911,2025-04-25 01:19:41.964840,0 days 00:00:14.576929,True,absolute_error,10,sqrt,1,10,929,TPESampler,COMPLETE
4277,0.384957281760326,2025-04-25 01:19:28.528186,2025-04-25 01:19:34.882661,0 days 00:00:06.354475,True,absolute_error,50,sqrt,1,14,281,TPESampler,COMPLETE
4278,0.4241066339932791,2025-04-25 01:19:31.529841,2025-04-25 01:19:44.260229,0 days 00:00:12.730388,False,absolute_error,35,sqrt,2,4,386,TPESampler,COMPLETE
4279,0.3472617470624451,2025-04-25 01:19:34.935247,2025-04-25 01:19:57.016196,0 days 00:00:22.080949,False,absolute_error,35,sqrt,1,5,620,TPESampler,COMPLETE
4280,0.3354635833820066,2025-04-25 01:19:35.307475,2025-04-25 01:19:56.473137,0 days 00:00:21.165662,False,absolute_error,50,sqrt,1,7,558,TPESampler,COMPLETE
4281,0.33206131151919904,2025-04-25 01:19:42.202055,2025-04-25 01:19:58.768106,0 days 00:00:16.566051,False,absolute_error,50,sqrt,1,3,422,TPESampler,COMPLETE
4282,0.34467625647216465,2025-04-25 01:19:44.509053,2025-04-25 01:20:09.914483,0 days 00:00:25.405430,False,absolute_error,50,sqrt,1,2,640,TPESampler,COMPLETE
4283,0.3405394703653598,2025-04-25 01:19:56.714987,2025-04-25 01:20:11.971020,0 days 00:00:15.256033,False,absolute_error,50,sqrt,1,8,401,TPESampler,COMPLETE
4284,0.3351553233023394,2025-04-25 01:19:57.337182,2025-04-25 01:20:06.382290,0 days 00:00:09.045108,False,absolute_error,40,sqrt,1,4,230,TPESampler,COMPLETE
4285,0.32758668757937126,2025-04-25 01:19:59.000989,2025-04-25 01:20:08.176922,0 days 00:00:09.175933,False,absolute_error,50,sqrt,1,4,228,TPESampler,COMPLETE
4286,0.32647117083712596,2025-04-25 01:20:06.634527,2025-04-25 01:20:30.300012,0 days 00:00:23.665485,False,absolute_error,50,sqrt,1,4,626,TPESampler,COMPLETE
4287,0.42112764623584553,2025-04-25 01:20:08.417433,2025-04-25 01:20:34.607266,0 days 00:00:26.189833,False,absolute_error,45,sqrt,2,5,813,TPESampler,COMPLETE
4288,0.33938773572996167,2025-04-25 01:20:10.143212,2025-04-25 01:20:44.871548,0 days 00:00:34.728336,False,absolute_error,42,sqrt,1,3,765,TPESampler,COMPLETE
4289,0.447944100613974,2025-04-25 01:20:12.243677,2025-04-25 01:22:55.910232,0 days 00:02:43.666555,False,absolute_error,50,,1,5,668,TPESampler,COMPLETE
4290,0.35003328884936413,2025-04-25 01:20:27.958531,2025-04-25 01:20:42.860062,0 days 00:00:14.901531,True,absolute_error,50,sqrt,1,3,610,TPESampler,COMPLETE
4291,0.33314869717577045,2025-04-25 01:20:30.546362,2025-04-25 01:20:49.292627,0 days 00:00:18.746265,False,absolute_error,43,sqrt,1,5,503,TPESampler,COMPLETE
4292,0.4180170929576603,2025-04-25 01:20:34.872234,2025-04-25 01:20:51.185758,0 days 00:00:16.313524,False,absolute_error,43,sqrt,2,4,583,TPESampler,COMPLETE
4293,0.3523050585374374,2025-04-25 01:20:39.599612,2025-04-25 01:21:01.419457,0 days 00:00:21.819845,False,absolute_error,43,sqrt,1,9,599,TPESampler,COMPLETE
4294,0.3354710228717678,2025-04-25 01:20:43.094839,2025-04-25 01:21:09.488838,0 days 00:00:26.393999,False,absolute_error,50,sqrt,1,7,649,TPESampler,COMPLETE
4295,0.41604123698625073,2025-04-25 01:20:45.135002,2025-04-25 01:20:58.709129,0 days 00:00:13.574127,False,absolute_error,50,sqrt,2,2,468,TPESampler,COMPLETE
4296,0.34087551475793204,2025-04-25 01:20:49.539837,2025-04-25 01:20:59.697178,0 days 00:00:10.157341,False,absolute_error,43,sqrt,1,7,266,TPESampler,COMPLETE
4297,0.3311111006264544,2025-04-25 01:20:51.430180,2025-04-25 01:21:14.862378,0 days 00:00:23.432198,False,absolute_error,50,sqrt,1,6,577,TPESampler,COMPLETE
4298,0.5930787850164052,2025-04-25 01:20:58.951808,2025-04-25 01:20:59.980055,0 days 00:00:01.028247,False,squared_error,44,sqrt,6,2,186,TPESampler,COMPLETE
4299,0.4384145294064307,2025-04-25 01:20:59.968020,2025-04-25 01:23:06.174224,0 days 00:02:06.206204,False,absolute_error,41,,1,10,562,TPESampler,COMPLETE
4300,0.327673426205286,2025-04-25 01:21:00.242868,2025-04-25 01:21:22.152561,0 days 00:00:21.909693,False,absolute_error,50,sqrt,1,4,501,TPESampler,COMPLETE
4301,0.33338447034804614,2025-04-25 01:21:01.670948,2025-04-25 01:21:33.338120,0 days 00:00:31.667172,False,absolute_error,43,sqrt,1,5,783,TPESampler,COMPLETE
4302,0.41725343537251686,2025-04-25 01:21:09.736070,2025-04-25 01:21:23.985471,0 days 00:00:14.249401,False,absolute_error,44,sqrt,2,3,529,TPESampler,COMPLETE
4303,0.32629310576839604,2025-04-25 01:21:15.094916,2025-04-25 01:21:31.087128,0 days 00:00:15.992212,False,absolute_error,50,sqrt,1,4,402,TPESampler,COMPLETE
4304,0.34529002541196274,2025-04-25 01:21:22.378113,2025-04-25 01:21:39.869588,0 days 00:00:17.491475,False,absolute_error,50,sqrt,1,2,430,TPESampler,COMPLETE
4305,0.33395953781013965,2025-04-25 01:21:24.217984,2025-04-25 01:21:46.786140,0 days 00:00:22.568156,False,absolute_error,44,sqrt,1,5,593,TPESampler,COMPLETE
4306,0.512228075814777,2025-04-25 01:21:31.318014,2025-04-25 01:21:40.390778,0 days 00:00:09.072764,False,absolute_error,30,,14,4,269,TPESampler,COMPLETE
4307,0.33704198062513796,2025-04-25 01:21:33.588458,2025-04-25 01:21:47.806197,0 days 00:00:14.217739,False,absolute_error,43,sqrt,1,3,370,TPESampler,COMPLETE
4308,0.3390122111046275,2025-04-25 01:21:40.110341,2025-04-25 01:22:04.822085,0 days 00:00:24.711744,False,absolute_error,43,sqrt,1,3,638,TPESampler,COMPLETE
4309,0.3254171596092742,2025-04-25 01:21:40.717946,2025-04-25 01:22:11.911591,0 days 00:00:31.193645,False,absolute_error,50,sqrt,1,5,830,TPESampler,COMPLETE
4310,0.3274620597276748,2025-04-25 01:21:47.022790,2025-04-25 01:21:57.614360,0 days 00:00:10.591570,False,absolute_error,50,sqrt,1,4,268,TPESampler,COMPLETE
4311,0.3249637260556455,2025-04-25 01:21:48.052046,2025-04-25 01:22:11.381344,0 days 00:00:23.329298,False,absolute_error,50,sqrt,1,5,624,TPESampler,COMPLETE
4312,0.4238026813863421,2025-04-25 01:21:57.855970,2025-04-25 01:22:15.232503,0 days 00:00:17.376533,False,absolute_error,43,sqrt,2,7,619,TPESampler,COMPLETE
4313,0.6236666176635909,2025-04-25 01:22:05.060618,2025-04-25 01:22:14.616589,0 days 00:00:09.555971,False,absolute_error,50,log2,2,6,681,TPESampler,COMPLETE
4314,0.32551591584847056,2025-04-25 01:22:11.624692,2025-04-25 01:22:26.335579,0 days 00:00:14.710887,False,absolute_error,50,sqrt,1,5,370,TPESampler,COMPLETE
4315,0.41344715694360373,2025-04-25 01:22:12.150810,2025-04-25 01:22:20.981091,0 days 00:00:08.830281,False,absolute_error,44,sqrt,2,4,303,TPESampler,COMPLETE
4316,0.3398653644861661,2025-04-25 01:22:14.848639,2025-04-25 01:22:32.832719,0 days 00:00:17.984080,False,absolute_error,44,sqrt,1,6,465,TPESampler,COMPLETE
4317,0.3460022357759671,2025-04-25 01:22:15.565493,2025-04-25 01:22:27.907949,0 days 00:00:12.342456,False,absolute_error,35,sqrt,1,4,329,TPESampler,COMPLETE
4318,0.33200800816618925,2025-04-25 01:22:21.231473,2025-04-25 01:22:27.945342,0 days 00:00:06.713869,False,absolute_error,42,sqrt,1,5,167,TPESampler,COMPLETE
4319,0.8697981150563354,2025-04-25 01:22:26.578211,2025-04-25 01:22:27.981984,0 days 00:00:01.403773,True,squared_error,6,log2,11,2,625,TPESampler,COMPLETE
4320,0.4782210554520256,2025-04-25 01:22:28.164776,2025-04-25 01:22:30.454404,0 days 00:00:02.289628,False,squared_error,44,,9,30,218,TPESampler,COMPLETE
4321,0.3481107306388673,2025-04-25 01:22:28.276832,2025-04-25 01:22:49.925389,0 days 00:00:21.648557,False,absolute_error,44,sqrt,1,2,537,TPESampler,COMPLETE
4322,0.3393299478234536,2025-04-25 01:22:28.331096,2025-04-25 01:22:46.501611,0 days 00:00:18.170515,False,absolute_error,42,sqrt,1,3,472,TPESampler,COMPLETE
4323,0.37253022460885904,2025-04-25 01:22:30.691769,2025-04-25 01:22:32.221360,0 days 00:00:01.529591,False,squared_error,46,log2,1,3,296,TPESampler,COMPLETE
4324,0.33235564267701684,2025-04-25 01:22:32.448891,2025-04-25 01:23:02.338365,0 days 00:00:29.889474,False,absolute_error,50,sqrt,1,6,805,TPESampler,COMPLETE
4325,0.4154535763080197,2025-04-25 01:22:33.136481,2025-04-25 01:22:43.065027,0 days 00:00:09.928546,False,absolute_error,44,sqrt,2,3,380,TPESampler,COMPLETE
4326,0.3353547385491638,2025-04-25 01:22:43.497452,2025-04-25 01:23:07.250756,0 days 00:00:23.753304,False,absolute_error,50,sqrt,1,7,626,TPESampler,COMPLETE
4327,0.3527788515748545,2025-04-25 01:22:46.880164,2025-04-25 01:22:49.870960,0 days 00:00:02.990796,False,squared_error,43,sqrt,1,8,810,TPESampler,COMPLETE
4328,0.33333714004999365,2025-04-25 01:22:50.214224,2025-04-25 01:23:08.498154,0 days 00:00:18.283930,False,absolute_error,43,sqrt,1,5,472,TPESampler,COMPLETE
4329,0.34090864678937705,2025-04-25 01:22:50.214129,2025-04-25 01:23:11.948162,0 days 00:00:21.734033,False,absolute_error,43,sqrt,1,6,557,TPESampler,COMPLETE
4330,0.5392180663036709,2025-04-25 01:22:56.377019,2025-04-25 01:22:58.893862,0 days 00:00:02.516843,False,squared_error,19,log2,1,2,967,TPESampler,COMPLETE
4331,0.42116670301086545,2025-04-25 01:22:59.142242,2025-04-25 01:23:14.755715,0 days 00:00:15.613473,False,absolute_error,44,sqrt,2,5,576,TPESampler,COMPLETE
4332,0.3391857474517173,2025-04-25 01:23:02.570644,2025-04-25 01:23:04.848484,0 days 00:00:02.277840,False,squared_error,49,sqrt,1,6,645,TPESampler,COMPLETE
4333,0.4155640056522164,2025-04-25 01:23:05.085141,2025-04-25 01:23:16.590286,0 days 00:00:11.505145,False,absolute_error,50,sqrt,2,3,436,TPESampler,COMPLETE
4334,0.4214179004992816,2025-04-25 01:23:06.417231,2025-04-25 01:23:26.019765,0 days 00:00:19.602534,False,absolute_error,50,sqrt,2,5,765,TPESampler,COMPLETE
4335,0.3361128697608952,2025-04-25 01:23:07.493611,2025-04-25 01:23:32.353075,0 days 00:00:24.859464,False,absolute_error,45,sqrt,1,3,634,TPESampler,COMPLETE
4336,0.7322962542214893,2025-04-25 01:23:08.740090,2025-04-25 01:23:10.088917,0 days 00:00:01.348827,False,squared_error,13,sqrt,11,2,659,TPESampler,COMPLETE
4337,0.35544697470751635,2025-04-25 01:23:10.324635,2025-04-25 01:23:38.653493,0 days 00:00:28.328858,False,absolute_error,35,sqrt,1,6,794,TPESampler,COMPLETE
4338,0.3254973439747985,2025-04-25 01:23:12.187278,2025-04-25 01:23:28.448507,0 days 00:00:16.261229,False,absolute_error,50,sqrt,1,5,419,TPESampler,COMPLETE
4339,0.4198313455854758,2025-04-25 01:23:15.002232,2025-04-25 01:23:28.560505,0 days 00:00:13.558273,False,absolute_error,50,sqrt,2,5,525,TPESampler,COMPLETE
4340,0.4263415795771805,2025-04-25 01:23:16.824650,2025-04-25 01:23:33.614626,0 days 00:00:16.789976,False,absolute_error,33,sqrt,2,4,697,TPESampler,COMPLETE
4341,0.33518967557296936,2025-04-25 01:23:26.268071,2025-04-25 01:23:44.012371,0 days 00:00:17.744300,False,absolute_error,44,sqrt,1,5,459,TPESampler,COMPLETE
4342,0.33171931295957213,2025-04-25 01:23:28.671858,2025-04-25 01:23:52.740707,0 days 00:00:24.068849,False,absolute_error,50,sqrt,1,3,590,TPESampler,COMPLETE
4343,0.3316067190890542,2025-04-25 01:23:28.843782,2025-04-25 01:23:47.976067,0 days 00:00:19.132285,False,absolute_error,50,sqrt,1,3,460,TPESampler,COMPLETE
4344,0.3262700875156673,2025-04-25 01:23:32.586987,2025-04-25 01:23:38.378464,0 days 00:00:05.791477,False,absolute_error,50,sqrt,1,5,133,TPESampler,COMPLETE
4345,0.3529187210355556,2025-04-25 01:23:33.845282,2025-04-25 01:23:58.837422,0 days 00:00:24.992140,False,absolute_error,50,sqrt,1,12,650,TPESampler,COMPLETE
4346,0.42432818973192343,2025-04-25 01:23:38.610478,2025-04-25 01:23:55.368986,0 days 00:00:16.758508,False,absolute_error,50,sqrt,2,8,651,TPESampler,COMPLETE
4347,0.3495657241007525,2025-04-25 01:23:39.024871,2025-04-25 01:24:05.653178,0 days 00:00:26.628307,False,absolute_error,43,sqrt,1,8,700,TPESampler,COMPLETE
4348,0.45610565517757856,2025-04-25 01:23:44.259322,2025-04-25 01:23:46.380980,0 days 00:00:02.121658,True,absolute_error,50,sqrt,2,7,108,TPESampler,COMPLETE
4349,0.3899427203319864,2025-04-25 01:23:46.617639,2025-04-25 01:24:01.559675,0 days 00:00:14.942036,False,absolute_error,40,log2,1,3,542,TPESampler,COMPLETE
4350,0.4130361416994732,2025-04-25 01:23:48.221104,2025-04-25 01:24:15.057494,0 days 00:00:26.836390,False,absolute_error,48,,2,3,192,TPESampler,COMPLETE
4351,0.3366440852059178,2025-04-25 01:23:52.979894,2025-04-25 01:24:21.754462,0 days 00:00:28.774568,False,absolute_error,44,sqrt,1,3,768,TPESampler,COMPLETE
4352,0.4473158366544065,2025-04-25 01:23:55.604882,2025-04-25 01:25:03.673532,0 days 00:01:08.068650,False,absolute_error,50,,1,5,294,TPESampler,COMPLETE
4353,0.32565850787658845,2025-04-25 01:23:59.077954,2025-04-25 01:24:17.012357,0 days 00:00:17.934403,False,absolute_error,50,sqrt,1,5,469,TPESampler,COMPLETE
4354,0.33141848951347885,2025-04-25 01:24:01.803136,2025-04-25 01:24:26.312025,0 days 00:00:24.508889,False,absolute_error,50,sqrt,1,6,635,TPESampler,COMPLETE
4355,0.3366414264843809,2025-04-25 01:24:05.890198,2025-04-25 01:24:25.769452,0 days 00:00:19.879254,False,absolute_error,44,sqrt,1,3,519,TPESampler,COMPLETE
4356,0.761475452994057,2025-04-25 01:24:15.302653,2025-04-25 01:24:16.303686,0 days 00:00:01.001033,True,squared_error,31,sqrt,8,12,205,TPESampler,COMPLETE
4357,0.4197273694150006,2025-04-25 01:24:16.544542,2025-04-25 01:24:34.694287,0 days 00:00:18.149745,False,absolute_error,45,sqrt,2,3,728,TPESampler,COMPLETE
4358,0.4186709118769895,2025-04-25 01:24:17.295031,2025-04-25 01:24:27.366557,0 days 00:00:10.071526,False,absolute_error,50,sqrt,2,5,387,TPESampler,COMPLETE
4359,0.396593179444163,2025-04-25 01:24:22.003774,2025-04-25 01:25:39.880730,0 days 00:01:17.876956,True,absolute_error,47,,2,24,953,TPESampler,COMPLETE
4360,0.33266852212703524,2025-04-25 01:24:26.012788,2025-04-25 01:24:53.807191,0 days 00:00:27.794403,False,absolute_error,50,sqrt,1,3,725,TPESampler,COMPLETE
4361,0.420933996560693,2025-04-25 01:24:26.550387,2025-04-25 01:24:45.034947,0 days 00:00:18.484560,False,absolute_error,50,sqrt,2,5,716,TPESampler,COMPLETE
4362,0.8572614142235656,2025-04-25 01:24:27.602513,2025-04-25 01:24:29.278048,0 days 00:00:01.675535,False,absolute_error,41,log2,11,2,525,TPESampler,COMPLETE
4363,0.32922491954715394,2025-04-25 01:24:29.506636,2025-04-25 01:24:39.191809,0 days 00:00:09.685173,False,absolute_error,42,sqrt,1,5,252,TPESampler,COMPLETE
4364,0.3266259285262382,2025-04-25 01:24:34.930955,2025-04-25 01:25:03.946457,0 days 00:00:29.015502,False,absolute_error,50,sqrt,1,4,737,TPESampler,COMPLETE
4365,0.3315307571350541,2025-04-25 01:24:39.423290,2025-04-25 01:25:02.583923,0 days 00:00:23.160633,False,absolute_error,43,sqrt,1,4,618,TPESampler,COMPLETE
4366,0.343482139605159,2025-04-25 01:24:45.270447,2025-04-25 01:25:04.057172,0 days 00:00:18.786725,False,absolute_error,50,sqrt,1,9,432,TPESampler,COMPLETE
4367,0.5783352694573005,2025-04-25 01:24:54.041441,2025-04-25 01:24:55.594513,0 days 00:00:01.553072,False,squared_error,15,sqrt,5,48,752,TPESampler,COMPLETE
4368,0.7152528785349483,2025-04-25 01:24:55.825446,2025-04-25 01:24:57.457847,0 days 00:00:01.632401,False,squared_error,44,sqrt,10,2,972,TPESampler,COMPLETE
4369,0.32637641512563803,2025-04-25 01:24:57.688988,2025-04-25 01:25:21.365503,0 days 00:00:23.676515,False,absolute_error,50,sqrt,1,4,618,TPESampler,COMPLETE
4370,0.33335789752401834,2025-04-25 01:25:02.820613,2025-04-25 01:25:13.486949,0 days 00:00:10.666336,False,absolute_error,50,sqrt,1,7,273,TPESampler,COMPLETE
4371,0.3320704496919102,2025-04-25 01:25:03.912645,2025-04-25 01:25:17.878974,0 days 00:00:13.966329,False,absolute_error,43,sqrt,1,4,359,TPESampler,COMPLETE
4372,0.4176662129395064,2025-04-25 01:25:04.230840,2025-04-25 01:25:25.395173,0 days 00:00:21.164333,False,absolute_error,41,log2,1,8,791,TPESampler,COMPLETE
4373,0.41106411679575455,2025-04-25 01:25:04.277778,2025-04-25 01:25:09.945180,0 days 00:00:05.667402,False,absolute_error,44,sqrt,2,4,179,TPESampler,COMPLETE
4374,0.3317242429110484,2025-04-25 01:25:10.181185,2025-04-25 01:25:24.447399,0 days 00:00:14.266214,False,absolute_error,50,sqrt,1,3,314,TPESampler,COMPLETE
4375,0.42333318762684535,2025-04-25 01:25:13.724979,2025-04-25 01:25:22.012173,0 days 00:00:08.287194,False,absolute_error,37,sqrt,2,7,310,TPESampler,COMPLETE
4376,0.34139831399415005,2025-04-25 01:25:18.122836,2025-04-25 01:25:44.638959,0 days 00:00:26.516123,False,absolute_error,43,sqrt,1,7,646,TPESampler,COMPLETE
4377,0.3414203391206937,2025-04-25 01:25:21.601962,2025-04-25 01:25:54.451754,0 days 00:00:32.849792,False,absolute_error,50,sqrt,1,8,799,TPESampler,COMPLETE
4378,0.7848673720868181,2025-04-25 01:25:22.346209,2025-04-25 01:25:24.787546,0 days 00:00:02.441337,False,absolute_error,38,sqrt,15,2,526,TPESampler,COMPLETE
4379,0.3256629788596714,2025-04-25 01:25:24.689623,2025-04-25 01:25:38.212080,0 days 00:00:13.522457,False,absolute_error,50,sqrt,1,5,344,TPESampler,COMPLETE
4380,0.4138244066500054,2025-04-25 01:25:25.043592,2025-04-25 01:25:32.596414,0 days 00:00:07.552822,False,absolute_error,50,sqrt,2,4,282,TPESampler,COMPLETE
4381,0.3490183375494099,2025-04-25 01:25:25.818929,2025-04-25 01:25:44.133327,0 days 00:00:18.314398,False,absolute_error,43,sqrt,1,8,493,TPESampler,COMPLETE
4382,0.6919402108754442,2025-04-25 01:25:32.842170,2025-04-25 01:25:33.916663,0 days 00:00:01.074493,True,squared_error,41,log2,2,2,212,TPESampler,COMPLETE
4383,0.32660124574258104,2025-04-25 01:25:34.158653,2025-04-25 01:26:00.293481,0 days 00:00:26.134828,False,absolute_error,50,sqrt,1,4,596,TPESampler,COMPLETE
4384,0.3255687653158147,2025-04-25 01:25:38.713860,2025-04-25 01:26:10.887842,0 days 00:00:32.173982,False,absolute_error,50,sqrt,1,5,700,TPESampler,COMPLETE
4385,0.3426607745643849,2025-04-25 01:25:40.143437,2025-04-25 01:26:06.285145,0 days 00:00:26.141708,False,absolute_error,39,sqrt,1,3,602,TPESampler,COMPLETE
4386,0.42944080543837154,2025-04-25 01:25:44.382133,2025-04-25 01:26:00.206132,0 days 00:00:15.823999,True,absolute_error,41,log2,1,6,707,TPESampler,COMPLETE
4387,0.3994261775227515,2025-04-25 01:25:44.907250,2025-04-25 01:26:04.182051,0 days 00:00:19.274801,False,absolute_error,50,log2,1,9,614,TPESampler,COMPLETE
4388,0.33649158623282127,2025-04-25 01:25:54.687573,2025-04-25 01:26:06.991870,0 days 00:00:12.304297,False,absolute_error,43,sqrt,1,3,313,TPESampler,COMPLETE
4389,0.3467432199122658,2025-04-25 01:26:00.476115,2025-04-25 01:26:18.338901,0 days 00:00:17.862786,False,absolute_error,43,sqrt,1,2,426,TPESampler,COMPLETE
4390,0.4177891233245833,2025-04-25 01:26:00.592325,2025-04-25 01:26:14.881904,0 days 00:00:14.289579,False,absolute_error,43,sqrt,2,4,566,TPESampler,COMPLETE
4391,0.41582991461411356,2025-04-25 01:26:04.419883,2025-04-25 01:26:17.528587,0 days 00:00:13.108704,False,absolute_error,50,sqrt,2,4,485,TPESampler,COMPLETE
4392,0.8225442887198396,2025-04-25 01:26:06.541198,2025-04-25 01:26:08.008032,0 days 00:00:01.466834,True,absolute_error,12,log2,4,4,268,TPESampler,COMPLETE
4393,0.3450126354935282,2025-04-25 01:26:07.282793,2025-04-25 01:26:31.762128,0 days 00:00:24.479335,False,absolute_error,50,sqrt,1,2,601,TPESampler,COMPLETE
4394,0.3479329949578847,2025-04-25 01:26:08.269459,2025-04-25 01:26:12.243071,0 days 00:00:03.973612,False,squared_error,50,sqrt,1,2,668,TPESampler,COMPLETE
4395,0.33302845923012436,2025-04-25 01:26:11.148851,2025-04-25 01:26:31.303537,0 days 00:00:20.154686,False,absolute_error,43,sqrt,1,5,539,TPESampler,COMPLETE
4396,0.41683961887443144,2025-04-25 01:26:12.481147,2025-04-25 01:26:27.130507,0 days 00:00:14.649360,False,absolute_error,50,sqrt,2,3,590,TPESampler,COMPLETE
4397,0.42472335420090557,2025-04-25 01:26:15.126862,2025-04-25 01:26:27.299786,0 days 00:00:12.172924,False,absolute_error,50,sqrt,2,10,461,TPESampler,COMPLETE
4398,0.34362049204521694,2025-04-25 01:26:17.768769,2025-04-25 01:26:37.695291,0 days 00:00:19.926522,False,absolute_error,50,sqrt,1,9,509,TPESampler,COMPLETE
4399,0.3472887702909027,2025-04-25 01:26:18.644714,2025-04-25 01:26:40.491399,0 days 00:00:21.846685,False,absolute_error,35,sqrt,1,5,618,TPESampler,COMPLETE
4400,0.32702562493242887,2025-04-25 01:26:27.374591,2025-04-25 01:26:46.962406,0 days 00:00:19.587815,False,absolute_error,50,sqrt,1,4,452,TPESampler,COMPLETE
4401,0.33543194762991657,2025-04-25 01:26:27.548499,2025-04-25 01:26:43.483834,0 days 00:00:15.935335,False,absolute_error,44,sqrt,1,3,409,TPESampler,COMPLETE
4402,0.41690107832114187,2025-04-25 01:26:31.547690,2025-04-25 01:26:48.318822,0 days 00:00:16.771132,False,absolute_error,50,sqrt,2,4,584,TPESampler,COMPLETE
4403,0.8589382227755779,2025-04-25 01:26:32.013065,2025-04-25 01:26:33.542245,0 days 00:00:01.529180,False,absolute_error,36,log2,13,16,443,TPESampler,COMPLETE
4404,0.3329431270560333,2025-04-25 01:26:33.789397,2025-04-25 01:27:02.638138,0 days 00:00:28.848741,False,absolute_error,50,sqrt,1,3,738,TPESampler,COMPLETE
