number,value,datetime_start,datetime_complete,duration,params_bootstrap,params_criterion,params_max_depth,params_max_features,params_min_samples_leaf,params_min_samples_split,params_n_estimators,system_attrs_auto:sampler,state
2897,0.4177989008747086,2025-04-25 00:03:32.786965,2025-04-25 00:03:49.088511,0 days 00:00:16.301546,False,absolute_error,50,sqrt,2,2,659,TPESampler,COMPLETE
2898,0.34640857500241184,2025-04-25 00:03:42.073914,2025-04-25 00:04:01.365485,0 days 00:00:19.291571,False,absolute_error,42,sqrt,1,7,528,TPESampler,COMPLETE
2899,0.339687399752747,2025-04-25 00:03:43.639834,2025-04-25 00:04:17.561925,0 days 00:00:33.922091,False,absolute_error,42,sqrt,1,3,625,TPESampler,COMPLETE
2900,0.42260794642459987,2025-04-25 00:03:49.306835,2025-04-25 00:04:03.018979,0 days 00:00:13.712144,False,absolute_error,43,sqrt,2,7,551,TPESampler,COMPLETE
2901,0.4230010136356275,2025-04-25 00:04:01.575208,2025-04-25 00:04:09.462263,0 days 00:00:07.887055,False,absolute_error,48,sqrt,2,10,303,TPESampler,COMPLETE
2902,0.33204906425963604,2025-04-25 00:04:03.260575,2025-04-25 00:04:23.809196,0 days 00:00:20.548621,False,absolute_error,50,sqrt,1,3,534,TPESampler,COMPLETE
2903,0.41459383022277546,2025-04-25 00:04:09.678459,2025-04-25 00:04:31.602716,0 days 00:00:21.924257,True,absolute_error,21,,4,7,486,TPESampler,COMPLETE
2904,0.5815471666422902,2025-04-25 00:04:13.535917,2025-04-25 00:04:15.245508,0 days 00:00:01.709591,True,squared_error,18,log2,1,8,776,TPESampler,COMPLETE
2905,0.3263614934644464,2025-04-25 00:04:15.461060,2025-04-25 00:04:38.395390,0 days 00:00:22.934330,False,absolute_error,50,sqrt,1,4,609,TPESampler,COMPLETE
2906,0.3658253317398878,2025-04-25 00:04:17.773822,2025-04-25 00:04:38.847021,0 days 00:00:21.073199,False,absolute_error,49,log2,1,4,750,TPESampler,COMPLETE
2907,0.4166829417390093,2025-04-25 00:04:24.026618,2025-04-25 00:04:40.602239,0 days 00:00:16.575621,False,absolute_error,50,sqrt,2,3,566,TPESampler,COMPLETE
2908,0.3302448723855624,2025-04-25 00:04:31.822900,2025-04-25 00:04:48.419236,0 days 00:00:16.596336,False,absolute_error,50,sqrt,1,6,411,TPESampler,COMPLETE
2909,0.4234575831155425,2025-04-25 00:04:38.613850,2025-04-25 00:04:51.312683,0 days 00:00:12.698833,False,absolute_error,50,sqrt,2,8,506,TPESampler,COMPLETE
2910,0.7767598263650227,2025-04-25 00:04:39.107988,2025-04-25 00:04:40.465805,0 days 00:00:01.357817,True,squared_error,5,log2,1,2,476,TPESampler,COMPLETE
2911,0.3296611807865309,2025-04-25 00:04:40.708960,2025-04-25 00:04:52.076216,0 days 00:00:11.367256,False,absolute_error,42,sqrt,1,5,299,TPESampler,COMPLETE
2912,0.41803497599429007,2025-04-25 00:04:40.854862,2025-04-25 00:04:57.483556,0 days 00:00:16.628694,False,absolute_error,50,sqrt,2,3,656,TPESampler,COMPLETE
2913,0.6923194713642686,2025-04-25 00:04:44.071235,2025-04-25 00:04:47.852345,0 days 00:00:03.781110,True,absolute_error,48,log2,2,5,605,TPESampler,COMPLETE
2914,0.3679682387331327,2025-04-25 00:04:48.066158,2025-04-25 00:05:02.070331,0 days 00:00:14.004173,True,absolute_error,50,sqrt,1,7,541,TPESampler,COMPLETE
2915,0.33159451527776823,2025-04-25 00:04:48.690814,2025-04-25 00:05:11.189201,0 days 00:00:22.498387,False,absolute_error,50,sqrt,1,6,530,TPESampler,COMPLETE
2916,0.3410040475526434,2025-04-25 00:04:51.534159,2025-04-25 00:05:17.592129,0 days 00:00:26.057970,False,absolute_error,42,sqrt,1,6,718,TPESampler,COMPLETE
2917,0.34757266178045915,2025-04-25 00:04:52.497962,2025-04-25 00:05:05.493815,0 days 00:00:12.995853,False,absolute_error,41,sqrt,1,2,331,TPESampler,COMPLETE
2918,0.3366365789320846,2025-04-25 00:04:57.361172,2025-04-25 00:05:16.109564,0 days 00:00:18.748392,False,absolute_error,44,sqrt,1,3,492,TPESampler,COMPLETE
2919,0.4195484450879721,2025-04-25 00:04:57.725880,2025-04-25 00:05:14.094238,0 days 00:00:16.368358,False,absolute_error,42,sqrt,2,4,653,TPESampler,COMPLETE
2920,0.599093465304943,2025-04-25 00:05:02.282558,2025-04-25 00:05:04.195766,0 days 00:00:01.913208,False,absolute_error,44,sqrt,6,8,135,TPESampler,COMPLETE
2921,0.33733849737572386,2025-04-25 00:05:04.410731,2025-04-25 00:05:20.177855,0 days 00:00:15.767124,False,absolute_error,43,sqrt,1,3,410,TPESampler,COMPLETE
2922,0.35220840345091714,2025-04-25 00:05:05.704847,2025-04-25 00:05:26.170665,0 days 00:00:20.465818,False,absolute_error,43,sqrt,1,9,566,TPESampler,COMPLETE
2923,0.6640658115481762,2025-04-25 00:05:11.433619,2025-04-25 00:05:13.321696,0 days 00:00:01.888077,True,absolute_error,27,sqrt,5,9,278,TPESampler,COMPLETE
2924,0.32692685784539716,2025-04-25 00:05:13.545879,2025-04-25 00:05:31.107887,0 days 00:00:17.562008,False,absolute_error,50,sqrt,1,4,451,TPESampler,COMPLETE
2925,0.33160812132440487,2025-04-25 00:05:14.457938,2025-04-25 00:05:41.908771,0 days 00:00:27.450833,False,absolute_error,43,sqrt,1,4,744,TPESampler,COMPLETE
2926,0.3380097154067906,2025-04-25 00:05:16.329357,2025-04-25 00:05:32.591731,0 days 00:00:16.262374,False,absolute_error,43,sqrt,1,3,422,TPESampler,COMPLETE
2927,0.3409415483858178,2025-04-25 00:05:17.816910,2025-04-25 00:05:43.740973,0 days 00:00:25.924063,False,absolute_error,42,sqrt,1,6,704,TPESampler,COMPLETE
2928,0.3468411491956911,2025-04-25 00:05:20.386238,2025-04-25 00:05:30.315436,0 days 00:00:09.929198,False,absolute_error,50,sqrt,1,2,240,TPESampler,COMPLETE
2929,0.4677865020219534,2025-04-25 00:05:26.392108,2025-04-25 00:07:05.155270,0 days 00:01:38.763162,False,absolute_error,50,,1,2,423,TPESampler,COMPLETE
2930,0.34345401862925445,2025-04-25 00:05:30.524868,2025-04-25 00:05:57.763980,0 days 00:00:27.239112,False,absolute_error,50,sqrt,1,9,734,TPESampler,COMPLETE
2931,0.41707740780639135,2025-04-25 00:05:31.539717,2025-04-25 00:05:37.823983,0 days 00:00:06.284266,False,absolute_error,50,sqrt,2,6,236,TPESampler,COMPLETE
2932,0.33289107133688717,2025-04-25 00:05:32.805786,2025-04-25 00:05:59.076002,0 days 00:00:26.270216,False,absolute_error,50,sqrt,1,3,687,TPESampler,COMPLETE
2933,0.32755787597332375,2025-04-25 00:05:38.036577,2025-04-25 00:05:57.034649,0 days 00:00:18.998072,False,absolute_error,50,sqrt,1,4,499,TPESampler,COMPLETE
2934,0.34000285445720924,2025-04-25 00:05:42.119177,2025-04-25 00:06:02.760063,0 days 00:00:20.640886,False,absolute_error,44,sqrt,1,6,559,TPESampler,COMPLETE
2935,0.3413670390792007,2025-04-25 00:05:43.957634,2025-04-25 00:06:07.699135,0 days 00:00:23.741501,False,absolute_error,50,sqrt,1,8,645,TPESampler,COMPLETE
2936,0.4209225996148624,2025-04-25 00:05:57.250779,2025-04-25 00:06:17.963638,0 days 00:00:20.712859,False,absolute_error,50,sqrt,2,5,715,TPESampler,COMPLETE
2937,0.32547364415599767,2025-04-25 00:05:58.206405,2025-04-25 00:06:11.506290,0 days 00:00:13.299885,False,absolute_error,50,sqrt,1,5,343,TPESampler,COMPLETE
2938,0.3257386911339316,2025-04-25 00:05:59.301527,2025-04-25 00:06:11.535720,0 days 00:00:12.234193,False,absolute_error,50,sqrt,1,5,316,TPESampler,COMPLETE
2939,0.3329124904169118,2025-04-25 00:06:02.978101,2025-04-25 00:06:26.081662,0 days 00:00:23.103561,False,absolute_error,43,sqrt,1,5,540,TPESampler,COMPLETE
2940,0.4151162327572158,2025-04-25 00:06:07.928688,2025-04-25 00:06:17.429881,0 days 00:00:09.501193,False,absolute_error,43,sqrt,2,4,357,TPESampler,COMPLETE
2941,0.4176491178393093,2025-04-25 00:06:11.769508,2025-04-25 00:06:25.363016,0 days 00:00:13.593508,False,absolute_error,43,sqrt,2,3,535,TPESampler,COMPLETE
2942,0.32657271980950225,2025-04-25 00:06:11.769228,2025-04-25 00:06:34.485188,0 days 00:00:22.715960,False,absolute_error,50,sqrt,1,4,589,TPESampler,COMPLETE
2943,0.5880546650019142,2025-04-25 00:06:17.651193,2025-04-25 00:06:18.585052,0 days 00:00:00.933859,True,squared_error,10,sqrt,1,12,140,TPESampler,COMPLETE
2944,0.3373739724994417,2025-04-25 00:06:18.200410,2025-04-25 00:06:43.550178,0 days 00:00:25.349768,False,absolute_error,44,sqrt,1,3,669,TPESampler,COMPLETE
2945,0.32456889898664376,2025-04-25 00:06:18.837098,2025-04-25 00:06:42.907366,0 days 00:00:24.070268,False,absolute_error,50,sqrt,1,5,616,TPESampler,COMPLETE
2946,0.8053364518785084,2025-04-25 00:06:25.603433,2025-04-25 00:06:29.230728,0 days 00:00:03.627295,False,absolute_error,22,log2,5,45,666,TPESampler,COMPLETE
2947,0.41818601590915444,2025-04-25 00:06:26.417062,2025-04-25 00:06:45.128507,0 days 00:00:18.711445,False,absolute_error,50,sqrt,2,4,732,TPESampler,COMPLETE
2948,0.4213824361610376,2025-04-25 00:06:29.446640,2025-04-25 00:06:44.440298,0 days 00:00:14.993658,False,absolute_error,45,sqrt,2,6,604,TPESampler,COMPLETE
2949,0.8227783544582427,2025-04-25 00:06:34.692602,2025-04-25 00:06:36.384199,0 days 00:00:01.691597,True,absolute_error,36,sqrt,15,3,567,TPESampler,COMPLETE
2950,0.3317534289864592,2025-04-25 00:06:36.596510,2025-04-25 00:07:01.666544,0 days 00:00:25.070034,False,absolute_error,50,sqrt,1,3,632,TPESampler,COMPLETE
2951,0.3319788014266211,2025-04-25 00:06:43.125445,2025-04-25 00:07:02.420565,0 days 00:00:19.295120,False,absolute_error,50,sqrt,1,6,514,TPESampler,COMPLETE
2952,0.3409671010505631,2025-04-25 00:06:43.867871,2025-04-25 00:07:16.651736,0 days 00:00:32.783865,False,absolute_error,42,sqrt,1,6,728,TPESampler,COMPLETE
2953,0.3458737462197405,2025-04-25 00:06:44.881540,2025-04-25 00:06:58.410783,0 days 00:00:13.529243,False,absolute_error,50,sqrt,1,2,332,TPESampler,COMPLETE
2954,0.32664099317436823,2025-04-25 00:06:45.404228,2025-04-25 00:07:15.324056,0 days 00:00:29.919828,False,absolute_error,50,sqrt,1,4,722,TPESampler,COMPLETE
2955,0.33316078230817026,2025-04-25 00:06:58.624967,2025-04-25 00:07:27.867449,0 days 00:00:29.242482,False,absolute_error,42,sqrt,1,4,624,TPESampler,COMPLETE
2956,0.3329030445903255,2025-04-25 00:07:01.898229,2025-04-25 00:07:19.978603,0 days 00:00:18.080374,False,absolute_error,42,sqrt,1,4,483,TPESampler,COMPLETE
2957,0.3270279170659912,2025-04-25 00:07:02.763581,2025-04-25 00:07:28.452397,0 days 00:00:25.688816,False,absolute_error,50,sqrt,1,4,680,TPESampler,COMPLETE
2958,0.34918349075114336,2025-04-25 00:07:05.370801,2025-04-25 00:07:23.747937,0 days 00:00:18.377136,False,absolute_error,43,sqrt,1,8,504,TPESampler,COMPLETE
2959,0.3353769308942158,2025-04-25 00:07:15.543775,2025-04-25 00:07:38.200788,0 days 00:00:22.657013,False,absolute_error,50,sqrt,1,7,604,TPESampler,COMPLETE
2960,0.3318100694361979,2025-04-25 00:07:16.873359,2025-04-25 00:07:29.402759,0 days 00:00:12.529400,False,absolute_error,50,sqrt,1,3,317,TPESampler,COMPLETE
2961,0.3901786644294771,2025-04-25 00:07:20.193879,2025-04-25 00:07:33.360269,0 days 00:00:13.166390,False,absolute_error,43,log2,1,5,472,TPESampler,COMPLETE
2962,0.41953826657919735,2025-04-25 00:07:23.965681,2025-04-25 00:07:36.839230,0 days 00:00:12.873549,False,absolute_error,50,sqrt,2,5,504,TPESampler,COMPLETE
2963,0.3350310711943242,2025-04-25 00:07:28.078361,2025-04-25 00:07:40.619955,0 days 00:00:12.541594,False,absolute_error,41,sqrt,1,5,328,TPESampler,COMPLETE
2964,0.8729559893803425,2025-04-25 00:07:28.772034,2025-04-25 00:07:30.458034,0 days 00:00:01.686000,True,absolute_error,20,log2,12,45,605,TPESampler,COMPLETE
2965,0.3319214046702823,2025-04-25 00:07:29.664723,2025-04-25 00:07:55.528394,0 days 00:00:25.863671,False,absolute_error,43,sqrt,1,4,698,TPESampler,COMPLETE
2966,0.459891349142683,2025-04-25 00:07:30.671641,2025-04-25 00:07:32.790558,0 days 00:00:02.118917,True,squared_error,15,,7,4,383,TPESampler,COMPLETE
2967,0.502469289387618,2025-04-25 00:07:33.006410,2025-04-25 00:08:45.221473,0 days 00:01:12.215063,False,absolute_error,6,,4,9,992,TPESampler,COMPLETE
2968,0.41638480391698873,2025-04-25 00:07:33.598292,2025-04-25 00:07:44.145085,0 days 00:00:10.546793,False,absolute_error,50,sqrt,2,4,403,TPESampler,COMPLETE
2969,0.33231441383014215,2025-04-25 00:07:37.051683,2025-04-25 00:08:02.685428,0 days 00:00:25.633745,False,absolute_error,50,sqrt,1,3,670,TPESampler,COMPLETE
2970,0.3485426382651355,2025-04-25 00:07:38.424089,2025-04-25 00:07:42.800148,0 days 00:00:04.376059,False,squared_error,50,sqrt,1,2,580,TPESampler,COMPLETE
2971,0.4185626162450162,2025-04-25 00:07:40.855994,2025-04-25 00:07:57.862846,0 days 00:00:17.006852,False,absolute_error,44,sqrt,2,4,683,TPESampler,COMPLETE
2972,0.42111817922737693,2025-04-25 00:07:43.016755,2025-04-25 00:08:01.411219,0 days 00:00:18.394464,False,absolute_error,50,sqrt,2,6,746,TPESampler,COMPLETE
2973,0.6415888773026223,2025-04-25 00:07:44.359072,2025-04-25 00:07:48.062835,0 days 00:00:03.703763,False,absolute_error,28,log2,2,25,245,TPESampler,COMPLETE
2974,0.6228031750189974,2025-04-25 00:07:48.558766,2025-04-25 00:07:55.621435,0 days 00:00:07.062669,False,absolute_error,49,log2,2,7,516,TPESampler,COMPLETE
2975,0.4203090699329502,2025-04-25 00:07:55.900899,2025-04-25 00:08:05.412221,0 days 00:00:09.511322,False,absolute_error,50,sqrt,2,7,330,TPESampler,COMPLETE
2976,0.3319413108725524,2025-04-25 00:07:55.976350,2025-04-25 00:08:15.675579,0 days 00:00:19.699229,False,absolute_error,50,sqrt,1,6,506,TPESampler,COMPLETE
2977,0.3374534733808436,2025-04-25 00:07:58.125612,2025-04-25 00:07:59.672243,0 days 00:00:01.546631,False,squared_error,44,sqrt,1,4,143,TPESampler,COMPLETE
2978,0.4296649678644968,2025-04-25 00:07:59.891736,2025-04-25 00:08:19.650339,0 days 00:00:19.758603,False,absolute_error,50,sqrt,2,13,731,TPESampler,COMPLETE
2979,0.3256936044040735,2025-04-25 00:08:01.627652,2025-04-25 00:08:16.602880,0 days 00:00:14.975228,False,absolute_error,50,sqrt,1,5,349,TPESampler,COMPLETE
2980,0.3265614229183384,2025-04-25 00:08:02.908534,2025-04-25 00:08:25.626684,0 days 00:00:22.718150,False,absolute_error,50,sqrt,1,4,604,TPESampler,COMPLETE
2981,0.37072451131706263,2025-04-25 00:08:05.633891,2025-04-25 00:08:24.598144,0 days 00:00:18.964253,True,absolute_error,39,sqrt,1,5,810,TPESampler,COMPLETE
2982,0.3358731304351465,2025-04-25 00:08:15.898853,2025-04-25 00:08:35.419925,0 days 00:00:19.521072,False,absolute_error,41,sqrt,1,4,529,TPESampler,COMPLETE
2983,0.33876882312181233,2025-04-25 00:08:16.818336,2025-04-25 00:08:30.283921,0 days 00:00:13.465585,False,absolute_error,42,sqrt,1,6,339,TPESampler,COMPLETE
2984,0.3250981938641328,2025-04-25 00:08:19.865100,2025-04-25 00:08:43.023918,0 days 00:00:23.158818,False,absolute_error,50,sqrt,1,5,601,TPESampler,COMPLETE
2985,0.5509828601111969,2025-04-25 00:08:24.984416,2025-04-25 00:08:26.400099,0 days 00:00:01.415683,True,squared_error,23,log2,1,29,226,TPESampler,COMPLETE
2986,0.4266619415444771,2025-04-25 00:08:25.957728,2025-04-25 00:08:40.022779,0 days 00:00:14.065051,False,absolute_error,43,sqrt,2,11,567,TPESampler,COMPLETE
2987,0.45570467138752274,2025-04-25 00:08:26.625304,2025-04-25 00:08:33.368736,0 days 00:00:06.743432,True,absolute_error,50,sqrt,2,3,453,TPESampler,COMPLETE
2988,0.8176471896285492,2025-04-25 00:08:30.496629,2025-04-25 00:08:31.838857,0 days 00:00:01.342228,True,squared_error,46,log2,4,11,560,TPESampler,COMPLETE
2989,0.33235247696541487,2025-04-25 00:08:32.064413,2025-04-25 00:09:00.909525,0 days 00:00:28.845112,False,absolute_error,50,sqrt,1,6,731,TPESampler,COMPLETE
2990,0.3405358181035248,2025-04-25 00:08:33.574924,2025-04-25 00:08:48.232984,0 days 00:00:14.658060,False,absolute_error,43,sqrt,1,7,358,TPESampler,COMPLETE
2991,0.3387247762345866,2025-04-25 00:08:35.646004,2025-04-25 00:08:50.033196,0 days 00:00:14.387192,False,absolute_error,42,sqrt,1,3,371,TPESampler,COMPLETE
2992,0.3388956008146065,2025-04-25 00:08:40.247776,2025-04-25 00:08:49.316859,0 days 00:00:09.069083,False,absolute_error,50,sqrt,1,8,232,TPESampler,COMPLETE
2993,0.3365471234741558,2025-04-25 00:08:43.262544,2025-04-25 00:09:03.217942,0 days 00:00:19.955398,False,absolute_error,44,sqrt,1,3,523,TPESampler,COMPLETE
2994,0.4477733182328729,2025-04-25 00:08:45.443105,2025-04-25 00:09:10.235938,0 days 00:00:24.792833,False,absolute_error,34,,1,9,110,TPESampler,COMPLETE
2995,0.3381408021470132,2025-04-25 00:08:48.454224,2025-04-25 00:08:59.473337,0 days 00:00:11.019113,False,absolute_error,42,sqrt,1,3,285,TPESampler,COMPLETE
2996,0.33231331154436816,2025-04-25 00:08:49.536631,2025-04-25 00:09:08.680563,0 days 00:00:19.143932,False,absolute_error,50,sqrt,1,3,487,TPESampler,COMPLETE
2997,0.3972213169985939,2025-04-25 00:08:50.272823,2025-04-25 00:08:56.131883,0 days 00:00:05.859060,True,absolute_error,50,log2,1,5,346,TPESampler,COMPLETE
2998,0.3268830610689944,2025-04-25 00:08:56.354612,2025-04-25 00:09:12.496741,0 days 00:00:16.142129,False,absolute_error,50,sqrt,1,4,419,TPESampler,COMPLETE
2999,0.4479261808013173,2025-04-25 00:08:59.690460,2025-04-25 00:11:19.031115,0 days 00:02:19.340655,False,absolute_error,49,,1,5,600,TPESampler,COMPLETE
3000,0.3400855249867934,2025-04-25 00:09:01.173310,2025-04-25 00:09:07.152025,0 days 00:00:05.978715,False,absolute_error,39,sqrt,1,3,146,TPESampler,COMPLETE
3001,0.3320766500071007,2025-04-25 00:09:03.430943,2025-04-25 00:09:22.404427,0 days 00:00:18.973484,False,absolute_error,42,sqrt,1,5,516,TPESampler,COMPLETE
3002,0.3619404174179925,2025-04-25 00:09:07.372195,2025-04-25 00:10:44.182161,0 days 00:01:36.809966,True,absolute_error,26,,1,8,714,TPESampler,COMPLETE
3003,0.35224340542352434,2025-04-25 00:09:08.895748,2025-04-25 00:09:38.666854,0 days 00:00:29.771106,False,absolute_error,43,sqrt,1,9,713,TPESampler,COMPLETE
3004,0.3571825934751989,2025-04-25 00:09:10.582879,2025-04-25 00:09:31.376433,0 days 00:00:20.793554,True,absolute_error,49,sqrt,1,5,728,TPESampler,COMPLETE
3005,0.4162930278380806,2025-04-25 00:09:12.725464,2025-04-25 00:09:28.470043,0 days 00:00:15.744579,False,absolute_error,50,sqrt,2,2,460,TPESampler,COMPLETE
3006,0.41669942719760183,2025-04-25 00:09:22.628058,2025-04-25 00:09:41.018535,0 days 00:00:18.390477,False,absolute_error,50,sqrt,2,4,570,TPESampler,COMPLETE
3007,0.42142308154683544,2025-04-25 00:09:28.750638,2025-04-25 00:09:46.471736,0 days 00:00:17.721098,False,absolute_error,50,sqrt,2,6,639,TPESampler,COMPLETE
3008,0.3384994361475227,2025-04-25 00:09:31.605960,2025-04-25 00:10:02.159652,0 days 00:00:30.553692,False,absolute_error,43,sqrt,1,3,776,TPESampler,COMPLETE
3009,0.32755787597332375,2025-04-25 00:09:38.892823,2025-04-25 00:09:57.880752,0 days 00:00:18.987929,False,absolute_error,50,sqrt,1,4,499,TPESampler,COMPLETE
3010,0.4167205660426374,2025-04-25 00:09:41.236145,2025-04-25 00:09:50.333980,0 days 00:00:09.097835,False,absolute_error,41,sqrt,2,3,353,TPESampler,COMPLETE
3011,0.335982786288609,2025-04-25 00:09:46.702054,2025-04-25 00:10:12.592479,0 days 00:00:25.890425,False,absolute_error,50,sqrt,1,7,696,TPESampler,COMPLETE
3012,0.4205800186853446,2025-04-25 00:09:50.546481,2025-04-25 00:10:07.107033,0 days 00:00:16.560552,False,absolute_error,44,sqrt,2,5,515,TPESampler,COMPLETE
3013,0.33192038342352004,2025-04-25 00:09:58.108194,2025-04-25 00:10:19.809836,0 days 00:00:21.701642,False,absolute_error,42,sqrt,1,5,588,TPESampler,COMPLETE
3014,0.44516469435447,2025-04-25 00:10:02.381293,2025-04-25 00:10:05.862545,0 days 00:00:03.481252,False,squared_error,34,,3,12,471,TPESampler,COMPLETE
3015,0.4568433884751027,2025-04-25 00:10:06.078347,2025-04-25 00:10:09.386167,0 days 00:00:03.307820,False,squared_error,16,,4,16,508,TPESampler,COMPLETE
3016,0.47753633973510046,2025-04-25 00:10:07.331892,2025-04-25 00:10:09.321496,0 days 00:00:01.989604,False,squared_error,25,log2,1,4,808,TPESampler,COMPLETE
3017,0.41440865720645625,2025-04-25 00:10:09.564320,2025-04-25 00:10:13.898612,0 days 00:00:04.334292,False,absolute_error,42,sqrt,2,7,148,TPESampler,COMPLETE
3018,0.4189403221530942,2025-04-25 00:10:09.698072,2025-04-25 00:10:28.082464,0 days 00:00:18.384392,False,absolute_error,43,sqrt,2,3,744,TPESampler,COMPLETE
3019,0.3517105980350808,2025-04-25 00:10:12.813379,2025-04-25 00:10:17.935791,0 days 00:00:05.122412,False,absolute_error,48,sqrt,1,12,124,TPESampler,COMPLETE
3020,0.3452953776383872,2025-04-25 00:10:14.123487,2025-04-25 00:10:37.950607,0 days 00:00:23.827120,False,absolute_error,50,sqrt,1,2,554,TPESampler,COMPLETE
3021,0.37811044741998934,2025-04-25 00:10:18.159685,2025-04-25 00:12:16.016685,0 days 00:01:57.857000,True,absolute_error,23,,1,14,959,TPESampler,COMPLETE
3022,0.4173420862654724,2025-04-25 00:10:20.059253,2025-04-25 00:10:21.170203,0 days 00:00:01.110950,False,squared_error,44,sqrt,2,7,258,TPESampler,COMPLETE
3023,0.3359467242288219,2025-04-25 00:10:21.385919,2025-04-25 00:10:40.329609,0 days 00:00:18.943690,False,absolute_error,50,sqrt,1,7,508,TPESampler,COMPLETE
3024,0.32720076087831756,2025-04-25 00:10:28.336233,2025-04-25 00:10:42.219978,0 days 00:00:13.883745,False,absolute_error,50,sqrt,1,4,355,TPESampler,COMPLETE
3025,0.3291895655893373,2025-04-25 00:10:38.176240,2025-04-25 00:10:42.589239,0 days 00:00:04.412999,False,absolute_error,50,sqrt,1,4,101,TPESampler,COMPLETE
3026,0.3316541883145022,2025-04-25 00:10:40.547752,2025-04-25 00:11:04.664939,0 days 00:00:24.117187,False,absolute_error,43,sqrt,1,4,647,TPESampler,COMPLETE
3027,0.3474695595263818,2025-04-25 00:10:42.438196,2025-04-25 00:11:33.412520,0 days 00:00:50.974324,True,absolute_error,40,,1,5,401,TPESampler,COMPLETE
3028,0.4226133424721338,2025-04-25 00:10:42.820486,2025-04-25 00:10:55.855975,0 days 00:00:13.035489,False,absolute_error,50,sqrt,2,7,520,TPESampler,COMPLETE
3029,0.33388776222468614,2025-04-25 00:10:44.440280,2025-04-25 00:11:12.827785,0 days 00:00:28.387505,False,absolute_error,44,sqrt,1,5,737,TPESampler,COMPLETE
3030,0.8166023082698514,2025-04-25 00:10:56.077408,2025-04-25 00:10:58.006542,0 days 00:00:01.929134,False,absolute_error,25,log2,6,2,424,TPESampler,COMPLETE
3031,0.32659689691825045,2025-04-25 00:10:58.222907,2025-04-25 00:11:22.771457,0 days 00:00:24.548550,False,absolute_error,50,sqrt,1,4,644,TPESampler,COMPLETE
3032,0.468417693036517,2025-04-25 00:11:04.900661,2025-04-25 00:11:49.283328,0 days 00:00:44.382667,False,absolute_error,50,,1,2,190,TPESampler,COMPLETE
3033,0.6047260020411377,2025-04-25 00:11:13.066753,2025-04-25 00:11:17.864565,0 days 00:00:04.797812,False,absolute_error,42,sqrt,6,5,491,TPESampler,COMPLETE
