number,value,datetime_start,datetime_complete,duration,params_bootstrap,params_criterion,params_max_depth,params_max_features,params_min_samples_leaf,params_min_samples_split,params_n_estimators,system_attrs_auto:sampler,state
3308,0.3268161323640391,2025-04-25 00:25:46.640665,2025-04-25 00:26:13.225645,0 days 00:00:26.584980,False,absolute_error,50,sqrt,1,4,699,TPESampler,COMPLETE
3309,0.41114573350857714,2025-04-25 00:25:47.612955,2025-04-25 00:25:54.650881,0 days 00:00:07.037926,False,squared_error,18,,2,2,901,TPESampler,COMPLETE
3310,0.35990035436016793,2025-04-25 00:25:48.293344,2025-04-25 00:26:08.999213,0 days 00:00:20.705869,False,absolute_error,42,sqrt,1,11,575,TPESampler,COMPLETE
3311,0.4190963923142721,2025-04-25 00:25:52.893006,2025-04-25 00:26:07.767372,0 days 00:00:14.874366,False,absolute_error,45,sqrt,2,4,602,TPESampler,COMPLETE
3312,0.5310820942717899,2025-04-25 00:25:53.774091,2025-04-25 00:25:56.317435,0 days 00:00:02.543344,True,absolute_error,36,sqrt,3,33,222,TPESampler,COMPLETE
3313,0.3563733215190012,2025-04-25 00:25:54.870335,2025-04-25 00:26:11.432119,0 days 00:00:16.561784,False,absolute_error,41,sqrt,1,9,453,TPESampler,COMPLETE
3314,0.32567753305611974,2025-04-25 00:25:56.525927,2025-04-25 00:26:21.061646,0 days 00:00:24.535719,False,absolute_error,50,sqrt,1,5,658,TPESampler,COMPLETE
3315,0.33742745549903375,2025-04-25 00:26:07.991587,2025-04-25 00:26:10.129769,0 days 00:00:02.138182,False,squared_error,49,sqrt,1,3,448,TPESampler,COMPLETE
3316,0.3254825403277082,2025-04-25 00:26:09.212904,2025-04-25 00:26:36.062211,0 days 00:00:26.849307,False,absolute_error,50,sqrt,1,5,724,TPESampler,COMPLETE
3317,0.3312909553057839,2025-04-25 00:26:10.350366,2025-04-25 00:26:24.165493,0 days 00:00:13.815127,False,absolute_error,50,sqrt,1,3,343,TPESampler,COMPLETE
3318,0.3327634658310361,2025-04-25 00:26:11.649884,2025-04-25 00:26:21.486245,0 days 00:00:09.836361,False,absolute_error,50,sqrt,1,7,253,TPESampler,COMPLETE
3319,0.8184589368108425,2025-04-25 00:26:13.435942,2025-04-25 00:26:14.617117,0 days 00:00:01.181175,True,squared_error,40,sqrt,14,4,472,TPESampler,COMPLETE
3320,0.41677741925546924,2025-04-25 00:26:14.831108,2025-04-25 00:26:28.239516,0 days 00:00:13.408408,False,absolute_error,50,sqrt,2,3,532,TPESampler,COMPLETE
3321,0.33204906425963604,2025-04-25 00:26:21.274983,2025-04-25 00:26:41.718308,0 days 00:00:20.443325,False,absolute_error,50,sqrt,1,3,534,TPESampler,COMPLETE
3322,0.4240896394910798,2025-04-25 00:26:21.726080,2025-04-25 00:26:39.736790,0 days 00:00:18.010710,False,absolute_error,50,sqrt,2,8,723,TPESampler,COMPLETE
3323,0.3902643315416262,2025-04-25 00:26:24.376591,2025-04-25 00:26:41.162661,0 days 00:00:16.786070,False,absolute_error,40,log2,1,3,609,TPESampler,COMPLETE
3324,0.4162953237139572,2025-04-25 00:26:28.458100,2025-04-25 00:26:39.032419,0 days 00:00:10.574319,False,absolute_error,50,sqrt,2,4,418,TPESampler,COMPLETE
3325,0.33226317419931145,2025-04-25 00:26:36.271899,2025-04-25 00:26:54.990033,0 days 00:00:18.718134,False,absolute_error,50,sqrt,1,3,482,TPESampler,COMPLETE
3326,0.331721187351056,2025-04-25 00:26:39.230338,2025-04-25 00:27:00.612842,0 days 00:00:21.382504,False,absolute_error,43,sqrt,1,4,571,TPESampler,COMPLETE
3327,0.7524515605966002,2025-04-25 00:26:40.125793,2025-04-25 00:26:41.457260,0 days 00:00:01.331467,False,squared_error,31,sqrt,12,5,722,TPESampler,COMPLETE
3328,0.35003108024113455,2025-04-25 00:26:41.392543,2025-04-25 00:27:03.090318,0 days 00:00:21.697775,True,absolute_error,50,sqrt,1,2,761,TPESampler,COMPLETE
3329,0.5986721445066238,2025-04-25 00:26:41.777091,2025-04-25 00:26:44.236363,0 days 00:00:02.459272,True,squared_error,15,log2,1,3,952,TPESampler,COMPLETE
3330,0.42030227026011274,2025-04-25 00:26:41.942976,2025-04-25 00:26:55.772365,0 days 00:00:13.829389,False,absolute_error,50,sqrt,2,6,553,TPESampler,COMPLETE
3331,0.8707401375904376,2025-04-25 00:26:44.462423,2025-04-25 00:26:45.617167,0 days 00:00:01.154744,False,squared_error,17,log2,15,6,667,TPESampler,COMPLETE
3332,0.444071922225848,2025-04-25 00:26:45.829238,2025-04-25 00:29:17.605364,0 days 00:02:31.776126,False,absolute_error,40,,1,5,655,TPESampler,COMPLETE
3333,0.33187643117851784,2025-04-25 00:26:47.348541,2025-04-25 00:27:07.815160,0 days 00:00:20.466619,False,absolute_error,50,sqrt,1,3,527,TPESampler,COMPLETE
3334,0.38211335892677284,2025-04-25 00:26:55.200728,2025-04-25 00:27:12.940253,0 days 00:00:17.739525,False,absolute_error,50,log2,1,6,615,TPESampler,COMPLETE
3335,0.3262101087509292,2025-04-25 00:26:56.156861,2025-04-25 00:27:04.092738,0 days 00:00:07.935877,False,absolute_error,50,sqrt,1,4,195,TPESampler,COMPLETE
3336,0.3401697329700045,2025-04-25 00:27:00.836605,2025-04-25 00:27:14.844221,0 days 00:00:14.007616,False,absolute_error,44,sqrt,1,7,373,TPESampler,COMPLETE
3337,0.8639965809120871,2025-04-25 00:27:03.314992,2025-04-25 00:27:04.574004,0 days 00:00:01.259012,False,squared_error,19,log2,14,42,890,TPESampler,COMPLETE
3338,0.33460880088312017,2025-04-25 00:27:04.306629,2025-04-25 00:27:19.649686,0 days 00:00:15.343057,False,absolute_error,44,sqrt,1,5,402,TPESampler,COMPLETE
3339,0.33186337694943396,2025-04-25 00:27:04.800478,2025-04-25 00:27:31.826477,0 days 00:00:27.025999,False,absolute_error,44,sqrt,1,4,735,TPESampler,COMPLETE
3340,0.8655121422212004,2025-04-25 00:27:08.033167,2025-04-25 00:27:09.002032,0 days 00:00:00.968865,False,squared_error,29,log2,15,28,401,TPESampler,COMPLETE
3341,0.33160231969814985,2025-04-25 00:27:09.220549,2025-04-25 00:27:19.910173,0 days 00:00:10.689624,False,absolute_error,50,sqrt,1,3,264,TPESampler,COMPLETE
3342,0.32607323518785297,2025-04-25 00:27:13.144306,2025-04-25 00:27:27.777146,0 days 00:00:14.632840,False,absolute_error,50,sqrt,1,4,379,TPESampler,COMPLETE
3343,0.8125921414095969,2025-04-25 00:27:15.056772,2025-04-25 00:27:16.518729,0 days 00:00:01.461957,True,absolute_error,24,sqrt,13,2,425,TPESampler,COMPLETE
3344,0.33258304551802537,2025-04-25 00:27:16.731401,2025-04-25 00:27:37.309939,0 days 00:00:20.578538,False,absolute_error,43,sqrt,1,5,561,TPESampler,COMPLETE
3345,0.33866687286618574,2025-04-25 00:27:19.865952,2025-04-25 00:27:43.167198,0 days 00:00:23.301246,False,absolute_error,43,sqrt,1,3,597,TPESampler,COMPLETE
3346,0.34802734070324043,2025-04-25 00:27:20.219458,2025-04-25 00:27:39.623947,0 days 00:00:19.404489,False,absolute_error,39,sqrt,1,2,489,TPESampler,COMPLETE
3347,0.7343977696114782,2025-04-25 00:27:27.984528,2025-04-25 00:27:35.101340,0 days 00:00:07.116812,False,absolute_error,8,log2,2,2,884,TPESampler,COMPLETE
3348,0.3451477266354841,2025-04-25 00:27:32.041813,2025-04-25 00:27:51.418032,0 days 00:00:19.376219,False,absolute_error,50,sqrt,1,10,500,TPESampler,COMPLETE
3349,0.3261718980644241,2025-04-25 00:27:35.320309,2025-04-25 00:28:01.799133,0 days 00:00:26.478824,False,absolute_error,50,sqrt,1,5,538,TPESampler,COMPLETE
3350,0.3278323044968566,2025-04-25 00:27:37.524764,2025-04-25 00:27:58.220739,0 days 00:00:20.695975,False,absolute_error,50,sqrt,1,4,526,TPESampler,COMPLETE
3351,0.369855485281281,2025-04-25 00:27:39.834704,2025-04-25 00:27:51.504412,0 days 00:00:11.669708,False,absolute_error,27,sqrt,1,4,234,TPESampler,COMPLETE
3352,0.4721250544595035,2025-04-25 00:27:43.394136,2025-04-25 00:30:36.374811,0 days 00:02:52.980675,False,absolute_error,19,,1,2,825,TPESampler,COMPLETE
3353,0.42379423736326705,2025-04-25 00:27:51.821688,2025-04-25 00:28:02.143007,0 days 00:00:10.321319,False,absolute_error,41,log2,1,9,326,TPESampler,COMPLETE
3354,0.42238343135340534,2025-04-25 00:27:51.969207,2025-04-25 00:28:12.120055,0 days 00:00:20.150848,False,absolute_error,43,sqrt,2,6,650,TPESampler,COMPLETE
3355,0.3332156943378397,2025-04-25 00:27:58.440325,2025-04-25 00:28:38.215955,0 days 00:00:39.775630,False,absolute_error,50,sqrt,1,3,780,TPESampler,COMPLETE
3356,0.41818601590915444,2025-04-25 00:28:02.004860,2025-04-25 00:28:20.017124,0 days 00:00:18.012264,False,absolute_error,50,sqrt,2,3,732,TPESampler,COMPLETE
3357,0.5918128500226062,2025-04-25 00:28:02.376964,2025-04-25 00:28:04.334693,0 days 00:00:01.957729,True,squared_error,46,sqrt,4,9,892,TPESampler,COMPLETE
3358,0.7827767399654845,2025-04-25 00:28:04.555212,2025-04-25 00:28:07.088111,0 days 00:00:02.532899,True,absolute_error,47,log2,3,14,591,TPESampler,COMPLETE
3359,0.3255978853091704,2025-04-25 00:28:07.298867,2025-04-25 00:28:43.734959,0 days 00:00:36.436092,False,absolute_error,50,sqrt,1,5,730,TPESampler,COMPLETE
3360,0.3419424161053313,2025-04-25 00:28:12.329353,2025-04-25 00:28:37.603644,0 days 00:00:25.274291,False,absolute_error,43,sqrt,1,7,699,TPESampler,COMPLETE
3361,0.34269908753898926,2025-04-25 00:28:20.228090,2025-04-25 00:28:35.592419,0 days 00:00:15.364329,False,absolute_error,50,sqrt,1,9,410,TPESampler,COMPLETE
3362,0.3317576672084785,2025-04-25 00:28:35.828729,2025-04-25 00:28:58.461532,0 days 00:00:22.632803,False,absolute_error,50,sqrt,1,3,591,TPESampler,COMPLETE
3363,0.3379055731007213,2025-04-25 00:28:37.807084,2025-04-25 00:28:52.275152,0 days 00:00:14.468068,False,absolute_error,42,sqrt,1,3,381,TPESampler,COMPLETE
3364,0.3679887457147497,2025-04-25 00:28:38.500882,2025-04-25 00:28:47.618737,0 days 00:00:09.117855,True,absolute_error,50,sqrt,1,8,394,TPESampler,COMPLETE
3365,0.4260951519326129,2025-04-25 00:28:43.960493,2025-04-25 00:29:00.323920,0 days 00:00:16.363427,False,absolute_error,34,sqrt,2,3,660,TPESampler,COMPLETE
3366,0.419539952152765,2025-04-25 00:28:47.836489,2025-04-25 00:28:57.775128,0 days 00:00:09.938639,False,absolute_error,42,sqrt,2,5,396,TPESampler,COMPLETE
3367,0.6999853285526545,2025-04-25 00:28:52.486143,2025-04-25 00:28:58.806448,0 days 00:00:06.320305,False,absolute_error,28,log2,3,2,764,TPESampler,COMPLETE
3368,0.5050649341051882,2025-04-25 00:28:57.991488,2025-04-25 00:29:10.389247,0 days 00:00:12.397759,False,absolute_error,22,log2,1,2,570,TPESampler,COMPLETE
3369,0.431864874694558,2025-04-25 00:28:58.769441,2025-04-25 00:29:00.821335,0 days 00:00:02.051894,False,squared_error,46,sqrt,2,28,600,TPESampler,COMPLETE
3370,0.8100138905379558,2025-04-25 00:28:59.090712,2025-04-25 00:29:01.663681,0 days 00:00:02.572969,True,absolute_error,5,sqrt,12,12,626,TPESampler,COMPLETE
3371,0.4092142939065262,2025-04-25 00:29:00.537573,2025-04-25 00:30:42.709417,0 days 00:01:42.171844,False,absolute_error,42,,2,5,725,TPESampler,COMPLETE
3372,0.33093404195387494,2025-04-25 00:29:01.045803,2025-04-25 00:29:15.581661,0 days 00:00:14.535858,False,absolute_error,42,sqrt,1,5,385,TPESampler,COMPLETE
3373,0.3256075961117128,2025-04-25 00:29:01.989046,2025-04-25 00:29:14.436140,0 days 00:00:12.447094,False,absolute_error,50,sqrt,1,5,324,TPESampler,COMPLETE
3374,0.46037217010346226,2025-04-25 00:29:10.617386,2025-04-25 00:29:18.075936,0 days 00:00:07.458550,True,absolute_error,50,sqrt,2,10,564,TPESampler,COMPLETE
3375,0.3398761359056605,2025-04-25 00:29:14.650891,2025-04-25 00:29:39.485652,0 days 00:00:24.834761,False,absolute_error,42,sqrt,1,3,661,TPESampler,COMPLETE
3376,0.4177039957647538,2025-04-25 00:29:15.792410,2025-04-25 00:29:31.531493,0 days 00:00:15.739083,False,absolute_error,50,sqrt,2,3,634,TPESampler,COMPLETE
3377,0.6268189289571324,2025-04-25 00:29:17.819211,2025-04-25 00:29:23.778660,0 days 00:00:05.959449,False,absolute_error,50,log2,2,23,456,TPESampler,COMPLETE
3378,0.45705626080709066,2025-04-25 00:29:18.351345,2025-04-25 00:29:23.417428,0 days 00:00:05.066083,True,absolute_error,50,sqrt,2,7,342,TPESampler,COMPLETE
3379,0.3580075230028063,2025-04-25 00:29:23.738192,2025-04-25 00:29:37.832153,0 days 00:00:14.093961,True,absolute_error,45,sqrt,1,2,487,TPESampler,COMPLETE
3380,0.3527221793432759,2025-04-25 00:29:24.097310,2025-04-25 00:29:51.569008,0 days 00:00:27.471698,False,absolute_error,43,sqrt,1,9,659,TPESampler,COMPLETE
3381,0.3611928825985606,2025-04-25 00:29:31.747416,2025-04-25 00:29:33.400126,0 days 00:00:01.652710,True,squared_error,47,,1,5,150,TPESampler,COMPLETE
3382,0.34468777379169246,2025-04-25 00:29:33.608612,2025-04-25 00:30:01.020660,0 days 00:00:27.412048,False,absolute_error,50,sqrt,1,2,697,TPESampler,COMPLETE
3383,0.8225691164179862,2025-04-25 00:29:38.050425,2025-04-25 00:29:40.814752,0 days 00:00:02.764327,True,absolute_error,27,log2,4,3,959,TPESampler,COMPLETE
3384,0.8513383596054772,2025-04-25 00:29:39.699439,2025-04-25 00:29:40.633161,0 days 00:00:00.933722,False,squared_error,11,log2,11,9,339,TPESampler,COMPLETE
3385,0.331957444481843,2025-04-25 00:29:40.858283,2025-04-25 00:29:59.101521,0 days 00:00:18.243238,False,absolute_error,50,sqrt,1,6,485,TPESampler,COMPLETE
3386,0.33475181152964895,2025-04-25 00:29:41.044967,2025-04-25 00:30:00.381489,0 days 00:00:19.336522,False,absolute_error,44,sqrt,1,5,521,TPESampler,COMPLETE
3387,0.565237491531883,2025-04-25 00:29:51.786891,2025-04-25 00:29:55.041178,0 days 00:00:03.254287,False,absolute_error,49,sqrt,5,2,253,TPESampler,COMPLETE
3388,0.34425551034660457,2025-04-25 00:29:55.260594,2025-04-25 00:30:10.783292,0 days 00:00:15.522698,False,absolute_error,50,sqrt,1,2,388,TPESampler,COMPLETE
3389,0.3322138250167629,2025-04-25 00:29:59.319784,2025-04-25 00:30:21.183778,0 days 00:00:21.863994,False,absolute_error,43,sqrt,1,5,597,TPESampler,COMPLETE
3390,0.4163037995956014,2025-04-25 00:30:00.595787,2025-04-25 00:30:14.532786,0 days 00:00:13.936999,False,absolute_error,50,sqrt,2,4,549,TPESampler,COMPLETE
3391,0.34159870134446896,2025-04-25 00:30:01.326239,2025-04-25 00:30:03.774600,0 days 00:00:02.448361,False,squared_error,41,sqrt,1,4,675,TPESampler,COMPLETE
3392,0.3319966566679774,2025-04-25 00:30:03.983887,2025-04-25 00:30:30.308768,0 days 00:00:26.324881,False,absolute_error,50,sqrt,1,6,711,TPESampler,COMPLETE
3393,0.3478703134981746,2025-04-25 00:30:11.011561,2025-04-25 00:30:38.419335,0 days 00:00:27.407774,False,absolute_error,34,sqrt,1,3,771,TPESampler,COMPLETE
3394,0.34300945753750306,2025-04-25 00:30:14.747921,2025-04-25 00:30:21.939037,0 days 00:00:07.191116,False,absolute_error,42,sqrt,1,3,178,TPESampler,COMPLETE
3395,0.4847410251853907,2025-04-25 00:30:21.402884,2025-04-25 00:30:55.669716,0 days 00:00:34.266832,False,absolute_error,15,,7,5,630,TPESampler,COMPLETE
3396,0.33464839101923033,2025-04-25 00:30:22.237515,2025-04-25 00:30:37.704909,0 days 00:00:15.467394,False,absolute_error,50,sqrt,1,7,316,TPESampler,COMPLETE
3397,0.3265072590970619,2025-04-25 00:30:30.525653,2025-04-25 00:30:59.222323,0 days 00:00:28.696670,False,absolute_error,50,sqrt,1,4,746,TPESampler,COMPLETE
3398,0.41563286196612387,2025-04-25 00:30:36.634590,2025-04-25 00:30:49.106887,0 days 00:00:12.472297,False,absolute_error,50,sqrt,2,4,496,TPESampler,COMPLETE
3399,0.3516793956802041,2025-04-25 00:30:37.925362,2025-04-25 00:31:01.073199,0 days 00:00:23.147837,False,absolute_error,42,sqrt,1,8,606,TPESampler,COMPLETE
3400,0.4414566748340802,2025-04-25 00:30:38.627457,2025-04-25 00:32:38.403773,0 days 00:01:59.776316,False,absolute_error,49,,1,8,514,TPESampler,COMPLETE
3401,0.33624194718890527,2025-04-25 00:30:42.928537,2025-04-25 00:31:00.975046,0 days 00:00:18.046509,False,absolute_error,50,sqrt,1,7,481,TPESampler,COMPLETE
3402,0.33677896678889657,2025-04-25 00:30:49.317737,2025-04-25 00:31:09.325905,0 days 00:00:20.008168,False,absolute_error,44,sqrt,1,3,507,TPESampler,COMPLETE
3403,0.3313198770999654,2025-04-25 00:30:55.889382,2025-04-25 00:31:04.075754,0 days 00:00:08.186372,False,absolute_error,43,sqrt,1,5,209,TPESampler,COMPLETE
3404,0.3325027767273391,2025-04-25 00:30:59.433217,2025-04-25 00:31:05.733299,0 days 00:00:06.300082,False,absolute_error,50,sqrt,1,3,148,TPESampler,COMPLETE
3405,0.3331621901326376,2025-04-25 00:31:01.178709,2025-04-25 00:31:19.527685,0 days 00:00:18.348976,False,absolute_error,43,sqrt,1,4,480,TPESampler,COMPLETE
3406,0.35671726546254845,2025-04-25 00:31:01.332460,2025-04-25 00:31:20.621281,0 days 00:00:19.288821,False,absolute_error,35,sqrt,1,6,538,TPESampler,COMPLETE
3407,0.4217235885902008,2025-04-25 00:31:04.292447,2025-04-25 00:31:25.954468,0 days 00:00:21.662021,False,absolute_error,44,sqrt,2,5,752,TPESampler,COMPLETE
3408,0.41994115289562917,2025-04-25 00:31:05.950773,2025-04-25 00:31:10.890875,0 days 00:00:04.940102,False,absolute_error,38,sqrt,2,5,172,TPESampler,COMPLETE
3409,0.3447750898724182,2025-04-25 00:31:09.537455,2025-04-25 00:31:35.017631,0 days 00:00:25.480176,False,absolute_error,50,sqrt,1,2,578,TPESampler,COMPLETE
3410,0.3456039273421721,2025-04-25 00:31:11.104799,2025-04-25 00:31:44.432177,0 days 00:00:33.327378,False,absolute_error,50,sqrt,1,10,807,TPESampler,COMPLETE
3411,0.4216021822681408,2025-04-25 00:31:19.755407,2025-04-25 00:31:31.288308,0 days 00:00:11.532901,False,absolute_error,43,sqrt,2,7,457,TPESampler,COMPLETE
3412,0.4131502627948012,2025-04-25 00:31:20.841117,2025-04-25 00:32:25.690595,0 days 00:01:04.849478,False,absolute_error,39,,2,4,475,TPESampler,COMPLETE
3413,0.332289774323026,2025-04-25 00:31:26.171808,2025-04-25 00:31:51.670150,0 days 00:00:25.498342,False,absolute_error,50,sqrt,1,3,662,TPESampler,COMPLETE
3414,0.33141848951347885,2025-04-25 00:31:31.512157,2025-04-25 00:31:55.047067,0 days 00:00:23.534910,False,absolute_error,50,sqrt,1,6,635,TPESampler,COMPLETE
3415,0.33303024816588067,2025-04-25 00:31:35.233929,2025-04-25 00:31:51.596020,0 days 00:00:16.362091,False,absolute_error,43,sqrt,1,4,434,TPESampler,COMPLETE
3416,0.4159656590608175,2025-04-25 00:31:44.647867,2025-04-25 00:31:54.115409,0 days 00:00:09.467542,False,absolute_error,42,sqrt,2,3,362,TPESampler,COMPLETE
3417,0.465528924798754,2025-04-25 00:31:51.797076,2025-04-25 00:32:54.203974,0 days 00:01:02.406898,False,absolute_error,38,,5,2,827,TPESampler,COMPLETE
3418,0.331843239710403,2025-04-25 00:31:51.938229,2025-04-25 00:32:10.745897,0 days 00:00:18.807668,False,absolute_error,50,sqrt,1,6,486,TPESampler,COMPLETE
3419,0.33430842956705537,2025-04-25 00:31:54.333107,2025-04-25 00:32:18.703068,0 days 00:00:24.369961,False,absolute_error,44,sqrt,1,5,658,TPESampler,COMPLETE
3420,0.4190152543552809,2025-04-25 00:31:55.266393,2025-04-25 00:32:09.488822,0 days 00:00:14.222429,False,absolute_error,41,sqrt,2,4,580,TPESampler,COMPLETE
3421,0.32800399537977726,2025-04-25 00:32:09.907253,2025-04-25 00:32:29.320217,0 days 00:00:19.412964,False,absolute_error,50,sqrt,1,4,508,TPESampler,COMPLETE
3422,0.4257361747443169,2025-04-25 00:32:11.049165,2025-04-25 00:32:19.777093,0 days 00:00:08.727928,False,absolute_error,32,sqrt,2,4,338,TPESampler,COMPLETE
3423,0.3434219156736144,2025-04-25 00:32:18.917003,2025-04-25 00:32:38.462151,0 days 00:00:19.545148,False,absolute_error,50,sqrt,1,9,526,TPESampler,COMPLETE
3424,0.33853245027758594,2025-04-25 00:32:19.988667,2025-04-25 00:32:53.759771,0 days 00:00:33.771104,False,absolute_error,43,sqrt,1,3,764,TPESampler,COMPLETE
3425,0.42209263145690645,2025-04-25 00:32:25.910096,2025-04-25 00:32:43.474161,0 days 00:00:17.564065,False,absolute_error,43,sqrt,2,5,640,TPESampler,COMPLETE
3426,0.6730536660833814,2025-04-25 00:32:29.544894,2025-04-25 00:32:33.816417,0 days 00:00:04.271523,True,absolute_error,11,sqrt,5,7,850,TPESampler,COMPLETE
3427,0.3354885638619096,2025-04-25 00:32:34.052465,2025-04-25 00:32:50.783169,0 days 00:00:16.730704,False,absolute_error,44,sqrt,1,3,400,TPESampler,COMPLETE
3428,0.33184599208037635,2025-04-25 00:32:38.639561,2025-04-25 00:32:57.758458,0 days 00:00:19.118897,False,absolute_error,50,sqrt,1,3,474,TPESampler,COMPLETE
3429,0.6001447502365223,2025-04-25 00:32:38.681052,2025-04-25 00:32:41.084194,0 days 00:00:02.403142,True,absolute_error,10,sqrt,2,33,186,TPESampler,COMPLETE
3430,0.46697337332292344,2025-04-25 00:32:41.451498,2025-04-25 00:33:45.145138,0 days 00:01:03.693640,False,absolute_error,50,,1,22,281,TPESampler,COMPLETE
3431,0.3619722223634324,2025-04-25 00:32:43.894226,2025-04-25 00:32:51.734110,0 days 00:00:07.839884,True,absolute_error,39,sqrt,1,3,311,TPESampler,COMPLETE
3432,0.3367891231805368,2025-04-25 00:32:51.217633,2025-04-25 00:33:07.149622,0 days 00:00:15.931989,False,absolute_error,43,sqrt,1,3,379,TPESampler,COMPLETE
3433,0.3331362034409401,2025-04-25 00:32:52.208405,2025-04-25 00:33:20.336851,0 days 00:00:28.128446,False,absolute_error,42,sqrt,1,4,740,TPESampler,COMPLETE
3434,0.3398964911726422,2025-04-25 00:32:54.026875,2025-04-25 00:33:08.294129,0 days 00:00:14.267254,False,absolute_error,43,sqrt,1,6,379,TPESampler,COMPLETE
3435,0.3313976873102659,2025-04-25 00:32:54.642611,2025-04-25 00:33:12.905127,0 days 00:00:18.262516,False,absolute_error,44,sqrt,1,4,482,TPESampler,COMPLETE
3436,0.3316631155901087,2025-04-25 00:32:57.991740,2025-04-25 00:33:22.299611,0 days 00:00:24.307871,False,absolute_error,50,sqrt,1,3,630,TPESampler,COMPLETE
3437,0.3276733519320897,2025-04-25 00:33:07.378519,2025-04-25 00:33:16.298451,0 days 00:00:08.919932,False,absolute_error,50,sqrt,1,4,223,TPESampler,COMPLETE
3438,0.33370906573765996,2025-04-25 00:33:08.510032,2025-04-25 00:33:10.927929,0 days 00:00:02.417897,False,squared_error,49,sqrt,1,4,635,TPESampler,COMPLETE
3439,0.3319121784217518,2025-04-25 00:33:11.137105,2025-04-25 00:33:36.055025,0 days 00:00:24.917920,False,absolute_error,45,sqrt,1,5,678,TPESampler,COMPLETE
3440,0.3310103346441082,2025-04-25 00:33:13.118779,2025-04-25 00:33:36.111368,0 days 00:00:22.992589,False,absolute_error,50,sqrt,1,6,620,TPESampler,COMPLETE
3441,0.4207709214609167,2025-04-25 00:33:16.524711,2025-04-25 00:33:35.366026,0 days 00:00:18.841315,False,absolute_error,50,sqrt,2,5,702,TPESampler,COMPLETE
3442,0.41656972889795485,2025-04-25 00:33:20.562563,2025-04-25 00:33:34.902832,0 days 00:00:14.340269,False,absolute_error,50,sqrt,2,4,578,TPESampler,COMPLETE
3443,0.3323287569961693,2025-04-25 00:33:22.572882,2025-04-25 00:33:44.951529,0 days 00:00:22.378647,False,absolute_error,43,sqrt,1,5,572,TPESampler,COMPLETE
3444,0.33499104531418766,2025-04-25 00:33:35.122980,2025-04-25 00:33:45.706916,0 days 00:00:10.583936,False,absolute_error,43,sqrt,1,3,268,TPESampler,COMPLETE
