number,value,datetime_start,datetime_complete,duration,params_bootstrap,params_criterion,params_max_depth,params_max_features,params_min_samples_leaf,params_min_samples_split,params_n_estimators,system_attrs_auto:sampler,state
3445,0.32706296557809367,2025-04-25 00:33:35.653258,2025-04-25 00:34:01.429098,0 days 00:00:25.775840,False,absolute_error,50,sqrt,1,4,678,TPESampler,COMPLETE
3446,0.41992397315684576,2025-04-25 00:33:36.270555,2025-04-25 00:33:46.521256,0 days 00:00:10.250701,False,absolute_error,44,sqrt,2,5,379,TPESampler,COMPLETE
3447,0.8732938301379776,2025-04-25 00:33:36.333181,2025-04-25 00:33:38.093293,0 days 00:00:01.760112,True,squared_error,13,log2,14,44,559,TPESampler,COMPLETE
3448,0.35251389914550946,2025-04-25 00:33:38.305073,2025-04-25 00:34:00.167218,0 days 00:00:21.862145,False,absolute_error,42,sqrt,1,8,479,TPESampler,COMPLETE
3449,0.3339069657439261,2025-04-25 00:33:45.190273,2025-04-25 00:34:01.091202,0 days 00:00:15.900929,False,absolute_error,50,sqrt,1,7,303,TPESampler,COMPLETE
3450,0.340015172265634,2025-04-25 00:33:45.430936,2025-04-25 00:33:58.997547,0 days 00:00:13.566611,False,absolute_error,44,sqrt,1,7,356,TPESampler,COMPLETE
3451,0.32660124574258104,2025-04-25 00:33:45.982902,2025-04-25 00:34:13.071710,0 days 00:00:27.088808,False,absolute_error,50,sqrt,1,4,596,TPESampler,COMPLETE
3452,0.34096751805212266,2025-04-25 00:33:46.776782,2025-04-25 00:34:12.512044,0 days 00:00:25.735262,False,absolute_error,50,sqrt,1,8,571,TPESampler,COMPLETE
3453,0.34332885062865615,2025-04-25 00:33:59.219171,2025-04-25 00:34:26.482515,0 days 00:00:27.263344,False,absolute_error,50,sqrt,1,9,709,TPESampler,COMPLETE
3454,0.3317047554380934,2025-04-25 00:34:00.382323,2025-04-25 00:34:26.821368,0 days 00:00:26.439045,False,absolute_error,43,sqrt,1,4,684,TPESampler,COMPLETE
3455,0.4149712828842808,2025-04-25 00:34:01.310740,2025-04-25 00:34:10.362901,0 days 00:00:09.052161,False,absolute_error,43,sqrt,2,2,353,TPESampler,COMPLETE
3456,0.32578716479207476,2025-04-25 00:34:01.750835,2025-04-25 00:34:18.169796,0 days 00:00:16.418961,False,absolute_error,50,sqrt,1,5,421,TPESampler,COMPLETE
3457,0.32800564790973014,2025-04-25 00:34:10.582868,2025-04-25 00:34:31.244419,0 days 00:00:20.661551,False,absolute_error,50,sqrt,1,4,539,TPESampler,COMPLETE
3458,0.41135374805744573,2025-04-25 00:34:12.734770,2025-04-25 00:34:18.203335,0 days 00:00:05.468565,False,absolute_error,50,sqrt,2,4,198,TPESampler,COMPLETE
3459,0.4231966462804149,2025-04-25 00:34:13.322539,2025-04-25 00:34:29.045653,0 days 00:00:15.723114,False,absolute_error,50,sqrt,2,7,631,TPESampler,COMPLETE
3460,0.34682563586079096,2025-04-25 00:34:18.399071,2025-04-25 00:34:43.486804,0 days 00:00:25.087733,False,absolute_error,43,sqrt,1,2,647,TPESampler,COMPLETE
3461,0.33185208137187244,2025-04-25 00:34:18.398831,2025-04-25 00:34:29.314575,0 days 00:00:10.915744,False,absolute_error,50,sqrt,1,3,272,TPESampler,COMPLETE
3462,0.3261718980644241,2025-04-25 00:34:26.894263,2025-04-25 00:34:47.339013,0 days 00:00:20.444750,False,absolute_error,50,sqrt,1,5,538,TPESampler,COMPLETE
3463,0.3317421058504855,2025-04-25 00:34:27.174692,2025-04-25 00:34:52.495232,0 days 00:00:25.320540,False,absolute_error,44,sqrt,1,4,673,TPESampler,COMPLETE
3464,0.41691138554840623,2025-04-25 00:34:29.267010,2025-04-25 00:34:31.123159,0 days 00:00:01.856149,False,squared_error,50,sqrt,2,2,437,TPESampler,COMPLETE
3465,0.42132261565663376,2025-04-25 00:34:29.612834,2025-04-25 00:34:52.314767,0 days 00:00:22.701933,False,absolute_error,50,sqrt,2,6,644,TPESampler,COMPLETE
3466,0.40893549558301656,2025-04-25 00:34:31.306866,2025-04-25 00:35:22.242672,0 days 00:00:50.935806,False,absolute_error,50,,2,5,369,TPESampler,COMPLETE
3467,0.331209470079482,2025-04-25 00:34:31.470210,2025-04-25 00:34:59.044626,0 days 00:00:27.574416,False,absolute_error,50,sqrt,1,6,597,TPESampler,COMPLETE
3468,0.41656218053492217,2025-04-25 00:34:43.696596,2025-04-25 00:34:54.330427,0 days 00:00:10.633831,False,absolute_error,50,sqrt,2,3,415,TPESampler,COMPLETE
3469,0.34677541162293907,2025-04-25 00:34:47.563727,2025-04-25 00:35:10.063749,0 days 00:00:22.500022,False,absolute_error,42,sqrt,1,2,585,TPESampler,COMPLETE
3470,0.3476310762423499,2025-04-25 00:34:52.536892,2025-04-25 00:35:09.285094,0 days 00:00:16.748202,False,absolute_error,35,sqrt,1,5,468,TPESampler,COMPLETE
3471,0.3273588246876613,2025-04-25 00:34:52.718230,2025-04-25 00:35:04.195141,0 days 00:00:11.476911,False,absolute_error,50,sqrt,1,4,294,TPESampler,COMPLETE
3472,0.33119054367591644,2025-04-25 00:34:54.536176,2025-04-25 00:35:15.563686,0 days 00:00:21.027510,False,absolute_error,50,sqrt,1,6,555,TPESampler,COMPLETE
3473,0.6477433734166945,2025-04-25 00:34:59.270591,2025-04-25 00:35:00.172968,0 days 00:00:00.902377,False,squared_error,37,log2,2,19,203,TPESampler,COMPLETE
3474,0.43788374072403985,2025-04-25 00:35:00.400176,2025-04-25 00:35:07.145335,0 days 00:00:06.745159,True,absolute_error,48,log2,1,19,434,TPESampler,COMPLETE
3475,0.345758927983978,2025-04-25 00:35:04.412565,2025-04-25 00:35:26.339071,0 days 00:00:21.926506,False,absolute_error,50,sqrt,1,2,547,TPESampler,COMPLETE
3476,0.3316141990034768,2025-04-25 00:35:07.367356,2025-04-25 00:35:27.287622,0 days 00:00:19.920266,False,absolute_error,50,sqrt,1,3,495,TPESampler,COMPLETE
3477,0.4553056716451066,2025-04-25 00:35:09.514605,2025-04-25 00:35:18.845096,0 days 00:00:09.330491,True,absolute_error,50,sqrt,2,4,682,TPESampler,COMPLETE
3478,0.42490631745785057,2025-04-25 00:35:10.328006,2025-04-25 00:35:12.616315,0 days 00:00:02.288309,True,squared_error,24,sqrt,1,8,919,TPESampler,COMPLETE
3479,0.3486030949814099,2025-04-25 00:35:12.835272,2025-04-25 00:36:39.720523,0 days 00:01:26.885251,True,absolute_error,42,,1,6,637,TPESampler,COMPLETE
3480,0.4275418416932144,2025-04-25 00:35:15.772225,2025-04-25 00:35:30.670456,0 days 00:00:14.898231,False,absolute_error,42,sqrt,2,9,604,TPESampler,COMPLETE
3481,0.3272487123522962,2025-04-25 00:35:19.068992,2025-04-25 00:35:33.428582,0 days 00:00:14.359590,False,absolute_error,50,sqrt,1,4,343,TPESampler,COMPLETE
3482,0.3263875643560801,2025-04-25 00:35:22.462608,2025-04-25 00:35:43.541462,0 days 00:00:21.078854,False,absolute_error,50,sqrt,1,5,523,TPESampler,COMPLETE
3483,0.8524584322455749,2025-04-25 00:35:26.933238,2025-04-25 00:35:29.214386,0 days 00:00:02.281148,True,absolute_error,7,log2,6,9,465,TPESampler,COMPLETE
3484,0.3475320728442841,2025-04-25 00:35:27.919293,2025-04-25 00:35:55.864265,0 days 00:00:27.944972,False,absolute_error,44,sqrt,1,8,771,TPESampler,COMPLETE
3485,0.33945228506147906,2025-04-25 00:35:29.428071,2025-04-25 00:35:49.196487,0 days 00:00:19.768416,False,absolute_error,42,sqrt,1,3,529,TPESampler,COMPLETE
3486,0.4196112590418416,2025-04-25 00:35:30.889496,2025-04-25 00:35:52.774551,0 days 00:00:21.885055,False,absolute_error,42,sqrt,2,4,723,TPESampler,COMPLETE
3487,0.3597151560550213,2025-04-25 00:35:33.642080,2025-04-25 00:35:59.326674,0 days 00:00:25.684594,False,absolute_error,50,sqrt,1,14,690,TPESampler,COMPLETE
3488,0.35504463763881966,2025-04-25 00:35:43.777228,2025-04-25 00:35:57.680463,0 days 00:00:13.903235,True,absolute_error,50,sqrt,1,4,637,TPESampler,COMPLETE
3489,0.3463046535909812,2025-04-25 00:35:49.413983,2025-04-25 00:36:01.041407,0 days 00:00:11.627424,False,absolute_error,50,sqrt,1,2,280,TPESampler,COMPLETE
3490,0.37841672210584815,2025-04-25 00:35:52.988178,2025-04-25 00:36:05.887494,0 days 00:00:12.899316,False,absolute_error,44,log2,1,4,462,TPESampler,COMPLETE
3491,0.4165038013012754,2025-04-25 00:35:56.089180,2025-04-25 00:35:57.759115,0 days 00:00:01.669935,False,squared_error,50,sqrt,2,5,607,TPESampler,COMPLETE
3492,0.38540632206422654,2025-04-25 00:35:57.886275,2025-04-25 00:36:11.775815,0 days 00:00:13.889540,True,absolute_error,50,log2,1,3,650,TPESampler,COMPLETE
3493,0.41992055462266287,2025-04-25 00:35:58.043140,2025-04-25 00:36:09.686345,0 days 00:00:11.643205,False,absolute_error,44,sqrt,2,5,441,TPESampler,COMPLETE
3494,0.333968330481848,2025-04-25 00:35:59.548610,2025-04-25 00:36:24.777848,0 days 00:00:25.229238,False,absolute_error,44,sqrt,1,5,613,TPESampler,COMPLETE
3495,0.3323591818037017,2025-04-25 00:36:01.253760,2025-04-25 00:36:28.371861,0 days 00:00:27.118101,False,absolute_error,50,sqrt,1,6,732,TPESampler,COMPLETE
3496,0.4204831986546212,2025-04-25 00:36:06.095189,2025-04-25 00:36:15.559796,0 days 00:00:09.464607,False,absolute_error,49,sqrt,2,6,373,TPESampler,COMPLETE
3497,0.44047010910723167,2025-04-25 00:36:09.907385,2025-04-25 00:38:48.403463,0 days 00:02:38.496078,False,absolute_error,50,,1,9,695,TPESampler,COMPLETE
3498,0.3322573389279143,2025-04-25 00:36:11.995807,2025-04-25 00:36:30.761289,0 days 00:00:18.765482,False,absolute_error,50,sqrt,1,3,483,TPESampler,COMPLETE
3499,0.41952949816183993,2025-04-25 00:36:15.778424,2025-04-25 00:36:37.332957,0 days 00:00:21.554533,False,absolute_error,42,sqrt,2,3,832,TPESampler,COMPLETE
3500,0.32540492880310756,2025-04-25 00:36:25.002836,2025-04-25 00:36:53.277034,0 days 00:00:28.274198,False,absolute_error,50,sqrt,1,5,760,TPESampler,COMPLETE
3501,0.4256288859890172,2025-04-25 00:36:28.583716,2025-04-25 00:36:38.900602,0 days 00:00:10.316886,False,absolute_error,50,sqrt,2,10,407,TPESampler,COMPLETE
3502,0.36644481810380264,2025-04-25 00:36:30.993144,2025-04-25 00:36:41.897691,0 days 00:00:10.904547,True,absolute_error,39,sqrt,1,4,522,TPESampler,COMPLETE
3503,0.41788451063968324,2025-04-25 00:36:37.551686,2025-04-25 00:36:53.266353,0 days 00:00:15.714667,False,absolute_error,45,sqrt,2,3,553,TPESampler,COMPLETE
3504,0.429016519663166,2025-04-25 00:36:39.123246,2025-04-25 00:37:00.911820,0 days 00:00:21.788574,True,absolute_error,25,sqrt,1,10,960,TPESampler,COMPLETE
3505,0.4213522157864963,2025-04-25 00:36:40.147039,2025-04-25 00:36:41.590822,0 days 00:00:01.443783,False,squared_error,39,sqrt,2,3,434,TPESampler,COMPLETE
3506,0.34101904499122937,2025-04-25 00:36:41.805112,2025-04-25 00:37:06.605788,0 days 00:00:24.800676,False,absolute_error,43,sqrt,1,7,574,TPESampler,COMPLETE
3507,0.4838364948384727,2025-04-25 00:36:42.131843,2025-04-25 00:36:48.503495,0 days 00:00:06.371652,True,absolute_error,40,,9,2,290,TPESampler,COMPLETE
3508,0.3335131048913277,2025-04-25 00:36:48.725561,2025-04-25 00:37:05.577720,0 days 00:00:16.852159,False,absolute_error,44,sqrt,1,5,346,TPESampler,COMPLETE
3509,0.3523739207633156,2025-04-25 00:36:53.496236,2025-04-25 00:37:01.400641,0 days 00:00:07.904405,False,absolute_error,42,sqrt,1,8,173,TPESampler,COMPLETE
3510,0.33142022245162206,2025-04-25 00:36:53.496168,2025-04-25 00:37:18.810220,0 days 00:00:25.314052,False,absolute_error,50,sqrt,1,3,578,TPESampler,COMPLETE
3511,0.3317548555584008,2025-04-25 00:37:01.136790,2025-04-25 00:37:18.126236,0 days 00:00:16.989446,False,absolute_error,50,sqrt,1,3,430,TPESampler,COMPLETE
3512,0.35057507393527837,2025-04-25 00:37:01.720396,2025-04-25 00:37:03.729018,0 days 00:00:02.008622,False,squared_error,48,sqrt,1,9,549,TPESampler,COMPLETE
3513,0.3571704130713369,2025-04-25 00:37:03.948787,2025-04-25 00:37:20.764016,0 days 00:00:16.815229,False,absolute_error,43,sqrt,1,11,459,TPESampler,COMPLETE
3514,0.39652952498235927,2025-04-25 00:37:05.806835,2025-04-25 00:37:10.097170,0 days 00:00:04.290335,False,squared_error,42,,2,6,504,TPESampler,COMPLETE
3515,0.3328735545281282,2025-04-25 00:37:06.828946,2025-04-25 00:37:27.447594,0 days 00:00:20.618648,False,absolute_error,42,sqrt,1,4,546,TPESampler,COMPLETE
3516,0.32623904047738306,2025-04-25 00:37:10.359764,2025-04-25 00:37:33.957480,0 days 00:00:23.597716,False,absolute_error,50,sqrt,1,4,613,TPESampler,COMPLETE
3517,0.415688931820545,2025-04-25 00:37:18.340573,2025-04-25 00:37:25.577319,0 days 00:00:07.236746,False,absolute_error,42,sqrt,2,3,267,TPESampler,COMPLETE
3518,0.4242600686806829,2025-04-25 00:37:19.110231,2025-04-25 00:37:39.811521,0 days 00:00:20.701290,False,absolute_error,43,sqrt,2,7,805,TPESampler,COMPLETE
3519,0.6938284270535823,2025-04-25 00:37:20.988660,2025-04-25 00:37:22.250018,0 days 00:00:01.261358,True,absolute_error,45,log2,2,7,120,TPESampler,COMPLETE
3520,0.327562042719673,2025-04-25 00:37:22.711179,2025-04-25 00:37:40.677281,0 days 00:00:17.966102,False,absolute_error,50,sqrt,1,4,464,TPESampler,COMPLETE
3521,0.41678757423045426,2025-04-25 00:37:25.785721,2025-04-25 00:37:40.755195,0 days 00:00:14.969474,False,absolute_error,50,sqrt,2,4,533,TPESampler,COMPLETE
3522,0.4080602551866234,2025-04-25 00:37:27.673723,2025-04-25 00:37:47.285224,0 days 00:00:19.611501,False,absolute_error,40,log2,1,6,654,TPESampler,COMPLETE
3523,0.33113012422119315,2025-04-25 00:37:34.185645,2025-04-25 00:37:58.422900,0 days 00:00:24.237255,False,absolute_error,50,sqrt,1,6,607,TPESampler,COMPLETE
3524,0.7022682779127083,2025-04-25 00:37:40.028362,2025-04-25 00:37:41.905191,0 days 00:00:01.876829,True,squared_error,16,sqrt,6,16,992,TPESampler,COMPLETE
3525,0.33100539077553726,2025-04-25 00:37:40.888883,2025-04-25 00:37:56.813885,0 days 00:00:15.925002,False,absolute_error,42,sqrt,1,5,403,TPESampler,COMPLETE
3526,0.33206348998422464,2025-04-25 00:37:41.033156,2025-04-25 00:38:04.763328,0 days 00:00:23.730172,False,absolute_error,43,sqrt,1,5,615,TPESampler,COMPLETE
3527,0.4187066871840465,2025-04-25 00:37:42.209500,2025-04-25 00:37:54.031431,0 days 00:00:11.821931,False,absolute_error,50,sqrt,2,5,453,TPESampler,COMPLETE
3528,0.4205436524769592,2025-04-25 00:37:48.027801,2025-04-25 00:37:59.234121,0 days 00:00:11.206320,False,absolute_error,50,sqrt,2,6,423,TPESampler,COMPLETE
3529,0.8757184242990393,2025-04-25 00:37:54.306855,2025-04-25 00:37:56.719840,0 days 00:00:02.412985,True,absolute_error,17,log2,15,16,927,TPESampler,COMPLETE
3530,0.33531571152297623,2025-04-25 00:37:57.039947,2025-04-25 00:38:12.455874,0 days 00:00:15.415927,False,absolute_error,50,sqrt,1,7,405,TPESampler,COMPLETE
3531,0.4144973374277081,2025-04-25 00:37:57.184621,2025-04-25 00:38:06.933437,0 days 00:00:09.748816,False,absolute_error,50,sqrt,2,3,362,TPESampler,COMPLETE
3532,0.3505978573060337,2025-04-25 00:37:58.652521,2025-04-25 00:38:22.423886,0 days 00:00:23.771365,False,absolute_error,50,sqrt,1,11,643,TPESampler,COMPLETE
3533,0.3360498895980035,2025-04-25 00:37:59.511326,2025-04-25 00:38:03.989427,0 days 00:00:04.478101,False,absolute_error,43,sqrt,1,4,105,TPESampler,COMPLETE
3534,0.43851393105028696,2025-04-25 00:38:04.218314,2025-04-25 00:38:09.197313,0 days 00:00:04.978999,True,squared_error,39,,5,5,893,TPESampler,COMPLETE
3535,0.41755016986833304,2025-04-25 00:38:05.155726,2025-04-25 00:38:21.176093,0 days 00:00:16.020367,False,absolute_error,50,sqrt,2,3,632,TPESampler,COMPLETE
3536,0.3252092098477225,2025-04-25 00:38:07.151054,2025-04-25 00:38:17.439732,0 days 00:00:10.288678,False,absolute_error,50,sqrt,1,5,261,TPESampler,COMPLETE
3537,0.3256257075402817,2025-04-25 00:38:09.411221,2025-04-25 00:38:34.475273,0 days 00:00:25.064052,False,absolute_error,50,sqrt,1,5,665,TPESampler,COMPLETE
3538,0.34573487109076884,2025-04-25 00:38:12.689778,2025-04-25 00:38:28.825867,0 days 00:00:16.136089,False,absolute_error,42,sqrt,1,2,402,TPESampler,COMPLETE
3539,0.42100223352895155,2025-04-25 00:38:17.665963,2025-04-25 00:38:34.389067,0 days 00:00:16.723104,False,absolute_error,50,sqrt,2,5,670,TPESampler,COMPLETE
3540,0.7875613716158131,2025-04-25 00:38:21.403635,2025-04-25 00:38:23.091370,0 days 00:00:01.687735,True,absolute_error,20,sqrt,10,8,396,TPESampler,COMPLETE
3541,0.4273807713379421,2025-04-25 00:38:22.648641,2025-04-25 00:38:38.654661,0 days 00:00:16.006020,False,absolute_error,50,sqrt,2,10,650,TPESampler,COMPLETE
3542,0.3392210721788378,2025-04-25 00:38:23.332161,2025-04-25 00:38:52.071774,0 days 00:00:28.739613,False,absolute_error,42,sqrt,1,3,776,TPESampler,COMPLETE
3543,0.34600249835892494,2025-04-25 00:38:29.041160,2025-04-25 00:38:49.937403,0 days 00:00:20.896243,False,absolute_error,36,sqrt,1,3,579,TPESampler,COMPLETE
3544,0.3316644192666259,2025-04-25 00:38:34.600946,2025-04-25 00:38:59.426080,0 days 00:00:24.825134,False,absolute_error,43,sqrt,1,4,592,TPESampler,COMPLETE
3545,0.3593816325841136,2025-04-25 00:38:34.750725,2025-04-25 00:39:00.758045,0 days 00:00:26.007320,False,absolute_error,34,sqrt,1,7,662,TPESampler,COMPLETE
3546,0.34373930064247654,2025-04-25 00:38:38.871305,2025-04-25 00:39:09.022957,0 days 00:00:30.151652,False,absolute_error,50,sqrt,1,2,725,TPESampler,COMPLETE
3547,0.33130242240883495,2025-04-25 00:38:48.630626,2025-04-25 00:38:59.713343,0 days 00:00:11.082717,False,absolute_error,43,sqrt,1,4,290,TPESampler,COMPLETE
3548,0.4175300687226474,2025-04-25 00:38:50.151745,2025-04-25 00:39:11.202881,0 days 00:00:21.051136,False,absolute_error,50,sqrt,2,4,806,TPESampler,COMPLETE
3549,0.5103315874187903,2025-04-25 00:38:52.287648,2025-04-25 00:38:54.921376,0 days 00:00:02.633728,True,squared_error,49,,10,49,672,TPESampler,COMPLETE
3550,0.41671493652870994,2025-04-25 00:38:55.138250,2025-04-25 00:39:07.951874,0 days 00:00:12.813624,False,absolute_error,43,sqrt,2,3,498,TPESampler,COMPLETE
3551,0.5577093581439473,2025-04-25 00:38:59.657385,2025-04-25 00:39:03.602357,0 days 00:00:03.944972,True,squared_error,44,,15,7,970,TPESampler,COMPLETE
3552,0.34076706841450416,2025-04-25 00:38:59.956825,2025-04-25 00:39:27.142088,0 days 00:00:27.185263,False,absolute_error,42,sqrt,1,6,750,TPESampler,COMPLETE
3553,0.32607323518785297,2025-04-25 00:39:00.981642,2025-04-25 00:39:15.899371,0 days 00:00:14.917729,False,absolute_error,50,sqrt,1,4,379,TPESampler,COMPLETE
3554,0.3337479952271037,2025-04-25 00:39:03.814895,2025-04-25 00:39:05.657684,0 days 00:00:01.842789,False,squared_error,49,sqrt,1,4,422,TPESampler,COMPLETE
3555,0.6247096159755218,2025-04-25 00:39:05.870367,2025-04-25 00:39:11.116896,0 days 00:00:05.246529,False,absolute_error,50,log2,2,9,382,TPESampler,COMPLETE
3556,0.3736097093640498,2025-04-25 00:39:08.165680,2025-04-25 00:39:09.960860,0 days 00:00:01.795180,True,squared_error,43,,2,10,227,TPESampler,COMPLETE
3557,0.3317547054105387,2025-04-25 00:39:09.248203,2025-04-25 00:39:32.931918,0 days 00:00:23.683715,False,absolute_error,50,sqrt,1,3,618,TPESampler,COMPLETE
3558,0.3310338716202925,2025-04-25 00:39:10.180627,2025-04-25 00:39:33.276565,0 days 00:00:23.095938,False,absolute_error,50,sqrt,1,6,616,TPESampler,COMPLETE
3559,0.35221474915405704,2025-04-25 00:39:11.358433,2025-04-25 00:39:31.912724,0 days 00:00:20.554291,False,absolute_error,43,sqrt,1,9,567,TPESampler,COMPLETE
3560,0.3304432262701513,2025-04-25 00:39:11.479120,2025-04-25 00:39:28.644912,0 days 00:00:17.165792,False,absolute_error,44,sqrt,1,4,451,TPESampler,COMPLETE
3561,0.33269145582427634,2025-04-25 00:39:16.119387,2025-04-25 00:39:43.651232,0 days 00:00:27.531845,False,absolute_error,50,sqrt,1,3,722,TPESampler,COMPLETE
3562,0.4109538244978781,2025-04-25 00:39:27.394190,2025-04-25 00:39:32.824659,0 days 00:00:05.430469,False,absolute_error,50,sqrt,2,4,186,TPESampler,COMPLETE
3563,0.32510188896671344,2025-04-25 00:39:28.861427,2025-04-25 00:39:44.826420,0 days 00:00:15.964993,False,absolute_error,50,sqrt,1,5,412,TPESampler,COMPLETE
3564,0.33118982764301597,2025-04-25 00:39:32.131330,2025-04-25 00:40:00.208669,0 days 00:00:28.077339,False,absolute_error,50,sqrt,1,6,576,TPESampler,COMPLETE
3565,0.34079085622768596,2025-04-25 00:39:33.015745,2025-04-25 00:39:55.779733,0 days 00:00:22.763988,False,absolute_error,42,sqrt,1,6,488,TPESampler,COMPLETE
3566,0.502439487103018,2025-04-25 00:39:33.177175,2025-04-25 00:39:34.975637,0 days 00:00:01.798462,False,squared_error,22,log2,1,2,321,TPESampler,COMPLETE
3567,0.41724282678305025,2025-04-25 00:39:33.520923,2025-04-25 00:39:39.106776,0 days 00:00:05.585853,False,absolute_error,44,sqrt,2,6,202,TPESampler,COMPLETE
3568,0.36546492735457237,2025-04-25 00:39:35.191927,2025-04-25 00:39:43.332934,0 days 00:00:08.141007,False,absolute_error,50,log2,1,3,268,TPESampler,COMPLETE
3569,0.3319461050950121,2025-04-25 00:39:39.322384,2025-04-25 00:40:00.972908,0 days 00:00:21.650524,False,absolute_error,43,sqrt,1,5,588,TPESampler,COMPLETE
3570,0.4212964864165658,2025-04-25 00:39:43.558638,2025-04-25 00:40:01.180237,0 days 00:00:17.621599,False,absolute_error,44,sqrt,2,5,573,TPESampler,COMPLETE
3571,0.32706298628852126,2025-04-25 00:39:43.880591,2025-04-25 00:40:06.574303,0 days 00:00:22.693712,False,absolute_error,50,sqrt,1,4,429,TPESampler,COMPLETE
3572,0.33134954290544094,2025-04-25 00:39:45.054934,2025-04-25 00:40:11.848394,0 days 00:00:26.793460,False,absolute_error,50,sqrt,1,3,582,TPESampler,COMPLETE
3573,0.37578852131578566,2025-04-25 00:39:56.006889,2025-04-25 00:40:02.602730,0 days 00:00:06.595841,True,absolute_error,40,sqrt,1,7,291,TPESampler,COMPLETE
3574,0.33687498147852907,2025-04-25 00:40:00.432188,2025-04-25 00:40:14.511054,0 days 00:00:14.078866,False,absolute_error,43,sqrt,1,3,361,TPESampler,COMPLETE
3575,0.34045756341676675,2025-04-25 00:40:01.312946,2025-04-25 00:40:25.458026,0 days 00:00:24.145080,False,absolute_error,43,sqrt,1,6,593,TPESampler,COMPLETE
3576,0.382450638428564,2025-04-25 00:40:01.415545,2025-04-25 00:40:15.249155,0 days 00:00:13.833610,False,absolute_error,50,log2,1,6,473,TPESampler,COMPLETE
3577,0.3333269375568804,2025-04-25 00:40:02.817243,2025-04-25 00:40:31.954882,0 days 00:00:29.137639,False,absolute_error,43,sqrt,1,5,796,TPESampler,COMPLETE
3578,0.33355122871033505,2025-04-25 00:40:06.791641,2025-04-25 00:40:25.506435,0 days 00:00:18.714794,False,absolute_error,43,sqrt,1,5,465,TPESampler,COMPLETE
3579,0.6411051888707162,2025-04-25 00:40:12.075286,2025-04-25 00:40:14.352691,0 days 00:00:02.277405,False,absolute_error,49,log2,2,2,144,TPESampler,COMPLETE
3580,0.3345486904652757,2025-04-25 00:40:14.685065,2025-04-25 00:40:21.319808,0 days 00:00:06.634743,False,absolute_error,50,sqrt,1,7,154,TPESampler,COMPLETE
3581,0.35304509627250463,2025-04-25 00:40:14.803729,2025-04-25 00:40:30.943878,0 days 00:00:16.140149,False,absolute_error,33,sqrt,1,3,401,TPESampler,COMPLETE
