number,value,datetime_start,datetime_complete,duration,params_bootstrap,params_criterion,params_max_depth,params_max_features,params_min_samples_leaf,params_min_samples_split,params_n_estimators,system_attrs_auto:sampler,state
2759,0.4713187664998277,2025-04-24 23:56:45.168884,2025-04-24 23:56:49.132472,0 days 00:00:03.963588,False,squared_error,44,,8,2,697,TPESampler,COMPLETE
2760,0.3571719104185861,2025-04-24 23:56:47.635338,2025-04-24 23:57:08.337722,0 days 00:00:20.702384,False,absolute_error,34,sqrt,1,6,520,TPESampler,COMPLETE
2761,0.33107604963066717,2025-04-24 23:56:49.296016,2025-04-24 23:57:12.472650,0 days 00:00:23.176634,False,absolute_error,45,sqrt,1,4,608,TPESampler,COMPLETE
2762,0.33630625636799827,2025-04-24 23:56:49.418899,2025-04-24 23:56:51.180204,0 days 00:00:01.761305,False,squared_error,50,sqrt,1,3,302,TPESampler,COMPLETE
2763,0.338407002954313,2025-04-24 23:56:51.403688,2025-04-24 23:57:12.019468,0 days 00:00:20.615780,False,absolute_error,49,sqrt,1,7,550,TPESampler,COMPLETE
2764,0.8633637803478357,2025-04-24 23:56:52.527272,2025-04-24 23:56:53.457571,0 days 00:00:00.930299,False,absolute_error,29,log2,13,39,140,TPESampler,COMPLETE
2765,0.44162367079549386,2025-04-24 23:56:53.677951,2025-04-24 23:58:31.601141,0 days 00:01:37.923190,False,absolute_error,48,,1,8,426,TPESampler,COMPLETE
2766,0.3312050061135064,2025-04-24 23:56:53.978204,2025-04-24 23:57:16.227625,0 days 00:00:22.249421,False,absolute_error,44,sqrt,1,4,528,TPESampler,COMPLETE
2767,0.32508296111345775,2025-04-24 23:56:58.568872,2025-04-24 23:57:21.180673,0 days 00:00:22.611801,False,absolute_error,50,sqrt,1,5,602,TPESampler,COMPLETE
2768,0.3489429337193952,2025-04-24 23:57:08.567665,2025-04-24 23:57:30.194760,0 days 00:00:21.627095,False,absolute_error,35,sqrt,1,3,567,TPESampler,COMPLETE
2769,0.5833376940762186,2025-04-24 23:57:12.231452,2025-04-24 23:57:19.567475,0 days 00:00:07.336023,False,absolute_error,9,sqrt,1,3,374,TPESampler,COMPLETE
2770,0.3349552869613662,2025-04-24 23:57:12.694223,2025-04-24 23:57:33.589337,0 days 00:00:20.895114,False,absolute_error,49,sqrt,1,3,519,TPESampler,COMPLETE
2771,0.4158402549377718,2025-04-24 23:57:16.450248,2025-04-24 23:57:29.037716,0 days 00:00:12.587468,False,absolute_error,50,sqrt,2,4,504,TPESampler,COMPLETE
2772,0.32801673888726346,2025-04-24 23:57:19.782926,2025-04-24 23:57:40.415975,0 days 00:00:20.633049,False,absolute_error,50,sqrt,1,4,542,TPESampler,COMPLETE
2773,0.33418079437283144,2025-04-24 23:57:21.412832,2025-04-24 23:57:42.017103,0 days 00:00:20.604271,False,absolute_error,44,sqrt,1,5,556,TPESampler,COMPLETE
2774,0.33140195447608484,2025-04-24 23:57:29.272882,2025-04-24 23:57:47.180614,0 days 00:00:17.907732,False,absolute_error,50,sqrt,1,3,447,TPESampler,COMPLETE
2775,0.41815205639370867,2025-04-24 23:57:30.543035,2025-04-24 23:57:40.066576,0 days 00:00:09.523541,False,absolute_error,40,sqrt,2,2,373,TPESampler,COMPLETE
2776,0.33144662869037694,2025-04-24 23:57:33.819325,2025-04-24 23:57:45.678640,0 days 00:00:11.859315,False,absolute_error,50,sqrt,1,3,298,TPESampler,COMPLETE
2777,0.4228911546130844,2025-04-24 23:57:40.290251,2025-04-24 23:57:54.955105,0 days 00:00:14.664854,False,absolute_error,40,sqrt,2,5,587,TPESampler,COMPLETE
2778,0.3272121991604624,2025-04-24 23:57:40.645217,2025-04-24 23:57:51.414019,0 days 00:00:10.768802,False,absolute_error,50,sqrt,1,4,219,TPESampler,COMPLETE
2779,0.41611511949240443,2025-04-24 23:57:42.243840,2025-04-24 23:57:55.682725,0 days 00:00:13.438885,False,absolute_error,50,sqrt,2,3,463,TPESampler,COMPLETE
2780,0.3493190687092994,2025-04-24 23:57:46.171015,2025-04-24 23:58:11.018444,0 days 00:00:24.847429,False,absolute_error,43,sqrt,1,8,662,TPESampler,COMPLETE
2781,0.3339109640803798,2025-04-24 23:57:47.769211,2025-04-24 23:57:57.542208,0 days 00:00:09.772997,False,absolute_error,50,sqrt,1,7,233,TPESampler,COMPLETE
2782,0.32835606305254106,2025-04-24 23:57:51.851511,2025-04-24 23:57:57.456416,0 days 00:00:05.604905,False,absolute_error,42,sqrt,1,4,126,TPESampler,COMPLETE
2783,0.5075227515435375,2025-04-24 23:57:55.178738,2025-04-24 23:57:56.587806,0 days 00:00:01.409068,False,squared_error,18,sqrt,3,50,212,TPESampler,COMPLETE
2784,0.3263511966530805,2025-04-24 23:57:56.274023,2025-04-24 23:58:16.154271,0 days 00:00:19.880248,False,absolute_error,50,sqrt,1,5,518,TPESampler,COMPLETE
2785,0.5144180876924398,2025-04-24 23:57:56.918732,2025-04-24 23:58:00.270728,0 days 00:00:03.351996,True,squared_error,48,,11,16,645,TPESampler,COMPLETE
2786,0.3682917039866865,2025-04-24 23:57:57.869981,2025-04-24 23:58:14.619680,0 days 00:00:16.749699,False,absolute_error,48,log2,1,3,583,TPESampler,COMPLETE
2787,0.4395394264297989,2025-04-24 23:57:58.070301,2025-04-25 00:00:25.093976,0 days 00:02:27.023675,False,absolute_error,43,,1,9,652,TPESampler,COMPLETE
2788,0.42421424221279513,2025-04-24 23:58:00.497244,2025-04-24 23:58:17.792169,0 days 00:00:17.294925,False,absolute_error,49,sqrt,2,7,707,TPESampler,COMPLETE
2789,0.33136547186509363,2025-04-24 23:58:11.242987,2025-04-24 23:58:34.829350,0 days 00:00:23.586363,False,absolute_error,43,sqrt,1,4,639,TPESampler,COMPLETE
2790,0.3260604107241011,2025-04-24 23:58:14.841684,2025-04-24 23:58:33.088255,0 days 00:00:18.246571,False,absolute_error,50,sqrt,1,5,474,TPESampler,COMPLETE
2791,0.328536753035627,2025-04-24 23:58:16.383114,2025-04-24 23:58:28.221507,0 days 00:00:11.838393,False,absolute_error,44,sqrt,1,4,309,TPESampler,COMPLETE
2792,0.8707583808354112,2025-04-24 23:58:18.008878,2025-04-24 23:58:20.047648,0 days 00:00:02.038770,True,absolute_error,31,log2,11,31,996,TPESampler,COMPLETE
2793,0.33232485192810013,2025-04-24 23:58:20.255460,2025-04-24 23:58:39.061418,0 days 00:00:18.805958,False,absolute_error,50,sqrt,1,3,486,TPESampler,COMPLETE
2794,0.6263771227912558,2025-04-24 23:58:28.441367,2025-04-24 23:58:32.342783,0 days 00:00:03.901416,False,absolute_error,46,log2,2,5,286,TPESampler,COMPLETE
2795,0.3999196130636287,2025-04-24 23:58:31.809152,2025-04-24 23:58:35.462207,0 days 00:00:03.653055,False,squared_error,26,,1,6,325,TPESampler,COMPLETE
2796,0.33164589203181577,2025-04-24 23:58:32.666427,2025-04-24 23:58:57.615106,0 days 00:00:24.948679,False,absolute_error,50,sqrt,1,6,649,TPESampler,COMPLETE
2797,0.47143285613673735,2025-04-24 23:58:33.320201,2025-04-24 23:58:44.963033,0 days 00:00:11.642832,False,absolute_error,49,,9,5,234,TPESampler,COMPLETE
2798,0.34336856715163466,2025-04-24 23:58:35.048751,2025-04-24 23:58:59.943845,0 days 00:00:24.895094,False,absolute_error,50,sqrt,1,9,675,TPESampler,COMPLETE
2799,0.4184439993567427,2025-04-24 23:58:35.749725,2025-04-24 23:59:06.639924,0 days 00:00:30.890199,True,absolute_error,16,,4,2,743,TPESampler,COMPLETE
2800,0.413693760831945,2025-04-24 23:58:39.275835,2025-04-24 23:58:46.879236,0 days 00:00:07.603401,False,absolute_error,50,sqrt,2,2,293,TPESampler,COMPLETE
2801,0.3433380975720383,2025-04-24 23:58:45.179355,2025-04-24 23:58:56.901691,0 days 00:00:11.722336,False,absolute_error,40,sqrt,1,6,313,TPESampler,COMPLETE
2802,0.41986747077457803,2025-04-24 23:58:47.095662,2025-04-24 23:58:53.848519,0 days 00:00:06.752857,False,absolute_error,43,sqrt,2,5,258,TPESampler,COMPLETE
2803,0.34682377494948663,2025-04-24 23:58:54.070726,2025-04-24 23:59:03.822642,0 days 00:00:09.751916,False,absolute_error,50,sqrt,1,2,235,TPESampler,COMPLETE
2804,0.3314585732122195,2025-04-24 23:58:57.180400,2025-04-24 23:59:12.324382,0 days 00:00:15.143982,False,absolute_error,50,sqrt,1,3,378,TPESampler,COMPLETE
2805,0.32686599969193625,2025-04-24 23:58:57.859423,2025-04-24 23:59:14.725274,0 days 00:00:16.865851,False,absolute_error,50,sqrt,1,4,416,TPESampler,COMPLETE
2806,0.33057859027081493,2025-04-24 23:59:00.180536,2025-04-24 23:59:13.545401,0 days 00:00:13.364865,False,absolute_error,50,sqrt,1,6,349,TPESampler,COMPLETE
2807,0.4466671292851695,2025-04-24 23:59:04.040802,2025-04-25 00:00:25.760029,0 days 00:01:21.719227,False,absolute_error,40,,1,4,359,TPESampler,COMPLETE
2808,0.41604647840197634,2025-04-24 23:59:06.852705,2025-04-24 23:59:21.390760,0 days 00:00:14.538055,False,absolute_error,50,sqrt,2,3,553,TPESampler,COMPLETE
2809,0.3452935009868578,2025-04-24 23:59:12.539501,2025-04-24 23:59:36.366316,0 days 00:00:23.826815,False,absolute_error,42,sqrt,1,7,626,TPESampler,COMPLETE
2810,0.3265817195305204,2025-04-24 23:59:13.771077,2025-04-24 23:59:36.030768,0 days 00:00:22.259691,False,absolute_error,50,sqrt,1,4,594,TPESampler,COMPLETE
2811,0.42478320092410254,2025-04-24 23:59:14.946124,2025-04-24 23:59:32.317169,0 days 00:00:17.371045,False,absolute_error,49,sqrt,2,8,645,TPESampler,COMPLETE
2812,0.39047832023404905,2025-04-24 23:59:21.600216,2025-04-24 23:59:26.857264,0 days 00:00:05.257048,False,absolute_error,43,log2,1,2,166,TPESampler,COMPLETE
2813,0.34729152950443476,2025-04-24 23:59:27.077695,2025-04-24 23:59:52.883129,0 days 00:00:25.805434,False,absolute_error,42,sqrt,1,2,644,TPESampler,COMPLETE
2814,0.5371383578085471,2025-04-24 23:59:32.537488,2025-04-24 23:59:34.076137,0 days 00:00:01.538649,False,squared_error,5,,4,32,228,TPESampler,COMPLETE
2815,0.3385865235686811,2025-04-24 23:59:34.285948,2025-04-25 00:00:02.333310,0 days 00:00:28.047362,False,absolute_error,43,sqrt,1,3,603,TPESampler,COMPLETE
2816,0.3280296522793357,2025-04-24 23:59:36.247502,2025-04-24 23:59:48.325707,0 days 00:00:12.078205,False,absolute_error,50,sqrt,1,4,311,TPESampler,COMPLETE
2817,0.4710493247536372,2025-04-24 23:59:36.608137,2025-04-24 23:59:38.461446,0 days 00:00:01.853309,True,squared_error,27,sqrt,2,24,748,TPESampler,COMPLETE
2818,0.4169075988301378,2025-04-24 23:59:38.674026,2025-04-24 23:59:58.086308,0 days 00:00:19.412282,False,absolute_error,50,sqrt,2,4,595,TPESampler,COMPLETE
2819,0.32790175839990604,2025-04-24 23:59:48.548410,2025-04-25 00:00:07.761448,0 days 00:00:19.213038,False,absolute_error,50,sqrt,1,4,507,TPESampler,COMPLETE
2820,0.33406098173208365,2025-04-24 23:59:53.106627,2025-04-25 00:00:14.427768,0 days 00:00:21.321141,False,absolute_error,44,sqrt,1,5,569,TPESampler,COMPLETE
2821,0.4676401408253341,2025-04-24 23:59:58.304506,2025-04-24 23:59:59.649434,0 days 00:00:01.344928,False,squared_error,22,sqrt,2,37,495,TPESampler,COMPLETE
2822,0.3847062454204441,2025-04-24 23:59:59.872010,2025-04-25 00:00:03.162311,0 days 00:00:03.290301,True,squared_error,46,log2,1,2,769,TPESampler,COMPLETE
2823,0.3391058380171608,2025-04-25 00:00:02.556968,2025-04-25 00:00:13.570337,0 days 00:00:11.013369,False,absolute_error,41,sqrt,1,3,284,TPESampler,COMPLETE
2824,0.3310762653178416,2025-04-25 00:00:03.460432,2025-04-25 00:00:20.958205,0 days 00:00:17.497773,False,absolute_error,42,sqrt,1,5,416,TPESampler,COMPLETE
2825,0.4507684939305029,2025-04-25 00:00:07.997732,2025-04-25 00:02:16.991327,0 days 00:02:08.993595,False,absolute_error,48,,1,4,563,TPESampler,COMPLETE
2826,0.4218186891727131,2025-04-25 00:00:13.789155,2025-04-25 00:00:33.003292,0 days 00:00:19.214137,False,absolute_error,41,sqrt,2,5,702,TPESampler,COMPLETE
2827,0.3256955844296959,2025-04-25 00:00:14.768778,2025-04-25 00:00:41.619307,0 days 00:00:26.850529,False,absolute_error,50,sqrt,1,5,667,TPESampler,COMPLETE
2828,0.33662002333622476,2025-04-25 00:00:21.173538,2025-04-25 00:00:23.593546,0 days 00:00:02.420008,False,squared_error,49,sqrt,1,5,642,TPESampler,COMPLETE
2829,0.33105913737607623,2025-04-25 00:00:23.852566,2025-04-25 00:00:45.892355,0 days 00:00:22.039789,False,absolute_error,50,sqrt,1,6,578,TPESampler,COMPLETE
2830,0.5490844485484191,2025-04-25 00:00:25.401358,2025-04-25 00:00:27.260889,0 days 00:00:01.859531,True,squared_error,12,sqrt,1,17,544,TPESampler,COMPLETE
2831,0.3317451081276685,2025-04-25 00:00:26.012887,2025-04-25 00:00:50.286457,0 days 00:00:24.273570,False,absolute_error,50,sqrt,1,3,620,TPESampler,COMPLETE
2832,0.4204459188084023,2025-04-25 00:00:27.485312,2025-04-25 00:00:42.898398,0 days 00:00:15.413086,False,absolute_error,50,sqrt,2,5,628,TPESampler,COMPLETE
2833,0.41239850080820284,2025-04-25 00:00:33.241819,2025-04-25 00:00:35.053870,0 days 00:00:01.812051,True,squared_error,15,,2,18,280,TPESampler,COMPLETE
2834,0.42112282324912126,2025-04-25 00:00:35.270401,2025-04-25 00:00:49.527891,0 days 00:00:14.257490,False,absolute_error,43,sqrt,2,6,524,TPESampler,COMPLETE
2835,0.3453349059998921,2025-04-25 00:00:41.840153,2025-04-25 00:01:07.859551,0 days 00:00:26.019398,False,absolute_error,50,sqrt,1,10,672,TPESampler,COMPLETE
2836,0.33228187664595765,2025-04-25 00:00:43.119059,2025-04-25 00:00:45.313355,0 days 00:00:02.194296,False,squared_error,50,sqrt,1,4,519,TPESampler,COMPLETE
2837,0.8576537533273495,2025-04-25 00:00:45.535807,2025-04-25 00:00:46.899862,0 days 00:00:01.364055,False,squared_error,36,log2,11,10,991,TPESampler,COMPLETE
2838,0.37910571688511785,2025-04-25 00:00:46.163343,2025-04-25 00:00:47.842818,0 days 00:00:01.679475,False,squared_error,47,log2,1,5,473,TPESampler,COMPLETE
2839,0.7824249648884332,2025-04-25 00:00:47.114977,2025-04-25 00:00:50.352166,0 days 00:00:03.237189,True,absolute_error,21,log2,3,47,814,TPESampler,COMPLETE
2840,0.3320349281707141,2025-04-25 00:00:48.066185,2025-04-25 00:01:09.662129,0 days 00:00:21.595944,False,absolute_error,42,sqrt,1,5,584,TPESampler,COMPLETE
2841,0.3469081487035736,2025-04-25 00:00:49.756486,2025-04-25 00:01:04.272755,0 days 00:00:14.516269,False,absolute_error,46,sqrt,1,9,384,TPESampler,COMPLETE
2842,0.3391774962182402,2025-04-25 00:00:50.545388,2025-04-25 00:01:09.649683,0 days 00:00:19.104295,False,absolute_error,42,sqrt,1,3,497,TPESampler,COMPLETE
2843,0.3263612342867122,2025-04-25 00:00:50.601504,2025-04-25 00:01:05.471462,0 days 00:00:14.869958,False,absolute_error,50,sqrt,1,4,375,TPESampler,COMPLETE
2844,0.7796943071650085,2025-04-25 00:01:04.505275,2025-04-25 00:01:05.533847,0 days 00:00:01.028572,True,absolute_error,7,sqrt,8,29,119,TPESampler,COMPLETE
2845,0.3448877523524071,2025-04-25 00:01:05.706007,2025-04-25 00:01:33.481035,0 days 00:00:27.775028,False,absolute_error,50,sqrt,1,2,645,TPESampler,COMPLETE
2846,0.41577275353808085,2025-04-25 00:01:05.816349,2025-04-25 00:01:16.028757,0 days 00:00:10.212408,False,absolute_error,50,sqrt,2,4,386,TPESampler,COMPLETE
2847,0.35078252770065854,2025-04-25 00:01:08.072490,2025-04-25 00:01:22.255839,0 days 00:00:14.183349,True,absolute_error,49,sqrt,1,3,579,TPESampler,COMPLETE
2848,0.3250966823471736,2025-04-25 00:01:09.900588,2025-04-25 00:01:20.367525,0 days 00:00:10.466937,False,absolute_error,50,sqrt,1,5,264,TPESampler,COMPLETE
2849,0.45670853885907614,2025-04-25 00:01:09.900877,2025-04-25 00:01:15.285177,0 days 00:00:05.384300,True,absolute_error,45,sqrt,2,7,371,TPESampler,COMPLETE
2850,0.3250173067930093,2025-04-25 00:01:15.497899,2025-04-25 00:01:38.078501,0 days 00:00:22.580602,False,absolute_error,50,sqrt,1,5,590,TPESampler,COMPLETE
2851,0.32796673112922137,2025-04-25 00:01:16.254834,2025-04-25 00:01:37.456097,0 days 00:00:21.201263,False,absolute_error,50,sqrt,1,4,523,TPESampler,COMPLETE
2852,0.4185858767242896,2025-04-25 00:01:20.611609,2025-04-25 00:01:37.355679,0 days 00:00:16.744070,False,absolute_error,42,sqrt,2,2,585,TPESampler,COMPLETE
2853,0.3614894890882571,2025-04-25 00:01:22.470816,2025-04-25 00:01:41.934120,0 days 00:00:19.463304,False,absolute_error,33,sqrt,1,6,555,TPESampler,COMPLETE
2854,0.3747481553959614,2025-04-25 00:01:33.716909,2025-04-25 00:01:37.479163,0 days 00:00:03.762254,True,absolute_error,35,sqrt,1,4,159,TPESampler,COMPLETE
2855,0.3436477032076898,2025-04-25 00:01:37.614794,2025-04-25 00:02:01.841969,0 days 00:00:24.227175,False,absolute_error,41,sqrt,1,6,656,TPESampler,COMPLETE
2856,0.3557205196287415,2025-04-25 00:01:37.782225,2025-04-25 00:01:53.387172,0 days 00:00:15.604947,False,absolute_error,49,sqrt,1,13,398,TPESampler,COMPLETE
2857,0.33258417610979346,2025-04-25 00:01:37.800062,2025-04-25 00:02:02.567066,0 days 00:00:24.767004,False,absolute_error,42,sqrt,1,5,660,TPESampler,COMPLETE
2858,0.33174878667663094,2025-04-25 00:01:38.382831,2025-04-25 00:02:04.868636,0 days 00:00:26.485805,False,absolute_error,50,sqrt,1,6,684,TPESampler,COMPLETE
2859,0.42006056982579254,2025-04-25 00:01:42.169689,2025-04-25 00:01:43.815137,0 days 00:00:01.645448,False,squared_error,44,sqrt,2,6,421,TPESampler,COMPLETE
2860,0.6719928739254046,2025-04-25 00:01:44.034468,2025-04-25 00:01:45.324932,0 days 00:00:01.290464,False,squared_error,46,sqrt,8,3,601,TPESampler,COMPLETE
2861,0.7202361100823383,2025-04-25 00:01:45.563214,2025-04-25 00:01:49.477843,0 days 00:00:03.914629,False,absolute_error,28,sqrt,10,30,707,TPESampler,COMPLETE
2862,0.55946479209111,2025-04-25 00:01:49.726004,2025-04-25 00:01:51.249425,0 days 00:00:01.523421,True,squared_error,22,log2,1,39,575,TPESampler,COMPLETE
2863,0.34176447250636705,2025-04-25 00:01:51.464235,2025-04-25 00:02:08.872066,0 days 00:00:17.407831,False,absolute_error,43,sqrt,1,6,467,TPESampler,COMPLETE
2864,0.3384135539177856,2025-04-25 00:01:53.607067,2025-04-25 00:02:15.436179,0 days 00:00:21.829112,False,absolute_error,43,sqrt,1,3,576,TPESampler,COMPLETE
2865,0.42290628829883287,2025-04-25 00:02:02.069621,2025-04-25 00:02:16.173007,0 days 00:00:14.103386,False,absolute_error,50,sqrt,2,7,568,TPESampler,COMPLETE
2866,0.35611675383855484,2025-04-25 00:02:02.970641,2025-04-25 00:04:13.312291,0 days 00:02:10.341650,True,absolute_error,48,,1,10,820,TPESampler,COMPLETE
2867,0.419952421342625,2025-04-25 00:02:05.088748,2025-04-25 00:02:16.269001,0 days 00:00:11.180253,False,absolute_error,42,sqrt,2,5,424,TPESampler,COMPLETE
2868,0.40942471872402714,2025-04-25 00:02:09.155475,2025-04-25 00:02:11.509031,0 days 00:00:02.353556,True,squared_error,13,,1,3,236,TPESampler,COMPLETE
2869,0.3904915259970159,2025-04-25 00:02:11.991474,2025-04-25 00:02:29.574916,0 days 00:00:17.583442,True,absolute_error,50,sqrt,1,17,646,TPESampler,COMPLETE
2870,0.6250279911240665,2025-04-25 00:02:15.662225,2025-04-25 00:02:27.841806,0 days 00:00:12.179581,True,absolute_error,14,log2,1,3,954,TPESampler,COMPLETE
2871,0.33207660993600113,2025-04-25 00:02:16.630398,2025-04-25 00:02:35.675842,0 days 00:00:19.045444,False,absolute_error,50,sqrt,1,6,504,TPESampler,COMPLETE
2872,0.3519380508250205,2025-04-25 00:02:16.878363,2025-04-25 00:02:38.260067,0 days 00:00:21.381704,False,absolute_error,50,sqrt,1,11,461,TPESampler,COMPLETE
2873,0.3323284361382582,2025-04-25 00:02:17.301855,2025-04-25 00:02:51.277978,0 days 00:00:33.976123,False,absolute_error,42,sqrt,1,5,709,TPESampler,COMPLETE
2874,0.4136796512230598,2025-04-25 00:02:28.050313,2025-04-25 00:02:35.465993,0 days 00:00:07.415680,False,absolute_error,50,sqrt,2,4,277,TPESampler,COMPLETE
2875,0.4511777519492223,2025-04-25 00:02:29.783087,2025-04-25 00:02:31.100877,0 days 00:00:01.317790,True,squared_error,24,sqrt,1,30,403,TPESampler,COMPLETE
2876,0.3405570783003618,2025-04-25 00:02:31.324650,2025-04-25 00:02:41.719462,0 days 00:00:10.394812,False,absolute_error,39,sqrt,1,5,262,TPESampler,COMPLETE
2877,0.3679666244854125,2025-04-25 00:02:35.682206,2025-04-25 00:02:46.278507,0 days 00:00:10.596301,False,absolute_error,49,log2,1,4,332,TPESampler,COMPLETE
2878,0.6738262822921259,2025-04-25 00:02:35.912529,2025-04-25 00:02:37.360305,0 days 00:00:01.447776,False,squared_error,10,log2,1,2,608,TPESampler,COMPLETE
2879,0.3321799656502573,2025-04-25 00:02:37.575577,2025-04-25 00:03:00.513955,0 days 00:00:22.938378,False,absolute_error,42,sqrt,1,5,494,TPESampler,COMPLETE
2880,0.45959952637947554,2025-04-25 00:02:38.473067,2025-04-25 00:02:41.677664,0 days 00:00:03.204597,False,squared_error,49,,6,23,532,TPESampler,COMPLETE
2881,0.3289885721533765,2025-04-25 00:02:41.862885,2025-04-25 00:02:47.535385,0 days 00:00:05.672500,False,absolute_error,50,sqrt,1,4,123,TPESampler,COMPLETE
2882,0.3468587640283327,2025-04-25 00:02:41.918114,2025-04-25 00:03:00.211350,0 days 00:00:18.293236,False,absolute_error,42,sqrt,1,2,454,TPESampler,COMPLETE
2883,0.33460839522586855,2025-04-25 00:02:46.685405,2025-04-25 00:03:08.144372,0 days 00:00:21.458967,False,absolute_error,49,sqrt,1,3,502,TPESampler,COMPLETE
2884,0.33253764687696186,2025-04-25 00:02:48.140050,2025-04-25 00:03:17.189744,0 days 00:00:29.049694,False,absolute_error,50,sqrt,1,3,707,TPESampler,COMPLETE
2885,0.3310619165310725,2025-04-25 00:02:51.671964,2025-04-25 00:03:15.391589,0 days 00:00:23.719625,False,absolute_error,50,sqrt,1,6,625,TPESampler,COMPLETE
2886,0.3358863025533576,2025-04-25 00:03:00.613871,2025-04-25 00:03:11.695728,0 days 00:00:11.081857,False,absolute_error,41,sqrt,1,4,287,TPESampler,COMPLETE
2887,0.819393301679261,2025-04-25 00:03:00.768003,2025-04-25 00:03:01.882574,0 days 00:00:01.114571,True,squared_error,22,log2,4,13,331,TPESampler,COMPLETE
2888,0.416505569843996,2025-04-25 00:03:02.104066,2025-04-25 00:03:14.895140,0 days 00:00:12.791074,False,absolute_error,43,sqrt,2,3,484,TPESampler,COMPLETE
2889,0.3353686286004725,2025-04-25 00:03:08.377097,2025-04-25 00:03:32.576564,0 days 00:00:24.199467,False,absolute_error,50,sqrt,1,7,645,TPESampler,COMPLETE
2890,0.3431339147759154,2025-04-25 00:03:11.919633,2025-04-25 00:03:13.548503,0 days 00:00:01.628870,False,squared_error,49,sqrt,1,7,410,TPESampler,COMPLETE
2891,0.46610493037540757,2025-04-25 00:03:13.775931,2025-04-25 00:04:43.859834,0 days 00:01:30.083903,False,absolute_error,19,,3,29,829,TPESampler,COMPLETE
2892,0.32760994504469454,2025-04-25 00:03:15.117504,2025-04-25 00:03:26.170663,0 days 00:00:11.053159,False,absolute_error,50,sqrt,1,4,281,TPESampler,COMPLETE
2893,0.3458742274727604,2025-04-25 00:03:15.682789,2025-04-25 00:03:43.415631,0 days 00:00:27.732842,False,absolute_error,50,sqrt,1,2,500,TPESampler,COMPLETE
2894,0.41647161701084867,2025-04-25 00:03:17.403883,2025-04-25 00:03:24.414092,0 days 00:00:07.010209,False,absolute_error,40,sqrt,2,3,267,TPESampler,COMPLETE
2895,0.32565038683969266,2025-04-25 00:03:24.659375,2025-04-25 00:03:41.854551,0 days 00:00:17.195176,False,absolute_error,50,sqrt,1,5,444,TPESampler,COMPLETE
2896,0.4471422304798621,2025-04-25 00:03:26.423682,2025-04-25 00:04:57.143656,0 days 00:01:30.719974,False,absolute_error,50,,1,5,361,TPESampler,COMPLETE
