number,value,datetime_start,datetime_complete,duration,params_bootstrap,params_criterion,params_max_depth,params_max_features,params_min_samples_leaf,params_min_samples_split,params_n_estimators,system_attrs_auto:sampler,state
1934,0.3248406800396405,2025-04-24 23:17:28.253207,2025-04-24 23:17:59.225784,0 days 00:00:30.972577,False,absolute_error,50,sqrt,1,5,582,TPESampler,COMPLETE
1935,0.3266378883740608,2025-04-24 23:17:30.518067,2025-04-24 23:17:54.865116,0 days 00:00:24.347049,False,absolute_error,50,sqrt,1,4,643,TPESampler,COMPLETE
1936,0.32560334704781313,2025-04-24 23:17:36.058782,2025-04-24 23:18:03.419650,0 days 00:00:27.360868,False,absolute_error,50,sqrt,1,5,656,TPESampler,COMPLETE
1937,0.3358068078254211,2025-04-24 23:17:48.773059,2025-04-24 23:18:11.179546,0 days 00:00:22.406487,False,absolute_error,41,sqrt,1,5,603,TPESampler,COMPLETE
1938,0.38630273999856335,2025-04-24 23:17:50.241940,2025-04-24 23:17:51.847471,0 days 00:00:01.605531,False,squared_error,20,,2,7,142,TPESampler,COMPLETE
1939,0.3516975590550323,2025-04-24 23:17:52.190296,2025-04-24 23:18:14.384600,0 days 00:00:22.194304,False,absolute_error,42,sqrt,1,8,601,TPESampler,COMPLETE
1940,0.33257905410924005,2025-04-24 23:17:52.532091,2025-04-24 23:18:13.544446,0 days 00:00:21.012355,False,absolute_error,42,sqrt,1,5,559,TPESampler,COMPLETE
1941,0.5694268722823543,2025-04-24 23:17:55.104067,2025-04-24 23:17:56.711539,0 days 00:00:01.607472,True,squared_error,10,sqrt,1,4,734,TPESampler,COMPLETE
1942,0.4798895313349959,2025-04-24 23:17:56.902191,2025-04-24 23:17:58.060539,0 days 00:00:01.158348,False,squared_error,7,,1,10,105,TPESampler,COMPLETE
1943,0.41671057910840187,2025-04-24 23:17:58.248716,2025-04-24 23:18:12.327109,0 days 00:00:14.078393,False,absolute_error,50,sqrt,2,3,574,TPESampler,COMPLETE
1944,0.8726582515529581,2025-04-24 23:17:59.420675,2025-04-24 23:18:00.942232,0 days 00:00:01.521557,True,absolute_error,34,log2,12,13,589,TPESampler,COMPLETE
1945,0.41687388324781804,2025-04-24 23:18:01.136884,2025-04-24 23:18:15.649911,0 days 00:00:14.513027,False,absolute_error,50,sqrt,2,4,591,TPESampler,COMPLETE
1946,0.3355407100189575,2025-04-24 23:18:03.675366,2025-04-24 23:18:22.291432,0 days 00:00:18.616066,False,absolute_error,50,sqrt,1,7,497,TPESampler,COMPLETE
1947,0.33247911561837334,2025-04-24 23:18:11.371696,2025-04-24 23:18:28.180027,0 days 00:00:16.808331,False,absolute_error,42,sqrt,1,4,452,TPESampler,COMPLETE
1948,0.33196196771222725,2025-04-24 23:18:12.515847,2025-04-24 23:18:34.032728,0 days 00:00:21.516881,False,absolute_error,50,sqrt,1,3,560,TPESampler,COMPLETE
1949,0.32724313519975656,2025-04-24 23:18:13.731457,2025-04-24 23:18:35.916716,0 days 00:00:22.185259,False,absolute_error,50,sqrt,1,4,560,TPESampler,COMPLETE
1950,0.3420115481212825,2025-04-24 23:18:14.572514,2025-04-24 23:18:39.290134,0 days 00:00:24.717620,False,absolute_error,49,sqrt,1,8,632,TPESampler,COMPLETE
1951,0.3650459137311015,2025-04-24 23:18:15.839154,2025-04-24 23:18:28.204879,0 days 00:00:12.365725,True,absolute_error,47,sqrt,1,6,542,TPESampler,COMPLETE
1952,0.4189099152754283,2025-04-24 23:18:22.477554,2025-04-24 23:18:33.548109,0 days 00:00:11.070555,False,absolute_error,50,sqrt,2,5,444,TPESampler,COMPLETE
1953,0.3956209310111927,2025-04-24 23:18:28.337639,2025-04-24 23:18:41.877345,0 days 00:00:13.539706,False,absolute_error,39,log2,1,2,473,TPESampler,COMPLETE
1954,0.3329553356807927,2025-04-24 23:18:28.389105,2025-04-24 23:18:47.187878,0 days 00:00:18.798773,False,absolute_error,43,sqrt,1,4,487,TPESampler,COMPLETE
1955,0.32638751417404893,2025-04-24 23:18:33.731326,2025-04-24 23:18:54.536398,0 days 00:00:20.805072,False,absolute_error,50,sqrt,1,5,515,TPESampler,COMPLETE
1956,0.6272390803338691,2025-04-24 23:18:34.254631,2025-04-24 23:18:43.522563,0 days 00:00:09.267932,False,absolute_error,50,log2,2,9,688,TPESampler,COMPLETE
1957,0.7026745616896902,2025-04-24 23:18:36.107405,2025-04-24 23:18:40.791025,0 days 00:00:04.683620,False,absolute_error,30,log2,3,22,553,TPESampler,COMPLETE
1958,0.3249097045585432,2025-04-24 23:18:39.478793,2025-04-24 23:19:03.082366,0 days 00:00:23.603573,False,absolute_error,50,sqrt,1,5,606,TPESampler,COMPLETE
1959,0.44983167006763497,2025-04-24 23:18:40.988595,2025-04-24 23:21:27.904835,0 days 00:02:46.916240,False,absolute_error,50,,1,4,724,TPESampler,COMPLETE
1960,0.3453972535871776,2025-04-24 23:18:42.074494,2025-04-24 23:19:03.191374,0 days 00:00:21.116880,False,absolute_error,50,sqrt,1,10,484,TPESampler,COMPLETE
1961,0.4194046603515065,2025-04-24 23:18:43.706170,2025-04-24 23:18:44.763826,0 days 00:00:01.057656,False,squared_error,40,sqrt,2,3,279,TPESampler,COMPLETE
1962,0.3267153648163538,2025-04-24 23:18:44.947546,2025-04-24 23:19:02.088157,0 days 00:00:17.140611,False,absolute_error,50,sqrt,1,4,448,TPESampler,COMPLETE
1963,0.4209307241634655,2025-04-24 23:18:47.379570,2025-04-24 23:19:03.898538,0 days 00:00:16.518968,False,absolute_error,42,sqrt,2,5,526,TPESampler,COMPLETE
1964,0.35170399664276353,2025-04-24 23:18:54.728732,2025-04-24 23:19:12.094093,0 days 00:00:17.365361,False,absolute_error,42,sqrt,1,8,445,TPESampler,COMPLETE
1965,0.32635003450329814,2025-04-24 23:19:02.276241,2025-04-24 23:19:26.167479,0 days 00:00:23.891238,False,absolute_error,50,sqrt,1,4,630,TPESampler,COMPLETE
1966,0.7804937633397498,2025-04-24 23:19:03.274604,2025-04-24 23:19:04.897479,0 days 00:00:01.622875,True,absolute_error,47,log2,3,4,322,TPESampler,COMPLETE
1967,0.46012992254581564,2025-04-24 23:19:03.406393,2025-04-24 23:19:14.208726,0 days 00:00:10.802333,True,absolute_error,49,sqrt,2,13,695,TPESampler,COMPLETE
1968,0.3406127146428567,2025-04-24 23:19:04.220432,2025-04-24 23:19:28.543856,0 days 00:00:24.323424,False,absolute_error,50,sqrt,1,8,612,TPESampler,COMPLETE
1969,0.41808725528594914,2025-04-24 23:19:05.086044,2025-04-24 23:19:24.146089,0 days 00:00:19.060045,False,absolute_error,44,sqrt,2,2,627,TPESampler,COMPLETE
1970,0.33963114779029197,2025-04-24 23:19:12.280767,2025-04-24 23:19:39.157511,0 days 00:00:26.876744,False,absolute_error,41,sqrt,1,3,660,TPESampler,COMPLETE
1971,0.36827335613274,2025-04-24 23:19:14.418644,2025-04-24 23:19:35.098191,0 days 00:00:20.679547,False,absolute_error,43,sqrt,1,15,578,TPESampler,COMPLETE
1972,0.33224563755131786,2025-04-24 23:19:24.332995,2025-04-24 23:19:47.231872,0 days 00:00:22.898877,False,absolute_error,43,sqrt,1,5,626,TPESampler,COMPLETE
1973,0.4487679677005877,2025-04-24 23:19:26.360279,2025-04-24 23:19:27.457119,0 days 00:00:01.096840,True,squared_error,50,log2,1,44,332,TPESampler,COMPLETE
1974,0.46773601221381006,2025-04-24 23:19:27.647609,2025-04-24 23:20:35.980927,0 days 00:01:08.333318,False,absolute_error,18,,3,2,530,TPESampler,COMPLETE
1975,0.3278362007812921,2025-04-24 23:19:28.737572,2025-04-24 23:19:47.194612,0 days 00:00:18.457040,False,absolute_error,50,sqrt,1,4,489,TPESampler,COMPLETE
1976,0.32778848021543533,2025-04-24 23:19:35.290536,2025-04-24 23:19:55.954739,0 days 00:00:20.664203,False,absolute_error,50,sqrt,1,4,549,TPESampler,COMPLETE
1977,0.44925805330214363,2025-04-24 23:19:39.345059,2025-04-24 23:21:19.462408,0 days 00:01:40.117349,False,absolute_error,50,,1,4,433,TPESampler,COMPLETE
1978,0.33111951960154745,2025-04-24 23:19:47.411366,2025-04-24 23:20:19.376475,0 days 00:00:31.965109,False,absolute_error,50,sqrt,1,6,600,TPESampler,COMPLETE
1979,0.5248943117432272,2025-04-24 23:19:47.411734,2025-04-24 23:19:49.022724,0 days 00:00:01.610990,False,squared_error,23,log2,1,13,729,TPESampler,COMPLETE
1980,0.35316506156595484,2025-04-24 23:19:49.204401,2025-04-24 23:20:02.174736,0 days 00:00:12.970335,True,absolute_error,49,sqrt,1,4,572,TPESampler,COMPLETE
1981,0.421369952688819,2025-04-24 23:19:56.143264,2025-04-24 23:20:10.909918,0 days 00:00:14.766654,False,absolute_error,42,sqrt,2,5,574,TPESampler,COMPLETE
1982,0.4480832019876201,2025-04-24 23:20:02.370196,2025-04-24 23:20:12.452880,0 days 00:00:10.082684,True,absolute_error,45,log2,1,21,673,TPESampler,COMPLETE
1983,0.3454007130826716,2025-04-24 23:20:11.100323,2025-04-24 23:20:34.314600,0 days 00:00:23.214277,False,absolute_error,50,sqrt,1,10,525,TPESampler,COMPLETE
1984,0.3349752784845065,2025-04-24 23:20:12.644070,2025-04-24 23:20:38.358223,0 days 00:00:25.714153,False,absolute_error,50,sqrt,1,7,579,TPESampler,COMPLETE
1985,0.3329785528879577,2025-04-24 23:20:19.562053,2025-04-24 23:20:41.983209,0 days 00:00:22.421156,False,absolute_error,42,sqrt,1,4,610,TPESampler,COMPLETE
1986,0.34359672044500666,2025-04-24 23:20:34.510046,2025-04-24 23:20:53.172503,0 days 00:00:18.662457,False,absolute_error,41,sqrt,1,6,516,TPESampler,COMPLETE
1987,0.3366948811445034,2025-04-24 23:20:36.174797,2025-04-24 23:20:38.534644,0 days 00:00:02.359847,False,squared_error,50,sqrt,1,3,549,TPESampler,COMPLETE
1988,0.33921086620293583,2025-04-24 23:20:38.554565,2025-04-24 23:21:01.215278,0 days 00:00:22.660713,False,absolute_error,42,sqrt,1,3,576,TPESampler,COMPLETE
1989,0.33960805046952236,2025-04-24 23:20:38.732287,2025-04-24 23:21:01.011147,0 days 00:00:22.278860,False,absolute_error,41,sqrt,1,3,589,TPESampler,COMPLETE
1990,0.3516991597910148,2025-04-24 23:20:42.169637,2025-04-24 23:21:04.283844,0 days 00:00:22.114207,False,absolute_error,42,sqrt,1,8,614,TPESampler,COMPLETE
1991,0.3353782437760418,2025-04-24 23:20:53.366535,2025-04-24 23:21:16.493748,0 days 00:00:23.127213,False,absolute_error,50,sqrt,1,7,627,TPESampler,COMPLETE
1992,0.4178104949358489,2025-04-24 23:21:01.203304,2025-04-24 23:21:18.043918,0 days 00:00:16.840614,False,absolute_error,50,sqrt,2,4,679,TPESampler,COMPLETE
1993,0.32563783179766764,2025-04-24 23:21:01.416407,2025-04-24 23:21:22.306195,0 days 00:00:20.889788,False,absolute_error,50,sqrt,1,5,559,TPESampler,COMPLETE
1994,0.340123408186918,2025-04-24 23:21:04.549712,2025-04-24 23:21:26.211660,0 days 00:00:21.661948,False,absolute_error,41,sqrt,1,3,524,TPESampler,COMPLETE
1995,0.3356285493827668,2025-04-24 23:21:16.687655,2025-04-24 23:21:38.888668,0 days 00:00:22.201013,False,absolute_error,45,sqrt,1,3,590,TPESampler,COMPLETE
1996,0.3864766387491872,2025-04-24 23:21:18.249970,2025-04-24 23:21:35.193810,0 days 00:00:16.943840,False,absolute_error,42,log2,1,4,628,TPESampler,COMPLETE
1997,0.3318124517812509,2025-04-24 23:21:19.660028,2025-04-24 23:21:40.229624,0 days 00:00:20.569596,False,absolute_error,50,sqrt,1,3,462,TPESampler,COMPLETE
1998,0.4214939418494745,2025-04-24 23:21:22.500982,2025-04-24 23:21:37.508010,0 days 00:00:15.007028,False,absolute_error,45,sqrt,2,6,615,TPESampler,COMPLETE
1999,0.34468957303377706,2025-04-24 23:21:26.398341,2025-04-24 23:21:52.668575,0 days 00:00:26.270234,False,absolute_error,50,sqrt,1,2,637,TPESampler,COMPLETE
2000,0.3318758394807677,2025-04-24 23:21:28.099675,2025-04-24 23:21:51.016548,0 days 00:00:22.916873,False,absolute_error,50,sqrt,1,3,602,TPESampler,COMPLETE
2001,0.3328626887882971,2025-04-24 23:21:35.381779,2025-04-24 23:22:01.500841,0 days 00:00:26.119062,False,absolute_error,43,sqrt,1,5,663,TPESampler,COMPLETE
2002,0.4177039957647538,2025-04-24 23:21:37.694680,2025-04-24 23:21:53.327819,0 days 00:00:15.633139,False,absolute_error,50,sqrt,2,4,634,TPESampler,COMPLETE
2003,0.32670067508983575,2025-04-24 23:21:39.084444,2025-04-24 23:22:00.831666,0 days 00:00:21.747222,False,absolute_error,50,sqrt,1,4,575,TPESampler,COMPLETE
2004,0.3838618720027171,2025-04-24 23:21:40.422473,2025-04-24 23:21:56.447196,0 days 00:00:16.024723,False,absolute_error,49,log2,1,6,520,TPESampler,COMPLETE
2005,0.6931085068199526,2025-04-24 23:21:51.214092,2025-04-24 23:21:55.519725,0 days 00:00:04.305633,True,absolute_error,32,log2,2,2,691,TPESampler,COMPLETE
2006,0.3311813158048836,2025-04-24 23:21:52.857237,2025-04-24 23:22:14.228376,0 days 00:00:21.371139,False,absolute_error,50,sqrt,1,6,575,TPESampler,COMPLETE
2007,0.3481562523232267,2025-04-24 23:21:53.554516,2025-04-24 23:22:09.279327,0 days 00:00:15.724811,False,absolute_error,44,sqrt,1,8,420,TPESampler,COMPLETE
2008,0.7730510957753176,2025-04-24 23:21:55.712937,2025-04-24 23:21:56.558653,0 days 00:00:00.845716,True,squared_error,48,sqrt,9,2,238,TPESampler,COMPLETE
2009,0.3390176488436663,2025-04-24 23:21:56.643893,2025-04-24 23:22:15.993453,0 days 00:00:19.349560,False,absolute_error,41,sqrt,1,3,406,TPESampler,COMPLETE
2010,0.32663496898596706,2025-04-24 23:21:56.773331,2025-04-24 23:22:18.557633,0 days 00:00:21.784302,False,absolute_error,50,sqrt,1,4,577,TPESampler,COMPLETE
2011,0.3366306290447799,2025-04-24 23:22:01.022515,2025-04-24 23:22:27.268113,0 days 00:00:26.245598,False,absolute_error,41,sqrt,1,5,657,TPESampler,COMPLETE
2012,0.3271713932548112,2025-04-24 23:22:01.723850,2025-04-24 23:22:30.614508,0 days 00:00:28.890658,False,absolute_error,50,sqrt,1,4,675,TPESampler,COMPLETE
2013,0.46247003692183625,2025-04-24 23:22:09.624714,2025-04-24 23:22:14.346743,0 days 00:00:04.722029,True,absolute_error,10,,7,4,162,TPESampler,COMPLETE
2014,0.4422719663730865,2025-04-24 23:22:14.755649,2025-04-24 23:24:46.034129,0 days 00:02:31.278480,False,absolute_error,50,,1,8,630,TPESampler,COMPLETE
2015,0.3652023119809928,2025-04-24 23:22:15.699975,2025-04-24 23:22:33.035643,0 days 00:00:17.335668,False,absolute_error,49,log2,1,3,587,TPESampler,COMPLETE
2016,0.8244277374698549,2025-04-24 23:22:16.229598,2025-04-24 23:22:18.419573,0 days 00:00:02.189975,True,absolute_error,6,sqrt,15,4,749,TPESampler,COMPLETE
2017,0.8189161860221864,2025-04-24 23:22:18.602433,2025-04-24 23:22:19.947451,0 days 00:00:01.345018,True,squared_error,47,sqrt,14,2,731,TPESampler,COMPLETE
2018,0.33226175409478864,2025-04-24 23:22:18.756010,2025-04-24 23:22:46.733116,0 days 00:00:27.977106,False,absolute_error,50,sqrt,1,3,667,TPESampler,COMPLETE
2019,0.7697879253179042,2025-04-24 23:22:20.134291,2025-04-24 23:22:22.779561,0 days 00:00:02.645270,False,absolute_error,6,log2,2,43,374,TPESampler,COMPLETE
2020,0.4227821384589864,2025-04-24 23:22:22.967146,2025-04-24 23:22:24.592977,0 days 00:00:01.625831,False,squared_error,45,sqrt,2,10,680,TPESampler,COMPLETE
2021,0.42451096024153917,2025-04-24 23:22:24.792529,2025-04-24 23:22:39.276981,0 days 00:00:14.484452,False,absolute_error,44,sqrt,2,8,596,TPESampler,COMPLETE
2022,0.35257805333547965,2025-04-24 23:22:27.466780,2025-04-24 23:22:50.681335,0 days 00:00:23.214555,False,absolute_error,50,sqrt,1,12,627,TPESampler,COMPLETE
2023,0.38543457059806674,2025-04-24 23:22:30.806374,2025-04-24 23:23:58.858897,0 days 00:01:28.052523,True,absolute_error,32,,1,24,608,TPESampler,COMPLETE
2024,0.3405270589603212,2025-04-24 23:22:33.226716,2025-04-24 23:22:54.414191,0 days 00:00:21.187475,False,absolute_error,42,sqrt,1,6,584,TPESampler,COMPLETE
2025,0.42258598117447954,2025-04-24 23:22:39.464824,2025-04-24 23:22:54.959363,0 days 00:00:15.494539,False,absolute_error,50,sqrt,2,7,519,TPESampler,COMPLETE
2026,0.3413188368906459,2025-04-24 23:22:47.032910,2025-04-24 23:23:13.064221,0 days 00:00:26.031311,False,absolute_error,50,sqrt,1,8,643,TPESampler,COMPLETE
2027,0.42348936620366784,2025-04-24 23:22:51.020540,2025-04-24 23:23:08.359087,0 days 00:00:17.338547,False,absolute_error,50,sqrt,2,8,605,TPESampler,COMPLETE
2028,0.4194837380860268,2025-04-24 23:22:54.841579,2025-04-24 23:23:14.403297,0 days 00:00:19.561718,False,absolute_error,42,sqrt,2,4,658,TPESampler,COMPLETE
2029,0.4202540367267769,2025-04-24 23:22:55.277433,2025-04-24 23:23:10.316609,0 days 00:00:15.039176,False,absolute_error,43,sqrt,2,5,484,TPESampler,COMPLETE
2030,0.4207050073499853,2025-04-24 23:23:08.551501,2025-04-24 23:23:25.276450,0 days 00:00:16.724949,False,absolute_error,50,sqrt,2,5,642,TPESampler,COMPLETE
2031,0.8136310977259585,2025-04-24 23:23:10.507742,2025-04-24 23:23:12.378319,0 days 00:00:01.870577,True,absolute_error,19,sqrt,13,13,630,TPESampler,COMPLETE
2032,0.3274063977815402,2025-04-24 23:23:12.565350,2025-04-24 23:23:37.470583,0 days 00:00:24.905233,False,absolute_error,50,sqrt,1,4,554,TPESampler,COMPLETE
2033,0.4156937691972655,2025-04-24 23:23:13.302574,2025-04-24 23:23:25.502286,0 days 00:00:12.199712,False,absolute_error,46,sqrt,2,3,488,TPESampler,COMPLETE
2034,0.3310347391617366,2025-04-24 23:23:14.595255,2025-04-24 23:23:30.120436,0 days 00:00:15.525181,False,absolute_error,43,sqrt,1,5,413,TPESampler,COMPLETE
2035,0.3681615308561951,2025-04-24 23:23:25.460957,2025-04-24 23:23:44.412131,0 days 00:00:18.951174,True,absolute_error,50,sqrt,1,7,608,TPESampler,COMPLETE
2036,0.3267554245379483,2025-04-24 23:23:25.742145,2025-04-24 23:23:55.071365,0 days 00:00:29.329220,False,absolute_error,50,sqrt,1,4,599,TPESampler,COMPLETE
2037,0.33592001830752777,2025-04-24 23:23:30.323013,2025-04-24 23:23:56.806959,0 days 00:00:26.483946,False,absolute_error,41,sqrt,1,5,608,TPESampler,COMPLETE
2038,0.3336920517327737,2025-04-24 23:23:37.673347,2025-04-24 23:23:39.862813,0 days 00:00:02.189466,False,squared_error,50,sqrt,1,5,582,TPESampler,COMPLETE
2039,0.3816997999345866,2025-04-24 23:23:40.044238,2025-04-24 23:23:41.068869,0 days 00:00:01.024631,True,squared_error,36,sqrt,1,6,211,TPESampler,COMPLETE
2040,0.3251884645762682,2025-04-24 23:23:41.265025,2025-04-24 23:24:09.935619,0 days 00:00:28.670594,False,absolute_error,50,sqrt,1,5,645,TPESampler,COMPLETE
2041,0.8753954144258174,2025-04-24 23:23:44.610976,2025-04-24 23:23:45.391510,0 days 00:00:00.780534,True,squared_error,27,log2,13,35,161,TPESampler,COMPLETE
2042,0.4092158247064208,2025-04-24 23:23:45.582151,2025-04-24 23:24:49.189027,0 days 00:01:03.606876,False,absolute_error,46,,2,5,466,TPESampler,COMPLETE
2043,0.33350551058448946,2025-04-24 23:23:55.280196,2025-04-24 23:24:12.910892,0 days 00:00:17.630696,False,absolute_error,43,sqrt,1,5,478,TPESampler,COMPLETE
2044,0.557735965923599,2025-04-24 23:23:56.996864,2025-04-24 23:23:59.599961,0 days 00:00:02.603097,True,squared_error,25,,15,2,692,TPESampler,COMPLETE
2045,0.3277777855323141,2025-04-24 23:23:59.050250,2025-04-24 23:24:12.039722,0 days 00:00:12.989472,False,absolute_error,50,sqrt,1,4,336,TPESampler,COMPLETE
2046,0.331874769599507,2025-04-24 23:23:59.916313,2025-04-24 23:24:24.141359,0 days 00:00:24.225046,False,absolute_error,43,sqrt,1,4,662,TPESampler,COMPLETE
2047,0.35232977639871127,2025-04-24 23:24:10.143212,2025-04-24 23:24:32.994267,0 days 00:00:22.851055,False,absolute_error,43,sqrt,1,9,637,TPESampler,COMPLETE
2048,0.3467403246892672,2025-04-24 23:24:12.236175,2025-04-24 23:24:34.816411,0 days 00:00:22.580236,False,absolute_error,43,sqrt,1,2,589,TPESampler,COMPLETE
2049,0.4253734298321979,2025-04-24 23:24:13.112164,2025-04-24 23:24:22.480003,0 days 00:00:09.367839,False,absolute_error,50,sqrt,2,9,375,TPESampler,COMPLETE
2050,0.3409399982077536,2025-04-24 23:24:22.671918,2025-04-24 23:24:36.201980,0 days 00:00:13.530062,False,absolute_error,50,sqrt,1,8,360,TPESampler,COMPLETE
2051,0.3407863040376652,2025-04-24 23:24:24.429246,2025-04-24 23:24:45.704416,0 days 00:00:21.275170,False,absolute_error,50,sqrt,1,8,580,TPESampler,COMPLETE
2052,0.33219212010850546,2025-04-24 23:24:33.187408,2025-04-24 23:24:57.085552,0 days 00:00:23.898144,False,absolute_error,43,sqrt,1,5,604,TPESampler,COMPLETE
2053,0.3706602298839826,2025-04-24 23:24:35.007821,2025-04-24 23:24:38.008909,0 days 00:00:03.001088,False,squared_error,48,log2,1,3,900,TPESampler,COMPLETE
2054,0.336553355832606,2025-04-24 23:24:36.411254,2025-04-24 23:24:52.696578,0 days 00:00:16.285324,False,absolute_error,44,sqrt,1,3,426,TPESampler,COMPLETE
2055,0.4191127286373861,2025-04-24 23:24:38.201489,2025-04-24 23:24:54.767913,0 days 00:00:16.566424,False,absolute_error,43,sqrt,2,4,673,TPESampler,COMPLETE
2056,0.3351178788209566,2025-04-24 23:24:45.896575,2025-04-24 23:25:13.564166,0 days 00:00:27.667591,False,absolute_error,50,sqrt,1,7,613,TPESampler,COMPLETE
2057,0.5150676244922344,2025-04-24 23:24:46.240870,2025-04-24 23:24:47.611386,0 days 00:00:01.370516,True,squared_error,34,sqrt,3,7,508,TPESampler,COMPLETE
2058,0.3251414746900402,2025-04-24 23:24:47.807552,2025-04-24 23:25:13.193061,0 days 00:00:25.385509,False,absolute_error,50,sqrt,1,5,641,TPESampler,COMPLETE
2059,0.331818242729403,2025-04-24 23:24:49.387602,2025-04-24 23:25:15.132025,0 days 00:00:25.744423,False,absolute_error,43,sqrt,1,4,656,TPESampler,COMPLETE
2060,0.3271944357848284,2025-04-24 23:24:52.900460,2025-04-24 23:25:19.049888,0 days 00:00:26.149428,False,absolute_error,50,sqrt,1,4,561,TPESampler,COMPLETE
2061,0.48022883463854776,2025-04-24 23:24:54.955255,2025-04-24 23:25:19.993071,0 days 00:00:25.037816,False,absolute_error,16,sqrt,1,13,976,TPESampler,COMPLETE
2062,0.34588811927089175,2025-04-24 23:24:57.285571,2025-04-24 23:25:16.927825,0 days 00:00:19.642254,False,absolute_error,50,sqrt,1,2,496,TPESampler,COMPLETE
2063,0.41656967626421515,2025-04-24 23:25:13.387376,2025-04-24 23:25:27.123769,0 days 00:00:13.736393,False,absolute_error,50,sqrt,2,4,538,TPESampler,COMPLETE
2064,0.4166303467708747,2025-04-24 23:25:13.768315,2025-04-24 23:25:28.046606,0 days 00:00:14.278291,False,absolute_error,50,sqrt,2,2,571,TPESampler,COMPLETE
2065,0.3321361837026613,2025-04-24 23:25:15.325899,2025-04-24 23:25:31.369160,0 days 00:00:16.043261,False,absolute_error,43,sqrt,1,5,428,TPESampler,COMPLETE
2066,0.37033831184462745,2025-04-24 23:25:17.120176,2025-04-24 23:25:32.069210,0 days 00:00:14.949034,True,absolute_error,34,sqrt,1,3,702,TPESampler,COMPLETE
2067,0.4007138917981821,2025-04-24 23:25:19.245406,2025-04-24 23:25:24.903399,0 days 00:00:05.657993,False,squared_error,50,,2,4,666,TPESampler,COMPLETE
2068,0.46971555148587085,2025-04-24 23:25:20.214883,2025-04-24 23:25:57.116741,0 days 00:00:36.901858,False,absolute_error,43,,1,3,157,TPESampler,COMPLETE
2069,0.4185075728150569,2025-04-24 23:25:25.106291,2025-04-24 23:25:35.555585,0 days 00:00:10.449294,False,absolute_error,50,sqrt,2,5,367,TPESampler,COMPLETE
2070,0.7134410286479713,2025-04-24 23:25:27.306485,2025-04-24 23:25:30.142080,0 days 00:00:02.835595,False,absolute_error,5,sqrt,5,5,366,TPESampler,COMPLETE
2071,0.3280872926677183,2025-04-24 23:25:28.245152,2025-04-24 23:25:49.988422,0 days 00:00:21.743270,False,absolute_error,50,sqrt,1,4,512,TPESampler,COMPLETE
