number,value,datetime_start,datetime_complete,duration,params_bootstrap,params_criterion,params_max_depth,params_max_features,params_min_samples_leaf,params_min_samples_split,params_n_estimators,system_attrs_auto:sampler,state
4817,0.45693975262526293,2025-04-25 01:49:16.274272,2025-04-25 01:49:26.134375,0 days 00:00:09.860103,True,absolute_error,49,sqrt,2,7,770,TPESampler,COMPLETE
4818,0.4226274944226965,2025-04-25 01:49:26.382992,2025-04-25 01:49:43.499817,0 days 00:00:17.116825,False,absolute_error,43,sqrt,2,6,690,TPESampler,COMPLETE
4819,0.3313070379829147,2025-04-25 01:49:27.663826,2025-04-25 01:49:39.409007,0 days 00:00:11.745181,False,absolute_error,50,sqrt,1,3,296,TPESampler,COMPLETE
4820,0.41791667343514494,2025-04-25 01:49:31.071150,2025-04-25 01:49:45.803905,0 days 00:00:14.732755,False,absolute_error,44,sqrt,2,4,591,TPESampler,COMPLETE
4821,0.3257492687027948,2025-04-25 01:49:37.917078,2025-04-25 01:50:03.263991,0 days 00:00:25.346913,False,absolute_error,50,sqrt,1,5,669,TPESampler,COMPLETE
4822,0.42604175978299225,2025-04-25 01:49:39.651178,2025-04-25 01:49:46.535518,0 days 00:00:06.884340,False,absolute_error,43,sqrt,2,9,250,TPESampler,COMPLETE
4823,0.3924783272392331,2025-04-25 01:49:43.748406,2025-04-25 01:49:52.239544,0 days 00:00:08.491138,False,absolute_error,42,log2,1,5,298,TPESampler,COMPLETE
4824,0.4200953465032028,2025-04-25 01:49:46.052068,2025-04-25 01:49:59.548952,0 days 00:00:13.496884,False,absolute_error,50,sqrt,2,5,528,TPESampler,COMPLETE
4825,0.33288289122126874,2025-04-25 01:49:46.830181,2025-04-25 01:50:04.548152,0 days 00:00:17.717971,False,absolute_error,43,sqrt,1,4,470,TPESampler,COMPLETE
4826,0.41887556012832,2025-04-25 01:49:52.483842,2025-04-25 01:50:04.592991,0 days 00:00:12.109149,False,absolute_error,50,sqrt,2,5,480,TPESampler,COMPLETE
4827,0.3318735537708083,2025-04-25 01:49:58.514787,2025-04-25 01:50:23.101199,0 days 00:00:24.586412,False,absolute_error,42,sqrt,1,5,595,TPESampler,COMPLETE
4828,0.34814328233948666,2025-04-25 01:49:59.802207,2025-04-25 01:50:12.369970,0 days 00:00:12.567763,False,absolute_error,45,sqrt,1,9,331,TPESampler,COMPLETE
4829,0.33182772057125537,2025-04-25 01:50:03.520023,2025-04-25 01:50:23.029931,0 days 00:00:19.509908,False,absolute_error,50,sqrt,1,3,502,TPESampler,COMPLETE
4830,0.33104904621623826,2025-04-25 01:50:04.774418,2025-04-25 01:50:16.689313,0 days 00:00:11.914895,False,absolute_error,43,sqrt,1,5,299,TPESampler,COMPLETE
4831,0.3330195417637618,2025-04-25 01:50:04.832605,2025-04-25 01:50:33.794858,0 days 00:00:28.962253,False,absolute_error,50,sqrt,1,3,746,TPESampler,COMPLETE
4832,0.40949719561312503,2025-04-25 01:50:12.622946,2025-04-25 01:52:07.327797,0 days 00:01:54.704851,False,absolute_error,50,,2,6,812,TPESampler,COMPLETE
4833,0.41815765057146037,2025-04-25 01:50:16.939876,2025-04-25 01:50:18.703588,0 days 00:00:01.763712,False,squared_error,49,sqrt,2,3,584,TPESampler,COMPLETE
4834,0.4422212777024262,2025-04-25 01:50:18.955314,2025-04-25 01:52:42.423144,0 days 00:02:23.467830,False,absolute_error,42,,1,8,635,TPESampler,COMPLETE
4835,0.3315754723621105,2025-04-25 01:50:23.254221,2025-04-25 01:50:54.117944,0 days 00:00:30.863723,False,absolute_error,50,sqrt,1,6,547,TPESampler,COMPLETE
4836,0.4211706886907324,2025-04-25 01:50:23.465980,2025-04-25 01:50:50.140463,0 days 00:00:26.674483,False,absolute_error,50,sqrt,2,5,668,TPESampler,COMPLETE
4837,0.3295529080956489,2025-04-25 01:50:34.037598,2025-04-25 01:50:42.462531,0 days 00:00:08.424933,False,absolute_error,50,sqrt,1,6,205,TPESampler,COMPLETE
4838,0.36361973980721407,2025-04-25 01:50:42.714267,2025-04-25 01:51:04.328929,0 days 00:00:21.614662,False,absolute_error,44,sqrt,1,14,600,TPESampler,COMPLETE
4839,0.3597958466001124,2025-04-25 01:50:50.394176,2025-04-25 01:51:08.142739,0 days 00:00:17.748563,False,absolute_error,44,sqrt,1,12,481,TPESampler,COMPLETE
4840,0.3254915812389336,2025-04-25 01:50:54.379316,2025-04-25 01:51:19.964493,0 days 00:00:25.585177,False,absolute_error,50,sqrt,1,5,684,TPESampler,COMPLETE
4841,0.32927565578537704,2025-04-25 01:51:04.593086,2025-04-25 01:51:17.547295,0 days 00:00:12.954209,False,absolute_error,44,sqrt,1,4,336,TPESampler,COMPLETE
4842,0.45944350121667427,2025-04-25 01:51:06.246093,2025-04-25 01:51:28.444170,0 days 00:00:22.198077,False,absolute_error,31,,4,2,247,TPESampler,COMPLETE
4843,0.3276523773561657,2025-04-25 01:51:08.396251,2025-04-25 01:51:28.449614,0 days 00:00:20.053363,False,absolute_error,50,sqrt,1,4,527,TPESampler,COMPLETE
4844,0.4007633659474969,2025-04-25 01:51:17.798895,2025-04-25 01:51:20.733260,0 days 00:00:02.934365,True,squared_error,47,,2,28,521,TPESampler,COMPLETE
4845,0.33101020122346636,2025-04-25 01:51:20.211138,2025-04-25 01:51:43.110563,0 days 00:00:22.899425,False,absolute_error,44,sqrt,1,4,565,TPESampler,COMPLETE
4846,0.3271164355966387,2025-04-25 01:51:21.051465,2025-04-25 01:51:38.668007,0 days 00:00:17.616542,False,absolute_error,50,sqrt,1,4,453,TPESampler,COMPLETE
4847,0.3469349097381689,2025-04-25 01:51:28.702807,2025-04-25 01:51:53.269303,0 days 00:00:24.566496,False,absolute_error,44,sqrt,1,2,628,TPESampler,COMPLETE
4848,0.37611971782156595,2025-04-25 01:51:28.702682,2025-04-25 01:52:09.219578,0 days 00:00:40.516896,True,absolute_error,45,,2,11,524,TPESampler,COMPLETE
4849,0.4248987874808723,2025-04-25 01:51:39.091660,2025-04-25 01:51:40.152007,0 days 00:00:01.060347,False,squared_error,47,sqrt,2,18,168,TPESampler,COMPLETE
4850,0.3255687653158147,2025-04-25 01:51:40.399275,2025-04-25 01:52:06.757098,0 days 00:00:26.357823,False,absolute_error,50,sqrt,1,5,700,TPESampler,COMPLETE
4851,0.4259629943590159,2025-04-25 01:51:43.360879,2025-04-25 01:51:54.354081,0 days 00:00:10.993202,False,absolute_error,35,sqrt,2,6,441,TPESampler,COMPLETE
4852,0.4139239183631721,2025-04-25 01:51:53.515330,2025-04-25 01:52:02.605623,0 days 00:00:09.090293,False,absolute_error,44,sqrt,2,4,352,TPESampler,COMPLETE
4853,0.4227698238181683,2025-04-25 01:51:54.611874,2025-04-25 01:52:08.067024,0 days 00:00:13.455150,False,absolute_error,43,sqrt,2,7,539,TPESampler,COMPLETE
4854,0.3257950984722187,2025-04-25 01:52:02.855632,2025-04-25 01:52:18.202995,0 days 00:00:15.347363,False,absolute_error,50,sqrt,1,4,394,TPESampler,COMPLETE
4855,0.34104688900473956,2025-04-25 01:52:07.004312,2025-04-25 01:52:29.268066,0 days 00:00:22.263754,False,absolute_error,42,sqrt,1,6,609,TPESampler,COMPLETE
4856,0.3438993649076265,2025-04-25 01:52:07.575662,2025-04-25 01:52:39.304997,0 days 00:00:31.729335,False,absolute_error,50,sqrt,1,2,738,TPESampler,COMPLETE
4857,0.41569145805133795,2025-04-25 01:52:08.394045,2025-04-25 01:52:18.718827,0 days 00:00:10.324782,False,absolute_error,50,sqrt,2,4,382,TPESampler,COMPLETE
4858,0.3385534279917371,2025-04-25 01:52:09.746427,2025-04-25 01:52:28.860509,0 days 00:00:19.114082,False,absolute_error,43,sqrt,1,3,499,TPESampler,COMPLETE
4859,0.3532795361717779,2025-04-25 01:52:18.525125,2025-04-25 01:52:43.783045,0 days 00:00:25.257920,False,absolute_error,44,sqrt,1,9,689,TPESampler,COMPLETE
4860,0.38600303932976654,2025-04-25 01:52:18.996409,2025-04-25 01:52:37.052098,0 days 00:00:18.055689,False,absolute_error,43,log2,1,2,626,TPESampler,COMPLETE
4861,0.3255389662072363,2025-04-25 01:52:29.112655,2025-04-25 01:52:44.815256,0 days 00:00:15.702601,False,absolute_error,50,sqrt,1,5,341,TPESampler,COMPLETE
4862,0.32501034560370845,2025-04-25 01:52:29.531167,2025-04-25 01:52:51.507734,0 days 00:00:21.976567,False,absolute_error,50,sqrt,1,5,580,TPESampler,COMPLETE
4863,0.4497430838021971,2025-04-25 01:52:37.305456,2025-04-25 01:54:48.742890,0 days 00:02:11.437434,False,absolute_error,50,,1,4,572,TPESampler,COMPLETE
4864,0.43457149900440073,2025-04-25 01:52:39.553966,2025-04-25 01:52:42.224910,0 days 00:00:02.670944,False,squared_error,39,,4,2,303,TPESampler,COMPLETE
4865,0.34350351848295385,2025-04-25 01:52:42.743794,2025-04-25 01:53:04.570393,0 days 00:00:21.826599,False,absolute_error,50,sqrt,1,9,547,TPESampler,COMPLETE
4866,0.34632293459646873,2025-04-25 01:52:42.966827,2025-04-25 01:52:56.840256,0 days 00:00:13.873429,False,absolute_error,50,sqrt,1,2,286,TPESampler,COMPLETE
4867,0.3383160229039087,2025-04-25 01:52:44.433680,2025-04-25 01:53:09.288489,0 days 00:00:24.854809,False,absolute_error,43,sqrt,1,3,581,TPESampler,COMPLETE
4868,0.41663817695089994,2025-04-25 01:52:45.200018,2025-04-25 01:52:59.580519,0 days 00:00:14.380501,False,absolute_error,50,sqrt,2,3,528,TPESampler,COMPLETE
4869,0.41854158658181434,2025-04-25 01:52:51.773010,2025-04-25 01:53:01.801475,0 days 00:00:10.028465,True,absolute_error,38,sqrt,1,34,397,TPESampler,COMPLETE
4870,0.33218427894010527,2025-04-25 01:52:57.103136,2025-04-25 01:53:22.614902,0 days 00:00:25.511766,False,absolute_error,43,sqrt,1,5,630,TPESampler,COMPLETE
4871,0.330230853651729,2025-04-25 01:52:59.827112,2025-04-25 01:53:06.900298,0 days 00:00:07.073186,False,absolute_error,44,sqrt,1,4,172,TPESampler,COMPLETE
4872,0.8077164177677483,2025-04-25 01:53:02.046412,2025-04-25 01:53:03.222023,0 days 00:00:01.175611,True,squared_error,10,sqrt,12,46,341,TPESampler,COMPLETE
4873,0.3387458945092917,2025-04-25 01:53:03.464173,2025-04-25 01:53:05.194001,0 days 00:00:01.729828,False,squared_error,42,sqrt,1,4,348,TPESampler,COMPLETE
4874,0.3331399532398906,2025-04-25 01:53:04.935263,2025-04-25 01:53:23.908591,0 days 00:00:18.973328,False,absolute_error,43,sqrt,1,5,505,TPESampler,COMPLETE
4875,0.4139876744198489,2025-04-25 01:53:05.464528,2025-04-25 01:53:13.509195,0 days 00:00:08.044667,False,absolute_error,50,sqrt,2,3,295,TPESampler,COMPLETE
4876,0.41964059022854566,2025-04-25 01:53:07.158391,2025-04-25 01:53:15.512252,0 days 00:00:08.353861,False,absolute_error,37,sqrt,2,2,325,TPESampler,COMPLETE
4877,0.4311321543794946,2025-04-25 01:53:09.537332,2025-04-25 01:53:11.567859,0 days 00:00:02.030527,True,squared_error,33,log2,1,2,476,TPESampler,COMPLETE
4878,0.34835981424292695,2025-04-25 01:53:11.814947,2025-04-25 01:53:27.791303,0 days 00:00:15.976356,False,absolute_error,36,sqrt,1,5,431,TPESampler,COMPLETE
4879,0.3329460003265637,2025-04-25 01:53:13.773657,2025-04-25 01:53:43.319366,0 days 00:00:29.545709,False,absolute_error,42,sqrt,1,4,801,TPESampler,COMPLETE
4880,0.3332949539887846,2025-04-25 01:53:15.779476,2025-04-25 01:53:46.899807,0 days 00:00:31.120331,False,absolute_error,50,sqrt,1,3,818,TPESampler,COMPLETE
4881,0.3362941766327966,2025-04-25 01:53:22.865875,2025-04-25 01:53:39.185918,0 days 00:00:16.320043,False,absolute_error,50,sqrt,1,7,426,TPESampler,COMPLETE
4882,0.32800564790973014,2025-04-25 01:53:24.158947,2025-04-25 01:53:44.562575,0 days 00:00:20.403628,False,absolute_error,50,sqrt,1,4,539,TPESampler,COMPLETE
4883,0.33168842262058523,2025-04-25 01:53:28.043148,2025-04-25 01:53:53.850931,0 days 00:00:25.807783,False,absolute_error,43,sqrt,1,4,685,TPESampler,COMPLETE
4884,0.3580670067967203,2025-04-25 01:53:39.434300,2025-04-25 01:53:56.385098,0 days 00:00:16.950798,False,absolute_error,50,sqrt,1,13,431,TPESampler,COMPLETE
4885,0.7288792068068831,2025-04-25 01:53:43.573083,2025-04-25 01:53:45.224300,0 days 00:00:01.651217,False,squared_error,35,sqrt,11,7,965,TPESampler,COMPLETE
4886,0.3282502791864275,2025-04-25 01:53:44.826340,2025-04-25 01:53:56.167905,0 days 00:00:11.341565,False,absolute_error,44,sqrt,1,4,286,TPESampler,COMPLETE
4887,0.7981052111076463,2025-04-25 01:53:45.477141,2025-04-25 01:53:48.120161,0 days 00:00:02.643020,True,absolute_error,23,sqrt,11,46,775,TPESampler,COMPLETE
4888,0.6548683745164745,2025-04-25 01:53:47.162462,2025-04-25 01:53:48.968927,0 days 00:00:01.806465,True,squared_error,39,sqrt,5,2,820,TPESampler,COMPLETE
4889,0.7600127153305231,2025-04-25 01:53:48.370567,2025-04-25 01:53:49.899635,0 days 00:00:01.529068,False,squared_error,13,log2,4,5,767,TPESampler,COMPLETE
4890,0.4076458319381478,2025-04-25 01:53:49.319337,2025-04-25 01:53:52.797365,0 days 00:00:03.478028,False,absolute_error,43,sqrt,2,4,106,TPESampler,COMPLETE
4891,0.33405155300990813,2025-04-25 01:53:53.049775,2025-04-25 01:54:06.279731,0 days 00:00:13.229956,False,absolute_error,50,sqrt,1,7,295,TPESampler,COMPLETE
4892,0.3313938903389712,2025-04-25 01:53:56.430799,2025-04-25 01:54:20.728356,0 days 00:00:24.297557,False,absolute_error,50,sqrt,1,3,584,TPESampler,COMPLETE
4893,0.42913928501298443,2025-04-25 01:54:06.526249,2025-04-25 01:54:07.537592,0 days 00:00:01.011343,True,squared_error,26,sqrt,1,12,110,TPESampler,COMPLETE
4894,0.33145415660823196,2025-04-25 01:54:07.788942,2025-04-25 01:54:23.696230,0 days 00:00:15.907288,False,absolute_error,50,sqrt,1,3,406,TPESampler,COMPLETE
4895,0.4137762343481851,2025-04-25 01:54:20.979900,2025-04-25 01:54:28.828261,0 days 00:00:07.848361,False,absolute_error,50,sqrt,2,3,259,TPESampler,COMPLETE
4896,0.33419532899920157,2025-04-25 01:54:23.953391,2025-04-25 01:54:47.828907,0 days 00:00:23.875516,False,absolute_error,44,sqrt,1,5,625,TPESampler,COMPLETE
4897,0.3320981992826654,2025-04-25 01:54:29.096858,2025-04-25 01:54:58.758169,0 days 00:00:29.661311,False,absolute_error,50,sqrt,1,6,781,TPESampler,COMPLETE
4898,0.45644748437766397,2025-04-25 01:54:48.081642,2025-04-25 01:54:55.833977,0 days 00:00:07.752335,True,absolute_error,50,sqrt,2,6,457,TPESampler,COMPLETE
4899,0.8428203310259234,2025-04-25 01:54:49.128661,2025-04-25 01:54:50.285449,0 days 00:00:01.156788,False,squared_error,32,log2,8,2,488,TPESampler,COMPLETE
4900,0.7645443125649465,2025-04-25 01:54:50.524645,2025-04-25 01:54:51.757973,0 days 00:00:01.233328,False,squared_error,37,sqrt,14,3,501,TPESampler,COMPLETE
4901,0.3270851300815674,2025-04-25 01:54:52.014617,2025-04-25 01:55:23.020400,0 days 00:00:31.005783,False,absolute_error,50,sqrt,1,4,666,TPESampler,COMPLETE
4902,0.41766915094630114,2025-04-25 01:54:56.081890,2025-04-25 01:55:21.616425,0 days 00:00:25.534535,False,absolute_error,50,sqrt,2,4,825,TPESampler,COMPLETE
4903,0.4121571916135613,2025-04-25 01:54:59.019477,2025-04-25 01:55:02.252920,0 days 00:00:03.233443,False,absolute_error,50,sqrt,2,6,102,TPESampler,COMPLETE
4904,0.38086139194149904,2025-04-25 01:55:02.508111,2025-04-25 01:55:21.285375,0 days 00:00:18.777264,True,absolute_error,42,sqrt,1,9,650,TPESampler,COMPLETE
4905,0.3333529643842301,2025-04-25 01:55:21.543587,2025-04-25 01:55:25.208746,0 days 00:00:03.665159,False,squared_error,49,sqrt,1,4,724,TPESampler,COMPLETE
4906,0.3419044354183296,2025-04-25 01:55:21.957990,2025-04-25 01:55:39.836982,0 days 00:00:17.878992,False,absolute_error,43,sqrt,1,6,464,TPESampler,COMPLETE
4907,0.42035598732188295,2025-04-25 01:55:23.395910,2025-04-25 01:55:35.189588,0 days 00:00:11.793678,False,absolute_error,43,sqrt,2,5,461,TPESampler,COMPLETE
4908,0.417084803912263,2025-04-25 01:55:25.496877,2025-04-25 01:55:40.907350,0 days 00:00:15.410473,False,absolute_error,50,sqrt,2,2,615,TPESampler,COMPLETE
4909,0.347427336577891,2025-04-25 01:55:35.468807,2025-04-25 01:55:51.272366,0 days 00:00:15.803559,False,absolute_error,36,sqrt,1,3,422,TPESampler,COMPLETE
4910,0.7312837793531941,2025-04-25 01:55:40.115036,2025-04-25 01:55:43.808073,0 days 00:00:03.693037,True,absolute_error,11,log2,2,2,502,TPESampler,COMPLETE
4911,0.344647515745398,2025-04-25 01:55:41.332975,2025-04-25 01:56:05.017203,0 days 00:00:23.684228,False,absolute_error,50,sqrt,1,10,632,TPESampler,COMPLETE
4912,0.33946001333402115,2025-04-25 01:55:44.058441,2025-04-25 01:56:03.662393,0 days 00:00:19.603952,False,absolute_error,44,sqrt,1,6,461,TPESampler,COMPLETE
4913,0.46295806795491007,2025-04-25 01:55:51.528355,2025-04-25 01:56:15.361912,0 days 00:00:23.833557,True,absolute_error,13,,7,24,807,TPESampler,COMPLETE
4914,0.8403695096410462,2025-04-25 01:56:03.910733,2025-04-25 01:56:04.861585,0 days 00:00:00.950852,True,squared_error,19,log2,5,15,117,TPESampler,COMPLETE
4915,0.341559500368504,2025-04-25 01:56:05.082755,2025-04-25 01:56:30.745028,0 days 00:00:25.662273,False,absolute_error,43,sqrt,1,7,660,TPESampler,COMPLETE
4916,0.7100866006321132,2025-04-25 01:56:05.275965,2025-04-25 01:56:07.514694,0 days 00:00:02.238729,True,absolute_error,50,sqrt,6,7,266,TPESampler,COMPLETE
4917,0.42204759958433286,2025-04-25 01:56:07.767273,2025-04-25 01:56:09.859872,0 days 00:00:02.092599,False,squared_error,42,sqrt,2,6,811,TPESampler,COMPLETE
4918,0.416304212191877,2025-04-25 01:56:10.121942,2025-04-25 01:56:26.202185,0 days 00:00:16.080243,False,absolute_error,50,sqrt,2,4,508,TPESampler,COMPLETE
4919,0.42068767918883493,2025-04-25 01:56:15.625682,2025-04-25 01:56:33.815830,0 days 00:00:18.190148,False,absolute_error,50,sqrt,2,5,641,TPESampler,COMPLETE
4920,0.32778789302704614,2025-04-25 01:56:26.460740,2025-04-25 01:56:38.619357,0 days 00:00:12.158617,False,absolute_error,50,sqrt,1,4,303,TPESampler,COMPLETE
4921,0.3380503679727341,2025-04-25 01:56:30.993399,2025-04-25 01:56:46.402229,0 days 00:00:15.408830,False,absolute_error,42,sqrt,1,3,399,TPESampler,COMPLETE
4922,0.407931293583416,2025-04-25 01:56:34.069929,2025-04-25 01:56:35.063981,0 days 00:00:00.994052,True,squared_error,46,sqrt,1,30,109,TPESampler,COMPLETE
4923,0.35000718884416004,2025-04-25 01:56:35.311798,2025-04-25 01:56:50.817849,0 days 00:00:15.506051,True,absolute_error,50,sqrt,1,2,639,TPESampler,COMPLETE
4924,0.4191250469480422,2025-04-25 01:56:39.087313,2025-04-25 01:56:48.097460,0 days 00:00:09.010147,False,absolute_error,50,sqrt,2,6,330,TPESampler,COMPLETE
4925,0.3333987237416323,2025-04-25 01:56:46.652264,2025-04-25 01:57:13.420729,0 days 00:00:26.768465,False,absolute_error,42,sqrt,1,4,716,TPESampler,COMPLETE
4926,0.35392983834495173,2025-04-25 01:56:48.345256,2025-04-25 01:56:58.547911,0 days 00:00:10.202655,True,absolute_error,43,sqrt,1,3,434,TPESampler,COMPLETE
4927,0.33157196918979803,2025-04-25 01:56:51.067938,2025-04-25 01:57:11.824536,0 days 00:00:20.756598,False,absolute_error,50,sqrt,1,6,548,TPESampler,COMPLETE
4928,0.33661980227722077,2025-04-25 01:56:58.794108,2025-04-25 01:57:19.175392,0 days 00:00:20.381284,False,absolute_error,44,sqrt,1,3,531,TPESampler,COMPLETE
4929,0.32674080855348214,2025-04-25 01:57:12.084882,2025-04-25 01:57:40.804808,0 days 00:00:28.719926,False,absolute_error,50,sqrt,1,4,710,TPESampler,COMPLETE
4930,0.3273853505641813,2025-04-25 01:57:13.672278,2025-04-25 01:57:31.834176,0 days 00:00:18.161898,False,absolute_error,50,sqrt,1,4,472,TPESampler,COMPLETE
4931,0.4288427069883771,2025-04-25 01:57:19.431058,2025-04-25 01:57:35.508176,0 days 00:00:16.077118,False,absolute_error,35,sqrt,2,7,617,TPESampler,COMPLETE
4932,0.33218751921904566,2025-04-25 01:57:32.081667,2025-04-25 01:57:52.599509,0 days 00:00:20.517842,False,absolute_error,43,sqrt,1,4,542,TPESampler,COMPLETE
4933,0.4262651217278908,2025-04-25 01:57:35.759919,2025-04-25 01:57:51.427876,0 days 00:00:15.667957,False,absolute_error,49,sqrt,2,11,632,TPESampler,COMPLETE
4934,0.3922007278685298,2025-04-25 01:57:41.052856,2025-04-25 01:57:55.052258,0 days 00:00:13.999402,False,absolute_error,42,log2,1,5,511,TPESampler,COMPLETE
4935,0.33195262532324427,2025-04-25 01:57:51.748526,2025-04-25 01:58:17.475196,0 days 00:00:25.726670,False,absolute_error,50,sqrt,1,6,659,TPESampler,COMPLETE
4936,0.6188029054898656,2025-04-25 01:57:53.083251,2025-04-25 01:57:59.444971,0 days 00:00:06.361720,False,absolute_error,43,log2,2,4,471,TPESampler,COMPLETE
4937,0.3686127909687315,2025-04-25 01:57:55.348558,2025-04-25 01:58:10.110493,0 days 00:00:14.761935,True,absolute_error,44,,2,6,181,TPESampler,COMPLETE
4938,0.5944757274359196,2025-04-25 01:57:59.690030,2025-04-25 01:58:01.277501,0 days 00:00:01.587471,False,squared_error,46,sqrt,6,9,694,TPESampler,COMPLETE
4939,0.4108867706969683,2025-04-25 01:58:01.531010,2025-04-25 01:58:06.826188,0 days 00:00:05.295178,False,absolute_error,50,sqrt,2,2,187,TPESampler,COMPLETE
