number,value,datetime_start,datetime_complete,duration,params_bootstrap,params_criterion,params_max_depth,params_max_features,params_min_samples_leaf,params_min_samples_split,params_n_estimators,system_attrs_auto:sampler,state
1658,0.3710196332797561,2025-04-24 23:00:00.734803,2025-04-24 23:00:17.407760,0 days 00:00:16.672957,False,absolute_error,50,log2,1,5,587,TPESampler,COMPLETE
1659,0.43012255782551434,2025-04-24 23:00:01.876603,2025-04-24 23:00:03.457169,0 days 00:00:01.580566,True,squared_error,47,log2,1,14,452,TPESampler,COMPLETE
1660,0.4474415255242675,2025-04-24 23:00:02.899405,2025-04-24 23:01:39.520148,0 days 00:01:36.620743,False,absolute_error,48,,1,5,423,TPESampler,COMPLETE
1661,0.4951002297266653,2025-04-24 23:00:02.899710,2025-04-24 23:00:05.842802,0 days 00:00:02.943092,False,squared_error,15,,11,5,444,TPESampler,COMPLETE
1662,0.3321328517919609,2025-04-24 23:00:03.859677,2025-04-24 23:00:23.870120,0 days 00:00:20.010443,False,absolute_error,43,sqrt,1,4,527,TPESampler,COMPLETE
1663,0.4713187664998273,2025-04-24 23:00:06.026452,2025-04-24 23:00:07.917074,0 days 00:00:01.890622,False,squared_error,48,,8,3,200,TPESampler,COMPLETE
1664,0.42098546143807697,2025-04-24 23:00:08.105064,2025-04-24 23:00:25.924676,0 days 00:00:17.819612,False,absolute_error,50,sqrt,2,5,653,TPESampler,COMPLETE
1665,0.3363360815485961,2025-04-24 23:00:09.295426,2025-04-24 23:00:12.093177,0 days 00:00:02.797751,False,squared_error,50,sqrt,1,3,691,TPESampler,COMPLETE
1666,0.33271613385067383,2025-04-24 23:00:12.293599,2025-04-24 23:00:38.102799,0 days 00:00:25.809200,False,absolute_error,50,sqrt,1,3,680,TPESampler,COMPLETE
1667,0.33339245550636737,2025-04-24 23:00:17.623881,2025-04-24 23:00:19.669066,0 days 00:00:02.045185,False,squared_error,50,sqrt,1,5,407,TPESampler,COMPLETE
1668,0.44968499235786147,2025-04-24 23:00:17.623831,2025-04-24 23:00:21.906142,0 days 00:00:04.282311,True,squared_error,24,,4,41,972,TPESampler,COMPLETE
1669,0.3316700144095527,2025-04-24 23:00:19.976369,2025-04-24 23:00:43.449235,0 days 00:00:23.472866,False,absolute_error,50,sqrt,1,3,616,TPESampler,COMPLETE
1670,0.3538904206905002,2025-04-24 23:00:22.135781,2025-04-24 23:00:47.158737,0 days 00:00:25.022956,False,absolute_error,32,sqrt,1,4,601,TPESampler,COMPLETE
1671,0.33618718871359643,2025-04-24 23:00:24.060794,2025-04-24 23:00:44.704025,0 days 00:00:20.643231,False,absolute_error,50,sqrt,1,7,440,TPESampler,COMPLETE
1672,0.8052884046257189,2025-04-24 23:00:26.119598,2025-04-24 23:00:28.834459,0 days 00:00:02.714861,False,absolute_error,14,log2,5,2,649,TPESampler,COMPLETE
1673,0.4180803356410338,2025-04-24 23:00:29.018398,2025-04-24 23:00:50.840753,0 days 00:00:21.822355,False,absolute_error,50,sqrt,2,3,774,TPESampler,COMPLETE
1674,0.36997120346276635,2025-04-24 23:00:38.294646,2025-04-24 23:01:07.475625,0 days 00:00:29.180979,False,absolute_error,40,sqrt,1,14,750,TPESampler,COMPLETE
1675,0.3255610906475063,2025-04-24 23:00:43.822448,2025-04-24 23:01:12.558440,0 days 00:00:28.735992,False,absolute_error,50,sqrt,1,5,687,TPESampler,COMPLETE
1676,0.3386998767681929,2025-04-24 23:00:44.891439,2025-04-24 23:01:02.786863,0 days 00:00:17.895424,False,absolute_error,43,sqrt,1,3,470,TPESampler,COMPLETE
1677,0.457100138970495,2025-04-24 23:00:47.344532,2025-04-24 23:00:54.394348,0 days 00:00:07.049816,True,absolute_error,50,sqrt,2,6,484,TPESampler,COMPLETE
1678,0.5090475292124531,2025-04-24 23:00:51.029295,2025-04-24 23:01:12.129971,0 days 00:00:21.100676,False,absolute_error,6,,1,39,145,TPESampler,COMPLETE
1679,0.3357460049006053,2025-04-24 23:00:54.578121,2025-04-24 23:01:21.375525,0 days 00:00:26.797404,False,absolute_error,50,sqrt,1,7,663,TPESampler,COMPLETE
1680,0.35247109916162306,2025-04-24 23:01:02.990100,2025-04-24 23:01:30.010541,0 days 00:00:27.020441,False,absolute_error,42,sqrt,1,8,679,TPESampler,COMPLETE
1681,0.3317555262724169,2025-04-24 23:01:07.675449,2025-04-24 23:01:25.269320,0 days 00:00:17.593871,False,absolute_error,50,sqrt,1,3,456,TPESampler,COMPLETE
1682,0.35288109536496376,2025-04-24 23:01:12.321721,2025-04-24 23:01:36.882531,0 days 00:00:24.560810,False,absolute_error,44,sqrt,1,9,533,TPESampler,COMPLETE
1683,0.4210989232476322,2025-04-24 23:01:12.782497,2025-04-24 23:01:25.292165,0 days 00:00:12.509668,False,absolute_error,43,sqrt,2,5,508,TPESampler,COMPLETE
1684,0.4205353696746807,2025-04-24 23:01:21.575147,2025-04-24 23:01:41.117453,0 days 00:00:19.542306,False,absolute_error,41,sqrt,2,4,730,TPESampler,COMPLETE
1685,0.32512389022483973,2025-04-24 23:01:25.417126,2025-04-24 23:01:57.548812,0 days 00:00:32.131686,False,absolute_error,50,sqrt,1,5,816,TPESampler,COMPLETE
1686,0.5793315290735661,2025-04-24 23:01:25.468574,2025-04-24 23:01:26.885014,0 days 00:00:01.416440,False,squared_error,9,sqrt,1,2,312,TPESampler,COMPLETE
1687,0.42358870888886574,2025-04-24 23:01:27.078014,2025-04-24 23:01:50.140503,0 days 00:00:23.062489,False,absolute_error,38,sqrt,2,5,967,TPESampler,COMPLETE
1688,0.33191558250754694,2025-04-24 23:01:30.232156,2025-04-24 23:01:54.668857,0 days 00:00:24.436701,False,absolute_error,43,sqrt,1,4,667,TPESampler,COMPLETE
1689,0.3255826738778543,2025-04-24 23:01:37.064582,2025-04-24 23:01:54.453346,0 days 00:00:17.388764,False,absolute_error,50,sqrt,1,5,460,TPESampler,COMPLETE
1690,0.3320961377495337,2025-04-24 23:01:39.709820,2025-04-24 23:02:02.112107,0 days 00:00:22.402287,False,absolute_error,50,sqrt,1,3,551,TPESampler,COMPLETE
1691,0.32771531788985264,2025-04-24 23:01:41.303220,2025-04-24 23:02:01.285708,0 days 00:00:19.982488,False,absolute_error,50,sqrt,1,4,528,TPESampler,COMPLETE
1692,0.3734870158060894,2025-04-24 23:01:50.329344,2025-04-24 23:01:52.005865,0 days 00:00:01.676521,True,squared_error,23,,2,2,210,TPESampler,COMPLETE
1693,0.32682708821206935,2025-04-24 23:01:52.193214,2025-04-24 23:02:25.724286,0 days 00:00:33.531072,False,absolute_error,50,sqrt,1,4,865,TPESampler,COMPLETE
1694,0.8661388123977448,2025-04-24 23:01:54.628534,2025-04-24 23:01:56.452767,0 days 00:00:01.824233,True,absolute_error,12,log2,9,18,644,TPESampler,COMPLETE
1695,0.33195262532324427,2025-04-24 23:01:54.924588,2025-04-24 23:02:19.740821,0 days 00:00:24.816233,False,absolute_error,50,sqrt,1,6,659,TPESampler,COMPLETE
1696,0.4201643183924226,2025-04-24 23:01:56.641391,2025-04-24 23:02:10.425734,0 days 00:00:13.784343,False,absolute_error,50,sqrt,2,5,563,TPESampler,COMPLETE
1697,0.581574944212457,2025-04-24 23:01:57.744825,2025-04-24 23:02:03.103141,0 days 00:00:05.358316,True,absolute_error,10,sqrt,1,5,421,TPESampler,COMPLETE
1698,0.3970567041612824,2025-04-24 23:02:01.465255,2025-04-24 23:02:19.354385,0 days 00:00:17.889130,True,absolute_error,14,,2,6,237,TPESampler,COMPLETE
1699,0.7399887749116997,2025-04-24 23:02:02.305438,2025-04-24 23:02:03.219563,0 days 00:00:00.914125,False,squared_error,10,log2,3,41,431,TPESampler,COMPLETE
1700,0.3292454801280986,2025-04-24 23:02:03.285780,2025-04-24 23:02:39.857034,0 days 00:00:36.571254,False,absolute_error,47,sqrt,1,5,1000,TPESampler,COMPLETE
1701,0.3285913779629303,2025-04-24 23:02:03.438911,2025-04-24 23:02:43.371117,0 days 00:00:39.932206,False,absolute_error,49,sqrt,1,5,995,TPESampler,COMPLETE
1702,0.33580063287803186,2025-04-24 23:02:10.626522,2025-04-24 23:02:45.351666,0 days 00:00:34.725144,False,absolute_error,48,sqrt,1,3,892,TPESampler,COMPLETE
1703,0.34871187701531997,2025-04-24 23:02:19.540060,2025-04-24 23:02:50.298127,0 days 00:00:30.758067,False,absolute_error,37,sqrt,1,6,784,TPESampler,COMPLETE
1704,0.33223688195519374,2025-04-24 23:02:19.962260,2025-04-24 23:02:52.957831,0 days 00:00:32.995571,False,absolute_error,50,sqrt,1,6,799,TPESampler,COMPLETE
1705,0.34705626231539083,2025-04-24 23:02:25.913370,2025-04-24 23:03:02.921853,0 days 00:00:37.008483,False,absolute_error,45,sqrt,1,8,809,TPESampler,COMPLETE
1706,0.3308711600712085,2025-04-24 23:02:40.051219,2025-04-24 23:03:09.542202,0 days 00:00:29.490983,False,absolute_error,45,sqrt,1,4,799,TPESampler,COMPLETE
1707,0.34353293576628813,2025-04-24 23:02:43.581843,2025-04-24 23:03:21.033036,0 days 00:00:37.451193,False,absolute_error,48,sqrt,1,8,889,TPESampler,COMPLETE
1708,0.34220852353870895,2025-04-24 23:02:45.627609,2025-04-24 23:03:17.920137,0 days 00:00:32.292528,False,absolute_error,50,sqrt,1,8,873,TPESampler,COMPLETE
1709,0.32983388044227524,2025-04-24 23:02:50.639627,2025-04-24 23:03:19.044558,0 days 00:00:28.404931,False,absolute_error,48,sqrt,1,5,769,TPESampler,COMPLETE
1710,0.3944172178932282,2025-04-24 23:02:53.138308,2025-04-24 23:02:59.974611,0 days 00:00:06.836303,False,squared_error,44,,1,8,754,TPESampler,COMPLETE
1711,0.421121028902885,2025-04-24 23:03:00.158207,2025-04-24 23:03:20.263648,0 days 00:00:20.105441,False,absolute_error,47,sqrt,2,6,829,TPESampler,COMPLETE
1712,0.3361121726874956,2025-04-24 23:03:03.108742,2025-04-24 23:03:33.340027,0 days 00:00:30.231285,False,absolute_error,50,sqrt,1,7,828,TPESampler,COMPLETE
1713,0.36848749554649585,2025-04-24 23:03:09.739847,2025-04-24 23:03:46.622794,0 days 00:00:36.882947,True,absolute_error,33,,2,7,415,TPESampler,COMPLETE
1714,0.8424439251454043,2025-04-24 23:03:18.118031,2025-04-24 23:03:18.982651,0 days 00:00:00.864620,True,squared_error,7,log2,5,8,267,TPESampler,COMPLETE
1715,0.3421481855834472,2025-04-24 23:03:19.122563,2025-04-24 23:03:54.169827,0 days 00:00:35.047264,False,absolute_error,39,sqrt,1,3,867,TPESampler,COMPLETE
1716,0.41794094964203843,2025-04-24 23:03:19.233418,2025-04-24 23:03:41.881623,0 days 00:00:22.648205,False,absolute_error,49,sqrt,2,4,902,TPESampler,COMPLETE
1717,0.34376168081512043,2025-04-24 23:03:20.871175,2025-04-24 23:03:49.110951,0 days 00:00:28.239776,False,absolute_error,41,sqrt,1,6,703,TPESampler,COMPLETE
1718,0.33129703329119087,2025-04-24 23:03:21.230072,2025-04-24 23:03:55.778269,0 days 00:00:34.548197,False,absolute_error,45,sqrt,1,4,839,TPESampler,COMPLETE
1719,0.42104636505027543,2025-04-24 23:03:33.520273,2025-04-24 23:03:56.278849,0 days 00:00:22.758576,False,absolute_error,50,sqrt,2,5,741,TPESampler,COMPLETE
1720,0.40074390291096756,2025-04-24 23:03:42.071609,2025-04-24 23:03:49.597329,0 days 00:00:07.525720,False,squared_error,33,,2,3,903,TPESampler,COMPLETE
1721,0.4468488771783776,2025-04-24 23:03:46.817985,2025-04-24 23:06:02.207499,0 days 00:02:15.389514,False,absolute_error,41,,1,4,577,TPESampler,COMPLETE
1722,0.3339214349720221,2025-04-24 23:03:49.296590,2025-04-24 23:04:20.834470,0 days 00:00:31.537880,False,absolute_error,43,sqrt,1,5,865,TPESampler,COMPLETE
1723,0.32534574049145504,2025-04-24 23:03:49.855190,2025-04-24 23:04:19.252479,0 days 00:00:29.397289,False,absolute_error,49,sqrt,1,4,782,TPESampler,COMPLETE
1724,0.42392226620033513,2025-04-24 23:03:54.355057,2025-04-24 23:04:11.806877,0 days 00:00:17.451820,False,absolute_error,50,sqrt,2,7,723,TPESampler,COMPLETE
1725,0.4644108350860442,2025-04-24 23:03:55.971327,2025-04-24 23:07:06.346440,0 days 00:03:10.375113,False,absolute_error,39,,1,29,882,TPESampler,COMPLETE
1726,0.33627964608064764,2025-04-24 23:03:56.477571,2025-04-24 23:04:23.511412,0 days 00:00:27.033841,False,absolute_error,50,sqrt,1,7,736,TPESampler,COMPLETE
1727,0.3469677484103644,2025-04-24 23:04:12.002776,2025-04-24 23:04:34.842032,0 days 00:00:22.839256,False,absolute_error,42,sqrt,1,2,599,TPESampler,COMPLETE
1728,0.8529682361142349,2025-04-24 23:04:19.469023,2025-04-24 23:04:20.447050,0 days 00:00:00.978027,True,absolute_error,18,log2,6,24,236,TPESampler,COMPLETE
1729,0.4132058136927723,2025-04-24 23:04:20.625534,2025-04-24 23:06:04.536989,0 days 00:01:43.911455,False,absolute_error,48,,2,4,758,TPESampler,COMPLETE
1730,0.3318007183321848,2025-04-24 23:04:21.055578,2025-04-24 23:04:47.426191,0 days 00:00:26.370613,False,absolute_error,43,sqrt,1,4,718,TPESampler,COMPLETE
1731,0.34415697840314435,2025-04-24 23:04:23.699533,2025-04-24 23:04:58.594394,0 days 00:00:34.894861,False,absolute_error,50,sqrt,1,2,902,TPESampler,COMPLETE
1732,0.3332964479672854,2025-04-24 23:04:35.023160,2025-04-24 23:05:05.980734,0 days 00:00:30.957574,False,absolute_error,50,sqrt,1,3,822,TPESampler,COMPLETE
1733,0.42910439441072473,2025-04-24 23:04:47.612149,2025-04-24 23:04:55.222471,0 days 00:00:07.610322,False,absolute_error,50,log2,1,19,270,TPESampler,COMPLETE
1734,0.3396548559731184,2025-04-24 23:04:55.404468,2025-04-24 23:05:18.383508,0 days 00:00:22.979040,False,absolute_error,41,sqrt,1,3,623,TPESampler,COMPLETE
1735,0.3332292396283229,2025-04-24 23:04:58.788005,2025-04-24 23:05:29.031165,0 days 00:00:30.243160,False,absolute_error,50,sqrt,1,3,804,TPESampler,COMPLETE
1736,0.7010601137320768,2025-04-24 23:05:06.170960,2025-04-24 23:05:07.667537,0 days 00:00:01.496577,True,squared_error,7,sqrt,5,41,812,TPESampler,COMPLETE
1737,0.41677622230304345,2025-04-24 23:05:07.857151,2025-04-24 23:05:19.007521,0 days 00:00:11.150370,False,absolute_error,43,sqrt,2,2,443,TPESampler,COMPLETE
1738,0.8545619402386313,2025-04-24 23:05:18.569390,2025-04-24 23:05:19.785755,0 days 00:00:01.216365,True,squared_error,50,log2,7,9,292,TPESampler,COMPLETE
1739,0.3332953144211722,2025-04-24 23:05:19.289063,2025-04-24 23:05:45.454783,0 days 00:00:26.165720,False,absolute_error,42,sqrt,1,4,708,TPESampler,COMPLETE
1740,0.41986829406718834,2025-04-24 23:05:20.374550,2025-04-24 23:05:41.002146,0 days 00:00:20.627596,False,absolute_error,42,sqrt,2,4,855,TPESampler,COMPLETE
1741,0.33320272871329765,2025-04-24 23:05:29.326637,2025-04-24 23:06:02.911651,0 days 00:00:33.585014,False,absolute_error,50,sqrt,1,3,808,TPESampler,COMPLETE
1742,0.4176109762650586,2025-04-24 23:05:41.187438,2025-04-24 23:05:55.385360,0 days 00:00:14.197922,False,absolute_error,44,sqrt,2,3,580,TPESampler,COMPLETE
1743,0.3319607677641618,2025-04-24 23:05:45.644140,2025-04-24 23:06:17.239781,0 days 00:00:31.595641,False,absolute_error,50,sqrt,1,6,757,TPESampler,COMPLETE
1744,0.3315027727688001,2025-04-24 23:05:55.578843,2025-04-24 23:06:23.393419,0 days 00:00:27.814576,False,absolute_error,44,sqrt,1,4,650,TPESampler,COMPLETE
1745,0.34448393067086697,2025-04-24 23:06:02.410351,2025-04-24 23:06:05.281939,0 days 00:00:02.871588,False,squared_error,39,sqrt,1,5,824,TPESampler,COMPLETE
1746,0.4162544600535593,2025-04-24 23:06:03.311731,2025-04-24 23:06:17.150170,0 days 00:00:13.838439,False,absolute_error,50,sqrt,2,3,562,TPESampler,COMPLETE
1747,0.41715993026333476,2025-04-24 23:06:04.727901,2025-04-24 23:06:30.348080,0 days 00:00:25.620179,False,absolute_error,49,sqrt,2,4,814,TPESampler,COMPLETE
1748,0.3474774719335967,2025-04-24 23:06:05.483210,2025-04-24 23:06:17.727099,0 days 00:00:12.243889,False,absolute_error,40,sqrt,1,2,315,TPESampler,COMPLETE
1749,0.32657611894079464,2025-04-24 23:06:17.396694,2025-04-24 23:06:48.691558,0 days 00:00:31.294864,False,absolute_error,50,sqrt,1,4,712,TPESampler,COMPLETE
1750,0.35460044001664204,2025-04-24 23:06:17.573918,2025-04-24 23:06:29.242533,0 days 00:00:11.668615,True,absolute_error,48,sqrt,1,4,531,TPESampler,COMPLETE
1751,0.3447771980435018,2025-04-24 23:06:17.946306,2025-04-24 23:06:49.200118,0 days 00:00:31.253812,False,absolute_error,50,sqrt,1,2,682,TPESampler,COMPLETE
1752,0.46776075057264827,2025-04-24 23:06:23.577880,2025-04-24 23:08:43.205873,0 days 00:02:19.627993,False,absolute_error,50,,1,2,605,TPESampler,COMPLETE
1753,0.42850030730092126,2025-04-24 23:06:29.433330,2025-04-24 23:06:46.079733,0 days 00:00:16.646403,False,absolute_error,44,sqrt,2,10,685,TPESampler,COMPLETE
1754,0.44173006289009775,2025-04-24 23:06:30.529976,2025-04-24 23:09:37.376945,0 days 00:03:06.846969,False,absolute_error,50,,1,7,822,TPESampler,COMPLETE
1755,0.7077489845576967,2025-04-24 23:06:46.275277,2025-04-24 23:06:50.712013,0 days 00:00:04.436736,True,absolute_error,5,sqrt,3,2,876,TPESampler,COMPLETE
1756,0.33193841678618274,2025-04-24 23:06:48.891154,2025-04-24 23:07:08.412398,0 days 00:00:19.521244,False,absolute_error,50,sqrt,1,3,506,TPESampler,COMPLETE
1757,0.42708521378035424,2025-04-24 23:06:49.378591,2025-04-24 23:07:08.002525,0 days 00:00:18.623934,False,absolute_error,49,sqrt,2,11,771,TPESampler,COMPLETE
1758,0.3324874708210294,2025-04-24 23:06:50.905650,2025-04-24 23:07:20.981020,0 days 00:00:30.075370,False,absolute_error,50,sqrt,1,6,823,TPESampler,COMPLETE
1759,0.33283619563370914,2025-04-24 23:07:06.539006,2025-04-24 23:07:30.630907,0 days 00:00:24.091901,False,absolute_error,43,sqrt,1,5,659,TPESampler,COMPLETE
1760,0.3433351601156681,2025-04-24 23:07:08.194067,2025-04-24 23:07:10.962085,0 days 00:00:02.768018,False,squared_error,39,sqrt,1,3,661,TPESampler,COMPLETE
1761,0.34111837474085455,2025-04-24 23:07:08.654870,2025-04-24 23:07:27.803025,0 days 00:00:19.148155,False,absolute_error,43,sqrt,1,6,521,TPESampler,COMPLETE
1762,0.4129962167733837,2025-04-24 23:07:11.157232,2025-04-24 23:08:27.578249,0 days 00:01:16.421017,False,absolute_error,37,,2,2,554,TPESampler,COMPLETE
1763,0.33720074378865533,2025-04-24 23:07:21.163318,2025-04-24 23:07:23.670888,0 days 00:00:02.507570,False,squared_error,50,sqrt,1,6,802,TPESampler,COMPLETE
1764,0.5411381581506776,2025-04-24 23:07:23.860553,2025-04-24 23:07:25.233354,0 days 00:00:01.372801,True,squared_error,15,,13,9,260,TPESampler,COMPLETE
1765,0.4094914709329099,2025-04-24 23:07:25.416459,2025-04-24 23:09:42.181943,0 days 00:02:16.765484,False,absolute_error,42,,2,5,927,TPESampler,COMPLETE
1766,0.3255687653158147,2025-04-24 23:07:28.002135,2025-04-24 23:07:53.938404,0 days 00:00:25.936269,False,absolute_error,50,sqrt,1,5,700,TPESampler,COMPLETE
1767,0.3745788283426006,2025-04-24 23:07:30.827639,2025-04-24 23:07:44.524454,0 days 00:00:13.696815,True,absolute_error,45,sqrt,1,8,670,TPESampler,COMPLETE
1768,0.3967817698789,2025-04-24 23:07:44.751310,2025-04-24 23:08:05.422942,0 days 00:00:20.671632,False,absolute_error,39,sqrt,1,34,572,TPESampler,COMPLETE
1769,0.4710124453861929,2025-04-24 23:07:54.121060,2025-04-24 23:07:57.630656,0 days 00:00:03.509596,False,squared_error,26,,8,17,577,TPESampler,COMPLETE
1770,0.42162861224122766,2025-04-24 23:07:57.829408,2025-04-24 23:08:13.987063,0 days 00:00:16.157655,False,absolute_error,44,sqrt,2,5,630,TPESampler,COMPLETE
1771,0.3310258402567129,2025-04-24 23:08:05.613842,2025-04-24 23:08:27.086847,0 days 00:00:21.473005,False,absolute_error,50,sqrt,1,6,570,TPESampler,COMPLETE
1772,0.3853288458850054,2025-04-24 23:08:14.177766,2025-04-24 23:08:38.786551,0 days 00:00:24.608785,False,absolute_error,43,log2,1,2,830,TPESampler,COMPLETE
1773,0.33589244374225463,2025-04-24 23:08:27.277129,2025-04-24 23:08:46.098644,0 days 00:00:18.821515,False,absolute_error,41,sqrt,1,5,518,TPESampler,COMPLETE
1774,0.33098441598136985,2025-04-24 23:08:27.793673,2025-04-24 23:08:53.003264,0 days 00:00:25.209591,False,absolute_error,50,sqrt,1,6,586,TPESampler,COMPLETE
1775,0.3333148171206133,2025-04-24 23:08:38.983642,2025-04-24 23:09:10.565133,0 days 00:00:31.581491,False,absolute_error,43,sqrt,1,5,807,TPESampler,COMPLETE
1776,0.3984037589346094,2025-04-24 23:08:43.389780,2025-04-24 23:09:13.597508,0 days 00:00:30.207728,False,absolute_error,47,log2,1,8,756,TPESampler,COMPLETE
1777,0.3628866421250864,2025-04-24 23:08:46.287125,2025-04-24 23:09:02.089302,0 days 00:00:15.802177,True,absolute_error,49,sqrt,1,6,756,TPESampler,COMPLETE
1778,0.42007890007903337,2025-04-24 23:08:53.187639,2025-04-24 23:09:05.840711,0 days 00:00:12.653072,False,absolute_error,50,sqrt,2,6,509,TPESampler,COMPLETE
1779,0.33220689384388685,2025-04-24 23:09:02.279361,2025-04-24 23:09:15.782288,0 days 00:00:13.502927,False,absolute_error,43,sqrt,1,4,358,TPESampler,COMPLETE
1780,0.3314992895475035,2025-04-24 23:09:06.041748,2025-04-24 23:09:28.715274,0 days 00:00:22.673526,False,absolute_error,43,sqrt,1,4,617,TPESampler,COMPLETE
1781,0.4236090506959746,2025-04-24 23:09:10.760929,2025-04-24 23:09:33.065063,0 days 00:00:22.304134,False,absolute_error,50,sqrt,2,7,921,TPESampler,COMPLETE
1782,0.8094423267664096,2025-04-24 23:09:13.778471,2025-04-24 23:09:15.080813,0 days 00:00:01.302342,False,absolute_error,33,log2,5,2,216,TPESampler,COMPLETE
1783,0.41621065547809993,2025-04-24 23:09:15.276905,2025-04-24 23:09:28.783178,0 days 00:00:13.506273,False,absolute_error,50,sqrt,2,3,550,TPESampler,COMPLETE
1784,0.3327447679732053,2025-04-24 23:09:15.997453,2025-04-24 23:09:43.319492,0 days 00:00:27.322039,False,absolute_error,50,sqrt,1,3,721,TPESampler,COMPLETE
1785,0.3257355644407359,2025-04-24 23:09:28.918002,2025-04-24 23:09:53.878641,0 days 00:00:24.960639,False,absolute_error,50,sqrt,1,5,666,TPESampler,COMPLETE
1786,0.3436449291974595,2025-04-24 23:09:29.009638,2025-04-24 23:09:58.702304,0 days 00:00:29.692666,False,absolute_error,41,sqrt,1,6,829,TPESampler,COMPLETE
1787,0.5025212614140281,2025-04-24 23:09:33.249667,2025-04-24 23:09:46.119983,0 days 00:00:12.870316,False,absolute_error,47,,12,15,361,TPESampler,COMPLETE
1788,0.336730996019477,2025-04-24 23:09:37.565617,2025-04-24 23:09:59.184331,0 days 00:00:21.618714,False,absolute_error,44,sqrt,1,3,578,TPESampler,COMPLETE
1789,0.3366226384428279,2025-04-24 23:09:42.367302,2025-04-24 23:10:00.936647,0 days 00:00:18.569345,False,absolute_error,44,sqrt,1,3,491,TPESampler,COMPLETE
1790,0.3454406993368114,2025-04-24 23:09:43.537001,2025-04-24 23:10:02.809287,0 days 00:00:19.272286,False,absolute_error,50,sqrt,1,10,519,TPESampler,COMPLETE
1791,0.34727712735255917,2025-04-24 23:09:46.306020,2025-04-24 23:10:08.674532,0 days 00:00:22.368512,False,absolute_error,44,sqrt,1,8,612,TPESampler,COMPLETE
1792,0.8552721893560673,2025-04-24 23:09:54.092687,2025-04-24 23:09:55.932759,0 days 00:00:01.840072,False,absolute_error,15,log2,9,12,673,TPESampler,COMPLETE
1793,0.6181749572513701,2025-04-24 23:09:56.131190,2025-04-24 23:09:57.133975,0 days 00:00:01.002785,False,squared_error,46,log2,2,6,396,TPESampler,COMPLETE
1794,0.473024499824116,2025-04-24 23:09:57.332336,2025-04-24 23:10:45.761780,0 days 00:00:48.429444,False,absolute_error,49,,8,8,999,TPESampler,COMPLETE
1795,0.4419432165217501,2025-04-24 23:09:58.884781,2025-04-24 23:12:04.656754,0 days 00:02:05.771973,False,absolute_error,48,,1,8,555,TPESampler,COMPLETE
