number,value,datetime_start,datetime_complete,duration,params_bootstrap,params_criterion,params_max_depth,params_max_features,params_min_samples_leaf,params_min_samples_split,params_n_estimators,system_attrs_auto:sampler,state
277,0.42424861564588223,2025-04-24 21:33:27.420080,2025-04-24 21:33:57.380245,0 days 00:00:29.960165,False,absolute_error,50,sqrt,2,7,857,TPESampler,COMPLETE
278,0.3352943894417574,2025-04-24 21:33:52.689244,2025-04-24 21:34:16.422563,0 days 00:00:23.733319,False,absolute_error,50,sqrt,1,7,638,TPESampler,COMPLETE
279,0.7624204807215412,2025-04-24 21:33:54.706601,2025-04-24 21:33:55.470910,0 days 00:00:00.764309,True,squared_error,23,sqrt,8,9,208,TPESampler,COMPLETE
280,0.4363127341064588,2025-04-24 21:33:55.641939,2025-04-24 21:33:57.096741,0 days 00:00:01.454802,True,squared_error,37,,4,31,254,TPESampler,COMPLETE
281,0.33215520301966156,2025-04-24 21:33:57.259632,2025-04-24 21:34:27.942234,0 days 00:00:30.682602,False,absolute_error,43,sqrt,1,4,840,TPESampler,COMPLETE
282,0.4179730316429713,2025-04-24 21:33:57.560543,2025-04-24 21:34:15.606123,0 days 00:00:18.045580,False,absolute_error,50,sqrt,2,4,744,TPESampler,COMPLETE
283,0.32804116096287705,2025-04-24 21:34:00.576411,2025-04-24 21:34:29.725877,0 days 00:00:29.149466,False,absolute_error,49,sqrt,1,5,789,TPESampler,COMPLETE
284,0.4199653170681573,2025-04-24 21:34:15.778493,2025-04-24 21:34:39.163695,0 days 00:00:23.385202,False,absolute_error,42,sqrt,2,3,973,TPESampler,COMPLETE
285,0.32607597378055253,2025-04-24 21:34:16.588490,2025-04-24 21:34:51.937210,0 days 00:00:35.348720,False,absolute_error,50,sqrt,1,5,958,TPESampler,COMPLETE
286,0.3255713829944546,2025-04-24 21:34:28.110048,2025-04-24 21:35:00.965260,0 days 00:00:32.855212,False,absolute_error,50,sqrt,1,5,878,TPESampler,COMPLETE
287,0.32646511033850484,2025-04-24 21:34:29.898456,2025-04-24 21:34:53.289310,0 days 00:00:23.390854,False,absolute_error,50,sqrt,1,4,625,TPESampler,COMPLETE
288,0.3264893930515355,2025-04-24 21:34:39.326443,2025-04-24 21:35:09.790333,0 days 00:00:30.463890,False,absolute_error,50,sqrt,1,4,748,TPESampler,COMPLETE
289,0.34218470402069634,2025-04-24 21:34:52.102644,2025-04-24 21:34:55.267344,0 days 00:00:03.164700,False,squared_error,46,sqrt,1,6,967,TPESampler,COMPLETE
290,0.7618697029077497,2025-04-24 21:34:53.485956,2025-04-24 21:34:55.257165,0 days 00:00:01.771209,True,squared_error,5,sqrt,7,12,966,TPESampler,COMPLETE
291,0.4184730193276279,2025-04-24 21:34:55.384187,2025-04-24 21:35:19.049726,0 days 00:00:23.665539,False,absolute_error,50,sqrt,2,4,959,TPESampler,COMPLETE
292,0.33796222699500567,2025-04-24 21:34:55.435101,2025-04-24 21:35:32.628035,0 days 00:00:37.192934,False,absolute_error,39,sqrt,1,4,997,TPESampler,COMPLETE
293,0.7172840514764257,2025-04-24 21:35:01.131428,2025-04-24 21:35:03.071676,0 days 00:00:01.940248,False,absolute_error,35,sqrt,10,10,324,TPESampler,COMPLETE
294,0.3353639546092566,2025-04-24 21:35:03.250666,2025-04-24 21:35:40.028943,0 days 00:00:36.778277,False,absolute_error,49,sqrt,1,6,958,TPESampler,COMPLETE
295,0.3435730333793365,2025-04-24 21:35:09.965833,2025-04-24 21:35:41.323625,0 days 00:00:31.357792,False,absolute_error,48,sqrt,1,8,840,TPESampler,COMPLETE
296,0.324888110096229,2025-04-24 21:35:19.233281,2025-04-24 21:35:47.950788,0 days 00:00:28.717507,False,absolute_error,49,sqrt,1,4,769,TPESampler,COMPLETE
297,0.33640492916689724,2025-04-24 21:35:32.903105,2025-04-24 21:36:04.996543,0 days 00:00:32.093438,False,absolute_error,50,sqrt,1,7,844,TPESampler,COMPLETE
298,0.4851582255384477,2025-04-24 21:35:40.211309,2025-04-24 21:35:41.404643,0 days 00:00:01.193334,True,squared_error,35,log2,1,43,474,TPESampler,COMPLETE
299,0.32544583408513333,2025-04-24 21:35:41.516251,2025-04-24 21:36:14.189043,0 days 00:00:32.672792,False,absolute_error,50,sqrt,1,5,833,TPESampler,COMPLETE
300,0.3442783113475217,2025-04-24 21:35:41.592553,2025-04-24 21:36:08.260681,0 days 00:00:26.668128,False,absolute_error,37,sqrt,1,3,739,TPESampler,COMPLETE
301,0.3322606749302447,2025-04-24 21:35:48.125421,2025-04-24 21:36:13.306179,0 days 00:00:25.180758,False,absolute_error,50,sqrt,1,3,663,TPESampler,COMPLETE
302,0.3406380128607798,2025-04-24 21:35:51.872523,2025-04-24 21:36:24.375835,0 days 00:00:32.503312,False,absolute_error,43,sqrt,1,6,829,TPESampler,COMPLETE
303,0.41951873884469776,2025-04-24 21:36:05.172379,2025-04-24 21:36:21.557738,0 days 00:00:16.385359,False,absolute_error,42,sqrt,2,3,657,TPESampler,COMPLETE
304,0.45971357106047334,2025-04-24 21:36:08.430211,2025-04-24 21:37:55.477037,0 days 00:01:47.046826,False,absolute_error,32,,1,11,486,TPESampler,COMPLETE
305,0.45515927703174164,2025-04-24 21:36:13.482457,2025-04-24 21:36:22.368118,0 days 00:00:08.885661,True,absolute_error,46,sqrt,2,4,673,TPESampler,COMPLETE
306,0.4455225934320307,2025-04-24 21:36:14.404838,2025-04-24 21:36:19.974994,0 days 00:00:05.570156,False,squared_error,26,,5,3,917,TPESampler,COMPLETE
307,0.750002737876492,2025-04-24 21:36:20.174734,2025-04-24 21:36:21.501921,0 days 00:00:01.327187,False,squared_error,46,sqrt,12,11,913,TPESampler,COMPLETE
308,0.34236497962696943,2025-04-24 21:36:21.689189,2025-04-24 21:36:58.359922,0 days 00:00:36.670733,False,absolute_error,50,sqrt,1,8,958,TPESampler,COMPLETE
309,0.8632921764742753,2025-04-24 21:36:21.744520,2025-04-24 21:36:24.068586,0 days 00:00:02.324066,True,absolute_error,7,log2,8,39,821,TPESampler,COMPLETE
310,0.3391561482931726,2025-04-24 21:36:22.751574,2025-04-24 21:36:52.832519,0 days 00:00:30.080945,False,absolute_error,40,sqrt,1,5,829,TPESampler,COMPLETE
311,0.8316630000885541,2025-04-24 21:36:24.254614,2025-04-24 21:36:27.461613,0 days 00:00:03.206999,False,absolute_error,13,log2,7,5,900,TPESampler,COMPLETE
312,0.4027758772907363,2025-04-24 21:36:24.552188,2025-04-24 21:36:26.250246,0 days 00:00:01.698058,False,squared_error,38,sqrt,1,39,675,TPESampler,COMPLETE
313,0.33767486230019345,2025-04-24 21:36:26.425001,2025-04-24 21:36:54.789452,0 days 00:00:28.364451,False,absolute_error,49,sqrt,1,7,751,TPESampler,COMPLETE
314,0.33624092653985027,2025-04-24 21:36:27.648850,2025-04-24 21:37:01.559151,0 days 00:00:33.910301,False,absolute_error,50,sqrt,1,7,920,TPESampler,COMPLETE
315,0.334443100328972,2025-04-24 21:36:44.876889,2025-04-24 21:37:17.530342,0 days 00:00:32.653453,False,absolute_error,49,sqrt,1,3,805,TPESampler,COMPLETE
316,0.42123969201977896,2025-04-24 21:36:53.007018,2025-04-24 21:37:11.664262,0 days 00:00:18.657244,False,absolute_error,46,sqrt,2,6,773,TPESampler,COMPLETE
317,0.3714812788116642,2025-04-24 21:36:54.972745,2025-04-24 21:37:22.437886,0 days 00:00:27.465141,False,absolute_error,47,log2,1,3,964,TPESampler,COMPLETE
318,0.35360784833621656,2025-04-24 21:36:58.533746,2025-04-24 21:37:19.630943,0 days 00:00:21.097197,True,absolute_error,50,sqrt,1,4,923,TPESampler,COMPLETE
319,0.3330548955299036,2025-04-24 21:37:01.742287,2025-04-24 21:37:34.014105,0 days 00:00:32.271818,False,absolute_error,50,sqrt,1,6,882,TPESampler,COMPLETE
320,0.37197918809664143,2025-04-24 21:37:11.830622,2025-04-24 21:38:05.222363,0 days 00:00:53.391741,True,absolute_error,23,,1,10,413,TPESampler,COMPLETE
321,0.4092380534315049,2025-04-24 21:37:17.711816,2025-04-24 21:37:22.360239,0 days 00:00:04.648423,True,squared_error,30,,1,39,819,TPESampler,COMPLETE
322,0.33365838121202646,2025-04-24 21:37:19.805250,2025-04-24 21:37:21.860124,0 days 00:00:02.054874,False,squared_error,50,sqrt,1,5,575,TPESampler,COMPLETE
323,0.33244419165226397,2025-04-24 21:37:22.033180,2025-04-24 21:37:50.659636,0 days 00:00:28.626456,False,absolute_error,42,sqrt,1,5,743,TPESampler,COMPLETE
324,0.8668868222567367,2025-04-24 21:37:22.560458,2025-04-24 21:37:24.290023,0 days 00:00:01.729565,False,absolute_error,30,log2,15,32,420,TPESampler,COMPLETE
325,0.5594257132146817,2025-04-24 21:37:22.862082,2025-04-24 21:37:24.917103,0 days 00:00:02.055021,True,squared_error,14,sqrt,3,2,784,TPESampler,COMPLETE
326,0.3320981992826654,2025-04-24 21:37:24.470252,2025-04-24 21:37:56.096505,0 days 00:00:31.626253,False,absolute_error,50,sqrt,1,6,781,TPESampler,COMPLETE
327,0.34304472572073447,2025-04-24 21:37:25.285184,2025-04-24 21:37:45.476501,0 days 00:00:20.191317,False,absolute_error,39,sqrt,1,3,514,TPESampler,COMPLETE
328,0.367413121603996,2025-04-24 21:37:34.182327,2025-04-24 21:37:57.937029,0 days 00:00:23.754702,False,absolute_error,44,sqrt,1,15,502,TPESampler,COMPLETE
329,0.6963631551326026,2025-04-24 21:37:46.129962,2025-04-24 21:37:51.586391,0 days 00:00:05.456429,True,absolute_error,46,log2,2,12,782,TPESampler,COMPLETE
330,0.3640239035203076,2025-04-24 21:37:50.864133,2025-04-24 21:38:12.297657,0 days 00:00:21.433524,False,absolute_error,50,log2,1,4,700,TPESampler,COMPLETE
331,0.3907081291801249,2025-04-24 21:37:51.960498,2025-04-24 21:37:56.137302,0 days 00:00:04.176804,False,squared_error,23,,1,15,470,TPESampler,COMPLETE
332,0.3477757671068642,2025-04-24 21:37:55.681456,2025-04-24 21:39:49.656561,0 days 00:01:53.975105,True,absolute_error,49,,1,4,689,TPESampler,COMPLETE
333,0.5556543315202092,2025-04-24 21:37:56.374992,2025-04-24 21:38:06.828044,0 days 00:00:10.453052,True,absolute_error,19,log2,1,2,778,TPESampler,COMPLETE
334,0.3321789665694678,2025-04-24 21:37:56.427383,2025-04-24 21:38:25.393307,0 days 00:00:28.965924,False,absolute_error,50,sqrt,1,6,720,TPESampler,COMPLETE
335,0.4174177413783577,2025-04-24 21:37:58.128542,2025-04-24 21:38:17.987812,0 days 00:00:19.859270,False,absolute_error,50,sqrt,2,3,812,TPESampler,COMPLETE
336,0.3267598888635933,2025-04-24 21:38:05.388225,2025-04-24 21:38:32.935265,0 days 00:00:27.547040,False,absolute_error,50,sqrt,1,4,696,TPESampler,COMPLETE
337,0.3319322767567269,2025-04-24 21:38:06.991753,2025-04-24 21:38:37.592978,0 days 00:00:30.601225,False,absolute_error,50,sqrt,1,6,756,TPESampler,COMPLETE
338,0.33225139205268456,2025-04-24 21:38:12.473631,2025-04-24 21:38:46.081125,0 days 00:00:33.607494,False,absolute_error,43,sqrt,1,4,842,TPESampler,COMPLETE
339,0.3962398107326278,2025-04-24 21:38:18.292060,2025-04-24 21:40:35.263557,0 days 00:02:16.971497,False,absolute_error,45,,2,12,846,TPESampler,COMPLETE
340,0.3254459882520916,2025-04-24 21:38:25.560626,2025-04-24 21:38:58.816365,0 days 00:00:33.255739,False,absolute_error,50,sqrt,1,5,860,TPESampler,COMPLETE
341,0.42114280622882233,2025-04-24 21:38:33.101279,2025-04-24 21:39:06.462045,0 days 00:00:33.360766,False,absolute_error,48,sqrt,2,6,982,TPESampler,COMPLETE
342,0.3285525077702146,2025-04-24 21:38:37.762193,2025-04-24 21:39:09.573717,0 days 00:00:31.811524,False,absolute_error,49,sqrt,1,5,853,TPESampler,COMPLETE
343,0.32674094319480956,2025-04-24 21:38:46.251362,2025-04-24 21:39:22.308982,0 days 00:00:36.057620,False,absolute_error,50,sqrt,1,4,966,TPESampler,COMPLETE
344,0.3387652702374568,2025-04-24 21:38:58.992869,2025-04-24 21:39:28.989065,0 days 00:00:29.996196,False,absolute_error,42,sqrt,1,3,809,TPESampler,COMPLETE
345,0.8704986728343432,2025-04-24 21:39:06.649743,2025-04-24 21:39:07.590000,0 days 00:00:00.940257,False,absolute_error,18,log2,15,2,186,TPESampler,COMPLETE
346,0.3544158708418182,2025-04-24 21:39:07.779694,2025-04-24 21:39:49.277344,0 days 00:00:41.497650,False,absolute_error,40,sqrt,1,8,837,TPESampler,COMPLETE
347,0.3256068071948624,2025-04-24 21:39:09.746999,2025-04-24 21:39:46.532335,0 days 00:00:36.785336,False,absolute_error,50,sqrt,1,5,850,TPESampler,COMPLETE
348,0.32567859666779414,2025-04-24 21:39:22.483912,2025-04-24 21:39:59.340819,0 days 00:00:36.856907,False,absolute_error,50,sqrt,1,5,892,TPESampler,COMPLETE
349,0.3431178606220343,2025-04-24 21:39:29.164995,2025-04-24 21:40:06.711940,0 days 00:00:37.546945,False,absolute_error,49,sqrt,1,2,857,TPESampler,COMPLETE
350,0.449175396839818,2025-04-24 21:39:46.714011,2025-04-24 21:39:50.665622,0 days 00:00:03.951611,True,absolute_error,22,,6,6,123,TPESampler,COMPLETE
351,0.325202008922387,2025-04-24 21:39:49.458880,2025-04-24 21:40:19.212534,0 days 00:00:29.753654,False,absolute_error,50,sqrt,1,5,805,TPESampler,COMPLETE
352,0.3412447438080997,2025-04-24 21:39:49.896040,2025-04-24 21:40:17.775879,0 days 00:00:27.879839,False,absolute_error,50,sqrt,1,8,762,TPESampler,COMPLETE
353,0.32660639064927,2025-04-24 21:39:50.849062,2025-04-24 21:40:23.815941,0 days 00:00:32.966879,False,absolute_error,50,sqrt,1,4,814,TPESampler,COMPLETE
354,0.7976768330426566,2025-04-24 21:39:59.497629,2025-04-24 21:40:00.458931,0 days 00:00:00.961302,False,squared_error,50,log2,5,15,535,TPESampler,COMPLETE
355,0.4505893591707265,2025-04-24 21:40:00.635279,2025-04-24 21:42:54.507151,0 days 00:02:53.871872,False,absolute_error,43,,1,4,754,TPESampler,COMPLETE
356,0.7348220140071265,2025-04-24 21:40:06.904652,2025-04-24 21:40:07.665364,0 days 00:00:00.760712,True,squared_error,10,log2,2,13,123,TPESampler,COMPLETE
357,0.3265810271357707,2025-04-24 21:40:07.836340,2025-04-24 21:40:38.979920,0 days 00:00:31.143580,False,absolute_error,50,sqrt,1,4,797,TPESampler,COMPLETE
358,0.4235728489943203,2025-04-24 21:40:17.954637,2025-04-24 21:40:33.485618,0 days 00:00:15.530981,False,absolute_error,44,sqrt,2,7,626,TPESampler,COMPLETE
359,0.3384425079273146,2025-04-24 21:40:19.382635,2025-04-24 21:40:50.001724,0 days 00:00:30.619089,False,absolute_error,40,sqrt,1,5,749,TPESampler,COMPLETE
360,0.34001795908775245,2025-04-24 21:40:23.984394,2025-04-24 21:40:52.645120,0 days 00:00:28.660726,False,absolute_error,44,sqrt,1,6,787,TPESampler,COMPLETE
361,0.3331316009506886,2025-04-24 21:40:33.657985,2025-04-24 21:41:07.358510,0 days 00:00:33.700525,False,absolute_error,50,sqrt,1,3,762,TPESampler,COMPLETE
362,0.4214536099593525,2025-04-24 21:40:35.425414,2025-04-24 21:41:00.630228,0 days 00:00:25.204814,False,absolute_error,49,sqrt,2,6,782,TPESampler,COMPLETE
363,0.8215242628743814,2025-04-24 21:40:39.150596,2025-04-24 21:40:40.360652,0 days 00:00:01.210056,False,squared_error,28,log2,6,24,984,TPESampler,COMPLETE
364,0.4184057271501061,2025-04-24 21:40:40.526601,2025-04-24 21:40:42.231973,0 days 00:00:01.705372,False,squared_error,49,sqrt,2,3,731,TPESampler,COMPLETE
365,0.41730895347241964,2025-04-24 21:40:42.399240,2025-04-24 21:41:02.407752,0 days 00:00:20.008512,False,absolute_error,49,sqrt,2,4,819,TPESampler,COMPLETE
366,0.33373235526328615,2025-04-24 21:40:50.170011,2025-04-24 21:41:18.955539,0 days 00:00:28.785528,False,absolute_error,44,sqrt,1,5,745,TPESampler,COMPLETE
367,0.651883244720714,2025-04-24 21:40:52.817913,2025-04-24 21:40:57.122523,0 days 00:00:04.304610,False,absolute_error,13,log2,1,33,290,TPESampler,COMPLETE
368,0.5538922248205504,2025-04-24 21:40:57.297317,2025-04-24 21:40:58.864012,0 days 00:00:01.566695,True,squared_error,22,log2,1,18,765,TPESampler,COMPLETE
369,0.5665655120876908,2025-04-24 21:40:59.026069,2025-04-24 21:41:13.680408,0 days 00:00:14.654339,False,absolute_error,21,log2,1,48,692,TPESampler,COMPLETE
370,0.6935240679432377,2025-04-24 21:41:00.798123,2025-04-24 21:41:02.069619,0 days 00:00:01.271496,False,squared_error,48,log2,3,5,906,TPESampler,COMPLETE
371,0.3485386527878867,2025-04-24 21:41:02.236916,2025-04-24 21:41:21.119444,0 days 00:00:18.882528,True,absolute_error,50,sqrt,1,3,752,TPESampler,COMPLETE
372,0.34224605964321503,2025-04-24 21:41:02.601080,2025-04-24 21:41:27.817661,0 days 00:00:25.216581,False,absolute_error,49,sqrt,1,8,641,TPESampler,COMPLETE
373,0.33395951063029805,2025-04-24 21:41:07.525384,2025-04-24 21:41:38.746791,0 days 00:00:31.221407,False,absolute_error,49,sqrt,1,6,778,TPESampler,COMPLETE
374,0.33672031007648134,2025-04-24 21:41:13.852810,2025-04-24 21:41:42.815063,0 days 00:00:28.962253,False,absolute_error,41,sqrt,1,5,802,TPESampler,COMPLETE
375,0.3267540984985495,2025-04-24 21:41:19.173329,2025-04-24 21:41:50.005414,0 days 00:00:30.832085,False,absolute_error,50,sqrt,1,4,815,TPESampler,COMPLETE
376,0.3841096461014628,2025-04-24 21:41:21.291822,2025-04-24 21:41:43.959381,0 days 00:00:22.667559,False,absolute_error,50,log2,1,7,807,TPESampler,COMPLETE
377,0.3252477766319147,2025-04-24 21:41:27.985011,2025-04-24 21:41:55.369178,0 days 00:00:27.384167,False,absolute_error,49,sqrt,1,4,733,TPESampler,COMPLETE
378,0.5166858750429496,2025-04-24 21:41:38.913388,2025-04-24 21:41:40.607311,0 days 00:00:01.693923,False,squared_error,21,log2,1,2,600,TPESampler,COMPLETE
379,0.3327076249202112,2025-04-24 21:41:40.777180,2025-04-24 21:41:43.464212,0 days 00:00:02.687032,False,squared_error,50,sqrt,1,4,771,TPESampler,COMPLETE
380,0.42081678523094734,2025-04-24 21:41:42.987924,2025-04-24 21:42:00.264088,0 days 00:00:17.276164,False,absolute_error,50,sqrt,2,5,705,TPESampler,COMPLETE
381,0.35121197717842934,2025-04-24 21:41:43.633973,2025-04-24 21:42:18.334498,0 days 00:00:34.700525,False,absolute_error,50,sqrt,1,11,748,TPESampler,COMPLETE
382,0.34214642861317973,2025-04-24 21:41:44.282510,2025-04-24 21:42:17.311354,0 days 00:00:33.028844,False,absolute_error,50,sqrt,1,8,846,TPESampler,COMPLETE
383,0.3252143323370535,2025-04-24 21:41:50.174925,2025-04-24 21:42:25.546373,0 days 00:00:35.371448,False,absolute_error,50,sqrt,1,5,823,TPESampler,COMPLETE
384,0.4091860297322153,2025-04-24 21:41:55.547319,2025-04-24 21:43:22.457077,0 days 00:01:26.909758,False,absolute_error,50,,2,5,617,TPESampler,COMPLETE
385,0.4951002297266657,2025-04-24 21:42:00.436185,2025-04-24 21:42:03.468472,0 days 00:00:03.032287,False,squared_error,24,,11,2,579,TPESampler,COMPLETE
386,0.8228484613315016,2025-04-24 21:42:03.669378,2025-04-24 21:42:04.720057,0 days 00:00:01.050679,True,squared_error,18,sqrt,15,3,494,TPESampler,COMPLETE
387,0.7646882076031526,2025-04-24 21:42:04.885633,2025-04-24 21:42:08.146653,0 days 00:00:03.261020,False,absolute_error,6,log2,2,2,486,TPESampler,COMPLETE
388,0.33302685977586727,2025-04-24 21:42:08.305719,2025-04-24 21:42:37.817415,0 days 00:00:29.511696,False,absolute_error,50,sqrt,1,3,772,TPESampler,COMPLETE
389,0.3470073363941229,2025-04-24 21:42:17.497681,2025-04-24 21:42:43.596318,0 days 00:00:26.098637,False,absolute_error,43,sqrt,1,2,673,TPESampler,COMPLETE
390,0.4714853645956346,2025-04-24 21:42:18.556920,2025-04-24 21:42:53.124316,0 days 00:00:34.567396,False,absolute_error,44,,8,25,693,TPESampler,COMPLETE
391,0.4852870201002471,2025-04-24 21:42:25.711121,2025-04-24 21:42:30.213058,0 days 00:00:04.501937,True,absolute_error,21,sqrt,2,3,359,TPESampler,COMPLETE
392,0.3253923596218063,2025-04-24 21:42:30.422883,2025-04-24 21:42:59.829061,0 days 00:00:29.406178,False,absolute_error,49,sqrt,1,4,754,TPESampler,COMPLETE
393,0.4943573833105069,2025-04-24 21:42:37.996001,2025-04-24 21:42:53.130311,0 days 00:00:15.134310,True,absolute_error,18,sqrt,1,45,901,TPESampler,COMPLETE
394,0.6028296798561186,2025-04-24 21:42:43.769775,2025-04-24 21:42:49.626270,0 days 00:00:05.856495,True,absolute_error,39,sqrt,4,50,863,TPESampler,COMPLETE
395,0.3516263681149892,2025-04-24 21:42:49.874633,2025-04-24 21:43:08.483058,0 days 00:00:18.608425,False,absolute_error,37,sqrt,1,7,499,TPESampler,COMPLETE
396,0.331645059534931,2025-04-24 21:42:53.482485,2025-04-24 21:43:16.019689,0 days 00:00:22.537204,False,absolute_error,43,sqrt,1,4,593,TPESampler,COMPLETE
397,0.3311488027214381,2025-04-24 21:42:53.493836,2025-04-24 21:43:16.664396,0 days 00:00:23.170560,False,absolute_error,50,sqrt,1,6,606,TPESampler,COMPLETE
398,0.334103180916723,2025-04-24 21:42:55.207615,2025-04-24 21:43:24.362590,0 days 00:00:29.154975,False,absolute_error,49,sqrt,1,6,784,TPESampler,COMPLETE
399,0.5481032132316216,2025-04-24 21:43:00.015164,2025-04-24 21:43:02.989437,0 days 00:00:02.974273,True,squared_error,27,,14,17,839,TPESampler,COMPLETE
400,0.5018123656761054,2025-04-24 21:43:03.174636,2025-04-24 21:43:06.313017,0 days 00:00:03.138381,False,absolute_error,32,log2,1,34,117,TPESampler,COMPLETE
401,0.33298503866105156,2025-04-24 21:43:06.488552,2025-04-24 21:43:35.973365,0 days 00:00:29.484813,False,absolute_error,50,sqrt,1,3,739,TPESampler,COMPLETE
402,0.5524690812328307,2025-04-24 21:43:08.653286,2025-04-24 21:43:11.487904,0 days 00:00:02.834618,True,absolute_error,44,,14,19,176,TPESampler,COMPLETE
403,0.42127743076656726,2025-04-24 21:43:11.658875,2025-04-24 21:43:32.496662,0 days 00:00:20.837787,False,absolute_error,50,sqrt,2,5,763,TPESampler,COMPLETE
404,0.3962145979694365,2025-04-24 21:43:16.187028,2025-04-24 21:43:17.000096,0 days 00:00:00.813068,False,squared_error,48,sqrt,1,46,177,TPESampler,COMPLETE
405,0.3253549423901865,2025-04-24 21:43:16.843767,2025-04-24 21:43:44.361561,0 days 00:00:27.517794,False,absolute_error,49,sqrt,1,4,694,TPESampler,COMPLETE
406,0.511689458332616,2025-04-24 21:43:17.208635,2025-04-24 21:43:18.682170,0 days 00:00:01.473535,False,squared_error,25,sqrt,4,36,729,TPESampler,COMPLETE
407,0.6809847556624439,2025-04-24 21:43:18.864554,2025-04-24 21:43:20.362752,0 days 00:00:01.498198,True,squared_error,10,log2,1,3,742,TPESampler,COMPLETE
408,0.33397114126783906,2025-04-24 21:43:20.533073,2025-04-24 21:43:49.576249,0 days 00:00:29.043176,False,absolute_error,49,sqrt,1,6,765,TPESampler,COMPLETE
409,0.32778848021543533,2025-04-24 21:43:22.644088,2025-04-24 21:43:43.892351,0 days 00:00:21.248263,False,absolute_error,50,sqrt,1,4,549,TPESampler,COMPLETE
410,0.4571876321710953,2025-04-24 21:43:24.545897,2025-04-24 21:43:26.482574,0 days 00:00:01.936677,True,squared_error,8,,5,12,438,TPESampler,COMPLETE
411,0.35503628342179294,2025-04-24 21:43:26.650269,2025-04-24 21:43:38.289374,0 days 00:00:11.639105,True,absolute_error,47,sqrt,1,4,508,TPESampler,COMPLETE
412,0.3321717519984081,2025-04-24 21:43:32.680328,2025-04-24 21:44:04.266906,0 days 00:00:31.586578,False,absolute_error,50,sqrt,1,6,794,TPESampler,COMPLETE
413,0.3330700816123796,2025-04-24 21:43:36.142226,2025-04-24 21:44:07.389853,0 days 00:00:31.247627,False,absolute_error,50,sqrt,1,3,764,TPESampler,COMPLETE
414,0.41859975345732425,2025-04-24 21:43:38.468205,2025-04-24 21:43:55.831900,0 days 00:00:17.363695,False,absolute_error,44,sqrt,2,3,635,TPESampler,COMPLETE
415,0.3334077919955371,2025-04-24 21:43:44.066123,2025-04-24 21:44:11.260913,0 days 00:00:27.194790,False,absolute_error,42,sqrt,1,4,659,TPESampler,COMPLETE
