number,value,datetime_start,datetime_complete,duration,params_bootstrap,params_criterion,params_max_depth,params_max_features,params_min_samples_leaf,params_min_samples_split,params_n_estimators,system_attrs_auto:sampler,state
2072,0.33656973935504436,2025-04-24 23:25:30.344562,2025-04-24 23:25:53.775565,0 days 00:00:23.431003,False,absolute_error,41,sqrt,1,5,649,TPESampler,COMPLETE
2073,0.33159517599735183,2025-04-24 23:25:31.562434,2025-04-24 23:25:57.590149,0 days 00:00:26.027715,False,absolute_error,44,sqrt,1,4,646,TPESampler,COMPLETE
2074,0.33880373099643324,2025-04-24 23:25:32.301118,2025-04-24 23:25:51.543165,0 days 00:00:19.242047,False,absolute_error,43,sqrt,1,3,516,TPESampler,COMPLETE
2075,0.45779026255020466,2025-04-24 23:25:35.871132,2025-04-24 23:25:42.709896,0 days 00:00:06.838764,True,absolute_error,36,sqrt,2,5,452,TPESampler,COMPLETE
2076,0.3527822638230014,2025-04-24 23:25:42.923662,2025-04-24 23:26:08.710317,0 days 00:00:25.786655,False,absolute_error,44,sqrt,1,9,656,TPESampler,COMPLETE
2077,0.7535170409710056,2025-04-24 23:25:50.187758,2025-04-24 23:25:51.082540,0 days 00:00:00.894782,False,squared_error,21,log2,4,7,346,TPESampler,COMPLETE
2078,0.33124991555625755,2025-04-24 23:25:51.287720,2025-04-24 23:26:14.821976,0 days 00:00:23.534256,False,absolute_error,44,sqrt,1,4,636,TPESampler,COMPLETE
2079,0.4132650613384545,2025-04-24 23:25:51.753619,2025-04-24 23:27:54.882959,0 days 00:02:03.129340,False,absolute_error,25,,2,4,901,TPESampler,COMPLETE
2080,0.3317996568707868,2025-04-24 23:25:53.963673,2025-04-24 23:26:10.759061,0 days 00:00:16.795388,False,absolute_error,50,sqrt,1,6,442,TPESampler,COMPLETE
2081,0.3450495364392447,2025-04-24 23:25:57.307094,2025-04-24 23:26:21.675396,0 days 00:00:24.368302,False,absolute_error,50,sqrt,1,2,616,TPESampler,COMPLETE
2082,0.4246768310002415,2025-04-24 23:25:57.851169,2025-04-24 23:25:59.572159,0 days 00:00:01.720990,False,squared_error,37,sqrt,2,6,687,TPESampler,COMPLETE
2083,0.3377094224226248,2025-04-24 23:25:59.774594,2025-04-24 23:26:25.563588,0 days 00:00:25.788994,False,absolute_error,44,sqrt,1,3,685,TPESampler,COMPLETE
2084,0.4314939896549956,2025-04-24 23:26:08.912363,2025-04-24 23:26:18.826532,0 days 00:00:09.914169,False,absolute_error,50,sqrt,2,24,393,TPESampler,COMPLETE
2085,0.35162829613960844,2025-04-24 23:26:10.963417,2025-04-24 23:26:13.885881,0 days 00:00:02.922464,True,squared_error,49,sqrt,1,3,883,TPESampler,COMPLETE
2086,0.32515970975127384,2025-04-24 23:26:14.077562,2025-04-24 23:26:36.345168,0 days 00:00:22.267606,False,absolute_error,50,sqrt,1,5,594,TPESampler,COMPLETE
2087,0.3359649780047001,2025-04-24 23:26:15.257408,2025-04-24 23:26:32.213781,0 days 00:00:16.956373,False,absolute_error,50,sqrt,1,7,443,TPESampler,COMPLETE
2088,0.3462639339590525,2025-04-24 23:26:19.027275,2025-04-24 23:26:20.687364,0 days 00:00:01.660089,False,squared_error,50,sqrt,1,2,235,TPESampler,COMPLETE
2089,0.32584377583916513,2025-04-24 23:26:20.884470,2025-04-24 23:26:36.263245,0 days 00:00:15.378775,False,absolute_error,50,sqrt,1,4,395,TPESampler,COMPLETE
2090,0.42075248855600295,2025-04-24 23:26:21.916225,2025-04-24 23:26:35.176874,0 days 00:00:13.260649,False,absolute_error,42,sqrt,2,5,543,TPESampler,COMPLETE
2091,0.4178453504614864,2025-04-24 23:26:25.759421,2025-04-24 23:26:41.713612,0 days 00:00:15.954191,False,absolute_error,50,sqrt,2,4,647,TPESampler,COMPLETE
2092,0.41958851630780475,2025-04-24 23:26:32.412203,2025-04-24 23:26:49.709247,0 days 00:00:17.297044,False,absolute_error,42,sqrt,2,3,672,TPESampler,COMPLETE
2093,0.3319663553115286,2025-04-24 23:26:35.359997,2025-04-24 23:26:59.880947,0 days 00:00:24.520950,False,absolute_error,50,sqrt,1,6,663,TPESampler,COMPLETE
2094,0.3409520674847018,2025-04-24 23:26:36.468107,2025-04-24 23:26:57.417781,0 days 00:00:20.949674,False,absolute_error,42,sqrt,1,6,521,TPESampler,COMPLETE
2095,0.38121411274267086,2025-04-24 23:26:36.560732,2025-04-24 23:26:54.911444,0 days 00:00:18.350712,False,absolute_error,50,log2,1,6,657,TPESampler,COMPLETE
2096,0.33231441383014215,2025-04-24 23:26:41.906147,2025-04-24 23:27:08.706749,0 days 00:00:26.800602,False,absolute_error,50,sqrt,1,3,670,TPESampler,COMPLETE
2097,0.4239682494105926,2025-04-24 23:26:49.900272,2025-04-24 23:27:07.946897,0 days 00:00:18.046625,False,absolute_error,50,sqrt,2,8,643,TPESampler,COMPLETE
2098,0.3364196937873557,2025-04-24 23:26:55.098020,2025-04-24 23:27:11.743858,0 days 00:00:16.645838,False,absolute_error,41,sqrt,1,4,447,TPESampler,COMPLETE
2099,0.6220960608035248,2025-04-24 23:26:57.609768,2025-04-24 23:27:06.763068,0 days 00:00:09.153300,False,absolute_error,50,log2,2,3,584,TPESampler,COMPLETE
2100,0.32628932987295406,2025-04-24 23:27:00.070590,2025-04-24 23:27:23.380442,0 days 00:00:23.309852,False,absolute_error,50,sqrt,1,4,621,TPESampler,COMPLETE
2101,0.33400395359193874,2025-04-24 23:27:06.952317,2025-04-24 23:27:36.579268,0 days 00:00:29.626951,False,absolute_error,44,sqrt,1,5,685,TPESampler,COMPLETE
2102,0.3309797771178114,2025-04-24 23:27:08.139595,2025-04-24 23:27:30.104811,0 days 00:00:21.965216,False,absolute_error,50,sqrt,1,6,589,TPESampler,COMPLETE
2103,0.5737854702213433,2025-04-24 23:27:09.092689,2025-04-24 23:27:14.642222,0 days 00:00:05.549533,True,absolute_error,20,log2,1,18,489,TPESampler,COMPLETE
2104,0.39368816991045474,2025-04-24 23:27:11.999619,2025-04-24 23:27:17.242017,0 days 00:00:05.242398,True,squared_error,30,,3,2,995,TPESampler,COMPLETE
2105,0.3264456042628282,2025-04-24 23:27:14.834718,2025-04-24 23:27:42.099085,0 days 00:00:27.264367,False,absolute_error,50,sqrt,1,4,638,TPESampler,COMPLETE
2106,0.420245458579077,2025-04-24 23:27:17.427889,2025-04-24 23:27:31.680986,0 days 00:00:14.253097,False,absolute_error,50,sqrt,2,5,581,TPESampler,COMPLETE
2107,0.4476384777074865,2025-04-24 23:27:23.582980,2025-04-24 23:29:30.580547,0 days 00:02:06.997567,False,absolute_error,45,,1,5,550,TPESampler,COMPLETE
2108,0.34343550174253645,2025-04-24 23:27:30.351827,2025-04-24 23:27:56.371320,0 days 00:00:26.019493,False,absolute_error,50,sqrt,1,9,700,TPESampler,COMPLETE
2109,0.7895631651669903,2025-04-24 23:27:31.932774,2025-04-24 23:27:33.088159,0 days 00:00:01.155385,True,squared_error,8,log2,3,2,533,TPESampler,COMPLETE
2110,0.7698881106552324,2025-04-24 23:27:33.266317,2025-04-24 23:27:36.847672,0 days 00:00:03.581355,False,absolute_error,24,sqrt,14,13,958,TPESampler,COMPLETE
2111,0.3316565424864937,2025-04-24 23:27:36.778552,2025-04-24 23:27:59.061257,0 days 00:00:22.282705,False,absolute_error,50,sqrt,1,3,575,TPESampler,COMPLETE
2112,0.8352069034736559,2025-04-24 23:27:37.046993,2025-04-24 23:27:38.658471,0 days 00:00:01.611478,False,absolute_error,5,log2,7,2,409,TPESampler,COMPLETE
2113,0.4165982758864627,2025-04-24 23:27:38.848693,2025-04-24 23:27:49.238722,0 days 00:00:10.390029,False,absolute_error,50,sqrt,2,4,414,TPESampler,COMPLETE
2114,0.32555924019013227,2025-04-24 23:27:42.291930,2025-04-24 23:27:58.344130,0 days 00:00:16.052200,False,absolute_error,50,sqrt,1,5,420,TPESampler,COMPLETE
2115,0.41656967626421515,2025-04-24 23:27:49.599520,2025-04-24 23:28:03.170535,0 days 00:00:13.571015,False,absolute_error,50,sqrt,2,3,538,TPESampler,COMPLETE
2116,0.331990568520573,2025-04-24 23:27:55.069758,2025-04-24 23:28:15.702200,0 days 00:00:20.632442,False,absolute_error,50,sqrt,1,3,536,TPESampler,COMPLETE
2117,0.49339540346741434,2025-04-24 23:27:56.817781,2025-04-24 23:28:01.187560,0 days 00:00:04.369779,False,squared_error,12,,13,5,757,TPESampler,COMPLETE
2118,0.41881428645308627,2025-04-24 23:27:58.656279,2025-04-24 23:28:17.683907,0 days 00:00:19.027628,False,absolute_error,43,sqrt,2,2,755,TPESampler,COMPLETE
2119,0.5302936792306485,2025-04-24 23:27:59.273917,2025-04-24 23:28:09.770096,0 days 00:00:10.496179,True,absolute_error,31,,12,36,625,TPESampler,COMPLETE
2120,0.374413376055413,2025-04-24 23:28:01.393433,2025-04-24 23:28:24.702268,0 days 00:00:23.308835,False,absolute_error,33,sqrt,1,10,633,TPESampler,COMPLETE
2121,0.34806215632503684,2025-04-24 23:28:03.361554,2025-04-24 23:28:29.536629,0 days 00:00:26.175075,False,absolute_error,42,sqrt,1,2,689,TPESampler,COMPLETE
2122,0.8431867275197987,2025-04-24 23:28:09.965283,2025-04-24 23:28:11.877726,0 days 00:00:01.912443,True,absolute_error,7,log2,5,3,718,TPESampler,COMPLETE
2123,0.32538862938303825,2025-04-24 23:28:12.077652,2025-04-24 23:28:40.245291,0 days 00:00:28.167639,False,absolute_error,50,sqrt,1,5,709,TPESampler,COMPLETE
2124,0.41770597717505753,2025-04-24 23:28:15.887114,2025-04-24 23:28:17.750870,0 days 00:00:01.863756,False,squared_error,50,sqrt,2,3,781,TPESampler,COMPLETE
2125,0.34329989742987543,2025-04-24 23:28:17.889465,2025-04-24 23:28:41.261330,0 days 00:00:23.371865,False,absolute_error,41,sqrt,1,6,643,TPESampler,COMPLETE
2126,0.34046054716300744,2025-04-24 23:28:17.976679,2025-04-24 23:28:36.428136,0 days 00:00:18.451457,False,absolute_error,42,sqrt,1,6,499,TPESampler,COMPLETE
2127,0.3321564294588429,2025-04-24 23:28:24.900581,2025-04-24 23:28:45.978400,0 days 00:00:21.077819,False,absolute_error,50,sqrt,1,3,546,TPESampler,COMPLETE
2128,0.5019367306066911,2025-04-24 23:28:29.729163,2025-04-24 23:28:32.171899,0 days 00:00:02.442736,True,squared_error,31,,10,8,582,TPESampler,COMPLETE
2129,0.5409027156040938,2025-04-24 23:28:32.366566,2025-04-24 23:28:35.760386,0 days 00:00:03.393820,True,squared_error,21,,13,46,997,TPESampler,COMPLETE
2130,0.3252572986822001,2025-04-24 23:28:35.953093,2025-04-24 23:29:00.136456,0 days 00:00:24.183363,False,absolute_error,50,sqrt,1,5,649,TPESampler,COMPLETE
2131,0.3324184240445265,2025-04-24 23:28:36.809226,2025-04-24 23:29:02.419806,0 days 00:00:25.610580,False,absolute_error,50,sqrt,1,3,673,TPESampler,COMPLETE
2132,0.6037566971539929,2025-04-24 23:28:40.453135,2025-04-24 23:28:45.417620,0 days 00:00:04.964485,False,absolute_error,48,sqrt,6,2,503,TPESampler,COMPLETE
2133,0.3430025371375448,2025-04-24 23:28:41.459485,2025-04-24 23:29:03.539599,0 days 00:00:22.080114,False,absolute_error,50,sqrt,1,9,598,TPESampler,COMPLETE
2134,0.32714172103099276,2025-04-24 23:28:45.609631,2025-04-24 23:29:12.778045,0 days 00:00:27.168414,False,absolute_error,50,sqrt,1,4,676,TPESampler,COMPLETE
2135,0.4199688427574669,2025-04-24 23:28:46.191995,2025-04-24 23:29:01.667402,0 days 00:00:15.475407,False,absolute_error,50,sqrt,2,5,562,TPESampler,COMPLETE
2136,0.340799688706542,2025-04-24 23:29:00.324182,2025-04-24 23:29:02.421213,0 days 00:00:02.097031,False,squared_error,50,sqrt,1,7,647,TPESampler,COMPLETE
2137,0.4547127640434524,2025-04-24 23:29:01.864333,2025-04-24 23:29:12.337941,0 days 00:00:10.473608,True,absolute_error,47,sqrt,2,3,699,TPESampler,COMPLETE
2138,0.33988524358353434,2025-04-24 23:29:02.592958,2025-04-24 23:29:31.855876,0 days 00:00:29.262918,False,absolute_error,44,sqrt,1,6,497,TPESampler,COMPLETE
2139,0.3318312629107167,2025-04-24 23:29:02.652512,2025-04-24 23:29:29.853153,0 days 00:00:27.200641,False,absolute_error,50,sqrt,1,6,464,TPESampler,COMPLETE
2140,0.3452155115116327,2025-04-24 23:29:03.761266,2025-04-24 23:29:32.491316,0 days 00:00:28.730050,False,absolute_error,42,sqrt,1,7,653,TPESampler,COMPLETE
2141,0.34149273449825485,2025-04-24 23:29:12.539166,2025-04-24 23:29:37.305229,0 days 00:00:24.766063,False,absolute_error,50,sqrt,1,8,670,TPESampler,COMPLETE
2142,0.4245988521210175,2025-04-24 23:29:13.031968,2025-04-24 23:29:31.927144,0 days 00:00:18.895176,False,absolute_error,41,sqrt,2,7,609,TPESampler,COMPLETE
2143,0.32714646176349194,2025-04-24 23:29:30.143660,2025-04-24 23:29:46.924468,0 days 00:00:16.780808,False,absolute_error,50,sqrt,1,4,435,TPESampler,COMPLETE
2144,0.4608888175405974,2025-04-24 23:29:30.918235,2025-04-24 23:30:58.177476,0 days 00:01:27.259241,False,absolute_error,15,,1,4,450,TPESampler,COMPLETE
2145,0.41850085136800996,2025-04-24 23:29:32.064251,2025-04-24 23:29:42.977490,0 days 00:00:10.913239,False,absolute_error,41,sqrt,2,3,425,TPESampler,COMPLETE
2146,0.3325018766072837,2025-04-24 23:29:32.161400,2025-04-24 23:29:51.022428,0 days 00:00:18.861028,False,absolute_error,42,sqrt,1,4,508,TPESampler,COMPLETE
2147,0.3276206098651637,2025-04-24 23:29:32.739207,2025-04-24 23:29:51.185021,0 days 00:00:18.445814,False,absolute_error,50,sqrt,1,4,480,TPESampler,COMPLETE
2148,0.3357788492293062,2025-04-24 23:29:37.501882,2025-04-24 23:30:01.914410,0 days 00:00:24.412528,False,absolute_error,50,sqrt,1,7,662,TPESampler,COMPLETE
2149,0.33159618885045095,2025-04-24 23:29:43.176454,2025-04-24 23:30:06.990143,0 days 00:00:23.813689,False,absolute_error,44,sqrt,1,4,647,TPESampler,COMPLETE
2150,0.8671203652667934,2025-04-24 23:29:47.106106,2025-04-24 23:29:48.619115,0 days 00:00:01.513009,True,absolute_error,39,log2,10,2,604,TPESampler,COMPLETE
2151,0.3313055128375096,2025-04-24 23:29:48.806709,2025-04-24 23:30:11.766935,0 days 00:00:22.960226,False,absolute_error,44,sqrt,1,4,622,TPESampler,COMPLETE
2152,0.4177952438902058,2025-04-24 23:29:51.214897,2025-04-24 23:30:07.552255,0 days 00:00:16.337358,False,absolute_error,50,sqrt,2,3,660,TPESampler,COMPLETE
2153,0.352137985040266,2025-04-24 23:29:51.432785,2025-04-24 23:30:12.448635,0 days 00:00:21.015850,False,absolute_error,33,sqrt,1,4,597,TPESampler,COMPLETE
2154,0.468613985558291,2025-04-24 23:30:02.111815,2025-04-24 23:32:36.616351,0 days 00:02:34.504536,False,absolute_error,45,,1,3,676,TPESampler,COMPLETE
2155,0.6968782359339313,2025-04-24 23:30:07.180746,2025-04-24 23:30:08.329752,0 days 00:00:01.149006,True,squared_error,5,sqrt,1,2,418,TPESampler,COMPLETE
2156,0.33193841678618274,2025-04-24 23:30:07.794949,2025-04-24 23:30:27.235376,0 days 00:00:19.440427,False,absolute_error,50,sqrt,1,3,506,TPESampler,COMPLETE
2157,0.3479390385017959,2025-04-24 23:30:08.540080,2025-04-24 23:30:12.561526,0 days 00:00:04.021446,False,squared_error,43,sqrt,1,2,795,TPESampler,COMPLETE
2158,0.34490101320058014,2025-04-24 23:30:11.956789,2025-04-24 23:30:49.851863,0 days 00:00:37.895074,False,absolute_error,50,sqrt,1,2,688,TPESampler,COMPLETE
2159,0.5067373984508868,2025-04-24 23:30:12.663287,2025-04-24 23:30:14.256036,0 days 00:00:01.592749,False,squared_error,41,,14,7,211,TPESampler,COMPLETE
2160,0.39714592947475336,2025-04-24 23:30:12.924937,2025-04-24 23:31:24.096443,0 days 00:01:11.171506,True,absolute_error,12,,1,4,573,TPESampler,COMPLETE
2161,0.41779157526876814,2025-04-24 23:30:14.543292,2025-04-24 23:30:30.721012,0 days 00:00:16.177720,False,absolute_error,50,sqrt,2,4,662,TPESampler,COMPLETE
2162,0.6195425683337485,2025-04-24 23:30:27.428753,2025-04-24 23:30:36.976174,0 days 00:00:09.547421,False,absolute_error,39,log2,2,3,740,TPESampler,COMPLETE
2163,0.4258170339536235,2025-04-24 23:30:30.918112,2025-04-24 23:30:49.698856,0 days 00:00:18.780744,False,absolute_error,43,sqrt,2,8,753,TPESampler,COMPLETE
2164,0.32660354739649045,2025-04-24 23:30:37.185858,2025-04-24 23:31:03.981396,0 days 00:00:26.795538,False,absolute_error,50,sqrt,1,4,654,TPESampler,COMPLETE
2165,0.324713581655901,2025-04-24 23:30:49.899673,2025-04-24 23:31:15.592861,0 days 00:00:25.693188,False,absolute_error,50,sqrt,1,5,618,TPESampler,COMPLETE
2166,0.3770349899743852,2025-04-24 23:30:50.054665,2025-04-24 23:31:03.261870,0 days 00:00:13.207205,True,absolute_error,39,sqrt,1,7,584,TPESampler,COMPLETE
2167,0.34528595094104386,2025-04-24 23:30:58.370058,2025-04-24 23:31:12.439039,0 days 00:00:14.068981,False,absolute_error,43,sqrt,1,2,332,TPESampler,COMPLETE
2168,0.515359975399339,2025-04-24 23:31:03.452122,2025-04-24 23:31:04.853157,0 days 00:00:01.401035,True,squared_error,28,sqrt,3,2,550,TPESampler,COMPLETE
2169,0.481113181380037,2025-04-24 23:31:04.203506,2025-04-24 23:31:04.996844,0 days 00:00:00.793338,False,squared_error,15,sqrt,1,5,115,TPESampler,COMPLETE
2170,0.596749336942384,2025-04-24 23:31:05.053210,2025-04-24 23:31:06.558941,0 days 00:00:01.505731,True,squared_error,50,sqrt,4,20,669,TPESampler,COMPLETE
2171,0.4193186271925944,2025-04-24 23:31:05.194008,2025-04-24 23:31:09.313871,0 days 00:00:04.119863,True,squared_error,41,,2,40,905,TPESampler,COMPLETE
2172,0.3554856862841913,2025-04-24 23:31:06.748951,2025-04-24 23:31:17.780944,0 days 00:00:11.031993,True,absolute_error,50,sqrt,1,4,435,TPESampler,COMPLETE
2173,0.3393053407195447,2025-04-24 23:31:09.509808,2025-04-24 23:31:30.342376,0 days 00:00:20.832568,False,absolute_error,42,sqrt,1,3,564,TPESampler,COMPLETE
2174,0.33715042907040854,2025-04-24 23:31:12.633895,2025-04-24 23:31:39.474319,0 days 00:00:26.840424,False,absolute_error,44,sqrt,1,3,628,TPESampler,COMPLETE
2175,0.34883997553674645,2025-04-24 23:31:15.791150,2025-04-24 23:31:30.998890,0 days 00:00:15.207740,True,absolute_error,50,sqrt,1,3,705,TPESampler,COMPLETE
2176,0.3358542398400888,2025-04-24 23:31:17.965835,2025-04-24 23:31:41.251439,0 days 00:00:23.285604,False,absolute_error,50,sqrt,1,7,520,TPESampler,COMPLETE
2177,0.4222846770918538,2025-04-24 23:31:24.281961,2025-04-24 23:31:36.616198,0 days 00:00:12.334237,False,absolute_error,44,sqrt,2,7,424,TPESampler,COMPLETE
2178,0.35256194383863,2025-04-24 23:31:30.535671,2025-04-24 23:31:54.507033,0 days 00:00:23.971362,False,absolute_error,42,sqrt,1,8,664,TPESampler,COMPLETE
2179,0.4224695577738643,2025-04-24 23:31:31.381822,2025-04-24 23:31:48.320936,0 days 00:00:16.939114,False,absolute_error,43,sqrt,2,6,702,TPESampler,COMPLETE
2180,0.33963583220562493,2025-04-24 23:31:36.804397,2025-04-24 23:31:59.544166,0 days 00:00:22.739769,False,absolute_error,44,sqrt,1,7,621,TPESampler,COMPLETE
2181,0.3263735294883557,2025-04-24 23:31:39.668653,2025-04-24 23:32:00.147136,0 days 00:00:20.478483,False,absolute_error,50,sqrt,1,5,542,TPESampler,COMPLETE
2182,0.3271810542027279,2025-04-24 23:31:41.435224,2025-04-24 23:32:06.678941,0 days 00:00:25.243717,False,absolute_error,50,sqrt,1,4,673,TPESampler,COMPLETE
2183,0.34896002608190413,2025-04-24 23:31:48.523957,2025-04-24 23:32:06.608431,0 days 00:00:18.084474,False,absolute_error,43,sqrt,1,8,497,TPESampler,COMPLETE
2184,0.3468225427000615,2025-04-24 23:31:54.701562,2025-04-24 23:31:56.616945,0 days 00:00:01.915383,False,squared_error,42,sqrt,1,6,579,TPESampler,COMPLETE
2185,0.33123837762263963,2025-04-24 23:31:56.816512,2025-04-24 23:32:17.349669,0 days 00:00:20.533157,False,absolute_error,50,sqrt,1,6,552,TPESampler,COMPLETE
2186,0.4156851019355664,2025-04-24 23:31:59.737150,2025-04-24 23:32:11.136668,0 days 00:00:11.399518,False,absolute_error,50,sqrt,2,4,437,TPESampler,COMPLETE
2187,0.3314896992303326,2025-04-24 23:32:00.351838,2025-04-24 23:32:24.305494,0 days 00:00:23.953656,False,absolute_error,43,sqrt,1,4,641,TPESampler,COMPLETE
2188,0.3456118052651289,2025-04-24 23:32:06.818584,2025-04-24 23:32:25.798354,0 days 00:00:18.979770,False,absolute_error,50,sqrt,1,10,512,TPESampler,COMPLETE
2189,0.33210283559108045,2025-04-24 23:32:06.910531,2025-04-24 23:32:23.620211,0 days 00:00:16.709680,False,absolute_error,42,sqrt,1,5,450,TPESampler,COMPLETE
2190,0.3469090594468445,2025-04-24 23:32:11.330548,2025-04-24 23:32:29.627689,0 days 00:00:18.297141,False,absolute_error,43,sqrt,1,2,466,TPESampler,COMPLETE
2191,0.3464929165092785,2025-04-24 23:32:17.542989,2025-04-24 23:32:45.360268,0 days 00:00:27.817279,False,absolute_error,43,sqrt,1,2,728,TPESampler,COMPLETE
2192,0.42392226620033513,2025-04-24 23:32:23.804558,2025-04-24 23:32:43.402144,0 days 00:00:19.597586,False,absolute_error,50,sqrt,2,7,723,TPESampler,COMPLETE
2193,0.42116509045917244,2025-04-24 23:32:24.677144,2025-04-24 23:32:40.408855,0 days 00:00:15.731711,False,absolute_error,39,sqrt,2,3,647,TPESampler,COMPLETE
2194,0.3325318416707665,2025-04-24 23:32:25.996381,2025-04-24 23:32:52.947376,0 days 00:00:26.950995,False,absolute_error,50,sqrt,1,3,708,TPESampler,COMPLETE
2195,0.32559607009765956,2025-04-24 23:32:29.816589,2025-04-24 23:32:56.347102,0 days 00:00:26.530513,False,absolute_error,50,sqrt,1,5,660,TPESampler,COMPLETE
2196,0.32739719077277973,2025-04-24 23:32:36.816302,2025-04-24 23:32:54.752974,0 days 00:00:17.936672,False,absolute_error,50,sqrt,1,4,469,TPESampler,COMPLETE
2197,0.33587720055698983,2025-04-24 23:32:40.599752,2025-04-24 23:32:58.668010,0 days 00:00:18.068258,False,absolute_error,45,sqrt,1,3,471,TPESampler,COMPLETE
2198,0.3413397426554269,2025-04-24 23:32:43.662030,2025-04-24 23:32:55.043493,0 days 00:00:11.381463,False,absolute_error,41,sqrt,1,6,278,TPESampler,COMPLETE
2199,0.4210448257250391,2025-04-24 23:32:45.676608,2025-04-24 23:33:02.638807,0 days 00:00:16.962199,False,absolute_error,50,sqrt,2,5,656,TPESampler,COMPLETE
2200,0.4464874635022649,2025-04-24 23:32:53.350013,2025-04-24 23:34:58.380810,0 days 00:02:05.030797,False,absolute_error,50,,1,6,547,TPESampler,COMPLETE
2201,0.3316731825325802,2025-04-24 23:32:54.953293,2025-04-24 23:33:19.185619,0 days 00:00:24.232326,False,absolute_error,50,sqrt,1,3,627,TPESampler,COMPLETE
2202,0.4714515225430348,2025-04-24 23:32:55.381133,2025-04-24 23:33:36.376996,0 days 00:00:40.995863,False,absolute_error,21,,9,20,851,TPESampler,COMPLETE
2203,0.4170364490470427,2025-04-24 23:32:56.747893,2025-04-24 23:33:09.684432,0 days 00:00:12.936539,False,absolute_error,43,sqrt,2,3,505,TPESampler,COMPLETE
2204,0.5239037872748256,2025-04-24 23:32:58.869857,2025-04-24 23:33:08.647793,0 days 00:00:09.777936,False,absolute_error,22,sqrt,4,32,669,TPESampler,COMPLETE
2205,0.4531015400012698,2025-04-24 23:33:02.832357,2025-04-24 23:33:04.009715,0 days 00:00:01.177358,True,squared_error,7,,1,12,179,TPESampler,COMPLETE
2206,0.3315027727688001,2025-04-24 23:33:04.259403,2025-04-24 23:33:28.069100,0 days 00:00:23.809697,False,absolute_error,44,sqrt,1,4,650,TPESampler,COMPLETE
2207,0.41560058166556335,2025-04-24 23:33:08.833966,2025-04-24 23:33:23.559066,0 days 00:00:14.725100,False,absolute_error,49,sqrt,2,4,548,TPESampler,COMPLETE
2208,0.3314296291561198,2025-04-24 23:33:09.879604,2025-04-24 23:33:30.375654,0 days 00:00:20.496050,False,absolute_error,44,sqrt,1,4,504,TPESampler,COMPLETE
2209,0.3410396878717989,2025-04-24 23:33:19.387630,2025-04-24 23:33:39.811426,0 days 00:00:20.423796,False,absolute_error,42,sqrt,1,6,538,TPESampler,COMPLETE
