number,value,datetime_start,datetime_complete,duration,params_bootstrap,params_criterion,params_max_depth,params_max_features,params_min_samples_leaf,params_min_samples_split,params_n_estimators,system_attrs_auto:sampler,state
692,0.6193279240348667,2025-04-24 22:03:59.149181,2025-04-24 22:04:08.309779,0 days 00:00:09.160598,False,absolute_error,48,log2,2,2,734,TPESampler,COMPLETE
693,0.5267352789273412,2025-04-24 22:04:00.568468,2025-04-24 22:04:15.879253,0 days 00:00:15.310785,True,absolute_error,44,,12,23,926,TPESampler,COMPLETE
694,0.4387434954325848,2025-04-24 22:04:00.972068,2025-04-24 22:04:06.326903,0 days 00:00:05.354835,False,squared_error,40,,3,3,697,TPESampler,COMPLETE
695,0.7641676044556507,2025-04-24 22:04:01.877744,2025-04-24 22:04:03.146648,0 days 00:00:01.268904,False,squared_error,11,log2,4,39,881,TPESampler,COMPLETE
696,0.4178575351816242,2025-04-24 22:04:03.292980,2025-04-24 22:04:14.903331,0 days 00:00:11.610351,False,absolute_error,40,sqrt,2,3,446,TPESampler,COMPLETE
697,0.42097149693747665,2025-04-24 22:04:03.347656,2025-04-24 22:04:22.643950,0 days 00:00:19.296294,False,absolute_error,50,sqrt,2,5,733,TPESampler,COMPLETE
698,0.45567128552943104,2025-04-24 22:04:06.497502,2025-04-24 22:04:07.712452,0 days 00:00:01.214950,True,squared_error,12,,1,44,189,TPESampler,COMPLETE
699,0.33577951254083366,2025-04-24 22:04:07.896435,2025-04-24 22:04:27.215487,0 days 00:00:19.319052,False,absolute_error,50,sqrt,1,7,503,TPESampler,COMPLETE
700,0.8775335370517444,2025-04-24 22:04:08.577000,2025-04-24 22:04:09.261293,0 days 00:00:00.684293,True,squared_error,18,log2,15,11,108,TPESampler,COMPLETE
701,0.41351099680109094,2025-04-24 22:04:09.439902,2025-04-24 22:06:16.517506,0 days 00:02:07.077604,False,absolute_error,38,,2,2,921,TPESampler,COMPLETE
702,0.3354074076138678,2025-04-24 22:04:15.166782,2025-04-24 22:04:40.349040,0 days 00:00:25.182258,False,absolute_error,50,sqrt,1,7,653,TPESampler,COMPLETE
703,0.34608032124834043,2025-04-24 22:04:16.067285,2025-04-24 22:04:49.326319,0 days 00:00:33.259034,False,absolute_error,41,sqrt,1,7,916,TPESampler,COMPLETE
704,0.3314759014402574,2025-04-24 22:04:21.321154,2025-04-24 22:04:46.190405,0 days 00:00:24.869251,False,absolute_error,50,sqrt,1,6,639,TPESampler,COMPLETE
705,0.47993198341147225,2025-04-24 22:04:22.823492,2025-04-24 22:05:29.448500,0 days 00:01:06.625008,False,absolute_error,39,,1,37,308,TPESampler,COMPLETE
706,0.6615434193996433,2025-04-24 22:04:27.420611,2025-04-24 22:04:41.177245,0 days 00:00:13.756634,False,absolute_error,6,sqrt,1,4,990,TPESampler,COMPLETE
707,0.40939441923394604,2025-04-24 22:04:40.524669,2025-04-24 22:06:38.582853,0 days 00:01:58.058184,False,absolute_error,50,,2,5,822,TPESampler,COMPLETE
708,0.33190593906010746,2025-04-24 22:04:41.610248,2025-04-24 22:05:01.170720,0 days 00:00:19.560472,False,absolute_error,50,sqrt,1,3,475,TPESampler,COMPLETE
709,0.34586593814408717,2025-04-24 22:04:46.370162,2025-04-24 22:05:12.903835,0 days 00:00:26.533673,False,absolute_error,42,sqrt,1,7,732,TPESampler,COMPLETE
710,0.8732156690162363,2025-04-24 22:04:49.499303,2025-04-24 22:04:50.482986,0 days 00:00:00.983683,True,squared_error,26,log2,14,2,407,TPESampler,COMPLETE
711,0.32630246053817663,2025-04-24 22:04:50.667047,2025-04-24 22:05:14.497884,0 days 00:00:23.830837,False,absolute_error,50,sqrt,1,4,616,TPESampler,COMPLETE
712,0.33908957825757835,2025-04-24 22:05:01.359946,2025-04-24 22:05:28.866492,0 days 00:00:27.506546,False,absolute_error,41,sqrt,1,3,745,TPESampler,COMPLETE
713,0.33200078434533875,2025-04-24 22:05:13.088830,2025-04-24 22:05:41.391142,0 days 00:00:28.302312,False,absolute_error,50,sqrt,1,6,764,TPESampler,COMPLETE
714,0.42145079006388386,2025-04-24 22:05:14.683625,2025-04-24 22:05:31.105841,0 days 00:00:16.422216,False,absolute_error,50,sqrt,2,6,671,TPESampler,COMPLETE
715,0.3413033706965499,2025-04-24 22:05:29.088332,2025-04-24 22:06:02.831916,0 days 00:00:33.743584,False,absolute_error,42,sqrt,1,6,823,TPESampler,COMPLETE
716,0.5548506800944658,2025-04-24 22:05:29.685316,2025-04-24 22:05:41.795030,0 days 00:00:12.109714,True,absolute_error,22,log2,1,11,939,TPESampler,COMPLETE
717,0.466746236568579,2025-04-24 22:05:31.283900,2025-04-24 22:05:40.308233,0 days 00:00:09.024333,False,absolute_error,47,,6,11,142,TPESampler,COMPLETE
718,0.7766625361029087,2025-04-24 22:05:40.472773,2025-04-24 22:05:41.352785,0 days 00:00:00.880012,True,squared_error,48,log2,3,5,105,TPESampler,COMPLETE
719,0.33345053646756334,2025-04-24 22:05:41.491348,2025-04-24 22:06:09.370177,0 days 00:00:27.878829,False,absolute_error,42,sqrt,1,4,700,TPESampler,COMPLETE
720,0.5198407894606423,2025-04-24 22:05:41.552796,2025-04-24 22:05:43.721829,0 days 00:00:02.169033,True,squared_error,48,sqrt,3,40,869,TPESampler,COMPLETE
721,0.3329650976799143,2025-04-24 22:05:42.000457,2025-04-24 22:06:16.284044,0 days 00:00:34.283587,False,absolute_error,50,sqrt,1,3,766,TPESampler,COMPLETE
722,0.3331036785410614,2025-04-24 22:05:43.915644,2025-04-24 22:06:20.520381,0 days 00:00:36.604737,False,absolute_error,42,sqrt,1,5,881,TPESampler,COMPLETE
723,0.7340272121171265,2025-04-24 22:06:03.009763,2025-04-24 22:06:05.668655,0 days 00:00:02.658892,False,absolute_error,50,sqrt,11,13,507,TPESampler,COMPLETE
724,0.32550623999941397,2025-04-24 22:06:06.066065,2025-04-24 22:06:32.358719,0 days 00:00:26.292654,False,absolute_error,50,sqrt,1,5,697,TPESampler,COMPLETE
725,0.3571272890862409,2025-04-24 22:06:09.550316,2025-04-24 22:06:29.843029,0 days 00:00:20.292713,True,absolute_error,49,sqrt,1,5,801,TPESampler,COMPLETE
726,0.3342622021047295,2025-04-24 22:06:16.475667,2025-04-24 22:06:18.819801,0 days 00:00:02.344134,False,squared_error,46,sqrt,1,5,640,TPESampler,COMPLETE
727,0.326786715183805,2025-04-24 22:06:16.770262,2025-04-24 22:06:42.888156,0 days 00:00:26.117894,False,absolute_error,50,sqrt,1,4,693,TPESampler,COMPLETE
728,0.41301035344661574,2025-04-24 22:06:19.000332,2025-04-24 22:07:18.748098,0 days 00:00:59.747766,False,absolute_error,48,,2,3,413,TPESampler,COMPLETE
729,0.42096837117604113,2025-04-24 22:06:20.824243,2025-04-24 22:06:44.489569,0 days 00:00:23.665326,False,absolute_error,40,sqrt,2,2,838,TPESampler,COMPLETE
730,0.347950930667468,2025-04-24 22:06:30.016134,2025-04-24 22:06:59.937061,0 days 00:00:29.920927,False,absolute_error,46,sqrt,1,9,821,TPESampler,COMPLETE
731,0.3473485565915058,2025-04-24 22:06:32.532591,2025-04-24 22:06:53.720753,0 days 00:00:21.188162,False,absolute_error,42,sqrt,1,2,552,TPESampler,COMPLETE
732,0.41876019217711097,2025-04-24 22:06:38.774186,2025-04-24 22:06:58.875765,0 days 00:00:20.101579,False,absolute_error,44,sqrt,2,4,688,TPESampler,COMPLETE
733,0.3453923891048675,2025-04-24 22:06:43.075104,2025-04-24 22:07:12.658303,0 days 00:00:29.583199,False,absolute_error,41,sqrt,1,7,704,TPESampler,COMPLETE
734,0.3331647720105079,2025-04-24 22:06:44.777604,2025-04-24 22:07:14.832860,0 days 00:00:30.055256,False,absolute_error,50,sqrt,1,3,781,TPESampler,COMPLETE
735,0.332055974850596,2025-04-24 22:06:53.896085,2025-04-24 22:07:22.728832,0 days 00:00:28.832747,False,absolute_error,50,sqrt,1,6,771,TPESampler,COMPLETE
736,0.3257493103924213,2025-04-24 22:06:59.061933,2025-04-24 22:07:33.516202,0 days 00:00:34.454269,False,absolute_error,50,sqrt,1,5,896,TPESampler,COMPLETE
737,0.47772697073635245,2025-04-24 22:07:00.109511,2025-04-24 22:07:02.847662,0 days 00:00:02.738151,False,squared_error,11,,9,27,521,TPESampler,COMPLETE
738,0.7589842447120829,2025-04-24 22:07:03.021371,2025-04-24 22:07:06.024129,0 days 00:00:03.002758,True,absolute_error,26,sqrt,8,21,935,TPESampler,COMPLETE
739,0.36475793456633226,2025-04-24 22:07:06.309157,2025-04-24 22:07:31.669249,0 days 00:00:25.360092,False,absolute_error,49,log2,1,3,837,TPESampler,COMPLETE
740,0.3850213816138349,2025-04-24 22:07:13.097937,2025-04-24 22:07:14.512982,0 days 00:00:01.415045,True,squared_error,42,sqrt,1,10,443,TPESampler,COMPLETE
741,0.419763156533085,2025-04-24 22:07:14.699985,2025-04-24 22:07:32.844267,0 days 00:00:18.144282,False,absolute_error,42,sqrt,2,4,742,TPESampler,COMPLETE
742,0.3354324390538972,2025-04-24 22:07:15.022280,2025-04-24 22:07:37.320904,0 days 00:00:22.298624,False,absolute_error,50,sqrt,1,7,593,TPESampler,COMPLETE
743,0.3421355427541635,2025-04-24 22:07:18.927785,2025-04-24 22:07:49.919653,0 days 00:00:30.991868,False,absolute_error,50,sqrt,1,8,847,TPESampler,COMPLETE
744,0.3286128610715897,2025-04-24 22:07:22.906030,2025-04-24 22:07:38.849532,0 days 00:00:15.943502,False,absolute_error,44,sqrt,1,4,386,TPESampler,COMPLETE
745,0.33227364262232933,2025-04-24 22:07:31.844487,2025-04-24 22:08:01.967881,0 days 00:00:30.123394,False,absolute_error,50,sqrt,1,6,804,TPESampler,COMPLETE
746,0.42439481536008905,2025-04-24 22:07:33.039054,2025-04-24 22:07:51.010264,0 days 00:00:17.971210,False,absolute_error,50,sqrt,2,8,740,TPESampler,COMPLETE
747,0.8305622102709874,2025-04-24 22:07:33.884568,2025-04-24 22:07:34.852674,0 days 00:00:00.968106,True,absolute_error,8,sqrt,15,2,223,TPESampler,COMPLETE
748,0.32491239834779434,2025-04-24 22:07:35.022021,2025-04-24 22:07:54.229381,0 days 00:00:19.207360,False,absolute_error,49,sqrt,1,4,509,TPESampler,COMPLETE
749,0.3265614229183384,2025-04-24 22:07:37.507233,2025-04-24 22:08:00.214549,0 days 00:00:22.707316,False,absolute_error,50,sqrt,1,4,604,TPESampler,COMPLETE
750,0.32534108127099237,2025-04-24 22:07:39.023155,2025-04-24 22:08:07.093910,0 days 00:00:28.070755,False,absolute_error,50,sqrt,1,5,749,TPESampler,COMPLETE
751,0.4349811060847295,2025-04-24 22:07:50.275572,2025-04-24 22:08:20.394711,0 days 00:00:30.119139,True,absolute_error,11,,4,10,649,TPESampler,COMPLETE
752,0.3332275336221477,2025-04-24 22:07:51.455992,2025-04-24 22:08:25.013042,0 days 00:00:33.557050,False,absolute_error,50,sqrt,1,3,857,TPESampler,COMPLETE
753,0.3322131295764527,2025-04-24 22:07:54.587642,2025-04-24 22:08:18.051445,0 days 00:00:23.463803,False,absolute_error,42,sqrt,1,5,525,TPESampler,COMPLETE
754,0.5240621716494014,2025-04-24 22:08:00.411888,2025-04-24 22:08:02.191660,0 days 00:00:01.779772,False,squared_error,12,sqrt,1,6,923,TPESampler,COMPLETE
755,0.7351014813739217,2025-04-24 22:08:02.144715,2025-04-24 22:08:06.043984,0 days 00:00:03.899269,True,absolute_error,48,sqrt,7,17,892,TPESampler,COMPLETE
756,0.8488494180849083,2025-04-24 22:08:02.408457,2025-04-24 22:08:04.013777,0 days 00:00:01.605320,False,squared_error,7,log2,8,3,998,TPESampler,COMPLETE
757,0.34338521149279877,2025-04-24 22:08:04.206718,2025-04-24 22:08:21.471608,0 days 00:00:17.264890,False,absolute_error,45,sqrt,1,2,432,TPESampler,COMPLETE
758,0.32694946327429586,2025-04-24 22:08:06.206497,2025-04-24 22:08:18.928601,0 days 00:00:12.722104,False,absolute_error,49,sqrt,1,5,331,TPESampler,COMPLETE
759,0.33219477268127284,2025-04-24 22:08:07.257097,2025-04-24 22:08:24.063234,0 days 00:00:16.806137,False,absolute_error,43,sqrt,1,5,450,TPESampler,COMPLETE
760,0.7773025312217889,2025-04-24 22:08:18.231712,2025-04-24 22:08:20.479941,0 days 00:00:02.248229,True,absolute_error,29,log2,3,7,459,TPESampler,COMPLETE
761,0.3251178524043358,2025-04-24 22:08:19.106822,2025-04-24 22:08:37.877918,0 days 00:00:18.771096,False,absolute_error,49,sqrt,1,4,490,TPESampler,COMPLETE
762,0.35694064402639886,2025-04-24 22:08:20.635663,2025-04-24 22:08:23.137965,0 days 00:00:02.502302,False,squared_error,49,sqrt,1,12,700,TPESampler,COMPLETE
763,0.8679062673906225,2025-04-24 22:08:20.708851,2025-04-24 22:08:22.227632,0 days 00:00:01.518781,True,squared_error,45,log2,11,34,428,TPESampler,COMPLETE
764,0.4835492503857518,2025-04-24 22:08:21.765153,2025-04-24 22:08:37.974094,0 days 00:00:16.208941,True,absolute_error,29,,9,11,792,TPESampler,COMPLETE
765,0.7651455378144111,2025-04-24 22:08:22.456961,2025-04-24 22:08:23.192395,0 days 00:00:00.735434,False,squared_error,31,log2,4,22,232,TPESampler,COMPLETE
766,0.3252042948274954,2025-04-24 22:08:23.267481,2025-04-24 22:08:45.729925,0 days 00:00:22.462444,False,absolute_error,50,sqrt,1,5,595,TPESampler,COMPLETE
767,0.42105157725854386,2025-04-24 22:08:23.337445,2025-04-24 22:08:39.052581,0 days 00:00:15.715136,False,absolute_error,45,sqrt,2,5,626,TPESampler,COMPLETE
768,0.4173952854267305,2025-04-24 22:08:24.290171,2025-04-24 22:08:39.920545,0 days 00:00:15.630374,False,absolute_error,46,sqrt,2,3,629,TPESampler,COMPLETE
769,0.4156301175167512,2025-04-24 22:08:25.185669,2025-04-24 22:08:35.043928,0 days 00:00:09.858259,False,absolute_error,46,sqrt,2,4,396,TPESampler,COMPLETE
770,0.6243398242781182,2025-04-24 22:08:35.229493,2025-04-24 22:08:42.275997,0 days 00:00:07.046504,False,absolute_error,49,log2,2,7,587,TPESampler,COMPLETE
771,0.3367970213631546,2025-04-24 22:08:38.026714,2025-04-24 22:08:55.405515,0 days 00:00:17.378801,False,absolute_error,41,sqrt,1,4,461,TPESampler,COMPLETE
772,0.33419802640848234,2025-04-24 22:08:38.175654,2025-04-24 22:09:00.105550,0 days 00:00:21.929896,False,absolute_error,49,sqrt,1,3,566,TPESampler,COMPLETE
773,0.33388534490740174,2025-04-24 22:08:39.239406,2025-04-24 22:08:54.921454,0 days 00:00:15.682048,False,absolute_error,47,sqrt,1,3,368,TPESampler,COMPLETE
774,0.4201414782937399,2025-04-24 22:08:40.100489,2025-04-24 22:08:41.564278,0 days 00:00:01.463789,False,squared_error,40,sqrt,2,4,550,TPESampler,COMPLETE
775,0.3328899021634743,2025-04-24 22:08:41.735574,2025-04-24 22:09:02.470478,0 days 00:00:20.734904,False,absolute_error,42,sqrt,1,4,563,TPESampler,COMPLETE
776,0.4184674023209617,2025-04-24 22:08:42.465144,2025-04-24 22:08:52.750520,0 days 00:00:10.285376,False,absolute_error,49,sqrt,2,5,361,TPESampler,COMPLETE
777,0.8084296043377898,2025-04-24 22:08:45.903167,2025-04-24 22:08:47.109396,0 days 00:00:01.206229,True,squared_error,40,sqrt,12,12,616,TPESampler,COMPLETE
778,0.42481323304501223,2025-04-24 22:08:47.282972,2025-04-24 22:08:57.739116,0 days 00:00:10.456144,False,absolute_error,48,sqrt,2,12,393,TPESampler,COMPLETE
779,0.43906676615604073,2025-04-24 22:08:52.941897,2025-04-24 22:09:02.749275,0 days 00:00:09.807378,True,absolute_error,24,sqrt,1,12,481,TPESampler,COMPLETE
780,0.3388105568612233,2025-04-24 22:08:55.089276,2025-04-24 22:09:16.259789,0 days 00:00:21.170513,False,absolute_error,43,sqrt,1,3,556,TPESampler,COMPLETE
781,0.339562198559079,2025-04-24 22:08:55.637604,2025-04-24 22:09:13.584656,0 days 00:00:17.947052,False,absolute_error,45,sqrt,1,7,483,TPESampler,COMPLETE
782,0.4156385616007627,2025-04-24 22:08:57.920736,2025-04-24 22:09:10.569333,0 days 00:00:12.648597,False,absolute_error,46,sqrt,2,4,489,TPESampler,COMPLETE
783,0.42005620760117607,2025-04-24 22:09:00.290482,2025-04-24 22:09:14.234758,0 days 00:00:13.944276,False,absolute_error,47,sqrt,2,5,562,TPESampler,COMPLETE
784,0.37343664589190007,2025-04-24 22:09:02.641329,2025-04-24 22:09:15.131149,0 days 00:00:12.489820,True,absolute_error,37,sqrt,1,5,610,TPESampler,COMPLETE
785,0.33141714865498223,2025-04-24 22:09:02.933283,2025-04-24 22:09:20.283755,0 days 00:00:17.350472,False,absolute_error,50,sqrt,1,3,442,TPESampler,COMPLETE
786,0.3305348312624,2025-04-24 22:09:10.755884,2025-04-24 22:09:32.022951,0 days 00:00:21.267067,False,absolute_error,46,sqrt,1,5,465,TPESampler,COMPLETE
787,0.3341654098341963,2025-04-24 22:09:13.790131,2025-04-24 22:09:40.400832,0 days 00:00:26.610701,False,absolute_error,49,sqrt,1,3,567,TPESampler,COMPLETE
788,0.33695869897138636,2025-04-24 22:09:14.666759,2025-04-24 22:09:35.068448,0 days 00:00:20.401689,False,absolute_error,47,sqrt,1,7,548,TPESampler,COMPLETE
789,0.33502621172256314,2025-04-24 22:09:15.413832,2025-04-24 22:09:39.827903,0 days 00:00:24.414071,False,absolute_error,46,sqrt,1,6,536,TPESampler,COMPLETE
790,0.3427916778709713,2025-04-24 22:09:16.445827,2025-04-24 22:09:37.125726,0 days 00:00:20.679899,False,absolute_error,50,sqrt,1,9,564,TPESampler,COMPLETE
791,0.33224848723522005,2025-04-24 22:09:20.570255,2025-04-24 22:09:44.148849,0 days 00:00:23.578594,False,absolute_error,50,sqrt,1,3,519,TPESampler,COMPLETE
792,0.41675557055692736,2025-04-24 22:09:32.226930,2025-04-24 22:09:33.395611,0 days 00:00:01.168681,True,squared_error,40,,1,45,142,TPESampler,COMPLETE
793,0.35869653093107234,2025-04-24 22:09:33.566551,2025-04-24 22:09:42.999158,0 days 00:00:09.432607,True,absolute_error,44,sqrt,1,2,410,TPESampler,COMPLETE
794,0.4328951794032961,2025-04-24 22:09:35.257793,2025-04-24 22:09:38.560741,0 days 00:00:03.302948,True,squared_error,10,,3,3,742,TPESampler,COMPLETE
795,0.3853191791358807,2025-04-24 22:09:37.307443,2025-04-24 22:09:43.161555,0 days 00:00:05.854112,False,squared_error,20,,2,7,828,TPESampler,COMPLETE
796,0.4548742578594456,2025-04-24 22:09:38.764603,2025-04-24 22:09:40.056660,0 days 00:00:01.292057,False,squared_error,49,sqrt,3,2,505,TPESampler,COMPLETE
797,0.41586576985440915,2025-04-24 22:09:40.006215,2025-04-24 22:09:52.169507,0 days 00:00:12.163292,False,absolute_error,50,sqrt,2,3,472,TPESampler,COMPLETE
798,0.441310099481105,2025-04-24 22:09:40.315894,2025-04-24 22:11:42.915477,0 days 00:02:02.599583,False,absolute_error,48,,1,7,488,TPESampler,COMPLETE
799,0.32479336526310987,2025-04-24 22:09:40.884875,2025-04-24 22:10:03.763038,0 days 00:00:22.878163,False,absolute_error,49,sqrt,1,4,593,TPESampler,COMPLETE
800,0.5994285795512544,2025-04-24 22:09:43.167298,2025-04-24 22:09:44.980007,0 days 00:00:01.812709,False,squared_error,9,sqrt,2,18,805,TPESampler,COMPLETE
801,0.3359530900255558,2025-04-24 22:09:43.347284,2025-04-24 22:10:09.233264,0 days 00:00:25.885980,False,absolute_error,50,sqrt,1,7,537,TPESampler,COMPLETE
802,0.32612429208508203,2025-04-24 22:09:44.526106,2025-04-24 22:10:09.471067,0 days 00:00:24.944961,False,absolute_error,50,sqrt,1,5,490,TPESampler,COMPLETE
803,0.3272422647836658,2025-04-24 22:09:45.305851,2025-04-24 22:10:11.912879,0 days 00:00:26.607028,False,absolute_error,50,sqrt,1,4,556,TPESampler,COMPLETE
804,0.385911566072556,2025-04-24 22:09:52.335873,2025-04-24 22:09:54.105135,0 days 00:00:01.769262,False,squared_error,24,sqrt,1,3,534,TPESampler,COMPLETE
805,0.4480269212918778,2025-04-24 22:09:54.280491,2025-04-24 22:09:56.634347,0 days 00:00:02.353856,False,squared_error,12,,1,6,325,TPESampler,COMPLETE
806,0.375641904768579,2025-04-24 22:09:56.810709,2025-04-24 22:10:29.018389,0 days 00:00:32.207680,False,absolute_error,26,sqrt,1,4,648,TPESampler,COMPLETE
807,0.4315326683542631,2025-04-24 22:10:04.014622,2025-04-24 22:10:25.505946,0 days 00:00:21.491324,False,absolute_error,40,sqrt,2,13,568,TPESampler,COMPLETE
808,0.77744730572399,2025-04-24 22:10:09.429162,2025-04-24 22:10:10.960152,0 days 00:00:01.530990,True,squared_error,36,log2,3,11,667,TPESampler,COMPLETE
809,0.3374951593238233,2025-04-24 22:10:09.741561,2025-04-24 22:10:30.249275,0 days 00:00:20.507714,False,absolute_error,39,sqrt,1,4,560,TPESampler,COMPLETE
810,0.33407237674722573,2025-04-24 22:10:11.134358,2025-04-24 22:10:33.067851,0 days 00:00:21.933493,False,absolute_error,49,sqrt,1,3,573,TPESampler,COMPLETE
811,0.3462822787029994,2025-04-24 22:10:12.093270,2025-04-24 22:10:24.885375,0 days 00:00:12.792105,False,absolute_error,49,sqrt,1,10,333,TPESampler,COMPLETE
812,0.33368515458176107,2025-04-24 22:10:25.069605,2025-04-24 22:10:53.252155,0 days 00:00:28.182550,False,absolute_error,49,sqrt,1,6,571,TPESampler,COMPLETE
813,0.4171139177794455,2025-04-24 22:10:25.733774,2025-04-24 22:10:40.569440,0 days 00:00:14.835666,False,absolute_error,50,sqrt,2,3,601,TPESampler,COMPLETE
814,0.33472161824739904,2025-04-24 22:10:29.190824,2025-04-24 22:10:55.006617,0 days 00:00:25.815793,False,absolute_error,41,sqrt,1,4,712,TPESampler,COMPLETE
815,0.32647922794805534,2025-04-24 22:10:30.432613,2025-04-24 22:11:03.130618,0 days 00:00:32.698005,False,absolute_error,50,sqrt,1,4,627,TPESampler,COMPLETE
816,0.46849294802083863,2025-04-24 22:10:33.334529,2025-04-24 22:11:50.620938,0 days 00:01:17.286409,False,absolute_error,37,,3,4,606,TPESampler,COMPLETE
817,0.4063260768249972,2025-04-24 22:10:40.811157,2025-04-24 22:11:26.233650,0 days 00:00:45.422493,True,absolute_error,44,,1,40,382,TPESampler,COMPLETE
818,0.4479011287099763,2025-04-24 22:10:53.428416,2025-04-24 22:13:37.390564,0 days 00:02:43.962148,False,absolute_error,50,,1,5,712,TPESampler,COMPLETE
819,0.3249651198627849,2025-04-24 22:10:55.186763,2025-04-24 22:11:17.649118,0 days 00:00:22.462355,False,absolute_error,50,sqrt,1,5,603,TPESampler,COMPLETE
820,0.41683961887443144,2025-04-24 22:11:03.312962,2025-04-24 22:11:17.791765,0 days 00:00:14.478803,False,absolute_error,50,sqrt,2,4,590,TPESampler,COMPLETE
821,0.4379330172613755,2025-04-24 22:11:17.840537,2025-04-24 22:11:19.413454,0 days 00:00:01.572917,True,squared_error,25,sqrt,1,18,606,TPESampler,COMPLETE
822,0.32818159430756233,2025-04-24 22:11:17.986226,2025-04-24 22:11:40.432941,0 days 00:00:22.446715,False,absolute_error,49,sqrt,1,5,561,TPESampler,COMPLETE
823,0.3262863282176574,2025-04-24 22:11:19.595524,2025-04-24 22:11:39.813313,0 days 00:00:20.217789,False,absolute_error,50,sqrt,1,5,533,TPESampler,COMPLETE
824,0.36363092006536946,2025-04-24 22:11:26.405694,2025-04-24 22:11:37.690810,0 days 00:00:11.285116,False,absolute_error,35,sqrt,1,8,317,TPESampler,COMPLETE
825,0.3284989462486632,2025-04-24 22:11:37.892418,2025-04-24 22:11:57.140194,0 days 00:00:19.247776,False,absolute_error,49,sqrt,1,5,498,TPESampler,COMPLETE
826,0.3499283109016298,2025-04-24 22:11:40.012759,2025-04-24 22:11:51.546585,0 days 00:00:11.533826,True,absolute_error,50,sqrt,1,3,472,TPESampler,COMPLETE
827,0.46576691740735976,2025-04-24 22:11:40.671404,2025-04-24 22:11:46.284661,0 days 00:00:05.613257,True,absolute_error,24,sqrt,1,49,259,TPESampler,COMPLETE
828,0.37712255169710773,2025-04-24 22:11:43.094931,2025-04-24 22:11:48.785871,0 days 00:00:05.690940,True,squared_error,23,,1,9,997,TPESampler,COMPLETE
829,0.3277068750814185,2025-04-24 22:11:46.473173,2025-04-24 22:12:05.659059,0 days 00:00:19.185886,False,absolute_error,50,sqrt,1,4,502,TPESampler,COMPLETE
830,0.3579880924067697,2025-04-24 22:11:48.986177,2025-04-24 22:12:12.044391,0 days 00:00:23.058214,False,absolute_error,38,sqrt,1,8,626,TPESampler,COMPLETE
