number,value,datetime_start,datetime_complete,duration,params_bootstrap,params_criterion,params_max_depth,params_max_features,params_min_samples_leaf,params_min_samples_split,params_n_estimators,system_attrs_auto:sampler,state
2210,0.600350568212799,2025-04-24 23:33:23.757592,2025-04-24 23:33:30.295017,0 days 00:00:06.537425,False,absolute_error,45,sqrt,6,7,697,TPESampler,COMPLETE
2211,0.41411906198675585,2025-04-24 23:33:28.260955,2025-04-24 23:33:34.213680,0 days 00:00:05.952725,False,absolute_error,39,log2,1,6,214,TPESampler,COMPLETE
2212,0.42657262063774776,2025-04-24 23:33:30.487560,2025-04-24 23:33:44.153048,0 days 00:00:13.665488,False,absolute_error,50,sqrt,2,12,500,TPESampler,COMPLETE
2213,0.32637641512563803,2025-04-24 23:33:30.615560,2025-04-24 23:33:55.255049,0 days 00:00:24.639489,False,absolute_error,50,sqrt,1,4,618,TPESampler,COMPLETE
2214,0.7505901693133356,2025-04-24 23:33:34.416069,2025-04-24 23:33:36.264920,0 days 00:00:01.848851,False,absolute_error,37,sqrt,12,23,340,TPESampler,COMPLETE
2215,0.34007200243795294,2025-04-24 23:33:36.474259,2025-04-24 23:34:02.001758,0 days 00:00:25.527499,False,absolute_error,44,sqrt,1,7,679,TPESampler,COMPLETE
2216,0.40914692523746926,2025-04-24 23:33:36.579696,2025-04-24 23:35:01.633138,0 days 00:01:25.053442,False,absolute_error,43,,2,5,625,TPESampler,COMPLETE
2217,0.33239570298732757,2025-04-24 23:33:40.002203,2025-04-24 23:34:00.414810,0 days 00:00:20.412607,False,absolute_error,42,sqrt,1,5,565,TPESampler,COMPLETE
2218,0.3318380662301391,2025-04-24 23:33:44.356570,2025-04-24 23:34:04.548136,0 days 00:00:20.191566,False,absolute_error,50,sqrt,1,6,543,TPESampler,COMPLETE
2219,0.3246180249286896,2025-04-24 23:33:55.449127,2025-04-24 23:34:18.352180,0 days 00:00:22.903053,False,absolute_error,50,sqrt,1,5,615,TPESampler,COMPLETE
2220,0.4661956859508531,2025-04-24 23:34:00.606691,2025-04-24 23:35:24.705595,0 days 00:01:24.098904,False,absolute_error,32,,4,36,946,TPESampler,COMPLETE
2221,0.3329206224012286,2025-04-24 23:34:02.189900,2025-04-24 23:34:26.360623,0 days 00:00:24.170723,False,absolute_error,43,sqrt,1,5,667,TPESampler,COMPLETE
2222,0.35122437344801427,2025-04-24 23:34:04.740655,2025-04-24 23:34:29.095421,0 days 00:00:24.354766,False,absolute_error,33,sqrt,1,5,712,TPESampler,COMPLETE
2223,0.4213698082581871,2025-04-24 23:34:18.651223,2025-04-24 23:34:31.185671,0 days 00:00:12.534448,False,absolute_error,42,sqrt,2,7,504,TPESampler,COMPLETE
2224,0.42212550520548875,2025-04-24 23:34:26.548930,2025-04-24 23:34:44.217126,0 days 00:00:17.668196,False,absolute_error,43,sqrt,2,5,712,TPESampler,COMPLETE
2225,0.32797954061693396,2025-04-24 23:34:29.282275,2025-04-24 23:34:48.668849,0 days 00:00:19.386574,False,absolute_error,50,sqrt,1,4,511,TPESampler,COMPLETE
2226,0.3353769308942158,2025-04-24 23:34:31.374004,2025-04-24 23:34:53.745450,0 days 00:00:22.371446,False,absolute_error,50,sqrt,1,7,604,TPESampler,COMPLETE
2227,0.5873786037003609,2025-04-24 23:34:44.440162,2025-04-24 23:34:54.484650,0 days 00:00:10.044488,False,absolute_error,11,sqrt,4,10,673,TPESampler,COMPLETE
2228,0.41842275677175483,2025-04-24 23:34:48.889757,2025-04-24 23:35:03.344765,0 days 00:00:14.455008,False,absolute_error,42,sqrt,2,4,580,TPESampler,COMPLETE
2229,0.4156485678305189,2025-04-24 23:34:53.943035,2025-04-24 23:35:03.447104,0 days 00:00:09.504069,False,absolute_error,50,sqrt,2,2,373,TPESampler,COMPLETE
2230,0.41905106791934144,2025-04-24 23:34:54.716694,2025-04-24 23:35:06.661231,0 days 00:00:11.944537,False,absolute_error,50,sqrt,2,5,474,TPESampler,COMPLETE
2231,0.3359596304232718,2025-04-24 23:34:58.577231,2025-04-24 23:35:22.940511,0 days 00:00:24.363280,False,absolute_error,45,sqrt,1,3,648,TPESampler,COMPLETE
2232,0.33536381136465826,2025-04-24 23:35:01.820546,2025-04-24 23:35:25.912901,0 days 00:00:24.092355,False,absolute_error,50,sqrt,1,7,644,TPESampler,COMPLETE
2233,0.32575602372969575,2025-04-24 23:35:03.504332,2025-04-24 23:35:21.577729,0 days 00:00:18.073397,False,absolute_error,50,sqrt,1,5,471,TPESampler,COMPLETE
2234,0.33214785728883583,2025-04-24 23:35:03.624537,2025-04-24 23:35:25.035097,0 days 00:00:21.410560,False,absolute_error,50,sqrt,1,3,550,TPESampler,COMPLETE
2235,0.326079508747676,2025-04-24 23:35:06.858169,2025-04-24 23:35:23.439503,0 days 00:00:16.581334,False,absolute_error,50,sqrt,1,5,437,TPESampler,COMPLETE
2236,0.44892569604408417,2025-04-24 23:35:21.770679,2025-04-24 23:35:24.095322,0 days 00:00:02.324643,False,squared_error,34,,3,36,299,TPESampler,COMPLETE
2237,0.45941320844337613,2025-04-24 23:35:23.134947,2025-04-24 23:37:38.790258,0 days 00:02:15.655311,False,absolute_error,14,,1,9,725,TPESampler,COMPLETE
2238,0.32979530661597795,2025-04-24 23:35:23.642072,2025-04-24 23:35:32.274430,0 days 00:00:08.632358,False,absolute_error,43,sqrt,1,4,216,TPESampler,COMPLETE
2239,0.36727714398240413,2025-04-24 23:35:24.293185,2025-04-24 23:35:40.372176,0 days 00:00:16.078991,False,absolute_error,30,sqrt,1,2,428,TPESampler,COMPLETE
2240,0.3414262067431295,2025-04-24 23:35:24.988980,2025-04-24 23:35:49.875724,0 days 00:00:24.886744,False,absolute_error,50,sqrt,1,8,675,TPESampler,COMPLETE
2241,0.4199211422532851,2025-04-24 23:35:25.361410,2025-04-24 23:35:38.752753,0 days 00:00:13.391343,False,absolute_error,50,sqrt,2,5,537,TPESampler,COMPLETE
2242,0.3370201927135184,2025-04-24 23:35:26.257525,2025-04-24 23:35:50.533511,0 days 00:00:24.275986,False,absolute_error,44,sqrt,1,3,631,TPESampler,COMPLETE
2243,0.3357851184128148,2025-04-24 23:35:32.473806,2025-04-24 23:35:57.634886,0 days 00:00:25.161080,False,absolute_error,50,sqrt,1,7,684,TPESampler,COMPLETE
2244,0.3324595673570754,2025-04-24 23:35:38.941752,2025-04-24 23:35:55.854657,0 days 00:00:16.912905,False,absolute_error,42,sqrt,1,4,453,TPESampler,COMPLETE
2245,0.34130407154683284,2025-04-24 23:35:40.563766,2025-04-24 23:35:59.535044,0 days 00:00:18.971278,False,absolute_error,43,sqrt,1,7,511,TPESampler,COMPLETE
2246,0.3406034026991129,2025-04-24 23:35:50.079236,2025-04-24 23:36:12.941995,0 days 00:00:22.862759,False,absolute_error,43,sqrt,1,6,631,TPESampler,COMPLETE
2247,0.3270424277201201,2025-04-24 23:35:50.763999,2025-04-24 23:36:16.478242,0 days 00:00:25.714243,False,absolute_error,50,sqrt,1,4,677,TPESampler,COMPLETE
2248,0.7421252569872564,2025-04-24 23:35:56.042953,2025-04-24 23:35:58.903307,0 days 00:00:02.860354,False,absolute_error,11,log2,3,15,321,TPESampler,COMPLETE
2249,0.34419813016101225,2025-04-24 23:35:57.831546,2025-04-24 23:36:13.640300,0 days 00:00:15.808754,False,absolute_error,50,sqrt,1,2,397,TPESampler,COMPLETE
2250,0.678203669324392,2025-04-24 23:35:59.094902,2025-04-24 23:36:06.425224,0 days 00:00:07.330322,True,absolute_error,6,sqrt,1,31,686,TPESampler,COMPLETE
2251,0.3862326341353351,2025-04-24 23:35:59.823405,2025-04-24 23:36:19.138635,0 days 00:00:19.315230,False,absolute_error,44,log2,1,5,663,TPESampler,COMPLETE
2252,0.332337491092391,2025-04-24 23:36:06.618089,2025-04-24 23:36:32.442533,0 days 00:00:25.824444,False,absolute_error,50,sqrt,1,3,671,TPESampler,COMPLETE
2253,0.33210411921973526,2025-04-24 23:36:13.139066,2025-04-24 23:36:33.995867,0 days 00:00:20.856801,False,absolute_error,43,sqrt,1,4,561,TPESampler,COMPLETE
2254,0.32640305381948065,2025-04-24 23:36:13.978757,2025-04-24 23:36:35.778752,0 days 00:00:21.799995,False,absolute_error,50,sqrt,1,4,581,TPESampler,COMPLETE
2255,0.33122608665007763,2025-04-24 23:36:16.687778,2025-04-24 23:36:31.812080,0 days 00:00:15.124302,False,absolute_error,50,sqrt,1,3,388,TPESampler,COMPLETE
2256,0.4287575897056196,2025-04-24 23:36:19.327469,2025-04-24 23:36:20.915553,0 days 00:00:01.588084,False,squared_error,21,sqrt,1,9,628,TPESampler,COMPLETE
2257,0.35830047195636644,2025-04-24 23:36:21.110131,2025-04-24 23:36:23.138945,0 days 00:00:02.028814,True,squared_error,49,sqrt,1,5,631,TPESampler,COMPLETE
2258,0.41883705635541396,2025-04-24 23:36:23.328456,2025-04-24 23:36:40.323225,0 days 00:00:16.994769,False,absolute_error,44,sqrt,2,3,690,TPESampler,COMPLETE
2259,0.3556465916554465,2025-04-24 23:36:32.002013,2025-04-24 23:38:27.499776,0 days 00:01:55.497763,True,absolute_error,47,,1,2,691,TPESampler,COMPLETE
2260,0.33581878816934496,2025-04-24 23:36:32.843754,2025-04-24 23:36:51.729560,0 days 00:00:18.885806,False,absolute_error,50,sqrt,1,7,448,TPESampler,COMPLETE
2261,0.7024553102520441,2025-04-24 23:36:34.212070,2025-04-24 23:36:35.685733,0 days 00:00:01.473663,False,squared_error,17,sqrt,9,6,985,TPESampler,COMPLETE
2262,0.3332674589323993,2025-04-24 23:36:35.848518,2025-04-24 23:37:05.181406,0 days 00:00:29.332888,False,absolute_error,42,sqrt,1,4,727,TPESampler,COMPLETE
2263,0.3450491822214076,2025-04-24 23:36:35.981169,2025-04-24 23:36:57.707917,0 days 00:00:21.726748,False,absolute_error,42,sqrt,1,7,595,TPESampler,COMPLETE
2264,0.32637869933670005,2025-04-24 23:36:40.512525,2025-04-24 23:37:02.882000,0 days 00:00:22.369475,False,absolute_error,50,sqrt,1,5,514,TPESampler,COMPLETE
2265,0.3373245317366938,2025-04-24 23:36:51.922581,2025-04-24 23:36:53.714408,0 days 00:00:01.791827,False,squared_error,50,sqrt,1,6,477,TPESampler,COMPLETE
2266,0.47296619323937666,2025-04-24 23:36:53.915848,2025-04-24 23:37:11.189015,0 days 00:00:17.273167,False,absolute_error,18,,10,3,393,TPESampler,COMPLETE
2267,0.32583240352557546,2025-04-24 23:36:57.901294,2025-04-24 23:37:21.355248,0 days 00:00:23.453954,False,absolute_error,50,sqrt,1,5,555,TPESampler,COMPLETE
2268,0.4174319986739968,2025-04-24 23:37:03.071380,2025-04-24 23:37:17.196300,0 days 00:00:14.124920,False,absolute_error,43,sqrt,2,3,516,TPESampler,COMPLETE
2269,0.5096424209142779,2025-04-24 23:37:05.381724,2025-04-24 23:37:33.559715,0 days 00:00:28.177991,False,absolute_error,27,,13,5,854,TPESampler,COMPLETE
2270,0.3255079188198105,2025-04-24 23:37:11.379267,2025-04-24 23:37:48.530756,0 days 00:00:37.151489,False,absolute_error,50,sqrt,1,5,725,TPESampler,COMPLETE
2271,0.3322119410023944,2025-04-24 23:37:17.385463,2025-04-24 23:37:44.336364,0 days 00:00:26.950901,False,absolute_error,43,sqrt,1,4,529,TPESampler,COMPLETE
2272,0.4195131848206483,2025-04-24 23:37:21.560007,2025-04-24 23:37:33.805723,0 days 00:00:12.245716,False,absolute_error,50,sqrt,2,6,489,TPESampler,COMPLETE
2273,0.326786715183805,2025-04-24 23:37:33.754108,2025-04-24 23:38:00.375793,0 days 00:00:26.621685,False,absolute_error,50,sqrt,1,4,693,TPESampler,COMPLETE
2274,0.5042427270508053,2025-04-24 23:37:34.055548,2025-04-24 23:37:35.994329,0 days 00:00:01.938781,False,squared_error,44,sqrt,4,17,884,TPESampler,COMPLETE
2275,0.4223095559122884,2025-04-24 23:37:36.184025,2025-04-24 23:37:51.797044,0 days 00:00:15.613019,False,absolute_error,43,sqrt,2,6,638,TPESampler,COMPLETE
2276,0.3321344896163152,2025-04-24 23:37:39.004738,2025-04-24 23:38:04.937685,0 days 00:00:25.932947,False,absolute_error,50,sqrt,1,6,700,TPESampler,COMPLETE
2277,0.3386297478204248,2025-04-24 23:37:44.761220,2025-04-24 23:38:21.287376,0 days 00:00:36.526156,False,absolute_error,40,sqrt,1,3,714,TPESampler,COMPLETE
2278,0.3492425894448227,2025-04-24 23:37:48.804214,2025-04-24 23:38:18.352947,0 days 00:00:29.548733,False,absolute_error,43,sqrt,1,8,540,TPESampler,COMPLETE
2279,0.3264456042628282,2025-04-24 23:37:52.189523,2025-04-24 23:38:16.548027,0 days 00:00:24.358504,False,absolute_error,50,sqrt,1,4,638,TPESampler,COMPLETE
2280,0.3715847080189237,2025-04-24 23:38:00.566195,2025-04-24 23:38:16.466338,0 days 00:00:15.900143,False,absolute_error,44,sqrt,1,18,437,TPESampler,COMPLETE
2281,0.32650964002506233,2025-04-24 23:38:05.182009,2025-04-24 23:38:27.013760,0 days 00:00:21.831751,False,absolute_error,50,sqrt,1,4,578,TPESampler,COMPLETE
2282,0.33171244683971046,2025-04-24 23:38:16.657405,2025-04-24 23:38:36.737648,0 days 00:00:20.080243,False,absolute_error,50,sqrt,1,3,499,TPESampler,COMPLETE
2283,0.37313114956328997,2025-04-24 23:38:16.795185,2025-04-24 23:38:24.769355,0 days 00:00:07.974170,True,absolute_error,39,sqrt,1,5,356,TPESampler,COMPLETE
2284,0.41747614222080204,2025-04-24 23:38:18.697285,2025-04-24 23:38:34.892074,0 days 00:00:16.194789,False,absolute_error,50,sqrt,2,2,620,TPESampler,COMPLETE
2285,0.3325680962755354,2025-04-24 23:38:21.476460,2025-04-24 23:38:48.393297,0 days 00:00:26.916837,False,absolute_error,50,sqrt,1,3,704,TPESampler,COMPLETE
2286,0.5500910499620156,2025-04-24 23:38:24.963960,2025-04-24 23:38:26.340973,0 days 00:00:01.377013,True,squared_error,46,,14,22,258,TPESampler,COMPLETE
2287,0.4177989008747086,2025-04-24 23:38:26.566311,2025-04-24 23:38:43.114132,0 days 00:00:16.547821,False,absolute_error,50,sqrt,2,4,659,TPESampler,COMPLETE
2288,0.4186920406012119,2025-04-24 23:38:27.373220,2025-04-24 23:38:29.070975,0 days 00:00:01.697755,False,squared_error,45,sqrt,2,2,604,TPESampler,COMPLETE
2289,0.7737327147381614,2025-04-24 23:38:27.704823,2025-04-24 23:38:30.625361,0 days 00:00:02.920538,True,absolute_error,40,sqrt,9,2,905,TPESampler,COMPLETE
2290,0.4210319246381543,2025-04-24 23:38:29.271228,2025-04-24 23:38:45.285432,0 days 00:00:16.014204,False,absolute_error,50,sqrt,2,6,630,TPESampler,COMPLETE
2291,0.4183402659267675,2025-04-24 23:38:30.817713,2025-04-24 23:38:32.263495,0 days 00:00:01.445782,False,squared_error,44,sqrt,2,4,506,TPESampler,COMPLETE
2292,0.6211486158936125,2025-04-24 23:38:32.452406,2025-04-24 23:38:39.063424,0 days 00:00:06.611018,False,absolute_error,41,log2,2,6,537,TPESampler,COMPLETE
2293,0.34581579363108184,2025-04-24 23:38:35.083766,2025-04-24 23:38:51.084215,0 days 00:00:16.000449,False,absolute_error,42,sqrt,1,7,434,TPESampler,COMPLETE
2294,0.8203953931223975,2025-04-24 23:38:36.938722,2025-04-24 23:38:38.593063,0 days 00:00:01.654341,True,squared_error,38,log2,4,3,989,TPESampler,COMPLETE
2295,0.33235712734365125,2025-04-24 23:38:38.787178,2025-04-24 23:39:02.253383,0 days 00:00:23.466205,False,absolute_error,42,sqrt,1,5,646,TPESampler,COMPLETE
2296,0.36243427626724956,2025-04-24 23:38:39.268528,2025-04-24 23:38:53.360705,0 days 00:00:14.092177,True,absolute_error,45,sqrt,1,5,639,TPESampler,COMPLETE
2297,0.3387497654454074,2025-04-24 23:38:43.381046,2025-04-24 23:39:02.681077,0 days 00:00:19.300031,False,absolute_error,43,sqrt,1,3,510,TPESampler,COMPLETE
2298,0.36772739578786484,2025-04-24 23:38:45.479717,2025-04-24 23:39:10.474265,0 days 00:00:24.994548,False,absolute_error,44,sqrt,1,15,701,TPESampler,COMPLETE
2299,0.3447385241584347,2025-04-24 23:38:48.584984,2025-04-24 23:39:11.809385,0 days 00:00:23.224401,False,absolute_error,50,sqrt,1,2,589,TPESampler,COMPLETE
2300,0.3281421327061233,2025-04-24 23:38:51.280843,2025-04-24 23:39:12.162917,0 days 00:00:20.882074,False,absolute_error,50,sqrt,1,4,544,TPESampler,COMPLETE
2301,0.8203959358877263,2025-04-24 23:38:53.558877,2025-04-24 23:38:54.321107,0 days 00:00:00.762230,True,squared_error,25,sqrt,14,33,125,TPESampler,COMPLETE
2302,0.3309797771178114,2025-04-24 23:38:54.512938,2025-04-24 23:39:16.472246,0 days 00:00:21.959308,False,absolute_error,50,sqrt,1,6,589,TPESampler,COMPLETE
2303,0.4549992613612465,2025-04-24 23:39:02.461155,2025-04-24 23:39:11.487646,0 days 00:00:09.026491,True,absolute_error,50,sqrt,2,5,595,TPESampler,COMPLETE
2304,0.3772506044176362,2025-04-24 23:39:02.919295,2025-04-24 23:39:19.278816,0 days 00:00:16.359521,False,absolute_error,48,log2,1,5,534,TPESampler,COMPLETE
2305,0.336740568466648,2025-04-24 23:39:10.674067,2025-04-24 23:39:30.331407,0 days 00:00:19.657340,False,absolute_error,44,sqrt,1,3,521,TPESampler,COMPLETE
2306,0.3495335909849314,2025-04-24 23:39:11.691142,2025-04-24 23:39:37.987448,0 days 00:00:26.296306,False,absolute_error,43,sqrt,1,8,723,TPESampler,COMPLETE
2307,0.4194026871621544,2025-04-24 23:39:12.027713,2025-04-24 23:39:14.018457,0 days 00:00:01.990744,False,squared_error,50,sqrt,2,8,679,TPESampler,COMPLETE
2308,0.42665398880561034,2025-04-24 23:39:12.457718,2025-04-24 23:39:34.480317,0 days 00:00:22.022599,False,absolute_error,50,sqrt,2,11,646,TPESampler,COMPLETE
2309,0.45047778062521376,2025-04-24 23:39:14.211100,2025-04-24 23:41:46.955374,0 days 00:02:32.744274,False,absolute_error,47,,1,4,654,TPESampler,COMPLETE
2310,0.3409706630989304,2025-04-24 23:39:16.760135,2025-04-24 23:39:43.865320,0 days 00:00:27.105185,False,absolute_error,50,sqrt,1,8,570,TPESampler,COMPLETE
2311,0.41300224228000254,2025-04-24 23:39:19.487470,2025-04-24 23:40:33.553259,0 days 00:01:14.065789,False,absolute_error,50,,2,3,541,TPESampler,COMPLETE
2312,0.6362140953912974,2025-04-24 23:39:30.539053,2025-04-24 23:39:31.436910,0 days 00:00:00.897857,False,squared_error,50,log2,2,33,290,TPESampler,COMPLETE
2313,0.42047009265895,2025-04-24 23:39:31.633129,2025-04-24 23:39:46.517720,0 days 00:00:14.884591,False,absolute_error,50,sqrt,2,5,602,TPESampler,COMPLETE
2314,0.39931588110119864,2025-04-24 23:39:34.669430,2025-04-24 23:39:53.171340,0 days 00:00:18.501910,False,absolute_error,50,log2,1,9,573,TPESampler,COMPLETE
2315,0.46121598143134646,2025-04-24 23:39:38.192061,2025-04-24 23:39:39.428231,0 days 00:00:01.236170,True,squared_error,27,,7,19,177,TPESampler,COMPLETE
2316,0.4156874380471817,2025-04-24 23:39:39.627370,2025-04-24 23:39:51.922365,0 days 00:00:12.294995,False,absolute_error,50,sqrt,2,3,492,TPESampler,COMPLETE
2317,0.8630936401721727,2025-04-24 23:39:44.054051,2025-04-24 23:39:46.024228,0 days 00:00:01.970177,True,absolute_error,35,log2,8,3,901,TPESampler,COMPLETE
2318,0.35345249464410594,2025-04-24 23:39:46.226048,2025-04-24 23:40:05.391354,0 days 00:00:19.165306,False,absolute_error,50,sqrt,1,12,518,TPESampler,COMPLETE
2319,0.32498202593305164,2025-04-24 23:39:46.763394,2025-04-24 23:40:01.334681,0 days 00:00:14.571287,False,absolute_error,50,sqrt,1,5,383,TPESampler,COMPLETE
2320,0.3327309902919369,2025-04-24 23:39:52.132888,2025-04-24 23:40:15.996055,0 days 00:00:23.863167,False,absolute_error,43,sqrt,1,5,656,TPESampler,COMPLETE
2321,0.6964269210046922,2025-04-24 23:39:53.365137,2025-04-24 23:39:54.601679,0 days 00:00:01.236542,False,squared_error,50,log2,3,6,685,TPESampler,COMPLETE
2322,0.3267213780693482,2025-04-24 23:39:54.789144,2025-04-24 23:40:19.384216,0 days 00:00:24.595072,False,absolute_error,50,sqrt,1,4,655,TPESampler,COMPLETE
2323,0.32551920337067203,2025-04-24 23:40:01.530780,2025-04-24 23:40:14.787982,0 days 00:00:13.257202,False,absolute_error,50,sqrt,1,5,347,TPESampler,COMPLETE
2324,0.41698049170915324,2025-04-24 23:40:05.578248,2025-04-24 23:40:11.582810,0 days 00:00:06.004562,False,absolute_error,50,sqrt,2,6,229,TPESampler,COMPLETE
2325,0.3246496343315034,2025-04-24 23:40:11.772792,2025-04-24 23:40:24.640561,0 days 00:00:12.867769,False,absolute_error,49,sqrt,1,4,332,TPESampler,COMPLETE
2326,0.33016858845894725,2025-04-24 23:40:14.989194,2025-04-24 23:40:26.387430,0 days 00:00:11.398236,False,absolute_error,46,sqrt,1,4,298,TPESampler,COMPLETE
2327,0.32905429713120254,2025-04-24 23:40:16.202929,2025-04-24 23:40:30.291868,0 days 00:00:14.088939,False,absolute_error,45,sqrt,1,4,373,TPESampler,COMPLETE
2328,0.3565631173293764,2025-04-24 23:40:19.647591,2025-04-24 23:40:31.043225,0 days 00:00:11.395634,False,absolute_error,43,sqrt,1,11,309,TPESampler,COMPLETE
2329,0.33537337537017425,2025-04-24 23:40:24.845734,2025-04-24 23:40:33.030769,0 days 00:00:08.185035,False,absolute_error,40,sqrt,1,5,213,TPESampler,COMPLETE
2330,0.33673040942673454,2025-04-24 23:40:26.587934,2025-04-24 23:40:36.336974,0 days 00:00:09.749040,False,absolute_error,46,sqrt,1,3,246,TPESampler,COMPLETE
2331,0.33677154932549036,2025-04-24 23:40:30.497037,2025-04-24 23:40:39.112596,0 days 00:00:08.615559,False,absolute_error,48,sqrt,1,3,213,TPESampler,COMPLETE
2332,0.34682377494948663,2025-04-24 23:40:31.278403,2025-04-24 23:40:41.039032,0 days 00:00:09.760629,False,absolute_error,50,sqrt,1,2,235,TPESampler,COMPLETE
2333,0.5470418894293965,2025-04-24 23:40:33.220353,2025-04-24 23:40:38.059576,0 days 00:00:04.839223,True,absolute_error,14,sqrt,2,44,447,TPESampler,COMPLETE
2334,0.3462656784770206,2025-04-24 23:40:33.799266,2025-04-24 23:40:42.028654,0 days 00:00:08.229388,False,absolute_error,44,sqrt,1,8,213,TPESampler,COMPLETE
2335,0.4416424125377117,2025-04-24 23:40:36.535016,2025-04-24 23:41:21.637814,0 days 00:00:45.102798,False,absolute_error,45,,1,7,188,TPESampler,COMPLETE
2336,0.4232951753168355,2025-04-24 23:40:38.257372,2025-04-24 23:41:00.109413,0 days 00:00:21.852041,True,absolute_error,41,sqrt,1,49,996,TPESampler,COMPLETE
2337,0.3380845732919586,2025-04-24 23:40:39.312718,2025-04-24 23:40:54.797743,0 days 00:00:15.485025,False,absolute_error,42,sqrt,1,3,407,TPESampler,COMPLETE
2338,0.41315191552049785,2025-04-24 23:40:41.237805,2025-04-24 23:40:49.141812,0 days 00:00:07.904007,False,absolute_error,46,sqrt,2,3,262,TPESampler,COMPLETE
2339,0.3403832266077175,2025-04-24 23:40:42.237949,2025-04-24 23:40:57.208292,0 days 00:00:14.970343,False,absolute_error,43,sqrt,1,7,408,TPESampler,COMPLETE
2340,0.4944299440761651,2025-04-24 23:40:49.339960,2025-04-24 23:40:53.777436,0 days 00:00:04.437476,False,squared_error,34,,11,23,873,TPESampler,COMPLETE
2341,0.3309191966945761,2025-04-24 23:40:54.012448,2025-04-24 23:41:09.261935,0 days 00:00:15.249487,False,absolute_error,42,sqrt,1,4,374,TPESampler,COMPLETE
2342,0.32703295269552546,2025-04-24 23:40:54.992814,2025-04-24 23:41:08.087546,0 days 00:00:13.094732,False,absolute_error,49,sqrt,1,5,327,TPESampler,COMPLETE
2343,0.33356650930994053,2025-04-24 23:40:57.404858,2025-04-24 23:41:13.766397,0 days 00:00:16.361539,False,absolute_error,47,sqrt,1,3,392,TPESampler,COMPLETE
2344,0.4550456928923924,2025-04-24 23:41:00.302491,2025-04-24 23:41:09.016228,0 days 00:00:08.713737,False,absolute_error,17,sqrt,1,7,316,TPESampler,COMPLETE
2345,0.3872290785486836,2025-04-24 23:41:08.295848,2025-04-24 23:41:15.462301,0 days 00:00:07.166453,False,absolute_error,49,log2,1,7,233,TPESampler,COMPLETE
2346,0.33469640293303227,2025-04-24 23:41:09.221590,2025-04-24 23:41:25.926965,0 days 00:00:16.705375,False,absolute_error,49,sqrt,1,6,439,TPESampler,COMPLETE
