number,value,datetime_start,datetime_complete,duration,params_bootstrap,params_criterion,params_max_depth,params_max_features,params_min_samples_leaf,params_min_samples_split,params_n_estimators,system_attrs_auto:sampler,state
1383,0.507923742907375,2025-04-24 22:43:24.392358,2025-04-24 22:43:26.520955,0 days 00:00:02.128597,True,squared_error,23,log2,1,2,686,TPESampler,COMPLETE
1384,0.7542417417011731,2025-04-24 22:43:24.989904,2025-04-24 22:43:26.243798,0 days 00:00:01.253894,False,squared_error,8,log2,3,11,617,TPESampler,COMPLETE
1385,0.4160965868118778,2025-04-24 22:43:25.917555,2025-04-24 22:43:39.333247,0 days 00:00:13.415692,False,absolute_error,50,sqrt,2,3,506,TPESampler,COMPLETE
1386,0.7578248217508355,2025-04-24 22:43:26.458450,2025-04-24 22:43:27.310216,0 days 00:00:00.851766,True,squared_error,50,sqrt,8,26,103,TPESampler,COMPLETE
1387,0.4209807041802242,2025-04-24 22:43:26.706495,2025-04-24 22:43:44.681962,0 days 00:00:17.975467,False,absolute_error,50,sqrt,2,5,744,TPESampler,COMPLETE
1388,0.7687577842380732,2025-04-24 22:43:27.499652,2025-04-24 22:43:28.289391,0 days 00:00:00.789739,True,squared_error,41,sqrt,9,6,163,TPESampler,COMPLETE
1389,0.3325661108157941,2025-04-24 22:43:28.483113,2025-04-24 22:43:56.060550,0 days 00:00:27.577437,False,absolute_error,50,sqrt,1,3,706,TPESampler,COMPLETE
1390,0.3251504317386558,2025-04-24 22:43:32.099911,2025-04-24 22:43:56.129803,0 days 00:00:24.029892,False,absolute_error,50,sqrt,1,5,644,TPESampler,COMPLETE
1391,0.39113515155607403,2025-04-24 22:43:39.530905,2025-04-24 22:43:44.803773,0 days 00:00:05.272868,False,squared_error,47,,1,4,515,TPESampler,COMPLETE
1392,0.3280344945521537,2025-04-24 22:43:44.874969,2025-04-24 22:43:57.036289,0 days 00:00:12.161320,False,absolute_error,50,sqrt,1,4,314,TPESampler,COMPLETE
1393,0.4607862674888142,2025-04-24 22:43:45.013334,2025-04-24 22:43:53.634094,0 days 00:00:08.620760,True,absolute_error,35,sqrt,2,8,677,TPESampler,COMPLETE
1394,0.3392079096767064,2025-04-24 22:43:53.830533,2025-04-24 22:44:15.975179,0 days 00:00:22.144646,False,absolute_error,42,sqrt,1,3,591,TPESampler,COMPLETE
1395,0.3279327496408333,2025-04-24 22:43:56.214248,2025-04-24 22:44:22.520135,0 days 00:00:26.305887,False,absolute_error,49,sqrt,1,5,704,TPESampler,COMPLETE
1396,0.731154550149953,2025-04-24 22:43:56.332554,2025-04-24 22:43:57.788796,0 days 00:00:01.456242,False,squared_error,25,sqrt,11,41,568,TPESampler,COMPLETE
1397,0.42094421709898094,2025-04-24 22:43:57.277667,2025-04-24 22:44:15.440056,0 days 00:00:18.162389,False,absolute_error,50,sqrt,2,6,752,TPESampler,COMPLETE
1398,0.3531553506462426,2025-04-24 22:43:58.029065,2025-04-24 22:44:23.559545,0 days 00:00:25.530480,False,absolute_error,44,sqrt,1,9,695,TPESampler,COMPLETE
1399,0.33208247364525384,2025-04-24 22:44:15.973860,2025-04-24 22:44:40.534765,0 days 00:00:24.560905,False,absolute_error,50,sqrt,1,3,642,TPESampler,COMPLETE
1400,0.3604942158770895,2025-04-24 22:44:16.201876,2025-04-24 22:44:39.988631,0 days 00:00:23.786755,False,absolute_error,50,sqrt,1,15,637,TPESampler,COMPLETE
1401,0.3336323402044018,2025-04-24 22:44:17.967245,2025-04-24 22:44:43.972181,0 days 00:00:26.004936,False,absolute_error,44,sqrt,1,5,711,TPESampler,COMPLETE
1402,0.3360734493442251,2025-04-24 22:44:20.814136,2025-04-24 22:44:48.192528,0 days 00:00:27.378392,False,absolute_error,50,sqrt,1,7,743,TPESampler,COMPLETE
1403,0.41654373893438806,2025-04-24 22:44:22.715930,2025-04-24 22:44:25.979749,0 days 00:00:03.263819,True,squared_error,21,,2,35,614,TPESampler,COMPLETE
1404,0.3343370865144868,2025-04-24 22:44:23.749657,2025-04-24 22:44:51.677374,0 days 00:00:27.927717,False,absolute_error,41,sqrt,1,4,773,TPESampler,COMPLETE
1405,0.3254851026745958,2025-04-24 22:44:26.170280,2025-04-24 22:44:52.372229,0 days 00:00:26.201949,False,absolute_error,50,sqrt,1,5,704,TPESampler,COMPLETE
1406,0.4545693144515552,2025-04-24 22:44:40.190897,2025-04-24 22:44:47.930613,0 days 00:00:07.739716,True,absolute_error,41,sqrt,2,4,600,TPESampler,COMPLETE
1407,0.7897831920468998,2025-04-24 22:44:40.790259,2025-04-24 22:44:42.617451,0 days 00:00:01.827192,True,absolute_error,10,log2,3,18,418,TPESampler,COMPLETE
1408,0.3399252057041489,2025-04-24 22:44:42.803062,2025-04-24 22:45:10.881744,0 days 00:00:28.078682,False,absolute_error,44,sqrt,1,6,695,TPESampler,COMPLETE
1409,0.4211258477838512,2025-04-24 22:44:44.158121,2025-04-24 22:45:05.420089,0 days 00:00:21.261968,False,absolute_error,50,sqrt,2,5,754,TPESampler,COMPLETE
1410,0.3445403127892892,2025-04-24 22:44:48.136820,2025-04-24 22:45:11.263857,0 days 00:00:23.127037,False,absolute_error,50,sqrt,1,2,583,TPESampler,COMPLETE
1411,0.33348029496112386,2025-04-24 22:44:48.392157,2025-04-24 22:45:18.614436,0 days 00:00:30.222279,False,absolute_error,42,sqrt,1,4,677,TPESampler,COMPLETE
1412,0.4092422558559964,2025-04-24 22:44:51.890884,2025-04-24 22:46:20.919225,0 days 00:01:29.028341,False,absolute_error,46,,2,5,651,TPESampler,COMPLETE
1413,0.8229707628453563,2025-04-24 22:44:52.744103,2025-04-24 22:44:55.353616,0 days 00:00:02.609513,True,absolute_error,48,log2,4,5,890,TPESampler,COMPLETE
1414,0.33257262737228965,2025-04-24 22:44:55.544888,2025-04-24 22:45:22.549952,0 days 00:00:27.005064,False,absolute_error,50,sqrt,1,3,715,TPESampler,COMPLETE
1415,0.33444748763839266,2025-04-24 22:45:05.615908,2025-04-24 22:45:07.826761,0 days 00:00:02.210853,False,squared_error,47,sqrt,1,4,604,TPESampler,COMPLETE
1416,0.4498224477978671,2025-04-24 22:45:08.000746,2025-04-24 22:47:37.473165,0 days 00:02:29.472419,False,absolute_error,50,,1,4,651,TPESampler,COMPLETE
1417,0.36958770241391387,2025-04-24 22:45:11.061178,2025-04-24 22:45:32.773287,0 days 00:00:21.712109,True,absolute_error,48,,1,18,158,TPESampler,COMPLETE
1418,0.42215230498822487,2025-04-24 22:45:11.464538,2025-04-24 22:45:29.047417,0 days 00:00:17.582879,False,absolute_error,43,sqrt,2,5,725,TPESampler,COMPLETE
1419,0.4210255485535562,2025-04-24 22:45:18.800386,2025-04-24 22:45:34.075825,0 days 00:00:15.275439,False,absolute_error,50,sqrt,2,6,567,TPESampler,COMPLETE
1420,0.333486804247635,2025-04-24 22:45:22.762898,2025-04-24 22:45:46.622210,0 days 00:00:23.859312,False,absolute_error,49,sqrt,1,6,647,TPESampler,COMPLETE
1421,0.32628932987295406,2025-04-24 22:45:29.250055,2025-04-24 22:45:52.783187,0 days 00:00:23.533132,False,absolute_error,50,sqrt,1,4,621,TPESampler,COMPLETE
1422,0.41684754566658144,2025-04-24 22:45:32.970507,2025-04-24 22:45:47.889362,0 days 00:00:14.918855,False,absolute_error,50,sqrt,2,4,592,TPESampler,COMPLETE
1423,0.52703096299082,2025-04-24 22:45:34.261501,2025-04-24 22:45:36.099556,0 days 00:00:01.838055,True,absolute_error,26,log2,1,49,113,TPESampler,COMPLETE
1424,0.42019137127038353,2025-04-24 22:45:36.283659,2025-04-24 22:45:55.193347,0 days 00:00:18.909688,False,absolute_error,41,sqrt,2,2,712,TPESampler,COMPLETE
1425,0.6547117576851775,2025-04-24 22:45:46.825364,2025-04-24 22:45:57.747718,0 days 00:00:10.922354,False,absolute_error,19,log2,2,44,980,TPESampler,COMPLETE
1426,0.3352285080977086,2025-04-24 22:45:48.081638,2025-04-24 22:46:10.944398,0 days 00:00:22.862760,False,absolute_error,40,sqrt,1,4,579,TPESampler,COMPLETE
1427,0.3398178653310817,2025-04-24 22:45:52.978185,2025-04-24 22:46:16.995642,0 days 00:00:24.017457,False,absolute_error,44,sqrt,1,6,661,TPESampler,COMPLETE
1428,0.3248520704787231,2025-04-24 22:45:55.395087,2025-04-24 22:46:18.510524,0 days 00:00:23.115437,False,absolute_error,50,sqrt,1,5,581,TPESampler,COMPLETE
1429,0.338113960132636,2025-04-24 22:45:57.938842,2025-04-24 22:46:23.409031,0 days 00:00:25.470189,False,absolute_error,49,sqrt,1,7,683,TPESampler,COMPLETE
1430,0.3349070669807599,2025-04-24 22:46:11.153235,2025-04-24 22:46:48.512060,0 days 00:00:37.358825,False,absolute_error,49,sqrt,1,3,946,TPESampler,COMPLETE
1431,0.33255171882324186,2025-04-24 22:46:17.195338,2025-04-24 22:46:51.927782,0 days 00:00:34.732444,False,absolute_error,50,sqrt,1,3,712,TPESampler,COMPLETE
1432,0.3324619003438749,2025-04-24 22:46:18.703068,2025-04-24 22:46:40.166526,0 days 00:00:21.463458,False,absolute_error,42,sqrt,1,4,587,TPESampler,COMPLETE
1433,0.3317055089047612,2025-04-24 22:46:21.126247,2025-04-24 22:46:45.717162,0 days 00:00:24.590915,False,absolute_error,50,sqrt,1,6,526,TPESampler,COMPLETE
1434,0.33187643117851784,2025-04-24 22:46:23.597914,2025-04-24 22:46:50.756834,0 days 00:00:27.158920,False,absolute_error,50,sqrt,1,3,527,TPESampler,COMPLETE
1435,0.8718967286336623,2025-04-24 22:46:40.373008,2025-04-24 22:46:41.784816,0 days 00:00:01.411808,True,squared_error,36,log2,12,20,812,TPESampler,COMPLETE
1436,0.42293525710517543,2025-04-24 22:46:41.985036,2025-04-24 22:46:59.798042,0 days 00:00:17.813006,False,absolute_error,50,sqrt,2,7,604,TPESampler,COMPLETE
1437,0.33817965108893744,2025-04-24 22:46:45.911133,2025-04-24 22:47:08.396546,0 days 00:00:22.485413,False,absolute_error,40,sqrt,1,5,513,TPESampler,COMPLETE
1438,0.34924754337953395,2025-04-24 22:46:48.700651,2025-04-24 22:47:04.654132,0 days 00:00:15.953481,True,absolute_error,50,sqrt,1,3,651,TPESampler,COMPLETE
1439,0.3311845338284126,2025-04-24 22:46:50.952172,2025-04-24 22:47:13.340196,0 days 00:00:22.388024,False,absolute_error,44,sqrt,1,4,606,TPESampler,COMPLETE
1440,0.33706687128033097,2025-04-24 22:46:52.302692,2025-04-24 22:47:30.345676,0 days 00:00:38.042984,False,absolute_error,44,sqrt,1,3,803,TPESampler,COMPLETE
1441,0.3267598888635933,2025-04-24 22:46:59.999297,2025-04-24 22:47:29.208542,0 days 00:00:29.209245,False,absolute_error,50,sqrt,1,4,696,TPESampler,COMPLETE
1442,0.34081082106712174,2025-04-24 22:47:04.843804,2025-04-24 22:47:28.034608,0 days 00:00:23.190804,False,absolute_error,43,sqrt,1,7,581,TPESampler,COMPLETE
1443,0.34537264049787564,2025-04-24 22:47:08.595538,2025-04-24 22:47:28.817943,0 days 00:00:20.222405,False,absolute_error,50,sqrt,1,10,535,TPESampler,COMPLETE
1444,0.42152433190458605,2025-04-24 22:47:13.539784,2025-04-24 22:47:32.164524,0 days 00:00:18.624740,False,absolute_error,42,sqrt,2,5,596,TPESampler,COMPLETE
1445,0.33275361334853676,2025-04-24 22:47:28.227620,2025-04-24 22:47:49.097312,0 days 00:00:20.869692,False,absolute_error,43,sqrt,1,4,493,TPESampler,COMPLETE
1446,0.32513287013514935,2025-04-24 22:47:29.033906,2025-04-24 22:47:50.800657,0 days 00:00:21.766751,False,absolute_error,50,sqrt,1,5,577,TPESampler,COMPLETE
1447,0.3502779776843657,2025-04-24 22:47:29.498512,2025-04-24 22:47:50.957875,0 days 00:00:21.459363,False,absolute_error,41,sqrt,1,2,507,TPESampler,COMPLETE
1448,0.32623904047738306,2025-04-24 22:47:30.541076,2025-04-24 22:47:53.615816,0 days 00:00:23.074740,False,absolute_error,50,sqrt,1,4,613,TPESampler,COMPLETE
1449,0.42276243147951115,2025-04-24 22:47:32.354175,2025-04-24 22:47:46.454176,0 days 00:00:14.100001,False,absolute_error,50,sqrt,2,7,577,TPESampler,COMPLETE
1450,0.4264481022240953,2025-04-24 22:47:37.819606,2025-04-24 22:48:03.619343,0 days 00:00:25.799737,False,absolute_error,49,sqrt,2,9,984,TPESampler,COMPLETE
1451,0.3318728299202945,2025-04-24 22:47:46.853641,2025-04-24 22:48:10.822246,0 days 00:00:23.968605,False,absolute_error,50,sqrt,1,3,599,TPESampler,COMPLETE
1452,0.36002856666335986,2025-04-24 22:47:49.553089,2025-04-24 22:47:56.032111,0 days 00:00:06.479022,True,squared_error,45,,1,7,895,TPESampler,COMPLETE
1453,0.3365097556413544,2025-04-24 22:47:51.020297,2025-04-24 22:48:11.920742,0 days 00:00:20.900445,False,absolute_error,44,sqrt,1,3,493,TPESampler,COMPLETE
1454,0.4189754186059055,2025-04-24 22:47:51.285093,2025-04-24 22:48:05.074915,0 days 00:00:13.789822,False,absolute_error,41,sqrt,2,3,518,TPESampler,COMPLETE
1455,0.33156757397461123,2025-04-24 22:47:53.828163,2025-04-24 22:48:17.644074,0 days 00:00:23.815911,False,absolute_error,43,sqrt,1,4,591,TPESampler,COMPLETE
1456,0.33187639005585706,2025-04-24 22:47:56.301741,2025-04-24 22:48:15.522746,0 days 00:00:19.221005,False,absolute_error,50,sqrt,1,6,478,TPESampler,COMPLETE
1457,0.4430267521791223,2025-04-24 22:48:03.800280,2025-04-24 22:50:13.374959,0 days 00:02:09.574679,False,absolute_error,41,,1,6,572,TPESampler,COMPLETE
1458,0.3278239743543277,2025-04-24 22:48:05.266299,2025-04-24 22:48:27.205346,0 days 00:00:21.939047,False,absolute_error,49,sqrt,1,5,587,TPESampler,COMPLETE
1459,0.3360977084292351,2025-04-24 22:48:11.005592,2025-04-24 22:48:37.510366,0 days 00:00:26.504774,False,absolute_error,50,sqrt,1,7,719,TPESampler,COMPLETE
1460,0.33318980446316127,2025-04-24 22:48:12.153246,2025-04-24 22:48:31.617883,0 days 00:00:19.464637,False,absolute_error,43,sqrt,1,5,525,TPESampler,COMPLETE
1461,0.41772258917636557,2025-04-24 22:48:15.755780,2025-04-24 22:48:31.563832,0 days 00:00:15.808052,False,absolute_error,50,sqrt,2,3,640,TPESampler,COMPLETE
1462,0.38940621096218486,2025-04-24 22:48:17.848672,2025-04-24 22:48:28.084737,0 days 00:00:10.236065,True,absolute_error,38,sqrt,1,10,509,TPESampler,COMPLETE
1463,0.6248975215562222,2025-04-24 22:48:27.393248,2025-04-24 22:48:28.761486,0 days 00:00:01.368238,False,squared_error,27,sqrt,7,10,742,TPESampler,COMPLETE
1464,0.36464740430893516,2025-04-24 22:48:28.278762,2025-04-24 22:48:49.264646,0 days 00:00:20.985884,False,absolute_error,50,log2,1,3,673,TPESampler,COMPLETE
1465,0.6012174395611368,2025-04-24 22:48:29.002323,2025-04-24 22:48:29.932751,0 days 00:00:00.930428,False,squared_error,23,sqrt,6,15,285,TPESampler,COMPLETE
1466,0.41808162684288613,2025-04-24 22:48:30.119015,2025-04-24 22:48:31.830354,0 days 00:00:01.711339,False,squared_error,49,sqrt,2,4,652,TPESampler,COMPLETE
1467,0.42020824045426164,2025-04-24 22:48:31.777372,2025-04-24 22:48:45.992859,0 days 00:00:14.215487,False,absolute_error,50,sqrt,2,5,573,TPESampler,COMPLETE
1468,0.6226519030811053,2025-04-24 22:48:31.827597,2025-04-24 22:48:42.001315,0 days 00:00:10.173718,False,absolute_error,43,log2,2,7,705,TPESampler,COMPLETE
1469,0.4380406877854295,2025-04-24 22:48:32.115336,2025-04-24 22:51:32.696602,0 days 00:03:00.581266,False,absolute_error,41,,1,7,793,TPESampler,COMPLETE
1470,0.3332082287953208,2025-04-24 22:48:37.708113,2025-04-24 22:49:12.703831,0 days 00:00:34.995718,False,absolute_error,50,sqrt,1,3,909,TPESampler,COMPLETE
1471,0.3250981938641328,2025-04-24 22:48:42.188591,2025-04-24 22:49:04.624716,0 days 00:00:22.436125,False,absolute_error,50,sqrt,1,5,601,TPESampler,COMPLETE
1472,0.34617013779486694,2025-04-24 22:48:46.180574,2025-04-24 22:49:05.517431,0 days 00:00:19.336857,False,absolute_error,40,sqrt,1,6,541,TPESampler,COMPLETE
1473,0.3361655443627795,2025-04-24 22:48:49.457574,2025-04-24 22:49:09.997441,0 days 00:00:20.539867,False,absolute_error,50,sqrt,1,7,543,TPESampler,COMPLETE
1474,0.7896726863958554,2025-04-24 22:49:04.825586,2025-04-24 22:49:06.073577,0 days 00:00:01.247991,True,squared_error,9,log2,3,24,570,TPESampler,COMPLETE
1475,0.385897250157655,2025-04-24 22:49:05.703951,2025-04-24 22:49:28.167254,0 days 00:00:22.463303,False,absolute_error,42,log2,1,4,847,TPESampler,COMPLETE
1476,0.8689762470214547,2025-04-24 22:49:06.351062,2025-04-24 22:49:08.507133,0 days 00:00:02.156071,False,absolute_error,7,log2,15,23,906,TPESampler,COMPLETE
1477,0.3367550242824311,2025-04-24 22:49:08.695460,2025-04-24 22:49:27.817305,0 days 00:00:19.121845,False,absolute_error,44,sqrt,1,3,504,TPESampler,COMPLETE
1478,0.3517686301934201,2025-04-24 22:49:10.186615,2025-04-24 22:49:39.011927,0 days 00:00:28.825312,False,absolute_error,42,sqrt,1,8,806,TPESampler,COMPLETE
1479,0.7292112619383645,2025-04-24 22:49:12.894349,2025-04-24 22:49:13.646303,0 days 00:00:00.751954,False,squared_error,23,log2,3,3,159,TPESampler,COMPLETE
1480,0.3514079957673725,2025-04-24 22:49:13.831403,2025-04-24 22:49:34.311229,0 days 00:00:20.479826,False,absolute_error,50,sqrt,1,11,561,TPESampler,COMPLETE
1481,0.5046604782049655,2025-04-24 22:49:28.002866,2025-04-24 22:49:34.551174,0 days 00:00:06.548308,True,absolute_error,5,,6,42,267,TPESampler,COMPLETE
1482,0.3362222115410201,2025-04-24 22:49:28.402117,2025-04-24 22:49:48.049216,0 days 00:00:19.647099,False,absolute_error,48,sqrt,1,3,516,TPESampler,COMPLETE
1483,0.7661980926763465,2025-04-24 22:49:34.510321,2025-04-24 22:49:36.781447,0 days 00:00:02.271126,True,absolute_error,8,sqrt,8,4,507,TPESampler,COMPLETE
1484,0.3280402614199702,2025-04-24 22:49:34.785234,2025-04-24 22:49:55.482476,0 days 00:00:20.697242,False,absolute_error,50,sqrt,1,4,538,TPESampler,COMPLETE
1485,0.3348108640976205,2025-04-24 22:49:36.976123,2025-04-24 22:49:56.779391,0 days 00:00:19.803268,False,absolute_error,49,sqrt,1,3,515,TPESampler,COMPLETE
1486,0.3421719101532374,2025-04-24 22:49:39.204642,2025-04-24 22:49:41.135157,0 days 00:00:01.930515,False,squared_error,49,sqrt,1,7,585,TPESampler,COMPLETE
1487,0.4156641218042545,2025-04-24 22:49:41.323679,2025-04-24 22:49:53.452431,0 days 00:00:12.128752,False,absolute_error,50,sqrt,2,4,490,TPESampler,COMPLETE
1488,0.32779314943961485,2025-04-24 22:49:48.236333,2025-04-24 22:50:07.204481,0 days 00:00:18.968148,False,absolute_error,50,sqrt,1,4,503,TPESampler,COMPLETE
1489,0.3319773802094153,2025-04-24 22:49:53.645173,2025-04-24 22:50:22.548408,0 days 00:00:28.903235,False,absolute_error,43,sqrt,1,4,787,TPESampler,COMPLETE
1490,0.33520381054832643,2025-04-24 22:49:55.679790,2025-04-24 22:50:18.750982,0 days 00:00:23.071192,False,absolute_error,50,sqrt,1,7,619,TPESampler,COMPLETE
1491,0.7522079243457128,2025-04-24 22:49:56.973250,2025-04-24 22:49:58.343159,0 days 00:00:01.369909,False,squared_error,25,log2,4,5,969,TPESampler,COMPLETE
1492,0.35488943651207744,2025-04-24 22:49:58.534924,2025-04-24 22:51:03.429859,0 days 00:01:04.894935,True,absolute_error,50,,1,10,495,TPESampler,COMPLETE
1493,0.4022399309350643,2025-04-24 22:50:07.410034,2025-04-24 22:50:09.624669,0 days 00:00:02.214635,True,squared_error,48,log2,1,6,908,TPESampler,COMPLETE
1494,0.4502423511854233,2025-04-24 22:50:09.810545,2025-04-24 22:50:31.153516,0 days 00:00:21.342971,False,absolute_error,22,sqrt,1,40,716,TPESampler,COMPLETE
1495,0.7000296750104331,2025-04-24 22:50:13.547567,2025-04-24 22:50:17.366568,0 days 00:00:03.819001,True,absolute_error,23,log2,2,45,574,TPESampler,COMPLETE
1496,0.33520203806521226,2025-04-24 22:50:17.597971,2025-04-24 22:50:41.645889,0 days 00:00:24.047918,False,absolute_error,50,sqrt,1,7,610,TPESampler,COMPLETE
1497,0.6992035381846519,2025-04-24 22:50:18.940058,2025-04-24 22:50:23.485130,0 days 00:00:04.545072,False,absolute_error,34,log2,3,2,527,TPESampler,COMPLETE
1498,0.3318036871727179,2025-04-24 22:50:22.732028,2025-04-24 22:50:39.550046,0 days 00:00:16.818018,False,absolute_error,50,sqrt,1,3,431,TPESampler,COMPLETE
1499,0.41778385286746367,2025-04-24 22:50:23.676234,2025-04-24 22:50:40.274114,0 days 00:00:16.597880,False,absolute_error,50,sqrt,2,2,677,TPESampler,COMPLETE
1500,0.5275969118228621,2025-04-24 22:50:31.334230,2025-04-24 22:50:33.475521,0 days 00:00:02.141291,True,absolute_error,13,sqrt,1,2,119,TPESampler,COMPLETE
1501,0.36845648744682596,2025-04-24 22:50:33.646837,2025-04-24 22:50:37.287514,0 days 00:00:03.640677,True,squared_error,30,,1,10,577,TPESampler,COMPLETE
1502,0.8025392911738164,2025-04-24 22:50:37.468734,2025-04-24 22:50:42.127300,0 days 00:00:04.658566,False,absolute_error,32,log2,5,17,882,TPESampler,COMPLETE
1503,0.5510202172198467,2025-04-24 22:50:39.735840,2025-04-24 22:50:49.896566,0 days 00:00:10.160726,True,absolute_error,19,,14,2,647,TPESampler,COMPLETE
1504,0.4135976511515557,2025-04-24 22:50:40.592405,2025-04-24 22:50:41.785080,0 days 00:00:01.192675,True,squared_error,50,sqrt,1,42,344,TPESampler,COMPLETE
1505,0.3320181395689459,2025-04-24 22:50:41.844789,2025-04-24 22:51:03.418305,0 days 00:00:21.573516,False,absolute_error,50,sqrt,1,3,565,TPESampler,COMPLETE
1506,0.3459806625521285,2025-04-24 22:50:41.997918,2025-04-24 22:51:13.673115,0 days 00:00:31.675197,False,absolute_error,42,sqrt,1,7,843,TPESampler,COMPLETE
1507,0.4229236079391139,2025-04-24 22:50:42.416644,2025-04-24 22:50:54.681531,0 days 00:00:12.264887,False,absolute_error,50,sqrt,2,8,490,TPESampler,COMPLETE
1508,0.34058724854627603,2025-04-24 22:50:50.082254,2025-04-24 22:51:11.747644,0 days 00:00:21.665390,False,absolute_error,43,sqrt,1,6,597,TPESampler,COMPLETE
1509,0.35328296299836986,2025-04-24 22:50:54.872689,2025-04-24 22:51:12.068540,0 days 00:00:17.195851,False,absolute_error,43,sqrt,1,9,473,TPESampler,COMPLETE
1510,0.3262741406355306,2025-04-24 22:51:03.621287,2025-04-24 22:51:26.857384,0 days 00:00:23.236097,False,absolute_error,50,sqrt,1,4,612,TPESampler,COMPLETE
1511,0.34693130038801984,2025-04-24 22:51:03.621184,2025-04-24 22:51:30.998149,0 days 00:00:27.376965,False,absolute_error,44,sqrt,1,2,709,TPESampler,COMPLETE
1512,0.356171516542163,2025-04-24 22:51:11.948056,2025-04-24 22:51:32.205826,0 days 00:00:20.257770,True,absolute_error,42,sqrt,1,3,960,TPESampler,COMPLETE
1513,0.42159121905515007,2025-04-24 22:51:12.268193,2025-04-24 22:51:24.388156,0 days 00:00:12.119963,False,absolute_error,39,sqrt,2,5,491,TPESampler,COMPLETE
1514,0.3271713932548112,2025-04-24 22:51:13.860693,2025-04-24 22:51:39.363686,0 days 00:00:25.502993,False,absolute_error,50,sqrt,1,4,675,TPESampler,COMPLETE
1515,0.6028598473149569,2025-04-24 22:51:24.568989,2025-04-24 22:51:29.837685,0 days 00:00:05.268696,False,absolute_error,46,sqrt,6,44,538,TPESampler,COMPLETE
1516,0.42242215232062,2025-04-24 22:51:27.058223,2025-04-24 22:51:42.997633,0 days 00:00:15.939410,False,absolute_error,43,sqrt,2,5,651,TPESampler,COMPLETE
1517,0.33146664374835016,2025-04-24 22:51:30.018280,2025-04-24 22:51:57.369366,0 days 00:00:27.351086,False,absolute_error,50,sqrt,1,6,640,TPESampler,COMPLETE
1518,0.3362393246673835,2025-04-24 22:51:31.196791,2025-04-24 22:51:49.231658,0 days 00:00:18.034867,False,absolute_error,50,sqrt,1,7,475,TPESampler,COMPLETE
1519,0.6991283248892539,2025-04-24 22:51:32.394464,2025-04-24 22:51:33.640273,0 days 00:00:01.245809,False,absolute_error,9,sqrt,8,50,120,TPESampler,COMPLETE
1520,0.33211300903614643,2025-04-24 22:51:32.910368,2025-04-24 22:51:48.759809,0 days 00:00:15.849441,False,absolute_error,42,sqrt,1,5,426,TPESampler,COMPLETE
