number,value,datetime_start,datetime_complete,duration,params_bootstrap,params_criterion,params_max_depth,params_max_features,params_min_samples_leaf,params_min_samples_split,params_n_estimators,system_attrs_auto:sampler,state
1107,0.36305072475072764,2025-04-24 22:27:16.460858,2025-04-24 22:27:36.879013,0 days 00:00:20.418155,False,absolute_error,42,sqrt,1,12,576,TPESampler,COMPLETE
1108,0.3317352065936253,2025-04-24 22:27:18.458673,2025-04-24 22:27:46.448983,0 days 00:00:27.990310,False,absolute_error,43,sqrt,1,4,769,TPESampler,COMPLETE
1109,0.5133564133172498,2025-04-24 22:27:24.892270,2025-04-24 22:27:29.339986,0 days 00:00:04.447716,True,absolute_error,24,,11,2,220,TPESampler,COMPLETE
1110,0.34113906230763197,2025-04-24 22:27:27.967612,2025-04-24 22:27:54.360754,0 days 00:00:26.393142,False,absolute_error,50,sqrt,1,8,718,TPESampler,COMPLETE
1111,0.32493742332201253,2025-04-24 22:27:29.645068,2025-04-24 22:27:56.650863,0 days 00:00:27.005795,False,absolute_error,49,sqrt,1,4,588,TPESampler,COMPLETE
1112,0.5632847689202654,2025-04-24 22:27:37.063171,2025-04-24 22:27:38.021038,0 days 00:00:00.957867,True,squared_error,20,log2,1,12,276,TPESampler,COMPLETE
1113,0.3311486279074186,2025-04-24 22:27:38.204877,2025-04-24 22:28:04.782092,0 days 00:00:26.577215,False,absolute_error,50,sqrt,1,6,628,TPESampler,COMPLETE
1114,0.40834907854996283,2025-04-24 22:27:46.827285,2025-04-24 22:28:01.157069,0 days 00:00:14.329784,True,absolute_error,15,,1,16,127,TPESampler,COMPLETE
1115,0.40592412227961805,2025-04-24 22:27:54.786508,2025-04-24 22:28:01.234011,0 days 00:00:06.447503,False,squared_error,50,,1,21,836,TPESampler,COMPLETE
1116,0.4787575335573048,2025-04-24 22:27:56.869754,2025-04-24 22:28:00.150786,0 days 00:00:03.281032,False,absolute_error,28,sqrt,3,30,142,TPESampler,COMPLETE
1117,0.3316259064312525,2025-04-24 22:28:00.335203,2025-04-24 22:28:22.618612,0 days 00:00:22.283409,False,absolute_error,50,sqrt,1,3,586,TPESampler,COMPLETE
1118,0.7638453390607246,2025-04-24 22:28:01.375036,2025-04-24 22:28:02.796678,0 days 00:00:01.421642,False,absolute_error,10,log2,3,5,126,TPESampler,COMPLETE
1119,0.33320383209654364,2025-04-24 22:28:01.441968,2025-04-24 22:28:20.378044,0 days 00:00:18.936076,False,absolute_error,43,sqrt,1,5,515,TPESampler,COMPLETE
1120,0.34677360312995414,2025-04-24 22:28:02.988802,2025-04-24 22:28:18.630727,0 days 00:00:15.641925,False,absolute_error,37,sqrt,1,3,423,TPESampler,COMPLETE
1121,0.5832643714417265,2025-04-24 22:28:04.959427,2025-04-24 22:28:07.839207,0 days 00:00:02.879780,False,absolute_error,10,sqrt,1,40,123,TPESampler,COMPLETE
1122,0.6404123751853695,2025-04-24 22:28:07.475411,2025-04-24 22:28:09.743564,0 days 00:00:02.268153,False,absolute_error,43,log2,2,3,145,TPESampler,COMPLETE
1123,0.3900093630777961,2025-04-24 22:28:08.083935,2025-04-24 22:28:09.434685,0 days 00:00:01.350750,False,squared_error,42,log2,1,2,218,TPESampler,COMPLETE
1124,0.33168644584237794,2025-04-24 22:28:09.618556,2025-04-24 22:28:29.954359,0 days 00:00:20.335803,False,absolute_error,50,sqrt,1,6,545,TPESampler,COMPLETE
1125,0.33228859268145,2025-04-24 22:28:09.947081,2025-04-24 22:28:33.994186,0 days 00:00:24.047105,False,absolute_error,43,sqrt,1,5,627,TPESampler,COMPLETE
1126,0.7849367550064532,2025-04-24 22:28:18.824663,2025-04-24 22:28:23.035103,0 days 00:00:04.210440,False,absolute_error,7,log2,4,18,859,TPESampler,COMPLETE
1127,0.6217568190028785,2025-04-24 22:28:20.571271,2025-04-24 22:28:28.875849,0 days 00:00:08.304578,False,absolute_error,50,log2,2,3,651,TPESampler,COMPLETE
1128,0.33512860810768647,2025-04-24 22:28:22.805465,2025-04-24 22:28:42.552917,0 days 00:00:19.747452,False,absolute_error,44,sqrt,1,5,507,TPESampler,COMPLETE
1129,0.6633371094631098,2025-04-24 22:28:23.291624,2025-04-24 22:28:24.149581,0 days 00:00:00.857957,True,squared_error,20,sqrt,5,2,169,TPESampler,COMPLETE
1130,0.41758554637208023,2025-04-24 22:28:24.331734,2025-04-24 22:28:37.215460,0 days 00:00:12.883726,False,absolute_error,40,sqrt,2,4,483,TPESampler,COMPLETE
1131,0.41843885654082064,2025-04-24 22:28:29.070793,2025-04-24 22:28:47.813127,0 days 00:00:18.742334,False,absolute_error,42,sqrt,2,3,577,TPESampler,COMPLETE
1132,0.3325701321678808,2025-04-24 22:28:30.148348,2025-04-24 22:28:49.163504,0 days 00:00:19.015156,False,absolute_error,43,sqrt,1,4,513,TPESampler,COMPLETE
1133,0.42512149234417207,2025-04-24 22:28:34.192196,2025-04-24 22:28:45.702263,0 days 00:00:11.510067,False,absolute_error,50,sqrt,2,9,462,TPESampler,COMPLETE
1134,0.42468063089600583,2025-04-24 22:28:37.413468,2025-04-24 22:28:52.371725,0 days 00:00:14.958257,False,absolute_error,41,sqrt,2,7,607,TPESampler,COMPLETE
1135,0.330615071233619,2025-04-24 22:28:42.734983,2025-04-24 22:28:56.332185,0 days 00:00:13.597202,False,absolute_error,50,sqrt,1,6,355,TPESampler,COMPLETE
1136,0.3318456548561608,2025-04-24 22:28:45.905541,2025-04-24 22:29:09.441172,0 days 00:00:23.535631,False,absolute_error,50,sqrt,1,3,609,TPESampler,COMPLETE
1137,0.7552390190639144,2025-04-24 22:28:48.064974,2025-04-24 22:28:55.189401,0 days 00:00:07.124427,False,absolute_error,49,log2,4,9,968,TPESampler,COMPLETE
1138,0.3265413651234418,2025-04-24 22:28:49.359918,2025-04-24 22:29:13.669848,0 days 00:00:24.309930,False,absolute_error,50,sqrt,1,4,579,TPESampler,COMPLETE
1139,0.5038307518570941,2025-04-24 22:28:52.805917,2025-04-24 22:29:26.347546,0 days 00:00:33.541629,False,absolute_error,11,,12,3,785,TPESampler,COMPLETE
1140,0.41549504684619604,2025-04-24 22:28:55.385393,2025-04-24 22:29:40.669999,0 days 00:00:45.284606,True,absolute_error,21,,4,2,999,TPESampler,COMPLETE
1141,0.3540150744336317,2025-04-24 22:28:56.506210,2025-04-24 22:28:59.212770,0 days 00:00:02.706560,True,squared_error,50,sqrt,1,2,623,TPESampler,COMPLETE
1142,0.33116421605452234,2025-04-24 22:28:59.399454,2025-04-24 22:29:21.913472,0 days 00:00:22.514018,False,absolute_error,50,sqrt,1,6,599,TPESampler,COMPLETE
1143,0.3459737772086253,2025-04-24 22:29:02.608582,2025-04-24 22:29:25.038164,0 days 00:00:22.429582,False,absolute_error,50,sqrt,1,2,513,TPESampler,COMPLETE
1144,0.331146094038693,2025-04-24 22:29:09.669728,2025-04-24 22:29:31.565656,0 days 00:00:21.895928,False,absolute_error,50,sqrt,1,6,557,TPESampler,COMPLETE
1145,0.6282126967318662,2025-04-24 22:29:13.862988,2025-04-24 22:29:15.247279,0 days 00:00:01.384291,False,squared_error,50,sqrt,7,19,619,TPESampler,COMPLETE
1146,0.41843806169152975,2025-04-24 22:29:15.431013,2025-04-24 22:29:34.581980,0 days 00:00:19.150967,False,absolute_error,47,sqrt,2,3,699,TPESampler,COMPLETE
1147,0.6932126265172562,2025-04-24 22:29:22.156546,2025-04-24 22:29:27.578777,0 days 00:00:05.422231,True,absolute_error,50,log2,2,2,773,TPESampler,COMPLETE
1148,0.36949050735942046,2025-04-24 22:29:25.238674,2025-04-24 22:29:31.496961,0 days 00:00:06.258287,True,squared_error,29,,1,2,739,TPESampler,COMPLETE
1149,0.4673775286863471,2025-04-24 22:29:26.535305,2025-04-24 22:31:46.831894,0 days 00:02:20.296589,False,absolute_error,46,,1,3,585,TPESampler,COMPLETE
1150,0.33641085705703727,2025-04-24 22:29:27.774322,2025-04-24 22:29:53.646400,0 days 00:00:25.872078,False,absolute_error,45,sqrt,1,3,683,TPESampler,COMPLETE
1151,0.3577216141583847,2025-04-24 22:29:31.698198,2025-04-24 22:29:36.338551,0 days 00:00:04.640353,True,absolute_error,46,sqrt,1,4,184,TPESampler,COMPLETE
1152,0.39811762409998463,2025-04-24 22:29:31.775395,2025-04-24 22:29:35.591292,0 days 00:00:03.815897,True,absolute_error,47,sqrt,1,23,138,TPESampler,COMPLETE
1153,0.4299015204944345,2025-04-24 22:29:34.782339,2025-04-24 22:29:37.600030,0 days 00:00:02.817691,True,squared_error,42,,4,25,543,TPESampler,COMPLETE
1154,0.3689311218414542,2025-04-24 22:29:35.790395,2025-04-24 22:29:46.531669,0 days 00:00:10.741274,True,absolute_error,50,sqrt,1,8,424,TPESampler,COMPLETE
1155,0.3618530353127886,2025-04-24 22:29:36.516752,2025-04-24 22:29:38.128129,0 days 00:00:01.611377,True,squared_error,50,sqrt,1,6,493,TPESampler,COMPLETE
1156,0.33253764687696186,2025-04-24 22:29:37.802639,2025-04-24 22:30:06.173074,0 days 00:00:28.370435,False,absolute_error,50,sqrt,1,3,707,TPESampler,COMPLETE
1157,0.3436566315674863,2025-04-24 22:29:38.369744,2025-04-24 22:30:03.170278,0 days 00:00:24.800534,False,absolute_error,41,sqrt,1,6,679,TPESampler,COMPLETE
1158,0.46892474442534476,2025-04-24 22:29:40.852072,2025-04-24 22:29:45.038261,0 days 00:00:04.186189,False,absolute_error,20,sqrt,2,4,177,TPESampler,COMPLETE
1159,0.3373739724994417,2025-04-24 22:29:45.219338,2025-04-24 22:30:10.328109,0 days 00:00:25.108771,False,absolute_error,44,sqrt,1,3,669,TPESampler,COMPLETE
1160,0.7895955690816202,2025-04-24 22:29:46.732133,2025-04-24 22:29:47.886184,0 days 00:00:01.154051,True,absolute_error,38,sqrt,10,2,260,TPESampler,COMPLETE
1161,0.3566076343262933,2025-04-24 22:29:48.083139,2025-04-24 22:30:08.828449,0 days 00:00:20.745310,False,absolute_error,44,sqrt,1,11,472,TPESampler,COMPLETE
1162,0.3251703432159775,2025-04-24 22:29:53.847492,2025-04-24 22:30:15.450766,0 days 00:00:21.603274,False,absolute_error,50,sqrt,1,5,574,TPESampler,COMPLETE
1163,0.3298734456741412,2025-04-24 22:30:03.374114,2025-04-24 22:30:18.379375,0 days 00:00:15.005261,False,absolute_error,50,sqrt,1,6,392,TPESampler,COMPLETE
1164,0.42308394786566916,2025-04-24 22:30:06.366221,2025-04-24 22:30:25.412132,0 days 00:00:19.045911,False,absolute_error,42,sqrt,2,6,684,TPESampler,COMPLETE
1165,0.5216196401876115,2025-04-24 22:30:09.019099,2025-04-24 22:30:13.799152,0 days 00:00:04.780053,False,absolute_error,24,log2,1,10,216,TPESampler,COMPLETE
1166,0.32659664171440267,2025-04-24 22:30:10.512130,2025-04-24 22:30:34.804568,0 days 00:00:24.292438,False,absolute_error,50,sqrt,1,4,641,TPESampler,COMPLETE
1167,0.3329830930824982,2025-04-24 22:30:13.988847,2025-04-24 22:30:16.625546,0 days 00:00:02.636699,False,squared_error,50,sqrt,1,4,731,TPESampler,COMPLETE
1168,0.4157933675722225,2025-04-24 22:30:15.645788,2025-04-24 22:30:27.909978,0 days 00:00:12.264190,False,absolute_error,50,sqrt,2,4,488,TPESampler,COMPLETE
1169,0.788145695930641,2025-04-24 22:30:16.832862,2025-04-24 22:30:17.753867,0 days 00:00:00.921005,True,absolute_error,16,sqrt,10,12,121,TPESampler,COMPLETE
1170,0.3395514935298384,2025-04-24 22:30:17.943375,2025-04-24 22:30:39.209530,0 days 00:00:21.266155,False,absolute_error,42,sqrt,1,3,505,TPESampler,COMPLETE
1171,0.39257138003199554,2025-04-24 22:30:18.631061,2025-04-24 22:30:20.138737,0 days 00:00:01.507676,True,squared_error,49,,3,3,197,TPESampler,COMPLETE
1172,0.3323052852704694,2025-04-24 22:30:20.333974,2025-04-24 22:30:41.207834,0 days 00:00:20.873860,False,absolute_error,50,sqrt,1,3,544,TPESampler,COMPLETE
1173,0.44792814692952754,2025-04-24 22:30:25.603347,2025-04-24 22:32:18.300267,0 days 00:01:52.696920,False,absolute_error,50,,1,5,492,TPESampler,COMPLETE
1174,0.3497408748939063,2025-04-24 22:30:28.110775,2025-04-24 22:30:29.519929,0 days 00:00:01.409154,False,squared_error,45,sqrt,1,8,386,TPESampler,COMPLETE
1175,0.5929752752896252,2025-04-24 22:30:29.712145,2025-04-24 22:30:40.889121,0 days 00:00:11.176976,False,absolute_error,10,sqrt,3,37,833,TPESampler,COMPLETE
1176,0.5989237065725687,2025-04-24 22:30:34.991156,2025-04-24 22:30:36.363564,0 days 00:00:01.372408,False,squared_error,10,sqrt,4,28,490,TPESampler,COMPLETE
1177,0.3547491648312571,2025-04-24 22:30:36.551863,2025-04-24 22:30:56.397525,0 days 00:00:19.845662,False,absolute_error,44,sqrt,1,10,548,TPESampler,COMPLETE
1178,0.4194127847752982,2025-04-24 22:30:39.410372,2025-04-24 22:30:51.973110,0 days 00:00:12.562738,False,absolute_error,50,sqrt,2,5,511,TPESampler,COMPLETE
1179,0.3397638296307084,2025-04-24 22:30:41.077901,2025-04-24 22:30:59.248327,0 days 00:00:18.170426,False,absolute_error,42,sqrt,1,3,483,TPESampler,COMPLETE
1180,0.7064141408777672,2025-04-24 22:30:41.408815,2025-04-24 22:30:44.669799,0 days 00:00:03.260984,False,absolute_error,46,log2,3,9,343,TPESampler,COMPLETE
1181,0.3266203944884314,2025-04-24 22:30:44.884756,2025-04-24 22:31:07.566455,0 days 00:00:22.681699,False,absolute_error,50,sqrt,1,4,602,TPESampler,COMPLETE
1182,0.3373743256142212,2025-04-24 22:30:52.259655,2025-04-24 22:31:09.277421,0 days 00:00:17.017766,False,absolute_error,48,sqrt,1,7,458,TPESampler,COMPLETE
1183,0.3326076087919669,2025-04-24 22:30:56.579748,2025-04-24 22:31:17.050520,0 days 00:00:20.470772,False,absolute_error,43,sqrt,1,5,555,TPESampler,COMPLETE
1184,0.32660124574258104,2025-04-24 22:30:59.429329,2025-04-24 22:31:24.072764,0 days 00:00:24.643435,False,absolute_error,50,sqrt,1,4,596,TPESampler,COMPLETE
1185,0.33142381312830455,2025-04-24 22:31:07.761129,2025-04-24 22:31:29.213616,0 days 00:00:21.452487,False,absolute_error,44,sqrt,1,4,480,TPESampler,COMPLETE
1186,0.6176718331458922,2025-04-24 22:31:09.473985,2025-04-24 22:31:16.770531,0 days 00:00:07.296546,False,absolute_error,50,log2,2,5,436,TPESampler,COMPLETE
1187,0.42631211125001117,2025-04-24 22:31:16.967361,2025-04-24 22:31:30.657983,0 days 00:00:13.690622,False,absolute_error,50,sqrt,2,10,565,TPESampler,COMPLETE
1188,0.41808204998165127,2025-04-24 22:31:17.262601,2025-04-24 22:32:58.250553,0 days 00:01:40.987952,True,absolute_error,43,,1,49,847,TPESampler,COMPLETE
1189,0.3243523240505123,2025-04-24 22:31:24.261398,2025-04-24 22:31:40.636123,0 days 00:00:16.374725,False,absolute_error,49,sqrt,1,4,428,TPESampler,COMPLETE
1190,0.34507850101357684,2025-04-24 22:31:29.394332,2025-04-24 22:31:52.152394,0 days 00:00:22.758062,False,absolute_error,42,sqrt,1,7,632,TPESampler,COMPLETE
1191,0.3314603182241895,2025-04-24 22:31:30.848051,2025-04-24 22:31:53.596685,0 days 00:00:22.748634,False,absolute_error,43,sqrt,1,4,622,TPESampler,COMPLETE
1192,0.4201878067930231,2025-04-24 22:31:40.832095,2025-04-24 22:31:50.532095,0 days 00:00:09.700000,False,absolute_error,36,sqrt,2,4,288,TPESampler,COMPLETE
1193,0.33702595118529804,2025-04-24 22:31:47.024247,2025-04-24 22:32:02.324927,0 days 00:00:15.300680,False,absolute_error,46,sqrt,1,3,352,TPESampler,COMPLETE
1194,0.32534415053743954,2025-04-24 22:31:50.730716,2025-04-24 22:32:02.486605,0 days 00:00:11.755889,False,absolute_error,50,sqrt,1,5,306,TPESampler,COMPLETE
1195,0.3955077545558761,2025-04-24 22:31:52.405284,2025-04-24 22:32:06.387286,0 days 00:00:13.982002,False,absolute_error,40,log2,1,4,526,TPESampler,COMPLETE
1196,0.7525216624583906,2025-04-24 22:31:53.785324,2025-04-24 22:31:54.811302,0 days 00:00:01.025978,False,squared_error,20,log2,4,2,567,TPESampler,COMPLETE
1197,0.415980104058634,2025-04-24 22:31:55.014723,2025-04-24 22:32:08.162409,0 days 00:00:13.147686,False,absolute_error,50,sqrt,2,2,456,TPESampler,COMPLETE
1198,0.33867628899125996,2025-04-24 22:32:02.521683,2025-04-24 22:32:17.034165,0 days 00:00:14.512482,False,absolute_error,41,sqrt,1,3,388,TPESampler,COMPLETE
1199,0.33433366976506496,2025-04-24 22:32:02.696159,2025-04-24 22:32:17.126033,0 days 00:00:14.429874,False,absolute_error,50,sqrt,1,7,376,TPESampler,COMPLETE
1200,0.3354317984927421,2025-04-24 22:32:06.598521,2025-04-24 22:32:19.780800,0 days 00:00:13.182279,False,absolute_error,48,sqrt,1,3,338,TPESampler,COMPLETE
1201,0.3416911308403325,2025-04-24 22:32:08.357603,2025-04-24 22:32:21.542767,0 days 00:00:13.185164,False,absolute_error,41,sqrt,1,6,349,TPESampler,COMPLETE
1202,0.3641674080709441,2025-04-24 22:32:17.232394,2025-04-24 22:32:37.197823,0 days 00:00:19.965429,False,absolute_error,50,log2,1,4,702,TPESampler,COMPLETE
1203,0.32771314621551734,2025-04-24 22:32:17.333858,2025-04-24 22:32:29.954517,0 days 00:00:12.620659,False,absolute_error,50,sqrt,1,4,326,TPESampler,COMPLETE
1204,0.33437578984106614,2025-04-24 22:32:18.479055,2025-04-24 22:32:39.033325,0 days 00:00:20.554270,False,absolute_error,44,sqrt,1,5,552,TPESampler,COMPLETE
1205,0.32708615369770816,2025-04-24 22:32:19.970458,2025-04-24 22:32:35.308394,0 days 00:00:15.337936,False,absolute_error,47,sqrt,1,4,401,TPESampler,COMPLETE
1206,0.3317867438465126,2025-04-24 22:32:21.733666,2025-04-24 22:32:42.093621,0 days 00:00:20.359955,False,absolute_error,50,sqrt,1,6,538,TPESampler,COMPLETE
1207,0.7754080345629365,2025-04-24 22:32:30.198044,2025-04-24 22:32:32.262107,0 days 00:00:02.064063,True,absolute_error,45,sqrt,9,35,584,TPESampler,COMPLETE
1208,0.34600840141938094,2025-04-24 22:32:32.485724,2025-04-24 22:32:54.185706,0 days 00:00:21.699982,False,absolute_error,50,sqrt,1,2,537,TPESampler,COMPLETE
1209,0.5348956564888274,2025-04-24 22:32:35.512238,2025-04-24 22:32:51.587918,0 days 00:00:16.075680,False,absolute_error,5,,3,2,189,TPESampler,COMPLETE
1210,0.4204951460763741,2025-04-24 22:32:37.385322,2025-04-24 22:32:46.259889,0 days 00:00:08.874567,False,absolute_error,50,sqrt,2,7,335,TPESampler,COMPLETE
1211,0.3351036052457167,2025-04-24 22:32:39.222154,2025-04-24 22:32:59.183251,0 days 00:00:19.961097,False,absolute_error,49,sqrt,1,3,490,TPESampler,COMPLETE
1212,0.41703860439781987,2025-04-24 22:32:42.374217,2025-04-24 22:33:00.829848,0 days 00:00:18.455631,False,absolute_error,50,sqrt,2,3,598,TPESampler,COMPLETE
1213,0.3433428534416019,2025-04-24 22:32:46.500481,2025-04-24 22:33:12.658430,0 days 00:00:26.157949,False,absolute_error,50,sqrt,1,9,636,TPESampler,COMPLETE
1214,0.3438226786467369,2025-04-24 22:32:51.787393,2025-04-24 22:33:20.628650,0 days 00:00:28.841257,False,absolute_error,50,sqrt,1,2,722,TPESampler,COMPLETE
1215,0.4179957240904916,2025-04-24 22:32:54.385647,2025-04-24 22:33:11.671136,0 days 00:00:17.285489,False,absolute_error,50,sqrt,2,4,711,TPESampler,COMPLETE
1216,0.32615886957639095,2025-04-24 22:32:58.446617,2025-04-24 22:33:16.885446,0 days 00:00:18.438829,False,absolute_error,50,sqrt,1,5,485,TPESampler,COMPLETE
1217,0.35061175016344226,2025-04-24 22:32:59.377171,2025-04-24 22:33:01.758301,0 days 00:00:02.381130,False,squared_error,41,sqrt,1,7,744,TPESampler,COMPLETE
1218,0.41069917175972953,2025-04-24 22:33:01.017048,2025-04-24 22:33:03.357036,0 days 00:00:02.339988,False,squared_error,30,,1,2,155,TPESampler,COMPLETE
1219,0.33457046655903894,2025-04-24 22:33:01.964234,2025-04-24 22:33:04.012315,0 days 00:00:02.048081,False,squared_error,46,sqrt,1,4,470,TPESampler,COMPLETE
1220,0.3276206098651637,2025-04-24 22:33:03.550175,2025-04-24 22:33:22.270207,0 days 00:00:18.720032,False,absolute_error,50,sqrt,1,4,480,TPESampler,COMPLETE
1221,0.4793076843598108,2025-04-24 22:33:04.220683,2025-04-24 22:33:06.975120,0 days 00:00:02.754437,True,squared_error,30,,7,48,671,TPESampler,COMPLETE
1222,0.3723846999201232,2025-04-24 22:33:07.218413,2025-04-24 22:33:25.269522,0 days 00:00:18.051109,False,absolute_error,50,log2,1,2,578,TPESampler,COMPLETE
1223,0.8581423979525629,2025-04-24 22:33:11.864479,2025-04-24 22:33:14.176491,0 days 00:00:02.312012,False,absolute_error,29,log2,11,4,985,TPESampler,COMPLETE
1224,0.3412036287978936,2025-04-24 22:33:12.839262,2025-04-24 22:33:33.447511,0 days 00:00:20.608249,False,absolute_error,43,sqrt,1,7,558,TPESampler,COMPLETE
1225,0.42161359333848397,2025-04-24 22:33:14.398376,2025-04-24 22:33:29.017093,0 days 00:00:14.618717,False,absolute_error,43,sqrt,2,5,594,TPESampler,COMPLETE
1226,0.34938544628730656,2025-04-24 22:33:17.155603,2025-04-24 22:33:41.825736,0 days 00:00:24.670133,False,absolute_error,41,sqrt,1,2,626,TPESampler,COMPLETE
1227,0.3338045298714987,2025-04-24 22:33:20.829205,2025-04-24 22:33:47.406824,0 days 00:00:26.577619,False,absolute_error,44,sqrt,1,5,702,TPESampler,COMPLETE
1228,0.3545587016589787,2025-04-24 22:33:22.466172,2025-04-24 22:33:35.120677,0 days 00:00:12.654505,True,absolute_error,48,sqrt,1,4,536,TPESampler,COMPLETE
1229,0.32722084385375144,2025-04-24 22:33:25.462288,2025-04-24 22:33:45.704401,0 days 00:00:20.242113,False,absolute_error,50,sqrt,1,4,440,TPESampler,COMPLETE
1230,0.4433363844860267,2025-04-24 22:33:29.209146,2025-04-24 22:33:33.333886,0 days 00:00:04.124740,True,squared_error,14,,1,43,992,TPESampler,COMPLETE
1231,0.3319160189230278,2025-04-24 22:33:33.540956,2025-04-24 22:34:00.429031,0 days 00:00:26.888075,False,absolute_error,50,sqrt,1,3,641,TPESampler,COMPLETE
1232,0.7583597524154142,2025-04-24 22:33:33.644318,2025-04-24 22:33:34.500916,0 days 00:00:00.856598,True,squared_error,6,log2,1,3,182,TPESampler,COMPLETE
1233,0.33691710363322247,2025-04-24 22:33:34.687618,2025-04-24 22:34:02.880975,0 days 00:00:28.193357,False,absolute_error,44,sqrt,1,3,655,TPESampler,COMPLETE
1234,0.3351452335439251,2025-04-24 22:33:35.484943,2025-04-24 22:34:03.122166,0 days 00:00:27.637223,False,absolute_error,50,sqrt,1,7,571,TPESampler,COMPLETE
1235,0.3329201745580599,2025-04-24 22:33:42.031929,2025-04-24 22:34:10.331649,0 days 00:00:28.299720,False,absolute_error,50,sqrt,1,3,749,TPESampler,COMPLETE
1236,0.32517855339596874,2025-04-24 22:33:45.899454,2025-04-24 22:34:10.434516,0 days 00:00:24.535062,False,absolute_error,50,sqrt,1,5,573,TPESampler,COMPLETE
1237,0.3952392929873072,2025-04-24 22:33:47.598278,2025-04-24 22:34:46.567871,0 days 00:00:58.969593,False,absolute_error,50,,2,10,341,TPESampler,COMPLETE
1238,0.35639160961092003,2025-04-24 22:34:00.621500,2025-04-24 22:34:15.278020,0 days 00:00:14.656520,True,absolute_error,46,sqrt,1,4,693,TPESampler,COMPLETE
1239,0.4163055416289545,2025-04-24 22:34:03.075727,2025-04-24 22:34:13.387256,0 days 00:00:10.311529,False,absolute_error,50,sqrt,2,4,401,TPESampler,COMPLETE
1240,0.554009827584276,2025-04-24 22:34:03.374663,2025-04-24 22:34:05.086739,0 days 00:00:01.712076,False,squared_error,12,sqrt,3,2,785,TPESampler,COMPLETE
1241,0.41740600251256094,2025-04-24 22:34:05.278909,2025-04-24 22:34:18.479515,0 days 00:00:13.200606,False,absolute_error,44,sqrt,2,4,532,TPESampler,COMPLETE
1242,0.446433637740164,2025-04-24 22:34:10.590774,2025-04-24 22:36:28.487616,0 days 00:02:17.896842,False,absolute_error,50,,1,6,600,TPESampler,COMPLETE
1243,0.41657643087785556,2025-04-24 22:34:10.916759,2025-04-24 22:34:24.151648,0 days 00:00:13.234889,False,absolute_error,50,sqrt,2,4,527,TPESampler,COMPLETE
1244,0.3600637691662964,2025-04-24 22:34:13.572510,2025-04-24 22:34:16.970538,0 days 00:00:03.398028,True,squared_error,40,,1,4,426,TPESampler,COMPLETE
