number,value,datetime_start,datetime_complete,duration,params_bootstrap,params_criterion,params_max_depth,params_max_features,params_min_samples_leaf,params_min_samples_split,params_n_estimators,system_attrs_auto:sampler,state
3582,0.4774775701065769,2025-04-25 00:40:15.556773,2025-04-25 00:40:20.145741,0 days 00:00:04.588968,False,squared_error,25,,10,6,863,TPESampler,COMPLETE
3583,0.340768775864715,2025-04-25 00:40:20.377111,2025-04-25 00:40:22.692421,0 days 00:00:02.315310,False,squared_error,41,sqrt,1,4,482,TPESampler,COMPLETE
3584,0.3542606402057307,2025-04-25 00:40:21.551501,2025-04-25 00:40:34.239592,0 days 00:00:12.688091,False,absolute_error,41,sqrt,1,9,330,TPESampler,COMPLETE
3585,0.33111951960154745,2025-04-25 00:40:22.928519,2025-04-25 00:40:45.613204,0 days 00:00:22.684685,False,absolute_error,50,sqrt,1,6,600,TPESampler,COMPLETE
3586,0.3523332563889049,2025-04-25 00:40:25.637100,2025-04-25 00:40:52.553744,0 days 00:00:26.916644,False,absolute_error,43,sqrt,1,9,738,TPESampler,COMPLETE
3587,0.44396527047887363,2025-04-25 00:40:25.681403,2025-04-25 00:42:26.069089,0 days 00:02:00.387686,False,absolute_error,41,,1,5,529,TPESampler,COMPLETE
3588,0.41801720077495336,2025-04-25 00:40:31.159795,2025-04-25 00:40:45.987069,0 days 00:00:14.827274,False,absolute_error,43,sqrt,2,3,607,TPESampler,COMPLETE
3589,0.33298701611624903,2025-04-25 00:40:32.180023,2025-04-25 00:40:58.671325,0 days 00:00:26.491302,False,absolute_error,43,sqrt,1,5,721,TPESampler,COMPLETE
3590,0.33714787353687387,2025-04-25 00:40:34.489276,2025-04-25 00:41:00.660267,0 days 00:00:26.170991,False,absolute_error,44,sqrt,1,3,619,TPESampler,COMPLETE
3591,0.3383160229039087,2025-04-25 00:40:45.854330,2025-04-25 00:41:10.741691,0 days 00:00:24.887361,False,absolute_error,43,sqrt,1,3,581,TPESampler,COMPLETE
3592,0.4232011541600764,2025-04-25 00:40:46.208811,2025-04-25 00:41:01.870985,0 days 00:00:15.662174,False,absolute_error,42,sqrt,2,7,631,TPESampler,COMPLETE
3593,0.4666765078321285,2025-04-25 00:40:52.771827,2025-04-25 00:40:54.599190,0 days 00:00:01.827363,False,squared_error,32,sqrt,3,32,850,TPESampler,COMPLETE
3594,0.32638751417404893,2025-04-25 00:40:54.813246,2025-04-25 00:41:22.567772,0 days 00:00:27.754526,False,absolute_error,50,sqrt,1,5,515,TPESampler,COMPLETE
3595,0.331391208150715,2025-04-25 00:40:58.892834,2025-04-25 00:41:22.513652,0 days 00:00:23.620818,False,absolute_error,43,sqrt,1,4,637,TPESampler,COMPLETE
3596,0.33035186291421104,2025-04-25 00:41:00.871679,2025-04-25 00:41:10.851931,0 days 00:00:09.980252,False,absolute_error,43,sqrt,1,4,261,TPESampler,COMPLETE
3597,0.34091798656568745,2025-04-25 00:41:02.095287,2025-04-25 00:41:33.053366,0 days 00:00:30.958079,False,absolute_error,50,sqrt,1,8,623,TPESampler,COMPLETE
3598,0.8400342617631625,2025-04-25 00:41:10.960502,2025-04-25 00:41:12.850034,0 days 00:00:01.889532,True,squared_error,42,log2,5,3,625,TPESampler,COMPLETE
3599,0.3435827833161455,2025-04-25 00:41:11.129248,2025-04-25 00:41:29.824752,0 days 00:00:18.695504,False,absolute_error,45,sqrt,1,2,460,TPESampler,COMPLETE
3600,0.3758855628291429,2025-04-25 00:41:13.076800,2025-04-25 00:41:27.117069,0 days 00:00:14.040269,True,absolute_error,46,sqrt,1,9,666,TPESampler,COMPLETE
3601,0.32797954061693396,2025-04-25 00:41:22.745818,2025-04-25 00:41:42.395863,0 days 00:00:19.650045,False,absolute_error,50,sqrt,1,4,511,TPESampler,COMPLETE
3602,0.4186723112245479,2025-04-25 00:41:22.790551,2025-04-25 00:41:30.015767,0 days 00:00:07.225216,False,absolute_error,50,sqrt,2,5,271,TPESampler,COMPLETE
3603,0.3294058573553777,2025-04-25 00:41:27.414171,2025-04-25 00:41:41.721981,0 days 00:00:14.307810,False,absolute_error,44,sqrt,1,4,372,TPESampler,COMPLETE
3604,0.3256180113778211,2025-04-25 00:41:30.061300,2025-04-25 00:41:47.700834,0 days 00:00:17.639534,False,absolute_error,50,sqrt,1,5,461,TPESampler,COMPLETE
3605,0.45049229625587617,2025-04-25 00:41:30.255822,2025-04-25 00:42:23.401516,0 days 00:00:53.145694,False,absolute_error,48,,1,4,229,TPESampler,COMPLETE
3606,0.32648654071073957,2025-04-25 00:41:33.269742,2025-04-25 00:41:41.081329,0 days 00:00:07.811587,False,absolute_error,50,sqrt,1,4,192,TPESampler,COMPLETE
3607,0.4309244366952717,2025-04-25 00:41:41.303859,2025-04-25 00:41:54.900779,0 days 00:00:13.596920,False,absolute_error,50,sqrt,2,17,552,TPESampler,COMPLETE
3608,0.42131891100958085,2025-04-25 00:41:42.002648,2025-04-25 00:41:55.588294,0 days 00:00:13.585646,False,absolute_error,43,sqrt,2,5,537,TPESampler,COMPLETE
3609,0.325302603748716,2025-04-25 00:41:42.668600,2025-04-25 00:42:12.443916,0 days 00:00:29.775316,False,absolute_error,50,sqrt,1,5,780,TPESampler,COMPLETE
3610,0.4168194092179921,2025-04-25 00:41:47.928463,2025-04-25 00:42:02.606438,0 days 00:00:14.677975,False,absolute_error,50,sqrt,2,3,586,TPESampler,COMPLETE
3611,0.33125187053689087,2025-04-25 00:41:55.117533,2025-04-25 00:42:18.032308,0 days 00:00:22.914775,False,absolute_error,44,sqrt,1,4,617,TPESampler,COMPLETE
3612,0.3627663544290414,2025-04-25 00:41:55.903178,2025-04-25 00:41:57.217110,0 days 00:00:01.313932,False,squared_error,42,sqrt,1,11,294,TPESampler,COMPLETE
3613,0.3710575170117837,2025-04-25 00:41:57.434424,2025-04-25 00:42:15.069648,0 days 00:00:17.635224,False,absolute_error,50,log2,1,5,584,TPESampler,COMPLETE
3614,0.33210498669425687,2025-04-25 00:42:02.832246,2025-04-25 00:42:31.375571,0 days 00:00:28.543325,False,absolute_error,50,sqrt,1,6,748,TPESampler,COMPLETE
3615,0.6423837155559725,2025-04-25 00:42:12.680581,2025-04-25 00:42:15.554374,0 days 00:00:02.873793,False,absolute_error,50,log2,2,8,187,TPESampler,COMPLETE
3616,0.6556347068115075,2025-04-25 00:42:15.292247,2025-04-25 00:42:17.356238,0 days 00:00:02.063991,True,squared_error,7,sqrt,3,5,748,TPESampler,COMPLETE
3617,0.32552373849721006,2025-04-25 00:42:15.837136,2025-04-25 00:42:41.924734,0 days 00:00:26.087598,False,absolute_error,50,sqrt,1,5,688,TPESampler,COMPLETE
3618,0.3337453166500316,2025-04-25 00:42:17.586349,2025-04-25 00:42:28.796129,0 days 00:00:11.209780,False,absolute_error,50,sqrt,1,7,290,TPESampler,COMPLETE
3619,0.4331277675646583,2025-04-25 00:42:18.295861,2025-04-25 00:42:42.014310,0 days 00:00:23.718449,False,absolute_error,35,log2,1,7,944,TPESampler,COMPLETE
3620,0.35054186378848007,2025-04-25 00:42:23.645787,2025-04-25 00:42:26.948665,0 days 00:00:03.302878,False,squared_error,40,sqrt,1,2,588,TPESampler,COMPLETE
3621,0.7545488681998356,2025-04-25 00:42:26.309673,2025-04-25 00:42:30.358018,0 days 00:00:04.048345,False,absolute_error,20,sqrt,12,2,719,TPESampler,COMPLETE
3622,0.39849543371644464,2025-04-25 00:42:27.199809,2025-04-25 00:42:33.425976,0 days 00:00:06.226167,False,squared_error,50,,1,6,597,TPESampler,COMPLETE
3623,0.336730996019477,2025-04-25 00:42:29.013748,2025-04-25 00:42:50.846224,0 days 00:00:21.832476,False,absolute_error,44,sqrt,1,3,578,TPESampler,COMPLETE
3624,0.32741077088049597,2025-04-25 00:42:30.576050,2025-04-25 00:42:40.774326,0 days 00:00:10.198276,False,absolute_error,50,sqrt,1,4,258,TPESampler,COMPLETE
3625,0.3324184240445265,2025-04-25 00:42:31.618973,2025-04-25 00:42:57.463958,0 days 00:00:25.844985,False,absolute_error,50,sqrt,1,3,673,TPESampler,COMPLETE
3626,0.33146121183432725,2025-04-25 00:42:33.642105,2025-04-25 00:42:47.375416,0 days 00:00:13.733311,False,absolute_error,50,sqrt,1,3,341,TPESampler,COMPLETE
3627,0.4515195382858835,2025-04-25 00:42:40.989930,2025-04-25 00:42:44.595467,0 days 00:00:03.605537,True,squared_error,45,,6,2,621,TPESampler,COMPLETE
3628,0.3522123481434235,2025-04-25 00:42:42.424046,2025-04-25 00:43:01.880617,0 days 00:00:19.456571,False,absolute_error,42,sqrt,1,8,518,TPESampler,COMPLETE
3629,0.32981780107430425,2025-04-25 00:42:42.585199,2025-04-25 00:42:58.259573,0 days 00:00:15.674374,False,absolute_error,50,sqrt,1,6,395,TPESampler,COMPLETE
3630,0.33915048189275404,2025-04-25 00:42:45.040356,2025-04-25 00:42:55.930616,0 days 00:00:10.890260,False,absolute_error,42,sqrt,1,6,271,TPESampler,COMPLETE
3631,0.3322378747396259,2025-04-25 00:42:47.808039,2025-04-25 00:43:07.075278,0 days 00:00:19.267239,False,absolute_error,42,sqrt,1,5,492,TPESampler,COMPLETE
3632,0.4492824108248865,2025-04-25 00:42:51.313785,2025-04-25 00:44:27.182037,0 days 00:01:35.868252,False,absolute_error,50,,1,4,414,TPESampler,COMPLETE
3633,0.418939528046984,2025-04-25 00:42:56.149800,2025-04-25 00:43:07.666945,0 days 00:00:11.517145,False,absolute_error,50,sqrt,2,5,424,TPESampler,COMPLETE
3634,0.3320870434001592,2025-04-25 00:42:57.691888,2025-04-25 00:43:17.538110,0 days 00:00:19.846222,False,absolute_error,50,sqrt,1,3,515,TPESampler,COMPLETE
3635,0.4210058136297645,2025-04-25 00:42:58.541958,2025-04-25 00:43:13.759356,0 days 00:00:15.217398,False,absolute_error,45,sqrt,2,6,555,TPESampler,COMPLETE
3636,0.34294400145627246,2025-04-25 00:43:02.106547,2025-04-25 00:43:24.243434,0 days 00:00:22.136887,False,absolute_error,50,sqrt,1,9,601,TPESampler,COMPLETE
3637,0.41944069507985215,2025-04-25 00:43:07.298253,2025-04-25 00:43:22.564879,0 days 00:00:15.266626,False,absolute_error,41,sqrt,2,2,601,TPESampler,COMPLETE
3638,0.3449386271860228,2025-04-25 00:43:07.906892,2025-04-25 00:43:20.700185,0 days 00:00:12.793293,False,absolute_error,43,sqrt,1,2,279,TPESampler,COMPLETE
3639,0.3255491009360125,2025-04-25 00:43:13.983564,2025-04-25 00:43:40.037986,0 days 00:00:26.054422,False,absolute_error,50,sqrt,1,5,689,TPESampler,COMPLETE
3640,0.8735384258929555,2025-04-25 00:43:17.766403,2025-04-25 00:43:18.772837,0 days 00:00:01.006434,True,squared_error,21,log2,15,4,296,TPESampler,COMPLETE
3641,0.62070101782627,2025-04-25 00:43:18.993425,2025-04-25 00:43:25.530991,0 days 00:00:06.537566,False,absolute_error,50,log2,2,2,516,TPESampler,COMPLETE
3642,0.35624118912530317,2025-04-25 00:43:20.924992,2025-04-25 00:43:32.064371,0 days 00:00:11.139379,True,absolute_error,43,sqrt,1,4,515,TPESampler,COMPLETE
3643,0.3496398317988547,2025-04-25 00:43:22.780852,2025-04-25 00:43:33.338008,0 days 00:00:10.557156,True,absolute_error,50,sqrt,1,3,464,TPESampler,COMPLETE
3644,0.4164348019489933,2025-04-25 00:43:24.468855,2025-04-25 00:43:37.963695,0 days 00:00:13.494840,False,absolute_error,50,sqrt,2,2,544,TPESampler,COMPLETE
3645,0.34796299968181427,2025-04-25 00:43:25.762512,2025-04-25 00:43:41.333018,0 days 00:00:15.570506,False,absolute_error,44,sqrt,1,8,419,TPESampler,COMPLETE
3646,0.33869897322873727,2025-04-25 00:43:32.497546,2025-04-25 00:44:00.707504,0 days 00:00:28.209958,False,absolute_error,43,sqrt,1,3,752,TPESampler,COMPLETE
3647,0.36632275759641303,2025-04-25 00:43:33.634551,2025-04-25 00:45:05.788480,0 days 00:01:32.153929,True,absolute_error,22,,1,2,751,TPESampler,COMPLETE
3648,0.33164771842322827,2025-04-25 00:43:38.194142,2025-04-25 00:44:01.751230,0 days 00:00:23.557088,False,absolute_error,50,sqrt,1,3,615,TPESampler,COMPLETE
3649,0.4166631530320132,2025-04-25 00:43:40.260660,2025-04-25 00:43:48.776683,0 days 00:00:08.516023,False,absolute_error,41,sqrt,2,4,247,TPESampler,COMPLETE
3650,0.3311895276420506,2025-04-25 00:43:41.556412,2025-04-25 00:44:01.203682,0 days 00:00:19.647270,False,absolute_error,44,sqrt,1,4,529,TPESampler,COMPLETE
3651,0.33895870466237205,2025-04-25 00:43:48.994866,2025-04-25 00:43:50.387900,0 days 00:00:01.393034,False,squared_error,50,sqrt,1,3,170,TPESampler,COMPLETE
3652,0.4182048272339112,2025-04-25 00:43:50.606228,2025-04-25 00:44:01.944825,0 days 00:00:11.338597,False,absolute_error,41,sqrt,2,4,446,TPESampler,COMPLETE
3653,0.4685667932720601,2025-04-25 00:44:00.927010,2025-04-25 00:47:11.386846,0 days 00:03:10.459836,False,absolute_error,50,,1,3,772,TPESampler,COMPLETE
3654,0.3540790106341893,2025-04-25 00:44:01.429631,2025-04-25 00:44:09.134823,0 days 00:00:07.705192,True,absolute_error,50,sqrt,1,4,326,TPESampler,COMPLETE
3655,0.3373157486908544,2025-04-25 00:44:02.152714,2025-04-25 00:44:27.608508,0 days 00:00:25.455794,False,absolute_error,44,sqrt,1,3,668,TPESampler,COMPLETE
3656,0.3389286814009036,2025-04-25 00:44:02.247270,2025-04-25 00:44:19.748881,0 days 00:00:17.501611,False,absolute_error,42,sqrt,1,3,460,TPESampler,COMPLETE
3657,0.3272853378930128,2025-04-25 00:44:09.356223,2025-04-25 00:44:23.038649,0 days 00:00:13.682426,False,absolute_error,50,sqrt,1,4,354,TPESampler,COMPLETE
3658,0.33202543785487393,2025-04-25 00:44:19.968089,2025-04-25 00:44:38.939382,0 days 00:00:18.971293,False,absolute_error,50,sqrt,1,6,502,TPESampler,COMPLETE
3659,0.4215189837454938,2025-04-25 00:44:23.268809,2025-04-25 00:44:42.401118,0 days 00:00:19.132309,False,absolute_error,49,sqrt,2,6,596,TPESampler,COMPLETE
3660,0.34556677075989245,2025-04-25 00:44:27.539291,2025-04-25 00:44:52.205296,0 days 00:00:24.666005,False,absolute_error,42,sqrt,1,7,670,TPESampler,COMPLETE
3661,0.48208402226008673,2025-04-25 00:44:27.938737,2025-04-25 00:44:29.159603,0 days 00:00:01.220866,True,squared_error,29,log2,1,9,106,TPESampler,COMPLETE
3662,0.4095555407593874,2025-04-25 00:44:29.382180,2025-04-25 00:45:55.188745,0 days 00:01:25.806565,False,absolute_error,49,,2,6,605,TPESampler,COMPLETE
3663,0.42124639432835015,2025-04-25 00:44:39.159212,2025-04-25 00:44:57.774324,0 days 00:00:18.615112,False,absolute_error,50,sqrt,2,6,735,TPESampler,COMPLETE
3664,0.3256746450400145,2025-04-25 00:44:42.668795,2025-04-25 00:45:03.646262,0 days 00:00:20.977467,False,absolute_error,50,sqrt,1,5,558,TPESampler,COMPLETE
3665,0.32511362031236707,2025-04-25 00:44:52.429064,2025-04-25 00:45:14.108969,0 days 00:00:21.679905,False,absolute_error,50,sqrt,1,5,578,TPESampler,COMPLETE
3666,0.33098226583364143,2025-04-25 00:44:57.997888,2025-04-25 00:45:12.858148,0 days 00:00:14.860260,False,absolute_error,42,sqrt,1,4,396,TPESampler,COMPLETE
3667,0.4137762343481851,2025-04-25 00:45:03.874950,2025-04-25 00:45:10.713351,0 days 00:00:06.838401,False,absolute_error,50,sqrt,2,2,259,TPESampler,COMPLETE
3668,0.32706296557809367,2025-04-25 00:45:06.006339,2025-04-25 00:45:38.298431,0 days 00:00:32.292092,False,absolute_error,50,sqrt,1,4,678,TPESampler,COMPLETE
3669,0.35933585081704966,2025-04-25 00:45:10.937055,2025-04-25 00:45:23.518954,0 days 00:00:12.581899,False,absolute_error,50,sqrt,1,14,330,TPESampler,COMPLETE
3670,0.32797863010356765,2025-04-25 00:45:13.079138,2025-04-25 00:45:34.320550,0 days 00:00:21.241412,False,absolute_error,50,sqrt,1,4,524,TPESampler,COMPLETE
3671,0.4571056663614315,2025-04-25 00:45:14.331154,2025-04-25 00:45:21.029543,0 days 00:00:06.698389,True,absolute_error,44,sqrt,2,6,508,TPESampler,COMPLETE
3672,0.336084691310596,2025-04-25 00:45:21.251322,2025-04-25 00:45:47.562783,0 days 00:00:26.311461,False,absolute_error,50,sqrt,1,7,712,TPESampler,COMPLETE
3673,0.32849515593076023,2025-04-25 00:45:23.749600,2025-04-25 00:45:33.172940,0 days 00:00:09.423340,False,absolute_error,42,sqrt,1,4,245,TPESampler,COMPLETE
3674,0.4185191066563527,2025-04-25 00:45:33.397752,2025-04-25 00:45:51.941388,0 days 00:00:18.543636,False,absolute_error,44,sqrt,2,3,761,TPESampler,COMPLETE
3675,0.41659772853649935,2025-04-25 00:45:34.549644,2025-04-25 00:45:45.066478,0 days 00:00:10.516834,False,absolute_error,50,sqrt,2,2,406,TPESampler,COMPLETE
3676,0.3360972077310055,2025-04-25 00:45:38.523944,2025-04-25 00:45:40.151157,0 days 00:00:01.627213,False,squared_error,50,sqrt,1,6,361,TPESampler,COMPLETE
3677,0.6021396522057626,2025-04-25 00:45:40.372214,2025-04-25 00:45:49.935536,0 days 00:00:09.563322,False,absolute_error,20,sqrt,6,3,956,TPESampler,COMPLETE
3678,0.6175607429275203,2025-04-25 00:45:45.290582,2025-04-25 00:45:46.698186,0 days 00:00:01.407604,False,squared_error,36,log2,2,4,663,TPESampler,COMPLETE
3679,0.476666583163045,2025-04-25 00:45:46.923070,2025-04-25 00:45:48.383545,0 days 00:00:01.460475,False,squared_error,27,log2,1,7,476,TPESampler,COMPLETE
3680,0.34524098614294346,2025-04-25 00:45:47.835279,2025-04-25 00:46:02.204836,0 days 00:00:14.369557,False,absolute_error,50,sqrt,1,2,342,TPESampler,COMPLETE
3681,0.7529297457935603,2025-04-25 00:45:48.714812,2025-04-25 00:45:50.265689,0 days 00:00:01.550877,False,squared_error,50,log2,4,14,986,TPESampler,COMPLETE
3682,0.3493149786420957,2025-04-25 00:45:50.192591,2025-04-25 00:46:10.221105,0 days 00:00:20.028514,False,absolute_error,43,sqrt,1,8,545,TPESampler,COMPLETE
3683,0.32510628164256417,2025-04-25 00:45:50.569922,2025-04-25 00:46:13.011573,0 days 00:00:22.441651,False,absolute_error,50,sqrt,1,5,589,TPESampler,COMPLETE
3684,0.8494857822075386,2025-04-25 00:45:52.170413,2025-04-25 00:45:53.561284,0 days 00:00:01.390871,False,absolute_error,40,log2,10,40,338,TPESampler,COMPLETE
3685,0.42620984772750786,2025-04-25 00:45:53.786478,2025-04-25 00:46:06.676893,0 days 00:00:12.890415,False,absolute_error,45,sqrt,2,9,513,TPESampler,COMPLETE
3686,0.32658190003461496,2025-04-25 00:45:55.425887,2025-04-25 00:46:18.110790,0 days 00:00:22.684903,False,absolute_error,50,sqrt,1,4,595,TPESampler,COMPLETE
3687,0.4178808122997195,2025-04-25 00:46:02.434657,2025-04-25 00:46:19.277446,0 days 00:00:16.842789,False,absolute_error,50,sqrt,2,3,670,TPESampler,COMPLETE
3688,0.3319414450528776,2025-04-25 00:46:06.908438,2025-04-25 00:46:36.115506,0 days 00:00:29.207068,False,absolute_error,43,sqrt,1,4,791,TPESampler,COMPLETE
3689,0.3743691459597173,2025-04-25 00:46:10.453095,2025-04-25 00:46:12.425938,0 days 00:00:01.972843,True,squared_error,23,,1,7,233,TPESampler,COMPLETE
3690,0.34602535730088385,2025-04-25 00:46:12.644054,2025-04-25 00:46:36.918811,0 days 00:00:24.274757,False,absolute_error,50,sqrt,1,2,462,TPESampler,COMPLETE
3691,0.3270816364977652,2025-04-25 00:46:13.291332,2025-04-25 00:46:31.390675,0 days 00:00:18.099343,False,absolute_error,50,sqrt,1,4,433,TPESampler,COMPLETE
3692,0.33870029124920564,2025-04-25 00:46:18.338944,2025-04-25 00:46:33.679023,0 days 00:00:15.340079,False,absolute_error,44,sqrt,1,6,412,TPESampler,COMPLETE
3693,0.3394937336632104,2025-04-25 00:46:19.496053,2025-04-25 00:46:38.871870,0 days 00:00:19.375817,False,absolute_error,42,sqrt,1,3,511,TPESampler,COMPLETE
3694,0.35284104192761356,2025-04-25 00:46:31.686665,2025-04-25 00:46:36.656907,0 days 00:00:04.970242,False,absolute_error,50,sqrt,1,2,111,TPESampler,COMPLETE
3695,0.8031546866291357,2025-04-25 00:46:33.903840,2025-04-25 00:46:37.736269,0 days 00:00:03.832429,False,absolute_error,30,log2,5,5,762,TPESampler,COMPLETE
3696,0.3365390425576468,2025-04-25 00:46:36.341055,2025-04-25 00:46:54.888681,0 days 00:00:18.547626,False,absolute_error,44,sqrt,1,3,428,TPESampler,COMPLETE
3697,0.4298765864458357,2025-04-25 00:46:36.876368,2025-04-25 00:46:56.462201,0 days 00:00:19.585833,False,absolute_error,40,sqrt,2,12,801,TPESampler,COMPLETE
3698,0.33562495590145036,2025-04-25 00:46:37.278439,2025-04-25 00:46:48.491988,0 days 00:00:11.213549,False,absolute_error,43,sqrt,1,3,280,TPESampler,COMPLETE
3699,0.32760168160295605,2025-04-25 00:46:37.980636,2025-04-25 00:46:49.518783,0 days 00:00:11.538147,False,absolute_error,50,sqrt,1,4,287,TPESampler,COMPLETE
3700,0.49300502767452536,2025-04-25 00:46:39.101171,2025-04-25 00:46:47.513449,0 days 00:00:08.412278,True,absolute_error,20,sqrt,2,11,713,TPESampler,COMPLETE
3701,0.3493141330427815,2025-04-25 00:46:47.735775,2025-04-25 00:47:14.388465,0 days 00:00:26.652690,False,absolute_error,43,sqrt,1,8,658,TPESampler,COMPLETE
3702,0.3362459305313134,2025-04-25 00:46:48.711392,2025-04-25 00:47:07.878116,0 days 00:00:19.166724,False,absolute_error,41,sqrt,1,4,521,TPESampler,COMPLETE
3703,0.4493522037880517,2025-04-25 00:46:49.745557,2025-04-25 00:47:13.169433,0 days 00:00:23.423876,False,absolute_error,27,sqrt,2,16,808,TPESampler,COMPLETE
3704,0.3265265124700075,2025-04-25 00:46:55.161282,2025-04-25 00:47:23.767550,0 days 00:00:28.606268,False,absolute_error,50,sqrt,1,4,759,TPESampler,COMPLETE
3705,0.38821813684098894,2025-04-25 00:46:56.688751,2025-04-25 00:47:24.408539,0 days 00:00:27.719788,True,absolute_error,34,,3,2,487,TPESampler,COMPLETE
3706,0.6947978632001613,2025-04-25 00:47:08.100884,2025-04-25 00:47:09.168338,0 days 00:00:01.067454,True,squared_error,26,log2,2,2,285,TPESampler,COMPLETE
3707,0.3418615048381276,2025-04-25 00:47:09.388584,2025-04-25 00:47:28.539412,0 days 00:00:19.150828,False,absolute_error,50,sqrt,1,8,488,TPESampler,COMPLETE
3708,0.4164782819023869,2025-04-25 00:47:11.621933,2025-04-25 00:47:22.559905,0 days 00:00:10.937972,False,absolute_error,44,sqrt,2,3,425,TPESampler,COMPLETE
3709,0.4767227303309446,2025-04-25 00:47:13.395542,2025-04-25 00:47:14.721257,0 days 00:00:01.325715,True,squared_error,48,,7,44,190,TPESampler,COMPLETE
3710,0.4190798555629602,2025-04-25 00:47:14.642578,2025-04-25 00:47:16.369741,0 days 00:00:01.727163,False,squared_error,18,,1,28,116,TPESampler,COMPLETE
3711,0.42090956030022514,2025-04-25 00:47:15.008217,2025-04-25 00:47:29.560904,0 days 00:00:14.552687,False,absolute_error,50,sqrt,2,6,569,TPESampler,COMPLETE
3712,0.41962516254074933,2025-04-25 00:47:16.591320,2025-04-25 00:47:25.874383,0 days 00:00:09.283063,False,absolute_error,44,sqrt,2,6,310,TPESampler,COMPLETE
3713,0.33270914254187284,2025-04-25 00:47:22.779240,2025-04-25 00:47:25.601926,0 days 00:00:02.822686,False,squared_error,50,sqrt,1,4,558,TPESampler,COMPLETE
3714,0.465739307701381,2025-04-25 00:47:24.005836,2025-04-25 00:47:29.554376,0 days 00:00:05.548540,True,absolute_error,32,sqrt,2,14,378,TPESampler,COMPLETE
3715,0.49047921652753845,2025-04-25 00:47:24.666430,2025-04-25 00:47:52.642478,0 days 00:00:27.976048,False,absolute_error,48,,11,13,726,TPESampler,COMPLETE
3716,0.8163604877202685,2025-04-25 00:47:25.813085,2025-04-25 00:47:26.709737,0 days 00:00:00.896652,False,squared_error,13,log2,5,36,160,TPESampler,COMPLETE
3717,0.41820499812279804,2025-04-25 00:47:26.097734,2025-04-25 00:47:41.747355,0 days 00:00:15.649621,False,absolute_error,43,sqrt,2,3,614,TPESampler,COMPLETE
3718,0.36335204839442015,2025-04-25 00:47:27.078402,2025-04-25 00:47:45.264062,0 days 00:00:18.185660,False,absolute_error,50,sqrt,1,16,485,TPESampler,COMPLETE
