number,value,datetime_start,datetime_complete,duration,params_bootstrap,params_criterion,params_max_depth,params_max_features,params_min_samples_leaf,params_min_samples_split,params_n_estimators,system_attrs_auto:sampler,state
1521,0.7785494943079211,2025-04-24 22:51:33.826838,2025-04-24 22:51:35.088953,0 days 00:00:01.262115,True,squared_error,15,log2,3,5,642,TPESampler,COMPLETE
1522,0.42187856456835615,2025-04-24 22:51:35.276676,2025-04-24 22:51:54.631653,0 days 00:00:19.354977,False,absolute_error,43,sqrt,2,5,803,TPESampler,COMPLETE
1523,0.32608842394389825,2025-04-24 22:51:39.550923,2025-04-24 22:51:56.265438,0 days 00:00:16.714515,False,absolute_error,50,sqrt,1,5,435,TPESampler,COMPLETE
1524,0.49822405372547546,2025-04-24 22:51:43.184729,2025-04-24 22:51:44.419398,0 days 00:00:01.234669,False,squared_error,6,,7,8,186,TPESampler,COMPLETE
1525,0.326643264248225,2025-04-24 22:51:44.612653,2025-04-24 22:52:15.653394,0 days 00:00:31.040741,False,absolute_error,50,sqrt,1,4,736,TPESampler,COMPLETE
1526,0.3324494434824675,2025-04-24 22:51:48.951905,2025-04-24 22:52:22.666201,0 days 00:00:33.714296,False,absolute_error,50,sqrt,1,6,811,TPESampler,COMPLETE
1527,0.3262958264484261,2025-04-24 22:51:49.461643,2025-04-24 22:52:11.418186,0 days 00:00:21.956543,False,absolute_error,50,sqrt,1,4,582,TPESampler,COMPLETE
1528,0.32796673112922137,2025-04-24 22:51:54.821793,2025-04-24 22:52:14.510478,0 days 00:00:19.688685,False,absolute_error,50,sqrt,1,4,523,TPESampler,COMPLETE
1529,0.3396485599949076,2025-04-24 22:51:56.458306,2025-04-24 22:52:14.843668,0 days 00:00:18.385362,False,absolute_error,42,sqrt,1,3,489,TPESampler,COMPLETE
1530,0.332593046522949,2025-04-24 22:51:57.560977,2025-04-24 22:52:18.605624,0 days 00:00:21.044647,False,absolute_error,42,sqrt,1,5,548,TPESampler,COMPLETE
1531,0.35540075835412266,2025-04-24 22:52:11.620616,2025-04-24 22:52:33.308940,0 days 00:00:21.688324,False,absolute_error,41,sqrt,1,9,595,TPESampler,COMPLETE
1532,0.45138529824425083,2025-04-24 22:52:14.696123,2025-04-24 22:52:15.761166,0 days 00:00:01.065043,True,squared_error,19,sqrt,1,2,156,TPESampler,COMPLETE
1533,0.33721427471403737,2025-04-24 22:52:15.099069,2025-04-24 22:52:49.413417,0 days 00:00:34.314348,False,absolute_error,44,sqrt,1,3,912,TPESampler,COMPLETE
1534,0.33862213549408415,2025-04-24 22:52:15.908142,2025-04-24 22:52:44.808462,0 days 00:00:28.900320,False,absolute_error,43,sqrt,1,3,744,TPESampler,COMPLETE
1535,0.4289164620998997,2025-04-24 22:52:16.163475,2025-04-24 22:52:32.179070,0 days 00:00:16.015595,False,absolute_error,40,sqrt,2,11,653,TPESampler,COMPLETE
1536,0.4200591672943888,2025-04-24 22:52:18.806603,2025-04-24 22:52:34.525308,0 days 00:00:15.718705,False,absolute_error,40,sqrt,2,3,629,TPESampler,COMPLETE
1537,0.32691234611895265,2025-04-24 22:52:22.839721,2025-04-24 22:52:54.709326,0 days 00:00:31.869605,False,absolute_error,50,sqrt,1,4,855,TPESampler,COMPLETE
1538,0.682516086026358,2025-04-24 22:52:32.355722,2025-04-24 22:52:39.444107,0 days 00:00:07.088385,False,absolute_error,10,log2,1,11,590,TPESampler,COMPLETE
1539,0.389801075473982,2025-04-24 22:52:33.499722,2025-04-24 22:52:52.873888,0 days 00:00:19.374166,False,absolute_error,41,log2,1,4,687,TPESampler,COMPLETE
1540,0.4163652604688777,2025-04-24 22:52:34.698462,2025-04-24 22:52:47.567035,0 days 00:00:12.868573,False,absolute_error,50,sqrt,2,3,509,TPESampler,COMPLETE
1541,0.41798516807753444,2025-04-24 22:52:39.628966,2025-04-24 22:52:58.237365,0 days 00:00:18.608399,False,absolute_error,50,sqrt,2,3,722,TPESampler,COMPLETE
1542,0.332213123068773,2025-04-24 22:52:45.061587,2025-04-24 22:53:08.512755,0 days 00:00:23.451168,False,absolute_error,43,sqrt,1,5,625,TPESampler,COMPLETE
1543,0.33285165683941903,2025-04-24 22:52:47.798182,2025-04-24 22:53:17.843604,0 days 00:00:30.045422,False,absolute_error,50,sqrt,1,3,732,TPESampler,COMPLETE
1544,0.3447855552245236,2025-04-24 22:52:49.601112,2025-04-24 22:53:13.725998,0 days 00:00:24.124886,False,absolute_error,50,sqrt,1,2,577,TPESampler,COMPLETE
1545,0.33119489005463765,2025-04-24 22:52:53.197118,2025-04-24 22:53:16.070139,0 days 00:00:22.873021,False,absolute_error,50,sqrt,1,6,574,TPESampler,COMPLETE
1546,0.8681441199332449,2025-04-24 22:52:54.987447,2025-04-24 22:52:56.392289,0 days 00:00:01.404842,True,squared_error,48,log2,11,5,571,TPESampler,COMPLETE
1547,0.7682485354502152,2025-04-24 22:52:56.578348,2025-04-24 22:52:57.471902,0 days 00:00:00.893554,True,absolute_error,24,sqrt,8,3,113,TPESampler,COMPLETE
1548,0.33113012422119315,2025-04-24 22:52:57.670726,2025-04-24 22:53:20.316558,0 days 00:00:22.645832,False,absolute_error,50,sqrt,1,6,607,TPESampler,COMPLETE
1549,0.33341759034986557,2025-04-24 22:52:58.424410,2025-04-24 22:53:27.405463,0 days 00:00:28.981053,False,absolute_error,43,sqrt,1,5,802,TPESampler,COMPLETE
1550,0.4390122956334025,2025-04-24 22:53:08.701410,2025-04-24 22:53:10.475099,0 days 00:00:01.773689,False,squared_error,50,,2,37,224,TPESampler,COMPLETE
1551,0.8636543320587763,2025-04-24 22:53:10.661138,2025-04-24 22:53:12.750819,0 days 00:00:02.089681,True,absolute_error,39,log2,8,11,996,TPESampler,COMPLETE
1552,0.4222803980695197,2025-04-24 22:53:12.931299,2025-04-24 22:53:34.126362,0 days 00:00:21.195063,False,absolute_error,43,sqrt,2,5,661,TPESampler,COMPLETE
1553,0.34574082352558966,2025-04-24 22:53:13.932175,2025-04-24 22:53:41.780440,0 days 00:00:27.848265,False,absolute_error,42,sqrt,1,7,774,TPESampler,COMPLETE
1554,0.34286470668427166,2025-04-24 22:53:16.257480,2025-04-24 22:53:38.589679,0 days 00:00:22.332199,False,absolute_error,41,sqrt,1,6,617,TPESampler,COMPLETE
1555,0.42217227298864257,2025-04-24 22:53:18.125183,2025-04-24 22:53:28.852096,0 days 00:00:10.726913,False,absolute_error,44,sqrt,2,6,406,TPESampler,COMPLETE
1556,0.33253995028804556,2025-04-24 22:53:20.506248,2025-04-24 22:53:43.821262,0 days 00:00:23.315014,False,absolute_error,42,sqrt,1,5,549,TPESampler,COMPLETE
1557,0.32530334487668705,2025-04-24 22:53:27.601651,2025-04-24 22:53:51.696943,0 days 00:00:24.095292,False,absolute_error,50,sqrt,1,5,569,TPESampler,COMPLETE
1558,0.3267951113477415,2025-04-24 22:53:29.044157,2025-04-24 22:54:13.411438,0 days 00:00:44.367281,False,absolute_error,50,sqrt,1,4,867,TPESampler,COMPLETE
1559,0.4437171453182272,2025-04-24 22:53:34.314362,2025-04-24 22:55:11.316205,0 days 00:01:37.001843,True,absolute_error,7,,1,5,884,TPESampler,COMPLETE
1560,0.3269940228900614,2025-04-24 22:53:38.782752,2025-04-24 22:53:57.487448,0 days 00:00:18.704696,False,absolute_error,50,sqrt,1,4,421,TPESampler,COMPLETE
1561,0.3472811910594497,2025-04-24 22:53:41.965960,2025-04-24 22:54:06.200974,0 days 00:00:24.235014,False,absolute_error,42,sqrt,1,2,638,TPESampler,COMPLETE
1562,0.331391208150715,2025-04-24 22:53:44.005863,2025-04-24 22:54:17.912787,0 days 00:00:33.906924,False,absolute_error,43,sqrt,1,4,637,TPESampler,COMPLETE
1563,0.40848051909217825,2025-04-24 22:53:51.889988,2025-04-24 22:54:29.189330,0 days 00:00:37.299342,False,absolute_error,38,,2,5,270,TPESampler,COMPLETE
1564,0.42155152476152014,2025-04-24 22:53:57.675691,2025-04-24 22:54:14.439737,0 days 00:00:16.764046,False,absolute_error,50,sqrt,2,6,685,TPESampler,COMPLETE
1565,0.33286155829336256,2025-04-24 22:54:06.388939,2025-04-24 22:54:32.989057,0 days 00:00:26.600118,False,absolute_error,50,sqrt,1,3,698,TPESampler,COMPLETE
1566,0.8523160836384964,2025-04-24 22:54:13.594965,2025-04-24 22:54:14.474339,0 days 00:00:00.879374,False,absolute_error,15,log2,9,41,139,TPESampler,COMPLETE
1567,0.5172270992752221,2025-04-24 22:54:14.637369,2025-04-24 22:54:16.310945,0 days 00:00:01.673576,True,squared_error,33,,11,4,312,TPESampler,COMPLETE
1568,0.37531630473208355,2025-04-24 22:54:14.660644,2025-04-24 22:56:20.837835,0 days 00:02:06.177191,True,absolute_error,16,,1,2,987,TPESampler,COMPLETE
1569,0.7384923980052938,2025-04-24 22:54:16.501461,2025-04-24 22:54:17.859099,0 days 00:00:01.357638,True,squared_error,34,sqrt,7,31,607,TPESampler,COMPLETE
1570,0.33260220692293585,2025-04-24 22:54:18.138848,2025-04-24 22:54:38.910576,0 days 00:00:20.771728,False,absolute_error,43,sqrt,1,5,563,TPESampler,COMPLETE
1571,0.33842091582056605,2025-04-24 22:54:18.147443,2025-04-24 22:54:40.827202,0 days 00:00:22.679759,False,absolute_error,42,sqrt,1,3,412,TPESampler,COMPLETE
1572,0.338684707693636,2025-04-24 22:54:29.386775,2025-04-24 22:54:31.687752,0 days 00:00:02.300977,False,squared_error,49,sqrt,1,6,708,TPESampler,COMPLETE
1573,0.6157766751430144,2025-04-24 22:54:31.881800,2025-04-24 22:54:33.012926,0 days 00:00:01.131126,False,squared_error,38,log2,2,2,515,TPESampler,COMPLETE
1574,0.4180788392400147,2025-04-24 22:54:33.130368,2025-04-24 22:54:51.534729,0 days 00:00:18.404361,False,absolute_error,43,sqrt,2,4,605,TPESampler,COMPLETE
1575,0.41789406489322417,2025-04-24 22:54:33.185078,2025-04-24 22:54:52.959783,0 days 00:00:19.774705,False,absolute_error,50,sqrt,2,4,648,TPESampler,COMPLETE
1576,0.36441572377088616,2025-04-24 22:54:39.099977,2025-04-24 22:55:04.566485,0 days 00:00:25.466508,False,absolute_error,31,sqrt,1,2,712,TPESampler,COMPLETE
1577,0.3321789665694678,2025-04-24 22:54:41.078606,2025-04-24 22:55:17.751111,0 days 00:00:36.672505,False,absolute_error,50,sqrt,1,6,720,TPESampler,COMPLETE
1578,0.7562344733687227,2025-04-24 22:54:51.732779,2025-04-24 22:54:55.225270,0 days 00:00:03.492491,False,absolute_error,44,log2,4,32,496,TPESampler,COMPLETE
1579,0.3255555766729036,2025-04-24 22:54:53.154705,2025-04-24 22:55:19.842763,0 days 00:00:26.688058,False,absolute_error,50,sqrt,1,5,717,TPESampler,COMPLETE
1580,0.34795295685930594,2025-04-24 22:54:55.421570,2025-04-24 22:56:04.379031,0 days 00:01:08.957461,True,absolute_error,48,,1,4,526,TPESampler,COMPLETE
1581,0.37154676061639935,2025-04-24 22:55:04.757365,2025-04-24 22:55:24.306205,0 days 00:00:19.548840,False,absolute_error,49,log2,1,5,690,TPESampler,COMPLETE
1582,0.4879838685137755,2025-04-24 22:55:11.513337,2025-04-24 22:55:30.376694,0 days 00:00:18.863357,True,absolute_error,5,,4,4,507,TPESampler,COMPLETE
1583,0.3276925048749721,2025-04-24 22:55:18.061593,2025-04-24 22:55:41.523114,0 days 00:00:23.461521,False,absolute_error,50,sqrt,1,4,530,TPESampler,COMPLETE
1584,0.34124950285572125,2025-04-24 22:55:20.041389,2025-04-24 22:55:52.851729,0 days 00:00:32.810340,False,absolute_error,44,sqrt,1,6,905,TPESampler,COMPLETE
1585,0.33168842262058523,2025-04-24 22:55:24.502743,2025-04-24 22:55:49.491925,0 days 00:00:24.989182,False,absolute_error,43,sqrt,1,4,685,TPESampler,COMPLETE
1586,0.34443723339450766,2025-04-24 22:55:30.555649,2025-04-24 22:55:53.039784,0 days 00:00:22.484135,False,absolute_error,50,sqrt,1,10,615,TPESampler,COMPLETE
1587,0.33520938465808936,2025-04-24 22:55:41.723397,2025-04-24 22:56:04.869028,0 days 00:00:23.145631,False,absolute_error,50,sqrt,1,7,608,TPESampler,COMPLETE
1588,0.4465405666602846,2025-04-24 22:55:49.679028,2025-04-24 22:58:58.181364,0 days 00:03:08.502336,False,absolute_error,48,,1,6,713,TPESampler,COMPLETE
1589,0.6107863196503628,2025-04-24 22:55:53.032487,2025-04-24 22:55:56.658137,0 days 00:00:03.625650,True,absolute_error,18,sqrt,4,2,493,TPESampler,COMPLETE
1590,0.3368594384064106,2025-04-24 22:55:53.224303,2025-04-24 22:56:18.059503,0 days 00:00:24.835200,False,absolute_error,44,sqrt,1,3,649,TPESampler,COMPLETE
1591,0.42159530064143586,2025-04-24 22:55:56.848951,2025-04-24 22:56:13.133435,0 days 00:00:16.284484,False,absolute_error,50,sqrt,2,6,652,TPESampler,COMPLETE
1592,0.7829398133130413,2025-04-24 22:56:04.571908,2025-04-24 22:56:08.417979,0 days 00:00:03.846071,True,absolute_error,17,log2,3,15,890,TPESampler,COMPLETE
1593,0.33216197867643854,2025-04-24 22:56:05.121444,2025-04-24 22:56:32.512061,0 days 00:00:27.390617,False,absolute_error,50,sqrt,1,6,745,TPESampler,COMPLETE
1594,0.4291784339208974,2025-04-24 22:56:08.616174,2025-04-24 22:56:15.164527,0 days 00:00:06.548353,True,absolute_error,35,log2,1,3,438,TPESampler,COMPLETE
1595,0.34840791409520777,2025-04-24 22:56:13.323250,2025-04-24 22:56:21.608336,0 days 00:00:08.285086,True,absolute_error,49,sqrt,1,3,331,TPESampler,COMPLETE
1596,0.36385270034117767,2025-04-24 22:56:15.368666,2025-04-24 22:56:16.879941,0 days 00:00:01.511275,False,squared_error,50,sqrt,1,14,446,TPESampler,COMPLETE
1597,0.421047622111955,2025-04-24 22:56:17.177028,2025-04-24 22:56:39.867596,0 days 00:00:22.690568,False,absolute_error,50,sqrt,2,5,864,TPESampler,COMPLETE
1598,0.3396414375505026,2025-04-24 22:56:18.246127,2025-04-24 22:56:41.725047,0 days 00:00:23.478920,False,absolute_error,42,sqrt,1,3,633,TPESampler,COMPLETE
1599,0.3276925048749721,2025-04-24 22:56:21.026333,2025-04-24 22:56:43.734545,0 days 00:00:22.708212,False,absolute_error,50,sqrt,1,4,530,TPESampler,COMPLETE
1600,0.42144620901681173,2025-04-24 22:56:21.813704,2025-04-24 22:56:31.644850,0 days 00:00:09.831146,False,absolute_error,42,sqrt,2,6,397,TPESampler,COMPLETE
1601,0.33586797595119416,2025-04-24 22:56:31.836738,2025-04-24 22:56:53.506990,0 days 00:00:21.670252,False,absolute_error,50,sqrt,1,7,551,TPESampler,COMPLETE
1602,0.3319175390032576,2025-04-24 22:56:32.685918,2025-04-24 22:57:02.857851,0 days 00:00:30.171933,False,absolute_error,50,sqrt,1,3,596,TPESampler,COMPLETE
1603,0.3369193732825898,2025-04-24 22:56:40.063909,2025-04-24 22:56:54.897455,0 days 00:00:14.833546,False,absolute_error,40,sqrt,1,5,406,TPESampler,COMPLETE
1604,0.32506191427231157,2025-04-24 22:56:41.907660,2025-04-24 22:57:08.034159,0 days 00:00:26.126499,False,absolute_error,50,sqrt,1,5,637,TPESampler,COMPLETE
1605,0.4281229583433077,2025-04-24 22:56:43.922261,2025-04-24 22:56:45.850762,0 days 00:00:01.928501,False,squared_error,25,sqrt,1,24,883,TPESampler,COMPLETE
1606,0.4396111063628219,2025-04-24 22:56:46.036082,2025-04-24 22:56:47.810329,0 days 00:00:01.774247,False,squared_error,41,log2,1,16,795,TPESampler,COMPLETE
1607,0.4187066871840465,2025-04-24 22:56:47.990079,2025-04-24 22:57:04.079645,0 days 00:00:16.089566,False,absolute_error,50,sqrt,2,5,453,TPESampler,COMPLETE
1608,0.35783517470064063,2025-04-24 22:56:53.693771,2025-04-24 22:57:07.697657,0 days 00:00:14.003886,True,absolute_error,43,sqrt,1,4,662,TPESampler,COMPLETE
1609,0.778429589291445,2025-04-24 22:56:55.094657,2025-04-24 22:56:56.085482,0 days 00:00:00.990825,True,squared_error,29,log2,3,39,337,TPESampler,COMPLETE
1610,0.39511338663225604,2025-04-24 22:56:56.280632,2025-04-24 22:58:34.367824,0 days 00:01:38.087192,False,absolute_error,50,,2,10,694,TPESampler,COMPLETE
1611,0.4737490676716459,2025-04-24 22:57:03.040611,2025-04-24 22:57:06.373322,0 days 00:00:03.332711,False,squared_error,8,,6,2,537,TPESampler,COMPLETE
1612,0.8619290775643922,2025-04-24 22:57:04.265149,2025-04-24 22:57:04.985566,0 days 00:00:00.720417,False,squared_error,34,log2,12,7,157,TPESampler,COMPLETE
1613,0.8739894086472606,2025-04-24 22:57:05.174196,2025-04-24 22:57:06.619238,0 days 00:00:01.445042,True,squared_error,20,log2,13,4,683,TPESampler,COMPLETE
1614,0.8598927174253297,2025-04-24 22:57:06.573190,2025-04-24 22:57:08.071849,0 days 00:00:01.498659,False,absolute_error,48,log2,14,6,375,TPESampler,COMPLETE
1615,0.3459579822390609,2025-04-24 22:57:06.891776,2025-04-24 22:57:24.838776,0 days 00:00:17.947000,False,absolute_error,50,sqrt,1,2,443,TPESampler,COMPLETE
1616,0.8466314043487613,2025-04-24 22:57:07.903485,2025-04-24 22:57:08.854278,0 days 00:00:00.950793,False,squared_error,47,log2,8,2,168,TPESampler,COMPLETE
1617,0.4796078248817544,2025-04-24 22:57:08.266755,2025-04-24 22:57:18.052519,0 days 00:00:09.785764,False,absolute_error,24,,5,48,131,TPESampler,COMPLETE
1618,0.3464502247909977,2025-04-24 22:57:08.325807,2025-04-24 22:57:42.070728,0 days 00:00:33.744921,False,absolute_error,49,sqrt,1,9,917,TPESampler,COMPLETE
1619,0.33302685977586727,2025-04-24 22:57:09.112060,2025-04-24 22:57:55.421465,0 days 00:00:46.309405,False,absolute_error,50,sqrt,1,3,772,TPESampler,COMPLETE
1620,0.32578974769456204,2025-04-24 22:57:18.243974,2025-04-24 22:57:51.675778,0 days 00:00:33.431804,False,absolute_error,50,sqrt,1,5,897,TPESampler,COMPLETE
1621,0.41859933467969995,2025-04-24 22:57:25.020863,2025-04-24 22:57:41.525194,0 days 00:00:16.504331,False,absolute_error,44,sqrt,2,3,679,TPESampler,COMPLETE
1622,0.3324732181539847,2025-04-24 22:57:41.705329,2025-04-24 22:58:08.454642,0 days 00:00:26.749313,False,absolute_error,42,sqrt,1,5,735,TPESampler,COMPLETE
1623,0.326695694196994,2025-04-24 22:57:42.275785,2025-04-24 22:58:07.001231,0 days 00:00:24.725446,False,absolute_error,50,sqrt,1,4,652,TPESampler,COMPLETE
1624,0.35373514488226576,2025-04-24 22:57:52.045841,2025-04-24 22:58:20.433410,0 days 00:00:28.387569,False,absolute_error,50,sqrt,1,12,729,TPESampler,COMPLETE
1625,0.35551283965987623,2025-04-24 22:57:55.638521,2025-04-24 22:58:12.578299,0 days 00:00:16.939778,True,absolute_error,47,sqrt,1,4,784,TPESampler,COMPLETE
1626,0.4668154821591512,2025-04-24 22:58:07.187425,2025-04-24 22:58:27.944535,0 days 00:00:20.757110,False,absolute_error,39,log2,1,32,651,TPESampler,COMPLETE
1627,0.4228148062201542,2025-04-24 22:58:08.652808,2025-04-24 22:58:21.807640,0 days 00:00:13.154832,False,absolute_error,43,sqrt,2,7,538,TPESampler,COMPLETE
1628,0.8143229338915156,2025-04-24 22:58:12.774161,2025-04-24 22:58:13.716401,0 days 00:00:00.942240,True,absolute_error,28,sqrt,13,33,184,TPESampler,COMPLETE
1629,0.33601881838685554,2025-04-24 22:58:13.908923,2025-04-24 22:58:41.714536,0 days 00:00:27.805613,False,absolute_error,50,sqrt,1,7,759,TPESampler,COMPLETE
1630,0.3411741363806807,2025-04-24 22:58:20.623274,2025-04-24 22:58:47.120946,0 days 00:00:26.497672,False,absolute_error,42,sqrt,1,6,672,TPESampler,COMPLETE
1631,0.3270851300815674,2025-04-24 22:58:21.996137,2025-04-24 22:58:47.023978,0 days 00:00:25.027841,False,absolute_error,50,sqrt,1,4,666,TPESampler,COMPLETE
1632,0.4163652604688777,2025-04-24 22:58:28.127415,2025-04-24 22:58:40.718807,0 days 00:00:12.591392,False,absolute_error,50,sqrt,2,4,509,TPESampler,COMPLETE
1633,0.4166179597263027,2025-04-24 22:58:34.563145,2025-04-24 22:58:48.479824,0 days 00:00:13.916679,False,absolute_error,50,sqrt,2,2,568,TPESampler,COMPLETE
1634,0.3434061209968001,2025-04-24 22:58:40.908447,2025-04-24 22:59:11.366353,0 days 00:00:30.457906,False,absolute_error,50,sqrt,1,2,771,TPESampler,COMPLETE
1635,0.35348282651096113,2025-04-24 22:58:41.909574,2025-04-24 22:59:04.121532,0 days 00:00:22.211958,False,absolute_error,41,sqrt,1,8,622,TPESampler,COMPLETE
1636,0.47299405301427533,2025-04-24 22:58:47.181528,2025-04-24 22:59:09.871652,0 days 00:00:22.690124,False,absolute_error,28,,8,7,428,TPESampler,COMPLETE
1637,0.42695525439948967,2025-04-24 22:58:47.312060,2025-04-24 22:59:08.017803,0 days 00:00:20.705743,False,absolute_error,41,sqrt,2,8,779,TPESampler,COMPLETE
1638,0.32609871661503664,2025-04-24 22:58:48.673985,2025-04-24 22:59:07.023602,0 days 00:00:18.349617,False,absolute_error,50,sqrt,1,5,486,TPESampler,COMPLETE
1639,0.3367636946646991,2025-04-24 22:58:58.377613,2025-04-24 22:59:25.696747,0 days 00:00:27.319134,False,absolute_error,45,sqrt,1,3,733,TPESampler,COMPLETE
1640,0.33595844900135613,2025-04-24 22:59:04.306088,2025-04-24 22:59:30.853420,0 days 00:00:26.547332,False,absolute_error,50,sqrt,1,7,692,TPESampler,COMPLETE
1641,0.3319175390032576,2025-04-24 22:59:07.218633,2025-04-24 22:59:31.523758,0 days 00:00:24.305125,False,absolute_error,50,sqrt,1,3,596,TPESampler,COMPLETE
1642,0.7565848049117959,2025-04-24 22:59:08.197725,2025-04-24 22:59:09.894371,0 days 00:00:01.696646,True,squared_error,47,sqrt,8,3,978,TPESampler,COMPLETE
1643,0.3390913570269709,2025-04-24 22:59:10.015730,2025-04-24 22:59:32.564324,0 days 00:00:22.548594,False,absolute_error,42,sqrt,1,3,599,TPESampler,COMPLETE
1644,0.4179939356001047,2025-04-24 22:59:10.072921,2025-04-24 22:59:31.284031,0 days 00:00:21.211110,False,absolute_error,48,sqrt,2,3,857,TPESampler,COMPLETE
1645,0.8562100211556215,2025-04-24 22:59:11.552840,2025-04-24 22:59:12.578844,0 days 00:00:01.026004,False,squared_error,14,log2,10,39,630,TPESampler,COMPLETE
1646,0.3267968672402148,2025-04-24 22:59:12.755552,2025-04-24 22:59:39.023963,0 days 00:00:26.268411,False,absolute_error,50,sqrt,1,4,701,TPESampler,COMPLETE
1647,0.36736865585616446,2025-04-24 22:59:25.891317,2025-04-24 23:00:02.699710,0 days 00:00:36.808393,False,absolute_error,28,sqrt,1,3,973,TPESampler,COMPLETE
1648,0.4149023213512483,2025-04-24 22:59:31.059629,2025-04-24 22:59:40.241791,0 days 00:00:09.182162,False,absolute_error,43,sqrt,2,3,355,TPESampler,COMPLETE
1649,0.33296097492482374,2025-04-24 22:59:31.482647,2025-04-24 23:00:02.710531,0 days 00:00:31.227884,False,absolute_error,42,sqrt,1,4,753,TPESampler,COMPLETE
1650,0.33128165241308793,2025-04-24 22:59:31.871742,2025-04-24 23:00:09.106672,0 days 00:00:37.234930,False,absolute_error,45,sqrt,1,4,845,TPESampler,COMPLETE
1651,0.42252561469097444,2025-04-24 22:59:32.737844,2025-04-24 22:59:34.067002,0 days 00:00:01.329158,False,squared_error,44,sqrt,2,9,502,TPESampler,COMPLETE
1652,0.38637827271553726,2025-04-24 22:59:34.260322,2025-04-24 22:59:42.111240,0 days 00:00:07.850918,True,absolute_error,49,log2,1,2,454,TPESampler,COMPLETE
1653,0.3328275058290089,2025-04-24 22:59:39.215780,2025-04-24 23:00:01.690605,0 days 00:00:22.474825,False,absolute_error,42,sqrt,1,4,603,TPESampler,COMPLETE
1654,0.3399216446333268,2025-04-24 22:59:40.441538,2025-04-24 23:00:00.520307,0 days 00:00:20.078769,False,absolute_error,42,sqrt,1,6,449,TPESampler,COMPLETE
1655,0.6207960810793596,2025-04-24 22:59:42.295627,2025-04-24 22:59:49.708316,0 days 00:00:07.412689,False,absolute_error,47,log2,2,5,601,TPESampler,COMPLETE
1656,0.45294118528430394,2025-04-24 22:59:49.890180,2025-04-24 22:59:51.185339,0 days 00:00:01.295159,False,squared_error,28,,6,10,132,TPESampler,COMPLETE
1657,0.33109487227180745,2025-04-24 22:59:51.363089,2025-04-24 23:00:17.432887,0 days 00:00:26.069798,False,absolute_error,50,sqrt,1,6,595,TPESampler,COMPLETE
