number,value,datetime_start,datetime_complete,duration,params_bootstrap,params_criterion,params_max_depth,params_max_features,params_min_samples_leaf,params_min_samples_split,params_n_estimators,system_attrs_auto:sampler,state
4405,0.6062204684483031,2025-04-25 01:26:37.928302,2025-04-25 01:26:43.391646,0 days 00:00:05.463344,False,absolute_error,12,sqrt,5,29,509,TPESampler,COMPLETE
4406,0.3331899939464778,2025-04-25 01:26:40.734594,2025-04-25 01:27:10.256409,0 days 00:00:29.521815,False,absolute_error,43,sqrt,1,5,754,TPESampler,COMPLETE
4407,0.3387507170264969,2025-04-25 01:26:43.612608,2025-04-25 01:27:10.615017,0 days 00:00:27.002409,False,absolute_error,43,sqrt,1,3,650,TPESampler,COMPLETE
4408,0.420294392620107,2025-04-25 01:26:43.774923,2025-04-25 01:26:58.909712,0 days 00:00:15.134789,False,absolute_error,50,sqrt,2,5,597,TPESampler,COMPLETE
4409,0.3314090073747811,2025-04-25 01:26:47.206997,2025-04-25 01:26:55.315813,0 days 00:00:08.108816,False,absolute_error,50,sqrt,1,3,193,TPESampler,COMPLETE
4410,0.4551481796553326,2025-04-25 01:26:48.557811,2025-04-25 01:26:56.155154,0 days 00:00:07.597343,True,absolute_error,50,sqrt,2,2,560,TPESampler,COMPLETE
4411,0.3399477706292249,2025-04-25 01:26:55.554815,2025-04-25 01:27:18.803307,0 days 00:00:23.248492,False,absolute_error,44,sqrt,1,6,558,TPESampler,COMPLETE
4412,0.3312217506232616,2025-04-25 01:26:56.588088,2025-04-25 01:27:16.506807,0 days 00:00:19.918719,False,absolute_error,44,sqrt,1,4,465,TPESampler,COMPLETE
4413,0.3252572986822001,2025-04-25 01:26:59.158741,2025-04-25 01:27:23.667882,0 days 00:00:24.509141,False,absolute_error,50,sqrt,1,5,649,TPESampler,COMPLETE
4414,0.3312311598168059,2025-04-25 01:27:02.873340,2025-04-25 01:27:20.588500,0 days 00:00:17.715160,False,absolute_error,50,sqrt,1,3,407,TPESampler,COMPLETE
4415,0.34518255422343036,2025-04-25 01:27:10.667582,2025-04-25 01:27:36.574573,0 days 00:00:25.906991,False,absolute_error,50,sqrt,1,10,687,TPESampler,COMPLETE
4416,0.32489853844259386,2025-04-25 01:27:10.872517,2025-04-25 01:27:33.741217,0 days 00:00:22.868700,False,absolute_error,50,sqrt,1,5,604,TPESampler,COMPLETE
4417,0.3321266456703946,2025-04-25 01:27:16.743059,2025-04-25 01:27:37.463167,0 days 00:00:20.720108,False,absolute_error,43,sqrt,1,4,550,TPESampler,COMPLETE
4418,0.45137902041607353,2025-04-25 01:27:19.230440,2025-04-25 01:27:21.093539,0 days 00:00:01.863099,True,squared_error,50,sqrt,2,5,667,TPESampler,COMPLETE
4419,0.33197237678330715,2025-04-25 01:27:20.821196,2025-04-25 01:27:42.776369,0 days 00:00:21.955173,False,absolute_error,50,sqrt,1,3,566,TPESampler,COMPLETE
4420,0.41757075282498274,2025-04-25 01:27:21.334630,2025-04-25 01:27:31.409821,0 days 00:00:10.075191,False,absolute_error,42,sqrt,2,4,396,TPESampler,COMPLETE
4421,0.33454155129961294,2025-04-25 01:27:23.912730,2025-04-25 01:27:34.543995,0 days 00:00:10.631265,False,absolute_error,44,sqrt,1,5,273,TPESampler,COMPLETE
4422,0.33908656413124194,2025-04-25 01:27:31.671315,2025-04-25 01:27:48.609660,0 days 00:00:16.938345,False,absolute_error,44,sqrt,1,6,436,TPESampler,COMPLETE
4423,0.3349744419936809,2025-04-25 01:27:33.976408,2025-04-25 01:27:55.969274,0 days 00:00:21.992866,False,absolute_error,50,sqrt,1,7,581,TPESampler,COMPLETE
4424,0.32613343933635924,2025-04-25 01:27:34.940590,2025-04-25 01:27:54.218176,0 days 00:00:19.277586,False,absolute_error,50,sqrt,1,5,506,TPESampler,COMPLETE
4425,0.41953856115323535,2025-04-25 01:27:36.946770,2025-04-25 01:27:39.105233,0 days 00:00:02.158463,False,squared_error,42,sqrt,2,4,475,TPESampler,COMPLETE
4426,0.4226133424721338,2025-04-25 01:27:37.776267,2025-04-25 01:27:51.457987,0 days 00:00:13.681720,False,absolute_error,50,sqrt,2,7,520,TPESampler,COMPLETE
4427,0.326361981998967,2025-04-25 01:27:39.343623,2025-04-25 01:28:00.006570,0 days 00:00:20.662947,False,absolute_error,50,sqrt,1,5,541,TPESampler,COMPLETE
4428,0.325332607842655,2025-04-25 01:27:43.022490,2025-04-25 01:27:55.022460,0 days 00:00:11.999970,False,absolute_error,50,sqrt,1,5,303,TPESampler,COMPLETE
4429,0.3765169731916145,2025-04-25 01:27:49.059180,2025-04-25 01:28:04.613193,0 days 00:00:15.554013,False,absolute_error,46,log2,1,4,528,TPESampler,COMPLETE
4430,0.690199788261816,2025-04-25 01:27:51.760749,2025-04-25 01:27:53.137229,0 days 00:00:01.376480,True,squared_error,10,log2,1,11,428,TPESampler,COMPLETE
4431,0.34693528367447535,2025-04-25 01:27:53.517312,2025-04-25 01:27:56.361627,0 days 00:00:02.844315,False,squared_error,49,sqrt,1,2,374,TPESampler,COMPLETE
4432,0.41800885445108227,2025-04-25 01:27:54.616154,2025-04-25 01:28:03.637935,0 days 00:00:09.021781,False,absolute_error,50,sqrt,2,5,329,TPESampler,COMPLETE
4433,0.331660652280989,2025-04-25 01:27:55.498936,2025-04-25 01:28:21.590211,0 days 00:00:26.091275,False,absolute_error,44,sqrt,1,4,684,TPESampler,COMPLETE
4434,0.421029269459303,2025-04-25 01:27:56.509677,2025-04-25 01:28:10.009580,0 days 00:00:13.499903,False,absolute_error,43,sqrt,2,5,504,TPESampler,COMPLETE
4435,0.35933281302895925,2025-04-25 01:27:56.887774,2025-04-25 01:28:07.374492,0 days 00:00:10.486718,True,absolute_error,42,sqrt,1,4,438,TPESampler,COMPLETE
4436,0.35440310570113404,2025-04-25 01:28:00.255676,2025-04-25 01:28:11.040732,0 days 00:00:10.785056,False,absolute_error,42,sqrt,1,9,277,TPESampler,COMPLETE
4437,0.34179545702134073,2025-04-25 01:28:03.877633,2025-04-25 01:28:22.897922,0 days 00:00:19.020289,False,absolute_error,50,sqrt,1,8,493,TPESampler,COMPLETE
4438,0.45481410664008615,2025-04-25 01:28:04.867125,2025-04-25 01:28:14.017321,0 days 00:00:09.150196,True,absolute_error,49,sqrt,2,5,633,TPESampler,COMPLETE
4439,0.3313286778322406,2025-04-25 01:28:07.604074,2025-04-25 01:28:27.538339,0 days 00:00:19.934265,False,absolute_error,44,sqrt,1,4,522,TPESampler,COMPLETE
4440,0.47410899709608745,2025-04-25 01:28:10.247137,2025-04-25 01:31:02.017914,0 days 00:02:51.770777,False,absolute_error,10,,1,14,994,TPESampler,COMPLETE
4441,0.413826693306627,2025-04-25 01:28:11.294851,2025-04-25 01:28:17.710687,0 days 00:00:06.415836,False,absolute_error,43,sqrt,2,2,231,TPESampler,COMPLETE
4442,0.3298311569116968,2025-04-25 01:28:14.257817,2025-04-25 01:28:25.375849,0 days 00:00:11.118032,False,absolute_error,42,sqrt,1,5,292,TPESampler,COMPLETE
4443,0.3460966958266092,2025-04-25 01:28:17.954336,2025-04-25 01:28:35.487623,0 days 00:00:17.533287,False,absolute_error,36,sqrt,1,4,483,TPESampler,COMPLETE
4444,0.7197896789321043,2025-04-25 01:28:21.828486,2025-04-25 01:28:27.092159,0 days 00:00:05.263673,False,absolute_error,34,sqrt,10,3,916,TPESampler,COMPLETE
4445,0.34149301196521653,2025-04-25 01:28:23.143897,2025-04-25 01:28:43.245059,0 days 00:00:20.101162,False,absolute_error,43,sqrt,1,7,547,TPESampler,COMPLETE
4446,0.3363437434443781,2025-04-25 01:28:25.632384,2025-04-25 01:28:37.840674,0 days 00:00:12.208290,False,absolute_error,43,sqrt,1,3,311,TPESampler,COMPLETE
4447,0.382782453342867,2025-04-25 01:28:27.344036,2025-04-25 01:28:29.508828,0 days 00:00:02.164792,False,squared_error,39,sqrt,1,19,703,TPESampler,COMPLETE
4448,0.3245852646664187,2025-04-25 01:28:27.810853,2025-04-25 01:28:51.005243,0 days 00:00:23.194390,False,absolute_error,50,sqrt,1,5,613,TPESampler,COMPLETE
4449,0.3408968360756304,2025-04-25 01:28:29.743208,2025-04-25 01:28:56.397966,0 days 00:00:26.654758,False,absolute_error,43,sqrt,1,6,718,TPESampler,COMPLETE
4450,0.3445856187337865,2025-04-25 01:28:35.750790,2025-04-25 01:29:00.025211,0 days 00:00:24.274421,False,absolute_error,50,sqrt,1,2,569,TPESampler,COMPLETE
4451,0.3318790562059621,2025-04-25 01:28:38.085738,2025-04-25 01:28:56.857899,0 days 00:00:18.772161,False,absolute_error,50,sqrt,1,6,463,TPESampler,COMPLETE
4452,0.4192882381194847,2025-04-25 01:28:43.495296,2025-04-25 01:28:59.497687,0 days 00:00:16.002391,False,absolute_error,42,sqrt,2,3,643,TPESampler,COMPLETE
4453,0.43058959438974714,2025-04-25 01:28:51.269702,2025-04-25 01:29:05.665417,0 days 00:00:14.395715,False,absolute_error,38,sqrt,2,9,542,TPESampler,COMPLETE
4454,0.3255112648169337,2025-04-25 01:28:56.633872,2025-04-25 01:29:17.813913,0 days 00:00:21.180041,False,absolute_error,50,sqrt,1,5,561,TPESampler,COMPLETE
4455,0.33131970943504474,2025-04-25 01:28:57.117730,2025-04-25 01:29:20.890584,0 days 00:00:23.772854,False,absolute_error,50,sqrt,1,6,632,TPESampler,COMPLETE
4456,0.3707056814891064,2025-04-25 01:28:59.735966,2025-04-25 01:29:18.325326,0 days 00:00:18.589360,False,absolute_error,50,log2,1,5,651,TPESampler,COMPLETE
4457,0.4178256594279521,2025-04-25 01:29:00.280108,2025-04-25 01:29:22.830082,0 days 00:00:22.549974,False,absolute_error,50,sqrt,2,4,682,TPESampler,COMPLETE
4458,0.3975281077331276,2025-04-25 01:29:05.911413,2025-04-25 01:29:42.258001,0 days 00:00:36.346588,False,absolute_error,38,sqrt,1,30,883,TPESampler,COMPLETE
4459,0.3449492167699743,2025-04-25 01:29:18.053082,2025-04-25 01:29:20.434809,0 days 00:00:02.381727,False,squared_error,41,sqrt,1,6,533,TPESampler,COMPLETE
4460,0.36325118534710304,2025-04-25 01:29:18.669734,2025-04-25 01:29:39.227924,0 days 00:00:20.558190,False,absolute_error,42,sqrt,1,12,564,TPESampler,COMPLETE
4461,0.45258544171159887,2025-04-25 01:29:20.668247,2025-04-25 01:29:22.137580,0 days 00:00:01.469333,True,squared_error,48,sqrt,2,5,420,TPESampler,COMPLETE
4462,0.33522178943021363,2025-04-25 01:29:21.142237,2025-04-25 01:29:45.394731,0 days 00:00:24.252494,False,absolute_error,50,sqrt,1,7,621,TPESampler,COMPLETE
4463,0.42171532604509554,2025-04-25 01:29:22.369177,2025-04-25 01:29:33.714004,0 days 00:00:11.344827,False,absolute_error,43,sqrt,2,7,446,TPESampler,COMPLETE
4464,0.3433410141418202,2025-04-25 01:29:23.132208,2025-04-25 01:29:49.316358,0 days 00:00:26.184150,False,absolute_error,50,sqrt,1,9,679,TPESampler,COMPLETE
4465,0.35718414105501106,2025-04-25 01:29:33.970258,2025-04-25 01:29:54.836182,0 days 00:00:20.865924,False,absolute_error,43,sqrt,1,11,436,TPESampler,COMPLETE
4466,0.35184782062439535,2025-04-25 01:29:39.466521,2025-04-25 01:30:05.621498,0 days 00:00:26.154977,False,absolute_error,42,sqrt,1,8,727,TPESampler,COMPLETE
4467,0.34186583996480413,2025-04-25 01:29:42.499732,2025-04-25 01:30:00.428252,0 days 00:00:17.928520,False,absolute_error,50,sqrt,1,8,433,TPESampler,COMPLETE
4468,0.41300172076800823,2025-04-25 01:29:45.789892,2025-04-25 01:31:12.333118,0 days 00:01:26.543226,False,absolute_error,40,,2,3,596,TPESampler,COMPLETE
4469,0.3266289006469195,2025-04-25 01:29:49.555473,2025-04-25 01:30:19.200982,0 days 00:00:29.645509,False,absolute_error,50,sqrt,1,4,760,TPESampler,COMPLETE
4470,0.3645214979694391,2025-04-25 01:29:55.104203,2025-04-25 01:30:17.079577,0 days 00:00:21.975374,False,absolute_error,43,sqrt,1,13,611,TPESampler,COMPLETE
4471,0.3272422647836658,2025-04-25 01:30:00.680920,2025-04-25 01:30:21.876476,0 days 00:00:21.195556,False,absolute_error,50,sqrt,1,4,556,TPESampler,COMPLETE
4472,0.339997086828124,2025-04-25 01:30:06.004332,2025-04-25 01:30:31.207999,0 days 00:00:25.203667,False,absolute_error,44,sqrt,1,7,691,TPESampler,COMPLETE
4473,0.7370550896952439,2025-04-25 01:30:17.318620,2025-04-25 01:30:22.791141,0 days 00:00:05.472521,False,absolute_error,8,log2,2,9,699,TPESampler,COMPLETE
4474,0.33518954986725863,2025-04-25 01:30:19.449194,2025-04-25 01:30:42.509719,0 days 00:00:23.060525,False,absolute_error,50,sqrt,1,7,620,TPESampler,COMPLETE
4475,0.44671010440495074,2025-04-25 01:30:22.117768,2025-04-25 01:33:21.754888,0 days 00:02:59.637120,False,absolute_error,44,,1,6,770,TPESampler,COMPLETE
4476,0.3276570841815124,2025-04-25 01:30:23.053348,2025-04-25 01:30:34.738762,0 days 00:00:11.685414,False,absolute_error,50,sqrt,1,4,296,TPESampler,COMPLETE
4477,0.3277068750814185,2025-04-25 01:30:31.448513,2025-04-25 01:30:50.852888,0 days 00:00:19.404375,False,absolute_error,50,sqrt,1,4,502,TPESampler,COMPLETE
4478,0.3503427791694744,2025-04-25 01:30:34.973015,2025-04-25 01:30:47.340970,0 days 00:00:12.367955,False,absolute_error,50,sqrt,1,11,318,TPESampler,COMPLETE
4479,0.35512989289603253,2025-04-25 01:30:42.761618,2025-04-25 01:30:57.337039,0 days 00:00:14.575421,False,absolute_error,36,sqrt,1,7,408,TPESampler,COMPLETE
4480,0.42466865583741226,2025-04-25 01:30:47.590581,2025-04-25 01:31:05.650007,0 days 00:00:18.059426,False,absolute_error,49,sqrt,2,8,719,TPESampler,COMPLETE
4481,0.42257693031924154,2025-04-25 01:30:51.097787,2025-04-25 01:31:09.681923,0 days 00:00:18.584136,False,absolute_error,42,sqrt,2,6,755,TPESampler,COMPLETE
4482,0.32592233743378674,2025-04-25 01:30:57.579814,2025-04-25 01:31:16.619978,0 days 00:00:19.040164,False,absolute_error,50,sqrt,1,5,502,TPESampler,COMPLETE
4483,0.33239320702725905,2025-04-25 01:31:02.309768,2025-04-25 01:31:23.753554,0 days 00:00:21.443786,False,absolute_error,43,sqrt,1,5,573,TPESampler,COMPLETE
4484,0.4201249657047829,2025-04-25 01:31:05.882512,2025-04-25 01:31:17.401909,0 days 00:00:11.519397,False,absolute_error,50,sqrt,2,6,446,TPESampler,COMPLETE
4485,0.49413282531480246,2025-04-25 01:31:09.923893,2025-04-25 01:31:11.713693,0 days 00:00:01.789800,False,squared_error,21,,13,12,239,TPESampler,COMPLETE
4486,0.4263153792867162,2025-04-25 01:31:11.947950,2025-04-25 01:31:25.558024,0 days 00:00:13.610074,False,absolute_error,50,sqrt,2,10,535,TPESampler,COMPLETE
4487,0.3447224890691939,2025-04-25 01:31:12.611435,2025-04-25 01:31:22.626524,0 days 00:00:10.015089,False,absolute_error,46,sqrt,1,2,239,TPESampler,COMPLETE
4488,0.3892740660378501,2025-04-25 01:31:16.880721,2025-04-25 01:32:03.936462,0 days 00:00:47.055741,True,absolute_error,25,,3,4,791,TPESampler,COMPLETE
4489,0.3360378192497799,2025-04-25 01:31:17.714531,2025-04-25 01:31:37.188645,0 days 00:00:19.474114,False,absolute_error,50,sqrt,1,7,489,TPESampler,COMPLETE
4490,0.36273294002473344,2025-04-25 01:31:22.875310,2025-04-25 01:31:35.146482,0 days 00:00:12.271172,True,absolute_error,45,sqrt,1,5,579,TPESampler,COMPLETE
4491,0.33931879150511224,2025-04-25 01:31:23.986143,2025-04-25 01:31:27.013616,0 days 00:00:03.027473,False,squared_error,44,sqrt,1,3,577,TPESampler,COMPLETE
4492,0.3361217073334029,2025-04-25 01:31:25.806941,2025-04-25 01:31:54.607543,0 days 00:00:28.800602,False,absolute_error,50,sqrt,1,7,773,TPESampler,COMPLETE
4493,0.4199902471971926,2025-04-25 01:31:27.253770,2025-04-25 01:31:28.983134,0 days 00:00:01.729364,False,squared_error,49,sqrt,2,6,610,TPESampler,COMPLETE
4494,0.3455457767820645,2025-04-25 01:31:29.223639,2025-04-25 01:31:50.977205,0 days 00:00:21.753566,False,absolute_error,42,sqrt,1,7,573,TPESampler,COMPLETE
4495,0.619646108728958,2025-04-25 01:31:35.480252,2025-04-25 01:31:43.427797,0 days 00:00:07.947545,False,absolute_error,50,log2,2,6,492,TPESampler,COMPLETE
4496,0.8587471685542981,2025-04-25 01:31:37.429932,2025-04-25 01:31:39.886467,0 days 00:00:02.456535,True,absolute_error,5,log2,7,2,970,TPESampler,COMPLETE
4497,0.44601255049882566,2025-04-25 01:31:40.126613,2025-04-25 01:33:15.740026,0 days 00:01:35.613413,False,absolute_error,43,,1,6,420,TPESampler,COMPLETE
4498,0.39547234508567397,2025-04-25 01:31:43.673507,2025-04-25 01:31:58.188139,0 days 00:00:14.514632,False,absolute_error,50,log2,1,8,446,TPESampler,COMPLETE
4499,0.32555868602384214,2025-04-25 01:31:51.302339,2025-04-25 01:32:17.540626,0 days 00:00:26.238287,False,absolute_error,50,sqrt,1,5,699,TPESampler,COMPLETE
4500,0.4166984786482184,2025-04-25 01:31:54.847070,2025-04-25 01:32:05.253571,0 days 00:00:10.406501,False,absolute_error,50,sqrt,2,3,407,TPESampler,COMPLETE
4501,0.3324316163953455,2025-04-25 01:31:58.440819,2025-04-25 01:32:04.550857,0 days 00:00:06.110038,False,absolute_error,42,sqrt,1,5,147,TPESampler,COMPLETE
4502,0.4227391688867741,2025-04-25 01:32:04.231859,2025-04-25 01:32:18.604302,0 days 00:00:14.372443,False,absolute_error,50,sqrt,2,7,576,TPESampler,COMPLETE
4503,0.34094469971346114,2025-04-25 01:32:04.981970,2025-04-25 01:32:30.399163,0 days 00:00:25.417193,False,absolute_error,43,sqrt,1,6,686,TPESampler,COMPLETE
4504,0.42084826937693426,2025-04-25 01:32:05.519192,2025-04-25 01:32:21.004452,0 days 00:00:15.485260,False,absolute_error,50,sqrt,2,6,616,TPESampler,COMPLETE
4505,0.32555924019013227,2025-04-25 01:32:17.772415,2025-04-25 01:32:33.982970,0 days 00:00:16.210555,False,absolute_error,50,sqrt,1,5,420,TPESampler,COMPLETE
4506,0.5834951897884642,2025-04-25 01:32:18.853153,2025-04-25 01:32:20.436636,0 days 00:00:01.583483,False,squared_error,9,sqrt,1,2,616,TPESampler,COMPLETE
4507,0.5837239963783113,2025-04-25 01:32:20.683544,2025-04-25 01:32:27.530396,0 days 00:00:06.846852,True,absolute_error,18,log2,1,7,653,TPESampler,COMPLETE
4508,0.32623904047738306,2025-04-25 01:32:21.236526,2025-04-25 01:32:44.517004,0 days 00:00:23.280478,False,absolute_error,50,sqrt,1,4,613,TPESampler,COMPLETE
4509,0.4222369384137264,2025-04-25 01:32:27.774627,2025-04-25 01:32:36.242756,0 days 00:00:08.468129,False,absolute_error,41,sqrt,2,8,325,TPESampler,COMPLETE
4510,0.36547525644428347,2025-04-25 01:32:30.645363,2025-04-25 01:33:33.223140,0 days 00:01:02.577777,True,absolute_error,44,,2,4,716,TPESampler,COMPLETE
4511,0.3317521112677108,2025-04-25 01:32:34.244141,2025-04-25 01:32:54.493154,0 days 00:00:20.249013,False,absolute_error,50,sqrt,1,6,537,TPESampler,COMPLETE
4512,0.45785503805355093,2025-04-25 01:32:36.651966,2025-04-25 01:32:38.112904,0 days 00:00:01.460938,False,squared_error,23,sqrt,2,14,397,TPESampler,COMPLETE
4513,0.33144544559138,2025-04-25 01:32:38.370387,2025-04-25 01:32:57.258054,0 days 00:00:18.887667,False,absolute_error,50,sqrt,1,3,352,TPESampler,COMPLETE
4514,0.42695724394412954,2025-04-25 01:32:45.011656,2025-04-25 01:32:47.255014,0 days 00:00:02.243358,False,squared_error,34,sqrt,2,8,305,TPESampler,COMPLETE
4515,0.33018726284391536,2025-04-25 01:32:47.727076,2025-04-25 01:33:01.254692,0 days 00:00:13.527616,False,absolute_error,50,sqrt,1,6,337,TPESampler,COMPLETE
4516,0.32552800698866785,2025-04-25 01:32:54.735020,2025-04-25 01:33:13.746240,0 days 00:00:19.011220,False,absolute_error,50,sqrt,1,5,447,TPESampler,COMPLETE
4517,0.32599047292342004,2025-04-25 01:32:57.510386,2025-04-25 01:33:04.853855,0 days 00:00:07.343469,False,absolute_error,50,sqrt,1,5,179,TPESampler,COMPLETE
4518,0.3528797296263231,2025-04-25 01:33:01.491565,2025-04-25 01:33:26.540542,0 days 00:00:25.048977,False,absolute_error,36,sqrt,1,6,610,TPESampler,COMPLETE
4519,0.4216606739854349,2025-04-25 01:33:05.100321,2025-04-25 01:33:19.011533,0 days 00:00:13.911212,False,absolute_error,37,sqrt,2,3,481,TPESampler,COMPLETE
4520,0.3300942257422122,2025-04-25 01:33:13.994976,2025-04-25 01:33:30.253919,0 days 00:00:16.258943,False,absolute_error,44,sqrt,1,4,424,TPESampler,COMPLETE
4521,0.33197029597476413,2025-04-25 01:33:15.975194,2025-04-25 01:33:39.433918,0 days 00:00:23.458724,False,absolute_error,42,sqrt,1,5,598,TPESampler,COMPLETE
4522,0.4198912675058772,2025-04-25 01:33:19.263728,2025-04-25 01:33:26.997655,0 days 00:00:07.733927,False,absolute_error,50,sqrt,2,8,250,TPESampler,COMPLETE
4523,0.41646699218789934,2025-04-25 01:33:22.011465,2025-04-25 01:33:35.172204,0 days 00:00:13.160739,False,absolute_error,43,sqrt,2,3,481,TPESampler,COMPLETE
4524,0.33925666317792025,2025-04-25 01:33:26.782570,2025-04-25 01:33:39.064013,0 days 00:00:12.281443,False,absolute_error,41,sqrt,1,3,310,TPESampler,COMPLETE
4525,0.3767430796674486,2025-04-25 01:33:27.254673,2025-04-25 01:33:39.900733,0 days 00:00:12.646060,True,absolute_error,49,sqrt,1,10,507,TPESampler,COMPLETE
4526,0.33575053422658485,2025-04-25 01:33:30.490979,2025-04-25 01:33:50.230272,0 days 00:00:19.739293,False,absolute_error,50,sqrt,1,7,517,TPESampler,COMPLETE
4527,0.4181588412605002,2025-04-25 01:33:33.476400,2025-04-25 01:33:50.716775,0 days 00:00:17.240375,False,absolute_error,50,sqrt,2,3,686,TPESampler,COMPLETE
4528,0.48531248167250973,2025-04-25 01:33:35.630212,2025-04-25 01:34:46.517350,0 days 00:01:10.887138,True,absolute_error,6,,1,38,683,TPESampler,COMPLETE
4529,0.7083396511648327,2025-04-25 01:33:39.307123,2025-04-25 01:33:40.716756,0 days 00:00:01.409633,False,squared_error,33,log2,3,45,376,TPESampler,COMPLETE
4530,0.6280341912862533,2025-04-25 01:33:39.841250,2025-04-25 01:33:49.017720,0 days 00:00:09.176470,False,absolute_error,41,log2,2,10,680,TPESampler,COMPLETE
4531,0.41593165370957147,2025-04-25 01:33:40.228222,2025-04-25 01:33:53.485134,0 days 00:00:13.256912,False,absolute_error,50,sqrt,2,4,466,TPESampler,COMPLETE
4532,0.41708457369121577,2025-04-25 01:33:41.192186,2025-04-25 01:33:56.748975,0 days 00:00:15.556789,False,absolute_error,50,sqrt,2,3,599,TPESampler,COMPLETE
4533,0.3390866931360357,2025-04-25 01:33:49.254774,2025-04-25 01:34:07.734195,0 days 00:00:18.479421,False,absolute_error,43,sqrt,1,3,480,TPESampler,COMPLETE
4534,0.4799965769733065,2025-04-25 01:33:50.469564,2025-04-25 01:34:19.284708,0 days 00:00:28.815144,False,absolute_error,27,,6,28,449,TPESampler,COMPLETE
4535,0.33225823442407687,2025-04-25 01:33:50.985798,2025-04-25 01:34:37.310862,0 days 00:00:46.325064,False,absolute_error,44,sqrt,1,4,832,TPESampler,COMPLETE
4536,0.33395485335940295,2025-04-25 01:33:53.730844,2025-04-25 01:34:29.026656,0 days 00:00:35.295812,False,absolute_error,44,sqrt,1,5,592,TPESampler,COMPLETE
4537,0.34089794486124847,2025-04-25 01:33:57.007359,2025-04-25 01:33:59.078566,0 days 00:00:02.071207,False,squared_error,50,sqrt,1,7,560,TPESampler,COMPLETE
4538,0.3254866215246744,2025-04-25 01:33:59.316180,2025-04-25 01:34:26.632560,0 days 00:00:27.316380,False,absolute_error,50,sqrt,1,5,690,TPESampler,COMPLETE
4539,0.3407078415371046,2025-04-25 01:34:07.967049,2025-04-25 01:34:29.681026,0 days 00:00:21.713977,False,absolute_error,50,sqrt,1,8,582,TPESampler,COMPLETE
4540,0.3340505599137733,2025-04-25 01:34:19.519615,2025-04-25 01:34:33.933800,0 days 00:00:14.414185,False,absolute_error,44,sqrt,1,5,380,TPESampler,COMPLETE
4541,0.3449898300450081,2025-04-25 01:34:26.865710,2025-04-25 01:34:51.441452,0 days 00:00:24.575742,False,absolute_error,50,sqrt,1,10,660,TPESampler,COMPLETE
