number,value,datetime_start,datetime_complete,duration,params_criterion,params_max_depth,params_max_features,params_min_samples_leaf,params_min_samples_split,params_splitter,system_attrs_auto:sampler,state
285,0.49169508102649473,2025-04-24 21:02:14.998733,2025-04-24 21:02:16.367642,0 days 00:00:01.368909,absolute_error,35,sqrt,1,10,best,TPESampler,COMPLETE
286,0.5009416042758076,2025-04-24 21:02:15.413783,2025-04-24 21:02:16.636919,0 days 00:00:01.223136,friedman_mse,23,sqrt,1,7,best,TPESampler,COMPLETE
287,0.6504215924944643,2025-04-24 21:02:16.065092,2025-04-24 21:02:16.826996,0 days 00:00:00.761904,friedman_mse,32,sqrt,3,8,best,TPESampler,COMPLETE
288,0.49668000907792603,2025-04-24 21:02:16.580084,2025-04-24 21:02:17.213063,0 days 00:00:00.632979,absolute_error,34,sqrt,1,11,best,TPESampler,COMPLETE
289,0.8098116966404602,2025-04-24 21:02:16.907909,2025-04-24 21:02:17.598261,0 days 00:00:00.690352,squared_error,9,sqrt,7,2,best,TPESampler,COMPLETE
290,0.5623543669503079,2025-04-24 21:02:17.058534,2025-04-24 21:02:17.914859,0 days 00:00:00.856325,squared_error,30,sqrt,1,5,best,TPESampler,COMPLETE
291,0.5435622016360893,2025-04-24 21:02:17.488644,2025-04-24 21:02:18.256149,0 days 00:00:00.767505,friedman_mse,27,sqrt,1,7,best,TPESampler,COMPLETE
292,0.6270092229911071,2025-04-24 21:02:17.847827,2025-04-24 21:02:18.691171,0 days 00:00:00.843344,absolute_error,29,sqrt,3,9,best,TPESampler,COMPLETE
293,0.5383133310961669,2025-04-24 21:02:18.201180,2025-04-24 21:02:19.052556,0 days 00:00:00.851376,absolute_error,22,sqrt,1,4,best,TPESampler,COMPLETE
294,0.90157797490464,2025-04-24 21:02:18.525458,2025-04-24 21:02:19.376276,0 days 00:00:00.850818,friedman_mse,2,log2,8,20,best,TPESampler,COMPLETE
295,0.7003059633287799,2025-04-24 21:02:18.974524,2025-04-24 21:02:19.900077,0 days 00:00:00.925553,absolute_error,35,sqrt,3,15,random,TPESampler,COMPLETE
296,0.5026787432477088,2025-04-24 21:02:19.325667,2025-04-24 21:02:20.249227,0 days 00:00:00.923560,squared_error,34,sqrt,1,14,best,TPESampler,COMPLETE
297,0.6011985060572526,2025-04-24 21:02:19.691196,2025-04-24 21:02:20.778097,0 days 00:00:01.086901,absolute_error,35,sqrt,2,9,best,TPESampler,COMPLETE
298,0.6504215924944643,2025-04-24 21:02:20.241232,2025-04-24 21:02:20.959915,0 days 00:00:00.718683,squared_error,33,sqrt,3,9,best,TPESampler,COMPLETE
299,0.5280304516867977,2025-04-24 21:02:20.532901,2025-04-24 21:02:21.404048,0 days 00:00:00.871147,absolute_error,30,sqrt,1,10,best,TPESampler,COMPLETE
300,0.868375860084902,2025-04-24 21:02:21.068552,2025-04-24 21:02:21.941325,0 days 00:00:00.872773,friedman_mse,5,sqrt,9,11,best,TPESampler,COMPLETE
301,0.8777936402968048,2025-04-24 21:02:21.175472,2025-04-24 21:02:21.950531,0 days 00:00:00.775059,absolute_error,4,sqrt,1,17,best,TPESampler,COMPLETE
302,0.49169508102649473,2025-04-24 21:02:21.708432,2025-04-24 21:02:22.310362,0 days 00:00:00.601930,absolute_error,35,sqrt,1,10,best,TPESampler,COMPLETE
303,0.5479322564786873,2025-04-24 21:02:22.183696,2025-04-24 21:02:23.108692,0 days 00:00:00.924996,friedman_mse,35,sqrt,1,6,best,TPESampler,COMPLETE
304,0.482024331116523,2025-04-24 21:02:22.255892,2025-04-24 21:02:23.062068,0 days 00:00:00.806176,absolute_error,35,sqrt,1,9,best,TPESampler,COMPLETE
305,0.6194853816763535,2025-04-24 21:02:22.516904,2025-04-24 21:02:23.381459,0 days 00:00:00.864555,friedman_mse,35,sqrt,2,8,best,TPESampler,COMPLETE
306,0.5226166766745245,2025-04-24 21:02:23.293318,2025-04-24 21:02:24.230210,0 days 00:00:00.936892,absolute_error,28,sqrt,1,7,best,TPESampler,COMPLETE
307,0.5976748780881214,2025-04-24 21:02:23.339687,2025-04-24 21:02:24.057949,0 days 00:00:00.718262,absolute_error,35,sqrt,3,8,best,TPESampler,COMPLETE
308,0.5162521900441466,2025-04-24 21:02:23.597428,2025-04-24 21:02:24.378763,0 days 00:00:00.781335,absolute_error,30,sqrt,1,9,best,TPESampler,COMPLETE
309,0.6180856799418332,2025-04-24 21:02:24.285552,2025-04-24 21:02:24.940842,0 days 00:00:00.655290,squared_error,31,sqrt,2,7,best,TPESampler,COMPLETE
310,0.9015251732962958,2025-04-24 21:02:24.508648,2025-04-24 21:02:25.243599,0 days 00:00:00.734951,absolute_error,19,log2,8,10,best,TPESampler,COMPLETE
311,0.90157797490464,2025-04-24 21:02:24.873239,2025-04-24 21:02:25.896516,0 days 00:00:01.023277,squared_error,35,log2,10,16,best,TPESampler,COMPLETE
312,0.49390761255894267,2025-04-24 21:02:25.239269,2025-04-24 21:02:26.196879,0 days 00:00:00.957610,absolute_error,35,sqrt,1,8,best,TPESampler,COMPLETE
313,0.5518815421255675,2025-04-24 21:02:25.548653,2025-04-24 21:02:26.374030,0 days 00:00:00.825377,friedman_mse,25,sqrt,1,6,best,TPESampler,COMPLETE
314,0.49443831345136974,2025-04-24 21:02:26.117353,2025-04-24 21:02:26.901888,0 days 00:00:00.784535,absolute_error,34,sqrt,1,8,best,TPESampler,COMPLETE
315,0.47983015285862346,2025-04-24 21:02:26.473666,2025-04-24 21:02:27.251776,0 days 00:00:00.778110,friedman_mse,28,sqrt,1,6,best,TPESampler,COMPLETE
316,0.7417728476491167,2025-04-24 21:02:26.652678,2025-04-24 21:02:27.410178,0 days 00:00:00.757500,absolute_error,35,log2,2,15,best,TPESampler,COMPLETE
317,0.4841824780964295,2025-04-24 21:02:27.182630,2025-04-24 21:02:27.829680,0 days 00:00:00.647050,friedman_mse,25,sqrt,1,5,best,TPESampler,COMPLETE
318,0.6265479990281826,2025-04-24 21:02:27.524857,2025-04-24 21:02:28.297659,0 days 00:00:00.772802,friedman_mse,25,sqrt,2,3,best,TPESampler,COMPLETE
319,0.6650731755197367,2025-04-24 21:02:27.697298,2025-04-24 21:02:28.477021,0 days 00:00:00.779723,friedman_mse,22,log2,1,4,best,TPESampler,COMPLETE
320,0.4868744820818364,2025-04-24 21:02:28.009947,2025-04-24 21:02:28.831948,0 days 00:00:00.822001,friedman_mse,27,sqrt,1,6,best,TPESampler,COMPLETE
321,0.5229942037417156,2025-04-24 21:02:28.562523,2025-04-24 21:02:29.368869,0 days 00:00:00.806346,friedman_mse,25,sqrt,1,4,best,TPESampler,COMPLETE
322,0.5518815421255675,2025-04-24 21:02:28.764780,2025-04-24 21:02:29.568196,0 days 00:00:00.803416,friedman_mse,25,sqrt,1,6,best,TPESampler,COMPLETE
323,0.5975832321496914,2025-04-24 21:02:29.071482,2025-04-24 21:02:30.112634,0 days 00:00:01.041152,friedman_mse,28,sqrt,2,5,best,TPESampler,COMPLETE
324,0.9016215139057422,2025-04-24 21:02:29.646039,2025-04-24 21:02:30.633029,0 days 00:00:00.986990,absolute_error,34,log2,10,9,random,TPESampler,COMPLETE
325,0.6589532298970542,2025-04-24 21:02:29.889756,2025-04-24 21:02:30.941820,0 days 00:00:01.052064,friedman_mse,13,sqrt,1,8,best,TPESampler,COMPLETE
326,0.6984223697207417,2025-04-24 21:02:30.755786,2025-04-24 21:02:31.913110,0 days 00:00:01.157324,friedman_mse,16,sqrt,4,7,best,TPESampler,COMPLETE
327,0.5137295393660822,2025-04-24 21:02:30.873512,2025-04-24 21:02:31.535064,0 days 00:00:00.661552,friedman_mse,24,sqrt,1,8,best,TPESampler,COMPLETE
328,0.8739965405465177,2025-04-24 21:02:31.173230,2025-04-24 21:02:32.022610,0 days 00:00:00.849380,squared_error,9,log2,5,17,best,TPESampler,COMPLETE
329,0.5435622016360893,2025-04-24 21:02:31.856769,2025-04-24 21:02:32.566456,0 days 00:00:00.709687,friedman_mse,27,sqrt,1,7,best,TPESampler,COMPLETE
330,0.47983015285862346,2025-04-24 21:02:32.157878,2025-04-24 21:02:32.914023,0 days 00:00:00.756145,friedman_mse,28,sqrt,1,6,best,TPESampler,COMPLETE
331,0.5137879318052204,2025-04-24 21:02:32.377275,2025-04-24 21:02:33.106448,0 days 00:00:00.729173,squared_error,35,sqrt,1,10,best,TPESampler,COMPLETE
332,0.5082425385680613,2025-04-24 21:02:32.852839,2025-04-24 21:02:33.468244,0 days 00:00:00.615405,friedman_mse,34,sqrt,1,2,best,TPESampler,COMPLETE
333,0.47983015285862346,2025-04-24 21:02:33.190547,2025-04-24 21:02:33.987363,0 days 00:00:00.796816,friedman_mse,28,sqrt,1,6,best,TPESampler,COMPLETE
334,0.5435622016360893,2025-04-24 21:02:33.348393,2025-04-24 21:02:34.054309,0 days 00:00:00.705916,friedman_mse,27,sqrt,1,7,best,TPESampler,COMPLETE
335,0.6456349183315407,2025-04-24 21:02:33.786481,2025-04-24 21:02:34.521359,0 days 00:00:00.734878,friedman_mse,22,sqrt,3,7,best,TPESampler,COMPLETE
336,0.5191719425869716,2025-04-24 21:02:34.218971,2025-04-24 21:02:35.022746,0 days 00:00:00.803775,friedman_mse,29,sqrt,1,5,best,TPESampler,COMPLETE
337,0.6515872609760095,2025-04-24 21:02:34.264351,2025-04-24 21:02:35.187034,0 days 00:00:00.922683,friedman_mse,23,sqrt,2,6,best,TPESampler,COMPLETE
338,0.48806613863614323,2025-04-24 21:02:34.952512,2025-04-24 21:02:35.688993,0 days 00:00:00.736481,friedman_mse,28,sqrt,1,4,best,TPESampler,COMPLETE
339,0.6456349183315407,2025-04-24 21:02:35.243945,2025-04-24 21:02:36.107462,0 days 00:00:00.863517,friedman_mse,28,sqrt,3,4,best,TPESampler,COMPLETE
340,0.5373966342965538,2025-04-24 21:02:35.534763,2025-04-24 21:02:36.286566,0 days 00:00:00.751803,friedman_mse,29,sqrt,1,4,best,TPESampler,COMPLETE
341,0.5378902223820379,2025-04-24 21:02:35.978038,2025-04-24 21:02:36.629357,0 days 00:00:00.651319,friedman_mse,24,sqrt,1,6,best,TPESampler,COMPLETE
342,0.606614313890833,2025-04-24 21:02:36.323389,2025-04-24 21:02:37.128494,0 days 00:00:00.805105,friedman_mse,24,sqrt,1,5,random,TPESampler,COMPLETE
343,0.5164242646936524,2025-04-24 21:02:36.503476,2025-04-24 21:02:37.302544,0 days 00:00:00.799068,friedman_mse,26,sqrt,1,3,best,TPESampler,COMPLETE
344,0.5373966342965538,2025-04-24 21:02:36.853008,2025-04-24 21:02:37.559415,0 days 00:00:00.706407,friedman_mse,29,sqrt,1,4,best,TPESampler,COMPLETE
345,0.46570797980588163,2025-04-24 21:02:37.402397,2025-04-24 21:02:38.166749,0 days 00:00:00.764352,friedman_mse,31,sqrt,1,7,best,TPESampler,COMPLETE
346,0.6504215924944643,2025-04-24 21:02:37.517973,2025-04-24 21:02:38.545481,0 days 00:00:01.027508,friedman_mse,27,sqrt,3,8,best,TPESampler,COMPLETE
347,0.47983015285862346,2025-04-24 21:02:37.780800,2025-04-24 21:02:38.652885,0 days 00:00:00.872085,friedman_mse,28,sqrt,1,6,best,TPESampler,COMPLETE
348,0.5020512557327408,2025-04-24 21:02:38.488458,2025-04-24 21:02:39.197441,0 days 00:00:00.708983,friedman_mse,30,sqrt,1,8,best,TPESampler,COMPLETE
349,0.6456349183315407,2025-04-24 21:02:38.791892,2025-04-24 21:02:39.511114,0 days 00:00:00.719222,friedman_mse,32,sqrt,3,7,best,TPESampler,COMPLETE
350,0.8609035623054152,2025-04-24 21:02:39.043770,2025-04-24 21:02:39.824816,0 days 00:00:00.781046,friedman_mse,32,log2,4,2,best,TPESampler,COMPLETE
351,0.9018784399194749,2025-04-24 21:02:39.504759,2025-04-24 21:02:40.198938,0 days 00:00:00.694179,friedman_mse,32,log2,8,11,random,TPESampler,COMPLETE
352,0.6180856799418332,2025-04-24 21:02:39.813900,2025-04-24 21:02:40.524208,0 days 00:00:00.710308,friedman_mse,27,sqrt,2,7,best,TPESampler,COMPLETE
353,0.5157610196982807,2025-04-24 21:02:40.101092,2025-04-24 21:02:40.958910,0 days 00:00:00.857818,friedman_mse,26,sqrt,1,7,best,TPESampler,COMPLETE
354,0.862556598302901,2025-04-24 21:02:40.481460,2025-04-24 21:02:41.179393,0 days 00:00:00.697933,friedman_mse,3,sqrt,4,5,random,TPESampler,COMPLETE
355,0.8767756438403109,2025-04-24 21:02:40.767839,2025-04-24 21:02:41.538291,0 days 00:00:00.770452,absolute_error,23,sqrt,8,11,random,TPESampler,COMPLETE
356,0.4750160173487102,2025-04-24 21:02:41.257896,2025-04-24 21:02:42.074478,0 days 00:00:00.816582,friedman_mse,32,sqrt,1,5,best,TPESampler,COMPLETE
357,0.5946192053612878,2025-04-24 21:02:41.419207,2025-04-24 21:02:42.189063,0 days 00:00:00.769856,friedman_mse,34,log2,1,5,best,TPESampler,COMPLETE
358,0.5020512557327408,2025-04-24 21:02:41.740691,2025-04-24 21:02:42.484244,0 days 00:00:00.743553,friedman_mse,30,sqrt,1,8,best,TPESampler,COMPLETE
359,0.6265479990281826,2025-04-24 21:02:42.362983,2025-04-24 21:02:43.363310,0 days 00:00:01.000327,friedman_mse,34,sqrt,2,4,best,TPESampler,COMPLETE
360,0.6456349183315407,2025-04-24 21:02:42.423136,2025-04-24 21:02:43.157435,0 days 00:00:00.734299,squared_error,22,sqrt,3,2,best,TPESampler,COMPLETE
361,0.5975832321496914,2025-04-24 21:02:42.697246,2025-04-24 21:02:43.446046,0 days 00:00:00.748800,friedman_mse,34,sqrt,2,5,best,TPESampler,COMPLETE
362,0.48921668337565616,2025-04-24 21:02:43.400221,2025-04-24 21:02:43.966096,0 days 00:00:00.565875,friedman_mse,32,sqrt,1,6,best,TPESampler,COMPLETE
363,0.7446881808179323,2025-04-24 21:02:43.571154,2025-04-24 21:02:44.373208,0 days 00:00:00.802054,absolute_error,15,log2,2,9,best,TPESampler,COMPLETE
364,0.5298778451782702,2025-04-24 21:02:43.701727,2025-04-24 21:02:44.472755,0 days 00:00:00.771028,friedman_mse,32,sqrt,1,7,best,TPESampler,COMPLETE
365,0.5103041358943772,2025-04-24 21:02:44.281646,2025-04-24 21:02:45.305145,0 days 00:00:01.023499,friedman_mse,31,sqrt,1,9,best,TPESampler,COMPLETE
366,0.550928635982706,2025-04-24 21:02:44.563327,2025-04-24 21:02:45.354437,0 days 00:00:00.791110,friedman_mse,34,sqrt,1,8,best,TPESampler,COMPLETE
367,0.4868744820818364,2025-04-24 21:02:45.041798,2025-04-24 21:02:45.978344,0 days 00:00:00.936546,friedman_mse,27,sqrt,1,6,best,TPESampler,COMPLETE
368,0.5724846347554697,2025-04-24 21:02:45.697236,2025-04-24 21:02:47.009841,0 days 00:00:01.312605,friedman_mse,30,sqrt,1,7,best,TPESampler,COMPLETE
369,0.5020512557327408,2025-04-24 21:02:45.753799,2025-04-24 21:02:47.211488,0 days 00:00:01.457689,squared_error,30,sqrt,1,8,best,TPESampler,COMPLETE
370,0.48350783172535233,2025-04-24 21:02:46.241230,2025-04-24 21:02:47.688676,0 days 00:00:01.447446,friedman_mse,34,sqrt,1,7,best,TPESampler,COMPLETE
371,0.6456349183315407,2025-04-24 21:02:47.383599,2025-04-24 21:02:48.697877,0 days 00:00:01.314278,friedman_mse,34,sqrt,3,4,best,TPESampler,COMPLETE
372,0.6278699030037329,2025-04-24 21:02:47.799002,2025-04-24 21:02:49.840098,0 days 00:00:02.041096,squared_error,26,sqrt,1,3,random,TPESampler,COMPLETE
373,0.90157797490464,2025-04-24 21:02:48.620597,2025-04-24 21:02:50.908943,0 days 00:00:02.288346,friedman_mse,28,log2,9,19,best,TPESampler,COMPLETE
374,0.6194853816763535,2025-04-24 21:02:49.697668,2025-04-24 21:02:51.232224,0 days 00:00:01.534556,friedman_mse,32,sqrt,2,8,best,TPESampler,COMPLETE
375,0.5129561010742344,2025-04-24 21:02:50.546423,2025-04-24 21:02:52.196355,0 days 00:00:01.649932,friedman_mse,33,sqrt,1,7,best,TPESampler,COMPLETE
376,0.6504215924944643,2025-04-24 21:02:51.381598,2025-04-24 21:02:52.695684,0 days 00:00:01.314086,squared_error,33,sqrt,3,11,best,TPESampler,COMPLETE
377,0.5137879318052204,2025-04-24 21:02:51.661483,2025-04-24 21:02:53.022082,0 days 00:00:01.360599,friedman_mse,35,sqrt,1,10,best,TPESampler,COMPLETE
378,0.7014109281977066,2025-04-24 21:02:52.633026,2025-04-24 21:02:53.742204,0 days 00:00:01.109178,absolute_error,14,sqrt,10,6,best,TPESampler,COMPLETE
379,0.6515872609760095,2025-04-24 21:02:53.309291,2025-04-24 21:02:54.133960,0 days 00:00:00.824669,friedman_mse,35,sqrt,2,6,best,TPESampler,COMPLETE
380,0.6194853816763535,2025-04-24 21:02:53.456335,2025-04-24 21:02:54.735155,0 days 00:00:01.278820,squared_error,35,sqrt,2,8,best,TPESampler,COMPLETE
381,0.6135054133428214,2025-04-24 21:02:53.985252,2025-04-24 21:02:55.679979,0 days 00:00:01.694727,absolute_error,28,sqrt,2,5,best,TPESampler,COMPLETE
382,0.48921668337565616,2025-04-24 21:02:54.628176,2025-04-24 21:02:56.065365,0 days 00:00:01.437189,friedman_mse,32,sqrt,1,6,best,TPESampler,COMPLETE
383,0.5628830452201053,2025-04-24 21:02:55.362401,2025-04-24 21:02:56.360727,0 days 00:00:00.998326,friedman_mse,33,sqrt,1,8,random,TPESampler,COMPLETE
384,0.9016215139057422,2025-04-24 21:02:56.003031,2025-04-24 21:02:57.209245,0 days 00:00:01.206214,absolute_error,6,log2,9,7,random,TPESampler,COMPLETE
385,0.49068441274037305,2025-04-24 21:02:56.469508,2025-04-24 21:02:58.015717,0 days 00:00:01.546209,friedman_mse,31,sqrt,1,6,best,TPESampler,COMPLETE
386,0.5062914135583193,2025-04-24 21:02:56.699267,2025-04-24 21:02:58.196817,0 days 00:00:01.497550,absolute_error,29,sqrt,1,4,best,TPESampler,COMPLETE
387,0.4653938401437279,2025-04-24 21:02:57.533588,2025-04-24 21:02:58.550490,0 days 00:00:01.016902,friedman_mse,32,sqrt,1,4,best,TPESampler,COMPLETE
388,0.74349522764793,2025-04-24 21:02:58.301164,2025-04-24 21:02:59.459185,0 days 00:00:01.158021,squared_error,25,log2,3,4,best,TPESampler,COMPLETE
389,0.6586554851151968,2025-04-24 21:02:58.439153,2025-04-24 21:02:59.743617,0 days 00:00:01.304464,absolute_error,35,sqrt,2,7,random,TPESampler,COMPLETE
390,0.48333612106664076,2025-04-24 21:02:58.911772,2025-04-24 21:02:59.972986,0 days 00:00:01.061214,friedman_mse,31,sqrt,1,4,best,TPESampler,COMPLETE
391,0.8790475103328365,2025-04-24 21:02:59.804255,2025-04-24 21:03:00.809246,0 days 00:00:01.004991,absolute_error,14,log2,6,5,random,TPESampler,COMPLETE
392,0.49783262823116015,2025-04-24 21:03:00.102723,2025-04-24 21:03:01.135525,0 days 00:00:01.032802,friedman_mse,31,sqrt,1,5,best,TPESampler,COMPLETE
393,0.48806613863614323,2025-04-24 21:03:00.418403,2025-04-24 21:03:01.303844,0 days 00:00:00.885441,friedman_mse,28,sqrt,1,4,best,TPESampler,COMPLETE
394,0.5827292820409873,2025-04-24 21:03:01.173346,2025-04-24 21:03:01.922057,0 days 00:00:00.748711,absolute_error,34,sqrt,4,8,best,TPESampler,COMPLETE
395,0.4805121307275211,2025-04-24 21:03:01.383133,2025-04-24 21:03:02.425873,0 days 00:00:01.042740,friedman_mse,33,sqrt,1,3,best,TPESampler,COMPLETE
396,0.6456349183315407,2025-04-24 21:03:01.556954,2025-04-24 21:03:02.529206,0 days 00:00:00.972252,friedman_mse,34,sqrt,3,3,best,TPESampler,COMPLETE
397,0.4805121307275211,2025-04-24 21:03:02.143745,2025-04-24 21:03:02.821067,0 days 00:00:00.677322,friedman_mse,33,sqrt,1,3,best,TPESampler,COMPLETE
398,0.5520453318079024,2025-04-24 21:03:02.697541,2025-04-24 21:03:03.523497,0 days 00:00:00.825956,friedman_mse,29,sqrt,1,2,best,TPESampler,COMPLETE
399,0.5517493393728706,2025-04-24 21:03:02.775309,2025-04-24 21:03:03.750525,0 days 00:00:00.975216,friedman_mse,35,sqrt,1,4,best,TPESampler,COMPLETE
400,0.5392396456504133,2025-04-24 21:03:03.039938,2025-04-24 21:03:03.874438,0 days 00:00:00.834500,friedman_mse,34,sqrt,1,3,best,TPESampler,COMPLETE
401,0.6265479990281826,2025-04-24 21:03:03.810480,2025-04-24 21:03:04.660634,0 days 00:00:00.850154,friedman_mse,30,sqrt,2,2,best,TPESampler,COMPLETE
402,0.5469433296825841,2025-04-24 21:03:03.995576,2025-04-24 21:03:05.004494,0 days 00:00:01.008918,friedman_mse,35,sqrt,1,3,best,TPESampler,COMPLETE
403,0.90157797490464,2025-04-24 21:03:04.086038,2025-04-24 21:03:05.003103,0 days 00:00:00.917065,squared_error,1,log2,9,5,best,TPESampler,COMPLETE
404,0.6173421226101489,2025-04-24 21:03:04.947871,2025-04-24 21:03:05.601867,0 days 00:00:00.653996,absolute_error,35,sqrt,3,7,best,TPESampler,COMPLETE
405,0.5338046397110097,2025-04-24 21:03:05.235488,2025-04-24 21:03:06.205171,0 days 00:00:00.969683,friedman_mse,32,sqrt,1,2,best,TPESampler,COMPLETE
406,0.5529688132197964,2025-04-24 21:03:05.314212,2025-04-24 21:03:06.685925,0 days 00:00:01.371713,friedman_mse,35,sqrt,1,2,best,TPESampler,COMPLETE
407,0.7688466480043374,2025-04-24 21:03:06.083244,2025-04-24 21:03:07.183780,0 days 00:00:01.100536,friedman_mse,27,sqrt,5,15,random,TPESampler,COMPLETE
408,0.6140253855158658,2025-04-24 21:03:06.743027,2025-04-24 21:03:07.631730,0 days 00:00:00.888703,absolute_error,35,sqrt,3,9,best,TPESampler,COMPLETE
409,0.5260423073871372,2025-04-24 21:03:07.051521,2025-04-24 21:03:07.817474,0 days 00:00:00.765953,absolute_error,28,sqrt,1,9,best,TPESampler,COMPLETE
410,0.49443831345136974,2025-04-24 21:03:07.408969,2025-04-24 21:03:08.107021,0 days 00:00:00.698052,absolute_error,34,sqrt,1,8,best,TPESampler,COMPLETE
411,0.49390761255894267,2025-04-24 21:03:07.885877,2025-04-24 21:03:09.201032,0 days 00:00:01.315155,absolute_error,35,sqrt,1,8,best,TPESampler,COMPLETE
412,0.583652229795029,2025-04-24 21:03:08.104127,2025-04-24 21:03:09.671097,0 days 00:00:01.566970,absolute_error,34,sqrt,1,14,best,TPESampler,COMPLETE
413,0.9018784399194749,2025-04-24 21:03:09.156155,2025-04-24 21:03:09.937951,0 days 00:00:00.781796,friedman_mse,14,log2,9,10,random,TPESampler,COMPLETE
414,0.6456349183315407,2025-04-24 21:03:09.519030,2025-04-24 21:03:10.227489,0 days 00:00:00.708459,friedman_mse,30,sqrt,3,5,best,TPESampler,COMPLETE
415,0.6171244315576496,2025-04-24 21:03:09.940394,2025-04-24 21:03:10.713251,0 days 00:00:00.772857,absolute_error,35,sqrt,3,15,best,TPESampler,COMPLETE
416,0.49169508102649473,2025-04-24 21:03:10.171297,2025-04-24 21:03:11.060357,0 days 00:00:00.889060,absolute_error,35,sqrt,1,10,best,TPESampler,COMPLETE
417,0.5262906297733717,2025-04-24 21:03:10.605617,2025-04-24 21:03:11.622344,0 days 00:00:01.016727,friedman_mse,34,sqrt,1,5,best,TPESampler,COMPLETE
418,0.550729237046517,2025-04-24 21:03:11.010916,2025-04-24 21:03:11.910736,0 days 00:00:00.899820,absolute_error,35,sqrt,1,6,best,TPESampler,COMPLETE
419,0.6456349183315407,2025-04-24 21:03:11.299307,2025-04-24 21:03:12.358220,0 days 00:00:01.058913,friedman_mse,29,sqrt,3,6,best,TPESampler,COMPLETE
420,0.7362682183268586,2025-04-24 21:03:11.875910,2025-04-24 21:03:12.551334,0 days 00:00:00.675424,absolute_error,19,sqrt,5,19,best,TPESampler,COMPLETE
421,0.8929076253830125,2025-04-24 21:03:12.125745,2025-04-24 21:03:12.977864,0 days 00:00:00.852119,friedman_mse,1,log2,2,2,best,TPESampler,COMPLETE
422,0.49390761255894267,2025-04-24 21:03:12.654549,2025-04-24 21:03:13.486216,0 days 00:00:00.831667,absolute_error,35,sqrt,1,8,best,TPESampler,COMPLETE
423,0.5114477233942855,2025-04-24 21:03:12.804395,2025-04-24 21:03:13.918907,0 days 00:00:01.114512,friedman_mse,28,sqrt,1,8,best,TPESampler,COMPLETE
424,0.8687336452537693,2025-04-24 21:03:13.297296,2025-04-24 21:03:14.164633,0 days 00:00:00.867337,friedman_mse,6,sqrt,6,19,best,TPESampler,COMPLETE
425,0.6088858348174665,2025-04-24 21:03:13.831930,2025-04-24 21:03:14.525633,0 days 00:00:00.693703,absolute_error,28,sqrt,3,10,best,TPESampler,COMPLETE
426,0.5373966342965538,2025-04-24 21:03:14.195682,2025-04-24 21:03:14.937581,0 days 00:00:00.741899,friedman_mse,29,sqrt,1,4,best,TPESampler,COMPLETE
427,0.8737590921917946,2025-04-24 21:03:14.488062,2025-04-24 21:03:15.334183,0 days 00:00:00.846121,friedman_mse,4,sqrt,8,16,random,TPESampler,COMPLETE
428,0.90157797490464,2025-04-24 21:03:14.790781,2025-04-24 21:03:15.534068,0 days 00:00:00.743287,squared_error,27,log2,10,10,best,TPESampler,COMPLETE
