number,value,datetime_start,datetime_complete,duration,params_criterion,params_max_depth,params_max_features,params_min_samples_leaf,params_min_samples_split,params_splitter,system_attrs_auto:sampler,state
2004,0.9015251732962958,2025-04-24 21:14:00.705286,2025-04-24 21:14:01.923311,0 days 00:00:01.218025,absolute_error,14,log2,10,20,best,TPESampler,COMPLETE
2005,0.5103041358943772,2025-04-24 21:14:01.105933,2025-04-24 21:14:01.801099,0 days 00:00:00.695166,friedman_mse,31,sqrt,1,9,best,TPESampler,COMPLETE
2006,0.6456349183315407,2025-04-24 21:14:01.727143,2025-04-24 21:14:02.639819,0 days 00:00:00.912676,friedman_mse,30,sqrt,3,6,best,TPESampler,COMPLETE
2007,0.49783262823116015,2025-04-24 21:14:02.101185,2025-04-24 21:14:02.898163,0 days 00:00:00.796978,friedman_mse,31,sqrt,1,5,best,TPESampler,COMPLETE
2008,0.5868750603971733,2025-04-24 21:14:02.385437,2025-04-24 21:14:03.224630,0 days 00:00:00.839193,friedman_mse,35,sqrt,1,7,best,TPESampler,COMPLETE
2009,0.6194853816763535,2025-04-24 21:14:03.077357,2025-04-24 21:14:03.907581,0 days 00:00:00.830224,friedman_mse,31,sqrt,2,8,best,TPESampler,COMPLETE
2010,0.6515872609760095,2025-04-24 21:14:03.298155,2025-04-24 21:14:04.074865,0 days 00:00:00.776710,friedman_mse,30,sqrt,2,6,best,TPESampler,COMPLETE
2011,0.5975832321496914,2025-04-24 21:14:03.550226,2025-04-24 21:14:04.354147,0 days 00:00:00.803921,friedman_mse,30,sqrt,2,5,best,TPESampler,COMPLETE
2012,0.5817002843973,2025-04-24 21:14:04.241113,2025-04-24 21:14:04.971541,0 days 00:00:00.730428,friedman_mse,31,sqrt,1,3,random,TPESampler,COMPLETE
2013,0.5724846347554697,2025-04-24 21:14:04.292053,2025-04-24 21:14:05.401940,0 days 00:00:01.109887,friedman_mse,30,sqrt,1,7,best,TPESampler,COMPLETE
2014,0.90157797490464,2025-04-24 21:14:04.629320,2025-04-24 21:14:05.656939,0 days 00:00:01.027619,friedman_mse,25,log2,9,2,best,TPESampler,COMPLETE
2015,0.6049361796283343,2025-04-24 21:14:05.351666,2025-04-24 21:14:06.382647,0 days 00:00:01.030981,absolute_error,25,log2,1,5,best,TPESampler,COMPLETE
2016,0.6456349183315407,2025-04-24 21:14:05.727664,2025-04-24 21:14:07.003453,0 days 00:00:01.275789,friedman_mse,32,sqrt,3,5,best,TPESampler,COMPLETE
2017,0.6456349183315407,2025-04-24 21:14:05.927336,2025-04-24 21:14:07.232897,0 days 00:00:01.305561,friedman_mse,35,sqrt,3,5,best,TPESampler,COMPLETE
2018,0.5517493393728706,2025-04-24 21:14:06.906524,2025-04-24 21:14:07.788591,0 days 00:00:00.882067,friedman_mse,35,sqrt,1,4,best,TPESampler,COMPLETE
2019,0.6289323974475082,2025-04-24 21:14:07.371967,2025-04-24 21:14:08.409758,0 days 00:00:01.037791,friedman_mse,35,sqrt,2,9,best,TPESampler,COMPLETE
2020,0.49068441274037305,2025-04-24 21:14:07.444558,2025-04-24 21:14:08.709318,0 days 00:00:01.264760,squared_error,31,sqrt,1,6,best,TPESampler,COMPLETE
2021,0.6289323974475082,2025-04-24 21:14:08.354493,2025-04-24 21:14:09.346369,0 days 00:00:00.991876,friedman_mse,29,sqrt,2,12,best,TPESampler,COMPLETE
2022,0.5593525150541101,2025-04-24 21:14:08.782231,2025-04-24 21:14:09.831678,0 days 00:00:01.049447,friedman_mse,30,sqrt,1,4,best,TPESampler,COMPLETE
2023,0.5623543669503079,2025-04-24 21:14:08.961931,2025-04-24 21:14:09.830124,0 days 00:00:00.868193,friedman_mse,30,sqrt,1,5,best,TPESampler,COMPLETE
2024,0.4831415131013947,2025-04-24 21:14:09.681283,2025-04-24 21:14:10.428866,0 days 00:00:00.747583,friedman_mse,31,sqrt,1,8,best,TPESampler,COMPLETE
2025,0.8737590921917946,2025-04-24 21:14:10.139783,2025-04-24 21:14:11.231337,0 days 00:00:01.091554,friedman_mse,35,sqrt,7,5,random,TPESampler,COMPLETE
2026,0.5296855957806621,2025-04-24 21:14:10.185817,2025-04-24 21:14:11.141834,0 days 00:00:00.956017,friedman_mse,26,sqrt,1,8,best,TPESampler,COMPLETE
2027,0.6504215924944643,2025-04-24 21:14:10.956086,2025-04-24 21:14:12.165719,0 days 00:00:01.209633,friedman_mse,29,sqrt,3,8,best,TPESampler,COMPLETE
2028,0.5339224783480143,2025-04-24 21:14:11.434977,2025-04-24 21:14:12.434573,0 days 00:00:00.999596,friedman_mse,35,sqrt,1,8,best,TPESampler,COMPLETE
2029,0.46570797980588163,2025-04-24 21:14:11.625797,2025-04-24 21:14:12.576492,0 days 00:00:00.950695,friedman_mse,31,sqrt,1,7,best,TPESampler,COMPLETE
2030,0.5137879318052204,2025-04-24 21:14:12.463534,2025-04-24 21:14:13.495226,0 days 00:00:01.031692,friedman_mse,35,sqrt,1,10,best,TPESampler,COMPLETE
2031,0.5363625633065204,2025-04-24 21:14:12.697209,2025-04-24 21:14:13.881426,0 days 00:00:01.184217,friedman_mse,26,sqrt,1,10,best,TPESampler,COMPLETE
2032,0.5931437620021845,2025-04-24 21:14:12.893116,2025-04-24 21:14:13.887781,0 days 00:00:00.994665,friedman_mse,33,sqrt,1,9,random,TPESampler,COMPLETE
2033,0.69774228910209,2025-04-24 21:14:13.748410,2025-04-24 21:14:14.585712,0 days 00:00:00.837302,absolute_error,34,sqrt,3,2,random,TPESampler,COMPLETE
2034,0.5362679897395523,2025-04-24 21:14:14.173409,2025-04-24 21:14:15.082148,0 days 00:00:00.908739,friedman_mse,32,sqrt,1,11,best,TPESampler,COMPLETE
2035,0.6456349183315407,2025-04-24 21:14:14.255385,2025-04-24 21:14:15.237626,0 days 00:00:00.982241,friedman_mse,31,sqrt,3,7,best,TPESampler,COMPLETE
2036,0.5129971695350808,2025-04-24 21:14:14.902472,2025-04-24 21:14:15.666772,0 days 00:00:00.764300,friedman_mse,30,sqrt,1,9,best,TPESampler,COMPLETE
2037,0.5517493393728706,2025-04-24 21:14:15.342562,2025-04-24 21:14:16.311862,0 days 00:00:00.969300,friedman_mse,35,sqrt,1,4,best,TPESampler,COMPLETE
2038,0.6180856799418332,2025-04-24 21:14:15.520919,2025-04-24 21:14:16.477166,0 days 00:00:00.956247,friedman_mse,35,sqrt,2,7,best,TPESampler,COMPLETE
2039,0.6180856799418332,2025-04-24 21:14:15.946283,2025-04-24 21:14:16.838295,0 days 00:00:00.892012,friedman_mse,30,sqrt,2,7,best,TPESampler,COMPLETE
2040,0.6194853816763535,2025-04-24 21:14:16.580056,2025-04-24 21:14:17.620553,0 days 00:00:01.040497,friedman_mse,25,sqrt,2,8,best,TPESampler,COMPLETE
2041,0.5524006536474168,2025-04-24 21:14:16.798631,2025-04-24 21:14:17.792377,0 days 00:00:00.993746,friedman_mse,32,sqrt,1,10,best,TPESampler,COMPLETE
2042,0.4831415131013947,2025-04-24 21:14:17.138057,2025-04-24 21:14:18.351927,0 days 00:00:01.213870,friedman_mse,31,sqrt,1,8,best,TPESampler,COMPLETE
2043,0.5339224783480143,2025-04-24 21:14:18.082821,2025-04-24 21:14:19.070325,0 days 00:00:00.987504,friedman_mse,35,sqrt,1,8,best,TPESampler,COMPLETE
2044,0.7985481754400544,2025-04-24 21:14:18.345969,2025-04-24 21:14:19.254950,0 days 00:00:00.908981,absolute_error,16,sqrt,2,14,random,TPESampler,COMPLETE
2045,0.6123340986255632,2025-04-24 21:14:18.703206,2025-04-24 21:14:19.536221,0 days 00:00:00.833015,absolute_error,28,sqrt,3,5,best,TPESampler,COMPLETE
2046,0.6456349183315407,2025-04-24 21:14:19.422962,2025-04-24 21:14:20.189286,0 days 00:00:00.766324,friedman_mse,29,sqrt,3,2,best,TPESampler,COMPLETE
2047,0.8786486450005158,2025-04-24 21:14:19.498672,2025-04-24 21:14:20.734393,0 days 00:00:01.235721,squared_error,33,log2,4,16,random,TPESampler,COMPLETE
2048,0.47245231313348,2025-04-24 21:14:19.827789,2025-04-24 21:14:20.732967,0 days 00:00:00.905178,friedman_mse,30,sqrt,1,6,best,TPESampler,COMPLETE
2049,0.5202466614878716,2025-04-24 21:14:20.530995,2025-04-24 21:14:21.278075,0 days 00:00:00.747080,friedman_mse,29,sqrt,1,7,best,TPESampler,COMPLETE
2050,0.6456349183315407,2025-04-24 21:14:20.975283,2025-04-24 21:14:22.031920,0 days 00:00:01.056637,friedman_mse,30,sqrt,3,7,best,TPESampler,COMPLETE
2051,0.48806613863614323,2025-04-24 21:14:21.031865,2025-04-24 21:14:22.064033,0 days 00:00:01.032168,squared_error,28,sqrt,1,4,best,TPESampler,COMPLETE
2052,0.48333612106664076,2025-04-24 21:14:21.767827,2025-04-24 21:14:22.565084,0 days 00:00:00.797257,friedman_mse,31,sqrt,1,4,best,TPESampler,COMPLETE
2053,0.6504215924944643,2025-04-24 21:14:22.237882,2025-04-24 21:14:23.201255,0 days 00:00:00.963373,friedman_mse,30,sqrt,3,11,best,TPESampler,COMPLETE
2054,0.7352239070983845,2025-04-24 21:14:22.298781,2025-04-24 21:14:23.242466,0 days 00:00:00.943685,friedman_mse,30,log2,3,8,best,TPESampler,COMPLETE
2055,0.5157610196982807,2025-04-24 21:14:23.079062,2025-04-24 21:14:24.205414,0 days 00:00:01.126352,friedman_mse,26,sqrt,1,7,best,TPESampler,COMPLETE
2056,0.6505607027347653,2025-04-24 21:14:23.397310,2025-04-24 21:14:24.583681,0 days 00:00:01.186371,friedman_mse,29,log2,1,8,best,TPESampler,COMPLETE
2057,0.49068441274037305,2025-04-24 21:14:23.519666,2025-04-24 21:14:24.548047,0 days 00:00:01.028381,friedman_mse,31,sqrt,1,6,best,TPESampler,COMPLETE
2058,0.5975832321496914,2025-04-24 21:14:24.476323,2025-04-24 21:14:25.175268,0 days 00:00:00.698945,friedman_mse,35,sqrt,2,5,best,TPESampler,COMPLETE
2059,0.5020512557327408,2025-04-24 21:14:24.820334,2025-04-24 21:14:25.863105,0 days 00:00:01.042771,friedman_mse,30,sqrt,1,8,best,TPESampler,COMPLETE
2060,0.500848998379332,2025-04-24 21:14:24.903993,2025-04-24 21:14:26.038594,0 days 00:00:01.134601,friedman_mse,30,sqrt,1,2,best,TPESampler,COMPLETE
2061,0.5975832321496914,2025-04-24 21:14:25.527913,2025-04-24 21:14:26.589453,0 days 00:00:01.061540,friedman_mse,25,sqrt,2,5,best,TPESampler,COMPLETE
2062,0.6456349183315407,2025-04-24 21:14:26.127204,2025-04-24 21:14:27.228659,0 days 00:00:01.101455,friedman_mse,31,sqrt,3,7,best,TPESampler,COMPLETE
2063,0.5386805156684904,2025-04-24 21:14:26.398710,2025-04-24 21:14:27.323432,0 days 00:00:00.924722,friedman_mse,26,sqrt,1,11,best,TPESampler,COMPLETE
2064,0.6265479990281826,2025-04-24 21:14:26.917293,2025-04-24 21:14:27.671906,0 days 00:00:00.754613,friedman_mse,35,sqrt,2,3,best,TPESampler,COMPLETE
2065,0.5517493393728706,2025-04-24 21:14:27.553568,2025-04-24 21:14:28.701707,0 days 00:00:01.148139,friedman_mse,35,sqrt,1,4,best,TPESampler,COMPLETE
2066,0.4903190247134273,2025-04-24 21:14:27.627621,2025-04-24 21:14:28.692458,0 days 00:00:01.064837,absolute_error,35,sqrt,1,3,best,TPESampler,COMPLETE
2067,0.49068441274037305,2025-04-24 21:14:28.208419,2025-04-24 21:14:28.995814,0 days 00:00:00.787395,friedman_mse,31,sqrt,1,6,best,TPESampler,COMPLETE
2068,0.5479322564786873,2025-04-24 21:14:28.952329,2025-04-24 21:14:29.819769,0 days 00:00:00.867440,friedman_mse,35,sqrt,1,6,best,TPESampler,COMPLETE
2069,0.5085251300670954,2025-04-24 21:14:28.994558,2025-04-24 21:14:30.170794,0 days 00:00:01.176236,friedman_mse,29,sqrt,1,9,best,TPESampler,COMPLETE
2070,0.5518815421255675,2025-04-24 21:14:29.266638,2025-04-24 21:14:30.279570,0 days 00:00:01.012932,friedman_mse,25,sqrt,1,6,best,TPESampler,COMPLETE
2071,0.49100091803166096,2025-04-24 21:14:30.109052,2025-04-24 21:14:30.872368,0 days 00:00:00.763316,friedman_mse,32,sqrt,1,8,best,TPESampler,COMPLETE
2072,0.6504215924944643,2025-04-24 21:14:30.482150,2025-04-24 21:14:31.265170,0 days 00:00:00.783020,friedman_mse,30,sqrt,3,10,best,TPESampler,COMPLETE
2073,0.5975832321496914,2025-04-24 21:14:30.572312,2025-04-24 21:14:31.978674,0 days 00:00:01.406362,friedman_mse,28,sqrt,2,5,best,TPESampler,COMPLETE
2074,0.49783262823116015,2025-04-24 21:14:31.266314,2025-04-24 21:14:32.352650,0 days 00:00:01.086336,friedman_mse,31,sqrt,1,5,best,TPESampler,COMPLETE
2075,0.6504215924944643,2025-04-24 21:14:31.691107,2025-04-24 21:14:32.564207,0 days 00:00:00.873100,friedman_mse,25,sqrt,3,8,best,TPESampler,COMPLETE
2076,0.5364579699886214,2025-04-24 21:14:32.286498,2025-04-24 21:14:33.049645,0 days 00:00:00.763147,friedman_mse,25,sqrt,1,7,best,TPESampler,COMPLETE
2077,0.6504215924944643,2025-04-24 21:14:32.677745,2025-04-24 21:14:33.552458,0 days 00:00:00.874713,friedman_mse,35,sqrt,3,9,best,TPESampler,COMPLETE
2078,0.8519173927695258,2025-04-24 21:14:32.857351,2025-04-24 21:14:33.796567,0 days 00:00:00.939216,friedman_mse,14,log2,3,20,random,TPESampler,COMPLETE
2079,0.9018784399194749,2025-04-24 21:14:33.433750,2025-04-24 21:14:34.232909,0 days 00:00:00.799159,squared_error,12,log2,9,3,random,TPESampler,COMPLETE
2080,0.6456349183315407,2025-04-24 21:14:33.915006,2025-04-24 21:14:34.843074,0 days 00:00:00.928068,friedman_mse,31,sqrt,3,4,best,TPESampler,COMPLETE
2081,0.5298778451782702,2025-04-24 21:14:34.100102,2025-04-24 21:14:35.028634,0 days 00:00:00.928532,friedman_mse,32,sqrt,1,7,best,TPESampler,COMPLETE
2082,0.5064102821977916,2025-04-24 21:14:34.506427,2025-04-24 21:14:35.315146,0 days 00:00:00.808719,friedman_mse,27,sqrt,1,2,best,TPESampler,COMPLETE
2083,0.7014109281977066,2025-04-24 21:14:35.077599,2025-04-24 21:14:36.051670,0 days 00:00:00.974071,absolute_error,32,sqrt,10,12,best,TPESampler,COMPLETE
2084,0.5858948666719191,2025-04-24 21:14:35.309134,2025-04-24 21:14:36.223250,0 days 00:00:00.914116,friedman_mse,32,log2,1,11,best,TPESampler,COMPLETE
2085,0.5479322564786873,2025-04-24 21:14:35.646040,2025-04-24 21:14:36.524009,0 days 00:00:00.877969,friedman_mse,35,sqrt,1,6,best,TPESampler,COMPLETE
2086,0.9016215139057422,2025-04-24 21:14:36.289827,2025-04-24 21:14:37.529330,0 days 00:00:01.239503,absolute_error,1,log2,8,3,random,TPESampler,COMPLETE
2087,0.6456349183315407,2025-04-24 21:14:36.480480,2025-04-24 21:14:37.470267,0 days 00:00:00.989787,squared_error,30,sqrt,3,3,best,TPESampler,COMPLETE
2088,0.4827218654781925,2025-04-24 21:14:37.090525,2025-04-24 21:14:37.862188,0 days 00:00:00.771663,squared_error,34,sqrt,1,6,best,TPESampler,COMPLETE
2089,0.6456349183315407,2025-04-24 21:14:37.770956,2025-04-24 21:14:38.801071,0 days 00:00:01.030115,friedman_mse,30,sqrt,3,6,best,TPESampler,COMPLETE
2090,0.90157797490464,2025-04-24 21:14:37.821650,2025-04-24 21:14:38.884404,0 days 00:00:01.062754,friedman_mse,13,log2,10,10,best,TPESampler,COMPLETE
2091,0.5339224783480143,2025-04-24 21:14:38.396099,2025-04-24 21:14:39.218848,0 days 00:00:00.822749,friedman_mse,35,sqrt,1,8,best,TPESampler,COMPLETE
2092,0.5296855957806621,2025-04-24 21:14:39.173477,2025-04-24 21:14:40.231717,0 days 00:00:01.058240,friedman_mse,26,sqrt,1,8,best,TPESampler,COMPLETE
2093,0.5191719425869716,2025-04-24 21:14:39.217005,2025-04-24 21:14:40.566607,0 days 00:00:01.349602,friedman_mse,29,sqrt,1,5,best,TPESampler,COMPLETE
2094,0.5593525150541101,2025-04-24 21:14:39.471031,2025-04-24 21:14:40.540734,0 days 00:00:01.069703,friedman_mse,30,sqrt,1,4,best,TPESampler,COMPLETE
2095,0.8737590921917946,2025-04-24 21:14:40.489212,2025-04-24 21:14:41.190534,0 days 00:00:00.701322,squared_error,17,sqrt,8,12,random,TPESampler,COMPLETE
2096,0.5164170552722069,2025-04-24 21:14:40.898644,2025-04-24 21:14:41.831420,0 days 00:00:00.932776,friedman_mse,29,sqrt,1,8,best,TPESampler,COMPLETE
2097,0.6180856799418332,2025-04-24 21:14:40.962911,2025-04-24 21:14:42.069538,0 days 00:00:01.106627,friedman_mse,30,sqrt,2,7,best,TPESampler,COMPLETE
2098,0.5129971695350808,2025-04-24 21:14:41.466441,2025-04-24 21:14:42.525605,0 days 00:00:01.059164,friedman_mse,30,sqrt,1,9,best,TPESampler,COMPLETE
2099,0.8896664101799587,2025-04-24 21:14:42.124414,2025-04-24 21:14:43.119911,0 days 00:00:00.995497,friedman_mse,3,log2,5,12,best,TPESampler,COMPLETE
2100,0.6265479990281826,2025-04-24 21:14:42.379052,2025-04-24 21:14:43.497857,0 days 00:00:01.118805,friedman_mse,32,sqrt,2,2,best,TPESampler,COMPLETE
2101,0.5364518982459593,2025-04-24 21:14:42.846172,2025-04-24 21:14:43.816370,0 days 00:00:00.970198,friedman_mse,24,sqrt,1,5,best,TPESampler,COMPLETE
2102,0.7459946044096345,2025-04-24 21:14:43.453105,2025-04-24 21:14:44.396345,0 days 00:00:00.943240,friedman_mse,29,log2,2,3,best,TPESampler,COMPLETE
2103,0.6456349183315407,2025-04-24 21:14:43.824418,2025-04-24 21:14:44.710835,0 days 00:00:00.886417,friedman_mse,33,sqrt,3,6,best,TPESampler,COMPLETE
2104,0.47245231313348,2025-04-24 21:14:44.193915,2025-04-24 21:14:45.199385,0 days 00:00:01.005470,friedman_mse,30,sqrt,1,6,best,TPESampler,COMPLETE
2105,0.5912941502828561,2025-04-24 21:14:44.670057,2025-04-24 21:14:45.557574,0 days 00:00:00.887517,friedman_mse,35,sqrt,1,5,best,TPESampler,COMPLETE
2106,0.5335792657092989,2025-04-24 21:14:45.059865,2025-04-24 21:14:46.043942,0 days 00:00:00.984077,absolute_error,29,sqrt,1,6,best,TPESampler,COMPLETE
2107,0.90157797490464,2025-04-24 21:14:45.494917,2025-04-24 21:14:46.431029,0 days 00:00:00.936112,friedman_mse,35,log2,8,19,best,TPESampler,COMPLETE
2108,0.6456349183315407,2025-04-24 21:14:45.850624,2025-04-24 21:14:46.779846,0 days 00:00:00.929222,friedman_mse,35,sqrt,3,7,best,TPESampler,COMPLETE
2109,0.5020512557327408,2025-04-24 21:14:46.419784,2025-04-24 21:14:47.445955,0 days 00:00:01.026171,friedman_mse,30,sqrt,1,8,best,TPESampler,COMPLETE
2110,0.4937530427079524,2025-04-24 21:14:46.777003,2025-04-24 21:14:47.581949,0 days 00:00:00.804946,friedman_mse,29,sqrt,1,11,best,TPESampler,COMPLETE
2111,0.6456349183315407,2025-04-24 21:14:47.091791,2025-04-24 21:14:47.935753,0 days 00:00:00.843962,friedman_mse,26,sqrt,3,5,best,TPESampler,COMPLETE
2112,0.5338046397110097,2025-04-24 21:14:47.811096,2025-04-24 21:14:48.885015,0 days 00:00:01.073919,friedman_mse,32,sqrt,1,2,best,TPESampler,COMPLETE
2113,0.5836827305659192,2025-04-24 21:14:47.891770,2025-04-24 21:14:48.954650,0 days 00:00:01.062880,absolute_error,23,sqrt,1,8,best,TPESampler,COMPLETE
2114,0.49783262823116015,2025-04-24 21:14:48.224842,2025-04-24 21:14:49.154678,0 days 00:00:00.929836,friedman_mse,31,sqrt,1,5,best,TPESampler,COMPLETE
2115,0.4831415131013947,2025-04-24 21:14:49.111431,2025-04-24 21:14:50.260125,0 days 00:00:01.148694,friedman_mse,31,sqrt,1,8,best,TPESampler,COMPLETE
2116,0.598835646376164,2025-04-24 21:14:49.224799,2025-04-24 21:14:50.258880,0 days 00:00:01.034081,friedman_mse,28,sqrt,1,6,random,TPESampler,COMPLETE
2117,0.8098340189020531,2025-04-24 21:14:49.401137,2025-04-24 21:14:50.444238,0 days 00:00:01.043101,squared_error,9,sqrt,5,12,best,TPESampler,COMPLETE
2118,0.5339224783480143,2025-04-24 21:14:50.475447,2025-04-24 21:14:51.505114,0 days 00:00:01.029667,friedman_mse,35,sqrt,1,8,best,TPESampler,COMPLETE
2119,0.6504215924944643,2025-04-24 21:14:50.789769,2025-04-24 21:14:51.931327,0 days 00:00:01.141558,friedman_mse,27,sqrt,3,10,best,TPESampler,COMPLETE
2120,0.5975832321496914,2025-04-24 21:14:50.936003,2025-04-24 21:14:52.220335,0 days 00:00:01.284332,friedman_mse,26,sqrt,2,5,best,TPESampler,COMPLETE
2121,0.5157610196982807,2025-04-24 21:14:51.829192,2025-04-24 21:14:52.669455,0 days 00:00:00.840263,friedman_mse,26,sqrt,1,7,best,TPESampler,COMPLETE
2122,0.5975832321496914,2025-04-24 21:14:52.302868,2025-04-24 21:14:53.342724,0 days 00:00:01.039856,friedman_mse,31,sqrt,2,5,best,TPESampler,COMPLETE
2123,0.5517493393728706,2025-04-24 21:14:52.538186,2025-04-24 21:14:53.455545,0 days 00:00:00.917359,squared_error,35,sqrt,1,4,best,TPESampler,COMPLETE
2124,0.49783262823116015,2025-04-24 21:14:52.923869,2025-04-24 21:14:53.772273,0 days 00:00:00.848404,friedman_mse,31,sqrt,1,5,best,TPESampler,COMPLETE
2125,0.90157797490464,2025-04-24 21:14:53.734173,2025-04-24 21:14:54.672747,0 days 00:00:00.938574,friedman_mse,2,log2,9,9,best,TPESampler,COMPLETE
2126,0.6180856799418332,2025-04-24 21:14:53.769866,2025-04-24 21:14:54.818965,0 days 00:00:01.049099,friedman_mse,30,sqrt,2,7,best,TPESampler,COMPLETE
2127,0.6456349183315407,2025-04-24 21:14:54.487539,2025-04-24 21:14:55.374055,0 days 00:00:00.886516,friedman_mse,35,sqrt,3,2,best,TPESampler,COMPLETE
2128,0.6289323974475082,2025-04-24 21:14:55.023911,2025-04-24 21:14:56.036070,0 days 00:00:01.012159,friedman_mse,35,sqrt,2,9,best,TPESampler,COMPLETE
2129,0.6289323974475082,2025-04-24 21:14:55.225916,2025-04-24 21:14:56.268394,0 days 00:00:01.042478,friedman_mse,31,sqrt,2,9,best,TPESampler,COMPLETE
2130,0.628151894140281,2025-04-24 21:14:55.667571,2025-04-24 21:14:56.749559,0 days 00:00:01.081988,friedman_mse,34,sqrt,1,6,random,TPESampler,COMPLETE
2131,0.5529688132197964,2025-04-24 21:14:56.340552,2025-04-24 21:14:57.379896,0 days 00:00:01.039344,squared_error,35,sqrt,1,2,best,TPESampler,COMPLETE
2132,0.5513554337953424,2025-04-24 21:14:56.612157,2025-04-24 21:14:57.532480,0 days 00:00:00.920323,friedman_mse,27,sqrt,1,5,best,TPESampler,COMPLETE
2133,0.90157797490464,2025-04-24 21:14:57.077687,2025-04-24 21:14:57.853426,0 days 00:00:00.775739,friedman_mse,1,log2,8,4,best,TPESampler,COMPLETE
2134,0.6456349183315407,2025-04-24 21:14:57.744014,2025-04-24 21:14:58.733876,0 days 00:00:00.989862,friedman_mse,29,sqrt,3,7,best,TPESampler,COMPLETE
2135,0.5421737802524879,2025-04-24 21:14:57.800442,2025-04-24 21:14:58.722366,0 days 00:00:00.921924,friedman_mse,21,sqrt,1,8,best,TPESampler,COMPLETE
2136,0.5593525150541101,2025-04-24 21:14:58.365816,2025-04-24 21:14:59.111987,0 days 00:00:00.746171,friedman_mse,30,sqrt,1,4,best,TPESampler,COMPLETE
2137,0.6803264737674085,2025-04-24 21:14:58.999198,2025-04-24 21:15:00.129775,0 days 00:00:01.130577,absolute_error,32,sqrt,2,18,random,TPESampler,COMPLETE
2138,0.5129971695350808,2025-04-24 21:14:59.054979,2025-04-24 21:15:00.494538,0 days 00:00:01.439559,friedman_mse,30,sqrt,1,9,best,TPESampler,COMPLETE
2139,0.8866253306412935,2025-04-24 21:14:59.351669,2025-04-24 21:15:00.493185,0 days 00:00:01.141516,squared_error,1,sqrt,4,4,random,TPESampler,COMPLETE
2140,0.5975832321496914,2025-04-24 21:15:00.451633,2025-04-24 21:15:01.651809,0 days 00:00:01.200176,friedman_mse,35,sqrt,2,5,best,TPESampler,COMPLETE
2141,0.8737590921917946,2025-04-24 21:15:00.775556,2025-04-24 21:15:01.880461,0 days 00:00:01.104905,squared_error,28,sqrt,9,9,random,TPESampler,COMPLETE
2142,0.8199060563570023,2025-04-24 21:15:00.852473,2025-04-24 21:15:02.495065,0 days 00:00:01.642592,absolute_error,10,sqrt,9,3,best,TPESampler,COMPLETE
2143,0.5085288623263258,2025-04-24 21:15:01.959183,2025-04-24 21:15:02.877152,0 days 00:00:00.917969,friedman_mse,35,sqrt,1,9,best,TPESampler,COMPLETE
2144,0.5479322564786873,2025-04-24 21:15:02.244604,2025-04-24 21:15:03.172271,0 days 00:00:00.927667,friedman_mse,35,sqrt,1,6,best,TPESampler,COMPLETE
2145,0.5364518982459593,2025-04-24 21:15:02.829434,2025-04-24 21:15:03.671182,0 days 00:00:00.841748,friedman_mse,24,sqrt,1,5,best,TPESampler,COMPLETE
2146,0.5623543669503079,2025-04-24 21:15:03.330287,2025-04-24 21:15:04.316194,0 days 00:00:00.985907,friedman_mse,30,sqrt,1,5,best,TPESampler,COMPLETE
