number,value,datetime_start,datetime_complete,duration,params_criterion,params_max_depth,params_max_features,params_min_samples_leaf,params_min_samples_split,params_splitter,system_attrs_auto:sampler,state
0,0.8737590921917946,2025-04-24 21:00:29.995097,2025-04-24 21:00:30.926345,0 days 00:00:00.931248,friedman_mse,24,sqrt,8,20,random,RandomSampler,COMPLETE
1,0.6300687996731097,2025-04-24 21:00:30.015470,2025-04-24 21:00:30.597970,0 days 00:00:00.582500,friedman_mse,22,sqrt,3,16,best,RandomSampler,COMPLETE
2,0.8737590921917946,2025-04-24 21:00:30.102587,2025-04-24 21:00:30.749081,0 days 00:00:00.646494,friedman_mse,35,sqrt,7,6,random,RandomSampler,COMPLETE
3,0.8786994273045032,2025-04-24 21:00:30.866950,2025-04-24 21:00:31.472947,0 days 00:00:00.605997,absolute_error,13,log2,4,18,random,TPESampler,COMPLETE
4,0.90157797490464,2025-04-24 21:00:30.979780,2025-04-24 21:00:31.761283,0 days 00:00:00.781503,squared_error,27,log2,10,19,best,TPESampler,COMPLETE
5,0.6854620540251789,2025-04-24 21:00:31.360006,2025-04-24 21:00:32.040655,0 days 00:00:00.680649,friedman_mse,20,sqrt,4,18,best,TPESampler,COMPLETE
6,0.878930627702796,2025-04-24 21:00:31.759093,2025-04-24 21:00:32.498847,0 days 00:00:00.739754,friedman_mse,2,log2,7,13,random,TPESampler,COMPLETE
7,0.6858428787475002,2025-04-24 21:00:32.036251,2025-04-24 21:00:33.041866,0 days 00:00:01.005615,absolute_error,17,sqrt,8,9,best,TPESampler,COMPLETE
8,0.8737590921917946,2025-04-24 21:00:32.393779,2025-04-24 21:00:33.232600,0 days 00:00:00.838821,friedman_mse,7,sqrt,7,20,random,TPESampler,COMPLETE
9,0.9018784399194749,2025-04-24 21:00:32.951301,2025-04-24 21:00:33.662507,0 days 00:00:00.711206,squared_error,35,log2,8,18,random,TPESampler,COMPLETE
10,0.9015251732962958,2025-04-24 21:00:33.328071,2025-04-24 21:00:34.066631,0 days 00:00:00.738560,absolute_error,20,log2,7,16,best,TPESampler,COMPLETE
11,0.6504215924944643,2025-04-24 21:00:33.545534,2025-04-24 21:00:34.217311,0 days 00:00:00.671777,friedman_mse,23,sqrt,3,9,best,TPESampler,COMPLETE
12,0.6504215924944643,2025-04-24 21:00:33.990169,2025-04-24 21:00:34.732352,0 days 00:00:00.742183,friedman_mse,29,sqrt,3,10,best,TPESampler,COMPLETE
13,0.5840558270072688,2025-04-24 21:00:34.396083,2025-04-24 21:00:35.272309,0 days 00:00:00.876226,squared_error,16,sqrt,1,16,best,TPESampler,COMPLETE
14,0.6589532298970542,2025-04-24 21:00:34.447977,2025-04-24 21:00:35.269331,0 days 00:00:00.821354,friedman_mse,13,sqrt,1,8,best,TPESampler,COMPLETE
15,0.6735376320468349,2025-04-24 21:00:35.020953,2025-04-24 21:00:35.642467,0 days 00:00:00.621514,friedman_mse,24,sqrt,1,14,random,TPESampler,COMPLETE
16,0.6481658257093826,2025-04-24 21:00:35.538599,2025-04-24 21:00:36.340740,0 days 00:00:00.802141,squared_error,12,sqrt,1,20,best,TPESampler,COMPLETE
17,0.6137680826708861,2025-04-24 21:00:35.589001,2025-04-24 21:00:36.423725,0 days 00:00:00.834724,squared_error,31,sqrt,2,20,best,TPESampler,COMPLETE
18,0.6958991525030052,2025-04-24 21:00:36.022263,2025-04-24 21:00:36.727402,0 days 00:00:00.705139,squared_error,19,sqrt,5,14,best,TPESampler,COMPLETE
19,0.6138554829851675,2025-04-24 21:00:36.594676,2025-04-24 21:00:37.433450,0 days 00:00:00.838774,squared_error,35,sqrt,2,19,best,TPESampler,COMPLETE
20,0.6045660424306688,2025-04-24 21:00:36.654286,2025-04-24 21:00:37.488189,0 days 00:00:00.833903,squared_error,30,sqrt,2,18,best,TPESampler,COMPLETE
21,0.7235995033015992,2025-04-24 21:00:37.114073,2025-04-24 21:00:37.803410,0 days 00:00:00.689337,squared_error,20,sqrt,4,17,random,TPESampler,COMPLETE
22,0.6512567899837967,2025-04-24 21:00:37.698124,2025-04-24 21:00:38.493422,0 days 00:00:00.795298,squared_error,34,log2,1,18,random,TPESampler,COMPLETE
23,0.7432319216441641,2025-04-24 21:00:37.753098,2025-04-24 21:00:38.618387,0 days 00:00:00.865289,squared_error,19,log2,2,15,best,TPESampler,COMPLETE
24,0.5458802277469731,2025-04-24 21:00:38.191936,2025-04-24 21:00:38.814490,0 days 00:00:00.622554,squared_error,23,sqrt,1,12,best,TPESampler,COMPLETE
25,0.5667823799395514,2025-04-24 21:00:38.762145,2025-04-24 21:00:39.566665,0 days 00:00:00.804520,squared_error,21,sqrt,1,10,best,TPESampler,COMPLETE
26,0.6289323974475082,2025-04-24 21:00:38.869349,2025-04-24 21:00:39.726690,0 days 00:00:00.857341,squared_error,22,sqrt,2,10,best,TPESampler,COMPLETE
27,0.5892731747707569,2025-04-24 21:00:39.243539,2025-04-24 21:00:39.944173,0 days 00:00:00.700634,absolute_error,24,sqrt,2,20,best,TPESampler,COMPLETE
28,0.7788255277953922,2025-04-24 21:00:39.880925,2025-04-24 21:00:40.644354,0 days 00:00:00.763429,squared_error,10,sqrt,1,11,best,TPESampler,COMPLETE
29,0.6046885654304703,2025-04-24 21:00:40.080337,2025-04-24 21:00:41.045101,0 days 00:00:00.964764,squared_error,23,sqrt,1,7,random,TPESampler,COMPLETE
30,0.5843909180658454,2025-04-24 21:00:40.241445,2025-04-24 21:00:41.252667,0 days 00:00:01.011222,squared_error,30,sqrt,1,8,random,TPESampler,COMPLETE
31,0.532551168457955,2025-04-24 21:00:40.984222,2025-04-24 21:00:41.830936,0 days 00:00:00.846714,absolute_error,26,sqrt,1,11,best,TPESampler,COMPLETE
32,0.6936943281344881,2025-04-24 21:00:41.325935,2025-04-24 21:00:42.212491,0 days 00:00:00.886556,squared_error,20,log2,1,5,best,TPESampler,COMPLETE
33,0.5126597929451711,2025-04-24 21:00:41.511281,2025-04-24 21:00:42.412793,0 days 00:00:00.901512,absolute_error,33,sqrt,1,7,best,TPESampler,COMPLETE
34,0.5622024994745835,2025-04-24 21:00:42.122716,2025-04-24 21:00:42.878568,0 days 00:00:00.755852,absolute_error,27,sqrt,2,3,best,TPESampler,COMPLETE
35,0.5547152952683243,2025-04-24 21:00:42.531686,2025-04-24 21:00:43.477785,0 days 00:00:00.946099,absolute_error,34,sqrt,1,5,best,TPESampler,COMPLETE
36,0.49169508102649473,2025-04-24 21:00:42.630554,2025-04-24 21:00:43.470481,0 days 00:00:00.839927,absolute_error,35,sqrt,1,10,best,TPESampler,COMPLETE
37,0.527095195161029,2025-04-24 21:00:43.134814,2025-04-24 21:00:44.119060,0 days 00:00:00.984246,absolute_error,26,sqrt,1,13,best,TPESampler,COMPLETE
38,0.6181570352809064,2025-04-24 21:00:43.819632,2025-04-24 21:00:44.704772,0 days 00:00:00.885140,absolute_error,25,log2,1,11,best,TPESampler,COMPLETE
39,0.577329743784586,2025-04-24 21:00:43.893516,2025-04-24 21:00:44.768162,0 days 00:00:00.874646,absolute_error,33,sqrt,1,12,best,TPESampler,COMPLETE
40,0.5291285065517722,2025-04-24 21:00:44.455663,2025-04-24 21:00:45.060020,0 days 00:00:00.604357,absolute_error,24,sqrt,1,12,best,TPESampler,COMPLETE
41,0.7955470831118738,2025-04-24 21:00:44.937178,2025-04-24 21:00:45.957529,0 days 00:00:01.020351,absolute_error,16,sqrt,3,12,random,TPESampler,COMPLETE
42,0.7109433928180021,2025-04-24 21:00:44.995258,2025-04-24 21:00:45.793531,0 days 00:00:00.798273,absolute_error,17,sqrt,1,11,best,TPESampler,COMPLETE
43,0.8106497546097036,2025-04-24 21:00:45.360800,2025-04-24 21:00:46.185281,0 days 00:00:00.824481,absolute_error,33,sqrt,4,10,random,TPESampler,COMPLETE
44,0.5490998648977673,2025-04-24 21:00:46.083970,2025-04-24 21:00:46.880727,0 days 00:00:00.796757,absolute_error,25,sqrt,1,12,best,TPESampler,COMPLETE
45,0.6160120733511538,2025-04-24 21:00:46.138928,2025-04-24 21:00:47.000780,0 days 00:00:00.861852,absolute_error,25,sqrt,3,11,best,TPESampler,COMPLETE
46,0.632124222957233,2025-04-24 21:00:46.558023,2025-04-24 21:00:47.361862,0 days 00:00:00.803839,absolute_error,32,log2,1,5,best,TPESampler,COMPLETE
47,0.7397311344246429,2025-04-24 21:00:47.078403,2025-04-24 21:00:47.766234,0 days 00:00:00.687831,absolute_error,25,sqrt,1,17,random,TPESampler,COMPLETE
48,0.7432319216441641,2025-04-24 21:00:47.297242,2025-04-24 21:00:48.020970,0 days 00:00:00.723728,squared_error,35,log2,2,10,best,TPESampler,COMPLETE
49,0.48350783172535233,2025-04-24 21:00:47.611225,2025-04-24 21:00:48.372874,0 days 00:00:00.761649,squared_error,34,sqrt,1,7,best,TPESampler,COMPLETE
50,0.482024331116523,2025-04-24 21:00:48.028250,2025-04-24 21:00:48.700428,0 days 00:00:00.672178,absolute_error,35,sqrt,1,9,best,TPESampler,COMPLETE
51,0.8172868600673935,2025-04-24 21:00:48.309468,2025-04-24 21:00:49.051117,0 days 00:00:00.741649,absolute_error,28,log2,1,11,random,TPESampler,COMPLETE
52,0.6265479990281826,2025-04-24 21:00:48.617460,2025-04-24 21:00:49.350725,0 days 00:00:00.733265,squared_error,28,sqrt,2,4,best,TPESampler,COMPLETE
53,0.5085726818050148,2025-04-24 21:00:48.944996,2025-04-24 21:00:49.738223,0 days 00:00:00.793227,squared_error,34,sqrt,1,9,best,TPESampler,COMPLETE
54,0.6126550445644109,2025-04-24 21:00:49.255752,2025-04-24 21:00:50.043371,0 days 00:00:00.787619,absolute_error,34,sqrt,3,9,best,TPESampler,COMPLETE
55,0.6289323974475082,2025-04-24 21:00:49.587801,2025-04-24 21:00:50.221288,0 days 00:00:00.633487,squared_error,34,sqrt,2,11,best,TPESampler,COMPLETE
56,0.5085288623263258,2025-04-24 21:00:49.990044,2025-04-24 21:00:50.733950,0 days 00:00:00.743906,squared_error,35,sqrt,1,9,best,TPESampler,COMPLETE
57,0.49100091803166096,2025-04-24 21:00:50.380564,2025-04-24 21:00:51.175946,0 days 00:00:00.795382,friedman_mse,32,sqrt,1,8,best,TPESampler,COMPLETE
58,0.5738143807136875,2025-04-24 21:00:50.448764,2025-04-24 21:00:51.271817,0 days 00:00:00.823053,friedman_mse,33,sqrt,1,6,best,TPESampler,COMPLETE
59,0.5339224783480143,2025-04-24 21:00:51.106216,2025-04-24 21:00:51.734237,0 days 00:00:00.628021,squared_error,35,sqrt,1,8,best,TPESampler,COMPLETE
60,0.69351465341836,2025-04-24 21:00:51.424803,2025-04-24 21:00:52.257549,0 days 00:00:00.832746,squared_error,34,sqrt,6,7,best,TPESampler,COMPLETE
61,0.6289323974475082,2025-04-24 21:00:51.523187,2025-04-24 21:00:52.306543,0 days 00:00:00.783356,friedman_mse,30,sqrt,2,12,best,TPESampler,COMPLETE
62,0.7436032276730585,2025-04-24 21:00:51.965235,2025-04-24 21:00:52.771927,0 days 00:00:00.806692,friedman_mse,31,log2,3,9,best,TPESampler,COMPLETE
63,0.8510024615078068,2025-04-24 21:00:52.638146,2025-04-24 21:00:53.471156,0 days 00:00:00.833010,friedman_mse,25,log2,2,4,random,TPESampler,COMPLETE
64,0.5129561010742344,2025-04-24 21:00:52.714520,2025-04-24 21:00:53.609480,0 days 00:00:00.894960,squared_error,33,sqrt,1,7,best,TPESampler,COMPLETE
65,0.8767756438403109,2025-04-24 21:00:53.126504,2025-04-24 21:00:53.825242,0 days 00:00:00.698738,absolute_error,12,sqrt,9,4,random,TPESampler,COMPLETE
66,0.90157797490464,2025-04-24 21:00:53.777532,2025-04-24 21:00:54.450343,0 days 00:00:00.672811,squared_error,3,log2,9,14,best,TPESampler,COMPLETE
67,0.8500480894490229,2025-04-24 21:00:53.822979,2025-04-24 21:00:54.755349,0 days 00:00:00.932370,squared_error,34,log2,2,6,random,TPESampler,COMPLETE
68,0.5329702439043837,2025-04-24 21:00:53.995746,2025-04-24 21:00:54.800402,0 days 00:00:00.804656,friedman_mse,35,sqrt,1,11,best,TPESampler,COMPLETE
69,0.49443831345136974,2025-04-24 21:00:54.695676,2025-04-24 21:00:55.342531,0 days 00:00:00.646855,absolute_error,34,sqrt,1,8,best,TPESampler,COMPLETE
70,0.723689866904228,2025-04-24 21:00:54.980606,2025-04-24 21:00:55.852248,0 days 00:00:00.871642,friedman_mse,33,sqrt,4,5,random,TPESampler,COMPLETE
71,0.8949707845327863,2025-04-24 21:00:55.043275,2025-04-24 21:00:55.771797,0 days 00:00:00.728522,squared_error,2,sqrt,10,5,best,TPESampler,COMPLETE
72,0.6354744260404631,2025-04-24 21:00:55.638745,2025-04-24 21:00:56.334845,0 days 00:00:00.696100,squared_error,35,log2,1,2,best,TPESampler,COMPLETE
73,0.538302782003533,2025-04-24 21:00:55.961981,2025-04-24 21:00:56.891877,0 days 00:00:00.929896,absolute_error,32,sqrt,1,8,best,TPESampler,COMPLETE
74,0.5131501014074039,2025-04-24 21:00:56.044943,2025-04-24 21:00:56.897408,0 days 00:00:00.852465,absolute_error,30,sqrt,1,8,best,TPESampler,COMPLETE
75,0.9015251732962958,2025-04-24 21:00:56.642995,2025-04-24 21:00:57.256591,0 days 00:00:00.613596,absolute_error,13,log2,7,3,best,TPESampler,COMPLETE
76,0.600774285800134,2025-04-24 21:00:57.114100,2025-04-24 21:00:57.933277,0 days 00:00:00.819177,absolute_error,34,sqrt,2,7,best,TPESampler,COMPLETE
77,0.5366475096286688,2025-04-24 21:00:57.191807,2025-04-24 21:00:57.993505,0 days 00:00:00.801698,absolute_error,34,sqrt,1,7,best,TPESampler,COMPLETE
78,0.6152852769125877,2025-04-24 21:00:57.700308,2025-04-24 21:00:58.576574,0 days 00:00:00.876266,absolute_error,33,sqrt,1,8,random,TPESampler,COMPLETE
79,0.5420808440475647,2025-04-24 21:00:58.136015,2025-04-24 21:00:58.839471,0 days 00:00:00.703456,squared_error,31,sqrt,1,12,best,TPESampler,COMPLETE
80,0.5378902223820379,2025-04-24 21:00:58.220455,2025-04-24 21:00:59.166014,0 days 00:00:00.945559,friedman_mse,24,sqrt,1,6,best,TPESampler,COMPLETE
81,0.8767756438403109,2025-04-24 21:00:58.838129,2025-04-24 21:00:59.515131,0 days 00:00:00.677002,absolute_error,10,sqrt,9,16,random,TPESampler,COMPLETE
82,0.6180856799418332,2025-04-24 21:00:59.122212,2025-04-24 21:00:59.845288,0 days 00:00:00.723076,squared_error,28,sqrt,2,7,best,TPESampler,COMPLETE
83,0.48921668337565616,2025-04-24 21:00:59.412394,2025-04-24 21:01:00.252875,0 days 00:00:00.840481,squared_error,32,sqrt,1,6,best,TPESampler,COMPLETE
84,0.9015251732962958,2025-04-24 21:00:59.728620,2025-04-24 21:01:00.586709,0 days 00:00:00.858089,absolute_error,27,log2,10,6,best,TPESampler,COMPLETE
85,0.7479967321897958,2025-04-24 21:01:00.165976,2025-04-24 21:01:01.012547,0 days 00:00:00.846571,absolute_error,34,log2,3,12,best,TPESampler,COMPLETE
86,0.6265479990281826,2025-04-24 21:01:00.493922,2025-04-24 21:01:01.207652,0 days 00:00:00.713730,squared_error,34,sqrt,2,4,best,TPESampler,COMPLETE
87,0.5197703343770413,2025-04-24 21:01:00.801616,2025-04-24 21:01:01.538331,0 days 00:00:00.736715,absolute_error,35,sqrt,1,11,best,TPESampler,COMPLETE
88,0.8731826145145795,2025-04-24 21:01:01.267355,2025-04-24 21:01:01.900648,0 days 00:00:00.633293,squared_error,4,sqrt,8,19,best,TPESampler,COMPLETE
89,0.90157797490464,2025-04-24 21:01:01.496961,2025-04-24 21:01:02.209851,0 days 00:00:00.712890,friedman_mse,26,log2,8,13,best,TPESampler,COMPLETE
90,0.5339224783480143,2025-04-24 21:01:01.794851,2025-04-24 21:01:02.559765,0 days 00:00:00.764914,squared_error,35,sqrt,1,8,best,TPESampler,COMPLETE
91,0.878930627702796,2025-04-24 21:01:02.110257,2025-04-24 21:01:02.935259,0 days 00:00:00.825002,friedman_mse,21,log2,6,13,random,TPESampler,COMPLETE
92,0.5724846347554697,2025-04-24 21:01:02.461313,2025-04-24 21:01:03.216301,0 days 00:00:00.754988,squared_error,30,sqrt,1,7,best,TPESampler,COMPLETE
93,0.6071761720802944,2025-04-24 21:01:02.750164,2025-04-24 21:01:03.549028,0 days 00:00:00.798864,squared_error,34,sqrt,3,13,random,TPESampler,COMPLETE
94,0.90157797490464,2025-04-24 21:01:03.169739,2025-04-24 21:01:03.903089,0 days 00:00:00.733350,friedman_mse,8,log2,9,6,best,TPESampler,COMPLETE
95,0.878930627702796,2025-04-24 21:01:03.466587,2025-04-24 21:01:04.207189,0 days 00:00:00.740602,squared_error,14,log2,6,6,random,TPESampler,COMPLETE
96,0.7940849586441125,2025-04-24 21:01:03.795864,2025-04-24 21:01:04.621322,0 days 00:00:00.825458,squared_error,6,sqrt,3,3,random,TPESampler,COMPLETE
97,0.8737590921917946,2025-04-24 21:01:04.161748,2025-04-24 21:01:05.044690,0 days 00:00:00.882942,friedman_mse,18,sqrt,10,12,random,TPESampler,COMPLETE
98,0.5517493393728706,2025-04-24 21:01:04.517240,2025-04-24 21:01:05.446655,0 days 00:00:00.929415,squared_error,35,sqrt,1,4,best,TPESampler,COMPLETE
99,0.5020512557327408,2025-04-24 21:01:04.901405,2025-04-24 21:01:05.792891,0 days 00:00:00.891486,squared_error,30,sqrt,1,8,best,TPESampler,COMPLETE
100,0.6825419058975224,2025-04-24 21:01:05.339376,2025-04-24 21:01:06.124644,0 days 00:00:00.785268,friedman_mse,33,sqrt,4,5,best,TPESampler,COMPLETE
101,0.8924085383115729,2025-04-24 21:01:05.727257,2025-04-24 21:01:06.523328,0 days 00:00:00.796071,friedman_mse,2,log2,4,15,best,TPESampler,COMPLETE
102,0.6180856799418332,2025-04-24 21:01:06.057370,2025-04-24 21:01:07.029905,0 days 00:00:00.972535,squared_error,27,sqrt,2,7,best,TPESampler,COMPLETE
103,0.5085288623263258,2025-04-24 21:01:06.407253,2025-04-24 21:01:07.488217,0 days 00:00:01.080964,squared_error,35,sqrt,1,9,best,TPESampler,COMPLETE
104,0.6504215924944643,2025-04-24 21:01:06.819574,2025-04-24 21:01:07.869415,0 days 00:00:01.049841,squared_error,34,sqrt,3,9,best,TPESampler,COMPLETE
105,0.5353038969897329,2025-04-24 21:01:07.470941,2025-04-24 21:01:08.270728,0 days 00:00:00.799787,squared_error,34,sqrt,1,12,best,TPESampler,COMPLETE
106,0.6180856799418332,2025-04-24 21:01:07.993038,2025-04-24 21:01:08.727532,0 days 00:00:00.734494,friedman_mse,35,sqrt,2,7,best,TPESampler,COMPLETE
107,0.6123055294357905,2025-04-24 21:01:08.099728,2025-04-24 21:01:09.055422,0 days 00:00:00.955694,squared_error,33,sqrt,3,4,random,TPESampler,COMPLETE
108,0.5701537892765277,2025-04-24 21:01:08.562196,2025-04-24 21:01:09.499296,0 days 00:00:00.937100,absolute_error,35,sqrt,2,8,best,TPESampler,COMPLETE
109,0.6333443902240995,2025-04-24 21:01:08.996182,2025-04-24 21:01:09.846136,0 days 00:00:00.849954,friedman_mse,27,sqrt,1,8,random,TPESampler,COMPLETE
110,0.628823225743699,2025-04-24 21:01:09.386906,2025-04-24 21:01:10.192889,0 days 00:00:00.805983,friedman_mse,33,log2,1,20,best,TPESampler,COMPLETE
111,0.5363625633065204,2025-04-24 21:01:09.766643,2025-04-24 21:01:10.573520,0 days 00:00:00.806877,squared_error,26,sqrt,1,10,best,TPESampler,COMPLETE
112,0.9018784399194749,2025-04-24 21:01:10.088687,2025-04-24 21:01:10.861417,0 days 00:00:00.772730,squared_error,26,log2,10,12,random,TPESampler,COMPLETE
113,0.5339224783480143,2025-04-24 21:01:10.449048,2025-04-24 21:01:11.175583,0 days 00:00:00.726535,squared_error,35,sqrt,1,8,best,TPESampler,COMPLETE
114,0.6180856799418332,2025-04-24 21:01:10.799472,2025-04-24 21:01:11.430607,0 days 00:00:00.631135,squared_error,33,sqrt,2,7,best,TPESampler,COMPLETE
115,0.8610424961550007,2025-04-24 21:01:11.096520,2025-04-24 21:01:11.914267,0 days 00:00:00.817747,friedman_mse,6,sqrt,4,13,random,TPESampler,COMPLETE
116,0.4831415131013947,2025-04-24 21:01:11.392470,2025-04-24 21:01:12.138945,0 days 00:00:00.746475,squared_error,31,sqrt,1,8,best,TPESampler,COMPLETE
117,0.5085288623263258,2025-04-24 21:01:11.709967,2025-04-24 21:01:12.482927,0 days 00:00:00.772960,squared_error,35,sqrt,1,9,best,TPESampler,COMPLETE
118,0.47345457294892884,2025-04-24 21:01:12.156480,2025-04-24 21:01:12.965315,0 days 00:00:00.808835,squared_error,34,sqrt,1,10,best,TPESampler,COMPLETE
119,0.9016215139057422,2025-04-24 21:01:12.384636,2025-04-24 21:01:13.103619,0 days 00:00:00.718983,absolute_error,2,log2,9,14,random,TPESampler,COMPLETE
120,0.8971135230143974,2025-04-24 21:01:12.814918,2025-04-24 21:01:13.537818,0 days 00:00:00.722900,absolute_error,2,sqrt,5,14,best,TPESampler,COMPLETE
121,0.5628830452201053,2025-04-24 21:01:13.161554,2025-04-24 21:01:13.928377,0 days 00:00:00.766823,squared_error,33,sqrt,1,8,random,TPESampler,COMPLETE
122,0.6564152842047275,2025-04-24 21:01:13.356542,2025-04-24 21:01:14.270124,0 days 00:00:00.913582,squared_error,32,log2,1,8,best,TPESampler,COMPLETE
123,0.5329702439043837,2025-04-24 21:01:13.802765,2025-04-24 21:01:14.512770,0 days 00:00:00.710005,squared_error,35,sqrt,1,11,best,TPESampler,COMPLETE
124,0.49455983062803255,2025-04-24 21:01:14.196439,2025-04-24 21:01:14.987342,0 days 00:00:00.790903,squared_error,28,sqrt,1,9,best,TPESampler,COMPLETE
125,0.8737590921917946,2025-04-24 21:01:14.589456,2025-04-24 21:01:15.813055,0 days 00:00:01.223599,squared_error,25,sqrt,8,4,random,TPESampler,COMPLETE
126,0.8924908961230087,2025-04-24 21:01:14.817471,2025-04-24 21:01:15.854868,0 days 00:00:01.037397,absolute_error,1,sqrt,1,7,random,TPESampler,COMPLETE
127,0.5378330558023339,2025-04-24 21:01:15.423663,2025-04-24 21:01:16.296883,0 days 00:00:00.873220,squared_error,27,sqrt,1,9,best,TPESampler,COMPLETE
128,0.5050330543762468,2025-04-24 21:01:16.018137,2025-04-24 21:01:16.745615,0 days 00:00:00.727478,squared_error,29,sqrt,1,10,best,TPESampler,COMPLETE
129,0.6895998002818075,2025-04-24 21:01:16.083672,2025-04-24 21:01:17.011061,0 days 00:00:00.927389,squared_error,28,sqrt,4,10,best,TPESampler,COMPLETE
130,0.5114477233942855,2025-04-24 21:01:16.519168,2025-04-24 21:01:17.325172,0 days 00:00:00.806004,squared_error,28,sqrt,1,8,best,TPESampler,COMPLETE
131,0.90157797490464,2025-04-24 21:01:16.955414,2025-04-24 21:01:17.622172,0 days 00:00:00.666758,squared_error,16,log2,9,4,best,TPESampler,COMPLETE
132,0.5185211704314117,2025-04-24 21:01:17.247265,2025-04-24 21:01:18.101719,0 days 00:00:00.854454,squared_error,30,sqrt,1,10,best,TPESampler,COMPLETE
133,0.565032535793402,2025-04-24 21:01:17.571546,2025-04-24 21:01:18.290087,0 days 00:00:00.718541,squared_error,32,sqrt,1,9,best,TPESampler,COMPLETE
134,0.5339224783480143,2025-04-24 21:01:17.876004,2025-04-24 21:01:18.536103,0 days 00:00:00.660099,squared_error,35,sqrt,1,8,best,TPESampler,COMPLETE
135,0.5230033993372178,2025-04-24 21:01:18.381860,2025-04-24 21:01:19.086842,0 days 00:00:00.704982,squared_error,24,sqrt,1,7,best,TPESampler,COMPLETE
136,0.8815969444241439,2025-04-24 21:01:18.602154,2025-04-24 21:01:19.370447,0 days 00:00:00.768293,absolute_error,6,sqrt,4,4,best,TPESampler,COMPLETE
137,0.8790475103328365,2025-04-24 21:01:18.914380,2025-04-24 21:01:19.640379,0 days 00:00:00.725999,absolute_error,32,log2,5,4,random,TPESampler,COMPLETE
138,0.6003595869177848,2025-04-24 21:01:19.347571,2025-04-24 21:01:20.390825,0 days 00:00:01.043254,absolute_error,34,sqrt,1,15,best,TPESampler,COMPLETE
139,0.6026460009830784,2025-04-24 21:01:19.590763,2025-04-24 21:01:20.541525,0 days 00:00:00.950762,absolute_error,35,sqrt,4,12,best,TPESampler,COMPLETE
140,0.5085251300670954,2025-04-24 21:01:19.944234,2025-04-24 21:01:20.712275,0 days 00:00:00.768041,friedman_mse,29,sqrt,1,9,best,TPESampler,COMPLETE
141,0.6090096365412528,2025-04-24 21:01:20.624112,2025-04-24 21:01:21.361176,0 days 00:00:00.737064,friedman_mse,29,log2,1,6,best,TPESampler,COMPLETE
