number,value,datetime_start,datetime_complete,duration,params_criterion,params_max_depth,params_max_features,params_min_samples_leaf,params_min_samples_split,params_splitter,system_attrs_auto:sampler,state
1432,0.5137295393660822,2025-04-24 21:09:49.050900,2025-04-24 21:09:50.052038,0 days 00:00:01.001138,friedman_mse,24,sqrt,1,8,best,TPESampler,COMPLETE
1433,0.8933764730129842,2025-04-24 21:09:49.495795,2025-04-24 21:09:50.455271,0 days 00:00:00.959476,squared_error,1,sqrt,6,17,best,TPESampler,COMPLETE
1434,0.6456349183315407,2025-04-24 21:09:49.897804,2025-04-24 21:09:50.854096,0 days 00:00:00.956292,friedman_mse,32,sqrt,3,4,best,TPESampler,COMPLETE
1435,0.8787156952958592,2025-04-24 21:09:50.415692,2025-04-24 21:09:51.089765,0 days 00:00:00.674073,friedman_mse,2,log2,3,18,random,TPESampler,COMPLETE
1436,0.49068441274037305,2025-04-24 21:09:50.812668,2025-04-24 21:09:51.628554,0 days 00:00:00.815886,friedman_mse,31,sqrt,1,6,best,TPESampler,COMPLETE
1437,0.5777786924655879,2025-04-24 21:09:51.134472,2025-04-24 21:09:51.908242,0 days 00:00:00.773770,absolute_error,29,sqrt,2,3,best,TPESampler,COMPLETE
1438,0.5912941502828561,2025-04-24 21:09:51.376681,2025-04-24 21:09:52.443454,0 days 00:00:01.066773,friedman_mse,35,sqrt,1,5,best,TPESampler,COMPLETE
1439,0.5724846347554697,2025-04-24 21:09:51.898351,2025-04-24 21:09:52.717322,0 days 00:00:00.818971,friedman_mse,30,sqrt,1,7,best,TPESampler,COMPLETE
1440,0.6504215924944643,2025-04-24 21:09:52.208462,2025-04-24 21:09:53.043928,0 days 00:00:00.835466,friedman_mse,26,sqrt,3,8,best,TPESampler,COMPLETE
1441,0.8737590921917946,2025-04-24 21:09:52.725534,2025-04-24 21:09:53.586555,0 days 00:00:00.861021,friedman_mse,6,sqrt,10,19,random,TPESampler,COMPLETE
1442,0.6456349183315407,2025-04-24 21:09:53.040937,2025-04-24 21:09:54.011501,0 days 00:00:00.970564,friedman_mse,29,sqrt,3,6,best,TPESampler,COMPLETE
1443,0.6548014724434806,2025-04-24 21:09:53.470620,2025-04-24 21:09:54.292414,0 days 00:00:00.821794,friedman_mse,27,sqrt,2,6,random,TPESampler,COMPLETE
1444,0.4653938401437279,2025-04-24 21:09:53.839485,2025-04-24 21:09:54.877268,0 days 00:00:01.037783,squared_error,32,sqrt,1,4,best,TPESampler,COMPLETE
1445,0.5816468111787075,2025-04-24 21:09:54.314514,2025-04-24 21:09:55.225352,0 days 00:00:00.910838,friedman_mse,34,sqrt,1,3,random,TPESampler,COMPLETE
1446,0.4868744820818364,2025-04-24 21:09:54.698803,2025-04-24 21:09:55.621511,0 days 00:00:00.922708,friedman_mse,27,sqrt,1,6,best,TPESampler,COMPLETE
1447,0.6265479990281826,2025-04-24 21:09:55.166470,2025-04-24 21:09:55.933883,0 days 00:00:00.767413,squared_error,32,sqrt,2,4,best,TPESampler,COMPLETE
1448,0.5513554337953424,2025-04-24 21:09:55.465579,2025-04-24 21:09:56.502359,0 days 00:00:01.036780,squared_error,27,sqrt,1,5,best,TPESampler,COMPLETE
1449,0.4750160173487102,2025-04-24 21:09:55.888027,2025-04-24 21:09:56.644831,0 days 00:00:00.756804,friedman_mse,32,sqrt,1,5,best,TPESampler,COMPLETE
1450,0.9018784399194749,2025-04-24 21:09:56.210759,2025-04-24 21:09:57.083335,0 days 00:00:00.872576,friedman_mse,3,log2,10,13,random,TPESampler,COMPLETE
1451,0.6825419058975224,2025-04-24 21:09:56.764845,2025-04-24 21:09:57.630271,0 days 00:00:00.865426,squared_error,30,sqrt,4,4,best,TPESampler,COMPLETE
1452,0.47983015285862346,2025-04-24 21:09:56.936024,2025-04-24 21:09:57.972451,0 days 00:00:01.036427,friedman_mse,28,sqrt,1,6,best,TPESampler,COMPLETE
1453,0.5520453318079024,2025-04-24 21:09:57.316345,2025-04-24 21:09:58.310671,0 days 00:00:00.994326,squared_error,29,sqrt,1,2,best,TPESampler,COMPLETE
1454,0.8767756438403109,2025-04-24 21:09:57.913570,2025-04-24 21:09:58.881823,0 days 00:00:00.968253,absolute_error,27,sqrt,10,8,random,TPESampler,COMPLETE
1455,0.6515872609760095,2025-04-24 21:09:58.306650,2025-04-24 21:09:59.116512,0 days 00:00:00.809862,squared_error,30,sqrt,2,6,best,TPESampler,COMPLETE
1456,0.5623543669503079,2025-04-24 21:09:58.612261,2025-04-24 21:09:59.427557,0 days 00:00:00.815296,friedman_mse,30,sqrt,1,5,best,TPESampler,COMPLETE
1457,0.5975832321496914,2025-04-24 21:09:59.299612,2025-04-24 21:10:00.299508,0 days 00:00:00.999896,friedman_mse,35,sqrt,2,5,best,TPESampler,COMPLETE
1458,0.7221791327231009,2025-04-24 21:09:59.377061,2025-04-24 21:10:00.551945,0 days 00:00:01.174884,squared_error,26,log2,2,7,best,TPESampler,COMPLETE
1459,0.6265479990281826,2025-04-24 21:09:59.932222,2025-04-24 21:10:00.926734,0 days 00:00:00.994512,squared_error,27,sqrt,2,2,best,TPESampler,COMPLETE
1460,0.90157797490464,2025-04-24 21:10:00.881281,2025-04-24 21:10:01.786727,0 days 00:00:00.905446,squared_error,23,log2,8,4,best,TPESampler,COMPLETE
1461,0.6456349183315407,2025-04-24 21:10:00.925523,2025-04-24 21:10:01.880818,0 days 00:00:00.955295,friedman_mse,32,sqrt,3,6,best,TPESampler,COMPLETE
1462,0.5364579699886214,2025-04-24 21:10:01.608863,2025-04-24 21:10:02.379176,0 days 00:00:00.770313,friedman_mse,25,sqrt,1,7,best,TPESampler,COMPLETE
1463,0.500848998379332,2025-04-24 21:10:02.044343,2025-04-24 21:10:02.930691,0 days 00:00:00.886348,squared_error,30,sqrt,1,2,best,TPESampler,COMPLETE
1464,0.8136068015810374,2025-04-24 21:10:02.235387,2025-04-24 21:10:03.154303,0 days 00:00:00.918916,absolute_error,9,sqrt,5,19,best,TPESampler,COMPLETE
1465,0.6515872609760095,2025-04-24 21:10:02.670148,2025-04-24 21:10:03.550292,0 days 00:00:00.880144,squared_error,31,sqrt,2,6,best,TPESampler,COMPLETE
1466,0.8790475103328365,2025-04-24 21:10:03.186258,2025-04-24 21:10:04.289567,0 days 00:00:01.103309,absolute_error,7,log2,7,18,random,TPESampler,COMPLETE
1467,0.5529688132197964,2025-04-24 21:10:03.464047,2025-04-24 21:10:04.460399,0 days 00:00:00.996352,friedman_mse,35,sqrt,1,2,best,TPESampler,COMPLETE
1468,0.6515872609760095,2025-04-24 21:10:03.859429,2025-04-24 21:10:04.868660,0 days 00:00:01.009231,squared_error,24,sqrt,2,6,best,TPESampler,COMPLETE
1469,0.6265479990281826,2025-04-24 21:10:04.534815,2025-04-24 21:10:05.994670,0 days 00:00:01.459855,squared_error,30,sqrt,2,2,best,TPESampler,COMPLETE
1470,0.6456349183315407,2025-04-24 21:10:04.803487,2025-04-24 21:10:05.682545,0 days 00:00:00.879058,friedman_mse,29,sqrt,3,7,best,TPESampler,COMPLETE
1471,0.6265479990281826,2025-04-24 21:10:05.082240,2025-04-24 21:10:06.090923,0 days 00:00:01.008683,squared_error,31,sqrt,2,3,best,TPESampler,COMPLETE
1472,0.5157610196982807,2025-04-24 21:10:05.995843,2025-04-24 21:10:07.027974,0 days 00:00:01.032131,friedman_mse,26,sqrt,1,7,best,TPESampler,COMPLETE
1473,0.6456349183315407,2025-04-24 21:10:06.491709,2025-04-24 21:10:07.731260,0 days 00:00:01.239551,squared_error,33,sqrt,3,4,best,TPESampler,COMPLETE
1474,0.5593525150541101,2025-04-24 21:10:06.539979,2025-04-24 21:10:07.637978,0 days 00:00:01.097999,squared_error,30,sqrt,1,4,best,TPESampler,COMPLETE
1475,0.6515872609760095,2025-04-24 21:10:07.317786,2025-04-24 21:10:08.483560,0 days 00:00:01.165774,squared_error,35,sqrt,2,6,best,TPESampler,COMPLETE
1476,0.6265479990281826,2025-04-24 21:10:07.859812,2025-04-24 21:10:08.712210,0 days 00:00:00.852398,squared_error,32,sqrt,2,4,best,TPESampler,COMPLETE
1477,0.5364518982459593,2025-04-24 21:10:07.967298,2025-04-24 21:10:08.957760,0 days 00:00:00.990462,squared_error,24,sqrt,1,5,best,TPESampler,COMPLETE
1478,0.5338046397110097,2025-04-24 21:10:08.753572,2025-04-24 21:10:09.496998,0 days 00:00:00.743426,squared_error,32,sqrt,1,2,best,TPESampler,COMPLETE
1479,0.5298778451782702,2025-04-24 21:10:09.012994,2025-04-24 21:10:10.086822,0 days 00:00:01.073828,friedman_mse,32,sqrt,1,7,best,TPESampler,COMPLETE
1480,0.6515872609760095,2025-04-24 21:10:09.210982,2025-04-24 21:10:10.130114,0 days 00:00:00.919132,friedman_mse,32,sqrt,2,6,best,TPESampler,COMPLETE
1481,0.5479322564786873,2025-04-24 21:10:09.864548,2025-04-24 21:10:10.579339,0 days 00:00:00.714791,friedman_mse,35,sqrt,1,6,best,TPESampler,COMPLETE
1482,0.47245231313348,2025-04-24 21:10:10.322352,2025-04-24 21:10:11.162952,0 days 00:00:00.840600,friedman_mse,30,sqrt,1,6,best,TPESampler,COMPLETE
1483,0.8720764985334399,2025-04-24 21:10:10.371875,2025-04-24 21:10:11.365397,0 days 00:00:00.993522,friedman_mse,16,log2,5,4,best,TPESampler,COMPLETE
1484,0.6504215924944643,2025-04-24 21:10:10.832733,2025-04-24 21:10:11.626293,0 days 00:00:00.793560,friedman_mse,24,sqrt,3,8,best,TPESampler,COMPLETE
1485,0.4962324084473796,2025-04-24 21:10:11.425760,2025-04-24 21:10:12.210078,0 days 00:00:00.784318,friedman_mse,29,sqrt,1,6,best,TPESampler,COMPLETE
1486,0.5912941502828561,2025-04-24 21:10:11.695780,2025-04-24 21:10:12.586841,0 days 00:00:00.891061,squared_error,35,sqrt,1,5,best,TPESampler,COMPLETE
1487,0.6456349183315407,2025-04-24 21:10:12.055412,2025-04-24 21:10:13.126818,0 days 00:00:01.071406,friedman_mse,29,sqrt,3,5,best,TPESampler,COMPLETE
1488,0.5164170552722069,2025-04-24 21:10:12.520132,2025-04-24 21:10:13.392362,0 days 00:00:00.872230,friedman_mse,29,sqrt,1,8,best,TPESampler,COMPLETE
1489,0.5509586477110677,2025-04-24 21:10:12.868930,2025-04-24 21:10:13.744583,0 days 00:00:00.875653,friedman_mse,22,sqrt,1,10,best,TPESampler,COMPLETE
1490,0.5724846347554697,2025-04-24 21:10:13.393893,2025-04-24 21:10:14.369235,0 days 00:00:00.975342,friedman_mse,30,sqrt,1,7,best,TPESampler,COMPLETE
1491,0.8936795249623696,2025-04-24 21:10:13.670322,2025-04-24 21:10:14.619810,0 days 00:00:00.949488,absolute_error,4,log2,4,20,best,TPESampler,COMPLETE
1492,0.5517493393728706,2025-04-24 21:10:14.291661,2025-04-24 21:10:15.080838,0 days 00:00:00.789177,friedman_mse,35,sqrt,1,4,best,TPESampler,COMPLETE
1493,0.6456349183315407,2025-04-24 21:10:14.646308,2025-04-24 21:10:15.612975,0 days 00:00:00.966667,friedman_mse,30,sqrt,3,6,best,TPESampler,COMPLETE
1494,0.6456349183315407,2025-04-24 21:10:15.049218,2025-04-24 21:10:15.771293,0 days 00:00:00.722075,friedman_mse,28,sqrt,3,6,best,TPESampler,COMPLETE
1495,0.5724846347554697,2025-04-24 21:10:15.302265,2025-04-24 21:10:16.136438,0 days 00:00:00.834173,friedman_mse,30,sqrt,1,7,best,TPESampler,COMPLETE
1496,0.6543493434771493,2025-04-24 21:10:15.855018,2025-04-24 21:10:16.667205,0 days 00:00:00.812187,friedman_mse,23,sqrt,1,8,random,TPESampler,COMPLETE
1497,0.5129561010742344,2025-04-24 21:10:16.137873,2025-04-24 21:10:17.097432,0 days 00:00:00.959559,friedman_mse,33,sqrt,1,7,best,TPESampler,COMPLETE
1498,0.5623543669503079,2025-04-24 21:10:16.539160,2025-04-24 21:10:17.850606,0 days 00:00:01.311446,friedman_mse,30,sqrt,1,5,best,TPESampler,COMPLETE
1499,0.5518815421255675,2025-04-24 21:10:17.062833,2025-04-24 21:10:18.099686,0 days 00:00:01.036853,friedman_mse,25,sqrt,1,6,best,TPESampler,COMPLETE
1500,0.5011482218769929,2025-04-24 21:10:17.603490,2025-04-24 21:10:18.830555,0 days 00:00:01.227065,friedman_mse,25,sqrt,1,8,best,TPESampler,COMPLETE
1501,0.6456349183315407,2025-04-24 21:10:18.131643,2025-04-24 21:10:19.055296,0 days 00:00:00.923653,friedman_mse,31,sqrt,3,4,best,TPESampler,COMPLETE
1502,0.7001426564128769,2025-04-24 21:10:18.328951,2025-04-24 21:10:19.191512,0 days 00:00:00.862561,squared_error,17,sqrt,10,11,best,TPESampler,COMPLETE
1503,0.5669493989992861,2025-04-24 21:10:19.105820,2025-04-24 21:10:20.256916,0 days 00:00:01.151096,squared_error,33,sqrt,1,5,best,TPESampler,COMPLETE
1504,0.8790475103328365,2025-04-24 21:10:19.302896,2025-04-24 21:10:20.562591,0 days 00:00:01.259695,absolute_error,21,log2,5,11,random,TPESampler,COMPLETE
1505,0.6504215924944643,2025-04-24 21:10:19.502927,2025-04-24 21:10:20.596155,0 days 00:00:01.093228,friedman_mse,30,sqrt,3,8,best,TPESampler,COMPLETE
1506,0.5722488541019987,2025-04-24 21:10:20.506094,2025-04-24 21:10:21.202761,0 days 00:00:00.696667,absolute_error,26,sqrt,1,5,best,TPESampler,COMPLETE
1507,0.49783262823116015,2025-04-24 21:10:20.865314,2025-04-24 21:10:21.839212,0 days 00:00:00.973898,friedman_mse,31,sqrt,1,5,best,TPESampler,COMPLETE
1508,0.6265479990281826,2025-04-24 21:10:20.903449,2025-04-24 21:10:21.876624,0 days 00:00:00.973175,friedman_mse,35,sqrt,2,3,best,TPESampler,COMPLETE
1509,0.5623543669503079,2025-04-24 21:10:21.475212,2025-04-24 21:10:22.224266,0 days 00:00:00.749054,friedman_mse,30,sqrt,1,5,best,TPESampler,COMPLETE
1510,0.5129561010742344,2025-04-24 21:10:22.093561,2025-04-24 21:10:23.242224,0 days 00:00:01.148663,friedman_mse,33,sqrt,1,7,best,TPESampler,COMPLETE
1511,0.6194853816763535,2025-04-24 21:10:22.149647,2025-04-24 21:10:23.065392,0 days 00:00:00.915745,friedman_mse,30,sqrt,2,8,best,TPESampler,COMPLETE
1512,0.496257590485042,2025-04-24 21:10:22.491171,2025-04-24 21:10:23.380566,0 days 00:00:00.889395,squared_error,34,sqrt,1,4,best,TPESampler,COMPLETE
1513,0.8609035623054152,2025-04-24 21:10:23.331264,2025-04-24 21:10:24.062346,0 days 00:00:00.731082,squared_error,32,log2,4,7,best,TPESampler,COMPLETE
1514,0.5020512557327408,2025-04-24 21:10:23.571537,2025-04-24 21:10:24.477340,0 days 00:00:00.905803,friedman_mse,30,sqrt,1,8,best,TPESampler,COMPLETE
1515,0.5378330558023339,2025-04-24 21:10:23.736110,2025-04-24 21:10:24.728455,0 days 00:00:00.992345,friedman_mse,27,sqrt,1,9,best,TPESampler,COMPLETE
1516,0.5513554337953424,2025-04-24 21:10:24.414019,2025-04-24 21:10:25.250285,0 days 00:00:00.836266,friedman_mse,27,sqrt,1,5,best,TPESampler,COMPLETE
1517,0.7688466480043374,2025-04-24 21:10:24.761657,2025-04-24 21:10:25.718433,0 days 00:00:00.956776,squared_error,26,sqrt,5,4,random,TPESampler,COMPLETE
1518,0.6090096365412528,2025-04-24 21:10:24.972734,2025-04-24 21:10:25.963272,0 days 00:00:00.990538,friedman_mse,29,log2,1,6,best,TPESampler,COMPLETE
1519,0.48921668337565616,2025-04-24 21:10:25.658716,2025-04-24 21:10:26.483653,0 days 00:00:00.824937,friedman_mse,32,sqrt,1,6,best,TPESampler,COMPLETE
1520,0.5912941502828561,2025-04-24 21:10:26.084052,2025-04-24 21:10:27.156778,0 days 00:00:01.072726,friedman_mse,35,sqrt,1,5,best,TPESampler,COMPLETE
1521,0.6180856799418332,2025-04-24 21:10:26.279493,2025-04-24 21:10:27.315813,0 days 00:00:01.036320,friedman_mse,35,sqrt,2,7,best,TPESampler,COMPLETE
1522,0.8739965405465177,2025-04-24 21:10:26.822117,2025-04-24 21:10:27.600677,0 days 00:00:00.778560,squared_error,15,log2,5,13,best,TPESampler,COMPLETE
1523,0.6504215924944643,2025-04-24 21:10:27.448759,2025-04-24 21:10:28.365890,0 days 00:00:00.917131,friedman_mse,26,sqrt,3,8,best,TPESampler,COMPLETE
1524,0.6456349183315407,2025-04-24 21:10:27.566028,2025-04-24 21:10:28.563721,0 days 00:00:00.997693,friedman_mse,26,sqrt,3,6,best,TPESampler,COMPLETE
1525,0.6737615845013311,2025-04-24 21:10:27.822120,2025-04-24 21:10:28.686406,0 days 00:00:00.864286,squared_error,20,sqrt,1,7,random,TPESampler,COMPLETE
1526,0.48333612106664076,2025-04-24 21:10:28.653004,2025-04-24 21:10:29.675592,0 days 00:00:01.022588,friedman_mse,31,sqrt,1,4,best,TPESampler,COMPLETE
1527,0.5373966342965538,2025-04-24 21:10:28.796976,2025-04-24 21:10:29.914124,0 days 00:00:01.117148,friedman_mse,29,sqrt,1,4,best,TPESampler,COMPLETE
1528,0.5593525150541101,2025-04-24 21:10:28.989175,2025-04-24 21:10:29.954505,0 days 00:00:00.965330,friedman_mse,30,sqrt,1,4,best,TPESampler,COMPLETE
1529,0.6194853816763535,2025-04-24 21:10:30.100447,2025-04-24 21:10:31.021442,0 days 00:00:00.920995,friedman_mse,29,sqrt,2,8,best,TPESampler,COMPLETE
1530,0.5164170552722069,2025-04-24 21:10:30.110392,2025-04-24 21:10:31.316307,0 days 00:00:01.205915,friedman_mse,29,sqrt,1,8,best,TPESampler,COMPLETE
1531,0.5114477233942855,2025-04-24 21:10:30.252277,2025-04-24 21:10:31.479461,0 days 00:00:01.227184,friedman_mse,28,sqrt,1,8,best,TPESampler,COMPLETE
1532,0.7271759717260888,2025-04-24 21:10:31.393312,2025-04-24 21:10:32.599309,0 days 00:00:01.205997,absolute_error,12,sqrt,3,3,best,TPESampler,COMPLETE
1533,0.6456349183315407,2025-04-24 21:10:31.601116,2025-04-24 21:10:32.950829,0 days 00:00:01.349713,friedman_mse,32,sqrt,3,3,best,TPESampler,COMPLETE
1534,0.5009416042758076,2025-04-24 21:10:31.763023,2025-04-24 21:10:32.837686,0 days 00:00:01.074663,friedman_mse,23,sqrt,1,7,best,TPESampler,COMPLETE
1535,0.6504215924944643,2025-04-24 21:10:32.889045,2025-04-24 21:10:33.759223,0 days 00:00:00.870178,friedman_mse,32,sqrt,3,8,best,TPESampler,COMPLETE
1536,0.7240473041800813,2025-04-24 21:10:33.212158,2025-04-24 21:10:34.391439,0 days 00:00:01.179281,squared_error,30,log2,1,8,random,TPESampler,COMPLETE
1537,0.8691709676792778,2025-04-24 21:10:33.479574,2025-04-24 21:10:34.462904,0 days 00:00:00.983330,squared_error,3,sqrt,2,9,random,TPESampler,COMPLETE
1538,0.5202466614878716,2025-04-24 21:10:34.095983,2025-04-24 21:10:34.880350,0 days 00:00:00.784367,friedman_mse,29,sqrt,1,7,best,TPESampler,COMPLETE
1539,0.6241300321581481,2025-04-24 21:10:34.602695,2025-04-24 21:10:35.636583,0 days 00:00:01.033888,friedman_mse,29,sqrt,1,7,random,TPESampler,COMPLETE
1540,0.4827218654781925,2025-04-24 21:10:34.674180,2025-04-24 21:10:35.685576,0 days 00:00:01.011396,friedman_mse,34,sqrt,1,6,best,TPESampler,COMPLETE
1541,0.6180856799418332,2025-04-24 21:10:35.434024,2025-04-24 21:10:36.241440,0 days 00:00:00.807416,friedman_mse,35,sqrt,2,7,best,TPESampler,COMPLETE
1542,0.6807108048919962,2025-04-24 21:10:35.888858,2025-04-24 21:10:36.964587,0 days 00:00:01.075729,squared_error,34,sqrt,8,8,best,TPESampler,COMPLETE
1543,0.5435622016360893,2025-04-24 21:10:35.937631,2025-04-24 21:10:36.953006,0 days 00:00:01.015375,squared_error,27,sqrt,1,7,best,TPESampler,COMPLETE
1544,0.6515872609760095,2025-04-24 21:10:36.515725,2025-04-24 21:10:37.254931,0 days 00:00:00.739206,friedman_mse,26,sqrt,2,6,best,TPESampler,COMPLETE
1545,0.5479322564786873,2025-04-24 21:10:37.183208,2025-04-24 21:10:38.053586,0 days 00:00:00.870378,friedman_mse,35,sqrt,1,6,best,TPESampler,COMPLETE
1546,0.6456349183315407,2025-04-24 21:10:37.329334,2025-04-24 21:10:38.591795,0 days 00:00:01.262461,friedman_mse,31,sqrt,3,6,best,TPESampler,COMPLETE
1547,0.5378902223820379,2025-04-24 21:10:37.499809,2025-04-24 21:10:38.551107,0 days 00:00:01.051298,friedman_mse,24,sqrt,1,6,best,TPESampler,COMPLETE
1548,0.5202466614878716,2025-04-24 21:10:38.423465,2025-04-24 21:10:39.232913,0 days 00:00:00.809448,friedman_mse,29,sqrt,1,7,best,TPESampler,COMPLETE
1549,0.5866989930671433,2025-04-24 21:10:38.862531,2025-04-24 21:10:40.004211,0 days 00:00:01.141680,absolute_error,29,sqrt,3,4,best,TPESampler,COMPLETE
1550,0.5593525150541101,2025-04-24 21:10:38.922821,2025-04-24 21:10:40.008471,0 days 00:00:01.085650,friedman_mse,30,sqrt,1,4,best,TPESampler,COMPLETE
1551,0.5724846347554697,2025-04-24 21:10:39.550110,2025-04-24 21:10:40.386136,0 days 00:00:00.836026,friedman_mse,30,sqrt,1,7,best,TPESampler,COMPLETE
1552,0.6265479990281826,2025-04-24 21:10:40.294530,2025-04-24 21:10:41.220572,0 days 00:00:00.926042,friedman_mse,30,sqrt,2,4,best,TPESampler,COMPLETE
1553,0.8790475103328365,2025-04-24 21:10:40.348114,2025-04-24 21:10:41.509582,0 days 00:00:01.161468,absolute_error,11,log2,6,11,random,TPESampler,COMPLETE
1554,0.8767756438403109,2025-04-24 21:10:40.684645,2025-04-24 21:10:41.682431,0 days 00:00:00.997786,absolute_error,25,sqrt,10,2,random,TPESampler,COMPLETE
1555,0.6504215924944643,2025-04-24 21:10:41.540657,2025-04-24 21:10:42.277250,0 days 00:00:00.736593,friedman_mse,30,sqrt,3,8,best,TPESampler,COMPLETE
1556,0.6265479990281826,2025-04-24 21:10:41.755319,2025-04-24 21:10:42.679875,0 days 00:00:00.924556,squared_error,35,sqrt,2,3,best,TPESampler,COMPLETE
1557,0.6289323974475082,2025-04-24 21:10:41.931010,2025-04-24 21:10:42.904580,0 days 00:00:00.973570,friedman_mse,28,sqrt,2,9,best,TPESampler,COMPLETE
1558,0.5724846347554697,2025-04-24 21:10:42.632569,2025-04-24 21:10:43.418127,0 days 00:00:00.785558,friedman_mse,30,sqrt,1,7,best,TPESampler,COMPLETE
1559,0.5513554337953424,2025-04-24 21:10:42.960540,2025-04-24 21:10:44.051715,0 days 00:00:01.091175,friedman_mse,27,sqrt,1,5,best,TPESampler,COMPLETE
1560,0.48333612106664076,2025-04-24 21:10:43.133293,2025-04-24 21:10:44.062715,0 days 00:00:00.929422,friedman_mse,31,sqrt,1,4,best,TPESampler,COMPLETE
1561,0.7617863170785959,2025-04-24 21:10:43.726450,2025-04-24 21:10:45.002008,0 days 00:00:01.275558,friedman_mse,10,sqrt,2,16,random,TPESampler,COMPLETE
1562,0.5164170552722069,2025-04-24 21:10:44.371943,2025-04-24 21:10:45.307769,0 days 00:00:00.935826,friedman_mse,29,sqrt,1,8,best,TPESampler,COMPLETE
1563,0.8519173927695258,2025-04-24 21:10:44.425081,2025-04-24 21:10:45.538778,0 days 00:00:01.113697,friedman_mse,35,log2,3,10,random,TPESampler,COMPLETE
1564,0.6456349183315407,2025-04-24 21:10:45.262767,2025-04-24 21:10:46.083245,0 days 00:00:00.820478,friedman_mse,28,sqrt,3,4,best,TPESampler,COMPLETE
1565,0.5129561010742344,2025-04-24 21:10:45.648393,2025-04-24 21:10:46.409144,0 days 00:00:00.760751,friedman_mse,33,sqrt,1,7,best,TPESampler,COMPLETE
1566,0.6265479990281826,2025-04-24 21:10:45.898156,2025-04-24 21:10:46.821213,0 days 00:00:00.923057,friedman_mse,35,sqrt,2,2,best,TPESampler,COMPLETE
1567,0.7436032276730585,2025-04-24 21:10:46.354063,2025-04-24 21:10:47.218392,0 days 00:00:00.864329,friedman_mse,18,log2,3,12,best,TPESampler,COMPLETE
1568,0.46570797980588163,2025-04-24 21:10:46.708397,2025-04-24 21:10:47.531074,0 days 00:00:00.822677,friedman_mse,31,sqrt,1,7,best,TPESampler,COMPLETE
1569,0.5378902223820379,2025-04-24 21:10:47.083172,2025-04-24 21:10:48.001989,0 days 00:00:00.918817,friedman_mse,24,sqrt,1,6,best,TPESampler,COMPLETE
1570,0.6456349183315407,2025-04-24 21:10:47.492210,2025-04-24 21:10:48.384030,0 days 00:00:00.891820,friedman_mse,35,sqrt,3,7,best,TPESampler,COMPLETE
1571,0.5332166565957392,2025-04-24 21:10:47.826376,2025-04-24 21:10:48.952970,0 days 00:00:01.126594,friedman_mse,24,sqrt,1,11,best,TPESampler,COMPLETE
1572,0.5164170552722069,2025-04-24 21:10:48.266403,2025-04-24 21:10:49.254342,0 days 00:00:00.987939,friedman_mse,29,sqrt,1,8,best,TPESampler,COMPLETE
1573,0.5011731735894601,2025-04-24 21:10:48.679939,2025-04-24 21:10:49.595493,0 days 00:00:00.915554,friedman_mse,33,sqrt,1,8,best,TPESampler,COMPLETE
1574,0.5085251300670954,2025-04-24 21:10:49.245421,2025-04-24 21:10:50.128178,0 days 00:00:00.882757,friedman_mse,29,sqrt,1,9,best,TPESampler,COMPLETE
