number,value,datetime_start,datetime_complete,duration,params_criterion,params_max_depth,params_max_features,params_min_samples_leaf,params_min_samples_split,params_splitter,system_attrs_auto:sampler,state
2433,0.501805213478129,2025-04-24 21:17:18.517427,2025-04-24 21:17:19.503140,0 days 00:00:00.985713,friedman_mse,31,sqrt,1,2,best,TPESampler,COMPLETE
2434,0.5364579699886214,2025-04-24 21:17:18.696306,2025-04-24 21:17:19.680726,0 days 00:00:00.984420,friedman_mse,25,sqrt,1,7,best,TPESampler,COMPLETE
2435,0.6505607027347653,2025-04-24 21:17:19.468528,2025-04-24 21:17:20.289188,0 days 00:00:00.820660,friedman_mse,29,log2,1,8,best,TPESampler,COMPLETE
2436,0.5020512557327408,2025-04-24 21:17:19.751528,2025-04-24 21:17:20.892150,0 days 00:00:01.140622,friedman_mse,30,sqrt,1,8,best,TPESampler,COMPLETE
2437,0.5242942957596758,2025-04-24 21:17:19.930609,2025-04-24 21:17:20.963045,0 days 00:00:01.032436,friedman_mse,30,sqrt,1,11,best,TPESampler,COMPLETE
2438,0.6515872609760095,2025-04-24 21:17:20.596320,2025-04-24 21:17:21.519254,0 days 00:00:00.922934,friedman_mse,30,sqrt,2,6,best,TPESampler,COMPLETE
2439,0.5981085317822403,2025-04-24 21:17:21.112591,2025-04-24 21:17:22.166520,0 days 00:00:01.053929,friedman_mse,33,sqrt,1,7,random,TPESampler,COMPLETE
2440,0.6456349183315407,2025-04-24 21:17:21.155430,2025-04-24 21:17:22.210631,0 days 00:00:01.055201,friedman_mse,35,sqrt,3,6,best,TPESampler,COMPLETE
2441,0.5329702439043837,2025-04-24 21:17:21.871977,2025-04-24 21:17:22.694215,0 days 00:00:00.822238,friedman_mse,35,sqrt,1,11,best,TPESampler,COMPLETE
2442,0.47245231313348,2025-04-24 21:17:22.393874,2025-04-24 21:17:23.454106,0 days 00:00:01.060232,friedman_mse,30,sqrt,1,6,best,TPESampler,COMPLETE
2443,0.6434470676863255,2025-04-24 21:17:22.448106,2025-04-24 21:17:23.492421,0 days 00:00:01.044315,squared_error,35,sqrt,2,5,random,TPESampler,COMPLETE
2444,0.8106497546097036,2025-04-24 21:17:23.182214,2025-04-24 21:17:24.261280,0 days 00:00:01.079066,absolute_error,22,sqrt,4,3,random,TPESampler,COMPLETE
2445,0.6426465850157429,2025-04-24 21:17:23.711089,2025-04-24 21:17:24.615282,0 days 00:00:00.904193,squared_error,15,sqrt,2,18,best,TPESampler,COMPLETE
2446,0.6456349183315407,2025-04-24 21:17:23.758074,2025-04-24 21:17:24.845980,0 days 00:00:01.087906,friedman_mse,22,sqrt,3,6,best,TPESampler,COMPLETE
2447,0.49783262823116015,2025-04-24 21:17:24.555601,2025-04-24 21:17:25.455941,0 days 00:00:00.900340,friedman_mse,31,sqrt,1,5,best,TPESampler,COMPLETE
2448,0.49783262823116015,2025-04-24 21:17:24.969485,2025-04-24 21:17:25.766396,0 days 00:00:00.796911,friedman_mse,31,sqrt,1,5,best,TPESampler,COMPLETE
2449,0.6504215924944643,2025-04-24 21:17:25.174595,2025-04-24 21:17:26.208949,0 days 00:00:01.034354,friedman_mse,31,sqrt,3,8,best,TPESampler,COMPLETE
2450,0.4831415131013947,2025-04-24 21:17:25.763486,2025-04-24 21:17:26.644064,0 days 00:00:00.880578,friedman_mse,31,sqrt,1,8,best,TPESampler,COMPLETE
2451,0.5339224783480143,2025-04-24 21:17:26.076741,2025-04-24 21:17:27.081614,0 days 00:00:01.004873,friedman_mse,35,sqrt,1,8,best,TPESampler,COMPLETE
2452,0.8386348672529573,2025-04-24 21:17:26.484589,2025-04-24 21:17:27.385222,0 days 00:00:00.900633,absolute_error,15,sqrt,5,11,random,TPESampler,COMPLETE
2453,0.6456349183315407,2025-04-24 21:17:27.022218,2025-04-24 21:17:28.131208,0 days 00:00:01.108990,friedman_mse,30,sqrt,3,4,best,TPESampler,COMPLETE
2454,0.6265479990281826,2025-04-24 21:17:27.378009,2025-04-24 21:17:28.325400,0 days 00:00:00.947391,friedman_mse,30,sqrt,2,4,best,TPESampler,COMPLETE
2455,0.5348776862952044,2025-04-24 21:17:27.797379,2025-04-24 21:17:28.604301,0 days 00:00:00.806922,friedman_mse,26,sqrt,1,2,best,TPESampler,COMPLETE
2456,0.6456349183315407,2025-04-24 21:17:28.566360,2025-04-24 21:17:29.646278,0 days 00:00:01.079918,friedman_mse,30,sqrt,3,2,best,TPESampler,COMPLETE
2457,0.5296855957806621,2025-04-24 21:17:28.607525,2025-04-24 21:17:29.694541,0 days 00:00:01.087016,friedman_mse,26,sqrt,1,8,best,TPESampler,COMPLETE
2458,0.5011482218769929,2025-04-24 21:17:28.824404,2025-04-24 21:17:30.016620,0 days 00:00:01.192216,friedman_mse,25,sqrt,1,8,best,TPESampler,COMPLETE
2459,0.6180856799418332,2025-04-24 21:17:29.937359,2025-04-24 21:17:30.830541,0 days 00:00:00.893182,friedman_mse,35,sqrt,2,7,best,TPESampler,COMPLETE
2460,0.8932346149665252,2025-04-24 21:17:29.983375,2025-04-24 21:17:31.221083,0 days 00:00:01.237708,absolute_error,1,log2,5,16,best,TPESampler,COMPLETE
2461,0.4831415131013947,2025-04-24 21:17:30.420410,2025-04-24 21:17:31.490668,0 days 00:00:01.070258,friedman_mse,31,sqrt,1,8,best,TPESampler,COMPLETE
2462,0.723689866904228,2025-04-24 21:17:31.370396,2025-04-24 21:17:32.422547,0 days 00:00:01.052151,friedman_mse,34,sqrt,4,2,random,TPESampler,COMPLETE
2463,0.5373966342965538,2025-04-24 21:17:31.558752,2025-04-24 21:17:32.920587,0 days 00:00:01.361835,friedman_mse,29,sqrt,1,4,best,TPESampler,COMPLETE
2464,0.6515872609760095,2025-04-24 21:17:31.781006,2025-04-24 21:17:33.061992,0 days 00:00:01.280986,friedman_mse,27,sqrt,2,6,best,TPESampler,COMPLETE
2465,0.8737590921917946,2025-04-24 21:17:32.885293,2025-04-24 21:17:33.706117,0 days 00:00:00.820824,friedman_mse,20,sqrt,7,7,random,TPESampler,COMPLETE
2466,0.4831415131013947,2025-04-24 21:17:33.156192,2025-04-24 21:17:34.308723,0 days 00:00:01.152531,friedman_mse,31,sqrt,1,8,best,TPESampler,COMPLETE
2467,0.6807108048919962,2025-04-24 21:17:33.352593,2025-04-24 21:17:34.314618,0 days 00:00:00.962025,friedman_mse,18,sqrt,8,20,best,TPESampler,COMPLETE
2468,0.49783262823116015,2025-04-24 21:17:34.038499,2025-04-24 21:17:34.861696,0 days 00:00:00.823197,friedman_mse,31,sqrt,1,5,best,TPESampler,COMPLETE
2469,0.7311891364188057,2025-04-24 21:17:34.539742,2025-04-24 21:17:35.515833,0 days 00:00:00.976091,friedman_mse,31,log2,2,5,best,TPESampler,COMPLETE
2470,0.5085288623263258,2025-04-24 21:17:34.595805,2025-04-24 21:17:35.633767,0 days 00:00:01.037962,friedman_mse,35,sqrt,1,9,best,TPESampler,COMPLETE
2471,0.5529688132197964,2025-04-24 21:17:35.324525,2025-04-24 21:17:36.559551,0 days 00:00:01.235026,friedman_mse,35,sqrt,1,2,best,TPESampler,COMPLETE
2472,0.5327880009702136,2025-04-24 21:17:35.816836,2025-04-24 21:17:36.884362,0 days 00:00:01.067526,squared_error,26,sqrt,1,9,best,TPESampler,COMPLETE
2473,0.74349522764793,2025-04-24 21:17:35.906257,2025-04-24 21:17:37.175131,0 days 00:00:01.268874,friedman_mse,26,log2,3,6,best,TPESampler,COMPLETE
2474,0.6448045736840117,2025-04-24 21:17:36.837321,2025-04-24 21:17:37.970822,0 days 00:00:01.133501,squared_error,26,sqrt,1,7,random,TPESampler,COMPLETE
2475,0.6504215924944643,2025-04-24 21:17:37.314303,2025-04-24 21:17:38.330444,0 days 00:00:01.016141,friedman_mse,27,sqrt,3,9,best,TPESampler,COMPLETE
2476,0.6504215924944643,2025-04-24 21:17:37.507324,2025-04-24 21:17:38.531322,0 days 00:00:01.023998,friedman_mse,25,sqrt,3,9,best,TPESampler,COMPLETE
2477,0.6265479990281826,2025-04-24 21:17:38.266587,2025-04-24 21:17:39.092461,0 days 00:00:00.825874,friedman_mse,24,sqrt,2,4,best,TPESampler,COMPLETE
2478,0.6515872609760095,2025-04-24 21:17:38.684339,2025-04-24 21:17:39.504923,0 days 00:00:00.820584,friedman_mse,35,sqrt,2,6,best,TPESampler,COMPLETE
2479,0.6504215924944643,2025-04-24 21:17:38.909056,2025-04-24 21:17:39.994284,0 days 00:00:01.085228,squared_error,26,sqrt,3,8,best,TPESampler,COMPLETE
2480,0.49783262823116015,2025-04-24 21:17:39.379141,2025-04-24 21:17:40.342279,0 days 00:00:00.963138,friedman_mse,31,sqrt,1,5,best,TPESampler,COMPLETE
2481,0.6619048787325945,2025-04-24 21:17:39.773924,2025-04-24 21:17:40.713495,0 days 00:00:00.939571,friedman_mse,21,sqrt,1,2,random,TPESampler,COMPLETE
2482,0.49068441274037305,2025-04-24 21:17:40.303914,2025-04-24 21:17:41.258608,0 days 00:00:00.954694,squared_error,31,sqrt,1,6,best,TPESampler,COMPLETE
2483,0.6456349183315407,2025-04-24 21:17:40.630117,2025-04-24 21:17:41.615961,0 days 00:00:00.985844,friedman_mse,31,sqrt,3,7,best,TPESampler,COMPLETE
2484,0.5050330543762468,2025-04-24 21:17:40.993072,2025-04-24 21:17:41.950067,0 days 00:00:00.956995,friedman_mse,29,sqrt,1,10,best,TPESampler,COMPLETE
2485,0.5724846347554697,2025-04-24 21:17:41.501884,2025-04-24 21:17:42.503210,0 days 00:00:01.001326,friedman_mse,30,sqrt,1,7,best,TPESampler,COMPLETE
2486,0.46570797980588163,2025-04-24 21:17:41.898805,2025-04-24 21:17:42.721983,0 days 00:00:00.823178,friedman_mse,31,sqrt,1,7,best,TPESampler,COMPLETE
2487,0.7221791327231009,2025-04-24 21:17:42.260363,2025-04-24 21:17:43.205013,0 days 00:00:00.944650,squared_error,33,log2,2,7,best,TPESampler,COMPLETE
2488,0.4868744820818364,2025-04-24 21:17:42.828983,2025-04-24 21:17:43.893234,0 days 00:00:01.064251,friedman_mse,27,sqrt,1,6,best,TPESampler,COMPLETE
2489,0.5037849405969599,2025-04-24 21:17:43.063413,2025-04-24 21:17:44.089194,0 days 00:00:01.025781,friedman_mse,26,sqrt,1,6,best,TPESampler,COMPLETE
2490,0.6504215924944643,2025-04-24 21:17:43.542312,2025-04-24 21:17:44.641398,0 days 00:00:01.099086,friedman_mse,30,sqrt,3,10,best,TPESampler,COMPLETE
2491,0.4653938401437279,2025-04-24 21:17:44.200812,2025-04-24 21:17:45.647616,0 days 00:00:01.446804,friedman_mse,32,sqrt,1,4,best,TPESampler,COMPLETE
2492,0.6456349183315407,2025-04-24 21:17:44.499150,2025-04-24 21:17:45.928590,0 days 00:00:01.429440,friedman_mse,30,sqrt,3,5,best,TPESampler,COMPLETE
2493,0.5103145559958866,2025-04-24 21:17:45.196412,2025-04-24 21:17:46.612027,0 days 00:00:01.415615,friedman_mse,32,sqrt,1,3,best,TPESampler,COMPLETE
2494,0.5502500298892143,2025-04-24 21:17:46.087735,2025-04-24 21:17:47.380177,0 days 00:00:01.292442,friedman_mse,33,sqrt,1,2,random,TPESampler,COMPLETE
2495,0.47692047149238787,2025-04-24 21:17:46.552396,2025-04-24 21:17:48.265259,0 days 00:00:01.712863,friedman_mse,27,sqrt,1,3,best,TPESampler,COMPLETE
2496,0.5392396456504133,2025-04-24 21:17:47.180744,2025-04-24 21:17:48.530058,0 days 00:00:01.349314,friedman_mse,34,sqrt,1,3,best,TPESampler,COMPLETE
2497,0.6265479990281826,2025-04-24 21:17:47.884635,2025-04-24 21:17:49.695682,0 days 00:00:01.811047,friedman_mse,34,sqrt,2,3,best,TPESampler,COMPLETE
2498,0.5031894798232044,2025-04-24 21:17:48.650007,2025-04-24 21:17:50.620840,0 days 00:00:01.970833,friedman_mse,25,sqrt,1,2,best,TPESampler,COMPLETE
2499,0.6265479990281826,2025-04-24 21:17:49.076022,2025-04-24 21:17:50.646315,0 days 00:00:01.570293,friedman_mse,30,sqrt,2,2,best,TPESampler,COMPLETE
