number,value,datetime_start,datetime_complete,duration,params_criterion,params_max_depth,params_max_features,params_min_samples_leaf,params_min_samples_split,params_splitter,system_attrs_auto:sampler,state
2147,0.8790475103328365,2025-04-24 21:15:03.477969,2025-04-24 21:15:04.480848,0 days 00:00:01.002879,absolute_error,19,log2,5,3,random,TPESampler,COMPLETE
2148,0.5296855957806621,2025-04-24 21:15:03.938556,2025-04-24 21:15:04.790821,0 days 00:00:00.852265,friedman_mse,26,sqrt,1,8,best,TPESampler,COMPLETE
2149,0.754992436740128,2025-04-24 21:15:04.749794,2025-04-24 21:15:05.499640,0 days 00:00:00.749846,friedman_mse,23,log2,1,11,random,TPESampler,COMPLETE
2150,0.5338046397110097,2025-04-24 21:15:04.795249,2025-04-24 21:15:06.496210,0 days 00:00:01.700961,friedman_mse,32,sqrt,1,2,best,TPESampler,COMPLETE
2151,0.47245231313348,2025-04-24 21:15:05.049317,2025-04-24 21:15:06.328971,0 days 00:00:01.279654,friedman_mse,30,sqrt,1,6,best,TPESampler,COMPLETE
2152,0.6504215924944643,2025-04-24 21:15:05.818756,2025-04-24 21:15:06.850120,0 days 00:00:01.031364,friedman_mse,25,sqrt,3,8,best,TPESampler,COMPLETE
2153,0.8575823339658861,2025-04-24 21:15:06.806607,2025-04-24 21:15:07.897125,0 days 00:00:01.090518,absolute_error,11,log2,3,6,random,TPESampler,COMPLETE
2154,0.6456349183315407,2025-04-24 21:15:06.844815,2025-04-24 21:15:07.904352,0 days 00:00:01.059537,friedman_mse,31,sqrt,3,5,best,TPESampler,COMPLETE
2155,0.6180856799418332,2025-04-24 21:15:07.424729,2025-04-24 21:15:08.295320,0 days 00:00:00.870591,friedman_mse,28,sqrt,2,7,best,TPESampler,COMPLETE
2156,0.5191719425869716,2025-04-24 21:15:08.208975,2025-04-24 21:15:09.326910,0 days 00:00:01.117935,squared_error,29,sqrt,1,5,best,TPESampler,COMPLETE
2157,0.4962324084473796,2025-04-24 21:15:08.255818,2025-04-24 21:15:09.561793,0 days 00:00:01.305975,friedman_mse,29,sqrt,1,6,best,TPESampler,COMPLETE
2158,0.6858428787475002,2025-04-24 21:15:08.677937,2025-04-24 21:15:09.901262,0 days 00:00:01.223325,absolute_error,23,sqrt,7,5,best,TPESampler,COMPLETE
2159,0.5961660972686237,2025-04-24 21:15:09.567601,2025-04-24 21:15:10.566549,0 days 00:00:00.998948,friedman_mse,28,log2,1,4,best,TPESampler,COMPLETE
2160,0.5469433296825841,2025-04-24 21:15:09.773908,2025-04-24 21:15:10.714479,0 days 00:00:00.940571,friedman_mse,35,sqrt,1,3,best,TPESampler,COMPLETE
2161,0.6265479990281826,2025-04-24 21:15:10.191524,2025-04-24 21:15:11.023415,0 days 00:00:00.831891,friedman_mse,26,sqrt,2,2,best,TPESampler,COMPLETE
2162,0.5242942957596758,2025-04-24 21:15:10.931252,2025-04-24 21:15:11.963234,0 days 00:00:01.031982,friedman_mse,30,sqrt,1,11,best,TPESampler,COMPLETE
2163,0.5387126777455866,2025-04-24 21:15:10.986085,2025-04-24 21:15:12.103222,0 days 00:00:01.117137,friedman_mse,28,sqrt,1,10,best,TPESampler,COMPLETE
2164,0.8759556325474401,2025-04-24 21:15:11.281746,2025-04-24 21:15:12.305415,0 days 00:00:01.023669,squared_error,3,sqrt,2,11,best,TPESampler,COMPLETE
2165,0.6180856799418332,2025-04-24 21:15:12.248618,2025-04-24 21:15:13.415289,0 days 00:00:01.166671,friedman_mse,31,sqrt,2,7,best,TPESampler,COMPLETE
2166,0.5298778451782702,2025-04-24 21:15:12.482110,2025-04-24 21:15:13.642302,0 days 00:00:01.160192,friedman_mse,32,sqrt,1,7,best,TPESampler,COMPLETE
2167,0.5724846347554697,2025-04-24 21:15:12.754204,2025-04-24 21:15:13.743289,0 days 00:00:00.989085,friedman_mse,30,sqrt,1,7,best,TPESampler,COMPLETE
2168,0.6008739649566123,2025-04-24 21:15:13.679322,2025-04-24 21:15:14.542584,0 days 00:00:00.863262,friedman_mse,33,log2,1,6,best,TPESampler,COMPLETE
2169,0.5164242646936524,2025-04-24 21:15:13.919024,2025-04-24 21:15:15.013660,0 days 00:00:01.094636,friedman_mse,26,sqrt,1,3,best,TPESampler,COMPLETE
2170,0.5912941502828561,2025-04-24 21:15:14.099650,2025-04-24 21:15:15.216071,0 days 00:00:01.116421,friedman_mse,35,sqrt,1,5,best,TPESampler,COMPLETE
2171,0.6504215924944643,2025-04-24 21:15:14.944746,2025-04-24 21:15:15.726092,0 days 00:00:00.781346,friedman_mse,35,sqrt,3,8,best,TPESampler,COMPLETE
2172,0.679677768649462,2025-04-24 21:15:15.353181,2025-04-24 21:15:16.524190,0 days 00:00:01.171009,absolute_error,25,sqrt,6,19,best,TPESampler,COMPLETE
2173,0.5230033993372178,2025-04-24 21:15:15.503483,2025-04-24 21:15:16.525607,0 days 00:00:01.022124,squared_error,24,sqrt,1,7,best,TPESampler,COMPLETE
2174,0.6456349183315407,2025-04-24 21:15:16.079562,2025-04-24 21:15:16.819044,0 days 00:00:00.739482,friedman_mse,28,sqrt,3,3,best,TPESampler,COMPLETE
2175,0.6090448711076348,2025-04-24 21:15:16.782336,2025-04-24 21:15:18.064954,0 days 00:00:01.282618,absolute_error,31,sqrt,3,5,best,TPESampler,COMPLETE
2176,0.6180856799418332,2025-04-24 21:15:16.828154,2025-04-24 21:15:18.060683,0 days 00:00:01.232529,friedman_mse,27,sqrt,2,7,best,TPESampler,COMPLETE
2177,0.49783262823116015,2025-04-24 21:15:17.576089,2025-04-24 21:15:18.379827,0 days 00:00:00.803738,friedman_mse,31,sqrt,1,5,best,TPESampler,COMPLETE
2178,0.6289323974475082,2025-04-24 21:15:18.333106,2025-04-24 21:15:19.479954,0 days 00:00:01.146848,friedman_mse,22,sqrt,2,11,best,TPESampler,COMPLETE
2179,0.6456349183315407,2025-04-24 21:15:18.375145,2025-04-24 21:15:19.425637,0 days 00:00:01.050492,friedman_mse,35,sqrt,3,5,best,TPESampler,COMPLETE
2180,0.7176520799310836,2025-04-24 21:15:19.090117,2025-04-24 21:15:19.945042,0 days 00:00:00.854925,squared_error,20,sqrt,5,11,best,TPESampler,COMPLETE
2181,0.5020512557327408,2025-04-24 21:15:19.651047,2025-04-24 21:15:20.646815,0 days 00:00:00.995768,friedman_mse,30,sqrt,1,8,best,TPESampler,COMPLETE
2182,0.5011731735894601,2025-04-24 21:15:19.720059,2025-04-24 21:15:20.799494,0 days 00:00:01.079435,friedman_mse,33,sqrt,1,8,best,TPESampler,COMPLETE
2183,0.49476012163682015,2025-04-24 21:15:20.533647,2025-04-24 21:15:21.395810,0 days 00:00:00.862163,absolute_error,29,sqrt,1,5,best,TPESampler,COMPLETE
2184,0.5229942037417156,2025-04-24 21:15:20.987061,2025-04-24 21:15:21.882036,0 days 00:00:00.894975,friedman_mse,25,sqrt,1,4,best,TPESampler,COMPLETE
2185,0.7001426564128769,2025-04-24 21:15:21.024158,2025-04-24 21:15:22.288369,0 days 00:00:01.264211,squared_error,27,sqrt,10,15,best,TPESampler,COMPLETE
2186,0.6456349183315407,2025-04-24 21:15:21.817950,2025-04-24 21:15:22.717892,0 days 00:00:00.899942,friedman_mse,28,sqrt,3,5,best,TPESampler,COMPLETE
2187,0.6504215924944643,2025-04-24 21:15:22.297918,2025-04-24 21:15:23.336996,0 days 00:00:01.039078,friedman_mse,29,sqrt,3,9,best,TPESampler,COMPLETE
2188,0.5990263576042965,2025-04-24 21:15:22.567045,2025-04-24 21:15:23.534294,0 days 00:00:00.967249,friedman_mse,30,sqrt,3,6,random,TPESampler,COMPLETE
2189,0.6180856799418332,2025-04-24 21:15:22.992224,2025-04-24 21:15:23.939234,0 days 00:00:00.947010,squared_error,30,sqrt,2,7,best,TPESampler,COMPLETE
2190,0.47245231313348,2025-04-24 21:15:23.729134,2025-04-24 21:15:24.993464,0 days 00:00:01.264330,friedman_mse,30,sqrt,1,6,best,TPESampler,COMPLETE
2191,0.5868750603971733,2025-04-24 21:15:23.797176,2025-04-24 21:15:24.994970,0 days 00:00:01.197794,friedman_mse,35,sqrt,1,7,best,TPESampler,COMPLETE
2192,0.5479322564786873,2025-04-24 21:15:24.256430,2025-04-24 21:15:25.344291,0 days 00:00:01.087861,friedman_mse,35,sqrt,1,6,best,TPESampler,COMPLETE
2193,0.5230033993372178,2025-04-24 21:15:25.251423,2025-04-24 21:15:26.405157,0 days 00:00:01.153734,friedman_mse,24,sqrt,1,7,best,TPESampler,COMPLETE
2194,0.5378330558023339,2025-04-24 21:15:25.295588,2025-04-24 21:15:26.416867,0 days 00:00:01.121279,friedman_mse,27,sqrt,1,9,best,TPESampler,COMPLETE
2195,0.6265479990281826,2025-04-24 21:15:25.877419,2025-04-24 21:15:26.854384,0 days 00:00:00.976965,friedman_mse,30,sqrt,2,4,best,TPESampler,COMPLETE
2196,0.6289323974475082,2025-04-24 21:15:26.762357,2025-04-24 21:15:27.798523,0 days 00:00:01.036166,friedman_mse,31,sqrt,2,10,best,TPESampler,COMPLETE
2197,0.48333612106664076,2025-04-24 21:15:26.810564,2025-04-24 21:15:28.004355,0 days 00:00:01.193791,friedman_mse,31,sqrt,1,4,best,TPESampler,COMPLETE
2198,0.6456349183315407,2025-04-24 21:15:27.152561,2025-04-24 21:15:28.134658,0 days 00:00:00.982097,friedman_mse,27,sqrt,3,7,best,TPESampler,COMPLETE
2199,0.5129971695350808,2025-04-24 21:15:28.072200,2025-04-24 21:15:28.970595,0 days 00:00:00.898395,friedman_mse,30,sqrt,1,9,best,TPESampler,COMPLETE
2200,0.48333612106664076,2025-04-24 21:15:28.331207,2025-04-24 21:15:29.634892,0 days 00:00:01.303685,friedman_mse,31,sqrt,1,4,best,TPESampler,COMPLETE
2201,0.5623543669503079,2025-04-24 21:15:28.384923,2025-04-24 21:15:29.564465,0 days 00:00:01.179542,friedman_mse,30,sqrt,1,5,best,TPESampler,COMPLETE
2202,0.5839510310299822,2025-04-24 21:15:29.354422,2025-04-24 21:15:30.180452,0 days 00:00:00.826030,friedman_mse,32,log2,1,2,best,TPESampler,COMPLETE
2203,0.6180856799418332,2025-04-24 21:15:29.853249,2025-04-24 21:15:30.916764,0 days 00:00:01.063515,friedman_mse,31,sqrt,2,7,best,TPESampler,COMPLETE
2204,0.9015251732962958,2025-04-24 21:15:29.900664,2025-04-24 21:15:30.924945,0 days 00:00:01.024281,absolute_error,34,log2,7,19,best,TPESampler,COMPLETE
2205,0.4831415131013947,2025-04-24 21:15:30.521196,2025-04-24 21:15:31.435166,0 days 00:00:00.913970,friedman_mse,31,sqrt,1,8,best,TPESampler,COMPLETE
2206,0.500848998379332,2025-04-24 21:15:31.154230,2025-04-24 21:15:32.051307,0 days 00:00:00.897077,friedman_mse,30,sqrt,1,2,best,TPESampler,COMPLETE
2207,0.5529688132197964,2025-04-24 21:15:31.201125,2025-04-24 21:15:32.410774,0 days 00:00:01.209649,friedman_mse,35,sqrt,1,2,best,TPESampler,COMPLETE
2208,0.6265479990281826,2025-04-24 21:15:31.756606,2025-04-24 21:15:32.671481,0 days 00:00:00.914875,friedman_mse,35,sqrt,2,2,best,TPESampler,COMPLETE
2209,0.5435622016360893,2025-04-24 21:15:32.336500,2025-04-24 21:15:33.217996,0 days 00:00:00.881496,friedman_mse,27,sqrt,1,7,best,TPESampler,COMPLETE
2210,0.6456349183315407,2025-04-24 21:15:32.797755,2025-04-24 21:15:33.962374,0 days 00:00:01.164619,squared_error,30,sqrt,3,5,best,TPESampler,COMPLETE
2211,0.6456349183315407,2025-04-24 21:15:32.895136,2025-04-24 21:15:34.150347,0 days 00:00:01.255211,friedman_mse,29,sqrt,3,7,best,TPESampler,COMPLETE
2212,0.6289323974475082,2025-04-24 21:15:33.805557,2025-04-24 21:15:35.063541,0 days 00:00:01.257984,friedman_mse,35,sqrt,2,10,best,TPESampler,COMPLETE
2213,0.792892304699157,2025-04-24 21:15:34.344656,2025-04-24 21:15:35.393884,0 days 00:00:01.049228,absolute_error,8,sqrt,3,15,best,TPESampler,COMPLETE
2214,0.6112159876046143,2025-04-24 21:15:34.538225,2025-04-24 21:15:35.889560,0 days 00:00:01.351335,absolute_error,24,sqrt,3,8,best,TPESampler,COMPLETE
2215,0.4841824780964295,2025-04-24 21:15:35.345213,2025-04-24 21:15:36.157803,0 days 00:00:00.812590,friedman_mse,25,sqrt,1,5,best,TPESampler,COMPLETE
2216,0.5339224783480143,2025-04-24 21:15:35.812598,2025-04-24 21:15:36.750141,0 days 00:00:00.937543,friedman_mse,35,sqrt,1,8,best,TPESampler,COMPLETE
2217,0.6456349183315407,2025-04-24 21:15:36.230032,2025-04-24 21:15:37.288813,0 days 00:00:01.058781,friedman_mse,31,sqrt,3,7,best,TPESampler,COMPLETE
2218,0.49912878166750996,2025-04-24 21:15:36.435900,2025-04-24 21:15:37.856997,0 days 00:00:01.421097,friedman_mse,28,sqrt,1,7,best,TPESampler,COMPLETE
2219,0.47245231313348,2025-04-24 21:15:37.224844,2025-04-24 21:15:38.197438,0 days 00:00:00.972594,friedman_mse,30,sqrt,1,6,best,TPESampler,COMPLETE
2220,0.8850110526457134,2025-04-24 21:15:37.613374,2025-04-24 21:15:38.651399,0 days 00:00:01.038025,absolute_error,2,sqrt,1,2,random,TPESampler,COMPLETE
2221,0.74349522764793,2025-04-24 21:15:38.301322,2025-04-24 21:15:39.309309,0 days 00:00:01.007987,squared_error,28,log2,3,2,best,TPESampler,COMPLETE
2222,0.8786486450005158,2025-04-24 21:15:38.539690,2025-04-24 21:15:39.589297,0 days 00:00:01.049607,squared_error,11,log2,4,10,random,TPESampler,COMPLETE
2223,0.6456349183315407,2025-04-24 21:15:38.933377,2025-04-24 21:15:40.014125,0 days 00:00:01.080748,friedman_mse,31,sqrt,3,5,best,TPESampler,COMPLETE
2224,0.48921668337565616,2025-04-24 21:15:39.639312,2025-04-24 21:15:40.686978,0 days 00:00:01.047666,friedman_mse,32,sqrt,1,6,best,TPESampler,COMPLETE
2225,0.5188980906380585,2025-04-24 21:15:39.899195,2025-04-24 21:15:40.928569,0 days 00:00:01.029374,friedman_mse,30,sqrt,1,12,best,TPESampler,COMPLETE
2226,0.6515872609760095,2025-04-24 21:15:40.310558,2025-04-24 21:15:41.215683,0 days 00:00:00.905125,friedman_mse,35,sqrt,2,6,best,TPESampler,COMPLETE
2227,0.8606532689475727,2025-04-24 21:15:41.033820,2025-04-24 21:15:41.884350,0 days 00:00:00.850530,squared_error,10,log2,3,16,best,TPESampler,COMPLETE
2228,0.5327880009702136,2025-04-24 21:15:41.211713,2025-04-24 21:15:42.405923,0 days 00:00:01.194210,friedman_mse,26,sqrt,1,9,best,TPESampler,COMPLETE
2229,0.6289323974475082,2025-04-24 21:15:41.490300,2025-04-24 21:15:42.520898,0 days 00:00:01.030598,friedman_mse,22,sqrt,2,9,best,TPESampler,COMPLETE
2230,0.6456349183315407,2025-04-24 21:15:42.219883,2025-04-24 21:15:43.245709,0 days 00:00:01.025826,friedman_mse,27,sqrt,3,3,best,TPESampler,COMPLETE
2231,0.5137879318052204,2025-04-24 21:15:42.658233,2025-04-24 21:15:43.719846,0 days 00:00:01.061613,friedman_mse,35,sqrt,1,10,best,TPESampler,COMPLETE
2232,0.5912941502828561,2025-04-24 21:15:42.779629,2025-04-24 21:15:43.799948,0 days 00:00:01.020319,friedman_mse,35,sqrt,1,5,best,TPESampler,COMPLETE
2233,0.49912878166750996,2025-04-24 21:15:43.518014,2025-04-24 21:15:44.391250,0 days 00:00:00.873236,friedman_mse,28,sqrt,1,7,best,TPESampler,COMPLETE
2234,0.5623543669503079,2025-04-24 21:15:43.977010,2025-04-24 21:15:45.048772,0 days 00:00:01.071762,friedman_mse,30,sqrt,1,5,best,TPESampler,COMPLETE
2235,0.5975832321496914,2025-04-24 21:15:44.022889,2025-04-24 21:15:45.146958,0 days 00:00:01.124069,friedman_mse,29,sqrt,2,5,best,TPESampler,COMPLETE
2236,0.6456349183315407,2025-04-24 21:15:44.676258,2025-04-24 21:15:45.487463,0 days 00:00:00.811205,friedman_mse,35,sqrt,3,6,best,TPESampler,COMPLETE
2237,0.5253868360947686,2025-04-24 21:15:45.435210,2025-04-24 21:15:46.356641,0 days 00:00:00.921431,friedman_mse,27,sqrt,1,4,best,TPESampler,COMPLETE
2238,0.6873561886360321,2025-04-24 21:15:45.491788,2025-04-24 21:15:46.542624,0 days 00:00:01.050836,friedman_mse,24,log2,1,7,best,TPESampler,COMPLETE
2239,0.6456349183315407,2025-04-24 21:15:46.016460,2025-04-24 21:15:47.418644,0 days 00:00:01.402184,friedman_mse,22,sqrt,3,6,best,TPESampler,COMPLETE
2240,0.6289323974475082,2025-04-24 21:15:46.738901,2025-04-24 21:15:47.896750,0 days 00:00:01.157849,friedman_mse,31,sqrt,2,9,best,TPESampler,COMPLETE
2241,0.4831415131013947,2025-04-24 21:15:46.795121,2025-04-24 21:15:47.889188,0 days 00:00:01.094067,friedman_mse,31,sqrt,1,8,best,TPESampler,COMPLETE
2242,0.6265479990281826,2025-04-24 21:15:47.685959,2025-04-24 21:15:48.417993,0 days 00:00:00.732034,friedman_mse,31,sqrt,2,4,best,TPESampler,COMPLETE
2243,0.8736249690276993,2025-04-24 21:15:48.164013,2025-04-24 21:15:49.197616,0 days 00:00:01.033603,friedman_mse,5,sqrt,1,7,best,TPESampler,COMPLETE
2244,0.6456349183315407,2025-04-24 21:15:48.208357,2025-04-24 21:15:49.191599,0 days 00:00:00.983242,squared_error,35,sqrt,3,7,best,TPESampler,COMPLETE
2245,0.6504215924944643,2025-04-24 21:15:48.762467,2025-04-24 21:15:49.580895,0 days 00:00:00.818428,friedman_mse,30,sqrt,3,11,best,TPESampler,COMPLETE
2246,0.49783262823116015,2025-04-24 21:15:49.534556,2025-04-24 21:15:50.658234,0 days 00:00:01.123678,friedman_mse,31,sqrt,1,5,best,TPESampler,COMPLETE
2247,0.5157610196982807,2025-04-24 21:15:49.574065,2025-04-24 21:15:50.688617,0 days 00:00:01.114552,friedman_mse,26,sqrt,1,7,best,TPESampler,COMPLETE
2248,0.5202466614878716,2025-04-24 21:15:50.258980,2025-04-24 21:15:51.028679,0 days 00:00:00.769699,friedman_mse,29,sqrt,1,7,best,TPESampler,COMPLETE
2249,0.8882159335097272,2025-04-24 21:15:51.006503,2025-04-24 21:15:52.382793,0 days 00:00:01.376290,friedman_mse,2,sqrt,3,18,random,TPESampler,COMPLETE
2250,0.8896433936219947,2025-04-24 21:15:51.026659,2025-04-24 21:15:52.495767,0 days 00:00:01.469108,squared_error,4,log2,5,20,best,TPESampler,COMPLETE
2251,0.4962324084473796,2025-04-24 21:15:52.099720,2025-04-24 21:15:53.017833,0 days 00:00:00.918113,squared_error,29,sqrt,1,6,best,TPESampler,COMPLETE
2252,0.5912941502828561,2025-04-24 21:15:52.647981,2025-04-24 21:15:53.873687,0 days 00:00:01.225706,friedman_mse,35,sqrt,1,5,best,TPESampler,COMPLETE
2253,0.6456349183315407,2025-04-24 21:15:52.695538,2025-04-24 21:15:53.880572,0 days 00:00:01.185034,friedman_mse,29,sqrt,3,7,best,TPESampler,COMPLETE
2254,0.49068441274037305,2025-04-24 21:15:53.548336,2025-04-24 21:15:54.467777,0 days 00:00:00.919441,friedman_mse,31,sqrt,1,6,best,TPESampler,COMPLETE
2255,0.8236588483287415,2025-04-24 21:15:54.136747,2025-04-24 21:15:55.238076,0 days 00:00:01.101329,friedman_mse,8,sqrt,4,12,best,TPESampler,COMPLETE
2256,0.5868750603971733,2025-04-24 21:15:54.181939,2025-04-24 21:15:55.414958,0 days 00:00:01.233019,friedman_mse,35,sqrt,1,7,best,TPESampler,COMPLETE
2257,0.5164242646936524,2025-04-24 21:15:54.870066,2025-04-24 21:15:55.743713,0 days 00:00:00.873647,friedman_mse,26,sqrt,1,3,best,TPESampler,COMPLETE
2258,0.6954076577953107,2025-04-24 21:15:55.631430,2025-04-24 21:15:56.782436,0 days 00:00:01.151006,absolute_error,26,sqrt,1,5,random,TPESampler,COMPLETE
2259,0.551686579116738,2025-04-24 21:15:55.703273,2025-04-24 21:15:56.900210,0 days 00:00:01.196937,friedman_mse,25,sqrt,1,10,best,TPESampler,COMPLETE
2260,0.7191631327590201,2025-04-24 21:15:56.023579,2025-04-24 21:15:57.260353,0 days 00:00:01.236774,friedman_mse,31,log2,2,8,best,TPESampler,COMPLETE
2261,0.4831415131013947,2025-04-24 21:15:57.166602,2025-04-24 21:15:58.338498,0 days 00:00:01.171896,friedman_mse,31,sqrt,1,8,best,TPESampler,COMPLETE
2262,0.5503039019834799,2025-04-24 21:15:57.214723,2025-04-24 21:15:58.249845,0 days 00:00:01.035122,squared_error,28,sqrt,1,3,best,TPESampler,COMPLETE
2263,0.6456349183315407,2025-04-24 21:15:57.575853,2025-04-24 21:15:58.629081,0 days 00:00:01.053228,friedman_mse,31,sqrt,3,4,best,TPESampler,COMPLETE
2264,0.6456349183315407,2025-04-24 21:15:58.568672,2025-04-24 21:15:59.576453,0 days 00:00:01.007781,friedman_mse,29,sqrt,3,7,best,TPESampler,COMPLETE
2265,0.6456349183315407,2025-04-24 21:15:58.661181,2025-04-24 21:16:00.204176,0 days 00:00:01.542995,friedman_mse,35,sqrt,3,7,best,TPESampler,COMPLETE
2266,0.4841824780964295,2025-04-24 21:15:59.010810,2025-04-24 21:16:00.197558,0 days 00:00:01.186748,friedman_mse,25,sqrt,1,5,best,TPESampler,COMPLETE
2267,0.5517493393728706,2025-04-24 21:15:59.914335,2025-04-24 21:16:00.743556,0 days 00:00:00.829221,friedman_mse,35,sqrt,1,4,best,TPESampler,COMPLETE
2268,0.5339224783480143,2025-04-24 21:16:00.415365,2025-04-24 21:16:01.639219,0 days 00:00:01.223854,friedman_mse,35,sqrt,1,8,best,TPESampler,COMPLETE
2269,0.6289323974475082,2025-04-24 21:16:00.466805,2025-04-24 21:16:01.754158,0 days 00:00:01.287353,friedman_mse,30,sqrt,2,9,best,TPESampler,COMPLETE
2270,0.5640872207266376,2025-04-24 21:16:01.263109,2025-04-24 21:16:02.234438,0 days 00:00:00.971329,friedman_mse,28,sqrt,1,2,best,TPESampler,COMPLETE
2271,0.9015251732962958,2025-04-24 21:16:01.951384,2025-04-24 21:16:02.922411,0 days 00:00:00.971027,absolute_error,13,log2,9,3,best,TPESampler,COMPLETE
2272,0.5114477233942855,2025-04-24 21:16:01.994839,2025-04-24 21:16:03.147175,0 days 00:00:01.152336,friedman_mse,28,sqrt,1,8,best,TPESampler,COMPLETE
2273,0.5185211704314117,2025-04-24 21:16:02.561904,2025-04-24 21:16:03.429258,0 days 00:00:00.867354,friedman_mse,30,sqrt,1,10,best,TPESampler,COMPLETE
2274,0.6315299012837583,2025-04-24 21:16:03.345358,2025-04-24 21:16:04.407504,0 days 00:00:01.062146,friedman_mse,26,sqrt,1,9,random,TPESampler,COMPLETE
2275,0.878930627702796,2025-04-24 21:16:03.388866,2025-04-24 21:16:04.381320,0 days 00:00:00.992454,squared_error,32,log2,7,19,random,TPESampler,COMPLETE
2276,0.5975832321496914,2025-04-24 21:16:04.141348,2025-04-24 21:16:05.070759,0 days 00:00:00.929411,friedman_mse,31,sqrt,2,5,best,TPESampler,COMPLETE
2277,0.5298778451782702,2025-04-24 21:16:04.674857,2025-04-24 21:16:05.772003,0 days 00:00:01.097146,squared_error,32,sqrt,1,7,best,TPESampler,COMPLETE
2278,0.6515872609760095,2025-04-24 21:16:04.761997,2025-04-24 21:16:05.965661,0 days 00:00:01.203664,friedman_mse,24,sqrt,2,6,best,TPESampler,COMPLETE
2279,0.4868744820818364,2025-04-24 21:16:05.391206,2025-04-24 21:16:06.407423,0 days 00:00:01.016217,friedman_mse,27,sqrt,1,6,best,TPESampler,COMPLETE
2280,0.48333612106664076,2025-04-24 21:16:06.186360,2025-04-24 21:16:07.372952,0 days 00:00:01.186592,friedman_mse,31,sqrt,1,4,best,TPESampler,COMPLETE
2281,0.8786486450005158,2025-04-24 21:16:06.236073,2025-04-24 21:16:07.465493,0 days 00:00:01.229420,squared_error,20,log2,4,20,random,TPESampler,COMPLETE
2282,0.5202466614878716,2025-04-24 21:16:06.870529,2025-04-24 21:16:07.794569,0 days 00:00:00.924040,friedman_mse,29,sqrt,1,7,best,TPESampler,COMPLETE
2283,0.6215686330393853,2025-04-24 21:16:07.703162,2025-04-24 21:16:09.048554,0 days 00:00:01.345392,friedman_mse,29,sqrt,1,5,random,TPESampler,COMPLETE
2284,0.6456349183315407,2025-04-24 21:16:07.758928,2025-04-24 21:16:08.961499,0 days 00:00:01.202571,friedman_mse,31,sqrt,3,2,best,TPESampler,COMPLETE
2285,0.5479322564786873,2025-04-24 21:16:08.063430,2025-04-24 21:16:09.368068,0 days 00:00:01.304638,friedman_mse,35,sqrt,1,6,best,TPESampler,COMPLETE
2286,0.6504215924944643,2025-04-24 21:16:09.282124,2025-04-24 21:16:10.354547,0 days 00:00:01.072423,friedman_mse,31,sqrt,3,8,best,TPESampler,COMPLETE
2287,0.5103041358943772,2025-04-24 21:16:09.331612,2025-04-24 21:16:10.294032,0 days 00:00:00.962420,friedman_mse,31,sqrt,1,9,best,TPESampler,COMPLETE
2288,0.6456349183315407,2025-04-24 21:16:09.665490,2025-04-24 21:16:10.669828,0 days 00:00:01.004338,friedman_mse,31,sqrt,3,7,best,TPESampler,COMPLETE
2289,0.5724846347554697,2025-04-24 21:16:10.619450,2025-04-24 21:16:11.406071,0 days 00:00:00.786621,friedman_mse,30,sqrt,1,7,best,TPESampler,COMPLETE
