number,value,datetime_start,datetime_complete,duration,params_criterion,params_max_depth,params_max_features,params_min_samples_leaf,params_min_samples_split,params_splitter,system_attrs_auto:sampler,state
859,0.6194853816763535,2025-04-24 21:05:54.972635,2025-04-24 21:05:56.240771,0 days 00:00:01.268136,friedman_mse,26,sqrt,2,8,best,TPESampler,COMPLETE
860,0.5191719425869716,2025-04-24 21:05:55.633137,2025-04-24 21:05:56.411943,0 days 00:00:00.778806,friedman_mse,29,sqrt,1,5,best,TPESampler,COMPLETE
861,0.6456349183315407,2025-04-24 21:05:55.744732,2025-04-24 21:05:56.564130,0 days 00:00:00.819398,friedman_mse,24,sqrt,3,4,best,TPESampler,COMPLETE
862,0.5182225565736444,2025-04-24 21:05:56.503264,2025-04-24 21:05:57.208431,0 days 00:00:00.705167,friedman_mse,29,sqrt,1,3,best,TPESampler,COMPLETE
863,0.7479967321897958,2025-04-24 21:05:56.735275,2025-04-24 21:05:57.539468,0 days 00:00:00.804193,absolute_error,25,log2,4,20,best,TPESampler,COMPLETE
864,0.49100091803166096,2025-04-24 21:05:56.940391,2025-04-24 21:05:57.896581,0 days 00:00:00.956190,friedman_mse,32,sqrt,1,8,best,TPESampler,COMPLETE
865,0.5859089511299568,2025-04-24 21:05:57.581550,2025-04-24 21:05:58.508299,0 days 00:00:00.926749,absolute_error,23,sqrt,3,5,best,TPESampler,COMPLETE
866,0.721140069252719,2025-04-24 21:05:57.903807,2025-04-24 21:05:58.778507,0 days 00:00:00.874700,squared_error,14,sqrt,2,17,random,TPESampler,COMPLETE
867,0.5364579699886214,2025-04-24 21:05:58.275036,2025-04-24 21:05:59.303838,0 days 00:00:01.028802,friedman_mse,25,sqrt,1,7,best,TPESampler,COMPLETE
868,0.565032535793402,2025-04-24 21:05:58.772566,2025-04-24 21:05:59.487542,0 days 00:00:00.714976,squared_error,32,sqrt,1,9,best,TPESampler,COMPLETE
869,0.5627285214658189,2025-04-24 21:05:59.046857,2025-04-24 21:05:59.787828,0 days 00:00:00.740971,friedman_mse,35,sqrt,1,13,best,TPESampler,COMPLETE
870,0.5975832321496914,2025-04-24 21:05:59.617637,2025-04-24 21:06:00.416552,0 days 00:00:00.798915,friedman_mse,31,sqrt,2,5,best,TPESampler,COMPLETE
871,0.6456349183315407,2025-04-24 21:05:59.741459,2025-04-24 21:06:00.965483,0 days 00:00:01.224024,friedman_mse,35,sqrt,3,5,best,TPESampler,COMPLETE
872,0.582440877251572,2025-04-24 21:06:00.051632,2025-04-24 21:06:01.159637,0 days 00:00:01.108005,squared_error,35,log2,1,7,best,TPESampler,COMPLETE
873,0.5349543318974846,2025-04-24 21:06:00.781937,2025-04-24 21:06:01.572574,0 days 00:00:00.790637,absolute_error,24,sqrt,1,2,best,TPESampler,COMPLETE
874,0.8787156952958592,2025-04-24 21:06:01.251498,2025-04-24 21:06:02.108940,0 days 00:00:00.857442,squared_error,2,log2,4,2,random,TPESampler,COMPLETE
875,0.7688466480043374,2025-04-24 21:06:01.455751,2025-04-24 21:06:02.291883,0 days 00:00:00.836132,squared_error,17,sqrt,5,5,random,TPESampler,COMPLETE
876,0.49068441274037305,2025-04-24 21:06:01.797261,2025-04-24 21:06:02.662347,0 days 00:00:00.865086,friedman_mse,31,sqrt,1,6,best,TPESampler,COMPLETE
877,0.500848998379332,2025-04-24 21:06:02.364487,2025-04-24 21:06:03.314433,0 days 00:00:00.949946,friedman_mse,30,sqrt,1,2,best,TPESampler,COMPLETE
878,0.5484487660981547,2025-04-24 21:06:02.597696,2025-04-24 21:06:03.455538,0 days 00:00:00.857842,absolute_error,33,sqrt,1,2,best,TPESampler,COMPLETE
879,0.7204844492863453,2025-04-24 21:06:02.919207,2025-04-24 21:06:03.728443,0 days 00:00:00.809236,squared_error,30,sqrt,5,17,best,TPESampler,COMPLETE
880,0.6456349183315407,2025-04-24 21:06:03.617034,2025-04-24 21:06:04.641549,0 days 00:00:01.024515,squared_error,27,sqrt,3,4,best,TPESampler,COMPLETE
881,0.5233735064493952,2025-04-24 21:06:03.688923,2025-04-24 21:06:04.928027,0 days 00:00:01.239104,friedman_mse,27,sqrt,1,8,best,TPESampler,COMPLETE
882,0.6504215924944643,2025-04-24 21:06:03.996007,2025-04-24 21:06:05.010764,0 days 00:00:01.014757,friedman_mse,27,sqrt,3,9,best,TPESampler,COMPLETE
883,0.8737590921917946,2025-04-24 21:06:04.947464,2025-04-24 21:06:05.682319,0 days 00:00:00.734855,squared_error,18,sqrt,9,18,random,TPESampler,COMPLETE
884,0.5906416501991485,2025-04-24 21:06:05.162525,2025-04-24 21:06:06.201622,0 days 00:00:01.039097,friedman_mse,33,sqrt,1,10,random,TPESampler,COMPLETE
885,0.6456349183315407,2025-04-24 21:06:05.218828,2025-04-24 21:06:05.975938,0 days 00:00:00.757110,friedman_mse,31,sqrt,3,2,best,TPESampler,COMPLETE
886,0.7751713454417847,2025-04-24 21:06:05.981655,2025-04-24 21:06:06.947643,0 days 00:00:00.965988,friedman_mse,8,sqrt,2,10,random,TPESampler,COMPLETE
887,0.5364518982459593,2025-04-24 21:06:06.451612,2025-04-24 21:06:07.632690,0 days 00:00:01.181078,friedman_mse,24,sqrt,1,5,best,TPESampler,COMPLETE
888,0.5253868360947686,2025-04-24 21:06:06.762558,2025-04-24 21:06:07.850448,0 days 00:00:01.087890,friedman_mse,27,sqrt,1,4,best,TPESampler,COMPLETE
889,0.6180856799418332,2025-04-24 21:06:07.325511,2025-04-24 21:06:08.203945,0 days 00:00:00.878434,friedman_mse,35,sqrt,2,7,best,TPESampler,COMPLETE
890,0.9016215139057422,2025-04-24 21:06:07.915070,2025-04-24 21:06:08.766798,0 days 00:00:00.851728,absolute_error,23,log2,10,11,random,TPESampler,COMPLETE
891,0.5262906297733717,2025-04-24 21:06:08.161719,2025-04-24 21:06:09.115659,0 days 00:00:00.953940,friedman_mse,34,sqrt,1,5,best,TPESampler,COMPLETE
892,0.47983015285862346,2025-04-24 21:06:08.444761,2025-04-24 21:06:09.333589,0 days 00:00:00.888828,friedman_mse,28,sqrt,1,6,best,TPESampler,COMPLETE
893,0.5623543669503079,2025-04-24 21:06:09.061551,2025-04-24 21:06:09.753127,0 days 00:00:00.691576,friedman_mse,30,sqrt,1,5,best,TPESampler,COMPLETE
894,0.5378330558023339,2025-04-24 21:06:09.453605,2025-04-24 21:06:10.284690,0 days 00:00:00.831085,friedman_mse,27,sqrt,1,9,best,TPESampler,COMPLETE
895,0.6515872609760095,2025-04-24 21:06:09.616615,2025-04-24 21:06:10.459480,0 days 00:00:00.842865,friedman_mse,22,sqrt,2,6,best,TPESampler,COMPLETE
896,0.49912878166750996,2025-04-24 21:06:10.011033,2025-04-24 21:06:10.829458,0 days 00:00:00.818425,friedman_mse,28,sqrt,1,7,best,TPESampler,COMPLETE
897,0.6456349183315407,2025-04-24 21:06:10.516605,2025-04-24 21:06:11.289021,0 days 00:00:00.772416,friedman_mse,27,sqrt,3,5,best,TPESampler,COMPLETE
898,0.6515872609760095,2025-04-24 21:06:10.719164,2025-04-24 21:06:11.600127,0 days 00:00:00.880963,friedman_mse,24,sqrt,2,6,best,TPESampler,COMPLETE
899,0.5780937309636404,2025-04-24 21:06:11.137238,2025-04-24 21:06:12.065861,0 days 00:00:00.928623,friedman_mse,23,sqrt,1,2,best,TPESampler,COMPLETE
900,0.6456349183315407,2025-04-24 21:06:11.562795,2025-04-24 21:06:12.461252,0 days 00:00:00.898457,friedman_mse,30,sqrt,3,7,best,TPESampler,COMPLETE
901,0.5191719425869716,2025-04-24 21:06:11.882296,2025-04-24 21:06:12.693130,0 days 00:00:00.810834,friedman_mse,29,sqrt,1,5,best,TPESampler,COMPLETE
902,0.5364518982459593,2025-04-24 21:06:12.405708,2025-04-24 21:06:13.165548,0 days 00:00:00.759840,friedman_mse,24,sqrt,1,5,best,TPESampler,COMPLETE
903,0.5912941502828561,2025-04-24 21:06:12.701858,2025-04-24 21:06:13.505372,0 days 00:00:00.803514,friedman_mse,35,sqrt,1,5,best,TPESampler,COMPLETE
904,0.5011482218769929,2025-04-24 21:06:13.025429,2025-04-24 21:06:14.046776,0 days 00:00:01.021347,friedman_mse,25,sqrt,1,8,best,TPESampler,COMPLETE
905,0.6456349183315407,2025-04-24 21:06:13.503678,2025-04-24 21:06:14.316845,0 days 00:00:00.813167,friedman_mse,28,sqrt,3,4,best,TPESampler,COMPLETE
906,0.6456349183315407,2025-04-24 21:06:13.797509,2025-04-24 21:06:14.552323,0 days 00:00:00.754814,friedman_mse,28,sqrt,3,4,best,TPESampler,COMPLETE
907,0.4962324084473796,2025-04-24 21:06:14.358886,2025-04-24 21:06:15.362273,0 days 00:00:01.003387,friedman_mse,29,sqrt,1,6,best,TPESampler,COMPLETE
908,0.5289073941272342,2025-04-24 21:06:14.575118,2025-04-24 21:06:15.688325,0 days 00:00:01.113207,friedman_mse,31,sqrt,1,10,best,TPESampler,COMPLETE
909,0.5623543669503079,2025-04-24 21:06:15.192982,2025-04-24 21:06:16.189017,0 days 00:00:00.996035,friedman_mse,30,sqrt,1,5,best,TPESampler,COMPLETE
910,0.5164170552722069,2025-04-24 21:06:15.635171,2025-04-24 21:06:16.383267,0 days 00:00:00.748096,friedman_mse,29,sqrt,1,8,best,TPESampler,COMPLETE
911,0.5202466614878716,2025-04-24 21:06:15.954321,2025-04-24 21:06:16.769379,0 days 00:00:00.815058,squared_error,29,sqrt,1,7,best,TPESampler,COMPLETE
912,0.5469433296825841,2025-04-24 21:06:16.466285,2025-04-24 21:06:17.233186,0 days 00:00:00.766901,friedman_mse,35,sqrt,1,3,best,TPESampler,COMPLETE
913,0.7195854047999368,2025-04-24 21:06:16.640433,2025-04-24 21:06:17.558610,0 days 00:00:00.918177,absolute_error,20,log2,2,2,best,TPESampler,COMPLETE
914,0.5229942037417156,2025-04-24 21:06:17.072672,2025-04-24 21:06:18.034505,0 days 00:00:00.961833,friedman_mse,25,sqrt,1,4,best,TPESampler,COMPLETE
915,0.500848998379332,2025-04-24 21:06:17.557205,2025-04-24 21:06:18.584615,0 days 00:00:01.027410,friedman_mse,30,sqrt,1,2,best,TPESampler,COMPLETE
916,0.6289323974475082,2025-04-24 21:06:17.994154,2025-04-24 21:06:18.757550,0 days 00:00:00.763396,friedman_mse,34,sqrt,2,9,best,TPESampler,COMPLETE
917,0.5975832321496914,2025-04-24 21:06:18.281346,2025-04-24 21:06:19.079915,0 days 00:00:00.798569,friedman_mse,30,sqrt,2,5,best,TPESampler,COMPLETE
918,0.5627153549336387,2025-04-24 21:06:18.817224,2025-04-24 21:06:19.943507,0 days 00:00:01.126283,friedman_mse,33,log2,1,5,best,TPESampler,COMPLETE
919,0.6504215924944643,2025-04-24 21:06:19.022587,2025-04-24 21:06:19.905313,0 days 00:00:00.882726,friedman_mse,25,sqrt,3,8,best,TPESampler,COMPLETE
920,0.5724846347554697,2025-04-24 21:06:19.288094,2025-04-24 21:06:20.211608,0 days 00:00:00.923514,friedman_mse,30,sqrt,1,7,best,TPESampler,COMPLETE
921,0.5364518982459593,2025-04-24 21:06:20.160507,2025-04-24 21:06:21.044862,0 days 00:00:00.884355,friedman_mse,24,sqrt,1,5,best,TPESampler,COMPLETE
922,0.6782015487378421,2025-04-24 21:06:20.198034,2025-04-24 21:06:21.125622,0 days 00:00:00.927588,absolute_error,29,sqrt,1,2,random,TPESampler,COMPLETE
923,0.5669493989992861,2025-04-24 21:06:20.887098,2025-04-24 21:06:21.655625,0 days 00:00:00.768527,friedman_mse,33,sqrt,1,5,best,TPESampler,COMPLETE
924,0.5137295393660822,2025-04-24 21:06:21.268752,2025-04-24 21:06:22.316410,0 days 00:00:01.047658,friedman_mse,24,sqrt,1,8,best,TPESampler,COMPLETE
925,0.5435622016360893,2025-04-24 21:06:21.352039,2025-04-24 21:06:22.314946,0 days 00:00:00.962907,friedman_mse,27,sqrt,1,7,best,TPESampler,COMPLETE
926,0.5724846347554697,2025-04-24 21:06:21.897644,2025-04-24 21:06:22.632157,0 days 00:00:00.734513,friedman_mse,30,sqrt,1,7,best,TPESampler,COMPLETE
927,0.6456349183315407,2025-04-24 21:06:22.560797,2025-04-24 21:06:23.444489,0 days 00:00:00.883692,friedman_mse,35,sqrt,3,2,best,TPESampler,COMPLETE
928,0.7769416155879757,2025-04-24 21:06:22.598020,2025-04-24 21:06:23.495454,0 days 00:00:00.897434,absolute_error,17,sqrt,1,6,random,TPESampler,COMPLETE
929,0.6456349183315407,2025-04-24 21:06:23.267328,2025-04-24 21:06:23.918021,0 days 00:00:00.650693,friedman_mse,30,sqrt,3,7,best,TPESampler,COMPLETE
930,0.5868750603971733,2025-04-24 21:06:23.663265,2025-04-24 21:06:24.497200,0 days 00:00:00.833935,squared_error,35,sqrt,1,7,best,TPESampler,COMPLETE
931,0.5064102821977916,2025-04-24 21:06:23.729951,2025-04-24 21:06:24.635100,0 days 00:00:00.905149,friedman_mse,27,sqrt,1,2,best,TPESampler,COMPLETE
932,0.47692047149238787,2025-04-24 21:06:24.159693,2025-04-24 21:06:24.963623,0 days 00:00:00.803930,friedman_mse,27,sqrt,1,3,best,TPESampler,COMPLETE
933,0.6265479990281826,2025-04-24 21:06:24.840359,2025-04-24 21:06:25.760262,0 days 00:00:00.919903,friedman_mse,19,sqrt,2,3,best,TPESampler,COMPLETE
934,0.5546449879220828,2025-04-24 21:06:24.902683,2025-04-24 21:06:25.761606,0 days 00:00:00.858923,friedman_mse,24,sqrt,1,2,best,TPESampler,COMPLETE
935,0.9018784399194749,2025-04-24 21:06:25.397535,2025-04-24 21:06:26.143160,0 days 00:00:00.745625,squared_error,31,log2,10,8,random,TPESampler,COMPLETE
936,0.90157797490464,2025-04-24 21:06:26.013317,2025-04-24 21:06:26.976805,0 days 00:00:00.963488,squared_error,15,log2,8,9,best,TPESampler,COMPLETE
937,0.6456349183315407,2025-04-24 21:06:26.101319,2025-04-24 21:06:27.160058,0 days 00:00:01.058739,friedman_mse,23,sqrt,3,3,best,TPESampler,COMPLETE
938,0.6456349183315407,2025-04-24 21:06:26.388770,2025-04-24 21:06:27.305236,0 days 00:00:00.916466,friedman_mse,28,sqrt,3,2,best,TPESampler,COMPLETE
939,0.5253868360947686,2025-04-24 21:06:27.220265,2025-04-24 21:06:27.904980,0 days 00:00:00.684715,friedman_mse,27,sqrt,1,4,best,TPESampler,COMPLETE
940,0.7001426564128769,2025-04-24 21:06:27.417516,2025-04-24 21:06:28.202764,0 days 00:00:00.785248,friedman_mse,18,sqrt,10,4,best,TPESampler,COMPLETE
941,0.47692047149238787,2025-04-24 21:06:27.782264,2025-04-24 21:06:28.630421,0 days 00:00:00.848157,friedman_mse,27,sqrt,1,3,best,TPESampler,COMPLETE
942,0.613762896169531,2025-04-24 21:06:28.167869,2025-04-24 21:06:28.982581,0 days 00:00:00.814712,friedman_mse,25,log2,1,5,best,TPESampler,COMPLETE
943,0.6265479990281826,2025-04-24 21:06:28.455146,2025-04-24 21:06:29.295751,0 days 00:00:00.840605,friedman_mse,27,sqrt,2,2,best,TPESampler,COMPLETE
944,0.6265479990281826,2025-04-24 21:06:28.920824,2025-04-24 21:06:29.713278,0 days 00:00:00.792454,friedman_mse,21,sqrt,2,4,best,TPESampler,COMPLETE
945,0.6265479990281826,2025-04-24 21:06:29.240934,2025-04-24 21:06:30.015230,0 days 00:00:00.774296,friedman_mse,26,sqrt,2,2,best,TPESampler,COMPLETE
946,0.6265479990281826,2025-04-24 21:06:29.535520,2025-04-24 21:06:30.549720,0 days 00:00:01.014200,friedman_mse,27,sqrt,2,2,best,TPESampler,COMPLETE
947,0.5363240863117025,2025-04-24 21:06:30.019095,2025-04-24 21:06:30.961695,0 days 00:00:00.942600,friedman_mse,26,sqrt,1,4,best,TPESampler,COMPLETE
948,0.5520453318079024,2025-04-24 21:06:30.311542,2025-04-24 21:06:31.342929,0 days 00:00:01.031387,friedman_mse,29,sqrt,1,2,best,TPESampler,COMPLETE
949,0.5348629384887357,2025-04-24 21:06:30.904396,2025-04-24 21:06:31.839335,0 days 00:00:00.934939,friedman_mse,19,sqrt,1,5,best,TPESampler,COMPLETE
950,0.6895998002818075,2025-04-24 21:06:31.240605,2025-04-24 21:06:32.028850,0 days 00:00:00.788245,squared_error,35,sqrt,4,10,best,TPESampler,COMPLETE
951,0.5703619271313644,2025-04-24 21:06:31.590827,2025-04-24 21:06:32.703292,0 days 00:00:01.112465,friedman_mse,31,sqrt,1,3,best,TPESampler,COMPLETE
952,0.5546449879220828,2025-04-24 21:06:32.153780,2025-04-24 21:06:32.889745,0 days 00:00:00.735965,friedman_mse,24,sqrt,1,2,best,TPESampler,COMPLETE
953,0.8782087097997953,2025-04-24 21:06:32.246455,2025-04-24 21:06:33.267113,0 days 00:00:01.020658,friedman_mse,2,sqrt,10,3,random,TPESampler,COMPLETE
954,0.8767756438403109,2025-04-24 21:06:32.971447,2025-04-24 21:06:33.846602,0 days 00:00:00.875155,absolute_error,33,sqrt,6,20,random,TPESampler,COMPLETE
955,0.90157797490464,2025-04-24 21:06:33.147167,2025-04-24 21:06:34.010595,0 days 00:00:00.863428,squared_error,34,log2,10,4,best,TPESampler,COMPLETE
956,0.4841824780964295,2025-04-24 21:06:33.493855,2025-04-24 21:06:34.358915,0 days 00:00:00.865060,friedman_mse,25,sqrt,1,5,best,TPESampler,COMPLETE
957,0.9017385005059522,2025-04-24 21:06:34.170861,2025-04-24 21:06:35.151219,0 days 00:00:00.980358,friedman_mse,1,log2,3,9,random,TPESampler,COMPLETE
958,0.5253868360947686,2025-04-24 21:06:34.241516,2025-04-24 21:06:35.134207,0 days 00:00:00.892691,friedman_mse,27,sqrt,1,4,best,TPESampler,COMPLETE
959,0.601590526898118,2025-04-24 21:06:34.634014,2025-04-24 21:06:35.634522,0 days 00:00:01.000508,friedman_mse,30,sqrt,1,6,random,TPESampler,COMPLETE
960,0.6198291350655195,2025-04-24 21:06:35.328188,2025-04-24 21:06:36.273386,0 days 00:00:00.945198,friedman_mse,27,sqrt,2,2,random,TPESampler,COMPLETE
961,0.4750160173487102,2025-04-24 21:06:35.379809,2025-04-24 21:06:36.341972,0 days 00:00:00.962163,friedman_mse,32,sqrt,1,5,best,TPESampler,COMPLETE
962,0.5593525150541101,2025-04-24 21:06:35.955008,2025-04-24 21:06:36.676141,0 days 00:00:00.721133,friedman_mse,30,sqrt,1,4,best,TPESampler,COMPLETE
963,0.5975832321496914,2025-04-24 21:06:36.557403,2025-04-24 21:06:37.338228,0 days 00:00:00.780825,friedman_mse,35,sqrt,2,5,best,TPESampler,COMPLETE
964,0.8850110526457134,2025-04-24 21:06:36.623989,2025-04-24 21:06:37.534754,0 days 00:00:00.910765,absolute_error,2,sqrt,1,16,random,TPESampler,COMPLETE
965,0.5636846378281005,2025-04-24 21:06:36.950951,2025-04-24 21:06:37.773644,0 days 00:00:00.822693,squared_error,21,sqrt,1,3,best,TPESampler,COMPLETE
966,0.5262906297733717,2025-04-24 21:06:37.597756,2025-04-24 21:06:38.277728,0 days 00:00:00.679972,friedman_mse,34,sqrt,1,5,best,TPESampler,COMPLETE
967,0.5593525150541101,2025-04-24 21:06:37.832291,2025-04-24 21:06:38.630322,0 days 00:00:00.798031,friedman_mse,30,sqrt,1,4,best,TPESampler,COMPLETE
968,0.6456349183315407,2025-04-24 21:06:38.005383,2025-04-24 21:06:38.944200,0 days 00:00:00.938817,friedman_mse,28,sqrt,3,6,best,TPESampler,COMPLETE
969,0.47245231313348,2025-04-24 21:06:38.623174,2025-04-24 21:06:39.484441,0 days 00:00:00.861267,friedman_mse,30,sqrt,1,6,best,TPESampler,COMPLETE
970,0.46570797980588163,2025-04-24 21:06:38.904198,2025-04-24 21:06:39.677539,0 days 00:00:00.773341,friedman_mse,31,sqrt,1,7,best,TPESampler,COMPLETE
971,0.6456349183315407,2025-04-24 21:06:39.184610,2025-04-24 21:06:40.495790,0 days 00:00:01.311180,friedman_mse,30,sqrt,3,6,best,TPESampler,COMPLETE
972,0.5298778451782702,2025-04-24 21:06:39.787377,2025-04-24 21:06:40.694511,0 days 00:00:00.907134,friedman_mse,32,sqrt,1,7,best,TPESampler,COMPLETE
973,0.4905008424568538,2025-04-24 21:06:39.875207,2025-04-24 21:06:40.813598,0 days 00:00:00.938391,friedman_mse,33,sqrt,1,9,best,TPESampler,COMPLETE
974,0.9015251732962958,2025-04-24 21:06:40.832262,2025-04-24 21:06:42.107362,0 days 00:00:01.275100,absolute_error,30,log2,10,2,best,TPESampler,COMPLETE
975,0.48350783172535233,2025-04-24 21:06:40.886313,2025-04-24 21:06:41.822781,0 days 00:00:00.936468,friedman_mse,34,sqrt,1,7,best,TPESampler,COMPLETE
976,0.49100091803166096,2025-04-24 21:06:41.003154,2025-04-24 21:06:42.014317,0 days 00:00:01.011163,friedman_mse,32,sqrt,1,8,best,TPESampler,COMPLETE
977,0.4868744820818364,2025-04-24 21:06:42.054417,2025-04-24 21:06:42.799271,0 days 00:00:00.744854,friedman_mse,27,sqrt,1,6,best,TPESampler,COMPLETE
978,0.724693405814323,2025-04-24 21:06:42.288304,2025-04-24 21:06:43.200580,0 days 00:00:00.912276,friedman_mse,12,log2,1,17,best,TPESampler,COMPLETE
979,0.55463100569659,2025-04-24 21:06:42.466257,2025-04-24 21:06:43.383978,0 days 00:00:00.917721,friedman_mse,24,sqrt,1,12,best,TPESampler,COMPLETE
980,0.5037849405969599,2025-04-24 21:06:43.126536,2025-04-24 21:06:43.857166,0 days 00:00:00.730630,friedman_mse,26,sqrt,1,6,best,TPESampler,COMPLETE
981,0.6456349183315407,2025-04-24 21:06:43.456916,2025-04-24 21:06:44.281124,0 days 00:00:00.824208,friedman_mse,30,sqrt,3,6,best,TPESampler,COMPLETE
982,0.90157797490464,2025-04-24 21:06:43.627489,2025-04-24 21:06:44.524525,0 days 00:00:00.897036,friedman_mse,17,log2,8,3,best,TPESampler,COMPLETE
983,0.5297487655453301,2025-04-24 21:06:44.189611,2025-04-24 21:06:45.018181,0 days 00:00:00.828570,friedman_mse,35,log2,1,9,best,TPESampler,COMPLETE
984,0.6515872609760095,2025-04-24 21:06:44.593386,2025-04-24 21:06:45.380553,0 days 00:00:00.787167,friedman_mse,31,sqrt,2,6,best,TPESampler,COMPLETE
985,0.5191719425869716,2025-04-24 21:06:44.752292,2025-04-24 21:06:45.695088,0 days 00:00:00.942796,friedman_mse,29,sqrt,1,5,best,TPESampler,COMPLETE
986,0.4653938401437279,2025-04-24 21:06:45.309070,2025-04-24 21:06:46.029865,0 days 00:00:00.720795,friedman_mse,32,sqrt,1,4,best,TPESampler,COMPLETE
987,0.49455983062803255,2025-04-24 21:06:45.747014,2025-04-24 21:06:46.891438,0 days 00:00:01.144424,friedman_mse,28,sqrt,1,9,best,TPESampler,COMPLETE
988,0.49912878166750996,2025-04-24 21:06:45.958550,2025-04-24 21:06:46.723945,0 days 00:00:00.765395,friedman_mse,28,sqrt,1,7,best,TPESampler,COMPLETE
989,0.6289323974475082,2025-04-24 21:06:46.224196,2025-04-24 21:06:47.007665,0 days 00:00:00.783469,friedman_mse,26,sqrt,2,9,best,TPESampler,COMPLETE
990,0.6515872609760095,2025-04-24 21:06:46.963081,2025-04-24 21:06:47.897337,0 days 00:00:00.934256,friedman_mse,29,sqrt,2,6,best,TPESampler,COMPLETE
991,0.4827218654781925,2025-04-24 21:06:47.171646,2025-04-24 21:06:48.180179,0 days 00:00:01.008533,friedman_mse,34,sqrt,1,6,best,TPESampler,COMPLETE
992,0.46570797980588163,2025-04-24 21:06:47.254379,2025-04-24 21:06:48.307732,0 days 00:00:01.053353,friedman_mse,31,sqrt,1,7,best,TPESampler,COMPLETE
993,0.5157610196982807,2025-04-24 21:06:48.133062,2025-04-24 21:06:48.836228,0 days 00:00:00.703166,friedman_mse,26,sqrt,1,7,best,TPESampler,COMPLETE
994,0.6504215924944643,2025-04-24 21:06:48.445768,2025-04-24 21:06:49.199003,0 days 00:00:00.753235,friedman_mse,33,sqrt,3,9,best,TPESampler,COMPLETE
995,0.5129971695350808,2025-04-24 21:06:48.518737,2025-04-24 21:06:49.402719,0 days 00:00:00.883982,friedman_mse,30,sqrt,1,9,best,TPESampler,COMPLETE
996,0.6180856799418332,2025-04-24 21:06:49.133566,2025-04-24 21:06:50.052577,0 days 00:00:00.919011,friedman_mse,30,sqrt,2,7,best,TPESampler,COMPLETE
997,0.6504215924944643,2025-04-24 21:06:49.543902,2025-04-24 21:06:50.568246,0 days 00:00:01.024344,friedman_mse,29,sqrt,3,11,best,TPESampler,COMPLETE
998,0.5114477233942855,2025-04-24 21:06:49.919953,2025-04-24 21:06:50.740823,0 days 00:00:00.820870,friedman_mse,28,sqrt,1,8,best,TPESampler,COMPLETE
999,0.550928635982706,2025-04-24 21:06:50.282366,2025-04-24 21:06:51.086412,0 days 00:00:00.804046,friedman_mse,34,sqrt,1,8,best,TPESampler,COMPLETE
1000,0.6456349183315407,2025-04-24 21:06:50.855055,2025-04-24 21:06:51.645361,0 days 00:00:00.790306,friedman_mse,25,sqrt,3,6,best,TPESampler,COMPLETE
1001,0.5540979794176473,2025-04-24 21:06:51.039000,2025-04-24 21:06:51.994197,0 days 00:00:00.955197,friedman_mse,23,sqrt,1,6,best,TPESampler,COMPLETE
1002,0.5239406427324055,2025-04-24 21:06:51.345293,2025-04-24 21:06:52.209864,0 days 00:00:00.864571,friedman_mse,22,sqrt,1,6,best,TPESampler,COMPLETE
