number,value,datetime_start,datetime_complete,duration,params_criterion,params_max_depth,params_max_features,params_min_samples_leaf,params_min_samples_split,params_splitter,system_attrs_auto:sampler,state
429,0.5989127987160004,2025-04-24 21:03:15.255626,2025-04-24 21:03:15.953869,0 days 00:00:00.698243,absolute_error,29,sqrt,1,7,best,TPESampler,COMPLETE
430,0.4962324084473796,2025-04-24 21:03:15.644235,2025-04-24 21:03:16.399251,0 days 00:00:00.755016,friedman_mse,29,sqrt,1,6,best,TPESampler,COMPLETE
431,0.6225845856267994,2025-04-24 21:03:15.734296,2025-04-24 21:03:16.634534,0 days 00:00:00.900238,friedman_mse,31,sqrt,3,4,random,TPESampler,COMPLETE
432,0.7685117598108862,2025-04-24 21:03:16.221512,2025-04-24 21:03:17.271565,0 days 00:00:01.050053,friedman_mse,9,sqrt,4,19,random,TPESampler,COMPLETE
433,0.5174821289965706,2025-04-24 21:03:16.629935,2025-04-24 21:03:17.458950,0 days 00:00:00.829015,absolute_error,29,sqrt,1,13,best,TPESampler,COMPLETE
434,0.534560318230295,2025-04-24 21:03:17.001520,2025-04-24 21:03:17.729813,0 days 00:00:00.728293,absolute_error,33,log2,1,11,best,TPESampler,COMPLETE
435,0.6861911563373202,2025-04-24 21:03:17.553339,2025-04-24 21:03:18.369318,0 days 00:00:00.815979,friedman_mse,33,sqrt,9,17,best,TPESampler,COMPLETE
436,0.49539401198788513,2025-04-24 21:03:17.693632,2025-04-24 21:03:18.668561,0 days 00:00:00.974929,absolute_error,34,sqrt,1,10,best,TPESampler,COMPLETE
437,0.6884729906189335,2025-04-24 21:03:17.921965,2025-04-24 21:03:18.673349,0 days 00:00:00.751384,friedman_mse,27,sqrt,4,13,best,TPESampler,COMPLETE
438,0.6057121888285978,2025-04-24 21:03:18.620874,2025-04-24 21:03:19.192997,0 days 00:00:00.572123,friedman_mse,28,sqrt,1,3,random,TPESampler,COMPLETE
439,0.5684057315395099,2025-04-24 21:03:18.882013,2025-04-24 21:03:19.761937,0 days 00:00:00.879924,friedman_mse,31,log2,1,2,best,TPESampler,COMPLETE
440,0.6861911563373202,2025-04-24 21:03:18.935388,2025-04-24 21:03:19.851296,0 days 00:00:00.915908,friedman_mse,29,sqrt,9,4,best,TPESampler,COMPLETE
441,0.5724846347554697,2025-04-24 21:03:19.466039,2025-04-24 21:03:20.154444,0 days 00:00:00.688405,friedman_mse,30,sqrt,1,7,best,TPESampler,COMPLETE
442,0.6086598638338473,2025-04-24 21:03:20.059834,2025-04-24 21:03:21.031460,0 days 00:00:00.971626,absolute_error,35,sqrt,3,12,best,TPESampler,COMPLETE
443,0.5197703343770413,2025-04-24 21:03:20.106995,2025-04-24 21:03:20.848978,0 days 00:00:00.741983,absolute_error,35,sqrt,1,11,best,TPESampler,COMPLETE
444,0.6504215924944643,2025-04-24 21:03:20.356309,2025-04-24 21:03:21.188160,0 days 00:00:00.831851,friedman_mse,28,sqrt,3,9,best,TPESampler,COMPLETE
445,0.49390761255894267,2025-04-24 21:03:21.142132,2025-04-24 21:03:21.898054,0 days 00:00:00.755922,absolute_error,35,sqrt,1,8,best,TPESampler,COMPLETE
446,0.5479322564786873,2025-04-24 21:03:21.243143,2025-04-24 21:03:22.243864,0 days 00:00:01.000721,friedman_mse,35,sqrt,1,6,best,TPESampler,COMPLETE
447,0.5640872207266376,2025-04-24 21:03:21.435352,2025-04-24 21:03:22.330979,0 days 00:00:00.895627,friedman_mse,28,sqrt,1,2,best,TPESampler,COMPLETE
448,0.6187065044038689,2025-04-24 21:03:22.186238,2025-04-24 21:03:22.775806,0 days 00:00:00.589568,absolute_error,35,sqrt,3,10,best,TPESampler,COMPLETE
449,0.878930627702796,2025-04-24 21:03:22.453657,2025-04-24 21:03:23.148694,0 days 00:00:00.695037,squared_error,35,log2,7,2,random,TPESampler,COMPLETE
450,0.4979921184868664,2025-04-24 21:03:22.596968,2025-04-24 21:03:23.569443,0 days 00:00:00.972475,absolute_error,34,sqrt,1,4,best,TPESampler,COMPLETE
451,0.674637265661119,2025-04-24 21:03:23.055945,2025-04-24 21:03:23.723025,0 days 00:00:00.667080,friedman_mse,22,log2,1,8,best,TPESampler,COMPLETE
452,0.6456349183315407,2025-04-24 21:03:23.362837,2025-04-24 21:03:24.034854,0 days 00:00:00.672017,friedman_mse,30,sqrt,3,3,best,TPESampler,COMPLETE
453,0.5164170552722069,2025-04-24 21:03:23.780573,2025-04-24 21:03:24.456622,0 days 00:00:00.676049,friedman_mse,29,sqrt,1,8,best,TPESampler,COMPLETE
454,0.49783262823116015,2025-04-24 21:03:23.921818,2025-04-24 21:03:24.807040,0 days 00:00:00.885222,friedman_mse,31,sqrt,1,5,best,TPESampler,COMPLETE
455,0.8767756438403109,2025-04-24 21:03:24.281026,2025-04-24 21:03:25.162883,0 days 00:00:00.881857,absolute_error,5,sqrt,10,9,random,TPESampler,COMPLETE
456,0.8390828160013849,2025-04-24 21:03:24.737112,2025-04-24 21:03:25.463427,0 days 00:00:00.726315,squared_error,15,log2,1,20,random,TPESampler,COMPLETE
457,0.4828395980192407,2025-04-24 21:03:25.063128,2025-04-24 21:03:25.964011,0 days 00:00:00.900883,squared_error,28,sqrt,1,13,best,TPESampler,COMPLETE
458,0.6173421226101489,2025-04-24 21:03:25.457874,2025-04-24 21:03:26.126408,0 days 00:00:00.668534,absolute_error,35,sqrt,3,7,best,TPESampler,COMPLETE
459,0.6083373971456141,2025-04-24 21:03:25.727986,2025-04-24 21:03:26.482496,0 days 00:00:00.754510,squared_error,21,sqrt,2,14,best,TPESampler,COMPLETE
460,0.6016941067360192,2025-04-24 21:03:26.210551,2025-04-24 21:03:27.062954,0 days 00:00:00.852403,squared_error,29,sqrt,3,12,best,TPESampler,COMPLETE
461,0.4937530427079524,2025-04-24 21:03:26.375633,2025-04-24 21:03:27.215439,0 days 00:00:00.839806,squared_error,29,sqrt,1,11,best,TPESampler,COMPLETE
462,0.524530267184308,2025-04-24 21:03:26.781933,2025-04-24 21:03:27.547843,0 days 00:00:00.765910,squared_error,27,sqrt,1,14,best,TPESampler,COMPLETE
463,0.8737590921917946,2025-04-24 21:03:27.262065,2025-04-24 21:03:28.011501,0 days 00:00:00.749436,friedman_mse,20,sqrt,8,19,random,TPESampler,COMPLETE
464,0.6009290026288858,2025-04-24 21:03:27.554301,2025-04-24 21:03:28.331549,0 days 00:00:00.777248,squared_error,35,sqrt,2,13,best,TPESampler,COMPLETE
465,0.8609035623054152,2025-04-24 21:03:27.943573,2025-04-24 21:03:28.634259,0 days 00:00:00.690686,friedman_mse,29,log2,4,8,best,TPESampler,COMPLETE
466,0.49169508102649473,2025-04-24 21:03:28.225905,2025-04-24 21:03:29.081585,0 days 00:00:00.855680,absolute_error,35,sqrt,1,10,best,TPESampler,COMPLETE
467,0.5363625633065204,2025-04-24 21:03:28.584270,2025-04-24 21:03:29.367967,0 days 00:00:00.783697,friedman_mse,26,sqrt,1,10,best,TPESampler,COMPLETE
468,0.5111974779306657,2025-04-24 21:03:28.876130,2025-04-24 21:03:29.639991,0 days 00:00:00.763861,absolute_error,28,sqrt,1,8,best,TPESampler,COMPLETE
469,0.5912941502828561,2025-04-24 21:03:29.311217,2025-04-24 21:03:30.139728,0 days 00:00:00.828511,friedman_mse,35,sqrt,1,5,best,TPESampler,COMPLETE
470,0.6456349183315407,2025-04-24 21:03:29.645246,2025-04-24 21:03:30.439884,0 days 00:00:00.794638,friedman_mse,26,sqrt,3,6,best,TPESampler,COMPLETE
471,0.5513554337953424,2025-04-24 21:03:29.920035,2025-04-24 21:03:30.744244,0 days 00:00:00.824209,friedman_mse,27,sqrt,1,5,best,TPESampler,COMPLETE
472,0.5107286963362299,2025-04-24 21:03:30.548473,2025-04-24 21:03:31.261822,0 days 00:00:00.713349,squared_error,30,sqrt,1,15,best,TPESampler,COMPLETE
473,0.6504215924944643,2025-04-24 21:03:30.638168,2025-04-24 21:03:31.389420,0 days 00:00:00.751252,friedman_mse,35,sqrt,3,8,best,TPESampler,COMPLETE
474,0.5395787625686699,2025-04-24 21:03:30.960220,2025-04-24 21:03:31.683974,0 days 00:00:00.723754,absolute_error,28,sqrt,1,12,best,TPESampler,COMPLETE
475,0.7436032276730585,2025-04-24 21:03:31.575507,2025-04-24 21:03:32.763248,0 days 00:00:01.187741,squared_error,28,log2,3,15,best,TPESampler,COMPLETE
476,0.6324456330462798,2025-04-24 21:03:31.635664,2025-04-24 21:03:32.636637,0 days 00:00:01.000973,squared_error,23,sqrt,1,11,random,TPESampler,COMPLETE
477,0.550729237046517,2025-04-24 21:03:31.883696,2025-04-24 21:03:33.089738,0 days 00:00:01.206042,absolute_error,35,sqrt,1,6,best,TPESampler,COMPLETE
478,0.5955913157425761,2025-04-24 21:03:32.920811,2025-04-24 21:03:33.625686,0 days 00:00:00.704875,absolute_error,29,sqrt,2,9,best,TPESampler,COMPLETE
479,0.878930627702796,2025-04-24 21:03:32.991819,2025-04-24 21:03:33.800103,0 days 00:00:00.808284,squared_error,26,log2,6,16,random,TPESampler,COMPLETE
480,0.5433477422291207,2025-04-24 21:03:33.336917,2025-04-24 21:03:34.110278,0 days 00:00:00.773361,absolute_error,35,sqrt,1,7,best,TPESampler,COMPLETE
481,0.500848998379332,2025-04-24 21:03:33.858764,2025-04-24 21:03:34.673297,0 days 00:00:00.814533,friedman_mse,30,sqrt,1,2,best,TPESampler,COMPLETE
482,0.8651495383192646,2025-04-24 21:03:34.064196,2025-04-24 21:03:35.058687,0 days 00:00:00.994491,friedman_mse,6,log2,1,15,random,TPESampler,COMPLETE
483,0.49169508102649473,2025-04-24 21:03:34.268867,2025-04-24 21:03:35.155611,0 days 00:00:00.886744,absolute_error,35,sqrt,1,10,best,TPESampler,COMPLETE
484,0.5435622016360893,2025-04-24 21:03:34.990894,2025-04-24 21:03:35.575156,0 days 00:00:00.584262,friedman_mse,27,sqrt,1,7,best,TPESampler,COMPLETE
485,0.5479322564786873,2025-04-24 21:03:35.307603,2025-04-24 21:03:36.146323,0 days 00:00:00.838720,friedman_mse,35,sqrt,1,6,best,TPESampler,COMPLETE
486,0.5623543669503079,2025-04-24 21:03:35.409968,2025-04-24 21:03:36.278651,0 days 00:00:00.868683,friedman_mse,30,sqrt,1,5,best,TPESampler,COMPLETE
487,0.7524951217838445,2025-04-24 21:03:35.821079,2025-04-24 21:03:36.594310,0 days 00:00:00.773231,absolute_error,27,log2,2,5,best,TPESampler,COMPLETE
488,0.695504129897712,2025-04-24 21:03:36.419235,2025-04-24 21:03:37.406749,0 days 00:00:00.987514,absolute_error,28,sqrt,1,7,random,TPESampler,COMPLETE
489,0.8479191337337452,2025-04-24 21:03:36.468864,2025-04-24 21:03:37.343775,0 days 00:00:00.874911,squared_error,13,log2,1,8,random,TPESampler,COMPLETE
490,0.6456349183315407,2025-04-24 21:03:36.856542,2025-04-24 21:03:37.685722,0 days 00:00:00.829180,friedman_mse,33,sqrt,3,3,best,TPESampler,COMPLETE
491,0.5392261741295051,2025-04-24 21:03:37.586237,2025-04-24 21:03:38.380153,0 days 00:00:00.793916,squared_error,26,sqrt,1,12,best,TPESampler,COMPLETE
492,0.607742911122644,2025-04-24 21:03:37.639392,2025-04-24 21:03:38.618553,0 days 00:00:00.979161,absolute_error,35,sqrt,3,11,best,TPESampler,COMPLETE
493,0.5420319960335082,2025-04-24 21:03:37.904068,2025-04-24 21:03:38.694945,0 days 00:00:00.790877,absolute_error,35,sqrt,1,12,best,TPESampler,COMPLETE
494,0.5114477233942855,2025-04-24 21:03:38.623340,2025-04-24 21:03:39.289647,0 days 00:00:00.666307,friedman_mse,28,sqrt,1,8,best,TPESampler,COMPLETE
495,0.6456349183315407,2025-04-24 21:03:38.845126,2025-04-24 21:03:39.653646,0 days 00:00:00.808520,friedman_mse,30,sqrt,3,6,best,TPESampler,COMPLETE
496,0.5701537892765277,2025-04-24 21:03:38.974527,2025-04-24 21:03:39.871614,0 days 00:00:00.897087,absolute_error,35,sqrt,2,8,best,TPESampler,COMPLETE
497,0.49169508102649473,2025-04-24 21:03:39.583035,2025-04-24 21:03:40.395619,0 days 00:00:00.812584,absolute_error,35,sqrt,1,10,best,TPESampler,COMPLETE
498,0.5219928786672743,2025-04-24 21:03:39.942465,2025-04-24 21:03:40.729906,0 days 00:00:00.787441,friedman_mse,33,sqrt,1,4,best,TPESampler,COMPLETE
499,0.47983015285862346,2025-04-24 21:03:40.096906,2025-04-24 21:03:40.924413,0 days 00:00:00.827507,friedman_mse,28,sqrt,1,6,best,TPESampler,COMPLETE
500,0.5085288623263258,2025-04-24 21:03:40.667444,2025-04-24 21:03:41.287003,0 days 00:00:00.619559,friedman_mse,35,sqrt,1,9,best,TPESampler,COMPLETE
501,0.4973764241949292,2025-04-24 21:03:41.017358,2025-04-24 21:03:41.752369,0 days 00:00:00.735011,friedman_mse,20,sqrt,1,5,best,TPESampler,COMPLETE
502,0.5636846378281005,2025-04-24 21:03:41.173110,2025-04-24 21:03:41.944915,0 days 00:00:00.771805,friedman_mse,21,sqrt,1,3,best,TPESampler,COMPLETE
503,0.5484825968641551,2025-04-24 21:03:41.481799,2025-04-24 21:03:42.245199,0 days 00:00:00.763400,friedman_mse,23,sqrt,1,10,best,TPESampler,COMPLETE
504,0.7221791327231009,2025-04-24 21:03:42.098073,2025-04-24 21:03:43.097801,0 days 00:00:00.999728,friedman_mse,31,log2,2,7,best,TPESampler,COMPLETE
505,0.5435622016360893,2025-04-24 21:03:42.192556,2025-04-24 21:03:42.948931,0 days 00:00:00.756375,friedman_mse,27,sqrt,1,7,best,TPESampler,COMPLETE
506,0.6456349183315407,2025-04-24 21:03:42.473852,2025-04-24 21:03:43.236808,0 days 00:00:00.762956,friedman_mse,29,sqrt,3,6,best,TPESampler,COMPLETE
507,0.5724846347554697,2025-04-24 21:03:43.162522,2025-04-24 21:03:43.753023,0 days 00:00:00.590501,friedman_mse,30,sqrt,1,7,best,TPESampler,COMPLETE
508,0.5513554337953424,2025-04-24 21:03:43.363846,2025-04-24 21:03:44.125354,0 days 00:00:00.761508,friedman_mse,27,sqrt,1,5,best,TPESampler,COMPLETE
509,0.7581703706144443,2025-04-24 21:03:43.704993,2025-04-24 21:03:44.498350,0 days 00:00:00.793357,squared_error,10,sqrt,5,9,random,TPESampler,COMPLETE
510,0.5088066030253231,2025-04-24 21:03:43.985974,2025-04-24 21:03:44.854564,0 days 00:00:00.868590,absolute_error,28,sqrt,1,6,best,TPESampler,COMPLETE
511,0.5081175596164936,2025-04-24 21:03:44.403428,2025-04-24 21:03:45.231073,0 days 00:00:00.827645,friedman_mse,28,sqrt,1,5,best,TPESampler,COMPLETE
512,0.630647031464809,2025-04-24 21:03:44.761952,2025-04-24 21:03:45.426371,0 days 00:00:00.664419,absolute_error,34,sqrt,1,12,random,TPESampler,COMPLETE
513,0.608534558952521,2025-04-24 21:03:45.164687,2025-04-24 21:03:45.820847,0 days 00:00:00.656160,absolute_error,28,sqrt,4,2,best,TPESampler,COMPLETE
514,0.5226166766745245,2025-04-24 21:03:45.496017,2025-04-24 21:03:46.373176,0 days 00:00:00.877159,absolute_error,28,sqrt,1,7,best,TPESampler,COMPLETE
515,0.5517493393728706,2025-04-24 21:03:45.673772,2025-04-24 21:03:46.512112,0 days 00:00:00.838340,friedman_mse,35,sqrt,1,4,best,TPESampler,COMPLETE
516,0.6807108048919962,2025-04-24 21:03:46.084172,2025-04-24 21:03:47.298397,0 days 00:00:01.214225,friedman_mse,17,sqrt,8,14,best,TPESampler,COMPLETE
517,0.9015251732962958,2025-04-24 21:03:46.635279,2025-04-24 21:03:47.530957,0 days 00:00:00.895678,absolute_error,34,log2,6,7,best,TPESampler,COMPLETE
518,0.5280304516867977,2025-04-24 21:03:46.726896,2025-04-24 21:03:47.637760,0 days 00:00:00.910864,absolute_error,30,sqrt,1,10,best,TPESampler,COMPLETE
519,0.482024331116523,2025-04-24 21:03:47.581912,2025-04-24 21:03:48.346273,0 days 00:00:00.764361,absolute_error,35,sqrt,1,9,best,TPESampler,COMPLETE
520,0.6456349183315407,2025-04-24 21:03:47.761945,2025-04-24 21:03:48.581185,0 days 00:00:00.819240,friedman_mse,30,sqrt,3,7,best,TPESampler,COMPLETE
521,0.8767756438403109,2025-04-24 21:03:47.876307,2025-04-24 21:03:48.896404,0 days 00:00:01.020097,absolute_error,32,sqrt,6,6,random,TPESampler,COMPLETE
522,0.49390761255894267,2025-04-24 21:03:48.614784,2025-04-24 21:03:49.509976,0 days 00:00:00.895192,absolute_error,35,sqrt,1,8,best,TPESampler,COMPLETE
523,0.5410513390176003,2025-04-24 21:03:48.792946,2025-04-24 21:03:49.700438,0 days 00:00:00.907492,absolute_error,29,sqrt,1,10,best,TPESampler,COMPLETE
524,0.6101425199126679,2025-04-24 21:03:49.103624,2025-04-24 21:03:49.890219,0 days 00:00:00.786595,absolute_error,29,sqrt,2,8,best,TPESampler,COMPLETE
525,0.49169508102649473,2025-04-24 21:03:49.802339,2025-04-24 21:03:50.658634,0 days 00:00:00.856295,absolute_error,35,sqrt,1,10,best,TPESampler,COMPLETE
526,0.5813930615984835,2025-04-24 21:03:49.897220,2025-04-24 21:03:50.850640,0 days 00:00:00.953420,absolute_error,30,sqrt,3,8,best,TPESampler,COMPLETE
527,0.878930627702796,2025-04-24 21:03:50.134615,2025-04-24 21:03:50.965598,0 days 00:00:00.830983,friedman_mse,19,log2,5,20,random,TPESampler,COMPLETE
528,0.5945733216843836,2025-04-24 21:03:50.921720,2025-04-24 21:03:51.799555,0 days 00:00:00.877835,absolute_error,34,sqrt,3,7,best,TPESampler,COMPLETE
529,0.6011985060572526,2025-04-24 21:03:51.065811,2025-04-24 21:03:51.999885,0 days 00:00:00.934074,absolute_error,35,sqrt,2,9,best,TPESampler,COMPLETE
530,0.7063091520116527,2025-04-24 21:03:51.270199,2025-04-24 21:03:52.051932,0 days 00:00:00.781733,absolute_error,22,sqrt,1,12,random,TPESampler,COMPLETE
531,0.49390761255894267,2025-04-24 21:03:52.098532,2025-04-24 21:03:52.878422,0 days 00:00:00.779890,absolute_error,35,sqrt,1,8,best,TPESampler,COMPLETE
532,0.6194853816763535,2025-04-24 21:03:52.155516,2025-04-24 21:03:53.189583,0 days 00:00:01.034067,friedman_mse,20,sqrt,2,8,best,TPESampler,COMPLETE
533,0.6456349183315407,2025-04-24 21:03:52.299397,2025-04-24 21:03:53.074102,0 days 00:00:00.774705,friedman_mse,24,sqrt,3,4,best,TPESampler,COMPLETE
534,0.5286244893261335,2025-04-24 21:03:53.135639,2025-04-24 21:03:53.898131,0 days 00:00:00.762492,absolute_error,30,sqrt,1,12,best,TPESampler,COMPLETE
535,0.49169508102649473,2025-04-24 21:03:53.276118,2025-04-24 21:03:54.128675,0 days 00:00:00.852557,absolute_error,35,sqrt,1,10,best,TPESampler,COMPLETE
536,0.5518815421255675,2025-04-24 21:03:53.494680,2025-04-24 21:03:54.232691,0 days 00:00:00.738011,friedman_mse,25,sqrt,1,6,best,TPESampler,COMPLETE
537,0.6140253855158658,2025-04-24 21:03:54.171650,2025-04-24 21:03:55.008852,0 days 00:00:00.837202,absolute_error,35,sqrt,3,9,best,TPESampler,COMPLETE
538,0.5197703343770413,2025-04-24 21:03:54.349193,2025-04-24 21:03:55.413286,0 days 00:00:01.064093,absolute_error,35,sqrt,1,11,best,TPESampler,COMPLETE
539,0.6011985060572526,2025-04-24 21:03:54.439539,2025-04-24 21:03:55.264659,0 days 00:00:00.825120,absolute_error,35,sqrt,2,9,best,TPESampler,COMPLETE
540,0.5191719425869716,2025-04-24 21:03:55.202756,2025-04-24 21:03:55.754142,0 days 00:00:00.551386,friedman_mse,29,sqrt,1,5,best,TPESampler,COMPLETE
541,0.5348776862952044,2025-04-24 21:03:55.510076,2025-04-24 21:03:56.259389,0 days 00:00:00.749313,squared_error,26,sqrt,1,2,best,TPESampler,COMPLETE
542,0.5436017507059375,2025-04-24 21:03:55.707325,2025-04-24 21:03:56.578908,0 days 00:00:00.871583,friedman_mse,31,sqrt,1,14,best,TPESampler,COMPLETE
543,0.49390761255894267,2025-04-24 21:03:55.959956,2025-04-24 21:03:56.917232,0 days 00:00:00.957276,absolute_error,35,sqrt,1,8,best,TPESampler,COMPLETE
544,0.6289323974475082,2025-04-24 21:03:56.522220,2025-04-24 21:03:57.524941,0 days 00:00:01.002721,friedman_mse,28,sqrt,2,9,best,TPESampler,COMPLETE
545,0.482024331116523,2025-04-24 21:03:56.927838,2025-04-24 21:03:57.798071,0 days 00:00:00.870233,absolute_error,35,sqrt,1,9,best,TPESampler,COMPLETE
546,0.5503039019834799,2025-04-24 21:03:57.265399,2025-04-24 21:03:58.008830,0 days 00:00:00.743431,friedman_mse,28,sqrt,1,3,best,TPESampler,COMPLETE
547,0.6806135153170361,2025-04-24 21:03:57.732632,2025-04-24 21:03:58.396603,0 days 00:00:00.663971,squared_error,15,sqrt,7,12,best,TPESampler,COMPLETE
548,0.6456349183315407,2025-04-24 21:03:58.115637,2025-04-24 21:03:58.834557,0 days 00:00:00.718920,friedman_mse,34,sqrt,3,2,best,TPESampler,COMPLETE
549,0.8933764730129842,2025-04-24 21:03:58.293002,2025-04-24 21:03:59.011089,0 days 00:00:00.718087,squared_error,1,sqrt,5,9,best,TPESampler,COMPLETE
550,0.49455983062803255,2025-04-24 21:03:58.621783,2025-04-24 21:03:59.309389,0 days 00:00:00.687606,friedman_mse,28,sqrt,1,9,best,TPESampler,COMPLETE
551,0.8618581899278337,2025-04-24 21:03:59.067242,2025-04-24 21:03:59.846599,0 days 00:00:00.779357,friedman_mse,28,log2,4,20,best,TPESampler,COMPLETE
552,0.8687336452537693,2025-04-24 21:03:59.269362,2025-04-24 21:04:00.171727,0 days 00:00:00.902365,friedman_mse,6,sqrt,7,2,best,TPESampler,COMPLETE
553,0.5518815421255675,2025-04-24 21:03:59.520165,2025-04-24 21:04:00.348436,0 days 00:00:00.828271,friedman_mse,25,sqrt,1,6,best,TPESampler,COMPLETE
554,0.5989127987160004,2025-04-24 21:04:00.103260,2025-04-24 21:04:00.787994,0 days 00:00:00.684734,absolute_error,29,sqrt,1,7,best,TPESampler,COMPLETE
555,0.8767756438403109,2025-04-24 21:04:00.479422,2025-04-24 21:04:01.203779,0 days 00:00:00.724357,absolute_error,16,sqrt,6,16,random,TPESampler,COMPLETE
556,0.560921181142204,2025-04-24 21:04:00.555211,2025-04-24 21:04:01.489676,0 days 00:00:00.934465,absolute_error,34,sqrt,1,6,best,TPESampler,COMPLETE
557,0.5338046397110097,2025-04-24 21:04:01.118848,2025-04-24 21:04:01.981077,0 days 00:00:00.862229,friedman_mse,32,sqrt,1,2,best,TPESampler,COMPLETE
558,0.5420319960335082,2025-04-24 21:04:01.452515,2025-04-24 21:04:02.295855,0 days 00:00:00.843340,absolute_error,35,sqrt,1,12,best,TPESampler,COMPLETE
559,0.5366227285243095,2025-04-24 21:04:01.746407,2025-04-24 21:04:02.478125,0 days 00:00:00.731718,absolute_error,29,sqrt,1,9,best,TPESampler,COMPLETE
560,0.6754478427652669,2025-04-24 21:04:02.231317,2025-04-24 21:04:02.946830,0 days 00:00:00.715513,friedman_mse,25,sqrt,1,12,random,TPESampler,COMPLETE
561,0.8725676114862353,2025-04-24 21:04:02.544403,2025-04-24 21:04:03.359729,0 days 00:00:00.815326,absolute_error,4,sqrt,8,12,best,TPESampler,COMPLETE
562,0.49912878166750996,2025-04-24 21:04:02.772607,2025-04-24 21:04:03.646685,0 days 00:00:00.874078,friedman_mse,28,sqrt,1,7,best,TPESampler,COMPLETE
563,0.7375011107188346,2025-04-24 21:04:03.296615,2025-04-24 21:04:04.082064,0 days 00:00:00.785449,absolute_error,33,log2,3,8,best,TPESampler,COMPLETE
564,0.6900939811013265,2025-04-24 21:04:03.604843,2025-04-24 21:04:04.468581,0 days 00:00:00.863738,absolute_error,28,sqrt,9,20,best,TPESampler,COMPLETE
565,0.6456349183315407,2025-04-24 21:04:03.906952,2025-04-24 21:04:04.660108,0 days 00:00:00.753156,friedman_mse,26,sqrt,3,4,best,TPESampler,COMPLETE
566,0.6076328031355862,2025-04-24 21:04:04.410360,2025-04-24 21:04:05.161981,0 days 00:00:00.751621,absolute_error,35,sqrt,2,6,best,TPESampler,COMPLETE
567,0.5085251300670954,2025-04-24 21:04:04.719870,2025-04-24 21:04:05.450395,0 days 00:00:00.730525,friedman_mse,29,sqrt,1,9,best,TPESampler,COMPLETE
568,0.6515872609760095,2025-04-24 21:04:04.925821,2025-04-24 21:04:05.644786,0 days 00:00:00.718965,friedman_mse,29,sqrt,2,6,best,TPESampler,COMPLETE
569,0.8210990120551902,2025-04-24 21:04:05.390723,2025-04-24 21:04:06.034456,0 days 00:00:00.643733,absolute_error,20,log2,1,3,random,TPESampler,COMPLETE
570,0.5137877011526676,2025-04-24 21:04:05.768276,2025-04-24 21:04:06.547739,0 days 00:00:00.779463,absolute_error,33,log2,1,8,best,TPESampler,COMPLETE
571,0.9015251732962958,2025-04-24 21:04:05.925892,2025-04-24 21:04:06.697762,0 days 00:00:00.771870,absolute_error,3,log2,10,14,best,TPESampler,COMPLETE
