number,value,datetime_start,datetime_complete,duration,params_criterion,params_max_depth,params_max_features,params_min_samples_leaf,params_min_samples_split,params_splitter,system_attrs_auto:sampler,state
1861,0.5202466614878716,2025-04-24 21:12:57.709774,2025-04-24 21:12:58.987617,0 days 00:00:01.277843,friedman_mse,29,sqrt,1,7,best,TPESampler,COMPLETE
1862,0.5593525150541101,2025-04-24 21:12:58.487493,2025-04-24 21:12:59.325441,0 days 00:00:00.837948,friedman_mse,30,sqrt,1,4,best,TPESampler,COMPLETE
1863,0.5640872207266376,2025-04-24 21:12:59.238714,2025-04-24 21:13:00.258493,0 days 00:00:01.019779,squared_error,28,sqrt,1,2,best,TPESampler,COMPLETE
1864,0.5780937309636404,2025-04-24 21:12:59.285657,2025-04-24 21:13:00.219538,0 days 00:00:00.933881,squared_error,23,sqrt,1,2,best,TPESampler,COMPLETE
1865,0.5912941502828561,2025-04-24 21:12:59.826373,2025-04-24 21:13:00.804011,0 days 00:00:00.977638,friedman_mse,35,sqrt,1,5,best,TPESampler,COMPLETE
1866,0.6504215924944643,2025-04-24 21:13:00.674180,2025-04-24 21:13:01.715500,0 days 00:00:01.041320,friedman_mse,30,sqrt,3,8,best,TPESampler,COMPLETE
1867,0.6456349183315407,2025-04-24 21:13:00.802730,2025-04-24 21:13:01.743652,0 days 00:00:00.940922,friedman_mse,30,sqrt,3,6,best,TPESampler,COMPLETE
1868,0.5185211704314117,2025-04-24 21:13:01.553320,2025-04-24 21:13:02.345244,0 days 00:00:00.791924,friedman_mse,30,sqrt,1,10,best,TPESampler,COMPLETE
1869,0.9018784399194749,2025-04-24 21:13:02.025595,2025-04-24 21:13:02.826651,0 days 00:00:00.801056,friedman_mse,35,log2,10,11,random,TPESampler,COMPLETE
1870,0.5655777242471537,2025-04-24 21:13:02.084020,2025-04-24 21:13:03.063863,0 days 00:00:00.979843,friedman_mse,23,sqrt,1,9,best,TPESampler,COMPLETE
1871,0.5479322564786873,2025-04-24 21:13:02.751524,2025-04-24 21:13:03.621324,0 days 00:00:00.869800,friedman_mse,35,sqrt,1,6,best,TPESampler,COMPLETE
1872,0.6254776933780483,2025-04-24 21:13:03.119885,2025-04-24 21:13:04.100880,0 days 00:00:00.980995,friedman_mse,18,sqrt,2,7,best,TPESampler,COMPLETE
1873,0.5011482218769929,2025-04-24 21:13:03.300890,2025-04-24 21:13:04.128914,0 days 00:00:00.828024,friedman_mse,25,sqrt,1,8,best,TPESampler,COMPLETE
1874,0.6509650128595895,2025-04-24 21:13:03.962996,2025-04-24 21:13:04.928031,0 days 00:00:00.965035,friedman_mse,28,log2,1,9,best,TPESampler,COMPLETE
1875,0.501805213478129,2025-04-24 21:13:04.274596,2025-04-24 21:13:05.482696,0 days 00:00:01.208100,friedman_mse,31,sqrt,1,2,best,TPESampler,COMPLETE
1876,0.7221791327231009,2025-04-24 21:13:04.388585,2025-04-24 21:13:05.406989,0 days 00:00:01.018404,friedman_mse,22,log2,2,7,best,TPESampler,COMPLETE
1877,0.5339224783480143,2025-04-24 21:13:05.211720,2025-04-24 21:13:05.989478,0 days 00:00:00.777758,friedman_mse,35,sqrt,1,8,best,TPESampler,COMPLETE
1878,0.6456349183315407,2025-04-24 21:13:05.667206,2025-04-24 21:13:06.625515,0 days 00:00:00.958309,squared_error,34,sqrt,3,2,best,TPESampler,COMPLETE
1879,0.6858428787475002,2025-04-24 21:13:05.773920,2025-04-24 21:13:06.916072,0 days 00:00:01.142152,absolute_error,35,sqrt,6,5,best,TPESampler,COMPLETE
1880,0.878930627702796,2025-04-24 21:13:06.286990,2025-04-24 21:13:07.211002,0 days 00:00:00.924012,squared_error,28,log2,6,4,random,TPESampler,COMPLETE
1881,0.6265479990281826,2025-04-24 21:13:07.105847,2025-04-24 21:13:07.940214,0 days 00:00:00.834367,friedman_mse,28,sqrt,2,4,best,TPESampler,COMPLETE
1882,0.6504215924944643,2025-04-24 21:13:07.171867,2025-04-24 21:13:08.419232,0 days 00:00:01.247365,friedman_mse,33,sqrt,3,8,best,TPESampler,COMPLETE
1883,0.8575823339658861,2025-04-24 21:13:07.530607,2025-04-24 21:13:08.978634,0 days 00:00:01.448027,absolute_error,9,log2,3,13,random,TPESampler,COMPLETE
1884,0.49783262823116015,2025-04-24 21:13:08.367471,2025-04-24 21:13:09.291969,0 days 00:00:00.924498,friedman_mse,31,sqrt,1,5,best,TPESampler,COMPLETE
1885,0.5513554337953424,2025-04-24 21:13:08.727780,2025-04-24 21:13:09.502993,0 days 00:00:00.775213,friedman_mse,27,sqrt,1,5,best,TPESampler,COMPLETE
1886,0.6515872609760095,2025-04-24 21:13:09.448203,2025-04-24 21:13:10.131143,0 days 00:00:00.682940,friedman_mse,31,sqrt,2,6,best,TPESampler,COMPLETE
1887,0.5817002843973,2025-04-24 21:13:09.793812,2025-04-24 21:13:10.699723,0 days 00:00:00.905911,squared_error,31,sqrt,1,3,random,TPESampler,COMPLETE
1888,0.6555861939534643,2025-04-24 21:13:09.835861,2025-04-24 21:13:11.004651,0 days 00:00:01.168790,friedman_mse,26,sqrt,3,5,random,TPESampler,COMPLETE
1889,0.5157610196982807,2025-04-24 21:13:10.439351,2025-04-24 21:13:11.305237,0 days 00:00:00.865886,friedman_mse,26,sqrt,1,7,best,TPESampler,COMPLETE
1890,0.5912941502828561,2025-04-24 21:13:10.971001,2025-04-24 21:13:11.680751,0 days 00:00:00.709750,squared_error,35,sqrt,1,5,best,TPESampler,COMPLETE
1891,0.49100091803166096,2025-04-24 21:13:11.404101,2025-04-24 21:13:12.336718,0 days 00:00:00.932617,friedman_mse,32,sqrt,1,8,best,TPESampler,COMPLETE
1892,0.8767756438403109,2025-04-24 21:13:11.678081,2025-04-24 21:13:12.567959,0 days 00:00:00.889878,absolute_error,17,sqrt,8,13,random,TPESampler,COMPLETE
1893,0.6265479990281826,2025-04-24 21:13:12.001828,2025-04-24 21:13:12.765138,0 days 00:00:00.763310,friedman_mse,35,sqrt,2,4,best,TPESampler,COMPLETE
1894,0.5185211704314117,2025-04-24 21:13:12.616853,2025-04-24 21:13:13.669412,0 days 00:00:01.052559,friedman_mse,30,sqrt,1,10,best,TPESampler,COMPLETE
1895,0.5229942037417156,2025-04-24 21:13:12.863165,2025-04-24 21:13:14.031970,0 days 00:00:01.168805,friedman_mse,25,sqrt,1,4,best,TPESampler,COMPLETE
1896,0.49912878166750996,2025-04-24 21:13:12.986042,2025-04-24 21:13:14.056992,0 days 00:00:01.070950,friedman_mse,28,sqrt,1,7,best,TPESampler,COMPLETE
1897,0.6456349183315407,2025-04-24 21:13:13.991345,2025-04-24 21:13:15.109862,0 days 00:00:01.118517,friedman_mse,25,sqrt,3,5,best,TPESampler,COMPLETE
1898,0.6194853816763535,2025-04-24 21:13:14.397980,2025-04-24 21:13:15.685372,0 days 00:00:01.287392,friedman_mse,35,sqrt,2,8,best,TPESampler,COMPLETE
1899,0.8575823339658861,2025-04-24 21:13:14.423046,2025-04-24 21:13:15.502940,0 days 00:00:01.079894,absolute_error,27,log2,3,7,random,TPESampler,COMPLETE
1900,0.6515872609760095,2025-04-24 21:13:15.444059,2025-04-24 21:13:16.228539,0 days 00:00:00.784480,friedman_mse,31,sqrt,2,6,best,TPESampler,COMPLETE
1901,0.69351465341836,2025-04-24 21:13:15.758996,2025-04-24 21:13:16.631939,0 days 00:00:00.872943,friedman_mse,32,sqrt,6,3,best,TPESampler,COMPLETE
1902,0.5182225565736444,2025-04-24 21:13:15.955994,2025-04-24 21:13:17.192237,0 days 00:00:01.236243,friedman_mse,29,sqrt,1,3,best,TPESampler,COMPLETE
1903,0.5202466614878716,2025-04-24 21:13:16.630641,2025-04-24 21:13:17.499923,0 days 00:00:00.869282,friedman_mse,29,sqrt,1,7,best,TPESampler,COMPLETE
1904,0.5517493393728706,2025-04-24 21:13:16.944672,2025-04-24 21:13:18.064305,0 days 00:00:01.119633,friedman_mse,35,sqrt,1,4,best,TPESampler,COMPLETE
1905,0.5868750603971733,2025-04-24 21:13:17.557663,2025-04-24 21:13:18.409140,0 days 00:00:00.851477,friedman_mse,35,sqrt,1,7,best,TPESampler,COMPLETE
1906,0.6289323974475082,2025-04-24 21:13:17.847271,2025-04-24 21:13:18.703932,0 days 00:00:00.856661,friedman_mse,30,sqrt,2,10,best,TPESampler,COMPLETE
1907,0.6456349183315407,2025-04-24 21:13:18.399965,2025-04-24 21:13:19.820746,0 days 00:00:01.420781,friedman_mse,30,sqrt,3,5,best,TPESampler,COMPLETE
1908,0.6456349183315407,2025-04-24 21:13:18.698280,2025-04-24 21:13:19.788269,0 days 00:00:01.089989,friedman_mse,31,sqrt,3,6,best,TPESampler,COMPLETE
1909,0.6456349183315407,2025-04-24 21:13:18.991153,2025-04-24 21:13:20.164868,0 days 00:00:01.173715,friedman_mse,30,sqrt,3,6,best,TPESampler,COMPLETE
1910,0.47245231313348,2025-04-24 21:13:20.079024,2025-04-24 21:13:21.167879,0 days 00:00:01.088855,friedman_mse,30,sqrt,1,6,best,TPESampler,COMPLETE
1911,0.47245231313348,2025-04-24 21:13:20.128081,2025-04-24 21:13:21.231757,0 days 00:00:01.103676,friedman_mse,30,sqrt,1,6,best,TPESampler,COMPLETE
1912,0.6135054133428214,2025-04-24 21:13:20.412327,2025-04-24 21:13:21.493246,0 days 00:00:01.080919,absolute_error,28,sqrt,2,5,best,TPESampler,COMPLETE
1913,0.5157610196982807,2025-04-24 21:13:21.456771,2025-04-24 21:13:22.456132,0 days 00:00:00.999361,friedman_mse,26,sqrt,1,7,best,TPESampler,COMPLETE
1914,0.5103041358943772,2025-04-24 21:13:21.490902,2025-04-24 21:13:22.502518,0 days 00:00:01.011616,friedman_mse,31,sqrt,1,9,best,TPESampler,COMPLETE
1915,0.6194853816763535,2025-04-24 21:13:22.039391,2025-04-24 21:13:22.813987,0 days 00:00:00.774596,friedman_mse,26,sqrt,2,8,best,TPESampler,COMPLETE
1916,0.5529688132197964,2025-04-24 21:13:22.769148,2025-04-24 21:13:23.782303,0 days 00:00:01.013155,friedman_mse,35,sqrt,1,2,best,TPESampler,COMPLETE
1917,0.5642837571409262,2025-04-24 21:13:22.806158,2025-04-24 21:13:23.813839,0 days 00:00:01.007681,absolute_error,31,sqrt,1,3,best,TPESampler,COMPLETE
1918,0.5339224783480143,2025-04-24 21:13:23.533502,2025-04-24 21:13:24.299896,0 days 00:00:00.766394,friedman_mse,35,sqrt,1,8,best,TPESampler,COMPLETE
1919,0.7465885658269817,2025-04-24 21:13:23.999562,2025-04-24 21:13:24.841963,0 days 00:00:00.842401,absolute_error,23,sqrt,5,13,best,TPESampler,COMPLETE
1920,0.4841824780964295,2025-04-24 21:13:24.031185,2025-04-24 21:13:25.073247,0 days 00:00:01.042062,friedman_mse,25,sqrt,1,5,best,TPESampler,COMPLETE
1921,0.5623961641640529,2025-04-24 21:13:24.672010,2025-04-24 21:13:25.381271,0 days 00:00:00.709261,friedman_mse,35,log2,1,5,best,TPESampler,COMPLETE
1922,0.6504215924944643,2025-04-24 21:13:25.288181,2025-04-24 21:13:26.149320,0 days 00:00:00.861139,friedman_mse,35,sqrt,3,10,best,TPESampler,COMPLETE
1923,0.5373966342965538,2025-04-24 21:13:25.343735,2025-04-24 21:13:26.477085,0 days 00:00:01.133350,friedman_mse,29,sqrt,1,4,best,TPESampler,COMPLETE
1924,0.5182225565736444,2025-04-24 21:13:25.644811,2025-04-24 21:13:26.507817,0 days 00:00:00.863006,friedman_mse,29,sqrt,1,3,best,TPESampler,COMPLETE
1925,0.6180856799418332,2025-04-24 21:13:26.415899,2025-04-24 21:13:27.233328,0 days 00:00:00.817429,friedman_mse,30,sqrt,2,7,best,TPESampler,COMPLETE
1926,0.48921668337565616,2025-04-24 21:13:26.794963,2025-04-24 21:13:27.922229,0 days 00:00:01.127266,friedman_mse,32,sqrt,1,6,best,TPESampler,COMPLETE
1927,0.5842828324175082,2025-04-24 21:13:26.839693,2025-04-24 21:13:28.003737,0 days 00:00:01.164044,friedman_mse,30,sqrt,1,8,random,TPESampler,COMPLETE
1928,0.6353603849108688,2025-04-24 21:13:27.557395,2025-04-24 21:13:28.321790,0 days 00:00:00.764395,friedman_mse,34,sqrt,2,8,random,TPESampler,COMPLETE
1929,0.5163803250766943,2025-04-24 21:13:28.223538,2025-04-24 21:13:29.205319,0 days 00:00:00.981781,friedman_mse,27,sqrt,1,13,best,TPESampler,COMPLETE
1930,0.5114477233942855,2025-04-24 21:13:28.274379,2025-04-24 21:13:29.193010,0 days 00:00:00.918631,friedman_mse,28,sqrt,1,8,best,TPESampler,COMPLETE
1931,0.6504215924944643,2025-04-24 21:13:28.822540,2025-04-24 21:13:29.591984,0 days 00:00:00.769444,squared_error,28,sqrt,3,8,best,TPESampler,COMPLETE
1932,0.47245231313348,2025-04-24 21:13:29.552136,2025-04-24 21:13:30.576137,0 days 00:00:01.024001,friedman_mse,30,sqrt,1,6,best,TPESampler,COMPLETE
1933,0.4868744820818364,2025-04-24 21:13:29.583880,2025-04-24 21:13:30.487433,0 days 00:00:00.903553,squared_error,27,sqrt,1,6,best,TPESampler,COMPLETE
1934,0.6456349183315407,2025-04-24 21:13:30.124089,2025-04-24 21:13:30.881578,0 days 00:00:00.757489,friedman_mse,32,sqrt,3,4,best,TPESampler,COMPLETE
1935,0.5289073941272342,2025-04-24 21:13:30.840205,2025-04-24 21:13:31.855395,0 days 00:00:01.015190,friedman_mse,31,sqrt,1,10,best,TPESampler,COMPLETE
1936,0.8737590921917946,2025-04-24 21:13:30.877448,2025-04-24 21:13:31.864964,0 days 00:00:00.987516,friedman_mse,32,sqrt,9,20,random,TPESampler,COMPLETE
1937,0.5407494611811223,2025-04-24 21:13:31.608400,2025-04-24 21:13:32.444183,0 days 00:00:00.835783,friedman_mse,19,sqrt,1,6,best,TPESampler,COMPLETE
1938,0.6504215924944643,2025-04-24 21:13:32.095813,2025-04-24 21:13:33.177272,0 days 00:00:01.081459,friedman_mse,26,sqrt,3,8,best,TPESampler,COMPLETE
1939,0.5373966342965538,2025-04-24 21:13:32.144992,2025-04-24 21:13:33.178817,0 days 00:00:01.033825,friedman_mse,29,sqrt,1,4,best,TPESampler,COMPLETE
1940,0.5724846347554697,2025-04-24 21:13:32.771850,2025-04-24 21:13:33.593122,0 days 00:00:00.821272,friedman_mse,30,sqrt,1,7,best,TPESampler,COMPLETE
1941,0.5975832321496914,2025-04-24 21:13:33.485481,2025-04-24 21:13:34.445389,0 days 00:00:00.959908,friedman_mse,33,sqrt,2,5,best,TPESampler,COMPLETE
1942,0.6456349183315407,2025-04-24 21:13:33.539775,2025-04-24 21:13:34.927480,0 days 00:00:01.387705,friedman_mse,35,sqrt,3,5,best,TPESampler,COMPLETE
1943,0.5868750603971733,2025-04-24 21:13:33.863546,2025-04-24 21:13:34.837034,0 days 00:00:00.973488,friedman_mse,35,sqrt,1,7,best,TPESampler,COMPLETE
1944,0.6180856799418332,2025-04-24 21:13:34.729070,2025-04-24 21:13:35.456728,0 days 00:00:00.727658,friedman_mse,25,sqrt,2,7,best,TPESampler,COMPLETE
1945,0.5623543669503079,2025-04-24 21:13:35.139541,2025-04-24 21:13:36.231628,0 days 00:00:01.092087,friedman_mse,30,sqrt,1,5,best,TPESampler,COMPLETE
1946,0.5202466614878716,2025-04-24 21:13:35.188476,2025-04-24 21:13:36.226107,0 days 00:00:01.037631,friedman_mse,29,sqrt,1,7,best,TPESampler,COMPLETE
1947,0.6132593524313702,2025-04-24 21:13:35.947940,2025-04-24 21:13:37.072512,0 days 00:00:01.124572,friedman_mse,28,log2,1,6,best,TPESampler,COMPLETE
1948,0.5327880009702136,2025-04-24 21:13:36.470132,2025-04-24 21:13:37.351747,0 days 00:00:00.881615,friedman_mse,26,sqrt,1,9,best,TPESampler,COMPLETE
1949,0.6265479990281826,2025-04-24 21:13:36.525182,2025-04-24 21:13:37.551311,0 days 00:00:01.026129,friedman_mse,31,sqrt,2,2,best,TPESampler,COMPLETE
1950,0.6504215924944643,2025-04-24 21:13:37.353096,2025-04-24 21:13:38.087433,0 days 00:00:00.734337,friedman_mse,28,sqrt,3,9,best,TPESampler,COMPLETE
1951,0.6456349183315407,2025-04-24 21:13:37.730043,2025-04-24 21:13:38.822236,0 days 00:00:01.092193,friedman_mse,24,sqrt,3,5,best,TPESampler,COMPLETE
1952,0.4750160173487102,2025-04-24 21:13:37.815772,2025-04-24 21:13:38.980460,0 days 00:00:01.164688,friedman_mse,32,sqrt,1,5,best,TPESampler,COMPLETE
1953,0.6504215924944643,2025-04-24 21:13:38.561819,2025-04-24 21:13:39.336211,0 days 00:00:00.774392,friedman_mse,34,sqrt,3,9,best,TPESampler,COMPLETE
1954,0.565032535793402,2025-04-24 21:13:39.242928,2025-04-24 21:13:40.252750,0 days 00:00:01.009822,friedman_mse,32,sqrt,1,9,best,TPESampler,COMPLETE
1955,0.5164170552722069,2025-04-24 21:13:39.291893,2025-04-24 21:13:40.341609,0 days 00:00:01.049716,friedman_mse,29,sqrt,1,8,best,TPESampler,COMPLETE
1956,0.5363240863117025,2025-04-24 21:13:39.582367,2025-04-24 21:13:40.646990,0 days 00:00:01.064623,friedman_mse,26,sqrt,1,4,best,TPESampler,COMPLETE
1957,0.6180856799418332,2025-04-24 21:13:40.608310,2025-04-24 21:13:41.467002,0 days 00:00:00.858692,friedman_mse,35,sqrt,2,7,best,TPESampler,COMPLETE
1958,0.4653938401437279,2025-04-24 21:13:40.651585,2025-04-24 21:13:41.722744,0 days 00:00:01.071159,friedman_mse,32,sqrt,1,4,best,TPESampler,COMPLETE
1959,0.46570797980588163,2025-04-24 21:13:40.899626,2025-04-24 21:13:41.849001,0 days 00:00:00.949375,friedman_mse,31,sqrt,1,7,best,TPESampler,COMPLETE
1960,0.5517493393728706,2025-04-24 21:13:41.775957,2025-04-24 21:13:42.765368,0 days 00:00:00.989411,friedman_mse,35,sqrt,1,4,best,TPESampler,COMPLETE
1961,0.5103145559958866,2025-04-24 21:13:41.969891,2025-04-24 21:13:43.100270,0 days 00:00:01.130379,friedman_mse,32,sqrt,1,3,best,TPESampler,COMPLETE
1962,0.5082425385680613,2025-04-24 21:13:42.160240,2025-04-24 21:13:43.242272,0 days 00:00:01.082032,friedman_mse,34,sqrt,1,2,best,TPESampler,COMPLETE
1963,0.8765168679441793,2025-04-24 21:13:43.042245,2025-04-24 21:13:43.881360,0 days 00:00:00.839115,squared_error,4,sqrt,4,4,best,TPESampler,COMPLETE
1964,0.5912941502828561,2025-04-24 21:13:43.415167,2025-04-24 21:13:44.501603,0 days 00:00:01.086436,friedman_mse,35,sqrt,1,5,best,TPESampler,COMPLETE
1965,0.6456349183315407,2025-04-24 21:13:43.503140,2025-04-24 21:13:44.499937,0 days 00:00:00.996797,friedman_mse,28,sqrt,3,3,best,TPESampler,COMPLETE
1966,0.5529688132197964,2025-04-24 21:13:44.197393,2025-04-24 21:13:44.988327,0 days 00:00:00.790934,friedman_mse,35,sqrt,1,2,best,TPESampler,COMPLETE
1967,0.5182225565736444,2025-04-24 21:13:44.738931,2025-04-24 21:13:45.828874,0 days 00:00:01.089943,friedman_mse,29,sqrt,1,3,best,TPESampler,COMPLETE
1968,0.5520453318079024,2025-04-24 21:13:44.783299,2025-04-24 21:13:45.835121,0 days 00:00:01.051822,friedman_mse,29,sqrt,1,2,best,TPESampler,COMPLETE
1969,0.8510024615078068,2025-04-24 21:13:45.357892,2025-04-24 21:13:46.436307,0 days 00:00:01.078415,friedman_mse,13,log2,2,11,random,TPESampler,COMPLETE
1970,0.5669493989992861,2025-04-24 21:13:46.032990,2025-04-24 21:13:46.881252,0 days 00:00:00.848262,squared_error,33,sqrt,1,5,best,TPESampler,COMPLETE
1971,0.6456349183315407,2025-04-24 21:13:46.116854,2025-04-24 21:13:47.340994,0 days 00:00:01.224140,friedman_mse,32,sqrt,3,3,best,TPESampler,COMPLETE
1972,0.6289323974475082,2025-04-24 21:13:46.816027,2025-04-24 21:13:47.766381,0 days 00:00:00.950354,friedman_mse,31,sqrt,2,10,best,TPESampler,COMPLETE
1973,0.5975832321496914,2025-04-24 21:13:47.210974,2025-04-24 21:13:48.161736,0 days 00:00:00.950762,friedman_mse,35,sqrt,2,5,best,TPESampler,COMPLETE
1974,0.5479322564786873,2025-04-24 21:13:47.713873,2025-04-24 21:13:48.607433,0 days 00:00:00.893560,friedman_mse,35,sqrt,1,6,best,TPESampler,COMPLETE
1975,0.5912941502828561,2025-04-24 21:13:48.038104,2025-04-24 21:13:48.952382,0 days 00:00:00.914278,friedman_mse,35,sqrt,1,5,best,TPESampler,COMPLETE
1976,0.6289323974475082,2025-04-24 21:13:48.470921,2025-04-24 21:13:49.430324,0 days 00:00:00.959403,friedman_mse,34,sqrt,2,10,best,TPESampler,COMPLETE
1977,0.6866568655157559,2025-04-24 21:13:48.914682,2025-04-24 21:13:49.882322,0 days 00:00:00.967640,squared_error,21,sqrt,2,2,random,TPESampler,COMPLETE
1978,0.5011731735894601,2025-04-24 21:13:49.261902,2025-04-24 21:13:50.158445,0 days 00:00:00.896543,friedman_mse,33,sqrt,1,8,best,TPESampler,COMPLETE
1979,0.6504215924944643,2025-04-24 21:13:49.838526,2025-04-24 21:13:50.793583,0 days 00:00:00.955057,friedman_mse,31,sqrt,3,8,best,TPESampler,COMPLETE
1980,0.5868750603971733,2025-04-24 21:13:50.151404,2025-04-24 21:13:51.150493,0 days 00:00:00.999089,friedman_mse,35,sqrt,1,7,best,TPESampler,COMPLETE
1981,0.6265479990281826,2025-04-24 21:13:50.553519,2025-04-24 21:13:51.489243,0 days 00:00:00.935724,friedman_mse,27,sqrt,2,4,best,TPESampler,COMPLETE
1982,0.6456349183315407,2025-04-24 21:13:51.146300,2025-04-24 21:13:52.093716,0 days 00:00:00.947416,squared_error,31,sqrt,3,5,best,TPESampler,COMPLETE
1983,0.6456349183315407,2025-04-24 21:13:51.497013,2025-04-24 21:13:52.408945,0 days 00:00:00.911932,friedman_mse,34,sqrt,3,2,best,TPESampler,COMPLETE
1984,0.74349522764793,2025-04-24 21:13:51.904280,2025-04-24 21:13:53.023736,0 days 00:00:01.119456,friedman_mse,35,log2,3,5,best,TPESampler,COMPLETE
1985,0.500848998379332,2025-04-24 21:13:52.351786,2025-04-24 21:13:53.242348,0 days 00:00:00.890562,friedman_mse,30,sqrt,1,2,best,TPESampler,COMPLETE
1986,0.4937530427079524,2025-04-24 21:13:52.711000,2025-04-24 21:13:53.547540,0 days 00:00:00.836540,friedman_mse,29,sqrt,1,11,best,TPESampler,COMPLETE
1987,0.5238282588318083,2025-04-24 21:13:53.360402,2025-04-24 21:13:54.348714,0 days 00:00:00.988312,squared_error,33,sqrt,1,2,best,TPESampler,COMPLETE
1988,0.6456349183315407,2025-04-24 21:13:53.504094,2025-04-24 21:13:54.574833,0 days 00:00:01.070739,friedman_mse,35,sqrt,3,6,best,TPESampler,COMPLETE
1989,0.6064691246415054,2025-04-24 21:13:53.817686,2025-04-24 21:13:54.982017,0 days 00:00:01.164331,friedman_mse,33,sqrt,2,4,random,TPESampler,COMPLETE
1990,0.49783262823116015,2025-04-24 21:13:54.638420,2025-04-24 21:13:55.617527,0 days 00:00:00.979107,friedman_mse,31,sqrt,1,5,best,TPESampler,COMPLETE
1991,0.46570797980588163,2025-04-24 21:13:54.850917,2025-04-24 21:13:55.803357,0 days 00:00:00.952440,friedman_mse,31,sqrt,1,7,best,TPESampler,COMPLETE
1992,0.4905008424568538,2025-04-24 21:13:55.279105,2025-04-24 21:13:56.105687,0 days 00:00:00.826582,friedman_mse,33,sqrt,1,9,best,TPESampler,COMPLETE
1993,0.5137879318052204,2025-04-24 21:13:55.836898,2025-04-24 21:13:56.758967,0 days 00:00:00.922069,friedman_mse,35,sqrt,1,10,best,TPESampler,COMPLETE
1994,0.6289323974475082,2025-04-24 21:13:56.101852,2025-04-24 21:13:57.142327,0 days 00:00:01.040475,friedman_mse,28,sqrt,2,9,best,TPESampler,COMPLETE
1995,0.5103041358943772,2025-04-24 21:13:56.455878,2025-04-24 21:13:57.556734,0 days 00:00:01.100856,friedman_mse,31,sqrt,1,9,best,TPESampler,COMPLETE
1996,0.6504215924944643,2025-04-24 21:13:57.173592,2025-04-24 21:13:58.211420,0 days 00:00:01.037828,friedman_mse,35,sqrt,3,9,best,TPESampler,COMPLETE
1997,0.6504215924944643,2025-04-24 21:13:57.419187,2025-04-24 21:13:58.412391,0 days 00:00:00.993204,friedman_mse,29,sqrt,3,9,best,TPESampler,COMPLETE
1998,0.5479322564786873,2025-04-24 21:13:57.867891,2025-04-24 21:13:58.767907,0 days 00:00:00.900016,friedman_mse,35,sqrt,1,6,best,TPESampler,COMPLETE
1999,0.5378330558023339,2025-04-24 21:13:58.501448,2025-04-24 21:13:59.669189,0 days 00:00:01.167741,friedman_mse,27,sqrt,1,9,best,TPESampler,COMPLETE
2000,0.5327880009702136,2025-04-24 21:13:58.702674,2025-04-24 21:13:59.575200,0 days 00:00:00.872526,friedman_mse,26,sqrt,1,9,best,TPESampler,COMPLETE
2001,0.49068441274037305,2025-04-24 21:13:59.304847,2025-04-24 21:14:00.435508,0 days 00:00:01.130661,friedman_mse,31,sqrt,1,6,best,TPESampler,COMPLETE
2002,0.5020512557327408,2025-04-24 21:13:59.840924,2025-04-24 21:14:00.690549,0 days 00:00:00.849625,friedman_mse,30,sqrt,1,8,best,TPESampler,COMPLETE
2003,0.5164170552722069,2025-04-24 21:13:59.958797,2025-04-24 21:14:01.345607,0 days 00:00:01.386810,squared_error,29,sqrt,1,8,best,TPESampler,COMPLETE
