number,value,datetime_start,datetime_complete,duration,params_criterion,params_max_depth,params_max_features,params_min_samples_leaf,params_min_samples_split,params_splitter,system_attrs_auto:sampler,state
715,0.6086598638338473,2025-04-24 21:04:58.962568,2025-04-24 21:04:59.742920,0 days 00:00:00.780352,absolute_error,35,sqrt,3,12,best,TPESampler,COMPLETE
716,0.9015251732962958,2025-04-24 21:04:59.111609,2025-04-24 21:04:59.898634,0 days 00:00:00.787025,absolute_error,16,log2,9,15,best,TPESampler,COMPLETE
717,0.5747109292962755,2025-04-24 21:04:59.456324,2025-04-24 21:05:00.262431,0 days 00:00:00.806107,absolute_error,28,sqrt,2,9,best,TPESampler,COMPLETE
718,0.7195854047999368,2025-04-24 21:04:59.968274,2025-04-24 21:05:00.915509,0 days 00:00:00.947235,absolute_error,34,log2,2,3,best,TPESampler,COMPLETE
719,0.6205015395984244,2025-04-24 21:05:00.141834,2025-04-24 21:05:01.078203,0 days 00:00:00.936369,friedman_mse,27,sqrt,1,7,random,TPESampler,COMPLETE
720,0.8887937791095064,2025-04-24 21:05:00.567322,2025-04-24 21:05:01.385577,0 days 00:00:00.818255,friedman_mse,2,log2,5,7,best,TPESampler,COMPLETE
721,0.5934160425725776,2025-04-24 21:05:01.145106,2025-04-24 21:05:01.895147,0 days 00:00:00.750041,absolute_error,35,sqrt,2,10,best,TPESampler,COMPLETE
722,0.5779499868560559,2025-04-24 21:05:01.395926,2025-04-24 21:05:02.241851,0 days 00:00:00.845925,absolute_error,21,sqrt,1,7,best,TPESampler,COMPLETE
723,0.482024331116523,2025-04-24 21:05:01.768201,2025-04-24 21:05:02.615061,0 days 00:00:00.846860,absolute_error,35,sqrt,1,9,best,TPESampler,COMPLETE
724,0.6515872609760095,2025-04-24 21:05:02.139566,2025-04-24 21:05:02.809009,0 days 00:00:00.669443,friedman_mse,29,sqrt,2,6,best,TPESampler,COMPLETE
725,0.5975832321496914,2025-04-24 21:05:02.565672,2025-04-24 21:05:03.357548,0 days 00:00:00.791876,friedman_mse,27,sqrt,2,5,best,TPESampler,COMPLETE
726,0.5226166766745245,2025-04-24 21:05:02.894861,2025-04-24 21:05:03.733749,0 days 00:00:00.838888,absolute_error,28,sqrt,1,7,best,TPESampler,COMPLETE
727,0.8882159335097272,2025-04-24 21:05:03.088801,2025-04-24 21:05:04.144674,0 days 00:00:01.055873,squared_error,2,sqrt,1,18,random,TPESampler,COMPLETE
728,0.4653938401437279,2025-04-24 21:05:03.678978,2025-04-24 21:05:04.461396,0 days 00:00:00.782418,friedman_mse,32,sqrt,1,4,best,TPESampler,COMPLETE
729,0.5164170552722069,2025-04-24 21:05:03.995099,2025-04-24 21:05:04.918325,0 days 00:00:00.923226,friedman_mse,29,sqrt,1,8,best,TPESampler,COMPLETE
730,0.5517493393728706,2025-04-24 21:05:04.409070,2025-04-24 21:05:05.278310,0 days 00:00:00.869240,friedman_mse,35,sqrt,1,4,best,TPESampler,COMPLETE
731,0.5975832321496914,2025-04-24 21:05:04.700383,2025-04-24 21:05:05.510910,0 days 00:00:00.810527,friedman_mse,35,sqrt,2,5,best,TPESampler,COMPLETE
732,0.48333612106664076,2025-04-24 21:05:05.309146,2025-04-24 21:05:06.234822,0 days 00:00:00.925676,friedman_mse,31,sqrt,1,4,best,TPESampler,COMPLETE
733,0.500848998379332,2025-04-24 21:05:05.568812,2025-04-24 21:05:06.731122,0 days 00:00:01.162310,friedman_mse,30,sqrt,1,2,best,TPESampler,COMPLETE
734,0.6456349183315407,2025-04-24 21:05:05.756394,2025-04-24 21:05:07.151076,0 days 00:00:01.394682,friedman_mse,35,sqrt,3,7,best,TPESampler,COMPLETE
735,0.5912941502828561,2025-04-24 21:05:06.729602,2025-04-24 21:05:07.557421,0 days 00:00:00.827819,friedman_mse,35,sqrt,1,5,best,TPESampler,COMPLETE
736,0.5868750603971733,2025-04-24 21:05:07.113730,2025-04-24 21:05:07.856160,0 days 00:00:00.742430,friedman_mse,35,sqrt,1,7,best,TPESampler,COMPLETE
737,0.47692047149238787,2025-04-24 21:05:07.407402,2025-04-24 21:05:08.157010,0 days 00:00:00.749608,friedman_mse,27,sqrt,1,3,best,TPESampler,COMPLETE
738,0.5164242646936524,2025-04-24 21:05:07.857361,2025-04-24 21:05:08.804831,0 days 00:00:00.947470,friedman_mse,26,sqrt,1,3,best,TPESampler,COMPLETE
739,0.5546449879220828,2025-04-24 21:05:08.099457,2025-04-24 21:05:08.953607,0 days 00:00:00.854150,friedman_mse,24,sqrt,1,2,best,TPESampler,COMPLETE
740,0.5593525150541101,2025-04-24 21:05:08.386910,2025-04-24 21:05:09.234019,0 days 00:00:00.847109,friedman_mse,30,sqrt,1,4,best,TPESampler,COMPLETE
741,0.6456349183315407,2025-04-24 21:05:09.131604,2025-04-24 21:05:09.948966,0 days 00:00:00.817362,friedman_mse,21,sqrt,3,6,best,TPESampler,COMPLETE
742,0.5253868360947686,2025-04-24 21:05:09.192578,2025-04-24 21:05:10.165885,0 days 00:00:00.973307,friedman_mse,27,sqrt,1,4,best,TPESampler,COMPLETE
743,0.7311891364188057,2025-04-24 21:05:09.440136,2025-04-24 21:05:10.266256,0 days 00:00:00.826120,friedman_mse,35,log2,2,5,best,TPESampler,COMPLETE
744,0.6456349183315407,2025-04-24 21:05:10.224887,2025-04-24 21:05:11.058551,0 days 00:00:00.833664,friedman_mse,27,sqrt,3,2,best,TPESampler,COMPLETE
745,0.878930627702796,2025-04-24 21:05:10.405985,2025-04-24 21:05:11.252138,0 days 00:00:00.846153,squared_error,35,log2,6,9,random,TPESampler,COMPLETE
746,0.5619714929648851,2025-04-24 21:05:10.622224,2025-04-24 21:05:11.461320,0 days 00:00:00.839096,friedman_mse,23,sqrt,1,4,best,TPESampler,COMPLETE
747,0.47692047149238787,2025-04-24 21:05:11.304272,2025-04-24 21:05:11.932318,0 days 00:00:00.628046,friedman_mse,27,sqrt,1,3,best,TPESampler,COMPLETE
748,0.878930627702796,2025-04-24 21:05:11.534122,2025-04-24 21:05:12.456657,0 days 00:00:00.922535,squared_error,15,log2,5,2,random,TPESampler,COMPLETE
749,0.5649798198408362,2025-04-24 21:05:11.893086,2025-04-24 21:05:12.649687,0 days 00:00:00.756601,friedman_mse,25,sqrt,1,3,best,TPESampler,COMPLETE
750,0.9018784399194749,2025-04-24 21:05:12.217012,2025-04-24 21:05:13.149539,0 days 00:00:00.932527,squared_error,11,log2,10,10,random,TPESampler,COMPLETE
751,0.6265479990281826,2025-04-24 21:05:12.729777,2025-04-24 21:05:13.738409,0 days 00:00:01.008632,friedman_mse,26,sqrt,2,4,best,TPESampler,COMPLETE
752,0.7677481737213557,2025-04-24 21:05:12.891155,2025-04-24 21:05:14.152213,0 days 00:00:01.261058,absolute_error,35,log2,1,7,random,TPESampler,COMPLETE
753,0.7075910860518516,2025-04-24 21:05:13.733668,2025-04-24 21:05:14.690432,0 days 00:00:00.956764,friedman_mse,29,log2,1,8,random,TPESampler,COMPLETE
754,0.6456349183315407,2025-04-24 21:05:14.104822,2025-04-24 21:05:15.397456,0 days 00:00:01.292634,friedman_mse,27,sqrt,3,2,best,TPESampler,COMPLETE
755,0.5363240863117025,2025-04-24 21:05:14.645034,2025-04-24 21:05:15.995659,0 days 00:00:01.350625,friedman_mse,26,sqrt,1,4,best,TPESampler,COMPLETE
756,0.6707881621244689,2025-04-24 21:05:15.119372,2025-04-24 21:05:16.558248,0 days 00:00:01.438876,friedman_mse,13,sqrt,2,2,best,TPESampler,COMPLETE
757,0.6265479990281826,2025-04-24 21:05:15.885118,2025-04-24 21:05:17.019286,0 days 00:00:01.134168,friedman_mse,32,sqrt,2,2,best,TPESampler,COMPLETE
758,0.5593525150541101,2025-04-24 21:05:16.476839,2025-04-24 21:05:17.389541,0 days 00:00:00.912702,friedman_mse,30,sqrt,1,4,best,TPESampler,COMPLETE
759,0.5164242646936524,2025-04-24 21:05:16.836262,2025-04-24 21:05:17.586630,0 days 00:00:00.750368,friedman_mse,26,sqrt,1,3,best,TPESampler,COMPLETE
760,0.677601910099337,2025-04-24 21:05:17.320005,2025-04-24 21:05:18.171118,0 days 00:00:00.851113,friedman_mse,20,sqrt,3,2,random,TPESampler,COMPLETE
761,0.5518815421255675,2025-04-24 21:05:17.679560,2025-04-24 21:05:18.582150,0 days 00:00:00.902590,friedman_mse,25,sqrt,1,6,best,TPESampler,COMPLETE
762,0.5703619271313644,2025-04-24 21:05:17.995548,2025-04-24 21:05:18.793959,0 days 00:00:00.798411,friedman_mse,31,sqrt,1,3,best,TPESampler,COMPLETE
763,0.8949707845327863,2025-04-24 21:05:18.501388,2025-04-24 21:05:19.248671,0 days 00:00:00.747283,squared_error,2,sqrt,10,14,best,TPESampler,COMPLETE
764,0.6456349183315407,2025-04-24 21:05:18.865294,2025-04-24 21:05:19.816913,0 days 00:00:00.951619,friedman_mse,26,sqrt,3,6,best,TPESampler,COMPLETE
765,0.6456349183315407,2025-04-24 21:05:19.023915,2025-04-24 21:05:19.943144,0 days 00:00:00.919229,friedman_mse,25,sqrt,3,7,best,TPESampler,COMPLETE
766,0.5503039019834799,2025-04-24 21:05:19.633673,2025-04-24 21:05:20.402156,0 days 00:00:00.768483,friedman_mse,28,sqrt,1,3,best,TPESampler,COMPLETE
767,0.6456349183315407,2025-04-24 21:05:20.085139,2025-04-24 21:05:20.922531,0 days 00:00:00.837392,friedman_mse,31,sqrt,3,4,best,TPESampler,COMPLETE
768,0.5202466614878716,2025-04-24 21:05:20.264297,2025-04-24 21:05:21.092729,0 days 00:00:00.828432,friedman_mse,29,sqrt,1,7,best,TPESampler,COMPLETE
769,0.5238282588318083,2025-04-24 21:05:20.693188,2025-04-24 21:05:21.389530,0 days 00:00:00.696342,friedman_mse,33,sqrt,1,2,best,TPESampler,COMPLETE
770,0.5540979794176473,2025-04-24 21:05:21.161292,2025-04-24 21:05:21.919467,0 days 00:00:00.758175,friedman_mse,23,sqrt,1,6,best,TPESampler,COMPLETE
771,0.90157797490464,2025-04-24 21:05:21.351089,2025-04-24 21:05:22.259970,0 days 00:00:00.908881,friedman_mse,32,log2,6,15,best,TPESampler,COMPLETE
772,0.8737590921917946,2025-04-24 21:05:21.615520,2025-04-24 21:05:22.655807,0 days 00:00:01.040287,friedman_mse,13,sqrt,8,6,random,TPESampler,COMPLETE
773,0.6132593524313702,2025-04-24 21:05:22.205342,2025-04-24 21:05:23.005388,0 days 00:00:00.800046,friedman_mse,28,log2,1,6,best,TPESampler,COMPLETE
774,0.5296855957806621,2025-04-24 21:05:22.562966,2025-04-24 21:05:23.563434,0 days 00:00:01.000468,friedman_mse,26,sqrt,1,8,best,TPESampler,COMPLETE
775,0.9018784399194749,2025-04-24 21:05:23.012377,2025-04-24 21:05:23.733939,0 days 00:00:00.721562,friedman_mse,35,log2,9,18,random,TPESampler,COMPLETE
776,0.47245231313348,2025-04-24 21:05:23.302516,2025-04-24 21:05:23.999082,0 days 00:00:00.696566,friedman_mse,30,sqrt,1,6,best,TPESampler,COMPLETE
777,0.6456349183315407,2025-04-24 21:05:23.840397,2025-04-24 21:05:24.516349,0 days 00:00:00.675952,friedman_mse,30,sqrt,3,6,best,TPESampler,COMPLETE
778,0.5623543669503079,2025-04-24 21:05:23.959588,2025-04-24 21:05:24.842355,0 days 00:00:00.882767,friedman_mse,30,sqrt,1,5,best,TPESampler,COMPLETE
779,0.5081175596164936,2025-04-24 21:05:24.221928,2025-04-24 21:05:25.028110,0 days 00:00:00.806182,friedman_mse,28,sqrt,1,5,best,TPESampler,COMPLETE
780,0.5298778451782702,2025-04-24 21:05:24.840898,2025-04-24 21:05:25.811523,0 days 00:00:00.970625,friedman_mse,32,sqrt,1,7,best,TPESampler,COMPLETE
781,0.4831415131013947,2025-04-24 21:05:25.154202,2025-04-24 21:05:25.992204,0 days 00:00:00.838002,friedman_mse,31,sqrt,1,8,best,TPESampler,COMPLETE
782,0.4868744820818364,2025-04-24 21:05:25.210397,2025-04-24 21:05:26.120655,0 days 00:00:00.910258,friedman_mse,27,sqrt,1,6,best,TPESampler,COMPLETE
783,0.878930627702796,2025-04-24 21:05:26.040635,2025-04-24 21:05:26.665020,0 days 00:00:00.624385,friedman_mse,9,log2,5,3,random,TPESampler,COMPLETE
784,0.6504215924944643,2025-04-24 21:05:26.221352,2025-04-24 21:05:27.113692,0 days 00:00:00.892340,friedman_mse,32,sqrt,3,9,best,TPESampler,COMPLETE
785,0.6456349183315407,2025-04-24 21:05:26.600605,2025-04-24 21:05:27.486730,0 days 00:00:00.886125,friedman_mse,32,sqrt,3,5,best,TPESampler,COMPLETE
786,0.6263537246776679,2025-04-24 21:05:26.959320,2025-04-24 21:05:27.724276,0 days 00:00:00.764956,friedman_mse,26,log2,1,12,best,TPESampler,COMPLETE
787,0.6504215924944643,2025-04-24 21:05:27.420621,2025-04-24 21:05:28.187534,0 days 00:00:00.766913,squared_error,29,sqrt,3,8,best,TPESampler,COMPLETE
788,0.49068441274037305,2025-04-24 21:05:27.830983,2025-04-24 21:05:28.620746,0 days 00:00:00.789763,friedman_mse,31,sqrt,1,6,best,TPESampler,COMPLETE
789,0.5724846347554697,2025-04-24 21:05:27.991309,2025-04-24 21:05:28.932348,0 days 00:00:00.941039,friedman_mse,30,sqrt,1,7,best,TPESampler,COMPLETE
790,0.6265479990281826,2025-04-24 21:05:28.445518,2025-04-24 21:05:29.308272,0 days 00:00:00.862754,friedman_mse,28,sqrt,2,2,best,TPESampler,COMPLETE
791,0.500848998379332,2025-04-24 21:05:28.857402,2025-04-24 21:05:29.758264,0 days 00:00:00.900862,friedman_mse,30,sqrt,1,2,best,TPESampler,COMPLETE
792,0.5230033993372178,2025-04-24 21:05:29.262974,2025-04-24 21:05:30.298769,0 days 00:00:01.035795,friedman_mse,24,sqrt,1,7,best,TPESampler,COMPLETE
793,0.8929076253830125,2025-04-24 21:05:29.698088,2025-04-24 21:05:30.514021,0 days 00:00:00.815933,squared_error,1,log2,4,4,best,TPESampler,COMPLETE
794,0.6016941067360192,2025-04-24 21:05:30.017932,2025-04-24 21:05:30.835240,0 days 00:00:00.817308,friedman_mse,22,sqrt,3,12,best,TPESampler,COMPLETE
795,0.69351465341836,2025-04-24 21:05:30.581419,2025-04-24 21:05:31.721022,0 days 00:00:01.139603,squared_error,20,sqrt,6,6,best,TPESampler,COMPLETE
796,0.5669493989992861,2025-04-24 21:05:30.773141,2025-04-24 21:05:31.636281,0 days 00:00:00.863140,friedman_mse,33,sqrt,1,5,best,TPESampler,COMPLETE
797,0.6456349183315407,2025-04-24 21:05:31.085802,2025-04-24 21:05:31.996829,0 days 00:00:00.911027,friedman_mse,28,sqrt,3,6,best,TPESampler,COMPLETE
798,0.8790475103328365,2025-04-24 21:05:31.909035,2025-04-24 21:05:33.059475,0 days 00:00:01.150440,absolute_error,22,log2,7,20,random,TPESampler,COMPLETE
799,0.534238624328626,2025-04-24 21:05:31.957914,2025-04-24 21:05:33.259866,0 days 00:00:01.301952,friedman_mse,20,sqrt,1,4,best,TPESampler,COMPLETE
800,0.6456349183315407,2025-04-24 21:05:32.276063,2025-04-24 21:05:33.258603,0 days 00:00:00.982540,friedman_mse,35,sqrt,3,2,best,TPESampler,COMPLETE
801,0.5081175596164936,2025-04-24 21:05:33.426612,2025-04-24 21:05:34.204738,0 days 00:00:00.778126,friedman_mse,28,sqrt,1,5,best,TPESampler,COMPLETE
802,0.7001426564128769,2025-04-24 21:05:33.459009,2025-04-24 21:05:34.431422,0 days 00:00:00.972413,friedman_mse,13,sqrt,10,20,best,TPESampler,COMPLETE
803,0.4841824780964295,2025-04-24 21:05:33.436788,2025-04-24 21:05:34.526393,0 days 00:00:01.089605,squared_error,25,sqrt,1,5,best,TPESampler,COMPLETE
804,0.5912941502828561,2025-04-24 21:05:34.461578,2025-04-24 21:05:35.201484,0 days 00:00:00.739906,friedman_mse,35,sqrt,1,5,best,TPESampler,COMPLETE
805,0.5517493393728706,2025-04-24 21:05:34.682073,2025-04-24 21:05:35.547540,0 days 00:00:00.865467,squared_error,35,sqrt,1,4,best,TPESampler,COMPLETE
806,0.49912878166750996,2025-04-24 21:05:34.883295,2025-04-24 21:05:35.765347,0 days 00:00:00.882052,friedman_mse,28,sqrt,1,7,best,TPESampler,COMPLETE
807,0.5387126777455866,2025-04-24 21:05:35.480168,2025-04-24 21:05:36.177181,0 days 00:00:00.697013,friedman_mse,28,sqrt,1,10,best,TPESampler,COMPLETE
808,0.8767756438403109,2025-04-24 21:05:35.852972,2025-04-24 21:05:36.715505,0 days 00:00:00.862533,absolute_error,7,sqrt,6,9,random,TPESampler,COMPLETE
809,0.7193630248088626,2025-04-24 21:05:36.049313,2025-04-24 21:05:36.927673,0 days 00:00:00.878360,friedman_mse,16,sqrt,5,20,best,TPESampler,COMPLETE
810,0.5504084310743447,2025-04-24 21:05:36.405237,2025-04-24 21:05:37.265981,0 days 00:00:00.860744,squared_error,35,sqrt,1,12,best,TPESampler,COMPLETE
811,0.6250972924297038,2025-04-24 21:05:37.025034,2025-04-24 21:05:37.867679,0 days 00:00:00.842645,friedman_mse,28,log2,1,3,best,TPESampler,COMPLETE
812,0.5513554337953424,2025-04-24 21:05:37.169791,2025-04-24 21:05:38.016248,0 days 00:00:00.846457,friedman_mse,27,sqrt,1,5,best,TPESampler,COMPLETE
813,0.648429191285751,2025-04-24 21:05:37.515195,2025-04-24 21:05:38.368104,0 days 00:00:00.852909,squared_error,27,sqrt,3,8,random,TPESampler,COMPLETE
814,0.6456349183315407,2025-04-24 21:05:38.101544,2025-04-24 21:05:38.883916,0 days 00:00:00.782372,friedman_mse,29,sqrt,3,5,best,TPESampler,COMPLETE
815,0.6295044658566773,2025-04-24 21:05:38.306941,2025-04-24 21:05:39.128321,0 days 00:00:00.821380,friedman_mse,25,sqrt,1,4,random,TPESampler,COMPLETE
816,0.6225845856267994,2025-04-24 21:05:38.812177,2025-04-24 21:05:39.432525,0 days 00:00:00.620348,friedman_mse,31,sqrt,3,6,random,TPESampler,COMPLETE
817,0.49068441274037305,2025-04-24 21:05:39.175817,2025-04-24 21:05:39.956801,0 days 00:00:00.780984,friedman_mse,31,sqrt,1,6,best,TPESampler,COMPLETE
818,0.6504215924944643,2025-04-24 21:05:39.384240,2025-04-24 21:05:40.330809,0 days 00:00:00.946569,friedman_mse,27,sqrt,3,9,best,TPESampler,COMPLETE
819,0.8519460571114881,2025-04-24 21:05:39.649478,2025-04-24 21:05:40.469304,0 days 00:00:00.819826,friedman_mse,17,log2,2,16,random,TPESampler,COMPLETE
820,0.5082425385680613,2025-04-24 21:05:40.274205,2025-04-24 21:05:41.012087,0 days 00:00:00.737882,friedman_mse,34,sqrt,1,2,best,TPESampler,COMPLETE
821,0.5185211704314117,2025-04-24 21:05:40.557179,2025-04-24 21:05:41.380107,0 days 00:00:00.822928,friedman_mse,30,sqrt,1,10,best,TPESampler,COMPLETE
822,0.5373966342965538,2025-04-24 21:05:40.829591,2025-04-24 21:05:41.729358,0 days 00:00:00.899767,friedman_mse,29,sqrt,1,4,best,TPESampler,COMPLETE
823,0.4962324084473796,2025-04-24 21:05:41.260807,2025-04-24 21:05:41.962053,0 days 00:00:00.701246,friedman_mse,29,sqrt,1,6,best,TPESampler,COMPLETE
824,0.6265479990281826,2025-04-24 21:05:41.677297,2025-04-24 21:05:42.478395,0 days 00:00:00.801098,friedman_mse,23,sqrt,2,3,best,TPESampler,COMPLETE
825,0.5182225565736444,2025-04-24 21:05:42.041551,2025-04-24 21:05:42.854145,0 days 00:00:00.812594,friedman_mse,29,sqrt,1,3,best,TPESampler,COMPLETE
826,0.5868750603971733,2025-04-24 21:05:42.218688,2025-04-24 21:05:43.409724,0 days 00:00:01.191036,friedman_mse,35,sqrt,1,7,best,TPESampler,COMPLETE
827,0.5421737802524879,2025-04-24 21:05:42.855486,2025-04-24 21:05:43.666428,0 days 00:00:00.810942,friedman_mse,21,sqrt,1,8,best,TPESampler,COMPLETE
828,0.6515872609760095,2025-04-24 21:05:43.164017,2025-04-24 21:05:43.965340,0 days 00:00:00.801323,friedman_mse,28,sqrt,2,6,best,TPESampler,COMPLETE
829,0.6456349183315407,2025-04-24 21:05:43.667637,2025-04-24 21:05:44.562459,0 days 00:00:00.894822,friedman_mse,29,sqrt,3,4,best,TPESampler,COMPLETE
830,0.5520453318079024,2025-04-24 21:05:43.898114,2025-04-24 21:05:44.677934,0 days 00:00:00.779820,friedman_mse,29,sqrt,1,2,best,TPESampler,COMPLETE
831,0.6504215924944643,2025-04-24 21:05:44.248098,2025-04-24 21:05:45.139344,0 days 00:00:00.891246,friedman_mse,33,sqrt,3,9,best,TPESampler,COMPLETE
832,0.9015251732962958,2025-04-24 21:05:44.821795,2025-04-24 21:05:45.618619,0 days 00:00:00.796824,absolute_error,5,log2,10,8,best,TPESampler,COMPLETE
833,0.4841824780964295,2025-04-24 21:05:44.996216,2025-04-24 21:05:45.918678,0 days 00:00:00.922462,friedman_mse,25,sqrt,1,5,best,TPESampler,COMPLETE
834,0.8737590921917946,2025-04-24 21:05:45.414103,2025-04-24 21:05:46.446355,0 days 00:00:01.032252,squared_error,17,sqrt,10,8,random,TPESampler,COMPLETE
835,0.5114477233942855,2025-04-24 21:05:45.911529,2025-04-24 21:05:46.644546,0 days 00:00:00.733017,friedman_mse,28,sqrt,1,8,best,TPESampler,COMPLETE
836,0.5623543669503079,2025-04-24 21:05:46.197031,2025-04-24 21:05:47.182497,0 days 00:00:00.985466,friedman_mse,30,sqrt,1,5,best,TPESampler,COMPLETE
837,0.5780937309636404,2025-04-24 21:05:46.695876,2025-04-24 21:05:47.384913,0 days 00:00:00.689037,friedman_mse,23,sqrt,1,2,best,TPESampler,COMPLETE
838,0.6456349183315407,2025-04-24 21:05:46.954924,2025-04-24 21:05:47.723227,0 days 00:00:00.768303,friedman_mse,34,sqrt,3,5,best,TPESampler,COMPLETE
839,0.6861911563373202,2025-04-24 21:05:47.448791,2025-04-24 21:05:48.311246,0 days 00:00:00.862455,squared_error,25,sqrt,9,9,best,TPESampler,COMPLETE
840,0.6456349183315407,2025-04-24 21:05:47.666280,2025-04-24 21:05:48.461909,0 days 00:00:00.795629,friedman_mse,24,sqrt,3,6,best,TPESampler,COMPLETE
841,0.496257590485042,2025-04-24 21:05:47.981220,2025-04-24 21:05:48.757792,0 days 00:00:00.776572,friedman_mse,34,sqrt,1,4,best,TPESampler,COMPLETE
842,0.5724846347554697,2025-04-24 21:05:48.624904,2025-04-24 21:05:49.660197,0 days 00:00:01.035293,friedman_mse,30,sqrt,1,7,best,TPESampler,COMPLETE
843,0.5298778451782702,2025-04-24 21:05:48.691439,2025-04-24 21:05:49.791062,0 days 00:00:01.099623,friedman_mse,32,sqrt,1,7,best,TPESampler,COMPLETE
844,0.6137680826708861,2025-04-24 21:05:49.323129,2025-04-24 21:05:50.100122,0 days 00:00:00.776993,friedman_mse,27,sqrt,2,20,best,TPESampler,COMPLETE
845,0.5037849405969599,2025-04-24 21:05:49.974829,2025-04-24 21:05:50.883011,0 days 00:00:00.908182,friedman_mse,26,sqrt,1,6,best,TPESampler,COMPLETE
846,0.520119086586278,2025-04-24 21:05:50.047085,2025-04-24 21:05:50.940042,0 days 00:00:00.892957,friedman_mse,22,sqrt,1,7,best,TPESampler,COMPLETE
847,0.6289323974475082,2025-04-24 21:05:50.587792,2025-04-24 21:05:51.406038,0 days 00:00:00.818246,squared_error,30,sqrt,2,9,best,TPESampler,COMPLETE
848,0.5640872207266376,2025-04-24 21:05:51.060746,2025-04-24 21:05:51.842762,0 days 00:00:00.782016,friedman_mse,28,sqrt,1,2,best,TPESampler,COMPLETE
849,0.49068441274037305,2025-04-24 21:05:51.203916,2025-04-24 21:05:52.056189,0 days 00:00:00.852273,friedman_mse,31,sqrt,1,6,best,TPESampler,COMPLETE
850,0.5872571009690963,2025-04-24 21:05:51.747456,2025-04-24 21:05:52.535129,0 days 00:00:00.787673,friedman_mse,32,sqrt,1,5,random,TPESampler,COMPLETE
851,0.500848998379332,2025-04-24 21:05:52.096601,2025-04-24 21:05:53.002954,0 days 00:00:00.906353,squared_error,30,sqrt,1,2,best,TPESampler,COMPLETE
852,0.6456349183315407,2025-04-24 21:05:52.352747,2025-04-24 21:05:53.256153,0 days 00:00:00.903406,friedman_mse,31,sqrt,3,7,best,TPESampler,COMPLETE
853,0.5479322564786873,2025-04-24 21:05:52.779906,2025-04-24 21:05:53.652362,0 days 00:00:00.872456,friedman_mse,35,sqrt,1,6,best,TPESampler,COMPLETE
854,0.5524006536474168,2025-04-24 21:05:53.311137,2025-04-24 21:05:54.197446,0 days 00:00:00.886309,friedman_mse,32,sqrt,1,10,best,TPESampler,COMPLETE
855,0.90157797490464,2025-04-24 21:05:53.521948,2025-04-24 21:05:54.381662,0 days 00:00:00.859714,friedman_mse,15,log2,9,20,best,TPESampler,COMPLETE
856,0.5529688132197964,2025-04-24 21:05:53.870285,2025-04-24 21:05:54.725120,0 days 00:00:00.854835,friedman_mse,35,sqrt,1,2,best,TPESampler,COMPLETE
857,0.5975832321496914,2025-04-24 21:05:54.440334,2025-04-24 21:05:55.544603,0 days 00:00:01.104269,friedman_mse,28,sqrt,2,5,best,TPESampler,COMPLETE
858,0.4868744820818364,2025-04-24 21:05:54.682355,2025-04-24 21:05:55.425986,0 days 00:00:00.743631,friedman_mse,27,sqrt,1,6,best,TPESampler,COMPLETE
