number,value,datetime_start,datetime_complete,duration,params_criterion,params_max_depth,params_max_features,params_min_samples_leaf,params_min_samples_split,params_splitter,system_attrs_auto:sampler,state
1575,0.7221791327231009,2025-04-24 21:10:49.596906,2025-04-24 21:10:50.527038,0 days 00:00:00.930132,friedman_mse,31,log2,2,7,best,TPESampler,COMPLETE
1576,0.6504215924944643,2025-04-24 21:10:49.991333,2025-04-24 21:10:51.090962,0 days 00:00:01.099629,friedman_mse,34,sqrt,3,8,best,TPESampler,COMPLETE
1577,0.552540576623951,2025-04-24 21:10:50.516292,2025-04-24 21:10:51.538598,0 days 00:00:01.022306,friedman_mse,35,log2,1,3,best,TPESampler,COMPLETE
1578,0.5129971695350808,2025-04-24 21:10:51.047904,2025-04-24 21:10:51.828993,0 days 00:00:00.781089,friedman_mse,30,sqrt,1,9,best,TPESampler,COMPLETE
1579,0.5479322564786873,2025-04-24 21:10:51.353054,2025-04-24 21:10:52.366671,0 days 00:00:01.013617,friedman_mse,35,sqrt,1,6,best,TPESampler,COMPLETE
1580,0.48350783172535233,2025-04-24 21:10:51.793583,2025-04-24 21:10:52.622559,0 days 00:00:00.828976,friedman_mse,34,sqrt,1,7,best,TPESampler,COMPLETE
1581,0.6504215924944643,2025-04-24 21:10:52.062940,2025-04-24 21:10:53.218868,0 days 00:00:01.155928,friedman_mse,27,sqrt,3,8,best,TPESampler,COMPLETE
1582,0.6456349183315407,2025-04-24 21:10:52.688399,2025-04-24 21:10:53.499920,0 days 00:00:00.811521,friedman_mse,27,sqrt,3,5,best,TPESampler,COMPLETE
1583,0.5665100312998601,2025-04-24 21:10:52.981413,2025-04-24 21:10:53.874641,0 days 00:00:00.893228,squared_error,33,log2,1,3,best,TPESampler,COMPLETE
1584,0.48333612106664076,2025-04-24 21:10:53.503079,2025-04-24 21:10:54.457677,0 days 00:00:00.954598,squared_error,31,sqrt,1,4,best,TPESampler,COMPLETE
1585,0.6289323974475082,2025-04-24 21:10:53.862313,2025-04-24 21:10:54.648243,0 days 00:00:00.785930,friedman_mse,29,sqrt,2,9,best,TPESampler,COMPLETE
1586,0.4653938401437279,2025-04-24 21:10:54.168651,2025-04-24 21:10:54.877087,0 days 00:00:00.708436,friedman_mse,32,sqrt,1,4,best,TPESampler,COMPLETE
1587,0.5219928786672743,2025-04-24 21:10:54.835969,2025-04-24 21:10:55.532519,0 days 00:00:00.696550,friedman_mse,33,sqrt,1,4,best,TPESampler,COMPLETE
1588,0.500848998379332,2025-04-24 21:10:55.193756,2025-04-24 21:10:56.379205,0 days 00:00:01.185449,friedman_mse,30,sqrt,1,2,best,TPESampler,COMPLETE
1589,0.4653938401437279,2025-04-24 21:10:55.263055,2025-04-24 21:10:56.377726,0 days 00:00:01.114671,friedman_mse,32,sqrt,1,4,best,TPESampler,COMPLETE
1590,0.6265479990281826,2025-04-24 21:10:55.874720,2025-04-24 21:10:56.672833,0 days 00:00:00.798113,friedman_mse,35,sqrt,2,4,best,TPESampler,COMPLETE
1591,0.5082425385680613,2025-04-24 21:10:56.625284,2025-04-24 21:10:57.355347,0 days 00:00:00.730063,friedman_mse,34,sqrt,1,2,best,TPESampler,COMPLETE
1592,0.6456349183315407,2025-04-24 21:10:56.850369,2025-04-24 21:10:57.723584,0 days 00:00:00.873215,friedman_mse,28,sqrt,3,4,best,TPESampler,COMPLETE
1593,0.6265479990281826,2025-04-24 21:10:57.008188,2025-04-24 21:10:58.333998,0 days 00:00:01.325810,friedman_mse,29,sqrt,2,2,best,TPESampler,COMPLETE
1594,0.5469433296825841,2025-04-24 21:10:57.715391,2025-04-24 21:10:58.551671,0 days 00:00:00.836280,squared_error,35,sqrt,1,3,best,TPESampler,COMPLETE
1595,0.5703619271313644,2025-04-24 21:10:58.026962,2025-04-24 21:10:58.882467,0 days 00:00:00.855505,friedman_mse,31,sqrt,1,3,best,TPESampler,COMPLETE
1596,0.49321865056844255,2025-04-24 21:10:58.731710,2025-04-24 21:10:59.578443,0 days 00:00:00.846733,friedman_mse,30,sqrt,1,3,best,TPESampler,COMPLETE
1597,0.5975832321496914,2025-04-24 21:10:58.812523,2025-04-24 21:11:00.162344,0 days 00:00:01.349821,friedman_mse,35,sqrt,2,5,best,TPESampler,COMPLETE
1598,0.6265479990281826,2025-04-24 21:10:59.198250,2025-04-24 21:11:00.168112,0 days 00:00:00.969862,friedman_mse,33,sqrt,2,4,best,TPESampler,COMPLETE
1599,0.5392396456504133,2025-04-24 21:10:59.889889,2025-04-24 21:11:00.823678,0 days 00:00:00.933789,friedman_mse,34,sqrt,1,3,best,TPESampler,COMPLETE
1600,0.5642837571409262,2025-04-24 21:11:00.362350,2025-04-24 21:11:01.567918,0 days 00:00:01.205568,absolute_error,31,sqrt,1,3,best,TPESampler,COMPLETE
1601,0.6456349183315407,2025-04-24 21:11:00.421722,2025-04-24 21:11:01.572984,0 days 00:00:01.151262,friedman_mse,34,sqrt,3,4,best,TPESampler,COMPLETE
1602,0.4962324084473796,2025-04-24 21:11:01.118318,2025-04-24 21:11:01.873990,0 days 00:00:00.755672,squared_error,29,sqrt,1,6,best,TPESampler,COMPLETE
1603,0.5392396456504133,2025-04-24 21:11:01.828971,2025-04-24 21:11:02.752192,0 days 00:00:00.923221,friedman_mse,34,sqrt,1,3,best,TPESampler,COMPLETE
1604,0.496257590485042,2025-04-24 21:11:01.868620,2025-04-24 21:11:02.753621,0 days 00:00:00.885001,friedman_mse,34,sqrt,1,4,best,TPESampler,COMPLETE
1605,0.90157797490464,2025-04-24 21:11:02.610398,2025-04-24 21:11:03.365896,0 days 00:00:00.755498,friedman_mse,22,log2,9,14,best,TPESampler,COMPLETE
1606,0.8866253306412935,2025-04-24 21:11:03.065625,2025-04-24 21:11:03.988596,0 days 00:00:00.922971,squared_error,1,sqrt,10,5,random,TPESampler,COMPLETE
1607,0.5529688132197964,2025-04-24 21:11:03.121944,2025-04-24 21:11:04.169955,0 days 00:00:01.048011,friedman_mse,35,sqrt,1,2,best,TPESampler,COMPLETE
1608,0.6456349183315407,2025-04-24 21:11:03.686351,2025-04-24 21:11:04.498036,0 days 00:00:00.811685,friedman_mse,29,sqrt,3,4,best,TPESampler,COMPLETE
1609,0.5912941502828561,2025-04-24 21:11:04.365048,2025-04-24 21:11:05.249945,0 days 00:00:00.884897,friedman_mse,35,sqrt,1,5,best,TPESampler,COMPLETE
1610,0.48350783172535233,2025-04-24 21:11:04.421055,2025-04-24 21:11:05.604840,0 days 00:00:01.183785,friedman_mse,34,sqrt,1,7,best,TPESampler,COMPLETE
1611,0.5479322564786873,2025-04-24 21:11:04.778771,2025-04-24 21:11:05.795679,0 days 00:00:01.016908,friedman_mse,35,sqrt,1,6,best,TPESampler,COMPLETE
1612,0.5191719425869716,2025-04-24 21:11:05.552745,2025-04-24 21:11:06.557655,0 days 00:00:01.004910,friedman_mse,29,sqrt,1,5,best,TPESampler,COMPLETE
1613,0.4947310621805249,2025-04-24 21:11:05.907934,2025-04-24 21:11:07.274708,0 days 00:00:01.366774,friedman_mse,26,sqrt,1,5,best,TPESampler,COMPLETE
1614,0.6265479990281826,2025-04-24 21:11:06.202017,2025-04-24 21:11:07.346713,0 days 00:00:01.144696,friedman_mse,29,sqrt,2,4,best,TPESampler,COMPLETE
1615,0.6456349183315407,2025-04-24 21:11:07.001909,2025-04-24 21:11:08.111262,0 days 00:00:01.109353,friedman_mse,34,sqrt,3,5,best,TPESampler,COMPLETE
1616,0.5868750603971733,2025-04-24 21:11:07.526386,2025-04-24 21:11:08.926018,0 days 00:00:01.399632,friedman_mse,35,sqrt,1,7,best,TPESampler,COMPLETE
1617,0.5081175596164936,2025-04-24 21:11:07.609488,2025-04-24 21:11:08.927885,0 days 00:00:01.318397,friedman_mse,28,sqrt,1,5,best,TPESampler,COMPLETE
1618,0.8447937451942837,2025-04-24 21:11:08.447573,2025-04-24 21:11:09.250417,0 days 00:00:00.802844,squared_error,18,log2,1,12,random,TPESampler,COMPLETE
1619,0.501805213478129,2025-04-24 21:11:09.209372,2025-04-24 21:11:10.200973,0 days 00:00:00.991601,friedman_mse,31,sqrt,1,2,best,TPESampler,COMPLETE
1620,0.6456349183315407,2025-04-24 21:11:09.247195,2025-04-24 21:11:10.204343,0 days 00:00:00.957148,friedman_mse,29,sqrt,3,5,best,TPESampler,COMPLETE
1621,0.6151267575979713,2025-04-24 21:11:09.961821,2025-04-24 21:11:10.696586,0 days 00:00:00.734765,friedman_mse,30,sqrt,2,6,random,TPESampler,COMPLETE
1622,0.6456349183315407,2025-04-24 21:11:10.432227,2025-04-24 21:11:11.330798,0 days 00:00:00.898571,friedman_mse,31,sqrt,3,7,best,TPESampler,COMPLETE
1623,0.6504215924944643,2025-04-24 21:11:10.489454,2025-04-24 21:11:11.473593,0 days 00:00:00.984139,friedman_mse,31,sqrt,3,9,best,TPESampler,COMPLETE
1624,0.5085251300670954,2025-04-24 21:11:10.997823,2025-04-24 21:11:11.770663,0 days 00:00:00.772840,friedman_mse,29,sqrt,1,9,best,TPESampler,COMPLETE
1625,0.5623543669503079,2025-04-24 21:11:11.733305,2025-04-24 21:11:12.447069,0 days 00:00:00.713764,friedman_mse,30,sqrt,1,5,best,TPESampler,COMPLETE
1626,0.48333612106664076,2025-04-24 21:11:11.773420,2025-04-24 21:11:12.898140,0 days 00:00:01.124720,friedman_mse,31,sqrt,1,4,best,TPESampler,COMPLETE
1627,0.5191719425869716,2025-04-24 21:11:12.006676,2025-04-24 21:11:13.004482,0 days 00:00:00.997806,friedman_mse,29,sqrt,1,5,best,TPESampler,COMPLETE
1628,0.8739965405465177,2025-04-24 21:11:12.727847,2025-04-24 21:11:13.538689,0 days 00:00:00.810842,friedman_mse,22,log2,5,17,best,TPESampler,COMPLETE
1629,0.4831415131013947,2025-04-24 21:11:13.184726,2025-04-24 21:11:14.176988,0 days 00:00:00.992262,friedman_mse,31,sqrt,1,8,best,TPESampler,COMPLETE
1630,0.8720764985334399,2025-04-24 21:11:13.262578,2025-04-24 21:11:14.452828,0 days 00:00:01.190250,squared_error,18,log2,5,4,best,TPESampler,COMPLETE
1631,0.6456349183315407,2025-04-24 21:11:14.062221,2025-04-24 21:11:14.966993,0 days 00:00:00.904772,friedman_mse,33,sqrt,3,4,best,TPESampler,COMPLETE
1632,0.8737590921917946,2025-04-24 21:11:14.592472,2025-04-24 21:11:15.615746,0 days 00:00:01.023274,squared_error,12,sqrt,7,20,random,TPESampler,COMPLETE
1633,0.5513554337953424,2025-04-24 21:11:14.778789,2025-04-24 21:11:15.763962,0 days 00:00:00.985173,friedman_mse,27,sqrt,1,5,best,TPESampler,COMPLETE
1634,0.6456349183315407,2025-04-24 21:11:15.408001,2025-04-24 21:11:16.178935,0 days 00:00:00.770934,friedman_mse,35,sqrt,3,6,best,TPESampler,COMPLETE
1635,0.5011731735894601,2025-04-24 21:11:15.852445,2025-04-24 21:11:16.740721,0 days 00:00:00.888276,friedman_mse,33,sqrt,1,8,best,TPESampler,COMPLETE
1636,0.5912941502828561,2025-04-24 21:11:16.039502,2025-04-24 21:11:17.383483,0 days 00:00:01.343981,friedman_mse,35,sqrt,1,5,best,TPESampler,COMPLETE
1637,0.886285790107931,2025-04-24 21:11:16.441855,2025-04-24 21:11:17.789119,0 days 00:00:01.347264,absolute_error,5,sqrt,5,9,best,TPESampler,COMPLETE
1638,0.6456349183315407,2025-04-24 21:11:17.439356,2025-04-24 21:11:18.386645,0 days 00:00:00.947289,friedman_mse,33,sqrt,3,2,best,TPESampler,COMPLETE
1639,0.5623543669503079,2025-04-24 21:11:17.671489,2025-04-24 21:11:18.732970,0 days 00:00:01.061481,friedman_mse,30,sqrt,1,5,best,TPESampler,COMPLETE
1640,0.49455983062803255,2025-04-24 21:11:18.060010,2025-04-24 21:11:19.108360,0 days 00:00:01.048350,friedman_mse,28,sqrt,1,9,best,TPESampler,COMPLETE
1641,0.6157413727079236,2025-04-24 21:11:18.673159,2025-04-24 21:11:19.642226,0 days 00:00:00.969067,friedman_mse,35,sqrt,3,4,random,TPESampler,COMPLETE
1642,0.6504215924944643,2025-04-24 21:11:19.188718,2025-04-24 21:11:20.216618,0 days 00:00:01.027900,friedman_mse,35,sqrt,3,8,best,TPESampler,COMPLETE
1643,0.6180856799418332,2025-04-24 21:11:19.407614,2025-04-24 21:11:20.373307,0 days 00:00:00.965693,friedman_mse,31,sqrt,2,7,best,TPESampler,COMPLETE
1644,0.8737590921917946,2025-04-24 21:11:20.026167,2025-04-24 21:11:20.842367,0 days 00:00:00.816200,squared_error,26,sqrt,6,19,random,TPESampler,COMPLETE
1645,0.48806613863614323,2025-04-24 21:11:20.452125,2025-04-24 21:11:21.357964,0 days 00:00:00.905839,friedman_mse,28,sqrt,1,4,best,TPESampler,COMPLETE
1646,0.5479322564786873,2025-04-24 21:11:20.644256,2025-04-24 21:11:21.587790,0 days 00:00:00.943534,friedman_mse,35,sqrt,1,6,best,TPESampler,COMPLETE
1647,0.5738036786367497,2025-04-24 21:11:21.114466,2025-04-24 21:11:21.923057,0 days 00:00:00.808591,friedman_mse,32,log2,1,7,best,TPESampler,COMPLETE
1648,0.5655777242471537,2025-04-24 21:11:21.641138,2025-04-24 21:11:22.530913,0 days 00:00:00.889775,friedman_mse,23,sqrt,1,9,best,TPESampler,COMPLETE
1649,0.6504215924944643,2025-04-24 21:11:21.935115,2025-04-24 21:11:22.909211,0 days 00:00:00.974096,friedman_mse,28,sqrt,3,10,best,TPESampler,COMPLETE
1650,0.5085251300670954,2025-04-24 21:11:22.324528,2025-04-24 21:11:23.426959,0 days 00:00:01.102431,friedman_mse,29,sqrt,1,9,best,TPESampler,COMPLETE
1651,0.48806613863614323,2025-04-24 21:11:22.829808,2025-04-24 21:11:23.751909,0 days 00:00:00.922101,squared_error,28,sqrt,1,4,best,TPESampler,COMPLETE
1652,0.5975832321496914,2025-04-24 21:11:23.187408,2025-04-24 21:11:24.354434,0 days 00:00:01.167026,friedman_mse,27,sqrt,2,5,best,TPESampler,COMPLETE
1653,0.5081175596164936,2025-04-24 21:11:23.750574,2025-04-24 21:11:24.579821,0 days 00:00:00.829247,friedman_mse,28,sqrt,1,5,best,TPESampler,COMPLETE
1654,0.8737590921917946,2025-04-24 21:11:24.063298,2025-04-24 21:11:24.875744,0 days 00:00:00.812446,friedman_mse,28,sqrt,8,16,random,TPESampler,COMPLETE
1655,0.5339224783480143,2025-04-24 21:11:24.807114,2025-04-24 21:11:25.791175,0 days 00:00:00.984061,friedman_mse,35,sqrt,1,8,best,TPESampler,COMPLETE
1656,0.5339224783480143,2025-04-24 21:11:24.817161,2025-04-24 21:11:26.053451,0 days 00:00:01.236290,friedman_mse,35,sqrt,1,8,best,TPESampler,COMPLETE
1657,0.6265479990281826,2025-04-24 21:11:25.146743,2025-04-24 21:11:26.211150,0 days 00:00:01.064407,friedman_mse,31,sqrt,2,3,best,TPESampler,COMPLETE
1658,0.6180856799418332,2025-04-24 21:11:26.055835,2025-04-24 21:11:26.786715,0 days 00:00:00.730880,friedman_mse,30,sqrt,2,7,best,TPESampler,COMPLETE
1659,0.5768496047868986,2025-04-24 21:11:26.307339,2025-04-24 21:11:27.344774,0 days 00:00:01.037435,absolute_error,24,sqrt,2,6,best,TPESampler,COMPLETE
1660,0.5593525150541101,2025-04-24 21:11:26.494373,2025-04-24 21:11:27.483968,0 days 00:00:00.989595,friedman_mse,30,sqrt,1,4,best,TPESampler,COMPLETE
1661,0.5517493393728706,2025-04-24 21:11:27.198366,2025-04-24 21:11:28.054636,0 days 00:00:00.856270,friedman_mse,35,sqrt,1,4,best,TPESampler,COMPLETE
1662,0.6456349183315407,2025-04-24 21:11:27.589405,2025-04-24 21:11:28.475995,0 days 00:00:00.886590,friedman_mse,22,sqrt,3,7,best,TPESampler,COMPLETE
1663,0.5085251300670954,2025-04-24 21:11:27.848979,2025-04-24 21:11:28.825528,0 days 00:00:00.976549,friedman_mse,29,sqrt,1,9,best,TPESampler,COMPLETE
1664,0.5037849405969599,2025-04-24 21:11:28.334460,2025-04-24 21:11:29.392413,0 days 00:00:01.057953,friedman_mse,26,sqrt,1,6,best,TPESampler,COMPLETE
1665,0.878930627702796,2025-04-24 21:11:28.784749,2025-04-24 21:11:29.764098,0 days 00:00:00.979349,friedman_mse,10,log2,6,11,random,TPESampler,COMPLETE
1666,0.6456349183315407,2025-04-24 21:11:29.106197,2025-04-24 21:11:30.030830,0 days 00:00:00.924633,friedman_mse,30,sqrt,3,6,best,TPESampler,COMPLETE
1667,0.5164170552722069,2025-04-24 21:11:29.712241,2025-04-24 21:11:30.686758,0 days 00:00:00.974517,friedman_mse,29,sqrt,1,8,best,TPESampler,COMPLETE
1668,0.5202466614878716,2025-04-24 21:11:30.049587,2025-04-24 21:11:30.872156,0 days 00:00:00.822569,friedman_mse,29,sqrt,1,7,best,TPESampler,COMPLETE
1669,0.5623543669503079,2025-04-24 21:11:30.406939,2025-04-24 21:11:31.618635,0 days 00:00:01.211696,friedman_mse,30,sqrt,1,5,best,TPESampler,COMPLETE
1670,0.5978196983404886,2025-04-24 21:11:30.995728,2025-04-24 21:11:31.968399,0 days 00:00:00.972671,friedman_mse,29,sqrt,1,8,random,TPESampler,COMPLETE
1671,0.5469433296825841,2025-04-24 21:11:31.117883,2025-04-24 21:11:32.169025,0 days 00:00:01.051142,squared_error,35,sqrt,1,3,best,TPESampler,COMPLETE
1672,0.4962324084473796,2025-04-24 21:11:31.905613,2025-04-24 21:11:32.627311,0 days 00:00:00.721698,squared_error,29,sqrt,1,6,best,TPESampler,COMPLETE
1673,0.6221801846102784,2025-04-24 21:11:32.283996,2025-04-24 21:11:33.319068,0 days 00:00:01.035072,absolute_error,35,sqrt,3,3,best,TPESampler,COMPLETE
1674,0.6504215924944643,2025-04-24 21:11:32.472852,2025-04-24 21:11:33.383531,0 days 00:00:00.910679,friedman_mse,31,sqrt,3,8,best,TPESampler,COMPLETE
1675,0.49783262823116015,2025-04-24 21:11:32.930298,2025-04-24 21:11:33.734570,0 days 00:00:00.804272,friedman_mse,31,sqrt,1,5,best,TPESampler,COMPLETE
1676,0.5868750603971733,2025-04-24 21:11:33.637616,2025-04-24 21:11:34.596095,0 days 00:00:00.958479,friedman_mse,35,sqrt,1,7,best,TPESampler,COMPLETE
1677,0.500848998379332,2025-04-24 21:11:33.679840,2025-04-24 21:11:34.605550,0 days 00:00:00.925710,friedman_mse,30,sqrt,1,2,best,TPESampler,COMPLETE
1678,0.7352239070983845,2025-04-24 21:11:34.260894,2025-04-24 21:11:35.111661,0 days 00:00:00.850767,friedman_mse,30,log2,3,7,best,TPESampler,COMPLETE
1679,0.8737590921917946,2025-04-24 21:11:34.830252,2025-04-24 21:11:35.872757,0 days 00:00:01.042505,friedman_mse,13,sqrt,8,16,random,TPESampler,COMPLETE
1680,0.6515872609760095,2025-04-24 21:11:34.887144,2025-04-24 21:11:35.867716,0 days 00:00:00.980572,friedman_mse,25,sqrt,2,6,best,TPESampler,COMPLETE
1681,0.8949707845327863,2025-04-24 21:11:35.445048,2025-04-24 21:11:36.185651,0 days 00:00:00.740603,friedman_mse,2,sqrt,10,20,best,TPESampler,COMPLETE
1682,0.6289323974475082,2025-04-24 21:11:36.097832,2025-04-24 21:11:36.845835,0 days 00:00:00.748003,friedman_mse,26,sqrt,2,10,best,TPESampler,COMPLETE
1683,0.5724846347554697,2025-04-24 21:11:36.144346,2025-04-24 21:11:37.209193,0 days 00:00:01.064847,friedman_mse,30,sqrt,1,7,best,TPESampler,COMPLETE
1684,0.5129971695350808,2025-04-24 21:11:36.480090,2025-04-24 21:11:37.605512,0 days 00:00:01.125422,friedman_mse,30,sqrt,1,9,best,TPESampler,COMPLETE
1685,0.5975832321496914,2025-04-24 21:11:37.153439,2025-04-24 21:11:37.958443,0 days 00:00:00.805004,friedman_mse,31,sqrt,2,5,best,TPESampler,COMPLETE
1686,0.9018784399194749,2025-04-24 21:11:37.499942,2025-04-24 21:11:38.634885,0 days 00:00:01.134943,friedman_mse,10,log2,9,4,random,TPESampler,COMPLETE
1687,0.5529688132197964,2025-04-24 21:11:37.900748,2025-04-24 21:11:38.770998,0 days 00:00:00.870250,friedman_mse,35,sqrt,1,2,best,TPESampler,COMPLETE
1688,0.48333612106664076,2025-04-24 21:11:38.209435,2025-04-24 21:11:39.075675,0 days 00:00:00.866240,friedman_mse,31,sqrt,1,4,best,TPESampler,COMPLETE
1689,0.6456349183315407,2025-04-24 21:11:38.950967,2025-04-24 21:11:39.959644,0 days 00:00:01.008677,friedman_mse,35,sqrt,3,6,best,TPESampler,COMPLETE
1690,0.4841824780964295,2025-04-24 21:11:39.038361,2025-04-24 21:11:40.211489,0 days 00:00:01.173128,friedman_mse,25,sqrt,1,5,best,TPESampler,COMPLETE
1691,0.6194853816763535,2025-04-24 21:11:39.331450,2025-04-24 21:11:40.351673,0 days 00:00:01.020223,friedman_mse,31,sqrt,2,8,best,TPESampler,COMPLETE
1692,0.5904544536906581,2025-04-24 21:11:40.266016,2025-04-24 21:11:40.961509,0 days 00:00:00.695493,friedman_mse,33,sqrt,1,5,random,TPESampler,COMPLETE
1693,0.8417400602476132,2025-04-24 21:11:40.468093,2025-04-24 21:11:41.467350,0 days 00:00:00.999257,friedman_mse,16,log2,1,4,random,TPESampler,COMPLETE
1694,0.5724846347554697,2025-04-24 21:11:40.685296,2025-04-24 21:11:41.524649,0 days 00:00:00.839353,friedman_mse,30,sqrt,1,7,best,TPESampler,COMPLETE
1695,0.6456349183315407,2025-04-24 21:11:41.333507,2025-04-24 21:11:42.339785,0 days 00:00:01.006278,friedman_mse,32,sqrt,3,2,best,TPESampler,COMPLETE
1696,0.6505704676015814,2025-04-24 21:11:41.678773,2025-04-24 21:11:42.727689,0 days 00:00:01.048916,squared_error,25,sqrt,3,19,best,TPESampler,COMPLETE
1697,0.6456349183315407,2025-04-24 21:11:41.801507,2025-04-24 21:11:43.019507,0 days 00:00:01.218000,friedman_mse,28,sqrt,3,5,best,TPESampler,COMPLETE
1698,0.9018784399194749,2025-04-24 21:11:42.681875,2025-04-24 21:11:43.666964,0 days 00:00:00.985089,squared_error,31,log2,10,2,random,TPESampler,COMPLETE
1699,0.5296855957806621,2025-04-24 21:11:43.110178,2025-04-24 21:11:43.974417,0 days 00:00:00.864239,friedman_mse,26,sqrt,1,8,best,TPESampler,COMPLETE
1700,0.5298778451782702,2025-04-24 21:11:43.382266,2025-04-24 21:11:44.339148,0 days 00:00:00.956882,friedman_mse,32,sqrt,1,7,best,TPESampler,COMPLETE
1701,0.5912941502828561,2025-04-24 21:11:43.937504,2025-04-24 21:11:44.935608,0 days 00:00:00.998104,friedman_mse,35,sqrt,1,5,best,TPESampler,COMPLETE
1702,0.49783262823116015,2025-04-24 21:11:44.334717,2025-04-24 21:11:45.115857,0 days 00:00:00.781140,friedman_mse,31,sqrt,1,5,best,TPESampler,COMPLETE
1703,0.7314755073768506,2025-04-24 21:11:44.612521,2025-04-24 21:11:45.444621,0 days 00:00:00.832100,absolute_error,20,sqrt,5,8,best,TPESampler,COMPLETE
1704,0.5085251300670954,2025-04-24 21:11:45.318800,2025-04-24 21:11:46.057277,0 days 00:00:00.738477,friedman_mse,29,sqrt,1,9,best,TPESampler,COMPLETE
1705,0.6194853816763535,2025-04-24 21:11:45.372905,2025-04-24 21:11:46.302865,0 days 00:00:00.929960,friedman_mse,35,sqrt,2,8,best,TPESampler,COMPLETE
1706,0.5975832321496914,2025-04-24 21:11:45.783829,2025-04-24 21:11:46.697736,0 days 00:00:00.913907,friedman_mse,24,sqrt,2,5,best,TPESampler,COMPLETE
1707,0.5722488541019987,2025-04-24 21:11:46.346275,2025-04-24 21:11:47.368610,0 days 00:00:01.022335,absolute_error,26,sqrt,1,5,best,TPESampler,COMPLETE
1708,0.5593525150541101,2025-04-24 21:11:46.622731,2025-04-24 21:11:47.536651,0 days 00:00:00.913920,friedman_mse,30,sqrt,1,4,best,TPESampler,COMPLETE
1709,0.6504215924944643,2025-04-24 21:11:46.995278,2025-04-24 21:11:47.867321,0 days 00:00:00.872043,friedman_mse,29,sqrt,3,10,best,TPESampler,COMPLETE
1710,0.5378902223820379,2025-04-24 21:11:47.586471,2025-04-24 21:11:48.515434,0 days 00:00:00.928963,friedman_mse,24,sqrt,1,6,best,TPESampler,COMPLETE
1711,0.5724846347554697,2025-04-24 21:11:47.819042,2025-04-24 21:11:48.717418,0 days 00:00:00.898376,friedman_mse,30,sqrt,1,7,best,TPESampler,COMPLETE
1712,0.6186874260556517,2025-04-24 21:11:48.197179,2025-04-24 21:11:49.099920,0 days 00:00:00.902741,friedman_mse,31,sqrt,3,9,random,TPESampler,COMPLETE
1713,0.6456349183315407,2025-04-24 21:11:48.814652,2025-04-24 21:11:49.691717,0 days 00:00:00.877065,friedman_mse,26,sqrt,3,6,best,TPESampler,COMPLETE
1714,0.6456349183315407,2025-04-24 21:11:49.053867,2025-04-24 21:11:50.064410,0 days 00:00:01.010543,friedman_mse,30,sqrt,3,7,best,TPESampler,COMPLETE
1715,0.5912941502828561,2025-04-24 21:11:49.400286,2025-04-24 21:11:50.565271,0 days 00:00:01.164985,friedman_mse,35,sqrt,1,5,best,TPESampler,COMPLETE
1716,0.5191719425869716,2025-04-24 21:11:50.005590,2025-04-24 21:11:50.835355,0 days 00:00:00.829765,friedman_mse,29,sqrt,1,5,best,TPESampler,COMPLETE
1717,0.90157797490464,2025-04-24 21:11:50.353908,2025-04-24 21:11:51.348776,0 days 00:00:00.994868,friedman_mse,30,log2,7,7,best,TPESampler,COMPLETE
