number,value,datetime_start,datetime_complete,duration,params_criterion,params_max_depth,params_max_features,params_min_samples_leaf,params_min_samples_split,params_splitter,system_attrs_auto:sampler,state
1003,0.4962324084473796,2025-04-24 21:06:51.942959,2025-04-24 21:06:52.619308,0 days 00:00:00.676349,friedman_mse,29,sqrt,1,6,best,TPESampler,COMPLETE
1004,0.8850110526457134,2025-04-24 21:06:52.331237,2025-04-24 21:06:53.117689,0 days 00:00:00.786452,absolute_error,2,sqrt,5,2,random,TPESampler,COMPLETE
1005,0.46570797980588163,2025-04-24 21:06:52.485143,2025-04-24 21:06:53.406845,0 days 00:00:00.921702,friedman_mse,31,sqrt,1,7,best,TPESampler,COMPLETE
1006,0.49912878166750996,2025-04-24 21:06:52.833517,2025-04-24 21:06:53.643917,0 days 00:00:00.810400,friedman_mse,28,sqrt,1,7,best,TPESampler,COMPLETE
1007,0.6180856799418332,2025-04-24 21:06:53.364287,2025-04-24 21:06:54.160094,0 days 00:00:00.795807,friedman_mse,35,sqrt,2,7,best,TPESampler,COMPLETE
1008,0.6289323974475082,2025-04-24 21:06:53.686346,2025-04-24 21:06:54.524201,0 days 00:00:00.837855,friedman_mse,32,sqrt,2,10,best,TPESampler,COMPLETE
1009,0.5103041358943772,2025-04-24 21:06:53.877616,2025-04-24 21:06:54.755968,0 days 00:00:00.878352,friedman_mse,31,sqrt,1,9,best,TPESampler,COMPLETE
1010,0.5011731735894601,2025-04-24 21:06:54.463378,2025-04-24 21:06:55.241528,0 days 00:00:00.778150,friedman_mse,33,sqrt,1,8,best,TPESampler,COMPLETE
1011,0.5724846347554697,2025-04-24 21:06:54.819557,2025-04-24 21:06:55.544848,0 days 00:00:00.725291,friedman_mse,30,sqrt,1,7,best,TPESampler,COMPLETE
1012,0.6456349183315407,2025-04-24 21:06:55.053346,2025-04-24 21:06:55.933112,0 days 00:00:00.879766,friedman_mse,35,sqrt,3,7,best,TPESampler,COMPLETE
1013,0.5868750603971733,2025-04-24 21:06:55.505135,2025-04-24 21:06:56.306606,0 days 00:00:00.801471,friedman_mse,35,sqrt,1,7,best,TPESampler,COMPLETE
1014,0.6158516821465488,2025-04-24 21:06:55.774657,2025-04-24 21:06:56.630878,0 days 00:00:00.856221,friedman_mse,35,sqrt,3,7,random,TPESampler,COMPLETE
1015,0.6456349183315407,2025-04-24 21:06:56.314746,2025-04-24 21:06:57.217591,0 days 00:00:00.902845,friedman_mse,28,sqrt,3,7,best,TPESampler,COMPLETE
1016,0.6456349183315407,2025-04-24 21:06:56.543965,2025-04-24 21:06:57.366084,0 days 00:00:00.822119,friedman_mse,28,sqrt,3,5,best,TPESampler,COMPLETE
1017,0.8790843793898446,2025-04-24 21:06:56.876160,2025-04-24 21:06:57.688267,0 days 00:00:00.812107,absolute_error,2,log2,4,7,random,TPESampler,COMPLETE
1018,0.49068441274037305,2025-04-24 21:06:57.435477,2025-04-24 21:06:58.519580,0 days 00:00:01.084103,friedman_mse,31,sqrt,1,6,best,TPESampler,COMPLETE
1019,0.5253868360947686,2025-04-24 21:06:57.647294,2025-04-24 21:06:58.439196,0 days 00:00:00.791902,friedman_mse,27,sqrt,1,4,best,TPESampler,COMPLETE
1020,0.49783262823116015,2025-04-24 21:06:57.906194,2025-04-24 21:06:58.732961,0 days 00:00:00.826767,friedman_mse,31,sqrt,1,5,best,TPESampler,COMPLETE
1021,0.5085288623263258,2025-04-24 21:06:58.682316,2025-04-24 21:06:59.415708,0 days 00:00:00.733392,friedman_mse,35,sqrt,1,9,best,TPESampler,COMPLETE
1022,0.4966168010617349,2025-04-24 21:06:58.757507,2025-04-24 21:06:59.793606,0 days 00:00:01.036099,friedman_mse,28,sqrt,1,11,best,TPESampler,COMPLETE
1023,0.5081175596164936,2025-04-24 21:06:58.958755,2025-04-24 21:06:59.956377,0 days 00:00:00.997622,friedman_mse,28,sqrt,1,5,best,TPESampler,COMPLETE
1024,0.5191719425869716,2025-04-24 21:06:59.722458,2025-04-24 21:07:00.413662,0 days 00:00:00.691204,friedman_mse,29,sqrt,1,5,best,TPESampler,COMPLETE
1025,0.6456349183315407,2025-04-24 21:07:00.087353,2025-04-24 21:07:01.096062,0 days 00:00:01.008709,friedman_mse,30,sqrt,3,5,best,TPESampler,COMPLETE
1026,0.884109351200436,2025-04-24 21:07:00.277680,2025-04-24 21:07:01.255811,0 days 00:00:00.978131,absolute_error,8,log2,2,5,best,TPESampler,COMPLETE
1027,0.5343848577626367,2025-04-24 21:07:00.658917,2025-04-24 21:07:01.531096,0 days 00:00:00.872179,friedman_mse,20,sqrt,1,2,best,TPESampler,COMPLETE
1028,0.49912878166750996,2025-04-24 21:07:01.419099,2025-04-24 21:07:02.463236,0 days 00:00:01.044137,friedman_mse,28,sqrt,1,7,best,TPESampler,COMPLETE
1029,0.6504215924944643,2025-04-24 21:07:01.480687,2025-04-24 21:07:02.210981,0 days 00:00:00.730294,squared_error,23,sqrt,3,8,best,TPESampler,COMPLETE
1030,0.49068441274037305,2025-04-24 21:07:01.751375,2025-04-24 21:07:02.538285,0 days 00:00:00.786910,friedman_mse,31,sqrt,1,6,best,TPESampler,COMPLETE
1031,0.6504215924944643,2025-04-24 21:07:02.464652,2025-04-24 21:07:03.138672,0 days 00:00:00.674020,friedman_mse,28,sqrt,3,8,best,TPESampler,COMPLETE
1032,0.5373966342965538,2025-04-24 21:07:02.775061,2025-04-24 21:07:03.712409,0 days 00:00:00.937348,friedman_mse,29,sqrt,1,4,best,TPESampler,COMPLETE
1033,0.49783262823116015,2025-04-24 21:07:02.831764,2025-04-24 21:07:03.718083,0 days 00:00:00.886319,friedman_mse,31,sqrt,1,5,best,TPESampler,COMPLETE
1034,0.7352239070983845,2025-04-24 21:07:03.394650,2025-04-24 21:07:04.140611,0 days 00:00:00.745961,friedman_mse,22,log2,3,8,best,TPESampler,COMPLETE
1035,0.6914240519562312,2025-04-24 21:07:03.927479,2025-04-24 21:07:04.969436,0 days 00:00:01.041957,squared_error,16,log2,1,12,best,TPESampler,COMPLETE
1036,0.7311891364188057,2025-04-24 21:07:04.006878,2025-04-24 21:07:04.963620,0 days 00:00:00.956742,friedman_mse,29,log2,2,5,best,TPESampler,COMPLETE
1037,0.5667823799395514,2025-04-24 21:07:04.443549,2025-04-24 21:07:05.142034,0 days 00:00:00.698485,friedman_mse,21,sqrt,1,10,best,TPESampler,COMPLETE
1038,0.5872571009690963,2025-04-24 21:07:05.186822,2025-04-24 21:07:06.679778,0 days 00:00:01.492956,squared_error,32,sqrt,1,5,random,TPESampler,COMPLETE
1039,0.6456349183315407,2025-04-24 21:07:05.247729,2025-04-24 21:07:06.506626,0 days 00:00:01.258897,friedman_mse,31,sqrt,3,6,best,TPESampler,COMPLETE
1040,0.6456349183315407,2025-04-24 21:07:05.374543,2025-04-24 21:07:06.378452,0 days 00:00:01.003909,friedman_mse,30,sqrt,3,5,best,TPESampler,COMPLETE
1041,0.5085251300670954,2025-04-24 21:07:06.730572,2025-04-24 21:07:08.134423,0 days 00:00:01.403851,friedman_mse,29,sqrt,1,9,best,TPESampler,COMPLETE
1042,0.878930627702796,2025-04-24 21:07:06.785238,2025-04-24 21:07:07.879865,0 days 00:00:01.094627,friedman_mse,3,log2,6,15,random,TPESampler,COMPLETE
1043,0.9018784399194749,2025-04-24 21:07:06.904131,2025-04-24 21:07:07.928254,0 days 00:00:01.024123,friedman_mse,26,log2,10,14,random,TPESampler,COMPLETE
1044,0.49783262823116015,2025-04-24 21:07:08.089636,2025-04-24 21:07:08.839575,0 days 00:00:00.749939,friedman_mse,31,sqrt,1,5,best,TPESampler,COMPLETE
1045,0.7001426564128769,2025-04-24 21:07:08.169450,2025-04-24 21:07:09.528810,0 days 00:00:01.359360,friedman_mse,33,sqrt,10,10,best,TPESampler,COMPLETE
1046,0.6456349183315407,2025-04-24 21:07:08.369125,2025-04-24 21:07:09.615385,0 days 00:00:01.246260,friedman_mse,25,sqrt,3,4,best,TPESampler,COMPLETE
1047,0.5064102821977916,2025-04-24 21:07:09.145326,2025-04-24 21:07:10.290240,0 days 00:00:01.144914,friedman_mse,27,sqrt,1,2,best,TPESampler,COMPLETE
1048,0.5037849405969599,2025-04-24 21:07:09.819069,2025-04-24 21:07:11.161598,0 days 00:00:01.342529,friedman_mse,26,sqrt,1,6,best,TPESampler,COMPLETE
1049,0.5239406427324055,2025-04-24 21:07:09.917998,2025-04-24 21:07:11.160014,0 days 00:00:01.242016,friedman_mse,22,sqrt,1,6,best,TPESampler,COMPLETE
1050,0.6858428787475002,2025-04-24 21:07:10.974390,2025-04-24 21:07:11.983240,0 days 00:00:01.008850,absolute_error,14,sqrt,6,14,best,TPESampler,COMPLETE
1051,0.49068441274037305,2025-04-24 21:07:11.359921,2025-04-24 21:07:12.431295,0 days 00:00:01.071374,friedman_mse,31,sqrt,1,6,best,TPESampler,COMPLETE
1052,0.5669493989992861,2025-04-24 21:07:11.412541,2025-04-24 21:07:12.440188,0 days 00:00:01.027647,friedman_mse,33,sqrt,1,5,best,TPESampler,COMPLETE
1053,0.5237651599650504,2025-04-24 21:07:12.391855,2025-04-24 21:07:13.080458,0 days 00:00:00.688603,friedman_mse,24,sqrt,1,4,best,TPESampler,COMPLETE
1054,0.9016215139057422,2025-04-24 21:07:12.625735,2025-04-24 21:07:13.374417,0 days 00:00:00.748682,absolute_error,28,log2,8,6,random,TPESampler,COMPLETE
1055,0.5362679897395523,2025-04-24 21:07:12.733287,2025-04-24 21:07:13.611929,0 days 00:00:00.878642,squared_error,32,sqrt,1,11,best,TPESampler,COMPLETE
1056,0.598835646376164,2025-04-24 21:07:13.320052,2025-04-24 21:07:14.120492,0 days 00:00:00.800440,friedman_mse,28,sqrt,1,6,random,TPESampler,COMPLETE
1057,0.6471931587078632,2025-04-24 21:07:13.681557,2025-04-24 21:07:14.501942,0 days 00:00:00.820385,squared_error,26,sqrt,1,18,random,TPESampler,COMPLETE
1058,0.8786486450005158,2025-04-24 21:07:13.880115,2025-04-24 21:07:15.027548,0 days 00:00:01.147433,friedman_mse,31,log2,4,6,random,TPESampler,COMPLETE
1059,0.6504215924944643,2025-04-24 21:07:14.500567,2025-04-24 21:07:15.358140,0 days 00:00:00.857573,friedman_mse,27,sqrt,3,10,best,TPESampler,COMPLETE
1060,0.69351465341836,2025-04-24 21:07:14.798138,2025-04-24 21:07:15.647763,0 days 00:00:00.849625,friedman_mse,23,sqrt,6,5,best,TPESampler,COMPLETE
1061,0.6194853816763535,2025-04-24 21:07:15.349856,2025-04-24 21:07:16.115224,0 days 00:00:00.765368,friedman_mse,29,sqrt,2,8,best,TPESampler,COMPLETE
1062,0.5050330543762468,2025-04-24 21:07:15.603635,2025-04-24 21:07:16.377207,0 days 00:00:00.773572,friedman_mse,29,sqrt,1,10,best,TPESampler,COMPLETE
1063,0.8782489256930615,2025-04-24 21:07:15.924689,2025-04-24 21:07:16.756359,0 days 00:00:00.831670,absolute_error,13,log2,5,13,best,TPESampler,COMPLETE
1064,0.6456349183315407,2025-04-24 21:07:16.467435,2025-04-24 21:07:17.266119,0 days 00:00:00.798684,friedman_mse,35,sqrt,3,5,best,TPESampler,COMPLETE
1065,0.6456349183315407,2025-04-24 21:07:16.651409,2025-04-24 21:07:17.454290,0 days 00:00:00.802881,friedman_mse,35,sqrt,3,7,best,TPESampler,COMPLETE
1066,0.4750160173487102,2025-04-24 21:07:16.995234,2025-04-24 21:07:17.843768,0 days 00:00:00.848534,friedman_mse,32,sqrt,1,5,best,TPESampler,COMPLETE
1067,0.5262906297733717,2025-04-24 21:07:17.546268,2025-04-24 21:07:18.817087,0 days 00:00:01.270819,friedman_mse,34,sqrt,1,5,best,TPESampler,COMPLETE
1068,0.5868750603971733,2025-04-24 21:07:17.793530,2025-04-24 21:07:18.693814,0 days 00:00:00.900284,friedman_mse,35,sqrt,1,7,best,TPESampler,COMPLETE
1069,0.5373966342965538,2025-04-24 21:07:18.205205,2025-04-24 21:07:19.055756,0 days 00:00:00.850551,squared_error,29,sqrt,1,4,best,TPESampler,COMPLETE
1070,0.5912941502828561,2025-04-24 21:07:19.009293,2025-04-24 21:07:19.851987,0 days 00:00:00.842694,friedman_mse,35,sqrt,1,5,best,TPESampler,COMPLETE
1071,0.5623543669503079,2025-04-24 21:07:19.096547,2025-04-24 21:07:20.255509,0 days 00:00:01.158962,friedman_mse,30,sqrt,1,5,best,TPESampler,COMPLETE
1072,0.69351465341836,2025-04-24 21:07:19.292492,2025-04-24 21:07:20.281318,0 days 00:00:00.988826,friedman_mse,35,sqrt,6,6,best,TPESampler,COMPLETE
1073,0.5348776862952044,2025-04-24 21:07:20.187033,2025-04-24 21:07:20.833535,0 days 00:00:00.646502,friedman_mse,26,sqrt,1,2,best,TPESampler,COMPLETE
1074,0.6456349183315407,2025-04-24 21:07:20.516587,2025-04-24 21:07:21.484249,0 days 00:00:00.967662,friedman_mse,31,sqrt,3,4,best,TPESampler,COMPLETE
1075,0.583481770487222,2025-04-24 21:07:20.575050,2025-04-24 21:07:21.562157,0 days 00:00:00.987107,friedman_mse,29,sqrt,1,2,random,TPESampler,COMPLETE
1076,0.6456349183315407,2025-04-24 21:07:21.290029,2025-04-24 21:07:22.037569,0 days 00:00:00.747540,friedman_mse,29,sqrt,3,2,best,TPESampler,COMPLETE
1077,0.48333612106664076,2025-04-24 21:07:21.729410,2025-04-24 21:07:22.560215,0 days 00:00:00.830805,friedman_mse,31,sqrt,1,4,best,TPESampler,COMPLETE
1078,0.5868750603971733,2025-04-24 21:07:21.868737,2025-04-24 21:07:22.739753,0 days 00:00:00.871016,friedman_mse,35,sqrt,1,7,best,TPESampler,COMPLETE
1079,0.6265479990281826,2025-04-24 21:07:22.266550,2025-04-24 21:07:23.262004,0 days 00:00:00.995454,friedman_mse,30,sqrt,2,4,best,TPESampler,COMPLETE
1080,0.49100091803166096,2025-04-24 21:07:22.797724,2025-04-24 21:07:23.421728,0 days 00:00:00.624004,friedman_mse,32,sqrt,1,8,best,TPESampler,COMPLETE
1081,0.6515872609760095,2025-04-24 21:07:23.041493,2025-04-24 21:07:23.931675,0 days 00:00:00.890182,friedman_mse,29,sqrt,2,6,best,TPESampler,COMPLETE
1082,0.48806613863614323,2025-04-24 21:07:23.493182,2025-04-24 21:07:24.342488,0 days 00:00:00.849306,friedman_mse,28,sqrt,1,4,best,TPESampler,COMPLETE
1083,0.8737590921917946,2025-04-24 21:07:23.695487,2025-04-24 21:07:24.553196,0 days 00:00:00.857709,squared_error,24,sqrt,6,13,random,TPESampler,COMPLETE
1084,0.5520453318079024,2025-04-24 21:07:24.276586,2025-04-24 21:07:24.922785,0 days 00:00:00.646199,friedman_mse,29,sqrt,1,2,best,TPESampler,COMPLETE
1085,0.74349522764793,2025-04-24 21:07:24.634902,2025-04-24 21:07:25.474905,0 days 00:00:00.840003,friedman_mse,34,log2,3,2,best,TPESampler,COMPLETE
1086,0.6456349183315407,2025-04-24 21:07:24.791413,2025-04-24 21:07:25.683716,0 days 00:00:00.892303,friedman_mse,22,sqrt,3,5,best,TPESampler,COMPLETE
1087,0.46570797980588163,2025-04-24 21:07:25.168145,2025-04-24 21:07:26.031502,0 days 00:00:00.863357,friedman_mse,31,sqrt,1,7,best,TPESampler,COMPLETE
1088,0.5524006536474168,2025-04-24 21:07:25.765683,2025-04-24 21:07:26.745155,0 days 00:00:00.979472,friedman_mse,32,sqrt,1,10,best,TPESampler,COMPLETE
1089,0.49100091803166096,2025-04-24 21:07:25.964293,2025-04-24 21:07:26.945167,0 days 00:00:00.980874,friedman_mse,32,sqrt,1,8,best,TPESampler,COMPLETE
1090,0.5912941502828561,2025-04-24 21:07:26.321167,2025-04-24 21:07:27.545813,0 days 00:00:01.224646,friedman_mse,35,sqrt,1,5,best,TPESampler,COMPLETE
1091,0.6792360628658397,2025-04-24 21:07:27.001598,2025-04-24 21:07:27.749821,0 days 00:00:00.748223,friedman_mse,27,log2,1,10,best,TPESampler,COMPLETE
1092,0.6504215924944643,2025-04-24 21:07:27.285729,2025-04-24 21:07:28.028188,0 days 00:00:00.742459,friedman_mse,32,sqrt,3,8,best,TPESampler,COMPLETE
1093,0.7459946044096345,2025-04-24 21:07:27.876327,2025-04-24 21:07:28.629028,0 days 00:00:00.752701,friedman_mse,19,log2,2,3,best,TPESampler,COMPLETE
1094,0.5339224783480143,2025-04-24 21:07:27.990798,2025-04-24 21:07:28.985195,0 days 00:00:00.994397,friedman_mse,35,sqrt,1,8,best,TPESampler,COMPLETE
1095,0.5085251300670954,2025-04-24 21:07:28.302209,2025-04-24 21:07:29.155589,0 days 00:00:00.853380,friedman_mse,29,sqrt,1,9,best,TPESampler,COMPLETE
1096,0.5164170552722069,2025-04-24 21:07:28.915600,2025-04-24 21:07:29.617172,0 days 00:00:00.701572,squared_error,29,sqrt,1,8,best,TPESampler,COMPLETE
1097,0.5517493393728706,2025-04-24 21:07:29.293852,2025-04-24 21:07:30.268397,0 days 00:00:00.974545,friedman_mse,35,sqrt,1,4,best,TPESampler,COMPLETE
1098,0.6475403899292606,2025-04-24 21:07:29.494558,2025-04-24 21:07:30.337525,0 days 00:00:00.842967,friedman_mse,29,sqrt,2,8,random,TPESampler,COMPLETE
1099,0.49912878166750996,2025-04-24 21:07:29.848500,2025-04-24 21:07:30.763053,0 days 00:00:00.914553,friedman_mse,28,sqrt,1,7,best,TPESampler,COMPLETE
1100,0.5724846347554697,2025-04-24 21:07:30.522429,2025-04-24 21:07:31.357039,0 days 00:00:00.834610,friedman_mse,30,sqrt,1,7,best,TPESampler,COMPLETE
1101,0.6456349183315407,2025-04-24 21:07:30.581848,2025-04-24 21:07:31.417401,0 days 00:00:00.835553,friedman_mse,30,sqrt,3,5,best,TPESampler,COMPLETE
1102,0.5975832321496914,2025-04-24 21:07:31.076062,2025-04-24 21:07:32.237928,0 days 00:00:01.161866,friedman_mse,30,sqrt,2,5,best,TPESampler,COMPLETE
1103,0.6265479990281826,2025-04-24 21:07:31.616604,2025-04-24 21:07:32.612105,0 days 00:00:00.995501,friedman_mse,31,sqrt,2,4,best,TPESampler,COMPLETE
1104,0.5623543669503079,2025-04-24 21:07:31.666006,2025-04-24 21:07:32.573610,0 days 00:00:00.907604,friedman_mse,30,sqrt,1,5,best,TPESampler,COMPLETE
1105,0.5020512557327408,2025-04-24 21:07:32.513419,2025-04-24 21:07:33.148971,0 days 00:00:00.635552,friedman_mse,30,sqrt,1,8,best,TPESampler,COMPLETE
1106,0.49321865056844255,2025-04-24 21:07:32.807693,2025-04-24 21:07:33.683642,0 days 00:00:00.875949,friedman_mse,30,sqrt,1,3,best,TPESampler,COMPLETE
1107,0.9018784399194749,2025-04-24 21:07:32.855983,2025-04-24 21:07:33.866393,0 days 00:00:01.010410,squared_error,21,log2,8,6,random,TPESampler,COMPLETE
1108,0.5191719425869716,2025-04-24 21:07:33.613547,2025-04-24 21:07:34.309482,0 days 00:00:00.695935,friedman_mse,29,sqrt,1,5,best,TPESampler,COMPLETE
1109,0.6295056008168576,2025-04-24 21:07:33.977269,2025-04-24 21:07:34.829495,0 days 00:00:00.852226,friedman_mse,31,log2,1,3,best,TPESampler,COMPLETE
1110,0.6008739649566123,2025-04-24 21:07:34.118507,2025-04-24 21:07:35.286527,0 days 00:00:01.168020,friedman_mse,33,log2,1,6,best,TPESampler,COMPLETE
1111,0.7559383066948747,2025-04-24 21:07:34.645561,2025-04-24 21:07:36.091384,0 days 00:00:01.445823,squared_error,23,log2,1,2,random,TPESampler,COMPLETE
1112,0.5370460028085798,2025-04-24 21:07:35.472303,2025-04-24 21:07:37.001082,0 days 00:00:01.528779,friedman_mse,35,sqrt,1,7,random,TPESampler,COMPLETE
1113,0.5137879318052204,2025-04-24 21:07:35.753970,2025-04-24 21:07:36.964634,0 days 00:00:01.210664,friedman_mse,35,sqrt,1,10,best,TPESampler,COMPLETE
1114,0.6504215924944643,2025-04-24 21:07:36.426496,2025-04-24 21:07:37.239064,0 days 00:00:00.812568,friedman_mse,30,sqrt,3,9,best,TPESampler,COMPLETE
1115,0.5619714929648851,2025-04-24 21:07:37.188437,2025-04-24 21:07:37.952821,0 days 00:00:00.764384,friedman_mse,23,sqrt,1,4,best,TPESampler,COMPLETE
1116,0.878930627702796,2025-04-24 21:07:37.293837,2025-04-24 21:07:38.335710,0 days 00:00:01.041873,friedman_mse,35,log2,6,2,random,TPESampler,COMPLETE
1117,0.6468388466289531,2025-04-24 21:07:37.489218,2025-04-24 21:07:38.445684,0 days 00:00:00.956466,squared_error,34,sqrt,3,14,best,TPESampler,COMPLETE
1118,0.49068441274037305,2025-04-24 21:07:38.257884,2025-04-24 21:07:38.932037,0 days 00:00:00.674153,friedman_mse,31,sqrt,1,6,best,TPESampler,COMPLETE
1119,0.6194853816763535,2025-04-24 21:07:38.625893,2025-04-24 21:07:39.384793,0 days 00:00:00.758900,friedman_mse,30,sqrt,2,8,best,TPESampler,COMPLETE
1120,0.6194853816763535,2025-04-24 21:07:38.764432,2025-04-24 21:07:39.745903,0 days 00:00:00.981471,friedman_mse,30,sqrt,2,8,best,TPESampler,COMPLETE
1121,0.5520453318079024,2025-04-24 21:07:39.233504,2025-04-24 21:07:40.106340,0 days 00:00:00.872836,friedman_mse,29,sqrt,1,2,best,TPESampler,COMPLETE
1122,0.5262906297733717,2025-04-24 21:07:39.691013,2025-04-24 21:07:40.470642,0 days 00:00:00.779629,friedman_mse,34,sqrt,1,5,best,TPESampler,COMPLETE
1123,0.5137295393660822,2025-04-24 21:07:40.001603,2025-04-24 21:07:40.981160,0 days 00:00:00.979557,friedman_mse,24,sqrt,1,8,best,TPESampler,COMPLETE
1124,0.6456349183315407,2025-04-24 21:07:40.343686,2025-04-24 21:07:41.239293,0 days 00:00:00.895607,friedman_mse,33,sqrt,3,4,best,TPESampler,COMPLETE
1125,0.5975832321496914,2025-04-24 21:07:40.745883,2025-04-24 21:07:41.756815,0 days 00:00:01.010932,friedman_mse,25,sqrt,2,5,best,TPESampler,COMPLETE
1126,0.8932114483036595,2025-04-24 21:07:41.230913,2025-04-24 21:07:42.043230,0 days 00:00:00.812317,squared_error,3,log2,1,9,best,TPESampler,COMPLETE
1127,0.4962324084473796,2025-04-24 21:07:41.541879,2025-04-24 21:07:42.372562,0 days 00:00:00.830683,friedman_mse,29,sqrt,1,6,best,TPESampler,COMPLETE
1128,0.7432319216441641,2025-04-24 21:07:42.044680,2025-04-24 21:07:42.890606,0 days 00:00:00.845926,squared_error,29,log2,2,11,best,TPESampler,COMPLETE
1129,0.8841695981015683,2025-04-24 21:07:42.261591,2025-04-24 21:07:43.206055,0 days 00:00:00.944464,absolute_error,5,sqrt,10,17,best,TPESampler,COMPLETE
1130,0.5262906297733717,2025-04-24 21:07:42.598592,2025-04-24 21:07:43.451044,0 days 00:00:00.852452,friedman_mse,34,sqrt,1,5,best,TPESampler,COMPLETE
1131,0.5546449879220828,2025-04-24 21:07:43.153277,2025-04-24 21:07:43.905772,0 days 00:00:00.752495,friedman_mse,24,sqrt,1,2,best,TPESampler,COMPLETE
1132,0.5233735064493952,2025-04-24 21:07:43.549481,2025-04-24 21:07:44.638075,0 days 00:00:01.088594,friedman_mse,27,sqrt,1,8,best,TPESampler,COMPLETE
1133,0.6504215924944643,2025-04-24 21:07:43.702501,2025-04-24 21:07:44.713133,0 days 00:00:01.010632,friedman_mse,24,sqrt,3,8,best,TPESampler,COMPLETE
1134,0.6504215924944643,2025-04-24 21:07:44.288146,2025-04-24 21:07:45.334759,0 days 00:00:01.046613,friedman_mse,33,sqrt,3,8,best,TPESampler,COMPLETE
1135,0.5338046397110097,2025-04-24 21:07:44.912061,2025-04-24 21:07:46.198731,0 days 00:00:01.286670,friedman_mse,32,sqrt,1,2,best,TPESampler,COMPLETE
1136,0.6515872609760095,2025-04-24 21:07:44.959270,2025-04-24 21:07:46.516082,0 days 00:00:01.556812,squared_error,33,sqrt,2,6,best,TPESampler,COMPLETE
1137,0.46570797980588163,2025-04-24 21:07:45.668144,2025-04-24 21:07:47.211628,0 days 00:00:01.543484,friedman_mse,31,sqrt,1,7,best,TPESampler,COMPLETE
1138,0.6180856799418332,2025-04-24 21:07:47.042514,2025-04-24 21:07:48.966278,0 days 00:00:01.923764,friedman_mse,35,sqrt,2,7,best,TPESampler,COMPLETE
1139,0.550928635982706,2025-04-24 21:07:47.164067,2025-04-24 21:07:49.614124,0 days 00:00:02.450057,friedman_mse,34,sqrt,1,8,best,TPESampler,COMPLETE
1140,0.5289073941272342,2025-04-24 21:07:47.634223,2025-04-24 21:07:50.097977,0 days 00:00:02.463754,friedman_mse,31,sqrt,1,10,best,TPESampler,COMPLETE
1141,0.5129561010742344,2025-04-24 21:07:50.019192,2025-04-24 21:07:51.984655,0 days 00:00:01.965463,friedman_mse,33,sqrt,1,7,best,TPESampler,COMPLETE
1142,0.5669493989992861,2025-04-24 21:07:50.474688,2025-04-24 21:07:52.347096,0 days 00:00:01.872408,friedman_mse,33,sqrt,1,5,best,TPESampler,COMPLETE
1143,0.6289323974475082,2025-04-24 21:07:50.712074,2025-04-24 21:07:52.320842,0 days 00:00:01.608768,squared_error,34,sqrt,2,11,best,TPESampler,COMPLETE
1144,0.5020512557327408,2025-04-24 21:07:52.242916,2025-04-24 21:07:53.335864,0 days 00:00:01.092948,friedman_mse,30,sqrt,1,8,best,TPESampler,COMPLETE
1145,0.6504215924944643,2025-04-24 21:07:52.544932,2025-04-24 21:07:54.164522,0 days 00:00:01.619590,friedman_mse,35,sqrt,3,9,best,TPESampler,COMPLETE
