number,value,datetime_start,datetime_complete,duration,params_criterion,params_max_depth,params_max_features,params_min_samples_leaf,params_min_samples_split,params_splitter,system_attrs_auto:sampler,state
572,0.5191719425869716,2025-04-24 21:04:06.232294,2025-04-24 21:04:07.135826,0 days 00:00:00.903532,friedman_mse,29,sqrt,1,5,best,TPESampler,COMPLETE
573,0.6270092229911071,2025-04-24 21:04:06.789439,2025-04-24 21:04:07.802006,0 days 00:00:01.012567,absolute_error,29,sqrt,3,9,best,TPESampler,COMPLETE
574,0.5366227285243095,2025-04-24 21:04:07.079489,2025-04-24 21:04:07.975473,0 days 00:00:00.895984,absolute_error,29,sqrt,1,9,best,TPESampler,COMPLETE
575,0.5962150622274125,2025-04-24 21:04:07.428327,2025-04-24 21:04:08.359642,0 days 00:00:00.931315,absolute_error,30,sqrt,3,11,best,TPESampler,COMPLETE
576,0.9018784399194749,2025-04-24 21:04:08.144883,2025-04-24 21:04:08.879534,0 days 00:00:00.734651,friedman_mse,3,log2,8,6,random,TPESampler,COMPLETE
577,0.8786486450005158,2025-04-24 21:04:08.253980,2025-04-24 21:04:09.149564,0 days 00:00:00.895584,friedman_mse,19,log2,4,8,random,TPESampler,COMPLETE
578,0.4831415131013947,2025-04-24 21:04:08.601427,2025-04-24 21:04:09.360845,0 days 00:00:00.759418,friedman_mse,31,sqrt,1,8,best,TPESampler,COMPLETE
579,0.6289323974475082,2025-04-24 21:04:09.101624,2025-04-24 21:04:09.791486,0 days 00:00:00.689862,squared_error,35,sqrt,2,10,best,TPESampler,COMPLETE
580,0.5527800949250299,2025-04-24 21:04:09.387936,2025-04-24 21:04:10.164601,0 days 00:00:00.776665,friedman_mse,34,sqrt,1,5,random,TPESampler,COMPLETE
581,0.5197703343770413,2025-04-24 21:04:09.739807,2025-04-24 21:04:10.569571,0 days 00:00:00.829764,absolute_error,35,sqrt,1,11,best,TPESampler,COMPLETE
582,0.8767756438403109,2025-04-24 21:04:09.994770,2025-04-24 21:04:10.731154,0 days 00:00:00.736384,absolute_error,31,sqrt,9,16,random,TPESampler,COMPLETE
583,0.49390761255894267,2025-04-24 21:04:10.469327,2025-04-24 21:04:11.138940,0 days 00:00:00.669613,absolute_error,35,sqrt,1,8,best,TPESampler,COMPLETE
584,0.6504215924944643,2025-04-24 21:04:10.830222,2025-04-24 21:04:11.653143,0 days 00:00:00.822921,friedman_mse,26,sqrt,3,8,best,TPESampler,COMPLETE
585,0.49390761255894267,2025-04-24 21:04:10.988506,2025-04-24 21:04:11.807215,0 days 00:00:00.818709,absolute_error,35,sqrt,1,8,best,TPESampler,COMPLETE
586,0.6258978147164156,2025-04-24 21:04:11.373289,2025-04-24 21:04:12.143674,0 days 00:00:00.770385,squared_error,34,sqrt,1,12,random,TPESampler,COMPLETE
587,0.8739965405465177,2025-04-24 21:04:11.883440,2025-04-24 21:04:12.712974,0 days 00:00:00.829534,friedman_mse,12,log2,5,15,best,TPESampler,COMPLETE
588,0.7125944237588101,2025-04-24 21:04:12.080110,2025-04-24 21:04:12.998452,0 days 00:00:00.918342,absolute_error,22,sqrt,3,20,random,TPESampler,COMPLETE
589,0.90157797490464,2025-04-24 21:04:12.395302,2025-04-24 21:04:13.237064,0 days 00:00:00.841762,squared_error,35,log2,7,9,best,TPESampler,COMPLETE
590,0.5593525150541101,2025-04-24 21:04:12.924986,2025-04-24 21:04:13.760786,0 days 00:00:00.835800,friedman_mse,30,sqrt,1,4,best,TPESampler,COMPLETE
591,0.49068441274037305,2025-04-24 21:04:13.281766,2025-04-24 21:04:13.931529,0 days 00:00:00.649763,friedman_mse,31,sqrt,1,6,best,TPESampler,COMPLETE
592,0.656079065542221,2025-04-24 21:04:13.525603,2025-04-24 21:04:14.522595,0 days 00:00:00.996992,friedman_mse,24,sqrt,3,7,random,TPESampler,COMPLETE
593,0.5281313608724899,2025-04-24 21:04:13.975763,2025-04-24 21:04:14.721515,0 days 00:00:00.745752,absolute_error,35,sqrt,1,4,best,TPESampler,COMPLETE
594,0.8924696613306121,2025-04-24 21:04:14.295725,2025-04-24 21:04:15.025505,0 days 00:00:00.729780,absolute_error,2,log2,3,10,best,TPESampler,COMPLETE
595,0.6504215924944643,2025-04-24 21:04:14.799045,2025-04-24 21:04:15.630626,0 days 00:00:00.831581,friedman_mse,32,sqrt,3,10,best,TPESampler,COMPLETE
596,0.85502796057862,2025-04-24 21:04:15.060283,2025-04-24 21:04:15.801162,0 days 00:00:00.740879,absolute_error,18,log2,2,13,random,TPESampler,COMPLETE
597,0.9015251732962958,2025-04-24 21:04:15.379304,2025-04-24 21:04:16.205927,0 days 00:00:00.826623,absolute_error,7,log2,6,7,best,TPESampler,COMPLETE
598,0.5364518982459593,2025-04-24 21:04:15.903904,2025-04-24 21:04:16.716101,0 days 00:00:00.812197,friedman_mse,24,sqrt,1,5,best,TPESampler,COMPLETE
599,0.5373966342965538,2025-04-24 21:04:16.094955,2025-04-24 21:04:16.902923,0 days 00:00:00.807968,friedman_mse,29,sqrt,1,4,best,TPESampler,COMPLETE
600,0.482024331116523,2025-04-24 21:04:16.474414,2025-04-24 21:04:17.270329,0 days 00:00:00.795915,absolute_error,35,sqrt,1,9,best,TPESampler,COMPLETE
601,0.5339224783480143,2025-04-24 21:04:16.968108,2025-04-24 21:04:17.928940,0 days 00:00:00.960832,friedman_mse,35,sqrt,1,8,best,TPESampler,COMPLETE
602,0.6187065044038689,2025-04-24 21:04:17.161820,2025-04-24 21:04:18.150142,0 days 00:00:00.988322,absolute_error,35,sqrt,3,10,best,TPESampler,COMPLETE
603,0.5975832321496914,2025-04-24 21:04:17.476015,2025-04-24 21:04:18.650852,0 days 00:00:01.174837,friedman_mse,32,sqrt,2,5,best,TPESampler,COMPLETE
604,0.6752359294758304,2025-04-24 21:04:18.135475,2025-04-24 21:04:18.861624,0 days 00:00:00.726149,friedman_mse,30,log2,1,8,best,TPESampler,COMPLETE
605,0.49390761255894267,2025-04-24 21:04:18.421470,2025-04-24 21:04:19.189077,0 days 00:00:00.767607,absolute_error,35,sqrt,1,8,best,TPESampler,COMPLETE
606,0.6430228260911179,2025-04-24 21:04:18.867255,2025-04-24 21:04:19.584812,0 days 00:00:00.717557,friedman_mse,29,sqrt,3,20,random,TPESampler,COMPLETE
607,0.8737590921917946,2025-04-24 21:04:19.145942,2025-04-24 21:04:19.928815,0 days 00:00:00.782873,squared_error,6,sqrt,9,15,random,TPESampler,COMPLETE
608,0.501805213478129,2025-04-24 21:04:19.411337,2025-04-24 21:04:20.410851,0 days 00:00:00.999514,friedman_mse,31,sqrt,1,2,best,TPESampler,COMPLETE
609,0.5329702439043837,2025-04-24 21:04:19.873372,2025-04-24 21:04:20.592800,0 days 00:00:00.719428,squared_error,35,sqrt,1,11,best,TPESampler,COMPLETE
610,0.8737590921917946,2025-04-24 21:04:20.195538,2025-04-24 21:04:20.886374,0 days 00:00:00.690836,squared_error,32,sqrt,10,20,random,TPESampler,COMPLETE
611,0.5415114667144778,2025-04-24 21:04:20.657783,2025-04-24 21:04:21.556939,0 days 00:00:00.899156,absolute_error,29,sqrt,1,8,best,TPESampler,COMPLETE
612,0.6323448549781184,2025-04-24 21:04:20.834659,2025-04-24 21:04:21.863933,0 days 00:00:01.029274,absolute_error,34,sqrt,1,8,random,TPESampler,COMPLETE
613,0.5475140890024266,2025-04-24 21:04:21.064962,2025-04-24 21:04:21.965053,0 days 00:00:00.900091,absolute_error,29,sqrt,1,11,best,TPESampler,COMPLETE
614,0.9018784399194749,2025-04-24 21:04:21.804560,2025-04-24 21:04:22.480190,0 days 00:00:00.675630,friedman_mse,19,log2,9,20,random,TPESampler,COMPLETE
615,0.5197703343770413,2025-04-24 21:04:22.088971,2025-04-24 21:04:22.890732,0 days 00:00:00.801761,absolute_error,35,sqrt,1,11,best,TPESampler,COMPLETE
616,0.5529688132197964,2025-04-24 21:04:22.199322,2025-04-24 21:04:23.214388,0 days 00:00:01.015066,friedman_mse,35,sqrt,1,2,best,TPESampler,COMPLETE
617,0.6456349183315407,2025-04-24 21:04:22.896518,2025-04-24 21:04:23.624020,0 days 00:00:00.727502,friedman_mse,31,sqrt,3,6,best,TPESampler,COMPLETE
618,0.8737590921917946,2025-04-24 21:04:23.165714,2025-04-24 21:04:23.958435,0 days 00:00:00.792721,friedman_mse,33,sqrt,9,11,random,TPESampler,COMPLETE
619,0.5296855957806621,2025-04-24 21:04:23.456344,2025-04-24 21:04:24.269630,0 days 00:00:00.813286,friedman_mse,26,sqrt,1,8,best,TPESampler,COMPLETE
620,0.7164220310759424,2025-04-24 21:04:23.896631,2025-04-24 21:04:24.693316,0 days 00:00:00.796685,squared_error,13,sqrt,5,17,best,TPESampler,COMPLETE
621,0.5433477422291207,2025-04-24 21:04:24.273252,2025-04-24 21:04:25.044513,0 days 00:00:00.771261,absolute_error,35,sqrt,1,7,best,TPESampler,COMPLETE
622,0.6456349183315407,2025-04-24 21:04:24.525424,2025-04-24 21:04:25.382605,0 days 00:00:00.857181,friedman_mse,35,sqrt,3,6,best,TPESampler,COMPLETE
623,0.6858428787475002,2025-04-24 21:04:24.921668,2025-04-24 21:04:25.720872,0 days 00:00:00.799204,absolute_error,14,sqrt,6,3,best,TPESampler,COMPLETE
624,0.4962324084473796,2025-04-24 21:04:25.275128,2025-04-24 21:04:25.981245,0 days 00:00:00.706117,friedman_mse,29,sqrt,1,6,best,TPESampler,COMPLETE
625,0.5540979794176473,2025-04-24 21:04:25.713910,2025-04-24 21:04:26.367202,0 days 00:00:00.653292,friedman_mse,23,sqrt,1,6,best,TPESampler,COMPLETE
626,0.6140253855158658,2025-04-24 21:04:26.093447,2025-04-24 21:04:26.906000,0 days 00:00:00.812553,absolute_error,35,sqrt,3,9,best,TPESampler,COMPLETE
627,0.6571182014915999,2025-04-24 21:04:26.251540,2025-04-24 21:04:27.061694,0 days 00:00:00.810154,squared_error,34,log2,1,15,best,TPESampler,COMPLETE
628,0.5185211704314117,2025-04-24 21:04:26.604604,2025-04-24 21:04:27.442118,0 days 00:00:00.837514,friedman_mse,30,sqrt,1,10,best,TPESampler,COMPLETE
629,0.6187065044038689,2025-04-24 21:04:27.161723,2025-04-24 21:04:27.995739,0 days 00:00:00.834016,absolute_error,35,sqrt,3,10,best,TPESampler,COMPLETE
630,0.5131501014074039,2025-04-24 21:04:27.326263,2025-04-24 21:04:28.183040,0 days 00:00:00.856777,absolute_error,30,sqrt,1,8,best,TPESampler,COMPLETE
631,0.5724846347554697,2025-04-24 21:04:27.676943,2025-04-24 21:04:28.376913,0 days 00:00:00.699970,friedman_mse,30,sqrt,1,7,best,TPESampler,COMPLETE
632,0.49390761255894267,2025-04-24 21:04:28.223802,2025-04-24 21:04:29.199691,0 days 00:00:00.975889,absolute_error,35,sqrt,1,8,best,TPESampler,COMPLETE
633,0.49169508102649473,2025-04-24 21:04:28.444483,2025-04-24 21:04:29.546184,0 days 00:00:01.101701,absolute_error,35,sqrt,1,10,best,TPESampler,COMPLETE
634,0.6456349183315407,2025-04-24 21:04:28.604753,2025-04-24 21:04:29.444888,0 days 00:00:00.840135,friedman_mse,26,sqrt,3,5,best,TPESampler,COMPLETE
635,0.49783262823116015,2025-04-24 21:04:29.507987,2025-04-24 21:04:30.236263,0 days 00:00:00.728276,friedman_mse,31,sqrt,1,5,best,TPESampler,COMPLETE
636,0.5976436569338668,2025-04-24 21:04:29.703278,2025-04-24 21:04:30.613113,0 days 00:00:00.909835,absolute_error,30,sqrt,3,6,best,TPESampler,COMPLETE
637,0.5895652958936961,2025-04-24 21:04:29.752775,2025-04-24 21:04:30.832231,0 days 00:00:01.079456,absolute_error,35,sqrt,1,14,best,TPESampler,COMPLETE
638,0.90157797490464,2025-04-24 21:04:30.647116,2025-04-24 21:04:31.518120,0 days 00:00:00.871004,squared_error,14,log2,8,18,best,TPESampler,COMPLETE
639,0.6456349183315407,2025-04-24 21:04:30.841550,2025-04-24 21:04:31.768398,0 days 00:00:00.926848,friedman_mse,27,sqrt,3,2,best,TPESampler,COMPLETE
640,0.6456349183315407,2025-04-24 21:04:31.043016,2025-04-24 21:04:31.865526,0 days 00:00:00.822510,friedman_mse,23,sqrt,3,2,best,TPESampler,COMPLETE
641,0.5724846347554697,2025-04-24 21:04:31.777857,2025-04-24 21:04:32.658118,0 days 00:00:00.880261,friedman_mse,30,sqrt,1,7,best,TPESampler,COMPLETE
642,0.5426767441012503,2025-04-24 21:04:31.987148,2025-04-24 21:04:32.798825,0 days 00:00:00.811677,friedman_mse,19,sqrt,1,9,best,TPESampler,COMPLETE
643,0.8737590921917946,2025-04-24 21:04:32.156238,2025-04-24 21:04:32.955894,0 days 00:00:00.799656,squared_error,32,sqrt,6,8,random,TPESampler,COMPLETE
644,0.5366227285243095,2025-04-24 21:04:32.907469,2025-04-24 21:04:33.674954,0 days 00:00:00.767485,absolute_error,29,sqrt,1,9,best,TPESampler,COMPLETE
645,0.49169508102649473,2025-04-24 21:04:33.026031,2025-04-24 21:04:34.149506,0 days 00:00:01.123475,absolute_error,35,sqrt,1,10,best,TPESampler,COMPLETE
646,0.6221801846102784,2025-04-24 21:04:33.198891,2025-04-24 21:04:34.238049,0 days 00:00:01.039158,absolute_error,35,sqrt,3,6,best,TPESampler,COMPLETE
647,0.8737590921917946,2025-04-24 21:04:34.040092,2025-04-24 21:04:34.669326,0 days 00:00:00.629234,friedman_mse,23,sqrt,7,3,random,TPESampler,COMPLETE
648,0.48921668337565616,2025-04-24 21:04:34.398054,2025-04-24 21:04:35.224602,0 days 00:00:00.826548,friedman_mse,32,sqrt,1,6,best,TPESampler,COMPLETE
649,0.74349522764793,2025-04-24 21:04:34.455782,2025-04-24 21:04:35.355410,0 days 00:00:00.899628,friedman_mse,26,log2,3,3,best,TPESampler,COMPLETE
650,0.482024331116523,2025-04-24 21:04:34.971761,2025-04-24 21:04:35.674706,0 days 00:00:00.702945,absolute_error,35,sqrt,1,9,best,TPESampler,COMPLETE
651,0.6504215924944643,2025-04-24 21:04:35.539562,2025-04-24 21:04:36.572759,0 days 00:00:01.033197,friedman_mse,23,sqrt,3,8,best,TPESampler,COMPLETE
652,0.8790475103328365,2025-04-24 21:04:35.608664,2025-04-24 21:04:36.356676,0 days 00:00:00.748012,absolute_error,29,log2,5,9,random,TPESampler,COMPLETE
653,0.5513554337953424,2025-04-24 21:04:35.902499,2025-04-24 21:04:36.694515,0 days 00:00:00.792016,friedman_mse,27,sqrt,1,5,best,TPESampler,COMPLETE
654,0.5348776862952044,2025-04-24 21:04:36.652027,2025-04-24 21:04:37.759508,0 days 00:00:01.107481,friedman_mse,26,sqrt,1,2,best,TPESampler,COMPLETE
655,0.6087873649630308,2025-04-24 21:04:36.841862,2025-04-24 21:04:37.679179,0 days 00:00:00.837317,absolute_error,30,sqrt,3,13,best,TPESampler,COMPLETE
656,0.5669493989992861,2025-04-24 21:04:36.889632,2025-04-24 21:04:37.880325,0 days 00:00:00.990693,friedman_mse,33,sqrt,1,5,best,TPESampler,COMPLETE
657,0.5433477422291207,2025-04-24 21:04:37.927034,2025-04-24 21:04:38.735059,0 days 00:00:00.808025,absolute_error,35,sqrt,1,7,best,TPESampler,COMPLETE
658,0.5085288623263258,2025-04-24 21:04:37.990209,2025-04-24 21:04:39.038616,0 days 00:00:01.048407,friedman_mse,35,sqrt,1,9,best,TPESampler,COMPLETE
659,0.9015251732962958,2025-04-24 21:04:38.160782,2025-04-24 21:04:38.899441,0 days 00:00:00.738659,absolute_error,31,log2,9,15,best,TPESampler,COMPLETE
660,0.496257590485042,2025-04-24 21:04:38.994477,2025-04-24 21:04:39.726476,0 days 00:00:00.731999,friedman_mse,34,sqrt,1,4,best,TPESampler,COMPLETE
661,0.5475140890024266,2025-04-24 21:04:39.115899,2025-04-24 21:04:40.098774,0 days 00:00:00.982875,absolute_error,29,sqrt,1,11,best,TPESampler,COMPLETE
662,0.5665858478164871,2025-04-24 21:04:39.269684,2025-04-24 21:04:40.215743,0 days 00:00:00.946059,absolute_error,28,sqrt,1,3,best,TPESampler,COMPLETE
663,0.5197703343770413,2025-04-24 21:04:40.011999,2025-04-24 21:04:40.783262,0 days 00:00:00.771263,absolute_error,35,sqrt,1,11,best,TPESampler,COMPLETE
664,0.8786486450005158,2025-04-24 21:04:40.336923,2025-04-24 21:04:41.098468,0 days 00:00:00.761545,squared_error,23,log2,4,9,random,TPESampler,COMPLETE
665,0.6456349183315407,2025-04-24 21:04:40.583086,2025-04-24 21:04:41.299534,0 days 00:00:00.716448,friedman_mse,29,sqrt,3,6,best,TPESampler,COMPLETE
666,0.5298778451782702,2025-04-24 21:04:41.021546,2025-04-24 21:04:41.790607,0 days 00:00:00.769061,squared_error,32,sqrt,1,7,best,TPESampler,COMPLETE
667,0.8510024615078068,2025-04-24 21:04:41.374374,2025-04-24 21:04:42.137486,0 days 00:00:00.763112,squared_error,31,log2,2,14,random,TPESampler,COMPLETE
668,0.47983015285862346,2025-04-24 21:04:41.525661,2025-04-24 21:04:42.401153,0 days 00:00:00.875492,friedman_mse,28,sqrt,1,6,best,TPESampler,COMPLETE
669,0.5327880009702136,2025-04-24 21:04:42.075581,2025-04-24 21:04:42.861783,0 days 00:00:00.786202,friedman_mse,26,sqrt,1,9,best,TPESampler,COMPLETE
670,0.5772440340692454,2025-04-24 21:04:42.473312,2025-04-24 21:04:43.218566,0 days 00:00:00.745254,friedman_mse,20,sqrt,1,7,best,TPESampler,COMPLETE
671,0.4841824780964295,2025-04-24 21:04:42.683153,2025-04-24 21:04:43.545366,0 days 00:00:00.862213,friedman_mse,25,sqrt,1,5,best,TPESampler,COMPLETE
672,0.5191719425869716,2025-04-24 21:04:43.094389,2025-04-24 21:04:44.010350,0 days 00:00:00.915961,friedman_mse,29,sqrt,1,5,best,TPESampler,COMPLETE
673,0.9018784399194749,2025-04-24 21:04:43.535231,2025-04-24 21:04:44.294988,0 days 00:00:00.759757,squared_error,28,log2,10,18,random,TPESampler,COMPLETE
674,0.5191719425869716,2025-04-24 21:04:43.814875,2025-04-24 21:04:44.945050,0 days 00:00:01.130175,friedman_mse,29,sqrt,1,5,best,TPESampler,COMPLETE
675,0.8106497546097036,2025-04-24 21:04:44.297923,2025-04-24 21:04:45.125421,0 days 00:00:00.827498,absolute_error,24,sqrt,4,8,random,TPESampler,COMPLETE
676,0.6254776933780483,2025-04-24 21:04:44.550900,2025-04-24 21:04:45.449755,0 days 00:00:00.898855,squared_error,18,sqrt,2,7,best,TPESampler,COMPLETE
677,0.6456349183315407,2025-04-24 21:04:45.183200,2025-04-24 21:04:45.994797,0 days 00:00:00.811597,squared_error,34,sqrt,3,2,best,TPESampler,COMPLETE
678,0.6504215924944643,2025-04-24 21:04:45.451168,2025-04-24 21:04:46.163894,0 days 00:00:00.712726,friedman_mse,28,sqrt,3,8,best,TPESampler,COMPLETE
679,0.5157610196982807,2025-04-24 21:04:45.685193,2025-04-24 21:04:46.508086,0 days 00:00:00.822893,friedman_mse,26,sqrt,1,7,best,TPESampler,COMPLETE
680,0.6456349183315407,2025-04-24 21:04:46.280722,2025-04-24 21:04:47.016639,0 days 00:00:00.735917,friedman_mse,32,sqrt,3,5,best,TPESampler,COMPLETE
681,0.5157610196982807,2025-04-24 21:04:46.436037,2025-04-24 21:04:47.188023,0 days 00:00:00.751986,friedman_mse,26,sqrt,1,7,best,TPESampler,COMPLETE
682,0.8737590921917946,2025-04-24 21:04:46.730012,2025-04-24 21:04:47.738588,0 days 00:00:01.008576,squared_error,9,sqrt,8,2,random,TPESampler,COMPLETE
683,0.629580205976257,2025-04-24 21:04:47.255079,2025-04-24 21:04:47.942885,0 days 00:00:00.687806,friedman_mse,22,sqrt,1,7,random,TPESampler,COMPLETE
684,0.6289323974475082,2025-04-24 21:04:47.508720,2025-04-24 21:04:48.287114,0 days 00:00:00.778394,friedman_mse,31,sqrt,2,9,best,TPESampler,COMPLETE
685,0.5373966342965538,2025-04-24 21:04:48.011950,2025-04-24 21:04:49.086680,0 days 00:00:01.074730,friedman_mse,29,sqrt,1,4,best,TPESampler,COMPLETE
686,0.48921668337565616,2025-04-24 21:04:48.220786,2025-04-24 21:04:49.265552,0 days 00:00:01.044766,friedman_mse,32,sqrt,1,6,best,TPESampler,COMPLETE
687,0.6806135153170361,2025-04-24 21:04:48.552375,2025-04-24 21:04:49.644301,0 days 00:00:01.091926,friedman_mse,33,sqrt,7,12,best,TPESampler,COMPLETE
688,0.6265479990281826,2025-04-24 21:04:49.415675,2025-04-24 21:04:50.222359,0 days 00:00:00.806684,friedman_mse,31,sqrt,2,2,best,TPESampler,COMPLETE
689,0.5724846347554697,2025-04-24 21:04:49.582197,2025-04-24 21:04:50.572724,0 days 00:00:00.990527,friedman_mse,30,sqrt,1,7,best,TPESampler,COMPLETE
690,0.8929076253830125,2025-04-24 21:04:49.907832,2025-04-24 21:04:50.756944,0 days 00:00:00.849112,squared_error,1,log2,2,19,best,TPESampler,COMPLETE
691,0.6064691246415054,2025-04-24 21:04:50.521357,2025-04-24 21:04:51.291609,0 days 00:00:00.770252,friedman_mse,34,sqrt,2,2,random,TPESampler,COMPLETE
692,0.5364579699886214,2025-04-24 21:04:50.826425,2025-04-24 21:04:51.619060,0 days 00:00:00.792635,squared_error,25,sqrt,1,7,best,TPESampler,COMPLETE
693,0.6181570352809064,2025-04-24 21:04:51.010481,2025-04-24 21:04:51.811114,0 days 00:00:00.800633,absolute_error,25,log2,1,11,best,TPESampler,COMPLETE
694,0.5085288623263258,2025-04-24 21:04:51.555727,2025-04-24 21:04:52.312513,0 days 00:00:00.756786,squared_error,35,sqrt,1,9,best,TPESampler,COMPLETE
695,0.8924908961230087,2025-04-24 21:04:51.874315,2025-04-24 21:04:52.676005,0 days 00:00:00.801690,absolute_error,1,sqrt,7,15,random,TPESampler,COMPLETE
696,0.5011482218769929,2025-04-24 21:04:52.051973,2025-04-24 21:04:53.008990,0 days 00:00:00.957017,friedman_mse,25,sqrt,1,8,best,TPESampler,COMPLETE
697,0.5868750603971733,2025-04-24 21:04:52.616458,2025-04-24 21:04:53.365227,0 days 00:00:00.748769,friedman_mse,35,sqrt,1,7,best,TPESampler,COMPLETE
698,0.5529688132197964,2025-04-24 21:04:52.902827,2025-04-24 21:04:53.776330,0 days 00:00:00.873503,friedman_mse,35,sqrt,1,2,best,TPESampler,COMPLETE
699,0.6265479990281826,2025-04-24 21:04:53.236733,2025-04-24 21:04:53.962503,0 days 00:00:00.725770,friedman_mse,35,sqrt,2,4,best,TPESampler,COMPLETE
700,0.5546449879220828,2025-04-24 21:04:53.687363,2025-04-24 21:04:54.333609,0 days 00:00:00.646246,friedman_mse,24,sqrt,1,2,best,TPESampler,COMPLETE
701,0.5185211704314117,2025-04-24 21:04:54.050115,2025-04-24 21:04:54.820919,0 days 00:00:00.770804,friedman_mse,30,sqrt,1,10,best,TPESampler,COMPLETE
702,0.6180856799418332,2025-04-24 21:04:54.207993,2025-04-24 21:04:54.990460,0 days 00:00:00.782467,friedman_mse,27,sqrt,2,7,best,TPESampler,COMPLETE
703,0.5578889301174688,2025-04-24 21:04:54.546318,2025-04-24 21:04:55.498027,0 days 00:00:00.951709,friedman_mse,23,sqrt,1,5,best,TPESampler,COMPLETE
704,0.6456349183315407,2025-04-24 21:04:55.002583,2025-04-24 21:04:55.673997,0 days 00:00:00.671414,friedman_mse,29,sqrt,3,5,best,TPESampler,COMPLETE
705,0.6140253855158658,2025-04-24 21:04:55.256730,2025-04-24 21:04:56.006426,0 days 00:00:00.749696,absolute_error,35,sqrt,3,9,best,TPESampler,COMPLETE
706,0.7272485230848159,2025-04-24 21:04:55.735792,2025-04-24 21:04:56.522956,0 days 00:00:00.787164,friedman_mse,12,sqrt,1,2,random,TPESampler,COMPLETE
707,0.5180341307456252,2025-04-24 21:04:55.896643,2025-04-24 21:04:56.683487,0 days 00:00:00.786844,absolute_error,30,sqrt,1,5,best,TPESampler,COMPLETE
708,0.90157797490464,2025-04-24 21:04:56.269478,2025-04-24 21:04:57.326169,0 days 00:00:01.056691,friedman_mse,23,log2,8,9,best,TPESampler,COMPLETE
709,0.7344402278686787,2025-04-24 21:04:56.792340,2025-04-24 21:04:57.522165,0 days 00:00:00.729825,friedman_mse,26,log2,2,6,best,TPESampler,COMPLETE
710,0.6424354303228184,2025-04-24 21:04:56.883784,2025-04-24 21:04:57.631848,0 days 00:00:00.748064,friedman_mse,15,sqrt,1,19,best,TPESampler,COMPLETE
711,0.5191719425869716,2025-04-24 21:04:57.568528,2025-04-24 21:04:58.217912,0 days 00:00:00.649384,friedman_mse,29,sqrt,1,5,best,TPESampler,COMPLETE
712,0.5860801369355814,2025-04-24 21:04:57.765798,2025-04-24 21:04:58.615968,0 days 00:00:00.850170,absolute_error,28,sqrt,2,11,best,TPESampler,COMPLETE
713,0.6861911563373202,2025-04-24 21:04:57.985690,2025-04-24 21:04:58.828368,0 days 00:00:00.842678,squared_error,21,sqrt,9,20,best,TPESampler,COMPLETE
714,0.5202466614878716,2025-04-24 21:04:58.566142,2025-04-24 21:04:59.242740,0 days 00:00:00.676598,friedman_mse,29,sqrt,1,7,best,TPESampler,COMPLETE
