number,value,datetime_start,datetime_complete,duration,params_criterion,params_max_depth,params_max_features,params_min_samples_leaf,params_min_samples_split,params_splitter,system_attrs_auto:sampler,state
1718,0.5677949958063961,2025-04-24 21:11:50.832482,2025-04-24 21:11:51.763235,0 days 00:00:00.930753,friedman_mse,27,sqrt,1,10,best,TPESampler,COMPLETE
1719,0.5137295393660822,2025-04-24 21:11:51.156929,2025-04-24 21:11:52.025968,0 days 00:00:00.869039,friedman_mse,24,sqrt,1,8,best,TPESampler,COMPLETE
1720,0.49100091803166096,2025-04-24 21:11:51.715094,2025-04-24 21:11:52.437078,0 days 00:00:00.721984,friedman_mse,32,sqrt,1,8,best,TPESampler,COMPLETE
1721,0.6456349183315407,2025-04-24 21:11:52.154417,2025-04-24 21:11:53.064552,0 days 00:00:00.910135,friedman_mse,30,sqrt,3,4,best,TPESampler,COMPLETE
1722,0.6396164713232063,2025-04-24 21:11:52.314358,2025-04-24 21:11:53.297002,0 days 00:00:00.982644,friedman_mse,29,log2,1,5,best,TPESampler,COMPLETE
1723,0.6194853816763535,2025-04-24 21:11:52.696056,2025-04-24 21:11:53.676006,0 days 00:00:00.979950,friedman_mse,31,sqrt,2,8,best,TPESampler,COMPLETE
1724,0.49783262823116015,2025-04-24 21:11:53.351088,2025-04-24 21:11:54.321402,0 days 00:00:00.970314,friedman_mse,31,sqrt,1,5,best,TPESampler,COMPLETE
1725,0.7347730864087854,2025-04-24 21:11:53.546276,2025-04-24 21:11:54.501275,0 days 00:00:00.954999,squared_error,13,log2,3,7,best,TPESampler,COMPLETE
1726,0.6456349183315407,2025-04-24 21:11:54.003990,2025-04-24 21:11:54.794989,0 days 00:00:00.790999,friedman_mse,35,sqrt,3,6,best,TPESampler,COMPLETE
1727,0.4947310621805249,2025-04-24 21:11:54.725323,2025-04-24 21:11:55.544774,0 days 00:00:00.819451,friedman_mse,26,sqrt,1,5,best,TPESampler,COMPLETE
1728,0.5373966342965538,2025-04-24 21:11:54.841996,2025-04-24 21:11:55.949952,0 days 00:00:01.107956,friedman_mse,29,sqrt,1,4,best,TPESampler,COMPLETE
1729,0.5129971695350808,2025-04-24 21:11:55.034207,2025-04-24 21:11:56.159020,0 days 00:00:01.124813,friedman_mse,30,sqrt,1,9,best,TPESampler,COMPLETE
1730,0.49100091803166096,2025-04-24 21:11:55.875724,2025-04-24 21:11:56.748565,0 days 00:00:00.872841,friedman_mse,32,sqrt,1,8,best,TPESampler,COMPLETE
1731,0.6265479990281826,2025-04-24 21:11:56.224587,2025-04-24 21:11:57.112379,0 days 00:00:00.887792,friedman_mse,31,sqrt,2,2,best,TPESampler,COMPLETE
1732,0.5339224783480143,2025-04-24 21:11:56.476268,2025-04-24 21:11:57.700177,0 days 00:00:01.223909,friedman_mse,35,sqrt,1,8,best,TPESampler,COMPLETE
1733,0.5517493393728706,2025-04-24 21:11:57.104948,2025-04-24 21:11:57.912253,0 days 00:00:00.807305,friedman_mse,35,sqrt,1,4,best,TPESampler,COMPLETE
1734,0.6504215924944643,2025-04-24 21:11:57.370303,2025-04-24 21:11:58.220353,0 days 00:00:00.850050,friedman_mse,20,sqrt,3,10,best,TPESampler,COMPLETE
1735,0.4947310621805249,2025-04-24 21:11:58.126210,2025-04-24 21:11:59.069862,0 days 00:00:00.943652,friedman_mse,26,sqrt,1,5,best,TPESampler,COMPLETE
1736,0.8929076253830125,2025-04-24 21:11:58.177229,2025-04-24 21:11:59.155883,0 days 00:00:00.978654,friedman_mse,1,log2,2,11,best,TPESampler,COMPLETE
1737,0.6515872609760095,2025-04-24 21:11:58.703555,2025-04-24 21:11:59.471666,0 days 00:00:00.768111,friedman_mse,30,sqrt,2,6,best,TPESampler,COMPLETE
1738,0.7688466480043374,2025-04-24 21:11:59.422457,2025-04-24 21:12:00.387160,0 days 00:00:00.964703,friedman_mse,19,sqrt,5,13,random,TPESampler,COMPLETE
1739,0.6456349183315407,2025-04-24 21:11:59.478055,2025-04-24 21:12:00.380187,0 days 00:00:00.902132,friedman_mse,31,sqrt,3,7,best,TPESampler,COMPLETE
1740,0.5202466614878716,2025-04-24 21:12:00.016115,2025-04-24 21:12:00.766263,0 days 00:00:00.750148,friedman_mse,29,sqrt,1,7,best,TPESampler,COMPLETE
1741,0.48333612106664076,2025-04-24 21:12:00.721347,2025-04-24 21:12:01.638809,0 days 00:00:00.917462,friedman_mse,31,sqrt,1,4,best,TPESampler,COMPLETE
1742,0.7432319216441641,2025-04-24 21:12:00.815222,2025-04-24 21:12:02.209684,0 days 00:00:01.394462,friedman_mse,30,log2,2,11,best,TPESampler,COMPLETE
1743,0.69351465341836,2025-04-24 21:12:01.059193,2025-04-24 21:12:02.193579,0 days 00:00:01.134386,friedman_mse,28,sqrt,6,9,best,TPESampler,COMPLETE
1744,0.90157797490464,2025-04-24 21:12:01.958812,2025-04-24 21:12:02.741172,0 days 00:00:00.782360,squared_error,11,log2,9,13,best,TPESampler,COMPLETE
1745,0.5339224783480143,2025-04-24 21:12:02.444142,2025-04-24 21:12:03.438469,0 days 00:00:00.994327,friedman_mse,35,sqrt,1,8,best,TPESampler,COMPLETE
1746,0.6180856799418332,2025-04-24 21:12:02.502004,2025-04-24 21:12:03.556181,0 days 00:00:01.054177,friedman_mse,35,sqrt,2,7,best,TPESampler,COMPLETE
1747,0.5364579699886214,2025-04-24 21:12:03.271294,2025-04-24 21:12:04.095365,0 days 00:00:00.824071,friedman_mse,25,sqrt,1,7,best,TPESampler,COMPLETE
1748,0.6504215924944643,2025-04-24 21:12:03.755885,2025-04-24 21:12:04.714569,0 days 00:00:00.958684,friedman_mse,29,sqrt,3,10,best,TPESampler,COMPLETE
1749,0.6387887584322929,2025-04-24 21:12:03.962440,2025-04-24 21:12:04.901196,0 days 00:00:00.938756,friedman_mse,23,sqrt,1,5,random,TPESampler,COMPLETE
1750,0.4750160173487102,2025-04-24 21:12:04.387028,2025-04-24 21:12:05.186191,0 days 00:00:00.799163,squared_error,32,sqrt,1,5,best,TPESampler,COMPLETE
1751,0.500848998379332,2025-04-24 21:12:04.941789,2025-04-24 21:12:05.802787,0 days 00:00:00.860998,friedman_mse,30,sqrt,1,2,best,TPESampler,COMPLETE
1752,0.6207223668636112,2025-04-24 21:12:05.195047,2025-04-24 21:12:06.306146,0 days 00:00:01.111099,squared_error,32,sqrt,3,3,random,TPESampler,COMPLETE
1753,0.6456349183315407,2025-04-24 21:12:05.486737,2025-04-24 21:12:06.418618,0 days 00:00:00.931881,friedman_mse,25,sqrt,3,7,best,TPESampler,COMPLETE
1754,0.47245231313348,2025-04-24 21:12:06.118539,2025-04-24 21:12:07.177447,0 days 00:00:01.058908,friedman_mse,30,sqrt,1,6,best,TPESampler,COMPLETE
1755,0.5050330543762468,2025-04-24 21:12:06.718356,2025-04-24 21:12:07.906467,0 days 00:00:01.188111,friedman_mse,29,sqrt,1,10,best,TPESampler,COMPLETE
1756,0.6456349183315407,2025-04-24 21:12:06.861615,2025-04-24 21:12:08.108133,0 days 00:00:01.246518,friedman_mse,31,sqrt,3,4,best,TPESampler,COMPLETE
1757,0.5975832321496914,2025-04-24 21:12:07.579277,2025-04-24 21:12:08.544351,0 days 00:00:00.965074,friedman_mse,29,sqrt,2,5,best,TPESampler,COMPLETE
1758,0.4962324084473796,2025-04-24 21:12:08.227184,2025-04-24 21:12:09.356667,0 days 00:00:01.129483,friedman_mse,29,sqrt,1,6,best,TPESampler,COMPLETE
1759,0.5202466614878716,2025-04-24 21:12:08.404501,2025-04-24 21:12:09.599067,0 days 00:00:01.194566,friedman_mse,29,sqrt,1,7,best,TPESampler,COMPLETE
1760,0.9015251732962958,2025-04-24 21:12:08.866367,2025-04-24 21:12:09.933669,0 days 00:00:01.067302,absolute_error,1,log2,7,2,best,TPESampler,COMPLETE
1761,0.90157797490464,2025-04-24 21:12:09.766078,2025-04-24 21:12:11.041574,0 days 00:00:01.275496,squared_error,25,log2,8,20,best,TPESampler,COMPLETE
1762,0.6194853816763535,2025-04-24 21:12:09.886502,2025-04-24 21:12:11.044554,0 days 00:00:01.158052,friedman_mse,31,sqrt,2,8,best,TPESampler,COMPLETE
1763,0.5479322564786873,2025-04-24 21:12:10.746414,2025-04-24 21:12:11.602844,0 days 00:00:00.856430,friedman_mse,35,sqrt,1,6,best,TPESampler,COMPLETE
1764,0.8720764985334399,2025-04-24 21:12:11.274497,2025-04-24 21:12:12.326133,0 days 00:00:01.051636,squared_error,24,log2,5,9,best,TPESampler,COMPLETE
1765,0.5989609889803799,2025-04-24 21:12:11.328598,2025-04-24 21:12:12.349404,0 days 00:00:01.020806,friedman_mse,25,sqrt,1,9,best,TPESampler,COMPLETE
1766,0.5593525150541101,2025-04-24 21:12:12.231895,2025-04-24 21:12:13.002597,0 days 00:00:00.770702,friedman_mse,30,sqrt,1,4,best,TPESampler,COMPLETE
1767,0.5081175596164936,2025-04-24 21:12:12.694375,2025-04-24 21:12:13.641811,0 days 00:00:00.947436,squared_error,28,sqrt,1,5,best,TPESampler,COMPLETE
1768,0.5724846347554697,2025-04-24 21:12:12.743054,2025-04-24 21:12:13.733764,0 days 00:00:00.990710,friedman_mse,30,sqrt,1,7,best,TPESampler,COMPLETE
1769,0.6456349183315407,2025-04-24 21:12:13.487254,2025-04-24 21:12:14.427855,0 days 00:00:00.940601,friedman_mse,35,sqrt,3,5,best,TPESampler,COMPLETE
1770,0.6825419058975224,2025-04-24 21:12:13.870899,2025-04-24 21:12:14.841250,0 days 00:00:00.970351,squared_error,30,sqrt,4,6,best,TPESampler,COMPLETE
1771,0.5975832321496914,2025-04-24 21:12:14.002622,2025-04-24 21:12:15.017459,0 days 00:00:01.014837,friedman_mse,28,sqrt,2,5,best,TPESampler,COMPLETE
1772,0.6194853816763535,2025-04-24 21:12:14.768333,2025-04-24 21:12:15.503818,0 days 00:00:00.735485,friedman_mse,30,sqrt,2,8,best,TPESampler,COMPLETE
1773,0.5338046397110097,2025-04-24 21:12:15.149911,2025-04-24 21:12:16.126031,0 days 00:00:00.976120,friedman_mse,32,sqrt,1,2,best,TPESampler,COMPLETE
1774,0.5738143807136875,2025-04-24 21:12:15.356112,2025-04-24 21:12:16.308540,0 days 00:00:00.952428,friedman_mse,33,sqrt,1,6,best,TPESampler,COMPLETE
1775,0.628151894140281,2025-04-24 21:12:15.796530,2025-04-24 21:12:17.099882,0 days 00:00:01.303352,friedman_mse,34,sqrt,1,6,random,TPESampler,COMPLETE
1776,0.4841824780964295,2025-04-24 21:12:16.465198,2025-04-24 21:12:17.320876,0 days 00:00:00.855678,friedman_mse,25,sqrt,1,5,best,TPESampler,COMPLETE
1777,0.5129971695350808,2025-04-24 21:12:16.573671,2025-04-24 21:12:17.544940,0 days 00:00:00.971269,friedman_mse,30,sqrt,1,9,best,TPESampler,COMPLETE
1778,0.6504215924944643,2025-04-24 21:12:17.377580,2025-04-24 21:12:18.411811,0 days 00:00:01.034231,friedman_mse,35,sqrt,3,9,best,TPESampler,COMPLETE
1779,0.6456349183315407,2025-04-24 21:12:17.600096,2025-04-24 21:12:18.849433,0 days 00:00:01.249337,squared_error,25,sqrt,3,3,best,TPESampler,COMPLETE
1780,0.5431074833619304,2025-04-24 21:12:18.106186,2025-04-24 21:12:19.199582,0 days 00:00:01.093396,friedman_mse,34,log2,1,8,best,TPESampler,COMPLETE
1781,0.6456349183315407,2025-04-24 21:12:18.783481,2025-04-24 21:12:19.848477,0 days 00:00:01.064996,friedman_mse,25,sqrt,3,7,best,TPESampler,COMPLETE
1782,0.8921122595733892,2025-04-24 21:12:19.192769,2025-04-24 21:12:20.222243,0 days 00:00:01.029474,friedman_mse,6,log2,3,20,best,TPESampler,COMPLETE
1783,0.49783262823116015,2025-04-24 21:12:19.621689,2025-04-24 21:12:20.479221,0 days 00:00:00.857532,friedman_mse,31,sqrt,1,5,best,TPESampler,COMPLETE
1784,0.6456349183315407,2025-04-24 21:12:20.188808,2025-04-24 21:12:21.030837,0 days 00:00:00.842029,friedman_mse,27,sqrt,3,4,best,TPESampler,COMPLETE
1785,0.6456349183315407,2025-04-24 21:12:20.489263,2025-04-24 21:12:21.393766,0 days 00:00:00.904503,friedman_mse,29,sqrt,3,4,best,TPESampler,COMPLETE
1786,0.5724846347554697,2025-04-24 21:12:20.863419,2025-04-24 21:12:21.856289,0 days 00:00:00.992870,friedman_mse,30,sqrt,1,7,best,TPESampler,COMPLETE
1787,0.5518815421255675,2025-04-24 21:12:21.357566,2025-04-24 21:12:22.199024,0 days 00:00:00.841458,friedman_mse,25,sqrt,1,6,best,TPESampler,COMPLETE
1788,0.5975832321496914,2025-04-24 21:12:21.655278,2025-04-24 21:12:23.047166,0 days 00:00:01.391888,friedman_mse,31,sqrt,2,5,best,TPESampler,COMPLETE
1789,0.49476012163682015,2025-04-24 21:12:22.148033,2025-04-24 21:12:23.121172,0 days 00:00:00.973139,absolute_error,29,sqrt,1,5,best,TPESampler,COMPLETE
1790,0.5262906297733717,2025-04-24 21:12:22.485866,2025-04-24 21:12:23.594253,0 days 00:00:01.108387,friedman_mse,34,sqrt,1,5,best,TPESampler,COMPLETE
1791,0.5129971695350808,2025-04-24 21:12:23.272267,2025-04-24 21:12:24.265633,0 days 00:00:00.993366,friedman_mse,30,sqrt,1,9,best,TPESampler,COMPLETE
1792,0.6504215924944643,2025-04-24 21:12:23.328398,2025-04-24 21:12:24.324398,0 days 00:00:00.996000,friedman_mse,30,sqrt,3,8,best,TPESampler,COMPLETE
1793,0.4831415131013947,2025-04-24 21:12:24.081733,2025-04-24 21:12:24.774114,0 days 00:00:00.692381,friedman_mse,31,sqrt,1,8,best,TPESampler,COMPLETE
1794,0.5868750603971733,2025-04-24 21:12:24.462159,2025-04-24 21:12:25.538918,0 days 00:00:01.076759,friedman_mse,35,sqrt,1,7,best,TPESampler,COMPLETE
1795,0.5298778451782702,2025-04-24 21:12:24.511752,2025-04-24 21:12:25.566634,0 days 00:00:01.054882,friedman_mse,32,sqrt,1,7,best,TPESampler,COMPLETE
1796,0.4841824780964295,2025-04-24 21:12:25.277873,2025-04-24 21:12:26.043271,0 days 00:00:00.765398,friedman_mse,25,sqrt,1,5,best,TPESampler,COMPLETE
1797,0.6265479990281826,2025-04-24 21:12:25.779928,2025-04-24 21:12:26.726017,0 days 00:00:00.946089,friedman_mse,30,sqrt,2,4,best,TPESampler,COMPLETE
1798,0.5517493393728706,2025-04-24 21:12:25.833239,2025-04-24 21:12:26.865594,0 days 00:00:01.032355,friedman_mse,35,sqrt,1,4,best,TPESampler,COMPLETE
1799,0.6289323974475082,2025-04-24 21:12:26.524339,2025-04-24 21:12:27.446843,0 days 00:00:00.922504,friedman_mse,25,sqrt,2,10,best,TPESampler,COMPLETE
1800,0.5081175596164936,2025-04-24 21:12:27.033759,2025-04-24 21:12:28.168661,0 days 00:00:01.134902,friedman_mse,28,sqrt,1,5,best,TPESampler,COMPLETE
1801,0.5364579699886214,2025-04-24 21:12:27.181314,2025-04-24 21:12:28.139226,0 days 00:00:00.957912,friedman_mse,25,sqrt,1,7,best,TPESampler,COMPLETE
1802,0.6903750366433126,2025-04-24 21:12:27.950328,2025-04-24 21:12:28.673096,0 days 00:00:00.722768,friedman_mse,20,sqrt,3,19,random,TPESampler,COMPLETE
1803,0.5593525150541101,2025-04-24 21:12:28.411548,2025-04-24 21:12:29.395292,0 days 00:00:00.983744,friedman_mse,30,sqrt,1,4,best,TPESampler,COMPLETE
1804,0.6305471612497648,2025-04-24 21:12:28.463957,2025-04-24 21:12:29.487914,0 days 00:00:01.023957,friedman_mse,28,sqrt,1,4,random,TPESampler,COMPLETE
1805,0.7428004263981904,2025-04-24 21:12:29.036570,2025-04-24 21:12:29.809479,0 days 00:00:00.772909,squared_error,14,log2,1,2,best,TPESampler,COMPLETE
1806,0.5387126777455866,2025-04-24 21:12:29.712257,2025-04-24 21:12:30.598109,0 days 00:00:00.885852,friedman_mse,28,sqrt,1,10,best,TPESampler,COMPLETE
1807,0.5020512557327408,2025-04-24 21:12:29.770225,2025-04-24 21:12:30.890342,0 days 00:00:01.120117,friedman_mse,30,sqrt,1,8,best,TPESampler,COMPLETE
1808,0.6504215924944643,2025-04-24 21:12:30.060216,2025-04-24 21:12:31.131934,0 days 00:00:01.071718,friedman_mse,32,sqrt,3,9,best,TPESampler,COMPLETE
1809,0.6456349183315407,2025-04-24 21:12:30.918312,2025-04-24 21:12:31.759624,0 days 00:00:00.841312,friedman_mse,35,sqrt,3,6,best,TPESampler,COMPLETE
1810,0.4827218654781925,2025-04-24 21:12:31.175952,2025-04-24 21:12:31.936695,0 days 00:00:00.760743,squared_error,34,sqrt,1,6,best,TPESampler,COMPLETE
1811,0.6456349183315407,2025-04-24 21:12:31.432932,2025-04-24 21:12:32.252357,0 days 00:00:00.819425,squared_error,35,sqrt,3,6,best,TPESampler,COMPLETE
1812,0.5182225565736444,2025-04-24 21:12:32.023108,2025-04-24 21:12:32.961864,0 days 00:00:00.938756,friedman_mse,29,sqrt,1,3,best,TPESampler,COMPLETE
1813,0.8790475103328365,2025-04-24 21:12:32.214768,2025-04-24 21:12:33.090477,0 days 00:00:00.875709,absolute_error,35,log2,6,20,random,TPESampler,COMPLETE
1814,0.584280156290597,2025-04-24 21:12:32.607003,2025-04-24 21:12:33.445575,0 days 00:00:00.838572,squared_error,19,sqrt,1,8,best,TPESampler,COMPLETE
1815,0.7459946044096345,2025-04-24 21:12:33.365713,2025-04-24 21:12:34.333326,0 days 00:00:00.967613,friedman_mse,30,log2,2,4,best,TPESampler,COMPLETE
1816,0.74349522764793,2025-04-24 21:12:33.409104,2025-04-24 21:12:34.329606,0 days 00:00:00.920502,friedman_mse,26,log2,3,3,best,TPESampler,COMPLETE
1817,0.6456349183315407,2025-04-24 21:12:33.973720,2025-04-24 21:12:34.724829,0 days 00:00:00.751109,friedman_mse,35,sqrt,3,4,best,TPESampler,COMPLETE
1818,0.5479322564786873,2025-04-24 21:12:34.629776,2025-04-24 21:12:35.651208,0 days 00:00:01.021432,friedman_mse,35,sqrt,1,6,best,TPESampler,COMPLETE
1819,0.5724846347554697,2025-04-24 21:12:34.688444,2025-04-24 21:12:35.652618,0 days 00:00:00.964174,friedman_mse,30,sqrt,1,7,best,TPESampler,COMPLETE
1820,0.5517493393728706,2025-04-24 21:12:35.227730,2025-04-24 21:12:35.970255,0 days 00:00:00.742525,friedman_mse,35,sqrt,1,4,best,TPESampler,COMPLETE
1821,0.6456349183315407,2025-04-24 21:12:35.928568,2025-04-24 21:12:36.705734,0 days 00:00:00.777166,friedman_mse,35,sqrt,3,2,best,TPESampler,COMPLETE
1822,0.6854876709350525,2025-04-24 21:12:35.968993,2025-04-24 21:12:36.888273,0 days 00:00:00.919280,absolute_error,19,sqrt,1,10,best,TPESampler,COMPLETE
1823,0.6180856799418332,2025-04-24 21:12:36.337441,2025-04-24 21:12:37.176548,0 days 00:00:00.839107,friedman_mse,25,sqrt,2,7,best,TPESampler,COMPLETE
1824,0.6456349183315407,2025-04-24 21:12:37.138395,2025-04-24 21:12:38.170164,0 days 00:00:01.031769,friedman_mse,29,sqrt,3,7,best,TPESampler,COMPLETE
1825,0.8739965405465177,2025-04-24 21:12:37.174358,2025-04-24 21:12:38.161759,0 days 00:00:00.987401,squared_error,32,log2,5,18,best,TPESampler,COMPLETE
1826,0.8737590921917946,2025-04-24 21:12:37.904686,2025-04-24 21:12:38.651519,0 days 00:00:00.746833,squared_error,29,sqrt,10,14,random,TPESampler,COMPLETE
1827,0.4947310621805249,2025-04-24 21:12:38.385733,2025-04-24 21:12:39.452627,0 days 00:00:01.066894,friedman_mse,26,sqrt,1,5,best,TPESampler,COMPLETE
1828,0.4937530427079524,2025-04-24 21:12:38.437219,2025-04-24 21:12:39.445386,0 days 00:00:01.008167,friedman_mse,29,sqrt,1,11,best,TPESampler,COMPLETE
1829,0.5191719425869716,2025-04-24 21:12:39.016022,2025-04-24 21:12:39.760353,0 days 00:00:00.744331,friedman_mse,29,sqrt,1,5,best,TPESampler,COMPLETE
1830,0.6194853816763535,2025-04-24 21:12:39.716563,2025-04-24 21:12:40.589221,0 days 00:00:00.872658,friedman_mse,31,sqrt,2,8,best,TPESampler,COMPLETE
1831,0.6456349183315407,2025-04-24 21:12:39.750833,2025-04-24 21:12:40.760045,0 days 00:00:01.009212,friedman_mse,30,sqrt,3,6,best,TPESampler,COMPLETE
1832,0.8537548997563055,2025-04-24 21:12:40.462812,2025-04-24 21:12:41.283896,0 days 00:00:00.821084,squared_error,11,log2,1,2,random,TPESampler,COMPLETE
1833,0.565032535793402,2025-04-24 21:12:40.956215,2025-04-24 21:12:41.907498,0 days 00:00:00.951283,friedman_mse,32,sqrt,1,9,best,TPESampler,COMPLETE
1834,0.5339224783480143,2025-04-24 21:12:41.154918,2025-04-24 21:12:42.077217,0 days 00:00:00.922299,friedman_mse,35,sqrt,1,8,best,TPESampler,COMPLETE
1835,0.6456349183315407,2025-04-24 21:12:41.586730,2025-04-24 21:12:42.404466,0 days 00:00:00.817736,squared_error,27,sqrt,3,6,best,TPESampler,COMPLETE
1836,0.5364518982459593,2025-04-24 21:12:42.291174,2025-04-24 21:12:43.247861,0 days 00:00:00.956687,friedman_mse,24,sqrt,1,5,best,TPESampler,COMPLETE
1837,0.5655777242471537,2025-04-24 21:12:42.356975,2025-04-24 21:12:43.320549,0 days 00:00:00.963574,friedman_mse,23,sqrt,1,9,best,TPESampler,COMPLETE
1838,0.5520453318079024,2025-04-24 21:12:42.955663,2025-04-24 21:12:44.257305,0 days 00:00:01.301642,friedman_mse,29,sqrt,1,2,best,TPESampler,COMPLETE
1839,0.6456349183315407,2025-04-24 21:12:43.524188,2025-04-24 21:12:44.846335,0 days 00:00:01.322147,friedman_mse,23,sqrt,3,4,best,TPESampler,COMPLETE
1840,0.49912878166750996,2025-04-24 21:12:43.573578,2025-04-24 21:12:44.969942,0 days 00:00:01.396364,friedman_mse,28,sqrt,1,7,best,TPESampler,COMPLETE
1841,0.49783262823116015,2025-04-24 21:12:44.871082,2025-04-24 21:12:46.016859,0 days 00:00:01.145777,friedman_mse,31,sqrt,1,5,best,TPESampler,COMPLETE
1842,0.4962324084473796,2025-04-24 21:12:45.298904,2025-04-24 21:12:46.818720,0 days 00:00:01.519816,squared_error,29,sqrt,1,6,best,TPESampler,COMPLETE
1843,0.5529688132197964,2025-04-24 21:12:45.710764,2025-04-24 21:12:47.021742,0 days 00:00:01.310978,friedman_mse,35,sqrt,1,2,best,TPESampler,COMPLETE
1844,0.6515872609760095,2025-04-24 21:12:46.547360,2025-04-24 21:12:48.713399,0 days 00:00:02.166039,friedman_mse,30,sqrt,2,6,best,TPESampler,COMPLETE
1845,0.4831415131013947,2025-04-24 21:12:47.515180,2025-04-24 21:12:49.962827,0 days 00:00:02.447647,friedman_mse,31,sqrt,1,8,best,TPESampler,COMPLETE
1846,0.5868750603971733,2025-04-24 21:12:47.554115,2025-04-24 21:12:49.939800,0 days 00:00:02.385685,friedman_mse,35,sqrt,1,7,best,TPESampler,COMPLETE
1847,0.6315703899188695,2025-04-24 21:12:49.901480,2025-04-24 21:12:51.080653,0 days 00:00:01.179173,friedman_mse,26,sqrt,1,10,random,TPESampler,COMPLETE
1848,0.6456349183315407,2025-04-24 21:12:50.391830,2025-04-24 21:12:52.054541,0 days 00:00:01.662711,friedman_mse,26,sqrt,3,7,best,TPESampler,COMPLETE
1849,0.6504215924944643,2025-04-24 21:12:50.492572,2025-04-24 21:12:52.025456,0 days 00:00:01.532884,friedman_mse,26,sqrt,3,10,best,TPESampler,COMPLETE
1850,0.6456349183315407,2025-04-24 21:12:51.696033,2025-04-24 21:12:52.571667,0 days 00:00:00.875634,friedman_mse,30,sqrt,3,6,best,TPESampler,COMPLETE
1851,0.47245231313348,2025-04-24 21:12:52.269828,2025-04-24 21:12:53.848719,0 days 00:00:01.578891,friedman_mse,30,sqrt,1,6,best,TPESampler,COMPLETE
1852,0.5435622016360893,2025-04-24 21:12:52.335218,2025-04-24 21:12:53.841798,0 days 00:00:01.506580,friedman_mse,27,sqrt,1,7,best,TPESampler,COMPLETE
1853,0.49783262823116015,2025-04-24 21:12:53.121785,2025-04-24 21:12:54.636640,0 days 00:00:01.514855,friedman_mse,31,sqrt,1,5,best,TPESampler,COMPLETE
1854,0.5103041358943772,2025-04-24 21:12:54.130726,2025-04-24 21:12:55.610390,0 days 00:00:01.479664,friedman_mse,31,sqrt,1,9,best,TPESampler,COMPLETE
1855,0.6289323974475082,2025-04-24 21:12:54.183273,2025-04-24 21:12:55.829333,0 days 00:00:01.646060,friedman_mse,29,sqrt,2,10,best,TPESampler,COMPLETE
1856,0.5081175596164936,2025-04-24 21:12:55.538643,2025-04-24 21:12:56.526725,0 days 00:00:00.988082,friedman_mse,28,sqrt,1,5,best,TPESampler,COMPLETE
1857,0.6456349183315407,2025-04-24 21:12:55.976835,2025-04-24 21:12:57.210984,0 days 00:00:01.234149,friedman_mse,30,sqrt,3,3,best,TPESampler,COMPLETE
1858,0.6456349183315407,2025-04-24 21:12:56.121166,2025-04-24 21:12:57.440607,0 days 00:00:01.319441,friedman_mse,27,sqrt,3,2,best,TPESampler,COMPLETE
1859,0.6515872609760095,2025-04-24 21:12:57.160552,2025-04-24 21:12:58.163919,0 days 00:00:01.003367,friedman_mse,35,sqrt,2,6,best,TPESampler,COMPLETE
1860,0.47245231313348,2025-04-24 21:12:57.512865,2025-04-24 21:12:58.888365,0 days 00:00:01.375500,friedman_mse,30,sqrt,1,6,best,TPESampler,COMPLETE
