number,value,datetime_start,datetime_complete,duration,params_constant_value,params_kernel_type,params_length_scale,params_noise_level,params_nu,system_attrs_auto:sampler,state
2288,1.3307518540988315,2025-04-24 21:57:43.026955,2025-04-24 21:57:46.468493,0 days 00:00:03.441538,919.6360450265703,Matern,2134.1599150316006,0.0012203323580781274,1.5,TPESampler,COMPLETE
2289,0.17261843271790395,2025-04-24 21:57:43.074021,2025-04-24 21:57:46.521753,0 days 00:00:03.447732,342.7771682129418,Matern,135.06527843152415,0.004657592996129444,1.5,TPESampler,COMPLETE
2290,1.3307518540995475,2025-04-24 21:57:44.707165,2025-04-24 21:57:49.700862,0 days 00:00:04.993697,108.4974561398158,Matern,92238.87708875329,0.02377561423615246,1.5,TPESampler,COMPLETE
2291,0.17261855385257865,2025-04-24 21:57:46.673712,2025-04-24 21:57:50.362127,0 days 00:00:03.688415,10520.837356414744,Matern,37.732854893436446,0.0056174852822506345,1.5,TPESampler,COMPLETE
2292,1.3307518540987948,2025-04-24 21:57:46.861489,2025-04-24 21:57:52.059486,0 days 00:00:05.197997,34587.68158200382,Matern,63453.4711623046,6.997390600543956e-07,2.5,TPESampler,COMPLETE
2293,0.17261855318088717,2025-04-24 21:57:49.959304,2025-04-24 21:57:54.020204,0 days 00:00:04.060900,5.402360590493435,Matern,366.6127665298256,0.9345118616876834,1.5,TPESampler,COMPLETE
2294,0.1726183711990295,2025-04-24 21:57:50.634939,2025-04-24 21:57:55.355902,0 days 00:00:04.720963,31.956577505997082,Matern,1909.7356037073903,0.9646088903938524,1.5,TPESampler,COMPLETE
2295,1.3307518540987882,2025-04-24 21:57:52.324275,2025-04-24 21:58:00.618094,0 days 00:00:08.293819,0.0015982441708094434,Matern,173.24500560767308,0.0111490708425335,1.5,TPESampler,COMPLETE
2296,0.17261855890848563,2025-04-24 21:57:54.306129,2025-04-24 21:57:58.365652,0 days 00:00:04.059523,1081.448058486151,Matern,1.481188978423705,7.81559857308097e-05,1.5,TPESampler,COMPLETE
2297,0.22211465419211887,2025-04-24 21:57:55.599155,2025-04-24 21:57:59.994890,0 days 00:00:04.395735,11.30981027179204,Matern,1801.6167148181612,0.8464517432232679,2.5,TPESampler,COMPLETE
2298,0.17261786208940622,2025-04-24 21:57:58.603350,2025-04-24 21:58:02.370323,0 days 00:00:03.766973,1272.637565350948,Matern,96.77155489341408,0.004799737651219834,1.5,TPESampler,COMPLETE
2299,1.3307518540987835,2025-04-24 21:58:00.235770,2025-04-24 21:58:08.356633,0 days 00:00:08.120863,4.772368468635814e-05,Matern,15671.779783536216,1.2063009262064786e-10,2.5,TPESampler,COMPLETE
2300,0.17261852888076595,2025-04-24 21:58:00.869523,2025-04-24 21:58:05.328063,0 days 00:00:04.458540,0.8464382952261954,Matern,19.89561312193945,0.033164336737897405,1.5,TPESampler,COMPLETE
2301,0.17261865294353948,2025-04-24 21:58:02.621612,2025-04-24 21:58:07.166244,0 days 00:00:04.544632,52.60698474849084,Matern,714.4389552197322,0.0056177812534434195,1.5,TPESampler,COMPLETE
2302,0.1726185374392748,2025-04-24 21:58:05.581702,2025-04-24 21:58:09.253574,0 days 00:00:03.671872,18.92164013683695,Matern,21.454980572242608,0.05726640827981686,1.5,TPESampler,COMPLETE
2303,0.1726183858320333,2025-04-24 21:58:07.415492,2025-04-24 21:58:12.515618,0 days 00:00:05.100126,22.50601350362057,Matern,3867.9059718951266,0.05375338866800484,1.5,TPESampler,COMPLETE
2304,1.367756005775798,2025-04-24 21:58:08.593623,2025-04-24 21:58:10.539119,0 days 00:00:01.945496,5490.184746527726,Matern,0.07217661669937461,0.000461465921696637,1.5,TPESampler,COMPLETE
2305,1.3677569516687618,2025-04-24 21:58:09.522832,2025-04-24 21:58:13.346849,0 days 00:00:03.824017,4.446242838018214,Matern,95914.9110173972,0.6953727765008489,1.5,TPESampler,COMPLETE
2306,1.3307518540971308,2025-04-24 21:58:10.792779,2025-04-24 21:58:15.970058,0 days 00:00:05.177279,0.00020484254451384946,Matern,35.01156757678865,0.00010044145190333879,1.5,TPESampler,COMPLETE
2307,0.17261855449348998,2025-04-24 21:58:12.792218,2025-04-24 21:58:16.485807,0 days 00:00:03.693589,301.0723136651339,Matern,2.379696180545675,0.06950330793168216,1.5,TPESampler,COMPLETE
2308,0.1726188653407158,2025-04-24 21:58:13.647793,2025-04-24 21:58:16.676032,0 days 00:00:03.028239,1776.2747244518148,Matern,53.86184156616313,0.0002976255238212632,1.5,TPESampler,COMPLETE
2309,1.3307518540987187,2025-04-24 21:58:16.191211,2025-04-24 21:58:19.785791,0 days 00:00:03.594580,622.0975779119597,Matern,3346.418961194944,0.0008760415985824175,1.5,TPESampler,COMPLETE
2310,0.17261848069834246,2025-04-24 21:58:16.728904,2025-04-24 21:58:23.828718,0 days 00:00:07.099814,52.6083152590878,Matern,15.712647952275452,0.08081379454499983,1.5,TPESampler,COMPLETE
2311,0.21064468464567726,2025-04-24 21:58:16.993756,2025-04-24 21:58:20.494159,0 days 00:00:03.500403,4078.355110483573,RBF,586.4370696767016,0.014014061070137657,1.5,TPESampler,COMPLETE
2312,0.1726188271756752,2025-04-24 21:58:20.084540,2025-04-24 21:58:23.795114,0 days 00:00:03.710574,10.018326749995435,Matern,39.669302721922584,0.8330615795217101,1.5,TPESampler,COMPLETE
2313,0.17261852871317754,2025-04-24 21:58:20.763638,2025-04-24 21:58:23.678670,0 days 00:00:02.915032,1892.5220436998434,Matern,232.17947620010295,0.015627151204640644,1.5,TPESampler,COMPLETE
2314,0.17261845145524643,2025-04-24 21:58:23.937450,2025-04-24 21:58:27.141708,0 days 00:00:03.204258,0.14594602462486958,Matern,2.677116116657575,0.0008040592859405352,1.5,TPESampler,COMPLETE
2315,1.3307518540981345,2025-04-24 21:58:24.001586,2025-04-24 21:58:28.029836,0 days 00:00:04.028250,31637.478375556617,Matern,41136.04957931007,0.00019353942532563783,1.5,TPESampler,COMPLETE
2316,1.330751854096725,2025-04-24 21:58:24.037976,2025-04-24 21:58:28.658944,0 days 00:00:04.620968,1936.923394879154,Matern,3177.2017747803993,1.070310438939655e-05,1.5,TPESampler,COMPLETE
2317,0.2106444338656433,2025-04-24 21:58:27.365133,2025-04-24 21:58:31.272703,0 days 00:00:03.907570,0.20225297393562375,RBF,989.2063476556257,0.11663575161622987,1.5,TPESampler,COMPLETE
2318,1.330751854105259,2025-04-24 21:58:28.342085,2025-04-24 21:58:31.574184,0 days 00:00:03.232099,24.896132836195928,Matern,2569.668814020397,0.022116432923019076,1.5,TPESampler,COMPLETE
2319,0.27419010540201966,2025-04-24 21:58:28.903218,2025-04-24 21:58:34.147063,0 days 00:00:05.243845,1328.2310364490725,Matern,1371.992223007886,0.0022539112306312788,0.5,TPESampler,COMPLETE
2320,1.3677560056918217,2025-04-24 21:58:31.484882,2025-04-24 21:58:34.241524,0 days 00:00:02.756642,6.648518297976548e-07,Matern,0.01344730172630254,0.6417795196687754,0.5,TPESampler,COMPLETE
2321,0.17261855169556817,2025-04-24 21:58:31.870179,2025-04-24 21:58:37.767276,0 days 00:00:05.897097,8.423292528963806,Matern,6573.197900741068,0.6814547150031439,1.5,TPESampler,COMPLETE
2322,1.330751854098816,2025-04-24 21:58:34.383217,2025-04-24 21:58:38.249316,0 days 00:00:03.866099,4.369686835814399,Matern,60731.163362797466,0.005272447226601843,0.5,TPESampler,COMPLETE
2323,0.1726185653896613,2025-04-24 21:58:34.434010,2025-04-24 21:58:38.279528,0 days 00:00:03.845518,4.938585773885856,Matern,10.814077717062046,0.9684693372238603,1.5,TPESampler,COMPLETE
2324,0.17261890896442048,2025-04-24 21:58:38.001306,2025-04-24 21:58:41.197216,0 days 00:00:03.195910,5709.826231970791,Matern,49.66777859249174,0.005006187018750913,1.5,TPESampler,COMPLETE
2325,0.1726185619565489,2025-04-24 21:58:38.499636,2025-04-24 21:58:47.236312,0 days 00:00:08.736676,137.54142184716162,Matern,289.8642973773771,0.03758187943994878,1.5,TPESampler,COMPLETE
2326,1.3307518541011691,2025-04-24 21:58:38.557147,2025-04-24 21:58:45.299285,0 days 00:00:06.742138,0.15972631248305744,Matern,5013.316997618239,0.028602217921442186,1.5,TPESampler,COMPLETE
2327,0.17261851803999292,2025-04-24 21:58:41.439714,2025-04-24 21:58:44.550422,0 days 00:00:03.110708,3469.441556567993,Matern,461.51588796855134,0.0021929222760118596,1.5,TPESampler,COMPLETE
2328,0.1726186200802511,2025-04-24 21:58:44.794743,2025-04-24 21:58:50.331069,0 days 00:00:05.536326,2149.5075419373693,Matern,0.749235979633344,0.029875568502441652,1.5,TPESampler,COMPLETE
2329,0.17261855554233452,2025-04-24 21:58:45.610031,2025-04-24 21:58:49.918923,0 days 00:00:04.308892,141.19924382940667,Matern,7.164117431773566,9.106329744294612e-05,1.5,TPESampler,COMPLETE
2330,1.3307518540378904,2025-04-24 21:58:47.500712,2025-04-24 21:58:50.904062,0 days 00:00:03.403350,64.29450587422636,Matern,12226.575054387189,0.00036488558937569735,1.5,TPESampler,COMPLETE
2331,1.3307518540962522,2025-04-24 21:58:50.171807,2025-04-24 21:58:55.520461,0 days 00:00:05.348654,65.53155382613814,Matern,15483.056257034119,0.034925932813661784,1.5,TPESampler,COMPLETE
2332,0.17261806278742017,2025-04-24 21:58:50.586618,2025-04-24 21:58:54.043016,0 days 00:00:03.456398,2812.098463429277,Matern,251.18294869801383,0.0035615545838748063,1.5,TPESampler,COMPLETE
2333,0.17261857867711175,2025-04-24 21:58:51.203219,2025-04-24 21:58:55.422591,0 days 00:00:04.219372,0.003372482823948221,Matern,8.810914391305682,0.026844316909391302,1.5,TPESampler,COMPLETE
2334,0.17261839278919516,2025-04-24 21:58:54.284039,2025-04-24 21:59:02.154474,0 days 00:00:07.870435,2698.796666740016,Matern,59.04437751483078,1.3356677329988423e-05,1.5,TPESampler,COMPLETE
2335,1.3307518540988696,2025-04-24 21:58:55.602016,2025-04-24 21:59:00.412345,0 days 00:00:04.810329,28.913607236504895,Matern,321.3413952261108,0.0011151072187071888,2.5,TPESampler,COMPLETE
2336,1.3307518541001684,2025-04-24 21:58:55.746836,2025-04-24 21:59:00.448992,0 days 00:00:04.702156,0.31569336232790784,RBF,21.7495044101898,0.004849024675006697,1.5,TPESampler,COMPLETE
2337,1.330751854097232,2025-04-24 21:59:00.610426,2025-04-24 21:59:04.771658,0 days 00:00:04.161232,112.67482958664179,RBF,59158.57745508623,6.138497071381924e-09,1.5,TPESampler,COMPLETE
2338,0.17261884288091311,2025-04-24 21:59:00.656637,2025-04-24 21:59:05.386201,0 days 00:00:04.729564,226.9334090425266,Matern,8.838904695425697,0.26749641931427376,1.5,TPESampler,COMPLETE
2339,0.17261861140822277,2025-04-24 21:59:02.434050,2025-04-24 21:59:05.607083,0 days 00:00:03.173033,47.623283250771635,Matern,0.6453470954659921,0.01799904370183032,1.5,TPESampler,COMPLETE
2340,0.17261667121597832,2025-04-24 21:59:05.001419,2025-04-24 21:59:10.845098,0 days 00:00:05.843679,373.2446526260879,Matern,983.2030157090638,0.02013767277585005,1.5,TPESampler,COMPLETE
2341,0.17261860206854893,2025-04-24 21:59:05.616291,2025-04-24 21:59:09.020595,0 days 00:00:03.404304,120.41968514248042,Matern,2945.6045304445847,0.10160824418642113,1.5,TPESampler,COMPLETE
2342,0.17261960632191167,2025-04-24 21:59:05.851725,2025-04-24 21:59:09.200231,0 days 00:00:03.348506,1157.2331632651576,Matern,53.75374961828727,0.02648727960611584,1.5,TPESampler,COMPLETE
2343,0.17261821238470385,2025-04-24 21:59:09.199083,2025-04-24 21:59:18.195693,0 days 00:00:08.996610,370.42407563170946,Matern,6581.6514237994525,0.04523877605361944,1.5,TPESampler,COMPLETE
2344,0.17261831888522622,2025-04-24 21:59:09.488837,2025-04-24 21:59:16.070156,0 days 00:00:06.581319,55.173403065481565,Matern,495.8474358864012,0.03214083356687593,1.5,TPESampler,COMPLETE
2345,1.3677560057812133,2025-04-24 21:59:11.082171,2025-04-24 21:59:15.126890,0 days 00:00:04.044719,34219.12492826851,Matern,0.03533382633983458,1.0644705215951508e-09,2.5,TPESampler,COMPLETE
2346,0.1726185461230104,2025-04-24 21:59:15.337503,2025-04-24 21:59:19.234582,0 days 00:00:03.897079,198.6794803746375,Matern,1230.7113489502447,0.01609692574120258,1.5,TPESampler,COMPLETE
2347,1.3307518540988075,2025-04-24 21:59:16.320979,2025-04-24 21:59:21.137902,0 days 00:00:04.816923,65.83058276734832,Matern,4123.375431784871,0.0005275880527932233,1.5,TPESampler,COMPLETE
2348,1.367756005781017,2025-04-24 21:59:18.441147,2025-04-24 21:59:21.183837,0 days 00:00:02.742690,50606.043198029605,Matern,2.4013580773467735e-05,1.843677825409006e-07,1.5,TPESampler,COMPLETE
2349,1.3307518541000662,2025-04-24 21:59:19.453399,2025-04-24 21:59:24.824488,0 days 00:00:05.371089,27.26572811698127,Matern,53564.801064682084,0.0022374921473606794,1.5,TPESampler,COMPLETE
2350,1.330751854098998,2025-04-24 21:59:21.306958,2025-04-24 21:59:26.043555,0 days 00:00:04.736597,66452.74962412751,RBF,96.60120055831602,2.3855705724417233e-08,1.5,TPESampler,COMPLETE
2351,1.3307518540988166,2025-04-24 21:59:21.355045,2025-04-24 21:59:25.947254,0 days 00:00:04.592209,466.67410247619836,Matern,4711.374908146112,0.005862724074812581,1.5,TPESampler,COMPLETE
2352,1.3307518540968275,2025-04-24 21:59:25.043095,2025-04-24 21:59:29.246666,0 days 00:00:04.203571,651.4292747849984,Matern,30934.13309545403,0.00012323277733174644,2.5,TPESampler,COMPLETE
2353,0.21064600274333595,2025-04-24 21:59:26.147840,2025-04-24 21:59:29.337507,0 days 00:00:03.189667,39.45023948843245,RBF,15.574038829764952,0.00016505315198796404,1.5,TPESampler,COMPLETE
2354,1.3307518540995318,2025-04-24 21:59:26.324741,2025-04-24 21:59:29.396910,0 days 00:00:03.072169,4.153957223586225,Matern,149.62892045569342,0.0007683387645231453,1.5,TPESampler,COMPLETE
2355,0.1726181398779606,2025-04-24 21:59:29.485082,2025-04-24 21:59:34.275158,0 days 00:00:04.790076,1491.7248829413227,Matern,616.966797007302,0.0031942590145951147,1.5,TPESampler,COMPLETE
2356,0.17261847495995666,2025-04-24 21:59:29.533414,2025-04-24 21:59:35.238084,0 days 00:00:05.704670,82.31940962210543,Matern,3057.402439632764,0.029589648498356335,1.5,TPESampler,COMPLETE
2357,0.17261854238681212,2025-04-24 21:59:29.762829,2025-04-24 21:59:33.857486,0 days 00:00:04.094657,371.985956381749,Matern,13081.189889332212,0.04448018108556065,1.5,TPESampler,COMPLETE
2358,1.3307518540949204,2025-04-24 21:59:34.124084,2025-04-24 21:59:39.788347,0 days 00:00:05.664263,0.19486904262477334,Matern,64639.12959055534,0.00016003777489760583,1.5,TPESampler,COMPLETE
2359,1.330751854098763,2025-04-24 21:59:34.559233,2025-04-24 21:59:39.926370,0 days 00:00:05.367137,0.4464565635667608,Matern,630.1107746010705,0.015618342240921013,1.5,TPESampler,COMPLETE
2360,0.17261855305709597,2025-04-24 21:59:35.516718,2025-04-24 21:59:38.687580,0 days 00:00:03.170862,198.836897819891,Matern,2598.6443185826424,0.07163069959942632,1.5,TPESampler,COMPLETE
2361,1.3307518540983925,2025-04-24 21:59:38.940110,2025-04-24 21:59:42.961286,0 days 00:00:04.021176,16.631846195451537,Matern,661.075105270048,1.123071733531487e-05,1.5,TPESampler,COMPLETE
2362,1.3307518540987957,2025-04-24 21:59:39.993701,2025-04-24 21:59:44.678035,0 days 00:00:04.684334,82.7009284651117,Matern,553.6269622218196,0.00045575845155582996,1.5,TPESampler,COMPLETE
2363,0.17261791673748303,2025-04-24 21:59:40.174348,2025-04-24 21:59:46.160754,0 days 00:00:05.986406,1411.6640376090932,Matern,1051.6333840218927,0.0010705921244539987,1.5,TPESampler,COMPLETE
2364,1.330751854098734,2025-04-24 21:59:43.205688,2025-04-24 21:59:47.373235,0 days 00:00:04.167547,646.6806122254615,Matern,3144.2880005304546,0.0013667623134347045,1.5,TPESampler,COMPLETE
2365,0.21064471929289943,2025-04-24 21:59:44.904805,2025-04-24 21:59:48.265933,0 days 00:00:03.361128,2002.4645707532547,RBF,2105.4160106351287,0.9142162307116175,1.5,TPESampler,COMPLETE
2366,0.17261758080289083,2025-04-24 21:59:46.407169,2025-04-24 21:59:53.522067,0 days 00:00:07.114898,11.887926226500761,Matern,2490.773620247421,0.09178485282222718,1.5,TPESampler,COMPLETE
2367,1.3307518540986716,2025-04-24 21:59:47.611466,2025-04-24 21:59:50.688250,0 days 00:00:03.076784,79794.29086180229,Matern,11181.283814862642,0.0005086886834201619,1.5,TPESampler,COMPLETE
2368,0.17261855599587503,2025-04-24 21:59:48.472117,2025-04-24 21:59:55.868632,0 days 00:00:07.396515,0.9703061898524393,Matern,4578.065083153784,0.9836016958191004,1.5,TPESampler,COMPLETE
2369,0.17261847926851656,2025-04-24 21:59:50.943402,2025-04-24 21:59:54.479879,0 days 00:00:03.536477,63.469547475149795,Matern,248.54711779898878,0.07918318886762306,1.5,TPESampler,COMPLETE
2370,0.17261855846712684,2025-04-24 21:59:53.791952,2025-04-24 21:59:57.138024,0 days 00:00:03.346072,3166.4606424411363,Matern,1942.466984585731,0.018078298203258004,1.5,TPESampler,COMPLETE
2371,0.17261860385242697,2025-04-24 21:59:54.744765,2025-04-24 21:59:57.860509,0 days 00:00:03.115744,963.908986717353,Matern,4033.0284545532036,0.025029755273246915,1.5,TPESampler,COMPLETE
2372,0.2741901066655803,2025-04-24 21:59:56.119370,2025-04-24 21:59:59.226655,0 days 00:00:03.107285,242.04183740289233,Matern,1640.4917882244586,0.04100815488503993,0.5,TPESampler,COMPLETE
2373,0.17261829074986998,2025-04-24 21:59:57.387446,2025-04-24 22:00:03.730438,0 days 00:00:06.342992,630.0909915147348,Matern,63304.4463237853,0.8228619106421345,1.5,TPESampler,COMPLETE
2374,1.3307518540987784,2025-04-24 21:59:58.082086,2025-04-24 22:00:02.161007,0 days 00:00:04.078921,3.4342974240852033,Matern,302.6155640537019,0.0036961213979527217,1.5,TPESampler,COMPLETE
2375,0.17261864625060339,2025-04-24 21:59:59.462895,2025-04-24 22:00:03.332864,0 days 00:00:03.869969,3960.674646339595,Matern,1222.5521970957434,0.0009860079149782864,1.5,TPESampler,COMPLETE
2376,0.17261852373183417,2025-04-24 22:00:02.408934,2025-04-24 22:00:05.734784,0 days 00:00:03.325850,47689.74526039092,Matern,89.25873923912546,0.0011626096482686245,1.5,TPESampler,COMPLETE
2377,0.17261837522525722,2025-04-24 22:00:03.587876,2025-04-24 22:00:07.237187,0 days 00:00:03.649311,168.33003618533905,Matern,743.1977188757826,0.8385259829036485,1.5,TPESampler,COMPLETE
2378,0.17261815416977985,2025-04-24 22:00:03.999251,2025-04-24 22:00:07.331499,0 days 00:00:03.332248,2269.283686489216,Matern,375.23497464504675,0.04487125100637255,1.5,TPESampler,COMPLETE
2379,1.3307518540987577,2025-04-24 22:00:05.956677,2025-04-24 22:00:12.780680,0 days 00:00:06.824003,633.1107707751677,Matern,95750.87380274564,0.0030832904686234424,1.5,TPESampler,COMPLETE
2380,0.1726184973227142,2025-04-24 22:00:07.532028,2025-04-24 22:00:12.252204,0 days 00:00:04.720176,28.8896351596423,Matern,2294.626754040317,0.05000603776455864,1.5,TPESampler,COMPLETE
2381,0.17261859618664255,2025-04-24 22:00:07.676633,2025-04-24 22:00:13.553408,0 days 00:00:05.876775,284.86105625284927,Matern,305.47875255810095,0.010530062399812683,1.5,TPESampler,COMPLETE
2382,0.17261852491462043,2025-04-24 22:00:12.483637,2025-04-24 22:00:16.008598,0 days 00:00:03.524961,3681.4060584833096,Matern,589.5686895156031,0.013983651816781897,1.5,TPESampler,COMPLETE
2383,1.3307518540886305,2025-04-24 22:00:13.019891,2025-04-24 22:00:18.095254,0 days 00:00:05.075363,135.1377411117669,Matern,29145.981306718757,0.033246313941986384,2.5,TPESampler,COMPLETE
2384,0.17261845480982865,2025-04-24 22:00:13.935218,2025-04-24 22:00:17.458674,0 days 00:00:03.523456,266.85060860510515,Matern,169.70236156006106,0.0009433845866918027,1.5,TPESampler,COMPLETE
2385,0.1726185578331888,2025-04-24 22:00:16.237409,2025-04-24 22:00:22.278974,0 days 00:00:06.041565,12.407172077218075,Matern,11146.766175865167,0.7898999707001427,1.5,TPESampler,COMPLETE
2386,1.33075185409841,2025-04-24 22:00:17.682768,2025-04-24 22:00:22.917195,0 days 00:00:05.234427,0.011064441663080866,Matern,105.13224507997643,0.05645499319187712,1.5,TPESampler,COMPLETE
2387,1.3307518540977097,2025-04-24 22:00:18.317697,2025-04-24 22:00:22.448161,0 days 00:00:04.130464,140.19854047827363,Matern,9391.565780242949,0.03343865212544364,1.5,TPESampler,COMPLETE
2388,0.1726189059320068,2025-04-24 22:00:22.511166,2025-04-24 22:00:25.760684,0 days 00:00:03.249518,28.144649882122103,Matern,278.08649017133155,0.02942070558408948,1.5,TPESampler,COMPLETE
2389,0.1726186213163804,2025-04-24 22:00:22.696463,2025-04-24 22:00:26.790631,0 days 00:00:04.094168,88355.85149416474,Matern,943.4758785869604,0.0005856863004367367,1.5,TPESampler,COMPLETE
2390,0.1726185589100381,2025-04-24 22:00:23.186346,2025-04-24 22:00:26.818683,0 days 00:00:03.632337,135.3277321327504,Matern,166.27240122743336,0.0014158185168520966,1.5,TPESampler,COMPLETE
2391,0.1726184876950594,2025-04-24 22:00:26.016303,2025-04-24 22:00:29.735256,0 days 00:00:03.718953,1193.903709294911,Matern,352.44451761063226,0.05413789841360306,1.5,TPESampler,COMPLETE
2392,0.17261905515688633,2025-04-24 22:00:26.958120,2025-04-24 22:00:35.157860,0 days 00:00:08.199740,91.68670928245733,Matern,702.8551040495004,0.7413428329400881,1.5,TPESampler,COMPLETE
2393,0.1726186509414259,2025-04-24 22:00:27.009493,2025-04-24 22:00:30.858379,0 days 00:00:03.848886,54.675817642662054,Matern,430.8778248596742,0.9113554559260834,1.5,TPESampler,COMPLETE
2394,1.3307518541011287,2025-04-24 22:00:29.965714,2025-04-24 22:00:33.655708,0 days 00:00:03.689994,29.79606405615926,RBF,0.10851022885928682,0.00012127850343047543,0.5,TPESampler,COMPLETE
2395,1.3307518540982177,2025-04-24 22:00:31.313576,2025-04-24 22:00:37.370226,0 days 00:00:06.056650,0.04650069971996309,Matern,1771.2922247276454,0.0007961099415319428,1.5,TPESampler,COMPLETE
2396,0.17261835355197006,2025-04-24 22:00:33.853587,2025-04-24 22:00:38.109175,0 days 00:00:04.255588,879.1543656511512,Matern,134.7109611252603,1.5240805461183158e-05,1.5,TPESampler,COMPLETE
2397,1.3307518540988263,2025-04-24 22:00:35.387377,2025-04-24 22:00:40.071953,0 days 00:00:04.684576,479.52729394995674,Matern,87698.84601438357,0.003868569732129562,1.5,TPESampler,COMPLETE
2398,0.17261858424618565,2025-04-24 22:00:37.615746,2025-04-24 22:00:42.137944,0 days 00:00:04.522198,5.364697507940492,Matern,487.83728891102237,0.009240957231328882,1.5,TPESampler,COMPLETE
2399,0.17261854355910125,2025-04-24 22:00:38.312123,2025-04-24 22:00:41.505377,0 days 00:00:03.193254,2154.246609927427,Matern,172.21526268021393,0.0779018646910651,1.5,TPESampler,COMPLETE
2400,1.330751854098718,2025-04-24 22:00:40.301849,2025-04-24 22:00:45.205497,0 days 00:00:04.903648,62.24451206519438,RBF,20400.17252205729,0.0063797372790371,1.5,TPESampler,COMPLETE
2401,1.3307518540983094,2025-04-24 22:00:41.750477,2025-04-24 22:00:45.752961,0 days 00:00:04.002484,0.3067061542370848,Matern,8094.761724254809,0.03482928739817437,1.5,TPESampler,COMPLETE
