number,value,datetime_start,datetime_complete,duration,params_constant_value,params_kernel_type,params_length_scale,params_noise_level,params_nu,system_attrs_auto:sampler,state
689,0.17261680873619872,2025-04-24 21:16:28.876954,2025-04-24 21:16:32.539680,0 days 00:00:03.662726,1737.4160835011444,Matern,212.66152652906268,0.0005068312179277556,1.5,TPESampler,COMPLETE
690,0.17261853993474272,2025-04-24 21:16:32.067270,2025-04-24 21:16:35.583862,0 days 00:00:03.516592,506.033008309925,Matern,1959.8855542795727,0.023716811722618185,1.5,TPESampler,COMPLETE
691,0.17261855342330334,2025-04-24 21:16:32.770235,2025-04-24 21:16:36.355943,0 days 00:00:03.585708,2309.9962773160405,Matern,1061.39033038902,0.00023154274310837656,1.5,TPESampler,COMPLETE
692,1.3307518540987964,2025-04-24 21:16:35.814633,2025-04-24 21:16:39.370519,0 days 00:00:03.555886,0.005280654198306821,Matern,0.0012906956760241465,3.332182872428591e-07,1.5,TPESampler,COMPLETE
693,0.17261850969638726,2025-04-24 21:16:36.120707,2025-04-24 21:16:40.296241,0 days 00:00:04.175534,12953.043925265738,Matern,145.35687329697686,0.0003689134103883662,1.5,TPESampler,COMPLETE
694,1.3307518540986856,2025-04-24 21:16:36.611295,2025-04-24 21:16:40.479468,0 days 00:00:03.868173,40587.075130922814,Matern,89885.66807087323,0.002304658956128258,2.5,TPESampler,COMPLETE
695,1.3677569516714423,2025-04-24 21:16:39.590976,2025-04-24 21:16:41.738414,0 days 00:00:02.147438,75755.59528500363,Matern,0.5558552219212332,0.000582325593342838,1.5,TPESampler,COMPLETE
696,0.2741901052924975,2025-04-24 21:16:40.503261,2025-04-24 21:16:43.994591,0 days 00:00:03.491330,12900.146576614945,Matern,281.9917159158909,0.018096676747972582,0.5,TPESampler,COMPLETE
697,0.17261855775453794,2025-04-24 21:16:40.679076,2025-04-24 21:16:44.037744,0 days 00:00:03.358668,11103.79400735801,Matern,6339.509319251923,0.034590840663421246,1.5,TPESampler,COMPLETE
698,1.3307518540987497,2025-04-24 21:16:41.978977,2025-04-24 21:16:47.243050,0 days 00:00:05.264073,1.2252582305616924e-05,RBF,59.83462666171021,0.0020597224283961752,0.5,TPESampler,COMPLETE
699,0.21064601876788852,2025-04-24 21:16:44.162500,2025-04-24 21:16:47.047793,0 days 00:00:02.885293,0.22649454476380304,RBF,5.561252974510766,0.2968562691453199,0.5,TPESampler,COMPLETE
700,0.1726185408153583,2025-04-24 21:16:44.254620,2025-04-24 21:16:47.319131,0 days 00:00:03.064511,1124.4953549843199,Matern,45.301788556604684,0.0025322883128769684,1.5,TPESampler,COMPLETE
701,1.33075185410104,2025-04-24 21:16:47.241671,2025-04-24 21:16:51.217220,0 days 00:00:03.975549,54196.36617617191,Matern,60205.96923786538,0.01048300980320185,1.5,TPESampler,COMPLETE
702,0.17261851823866442,2025-04-24 21:16:47.444469,2025-04-24 21:16:51.881188,0 days 00:00:04.436719,337.8776827337257,Matern,264.86810414647834,0.011030411526919512,1.5,TPESampler,COMPLETE
703,1.3307518540963064,2025-04-24 21:16:47.639028,2025-04-24 21:16:50.322205,0 days 00:00:02.683177,0.11124745206788025,RBF,4.26981292754006e-05,3.122030737120131e-08,1.5,TPESampler,COMPLETE
704,0.1726187468278492,2025-04-24 21:16:50.552731,2025-04-24 21:16:54.227972,0 days 00:00:03.675241,2856.9997040993608,Matern,2030.732281035351,0.008611073336830978,1.5,TPESampler,COMPLETE
705,0.17261818069053927,2025-04-24 21:16:51.450474,2025-04-24 21:16:57.306836,0 days 00:00:05.856362,156.2448844365511,Matern,489.15876390512636,0.0016694306239748219,1.5,TPESampler,COMPLETE
706,1.3307518540993202,2025-04-24 21:16:52.082032,2025-04-24 21:16:57.062154,0 days 00:00:04.980122,3.487011177620492e-07,Matern,3.855793255829067e-05,2.077517733302049e-06,1.5,TPESampler,COMPLETE
707,0.17261863177663486,2025-04-24 21:16:54.458322,2025-04-24 21:16:58.059253,0 days 00:00:03.600931,5756.301760018371,Matern,11124.237271626818,0.6567616626268222,1.5,TPESampler,COMPLETE
708,0.17261684244656206,2025-04-24 21:16:57.249062,2025-04-24 21:17:01.248255,0 days 00:00:03.999193,86110.70854972649,Matern,120.80250182798233,0.025221401798710064,1.5,TPESampler,COMPLETE
709,0.17261719448947452,2025-04-24 21:16:57.541304,2025-04-24 21:17:02.897858,0 days 00:00:05.356554,0.06790951040122117,Matern,171.45651708421664,0.5087748890038644,1.5,TPESampler,COMPLETE
710,1.3307518540969976,2025-04-24 21:16:58.311295,2025-04-24 21:17:02.761150,0 days 00:00:04.449855,759.9050460499349,Matern,62795.39207752346,0.0009600463791573149,1.5,TPESampler,COMPLETE
711,0.17261856906824039,2025-04-24 21:17:01.454657,2025-04-24 21:17:08.376689,0 days 00:00:06.922032,78524.8011006755,Matern,68.70558354371512,0.25322588721428335,1.5,TPESampler,COMPLETE
712,0.17261846702927658,2025-04-24 21:17:02.973974,2025-04-24 21:17:06.008608,0 days 00:00:03.034634,37633.21451139604,Matern,201.13901192647037,0.015182633247742893,1.5,TPESampler,COMPLETE
713,0.1726185716628269,2025-04-24 21:17:03.160576,2025-04-24 21:17:06.137942,0 days 00:00:02.977366,32045.712433224096,Matern,1982.764744950218,0.006598837787429234,1.5,TPESampler,COMPLETE
714,0.17261855382319516,2025-04-24 21:17:06.189354,2025-04-24 21:17:09.328780,0 days 00:00:03.139426,2933.1406480155774,Matern,302.8574665671127,0.0502991917423517,1.5,TPESampler,COMPLETE
715,0.17261745187657396,2025-04-24 21:17:06.326921,2025-04-24 21:17:17.650498,0 days 00:00:11.323577,0.007156128282566762,Matern,1191.5761019987335,0.6113555558139956,1.5,TPESampler,COMPLETE
716,0.17261806839252825,2025-04-24 21:17:08.616846,2025-04-24 21:17:11.860937,0 days 00:00:03.244091,23587.028369246087,Matern,48.86076973955153,0.031097138989565804,1.5,TPESampler,COMPLETE
717,0.1726184942022008,2025-04-24 21:17:09.555677,2025-04-24 21:17:17.052630,0 days 00:00:07.496953,0.24457783600537925,Matern,730.6740041630488,0.9724688932771017,1.5,TPESampler,COMPLETE
718,0.17261798727855296,2025-04-24 21:17:12.115863,2025-04-24 21:17:16.227187,0 days 00:00:04.111324,34145.11398191522,Matern,33.70607881809384,0.00139818226664656,1.5,TPESampler,COMPLETE
719,0.17261853833294394,2025-04-24 21:17:16.481919,2025-04-24 21:17:20.523680,0 days 00:00:04.041761,6776.991820760771,Matern,80.7979306882199,0.000475201564789562,1.5,TPESampler,COMPLETE
720,1.3677569516714423,2025-04-24 21:17:17.272938,2025-04-24 21:17:18.970880,0 days 00:00:01.697942,17198.354408814168,Matern,8.971222779906881,0.0005614096799230108,1.5,TPESampler,COMPLETE
721,1.3307518540990304,2025-04-24 21:17:17.918596,2025-04-24 21:17:25.484746,0 days 00:00:07.566150,0.0009748375931420182,Matern,2538.4406296817347,0.004508084652688015,1.5,TPESampler,COMPLETE
722,1.330751854098795,2025-04-24 21:17:19.217535,2025-04-24 21:17:25.958270,0 days 00:00:06.740735,0.001902296028080881,RBF,84457.25407026964,8.840091357321452e-10,1.5,TPESampler,COMPLETE
723,0.172618578648518,2025-04-24 21:17:20.749915,2025-04-24 21:17:24.639998,0 days 00:00:03.890083,0.34629784845620964,Matern,491.9811500283553,0.2684833092970059,1.5,TPESampler,COMPLETE
724,1.3307518540987828,2025-04-24 21:17:24.875244,2025-04-24 21:17:28.889227,0 days 00:00:04.013983,0.005181288345471341,Matern,70.57810904524212,6.417942519285388e-05,0.5,TPESampler,COMPLETE
725,0.17261855385834174,2025-04-24 21:17:25.711334,2025-04-24 21:17:28.739925,0 days 00:00:03.028591,21707.585582791795,Matern,90.56903941667127,0.017241475490788742,1.5,TPESampler,COMPLETE
726,1.3677569132089566,2025-04-24 21:17:26.177802,2025-04-24 21:17:29.606369,0 days 00:00:03.428567,0.00012120128613319099,Matern,1656.8287542459645,0.31999361673433885,1.5,TPESampler,COMPLETE
727,0.17261856760282546,2025-04-24 21:17:28.937970,2025-04-24 21:17:35.255686,0 days 00:00:06.317716,0.0016467575143339062,Matern,123.84857666973247,0.8176851169038403,1.5,TPESampler,COMPLETE
728,1.3677569495397708,2025-04-24 21:17:29.124579,2025-04-24 21:17:33.112406,0 days 00:00:03.987827,0.016126418216268788,Matern,7120.295066165237,0.2720053163013087,1.5,TPESampler,COMPLETE
729,1.3307518541004013,2025-04-24 21:17:29.808811,2025-04-24 21:17:32.857533,0 days 00:00:03.048722,0.0044866917431157505,RBF,5.753775879417658,9.614426271778137e-05,2.5,TPESampler,COMPLETE
730,1.3307518540984276,2025-04-24 21:17:33.072222,2025-04-24 21:17:36.794739,0 days 00:00:03.722517,0.05739017949059657,RBF,5.57056388904483,2.544088415277713e-09,0.5,TPESampler,COMPLETE
731,0.1726183945505644,2025-04-24 21:17:33.385853,2025-04-24 21:17:38.844262,0 days 00:00:05.458409,1810.258872752845,Matern,32.168516460667576,0.007987708631792396,1.5,TPESampler,COMPLETE
732,0.17261717321983852,2025-04-24 21:17:35.479001,2025-04-24 21:17:39.120124,0 days 00:00:03.641123,861.3196937008927,Matern,58.273348655236404,0.03692265701561846,1.5,TPESampler,COMPLETE
733,1.3677569242563348,2025-04-24 21:17:37.020545,2025-04-24 21:17:40.625157,0 days 00:00:03.604612,0.0006441732884631151,Matern,1990.268113219491,0.8556103117165247,1.5,TPESampler,COMPLETE
734,1.3307518541016314,2025-04-24 21:17:39.067651,2025-04-24 21:17:46.390355,0 days 00:00:07.322704,0.002550943267183488,Matern,121.69558009357252,0.05182948657212278,1.5,TPESampler,COMPLETE
735,0.17261855087308017,2025-04-24 21:17:39.376951,2025-04-24 21:17:47.664156,0 days 00:00:08.287205,0.03999129785050776,Matern,229.16431971921583,0.6376383470320064,1.5,TPESampler,COMPLETE
736,0.1726184473628749,2025-04-24 21:17:40.844444,2025-04-24 21:17:43.800060,0 days 00:00:02.955616,28712.66654719759,Matern,5.376023372581708,0.012158055569788336,1.5,TPESampler,COMPLETE
737,1.3307518540973247,2025-04-24 21:17:44.016623,2025-04-24 21:17:47.623042,0 days 00:00:03.606419,7.004364290115168,RBF,2506.0671685003927,1.1598568742358731e-08,1.5,TPESampler,COMPLETE
738,0.17261845426760627,2025-04-24 21:17:46.654803,2025-04-24 21:17:50.028275,0 days 00:00:03.373472,47271.35458920343,Matern,1249.9385122661922,4.05451979582548e-06,1.5,TPESampler,COMPLETE
739,1.3677569439745565,2025-04-24 21:17:47.772118,2025-04-24 21:17:51.360529,0 days 00:00:03.588411,8.01536702582956e-07,RBF,28016.170563444943,7.253637686100772e-05,2.5,TPESampler,COMPLETE
740,0.27419010660768484,2025-04-24 21:17:47.828802,2025-04-24 21:17:56.583510,0 days 00:00:08.754708,0.00043786237202896917,Matern,1048.9213779566187,0.2869093826322919,0.5,TPESampler,COMPLETE
741,0.17261853545869696,2025-04-24 21:17:50.241216,2025-04-24 21:17:53.582677,0 days 00:00:03.341461,975.672619736188,Matern,5.121113843530249,0.00983856694958107,1.5,TPESampler,COMPLETE
742,0.17261856068132253,2025-04-24 21:17:51.585271,2025-04-24 21:17:54.255603,0 days 00:00:02.670332,226.4113500391317,Matern,69.06326974945954,0.029487573349229895,1.5,TPESampler,COMPLETE
743,0.17261828025479248,2025-04-24 21:17:53.812837,2025-04-24 21:17:57.438075,0 days 00:00:03.625238,19792.502205167773,Matern,55.16867651276515,0.12290160768173475,1.5,TPESampler,COMPLETE
744,0.22211471649675857,2025-04-24 21:17:54.533233,2025-04-24 21:17:57.360337,0 days 00:00:02.827104,14724.472513398394,Matern,16.378393892466203,0.08619365500850415,2.5,TPESampler,COMPLETE
745,0.17261869665884672,2025-04-24 21:17:56.852782,2025-04-24 21:18:03.495840,0 days 00:00:06.643058,1032.8909661015387,Matern,49.50102111539819,0.0008922331115082075,1.5,TPESampler,COMPLETE
746,0.17261855588002215,2025-04-24 21:17:57.520935,2025-04-24 21:18:01.821592,0 days 00:00:04.300657,0.014127326216349679,Matern,327.5798397501559,0.08428618286907806,1.5,TPESampler,COMPLETE
747,1.3307518540973045,2025-04-24 21:17:57.613548,2025-04-24 21:18:02.845432,0 days 00:00:05.231884,2.3710304684089342e-07,Matern,56.283460326143796,9.840103077607516e-06,1.5,TPESampler,COMPLETE
748,1.367756947960625,2025-04-24 21:18:02.052306,2025-04-24 21:18:06.005034,0 days 00:00:03.952728,0.030499043544201937,Matern,5818.51194940293,0.20556133455689432,1.5,TPESampler,COMPLETE
749,0.1726185830651173,2025-04-24 21:18:03.083762,2025-04-24 21:18:05.965078,0 days 00:00:02.881316,18613.59841970384,Matern,155.19402224258513,0.00024291177096021264,1.5,TPESampler,COMPLETE
750,1.3677569484262642,2025-04-24 21:18:03.739089,2025-04-24 21:18:07.210181,0 days 00:00:03.471092,0.08609651052158412,Matern,6858.652786234947,0.6241048011422506,1.5,TPESampler,COMPLETE
751,0.17261743528200346,2025-04-24 21:18:06.133500,2025-04-24 21:18:09.482733,0 days 00:00:03.349233,1073.2463686187648,Matern,43.80055020130569,0.020853746965877055,1.5,TPESampler,COMPLETE
752,0.21064321701744113,2025-04-24 21:18:06.179244,2025-04-24 21:18:09.919917,0 days 00:00:03.740673,1.1308965213287994,RBF,3.188901942708458,5.726001566612125e-05,0.5,TPESampler,COMPLETE
753,1.3307518540988008,2025-04-24 21:18:07.551319,2025-04-24 21:18:12.038461,0 days 00:00:04.487142,11.303320905666123,Matern,263.20260578727175,9.407047660137084e-08,2.5,TPESampler,COMPLETE
754,1.3307518540973093,2025-04-24 21:18:09.721077,2025-04-24 21:18:12.147944,0 days 00:00:02.426867,557.4471033711751,RBF,0.0017779682934393126,6.027365901439176e-05,1.5,TPESampler,COMPLETE
755,0.1726185259222241,2025-04-24 21:18:10.144094,2025-04-24 21:18:14.281107,0 days 00:00:04.137013,557.1383835484555,Matern,419.00559728976253,0.0002951560457157854,1.5,TPESampler,COMPLETE
756,0.1726170891544228,2025-04-24 21:18:12.231314,2025-04-24 21:18:16.806002,0 days 00:00:04.574688,414.6629657789042,Matern,29.896575197154565,0.004494425865181736,1.5,TPESampler,COMPLETE
757,1.36775670626423,2025-04-24 21:18:12.374972,2025-04-24 21:18:15.521705,0 days 00:00:03.146733,6.147992603317645e-05,RBF,410.43502793412125,0.6446415721725839,1.5,TPESampler,COMPLETE
758,1.330751854098861,2025-04-24 21:18:14.489396,2025-04-24 21:18:20.843567,0 days 00:00:06.354171,0.007047743424613741,Matern,1.9704076435863427e-05,0.043518997541070914,2.5,TPESampler,COMPLETE
759,0.17261855187185163,2025-04-24 21:18:15.751906,2025-04-24 21:18:19.202564,0 days 00:00:03.450658,16219.48546775317,Matern,1855.3141138662388,0.00157386151013916,1.5,TPESampler,COMPLETE
760,0.17261829899625342,2025-04-24 21:18:17.038184,2025-04-24 21:18:20.801962,0 days 00:00:03.763778,93.60764464394983,Matern,17.436873903063557,0.09978612189944072,1.5,TPESampler,COMPLETE
761,1.3307518540981402,2025-04-24 21:18:19.430071,2025-04-24 21:18:22.015731,0 days 00:00:02.585660,0.2785514314082742,RBF,5.0319886032688764e-05,8.999829399729874e-05,1.5,TPESampler,COMPLETE
762,0.17261838474024005,2025-04-24 21:18:20.959287,2025-04-24 21:18:24.006239,0 days 00:00:03.046952,104.41139205727431,Matern,119.84161639392093,0.006585152089304843,1.5,TPESampler,COMPLETE
763,0.17261854230099646,2025-04-24 21:18:21.000234,2025-04-24 21:18:24.955512,0 days 00:00:03.955278,231.49506870567023,Matern,9.60380673904202,0.007485574967632532,1.5,TPESampler,COMPLETE
764,0.17261858110511444,2025-04-24 21:18:22.262544,2025-04-24 21:18:25.560222,0 days 00:00:03.297678,382.1658779322425,Matern,21.21513995349708,0.0393354048518116,1.5,TPESampler,COMPLETE
765,0.17261856453866417,2025-04-24 21:18:24.215280,2025-04-24 21:18:27.582068,0 days 00:00:03.366788,315.21922510176927,Matern,99.12224035305687,0.3804472338658605,1.5,TPESampler,COMPLETE
766,0.17261886243962468,2025-04-24 21:18:25.171502,2025-04-24 21:18:30.733254,0 days 00:00:05.561752,606.894058946864,Matern,224.91838751717432,0.4217260802190183,1.5,TPESampler,COMPLETE
767,0.17261845176071228,2025-04-24 21:18:25.768953,2025-04-24 21:18:30.307678,0 days 00:00:04.538725,0.037763876880515135,Matern,135.630582285805,0.2447044053323155,1.5,TPESampler,COMPLETE
768,0.2221147505074765,2025-04-24 21:18:27.810945,2025-04-24 21:18:30.743155,0 days 00:00:02.932210,3152.0648349428475,Matern,436.04277696458064,0.0012393474133356713,2.5,TPESampler,COMPLETE
769,0.1726184789699479,2025-04-24 21:18:30.534604,2025-04-24 21:18:33.390246,0 days 00:00:02.855642,43325.11364515071,Matern,46.068418006209306,0.017842404752347777,1.5,TPESampler,COMPLETE
770,0.17261857786048074,2025-04-24 21:18:30.972581,2025-04-24 21:18:35.028475,0 days 00:00:04.055894,28.087494859964732,Matern,233.73465661108492,0.0882274002962668,1.5,TPESampler,COMPLETE
771,0.1726186177674419,2025-04-24 21:18:31.016837,2025-04-24 21:18:34.738357,0 days 00:00:03.721520,318.2884383930919,Matern,6.357401694675851,0.005709168640324282,1.5,TPESampler,COMPLETE
772,0.17261853500487745,2025-04-24 21:18:33.623516,2025-04-24 21:18:39.971342,0 days 00:00:06.347826,496.19132650028155,Matern,200.05269075014672,0.016412550669593753,1.5,TPESampler,COMPLETE
773,0.17261972517500146,2025-04-24 21:18:34.945318,2025-04-24 21:18:41.269726,0 days 00:00:06.324408,0.2595292608068165,Matern,99.74167739092307,0.7195532487045079,1.5,TPESampler,COMPLETE
774,0.17261869621365264,2025-04-24 21:18:35.219205,2025-04-24 21:18:41.322499,0 days 00:00:06.103294,774.6352677516792,Matern,239.65340949691006,0.9635811236192018,1.5,TPESampler,COMPLETE
775,0.17261856126567254,2025-04-24 21:18:40.190481,2025-04-24 21:18:47.531182,0 days 00:00:07.340701,0.015727387367743175,Matern,770.9960096131418,0.787570913254014,1.5,TPESampler,COMPLETE
776,0.17262044026339585,2025-04-24 21:18:41.434350,2025-04-24 21:18:45.033964,0 days 00:00:03.599614,79615.8057526751,Matern,241.2156984073303,0.020084015642323694,1.5,TPESampler,COMPLETE
777,1.3307518540993983,2025-04-24 21:18:41.480383,2025-04-24 21:18:44.563715,0 days 00:00:03.083332,198.79349478355454,Matern,1397.1793939972827,0.003410768885493528,1.5,TPESampler,COMPLETE
778,0.17261866529029202,2025-04-24 21:18:44.795882,2025-04-24 21:18:47.820874,0 days 00:00:03.024992,115.22961001504814,Matern,517.727508122041,0.03102233403989811,1.5,TPESampler,COMPLETE
779,0.17261855214500768,2025-04-24 21:18:45.280851,2025-04-24 21:18:48.659214,0 days 00:00:03.378363,72427.9741130262,Matern,335.22891259405293,0.5564538670259306,1.5,TPESampler,COMPLETE
780,0.27419009334069705,2025-04-24 21:18:47.774967,2025-04-24 21:18:51.793798,0 days 00:00:04.018831,49134.74647805446,Matern,1.6199171083079804,0.0029594325950378225,0.5,TPESampler,COMPLETE
781,0.1726198549809915,2025-04-24 21:18:48.098571,2025-04-24 21:18:52.981446,0 days 00:00:04.882875,16.847992922613948,Matern,4.869125085357542,0.005046207259945223,1.5,TPESampler,COMPLETE
782,0.2741900992940745,2025-04-24 21:18:48.868428,2025-04-24 21:18:52.286328,0 days 00:00:03.417900,11.089017517009204,Matern,935.955730392588,0.5519555881434586,0.5,TPESampler,COMPLETE
783,0.172618569164516,2025-04-24 21:18:52.031066,2025-04-24 21:18:55.644155,0 days 00:00:03.613089,7.868999632508776,Matern,854.0332793668055,0.12414014828872189,1.5,TPESampler,COMPLETE
784,0.2106447152440772,2025-04-24 21:18:52.517846,2025-04-24 21:18:55.670786,0 days 00:00:03.152940,74.31071794318645,RBF,139.5411690141554,0.0013525652531194022,1.5,TPESampler,COMPLETE
785,0.1726185121538126,2025-04-24 21:18:53.220222,2025-04-24 21:18:56.350092,0 days 00:00:03.129870,4821.810635608635,Matern,3288.9388194736234,0.004788429325188564,1.5,TPESampler,COMPLETE
786,0.17261852535577704,2025-04-24 21:18:55.797588,2025-04-24 21:18:59.130418,0 days 00:00:03.332830,38.72760780938733,Matern,46.20930971127894,0.041195980372439205,1.5,TPESampler,COMPLETE
787,0.22211440185591566,2025-04-24 21:18:55.840378,2025-04-24 21:18:59.693848,0 days 00:00:03.853470,2.505005505444152,Matern,2764.013080222384,0.1385679715522673,2.5,TPESampler,COMPLETE
788,0.17261857608608738,2025-04-24 21:18:56.547199,2025-04-24 21:18:59.571703,0 days 00:00:03.024504,364.0823217323564,Matern,1286.6852857756123,0.055329831256060134,1.5,TPESampler,COMPLETE
789,0.17261856467400105,2025-04-24 21:18:59.343936,2025-04-24 21:19:03.978029,0 days 00:00:04.634093,211.49328304957075,Matern,1896.438712797359,0.008236812104260659,1.5,TPESampler,COMPLETE
790,0.17261834812300525,2025-04-24 21:18:59.794655,2025-04-24 21:19:03.382245,0 days 00:00:03.587590,294.7568659609691,Matern,21.391485729853336,0.014190526809587092,1.5,TPESampler,COMPLETE
791,0.1726196602262334,2025-04-24 21:18:59.943777,2025-04-24 21:19:04.649489,0 days 00:00:04.705712,5085.722773028232,Matern,14.222776060101861,0.7534725932570993,1.5,TPESampler,COMPLETE
792,1.330751854097454,2025-04-24 21:19:03.604652,2025-04-24 21:19:08.513173,0 days 00:00:04.908521,0.00012721914913233975,Matern,30.343033027175345,0.0011927521950766068,1.5,TPESampler,COMPLETE
793,0.1726184677013575,2025-04-24 21:19:04.169284,2025-04-24 21:19:07.432441,0 days 00:00:03.263157,5745.248590907718,Matern,291.1415177359598,0.03557384776826439,1.5,TPESampler,COMPLETE
794,0.1726185389922561,2025-04-24 21:19:04.892142,2025-04-24 21:19:07.975027,0 days 00:00:03.082885,59210.825052732245,Matern,3987.5578380564857,0.00032751279353045333,1.5,TPESampler,COMPLETE
795,0.17261855228482295,2025-04-24 21:19:07.673135,2025-04-24 21:19:11.181899,0 days 00:00:03.508764,2335.9525965589473,Matern,0.9684504893833632,0.0025289414655379314,1.5,TPESampler,COMPLETE
796,1.3307518540988288,2025-04-24 21:19:08.175760,2025-04-24 21:19:12.140131,0 days 00:00:03.964371,0.01029849799672985,Matern,32.312089226219015,0.013078867525072717,1.5,TPESampler,COMPLETE
797,0.17261886131202653,2025-04-24 21:19:08.743240,2025-04-24 21:19:13.800511,0 days 00:00:05.057271,854.4779235935939,Matern,169.17777993152905,0.8094083924667744,1.5,TPESampler,COMPLETE
798,1.3677569303520842,2025-04-24 21:19:11.399441,2025-04-24 21:19:14.454130,0 days 00:00:03.054689,0.0055612091692468614,Matern,2396.402407645644,0.47264924584482465,1.5,TPESampler,COMPLETE
799,1.3307518540990586,2025-04-24 21:19:12.369799,2025-04-24 21:19:18.353125,0 days 00:00:05.983326,9.180574731687504e-07,Matern,1602.3920967804543,0.0022206778877470446,0.5,TPESampler,COMPLETE
800,0.21064108262816286,2025-04-24 21:19:14.028735,2025-04-24 21:19:16.877782,0 days 00:00:02.849047,1924.022578759412,RBF,42.19943456782648,0.01580936539812264,1.5,TPESampler,COMPLETE
801,0.1726188738463595,2025-04-24 21:19:14.728195,2025-04-24 21:19:18.981614,0 days 00:00:04.253419,3.261797542877749,Matern,794.5443251423947,0.32720396160890924,1.5,TPESampler,COMPLETE
802,0.17261849994985867,2025-04-24 21:19:17.111908,2025-04-24 21:19:23.533357,0 days 00:00:06.421449,145.4554197511589,Matern,988.6089627158101,0.8601692575052439,1.5,TPESampler,COMPLETE
803,0.17261783468907677,2025-04-24 21:19:18.586098,2025-04-24 21:19:22.254798,0 days 00:00:03.668700,496.5213177425236,Matern,2868.7919085188964,0.0541504612154857,1.5,TPESampler,COMPLETE
