number,value,datetime_start,datetime_complete,duration,params_constant_value,params_kernel_type,params_length_scale,params_noise_level,params_nu,system_attrs_auto:sampler,state
1603,0.17261855924952027,2025-04-24 21:40:15.446388,2025-04-24 21:40:21.596771,0 days 00:00:06.150383,1.4058207585503788,Matern,2883.0823093095337,0.4578714147825466,1.5,TPESampler,COMPLETE
1604,1.3307518541002827,2025-04-24 21:40:16.287506,2025-04-24 21:40:20.692841,0 days 00:00:04.405335,38.83896865886529,Matern,12860.88786622439,0.0001378715822322737,1.5,TPESampler,COMPLETE
1605,1.330751854097428,2025-04-24 21:40:18.099025,2025-04-24 21:40:22.273470,0 days 00:00:04.174445,1.1831047310592026e-05,Matern,0.0010713407093921009,2.3108522503171336e-09,1.5,TPESampler,COMPLETE
1606,1.3307518540987895,2025-04-24 21:40:20.898282,2025-04-24 21:40:24.096351,0 days 00:00:03.198069,0.01815498783408312,RBF,0.03321132702883462,3.3998351717133715e-08,2.5,TPESampler,COMPLETE
1607,0.17261945966512907,2025-04-24 21:40:21.810930,2025-04-24 21:40:29.775652,0 days 00:00:07.964722,8.00822345695541,Matern,3923.4764697193627,0.8858915697923595,1.5,TPESampler,COMPLETE
1608,1.3307518540980026,2025-04-24 21:40:22.493710,2025-04-24 21:40:25.703412,0 days 00:00:03.209702,1846.3003544554272,Matern,0.000597972348207907,2.130533272470455e-10,1.5,TPESampler,COMPLETE
1609,0.17261842442299977,2025-04-24 21:40:24.302200,2025-04-24 21:40:36.135495,0 days 00:00:11.833295,531.7706446465344,Matern,7.47633484400874,0.018947691977826163,1.5,TPESampler,COMPLETE
1610,1.3307518540993202,2025-04-24 21:40:25.932917,2025-04-24 21:40:36.611973,0 days 00:00:10.679056,1.193496788851521e-07,Matern,0.017519884638484876,3.4796387766499552e-06,2.5,TPESampler,COMPLETE
1611,0.2741901126818553,2025-04-24 21:40:30.401615,2025-04-24 21:40:41.874349,0 days 00:00:11.472734,2.0685081022796778e-07,Matern,26.66143929160626,0.14663205248214323,0.5,TPESampler,COMPLETE
1612,0.1726185452854684,2025-04-24 21:40:36.617630,2025-04-24 21:40:40.467602,0 days 00:00:03.849972,2238.3114822131597,Matern,21603.355732878696,0.9305844399316756,1.5,TPESampler,COMPLETE
1613,0.17261840010275786,2025-04-24 21:40:36.850949,2025-04-24 21:40:40.401615,0 days 00:00:03.550666,27.437854943277518,Matern,117.53675867504101,0.023533278453639447,1.5,TPESampler,COMPLETE
1614,0.17261829085771535,2025-04-24 21:40:40.590761,2025-04-24 21:40:43.539815,0 days 00:00:02.949054,1332.9434857731737,Matern,49.84053121981217,0.017357430751469206,1.5,TPESampler,COMPLETE
1615,0.27419010059771165,2025-04-24 21:40:40.624727,2025-04-24 21:40:44.284466,0 days 00:00:03.659739,0.350710754358205,Matern,5.437343394385617,9.635418015833433e-10,0.5,TPESampler,COMPLETE
1616,0.2741901172191316,2025-04-24 21:40:42.088401,2025-04-24 21:40:45.605375,0 days 00:00:03.516974,905.2579695427127,Matern,45.50268099628656,0.07933908215171319,0.5,TPESampler,COMPLETE
1617,0.17261831056953766,2025-04-24 21:40:43.784070,2025-04-24 21:40:48.595730,0 days 00:00:04.811660,31.66979012674432,Matern,126.63580829692295,0.8899382030143882,1.5,TPESampler,COMPLETE
1618,1.3307518540986125,2025-04-24 21:40:44.534143,2025-04-24 21:40:49.965029,0 days 00:00:05.430886,1.4145582182424857e-05,Matern,129.67389019465594,1.2603220622858831e-08,1.5,TPESampler,COMPLETE
1619,0.1726179630100856,2025-04-24 21:40:45.806112,2025-04-24 21:40:49.795191,0 days 00:00:03.989079,1671.8747089464628,Matern,559.0961042345356,0.9616370292754652,1.5,TPESampler,COMPLETE
1620,1.3307518540989327,2025-04-24 21:40:48.838703,2025-04-24 21:40:53.907376,0 days 00:00:05.068673,37.3692007181874,Matern,71637.49527432639,0.018362345652367818,1.5,TPESampler,COMPLETE
1621,0.1726187045403217,2025-04-24 21:40:50.010614,2025-04-24 21:40:54.015107,0 days 00:00:04.004493,3589.9216879718983,Matern,8704.065259280862,0.04570007151416436,1.5,TPESampler,COMPLETE
1622,0.1726187566517374,2025-04-24 21:40:50.224289,2025-04-24 21:40:56.527547,0 days 00:00:06.303258,3.1597966154415844,Matern,0.18593899791188698,0.8087961388717191,1.5,TPESampler,COMPLETE
1623,0.27419005413763314,2025-04-24 21:40:54.080271,2025-04-24 21:40:58.003202,0 days 00:00:03.922931,7.042415142245742,Matern,30669.640703796023,0.11309339821579678,0.5,TPESampler,COMPLETE
1624,0.1726177561697554,2025-04-24 21:40:54.250506,2025-04-24 21:40:59.699070,0 days 00:00:05.448564,3989.193405682834,Matern,0.20707242439566478,0.009598662029901365,1.5,TPESampler,COMPLETE
1625,0.17261855299843895,2025-04-24 21:40:56.752373,2025-04-24 21:41:00.224859,0 days 00:00:03.472486,26.81451060772711,Matern,55.35295226635456,0.00034370462696971596,1.5,TPESampler,COMPLETE
1626,1.3307518540987622,2025-04-24 21:40:58.239202,2025-04-24 21:41:03.446473,0 days 00:00:05.207271,0.31871441279939283,RBF,196.13555039281084,0.00013335791890201203,1.5,TPESampler,COMPLETE
1627,0.1726187604488081,2025-04-24 21:40:59.949856,2025-04-24 21:41:04.454714,0 days 00:00:04.504858,1206.659853532021,Matern,364.0748512655052,0.007024255823191755,1.5,TPESampler,COMPLETE
1628,1.330751854098795,2025-04-24 21:41:00.490628,2025-04-24 21:41:03.550714,0 days 00:00:03.060086,0.4376779708728908,RBF,0.0048018614741449275,9.94562207366938e-06,0.5,TPESampler,COMPLETE
1629,0.17261855110551005,2025-04-24 21:41:03.624490,2025-04-24 21:41:07.672636,0 days 00:00:04.048146,14.476919479371805,Matern,1741.9909618968002,0.043390895294800426,1.5,TPESampler,COMPLETE
1630,0.17261849221298642,2025-04-24 21:41:03.805764,2025-04-24 21:41:07.629576,0 days 00:00:03.823812,5116.407102657881,Matern,185.07705956602203,0.9590983917090652,1.5,TPESampler,COMPLETE
1631,0.17262037447924083,2025-04-24 21:41:04.718488,2025-04-24 21:41:07.911698,0 days 00:00:03.193210,1376.2413594248624,Matern,29.928704237597405,0.002651709209890047,1.5,TPESampler,COMPLETE
1632,0.17261860475442642,2025-04-24 21:41:07.803583,2025-04-24 21:41:10.529166,0 days 00:00:02.725583,63549.775758883865,Matern,2098.6728060422897,0.013386575921331694,1.5,TPESampler,COMPLETE
1633,1.3677560057816385,2025-04-24 21:41:07.851482,2025-04-24 21:41:10.816541,0 days 00:00:02.965059,14528.324485175463,RBF,1.4475007358258337e-05,1.5257370740981484e-10,0.5,TPESampler,COMPLETE
1634,0.17261843623993675,2025-04-24 21:41:08.257252,2025-04-24 21:41:12.502560,0 days 00:00:04.245308,55173.90086402094,Matern,73.39280747061758,0.032174829855178805,1.5,TPESampler,COMPLETE
1635,0.2741901065728362,2025-04-24 21:41:10.953201,2025-04-24 21:41:15.252268,0 days 00:00:04.299067,109.86884337971172,Matern,98.19844901083647,0.0005009212478599982,0.5,TPESampler,COMPLETE
1636,0.17261808276438795,2025-04-24 21:41:11.009284,2025-04-24 21:41:15.386801,0 days 00:00:04.377517,293.4437672040359,Matern,3916.762904080946,0.02311760518525306,1.5,TPESampler,COMPLETE
1637,0.21064447873567171,2025-04-24 21:41:12.748126,2025-04-24 21:41:20.026337,0 days 00:00:07.278211,0.001076032933475158,RBF,0.4700049624101225,7.099492761840511e-10,1.5,TPESampler,COMPLETE
1638,0.17261990178700948,2025-04-24 21:41:15.454219,2025-04-24 21:41:22.017966,0 days 00:00:06.563747,2781.749994046059,Matern,2585.6357436765725,0.022501914478212877,1.5,TPESampler,COMPLETE
1639,0.172618402305431,2025-04-24 21:41:15.593189,2025-04-24 21:41:22.979414,0 days 00:00:07.386225,146.3685854287215,Matern,363.1371060963194,0.0026980213972225163,1.5,TPESampler,COMPLETE
1640,0.21064470063062657,2025-04-24 21:41:20.283077,2025-04-24 21:41:23.255163,0 days 00:00:02.972086,1379.2927725811564,RBF,10.805277186817156,0.014033824734377049,1.5,TPESampler,COMPLETE
1641,0.17261867882868606,2025-04-24 21:41:22.234533,2025-04-24 21:41:26.437310,0 days 00:00:04.202777,0.000755890562243865,Matern,1.801500660440296,0.12637111992058092,1.5,TPESampler,COMPLETE
1642,1.3307518540966938,2025-04-24 21:41:23.194251,2025-04-24 21:41:27.254238,0 days 00:00:04.059987,6873.478778586142,Matern,68860.69734955892,0.0006434712084430869,1.5,TPESampler,COMPLETE
1643,0.17261851621111002,2025-04-24 21:41:23.519832,2025-04-24 21:41:26.488723,0 days 00:00:02.968891,652.7729312377246,Matern,4.747996155742346,0.02719065652458536,1.5,TPESampler,COMPLETE
1644,0.1726185513218008,2025-04-24 21:41:26.666950,2025-04-24 21:41:30.392118,0 days 00:00:03.725168,87825.84382104389,Matern,3.0579625670686927,0.01700458783539852,1.5,TPESampler,COMPLETE
1645,1.3307518541077952,2025-04-24 21:41:26.734392,2025-04-24 21:41:31.841988,0 days 00:00:05.107596,1212.7021983536438,Matern,2982.4896265524403,0.0008145417878147197,1.5,TPESampler,COMPLETE
1646,0.1726185535935743,2025-04-24 21:41:27.478794,2025-04-24 21:41:33.141555,0 days 00:00:05.662761,6.9580346367091845,Matern,2994.504874830527,0.7192343562520296,1.5,TPESampler,COMPLETE
1647,0.22211468575161833,2025-04-24 21:41:30.611780,2025-04-24 21:41:37.296033,0 days 00:00:06.684253,0.00017496639362710615,Matern,0.3842428333904525,6.155283665594539e-09,2.5,TPESampler,COMPLETE
1648,0.17261859272938235,2025-04-24 21:41:32.075261,2025-04-24 21:41:36.029856,0 days 00:00:03.954595,2895.4555946142723,Matern,2126.5792779514622,0.049964738024665105,1.5,TPESampler,COMPLETE
1649,0.2741901055211125,2025-04-24 21:41:33.393900,2025-04-24 21:41:37.267874,0 days 00:00:03.873974,233.34105204296839,Matern,1399.2324006753072,0.8290277331765187,0.5,TPESampler,COMPLETE
1650,0.17261859947714236,2025-04-24 21:41:36.249417,2025-04-24 21:41:41.548309,0 days 00:00:05.298892,1855.262634114826,Matern,150.36285398234995,0.0010819528237095751,1.5,TPESampler,COMPLETE
1651,1.3307518540653542,2025-04-24 21:41:37.465007,2025-04-24 21:41:40.725339,0 days 00:00:03.260332,0.0035725533530045024,Matern,5.573016912417838,1.1135965025034335e-07,0.5,TPESampler,COMPLETE
1652,0.17261887709220838,2025-04-24 21:41:37.527477,2025-04-24 21:41:41.364618,0 days 00:00:03.837141,6.387625830688915,Matern,63.5774013972436,0.010555065983882535,1.5,TPESampler,COMPLETE
1653,0.17261791187844416,2025-04-24 21:41:40.981266,2025-04-24 21:41:47.805526,0 days 00:00:06.824260,47978.03542723385,Matern,3031.3482246187627,0.6341505582988402,1.5,TPESampler,COMPLETE
1654,0.17261853897073937,2025-04-24 21:41:41.591711,2025-04-24 21:41:44.971286,0 days 00:00:03.379575,53224.97854263453,Matern,5.913752988872046,0.7397914938347694,1.5,TPESampler,COMPLETE
1655,1.3307518540986298,2025-04-24 21:41:41.818633,2025-04-24 21:41:46.362050,0 days 00:00:04.543417,991.6157062373295,Matern,1239.8164702173976,8.398021760588544e-05,2.5,TPESampler,COMPLETE
1656,0.17261846462408686,2025-04-24 21:41:45.222610,2025-04-24 21:41:51.718641,0 days 00:00:06.496031,0.42163966737945485,Matern,15.047879380832871,0.9540052939733451,1.5,TPESampler,COMPLETE
1657,0.17261815544057998,2025-04-24 21:41:46.620007,2025-04-24 21:41:50.147562,0 days 00:00:03.527555,44.19037730210638,Matern,34.98551774673564,0.03316494226684037,1.5,TPESampler,COMPLETE
1658,1.367756002831939,2025-04-24 21:41:48.029061,2025-04-24 21:41:50.329922,0 days 00:00:02.300861,9.322326435786044e-06,Matern,8.015958776651188e-05,0.28031575880128123,2.5,TPESampler,COMPLETE
1659,1.3307518541572732,2025-04-24 21:41:50.337315,2025-04-24 21:41:54.439938,0 days 00:00:04.102623,136.98369411374955,Matern,2239.887907101062,0.0012211960052300598,1.5,TPESampler,COMPLETE
1660,0.17261842439300804,2025-04-24 21:41:50.554023,2025-04-24 21:41:53.770459,0 days 00:00:03.216436,140.72651673954365,Matern,158.92736868575935,0.9352120418266519,1.5,TPESampler,COMPLETE
1661,0.21064499792148633,2025-04-24 21:41:51.936999,2025-04-24 21:41:55.572306,0 days 00:00:03.635307,8.425658897308047,RBF,48.04601242839889,0.6366588974437121,2.5,TPESampler,COMPLETE
1662,0.22211463835668557,2025-04-24 21:41:53.991408,2025-04-24 21:41:57.566291,0 days 00:00:03.574883,3.3233542542831995,Matern,0.4343939488502375,0.8251937606342905,2.5,TPESampler,COMPLETE
1663,0.17261779674880498,2025-04-24 21:41:54.672919,2025-04-24 21:41:59.234653,0 days 00:00:04.561734,1374.7662531164283,Matern,240.98172960217343,0.017477977507942378,1.5,TPESampler,COMPLETE
1664,1.3307518540986383,2025-04-24 21:41:55.794144,2025-04-24 21:42:01.315844,0 days 00:00:05.521700,2887.3527287061356,Matern,90769.58438584824,0.011288782105860975,1.5,TPESampler,COMPLETE
1665,1.3307518541231766,2025-04-24 21:41:57.790845,2025-04-24 21:42:01.369151,0 days 00:00:03.578306,2.152009062108601,Matern,5047.905236034065,1.0397485666648026e-10,1.5,TPESampler,COMPLETE
1666,1.33075185409887,2025-04-24 21:41:59.448386,2025-04-24 21:42:04.623195,0 days 00:00:05.174809,98.99367162860382,Matern,33089.48880083026,0.04820593888131994,1.5,TPESampler,COMPLETE
1667,0.17261892929976327,2025-04-24 21:42:01.497511,2025-04-24 21:42:07.329387,0 days 00:00:05.831876,75805.34906142451,Matern,18263.508568835612,0.7639689423893228,1.5,TPESampler,COMPLETE
1668,1.330751854098777,2025-04-24 21:42:01.544478,2025-04-24 21:42:05.105986,0 days 00:00:03.561508,0.5832236677321829,Matern,0.000621276967368624,0.6264792558569061,2.5,TPESampler,COMPLETE
1669,0.17261855201642576,2025-04-24 21:42:04.835642,2025-04-24 21:42:07.596412,0 days 00:00:02.760770,3958.786296290338,Matern,133.28713828908613,0.004822616752893332,1.5,TPESampler,COMPLETE
1670,0.17261799426874647,2025-04-24 21:42:05.358584,2025-04-24 21:42:10.477300,0 days 00:00:05.118716,761.3217765469154,Matern,331.66291117531455,0.017270887012314325,1.5,TPESampler,COMPLETE
1671,0.17261824182113303,2025-04-24 21:42:07.535915,2025-04-24 21:42:11.409699,0 days 00:00:03.873784,1028.2391866750384,Matern,1223.039927900308,0.9975381645834833,1.5,TPESampler,COMPLETE
1672,0.17261855452922487,2025-04-24 21:42:07.918021,2025-04-24 21:42:11.814022,0 days 00:00:03.896001,1773.373473483543,Matern,1.537111131347761,0.0031411850995088243,1.5,TPESampler,COMPLETE
1673,0.17261854806684784,2025-04-24 21:42:10.737964,2025-04-24 21:42:14.717209,0 days 00:00:03.979245,6.60727630903255,Matern,183.4838194248476,0.06982130090656984,1.5,TPESampler,COMPLETE
1674,1.3307518540982726,2025-04-24 21:42:11.692092,2025-04-24 21:42:17.336426,0 days 00:00:05.644334,94.82529690119023,Matern,89944.56287963326,0.00026352566946235184,1.5,TPESampler,COMPLETE
1675,0.17261834758791908,2025-04-24 21:42:12.166930,2025-04-24 21:42:15.757115,0 days 00:00:03.590185,96275.4327204158,Matern,1127.676123529937,0.004557452583783164,1.5,TPESampler,COMPLETE
1676,1.3307518540996712,2025-04-24 21:42:14.967632,2025-04-24 21:42:18.150004,0 days 00:00:03.182372,5969.287780564134,RBF,897.0740098346085,0.00024475051873426134,0.5,TPESampler,COMPLETE
1677,1.3307518540987493,2025-04-24 21:42:15.986166,2025-04-24 21:42:21.508501,0 days 00:00:05.522335,9.604553814938802,Matern,7951.793122550302,0.013729727450362352,1.5,TPESampler,COMPLETE
1678,0.2741901060934566,2025-04-24 21:42:17.591051,2025-04-24 21:42:21.859019,0 days 00:00:04.267968,1341.5649176934753,Matern,62820.30647797209,0.027723085212772156,0.5,TPESampler,COMPLETE
1679,1.3307518540987986,2025-04-24 21:42:18.386832,2025-04-24 21:42:21.778291,0 days 00:00:03.391459,1.688492435741787,Matern,91.24069952005442,0.0005911030446050755,1.5,TPESampler,COMPLETE
1680,0.17261854037125862,2025-04-24 21:42:21.730991,2025-04-24 21:42:28.987204,0 days 00:00:07.256213,651.5146072753836,Matern,15.532584742959076,0.023623690045199968,1.5,TPESampler,COMPLETE
1681,0.21064800655598398,2025-04-24 21:42:21.988830,2025-04-24 21:42:24.935446,0 days 00:00:02.946616,48219.95375098055,RBF,218.61910697463378,0.012158919269037597,1.5,TPESampler,COMPLETE
1682,0.17261765703892243,2025-04-24 21:42:22.091503,2025-04-24 21:42:27.527068,0 days 00:00:05.435565,63.303434390222115,Matern,1908.240973116721,0.03827050068774116,1.5,TPESampler,COMPLETE
1683,0.17261857837412264,2025-04-24 21:42:25.150704,2025-04-24 21:42:31.155886,0 days 00:00:06.005182,188.35462223875507,Matern,11681.94479834909,0.9553601784471144,1.5,TPESampler,COMPLETE
1684,1.330751854098855,2025-04-24 21:42:27.737144,2025-04-24 21:42:31.437654,0 days 00:00:03.700510,0.016415732912118376,RBF,0.0159547031344792,2.9853664216412477e-09,0.5,TPESampler,COMPLETE
1685,0.17261862576966935,2025-04-24 21:42:29.206943,2025-04-24 21:42:33.762949,0 days 00:00:04.556006,1322.0631972456931,Matern,60.69061475894063,0.7011759018648492,1.5,TPESampler,COMPLETE
1686,1.3307518540987593,2025-04-24 21:42:31.485509,2025-04-24 21:42:35.578045,0 days 00:00:04.092536,584.979189329937,Matern,1054.932813150329,0.0009018857916672601,1.5,TPESampler,COMPLETE
1687,0.1726186349044051,2025-04-24 21:42:31.714737,2025-04-24 21:42:39.163629,0 days 00:00:07.448892,0.028829711763903382,Matern,10.99463034940592,0.007909442585931348,1.5,TPESampler,COMPLETE
1688,0.17261854061232407,2025-04-24 21:42:33.985423,2025-04-24 21:42:40.998987,0 days 00:00:07.013564,58435.682768918625,Matern,40.33574401640203,0.013734199499129515,1.5,TPESampler,COMPLETE
1689,1.3307518348157055,2025-04-24 21:42:35.792060,2025-04-24 21:42:40.146874,0 days 00:00:04.354814,1.1127249315760037e-05,Matern,0.07670686521231078,1.8810745393523226e-08,1.5,TPESampler,COMPLETE
1690,0.17261856295358738,2025-04-24 21:42:39.376505,2025-04-24 21:42:44.364180,0 days 00:00:04.987675,72.30040232393847,Matern,40.10143517006111,0.0012368131915634093,1.5,TPESampler,COMPLETE
1691,0.17261853966003135,2025-04-24 21:42:40.357350,2025-04-24 21:42:43.860479,0 days 00:00:03.503129,1288.3930292878963,Matern,383.92093581066007,0.011553505676084553,1.5,TPESampler,COMPLETE
1692,0.1726185098038039,2025-04-24 21:42:41.216057,2025-04-24 21:42:44.278524,0 days 00:00:03.062467,90506.09123851566,Matern,215.08866440676408,0.01614754844558785,1.5,TPESampler,COMPLETE
1693,1.3307518540974277,2025-04-24 21:42:44.103906,2025-04-24 21:42:47.045164,0 days 00:00:02.941258,1232.154861285971,RBF,0.0007965090489278375,0.30688316160494994,1.5,TPESampler,COMPLETE
1694,1.3307518540984247,2025-04-24 21:42:44.546849,2025-04-24 21:42:49.130665,0 days 00:00:04.583816,13.382324866884082,Matern,3818.0463672663213,0.0535130727153666,1.5,TPESampler,COMPLETE
1695,0.17261861342073284,2025-04-24 21:42:44.738063,2025-04-24 21:42:51.816925,0 days 00:00:07.078862,20.74191424471696,Matern,79489.68487705194,0.06435065418065669,1.5,TPESampler,COMPLETE
1696,0.17261858039010874,2025-04-24 21:42:47.311485,2025-04-24 21:42:51.862786,0 days 00:00:04.551301,958.753950906316,Matern,0.8070896629401673,0.08228948943879998,1.5,TPESampler,COMPLETE
1697,0.17261848915574368,2025-04-24 21:42:49.344275,2025-04-24 21:42:53.561570,0 days 00:00:04.217295,201.029649789313,Matern,5051.382515966912,0.046257697427168766,1.5,TPESampler,COMPLETE
1698,0.17261869781087769,2025-04-24 21:42:51.971470,2025-04-24 21:42:55.772452,0 days 00:00:03.800982,10.174669208529306,Matern,107.49699347314915,0.04262988438835645,1.5,TPESampler,COMPLETE
1699,0.2221146824275778,2025-04-24 21:42:52.034072,2025-04-24 21:42:55.263608,0 days 00:00:03.229536,51734.02898701011,Matern,257.798323986427,0.0018060129594921908,2.5,TPESampler,COMPLETE
1700,0.1726185529954663,2025-04-24 21:42:53.791719,2025-04-24 21:42:57.029898,0 days 00:00:03.238179,2856.9055094963255,Matern,239.76938282675752,0.022543344987107354,1.5,TPESampler,COMPLETE
1701,0.17261858003474423,2025-04-24 21:42:55.480519,2025-04-24 21:42:59.228173,0 days 00:00:03.747654,73.68995569565743,Matern,0.6968987025088079,0.3685004607329628,1.5,TPESampler,COMPLETE
1702,1.3307518540981114,2025-04-24 21:42:56.021723,2025-04-24 21:43:00.941936,0 days 00:00:04.920213,1430.1517378622975,Matern,63245.77098487133,0.04482063618210594,1.5,TPESampler,COMPLETE
1703,0.2741901045712519,2025-04-24 21:42:57.258532,2025-04-24 21:43:01.786882,0 days 00:00:04.528350,0.0003427239741912536,Matern,1.6864129612693828,0.00034438995463711156,0.5,TPESampler,COMPLETE
1704,0.17261869077745795,2025-04-24 21:42:59.453161,2025-04-24 21:43:03.118059,0 days 00:00:03.664898,0.6742478512166945,Matern,112.09410435160994,0.9319559347280114,1.5,TPESampler,COMPLETE
1705,1.3307518540987064,2025-04-24 21:43:01.146136,2025-04-24 21:43:05.173147,0 days 00:00:04.027011,873.982448780116,Matern,8361.01293187544,0.016312721369811427,2.5,TPESampler,COMPLETE
1706,0.2221146080034892,2025-04-24 21:43:02.033072,2025-04-24 21:43:05.023428,0 days 00:00:02.990356,32.75843921948606,Matern,221.56569900116986,0.32570159072718013,2.5,TPESampler,COMPLETE
1707,0.17261857465176375,2025-04-24 21:43:03.339051,2025-04-24 21:43:08.364296,0 days 00:00:05.025245,5606.622186717194,Matern,1166.7772431200124,0.0005606574946410533,1.5,TPESampler,COMPLETE
1708,1.3307518540987924,2025-04-24 21:43:05.233719,2025-04-24 21:43:08.987649,0 days 00:00:03.753930,230.22972532783598,RBF,16994.022597779596,0.0003665172813521089,1.5,TPESampler,COMPLETE
1709,0.1726185411700365,2025-04-24 21:43:05.456122,2025-04-24 21:43:08.623843,0 days 00:00:03.167721,35773.77281121105,Matern,1664.5155317054807,0.992490302070168,1.5,TPESampler,COMPLETE
1710,0.17261793280281076,2025-04-24 21:43:08.582072,2025-04-24 21:43:12.911589,0 days 00:00:04.329517,3637.469577558029,Matern,37.440626293527025,0.04646061548329799,1.5,TPESampler,COMPLETE
1711,1.3307518540987389,2025-04-24 21:43:08.921272,2025-04-24 21:43:13.612368,0 days 00:00:04.691096,79679.80734202235,Matern,5988.062060429396,0.00013187075554244805,1.5,TPESampler,COMPLETE
1712,0.17261879800025456,2025-04-24 21:43:09.262789,2025-04-24 21:43:12.035794,0 days 00:00:02.773005,937.3169443260812,Matern,1163.643938669139,0.013514342128930542,1.5,TPESampler,COMPLETE
1713,0.17261848307403962,2025-04-24 21:43:12.266390,2025-04-24 21:43:16.859643,0 days 00:00:04.593253,7.100812639944892,Matern,1887.9761689908498,0.7372591470696123,1.5,TPESampler,COMPLETE
1714,0.17261663939641222,2025-04-24 21:43:13.142337,2025-04-24 21:43:16.965048,0 days 00:00:03.822711,305.2304578490559,Matern,3147.8691869623485,0.8888226100122264,1.5,TPESampler,COMPLETE
1715,1.330751854103074,2025-04-24 21:43:13.874120,2025-04-24 21:43:18.082567,0 days 00:00:04.208447,16.645039588783213,Matern,929.3091451771991,2.1878008091345054e-05,1.5,TPESampler,COMPLETE
1716,0.17261854141476327,2025-04-24 21:43:17.045519,2025-04-24 21:43:21.323082,0 days 00:00:04.277563,1236.3301872831569,Matern,24434.964038869275,0.9243259138513208,1.5,TPESampler,COMPLETE
