number,value,datetime_start,datetime_complete,duration,params_constant_value,params_kernel_type,params_length_scale,params_noise_level,params_nu,system_attrs_auto:sampler,state
0,1.330751854096971,2025-04-24 20:58:22.981477,2025-04-24 20:58:26.333444,0 days 00:00:03.351967,1463.0480283345387,Matern,0.0041779322032917485,8.263773253630382e-09,0.5,RandomSampler,COMPLETE
1,1.3307518540986463,2025-04-24 20:58:23.113600,2025-04-24 20:58:32.553162,0 days 00:00:09.439562,1.6384756623589453e-05,Matern,4495.011307405061,1.0268753115173781e-09,0.5,RandomSampler,COMPLETE
2,1.3307518540991805,2025-04-24 20:58:23.174797,2025-04-24 20:58:26.879814,0 days 00:00:03.705017,2.5502145353693e-05,RBF,0.003104803324051908,4.3110631093469516e-08,2.5,RandomSampler,COMPLETE
3,1.330751854098505,2025-04-24 20:58:26.545132,2025-04-24 20:58:31.618562,0 days 00:00:05.073430,0.0008772298712052494,RBF,137.29943602675453,2.7010807744938207e-08,1.5,TPESampler,COMPLETE
4,1.3307518540985959,2025-04-24 20:58:27.099918,2025-04-24 20:58:30.201164,0 days 00:00:03.101246,2686.2717092078988,Matern,0.007282817312555588,4.107657663706715e-08,2.5,TPESampler,COMPLETE
5,1.330751854099817,2025-04-24 20:58:30.408685,2025-04-24 20:58:32.968221,0 days 00:00:02.559536,116.02268422096265,Matern,2.132641894618457e-05,7.251588490731278e-05,1.5,TPESampler,COMPLETE
6,1.330751854098314,2025-04-24 20:58:31.825136,2025-04-24 20:58:35.515450,0 days 00:00:03.690314,6.091239906078505e-05,Matern,2.6209782212300174e-05,4.1703050886829995e-06,0.5,TPESampler,COMPLETE
7,1.3677559959368413,2025-04-24 20:58:32.741165,2025-04-24 20:58:34.821118,0 days 00:00:02.079953,6.282845435213746e-06,RBF,0.0014488895718956006,0.19153851617860326,0.5,TPESampler,COMPLETE
8,0.210644595575979,2025-04-24 20:58:33.161572,2025-04-24 20:58:36.342706,0 days 00:00:03.181134,19.824052207839955,RBF,203.05443772260827,0.064262600409344,0.5,TPESampler,COMPLETE
9,0.21064472868114767,2025-04-24 20:58:35.026452,2025-04-24 20:58:41.097629,0 days 00:00:06.071177,2.266730091994054e-05,RBF,6.115099629088782,7.889713906140387e-05,1.5,TPESampler,COMPLETE
10,1.330751854098946,2025-04-24 20:58:35.719215,2025-04-24 20:58:41.049385,0 days 00:00:05.330170,0.0002161225552029682,RBF,93.78835975257189,5.421697220902778e-06,1.5,TPESampler,COMPLETE
11,1.330751854087915,2025-04-24 20:58:36.539067,2025-04-24 20:58:38.958825,0 days 00:00:02.419758,9.024400773007253,Matern,3.6037739343816456e-05,9.341773506896975e-08,1.5,TPESampler,COMPLETE
12,1.367756951665171,2025-04-24 20:58:39.156770,2025-04-24 20:58:43.591506,0 days 00:00:04.434736,0.726201231488869,RBF,48301.93961010409,0.05418084392406717,0.5,TPESampler,COMPLETE
13,0.210644645498711,2025-04-24 20:58:41.207210,2025-04-24 20:58:44.476951,0 days 00:00:03.269741,320.2211910895137,RBF,21.327757422965952,0.3174800429564143,1.5,TPESampler,COMPLETE
14,0.2741901055910224,2025-04-24 20:58:41.273684,2025-04-24 20:58:44.703879,0 days 00:00:03.430195,26.258450430398387,Matern,15.004965232205235,0.16588199536599996,0.5,TPESampler,COMPLETE
15,0.21064467042508997,2025-04-24 20:58:43.794486,2025-04-24 20:58:46.555752,0 days 00:00:02.761266,93091.8070706295,RBF,1.6308631335295276,0.008054401268650915,0.5,TPESampler,COMPLETE
16,0.21064426613404122,2025-04-24 20:58:44.660782,2025-04-24 20:58:47.735544,0 days 00:00:03.074762,5.978785911457827,RBF,0.5451485630608852,0.023316925777170414,1.5,TPESampler,COMPLETE
17,0.2106448851958389,2025-04-24 20:58:44.855004,2025-04-24 20:58:48.123523,0 days 00:00:03.268519,2022.8094328244415,RBF,471.3356315046775,0.6091315159469752,1.5,TPESampler,COMPLETE
18,1.3307518540997207,2025-04-24 20:58:46.768052,2025-04-24 20:58:50.262253,0 days 00:00:03.494201,100.40730197647329,RBF,15392.784945923706,2.8246557440963344e-07,0.5,TPESampler,COMPLETE
19,1.3307518540987955,2025-04-24 20:58:47.936975,2025-04-24 20:58:51.159486,0 days 00:00:03.222511,35.858186690672625,RBF,0.0002854781406162975,0.01574126110160467,1.5,TPESampler,COMPLETE
20,1.3307518540995549,2025-04-24 20:58:48.572088,2025-04-24 20:58:56.413110,0 days 00:00:07.841022,0.0003216941953305712,Matern,0.0036885037871778824,0.13624443379354897,1.5,TPESampler,COMPLETE
21,1.3307518540986925,2025-04-24 20:58:50.467288,2025-04-24 20:58:54.394094,0 days 00:00:03.926806,2.643047405830804,Matern,1052.8625903229217,0.00013992667200104998,1.5,TPESampler,COMPLETE
22,0.21064461418107475,2025-04-24 20:58:51.362384,2025-04-24 20:58:54.970179,0 days 00:00:03.607795,0.06044590757182463,RBF,31.141550009218363,0.13640357997159944,2.5,TPESampler,COMPLETE
23,0.21064253716680195,2025-04-24 20:58:54.611095,2025-04-24 20:58:58.032242,0 days 00:00:03.421147,156.9893524006823,RBF,4.389695688849217,0.00029456577820859896,1.5,TPESampler,COMPLETE
24,0.21064457712851303,2025-04-24 20:58:55.162889,2025-04-24 20:58:58.517855,0 days 00:00:03.354966,0.4419996910272002,RBF,117.96501645745009,0.25361388624659376,2.5,TPESampler,COMPLETE
25,0.2106462288192054,2025-04-24 20:58:56.616403,2025-04-24 20:58:59.693826,0 days 00:00:03.077423,3.75123360557091,RBF,1.4658999277654627,0.0003995398104034482,2.5,TPESampler,COMPLETE
26,0.21064476832158646,2025-04-24 20:58:58.236779,2025-04-24 20:59:01.369719,0 days 00:00:03.132940,0.11024082073742311,RBF,2.0691438862358678,0.0007286561782463467,1.5,TPESampler,COMPLETE
27,1.3307518540983219,2025-04-24 20:58:58.698478,2025-04-24 20:59:03.422233,0 days 00:00:04.723755,6317.452648865394,RBF,31.58093510705505,6.285523456013094e-06,1.5,TPESampler,COMPLETE
28,1.3307518540969037,2025-04-24 20:58:59.909235,2025-04-24 20:59:03.542632,0 days 00:00:03.633397,105.02445706497147,RBF,20163.508746266478,0.0006299691541059544,2.5,TPESampler,COMPLETE
29,1.3307518540987464,2025-04-24 20:59:01.582729,2025-04-24 20:59:05.469971,0 days 00:00:03.887242,25582.21488545364,Matern,18466.131340602704,1.56371163482522e-07,2.5,TPESampler,COMPLETE
30,1.3307518540158685,2025-04-24 20:59:03.608683,2025-04-24 20:59:06.365218,0 days 00:00:02.756535,3.953591165684731,Matern,0.06625902763900746,0.008630745202015547,1.5,TPESampler,COMPLETE
31,0.210643350891641,2025-04-24 20:59:03.740809,2025-04-24 20:59:08.807125,0 days 00:00:05.066316,0.0011379111086328884,RBF,5.686181881554488,0.5345032345796087,1.5,TPESampler,COMPLETE
32,0.1726185556289472,2025-04-24 20:59:05.670578,2025-04-24 20:59:08.869697,0 days 00:00:03.199119,75019.85230649747,Matern,3.7320503977199078,0.00012216501679879676,1.5,TPESampler,COMPLETE
33,0.21064485368919467,2025-04-24 20:59:06.570860,2025-04-24 20:59:09.304797,0 days 00:00:02.733937,0.49693183491170934,RBF,1.2093193569692444,0.003088137187395775,0.5,TPESampler,COMPLETE
34,0.17261953745393088,2025-04-24 20:59:08.935055,2025-04-24 20:59:14.278678,0 days 00:00:05.343623,46216.93219560671,Matern,0.9395083912134118,3.0095075341820164e-05,1.5,TPESampler,COMPLETE
35,0.17261955197415216,2025-04-24 20:59:09.007981,2025-04-24 20:59:12.585702,0 days 00:00:03.577721,13187.83117815841,Matern,4.271354509594317,2.7659112180982832e-06,1.5,TPESampler,COMPLETE
36,1.3307518540981225,2025-04-24 20:59:09.540201,2025-04-24 20:59:14.338281,0 days 00:00:04.798080,0.022233824779786495,RBF,0.04450218461714772,0.5072860642905385,1.5,TPESampler,COMPLETE
37,0.1726185088770196,2025-04-24 20:59:12.786584,2025-04-24 20:59:20.701476,0 days 00:00:07.914892,674.7979505277714,Matern,3.7615045657909887,6.470002793833796e-08,1.5,TPESampler,COMPLETE
38,1.3677569268703198,2025-04-24 20:59:14.412900,2025-04-24 20:59:17.072768,0 days 00:00:02.659868,90338.0368780166,Matern,0.46762075178442963,2.583550599716571e-05,1.5,TPESampler,COMPLETE
39,0.17261940030877332,2025-04-24 20:59:14.470764,2025-04-24 20:59:18.146306,0 days 00:00:03.675542,31904.378355312158,Matern,6.314643519278833,9.627802083041007e-05,1.5,TPESampler,COMPLETE
40,0.2741901081212411,2025-04-24 20:59:17.284431,2025-04-24 20:59:20.163619,0 days 00:00:02.879188,30322.07046690495,Matern,46.3480724131791,3.3403540437415914e-06,0.5,TPESampler,COMPLETE
41,0.1726187546627979,2025-04-24 20:59:18.376213,2025-04-24 20:59:22.238248,0 days 00:00:03.862035,77719.51176227782,Matern,344.3337319105358,5.423556521026581e-06,1.5,TPESampler,COMPLETE
42,0.1726185585923751,2025-04-24 20:59:20.359082,2025-04-24 20:59:27.698989,0 days 00:00:07.339907,27316.998647498527,Matern,1.2832961860015193,0.018317880813805358,1.5,TPESampler,COMPLETE
43,1.3307518540988212,2025-04-24 20:59:20.894941,2025-04-24 20:59:27.290905,0 days 00:00:06.395964,198.87917021370967,Matern,0.015525383171548834,5.742358665715461e-08,1.5,TPESampler,COMPLETE
44,0.17261590133439153,2025-04-24 20:59:22.871168,2025-04-24 20:59:32.882778,0 days 00:00:10.011610,17339.747576136186,Matern,2245.390556527377,0.0002459512580592035,1.5,TPESampler,COMPLETE
45,1.3307518540993164,2025-04-24 20:59:27.498546,2025-04-24 20:59:31.545131,0 days 00:00:04.046585,4.093213911908152,Matern,316.508794443203,5.743899267171238e-09,1.5,TPESampler,COMPLETE
46,0.17261856119299893,2025-04-24 20:59:27.906152,2025-04-24 20:59:31.222200,0 days 00:00:03.316048,1469.8827603436155,Matern,6.939526018145356,0.18337746760815316,1.5,TPESampler,COMPLETE
47,0.1726187307047686,2025-04-24 20:59:31.461946,2025-04-24 20:59:35.703133,0 days 00:00:04.241187,19825.076200899934,Matern,2.621850629568064,0.41311245061172336,1.5,TPESampler,COMPLETE
48,0.2221146663470943,2025-04-24 20:59:31.789640,2025-04-24 20:59:34.591021,0 days 00:00:02.801381,15215.672273465136,Matern,5.500927400131293,0.00020888473824809878,2.5,TPESampler,COMPLETE
49,1.330751854098795,2025-04-24 20:59:33.098579,2025-04-24 20:59:37.137591,0 days 00:00:04.039012,39171.65670731219,Matern,46509.14637604244,0.0007074524643269954,1.5,TPESampler,COMPLETE
50,1.330751854099413,2025-04-24 20:59:34.801053,2025-04-24 20:59:37.764440,0 days 00:00:02.963387,98.54992770302573,Matern,0.056686051044870206,0.2702900236511915,2.5,TPESampler,COMPLETE
51,0.17261871981691823,2025-04-24 20:59:35.911413,2025-04-24 20:59:39.932469,0 days 00:00:04.021056,289.98515583355515,Matern,346.8033749188151,0.8077219921950204,1.5,TPESampler,COMPLETE
52,1.330751854099027,2025-04-24 20:59:37.386124,2025-04-24 20:59:40.352231,0 days 00:00:02.966107,15058.520764737905,Matern,0.001148321808626455,0.10584554685104287,1.5,TPESampler,COMPLETE
53,0.17261850873413007,2025-04-24 20:59:37.963205,2025-04-24 20:59:41.595265,0 days 00:00:03.632060,182.35719246067333,Matern,3.099510414900494,0.40703209324839495,1.5,TPESampler,COMPLETE
54,1.367756951266476,2025-04-24 20:59:40.134650,2025-04-24 20:59:44.448396,0 days 00:00:04.313746,0.02421823293988891,Matern,15835.225051050924,0.2697466134449928,1.5,TPESampler,COMPLETE
55,0.17261597061315276,2025-04-24 20:59:40.585375,2025-04-24 20:59:44.508855,0 days 00:00:03.923480,497.75251954946987,Matern,1127.8714745506477,0.25340035184854415,1.5,TPESampler,COMPLETE
56,0.1726185471604172,2025-04-24 20:59:41.811419,2025-04-24 20:59:49.365055,0 days 00:00:07.553636,12.07191566654742,Matern,5.075734693993231,0.011827183850528018,1.5,TPESampler,COMPLETE
57,0.17261844987061706,2025-04-24 20:59:44.605673,2025-04-24 20:59:47.907965,0 days 00:00:03.302292,28758.044838049707,Matern,77.79351408068834,2.512988990199849e-10,1.5,TPESampler,COMPLETE
58,0.22211524650051603,2025-04-24 20:59:44.653617,2025-04-24 20:59:48.063893,0 days 00:00:03.410276,141.9439104273333,Matern,972.9313064507614,0.02249587324265465,2.5,TPESampler,COMPLETE
59,0.17261862653004523,2025-04-24 20:59:48.066783,2025-04-24 20:59:52.000442,0 days 00:00:03.933659,2858.5031562993468,Matern,171.62327745500195,1.266924006054543e-10,1.5,TPESampler,COMPLETE
60,1.330751854099445,2025-04-24 20:59:48.251065,2025-04-24 20:59:53.388562,0 days 00:00:05.137497,2.588344392095847e-06,Matern,37.01441405615401,4.515428763609811e-06,0.5,TPESampler,COMPLETE
61,1.330751854099016,2025-04-24 20:59:49.580290,2025-04-24 20:59:54.488152,0 days 00:00:04.907862,12834.073852363374,RBF,597.692337694727,1.996050857064065e-09,1.5,TPESampler,COMPLETE
62,0.1726185010738902,2025-04-24 20:59:52.211995,2025-04-24 20:59:55.777613,0 days 00:00:03.565618,0.1639884895912225,Matern,23.413376738714287,0.056747244312157025,1.5,TPESampler,COMPLETE
63,1.3307518540981624,2025-04-24 20:59:53.588440,2025-04-24 20:59:58.631675,0 days 00:00:05.043235,17.142841285336196,Matern,332.19053234314663,1.4908407922034323e-10,2.5,TPESampler,COMPLETE
64,0.2741901061723453,2025-04-24 20:59:54.709347,2025-04-24 20:59:58.274205,0 days 00:00:03.564858,0.7572285928183923,Matern,5.827318643680998,2.639977343608119e-07,0.5,TPESampler,COMPLETE
65,0.17262026492652746,2025-04-24 20:59:55.983643,2025-04-24 20:59:59.879424,0 days 00:00:03.895781,0.041808849700737914,Matern,0.65431016615098,0.07478648136146146,1.5,TPESampler,COMPLETE
66,0.17261876976898402,2025-04-24 20:59:58.490444,2025-04-24 21:00:03.247236,0 days 00:00:04.756792,0.5095392953631239,Matern,183.1980115035632,0.0265613582227206,1.5,TPESampler,COMPLETE
67,0.17261858682559103,2025-04-24 20:59:58.873160,2025-04-24 21:00:05.258638,0 days 00:00:06.385478,0.0023970245410811592,Matern,0.48233819433462044,1.3345760649744725e-06,1.5,TPESampler,COMPLETE
68,1.33075185409966,2025-04-24 21:00:00.130423,2025-04-24 21:00:07.014683,0 days 00:00:06.884260,0.00030093122938768945,Matern,170.81327129792527,0.007162495013278842,2.5,TPESampler,COMPLETE
69,1.3677569516711323,2025-04-24 21:00:03.448206,2025-04-24 21:00:06.180529,0 days 00:00:02.732323,56626.00944860735,Matern,1.7098843681534444,7.576432228020985e-09,1.5,TPESampler,COMPLETE
70,1.3677569516782477,2025-04-24 21:00:05.482777,2025-04-24 21:00:08.034749,0 days 00:00:02.551972,45216.4386543074,RBF,2.1305360978123544,9.610469800356934e-10,0.5,TPESampler,COMPLETE
71,1.330751854100939,2025-04-24 21:00:06.405726,2025-04-24 21:00:14.419036,0 days 00:00:08.013310,24640.036785751232,RBF,5.4730374932666734e-05,1.682978073354909e-05,2.5,TPESampler,COMPLETE
72,1.3307518540993202,2025-04-24 21:00:07.231414,2025-04-24 21:00:11.898561,0 days 00:00:04.667147,5.950959732584213e-07,RBF,0.003806089883321245,4.7063449373261324e-08,0.5,TPESampler,COMPLETE
73,0.17261855620389485,2025-04-24 21:00:08.242340,2025-04-24 21:00:11.618320,0 days 00:00:03.375980,342.4544075293139,Matern,86.39975685046083,0.0004386684115507187,1.5,TPESampler,COMPLETE
74,0.27419010616370354,2025-04-24 21:00:11.806954,2025-04-24 21:00:15.792155,0 days 00:00:03.985201,23076.33957192872,Matern,1216.0851986981852,0.015275092997308275,0.5,TPESampler,COMPLETE
75,1.330751854098682,2025-04-24 21:00:12.088409,2025-04-24 21:00:15.914980,0 days 00:00:03.826571,0.00012503972858779605,Matern,4.448114742776656e-05,6.045454878260937e-10,1.5,TPESampler,COMPLETE
76,0.27419010582416936,2025-04-24 21:00:14.622061,2025-04-24 21:00:18.070184,0 days 00:00:03.448123,316.45578767943425,Matern,2.978020274494996,5.454023818154014e-10,0.5,TPESampler,COMPLETE
77,1.3307518540974947,2025-04-24 21:00:15.963100,2025-04-24 21:00:23.042773,0 days 00:00:07.079673,6.746016264857736e-07,Matern,3.728983771686108e-05,0.00042970450746894137,2.5,TPESampler,COMPLETE
78,1.3307518540982686,2025-04-24 21:00:16.141838,2025-04-24 21:00:22.235452,0 days 00:00:06.093614,0.0001408637652290908,Matern,11.765732104968214,0.043626336715469914,0.5,TPESampler,COMPLETE
79,1.3307518541044225,2025-04-24 21:00:18.272041,2025-04-24 21:00:23.892907,0 days 00:00:05.620866,0.00011451240519032037,Matern,55.51890318094898,0.00043622202098363464,1.5,TPESampler,COMPLETE
80,0.22211472883584824,2025-04-24 21:00:22.453217,2025-04-24 21:00:28.052524,0 days 00:00:05.599307,0.7894597206686631,Matern,0.17355553045906943,8.214898917279246e-05,2.5,TPESampler,COMPLETE
81,1.330751854078344,2025-04-24 21:00:23.258528,2025-04-24 21:00:32.349309,0 days 00:00:09.090781,1.3775681083790448e-05,Matern,6177.343336116083,1.4436287084338352e-09,2.5,TPESampler,COMPLETE
82,0.17261840679232152,2025-04-24 21:00:24.122534,2025-04-24 21:00:28.940356,0 days 00:00:04.817822,0.9456446511649386,Matern,38.41904306942967,0.6983698694873206,1.5,TPESampler,COMPLETE
83,0.17261855082506147,2025-04-24 21:00:28.305324,2025-04-24 21:00:31.648524,0 days 00:00:03.343200,5.550040598263714,Matern,20.903878017223395,0.00020797576726419364,1.5,TPESampler,COMPLETE
84,0.17261856271437034,2025-04-24 21:00:29.185779,2025-04-24 21:00:32.634319,0 days 00:00:03.448540,0.3271357148685159,Matern,29.936617867948037,0.5183384616932575,1.5,TPESampler,COMPLETE
85,0.17261879736006447,2025-04-24 21:00:31.901596,2025-04-24 21:00:36.282835,0 days 00:00:04.381239,8.766086886807562,Matern,4.287586179599981,0.009995109200115409,1.5,TPESampler,COMPLETE
86,0.17261855495445563,2025-04-24 21:00:32.649875,2025-04-24 21:00:39.395992,0 days 00:00:06.746117,2.0742169023882377,Matern,32.61906690517684,1.4580292845902383e-05,1.5,TPESampler,COMPLETE
87,0.17261850031738715,2025-04-24 21:00:32.931897,2025-04-24 21:00:36.885097,0 days 00:00:03.953200,74.20449375802906,Matern,1335.6115596122022,0.012103825339463076,1.5,TPESampler,COMPLETE
88,0.1726180240848542,2025-04-24 21:00:36.532581,2025-04-24 21:00:41.224385,0 days 00:00:04.691804,2006.08455545781,Matern,15043.692282688073,0.9717544597326105,1.5,TPESampler,COMPLETE
89,0.17261862329303965,2025-04-24 21:00:37.146619,2025-04-24 21:00:41.271635,0 days 00:00:04.125016,9.842646018481478,Matern,1.2138101867971514,0.5158534486230111,1.5,TPESampler,COMPLETE
90,1.330751854098601,2025-04-24 21:00:39.634375,2025-04-24 21:00:43.656313,0 days 00:00:04.021938,23.485983344882037,Matern,5876.737587107464,0.007161159829963456,1.5,TPESampler,COMPLETE
91,0.17261860114064007,2025-04-24 21:00:41.380531,2025-04-24 21:00:45.301868,0 days 00:00:03.921337,3195.0593194884973,Matern,1355.2105832548323,0.039303158231552636,1.5,TPESampler,COMPLETE
92,1.3307518540988459,2025-04-24 21:00:41.462807,2025-04-24 21:00:47.398983,0 days 00:00:05.936176,410.6538422610723,Matern,66603.68994453188,0.047189424560104734,1.5,TPESampler,COMPLETE
93,1.3307518540987284,2025-04-24 21:00:43.913980,2025-04-24 21:00:49.702479,0 days 00:00:05.788499,77.58931020503917,RBF,36292.09903905425,0.0003424380343690152,1.5,TPESampler,COMPLETE
94,0.17261927319424203,2025-04-24 21:00:45.548758,2025-04-24 21:00:49.318976,0 days 00:00:03.770218,52085.2935274919,Matern,63309.06555502696,0.15037672192139334,1.5,TPESampler,COMPLETE
95,0.17261855322610084,2025-04-24 21:00:47.638493,2025-04-24 21:00:50.995583,0 days 00:00:03.357090,2167.8174889445872,Matern,27.35862574404496,5.751812926076131e-09,1.5,TPESampler,COMPLETE
96,0.17261898942796702,2025-04-24 21:00:49.538170,2025-04-24 21:00:53.249702,0 days 00:00:03.711532,2.686988980620362,Matern,1208.4167798289793,0.1643396869276383,1.5,TPESampler,COMPLETE
97,0.2106446629022252,2025-04-24 21:00:49.899076,2025-04-24 21:00:52.775939,0 days 00:00:02.876863,1.1421356374217964,RBF,121.44855386705484,0.25968953239412057,1.5,TPESampler,COMPLETE
98,1.330751854099078,2025-04-24 21:00:51.220583,2025-04-24 21:00:55.386713,0 days 00:00:04.166130,220.83345189221714,RBF,74.58994839992853,2.4901056858843684e-08,2.5,TPESampler,COMPLETE
99,0.2741900921934717,2025-04-24 21:00:52.990166,2025-04-24 21:00:56.456010,0 days 00:00:03.465844,0.3564978361630576,Matern,3.946008861938514,0.03728689043238589,0.5,TPESampler,COMPLETE
100,0.17261820129401753,2025-04-24 21:00:53.481221,2025-04-24 21:00:57.221863,0 days 00:00:03.740642,204.75297936305742,Matern,78.17604723269886,0.5017333686661182,1.5,TPESampler,COMPLETE
101,1.33075185409622,2025-04-24 21:00:55.611648,2025-04-24 21:01:00.358093,0 days 00:00:04.746445,5954.100635903667,Matern,35751.741025511285,2.5902665930731322e-09,1.5,TPESampler,COMPLETE
102,1.330751854098744,2025-04-24 21:00:56.678197,2025-04-24 21:00:59.876685,0 days 00:00:03.198488,266.702538898921,Matern,0.048701934793917885,2.3542983188979167e-10,1.5,TPESampler,COMPLETE
103,0.1726185208996421,2025-04-24 21:00:57.477035,2025-04-24 21:01:01.086119,0 days 00:00:03.609084,1082.063893476393,Matern,752.4339873429765,0.3067633849288202,1.5,TPESampler,COMPLETE
104,0.1726175026125931,2025-04-24 21:01:00.119102,2025-04-24 21:01:04.903663,0 days 00:00:04.784561,64.83026214652597,Matern,88.66449942627897,0.8786153928187106,1.5,TPESampler,COMPLETE
105,0.17261920726403712,2025-04-24 21:01:00.584889,2025-04-24 21:01:06.278877,0 days 00:00:05.693988,90.98285538748603,Matern,115.0993110716385,0.006765610854257837,1.5,TPESampler,COMPLETE
106,0.17261854577832594,2025-04-24 21:01:01.347848,2025-04-24 21:01:08.805112,0 days 00:00:07.457264,12271.170105978472,Matern,35.48998594677566,0.377706403446112,1.5,TPESampler,COMPLETE
107,0.2221145921446187,2025-04-24 21:01:05.134398,2025-04-24 21:01:08.801555,0 days 00:00:03.667157,37259.35351234366,Matern,858.2926258494147,0.7872261357503622,2.5,TPESampler,COMPLETE
108,1.3307518540983283,2025-04-24 21:01:06.525524,2025-04-24 21:01:11.294141,0 days 00:00:04.768617,1.1250863431749901e-05,Matern,0.06548539797839545,5.667332877887223e-09,2.5,TPESampler,COMPLETE
109,1.3307518540987526,2025-04-24 21:01:08.970187,2025-04-24 21:01:12.789303,0 days 00:00:03.819116,0.005011844261513347,RBF,0.023321224997924182,7.960604649253154e-10,1.5,TPESampler,COMPLETE
110,0.1726185316371347,2025-04-24 21:01:09.043858,2025-04-24 21:01:13.127944,0 days 00:00:04.084086,286.63470749895833,Matern,2159.9234266382955,0.8584457177474939,1.5,TPESampler,COMPLETE
111,0.2741901056753173,2025-04-24 21:01:11.509465,2025-04-24 21:01:14.650456,0 days 00:00:03.140991,521.7996096581197,Matern,7.019078119620595,0.5887458487119782,0.5,TPESampler,COMPLETE
112,0.17261855249367486,2025-04-24 21:01:13.027979,2025-04-24 21:01:16.392026,0 days 00:00:03.364047,484.7327663153114,Matern,79.00716761870373,0.4105232099317246,1.5,TPESampler,COMPLETE
113,0.1726186707047154,2025-04-24 21:01:13.387429,2025-04-24 21:01:16.717113,0 days 00:00:03.329684,6.944048567201728,Matern,59.73049414670765,0.3663732857829088,1.5,TPESampler,COMPLETE
