number,value,datetime_start,datetime_complete,duration,params_constant_value,params_kernel_type,params_length_scale,params_noise_level,params_nu,system_attrs_auto:sampler,state
1261,0.17261858146237466,2025-04-24 21:31:00.961221,2025-04-24 21:31:04.889781,0 days 00:00:03.928560,33606.57833263241,Matern,88103.9859647413,0.14021216636268852,1.5,TPESampler,COMPLETE
1262,0.17261852506420272,2025-04-24 21:31:03.066679,2025-04-24 21:31:06.217120,0 days 00:00:03.150441,97994.37487095501,Matern,3483.225666914609,0.05719908887773983,1.5,TPESampler,COMPLETE
1263,1.3307518540997847,2025-04-24 21:31:04.474679,2025-04-24 21:31:07.342461,0 days 00:00:02.867782,1852.123635672901,Matern,25969.298997171536,0.003330103053103846,1.5,TPESampler,COMPLETE
1264,0.17261781968316142,2025-04-24 21:31:05.075486,2025-04-24 21:31:09.003447,0 days 00:00:03.927961,2916.1505643753067,Matern,347.84637879293933,0.0013175321968238076,1.5,TPESampler,COMPLETE
1265,1.330751854097747,2025-04-24 21:31:06.444049,2025-04-24 21:31:11.253284,0 days 00:00:04.809235,155.53519068334748,Matern,58122.56922180347,0.000998771720878167,1.5,TPESampler,COMPLETE
1266,0.17261890401945093,2025-04-24 21:31:07.580163,2025-04-24 21:31:10.667942,0 days 00:00:03.087779,2649.774300892064,Matern,1036.6249947468937,0.010752278130336253,1.5,TPESampler,COMPLETE
1267,0.17261855322115982,2025-04-24 21:31:09.238409,2025-04-24 21:31:12.959117,0 days 00:00:03.720708,302.2348311021818,Matern,366.42872880486675,0.010288292126275122,1.5,TPESampler,COMPLETE
1268,1.3307518540993202,2025-04-24 21:31:10.892838,2025-04-24 21:31:15.502817,0 days 00:00:04.609979,6.117902835552598e-07,RBF,1.709593612714934e-05,4.711858517053985e-08,0.5,TPESampler,COMPLETE
1269,0.2741901062076282,2025-04-24 21:31:11.476245,2025-04-24 21:31:15.876591,0 days 00:00:04.400346,62011.954340763055,Matern,5489.48831036393,0.7042904454988395,0.5,TPESampler,COMPLETE
1270,0.17261846380816845,2025-04-24 21:31:13.201264,2025-04-24 21:31:17.829232,0 days 00:00:04.627968,921.3303178752814,Matern,2467.9143502416064,0.9890204731480157,1.5,TPESampler,COMPLETE
1271,0.2106442661164343,2025-04-24 21:31:15.732045,2025-04-24 21:31:21.663718,0 days 00:00:05.931673,0.0016924148168718349,RBF,0.30030978329487046,3.8174299381964364e-07,0.5,TPESampler,COMPLETE
1272,1.330751854098947,2025-04-24 21:31:16.069732,2025-04-24 21:31:17.987526,0 days 00:00:01.917794,1.3427204392008487,Matern,0.003196218921392335,0.0002887497544715513,0.5,TPESampler,COMPLETE
1273,1.3307518541071084,2025-04-24 21:31:18.004219,2025-04-24 21:31:22.477532,0 days 00:00:04.473313,271.55591909048354,Matern,71179.41487045409,0.05530942334377544,1.5,TPESampler,COMPLETE
1274,0.21064485216564355,2025-04-24 21:31:18.198435,2025-04-24 21:31:21.412771,0 days 00:00:03.214336,50185.05704670916,RBF,507.3932583441343,0.0001907415271748638,1.5,TPESampler,COMPLETE
1275,0.17261850086790523,2025-04-24 21:31:21.605065,2025-04-24 21:31:24.412432,0 days 00:00:02.807367,10195.729220600619,Matern,194.9752418654489,0.0319135736124415,1.5,TPESampler,COMPLETE
1276,0.17261855721764455,2025-04-24 21:31:21.876851,2025-04-24 21:31:24.685796,0 days 00:00:02.808945,52769.55400174473,Matern,1306.5704067860836,0.00713372018492307,1.5,TPESampler,COMPLETE
1277,1.3307518540987078,2025-04-24 21:31:22.708832,2025-04-24 21:31:28.250025,0 days 00:00:05.541193,37.362609505278655,Matern,22424.33170641466,0.02669934380832526,1.5,TPESampler,COMPLETE
1278,0.17261855330455092,2025-04-24 21:31:24.634573,2025-04-24 21:31:27.421532,0 days 00:00:02.786959,2857.9873541907236,Matern,98.64328322646685,0.005809194043122325,1.5,TPESampler,COMPLETE
1279,0.17261865467173668,2025-04-24 21:31:24.943378,2025-04-24 21:31:28.029532,0 days 00:00:03.086154,1097.6737850678833,Matern,102.68715486572258,0.018757260882174512,1.5,TPESampler,COMPLETE
1280,0.1726184934355994,2025-04-24 21:31:27.659788,2025-04-24 21:31:30.335568,0 days 00:00:02.675780,7230.190256843497,Matern,186.21749672158657,0.004863308474220901,1.5,TPESampler,COMPLETE
1281,0.17261861601447276,2025-04-24 21:31:28.271195,2025-04-24 21:31:32.696647,0 days 00:00:04.425452,83717.5831165039,Matern,52675.13332687627,0.79788590198554,1.5,TPESampler,COMPLETE
1282,1.3307518540987953,2025-04-24 21:31:28.490611,2025-04-24 21:31:34.080808,0 days 00:00:05.590197,2.0270569217286854e-06,RBF,82.08476115363479,1.541367278456254e-10,0.5,TPESampler,COMPLETE
1283,0.17261854953057054,2025-04-24 21:31:30.585677,2025-04-24 21:31:35.133780,0 days 00:00:04.548103,35.70970159032126,Matern,8898.405461320328,0.750047884469999,1.5,TPESampler,COMPLETE
1284,1.3307518540987966,2025-04-24 21:31:32.907554,2025-04-24 21:31:38.207626,0 days 00:00:05.300072,22.69140343145735,Matern,4450.68040824004,0.0006479824969898134,1.5,TPESampler,COMPLETE
1285,0.17261806409960026,2025-04-24 21:31:34.342829,2025-04-24 21:31:40.045271,0 days 00:00:05.702442,34.994266472812484,Matern,73756.90938206998,0.08567795720014908,1.5,TPESampler,COMPLETE
1286,0.17261825115754675,2025-04-24 21:31:35.378594,2025-04-24 21:31:38.879355,0 days 00:00:03.500761,3932.4376769334576,Matern,327.35581329542606,0.036292748511570945,1.5,TPESampler,COMPLETE
1287,0.17261852247969905,2025-04-24 21:31:38.457537,2025-04-24 21:31:41.925023,0 days 00:00:03.467486,65980.15178463217,Matern,8.23315918129054,0.014502137373172788,1.5,TPESampler,COMPLETE
1288,0.17261815616340034,2025-04-24 21:31:39.098709,2025-04-24 21:31:44.073018,0 days 00:00:04.974309,361.12742675506087,Matern,685.9898505038366,0.0016053535904477633,1.5,TPESampler,COMPLETE
1289,0.17261859803257393,2025-04-24 21:31:40.288486,2025-04-24 21:31:43.582137,0 days 00:00:03.293651,2661.1419883046638,Matern,1945.7140360214507,0.9713793339572199,1.5,TPESampler,COMPLETE
1290,0.27419011868331544,2025-04-24 21:31:42.142555,2025-04-24 21:31:45.545004,0 days 00:00:03.402449,649.6072539886147,Matern,724.7944518222984,0.0005227129621464909,0.5,TPESampler,COMPLETE
1291,0.17261802362244408,2025-04-24 21:31:43.820984,2025-04-24 21:31:47.771380,0 days 00:00:03.950396,3438.756170063966,Matern,31.574681594553212,0.0015439109970581493,1.5,TPESampler,COMPLETE
1292,0.1726199049575847,2025-04-24 21:31:44.326751,2025-04-24 21:31:48.677185,0 days 00:00:04.350434,15554.489213772662,Matern,18.88208923393011,0.6128061417950222,1.5,TPESampler,COMPLETE
1293,0.17261728881929192,2025-04-24 21:31:45.762010,2025-04-24 21:31:49.357438,0 days 00:00:03.595428,841.1275834625103,Matern,677.6790267613358,0.0016596493328105023,1.5,TPESampler,COMPLETE
1294,0.1726194293745569,2025-04-24 21:31:48.003416,2025-04-24 21:31:51.042383,0 days 00:00:03.038967,107.17274397510691,Matern,383.193954791168,0.022367820224652956,1.5,TPESampler,COMPLETE
1295,0.17261810868023267,2025-04-24 21:31:48.901272,2025-04-24 21:31:53.277118,0 days 00:00:04.375846,112.1139399634392,Matern,3194.5469200585235,0.054252885417862697,1.5,TPESampler,COMPLETE
1296,1.3307518540985912,2025-04-24 21:31:49.820532,2025-04-24 21:31:53.939256,0 days 00:00:04.118724,586.9771586309087,Matern,2110.5085804502155,5.1058760996305533e-05,1.5,TPESampler,COMPLETE
1297,1.3307518540988155,2025-04-24 21:31:51.288292,2025-04-24 21:31:55.253445,0 days 00:00:03.965153,71.36468532660963,Matern,10036.401667512753,0.00042004878736257636,1.5,TPESampler,COMPLETE
1298,1.33075185410289,2025-04-24 21:31:53.517146,2025-04-24 21:31:56.767235,0 days 00:00:03.250089,47.06490150430471,Matern,3312.973661681195,0.00020827030995413778,1.5,TPESampler,COMPLETE
1299,0.17261859287122872,2025-04-24 21:31:54.147689,2025-04-24 21:31:57.811511,0 days 00:00:03.663822,361.2087665273255,Matern,540.6772947041367,0.00025589391139280794,1.5,TPESampler,COMPLETE
1300,0.22211466620683257,2025-04-24 21:31:55.486925,2025-04-24 21:32:00.081695,0 days 00:00:04.594770,37.52342599944993,Matern,12358.402286366205,0.6447359198345399,2.5,TPESampler,COMPLETE
1301,1.330751854098777,2025-04-24 21:31:56.984097,2025-04-24 21:32:00.118419,0 days 00:00:03.134322,2253.7795424221576,Matern,3626.822599317929,0.0026373271865544343,1.5,TPESampler,COMPLETE
1302,1.3307518541044412,2025-04-24 21:31:58.049841,2025-04-24 21:32:02.251691,0 days 00:00:04.201850,3046.530834171005,Matern,3031.862584421526,0.00042055802412123216,2.5,TPESampler,COMPLETE
1303,1.330751854098382,2025-04-24 21:32:00.264447,2025-04-24 21:32:03.740743,0 days 00:00:03.476296,344.6704131647887,Matern,1813.6328699736828,0.0022475398844223927,1.5,TPESampler,COMPLETE
1304,1.3307518540986416,2025-04-24 21:32:00.308736,2025-04-24 21:32:04.088412,0 days 00:00:03.779676,15486.591528967901,Matern,9577.722746619187,0.0006009423793855602,1.5,TPESampler,COMPLETE
1305,1.3307518540986503,2025-04-24 21:32:02.466453,2025-04-24 21:32:06.630660,0 days 00:00:04.164207,101.64255011534271,Matern,7128.988269129208,0.0006115323125438001,2.5,TPESampler,COMPLETE
1306,1.3307518540993242,2025-04-24 21:32:03.939265,2025-04-24 21:32:06.159129,0 days 00:00:02.219864,14.997434686119155,RBF,0.0003688947984428638,0.0018914875044848238,0.5,TPESampler,COMPLETE
1307,0.17261852071588918,2025-04-24 21:32:04.339094,2025-04-24 21:32:08.079711,0 days 00:00:03.740617,969.2937089736815,Matern,19.087671996489505,0.0009039949285337366,1.5,TPESampler,COMPLETE
1308,0.17261851992261296,2025-04-24 21:32:06.410124,2025-04-24 21:32:14.026152,0 days 00:00:07.616028,88.56787652932297,Matern,53707.69703056799,0.3522418692526882,1.5,TPESampler,COMPLETE
1309,0.17261853452894194,2025-04-24 21:32:06.857475,2025-04-24 21:32:10.397519,0 days 00:00:03.540044,2204.3199851339555,Matern,1976.425692052185,0.0025069492883540885,1.5,TPESampler,COMPLETE
1310,0.22211467959469958,2025-04-24 21:32:08.339735,2025-04-24 21:32:11.604580,0 days 00:00:03.264845,41554.98742050733,Matern,2469.9210241168585,0.1183606310278382,2.5,TPESampler,COMPLETE
1311,0.2741901056543125,2025-04-24 21:32:10.645423,2025-04-24 21:32:13.752113,0 days 00:00:03.106690,1548.7229890364067,Matern,15.250659262883842,5.582350060305568e-05,0.5,TPESampler,COMPLETE
1312,1.330751854083865,2025-04-24 21:32:11.814785,2025-04-24 21:32:16.972681,0 days 00:00:05.157896,137.4481583720825,Matern,66960.76314745656,0.010191525224516444,1.5,TPESampler,COMPLETE
1313,1.3307518540966121,2025-04-24 21:32:13.966738,2025-04-24 21:32:17.014579,0 days 00:00:03.047841,1389.8590095124246,RBF,1550.3629916029415,0.0014058834926529143,1.5,TPESampler,COMPLETE
1314,0.1726184283253699,2025-04-24 21:32:14.284432,2025-04-24 21:32:17.937110,0 days 00:00:03.652678,159.6181705957873,Matern,2354.2294938931227,0.04886647710397876,1.5,TPESampler,COMPLETE
1315,0.17261856976878318,2025-04-24 21:32:17.126076,2025-04-24 21:32:21.326595,0 days 00:00:04.200519,31.317142413517022,Matern,279.0627667110925,0.0026176681914284626,1.5,TPESampler,COMPLETE
1316,0.2741901045411568,2025-04-24 21:32:17.170029,2025-04-24 21:32:20.562693,0 days 00:00:03.392664,38.99699120530998,Matern,3921.7693039004857,0.017168428319830283,0.5,TPESampler,COMPLETE
1317,0.17261856585146293,2025-04-24 21:32:18.162084,2025-04-24 21:32:21.029999,0 days 00:00:02.867915,51203.17080948686,Matern,3744.1724895446255,0.004587194152923305,1.5,TPESampler,COMPLETE
1318,0.2741901063163823,2025-04-24 21:32:20.765126,2025-04-24 21:32:25.222424,0 days 00:00:04.457298,10149.122423780203,Matern,9025.632237702714,5.39997322709982e-07,0.5,TPESampler,COMPLETE
1319,0.17261850413397065,2025-04-24 21:32:21.258804,2025-04-24 21:32:24.189999,0 days 00:00:02.931195,1092.9163325332197,Matern,1477.6239875298093,0.018915297002320103,1.5,TPESampler,COMPLETE
1320,0.17261852012010695,2025-04-24 21:32:21.560399,2025-04-24 21:32:25.136323,0 days 00:00:03.575924,15847.172749765548,Matern,562.2200099244737,0.7367066526123609,1.5,TPESampler,COMPLETE
1321,1.330751854098804,2025-04-24 21:32:24.429806,2025-04-24 21:32:28.346434,0 days 00:00:03.916628,1577.1527665294743,Matern,1660.510509889768,0.00023564909338685364,1.5,TPESampler,COMPLETE
1322,1.3307518540990007,2025-04-24 21:32:25.345249,2025-04-24 21:32:29.711605,0 days 00:00:04.366356,37.94198729016288,Matern,630.5990067410995,0.00011088896640607241,1.5,TPESampler,COMPLETE
1323,0.17261833146411074,2025-04-24 21:32:25.401732,2025-04-24 21:32:31.553717,0 days 00:00:06.151985,117.56253333944777,Matern,563.7798117049468,0.0190523289366973,1.5,TPESampler,COMPLETE
1324,0.17261858447377584,2025-04-24 21:32:28.567264,2025-04-24 21:32:31.439138,0 days 00:00:02.871874,55495.940300569906,Matern,1837.2421570169859,0.0017868648577559025,1.5,TPESampler,COMPLETE
1325,0.17261831570969843,2025-04-24 21:32:29.925168,2025-04-24 21:32:34.262409,0 days 00:00:04.337241,211.1394613353048,Matern,705.550177889596,0.7941591904320306,1.5,TPESampler,COMPLETE
1326,0.17261856255119562,2025-04-24 21:32:31.631125,2025-04-24 21:32:36.876378,0 days 00:00:05.245253,925.0350254961601,Matern,29.218389147284988,0.0009063903851433269,1.5,TPESampler,COMPLETE
1327,0.1726185142539925,2025-04-24 21:32:31.821336,2025-04-24 21:32:35.214288,0 days 00:00:03.392952,139.18433027658187,Matern,207.76893778954351,0.0005633411575884586,1.5,TPESampler,COMPLETE
1328,0.1726191704727357,2025-04-24 21:32:34.497231,2025-04-24 21:32:39.973937,0 days 00:00:05.476706,4383.154876703195,Matern,389.8405314631732,0.062232895810117414,1.5,TPESampler,COMPLETE
1329,0.17261723591395725,2025-04-24 21:32:35.445963,2025-04-24 21:32:44.334875,0 days 00:00:08.888912,77.46916294024436,Matern,8890.712508034087,0.9383705309468888,1.5,TPESampler,COMPLETE
1330,1.3307518540987917,2025-04-24 21:32:37.096791,2025-04-24 21:32:41.943964,0 days 00:00:04.847173,104.51560069270296,Matern,59183.922208484786,0.0582712766904738,1.5,TPESampler,COMPLETE
1331,0.17261861442763915,2025-04-24 21:32:40.183561,2025-04-24 21:32:43.510850,0 days 00:00:03.327289,2029.3314410358762,Matern,8.731028411650247,0.0017662996702503529,1.5,TPESampler,COMPLETE
1332,0.1726185592273028,2025-04-24 21:32:42.148279,2025-04-24 21:32:45.174784,0 days 00:00:03.026505,75038.535501911,Matern,215.945492546698,0.003377783364143436,1.5,TPESampler,COMPLETE
1333,0.1726184864898003,2025-04-24 21:32:43.726130,2025-04-24 21:32:50.523504,0 days 00:00:06.797374,161.44562658467117,Matern,431.93760062941953,0.0022471258445705307,1.5,TPESampler,COMPLETE
1334,1.330751854098821,2025-04-24 21:32:44.575044,2025-04-24 21:32:49.675719,0 days 00:00:05.100675,0.0002930975913538969,RBF,65.37411653584354,8.758419817513262e-10,2.5,TPESampler,COMPLETE
1335,0.17261858236671976,2025-04-24 21:32:45.411411,2025-04-24 21:32:48.521655,0 days 00:00:03.110244,2377.095989113953,Matern,3249.7175876990236,0.22751680749597852,1.5,TPESampler,COMPLETE
1336,0.17261855672792184,2025-04-24 21:32:48.730924,2025-04-24 21:32:52.538077,0 days 00:00:03.807153,51.81217420853844,Matern,1842.1599764569826,0.037553127508726206,1.5,TPESampler,COMPLETE
1337,1.3677560014521952,2025-04-24 21:32:49.879939,2025-04-24 21:32:52.617501,0 days 00:00:02.737562,2.5504180575541884e-07,RBF,0.09828884205686629,0.2501092345476134,0.5,TPESampler,COMPLETE
1338,1.3677568527822581,2025-04-24 21:32:50.854003,2025-04-24 21:32:54.890197,0 days 00:00:04.036194,19.482209945502408,Matern,34742.19155070228,0.42779373658802317,1.5,TPESampler,COMPLETE
1339,0.17261848919006226,2025-04-24 21:32:52.696072,2025-04-24 21:32:57.039290,0 days 00:00:04.343218,619.8855969601954,Matern,273.3075020639276,0.4949298127749255,1.5,TPESampler,COMPLETE
1340,0.17261862920711277,2025-04-24 21:32:52.825053,2025-04-24 21:32:59.486446,0 days 00:00:06.661393,697.0101576762668,Matern,58481.29998679012,0.11898758141159134,1.5,TPESampler,COMPLETE
1341,0.17261807798125187,2025-04-24 21:32:55.126330,2025-04-24 21:32:59.008413,0 days 00:00:03.882083,2666.898275387506,Matern,17960.57074912155,0.19606236524616513,1.5,TPESampler,COMPLETE
1342,1.3677569514710943,2025-04-24 21:32:57.274689,2025-04-24 21:33:00.502146,0 days 00:00:03.227457,4.160282248836295e-05,RBF,12715.538174708405,0.7986353308890499,2.5,TPESampler,COMPLETE
1343,0.1726184304002484,2025-04-24 21:32:59.226574,2025-04-24 21:33:02.795797,0 days 00:00:03.569223,1397.2549479609045,Matern,5359.5219290663035,0.8757726788437159,1.5,TPESampler,COMPLETE
1344,0.1726185301751772,2025-04-24 21:32:59.750834,2025-04-24 21:33:04.204898,0 days 00:00:04.454064,78.55337495057367,Matern,12845.560842032006,0.31330557232592865,1.5,TPESampler,COMPLETE
1345,0.1726185503016217,2025-04-24 21:33:00.704210,2025-04-24 21:33:05.707635,0 days 00:00:05.003425,254.39016232130675,Matern,17073.773672733052,0.9031278881026725,1.5,TPESampler,COMPLETE
1346,0.27419009770027536,2025-04-24 21:33:03.029874,2025-04-24 21:33:06.701299,0 days 00:00:03.671425,984.1340548690976,Matern,131.37777271649753,0.07255596236187731,0.5,TPESampler,COMPLETE
1347,0.1726185287603161,2025-04-24 21:33:04.446475,2025-04-24 21:33:07.949184,0 days 00:00:03.502709,220.59723536343625,Matern,1005.7807749942855,0.7772381713990582,1.5,TPESampler,COMPLETE
1348,1.3677566543883068,2025-04-24 21:33:05.911560,2025-04-24 21:33:09.416613,0 days 00:00:03.505053,118.65619498008678,Matern,73055.28137497262,0.9273711240799251,1.5,TPESampler,COMPLETE
1349,1.3307518540978616,2025-04-24 21:33:06.931824,2025-04-24 21:33:10.740966,0 days 00:00:03.809142,74813.96341861456,Matern,90226.77119723256,0.0008039924319971015,1.5,TPESampler,COMPLETE
1350,1.3307518540987817,2025-04-24 21:33:08.190152,2025-04-24 21:33:13.394967,0 days 00:00:05.204815,50.30610844692352,Matern,74134.71446302318,0.0026892401489890714,1.5,TPESampler,COMPLETE
1351,0.1726179595670619,2025-04-24 21:33:09.637786,2025-04-24 21:33:14.090421,0 days 00:00:04.452635,161.1166518103205,Matern,1638.6353393216918,0.06599729990306365,1.5,TPESampler,COMPLETE
1352,0.17261854854646447,2025-04-24 21:33:10.985579,2025-04-24 21:33:14.442641,0 days 00:00:03.457062,160.15235204628348,Matern,1627.4898039772825,0.7827556977877358,1.5,TPESampler,COMPLETE
1353,0.17261856251422755,2025-04-24 21:33:13.630653,2025-04-24 21:33:17.487903,0 days 00:00:03.857250,15.688741728774648,Matern,878.6679116870981,0.013092562835048097,1.5,TPESampler,COMPLETE
1354,0.2106450194974868,2025-04-24 21:33:14.371692,2025-04-24 21:33:17.896895,0 days 00:00:03.525203,515.5883348767088,RBF,3945.620538815629,0.9967297060765343,1.5,TPESampler,COMPLETE
1355,0.1726185674362285,2025-04-24 21:33:14.730374,2025-04-24 21:33:18.542510,0 days 00:00:03.812136,1421.517567726881,Matern,46.0462909579208,0.13681670862733494,1.5,TPESampler,COMPLETE
1356,0.17261832139228112,2025-04-24 21:33:17.726793,2025-04-24 21:33:25.590178,0 days 00:00:07.863385,36.30765510832909,Matern,2258.2113941717616,0.04296388150598659,1.5,TPESampler,COMPLETE
1357,0.17261855538432685,2025-04-24 21:33:18.115195,2025-04-24 21:33:21.353089,0 days 00:00:03.237894,1282.1816885477258,Matern,623.5086040424269,0.008295594979029552,1.5,TPESampler,COMPLETE
1358,1.3677569516659656,2025-04-24 21:33:18.751375,2025-04-24 21:33:22.680439,0 days 00:00:03.929064,0.44063288779635446,Matern,81455.07670678342,0.19134541357647517,1.5,TPESampler,COMPLETE
1359,0.17261852137496267,2025-04-24 21:33:21.568029,2025-04-24 21:33:24.933865,0 days 00:00:03.365836,68144.37763378967,Matern,1613.0968733923846,0.10371653179419908,1.5,TPESampler,COMPLETE
1360,1.3307518540988355,2025-04-24 21:33:22.909004,2025-04-24 21:33:27.545173,0 days 00:00:04.636169,161.21426022332062,Matern,460.8275012708037,8.245203734339869e-06,1.5,TPESampler,COMPLETE
1361,0.17261850350643992,2025-04-24 21:33:25.156650,2025-04-24 21:33:30.201049,0 days 00:00:05.044399,10673.261025765338,Matern,1423.2636055916491,0.9365199632895087,1.5,TPESampler,COMPLETE
1362,0.172618549886243,2025-04-24 21:33:25.793389,2025-04-24 21:33:28.883867,0 days 00:00:03.090478,1125.2476681355683,Matern,217.93963778192767,0.0004143326924154464,1.5,TPESampler,COMPLETE
1363,0.1726189032150762,2025-04-24 21:33:27.791692,2025-04-24 21:33:33.125845,0 days 00:00:05.334153,14.010654383557469,Matern,78194.60319407894,0.0338153678613274,1.5,TPESampler,COMPLETE
1364,0.2221146912668834,2025-04-24 21:33:29.128683,2025-04-24 21:33:31.793713,0 days 00:00:02.665030,121.84047985948372,Matern,24.389442989373123,0.0005254334092999459,2.5,TPESampler,COMPLETE
1365,0.17261845174731028,2025-04-24 21:33:30.433414,2025-04-24 21:33:33.575736,0 days 00:00:03.142322,514.0434720015297,Matern,38.792644665541296,0.037188364142567466,1.5,TPESampler,COMPLETE
1366,1.3307518540986742,2025-04-24 21:33:32.015944,2025-04-24 21:33:36.019985,0 days 00:00:04.004041,37.675761212460635,Matern,371.31570138921455,0.000620997995831262,1.5,TPESampler,COMPLETE
1367,1.3307518540990606,2025-04-24 21:33:33.341016,2025-04-24 21:33:37.248050,0 days 00:00:03.907034,1858.8529719198914,Matern,54108.19790154941,0.0037308798801115512,1.5,TPESampler,COMPLETE
1368,1.3677569159914285,2025-04-24 21:33:33.831656,2025-04-24 21:33:39.105478,0 days 00:00:05.273822,1.2411098716364332e-07,RBF,1.2627190916265782,0.00012233370083078536,0.5,TPESampler,COMPLETE
1369,0.17261855473039825,2025-04-24 21:33:36.228817,2025-04-24 21:33:46.534779,0 days 00:00:10.305962,5.310478133252686e-05,Matern,0.33942957248686545,0.012568227108723788,1.5,TPESampler,COMPLETE
1370,0.1726185471715586,2025-04-24 21:33:37.458775,2025-04-24 21:33:41.034804,0 days 00:00:03.576029,61116.864690375594,Matern,29.72327531235922,0.0035155268599260216,1.5,TPESampler,COMPLETE
1371,1.367756941571023,2025-04-24 21:33:39.315545,2025-04-24 21:33:43.779709,0 days 00:00:04.464164,1.2549878387005412e-07,Matern,3.667944324595973,0.0018076134644446555,1.5,TPESampler,COMPLETE
1372,0.17261916159375876,2025-04-24 21:33:41.256156,2025-04-24 21:33:47.023482,0 days 00:00:05.767326,13049.031983796218,Matern,29.555437726355397,0.7975579104278779,1.5,TPESampler,COMPLETE
1373,0.17261860997096393,2025-04-24 21:33:43.986867,2025-04-24 21:33:47.268489,0 days 00:00:03.281622,2354.643112776894,Matern,1835.7536309730094,0.03371596211770979,1.5,TPESampler,COMPLETE
1374,0.17261850675743295,2025-04-24 21:33:46.761815,2025-04-24 21:33:49.956600,0 days 00:00:03.194785,286.1787479809092,Matern,146.39008978919344,0.049827221279962,1.5,TPESampler,COMPLETE
