number,value,datetime_start,datetime_complete,duration,params_constant_value,params_kernel_type,params_length_scale,params_noise_level,params_nu,system_attrs_auto:sampler,state
1375,1.3307518541069836,2025-04-24 21:33:47.273860,2025-04-24 21:33:52.029795,0 days 00:00:04.755935,26.418419219643688,Matern,48832.19396397839,0.029647854267665273,2.5,TPESampler,COMPLETE
1376,1.3307518540988263,2025-04-24 21:33:47.472736,2025-04-24 21:33:53.321816,0 days 00:00:05.849080,1447.4747860141858,Matern,84021.8253396278,0.042760281260069505,1.5,TPESampler,COMPLETE
1377,0.17261835015678398,2025-04-24 21:33:50.166078,2025-04-24 21:33:55.340896,0 days 00:00:05.174818,30.1167145302314,Matern,1962.0641497006263,0.02546104649864742,1.5,TPESampler,COMPLETE
1378,1.3677569516246044,2025-04-24 21:33:52.269979,2025-04-24 21:33:56.008104,0 days 00:00:03.738125,37.18919397560852,Matern,92858.24107941704,0.8717069400459859,1.5,TPESampler,COMPLETE
1379,0.17261859874950394,2025-04-24 21:33:53.546706,2025-04-24 21:33:56.771393,0 days 00:00:03.224687,1553.4333257848234,Matern,24.74235953537786,0.004980354268982742,1.5,TPESampler,COMPLETE
1380,1.3307516872740468,2025-04-24 21:33:55.563320,2025-04-24 21:33:58.775380,0 days 00:00:03.212060,52173.456666425824,Matern,0.09522330556498454,0.3816346763744765,1.5,TPESampler,COMPLETE
1381,0.17261829703349973,2025-04-24 21:33:56.246139,2025-04-24 21:33:59.429927,0 days 00:00:03.183788,862.7642610236845,Matern,1625.00797630306,0.017829081683915848,1.5,TPESampler,COMPLETE
1382,0.2741899201428214,2025-04-24 21:33:57.003740,2025-04-24 21:34:00.787113,0 days 00:00:03.783373,39449.355920126865,Matern,976.6040723608263,0.00030062057290849894,0.5,TPESampler,COMPLETE
1383,0.17261751985420795,2025-04-24 21:33:59.003429,2025-04-24 21:34:02.358275,0 days 00:00:03.354846,98.81078831917989,Matern,159.92908705203732,0.9709067396101312,1.5,TPESampler,COMPLETE
1384,0.17261840580774576,2025-04-24 21:33:59.663551,2025-04-24 21:34:03.860893,0 days 00:00:04.197342,32.87891500343098,Matern,894.3215032947343,0.45942115838721653,1.5,TPESampler,COMPLETE
1385,0.1726187865157582,2025-04-24 21:34:01.012257,2025-04-24 21:34:06.594896,0 days 00:00:05.582639,66896.61895040335,Matern,2008.799622741877,0.05206094330939628,1.5,TPESampler,COMPLETE
1386,1.3307518540985392,2025-04-24 21:34:02.601610,2025-04-24 21:34:06.226521,0 days 00:00:03.624911,973.8953891845936,Matern,4489.734740561746,0.0009870351368120541,1.5,TPESampler,COMPLETE
1387,0.1726184128144864,2025-04-24 21:34:04.109733,2025-04-24 21:34:07.837075,0 days 00:00:03.727342,654.9800687889127,Matern,10.157638583351376,0.0009071947711298427,1.5,TPESampler,COMPLETE
1388,0.2741901062349392,2025-04-24 21:34:06.492238,2025-04-24 21:34:09.737521,0 days 00:00:03.245283,319.1190499172373,Matern,5855.641877609154,0.29976971832166815,0.5,TPESampler,COMPLETE
1389,0.17261880536691,2025-04-24 21:34:06.802303,2025-04-24 21:34:14.997616,0 days 00:00:08.195313,14.521655742020656,Matern,2080.9843575146556,0.8595696013593467,1.5,TPESampler,COMPLETE
1390,0.17261854791887063,2025-04-24 21:34:08.077175,2025-04-24 21:34:12.710710,0 days 00:00:04.633535,1891.5496100472985,Matern,206.32949199728637,0.00013535681908013276,1.5,TPESampler,COMPLETE
1391,0.17261855164415496,2025-04-24 21:34:09.952959,2025-04-24 21:34:13.092664,0 days 00:00:03.139705,997.2364212949961,Matern,89.54997310769643,0.013677411770401394,1.5,TPESampler,COMPLETE
1392,1.330751854099524,2025-04-24 21:34:12.958975,2025-04-24 21:34:16.939621,0 days 00:00:03.980646,25.10676254653217,Matern,270.1264402368116,0.0008324917497058896,1.5,TPESampler,COMPLETE
1393,0.17261852390262533,2025-04-24 21:34:13.322415,2025-04-24 21:34:16.460968,0 days 00:00:03.138553,73919.75592792517,Matern,57.59051775104309,0.041406598209875405,1.5,TPESampler,COMPLETE
1394,0.17261689143548184,2025-04-24 21:34:15.242324,2025-04-24 21:34:20.324651,0 days 00:00:05.082327,4552.868588385479,Matern,1701.290222160715,0.0005255192927288775,1.5,TPESampler,COMPLETE
1395,0.17261958386931203,2025-04-24 21:34:16.700215,2025-04-24 21:34:20.499497,0 days 00:00:03.799282,844.8274355983892,Matern,24.75718572854021,0.0380723339679659,1.5,TPESampler,COMPLETE
1396,0.1726185189451707,2025-04-24 21:34:17.159894,2025-04-24 21:34:24.156092,0 days 00:00:06.996198,41024.43540082116,Matern,377.85183538365425,0.7442268579581562,1.5,TPESampler,COMPLETE
1397,1.3307518541036722,2025-04-24 21:34:20.515846,2025-04-24 21:34:24.042707,0 days 00:00:03.526861,286.9718691371091,RBF,11.863109398553863,4.659994809345941e-08,1.5,TPESampler,COMPLETE
1398,1.330751854098798,2025-04-24 21:34:20.722231,2025-04-24 21:34:23.586195,0 days 00:00:02.863964,188.57209302141192,RBF,450.13954079556976,0.002210517186821512,1.5,TPESampler,COMPLETE
1399,1.330751854114135,2025-04-24 21:34:23.796022,2025-04-24 21:34:27.380923,0 days 00:00:03.584901,31870.56808569078,Matern,7904.065350230125,0.00023451994647565957,1.5,TPESampler,COMPLETE
1400,1.3307518540987258,2025-04-24 21:34:24.348496,2025-04-24 21:34:27.855043,0 days 00:00:03.506547,506.9814801313868,Matern,1693.9717510929138,3.173803473289486e-05,1.5,TPESampler,COMPLETE
1401,1.3307518540977616,2025-04-24 21:34:24.398065,2025-04-24 21:34:28.772971,0 days 00:00:04.374906,328.6780657801349,Matern,3882.0064359269304,3.0635779335516606e-05,1.5,TPESampler,COMPLETE
1402,1.3307518540979795,2025-04-24 21:34:27.605100,2025-04-24 21:34:33.525883,0 days 00:00:05.920783,0.0020351911347498753,RBF,26500.29827563139,4.344577067341322e-06,1.5,TPESampler,COMPLETE
1403,0.17261861908403975,2025-04-24 21:34:28.068555,2025-04-24 21:34:32.217971,0 days 00:00:04.149416,92008.91572639509,Matern,1398.5550062143914,2.2338513232431833e-05,1.5,TPESampler,COMPLETE
1404,0.17261996022573736,2025-04-24 21:34:29.011826,2025-04-24 21:34:36.137137,0 days 00:00:07.125311,11577.426246371213,Matern,3110.37253198678,0.0010461057805626643,1.5,TPESampler,COMPLETE
1405,0.36323560178838415,2025-04-24 21:34:32.430465,2025-04-24 21:34:39.308657,0 days 00:00:06.878192,5.689925479670508e-07,RBF,348.6491558937807,0.0034084295322608016,1.5,TPESampler,COMPLETE
1406,1.330751854098808,2025-04-24 21:34:33.764211,2025-04-24 21:34:44.569691,0 days 00:00:10.805480,8.618870003285692e-07,Matern,8600.263097085252,5.541392231289346e-07,0.5,TPESampler,COMPLETE
1407,0.1726185653538924,2025-04-24 21:34:36.340972,2025-04-24 21:34:39.884855,0 days 00:00:03.543883,1145.268901626265,Matern,482.1265469355392,0.0002051397572600201,1.5,TPESampler,COMPLETE
1408,1.3307518540964964,2025-04-24 21:34:39.526143,2025-04-24 21:34:43.930071,0 days 00:00:04.403928,1379.1536353889335,Matern,12043.716279738672,0.0011527821176589522,1.5,TPESampler,COMPLETE
1409,0.17261859718443556,2025-04-24 21:34:40.116419,2025-04-24 21:34:43.609263,0 days 00:00:03.492844,12320.050928202174,Matern,1713.6256178296287,0.00019209843248592557,1.5,TPESampler,COMPLETE
1410,0.17261893779388496,2025-04-24 21:34:43.835745,2025-04-24 21:34:48.191552,0 days 00:00:04.355807,1930.0336958604387,Matern,1222.7155838596793,0.00039326419325705575,1.5,TPESampler,COMPLETE
1411,0.1726176802051228,2025-04-24 21:34:44.202870,2025-04-24 21:34:48.182854,0 days 00:00:03.979984,186.88569212961974,Matern,12.862220284830578,0.0009503718113045935,1.5,TPESampler,COMPLETE
1412,1.3307518540931953,2025-04-24 21:34:44.812930,2025-04-24 21:34:48.963413,0 days 00:00:04.150483,1045.9943784840502,Matern,1595.474485355695,4.333636232620655e-05,1.5,TPESampler,COMPLETE
1413,1.3307518540894931,2025-04-24 21:34:48.357709,2025-04-24 21:34:52.820956,0 days 00:00:04.463247,827.1946177304764,Matern,28648.379448154363,8.88320593090365e-06,1.5,TPESampler,COMPLETE
1414,0.17261855230983372,2025-04-24 21:34:48.406140,2025-04-24 21:34:52.572803,0 days 00:00:04.166663,262.0736714570597,Matern,77.17076630517056,9.302846273774206e-06,1.5,TPESampler,COMPLETE
1415,1.3307518541013394,2025-04-24 21:34:49.251325,2025-04-24 21:34:52.717742,0 days 00:00:03.466417,53.34659364147395,Matern,3972.5871802040465,0.011144176327816968,1.5,TPESampler,COMPLETE
1416,0.17261855339180032,2025-04-24 21:34:52.768196,2025-04-24 21:34:56.785317,0 days 00:00:04.017121,75771.38601267849,Matern,12.945888310741973,0.0015919794827334713,1.5,TPESampler,COMPLETE
1417,0.1726186265806145,2025-04-24 21:34:52.976131,2025-04-24 21:34:55.997609,0 days 00:00:03.021478,97632.98790743161,Matern,5649.680067388724,0.8707406365631188,1.5,TPESampler,COMPLETE
1418,1.3307518540965106,2025-04-24 21:34:53.150671,2025-04-24 21:34:56.810196,0 days 00:00:03.659525,0.216236840244352,RBF,0.0008477313806716909,0.03173943830546384,1.5,TPESampler,COMPLETE
1419,1.3677560057806826,2025-04-24 21:34:56.232727,2025-04-24 21:34:59.030233,0 days 00:00:02.797506,98543.90856731789,Matern,0.00039061734098747085,3.215818902662095e-08,0.5,TPESampler,COMPLETE
1420,1.3307518541051304,2025-04-24 21:34:57.032072,2025-04-24 21:35:01.571814,0 days 00:00:04.539742,150.34361166408027,RBF,155.57067864098846,4.613336313327226e-05,1.5,TPESampler,COMPLETE
1421,1.3307518540972068,2025-04-24 21:34:57.081010,2025-04-24 21:35:01.519312,0 days 00:00:04.438302,50.52150574432955,Matern,2556.7601382165576,0.002349057086721718,1.5,TPESampler,COMPLETE
1422,0.17261932844892816,2025-04-24 21:34:59.250794,2025-04-24 21:35:03.283160,0 days 00:00:04.032366,835.1073288720548,Matern,65.44234104557405,0.0008754019850657554,1.5,TPESampler,COMPLETE
1423,0.17261924411262553,2025-04-24 21:35:01.669596,2025-04-24 21:35:15.657357,0 days 00:00:13.987761,2.0085920329750233,Matern,8299.225142273306,0.8851231081482824,1.5,TPESampler,COMPLETE
1424,0.17261852115632204,2025-04-24 21:35:01.759667,2025-04-24 21:35:07.271114,0 days 00:00:05.511447,413.41713509646047,Matern,4.532543952223109,0.03664716370195929,1.5,TPESampler,COMPLETE
1425,1.330751854098628,2025-04-24 21:35:03.507818,2025-04-24 21:35:07.548559,0 days 00:00:04.040741,7.180060809538874,Matern,116.23054067627127,0.0003009516663996358,1.5,TPESampler,COMPLETE
1426,1.330751854098735,2025-04-24 21:35:07.485332,2025-04-24 21:35:11.490078,0 days 00:00:04.004746,683.9900251420553,Matern,8557.567065881096,0.004693899453509545,1.5,TPESampler,COMPLETE
1427,0.172617920568224,2025-04-24 21:35:07.821216,2025-04-24 21:35:12.069972,0 days 00:00:04.248756,71.41613596913064,Matern,279.8363137838617,0.006632581018532956,1.5,TPESampler,COMPLETE
1428,0.17261854880709665,2025-04-24 21:35:11.698966,2025-04-24 21:35:14.797975,0 days 00:00:03.099009,18847.764434159242,Matern,1117.042695755104,0.001125110908648097,1.5,TPESampler,COMPLETE
1429,0.17261854638656357,2025-04-24 21:35:12.285530,2025-04-24 21:35:15.500215,0 days 00:00:03.214685,3898.581013943652,Matern,58.80511332199207,0.001403479152883686,1.5,TPESampler,COMPLETE
1430,1.3307518541006518,2025-04-24 21:35:15.043138,2025-04-24 21:35:19.046274,0 days 00:00:04.003136,993.6487312042476,Matern,47101.95771803933,0.0005708313404823896,1.5,TPESampler,COMPLETE
1431,0.17261863991649776,2025-04-24 21:35:15.708461,2025-04-24 21:35:19.320766,0 days 00:00:03.612305,827.3656893704906,Matern,1.3499763625555727,0.04893514356971888,1.5,TPESampler,COMPLETE
1432,0.17261868075639222,2025-04-24 21:35:15.908419,2025-04-24 21:35:19.564430,0 days 00:00:03.656011,37510.8409482984,Matern,276.75026017819107,0.001882454878671901,1.5,TPESampler,COMPLETE
1433,0.17261859681638164,2025-04-24 21:35:19.266959,2025-04-24 21:35:27.355173,0 days 00:00:08.088214,26.707341653797304,Matern,7288.613668601943,0.6249197628743923,1.5,TPESampler,COMPLETE
1434,0.17261851728302988,2025-04-24 21:35:19.630648,2025-04-24 21:35:24.398502,0 days 00:00:04.767854,88770.6659702466,Matern,3918.9643226918247,0.001557375616540644,1.5,TPESampler,COMPLETE
1435,0.17261831308263248,2025-04-24 21:35:19.904627,2025-04-24 21:35:25.549012,0 days 00:00:05.644385,93.10576549589395,Matern,474.7420408281172,0.8280772798237681,1.5,TPESampler,COMPLETE
1436,0.17261849034262186,2025-04-24 21:35:24.623843,2025-04-24 21:35:31.054160,0 days 00:00:06.430317,150.620883925771,Matern,768.8749852796078,0.006118809118123685,1.5,TPESampler,COMPLETE
1437,1.330751854097596,2025-04-24 21:35:25.785518,2025-04-24 21:35:29.323224,0 days 00:00:03.537706,20.644384689612867,Matern,2479.3703686398535,0.01321168270552794,1.5,TPESampler,COMPLETE
1438,1.330751854099384,2025-04-24 21:35:27.606094,2025-04-24 21:35:32.245120,0 days 00:00:04.639026,1398.9954157668756,Matern,90852.65943694965,0.00012940010842766263,1.5,TPESampler,COMPLETE
1439,0.17261855294077946,2025-04-24 21:35:29.553667,2025-04-24 21:35:34.028333,0 days 00:00:04.474666,2403.561308660729,Matern,99414.72908718731,0.10309604647118699,1.5,TPESampler,COMPLETE
1440,0.22211447604930687,2025-04-24 21:35:31.522597,2025-04-24 21:35:34.699188,0 days 00:00:03.176591,372.0666589089392,Matern,49.403335554689875,0.008258740277578351,2.5,TPESampler,COMPLETE
1441,0.21064470038406266,2025-04-24 21:35:32.671113,2025-04-24 21:35:39.924433,0 days 00:00:07.253320,17.836677675193307,RBF,16077.469936813728,0.21398503030520466,1.5,TPESampler,COMPLETE
1442,0.17261854694719586,2025-04-24 21:35:34.225343,2025-04-24 21:35:36.985192,0 days 00:00:02.759849,312.7551417661544,Matern,404.82565907825654,0.04638685087492248,1.5,TPESampler,COMPLETE
1443,0.17261845980050788,2025-04-24 21:35:34.931688,2025-04-24 21:35:38.036574,0 days 00:00:03.104886,85.13465613609839,Matern,48.511713621153234,0.00017602294813078367,1.5,TPESampler,COMPLETE
1444,1.3307518540980066,2025-04-24 21:35:37.199047,2025-04-24 21:35:42.259613,0 days 00:00:05.060566,9.989863007483391,Matern,62811.671881315364,0.0047793106861048215,1.5,TPESampler,COMPLETE
1445,0.17261878706876702,2025-04-24 21:35:38.265445,2025-04-24 21:35:41.620424,0 days 00:00:03.354979,1810.65295294551,Matern,885.4861506626002,0.0020918323121439614,1.5,TPESampler,COMPLETE
1446,0.1726185007869569,2025-04-24 21:35:40.182723,2025-04-24 21:35:43.276509,0 days 00:00:03.093786,805.134021204242,Matern,1254.141222450369,0.021438757717354394,1.5,TPESampler,COMPLETE
1447,1.3677569516530559,2025-04-24 21:35:41.839795,2025-04-24 21:35:45.733922,0 days 00:00:03.894127,9.570231659564945e-05,RBF,34502.16084960087,0.04352921884586771,0.5,TPESampler,COMPLETE
1448,0.17261870252547853,2025-04-24 21:35:42.501835,2025-04-24 21:35:46.147709,0 days 00:00:03.645874,112.68239458510331,Matern,3.0971484704232983,0.0028352376317565746,1.5,TPESampler,COMPLETE
1449,0.1726187838306877,2025-04-24 21:35:43.493897,2025-04-24 21:35:49.481544,0 days 00:00:05.987647,430.567743302108,Matern,7.340992019603939,0.13826619311270208,1.5,TPESampler,COMPLETE
1450,0.17261855693251676,2025-04-24 21:35:45.980164,2025-04-24 21:35:49.223076,0 days 00:00:03.242912,7882.6884342229405,Matern,505.4943306269964,2.0070964418599833e-05,1.5,TPESampler,COMPLETE
1451,0.17261821501530325,2025-04-24 21:35:46.366227,2025-04-24 21:35:52.216705,0 days 00:00:05.850478,73307.76579768579,Matern,2052.564604025562,0.0048562829960316104,1.5,TPESampler,COMPLETE
1452,1.3307518540986054,2025-04-24 21:35:49.429784,2025-04-24 21:35:54.081520,0 days 00:00:04.651736,0.5748556533406824,Matern,6725.569733155391,8.48352664842694e-06,1.5,TPESampler,COMPLETE
1453,0.17261873611836667,2025-04-24 21:35:49.661309,2025-04-24 21:35:52.957824,0 days 00:00:03.296515,2693.763273063732,Matern,71.78884617279029,0.0005035201879182286,1.5,TPESampler,COMPLETE
1454,0.17261862708512374,2025-04-24 21:35:52.465174,2025-04-24 21:35:59.342469,0 days 00:00:06.877295,59493.06393034191,Matern,0.893512802149944,0.09465769477450577,1.5,TPESampler,COMPLETE
1455,0.17261855373168747,2025-04-24 21:35:53.243408,2025-04-24 21:35:56.891189,0 days 00:00:03.647781,1498.1215283371248,Matern,145.4453283141533,0.03160624888541819,1.5,TPESampler,COMPLETE
1456,0.17261786315958552,2025-04-24 21:35:54.322057,2025-04-24 21:36:01.147375,0 days 00:00:06.825318,468.56399881003193,Matern,649.9174456293308,0.665398587586009,1.5,TPESampler,COMPLETE
1457,0.17261869105876976,2025-04-24 21:35:57.115890,2025-04-24 21:36:00.467717,0 days 00:00:03.351827,27.90359975535265,Matern,45.86149661357205,0.008263080141662073,1.5,TPESampler,COMPLETE
1458,1.3307518540985697,2025-04-24 21:35:59.588163,2025-04-24 21:36:04.248952,0 days 00:00:04.660789,0.001333060862716495,Matern,75.44796475855136,1.0852654827314523e-10,1.5,TPESampler,COMPLETE
1459,0.17261733988136602,2025-04-24 21:36:00.664305,2025-04-24 21:36:06.542012,0 days 00:00:05.877707,2.2715310992270658e-05,Matern,0.10075351571979085,4.662712516559263e-10,1.5,TPESampler,COMPLETE
1460,1.3307518540986247,2025-04-24 21:36:01.398437,2025-04-24 21:36:05.467785,0 days 00:00:04.069348,10.664537424512345,Matern,895.3587431218671,0.005101829698108802,1.5,TPESampler,COMPLETE
1461,0.17261784081563936,2025-04-24 21:36:04.490711,2025-04-24 21:36:13.164563,0 days 00:00:08.673852,74494.95125786577,Matern,9.182989234858596,0.0014778383003027837,1.5,TPESampler,COMPLETE
1462,0.1726185599814934,2025-04-24 21:36:05.706599,2025-04-24 21:36:09.899719,0 days 00:00:04.193120,625.3919739751577,Matern,1564.98765971319,0.8996237975960225,1.5,TPESampler,COMPLETE
1463,1.3307518541024659,2025-04-24 21:36:06.808818,2025-04-24 21:36:12.490597,0 days 00:00:05.681779,1.9615007482232157e-05,Matern,0.030263006278425594,7.907491952452679e-10,1.5,TPESampler,COMPLETE
1464,1.3307518540995762,2025-04-24 21:36:10.244211,2025-04-24 21:36:15.882275,0 days 00:00:05.638064,5.447057251727785,Matern,49139.49401026992,0.022112492735578124,1.5,TPESampler,COMPLETE
1465,0.22211382158313459,2025-04-24 21:36:12.713460,2025-04-24 21:36:17.365773,0 days 00:00:04.652313,1948.0899334588078,Matern,4874.473468009798,0.09467782616155015,2.5,TPESampler,COMPLETE
1466,0.1726187819593929,2025-04-24 21:36:13.622872,2025-04-24 21:36:21.705245,0 days 00:00:08.082373,2.918661896369792e-07,Matern,2.3126910676562598,5.967114911970108e-10,1.5,TPESampler,COMPLETE
1467,0.17261855143394492,2025-04-24 21:36:16.136839,2025-04-24 21:36:20.345052,0 days 00:00:04.208213,0.00012311896159555697,Matern,0.10287477731943682,3.593890012270865e-09,1.5,TPESampler,COMPLETE
1468,1.3677569514974675,2025-04-24 21:36:17.598832,2025-04-24 21:36:20.967583,0 days 00:00:03.368751,17.83196740151682,Matern,58610.9256597711,0.8878330474484352,1.5,TPESampler,COMPLETE
1469,1.3307518540985677,2025-04-24 21:36:20.578961,2025-04-24 21:36:25.797835,0 days 00:00:05.218874,0.0002779706534278336,Matern,0.012018861930328126,5.558438584530611e-10,1.5,TPESampler,COMPLETE
1470,0.17261855762155331,2025-04-24 21:36:21.214560,2025-04-24 21:36:29.387693,0 days 00:00:08.173133,7.470555661126611e-05,Matern,0.24267675461710508,4.779197531860098e-10,1.5,TPESampler,COMPLETE
1471,1.3307518540985803,2025-04-24 21:36:22.229704,2025-04-24 21:36:27.256663,0 days 00:00:05.026959,449.63404437207816,Matern,5617.383394652123,0.00951803758542427,1.5,TPESampler,COMPLETE
1472,0.17261865253979014,2025-04-24 21:36:26.007835,2025-04-24 21:36:31.605703,0 days 00:00:05.597868,4.4132264738853105e-06,Matern,2.6215592852672884,1.881221613887758e-08,1.5,TPESampler,COMPLETE
1473,1.3307518541097354,2025-04-24 21:36:27.510194,2025-04-24 21:36:31.761170,0 days 00:00:04.250976,0.00021864725824177875,Matern,0.008430214417801526,4.100735634430644e-09,1.5,TPESampler,COMPLETE
1474,1.3307518540993202,2025-04-24 21:36:29.695597,2025-04-24 21:36:37.005154,0 days 00:00:07.309557,3.359312947066306e-06,Matern,0.028721767950760195,2.5310861773220273e-09,1.5,TPESampler,COMPLETE
1475,1.330751854098682,2025-04-24 21:36:31.866263,2025-04-24 21:36:36.909659,0 days 00:00:05.043396,0.00842669273636307,Matern,0.0018005532876084352,1.179472716781514e-09,1.5,TPESampler,COMPLETE
1476,0.1726186750732178,2025-04-24 21:36:32.011452,2025-04-24 21:36:36.911045,0 days 00:00:04.899593,95886.99331043006,Matern,380.4882734513539,0.00038657704165564766,1.5,TPESampler,COMPLETE
1477,0.17261855242767357,2025-04-24 21:36:37.098845,2025-04-24 21:36:42.191532,0 days 00:00:05.092687,0.00035546686638429203,Matern,0.10347002634396872,2.6657188124872684e-10,1.5,TPESampler,COMPLETE
1478,1.3307518540990948,2025-04-24 21:36:37.107097,2025-04-24 21:36:40.978669,0 days 00:00:03.871572,0.00014520094448493753,Matern,0.005079018219817592,1.3215486346329e-07,1.5,TPESampler,COMPLETE
1479,1.3307518540987813,2025-04-24 21:36:37.123853,2025-04-24 21:36:41.447611,0 days 00:00:04.323758,1.3478772136107877e-05,Matern,0.0011863601893433884,1.2066018181734905e-10,1.5,TPESampler,COMPLETE
1480,0.1726192091026064,2025-04-24 21:36:41.209996,2025-04-24 21:36:50.232453,0 days 00:00:09.022457,1.5223566251989044e-05,Matern,0.9345898228917088,1.678181068109854e-08,1.5,TPESampler,COMPLETE
1481,1.330751854102122,2025-04-24 21:36:41.722227,2025-04-24 21:36:46.432158,0 days 00:00:04.709931,4.8993323982859234e-05,Matern,0.04359023430220041,2.946615445736539e-10,1.5,TPESampler,COMPLETE
1482,1.3307518540993202,2025-04-24 21:36:42.427925,2025-04-24 21:36:50.590453,0 days 00:00:08.162528,1.233993845473439e-07,Matern,0.022984647495922546,3.029925607659304e-09,1.5,TPESampler,COMPLETE
1483,1.3307518540987882,2025-04-24 21:36:46.910307,2025-04-24 21:36:52.726403,0 days 00:00:05.816096,735.1595637158299,Matern,6107.351475229766,0.0004375013305748392,1.5,TPESampler,COMPLETE
1484,0.1726188571085431,2025-04-24 21:36:50.589418,2025-04-24 21:37:05.906857,0 days 00:00:15.317439,1065.898637770928,Matern,6915.622263360966,0.013559448328319379,1.5,TPESampler,COMPLETE
1485,0.17261831453591447,2025-04-24 21:36:50.830854,2025-04-24 21:37:04.757616,0 days 00:00:13.926762,4.009249612379855e-05,Matern,0.10592658599239085,1.1089739020957658e-09,1.5,TPESampler,COMPLETE
1486,1.3307518541005452,2025-04-24 21:36:52.948786,2025-04-24 21:37:05.369163,0 days 00:00:12.420377,1.5594020349620182e-05,Matern,0.01621607866114793,1.5978041645048905e-10,1.5,TPESampler,COMPLETE
1487,0.17261854673556792,2025-04-24 21:37:05.325657,2025-04-24 21:37:16.149263,0 days 00:00:10.823606,0.00011443360710287427,Matern,1.9301535210385228,1.5205252369812265e-10,1.5,TPESampler,COMPLETE
1488,1.3307518540988388,2025-04-24 21:37:05.675700,2025-04-24 21:37:08.185014,0 days 00:00:02.509314,96.43426457441083,RBF,0.015507303325456837,0.19733529941243225,0.5,TPESampler,COMPLETE
