number,value,datetime_start,datetime_complete,duration,params_constant_value,params_kernel_type,params_length_scale,params_noise_level,params_nu,system_attrs_auto:sampler,state
2402,0.17261843670905347,2025-04-24 22:00:42.378262,2025-04-24 22:00:48.975085,0 days 00:00:06.596823,1627.1949576581862,Matern,8612.273911360478,0.010490888977923241,1.5,TPESampler,COMPLETE
2403,0.17261860164499482,2025-04-24 22:00:45.455785,2025-04-24 22:00:49.437561,0 days 00:00:03.981776,563.1502097312631,Matern,223.47401400568089,0.9353792935175704,1.5,TPESampler,COMPLETE
2404,0.17261854879571842,2025-04-24 22:00:46.075810,2025-04-24 22:00:48.931115,0 days 00:00:02.855305,1808.195642123648,Matern,25.38657028509675,0.0014951594118320303,1.5,TPESampler,COMPLETE
2405,1.3307518540980774,2025-04-24 22:00:49.111001,2025-04-24 22:00:53.307281,0 days 00:00:04.196280,5242.842009371379,Matern,2940.3423522093613,4.466394474033643e-05,1.5,TPESampler,COMPLETE
2406,0.1726185589670495,2025-04-24 22:00:49.159991,2025-04-24 22:00:52.089726,0 days 00:00:02.929735,19287.14132266746,Matern,595.506439083388,0.0017841618027123146,1.5,TPESampler,COMPLETE
2407,0.1726190796059419,2025-04-24 22:00:49.840998,2025-04-24 22:00:53.349379,0 days 00:00:03.508381,91784.57284019749,Matern,817.7563659271251,0.0024289956928900324,1.5,TPESampler,COMPLETE
2408,0.17261841459432042,2025-04-24 22:00:52.336821,2025-04-24 22:00:59.608562,0 days 00:00:07.271741,16.606219477809383,Matern,12235.308470129346,0.8069984867077103,1.5,TPESampler,COMPLETE
2409,0.17261856725729915,2025-04-24 22:00:53.495408,2025-04-24 22:01:00.636047,0 days 00:00:07.140639,1438.5631421127848,Matern,204.9766605177047,0.07406285319039517,1.5,TPESampler,COMPLETE
2410,1.330751854098733,2025-04-24 22:00:53.542320,2025-04-24 22:00:58.187632,0 days 00:00:04.645312,37.37701465189932,Matern,3034.4203790695415,0.0014539962795006261,1.5,TPESampler,COMPLETE
2411,0.21064101552524642,2025-04-24 22:00:58.429929,2025-04-24 22:01:01.143569,0 days 00:00:02.713640,30.6855789153815,RBF,10.206640064842555,0.0014779910724492154,2.5,TPESampler,COMPLETE
2412,0.1726187494774268,2025-04-24 22:00:59.838948,2025-04-24 22:01:03.771287,0 days 00:00:03.932339,629.9459637768073,Matern,90700.79559452669,0.0899488101258676,1.5,TPESampler,COMPLETE
2413,0.2106444138633369,2025-04-24 22:01:00.851661,2025-04-24 22:01:03.485578,0 days 00:00:02.633917,137.52068455067243,RBF,22.64781810159689,0.0019140664454356162,0.5,TPESampler,COMPLETE
2414,0.17261840985540036,2025-04-24 22:01:01.397409,2025-04-24 22:01:04.772001,0 days 00:00:03.374592,747.697797503176,Matern,2526.592578614791,0.7683765857140074,1.5,TPESampler,COMPLETE
2415,0.17261872687446372,2025-04-24 22:01:03.714003,2025-04-24 22:01:08.784966,0 days 00:00:05.070963,0.013565475778404076,Matern,2.4907361693241983,0.6198572851349652,1.5,TPESampler,COMPLETE
2416,1.3307518540982715,2025-04-24 22:01:04.035227,2025-04-24 22:01:08.107571,0 days 00:00:04.072344,80.18987563994335,Matern,1846.9842991049622,0.00232569892087046,1.5,TPESampler,COMPLETE
2417,0.2741901073155779,2025-04-24 22:01:05.023482,2025-04-24 22:01:08.792247,0 days 00:00:03.768765,54.7315778692011,Matern,2438.449389265337,0.0004570102399759232,0.5,TPESampler,COMPLETE
2418,0.2741901054871753,2025-04-24 22:01:08.326916,2025-04-24 22:01:12.584909,0 days 00:00:04.257993,79433.47336638294,Matern,144.60742847883412,0.027710970128680748,0.5,TPESampler,COMPLETE
2419,0.17261938450326023,2025-04-24 22:01:09.036976,2025-04-24 22:01:12.592176,0 days 00:00:03.555200,952.9320491706832,Matern,1451.7575384771026,0.02803136299466611,1.5,TPESampler,COMPLETE
2420,0.17261852443290118,2025-04-24 22:01:09.084565,2025-04-24 22:01:12.285534,0 days 00:00:03.200969,38.25120147398641,Matern,188.95625803729413,0.022963644022894376,1.5,TPESampler,COMPLETE
2421,1.3307518540988286,2025-04-24 22:01:12.526266,2025-04-24 22:01:17.120176,0 days 00:00:04.593910,154.24920514496145,Matern,2885.587916881721,3.700406590368517e-05,1.5,TPESampler,COMPLETE
2422,0.17261864442374547,2025-04-24 22:01:12.933539,2025-04-24 22:01:20.007275,0 days 00:00:07.073736,0.12548329901130972,Matern,162.36236587160522,0.19707744894781462,1.5,TPESampler,COMPLETE
2423,0.1726185423080161,2025-04-24 22:01:13.043672,2025-04-24 22:01:16.623993,0 days 00:00:03.580321,3400.2343142050518,Matern,31.851657612938673,0.024875811365670478,1.5,TPESampler,COMPLETE
2424,0.1726185467588466,2025-04-24 22:01:16.844825,2025-04-24 22:01:22.361532,0 days 00:00:05.516707,5.248607723907645e-05,Matern,2.6771481576540315,0.09591482726159035,1.5,TPESampler,COMPLETE
2425,0.1726185614337085,2025-04-24 22:01:17.397091,2025-04-24 22:01:23.368620,0 days 00:00:05.971529,0.00044815294384088566,Matern,0.16277305398738479,4.876300979848187e-05,1.5,TPESampler,COMPLETE
2426,0.1726182792680072,2025-04-24 22:01:20.254287,2025-04-24 22:01:26.650511,0 days 00:00:06.396224,2927.180945372795,Matern,77.93542977738255,0.00034095474812433947,1.5,TPESampler,COMPLETE
2427,0.17261855438591883,2025-04-24 22:01:22.583188,2025-04-24 22:01:27.789290,0 days 00:00:05.206102,10.95563974621452,Matern,190.026232619071,0.048060481036095434,1.5,TPESampler,COMPLETE
2428,0.17261868531843402,2025-04-24 22:01:23.647132,2025-04-24 22:01:29.335208,0 days 00:00:05.688076,17.02638627182209,Matern,68276.63658233886,0.04132496041386235,1.5,TPESampler,COMPLETE
2429,0.17261812197546444,2025-04-24 22:01:26.893591,2025-04-24 22:01:32.239729,0 days 00:00:05.346138,990.6929574100632,Matern,991.6428955220983,0.05014334478287306,1.5,TPESampler,COMPLETE
2430,0.17261855728314238,2025-04-24 22:01:28.026725,2025-04-24 22:01:31.607133,0 days 00:00:03.580408,2792.6988190593024,Matern,65.12414261583197,0.0011982127949332101,1.5,TPESampler,COMPLETE
2431,0.17261858610670755,2025-04-24 22:01:29.617733,2025-04-24 22:01:33.019255,0 days 00:00:03.401522,4840.54724558135,Matern,963.7414531062012,0.035896793993922385,1.5,TPESampler,COMPLETE
2432,0.1726185384319529,2025-04-24 22:01:31.832556,2025-04-24 22:01:35.770100,0 days 00:00:03.937544,101.37988481379607,Matern,2663.1191771327653,0.7342208683717742,1.5,TPESampler,COMPLETE
2433,0.17261854737287816,2025-04-24 22:01:32.494002,2025-04-24 22:01:39.207911,0 days 00:00:06.713909,28.430914342515504,Matern,236.1459594527358,0.015213511699216507,1.5,TPESampler,COMPLETE
2434,0.1726179655042247,2025-04-24 22:01:33.325549,2025-04-24 22:01:36.924197,0 days 00:00:03.598648,4437.631679785466,Matern,47.05663805011877,0.01365494213079663,1.5,TPESampler,COMPLETE
2435,1.3307518540986605,2025-04-24 22:01:36.014376,2025-04-24 22:01:41.558759,0 days 00:00:05.544383,5.886651578091925,Matern,6201.02828222574,0.006894720999894495,1.5,TPESampler,COMPLETE
2436,0.2741901081241992,2025-04-24 22:01:37.154451,2025-04-24 22:01:39.901459,0 days 00:00:02.747008,85620.06387183571,Matern,46.41974103748606,0.00024695328040956574,0.5,TPESampler,COMPLETE
2437,0.1726185512730465,2025-04-24 22:01:39.465714,2025-04-24 22:01:43.091668,0 days 00:00:03.625954,0.06321275117152812,Matern,297.51135073280335,0.9995027864164315,1.5,TPESampler,COMPLETE
2438,1.3677489340272193,2025-04-24 22:01:40.158896,2025-04-24 22:01:43.140868,0 days 00:00:02.981972,4.657534641423566e-05,RBF,0.0714322922642223,0.06401257665176438,1.5,TPESampler,COMPLETE
2439,0.1726185621258691,2025-04-24 22:01:41.859922,2025-04-24 22:01:45.315374,0 days 00:00:03.455452,10.064734451597241,Matern,27.59192088712262,0.0009421916300059119,1.5,TPESampler,COMPLETE
2440,1.3307518541024532,2025-04-24 22:01:43.296484,2025-04-24 22:01:47.969959,0 days 00:00:04.673475,2603.5255008380454,Matern,33285.82287751731,0.0007888895169368649,1.5,TPESampler,COMPLETE
2441,0.17261846000574152,2025-04-24 22:01:43.342273,2025-04-24 22:01:48.496970,0 days 00:00:05.154697,443.47769559665824,Matern,28.380110221739812,0.6461170705860169,1.5,TPESampler,COMPLETE
2442,0.17261855246596208,2025-04-24 22:01:45.584162,2025-04-24 22:01:49.503580,0 days 00:00:03.919418,812.7660287851284,Matern,19.552880464476534,0.9863239306631643,1.5,TPESampler,COMPLETE
2443,0.17261881831958906,2025-04-24 22:01:48.233832,2025-04-24 22:01:52.927999,0 days 00:00:04.694167,1498.073682137478,Matern,11861.19920036675,0.05588756313666359,1.5,TPESampler,COMPLETE
2444,0.1726185555752268,2025-04-24 22:01:48.772543,2025-04-24 22:01:51.870839,0 days 00:00:03.098296,73347.19050674787,Matern,824.7178322743911,0.004360789522637007,1.5,TPESampler,COMPLETE
2445,0.17261869453975923,2025-04-24 22:01:49.844119,2025-04-24 22:01:55.685638,0 days 00:00:05.841519,301.7988096561112,Matern,138.9410969398077,0.004074005175466509,1.5,TPESampler,COMPLETE
2446,0.1726182800499979,2025-04-24 22:01:52.098060,2025-04-24 22:01:56.494408,0 days 00:00:04.396348,1952.4972852352616,Matern,11875.40017593961,0.03246135246673584,1.5,TPESampler,COMPLETE
2447,0.17261793676598136,2025-04-24 22:01:53.141885,2025-04-24 22:01:56.261270,0 days 00:00:03.119385,50442.14078742413,Matern,71.27922491760074,0.014560583761321143,1.5,TPESampler,COMPLETE
2448,0.22211419709852162,2025-04-24 22:01:55.959087,2025-04-24 22:01:59.733959,0 days 00:00:03.774872,469.29960984301476,Matern,113.72360826342323,0.07323058424488446,2.5,TPESampler,COMPLETE
2449,0.17261854861157852,2025-04-24 22:01:56.548027,2025-04-24 22:01:59.730626,0 days 00:00:03.182599,98699.18282108552,Matern,4.351974991838175,0.10420098892643358,1.5,TPESampler,COMPLETE
2450,0.1726186207852623,2025-04-24 22:01:56.771636,2025-04-24 22:02:05.033815,0 days 00:00:08.262179,44.3153685782579,Matern,3773.728647410395,0.948409972167425,1.5,TPESampler,COMPLETE
2451,0.17261806366889398,2025-04-24 22:01:59.903637,2025-04-24 22:02:07.623582,0 days 00:00:07.719945,547.5087805265593,Matern,3370.802116569953,0.8928278491992351,1.5,TPESampler,COMPLETE
2452,1.3307518540988226,2025-04-24 22:01:59.952272,2025-04-24 22:02:06.514450,0 days 00:00:06.562178,3.314769935407198,Matern,3957.277192519327,0.0316842844372858,1.5,TPESampler,COMPLETE
2453,0.1726181541573009,2025-04-24 22:02:05.272255,2025-04-24 22:02:09.000812,0 days 00:00:03.728557,22.492399616358536,Matern,149.09391342349352,0.010275393522548044,1.5,TPESampler,COMPLETE
2454,0.2221143405023131,2025-04-24 22:02:06.742028,2025-04-24 22:02:10.417305,0 days 00:00:03.675277,24110.935890335804,Matern,3171.773736090001,0.0024403911490065216,2.5,TPESampler,COMPLETE
2455,1.3307518540988126,2025-04-24 22:02:07.867404,2025-04-24 22:02:11.858997,0 days 00:00:03.991593,2378.9212849515484,Matern,3698.9450437713353,0.00015320265247949962,1.5,TPESampler,COMPLETE
2456,0.17261856117308652,2025-04-24 22:02:09.255217,2025-04-24 22:02:12.791461,0 days 00:00:03.536244,1311.520786175989,Matern,83.91456048049358,0.09041831068100907,1.5,TPESampler,COMPLETE
2457,1.3307518540987184,2025-04-24 22:02:10.648626,2025-04-24 22:02:16.493322,0 days 00:00:05.844696,4.216314019064893,Matern,99519.63585744846,0.003561792438758749,1.5,TPESampler,COMPLETE
2458,1.3307518540987222,2025-04-24 22:02:12.094338,2025-04-24 22:02:19.971975,0 days 00:00:07.877637,0.03322800848460416,Matern,457.4309723151999,0.02138158051792265,2.5,TPESampler,COMPLETE
2459,0.17261854073230426,2025-04-24 22:02:12.998988,2025-04-24 22:02:19.852886,0 days 00:00:06.853898,11.295419034829651,Matern,91.13972134974608,0.9885840337857292,1.5,TPESampler,COMPLETE
2460,0.2741901475505883,2025-04-24 22:02:16.749210,2025-04-24 22:02:21.502514,0 days 00:00:04.753304,0.07378542235685132,Matern,305.859172690262,0.04865641486510749,0.5,TPESampler,COMPLETE
2461,0.27419010595461213,2025-04-24 22:02:20.060182,2025-04-24 22:02:23.884755,0 days 00:00:03.824573,20.736677436871208,Matern,15663.10636395892,0.7389932007503325,0.5,TPESampler,COMPLETE
2462,0.1726185748807886,2025-04-24 22:02:20.200877,2025-04-24 22:02:23.517933,0 days 00:00:03.317056,1060.8658591896997,Matern,114.75572108798687,0.09121103210276992,1.5,TPESampler,COMPLETE
2463,0.17261856194134684,2025-04-24 22:02:21.759105,2025-04-24 22:02:25.604259,0 days 00:00:03.845154,0.7316397741498454,Matern,54.13388345309829,0.03436311393687119,1.5,TPESampler,COMPLETE
2464,0.1726186540241573,2025-04-24 22:02:23.734005,2025-04-24 22:02:28.253325,0 days 00:00:04.519320,1291.8344020909713,Matern,167.59624903994248,6.609471709243205e-05,1.5,TPESampler,COMPLETE
2465,0.2106446989624677,2025-04-24 22:02:24.174410,2025-04-24 22:02:27.696987,0 days 00:00:03.522577,84573.71829634285,RBF,0.44589071707171146,0.2279457114406293,1.5,TPESampler,COMPLETE
2466,0.2741901014037343,2025-04-24 22:02:25.868535,2025-04-24 22:02:29.987061,0 days 00:00:04.118526,35.0018009757253,Matern,42.257521560086126,0.004041238031194326,0.5,TPESampler,COMPLETE
2467,0.2106446797691392,2025-04-24 22:02:27.937276,2025-04-24 22:02:31.756161,0 days 00:00:03.818885,43.60008913790364,RBF,507.6730098903895,0.007616525674883796,1.5,TPESampler,COMPLETE
2468,0.17261854210012828,2025-04-24 22:02:28.505835,2025-04-24 22:02:32.512258,0 days 00:00:04.006423,2194.671476920222,Matern,19.404590795587016,0.0009030506700206851,1.5,TPESampler,COMPLETE
2469,0.17261826082900872,2025-04-24 22:02:30.233941,2025-04-24 22:02:36.593665,0 days 00:00:06.359724,251.62960895125886,Matern,5301.306739026723,0.02312591632086581,1.5,TPESampler,COMPLETE
2470,0.17261787784799723,2025-04-24 22:02:32.018188,2025-04-24 22:02:37.741413,0 days 00:00:05.723225,396.2105866166278,Matern,66.71807224768543,0.9783121272391125,1.5,TPESampler,COMPLETE
2471,0.17261755444433521,2025-04-24 22:02:32.776531,2025-04-24 22:02:36.450953,0 days 00:00:03.674422,80630.43564737748,Matern,50.75968637153379,0.023963865462564626,1.5,TPESampler,COMPLETE
2472,0.17261888286199129,2025-04-24 22:02:36.660807,2025-04-24 22:02:45.249691,0 days 00:00:08.588884,42.02358291782163,Matern,91806.15678118748,0.07001694941380471,1.5,TPESampler,COMPLETE
2473,1.3307518541002696,2025-04-24 22:02:36.889127,2025-04-24 22:02:44.399476,0 days 00:00:07.510349,0.0005285930968805481,Matern,242.2257436092765,0.031791496184360585,1.5,TPESampler,COMPLETE
2474,0.172618804897133,2025-04-24 22:02:37.977891,2025-04-24 22:02:41.434939,0 days 00:00:03.457048,5046.899358245994,Matern,1405.3637453945867,0.017910061303983392,1.5,TPESampler,COMPLETE
2475,0.172618552335043,2025-04-24 22:02:41.699226,2025-04-24 22:02:45.257036,0 days 00:00:03.557810,151.74775586323167,Matern,329.8550420433917,0.00094677636964505,1.5,TPESampler,COMPLETE
2476,1.3307518540983754,2025-04-24 22:02:44.653933,2025-04-24 22:02:49.041921,0 days 00:00:04.387988,613.8649733974465,Matern,2318.1017126173883,0.0031471457530837478,1.5,TPESampler,COMPLETE
2477,1.3677560023281896,2025-04-24 22:02:45.651091,2025-04-24 22:02:48.272227,0 days 00:00:02.621136,60.88549422250122,Matern,3.217135424527941e-05,0.0006064868885097514,1.5,TPESampler,COMPLETE
2478,0.17261821969791108,2025-04-24 22:02:45.718208,2025-04-24 22:02:54.743090,0 days 00:00:09.024882,232.54778125473624,Matern,95687.4522944478,0.1927844238068651,1.5,TPESampler,COMPLETE
2479,1.3307518540979475,2025-04-24 22:02:48.499298,2025-04-24 22:02:56.546875,0 days 00:00:08.047577,0.6351703185526821,Matern,2338.275123467177,0.04006397903228645,1.5,TPESampler,COMPLETE
2480,0.21064143732549673,2025-04-24 22:02:49.306079,2025-04-24 22:02:53.574051,0 days 00:00:04.267972,0.6595760833697538,RBF,1.9923988491258486,6.423172423779256e-08,1.5,TPESampler,COMPLETE
2481,1.3307518540987533,2025-04-24 22:02:53.808826,2025-04-24 22:02:59.832869,0 days 00:00:06.024043,0.0008504123937878186,Matern,15.404288080139512,0.004483894753515207,2.5,TPESampler,COMPLETE
2482,0.17261855387380098,2025-04-24 22:02:55.007112,2025-04-24 22:02:58.802944,0 days 00:00:03.795832,6.22469801517583,Matern,88.30625646229115,0.057425866318992436,1.5,TPESampler,COMPLETE
2483,0.17261789372223832,2025-04-24 22:02:56.781111,2025-04-24 22:03:03.408302,0 days 00:00:06.627191,396.6987225390688,Matern,1654.6099965809735,0.048400795241566354,1.5,TPESampler,COMPLETE
2484,0.21064456283099822,2025-04-24 22:02:59.142817,2025-04-24 22:03:02.527447,0 days 00:00:03.384630,2898.8269924798237,RBF,86.42031189358474,0.1428841038769748,1.5,TPESampler,COMPLETE
2485,0.17261859855896308,2025-04-24 22:03:00.096285,2025-04-24 22:03:03.302206,0 days 00:00:03.205921,93.51322870074891,Matern,23.777277386417747,0.0073509931129653585,1.5,TPESampler,COMPLETE
2486,0.1726184868603333,2025-04-24 22:03:02.774430,2025-04-24 22:03:07.200722,0 days 00:00:04.426292,444.4606324839908,Matern,148.25305130146054,0.08602058377839221,1.5,TPESampler,COMPLETE
2487,0.17261840972717823,2025-04-24 22:03:03.494153,2025-04-24 22:03:06.669543,0 days 00:00:03.175390,54461.81194223344,Matern,219.19251023624903,6.37499896857326e-05,1.5,TPESampler,COMPLETE
2488,1.3677569394630433,2025-04-24 22:03:03.589633,2025-04-24 22:03:07.282425,0 days 00:00:03.692792,0.08369486200475836,Matern,4511.279606221581,0.7903599407782723,1.5,TPESampler,COMPLETE
2489,0.1726185564167885,2025-04-24 22:03:06.912803,2025-04-24 22:03:10.333227,0 days 00:00:03.420424,80614.1753185471,Matern,11797.706480346222,0.02313471517723531,1.5,TPESampler,COMPLETE
2490,1.3307518540967371,2025-04-24 22:03:07.467151,2025-04-24 22:03:12.253435,0 days 00:00:04.786284,42.6436771661682,Matern,6020.735821716988,0.00010656352651881854,1.5,TPESampler,COMPLETE
2491,0.27419010634145047,2025-04-24 22:03:07.502336,2025-04-24 22:03:10.517484,0 days 00:00:03.015148,26468.100679714895,Matern,158.03638229147745,7.39539264382876e-07,0.5,TPESampler,COMPLETE
2492,0.17261879945390116,2025-04-24 22:03:10.519993,2025-04-24 22:03:14.499202,0 days 00:00:03.979209,0.09329572257017318,Matern,45.77343709561251,0.786219198785371,1.5,TPESampler,COMPLETE
2493,0.17261811151082967,2025-04-24 22:03:10.798348,2025-04-24 22:03:18.109436,0 days 00:00:07.311088,2160.479135699993,Matern,1676.0149126152144,0.03958102023504583,1.5,TPESampler,COMPLETE
2494,0.1726182470170988,2025-04-24 22:03:12.482784,2025-04-24 22:03:16.241790,0 days 00:00:03.759006,954.4533754756994,Matern,156.0701969609621,0.016368400567619873,1.5,TPESampler,COMPLETE
2495,0.2741901064511013,2025-04-24 22:03:14.780082,2025-04-24 22:03:19.858662,0 days 00:00:05.078580,0.0012550299852715106,Matern,92.73329496681914,0.33634216262435396,0.5,TPESampler,COMPLETE
2496,0.17261852661102603,2025-04-24 22:03:16.493846,2025-04-24 22:03:19.367276,0 days 00:00:02.873430,29707.90742144792,Matern,8.8745181945617,0.0022027207854470555,1.5,TPESampler,COMPLETE
2497,0.17261843011076905,2025-04-24 22:03:18.349878,2025-04-24 22:03:23.185171,0 days 00:00:04.835293,0.6052449862234163,Matern,568.704598006244,0.8564412992260716,1.5,TPESampler,COMPLETE
2498,0.1726186427354687,2025-04-24 22:03:19.606268,2025-04-24 22:03:22.894971,0 days 00:00:03.288703,49.01579016111478,Matern,150.09086109350096,0.035411617393045866,1.5,TPESampler,COMPLETE
2499,1.330751854098828,2025-04-24 22:03:20.163526,2025-04-24 22:03:24.508414,0 days 00:00:04.344888,13.418121266395678,Matern,1538.5378652923027,0.0009401511778183522,1.5,TPESampler,COMPLETE
