number,value,datetime_start,datetime_complete,duration,params_constant_value,params_kernel_type,params_length_scale,params_noise_level,params_nu,system_attrs_auto:sampler,state
1717,0.17261852709275974,2025-04-24 21:43:17.209652,2025-04-24 21:43:20.869763,0 days 00:00:03.660111,245.3431941133918,Matern,342.3712109357808,0.7208789452245629,1.5,TPESampler,COMPLETE
1718,0.172618571333444,2025-04-24 21:43:18.350862,2025-04-24 21:43:22.069085,0 days 00:00:03.718223,2038.6201209760545,Matern,9319.812054592845,0.4297140193705918,1.5,TPESampler,COMPLETE
1719,1.3307518533758105,2025-04-24 21:43:21.072322,2025-04-24 21:43:23.523213,0 days 00:00:02.450891,91.77605874224601,Matern,0.048367156625459325,0.004256447363639021,0.5,TPESampler,COMPLETE
1720,0.17261862466565692,2025-04-24 21:43:21.614829,2025-04-24 21:43:25.666556,0 days 00:00:04.051727,6.744152402904671,Matern,1435.4607169287988,0.45282486345660594,1.5,TPESampler,COMPLETE
1721,0.17261818721393948,2025-04-24 21:43:22.261031,2025-04-24 21:43:28.818596,0 days 00:00:06.557565,758.588969343287,Matern,18761.28185795966,0.8014236417845754,1.5,TPESampler,COMPLETE
1722,1.3677560057830254,2025-04-24 21:43:23.732661,2025-04-24 21:43:26.145839,0 days 00:00:02.413178,6537.227286402464,RBF,0.00031486950817167646,1.4247901802230162e-06,2.5,TPESampler,COMPLETE
1723,0.17261740220233127,2025-04-24 21:43:25.877936,2025-04-24 21:43:32.597166,0 days 00:00:06.719230,237.9287614356199,Matern,3817.2756546348587,0.06189562685034118,1.5,TPESampler,COMPLETE
1724,0.17261845867960104,2025-04-24 21:43:26.383407,2025-04-24 21:43:29.532275,0 days 00:00:03.148868,661.149401480597,Matern,5379.051798752559,0.6722764002120398,1.5,TPESampler,COMPLETE
1725,1.3677569515961394,2025-04-24 21:43:29.083933,2025-04-24 21:43:32.538198,0 days 00:00:03.454265,1.8265191985472602,Matern,40586.66099582415,0.8224476880511205,1.5,TPESampler,COMPLETE
1726,0.17261836622098842,2025-04-24 21:43:29.752916,2025-04-24 21:43:36.309555,0 days 00:00:06.556639,86062.05876771735,Matern,87.83449143668392,0.6988708984152975,1.5,TPESampler,COMPLETE
1727,0.1726188842643119,2025-04-24 21:43:32.706667,2025-04-24 21:43:36.257381,0 days 00:00:03.550714,276.9316286691062,Matern,615.6530074914835,0.06399501409783412,1.5,TPESampler,COMPLETE
1728,0.1726185457696525,2025-04-24 21:43:32.774574,2025-04-24 21:43:36.378731,0 days 00:00:03.604157,43.77472104572219,Matern,233.4098308386001,0.15193909868958175,1.5,TPESampler,COMPLETE
1729,0.17261854336675883,2025-04-24 21:43:36.436930,2025-04-24 21:43:40.025651,0 days 00:00:03.588721,56.367529760218105,Matern,4120.128486802038,0.3488794955577274,1.5,TPESampler,COMPLETE
1730,0.17261821675954483,2025-04-24 21:43:36.478003,2025-04-24 21:43:39.879759,0 days 00:00:03.401756,794.9578852864851,Matern,1935.5819955314867,0.04075216922290559,1.5,TPESampler,COMPLETE
1731,0.17261846547302823,2025-04-24 21:43:36.625299,2025-04-24 21:43:42.894605,0 days 00:00:06.269306,107.08769208958391,Matern,2942.5373710089125,0.4135683115556474,1.5,TPESampler,COMPLETE
1732,0.17261860491952255,2025-04-24 21:43:40.091827,2025-04-24 21:43:44.129232,0 days 00:00:04.037405,0.025208542817765717,Matern,5.57708645935291,0.03210107863361038,1.5,TPESampler,COMPLETE
1733,0.17261876949469498,2025-04-24 21:43:40.242806,2025-04-24 21:43:47.101088,0 days 00:00:06.858282,92.19289850407115,Matern,60.890987539847956,0.03737085619687202,1.5,TPESampler,COMPLETE
1734,0.17261854390875883,2025-04-24 21:43:43.123539,2025-04-24 21:43:46.367240,0 days 00:00:03.243701,1736.1897401162619,Matern,1002.8668992790901,0.9768624860381736,1.5,TPESampler,COMPLETE
1735,1.3677569516418242,2025-04-24 21:43:44.416536,2025-04-24 21:43:48.608046,0 days 00:00:04.191510,11.090672139564317,Matern,88000.78682301742,0.08711828954319911,1.5,TPESampler,COMPLETE
1736,1.3307518540987902,2025-04-24 21:43:46.598329,2025-04-24 21:43:52.738673,0 days 00:00:06.140344,0.0025067061147621083,RBF,1299.5977660277683,6.03991858909643e-08,2.5,TPESampler,COMPLETE
1737,0.1726191616080857,2025-04-24 21:43:47.378435,2025-04-24 21:43:51.261599,0 days 00:00:03.883164,57.994255306720426,Matern,560.9078952506223,0.764998986795469,1.5,TPESampler,COMPLETE
1738,1.3307518540994554,2025-04-24 21:43:48.848452,2025-04-24 21:43:53.058014,0 days 00:00:04.209562,41.167997219712895,Matern,12381.435933077437,0.0019305199667727492,1.5,TPESampler,COMPLETE
1739,0.1726190782511578,2025-04-24 21:43:51.478333,2025-04-24 21:43:55.545151,0 days 00:00:04.066818,84501.63635406844,Matern,881.0653408237371,0.04388025880180059,1.5,TPESampler,COMPLETE
1740,0.17261828141564742,2025-04-24 21:43:52.980445,2025-04-24 21:43:58.232563,0 days 00:00:05.252118,443.1815107767655,Matern,14.829797665247277,0.07136013383727251,1.5,TPESampler,COMPLETE
1741,1.3307518540987522,2025-04-24 21:43:53.329287,2025-04-24 21:43:57.054606,0 days 00:00:03.725319,32.01242397219318,Matern,2534.707801021164,0.0016392435572740404,1.5,TPESampler,COMPLETE
1742,0.17261699298386624,2025-04-24 21:43:55.781138,2025-04-24 21:44:03.210436,0 days 00:00:07.429298,17.45449608043134,Matern,3.5811297525753663,0.9911828384281188,1.5,TPESampler,COMPLETE
1743,0.17261848508107763,2025-04-24 21:43:57.287137,2025-04-24 21:44:00.378543,0 days 00:00:03.091406,932.6353138211928,Matern,7.148123504347799,0.0006564649351064996,1.5,TPESampler,COMPLETE
1744,1.3677569360381834,2025-04-24 21:43:58.490224,2025-04-24 21:44:02.067596,0 days 00:00:03.577372,32.861681375685365,Matern,47014.34362218047,0.8385248420200735,1.5,TPESampler,COMPLETE
1745,0.1726181970498788,2025-04-24 21:44:00.605152,2025-04-24 21:44:08.152758,0 days 00:00:07.547606,697.2024599935792,Matern,30.33837920463907,0.6540252940428466,1.5,TPESampler,COMPLETE
1746,1.3307518540986203,2025-04-24 21:44:02.309573,2025-04-24 21:44:09.889249,0 days 00:00:07.579676,0.00013266195092067896,Matern,15.015244901193944,0.00796085790976663,1.5,TPESampler,COMPLETE
1747,1.3307518541058336,2025-04-24 21:44:03.484039,2025-04-24 21:44:07.427319,0 days 00:00:03.943280,0.08835730948376916,Matern,0.03053884062365943,0.0087038144754,1.5,TPESampler,COMPLETE
1748,0.1726185481850775,2025-04-24 21:44:07.682437,2025-04-24 21:44:11.464931,0 days 00:00:03.782494,2.1695593759787903,Matern,37.07701878592434,0.9193843183464976,1.5,TPESampler,COMPLETE
1749,1.3307518541061274,2025-04-24 21:44:08.399947,2025-04-24 21:44:13.526107,0 days 00:00:05.126160,330.4854512169314,RBF,11355.70350129731,0.020508421319493805,1.5,TPESampler,COMPLETE
1750,1.3307518541011971,2025-04-24 21:44:10.086756,2025-04-24 21:44:13.469669,0 days 00:00:03.382913,41.946477031383,Matern,0.004918847903508749,0.4918123743918728,1.5,TPESampler,COMPLETE
1751,1.3307518540983014,2025-04-24 21:44:11.691007,2025-04-24 21:44:15.341385,0 days 00:00:03.650378,0.9435887149151193,RBF,21.14135155064378,1.5941527115461126e-06,2.5,TPESampler,COMPLETE
1752,0.17261854939981744,2025-04-24 21:44:13.635962,2025-04-24 21:44:17.618208,0 days 00:00:03.982246,5412.69218233707,Matern,90.8728938885658,0.7794034302531043,1.5,TPESampler,COMPLETE
1753,0.2106447397616635,2025-04-24 21:44:13.779423,2025-04-24 21:44:17.569971,0 days 00:00:03.790548,5.5224552132241875,RBF,534.0905948513329,0.032406093365855065,1.5,TPESampler,COMPLETE
1754,0.17261840340819276,2025-04-24 21:44:15.584281,2025-04-24 21:44:19.447089,0 days 00:00:03.862808,10.461123250014902,Matern,1.6142315935338512,0.01865414802608109,1.5,TPESampler,COMPLETE
1755,0.1726175913095166,2025-04-24 21:44:17.733840,2025-04-24 21:44:24.813162,0 days 00:00:07.079322,6.641354369008904,Matern,11.30970613630105,0.2581347193215146,1.5,TPESampler,COMPLETE
1756,0.1726189559219779,2025-04-24 21:44:17.799788,2025-04-24 21:44:22.485558,0 days 00:00:04.685770,203.76811711152834,Matern,2.2096973569110077,0.07370294186566273,1.5,TPESampler,COMPLETE
1757,0.17261883352876842,2025-04-24 21:44:19.692667,2025-04-24 21:44:23.333030,0 days 00:00:03.640363,33.364350796438465,Matern,3.4123669541252397,0.06452719714263261,1.5,TPESampler,COMPLETE
1758,0.2106447142044108,2025-04-24 21:44:22.709949,2025-04-24 21:44:26.343506,0 days 00:00:03.633557,0.00027059424057878837,RBF,0.21740050383748982,0.0009096940318538827,1.5,TPESampler,COMPLETE
1759,1.3677569507411826,2025-04-24 21:44:23.642969,2025-04-24 21:44:27.861517,0 days 00:00:04.218548,133.49311485978322,RBF,68983.80723532708,0.5317299163127275,1.5,TPESampler,COMPLETE
1760,1.330751854099029,2025-04-24 21:44:25.057549,2025-04-24 21:44:32.533258,0 days 00:00:07.475709,2178.081666746917,RBF,3911.116061080509,7.58455388792656e-10,2.5,TPESampler,COMPLETE
1761,1.3307518540988528,2025-04-24 21:44:26.587860,2025-04-24 21:44:32.528225,0 days 00:00:05.940365,3.93195621835661,Matern,0.021118043222351196,0.16614823678452806,1.5,TPESampler,COMPLETE
1762,1.3307518354393775,2025-04-24 21:44:28.413667,2025-04-24 21:44:32.964101,0 days 00:00:04.550434,101.11582144952736,Matern,0.08452923931016991,0.014543352145603951,1.5,TPESampler,COMPLETE
1763,0.17261806900271515,2025-04-24 21:44:32.704099,2025-04-24 21:44:41.235374,0 days 00:00:08.531275,25.778194569129287,Matern,0.17033472775381103,0.10105997825479529,1.5,TPESampler,COMPLETE
1764,1.3307518540987688,2025-04-24 21:44:32.764128,2025-04-24 21:44:35.986044,0 days 00:00:03.221916,0.27056321813102757,RBF,0.05865533639402223,0.0020492912563520463,2.5,TPESampler,COMPLETE
1765,1.3307518541049002,2025-04-24 21:44:33.190675,2025-04-24 21:44:37.460619,0 days 00:00:04.269944,861.5233580213654,RBF,35997.43019504592,3.917864376442707e-10,0.5,TPESampler,COMPLETE
1766,0.17261831742460157,2025-04-24 21:44:36.195919,2025-04-24 21:44:40.733452,0 days 00:00:04.537533,348.1840650190312,Matern,13.400467738798023,0.5753452157021351,1.5,TPESampler,COMPLETE
1767,0.17261835214052926,2025-04-24 21:44:37.721818,2025-04-24 21:44:44.758209,0 days 00:00:07.036391,4.960996116389728,Matern,0.6372234336204943,0.17148685284193826,1.5,TPESampler,COMPLETE
1768,0.17261829890022645,2025-04-24 21:44:40.973788,2025-04-24 21:44:44.466807,0 days 00:00:03.493019,63.14125863545812,Matern,1.2230410168441062,0.6357943264315045,1.5,TPESampler,COMPLETE
1769,0.22211448419000324,2025-04-24 21:44:41.464318,2025-04-24 21:44:45.925914,0 days 00:00:04.461596,1410.4174244159474,Matern,23384.699756250386,0.7494503575825561,2.5,TPESampler,COMPLETE
1770,1.3307518541002061,2025-04-24 21:44:44.689357,2025-04-24 21:44:47.498456,0 days 00:00:02.809099,1683.6709579828773,RBF,0.004098696307248804,1.2385850801240222e-10,2.5,TPESampler,COMPLETE
1771,0.1726185116597944,2025-04-24 21:44:45.006150,2025-04-24 21:44:50.844378,0 days 00:00:05.838228,475.8454856852357,Matern,0.17373576923744247,0.7053344413904643,1.5,TPESampler,COMPLETE
1772,0.17261855363934037,2025-04-24 21:44:46.142422,2025-04-24 21:44:49.646982,0 days 00:00:03.504560,0.70496955704019,Matern,2.831279390545034,0.0601737578072109,1.5,TPESampler,COMPLETE
1773,0.17261836200605474,2025-04-24 21:44:47.748749,2025-04-24 21:44:52.243052,0 days 00:00:04.494303,47.79799738181275,Matern,239.27806051712622,0.5729504273208282,1.5,TPESampler,COMPLETE
1774,1.3677569516720776,2025-04-24 21:44:49.874274,2025-04-24 21:44:53.410863,0 days 00:00:03.536589,2.211854557356969,Matern,79218.50577180149,0.992403502257873,2.5,TPESampler,COMPLETE
1775,0.17261854850623917,2025-04-24 21:44:51.446080,2025-04-24 21:44:55.679706,0 days 00:00:04.233626,0.029942633581014174,Matern,14.87584836398586,0.7057786779400423,1.5,TPESampler,COMPLETE
1776,0.1726184458447773,2025-04-24 21:44:52.497422,2025-04-24 21:44:55.728124,0 days 00:00:03.230702,4755.214267595582,Matern,155.2282742508607,0.925044199827613,1.5,TPESampler,COMPLETE
1777,0.17261867402509207,2025-04-24 21:44:53.654560,2025-04-24 21:44:57.915461,0 days 00:00:04.260901,2.253586333644097,Matern,260.7558906472359,0.6400251868790908,1.5,TPESampler,COMPLETE
1778,0.17261855379784558,2025-04-24 21:44:55.865027,2025-04-24 21:44:59.110735,0 days 00:00:03.245708,1449.2957636579963,Matern,2.3940830993396984,0.5595557007185508,1.5,TPESampler,COMPLETE
1779,0.2741901045000706,2025-04-24 21:44:55.913793,2025-04-24 21:44:59.245442,0 days 00:00:03.331649,25.96270789059056,Matern,27.985635218256068,0.08267283546003566,0.5,TPESampler,COMPLETE
1780,0.1726185545819069,2025-04-24 21:44:58.162914,2025-04-24 21:45:03.131708,0 days 00:00:04.968794,24.126774967921527,Matern,0.2711817004056056,0.7242355501491113,1.5,TPESampler,COMPLETE
1781,0.17261855296760278,2025-04-24 21:44:59.311044,2025-04-24 21:45:02.297923,0 days 00:00:02.986879,13.844192411348233,Matern,87.31876069297927,0.042751750385951706,1.5,TPESampler,COMPLETE
1782,0.17261958341875389,2025-04-24 21:44:59.499009,2025-04-24 21:45:06.455691,0 days 00:00:06.956682,16458.478527704472,Matern,8113.65151931676,0.07239137511895309,1.5,TPESampler,COMPLETE
1783,0.17261834432748804,2025-04-24 21:45:02.510426,2025-04-24 21:45:05.943787,0 days 00:00:03.433361,2.744490063923121,Matern,0.6231225362081375,0.020155708121647863,1.5,TPESampler,COMPLETE
1784,0.21064471731873408,2025-04-24 21:45:03.370987,2025-04-24 21:45:06.346112,0 days 00:00:02.975125,43.88716597172916,RBF,88.30399607534584,0.3354140831052431,1.5,TPESampler,COMPLETE
1785,0.1726185837694636,2025-04-24 21:45:06.204283,2025-04-24 21:45:11.241296,0 days 00:00:05.037013,0.42815586041020093,Matern,14.019233433358634,0.24085848451410685,1.5,TPESampler,COMPLETE
1786,0.1726190999647576,2025-04-24 21:45:06.698302,2025-04-24 21:45:13.497035,0 days 00:00:06.798733,4.057332309153163,Matern,84.69472540119651,0.5818289460418311,1.5,TPESampler,COMPLETE
1787,0.17261916155620363,2025-04-24 21:45:06.798033,2025-04-24 21:45:13.202462,0 days 00:00:06.404429,1.6468056837602012,Matern,14.236362349188521,0.793503583865349,1.5,TPESampler,COMPLETE
1788,0.17261856237390347,2025-04-24 21:45:11.483025,2025-04-24 21:45:15.297705,0 days 00:00:03.814680,14.03043332677809,Matern,4.804011252835565,0.3166711015267231,1.5,TPESampler,COMPLETE
1789,0.17261855845970933,2025-04-24 21:45:13.453999,2025-04-24 21:45:16.563721,0 days 00:00:03.109722,2357.3513946900193,Matern,10134.409822289244,0.03842831139500773,1.5,TPESampler,COMPLETE
1790,1.3677569516626098,2025-04-24 21:45:13.746308,2025-04-24 21:45:18.264455,0 days 00:00:04.518147,0.0003715237727625293,RBF,42689.137607100405,0.0037209574332493444,2.5,TPESampler,COMPLETE
1791,0.17261855294206793,2025-04-24 21:45:15.507690,2025-04-24 21:45:20.356840,0 days 00:00:04.849150,155.39681333013732,Matern,9557.41412098984,0.968271214148671,1.5,TPESampler,COMPLETE
1792,0.17261836065144867,2025-04-24 21:45:16.804322,2025-04-24 21:45:20.989727,0 days 00:00:04.185405,0.8691542368423476,Matern,775.7133933175076,0.05404458569106613,1.5,TPESampler,COMPLETE
1793,1.3677569515661536,2025-04-24 21:45:18.492017,2025-04-24 21:45:21.670217,0 days 00:00:03.178200,1.7204373437920422,Matern,36136.42468429657,0.9330571500350558,1.5,TPESampler,COMPLETE
1794,0.17261855615120691,2025-04-24 21:45:20.616014,2025-04-24 21:45:24.196770,0 days 00:00:03.580756,11.894168506602512,Matern,7.697399164375562,0.28232959403788094,1.5,TPESampler,COMPLETE
1795,0.17261822870675939,2025-04-24 21:45:21.213494,2025-04-24 21:45:26.025643,0 days 00:00:04.812149,569.5785476456994,Matern,1473.5764931712479,0.5420154393602601,1.5,TPESampler,COMPLETE
1796,0.17261856434400377,2025-04-24 21:45:21.882177,2025-04-24 21:45:26.665073,0 days 00:00:04.782896,460.4644915608762,Matern,65.6834997080487,0.5208290468269194,1.5,TPESampler,COMPLETE
1797,0.1726184789011474,2025-04-24 21:45:24.445282,2025-04-24 21:45:28.408242,0 days 00:00:03.962960,72.93541922434979,Matern,8.448997206223472,0.7848322991416922,1.5,TPESampler,COMPLETE
1798,0.17261834693423242,2025-04-24 21:45:26.261743,2025-04-24 21:45:29.582620,0 days 00:00:03.320877,5451.486902474846,Matern,6.59904908488683,0.0128846857480759,1.5,TPESampler,COMPLETE
1799,0.21064312307467378,2025-04-24 21:45:26.899085,2025-04-24 21:45:29.937783,0 days 00:00:03.038698,1.2249948636580368,RBF,1.250050446321979,0.03191348873048298,1.5,TPESampler,COMPLETE
1800,0.1726185547149535,2025-04-24 21:45:28.680022,2025-04-24 21:45:31.795144,0 days 00:00:03.115122,3288.3785457814765,Matern,4062.9485377855176,0.016080116475578686,1.5,TPESampler,COMPLETE
1801,0.17261855177543067,2025-04-24 21:45:29.875331,2025-04-24 21:45:34.734933,0 days 00:00:04.859602,0.298825327769828,Matern,0.19382262658721178,0.2527929463072657,1.5,TPESampler,COMPLETE
1802,1.33075185409883,2025-04-24 21:45:30.178181,2025-04-24 21:45:32.796974,0 days 00:00:02.618793,363.2300075872304,RBF,2.229271570897156e-05,0.00022534999280924225,2.5,TPESampler,COMPLETE
1803,0.17261832036194746,2025-04-24 21:45:32.010673,2025-04-24 21:45:35.774212,0 days 00:00:03.763539,50.42283145294601,Matern,882.1239496481667,0.5699078950402938,1.5,TPESampler,COMPLETE
1804,0.17261865104801571,2025-04-24 21:45:33.066806,2025-04-24 21:45:38.998314,0 days 00:00:05.931508,0.0012496223176527886,Matern,0.5176316620525713,0.3854022962772602,1.5,TPESampler,COMPLETE
1805,1.3307518540988275,2025-04-24 21:45:35.003822,2025-04-24 21:45:40.330942,0 days 00:00:05.327120,319.99683313210124,Matern,93766.33867780735,0.04320495650758218,1.5,TPESampler,COMPLETE
1806,0.17261854536237328,2025-04-24 21:45:36.030687,2025-04-24 21:45:39.082629,0 days 00:00:03.051942,2250.0477902398397,Matern,32.96803654741148,0.03310523042290256,1.5,TPESampler,COMPLETE
1807,0.17261855047075825,2025-04-24 21:45:39.172442,2025-04-24 21:45:42.302636,0 days 00:00:03.130194,5699.210100329612,Matern,15203.875738534482,0.7339477658590958,1.5,TPESampler,COMPLETE
1808,1.3307518541032948,2025-04-24 21:45:39.317598,2025-04-24 21:45:43.915771,0 days 00:00:04.598173,0.6501388638614437,Matern,1541.6525595192793,0.010270032582300715,1.5,TPESampler,COMPLETE
1809,0.1726185457001126,2025-04-24 21:45:40.561767,2025-04-24 21:45:43.801176,0 days 00:00:03.239409,4641.081987818346,Matern,207.53361770333066,0.08239572808225279,1.5,TPESampler,COMPLETE
1810,0.17261873491092702,2025-04-24 21:45:42.526489,2025-04-24 21:45:46.731307,0 days 00:00:04.204818,20.637341740552596,Matern,1176.140964500494,0.02137992632081414,1.5,TPESampler,COMPLETE
1811,0.17261854789215442,2025-04-24 21:45:43.997385,2025-04-24 21:45:47.276735,0 days 00:00:03.279350,31.087441308755118,Matern,21.209459510260928,0.00144374587959487,1.5,TPESampler,COMPLETE
1812,0.1726185823615429,2025-04-24 21:45:44.145746,2025-04-24 21:45:47.273397,0 days 00:00:03.127651,88322.8588606807,Matern,15.722484532162339,0.02270818931205565,1.5,TPESampler,COMPLETE
1813,1.3307518540974084,2025-04-24 21:45:46.997612,2025-04-24 21:45:50.095186,0 days 00:00:03.097574,0.23247430894755033,RBF,1.0532674686893138e-05,6.95633164761922e-08,0.5,TPESampler,COMPLETE
1814,0.17261852907702088,2025-04-24 21:45:47.559666,2025-04-24 21:45:51.406449,0 days 00:00:03.846783,0.8352029326041743,Matern,0.9527181189176408,0.7747313282421137,1.5,TPESampler,COMPLETE
1815,0.27419009962382884,2025-04-24 21:45:47.604721,2025-04-24 21:45:51.444520,0 days 00:00:03.839799,1691.493193582361,Matern,0.631122762461693,0.5867591654358579,0.5,TPESampler,COMPLETE
1816,0.17261866314353186,2025-04-24 21:45:50.325785,2025-04-24 21:45:55.863739,0 days 00:00:05.537954,3266.120645663917,Matern,13.760740938009796,0.9460506873848885,1.5,TPESampler,COMPLETE
1817,0.17261855638650064,2025-04-24 21:45:51.616298,2025-04-24 21:45:54.758754,0 days 00:00:03.142456,366.07376009476377,Matern,773.0396883277731,0.01926178409153135,1.5,TPESampler,COMPLETE
1818,0.21064471272209281,2025-04-24 21:45:51.656982,2025-04-24 21:45:55.347548,0 days 00:00:03.690566,0.04164916844115481,RBF,38.357610296606545,0.38733402756311336,1.5,TPESampler,COMPLETE
1819,0.17261837822258064,2025-04-24 21:45:54.978717,2025-04-24 21:45:59.472176,0 days 00:00:04.493459,11422.944978951306,Matern,1741.8347409728729,0.01883198379458903,1.5,TPESampler,COMPLETE
1820,0.1726185694373667,2025-04-24 21:45:55.580142,2025-04-24 21:45:58.837060,0 days 00:00:03.256918,15.227412567995561,Matern,335.01561061123977,0.0320835354731186,1.5,TPESampler,COMPLETE
1821,0.1726199826813683,2025-04-24 21:45:56.133917,2025-04-24 21:46:01.221401,0 days 00:00:05.087484,12365.659813807368,Matern,6306.652059443321,0.04440121655689843,1.5,TPESampler,COMPLETE
1822,0.17261844043177152,2025-04-24 21:45:59.086801,2025-04-24 21:46:02.310813,0 days 00:00:03.224012,4362.961003694781,Matern,399.1259907175547,0.04448535536082043,1.5,TPESampler,COMPLETE
1823,0.2221140204913961,2025-04-24 21:45:59.717846,2025-04-24 21:46:02.468708,0 days 00:00:02.750862,17.057186701505017,Matern,307.4355717027216,0.015695398257692054,2.5,TPESampler,COMPLETE
1824,1.3307518540987842,2025-04-24 21:46:01.467206,2025-04-24 21:46:06.431155,0 days 00:00:04.963949,0.2538993156091297,Matern,838.3901349459597,0.01547737447306607,1.5,TPESampler,COMPLETE
1825,0.17261854708310168,2025-04-24 21:46:02.553330,2025-04-24 21:46:06.304150,0 days 00:00:03.750820,8243.583573924343,Matern,69.89727409609883,0.9810943145380526,1.5,TPESampler,COMPLETE
1826,1.330751854098856,2025-04-24 21:46:02.741932,2025-04-24 21:46:08.270153,0 days 00:00:05.528221,256.3982935909906,Matern,83698.66773503652,0.04467504586373368,1.5,TPESampler,COMPLETE
1827,0.27419011560727535,2025-04-24 21:46:06.502684,2025-04-24 21:46:10.163714,0 days 00:00:03.661030,3076.1332467786137,Matern,15049.812434309602,0.9068499406732511,0.5,TPESampler,COMPLETE
1828,0.172618543985375,2025-04-24 21:46:06.702592,2025-04-24 21:46:13.354849,0 days 00:00:06.652257,19.666985244733358,Matern,68.711494519081,0.5429091744804202,1.5,TPESampler,COMPLETE
1829,0.172618555448642,2025-04-24 21:46:08.531072,2025-04-24 21:46:11.791455,0 days 00:00:03.260383,89824.77528423343,Matern,6200.143972397178,0.02373005933173672,1.5,TPESampler,COMPLETE
1830,0.1726172824958472,2025-04-24 21:46:10.397299,2025-04-24 21:46:18.203052,0 days 00:00:07.805753,38.40165543826395,Matern,7149.11494147393,0.8177282151657268,1.5,TPESampler,COMPLETE
1831,0.17261862883786164,2025-04-24 21:46:12.022648,2025-04-24 21:46:16.258321,0 days 00:00:04.235673,169.04287058710685,Matern,15.66873233143263,0.002448664244590841,1.5,TPESampler,COMPLETE
