number,value,datetime_start,datetime_complete,duration,params_constant_value,params_kernel_type,params_length_scale,params_noise_level,params_nu,system_attrs_auto:sampler,state
344,1.3677557974468484,2025-04-24 21:07:40.536819,2025-04-24 21:07:42.646524,0 days 00:00:02.109705,5.692285253142454e-07,RBF,0.364075624852921,0.266899096243067,1.5,TPESampler,COMPLETE
345,0.17261854633738843,2025-04-24 21:07:42.861025,2025-04-24 21:07:46.063238,0 days 00:00:03.202213,1079.222517820511,Matern,1170.9594379400346,0.0328547085325808,1.5,TPESampler,COMPLETE
346,1.330751854098826,2025-04-24 21:07:44.035526,2025-04-24 21:07:46.974347,0 days 00:00:02.938821,0.4793668991281972,RBF,0.00016484953245469777,2.9191653131673633e-06,2.5,TPESampler,COMPLETE
347,0.2741901003678454,2025-04-24 21:07:45.965127,2025-04-24 21:07:49.603342,0 days 00:00:03.638215,76585.71144038021,Matern,13547.32856262958,3.481620628207851e-05,0.5,TPESampler,COMPLETE
348,0.17261720088109378,2025-04-24 21:07:46.405961,2025-04-24 21:07:49.742357,0 days 00:00:03.336396,450.64629440855776,Matern,470.6668401345915,0.057526026417967904,1.5,TPESampler,COMPLETE
349,0.1726188945559753,2025-04-24 21:07:47.224160,2025-04-24 21:07:50.911162,0 days 00:00:03.687002,212.66599426007403,Matern,2348.9890367102093,0.7018353106402608,1.5,TPESampler,COMPLETE
350,0.21064487458015746,2025-04-24 21:07:49.811534,2025-04-24 21:07:53.612475,0 days 00:00:03.800941,33.26670306505472,RBF,5942.988217295568,0.15700025860347167,1.5,TPESampler,COMPLETE
351,0.17261680934179255,2025-04-24 21:07:49.911957,2025-04-24 21:07:53.675425,0 days 00:00:03.763468,2809.6758995193536,Matern,430.01029877550457,0.01260025507395888,1.5,TPESampler,COMPLETE
352,0.17261860557714612,2025-04-24 21:07:51.151653,2025-04-24 21:07:55.046148,0 days 00:00:03.894495,110.13346392624665,Matern,144.58494192832003,0.010069155850226448,1.5,TPESampler,COMPLETE
353,1.3676775705391455,2025-04-24 21:07:53.781073,2025-04-24 21:07:56.403615,0 days 00:00:02.622542,7.517698987779459e-06,RBF,0.003924639589245674,5.505392208888631e-05,0.5,TPESampler,COMPLETE
354,0.1726185593473199,2025-04-24 21:07:53.863229,2025-04-24 21:07:57.249613,0 days 00:00:03.386384,2754.0306502463895,Matern,183.73340151766695,0.01234706589055615,1.5,TPESampler,COMPLETE
355,0.17261853645929376,2025-04-24 21:07:55.287713,2025-04-24 21:08:01.430037,0 days 00:00:06.142324,551.8138072829618,Matern,1634.14496966189,0.03405271229293906,1.5,TPESampler,COMPLETE
356,1.3677569494359265,2025-04-24 21:07:56.627059,2025-04-24 21:08:01.081444,0 days 00:00:04.454385,0.08215017833848237,Matern,27614.925190075817,0.011949384455350301,1.5,TPESampler,COMPLETE
357,0.27419010601590255,2025-04-24 21:07:57.470748,2025-04-24 21:08:00.982065,0 days 00:00:03.511317,59979.41379627417,Matern,39255.135039512614,0.25658906870965703,0.5,TPESampler,COMPLETE
358,0.17261832137033406,2025-04-24 21:08:01.153473,2025-04-24 21:08:05.202392,0 days 00:00:04.048919,1134.754685483585,Matern,1936.5183989725624,0.6660728819217918,1.5,TPESampler,COMPLETE
359,0.17261860727263784,2025-04-24 21:08:01.251705,2025-04-24 21:08:09.421392,0 days 00:00:08.169687,150.68098939606236,Matern,927.5862758711592,0.014719374346974326,1.5,TPESampler,COMPLETE
360,0.17261848140160604,2025-04-24 21:08:01.666161,2025-04-24 21:08:05.491543,0 days 00:00:03.825382,288.01084923786175,Matern,697.4573893883638,0.39007921746375707,1.5,TPESampler,COMPLETE
361,0.1726187436477252,2025-04-24 21:08:05.418692,2025-04-24 21:08:10.694329,0 days 00:00:05.275637,26147.008983582473,Matern,37.137643989983836,0.009676573902773055,1.5,TPESampler,COMPLETE
362,1.3307518540987944,2025-04-24 21:08:05.736487,2025-04-24 21:08:15.493054,0 days 00:00:09.756567,2.301704358794964e-06,Matern,0.012242808449891424,0.0012921631478348206,1.5,TPESampler,COMPLETE
363,0.17261882455445926,2025-04-24 21:08:09.890978,2025-04-24 21:08:15.761337,0 days 00:00:05.870359,141.3359710700601,Matern,1436.7592597425732,0.03217835973004067,1.5,TPESampler,COMPLETE
364,0.1726185557405348,2025-04-24 21:08:11.171266,2025-04-24 21:08:18.068331,0 days 00:00:06.897065,4469.367904017988,Matern,954.6346100607115,0.0012608349127282647,1.5,TPESampler,COMPLETE
365,0.17261855406550478,2025-04-24 21:08:15.703689,2025-04-24 21:08:18.929131,0 days 00:00:03.225442,660.5940823377721,Matern,829.2618975498932,0.3894692162865886,1.5,TPESampler,COMPLETE
366,0.21064270596059925,2025-04-24 21:08:16.026684,2025-04-24 21:08:19.690372,0 days 00:00:03.663688,5648.9977669553855,RBF,111.18723600407723,0.49285531683631884,2.5,TPESampler,COMPLETE
367,1.3307518540987289,2025-04-24 21:08:18.298775,2025-04-24 21:08:23.052605,0 days 00:00:04.753830,43.371700138736685,Matern,62074.19849317056,0.009461795538528993,1.5,TPESampler,COMPLETE
368,0.17261854655485298,2025-04-24 21:08:19.171484,2025-04-24 21:08:24.088437,0 days 00:00:04.916953,66.94633502535841,Matern,6969.562044635878,0.9463290152470468,1.5,TPESampler,COMPLETE
369,0.17261856244226664,2025-04-24 21:08:19.895805,2025-04-24 21:08:23.611204,0 days 00:00:03.715399,409.51645603360566,Matern,7580.174449802924,0.9137320066272847,1.5,TPESampler,COMPLETE
370,0.17261833177161687,2025-04-24 21:08:23.297482,2025-04-24 21:08:31.929987,0 days 00:00:08.632505,7.751135130224573e-05,Matern,0.5488210545278401,0.3217573853994316,1.5,TPESampler,COMPLETE
371,0.17262011713420142,2025-04-24 21:08:23.832170,2025-04-24 21:08:28.396459,0 days 00:00:04.564289,19443.7484916244,Matern,250.28190357211565,0.0053283336694396315,1.5,TPESampler,COMPLETE
372,0.17261878904064792,2025-04-24 21:08:24.293468,2025-04-24 21:08:28.231936,0 days 00:00:03.938468,47.3681468117295,Matern,13.468754813672605,0.0005046186936816336,1.5,TPESampler,COMPLETE
373,0.17261854458350734,2025-04-24 21:08:28.423193,2025-04-24 21:08:31.771205,0 days 00:00:03.348012,776.443756044352,Matern,1473.419391391693,0.9598634773804334,1.5,TPESampler,COMPLETE
374,0.17261855564201267,2025-04-24 21:08:28.647863,2025-04-24 21:08:32.598929,0 days 00:00:03.951066,52.573399127292994,Matern,1338.4105956467563,0.01740510503764176,1.5,TPESampler,COMPLETE
375,0.17261854585802425,2025-04-24 21:08:31.991067,2025-04-24 21:08:35.324058,0 days 00:00:03.332991,194.60275209310927,Matern,281.6366487051196,0.03520785797491634,1.5,TPESampler,COMPLETE
376,1.330751854097863,2025-04-24 21:08:32.194812,2025-04-24 21:08:36.415549,0 days 00:00:04.220737,1.0921914715626906,Matern,221.61558644655844,0.0007973942024487506,1.5,TPESampler,COMPLETE
377,0.17261863650725404,2025-04-24 21:08:32.827650,2025-04-24 21:08:37.031381,0 days 00:00:04.203731,0.0034083798851646373,Matern,1.9836717135575819,0.0039250092993433775,1.5,TPESampler,COMPLETE
378,0.21064474055245463,2025-04-24 21:08:35.543397,2025-04-24 21:08:45.611539,0 days 00:00:10.068142,2.37223471462791e-06,RBF,41.74627008065957,0.1872566284422275,2.5,TPESampler,COMPLETE
379,1.3307518540980363,2025-04-24 21:08:36.629584,2025-04-24 21:08:43.917160,0 days 00:00:07.287576,1.7280969074091623e-05,RBF,14823.898458559463,1.4085749936474222e-10,2.5,TPESampler,COMPLETE
380,1.367756005781552,2025-04-24 21:08:37.239866,2025-04-24 21:08:39.684632,0 days 00:00:02.444766,17336.31992620334,RBF,0.025182272873505572,3.4144061434790766e-06,0.5,TPESampler,COMPLETE
381,0.21064426095581307,2025-04-24 21:08:39.907634,2025-04-24 21:08:42.739959,0 days 00:00:02.832325,7398.650818407803,RBF,1.2559727859711922,0.0038967298602421148,1.5,TPESampler,COMPLETE
382,1.3677550920963164,2025-04-24 21:08:42.960628,2025-04-24 21:08:45.213853,0 days 00:00:02.253225,1.9177298684875762e-05,Matern,0.0004603153623344115,0.16104664551997602,0.5,TPESampler,COMPLETE
383,0.17261861941667134,2025-04-24 21:08:44.133065,2025-04-24 21:08:47.238399,0 days 00:00:03.105334,17155.747525072235,Matern,474.48700196989995,0.00647766238874536,1.5,TPESampler,COMPLETE
384,1.3307518540987842,2025-04-24 21:08:45.436942,2025-04-24 21:08:49.372527,0 days 00:00:03.935585,739.6380430903866,Matern,36737.74390949863,0.00875724472634049,1.5,TPESampler,COMPLETE
385,1.3307518540987342,2025-04-24 21:08:45.803551,2025-04-24 21:08:52.308029,0 days 00:00:06.504478,0.0030608076123745344,Matern,223.50838047440843,0.002882436245704815,1.5,TPESampler,COMPLETE
386,0.17261856879674642,2025-04-24 21:08:47.476237,2025-04-24 21:08:50.649751,0 days 00:00:03.173514,202.6166551699807,Matern,45.55281237061023,0.02153122663983376,1.5,TPESampler,COMPLETE
387,1.3307518540985062,2025-04-24 21:08:49.603933,2025-04-24 21:08:54.617781,0 days 00:00:05.013848,22001.634841226012,RBF,4766.397069337922,1.4597949989051613e-06,1.5,TPESampler,COMPLETE
388,0.17261857105415176,2025-04-24 21:08:50.875323,2025-04-24 21:08:55.573243,0 days 00:00:04.697920,4783.391945672844,Matern,688.1094560624434,0.4462931249998962,1.5,TPESampler,COMPLETE
389,1.36775695135098,2025-04-24 21:08:52.551807,2025-04-24 21:08:55.599883,0 days 00:00:03.048076,0.245489537237477,Matern,19064.99249448557,0.9916684880871086,1.5,TPESampler,COMPLETE
390,1.3677555363217135,2025-04-24 21:08:54.842770,2025-04-24 21:08:56.504500,0 days 00:00:01.661730,7.188855074989545e-06,Matern,199.30398230964664,0.6372781441763438,2.5,TPESampler,COMPLETE
391,1.330751854097151,2025-04-24 21:08:55.747589,2025-04-24 21:08:58.500802,0 days 00:00:02.753213,0.02540420781110707,RBF,0.002814737146038645,0.007056447947568209,0.5,TPESampler,COMPLETE
392,0.17261857610861733,2025-04-24 21:08:55.806122,2025-04-24 21:08:59.256308,0 days 00:00:03.450186,846.3589510826932,Matern,68142.05446199387,0.21566101428315324,1.5,TPESampler,COMPLETE
393,0.17261854895655754,2025-04-24 21:08:56.732375,2025-04-24 21:09:00.555802,0 days 00:00:03.823427,31.544463238375315,Matern,1517.1323894453528,0.03971151067391884,1.5,TPESampler,COMPLETE
394,0.1726185287767121,2025-04-24 21:08:58.753029,2025-04-24 21:09:04.202013,0 days 00:00:05.448984,105.30536190820511,Matern,43963.73676158338,0.9082593849925474,1.5,TPESampler,COMPLETE
395,0.22211467727562745,2025-04-24 21:08:59.488206,2025-04-24 21:09:02.446947,0 days 00:00:02.958741,239.96758096981893,Matern,2.0297283191959186,0.0039333269785770154,2.5,TPESampler,COMPLETE
396,0.17261867951437793,2025-04-24 21:09:01.136633,2025-04-24 21:09:08.601696,0 days 00:00:07.465063,0.0009563143385852234,Matern,16.14169381846595,0.6298323917318861,1.5,TPESampler,COMPLETE
397,0.21064468545864454,2025-04-24 21:09:02.678908,2025-04-24 21:09:06.358534,0 days 00:00:03.679626,694.6480754084836,RBF,2806.29993708824,0.5354144849645425,1.5,TPESampler,COMPLETE
398,0.22211471703216992,2025-04-24 21:09:04.444668,2025-04-24 21:09:07.561222,0 days 00:00:03.116554,35687.654469002126,Matern,281.69110679598975,0.037665844338467286,2.5,TPESampler,COMPLETE
399,1.3307518540987935,2025-04-24 21:09:06.572646,2025-04-24 21:09:12.087320,0 days 00:00:05.514674,0.0002449087351338057,Matern,23271.95213332474,3.7783544327432502e-06,1.5,TPESampler,COMPLETE
400,0.17261804907740083,2025-04-24 21:09:07.974296,2025-04-24 21:09:12.006897,0 days 00:00:04.032601,2.0607996012476555,Matern,347.170973666109,0.011319796221258595,1.5,TPESampler,COMPLETE
401,0.21064507657439163,2025-04-24 21:09:08.840443,2025-04-24 21:09:11.879560,0 days 00:00:03.039117,4015.2369723178235,RBF,157.5196124259688,0.0007948792329372694,1.5,TPESampler,COMPLETE
402,1.3307518540996608,2025-04-24 21:09:12.060426,2025-04-24 21:09:20.193357,0 days 00:00:08.132931,0.002894085933105229,Matern,0.0197236696541632,0.00026998823706445425,2.5,TPESampler,COMPLETE
403,1.3307518540988659,2025-04-24 21:09:12.172157,2025-04-24 21:09:18.072465,0 days 00:00:05.900308,9034.082748945595,RBF,0.0008188234446249493,0.022730158261741136,0.5,TPESampler,COMPLETE
404,0.17261852791285878,2025-04-24 21:09:12.269387,2025-04-24 21:09:21.404232,0 days 00:00:09.134845,72.53801250830318,Matern,77.7433671211638,0.008164435938145297,1.5,TPESampler,COMPLETE
405,0.21064439097267335,2025-04-24 21:09:18.672066,2025-04-24 21:09:22.717219,0 days 00:00:04.045153,37792.50302556903,RBF,37278.973751547725,0.1595328688794039,0.5,TPESampler,COMPLETE
406,0.17261901564700924,2025-04-24 21:09:20.432911,2025-04-24 21:09:24.038280,0 days 00:00:03.605369,0.011206007518403735,Matern,0.15744768175361387,0.004659945535982203,1.5,TPESampler,COMPLETE
407,0.17261840162144595,2025-04-24 21:09:21.619783,2025-04-24 21:09:25.037862,0 days 00:00:03.418079,2200.602079470973,Matern,421.34763797264196,0.05080424029099121,1.5,TPESampler,COMPLETE
408,0.17261854999172124,2025-04-24 21:09:22.940850,2025-04-24 21:09:26.771228,0 days 00:00:03.830378,50324.181949694736,Matern,19327.158467233105,0.004246864925556294,1.5,TPESampler,COMPLETE
409,0.17261851754878915,2025-04-24 21:09:24.254654,2025-04-24 21:09:27.977446,0 days 00:00:03.722792,8219.823719923363,Matern,497.74347495268677,0.8007700999920158,1.5,TPESampler,COMPLETE
410,0.27419013985531254,2025-04-24 21:09:25.285512,2025-04-24 21:09:28.628852,0 days 00:00:03.343340,45760.405895177304,Matern,164.92730085554084,0.9515291308217977,0.5,TPESampler,COMPLETE
411,0.17261855225206046,2025-04-24 21:09:27.026501,2025-04-24 21:09:30.127506,0 days 00:00:03.101005,138.5463361798535,Matern,1320.3823930898739,0.012046191842847685,1.5,TPESampler,COMPLETE
412,0.17261850011469235,2025-04-24 21:09:28.218390,2025-04-24 21:09:31.147773,0 days 00:00:02.929383,4.1658223836116335,Matern,3.582467644263094,0.0037482986462598978,1.5,TPESampler,COMPLETE
413,0.17261855304060827,2025-04-24 21:09:28.850246,2025-04-24 21:09:33.103090,0 days 00:00:04.252844,2.1538532702240736,Matern,1045.2889280619413,0.10280657741574305,1.5,TPESampler,COMPLETE
414,0.17261855315673277,2025-04-24 21:09:30.367223,2025-04-24 21:09:35.783473,0 days 00:00:05.416250,145.54693019434183,Matern,32204.196247798332,0.8350936254975231,1.5,TPESampler,COMPLETE
415,1.3307517323372666,2025-04-24 21:09:31.381507,2025-04-24 21:09:33.753971,0 days 00:00:02.372464,9.285626659750921,Matern,0.09351769341275386,7.826466506271988e-07,1.5,TPESampler,COMPLETE
416,0.17261854015652872,2025-04-24 21:09:33.341440,2025-04-24 21:09:37.089406,0 days 00:00:03.747966,1424.0288677780193,Matern,547.968110210415,6.141994766012645e-05,1.5,TPESampler,COMPLETE
417,0.17261856920594146,2025-04-24 21:09:33.971367,2025-04-24 21:09:37.901972,0 days 00:00:03.930605,1569.2263305137337,Matern,14.195785903556791,0.010864165351340181,1.5,TPESampler,COMPLETE
418,0.17262042595284596,2025-04-24 21:09:36.003119,2025-04-24 21:09:38.910917,0 days 00:00:02.907798,96831.90135395253,Matern,208.85367150072622,0.006832220703238718,1.5,TPESampler,COMPLETE
419,1.330751854098947,2025-04-24 21:09:37.326657,2025-04-24 21:09:40.960569,0 days 00:00:03.633912,81781.17692987566,RBF,13101.911953725197,0.0017933483513204501,1.5,TPESampler,COMPLETE
420,0.2741900719614761,2025-04-24 21:09:38.149017,2025-04-24 21:09:42.146491,0 days 00:00:03.997474,959.1397816824473,Matern,7.029973153874827,0.003226736419883696,0.5,TPESampler,COMPLETE
421,1.330751854098644,2025-04-24 21:09:39.155897,2025-04-24 21:09:47.290234,0 days 00:00:08.134337,0.00016882251651833137,Matern,275.610614153173,0.008804632037462037,1.5,TPESampler,COMPLETE
422,0.17261909275379742,2025-04-24 21:09:41.187916,2025-04-24 21:09:45.025186,0 days 00:00:03.837270,23.719723956488494,Matern,1441.0181105880192,0.3614652162876123,1.5,TPESampler,COMPLETE
423,0.17261855803345305,2025-04-24 21:09:42.392061,2025-04-24 21:09:46.460222,0 days 00:00:04.068161,76.81116804272911,Matern,4529.055764814437,0.9799715549258324,1.5,TPESampler,COMPLETE
424,0.1726185392296293,2025-04-24 21:09:45.715197,2025-04-24 21:09:51.673986,0 days 00:00:05.958789,0.005647673413070604,Matern,0.23448386204076488,4.6537044877896655e-10,1.5,TPESampler,COMPLETE
425,1.3307518540987995,2025-04-24 21:09:46.676293,2025-04-24 21:09:49.261127,0 days 00:00:02.584834,1.6204626277241674,RBF,0.03443699370432564,1.7561919986957382e-10,2.5,TPESampler,COMPLETE
426,0.17261859038827776,2025-04-24 21:09:47.530669,2025-04-24 21:09:51.043276,0 days 00:00:03.512607,66995.18694527425,Matern,3585.7312144753837,0.7331087552798038,1.5,TPESampler,COMPLETE
427,0.21064465355466772,2025-04-24 21:09:49.480415,2025-04-24 21:09:53.793080,0 days 00:00:04.312665,5.420670043387794,RBF,0.42260837414967783,3.431669425689802e-06,2.5,TPESampler,COMPLETE
428,1.3677569516109063,2025-04-24 21:09:51.276543,2025-04-24 21:09:55.696155,0 days 00:00:04.419612,0.052052203414935536,Matern,42365.05464214162,0.008101088278999283,2.5,TPESampler,COMPLETE
429,1.3676769068620076,2025-04-24 21:09:51.885374,2025-04-24 21:09:54.636974,0 days 00:00:02.751600,8.616878415277333e-05,Matern,73274.20928760723,8.222297184031646e-05,0.5,TPESampler,COMPLETE
430,1.3307518540973273,2025-04-24 21:09:54.031583,2025-04-24 21:09:59.367387,0 days 00:00:05.335804,3.461197505793449e-06,Matern,39.53346582975253,5.697514793819241e-05,2.5,TPESampler,COMPLETE
431,1.330751854098475,2025-04-24 21:09:54.876702,2025-04-24 21:09:59.443705,0 days 00:00:04.567003,0.030923549151886682,Matern,9.492582079272658,8.250895749383622e-05,1.5,TPESampler,COMPLETE
432,1.330751854109819,2025-04-24 21:09:55.939494,2025-04-24 21:10:03.902537,0 days 00:00:07.963043,1.614200454450349e-06,RBF,312.6887755090548,1.4150855083141894e-07,2.5,TPESampler,COMPLETE
433,0.17261854955608094,2025-04-24 21:09:59.565488,2025-04-24 21:10:04.067760,0 days 00:00:04.502272,0.0011646791893470956,Matern,87.87305637391347,0.0818233678216809,1.5,TPESampler,COMPLETE
434,1.3307518541006726,2025-04-24 21:09:59.651568,2025-04-24 21:10:05.060883,0 days 00:00:05.409315,0.002664765729163717,Matern,27.848490535854683,0.04775925048109051,1.5,TPESampler,COMPLETE
435,0.1726185345642474,2025-04-24 21:10:04.094175,2025-04-24 21:10:10.520733,0 days 00:00:06.426558,140.51078300858777,Matern,193.1505733754139,0.10146739028636638,1.5,TPESampler,COMPLETE
436,0.17261829015701816,2025-04-24 21:10:04.304568,2025-04-24 21:10:11.314289,0 days 00:00:07.009721,204.8223071216382,Matern,221.0625855575831,0.5866790705128487,1.5,TPESampler,COMPLETE
437,0.172618637471469,2025-04-24 21:10:05.288956,2025-04-24 21:10:08.512926,0 days 00:00:03.223970,30.098697508580095,Matern,34.94033130611089,0.00140552237099165,1.5,TPESampler,COMPLETE
438,1.3307518540986034,2025-04-24 21:10:08.736621,2025-04-24 21:10:14.882240,0 days 00:00:06.145619,4.73175901643704,Matern,87773.21184968812,0.0006904046054800533,1.5,TPESampler,COMPLETE
439,1.3307518540988057,2025-04-24 21:10:10.738927,2025-04-24 21:10:15.980411,0 days 00:00:05.241484,165.5946279134895,Matern,27766.513918882203,0.01411981956392938,1.5,TPESampler,COMPLETE
440,0.1726182420308789,2025-04-24 21:10:11.539420,2025-04-24 21:10:15.457850,0 days 00:00:03.918430,4267.869962697833,Matern,8.992444628608208,0.6215414947626385,1.5,TPESampler,COMPLETE
441,0.1726185684810042,2025-04-24 21:10:15.109384,2025-04-24 21:10:18.191048,0 days 00:00:03.081664,425.3268328174152,Matern,165.7554116056139,0.039483016871006346,1.5,TPESampler,COMPLETE
442,0.1726186021247973,2025-04-24 21:10:15.656815,2025-04-24 21:10:19.378282,0 days 00:00:03.721467,29605.599621647645,Matern,2.224077664233984,0.2562693959805867,1.5,TPESampler,COMPLETE
443,0.17261855060855402,2025-04-24 21:10:16.194417,2025-04-24 21:10:21.779240,0 days 00:00:05.584823,0.0018616376341987072,Matern,0.5848920889815743,0.7132971376024952,1.5,TPESampler,COMPLETE
444,0.17261856050056804,2025-04-24 21:10:18.407649,2025-04-24 21:10:25.706008,0 days 00:00:07.298359,6349.672132230265,Matern,55.13167995668027,0.48245210108182146,1.5,TPESampler,COMPLETE
445,0.17261855775307441,2025-04-24 21:10:19.620783,2025-04-24 21:10:22.904520,0 days 00:00:03.283737,224.57054755848412,Matern,104.89757606768268,0.16794803458380841,1.5,TPESampler,COMPLETE
446,0.1726179740594807,2025-04-24 21:10:21.992174,2025-04-24 21:10:29.064775,0 days 00:00:07.072601,2245.077460302701,Matern,36.96154930105861,0.04063777392102869,1.5,TPESampler,COMPLETE
447,1.3307518540992147,2025-04-24 21:10:23.132818,2025-04-24 21:10:26.606988,0 days 00:00:03.474170,0.015623836370426759,Matern,0.0006110833295178834,4.0111411494448066e-07,2.5,TPESampler,COMPLETE
448,0.17261853307161243,2025-04-24 21:10:25.960077,2025-04-24 21:10:29.439371,0 days 00:00:03.479294,308.9575949342926,Matern,105.84575637639493,0.4050750407834478,1.5,TPESampler,COMPLETE
449,0.2741900688872881,2025-04-24 21:10:26.893458,2025-04-24 21:10:30.538067,0 days 00:00:03.644609,128.27500634668283,Matern,2251.386860663815,0.37620188503820684,0.5,TPESampler,COMPLETE
450,0.17261854387234052,2025-04-24 21:10:29.278859,2025-04-24 21:10:32.511446,0 days 00:00:03.232587,28941.316381762932,Matern,4.829332073751057,0.13934737354056997,1.5,TPESampler,COMPLETE
451,0.17261828575019372,2025-04-24 21:10:29.681157,2025-04-24 21:10:35.672326,0 days 00:00:05.991169,190.51158311291323,Matern,4.880485240028028,0.9293889116639512,1.5,TPESampler,COMPLETE
452,0.1726184376326599,2025-04-24 21:10:30.748383,2025-04-24 21:10:34.286220,0 days 00:00:03.537837,23542.40549108038,Matern,6.243924185662375,0.7301770337966421,1.5,TPESampler,COMPLETE
453,1.3307518540998007,2025-04-24 21:10:32.751553,2025-04-24 21:10:37.562402,0 days 00:00:04.810849,2986.515519652375,Matern,78745.33183046535,0.025602822417040337,1.5,TPESampler,COMPLETE
454,1.3307518540951915,2025-04-24 21:10:34.532709,2025-04-24 21:10:38.667164,0 days 00:00:04.134455,0.3055480009486065,Matern,525.3767465333334,0.003032388607375391,1.5,TPESampler,COMPLETE
455,1.330751854098862,2025-04-24 21:10:35.929871,2025-04-24 21:10:40.805436,0 days 00:00:04.875565,0.0069547597927461895,RBF,15.237318036118593,0.001562075664459969,1.5,TPESampler,COMPLETE
456,0.17261864295412663,2025-04-24 21:10:37.782729,2025-04-24 21:10:41.297034,0 days 00:00:03.514305,270.3657177776716,Matern,14.32266022322439,0.8929465868042614,1.5,TPESampler,COMPLETE
457,0.172618542454211,2025-04-24 21:10:38.922345,2025-04-24 21:10:42.871223,0 days 00:00:03.948878,249.0569807883848,Matern,12.486334779486944,0.00655745842023363,1.5,TPESampler,COMPLETE
458,0.17261855779526677,2025-04-24 21:10:41.038255,2025-04-24 21:10:44.463387,0 days 00:00:03.425132,1031.2558410521199,Matern,9.480253795984485,0.08409174049068138,1.5,TPESampler,COMPLETE
