number,value,datetime_start,datetime_complete,duration,params_constant_value,params_kernel_type,params_length_scale,params_noise_level,params_nu,system_attrs_auto:sampler,state
1489,0.17261872949261384,2025-04-24 21:37:06.137587,2025-04-24 21:37:11.795561,0 days 00:00:05.657974,72217.54600700694,Matern,60020.17529882399,0.0134877293123804,1.5,TPESampler,COMPLETE
1490,1.3307518541066572,2025-04-24 21:37:08.394520,2025-04-24 21:37:13.003625,0 days 00:00:04.609105,34889.828025341456,Matern,9755.340536605958,3.7688350790009937e-06,1.5,TPESampler,COMPLETE
1491,0.17261929470553053,2025-04-24 21:37:12.043032,2025-04-24 21:37:17.086625,0 days 00:00:05.043593,6.342910327497355e-07,Matern,1.3491309369002062,2.0692951265671296e-10,1.5,TPESampler,COMPLETE
1492,0.17261909811350543,2025-04-24 21:37:13.289843,2025-04-24 21:37:21.133084,0 days 00:00:07.843241,1.8688462871453084,Matern,1458.098488900297,0.52109180114884,1.5,TPESampler,COMPLETE
1493,1.3307518540882846,2025-04-24 21:37:16.378720,2025-04-24 21:37:19.454392,0 days 00:00:03.075672,2043.7796517635948,Matern,18325.30538529574,0.02008006213762725,1.5,TPESampler,COMPLETE
1494,0.17261977305277865,2025-04-24 21:37:17.336509,2025-04-24 21:37:21.394232,0 days 00:00:04.057723,684.8330453400167,Matern,72148.00419826798,0.11218677146369237,1.5,TPESampler,COMPLETE
1495,0.22211464283196844,2025-04-24 21:37:19.673730,2025-04-24 21:37:26.418562,0 days 00:00:06.744832,0.005175516990218627,Matern,0.2949121328310823,1.5800829696302136e-07,2.5,TPESampler,COMPLETE
1496,0.17261821208098643,2025-04-24 21:37:21.336868,2025-04-24 21:37:24.586408,0 days 00:00:03.249540,359.732676965747,Matern,3964.649413483742,0.0796934481788248,1.5,TPESampler,COMPLETE
1497,0.17261862088419883,2025-04-24 21:37:21.659005,2025-04-24 21:37:26.981803,0 days 00:00:05.322798,0.005118605460056535,Matern,0.21802616810102574,1.5810934452316387e-10,1.5,TPESampler,COMPLETE
1498,0.21064469778837003,2025-04-24 21:37:24.823456,2025-04-24 21:37:28.519393,0 days 00:00:03.695937,42490.93661785784,RBF,1260.95030317887,0.03838075569130187,1.5,TPESampler,COMPLETE
1499,1.3307518540993202,2025-04-24 21:37:26.632319,2025-04-24 21:37:36.611188,0 days 00:00:09.978869,1.4998116170937906e-07,Matern,0.012793634353697802,5.319845808842639e-10,1.5,TPESampler,COMPLETE
1500,0.17261852385790105,2025-04-24 21:37:27.213261,2025-04-24 21:37:33.683480,0 days 00:00:06.470219,5016.135098617144,Matern,199.6910720638518,2.5910083158708395e-05,1.5,TPESampler,COMPLETE
1501,1.3307518540946885,2025-04-24 21:37:29.086181,2025-04-24 21:37:37.655710,0 days 00:00:08.569529,4.717560652991591,Matern,1127.836958323139,0.03226538780351393,1.5,TPESampler,COMPLETE
1502,0.17261857559054083,2025-04-24 21:37:34.251822,2025-04-24 21:37:39.963481,0 days 00:00:05.711659,55955.95805944207,Matern,221.1541610886082,0.9879041106858037,1.5,TPESampler,COMPLETE
1503,0.17261856784117613,2025-04-24 21:37:36.858763,2025-04-24 21:37:41.312348,0 days 00:00:04.453585,2.353268646417593e-06,Matern,1.4274501467326028,2.043268233336438e-09,1.5,TPESampler,COMPLETE
1504,0.17261787338277979,2025-04-24 21:37:37.882948,2025-04-24 21:37:44.329253,0 days 00:00:06.446305,0.00018416370252286908,Matern,0.7793247360533438,2.0236624483303878e-08,1.5,TPESampler,COMPLETE
1505,0.2741901069333641,2025-04-24 21:37:40.189819,2025-04-24 21:37:43.767132,0 days 00:00:03.577313,1022.6358958708423,Matern,47304.1000010954,6.57370794671651e-05,0.5,TPESampler,COMPLETE
1506,0.17261861942757686,2025-04-24 21:37:41.560752,2025-04-24 21:37:44.721486,0 days 00:00:03.160734,97645.05095768909,Matern,169.41061196183279,0.01956354524781494,1.5,TPESampler,COMPLETE
1507,1.3307518540986432,2025-04-24 21:37:44.024881,2025-04-24 21:37:48.041661,0 days 00:00:04.016780,9.394194991315068,Matern,4394.757348928244,0.0016805861112389698,1.5,TPESampler,COMPLETE
1508,1.330751854098804,2025-04-24 21:37:44.878604,2025-04-24 21:37:50.554624,0 days 00:00:05.676020,113.20434771855838,Matern,98039.29734324805,0.006902878051644445,1.5,TPESampler,COMPLETE
1509,0.17261872832052422,2025-04-24 21:37:44.938562,2025-04-24 21:37:48.901350,0 days 00:00:03.962788,662.2860140521045,Matern,1110.6952062559776,0.0017260229460038029,1.5,TPESampler,COMPLETE
1510,1.3307518540987628,2025-04-24 21:37:48.287798,2025-04-24 21:37:53.545286,0 days 00:00:05.257488,0.8286964074079359,RBF,564.857257065265,0.026388469331219012,0.5,TPESampler,COMPLETE
1511,0.17261845546645024,2025-04-24 21:37:49.097224,2025-04-24 21:37:58.399828,0 days 00:00:09.302604,0.02358484253346698,Matern,0.1131399595015069,2.8936256834182985e-09,1.5,TPESampler,COMPLETE
1512,0.17261856120944996,2025-04-24 21:37:50.777353,2025-04-24 21:37:53.600738,0 days 00:00:02.823385,427.24006897904434,Matern,1502.2448985926083,0.12759637512808344,1.5,TPESampler,COMPLETE
1513,0.17261848941128002,2025-04-24 21:37:53.727270,2025-04-24 21:37:57.177401,0 days 00:00:03.450131,404.02165219788213,Matern,139.09215841341168,0.08020010130227932,1.5,TPESampler,COMPLETE
1514,0.17261812637104024,2025-04-24 21:37:53.777248,2025-04-24 21:38:00.886495,0 days 00:00:07.109247,1478.178610554806,Matern,317.9848248298024,0.00025198433810169347,1.5,TPESampler,COMPLETE
1515,0.17261535385144314,2025-04-24 21:37:57.432178,2025-04-24 21:38:02.923327,0 days 00:00:05.491149,564.9446031917769,Matern,283.0847494108842,0.7658748518362478,1.5,TPESampler,COMPLETE
1516,0.17262036448232243,2025-04-24 21:37:58.637328,2025-04-24 21:38:01.970295,0 days 00:00:03.332967,3489.9710316571395,Matern,4027.091318081956,0.01187463450601805,1.5,TPESampler,COMPLETE
1517,1.330751854098739,2025-04-24 21:38:01.104451,2025-04-24 21:38:04.611948,0 days 00:00:03.507497,0.40208564996471774,Matern,0.0010548384367479022,1.8086045832351657e-09,2.5,TPESampler,COMPLETE
1518,0.17261853474403369,2025-04-24 21:38:02.212216,2025-04-24 21:38:08.082159,0 days 00:00:05.869943,2.4282684480116465e-05,Matern,0.7656804215834174,2.3593441696891894e-10,1.5,TPESampler,COMPLETE
1519,1.3307518540993202,2025-04-24 21:38:03.146662,2025-04-24 21:38:08.125886,0 days 00:00:04.979224,1.7187720647109078e-06,Matern,0.02651901931160061,6.767500463590869e-08,0.5,TPESampler,COMPLETE
1520,1.3307518540999241,2025-04-24 21:38:04.844621,2025-04-24 21:38:11.330559,0 days 00:00:06.485938,0.004029484433370886,RBF,1.978253140139368e-05,0.6370654985272634,0.5,TPESampler,COMPLETE
1521,0.1726185527893813,2025-04-24 21:38:08.288623,2025-04-24 21:38:11.809202,0 days 00:00:03.520579,1233.312056710499,Matern,19.204243088183713,0.9373346694378993,1.5,TPESampler,COMPLETE
1522,0.17261853199099314,2025-04-24 21:38:08.334710,2025-04-24 21:38:11.871087,0 days 00:00:03.536377,101.75832541420536,Matern,962.6432682447402,0.6999579834418627,1.5,TPESampler,COMPLETE
1523,1.3307518540993202,2025-04-24 21:38:11.572476,2025-04-24 21:38:18.133754,0 days 00:00:06.561278,6.484891725226822e-06,Matern,0.00957218877515362,4.897765423116675e-08,1.5,TPESampler,COMPLETE
1524,1.3307518540991767,2025-04-24 21:38:12.074488,2025-04-24 21:38:16.542943,0 days 00:00:04.468455,0.00041195684611281647,Matern,4.9964267100764674e-05,5.622625282339833e-08,0.5,TPESampler,COMPLETE
1525,0.1726185451659926,2025-04-24 21:38:12.119409,2025-04-24 21:38:17.035946,0 days 00:00:04.916537,3248.1872276220774,Matern,63.317253916934234,0.4422409776081711,1.5,TPESampler,COMPLETE
1526,0.17261868598451197,2025-04-24 21:38:16.916578,2025-04-24 21:38:20.785513,0 days 00:00:03.868935,3517.8805899204217,Matern,48.18030272801862,0.5509268039400091,1.5,TPESampler,COMPLETE
1527,0.1726185738629948,2025-04-24 21:38:17.381859,2025-04-24 21:38:26.347376,0 days 00:00:08.965517,845.6332617385025,Matern,45256.03802498274,0.7569845489226581,1.5,TPESampler,COMPLETE
1528,0.1726185398139166,2025-04-24 21:38:18.353535,2025-04-24 21:38:21.867406,0 days 00:00:03.513871,1094.1305687598401,Matern,111.85372638304052,0.2827246873139284,1.5,TPESampler,COMPLETE
1529,0.17261854688597897,2025-04-24 21:38:21.032205,2025-04-24 21:38:24.160948,0 days 00:00:03.128743,7.908142757291724,Matern,250.41819915027452,0.6090522917129544,1.5,TPESampler,COMPLETE
1530,0.1726185474672018,2025-04-24 21:38:22.077529,2025-04-24 21:38:25.723613,0 days 00:00:03.646084,1171.0686445373021,Matern,1300.1859298263664,0.31209168555364547,1.5,TPESampler,COMPLETE
1531,0.172619708689314,2025-04-24 21:38:24.403373,2025-04-24 21:38:30.887600,0 days 00:00:06.484227,73.70723565355652,Matern,65.98610659684626,0.043289309410763026,1.5,TPESampler,COMPLETE
1532,0.17261855451666872,2025-04-24 21:38:25.979419,2025-04-24 21:38:28.854057,0 days 00:00:02.874638,1263.6142770391502,Matern,278.2286452752289,0.7141311715507696,1.5,TPESampler,COMPLETE
1533,0.1726187100958257,2025-04-24 21:38:26.577781,2025-04-24 21:38:30.261953,0 days 00:00:03.684172,201.79470750511302,Matern,24.934851858458025,0.7516845313560405,1.5,TPESampler,COMPLETE
1534,0.17261857203261027,2025-04-24 21:38:29.105118,2025-04-24 21:38:32.627408,0 days 00:00:03.522290,41.866422591184126,Matern,800.840177955274,0.23755358937597695,1.5,TPESampler,COMPLETE
1535,1.330751854098792,2025-04-24 21:38:30.513127,2025-04-24 21:38:33.633428,0 days 00:00:03.120301,0.00022562108097992574,Matern,6.889394290232586e-05,3.6867089370764784e-08,1.5,TPESampler,COMPLETE
1536,0.172618377885049,2025-04-24 21:38:31.123766,2025-04-24 21:38:36.061989,0 days 00:00:04.938223,3292.426152844447,Matern,2044.4335522023696,0.7280499465063649,1.5,TPESampler,COMPLETE
1537,1.3307518540994894,2025-04-24 21:38:32.870710,2025-04-24 21:38:42.183870,0 days 00:00:09.313160,3.074047354034729e-06,Matern,45991.09198091727,2.038494823190411e-07,2.5,TPESampler,COMPLETE
1538,1.3307518540987944,2025-04-24 21:38:33.834727,2025-04-24 21:38:38.465953,0 days 00:00:04.631226,3.8512349860061885,Matern,0.010471774418402103,0.04616128208404873,1.5,TPESampler,COMPLETE
1539,1.3307518540989371,2025-04-24 21:38:36.497280,2025-04-24 21:38:40.204116,0 days 00:00:03.706836,1247.58390996024,RBF,0.0033083586248015685,7.770570889273325e-08,0.5,TPESampler,COMPLETE
1540,0.17261853808785435,2025-04-24 21:38:38.667575,2025-04-24 21:38:41.703406,0 days 00:00:03.035831,607.4727307529636,Matern,995.7696120889258,0.739928711080699,1.5,TPESampler,COMPLETE
1541,0.1726185529214779,2025-04-24 21:38:40.415433,2025-04-24 21:38:44.479090,0 days 00:00:04.063657,67805.96875245418,Matern,2484.939521054654,0.1844379409687721,1.5,TPESampler,COMPLETE
1542,0.1726181447928497,2025-04-24 21:38:41.932576,2025-04-24 21:38:47.308958,0 days 00:00:05.376382,155.5565384607634,Matern,2826.030571574555,0.5876148658945277,1.5,TPESampler,COMPLETE
1543,0.17261854940178953,2025-04-24 21:38:42.435720,2025-04-24 21:38:45.416167,0 days 00:00:02.980447,987.715599396405,Matern,196.78134015647532,0.03394935655980216,1.5,TPESampler,COMPLETE
1544,1.3307518540970205,2025-04-24 21:38:44.719180,2025-04-24 21:38:54.186886,0 days 00:00:09.467706,1.9147973033603638,Matern,837.7748215743497,0.04250157959671529,1.5,TPESampler,COMPLETE
1545,1.3307518540985888,2025-04-24 21:38:45.637502,2025-04-24 21:38:51.761730,0 days 00:00:06.124228,2.2445798169937883e-06,Matern,0.006821481796249514,0.00659544427427376,2.5,TPESampler,COMPLETE
1546,0.17261863795014035,2025-04-24 21:38:47.581481,2025-04-24 21:38:50.946608,0 days 00:00:03.365127,94394.00095168727,Matern,130.64327764948746,0.25816460474805414,1.5,TPESampler,COMPLETE
1547,0.17261777437623113,2025-04-24 21:38:51.174974,2025-04-24 21:38:55.567185,0 days 00:00:04.392211,203.7556451619875,Matern,28.863017459995806,0.8321933319487944,1.5,TPESampler,COMPLETE
1548,0.17262011531376809,2025-04-24 21:38:51.987825,2025-04-24 21:38:58.079573,0 days 00:00:06.091748,1115.887876689854,Matern,0.9578796874559574,0.9572617186564039,1.5,TPESampler,COMPLETE
1549,1.3307518540993202,2025-04-24 21:38:54.414528,2025-04-24 21:38:59.757547,0 days 00:00:05.343019,4.435001996569423e-07,Matern,0.008632302914895456,6.887398086880612e-10,2.5,TPESampler,COMPLETE
1550,0.2741901062864828,2025-04-24 21:38:55.861866,2025-04-24 21:39:01.483819,0 days 00:00:05.621953,2.153633275172739e-07,Matern,0.07476400720724105,3.5503912459083607e-10,0.5,TPESampler,COMPLETE
1551,0.1726185299295886,2025-04-24 21:38:58.370176,2025-04-24 21:39:02.198931,0 days 00:00:03.828755,36.436259212462666,Matern,48.55113847672298,0.9815466304672557,1.5,TPESampler,COMPLETE
1552,0.1726184758865693,2025-04-24 21:38:59.960835,2025-04-24 21:39:03.920293,0 days 00:00:03.959458,1303.0057044718042,Matern,1944.4419071829504,0.015644137505196345,1.5,TPESampler,COMPLETE
1553,0.17261855386307304,2025-04-24 21:39:01.707899,2025-04-24 21:39:05.293504,0 days 00:00:03.585605,19166.987035431073,Matern,38906.37868618011,0.608779106398519,1.5,TPESampler,COMPLETE
1554,1.3307518540989456,2025-04-24 21:39:02.424201,2025-04-24 21:39:07.461872,0 days 00:00:05.037671,14.35450943129457,Matern,4048.148411958144,0.02512470935494717,1.5,TPESampler,COMPLETE
1555,0.2106450225333548,2025-04-24 21:39:04.141401,2025-04-24 21:39:07.611160,0 days 00:00:03.469759,1702.9817552026377,RBF,36.93981608499252,0.7667845883757507,1.5,TPESampler,COMPLETE
1556,0.17261855255661085,2025-04-24 21:39:05.534025,2025-04-24 21:39:13.651202,0 days 00:00:08.117177,0.003439177274868633,Matern,0.6467873530303411,0.05969376528086297,1.5,TPESampler,COMPLETE
1557,0.17261902952121275,2025-04-24 21:39:07.675034,2025-04-24 21:39:11.373254,0 days 00:00:03.698220,84.38049105479774,Matern,4.907569662013567,0.016911327158185416,1.5,TPESampler,COMPLETE
1558,1.3307518540988272,2025-04-24 21:39:07.865731,2025-04-24 21:39:12.271695,0 days 00:00:04.405964,1.7940328571731163,RBF,223.08096166212326,1.4454203144068403e-08,0.5,TPESampler,COMPLETE
1559,0.17261854175290803,2025-04-24 21:39:11.592034,2025-04-24 21:39:14.792158,0 days 00:00:03.200124,6401.307172512142,Matern,487.5253357269659,0.05481904722423791,1.5,TPESampler,COMPLETE
1560,0.22211476583902848,2025-04-24 21:39:12.521135,2025-04-24 21:39:18.367276,0 days 00:00:05.846141,1100.6550012304212,Matern,70.20300191706967,0.19855327154088917,2.5,TPESampler,COMPLETE
1561,1.367756950852078,2025-04-24 21:39:13.871190,2025-04-24 21:39:17.058232,0 days 00:00:03.187042,120.56885445987831,Matern,93012.75811063653,0.9995578115670072,1.5,TPESampler,COMPLETE
1562,1.330751854098569,2025-04-24 21:39:15.026158,2025-04-24 21:39:20.534159,0 days 00:00:05.508001,3.0752036067687127,Matern,2832.597534787796,0.06125488035807375,1.5,TPESampler,COMPLETE
1563,1.3307518540988048,2025-04-24 21:39:17.333579,2025-04-24 21:39:20.365893,0 days 00:00:03.032314,0.0068286583189719734,Matern,5.02150089139133,0.0005233061646332542,1.5,TPESampler,COMPLETE
1564,0.17261859608619953,2025-04-24 21:39:18.617526,2025-04-24 21:39:21.880657,0 days 00:00:03.263131,72.12741014565543,Matern,689.1046528538973,0.04406638037624693,1.5,TPESampler,COMPLETE
1565,0.17261855397053408,2025-04-24 21:39:20.544036,2025-04-24 21:39:23.821122,0 days 00:00:03.277086,53081.25711210068,Matern,556.1487761933828,0.01921483998178935,1.5,TPESampler,COMPLETE
1566,0.27419007833080977,2025-04-24 21:39:20.763249,2025-04-24 21:39:25.284500,0 days 00:00:04.521251,40967.6348255773,Matern,197.20075041461018,0.004375859701826828,0.5,TPESampler,COMPLETE
1567,0.1726186770615781,2025-04-24 21:39:22.096844,2025-04-24 21:39:25.329192,0 days 00:00:03.232348,66.91227534089415,Matern,336.560660693952,0.8184850208249089,1.5,TPESampler,COMPLETE
1568,0.17261856238043063,2025-04-24 21:39:24.044439,2025-04-24 21:39:27.507383,0 days 00:00:03.462944,47.47134696451027,Matern,54.31184685669918,0.030334811314533094,1.5,TPESampler,COMPLETE
1569,1.3307518541010381,2025-04-24 21:39:25.444648,2025-04-24 21:39:29.670605,0 days 00:00:04.225957,2908.5716902746753,Matern,90082.65191484892,0.004540805755763091,1.5,TPESampler,COMPLETE
1570,0.17261869310124392,2025-04-24 21:39:25.481654,2025-04-24 21:39:30.517548,0 days 00:00:05.035894,2.608777110084354e-07,Matern,0.5667531447942582,1.1178905587128167e-07,1.5,TPESampler,COMPLETE
1571,0.17261849453802267,2025-04-24 21:39:27.733029,2025-04-24 21:39:32.446203,0 days 00:00:04.713174,1112.1633448645075,Matern,1694.8589110725616,0.0063127200173832936,1.5,TPESampler,COMPLETE
1572,0.17261851290165803,2025-04-24 21:39:29.900337,2025-04-24 21:39:34.224870,0 days 00:00:04.324533,673.8644562119035,Matern,4325.990817624808,0.9019651724764839,1.5,TPESampler,COMPLETE
1573,1.3307518541001782,2025-04-24 21:39:30.729718,2025-04-24 21:39:34.985043,0 days 00:00:04.255325,4.312572032838284,Matern,989.5440171348267,0.0009047008443133454,1.5,TPESampler,COMPLETE
1574,0.17261758442273084,2025-04-24 21:39:32.672897,2025-04-24 21:39:38.541727,0 days 00:00:05.868830,1.4103358208620415e-06,Matern,0.08906716203786907,2.1772687346405032e-10,1.5,TPESampler,COMPLETE
1575,1.3307518540987187,2025-04-24 21:39:34.436652,2025-04-24 21:39:37.871740,0 days 00:00:03.435088,44435.85913399571,Matern,4.4602857201451616e-05,0.698154874016206,1.5,TPESampler,COMPLETE
1576,0.17261848362288712,2025-04-24 21:39:35.233352,2025-04-24 21:39:39.436662,0 days 00:00:04.203310,105.34121541057097,Matern,7248.723792866803,0.9226314718702296,1.5,TPESampler,COMPLETE
1577,1.367756951665687,2025-04-24 21:39:38.093386,2025-04-24 21:39:42.344602,0 days 00:00:04.251216,0.6904364009864938,Matern,87780.27116375652,0.03944700840843357,1.5,TPESampler,COMPLETE
1578,0.172617545772815,2025-04-24 21:39:38.774060,2025-04-24 21:39:45.811484,0 days 00:00:07.037424,62386.18211141251,Matern,553.0704165062504,0.8711416432547725,1.5,TPESampler,COMPLETE
1579,0.1726185643758129,2025-04-24 21:39:39.676952,2025-04-24 21:39:42.686188,0 days 00:00:03.009236,1419.457094531987,Matern,409.9599386611624,0.010662216125617291,1.5,TPESampler,COMPLETE
1580,0.17261855323278957,2025-04-24 21:39:42.558152,2025-04-24 21:39:45.363257,0 days 00:00:02.805105,1020.0399720135938,Matern,74.42347194523866,0.02069773238227252,1.5,TPESampler,COMPLETE
1581,0.1726185406985234,2025-04-24 21:39:42.943057,2025-04-24 21:39:46.313820,0 days 00:00:03.370763,2851.6738621663444,Matern,51.36165819788793,0.06580107507622268,1.5,TPESampler,COMPLETE
1582,0.17261887292992537,2025-04-24 21:39:45.613593,2025-04-24 21:39:49.330793,0 days 00:00:03.717200,15.150469222684626,Matern,1.7177260335975126,0.013696409295104822,1.5,TPESampler,COMPLETE
1583,0.17261882801306985,2025-04-24 21:39:46.017795,2025-04-24 21:39:50.441170,0 days 00:00:04.423375,1771.2581060404714,Matern,3016.3905723492385,0.04464614066850358,1.5,TPESampler,COMPLETE
1584,1.3307518540990988,2025-04-24 21:39:46.578659,2025-04-24 21:39:50.393978,0 days 00:00:03.815319,0.4999819483088697,Matern,449.34205180364785,0.011546228120242124,2.5,TPESampler,COMPLETE
1585,1.3677568650002014,2025-04-24 21:39:49.558993,2025-04-24 21:39:53.460938,0 days 00:00:03.901945,2.2168096771821957,Matern,12344.04075942398,0.7825645450787669,1.5,TPESampler,COMPLETE
1586,1.3307518540987984,2025-04-24 21:39:50.577257,2025-04-24 21:39:58.217500,0 days 00:00:07.640243,4.7592265803165097e-07,RBF,3.8651891120443434e-05,4.6067908518029726e-05,0.5,TPESampler,COMPLETE
1587,0.17261840587743577,2025-04-24 21:39:50.623188,2025-04-24 21:39:53.964158,0 days 00:00:03.340970,40.754668357740016,Matern,80.36687595260194,0.015348358843579143,1.5,TPESampler,COMPLETE
1588,0.1726185579049733,2025-04-24 21:39:53.701469,2025-04-24 21:39:58.258787,0 days 00:00:04.557318,536.2444605556313,Matern,2759.2641642701374,0.027483416260308317,1.5,TPESampler,COMPLETE
1589,0.17261854245626407,2025-04-24 21:39:54.186409,2025-04-24 21:39:57.087970,0 days 00:00:02.901561,5542.05609148522,Matern,43.214144471093626,0.0350134826145007,1.5,TPESampler,COMPLETE
1590,0.17261855416724067,2025-04-24 21:39:57.320513,2025-04-24 21:40:00.266285,0 days 00:00:02.945772,56190.64327332394,Matern,3484.9438259276617,0.003599630607368009,1.5,TPESampler,COMPLETE
1591,0.17261852986393494,2025-04-24 21:39:58.399701,2025-04-24 21:40:02.181057,0 days 00:00:03.781356,444.6142502217987,Matern,242.7440561475022,0.8866480551900061,1.5,TPESampler,COMPLETE
1592,0.17261857765213737,2025-04-24 21:39:58.444681,2025-04-24 21:40:02.506855,0 days 00:00:04.062174,84494.45550973434,Matern,9.055403571582634,0.239811060275957,1.5,TPESampler,COMPLETE
1593,1.3307518540997743,2025-04-24 21:40:00.491088,2025-04-24 21:40:03.884087,0 days 00:00:03.392999,85.70239106839205,Matern,2707.0811693461173,0.014110033180572386,1.5,TPESampler,COMPLETE
1594,1.3307518540978052,2025-04-24 21:40:02.425628,2025-04-24 21:40:06.069834,0 days 00:00:03.644206,34.773491320125466,Matern,1068.9330508964906,0.0012103423928508516,1.5,TPESampler,COMPLETE
1595,0.17261861442235296,2025-04-24 21:40:02.793755,2025-04-24 21:40:08.717289,0 days 00:00:05.923534,19.86382647357632,Matern,3.064718607060126,0.07392760992461546,1.5,TPESampler,COMPLETE
1596,0.22211466377146552,2025-04-24 21:40:04.095652,2025-04-24 21:40:07.330701,0 days 00:00:03.235049,65903.20175392435,Matern,71.53792598922337,0.5471246223818294,2.5,TPESampler,COMPLETE
1597,0.17261855232019133,2025-04-24 21:40:06.263961,2025-04-24 21:40:09.122487,0 days 00:00:02.858526,78314.64014553647,Matern,1259.8610322164045,0.0036773448156247044,1.5,TPESampler,COMPLETE
1598,0.1726185590341454,2025-04-24 21:40:07.566934,2025-04-24 21:40:13.106873,0 days 00:00:05.539939,0.003459861718357424,Matern,2.439499401720525,8.322540347407559e-09,1.5,TPESampler,COMPLETE
1599,0.17261854720179826,2025-04-24 21:40:08.982180,2025-04-24 21:40:11.807172,0 days 00:00:02.824992,729.0973105030712,Matern,1503.776825109417,0.023398176167625292,1.5,TPESampler,COMPLETE
1600,0.2106448981752063,2025-04-24 21:40:09.356306,2025-04-24 21:40:15.233216,0 days 00:00:05.876910,5.523968147277242e-07,RBF,0.24455193807722958,1.8447575841927367e-07,1.5,TPESampler,COMPLETE
1601,0.2741900992189276,2025-04-24 21:40:12.025499,2025-04-24 21:40:16.056902,0 days 00:00:04.031403,0.7306215813395774,Matern,1040.4641415066321,0.34484444161929423,0.5,TPESampler,COMPLETE
1602,0.21064513544172048,2025-04-24 21:40:13.352905,2025-04-24 21:40:17.845046,0 days 00:00:04.492141,156.00293731394854,RBF,4218.547250661562,0.062318935512693,1.5,TPESampler,COMPLETE
