number,value,datetime_start,datetime_complete,duration,params_constant_value,params_kernel_type,params_length_scale,params_noise_level,params_nu,system_attrs_auto:sampler,state
1832,0.17261809032602277,2025-04-24 21:46:13.605182,2025-04-24 21:46:19.122719,0 days 00:00:05.517537,46.56516412304431,Matern,1279.4796398688102,0.021754304042791967,1.5,TPESampler,COMPLETE
1833,0.17261749008191327,2025-04-24 21:46:16.474520,2025-04-24 21:46:21.130625,0 days 00:00:04.656105,1551.4998144832687,Matern,413.30520033922846,0.7768982156192569,1.5,TPESampler,COMPLETE
1834,0.1726186422896096,2025-04-24 21:46:18.447544,2025-04-24 21:46:21.734549,0 days 00:00:03.287005,74165.52674482836,Matern,53.34278021174055,0.004098473914136289,1.5,TPESampler,COMPLETE
1835,0.17261855884757646,2025-04-24 21:46:19.368519,2025-04-24 21:46:22.639301,0 days 00:00:03.270782,749.3317055965854,Matern,1.0145950525788043,0.9239478598219993,1.5,TPESampler,COMPLETE
1836,0.17261864232602556,2025-04-24 21:46:21.365486,2025-04-24 21:46:24.318612,0 days 00:00:02.953126,5.576801481527365,Matern,1.65243688593796,0.0014282967300826138,1.5,TPESampler,COMPLETE
1837,1.3307518540810201,2025-04-24 21:46:21.967545,2025-04-24 21:46:24.362932,0 days 00:00:02.395387,9.219957639960784,Matern,7.481120316845672e-05,6.2947317387345685e-09,0.5,TPESampler,COMPLETE
1838,0.17261855112491056,2025-04-24 21:46:22.890424,2025-04-24 21:46:27.640380,0 days 00:00:04.749956,0.5317653876396754,Matern,1342.4272269437502,0.8784221163571789,1.5,TPESampler,COMPLETE
1839,0.17261814580784907,2025-04-24 21:46:24.502874,2025-04-24 21:46:27.684295,0 days 00:00:03.181421,462.3422954099609,Matern,0.7340574428686508,0.015802698140083147,1.5,TPESampler,COMPLETE
1840,0.17261854056891354,2025-04-24 21:46:24.545584,2025-04-24 21:46:27.891387,0 days 00:00:03.345803,1448.687535087338,Matern,618.8580202348851,0.8493096891060034,1.5,TPESampler,COMPLETE
1841,0.1726185491753298,2025-04-24 21:46:27.797996,2025-04-24 21:46:31.115336,0 days 00:00:03.317340,56.32133835180954,Matern,2201.235580444423,0.7339953559871558,1.5,TPESampler,COMPLETE
1842,0.2741901069501731,2025-04-24 21:46:27.845798,2025-04-24 21:46:31.398229,0 days 00:00:03.552431,1008.0261256858639,Matern,41.7478354506118,0.44768469635775443,0.5,TPESampler,COMPLETE
1843,0.17261854974064972,2025-04-24 21:46:28.377697,2025-04-24 21:46:32.928092,0 days 00:00:04.550395,82.32576226276258,Matern,67.31219316345997,0.022863708279586503,1.5,TPESampler,COMPLETE
1844,0.17261918476797924,2025-04-24 21:46:31.330006,2025-04-24 21:46:37.373606,0 days 00:00:06.043600,11830.528316127127,Matern,66676.66297836768,0.8472263235656926,1.5,TPESampler,COMPLETE
1845,1.330751854098274,2025-04-24 21:46:31.649021,2025-04-24 21:46:35.432697,0 days 00:00:03.783676,5208.587631828236,Matern,5508.540062420117,0.00045639823189954184,1.5,TPESampler,COMPLETE
1846,0.17261872303774115,2025-04-24 21:46:33.132962,2025-04-24 21:46:36.299587,0 days 00:00:03.166625,10.831448288495684,Matern,0.8808630894744145,0.8528593393853793,1.5,TPESampler,COMPLETE
1847,0.1726184674165818,2025-04-24 21:46:35.652921,2025-04-24 21:46:39.770930,0 days 00:00:04.118009,524.9636525934346,Matern,25.170950828244063,0.010922770345928305,1.5,TPESampler,COMPLETE
1848,1.3307518540988106,2025-04-24 21:46:36.567267,2025-04-24 21:46:44.019887,0 days 00:00:07.452620,4.4644173691767784e-07,Matern,1.347697329340126e-05,6.919170080235153e-05,0.5,TPESampler,COMPLETE
1849,1.3307518540988366,2025-04-24 21:46:37.593846,2025-04-24 21:46:42.017312,0 days 00:00:04.423466,6.089407679857955,RBF,4794.166108295222,0.0005771325134623994,2.5,TPESampler,COMPLETE
1850,0.17261855512310761,2025-04-24 21:46:39.998802,2025-04-24 21:46:44.891275,0 days 00:00:04.892473,54.26196519837955,Matern,68.54078916116899,0.8294480310278136,1.5,TPESampler,COMPLETE
1851,1.3307518541074481,2025-04-24 21:46:42.284605,2025-04-24 21:46:47.404333,0 days 00:00:05.119728,0.00855610474349166,Matern,59.75904129248338,0.02227793005988499,1.5,TPESampler,COMPLETE
1852,1.3307518541039116,2025-04-24 21:46:44.274612,2025-04-24 21:46:47.919641,0 days 00:00:03.645029,0.007443503036007019,RBF,1.4651268242549694e-05,0.0055852805282388274,1.5,TPESampler,COMPLETE
1853,1.3307518540949168,2025-04-24 21:46:45.102355,2025-04-24 21:46:47.523423,0 days 00:00:02.421068,10.06268001677148,RBF,1.5314073597630634e-05,9.300528075653968e-07,1.5,TPESampler,COMPLETE
1854,0.17261857126013763,2025-04-24 21:46:47.620301,2025-04-24 21:46:50.823773,0 days 00:00:03.203472,825.3967990407502,Matern,144.51782113566506,0.0207399482968322,1.5,TPESampler,COMPLETE
1855,1.3307518540987888,2025-04-24 21:46:47.769926,2025-04-24 21:46:51.541639,0 days 00:00:03.771713,30.480389878118228,Matern,3645.4676471828598,0.0191349798872903,1.5,TPESampler,COMPLETE
1856,0.17261855589381409,2025-04-24 21:46:48.201016,2025-04-24 21:46:51.535217,0 days 00:00:03.334201,96585.55955903945,Matern,36.34059186799332,0.00011710222243490225,1.5,TPESampler,COMPLETE
1857,0.17261904377916154,2025-04-24 21:46:51.070479,2025-04-24 21:46:54.398821,0 days 00:00:03.328342,75298.8259539452,Matern,1273.0962395191536,0.02322141486735522,1.5,TPESampler,COMPLETE
1858,1.330751854098762,2025-04-24 21:46:51.807709,2025-04-24 21:46:58.825890,0 days 00:00:07.018181,537.2060742272014,Matern,46564.92728111512,0.012212363171675362,1.5,TPESampler,COMPLETE
1859,0.1726185439426501,2025-04-24 21:46:51.861444,2025-04-24 21:46:55.316780,0 days 00:00:03.455336,131.49961255471322,Matern,562.0317355871063,0.9920474086188699,1.5,TPESampler,COMPLETE
1860,1.3307518540987777,2025-04-24 21:46:54.624614,2025-04-24 21:46:58.104345,0 days 00:00:03.479731,77133.75283132687,Matern,52968.463847835425,0.0006323354938317984,1.5,TPESampler,COMPLETE
1861,0.17261853639740132,2025-04-24 21:46:55.541521,2025-04-24 21:46:59.208682,0 days 00:00:03.667161,1788.403145687214,Matern,167.5044809126851,0.017682496846490554,1.5,TPESampler,COMPLETE
1862,0.1726185374636412,2025-04-24 21:46:58.349871,2025-04-24 21:47:01.729378,0 days 00:00:03.379507,16.85143586747323,Matern,86.92775821151149,0.9785861540707891,1.5,TPESampler,COMPLETE
1863,0.17261856771072934,2025-04-24 21:46:59.065740,2025-04-24 21:47:02.587500,0 days 00:00:03.521760,84969.58193213974,Matern,614.5079943315816,0.05098140991464351,1.5,TPESampler,COMPLETE
1864,0.17261831553637236,2025-04-24 21:46:59.465373,2025-04-24 21:47:02.433204,0 days 00:00:02.967831,2028.619957498189,Matern,55.72130055649626,0.0027387963026853507,1.5,TPESampler,COMPLETE
1865,0.17261854262594117,2025-04-24 21:47:01.954541,2025-04-24 21:47:05.026727,0 days 00:00:03.072186,0.5133081680732696,Matern,15.116290100384216,0.033612581041412855,1.5,TPESampler,COMPLETE
1866,0.2741901034327522,2025-04-24 21:47:02.634185,2025-04-24 21:47:06.247625,0 days 00:00:03.613440,0.3549102619607589,Matern,0.3122727955148893,0.6764121650269657,0.5,TPESampler,COMPLETE
1867,0.17261844282931094,2025-04-24 21:47:02.863474,2025-04-24 21:47:05.946291,0 days 00:00:03.082817,1313.483575355023,Matern,4482.377003966769,0.05956865478380442,1.5,TPESampler,COMPLETE
1868,0.17261820595495556,2025-04-24 21:47:05.274845,2025-04-24 21:47:12.097632,0 days 00:00:06.822787,0.10429269966586714,Matern,72541.82717068735,0.0034865247224956236,1.5,TPESampler,COMPLETE
1869,0.21064781805181126,2025-04-24 21:47:06.200381,2025-04-24 21:47:09.332422,0 days 00:00:03.132041,181.23617346885442,RBF,608.8834222398904,0.4840470237800176,1.5,TPESampler,COMPLETE
1870,0.1726187593177262,2025-04-24 21:47:06.533168,2025-04-24 21:47:10.471149,0 days 00:00:03.937981,618.5611620851053,Matern,264.4950742751854,0.016677290861422764,1.5,TPESampler,COMPLETE
1871,0.17261864861727833,2025-04-24 21:47:09.580059,2025-04-24 21:47:12.819415,0 days 00:00:03.239356,1435.385275272967,Matern,2.6375639269515005,0.002279610613151963,1.5,TPESampler,COMPLETE
1872,1.3307518540987804,2025-04-24 21:47:10.711306,2025-04-24 21:47:14.376973,0 days 00:00:03.665667,1419.1935293689958,Matern,11437.961031709327,0.00012919624160801058,1.5,TPESampler,COMPLETE
1873,0.1726185556824902,2025-04-24 21:47:12.350136,2025-04-24 21:47:15.899496,0 days 00:00:03.549360,14.567330372068886,Matern,29.574173215930912,0.009373027672328975,1.5,TPESampler,COMPLETE
1874,0.17261855932471817,2025-04-24 21:47:13.076728,2025-04-24 21:47:16.568869,0 days 00:00:03.492141,378.3937761490456,Matern,1118.911206929885,0.8833482980213072,1.5,TPESampler,COMPLETE
1875,0.17261957797775543,2025-04-24 21:47:14.623688,2025-04-24 21:47:19.117726,0 days 00:00:04.494038,1082.9476517610756,Matern,2.1055734338077454,0.036425233737063065,1.5,TPESampler,COMPLETE
1876,0.17261857309524167,2025-04-24 21:47:16.127758,2025-04-24 21:47:19.434515,0 days 00:00:03.306757,98346.14230892787,Matern,46897.167992163355,0.030063365652374083,1.5,TPESampler,COMPLETE
1877,0.2106436315332581,2025-04-24 21:47:16.795871,2025-04-24 21:47:20.030986,0 days 00:00:03.235115,655.3170486924975,RBF,2420.1375164103697,0.2814790459270891,0.5,TPESampler,COMPLETE
1878,0.17261855252095304,2025-04-24 21:47:19.390582,2025-04-24 21:47:24.972907,0 days 00:00:05.582325,19.82318708498636,Matern,72474.35203223309,0.05311366496179682,1.5,TPESampler,COMPLETE
1879,0.17261854258662349,2025-04-24 21:47:19.782443,2025-04-24 21:47:23.322212,0 days 00:00:03.539769,3750.8955437737272,Matern,592.908070525693,0.0009494444458422916,1.5,TPESampler,COMPLETE
1880,1.3307518540985344,2025-04-24 21:47:20.282288,2025-04-24 21:47:23.535158,0 days 00:00:03.252870,30003.469907818886,Matern,0.00895216032695695,0.36019596459710623,2.5,TPESampler,COMPLETE
1881,0.17261854204074903,2025-04-24 21:47:23.545082,2025-04-24 21:47:26.670114,0 days 00:00:03.125032,309.2627011928398,Matern,1942.9064448771715,0.05550853640723975,1.5,TPESampler,COMPLETE
1882,1.3307518540988956,2025-04-24 21:47:23.804169,2025-04-24 21:47:28.770919,0 days 00:00:04.966750,15.594959966195495,Matern,81698.35112766743,0.005351104493343973,1.5,TPESampler,COMPLETE
1883,0.17261800198846672,2025-04-24 21:47:25.267604,2025-04-24 21:47:29.388038,0 days 00:00:04.120434,14274.70815135486,Matern,599.241450121055,0.9886594760262987,1.5,TPESampler,COMPLETE
1884,0.172618491982179,2025-04-24 21:47:26.998060,2025-04-24 21:47:30.289076,0 days 00:00:03.291016,64.42143196661394,Matern,292.27858707786316,0.026476494380917818,1.5,TPESampler,COMPLETE
1885,0.1726179240335421,2025-04-24 21:47:29.002164,2025-04-24 21:47:32.304968,0 days 00:00:03.302804,55572.63048028802,Matern,0.4958443602645113,0.009676478041371794,1.5,TPESampler,COMPLETE
1886,0.17261858646428857,2025-04-24 21:47:29.608779,2025-04-24 21:47:34.531447,0 days 00:00:04.922668,0.007687851702251046,Matern,16.233011888902166,0.07957622678511371,1.5,TPESampler,COMPLETE
1887,0.17261825605012487,2025-04-24 21:47:30.512647,2025-04-24 21:47:34.481398,0 days 00:00:03.968751,114.22779425040599,Matern,16.664651969517863,0.04737537914736702,1.5,TPESampler,COMPLETE
1888,1.3307518540985988,2025-04-24 21:47:32.515743,2025-04-24 21:47:37.352642,0 days 00:00:04.836899,0.11805986284120676,Matern,240.27150785431292,0.03197853402006798,1.5,TPESampler,COMPLETE
1889,0.17261926378643663,2025-04-24 21:47:34.642756,2025-04-24 21:47:40.212149,0 days 00:00:05.569393,6.610751885534858,Matern,3329.4631125532183,0.8014426274868426,1.5,TPESampler,COMPLETE
1890,0.17261855348469596,2025-04-24 21:47:34.684994,2025-04-24 21:47:40.163267,0 days 00:00:05.478273,50.60706695298847,Matern,12291.09820730658,0.9632228763898948,1.5,TPESampler,COMPLETE
1891,0.21064469392225976,2025-04-24 21:47:37.603306,2025-04-24 21:47:40.990624,0 days 00:00:03.387318,2057.7684180413403,RBF,0.779904245057387,0.00017561794107558295,1.5,TPESampler,COMPLETE
1892,0.2741901628661268,2025-04-24 21:47:40.337471,2025-04-24 21:47:44.316871,0 days 00:00:03.979400,13793.942556246802,Matern,3015.6319359270315,0.01404164655393728,0.5,TPESampler,COMPLETE
1893,0.1726184609507749,2025-04-24 21:47:40.400500,2025-04-24 21:47:43.498928,0 days 00:00:03.098428,3881.026256805968,Matern,249.89107441999516,0.0008433946626279828,1.5,TPESampler,COMPLETE
1894,0.17261852006586462,2025-04-24 21:47:41.244983,2025-04-24 21:47:44.608757,0 days 00:00:03.363774,3979.806505840524,Matern,3493.649300882524,0.5353746713889024,1.5,TPESampler,COMPLETE
1895,0.17261853007082775,2025-04-24 21:47:43.729331,2025-04-24 21:47:47.158832,0 days 00:00:03.429501,62223.91274817044,Matern,2.986086153636652,0.6020404439451476,1.5,TPESampler,COMPLETE
1896,1.3307518540982906,2025-04-24 21:47:44.570489,2025-04-24 21:47:48.696027,0 days 00:00:04.125538,97.13458850845787,Matern,2915.145013574162,1.758725380951888e-07,1.5,TPESampler,COMPLETE
1897,0.17261827779368433,2025-04-24 21:47:44.931297,2025-04-24 21:47:50.447521,0 days 00:00:05.516224,2292.5329742040108,Matern,97625.27914495008,0.12287620543611313,1.5,TPESampler,COMPLETE
1898,1.3307518540987844,2025-04-24 21:47:47.407930,2025-04-24 21:47:50.579193,0 days 00:00:03.171263,15.305618584346764,Matern,2077.282119620072,0.0020433768022206414,1.5,TPESampler,COMPLETE
1899,0.17261854960217896,2025-04-24 21:47:48.912661,2025-04-24 21:47:51.888666,0 days 00:00:02.976005,83758.08309927266,Matern,66.25518545517627,0.0002907883345007073,1.5,TPESampler,COMPLETE
1900,0.17261853764296278,2025-04-24 21:47:50.636905,2025-04-24 21:47:53.674342,0 days 00:00:03.037437,95.72519321542426,Matern,132.06645482509936,0.03351737543491335,1.5,TPESampler,COMPLETE
1901,0.2741901119505853,2025-04-24 21:47:50.846808,2025-04-24 21:47:54.191479,0 days 00:00:03.344671,49.013883450877714,Matern,4829.653913056763,0.003937682657279352,0.5,TPESampler,COMPLETE
1902,0.17261854790683656,2025-04-24 21:47:52.125974,2025-04-24 21:47:55.613264,0 days 00:00:03.487290,1353.6273798034074,Matern,120.813044894627,0.7881294594198329,1.5,TPESampler,COMPLETE
1903,0.17261834456105934,2025-04-24 21:47:53.891638,2025-04-24 21:47:57.247299,0 days 00:00:03.355661,1180.8879804888318,Matern,437.0063751289301,0.002784582460152428,1.5,TPESampler,COMPLETE
1904,0.17261847806575825,2025-04-24 21:47:54.439432,2025-04-24 21:47:58.151141,0 days 00:00:03.711709,139.84867037534985,Matern,7.286140325499865,0.8435460956177909,1.5,TPESampler,COMPLETE
1905,0.17261854825051398,2025-04-24 21:47:55.864919,2025-04-24 21:47:58.894979,0 days 00:00:03.030060,83336.08893416815,Matern,94.86077298668124,0.002433376024898888,1.5,TPESampler,COMPLETE
1906,0.1726200488682532,2025-04-24 21:47:57.490018,2025-04-24 21:48:01.014794,0 days 00:00:03.524776,2553.0839245081124,Matern,2123.897103250181,0.017696287549365666,1.5,TPESampler,COMPLETE
1907,1.330751854099348,2025-04-24 21:47:58.417493,2025-04-24 21:48:02.139128,0 days 00:00:03.721635,60.49474326461833,Matern,5228.083501852582,0.013273925862921095,1.5,TPESampler,COMPLETE
1908,0.17261855402268234,2025-04-24 21:47:59.167895,2025-04-24 21:48:02.643159,0 days 00:00:03.475264,3371.853105877837,Matern,6307.541146508768,0.035944682092681944,1.5,TPESampler,COMPLETE
1909,0.1726185548661382,2025-04-24 21:48:01.228104,2025-04-24 21:48:04.789841,0 days 00:00:03.561737,1317.1137510231467,Matern,221.73691073577814,0.04119700213995085,1.5,TPESampler,COMPLETE
1910,0.17261777622368238,2025-04-24 21:48:02.372456,2025-04-24 21:48:06.554272,0 days 00:00:04.181816,1.6025096407077575,Matern,19.837412230112243,0.0014514002372094134,1.5,TPESampler,COMPLETE
1911,0.21064464391077004,2025-04-24 21:48:02.904869,2025-04-24 21:48:07.353825,0 days 00:00:04.448956,1534.5873744739342,RBF,9978.459807828285,0.8786230793066435,2.5,TPESampler,COMPLETE
1912,0.17261837545470662,2025-04-24 21:48:05.013146,2025-04-24 21:48:11.832761,0 days 00:00:06.819615,86.89650056394491,Matern,772.4106979750271,0.022925935725396043,1.5,TPESampler,COMPLETE
1913,1.330751854097998,2025-04-24 21:48:06.812923,2025-04-24 21:48:10.770602,0 days 00:00:03.957679,2536.5709647907056,Matern,4342.6604224243365,4.250692729787826e-05,1.5,TPESampler,COMPLETE
1914,0.17261877193508404,2025-04-24 21:48:07.596343,2025-04-24 21:48:12.989338,0 days 00:00:05.392995,1631.8965427187024,Matern,244.391464284888,0.029427873147551294,1.5,TPESampler,COMPLETE
1915,0.17261854767338092,2025-04-24 21:48:11.029788,2025-04-24 21:48:13.999189,0 days 00:00:02.969401,18568.277766851734,Matern,83.45576746945633,0.11957748788910733,1.5,TPESampler,COMPLETE
1916,0.22211468912642743,2025-04-24 21:48:12.092655,2025-04-24 21:48:15.636948,0 days 00:00:03.544293,340.0902029844471,Matern,1.598755619954771,0.009310978421764829,2.5,TPESampler,COMPLETE
1917,0.17261910550302403,2025-04-24 21:48:13.237923,2025-04-24 21:48:18.544746,0 days 00:00:05.306823,290.2735255311448,Matern,43832.9574520731,0.7844445889644015,1.5,TPESampler,COMPLETE
1918,0.17261857030810496,2025-04-24 21:48:14.304104,2025-04-24 21:48:17.319914,0 days 00:00:03.015810,4730.966847686916,Matern,3.453945237315135,0.011499684578274622,1.5,TPESampler,COMPLETE
1919,0.17261850020587347,2025-04-24 21:48:15.862805,2025-04-24 21:48:19.779185,0 days 00:00:03.916380,2673.8705725630916,Matern,21.090524214553323,0.0007531232818779677,1.5,TPESampler,COMPLETE
1920,0.21064475195495833,2025-04-24 21:48:17.533434,2025-04-24 21:48:20.885557,0 days 00:00:03.352123,92336.43584464137,RBF,176.19539439316534,0.09989962693607855,1.5,TPESampler,COMPLETE
1921,0.17261874391337434,2025-04-24 21:48:18.788420,2025-04-24 21:48:22.299529,0 days 00:00:03.511109,184.29669240584576,Matern,13.78959663670973,0.05160053332301968,1.5,TPESampler,COMPLETE
1922,1.3307518540985135,2025-04-24 21:48:20.023307,2025-04-24 21:48:26.162098,0 days 00:00:06.138791,0.7228447675351235,Matern,1498.1102424886883,0.0566380405716383,1.5,TPESampler,COMPLETE
1923,1.3307518540686896,2025-04-24 21:48:21.138268,2025-04-24 21:48:25.034307,0 days 00:00:03.896039,66315.56238509186,Matern,36355.89213312479,1.0407293107557808e-05,1.5,TPESampler,COMPLETE
1924,0.1726176467548773,2025-04-24 21:48:22.557691,2025-04-24 21:48:27.070039,0 days 00:00:04.512348,58846.68824728221,Matern,233.43539137552378,0.060142148981210765,1.5,TPESampler,COMPLETE
1925,1.3307518541076697,2025-04-24 21:48:25.243663,2025-04-24 21:48:29.507358,0 days 00:00:04.263695,0.00681366943646194,Matern,170.36886829589702,0.00030504890561842306,1.5,TPESampler,COMPLETE
1926,0.17261855963630043,2025-04-24 21:48:26.398456,2025-04-24 21:48:30.107460,0 days 00:00:03.709004,13729.310608542772,Matern,8242.50199047228,0.970806597726901,1.5,TPESampler,COMPLETE
1927,1.3307518541051835,2025-04-24 21:48:27.329089,2025-04-24 21:48:31.310371,0 days 00:00:03.981282,206.6642942152912,Matern,9729.402748253715,0.005118774976663273,1.5,TPESampler,COMPLETE
1928,0.17261892063895573,2025-04-24 21:48:29.722553,2025-04-24 21:48:34.280553,0 days 00:00:04.558000,35.79394532829462,Matern,646.1767938454693,0.921196310066682,1.5,TPESampler,COMPLETE
1929,0.17261898025419734,2025-04-24 21:48:30.317924,2025-04-24 21:48:35.326853,0 days 00:00:05.008929,7.721343033379738,Matern,9.257227351117526,0.005822763702099422,1.5,TPESampler,COMPLETE
1930,1.3307518540985708,2025-04-24 21:48:31.537393,2025-04-24 21:48:35.618880,0 days 00:00:04.081487,100.19353554569344,Matern,1129.4698764501568,0.0012166820001483889,1.5,TPESampler,COMPLETE
1931,0.17261829984056554,2025-04-24 21:48:34.505351,2025-04-24 21:48:38.140022,0 days 00:00:03.634671,4216.140267741247,Matern,5608.909228196812,0.9215479496639444,1.5,TPESampler,COMPLETE
1932,0.1726185514271544,2025-04-24 21:48:35.575811,2025-04-24 21:48:40.003406,0 days 00:00:04.427595,216.30164066855914,Matern,4.8408942435118485,0.9232689901874572,1.5,TPESampler,COMPLETE
1933,1.3307518541022796,2025-04-24 21:48:35.894481,2025-04-24 21:48:39.367215,0 days 00:00:03.472734,0.004756018520598737,RBF,0.0010115293069029956,8.518799873969088e-10,1.5,TPESampler,COMPLETE
1934,1.3677543652088286,2025-04-24 21:48:38.349880,2025-04-24 21:48:40.521659,0 days 00:00:02.171779,8.737464275150086e-07,Matern,0.44228132570391304,0.4285113830381743,1.5,TPESampler,COMPLETE
1935,0.21064467817695554,2025-04-24 21:48:39.588106,2025-04-24 21:48:46.634803,0 days 00:00:07.046697,1.0675800346994431e-07,RBF,3.3749830480943537,7.974986498306122e-05,2.5,TPESampler,COMPLETE
1936,1.3307518540986039,2025-04-24 21:48:40.244149,2025-04-24 21:48:43.646991,0 days 00:00:03.402842,27.65956988215427,Matern,1.4551076956637413e-05,1.070740508842755e-07,2.5,TPESampler,COMPLETE
1937,0.17262033753769476,2025-04-24 21:48:40.743118,2025-04-24 21:48:46.659675,0 days 00:00:05.916557,4100.91022424558,Matern,502.3613973264083,0.9632387153490415,1.5,TPESampler,COMPLETE
1938,1.3307518540884713,2025-04-24 21:48:43.902943,2025-04-24 21:48:47.478649,0 days 00:00:03.575706,5617.8746575113455,Matern,10989.494652441559,0.0027673103021645506,1.5,TPESampler,COMPLETE
1939,1.3307518540982417,2025-04-24 21:48:46.820502,2025-04-24 21:48:51.601639,0 days 00:00:04.781137,27.043055389629636,Matern,6167.912163814836,0.03921683673398195,1.5,TPESampler,COMPLETE
1940,1.3307518541057837,2025-04-24 21:48:46.864209,2025-04-24 21:48:51.883454,0 days 00:00:05.019245,206.1430083207886,Matern,1893.793193356031,0.004289526466688831,2.5,TPESampler,COMPLETE
1941,0.17261874206814345,2025-04-24 21:48:47.695780,2025-04-24 21:48:51.397674,0 days 00:00:03.701894,78.60702221388257,Matern,17.69788645754749,8.595764674211657e-05,1.5,TPESampler,COMPLETE
1942,0.17261818204771248,2025-04-24 21:48:51.604986,2025-04-24 21:48:55.059168,0 days 00:00:03.454182,72014.29768387087,Matern,133.75243638905303,0.06228774737589965,1.5,TPESampler,COMPLETE
1943,0.1726189808728413,2025-04-24 21:48:51.841731,2025-04-24 21:48:56.845977,0 days 00:00:05.004246,11.89287625008863,Matern,2720.4558692305673,0.9671793797848699,1.5,TPESampler,COMPLETE
1944,0.2221146686272804,2025-04-24 21:48:52.200693,2025-04-24 21:48:56.816325,0 days 00:00:04.615632,0.003596622869827585,Matern,1.6166814640522156,0.38362081795718184,2.5,TPESampler,COMPLETE
1945,0.17261856124475794,2025-04-24 21:48:55.283877,2025-04-24 21:48:59.176557,0 days 00:00:03.892680,0.04758078428257579,Matern,1.8953566709226835,0.05099668194520121,1.5,TPESampler,COMPLETE
