number,value,datetime_start,datetime_complete,duration,params_constant_value,params_kernel_type,params_length_scale,params_noise_level,params_nu,system_attrs_auto:sampler,state
229,1.3307518541199506,2025-04-24 21:04:43.314504,2025-04-24 21:04:48.197196,0 days 00:00:04.882692,11.731838808840136,Matern,7699.306976054332,0.0450189728219379,1.5,TPESampler,COMPLETE
230,0.17261858107513992,2025-04-24 21:04:45.000878,2025-04-24 21:04:51.985245,0 days 00:00:06.984367,1080.998652131089,Matern,257.9975900766861,0.5200537918702642,1.5,TPESampler,COMPLETE
231,1.3307518540988275,2025-04-24 21:04:47.193562,2025-04-24 21:04:50.706822,0 days 00:00:03.513260,2.8036154028131772,Matern,45728.2426323259,6.093896360550472e-08,0.5,TPESampler,COMPLETE
232,0.21064462526310923,2025-04-24 21:04:48.442442,2025-04-24 21:04:54.639456,0 days 00:00:06.197014,4.08335887143443e-05,RBF,0.3640620482504531,2.6403803383749355e-06,2.5,TPESampler,COMPLETE
233,0.1726187343441773,2025-04-24 21:04:50.916433,2025-04-24 21:04:54.692521,0 days 00:00:03.776088,0.027988110377337293,Matern,155.06699884229812,0.47904676766464405,1.5,TPESampler,COMPLETE
234,1.3307518541001628,2025-04-24 21:04:52.217981,2025-04-24 21:04:57.054346,0 days 00:00:04.836365,0.11632366165796791,Matern,1048.1953044112674,0.0010872161063558534,1.5,TPESampler,COMPLETE
235,0.17261853040335626,2025-04-24 21:04:54.793526,2025-04-24 21:04:58.515957,0 days 00:00:03.722431,0.42219999629622185,Matern,2.114333979098463,0.9841299321210565,1.5,TPESampler,COMPLETE
236,0.17261854243389244,2025-04-24 21:04:54.837848,2025-04-24 21:05:02.524115,0 days 00:00:07.686267,0.011886638416305096,Matern,0.5018906677326865,0.0020437432542483435,1.5,TPESampler,COMPLETE
237,1.3307518540987955,2025-04-24 21:04:57.279965,2025-04-24 21:05:00.872398,0 days 00:00:03.592433,83.07227906315809,RBF,3.8411061480161055,2.920018580631208e-10,1.5,TPESampler,COMPLETE
238,0.21064591270651026,2025-04-24 21:04:58.815441,2025-04-24 21:05:02.425768,0 days 00:00:03.610327,33529.599246871985,RBF,9.374353250655696,0.0012770598687764359,2.5,TPESampler,COMPLETE
239,0.1726178070879665,2025-04-24 21:05:01.095814,2025-04-24 21:05:06.519203,0 days 00:00:05.423389,0.5476956534013708,Matern,66.42588508869977,0.007132837895478989,1.5,TPESampler,COMPLETE
240,0.1726185807453493,2025-04-24 21:05:02.611699,2025-04-24 21:05:05.817431,0 days 00:00:03.205732,786.8826150721985,Matern,1.9715374147395113,0.8726917958117818,1.5,TPESampler,COMPLETE
241,1.3307501356927474,2025-04-24 21:05:02.708563,2025-04-24 21:05:05.499593,0 days 00:00:02.791030,7.972702268691431,Matern,0.10999565887238347,0.6527574317458249,1.5,TPESampler,COMPLETE
242,1.3307518540937309,2025-04-24 21:05:05.739750,2025-04-24 21:05:08.546144,0 days 00:00:02.806394,10.221448919070156,Matern,0.006888586829228348,0.0015180618247908663,1.5,TPESampler,COMPLETE
243,0.17261850729409023,2025-04-24 21:05:06.046041,2025-04-24 21:05:11.316188,0 days 00:00:05.270147,0.8169872506843813,Matern,1.5864401621173718,0.001553249788175794,1.5,TPESampler,COMPLETE
244,1.3307518540987686,2025-04-24 21:05:06.789484,2025-04-24 21:05:09.514275,0 days 00:00:02.724791,43.75726233123984,Matern,5.9201631977724355e-05,3.2576958247890023e-10,2.5,TPESampler,COMPLETE
245,1.330751854098762,2025-04-24 21:05:08.784851,2025-04-24 21:05:14.311840,0 days 00:00:05.526989,0.011387585816601566,Matern,113.91241831626317,0.03517076524094695,1.5,TPESampler,COMPLETE
246,0.1726187385183204,2025-04-24 21:05:09.731830,2025-04-24 21:05:12.616954,0 days 00:00:02.885124,1.8941776809404756,Matern,12.460018116384212,0.011819419162869148,1.5,TPESampler,COMPLETE
247,1.3307518540952745,2025-04-24 21:05:11.563432,2025-04-24 21:05:17.479405,0 days 00:00:05.915973,0.004961177833142376,RBF,6134.474662132593,0.0002455474982379558,0.5,TPESampler,COMPLETE
248,0.17261858744262912,2025-04-24 21:05:12.840407,2025-04-24 21:05:16.595657,0 days 00:00:03.755250,0.20414545436932627,Matern,109.57931119487533,0.9406155655655786,1.5,TPESampler,COMPLETE
249,1.3307518540987968,2025-04-24 21:05:14.551743,2025-04-24 21:05:18.490419,0 days 00:00:03.938676,8.20396789411085,Matern,146.27626716135586,0.00024123008019589544,2.5,TPESampler,COMPLETE
250,0.17261858949906833,2025-04-24 21:05:16.837106,2025-04-24 21:05:21.657552,0 days 00:00:04.820446,24.656293163168453,Matern,43.013866434889614,0.006553354299800737,1.5,TPESampler,COMPLETE
251,1.330751854098749,2025-04-24 21:05:17.717830,2025-04-24 21:05:20.371942,0 days 00:00:02.654112,1012.535012320531,Matern,444.09366673944214,9.619567230413249e-10,1.5,TPESampler,COMPLETE
252,0.17261856094061906,2025-04-24 21:05:18.724356,2025-04-24 21:05:22.286083,0 days 00:00:03.561727,0.0018917244475699373,Matern,2.0506289912192974,0.07528324873390817,1.5,TPESampler,COMPLETE
253,0.17261853466282484,2025-04-24 21:05:20.616213,2025-04-24 21:05:23.924111,0 days 00:00:03.307898,76619.60002715574,Matern,264.2570562372535,4.133465405149373e-10,1.5,TPESampler,COMPLETE
254,0.21064403044281685,2025-04-24 21:05:21.881290,2025-04-24 21:05:24.928964,0 days 00:00:03.047674,161.87910150854637,RBF,16.958332504362517,0.34987586971879514,1.5,TPESampler,COMPLETE
255,0.1726184670707143,2025-04-24 21:05:22.516023,2025-04-24 21:05:26.979219,0 days 00:00:04.463196,46.939844412153136,Matern,78.40656838618956,0.6842156790812335,1.5,TPESampler,COMPLETE
256,0.2741901063325356,2025-04-24 21:05:24.143897,2025-04-24 21:05:29.092490,0 days 00:00:04.948593,0.0008784533625785638,Matern,0.5266152288019484,1.5744161463539493e-10,0.5,TPESampler,COMPLETE
257,0.1726190490142365,2025-04-24 21:05:25.162402,2025-04-24 21:05:29.605155,0 days 00:00:04.442753,20339.711410109117,Matern,1535.7696029894892,0.005890150497676934,1.5,TPESampler,COMPLETE
258,0.17261854935820833,2025-04-24 21:05:27.196765,2025-04-24 21:05:30.709717,0 days 00:00:03.512952,13.970724097916099,Matern,35.930127780014644,0.07006176464498565,1.5,TPESampler,COMPLETE
259,0.172618555269204,2025-04-24 21:05:29.317271,2025-04-24 21:05:32.707581,0 days 00:00:03.390310,12.189997849205898,Matern,142.5000107288467,0.7739249038802244,1.5,TPESampler,COMPLETE
260,0.17261853169654526,2025-04-24 21:05:29.883010,2025-04-24 21:05:33.294485,0 days 00:00:03.411475,83.12778903068978,Matern,1559.3097238547784,0.7623954946341053,1.5,TPESampler,COMPLETE
261,1.330751854098793,2025-04-24 21:05:30.968846,2025-04-24 21:05:34.481749,0 days 00:00:03.512903,3265.096014775967,RBF,20035.049804810867,0.00019903222394976778,0.5,TPESampler,COMPLETE
262,0.17261855631247172,2025-04-24 21:05:32.952339,2025-04-24 21:05:37.673932,0 days 00:00:04.721593,133.27059266791352,Matern,30.278194527108,0.6852148952985424,1.5,TPESampler,COMPLETE
263,0.17261855420166794,2025-04-24 21:05:33.491598,2025-04-24 21:05:36.449997,0 days 00:00:02.958399,8674.293950437077,Matern,8.31219918247309,0.02737562128385454,1.5,TPESampler,COMPLETE
264,0.17261854513945152,2025-04-24 21:05:34.732893,2025-04-24 21:05:39.314775,0 days 00:00:04.581882,0.031452366178822404,Matern,0.39883683516865065,0.8720565683276028,1.5,TPESampler,COMPLETE
265,0.17261855791894287,2025-04-24 21:05:36.685403,2025-04-24 21:05:40.129552,0 days 00:00:03.444149,11.600718968300805,Matern,3.174735126326551,0.0313809752714377,1.5,TPESampler,COMPLETE
266,0.17261856782312293,2025-04-24 21:05:37.922014,2025-04-24 21:05:42.069087,0 days 00:00:04.147073,23.4029392939685,Matern,3.9385458956004906,0.7308207412381992,1.5,TPESampler,COMPLETE
267,0.17261857743216946,2025-04-24 21:05:39.542678,2025-04-24 21:05:43.710575,0 days 00:00:04.167897,2501.948921003095,Matern,8514.326520104238,0.07817834814527792,1.5,TPESampler,COMPLETE
268,1.330751854100879,2025-04-24 21:05:40.354602,2025-04-24 21:05:43.302303,0 days 00:00:02.947701,88874.73564401457,Matern,0.0006425456929438321,0.0007153996985282321,2.5,TPESampler,COMPLETE
269,0.22211740281484232,2025-04-24 21:05:42.296310,2025-04-24 21:05:45.652825,0 days 00:00:03.356515,4.257480090261659,Matern,30.754126831472995,0.568337917342715,2.5,TPESampler,COMPLETE
270,0.1726183128666615,2025-04-24 21:05:43.534484,2025-04-24 21:05:52.152984,0 days 00:00:08.618500,1.850268348056271,Matern,373.94889133872454,0.01491292876374195,1.5,TPESampler,COMPLETE
271,0.17261854912388572,2025-04-24 21:05:43.885170,2025-04-24 21:05:49.685172,0 days 00:00:05.800002,0.0006816146342937702,Matern,50.11495210989135,0.5897649504873961,1.5,TPESampler,COMPLETE
272,1.3307510453712694,2025-04-24 21:05:45.902847,2025-04-24 21:05:48.512629,0 days 00:00:02.609782,206.40440010120173,Matern,0.07318068167948213,0.00010454008270520096,0.5,TPESampler,COMPLETE
273,1.3307518540986774,2025-04-24 21:05:48.736412,2025-04-24 21:05:52.546193,0 days 00:00:03.809781,160.7492771764583,Matern,0.00935963979801887,0.20444168960301348,1.5,TPESampler,COMPLETE
274,0.17261888638887385,2025-04-24 21:05:50.075613,2025-04-24 21:05:53.930853,0 days 00:00:03.855240,828.5944073406318,Matern,1.3084662815837318,0.005596376750063313,1.5,TPESampler,COMPLETE
275,1.3307518540987184,2025-04-24 21:05:52.499998,2025-04-24 21:05:56.529116,0 days 00:00:04.029118,0.6238411051931269,Matern,662.51270599818,0.011264809225277323,1.5,TPESampler,COMPLETE
276,0.17261862238306927,2025-04-24 21:05:52.781761,2025-04-24 21:05:57.723608,0 days 00:00:04.941847,116.22561476593073,Matern,13.770796960652522,0.9266043240033366,1.5,TPESampler,COMPLETE
277,1.3307518537728482,2025-04-24 21:05:54.155467,2025-04-24 21:05:56.984535,0 days 00:00:02.829068,0.004230708671917147,Matern,0.04658333223948177,5.08628236863001e-05,0.5,TPESampler,COMPLETE
278,0.17261857489284899,2025-04-24 21:05:56.743520,2025-04-24 21:06:00.206887,0 days 00:00:03.463367,0.6663550389138632,Matern,1.9911570689140121,0.4554598395086193,1.5,TPESampler,COMPLETE
279,0.1726185595125667,2025-04-24 21:05:57.222123,2025-04-24 21:06:01.337597,0 days 00:00:04.115474,0.17442738887505707,Matern,471.1210500472837,0.5342721690281502,1.5,TPESampler,COMPLETE
280,1.367756950580068,2025-04-24 21:05:57.962247,2025-04-24 21:06:00.157999,0 days 00:00:02.195752,3.351907058071036e-05,Matern,17598.87936846671,0.13338257634178552,1.5,TPESampler,COMPLETE
281,1.330751854101156,2025-04-24 21:06:00.326031,2025-04-24 21:06:04.491202,0 days 00:00:04.165171,2.823351507107071,Matern,639.1485587781743,0.004385729609683686,1.5,TPESampler,COMPLETE
282,0.1726185772383345,2025-04-24 21:06:00.400214,2025-04-24 21:06:08.178239,0 days 00:00:07.778025,0.4723009777099747,Matern,52.33835079643886,0.007711381307561061,1.5,TPESampler,COMPLETE
283,1.3307518540986052,2025-04-24 21:06:01.583343,2025-04-24 21:06:04.188009,0 days 00:00:02.604666,0.12056518658206687,RBF,0.05604270614243715,0.0006556097542844809,1.5,TPESampler,COMPLETE
284,0.1726190683927394,2025-04-24 21:06:04.445105,2025-04-24 21:06:10.280154,0 days 00:00:05.835049,11452.665713342427,Matern,0.23903174314996056,0.7821826044862908,1.5,TPESampler,COMPLETE
285,0.1726184925483519,2025-04-24 21:06:04.773413,2025-04-24 21:06:07.900450,0 days 00:00:03.127037,5.441287745901648,Matern,0.49351214010045846,0.002842459350671463,1.5,TPESampler,COMPLETE
286,0.2106449796193023,2025-04-24 21:06:08.131348,2025-04-24 21:06:11.710521,0 days 00:00:03.579173,0.09145100825784686,RBF,59.45832041235735,0.6058087138850042,1.5,TPESampler,COMPLETE
287,0.2741901099965236,2025-04-24 21:06:08.424529,2025-04-24 21:06:11.765394,0 days 00:00:03.340865,34494.22129387864,Matern,893.2363700668711,1.9977884462479447e-10,0.5,TPESampler,COMPLETE
288,1.330751854097412,2025-04-24 21:06:10.518381,2025-04-24 21:06:16.536132,0 days 00:00:06.017751,0.006263883691121994,Matern,79601.8851442039,6.6731965409758705e-06,2.5,TPESampler,COMPLETE
289,1.330751854097307,2025-04-24 21:06:11.865837,2025-04-24 21:06:21.163036,0 days 00:00:09.297199,4.457309073133287e-05,Matern,7.897692852357649,0.003457270627417183,1.5,TPESampler,COMPLETE
290,0.1726188787285674,2025-04-24 21:06:11.951742,2025-04-24 21:06:15.673014,0 days 00:00:03.721272,18.00216765049639,Matern,8.068505105579026,0.9406832355098498,1.5,TPESampler,COMPLETE
291,0.17261850849437446,2025-04-24 21:06:15.909202,2025-04-24 21:06:21.134869,0 days 00:00:05.225667,40990.371201216265,Matern,69.2370154565157,0.9920120611636356,1.5,TPESampler,COMPLETE
292,1.330751854098462,2025-04-24 21:06:16.775499,2025-04-24 21:06:20.878655,0 days 00:00:04.103156,1.9169018846610535,Matern,0.03420500409809684,0.02026724765918259,2.5,TPESampler,COMPLETE
293,0.1726167955030453,2025-04-24 21:06:21.079045,2025-04-24 21:06:25.095543,0 days 00:00:04.016498,147.06119660780627,Matern,5668.12528802065,0.9809314403983613,1.5,TPESampler,COMPLETE
294,0.17261883939988096,2025-04-24 21:06:21.348426,2025-04-24 21:06:25.773675,0 days 00:00:04.425249,0.02303312416621404,Matern,13.738617580676273,0.05215788121569237,1.5,TPESampler,COMPLETE
295,0.17261855277492646,2025-04-24 21:06:21.395686,2025-04-24 21:06:25.370428,0 days 00:00:03.974742,7.4623424826505405,Matern,0.5634024740891628,0.8313999490729125,1.5,TPESampler,COMPLETE
296,0.17261879817781453,2025-04-24 21:06:25.320450,2025-04-24 21:06:28.402599,0 days 00:00:03.082149,3819.819790464188,Matern,8367.365643623862,0.8025091691392652,1.5,TPESampler,COMPLETE
297,0.17261861372697365,2025-04-24 21:06:25.613476,2025-04-24 21:06:34.941498,0 days 00:00:09.328022,3.4190815735371323,Matern,10847.267654075205,0.6829586618184884,1.5,TPESampler,COMPLETE
298,0.17261852801830554,2025-04-24 21:06:25.949430,2025-04-24 21:06:28.857186,0 days 00:00:02.907756,69.41858893648252,Matern,130.66026846158573,0.29387522379759123,1.5,TPESampler,COMPLETE
299,0.17261822900302193,2025-04-24 21:06:28.624502,2025-04-24 21:06:32.889692,0 days 00:00:04.265190,950.3570207727341,Matern,339.6624307197936,0.017190960541505734,1.5,TPESampler,COMPLETE
300,0.17261818064807077,2025-04-24 21:06:29.082658,2025-04-24 21:06:35.527299,0 days 00:00:06.444641,81.07352268294169,Matern,42249.84146234793,0.6078700957289732,1.5,TPESampler,COMPLETE
301,0.1726185369281732,2025-04-24 21:06:33.130286,2025-04-24 21:06:36.324150,0 days 00:00:03.193864,1684.927261516,Matern,259.12843599540696,0.0003484171673234877,1.5,TPESampler,COMPLETE
302,1.3677569496211464,2025-04-24 21:06:35.194784,2025-04-24 21:06:37.680940,0 days 00:00:02.486156,11657.333897803206,Matern,0.6969029347277651,2.0275044184967218e-10,1.5,TPESampler,COMPLETE
303,0.17262012480709676,2025-04-24 21:06:35.807755,2025-04-24 21:06:43.037385,0 days 00:00:07.229630,871.4078878928029,Matern,12092.542766143337,0.0605454657643094,1.5,TPESampler,COMPLETE
304,1.3307518541111942,2025-04-24 21:06:36.563097,2025-04-24 21:06:41.174934,0 days 00:00:04.611837,40.086323068485946,Matern,16074.565883445934,0.012509656207192469,1.5,TPESampler,COMPLETE
305,1.367756951285973,2025-04-24 21:06:37.900217,2025-04-24 21:06:41.617111,0 days 00:00:03.716894,11.724687449919195,Matern,44521.92915150533,0.6808059416028135,1.5,TPESampler,COMPLETE
306,0.17261858981012576,2025-04-24 21:06:41.392955,2025-04-24 21:06:49.615985,0 days 00:00:08.223030,15.686043621893432,Matern,18949.050198847803,0.7004187176709425,1.5,TPESampler,COMPLETE
307,0.17261789545824582,2025-04-24 21:06:41.857408,2025-04-24 21:06:46.594431,0 days 00:00:04.737023,2023.5786881130073,Matern,8543.110682371505,0.9524758458222063,1.5,TPESampler,COMPLETE
308,1.3307518503499003,2025-04-24 21:06:43.260522,2025-04-24 21:06:46.072417,0 days 00:00:02.811895,1190.760878355615,Matern,0.0781271921477969,0.0029170974469070435,1.5,TPESampler,COMPLETE
309,1.3307518540988117,2025-04-24 21:06:46.328010,2025-04-24 21:06:50.091338,0 days 00:00:03.763328,0.8095546596988111,RBF,0.10989988605821147,1.2496321718718086e-07,0.5,TPESampler,COMPLETE
310,0.17261843943793093,2025-04-24 21:06:46.860919,2025-04-24 21:06:58.346598,0 days 00:00:11.485679,204.80623234253144,Matern,92522.77488917414,0.24069183473154188,1.5,TPESampler,COMPLETE
311,1.3307518540979348,2025-04-24 21:06:49.986800,2025-04-24 21:06:53.558537,0 days 00:00:03.571737,3.6459428189826126,RBF,897.1824098080355,0.003637593635086229,1.5,TPESampler,COMPLETE
312,1.3307518540988237,2025-04-24 21:06:50.304211,2025-04-24 21:06:53.845225,0 days 00:00:03.541014,0.0001945304375788268,RBF,0.001629108932743435,1.0463980248243054e-06,1.5,TPESampler,COMPLETE
313,0.17261856092345712,2025-04-24 21:06:53.790989,2025-04-24 21:06:59.308054,0 days 00:00:05.517065,189.51632555392786,Matern,49857.23657836034,0.8893342332424957,1.5,TPESampler,COMPLETE
314,0.17261869688458722,2025-04-24 21:06:54.114075,2025-04-24 21:06:59.692911,0 days 00:00:05.578836,6555.005046010399,Matern,4209.272746325847,0.031150657345385524,1.5,TPESampler,COMPLETE
315,0.17261853190588747,2025-04-24 21:06:58.587048,2025-04-24 21:07:02.127197,0 days 00:00:03.540149,7286.364083755939,Matern,7354.260896169488,0.6885070985859095,1.5,TPESampler,COMPLETE
316,1.330751854098333,2025-04-24 21:06:59.531520,2025-04-24 21:07:03.640618,0 days 00:00:04.109098,419.1960282736607,Matern,11159.772189710719,0.004084248598239732,1.5,TPESampler,COMPLETE
317,0.172618553744924,2025-04-24 21:06:59.895063,2025-04-24 21:07:02.984907,0 days 00:00:03.089844,35581.11522896859,Matern,42433.84966431412,0.10920962853483547,1.5,TPESampler,COMPLETE
318,0.17261861411049695,2025-04-24 21:07:02.343461,2025-04-24 21:07:08.063853,0 days 00:00:05.720392,90.45183564056723,Matern,43802.35126698134,0.17418622749665463,1.5,TPESampler,COMPLETE
319,1.3307518541031333,2025-04-24 21:07:03.230861,2025-04-24 21:07:06.062787,0 days 00:00:02.831926,0.11526435899141693,Matern,0.00025704544745549406,4.173073997215479e-09,0.5,TPESampler,COMPLETE
320,0.17261820814721474,2025-04-24 21:07:03.870634,2025-04-24 21:07:07.228043,0 days 00:00:03.357409,330.3376213919693,Matern,7261.99694582411,0.2644467454720769,1.5,TPESampler,COMPLETE
321,0.17261881536868276,2025-04-24 21:07:06.292015,2025-04-24 21:07:14.102357,0 days 00:00:07.810342,44.01039486759749,Matern,1379.8192237897017,0.8729294504190506,1.5,TPESampler,COMPLETE
322,0.17261829889801109,2025-04-24 21:07:07.457261,2025-04-24 21:07:13.366073,0 days 00:00:05.908812,1308.4243133685945,Matern,134.4224272729559,0.02493087477505813,1.5,TPESampler,COMPLETE
323,1.3307518540980783,2025-04-24 21:07:08.290396,2025-04-24 21:07:11.119072,0 days 00:00:02.828676,1203.4367808144732,Matern,4.916181683051271e-05,2.2819058805167488e-07,0.5,TPESampler,COMPLETE
324,1.3307518540987944,2025-04-24 21:07:11.332522,2025-04-24 21:07:15.337259,0 days 00:00:04.004737,10.576936642070061,Matern,471.80863987466114,1.0911132549619277e-05,1.5,TPESampler,COMPLETE
325,0.17261855450270558,2025-04-24 21:07:13.603237,2025-04-24 21:07:16.812385,0 days 00:00:03.209148,1999.5169055517272,Matern,400.0712355881946,0.024268142713898308,1.5,TPESampler,COMPLETE
326,0.27419010547395484,2025-04-24 21:07:14.373598,2025-04-24 21:07:17.490348,0 days 00:00:03.116750,2.7052539070081747,Matern,12.11736857765034,0.0002629059800969039,0.5,TPESampler,COMPLETE
327,0.17261842312361808,2025-04-24 21:07:15.554202,2025-04-24 21:07:21.858729,0 days 00:00:06.304527,738.3048648628161,Matern,111.22329743272712,0.0027282897109637168,1.5,TPESampler,COMPLETE
328,0.17261797617724142,2025-04-24 21:07:17.037048,2025-04-24 21:07:20.505782,0 days 00:00:03.468734,422.4757836106801,Matern,2998.312046511107,0.11633910701632377,1.5,TPESampler,COMPLETE
329,0.17261895149768994,2025-04-24 21:07:17.767143,2025-04-24 21:07:24.485549,0 days 00:00:06.718406,21640.467926783513,Matern,3364.73014507813,0.5593441523893946,1.5,TPESampler,COMPLETE
330,0.1726184352420352,2025-04-24 21:07:20.740540,2025-04-24 21:07:25.193587,0 days 00:00:04.453047,1334.9705472885041,Matern,727.3295580430163,0.16491410690855368,1.5,TPESampler,COMPLETE
331,0.1726186360954458,2025-04-24 21:07:22.113228,2025-04-24 21:07:28.859086,0 days 00:00:06.745858,0.07212588569372172,Matern,0.8820625867318345,0.00010317812144606473,1.5,TPESampler,COMPLETE
332,0.17261990523884926,2025-04-24 21:07:24.707343,2025-04-24 21:07:28.067933,0 days 00:00:03.360590,16418.411523924053,Matern,229.98669251632973,0.6690714278927028,1.5,TPESampler,COMPLETE
333,1.330751854099015,2025-04-24 21:07:25.436010,2025-04-24 21:07:30.246927,0 days 00:00:04.810917,86.69906362764306,Matern,33116.87222146547,0.007631392878619627,2.5,TPESampler,COMPLETE
334,0.22211490439130202,2025-04-24 21:07:28.292412,2025-04-24 21:07:32.630813,0 days 00:00:04.338401,99.30541745647083,Matern,7335.668223476564,0.8990877954995875,2.5,TPESampler,COMPLETE
335,0.1726185272281962,2025-04-24 21:07:29.102435,2025-04-24 21:07:32.351498,0 days 00:00:03.249063,49706.28736231261,Matern,180.32054433608616,2.0496235580213918e-05,1.5,TPESampler,COMPLETE
336,0.27419010913507263,2025-04-24 21:07:30.485022,2025-04-24 21:07:34.462902,0 days 00:00:03.977880,1329.7628101317307,Matern,562.042779270399,0.03739144872635305,0.5,TPESampler,COMPLETE
337,0.17261854748854577,2025-04-24 21:07:32.583103,2025-04-24 21:07:36.609582,0 days 00:00:04.026479,515.0172630229509,Matern,12968.997811869753,0.18216222050881736,1.5,TPESampler,COMPLETE
338,0.17261830441532883,2025-04-24 21:07:32.927986,2025-04-24 21:07:39.996230,0 days 00:00:07.068244,854.364277207279,Matern,4500.03678588595,0.9868870883835082,1.5,TPESampler,COMPLETE
339,1.3677453615421107,2025-04-24 21:07:34.692755,2025-04-24 21:07:36.321792,0 days 00:00:01.629037,9.266106966790596e-06,Matern,83.10794747267933,0.5913153053138694,1.5,TPESampler,COMPLETE
340,1.3307518540990035,2025-04-24 21:07:36.546630,2025-04-24 21:07:40.318552,0 days 00:00:03.771922,81854.41569027651,Matern,10358.791899917465,0.0002391261730707457,1.5,TPESampler,COMPLETE
341,1.3307518540985326,2025-04-24 21:07:36.867621,2025-04-24 21:07:40.050396,0 days 00:00:03.182775,28.262856120606532,Matern,836.3401124668557,0.0007648028451827192,1.5,TPESampler,COMPLETE
342,0.17261863251355222,2025-04-24 21:07:40.152990,2025-04-24 21:07:43.802665,0 days 00:00:03.649675,24402.392443524608,Matern,54242.34735970161,0.9669211886292665,1.5,TPESampler,COMPLETE
343,1.3307518541027774,2025-04-24 21:07:40.222117,2025-04-24 21:07:45.754779,0 days 00:00:05.532662,0.009694941849476857,RBF,38069.91339535386,4.5964350340704905e-06,2.5,TPESampler,COMPLETE
