number,value,datetime_start,datetime_complete,duration,params_constant_value,params_kernel_type,params_length_scale,params_noise_level,params_nu,system_attrs_auto:sampler,state
2174,0.1726185459894243,2025-04-24 21:54:42.501135,2025-04-24 21:54:46.066939,0 days 00:00:03.565804,103.00076382318983,Matern,1064.7735941484966,0.034965053105847785,1.5,TPESampler,COMPLETE
2175,1.3307518540980574,2025-04-24 21:54:42.549855,2025-04-24 21:54:48.738516,0 days 00:00:06.188661,164.10452623725033,Matern,59840.776802878616,0.0012081049347443821,1.5,TPESampler,COMPLETE
2176,0.17261849257985715,2025-04-24 21:54:46.231446,2025-04-24 21:54:50.229056,0 days 00:00:03.997610,43.08067794832203,Matern,351.89181033497704,0.9879443046538209,1.5,TPESampler,COMPLETE
2177,0.17261978203631723,2025-04-24 21:54:46.380340,2025-04-24 21:54:51.209321,0 days 00:00:04.828981,47.00158337951935,Matern,2.457436582924216,0.009789393376978265,1.5,TPESampler,COMPLETE
2178,1.330751854099463,2025-04-24 21:54:48.972917,2025-04-24 21:54:54.520948,0 days 00:00:05.548031,0.9067601420271847,RBF,50373.88553980002,3.2133717828357546e-10,2.5,TPESampler,COMPLETE
2179,0.17261855753131514,2025-04-24 21:54:50.486189,2025-04-24 21:54:55.831384,0 days 00:00:05.345195,0.11698666870530305,Matern,1.4540001280610693,0.02940157869588562,1.5,TPESampler,COMPLETE
2180,0.17261859388294643,2025-04-24 21:54:51.497800,2025-04-24 21:54:54.702436,0 days 00:00:03.204636,663.7128270403057,Matern,36.774255908639965,9.045818666052327e-05,1.5,TPESampler,COMPLETE
2181,0.172618607300552,2025-04-24 21:54:54.758111,2025-04-24 21:55:03.576219,0 days 00:00:08.818108,6977.614114197702,Matern,87935.1750522478,0.6820988268977329,1.5,TPESampler,COMPLETE
2182,1.330751854096115,2025-04-24 21:54:54.989903,2025-04-24 21:55:02.022175,0 days 00:00:07.032272,0.0005822312296907483,Matern,0.0032937129238780056,0.0022970205967308152,1.5,TPESampler,COMPLETE
2183,0.17261852798196808,2025-04-24 21:54:56.102604,2025-04-24 21:55:00.599685,0 days 00:00:04.497081,15384.248790707994,Matern,36.70948326567377,0.01721740617656586,1.5,TPESampler,COMPLETE
2184,0.17261855833540488,2025-04-24 21:55:00.823190,2025-04-24 21:55:06.921817,0 days 00:00:06.098627,0.10708642044953862,Matern,483.0810989460184,0.8994106348011647,1.5,TPESampler,COMPLETE
2185,0.2106442948583373,2025-04-24 21:55:02.278100,2025-04-24 21:55:07.025437,0 days 00:00:04.747337,449.0367812542495,RBF,0.3278231035638297,0.31426957941147377,1.5,TPESampler,COMPLETE
2186,0.17261852471409134,2025-04-24 21:55:03.810334,2025-04-24 21:55:06.775300,0 days 00:00:02.964966,90516.68641095342,Matern,51.897992061452086,0.03956160985577754,1.5,TPESampler,COMPLETE
2187,1.33075185409899,2025-04-24 21:55:06.994856,2025-04-24 21:55:10.837716,0 days 00:00:03.842860,4596.278827273462,RBF,1494.5078002169505,5.517901076873969e-05,1.5,TPESampler,COMPLETE
2188,1.330751854096993,2025-04-24 21:55:07.174807,2025-04-24 21:55:12.347544,0 days 00:00:05.172737,16.983360796354248,Matern,6986.406928592697,0.04820782392383369,1.5,TPESampler,COMPLETE
2189,0.17261854858945894,2025-04-24 21:55:07.420328,2025-04-24 21:55:11.162391,0 days 00:00:03.742063,502.99258156261834,Matern,47.62305262296598,0.04921121735173173,1.5,TPESampler,COMPLETE
2190,0.17261852931637908,2025-04-24 21:55:11.086318,2025-04-24 21:55:14.709728,0 days 00:00:03.623410,837.8716889569986,Matern,1637.4856802299832,0.045010460926455644,1.5,TPESampler,COMPLETE
2191,0.17261822863609055,2025-04-24 21:55:11.506514,2025-04-24 21:55:15.415384,0 days 00:00:03.908870,7294.647716491013,Matern,152.55792340885725,0.0008599558624398318,1.5,TPESampler,COMPLETE
2192,0.17261832500064073,2025-04-24 21:55:12.612498,2025-04-24 21:55:16.338722,0 days 00:00:03.726224,1689.958790445629,Matern,555.5846432781383,0.036372546932765024,1.5,TPESampler,COMPLETE
2193,0.22211453097325515,2025-04-24 21:55:14.926257,2025-04-24 21:55:19.387913,0 days 00:00:04.461656,9341.027523397777,Matern,13543.502650188608,0.011190119341555504,2.5,TPESampler,COMPLETE
2194,1.3307518540992622,2025-04-24 21:55:15.625167,2025-04-24 21:55:19.689630,0 days 00:00:04.064463,34.721131464735066,Matern,3134.9478237317244,0.002922072440638661,1.5,TPESampler,COMPLETE
2195,0.17261784752112044,2025-04-24 21:55:16.603602,2025-04-24 21:55:20.599117,0 days 00:00:03.995515,0.427245704980291,Matern,42.61485890824752,0.04463550865054246,1.5,TPESampler,COMPLETE
2196,0.1726161529145983,2025-04-24 21:55:19.646198,2025-04-24 21:55:27.433707,0 days 00:00:07.787509,87.72422523965787,Matern,3648.635522749368,0.05130663609815121,1.5,TPESampler,COMPLETE
2197,0.17261884282511428,2025-04-24 21:55:20.036428,2025-04-24 21:55:23.757856,0 days 00:00:03.721428,1938.8531798369665,Matern,1096.118269382252,0.0003781081108986257,1.5,TPESampler,COMPLETE
2198,0.17261854691559428,2025-04-24 21:55:20.975625,2025-04-24 21:55:24.480309,0 days 00:00:03.504684,16.168182864364162,Matern,16.05104491480844,0.001092350933203894,1.5,TPESampler,COMPLETE
2199,0.1726184022823064,2025-04-24 21:55:23.980416,2025-04-24 21:55:27.492650,0 days 00:00:03.512234,6955.96563844807,Matern,272.3322337612461,0.07329096595417177,1.5,TPESampler,COMPLETE
2200,1.3677569510688203,2025-04-24 21:55:24.728657,2025-04-24 21:55:27.724519,0 days 00:00:02.995862,83.97252228817008,Matern,92456.02920439275,0.9970123857547329,1.5,TPESampler,COMPLETE
2201,1.3307518540951275,2025-04-24 21:55:27.612606,2025-04-24 21:55:33.071011,0 days 00:00:05.458405,2.814583352871546,Matern,8050.0617411210505,0.015206441887425625,1.5,TPESampler,COMPLETE
2202,0.1726180048929975,2025-04-24 21:55:27.736035,2025-04-24 21:55:34.556289,0 days 00:00:06.820254,14.263193492065469,Matern,793.2027405705281,0.5811807256526508,1.5,TPESampler,COMPLETE
2203,0.17261855596394862,2025-04-24 21:55:28.017003,2025-04-24 21:55:31.993679,0 days 00:00:03.976676,10.032587865759796,Matern,45.93566964983541,0.9243962384538703,1.5,TPESampler,COMPLETE
2204,1.3307518540988372,2025-04-24 21:55:32.218750,2025-04-24 21:55:39.285099,0 days 00:00:07.066349,0.07557064926273865,Matern,896.0302115316695,0.018233653198428033,1.5,TPESampler,COMPLETE
2205,0.17261855439045437,2025-04-24 21:55:33.337963,2025-04-24 21:55:37.376423,0 days 00:00:04.038460,2.477487435657722,Matern,2295.862310021238,0.2691114020565609,1.5,TPESampler,COMPLETE
2206,0.1726190444392298,2025-04-24 21:55:34.866914,2025-04-24 21:55:40.153833,0 days 00:00:05.286919,0.9942417394112485,Matern,1005.0923610424959,0.9015180593153451,1.5,TPESampler,COMPLETE
2207,1.3307518540992995,2025-04-24 21:55:37.600754,2025-04-24 21:55:42.250201,0 days 00:00:04.649447,2.4172957389886394,Matern,1980.2848033745552,0.0004037257824366401,1.5,TPESampler,COMPLETE
2208,0.17261860601328088,2025-04-24 21:55:39.542451,2025-04-24 21:55:44.055084,0 days 00:00:04.512633,2013.4198166510091,Matern,0.342325515637587,0.08895857981921411,1.5,TPESampler,COMPLETE
2209,1.3677569516542365,2025-04-24 21:55:40.399444,2025-04-24 21:55:45.195319,0 days 00:00:04.795875,5.565659440554295,Matern,84690.05772724542,0.07365201454206513,1.5,TPESampler,COMPLETE
2210,0.17261773717005344,2025-04-24 21:55:42.469158,2025-04-24 21:55:50.856238,0 days 00:00:08.387080,117.49624720791905,Matern,1457.2539121859386,0.056062462641008,1.5,TPESampler,COMPLETE
2211,0.17261787294147404,2025-04-24 21:55:44.326175,2025-04-24 21:55:48.753460,0 days 00:00:04.427285,1.4869710584210307,Matern,106.41336307389254,0.06147206363241349,1.5,TPESampler,COMPLETE
2212,1.3307518540996783,2025-04-24 21:55:45.458958,2025-04-24 21:55:50.883734,0 days 00:00:05.424776,49.14485120911842,Matern,17503.989129823356,0.017656638955663728,1.5,TPESampler,COMPLETE
2213,1.3677560057804365,2025-04-24 21:55:48.999406,2025-04-24 21:55:51.858230,0 days 00:00:02.858824,13080.275825368226,RBF,0.05549118656816621,3.195312268240919e-08,2.5,TPESampler,COMPLETE
2214,0.2741901005287954,2025-04-24 21:55:51.061541,2025-04-24 21:55:55.338489,0 days 00:00:04.276948,122.51689562014155,Matern,260.1011968564489,0.9551291415210199,0.5,TPESampler,COMPLETE
2215,1.3307518540987948,2025-04-24 21:55:51.101196,2025-04-24 21:55:55.387509,0 days 00:00:04.286313,11.483860915783449,Matern,436.49222727256097,0.0012715614086335754,1.5,TPESampler,COMPLETE
2216,1.3677569516678032,2025-04-24 21:55:52.116779,2025-04-24 21:55:57.184560,0 days 00:00:05.067781,0.13737721499845687,Matern,89818.06293963814,0.02463691324226144,1.5,TPESampler,COMPLETE
2217,0.17261851577900494,2025-04-24 21:55:55.545268,2025-04-24 21:56:00.010337,0 days 00:00:04.465069,84714.71116418074,Matern,7.454304746544462,0.017768835101816306,1.5,TPESampler,COMPLETE
2218,1.3307518540984857,2025-04-24 21:55:55.593674,2025-04-24 21:56:02.712814,0 days 00:00:07.119140,1.745999615075886,Matern,2953.2323103066387,0.032837917362543025,1.5,TPESampler,COMPLETE
2219,0.17261855399447448,2025-04-24 21:55:57.432811,2025-04-24 21:56:00.622035,0 days 00:00:03.189224,26.366489615671284,Matern,302.04040523445263,0.7749598559365843,1.5,TPESampler,COMPLETE
2220,1.330751854098867,2025-04-24 21:56:00.240614,2025-04-24 21:56:03.136748,0 days 00:00:02.896134,83.63215985852884,Matern,0.03474448586169696,0.0066928761927853835,1.5,TPESampler,COMPLETE
2221,0.2741900939239478,2025-04-24 21:56:00.856762,2025-04-24 21:56:05.367166,0 days 00:00:04.510404,125.0800814801461,Matern,146.3739978015555,3.402440487489493e-08,0.5,TPESampler,COMPLETE
2222,0.17261902098918425,2025-04-24 21:56:03.054328,2025-04-24 21:56:07.073904,0 days 00:00:04.019576,1791.3255656289214,Matern,4.5276107294871375,0.46882519110755605,1.5,TPESampler,COMPLETE
2223,0.17261854819176511,2025-04-24 21:56:03.397082,2025-04-24 21:56:07.113788,0 days 00:00:03.716706,61.561643014602616,Matern,16.460973720923676,0.02773437288032498,1.5,TPESampler,COMPLETE
2224,0.1726185388446113,2025-04-24 21:56:05.595365,2025-04-24 21:56:11.813540,0 days 00:00:06.218175,694.8826510014696,Matern,39.960754588980606,0.07612795505404288,1.5,TPESampler,COMPLETE
2225,0.21064467030954914,2025-04-24 21:56:07.273657,2025-04-24 21:56:13.821163,0 days 00:00:06.547506,4.0777759041810034e-07,RBF,0.19863767382865205,2.585809618402371e-10,0.5,TPESampler,COMPLETE
2226,0.1726182573791158,2025-04-24 21:56:07.312891,2025-04-24 21:56:11.519246,0 days 00:00:04.206355,30.44985220858591,Matern,150.41925784631937,0.004224327778659403,1.5,TPESampler,COMPLETE
2227,0.1726185875984346,2025-04-24 21:56:11.758531,2025-04-24 21:56:15.001003,0 days 00:00:03.242472,43.59730300728599,Matern,905.4115312907669,0.02536960715696648,1.5,TPESampler,COMPLETE
2228,0.17261852621800197,2025-04-24 21:56:12.071919,2025-04-24 21:56:15.535186,0 days 00:00:03.463267,3503.596828898843,Matern,522.6047017021892,0.36729912632355316,1.5,TPESampler,COMPLETE
2229,0.17261849946477198,2025-04-24 21:56:14.067674,2025-04-24 21:56:17.843636,0 days 00:00:03.775962,57.32779552078854,Matern,681.9371539334461,0.08470051665149625,1.5,TPESampler,COMPLETE
2230,0.21064476071999694,2025-04-24 21:56:15.332147,2025-04-24 21:56:19.362559,0 days 00:00:04.030412,2.2197340716206844,RBF,0.3303364631079033,0.5226564407354204,2.5,TPESampler,COMPLETE
2231,0.17261666200771553,2025-04-24 21:56:15.795287,2025-04-24 21:56:19.517614,0 days 00:00:03.722327,2362.598464950029,Matern,23.476453344370206,0.002270948735184231,1.5,TPESampler,COMPLETE
2232,0.17261855642409654,2025-04-24 21:56:18.086725,2025-04-24 21:56:21.722494,0 days 00:00:03.635769,14.211520903780256,Matern,129.68591742960697,0.05930759131257776,1.5,TPESampler,COMPLETE
2233,0.17261788913345202,2025-04-24 21:56:19.577168,2025-04-24 21:56:25.252947,0 days 00:00:05.675779,729.4706879778602,Matern,8.010621243454453,0.0010001014923921214,1.5,TPESampler,COMPLETE
2234,1.3307518540993202,2025-04-24 21:56:19.742285,2025-04-24 21:56:24.630598,0 days 00:00:04.888313,5.48261844250718e-07,RBF,0.0007016930450943018,2.439296873426004e-10,0.5,TPESampler,COMPLETE
2235,0.17261861459910974,2025-04-24 21:56:21.959517,2025-04-24 21:56:25.798296,0 days 00:00:03.838779,888.7416511052159,Matern,3.105460350984559,0.0029964676048630213,1.5,TPESampler,COMPLETE
2236,0.1726185576241883,2025-04-24 21:56:24.869067,2025-04-24 21:56:28.545808,0 days 00:00:03.676741,137.84994698558495,Matern,0.7024870037796359,0.0012945272135746501,1.5,TPESampler,COMPLETE
2237,0.17261847207977798,2025-04-24 21:56:25.496104,2025-04-24 21:56:30.639269,0 days 00:00:05.143165,631.9268220342674,Matern,9.093152144851038,1.3411375698035523e-05,1.5,TPESampler,COMPLETE
2238,0.17261859545106034,2025-04-24 21:56:26.044515,2025-04-24 21:56:29.464372,0 days 00:00:03.419857,22828.59421469506,Matern,9.48378554913071,0.0002805567769838536,1.5,TPESampler,COMPLETE
2239,0.1726188763576761,2025-04-24 21:56:28.797013,2025-04-24 21:56:35.606665,0 days 00:00:06.809652,14.328186633336593,Matern,15.101184909471325,0.0011858178017813594,1.5,TPESampler,COMPLETE
2240,0.17261853279042058,2025-04-24 21:56:29.699037,2025-04-24 21:56:37.213631,0 days 00:00:07.514594,388.3628537129396,Matern,4.30857438869413,0.001432927588023178,1.5,TPESampler,COMPLETE
2241,0.1726185517374529,2025-04-24 21:56:30.872946,2025-04-24 21:56:34.252293,0 days 00:00:03.379347,16617.414913717865,Matern,37.16377125355616,7.921728923814068e-05,1.5,TPESampler,COMPLETE
2242,0.17261732057609852,2025-04-24 21:56:34.480776,2025-04-24 21:56:40.373559,0 days 00:00:05.892783,1173.393289403327,Matern,232.20805352208833,0.0002483159203177027,1.5,TPESampler,COMPLETE
2243,0.17261992705023163,2025-04-24 21:56:35.843986,2025-04-24 21:56:41.308153,0 days 00:00:05.464167,764.8587901544779,Matern,0.6191325882423291,0.013311578007151204,1.5,TPESampler,COMPLETE
2244,0.17261867533237207,2025-04-24 21:56:37.449404,2025-04-24 21:56:40.085459,0 days 00:00:02.636055,72639.52403545011,Matern,3.2572713337418016,0.0002786436070922828,1.5,TPESampler,COMPLETE
2245,0.1726174416700234,2025-04-24 21:56:40.304295,2025-04-24 21:56:44.905761,0 days 00:00:04.601466,788.6260600307279,Matern,235.32549211743847,0.00018589383614949368,1.5,TPESampler,COMPLETE
2246,1.3677569516722123,2025-04-24 21:56:40.666080,2025-04-24 21:56:44.096762,0 days 00:00:03.430682,6.882004413211423,RBF,65446.38411372898,0.7478801104979534,1.5,TPESampler,COMPLETE
2247,0.17261844075632649,2025-04-24 21:56:41.555163,2025-04-24 21:56:44.855470,0 days 00:00:03.300307,82911.1974295836,Matern,2.0817371672636313,0.0035101480034535207,1.5,TPESampler,COMPLETE
2248,0.1726184970111684,2025-04-24 21:56:44.382563,2025-04-24 21:56:49.355510,0 days 00:00:04.972947,4.38687876686624,Matern,15.020772076305466,2.9061964460637586e-05,1.5,TPESampler,COMPLETE
2249,0.1726185521301113,2025-04-24 21:56:45.068727,2025-04-24 21:56:48.183278,0 days 00:00:03.114551,102.83484670054762,Matern,52.37498547431963,0.0005216340491294239,1.5,TPESampler,COMPLETE
2250,0.17261958749462836,2025-04-24 21:56:45.213157,2025-04-24 21:56:48.941287,0 days 00:00:03.728130,8027.091527886169,Matern,8.636864440625407,0.002615722570543873,1.5,TPESampler,COMPLETE
2251,0.1726186228389026,2025-04-24 21:56:48.411697,2025-04-24 21:56:52.396623,0 days 00:00:03.984926,3034.6413318700347,Matern,5.150625961561138,7.221499070419298e-05,1.5,TPESampler,COMPLETE
2252,0.17261833433562437,2025-04-24 21:56:49.186345,2025-04-24 21:56:55.786249,0 days 00:00:06.599904,0.2590284695454559,Matern,0.16663030126921574,0.005100065245028075,1.5,TPESampler,COMPLETE
2253,0.17261856037654746,2025-04-24 21:56:49.631717,2025-04-24 21:56:54.903849,0 days 00:00:05.272132,296.05668998652817,Matern,37.356750881017554,0.001086740977808153,1.5,TPESampler,COMPLETE
2254,0.1726185566044802,2025-04-24 21:56:52.663710,2025-04-24 21:56:55.927079,0 days 00:00:03.263369,89019.33632156329,Matern,425.95034784935,0.00012487016111544522,1.5,TPESampler,COMPLETE
2255,0.17261855307588847,2025-04-24 21:56:55.132602,2025-04-24 21:56:59.678527,0 days 00:00:04.545925,0.4375122336517346,Matern,0.5394286700261911,0.9005308186517378,1.5,TPESampler,COMPLETE
2256,0.17261896177649041,2025-04-24 21:56:55.974335,2025-04-24 21:57:00.210784,0 days 00:00:04.236449,194.6973828445254,Matern,2.1610088553397033,0.047904687210756906,1.5,TPESampler,COMPLETE
2257,1.3307518540998655,2025-04-24 21:56:56.206177,2025-04-24 21:57:01.276842,0 days 00:00:05.070665,5.451323788580493,Matern,275.9557795747963,7.366704312841975e-05,1.5,TPESampler,COMPLETE
2258,1.3307518540982963,2025-04-24 21:56:59.926488,2025-04-24 21:57:04.273065,0 days 00:00:04.346577,3498.299103744717,Matern,2307.5182515257757,7.125815713788412e-07,1.5,TPESampler,COMPLETE
2259,0.17261890499538135,2025-04-24 21:57:00.450303,2025-04-24 21:57:04.226349,0 days 00:00:03.776046,10192.011036340178,Matern,47.53279296546987,0.0020571737041133386,1.5,TPESampler,COMPLETE
2260,0.17261857784481252,2025-04-24 21:57:01.507573,2025-04-24 21:57:04.878940,0 days 00:00:03.371367,771.4581522839443,Matern,25.878742152894674,0.0043436218497423405,1.5,TPESampler,COMPLETE
2261,1.3307518540966492,2025-04-24 21:57:04.405452,2025-04-24 21:57:08.438914,0 days 00:00:04.033462,9.140008290314725,Matern,1432.8518755629539,0.0176655345054143,2.5,TPESampler,COMPLETE
2262,0.1726184713681521,2025-04-24 21:57:04.464884,2025-04-24 21:57:08.263322,0 days 00:00:03.798438,106.1337179460014,Matern,331.8534007163044,0.0006752690947687868,1.5,TPESampler,COMPLETE
2263,0.17262014134359882,2025-04-24 21:57:05.171282,2025-04-24 21:57:11.155060,0 days 00:00:05.983778,3595.5006915137337,Matern,0.1280200946941052,0.299019446456516,1.5,TPESampler,COMPLETE
2264,0.17261916225728302,2025-04-24 21:57:08.507393,2025-04-24 21:57:12.799484,0 days 00:00:04.292091,89.54930584732264,Matern,20.756201388628362,0.007743924922684227,1.5,TPESampler,COMPLETE
2265,0.2106446452951904,2025-04-24 21:57:08.712589,2025-04-24 21:57:12.033482,0 days 00:00:03.320893,2573.647517668146,RBF,7.199388969822537,0.008757387762964735,1.5,TPESampler,COMPLETE
2266,0.1726185700187918,2025-04-24 21:57:11.376949,2025-04-24 21:57:16.667666,0 days 00:00:05.290717,1.3185851114420504,Matern,5.285980803112384,0.025160235671905045,1.5,TPESampler,COMPLETE
2267,0.17261863161162663,2025-04-24 21:57:12.297702,2025-04-24 21:57:17.657251,0 days 00:00:05.359549,0.0052848549895682,Matern,47.347432260762595,0.9408719216534134,1.5,TPESampler,COMPLETE
2268,1.3307518540987877,2025-04-24 21:57:13.040774,2025-04-24 21:57:18.292138,0 days 00:00:05.251364,9.98414505938116,Matern,91189.24033003901,0.006358116933981315,1.5,TPESampler,COMPLETE
2269,1.3307518540987404,2025-04-24 21:57:16.900402,2025-04-24 21:57:20.712417,0 days 00:00:03.812015,561.2319592698923,Matern,707.091495789777,7.0822985137533985e-06,1.5,TPESampler,COMPLETE
2270,0.27419010719425146,2025-04-24 21:57:17.886164,2025-04-24 21:57:21.123340,0 days 00:00:03.237176,366.0029059071735,Matern,1.6238704575892635,3.039742564750045e-05,0.5,TPESampler,COMPLETE
2271,0.17261817139152028,2025-04-24 21:57:18.548165,2025-04-24 21:57:21.983856,0 days 00:00:03.435691,90553.84373821593,Matern,51.46040272806396,0.0025149350573381263,1.5,TPESampler,COMPLETE
2272,0.1726185502832503,2025-04-24 21:57:20.966259,2025-04-24 21:57:24.659755,0 days 00:00:03.693496,90981.00665201432,Matern,1757.5321990653974,7.043252214389134e-05,1.5,TPESampler,COMPLETE
2273,0.17261854693546633,2025-04-24 21:57:21.427391,2025-04-24 21:57:24.697745,0 days 00:00:03.270354,2546.853571485352,Matern,10.115124327891966,0.005307863082313308,1.5,TPESampler,COMPLETE
2274,1.33075185409938,2025-04-24 21:57:22.257705,2025-04-24 21:57:27.260054,0 days 00:00:05.002349,16.65434276682617,Matern,4686.721184001978,0.02479934765556717,1.5,TPESampler,COMPLETE
2275,0.1726185495755265,2025-04-24 21:57:24.861004,2025-04-24 21:57:28.051513,0 days 00:00:03.190509,10.4708896132468,Matern,139.24170010791573,0.01726248787560972,1.5,TPESampler,COMPLETE
2276,1.3307518540991365,2025-04-24 21:57:24.908316,2025-04-24 21:57:28.999708,0 days 00:00:04.091392,994.7212807993811,Matern,1767.0963521229846,0.00047813792926335366,1.5,TPESampler,COMPLETE
2277,1.3307518540987655,2025-04-24 21:57:27.506584,2025-04-24 21:57:30.552306,0 days 00:00:03.045722,0.05569030936357236,RBF,0.00030253962325355304,1.6895642036967506e-10,2.5,TPESampler,COMPLETE
2278,0.17261945973922954,2025-04-24 21:57:28.316498,2025-04-24 21:57:33.362216,0 days 00:00:05.045718,1960.0406434204826,Matern,9.900652050253761,0.039765102276099605,1.5,TPESampler,COMPLETE
2279,0.17261837388124857,2025-04-24 21:57:29.273597,2025-04-24 21:57:32.863126,0 days 00:00:03.589529,75.56646753172575,Matern,75.7538252142331,0.0020678419432550066,1.5,TPESampler,COMPLETE
2280,0.22211451238591215,2025-04-24 21:57:30.801343,2025-04-24 21:57:33.702971,0 days 00:00:02.901628,774.8137407858736,Matern,25.52347717297793,0.05678117665387223,2.5,TPESampler,COMPLETE
2281,1.330751854060986,2025-04-24 21:57:33.110295,2025-04-24 21:57:36.435655,0 days 00:00:03.325360,226.03065920489738,Matern,0.06363560201543329,0.001090907141938714,1.5,TPESampler,COMPLETE
2282,1.3307518540987089,2025-04-24 21:57:33.615471,2025-04-24 21:57:38.208291,0 days 00:00:04.592820,6.070320533140458,Matern,4173.139968454704,0.0013069823636603802,1.5,TPESampler,COMPLETE
2283,1.3307518540987429,2025-04-24 21:57:34.011228,2025-04-24 21:57:39.269377,0 days 00:00:05.258149,15.262060089936602,Matern,7328.8406687460965,0.04104466640244063,1.5,TPESampler,COMPLETE
2284,0.1726185893090745,2025-04-24 21:57:36.674395,2025-04-24 21:57:40.154152,0 days 00:00:03.479757,322.2835493968994,Matern,5.487431992680157,0.027373215342485276,1.5,TPESampler,COMPLETE
2285,1.3307518540987646,2025-04-24 21:57:38.453519,2025-04-24 21:57:42.876796,0 days 00:00:04.423277,0.05651789274622927,Matern,124.61486488524727,0.019993389716410896,1.5,TPESampler,COMPLETE
2286,0.17261858471679578,2025-04-24 21:57:39.494827,2025-04-24 21:57:42.832748,0 days 00:00:03.337921,5.916450847344151,Matern,6.217215214142241,5.139055964505741e-09,1.5,TPESampler,COMPLETE
2287,0.2741901038957273,2025-04-24 21:57:40.365215,2025-04-24 21:57:44.428582,0 days 00:00:04.063367,2865.55478500887,Matern,1.1267240621823909,0.003100678491504283,0.5,TPESampler,COMPLETE
