number,value,datetime_start,datetime_complete,duration,params_constant_value,params_kernel_type,params_length_scale,params_noise_level,params_nu,system_attrs_auto:sampler,state
1147,0.27419005567150034,2025-04-24 21:28:14.429756,2025-04-24 21:28:17.923904,0 days 00:00:03.494148,1.56770839146981,Matern,49.52855585604825,0.2504393403213872,0.5,TPESampler,COMPLETE
1148,0.17261855180876468,2025-04-24 21:28:15.936702,2025-04-24 21:28:19.028763,0 days 00:00:03.092061,508.18359870927503,Matern,162.2702665390623,0.02488764794537003,1.5,TPESampler,COMPLETE
1149,1.3307518540985221,2025-04-24 21:28:17.098677,2025-04-24 21:28:20.717726,0 days 00:00:03.619049,2.6801233176528187,RBF,8393.286901324904,6.232128675692787e-05,0.5,TPESampler,COMPLETE
1150,0.17261856360633504,2025-04-24 21:28:18.182509,2025-04-24 21:28:21.399903,0 days 00:00:03.217394,180.8239409806723,Matern,14.125139897028042,0.20468738729059546,1.5,TPESampler,COMPLETE
1151,0.1726185346446539,2025-04-24 21:28:19.258748,2025-04-24 21:28:23.070604,0 days 00:00:03.811856,523.1905425558748,Matern,23.920168781746636,0.17469473978490668,1.5,TPESampler,COMPLETE
1152,1.3307518540988024,2025-04-24 21:28:20.903448,2025-04-24 21:28:28.386006,0 days 00:00:07.482558,0.002142181521880205,RBF,0.04226638005420854,0.6175987250663939,0.5,TPESampler,COMPLETE
1153,1.3307518540987966,2025-04-24 21:28:21.638437,2025-04-24 21:28:24.106055,0 days 00:00:02.467618,3.9614755137700173,RBF,0.002456015981656626,3.983626786675131e-08,2.5,TPESampler,COMPLETE
1154,0.172618580235119,2025-04-24 21:28:23.295757,2025-04-24 21:28:26.510928,0 days 00:00:03.215171,3096.892605334818,Matern,48.59833817963092,0.021354564365888416,1.5,TPESampler,COMPLETE
1155,0.17261855436343237,2025-04-24 21:28:24.351224,2025-04-24 21:28:31.050191,0 days 00:00:06.698967,0.007589475053708422,Matern,493.1820583412177,0.7145216883928236,1.5,TPESampler,COMPLETE
1156,1.330751854097881,2025-04-24 21:28:26.753897,2025-04-24 21:28:29.847772,0 days 00:00:03.093875,0.00020137389789901192,Matern,1.7286349234938518e-05,2.9435700478306176e-05,2.5,TPESampler,COMPLETE
1157,0.17261854136609225,2025-04-24 21:28:28.603545,2025-04-24 21:28:32.020849,0 days 00:00:03.417304,68420.67859967059,Matern,1575.1472068189057,0.07100050247348516,1.5,TPESampler,COMPLETE
1158,0.1726185381048914,2025-04-24 21:28:30.066092,2025-04-24 21:28:33.247447,0 days 00:00:03.181355,54.388281754429144,Matern,19.3132400937504,0.0009483360697043586,1.5,TPESampler,COMPLETE
1159,0.17261855329706277,2025-04-24 21:28:31.284478,2025-04-24 21:28:34.799165,0 days 00:00:03.514687,63633.66217924777,Matern,416.92322601620685,0.2647888876265512,1.5,TPESampler,COMPLETE
1160,0.17261854808162128,2025-04-24 21:28:32.261313,2025-04-24 21:28:36.279427,0 days 00:00:04.018114,6.074895555423448,Matern,185.95526267685318,0.009089793544444464,1.5,TPESampler,COMPLETE
1161,0.17261854343098035,2025-04-24 21:28:33.485087,2025-04-24 21:28:36.569699,0 days 00:00:03.084612,1435.4442382417483,Matern,16.668295889045783,0.048391891259400195,1.5,TPESampler,COMPLETE
1162,0.2741901178176259,2025-04-24 21:28:35.038008,2025-04-24 21:28:38.853561,0 days 00:00:03.815553,79.82765068045765,Matern,165.0639785736255,0.04291117081883143,0.5,TPESampler,COMPLETE
1163,0.17261842142009348,2025-04-24 21:28:36.507076,2025-04-24 21:28:41.570761,0 days 00:00:05.063685,576.098109263133,Matern,2977.720688431401,0.03391324796706834,1.5,TPESampler,COMPLETE
1164,0.17261839196682374,2025-04-24 21:28:36.856248,2025-04-24 21:28:40.109483,0 days 00:00:03.253235,97.86257269418736,Matern,40.52564783733175,0.008555124899982712,1.5,TPESampler,COMPLETE
1165,0.22211477295452858,2025-04-24 21:28:39.101213,2025-04-24 21:28:41.993490,0 days 00:00:02.892277,35399.5822594449,Matern,9.834978002779724,0.0028152207282001376,2.5,TPESampler,COMPLETE
1166,0.21064507709122915,2025-04-24 21:28:40.348317,2025-04-24 21:28:47.137460,0 days 00:00:06.789143,2.8777368567767923,RBF,41224.907654008406,0.020156239988116404,1.5,TPESampler,COMPLETE
1167,1.3307518540987868,2025-04-24 21:28:41.760851,2025-04-24 21:28:46.069707,0 days 00:00:04.308856,0.002977921961526122,RBF,14.513409636577784,0.0314720678535142,1.5,TPESampler,COMPLETE
1168,0.1726187337236493,2025-04-24 21:28:42.210952,2025-04-24 21:28:47.455763,0 days 00:00:05.244811,78.80405061392244,Matern,2512.0836542249963,0.05387053609631215,1.5,TPESampler,COMPLETE
1169,1.3307518541064198,2025-04-24 21:28:46.344842,2025-04-24 21:28:51.860506,0 days 00:00:05.515664,0.001212432589246343,RBF,492.89710303630363,6.140369528039977e-07,0.5,TPESampler,COMPLETE
1170,1.3307518540981305,2025-04-24 21:28:47.375489,2025-04-24 21:28:50.815532,0 days 00:00:03.440043,2384.475225544031,RBF,6.1614222969908035,2.6922290786765485e-10,2.5,TPESampler,COMPLETE
1171,0.17261858159970014,2025-04-24 21:28:47.701182,2025-04-24 21:28:52.325292,0 days 00:00:04.624110,0.1942243214695659,Matern,68.78305071610353,0.00789463024180204,1.5,TPESampler,COMPLETE
1172,1.3307518540984897,2025-04-24 21:28:51.053661,2025-04-24 21:28:58.526169,0 days 00:00:07.472508,0.022871808864085894,Matern,5332.701801351505,0.012186775325778219,1.5,TPESampler,COMPLETE
1173,1.330751854098682,2025-04-24 21:28:52.075148,2025-04-24 21:28:57.048032,0 days 00:00:04.972884,6.064601868771271,Matern,2527.640955788386,0.00011149115857754815,1.5,TPESampler,COMPLETE
1174,1.3307518540988599,2025-04-24 21:28:52.572605,2025-04-24 21:28:54.784690,0 days 00:00:02.212085,122.34700239730194,RBF,0.07699991680846205,0.003771511082398437,1.5,TPESampler,COMPLETE
1175,0.17261843352551776,2025-04-24 21:28:55.004999,2025-04-24 21:28:58.784876,0 days 00:00:03.779877,607.9104471046174,Matern,309.0825903250109,0.004482203220054552,1.5,TPESampler,COMPLETE
1176,0.17261854371130722,2025-04-24 21:28:57.282111,2025-04-24 21:29:01.594490,0 days 00:00:04.312379,72.87867945549239,Matern,4659.833833181928,0.6176504789998571,1.5,TPESampler,COMPLETE
1177,0.2106447059418024,2025-04-24 21:28:58.739902,2025-04-24 21:29:01.729272,0 days 00:00:02.989370,52.25870650515144,RBF,68.98606796970483,0.06873348442189248,1.5,TPESampler,COMPLETE
1178,1.3307518540987038,2025-04-24 21:28:59.077403,2025-04-24 21:29:02.867195,0 days 00:00:03.789792,0.00012634570472603313,Matern,0.0007616370851886432,1.5840163739372284e-09,2.5,TPESampler,COMPLETE
1179,0.17261854942177568,2025-04-24 21:29:01.814709,2025-04-24 21:29:06.709254,0 days 00:00:04.894545,0.005332577392811884,Matern,21.306195677612322,0.9110260586849773,1.5,TPESampler,COMPLETE
1180,0.17261930964877,2025-04-24 21:29:02.022484,2025-04-24 21:29:05.359804,0 days 00:00:03.337320,1045.3542213712715,Matern,222.2043099426812,0.004150507243279438,1.5,TPESampler,COMPLETE
1181,0.17261857060194563,2025-04-24 21:29:03.147155,2025-04-24 21:29:06.641006,0 days 00:00:03.493851,6.862425871101048,Matern,104.81519714062992,0.2543748214375461,1.5,TPESampler,COMPLETE
1182,0.2106452639310078,2025-04-24 21:29:05.589972,2025-04-24 21:29:08.853284,0 days 00:00:03.263312,55125.103614112544,RBF,138.80534190423862,0.03821417886130345,0.5,TPESampler,COMPLETE
1183,0.17261790986755468,2025-04-24 21:29:06.820023,2025-04-24 21:29:10.430951,0 days 00:00:03.610928,0.11857065491231777,Matern,2.014416231569576,0.04282500770191761,1.5,TPESampler,COMPLETE
1184,0.1726166310675271,2025-04-24 21:29:06.881990,2025-04-24 21:29:11.402805,0 days 00:00:04.520815,7695.064526173913,Matern,163.79946070401945,0.06345293185483655,1.5,TPESampler,COMPLETE
1185,0.22211464992391458,2025-04-24 21:29:09.070733,2025-04-24 21:29:12.408135,0 days 00:00:03.337402,636.5685480811712,Matern,0.7970660669653379,3.0512827566297536e-10,2.5,TPESampler,COMPLETE
1186,0.17261858772400873,2025-04-24 21:29:10.664291,2025-04-24 21:29:13.984946,0 days 00:00:03.320655,2044.8143869978092,Matern,3.9168219206239168,0.8103423931279489,1.5,TPESampler,COMPLETE
1187,0.17261846700322112,2025-04-24 21:29:11.622664,2025-04-24 21:29:15.329042,0 days 00:00:03.706378,38679.81106625491,Matern,7.566983349213964,0.09771232890997482,1.5,TPESampler,COMPLETE
1188,0.1726185281443543,2025-04-24 21:29:12.628081,2025-04-24 21:29:15.949264,0 days 00:00:03.321183,184.2806237276761,Matern,152.115860997939,0.8275092594355493,1.5,TPESampler,COMPLETE
1189,0.17261850370401868,2025-04-24 21:29:14.277330,2025-04-24 21:29:21.083994,0 days 00:00:06.806664,14128.761387072918,Matern,580.4579558179854,0.07503477814414698,1.5,TPESampler,COMPLETE
1190,0.17261854923101247,2025-04-24 21:29:15.548866,2025-04-24 21:29:19.225604,0 days 00:00:03.676738,37489.378290746565,Matern,32.05441099086453,0.012868961815382699,1.5,TPESampler,COMPLETE
1191,1.3307518541039258,2025-04-24 21:29:16.162177,2025-04-24 21:29:20.429671,0 days 00:00:04.267494,5399.631667351969,RBF,93874.5631764675,2.3013044820055722e-05,1.5,TPESampler,COMPLETE
1192,0.17261847236833172,2025-04-24 21:29:19.442677,2025-04-24 21:29:23.723649,0 days 00:00:04.280972,499.0729735536412,Matern,2455.6173129368963,0.021178298078644627,1.5,TPESampler,COMPLETE
1193,0.17261855082826827,2025-04-24 21:29:20.656917,2025-04-24 21:29:24.520996,0 days 00:00:03.864079,36594.32520965513,Matern,139.47306388767424,0.22846344342027916,1.5,TPESampler,COMPLETE
1194,1.3307518541076366,2025-04-24 21:29:21.293845,2025-04-24 21:29:24.452784,0 days 00:00:03.158939,1183.485501404437,Matern,0.056793744174173565,0.013762567764792724,2.5,TPESampler,COMPLETE
1195,0.17261836653212376,2025-04-24 21:29:23.992061,2025-04-24 21:29:27.734844,0 days 00:00:03.742783,1368.9204198795642,Matern,190.87800501530478,0.0949753819381068,1.5,TPESampler,COMPLETE
1196,0.17261856374989967,2025-04-24 21:29:24.633196,2025-04-24 21:29:28.080894,0 days 00:00:03.447698,88630.27648900972,Matern,19194.823707763728,0.00722492541580759,1.5,TPESampler,COMPLETE
1197,0.17261853876540575,2025-04-24 21:29:24.728085,2025-04-24 21:29:31.750265,0 days 00:00:07.022180,2004.8607553106829,Matern,149.5131523956796,0.0022327271827530847,1.5,TPESampler,COMPLETE
1198,1.3677559929361522,2025-04-24 21:29:27.949631,2025-04-24 21:29:30.108747,0 days 00:00:02.159116,1.5612482793407028e-07,RBF,2.7446177060227484e-05,0.1745397036694757,2.5,TPESampler,COMPLETE
1199,0.17261854761881135,2025-04-24 21:29:28.301163,2025-04-24 21:29:31.807826,0 days 00:00:03.506663,1713.7914327658902,Matern,50.650446216601814,0.011136754609540276,1.5,TPESampler,COMPLETE
1200,0.22211466391333232,2025-04-24 21:29:30.351788,2025-04-24 21:29:33.685699,0 days 00:00:03.333911,248.71930913199407,Matern,384.52573091920567,0.907432709260797,2.5,TPESampler,COMPLETE
1201,0.17261827216736966,2025-04-24 21:29:31.929200,2025-04-24 21:29:36.930534,0 days 00:00:05.001334,2386.6687561806802,Matern,9.754128073448534,0.005222295226729759,1.5,TPESampler,COMPLETE
1202,0.17261834032628853,2025-04-24 21:29:31.969105,2025-04-24 21:29:35.621878,0 days 00:00:03.652773,4428.836863134964,Matern,194.89593350312958,0.05797590836421826,1.5,TPESampler,COMPLETE
1203,1.367756005751945,2025-04-24 21:29:33.888525,2025-04-24 21:29:35.527749,0 days 00:00:01.639224,5.209071137988092e-07,RBF,0.0014387321592116025,0.7461543143463973,1.5,TPESampler,COMPLETE
1204,0.1726185513901891,2025-04-24 21:29:35.693246,2025-04-24 21:29:39.292097,0 days 00:00:03.598851,2318.514327388982,Matern,7064.99151269768,0.013751841822714057,1.5,TPESampler,COMPLETE
1205,0.17261809870223704,2025-04-24 21:29:35.839354,2025-04-24 21:29:39.156529,0 days 00:00:03.317175,9564.679138381738,Matern,37.5994817513089,0.03208791275817844,1.5,TPESampler,COMPLETE
1206,0.17261854978763308,2025-04-24 21:29:37.152104,2025-04-24 21:29:43.923986,0 days 00:00:06.771882,97638.01219334561,Matern,9.341002129901039,0.15138628718863198,1.5,TPESampler,COMPLETE
1207,0.17261810253171658,2025-04-24 21:29:39.360303,2025-04-24 21:29:42.992860,0 days 00:00:03.632557,3671.6354896175553,Matern,3066.250214377762,0.12416358101329827,1.5,TPESampler,COMPLETE
1208,0.17261859401642377,2025-04-24 21:29:39.553999,2025-04-24 21:29:43.037723,0 days 00:00:03.483724,15.29503759387828,Matern,10.236900108860038,0.006443614257975461,1.5,TPESampler,COMPLETE
1209,0.17261977792292008,2025-04-24 21:29:43.169598,2025-04-24 21:29:47.523095,0 days 00:00:04.353497,956.4449284318877,Matern,0.4265331519551863,0.000157609385977722,1.5,TPESampler,COMPLETE
1210,0.1726167485564292,2025-04-24 21:29:43.213725,2025-04-24 21:29:47.827425,0 days 00:00:04.613700,907.568755159337,Matern,186.2211589083486,0.05485263086723103,1.5,TPESampler,COMPLETE
1211,0.21064471238040888,2025-04-24 21:29:44.177390,2025-04-24 21:29:47.220959,0 days 00:00:03.043569,29920.191712295356,RBF,5.758305653468737,0.027837428193057064,1.5,TPESampler,COMPLETE
1212,0.17261854346670893,2025-04-24 21:29:47.447870,2025-04-24 21:29:50.395977,0 days 00:00:02.948107,1572.341382218889,Matern,758.6660219234952,0.5426774357145762,1.5,TPESampler,COMPLETE
1213,0.17261886171609847,2025-04-24 21:29:47.769502,2025-04-24 21:29:54.050721,0 days 00:00:06.281219,12668.401040924666,Matern,1666.9013185429233,0.13878636481917508,1.5,TPESampler,COMPLETE
1214,0.17261873308150952,2025-04-24 21:29:48.109390,2025-04-24 21:29:51.980395,0 days 00:00:03.871005,2073.2478768643446,Matern,6.182989880192762,0.870830945563115,1.5,TPESampler,COMPLETE
1215,0.17261855323882852,2025-04-24 21:29:50.657994,2025-04-24 21:29:53.583450,0 days 00:00:02.925456,9342.55798373904,Matern,38.19600935426017,0.01792329179728332,1.5,TPESampler,COMPLETE
1216,0.17261829364446757,2025-04-24 21:29:52.214743,2025-04-24 21:29:58.067012,0 days 00:00:05.852269,1061.0338491767448,Matern,782.8600110192115,0.0013248156029933979,1.5,TPESampler,COMPLETE
1217,0.17261880415509612,2025-04-24 21:29:53.797162,2025-04-24 21:30:01.061620,0 days 00:00:07.264458,1987.5679249508496,Matern,6278.555331846295,0.007685025600314745,1.5,TPESampler,COMPLETE
1218,0.17261857511653408,2025-04-24 21:29:54.269801,2025-04-24 21:29:59.423857,0 days 00:00:05.154056,1109.5683082572943,Matern,35.050752692269945,0.002390004186667528,1.5,TPESampler,COMPLETE
1219,0.1726185158434004,2025-04-24 21:29:58.290295,2025-04-24 21:30:01.191093,0 days 00:00:02.900798,596.5068895885693,Matern,162.38657692202355,0.050990570389339865,1.5,TPESampler,COMPLETE
1220,0.17261725550615162,2025-04-24 21:29:59.643440,2025-04-24 21:30:03.087901,0 days 00:00:03.444461,19674.624747824808,Matern,1196.1462351886844,0.7859331861560285,1.5,TPESampler,COMPLETE
1221,1.3307518540984535,2025-04-24 21:30:01.282249,2025-04-24 21:30:09.232852,0 days 00:00:07.950603,1.765395689728033e-07,Matern,437.3423686535871,2.1059312515072141e-10,1.5,TPESampler,COMPLETE
1222,1.3677569513254473,2025-04-24 21:30:01.422804,2025-04-24 21:30:04.023902,0 days 00:00:02.601098,40470.60656625803,Matern,0.784773570474204,7.546299369517291e-06,2.5,TPESampler,COMPLETE
1223,1.3307518540959313,2025-04-24 21:30:03.320799,2025-04-24 21:30:06.719926,0 days 00:00:03.399127,3229.9597821857087,Matern,13107.385497147443,0.007337345914885835,1.5,TPESampler,COMPLETE
1224,0.1726185627536093,2025-04-24 21:30:04.283107,2025-04-24 21:30:07.958668,0 days 00:00:03.675561,40206.85881601753,Matern,130.1203186275196,0.8966035214841671,1.5,TPESampler,COMPLETE
1225,0.1726185719825216,2025-04-24 21:30:06.948872,2025-04-24 21:30:10.358791,0 days 00:00:03.409919,9688.410401623203,Matern,2080.153405022914,0.14882913465513384,1.5,TPESampler,COMPLETE
1226,0.172618693548959,2025-04-24 21:30:08.180910,2025-04-24 21:30:11.929810,0 days 00:00:03.748900,20533.11693361077,Matern,1639.454174416866,0.5368939661516783,1.5,TPESampler,COMPLETE
1227,0.17261845610694607,2025-04-24 21:30:09.462140,2025-04-24 21:30:14.512483,0 days 00:00:05.050343,48136.30535987201,Matern,323.86575620681486,0.6348093804887968,1.5,TPESampler,COMPLETE
1228,0.21064466368587365,2025-04-24 21:30:10.585155,2025-04-24 21:30:13.564396,0 days 00:00:02.979241,11759.626233091634,RBF,5549.926064184636,0.5719459542235503,1.5,TPESampler,COMPLETE
1229,0.17261860664507936,2025-04-24 21:30:12.154354,2025-04-24 21:30:15.676265,0 days 00:00:03.521911,3541.2801864208827,Matern,17785.00334487818,0.5151686540210049,1.5,TPESampler,COMPLETE
1230,1.3307518541020165,2025-04-24 21:30:13.809354,2025-04-24 21:30:20.422326,0 days 00:00:06.612972,3.66150445006188e-06,RBF,2.155816987915215e-05,8.062323563633938e-05,1.5,TPESampler,COMPLETE
1231,0.17261855234774748,2025-04-24 21:30:14.723258,2025-04-24 21:30:17.934581,0 days 00:00:03.211323,10583.144351523948,Matern,2923.458547709991,0.2504557589987162,1.5,TPESampler,COMPLETE
1232,0.1726184725628688,2025-04-24 21:30:15.904430,2025-04-24 21:30:19.023056,0 days 00:00:03.118626,60848.72218251211,Matern,196.02888602787132,0.03249233756203428,1.5,TPESampler,COMPLETE
1233,0.17261693708172854,2025-04-24 21:30:18.184420,2025-04-24 21:30:24.863285,0 days 00:00:06.678865,73.6969070967104,Matern,96207.03469536538,0.06518120446041654,1.5,TPESampler,COMPLETE
1234,0.17261836059570465,2025-04-24 21:30:19.239880,2025-04-24 21:30:25.533341,0 days 00:00:06.293461,2918.209901864833,Matern,22926.527161830614,0.9053232402685456,1.5,TPESampler,COMPLETE
1235,0.17261865037013843,2025-04-24 21:30:20.630050,2025-04-24 21:30:23.330971,0 days 00:00:02.700921,90348.8790633536,Matern,188.21390601827622,0.008065996757182808,1.5,TPESampler,COMPLETE
1236,0.17261839920898228,2025-04-24 21:30:23.554960,2025-04-24 21:30:26.631798,0 days 00:00:03.076838,64137.44910446079,Matern,800.8616050594719,0.6645240569599788,1.5,TPESampler,COMPLETE
1237,1.3677569516646235,2025-04-24 21:30:25.064974,2025-04-24 21:30:28.614112,0 days 00:00:03.549138,2.963967222244607,Matern,82498.87524575887,0.4787031418020346,1.5,TPESampler,COMPLETE
1238,1.3307518540985888,2025-04-24 21:30:25.772167,2025-04-24 21:30:30.768531,0 days 00:00:04.996364,52.19083676362006,Matern,20021.441136825862,0.031058721380304438,1.5,TPESampler,COMPLETE
1239,0.17261797817154037,2025-04-24 21:30:26.837731,2025-04-24 21:30:31.408422,0 days 00:00:04.570691,500.3387942263469,Matern,39652.15489170654,0.06913781879616536,1.5,TPESampler,COMPLETE
1240,1.3307518540982164,2025-04-24 21:30:28.859270,2025-04-24 21:30:32.870760,0 days 00:00:04.011490,38.64589649288799,Matern,15247.21035916431,0.00021518689761947083,1.5,TPESampler,COMPLETE
1241,1.3307518540965917,2025-04-24 21:30:30.998071,2025-04-24 21:30:34.795546,0 days 00:00:03.797475,339.50000934241916,Matern,22147.724312949118,0.005451319368991926,1.5,TPESampler,COMPLETE
1242,1.330751854113684,2025-04-24 21:30:31.647438,2025-04-24 21:30:39.117679,0 days 00:00:07.470241,0.3489358845376524,Matern,40990.59657279998,0.0032694428138594833,1.5,TPESampler,COMPLETE
1243,1.330751854102337,2025-04-24 21:30:33.107089,2025-04-24 21:30:37.528249,0 days 00:00:04.421160,0.11774910216928691,Matern,81528.53304162591,0.0002739614277736966,0.5,TPESampler,COMPLETE
1244,0.17261864616456585,2025-04-24 21:30:35.018232,2025-04-24 21:30:37.913097,0 days 00:00:02.894865,16682.97592106631,Matern,17172.67354143123,0.030834834756427464,1.5,TPESampler,COMPLETE
1245,0.22211464352818872,2025-04-24 21:30:37.770262,2025-04-24 21:30:40.543415,0 days 00:00:02.773153,26889.220062199278,Matern,165.92832685832403,0.044615121704239966,2.5,TPESampler,COMPLETE
1246,1.3307518540988985,2025-04-24 21:30:38.140113,2025-04-24 21:30:43.645022,0 days 00:00:05.504909,3.0803282805512215,Matern,35657.38169497595,0.0011992341858849975,1.5,TPESampler,COMPLETE
1247,1.33075185409946,2025-04-24 21:30:39.323853,2025-04-24 21:30:44.429013,0 days 00:00:05.105160,2.8393108073660245,Matern,9907.338770450675,0.026868181182789354,1.5,TPESampler,COMPLETE
1248,0.17261920991483942,2025-04-24 21:30:40.750783,2025-04-24 21:30:45.508204,0 days 00:00:04.757421,504.7622884118141,Matern,51210.06668589637,0.35955705101003277,1.5,TPESampler,COMPLETE
1249,1.330751854098773,2025-04-24 21:30:43.873193,2025-04-24 21:30:49.684118,0 days 00:00:05.810925,2.959276909162353,Matern,35425.105577337155,0.02441424805189365,1.5,TPESampler,COMPLETE
1250,0.2741901056194209,2025-04-24 21:30:44.655584,2025-04-24 21:30:48.517088,0 days 00:00:03.861504,5782.199648033194,Matern,7600.3567158606265,0.03309559810437567,0.5,TPESampler,COMPLETE
1251,0.17261617134729143,2025-04-24 21:30:45.747108,2025-04-24 21:30:50.140573,0 days 00:00:04.393465,467.1587484157955,Matern,1035.6097180188044,0.007830924761818483,1.5,TPESampler,COMPLETE
1252,0.17261851130271144,2025-04-24 21:30:48.716725,2025-04-24 21:30:52.071000,0 days 00:00:03.354275,536.5200146043728,Matern,2189.746933273291,0.8213911673281644,1.5,TPESampler,COMPLETE
1253,1.3307518540988073,2025-04-24 21:30:49.901628,2025-04-24 21:30:54.293516,0 days 00:00:04.391888,1.698130523462663e-05,RBF,0.00047107887609841077,2.4172598104732913e-10,2.5,TPESampler,COMPLETE
1254,0.17261920443541162,2025-04-24 21:30:50.420097,2025-04-24 21:30:55.477605,0 days 00:00:05.057508,4.339478258123945,Matern,65346.307051357435,0.021521811258117526,1.5,TPESampler,COMPLETE
1255,1.3677568210631552,2025-04-24 21:30:52.292617,2025-04-24 21:30:56.445064,0 days 00:00:04.152447,3.9516753299462e-05,Matern,0.671647733799566,0.01555843827862046,2.5,TPESampler,COMPLETE
1256,1.3307518540989043,2025-04-24 21:30:54.524815,2025-04-24 21:30:58.517650,0 days 00:00:03.992835,251.48703592273515,Matern,3791.033480034363,0.0034814805991746443,1.5,TPESampler,COMPLETE
1257,0.2741901050330688,2025-04-24 21:30:55.716474,2025-04-24 21:31:00.082409,0 days 00:00:04.365935,39358.04193686219,Matern,1.879522063707372,0.12812226399129847,0.5,TPESampler,COMPLETE
1258,0.17261855037019466,2025-04-24 21:30:56.657575,2025-04-24 21:31:00.761163,0 days 00:00:04.103588,5640.921642039833,Matern,14339.728987010376,0.020651552324089575,1.5,TPESampler,COMPLETE
1259,1.3307518540933698,2025-04-24 21:30:58.765714,2025-04-24 21:31:02.841648,0 days 00:00:04.075934,1586.974241421788,Matern,10113.445048906711,0.0022694021838881606,1.5,TPESampler,COMPLETE
1260,1.3307518540987948,2025-04-24 21:31:00.325452,2025-04-24 21:31:04.019073,0 days 00:00:03.693621,154.00630793937006,Matern,5520.500065012836,0.018427442550705116,1.5,TPESampler,COMPLETE
