number,value,datetime_start,datetime_complete,duration,params_constant_value,params_kernel_type,params_length_scale,params_noise_level,params_nu,system_attrs_auto:sampler,state
804,0.17261851345615778,2025-04-24 21:19:19.195652,2025-04-24 21:19:22.207615,0 days 00:00:03.011963,18.240433472684803,Matern,83.18715144747765,0.026476874004156957,1.5,TPESampler,COMPLETE
805,1.3307518540981476,2025-04-24 21:19:22.390250,2025-04-24 21:19:26.610239,0 days 00:00:04.219989,531.4452145073084,Matern,2216.6160699976463,0.0008943588722768243,1.5,TPESampler,COMPLETE
806,0.21064429540117877,2025-04-24 21:19:22.441430,2025-04-24 21:19:25.634775,0 days 00:00:03.193345,86442.64430762162,RBF,39.37222022132557,0.0012522537741715026,1.5,TPESampler,COMPLETE
807,0.1726185927128831,2025-04-24 21:19:23.771784,2025-04-24 21:19:26.914458,0 days 00:00:03.142674,298.9787061988336,Matern,1506.3722949357223,0.010771283835467051,1.5,TPESampler,COMPLETE
808,1.330751854098789,2025-04-24 21:19:26.086634,2025-04-24 21:19:30.966978,0 days 00:00:04.880344,0.7504038991954791,Matern,6630.967976350073,0.004620884760583034,1.5,TPESampler,COMPLETE
809,0.1726187522865428,2025-04-24 21:19:26.826543,2025-04-24 21:19:29.971969,0 days 00:00:03.145426,38.17617191109764,Matern,308.9116608490484,0.004431530109051441,1.5,TPESampler,COMPLETE
810,0.1726185545524768,2025-04-24 21:19:27.231165,2025-04-24 21:19:30.106408,0 days 00:00:02.875243,34950.601720347964,Matern,2.8616443935243163,0.029158977893493275,1.5,TPESampler,COMPLETE
811,1.3307518540949468,2025-04-24 21:19:30.158379,2025-04-24 21:19:34.881406,0 days 00:00:04.723027,7.278351607624369,Matern,2827.957761837046,0.049934112974549236,1.5,TPESampler,COMPLETE
812,0.1726184527221286,2025-04-24 21:19:30.304891,2025-04-24 21:19:37.103692,0 days 00:00:06.798801,9.17750798329389,Matern,138.45266465738263,0.6998884476182006,1.5,TPESampler,COMPLETE
813,0.1726185557410127,2025-04-24 21:19:31.202194,2025-04-24 21:19:34.814029,0 days 00:00:03.611835,609.2772936856369,Matern,5.894660765854079,0.0012764163529923156,1.5,TPESampler,COMPLETE
814,0.17261844549763172,2025-04-24 21:19:34.968509,2025-04-24 21:19:38.838982,0 days 00:00:03.870473,878.0084259961628,Matern,758.251037994731,0.01163761521290078,1.5,TPESampler,COMPLETE
815,0.21064145110394542,2025-04-24 21:19:35.058424,2025-04-24 21:19:42.642080,0 days 00:00:07.583656,314.050930959687,RBF,0.22476557555870488,0.02936545315408354,2.5,TPESampler,COMPLETE
816,0.17261872721844365,2025-04-24 21:19:37.405256,2025-04-24 21:19:40.988843,0 days 00:00:03.583587,11.103034219103723,Matern,8.553208462092778,0.01518530039780777,1.5,TPESampler,COMPLETE
817,0.17261938451264494,2025-04-24 21:19:39.049345,2025-04-24 21:19:42.383694,0 days 00:00:03.334349,15588.832129313438,Matern,1439.0808002962142,0.01260728225437568,1.5,TPESampler,COMPLETE
818,1.330751854102317,2025-04-24 21:19:41.177557,2025-04-24 21:19:44.445040,0 days 00:00:03.267483,0.00016819684461664647,RBF,6.180404495443082e-05,2.116674346181221e-07,2.5,TPESampler,COMPLETE
819,1.33075185409945,2025-04-24 21:19:42.579344,2025-04-24 21:19:47.322643,0 days 00:00:04.743299,0.18905095073699,RBF,215.81323891528717,0.02259440972959065,1.5,TPESampler,COMPLETE
820,0.17261862525314856,2025-04-24 21:19:42.872227,2025-04-24 21:19:45.801110,0 days 00:00:02.928883,58663.16464206091,Matern,1816.2948423422092,0.02197643862443482,1.5,TPESampler,COMPLETE
821,0.1726186173986089,2025-04-24 21:19:44.681493,2025-04-24 21:19:50.973759,0 days 00:00:06.292266,26.14107542385725,Matern,500.84593927094386,0.011287917599818073,1.5,TPESampler,COMPLETE
822,0.22211466802108534,2025-04-24 21:19:46.015975,2025-04-24 21:19:51.578713,0 days 00:00:05.562738,0.023841854982899844,Matern,31.452776171570076,0.02579426315808089,2.5,TPESampler,COMPLETE
823,0.17261785166851212,2025-04-24 21:19:47.539433,2025-04-24 21:19:53.357540,0 days 00:00:05.818107,1.198030994660532,Matern,46.79916891892445,0.6742377896753373,1.5,TPESampler,COMPLETE
824,0.17261853995754553,2025-04-24 21:19:51.171230,2025-04-24 21:19:55.793936,0 days 00:00:04.622706,2389.0064547756556,Matern,48.23946561522535,0.0727714517531606,1.5,TPESampler,COMPLETE
825,1.3307518541005545,2025-04-24 21:19:51.831436,2025-04-24 21:19:58.658865,0 days 00:00:06.827429,0.029358755284209788,Matern,351.97218261519083,0.02107090972017004,1.5,TPESampler,COMPLETE
826,0.17261848778117617,2025-04-24 21:19:53.594692,2025-04-24 21:19:56.610553,0 days 00:00:03.015861,1628.8068521265816,Matern,192.38912759355944,0.020173987687053214,1.5,TPESampler,COMPLETE
827,0.17261857532651542,2025-04-24 21:19:56.033636,2025-04-24 21:19:59.181586,0 days 00:00:03.147950,53022.922365916165,Matern,177.85442640612152,0.0006282978418671758,1.5,TPESampler,COMPLETE
828,0.1726196151473708,2025-04-24 21:19:56.816432,2025-04-24 21:20:02.882992,0 days 00:00:06.066560,0.012731058040462753,Matern,80.71238590742064,0.4686907776269881,1.5,TPESampler,COMPLETE
829,1.330751854099533,2025-04-24 21:19:58.886847,2025-04-24 21:20:03.596176,0 days 00:00:04.709329,772.1010539576037,Matern,17409.622733375323,0.0004753019191138715,1.5,TPESampler,COMPLETE
830,0.17261850604870496,2025-04-24 21:19:59.402692,2025-04-24 21:20:04.071817,0 days 00:00:04.669125,424.14936445262407,Matern,53.39860986717262,0.009379387817632643,1.5,TPESampler,COMPLETE
831,1.3307518540977838,2025-04-24 21:20:03.106505,2025-04-24 21:20:06.658698,0 days 00:00:03.552193,14.181882345032239,Matern,550.9762329003017,0.0022416377773991337,1.5,TPESampler,COMPLETE
832,1.3307518540980734,2025-04-24 21:20:03.818282,2025-04-24 21:20:08.773252,0 days 00:00:04.954970,5.210439826933709,Matern,1722.1488622640861,0.0452562347554472,1.5,TPESampler,COMPLETE
833,0.2221148932765257,2025-04-24 21:20:04.390166,2025-04-24 21:20:07.296683,0 days 00:00:02.906517,471.32248235274693,Matern,47.74574093901869,0.023586641974519516,2.5,TPESampler,COMPLETE
834,0.22211460126966567,2025-04-24 21:20:06.894438,2025-04-24 21:20:12.430567,0 days 00:00:05.536129,2.427840244145911e-07,Matern,5.335749421808194,1.7274934396975471e-07,2.5,TPESampler,COMPLETE
835,1.3307518540993202,2025-04-24 21:20:07.499027,2025-04-24 21:20:12.024493,0 days 00:00:04.525466,9.27923999287999e-06,Matern,0.0004579145030306802,8.692759688485444e-10,0.5,TPESampler,COMPLETE
836,1.3307518540993202,2025-04-24 21:20:09.048850,2025-04-24 21:20:13.527041,0 days 00:00:04.478191,6.567410659669368e-07,RBF,0.00015481816384566296,1.8128428161956027e-09,1.5,TPESampler,COMPLETE
837,1.3307518540987728,2025-04-24 21:20:12.254782,2025-04-24 21:20:16.371188,0 days 00:00:04.116406,0.004735758928075722,Matern,13106.68553887555,2.645184146929009e-09,0.5,TPESampler,COMPLETE
838,1.330751854098787,2025-04-24 21:20:12.637944,2025-04-24 21:20:15.900225,0 days 00:00:03.262281,0.0009336194331328046,RBF,0.0002526129843221626,5.329121293057567e-07,0.5,TPESampler,COMPLETE
839,0.17261856241231113,2025-04-24 21:20:13.745425,2025-04-24 21:20:17.222154,0 days 00:00:03.476729,66691.37929197088,Matern,37.59027215619466,0.02473950820050443,1.5,TPESampler,COMPLETE
840,0.17261866737077788,2025-04-24 21:20:16.133466,2025-04-24 21:20:20.429545,0 days 00:00:04.296079,169.02329163598012,Matern,2761.802661105246,0.028204375213818647,1.5,TPESampler,COMPLETE
841,0.2741901076882624,2025-04-24 21:20:16.610499,2025-04-24 21:20:20.484318,0 days 00:00:03.873819,1315.0600166637632,Matern,142.63020936112858,0.450815160767804,0.5,TPESampler,COMPLETE
842,0.1726184641375168,2025-04-24 21:20:17.517346,2025-04-24 21:20:20.674697,0 days 00:00:03.157351,1359.0589127506635,Matern,9134.40436782086,0.017024488014575533,1.5,TPESampler,COMPLETE
843,0.17261938678596778,2025-04-24 21:20:20.593013,2025-04-24 21:20:24.369828,0 days 00:00:03.776815,2733.00370533941,Matern,78.65714212655537,0.7176805645258303,1.5,TPESampler,COMPLETE
844,0.17261853840258154,2025-04-24 21:20:20.639332,2025-04-24 21:20:25.143460,0 days 00:00:04.504128,455.8745284278106,Matern,16.828921834251517,0.00029243192466377627,1.5,TPESampler,COMPLETE
845,0.17261868764378258,2025-04-24 21:20:20.914820,2025-04-24 21:20:24.680933,0 days 00:00:03.766113,17.705549689086766,Matern,5.848198655453456,0.0004961181411824412,1.5,TPESampler,COMPLETE
846,0.17261842935467625,2025-04-24 21:20:24.607201,2025-04-24 21:20:28.999032,0 days 00:00:04.391831,10.54849377898346,Matern,10.676818066098232,0.46997571020779993,1.5,TPESampler,COMPLETE
847,1.3307518540987822,2025-04-24 21:20:24.927665,2025-04-24 21:20:30.146533,0 days 00:00:05.218868,2.4488488974005585e-06,Matern,10.577739949006787,1.497165736303138e-10,2.5,TPESampler,COMPLETE
848,0.17261860993747638,2025-04-24 21:20:25.365748,2025-04-24 21:20:28.226742,0 days 00:00:02.860994,2394.6963792294328,Matern,1959.8073763646903,0.022987338076421948,1.5,TPESampler,COMPLETE
849,0.17261854579664007,2025-04-24 21:20:28.441135,2025-04-24 21:20:35.146277,0 days 00:00:06.705142,0.03637892646462205,Matern,42.052298122114735,0.015585821341969404,1.5,TPESampler,COMPLETE
850,0.17261885947490532,2025-04-24 21:20:29.246955,2025-04-24 21:20:38.617201,0 days 00:00:09.370246,6.138762333049361e-05,Matern,115.98955987279696,0.041440847051489337,1.5,TPESampler,COMPLETE
851,0.17261772522188207,2025-04-24 21:20:30.399515,2025-04-24 21:20:36.131717,0 days 00:00:05.732202,255.35386021678323,Matern,7.654872615499069,0.020837679292423646,1.5,TPESampler,COMPLETE
852,1.330751854099673,2025-04-24 21:20:35.387504,2025-04-24 21:20:38.365501,0 days 00:00:02.977997,1150.130044007384,Matern,7361.211796683618,0.00928562540429165,1.5,TPESampler,COMPLETE
853,0.17261815322903698,2025-04-24 21:20:36.566136,2025-04-24 21:20:40.417427,0 days 00:00:03.851291,456.35093456812206,Matern,4.576965356675668,0.0006750889142053666,1.5,TPESampler,COMPLETE
854,0.1726186557006527,2025-04-24 21:20:38.564196,2025-04-24 21:20:45.188522,0 days 00:00:06.624326,2575.5496476667568,Matern,2.7858877560720297,0.030642001463132035,1.5,TPESampler,COMPLETE
855,0.1726185390750081,2025-04-24 21:20:38.856619,2025-04-24 21:20:41.976952,0 days 00:00:03.120333,16.819994608934184,Matern,2.2227659842145693,0.04314970916364265,1.5,TPESampler,COMPLETE
856,0.1726176132567547,2025-04-24 21:20:40.655919,2025-04-24 21:20:48.513662,0 days 00:00:07.857743,0.0031442059717947516,Matern,326.4657914351167,0.6658992776644128,1.5,TPESampler,COMPLETE
857,0.17261841252666837,2025-04-24 21:20:42.164825,2025-04-24 21:20:45.452883,0 days 00:00:03.288058,484.92939429704796,Matern,24.47861445173267,0.01821923022968561,1.5,TPESampler,COMPLETE
858,0.27419010723788745,2025-04-24 21:20:45.391094,2025-04-24 21:20:48.718408,0 days 00:00:03.327314,14723.634802219864,Matern,181.94285930346103,2.984534344827044e-05,0.5,TPESampler,COMPLETE
859,1.3307518274661931,2025-04-24 21:20:45.704038,2025-04-24 21:20:48.473718,0 days 00:00:02.769680,25.060915538206558,Matern,0.08609668661376048,0.0019239195896408644,1.5,TPESampler,COMPLETE
860,1.3307518541050878,2025-04-24 21:20:48.625854,2025-04-24 21:20:52.621087,0 days 00:00:03.995233,122.59147727487884,RBF,154.6259907120025,0.00021495956230067168,2.5,TPESampler,COMPLETE
861,0.17261856342632403,2025-04-24 21:20:48.679081,2025-04-24 21:21:00.371922,0 days 00:00:11.692841,0.10310369943022231,Matern,1758.3979914792899,0.7770562904367843,1.5,TPESampler,COMPLETE
862,0.17261856916260268,2025-04-24 21:20:48.945682,2025-04-24 21:20:53.738341,0 days 00:00:04.792659,0.007060197570972521,Matern,15.496230180494925,0.4586568892348584,1.5,TPESampler,COMPLETE
863,0.27419010757074175,2025-04-24 21:20:52.841355,2025-04-24 21:20:58.860636,0 days 00:00:06.019281,0.06499425914975052,Matern,30092.03410250821,0.18411097175855554,0.5,TPESampler,COMPLETE
864,1.3307518541010546,2025-04-24 21:20:53.956940,2025-04-24 21:21:01.209640,0 days 00:00:07.252700,0.02088045818515544,Matern,418.65476075604295,0.024274405425183936,1.5,TPESampler,COMPLETE
865,1.367756787019176,2025-04-24 21:20:59.101890,2025-04-24 21:21:02.318339,0 days 00:00:03.216449,7.31064245040518e-05,Matern,834.852905203193,0.6236891642575548,1.5,TPESampler,COMPLETE
866,0.17261853709392153,2025-04-24 21:21:00.590309,2025-04-24 21:21:05.326642,0 days 00:00:04.736333,0.0006591272172458927,Matern,27.47985568721994,0.2004871668986944,1.5,TPESampler,COMPLETE
867,1.3677568982415829,2025-04-24 21:21:01.442849,2025-04-24 21:21:05.171378,0 days 00:00:03.728529,0.003811404295465155,Matern,1857.4846932395926,0.08864935565222434,1.5,TPESampler,COMPLETE
868,0.17261854965242052,2025-04-24 21:21:02.543184,2025-04-24 21:21:10.846799,0 days 00:00:08.303615,0.0018326864644175591,Matern,812.0772381492912,0.08361226275314591,1.5,TPESampler,COMPLETE
869,0.17261897713908506,2025-04-24 21:21:05.379653,2025-04-24 21:21:14.392131,0 days 00:00:09.012478,3.8547045318059894e-05,Matern,79.93044190536953,0.5219587667178446,1.5,TPESampler,COMPLETE
870,1.3677569510309162,2025-04-24 21:21:05.514904,2025-04-24 21:21:09.513334,0 days 00:00:03.998430,0.006190381258519734,Matern,12669.07476138362,0.07315171935850472,1.5,TPESampler,COMPLETE
871,0.17261856573543954,2025-04-24 21:21:09.759554,2025-04-24 21:21:12.998855,0 days 00:00:03.239301,1.920329935485835,Matern,1.9486908274083818,0.004100851769973158,1.5,TPESampler,COMPLETE
872,0.17261854327369303,2025-04-24 21:21:11.100227,2025-04-24 21:21:14.436454,0 days 00:00:03.336227,190.71003611449365,Matern,5.371632091544711,0.14329432917314652,1.5,TPESampler,COMPLETE
873,0.1726185555435938,2025-04-24 21:21:13.244129,2025-04-24 21:21:18.749286,0 days 00:00:05.505157,0.011671840262383491,Matern,274.46017127271057,0.373132663902925,1.5,TPESampler,COMPLETE
874,1.330751854110965,2025-04-24 21:21:14.559308,2025-04-24 21:21:17.385439,0 days 00:00:02.826131,105.4473019677537,Matern,0.00011932084686193082,0.6984677177457921,0.5,TPESampler,COMPLETE
875,0.17261856296198969,2025-04-24 21:21:14.600803,2025-04-24 21:21:21.013285,0 days 00:00:06.412482,0.001058419893709956,Matern,93.44966798271885,0.59587737112994,1.5,TPESampler,COMPLETE
876,0.17261854224405718,2025-04-24 21:21:17.865235,2025-04-24 21:21:21.991619,0 days 00:00:04.126384,0.324140482669277,Matern,21.954330216280596,0.6629442145063473,1.5,TPESampler,COMPLETE
877,0.17261852556693208,2025-04-24 21:21:18.992192,2025-04-24 21:21:23.707024,0 days 00:00:04.714832,21.1657814589246,Matern,0.8057194666555973,0.01653820158380277,1.5,TPESampler,COMPLETE
878,0.17261840399546557,2025-04-24 21:21:21.232403,2025-04-24 21:21:24.365722,0 days 00:00:03.133319,49.63250786775048,Matern,28.240950593005483,0.002678482998916216,1.5,TPESampler,COMPLETE
879,0.17261950716675903,2025-04-24 21:21:22.240110,2025-04-24 21:21:27.263409,0 days 00:00:05.023299,52123.96417785697,Matern,6.024489955545684,9.892165937507881e-05,1.5,TPESampler,COMPLETE
880,1.367756951622037,2025-04-24 21:21:23.954252,2025-04-24 21:21:27.217114,0 days 00:00:03.262862,0.018587455246376644,RBF,23927.286183761287,0.3552229109031638,1.5,TPESampler,COMPLETE
881,0.17261956491374147,2025-04-24 21:21:24.558074,2025-04-24 21:21:31.795026,0 days 00:00:07.236952,31507.411882432698,Matern,0.18496592698532255,0.018749453157459035,1.5,TPESampler,COMPLETE
882,0.17261851928920402,2025-04-24 21:21:27.359125,2025-04-24 21:21:39.431501,0 days 00:00:12.072376,0.003140853229190625,Matern,629.2549679922748,0.4471225389528709,1.5,TPESampler,COMPLETE
883,0.1726179308958266,2025-04-24 21:21:27.458043,2025-04-24 21:21:32.723543,0 days 00:00:05.265500,0.0747847501554049,Matern,220.7690538636494,0.957826848529462,1.5,TPESampler,COMPLETE
884,0.2221146812448454,2025-04-24 21:21:32.028689,2025-04-24 21:21:34.787018,0 days 00:00:02.758329,3.9687948234009167,Matern,9.276521994970421,0.00047721846960876486,2.5,TPESampler,COMPLETE
885,0.1726185548951296,2025-04-24 21:21:32.967436,2025-04-24 21:21:36.200836,0 days 00:00:03.233400,3.812856883430173,Matern,12.106832899829264,0.05004892171817037,1.5,TPESampler,COMPLETE
886,0.17261724987364746,2025-04-24 21:21:35.047313,2025-04-24 21:21:38.737956,0 days 00:00:03.690643,346.8513674280249,Matern,1.8645576265784256,0.0626639254256116,1.5,TPESampler,COMPLETE
887,0.17261799398551447,2025-04-24 21:21:36.412155,2025-04-24 21:21:40.556940,0 days 00:00:04.144785,46693.34599072881,Matern,37.201857563846886,0.00255661240842178,1.5,TPESampler,COMPLETE
888,0.1726185959643726,2025-04-24 21:21:38.990462,2025-04-24 21:21:44.607384,0 days 00:00:05.616922,11.582253843564425,Matern,8.291496629079603,0.029168100823958706,1.5,TPESampler,COMPLETE
889,1.3677569490683295,2025-04-24 21:21:39.670327,2025-04-24 21:21:42.123327,0 days 00:00:02.453000,3.124553020473841e-05,Matern,15112.12686323022,0.0009723171670196571,1.5,TPESampler,COMPLETE
890,0.1726185385431505,2025-04-24 21:21:40.798978,2025-04-24 21:21:43.831807,0 days 00:00:03.032829,2011.2228728651464,Matern,26.76866427166633,0.05490555163350145,1.5,TPESampler,COMPLETE
891,1.3307518540977619,2025-04-24 21:21:42.384443,2025-04-24 21:21:50.841334,0 days 00:00:08.456891,0.00018673879720884214,Matern,643.7651029823209,1.0978627903928319e-07,2.5,TPESampler,COMPLETE
892,0.1726185737072701,2025-04-24 21:21:44.087124,2025-04-24 21:21:52.990135,0 days 00:00:08.903011,4616.24267658908,Matern,0.20503324535393286,0.00340060872829485,1.5,TPESampler,COMPLETE
893,1.3307518540988519,2025-04-24 21:21:44.860103,2025-04-24 21:21:50.374001,0 days 00:00:05.513898,904.9009002866079,Matern,0.01314117072929213,0.1637181145175326,1.5,TPESampler,COMPLETE
894,1.3307518540993202,2025-04-24 21:21:50.588889,2025-04-24 21:21:55.048202,0 days 00:00:04.459313,7.460948398358112e-07,Matern,4.717004907871483e-05,1.2645351314342892e-10,1.5,TPESampler,COMPLETE
895,0.1726189345839455,2025-04-24 21:21:51.066230,2025-04-24 21:21:56.276732,0 days 00:00:05.210502,183.79952184228804,Matern,0.30152090518008723,0.07411676413052153,1.5,TPESampler,COMPLETE
896,0.17261872744944481,2025-04-24 21:21:53.228480,2025-04-24 21:21:56.727306,0 days 00:00:03.498826,775.4366341538564,Matern,1.0462484929374318,0.014040425911619322,1.5,TPESampler,COMPLETE
897,0.1726184591926497,2025-04-24 21:21:55.251232,2025-04-24 21:21:59.187088,0 days 00:00:03.935856,8586.307187100338,Matern,5.864854925120786,0.04192461361878367,1.5,TPESampler,COMPLETE
898,0.1726172252783902,2025-04-24 21:21:56.488533,2025-04-24 21:21:59.901127,0 days 00:00:03.412594,181.1547402441854,Matern,174.79089641663109,0.13408397350556037,1.5,TPESampler,COMPLETE
899,0.22211468359785025,2025-04-24 21:21:56.946786,2025-04-24 21:22:01.785221,0 days 00:00:04.838435,0.018105773094369507,Matern,97.71743416350861,0.791094205814225,2.5,TPESampler,COMPLETE
900,0.17261848721012824,2025-04-24 21:21:59.380564,2025-04-24 21:22:02.841892,0 days 00:00:03.461328,550.8522797919554,Matern,9.812819396723043,0.16829704107152754,1.5,TPESampler,COMPLETE
901,0.1726185903298424,2025-04-24 21:22:00.134278,2025-04-24 21:22:06.780678,0 days 00:00:06.646400,257.24862733059524,Matern,2.586448180535109,0.07697462653018027,1.5,TPESampler,COMPLETE
902,1.3677569515781827,2025-04-24 21:22:02.003951,2025-04-24 21:22:05.466326,0 days 00:00:03.462375,0.01592354237779185,Matern,23451.401535414218,0.7370671907250027,2.5,TPESampler,COMPLETE
903,0.17261854014688566,2025-04-24 21:22:03.054528,2025-04-24 21:22:06.753686,0 days 00:00:03.699158,71.85926073420828,Matern,27.024064109865517,0.9995229674455183,1.5,TPESampler,COMPLETE
904,1.3677569516782477,2025-04-24 21:22:05.685414,2025-04-24 21:22:07.751442,0 days 00:00:02.066028,10950.946975329301,RBF,2.2966781576676434,0.0004985923101601909,0.5,TPESampler,COMPLETE
905,0.1726183555176414,2025-04-24 21:22:06.915459,2025-04-24 21:22:12.065033,0 days 00:00:05.149574,68.25098885026638,Matern,3.4114333741615255,0.9837986612924234,1.5,TPESampler,COMPLETE
906,1.3307518540985759,2025-04-24 21:22:06.971942,2025-04-24 21:22:13.365473,0 days 00:00:06.393531,1.229991850437844,RBF,33603.89936751553,2.1922974452425542e-10,0.5,TPESampler,COMPLETE
907,0.17261854424015727,2025-04-24 21:22:08.189619,2025-04-24 21:22:11.231377,0 days 00:00:03.041758,525.7284852323613,Matern,36.99910872570626,0.02088995061417769,1.5,TPESampler,COMPLETE
908,0.17261858080274486,2025-04-24 21:22:11.446471,2025-04-24 21:22:15.749088,0 days 00:00:04.302617,68842.16190459768,Matern,26.661862647681684,0.5804076226263234,1.5,TPESampler,COMPLETE
909,0.17261852061479252,2025-04-24 21:22:12.283766,2025-04-24 21:22:15.618668,0 days 00:00:03.334902,863.6882871141731,Matern,40.40092189635071,0.0052046606443003065,1.5,TPESampler,COMPLETE
910,0.2741901051623521,2025-04-24 21:22:13.609947,2025-04-24 21:22:17.461388,0 days 00:00:03.851441,257.255113769335,Matern,449.528395871211,0.0070072277796257324,0.5,TPESampler,COMPLETE
911,0.17261861153540817,2025-04-24 21:22:15.821951,2025-04-24 21:22:20.855265,0 days 00:00:05.033314,278.06547570021064,Matern,2.436481370891275,0.004571982813711806,1.5,TPESampler,COMPLETE
912,0.17261854682892888,2025-04-24 21:22:16.006281,2025-04-24 21:22:19.660020,0 days 00:00:03.653739,423.1293050393944,Matern,31.617268059226088,0.688053260813547,1.5,TPESampler,COMPLETE
913,0.2106450234182834,2025-04-24 21:22:17.751027,2025-04-24 21:22:21.991541,0 days 00:00:04.240514,335.74315505344873,RBF,2509.1755759194803,0.018642118743096837,1.5,TPESampler,COMPLETE
914,0.17261856132744732,2025-04-24 21:22:19.916814,2025-04-24 21:22:23.305177,0 days 00:00:03.388363,401.2718035512628,Matern,197.8029432938954,0.27869535947324986,1.5,TPESampler,COMPLETE
915,0.17261855290463557,2025-04-24 21:22:21.142552,2025-04-24 21:22:25.145375,0 days 00:00:04.002823,122.71569834703523,Matern,70.02707320481112,0.9954302563439151,1.5,TPESampler,COMPLETE
916,0.17261821833233235,2025-04-24 21:22:22.201842,2025-04-24 21:22:25.509974,0 days 00:00:03.308132,1112.3445663068333,Matern,270.8661101418351,0.0010429923521925333,1.5,TPESampler,COMPLETE
917,0.1726185291071761,2025-04-24 21:22:23.536934,2025-04-24 21:22:26.632765,0 days 00:00:03.095831,1184.624419755369,Matern,32.32559483905853,0.00804176295480481,1.5,TPESampler,COMPLETE
918,0.17261857721209822,2025-04-24 21:22:25.364926,2025-04-24 21:22:28.497642,0 days 00:00:03.132716,49.41416962893495,Matern,225.09719764193713,0.7780927540245494,1.5,TPESampler,COMPLETE
