number,value,datetime_start,datetime_complete,duration,params_constant_value,params_kernel_type,params_length_scale,params_noise_level,params_nu,system_attrs_auto:sampler,state
919,0.17261854479700453,2025-04-24 21:22:25.716221,2025-04-24 21:22:29.677592,0 days 00:00:03.961371,10.776374872011937,Matern,2614.3524294463177,0.7902601161934467,1.5,TPESampler,COMPLETE
920,0.1726183082612874,2025-04-24 21:22:26.858762,2025-04-24 21:22:30.460878,0 days 00:00:03.602116,151.74867362421028,Matern,76.22309295551275,0.00992258961226228,1.5,TPESampler,COMPLETE
921,0.17261743046980108,2025-04-24 21:22:28.717731,2025-04-24 21:22:35.608042,0 days 00:00:06.890311,5913.239900307748,Matern,226.32738507756875,0.00011117257132719267,1.5,TPESampler,COMPLETE
922,0.21064470475335453,2025-04-24 21:22:29.917749,2025-04-24 21:22:33.623910,0 days 00:00:03.706161,6173.540682691881,RBF,16.040252034516325,0.7404137651769936,1.5,TPESampler,COMPLETE
923,0.1726199729130193,2025-04-24 21:22:30.676129,2025-04-24 21:22:38.042384,0 days 00:00:07.366255,97672.09327106285,Matern,1993.9786449422359,0.01032426603523899,1.5,TPESampler,COMPLETE
924,1.3307518541005965,2025-04-24 21:22:33.847295,2025-04-24 21:22:36.256453,0 days 00:00:02.409158,12.295471537865577,RBF,0.0005614757881925816,0.002579389994821702,2.5,TPESampler,COMPLETE
925,1.3307518540971377,2025-04-24 21:22:35.843158,2025-04-24 21:22:39.802558,0 days 00:00:03.959400,48464.850259862615,Matern,28917.439698625967,4.2679902141826034e-05,1.5,TPESampler,COMPLETE
926,0.17261818927346817,2025-04-24 21:22:36.456825,2025-04-24 21:22:42.315651,0 days 00:00:05.858826,79926.07623290215,Matern,42.05881111457276,0.0011331364000974483,1.5,TPESampler,COMPLETE
927,1.3677560057811813,2025-04-24 21:22:38.281064,2025-04-24 21:22:41.023185,0 days 00:00:02.742121,36483.67471842937,Matern,0.0003831844859834905,7.882709500606229e-07,2.5,TPESampler,COMPLETE
928,0.17261855352114708,2025-04-24 21:22:40.027127,2025-04-24 21:22:43.986469,0 days 00:00:03.959342,27218.81808731069,Matern,180.74176633412458,7.62973284682171e-06,1.5,TPESampler,COMPLETE
929,1.3307518540986727,2025-04-24 21:22:41.289389,2025-04-24 21:22:46.047879,0 days 00:00:04.758490,221.1481178935394,Matern,1665.37313246209,0.00017985490614093105,1.5,TPESampler,COMPLETE
930,1.3307518540987977,2025-04-24 21:22:42.568043,2025-04-24 21:22:47.318620,0 days 00:00:04.750577,87.95236606210133,Matern,39734.375390566944,8.726693369732961e-06,1.5,TPESampler,COMPLETE
931,0.17261877926307923,2025-04-24 21:22:44.248456,2025-04-24 21:22:50.511466,0 days 00:00:06.263010,26870.485069587256,Matern,560.3909799737601,6.785756435448237e-05,1.5,TPESampler,COMPLETE
932,1.3307518540987178,2025-04-24 21:22:46.255090,2025-04-24 21:22:54.780620,0 days 00:00:08.525530,2.306491920884948e-06,Matern,0.019102816539624392,0.0011165658698484508,0.5,TPESampler,COMPLETE
933,0.1726185447009997,2025-04-24 21:22:47.648623,2025-04-24 21:22:52.328200,0 days 00:00:04.679577,8372.78822802836,Matern,25.144274456589685,2.581757812196714e-05,1.5,TPESampler,COMPLETE
934,0.17261841424308186,2025-04-24 21:22:50.843043,2025-04-24 21:22:56.255379,0 days 00:00:05.412336,250.8897577263057,Matern,45.09316381830116,6.938114556106519e-05,1.5,TPESampler,COMPLETE
935,0.17261856697273129,2025-04-24 21:22:52.669184,2025-04-24 21:22:57.712846,0 days 00:00:05.043662,776.0932119925889,Matern,215.11666740477946,2.2807908733039752e-05,1.5,TPESampler,COMPLETE
936,1.3307518122811925,2025-04-24 21:22:55.055627,2025-04-24 21:22:58.292230,0 days 00:00:03.236603,0.0010028279044016657,Matern,0.05959614173416355,6.172142883603395e-08,0.5,TPESampler,COMPLETE
937,1.3307518540987162,2025-04-24 21:22:56.531055,2025-04-24 21:22:59.080247,0 days 00:00:02.549192,0.0019633976345259808,RBF,9.592820845431804e-05,0.0007217177079414133,2.5,TPESampler,COMPLETE
938,0.21064433669352622,2025-04-24 21:22:57.945153,2025-04-24 21:23:04.240840,0 days 00:00:06.295687,6.694657864189691e-07,RBF,0.6863833230472663,2.9410456554347065e-08,0.5,TPESampler,COMPLETE
939,0.1726186708765127,2025-04-24 21:22:58.502545,2025-04-24 21:23:01.592123,0 days 00:00:03.089578,32487.77938106632,Matern,470.2289642303209,0.0004578418720177259,1.5,TPESampler,COMPLETE
940,1.3307518541026933,2025-04-24 21:22:59.290888,2025-04-24 21:23:03.165584,0 days 00:00:03.874696,6960.128868628055,Matern,1458.0649920859173,6.415732072545718e-05,1.5,TPESampler,COMPLETE
941,0.27419010459142695,2025-04-24 21:23:01.833726,2025-04-24 21:23:06.099213,0 days 00:00:04.265487,14.854001593517088,Matern,5.1876797658622325,0.002671704214102733,0.5,TPESampler,COMPLETE
942,0.17261829570074286,2025-04-24 21:23:03.403916,2025-04-24 21:23:08.261597,0 days 00:00:04.857681,2233.1338720839262,Matern,7.605459562258053,0.014385602408683942,1.5,TPESampler,COMPLETE
943,0.1726185449341855,2025-04-24 21:23:04.477393,2025-04-24 21:23:07.381038,0 days 00:00:02.903645,1051.7408052956057,Matern,12.539347177117582,0.0006581791004229514,1.5,TPESampler,COMPLETE
944,1.3307518540988725,2025-04-24 21:23:06.336636,2025-04-24 21:23:09.865497,0 days 00:00:03.528861,752.032219568967,Matern,3.7755531216912174e-05,0.3037123264468905,2.5,TPESampler,COMPLETE
945,0.17261884832928018,2025-04-24 21:23:07.609885,2025-04-24 21:23:12.079448,0 days 00:00:04.469563,2711.684666386003,Matern,165.94911182159956,0.0005073046324847291,1.5,TPESampler,COMPLETE
946,0.17261825818458212,2025-04-24 21:23:08.471692,2025-04-24 21:23:12.182719,0 days 00:00:03.711027,110.81384500013742,Matern,236.8271584491506,0.02681074064783603,1.5,TPESampler,COMPLETE
947,0.17261807305734808,2025-04-24 21:23:10.110930,2025-04-24 21:23:14.160647,0 days 00:00:04.049717,82.3504274939954,Matern,1.3749095748726317,0.001780703722026846,1.5,TPESampler,COMPLETE
948,0.17261840937950734,2025-04-24 21:23:12.285474,2025-04-24 21:23:15.564583,0 days 00:00:03.279109,446.6290033549856,Matern,175.64063549138496,0.0013620772145896463,1.5,TPESampler,COMPLETE
949,0.22211473249825786,2025-04-24 21:23:12.346751,2025-04-24 21:23:16.334566,0 days 00:00:03.987815,1532.8365315510257,Matern,3.050345267930586,0.0010707988763489645,2.5,TPESampler,COMPLETE
950,0.17261858134879907,2025-04-24 21:23:14.430874,2025-04-24 21:23:17.799028,0 days 00:00:03.368154,91314.9945755465,Matern,61.56639917215633,0.01798359355147908,1.5,TPESampler,COMPLETE
951,0.1726180958462233,2025-04-24 21:23:15.811796,2025-04-24 21:23:19.461578,0 days 00:00:03.649782,63.62263306053795,Matern,58.917460790627565,0.00613288151287594,1.5,TPESampler,COMPLETE
952,0.21064461028380785,2025-04-24 21:23:16.578719,2025-04-24 21:23:19.917318,0 days 00:00:03.338599,45.99061946305781,RBF,44.981243594130866,0.8368461332162888,0.5,TPESampler,COMPLETE
953,0.17261836288118904,2025-04-24 21:23:18.028532,2025-04-24 21:23:21.591253,0 days 00:00:03.562721,1986.3929764258419,Matern,758.7621960731005,0.0002366184041786729,1.5,TPESampler,COMPLETE
954,0.17261884294077015,2025-04-24 21:23:19.701560,2025-04-24 21:23:23.524018,0 days 00:00:03.822458,11729.79198090334,Matern,1495.9879380253997,0.07056034622108136,1.5,TPESampler,COMPLETE
955,1.3307518540987935,2025-04-24 21:23:20.145875,2025-04-24 21:23:24.379292,0 days 00:00:04.233417,113.24552994871782,Matern,529.4585326784367,0.0006777407894807856,1.5,TPESampler,COMPLETE
956,0.17261872141918594,2025-04-24 21:23:21.825159,2025-04-24 21:23:30.685420,0 days 00:00:08.860261,30.54741171732556,Matern,0.17342140147818444,0.021308912237132972,1.5,TPESampler,COMPLETE
957,0.1726185414993119,2025-04-24 21:23:23.769009,2025-04-24 21:23:27.073292,0 days 00:00:03.304283,19.575455476420792,Matern,64.63984896781591,0.023620516248993185,1.5,TPESampler,COMPLETE
958,0.1726186882014699,2025-04-24 21:23:24.599829,2025-04-24 21:23:28.289907,0 days 00:00:03.690078,371.9264091529568,Matern,1.3874491488564005,0.03706795089930999,1.5,TPESampler,COMPLETE
959,0.1726187102791019,2025-04-24 21:23:27.324927,2025-04-24 21:23:32.459146,0 days 00:00:05.134219,2558.7575539284007,Matern,3.086920598944492,0.00015474519580874684,1.5,TPESampler,COMPLETE
960,0.17261857517762386,2025-04-24 21:23:28.526378,2025-04-24 21:23:31.489390,0 days 00:00:02.963012,908.3546242651068,Matern,476.3273684526327,0.02291804638258493,1.5,TPESampler,COMPLETE
961,0.17261855576777257,2025-04-24 21:23:30.923062,2025-04-24 21:23:33.958272,0 days 00:00:03.035210,26529.236754952894,Matern,1270.4829295318252,0.005791367892697036,1.5,TPESampler,COMPLETE
962,0.17261856029873163,2025-04-24 21:23:31.705950,2025-04-24 21:23:35.025114,0 days 00:00:03.319164,41037.939621552345,Matern,5862.57531117981,0.0015186560056638157,1.5,TPESampler,COMPLETE
963,1.3307518540861856,2025-04-24 21:23:32.674216,2025-04-24 21:23:37.672655,0 days 00:00:04.998439,0.00047345675071912144,Matern,19.144593282280884,0.007955850658778896,1.5,TPESampler,COMPLETE
964,0.1726186150552426,2025-04-24 21:23:34.190843,2025-04-24 21:23:37.019485,0 days 00:00:02.828642,30.18132346837187,Matern,79.10000945000523,0.03432767196509925,1.5,TPESampler,COMPLETE
965,0.21064478326378336,2025-04-24 21:23:35.218521,2025-04-24 21:23:38.470629,0 days 00:00:03.252108,4.49140893416595,RBF,39.57772485852249,0.1360811962771848,1.5,TPESampler,COMPLETE
966,1.3307518540999328,2025-04-24 21:23:37.251153,2025-04-24 21:23:40.310283,0 days 00:00:03.059130,97.39098591825942,Matern,10438.396115851661,0.004273668539706586,1.5,TPESampler,COMPLETE
967,0.17261853399922567,2025-04-24 21:23:37.863193,2025-04-24 21:23:42.016579,0 days 00:00:04.153386,8.24927339279171,Matern,5.98497421236185,0.06211306458858295,1.5,TPESampler,COMPLETE
968,0.17261855604084306,2025-04-24 21:23:38.711800,2025-04-24 21:23:41.738708,0 days 00:00:03.026908,39425.42207774402,Matern,2.971437801348259,0.0015382832105696716,1.5,TPESampler,COMPLETE
969,0.17261857107402892,2025-04-24 21:23:40.495375,2025-04-24 21:23:44.116390,0 days 00:00:03.621015,71619.95091036975,Matern,1943.1654176972488,0.09034909581257677,1.5,TPESampler,COMPLETE
970,1.330751854098904,2025-04-24 21:23:41.969897,2025-04-24 21:23:45.804757,0 days 00:00:03.834860,21854.96923627045,RBF,98.71457091885041,1.0580014808754182e-05,1.5,TPESampler,COMPLETE
971,0.1726182179503889,2025-04-24 21:23:42.263309,2025-04-24 21:23:45.330538,0 days 00:00:03.067229,5186.790587560271,Matern,19.253437461917493,0.027461868142945472,1.5,TPESampler,COMPLETE
972,0.17261854518509895,2025-04-24 21:23:44.356107,2025-04-24 21:23:51.327036,0 days 00:00:06.970929,17.39451868249421,Matern,3443.2508163391035,0.22830430114054603,1.5,TPESampler,COMPLETE
973,0.17261860823219216,2025-04-24 21:23:45.561673,2025-04-24 21:23:49.048020,0 days 00:00:03.486347,1631.4636955770736,Matern,453.4341021010278,0.0003066139947952578,1.5,TPESampler,COMPLETE
974,0.17261854491582979,2025-04-24 21:23:46.038777,2025-04-24 21:23:49.009691,0 days 00:00:02.970914,3733.323228763144,Matern,1.1609280360747964,0.6242595933184514,1.5,TPESampler,COMPLETE
975,0.17261856393169264,2025-04-24 21:23:49.169113,2025-04-24 21:23:52.668730,0 days 00:00:03.499617,47.19722017151661,Matern,44.580751095291255,0.0005544329209239325,1.5,TPESampler,COMPLETE
976,0.17261855162593728,2025-04-24 21:23:49.225896,2025-04-24 21:23:52.620352,0 days 00:00:03.394456,147.14051777952608,Matern,1313.7260739750031,0.017379036428227836,1.5,TPESampler,COMPLETE
977,0.2221146770037226,2025-04-24 21:23:51.566549,2025-04-24 21:23:54.597020,0 days 00:00:03.030471,4398.056781602878,Matern,402.60901575220066,0.008510671414997634,2.5,TPESampler,COMPLETE
978,0.17262005267545502,2025-04-24 21:23:52.808483,2025-04-24 21:24:00.222002,0 days 00:00:07.413519,5644.154504977568,Matern,313.24654658160154,0.9871148616627478,1.5,TPESampler,COMPLETE
979,0.21064375586669976,2025-04-24 21:23:52.855663,2025-04-24 21:23:55.994130,0 days 00:00:03.138467,248.26853660409265,RBF,5.144018856487914,0.0007050912274379301,1.5,TPESampler,COMPLETE
980,0.17261833366979226,2025-04-24 21:23:54.806812,2025-04-24 21:23:58.481181,0 days 00:00:03.674369,1654.083040888311,Matern,4792.350897096841,0.7887022590105517,1.5,TPESampler,COMPLETE
981,1.3677569448360012,2025-04-24 21:23:56.226650,2025-04-24 21:23:58.358552,0 days 00:00:02.131902,2.4715595835953774e-05,Matern,6063.517520431642,0.20402988658557047,1.5,TPESampler,COMPLETE
982,0.17261860259218492,2025-04-24 21:23:58.543781,2025-04-24 21:24:02.902253,0 days 00:00:04.358472,651.1659264701748,Matern,11.873998811889255,0.03550297922061653,1.5,TPESampler,COMPLETE
983,1.3307518540985315,2025-04-24 21:23:58.636006,2025-04-24 21:24:03.569154,0 days 00:00:04.933148,7.950813335642728e-07,RBF,33780.92925520542,2.1140973923435718e-05,0.5,TPESampler,COMPLETE
984,1.3307518541002108,2025-04-24 21:24:00.469710,2025-04-24 21:24:03.375476,0 days 00:00:02.905766,3646.9683928947675,Matern,734.2772299910196,7.67014931793284e-06,1.5,TPESampler,COMPLETE
985,0.17261854639000618,2025-04-24 21:24:03.134957,2025-04-24 21:24:06.730098,0 days 00:00:03.595141,4.35795070945317,Matern,112.3004219532355,0.9807860431735558,1.5,TPESampler,COMPLETE
986,0.2741899932765723,2025-04-24 21:24:03.646960,2025-04-24 21:24:07.295697,0 days 00:00:03.648737,23.071304699293915,Matern,1185.7321845762497,5.674869284567008e-06,0.5,TPESampler,COMPLETE
987,1.367756951437595,2025-04-24 21:24:03.853268,2025-04-24 21:24:07.001000,0 days 00:00:03.147732,0.0038240721709508576,Matern,20465.038837250762,0.8609901994633031,1.5,TPESampler,COMPLETE
988,0.1726181110755005,2025-04-24 21:24:06.932613,2025-04-24 21:24:10.116212,0 days 00:00:03.183599,620.8141781805916,Matern,475.5651472592485,0.003356646032638134,1.5,TPESampler,COMPLETE
989,1.3307518540981138,2025-04-24 21:24:07.244264,2025-04-24 21:24:13.353253,0 days 00:00:06.108989,1.2454328299913195,Matern,10252.579920664735,0.05280717948586672,1.5,TPESampler,COMPLETE
990,1.3307518540992036,2025-04-24 21:24:07.572783,2025-04-24 21:24:10.023735,0 days 00:00:02.450952,151.2097051212096,RBF,0.0001072062519142886,2.73836380189513e-09,1.5,TPESampler,COMPLETE
991,1.3307518540986243,2025-04-24 21:24:10.201917,2025-04-24 21:24:15.621971,0 days 00:00:05.420054,356.03379856097905,Matern,91586.67295765335,0.001875915436357941,1.5,TPESampler,COMPLETE
992,0.1726190533968947,2025-04-24 21:24:10.342976,2025-04-24 21:24:13.408957,0 days 00:00:03.065981,14.238014780361585,Matern,28.115974292138855,0.0083107873053797,1.5,TPESampler,COMPLETE
993,0.1726185110717644,2025-04-24 21:24:13.504851,2025-04-24 21:24:16.261743,0 days 00:00:02.756892,82936.47604902327,Matern,525.631018534904,0.020964570745223995,1.5,TPESampler,COMPLETE
994,0.1726188828578549,2025-04-24 21:24:13.600180,2025-04-24 21:24:18.098892,0 days 00:00:04.498712,2190.1471141388492,Matern,440.09888770167254,0.11192713170864535,1.5,TPESampler,COMPLETE
995,0.17261772877231563,2025-04-24 21:24:15.834762,2025-04-24 21:24:19.642736,0 days 00:00:03.807974,1145.3330362143374,Matern,0.6263070743225504,0.022972077661672717,1.5,TPESampler,COMPLETE
996,0.1726193885070367,2025-04-24 21:24:16.462875,2025-04-24 21:24:21.270449,0 days 00:00:04.807574,319.988441839262,Matern,27.548911744263254,0.010246921830309291,1.5,TPESampler,COMPLETE
997,0.17261880056168816,2025-04-24 21:24:18.339310,2025-04-24 21:24:23.576699,0 days 00:00:05.237389,23.446442285171162,Matern,183.09265380894442,0.0955683705978924,1.5,TPESampler,COMPLETE
998,0.17261832232342583,2025-04-24 21:24:19.853582,2025-04-24 21:24:26.196769,0 days 00:00:06.343187,1639.2609883417274,Matern,2.2908440850767313,0.0025303289378362215,1.5,TPESampler,COMPLETE
999,0.17261855224661718,2025-04-24 21:24:21.483502,2025-04-24 21:24:24.477026,0 days 00:00:02.993524,56599.33053881067,Matern,1.8612862486136876,0.008177523214243707,1.5,TPESampler,COMPLETE
1000,0.17261879435173874,2025-04-24 21:24:23.796201,2025-04-24 21:24:29.337434,0 days 00:00:05.541233,272.2095913870183,Matern,0.17029078620090157,0.062015077273412704,1.5,TPESampler,COMPLETE
1001,0.17261831934628233,2025-04-24 21:24:24.695522,2025-04-24 21:24:29.651143,0 days 00:00:04.955621,11506.036263112117,Matern,0.7431374459306576,0.013539577838326504,1.5,TPESampler,COMPLETE
1002,1.3307518540969472,2025-04-24 21:24:26.423000,2025-04-24 21:24:28.903913,0 days 00:00:02.480913,233.93206107974976,Matern,0.05711853195264301,0.23068984794960293,1.5,TPESampler,COMPLETE
1003,0.22211455272645775,2025-04-24 21:24:29.122602,2025-04-24 21:24:32.276299,0 days 00:00:03.153697,856.1584250632071,Matern,3.4432498794193482,0.6250099353496655,2.5,TPESampler,COMPLETE
1004,1.330751854098541,2025-04-24 21:24:29.553302,2025-04-24 21:24:32.177211,0 days 00:00:02.623909,3778.778596248608,Matern,0.005245822804576347,0.0032590049693102877,1.5,TPESampler,COMPLETE
1005,0.17261919025549147,2025-04-24 21:24:29.911938,2025-04-24 21:24:34.478918,0 days 00:00:04.566980,0.7961494965843674,Matern,0.8574959101366615,0.01083374182957793,1.5,TPESampler,COMPLETE
1006,0.17261857358683838,2025-04-24 21:24:32.352888,2025-04-24 21:24:35.808571,0 days 00:00:03.455683,93.73128066417644,Matern,0.7467715042430533,0.005730612333613941,1.5,TPESampler,COMPLETE
1007,0.1726174818497343,2025-04-24 21:24:32.488065,2025-04-24 21:24:40.381657,0 days 00:00:07.893592,720.7064680047135,Matern,0.1624573606858752,1.379079561803475e-05,1.5,TPESampler,COMPLETE
1008,0.17261857495799732,2025-04-24 21:24:34.709764,2025-04-24 21:24:37.714405,0 days 00:00:03.004641,2084.6211819779737,Matern,1.0061616796508035,0.00541758898567294,1.5,TPESampler,COMPLETE
1009,0.1726185199912741,2025-04-24 21:24:36.052586,2025-04-24 21:24:39.978183,0 days 00:00:03.925597,450.9774501191624,Matern,0.3553016589639171,0.006342519677470623,1.5,TPESampler,COMPLETE
1010,0.2741900993730275,2025-04-24 21:24:37.954702,2025-04-24 21:24:41.251460,0 days 00:00:03.296758,267.5035052910553,Matern,2.5519150172975116,0.010304100529727918,0.5,TPESampler,COMPLETE
1011,0.1726183454558008,2025-04-24 21:24:40.214997,2025-04-24 21:24:46.835617,0 days 00:00:06.620620,5038.924601870203,Matern,5.466055583430655,1.0859690197307765e-05,1.5,TPESampler,COMPLETE
1012,1.3307518540885792,2025-04-24 21:24:40.583684,2025-04-24 21:24:45.995745,0 days 00:00:05.412061,6.753394161453158,Matern,0.010552703766215431,4.5820922821120595e-07,0.5,TPESampler,COMPLETE
1013,0.17261859310395777,2025-04-24 21:24:42.004893,2025-04-24 21:24:48.367067,0 days 00:00:06.362174,314.2759229220129,Matern,0.7384683107360633,5.720238099490518e-07,1.5,TPESampler,COMPLETE
1014,1.3307518540995753,2025-04-24 21:24:46.213467,2025-04-24 21:24:50.198947,0 days 00:00:03.985480,18.78858406781,Matern,577.6677342134708,0.0010377523934589584,1.5,TPESampler,COMPLETE
1015,0.17261901052963965,2025-04-24 21:24:47.069968,2025-04-24 21:24:51.177471,0 days 00:00:04.107503,3693.1287468138707,Matern,0.8713085035380205,1.1786503009569467e-06,1.5,TPESampler,COMPLETE
1016,0.17261840483066077,2025-04-24 21:24:48.606859,2025-04-24 21:24:52.797194,0 days 00:00:04.190335,3120.0597262950464,Matern,226.8426869437189,1.3260762722956494e-06,1.5,TPESampler,COMPLETE
1017,0.17261856047924903,2025-04-24 21:24:50.417226,2025-04-24 21:24:58.202601,0 days 00:00:07.785375,2055.4708471554786,Matern,13.46902195952676,6.0536232628218966e-05,1.5,TPESampler,COMPLETE
1018,1.3307518540987284,2025-04-24 21:24:51.390633,2025-04-24 21:24:57.236905,0 days 00:00:05.846272,408.5462958248827,Matern,0.02049484333250525,1.4947998857796035e-05,1.5,TPESampler,COMPLETE
1019,0.21064462735480108,2025-04-24 21:24:53.375956,2025-04-24 21:24:58.775029,0 days 00:00:05.399073,0.0029592660974802312,RBF,1.8597146053873241,0.11101933137587562,2.5,TPESampler,COMPLETE
1020,0.27419008531602257,2025-04-24 21:24:57.475592,2025-04-24 21:25:01.647950,0 days 00:00:04.172358,43762.45346156168,Matern,60.669211816218684,0.011323648522648954,0.5,TPESampler,COMPLETE
1021,1.3307518540992818,2025-04-24 21:24:58.426910,2025-04-24 21:25:04.471419,0 days 00:00:06.044509,0.0004521694543231483,Matern,236.1968997231043,0.0177049448515278,1.5,TPESampler,COMPLETE
1022,0.17261822206285432,2025-04-24 21:24:59.000295,2025-04-24 21:25:02.297488,0 days 00:00:03.297193,76334.97317617656,Matern,97.4408892325919,0.002732687822506389,1.5,TPESampler,COMPLETE
1023,1.3307518541367054,2025-04-24 21:25:01.871147,2025-04-24 21:25:08.871146,0 days 00:00:06.999999,1.206089303540224e-06,RBF,2154.45212048502,5.5958553635181886e-08,0.5,TPESampler,COMPLETE
1024,0.17261853409550845,2025-04-24 21:25:02.495818,2025-04-24 21:25:06.171762,0 days 00:00:03.675944,1125.5086827541384,Matern,334.31316252754954,0.0002853482677220786,1.5,TPESampler,COMPLETE
1025,1.330751854098805,2025-04-24 21:25:04.694073,2025-04-24 21:25:07.579157,0 days 00:00:02.885084,117.02868745541868,Matern,0.0032015017928934885,7.96893835722543e-06,1.5,TPESampler,COMPLETE
1026,0.17261852394018412,2025-04-24 21:25:06.394527,2025-04-24 21:25:09.919463,0 days 00:00:03.524936,2289.3269662449457,Matern,0.37423151960669665,0.0001922090916388204,1.5,TPESampler,COMPLETE
1027,1.3307518541004624,2025-04-24 21:25:07.811482,2025-04-24 21:25:10.787428,0 days 00:00:02.975946,445.9681353044513,Matern,0.00029076514852130806,5.259621158528004e-08,1.5,TPESampler,COMPLETE
1028,0.17261860549337857,2025-04-24 21:25:09.075843,2025-04-24 21:25:12.914393,0 days 00:00:03.838550,1281.5200106141147,Matern,1.1245421582979127,2.309484070950931e-06,1.5,TPESampler,COMPLETE
1029,1.3307518540987466,2025-04-24 21:25:10.167778,2025-04-24 21:25:14.252968,0 days 00:00:04.085190,46862.78412518303,Matern,10536.025600188615,0.0001235638743188719,1.5,TPESampler,COMPLETE
1030,0.17261839192144915,2025-04-24 21:25:10.999902,2025-04-24 21:25:14.296865,0 days 00:00:03.296963,20.896841492959513,Matern,55.658678107437424,0.03234952422357037,1.5,TPESampler,COMPLETE
1031,0.17261838819551817,2025-04-24 21:25:13.132919,2025-04-24 21:25:19.845752,0 days 00:00:06.712833,0.28455679633902903,Matern,122.7435475299158,0.01231454482944074,1.5,TPESampler,COMPLETE
1032,1.3307518540985732,2025-04-24 21:25:14.393300,2025-04-24 21:25:19.886086,0 days 00:00:05.492786,4766.894809448905,Matern,0.0026058640100738105,5.278654951352642e-06,1.5,TPESampler,COMPLETE
