number,value,datetime_start,datetime_complete,duration,params_constant_value,params_kernel_type,params_length_scale,params_noise_level,params_nu,system_attrs_auto:sampler,state
1033,1.3307518540987997,2025-04-24 21:25:14.443550,2025-04-24 21:25:19.729503,0 days 00:00:05.285953,57.24392226687552,Matern,0.01245760427061242,3.9760934378578584e-05,1.5,TPESampler,COMPLETE
1034,0.17261855039478224,2025-04-24 21:25:19.906565,2025-04-24 21:25:31.825839,0 days 00:00:11.919274,0.05387317073073449,Matern,828.8428464973335,0.8097403527188182,1.5,TPESampler,COMPLETE
1035,1.3307518540970968,2025-04-24 21:25:20.013339,2025-04-24 21:25:27.127277,0 days 00:00:07.113938,3398.3672688767006,Matern,0.01902271128835056,2.988386926928765e-05,1.5,TPESampler,COMPLETE
1036,1.3677560057813651,2025-04-24 21:25:20.134911,2025-04-24 21:25:25.859576,0 days 00:00:05.724665,24880.768839618824,Matern,0.07210525333923332,7.879009090635009e-06,1.5,TPESampler,COMPLETE
1037,1.3307518540996768,2025-04-24 21:25:26.514762,2025-04-24 21:25:31.916038,0 days 00:00:05.401276,33.606237960451125,Matern,0.02061372668460929,4.651620866360983e-05,1.5,TPESampler,COMPLETE
1038,0.17261855308480212,2025-04-24 21:25:27.357511,2025-04-24 21:25:33.949239,0 days 00:00:06.591728,1.1483202509159438,Matern,1.5082292023764352,4.524154631945207e-05,1.5,TPESampler,COMPLETE
1039,1.3307518540987706,2025-04-24 21:25:32.036826,2025-04-24 21:25:36.449021,0 days 00:00:04.412195,0.01811061680837536,Matern,396.8029648722256,0.0033118474857068217,0.5,TPESampler,COMPLETE
1040,0.17261775759834314,2025-04-24 21:25:32.115660,2025-04-24 21:25:37.452739,0 days 00:00:05.337079,25.544780522640966,Matern,0.3803435813979553,6.397971015351566e-06,1.5,TPESampler,COMPLETE
1041,0.21064469119504137,2025-04-24 21:25:34.300337,2025-04-24 21:25:38.405183,0 days 00:00:04.104846,47214.554568154854,RBF,20099.034646166576,0.024820917355032432,1.5,TPESampler,COMPLETE
1042,0.17261854965789286,2025-04-24 21:25:36.691823,2025-04-24 21:25:41.194943,0 days 00:00:04.503120,0.0038537796617746584,Matern,33.7870896703811,0.6377336981708223,1.5,TPESampler,COMPLETE
1043,0.17261848672100588,2025-04-24 21:25:37.680878,2025-04-24 21:25:44.066786,0 days 00:00:06.385908,514.6250296032196,Matern,163.81200170831033,0.010864882689473764,1.5,TPESampler,COMPLETE
1044,1.3307518540986853,2025-04-24 21:25:38.644431,2025-04-24 21:25:43.141935,0 days 00:00:04.497504,69.72424822733781,Matern,4266.065232640853,0.0005552160064657945,1.5,TPESampler,COMPLETE
1045,0.17261852292529126,2025-04-24 21:25:41.414976,2025-04-24 21:25:45.484047,0 days 00:00:04.069071,28.348846329467335,Matern,2.90245563241171,0.00024962023877436225,1.5,TPESampler,COMPLETE
1046,0.172618041834375,2025-04-24 21:25:43.361295,2025-04-24 21:25:46.714773,0 days 00:00:03.353478,4408.006488906166,Matern,95.05945283988547,0.004149667434575586,1.5,TPESampler,COMPLETE
1047,0.172618555766119,2025-04-24 21:25:44.364478,2025-04-24 21:25:48.059729,0 days 00:00:03.695251,188.88681474437664,Matern,0.7496729561178983,2.910107387999828e-05,1.5,TPESampler,COMPLETE
1048,0.17261767278426443,2025-04-24 21:25:45.702534,2025-04-24 21:25:51.145123,0 days 00:00:05.442589,32610.13041058498,Matern,174.5446867809967,0.00011470556474618292,1.5,TPESampler,COMPLETE
1049,0.22211467952224093,2025-04-24 21:25:46.933041,2025-04-24 21:25:49.966472,0 days 00:00:03.033431,9.954134919982017,Matern,48.772844424596,0.02267928111683249,2.5,TPESampler,COMPLETE
1050,0.1726188712176775,2025-04-24 21:25:48.300688,2025-04-24 21:25:51.277185,0 days 00:00:02.976497,93487.61297362299,Matern,538.4761696648234,0.0016257285937421187,1.5,TPESampler,COMPLETE
1051,1.3307518540986183,2025-04-24 21:25:50.194559,2025-04-24 21:25:54.170340,0 days 00:00:03.975781,65.78115003719351,Matern,102.15828456720914,3.872173923695989e-06,2.5,TPESampler,COMPLETE
1052,1.330751854098756,2025-04-24 21:25:51.337437,2025-04-24 21:25:56.480420,0 days 00:00:05.142983,17717.98788780353,Matern,987.9756263772222,3.7492996220010676e-06,2.5,TPESampler,COMPLETE
1053,0.17261815872818204,2025-04-24 21:25:51.519145,2025-04-24 21:25:58.542789,0 days 00:00:07.023644,16128.317593051745,Matern,64.94395310655733,0.0002956341594235936,1.5,TPESampler,COMPLETE
1054,0.17261862088224714,2025-04-24 21:25:54.391791,2025-04-24 21:25:57.441154,0 days 00:00:03.049363,7824.22714367926,Matern,27.395051593343414,6.090403804434322e-05,1.5,TPESampler,COMPLETE
1055,0.172618532422903,2025-04-24 21:25:56.703976,2025-04-24 21:26:00.591140,0 days 00:00:03.887164,539.5979882824662,Matern,244.52164956695916,4.568687701973814e-06,1.5,TPESampler,COMPLETE
1056,0.1726202691789109,2025-04-24 21:25:57.681909,2025-04-24 21:26:00.774639,0 days 00:00:03.092730,73262.45263342225,Matern,10.768204409184671,4.611103522382265e-05,1.5,TPESampler,COMPLETE
1057,1.3323496013583729,2025-04-24 21:25:58.778836,2025-04-24 21:26:06.069715,0 days 00:00:07.290879,0.0009306250262651543,Matern,51.86203343044078,0.019740815971528037,1.5,TPESampler,COMPLETE
1058,0.17261840253194136,2025-04-24 21:26:00.776828,2025-04-24 21:26:03.881423,0 days 00:00:03.104595,51861.22926325036,Matern,27.500306275148535,0.0002789552914466235,1.5,TPESampler,COMPLETE
1059,0.2106449933022085,2025-04-24 21:26:00.978962,2025-04-24 21:26:07.343688,0 days 00:00:06.364726,4.768295252592558e-05,RBF,2.132774117644856,1.3237788181673e-06,1.5,TPESampler,COMPLETE
1060,1.3307518541005041,2025-04-24 21:26:04.132973,2025-04-24 21:26:08.224255,0 days 00:00:04.091282,5413.041876551483,Matern,5374.091694819775,1.5490519826345179e-06,1.5,TPESampler,COMPLETE
1061,1.3307518540987548,2025-04-24 21:26:06.348492,2025-04-24 21:26:10.423767,0 days 00:00:04.075275,9184.55702201931,Matern,8926.976144114622,0.0006366272357867211,1.5,TPESampler,COMPLETE
1062,0.1726185502353439,2025-04-24 21:26:07.556088,2025-04-24 21:26:11.033518,0 days 00:00:03.477430,17050.24834142399,Matern,8.559051332230418,2.2060140383963323e-07,1.5,TPESampler,COMPLETE
1063,1.330751854099169,2025-04-24 21:26:08.449801,2025-04-24 21:26:12.333589,0 days 00:00:03.883788,0.0035930985074085903,RBF,36.63760139711926,3.4768993218117717e-10,1.5,TPESampler,COMPLETE
1064,1.330751854096493,2025-04-24 21:26:10.648779,2025-04-24 21:26:14.200199,0 days 00:00:03.551420,97102.01628066237,Matern,4577.516011645034,4.721638164564872e-05,1.5,TPESampler,COMPLETE
1065,0.17261855042597588,2025-04-24 21:26:11.234985,2025-04-24 21:26:14.583167,0 days 00:00:03.348182,526.46088057455,Matern,117.84543919953406,3.5748901774304044e-05,1.5,TPESampler,COMPLETE
1066,1.330751854098296,2025-04-24 21:26:12.535238,2025-04-24 21:26:15.900914,0 days 00:00:03.365676,0.03798004367661576,Matern,0.0003400020321980316,2.272322036318719e-10,1.5,TPESampler,COMPLETE
1067,0.17261877403971582,2025-04-24 21:26:14.450773,2025-04-24 21:26:18.775040,0 days 00:00:04.324267,47868.41075242215,Matern,3907.5193526429093,0.0008757237899490588,1.5,TPESampler,COMPLETE
1068,0.17261855239824794,2025-04-24 21:26:14.807599,2025-04-24 21:26:18.181019,0 days 00:00:03.373420,47754.54346910775,Matern,22.162800949257694,3.540182923578963e-05,1.5,TPESampler,COMPLETE
1069,0.2741901039529747,2025-04-24 21:26:16.123885,2025-04-24 21:26:20.156602,0 days 00:00:04.032717,9231.51285346888,Matern,7410.416564899931,0.0024454275543972625,0.5,TPESampler,COMPLETE
1070,1.3307518540987016,2025-04-24 21:26:18.417128,2025-04-24 21:26:21.723436,0 days 00:00:03.306308,0.00015783360251356524,Matern,3.8259193065914165,4.1830597173841075e-07,1.5,TPESampler,COMPLETE
1071,1.3677569382602563,2025-04-24 21:26:19.018387,2025-04-24 21:26:23.152676,0 days 00:00:04.134289,0.013135945443729596,Matern,3127.8266947817006,0.9356634877178995,1.5,TPESampler,COMPLETE
1072,1.3307518540986347,2025-04-24 21:26:20.366313,2025-04-24 21:26:24.976020,0 days 00:00:04.609707,281.707688693873,Matern,0.013855895609420379,6.802198354418413e-06,2.5,TPESampler,COMPLETE
1073,1.3307518540731382,2025-04-24 21:26:22.160426,2025-04-24 21:26:26.513316,0 days 00:00:04.352890,3058.6117005196343,Matern,0.06363012645933418,1.394327218729588e-07,1.5,TPESampler,COMPLETE
1074,0.17261913633492848,2025-04-24 21:26:23.607010,2025-04-24 21:26:28.019189,0 days 00:00:04.412179,95209.07961417636,Matern,1157.3346265036307,3.715383397645041e-06,1.5,TPESampler,COMPLETE
1075,0.17261843719696432,2025-04-24 21:26:25.190518,2025-04-24 21:26:29.691732,0 days 00:00:04.501214,1170.775198848385,Matern,461.7577339704547,0.001236662526203366,1.5,TPESampler,COMPLETE
1076,0.21064471475525526,2025-04-24 21:26:26.721702,2025-04-24 21:26:32.036736,0 days 00:00:05.315034,104.85034123592385,RBF,0.23068693686942576,1.2777415682822814e-09,0.5,TPESampler,COMPLETE
1077,1.3307518540988483,2025-04-24 21:26:28.326987,2025-04-24 21:26:32.435610,0 days 00:00:04.108623,35.493488569691074,Matern,4452.782384068974,0.014605957542604112,1.5,TPESampler,COMPLETE
1078,0.17261860367381385,2025-04-24 21:26:29.909122,2025-04-24 21:26:32.968435,0 days 00:00:03.059313,71611.82982039523,Matern,235.39397349937457,0.00038236034353503814,1.5,TPESampler,COMPLETE
1079,0.27419010863087795,2025-04-24 21:26:32.269760,2025-04-24 21:26:34.949860,0 days 00:00:02.680100,0.014035149988429191,Matern,3.8590172215386285,0.8356386300351551,0.5,TPESampler,COMPLETE
1080,0.17261881735726106,2025-04-24 21:26:32.709543,2025-04-24 21:26:37.515016,0 days 00:00:04.805473,46672.950161940855,Matern,440.42819565339465,3.147312489604565e-05,1.5,TPESampler,COMPLETE
1081,0.17261855509904986,2025-04-24 21:26:33.239914,2025-04-24 21:26:36.838891,0 days 00:00:03.598977,0.11074946828418829,Matern,2.290977512501564,0.1464587199592157,1.5,TPESampler,COMPLETE
1082,1.3307518540982852,2025-04-24 21:26:35.161965,2025-04-24 21:26:37.664973,0 days 00:00:02.503008,48.659966583174715,Matern,1.6949369957168717e-05,3.556077414487789e-05,0.5,TPESampler,COMPLETE
1083,1.330751854098112,2025-04-24 21:26:37.072954,2025-04-24 21:26:40.733751,0 days 00:00:03.660797,1069.4783088023967,Matern,3199.7642319208353,0.000558518980851144,1.5,TPESampler,COMPLETE
1084,1.3307518540988013,2025-04-24 21:26:37.701223,2025-04-24 21:26:43.499675,0 days 00:00:05.798452,1.8555994588840155,Matern,5134.992935101065,0.058150838712272265,1.5,TPESampler,COMPLETE
1085,0.1726186821395558,2025-04-24 21:26:37.838966,2025-04-24 21:26:43.677231,0 days 00:00:05.838265,0.024721917173951433,Matern,48.34461658824835,0.907046217045258,1.5,TPESampler,COMPLETE
1086,0.17261768957641765,2025-04-24 21:26:40.970849,2025-04-24 21:26:44.251197,0 days 00:00:03.280348,140.08707007861864,Matern,41.439782648468835,0.00024713590965815295,1.5,TPESampler,COMPLETE
1087,0.17261855112421712,2025-04-24 21:26:43.680831,2025-04-24 21:26:46.745833,0 days 00:00:03.065002,939.4252417026194,Matern,638.3521260962062,0.008542933920094729,1.5,TPESampler,COMPLETE
1088,0.17261809707982723,2025-04-24 21:26:43.898347,2025-04-24 21:26:48.725350,0 days 00:00:04.827003,58.71603220563981,Matern,297.6225511795887,0.034399185974766,1.5,TPESampler,COMPLETE
1089,0.17261853847511896,2025-04-24 21:26:44.519221,2025-04-24 21:26:47.759991,0 days 00:00:03.240770,83901.41014637132,Matern,16.22253186813569,0.13615419372721496,1.5,TPESampler,COMPLETE
1090,1.330751854098993,2025-04-24 21:26:46.994311,2025-04-24 21:26:49.980473,0 days 00:00:02.986162,88227.32745215706,RBF,2.469380697689822e-05,0.00025522400539101,1.5,TPESampler,COMPLETE
1091,0.17261890904000046,2025-04-24 21:26:47.980194,2025-04-24 21:26:51.235205,0 days 00:00:03.255011,503.0043760472889,Matern,1526.4930146598451,0.013823204727224269,1.5,TPESampler,COMPLETE
1092,0.17261810841534522,2025-04-24 21:26:48.937120,2025-04-24 21:26:53.983182,0 days 00:00:05.046062,0.8179587615251016,Matern,23.08294770857928,0.9494243542275611,1.5,TPESampler,COMPLETE
1093,0.2221147723037404,2025-04-24 21:26:50.181426,2025-04-24 21:26:58.206733,0 days 00:00:08.025307,0.0003051866101173619,Matern,668.9269245769362,0.016845731664145953,2.5,TPESampler,COMPLETE
1094,1.3307518540993202,2025-04-24 21:26:51.467875,2025-04-24 21:26:55.875884,0 days 00:00:04.408009,2.6938526747132486e-07,RBF,1.3987223940658758e-05,2.0157929391133883e-08,2.5,TPESampler,COMPLETE
1095,0.17261855987723496,2025-04-24 21:26:54.226439,2025-04-24 21:26:57.350723,0 days 00:00:03.124284,4659.5128693709175,Matern,274.4135771990245,0.023080792171982147,1.5,TPESampler,COMPLETE
1096,1.3677564802710298,2025-04-24 21:26:56.120024,2025-04-24 21:26:59.868107,0 days 00:00:03.748083,0.00013642126719257976,Matern,564.3482387259509,0.16324624313590153,1.5,TPESampler,COMPLETE
1097,1.330751854098941,2025-04-24 21:26:57.599236,2025-04-24 21:27:02.292782,0 days 00:00:04.693546,1827.2912147446068,Matern,39247.00343154826,0.025757679574339155,1.5,TPESampler,COMPLETE
1098,0.17261879867977378,2025-04-24 21:26:58.415037,2025-04-24 21:27:04.324017,0 days 00:00:05.908980,0.0011869301392401859,Matern,3.243520089174952,0.022159525291173855,1.5,TPESampler,COMPLETE
1099,0.1726185363386542,2025-04-24 21:27:00.102322,2025-04-24 21:27:03.861130,0 days 00:00:03.758808,13.35782903257366,Matern,1180.383491287223,0.05615860071227034,1.5,TPESampler,COMPLETE
1100,1.3307518540990109,2025-04-24 21:27:02.522578,2025-04-24 21:27:06.156591,0 days 00:00:03.634013,771.0708710263607,Matern,4232.7375488315865,9.452253542535809e-05,1.5,TPESampler,COMPLETE
1101,0.17261855056150618,2025-04-24 21:27:04.076043,2025-04-24 21:27:08.094315,0 days 00:00:04.018272,0.0030363829109578736,Matern,27607.18666158165,0.0011215181534498036,1.5,TPESampler,COMPLETE
1102,0.17261827216995101,2025-04-24 21:27:04.560054,2025-04-24 21:27:11.411262,0 days 00:00:06.851208,0.00010494924064005343,Matern,38.65947265480296,0.6368607127212509,1.5,TPESampler,COMPLETE
1103,0.17261858113066897,2025-04-24 21:27:06.376399,2025-04-24 21:27:15.101263,0 days 00:00:08.724864,115.5231271515827,Matern,156.46323163893868,7.806734723449263e-05,1.5,TPESampler,COMPLETE
1104,0.1726185770652143,2025-04-24 21:27:08.305890,2025-04-24 21:27:11.779053,0 days 00:00:03.473163,66114.75414121774,Matern,36385.91475601968,0.01959059721603456,1.5,TPESampler,COMPLETE
1105,0.17261869304089206,2025-04-24 21:27:11.644323,2025-04-24 21:27:18.456211,0 days 00:00:06.811888,1.0632209497947294,Matern,79.7030912010489,0.035419026100911244,1.5,TPESampler,COMPLETE
1106,0.17261810090245278,2025-04-24 21:27:12.016210,2025-04-24 21:27:14.941459,0 days 00:00:02.925249,210.23762845405386,Matern,115.91182524702506,0.09265446152874958,1.5,TPESampler,COMPLETE
1107,1.3677569515586483,2025-04-24 21:27:15.143074,2025-04-24 21:27:18.187660,0 days 00:00:03.044586,3.796083495972066e-05,Matern,28803.914363280932,0.777594665817693,1.5,TPESampler,COMPLETE
1108,1.3677568618923701,2025-04-24 21:27:15.371106,2025-04-24 21:27:18.781621,0 days 00:00:03.410515,1.4189106691400089,Matern,9938.830653770197,0.5626031822212714,1.5,TPESampler,COMPLETE
1109,0.17261861039624407,2025-04-24 21:27:18.393603,2025-04-24 21:27:20.991543,0 days 00:00:02.597940,36548.154471380156,Matern,355.3327900586931,0.013498789387368374,1.5,TPESampler,COMPLETE
1110,0.2106434165631423,2025-04-24 21:27:18.718086,2025-04-24 21:27:22.463292,0 days 00:00:03.745206,2204.3358132776225,RBF,1526.0739841592695,0.007555696789751499,2.5,TPESampler,COMPLETE
1111,0.17261847672398326,2025-04-24 21:27:19.043127,2025-04-24 21:27:23.609091,0 days 00:00:04.565964,2622.739160655807,Matern,0.2526143662415487,1.7383577227821645e-05,1.5,TPESampler,COMPLETE
1112,0.17261855115459723,2025-04-24 21:27:21.239050,2025-04-24 21:27:24.676578,0 days 00:00:03.437528,57921.187666938145,Matern,154.0044392186679,0.000264082744253121,1.5,TPESampler,COMPLETE
1113,1.3307518537257232,2025-04-24 21:27:22.701873,2025-04-24 21:27:26.024268,0 days 00:00:03.322395,33.26388440320911,Matern,0.07047582537815072,1.527517619350393e-07,1.5,TPESampler,COMPLETE
1114,0.17261867671957534,2025-04-24 21:27:23.820171,2025-04-24 21:27:27.184508,0 days 00:00:03.364337,2457.3086793686825,Matern,90.05865054078393,0.007084410936907433,1.5,TPESampler,COMPLETE
1115,0.22211473237041765,2025-04-24 21:27:24.889250,2025-04-24 21:27:29.123908,0 days 00:00:04.234658,2489.6905588625095,Matern,6254.499213682026,0.009361268157952744,2.5,TPESampler,COMPLETE
1116,1.3307518540987222,2025-04-24 21:27:26.233662,2025-04-24 21:27:29.355273,0 days 00:00:03.121611,9.851615499612494,Matern,1646.582332307338,0.023442444796820776,1.5,TPESampler,COMPLETE
1117,0.17261776732675208,2025-04-24 21:27:27.395240,2025-04-24 21:27:31.474609,0 days 00:00:04.079369,4.509055609643549,Matern,2.6524449733153483,0.6860761234607622,1.5,TPESampler,COMPLETE
1118,0.17261854954955777,2025-04-24 21:27:29.295999,2025-04-24 21:27:32.300997,0 days 00:00:03.004998,5922.706807083438,Matern,154.56339633161545,0.037681751980483846,1.5,TPESampler,COMPLETE
1119,0.17261871106233853,2025-04-24 21:27:29.578829,2025-04-24 21:27:34.808786,0 days 00:00:05.229957,679.2051412268617,Matern,612.1490673596937,0.0002763027788842272,1.5,TPESampler,COMPLETE
1120,0.17261856406705461,2025-04-24 21:27:31.688851,2025-04-24 21:27:36.381219,0 days 00:00:04.692368,3.0956890257926597,Matern,101.96371525329576,0.1270351913745232,1.5,TPESampler,COMPLETE
1121,1.367756005778254,2025-04-24 21:27:32.534193,2025-04-24 21:27:34.759744,0 days 00:00:02.225551,99354.8565068448,Matern,0.059022738156843106,1.569448697724179e-05,0.5,TPESampler,COMPLETE
1122,0.17261829610039525,2025-04-24 21:27:34.936200,2025-04-24 21:27:41.290771,0 days 00:00:06.354571,437.8937055441299,Matern,7164.158177849077,0.023035124117020103,1.5,TPESampler,COMPLETE
1123,1.3307518540990388,2025-04-24 21:27:35.004175,2025-04-24 21:27:37.867488,0 days 00:00:02.863313,38.572540859586624,Matern,5.856115532971015e-05,0.00018533327462131623,2.5,TPESampler,COMPLETE
1124,1.3307518540987797,2025-04-24 21:27:36.595383,2025-04-24 21:27:41.025269,0 days 00:00:04.429886,0.009578061200890813,Matern,36.43977040187371,0.008956486695823971,1.5,TPESampler,COMPLETE
1125,0.17261867307484485,2025-04-24 21:27:38.137078,2025-04-24 21:27:41.443230,0 days 00:00:03.306152,137.84949676870252,Matern,56.07243952073525,0.0002829093307320466,1.5,TPESampler,COMPLETE
1126,0.1726184924784221,2025-04-24 21:27:41.234351,2025-04-24 21:27:45.000034,0 days 00:00:03.765683,473.0845715224917,Matern,33.396856653713954,0.7867607758857436,1.5,TPESampler,COMPLETE
1127,0.22211469381599458,2025-04-24 21:27:41.539484,2025-04-24 21:27:47.256254,0 days 00:00:05.716770,6.738752663063822e-05,Matern,0.22618524283560962,7.4040451344461155e-06,2.5,TPESampler,COMPLETE
1128,0.17261856314649174,2025-04-24 21:27:41.642915,2025-04-24 21:27:44.952609,0 days 00:00:03.309694,223.88364362992976,Matern,244.0290347543098,0.034670915365926015,1.5,TPESampler,COMPLETE
1129,0.17261862686165375,2025-04-24 21:27:45.132876,2025-04-24 21:27:49.867579,0 days 00:00:04.734703,3188.7486896993896,Matern,1847.2483444298998,0.05551413705690266,1.5,TPESampler,COMPLETE
1130,0.17261806846044717,2025-04-24 21:27:45.199185,2025-04-24 21:27:48.639886,0 days 00:00:03.440701,767.1961923958091,Matern,468.1075722350833,0.04065459841314759,1.5,TPESampler,COMPLETE
1131,0.1726184787467357,2025-04-24 21:27:47.468508,2025-04-24 21:27:55.346457,0 days 00:00:07.877949,0.0001668560978000395,Matern,410.23631432162847,0.6238162913114254,1.5,TPESampler,COMPLETE
1132,1.3677560057814224,2025-04-24 21:27:48.874996,2025-04-24 21:27:51.495693,0 days 00:00:02.620697,22526.977006055393,RBF,0.008022498909254138,3.626401026485334e-10,1.5,TPESampler,COMPLETE
1133,0.1726203345867331,2025-04-24 21:27:50.126110,2025-04-24 21:27:57.378903,0 days 00:00:07.252793,10063.466592756798,Matern,1043.0722680868323,0.00034524266016033357,1.5,TPESampler,COMPLETE
1134,1.3307518540987817,2025-04-24 21:27:51.706432,2025-04-24 21:27:57.644482,0 days 00:00:05.938050,52521.98099096825,RBF,9581.993077406458,3.7674091315601e-10,1.5,TPESampler,COMPLETE
1135,0.1726184824926013,2025-04-24 21:27:55.591485,2025-04-24 21:27:59.958423,0 days 00:00:04.366938,3.771708280386248,Matern,238.4951061767752,0.004985716432057639,1.5,TPESampler,COMPLETE
1136,1.3307518540985972,2025-04-24 21:27:57.589574,2025-04-24 21:28:01.517747,0 days 00:00:03.928173,2871.7355403844535,Matern,91283.5241793545,4.849261570672268e-05,1.5,TPESampler,COMPLETE
1137,0.17261863190161267,2025-04-24 21:27:57.867445,2025-04-24 21:28:00.829305,0 days 00:00:02.961860,92570.34698730377,Matern,332.32766310720865,0.00013404436847877632,1.5,TPESampler,COMPLETE
1138,0.17261746042904452,2025-04-24 21:28:00.199634,2025-04-24 21:28:05.812926,0 days 00:00:05.613292,4357.5629807237565,Matern,90.63231003564687,0.02760381628518239,1.5,TPESampler,COMPLETE
1139,0.17261859503625962,2025-04-24 21:28:01.023291,2025-04-24 21:28:06.968183,0 days 00:00:05.944892,1.5273532856809067,Matern,704.5042663907532,0.7724835020315598,1.5,TPESampler,COMPLETE
1140,1.3307518540985017,2025-04-24 21:28:01.738435,2025-04-24 21:28:06.883017,0 days 00:00:05.144582,134.5303342604248,Matern,55921.29434109879,0.00988636521892059,1.5,TPESampler,COMPLETE
1141,0.21064481123286605,2025-04-24 21:28:06.034675,2025-04-24 21:28:09.680000,0 days 00:00:03.645325,2399.1851946985016,RBF,412.8491661633596,0.03053661044602841,1.5,TPESampler,COMPLETE
1142,0.17261879120588602,2025-04-24 21:28:07.063842,2025-04-24 21:28:12.049724,0 days 00:00:04.985882,6411.967953277289,Matern,5.883278129738236,0.23189572867911049,1.5,TPESampler,COMPLETE
1143,0.1726185463810545,2025-04-24 21:28:07.194395,2025-04-24 21:28:14.139182,0 days 00:00:06.944787,59562.99297112699,Matern,14.620675485845917,0.01172647800843954,1.5,TPESampler,COMPLETE
1144,0.17261861824901356,2025-04-24 21:28:09.904103,2025-04-24 21:28:13.087163,0 days 00:00:03.183060,73072.8300138664,Matern,108.44515912326747,0.03831863483589635,1.5,TPESampler,COMPLETE
1145,0.17261852352994494,2025-04-24 21:28:12.278038,2025-04-24 21:28:15.690577,0 days 00:00:03.412539,141.0185725870191,Matern,17.102924883198437,0.06886319972751598,1.5,TPESampler,COMPLETE
1146,0.1726184986098075,2025-04-24 21:28:13.327678,2025-04-24 21:28:16.882620,0 days 00:00:03.554942,163.60832663243266,Matern,1630.0349482397494,0.19346118758482259,1.5,TPESampler,COMPLETE
