number,value,datetime_start,datetime_complete,duration,params_constant_value,params_kernel_type,params_length_scale,params_noise_level,params_nu,system_attrs_auto:sampler,state
2287,0.26238332827357363,2025-04-24 22:14:02.362563,2025-04-24 22:14:06.501577,0 days 00:00:04.139014,3.0874037365857436,Matern,99.11253177705206,0.0007862443514504261,0.5,TPESampler,COMPLETE
2288,0.2623834717188636,2025-04-24 22:14:02.992637,2025-04-24 22:14:10.440162,0 days 00:00:07.447525,53663.05437353365,Matern,0.1603649775401002,0.02360022983698009,0.5,TPESampler,COMPLETE
2289,0.2623834979307996,2025-04-24 22:14:06.319464,2025-04-24 22:14:11.187621,0 days 00:00:04.868157,72049.22968729038,Matern,1392.7049161613263,0.03902351375572943,0.5,TPESampler,COMPLETE
2290,0.9329374977588912,2025-04-24 22:14:06.764987,2025-04-24 22:14:15.583124,0 days 00:00:08.818137,0.0006653905110746086,Matern,23008.38447648136,0.0001385284844920817,2.5,TPESampler,COMPLETE
2291,0.2623834661929523,2025-04-24 22:14:10.687852,2025-04-24 22:14:14.969917,0 days 00:00:04.282065,99.46902409684877,Matern,1169.3120056508096,0.9101217330490606,0.5,TPESampler,COMPLETE
2292,0.26238348962124,2025-04-24 22:14:11.442986,2025-04-24 22:14:15.390095,0 days 00:00:03.947109,0.7395710561398043,Matern,9.424166692457263,0.004656227743714231,0.5,TPESampler,COMPLETE
2293,0.2623833455369925,2025-04-24 22:14:15.235242,2025-04-24 22:14:28.092327,0 days 00:00:12.857085,63186.83545760091,Matern,0.1552594871049925,0.0015338282705500397,0.5,TPESampler,COMPLETE
2294,0.9329375015525203,2025-04-24 22:14:15.615077,2025-04-24 22:14:19.253380,0 days 00:00:03.638303,15.63420190263041,Matern,0.03585250452023855,0.021705258845258302,0.5,TPESampler,COMPLETE
2295,0.26238348214455304,2025-04-24 22:14:15.873685,2025-04-24 22:14:20.932021,0 days 00:00:05.058336,68203.72181060922,Matern,6.362281065022266,0.001668682016605009,0.5,TPESampler,COMPLETE
2296,0.9329374977693878,2025-04-24 22:14:19.506445,2025-04-24 22:14:22.789178,0 days 00:00:03.282733,56809.94187670712,Matern,5.789781263152664e-05,0.03834054811017563,2.5,TPESampler,COMPLETE
2297,0.26238346910572885,2025-04-24 22:14:21.162648,2025-04-24 22:14:25.623192,0 days 00:00:04.460544,65.05684480035599,Matern,97.13150792319502,0.03010627562106027,0.5,TPESampler,COMPLETE
2298,0.9928350583693539,2025-04-24 22:14:23.035451,2025-04-24 22:14:26.319694,0 days 00:00:03.284243,2.7150061675031756,RBF,0.018440046367640028,6.442891910434857e-07,2.5,TPESampler,COMPLETE
2299,0.992836555509532,2025-04-24 22:14:25.928446,2025-04-24 22:14:28.382515,0 days 00:00:02.454069,90339.07453617099,Matern,0.5917304967280571,0.00952810863643711,0.5,TPESampler,COMPLETE
2300,0.2623834647561988,2025-04-24 22:14:26.573176,2025-04-24 22:14:36.121802,0 days 00:00:09.548626,0.0005749346154212474,Matern,32.482585323136945,0.9723683528276823,0.5,TPESampler,COMPLETE
2301,0.9329374999606613,2025-04-24 22:14:28.312477,2025-04-24 22:14:33.595309,0 days 00:00:05.282832,1076.2055560281951,RBF,0.10854018829749455,0.5496131251391608,0.5,TPESampler,COMPLETE
2302,0.2678747498405657,2025-04-24 22:14:28.628298,2025-04-24 22:14:35.354269,0 days 00:00:06.725971,5831.203608096328,Matern,15.632309824805263,0.14615033305359354,1.5,TPESampler,COMPLETE
2303,0.26238347508203547,2025-04-24 22:14:33.827750,2025-04-24 22:14:46.428584,0 days 00:00:12.600834,0.0124499587097423,Matern,0.9951000057970835,0.011184243403635611,0.5,TPESampler,COMPLETE
2304,0.26238346550100605,2025-04-24 22:14:35.646491,2025-04-24 22:14:44.332589,0 days 00:00:08.686098,0.7310390150823889,Matern,2.3291685667216586,0.03596394722086388,0.5,TPESampler,COMPLETE
2305,0.9329374976722536,2025-04-24 22:14:36.396871,2025-04-24 22:14:47.810447,0 days 00:00:11.413576,2308.3014404358887,Matern,0.009501504150324863,0.0005375877532749134,0.5,TPESampler,COMPLETE
2306,0.9329374977415044,2025-04-24 22:14:45.306093,2025-04-24 22:14:50.170180,0 days 00:00:04.864087,1021.6310524204116,Matern,0.003252383996899621,0.04992687898712284,0.5,TPESampler,COMPLETE
2307,0.9329374977619276,2025-04-24 22:14:47.415801,2025-04-24 22:14:52.122215,0 days 00:00:04.706414,0.02924778428925376,Matern,103.91806089869449,0.0010812528622696955,0.5,TPESampler,COMPLETE
2308,0.2623834822291946,2025-04-24 22:14:48.088552,2025-04-24 22:14:53.279274,0 days 00:00:05.190722,43.352285083148324,Matern,3296.4179766647726,0.014432085529062794,0.5,TPESampler,COMPLETE
2309,0.282517554021604,2025-04-24 22:14:50.422447,2025-04-24 22:14:54.769048,0 days 00:00:04.346601,3635.725807493649,RBF,20.25952997397002,0.03135697047814679,0.5,TPESampler,COMPLETE
2310,0.2623834759076906,2025-04-24 22:14:52.369649,2025-04-24 22:14:57.778442,0 days 00:00:05.408793,87176.11419257519,Matern,3.329439017403755,0.29928752668502734,0.5,TPESampler,COMPLETE
2311,0.2623834576689971,2025-04-24 22:14:53.562043,2025-04-24 22:14:59.037666,0 days 00:00:05.475623,57.07428906721779,Matern,27.204637312341138,0.006186657893556694,0.5,TPESampler,COMPLETE
2312,0.2623834753672289,2025-04-24 22:14:55.048730,2025-04-24 22:14:59.401483,0 days 00:00:04.352753,33.257238971802636,Matern,974.9294053892247,0.010756570661177597,0.5,TPESampler,COMPLETE
2313,0.932937497730672,2025-04-24 22:14:58.033805,2025-04-24 22:15:04.823323,0 days 00:00:06.789518,9024.724627382539,RBF,878.443434285577,0.002941139364706745,0.5,TPESampler,COMPLETE
2314,0.2623835003934635,2025-04-24 22:14:59.298202,2025-04-24 22:15:04.998276,0 days 00:00:05.700074,8.27559395788164,Matern,0.22590089323780377,0.9908947111385574,0.5,TPESampler,COMPLETE
2315,0.26238347587812555,2025-04-24 22:14:59.742411,2025-04-24 22:15:04.523082,0 days 00:00:04.780671,0.08593146520874549,Matern,1.5697245456751099,0.6190492424595032,0.5,TPESampler,COMPLETE
2316,0.28251753202583424,2025-04-24 22:15:04.783793,2025-04-24 22:15:09.842811,0 days 00:00:05.059018,0.26589567634742617,RBF,126.41635933313037,0.7995534281654594,0.5,TPESampler,COMPLETE
2317,0.26238347397693845,2025-04-24 22:15:05.114926,2025-04-24 22:15:10.169967,0 days 00:00:05.055041,51.19023163333779,Matern,76.04708781230126,0.05286510550846091,0.5,TPESampler,COMPLETE
2318,0.9329374976292563,2025-04-24 22:15:05.286174,2025-04-24 22:15:08.792774,0 days 00:00:03.506600,0.1313209568752488,RBF,6.679571042229257e-05,0.00020150920860458087,1.5,TPESampler,COMPLETE
2319,0.26238344105974976,2025-04-24 22:15:09.046533,2025-04-24 22:15:14.064742,0 days 00:00:05.018209,24.467198085777305,Matern,0.9625879592106091,0.002529803036723058,0.5,TPESampler,COMPLETE
2320,0.26238347304138065,2025-04-24 22:15:10.069204,2025-04-24 22:15:14.653756,0 days 00:00:04.584552,392.8235738901602,Matern,1.6207251630158044,0.9979878404891435,0.5,TPESampler,COMPLETE
2321,0.2623834695213019,2025-04-24 22:15:10.430418,2025-04-24 22:15:14.869373,0 days 00:00:04.438955,928.9614031827372,Matern,7052.232741226325,0.018173505586619367,0.5,TPESampler,COMPLETE
2322,0.26238347313680466,2025-04-24 22:15:14.383679,2025-04-24 22:15:20.063261,0 days 00:00:05.679582,331.4983479706476,Matern,2206.090528445282,0.879448797070631,0.5,TPESampler,COMPLETE
2323,0.26238347422751557,2025-04-24 22:15:14.967698,2025-04-24 22:15:20.117720,0 days 00:00:05.150022,1126.4608907384788,Matern,0.7376593286214922,0.02438678402873076,0.5,TPESampler,COMPLETE
2324,0.26238348063086897,2025-04-24 22:15:15.192760,2025-04-24 22:15:21.239606,0 days 00:00:06.046846,0.03899258933638143,Matern,0.6972384317454069,0.7823551984922296,0.5,TPESampler,COMPLETE
2325,0.2623834408829128,2025-04-24 22:15:20.257087,2025-04-24 22:15:25.787975,0 days 00:00:05.530888,6.279251226202254,Matern,74.60497708451389,0.025148012634506393,0.5,TPESampler,COMPLETE
2326,0.9329375000214783,2025-04-24 22:15:20.412179,2025-04-24 22:15:28.654655,0 days 00:00:08.242476,7647.767365311568,Matern,77885.89526178195,0.0001871414211554421,1.5,TPESampler,COMPLETE
2327,0.9329374978370596,2025-04-24 22:15:21.484015,2025-04-24 22:15:29.520837,0 days 00:00:08.036822,0.012299421538709865,Matern,0.005163451225223325,0.014911322447285493,0.5,TPESampler,COMPLETE
2328,0.2623834755033881,2025-04-24 22:15:26.203665,2025-04-24 22:15:32.191951,0 days 00:00:05.988286,302.8001090981642,Matern,188.9505007399211,0.0027609015431279862,0.5,TPESampler,COMPLETE
2329,0.2623834628377297,2025-04-24 22:15:29.048771,2025-04-24 22:15:33.152504,0 days 00:00:04.103733,0.5853465963125325,Matern,4.455499000535649,0.0023757519665414664,0.5,TPESampler,COMPLETE
2330,0.2623834772007039,2025-04-24 22:15:29.835496,2025-04-24 22:15:34.687378,0 days 00:00:04.851882,0.38737300553069604,Matern,0.23355977366677594,0.038491088225841824,0.5,TPESampler,COMPLETE
2331,0.9329374977632252,2025-04-24 22:15:32.442644,2025-04-24 22:15:37.871113,0 days 00:00:05.428469,50.400705333055804,Matern,77132.46239823167,0.005893682136031579,0.5,TPESampler,COMPLETE
2332,0.9329374977274805,2025-04-24 22:15:33.384751,2025-04-24 22:15:39.692180,0 days 00:00:06.307429,30.410575092297023,Matern,68628.79390367611,0.03414170719491999,2.5,TPESampler,COMPLETE
2333,0.26238343894643446,2025-04-24 22:15:34.896245,2025-04-24 22:15:39.459354,0 days 00:00:04.563109,2.5572845855392794,Matern,1.289521615094629,0.04209230946570703,0.5,TPESampler,COMPLETE
2334,0.9329374976417528,2025-04-24 22:15:38.119476,2025-04-24 22:15:45.181394,0 days 00:00:07.061918,0.5107888405055174,RBF,708.6210508671498,2.033780187650688e-05,0.5,TPESampler,COMPLETE
2335,0.26238348305518416,2025-04-24 22:15:39.654446,2025-04-24 22:15:44.340655,0 days 00:00:04.686209,958.4647283847199,Matern,340.21912115900165,0.8352621073632365,0.5,TPESampler,COMPLETE
2336,0.2623834779518271,2025-04-24 22:15:40.023222,2025-04-24 22:15:47.619085,0 days 00:00:07.595863,170.2621989746496,Matern,0.14089923882070216,0.00043561262308200514,0.5,TPESampler,COMPLETE
2337,0.2623834750054169,2025-04-24 22:15:44.627871,2025-04-24 22:15:50.454495,0 days 00:00:05.826624,0.3652305171621327,Matern,0.2641696149653142,0.9738148120492361,0.5,TPESampler,COMPLETE
2338,0.2623834708822074,2025-04-24 22:15:45.415331,2025-04-24 22:15:49.421570,0 days 00:00:04.006239,0.05629030360747147,Matern,3.651248839500939,0.9821506369054611,0.5,TPESampler,COMPLETE
2339,0.9329374809341856,2025-04-24 22:15:47.924408,2025-04-24 22:15:51.373756,0 days 00:00:03.449348,3773.683684287854,Matern,0.05677032615496456,0.904379448738385,0.5,TPESampler,COMPLETE
2340,0.9329374981151299,2025-04-24 22:15:49.677587,2025-04-24 22:15:54.152207,0 days 00:00:04.474620,2.3779958907738066,Matern,845.3653411093312,0.00041060446629261895,0.5,TPESampler,COMPLETE
2341,0.9928365555095288,2025-04-24 22:15:50.759870,2025-04-24 22:15:53.337958,0 days 00:00:02.578088,1070.378668383242,Matern,0.6097245600364436,0.009419747451103357,0.5,TPESampler,COMPLETE
2342,0.26238340774242314,2025-04-24 22:15:51.728668,2025-04-24 22:15:56.166543,0 days 00:00:04.437875,3.4230872529498635,Matern,28.265999527252433,0.03014820751345892,0.5,TPESampler,COMPLETE
2343,0.2623834760819632,2025-04-24 22:15:53.596741,2025-04-24 22:15:58.699292,0 days 00:00:05.102551,848.1066955064002,Matern,404.14703318642137,0.0293862227445284,0.5,TPESampler,COMPLETE
2344,0.2623834738948668,2025-04-24 22:15:54.387539,2025-04-24 22:16:01.882160,0 days 00:00:07.494621,11.121780108214681,Matern,0.1479993897035569,0.06721763437927214,0.5,TPESampler,COMPLETE
2345,0.9928356822137165,2025-04-24 22:15:56.434273,2025-04-24 22:15:59.783739,0 days 00:00:03.349466,24.39175380524934,Matern,1.2277538393280003,1.7752661842143213e-05,0.5,TPESampler,COMPLETE
2346,0.26238396225576766,2025-04-24 22:15:58.995914,2025-04-24 22:16:03.374355,0 days 00:00:04.378441,0.14139014921656629,Matern,10.596344346745536,0.04798410701236929,0.5,TPESampler,COMPLETE
2347,0.26238347610388696,2025-04-24 22:16:00.000174,2025-04-24 22:16:05.739559,0 days 00:00:05.739385,3170.1718327925137,Matern,3.0821763203166976,0.0758355575318735,0.5,TPESampler,COMPLETE
2348,0.26238335804934837,2025-04-24 22:16:02.139921,2025-04-24 22:16:07.826638,0 days 00:00:05.686717,0.25938889465392545,Matern,194.23454790060018,0.018095661802193675,0.5,TPESampler,COMPLETE
2349,0.2623834723138683,2025-04-24 22:16:03.596156,2025-04-24 22:16:09.029664,0 days 00:00:05.433508,27472.85569740795,Matern,41700.15292776268,0.757294201583548,0.5,TPESampler,COMPLETE
2350,0.26238347257405825,2025-04-24 22:16:06.006632,2025-04-24 22:16:10.929038,0 days 00:00:04.922406,1.232753822358123,Matern,239.37951375005778,0.03513890042369472,0.5,TPESampler,COMPLETE
2351,0.9928350583225732,2025-04-24 22:16:08.066217,2025-04-24 22:16:10.769639,0 days 00:00:02.703422,59221.15273429122,Matern,0.06293007082751623,0.00897977768241002,0.5,TPESampler,COMPLETE
2352,0.2623834521118049,2025-04-24 22:16:09.288784,2025-04-24 22:16:13.151785,0 days 00:00:03.863001,92685.22388839016,Matern,264.9934395140854,0.001120082267584023,0.5,TPESampler,COMPLETE
2353,0.26238348608245055,2025-04-24 22:16:10.979525,2025-04-24 22:16:16.447032,0 days 00:00:05.467507,49.175648796180106,Matern,25.797544727150534,0.04705830658790776,0.5,TPESampler,COMPLETE
2354,0.992835058384136,2025-04-24 22:16:11.219176,2025-04-24 22:16:14.248696,0 days 00:00:03.029520,180.09191843889806,RBF,0.00560736260407385,1.8484786359176948e-10,2.5,TPESampler,COMPLETE
2355,0.2623834720889774,2025-04-24 22:16:13.444874,2025-04-24 22:16:17.632432,0 days 00:00:04.187558,3.133945460440448,Matern,4.7182103643692,0.8815538796879344,0.5,TPESampler,COMPLETE
2356,0.26238343969492245,2025-04-24 22:16:14.569905,2025-04-24 22:16:21.103897,0 days 00:00:06.533992,0.03742980622422247,Matern,10.061586643294527,0.043516402497899495,0.5,TPESampler,COMPLETE
2357,0.26787475478437256,2025-04-24 22:16:16.731449,2025-04-24 22:16:22.339749,0 days 00:00:05.608300,4109.968571006755,Matern,1982.7166927520134,0.8541240625865698,1.5,TPESampler,COMPLETE
2358,0.9329374983547346,2025-04-24 22:16:17.887406,2025-04-24 22:16:22.395517,0 days 00:00:04.508111,8.597664512762249,RBF,0.040040630483118456,5.5282794538680505e-05,0.5,TPESampler,COMPLETE
2359,0.932937497340162,2025-04-24 22:16:21.421141,2025-04-24 22:16:25.958976,0 days 00:00:04.537835,11.573196903439774,RBF,0.0002444595120576966,0.0001376883601342427,0.5,TPESampler,COMPLETE
2360,0.9329374977055882,2025-04-24 22:16:22.531307,2025-04-24 22:16:26.613403,0 days 00:00:04.082096,26.73935690939216,Matern,0.04231402208266892,0.044787509305941955,0.5,TPESampler,COMPLETE
2361,0.932937497455274,2025-04-24 22:16:22.586680,2025-04-24 22:16:26.240586,0 days 00:00:03.653906,0.131340005843717,Matern,149.5944010257157,3.863593775525177e-05,0.5,TPESampler,COMPLETE
2362,0.2623834744597482,2025-04-24 22:16:26.200260,2025-04-24 22:16:31.487472,0 days 00:00:05.287212,124.00666367528203,Matern,2932.0973145889416,0.7469540800194148,0.5,TPESampler,COMPLETE
2363,0.9928365555095355,2025-04-24 22:16:26.541390,2025-04-24 22:16:29.351142,0 days 00:00:02.809752,4140.291889260571,Matern,55.29200122291848,0.007888805538156782,0.5,TPESampler,COMPLETE
2364,0.2623834569673551,2025-04-24 22:16:26.889085,2025-04-24 22:16:33.437838,0 days 00:00:06.548753,259.2003885790972,Matern,0.10326961735874331,0.8025865417259632,0.5,TPESampler,COMPLETE
2365,0.9329374965527105,2025-04-24 22:16:29.664760,2025-04-24 22:16:35.302785,0 days 00:00:05.638025,1.3212394244919195e-07,Matern,0.0036707765001968034,3.399421475071568e-08,2.5,TPESampler,COMPLETE
2366,0.2825175507182106,2025-04-24 22:16:31.739994,2025-04-24 22:16:37.065040,0 days 00:00:05.325046,23627.25390868797,RBF,4.614634350892653,0.35653881463129145,1.5,TPESampler,COMPLETE
2367,0.26238349638988906,2025-04-24 22:16:33.648408,2025-04-24 22:16:38.075254,0 days 00:00:04.426846,41330.0717981993,Matern,0.5919997976607814,0.7795166384230019,0.5,TPESampler,COMPLETE
2368,0.2623835320513402,2025-04-24 22:16:35.591464,2025-04-24 22:16:39.584315,0 days 00:00:03.992851,178.3857388608334,Matern,5.380927808577395,0.0056379803267291445,0.5,TPESampler,COMPLETE
2369,0.9329374981937506,2025-04-24 22:16:37.316769,2025-04-24 22:16:41.056266,0 days 00:00:03.739497,4.451525808107062,Matern,2616.2335610406853,0.001770891264893852,0.5,TPESampler,COMPLETE
2370,0.2623834734963096,2025-04-24 22:16:38.350601,2025-04-24 22:16:43.109406,0 days 00:00:04.758805,4.480044275256881,Matern,186.44608462266623,0.03758421981106535,0.5,TPESampler,COMPLETE
2371,0.2623834751846197,2025-04-24 22:16:39.806842,2025-04-24 22:16:45.377210,0 days 00:00:05.570368,109.36137230767963,Matern,16631.06497518502,0.07527791815282085,0.5,TPESampler,COMPLETE
2372,0.26238343441222123,2025-04-24 22:16:41.319959,2025-04-24 22:16:46.866143,0 days 00:00:05.546184,2012.3399276703956,Matern,0.3473147721013241,0.03205482455739587,0.5,TPESampler,COMPLETE
2373,0.2623834706079585,2025-04-24 22:16:43.325234,2025-04-24 22:16:47.694986,0 days 00:00:04.369752,18.756959379745915,Matern,783.6413865530941,0.04990500530061957,0.5,TPESampler,COMPLETE
2374,0.26238333634019473,2025-04-24 22:16:45.624022,2025-04-24 22:16:49.920483,0 days 00:00:04.296461,457.9516241033872,Matern,22.90751041608113,0.38922403501598374,0.5,TPESampler,COMPLETE
2375,0.26238344932363505,2025-04-24 22:16:47.089336,2025-04-24 22:16:51.968156,0 days 00:00:04.878820,23.110775456914077,Matern,15.32187604976182,0.9396837677998345,0.5,TPESampler,COMPLETE
2376,0.2623834663077114,2025-04-24 22:16:47.952041,2025-04-24 22:16:55.134030,0 days 00:00:07.181989,0.07525878147707822,Matern,0.11363930175730651,0.015987399957951984,0.5,TPESampler,COMPLETE
2377,0.9329374976503009,2025-04-24 22:16:50.168332,2025-04-24 22:16:54.755667,0 days 00:00:04.587335,0.15466328137783703,Matern,59.338573769244995,0.0014229772836716408,0.5,TPESampler,COMPLETE
2378,0.9928348458064747,2025-04-24 22:16:52.245249,2025-04-24 22:16:54.312292,0 days 00:00:02.067043,3.0343667802081424e-07,Matern,1074.7712575343044,0.5059170449789497,0.5,TPESampler,COMPLETE
2379,0.26787458476581794,2025-04-24 22:16:54.714243,2025-04-24 22:16:58.837821,0 days 00:00:04.123578,325.01134301745935,Matern,1.2244293317282635,0.02823788060084707,1.5,TPESampler,COMPLETE
2380,0.9329374977675574,2025-04-24 22:16:55.030474,2025-04-24 22:17:02.969557,0 days 00:00:07.939083,918.9656756620107,RBF,20905.269106633074,2.3180844628658908e-07,1.5,TPESampler,COMPLETE
2381,0.2623836620485311,2025-04-24 22:16:55.374882,2025-04-24 22:17:00.422833,0 days 00:00:05.047951,73.76678612015898,Matern,32.52802455873631,0.0002654700190500346,0.5,TPESampler,COMPLETE
2382,0.2623834753940225,2025-04-24 22:16:59.116884,2025-04-24 22:17:04.381194,0 days 00:00:05.264310,64.3172742483782,Matern,5500.998076098783,0.020008467042814945,0.5,TPESampler,COMPLETE
2383,0.26238345086909287,2025-04-24 22:17:00.639560,2025-04-24 22:17:05.401864,0 days 00:00:04.762304,13.537457466967876,Matern,1.4314006011734068,0.013824121547549478,0.5,TPESampler,COMPLETE
2384,0.26238347433527054,2025-04-24 22:17:03.237264,2025-04-24 22:17:07.630662,0 days 00:00:04.393398,1488.6944435211155,Matern,0.6331280323789931,0.001203136236819048,0.5,TPESampler,COMPLETE
2385,0.2623834803320939,2025-04-24 22:17:04.666906,2025-04-24 22:17:09.431507,0 days 00:00:04.764601,1.1046327340698296,Matern,0.30526168956741606,0.991411532167257,0.5,TPESampler,COMPLETE
2386,0.2623834633461145,2025-04-24 22:17:05.650183,2025-04-24 22:17:10.575214,0 days 00:00:04.925031,131.96749850913105,Matern,1.878788634101733,0.08428173864169865,0.5,TPESampler,COMPLETE
2387,0.9928365739254639,2025-04-24 22:17:07.912751,2025-04-24 22:17:11.158449,0 days 00:00:03.245698,1508.4376684931508,RBF,1.0508806561734412,1.2471667364551814e-07,2.5,TPESampler,COMPLETE
2388,0.932937497776018,2025-04-24 22:17:09.720745,2025-04-24 22:17:18.613704,0 days 00:00:08.892959,0.002678257580084584,Matern,1869.7516929216042,0.0008503383217596806,0.5,TPESampler,COMPLETE
2389,0.9928350583598852,2025-04-24 22:17:10.894750,2025-04-24 22:17:13.594180,0 days 00:00:02.699430,4786.978998318541,Matern,0.000616903618313867,0.007196616075032378,0.5,TPESampler,COMPLETE
2390,0.9329374978272634,2025-04-24 22:17:11.445431,2025-04-24 22:17:17.333008,0 days 00:00:05.887577,0.004900491949272662,Matern,15.09973234803669,0.021196891770086556,0.5,TPESampler,COMPLETE
2391,0.26238347713475973,2025-04-24 22:17:13.931604,2025-04-24 22:17:19.100714,0 days 00:00:05.169110,8.81319045651232,Matern,35.2766105801757,0.9731223160568384,0.5,TPESampler,COMPLETE
2392,0.93293749214978,2025-04-24 22:17:17.601433,2025-04-24 22:17:22.117640,0 days 00:00:04.516207,9356.411498555672,Matern,0.028268074101238577,0.014456204653619022,0.5,TPESampler,COMPLETE
2393,0.9928365555095352,2025-04-24 22:17:18.914203,2025-04-24 22:17:22.539616,0 days 00:00:03.625413,96010.43059129044,Matern,6.481210984454017,0.005670461666512892,0.5,TPESampler,COMPLETE
2394,0.26238347216717706,2025-04-24 22:17:19.414139,2025-04-24 22:17:26.618522,0 days 00:00:07.204383,53368.30619027723,Matern,3974.6759837274108,0.036206566547889577,0.5,TPESampler,COMPLETE
2395,0.2623834747453212,2025-04-24 22:17:22.383162,2025-04-24 22:17:27.003979,0 days 00:00:04.620817,1.0307305126894242,Matern,0.2555426320962025,0.0005358916681472767,0.5,TPESampler,COMPLETE
2396,0.2825175335336816,2025-04-24 22:17:22.805079,2025-04-24 22:17:31.805815,0 days 00:00:09.000736,7.835644727224288e-05,RBF,0.46728891872180733,2.3235485272077364e-10,0.5,TPESampler,COMPLETE
2397,0.2623834738555735,2025-04-24 22:17:26.863375,2025-04-24 22:17:31.753774,0 days 00:00:04.890399,69368.8973124665,Matern,882.0434087802142,0.2801262914731025,0.5,TPESampler,COMPLETE
2398,0.9329374977709097,2025-04-24 22:17:27.232144,2025-04-24 22:17:36.507571,0 days 00:00:09.275427,7.185558550700751e-07,RBF,80.97507258609454,1.24489740230741e-07,1.5,TPESampler,COMPLETE
2399,0.9329374972622826,2025-04-24 22:17:31.947911,2025-04-24 22:17:34.959864,0 days 00:00:03.011953,3.898250489602227,RBF,0.0021456929367397078,0.04111820111744602,0.5,TPESampler,COMPLETE
2400,0.26238347455263783,2025-04-24 22:17:31.995421,2025-04-24 22:17:37.506685,0 days 00:00:05.511264,20.11015341848323,Matern,5759.1454367238375,0.06947136556785277,0.5,TPESampler,COMPLETE
