number,value,datetime_start,datetime_complete,duration,params_constant_value,params_kernel_type,params_length_scale,params_noise_level,params_nu,system_attrs_auto:sampler,state
2173,0.2623834764479636,2025-04-24 22:10:28.333866,2025-04-24 22:10:32.681184,0 days 00:00:04.347318,15.614861606605213,Matern,1.4978068286005748,0.0008228821034892914,0.5,TPESampler,COMPLETE
2174,0.2678747551933867,2025-04-24 22:10:32.101108,2025-04-24 22:10:37.017908,0 days 00:00:04.916800,3.441598413416114,Matern,0.2017114152539241,0.022943002087917694,1.5,TPESampler,COMPLETE
2175,0.26238347478819496,2025-04-24 22:10:32.511597,2025-04-24 22:10:39.346442,0 days 00:00:06.834845,0.0003513111215220719,Matern,3.792684083825997,0.014103850560645614,0.5,TPESampler,COMPLETE
2176,0.932937497748443,2025-04-24 22:10:32.953740,2025-04-24 22:10:36.376512,0 days 00:00:03.422772,15.622227440400836,RBF,0.03917535961112971,0.003034406172263915,1.5,TPESampler,COMPLETE
2177,0.26238347130902195,2025-04-24 22:10:36.637874,2025-04-24 22:10:41.463820,0 days 00:00:04.825946,2537.8950714640023,Matern,1.939257075579328,0.0006899715845291306,0.5,TPESampler,COMPLETE
2178,0.9329374977127726,2025-04-24 22:10:37.294430,2025-04-24 22:10:49.211732,0 days 00:00:11.917302,5.615775206761887e-06,Matern,866.6290180933323,0.00022259798863092286,2.5,TPESampler,COMPLETE
2179,0.9928365741156132,2025-04-24 22:10:39.609238,2025-04-24 22:10:44.334129,0 days 00:00:04.724891,0.8133719028902265,Matern,84570.61610241726,0.5136453195670827,1.5,TPESampler,COMPLETE
2180,0.26238347756832653,2025-04-24 22:10:41.755959,2025-04-24 22:10:46.211208,0 days 00:00:04.455249,1.965696379916904,Matern,2.723332200166914,0.024777955613723698,0.5,TPESampler,COMPLETE
2181,0.2623832645452647,2025-04-24 22:10:44.557743,2025-04-24 22:10:50.197550,0 days 00:00:05.639807,576.3595142397411,Matern,115.68956380859967,0.023075993792584713,0.5,TPESampler,COMPLETE
2182,0.26238345358539267,2025-04-24 22:10:46.471986,2025-04-24 22:10:51.886380,0 days 00:00:05.414394,0.05521319187342817,Matern,70.06355808807778,0.02688439557465946,0.5,TPESampler,COMPLETE
2183,0.9329374977563788,2025-04-24 22:10:49.482185,2025-04-24 22:10:56.854416,0 days 00:00:07.372231,0.5283061020768448,Matern,85052.53676427896,0.011572652844727098,0.5,TPESampler,COMPLETE
2184,0.2623834757455324,2025-04-24 22:10:50.448681,2025-04-24 22:10:55.046875,0 days 00:00:04.598194,106.87149126482414,Matern,437.8052567979531,0.001995968126618999,0.5,TPESampler,COMPLETE
2185,0.26238346703812176,2025-04-24 22:10:52.133104,2025-04-24 22:10:57.555936,0 days 00:00:05.422832,17240.31755674064,Matern,1280.543875258926,0.01274212468434419,0.5,TPESampler,COMPLETE
2186,0.2623834915514724,2025-04-24 22:10:55.300887,2025-04-24 22:11:00.211121,0 days 00:00:04.910234,1567.8492666448753,Matern,13.914427728673392,0.2977546485569682,0.5,TPESampler,COMPLETE
2187,0.2623834757480612,2025-04-24 22:10:57.106827,2025-04-24 22:11:02.083894,0 days 00:00:04.977067,1496.769609369209,Matern,507.82920697512446,5.939848342442375e-05,0.5,TPESampler,COMPLETE
2188,0.262383495442539,2025-04-24 22:10:57.814969,2025-04-24 22:11:02.160357,0 days 00:00:04.345388,1639.4869263510423,Matern,59.68824703850191,0.9048707828531214,0.5,TPESampler,COMPLETE
2189,0.26238346990608424,2025-04-24 22:11:00.454923,2025-04-24 22:11:05.077325,0 days 00:00:04.622402,1287.0136323164836,Matern,12.704369268085117,0.0019701758114068824,0.5,TPESampler,COMPLETE
2190,0.26238347484629293,2025-04-24 22:11:02.301975,2025-04-24 22:11:08.538924,0 days 00:00:06.236949,270.76229100626665,Matern,162.32810285540515,0.010965555806038911,0.5,TPESampler,COMPLETE
2191,0.26238347489038,2025-04-24 22:11:02.337705,2025-04-24 22:11:09.222081,0 days 00:00:06.884376,19017.258118315673,Matern,113.36358400183873,0.012171530171111179,0.5,TPESampler,COMPLETE
2192,0.2623834533154126,2025-04-24 22:11:05.336266,2025-04-24 22:11:09.500470,0 days 00:00:04.164204,894.4778605482,Matern,136.3060819686357,0.0006407010385273032,0.5,TPESampler,COMPLETE
2193,0.2623834589239596,2025-04-24 22:11:08.823825,2025-04-24 22:11:13.551321,0 days 00:00:04.727496,10.327636166942664,Matern,84.55770387126717,0.00027647707872141834,0.5,TPESampler,COMPLETE
2194,0.26238346376403215,2025-04-24 22:11:09.454138,2025-04-24 22:11:13.781173,0 days 00:00:04.327035,209.22871038504903,Matern,482.7874025686705,0.011076005599090624,0.5,TPESampler,COMPLETE
2195,0.26238347039262494,2025-04-24 22:11:09.791534,2025-04-24 22:11:15.005171,0 days 00:00:05.213637,2014.5989310019206,Matern,34.22357989674109,0.0067657461336431985,0.5,TPESampler,COMPLETE
2196,0.9329374971715981,2025-04-24 22:11:13.777159,2025-04-24 22:11:19.940732,0 days 00:00:06.163573,0.598769808269429,Matern,0.004824037754854826,0.8410218310672672,0.5,TPESampler,COMPLETE
2197,0.26238346835275406,2025-04-24 22:11:14.297180,2025-04-24 22:11:19.816070,0 days 00:00:05.518890,88.60776830668769,Matern,748.2617570219121,0.0008182681597065879,0.5,TPESampler,COMPLETE
2198,0.26238363454891533,2025-04-24 22:11:15.360047,2025-04-24 22:11:21.609244,0 days 00:00:06.249197,528.2758534081373,Matern,16.40564845035542,0.010943717007796687,0.5,TPESampler,COMPLETE
2199,0.2623835049155721,2025-04-24 22:11:20.091440,2025-04-24 22:11:26.561397,0 days 00:00:06.469957,3649.0753962553063,Matern,1804.825760317709,0.07311747476232232,0.5,TPESampler,COMPLETE
2200,0.26238349762222174,2025-04-24 22:11:20.237989,2025-04-24 22:11:36.066050,0 days 00:00:15.828061,1900.308173937745,Matern,0.37537585441818455,0.004715293084336226,0.5,TPESampler,COMPLETE
2201,0.26238384272635745,2025-04-24 22:11:21.851778,2025-04-24 22:11:26.614169,0 days 00:00:04.762391,1138.248427558889,Matern,1563.26687206263,0.008588344906520407,0.5,TPESampler,COMPLETE
2202,0.26238347438839343,2025-04-24 22:11:26.766136,2025-04-24 22:11:34.046196,0 days 00:00:07.280060,800.4794396771762,Matern,51.4774875579356,0.003679057822400719,0.5,TPESampler,COMPLETE
2203,0.9329374977183946,2025-04-24 22:11:26.815566,2025-04-24 22:11:35.377943,0 days 00:00:08.562377,86783.1920466962,Matern,0.015406917446266792,0.004337038829924726,0.5,TPESampler,COMPLETE
2204,0.26238347503204995,2025-04-24 22:11:34.685143,2025-04-24 22:11:40.463757,0 days 00:00:05.778614,5164.641091500667,Matern,2194.3368558970205,0.0006933959631061422,0.5,TPESampler,COMPLETE
2205,0.26238404266612675,2025-04-24 22:11:35.610838,2025-04-24 22:11:41.089164,0 days 00:00:05.478326,272.3022187416687,Matern,590.3139131670409,0.04650377867994776,0.5,TPESampler,COMPLETE
2206,0.2623834032398137,2025-04-24 22:11:36.321865,2025-04-24 22:11:41.780717,0 days 00:00:05.458852,111.30972030292146,Matern,16.285690283017548,0.0590725751371325,0.5,TPESampler,COMPLETE
2207,0.2623834054801529,2025-04-24 22:11:40.727656,2025-04-24 22:11:45.335710,0 days 00:00:04.608054,80.43308592617326,Matern,0.9526310110734462,0.017119677037200527,0.5,TPESampler,COMPLETE
2208,0.2623834564910595,2025-04-24 22:11:41.331662,2025-04-24 22:11:46.416672,0 days 00:00:05.085010,1159.5806040075986,Matern,27.639246203999384,0.10906952124341025,0.5,TPESampler,COMPLETE
2209,0.9926969746943055,2025-04-24 22:11:42.017075,2025-04-24 22:11:48.907852,0 days 00:00:06.890777,0.06334564572520755,Matern,78507.67742542118,0.6447392933857755,0.5,TPESampler,COMPLETE
2210,0.2623834749226193,2025-04-24 22:11:45.641794,2025-04-24 22:11:53.843959,0 days 00:00:08.202165,1119.3997139290964,Matern,0.08227835040237132,0.07661859352310647,0.5,TPESampler,COMPLETE
2211,0.26238347081654806,2025-04-24 22:11:46.734596,2025-04-24 22:11:51.850134,0 days 00:00:05.115538,326.8327870893306,Matern,0.2756319626311468,0.9267659532654208,0.5,TPESampler,COMPLETE
2212,0.2737570208859265,2025-04-24 22:11:49.156882,2025-04-24 22:11:54.640189,0 days 00:00:05.483307,234.92269853609895,Matern,35.8198940079732,0.00918920961392091,2.5,TPESampler,COMPLETE
2213,0.26238343577105006,2025-04-24 22:11:52.102853,2025-04-24 22:11:56.804992,0 days 00:00:04.702139,625.9985022374432,Matern,9.212777976355792,0.026119757032460694,0.5,TPESampler,COMPLETE
2214,0.2623834540440817,2025-04-24 22:11:54.095873,2025-04-24 22:12:01.774387,0 days 00:00:07.678514,10.378718174800802,Matern,0.1233410095341775,0.036046621172912394,0.5,TPESampler,COMPLETE
2215,0.2623834747209576,2025-04-24 22:11:54.881813,2025-04-24 22:12:00.019679,0 days 00:00:05.137866,346.5145522647001,Matern,3222.8428291276946,0.019433806154627184,0.5,TPESampler,COMPLETE
2216,0.9329374952188229,2025-04-24 22:11:57.042243,2025-04-24 22:12:02.053905,0 days 00:00:05.011662,11.408734363846495,Matern,7702.986692399035,0.0039001434698935434,0.5,TPESampler,COMPLETE
2217,0.2623834776421583,2025-04-24 22:12:00.265486,2025-04-24 22:12:05.632922,0 days 00:00:05.367436,475.20334461605586,Matern,91483.9527733054,0.05302800472087571,0.5,TPESampler,COMPLETE
2218,0.2737566072260652,2025-04-24 22:12:02.013600,2025-04-24 22:12:08.083016,0 days 00:00:06.069416,1.7103828737722817,Matern,2557.9707577489153,0.9119134737870063,2.5,TPESampler,COMPLETE
2219,0.9329374965988939,2025-04-24 22:12:02.379913,2025-04-24 22:12:05.296586,0 days 00:00:02.916673,232.76140534787277,Matern,295.266318729471,0.00407788615429498,1.5,TPESampler,COMPLETE
2220,0.9928350583885786,2025-04-24 22:12:05.552043,2025-04-24 22:12:08.361544,0 days 00:00:02.809501,7115.62429933716,RBF,0.002514207906722688,1.3229424514933554e-06,0.5,TPESampler,COMPLETE
2221,0.2623834567168096,2025-04-24 22:12:05.885199,2025-04-24 22:12:10.328590,0 days 00:00:04.443391,13.544259374872999,Matern,0.3018777680263898,0.001472721103912283,0.5,TPESampler,COMPLETE
2222,0.26238313777089145,2025-04-24 22:12:08.321266,2025-04-24 22:12:13.259133,0 days 00:00:04.937867,10042.418082716777,Matern,938.1703001829877,0.2419606480012485,0.5,TPESampler,COMPLETE
2223,0.9329374977211956,2025-04-24 22:12:08.681056,2025-04-24 22:12:14.893168,0 days 00:00:06.212112,0.6714878704963434,Matern,9.32643404276842,5.638920557683063e-07,0.5,TPESampler,COMPLETE
2224,0.9928365346506258,2025-04-24 22:12:10.576610,2025-04-24 22:12:13.311711,0 days 00:00:02.735101,23882.997401797395,Matern,20.727935580421352,7.485546812861735e-05,0.5,TPESampler,COMPLETE
2225,0.2623834753788073,2025-04-24 22:12:13.449381,2025-04-24 22:12:17.895446,0 days 00:00:04.446065,17955.457294588956,Matern,64.65469195149952,0.06717456834916101,0.5,TPESampler,COMPLETE
2226,0.26238376193386664,2025-04-24 22:12:13.515545,2025-04-24 22:12:18.625997,0 days 00:00:05.110452,144.46563184788315,Matern,1557.241214695815,0.2990139860785073,0.5,TPESampler,COMPLETE
2227,0.26238345761603415,2025-04-24 22:12:15.131144,2025-04-24 22:12:19.558846,0 days 00:00:04.427702,1882.6842787667501,Matern,49.48238993622519,0.32458780537347137,0.5,TPESampler,COMPLETE
2228,0.2623834396606016,2025-04-24 22:12:18.134245,2025-04-24 22:12:23.158528,0 days 00:00:05.024283,33458.050723456065,Matern,380.2259609518625,0.8035727583372617,0.5,TPESampler,COMPLETE
2229,0.26238347316567195,2025-04-24 22:12:18.868429,2025-04-24 22:12:24.168814,0 days 00:00:05.300385,2490.0972164679174,Matern,24453.26976307107,0.10121673989449892,0.5,TPESampler,COMPLETE
2230,0.2623834742557783,2025-04-24 22:12:19.850497,2025-04-24 22:12:25.483809,0 days 00:00:05.633312,1623.2504480907703,Matern,8942.913352208558,0.009126381843931731,0.5,TPESampler,COMPLETE
2231,0.26238345080277553,2025-04-24 22:12:23.424992,2025-04-24 22:12:28.744745,0 days 00:00:05.319753,492.83360717571867,Matern,2428.252680069776,0.11174280445201823,0.5,TPESampler,COMPLETE
2232,0.2623834531878398,2025-04-24 22:12:24.404981,2025-04-24 22:12:29.542263,0 days 00:00:05.137282,8514.787969879906,Matern,126.42037469031888,0.21901151112652795,0.5,TPESampler,COMPLETE
2233,0.26238347502177256,2025-04-24 22:12:25.944771,2025-04-24 22:12:31.594859,0 days 00:00:05.650088,31838.964845469964,Matern,7804.554959540012,0.12816682628974632,0.5,TPESampler,COMPLETE
2234,0.26238347370696896,2025-04-24 22:12:29.005789,2025-04-24 22:12:34.185137,0 days 00:00:05.179348,103.95041362639054,Matern,2539.612277883461,0.028149600065135776,0.5,TPESampler,COMPLETE
2235,0.2623834617805373,2025-04-24 22:12:29.779877,2025-04-24 22:12:36.594226,0 days 00:00:06.814349,14178.178636479535,Matern,2601.3834165441885,0.012488999895917008,0.5,TPESampler,COMPLETE
2236,0.2623834945861051,2025-04-24 22:12:31.837061,2025-04-24 22:12:37.938474,0 days 00:00:06.101413,5769.21020298644,Matern,2908.134858885827,0.06920291300476519,0.5,TPESampler,COMPLETE
2237,0.26238346919281264,2025-04-24 22:12:34.446333,2025-04-24 22:12:39.490438,0 days 00:00:05.044105,13098.49341089737,Matern,243.61386216708527,0.05771198093193189,0.5,TPESampler,COMPLETE
2238,0.262383475863344,2025-04-24 22:12:36.842341,2025-04-24 22:12:42.335260,0 days 00:00:05.492919,6998.272903578178,Matern,2939.010520508388,0.5890206259937797,0.5,TPESampler,COMPLETE
2239,0.2623834806108132,2025-04-24 22:12:38.202922,2025-04-24 22:12:43.173215,0 days 00:00:04.970293,1152.7830737037914,Matern,37.059005048727876,0.05866422156327385,0.5,TPESampler,COMPLETE
2240,0.26238347535772544,2025-04-24 22:12:39.903002,2025-04-24 22:12:44.855581,0 days 00:00:04.952579,35490.22777815492,Matern,167.54816713456447,0.09260673868239022,0.5,TPESampler,COMPLETE
2241,0.26238347104121035,2025-04-24 22:12:42.583933,2025-04-24 22:12:48.409959,0 days 00:00:05.826026,8140.626569930638,Matern,48474.113799880186,0.3936917602773272,0.5,TPESampler,COMPLETE
2242,0.9329374971726154,2025-04-24 22:12:43.468656,2025-04-24 22:12:47.488988,0 days 00:00:04.020332,7.600790472264321,Matern,17782.92728871411,6.295713631625008e-06,0.5,TPESampler,COMPLETE
2243,0.26238358863836375,2025-04-24 22:12:45.125187,2025-04-24 22:12:50.244628,0 days 00:00:05.119441,15079.244928480348,Matern,16044.082776849638,0.21830917333553504,0.5,TPESampler,COMPLETE
2244,0.2623834744126602,2025-04-24 22:12:47.791461,2025-04-24 22:12:53.308917,0 days 00:00:05.517456,4310.8193045012595,Matern,1770.8380660155706,0.015130278041944056,0.5,TPESampler,COMPLETE
2245,0.2623837654869595,2025-04-24 22:12:48.700645,2025-04-24 22:12:53.506483,0 days 00:00:04.805838,12110.41590474655,Matern,802.017186419748,0.46316220646107686,0.5,TPESampler,COMPLETE
2246,0.26238348400458134,2025-04-24 22:12:50.467743,2025-04-24 22:12:55.014719,0 days 00:00:04.546976,10909.396204842702,Matern,428.50631715859447,0.04360977748019102,0.5,TPESampler,COMPLETE
2247,0.2623834795128723,2025-04-24 22:12:53.568144,2025-04-24 22:12:58.631661,0 days 00:00:05.063517,11484.08618129973,Matern,7.125363870258713,0.9510311168981567,0.5,TPESampler,COMPLETE
2248,0.2623834747524549,2025-04-24 22:12:53.805383,2025-04-24 22:12:58.566949,0 days 00:00:04.761566,9121.613695661812,Matern,1212.3525323904116,0.0029230810070713827,0.5,TPESampler,COMPLETE
2249,0.2623834717532246,2025-04-24 22:12:55.276114,2025-04-24 22:12:59.136762,0 days 00:00:03.860648,39.517492707794325,Matern,196.39047180610893,0.038859711332550936,0.5,TPESampler,COMPLETE
2250,0.26238347289789055,2025-04-24 22:12:58.743721,2025-04-24 22:13:03.044064,0 days 00:00:04.300343,420.2482004476253,Matern,413.0042173358996,0.1695054743622064,0.5,TPESampler,COMPLETE
2251,0.2623834747385087,2025-04-24 22:12:58.809156,2025-04-24 22:13:04.117316,0 days 00:00:05.308160,40189.15058575554,Matern,3864.4580581904092,0.002158437670328147,0.5,TPESampler,COMPLETE
2252,0.2623834743460537,2025-04-24 22:12:59.498869,2025-04-24 22:13:03.342092,0 days 00:00:03.843223,3365.433653983352,Matern,16.60717750759184,0.0036785731549991,0.5,TPESampler,COMPLETE
2253,0.9329374974915214,2025-04-24 22:13:03.273781,2025-04-24 22:13:06.746969,0 days 00:00:03.473188,0.008859854505863388,RBF,0.047840975554070665,7.214594811127733e-06,0.5,TPESampler,COMPLETE
2254,0.2623834728492119,2025-04-24 22:13:03.602329,2025-04-24 22:13:08.248383,0 days 00:00:04.646054,2432.815334278595,Matern,76.27670833651018,0.0752759547835364,0.5,TPESampler,COMPLETE
2255,0.2623834756054412,2025-04-24 22:13:04.356624,2025-04-24 22:13:08.317212,0 days 00:00:03.960588,521.8653218494127,Matern,60.64901541942285,0.09502355567288316,0.5,TPESampler,COMPLETE
2256,0.262383474536237,2025-04-24 22:13:06.997002,2025-04-24 22:13:11.808935,0 days 00:00:04.811933,82367.96924972806,Matern,170.9884237875927,0.2905555458714344,0.5,TPESampler,COMPLETE
2257,0.9329373475392503,2025-04-24 22:13:08.429483,2025-04-24 22:13:11.517764,0 days 00:00:03.088281,2745.659929555589,Matern,0.06482031018373974,0.08786258355794627,0.5,TPESampler,COMPLETE
2258,0.26238348863578487,2025-04-24 22:13:08.500894,2025-04-24 22:13:13.305078,0 days 00:00:04.804184,6039.386812047404,Matern,1.9519716210735665,0.0020212243213622375,0.5,TPESampler,COMPLETE
2259,0.26238345949259034,2025-04-24 22:13:11.740634,2025-04-24 22:13:16.098004,0 days 00:00:04.357370,43.61439815883652,Matern,1.4271575853782685,0.0024530719962727425,0.5,TPESampler,COMPLETE
2260,0.2623834701655679,2025-04-24 22:13:12.108848,2025-04-24 22:13:16.625765,0 days 00:00:04.516917,100.72644205608393,Matern,934.7831994747529,0.0007402217735160351,0.5,TPESampler,COMPLETE
2261,0.2623835671532778,2025-04-24 22:13:13.566537,2025-04-24 22:13:17.631765,0 days 00:00:04.065228,29708.600427377558,Matern,2089.974988593093,0.3798277905020925,0.5,TPESampler,COMPLETE
2262,0.2623834729939512,2025-04-24 22:13:16.335140,2025-04-24 22:13:21.283480,0 days 00:00:04.948340,209.9396115753414,Matern,87.89575319008688,0.9345023813219718,0.5,TPESampler,COMPLETE
2263,0.26238347624643865,2025-04-24 22:13:16.902034,2025-04-24 22:13:22.275353,0 days 00:00:05.373319,106.21420981994807,Matern,33.442198486112105,0.037792147557704756,0.5,TPESampler,COMPLETE
2264,0.26238347385830857,2025-04-24 22:13:17.905832,2025-04-24 22:13:22.373975,0 days 00:00:04.468143,0.20916068968047238,Matern,6.910088611272138,0.0017081538113840648,0.5,TPESampler,COMPLETE
2265,0.9329374974830357,2025-04-24 22:13:21.544592,2025-04-24 22:13:26.322545,0 days 00:00:04.777953,448.7197908883097,Matern,432.6625677735706,0.004064403042479461,2.5,TPESampler,COMPLETE
2266,0.26238348851455745,2025-04-24 22:13:22.435660,2025-04-24 22:13:27.259328,0 days 00:00:04.823668,1.6199232230271556,Matern,0.8181705882543897,0.9868999237342189,0.5,TPESampler,COMPLETE
2267,0.2623834784549788,2025-04-24 22:13:22.613046,2025-04-24 22:13:26.967657,0 days 00:00:04.354611,1165.3968949376301,Matern,1.4667526978902512,0.056833264909658995,0.5,TPESampler,COMPLETE
2268,0.9329374982212877,2025-04-24 22:13:26.571922,2025-04-24 22:13:34.035787,0 days 00:00:07.463865,2729.048280325163,Matern,0.012669523116658421,0.015909937617910902,0.5,TPESampler,COMPLETE
2269,0.2623834721191509,2025-04-24 22:13:27.231196,2025-04-24 22:13:35.039021,0 days 00:00:07.807825,195.22448706795672,Matern,2.843820510876369,0.8897813027379843,0.5,TPESampler,COMPLETE
2270,0.2623835106731112,2025-04-24 22:13:27.712067,2025-04-24 22:13:35.762798,0 days 00:00:08.050731,572.8297409485814,Matern,694.177192794778,0.8641388524015545,0.5,TPESampler,COMPLETE
2271,0.2623834743349672,2025-04-24 22:13:34.294962,2025-04-24 22:13:38.753448,0 days 00:00:04.458486,17236.84973758038,Matern,98.74719518919852,0.005738308935430631,0.5,TPESampler,COMPLETE
2272,0.9329374981462774,2025-04-24 22:13:35.279479,2025-04-24 22:13:38.573357,0 days 00:00:03.293878,81471.0659136395,Matern,0.00311640114448889,0.3679518365296076,0.5,TPESampler,COMPLETE
2273,0.9928322687285976,2025-04-24 22:13:36.212315,2025-04-24 22:13:38.917912,0 days 00:00:02.705597,59629.14652432143,Matern,0.0011743899606220297,0.0004518798022932352,0.5,TPESampler,COMPLETE
2274,0.9329374970905912,2025-04-24 22:13:38.786608,2025-04-24 22:13:47.438683,0 days 00:00:08.652075,0.06895421058641636,Matern,0.01724735751921154,0.7706807324759148,0.5,TPESampler,COMPLETE
2275,0.9928346944067422,2025-04-24 22:13:38.991599,2025-04-24 22:13:43.888040,0 days 00:00:04.896441,86067.74744839144,Matern,0.17257229903830862,0.2103482061540054,0.5,TPESampler,COMPLETE
2276,0.2623834695803188,2025-04-24 22:13:39.132183,2025-04-24 22:13:48.089933,0 days 00:00:08.957750,3575.771021753422,Matern,4.3392776563481945,0.012750831635315707,0.5,TPESampler,COMPLETE
2277,0.2623835125738588,2025-04-24 22:13:44.418774,2025-04-24 22:13:50.265017,0 days 00:00:05.846243,8.537667759883202,Matern,1.1161855039101516,0.04130807484814153,0.5,TPESampler,COMPLETE
2278,0.26238370888481233,2025-04-24 22:13:47.684079,2025-04-24 22:13:52.724193,0 days 00:00:05.040114,6.458204791016502,Matern,801.4877621076031,0.0031762067317926642,0.5,TPESampler,COMPLETE
2279,0.2623834694861247,2025-04-24 22:13:48.353113,2025-04-24 22:13:52.748220,0 days 00:00:04.395107,1421.6320302260383,Matern,9.708577950405818,0.00017214701389505618,0.5,TPESampler,COMPLETE
2280,0.2825175464443582,2025-04-24 22:13:50.500333,2025-04-24 22:13:56.076685,0 days 00:00:05.576352,414.54787580391366,RBF,409.936709068769,0.5933246622605194,0.5,TPESampler,COMPLETE
2281,0.2623834802629653,2025-04-24 22:13:52.897159,2025-04-24 22:13:58.245386,0 days 00:00:05.348227,0.020310478609056402,Matern,0.3747136842677778,0.025311171971605376,0.5,TPESampler,COMPLETE
2282,0.2623833939708071,2025-04-24 22:13:52.960539,2025-04-24 22:13:57.952219,0 days 00:00:04.991680,22.296378566486503,Matern,12.403129903753074,0.0003645986358601573,0.5,TPESampler,COMPLETE
2283,0.26238347815915913,2025-04-24 22:13:56.309621,2025-04-24 22:14:00.313031,0 days 00:00:04.003410,682.9538911579747,Matern,1.504828116434476,0.03241001827596493,0.5,TPESampler,COMPLETE
2284,0.26238347030445425,2025-04-24 22:13:58.205895,2025-04-24 22:14:02.731894,0 days 00:00:04.525999,39.479803794587376,Matern,4.2989259554185,0.8743908682375867,0.5,TPESampler,COMPLETE
2285,0.9329374977483866,2025-04-24 22:13:58.581437,2025-04-24 22:14:02.086906,0 days 00:00:03.505469,37.804824062548136,Matern,0.0026992030775333346,0.5895367227586351,0.5,TPESampler,COMPLETE
2286,0.26238364031618516,2025-04-24 22:14:00.611979,2025-04-24 22:14:06.053612,0 days 00:00:05.441633,1692.5509845267363,Matern,0.9194185017591386,0.8510677738402348,0.5,TPESampler,COMPLETE
