number,value,datetime_start,datetime_complete,duration,params_constant_value,params_kernel_type,params_length_scale,params_noise_level,params_nu,system_attrs_auto:sampler,state
1717,0.26238347429897513,2025-04-24 21:55:12.490280,2025-04-24 21:55:18.832963,0 days 00:00:06.342683,0.006673289751883622,Matern,71.99724300432682,0.76333017946718,0.5,TPESampler,COMPLETE
1718,0.9329373199145325,2025-04-24 21:55:16.045746,2025-04-24 21:55:21.658095,0 days 00:00:05.612349,98075.82790849052,Matern,0.0655014810518873,0.002891989712790231,0.5,TPESampler,COMPLETE
1719,0.26238346703836657,2025-04-24 21:55:17.078872,2025-04-24 21:55:22.182748,0 days 00:00:05.103876,0.11871231004483535,Matern,4.056220845658038,0.03300641265551888,0.5,TPESampler,COMPLETE
1720,0.2737566136042484,2025-04-24 21:55:19.106753,2025-04-24 21:55:28.485169,0 days 00:00:09.378416,0.07228587900325853,Matern,671.3273866064399,0.5502911266936844,2.5,TPESampler,COMPLETE
1721,0.2623834704042786,2025-04-24 21:55:21.937796,2025-04-24 21:55:27.298694,0 days 00:00:05.360898,0.82961456257542,Matern,61.29901451105473,0.6304089874684963,0.5,TPESampler,COMPLETE
1722,0.2623834507223492,2025-04-24 21:55:22.459168,2025-04-24 21:55:27.738203,0 days 00:00:05.279035,674.9998546268024,Matern,2.7927463607285383,0.0854052638612378,0.5,TPESampler,COMPLETE
1723,0.2623834720957944,2025-04-24 21:55:27.609508,2025-04-24 21:55:34.284357,0 days 00:00:06.674849,1203.7022031794252,Matern,17.09539287308596,0.012919126345474258,0.5,TPESampler,COMPLETE
1724,0.26238347463171213,2025-04-24 21:55:28.015287,2025-04-24 21:55:33.607661,0 days 00:00:05.592374,7.870439904267555,Matern,86.55545282941964,0.8984742689289645,0.5,TPESampler,COMPLETE
1725,0.9329374979635959,2025-04-24 21:55:28.724805,2025-04-24 21:55:34.989799,0 days 00:00:06.264994,0.012602437148390573,RBF,0.002415414476088819,0.025855701613720368,0.5,TPESampler,COMPLETE
1726,0.9329374974167544,2025-04-24 21:55:33.878309,2025-04-24 21:55:40.212347,0 days 00:00:06.334038,2.2244462267405782,Matern,9864.714956718808,0.025999976297417012,0.5,TPESampler,COMPLETE
1727,0.2623834715436387,2025-04-24 21:55:34.633034,2025-04-24 21:55:39.850223,0 days 00:00:05.217189,0.4710750405495527,Matern,484.18590269423714,0.9562259116065014,0.5,TPESampler,COMPLETE
1728,0.2623834622844231,2025-04-24 21:55:35.229636,2025-04-24 21:55:39.892313,0 days 00:00:04.662677,32272.68947318424,Matern,26.28038399590816,0.026799913309034206,0.5,TPESampler,COMPLETE
1729,0.26238347167823556,2025-04-24 21:55:40.021410,2025-04-24 21:55:45.433007,0 days 00:00:05.411597,11.821790253919149,Matern,3.184820054733512,0.03806016977031207,0.5,TPESampler,COMPLETE
1730,0.2623834737988571,2025-04-24 21:55:40.067106,2025-04-24 21:55:46.139759,0 days 00:00:06.072653,16.214233238731392,Matern,0.7694480743755078,0.5847019005700677,0.5,TPESampler,COMPLETE
1731,0.26238334126597634,2025-04-24 21:55:40.489435,2025-04-24 21:55:45.365553,0 days 00:00:04.876118,0.1723811693257958,Matern,8.69265194818789,0.7607905479515107,0.5,TPESampler,COMPLETE
1732,0.26238343915049306,2025-04-24 21:55:45.562902,2025-04-24 21:56:08.075097,0 days 00:00:22.512195,0.06128035549735414,Matern,42813.02018963915,0.945865625092413,0.5,TPESampler,COMPLETE
1733,0.932937496697387,2025-04-24 21:55:45.711937,2025-04-24 21:55:50.598271,0 days 00:00:04.886334,2029.6394268461056,Matern,0.02089132647175446,0.02148180497645808,0.5,TPESampler,COMPLETE
1734,0.2623834754946013,2025-04-24 21:55:46.377741,2025-04-24 21:55:52.463763,0 days 00:00:06.086022,38086.17002119895,Matern,27.334606416654513,0.9614191210359396,0.5,TPESampler,COMPLETE
1735,0.9329374975769454,2025-04-24 21:55:50.851324,2025-04-24 21:55:58.217429,0 days 00:00:07.366105,0.07968258636063633,Matern,1290.1985651079535,0.041400859137566484,0.5,TPESampler,COMPLETE
1736,0.2623834728275497,2025-04-24 21:55:52.993482,2025-04-24 21:56:01.651712,0 days 00:00:08.658230,1.8560188934932715,Matern,0.14958455804318627,0.8883868158197051,0.5,TPESampler,COMPLETE
1737,0.9329374972855426,2025-04-24 21:55:58.476352,2025-04-24 21:56:07.917598,0 days 00:00:09.441246,0.00812746365098834,Matern,8771.455788837082,0.03164091412176993,0.5,TPESampler,COMPLETE
1738,0.2737566310820843,2025-04-24 21:56:02.160083,2025-04-24 21:56:06.783456,0 days 00:00:04.623373,0.08163966533470786,Matern,8.298015240197229,0.6282640267544063,2.5,TPESampler,COMPLETE
1739,0.2678747509146152,2025-04-24 21:56:07.031519,2025-04-24 21:56:11.921999,0 days 00:00:04.890480,0.19100586694472824,Matern,519.5727092712555,0.17883848081097467,1.5,TPESampler,COMPLETE
1740,0.9329374977231859,2025-04-24 21:56:08.156078,2025-04-24 21:56:15.913501,0 days 00:00:07.757423,1.647021761805689,Matern,3256.1344279208643,0.061124678448697865,2.5,TPESampler,COMPLETE
1741,0.9329374984907718,2025-04-24 21:56:08.364449,2025-04-24 21:56:13.554063,0 days 00:00:05.189614,2.37991450784794,Matern,38641.840962857365,0.0007152320496306694,0.5,TPESampler,COMPLETE
1742,0.28251760419134864,2025-04-24 21:56:12.149300,2025-04-24 21:56:17.515619,0 days 00:00:05.366319,14272.560507586528,RBF,100.15835912357015,0.6410219469132467,2.5,TPESampler,COMPLETE
1743,0.932937497690391,2025-04-24 21:56:13.820677,2025-04-24 21:56:21.178487,0 days 00:00:07.357810,0.0229419413641217,RBF,51.901777537863836,0.00023114322225672028,2.5,TPESampler,COMPLETE
1744,0.26223962155724134,2025-04-24 21:56:16.203560,2025-04-24 21:56:24.272927,0 days 00:00:08.069367,90227.48488317554,Matern,0.23593311671803124,0.16038921992522442,0.5,TPESampler,COMPLETE
1745,0.9329374973593939,2025-04-24 21:56:17.750707,2025-04-24 21:56:22.810591,0 days 00:00:05.059884,43.94030090333828,Matern,81588.65336133272,0.01635655192990676,0.5,TPESampler,COMPLETE
1746,0.26238346864641926,2025-04-24 21:56:21.434320,2025-04-24 21:56:26.092589,0 days 00:00:04.658269,636.8347820699308,Matern,23.601402639999694,0.0011876790819211802,0.5,TPESampler,COMPLETE
1747,0.2623834768249893,2025-04-24 21:56:23.027948,2025-04-24 21:56:28.874590,0 days 00:00:05.846642,0.5309861151301215,Matern,2576.4749275951476,0.9066365842059951,0.5,TPESampler,COMPLETE
1748,0.9329374963585693,2025-04-24 21:56:24.557663,2025-04-24 21:56:28.085990,0 days 00:00:03.528327,43440.87481908908,Matern,0.00046181695529391736,0.3724583294997496,0.5,TPESampler,COMPLETE
1749,0.9928350583841958,2025-04-24 21:56:26.389675,2025-04-24 21:56:29.766131,0 days 00:00:03.376456,92025.46523484636,Matern,0.0004401132994615571,6.565610632419708e-05,2.5,TPESampler,COMPLETE
1750,0.9329374977605996,2025-04-24 21:56:28.314204,2025-04-24 21:56:32.810819,0 days 00:00:04.496615,6316.303195808627,Matern,0.004559170929975981,0.8365546806032215,0.5,TPESampler,COMPLETE
1751,0.9928350583598672,2025-04-24 21:56:29.216544,2025-04-24 21:56:31.851255,0 days 00:00:02.634711,54588.470255058106,Matern,0.005604187096753822,0.00869399910995835,0.5,TPESampler,COMPLETE
1752,0.26238347548774166,2025-04-24 21:56:30.086784,2025-04-24 21:56:38.504507,0 days 00:00:08.417723,4964.6985334262245,Matern,0.17825296243386723,0.1065582930886812,0.5,TPESampler,COMPLETE
1753,0.2623833040452852,2025-04-24 21:56:32.207616,2025-04-24 21:56:38.118490,0 days 00:00:05.910874,66532.21310645631,Matern,0.23575763329074537,0.0722221971643549,0.5,TPESampler,COMPLETE
1754,0.26238347457262934,2025-04-24 21:56:33.045346,2025-04-24 21:56:38.832809,0 days 00:00:05.787463,50026.38953677812,Matern,0.324114404016312,0.021213788489701478,0.5,TPESampler,COMPLETE
1755,0.9329374977481765,2025-04-24 21:56:38.418823,2025-04-24 21:56:44.088021,0 days 00:00:05.669198,2333.035070021229,Matern,0.012195855196653466,0.05408092456370148,0.5,TPESampler,COMPLETE
1756,0.9928350583477885,2025-04-24 21:56:38.781394,2025-04-24 21:56:44.089481,0 days 00:00:05.308087,1831.927710368902,Matern,0.06990446506067463,0.008373100808034639,0.5,TPESampler,COMPLETE
1757,0.2623834261911868,2025-04-24 21:56:39.410397,2025-04-24 21:56:51.613597,0 days 00:00:12.203200,37587.75078097201,Matern,0.14739421376549885,0.0052864911274360694,0.5,TPESampler,COMPLETE
1758,0.26238347464650014,2025-04-24 21:56:44.332481,2025-04-24 21:56:49.327496,0 days 00:00:04.995015,69944.2697173495,Matern,4.413343722947709,0.7497607866150637,0.5,TPESampler,COMPLETE
1759,0.2623841963319132,2025-04-24 21:56:44.381664,2025-04-24 21:56:50.844584,0 days 00:00:06.462920,60000.33605732642,Matern,0.2524543439591132,0.30587749294550853,0.5,TPESampler,COMPLETE
1760,0.9928350533162713,2025-04-24 21:56:49.552627,2025-04-24 21:56:54.247622,0 days 00:00:04.694995,28874.590550534682,Matern,0.024448592487117143,0.07421949477209899,0.5,TPESampler,COMPLETE
1761,0.2623833550201381,2025-04-24 21:56:51.236611,2025-04-24 21:56:58.229919,0 days 00:00:06.993308,20230.968396027813,Matern,0.22440863360790708,0.12549960608998872,0.5,TPESampler,COMPLETE
1762,0.9329374974823937,2025-04-24 21:56:52.029566,2025-04-24 21:56:58.579168,0 days 00:00:06.549602,1.8167643796618138e-07,Matern,2731.439603568998,0.0005503008718739731,1.5,TPESampler,COMPLETE
1763,0.26787476505647934,2025-04-24 21:56:54.526931,2025-04-24 21:56:59.637176,0 days 00:00:05.110245,9115.133180358318,Matern,11.25937248500172,0.0014295047858163337,1.5,TPESampler,COMPLETE
1764,0.26238345023313975,2025-04-24 21:56:58.502466,2025-04-24 21:57:02.727860,0 days 00:00:04.225394,472.5691369574271,Matern,0.42715586009534273,0.44662177557353144,0.5,TPESampler,COMPLETE
1765,0.2623833247268349,2025-04-24 21:56:58.877003,2025-04-24 21:57:02.437652,0 days 00:00:03.560649,398.6396772584918,Matern,6.3209486443772605,0.00400224517382499,0.5,TPESampler,COMPLETE
1766,0.26238345867934,2025-04-24 21:56:59.931723,2025-04-24 21:57:05.230380,0 days 00:00:05.298657,70048.11649988881,Matern,0.3879505534267683,0.30132230250189046,0.5,TPESampler,COMPLETE
1767,0.9928365555095401,2025-04-24 21:57:02.683197,2025-04-24 21:57:04.951611,0 days 00:00:02.268414,82565.21774674793,Matern,4.9431128904448105,0.008884872840169535,0.5,TPESampler,COMPLETE
1768,0.2623834734526871,2025-04-24 21:57:03.062105,2025-04-24 21:57:12.955787,0 days 00:00:09.893682,99913.50031012672,Matern,30.016478839504344,0.013691923317072007,0.5,TPESampler,COMPLETE
1769,0.262383474697303,2025-04-24 21:57:05.190316,2025-04-24 21:57:11.890193,0 days 00:00:06.699877,48900.78662054428,Matern,11.091213246492279,0.036063668486081654,0.5,TPESampler,COMPLETE
1770,0.9928350583262417,2025-04-24 21:57:05.537761,2025-04-24 21:57:10.608441,0 days 00:00:05.070680,8825.437170872096,Matern,0.019767386757466525,0.008998230214874182,2.5,TPESampler,COMPLETE
1771,0.9329374977161461,2025-04-24 21:57:10.875760,2025-04-24 21:57:17.219339,0 days 00:00:06.343579,309.8114733738027,Matern,0.024176002658076814,0.010465170551540883,0.5,TPESampler,COMPLETE
1772,0.26238350004290334,2025-04-24 21:57:12.339728,2025-04-24 21:57:18.496817,0 days 00:00:06.157089,58456.61829639958,Matern,0.40585019035761427,0.0017544599734691602,0.5,TPESampler,COMPLETE
1773,0.2678747305121919,2025-04-24 21:57:13.386080,2025-04-24 21:57:18.414117,0 days 00:00:05.028037,0.15659897667661338,Matern,5.5976254198837845,0.6582966119404484,1.5,TPESampler,COMPLETE
1774,0.2623834749273047,2025-04-24 21:57:17.434406,2025-04-24 21:57:21.667784,0 days 00:00:04.233378,319.5676695978973,Matern,2.8438426301470012,0.5571096901551248,0.5,TPESampler,COMPLETE
1775,0.9329374966325471,2025-04-24 21:57:18.610661,2025-04-24 21:57:21.879313,0 days 00:00:03.268652,77234.32405786616,Matern,0.0002794700247465648,0.014850595484036085,0.5,TPESampler,COMPLETE
1776,0.2623834917830666,2025-04-24 21:57:18.759750,2025-04-24 21:57:23.955025,0 days 00:00:05.195275,77821.56650269654,Matern,0.34269255540447313,0.01180376937441197,0.5,TPESampler,COMPLETE
1777,0.2623834750495934,2025-04-24 21:57:21.878399,2025-04-24 21:57:27.760862,0 days 00:00:05.882463,789.3242643395673,Matern,1.3335803105179214,0.019873176780042703,0.5,TPESampler,COMPLETE
1778,0.9329374965323078,2025-04-24 21:57:22.160414,2025-04-24 21:57:27.747537,0 days 00:00:05.587123,0.03122093974081608,Matern,0.03700084319135817,0.09270210195173459,0.5,TPESampler,COMPLETE
1779,0.2623834712258504,2025-04-24 21:57:24.449214,2025-04-24 21:57:29.745733,0 days 00:00:05.296519,306.470539381099,Matern,0.4583052534536547,0.8203772563947683,0.5,TPESampler,COMPLETE
1780,0.9329374977435435,2025-04-24 21:57:27.930541,2025-04-24 21:57:31.556378,0 days 00:00:03.625837,32389.729011934993,RBF,0.003077669656750944,0.24407556502726627,0.5,TPESampler,COMPLETE
1781,0.9329374977537548,2025-04-24 21:57:28.001782,2025-04-24 21:57:31.505813,0 days 00:00:03.504031,90.08895953911677,Matern,0.00410448030198641,0.0007023702597644336,1.5,TPESampler,COMPLETE
1782,0.26787475877173617,2025-04-24 21:57:30.051631,2025-04-24 21:57:34.370234,0 days 00:00:04.318603,3088.7875651912386,Matern,1.1964990880602413,0.1981686969517798,1.5,TPESampler,COMPLETE
1783,0.26238347349106617,2025-04-24 21:57:31.727756,2025-04-24 21:57:40.085932,0 days 00:00:08.358176,25618.42923494715,Matern,0.1728549199014023,0.5926281745741017,0.5,TPESampler,COMPLETE
1784,0.2623834821166126,2025-04-24 21:57:31.773246,2025-04-24 21:57:39.261615,0 days 00:00:07.488369,95760.32312617704,Matern,0.17173390118218132,0.6418953042776377,0.5,TPESampler,COMPLETE
1785,0.9329374978102846,2025-04-24 21:57:34.625804,2025-04-24 21:57:38.064216,0 days 00:00:03.438412,1.4691802134564362,Matern,0.0021544385244787433,0.00010018846042839868,0.5,TPESampler,COMPLETE
1786,0.9329374975919418,2025-04-24 21:57:38.331579,2025-04-24 21:57:41.771338,0 days 00:00:03.439759,605.1617468140568,Matern,0.031524993976189755,0.04281478300076907,0.5,TPESampler,COMPLETE
1787,0.2623834416941511,2025-04-24 21:57:39.602653,2025-04-24 21:57:44.548749,0 days 00:00:04.946096,1321.7031101286457,Matern,8.450621593390728,0.4331433712204348,0.5,TPESampler,COMPLETE
1788,0.9329374977726507,2025-04-24 21:57:40.397557,2025-04-24 21:57:46.229188,0 days 00:00:05.831631,70055.79274891232,Matern,0.003859601092587002,0.0017976008913241557,0.5,TPESampler,COMPLETE
1789,0.26238349687643436,2025-04-24 21:57:42.013217,2025-04-24 21:57:47.322932,0 days 00:00:05.309715,3.348886868570924,Matern,0.5479552180124359,0.1457020897902872,0.5,TPESampler,COMPLETE
1790,0.26238347579264404,2025-04-24 21:57:44.920901,2025-04-24 21:57:49.872846,0 days 00:00:04.951945,589.0709260743811,Matern,0.317280670907655,0.006380226448690779,0.5,TPESampler,COMPLETE
1791,0.267874770012359,2025-04-24 21:57:46.523913,2025-04-24 21:57:57.505968,0 days 00:00:10.982055,4674.094332429419,Matern,0.1436252074219368,0.00018135427529151392,1.5,TPESampler,COMPLETE
1792,0.2623834749457322,2025-04-24 21:57:47.672091,2025-04-24 21:57:52.547745,0 days 00:00:04.875654,4.243776702565631,Matern,18.84748223935218,0.04654274733060496,0.5,TPESampler,COMPLETE
1793,0.26238347484660524,2025-04-24 21:57:50.146423,2025-04-24 21:57:58.231104,0 days 00:00:08.084681,59737.09868909068,Matern,0.17145096157785383,0.7640891702860809,0.5,TPESampler,COMPLETE
1794,0.26787475262565197,2025-04-24 21:57:52.862891,2025-04-24 21:57:56.701807,0 days 00:00:03.838916,99.71380544764409,Matern,0.5298284312118952,0.0024016692931653045,1.5,TPESampler,COMPLETE
1795,0.26238348159026237,2025-04-24 21:57:56.963585,2025-04-24 21:58:03.381975,0 days 00:00:06.418390,1301.5033898937347,Matern,29.298701426671194,0.028800347676100523,0.5,TPESampler,COMPLETE
1796,0.9329374977454347,2025-04-24 21:57:57.716508,2025-04-24 21:58:02.655002,0 days 00:00:04.938494,330.75301194353375,Matern,0.019581786700265526,0.794390386090413,0.5,TPESampler,COMPLETE
1797,0.2623834664405261,2025-04-24 21:57:58.468468,2025-04-24 21:58:04.594135,0 days 00:00:06.125667,405.1662189121849,Matern,3.1050515091990114,0.926958213867041,0.5,TPESampler,COMPLETE
1798,0.26238352644465723,2025-04-24 21:58:02.870247,2025-04-24 21:58:07.784004,0 days 00:00:04.913757,50.34439033325135,Matern,2588.8473852873285,0.8551402253046395,0.5,TPESampler,COMPLETE
1799,0.9329374977208073,2025-04-24 21:58:03.637893,2025-04-24 21:58:13.835101,0 days 00:00:10.197208,8.74686407296029e-05,Matern,0.003986423878316185,0.0020646865982901948,0.5,TPESampler,COMPLETE
1800,0.26238346758105136,2025-04-24 21:58:04.845949,2025-04-24 21:58:11.584041,0 days 00:00:06.738092,1349.3738068425437,Matern,0.9783853796636138,0.01219044177569717,0.5,TPESampler,COMPLETE
1801,0.9329374977885104,2025-04-24 21:58:08.073498,2025-04-24 21:58:13.021553,0 days 00:00:04.948055,0.00015254610723225412,Matern,0.0027189103532727107,1.957200309898e-08,1.5,TPESampler,COMPLETE
1802,0.9329374977526675,2025-04-24 21:58:11.940760,2025-04-24 21:58:16.607825,0 days 00:00:04.667065,0.007359455128950257,Matern,811.8270000075178,5.94396840385045e-07,0.5,TPESampler,COMPLETE
1803,0.2623834672637659,2025-04-24 21:58:13.378036,2025-04-24 21:58:18.290503,0 days 00:00:04.912467,92179.97250790361,Matern,0.9453498979419741,0.02458660921289967,0.5,TPESampler,COMPLETE
1804,0.26238355162679183,2025-04-24 21:58:14.057224,2025-04-24 21:58:19.354405,0 days 00:00:05.297181,8.94106286408604,Matern,96852.3380603475,0.24948726608109914,0.5,TPESampler,COMPLETE
1805,0.2623834647123588,2025-04-24 21:58:16.906617,2025-04-24 21:58:21.888017,0 days 00:00:04.981400,0.08812957979153756,Matern,0.2197204208348474,0.00967105291270932,0.5,TPESampler,COMPLETE
1806,0.26238347587940014,2025-04-24 21:58:18.554874,2025-04-24 21:58:23.065697,0 days 00:00:04.510823,0.8600981738915732,Matern,1.8541657616025835,0.5271808761570704,0.5,TPESampler,COMPLETE
1807,0.9329374963814474,2025-04-24 21:58:19.649124,2025-04-24 21:58:28.549739,0 days 00:00:08.900615,0.0011935393855253612,RBF,6.721165333741828,0.02234725701317868,0.5,TPESampler,COMPLETE
1808,0.26238344565944427,2025-04-24 21:58:22.178049,2025-04-24 21:58:26.595270,0 days 00:00:04.417221,0.7807987844404618,Matern,2.3946171888014476,0.035829244945856674,0.5,TPESampler,COMPLETE
1809,0.9329374977369387,2025-04-24 21:58:23.417603,2025-04-24 21:58:27.569489,0 days 00:00:04.151886,1210.1135998578866,Matern,0.04136161121624868,0.0005430768871434189,0.5,TPESampler,COMPLETE
1810,0.27375660075594427,2025-04-24 21:58:27.061215,2025-04-24 21:58:32.611142,0 days 00:00:05.549927,0.4384585082826798,Matern,1.1460348813038344,0.9142186241458415,2.5,TPESampler,COMPLETE
1811,0.9329374984178502,2025-04-24 21:58:27.782985,2025-04-24 21:58:38.631446,0 days 00:00:10.848461,0.0058712118764295655,Matern,0.018843837152655918,0.5995638795703337,0.5,TPESampler,COMPLETE
1812,0.2623834747030499,2025-04-24 21:58:28.938771,2025-04-24 21:58:38.403540,0 days 00:00:09.464769,82691.27951412697,Matern,0.25578410942543567,0.001342685188508972,0.5,TPESampler,COMPLETE
1813,0.9329374977470202,2025-04-24 21:58:33.045400,2025-04-24 21:58:38.863587,0 days 00:00:05.818187,2.4562410215520587,Matern,974.3571050218515,0.0007313616394684665,0.5,TPESampler,COMPLETE
1814,0.26238346135668866,2025-04-24 21:58:38.684450,2025-04-24 21:58:43.798081,0 days 00:00:05.113631,24.113328858388183,Matern,53757.59544157487,0.9342191279450285,0.5,TPESampler,COMPLETE
1815,0.2623834702619338,2025-04-24 21:58:38.866833,2025-04-24 21:58:44.782415,0 days 00:00:05.915582,12.653832727711828,Matern,25415.33181287547,0.9682209877002698,0.5,TPESampler,COMPLETE
1816,0.26238344414943443,2025-04-24 21:58:39.162368,2025-04-24 21:58:43.221680,0 days 00:00:04.059312,51463.76301878906,Matern,2.287380031853589,0.4816538702519085,0.5,TPESampler,COMPLETE
1817,0.9329374975962724,2025-04-24 21:58:43.477548,2025-04-24 21:58:49.098605,0 days 00:00:05.621057,77674.36825456763,Matern,0.005987365296666348,0.7163539261428392,0.5,TPESampler,COMPLETE
1818,0.9329374969318809,2025-04-24 21:58:44.035021,2025-04-24 21:58:49.683267,0 days 00:00:05.648246,737.3415723618502,Matern,0.006171129337729416,0.78913357340825,1.5,TPESampler,COMPLETE
1819,0.9329374978116421,2025-04-24 21:58:45.341856,2025-04-24 21:58:53.273574,0 days 00:00:07.931718,4.542679057112229,Matern,77515.75506315556,0.023183873777484983,0.5,TPESampler,COMPLETE
1820,0.2623834718111586,2025-04-24 21:58:49.429613,2025-04-24 21:58:52.992538,0 days 00:00:03.562925,0.024529938881797206,Matern,3.657904662331935,0.7986624457311482,0.5,TPESampler,COMPLETE
1821,0.2623834548456863,2025-04-24 21:58:49.950206,2025-04-24 21:58:55.200139,0 days 00:00:05.249933,20.17267368308876,Matern,13.847437401402503,0.016995860006261604,0.5,TPESampler,COMPLETE
1822,0.932937497520946,2025-04-24 21:58:53.235411,2025-04-24 21:58:57.140789,0 days 00:00:03.905378,18.666574637335124,Matern,3.324641205971334e-05,0.08158188237368522,0.5,TPESampler,COMPLETE
1823,0.282517489524312,2025-04-24 21:58:53.544616,2025-04-24 21:59:05.766707,0 days 00:00:12.222091,0.00034492928954737095,RBF,1.233099189899123,4.781728568838649e-08,1.5,TPESampler,COMPLETE
1824,0.282517543893027,2025-04-24 21:58:55.487818,2025-04-24 21:59:04.075167,0 days 00:00:08.587349,895.1635845247871,RBF,0.2047203257570467,0.0704298397700848,0.5,TPESampler,COMPLETE
1825,0.9928364996359377,2025-04-24 21:58:57.595785,2025-04-24 21:59:01.833048,0 days 00:00:04.237263,30933.636984359993,Matern,213.43794361669785,1.6100875670236827e-09,0.5,TPESampler,COMPLETE
1826,0.2825175465525279,2025-04-24 21:59:02.084759,2025-04-24 21:59:06.472909,0 days 00:00:04.388150,0.520142961033925,RBF,0.2831759175080077,0.02502825342700196,0.5,TPESampler,COMPLETE
1827,0.26238347497276177,2025-04-24 21:59:04.295594,2025-04-24 21:59:13.968769,0 days 00:00:09.673175,0.0004937602328463504,Matern,0.39077790589457934,0.876130296892685,0.5,TPESampler,COMPLETE
1828,0.2623834638829178,2025-04-24 21:59:06.027290,2025-04-24 21:59:11.132813,0 days 00:00:05.105523,9.142697841196975,Matern,0.31622072979859656,0.021222061560559242,0.5,TPESampler,COMPLETE
1829,0.2623833983089648,2025-04-24 21:59:06.730090,2025-04-24 21:59:10.950987,0 days 00:00:04.220897,1.6783988811415622,Matern,37.977432972122074,0.25541868389971534,0.5,TPESampler,COMPLETE
1830,0.9329374933204363,2025-04-24 21:59:11.179875,2025-04-24 21:59:14.693578,0 days 00:00:03.513703,1.492422085509742,Matern,0.07810945514624146,0.8138579962867836,1.5,TPESampler,COMPLETE
