number,value,datetime_start,datetime_complete,duration,params_constant_value,params_kernel_type,params_length_scale,params_noise_level,params_nu,system_attrs_auto:sampler,state
1603,0.9329374961480821,2025-04-24 21:51:10.423348,2025-04-24 21:51:23.641247,0 days 00:00:13.217899,27761.742383508405,Matern,0.005433131236364297,0.00031016762650764614,0.5,TPESampler,COMPLETE
1604,0.9329374979840181,2025-04-24 21:51:10.758181,2025-04-24 21:51:15.088400,0 days 00:00:04.330219,6.397506883067311,Matern,0.004592067553155072,0.0011893810294878124,2.5,TPESampler,COMPLETE
1605,0.9928350442291993,2025-04-24 21:51:15.610481,2025-04-24 21:51:20.789497,0 days 00:00:05.179016,7917.756270459484,Matern,0.1321661206834246,0.01825198984588193,0.5,TPESampler,COMPLETE
1606,0.9329374977296089,2025-04-24 21:51:17.272813,2025-04-24 21:51:28.557908,0 days 00:00:11.285095,0.015082666747366472,Matern,89377.95734595432,0.02618702006007329,0.5,TPESampler,COMPLETE
1607,0.26238353095779865,2025-04-24 21:51:21.298989,2025-04-24 21:51:26.804613,0 days 00:00:05.505624,5152.37117196215,Matern,1.9769954194461763,0.0004208757105878852,0.5,TPESampler,COMPLETE
1608,0.9329374977940587,2025-04-24 21:51:23.929157,2025-04-24 21:51:33.202429,0 days 00:00:09.273272,2.144379173085672e-06,Matern,5718.560383306436,1.6302280556011848e-10,0.5,TPESampler,COMPLETE
1609,0.9329374977775186,2025-04-24 21:51:27.066793,2025-04-24 21:51:31.388456,0 days 00:00:04.321663,1.567658369207529,Matern,8623.33533603046,1.4670691077755409e-09,0.5,TPESampler,COMPLETE
1610,0.9928365741140949,2025-04-24 21:51:28.828429,2025-04-24 21:51:31.712725,0 days 00:00:02.884296,2083.998713827638,RBF,1.2157000563966045,6.396140567547747e-05,0.5,TPESampler,COMPLETE
1611,0.2623834778465804,2025-04-24 21:51:31.636030,2025-04-24 21:51:36.031216,0 days 00:00:04.395186,312.8281512990413,Matern,1.8626155825868662,0.0005389955025204119,0.5,TPESampler,COMPLETE
1612,0.2623834697874312,2025-04-24 21:51:32.032323,2025-04-24 21:51:37.451006,0 days 00:00:05.418683,1213.6583612975187,Matern,1.226749879071669,0.012643477938929169,0.5,TPESampler,COMPLETE
1613,0.26238347500807346,2025-04-24 21:51:33.523196,2025-04-24 21:51:37.997509,0 days 00:00:04.474313,10958.758286229559,Matern,1.1018128805387168,0.0015186002584090573,0.5,TPESampler,COMPLETE
1614,0.2623834782084521,2025-04-24 21:51:36.293249,2025-04-24 21:51:40.985718,0 days 00:00:04.692469,2409.975351135317,Matern,0.5665405379816728,0.021450408569560025,0.5,TPESampler,COMPLETE
1615,0.9329374977435463,2025-04-24 21:51:37.692344,2025-04-24 21:51:40.554677,0 days 00:00:02.862333,91.76917340560594,RBF,0.022554474400332765,0.02475055991948375,0.5,TPESampler,COMPLETE
1616,0.2623834808315201,2025-04-24 21:51:38.303695,2025-04-24 21:51:43.751635,0 days 00:00:05.447940,35602.5743136592,Matern,1.3876641220024408,0.09414596010147536,0.5,TPESampler,COMPLETE
1617,0.9329374977011093,2025-04-24 21:51:40.824170,2025-04-24 21:51:51.779202,0 days 00:00:10.955032,30994.21124427109,Matern,0.005714016707365922,0.001068556286579762,0.5,TPESampler,COMPLETE
1618,0.2623834796927432,2025-04-24 21:51:41.245092,2025-04-24 21:51:56.299853,0 days 00:00:15.054761,0.0012599846213216,Matern,1893.3904799705167,0.1805101699174124,0.5,TPESampler,COMPLETE
1619,0.9329374977598426,2025-04-24 21:51:44.323980,2025-04-24 21:51:51.752489,0 days 00:00:07.428509,55023.97090079857,Matern,0.02533399985717242,0.012199913794618667,0.5,TPESampler,COMPLETE
1620,0.26238345321561757,2025-04-24 21:51:51.932144,2025-04-24 21:51:57.077318,0 days 00:00:05.145174,65.02367869701541,Matern,0.20068126758119137,0.0008860703325005322,0.5,TPESampler,COMPLETE
1621,0.9329374967291865,2025-04-24 21:51:51.979825,2025-04-24 21:51:57.620295,0 days 00:00:05.640470,18342.49881650769,RBF,0.0010683610693702859,0.001221283677764148,1.5,TPESampler,COMPLETE
1622,0.2623834744155461,2025-04-24 21:51:56.558786,2025-04-24 21:52:09.763194,0 days 00:00:13.204408,0.0011259627975197183,Matern,3409.712481618936,0.6442686023451984,0.5,TPESampler,COMPLETE
1623,0.9329374950618059,2025-04-24 21:51:57.311768,2025-04-24 21:52:00.623993,0 days 00:00:03.312225,0.6568622457096102,Matern,0.026876770916648553,0.025778974932823183,0.5,TPESampler,COMPLETE
1624,0.2623834664130745,2025-04-24 21:51:57.884052,2025-04-24 21:52:05.410115,0 days 00:00:07.526063,1164.741180943839,Matern,0.19284164863590422,0.14625668041998358,0.5,TPESampler,COMPLETE
1625,0.9329374980635531,2025-04-24 21:52:00.924344,2025-04-24 21:52:07.866704,0 days 00:00:06.942360,0.2864205008462211,Matern,9572.308818700789,0.03776172259877787,0.5,TPESampler,COMPLETE
1626,0.2623834835061112,2025-04-24 21:52:05.669214,2025-04-24 21:52:10.261875,0 days 00:00:04.592661,299.50860947072727,Matern,17.311701296947984,0.00015338223540682078,0.5,TPESampler,COMPLETE
1627,0.26238347521355315,2025-04-24 21:52:08.158488,2025-04-24 21:52:12.823904,0 days 00:00:04.665416,23.742167776339382,Matern,1.2634017594792666,0.0004764339241586179,0.5,TPESampler,COMPLETE
1628,0.27375659720497164,2025-04-24 21:52:10.078837,2025-04-24 21:52:14.798044,0 days 00:00:04.719207,1022.3700173721095,Matern,0.48232424919580413,0.004535869468504742,2.5,TPESampler,COMPLETE
1629,0.26238355990013146,2025-04-24 21:52:10.573973,2025-04-24 21:52:14.911809,0 days 00:00:04.337836,2.186534973487585,Matern,0.4464631243320663,0.0014677831100804806,0.5,TPESampler,COMPLETE
1630,0.26238341367911056,2025-04-24 21:52:13.119997,2025-04-24 21:52:18.699655,0 days 00:00:05.579658,1087.6915872660484,Matern,0.33630923678908603,0.06306098640585835,0.5,TPESampler,COMPLETE
1631,0.99283505838933,2025-04-24 21:52:14.988990,2025-04-24 21:52:19.307515,0 days 00:00:04.318525,169.00502252854608,Matern,0.035032399539086136,1.1551668970463953e-05,0.5,TPESampler,COMPLETE
1632,0.9329374968087483,2025-04-24 21:52:15.181940,2025-04-24 21:52:24.396038,0 days 00:00:09.214098,1.3095078051058933e-07,RBF,0.004788151489085641,9.73064084569365e-05,0.5,TPESampler,COMPLETE
1633,0.9329374992602805,2025-04-24 21:52:19.015950,2025-04-24 21:52:22.328275,0 days 00:00:03.312325,90410.52918536283,Matern,0.04245353630480626,0.02230037015504815,0.5,TPESampler,COMPLETE
1634,0.9928361047808746,2025-04-24 21:52:19.598036,2025-04-24 21:52:22.875235,0 days 00:00:03.277199,28030.225795700346,Matern,0.47137451011253156,3.033734232323657e-06,0.5,TPESampler,COMPLETE
1635,0.9329374978485161,2025-04-24 21:52:22.628844,2025-04-24 21:52:29.655579,0 days 00:00:07.026735,0.04280008736015037,Matern,3776.0548703575373,0.013771753580667895,0.5,TPESampler,COMPLETE
1636,0.26238346862902434,2025-04-24 21:52:23.152507,2025-04-24 21:52:29.116264,0 days 00:00:05.963757,0.3492713442734415,Matern,7733.191802324863,0.08474764148854386,0.5,TPESampler,COMPLETE
1637,0.2623834677595858,2025-04-24 21:52:24.666239,2025-04-24 21:52:29.515534,0 days 00:00:04.849295,22.583828971505312,Matern,0.4975950263189586,0.014574579906697964,0.5,TPESampler,COMPLETE
1638,0.9329374977466726,2025-04-24 21:52:29.357357,2025-04-24 21:52:37.379152,0 days 00:00:08.021795,98308.49878141466,Matern,0.00839684615618086,0.4857409965808925,0.5,TPESampler,COMPLETE
1639,0.26238349162381047,2025-04-24 21:52:29.724578,2025-04-24 21:52:42.600911,0 days 00:00:12.876333,1183.6117384734075,Matern,0.08113027672708147,0.004276600110727114,0.5,TPESampler,COMPLETE
1640,0.9329374974626294,2025-04-24 21:52:29.871628,2025-04-24 21:52:41.456480,0 days 00:00:11.584852,1.1265166471972128e-07,RBF,15.947770201055912,4.526262704326656e-10,1.5,TPESampler,COMPLETE
1641,0.2623833017671982,2025-04-24 21:52:37.670310,2025-04-24 21:52:42.929272,0 days 00:00:05.258962,31000.315371138106,Matern,1.880448278814728,0.7800225976477826,0.5,TPESampler,COMPLETE
1642,0.9928350583818945,2025-04-24 21:52:41.736746,2025-04-24 21:52:45.045198,0 days 00:00:03.308452,482.4924610599932,Matern,0.0023022291535758498,7.995856306680275e-08,2.5,TPESampler,COMPLETE
1643,0.26238346790542794,2025-04-24 21:52:42.855011,2025-04-24 21:52:50.958837,0 days 00:00:08.103826,1833.9082173720158,Matern,0.09958617917011567,0.0020208445529754523,0.5,TPESampler,COMPLETE
1644,0.2623834339259741,2025-04-24 21:52:43.206733,2025-04-24 21:52:48.313280,0 days 00:00:05.106547,22848.323820379082,Matern,4.995318699883432,0.0911995305951908,0.5,TPESampler,COMPLETE
1645,0.26238342352921645,2025-04-24 21:52:45.315600,2025-04-24 21:52:50.986831,0 days 00:00:05.671231,6284.258353304269,Matern,0.8954982488507643,0.012117136478564713,0.5,TPESampler,COMPLETE
1646,0.9329374979336208,2025-04-24 21:52:48.542266,2025-04-24 21:52:52.666310,0 days 00:00:04.124044,3119.0275973753905,Matern,0.03715223131715966,0.4510248641015492,0.5,TPESampler,COMPLETE
1647,0.262383613471471,2025-04-24 21:52:51.160765,2025-04-24 21:52:56.404712,0 days 00:00:05.243947,2169.846313658546,Matern,1.044964960677378,0.01969942213091951,0.5,TPESampler,COMPLETE
1648,0.26238345375501765,2025-04-24 21:52:51.252867,2025-04-24 21:52:56.912396,0 days 00:00:05.659529,48643.93315682654,Matern,0.4635158942287414,0.03884354338992608,0.5,TPESampler,COMPLETE
1649,0.932937497487872,2025-04-24 21:52:52.958094,2025-04-24 21:53:02.169399,0 days 00:00:09.211305,0.005865374432544229,RBF,628.9698963433375,0.0032163185820392117,0.5,TPESampler,COMPLETE
1650,0.2623834715799908,2025-04-24 21:52:56.672190,2025-04-24 21:53:02.083108,0 days 00:00:05.410918,30042.556080871687,Matern,1.4562887081078395,0.9726695592021388,0.5,TPESampler,COMPLETE
1651,0.2623834959575685,2025-04-24 21:52:57.160538,2025-04-24 21:53:02.117133,0 days 00:00:04.956595,29994.70951310573,Matern,238.28375299936366,0.2850047132602144,0.5,TPESampler,COMPLETE
1652,0.2825175522252649,2025-04-24 21:53:02.251101,2025-04-24 21:53:08.092006,0 days 00:00:05.840905,97061.95125124465,RBF,5.7913007328544905,0.015498018106979396,0.5,TPESampler,COMPLETE
1653,0.2623834574204438,2025-04-24 21:53:02.259100,2025-04-24 21:53:07.464554,0 days 00:00:05.205454,4296.082859769803,Matern,1.8366541072846714,0.11183621198511241,0.5,TPESampler,COMPLETE
1654,0.2623835457053998,2025-04-24 21:53:02.337900,2025-04-24 21:53:07.119761,0 days 00:00:04.781861,37256.92930347057,Matern,0.7132522951802431,0.08942472275838369,0.5,TPESampler,COMPLETE
1655,0.26238348108594434,2025-04-24 21:53:07.398617,2025-04-24 21:53:11.971105,0 days 00:00:04.572488,36680.01101882199,Matern,11.301343375165459,0.48404056277305996,0.5,TPESampler,COMPLETE
1656,0.2623834686561795,2025-04-24 21:53:07.752592,2025-04-24 21:53:13.080780,0 days 00:00:05.328188,17745.315338036107,Matern,1.787081493445929,0.7733804499519508,0.5,TPESampler,COMPLETE
1657,0.9928365740916939,2025-04-24 21:53:08.336508,2025-04-24 21:53:14.761507,0 days 00:00:06.424999,2.0692724708573564,Matern,65834.60897391717,0.046720228370337694,1.5,TPESampler,COMPLETE
1658,0.9928350583881251,2025-04-24 21:53:12.366379,2025-04-24 21:53:16.198289,0 days 00:00:03.831910,86999.21450888613,RBF,0.06599067844152084,2.4053977828306446e-08,0.5,TPESampler,COMPLETE
1659,0.9329374976829155,2025-04-24 21:53:13.369686,2025-04-24 21:53:20.641887,0 days 00:00:07.272201,2.7551383841367634,Matern,98841.04078730484,0.027516507016435137,0.5,TPESampler,COMPLETE
1660,0.9329374925541998,2025-04-24 21:53:15.068240,2025-04-24 21:53:19.211712,0 days 00:00:04.143472,99839.19135951168,Matern,0.051623498117413014,0.37245687998420424,0.5,TPESampler,COMPLETE
1661,0.27375654450718007,2025-04-24 21:53:16.484900,2025-04-24 21:53:23.931283,0 days 00:00:07.446383,61732.33383461194,Matern,12.824439404372,0.06705794359114677,2.5,TPESampler,COMPLETE
1662,0.26238349853234605,2025-04-24 21:53:19.526955,2025-04-24 21:53:24.892380,0 days 00:00:05.365425,13006.26854290245,Matern,0.6062174591538727,0.9037856526821114,0.5,TPESampler,COMPLETE
1663,0.2623834746536647,2025-04-24 21:53:20.900877,2025-04-24 21:53:25.057226,0 days 00:00:04.156349,3989.143634650611,Matern,7.551848530556212,0.6772662477549547,0.5,TPESampler,COMPLETE
1664,0.26238347783483046,2025-04-24 21:53:24.190176,2025-04-24 21:53:30.623706,0 days 00:00:06.433530,1.2526341906497365,Matern,1901.2476906891857,0.7390333486846197,0.5,TPESampler,COMPLETE
1665,0.9329375021525214,2025-04-24 21:53:25.109558,2025-04-24 21:53:30.597789,0 days 00:00:05.488231,1131.2849473322378,Matern,0.04170287669627272,0.0127080142577496,1.5,TPESampler,COMPLETE
1666,0.2623834849214405,2025-04-24 21:53:25.315058,2025-04-24 21:53:31.906044,0 days 00:00:06.590986,17984.528917841006,Matern,0.2800357856183159,0.6271120840905633,0.5,TPESampler,COMPLETE
1667,0.26238346768751764,2025-04-24 21:53:30.771463,2025-04-24 21:53:36.654152,0 days 00:00:05.882689,48322.50012007125,Matern,8.10685817392838,0.6203740803890765,0.5,TPESampler,COMPLETE
1668,0.9928350582753004,2025-04-24 21:53:30.817479,2025-04-24 21:53:34.895671,0 days 00:00:04.078192,1.3562817028203131,Matern,0.12153750497551695,1.5030426111664406e-10,1.5,TPESampler,COMPLETE
1669,0.9329374978600127,2025-04-24 21:53:32.162957,2025-04-24 21:53:38.174528,0 days 00:00:06.011571,155.7846225589417,Matern,9235.34650495945,3.198329399218698e-10,1.5,TPESampler,COMPLETE
1670,0.2825175461699869,2025-04-24 21:53:35.147908,2025-04-24 21:53:43.616377,0 days 00:00:08.468469,0.01300315170152986,RBF,0.21146567966085542,3.1937805279091604e-08,2.5,TPESampler,COMPLETE
1671,0.26238347552063473,2025-04-24 21:53:36.927399,2025-04-24 21:53:41.899463,0 days 00:00:04.972064,83478.60022649077,Matern,22.982700832417155,0.9087731106977527,0.5,TPESampler,COMPLETE
1672,0.2623834088197837,2025-04-24 21:53:38.430229,2025-04-24 21:53:43.532931,0 days 00:00:05.102702,56768.506575879124,Matern,1.728977895556479,0.08269830614511424,0.5,TPESampler,COMPLETE
1673,0.9329374977244267,2025-04-24 21:53:42.164612,2025-04-24 21:53:45.268862,0 days 00:00:03.104250,232.7881512403838,Matern,0.043435182670103,0.8094205130980936,0.5,TPESampler,COMPLETE
1674,0.2623834379470432,2025-04-24 21:53:43.748537,2025-04-24 21:53:47.866065,0 days 00:00:04.117528,0.017376042760176652,Matern,2.2158766913385577,0.8137267687140867,0.5,TPESampler,COMPLETE
1675,0.2623835557959635,2025-04-24 21:53:43.830052,2025-04-24 21:53:49.778337,0 days 00:00:05.948285,0.7406178298177221,Matern,1619.0959372175025,0.7353116245817334,0.5,TPESampler,COMPLETE
1676,0.2623834789104334,2025-04-24 21:53:45.529486,2025-04-24 21:53:51.059226,0 days 00:00:05.529740,1074.5605542060175,Matern,4.59308390059682,0.8665127753438701,0.5,TPESampler,COMPLETE
1677,0.26238347606996143,2025-04-24 21:53:48.131675,2025-04-24 21:53:54.407685,0 days 00:00:06.276010,81566.65446201147,Matern,0.4081108730291686,0.19052183664206168,0.5,TPESampler,COMPLETE
1678,0.9329374977403816,2025-04-24 21:53:50.057541,2025-04-24 21:53:53.145206,0 days 00:00:03.087665,130.40617454558034,Matern,4.225916211778343e-05,0.09842541988938666,2.5,TPESampler,COMPLETE
1679,0.26238348910540144,2025-04-24 21:53:51.334899,2025-04-24 21:53:56.618808,0 days 00:00:05.283909,0.07300207827002145,Matern,69.38747231588135,0.9448919362604249,0.5,TPESampler,COMPLETE
1680,0.9329374975403679,2025-04-24 21:53:53.415740,2025-04-24 21:54:00.471194,0 days 00:00:07.055454,0.13073136582873185,Matern,85033.47760276664,0.0005070716708512257,0.5,TPESampler,COMPLETE
1681,0.2623835179096783,2025-04-24 21:53:54.669414,2025-04-24 21:54:08.197681,0 days 00:00:13.528267,0.01643934460101506,Matern,12296.729926018412,0.6654974602577006,0.5,TPESampler,COMPLETE
1682,0.2623834650574382,2025-04-24 21:53:56.867853,2025-04-24 21:54:02.634219,0 days 00:00:05.766366,89309.98153663031,Matern,0.8880130990531797,0.04196650507046916,0.5,TPESampler,COMPLETE
1683,0.26238347548505336,2025-04-24 21:54:00.781435,2025-04-24 21:54:05.321947,0 days 00:00:04.540512,15284.958967200459,Matern,18.92318562702378,0.0004600472040227382,0.5,TPESampler,COMPLETE
1684,0.2623834754545619,2025-04-24 21:54:02.902769,2025-04-24 21:54:11.955729,0 days 00:00:09.052960,4.951198793583242e-05,Matern,46.55853235144463,0.8884536178272371,0.5,TPESampler,COMPLETE
1685,0.9928365720640464,2025-04-24 21:54:05.688208,2025-04-24 21:54:10.788067,0 days 00:00:05.099859,1.7615109140190506,RBF,12853.937953644556,0.12308277511495447,0.5,TPESampler,COMPLETE
1686,0.9928365555095349,2025-04-24 21:54:08.468716,2025-04-24 21:54:11.724086,0 days 00:00:03.255370,99744.45323643548,Matern,0.6830311133940645,0.010275554369340417,0.5,TPESampler,COMPLETE
1687,0.9928347453434985,2025-04-24 21:54:11.052856,2025-04-24 21:54:15.688240,0 days 00:00:04.635384,0.08255897591791968,Matern,74347.6690078865,0.880432689237303,0.5,TPESampler,COMPLETE
1688,0.9928350583867404,2025-04-24 21:54:11.950785,2025-04-24 21:54:14.700176,0 days 00:00:02.749391,1975.7718436460427,Matern,2.731087077389846e-05,4.623749059938462e-05,0.5,TPESampler,COMPLETE
1689,0.26238334481625714,2025-04-24 21:54:12.242422,2025-04-24 21:54:17.377213,0 days 00:00:05.134791,0.010643256232585092,Matern,0.317435643429771,0.2910403248712734,0.5,TPESampler,COMPLETE
1690,0.2623835964587126,2025-04-24 21:54:14.960308,2025-04-24 21:54:20.174926,0 days 00:00:05.214618,44.088800671791574,Matern,0.5719561437714743,0.40152680685301045,0.5,TPESampler,COMPLETE
1691,0.26238352867430087,2025-04-24 21:54:15.951417,2025-04-24 21:54:23.667747,0 days 00:00:07.716330,0.005493058559893604,Matern,810.0251891773297,0.6344280229132521,0.5,TPESampler,COMPLETE
1692,0.2623834565729603,2025-04-24 21:54:17.678469,2025-04-24 21:54:26.182690,0 days 00:00:08.504221,0.5621584358784666,Matern,0.1311391079917543,0.9308481539115414,0.5,TPESampler,COMPLETE
1693,0.9329374963589412,2025-04-24 21:54:20.444162,2025-04-24 21:54:30.480807,0 days 00:00:10.036645,0.004018808606225449,Matern,90415.81419820122,0.014676417384861699,0.5,TPESampler,COMPLETE
1694,0.28251754304966853,2025-04-24 21:54:23.931426,2025-04-24 21:54:29.486345,0 days 00:00:05.554919,31565.27288459972,RBF,1.4873162249214478,0.5253295497952285,0.5,TPESampler,COMPLETE
1695,0.26238344905619754,2025-04-24 21:54:26.449736,2025-04-24 21:54:32.421908,0 days 00:00:05.972172,0.018087963069074023,Matern,7.618362698564976,0.7546441945932797,0.5,TPESampler,COMPLETE
1696,0.2623840695688049,2025-04-24 21:54:29.765614,2025-04-24 21:54:36.505981,0 days 00:00:06.740367,4.30181736925656,Matern,77460.10175806528,0.07716571409640863,0.5,TPESampler,COMPLETE
1697,0.9329374972722454,2025-04-24 21:54:30.712126,2025-04-24 21:54:37.182515,0 days 00:00:06.470389,0.641618849976576,Matern,5.108158003271373e-05,2.3299638771571775e-07,2.5,TPESampler,COMPLETE
1698,0.9329374970373707,2025-04-24 21:54:32.663621,2025-04-24 21:54:35.962648,0 days 00:00:03.299027,255.39494065412177,Matern,0.06311822831346103,0.6814613639457435,2.5,TPESampler,COMPLETE
1699,0.93293749759207,2025-04-24 21:54:36.227824,2025-04-24 21:54:40.753227,0 days 00:00:04.525403,1.8764998021103774,Matern,0.004098892448559474,0.7427925727359405,0.5,TPESampler,COMPLETE
1700,0.2623836604206882,2025-04-24 21:54:36.763625,2025-04-24 21:54:42.040573,0 days 00:00:05.276948,90951.95180916805,Matern,1.5281111135047931,0.0008543368869250467,0.5,TPESampler,COMPLETE
1701,0.26238347592029065,2025-04-24 21:54:37.431204,2025-04-24 21:54:42.592475,0 days 00:00:05.161271,1.6795886661703294,Matern,3.3871483989132103,0.5121977003530299,0.5,TPESampler,COMPLETE
1702,0.26238347472800966,2025-04-24 21:54:41.007845,2025-04-24 21:54:46.190064,0 days 00:00:05.182219,517.8593806174924,Matern,0.6707451527383856,0.5943793468163979,0.5,TPESampler,COMPLETE
1703,0.9928346609033026,2025-04-24 21:54:42.304557,2025-04-24 21:54:46.110940,0 days 00:00:03.806383,1.1906778924206451,Matern,0.6354294579522005,1.1253893758685485e-10,0.5,TPESampler,COMPLETE
1704,0.2623834153774039,2025-04-24 21:54:42.874382,2025-04-24 21:54:48.944429,0 days 00:00:06.070047,0.21107872600723376,Matern,266.2526243420889,0.033005243640830476,0.5,TPESampler,COMPLETE
1705,0.932937497683894,2025-04-24 21:54:46.296344,2025-04-24 21:54:50.078840,0 days 00:00:03.782496,4722.7872051660215,Matern,0.00013474500882023556,0.032779474634598314,0.5,TPESampler,COMPLETE
1706,0.9329374978414008,2025-04-24 21:54:46.434403,2025-04-24 21:54:54.044175,0 days 00:00:07.609772,0.12774512441814084,Matern,4335.337307237993,0.01766321149639462,0.5,TPESampler,COMPLETE
1707,0.2623834755566826,2025-04-24 21:54:49.213130,2025-04-24 21:54:54.771774,0 days 00:00:05.558644,0.32045383979356096,Matern,1720.6864299419935,0.09791547724594059,0.5,TPESampler,COMPLETE
1708,0.9329374983410149,2025-04-24 21:54:50.298505,2025-04-24 21:54:57.335080,0 days 00:00:07.036575,4.1556491795530235,RBF,62398.478055822765,4.79272861393928e-09,1.5,TPESampler,COMPLETE
1709,0.2623834652408159,2025-04-24 21:54:54.308596,2025-04-24 21:54:59.548460,0 days 00:00:05.239864,0.9526150599944225,Matern,2214.493723872146,0.7502226077708921,0.5,TPESampler,COMPLETE
1710,0.2623834728775818,2025-04-24 21:54:55.052993,2025-04-24 21:55:03.991125,0 days 00:00:08.938132,39577.04853152646,Matern,0.16611716217890615,0.7473914957603991,0.5,TPESampler,COMPLETE
1711,0.2623834745770014,2025-04-24 21:54:57.589375,2025-04-24 21:55:06.482920,0 days 00:00:08.893545,3.4701944968726823,Matern,64313.45357599421,0.7427609801153678,0.5,TPESampler,COMPLETE
1712,0.9329374977463495,2025-04-24 21:54:59.806313,2025-04-24 21:55:03.992270,0 days 00:00:04.185957,219.38445954111646,Matern,0.02235274363690101,0.06676180059303077,0.5,TPESampler,COMPLETE
1713,0.2623834729028983,2025-04-24 21:55:04.151574,2025-04-24 21:55:12.224926,0 days 00:00:08.073352,0.006110346781232875,Matern,1572.9474799867276,0.8937060603187663,0.5,TPESampler,COMPLETE
1714,0.9928350583881337,2025-04-24 21:55:04.224296,2025-04-24 21:55:07.746192,0 days 00:00:03.521896,72122.7984441598,Matern,3.2974523315281455e-05,2.4460814863362515e-08,2.5,TPESampler,COMPLETE
1715,0.9329375069267967,2025-04-24 21:55:06.783783,2025-04-24 21:55:16.812446,0 days 00:00:10.028663,8.54003835416925e-06,RBF,8449.572486787501,2.196394663009217e-08,1.5,TPESampler,COMPLETE
1716,0.9329374974590179,2025-04-24 21:55:08.018969,2025-04-24 21:55:15.797699,0 days 00:00:07.778730,0.05572480166212449,Matern,4058.5170316021376,0.02121116469085978,0.5,TPESampler,COMPLETE
