number,value,datetime_start,datetime_complete,duration,params_constant_value,params_kernel_type,params_length_scale,params_noise_level,params_nu,system_attrs_auto:sampler,state
2401,0.27375668418443466,2025-04-24 22:17:35.255904,2025-04-24 22:17:38.820615,0 days 00:00:03.564711,1.4624584449775027,Matern,1.9840001595717305,0.07867948021394335,2.5,TPESampler,COMPLETE
2402,0.262383474355062,2025-04-24 22:17:36.774424,2025-04-24 22:17:40.911318,0 days 00:00:04.136894,4478.561255102998,Matern,19.939381491354844,0.9404683217105235,0.5,TPESampler,COMPLETE
2403,0.26238350302378677,2025-04-24 22:17:37.749117,2025-04-24 22:17:42.137993,0 days 00:00:04.388876,0.9499880984130622,Matern,44.909937971991575,0.09055878768008084,0.5,TPESampler,COMPLETE
2404,0.2623834812030006,2025-04-24 22:17:39.114372,2025-04-24 22:17:43.488447,0 days 00:00:04.374075,0.42060699556116443,Matern,6.215799171210867,0.009967008081677864,0.5,TPESampler,COMPLETE
2405,0.9329374977214789,2025-04-24 22:17:41.193216,2025-04-24 22:17:45.278156,0 days 00:00:04.084940,1.2232547395572275,Matern,100.55641821239996,0.0007246802352833322,1.5,TPESampler,COMPLETE
2406,0.26238328453083815,2025-04-24 22:17:42.389717,2025-04-24 22:17:47.679605,0 days 00:00:05.289888,93413.85358250303,Matern,0.6982395575139355,0.02220580207980411,0.5,TPESampler,COMPLETE
2407,0.2623833176956777,2025-04-24 22:17:43.748141,2025-04-24 22:17:48.199468,0 days 00:00:04.451327,5.962860368346264,Matern,4.758646839815618,0.03255142391274725,0.5,TPESampler,COMPLETE
2408,0.9928350583887844,2025-04-24 22:17:45.559444,2025-04-24 22:17:48.585579,0 days 00:00:03.026135,2694.1229731362464,RBF,0.0002907614819542394,1.382943045756234e-06,2.5,TPESampler,COMPLETE
2409,0.2623838475603932,2025-04-24 22:17:47.924425,2025-04-24 22:17:52.579672,0 days 00:00:04.655247,29624.425782123137,Matern,2.3951771735342557,0.03947381561961136,0.5,TPESampler,COMPLETE
2410,0.9928364445107298,2025-04-24 22:17:48.500135,2025-04-24 22:17:51.395689,0 days 00:00:02.895554,61789.0347014021,Matern,0.834853166617031,0.0003098756789394103,0.5,TPESampler,COMPLETE
2411,0.9329374791302458,2025-04-24 22:17:48.898994,2025-04-24 22:17:52.637428,0 days 00:00:03.738434,17728.920692008334,Matern,0.05710217801074106,0.04109303378827166,0.5,TPESampler,COMPLETE
2412,0.26238346379788485,2025-04-24 22:17:51.736806,2025-04-24 22:17:56.869032,0 days 00:00:05.132226,54024.67528699787,Matern,4.659154459999507,0.0027365348725774327,0.5,TPESampler,COMPLETE
2413,0.26238345522791345,2025-04-24 22:17:52.771975,2025-04-24 22:17:57.586552,0 days 00:00:04.814577,71608.15177312793,Matern,2.6573852684919976,0.16195219694546353,0.5,TPESampler,COMPLETE
2414,0.2623834733107376,2025-04-24 22:17:52.937814,2025-04-24 22:17:58.406032,0 days 00:00:05.468218,10997.948586148033,Matern,0.24326834240040748,0.09058776133483412,0.5,TPESampler,COMPLETE
2415,0.26238347366087317,2025-04-24 22:17:57.171284,2025-04-24 22:18:01.803868,0 days 00:00:04.632584,3886.161516628879,Matern,88.65217429687982,0.06759018896387262,0.5,TPESampler,COMPLETE
2416,0.9927194557689316,2025-04-24 22:17:57.843113,2025-04-24 22:18:00.824219,0 days 00:00:02.981106,0.003123206243116598,Matern,394.12652936128706,0.03667775113424741,0.5,TPESampler,COMPLETE
2417,0.9928350550846352,2025-04-24 22:17:58.648490,2025-04-24 22:18:01.835246,0 days 00:00:03.186756,40927.220950736264,Matern,0.003537555437549969,0.06851287401697297,0.5,TPESampler,COMPLETE
2418,0.2623834757045811,2025-04-24 22:18:01.064948,2025-04-24 22:18:06.819747,0 days 00:00:05.754799,54922.19221279143,Matern,4.220827990691897,0.00474278944865917,0.5,TPESampler,COMPLETE
2419,0.9928350583881295,2025-04-24 22:18:01.966122,2025-04-24 22:18:05.139945,0 days 00:00:03.173823,77488.74102475571,Matern,0.003886865621728167,2.963347190648272e-08,1.5,TPESampler,COMPLETE
2420,0.28251763930731466,2025-04-24 22:18:02.008505,2025-04-24 22:18:06.285805,0 days 00:00:04.277300,7.586808445785674,RBF,4.913036312349768,0.04348240327930936,0.5,TPESampler,COMPLETE
2421,0.26238335125855106,2025-04-24 22:18:05.518835,2025-04-24 22:18:10.618670,0 days 00:00:05.099835,7796.014150142684,Matern,1.9082256296093034,0.07608782540409305,0.5,TPESampler,COMPLETE
2422,0.26238347466076917,2025-04-24 22:18:06.624504,2025-04-24 22:18:12.551229,0 days 00:00:05.926725,97152.88883679108,Matern,852.9494056278743,0.016811610128781886,0.5,TPESampler,COMPLETE
2423,0.26238347394161365,2025-04-24 22:18:07.088906,2025-04-24 22:18:13.571652,0 days 00:00:06.482746,5384.802747318454,Matern,38.65354819836651,0.01605757444613604,0.5,TPESampler,COMPLETE
2424,0.26238356835747023,2025-04-24 22:18:10.903167,2025-04-24 22:18:15.726842,0 days 00:00:04.823675,10.992529801126866,Matern,4606.191337770992,0.0548797714928223,0.5,TPESampler,COMPLETE
2425,0.9329374977456054,2025-04-24 22:18:12.807962,2025-04-24 22:18:22.852196,0 days 00:00:10.044234,135.94384593318975,RBF,24295.336304368382,8.427949005463237e-10,0.5,TPESampler,COMPLETE
2426,0.26238424976306995,2025-04-24 22:18:13.872707,2025-04-24 22:18:19.891257,0 days 00:00:06.018550,1519.7661401844375,Matern,2.9021406099333706,0.21202878043735504,0.5,TPESampler,COMPLETE
2427,0.9329374977137157,2025-04-24 22:18:15.996252,2025-04-24 22:18:23.415465,0 days 00:00:07.419213,0.019835709715058273,Matern,0.015589844485650269,8.575962898849082e-07,0.5,TPESampler,COMPLETE
2428,0.9329374976188819,2025-04-24 22:18:20.534997,2025-04-24 22:18:30.822008,0 days 00:00:10.287011,0.0012265376789390163,RBF,2.0575146646175152e-05,0.2588473112147659,0.5,TPESampler,COMPLETE
2429,0.9329374982854469,2025-04-24 22:18:23.373937,2025-04-24 22:18:27.422263,0 days 00:00:04.048326,26452.9850772899,Matern,0.03753477726601486,0.03656711445432193,0.5,TPESampler,COMPLETE
2430,0.26238346934951556,2025-04-24 22:18:23.715554,2025-04-24 22:18:29.405342,0 days 00:00:05.689788,83.53357104056788,Matern,11924.005491181859,0.00045652075089609755,0.5,TPESampler,COMPLETE
2431,0.2825175501308535,2025-04-24 22:18:27.692648,2025-04-24 22:18:35.361897,0 days 00:00:07.669249,0.0021822769448219793,RBF,0.20044922914413377,1.8277447603407424e-10,1.5,TPESampler,COMPLETE
2432,0.2623834752183781,2025-04-24 22:18:29.666444,2025-04-24 22:18:35.546856,0 days 00:00:05.880412,232.76095658409454,Matern,77715.23021647637,0.0064783122639763555,0.5,TPESampler,COMPLETE
2433,0.9928350458518309,2025-04-24 22:18:31.108228,2025-04-24 22:18:35.033562,0 days 00:00:03.925334,65795.84081115194,Matern,0.12877005230152852,0.19869260292004087,0.5,TPESampler,COMPLETE
2434,0.2623835951712294,2025-04-24 22:18:35.260666,2025-04-24 22:18:39.404513,0 days 00:00:04.143847,95605.57828317399,Matern,0.6687598460764905,0.0015349138439032413,0.5,TPESampler,COMPLETE
2435,0.26238349074215345,2025-04-24 22:18:35.630636,2025-04-24 22:18:41.275386,0 days 00:00:05.644750,0.16479062469827482,Matern,85.10676001300696,0.050471367832824215,0.5,TPESampler,COMPLETE
2436,0.26238347865093076,2025-04-24 22:18:35.756357,2025-04-24 22:18:40.776153,0 days 00:00:05.019796,0.3815974873160448,Matern,237.81316334244724,0.08379508497550242,0.5,TPESampler,COMPLETE
2437,0.262383519513151,2025-04-24 22:18:39.702927,2025-04-24 22:18:45.194992,0 days 00:00:05.492065,76594.39543020062,Matern,0.35016319595892237,0.5980427419945377,0.5,TPESampler,COMPLETE
2438,0.26238329973941077,2025-04-24 22:18:41.032521,2025-04-24 22:18:45.742788,0 days 00:00:04.710267,39.209736978170625,Matern,4040.32997533865,0.1601752354116549,0.5,TPESampler,COMPLETE
2439,0.2623835050012877,2025-04-24 22:18:41.541888,2025-04-24 22:18:46.184599,0 days 00:00:04.642711,3575.138394708876,Matern,3.4903505729904953,0.850055109843698,0.5,TPESampler,COMPLETE
2440,0.26238343307596396,2025-04-24 22:18:45.489718,2025-04-24 22:18:50.100257,0 days 00:00:04.610539,349.2028276306164,Matern,587.2388333390837,0.7207332670066631,0.5,TPESampler,COMPLETE
2441,0.26238348691264163,2025-04-24 22:18:46.014421,2025-04-24 22:18:50.406515,0 days 00:00:04.392094,21.603985131745507,Matern,99.78203154772787,0.4374935190076533,0.5,TPESampler,COMPLETE
2442,0.2623834746501191,2025-04-24 22:18:46.469014,2025-04-24 22:18:52.506866,0 days 00:00:06.037852,40.020589790475185,Matern,6709.091444458626,0.22650583504422905,0.5,TPESampler,COMPLETE
2443,0.9329374977411791,2025-04-24 22:18:50.360404,2025-04-24 22:18:54.073892,0 days 00:00:03.713488,43.8330035560603,RBF,6.908238510624308e-05,0.8290827894847657,0.5,TPESampler,COMPLETE
2444,0.2623834751367629,2025-04-24 22:18:50.690087,2025-04-24 22:18:55.239398,0 days 00:00:04.549311,269.10435003551555,Matern,3781.329385803029,0.001663362200431919,0.5,TPESampler,COMPLETE
2445,0.26238344789014506,2025-04-24 22:18:52.801753,2025-04-24 22:18:58.223849,0 days 00:00:05.422096,47.94838611495031,Matern,6889.714535832789,0.017246270914516474,0.5,TPESampler,COMPLETE
2446,0.26238350032480007,2025-04-24 22:18:54.370700,2025-04-24 22:18:58.962977,0 days 00:00:04.592277,150.1270322911874,Matern,406.41118862364675,0.06770782901811344,0.5,TPESampler,COMPLETE
2447,0.9329374980496707,2025-04-24 22:18:55.516766,2025-04-24 22:18:58.608514,0 days 00:00:03.091748,0.013031963606596208,Matern,0.0015216772927401762,3.870451478827691e-05,1.5,TPESampler,COMPLETE
2448,0.26238347346726637,2025-04-24 22:18:58.461921,2025-04-24 22:19:03.850713,0 days 00:00:05.388792,18.459286517881644,Matern,10432.608467490187,0.21351700617558142,0.5,TPESampler,COMPLETE
2449,0.26238347466888523,2025-04-24 22:18:58.882772,2025-04-24 22:19:04.960885,0 days 00:00:06.078113,76.51718411951649,Matern,73078.03063736131,0.38210256791596053,0.5,TPESampler,COMPLETE
2450,0.2623834750675056,2025-04-24 22:18:59.326782,2025-04-24 22:19:03.776699,0 days 00:00:04.449917,21.57204869266979,Matern,1122.3971850547496,0.16630593608871605,0.5,TPESampler,COMPLETE
2451,0.2623834715300564,2025-04-24 22:19:03.986084,2025-04-24 22:19:08.531687,0 days 00:00:04.545603,14.700976419367658,Matern,2324.5514000235476,0.008414444371968558,0.5,TPESampler,COMPLETE
2452,0.26238346535710183,2025-04-24 22:19:04.055385,2025-04-24 22:19:08.485130,0 days 00:00:04.429745,4.078868276308416,Matern,2442.0518469192316,0.05477539643001868,0.5,TPESampler,COMPLETE
2453,0.2623834745072479,2025-04-24 22:19:05.219258,2025-04-24 22:19:10.334570,0 days 00:00:05.115312,979.5939888323563,Matern,6014.927523689136,0.04056839785453592,0.5,TPESampler,COMPLETE
2454,0.2623834783304625,2025-04-24 22:19:08.632898,2025-04-24 22:19:14.105513,0 days 00:00:05.472615,58.638338857265126,Matern,26836.860805082266,0.8937484090749475,0.5,TPESampler,COMPLETE
2455,0.26238350432315255,2025-04-24 22:19:08.730741,2025-04-24 22:19:14.929439,0 days 00:00:06.198698,0.004356916857514951,Matern,29.58811065019231,0.921955859474089,0.5,TPESampler,COMPLETE
2456,0.9329374977332283,2025-04-24 22:19:10.602493,2025-04-24 22:19:15.376498,0 days 00:00:04.774005,7.507407010704846,Matern,71871.6620712138,0.0007594423870957385,0.5,TPESampler,COMPLETE
2457,0.2623834787728882,2025-04-24 22:19:14.389258,2025-04-24 22:19:19.604798,0 days 00:00:05.215540,4.012819484586966,Matern,1767.8449362646352,0.25163598377807944,0.5,TPESampler,COMPLETE
2458,0.2623834751899961,2025-04-24 22:19:15.226767,2025-04-24 22:19:19.338433,0 days 00:00:04.111666,13.207276619954907,Matern,470.11618667570707,0.04763748735150125,0.5,TPESampler,COMPLETE
2459,0.9329374977513978,2025-04-24 22:19:15.620573,2025-04-24 22:19:21.390190,0 days 00:00:05.769617,0.3569539829991488,Matern,4897.0934003383945,0.005997946129417408,0.5,TPESampler,COMPLETE
2460,0.2623834749579963,2025-04-24 22:19:19.564617,2025-04-24 22:19:24.828544,0 days 00:00:05.263927,175.5886145359311,Matern,3093.0572759749284,0.2250048612327192,0.5,TPESampler,COMPLETE
2461,0.26238347480779023,2025-04-24 22:19:19.950236,2025-04-24 22:19:25.116872,0 days 00:00:05.166636,24.003313796789424,Matern,505.46003912985975,0.002567807317282071,0.5,TPESampler,COMPLETE
2462,0.2623834816470461,2025-04-24 22:19:21.647964,2025-04-24 22:19:28.038036,0 days 00:00:06.390072,1187.0978758889887,Matern,69161.83033285687,0.007589035131872049,0.5,TPESampler,COMPLETE
2463,0.2623834725421567,2025-04-24 22:19:25.071758,2025-04-24 22:19:30.423137,0 days 00:00:05.351379,5943.0954217816015,Matern,98978.49874497809,0.05901518500827876,0.5,TPESampler,COMPLETE
2464,0.2623835256730948,2025-04-24 22:19:25.465605,2025-04-24 22:19:30.654534,0 days 00:00:05.188929,111.96600333345484,Matern,870.7755864523081,0.05064963045375924,0.5,TPESampler,COMPLETE
2465,0.26238347651933813,2025-04-24 22:19:28.297155,2025-04-24 22:19:33.803107,0 days 00:00:05.505952,10.615952355749982,Matern,1836.5739920342035,0.7266740738070553,0.5,TPESampler,COMPLETE
2466,0.2623834224707356,2025-04-24 22:19:30.658181,2025-04-24 22:19:35.855107,0 days 00:00:05.196926,2.9083799956884824,Matern,1690.906232825203,0.8922971477166767,0.5,TPESampler,COMPLETE
2467,0.9329374978913387,2025-04-24 22:19:30.933995,2025-04-24 22:19:38.098717,0 days 00:00:07.164722,0.9236220695128573,Matern,16002.010630902525,0.015533438245408725,0.5,TPESampler,COMPLETE
2468,0.2623832558530532,2025-04-24 22:19:34.045028,2025-04-24 22:19:38.909539,0 days 00:00:04.864511,395.4957065398144,Matern,36803.81713367217,0.6554522528318409,0.5,TPESampler,COMPLETE
2469,0.932937499506986,2025-04-24 22:19:36.140152,2025-04-24 22:19:41.109506,0 days 00:00:04.969354,1.888265390944561,Matern,5628.106750294617,0.0062049352902446885,0.5,TPESampler,COMPLETE
2470,0.2678747639875548,2025-04-24 22:19:38.372721,2025-04-24 22:19:44.723819,0 days 00:00:06.351098,4978.158899965728,Matern,555.1655259879301,0.0045271306721357246,1.5,TPESampler,COMPLETE
2471,0.2623834752320186,2025-04-24 22:19:39.155502,2025-04-24 22:19:44.459693,0 days 00:00:05.304191,66931.57607444847,Matern,33390.23113116523,0.3574043238917685,0.5,TPESampler,COMPLETE
2472,0.26238378560181935,2025-04-24 22:19:41.361793,2025-04-24 22:19:46.875961,0 days 00:00:05.514168,4116.95144271656,Matern,7593.749252436639,0.6784367118299228,0.5,TPESampler,COMPLETE
2473,0.26238347476473356,2025-04-24 22:19:44.684831,2025-04-24 22:19:51.803188,0 days 00:00:07.118357,0.003924979948318375,Matern,38.66756068832006,0.7589941136023151,0.5,TPESampler,COMPLETE
2474,0.2737566027805622,2025-04-24 22:19:44.995938,2025-04-24 22:19:51.030672,0 days 00:00:06.034734,1471.3637925083544,Matern,1035.7057756825373,0.034840108868341615,2.5,TPESampler,COMPLETE
2475,0.26238347485843344,2025-04-24 22:19:47.134826,2025-04-24 22:19:52.635902,0 days 00:00:05.501076,156.66106171033616,Matern,37874.90141584376,0.020841754199531964,0.5,TPESampler,COMPLETE
2476,0.26238347470691625,2025-04-24 22:19:51.277999,2025-04-24 22:19:57.792670,0 days 00:00:06.514671,149.0968961404755,Matern,57317.864534095475,0.028521787419749402,0.5,TPESampler,COMPLETE
2477,0.2623835080031532,2025-04-24 22:19:52.231198,2025-04-24 22:19:56.683039,0 days 00:00:04.451841,607.013956168894,Matern,1653.1803209431068,0.1650208648856881,0.5,TPESampler,COMPLETE
2478,0.26238349860346327,2025-04-24 22:19:52.906140,2025-04-24 22:19:57.842080,0 days 00:00:04.935940,2350.52954062357,Matern,22284.02509836923,0.018279712311560576,0.5,TPESampler,COMPLETE
2479,0.2623834771250722,2025-04-24 22:19:56.939156,2025-04-24 22:20:01.580903,0 days 00:00:04.641747,85.54091504056028,Matern,4432.941129354966,0.947332299280405,0.5,TPESampler,COMPLETE
2480,0.2623834748754666,2025-04-24 22:19:57.984612,2025-04-24 22:20:03.135105,0 days 00:00:05.150493,1670.2221611350683,Matern,1610.9458940769555,0.015191203457228871,0.5,TPESampler,COMPLETE
2481,0.2623834748794397,2025-04-24 22:19:58.035391,2025-04-24 22:20:03.651398,0 days 00:00:05.616007,2601.6922035173425,Matern,15684.592119019579,0.876992194996288,0.5,TPESampler,COMPLETE
2482,0.26238370193539745,2025-04-24 22:20:01.837556,2025-04-24 22:20:06.016558,0 days 00:00:04.179002,0.18106017924287168,Matern,9.00699040258438,0.06298024654865682,0.5,TPESampler,COMPLETE
2483,0.262383443634511,2025-04-24 22:20:03.380117,2025-04-24 22:20:08.228640,0 days 00:00:04.848523,1419.635270596242,Matern,4069.5288388195886,0.5497777404459284,0.5,TPESampler,COMPLETE
2484,0.26238349885779055,2025-04-24 22:20:03.906023,2025-04-24 22:20:08.521637,0 days 00:00:04.615614,3.462953254396167,Matern,32411.663515117023,0.15991889145321117,0.5,TPESampler,COMPLETE
2485,0.9928350583842819,2025-04-24 22:20:06.427585,2025-04-24 22:20:08.260309,0 days 00:00:01.832724,6.086376753136328e-07,Matern,0.0002887629729351598,0.9043153779330686,0.5,TPESampler,COMPLETE
2486,0.9329374973941377,2025-04-24 22:20:08.425484,2025-04-24 22:20:18.172426,0 days 00:00:09.746942,0.009099235478548566,Matern,2193.241549721632,0.013792085161160397,0.5,TPESampler,COMPLETE
2487,0.2623834701575915,2025-04-24 22:20:08.476152,2025-04-24 22:20:13.695158,0 days 00:00:05.219006,825.1626618395638,Matern,37813.71672309878,0.7631684435080828,0.5,TPESampler,COMPLETE
2488,0.26238346526589745,2025-04-24 22:20:08.823397,2025-04-24 22:20:13.776151,0 days 00:00:04.952754,164.42291125127454,Matern,9816.612948196494,0.1511079972814862,0.5,TPESampler,COMPLETE
2489,0.2623834514184831,2025-04-24 22:20:13.917492,2025-04-24 22:20:19.368070,0 days 00:00:05.450578,67731.04894359874,Matern,2093.4347122942745,0.4886106677276201,0.5,TPESampler,COMPLETE
2490,0.28251754216544667,2025-04-24 22:20:14.108704,2025-04-24 22:20:22.134115,0 days 00:00:08.025411,5.070797498376442,RBF,5368.68357548287,0.3216332064274512,2.5,TPESampler,COMPLETE
2491,0.2623834752160189,2025-04-24 22:20:18.445094,2025-04-24 22:20:25.424011,0 days 00:00:06.978917,249.98532200519873,Matern,92184.10289022472,0.027648275277697417,0.5,TPESampler,COMPLETE
2492,0.2623834774007818,2025-04-24 22:20:19.644564,2025-04-24 22:20:24.482643,0 days 00:00:04.838079,890.9225154066136,Matern,24351.63878137757,0.059148859879145935,0.5,TPESampler,COMPLETE
2493,0.9329374975623118,2025-04-24 22:20:22.424676,2025-04-24 22:20:31.582597,0 days 00:00:09.157921,0.00014428894132198288,Matern,1143.5102342077032,1.4475432286512515e-07,2.5,TPESampler,COMPLETE
2494,0.2623835293134244,2025-04-24 22:20:24.707639,2025-04-24 22:20:29.908649,0 days 00:00:05.201010,546.3151354697924,Matern,88246.84275304481,0.030491237065271116,0.5,TPESampler,COMPLETE
2495,0.26238347476580115,2025-04-24 22:20:25.699346,2025-04-24 22:20:36.485733,0 days 00:00:10.786387,0.00013655947371934624,Matern,0.15433150585625371,0.0397441241576465,0.5,TPESampler,COMPLETE
2496,0.2623834590337465,2025-04-24 22:20:30.186166,2025-04-24 22:20:38.353661,0 days 00:00:08.167495,0.0361809553562596,Matern,2.5003464471394836,0.0008389485022008656,0.5,TPESampler,COMPLETE
2497,0.26238221422034824,2025-04-24 22:20:31.842491,2025-04-24 22:20:37.175589,0 days 00:00:05.333098,140.930155993527,Matern,57728.383921679015,0.05082177637495313,0.5,TPESampler,COMPLETE
2498,0.273756599929906,2025-04-24 22:20:36.792404,2025-04-24 22:20:42.719220,0 days 00:00:05.926816,360.9505394568205,Matern,6422.588611784883,0.8927905128435755,2.5,TPESampler,COMPLETE
2499,0.26238347499109116,2025-04-24 22:20:37.473563,2025-04-24 22:20:44.031114,0 days 00:00:06.557551,36074.75145583471,Matern,64199.73511093673,0.008129260095660154,0.5,TPESampler,COMPLETE
