number,value,datetime_start,datetime_complete,duration,params_constant_value,params_kernel_type,params_length_scale,params_noise_level,params_nu,system_attrs_auto:sampler,state
688,0.9928365379387095,2025-04-24 21:20:52.244071,2025-04-24 21:20:57.493944,0 days 00:00:05.249873,0.013852672903122646,Matern,98438.07573623298,0.14045258799036825,0.5,TPESampler,COMPLETE
689,0.9329374977345789,2025-04-24 21:20:55.045825,2025-04-24 21:21:02.780731,0 days 00:00:07.734906,0.017468624573214266,Matern,56472.22992285,1.2130374025440144e-10,2.5,TPESampler,COMPLETE
690,0.2623834957059101,2025-04-24 21:20:55.724667,2025-04-24 21:21:01.146908,0 days 00:00:05.422241,58.718258166429685,Matern,40.555201500917384,0.06127153818895842,0.5,TPESampler,COMPLETE
691,0.26238347251046634,2025-04-24 21:20:57.726387,2025-04-24 21:21:02.495390,0 days 00:00:04.769003,5.888727813283258,Matern,1621.8772990129003,0.040746822571141136,0.5,TPESampler,COMPLETE
692,0.26238347833099196,2025-04-24 21:21:01.388882,2025-04-24 21:21:05.920293,0 days 00:00:04.531411,11.93455039189337,Matern,1.9761990378319283,0.002819806099259077,0.5,TPESampler,COMPLETE
693,0.26238340729704507,2025-04-24 21:21:02.733056,2025-04-24 21:21:07.487523,0 days 00:00:04.754467,2.422662439024549,Matern,631.3355785663206,0.03675853001868092,0.5,TPESampler,COMPLETE
694,0.9329374979547651,2025-04-24 21:21:03.065606,2025-04-24 21:21:09.917666,0 days 00:00:06.852060,0.8517246947757143,Matern,1536.6977037254835,0.014482413872667235,0.5,TPESampler,COMPLETE
695,0.26238340857816,2025-04-24 21:21:06.180619,2025-04-24 21:21:11.528633,0 days 00:00:05.348014,15.943177785996403,Matern,13.844515442672872,0.7084378616579255,0.5,TPESampler,COMPLETE
696,0.2623835643633707,2025-04-24 21:21:07.716061,2025-04-24 21:21:17.375693,0 days 00:00:09.659632,0.006521441584107391,Matern,1130.659396296566,0.6650396612544012,0.5,TPESampler,COMPLETE
697,0.2825175754204083,2025-04-24 21:21:10.171356,2025-04-24 21:21:15.467137,0 days 00:00:05.295781,24.47657863755448,RBF,3.109668717352622,0.5737826837652776,1.5,TPESampler,COMPLETE
698,0.2623833776036684,2025-04-24 21:21:11.776171,2025-04-24 21:21:18.545211,0 days 00:00:06.769040,0.07589905731292894,Matern,47.67759839963104,0.011224266191981955,0.5,TPESampler,COMPLETE
699,0.2825176308271094,2025-04-24 21:21:15.719812,2025-04-24 21:21:23.450974,0 days 00:00:07.731162,35.90835518331298,RBF,859.5149128265346,0.5554640610588512,0.5,TPESampler,COMPLETE
700,0.9329374984019366,2025-04-24 21:21:17.836131,2025-04-24 21:21:23.533855,0 days 00:00:05.697724,0.17163304782353353,Matern,0.005361348772074194,0.1750319979475817,0.5,TPESampler,COMPLETE
701,0.9329374976952396,2025-04-24 21:21:18.856506,2025-04-24 21:21:24.775187,0 days 00:00:05.918681,0.06666008380603751,Matern,113.91237455834283,0.00019850266358209818,0.5,TPESampler,COMPLETE
702,0.2623834747096398,2025-04-24 21:21:23.632738,2025-04-24 21:21:32.360036,0 days 00:00:08.727298,0.08799966062095069,Matern,8.7796879784935,0.003237600090118154,0.5,TPESampler,COMPLETE
703,0.2623834872116744,2025-04-24 21:21:23.712705,2025-04-24 21:21:32.888129,0 days 00:00:09.175424,0.04260333406466357,Matern,2.456406615986227,0.0011321783555198037,0.5,TPESampler,COMPLETE
704,0.26238346055411316,2025-04-24 21:21:25.032254,2025-04-24 21:21:29.869096,0 days 00:00:04.836842,0.03750666612419025,Matern,12.9527356070416,0.10256673566248223,0.5,TPESampler,COMPLETE
705,0.2623834769738512,2025-04-24 21:21:30.094573,2025-04-24 21:21:37.788754,0 days 00:00:07.694181,159.12602446554095,Matern,0.27247739521269554,0.020451911599527396,0.5,TPESampler,COMPLETE
706,0.27375659936671143,2025-04-24 21:21:32.607242,2025-04-24 21:21:38.085515,0 days 00:00:05.478273,0.5920478969585574,Matern,0.6943683058693182,0.0011258902066086291,2.5,TPESampler,COMPLETE
707,0.9928350583919445,2025-04-24 21:21:33.129744,2025-04-24 21:21:37.100576,0 days 00:00:03.970832,1288.6740878904009,Matern,0.0066633640299383875,1.4285313095435246e-10,0.5,TPESampler,COMPLETE
708,0.2623834613412669,2025-04-24 21:21:37.349476,2025-04-24 21:21:44.103658,0 days 00:00:06.754182,0.20204502298816704,Matern,48.087911490617614,0.006620061470073198,0.5,TPESampler,COMPLETE
709,0.2623835010344164,2025-04-24 21:21:38.018566,2025-04-24 21:21:43.572803,0 days 00:00:05.554237,27.30740558747365,Matern,20.08341190018184,0.0002205225694226883,0.5,TPESampler,COMPLETE
710,0.9329374978109723,2025-04-24 21:21:38.344205,2025-04-24 21:21:45.357340,0 days 00:00:07.013135,0.00032243249129529545,RBF,3.209529174309994e-05,0.00037264476573739026,0.5,TPESampler,COMPLETE
711,0.2623835326499406,2025-04-24 21:21:43.826071,2025-04-24 21:21:48.818875,0 days 00:00:04.992804,1.229322116170212,Matern,58.76009539829002,0.0005367605593134323,0.5,TPESampler,COMPLETE
712,0.26238317506309905,2025-04-24 21:21:44.423220,2025-04-24 21:21:48.869596,0 days 00:00:04.446376,774.1258714018351,Matern,6.862398699294074,0.03438292711221573,0.5,TPESampler,COMPLETE
713,0.2623834390969303,2025-04-24 21:21:45.607143,2025-04-24 21:21:49.987491,0 days 00:00:04.380348,11.312363852879699,Matern,23.306613331275607,0.014884464348516271,0.5,TPESampler,COMPLETE
714,0.26238406202593534,2025-04-24 21:21:48.980090,2025-04-24 21:21:53.373573,0 days 00:00:04.393483,58.03529684973062,Matern,1.7729029646161818,0.004961389480132506,0.5,TPESampler,COMPLETE
715,0.2623834672115367,2025-04-24 21:21:49.046710,2025-04-24 21:21:53.777532,0 days 00:00:04.730822,2023.1011241566252,Matern,2.805012542786391,0.0002948914162495886,0.5,TPESampler,COMPLETE
716,0.26238346877573426,2025-04-24 21:21:50.210350,2025-04-24 21:21:55.456924,0 days 00:00:05.246574,318.28948737417574,Matern,5.255027819699726,0.05749920472065869,0.5,TPESampler,COMPLETE
717,0.2623834602451438,2025-04-24 21:21:53.606297,2025-04-24 21:21:58.735916,0 days 00:00:05.129619,14449.624262993395,Matern,7.993437240564008,0.024192750334351417,0.5,TPESampler,COMPLETE
718,0.26238352154868794,2025-04-24 21:21:53.971091,2025-04-24 21:21:58.899657,0 days 00:00:04.928566,239.24628556297583,Matern,1.3963019443731366,0.6232577223042556,0.5,TPESampler,COMPLETE
719,0.26238347015194713,2025-04-24 21:21:55.669768,2025-04-24 21:22:01.625696,0 days 00:00:05.955928,674.6585879649444,Matern,287.466450029645,0.010986503932105852,0.5,TPESampler,COMPLETE
720,0.2623834129741464,2025-04-24 21:21:58.902336,2025-04-24 21:22:04.108962,0 days 00:00:05.206626,953.0353932845672,Matern,7.774344489884817,0.014246817951586338,0.5,TPESampler,COMPLETE
721,0.2623834742758388,2025-04-24 21:21:59.128109,2025-04-24 21:22:05.518674,0 days 00:00:06.390565,649.4925914731041,Matern,33.123130181692375,0.013804263020556207,0.5,TPESampler,COMPLETE
722,0.9928350583678323,2025-04-24 21:22:01.873549,2025-04-24 21:22:05.398132,0 days 00:00:03.524583,1.8667211296407777,RBF,1.6352561347715997e-05,1.3163300473086833e-08,2.5,TPESampler,COMPLETE
723,0.262383516910595,2025-04-24 21:22:04.348944,2025-04-24 21:22:09.846872,0 days 00:00:05.497928,0.8405980400149677,Matern,0.6521561490516433,0.010742233147445405,0.5,TPESampler,COMPLETE
724,0.26238346726637546,2025-04-24 21:22:05.613662,2025-04-24 21:22:11.261701,0 days 00:00:05.648039,748.0661126650832,Matern,0.6314038471403893,0.024610684883744245,0.5,TPESampler,COMPLETE
725,0.2623834812146017,2025-04-24 21:22:05.722722,2025-04-24 21:22:10.660881,0 days 00:00:04.938159,78244.45547426761,Matern,11.753056388282525,0.09976882792303172,0.5,TPESampler,COMPLETE
726,0.26238347310697563,2025-04-24 21:22:10.108554,2025-04-24 21:22:15.370921,0 days 00:00:05.262367,170.41837765551188,Matern,3829.7887846835074,0.020955701514935074,0.5,TPESampler,COMPLETE
727,0.26238366521944967,2025-04-24 21:22:10.896215,2025-04-24 21:22:18.130695,0 days 00:00:07.234480,0.419211934446837,Matern,91.0294875246802,0.011004479230055833,0.5,TPESampler,COMPLETE
728,0.26238347491721625,2025-04-24 21:22:11.456907,2025-04-24 21:22:17.246477,0 days 00:00:05.789570,46.18982706967225,Matern,378.9196520522457,0.044428291928477096,0.5,TPESampler,COMPLETE
729,0.932937498036918,2025-04-24 21:22:15.620387,2025-04-24 21:22:23.126097,0 days 00:00:07.505710,519.2167546870015,Matern,0.011300481904730496,0.3061498110980463,0.5,TPESampler,COMPLETE
730,0.2623834733292924,2025-04-24 21:22:18.087611,2025-04-24 21:22:25.226124,0 days 00:00:07.138513,1679.9124647910094,Matern,30.590145264626916,0.6025662750237953,0.5,TPESampler,COMPLETE
731,0.2623834475159816,2025-04-24 21:22:18.664880,2025-04-24 21:22:27.111755,0 days 00:00:08.446875,0.1246261361294836,Matern,56.611547940446265,0.015163306700473195,0.5,TPESampler,COMPLETE
732,0.2623834497436037,2025-04-24 21:22:23.377234,2025-04-24 21:22:28.862158,0 days 00:00:05.484924,19.471295219379197,Matern,43.402509856069614,0.7144562668510707,0.5,TPESampler,COMPLETE
733,0.9329374967809015,2025-04-24 21:22:25.462095,2025-04-24 21:22:32.010093,0 days 00:00:06.547998,1.335701515421976,Matern,62935.61022894571,0.0005724612634958393,0.5,TPESampler,COMPLETE
734,0.26238343662729335,2025-04-24 21:22:27.366926,2025-04-24 21:22:31.746614,0 days 00:00:04.379688,1350.6031712361907,Matern,3.532424305122095,0.0026096352597008918,0.5,TPESampler,COMPLETE
735,0.2623834763619019,2025-04-24 21:22:29.098441,2025-04-24 21:22:37.649915,0 days 00:00:08.551474,11.951022494657552,Matern,0.10262066821045718,0.012224905284945289,0.5,TPESampler,COMPLETE
736,0.9329374984356562,2025-04-24 21:22:31.967866,2025-04-24 21:22:40.210537,0 days 00:00:08.242671,11852.013814775135,RBF,49007.954750474724,1.7791087954568656e-05,1.5,TPESampler,COMPLETE
737,0.2623834482541541,2025-04-24 21:22:32.269134,2025-04-24 21:22:37.389052,0 days 00:00:05.119918,0.34014232322974186,Matern,21.041237780840113,0.03469503779021122,0.5,TPESampler,COMPLETE
738,0.26238348528985556,2025-04-24 21:22:37.609704,2025-04-24 21:22:42.620637,0 days 00:00:05.010933,62.65062273089632,Matern,100.30962527209996,0.0017830376261003835,0.5,TPESampler,COMPLETE
739,0.26238352707290225,2025-04-24 21:22:37.902331,2025-04-24 21:22:42.298217,0 days 00:00:04.395886,0.12878727642561902,Matern,7.423806536510603,0.6854410045386687,0.5,TPESampler,COMPLETE
740,0.992836572933857,2025-04-24 21:22:40.452617,2025-04-24 21:22:46.309698,0 days 00:00:05.857081,1.9337260139597422e-07,RBF,2.938995589697644,0.029170723486054807,1.5,TPESampler,COMPLETE
741,0.2623834853906005,2025-04-24 21:22:42.530527,2025-04-24 21:22:47.188522,0 days 00:00:04.657995,13.89373231951558,Matern,973.8339290878382,0.015034367587150325,0.5,TPESampler,COMPLETE
742,0.9329374982339144,2025-04-24 21:22:42.896145,2025-04-24 21:22:49.261356,0 days 00:00:06.365211,1.8482714463859187,Matern,42660.468557217595,0.04200497589905086,0.5,TPESampler,COMPLETE
743,0.9928350583761977,2025-04-24 21:22:46.584754,2025-04-24 21:22:49.974081,0 days 00:00:03.389327,11.911119022949517,Matern,0.00040350419587273253,9.096391118330556e-10,1.5,TPESampler,COMPLETE
744,0.9329374977133611,2025-04-24 21:22:47.475451,2025-04-24 21:22:53.420089,0 days 00:00:05.944638,0.2942399227814523,Matern,3464.4893469366393,0.00020983852335417375,0.5,TPESampler,COMPLETE
745,0.9329374981058758,2025-04-24 21:22:49.509018,2025-04-24 21:22:56.904770,0 days 00:00:07.395752,14.887081373053725,RBF,4666.598211008783,0.00026699209270733554,0.5,TPESampler,COMPLETE
746,0.2623834764878745,2025-04-24 21:22:50.191545,2025-04-24 21:22:55.469146,0 days 00:00:05.277601,81.38354754139468,Matern,2.113738628079248,0.011138638236880022,0.5,TPESampler,COMPLETE
747,0.9329374978194632,2025-04-24 21:22:53.665697,2025-04-24 21:23:00.624017,0 days 00:00:06.958320,1.7947953104201362,Matern,1538.8176970425125,0.003701753504961164,2.5,TPESampler,COMPLETE
748,0.2623834780363295,2025-04-24 21:22:55.699926,2025-04-24 21:23:01.210687,0 days 00:00:05.510761,0.6078402844184847,Matern,848.7190784954896,0.6914645780303282,0.5,TPESampler,COMPLETE
749,0.9329374977522029,2025-04-24 21:22:57.122546,2025-04-24 21:23:02.203631,0 days 00:00:05.081085,49779.269518507135,Matern,0.000988111298283332,0.0027429541762472374,0.5,TPESampler,COMPLETE
750,0.2623834801534367,2025-04-24 21:23:00.869296,2025-04-24 21:23:06.651890,0 days 00:00:05.782594,9.798805689273317,Matern,7530.857852912634,0.07057495744795789,0.5,TPESampler,COMPLETE
751,0.26238344997104046,2025-04-24 21:23:01.552759,2025-04-24 21:23:06.696751,0 days 00:00:05.143992,1.425969446523855,Matern,14.447875788138488,0.05135633241667198,0.5,TPESampler,COMPLETE
752,0.9329374983881005,2025-04-24 21:23:02.404585,2025-04-24 21:23:07.564840,0 days 00:00:05.160255,0.21040360583790638,Matern,15.6032019065095,9.378825971560426e-08,2.5,TPESampler,COMPLETE
753,0.9329374980980207,2025-04-24 21:23:06.810124,2025-04-24 21:23:12.146676,0 days 00:00:05.336552,0.07446503877998327,Matern,0.0005317425370847791,5.937469566479084e-06,0.5,TPESampler,COMPLETE
754,0.2623833167408064,2025-04-24 21:23:06.854666,2025-04-24 21:23:11.275067,0 days 00:00:04.420401,31.342902402341327,Matern,48.7606764542463,0.44872989892344134,0.5,TPESampler,COMPLETE
755,0.26787475057385146,2025-04-24 21:23:08.011948,2025-04-24 21:23:12.505854,0 days 00:00:04.493906,7.889455344889519,Matern,0.2883422682760426,0.7211934614680202,1.5,TPESampler,COMPLETE
756,0.262383493997926,2025-04-24 21:23:11.520118,2025-04-24 21:23:19.262145,0 days 00:00:07.742027,819.9381702172755,Matern,0.11075505449822506,0.04545798852036064,0.5,TPESampler,COMPLETE
757,0.2623834738078404,2025-04-24 21:23:12.361635,2025-04-24 21:23:16.456544,0 days 00:00:04.094909,102.87089884460975,Matern,350.7056193923972,0.6629914905666662,0.5,TPESampler,COMPLETE
758,0.9329374969598982,2025-04-24 21:23:12.716231,2025-04-24 21:23:16.278781,0 days 00:00:03.562550,0.14486094957840834,Matern,5.5252863440664175,0.006805390462668049,1.5,TPESampler,COMPLETE
759,0.9329374968068538,2025-04-24 21:23:16.458759,2025-04-24 21:23:21.667094,0 days 00:00:05.208335,0.000300940147023759,Matern,11.278006149101282,0.00019618327877369998,0.5,TPESampler,COMPLETE
760,0.2623834747559261,2025-04-24 21:23:16.680610,2025-04-24 21:23:21.384345,0 days 00:00:04.703735,9.861334568611275,Matern,12.186263070908016,0.00036540800419489883,0.5,TPESampler,COMPLETE
761,0.26238347138289375,2025-04-24 21:23:19.510342,2025-04-24 21:23:24.751028,0 days 00:00:05.240686,1377.4494372461409,Matern,53.19160152304886,0.04089864335893744,0.5,TPESampler,COMPLETE
762,0.2825175403696628,2025-04-24 21:23:21.618243,2025-04-24 21:23:29.907587,0 days 00:00:08.289344,0.0013358848786703265,RBF,48499.18507844926,0.00038007786242218926,0.5,TPESampler,COMPLETE
763,0.2623834888491188,2025-04-24 21:23:21.930345,2025-04-24 21:23:26.087252,0 days 00:00:04.156907,435.64922804973696,Matern,6.845501053607072,0.49724121119332304,0.5,TPESampler,COMPLETE
764,0.26238340762862516,2025-04-24 21:23:25.008169,2025-04-24 21:23:32.231784,0 days 00:00:07.223615,344.5833420360479,Matern,0.13108139162329638,0.850577494613466,0.5,TPESampler,COMPLETE
765,0.2825175473671343,2025-04-24 21:23:26.359877,2025-04-24 21:23:31.591805,0 days 00:00:05.231928,21228.263527541825,RBF,9.311638268885591,0.002107861936425473,1.5,TPESampler,COMPLETE
766,0.9329374979014398,2025-04-24 21:23:30.184003,2025-04-24 21:23:34.967802,0 days 00:00:04.783799,25.0607394728054,Matern,40001.80707102047,0.01566476920839867,0.5,TPESampler,COMPLETE
767,0.26238344018098786,2025-04-24 21:23:31.839904,2025-04-24 21:23:36.292229,0 days 00:00:04.452325,60699.54713594257,Matern,8.263389108490871,0.00035989024609594253,0.5,TPESampler,COMPLETE
768,0.26238345777363103,2025-04-24 21:23:32.483926,2025-04-24 21:23:37.776582,0 days 00:00:05.292656,66.18542007910753,Matern,38.87826533711736,0.057387516591928554,0.5,TPESampler,COMPLETE
769,0.9329374953506022,2025-04-24 21:23:35.206170,2025-04-24 21:23:44.987028,0 days 00:00:09.780858,0.03213512296938358,Matern,41636.192746804176,0.014637953918400165,0.5,TPESampler,COMPLETE
770,0.26238349797619503,2025-04-24 21:23:36.540492,2025-04-24 21:23:42.076992,0 days 00:00:05.536500,296.3825130183492,Matern,8.4660651484139,0.011502890400981076,0.5,TPESampler,COMPLETE
771,0.262383477780731,2025-04-24 21:23:38.020544,2025-04-24 21:23:42.333817,0 days 00:00:04.313273,84.79729213715828,Matern,163.19504769052196,0.03540248266708516,0.5,TPESampler,COMPLETE
772,0.2623834780477418,2025-04-24 21:23:42.301254,2025-04-24 21:23:49.277824,0 days 00:00:06.976570,0.8008650329141557,Matern,25827.915679190133,0.8239472468144818,0.5,TPESampler,COMPLETE
773,0.9928365740406176,2025-04-24 21:23:42.509188,2025-04-24 21:23:47.116891,0 days 00:00:04.607703,0.008660019375142313,Matern,9073.88818356891,0.6786614140610174,2.5,TPESampler,COMPLETE
774,0.9928365740214058,2025-04-24 21:23:45.223155,2025-04-24 21:23:49.348911,0 days 00:00:04.125756,48.07888246617225,RBF,48771.187697515794,0.9350793449405679,0.5,TPESampler,COMPLETE
775,0.2623834756664713,2025-04-24 21:23:47.357000,2025-04-24 21:23:53.157226,0 days 00:00:05.800226,0.3815746430934389,Matern,96.3190206059,0.004780510094894291,0.5,TPESampler,COMPLETE
776,0.2623834760985825,2025-04-24 21:23:49.434517,2025-04-24 21:23:54.785342,0 days 00:00:05.350825,0.7905737549615565,Matern,863.7960662528045,0.024624075756945363,0.5,TPESampler,COMPLETE
777,0.9329374977715376,2025-04-24 21:23:49.477834,2025-04-24 21:23:56.567284,0 days 00:00:07.089450,7.477370453589837,Matern,25902.861154758142,4.839776008495325e-07,1.5,TPESampler,COMPLETE
778,0.26238347460330624,2025-04-24 21:23:53.405196,2025-04-24 21:23:58.447192,0 days 00:00:05.041996,13407.847229537761,Matern,286.48297330492943,0.35646691405959147,0.5,TPESampler,COMPLETE
779,0.26238349447388576,2025-04-24 21:23:55.027239,2025-04-24 21:24:00.287873,0 days 00:00:05.260634,3921.5627668246575,Matern,0.3620743968593902,0.0264872650923612,0.5,TPESampler,COMPLETE
780,0.27375659013982423,2025-04-24 21:23:56.821754,2025-04-24 21:24:02.958742,0 days 00:00:06.136988,4.665131834180804,Matern,432.01625059908645,0.6629632249702666,2.5,TPESampler,COMPLETE
781,0.26238351005540633,2025-04-24 21:23:58.674995,2025-04-24 21:24:03.630214,0 days 00:00:04.955219,21.480635267113534,Matern,3.594435256434475,0.04022819518726057,0.5,TPESampler,COMPLETE
782,0.2623834923887207,2025-04-24 21:24:00.526942,2025-04-24 21:24:05.647260,0 days 00:00:05.120318,41.131243238659,Matern,83182.70500292115,0.1997080150789889,0.5,TPESampler,COMPLETE
783,0.26238347490031116,2025-04-24 21:24:03.214091,2025-04-24 21:24:08.308237,0 days 00:00:05.094146,106.23546722348223,Matern,463.2010495838186,0.9006698848587924,0.5,TPESampler,COMPLETE
784,0.26238340861516357,2025-04-24 21:24:03.864652,2025-04-24 21:24:09.030637,0 days 00:00:05.165985,8.346898920880392,Matern,952.410444723085,0.9232864177462404,0.5,TPESampler,COMPLETE
785,0.9329374977133987,2025-04-24 21:24:05.899335,2025-04-24 21:24:12.766290,0 days 00:00:06.866955,0.056389721654701914,Matern,81.74605505167655,0.01991395622293532,0.5,TPESampler,COMPLETE
786,0.2623834894959027,2025-04-24 21:24:08.553786,2025-04-24 21:24:17.393415,0 days 00:00:08.839629,2.5534132796939963,Matern,0.11738555144396409,0.8347146591601425,0.5,TPESampler,COMPLETE
787,0.26238347706264165,2025-04-24 21:24:09.258680,2025-04-24 21:24:14.051234,0 days 00:00:04.792554,17.17276609476842,Matern,40.32552212681745,0.001313399047274278,0.5,TPESampler,COMPLETE
788,0.2815743763487024,2025-04-24 21:24:13.020290,2025-04-24 21:24:21.133112,0 days 00:00:08.112822,0.03860068347367527,RBF,0.1923173245723849,2.965708356214106e-05,1.5,TPESampler,COMPLETE
789,0.9329374977645851,2025-04-24 21:24:14.483272,2025-04-24 21:24:24.748789,0 days 00:00:10.265517,0.07485548537502933,Matern,9165.08139146484,0.018411335387987407,0.5,TPESampler,COMPLETE
790,0.26238345172270044,2025-04-24 21:24:17.835071,2025-04-24 21:24:22.633404,0 days 00:00:04.798333,0.44351176187322555,Matern,0.2249965170657395,7.59069554080009e-05,0.5,TPESampler,COMPLETE
791,0.262383478151214,2025-04-24 21:24:21.389111,2025-04-24 21:24:25.863979,0 days 00:00:04.474868,12.620928668150741,Matern,5.364386395171199,0.015878597657555057,0.5,TPESampler,COMPLETE
792,0.2623834740957336,2025-04-24 21:24:22.876544,2025-04-24 21:24:30.819024,0 days 00:00:07.942480,0.3682819222464672,Matern,5534.160662049626,0.864958527584726,0.5,TPESampler,COMPLETE
793,0.26238347584738503,2025-04-24 21:24:25.001169,2025-04-24 21:24:30.596399,0 days 00:00:05.595230,46329.99839420434,Matern,7.228387819346226,0.044270031503802536,0.5,TPESampler,COMPLETE
794,0.9329374965527105,2025-04-24 21:24:26.112239,2025-04-24 21:24:33.970482,0 days 00:00:07.858243,5.651201510924878e-07,Matern,0.040918853435944674,1.1810751515165593e-09,2.5,TPESampler,COMPLETE
795,0.9329374970021007,2025-04-24 21:24:30.868624,2025-04-24 21:24:35.945794,0 days 00:00:05.077170,92412.38261521021,Matern,0.034867783939880825,0.04593506052808981,0.5,TPESampler,COMPLETE
796,0.2623834749640111,2025-04-24 21:24:31.111211,2025-04-24 21:24:37.478059,0 days 00:00:06.366848,1.027754778753866,Matern,97.19111738478654,0.01929977603806878,0.5,TPESampler,COMPLETE
797,0.9329374977095676,2025-04-24 21:24:34.213807,2025-04-24 21:24:36.796055,0 days 00:00:02.582248,0.5122567805612761,RBF,0.042970572123514364,0.005146060620436914,2.5,TPESampler,COMPLETE
798,0.26238348097707986,2025-04-24 21:24:36.193905,2025-04-24 21:24:40.806797,0 days 00:00:04.612892,24.639725386049562,Matern,985.2026753338095,0.04212797814534663,0.5,TPESampler,COMPLETE
799,0.26238347132906265,2025-04-24 21:24:37.038217,2025-04-24 21:24:41.566824,0 days 00:00:04.528607,2781.5867227432923,Matern,82.05146025587283,0.00018511096110852775,0.5,TPESampler,COMPLETE
800,0.28251756395346594,2025-04-24 21:24:37.683334,2025-04-24 21:24:43.710521,0 days 00:00:06.027187,52024.106450419094,RBF,329.01553295803103,0.34164511288705335,0.5,TPESampler,COMPLETE
801,0.26238346632473053,2025-04-24 21:24:41.058273,2025-04-24 21:24:45.502196,0 days 00:00:04.443923,18.480636618706196,Matern,1.5395173552573,0.7410483529740794,0.5,TPESampler,COMPLETE
802,0.2623834737437237,2025-04-24 21:24:41.831146,2025-04-24 21:24:47.381416,0 days 00:00:05.550270,0.008563342003464595,Matern,1.365307672215697,0.011203469429315828,0.5,TPESampler,COMPLETE
