number,value,datetime_start,datetime_complete,duration,params_constant_value,params_kernel_type,params_length_scale,params_noise_level,params_nu,system_attrs_auto:sampler,state
918,0.26238350275498995,2025-04-24 21:28:28.468935,2025-04-24 21:28:33.409118,0 days 00:00:04.940183,2.8462313405396586,Matern,12.643051809030478,0.8718830198353836,0.5,TPESampler,COMPLETE
919,0.2623834750625173,2025-04-24 21:28:29.234929,2025-04-24 21:28:34.598352,0 days 00:00:05.363423,0.25660465157785084,Matern,205.6187631861122,0.8464989167181523,0.5,TPESampler,COMPLETE
920,0.2623834233596299,2025-04-24 21:28:30.309746,2025-04-24 21:28:37.350079,0 days 00:00:07.040333,0.03729627552023203,Matern,724.6199470612845,0.860837740772491,0.5,TPESampler,COMPLETE
921,0.26238347083533975,2025-04-24 21:28:33.664610,2025-04-24 21:28:39.149194,0 days 00:00:05.484584,1.6817268813042257,Matern,10315.325697229853,0.5232504528075312,0.5,TPESampler,COMPLETE
922,0.9329374983121222,2025-04-24 21:28:34.895055,2025-04-24 21:28:42.044336,0 days 00:00:07.149281,0.5579584541333532,Matern,53789.41888029859,0.015704462865868296,0.5,TPESampler,COMPLETE
923,0.9928365146658293,2025-04-24 21:28:37.621228,2025-04-24 21:28:43.189246,0 days 00:00:05.568018,0.006156455278884441,Matern,44062.57395293172,0.6666580814451932,0.5,TPESampler,COMPLETE
924,0.9329374978042619,2025-04-24 21:28:39.403341,2025-04-24 21:28:45.308561,0 days 00:00:05.905220,4.998833837065296,Matern,62470.04575703727,0.02571243109910369,0.5,TPESampler,COMPLETE
925,0.262383439615535,2025-04-24 21:28:42.276897,2025-04-24 21:28:49.560684,0 days 00:00:07.283787,0.23115377802291534,Matern,16389.139352666836,0.9200647132445812,0.5,TPESampler,COMPLETE
926,0.26238347274644525,2025-04-24 21:28:43.445388,2025-04-24 21:28:49.485287,0 days 00:00:06.039899,48.8322917543069,Matern,86023.14176082022,0.06231633698583106,0.5,TPESampler,COMPLETE
927,0.26238347010744845,2025-04-24 21:28:45.570592,2025-04-24 21:28:50.407320,0 days 00:00:04.836728,7.3397339622302145,Matern,73.93915560806116,0.5760664185233823,0.5,TPESampler,COMPLETE
928,0.26238344224406235,2025-04-24 21:28:49.647050,2025-04-24 21:28:56.951502,0 days 00:00:07.304452,1.9016791888268758,Matern,39305.32119224801,0.7104651803071647,0.5,TPESampler,COMPLETE
929,0.26238347120076944,2025-04-24 21:28:49.750496,2025-04-24 21:28:58.175537,0 days 00:00:08.425041,0.4475931241125382,Matern,55329.930788731894,0.6259461890291647,0.5,TPESampler,COMPLETE
930,0.2623835126769198,2025-04-24 21:28:50.640425,2025-04-24 21:28:56.429248,0 days 00:00:05.788823,0.026611565456960355,Matern,67.2510731286442,0.5960886096907848,0.5,TPESampler,COMPLETE
931,0.26238339971221636,2025-04-24 21:28:56.717573,2025-04-24 21:29:01.647171,0 days 00:00:04.929598,1.5083208240364614,Matern,363.8398430198883,0.17459374162275523,0.5,TPESampler,COMPLETE
932,0.27375661379797056,2025-04-24 21:28:57.209968,2025-04-24 21:29:04.749910,0 days 00:00:07.539942,39597.85557847923,Matern,3.542971190931005,0.22417900373226934,2.5,TPESampler,COMPLETE
933,0.2623834745724294,2025-04-24 21:28:58.433613,2025-04-24 21:29:03.944721,0 days 00:00:05.511108,0.5441623661496793,Matern,0.448739178581283,0.6743174155113594,0.5,TPESampler,COMPLETE
934,0.2623834441038976,2025-04-24 21:29:01.894797,2025-04-24 21:29:06.125233,0 days 00:00:04.230436,966.6814254314538,Matern,26.11454407854499,0.6402462490148721,0.5,TPESampler,COMPLETE
935,0.9329374977371625,2025-04-24 21:29:04.195612,2025-04-24 21:29:07.568941,0 days 00:00:03.373329,3020.11733873037,RBF,0.003895542121495191,0.8750229882943996,1.5,TPESampler,COMPLETE
936,0.2623835477532493,2025-04-24 21:29:05.001445,2025-04-24 21:29:09.241441,0 days 00:00:04.239996,5.763442667169023,Matern,186.25417594344063,0.6672263947270338,0.5,TPESampler,COMPLETE
937,0.9329374977474052,2025-04-24 21:29:06.379670,2025-04-24 21:29:12.308903,0 days 00:00:05.929233,5.952195752816204,RBF,48692.72493022118,0.006028976962293949,2.5,TPESampler,COMPLETE
938,0.932937497745748,2025-04-24 21:29:07.838524,2025-04-24 21:29:16.779217,0 days 00:00:08.940693,0.009638880297929475,Matern,276.5331368229792,0.026072503830196277,0.5,TPESampler,COMPLETE
939,0.9329374971208944,2025-04-24 21:29:09.568314,2025-04-24 21:29:16.825670,0 days 00:00:07.257356,3.961752287504975e-05,Matern,1.1029607532246869e-05,0.011559456538785042,1.5,TPESampler,COMPLETE
940,0.9928365741152712,2025-04-24 21:29:12.546143,2025-04-24 21:29:17.094313,0 days 00:00:04.548170,0.051025236121509505,Matern,56002.634847887595,0.7997219075511698,2.5,TPESampler,COMPLETE
941,0.9329374977179138,2025-04-24 21:29:16.935320,2025-04-24 21:29:26.512196,0 days 00:00:09.576876,0.004744982774340651,Matern,96803.03506949832,0.005054271744311021,0.5,TPESampler,COMPLETE
942,0.26238355076801956,2025-04-24 21:29:17.066487,2025-04-24 21:29:22.011975,0 days 00:00:04.945488,7.374689376857053,Matern,90.88882091026262,0.8801055343107927,0.5,TPESampler,COMPLETE
943,0.2623834681241095,2025-04-24 21:29:17.321221,2025-04-24 21:29:21.864963,0 days 00:00:04.543742,1.2373359433532904,Matern,307.34773143603485,0.033316750294895475,0.5,TPESampler,COMPLETE
944,0.9329374977464684,2025-04-24 21:29:22.059868,2025-04-24 21:29:27.521029,0 days 00:00:05.461161,219.56469652297483,RBF,202.33345916795352,0.002031924465535339,0.5,TPESampler,COMPLETE
945,0.26238347464204775,2025-04-24 21:29:22.242928,2025-04-24 21:29:27.799514,0 days 00:00:05.556586,99540.31424371847,Matern,332.9836303541277,0.3331372057425713,0.5,TPESampler,COMPLETE
946,0.9329374977666761,2025-04-24 21:29:26.751626,2025-04-24 21:29:35.783608,0 days 00:00:09.031982,0.03399955823908707,Matern,2646.6595902914696,0.013958141674486576,0.5,TPESampler,COMPLETE
947,0.9928365129709097,2025-04-24 21:29:27.756956,2025-04-24 21:29:32.142326,0 days 00:00:04.385370,0.02695039559376424,Matern,78618.5960542106,0.4156721929022155,0.5,TPESampler,COMPLETE
948,0.26238347614414276,2025-04-24 21:29:28.075398,2025-04-24 21:29:32.512804,0 days 00:00:04.437406,92.25169676951568,Matern,2414.344189543681,0.18386195174290113,0.5,TPESampler,COMPLETE
949,0.2623834672424589,2025-04-24 21:29:32.397141,2025-04-24 21:29:36.761236,0 days 00:00:04.364095,9.693356679433103,Matern,17.23726247435422,0.8417617286433657,0.5,TPESampler,COMPLETE
950,0.9928365741167686,2025-04-24 21:29:32.720439,2025-04-24 21:29:37.890924,0 days 00:00:05.170485,0.0910498775440789,RBF,93136.15308780923,0.013017154799416883,0.5,TPESampler,COMPLETE
951,0.2623834805355069,2025-04-24 21:29:36.030988,2025-04-24 21:29:41.054594,0 days 00:00:05.023606,0.09076781536890119,Matern,43.71472549256976,0.6428634211990406,0.5,TPESampler,COMPLETE
952,0.9329374974963895,2025-04-24 21:29:37.025297,2025-04-24 21:29:42.698562,0 days 00:00:05.673265,0.17482548273248133,Matern,383.2940576989476,0.019855040337835684,0.5,TPESampler,COMPLETE
953,0.2623834656999611,2025-04-24 21:29:38.104228,2025-04-24 21:29:44.866153,0 days 00:00:06.761925,216.855694520724,Matern,90529.42438925739,0.3930931227110294,0.5,TPESampler,COMPLETE
954,0.9329374859665561,2025-04-24 21:29:41.295613,2025-04-24 21:29:49.376450,0 days 00:00:08.080837,0.001561019958012451,Matern,0.08265975260600451,0.03235741022649837,1.5,TPESampler,COMPLETE
955,0.26238350248921605,2025-04-24 21:29:42.927126,2025-04-24 21:29:47.459822,0 days 00:00:04.532696,325.57931031074173,Matern,517.8882678965251,0.018417528694177808,0.5,TPESampler,COMPLETE
956,0.9329374984674683,2025-04-24 21:29:45.099318,2025-04-24 21:29:54.562469,0 days 00:00:09.463151,0.0003888735761715309,Matern,506.48407768367525,0.05488316995088745,0.5,TPESampler,COMPLETE
957,0.2623834779878236,2025-04-24 21:29:47.694039,2025-04-24 21:29:53.847006,0 days 00:00:06.152967,0.022378546393197682,Matern,578.8004551823823,0.8496220401406922,0.5,TPESampler,COMPLETE
958,0.26238351635355,2025-04-24 21:29:49.602348,2025-04-24 21:29:54.347838,0 days 00:00:04.745490,85.08307616660122,Matern,1301.7201610761067,0.1711022913713345,0.5,TPESampler,COMPLETE
959,0.2670217219037364,2025-04-24 21:29:54.103769,2025-04-24 21:29:58.831682,0 days 00:00:04.727913,0.011112180574810428,Matern,0.8357107838128986,0.5237954567535316,0.5,TPESampler,COMPLETE
960,0.9928350583773079,2025-04-24 21:29:54.556904,2025-04-24 21:29:58.745358,0 days 00:00:04.188454,17.73397270675209,RBF,0.07948132777503417,1.1132879957924245e-07,1.5,TPESampler,COMPLETE
961,0.2623834745433169,2025-04-24 21:29:54.747445,2025-04-24 21:30:01.320549,0 days 00:00:06.573104,28.74742772107147,Matern,360.78710634481575,0.9762963266600289,0.5,TPESampler,COMPLETE
962,0.932937497746257,2025-04-24 21:29:58.906243,2025-04-24 21:30:06.057902,0 days 00:00:07.151659,0.4228003260223468,Matern,3947.872671979732,0.002514596678496238,0.5,TPESampler,COMPLETE
963,0.932937497901398,2025-04-24 21:29:59.047387,2025-04-24 21:30:02.262812,0 days 00:00:03.215425,560.3434330082733,Matern,9.268149249821267e-05,0.06902928163497178,1.5,TPESampler,COMPLETE
964,0.9329374975956156,2025-04-24 21:30:01.569121,2025-04-24 21:30:08.065074,0 days 00:00:06.495953,0.563239262673086,Matern,3084.2019269935477,0.011912002097742886,0.5,TPESampler,COMPLETE
965,0.9329374977497843,2025-04-24 21:30:02.505411,2025-04-24 21:30:09.782639,0 days 00:00:07.277228,0.9161668389327972,Matern,7257.803854806621,1.3256730195961332e-07,2.5,TPESampler,COMPLETE
966,0.26238347122276295,2025-04-24 21:30:06.320828,2025-04-24 21:30:11.796099,0 days 00:00:05.475271,83.19231025468696,Matern,2091.0428183076588,0.0005599256947863418,0.5,TPESampler,COMPLETE
967,0.2623834689675725,2025-04-24 21:30:08.277278,2025-04-24 21:30:13.813323,0 days 00:00:05.536045,14.616448795867852,Matern,3.3628580958923604,0.9918595322223319,0.5,TPESampler,COMPLETE
968,0.2623834447227646,2025-04-24 21:30:09.992331,2025-04-24 21:30:15.515483,0 days 00:00:05.523152,0.299991356782463,Matern,290.9798694161164,0.5266397255998719,0.5,TPESampler,COMPLETE
969,0.2623834753156153,2025-04-24 21:30:12.077558,2025-04-24 21:30:17.849090,0 days 00:00:05.771532,1.1250283934004797,Matern,13675.45157608746,0.680409626955238,0.5,TPESampler,COMPLETE
970,0.9329374974251489,2025-04-24 21:30:14.066576,2025-04-24 21:30:25.625079,0 days 00:00:11.558503,0.01603129470441263,Matern,3463.898743834957,0.03784600737627981,0.5,TPESampler,COMPLETE
971,0.2623834768402302,2025-04-24 21:30:15.763903,2025-04-24 21:30:21.016296,0 days 00:00:05.252393,4.804553690841795,Matern,2430.148880852917,0.04220805777226737,0.5,TPESampler,COMPLETE
972,0.26238341228786627,2025-04-24 21:30:18.118784,2025-04-24 21:30:23.563512,0 days 00:00:05.444728,1.8502396098382614,Matern,417.575506232796,0.5729947648608645,0.5,TPESampler,COMPLETE
973,0.932937497776673,2025-04-24 21:30:21.267627,2025-04-24 21:30:25.582750,0 days 00:00:04.315123,59.47895755856058,Matern,0.019552545620941365,0.2827831095226736,0.5,TPESampler,COMPLETE
974,0.9329374977456725,2025-04-24 21:30:24.029571,2025-04-24 21:30:33.829419,0 days 00:00:09.799848,0.004701732640180543,Matern,57.4872624811883,0.016944768033719762,0.5,TPESampler,COMPLETE
975,0.9928364717961992,2025-04-24 21:30:25.767504,2025-04-24 21:30:29.216652,0 days 00:00:03.449148,0.030550874435683217,Matern,71607.45385531826,0.9610072808370386,0.5,TPESampler,COMPLETE
976,0.26238347457179206,2025-04-24 21:30:25.808441,2025-04-24 21:30:32.184281,0 days 00:00:06.375840,1.3338684479484302,Matern,2658.2067384084007,0.5952327638910507,0.5,TPESampler,COMPLETE
977,0.9928359659977068,2025-04-24 21:30:29.473466,2025-04-24 21:30:33.958747,0 days 00:00:04.485281,0.3863137070573768,RBF,2976.8328957557114,0.6534011878195364,0.5,TPESampler,COMPLETE
978,0.2623833955963429,2025-04-24 21:30:32.403702,2025-04-24 21:30:37.499289,0 days 00:00:05.095587,8.347030398828895,Matern,21.10983463523137,0.7961620905184794,0.5,TPESampler,COMPLETE
979,0.26238347737941753,2025-04-24 21:30:34.049974,2025-04-24 21:30:38.727045,0 days 00:00:04.677071,2682.226474699254,Matern,685.9124658954194,0.510552134141035,0.5,TPESampler,COMPLETE
980,0.2678747541495837,2025-04-24 21:30:34.238023,2025-04-24 21:30:38.794996,0 days 00:00:04.556973,9.91323549382963,Matern,6.523930653213402,0.02297111096966937,1.5,TPESampler,COMPLETE
981,0.9329374976067855,2025-04-24 21:30:37.761236,2025-04-24 21:30:45.409288,0 days 00:00:07.648052,0.014330966296250426,Matern,20.672155457995927,0.013570626258485813,0.5,TPESampler,COMPLETE
982,0.9329374977277115,2025-04-24 21:30:38.912193,2025-04-24 21:30:46.487654,0 days 00:00:07.575461,0.00041663210705273317,RBF,54579.75891077323,7.423286844948176e-10,2.5,TPESampler,COMPLETE
983,0.9329374977471833,2025-04-24 21:30:38.975913,2025-04-24 21:30:46.316513,0 days 00:00:07.340600,1.7341157412216934,RBF,93536.64200333589,9.948520769190698e-08,0.5,TPESampler,COMPLETE
984,0.26238343344145726,2025-04-24 21:30:45.679143,2025-04-24 21:30:50.434720,0 days 00:00:04.755577,1.8517632349953541,Matern,80.24546775317819,0.01877618687441064,0.5,TPESampler,COMPLETE
985,0.2623834751263881,2025-04-24 21:30:46.490292,2025-04-24 21:30:51.132633,0 days 00:00:04.642341,1575.5383705113882,Matern,3.1902787203134717,0.9469429133752582,0.5,TPESampler,COMPLETE
986,0.26238347525794825,2025-04-24 21:30:46.689890,2025-04-24 21:30:51.521977,0 days 00:00:04.832087,1.5940868335969285,Matern,16463.57350923178,0.9518126133456147,0.5,TPESampler,COMPLETE
987,0.9329374975002895,2025-04-24 21:30:50.649980,2025-04-24 21:30:57.101664,0 days 00:00:06.451684,0.1115698920112212,Matern,5339.171964840763,0.012605539919528688,0.5,TPESampler,COMPLETE
988,0.2623834520736773,2025-04-24 21:30:51.395502,2025-04-24 21:30:56.421743,0 days 00:00:05.026241,855.9065398442461,Matern,2774.4036223510275,0.991665188884097,0.5,TPESampler,COMPLETE
989,0.26238347481702556,2025-04-24 21:30:51.721778,2025-04-24 21:30:56.379960,0 days 00:00:04.658182,0.1007785588196259,Matern,14.083465515431802,0.6443282980213836,0.5,TPESampler,COMPLETE
990,0.2623834764692391,2025-04-24 21:30:56.513908,2025-04-24 21:31:01.349458,0 days 00:00:04.835550,0.0732136803810009,Matern,18.87589268066107,0.936011691254133,0.5,TPESampler,COMPLETE
991,0.26238341741529936,2025-04-24 21:30:56.620459,2025-04-24 21:31:01.414740,0 days 00:00:04.794281,605.1699048677946,Matern,1227.1435016975445,0.004142501159702821,0.5,TPESampler,COMPLETE
992,0.2623833946953786,2025-04-24 21:30:57.314653,2025-04-24 21:31:02.778172,0 days 00:00:05.463519,3.285026818545152,Matern,747.8492987433084,0.020476178125020564,0.5,TPESampler,COMPLETE
993,0.26238346483512837,2025-04-24 21:31:01.507667,2025-04-24 21:31:08.136747,0 days 00:00:06.629080,434.72923559913636,Matern,0.16705836691197248,0.34098249358909793,0.5,TPESampler,COMPLETE
994,0.26787467447813623,2025-04-24 21:31:01.564655,2025-04-24 21:31:15.982694,0 days 00:00:14.418039,10525.26509128555,Matern,0.3467335476665174,1.8298305500452645e-10,1.5,TPESampler,COMPLETE
995,0.9329374977803829,2025-04-24 21:31:03.004041,2025-04-24 21:31:11.637179,0 days 00:00:08.633138,0.3569068875595058,Matern,99216.05286884357,0.04480036701314865,0.5,TPESampler,COMPLETE
996,0.2678747515614722,2025-04-24 21:31:08.349930,2025-04-24 21:31:15.314422,0 days 00:00:06.964492,19.887009856179628,Matern,604.2204834231488,0.7989976950392914,1.5,TPESampler,COMPLETE
997,0.2623833936760529,2025-04-24 21:31:11.889288,2025-04-24 21:31:19.572173,0 days 00:00:07.682885,0.01690053870938406,Matern,9196.30994680292,0.9699931109071254,0.5,TPESampler,COMPLETE
998,0.932937497743057,2025-04-24 21:31:15.569518,2025-04-24 21:31:19.015889,0 days 00:00:03.446371,1.5859199507387434,Matern,1345.4620944224043,0.0007073270990081095,0.5,TPESampler,COMPLETE
999,0.9329374989169693,2025-04-24 21:31:16.177188,2025-04-24 21:31:22.980690,0 days 00:00:06.803502,43.85848196185247,RBF,48177.145804692685,0.01121602041457952,0.5,TPESampler,COMPLETE
1000,0.26238357441127397,2025-04-24 21:31:19.339421,2025-04-24 21:31:24.104093,0 days 00:00:04.764672,0.8374992726771178,Matern,1991.6298272806282,0.02867689239670635,0.5,TPESampler,COMPLETE
1001,0.26238347525497924,2025-04-24 21:31:19.775943,2025-04-24 21:31:25.586694,0 days 00:00:05.810751,0.3408904572555579,Matern,584.114032164381,0.9231838881992348,0.5,TPESampler,COMPLETE
1002,0.26238347484166147,2025-04-24 21:31:23.223266,2025-04-24 21:31:27.968925,0 days 00:00:04.745659,94.57585663124993,Matern,329.33973132270154,0.01622653373114949,0.5,TPESampler,COMPLETE
1003,0.26238351108490154,2025-04-24 21:31:24.387469,2025-04-24 21:31:28.568374,0 days 00:00:04.180905,13.023151642017405,Matern,4606.919735869837,0.7234030063756531,0.5,TPESampler,COMPLETE
1004,0.9329374965527105,2025-04-24 21:31:25.818976,2025-04-24 21:31:31.139549,0 days 00:00:05.320573,2.4595467486187325e-07,Matern,0.00040544528393413314,3.5841644457010794e-09,0.5,TPESampler,COMPLETE
1005,0.26238347460205463,2025-04-24 21:31:28.206200,2025-04-24 21:31:39.625095,0 days 00:00:11.418895,0.00016622976352322503,Matern,380.1984957116573,0.5312571721087781,0.5,TPESampler,COMPLETE
1006,0.26238347277442986,2025-04-24 21:31:28.834222,2025-04-24 21:31:33.276582,0 days 00:00:04.442360,23.323881243980402,Matern,6.821941241728531,0.6643270991201711,0.5,TPESampler,COMPLETE
1007,0.26787475991996307,2025-04-24 21:31:31.611160,2025-04-24 21:31:40.124405,0 days 00:00:08.513245,0.3105229859688341,Matern,0.659969601940591,2.4421823137089303e-08,1.5,TPESampler,COMPLETE
1008,0.9329374977935,2025-04-24 21:31:34.224966,2025-04-24 21:31:44.095072,0 days 00:00:09.870106,3.250475117951727e-05,RBF,70.84443343812636,0.00043029385680666793,2.5,TPESampler,COMPLETE
1009,0.932937497754173,2025-04-24 21:31:39.864481,2025-04-24 21:31:44.156248,0 days 00:00:04.291767,0.5177697200428236,Matern,0.004456204722192852,0.7543742805389513,2.5,TPESampler,COMPLETE
1010,0.27375660078932057,2025-04-24 21:31:40.340840,2025-04-24 21:31:46.529606,0 days 00:00:06.188766,180.09950132971727,Matern,7018.340958185985,0.738388102944943,2.5,TPESampler,COMPLETE
1011,0.9329374978043298,2025-04-24 21:31:44.278972,2025-04-24 21:31:52.359577,0 days 00:00:08.080605,0.0016032120919156167,Matern,133.8950094838372,0.00016173875053166476,2.5,TPESampler,COMPLETE
1012,0.9329374981977552,2025-04-24 21:31:44.419578,2025-04-24 21:31:48.434144,0 days 00:00:04.014566,5858.22842280018,Matern,0.028289220509235977,0.8954788222586934,0.5,TPESampler,COMPLETE
1013,0.9329374977627868,2025-04-24 21:31:46.860705,2025-04-24 21:31:50.558394,0 days 00:00:03.697689,33216.75345147726,Matern,0.003458241598393849,0.1593109979076375,1.5,TPESampler,COMPLETE
1014,0.27375661993544925,2025-04-24 21:31:48.695046,2025-04-24 21:31:53.216805,0 days 00:00:04.521759,1.6385393781870286,Matern,16.92505113007122,0.17118449797992127,2.5,TPESampler,COMPLETE
1015,0.26238348937238726,2025-04-24 21:31:50.812894,2025-04-24 21:31:56.265294,0 days 00:00:05.452400,0.3834979568263973,Matern,87.28710070358865,0.00919165027203464,0.5,TPESampler,COMPLETE
1016,0.2623834746525535,2025-04-24 21:31:52.657976,2025-04-24 21:31:56.987295,0 days 00:00:04.329319,26.63525997454805,Matern,4426.331420278475,0.030012562231811063,0.5,TPESampler,COMPLETE
1017,0.26238284337898493,2025-04-24 21:31:53.475159,2025-04-24 21:31:59.001897,0 days 00:00:05.526738,92.32846616202032,Matern,94099.44087489344,0.05027597292259344,0.5,TPESampler,COMPLETE
1018,0.9329374975529334,2025-04-24 21:31:56.503470,2025-04-24 21:32:04.649234,0 days 00:00:08.145764,0.01743103604374322,Matern,0.03215667642303004,0.9339007781056881,0.5,TPESampler,COMPLETE
1019,0.2623834985971627,2025-04-24 21:31:57.191227,2025-04-24 21:32:03.376520,0 days 00:00:06.185293,50671.67162789545,Matern,28.1673675075549,0.01892124382894788,0.5,TPESampler,COMPLETE
1020,0.2623834751444924,2025-04-24 21:31:59.303452,2025-04-24 21:32:05.054513,0 days 00:00:05.751061,890.4954800735095,Matern,12585.944688376661,0.38008242850434903,0.5,TPESampler,COMPLETE
1021,0.26787474891978197,2025-04-24 21:32:03.698136,2025-04-24 21:32:09.146489,0 days 00:00:05.448353,68270.21910438973,Matern,56911.98715428679,0.1201143447140308,1.5,TPESampler,COMPLETE
1022,0.26238343764599237,2025-04-24 21:32:04.889995,2025-04-24 21:32:09.796090,0 days 00:00:04.906095,9.597781872193115,Matern,20105.38805384298,0.04831954483841739,0.5,TPESampler,COMPLETE
1023,0.2623834811654665,2025-04-24 21:32:05.266472,2025-04-24 21:32:10.826634,0 days 00:00:05.560162,128.70204058970162,Matern,59279.36537853651,0.017616598621876756,0.5,TPESampler,COMPLETE
1024,0.2825174877895941,2025-04-24 21:32:09.388997,2025-04-24 21:32:14.736384,0 days 00:00:05.347387,0.0308290929892895,RBF,138.82931531634046,0.17622324344415574,1.5,TPESampler,COMPLETE
1025,0.9928350583903744,2025-04-24 21:32:10.031895,2025-04-24 21:32:12.908747,0 days 00:00:02.876852,1119.7783426693713,RBF,1.2590902169674557e-05,5.386183480872381e-10,2.5,TPESampler,COMPLETE
1026,0.9928365741140428,2025-04-24 21:32:11.066598,2025-04-24 21:32:15.900176,0 days 00:00:04.833578,0.0007409699062895398,Matern,59017.289659604205,0.03588024019737331,1.5,TPESampler,COMPLETE
1027,0.2623834747120908,2025-04-24 21:32:13.160056,2025-04-24 21:32:18.016283,0 days 00:00:04.856227,112.26614466291696,Matern,4775.804247395685,0.10393390308797128,0.5,TPESampler,COMPLETE
1028,0.26238347424921915,2025-04-24 21:32:15.009828,2025-04-24 21:32:19.992864,0 days 00:00:04.983036,231.12855805261822,Matern,18936.697973890776,0.02327659315187373,0.5,TPESampler,COMPLETE
1029,0.2623834738093748,2025-04-24 21:32:16.142838,2025-04-24 21:32:21.646559,0 days 00:00:05.503721,336.10533181707876,Matern,66998.73633918683,0.481397388239141,0.5,TPESampler,COMPLETE
1030,0.26238346367735754,2025-04-24 21:32:18.267394,2025-04-24 21:32:23.684343,0 days 00:00:05.416949,5719.728295082842,Matern,7926.245382244543,0.06261586623230288,0.5,TPESampler,COMPLETE
1031,0.26238350834710855,2025-04-24 21:32:20.271701,2025-04-24 21:32:27.070461,0 days 00:00:06.798760,33.47881164364483,Matern,42207.29010350993,0.08342808269484517,0.5,TPESampler,COMPLETE
1032,0.26238346584865774,2025-04-24 21:32:21.881066,2025-04-24 21:32:29.224441,0 days 00:00:07.343375,1731.2525280816747,Matern,93126.753020368,0.003403442358417504,0.5,TPESampler,COMPLETE
