number,value,datetime_start,datetime_complete,duration,params_constant_value,params_kernel_type,params_length_scale,params_noise_level,params_nu,system_attrs_auto:sampler,state
1831,0.2623834879729857,2025-04-24 21:59:11.405452,2025-04-24 21:59:16.613700,0 days 00:00:05.208248,1.5357987453834379,Matern,567.5059473589536,0.05197482591485932,0.5,TPESampler,COMPLETE
1832,0.2623834452843798,2025-04-24 21:59:14.299305,2025-04-24 21:59:19.282454,0 days 00:00:04.983149,56.86084199894655,Matern,0.8345492384451583,0.82226288696914,0.5,TPESampler,COMPLETE
1833,0.2623834672731482,2025-04-24 21:59:14.938528,2025-04-24 21:59:20.469925,0 days 00:00:05.531397,96974.43825146896,Matern,0.9161548690549052,0.18107055262305502,0.5,TPESampler,COMPLETE
1834,0.26238348215994683,2025-04-24 21:59:16.855476,2025-04-24 21:59:21.256781,0 days 00:00:04.401305,4.663321536476344,Matern,21.237795677085767,0.07693713864613172,0.5,TPESampler,COMPLETE
1835,0.2623835308119062,2025-04-24 21:59:19.542644,2025-04-24 21:59:24.627691,0 days 00:00:05.085047,1398.3386347079693,Matern,0.42465525931275516,0.9809748551112891,0.5,TPESampler,COMPLETE
1836,0.2623834709329308,2025-04-24 21:59:20.737345,2025-04-24 21:59:25.634255,0 days 00:00:04.896910,93681.19502850047,Matern,34.28581771749937,0.0016849157876397394,0.5,TPESampler,COMPLETE
1837,0.2623836170898079,2025-04-24 21:59:21.466774,2025-04-24 21:59:26.952018,0 days 00:00:05.485244,167.3809401269343,Matern,57489.49261126452,0.028905362915751964,0.5,TPESampler,COMPLETE
1838,0.26238348876746903,2025-04-24 21:59:24.893128,2025-04-24 21:59:29.944187,0 days 00:00:05.051059,0.6695977376094503,Matern,32.78491432254724,0.5834875293534351,0.5,TPESampler,COMPLETE
1839,0.26238348310856174,2025-04-24 21:59:25.918715,2025-04-24 21:59:31.316476,0 days 00:00:05.397761,77230.21996440583,Matern,51.82052349150312,0.9928724419435717,0.5,TPESampler,COMPLETE
1840,0.9329374963276271,2025-04-24 21:59:27.212044,2025-04-24 21:59:32.603692,0 days 00:00:05.391648,75281.11687759488,Matern,0.028019076201395845,0.005335476992644966,0.5,TPESampler,COMPLETE
1841,0.9329374978251046,2025-04-24 21:59:30.211504,2025-04-24 21:59:38.305324,0 days 00:00:08.093820,0.102903026708183,RBF,586.6195604699909,1.9494003321109996e-09,2.5,TPESampler,COMPLETE
1842,0.932937498667708,2025-04-24 21:59:31.676703,2025-04-24 21:59:38.578125,0 days 00:00:06.901422,0.3619780713819165,Matern,74201.93334084094,0.009252688132771192,0.5,TPESampler,COMPLETE
1843,0.9329374977137953,2025-04-24 21:59:32.908413,2025-04-24 21:59:41.093621,0 days 00:00:08.185208,0.30479821220672493,Matern,72853.94856636743,0.01852303549015658,0.5,TPESampler,COMPLETE
1844,0.28251754300528514,2025-04-24 21:59:38.539803,2025-04-24 21:59:44.537277,0 days 00:00:05.997474,32.965648288877546,RBF,296.425153225049,0.41833252414961386,1.5,TPESampler,COMPLETE
1845,0.2737565906921896,2025-04-24 21:59:38.866647,2025-04-24 21:59:44.608193,0 days 00:00:05.741546,5125.710114467489,Matern,4.773266787957281,0.00021123520408552872,2.5,TPESampler,COMPLETE
1846,0.2623835037806428,2025-04-24 21:59:41.317445,2025-04-24 21:59:45.719194,0 days 00:00:04.401749,1346.4218835226782,Matern,0.8769925569337532,0.0012135461140707904,0.5,TPESampler,COMPLETE
1847,0.2623834754426693,2025-04-24 21:59:44.729065,2025-04-24 21:59:50.451558,0 days 00:00:05.722493,8.167750247142937,Matern,1096.3097653636428,0.02496563724457601,0.5,TPESampler,COMPLETE
1848,0.26238341388914116,2025-04-24 21:59:44.883286,2025-04-24 21:59:48.876430,0 days 00:00:03.993144,0.28125491751100673,Matern,1.6942171011416363,0.6351998754542673,0.5,TPESampler,COMPLETE
1849,0.9329374977409304,2025-04-24 21:59:45.964655,2025-04-24 21:59:52.348006,0 days 00:00:06.383351,11.14186649074294,Matern,2735.3613494729207,0.0003682053409046925,1.5,TPESampler,COMPLETE
1850,0.26238615926594344,2025-04-24 21:59:49.135088,2025-04-24 21:59:53.076998,0 days 00:00:03.941910,2501.114848627089,Matern,22.15530301494036,0.01738142896166923,0.5,TPESampler,COMPLETE
1851,0.9329374972171594,2025-04-24 21:59:50.702201,2025-04-24 21:59:59.851338,0 days 00:00:09.149137,0.024377624122145943,Matern,64534.546520441494,0.04598387289900844,0.5,TPESampler,COMPLETE
1852,0.26238348319651006,2025-04-24 21:59:52.645919,2025-04-24 21:59:57.828568,0 days 00:00:05.182649,25.466107605822096,Matern,151.66460266179377,0.7659639205505349,0.5,TPESampler,COMPLETE
1853,0.932937498099506,2025-04-24 21:59:53.356401,2025-04-24 21:59:56.465681,0 days 00:00:03.109280,63.95091438910092,Matern,0.0018345228631623108,0.06482523824074517,0.5,TPESampler,COMPLETE
1854,0.2623834725748517,2025-04-24 21:59:56.741957,2025-04-24 22:00:01.276493,0 days 00:00:04.534536,92.17504178150901,Matern,0.5690280911996366,0.02731058394152376,0.5,TPESampler,COMPLETE
1855,0.26238335748661756,2025-04-24 21:59:58.085499,2025-04-24 22:00:03.268941,0 days 00:00:05.183442,2.534871668350944,Matern,27.866476833877165,0.9537670666380668,0.5,TPESampler,COMPLETE
1856,0.932937497542504,2025-04-24 22:00:00.140296,2025-04-24 22:00:09.474669,0 days 00:00:09.334373,0.06754299852672144,Matern,96474.4325571425,0.04381273956763668,0.5,TPESampler,COMPLETE
1857,0.9329374976580244,2025-04-24 22:00:01.497987,2025-04-24 22:00:05.222578,0 days 00:00:03.724591,653.6047002337287,Matern,0.045745226184828264,0.02933964673309026,0.5,TPESampler,COMPLETE
1858,0.9329374989372936,2025-04-24 22:00:03.535968,2025-04-24 22:00:08.432496,0 days 00:00:04.896528,55.571352318703596,Matern,99877.053527761,0.016041756684191194,0.5,TPESampler,COMPLETE
1859,0.2737566588368984,2025-04-24 22:00:05.487912,2025-04-24 22:00:11.110740,0 days 00:00:05.622828,216.86486162026966,Matern,12.579943477262498,0.9638713169868669,2.5,TPESampler,COMPLETE
1860,0.2623835567064249,2025-04-24 22:00:08.741498,2025-04-24 22:00:14.064245,0 days 00:00:05.322747,3.5428422618497315,Matern,2471.715390478079,0.03452203833949014,0.5,TPESampler,COMPLETE
1861,0.26238348775803777,2025-04-24 22:00:09.793262,2025-04-24 22:00:16.128954,0 days 00:00:06.335692,0.03228093519057807,Matern,0.3324192622664027,0.018994400871872937,0.5,TPESampler,COMPLETE
1862,0.26238347414857466,2025-04-24 22:00:11.530471,2025-04-24 22:00:16.256871,0 days 00:00:04.726400,0.12506285286028718,Matern,4.387676403476747,0.035806154773286025,0.5,TPESampler,COMPLETE
1863,0.9329371492035071,2025-04-24 22:00:14.412020,2025-04-24 22:00:18.322549,0 days 00:00:03.910529,56842.14607311606,Matern,0.09895630207127135,0.9919933121134095,1.5,TPESampler,COMPLETE
1864,0.26238347705988885,2025-04-24 22:00:16.336284,2025-04-24 22:00:21.834112,0 days 00:00:05.497828,31.656671192624586,Matern,29.960507714419258,0.0018683203872613121,0.5,TPESampler,COMPLETE
1865,0.2623834806983959,2025-04-24 22:00:16.484350,2025-04-24 22:00:20.424292,0 days 00:00:03.939942,1139.3641763979972,Matern,4.2739341198686684,0.0027243115530085895,0.5,TPESampler,COMPLETE
1866,0.9329374978133164,2025-04-24 22:00:18.600845,2025-04-24 22:00:24.663561,0 days 00:00:06.062716,0.7226858370222614,RBF,1.1940740124997653e-05,1.581943307266239e-06,2.5,TPESampler,COMPLETE
1867,0.2623834663454148,2025-04-24 22:00:20.657705,2025-04-24 22:00:24.726758,0 days 00:00:04.069053,417.82241597333285,Matern,2.781047789572639,0.026354249291639886,0.5,TPESampler,COMPLETE
1868,0.9329374974536278,2025-04-24 22:00:22.127723,2025-04-24 22:00:28.524006,0 days 00:00:06.396283,1.8721938781245084,Matern,4134.806885229228,0.019296736800902756,0.5,TPESampler,COMPLETE
1869,0.2623834975355961,2025-04-24 22:00:24.847343,2025-04-24 22:00:38.753444,0 days 00:00:13.906101,0.1361602141174138,Matern,81838.19190725008,0.4986745457328476,0.5,TPESampler,COMPLETE
1870,0.26238346818444575,2025-04-24 22:00:25.013982,2025-04-24 22:00:30.269326,0 days 00:00:05.255344,4.998408305903478,Matern,2494.9645618559102,0.06691501712080931,0.5,TPESampler,COMPLETE
1871,0.9928350583133283,2025-04-24 22:00:28.822397,2025-04-24 22:00:34.253314,0 days 00:00:05.430917,80345.45497124908,Matern,0.013883965838104785,0.019470877453040714,0.5,TPESampler,COMPLETE
1872,0.2623834695582402,2025-04-24 22:00:30.938168,2025-04-24 22:00:37.000192,0 days 00:00:06.062024,0.13973304644863063,Matern,10.656142244599913,0.02834451821288063,0.5,TPESampler,COMPLETE
1873,0.9329374975677326,2025-04-24 22:00:34.516641,2025-04-24 22:00:39.452491,0 days 00:00:04.935850,14.626713981303979,Matern,84432.21089203523,0.0007702530693608258,0.5,TPESampler,COMPLETE
1874,0.9928350583884165,2025-04-24 22:00:37.267964,2025-04-24 22:00:41.120150,0 days 00:00:03.852186,10300.596831915062,Matern,0.005382650865028043,9.273800707655918e-06,0.5,TPESampler,COMPLETE
1875,0.932937497786701,2025-04-24 22:00:39.224836,2025-04-24 22:00:44.416949,0 days 00:00:05.192113,1.4697187411691929e-07,RBF,92272.19347740195,4.179941697837212e-10,1.5,TPESampler,COMPLETE
1876,0.2623834982496277,2025-04-24 22:00:39.794728,2025-04-24 22:00:46.463204,0 days 00:00:06.668476,16.951188832539913,Matern,1814.7697795069873,0.0008109577311586387,0.5,TPESampler,COMPLETE
1877,0.26238349639901093,2025-04-24 22:00:41.372932,2025-04-24 22:00:46.435324,0 days 00:00:05.062392,1.6369378581131677,Matern,1.6135715088865026,0.9737507650309893,0.5,TPESampler,COMPLETE
1878,0.9329374976919799,2025-04-24 22:00:44.690677,2025-04-24 22:00:50.875190,0 days 00:00:06.184513,1814.572713038909,Matern,0.013806129658663388,0.8773556554161792,0.5,TPESampler,COMPLETE
1879,0.9928364033896818,2025-04-24 22:00:46.794339,2025-04-24 22:00:52.022511,0 days 00:00:05.228172,80368.24864549725,Matern,2.1245251022961105,3.3487434766577706e-05,0.5,TPESampler,COMPLETE
1880,0.262383477557767,2025-04-24 22:00:47.046632,2025-04-24 22:00:56.464024,0 days 00:00:09.417392,2.5325980985221875e-06,Matern,0.14355954822065267,1.8295724537689226e-09,0.5,TPESampler,COMPLETE
1881,0.2623833538363148,2025-04-24 22:00:51.134922,2025-04-24 22:00:55.745139,0 days 00:00:04.610217,0.6972968832657981,Matern,52.19248163859774,0.9773923554723819,0.5,TPESampler,COMPLETE
1882,0.9329374977202125,2025-04-24 22:00:52.298402,2025-04-24 22:00:55.468644,0 days 00:00:03.170242,8.880826018048534,Matern,0.039687786297838,0.0770229842068208,0.5,TPESampler,COMPLETE
1883,0.2623834837791919,2025-04-24 22:00:55.704541,2025-04-24 22:01:00.237498,0 days 00:00:04.532957,5.628661625717681,Matern,50.104482093211296,0.01774325239326654,0.5,TPESampler,COMPLETE
1884,0.9928365477995179,2025-04-24 22:00:56.071435,2025-04-24 22:01:01.304904,0 days 00:00:05.233469,6.941986006993264e-05,Matern,71745.97139101599,0.2533583913370739,0.5,TPESampler,COMPLETE
1885,0.2623834933955826,2025-04-24 22:00:56.732552,2025-04-24 22:01:01.005794,0 days 00:00:04.273242,2057.5522575985765,Matern,12.368587504461853,0.0036297891581800606,0.5,TPESampler,COMPLETE
1886,0.2623834822723923,2025-04-24 22:01:00.502299,2025-04-24 22:01:07.563332,0 days 00:00:07.061033,510.97609937210905,Matern,0.15718972846075513,0.05357078771719151,0.5,TPESampler,COMPLETE
1887,0.26238346653303446,2025-04-24 22:01:01.277402,2025-04-24 22:01:07.598126,0 days 00:00:06.320724,0.2591843858095765,Matern,3781.941927657411,0.9279687964439344,0.5,TPESampler,COMPLETE
1888,0.2623833728988321,2025-04-24 22:01:01.494194,2025-04-24 22:01:06.168330,0 days 00:00:04.674136,99739.0954847747,Matern,16.883112355690074,0.06622247516347285,0.5,TPESampler,COMPLETE
1889,0.9928350583035722,2025-04-24 22:01:06.446954,2025-04-24 22:01:08.961759,0 days 00:00:02.514805,1.3731736070807793e-07,Matern,0.11615480239742318,0.8135220443980198,1.5,TPESampler,COMPLETE
1890,0.9329374975961637,2025-04-24 22:01:07.740794,2025-04-24 22:01:18.002929,0 days 00:00:10.262135,1.071464073628851e-07,Matern,27552.179501440056,1.2365914357248076e-05,0.5,TPESampler,COMPLETE
1891,0.26238362957849926,2025-04-24 22:01:07.784857,2025-04-24 22:01:13.890869,0 days 00:00:06.106012,0.00036634580995359336,Matern,3.5629068115570095,0.008543488950814271,0.5,TPESampler,COMPLETE
1892,0.9329368362497391,2025-04-24 22:01:09.179545,2025-04-24 22:01:12.597846,0 days 00:00:03.418301,1.430207222905992,Matern,0.07163928688726526,0.7289899805179443,0.5,TPESampler,COMPLETE
1893,0.2623834736311788,2025-04-24 22:01:12.962342,2025-04-24 22:01:18.478648,0 days 00:00:05.516306,56.32002542538529,Matern,0.9043158073143769,0.016538053429214966,0.5,TPESampler,COMPLETE
1894,0.26238348066084083,2025-04-24 22:01:14.117041,2025-04-24 22:01:19.180471,0 days 00:00:05.063430,229.6905355614711,Matern,89.84251034829414,0.09548158283200298,0.5,TPESampler,COMPLETE
1895,0.2737566097366573,2025-04-24 22:01:18.279125,2025-04-24 22:01:24.211740,0 days 00:00:05.932615,24.593131758307166,Matern,768.5673138788877,0.6973416476692027,2.5,TPESampler,COMPLETE
1896,0.28251754975189125,2025-04-24 22:01:18.739980,2025-04-24 22:01:24.486126,0 days 00:00:05.746146,0.004822636911448918,RBF,2.873577936738935,0.8768914219564776,0.5,TPESampler,COMPLETE
1897,0.9928365741130064,2025-04-24 22:01:19.496824,2025-04-24 22:01:23.560504,0 days 00:00:04.063680,0.012806435281776288,RBF,29610.4487193066,0.988447708250401,2.5,TPESampler,COMPLETE
1898,0.2623834956648386,2025-04-24 22:01:23.856040,2025-04-24 22:01:28.182114,0 days 00:00:04.326074,84.23107707641331,Matern,4.081661576487216,0.7292190258821365,0.5,TPESampler,COMPLETE
1899,0.2623834838210799,2025-04-24 22:01:24.440783,2025-04-24 22:01:29.280503,0 days 00:00:04.839720,0.3343743803636104,Matern,1.364265610286235,0.01692939705525558,0.5,TPESampler,COMPLETE
1900,0.2623835656164411,2025-04-24 22:01:24.828278,2025-04-24 22:01:32.455746,0 days 00:00:07.627468,4.065733039552926,Matern,71027.4702542565,0.8632279548079437,0.5,TPESampler,COMPLETE
1901,0.262383476549287,2025-04-24 22:01:28.464761,2025-04-24 22:01:33.377959,0 days 00:00:04.913198,4.068269664408815,Matern,6.887623032304755,0.9544742983968586,0.5,TPESampler,COMPLETE
1902,0.2825175054335949,2025-04-24 22:01:29.587208,2025-04-24 22:01:37.857498,0 days 00:00:08.270290,369.13796003862615,RBF,0.2517215833630005,0.00203391931101181,0.5,TPESampler,COMPLETE
1903,0.9329373434635455,2025-04-24 22:01:32.741571,2025-04-24 22:01:36.716766,0 days 00:00:03.975195,939.6523883901879,Matern,0.0649462977825645,0.00027732545593392677,0.5,TPESampler,COMPLETE
1904,0.26238347418115227,2025-04-24 22:01:33.646760,2025-04-24 22:01:38.134439,0 days 00:00:04.487679,0.674496976896169,Matern,4.5181528431045885,0.04879798048682051,0.5,TPESampler,COMPLETE
1905,0.2623834798824381,2025-04-24 22:01:37.021066,2025-04-24 22:01:41.620187,0 days 00:00:04.599121,1459.7556766029713,Matern,3.190066323825326,0.8372400875115101,0.5,TPESampler,COMPLETE
1906,0.9329374977689707,2025-04-24 22:01:38.092144,2025-04-24 22:01:44.024051,0 days 00:00:05.931907,0.04646959457678597,Matern,601.8944784955687,0.0013974735493469314,0.5,TPESampler,COMPLETE
1907,0.26238346152449693,2025-04-24 22:01:38.452471,2025-04-24 22:01:44.392204,0 days 00:00:05.939733,0.19294387248755956,Matern,57.185810315442296,0.036953197542553676,0.5,TPESampler,COMPLETE
1908,0.26842943167950073,2025-04-24 22:01:41.868429,2025-04-24 22:01:48.318631,0 days 00:00:06.450202,85326.80768594981,Matern,0.08055262328253887,0.7574939913482194,0.5,TPESampler,COMPLETE
1909,0.2623834823809698,2025-04-24 22:01:44.349903,2025-04-24 22:01:49.723030,0 days 00:00:05.373127,90089.6110795161,Matern,0.5518131959603422,0.09305531557379103,0.5,TPESampler,COMPLETE
1910,0.9329374977736629,2025-04-24 22:01:44.759821,2025-04-24 22:01:53.239287,0 days 00:00:08.479466,0.003200262267955562,Matern,7133.425547903565,0.0003394286647897193,0.5,TPESampler,COMPLETE
1911,0.26238347419890495,2025-04-24 22:01:48.570836,2025-04-24 22:01:53.761158,0 days 00:00:05.190322,1.2124054246494798,Matern,732.2489849919996,0.9023793109305165,0.5,TPESampler,COMPLETE
1912,0.28251771531721426,2025-04-24 22:01:50.035177,2025-04-24 22:01:56.372770,0 days 00:00:06.337593,1.8218818734565911,RBF,243.12585949647092,0.8007324801529204,0.5,TPESampler,COMPLETE
1913,0.9928350582666234,2025-04-24 22:01:53.490542,2025-04-24 22:01:56.438629,0 days 00:00:02.948087,82156.1313002109,Matern,0.08586659968328991,0.018054946402370296,0.5,TPESampler,COMPLETE
1914,0.26238358513892507,2025-04-24 22:01:54.017729,2025-04-24 22:02:02.011237,0 days 00:00:07.993508,89043.41195050572,Matern,0.17012458768227354,0.024613482735295122,0.5,TPESampler,COMPLETE
1915,0.9329374977448219,2025-04-24 22:01:56.572729,2025-04-24 22:02:02.673354,0 days 00:00:06.100625,1.0854674867667448e-06,Matern,3.232085299645037,2.3955917188891513e-10,1.5,TPESampler,COMPLETE
1916,0.26238367785196454,2025-04-24 22:01:56.721387,2025-04-24 22:02:02.079644,0 days 00:00:05.358257,77.97022684138177,Matern,9944.042353714027,0.9438030629357993,0.5,TPESampler,COMPLETE
1917,0.2623834942274191,2025-04-24 22:02:02.197370,2025-04-24 22:02:07.443596,0 days 00:00:05.246226,92099.50836337054,Matern,2.984107328024392,0.019835862353300815,0.5,TPESampler,COMPLETE
1918,0.27375665178167785,2025-04-24 22:02:02.320850,2025-04-24 22:02:07.907002,0 days 00:00:05.586152,62074.73286840556,Matern,1.2227672570042463,0.40002845918147667,2.5,TPESampler,COMPLETE
1919,0.2623834751328819,2025-04-24 22:02:02.933955,2025-04-24 22:02:07.622270,0 days 00:00:04.688315,7.725452498094747,Matern,161.07096274877495,0.008662699130600516,0.5,TPESampler,COMPLETE
1920,0.28251754628748194,2025-04-24 22:02:07.655121,2025-04-24 22:02:12.852028,0 days 00:00:05.196907,0.3467253544552239,RBF,0.4629455147771797,0.8397034819684162,0.5,TPESampler,COMPLETE
1921,0.2623835480503254,2025-04-24 22:02:07.870711,2025-04-24 22:02:12.940340,0 days 00:00:05.069629,173.66079655609934,Matern,85.72327841533458,0.9614101814851627,0.5,TPESampler,COMPLETE
1922,0.9928365739308708,2025-04-24 22:02:08.183127,2025-04-24 22:02:13.666314,0 days 00:00:05.483187,0.02174588516152052,RBF,4727.601930254085,0.2597793274511347,0.5,TPESampler,COMPLETE
1923,0.26238347423343805,2025-04-24 22:02:13.079344,2025-04-24 22:02:20.328673,0 days 00:00:07.249329,0.008028286955819893,Matern,2.659186712636875,0.47359719148536455,0.5,TPESampler,COMPLETE
1924,0.9329374977451032,2025-04-24 22:02:13.218165,2025-04-24 22:02:20.739233,0 days 00:00:07.521068,2126.3801135073772,Matern,70931.68236336914,0.04549550761609992,1.5,TPESampler,COMPLETE
1925,0.2623834746180401,2025-04-24 22:02:13.919683,2025-04-24 22:02:19.534736,0 days 00:00:05.615053,3.4121173084813945,Matern,4968.213271028447,0.053555250379247965,0.5,TPESampler,COMPLETE
1926,0.9329374962409158,2025-04-24 22:02:19.801611,2025-04-24 22:02:24.040264,0 days 00:00:04.238653,0.717060950829397,Matern,0.005727597883072232,0.026203658530533087,0.5,TPESampler,COMPLETE
1927,0.9329374972986937,2025-04-24 22:02:20.705513,2025-04-24 22:02:29.851112,0 days 00:00:09.145599,0.00015757377148231154,Matern,81.98132167616181,2.533844734147229e-09,2.5,TPESampler,COMPLETE
1928,0.26238347242286103,2025-04-24 22:02:21.118216,2025-04-24 22:02:29.024533,0 days 00:00:07.906317,0.12101895638727093,Matern,89.26150886815724,0.022421731115218255,0.5,TPESampler,COMPLETE
1929,0.26238347601424233,2025-04-24 22:02:24.306246,2025-04-24 22:02:29.083833,0 days 00:00:04.777587,0.08138871147786901,Matern,4.3155507100107995,0.8793254481862866,0.5,TPESampler,COMPLETE
1930,0.9329374972559384,2025-04-24 22:02:29.211173,2025-04-24 22:02:39.100255,0 days 00:00:09.889082,13.365655812554783,RBF,98.5591290225207,0.0012346720127417098,0.5,TPESampler,COMPLETE
1931,0.9329374986795891,2025-04-24 22:02:29.283793,2025-04-24 22:02:37.670270,0 days 00:00:08.386477,23.897523089844587,Matern,0.00838854082981748,0.0003369355590720605,0.5,TPESampler,COMPLETE
1932,0.2623834737248512,2025-04-24 22:02:30.485838,2025-04-24 22:02:39.829407,0 days 00:00:09.343569,1.929221269990856,Matern,4.196140830413857,0.02228327218171076,0.5,TPESampler,COMPLETE
1933,0.2623833621203259,2025-04-24 22:02:37.930627,2025-04-24 22:02:43.050137,0 days 00:00:05.119510,3.581810234400043,Matern,5512.271756878538,0.03264664055385838,0.5,TPESampler,COMPLETE
1934,0.26238347446743204,2025-04-24 22:02:39.369078,2025-04-24 22:02:51.068425,0 days 00:00:11.699347,0.01881708758078964,Matern,6190.612303985288,0.814802809371,0.5,TPESampler,COMPLETE
1935,0.9928348956637708,2025-04-24 22:02:40.095273,2025-04-24 22:02:43.222004,0 days 00:00:03.126731,227.03969704457387,Matern,0.19643795085341703,0.007514211010912379,0.5,TPESampler,COMPLETE
1936,0.2623834933653156,2025-04-24 22:02:43.673215,2025-04-24 22:02:56.182182,0 days 00:00:12.508967,0.013852129356154506,Matern,0.08981404301072936,0.9882965247731991,0.5,TPESampler,COMPLETE
1937,0.2623834587530143,2025-04-24 22:02:43.883952,2025-04-24 22:02:48.695876,0 days 00:00:04.811924,6.420380621840579,Matern,64.08496452564006,0.0007884358989213848,0.5,TPESampler,COMPLETE
1938,0.2623834757932525,2025-04-24 22:02:48.944053,2025-04-24 22:02:56.026922,0 days 00:00:07.082869,308.03690014064523,Matern,70117.91141276571,0.015744869621388366,0.5,TPESampler,COMPLETE
1939,0.2623834647261137,2025-04-24 22:02:51.311982,2025-04-24 22:02:56.940728,0 days 00:00:05.628746,1689.2064688574405,Matern,24.67525253035947,0.0546054235467505,0.5,TPESampler,COMPLETE
1940,0.26238347346932916,2025-04-24 22:02:56.270210,2025-04-24 22:03:01.121918,0 days 00:00:04.851708,3.1352978732740717,Matern,1000.2644372491981,0.03742167988676339,0.5,TPESampler,COMPLETE
1941,0.9928365552492932,2025-04-24 22:02:56.475964,2025-04-24 22:02:58.690240,0 days 00:00:02.214276,1469.599870149861,Matern,1.008384265501472,0.008607304305446624,0.5,TPESampler,COMPLETE
1942,0.2623834743547279,2025-04-24 22:02:57.239283,2025-04-24 22:03:03.203507,0 days 00:00:05.964224,373.2031429557308,Matern,89337.16156603787,0.04609225239693077,0.5,TPESampler,COMPLETE
1943,0.9329374981003574,2025-04-24 22:02:58.951924,2025-04-24 22:03:04.840765,0 days 00:00:05.888841,5980.806902843198,RBF,0.00343435357457882,0.0013105471108671046,2.5,TPESampler,COMPLETE
1944,0.26238347261483774,2025-04-24 22:03:01.375305,2025-04-24 22:03:07.932506,0 days 00:00:06.557201,0.15871008949977192,Matern,8583.096001049204,0.08904926756904705,0.5,TPESampler,COMPLETE
