number,value,datetime_start,datetime_complete,duration,params_constant_value,params_kernel_type,params_length_scale,params_noise_level,params_nu,system_attrs_auto:sampler,state
1261,0.9329374974938381,2025-04-24 21:40:08.743963,2025-04-24 21:40:14.836264,0 days 00:00:06.092301,0.04008090724672575,Matern,342.2715678081622,0.01851829606134321,0.5,TPESampler,COMPLETE
1262,0.9329374977469327,2025-04-24 21:40:09.308402,2025-04-24 21:40:12.690572,0 days 00:00:03.382170,0.13198330396966887,RBF,0.0017495394417091515,0.0035667732624443576,1.5,TPESampler,COMPLETE
1263,0.2623834983828844,2025-04-24 21:40:12.937669,2025-04-24 21:40:17.187187,0 days 00:00:04.249518,2919.2787810260133,Matern,1.0846044067256064,0.022021136748466185,0.5,TPESampler,COMPLETE
1264,0.2623834748571461,2025-04-24 21:40:13.485715,2025-04-24 21:40:18.854587,0 days 00:00:05.368872,2120.8801414127615,Matern,95893.29594041144,0.10674007120946682,0.5,TPESampler,COMPLETE
1265,0.26238331138298093,2025-04-24 21:40:15.092772,2025-04-24 21:40:19.410266,0 days 00:00:04.317494,3.5719637754596256,Matern,3.080704753414887,0.004411232843363352,0.5,TPESampler,COMPLETE
1266,0.2623834963968489,2025-04-24 21:40:17.390963,2025-04-24 21:40:21.859126,0 days 00:00:04.468163,3.1021654696107084,Matern,3.210125445237532,0.9917618911588175,0.5,TPESampler,COMPLETE
1267,0.2623834742905706,2025-04-24 21:40:19.122179,2025-04-24 21:40:24.038647,0 days 00:00:04.916468,1.9337892430956454,Matern,126.87065749839753,0.0014288858535380434,0.5,TPESampler,COMPLETE
1268,0.2623834664588191,2025-04-24 21:40:19.643401,2025-04-24 21:40:23.681941,0 days 00:00:04.038540,1783.4121697646117,Matern,4.903349064075161,0.04527803101180429,0.5,TPESampler,COMPLETE
1269,0.26238346867031875,2025-04-24 21:40:22.103059,2025-04-24 21:40:27.131654,0 days 00:00:05.028595,88.66713207954733,Matern,6.642431357270239,0.0002229637625573116,0.5,TPESampler,COMPLETE
1270,0.26238348284938956,2025-04-24 21:40:23.925420,2025-04-24 21:40:28.285945,0 days 00:00:04.360525,3.2118171845275114,Matern,3.8354291984712092,0.00027870877709543787,0.5,TPESampler,COMPLETE
1271,0.262383435503524,2025-04-24 21:40:24.254751,2025-04-24 21:40:28.608286,0 days 00:00:04.353535,14.359255813511693,Matern,20.678670284855038,0.0010901933382525062,0.5,TPESampler,COMPLETE
1272,0.2623835164142555,2025-04-24 21:40:27.376581,2025-04-24 21:40:31.528464,0 days 00:00:04.151883,3.4261803286272867,Matern,2.202392425386064,0.0242845781885826,0.5,TPESampler,COMPLETE
1273,0.9329374977337146,2025-04-24 21:40:28.532589,2025-04-24 21:40:37.279772,0 days 00:00:08.747183,0.0005161582166391635,RBF,11601.752216306504,3.488164966006451e-05,1.5,TPESampler,COMPLETE
1274,0.26238342994279107,2025-04-24 21:40:28.863830,2025-04-24 21:40:33.374852,0 days 00:00:04.511022,0.5538293489199362,Matern,0.18618788636069722,0.0019159550991525642,0.5,TPESampler,COMPLETE
1275,0.26238344856265367,2025-04-24 21:40:31.816244,2025-04-24 21:40:37.518571,0 days 00:00:05.702327,0.011395435702953328,Matern,0.34387823928341593,0.035036585632479175,0.5,TPESampler,COMPLETE
1276,0.9329360039697705,2025-04-24 21:40:33.645846,2025-04-24 21:40:36.756280,0 days 00:00:03.110434,0.019850274548397415,Matern,0.08080990751588721,0.00024321686412944314,0.5,TPESampler,COMPLETE
1277,0.2623834748565207,2025-04-24 21:40:37.014283,2025-04-24 21:40:44.904457,0 days 00:00:07.890174,0.34074566674980006,Matern,43.46626389485611,0.00025165235037062736,0.5,TPESampler,COMPLETE
1278,0.992835058269751,2025-04-24 21:40:37.538240,2025-04-24 21:40:42.088234,0 days 00:00:04.549994,22825.01232142116,RBF,0.20952760739962115,4.442160621681498e-09,1.5,TPESampler,COMPLETE
1279,0.9329374981121341,2025-04-24 21:40:37.749369,2025-04-24 21:40:46.510848,0 days 00:00:08.761479,0.0030396512776489364,Matern,174.01198584424236,1.3399127630197896e-06,1.5,TPESampler,COMPLETE
1280,0.26238349031515795,2025-04-24 21:40:42.319944,2025-04-24 21:40:46.395276,0 days 00:00:04.075332,1.1574932607660233,Matern,7.3293962639298575,0.0016608341564783508,0.5,TPESampler,COMPLETE
1281,0.2623834563611561,2025-04-24 21:40:45.150515,2025-04-24 21:40:50.295094,0 days 00:00:05.144579,8061.135514968795,Matern,0.31995097579626436,0.9772398086651606,0.5,TPESampler,COMPLETE
1282,0.2623834746300632,2025-04-24 21:40:46.581881,2025-04-24 21:40:51.748969,0 days 00:00:05.167088,2352.0580559898303,Matern,3364.6997143714166,0.021227239152902446,0.5,TPESampler,COMPLETE
1283,0.2623834710803618,2025-04-24 21:40:46.776588,2025-04-24 21:40:54.641768,0 days 00:00:07.865180,20.610316314179133,Matern,0.0919205487736597,0.0038801094957293704,0.5,TPESampler,COMPLETE
1284,0.26238349850981785,2025-04-24 21:40:50.542909,2025-04-24 21:40:55.155954,0 days 00:00:04.613045,9.154390546347384,Matern,6.996708006975083,0.011644744769762069,0.5,TPESampler,COMPLETE
1285,0.9928364776727254,2025-04-24 21:40:51.996544,2025-04-24 21:40:57.264108,0 days 00:00:05.267564,0.02423457062338233,Matern,90302.80764599312,0.13684175552107744,0.5,TPESampler,COMPLETE
1286,0.2623834945835173,2025-04-24 21:40:54.892282,2025-04-24 21:40:59.223177,0 days 00:00:04.330895,5.600207778763178,Matern,5.549966605426535,0.0011523688698558475,0.5,TPESampler,COMPLETE
1287,0.9928355896440617,2025-04-24 21:40:55.380471,2025-04-24 21:40:58.625995,0 days 00:00:03.245524,22.348062188685137,Matern,1.111669875562556,4.30171039109638e-08,0.5,TPESampler,COMPLETE
1288,0.26238368268538864,2025-04-24 21:40:57.551686,2025-04-24 21:41:02.147123,0 days 00:00:04.595437,17.706499947999063,Matern,0.8719350697727437,0.0015227419213747972,0.5,TPESampler,COMPLETE
1289,0.9329375015325734,2025-04-24 21:40:58.853436,2025-04-24 21:41:02.075845,0 days 00:00:03.222409,0.001492833286610899,RBF,1.259943960035779,7.058528562873396e-08,0.5,TPESampler,COMPLETE
1290,0.262383462262801,2025-04-24 21:40:59.479550,2025-04-24 21:41:04.010430,0 days 00:00:04.530880,280.60739214147316,Matern,1.1083995649895815,0.0022792881976704286,0.5,TPESampler,COMPLETE
1291,0.9329368041221675,2025-04-24 21:41:02.248097,2025-04-24 21:41:05.341732,0 days 00:00:03.093635,0.6659612134225562,Matern,0.07188887371338674,0.03405305920806155,0.5,TPESampler,COMPLETE
1292,0.9329374977921766,2025-04-24 21:41:02.321101,2025-04-24 21:41:06.303372,0 days 00:00:03.982271,5.2310728758834655,Matern,1309.9824197486732,0.00024111868975076005,0.5,TPESampler,COMPLETE
1293,0.2623834759776728,2025-04-24 21:41:04.270185,2025-04-24 21:41:09.838509,0 days 00:00:05.568324,1.398464013347401,Matern,94767.46965232212,0.07378395671650763,0.5,TPESampler,COMPLETE
1294,0.2623834746411339,2025-04-24 21:41:05.596225,2025-04-24 21:41:11.321628,0 days 00:00:05.725403,5.017664291703478,Matern,99426.88857045321,0.0602955573999818,0.5,TPESampler,COMPLETE
1295,0.992836555509533,2025-04-24 21:41:06.581875,2025-04-24 21:41:09.666164,0 days 00:00:03.084289,91638.06863348371,Matern,6.867592620939663,0.006022337127412666,0.5,TPESampler,COMPLETE
1296,0.9329374984512456,2025-04-24 21:41:09.845433,2025-04-24 21:41:13.376784,0 days 00:00:03.531351,0.004427142037083797,Matern,2.852133965826504,0.0014201729423420838,0.5,TPESampler,COMPLETE
1297,0.2623834838464944,2025-04-24 21:41:10.097015,2025-04-24 21:41:14.645040,0 days 00:00:04.548025,2.086161495484689,Matern,1.260642307446067,0.021866576954226672,0.5,TPESampler,COMPLETE
1298,0.26238350978903,2025-04-24 21:41:11.564126,2025-04-24 21:41:15.651521,0 days 00:00:04.087395,3.6217709215155263,Matern,2.4075688866365,0.005987552796224304,0.5,TPESampler,COMPLETE
1299,0.2623834747617988,2025-04-24 21:41:13.632894,2025-04-24 21:41:19.360631,0 days 00:00:05.727737,19.913418892364472,Matern,71509.89048068592,0.9082450257022311,0.5,TPESampler,COMPLETE
1300,0.9926663433315576,2025-04-24 21:41:14.903234,2025-04-24 21:41:16.846624,0 days 00:00:01.943390,0.001098356955902609,RBF,0.018404174967454445,0.5722142769377502,1.5,TPESampler,COMPLETE
1301,0.28251755610693935,2025-04-24 21:41:15.890543,2025-04-24 21:41:20.983016,0 days 00:00:05.092473,46019.22401697872,RBF,60.79701161675489,0.009961112411527726,0.5,TPESampler,COMPLETE
1302,0.2623836151092474,2025-04-24 21:41:17.135642,2025-04-24 21:41:21.331178,0 days 00:00:04.195536,9165.612023896952,Matern,386.72204565267685,0.005484657576033014,0.5,TPESampler,COMPLETE
1303,0.2623835088072505,2025-04-24 21:41:19.604438,2025-04-24 21:41:24.888758,0 days 00:00:05.284320,3.1484267008900204,Matern,281.1269881215162,0.008018193929593034,0.5,TPESampler,COMPLETE
1304,0.9928350581872917,2025-04-24 21:41:21.246533,2025-04-24 21:41:23.933018,0 days 00:00:02.686485,160.40426543113355,Matern,0.0046277053860917195,0.007866266566232445,0.5,TPESampler,COMPLETE
1305,0.9329374977459978,2025-04-24 21:41:21.623493,2025-04-24 21:41:28.738484,0 days 00:00:07.114991,542.6251981053983,RBF,11332.00088620737,1.7933342420161327e-09,2.5,TPESampler,COMPLETE
1306,0.2623834399064701,2025-04-24 21:41:24.177755,2025-04-24 21:41:29.016085,0 days 00:00:04.838330,0.45393307221368184,Matern,1176.0435490677673,0.04005802504983383,0.5,TPESampler,COMPLETE
1307,0.26238348218538404,2025-04-24 21:41:25.169985,2025-04-24 21:41:30.660813,0 days 00:00:05.490828,0.18903645233560715,Matern,1679.2019217869981,0.8966123659946852,0.5,TPESampler,COMPLETE
1308,0.26238336709750637,2025-04-24 21:41:28.974310,2025-04-24 21:41:33.896749,0 days 00:00:04.922439,0.5224311051874595,Matern,1593.336694619504,0.029409394767605776,0.5,TPESampler,COMPLETE
1309,0.26238346034146115,2025-04-24 21:41:29.274319,2025-04-24 21:41:33.946903,0 days 00:00:04.672584,26.960583036875246,Matern,2.4528870391424844,0.03472647750967665,0.5,TPESampler,COMPLETE
1310,0.2623834537075474,2025-04-24 21:41:30.913656,2025-04-24 21:41:35.717515,0 days 00:00:04.803859,79475.63701015142,Matern,1.0960531545813232,0.12227521538235932,0.5,TPESampler,COMPLETE
1311,0.2623834991053762,2025-04-24 21:41:34.070726,2025-04-24 21:41:38.907429,0 days 00:00:04.836703,0.8930116961876533,Matern,13.410514978368544,0.01764382882441507,0.5,TPESampler,COMPLETE
1312,0.2825175088567092,2025-04-24 21:41:34.126786,2025-04-24 21:41:38.965875,0 days 00:00:04.839089,1.9012534495576852,RBF,17.11728049886891,0.9844688175191123,0.5,TPESampler,COMPLETE
1313,0.2623834751456821,2025-04-24 21:41:35.974827,2025-04-24 21:41:40.914100,0 days 00:00:04.939273,10.875283348782222,Matern,0.24835366314910529,8.546992642512703e-05,0.5,TPESampler,COMPLETE
1314,0.26238342807479775,2025-04-24 21:41:39.093957,2025-04-24 21:41:50.393614,0 days 00:00:11.299657,0.02780252721167377,Matern,15885.384304490704,0.9495130791877626,0.5,TPESampler,COMPLETE
1315,0.27375661645881466,2025-04-24 21:41:39.215845,2025-04-24 21:41:43.955524,0 days 00:00:04.739679,928.8877372471524,Matern,37.22197784832445,0.08734899390537217,2.5,TPESampler,COMPLETE
1316,0.9329374978187985,2025-04-24 21:41:41.175271,2025-04-24 21:41:45.712069,0 days 00:00:04.536798,0.10042349917286368,Matern,3223.501188314172,0.00033450211576351464,0.5,TPESampler,COMPLETE
1317,0.2678747473442721,2025-04-24 21:41:44.216302,2025-04-24 21:41:50.948992,0 days 00:00:06.732690,8.737213299429342,Matern,10.784546081668076,0.00015060545475124604,1.5,TPESampler,COMPLETE
1318,0.9928269773225987,2025-04-24 21:41:45.977072,2025-04-24 21:41:50.952296,0 days 00:00:04.975224,6.136329366795194e-05,Matern,0.015669556520832274,0.23804492114901535,0.5,TPESampler,COMPLETE
1319,0.2623834621278665,2025-04-24 21:41:50.875452,2025-04-24 21:41:55.794015,0 days 00:00:04.918563,1.0277278974880188,Matern,2725.0108526135787,0.031182265671129413,0.5,TPESampler,COMPLETE
1320,0.262383474820092,2025-04-24 21:41:51.176437,2025-04-24 21:41:56.269640,0 days 00:00:05.093203,14.212986599372432,Matern,1858.6940629648066,0.8674245439096325,0.5,TPESampler,COMPLETE
1321,0.9928364902069051,2025-04-24 21:41:51.231668,2025-04-24 21:41:55.860767,0 days 00:00:04.629099,0.024603994376933423,Matern,74565.1909623587,0.7783463293974667,0.5,TPESampler,COMPLETE
1322,0.2623834747829312,2025-04-24 21:41:55.959785,2025-04-24 21:42:00.967754,0 days 00:00:05.007969,683.7668016599899,Matern,1221.5962932457942,0.018269331228923484,0.5,TPESampler,COMPLETE
1323,0.262383452823941,2025-04-24 21:41:56.109466,2025-04-24 21:42:00.784994,0 days 00:00:04.675528,33.24563691043173,Matern,0.6162062581692668,0.8361360529527212,0.5,TPESampler,COMPLETE
1324,0.26238347060629313,2025-04-24 21:41:56.519649,2025-04-24 21:42:09.448574,0 days 00:00:12.928925,9.03185794378243e-05,Matern,2667.259329557221,0.1843229762318765,0.5,TPESampler,COMPLETE
1325,0.26238347496063663,2025-04-24 21:42:00.966749,2025-04-24 21:42:06.786553,0 days 00:00:05.819804,63.12504702544828,Matern,6249.630860916308,0.010758837493926875,0.5,TPESampler,COMPLETE
1326,0.9329374977576889,2025-04-24 21:42:01.239704,2025-04-24 21:42:05.316318,0 days 00:00:04.076614,2.49784477960697,Matern,0.023238942235079996,0.06824983684166315,0.5,TPESampler,COMPLETE
1327,0.9926984454360537,2025-04-24 21:42:05.547913,2025-04-24 21:42:08.126968,0 days 00:00:02.579055,0.008079555375612332,Matern,3185.4630107777675,0.04183344984375518,0.5,TPESampler,COMPLETE
1328,0.932937497740005,2025-04-24 21:42:07.047189,2025-04-24 21:42:16.301753,0 days 00:00:09.254564,1.2673801442330348e-07,RBF,0.03834516533463855,0.0004930271072571152,2.5,TPESampler,COMPLETE
1329,0.26787459648256345,2025-04-24 21:42:08.370339,2025-04-24 21:42:11.915972,0 days 00:00:03.545633,49.39141550487341,Matern,0.4610147134945599,0.037844820479021574,1.5,TPESampler,COMPLETE
1330,0.26238340595826093,2025-04-24 21:42:09.712140,2025-04-24 21:42:16.616918,0 days 00:00:06.904778,577.9896686032167,Matern,0.0918672175269818,0.05598930914423341,0.5,TPESampler,COMPLETE
1331,0.9329374976542436,2025-04-24 21:42:12.151898,2025-04-24 21:42:16.950755,0 days 00:00:04.798857,0.23399324715638892,Matern,0.001014910507144933,0.8715618895370729,0.5,TPESampler,COMPLETE
1332,0.9928365555095352,2025-04-24 21:42:16.564210,2025-04-24 21:42:19.019024,0 days 00:00:02.454814,145.61106283325338,Matern,21.273318961906792,0.007992294041125928,0.5,TPESampler,COMPLETE
1333,0.2623834740634278,2025-04-24 21:42:16.909280,2025-04-24 21:42:23.012477,0 days 00:00:06.103197,80.43648564828774,Matern,91556.22446356989,0.037641743213332,0.5,TPESampler,COMPLETE
1334,0.26238364704958994,2025-04-24 21:42:17.223770,2025-04-24 21:42:22.076689,0 days 00:00:04.852919,0.2994634199801014,Matern,214.8754992381447,0.9988389385991939,0.5,TPESampler,COMPLETE
1335,0.9329374977609219,2025-04-24 21:42:19.257940,2025-04-24 21:42:28.795876,0 days 00:00:09.537936,0.0003917419474135196,Matern,327.8827386125615,0.0013337413316382358,0.5,TPESampler,COMPLETE
1336,0.2623834752752084,2025-04-24 21:42:22.326449,2025-04-24 21:42:27.211328,0 days 00:00:04.884879,0.09121175408281165,Matern,4.3402516552465595,0.006482760281826625,0.5,TPESampler,COMPLETE
1337,0.2623834773032755,2025-04-24 21:42:23.258521,2025-04-24 21:42:28.166083,0 days 00:00:04.907562,2633.3300099987136,Matern,4032.9196622799445,0.7201436832994104,0.5,TPESampler,COMPLETE
1338,0.2623834399691202,2025-04-24 21:42:27.471539,2025-04-24 21:42:32.327114,0 days 00:00:04.855575,93.26589689070158,Matern,16.901150599186497,0.9539735924762253,0.5,TPESampler,COMPLETE
1339,0.26238369678843343,2025-04-24 21:42:28.431626,2025-04-24 21:42:32.259415,0 days 00:00:03.827789,0.43203147670279346,Matern,4.129662622935439,0.007548981667309294,0.5,TPESampler,COMPLETE
1340,0.9329374980018306,2025-04-24 21:42:29.002832,2025-04-24 21:42:35.122564,0 days 00:00:06.119732,0.11417402790983268,Matern,2201.541497149159,0.03977184809085934,0.5,TPESampler,COMPLETE
1341,0.9329374978543824,2025-04-24 21:42:32.396788,2025-04-24 21:42:39.823160,0 days 00:00:07.426372,0.3774033619718886,Matern,93333.5419996543,0.006917502068531439,0.5,TPESampler,COMPLETE
1342,0.9329374979106121,2025-04-24 21:42:32.556762,2025-04-24 21:42:36.908338,0 days 00:00:04.351576,0.0005931683663572287,RBF,0.002398835247373388,3.8127519540307767e-10,2.5,TPESampler,COMPLETE
1343,0.2623835455447063,2025-04-24 21:42:35.371447,2025-04-24 21:42:40.463841,0 days 00:00:05.092394,561.7966144346794,Matern,1.9090935164374068,0.02009540527598039,0.5,TPESampler,COMPLETE
1344,0.9329374966603794,2025-04-24 21:42:37.167817,2025-04-24 21:42:45.849306,0 days 00:00:08.681489,0.0011890936866333142,Matern,21.419605038866774,0.016812510206255783,0.5,TPESampler,COMPLETE
1345,0.9329374978563194,2025-04-24 21:42:40.096450,2025-04-24 21:42:46.653638,0 days 00:00:06.557188,0.81690193927897,Matern,1100.4316966109236,0.05717610233853482,1.5,TPESampler,COMPLETE
1346,0.9329374977605018,2025-04-24 21:42:40.664357,2025-04-24 21:42:44.095401,0 days 00:00:03.431044,0.00032304711261973594,RBF,1.9382941922224078e-05,1.5469985269647178e-07,2.5,TPESampler,COMPLETE
1347,0.9329374975378415,2025-04-24 21:42:44.414529,2025-04-24 21:42:50.552086,0 days 00:00:06.137557,1.1728239004066217,RBF,40.77241949922185,0.0028358330110789345,1.5,TPESampler,COMPLETE
1348,0.9329374977459487,2025-04-24 21:42:46.104232,2025-04-24 21:42:54.120459,0 days 00:00:08.016227,0.006137278676093427,Matern,53.297516336216304,0.01756886418892441,1.5,TPESampler,COMPLETE
1349,0.2623834697697029,2025-04-24 21:42:46.921410,2025-04-24 21:42:51.401346,0 days 00:00:04.479936,5.9316075528841505,Matern,19.753941130670782,0.015930354864565722,0.5,TPESampler,COMPLETE
1350,0.2623834836614564,2025-04-24 21:42:50.829636,2025-04-24 21:42:55.649088,0 days 00:00:04.819452,7.002701184759639,Matern,4959.340816563645,0.655106199365157,0.5,TPESampler,COMPLETE
1351,0.26238364881918275,2025-04-24 21:42:51.666162,2025-04-24 21:42:56.818610,0 days 00:00:05.152448,3.0013035602159843,Matern,0.8863446191210398,0.9729967291338316,0.5,TPESampler,COMPLETE
1352,0.2623833431502149,2025-04-24 21:42:54.375842,2025-04-24 21:43:00.688419,0 days 00:00:06.312577,0.0543185114116911,Matern,24.863338849742856,0.016069295813871946,0.5,TPESampler,COMPLETE
1353,0.2623835134673148,2025-04-24 21:42:55.940975,2025-04-24 21:43:00.642464,0 days 00:00:04.701489,63.24699987249542,Matern,2511.015653091148,0.006572081234252115,0.5,TPESampler,COMPLETE
1354,0.28251756498486164,2025-04-24 21:42:57.059255,2025-04-24 21:43:02.610801,0 days 00:00:05.551546,6.494646659415831,RBF,6.952720887359027,0.00313291578932546,0.5,TPESampler,COMPLETE
1355,0.2623840347158896,2025-04-24 21:43:00.816942,2025-04-24 21:43:05.189867,0 days 00:00:04.372925,0.02984871722657634,Matern,2.579737891737868,0.0658618281467626,0.5,TPESampler,COMPLETE
1356,0.9329374977640369,2025-04-24 21:43:00.861513,2025-04-24 21:43:05.163746,0 days 00:00:04.302233,0.07553364438567584,Matern,92.44638573790023,0.003354700127082442,0.5,TPESampler,COMPLETE
1357,0.9329374966087824,2025-04-24 21:43:02.866955,2025-04-24 21:43:14.211884,0 days 00:00:11.344929,1.1944481327335413e-07,Matern,5519.143799155707,3.721164414681384e-10,1.5,TPESampler,COMPLETE
1358,0.9329374977475705,2025-04-24 21:43:05.328762,2025-04-24 21:43:13.064006,0 days 00:00:07.735244,39096.37217088243,RBF,48856.5743946599,0.0025956067712202533,2.5,TPESampler,COMPLETE
1359,0.27375661468339935,2025-04-24 21:43:05.376499,2025-04-24 21:43:11.622662,0 days 00:00:06.246163,11.969125937364353,Matern,105.47064421255159,0.011451277894597704,2.5,TPESampler,COMPLETE
1360,0.26238346689805625,2025-04-24 21:43:11.868483,2025-04-24 21:43:17.827401,0 days 00:00:05.958918,0.0035818221957978364,Matern,0.14487929946885297,0.021849519013390058,0.5,TPESampler,COMPLETE
1361,0.2623834498504098,2025-04-24 21:43:13.271114,2025-04-24 21:43:17.054383,0 days 00:00:03.783269,2.4513131160039014,Matern,17.883002904952374,0.004161978238582973,0.5,TPESampler,COMPLETE
1362,0.992834956915494,2025-04-24 21:43:14.496796,2025-04-24 21:43:17.107085,0 days 00:00:02.610289,1.8964732243638876e-07,Matern,0.0007048592262960965,0.09040938199848764,2.5,TPESampler,COMPLETE
1363,0.932937497713577,2025-04-24 21:43:17.243501,2025-04-24 21:43:23.302664,0 days 00:00:06.059163,0.0006219330929528412,Matern,33.06173167236286,0.0007894606347638288,0.5,TPESampler,COMPLETE
1364,0.2623834653474465,2025-04-24 21:43:17.284494,2025-04-24 21:43:22.765713,0 days 00:00:05.481219,0.043058256273668556,Matern,1.1645589819467588,0.053173978492366915,0.5,TPESampler,COMPLETE
1365,0.26238349789559867,2025-04-24 21:43:18.085869,2025-04-24 21:43:22.843071,0 days 00:00:04.757202,0.19911678435778382,Matern,1.2878759241040414,0.0032248715175838523,0.5,TPESampler,COMPLETE
1366,0.9329374979423213,2025-04-24 21:43:22.976654,2025-04-24 21:43:29.092276,0 days 00:00:06.115622,8.599625142910268,RBF,64006.78227178009,0.0007458055449998628,1.5,TPESampler,COMPLETE
1367,0.26238349507412817,2025-04-24 21:43:23.048904,2025-04-24 21:43:29.627735,0 days 00:00:06.578831,0.10382999990095045,Matern,26.948666217966345,0.017467425325900853,0.5,TPESampler,COMPLETE
1368,0.9329374923273709,2025-04-24 21:43:23.577813,2025-04-24 21:43:26.686509,0 days 00:00:03.108696,0.02680773329782225,Matern,0.09264725459592173,0.001392928655858603,2.5,TPESampler,COMPLETE
1369,0.9329374977997198,2025-04-24 21:43:26.933334,2025-04-24 21:43:35.414954,0 days 00:00:08.481620,0.004044325219079309,Matern,669.22154888658,0.00493332790778483,2.5,TPESampler,COMPLETE
1370,0.262383404064213,2025-04-24 21:43:29.365602,2025-04-24 21:43:33.556807,0 days 00:00:04.191205,5449.094229491739,Matern,62.31314037786573,0.02074580255401543,0.5,TPESampler,COMPLETE
1371,0.2623834680803172,2025-04-24 21:43:29.863890,2025-04-24 21:43:35.025517,0 days 00:00:05.161627,4.904549861925179,Matern,105.5473741041211,0.0004993204641339168,0.5,TPESampler,COMPLETE
1372,0.9329374977913464,2025-04-24 21:43:33.819255,2025-04-24 21:43:38.850476,0 days 00:00:05.031221,0.040504990364033766,Matern,111.05170661272085,0.00013304634732804968,0.5,TPESampler,COMPLETE
1373,0.2623834731774452,2025-04-24 21:43:35.289103,2025-04-24 21:43:43.334138,0 days 00:00:08.045035,0.04037216297902226,Matern,3.122736295548051,0.005248573484484794,0.5,TPESampler,COMPLETE
1374,0.2623833692415504,2025-04-24 21:43:35.675867,2025-04-24 21:43:39.792404,0 days 00:00:04.116537,24.22003216465713,Matern,52.883172960505824,0.025119774587044216,0.5,TPESampler,COMPLETE
