number,value,datetime_start,datetime_complete,duration,params_constant_value,params_kernel_type,params_length_scale,params_noise_level,params_nu,system_attrs_auto:sampler,state
0,0.992835058390403,2025-04-24 20:57:15.387341,2025-04-24 20:57:18.157384,0 days 00:00:02.770043,1100.047440188234,Matern,0.003247341272468209,1.022989986773195e-06,1.5,RandomSampler,COMPLETE
1,0.2825175520807404,2025-04-24 20:57:15.403786,2025-04-24 20:57:20.579439,0 days 00:00:05.175653,0.9021010809636154,RBF,0.28321792106511157,8.733543334157903e-05,2.5,RandomSampler,COMPLETE
2,0.9329374977938542,2025-04-24 20:57:15.463070,2025-04-24 20:57:19.773068,0 days 00:00:04.309998,0.3574084819331545,RBF,0.010812990689221055,7.634893524572228e-05,0.5,RandomSampler,COMPLETE
3,0.28251741810608627,2025-04-24 20:57:18.357752,2025-04-24 20:57:37.372497,0 days 00:00:19.014745,1.2573772420921318e-06,RBF,46.646250310791544,0.27257356422363793,0.5,TPESampler,COMPLETE
4,0.932937497335416,2025-04-24 20:57:19.968895,2025-04-24 20:57:25.701714,0 days 00:00:05.732819,0.631168860161446,RBF,9.97200322379612e-05,3.0713180829227152e-06,0.5,TPESampler,COMPLETE
5,0.9329374977774733,2025-04-24 20:57:20.798451,2025-04-24 20:57:28.244266,0 days 00:00:07.445815,3.6864055968589934e-06,RBF,782.5984516072865,0.0012864859486576312,0.5,TPESampler,COMPLETE
6,0.9928365741163164,2025-04-24 20:57:25.991775,2025-04-24 20:57:30.995368,0 days 00:00:05.003593,0.00014633235055212966,Matern,81351.13198756389,0.9430741742409784,2.5,TPESampler,COMPLETE
7,0.932937497745685,2025-04-24 20:57:28.436572,2025-04-24 20:57:50.357740,0 days 00:00:21.921168,0.0007651296249835254,Matern,0.015838242784669106,0.0994086471881509,1.5,TPESampler,COMPLETE
8,0.9329374597977212,2025-04-24 20:57:31.513850,2025-04-24 20:57:49.095789,0 days 00:00:17.581939,0.9276014221014081,RBF,0.1727403738681817,1.6783173007355066e-06,0.5,TPESampler,COMPLETE
9,0.9329374977442654,2025-04-24 20:57:38.577826,2025-04-24 20:57:50.715511,0 days 00:00:12.137685,93772.66997357036,Matern,0.0002610110292728976,0.027944672532437716,2.5,TPESampler,COMPLETE
10,0.9329374977485281,2025-04-24 20:57:49.619420,2025-04-24 20:57:56.426000,0 days 00:00:06.806580,0.35693312718298376,RBF,18292.458034844316,6.383212073723508e-06,0.5,TPESampler,COMPLETE
11,0.9329374976923267,2025-04-24 20:57:50.536722,2025-04-24 20:57:56.266718,0 days 00:00:05.729996,0.0011470109861978011,Matern,20.123908077497113,3.581110293060797e-07,2.5,TPESampler,COMPLETE
12,0.2623834784491581,2025-04-24 20:57:50.906486,2025-04-24 20:57:57.047512,0 days 00:00:06.141026,4.901465329313476e-07,Matern,0.1920643912513235,0.005104325403389845,0.5,TPESampler,COMPLETE
13,0.28251755402165496,2025-04-24 20:57:56.424581,2025-04-24 20:58:08.104774,0 days 00:00:11.680193,0.006053583488709491,RBF,1.0080611666546297,0.042094663569051935,2.5,TPESampler,COMPLETE
14,0.2825175420254021,2025-04-24 20:57:56.589985,2025-04-24 20:58:10.060606,0 days 00:00:13.470621,4.357365664533176e-06,RBF,7.784610903756648,0.45500037401976734,0.5,TPESampler,COMPLETE
15,0.9329374978680524,2025-04-24 20:57:57.255498,2025-04-24 20:58:05.239480,0 days 00:00:07.983982,0.0002819499804239925,Matern,0.01149203336434703,7.59689056096307e-05,0.5,TPESampler,COMPLETE
16,0.9329374971155003,2025-04-24 20:58:05.449661,2025-04-24 20:58:12.641312,0 days 00:00:07.191651,1.6086774903949267e-05,Matern,2602.3898798659875,2.77012013809366e-06,0.5,TPESampler,COMPLETE
17,0.2634372147210833,2025-04-24 20:58:08.297607,2025-04-24 20:58:15.860894,0 days 00:00:07.563287,6.399744351573078e-07,Matern,0.4294586540605583,0.02928744729239688,0.5,TPESampler,COMPLETE
18,0.26238350412942835,2025-04-24 20:58:10.282216,2025-04-24 20:58:14.589612,0 days 00:00:04.307396,0.15322725703481108,Matern,18.366560190053328,0.4647299804539658,0.5,TPESampler,COMPLETE
19,0.9928349895828595,2025-04-24 20:58:12.865594,2025-04-24 20:58:15.632325,0 days 00:00:02.766731,1.4217175924467217e-06,RBF,0.00017750835986428024,0.10547298213276787,0.5,TPESampler,COMPLETE
20,0.2678746923380371,2025-04-24 20:58:14.781277,2025-04-24 20:58:19.506014,0 days 00:00:04.724737,3.1271679247042727,Matern,817.3343396763598,0.087070669736286,1.5,TPESampler,COMPLETE
21,0.2623834919588474,2025-04-24 20:58:15.809787,2025-04-24 20:58:21.210673,0 days 00:00:05.400886,0.041675985554480065,Matern,7.105129136920007,0.06069458747231863,0.5,TPESampler,COMPLETE
22,0.26238352636885837,2025-04-24 20:58:16.043208,2025-04-24 20:58:19.760612,0 days 00:00:03.717404,15866.78658205419,Matern,1.0408931380049566,0.026615194187650078,0.5,TPESampler,COMPLETE
23,0.26238347937282064,2025-04-24 20:58:19.699963,2025-04-24 20:58:23.420561,0 days 00:00:03.720598,4816.7467896215285,Matern,13.827950368707636,0.19775768761260393,0.5,TPESampler,COMPLETE
24,0.9928350578917916,2025-04-24 20:58:19.929896,2025-04-24 20:58:22.954296,0 days 00:00:03.024400,64982.832325160474,Matern,0.10020467045904796,1.9001729902549337e-05,0.5,TPESampler,COMPLETE
25,0.2623837714060621,2025-04-24 20:58:21.406713,2025-04-24 20:58:26.708630,0 days 00:00:05.301917,0.014332719267811832,Matern,0.7966319831786745,0.06947139634083455,0.5,TPESampler,COMPLETE
26,0.26238347899574604,2025-04-24 20:58:23.310770,2025-04-24 20:58:28.622906,0 days 00:00:05.312136,9621.960235043647,Matern,17387.576861439742,0.015856258349376377,0.5,TPESampler,COMPLETE
27,0.282517602797519,2025-04-24 20:58:23.583230,2025-04-24 20:58:35.501827,0 days 00:00:11.918597,15613.285451311445,RBF,4.782570648777861,0.23555366355126714,1.5,TPESampler,COMPLETE
28,0.9329374955563334,2025-04-24 20:58:26.930704,2025-04-24 20:58:30.565953,0 days 00:00:03.635249,6.503403349440837,RBF,0.024200607076435676,0.6932539836222319,0.5,TPESampler,COMPLETE
29,0.932937497394598,2025-04-24 20:58:28.856590,2025-04-24 20:58:35.552478,0 days 00:00:06.695888,1121.4451509086527,RBF,9337.800425993633,0.01671542351838697,0.5,TPESampler,COMPLETE
30,0.26238344436827093,2025-04-24 20:58:30.794587,2025-04-24 20:58:36.581868,0 days 00:00:05.787281,894.9046864130526,Matern,26170.896109240093,0.0002233266540441877,0.5,TPESampler,COMPLETE
31,0.26238347590839556,2025-04-24 20:58:35.659759,2025-04-24 20:58:41.718321,0 days 00:00:06.058562,368.0134947828342,Matern,13950.204982862913,0.25179759056522155,0.5,TPESampler,COMPLETE
32,0.9329374977653468,2025-04-24 20:58:35.700035,2025-04-24 20:58:43.248867,0 days 00:00:07.548832,1815.2702757770048,Matern,9232.835161867271,1.0348410110626843e-06,2.5,TPESampler,COMPLETE
33,0.9928365554777514,2025-04-24 20:58:36.737265,2025-04-24 20:58:40.238336,0 days 00:00:03.501071,18024.269889388783,Matern,53748.263988932384,3.854484243482442e-06,0.5,TPESampler,COMPLETE
34,0.9329374982516351,2025-04-24 20:58:40.451655,2025-04-24 20:58:48.466268,0 days 00:00:08.014613,27414.4494192015,Matern,12364.606035321674,0.011119876125598635,2.5,TPESampler,COMPLETE
35,0.2623834748428606,2025-04-24 20:58:41.935653,2025-04-24 20:58:47.356011,0 days 00:00:05.420358,2800.9784095135014,Matern,50819.72308428748,0.030190686821599196,0.5,TPESampler,COMPLETE
36,0.9329374977458201,2025-04-24 20:58:43.484988,2025-04-24 20:58:47.076785,0 days 00:00:03.591797,1.3484231181863535,Matern,1409.4581165367285,7.967521222383537e-05,0.5,TPESampler,COMPLETE
37,0.26238309122673303,2025-04-24 20:58:47.294009,2025-04-24 20:58:52.382857,0 days 00:00:05.088848,4.514360713218883,Matern,48897.04344022795,0.14767226212925136,0.5,TPESampler,COMPLETE
38,0.2678747585344511,2025-04-24 20:58:47.578187,2025-04-24 20:58:54.179394,0 days 00:00:06.601207,44958.44708681815,Matern,9114.81420534651,0.2548641461951883,1.5,TPESampler,COMPLETE
39,0.9928002339795272,2025-04-24 20:58:48.685669,2025-04-24 20:58:52.464872,0 days 00:00:03.779203,0.0032874265711267357,RBF,0.00025075990662248914,2.5062064802397486e-09,2.5,TPESampler,COMPLETE
40,0.9329374980070372,2025-04-24 20:58:52.515592,2025-04-24 20:59:00.462040,0 days 00:00:07.946448,2.8412218076767592,Matern,7758.472212470627,0.0233232080069587,0.5,TPESampler,COMPLETE
41,0.9329374978074597,2025-04-24 20:58:52.615687,2025-04-24 20:59:00.397331,0 days 00:00:07.781644,1.0075998467310041,Matern,28387.035523708528,0.006978517668336374,2.5,TPESampler,COMPLETE
42,0.9329375134948077,2025-04-24 20:58:54.397517,2025-04-24 20:59:01.402787,0 days 00:00:07.005270,2.301340426125886,RBF,31768.689636876225,0.002059894169817883,1.5,TPESampler,COMPLETE
43,0.26238347936761147,2025-04-24 20:59:00.546422,2025-04-24 20:59:05.304084,0 days 00:00:04.757662,621.3034880390965,Matern,22472.402743299474,0.7474808046960552,0.5,TPESampler,COMPLETE
44,0.26238345680206554,2025-04-24 20:59:00.610323,2025-04-24 20:59:08.090505,0 days 00:00:07.480182,1.837647166924262e-07,Matern,0.13064859150177788,6.107229186573445e-05,0.5,TPESampler,COMPLETE
45,0.9329374966761665,2025-04-24 20:59:01.651369,2025-04-24 20:59:07.001802,0 days 00:00:05.350433,12.851863992484864,Matern,656.6317491542603,4.966641723760384e-07,1.5,TPESampler,COMPLETE
46,0.9329374979100209,2025-04-24 20:59:05.507698,2025-04-24 20:59:08.933776,0 days 00:00:03.426078,140.61864434015462,Matern,49103.19408534725,0.0009259003716299091,0.5,TPESampler,COMPLETE
47,0.93293749808277,2025-04-24 20:59:07.205983,2025-04-24 20:59:12.916496,0 days 00:00:05.710513,1.447211712673899e-07,RBF,0.012721757546525382,1.0211157728932708e-05,2.5,TPESampler,COMPLETE
48,0.9928365738766001,2025-04-24 20:59:08.297528,2025-04-24 20:59:13.566914,0 days 00:00:05.269386,0.04719237044395653,RBF,4697.898580763493,0.14364904443022283,0.5,TPESampler,COMPLETE
49,0.9329374989770757,2025-04-24 20:59:09.140575,2025-04-24 20:59:25.852849,0 days 00:00:16.712274,3.068300538267804e-06,RBF,4.727916467442318,1.227382938036332e-06,0.5,TPESampler,COMPLETE
50,0.9329374977419446,2025-04-24 20:59:13.124994,2025-04-24 20:59:29.970140,0 days 00:00:16.845146,1.6114472391406928e-05,Matern,0.013975692665581857,2.435131652215026e-07,0.5,TPESampler,COMPLETE
51,0.9329374965527105,2025-04-24 20:59:13.962185,2025-04-24 20:59:31.584547,0 days 00:00:17.622362,6.329025386234226e-07,Matern,0.012267809298640752,4.965569628920313e-06,0.5,TPESampler,COMPLETE
52,0.9329374965527105,2025-04-24 20:59:26.720458,2025-04-24 20:59:38.776651,0 days 00:00:12.056193,2.2839588093995294e-06,Matern,0.013322578136762036,1.34733226981322e-06,2.5,TPESampler,COMPLETE
53,0.9329359806513611,2025-04-24 20:59:30.661274,2025-04-24 20:59:41.176460,0 days 00:00:10.515186,9.1535242256737e-07,Matern,0.07604731566653461,0.0039784773221575274,0.5,TPESampler,COMPLETE
54,0.9928350583864083,2025-04-24 20:59:31.892216,2025-04-24 20:59:36.980621,0 days 00:00:05.088405,16287.297465695652,RBF,0.0007174246032674333,5.685055360477129e-09,0.5,TPESampler,COMPLETE
55,0.9928350583840251,2025-04-24 20:59:37.307372,2025-04-24 20:59:39.858733,0 days 00:00:02.551361,1.4906683536368578e-07,Matern,0.10243834651686919,0.9067864453747878,2.5,TPESampler,COMPLETE
56,0.9856584480078546,2025-04-24 20:59:38.999667,2025-04-24 20:59:51.783335,0 days 00:00:12.783668,1.0308084264211403e-06,Matern,0.1649935059659667,0.0005435139083055224,1.5,TPESampler,COMPLETE
57,0.9329374965984777,2025-04-24 20:59:40.090699,2025-04-24 20:59:47.793722,0 days 00:00:07.703023,2.578868489225109e-07,Matern,10.449214081329325,1.5669339720015468e-07,0.5,TPESampler,COMPLETE
58,0.26238347474999935,2025-04-24 20:59:41.399572,2025-04-24 20:59:48.297282,0 days 00:00:06.897710,5.468057868078906,Matern,8914.870693693067,0.037618396929699864,0.5,TPESampler,COMPLETE
59,0.9329374952872487,2025-04-24 20:59:48.006851,2025-04-24 20:59:57.706432,0 days 00:00:09.699581,1.1740480918676179e-07,Matern,0.035480251284343386,0.0003138807190333927,0.5,TPESampler,COMPLETE
60,0.26242919803358494,2025-04-24 20:59:48.481572,2025-04-24 20:59:59.886054,0 days 00:00:11.404482,0.001858540644495854,Matern,44075.92570652011,0.017846997885512327,0.5,TPESampler,COMPLETE
61,0.26238366774092137,2025-04-24 20:59:52.053195,2025-04-24 20:59:57.862367,0 days 00:00:05.809172,5.067527830720034,Matern,62566.39246112084,0.4749502156474917,0.5,TPESampler,COMPLETE
62,0.932937497966138,2025-04-24 20:59:57.940017,2025-04-24 21:00:04.492782,0 days 00:00:06.552765,6.434706978982012,Matern,45888.312939883595,0.0016229100156811627,1.5,TPESampler,COMPLETE
63,0.9329374977441969,2025-04-24 20:59:58.056247,2025-04-24 21:00:02.770783,0 days 00:00:04.714536,20.13479062159915,Matern,67459.0845076504,0.0030713964173365495,0.5,TPESampler,COMPLETE
64,0.9329374977319209,2025-04-24 21:00:00.134736,2025-04-24 21:00:06.684289,0 days 00:00:06.549553,0.18310733783460684,Matern,1.2012551369157198e-05,1.0999289273960186e-07,1.5,TPESampler,COMPLETE
65,0.9329374976422525,2025-04-24 21:00:02.995628,2025-04-24 21:00:10.585669,0 days 00:00:07.590041,2.815660316187568e-05,Matern,10.539680475118484,9.646137549465869e-05,0.5,TPESampler,COMPLETE
66,0.9329374971254317,2025-04-24 21:00:04.734419,2025-04-24 21:00:11.634380,0 days 00:00:06.899961,1490.6452794380184,RBF,691.4176625257392,4.15812308734096e-10,2.5,TPESampler,COMPLETE
67,0.26238347385146266,2025-04-24 21:00:06.934039,2025-04-24 21:00:11.777873,0 days 00:00:04.843834,92.80292947985377,Matern,742.5621212330514,0.0026105623170855053,0.5,TPESampler,COMPLETE
68,0.9928094868878884,2025-04-24 21:00:10.823334,2025-04-24 21:00:12.405579,0 days 00:00:01.582245,0.00017873275128513103,Matern,0.0004098317098997067,0.9302103498812107,0.5,TPESampler,COMPLETE
69,0.2623835074083531,2025-04-24 21:00:11.811587,2025-04-24 21:00:17.309230,0 days 00:00:05.497643,6372.167509813393,Matern,765.6970769791023,0.00027437212510912526,0.5,TPESampler,COMPLETE
70,0.2825175525788294,2025-04-24 21:00:12.019344,2025-04-24 21:00:22.286373,0 days 00:00:10.267029,0.0001939864614573667,RBF,0.7585158729586962,2.9257506357062505e-10,1.5,TPESampler,COMPLETE
71,0.2623834747819538,2025-04-24 21:00:12.628241,2025-04-24 21:00:17.586062,0 days 00:00:04.957821,104.03439948484426,Matern,620.8029441289729,0.02307092237123165,0.5,TPESampler,COMPLETE
72,0.2825175568952833,2025-04-24 21:00:17.538815,2025-04-24 21:00:22.612326,0 days 00:00:05.073511,271.82507693340807,RBF,3509.1618869789704,0.31019203314298716,2.5,TPESampler,COMPLETE
73,0.26238348885641477,2025-04-24 21:00:17.780332,2025-04-24 21:00:22.719813,0 days 00:00:04.939481,199.85047992017468,Matern,148.75373015024923,0.0019522825200453905,0.5,TPESampler,COMPLETE
74,0.2623835452346374,2025-04-24 21:00:22.540332,2025-04-24 21:00:27.489582,0 days 00:00:04.949250,12.984774391064784,Matern,75.71756907276517,0.04551856219439794,0.5,TPESampler,COMPLETE
75,0.26238346583057226,2025-04-24 21:00:22.827400,2025-04-24 21:00:28.575483,0 days 00:00:05.748083,72926.21459945718,Matern,1289.3409910904088,0.06675222814899967,0.5,TPESampler,COMPLETE
76,0.2623835142164991,2025-04-24 21:00:22.906373,2025-04-24 21:00:28.396790,0 days 00:00:05.490417,4465.737722000162,Matern,821.012721013912,0.08609033863807859,0.5,TPESampler,COMPLETE
77,0.2623836227154124,2025-04-24 21:00:27.744912,2025-04-24 21:00:33.682045,0 days 00:00:05.937133,194.32924775446526,Matern,62331.563642012865,0.09473675077069572,0.5,TPESampler,COMPLETE
78,0.9928365739772372,2025-04-24 21:00:28.603950,2025-04-24 21:00:32.323413,0 days 00:00:03.719463,1.2823366146875102e-07,RBF,34666.07456198046,8.597325474520517e-05,2.5,TPESampler,COMPLETE
79,0.9329375056580881,2025-04-24 21:00:28.799106,2025-04-24 21:00:35.925139,0 days 00:00:07.126033,1748.0183546562187,RBF,83280.33914347598,0.00015382056099248588,0.5,TPESampler,COMPLETE
80,0.9928344447311582,2025-04-24 21:00:32.632113,2025-04-24 21:00:36.653019,0 days 00:00:04.020906,34.24370210627595,Matern,5.133847697726831,3.2251897980287887e-10,0.5,TPESampler,COMPLETE
81,0.26238347204449664,2025-04-24 21:00:33.956901,2025-04-24 21:00:39.415908,0 days 00:00:05.459007,89090.75016954562,Matern,94.97818581490267,0.23285855973701716,0.5,TPESampler,COMPLETE
82,0.9329374996922302,2025-04-24 21:00:36.204177,2025-04-24 21:00:40.567507,0 days 00:00:04.363330,1.159184594797844,Matern,41496.16896657091,1.4928575975842335e-06,0.5,TPESampler,COMPLETE
83,0.2737566343970782,2025-04-24 21:00:36.916597,2025-04-24 21:00:41.836717,0 days 00:00:04.920120,227.58156796308234,Matern,3.492560442248806,0.01468328358928288,2.5,TPESampler,COMPLETE
84,0.28251754523266226,2025-04-24 21:00:39.676548,2025-04-24 21:00:45.379809,0 days 00:00:05.703261,996.9113381267038,RBF,13.971967195759929,0.04492047230081098,0.5,TPESampler,COMPLETE
85,0.26238347550399355,2025-04-24 21:00:40.808296,2025-04-24 21:00:45.297293,0 days 00:00:04.488997,14220.384133506735,Matern,47.887994298924035,0.004460762203564676,0.5,TPESampler,COMPLETE
86,0.26238391440353237,2025-04-24 21:00:42.142253,2025-04-24 21:00:45.505988,0 days 00:00:03.363735,4281.308862216333,Matern,23.08920142848346,0.38547330382705614,0.5,TPESampler,COMPLETE
87,0.26787476571890867,2025-04-24 21:00:45.456396,2025-04-24 21:00:51.819060,0 days 00:00:06.362664,42187.83627735957,Matern,166.58475541726,7.48041851888428e-05,1.5,TPESampler,COMPLETE
88,0.26238347537284057,2025-04-24 21:00:45.550048,2025-04-24 21:00:50.874624,0 days 00:00:05.324576,64548.88422888174,Matern,4201.194041233678,0.23629673577438334,0.5,TPESampler,COMPLETE
89,0.9928350502894738,2025-04-24 21:00:45.729860,2025-04-24 21:00:49.763747,0 days 00:00:04.033887,49648.80885075038,Matern,0.16053469318013017,0.0790639048602882,1.5,TPESampler,COMPLETE
90,0.9329374977455934,2025-04-24 21:00:50.012204,2025-04-24 21:00:57.204613,0 days 00:00:07.192409,0.09249475515963969,RBF,29310.509450022895,1.2758661802228092e-09,0.5,TPESampler,COMPLETE
91,0.9329374976024827,2025-04-24 21:00:51.115694,2025-04-24 21:00:55.019557,0 days 00:00:03.903863,0.11680241272867058,Matern,0.00046397070184160997,7.904152641042738e-05,2.5,TPESampler,COMPLETE
92,0.26238346409745567,2025-04-24 21:00:52.079947,2025-04-24 21:00:58.139241,0 days 00:00:06.059294,33697.8825313818,Matern,25176.092302614135,0.0002187916179551071,0.5,TPESampler,COMPLETE
93,0.2737565941932153,2025-04-24 21:00:55.267338,2025-04-24 21:01:01.908642,0 days 00:00:06.641304,13986.519595347274,Matern,121.28948023855877,0.5691487552415577,2.5,TPESampler,COMPLETE
94,0.26238348283597096,2025-04-24 21:00:57.470862,2025-04-24 21:01:02.891502,0 days 00:00:05.420640,57949.17154850095,Matern,3871.0564387747418,0.3522539039293182,0.5,TPESampler,COMPLETE
95,0.2623834747643423,2025-04-24 21:00:58.364048,2025-04-24 21:01:05.101446,0 days 00:00:06.737398,26923.055871444638,Matern,10532.389207610435,0.00016709666616393406,0.5,TPESampler,COMPLETE
96,0.9329374977430048,2025-04-24 21:01:02.165811,2025-04-24 21:01:06.130222,0 days 00:00:03.964411,54200.714067778936,Matern,1563.6130720668207,6.987237677518266e-10,1.5,TPESampler,COMPLETE
97,0.9329374977901067,2025-04-24 21:01:03.156638,2025-04-24 21:01:06.652092,0 days 00:00:03.495454,13.666213149632892,Matern,10254.453191553775,0.00027140260252501384,0.5,TPESampler,COMPLETE
98,0.26238347410235324,2025-04-24 21:01:05.376775,2025-04-24 21:01:11.616227,0 days 00:00:06.239452,91881.76665246942,Matern,3867.462512012288,0.0001043936944367377,0.5,TPESampler,COMPLETE
99,0.9928364799330043,2025-04-24 21:01:06.426199,2025-04-24 21:01:09.484561,0 days 00:00:03.058362,65349.62833987483,Matern,68.87797575092507,3.63102446662142e-08,0.5,TPESampler,COMPLETE
100,0.9329374976272429,2025-04-24 21:01:06.889558,2025-04-24 21:01:17.795931,0 days 00:00:10.906373,8.825515328791586e-06,Matern,16223.923925230634,5.306800363573579e-07,1.5,TPESampler,COMPLETE
101,0.2623834743281133,2025-04-24 21:01:09.737185,2025-04-24 21:01:16.543588,0 days 00:00:06.806403,10120.024252457937,Matern,63789.72534275231,5.979243347806273e-05,0.5,TPESampler,COMPLETE
102,0.9928365223728031,2025-04-24 21:01:11.874991,2025-04-24 21:01:15.304580,0 days 00:00:03.429589,56095.461335146654,Matern,761.3030488755284,8.00649997952422e-06,0.5,TPESampler,COMPLETE
103,0.9928365555095368,2025-04-24 21:01:15.585872,2025-04-24 21:01:19.007888,0 days 00:00:03.422016,30335.58863107395,Matern,9873.808472724528,3.331767763252739e-05,0.5,TPESampler,COMPLETE
104,0.2623834539173583,2025-04-24 21:01:16.809598,2025-04-24 21:01:22.831501,0 days 00:00:06.021903,2511.9624737664335,Matern,92310.93025096014,0.00014918002526713488,0.5,TPESampler,COMPLETE
105,0.2623834676775598,2025-04-24 21:01:18.059532,2025-04-24 21:01:24.230720,0 days 00:00:06.171188,34098.68687749048,Matern,52796.30586219054,4.774478095811044e-05,0.5,TPESampler,COMPLETE
106,0.932937497704891,2025-04-24 21:01:19.244712,2025-04-24 21:01:29.983686,0 days 00:00:10.738974,1.9896124754227108e-07,RBF,27644.132996956472,4.381241294951162e-10,0.5,TPESampler,COMPLETE
107,0.932937497714504,2025-04-24 21:01:23.095131,2025-04-24 21:01:27.005460,0 days 00:00:03.910329,205.14410183896416,Matern,85824.8051953604,0.00030199368658742176,0.5,TPESampler,COMPLETE
108,0.9928365539568188,2025-04-24 21:01:24.463585,2025-04-24 21:01:27.782261,0 days 00:00:03.318676,18610.85884885767,Matern,37408.18762799115,1.2247695701231217e-07,0.5,TPESampler,COMPLETE
109,0.2623835024630314,2025-04-24 21:01:27.336417,2025-04-24 21:01:34.653922,0 days 00:00:07.317505,25890.746320197275,Matern,43460.248468347214,0.000790730479759209,0.5,TPESampler,COMPLETE
110,0.9329374978438524,2025-04-24 21:01:27.989716,2025-04-24 21:01:38.202058,0 days 00:00:10.212342,6.6982076846092285e-06,Matern,31.91069890590813,0.0009542447952106058,2.5,TPESampler,COMPLETE
111,0.9329374977037546,2025-04-24 21:01:30.247184,2025-04-24 21:01:38.781205,0 days 00:00:08.534021,5797.713181707104,RBF,74165.55728756332,3.1541545034390465e-05,2.5,TPESampler,COMPLETE
112,0.9329374996622734,2025-04-24 21:01:34.922346,2025-04-24 21:01:42.561982,0 days 00:00:07.639636,472.7229253695251,Matern,49155.77849054606,1.7643812042560734e-05,0.5,TPESampler,COMPLETE
113,0.9329374956522081,2025-04-24 21:01:38.551684,2025-04-24 21:01:42.842994,0 days 00:00:04.291310,122.19362713610269,RBF,2.561236107068846e-05,0.01077842979861706,1.5,TPESampler,COMPLETE
