number,value,datetime_start,datetime_complete,duration,params_constant_value,params_kernel_type,params_length_scale,params_noise_level,params_nu,system_attrs_auto:sampler,state
228,0.9329374977465322,2025-04-24 21:05:20.693650,2025-04-24 21:05:29.075466,0 days 00:00:08.381816,0.001329490434090499,Matern,46105.91299138325,1.503827105312468e-06,2.5,TPESampler,COMPLETE
229,0.2623835147320358,2025-04-24 21:05:26.971973,2025-04-24 21:05:32.594003,0 days 00:00:05.622030,2156.1641582948387,Matern,30073.11182513783,0.001730561238988352,0.5,TPESampler,COMPLETE
230,0.9928365741158108,2025-04-24 21:05:29.025852,2025-04-24 21:05:33.969000,0 days 00:00:04.943148,0.00013257045847720817,RBF,50777.182376807716,0.07703380487070269,0.5,TPESampler,COMPLETE
231,0.9928346655711905,2025-04-24 21:05:29.296241,2025-04-24 21:05:31.563280,0 days 00:00:02.267039,3831.7000458569864,Matern,0.4132121265957046,0.0074211002926275905,0.5,TPESampler,COMPLETE
232,0.9928363775965009,2025-04-24 21:05:31.819528,2025-04-24 21:05:36.983341,0 days 00:00:05.163813,8.233983355150034e-05,Matern,10824.934378162669,0.15486398183000105,0.5,TPESampler,COMPLETE
233,0.26238349512346704,2025-04-24 21:05:32.877650,2025-04-24 21:05:39.856593,0 days 00:00:06.978943,0.15885366605642953,Matern,24342.390363278006,0.5121712237033443,0.5,TPESampler,COMPLETE
234,0.26787475833408314,2025-04-24 21:05:34.245086,2025-04-24 21:05:39.792407,0 days 00:00:05.547321,0.16068342759629145,Matern,124.49485088321305,0.15129398475927844,1.5,TPESampler,COMPLETE
235,0.9329374977428574,2025-04-24 21:05:37.205901,2025-04-24 21:05:44.342269,0 days 00:00:07.136368,2.172072163055514,RBF,98818.79353218917,4.836569987553328e-07,1.5,TPESampler,COMPLETE
236,0.9928365294055447,2025-04-24 21:05:39.974378,2025-04-24 21:05:46.136757,0 days 00:00:06.162379,0.0015077933896999532,Matern,69551.13502434343,0.04309894998619152,0.5,TPESampler,COMPLETE
237,0.26245333167804774,2025-04-24 21:05:40.033581,2025-04-24 21:05:50.363207,0 days 00:00:10.329626,0.031027200468624217,Matern,23598.433845450396,0.7808285702138281,0.5,TPESampler,COMPLETE
238,0.2623834557558859,2025-04-24 21:05:44.575260,2025-04-24 21:05:49.166926,0 days 00:00:04.591666,11.337900275628037,Matern,211.10699707781131,0.19861033512557907,0.5,TPESampler,COMPLETE
239,0.9329374976924524,2025-04-24 21:05:46.399726,2025-04-24 21:05:53.594778,0 days 00:00:07.195052,0.7051769908881627,Matern,20381.51008246332,0.03030689419774177,0.5,TPESampler,COMPLETE
240,0.26238349267874267,2025-04-24 21:05:49.400464,2025-04-24 21:05:53.934954,0 days 00:00:04.534490,7.303254192753486,Matern,12.193995646519404,0.11817767475409402,0.5,TPESampler,COMPLETE
241,0.9329374979273227,2025-04-24 21:05:50.623823,2025-04-24 21:05:53.886474,0 days 00:00:03.262651,3.707570251473372,Matern,0.03796344378676065,0.002754041218335443,0.5,TPESampler,COMPLETE
242,0.2623834753954236,2025-04-24 21:05:53.842193,2025-04-24 21:06:00.500621,0 days 00:00:06.658428,1.269006956713202,Matern,44426.68911650046,0.3424172840118993,0.5,TPESampler,COMPLETE
243,0.2623835030927189,2025-04-24 21:05:54.046390,2025-04-24 21:05:59.448095,0 days 00:00:05.401705,0.6748234046372406,Matern,164.13879186046162,0.7342076909718807,0.5,TPESampler,COMPLETE
244,0.9928350583838258,2025-04-24 21:05:54.138461,2025-04-24 21:05:57.442940,0 days 00:00:03.304479,151.7083575099693,Matern,1.2946463461591973e-05,2.501437894643604e-08,2.5,TPESampler,COMPLETE
245,0.26238345438292954,2025-04-24 21:05:57.731051,2025-04-24 21:06:02.225989,0 days 00:00:04.494938,66.98355549271082,Matern,113.1435098709084,0.03802298406726664,0.5,TPESampler,COMPLETE
246,0.9329374976192778,2025-04-24 21:05:59.711804,2025-04-24 21:06:02.996718,0 days 00:00:03.284914,312.54019089941244,Matern,46977.5889324471,8.107028399835125e-05,0.5,TPESampler,COMPLETE
247,0.992836450889239,2025-04-24 21:06:00.819428,2025-04-24 21:06:04.798642,0 days 00:00:03.979214,88.76175245557123,Matern,212.1979593501921,7.993012550940426e-06,0.5,TPESampler,COMPLETE
248,0.2623850673848308,2025-04-24 21:06:02.495518,2025-04-24 21:06:05.535405,0 days 00:00:03.039887,26.639187745354118,Matern,280.237246508817,0.13045637256298975,0.5,TPESampler,COMPLETE
249,0.9329374975326286,2025-04-24 21:06:03.296887,2025-04-24 21:06:08.272794,0 days 00:00:04.975907,0.0557763951448211,Matern,55.99661959152376,6.445763729758181e-08,0.5,TPESampler,COMPLETE
250,0.28251744871181855,2025-04-24 21:06:05.068971,2025-04-24 21:06:11.330320,0 days 00:00:06.261349,3563.957562519883,RBF,4847.1203941035565,0.4868107384272475,0.5,TPESampler,COMPLETE
251,0.26238346234606424,2025-04-24 21:06:05.740217,2025-04-24 21:06:10.872410,0 days 00:00:05.132193,38.07403326313928,Matern,13.503698927151413,0.01976349730146383,0.5,TPESampler,COMPLETE
252,0.26238348376609205,2025-04-24 21:06:08.540329,2025-04-24 21:06:13.919133,0 days 00:00:05.378804,10.013123051835487,Matern,609.9925883654843,0.001360069263289108,0.5,TPESampler,COMPLETE
253,0.26238348213775964,2025-04-24 21:06:11.140216,2025-04-24 21:06:15.465078,0 days 00:00:04.324862,222.26822048362223,Matern,375.36528780152884,0.006266375486296375,0.5,TPESampler,COMPLETE
254,0.26238364484339755,2025-04-24 21:06:11.579451,2025-04-24 21:06:17.006646,0 days 00:00:05.427195,224.20032891171195,Matern,22.411416333966315,0.1783781770229821,0.5,TPESampler,COMPLETE
255,0.2623834814995492,2025-04-24 21:06:14.179664,2025-04-24 21:06:19.082042,0 days 00:00:04.902378,90164.69092274335,Matern,464.1328979852744,0.0011037843908243818,0.5,TPESampler,COMPLETE
256,0.2623834750916097,2025-04-24 21:06:15.716894,2025-04-24 21:06:20.244098,0 days 00:00:04.527204,0.4580658304311822,Matern,7.559579338059345,0.013049596259975507,0.5,TPESampler,COMPLETE
257,0.2623834744071738,2025-04-24 21:06:17.257673,2025-04-24 21:06:23.907496,0 days 00:00:06.649823,82985.24965377549,Matern,46675.62402229114,0.0003130429515702473,0.5,TPESampler,COMPLETE
258,0.26238347447018334,2025-04-24 21:06:19.334923,2025-04-24 21:06:24.432347,0 days 00:00:05.097424,784.0519840484355,Matern,2.093752410487751,0.00405439502787953,0.5,TPESampler,COMPLETE
259,0.2623834542763578,2025-04-24 21:06:20.490943,2025-04-24 21:06:25.408548,0 days 00:00:04.917605,9.517044203486934,Matern,47.935323442556836,0.0019820485655751515,0.5,TPESampler,COMPLETE
260,0.2623834736345441,2025-04-24 21:06:24.159532,2025-04-24 21:06:29.370729,0 days 00:00:05.211197,74.17714815635257,Matern,1.3207607117271911,0.1754202112604111,0.5,TPESampler,COMPLETE
261,0.26238347459023537,2025-04-24 21:06:24.668053,2025-04-24 21:06:30.385737,0 days 00:00:05.717684,2523.5436246963213,Matern,482.39748250566043,0.1179036440767312,0.5,TPESampler,COMPLETE
262,0.2623834765419325,2025-04-24 21:06:25.661936,2025-04-24 21:06:32.021379,0 days 00:00:06.359443,0.3563293876583913,Matern,1.0995672383984567,3.164530277948875e-05,0.5,TPESampler,COMPLETE
263,0.2623835700241703,2025-04-24 21:06:29.628134,2025-04-24 21:06:34.344202,0 days 00:00:04.716068,17.865476799415006,Matern,843.8517353815669,0.04956456626401572,0.5,TPESampler,COMPLETE
264,0.2623834431244666,2025-04-24 21:06:30.678533,2025-04-24 21:06:35.106547,0 days 00:00:04.428014,31.13671762177385,Matern,28.455909322612335,0.014859554587440645,0.5,TPESampler,COMPLETE
265,0.2623834762032425,2025-04-24 21:06:32.282678,2025-04-24 21:06:36.526354,0 days 00:00:04.243676,20.091919128280853,Matern,269.3711310469786,0.0016238932030592638,0.5,TPESampler,COMPLETE
266,0.26238348834921277,2025-04-24 21:06:34.592221,2025-04-24 21:06:39.054784,0 days 00:00:04.462563,4.199854358213156,Matern,3.500959031429824,0.005160638037052952,0.5,TPESampler,COMPLETE
267,0.26238345659963114,2025-04-24 21:06:35.356856,2025-04-24 21:06:41.006120,0 days 00:00:05.649264,667.7296973989698,Matern,2560.100713907198,0.005788388647184295,0.5,TPESampler,COMPLETE
268,0.2623834763440589,2025-04-24 21:06:36.769464,2025-04-24 21:06:42.658950,0 days 00:00:05.889486,7887.807108964128,Matern,94908.2544664642,0.00014500949521072947,0.5,TPESampler,COMPLETE
269,0.2623834740481794,2025-04-24 21:06:39.312244,2025-04-24 21:06:46.331902,0 days 00:00:07.019658,1.23101189224925e-07,Matern,0.9316453135802073,7.982896338245215e-05,0.5,TPESampler,COMPLETE
270,0.26238347472747536,2025-04-24 21:06:41.268423,2025-04-24 21:06:46.302157,0 days 00:00:05.033734,483.9291849683666,Matern,2728.9764929964485,0.023270827928938954,0.5,TPESampler,COMPLETE
271,0.2623835463178346,2025-04-24 21:06:42.900453,2025-04-24 21:06:47.915785,0 days 00:00:05.015332,850.5866593865159,Matern,32424.909926006403,0.018745666772087017,0.5,TPESampler,COMPLETE
272,0.26238342117339464,2025-04-24 21:06:46.447961,2025-04-24 21:06:50.577337,0 days 00:00:04.129376,2.174051034126678,Matern,19.99644945691078,0.0019184673550316496,0.5,TPESampler,COMPLETE
273,0.2623834984187346,2025-04-24 21:06:46.494884,2025-04-24 21:06:51.028127,0 days 00:00:04.533243,0.6652690373227711,Matern,21.75420083527747,0.015630226866053545,0.5,TPESampler,COMPLETE
274,0.9928365555095355,2025-04-24 21:06:48.145262,2025-04-24 21:06:50.779327,0 days 00:00:02.634065,2007.5296266739904,Matern,55.409714152584655,0.007877769754016651,0.5,TPESampler,COMPLETE
275,0.9329374977061522,2025-04-24 21:06:50.786797,2025-04-24 21:06:54.008291,0 days 00:00:03.221494,0.08104627024040328,Matern,24.800064323494848,0.00012776293674551353,0.5,TPESampler,COMPLETE
276,0.2623834855086446,2025-04-24 21:06:50.952605,2025-04-24 21:06:55.636863,0 days 00:00:04.684258,10.127523204351945,Matern,12.89869904917289,0.0724177402259984,0.5,TPESampler,COMPLETE
277,0.9329374977480562,2025-04-24 21:06:51.256426,2025-04-24 21:06:54.777174,0 days 00:00:03.520748,0.7533725014074394,Matern,23.394179469620433,0.0007510116921334708,1.5,TPESampler,COMPLETE
278,0.26238347875763,2025-04-24 21:06:54.256079,2025-04-24 21:06:58.833604,0 days 00:00:04.577525,7.8052420115098,Matern,336.1690220619095,0.0003034930485148028,0.5,TPESampler,COMPLETE
279,0.9329374977515024,2025-04-24 21:06:55.077657,2025-04-24 21:07:04.657178,0 days 00:00:09.579521,1.772340571077558e-06,Matern,0.0059555904531816695,0.0005856291234871146,2.5,TPESampler,COMPLETE
280,0.2623835027000088,2025-04-24 21:06:55.915547,2025-04-24 21:07:00.904107,0 days 00:00:04.988560,5.322570879470079,Matern,213.33154178704572,0.002403378768251916,0.5,TPESampler,COMPLETE
281,0.26238347458924893,2025-04-24 21:06:59.093737,2025-04-24 21:07:04.684084,0 days 00:00:05.590347,6118.656429918009,Matern,868.8323253328848,0.0186808445840673,0.5,TPESampler,COMPLETE
282,0.9329374965527105,2025-04-24 21:07:01.188421,2025-04-24 21:07:06.611792,0 days 00:00:05.423371,1.8730081985527462e-06,RBF,0.008715759303129404,5.890257645568167e-09,2.5,TPESampler,COMPLETE
283,0.2825175465559511,2025-04-24 21:07:04.838968,2025-04-24 21:07:08.793484,0 days 00:00:03.954516,8.282745712751922,RBF,2.5361864356000035,0.05327848940239807,0.5,TPESampler,COMPLETE
284,0.2623834744611598,2025-04-24 21:07:04.911029,2025-04-24 21:07:10.859862,0 days 00:00:05.948833,64039.64208646177,Matern,3058.5836572279004,0.010686471707988717,0.5,TPESampler,COMPLETE
285,0.2623834858606113,2025-04-24 21:07:06.858611,2025-04-24 21:07:11.191236,0 days 00:00:04.332625,9.181752882531843,Matern,2.752130877409659,0.0019179473091439543,0.5,TPESampler,COMPLETE
286,0.26238347544868046,2025-04-24 21:07:09.050937,2025-04-24 21:07:14.041841,0 days 00:00:04.990904,113.83087017329524,Matern,153.36266675837606,0.004065529166127654,0.5,TPESampler,COMPLETE
287,0.2678746108481179,2025-04-24 21:07:11.144976,2025-04-24 21:07:17.223805,0 days 00:00:06.078829,2.218586100933986,Matern,0.15324363794218446,0.0422228929019268,1.5,TPESampler,COMPLETE
288,0.9329374991189291,2025-04-24 21:07:11.478596,2025-04-24 21:07:17.485656,0 days 00:00:06.007060,90295.3020468077,RBF,69439.79167582572,0.000938400145199943,0.5,TPESampler,COMPLETE
289,0.26238348278024576,2025-04-24 21:07:14.297668,2025-04-24 21:07:18.684297,0 days 00:00:04.386629,22.31003179463422,Matern,79.8946487838408,0.030991223934934232,0.5,TPESampler,COMPLETE
290,0.9329374977459457,2025-04-24 21:07:17.450091,2025-04-24 21:07:24.030237,0 days 00:00:06.580146,0.03628284276178153,Matern,44141.628827925415,0.00028051309790181407,0.5,TPESampler,COMPLETE
291,0.9329374976915323,2025-04-24 21:07:17.796231,2025-04-24 21:07:25.734673,0 days 00:00:07.938442,0.07829039648671769,Matern,446.9847494696524,0.017452642782231815,2.5,TPESampler,COMPLETE
292,0.2623836825918913,2025-04-24 21:07:18.917070,2025-04-24 21:07:23.377749,0 days 00:00:04.460679,0.7926783042090851,Matern,6.751624617706423,0.0002845180645050833,0.5,TPESampler,COMPLETE
293,0.9329374977457572,2025-04-24 21:07:23.627200,2025-04-24 21:07:28.456314,0 days 00:00:04.829114,33.09585489466915,Matern,48324.20230211379,0.013477964667449343,0.5,TPESampler,COMPLETE
294,0.9928342780179001,2025-04-24 21:07:24.266098,2025-04-24 21:07:27.655234,0 days 00:00:03.389136,1.11395260462641e-06,Matern,0.0009710079913955149,0.04499978829019785,1.5,TPESampler,COMPLETE
295,0.932937279593254,2025-04-24 21:07:26.020706,2025-04-24 21:07:29.819696,0 days 00:00:03.798990,1698.3138316529391,Matern,0.06640591543815447,0.0034544745078427946,0.5,TPESampler,COMPLETE
296,0.9928365739521627,2025-04-24 21:07:27.934928,2025-04-24 21:07:30.139028,0 days 00:00:02.204100,2.181233446532771e-06,RBF,4745.019908134883,0.12718177085833793,2.5,TPESampler,COMPLETE
297,0.9329374977444481,2025-04-24 21:07:28.695103,2025-04-24 21:07:31.880805,0 days 00:00:03.185702,977.7069321331758,RBF,3.725647391038759e-05,0.04965861941005766,0.5,TPESampler,COMPLETE
298,0.2623834499154237,2025-04-24 21:07:30.068610,2025-04-24 21:07:34.149965,0 days 00:00:04.081355,3.4549473295270703,Matern,576.2466374207667,0.34755249397211807,0.5,TPESampler,COMPLETE
299,0.9329374978913375,2025-04-24 21:07:30.385620,2025-04-24 21:07:35.190015,0 days 00:00:04.804395,4956.255454359178,Matern,9248.013475286112,0.0025947325928502075,1.5,TPESampler,COMPLETE
300,0.2623835831280188,2025-04-24 21:07:32.130681,2025-04-24 21:07:37.175915,0 days 00:00:05.045234,11.265213144435291,Matern,0.4647211820062189,0.00037289253603080367,0.5,TPESampler,COMPLETE
301,0.26238347462557365,2025-04-24 21:07:34.397350,2025-04-24 21:07:41.572849,0 days 00:00:07.175499,2.2452795277841497e-05,Matern,0.24659154452405346,3.6847983622879864e-05,0.5,TPESampler,COMPLETE
302,0.26238347543225204,2025-04-24 21:07:35.489047,2025-04-24 21:07:41.076764,0 days 00:00:05.587717,546.0562983273694,Matern,199.33569126668343,0.9285306764379874,0.5,TPESampler,COMPLETE
303,0.27375659756300236,2025-04-24 21:07:37.404220,2025-04-24 21:07:43.012451,0 days 00:00:05.608231,1215.051801989654,Matern,19.279743410931385,0.004696098218405547,2.5,TPESampler,COMPLETE
304,0.26238347472254536,2025-04-24 21:07:41.323411,2025-04-24 21:07:46.028637,0 days 00:00:04.705226,1.6141755151805453,Matern,59.686129873847875,0.4010447039541805,0.5,TPESampler,COMPLETE
305,0.932937497873574,2025-04-24 21:07:41.791239,2025-04-24 21:07:51.045838,0 days 00:00:09.254599,7.439244062935008e-05,RBF,4634.590320208329,7.251420179538298e-07,0.5,TPESampler,COMPLETE
306,0.9329374976719015,2025-04-24 21:07:43.258949,2025-04-24 21:07:47.977492,0 days 00:00:04.718543,0.29755922844557203,Matern,2064.63091792928,0.0015014519646818888,0.5,TPESampler,COMPLETE
307,0.26238347488118,2025-04-24 21:07:46.364371,2025-04-24 21:07:51.680157,0 days 00:00:05.315786,49.35247392310027,Matern,629.5600293395772,0.87595495861614,0.5,TPESampler,COMPLETE
308,0.2825175376137838,2025-04-24 21:07:48.219590,2025-04-24 21:07:54.880420,0 days 00:00:06.660830,0.002205009725399055,RBF,77.21955750174565,0.2480034080217796,0.5,TPESampler,COMPLETE
309,0.26238347334300033,2025-04-24 21:07:51.290151,2025-04-24 21:07:56.629025,0 days 00:00:05.338874,0.4304283733594532,Matern,2576.1380177431415,0.04345715420551244,0.5,TPESampler,COMPLETE
310,0.2623834803721663,2025-04-24 21:07:51.883789,2025-04-24 21:07:56.126727,0 days 00:00:04.242938,12.428696210111658,Matern,20.79491521778022,0.002417964523804509,0.5,TPESampler,COMPLETE
311,0.26238347248995547,2025-04-24 21:07:55.123131,2025-04-24 21:07:59.858052,0 days 00:00:04.734921,150.06752753005475,Matern,1595.1649269462232,0.00019465086529639987,0.5,TPESampler,COMPLETE
312,0.26238347427360326,2025-04-24 21:07:56.406106,2025-04-24 21:08:01.407377,0 days 00:00:05.001271,4.262098115829979,Matern,265.9172212645004,0.5787261195565386,0.5,TPESampler,COMPLETE
313,0.2623829487207998,2025-04-24 21:07:56.863601,2025-04-24 21:08:00.502951,0 days 00:00:03.639350,9.330976392897439,Matern,97.8612736435537,0.004382513602581957,0.5,TPESampler,COMPLETE
314,0.9329374977384776,2025-04-24 21:08:00.105294,2025-04-24 21:08:06.555341,0 days 00:00:06.450047,1367.3118242501364,Matern,38040.849545022116,0.000742451193441226,2.5,TPESampler,COMPLETE
315,0.26238347575232424,2025-04-24 21:08:00.779283,2025-04-24 21:08:05.399481,0 days 00:00:04.620198,35.90347742380755,Matern,0.8719556259872676,0.0032727978646321966,0.5,TPESampler,COMPLETE
316,0.262383476374276,2025-04-24 21:08:01.655670,2025-04-24 21:08:07.535901,0 days 00:00:05.880231,0.2964068062649097,Matern,74.36089602510955,0.013643338264264344,0.5,TPESampler,COMPLETE
317,0.2623834731475024,2025-04-24 21:08:05.654975,2025-04-24 21:08:09.697783,0 days 00:00:04.042808,5.833004894003801,Matern,143.34708083847286,0.005660224596363985,0.5,TPESampler,COMPLETE
318,0.26238363947372106,2025-04-24 21:08:06.817630,2025-04-24 21:08:12.415658,0 days 00:00:05.598028,0.005144388496748783,Matern,112.77478187081587,0.34807668600655284,0.5,TPESampler,COMPLETE
319,0.26238347436128134,2025-04-24 21:08:07.777875,2025-04-24 21:08:12.870140,0 days 00:00:05.092265,125.78249054050922,Matern,5.309472513287317,0.024403963305370185,0.5,TPESampler,COMPLETE
320,0.9928350583886163,2025-04-24 21:08:09.938941,2025-04-24 21:08:12.807576,0 days 00:00:02.868635,6181.551179513381,RBF,6.921810479873866e-05,4.172271537908313e-10,1.5,TPESampler,COMPLETE
321,0.2623834744037261,2025-04-24 21:08:12.663602,2025-04-24 21:08:16.912417,0 days 00:00:04.248815,56.96221236061106,Matern,162.48005197916132,0.0045492103975941075,0.5,TPESampler,COMPLETE
322,0.2623834234868704,2025-04-24 21:08:13.000216,2025-04-24 21:08:17.697124,0 days 00:00:04.696908,1.2658210114313444,Matern,22.99202706696029,5.008687818386312e-05,0.5,TPESampler,COMPLETE
323,0.2623834731687818,2025-04-24 21:08:13.127513,2025-04-24 21:08:18.872200,0 days 00:00:05.744687,156.06089488929504,Matern,89861.96549610251,0.18426616435459967,0.5,TPESampler,COMPLETE
324,0.262383478636768,2025-04-24 21:08:17.166220,2025-04-24 21:08:23.739262,0 days 00:00:06.573042,6.25069028204466e-07,Matern,0.10412460672683467,4.53014045632984e-05,0.5,TPESampler,COMPLETE
325,0.9329374977552394,2025-04-24 21:08:17.918379,2025-04-24 21:08:23.690759,0 days 00:00:05.772380,6.107877181591608,Matern,195.32112701170692,5.807782379901782e-06,0.5,TPESampler,COMPLETE
326,0.2623834748233866,2025-04-24 21:08:19.112506,2025-04-24 21:08:26.139759,0 days 00:00:07.027253,0.22290666828772923,Matern,27.882827897145606,0.0005846479158472302,0.5,TPESampler,COMPLETE
327,0.9329374977137084,2025-04-24 21:08:23.895296,2025-04-24 21:08:27.431372,0 days 00:00:03.536076,0.00022466246997771225,Matern,0.0007475636207845503,2.442158467181242e-09,2.5,TPESampler,COMPLETE
328,0.932937497746429,2025-04-24 21:08:23.945948,2025-04-24 21:08:31.081716,0 days 00:00:07.135768,25116.089297772047,RBF,10345.709514767583,3.083316867203538e-08,0.5,TPESampler,COMPLETE
329,0.9329374976706954,2025-04-24 21:08:26.388457,2025-04-24 21:08:33.196201,0 days 00:00:06.807744,0.04334117746027906,Matern,98292.2702172659,0.005674616647759099,0.5,TPESampler,COMPLETE
330,0.9329374966906263,2025-04-24 21:08:27.683753,2025-04-24 21:08:31.877901,0 days 00:00:04.194148,76.91726012233919,Matern,52.354952206583754,4.005237676399377e-05,1.5,TPESampler,COMPLETE
331,0.26238347192818595,2025-04-24 21:08:31.328700,2025-04-24 21:08:36.267321,0 days 00:00:04.938621,8.242945375159545,Matern,3.457277233126684,4.708595200755242e-05,0.5,TPESampler,COMPLETE
332,0.26238347506379855,2025-04-24 21:08:32.115946,2025-04-24 21:08:36.735340,0 days 00:00:04.619394,11.659467162520645,Matern,23.903476765877524,0.0001893235711489491,0.5,TPESampler,COMPLETE
333,0.9329374961056797,2025-04-24 21:08:33.429271,2025-04-24 21:08:36.791293,0 days 00:00:03.362022,254.57184230311563,RBF,103.92057796096627,2.364656381023174e-05,0.5,TPESampler,COMPLETE
334,0.2623833070561712,2025-04-24 21:08:36.517381,2025-04-24 21:08:41.215238,0 days 00:00:04.697857,0.0657500764955992,Matern,881.0871273961233,0.24881834467727668,0.5,TPESampler,COMPLETE
335,0.9329374977819898,2025-04-24 21:08:36.971700,2025-04-24 21:08:42.896195,0 days 00:00:05.924495,0.5449859592036416,Matern,672.2760559205582,0.013215654510730339,0.5,TPESampler,COMPLETE
336,0.9928350549941816,2025-04-24 21:08:37.018086,2025-04-24 21:08:40.066727,0 days 00:00:03.048641,471.34069383779484,Matern,0.12322443914991335,5.107336989034178e-06,0.5,TPESampler,COMPLETE
337,0.262383474473591,2025-04-24 21:08:40.307649,2025-04-24 21:08:45.075201,0 days 00:00:04.767552,187.46789002581627,Matern,5.151048966932206,0.0214808880914542,0.5,TPESampler,COMPLETE
338,0.9329374975092872,2025-04-24 21:08:41.468795,2025-04-24 21:08:45.040158,0 days 00:00:03.571363,0.12487412670992441,Matern,77.12699654926419,7.397055955729375e-05,0.5,TPESampler,COMPLETE
339,0.26238347467453216,2025-04-24 21:08:43.139179,2025-04-24 21:08:47.972668,0 days 00:00:04.833489,0.20537389923345695,Matern,9.24775773720792,0.01741749853030116,0.5,TPESampler,COMPLETE
340,0.26238346611127433,2025-04-24 21:08:45.198856,2025-04-24 21:08:50.912073,0 days 00:00:05.713217,360.2935985419224,Matern,7618.429924033799,0.00010880613612209758,0.5,TPESampler,COMPLETE
341,0.9329374977670157,2025-04-24 21:08:45.246236,2025-04-24 21:08:52.646534,0 days 00:00:07.400298,73.68356876482383,Matern,11613.859694283166,1.2163496967187765e-05,0.5,TPESampler,COMPLETE
342,0.262383392312599,2025-04-24 21:08:48.228853,2025-04-24 21:08:53.787281,0 days 00:00:05.558428,1.4314095712183088,Matern,493.157760593327,0.2886355759098921,0.5,TPESampler,COMPLETE
