number,value,datetime_start,datetime_complete,duration,params_constant_value,params_kernel_type,params_length_scale,params_noise_level,params_nu,system_attrs_auto:sampler,state
2059,0.2623834288933794,2025-04-24 22:06:37.507995,2025-04-24 22:06:44.130042,0 days 00:00:06.622047,5.560314572657559,Matern,225.87442730001575,0.8526896570340482,0.5,TPESampler,COMPLETE
2060,0.9329374970228448,2025-04-24 22:06:38.230110,2025-04-24 22:06:50.715440,0 days 00:00:12.485330,0.006274129022648114,Matern,3007.59278726081,0.0007797656122456244,1.5,TPESampler,COMPLETE
2061,0.9928332987021778,2025-04-24 22:06:38.294181,2025-04-24 22:06:44.292551,0 days 00:00:05.998370,79763.65684353505,Matern,0.021419404062054493,0.0004904317940622347,1.5,TPESampler,COMPLETE
2062,0.9329374977760939,2025-04-24 22:06:44.439042,2025-04-24 22:06:52.579171,0 days 00:00:08.140129,0.0027081284353821207,Matern,642.3237230781596,0.007696544289475395,0.5,TPESampler,COMPLETE
2063,0.9928364445431117,2025-04-24 22:06:44.647816,2025-04-24 22:06:48.272123,0 days 00:00:03.624307,44.45030414632208,Matern,256.68668765036995,1.1341059722443918e-05,0.5,TPESampler,COMPLETE
2064,0.2623834748384118,2025-04-24 22:06:48.517250,2025-04-24 22:06:56.903653,0 days 00:00:08.386403,4.773697423307924,Matern,0.11253849601601612,0.7947092582451832,0.5,TPESampler,COMPLETE
2065,0.2623834641961307,2025-04-24 22:06:50.930863,2025-04-24 22:06:56.146480,0 days 00:00:05.215617,0.19402369940446149,Matern,2298.523813646621,0.6442479539994519,0.5,TPESampler,COMPLETE
2066,0.26238348069319617,2025-04-24 22:06:52.830534,2025-04-24 22:06:58.416623,0 days 00:00:05.586089,0.7269814198955523,Matern,4498.30495467891,0.044353516699796605,0.5,TPESampler,COMPLETE
2067,0.9329374979216017,2025-04-24 22:06:56.394174,2025-04-24 22:07:01.122460,0 days 00:00:04.728286,8.750728923807442,Matern,87799.07565117883,0.0015373993341435104,0.5,TPESampler,COMPLETE
2068,0.26238341645693625,2025-04-24 22:06:57.121863,2025-04-24 22:07:01.153621,0 days 00:00:04.031758,0.24175244116339825,Matern,1.469794134442905,0.0002279362135510557,0.5,TPESampler,COMPLETE
2069,0.9329374978894583,2025-04-24 22:06:58.654287,2025-04-24 22:07:04.714008,0 days 00:00:06.059721,4.617797014796618,Matern,98246.44770915197,0.022839598508666875,0.5,TPESampler,COMPLETE
2070,0.2623837493051811,2025-04-24 22:07:01.301473,2025-04-24 22:07:05.495803,0 days 00:00:04.194330,0.027161012028230156,Matern,3.061008450652565,0.018212424822821,0.5,TPESampler,COMPLETE
2071,0.2623834745386311,2025-04-24 22:07:01.372305,2025-04-24 22:07:08.248947,0 days 00:00:06.876642,0.06021551153128503,Matern,7.402888574565953,0.01748572005910837,0.5,TPESampler,COMPLETE
2072,0.26238347232262604,2025-04-24 22:07:04.973081,2025-04-24 22:07:09.015449,0 days 00:00:04.042368,401.86765541293147,Matern,176.80401692461882,0.003976885630225983,0.5,TPESampler,COMPLETE
2073,0.2623834700304685,2025-04-24 22:07:05.714550,2025-04-24 22:07:10.883240,0 days 00:00:05.168690,36.71284326540095,Matern,95592.87146387868,0.9244209888277329,0.5,TPESampler,COMPLETE
2074,0.9928365740960172,2025-04-24 22:07:08.513047,2025-04-24 22:07:11.562688,0 days 00:00:03.049641,14479.66610215863,Matern,52.383385055376266,4.064479096839136e-06,1.5,TPESampler,COMPLETE
2075,0.9928365468085986,2025-04-24 22:07:09.267947,2025-04-24 22:07:13.550673,0 days 00:00:04.282726,0.013904300195482541,Matern,96618.35459132615,0.46778976005735623,0.5,TPESampler,COMPLETE
2076,0.9329374975633536,2025-04-24 22:07:11.132958,2025-04-24 22:07:16.722930,0 days 00:00:05.589972,863.1085897811835,Matern,53123.2679433148,0.05383683926402922,2.5,TPESampler,COMPLETE
2077,0.2623834367632721,2025-04-24 22:07:11.810573,2025-04-24 22:07:16.809938,0 days 00:00:04.999365,228.1851500146271,Matern,3.5543496463880504,0.03206757933769549,0.5,TPESampler,COMPLETE
2078,0.9329374965527105,2025-04-24 22:07:13.838022,2025-04-24 22:07:19.171567,0 days 00:00:05.333545,2.406434708689713e-07,RBF,1.5741152705835655e-05,8.48816984006703e-09,2.5,TPESampler,COMPLETE
2079,0.26238350665256616,2025-04-24 22:07:16.920139,2025-04-24 22:07:22.021502,0 days 00:00:05.101363,1.830930341008272,Matern,75.74684556175391,0.00463274092973945,0.5,TPESampler,COMPLETE
2080,0.26238350009345485,2025-04-24 22:07:17.084849,2025-04-24 22:07:21.970175,0 days 00:00:04.885326,2.344335355592988,Matern,42.17198469576536,0.0426326909709158,0.5,TPESampler,COMPLETE
2081,0.932937497724926,2025-04-24 22:07:19.437026,2025-04-24 22:07:29.453088,0 days 00:00:10.016062,0.19761153403635118,Matern,84892.60758525906,0.0632580897520239,0.5,TPESampler,COMPLETE
2082,0.9329374977908491,2025-04-24 22:07:22.157930,2025-04-24 22:07:32.288194,0 days 00:00:10.130264,0.0018361776354724963,Matern,206.10742537461167,0.049395747370799103,0.5,TPESampler,COMPLETE
2083,0.9928350583753369,2025-04-24 22:07:22.320821,2025-04-24 22:07:26.309439,0 days 00:00:03.988618,79699.67850268791,RBF,0.08388228028159857,0.0002451970741818621,0.5,TPESampler,COMPLETE
2084,0.2623834753039858,2025-04-24 22:07:26.552172,2025-04-24 22:07:32.203285,0 days 00:00:05.651113,0.2830034899719168,Matern,3492.9605188989603,0.7532410278694024,0.5,TPESampler,COMPLETE
2085,0.26238345525489687,2025-04-24 22:07:29.730981,2025-04-24 22:07:33.971704,0 days 00:00:04.240723,12.047924624827345,Matern,472.50775455328613,0.8756044958883,0.5,TPESampler,COMPLETE
2086,0.2623834452693346,2025-04-24 22:07:32.473670,2025-04-24 22:07:37.397408,0 days 00:00:04.923738,13.546476594960993,Matern,0.5766984455582923,0.8204935045447523,0.5,TPESampler,COMPLETE
2087,0.2623834819694778,2025-04-24 22:07:32.629998,2025-04-24 22:07:37.481234,0 days 00:00:04.851236,0.04508224187865402,Matern,111.31068870567756,0.9985581350201518,0.5,TPESampler,COMPLETE
2088,0.26238334257316476,2025-04-24 22:07:34.236950,2025-04-24 22:07:39.438190,0 days 00:00:05.201240,2.3900507123567576,Matern,2798.0844959460537,0.8526505904507498,0.5,TPESampler,COMPLETE
2089,0.267874757330476,2025-04-24 22:07:37.600320,2025-04-24 22:07:41.791731,0 days 00:00:04.191411,6.1068791260835,Matern,5.015365050538901,0.633016445026644,1.5,TPESampler,COMPLETE
2090,0.2678747196437132,2025-04-24 22:07:37.769327,2025-04-24 22:07:44.953944,0 days 00:00:07.184617,0.016560156392980693,Matern,511.79732480422473,0.3924705690015495,1.5,TPESampler,COMPLETE
2091,0.2623834410604757,2025-04-24 22:07:39.701033,2025-04-24 22:07:43.703851,0 days 00:00:04.002818,0.25945841249283785,Matern,1.0626085452097833,0.0924428180165855,0.5,TPESampler,COMPLETE
2092,0.2737565941065273,2025-04-24 22:07:42.038635,2025-04-24 22:07:54.856831,0 days 00:00:12.818196,6.757601531932131e-06,Matern,1.1937266992405897,0.4321539505525044,2.5,TPESampler,COMPLETE
2093,0.2623834471763878,2025-04-24 22:07:44.172936,2025-04-24 22:07:50.217098,0 days 00:00:06.044162,358.62799124856514,Matern,0.19878402087342223,0.01827136116944253,0.5,TPESampler,COMPLETE
2094,0.9329374965527105,2025-04-24 22:07:45.210861,2025-04-24 22:07:50.461978,0 days 00:00:05.251117,2.4850471189658013e-06,RBF,0.0021072387310981065,6.410291452839089e-10,1.5,TPESampler,COMPLETE
2095,0.992835013000624,2025-04-24 22:07:50.416430,2025-04-24 22:07:53.361312,0 days 00:00:02.944882,95017.58860553357,Matern,0.24043478015794895,6.849807512167852e-05,2.5,TPESampler,COMPLETE
2096,0.28251754328432876,2025-04-24 22:07:50.746834,2025-04-24 22:07:58.757976,0 days 00:00:08.011142,2203.070820136134,RBF,59613.51014295566,0.6570651867938285,0.5,TPESampler,COMPLETE
2097,0.262383477416318,2025-04-24 22:07:53.579148,2025-04-24 22:07:58.733046,0 days 00:00:05.153898,24.266013349179172,Matern,12.304866585500607,0.011990485281669775,0.5,TPESampler,COMPLETE
2098,0.9329374975192515,2025-04-24 22:07:55.122745,2025-04-24 22:07:58.808036,0 days 00:00:03.685291,102.68356497733112,RBF,18.446443250545872,3.2250878158545036e-10,2.5,TPESampler,COMPLETE
2099,0.26238349372439446,2025-04-24 22:07:58.908497,2025-04-24 22:08:03.356051,0 days 00:00:04.447554,126.11117301134094,Matern,4376.845048326362,0.04541600363798321,0.5,TPESampler,COMPLETE
2100,0.26238346327702144,2025-04-24 22:07:58.915721,2025-04-24 22:08:03.097374,0 days 00:00:04.181653,533.3686208765032,Matern,13.58616790743512,0.7981907683056819,0.5,TPESampler,COMPLETE
2101,0.9329374975384284,2025-04-24 22:07:59.453232,2025-04-24 22:08:07.306613,0 days 00:00:07.853381,0.0649977656723145,Matern,3758.386577647586,0.015639999539740164,0.5,TPESampler,COMPLETE
2102,0.26238346863561407,2025-04-24 22:08:03.324695,2025-04-24 22:08:07.748623,0 days 00:00:04.423928,0.36839199571616604,Matern,1.1567790058708367,0.04313003627864688,0.5,TPESampler,COMPLETE
2103,0.9329374977452249,2025-04-24 22:08:03.613538,2025-04-24 22:08:07.614737,0 days 00:00:04.001199,57710.07092695223,Matern,0.00403014330631368,0.06447196800313434,0.5,TPESampler,COMPLETE
2104,0.9928350583596737,2025-04-24 22:08:07.541714,2025-04-24 22:08:12.857455,0 days 00:00:05.315741,1079.6566236206634,Matern,0.011466220454514325,0.008071731918660882,0.5,TPESampler,COMPLETE
2105,0.9928365710354099,2025-04-24 22:08:07.914289,2025-04-24 22:08:14.515356,0 days 00:00:06.601067,16.687752368298817,Matern,1.1101998668695379,4.257525614092087e-06,1.5,TPESampler,COMPLETE
2106,0.26238345656559614,2025-04-24 22:08:08.031475,2025-04-24 22:08:15.753589,0 days 00:00:07.722114,1.7311164307451972,Matern,27.84820965671924,0.8886774080611973,0.5,TPESampler,COMPLETE
2107,0.2623835615789585,2025-04-24 22:08:13.130899,2025-04-24 22:08:18.422675,0 days 00:00:05.291776,0.040441622932283976,Matern,68.1189378478066,0.8535345177383757,0.5,TPESampler,COMPLETE
2108,0.9928323402830791,2025-04-24 22:08:14.777159,2025-04-24 22:08:17.809304,0 days 00:00:03.032145,1025.838416820539,Matern,0.2554298452860036,0.007954638041976153,0.5,TPESampler,COMPLETE
2109,0.27375665335721067,2025-04-24 22:08:16.041032,2025-04-24 22:08:20.335107,0 days 00:00:04.294075,38.10193037718406,Matern,1.0887573594669882,0.10861088897037428,2.5,TPESampler,COMPLETE
2110,0.9928350583807826,2025-04-24 22:08:18.048706,2025-04-24 22:08:20.757332,0 days 00:00:02.708626,55785.27156553463,Matern,0.04233243497871226,8.031109460490637e-05,0.5,TPESampler,COMPLETE
2111,0.26787477652264463,2025-04-24 22:08:18.679189,2025-04-24 22:08:25.564971,0 days 00:00:06.885782,0.00019356750189254433,Matern,2.122195398405323,0.7791730490684808,1.5,TPESampler,COMPLETE
2112,0.2623834769459819,2025-04-24 22:08:20.629310,2025-04-24 22:08:25.294706,0 days 00:00:04.665396,58.017293222018615,Matern,63.644824325607296,0.0008864032033785485,0.5,TPESampler,COMPLETE
2113,0.262383434598943,2025-04-24 22:08:21.046248,2025-04-24 22:08:26.961253,0 days 00:00:05.915005,0.0007344965635680006,Matern,1.0925181666707005,0.9093125216674125,0.5,TPESampler,COMPLETE
2114,0.2623834715438344,2025-04-24 22:08:25.525196,2025-04-24 22:08:30.519819,0 days 00:00:04.994623,1243.1460064544517,Matern,545.0908016079977,0.9504616997047695,0.5,TPESampler,COMPLETE
2115,0.9329374949120689,2025-04-24 22:08:25.902482,2025-04-24 22:08:30.516252,0 days 00:00:04.613770,60141.61576871609,Matern,0.08995201107455011,0.0036982512546508742,2.5,TPESampler,COMPLETE
2116,0.932937497747362,2025-04-24 22:08:27.207788,2025-04-24 22:08:30.962876,0 days 00:00:03.755088,0.08324592913941724,Matern,0.028148726306678504,0.001069612159745976,0.5,TPESampler,COMPLETE
2117,0.26238358441030923,2025-04-24 22:08:30.701541,2025-04-24 22:08:35.890262,0 days 00:00:05.188721,2.1224314783448337,Matern,1165.6326948823032,0.03779962797934477,0.5,TPESampler,COMPLETE
2118,0.93293749780598,2025-04-24 22:08:30.741217,2025-04-24 22:08:37.262794,0 days 00:00:06.521577,0.046479087936036736,Matern,6774.420512223468,0.0019451192996816978,0.5,TPESampler,COMPLETE
2119,0.9329374976686845,2025-04-24 22:08:31.183859,2025-04-24 22:08:40.057211,0 days 00:00:08.873352,0.014243427333881167,Matern,4729.31199414163,0.03263084077837333,0.5,TPESampler,COMPLETE
2120,0.2623834556045091,2025-04-24 22:08:36.176374,2025-04-24 22:08:40.150206,0 days 00:00:03.973832,0.9238643469069883,Matern,17.545334362236144,0.03953392926297424,0.5,TPESampler,COMPLETE
2121,0.2623833252353459,2025-04-24 22:08:37.517067,2025-04-24 22:08:42.648276,0 days 00:00:05.131209,723.8842151370065,Matern,18.157205421133103,0.034441252240975176,0.5,TPESampler,COMPLETE
2122,0.26238347306608734,2025-04-24 22:08:40.241433,2025-04-24 22:08:44.890025,0 days 00:00:04.648592,16.536791656672282,Matern,3.456149702354745,0.04776547247350181,0.5,TPESampler,COMPLETE
2123,0.26238346156388287,2025-04-24 22:08:40.310770,2025-04-24 22:08:44.596966,0 days 00:00:04.286196,219.7538434062406,Matern,3710.940669686489,0.05583914228674874,0.5,TPESampler,COMPLETE
2124,0.2623834747162115,2025-04-24 22:08:42.904438,2025-04-24 22:08:48.392192,0 days 00:00:05.487754,439.3382904260399,Matern,76320.132559417,0.0012847785631491047,0.5,TPESampler,COMPLETE
2125,0.2825175459514445,2025-04-24 22:08:44.849521,2025-04-24 22:08:49.186902,0 days 00:00:04.337381,5.608553170764584,RBF,7.1812932865924015,0.015134611253868498,0.5,TPESampler,COMPLETE
2126,0.26238352552352084,2025-04-24 22:08:45.142001,2025-04-24 22:08:49.808554,0 days 00:00:04.666553,0.6554565800447566,Matern,1.0541403671369123,0.06833759590353732,0.5,TPESampler,COMPLETE
2127,0.9928365700161037,2025-04-24 22:08:48.677054,2025-04-24 22:08:51.993196,0 days 00:00:03.316142,1.447687898418863e-07,RBF,1037.6409593366104,0.009882196919746532,2.5,TPESampler,COMPLETE
2128,0.26238347458208483,2025-04-24 22:08:49.420564,2025-04-24 22:08:56.526122,0 days 00:00:07.105558,444.6223192421813,Matern,108.58713109099907,0.037045579323935575,0.5,TPESampler,COMPLETE
2129,0.26238346676397417,2025-04-24 22:08:50.044951,2025-04-24 22:08:57.640469,0 days 00:00:07.595518,1.5516372759992474,Matern,264.6992390574605,0.003164917331854794,0.5,TPESampler,COMPLETE
2130,0.9329374979322664,2025-04-24 22:08:52.252736,2025-04-24 22:08:57.521176,0 days 00:00:05.268440,5.350117901467638,Matern,0.013961366217533595,0.002836659918356017,0.5,TPESampler,COMPLETE
2131,0.26238363921015245,2025-04-24 22:08:57.171445,2025-04-24 22:09:01.893528,0 days 00:00:04.722083,0.3974513457930631,Matern,0.4042621594878978,0.7036408445081701,0.5,TPESampler,COMPLETE
2132,0.9329374979005165,2025-04-24 22:08:57.831607,2025-04-24 22:09:05.560404,0 days 00:00:07.728797,1.3129449487440439,Matern,1390.1603815467286,0.0008452303629663271,2.5,TPESampler,COMPLETE
2133,0.26787476630812024,2025-04-24 22:08:57.876186,2025-04-24 22:09:05.632381,0 days 00:00:07.756195,0.01283446126726692,Matern,0.8867507121675622,0.0022314574056094116,1.5,TPESampler,COMPLETE
2134,0.262383472518245,2025-04-24 22:09:02.149392,2025-04-24 22:09:06.440551,0 days 00:00:04.291159,2.8243809724089353,Matern,117.86398681909415,0.6454733141360992,0.5,TPESampler,COMPLETE
2135,0.9928365515743106,2025-04-24 22:09:05.729329,2025-04-24 22:09:10.268888,0 days 00:00:04.539559,0.0022261019004574446,Matern,88282.96668433723,0.5899726534909131,0.5,TPESampler,COMPLETE
2136,0.9329374978082837,2025-04-24 22:09:05.868739,2025-04-24 22:09:13.590084,0 days 00:00:07.721345,3.3193820343671114,Matern,2704.6659970648407,0.03575145673106323,1.5,TPESampler,COMPLETE
2137,0.9928281145296318,2025-04-24 22:09:06.685236,2025-04-24 22:09:09.526865,0 days 00:00:02.841629,94688.71663277567,Matern,0.1598060346305778,0.0007549756107548646,0.5,TPESampler,COMPLETE
2138,0.26238344682974996,2025-04-24 22:09:09.783807,2025-04-24 22:09:20.015630,0 days 00:00:10.231823,1151.8233943649539,Matern,0.7348840268510902,0.08358363467432804,0.5,TPESampler,COMPLETE
2139,0.9329374980564419,2025-04-24 22:09:10.525868,2025-04-24 22:09:19.181162,0 days 00:00:08.655294,92443.27752101107,Matern,0.008774675744316887,0.04008566100093721,0.5,TPESampler,COMPLETE
2140,0.9329374967030967,2025-04-24 22:09:14.470150,2025-04-24 22:09:28.681920,0 days 00:00:14.211770,0.1432073024652128,Matern,6306.37075062062,0.03911815466389166,0.5,TPESampler,COMPLETE
2141,0.9329374980041037,2025-04-24 22:09:19.424074,2025-04-24 22:09:33.679503,0 days 00:00:14.255429,0.14415624284794268,Matern,705.7627009550599,0.024860225486119863,2.5,TPESampler,COMPLETE
2142,0.9329374974559806,2025-04-24 22:09:20.281550,2025-04-24 22:09:33.184725,0 days 00:00:12.903175,0.008891135129019446,Matern,0.016947205209278005,0.3219931158666754,2.5,TPESampler,COMPLETE
2143,0.2623834617719674,2025-04-24 22:09:29.372559,2025-04-24 22:09:36.031305,0 days 00:00:06.658746,0.018527683841315784,Matern,1.7549950747496188,0.935965430669953,0.5,TPESampler,COMPLETE
2144,0.26238346973311044,2025-04-24 22:09:33.418044,2025-04-24 22:09:38.123786,0 days 00:00:04.705742,1.084963073134865,Matern,2.3910803480714753,0.0002672420364778894,0.5,TPESampler,COMPLETE
2145,0.9329370847053735,2025-04-24 22:09:33.936537,2025-04-24 22:09:36.849357,0 days 00:00:02.912820,195.95426531467922,Matern,0.06933921149685081,0.9847024962501263,0.5,TPESampler,COMPLETE
2146,0.2623834363671192,2025-04-24 22:09:36.272240,2025-04-24 22:09:40.974883,0 days 00:00:04.702643,0.43689870196505565,Matern,76.98152509601645,0.9143723112899567,0.5,TPESampler,COMPLETE
2147,0.2623835317410294,2025-04-24 22:09:37.063161,2025-04-24 22:09:42.659962,0 days 00:00:05.596801,6.278355405407982,Matern,2116.779035181223,0.028189196622589115,0.5,TPESampler,COMPLETE
2148,0.26238347742415763,2025-04-24 22:09:38.392487,2025-04-24 22:09:44.295916,0 days 00:00:05.903429,1011.8586642707243,Matern,0.22767371934350106,0.0010780956449032786,0.5,TPESampler,COMPLETE
2149,0.26238347319726857,2025-04-24 22:09:41.221406,2025-04-24 22:09:46.883606,0 days 00:00:05.662200,0.180861823493376,Matern,65311.77316749511,0.07227151207037108,0.5,TPESampler,COMPLETE
2150,0.26238347504951726,2025-04-24 22:09:42.910783,2025-04-24 22:09:50.604599,0 days 00:00:07.693816,1.2553011585230085,Matern,21911.782060085974,0.9788031176553407,0.5,TPESampler,COMPLETE
2151,0.9329374982312256,2025-04-24 22:09:44.546012,2025-04-24 22:09:47.308969,0 days 00:00:02.762957,189.1149447471182,Matern,0.03726900781196738,0.04274963645495462,0.5,TPESampler,COMPLETE
2152,0.2623834670563492,2025-04-24 22:09:47.161519,2025-04-24 22:09:51.810552,0 days 00:00:04.649033,1.9406342151678748,Matern,8.427940073407873,0.7142434412953116,0.5,TPESampler,COMPLETE
2153,0.26238347473256035,2025-04-24 22:09:47.610226,2025-04-24 22:09:53.217268,0 days 00:00:05.607042,13.732085060019326,Matern,82019.50843412189,0.04028211105104535,0.5,TPESampler,COMPLETE
2154,0.26787474768862735,2025-04-24 22:09:50.855293,2025-04-24 22:09:59.610606,0 days 00:00:08.755313,190.87769545397154,Matern,80921.4838565739,0.24468866090576125,1.5,TPESampler,COMPLETE
2155,0.2623834680471908,2025-04-24 22:09:52.055812,2025-04-24 22:09:58.164905,0 days 00:00:06.109093,0.07898193790677162,Matern,37.79532857551529,0.03163760432412683,0.5,TPESampler,COMPLETE
2156,0.26238347386646077,2025-04-24 22:09:53.459544,2025-04-24 22:09:58.353799,0 days 00:00:04.894255,3.6612011753876983,Matern,21.72993367774072,0.0013430949982506267,0.5,TPESampler,COMPLETE
2157,0.26238352852840086,2025-04-24 22:09:58.352580,2025-04-24 22:10:02.860046,0 days 00:00:04.507466,43.684558373184345,Matern,1522.585713805037,0.8152065946245396,0.5,TPESampler,COMPLETE
2158,0.26238347560061065,2025-04-24 22:09:58.645938,2025-04-24 22:10:12.112960,0 days 00:00:13.467022,0.004189638795167921,Matern,0.09584311806290717,0.01972874397725293,0.5,TPESampler,COMPLETE
2159,0.9927830674030648,2025-04-24 22:09:59.826319,2025-04-24 22:10:03.192612,0 days 00:00:03.366293,0.0006072346401807883,Matern,5660.702592018886,0.012996782935932103,0.5,TPESampler,COMPLETE
2160,0.2623834806381912,2025-04-24 22:10:03.281964,2025-04-24 22:10:09.284461,0 days 00:00:06.002497,1.5500876501742693,Matern,652.110177690231,0.03464155195801643,0.5,TPESampler,COMPLETE
2161,0.2623834742998433,2025-04-24 22:10:03.442080,2025-04-24 22:10:08.559396,0 days 00:00:05.117316,0.3599209817175157,Matern,1358.8282895593268,0.03475379454714362,0.5,TPESampler,COMPLETE
2162,0.26238346785021993,2025-04-24 22:10:08.809255,2025-04-24 22:10:15.081904,0 days 00:00:06.272649,674.4502967112179,Matern,88275.02145945808,0.020024652611937914,0.5,TPESampler,COMPLETE
2163,0.26238347691508374,2025-04-24 22:10:09.534856,2025-04-24 22:10:14.670326,0 days 00:00:05.135470,29.747798615940738,Matern,11.256970875618316,0.036297538976104236,0.5,TPESampler,COMPLETE
2164,0.9928365494896334,2025-04-24 22:10:12.412070,2025-04-24 22:10:16.784001,0 days 00:00:04.371931,2.651047625338336,RBF,8715.370042415076,0.5777426636228333,0.5,TPESampler,COMPLETE
2165,0.2623834747904873,2025-04-24 22:10:14.931917,2025-04-24 22:10:23.089788,0 days 00:00:08.157871,3132.8371232081054,Matern,0.12145618065389244,0.9304811361514448,0.5,TPESampler,COMPLETE
2166,0.2623834540496398,2025-04-24 22:10:15.358316,2025-04-24 22:10:22.380281,0 days 00:00:07.021965,0.20236819868384587,Matern,3287.8768299726894,0.8951422403931282,0.5,TPESampler,COMPLETE
2167,0.9928364387191033,2025-04-24 22:10:17.056545,2025-04-24 22:10:20.057510,0 days 00:00:03.000965,3203.0170002214327,Matern,47.70478269351609,6.570790754637656e-07,0.5,TPESampler,COMPLETE
2168,0.2623834500172525,2025-04-24 22:10:20.353282,2025-04-24 22:10:25.185734,0 days 00:00:04.832452,1383.1355468102342,Matern,1.1496658338011108,0.02146762158572282,0.5,TPESampler,COMPLETE
2169,0.2623834379882947,2025-04-24 22:10:22.620007,2025-04-24 22:10:27.795024,0 days 00:00:05.175017,0.008003376285177732,Matern,149.66445856779404,0.07827655664206286,0.5,TPESampler,COMPLETE
2170,0.26238347826541203,2025-04-24 22:10:23.327779,2025-04-24 22:10:28.060343,0 days 00:00:04.732564,48.620489855539624,Matern,21.37170328499973,0.03362115271805307,0.5,TPESampler,COMPLETE
2171,0.2623834760857091,2025-04-24 22:10:25.445660,2025-04-24 22:10:31.837155,0 days 00:00:06.391495,0.6858718165635469,Matern,0.1438777033656257,0.03785800472687786,0.5,TPESampler,COMPLETE
2172,0.2623834514250577,2025-04-24 22:10:28.018768,2025-04-24 22:10:32.261706,0 days 00:00:04.242938,0.6197932632673726,Matern,12.971327822932667,0.8065300174810297,0.5,TPESampler,COMPLETE
