number,value,datetime_start,datetime_complete,duration,params_constant_value,params_kernel_type,params_length_scale,params_noise_level,params_nu,system_attrs_auto:sampler,state
803,0.2623834766430026,2025-04-24 21:24:43.987823,2025-04-24 21:24:50.336924,0 days 00:00:06.349101,3.8677437951404547,Matern,65523.79543887499,0.9522766453457512,0.5,TPESampler,COMPLETE
804,0.26238346778926697,2025-04-24 21:24:45.728092,2025-04-24 21:24:49.978458,0 days 00:00:04.250366,1.2207052012979605,Matern,0.9025166410765699,0.0009849207185249525,0.5,TPESampler,COMPLETE
805,0.2623833982576925,2025-04-24 21:24:47.627980,2025-04-24 21:24:52.268544,0 days 00:00:04.640564,86.58555474535919,Matern,1807.4734237322107,0.015583961179954855,0.5,TPESampler,COMPLETE
806,0.932937497745521,2025-04-24 21:24:50.218224,2025-04-24 21:24:55.535590,0 days 00:00:05.317366,0.040737897194447495,Matern,312.3706254871391,0.019513207966462942,0.5,TPESampler,COMPLETE
807,0.9329374998967864,2025-04-24 21:24:50.547461,2025-04-24 21:24:54.239565,0 days 00:00:03.692104,8.502346518403636,Matern,2753.3840130633266,0.00038476556804594337,0.5,TPESampler,COMPLETE
808,0.9928365740567388,2025-04-24 21:24:52.507767,2025-04-24 21:24:56.842193,0 days 00:00:04.334426,0.31095673054221284,Matern,16968.477122566077,0.5531509686974758,1.5,TPESampler,COMPLETE
809,0.26238347443324034,2025-04-24 21:24:54.478929,2025-04-24 21:24:59.723547,0 days 00:00:05.244618,66758.61142911726,Matern,6.368489183138942,0.6778765898764418,0.5,TPESampler,COMPLETE
810,0.2623834505602858,2025-04-24 21:24:55.781619,2025-04-24 21:25:00.502046,0 days 00:00:04.720427,1.4580390454270056,Matern,10.86342149956573,0.0660335593674387,0.5,TPESampler,COMPLETE
811,0.2623835139369635,2025-04-24 21:24:57.099318,2025-04-24 21:25:02.211917,0 days 00:00:05.112599,0.11879822894129914,Matern,99.3579003395935,0.6061654225669696,0.5,TPESampler,COMPLETE
812,0.9329374973323196,2025-04-24 21:24:59.976323,2025-04-24 21:25:07.676750,0 days 00:00:07.700427,42.83190522439724,Matern,1065.8803489706918,0.01791605688599706,1.5,TPESampler,COMPLETE
813,0.9329374977685744,2025-04-24 21:25:00.756102,2025-04-24 21:25:09.753531,0 days 00:00:08.997429,0.0037372701002772093,Matern,86678.22373740048,0.006624732777264949,0.5,TPESampler,COMPLETE
814,0.26238347027816805,2025-04-24 21:25:02.457968,2025-04-24 21:25:08.080595,0 days 00:00:05.622627,0.22059748544469487,Matern,375.99334744544285,0.08076979382883,0.5,TPESampler,COMPLETE
815,0.2623834740095285,2025-04-24 21:25:07.922716,2025-04-24 21:25:12.913028,0 days 00:00:04.990312,63.00983286646562,Matern,32.64364245159223,0.20508968678172154,0.5,TPESampler,COMPLETE
816,0.2737566045681182,2025-04-24 21:25:08.281078,2025-04-24 21:25:14.867266,0 days 00:00:06.586188,3229.5775292010967,Matern,48748.87718691298,0.130285236022451,2.5,TPESampler,COMPLETE
817,0.9329374977467796,2025-04-24 21:25:10.006292,2025-04-24 21:25:13.071105,0 days 00:00:03.064813,0.58669183647604,RBF,0.00010903182816254307,0.0003112052736491189,2.5,TPESampler,COMPLETE
818,0.9329374982671482,2025-04-24 21:25:13.122918,2025-04-24 21:25:18.312938,0 days 00:00:05.190020,27198.15116088189,RBF,16.88052034214669,1.1676521930006937e-10,0.5,TPESampler,COMPLETE
819,0.26238347526952954,2025-04-24 21:25:13.313181,2025-04-24 21:25:18.948892,0 days 00:00:05.635711,0.09739825205571176,Matern,640.2619669132484,0.9441453049425949,0.5,TPESampler,COMPLETE
820,0.26238347189823746,2025-04-24 21:25:15.107980,2025-04-24 21:25:19.760436,0 days 00:00:04.652456,1.311357538546325,Matern,94.2817904519087,0.0018641997889568178,0.5,TPESampler,COMPLETE
821,0.26238353463287495,2025-04-24 21:25:18.595674,2025-04-24 21:25:23.760725,0 days 00:00:05.165051,281.04612558179485,Matern,0.5032086508074923,0.01636904271987347,0.5,TPESampler,COMPLETE
822,0.9329374977458479,2025-04-24 21:25:19.164011,2025-04-24 21:25:25.077446,0 days 00:00:05.913435,0.07656844697492077,RBF,62.178999317152936,0.0053850848436560305,0.5,TPESampler,COMPLETE
823,0.26238347519826966,2025-04-24 21:25:19.984588,2025-04-24 21:25:24.835972,0 days 00:00:04.851384,39.4345160750896,Matern,848.2549210565205,0.9123952812464204,0.5,TPESampler,COMPLETE
824,0.9329374977458466,2025-04-24 21:25:24.006725,2025-04-24 21:25:31.566125,0 days 00:00:07.559400,0.32376052735165195,Matern,37124.685677933376,0.007042131131788428,0.5,TPESampler,COMPLETE
825,0.9329375041059231,2025-04-24 21:25:25.032670,2025-04-24 21:25:32.773948,0 days 00:00:07.741278,9.307813455592399e-07,RBF,5.099039882013554,2.5011356412338665e-08,2.5,TPESampler,COMPLETE
826,0.26238346219862,2025-04-24 21:25:25.313283,2025-04-24 21:25:30.846513,0 days 00:00:05.533230,1.0720275158787014,Matern,1018.7603456419579,0.7729469834225493,0.5,TPESampler,COMPLETE
827,0.2623834798762468,2025-04-24 21:25:31.063039,2025-04-24 21:25:35.392098,0 days 00:00:04.329059,103.99216780484633,Matern,1.2616012917508455,0.0014563059641472123,0.5,TPESampler,COMPLETE
828,0.9928350583881316,2025-04-24 21:25:31.802178,2025-04-24 21:25:35.226529,0 days 00:00:03.424351,74698.3111755794,Matern,0.0003337536736115556,1.747853712239199e-06,0.5,TPESampler,COMPLETE
829,0.9329374937510369,2025-04-24 21:25:33.036902,2025-04-24 21:25:36.001468,0 days 00:00:02.964566,0.575091896299763,Matern,0.07827092202426125,0.0006947186737196339,1.5,TPESampler,COMPLETE
830,0.26238343173463324,2025-04-24 21:25:35.394499,2025-04-24 21:25:39.680756,0 days 00:00:04.286257,22.02091744153116,Matern,34.523851054568546,0.5522024351900624,0.5,TPESampler,COMPLETE
831,0.932937498352534,2025-04-24 21:25:35.625078,2025-04-24 21:25:42.008202,0 days 00:00:06.383124,710.3735637628112,Matern,15386.029906785107,3.143534360758253e-10,0.5,TPESampler,COMPLETE
832,0.2623834747503654,2025-04-24 21:25:36.228639,2025-04-24 21:25:45.027517,0 days 00:00:08.798878,0.056261267074732155,Matern,86838.58742607411,0.1744494393217126,0.5,TPESampler,COMPLETE
833,0.2623834675236933,2025-04-24 21:25:39.929008,2025-04-24 21:25:44.426845,0 days 00:00:04.497837,1223.4401612162023,Matern,16.20957252149199,0.0014018549273084222,0.5,TPESampler,COMPLETE
834,0.2623834792316427,2025-04-24 21:25:42.269625,2025-04-24 21:25:47.067305,0 days 00:00:04.797680,7.107676519341651,Matern,2842.0598153895367,0.043937454055794654,0.5,TPESampler,COMPLETE
835,0.9329374977452646,2025-04-24 21:25:44.674176,2025-04-24 21:25:51.937652,0 days 00:00:07.263476,0.012227807760328674,Matern,101.852685684246,0.0025221665093195203,0.5,TPESampler,COMPLETE
836,0.9329374977513781,2025-04-24 21:25:45.230806,2025-04-24 21:25:51.863994,0 days 00:00:06.633188,0.14655123653361227,Matern,2492.821400417957,0.03426976393382299,0.5,TPESampler,COMPLETE
837,0.26238359437691494,2025-04-24 21:25:47.321201,2025-04-24 21:25:52.207950,0 days 00:00:04.886749,11.879749132874577,Matern,49.363296321637215,0.0045571907698698285,0.5,TPESampler,COMPLETE
838,0.26238350247869907,2025-04-24 21:25:52.033673,2025-04-24 21:25:56.952865,0 days 00:00:04.919192,7.376331632295155,Matern,0.4820507246648779,0.028453526956500087,0.5,TPESampler,COMPLETE
839,0.2623834747136174,2025-04-24 21:25:52.107346,2025-04-24 21:25:57.226243,0 days 00:00:05.118897,31751.01266019857,Matern,0.9355004114501936,0.0018887178526770592,0.5,TPESampler,COMPLETE
840,0.9928365229396929,2025-04-24 21:25:52.425133,2025-04-24 21:25:57.232130,0 days 00:00:04.806997,0.00012736199809213874,Matern,666.56019495768,0.09175166070322087,1.5,TPESampler,COMPLETE
841,0.9329374972466744,2025-04-24 21:25:57.184876,2025-04-24 21:26:04.615949,0 days 00:00:07.431073,42.98107916276151,Matern,72.86408512616224,0.0006114751489424433,2.5,TPESampler,COMPLETE
842,0.26238347753136176,2025-04-24 21:25:57.475911,2025-04-24 21:26:05.795717,0 days 00:00:08.319806,0.0018194983159836465,Matern,11.225238139795676,0.09066626801156391,0.5,TPESampler,COMPLETE
843,0.9329374977544284,2025-04-24 21:25:57.528295,2025-04-24 21:26:03.463985,0 days 00:00:05.935690,811.6223229242117,Matern,0.013541193632826624,0.000371148513830118,2.5,TPESampler,COMPLETE
844,0.26238350936823956,2025-04-24 21:26:03.695189,2025-04-24 21:26:11.173746,0 days 00:00:07.478557,0.008750625702641542,Matern,1014.682707371011,0.870708156488194,0.5,TPESampler,COMPLETE
845,0.2825175405262236,2025-04-24 21:26:04.850185,2025-04-24 21:26:10.112754,0 days 00:00:05.262569,237.3640338320471,RBF,1.4793815476363472,0.8266800951406088,0.5,TPESampler,COMPLETE
846,0.2623834438511086,2025-04-24 21:26:06.006011,2025-04-24 21:26:10.899784,0 days 00:00:04.893773,100.08591095147386,Matern,17.52012021553327,0.039222726526775484,0.5,TPESampler,COMPLETE
847,0.2623834707981402,2025-04-24 21:26:10.368284,2025-04-24 21:26:14.887587,0 days 00:00:04.519303,761.5693531912457,Matern,2.880855459036699,0.6397362235107569,0.5,TPESampler,COMPLETE
848,0.2623833366225593,2025-04-24 21:26:11.091565,2025-04-24 21:26:16.303865,0 days 00:00:05.212300,569.8056745847915,Matern,3664.247949803148,0.04424799227115654,0.5,TPESampler,COMPLETE
849,0.2623825965719976,2025-04-24 21:26:11.407501,2025-04-24 21:26:16.371884,0 days 00:00:04.964383,0.4929093759603945,Matern,26.25665462502924,0.8105691997081922,0.5,TPESampler,COMPLETE
850,0.26238371551777107,2025-04-24 21:26:15.138303,2025-04-24 21:26:21.285418,0 days 00:00:06.147115,1.9003001672450541,Matern,8103.843168475306,0.03429385460532862,0.5,TPESampler,COMPLETE
851,0.9329374977971402,2025-04-24 21:26:16.476088,2025-04-24 21:26:23.272498,0 days 00:00:06.796410,0.002110240399913667,RBF,2024.2772413646317,8.537811837045172e-08,1.5,TPESampler,COMPLETE
852,0.2623834750953279,2025-04-24 21:26:16.543306,2025-04-24 21:26:22.989782,0 days 00:00:06.446476,311.08698313582283,Matern,24691.678137899493,0.005112146155180242,0.5,TPESampler,COMPLETE
853,0.2623834745810377,2025-04-24 21:26:21.539776,2025-04-24 21:26:26.472252,0 days 00:00:04.932476,0.04185753557039951,Matern,2.979244626062238,0.1831451309166394,0.5,TPESampler,COMPLETE
854,0.9329374976348592,2025-04-24 21:26:23.233754,2025-04-24 21:26:29.083437,0 days 00:00:05.849683,1.555680997970407e-05,RBF,0.030631470498583776,8.325762315111185e-09,0.5,TPESampler,COMPLETE
855,0.2623834812017364,2025-04-24 21:26:23.502476,2025-04-24 21:26:27.771919,0 days 00:00:04.269443,1351.8606661775718,Matern,3993.688684925613,0.056697491055130604,0.5,TPESampler,COMPLETE
856,0.2623834619323003,2025-04-24 21:26:26.720955,2025-04-24 21:26:31.919835,0 days 00:00:05.198880,835.4988268527663,Matern,796.4598685703074,0.004910388638399872,0.5,TPESampler,COMPLETE
857,0.2623842350734579,2025-04-24 21:26:28.022325,2025-04-24 21:26:30.940512,0 days 00:00:02.918187,0.20112437507086434,Matern,3.7337419187516168,0.42204384701878006,0.5,TPESampler,COMPLETE
858,0.2623834651630807,2025-04-24 21:26:29.340341,2025-04-24 21:26:35.139187,0 days 00:00:05.798846,3463.4322738829555,Matern,5657.283751558058,0.03925613323451149,0.5,TPESampler,COMPLETE
859,0.26238347146073693,2025-04-24 21:26:31.158433,2025-04-24 21:26:35.928528,0 days 00:00:04.770095,0.08755624420851732,Matern,2.670633851140411,0.016964774721860806,0.5,TPESampler,COMPLETE
860,0.2678747541605769,2025-04-24 21:26:32.171562,2025-04-24 21:26:40.557716,0 days 00:00:08.386154,0.010975074629167147,Matern,0.9553117227748135,8.072168846670398e-06,1.5,TPESampler,COMPLETE
861,0.2623834881880108,2025-04-24 21:26:35.385751,2025-04-24 21:26:40.702015,0 days 00:00:05.316264,0.05885759184345113,Matern,33.630837416395615,0.5925200469166128,0.5,TPESampler,COMPLETE
862,0.262383483889918,2025-04-24 21:26:36.143931,2025-04-24 21:26:39.947863,0 days 00:00:03.803932,0.12475820903790014,Matern,5.867985449967791,0.7783074006137625,0.5,TPESampler,COMPLETE
863,0.9329374976610365,2025-04-24 21:26:40.211479,2025-04-24 21:26:45.577456,0 days 00:00:05.365977,1.454929980251688e-06,RBF,4.2478744154264965e-05,1.0627138581762756e-05,2.5,TPESampler,COMPLETE
864,0.26238347070526663,2025-04-24 21:26:40.786995,2025-04-24 21:26:46.362868,0 days 00:00:05.575873,2.2294773280284987,Matern,13.89985222423654,0.5642013938711427,0.5,TPESampler,COMPLETE
865,0.26238349585415577,2025-04-24 21:26:40.896494,2025-04-24 21:26:48.756876,0 days 00:00:07.860382,702.0669360909883,Matern,45443.325668954916,0.007295580458474456,0.5,TPESampler,COMPLETE
866,0.27375660167975313,2025-04-24 21:26:45.798530,2025-04-24 21:26:51.065076,0 days 00:00:05.266546,0.0939330371016717,Matern,40.44486379128418,0.04810896307027067,2.5,TPESampler,COMPLETE
867,0.9329374953129153,2025-04-24 21:26:46.590870,2025-04-24 21:26:50.901418,0 days 00:00:04.310548,0.25300433260551525,RBF,3.203322944436893,3.2239254790832415e-05,0.5,TPESampler,COMPLETE
868,0.26238347516067906,2025-04-24 21:26:48.986895,2025-04-24 21:26:54.322473,0 days 00:00:05.335578,50.920927212295496,Matern,351.8588113237373,0.0046374502636754,0.5,TPESampler,COMPLETE
869,0.9329374977641434,2025-04-24 21:26:51.092655,2025-04-24 21:26:56.290306,0 days 00:00:05.197651,0.2977291585319409,Matern,0.0026017487596943518,8.782187457066496e-10,2.5,TPESampler,COMPLETE
870,0.992835058381457,2025-04-24 21:26:51.245785,2025-04-24 21:26:54.398189,0 days 00:00:03.152404,90.76748154994519,Matern,1.7194996600529696e-05,1.7380657556730498e-07,0.5,TPESampler,COMPLETE
871,0.2623834754305028,2025-04-24 21:26:54.473110,2025-04-24 21:27:00.051943,0 days 00:00:05.578833,113.68039195624569,Matern,11.430699695436624,0.9566017492884553,0.5,TPESampler,COMPLETE
872,0.2825175512510059,2025-04-24 21:26:54.632122,2025-04-24 21:26:59.779267,0 days 00:00:05.147145,236.53907482697,RBF,174.33471611442806,0.051903017661818644,2.5,TPESampler,COMPLETE
873,0.2623834740970038,2025-04-24 21:26:56.503771,2025-04-24 21:27:01.681317,0 days 00:00:05.177546,305.12189889812794,Matern,974.7597641508039,0.024665729245668944,0.5,TPESampler,COMPLETE
874,0.2623835516831151,2025-04-24 21:27:00.010568,2025-04-24 21:27:04.801391,0 days 00:00:04.790823,500.76728865431284,Matern,565.6603600108446,0.09390120517714566,0.5,TPESampler,COMPLETE
875,0.9329374977698297,2025-04-24 21:27:00.298947,2025-04-24 21:27:06.761062,0 days 00:00:06.462115,0.033443345000254594,RBF,337.5225345218489,6.742125190357384e-08,0.5,TPESampler,COMPLETE
876,0.2623836590629762,2025-04-24 21:27:01.933701,2025-04-24 21:27:06.475280,0 days 00:00:04.541579,4.949408109769644,Matern,179.83009945266457,0.02741521627489721,0.5,TPESampler,COMPLETE
877,0.26238347947318824,2025-04-24 21:27:05.021785,2025-04-24 21:27:10.187923,0 days 00:00:05.166138,18.48840000149976,Matern,9543.775986827406,0.6483809715604351,0.5,TPESampler,COMPLETE
878,0.9928365461202485,2025-04-24 21:27:06.717301,2025-04-24 21:27:11.638308,0 days 00:00:04.921007,0.0009938398319085055,Matern,70139.52193151487,0.38934176695405964,0.5,TPESampler,COMPLETE
879,0.932937497749736,2025-04-24 21:27:06.998705,2025-04-24 21:27:10.812856,0 days 00:00:03.814151,0.29899682297708136,Matern,1.5093979623698002e-05,0.00048722105046834606,1.5,TPESampler,COMPLETE
880,0.2623835005745022,2025-04-24 21:27:10.405707,2025-04-24 21:27:15.011440,0 days 00:00:04.605733,3.674587963266164,Matern,3.2388351343211,0.9882009114231817,0.5,TPESampler,COMPLETE
881,0.9329374974210616,2025-04-24 21:27:11.013463,2025-04-24 21:27:19.581744,0 days 00:00:08.568281,2.6632469753377976,Matern,66646.31645709166,0.004803621889023057,0.5,TPESampler,COMPLETE
882,0.2623834767829615,2025-04-24 21:27:11.883467,2025-04-24 21:27:18.387014,0 days 00:00:06.503547,0.20006933781678812,Matern,21.984600242572107,0.00154018382192288,0.5,TPESampler,COMPLETE
883,0.26238351315186925,2025-04-24 21:27:15.265042,2025-04-24 21:27:21.412108,0 days 00:00:06.147066,0.005186448420099106,Matern,27.869143500534317,0.7427713909027643,0.5,TPESampler,COMPLETE
884,0.9329374977487734,2025-04-24 21:27:18.638078,2025-04-24 21:27:23.700770,0 days 00:00:05.062692,2.7831780489648903,Matern,681.3094832344799,5.673063159674651e-05,0.5,TPESampler,COMPLETE
885,0.26238360716232045,2025-04-24 21:27:19.826710,2025-04-24 21:27:25.212695,0 days 00:00:05.385985,1.0560817796282926,Matern,0.5160757826977016,0.031961377632373014,0.5,TPESampler,COMPLETE
886,0.2623834721396273,2025-04-24 21:27:21.671036,2025-04-24 21:27:27.125184,0 days 00:00:05.454148,53.49077783823828,Matern,56601.768285259386,0.12979719143674046,0.5,TPESampler,COMPLETE
887,0.2737565588509443,2025-04-24 21:27:23.946994,2025-04-24 21:27:28.765562,0 days 00:00:04.818568,7.739454828836827,Matern,1.5993456647364546,0.013168571920912791,2.5,TPESampler,COMPLETE
888,0.26238349352493734,2025-04-24 21:27:25.465543,2025-04-24 21:27:29.550572,0 days 00:00:04.085029,1.4864151304638755,Matern,13.778082435161952,0.04174873855432318,0.5,TPESampler,COMPLETE
889,0.26238347056322364,2025-04-24 21:27:27.371847,2025-04-24 21:27:32.036539,0 days 00:00:04.664692,10.19317195850281,Matern,202.2716064646315,0.9796866503699081,0.5,TPESampler,COMPLETE
890,0.26238347462456674,2025-04-24 21:27:29.033675,2025-04-24 21:27:34.884744,0 days 00:00:05.851069,99329.43414111868,Matern,0.49265867996361556,0.7135433341022368,0.5,TPESampler,COMPLETE
891,0.2623834745345875,2025-04-24 21:27:29.788746,2025-04-24 21:27:35.310809,0 days 00:00:05.522063,4.580706531634302,Matern,2047.400664460088,0.06787043290104461,0.5,TPESampler,COMPLETE
892,0.932937497749351,2025-04-24 21:27:32.273863,2025-04-24 21:27:37.338695,0 days 00:00:05.064832,10.841657280463195,RBF,8.365965844761629,9.761024771733904e-05,2.5,TPESampler,COMPLETE
893,0.2623834692301435,2025-04-24 21:27:35.135670,2025-04-24 21:27:40.696924,0 days 00:00:05.561254,37285.6707372469,Matern,1281.2660516684232,0.04320970308214691,0.5,TPESampler,COMPLETE
894,0.9928365492728728,2025-04-24 21:27:35.511656,2025-04-24 21:27:39.027954,0 days 00:00:03.516298,0.005333288250281596,Matern,86097.9013336368,0.9688201907804102,0.5,TPESampler,COMPLETE
895,0.9329374977653678,2025-04-24 21:27:37.594684,2025-04-24 21:27:44.368330,0 days 00:00:06.773646,0.23846220499479465,Matern,587.6193460247005,0.0223485798114289,0.5,TPESampler,COMPLETE
896,0.2623835122256854,2025-04-24 21:27:39.289536,2025-04-24 21:27:44.449214,0 days 00:00:05.159678,0.07206813388557722,Matern,177.28338295312227,0.8850555546541995,0.5,TPESampler,COMPLETE
897,0.26238348438199866,2025-04-24 21:27:40.956548,2025-04-24 21:27:55.769237,0 days 00:00:14.812689,1.1557050703169375e-05,Matern,0.7086532529065751,0.5066015908609872,0.5,TPESampler,COMPLETE
898,0.9329362755185219,2025-04-24 21:27:44.513918,2025-04-24 21:27:48.928436,0 days 00:00:04.414518,13.422176449238796,RBF,0.19347106649345672,0.003939650484394829,0.5,TPESampler,COMPLETE
899,0.26238348536775524,2025-04-24 21:27:44.655927,2025-04-24 21:27:51.442685,0 days 00:00:06.786758,20.67394797879745,Matern,104.23959905175323,0.000964552407115927,0.5,TPESampler,COMPLETE
900,0.2623834595778672,2025-04-24 21:27:49.166087,2025-04-24 21:27:54.788428,0 days 00:00:05.622341,0.04119558880802377,Matern,1024.679717264103,0.07351555523802394,0.5,TPESampler,COMPLETE
901,0.26238348099557823,2025-04-24 21:27:51.689047,2025-04-24 21:27:57.665430,0 days 00:00:05.976383,2.15216596196368,Matern,6710.235046199923,0.6257564954300395,0.5,TPESampler,COMPLETE
902,0.2623834742935408,2025-04-24 21:27:55.012330,2025-04-24 21:27:59.709471,0 days 00:00:04.697141,2.801231358720845,Matern,18.610338745566224,0.056833449621258095,0.5,TPESampler,COMPLETE
903,0.2623834610625086,2025-04-24 21:27:56.018636,2025-04-24 21:28:00.762438,0 days 00:00:04.743802,0.7044139324653306,Matern,3.544643020055925,0.001622842235503731,0.5,TPESampler,COMPLETE
904,0.9329374973301389,2025-04-24 21:27:57.915796,2025-04-24 21:28:06.550806,0 days 00:00:08.635010,0.019694713880035658,Matern,2766.1035075899094,0.004838491706589431,0.5,TPESampler,COMPLETE
905,0.2623834705438025,2025-04-24 21:27:59.961930,2025-04-24 21:28:05.818252,0 days 00:00:05.856322,1332.3668424846967,Matern,111.90024862294113,0.05501312539118917,0.5,TPESampler,COMPLETE
906,0.2623839704542108,2025-04-24 21:28:01.015550,2025-04-24 21:28:06.408695,0 days 00:00:05.393145,39.32066361542025,Matern,8076.383969355332,0.014256866843393235,0.5,TPESampler,COMPLETE
907,0.26238330295694523,2025-04-24 21:28:06.077845,2025-04-24 21:28:15.665719,0 days 00:00:09.587874,0.18433420910192866,Matern,84465.81278269902,0.5231948621708264,0.5,TPESampler,COMPLETE
908,0.2825174566514232,2025-04-24 21:28:06.627452,2025-04-24 21:28:10.417345,0 days 00:00:03.789893,0.450816550412487,RBF,19.55052929351036,0.08396482855421177,0.5,TPESampler,COMPLETE
909,0.932937496844583,2025-04-24 21:28:06.829732,2025-04-24 21:28:16.363286,0 days 00:00:09.533554,1.0959764167759522e-07,Matern,14.845826089035453,3.36201556840843e-05,2.5,TPESampler,COMPLETE
910,0.2623831187396673,2025-04-24 21:28:10.668707,2025-04-24 21:28:15.743653,0 days 00:00:05.074946,1.7710335323541022,Matern,25.305166292444376,0.892794317417869,0.5,TPESampler,COMPLETE
911,0.2623834819736166,2025-04-24 21:28:15.818271,2025-04-24 21:28:21.876345,0 days 00:00:06.058074,0.009084353379283105,Matern,13694.167782043809,0.06950053684597217,0.5,TPESampler,COMPLETE
912,0.26238349124810245,2025-04-24 21:28:15.982505,2025-04-24 21:28:21.850517,0 days 00:00:05.868012,0.21619292249590305,Matern,76514.82643285823,0.0841995199739759,0.5,TPESampler,COMPLETE
913,0.992835058286472,2025-04-24 21:28:16.619922,2025-04-24 21:28:18.699164,0 days 00:00:02.079242,2.0012964487418783e-07,RBF,0.00044691864783103267,0.6989354143813229,0.5,TPESampler,COMPLETE
914,0.9329374977449194,2025-04-24 21:28:18.945766,2025-04-24 21:28:22.586357,0 days 00:00:03.640591,0.013037604463896953,Matern,1.6497760455377378e-05,1.2942949222547463e-10,1.5,TPESampler,COMPLETE
915,0.9329374978966101,2025-04-24 21:28:22.029498,2025-04-24 21:28:30.081956,0 days 00:00:08.052458,0.06358687751055554,Matern,6401.233419254344,0.005899361180255284,1.5,TPESampler,COMPLETE
916,0.2623834491058903,2025-04-24 21:28:22.073637,2025-04-24 21:28:28.241211,0 days 00:00:06.167574,0.07898036615888591,Matern,31246.441183254497,0.182236776500007,0.5,TPESampler,COMPLETE
917,0.26238347421847025,2025-04-24 21:28:22.956425,2025-04-24 21:28:28.982469,0 days 00:00:06.026044,1.3022106477753415,Matern,67726.6480612359,0.22016409397594844,0.5,TPESampler,COMPLETE
