number,value,datetime_start,datetime_complete,duration,params_constant_value,params_kernel_type,params_length_scale,params_noise_level,params_nu,system_attrs_auto:sampler,state
1945,0.26238347317478966,2025-04-24 22:03:03.421501,2025-04-24 22:03:08.754875,0 days 00:00:05.333374,341.22690694344277,Matern,396.53587882667233,0.00015624770259295404,0.5,TPESampler,COMPLETE
1946,0.26238345618731324,2025-04-24 22:03:05.100802,2025-04-24 22:03:11.665721,0 days 00:00:06.564919,0.009037135893476723,Matern,194.3831888187283,0.8140922565961183,0.5,TPESampler,COMPLETE
1947,0.2623834724528282,2025-04-24 22:03:08.193818,2025-04-24 22:03:14.822281,0 days 00:00:06.628463,0.014636421085092286,Matern,0.42117898782616664,0.00027123609479570455,0.5,TPESampler,COMPLETE
1948,0.26238347329997425,2025-04-24 22:03:09.021406,2025-04-24 22:03:20.195452,0 days 00:00:11.174046,0.001373554982501364,Matern,82148.72142867328,0.01711083804854196,0.5,TPESampler,COMPLETE
1949,0.26238346776913585,2025-04-24 22:03:11.924704,2025-04-24 22:03:17.741031,0 days 00:00:05.816327,76.64299066433318,Matern,0.1885033837522422,0.022372223804334193,0.5,TPESampler,COMPLETE
1950,0.26238345242093003,2025-04-24 22:03:15.084676,2025-04-24 22:03:21.007454,0 days 00:00:05.922778,46.679580842359975,Matern,5.918457065185785,0.035966273098465194,0.5,TPESampler,COMPLETE
1951,0.9329374978797089,2025-04-24 22:03:18.007877,2025-04-24 22:03:23.041182,0 days 00:00:05.033305,0.20725549583621009,Matern,5.874220855768762,0.0019099187565974087,2.5,TPESampler,COMPLETE
1952,0.262382949586086,2025-04-24 22:03:20.512190,2025-04-24 22:03:26.326733,0 days 00:00:05.814543,9.147141283055674,Matern,31.666599620816385,0.05076070386850086,0.5,TPESampler,COMPLETE
1953,0.9329375012273157,2025-04-24 22:03:21.299715,2025-04-24 22:03:25.913519,0 days 00:00:04.613804,1912.7997724858214,Matern,0.02920257207484375,0.7604903610281409,0.5,TPESampler,COMPLETE
1954,0.9329374960230071,2025-04-24 22:03:23.401100,2025-04-24 22:03:29.033647,0 days 00:00:05.632547,0.17191472926025883,Matern,0.029316000296607254,0.04567858974098511,0.5,TPESampler,COMPLETE
1955,0.26238337379383264,2025-04-24 22:03:26.257002,2025-04-24 22:03:30.580959,0 days 00:00:04.323957,1.3920026188752246,Matern,17.46135459846033,0.007098443192770834,0.5,TPESampler,COMPLETE
1956,0.26238347676908524,2025-04-24 22:03:26.663216,2025-04-24 22:03:32.190019,0 days 00:00:05.526803,25.073606289645,Matern,119.48502818976225,0.009811216516531012,0.5,TPESampler,COMPLETE
1957,0.2623834854654961,2025-04-24 22:03:29.319103,2025-04-24 22:03:33.433407,0 days 00:00:04.114304,1.3787528896167216,Matern,50.703355830620986,0.20720320967817504,0.5,TPESampler,COMPLETE
1958,0.26238343902310335,2025-04-24 22:03:30.820898,2025-04-24 22:03:36.751653,0 days 00:00:05.930755,0.39865298860824905,Matern,78.48920066582166,0.0034813465839479817,0.5,TPESampler,COMPLETE
1959,0.26238362551382577,2025-04-24 22:03:32.461281,2025-04-24 22:03:36.708610,0 days 00:00:04.247329,9.357636486203257,Matern,141.10671127496775,0.03868516395923091,0.5,TPESampler,COMPLETE
1960,0.26238349894135465,2025-04-24 22:03:33.695324,2025-04-24 22:03:38.382660,0 days 00:00:04.687336,8.34294849521293,Matern,1.5916855831667265,0.051927285859529576,0.5,TPESampler,COMPLETE
1961,0.2623834624006918,2025-04-24 22:03:36.879592,2025-04-24 22:03:41.847691,0 days 00:00:04.968099,2.890348443509939,Matern,4.150879487468049,0.055054510040332176,0.5,TPESampler,COMPLETE
1962,0.26238347796268635,2025-04-24 22:03:36.921224,2025-04-24 22:03:42.119802,0 days 00:00:05.198578,1.7698581020483652,Matern,58.7856789162152,0.013756796505128996,0.5,TPESampler,COMPLETE
1963,0.26238347905754333,2025-04-24 22:03:38.640727,2025-04-24 22:03:43.317606,0 days 00:00:04.676879,24.532579723442772,Matern,1102.2131467986599,0.7662019738678141,0.5,TPESampler,COMPLETE
1964,0.26238347297295206,2025-04-24 22:03:42.056139,2025-04-24 22:03:46.792142,0 days 00:00:04.736003,115.36602769508684,Matern,210.46395941174862,0.0010160105982328369,0.5,TPESampler,COMPLETE
1965,0.26238346767405496,2025-04-24 22:03:42.365449,2025-04-24 22:03:47.079943,0 days 00:00:04.714494,0.1279473846282321,Matern,34.19178104020903,0.05413731479596863,0.5,TPESampler,COMPLETE
1966,0.9329374965407348,2025-04-24 22:03:43.568294,2025-04-24 22:03:47.226642,0 days 00:00:03.658348,0.1397749505929101,RBF,1.0924432772208866e-05,0.005466634927566326,0.5,TPESampler,COMPLETE
1967,0.26238347798850836,2025-04-24 22:03:47.040048,2025-04-24 22:03:51.886093,0 days 00:00:04.846045,1.731680828887755,Matern,25.848382066993313,0.02491679848830374,0.5,TPESampler,COMPLETE
1968,0.26238341599654436,2025-04-24 22:03:47.300842,2025-04-24 22:03:51.620980,0 days 00:00:04.320138,1.6274303511142354,Matern,2.374185665044015,0.004361989279776638,0.5,TPESampler,COMPLETE
1969,0.26238347851063376,2025-04-24 22:03:47.465955,2025-04-24 22:03:54.002682,0 days 00:00:06.536727,0.012602921128299135,Matern,0.9461568077244187,0.015816522036179587,0.5,TPESampler,COMPLETE
1970,0.26238346967292836,2025-04-24 22:03:51.854469,2025-04-24 22:03:56.476656,0 days 00:00:04.622187,1.7597000476305567,Matern,13.646816837058658,0.00014346541345171344,0.5,TPESampler,COMPLETE
1971,0.2678747320820855,2025-04-24 22:03:52.129283,2025-04-24 22:03:58.080123,0 days 00:00:05.950840,133.17218547372434,Matern,399.84716615665633,0.8446398565438807,1.5,TPESampler,COMPLETE
1972,0.2623834757284665,2025-04-24 22:03:54.260968,2025-04-24 22:03:59.293603,0 days 00:00:05.032635,107.63260706476858,Matern,1914.3725280388364,0.02324646698576674,0.5,TPESampler,COMPLETE
1973,0.9928365741161238,2025-04-24 22:03:56.733309,2025-04-24 22:04:02.982472,0 days 00:00:06.249163,0.025811850235198,Matern,74223.4731788333,0.05984072800483664,2.5,TPESampler,COMPLETE
1974,0.9329374977978476,2025-04-24 22:03:58.336728,2025-04-24 22:04:05.172067,0 days 00:00:06.835339,0.8678616889061831,Matern,98525.37783101478,0.008878645219675472,0.5,TPESampler,COMPLETE
1975,0.26238345820367853,2025-04-24 22:03:59.564221,2025-04-24 22:04:03.810196,0 days 00:00:04.245975,2.80569986238375,Matern,104.25402233072231,0.07473422974012808,0.5,TPESampler,COMPLETE
1976,0.2623834880681182,2025-04-24 22:04:03.249567,2025-04-24 22:04:08.103061,0 days 00:00:04.853494,6.0098070484367945,Matern,84.80469963916066,0.5845505730451085,0.5,TPESampler,COMPLETE
1977,0.26238347823603314,2025-04-24 22:04:04.083390,2025-04-24 22:04:08.749778,0 days 00:00:04.666388,5.549580265593565,Matern,7.718722878377407,0.9581564947015057,0.5,TPESampler,COMPLETE
1978,0.9329374977595742,2025-04-24 22:04:05.431117,2025-04-24 22:04:11.839140,0 days 00:00:06.408023,15.406235774242983,RBF,25924.520530320726,0.022957739172559524,0.5,TPESampler,COMPLETE
1979,0.26238346559947534,2025-04-24 22:04:08.360817,2025-04-24 22:04:15.657915,0 days 00:00:07.297098,0.014959933726055589,Matern,0.3442308325356319,0.9290080127466792,0.5,TPESampler,COMPLETE
1980,0.2623834761658039,2025-04-24 22:04:08.958518,2025-04-24 22:04:15.379100,0 days 00:00:06.420582,0.16748614108735302,Matern,144.27613637410656,0.03430004708944854,0.5,TPESampler,COMPLETE
1981,0.262383474733585,2025-04-24 22:04:12.080951,2025-04-24 22:04:17.965987,0 days 00:00:05.885036,0.9528587617372049,Matern,80180.35301651731,0.14489508810106227,0.5,TPESampler,COMPLETE
1982,0.9329374977307053,2025-04-24 22:04:15.614400,2025-04-24 22:04:20.897437,0 days 00:00:05.283037,0.30829096410499696,Matern,2160.329993231611,0.0003517624495978703,0.5,TPESampler,COMPLETE
1983,0.26238337096258446,2025-04-24 22:04:15.990466,2025-04-24 22:04:21.201988,0 days 00:00:05.211522,11.619021291477765,Matern,4.902327732008704,0.001236153385529371,0.5,TPESampler,COMPLETE
1984,0.959253485100009,2025-04-24 22:04:18.216238,2025-04-24 22:04:30.540249,0 days 00:00:12.324011,0.10292151408007777,Matern,81834.55090717193,0.5109561609835214,0.5,TPESampler,COMPLETE
1985,0.2623834732620038,2025-04-24 22:04:21.143375,2025-04-24 22:04:25.969640,0 days 00:00:04.826265,0.7269533893737873,Matern,7.916385782594773,0.9987984359340218,0.5,TPESampler,COMPLETE
1986,0.26238346718764327,2025-04-24 22:04:21.464980,2025-04-24 22:04:26.878688,0 days 00:00:05.413708,21.20430552151327,Matern,1973.5259832934219,0.07065930025898617,0.5,TPESampler,COMPLETE
1987,0.2623836405742526,2025-04-24 22:04:26.190112,2025-04-24 22:04:29.566148,0 days 00:00:03.376036,91.35277381491056,Matern,111.71370793636031,0.04026818649671343,0.5,TPESampler,COMPLETE
1988,0.9329374974583545,2025-04-24 22:04:27.174318,2025-04-24 22:04:34.202492,0 days 00:00:07.028174,13.391812309274192,RBF,351.8111488339535,1.6209682593350904e-06,2.5,TPESampler,COMPLETE
1989,0.9329374972418861,2025-04-24 22:04:30.005704,2025-04-24 22:04:37.911973,0 days 00:00:07.906269,0.0005602408443327894,Matern,41.6232776022367,0.047506563434542966,0.5,TPESampler,COMPLETE
1990,0.26238348029627684,2025-04-24 22:04:30.808199,2025-04-24 22:04:36.047738,0 days 00:00:05.239539,1.2768718430916894,Matern,0.26196584269644624,0.04320919544879669,0.5,TPESampler,COMPLETE
1991,0.9329374975545625,2025-04-24 22:04:34.456672,2025-04-24 22:04:38.185377,0 days 00:00:03.728705,27.823503961713815,Matern,0.034735426117335454,0.8943332225096893,0.5,TPESampler,COMPLETE
1992,0.26238349848370945,2025-04-24 22:04:36.294044,2025-04-24 22:04:41.154093,0 days 00:00:04.860049,26.299226382893863,Matern,23.386067627759694,0.03839363889499323,0.5,TPESampler,COMPLETE
1993,0.26238348905334513,2025-04-24 22:04:38.180162,2025-04-24 22:04:43.038342,0 days 00:00:04.858180,0.030389186014791045,Matern,1928.4541920179383,0.07868025609073173,0.5,TPESampler,COMPLETE
1994,0.9329374979698188,2025-04-24 22:04:38.423516,2025-04-24 22:04:45.430278,0 days 00:00:07.006762,0.1110037268009774,RBF,28.510951869936516,0.011678313172942007,0.5,TPESampler,COMPLETE
1995,0.26238344226250593,2025-04-24 22:04:41.401433,2025-04-24 22:04:45.494861,0 days 00:00:04.093428,4.897614857903037,Matern,3793.893483947319,0.5312497833107966,0.5,TPESampler,COMPLETE
1996,0.26238348882164764,2025-04-24 22:04:43.279034,2025-04-24 22:04:47.782132,0 days 00:00:04.503098,0.37028828896130567,Matern,305.88086734723095,0.8796031693635948,0.5,TPESampler,COMPLETE
1997,0.2623834883683834,2025-04-24 22:04:45.636382,2025-04-24 22:04:50.591597,0 days 00:00:04.955215,15.27825232263084,Matern,153.97473426279055,0.807453856310745,0.5,TPESampler,COMPLETE
1998,0.2623834525098424,2025-04-24 22:04:45.674913,2025-04-24 22:04:49.924351,0 days 00:00:04.249438,0.4608442656056529,Matern,1.8804770049733313,0.9319712813211395,0.5,TPESampler,COMPLETE
1999,0.26238349297869223,2025-04-24 22:04:48.054072,2025-04-24 22:04:54.197646,0 days 00:00:06.143574,102.14724281991337,Matern,0.11098467450037325,0.0005944811796801598,0.5,TPESampler,COMPLETE
2000,0.9928364425717021,2025-04-24 22:04:50.208251,2025-04-24 22:04:54.685302,0 days 00:00:04.477051,0.0009576390734209441,Matern,17464.371458030902,0.8162442939290049,0.5,TPESampler,COMPLETE
2001,0.2825174865208337,2025-04-24 22:04:50.865399,2025-04-24 22:04:55.799694,0 days 00:00:04.934295,425.6255598106963,RBF,590.2542161718594,0.07397667013308702,0.5,TPESampler,COMPLETE
2002,0.27375659879523234,2025-04-24 22:04:54.429445,2025-04-24 22:04:59.537001,0 days 00:00:05.107556,11.136565338875021,Matern,35.512741905821684,0.0090603762551003,2.5,TPESampler,COMPLETE
2003,0.992835024313069,2025-04-24 22:04:54.914696,2025-04-24 22:04:57.556434,0 days 00:00:02.641738,5.892473065558305e-06,RBF,0.014941815916124934,0.13872441870917357,2.5,TPESampler,COMPLETE
2004,0.2623834642595528,2025-04-24 22:04:56.072664,2025-04-24 22:05:01.041845,0 days 00:00:04.969181,3.3349729710044196,Matern,5329.491065203533,0.8640801865767807,0.5,TPESampler,COMPLETE
2005,0.27375662279899593,2025-04-24 22:04:57.783461,2025-04-24 22:05:03.415048,0 days 00:00:05.631587,17559.949382540402,Matern,587.703776613368,0.6276898353258341,2.5,TPESampler,COMPLETE
2006,0.932937498548024,2025-04-24 22:04:59.789515,2025-04-24 22:05:09.428443,0 days 00:00:09.638928,3.606521631955866e-07,Matern,4.6976118868642474e-05,0.00023209144982528187,2.5,TPESampler,COMPLETE
2007,0.26238345528471957,2025-04-24 22:05:01.336705,2025-04-24 22:05:07.563898,0 days 00:00:06.227193,1.875997361781636,Matern,0.136348961197789,0.012724792350459235,0.5,TPESampler,COMPLETE
2008,0.2623834075330084,2025-04-24 22:05:03.666038,2025-04-24 22:05:08.250929,0 days 00:00:04.584891,32.5114963600351,Matern,52.31630299815953,0.02993230594121878,0.5,TPESampler,COMPLETE
2009,0.9329374976679646,2025-04-24 22:05:07.859763,2025-04-24 22:05:17.088508,0 days 00:00:09.228745,5.295117027073523e-07,RBF,67.41787723279204,6.896924971381611e-06,2.5,TPESampler,COMPLETE
2010,0.9329374975955824,2025-04-24 22:05:08.481405,2025-04-24 22:05:13.444731,0 days 00:00:04.963326,8.454725517194717,Matern,3911.7412496753245,0.0036547551587579235,0.5,TPESampler,COMPLETE
2011,0.26238347356913716,2025-04-24 22:05:09.659472,2025-04-24 22:05:13.972372,0 days 00:00:04.312900,1.9124511729045355,Matern,2.4553363272390083,0.023825906835508878,0.5,TPESampler,COMPLETE
2012,0.9329374975926356,2025-04-24 22:05:13.681774,2025-04-24 22:05:22.323888,0 days 00:00:08.642114,0.014362210877244288,Matern,88081.16910648429,0.01723782687283439,0.5,TPESampler,COMPLETE
2013,0.2825175399240206,2025-04-24 22:05:14.296807,2025-04-24 22:05:19.139794,0 days 00:00:04.842987,789.4418325639762,RBF,8.01282573224476,0.003557737926173225,0.5,TPESampler,COMPLETE
2014,0.26238347746254537,2025-04-24 22:05:17.338300,2025-04-24 22:05:21.938367,0 days 00:00:04.600067,0.2538469659854813,Matern,99.87020048281934,0.8454056724239345,0.5,TPESampler,COMPLETE
2015,0.26238353374014595,2025-04-24 22:05:19.381376,2025-04-24 22:05:23.289525,0 days 00:00:03.908149,1.9444455173682729,Matern,15.147896698755737,0.032987125755328486,0.5,TPESampler,COMPLETE
2016,0.9329374974363385,2025-04-24 22:05:22.184098,2025-04-24 22:05:26.041415,0 days 00:00:03.857317,7.573187393478614e-05,RBF,0.000105784145328817,2.5951983720014705e-09,0.5,TPESampler,COMPLETE
2017,0.932937497732826,2025-04-24 22:05:22.566401,2025-04-24 22:05:29.491889,0 days 00:00:06.925488,0.04412038385799051,Matern,1733.461085343821,0.05390428071920306,0.5,TPESampler,COMPLETE
2018,0.26238349127446886,2025-04-24 22:05:23.569097,2025-04-24 22:05:27.815963,0 days 00:00:04.246866,144.55494101823945,Matern,33357.3196000829,0.8919342788692698,0.5,TPESampler,COMPLETE
2019,0.2623834784666856,2025-04-24 22:05:26.321930,2025-04-24 22:05:32.985318,0 days 00:00:06.663388,0.06541392255457855,Matern,3.1383703161942496,0.002877001267464994,0.5,TPESampler,COMPLETE
2020,0.932937497745801,2025-04-24 22:05:28.060544,2025-04-24 22:05:35.576861,0 days 00:00:07.516317,3595.3207906385937,RBF,8983.429838797536,1.398826040431463e-05,0.5,TPESampler,COMPLETE
2021,0.2623834647021519,2025-04-24 22:05:29.776386,2025-04-24 22:05:34.487775,0 days 00:00:04.711389,0.4567138844452784,Matern,142.1134052898151,0.020467661236012888,0.5,TPESampler,COMPLETE
2022,0.2623834776859951,2025-04-24 22:05:33.250667,2025-04-24 22:05:38.410429,0 days 00:00:05.159762,12.593680480567812,Matern,3090.5546856673536,0.01857156240016836,0.5,TPESampler,COMPLETE
2023,0.26238347231076714,2025-04-24 22:05:34.744379,2025-04-24 22:05:39.550784,0 days 00:00:04.806405,1.3260706169716066,Matern,0.42384504271848916,0.04177546130699206,0.5,TPESampler,COMPLETE
2024,0.26238347913287813,2025-04-24 22:05:35.854617,2025-04-24 22:05:39.945706,0 days 00:00:04.091089,0.046885985697644406,Matern,3.0520690786440987,0.06283131699937189,0.5,TPESampler,COMPLETE
2025,0.2623835041119662,2025-04-24 22:05:38.660111,2025-04-24 22:05:44.030144,0 days 00:00:05.370033,0.032816491229993326,Matern,136.31467147693328,0.07050566912205283,0.5,TPESampler,COMPLETE
2026,0.26238349257017934,2025-04-24 22:05:39.797357,2025-04-24 22:05:44.191158,0 days 00:00:04.393801,97.7162151078916,Matern,19.380882150521998,0.0016620888973446699,0.5,TPESampler,COMPLETE
2027,0.2623834747119198,2025-04-24 22:05:40.190445,2025-04-24 22:05:44.656957,0 days 00:00:04.466512,14.250432100397703,Matern,3.880662365664125,0.5374114852059018,0.5,TPESampler,COMPLETE
2028,0.26238348197749994,2025-04-24 22:05:44.287368,2025-04-24 22:05:49.957772,0 days 00:00:05.670404,0.20123770641725902,Matern,6275.297769224145,0.08945505509624224,0.5,TPESampler,COMPLETE
2029,0.9329374976866192,2025-04-24 22:05:44.511396,2025-04-24 22:05:47.680001,0 days 00:00:03.168605,575.8858863690858,Matern,0.0024052282446617823,0.017591666051526088,0.5,TPESampler,COMPLETE
2030,0.9928364384653647,2025-04-24 22:05:44.971451,2025-04-24 22:05:48.956487,0 days 00:00:03.985036,0.014470592959882147,Matern,38280.63898510366,0.8703986888803811,0.5,TPESampler,COMPLETE
2031,0.2623834748383172,2025-04-24 22:05:47.933349,2025-04-24 22:05:53.189433,0 days 00:00:05.256084,2004.4798702411158,Matern,78650.86082619568,0.44000615154461636,0.5,TPESampler,COMPLETE
2032,0.9329374961474094,2025-04-24 22:05:49.214380,2025-04-24 22:05:52.905344,0 days 00:00:03.690964,0.5692076252267518,Matern,15.228364988377782,0.008673924618934932,1.5,TPESampler,COMPLETE
2033,0.2623834701138925,2025-04-24 22:05:50.234961,2025-04-24 22:05:54.506832,0 days 00:00:04.271871,38.71975170829168,Matern,15.196459735086476,0.06801649852741302,0.5,TPESampler,COMPLETE
2034,0.932937494227095,2025-04-24 22:05:53.144642,2025-04-24 22:05:58.481355,0 days 00:00:05.336713,0.270413474215036,Matern,79501.54474706406,0.685925864382294,0.5,TPESampler,COMPLETE
2035,0.26238348365789194,2025-04-24 22:05:53.571802,2025-04-24 22:05:59.911329,0 days 00:00:06.339527,0.005979805804449416,Matern,10.51465172424491,0.6642492084292045,0.5,TPESampler,COMPLETE
2036,0.267874671907547,2025-04-24 22:05:54.783212,2025-04-24 22:05:59.866905,0 days 00:00:05.083693,25.349735221840543,Matern,75.3843006093307,0.030781619291191862,1.5,TPESampler,COMPLETE
2037,0.26238347476780927,2025-04-24 22:05:58.772003,2025-04-24 22:06:03.188958,0 days 00:00:04.416955,0.7242728962144387,Matern,33.14121873723204,0.0006806205714136745,0.5,TPESampler,COMPLETE
2038,0.9329374977608947,2025-04-24 22:06:00.122429,2025-04-24 22:06:04.370116,0 days 00:00:04.247687,1.0358318067843173,Matern,1566.8051529184604,0.003493498480992078,0.5,TPESampler,COMPLETE
2039,0.9329374972243525,2025-04-24 22:06:00.169907,2025-04-24 22:06:08.003320,0 days 00:00:07.833413,0.17923515954702773,Matern,4935.940081943887,0.001340205913050674,0.5,TPESampler,COMPLETE
2040,0.2623835238578992,2025-04-24 22:06:03.450940,2025-04-24 22:06:08.633144,0 days 00:00:05.182204,0.04446743936486572,Matern,418.0816379009432,0.06562525209195949,0.5,TPESampler,COMPLETE
2041,0.26238347442014487,2025-04-24 22:06:04.652971,2025-04-24 22:06:09.920249,0 days 00:00:05.267278,65.92691164983566,Matern,95898.11956595087,0.6964582979860489,0.5,TPESampler,COMPLETE
2042,0.26238347868865897,2025-04-24 22:06:08.253030,2025-04-24 22:06:12.299788,0 days 00:00:04.046758,125.10626753270562,Matern,27.266915819727515,0.9093839237423986,0.5,TPESampler,COMPLETE
2043,0.26238347388584904,2025-04-24 22:06:08.896827,2025-04-24 22:06:13.079846,0 days 00:00:04.183019,131.8570248298933,Matern,0.5601160044075906,8.653551776360683e-05,0.5,TPESampler,COMPLETE
2044,0.26238347485976155,2025-04-24 22:06:10.175282,2025-04-24 22:06:15.419928,0 days 00:00:05.244646,44.27468249387295,Matern,1.574870930766333,0.02905147008094822,0.5,TPESampler,COMPLETE
2045,0.2623834759460891,2025-04-24 22:06:12.557065,2025-04-24 22:06:17.736623,0 days 00:00:05.179558,2.9781363375598464,Matern,3742.3052840211044,0.0674686889244926,0.5,TPESampler,COMPLETE
2046,0.2623834947974551,2025-04-24 22:06:13.373320,2025-04-24 22:06:17.891803,0 days 00:00:04.518483,160.3852880773998,Matern,4125.768759853726,0.002300998438026463,0.5,TPESampler,COMPLETE
2047,0.26238347474960355,2025-04-24 22:06:15.672949,2025-04-24 22:06:22.024272,0 days 00:00:06.351323,12.985776492138802,Matern,78414.36074303079,0.037387880621078146,0.5,TPESampler,COMPLETE
2048,0.2623834740757439,2025-04-24 22:06:17.976709,2025-04-24 22:06:22.369315,0 days 00:00:04.392606,36.74569506711882,Matern,1022.0342182357336,0.08103374825084346,0.5,TPESampler,COMPLETE
2049,0.932937497746449,2025-04-24 22:06:18.162323,2025-04-24 22:06:23.505898,0 days 00:00:05.343575,0.20388652230993234,Matern,0.03164157255097713,0.5226596377478777,0.5,TPESampler,COMPLETE
2050,0.28251756395755845,2025-04-24 22:06:22.280425,2025-04-24 22:06:28.509243,0 days 00:00:06.228818,0.0008056804011717342,RBF,2.6003307540861065,0.06194743226547909,1.5,TPESampler,COMPLETE
2051,0.2623834827366202,2025-04-24 22:06:22.654738,2025-04-24 22:06:27.624037,0 days 00:00:04.969299,34.818013182276914,Matern,0.8557819956311521,0.04268165089427318,0.5,TPESampler,COMPLETE
2052,0.2623834906472192,2025-04-24 22:06:23.783527,2025-04-24 22:06:28.136971,0 days 00:00:04.353444,0.02990174700093159,Matern,26.66909054258155,0.7504557866187445,0.5,TPESampler,COMPLETE
2053,0.2623834546275394,2025-04-24 22:06:27.870027,2025-04-24 22:06:32.800111,0 days 00:00:04.930084,0.06349861524704016,Matern,39.63993684161221,0.0436614206690201,0.5,TPESampler,COMPLETE
2054,0.2623835003618569,2025-04-24 22:06:28.355049,2025-04-24 22:06:32.877674,0 days 00:00:04.522625,96.08188948463851,Matern,0.9601115957123906,0.0018854394721398674,0.5,TPESampler,COMPLETE
2055,0.2623834660438806,2025-04-24 22:06:28.789437,2025-04-24 22:06:33.348422,0 days 00:00:04.558985,81.37195948764393,Matern,26.44102715603554,0.004407722465664036,0.5,TPESampler,COMPLETE
2056,0.26238353797210123,2025-04-24 22:06:33.018131,2025-04-24 22:06:38.058388,0 days 00:00:05.040257,6.715860551406589,Matern,0.47902180194563093,0.9224868523737203,0.5,TPESampler,COMPLETE
2057,0.2623834716281326,2025-04-24 22:06:33.060116,2025-04-24 22:06:38.042695,0 days 00:00:04.982579,6.524471401249705,Matern,26.49603817301794,0.7179760583322301,0.5,TPESampler,COMPLETE
2058,0.9329374306558387,2025-04-24 22:06:33.725607,2025-04-24 22:06:37.261847,0 days 00:00:03.536240,896.7418823210693,Matern,0.06160296723829167,0.002607817524469722,0.5,TPESampler,COMPLETE
