number,value,datetime_start,datetime_complete,duration,params_constant_value,params_kernel_type,params_length_scale,params_noise_level,params_nu,system_attrs_auto:sampler,state
1033,0.9329374965527105,2025-04-24 21:32:23.928332,2025-04-24 21:32:32.196553,0 days 00:00:08.268221,1.0592985695598451e-06,RBF,0.11334931731408229,1.5622305528226293e-08,1.5,TPESampler,COMPLETE
1034,0.9329374977207239,2025-04-24 21:32:27.545806,2025-04-24 21:32:34.882117,0 days 00:00:07.336311,1.9187002186300535,Matern,87823.67130466345,9.447636054607437e-05,0.5,TPESampler,COMPLETE
1035,0.992835058378285,2025-04-24 21:32:29.741606,2025-04-24 21:32:33.801946,0 days 00:00:04.060340,25.045640113281323,RBF,0.0005295112326187417,9.249222479664775e-06,1.5,TPESampler,COMPLETE
1036,0.9329374977181282,2025-04-24 21:32:32.442288,2025-04-24 21:32:36.880857,0 days 00:00:04.438569,28.674395078662197,Matern,10446.3359954634,0.00301334202353951,0.5,TPESampler,COMPLETE
1037,0.2623839312241417,2025-04-24 21:32:34.034393,2025-04-24 21:32:38.542012,0 days 00:00:04.507619,46.82372740360968,Matern,10.553921830167514,0.939851045233897,0.5,TPESampler,COMPLETE
1038,0.26238348273577167,2025-04-24 21:32:35.105936,2025-04-24 21:32:39.984867,0 days 00:00:04.878931,5.411193049678492,Matern,3741.1765707618506,0.6044643412083169,0.5,TPESampler,COMPLETE
1039,0.26238347090401304,2025-04-24 21:32:37.137706,2025-04-24 21:32:42.590569,0 days 00:00:05.452863,0.5673439248077129,Matern,65037.025047556715,0.25367322818005855,0.5,TPESampler,COMPLETE
1040,0.26238352564259054,2025-04-24 21:32:38.781050,2025-04-24 21:32:43.163290,0 days 00:00:04.382240,18.736175437320735,Matern,78.00455186083923,0.9955926835465612,0.5,TPESampler,COMPLETE
1041,0.9329374972219159,2025-04-24 21:32:40.231822,2025-04-24 21:32:47.363956,0 days 00:00:07.132134,6.3954906987052595,Matern,28241.144243432624,0.010212652543817279,0.5,TPESampler,COMPLETE
1042,0.2623834763054941,2025-04-24 21:32:42.883245,2025-04-24 21:32:46.983140,0 days 00:00:04.099895,546.1706128642919,Matern,108.91862065177352,0.03887602915694566,0.5,TPESampler,COMPLETE
1043,0.9329374977460291,2025-04-24 21:32:43.387404,2025-04-24 21:32:49.191249,0 days 00:00:05.803845,7.09619061761782,Matern,25784.643762412838,0.006098246752405002,0.5,TPESampler,COMPLETE
1044,0.9329374978275494,2025-04-24 21:32:47.216053,2025-04-24 21:32:53.100476,0 days 00:00:05.884423,22.43825370147722,Matern,32653.69112260463,0.0036761510514681612,1.5,TPESampler,COMPLETE
1045,0.26238348317131555,2025-04-24 21:32:47.633556,2025-04-24 21:32:53.869515,0 days 00:00:06.235959,0.9305280678222305,Matern,71809.29033388277,0.44113107281020747,0.5,TPESampler,COMPLETE
1046,0.9928365699315503,2025-04-24 21:32:49.439127,2025-04-24 21:32:51.600625,0 days 00:00:02.161498,3.598990373705855e-06,RBF,943.0817976545326,0.3847893761876266,0.5,TPESampler,COMPLETE
1047,0.262383476170089,2025-04-24 21:32:51.841920,2025-04-24 21:32:58.401506,0 days 00:00:06.559586,6.546605948882819,Matern,99772.9423959648,0.7593592121186343,0.5,TPESampler,COMPLETE
1048,0.9329374974608369,2025-04-24 21:32:53.333761,2025-04-24 21:32:59.868539,0 days 00:00:06.534778,0.2229244435395396,Matern,67365.5510455922,0.004080663850584339,0.5,TPESampler,COMPLETE
1049,0.9329374977502894,2025-04-24 21:32:54.125142,2025-04-24 21:32:58.903093,0 days 00:00:04.777951,24.027243917517954,Matern,64261.20812098883,0.0017234514510946384,0.5,TPESampler,COMPLETE
1050,0.26238347172377086,2025-04-24 21:32:58.649188,2025-04-24 21:33:03.695491,0 days 00:00:05.046303,55.248605813787066,Matern,12.70005233941455,0.01702639956759029,0.5,TPESampler,COMPLETE
1051,0.2623833967091902,2025-04-24 21:32:59.184326,2025-04-24 21:33:03.847044,0 days 00:00:04.662718,1.904231371126259,Matern,0.5828633904187477,0.5139717847784526,0.5,TPESampler,COMPLETE
1052,0.2825175731285161,2025-04-24 21:33:00.134696,2025-04-24 21:33:09.937337,0 days 00:00:09.802641,0.0036163199221564165,RBF,481.52896703438483,0.41915171003470575,0.5,TPESampler,COMPLETE
1053,0.9928350583903305,2025-04-24 21:33:03.910971,2025-04-24 21:33:07.598252,0 days 00:00:03.687281,1.1767164982263236,RBF,0.060138888046260434,4.403713033632542e-10,2.5,TPESampler,COMPLETE
1054,0.2623835058097574,2025-04-24 21:33:04.102718,2025-04-24 21:33:08.946828,0 days 00:00:04.844110,0.09415747455344947,Matern,849.3373168382994,0.36141844458812755,0.5,TPESampler,COMPLETE
1055,0.9329374978712496,2025-04-24 21:33:07.844221,2025-04-24 21:33:13.647374,0 days 00:00:05.803153,0.00019268541529122746,Matern,0.000139350558734608,0.00010922005967352732,2.5,TPESampler,COMPLETE
1056,0.26238350784359826,2025-04-24 21:33:09.208830,2025-04-24 21:33:19.051622,0 days 00:00:09.842792,0.001996438834361174,Matern,2077.600092478789,0.8615538531971847,0.5,TPESampler,COMPLETE
1057,0.26238347523425865,2025-04-24 21:33:10.163992,2025-04-24 21:33:16.426091,0 days 00:00:06.262099,19818.03754271322,Matern,0.23869357436979,0.024847112047707207,0.5,TPESampler,COMPLETE
1058,0.9928365741163047,2025-04-24 21:33:13.930893,2025-04-24 21:33:18.277275,0 days 00:00:04.346382,4.574500228963332,Matern,87647.81728635704,0.8985312049121307,2.5,TPESampler,COMPLETE
1059,0.9928365555095366,2025-04-24 21:33:16.682921,2025-04-24 21:33:18.973644,0 days 00:00:02.290723,744.2479415713382,Matern,49.15592633653527,0.007411459807733452,0.5,TPESampler,COMPLETE
1060,0.2623834746281002,2025-04-24 21:33:18.523454,2025-04-24 21:33:24.563794,0 days 00:00:06.040340,1375.2159675829935,Matern,918.2706420828795,0.0008318603797486116,0.5,TPESampler,COMPLETE
1061,0.9928365741146296,2025-04-24 21:33:19.142395,2025-04-24 21:33:24.239520,0 days 00:00:05.097125,0.0025171509390888047,RBF,37648.49558277565,0.23255817633883624,0.5,TPESampler,COMPLETE
1062,0.2623835546614474,2025-04-24 21:33:19.250936,2025-04-24 21:33:25.282920,0 days 00:00:06.031984,0.051945502249324135,Matern,554.4778041136537,0.5176260803321828,0.5,TPESampler,COMPLETE
1063,0.26238347257625294,2025-04-24 21:33:24.463632,2025-04-24 21:33:28.492778,0 days 00:00:04.029146,4.3442569662078965,Matern,732.1438832865508,0.8395087678909854,0.5,TPESampler,COMPLETE
1064,0.2623834934821535,2025-04-24 21:33:24.821042,2025-04-24 21:33:30.010916,0 days 00:00:05.189874,32.187702159440846,Matern,176.70575171207074,0.009174198338468357,0.5,TPESampler,COMPLETE
1065,0.9329374983868165,2025-04-24 21:33:25.497368,2025-04-24 21:33:31.135743,0 days 00:00:05.638375,12.462971346922759,Matern,8282.601677191054,0.015551889095144789,2.5,TPESampler,COMPLETE
1066,0.26238348149913354,2025-04-24 21:33:28.729139,2025-04-24 21:33:34.285457,0 days 00:00:05.556318,23688.366367452825,Matern,3.368940232296611,0.08415855994889211,0.5,TPESampler,COMPLETE
1067,0.932937496050655,2025-04-24 21:33:30.255830,2025-04-24 21:33:34.241954,0 days 00:00:03.986124,0.0006769293805367502,RBF,0.00039074070913304725,6.163966989685214e-06,1.5,TPESampler,COMPLETE
1068,0.26238344709114936,2025-04-24 21:33:31.376030,2025-04-24 21:33:36.129243,0 days 00:00:04.753213,8499.564311940188,Matern,29637.191002190117,0.04637581855997396,0.5,TPESampler,COMPLETE
1069,0.26238351541004623,2025-04-24 21:33:34.410137,2025-04-24 21:33:40.733786,0 days 00:00:06.323649,0.0010686596984383905,Matern,23.765319268688057,0.9824699734648569,0.5,TPESampler,COMPLETE
1070,0.26787475163081564,2025-04-24 21:33:34.452666,2025-04-24 21:33:40.225701,0 days 00:00:05.773035,0.013194571533276557,Matern,121.34018475761104,0.5384440761994916,1.5,TPESampler,COMPLETE
1071,0.9329374978691293,2025-04-24 21:33:36.373270,2025-04-24 21:33:45.464647,0 days 00:00:09.091377,0.012095492912292328,Matern,18172.1121270245,0.010860220014779709,0.5,TPESampler,COMPLETE
1072,0.9329374981671663,2025-04-24 21:33:40.480791,2025-04-24 21:33:43.736789,0 days 00:00:03.255998,12152.32769018066,Matern,0.0023725883455038427,0.088951602026122,2.5,TPESampler,COMPLETE
1073,0.2623834109280049,2025-04-24 21:33:40.959937,2025-04-24 21:33:46.253922,0 days 00:00:05.293985,1.243498295117466,Matern,765.2381180433363,0.02772428061779419,0.5,TPESampler,COMPLETE
1074,0.2623834547637221,2025-04-24 21:33:43.982932,2025-04-24 21:33:48.796339,0 days 00:00:04.813407,212.22187436500406,Matern,268.8273954175967,0.6668616840146768,0.5,TPESampler,COMPLETE
1075,0.9329374977559706,2025-04-24 21:33:45.712910,2025-04-24 21:33:52.393870,0 days 00:00:06.680960,15.990980672758136,Matern,83988.10771681703,0.008400310553124174,0.5,TPESampler,COMPLETE
1076,0.2623834877908381,2025-04-24 21:33:46.529031,2025-04-24 21:33:52.288511,0 days 00:00:05.759480,2448.965685689965,Matern,68509.1146602201,0.4035685262487086,0.5,TPESampler,COMPLETE
1077,0.26238343951895365,2025-04-24 21:33:49.040652,2025-04-24 21:33:53.349451,0 days 00:00:04.308799,1.5626482264042643,Matern,47.91876995397153,0.8554871728637422,0.5,TPESampler,COMPLETE
1078,0.2623835046765586,2025-04-24 21:33:52.475653,2025-04-24 21:33:59.454728,0 days 00:00:06.979075,0.018746724380129677,Matern,2869.644569326255,0.9060740974447351,0.5,TPESampler,COMPLETE
1079,0.26787474781456255,2025-04-24 21:33:52.665840,2025-04-24 21:33:58.019357,0 days 00:00:05.353517,99400.56511602343,Matern,0.35181617678257393,0.0021561678796918056,1.5,TPESampler,COMPLETE
1080,0.26238345544355246,2025-04-24 21:33:53.602916,2025-04-24 21:33:58.967101,0 days 00:00:05.364185,1130.2349281097684,Matern,0.6737140340723626,0.06853098793636977,0.5,TPESampler,COMPLETE
1081,0.262383487847113,2025-04-24 21:33:58.288729,2025-04-24 21:34:02.653942,0 days 00:00:04.365213,3.712490483053754,Matern,205.37649232400724,0.026693269670689954,0.5,TPESampler,COMPLETE
1082,0.9329374977309316,2025-04-24 21:33:59.226128,2025-04-24 21:34:04.903813,0 days 00:00:05.677685,33.328783492400525,RBF,1655.0023261785548,0.042392857130984146,0.5,TPESampler,COMPLETE
1083,0.26787475099390334,2025-04-24 21:33:59.711035,2025-04-24 21:34:04.610816,0 days 00:00:04.899781,889.6574072439815,Matern,45.67678599416993,0.0007170363983839014,1.5,TPESampler,COMPLETE
1084,0.26238362079578664,2025-04-24 21:34:02.901440,2025-04-24 21:34:07.485221,0 days 00:00:04.583781,304.45443956771896,Matern,8.888436286685568,0.023674011249015477,0.5,TPESampler,COMPLETE
1085,0.26238347305631937,2025-04-24 21:34:04.836772,2025-04-24 21:34:12.294527,0 days 00:00:07.457755,27.68934376720855,Matern,0.16303343804107198,0.026893568849714288,0.5,TPESampler,COMPLETE
1086,0.9329374977752778,2025-04-24 21:34:05.171815,2025-04-24 21:34:08.078108,0 days 00:00:02.906293,5762.949618173816,Matern,2.9009503404597443e-05,0.4907508456825959,0.5,TPESampler,COMPLETE
1087,0.26238347432768244,2025-04-24 21:34:07.699328,2025-04-24 21:34:12.565469,0 days 00:00:04.866141,1.5445052127692867,Matern,66806.88154555963,0.9821694224850196,0.5,TPESampler,COMPLETE
1088,0.2623832599475791,2025-04-24 21:34:08.277818,2025-04-24 21:34:12.711804,0 days 00:00:04.433986,0.7601186741488896,Matern,12.513980270504591,0.09836124210291572,0.5,TPESampler,COMPLETE
1089,0.26238347369743037,2025-04-24 21:34:12.523212,2025-04-24 21:34:17.553380,0 days 00:00:05.030168,1.3346659501365974,Matern,23.44973558210864,0.9793436301352604,0.5,TPESampler,COMPLETE
1090,0.26238347895340375,2025-04-24 21:34:12.847771,2025-04-24 21:34:17.247513,0 days 00:00:04.399742,0.42228231692374524,Matern,2.3406931716129984,0.04331980274960263,0.5,TPESampler,COMPLETE
1091,0.2623834755385439,2025-04-24 21:34:13.030307,2025-04-24 21:34:16.762806,0 days 00:00:03.732499,0.5344213282271469,Matern,9.433761857212925,0.3314263735026016,0.5,TPESampler,COMPLETE
1092,0.26238348647989307,2025-04-24 21:34:17.011454,2025-04-24 21:34:21.466498,0 days 00:00:04.455044,3.430780894397697,Matern,2.523451629028895,0.020288718999260325,0.5,TPESampler,COMPLETE
1093,0.2623832419616806,2025-04-24 21:34:17.507672,2025-04-24 21:34:24.360146,0 days 00:00:06.852474,0.9280674106776376,Matern,0.18429496953146532,0.6446233996315865,0.5,TPESampler,COMPLETE
1094,0.26238345370474664,2025-04-24 21:34:17.759812,2025-04-24 21:34:23.265833,0 days 00:00:05.506021,0.006111954101548632,Matern,6.722802440132931,0.7931273353818509,0.5,TPESampler,COMPLETE
1095,0.2623834499062815,2025-04-24 21:34:21.701163,2025-04-24 21:34:26.738672,0 days 00:00:05.037509,0.3801543362242284,Matern,2796.2060854237743,0.2669067438149966,0.5,TPESampler,COMPLETE
1096,0.2623833855530224,2025-04-24 21:34:23.510506,2025-04-24 21:34:28.992923,0 days 00:00:05.482417,0.19199352373940037,Matern,205.04901054744855,0.9457631868828461,0.5,TPESampler,COMPLETE
1097,0.9928258766103324,2025-04-24 21:34:24.575727,2025-04-24 21:34:27.954705,0 days 00:00:03.378978,7.526399272898219,RBF,0.31022446381975777,8.790245104041936e-08,0.5,TPESampler,COMPLETE
1098,0.9329374977588123,2025-04-24 21:34:26.990937,2025-04-24 21:34:31.702226,0 days 00:00:04.711289,3.3999441444653704,Matern,0.004872215558658036,0.23399214840360313,0.5,TPESampler,COMPLETE
1099,0.9928350570938396,2025-04-24 21:34:28.207068,2025-04-24 21:34:32.029701,0 days 00:00:03.822633,61553.55875748514,Matern,0.11061451399156165,4.102278759463464e-08,0.5,TPESampler,COMPLETE
1100,0.26238347786123656,2025-04-24 21:34:29.308629,2025-04-24 21:34:33.700387,0 days 00:00:04.391758,0.3430087717224755,Matern,4.2181366686490795,0.12290076105406018,0.5,TPESampler,COMPLETE
1101,0.2623834618135987,2025-04-24 21:34:31.967405,2025-04-24 21:34:37.201569,0 days 00:00:05.234164,2.3904699493084802,Matern,20.762547004295072,0.4576755894058754,0.5,TPESampler,COMPLETE
1102,0.2623834792750259,2025-04-24 21:34:32.267551,2025-04-24 21:34:43.760643,0 days 00:00:11.493092,238.21504016123112,Matern,0.10784179001262488,0.16130818689292106,0.5,TPESampler,COMPLETE
1103,0.9329374977558379,2025-04-24 21:34:33.944250,2025-04-24 21:34:40.772267,0 days 00:00:06.828017,7.244995763198783,Matern,0.01320062280104034,0.12740257637436017,0.5,TPESampler,COMPLETE
1104,0.26238347345819274,2025-04-24 21:34:37.647848,2025-04-24 21:34:53.882623,0 days 00:00:16.234775,0.01677433119008952,Matern,7648.146969471652,0.8003688670991076,0.5,TPESampler,COMPLETE
1105,0.9329374895351703,2025-04-24 21:34:41.023680,2025-04-24 21:34:44.671102,0 days 00:00:03.647422,12.615551471987443,Matern,0.05471035116622937,0.25178935156603505,0.5,TPESampler,COMPLETE
1106,0.2623835008450516,2025-04-24 21:34:44.039369,2025-04-24 21:34:49.437486,0 days 00:00:05.398117,59.89209718614137,Matern,0.7180275211729477,0.11271598782947836,0.5,TPESampler,COMPLETE
1107,0.26238346023113945,2025-04-24 21:34:44.923661,2025-04-24 21:34:50.534798,0 days 00:00:05.611137,0.7244884229421545,Matern,0.6029600243787279,0.03557389139278226,0.5,TPESampler,COMPLETE
1108,0.9329374977529981,2025-04-24 21:34:49.661753,2025-04-24 21:34:53.511414,0 days 00:00:03.849661,1.0635266108529426,Matern,0.018382625202573496,0.0018159435419195882,0.5,TPESampler,COMPLETE
1109,0.262383458728634,2025-04-24 21:34:50.921928,2025-04-24 21:34:57.401599,0 days 00:00:06.479671,0.21018084003158616,Matern,0.8034230015945131,0.9671655150653986,0.5,TPESampler,COMPLETE
1110,0.9329374960429263,2025-04-24 21:34:53.757550,2025-04-24 21:34:59.757727,0 days 00:00:06.000177,0.03980404476202627,Matern,0.0068638427472019845,0.007417527479028037,0.5,TPESampler,COMPLETE
1111,0.26238346951674335,2025-04-24 21:34:54.071262,2025-04-24 21:35:02.618371,0 days 00:00:08.547109,0.9085342268299199,Matern,0.14295799299855158,0.9052958621270415,0.5,TPESampler,COMPLETE
1112,0.26238347490076525,2025-04-24 21:34:58.102832,2025-04-24 21:35:04.380255,0 days 00:00:06.277423,13.658299353569483,Matern,1.0587301142670327,0.11504339752444848,0.5,TPESampler,COMPLETE
1113,0.2623834760230693,2025-04-24 21:34:59.986769,2025-04-24 21:35:05.512043,0 days 00:00:05.525274,0.009301307151288166,Matern,2.0915898931939485,0.7244367672062826,0.5,TPESampler,COMPLETE
1114,0.9329374974235378,2025-04-24 21:35:02.837420,2025-04-24 21:35:10.070765,0 days 00:00:07.233345,0.015966821751521483,Matern,0.00044873064092819674,0.11448042097087578,0.5,TPESampler,COMPLETE
1115,0.2623834638256648,2025-04-24 21:35:04.641883,2025-04-24 21:35:09.761400,0 days 00:00:05.119517,45640.49206254847,Matern,0.7469754683350706,0.6453261965646534,0.5,TPESampler,COMPLETE
1116,0.9329374969521784,2025-04-24 21:35:05.735244,2025-04-24 21:35:08.912824,0 days 00:00:03.177580,2.881881510844694,RBF,0.037548250399021765,0.6872684556561467,0.5,TPESampler,COMPLETE
1117,0.2623833649660406,2025-04-24 21:35:09.183459,2025-04-24 21:35:20.468922,0 days 00:00:11.285463,0.6263607839760905,Matern,0.11914889710370925,0.07724073564618159,0.5,TPESampler,COMPLETE
1118,0.9329374976881805,2025-04-24 21:35:10.027890,2025-04-24 21:35:22.254243,0 days 00:00:12.226353,0.051408376118346685,Matern,80657.20347011913,0.060714886616045106,0.5,TPESampler,COMPLETE
1119,0.9329374975287753,2025-04-24 21:35:10.395384,2025-04-24 21:35:19.264582,0 days 00:00:08.869198,0.1854287476381307,Matern,0.015243464124529706,0.538845570060467,0.5,TPESampler,COMPLETE
1120,0.9329316068176874,2025-04-24 21:35:19.521587,2025-04-24 21:35:26.090765,0 days 00:00:06.569178,0.015229263643095885,Matern,0.08381698120772907,0.3522731583750848,0.5,TPESampler,COMPLETE
1121,0.9329374977440834,2025-04-24 21:35:20.748392,2025-04-24 21:35:29.615225,0 days 00:00:08.866833,0.02293014541113617,Matern,2087.2350728128276,0.017851663350557323,0.5,TPESampler,COMPLETE
1122,0.2623834716841045,2025-04-24 21:35:22.527505,2025-04-24 21:35:27.770464,0 days 00:00:05.242959,3.979066262651709,Matern,16.973243635769382,0.9061870502125539,0.5,TPESampler,COMPLETE
1123,0.26238347549023777,2025-04-24 21:35:26.405265,2025-04-24 21:35:32.934547,0 days 00:00:06.529282,0.21883136392162017,Matern,1953.7505183079475,0.8676003103966349,0.5,TPESampler,COMPLETE
1124,0.26238348371772724,2025-04-24 21:35:28.014674,2025-04-24 21:35:33.647457,0 days 00:00:05.632783,79.97744952655191,Matern,0.8072992280285476,0.771527294280049,0.5,TPESampler,COMPLETE
1125,0.26238347097430736,2025-04-24 21:35:29.873087,2025-04-24 21:35:34.374269,0 days 00:00:04.501182,42.02412234619392,Matern,964.7585266476639,0.9991397717543774,0.5,TPESampler,COMPLETE
1126,0.9928363465717718,2025-04-24 21:35:33.192884,2025-04-24 21:35:40.892050,0 days 00:00:07.699166,8.330516369545682e-05,Matern,15187.676867679493,0.020098553596235226,0.5,TPESampler,COMPLETE
1127,0.9329374977460062,2025-04-24 21:35:33.872451,2025-04-24 21:35:40.122643,0 days 00:00:06.250192,26358.212835309016,RBF,0.12459972770695185,0.2581414402138797,0.5,TPESampler,COMPLETE
1128,0.9329374976891047,2025-04-24 21:35:34.768421,2025-04-24 21:35:44.328649,0 days 00:00:09.560228,0.1397959245348549,Matern,73354.80540976052,0.005387135908966209,0.5,TPESampler,COMPLETE
1129,0.9329374965702875,2025-04-24 21:35:40.374357,2025-04-24 21:35:45.105731,0 days 00:00:04.731374,0.30159975648477316,Matern,0.04925815873920253,0.7564729491906665,0.5,TPESampler,COMPLETE
1130,0.9329374977413835,2025-04-24 21:35:41.154977,2025-04-24 21:35:45.524713,0 days 00:00:04.369736,187.0822473123429,Matern,74449.746470435,0.0027208726608807655,0.5,TPESampler,COMPLETE
1131,0.28251834210759325,2025-04-24 21:35:44.565176,2025-04-24 21:35:52.384429,0 days 00:00:07.819253,0.11555768109760943,RBF,0.5529045431992514,0.0091851882732141,0.5,TPESampler,COMPLETE
1132,0.9329374980704901,2025-04-24 21:35:45.366033,2025-04-24 21:36:01.282703,0 days 00:00:15.916670,3.432755405565817e-06,Matern,0.010809014768019124,7.086585833348512e-05,1.5,TPESampler,COMPLETE
1133,0.26238343281322546,2025-04-24 21:35:45.746492,2025-04-24 21:35:54.105076,0 days 00:00:08.358584,0.09657795609454776,Matern,38.25974789080462,0.055225878614858,0.5,TPESampler,COMPLETE
1134,0.2825175348813069,2025-04-24 21:35:52.754304,2025-04-24 21:35:59.682018,0 days 00:00:06.927714,0.029747040243895156,RBF,8.748731746849597,0.6248162467600279,0.5,TPESampler,COMPLETE
1135,0.9329374977937176,2025-04-24 21:35:54.470408,2025-04-24 21:36:07.702684,0 days 00:00:13.232276,2.9649740643355927e-06,RBF,0.0001329787920526746,0.01586910873143021,1.5,TPESampler,COMPLETE
1136,0.9928365688138229,2025-04-24 21:36:00.042410,2025-04-24 21:36:05.998957,0 days 00:00:05.956547,0.00015622155644869467,Matern,1.0521023084512662,0.005843154220797342,2.5,TPESampler,COMPLETE
1137,0.932937495541904,2025-04-24 21:36:01.533916,2025-04-24 21:36:08.625234,0 days 00:00:07.091318,0.6132519341540832,Matern,68891.5123547353,0.021787962892872877,0.5,TPESampler,COMPLETE
1138,0.2623834719819667,2025-04-24 21:36:06.222515,2025-04-24 21:36:16.594683,0 days 00:00:10.372168,0.11851781085749859,Matern,68499.34884916861,0.7349345128098085,0.5,TPESampler,COMPLETE
1139,0.9329374977942844,2025-04-24 21:36:07.971348,2025-04-24 21:36:17.622305,0 days 00:00:09.650957,1.5856611437130045e-06,RBF,45.222257268292324,3.810405768179206e-09,0.5,TPESampler,COMPLETE
1140,0.26238347746661933,2025-04-24 21:36:08.852797,2025-04-24 21:36:13.893155,0 days 00:00:05.040358,3725.6319233990084,Matern,23.75588416928075,0.8041487549762039,0.5,TPESampler,COMPLETE
1141,0.26238346961835746,2025-04-24 21:36:14.135905,2025-04-24 21:36:20.812894,0 days 00:00:06.676989,44.08098280364412,Matern,75348.49719719752,0.25815502942907376,0.5,TPESampler,COMPLETE
1142,0.2623834894224117,2025-04-24 21:36:16.824521,2025-04-24 21:36:21.209562,0 days 00:00:04.385041,0.8748920713491009,Matern,1.8957568804880993,0.03418967106395213,0.5,TPESampler,COMPLETE
1143,0.2623834778338086,2025-04-24 21:36:17.885852,2025-04-24 21:36:23.059459,0 days 00:00:05.173607,95676.91461509389,Matern,0.49064044736058343,0.030051629289405336,0.5,TPESampler,COMPLETE
1144,0.26238347612385793,2025-04-24 21:36:21.056371,2025-04-24 21:36:29.168053,0 days 00:00:08.111682,0.5806710416585977,Matern,24.99268012246534,0.9639960032361196,0.5,TPESampler,COMPLETE
1145,0.2623836920335181,2025-04-24 21:36:21.842518,2025-04-24 21:36:30.028502,0 days 00:00:08.185984,3.740685786021884,Matern,90708.75246430984,0.06600265143555585,0.5,TPESampler,COMPLETE
1146,0.992835058360801,2025-04-24 21:36:23.323577,2025-04-24 21:36:29.169134,0 days 00:00:05.845557,2978.1824722694328,Matern,0.011604527476849305,0.0072140735347991525,0.5,TPESampler,COMPLETE
