number,value,datetime_start,datetime_complete,duration,params_constant_value,params_kernel_type,params_length_scale,params_noise_level,params_nu,system_attrs_auto:sampler,state
343,0.93293749775171,2025-04-24 21:08:51.164270,2025-04-24 21:08:54.555496,0 days 00:00:03.391226,1.0821629357424019,RBF,0.0266421877278207,0.00012195394967474888,0.5,TPESampler,COMPLETE
344,0.2678747524948046,2025-04-24 21:08:52.902386,2025-04-24 21:08:59.532790,0 days 00:00:06.630404,483.395750768039,Matern,3488.275512734417,0.40065772123041204,1.5,TPESampler,COMPLETE
345,0.9329374978514997,2025-04-24 21:08:54.032128,2025-04-24 21:09:00.081015,0 days 00:00:06.048887,4210.159378933653,RBF,2155.580391947483,0.0030161370978687,1.5,TPESampler,COMPLETE
346,0.26238348757919183,2025-04-24 21:08:54.822935,2025-04-24 21:08:59.928524,0 days 00:00:05.105589,0.09409105570457489,Matern,141.13176669676886,0.07941951010542969,0.5,TPESampler,COMPLETE
347,0.26238347862705924,2025-04-24 21:08:59.757548,2025-04-24 21:09:03.946564,0 days 00:00:04.189016,2.454815200235848,Matern,7.133091593154076,0.5253619990719759,0.5,TPESampler,COMPLETE
348,0.9928365737875695,2025-04-24 21:09:00.200064,2025-04-24 21:09:04.242929,0 days 00:00:04.042865,17.88428164316367,RBF,1.57559824038941,1.209956642702378e-07,2.5,TPESampler,COMPLETE
349,0.9329374982416532,2025-04-24 21:09:00.444673,2025-04-24 21:09:04.929941,0 days 00:00:04.485268,12.414101246814326,Matern,13876.023741874935,0.0034110004119648827,0.5,TPESampler,COMPLETE
350,0.9329374990735971,2025-04-24 21:09:04.169483,2025-04-24 21:09:15.192744,0 days 00:00:11.023261,0.5580768678689195,RBF,288.5166295340582,0.00039610733219224244,0.5,TPESampler,COMPLETE
351,0.93293749761608,2025-04-24 21:09:04.501542,2025-04-24 21:09:17.167450,0 days 00:00:12.665908,1.8679695046617084e-07,Matern,0.00594627789709853,0.0013857285495402702,0.5,TPESampler,COMPLETE
352,0.26238349230844343,2025-04-24 21:09:05.143812,2025-04-24 21:09:13.163056,0 days 00:00:08.019244,0.9491488824551475,Matern,2057.5916841582994,0.23787947869162906,0.5,TPESampler,COMPLETE
353,0.2623834363454717,2025-04-24 21:09:13.647814,2025-04-24 21:09:19.274347,0 days 00:00:05.626533,25.206252244762894,Matern,41.562305164847125,0.012568313682277068,0.5,TPESampler,COMPLETE
354,0.262383472784618,2025-04-24 21:09:15.677211,2025-04-24 21:09:20.941800,0 days 00:00:05.264589,15.147432818292843,Matern,278.38998575196405,0.12009090736912073,0.5,TPESampler,COMPLETE
355,0.2623831920148049,2025-04-24 21:09:17.396946,2025-04-24 21:09:22.579216,0 days 00:00:05.182270,0.1710708381307689,Matern,467.4084465693075,0.5438990237926171,0.5,TPESampler,COMPLETE
356,0.2623834662347709,2025-04-24 21:09:19.526328,2025-04-24 21:09:23.932981,0 days 00:00:04.406653,22.92363130038302,Matern,33.401559851608674,0.016873400630906896,0.5,TPESampler,COMPLETE
357,0.2623834713895676,2025-04-24 21:09:21.188834,2025-04-24 21:09:25.794592,0 days 00:00:04.605758,12.689958963904612,Matern,1083.181564641187,0.03408410348294947,0.5,TPESampler,COMPLETE
358,0.2623834706750971,2025-04-24 21:09:22.833101,2025-04-24 21:09:27.434251,0 days 00:00:04.601150,0.7020231751376856,Matern,1767.5799758026424,0.752920370879327,0.5,TPESampler,COMPLETE
359,0.9329374977822213,2025-04-24 21:09:24.192890,2025-04-24 21:09:27.478609,0 days 00:00:03.285719,18.030803555584654,Matern,2.2033942781938754e-05,0.001232426900549045,0.5,TPESampler,COMPLETE
360,0.26238350220279627,2025-04-24 21:09:26.056225,2025-04-24 21:09:31.182455,0 days 00:00:05.126230,1.8870420192270665,Matern,650.4555986739555,0.6815827413801979,0.5,TPESampler,COMPLETE
361,0.9329374978905518,2025-04-24 21:09:27.613696,2025-04-24 21:09:34.807098,0 days 00:00:07.193402,0.006988551910744329,Matern,313.8112702672242,0.005956702929290819,0.5,TPESampler,COMPLETE
362,0.9329374974277616,2025-04-24 21:09:27.652028,2025-04-24 21:09:36.582682,0 days 00:00:08.930654,0.0038930929844349987,Matern,1691.5833290726205,0.016461737326490204,0.5,TPESampler,COMPLETE
363,0.2623833769069028,2025-04-24 21:09:31.441313,2025-04-24 21:09:35.681020,0 days 00:00:04.239707,3.807155078504557,Matern,131.99837566335958,0.021984563511494006,0.5,TPESampler,COMPLETE
364,0.26238340184064235,2025-04-24 21:09:35.054291,2025-04-24 21:09:40.136208,0 days 00:00:05.081917,0.6196382486381022,Matern,2592.5188481839486,0.8872749038296341,0.5,TPESampler,COMPLETE
365,0.2623835281190211,2025-04-24 21:09:35.904508,2025-04-24 21:09:41.461780,0 days 00:00:05.557272,0.5142610012128487,Matern,178.4263079846119,0.006988928187836133,0.5,TPESampler,COMPLETE
366,0.2623833969693115,2025-04-24 21:09:36.805408,2025-04-24 21:09:43.752195,0 days 00:00:06.946787,0.004103495946615884,Matern,1930.291299892666,0.16767626706588282,0.5,TPESampler,COMPLETE
367,0.2623835091683162,2025-04-24 21:09:40.384988,2025-04-24 21:09:44.450188,0 days 00:00:04.065200,0.713493891600243,Matern,29.954842007213678,0.1770654426721574,0.5,TPESampler,COMPLETE
368,0.26238349496906777,2025-04-24 21:09:41.722051,2025-04-24 21:09:46.697952,0 days 00:00:04.975901,12.604455945254086,Matern,202.58070173485677,0.1998024284821368,0.5,TPESampler,COMPLETE
369,0.2623834739575349,2025-04-24 21:09:44.004043,2025-04-24 21:09:52.135628,0 days 00:00:08.131585,0.006091214153785598,Matern,1523.8412518111459,0.8775386064392167,0.5,TPESampler,COMPLETE
370,0.26238348675662493,2025-04-24 21:09:44.665250,2025-04-24 21:09:52.826538,0 days 00:00:08.161288,0.0003982807144121741,Matern,25.1508972005503,0.33505905116690926,0.5,TPESampler,COMPLETE
371,0.26238346996312584,2025-04-24 21:09:46.922399,2025-04-24 21:09:51.580182,0 days 00:00:04.657783,0.03309889410801697,Matern,4.174435074496115,0.6028977893981244,0.5,TPESampler,COMPLETE
372,0.2623834648872897,2025-04-24 21:09:51.800078,2025-04-24 21:09:57.430822,0 days 00:00:05.630744,0.0064122624569990395,Matern,156.98611426786,0.36998366365466323,0.5,TPESampler,COMPLETE
373,0.2623834751045899,2025-04-24 21:09:52.323091,2025-04-24 21:10:02.340542,0 days 00:00:10.017451,0.0015314911648408064,Matern,4046.827670850546,0.0929004351697488,0.5,TPESampler,COMPLETE
374,0.2623834740904522,2025-04-24 21:09:53.168938,2025-04-24 21:09:58.210513,0 days 00:00:05.041575,5.049863833875123,Matern,1538.0984249490855,0.005048685057834123,0.5,TPESampler,COMPLETE
375,0.2623833634669761,2025-04-24 21:09:57.677604,2025-04-24 21:10:02.625817,0 days 00:00:04.948213,1.6688767102618893,Matern,5149.918095705311,0.9086440169944879,0.5,TPESampler,COMPLETE
376,0.992836574105361,2025-04-24 21:09:58.479432,2025-04-24 21:10:02.950138,0 days 00:00:04.470706,0.00010086801534669472,Matern,22826.045501716613,0.45922933304445474,2.5,TPESampler,COMPLETE
377,0.9329374974167448,2025-04-24 21:10:02.574011,2025-04-24 21:10:12.920717,0 days 00:00:10.346706,0.034881641748303306,Matern,1721.4781387011858,0.051374940431115894,0.5,TPESampler,COMPLETE
378,0.9329374975327497,2025-04-24 21:10:02.882325,2025-04-24 21:10:10.097950,0 days 00:00:07.215625,0.9097163683867283,Matern,32.85207809262746,0.0125781914378973,2.5,TPESampler,COMPLETE
379,0.26238347477436846,2025-04-24 21:10:03.184292,2025-04-24 21:10:13.753467,0 days 00:00:10.569175,0.02243517028336462,Matern,7730.720682186465,0.521585957163022,0.5,TPESampler,COMPLETE
380,0.2623835215932468,2025-04-24 21:10:10.324753,2025-04-24 21:10:15.724494,0 days 00:00:05.399741,0.8768255595750594,Matern,728.3444752017876,0.1944502322052396,0.5,TPESampler,COMPLETE
381,0.2623835165081269,2025-04-24 21:10:13.177896,2025-04-24 21:10:17.557809,0 days 00:00:04.379913,2.173583962715346,Matern,873.6898977557089,0.07907214786772744,0.5,TPESampler,COMPLETE
382,0.9329374977765443,2025-04-24 21:10:13.988626,2025-04-24 21:10:21.158371,0 days 00:00:07.169745,0.06015613075213704,Matern,2515.397911873755,0.0003463669607956869,1.5,TPESampler,COMPLETE
383,0.2623835621830785,2025-04-24 21:10:15.971058,2025-04-24 21:10:21.101695,0 days 00:00:05.130637,13.503035578863143,Matern,2726.317524857902,0.35176403620841257,0.5,TPESampler,COMPLETE
384,0.2623834828800352,2025-04-24 21:10:17.786548,2025-04-24 21:10:22.991817,0 days 00:00:05.205269,0.7438592522031237,Matern,4476.540158334849,0.9547480585610797,0.5,TPESampler,COMPLETE
385,0.9329374988000375,2025-04-24 21:10:21.262883,2025-04-24 21:10:29.479519,0 days 00:00:08.216636,1.056530307867612,RBF,1373.8646427981328,4.4131856185415825e-10,1.5,TPESampler,COMPLETE
386,0.2623836319596456,2025-04-24 21:10:21.324413,2025-04-24 21:10:26.779047,0 days 00:00:05.454634,14.510706608865416,Matern,9.50452867908481,0.0015352085716224281,0.5,TPESampler,COMPLETE
387,0.9329374976967043,2025-04-24 21:10:23.231785,2025-04-24 21:10:31.144287,0 days 00:00:07.912502,0.2293812842530002,Matern,46870.46819891334,0.02464828664103065,0.5,TPESampler,COMPLETE
388,0.2623838432306206,2025-04-24 21:10:27.067733,2025-04-24 21:10:32.110210,0 days 00:00:05.042477,0.31286632040877443,Matern,32.75987249066752,0.4701696714389374,0.5,TPESampler,COMPLETE
389,0.9928350583882336,2025-04-24 21:10:29.722341,2025-04-24 21:10:34.415993,0 days 00:00:04.693652,84.90099852542558,RBF,0.07452592898167795,5.237917010517001e-05,1.5,TPESampler,COMPLETE
390,0.26238348284629454,2025-04-24 21:10:31.529314,2025-04-24 21:10:37.099326,0 days 00:00:05.570012,12.666297704536944,Matern,11422.541322442723,0.6824209844179373,0.5,TPESampler,COMPLETE
391,0.932937497793202,2025-04-24 21:10:32.430898,2025-04-24 21:10:37.379800,0 days 00:00:04.948902,0.0950795098143426,Matern,421.61389342817915,0.00168982158803376,0.5,TPESampler,COMPLETE
392,0.26238347503003495,2025-04-24 21:10:34.675442,2025-04-24 21:10:39.709087,0 days 00:00:05.033645,0.2654860594100174,Matern,9.032520457243367,0.004906053383410867,0.5,TPESampler,COMPLETE
393,0.2825175432038247,2025-04-24 21:10:37.335041,2025-04-24 21:10:42.943148,0 days 00:00:05.608107,0.7075438176702761,RBF,1287.5919210733255,0.0666658590658493,0.5,TPESampler,COMPLETE
394,0.2678747535458395,2025-04-24 21:10:37.612259,2025-04-24 21:10:45.969723,0 days 00:00:08.357464,2.2174552783684014,Matern,7596.774816044359,0.19927650911069003,1.5,TPESampler,COMPLETE
395,0.26238347670247225,2025-04-24 21:10:39.962994,2025-04-24 21:10:45.277427,0 days 00:00:05.314433,79813.89254692836,Matern,0.40874384421663634,0.0005975513125189455,0.5,TPESampler,COMPLETE
396,0.26238340233450885,2025-04-24 21:10:43.201727,2025-04-24 21:10:47.842287,0 days 00:00:04.640560,1.104324985728856,Matern,178.61878432686214,0.7359364971052843,0.5,TPESampler,COMPLETE
397,0.9928350583881379,2025-04-24 21:10:45.534627,2025-04-24 21:10:48.722590,0 days 00:00:03.187963,68065.43319201612,RBF,0.00013668807897148562,1.4368253105550574e-06,1.5,TPESampler,COMPLETE
398,0.26238347477671237,2025-04-24 21:10:46.185962,2025-04-24 21:10:54.401073,0 days 00:00:08.215111,1102.348574128753,Matern,0.12086337874398485,0.01978758890186812,0.5,TPESampler,COMPLETE
399,0.2678747513021343,2025-04-24 21:10:48.067902,2025-04-24 21:10:54.293639,0 days 00:00:06.225737,0.0031171660415263997,Matern,7.068501208626865,0.5495391976041046,1.5,TPESampler,COMPLETE
400,0.26238475021303725,2025-04-24 21:10:48.986664,2025-04-24 21:10:55.446434,0 days 00:00:06.459770,0.03802250194572975,Matern,536.6311642433847,0.7252187982200332,0.5,TPESampler,COMPLETE
401,0.932937354743185,2025-04-24 21:10:54.470011,2025-04-24 21:10:58.108738,0 days 00:00:03.638727,0.2730709049776625,Matern,0.06459237618359832,0.0002680584416185282,0.5,TPESampler,COMPLETE
402,0.2623834775306156,2025-04-24 21:10:54.631923,2025-04-24 21:11:00.917722,0 days 00:00:06.285799,0.6807403708359202,Matern,4010.580221860507,0.686554146813732,0.5,TPESampler,COMPLETE
403,0.26238374878508014,2025-04-24 21:10:55.685607,2025-04-24 21:11:01.323666,0 days 00:00:05.638059,0.03806142279124672,Matern,42.915444970226744,0.7165721226763588,0.5,TPESampler,COMPLETE
404,0.2623834741697867,2025-04-24 21:10:58.394854,2025-04-24 21:11:03.538933,0 days 00:00:05.144079,16.552288480136212,Matern,35.30702453752103,0.6653075478369506,0.5,TPESampler,COMPLETE
405,0.9329374978481433,2025-04-24 21:11:01.163390,2025-04-24 21:11:10.314660,0 days 00:00:09.151270,0.00027604133614764984,RBF,191.33591330999306,1.9996238642835412e-07,2.5,TPESampler,COMPLETE
406,0.2623834728149373,2025-04-24 21:11:01.516102,2025-04-24 21:11:09.571641,0 days 00:00:08.055539,13.557216111457334,Matern,28682.17333691694,0.7971242126282113,0.5,TPESampler,COMPLETE
407,0.2623834738106441,2025-04-24 21:11:03.795224,2025-04-24 21:11:15.141095,0 days 00:00:11.345871,1.250752531429525e-05,Matern,158.54800257299428,0.03924257865625425,0.5,TPESampler,COMPLETE
408,0.2623834832803949,2025-04-24 21:11:09.792432,2025-04-24 21:11:15.110965,0 days 00:00:05.318533,1.2272174814512569,Matern,170.32037242113122,0.0033135653891507833,0.5,TPESampler,COMPLETE
409,0.932937497699244,2025-04-24 21:11:10.563321,2025-04-24 21:11:17.675470,0 days 00:00:07.112149,0.10123158417785422,Matern,8597.86946784971,0.006014086674410684,0.5,TPESampler,COMPLETE
410,0.9928365738292838,2025-04-24 21:11:15.300593,2025-04-24 21:11:19.022749,0 days 00:00:03.722156,0.010401129520081315,Matern,6235.540578344748,0.9827883231883572,1.5,TPESampler,COMPLETE
411,0.9329374977220459,2025-04-24 21:11:15.370672,2025-04-24 21:11:19.460099,0 days 00:00:04.089427,1205.958498689214,Matern,0.00017765042194081262,0.0007899263005879099,2.5,TPESampler,COMPLETE
412,0.273756549308024,2025-04-24 21:11:17.938011,2025-04-24 21:11:30.543218,0 days 00:00:12.605207,2.7316930217728705,Matern,10496.249887703072,0.6628289890943185,2.5,TPESampler,COMPLETE
413,0.9928349643292576,2025-04-24 21:11:19.282034,2025-04-24 21:11:21.848710,0 days 00:00:02.566676,85682.93268516262,Matern,0.2563437328130744,0.00913317139753845,2.5,TPESampler,COMPLETE
414,0.26238354396528935,2025-04-24 21:11:19.708699,2025-04-24 21:11:27.303955,0 days 00:00:07.595256,0.006138649731769272,Matern,1735.427455257419,0.714459102193736,0.5,TPESampler,COMPLETE
415,0.2825175424431732,2025-04-24 21:11:22.103132,2025-04-24 21:11:27.625796,0 days 00:00:05.522664,8.842077132596673,RBF,84.52984531003985,0.4839171625760525,0.5,TPESampler,COMPLETE
416,0.26238346291637205,2025-04-24 21:11:27.558997,2025-04-24 21:11:32.105530,0 days 00:00:04.546533,9.86147387363803,Matern,18.190753415527713,0.0013512839289427188,0.5,TPESampler,COMPLETE
417,0.2623834811361266,2025-04-24 21:11:27.878416,2025-04-24 21:11:31.933702,0 days 00:00:04.055286,3.3995143354435338,Matern,74.76730233228169,0.587362371322265,0.5,TPESampler,COMPLETE
418,0.9928358795850267,2025-04-24 21:11:30.796701,2025-04-24 21:11:33.108448,0 days 00:00:02.311747,6.489931105126175e-05,Matern,18400.489464774695,0.4867136146855645,0.5,TPESampler,COMPLETE
419,0.2623834815248482,2025-04-24 21:11:32.152349,2025-04-24 21:11:40.902738,0 days 00:00:08.750389,8.562448404252123,Matern,0.07897513049062968,0.0072227292196126724,0.5,TPESampler,COMPLETE
420,0.2825175400916428,2025-04-24 21:11:32.329717,2025-04-24 21:11:38.618324,0 days 00:00:06.288607,0.40907710507695033,RBF,549.0648674477998,0.15200158399996141,2.5,TPESampler,COMPLETE
421,0.9329374973857227,2025-04-24 21:11:33.387100,2025-04-24 21:11:40.630282,0 days 00:00:07.243182,0.4191009288145715,Matern,1782.839729649145,0.008294548404689036,0.5,TPESampler,COMPLETE
422,0.2623834817901106,2025-04-24 21:11:38.876152,2025-04-24 21:11:43.720511,0 days 00:00:04.844359,11.726333881862805,Matern,5.4040379934819605,0.003075827703150809,0.5,TPESampler,COMPLETE
423,0.26238335680175623,2025-04-24 21:11:40.852549,2025-04-24 21:11:44.932187,0 days 00:00:04.079638,1.271907321514094,Matern,69.62418870903524,0.9317918533619391,0.5,TPESampler,COMPLETE
424,0.262383451597021,2025-04-24 21:11:41.151467,2025-04-24 21:11:48.057492,0 days 00:00:06.906025,0.03639946096539433,Matern,53327.71444462252,0.0833625588936306,0.5,TPESampler,COMPLETE
425,0.26238347454737554,2025-04-24 21:11:43.966830,2025-04-24 21:11:48.579617,0 days 00:00:04.612787,45.548587123709225,Matern,426.3156710465989,0.0021177104471269033,0.5,TPESampler,COMPLETE
426,0.9329374977698982,2025-04-24 21:11:45.180748,2025-04-24 21:11:51.422586,0 days 00:00:06.241838,0.10983391055773636,RBF,119.35887427974028,2.2553366442279165e-05,1.5,TPESampler,COMPLETE
427,0.9329374949983245,2025-04-24 21:11:48.307679,2025-04-24 21:11:54.691003,0 days 00:00:06.383324,0.09697093676999852,RBF,0.00017439969939591528,0.9661810403844151,1.5,TPESampler,COMPLETE
428,0.28251754526421785,2025-04-24 21:11:48.854942,2025-04-24 21:11:59.890079,0 days 00:00:11.035137,1.8445528895647466e-05,RBF,0.4932923736186565,5.552485941500885e-06,1.5,TPESampler,COMPLETE
429,0.262383485597424,2025-04-24 21:11:51.648413,2025-04-24 21:11:58.097212,0 days 00:00:06.448799,0.1288394913176539,Matern,62351.8560132946,0.13539058631103512,0.5,TPESampler,COMPLETE
430,0.9797171119575585,2025-04-24 21:11:54.945587,2025-04-24 21:12:05.000180,0 days 00:00:10.054593,0.00047634545436663533,Matern,11529.30620499053,0.01284362120844307,0.5,TPESampler,COMPLETE
431,0.2623833505317835,2025-04-24 21:11:58.344263,2025-04-24 21:12:04.575816,0 days 00:00:06.231553,0.09271863042997096,Matern,782.6124599665852,0.6842823149304376,0.5,TPESampler,COMPLETE
432,0.2623834751607946,2025-04-24 21:12:00.124313,2025-04-24 21:12:06.308045,0 days 00:00:06.183732,0.03557862412038157,Matern,9261.195839740056,0.8560749042210756,0.5,TPESampler,COMPLETE
433,0.26238341217584443,2025-04-24 21:12:04.830999,2025-04-24 21:12:10.241318,0 days 00:00:05.410319,0.006519988031639644,Matern,705.8217595836753,0.0776486752390145,0.5,TPESampler,COMPLETE
434,0.2623834847419501,2025-04-24 21:12:05.194784,2025-04-24 21:12:09.820047,0 days 00:00:04.625263,3.953845147186386,Matern,360.0068358900487,0.7116091365918059,0.5,TPESampler,COMPLETE
435,0.9329375021477456,2025-04-24 21:12:06.586480,2025-04-24 21:12:13.198224,0 days 00:00:06.611744,0.035662554714990614,Matern,6498.973689685131,0.025028243515068785,0.5,TPESampler,COMPLETE
436,0.9329374977516798,2025-04-24 21:12:10.071248,2025-04-24 21:12:20.881446,0 days 00:00:10.810198,0.0009391726798013875,Matern,25.624881076024174,0.007791254334238362,0.5,TPESampler,COMPLETE
437,0.26238347478336066,2025-04-24 21:12:10.452397,2025-04-24 21:12:16.607352,0 days 00:00:06.154955,0.04276876411804318,Matern,595.3922834441009,0.14566566381105664,0.5,TPESampler,COMPLETE
438,0.26238344734728525,2025-04-24 21:12:13.460745,2025-04-24 21:12:18.553697,0 days 00:00:05.092952,0.022874879752104654,Matern,67.06226285890403,0.2677675644478498,0.5,TPESampler,COMPLETE
439,0.26238355853691053,2025-04-24 21:12:16.849136,2025-04-24 21:12:22.295320,0 days 00:00:05.446184,0.5725113305779704,Matern,70.96802669712667,0.360926574807291,0.5,TPESampler,COMPLETE
440,0.2623834729789693,2025-04-24 21:12:18.789608,2025-04-24 21:12:25.121634,0 days 00:00:06.332026,0.0042727583786853485,Matern,10.314722635043173,0.7663539541427509,0.5,TPESampler,COMPLETE
441,0.2623835102781961,2025-04-24 21:12:21.125471,2025-04-24 21:12:26.690158,0 days 00:00:05.564687,0.00749270973356299,Matern,389.53110954049004,0.9895163574180572,0.5,TPESampler,COMPLETE
442,0.9329374964333066,2025-04-24 21:12:22.551210,2025-04-24 21:12:27.001870,0 days 00:00:04.450660,0.02015094089370549,Matern,8.912620994803481,0.006181556754916401,0.5,TPESampler,COMPLETE
443,0.26238348018528107,2025-04-24 21:12:25.377598,2025-04-24 21:12:29.910018,0 days 00:00:04.532420,0.4240694498002939,Matern,0.44098710124632096,0.2680687566434256,0.5,TPESampler,COMPLETE
444,0.975904759509241,2025-04-24 21:12:26.921084,2025-04-24 21:12:35.592703,0 days 00:00:08.671619,0.004533139694466889,Matern,450.3834620904704,0.014527507593262498,0.5,TPESampler,COMPLETE
445,0.9329374974330715,2025-04-24 21:12:27.292664,2025-04-24 21:12:35.793922,0 days 00:00:08.501258,0.003602753995246449,RBF,0.043213838367462204,0.8758394354863439,0.5,TPESampler,COMPLETE
446,0.9329374980112509,2025-04-24 21:12:30.160683,2025-04-24 21:12:35.671781,0 days 00:00:05.511098,0.003749634692507278,RBF,4.869697937373502,0.001561642568565993,0.5,TPESampler,COMPLETE
447,0.9329374982295906,2025-04-24 21:12:35.743388,2025-04-24 21:12:44.800250,0 days 00:00:09.056862,0.006116107579564017,Matern,313.04095880479167,0.010187676849678756,0.5,TPESampler,COMPLETE
448,0.26238347467665263,2025-04-24 21:12:35.819770,2025-04-24 21:12:42.868512,0 days 00:00:07.048742,0.07047503230446021,Matern,966.4595590425668,0.7807345813382491,0.5,TPESampler,COMPLETE
449,0.2623834747741703,2025-04-24 21:12:36.018448,2025-04-24 21:12:42.012124,0 days 00:00:05.993676,0.16689585261842224,Matern,1094.109840983643,0.5936623661703426,0.5,TPESampler,COMPLETE
450,0.26238347644427135,2025-04-24 21:12:42.261437,2025-04-24 21:12:47.066105,0 days 00:00:04.804668,0.37893345656809824,Matern,19.121330705268196,0.641064647690707,0.5,TPESampler,COMPLETE
451,0.2623834745420406,2025-04-24 21:12:43.122114,2025-04-24 21:12:50.917386,0 days 00:00:07.795272,0.07851145661327857,Matern,349.3227202984381,0.853620890170995,0.5,TPESampler,COMPLETE
452,0.2737566004026729,2025-04-24 21:12:45.057443,2025-04-24 21:12:52.814062,0 days 00:00:07.756619,0.10691345418711537,Matern,598.5966400007196,0.5190366270563591,2.5,TPESampler,COMPLETE
453,0.2737565677630861,2025-04-24 21:12:47.320550,2025-04-24 21:12:52.125103,0 days 00:00:04.804553,0.06128380397433358,Matern,4.2545260670545915,0.9735692767206529,2.5,TPESampler,COMPLETE
454,0.9329374976974619,2025-04-24 21:12:51.172142,2025-04-24 21:13:01.568554,0 days 00:00:10.396412,0.0019315724662816002,Matern,21.95128959426056,0.030181699131571257,0.5,TPESampler,COMPLETE
455,0.2623835077041886,2025-04-24 21:12:52.385353,2025-04-24 21:12:58.048729,0 days 00:00:05.663376,0.06142589178870354,Matern,230.95965394041463,0.9732782374270039,0.5,TPESampler,COMPLETE
456,0.26238347562729764,2025-04-24 21:12:53.041600,2025-04-24 21:12:58.449233,0 days 00:00:05.407633,1737.5116890260233,Matern,0.9667692761558913,0.0020965159226721598,0.5,TPESampler,COMPLETE
457,0.2623834199870186,2025-04-24 21:12:58.279050,2025-04-24 21:13:02.941162,0 days 00:00:04.662112,1.0056312727628136,Matern,13.856939944141956,0.7859919364437095,0.5,TPESampler,COMPLETE
