number,value,datetime_start,datetime_complete,duration,params_constant_value,params_kernel_type,params_length_scale,params_noise_level,params_nu,system_attrs_auto:sampler,state
1147,0.26238351821159184,2025-04-24 21:36:29.326688,2025-04-24 21:36:34.805119,0 days 00:00:05.478431,3.4688390025855913,Matern,1368.8693343437928,0.7147235909030624,0.5,TPESampler,COMPLETE
1148,0.2623834908563309,2025-04-24 21:36:29.373478,2025-04-24 21:36:36.575131,0 days 00:00:07.201653,0.029414669033883782,Matern,4224.024585339645,0.8214114377567422,0.5,TPESampler,COMPLETE
1149,0.26238347605991075,2025-04-24 21:36:30.458298,2025-04-24 21:36:40.104630,0 days 00:00:09.646332,1.6713193936607365,Matern,0.07583674835222282,0.8694137636890779,0.5,TPESampler,COMPLETE
1150,0.26238347169366016,2025-04-24 21:36:35.071698,2025-04-24 21:36:41.387393,0 days 00:00:06.315695,0.24463217390693678,Matern,1346.370688107488,0.8023777080560974,0.5,TPESampler,COMPLETE
1151,0.9928365741168751,2025-04-24 21:36:36.787384,2025-04-24 21:36:41.412135,0 days 00:00:04.624751,0.18764813627983887,RBF,99375.52358025714,0.845459447722157,0.5,TPESampler,COMPLETE
1152,0.2623834779415817,2025-04-24 21:36:40.366550,2025-04-24 21:36:46.413865,0 days 00:00:06.047315,0.002868293568290301,Matern,2.2313267210774717,0.009834536646190153,0.5,TPESampler,COMPLETE
1153,0.26238347499851916,2025-04-24 21:36:41.552072,2025-04-24 21:36:47.643966,0 days 00:00:06.091894,80.79252840020638,Matern,51235.13729322511,0.7794957331789564,0.5,TPESampler,COMPLETE
1154,0.2623831562828096,2025-04-24 21:36:41.636870,2025-04-24 21:36:46.081264,0 days 00:00:04.444394,0.44159867805501357,Matern,4.097723400658057,0.06807936635892782,0.5,TPESampler,COMPLETE
1155,0.26238347344082835,2025-04-24 21:36:46.522592,2025-04-24 21:36:51.444442,0 days 00:00:04.921850,0.20444712307182963,Matern,0.30078442854511345,0.7446287345854276,0.5,TPESampler,COMPLETE
1156,0.2623835396371932,2025-04-24 21:36:46.590033,2025-04-24 21:36:51.701464,0 days 00:00:05.111431,44.013812204598864,Matern,2.2740527934261348,0.10551895105141597,0.5,TPESampler,COMPLETE
1157,0.2623834367858499,2025-04-24 21:36:47.949583,2025-04-24 21:36:52.885670,0 days 00:00:04.936087,0.7352882844313621,Matern,8.223531530995276,0.14559800092488379,0.5,TPESampler,COMPLETE
1158,0.2623834241838889,2025-04-24 21:36:51.658837,2025-04-24 21:36:56.969718,0 days 00:00:05.310881,5.410730763941125,Matern,0.2524035198495856,0.011214270595520682,0.5,TPESampler,COMPLETE
1159,0.992835058387459,2025-04-24 21:36:51.981473,2025-04-24 21:36:54.798765,0 days 00:00:02.817292,557.9657810751996,RBF,1.053615091016723e-05,2.821319486355469e-08,0.5,TPESampler,COMPLETE
1160,0.26238345790477163,2025-04-24 21:36:53.147572,2025-04-24 21:36:57.687113,0 days 00:00:04.539541,2.3777711823668737,Matern,11.045331642221285,0.007448172566093061,0.5,TPESampler,COMPLETE
1161,0.2623834847923436,2025-04-24 21:36:55.043421,2025-04-24 21:36:59.686847,0 days 00:00:04.643426,0.12750587547475947,Matern,0.36656834718489045,0.09519285617058239,0.5,TPESampler,COMPLETE
1162,0.26238346924259487,2025-04-24 21:36:57.219582,2025-04-24 21:37:03.231189,0 days 00:00:06.011607,0.006415396757263638,Matern,0.24885442891299206,0.020852713004177823,0.5,TPESampler,COMPLETE
1163,0.26238347275020574,2025-04-24 21:36:57.929320,2025-04-24 21:37:05.133619,0 days 00:00:07.204299,0.0020930444934736388,Matern,0.390278260978435,2.432206544929469e-09,0.5,TPESampler,COMPLETE
1164,0.26238351499931306,2025-04-24 21:36:59.936756,2025-04-24 21:37:06.022240,0 days 00:00:06.085484,0.7411047951473887,Matern,0.13090619820383181,0.0032297676265744027,0.5,TPESampler,COMPLETE
1165,0.27375659084834747,2025-04-24 21:37:03.489043,2025-04-24 21:37:09.165479,0 days 00:00:05.676436,0.13249932317668892,Matern,509.3371228777528,0.4751353782937785,2.5,TPESampler,COMPLETE
1166,0.2623834813056094,2025-04-24 21:37:05.382277,2025-04-24 21:37:13.762999,0 days 00:00:08.380722,0.01754012856346113,Matern,12.050687865442812,0.01829816247466614,0.5,TPESampler,COMPLETE
1167,0.26238347320644045,2025-04-24 21:37:06.257487,2025-04-24 21:37:11.199735,0 days 00:00:04.942248,14.233498193057256,Matern,2.906071531779848,0.14004531523151253,0.5,TPESampler,COMPLETE
1168,0.2737565983911622,2025-04-24 21:37:09.417992,2025-04-24 21:37:13.696334,0 days 00:00:04.278342,0.5911883835565412,Matern,0.5080868877965001,0.08919195897739053,2.5,TPESampler,COMPLETE
1169,0.26238350924463333,2025-04-24 21:37:11.464256,2025-04-24 21:37:16.787575,0 days 00:00:05.323319,0.1673938785926982,Matern,41.63524695535692,0.011562569710920529,0.5,TPESampler,COMPLETE
1170,0.2623834747941207,2025-04-24 21:37:13.888748,2025-04-24 21:37:18.333259,0 days 00:00:04.444511,0.19831906523670303,Matern,0.7735230965747273,0.9124274780182727,0.5,TPESampler,COMPLETE
1171,0.26238347777503707,2025-04-24 21:37:13.995265,2025-04-24 21:37:18.849731,0 days 00:00:04.854466,0.26813029067975125,Matern,4.90156198621549,0.03182804295067551,0.5,TPESampler,COMPLETE
1172,0.26238350330260674,2025-04-24 21:37:17.045009,2025-04-24 21:37:21.416135,0 days 00:00:04.371126,9.947300243137636,Matern,0.8729645155809042,0.2851822409547919,0.5,TPESampler,COMPLETE
1173,0.26238348615274365,2025-04-24 21:37:18.587668,2025-04-24 21:37:23.436422,0 days 00:00:04.848754,0.5591328232478282,Matern,6.410595998665113,0.09801300375634077,0.5,TPESampler,COMPLETE
1174,0.28251755859707484,2025-04-24 21:37:19.077463,2025-04-24 21:37:26.382078,0 days 00:00:07.304615,19.681579763597618,RBF,14.907506676927065,0.17682303258608034,0.5,TPESampler,COMPLETE
1175,0.9928350582831248,2025-04-24 21:37:21.675645,2025-04-24 21:37:26.963826,0 days 00:00:05.288181,95953.9835307826,Matern,0.015558107737002358,0.14935162218756173,0.5,TPESampler,COMPLETE
1176,0.26787471644035327,2025-04-24 21:37:23.824053,2025-04-24 21:37:28.985350,0 days 00:00:05.161297,0.12210623441789752,Matern,2.342985038642023,0.23208351330899663,1.5,TPESampler,COMPLETE
1177,0.9329374977484476,2025-04-24 21:37:26.921914,2025-04-24 21:37:36.373913,0 days 00:00:09.451999,0.0018834810971761215,Matern,1762.6060071343657,0.008458511722467432,0.5,TPESampler,COMPLETE
1178,0.2623834717625213,2025-04-24 21:37:27.230041,2025-04-24 21:37:31.951982,0 days 00:00:04.721941,0.06959467391522116,Matern,8.819513550303684,0.5729254925591518,0.5,TPESampler,COMPLETE
1179,0.2623835044563706,2025-04-24 21:37:29.237930,2025-04-24 21:37:34.180832,0 days 00:00:04.942902,156.1676037897222,Matern,6.206314323589472,0.014865569323162688,0.5,TPESampler,COMPLETE
1180,0.2623834330974743,2025-04-24 21:37:32.201289,2025-04-24 21:37:37.140347,0 days 00:00:04.939058,0.2212655414874654,Matern,0.29367599383423443,0.005620534098326323,0.5,TPESampler,COMPLETE
1181,0.27375660120520107,2025-04-24 21:37:34.433533,2025-04-24 21:37:39.598687,0 days 00:00:05.165154,67693.74856764587,Matern,49.45716680604827,0.0009744639661413486,2.5,TPESampler,COMPLETE
1182,0.2623834590807915,2025-04-24 21:37:36.621709,2025-04-24 21:37:41.178560,0 days 00:00:04.556851,379.0805849777547,Matern,0.8603036220652776,0.9798104646815238,0.5,TPESampler,COMPLETE
1183,0.9928365523405392,2025-04-24 21:37:37.350497,2025-04-24 21:37:41.823460,0 days 00:00:04.472963,0.0002338753675158829,Matern,89096.77833424849,0.639991212366034,0.5,TPESampler,COMPLETE
1184,0.26238347320758554,2025-04-24 21:37:39.859341,2025-04-24 21:37:45.081735,0 days 00:00:05.222394,0.4981144805207371,Matern,22.306002579601515,0.03107039747594419,0.5,TPESampler,COMPLETE
1185,0.26238347248047383,2025-04-24 21:37:41.392965,2025-04-24 21:37:46.677792,0 days 00:00:05.284827,1.5821906793851936,Matern,2.976820488223467,0.5708198707772282,0.5,TPESampler,COMPLETE
1186,0.26238347582624066,2025-04-24 21:37:42.053145,2025-04-24 21:37:51.353795,0 days 00:00:09.300650,339.13101185795426,Matern,0.0855620888995166,0.0058562676964666535,0.5,TPESampler,COMPLETE
1187,0.2623835022857041,2025-04-24 21:37:45.364122,2025-04-24 21:37:50.500947,0 days 00:00:05.136825,0.008929211035991681,Matern,182.795686477137,0.11004113420574257,0.5,TPESampler,COMPLETE
1188,0.9928365741124567,2025-04-24 21:37:46.947615,2025-04-24 21:37:50.318979,0 days 00:00:03.371364,3.216598328196029e-07,RBF,27839.054774591834,0.022274140356422188,1.5,TPESampler,COMPLETE
1189,0.9928286815559212,2025-04-24 21:37:50.499050,2025-04-24 21:37:52.889668,0 days 00:00:02.390618,29247.577406718523,RBF,0.001074849872000632,0.0006428171003059142,0.5,TPESampler,COMPLETE
1190,0.2623834819184831,2025-04-24 21:37:50.779343,2025-04-24 21:37:55.962686,0 days 00:00:05.183343,0.03496042840143457,Matern,91.02748269851921,0.0776714365406525,0.5,TPESampler,COMPLETE
1191,0.9329374977450778,2025-04-24 21:37:51.599254,2025-04-24 21:37:59.296138,0 days 00:00:07.696884,0.15924157983200593,Matern,4487.180484643618,0.014633320413519384,0.5,TPESampler,COMPLETE
1192,0.28251756302538433,2025-04-24 21:37:53.152307,2025-04-24 21:37:56.806982,0 days 00:00:03.654675,0.6733535208182698,RBF,4.37619518532515,0.19519161025521975,2.5,TPESampler,COMPLETE
1193,0.9329374977478712,2025-04-24 21:37:56.229160,2025-04-24 21:37:59.572590,0 days 00:00:03.343430,20.327351978805297,Matern,0.0007365473880214244,0.0027035348002798724,0.5,TPESampler,COMPLETE
1194,0.2623834736069892,2025-04-24 21:37:57.094403,2025-04-24 21:38:02.430768,0 days 00:00:05.336365,0.662545746562693,Matern,15.361340507493791,0.030981350466645203,0.5,TPESampler,COMPLETE
1195,0.2623834702528387,2025-04-24 21:37:59.529574,2025-04-24 21:38:04.475412,0 days 00:00:04.945838,3.1325636905699037,Matern,45.02790784675402,0.03325775308839592,0.5,TPESampler,COMPLETE
1196,0.26238347073705953,2025-04-24 21:37:59.823686,2025-04-24 21:38:10.531400,0 days 00:00:10.707714,0.000482122073005606,Matern,119.2062011792308,0.725098519537577,0.5,TPESampler,COMPLETE
1197,0.273756599904856,2025-04-24 21:38:02.695621,2025-04-24 21:38:07.213609,0 days 00:00:04.517988,8.374759528228902,Matern,19.857722909940943,0.729216703605595,2.5,TPESampler,COMPLETE
1198,0.9329374982333781,2025-04-24 21:38:04.719372,2025-04-24 21:38:11.880169,0 days 00:00:07.160797,1.4320451002858794e-05,RBF,2.323610668464469,2.3551137344068835e-05,0.5,TPESampler,COMPLETE
1199,0.9928365741080463,2025-04-24 21:38:07.482459,2025-04-24 21:38:12.798789,0 days 00:00:05.316330,0.20488564042812235,Matern,43128.92378255084,0.03610374133641105,1.5,TPESampler,COMPLETE
1200,0.26238345451072814,2025-04-24 21:38:10.803152,2025-04-24 21:38:15.552227,0 days 00:00:04.749075,4.356586082115024,Matern,175.41107426409835,0.025002639070298337,0.5,TPESampler,COMPLETE
1201,0.26238358734297035,2025-04-24 21:38:12.128260,2025-04-24 21:38:16.892567,0 days 00:00:04.764307,25.764651596434575,Matern,0.7688017947511095,0.5208545292188234,0.5,TPESampler,COMPLETE
1202,0.9329374972967782,2025-04-24 21:38:13.027613,2025-04-24 21:38:16.405805,0 days 00:00:03.378192,0.07697913190088855,Matern,12.446760941645769,0.00014860312026636336,0.5,TPESampler,COMPLETE
1203,0.2623834831969977,2025-04-24 21:38:15.813978,2025-04-24 21:38:21.363610,0 days 00:00:05.549632,1241.225052866862,Matern,7.099904399418114,0.013013210579865157,0.5,TPESampler,COMPLETE
1204,0.26238347634458703,2025-04-24 21:38:16.666280,2025-04-24 21:38:22.271303,0 days 00:00:05.605023,0.26599443382307,Matern,61.57161658755306,0.38469176706584585,0.5,TPESampler,COMPLETE
1205,0.9329374973394176,2025-04-24 21:38:17.140140,2025-04-24 21:38:27.205703,0 days 00:00:10.065563,0.005376185417131797,Matern,1172.4148944286787,0.04107547811412388,0.5,TPESampler,COMPLETE
1206,0.932937497745625,2025-04-24 21:38:21.588671,2025-04-24 21:38:29.093670,0 days 00:00:07.504999,0.05981750896636523,Matern,1791.5798266199095,0.012989466157226962,0.5,TPESampler,COMPLETE
1207,0.2623834726867813,2025-04-24 21:38:22.505959,2025-04-24 21:38:28.201255,0 days 00:00:05.695296,6173.195230896584,Matern,99008.11027429783,0.00933415043671254,0.5,TPESampler,COMPLETE
1208,0.26238346759820275,2025-04-24 21:38:27.457130,2025-04-24 21:38:31.911430,0 days 00:00:04.454300,34.425445237745855,Matern,85.02998706419261,0.06815564999558289,0.5,TPESampler,COMPLETE
1209,0.2678747957745155,2025-04-24 21:38:28.478482,2025-04-24 21:38:32.704202,0 days 00:00:04.225720,2.3427145008940244,Matern,14.054790932540872,0.287481063073804,1.5,TPESampler,COMPLETE
1210,0.2623834616845658,2025-04-24 21:38:29.362099,2025-04-24 21:38:32.797608,0 days 00:00:03.435509,0.06098095375235216,Matern,2.7577095287794093,0.9328353683393356,0.5,TPESampler,COMPLETE
1211,0.9329374968950072,2025-04-24 21:38:32.135808,2025-04-24 21:38:40.323810,0 days 00:00:08.188002,522.7743525588505,Matern,0.010129056028261075,0.8191313491663341,0.5,TPESampler,COMPLETE
1212,0.2623834710631438,2025-04-24 21:38:32.865590,2025-04-24 21:38:42.527825,0 days 00:00:09.662235,0.13673620900860678,Matern,1.6372840167818428,0.004647366953643087,0.5,TPESampler,COMPLETE
1213,0.26238349387853266,2025-04-24 21:38:33.403632,2025-04-24 21:38:42.456928,0 days 00:00:09.053296,717.3403314709246,Matern,72.35370948485522,0.6460155149506587,0.5,TPESampler,COMPLETE
1214,0.26238341989318786,2025-04-24 21:38:40.531845,2025-04-24 21:38:45.445988,0 days 00:00:04.914143,0.43863348113241,Matern,48.957659690061824,0.045633597778796414,0.5,TPESampler,COMPLETE
1215,0.9329374977089754,2025-04-24 21:38:42.593718,2025-04-24 21:38:49.924307,0 days 00:00:07.330589,0.004500871446292676,Matern,32988.85850288979,0.0001529035552983688,0.5,TPESampler,COMPLETE
1216,0.9928365555095353,2025-04-24 21:38:42.732860,2025-04-24 21:38:45.729468,0 days 00:00:02.996608,92511.38429395175,Matern,2.8731076639565303,0.010066023463064438,0.5,TPESampler,COMPLETE
1217,0.2623835702208238,2025-04-24 21:38:45.659934,2025-04-24 21:38:52.447613,0 days 00:00:06.787679,0.002646327830410893,Matern,24.091099896838664,0.8885158270808189,0.5,TPESampler,COMPLETE
1218,0.992836536328688,2025-04-24 21:38:46.006669,2025-04-24 21:38:51.228881,0 days 00:00:05.222212,0.012976228045149687,Matern,91183.69408961991,0.13375628942940665,0.5,TPESampler,COMPLETE
1219,0.26787473556506775,2025-04-24 21:38:50.178484,2025-04-24 21:38:56.076490,0 days 00:00:05.898006,2798.991661398524,Matern,785.1660482001407,0.04671962461852648,1.5,TPESampler,COMPLETE
1220,0.26238353806482345,2025-04-24 21:38:51.474503,2025-04-24 21:38:56.148821,0 days 00:00:04.674318,1.0084391781535973,Matern,5.879703162991043,0.8074028642687314,0.5,TPESampler,COMPLETE
1221,0.2623834677532245,2025-04-24 21:38:52.753841,2025-04-24 21:38:58.110944,0 days 00:00:05.357103,1.3577081138718863,Matern,2422.812159295821,0.028047717680090924,0.5,TPESampler,COMPLETE
1222,0.2623834815882798,2025-04-24 21:38:56.262550,2025-04-24 21:39:01.116705,0 days 00:00:04.854155,0.8287376784897766,Matern,35.6291684905911,0.7624162487989478,0.5,TPESampler,COMPLETE
1223,0.2623834747842369,2025-04-24 21:38:56.333491,2025-04-24 21:39:01.794153,0 days 00:00:05.460662,136.44783495127453,Matern,6.132637980706088,0.025152327178985547,0.5,TPESampler,COMPLETE
1224,0.2623834781661955,2025-04-24 21:38:58.344967,2025-04-24 21:39:04.687002,0 days 00:00:06.342035,1.5843483530956095,Matern,3580.9819587467186,0.04558537936172189,0.5,TPESampler,COMPLETE
1225,0.2737566244353513,2025-04-24 21:39:01.369248,2025-04-24 21:39:05.054185,0 days 00:00:03.684937,297.15508828134455,Matern,0.7318796892353873,0.01784080683973092,2.5,TPESampler,COMPLETE
1226,0.2623834416386606,2025-04-24 21:39:02.066838,2025-04-24 21:39:07.203699,0 days 00:00:05.136861,21.353517931657464,Matern,1741.4479804105777,0.058497648028393745,0.5,TPESampler,COMPLETE
1227,0.2623834884334196,2025-04-24 21:39:04.932473,2025-04-24 21:39:10.122933,0 days 00:00:05.190460,0.7049219410686136,Matern,275.09831423904285,0.6946386404192426,0.5,TPESampler,COMPLETE
1228,0.9329374975994337,2025-04-24 21:39:05.258756,2025-04-24 21:39:13.257289,0 days 00:00:07.998533,0.23071952183610306,Matern,69317.21744684123,0.01886375495606463,0.5,TPESampler,COMPLETE
1229,0.26787476752243683,2025-04-24 21:39:07.448771,2025-04-24 21:39:13.531542,0 days 00:00:06.082771,5320.798313107861,Matern,0.24825365449649894,0.20491187391404603,1.5,TPESampler,COMPLETE
1230,0.262383488747615,2025-04-24 21:39:10.375745,2025-04-24 21:39:15.714539,0 days 00:00:05.338794,18.514097554692775,Matern,0.46503487548675687,0.012230657012635773,0.5,TPESampler,COMPLETE
1231,0.9329374977104997,2025-04-24 21:39:13.489471,2025-04-24 21:39:17.016744,0 days 00:00:03.527273,0.0010499524111852168,RBF,0.00543538198149084,9.249513505918408e-06,2.5,TPESampler,COMPLETE
1232,0.26238379168574305,2025-04-24 21:39:13.831452,2025-04-24 21:39:17.351926,0 days 00:00:03.520474,1827.9706845143644,Matern,44.15588055221498,0.9599397805467148,0.5,TPESampler,COMPLETE
1233,0.2623834699191804,2025-04-24 21:39:15.960478,2025-04-24 21:39:20.726624,0 days 00:00:04.766146,15.864161448294608,Matern,39.4345248767018,0.03678037271324387,0.5,TPESampler,COMPLETE
1234,0.9928360744515974,2025-04-24 21:39:17.299758,2025-04-24 21:39:23.420794,0 days 00:00:06.121036,0.0009156449991051085,Matern,81996.75028628431,0.01565475220839714,0.5,TPESampler,COMPLETE
1235,0.2623834766318907,2025-04-24 21:39:17.629060,2025-04-24 21:39:25.378501,0 days 00:00:07.749441,11.249784583979858,Matern,0.133891802771511,0.738717886143748,0.5,TPESampler,COMPLETE
1236,0.9329374982286753,2025-04-24 21:39:20.977960,2025-04-24 21:39:26.509314,0 days 00:00:05.531354,0.06929883088316026,RBF,0.0011701507313954514,7.923764180589307e-07,0.5,TPESampler,COMPLETE
1237,0.2623835243198692,2025-04-24 21:39:23.678957,2025-04-24 21:39:28.541929,0 days 00:00:04.862972,0.01051468439245142,Matern,2420.880873095659,0.08812719253540875,0.5,TPESampler,COMPLETE
1238,0.9329374966228406,2025-04-24 21:39:25.629613,2025-04-24 21:39:30.670768,0 days 00:00:05.041155,93.69357982806005,Matern,79978.86087070407,0.0030302632421416566,0.5,TPESampler,COMPLETE
1239,0.2623834752943514,2025-04-24 21:39:26.765332,2025-04-24 21:39:31.942797,0 days 00:00:05.177465,0.03931209370133097,Matern,615.2463314314632,0.7179508497257115,0.5,TPESampler,COMPLETE
1240,0.26238347882919616,2025-04-24 21:39:28.794306,2025-04-24 21:39:33.597771,0 days 00:00:04.803465,0.008704825327795679,Matern,542.639838105313,0.9873411323455755,0.5,TPESampler,COMPLETE
1241,0.26238346356198106,2025-04-24 21:39:30.924778,2025-04-24 21:39:35.352548,0 days 00:00:04.427770,219.0504613076813,Matern,660.006501410802,0.055488600554722725,0.5,TPESampler,COMPLETE
1242,0.2623834759230384,2025-04-24 21:39:32.200178,2025-04-24 21:39:37.042916,0 days 00:00:04.842738,66.0825555973779,Matern,51.52262070936473,0.5613754280703187,0.5,TPESampler,COMPLETE
1243,0.2623836160107359,2025-04-24 21:39:33.841548,2025-04-24 21:39:38.229204,0 days 00:00:04.387656,54515.33656697242,Matern,21.25353400922065,0.6560496606905987,0.5,TPESampler,COMPLETE
1244,0.2623834665680588,2025-04-24 21:39:35.645814,2025-04-24 21:39:40.074103,0 days 00:00:04.428289,0.7323220910984916,Matern,0.3774712615211808,0.021807642419407768,0.5,TPESampler,COMPLETE
1245,0.2678747362051256,2025-04-24 21:39:37.272389,2025-04-24 21:39:44.215786,0 days 00:00:06.943397,9.869687297780121,Matern,8604.698478689987,0.8311610983129689,1.5,TPESampler,COMPLETE
1246,0.9329374976512087,2025-04-24 21:39:38.498735,2025-04-24 21:39:43.824570,0 days 00:00:05.325835,1.5049169245091867e-05,Matern,7.188510505662306e-05,5.64487313371476e-06,0.5,TPESampler,COMPLETE
1247,0.9329374965527105,2025-04-24 21:39:40.323511,2025-04-24 21:39:45.409504,0 days 00:00:05.085993,2.2974113611520613e-07,RBF,3.4633380038179087e-05,5.741043673794737e-06,1.5,TPESampler,COMPLETE
1248,0.9329374974919964,2025-04-24 21:39:44.069375,2025-04-24 21:39:51.116761,0 days 00:00:07.047386,2604.3596031696165,RBF,1.297577992711467e-05,0.00028684725688446526,2.5,TPESampler,COMPLETE
1249,0.2623834704849358,2025-04-24 21:39:44.455664,2025-04-24 21:39:50.442738,0 days 00:00:05.987074,1.3540020202850438,Matern,81129.0222620761,0.36093724657766674,0.5,TPESampler,COMPLETE
1250,0.26238352551743244,2025-04-24 21:39:45.663047,2025-04-24 21:39:54.050314,0 days 00:00:08.387267,575.2401942604384,Matern,0.1030062750106194,0.012657405765703612,0.5,TPESampler,COMPLETE
1251,0.2623834747098626,2025-04-24 21:39:50.710410,2025-04-24 21:39:56.644135,0 days 00:00:05.933725,21.11911879281704,Matern,57005.53350598199,0.05553849446947187,0.5,TPESampler,COMPLETE
1252,0.2623834168058975,2025-04-24 21:39:51.341165,2025-04-24 21:39:56.334902,0 days 00:00:04.993737,0.032850236150310026,Matern,1.2152315305707253,0.014068674165930859,0.5,TPESampler,COMPLETE
1253,0.26238346240587507,2025-04-24 21:39:54.306146,2025-04-24 21:39:59.982504,0 days 00:00:05.676358,17.892576188161787,Matern,81494.00497616974,0.056731537732468314,0.5,TPESampler,COMPLETE
1254,0.262383475989394,2025-04-24 21:39:56.600225,2025-04-24 21:40:01.307055,0 days 00:00:04.706830,4.417778551384812,Matern,190.5166333376579,0.03876520387116134,0.5,TPESampler,COMPLETE
1255,0.9329374977330298,2025-04-24 21:39:56.958175,2025-04-24 21:40:04.000031,0 days 00:00:07.041856,0.4313658961479623,Matern,1863.7445738595247,0.018881779187810414,0.5,TPESampler,COMPLETE
1256,0.26238348136938705,2025-04-24 21:40:00.242213,2025-04-24 21:40:04.945235,0 days 00:00:04.703022,80.23018441612342,Matern,1.2450037726029928,0.6986636747885918,0.5,TPESampler,COMPLETE
1257,0.2623835076847632,2025-04-24 21:40:01.557273,2025-04-24 21:40:06.863984,0 days 00:00:05.306711,0.023796348344550505,Matern,33.55393431286233,0.04249894922933135,0.5,TPESampler,COMPLETE
1258,0.26238347847986915,2025-04-24 21:40:04.279958,2025-04-24 21:40:09.042701,0 days 00:00:04.762743,25.072037878090892,Matern,96.17403854996923,0.8086566051572327,0.5,TPESampler,COMPLETE
1259,0.9928350583779992,2025-04-24 21:40:05.228758,2025-04-24 21:40:08.508348,0 days 00:00:03.279590,22.61438172450201,Matern,0.000233883858550361,1.8197337078717645e-06,1.5,TPESampler,COMPLETE
1260,0.26238392354333817,2025-04-24 21:40:07.153233,2025-04-24 21:40:13.196883,0 days 00:00:06.043650,0.01124605767220433,Matern,225.2117360390947,0.9995765970447683,0.5,TPESampler,COMPLETE
