number,value,datetime_start,datetime_complete,duration,params_learning_rate,params_max_depth,params_max_features,params_min_samples_leaf,params_min_samples_split,params_n_estimators,params_subsample,system_attrs_auto:sampler,state
369,0.24367304051080343,2025-04-24 22:07:20.153968,2025-04-24 22:07:22.997191,0 days 00:00:02.843223,0.09555189525920992,10,sqrt,1,18,1398,0.8725217364465074,TPESampler,COMPLETE
370,0.33248648666842096,2025-04-24 22:07:20.973911,2025-04-24 22:07:29.722541,0 days 00:00:08.748630,0.03787210825829823,11,,8,3,1317,0.9911384457487463,TPESampler,COMPLETE
371,0.23433990758736173,2025-04-24 22:07:22.136737,2025-04-24 22:07:24.508540,0 days 00:00:02.371803,0.06840562577529025,10,sqrt,1,11,1407,0.8779171412621437,TPESampler,COMPLETE
372,0.35370342499563795,2025-04-24 22:07:23.216575,2025-04-24 22:07:28.736038,0 days 00:00:05.519463,0.016027575592516715,7,,7,12,934,0.971527687734165,TPESampler,COMPLETE
373,0.23772784618702708,2025-04-24 22:07:24.697109,2025-04-24 22:07:26.953103,0 days 00:00:02.255994,0.09529627465445155,8,sqrt,1,18,1275,0.7409898905410833,TPESampler,COMPLETE
374,0.25494890959125943,2025-04-24 22:07:27.124674,2025-04-24 22:07:29.198800,0 days 00:00:02.074126,0.05613296921528377,11,sqrt,2,19,1290,0.8024710615940749,TPESampler,COMPLETE
375,0.24619959733330032,2025-04-24 22:07:29.158000,2025-04-24 22:07:32.753344,0 days 00:00:03.595344,0.0449631440960585,9,sqrt,1,9,1448,0.8646497732408019,TPESampler,COMPLETE
376,0.44980681080392126,2025-04-24 22:07:29.404307,2025-04-24 22:07:32.610919,0 days 00:00:03.206612,0.03022434194520557,3,sqrt,9,17,1437,0.6354648102482148,TPESampler,COMPLETE
377,0.30506742757435384,2025-04-24 22:07:29.895135,2025-04-24 22:07:33.382030,0 days 00:00:03.486895,0.022598731456477995,7,sqrt,2,15,1472,0.6970828236312805,TPESampler,COMPLETE
378,0.24494613858383193,2025-04-24 22:07:32.797846,2025-04-24 22:07:35.852311,0 days 00:00:03.054465,0.08477153622176678,10,sqrt,1,8,1485,0.8412884871491803,TPESampler,COMPLETE
379,0.27384401455404445,2025-04-24 22:07:32.939064,2025-04-24 22:07:41.460055,0 days 00:00:08.520991,0.06021967568875416,12,,1,13,1254,0.7768532845009374,TPESampler,COMPLETE
380,0.43939572010860384,2025-04-24 22:07:33.607549,2025-04-24 22:07:35.593852,0 days 00:00:01.986303,0.08818236107696444,12,log2,8,5,1044,0.7294181971512121,TPESampler,COMPLETE
381,0.24125498059751846,2025-04-24 22:07:35.768563,2025-04-24 22:07:37.995508,0 days 00:00:02.226945,0.06578170920786111,9,sqrt,1,11,1230,0.8457370221357415,TPESampler,COMPLETE
382,0.3692439157316777,2025-04-24 22:07:36.057573,2025-04-24 22:07:37.448729,0 days 00:00:01.391156,0.01751712428671125,7,,4,7,263,0.610844125449882,TPESampler,COMPLETE
383,0.3530820629414463,2025-04-24 22:07:37.642083,2025-04-24 22:07:39.596913,0 days 00:00:01.954830,0.09734067880896151,10,log2,6,19,1097,0.9465412886999343,TPESampler,COMPLETE
384,0.2306312431973227,2025-04-24 22:07:38.155605,2025-04-24 22:07:40.973508,0 days 00:00:02.817903,0.09341163840488166,11,sqrt,1,18,1460,0.8236697218802524,TPESampler,COMPLETE
385,0.2544121983135387,2025-04-24 22:07:39.889645,2025-04-24 22:07:42.471333,0 days 00:00:02.581688,0.08957273451155104,8,sqrt,2,18,1240,0.9368277061123123,TPESampler,COMPLETE
386,0.26544799657359347,2025-04-24 22:07:41.139431,2025-04-24 22:07:44.464250,0 days 00:00:03.324819,0.05993288939272264,9,sqrt,2,17,1456,0.84696619867433,TPESampler,COMPLETE
387,0.4082758047877181,2025-04-24 22:07:41.625972,2025-04-24 22:07:44.165260,0 days 00:00:02.539288,0.016080384374718905,9,sqrt,8,12,1045,0.8288961450968371,TPESampler,COMPLETE
388,0.24007621025173886,2025-04-24 22:07:42.657323,2025-04-24 22:07:46.034701,0 days 00:00:03.377378,0.08736795649927931,11,sqrt,1,17,1415,0.7658402246480653,TPESampler,COMPLETE
389,0.2485633905622404,2025-04-24 22:07:44.380007,2025-04-24 22:07:47.542316,0 days 00:00:03.162309,0.09334349363499082,12,log2,1,18,1434,0.7902021828659747,TPESampler,COMPLETE
390,0.2521747089945662,2025-04-24 22:07:44.702991,2025-04-24 22:07:47.456790,0 days 00:00:02.753799,0.07438631973375295,9,sqrt,1,18,1162,0.8562658090883785,TPESampler,COMPLETE
391,0.25015068139547136,2025-04-24 22:07:46.317205,2025-04-24 22:07:49.001094,0 days 00:00:02.683889,0.09121462801670009,10,sqrt,2,9,1246,0.8501445948370087,TPESampler,COMPLETE
392,0.3960553367227904,2025-04-24 22:07:47.848949,2025-04-24 22:07:49.329428,0 days 00:00:01.480479,0.0777811874450973,8,log2,4,6,433,0.658884687531277,TPESampler,COMPLETE
393,0.27531783234601687,2025-04-24 22:07:47.946335,2025-04-24 22:07:50.944304,0 days 00:00:02.997969,0.047860512136547184,9,sqrt,2,20,1173,0.8593437549486098,TPESampler,COMPLETE
394,0.26415646376367635,2025-04-24 22:07:49.449982,2025-04-24 22:07:57.059083,0 days 00:00:07.609101,0.09614898673024147,9,,1,16,1226,0.9221578875957792,TPESampler,COMPLETE
395,0.31621407845245136,2025-04-24 22:07:49.794444,2025-04-24 22:07:58.208746,0 days 00:00:08.414302,0.0944388057236969,11,,2,20,1364,0.7924388174356495,TPESampler,COMPLETE
396,0.2512785372943602,2025-04-24 22:07:51.143070,2025-04-24 22:07:53.251588,0 days 00:00:02.108518,0.0674701147602055,9,sqrt,1,19,1298,0.8371481000120378,TPESampler,COMPLETE
397,0.7596456754588937,2025-04-24 22:07:53.422610,2025-04-24 22:07:54.754867,0 days 00:00:01.332257,0.011268814390844076,3,log2,9,15,464,0.6963648905881542,TPESampler,COMPLETE
398,0.41671299985901206,2025-04-24 22:07:54.989175,2025-04-24 22:07:56.944598,0 days 00:00:01.955423,0.020220097568706435,9,log2,5,7,1473,0.6376993346483635,TPESampler,COMPLETE
399,0.27217992831333454,2025-04-24 22:07:57.116077,2025-04-24 22:08:00.151288,0 days 00:00:03.035211,0.06377603742534495,9,sqrt,3,11,1429,0.8678923733751627,TPESampler,COMPLETE
400,0.2918167083548465,2025-04-24 22:07:57.333159,2025-04-24 22:08:00.061333,0 days 00:00:02.728174,0.06792811947148193,8,log2,1,15,1154,0.9858474480480083,TPESampler,COMPLETE
401,0.24618847404754868,2025-04-24 22:07:58.583385,2025-04-24 22:08:01.824092,0 days 00:00:03.240707,0.09780548976409754,9,sqrt,1,20,1366,0.9320244896270161,TPESampler,COMPLETE
402,0.282709239956375,2025-04-24 22:08:00.224003,2025-04-24 22:08:03.741563,0 days 00:00:03.517560,0.09988403783193076,9,sqrt,4,15,1431,0.8300841419004157,TPESampler,COMPLETE
403,0.25853214184263473,2025-04-24 22:08:00.301844,2025-04-24 22:08:03.612004,0 days 00:00:03.310160,0.0981726294405461,10,sqrt,2,16,1320,0.8469417008998671,TPESampler,COMPLETE
404,0.3222125618537088,2025-04-24 22:08:02.011255,2025-04-24 22:08:03.537643,0 days 00:00:01.526388,0.02126842646592018,11,sqrt,1,13,438,0.9413036864135366,TPESampler,COMPLETE
405,0.5312248931442107,2025-04-24 22:08:03.685852,2025-04-24 22:08:04.748346,0 days 00:00:01.062494,0.027134586766104248,6,log2,4,2,334,0.6474533932665358,TPESampler,COMPLETE
406,0.24601832138333837,2025-04-24 22:08:03.774561,2025-04-24 22:08:07.685116,0 days 00:00:03.910555,0.07058340064934195,10,sqrt,1,18,1492,0.8185837445680043,TPESampler,COMPLETE
407,0.25301726369018185,2025-04-24 22:08:03.950292,2025-04-24 22:08:07.628700,0 days 00:00:03.678408,0.05439728895639567,8,sqrt,1,12,1465,0.8410482169114574,TPESampler,COMPLETE
408,0.24955735302521787,2025-04-24 22:08:04.943570,2025-04-24 22:08:07.679104,0 days 00:00:02.735534,0.0807141750857619,7,sqrt,1,9,1081,0.9001103950416465,TPESampler,COMPLETE
409,0.23493409857631048,2025-04-24 22:08:07.809629,2025-04-24 22:08:10.833606,0 days 00:00:03.023977,0.0846513646788472,11,sqrt,1,17,1461,0.8216742750953522,TPESampler,COMPLETE
410,0.26682071188520523,2025-04-24 22:08:07.818537,2025-04-24 22:08:10.860540,0 days 00:00:03.042003,0.07217161963008085,11,sqrt,4,19,1406,0.8177379270701522,TPESampler,COMPLETE
411,0.34273361607122116,2025-04-24 22:08:07.834724,2025-04-24 22:08:10.602156,0 days 00:00:02.767432,0.0206134171235883,7,,4,5,402,0.8368935646646373,TPESampler,COMPLETE
412,0.25838202348968503,2025-04-24 22:08:10.789786,2025-04-24 22:08:13.340647,0 days 00:00:02.550861,0.07161967062518168,9,sqrt,1,4,1038,0.8461724682247893,TPESampler,COMPLETE
413,0.2521690984832384,2025-04-24 22:08:11.056314,2025-04-24 22:08:14.645280,0 days 00:00:03.588966,0.09669842525109268,10,sqrt,1,16,1322,0.8331932077623145,TPESampler,COMPLETE
414,0.22421170181094338,2025-04-24 22:08:11.104502,2025-04-24 22:08:14.786069,0 days 00:00:03.681567,0.06889555187439639,9,sqrt,1,15,1380,0.8765876737508956,TPESampler,COMPLETE
415,0.24846244372873627,2025-04-24 22:08:13.523123,2025-04-24 22:08:16.501925,0 days 00:00:02.978802,0.09841963832764605,10,sqrt,1,11,1329,0.991485448008129,TPESampler,COMPLETE
416,0.2507832838229637,2025-04-24 22:08:14.941495,2025-04-24 22:08:17.836423,0 days 00:00:02.894928,0.04635924158356956,11,sqrt,1,17,1110,0.7505623550537491,TPESampler,COMPLETE
417,0.5250593311388483,2025-04-24 22:08:15.045325,2025-04-24 22:08:16.336249,0 days 00:00:01.290924,0.031121367283970837,4,log2,1,10,234,0.8658946476011726,TPESampler,COMPLETE
418,0.2541352627022134,2025-04-24 22:08:16.544066,2025-04-24 22:08:18.658068,0 days 00:00:02.114002,0.058593518068027706,9,sqrt,1,20,971,0.8762781372671246,TPESampler,COMPLETE
419,0.2957103239546461,2025-04-24 22:08:16.674774,2025-04-24 22:08:24.266109,0 days 00:00:07.591335,0.011288664819436396,10,,1,20,1186,0.8740385688136326,TPESampler,COMPLETE
420,0.2546205487186999,2025-04-24 22:08:18.007085,2025-04-24 22:08:20.608622,0 days 00:00:02.601537,0.061348179587270804,9,sqrt,2,14,1398,0.8677027887893547,TPESampler,COMPLETE
421,0.2426642656180206,2025-04-24 22:08:18.838826,2025-04-24 22:08:21.335806,0 days 00:00:02.496980,0.06773765017471439,9,sqrt,1,15,1344,0.9398090731204662,TPESampler,COMPLETE
422,0.2620744635817582,2025-04-24 22:08:20.797224,2025-04-24 22:08:22.998563,0 days 00:00:02.201339,0.0559119261181686,10,sqrt,1,16,1069,0.862676328863274,TPESampler,COMPLETE
423,0.26998939146868606,2025-04-24 22:08:21.539574,2025-04-24 22:08:23.223015,0 days 00:00:01.683441,0.08785553552461257,9,log2,1,7,801,0.9056425203293367,TPESampler,COMPLETE
424,0.2609392024541256,2025-04-24 22:08:23.174686,2025-04-24 22:08:25.871924,0 days 00:00:02.697238,0.04815854955456183,12,sqrt,2,20,1372,0.8512115340556607,TPESampler,COMPLETE
425,0.32380919131206193,2025-04-24 22:08:23.453299,2025-04-24 22:08:29.000015,0 days 00:00:05.546716,0.016911292481068863,4,,2,8,1311,0.8853334814868703,TPESampler,COMPLETE
426,0.6462005536745555,2025-04-24 22:08:24.442103,2025-04-24 22:08:25.552452,0 days 00:00:01.110349,0.02127398995322976,7,log2,8,3,338,0.8716514429535924,TPESampler,COMPLETE
427,0.24962127599670428,2025-04-24 22:08:25.738817,2025-04-24 22:08:28.122040,0 days 00:00:02.383223,0.06568421185047406,10,sqrt,1,20,1340,0.8856715880190517,TPESampler,COMPLETE
428,0.2908064418069463,2025-04-24 22:08:26.061992,2025-04-24 22:08:30.223053,0 days 00:00:04.161061,0.05707894773067503,5,,3,5,943,0.9005938990724215,TPESampler,COMPLETE
429,0.2721168442600628,2025-04-24 22:08:28.296601,2025-04-24 22:08:30.817656,0 days 00:00:02.521055,0.09265748810300964,9,sqrt,3,19,1059,0.8888733420713575,TPESampler,COMPLETE
430,0.24801702070471857,2025-04-24 22:08:29.189501,2025-04-24 22:08:31.905658,0 days 00:00:02.716157,0.07037377958170654,10,sqrt,1,17,1144,0.8345701735063524,TPESampler,COMPLETE
431,0.327498344163854,2025-04-24 22:08:30.402485,2025-04-24 22:08:32.280152,0 days 00:00:01.877667,0.023370541549158467,7,sqrt,1,5,674,0.9389085250040498,TPESampler,COMPLETE
432,0.2306745968139383,2025-04-24 22:08:31.016486,2025-04-24 22:08:34.395511,0 days 00:00:03.379025,0.09863383011462702,11,sqrt,1,16,1402,0.9010583063603725,TPESampler,COMPLETE
433,0.2523151916663034,2025-04-24 22:08:32.088128,2025-04-24 22:08:34.976106,0 days 00:00:02.887978,0.09658114811395102,8,sqrt,1,16,1166,0.8639047663184494,TPESampler,COMPLETE
434,0.31186775207115586,2025-04-24 22:08:32.516984,2025-04-24 22:08:35.322331,0 days 00:00:02.805347,0.06777759452074388,7,log2,2,20,1240,0.9135974122954209,TPESampler,COMPLETE
435,0.24610826380848186,2025-04-24 22:08:34.596179,2025-04-24 22:08:37.973347,0 days 00:00:03.377168,0.05076009208750957,10,sqrt,1,14,1408,0.8503456382328924,TPESampler,COMPLETE
436,0.24056412178221576,2025-04-24 22:08:35.164264,2025-04-24 22:08:38.530973,0 days 00:00:03.366709,0.09420762500985098,11,sqrt,1,17,1400,0.8378282142372278,TPESampler,COMPLETE
437,0.244884674288609,2025-04-24 22:08:35.527407,2025-04-24 22:08:39.032633,0 days 00:00:03.505226,0.0925337918636308,10,sqrt,2,14,1468,0.8315448805576184,TPESampler,COMPLETE
438,0.3843478350577023,2025-04-24 22:08:38.159727,2025-04-24 22:08:40.869343,0 days 00:00:02.709616,0.01972334367439128,5,sqrt,6,6,1170,0.6756635146771016,TPESampler,COMPLETE
439,0.33546950081148214,2025-04-24 22:08:38.724039,2025-04-24 22:08:41.875668,0 days 00:00:03.151629,0.016430704689071814,5,sqrt,3,5,1425,0.9871306805252433,TPESampler,COMPLETE
440,0.24232500344701205,2025-04-24 22:08:39.209973,2025-04-24 22:08:42.569480,0 days 00:00:03.359507,0.09916651054044984,8,sqrt,1,20,1350,0.8011517707058288,TPESampler,COMPLETE
441,0.24432360505006123,2025-04-24 22:08:41.065219,2025-04-24 22:08:44.369866,0 days 00:00:03.304647,0.0701300304454997,7,sqrt,1,16,1464,0.8506374961166988,TPESampler,COMPLETE
442,0.2273062278377242,2025-04-24 22:08:42.074779,2025-04-24 22:08:45.294064,0 days 00:00:03.219285,0.09414461892987831,11,sqrt,1,20,1357,0.8331821573511633,TPESampler,COMPLETE
443,0.25917263476514796,2025-04-24 22:08:42.760986,2025-04-24 22:08:45.525890,0 days 00:00:02.764904,0.09726565408989817,9,sqrt,2,16,1133,0.9363429776813258,TPESampler,COMPLETE
444,0.2593192283527673,2025-04-24 22:08:44.569777,2025-04-24 22:08:47.376710,0 days 00:00:02.806933,0.0916682870708392,11,sqrt,2,17,1156,0.9129497540594985,TPESampler,COMPLETE
445,0.24502184340701727,2025-04-24 22:08:45.488233,2025-04-24 22:08:48.627886,0 days 00:00:03.139653,0.0993538179643615,12,sqrt,1,17,1364,0.9717119946308079,TPESampler,COMPLETE
446,0.24136253011349573,2025-04-24 22:08:45.741482,2025-04-24 22:08:49.100508,0 days 00:00:03.359026,0.09769595729860951,10,sqrt,1,20,1437,0.745201580818744,TPESampler,COMPLETE
447,0.2623603396485064,2025-04-24 22:08:47.558778,2025-04-24 22:08:50.865850,0 days 00:00:03.307072,0.09490367568491719,12,sqrt,3,18,1400,0.8852926446297484,TPESampler,COMPLETE
448,0.749634414256832,2025-04-24 22:08:48.813269,2025-04-24 22:08:49.861231,0 days 00:00:01.047962,0.014856182281421855,12,log2,7,10,265,0.8629362992661633,TPESampler,COMPLETE
449,0.243102841755936,2025-04-24 22:08:49.273431,2025-04-24 22:08:52.539026,0 days 00:00:03.265595,0.08221364139243753,10,sqrt,1,16,1400,0.8906932425977898,TPESampler,COMPLETE
450,0.23745594782662557,2025-04-24 22:08:50.054104,2025-04-24 22:08:53.276793,0 days 00:00:03.222689,0.09405724395793745,9,sqrt,1,18,1392,0.8631207180975821,TPESampler,COMPLETE
451,0.3637282978334069,2025-04-24 22:08:51.049852,2025-04-24 22:08:52.173983,0 days 00:00:01.124131,0.08149184079336318,10,log2,4,20,317,0.9984783154247563,TPESampler,COMPLETE
452,0.24301752456731798,2025-04-24 22:08:52.355554,2025-04-24 22:08:55.513551,0 days 00:00:03.157997,0.06346649234464176,11,sqrt,1,15,1350,0.8362048302328683,TPESampler,COMPLETE
453,0.23179861215490655,2025-04-24 22:08:52.756929,2025-04-24 22:08:55.839819,0 days 00:00:03.082890,0.09879097724030478,11,sqrt,1,19,1259,0.8474251113496403,TPESampler,COMPLETE
454,0.25375334275893807,2025-04-24 22:08:53.483744,2025-04-24 22:08:56.773594,0 days 00:00:03.289850,0.08515368145849035,11,sqrt,1,16,1374,0.8920217727548715,TPESampler,COMPLETE
455,0.25982576335555585,2025-04-24 22:08:55.696046,2025-04-24 22:08:58.297422,0 days 00:00:02.601376,0.09626196929493246,11,sqrt,2,15,1022,0.8111443379678478,TPESampler,COMPLETE
456,0.4471770858704413,2025-04-24 22:08:56.015833,2025-04-24 22:08:58.720161,0 days 00:00:02.704328,0.015101760708738978,4,sqrt,9,14,1269,0.8111265641450696,TPESampler,COMPLETE
457,0.48589549285760075,2025-04-24 22:08:56.956009,2025-04-24 22:08:58.229948,0 days 00:00:01.273939,0.05145175945796298,5,log2,7,7,348,0.9060193940368761,TPESampler,COMPLETE
458,0.6024348495341258,2025-04-24 22:08:58.409490,2025-04-24 22:08:59.957423,0 days 00:00:01.547933,0.02946323114104383,9,log2,10,16,400,0.9831028232368503,TPESampler,COMPLETE
459,0.26445554614606887,2025-04-24 22:08:58.492427,2025-04-24 22:09:01.947903,0 days 00:00:03.455476,0.08038928274941964,10,sqrt,3,20,1279,0.8998970151515125,TPESampler,COMPLETE
460,0.2382301576857005,2025-04-24 22:08:59.129829,2025-04-24 22:09:02.182894,0 days 00:00:03.053065,0.09665911771824388,11,sqrt,1,20,1176,0.8323465736940929,TPESampler,COMPLETE
461,0.24719942617563687,2025-04-24 22:09:00.146076,2025-04-24 22:09:03.536763,0 days 00:00:03.390687,0.06876235294276892,11,sqrt,1,19,1293,0.8128290013735021,TPESampler,COMPLETE
462,0.26950616293880014,2025-04-24 22:09:02.127854,2025-04-24 22:09:05.721120,0 days 00:00:03.593266,0.08525397427612415,10,sqrt,2,20,1473,0.82597624640744,TPESampler,COMPLETE
463,0.6211137874542211,2025-04-24 22:09:02.398263,2025-04-24 22:09:04.027348,0 days 00:00:01.629085,0.017838652758821304,3,log2,9,3,647,0.948220216786825,TPESampler,COMPLETE
464,0.45514547607522027,2025-04-24 22:09:03.732116,2025-04-24 22:09:06.491558,0 days 00:00:02.759442,0.012690878583196603,7,log2,5,20,1212,0.8779147212859786,TPESampler,COMPLETE
465,0.42122976824107516,2025-04-24 22:09:04.195088,2025-04-24 22:09:07.714175,0 days 00:00:03.519087,0.027020356259091893,5,sqrt,9,7,1473,0.8328152813096028,TPESampler,COMPLETE
466,0.24090329557579096,2025-04-24 22:09:05.911364,2025-04-24 22:09:08.994026,0 days 00:00:03.082662,0.07136598046241269,12,sqrt,1,18,1139,0.8712433322340288,TPESampler,COMPLETE
467,0.43447368225806704,2025-04-24 22:09:06.686053,2025-04-24 22:09:08.903625,0 days 00:00:02.217572,0.02487397613292547,9,log2,7,10,1016,0.979601784674812,TPESampler,COMPLETE
468,0.22508822856715144,2025-04-24 22:09:07.899673,2025-04-24 22:09:10.740815,0 days 00:00:02.841142,0.08825241326025098,11,sqrt,1,13,1178,0.8956711473073871,TPESampler,COMPLETE
469,0.24109651998659976,2025-04-24 22:09:09.058088,2025-04-24 22:09:11.821424,0 days 00:00:02.763336,0.09941071949507815,10,sqrt,1,17,1149,0.8574260466141744,TPESampler,COMPLETE
470,0.23334481449005,2025-04-24 22:09:09.173642,2025-04-24 22:09:12.443649,0 days 00:00:03.270007,0.08628380925803526,11,sqrt,1,19,1264,0.8818693631075584,TPESampler,COMPLETE
471,0.5157392738530174,2025-04-24 22:09:10.920991,2025-04-24 22:09:12.583050,0 days 00:00:01.662059,0.04179749279484613,8,log2,9,20,783,0.6258741186142127,TPESampler,COMPLETE
472,0.3689801903783044,2025-04-24 22:09:12.348971,2025-04-24 22:09:13.410025,0 days 00:00:01.061054,0.08493672320053522,3,sqrt,4,18,286,0.8548816162050685,TPESampler,COMPLETE
473,0.2907961808877119,2025-04-24 22:09:12.683181,2025-04-24 22:09:19.635388,0 days 00:00:06.952207,0.055912117877991274,9,,2,13,994,0.8798293972980111,TPESampler,COMPLETE
474,0.584615635001671,2025-04-24 22:09:12.902789,2025-04-24 22:09:14.179529,0 days 00:00:01.276740,0.018408191384738037,5,sqrt,1,12,135,0.9358433916103664,TPESampler,COMPLETE
475,0.25259983877173914,2025-04-24 22:09:13.619833,2025-04-24 22:09:16.204452,0 days 00:00:02.584619,0.07333452649523864,12,sqrt,2,12,1237,0.8916850212361238,TPESampler,COMPLETE
476,0.36587755547409273,2025-04-24 22:09:14.451899,2025-04-24 22:09:16.118020,0 days 00:00:01.666121,0.025355108906220274,4,sqrt,1,18,647,0.7220195841167438,TPESampler,COMPLETE
477,0.237310948300024,2025-04-24 22:09:16.259143,2025-04-24 22:09:18.656671,0 days 00:00:02.397528,0.08149174640610278,11,sqrt,1,15,1175,0.956253391780897,TPESampler,COMPLETE
478,0.24256127025633675,2025-04-24 22:09:16.381352,2025-04-24 22:09:18.607454,0 days 00:00:02.226102,0.09349775697116142,9,sqrt,1,19,1034,0.8976550591525709,TPESampler,COMPLETE
479,0.2572796303248796,2025-04-24 22:09:18.734478,2025-04-24 22:09:21.869383,0 days 00:00:03.134905,0.09770446855664018,12,sqrt,2,17,1485,0.8592522770589769,TPESampler,COMPLETE
480,0.249488224525164,2025-04-24 22:09:18.781827,2025-04-24 22:09:21.893601,0 days 00:00:03.111774,0.09382936823306376,11,sqrt,1,17,1500,0.8803793056229385,TPESampler,COMPLETE
481,0.3887437713646896,2025-04-24 22:09:19.878056,2025-04-24 22:09:26.328064,0 days 00:00:06.450008,0.04086982776564263,9,,10,3,1402,0.7072180412582222,TPESampler,COMPLETE
482,0.24241819443253398,2025-04-24 22:09:22.003493,2025-04-24 22:09:24.138867,0 days 00:00:02.135374,0.09658367208865974,9,sqrt,1,12,1202,0.9048853001127725,TPESampler,COMPLETE
483,0.3061786830351053,2025-04-24 22:09:22.054202,2025-04-24 22:09:31.099669,0 days 00:00:09.045467,0.07348252596302204,9,,1,6,1469,0.880222874644067,TPESampler,COMPLETE
484,0.37007250088811,2025-04-24 22:09:24.315150,2025-04-24 22:09:25.742132,0 days 00:00:01.426982,0.01986121034673591,8,log2,2,18,908,0.6541229330933803,TPESampler,COMPLETE
485,0.23066649956767402,2025-04-24 22:09:25.917505,2025-04-24 22:09:28.462966,0 days 00:00:02.545461,0.0983600644860204,11,sqrt,1,17,1227,0.9262746805794548,TPESampler,COMPLETE
486,0.2500431292565315,2025-04-24 22:09:26.537147,2025-04-24 22:09:28.591208,0 days 00:00:02.054061,0.09994272446013572,12,sqrt,1,13,1029,0.9762085616961578,TPESampler,COMPLETE
487,0.23728167200475606,2025-04-24 22:09:28.694006,2025-04-24 22:09:31.071265,0 days 00:00:02.377259,0.09346505063167886,11,sqrt,1,17,1177,0.978006135797463,TPESampler,COMPLETE
488,0.2434387339704635,2025-04-24 22:09:28.783587,2025-04-24 22:09:31.288851,0 days 00:00:02.505264,0.07227139594025335,11,sqrt,1,17,1177,0.9752806229467512,TPESampler,COMPLETE
489,0.31816553903822425,2025-04-24 22:09:31.200578,2025-04-24 22:09:40.615860,0 days 00:00:09.415282,0.01106739533948055,11,,5,4,1342,0.997784779858179,TPESampler,COMPLETE
490,0.24868511857015718,2025-04-24 22:09:31.256573,2025-04-24 22:09:34.221161,0 days 00:00:02.964588,0.09499371852853136,9,sqrt,1,14,1494,0.8778093383686569,TPESampler,COMPLETE
491,0.25219257366437675,2025-04-24 22:09:31.467666,2025-04-24 22:09:34.222929,0 days 00:00:02.755263,0.09369279476358723,8,sqrt,1,6,1416,0.9629155477044504,TPESampler,COMPLETE
