number,value,datetime_start,datetime_complete,duration,params_learning_rate,params_max_depth,params_max_features,params_min_samples_leaf,params_min_samples_split,params_n_estimators,params_subsample,system_attrs_auto:sampler,state
615,0.23694672433234826,2025-04-24 22:11:45.300591,2025-04-24 22:11:48.639118,0 days 00:00:03.338527,0.09515134634877837,10,sqrt,1,19,1383,0.8736910753436018,TPESampler,COMPLETE
616,0.2610252883329302,2025-04-24 22:11:46.041138,2025-04-24 22:11:49.552102,0 days 00:00:03.510964,0.05248138854404817,10,sqrt,2,14,1496,0.927468035791827,TPESampler,COMPLETE
617,0.2599226221427135,2025-04-24 22:11:46.729445,2025-04-24 22:11:49.524684,0 days 00:00:02.795239,0.09977517394172739,10,sqrt,2,20,1096,0.7312093144510944,TPESampler,COMPLETE
618,0.23470893918065414,2025-04-24 22:11:48.825594,2025-04-24 22:11:52.011895,0 days 00:00:03.186301,0.08668513204872559,10,sqrt,1,18,1383,0.8266665753661951,TPESampler,COMPLETE
619,0.6782731888461305,2025-04-24 22:11:49.660448,2025-04-24 22:11:50.849553,0 days 00:00:01.189105,0.021032078870489183,4,log2,5,13,278,0.6966726196102425,TPESampler,COMPLETE
620,0.26543883915992195,2025-04-24 22:11:49.711809,2025-04-24 22:11:52.634801,0 days 00:00:02.922992,0.08911404943354835,10,sqrt,2,13,1127,0.8959785992556292,TPESampler,COMPLETE
621,0.41938628692597735,2025-04-24 22:11:51.036986,2025-04-24 22:11:52.720606,0 days 00:00:01.683620,0.013687262954276129,11,sqrt,6,12,522,0.6995479378049764,TPESampler,COMPLETE
622,0.3094621932136638,2025-04-24 22:11:52.222159,2025-04-24 22:12:00.268553,0 days 00:00:08.046394,0.04267538834130486,9,,5,12,1427,0.8225229083394706,TPESampler,COMPLETE
623,0.2615063427755453,2025-04-24 22:11:52.878507,2025-04-24 22:11:55.283655,0 days 00:00:02.405148,0.0794885134418276,10,sqrt,2,15,1133,0.8593127809328214,TPESampler,COMPLETE
624,0.2969056823000089,2025-04-24 22:11:52.919327,2025-04-24 22:11:55.621842,0 days 00:00:02.702515,0.059784886906120355,7,log2,1,11,1366,0.7715480885961457,TPESampler,COMPLETE
625,0.32694052647986405,2025-04-24 22:11:55.481417,2025-04-24 22:11:58.290454,0 days 00:00:02.809037,0.01051209459219107,12,,4,4,549,0.6396167491062742,TPESampler,COMPLETE
626,0.26062920700237613,2025-04-24 22:11:55.809460,2025-04-24 22:12:02.411776,0 days 00:00:06.602316,0.06298842769857192,10,,1,20,969,0.9543646850892137,TPESampler,COMPLETE
627,0.4925653027430302,2025-04-24 22:11:58.458462,2025-04-24 22:11:59.197932,0 days 00:00:00.739470,0.05971293766155575,4,log2,4,12,194,0.9478793247842048,TPESampler,COMPLETE
628,0.2629956198749337,2025-04-24 22:11:59.377613,2025-04-24 22:12:01.675633,0 days 00:00:02.298020,0.08979601129774821,11,sqrt,3,17,1214,0.7919989608595035,TPESampler,COMPLETE
629,0.3514465987358967,2025-04-24 22:12:00.463209,2025-04-24 22:12:02.381966,0 days 00:00:01.918757,0.0269819244828931,9,log2,3,7,1046,0.7844622664689033,TPESampler,COMPLETE
630,0.2601472701420549,2025-04-24 22:12:01.880803,2025-04-24 22:12:04.572271,0 days 00:00:02.691468,0.03565661595145518,9,sqrt,1,17,1338,0.7266336354893457,TPESampler,COMPLETE
631,0.2598878433233583,2025-04-24 22:12:02.550158,2025-04-24 22:12:10.392365,0 days 00:00:07.842207,0.09328544752139656,11,,1,20,1190,0.8631318885540933,TPESampler,COMPLETE
632,0.2473834718904117,2025-04-24 22:12:02.597977,2025-04-24 22:12:05.632015,0 days 00:00:03.034038,0.056196919953944886,9,sqrt,1,16,1393,0.8002219439211031,TPESampler,COMPLETE
633,0.41268462166377784,2025-04-24 22:12:04.822710,2025-04-24 22:12:06.628467,0 days 00:00:01.805757,0.010536813648783961,9,,3,19,171,0.7447393536693642,TPESampler,COMPLETE
634,0.254101310205466,2025-04-24 22:12:05.898924,2025-04-24 22:12:08.186790,0 days 00:00:02.287866,0.09229190631227015,10,sqrt,1,12,1283,0.8014347928892085,TPESampler,COMPLETE
635,0.34775433540438516,2025-04-24 22:12:06.809903,2025-04-24 22:12:12.531573,0 days 00:00:05.721670,0.011658335116892373,12,,8,20,888,0.9081093268773828,TPESampler,COMPLETE
636,0.264682051193941,2025-04-24 22:12:08.369372,2025-04-24 22:12:10.963441,0 days 00:00:02.594069,0.08613939653068194,10,sqrt,3,18,1481,0.8405007965462382,TPESampler,COMPLETE
637,0.26257368259185665,2025-04-24 22:12:10.813928,2025-04-24 22:12:13.511406,0 days 00:00:02.697478,0.07118149622857639,10,log2,1,19,1305,0.8202245794950989,TPESampler,COMPLETE
638,0.24658544150534686,2025-04-24 22:12:11.240359,2025-04-24 22:12:13.675291,0 days 00:00:02.434932,0.05269895631406826,11,sqrt,1,6,1125,0.8880544212059027,TPESampler,COMPLETE
639,0.24548471920393228,2025-04-24 22:12:12.755907,2025-04-24 22:12:16.440385,0 days 00:00:03.684478,0.09355740035995372,9,sqrt,1,20,1419,0.8045521379871882,TPESampler,COMPLETE
640,0.24394734488284564,2025-04-24 22:12:13.719783,2025-04-24 22:12:16.831159,0 days 00:00:03.111376,0.0591557633622325,10,sqrt,1,14,1287,0.8908512605517604,TPESampler,COMPLETE
641,0.2635754101852961,2025-04-24 22:12:13.872214,2025-04-24 22:12:16.902929,0 days 00:00:03.030715,0.07671912058741992,8,sqrt,3,10,1171,0.8975723247847173,TPESampler,COMPLETE
642,0.5375055412714803,2025-04-24 22:12:16.628295,2025-04-24 22:12:18.952661,0 days 00:00:02.324366,0.024311802221919417,8,log2,10,2,979,0.7890205947951602,TPESampler,COMPLETE
643,0.24474205539768973,2025-04-24 22:12:17.007758,2025-04-24 22:12:20.606677,0 days 00:00:03.598919,0.08249286738809433,10,sqrt,1,16,1459,0.8690212621035185,TPESampler,COMPLETE
644,0.4034913684707231,2025-04-24 22:12:17.090126,2025-04-24 22:12:19.345896,0 days 00:00:02.255770,0.07200041295405128,4,sqrt,8,5,720,0.7372777795960883,TPESampler,COMPLETE
645,0.24753523358107066,2025-04-24 22:12:19.148586,2025-04-24 22:12:22.202975,0 days 00:00:03.054389,0.0820308628751098,11,sqrt,1,14,1470,0.8895633419480442,TPESampler,COMPLETE
646,0.24437339708237615,2025-04-24 22:12:19.560011,2025-04-24 22:12:22.920178,0 days 00:00:03.360167,0.09404126539885238,10,sqrt,1,20,1498,0.8657627313537272,TPESampler,COMPLETE
647,0.2632911310564144,2025-04-24 22:12:20.788806,2025-04-24 22:12:28.449840,0 days 00:00:07.661034,0.053905535088835305,9,,1,14,1287,0.8147149333948857,TPESampler,COMPLETE
648,0.252940962074978,2025-04-24 22:12:22.374914,2025-04-24 22:12:25.119051,0 days 00:00:02.744137,0.07278671598009497,7,sqrt,1,7,1370,0.8166157833565338,TPESampler,COMPLETE
649,0.4084270842286211,2025-04-24 22:12:23.110535,2025-04-24 22:12:25.146223,0 days 00:00:02.035688,0.023260540530596473,5,sqrt,8,4,1047,0.9602951301941836,TPESampler,COMPLETE
650,0.4666413333268821,2025-04-24 22:12:25.238261,2025-04-24 22:12:26.518393,0 days 00:00:01.280132,0.015537291504292627,3,,9,7,235,0.8400372565085249,TPESampler,COMPLETE
651,0.2916502645306449,2025-04-24 22:12:25.287722,2025-04-24 22:12:27.256236,0 days 00:00:01.968514,0.06908764598589558,9,sqrt,4,4,909,0.7199836177127821,TPESampler,COMPLETE
652,0.260469315781171,2025-04-24 22:12:26.700818,2025-04-24 22:12:29.211250,0 days 00:00:02.510432,0.09838377790513664,11,sqrt,2,19,1186,0.7606745651900086,TPESampler,COMPLETE
653,0.24843540183204385,2025-04-24 22:12:27.458495,2025-04-24 22:12:29.667236,0 days 00:00:02.208741,0.04908474978197645,8,sqrt,1,8,942,0.8368716099198379,TPESampler,COMPLETE
654,0.2713810747856995,2025-04-24 22:12:28.768773,2025-04-24 22:12:30.859892,0 days 00:00:02.091119,0.09875446481087549,10,log2,1,17,965,0.960335205040222,TPESampler,COMPLETE
655,0.3580441308467539,2025-04-24 22:12:29.389538,2025-04-24 22:12:33.265979,0 days 00:00:03.876441,0.01246958641785198,10,,7,9,551,0.9676705943671121,TPESampler,COMPLETE
656,0.23287711787984666,2025-04-24 22:12:29.875551,2025-04-24 22:12:32.551021,0 days 00:00:02.675470,0.09591995101883548,12,sqrt,1,20,1295,0.8449277853615249,TPESampler,COMPLETE
657,0.78969225231529,2025-04-24 22:12:31.032032,2025-04-24 22:12:31.915347,0 days 00:00:00.883315,0.013917240462231781,5,log2,9,11,229,0.916662198541921,TPESampler,COMPLETE
658,0.2683212590709067,2025-04-24 22:12:32.099815,2025-04-24 22:12:42.725613,0 days 00:00:10.625798,0.09175518976861692,11,,1,19,1446,0.9457544641562108,TPESampler,COMPLETE
659,0.636576207151601,2025-04-24 22:12:32.754626,2025-04-24 22:12:34.086969,0 days 00:00:01.332343,0.028274871343711313,9,log2,10,3,532,0.6188931454478095,TPESampler,COMPLETE
660,0.48222184586372424,2025-04-24 22:12:33.469245,2025-04-24 22:12:35.414280,0 days 00:00:01.945035,0.010853920456878656,9,log2,4,12,1000,0.6353374089797548,TPESampler,COMPLETE
661,0.2487306906623596,2025-04-24 22:12:34.278389,2025-04-24 22:12:36.694987,0 days 00:00:02.416598,0.07661660357836597,12,sqrt,1,18,1167,0.7858765678686723,TPESampler,COMPLETE
662,0.2602470065208719,2025-04-24 22:12:35.596765,2025-04-24 22:12:38.221512,0 days 00:00:02.624747,0.09419242374917675,12,sqrt,2,20,1347,0.9028471212341473,TPESampler,COMPLETE
663,0.429242898772865,2025-04-24 22:12:36.871627,2025-04-24 22:12:37.976284,0 days 00:00:01.104657,0.08299279097716891,8,sqrt,10,4,367,0.8830528660460653,TPESampler,COMPLETE
664,0.2564788552674851,2025-04-24 22:12:38.161303,2025-04-24 22:12:40.705851,0 days 00:00:02.544548,0.0888074474305889,11,sqrt,1,19,1369,0.821125898460777,TPESampler,COMPLETE
665,0.23902921810274802,2025-04-24 22:12:38.464117,2025-04-24 22:12:40.617264,0 days 00:00:02.153147,0.09641333678801281,11,sqrt,1,20,1074,0.8242809752466113,TPESampler,COMPLETE
666,0.28870200262404744,2025-04-24 22:12:40.767576,2025-04-24 22:12:46.476324,0 days 00:00:05.708748,0.09540550026624788,8,,3,10,936,0.9830790815662643,TPESampler,COMPLETE
667,0.2542025963820973,2025-04-24 22:12:40.833449,2025-04-24 22:12:43.706293,0 days 00:00:02.872844,0.09508679128422853,12,sqrt,2,12,1469,0.8724019433631931,TPESampler,COMPLETE
668,0.23378646980054094,2025-04-24 22:12:43.217942,2025-04-24 22:12:45.653070,0 days 00:00:02.435128,0.09528843758406227,9,sqrt,1,18,1221,0.8247763384971898,TPESampler,COMPLETE
669,0.2580021735300773,2025-04-24 22:12:43.899561,2025-04-24 22:12:46.736028,0 days 00:00:02.836467,0.06875133199188715,10,sqrt,2,15,1185,0.8486772357135107,TPESampler,COMPLETE
670,0.23690859557215013,2025-04-24 22:12:46.066889,2025-04-24 22:12:49.077986,0 days 00:00:03.011097,0.08719362698707162,12,sqrt,1,20,1330,0.8927584927290645,TPESampler,COMPLETE
671,0.24714562796192535,2025-04-24 22:12:46.836708,2025-04-24 22:12:49.486590,0 days 00:00:02.649882,0.08562859761029189,11,sqrt,1,17,836,0.9725422646573498,TPESampler,COMPLETE
672,0.5940723056438797,2025-04-24 22:12:47.290306,2025-04-24 22:12:49.158635,0 days 00:00:01.868329,0.026083633949408293,6,log2,1,9,148,0.6828153898212759,TPESampler,COMPLETE
673,0.36684804027516316,2025-04-24 22:12:49.417884,2025-04-24 22:12:52.229169,0 days 00:00:02.811285,0.018463028422145197,7,sqrt,6,18,1056,0.8107211125262949,TPESampler,COMPLETE
674,0.260307729616842,2025-04-24 22:12:49.539845,2025-04-24 22:12:53.047849,0 days 00:00:03.508004,0.06395850377511787,8,sqrt,2,11,1450,0.6116297228724311,TPESampler,COMPLETE
675,0.26193159180781045,2025-04-24 22:12:49.823081,2025-04-24 22:12:53.046358,0 days 00:00:03.223277,0.07611246024714083,12,log2,1,15,922,0.8205469854548764,TPESampler,COMPLETE
676,0.2437212808031682,2025-04-24 22:12:52.903953,2025-04-24 22:12:56.276091,0 days 00:00:03.372138,0.09368557390945324,12,sqrt,1,19,1187,0.8379803286505474,TPESampler,COMPLETE
677,0.29415608263506093,2025-04-24 22:12:53.750681,2025-04-24 22:12:57.584083,0 days 00:00:03.833402,0.03442260463729848,8,sqrt,4,14,1403,0.8376850354168516,TPESampler,COMPLETE
678,0.2369808834523662,2025-04-24 22:12:53.800973,2025-04-24 22:12:57.210396,0 days 00:00:03.409423,0.09755340546193571,12,sqrt,1,20,1138,0.8242825560360456,TPESampler,COMPLETE
679,0.23474790380358151,2025-04-24 22:12:56.475967,2025-04-24 22:12:59.649235,0 days 00:00:03.173268,0.09712457795380094,11,sqrt,1,16,1378,0.9324502404019989,TPESampler,COMPLETE
680,0.26487753158189953,2025-04-24 22:12:57.470009,2025-04-24 22:13:00.817973,0 days 00:00:03.347964,0.09366296719636082,11,sqrt,3,13,1397,0.9359517096475004,TPESampler,COMPLETE
681,0.2379039484163262,2025-04-24 22:12:57.913369,2025-04-24 22:13:01.364080,0 days 00:00:03.450711,0.08839007056457922,8,sqrt,1,16,1465,0.9016706457043131,TPESampler,COMPLETE
682,0.251033671304803,2025-04-24 22:12:59.862372,2025-04-24 22:13:02.431960,0 days 00:00:02.569588,0.046255771950574655,10,sqrt,1,16,1034,0.9267732784215007,TPESampler,COMPLETE
683,0.24930569674155784,2025-04-24 22:13:01.002285,2025-04-24 22:13:03.977568,0 days 00:00:02.975283,0.09988100681901645,10,sqrt,1,14,1226,0.8615268467028829,TPESampler,COMPLETE
684,0.2521352395472101,2025-04-24 22:13:01.560908,2025-04-24 22:13:04.818279,0 days 00:00:03.257371,0.09224611825501111,12,sqrt,1,20,1350,0.8004731290690672,TPESampler,COMPLETE
685,0.24135682618651508,2025-04-24 22:13:02.616320,2025-04-24 22:13:05.232130,0 days 00:00:02.615810,0.09510824805145152,11,sqrt,1,19,1027,0.9341917060591823,TPESampler,COMPLETE
686,0.2475774435229916,2025-04-24 22:13:04.155836,2025-04-24 22:13:06.817406,0 days 00:00:02.661570,0.09100154499948841,10,sqrt,1,15,1061,0.9136893769272024,TPESampler,COMPLETE
687,0.2627782804391211,2025-04-24 22:13:05.014583,2025-04-24 22:13:08.292550,0 days 00:00:03.277967,0.09125409142852305,10,sqrt,2,17,1377,0.8246042931891617,TPESampler,COMPLETE
688,0.24863540553512883,2025-04-24 22:13:05.450653,2025-04-24 22:13:08.373532,0 days 00:00:02.922879,0.051981157612365894,12,sqrt,1,16,1176,0.8618659223332008,TPESampler,COMPLETE
689,0.2471972383844925,2025-04-24 22:13:07.007802,2025-04-24 22:13:10.453306,0 days 00:00:03.445504,0.06008076080519687,9,sqrt,1,15,1482,0.8667207076196185,TPESampler,COMPLETE
690,0.23990174358116637,2025-04-24 22:13:08.438676,2025-04-24 22:13:11.629220,0 days 00:00:03.190544,0.0916400194587653,12,sqrt,1,16,1320,0.9009093028315242,TPESampler,COMPLETE
691,0.2758805988013197,2025-04-24 22:13:08.575568,2025-04-24 22:13:12.017377,0 days 00:00:03.441809,0.08111086178227488,10,sqrt,4,8,1483,0.8891338090888713,TPESampler,COMPLETE
692,0.41481006203259424,2025-04-24 22:13:10.649912,2025-04-24 22:13:12.016085,0 days 00:00:01.366173,0.07142800826424861,4,,9,8,188,0.9576483108645748,TPESampler,COMPLETE
693,0.2508172306572778,2025-04-24 22:13:11.814695,2025-04-24 22:13:15.260839,0 days 00:00:03.446144,0.09758313057043677,9,sqrt,1,13,1468,0.8062686950578216,TPESampler,COMPLETE
694,0.444699750618898,2025-04-24 22:13:12.176502,2025-04-24 22:13:15.609851,0 days 00:00:03.433349,0.0871987103467295,8,log2,10,20,1399,0.9008682062880263,TPESampler,COMPLETE
695,0.23226754723993967,2025-04-24 22:13:12.228763,2025-04-24 22:13:16.476710,0 days 00:00:04.247947,0.09319253984383077,11,sqrt,1,15,1438,0.7812229221721287,TPESampler,COMPLETE
696,0.5816842368450976,2025-04-24 22:13:15.458326,2025-04-24 22:13:17.142146,0 days 00:00:01.683820,0.011888352772657765,3,log2,3,2,600,0.8738245217250481,TPESampler,COMPLETE
697,0.4259830027317303,2025-04-24 22:13:15.821727,2025-04-24 22:13:18.688709,0 days 00:00:02.866982,0.013958868667396885,6,sqrt,7,17,1325,0.6161094831892922,TPESampler,COMPLETE
698,0.2387727145661586,2025-04-24 22:13:16.691921,2025-04-24 22:13:19.859589,0 days 00:00:03.167668,0.05609655558105362,11,sqrt,1,17,1466,0.6620703243219699,TPESampler,COMPLETE
699,0.33820635526149206,2025-04-24 22:13:17.320303,2025-04-24 22:13:20.217876,0 days 00:00:02.897573,0.08096085722412487,6,,7,14,480,0.8959950498521413,TPESampler,COMPLETE
700,0.23958631163205193,2025-04-24 22:13:18.866998,2025-04-24 22:13:22.015395,0 days 00:00:03.148397,0.09122048254540274,10,sqrt,1,11,1459,0.7356031977692052,TPESampler,COMPLETE
701,0.24650433800936974,2025-04-24 22:13:20.039061,2025-04-24 22:13:23.464754,0 days 00:00:03.425693,0.05972037756262117,11,sqrt,1,15,1415,0.7745449106879807,TPESampler,COMPLETE
702,0.23300413240517517,2025-04-24 22:13:20.497115,2025-04-24 22:13:23.593284,0 days 00:00:03.096169,0.06902781473910603,10,sqrt,1,14,1241,0.7274332064177286,TPESampler,COMPLETE
703,0.2778862291262077,2025-04-24 22:13:22.207760,2025-04-24 22:13:25.105671,0 days 00:00:02.897911,0.09793328680426333,9,sqrt,1,18,1302,0.834525353043287,TPESampler,COMPLETE
704,0.32279336492986827,2025-04-24 22:13:23.646781,2025-04-24 22:13:29.155556,0 days 00:00:05.508775,0.09359057476819475,9,,5,10,906,0.8080253842257127,TPESampler,COMPLETE
705,0.27419828029291765,2025-04-24 22:13:23.829007,2025-04-24 22:13:26.272712,0 days 00:00:02.443705,0.09547797584645036,11,sqrt,3,14,1169,0.8824807575629272,TPESampler,COMPLETE
706,0.28220118411637235,2025-04-24 22:13:25.288001,2025-04-24 22:13:27.626675,0 days 00:00:02.338674,0.09638692213335698,10,log2,2,13,1307,0.8102408523677419,TPESampler,COMPLETE
707,0.27065863161865494,2025-04-24 22:13:26.476944,2025-04-24 22:13:29.247026,0 days 00:00:02.770082,0.08693443044959306,12,sqrt,4,14,1355,0.7432623125271132,TPESampler,COMPLETE
708,0.2467746982992937,2025-04-24 22:13:27.977432,2025-04-24 22:13:30.734314,0 days 00:00:02.756882,0.07474309412084187,11,sqrt,1,11,1098,0.9492749273006044,TPESampler,COMPLETE
709,0.2608509724490983,2025-04-24 22:13:29.311735,2025-04-24 22:13:33.005030,0 days 00:00:03.693295,0.07476766252085541,10,sqrt,2,15,1479,0.835057623751688,TPESampler,COMPLETE
710,0.23948012407990327,2025-04-24 22:13:29.380004,2025-04-24 22:13:33.153961,0 days 00:00:03.773957,0.060438637183326045,10,sqrt,1,16,1477,0.7608645338748661,TPESampler,COMPLETE
711,0.4530096783091967,2025-04-24 22:13:30.913105,2025-04-24 22:13:33.074627,0 days 00:00:02.161522,0.03444990224037933,12,log2,7,9,890,0.793381382138455,TPESampler,COMPLETE
712,0.2424394376119134,2025-04-24 22:13:33.162970,2025-04-24 22:13:36.633649,0 days 00:00:03.470679,0.04698023495662896,9,sqrt,1,11,1494,0.7491717078342773,TPESampler,COMPLETE
713,0.2412259206609728,2025-04-24 22:13:33.232884,2025-04-24 22:13:36.403084,0 days 00:00:03.170200,0.09695519880773797,10,sqrt,1,17,1042,0.9198622985383683,TPESampler,COMPLETE
714,0.3961067418155285,2025-04-24 22:13:33.371533,2025-04-24 22:13:35.609708,0 days 00:00:02.238175,0.049418197148695636,3,sqrt,7,10,702,0.837901086912964,TPESampler,COMPLETE
715,0.2582036869229224,2025-04-24 22:13:35.790231,2025-04-24 22:13:39.144339,0 days 00:00:03.354108,0.09986528836825412,12,sqrt,2,14,1324,0.8199662023117136,TPESampler,COMPLETE
716,0.39065745814255753,2025-04-24 22:13:36.601075,2025-04-24 22:13:39.645402,0 days 00:00:03.044327,0.07057569946065254,11,sqrt,8,17,1347,0.649975158748402,TPESampler,COMPLETE
717,0.25549203243180185,2025-04-24 22:13:36.824044,2025-04-24 22:13:39.788436,0 days 00:00:02.964392,0.05766548326513743,9,sqrt,1,17,1129,0.9092921689530312,TPESampler,COMPLETE
718,0.23422336848344813,2025-04-24 22:13:39.355722,2025-04-24 22:13:42.508968,0 days 00:00:03.153246,0.09378482863262566,11,sqrt,1,17,1268,0.8175662175825239,TPESampler,COMPLETE
719,0.2432486677135037,2025-04-24 22:13:39.868459,2025-04-24 22:13:43.318045,0 days 00:00:03.449586,0.06463672589903663,9,sqrt,1,18,1491,0.9691235962019069,TPESampler,COMPLETE
720,0.8133759543713844,2025-04-24 22:13:40.023753,2025-04-24 22:13:41.356009,0 days 00:00:01.332256,0.010111714717370294,11,log2,10,18,321,0.7674912161623545,TPESampler,COMPLETE
721,0.42422626491353527,2025-04-24 22:13:41.546729,2025-04-24 22:13:43.059751,0 days 00:00:01.513022,0.030846823995995434,11,sqrt,7,16,444,0.6414755693196554,TPESampler,COMPLETE
722,0.24943697159193093,2025-04-24 22:13:42.686937,2025-04-24 22:13:45.817582,0 days 00:00:03.130645,0.09172633801865952,12,sqrt,1,9,1233,0.9329317883499149,TPESampler,COMPLETE
723,0.3404872113135595,2025-04-24 22:13:43.259466,2025-04-24 22:13:44.975514,0 days 00:00:01.716048,0.03839452235249352,11,sqrt,5,7,578,0.6574684302849483,TPESampler,COMPLETE
724,0.2376572679742827,2025-04-24 22:13:43.586245,2025-04-24 22:13:47.066983,0 days 00:00:03.480738,0.09924058537234705,9,sqrt,1,7,1454,0.8675823702486577,TPESampler,COMPLETE
725,0.23919705378510872,2025-04-24 22:13:45.164974,2025-04-24 22:13:48.656902,0 days 00:00:03.491928,0.07226388829674904,10,sqrt,1,12,1451,0.7937231680897013,TPESampler,COMPLETE
726,0.5405295705188486,2025-04-24 22:13:46.013664,2025-04-24 22:13:47.647241,0 days 00:00:01.633577,0.031152273292608595,7,log2,9,20,573,0.8143723244641976,TPESampler,COMPLETE
727,0.2555159326943358,2025-04-24 22:13:47.271727,2025-04-24 22:13:50.217934,0 days 00:00:02.946207,0.05718827597667711,9,sqrt,1,16,1163,0.8474563542438512,TPESampler,COMPLETE
728,0.2587667514763468,2025-04-24 22:13:47.847186,2025-04-24 22:13:51.397715,0 days 00:00:03.550529,0.09865791409889565,12,sqrt,3,16,1491,0.7146084710962096,TPESampler,COMPLETE
729,0.24392878947743868,2025-04-24 22:13:48.850750,2025-04-24 22:13:52.431895,0 days 00:00:03.581145,0.05861445747963256,10,sqrt,1,19,1483,0.8618526845748058,TPESampler,COMPLETE
730,0.26344461354589677,2025-04-24 22:13:50.401871,2025-04-24 22:13:53.133321,0 days 00:00:02.731450,0.09321988712827654,10,sqrt,3,18,1098,0.8568430375549312,TPESampler,COMPLETE
731,0.3073133746287113,2025-04-24 22:13:51.619523,2025-04-24 22:13:54.743698,0 days 00:00:03.124175,0.059384821138875624,12,log2,4,20,1462,0.8457718444060769,TPESampler,COMPLETE
732,0.24827006653090464,2025-04-24 22:13:52.615394,2025-04-24 22:13:55.557629,0 days 00:00:02.942235,0.09877703428728832,10,sqrt,1,14,1078,0.76545210595215,TPESampler,COMPLETE
733,0.3145018375945391,2025-04-24 22:13:53.351917,2025-04-24 22:13:55.623103,0 days 00:00:02.271186,0.06450185940240012,8,log2,1,16,852,0.735203528453866,TPESampler,COMPLETE
734,0.34803304560487,2025-04-24 22:13:54.931958,2025-04-24 22:13:59.550477,0 days 00:00:04.618519,0.037925148301224516,4,,6,11,1080,0.8683812478916451,TPESampler,COMPLETE
735,0.2771538999485531,2025-04-24 22:13:55.710610,2025-04-24 22:13:58.354634,0 days 00:00:02.644024,0.07823588342281183,7,sqrt,4,14,1240,0.7916350992113391,TPESampler,COMPLETE
736,0.25604201414921723,2025-04-24 22:13:55.781691,2025-04-24 22:13:58.473013,0 days 00:00:02.691322,0.09910669512187396,11,sqrt,2,17,1191,0.9199255811276531,TPESampler,COMPLETE
737,0.31322996883808923,2025-04-24 22:13:58.523300,2025-04-24 22:14:05.902443,0 days 00:00:07.379143,0.09528806951499186,10,,2,15,1167,0.8782678491992415,TPESampler,COMPLETE
