number,value,datetime_start,datetime_complete,duration,params_learning_rate,params_max_depth,params_max_features,params_min_samples_leaf,params_min_samples_split,params_n_estimators,params_subsample,system_attrs_auto:sampler,state
1474,0.43026121768684467,2025-04-24 22:27:28.684911,2025-04-24 22:27:29.976952,0 days 00:00:01.292041,0.025393177171546422,5,,4,8,105,0.7921150604434125,TPESampler,COMPLETE
1475,0.24528505924173005,2025-04-24 22:27:30.055276,2025-04-24 22:27:33.247207,0 days 00:00:03.191931,0.09927823894391262,11,sqrt,1,12,1210,0.9070371681824559,TPESampler,COMPLETE
1476,0.25768069779808295,2025-04-24 22:27:30.177758,2025-04-24 22:27:33.943638,0 days 00:00:03.765880,0.09158651417884937,9,sqrt,3,12,1414,0.7222438132626798,TPESampler,COMPLETE
1477,0.24627115736272004,2025-04-24 22:27:30.346811,2025-04-24 22:27:33.796652,0 days 00:00:03.449841,0.0867889614882073,9,sqrt,1,16,1361,0.8038937765550473,TPESampler,COMPLETE
1478,0.2544825012754912,2025-04-24 22:27:33.674427,2025-04-24 22:27:36.445687,0 days 00:00:02.771260,0.08915889748482024,6,sqrt,1,16,1380,0.9012324570108411,TPESampler,COMPLETE
1479,0.2593418993929021,2025-04-24 22:27:34.033963,2025-04-24 22:27:37.110571,0 days 00:00:03.076608,0.09817953517051359,9,sqrt,2,17,1489,0.8432339558935352,TPESampler,COMPLETE
1480,0.265331782053349,2025-04-24 22:27:34.200082,2025-04-24 22:27:41.028242,0 days 00:00:06.828160,0.09944389834996824,8,,1,15,1069,0.8604855426743232,TPESampler,COMPLETE
1481,0.24820324563249693,2025-04-24 22:27:36.667682,2025-04-24 22:27:39.181716,0 days 00:00:02.514034,0.07075574391963474,10,sqrt,1,16,1230,0.8603588496135032,TPESampler,COMPLETE
1482,0.24571857954686427,2025-04-24 22:27:37.312561,2025-04-24 22:27:40.183786,0 days 00:00:02.871225,0.09461081759495338,11,sqrt,1,16,1461,0.913078909173582,TPESampler,COMPLETE
1483,0.41626543604051014,2025-04-24 22:27:39.373034,2025-04-24 22:27:40.245207,0 days 00:00:00.872173,0.09283554397541602,8,sqrt,8,16,176,0.8680968848072733,TPESampler,COMPLETE
1484,0.27116234489074514,2025-04-24 22:27:40.334719,2025-04-24 22:27:49.455620,0 days 00:00:09.120901,0.07766815635249559,11,,1,17,1369,0.8079339868983583,TPESampler,COMPLETE
1485,0.24326611266804107,2025-04-24 22:27:40.457480,2025-04-24 22:27:43.270036,0 days 00:00:02.812556,0.08926545802794815,9,sqrt,1,20,1228,0.9104065333828126,TPESampler,COMPLETE
1486,0.2776102154294582,2025-04-24 22:27:41.310462,2025-04-24 22:27:43.587663,0 days 00:00:02.277201,0.09082965577480892,8,sqrt,3,16,1181,0.8805213135128334,TPESampler,COMPLETE
1487,0.2612488135375256,2025-04-24 22:27:43.461511,2025-04-24 22:27:46.164859,0 days 00:00:02.703348,0.06294027627529211,10,log2,1,18,1492,0.8463713849567991,TPESampler,COMPLETE
1488,0.2482897712242005,2025-04-24 22:27:43.836271,2025-04-24 22:27:46.816144,0 days 00:00:02.979873,0.060724117554871344,12,sqrt,1,19,1476,0.9007733954630788,TPESampler,COMPLETE
1489,0.23724371509082973,2025-04-24 22:27:46.659760,2025-04-24 22:27:49.876270,0 days 00:00:03.216510,0.09605035418410744,10,sqrt,1,19,1490,0.8941599118635251,TPESampler,COMPLETE
1490,0.3953336222989338,2025-04-24 22:27:47.405068,2025-04-24 22:27:50.819413,0 days 00:00:03.414345,0.03138761240620856,7,,10,16,412,0.8748044235930803,TPESampler,COMPLETE
1491,0.25279851519685015,2025-04-24 22:27:49.752155,2025-04-24 22:27:52.975169,0 days 00:00:03.223014,0.06661439239573337,8,sqrt,1,15,1123,0.8408875448315785,TPESampler,COMPLETE
1492,0.27221624642928255,2025-04-24 22:27:50.336247,2025-04-24 22:27:53.847694,0 days 00:00:03.511447,0.049579470329817424,11,sqrt,4,11,1285,0.9017463919616799,TPESampler,COMPLETE
1493,0.2722005284995152,2025-04-24 22:27:51.175172,2025-04-24 22:27:53.832927,0 days 00:00:02.657755,0.07011271979264652,11,sqrt,2,17,1014,0.7847829255187672,TPESampler,COMPLETE
1494,0.39913013196096103,2025-04-24 22:27:53.668641,2025-04-24 22:27:56.269958,0 days 00:00:02.601317,0.010438318975304698,5,,2,2,426,0.8438476978014784,TPESampler,COMPLETE
1495,0.24197529231213455,2025-04-24 22:27:54.129811,2025-04-24 22:27:57.963056,0 days 00:00:03.833245,0.06726623666031545,9,sqrt,1,12,1378,0.8712958977723817,TPESampler,COMPLETE
1496,0.42641545645088647,2025-04-24 22:27:54.170903,2025-04-24 22:27:57.871678,0 days 00:00:03.700775,0.013751350746534798,3,log2,2,2,1487,0.8505535809058549,TPESampler,COMPLETE
1497,0.24978203757054965,2025-04-24 22:27:56.487404,2025-04-24 22:27:59.678433,0 days 00:00:03.191029,0.05511953566081274,10,sqrt,1,15,1264,0.9324075060594232,TPESampler,COMPLETE
1498,0.2711919756880773,2025-04-24 22:27:58.039240,2025-04-24 22:28:01.139338,0 days 00:00:03.100098,0.09839382885867318,11,sqrt,3,14,1199,0.9100368231241867,TPESampler,COMPLETE
1499,0.2390780774437176,2025-04-24 22:27:58.209123,2025-04-24 22:28:01.571920,0 days 00:00:03.362797,0.09448775783268172,10,sqrt,1,20,1265,0.850793604258818,TPESampler,COMPLETE
1500,0.25846513748891237,2025-04-24 22:27:59.884558,2025-04-24 22:28:03.037060,0 days 00:00:03.152502,0.08149117458389042,12,sqrt,2,17,1475,0.7964519214172466,TPESampler,COMPLETE
1501,0.2832880906850213,2025-04-24 22:28:01.338058,2025-04-24 22:28:07.598352,0 days 00:00:06.260294,0.07713201197134682,10,,3,14,1014,0.8263851330971546,TPESampler,COMPLETE
1502,0.3388655128099467,2025-04-24 22:28:01.825842,2025-04-24 22:28:03.076317,0 days 00:00:01.250475,0.028686313392197085,12,,1,15,114,0.7944517327585261,TPESampler,COMPLETE
1503,0.2709060564089426,2025-04-24 22:28:03.195173,2025-04-24 22:28:05.505316,0 days 00:00:02.310143,0.09847335416186855,10,sqrt,3,15,1305,0.8988360768871486,TPESampler,COMPLETE
1504,0.30863320114164877,2025-04-24 22:28:03.240730,2025-04-24 22:28:12.594981,0 days 00:00:09.354251,0.01788649670243468,12,,5,12,1396,0.8619785433688453,TPESampler,COMPLETE
1505,0.35241699259504417,2025-04-24 22:28:05.702355,2025-04-24 22:28:11.593056,0 days 00:00:05.890701,0.09405921745728305,12,,6,20,1250,0.6325831995914791,TPESampler,COMPLETE
1506,0.24400556890535988,2025-04-24 22:28:07.786679,2025-04-24 22:28:09.893491,0 days 00:00:02.106812,0.09616154785868375,10,sqrt,1,12,1247,0.8186369601423203,TPESampler,COMPLETE
1507,0.4387778749816402,2025-04-24 22:28:10.098417,2025-04-24 22:28:11.536250,0 days 00:00:01.437833,0.012967979983501502,11,log2,4,20,863,0.8586266934498474,TPESampler,COMPLETE
1508,0.2520095787734923,2025-04-24 22:28:11.695418,2025-04-24 22:28:14.761846,0 days 00:00:03.066428,0.09874936994077815,10,sqrt,1,18,1222,0.8933409584189518,TPESampler,COMPLETE
1509,0.2723970736610433,2025-04-24 22:28:11.747353,2025-04-24 22:28:14.944254,0 days 00:00:03.196901,0.03127992268668093,10,sqrt,2,11,1197,0.889344651060551,TPESampler,COMPLETE
1510,0.24039152876746256,2025-04-24 22:28:12.799696,2025-04-24 22:28:15.900207,0 days 00:00:03.100511,0.09942578477818587,10,sqrt,1,14,1256,0.9066409547902952,TPESampler,COMPLETE
1511,0.23935415686446926,2025-04-24 22:28:15.032713,2025-04-24 22:28:17.956998,0 days 00:00:02.924285,0.06478056845161557,10,sqrt,1,14,1352,0.7846611052982417,TPESampler,COMPLETE
1512,0.26806676406564783,2025-04-24 22:28:15.181433,2025-04-24 22:28:17.925759,0 days 00:00:02.744326,0.07319324545777442,10,sqrt,3,12,1116,0.8860299584016943,TPESampler,COMPLETE
1513,0.34813872809592966,2025-04-24 22:28:16.277384,2025-04-24 22:28:26.699853,0 days 00:00:10.422469,0.086082507661573,11,,6,14,1429,0.9982724380410227,TPESampler,COMPLETE
1514,0.35220591399926926,2025-04-24 22:28:18.080332,2025-04-24 22:28:19.695690,0 days 00:00:01.615358,0.05099440381719504,5,,4,4,227,0.9789034438180737,TPESampler,COMPLETE
1515,0.23934938773102288,2025-04-24 22:28:18.125087,2025-04-24 22:28:20.692298,0 days 00:00:02.567211,0.0938835115394797,9,sqrt,1,15,1275,0.8230869014323143,TPESampler,COMPLETE
1516,0.25943032191520793,2025-04-24 22:28:19.881789,2025-04-24 22:28:22.426085,0 days 00:00:02.544296,0.06686249583480722,11,sqrt,3,17,1318,0.9030371234769917,TPESampler,COMPLETE
1517,0.247539828153592,2025-04-24 22:28:20.884652,2025-04-24 22:28:23.269342,0 days 00:00:02.384690,0.05246310740308869,8,sqrt,1,15,1153,0.909986330739995,TPESampler,COMPLETE
1518,0.29141281841356403,2025-04-24 22:28:22.619606,2025-04-24 22:28:25.036069,0 days 00:00:02.416463,0.08510869285937761,9,log2,2,20,1311,0.8670201669775819,TPESampler,COMPLETE
1519,0.32422880763097994,2025-04-24 22:28:23.483906,2025-04-24 22:28:25.148661,0 days 00:00:01.664755,0.018973340017331697,8,sqrt,3,20,744,0.9669742310086471,TPESampler,COMPLETE
1520,0.2855992809222468,2025-04-24 22:28:25.199872,2025-04-24 22:28:30.860539,0 days 00:00:05.660667,0.0672199244476942,6,,3,12,1188,0.7808655731697995,TPESampler,COMPLETE
1521,0.2674735407777064,2025-04-24 22:28:25.371041,2025-04-24 22:28:28.010273,0 days 00:00:02.639232,0.07352243727399936,10,sqrt,3,16,1288,0.9870579054733166,TPESampler,COMPLETE
1522,0.254325201819248,2025-04-24 22:28:26.905113,2025-04-24 22:28:29.577933,0 days 00:00:02.672820,0.09699785346272592,10,sqrt,2,19,1131,0.808028258178932,TPESampler,COMPLETE
1523,0.4271954394751029,2025-04-24 22:28:28.195398,2025-04-24 22:28:29.620202,0 days 00:00:01.424804,0.010863547070697196,11,log2,1,7,407,0.9980049000620201,TPESampler,COMPLETE
1524,0.2603457190435778,2025-04-24 22:28:29.804256,2025-04-24 22:28:32.286746,0 days 00:00:02.482490,0.0678487146941869,9,sqrt,1,20,898,0.8928068744982806,TPESampler,COMPLETE
1525,0.22386946107501185,2025-04-24 22:28:29.844195,2025-04-24 22:28:33.126039,0 days 00:00:03.281844,0.09280444945896989,11,sqrt,1,18,1228,0.8163175572407657,TPESampler,COMPLETE
1526,0.24878515273250076,2025-04-24 22:28:31.054032,2025-04-24 22:28:34.043641,0 days 00:00:02.989609,0.0653713749587988,11,sqrt,1,13,1191,0.8382383367881224,TPESampler,COMPLETE
1527,0.24943554453447722,2025-04-24 22:28:32.484192,2025-04-24 22:28:35.590539,0 days 00:00:03.106347,0.06348321876529732,10,sqrt,1,18,1269,0.9627417397896726,TPESampler,COMPLETE
1528,0.24807325831631846,2025-04-24 22:28:33.347908,2025-04-24 22:28:36.453580,0 days 00:00:03.105672,0.07480764806942516,12,sqrt,1,16,1275,0.7681463978596933,TPESampler,COMPLETE
1529,0.25249193663853975,2025-04-24 22:28:34.245226,2025-04-24 22:28:37.405847,0 days 00:00:03.160621,0.09494359371757419,11,sqrt,2,19,1312,0.8129805468674938,TPESampler,COMPLETE
1530,0.24381053547187526,2025-04-24 22:28:35.786323,2025-04-24 22:28:38.555655,0 days 00:00:02.769332,0.09387553871822889,12,sqrt,1,17,1038,0.7638020272786707,TPESampler,COMPLETE
1531,0.4299027487237762,2025-04-24 22:28:36.671567,2025-04-24 22:28:38.783340,0 days 00:00:02.111773,0.08386083452810573,12,sqrt,10,14,776,0.7718033571226647,TPESampler,COMPLETE
1532,0.2416469467732027,2025-04-24 22:28:37.607775,2025-04-24 22:28:40.589890,0 days 00:00:02.982115,0.09513929175381,9,sqrt,1,18,1136,0.7531546938405116,TPESampler,COMPLETE
1533,0.2679039025951939,2025-04-24 22:28:38.744138,2025-04-24 22:28:41.715195,0 days 00:00:02.971057,0.06221015537112807,10,sqrt,2,20,1211,0.8023623485924269,TPESampler,COMPLETE
1534,0.26090760224107473,2025-04-24 22:28:39.060461,2025-04-24 22:28:42.650416,0 days 00:00:03.589955,0.09300866344320675,10,sqrt,3,14,1486,0.8324774405261184,TPESampler,COMPLETE
1535,0.24460605186100068,2025-04-24 22:28:40.802111,2025-04-24 22:28:43.767861,0 days 00:00:02.965750,0.05687072833011394,10,sqrt,1,17,1193,0.8200808999699654,TPESampler,COMPLETE
1536,0.24239669950428955,2025-04-24 22:28:41.910595,2025-04-24 22:28:45.392806,0 days 00:00:03.482211,0.09206442147929299,11,sqrt,1,19,1467,0.7393611935457348,TPESampler,COMPLETE
1537,0.2586053591290138,2025-04-24 22:28:42.840479,2025-04-24 22:28:45.862348,0 days 00:00:03.021869,0.08652580563445493,12,sqrt,3,19,1280,0.7777552808824919,TPESampler,COMPLETE
1538,0.24761370526036058,2025-04-24 22:28:43.973588,2025-04-24 22:28:47.194642,0 days 00:00:03.221054,0.09115322549906653,11,sqrt,1,16,1444,0.7829888607787366,TPESampler,COMPLETE
1539,0.2924709692198081,2025-04-24 22:28:45.816342,2025-04-24 22:28:54.776481,0 days 00:00:08.960139,0.09342235231628741,12,,1,13,1337,0.8295018529505394,TPESampler,COMPLETE
1540,0.22655412927466617,2025-04-24 22:28:46.124675,2025-04-24 22:28:48.617090,0 days 00:00:02.492415,0.09523434743984409,12,sqrt,1,20,1210,0.8307039890961119,TPESampler,COMPLETE
1541,0.4242935468464435,2025-04-24 22:28:47.373285,2025-04-24 22:28:49.439760,0 days 00:00:02.066475,0.010807850593495238,6,,10,19,365,0.8598398265615386,TPESampler,COMPLETE
1542,0.29229177936523604,2025-04-24 22:28:48.803468,2025-04-24 22:28:56.040552,0 days 00:00:07.237084,0.057606676649562094,12,,3,20,1295,0.7181362363299935,TPESampler,COMPLETE
1543,0.25309554788287025,2025-04-24 22:28:49.631535,2025-04-24 22:28:51.575154,0 days 00:00:01.943619,0.06346043881314375,12,sqrt,2,18,1107,0.8269761874433632,TPESampler,COMPLETE
1544,0.26105828569425327,2025-04-24 22:28:51.769771,2025-04-24 22:28:53.921805,0 days 00:00:02.152034,0.061030017569824825,11,sqrt,1,20,1167,0.8353545850794317,TPESampler,COMPLETE
1545,0.2629933577955317,2025-04-24 22:28:54.116212,2025-04-24 22:28:56.143134,0 days 00:00:02.026922,0.08602548314455226,11,sqrt,3,17,974,0.7583014942859211,TPESampler,COMPLETE
1546,0.2555762558394739,2025-04-24 22:28:54.968705,2025-04-24 22:28:57.839756,0 days 00:00:02.871051,0.08701053040115524,12,sqrt,2,17,1202,0.836375925346201,TPESampler,COMPLETE
1547,0.27255704547456433,2025-04-24 22:28:56.231329,2025-04-24 22:28:58.789904,0 days 00:00:02.558575,0.08847137682964434,11,sqrt,3,19,929,0.8206787527872542,TPESampler,COMPLETE
1548,0.25912625164121195,2025-04-24 22:28:56.359334,2025-04-24 22:28:58.781391,0 days 00:00:02.422057,0.061746653493600374,11,sqrt,1,16,847,0.8048396106721634,TPESampler,COMPLETE
1549,0.24305519037634685,2025-04-24 22:28:58.037275,2025-04-24 22:29:00.751553,0 days 00:00:02.714278,0.09004147628173263,11,sqrt,1,20,1182,0.7574818451290284,TPESampler,COMPLETE
1550,0.23275686435245177,2025-04-24 22:28:58.930570,2025-04-24 22:29:01.188991,0 days 00:00:02.258421,0.08968857326250539,12,sqrt,1,17,975,0.8195387091596181,TPESampler,COMPLETE
1551,0.26292493993454563,2025-04-24 22:28:58.980850,2025-04-24 22:29:07.155692,0 days 00:00:08.174842,0.038527237721550756,11,,1,16,1186,0.8113883778507252,TPESampler,COMPLETE
1552,0.24572339034683813,2025-04-24 22:29:00.977893,2025-04-24 22:29:03.255484,0 days 00:00:02.277591,0.06218278108173701,12,sqrt,1,17,1080,0.8409716976365824,TPESampler,COMPLETE
1553,0.2620639969252522,2025-04-24 22:29:01.440690,2025-04-24 22:29:04.001634,0 days 00:00:02.560944,0.08083726573452982,12,sqrt,3,20,1221,0.8384185852755957,TPESampler,COMPLETE
1554,0.25250423470354744,2025-04-24 22:29:03.449052,2025-04-24 22:29:05.794394,0 days 00:00:02.345342,0.07995966975710872,11,sqrt,1,20,1122,0.820759972285486,TPESampler,COMPLETE
1555,0.26548792396756654,2025-04-24 22:29:04.218338,2025-04-24 22:29:05.865372,0 days 00:00:01.647034,0.09909114141094098,8,sqrt,1,19,699,0.8782307319640877,TPESampler,COMPLETE
1556,0.2531225962181099,2025-04-24 22:29:05.952003,2025-04-24 22:29:08.838444,0 days 00:00:02.886441,0.09404359078511221,11,sqrt,1,20,1090,0.855871592490177,TPESampler,COMPLETE
1557,0.24291892792391362,2025-04-24 22:29:06.034853,2025-04-24 22:29:09.123180,0 days 00:00:03.088327,0.09029187597293549,10,sqrt,1,19,1117,0.8488289973513552,TPESampler,COMPLETE
1558,0.3775375822977608,2025-04-24 22:29:07.387153,2025-04-24 22:29:10.676393,0 days 00:00:03.289240,0.04886314003168528,7,log2,6,5,1473,0.7762012676069279,TPESampler,COMPLETE
1559,0.2715847597896907,2025-04-24 22:29:09.070004,2025-04-24 22:29:11.889728,0 days 00:00:02.819724,0.06580276701497377,10,sqrt,3,15,974,0.8783826918483673,TPESampler,COMPLETE
1560,0.2757707575172748,2025-04-24 22:29:09.386621,2025-04-24 22:29:12.410407,0 days 00:00:03.023786,0.09284871804220934,7,sqrt,3,15,1090,0.8276870758218166,TPESampler,COMPLETE
1561,0.2504776171998999,2025-04-24 22:29:10.906350,2025-04-24 22:29:13.836251,0 days 00:00:02.929901,0.0975415771081028,10,sqrt,1,18,1142,0.7880234109959916,TPESampler,COMPLETE
1562,0.24698261675170272,2025-04-24 22:29:12.105363,2025-04-24 22:29:15.336345,0 days 00:00:03.230982,0.09953927941681157,12,sqrt,1,16,1271,0.8134218533413845,TPESampler,COMPLETE
1563,0.23421026163628272,2025-04-24 22:29:12.653668,2025-04-24 22:29:15.764038,0 days 00:00:03.110370,0.0898483136131565,10,sqrt,1,16,1142,0.8214032614018494,TPESampler,COMPLETE
1564,0.2613097413767657,2025-04-24 22:29:14.054948,2025-04-24 22:29:16.958874,0 days 00:00:02.903926,0.06188834179762276,8,sqrt,1,18,1096,0.7959491632591212,TPESampler,COMPLETE
1565,0.25651508528617456,2025-04-24 22:29:15.545369,2025-04-24 22:29:18.991393,0 days 00:00:03.446024,0.07271072439136105,12,sqrt,2,9,1454,0.8970329176561702,TPESampler,COMPLETE
1566,0.2766901896446386,2025-04-24 22:29:15.997456,2025-04-24 22:29:19.570435,0 days 00:00:03.572979,0.0748134886053986,8,sqrt,3,16,1301,0.822908276577029,TPESampler,COMPLETE
1567,0.43028187347854635,2025-04-24 22:29:17.194560,2025-04-24 22:29:19.567213,0 days 00:00:02.372653,0.029909696828815256,11,sqrt,9,6,821,0.7543199950818446,TPESampler,COMPLETE
1568,0.3748773739201057,2025-04-24 22:29:19.195996,2025-04-24 22:29:21.570256,0 days 00:00:02.374260,0.013008348845494946,11,sqrt,6,18,932,0.75002322896165,TPESampler,COMPLETE
1569,0.4757504862783336,2025-04-24 22:29:19.789393,2025-04-24 22:29:21.147751,0 days 00:00:01.358358,0.0355206362958423,5,log2,3,18,269,0.7205550614238483,TPESampler,COMPLETE
1570,0.27218939732139674,2025-04-24 22:29:19.848655,2025-04-24 22:29:23.810949,0 days 00:00:03.962294,0.09780729601495317,12,sqrt,4,11,1499,0.9148077747975917,TPESampler,COMPLETE
1571,0.2409316717343284,2025-04-24 22:29:21.362685,2025-04-24 22:29:24.321460,0 days 00:00:02.958775,0.0752362749268405,12,sqrt,1,20,1114,0.7933195284328354,TPESampler,COMPLETE
1572,0.24162868491442005,2025-04-24 22:29:21.851014,2025-04-24 22:29:24.958808,0 days 00:00:03.107794,0.07479102068839182,12,sqrt,1,18,1156,0.8097340167725781,TPESampler,COMPLETE
1573,0.2448250929853022,2025-04-24 22:29:24.010569,2025-04-24 22:29:26.967771,0 days 00:00:02.957202,0.09755579117514242,11,sqrt,1,20,1114,0.8708339808828262,TPESampler,COMPLETE
1574,0.26449232493566005,2025-04-24 22:29:24.563651,2025-04-24 22:29:27.379428,0 days 00:00:02.815777,0.09540431982217251,10,sqrt,3,15,1096,0.8183740436760731,TPESampler,COMPLETE
1575,0.46155618525063774,2025-04-24 22:29:25.186279,2025-04-24 22:29:27.025039,0 days 00:00:01.838760,0.02983155088555879,3,sqrt,10,17,607,0.8998939885602195,TPESampler,COMPLETE
1576,0.24570153370107647,2025-04-24 22:29:27.135365,2025-04-24 22:29:30.214942,0 days 00:00:03.079577,0.09696649264083299,11,sqrt,1,13,1142,0.7207747637917711,TPESampler,COMPLETE
1577,0.23636289253438833,2025-04-24 22:29:27.189672,2025-04-24 22:29:30.885395,0 days 00:00:03.695723,0.09667216579473013,11,sqrt,1,14,1299,0.8667618590231346,TPESampler,COMPLETE
1578,0.3553888377628896,2025-04-24 22:29:27.659183,2025-04-24 22:29:30.556293,0 days 00:00:02.897110,0.01667531146164532,4,sqrt,2,12,1208,0.6573992688902193,TPESampler,COMPLETE
1579,0.2658736580144705,2025-04-24 22:29:30.429903,2025-04-24 22:29:33.479194,0 days 00:00:03.049291,0.08326083904655002,8,sqrt,3,20,1234,0.8505123947761496,TPESampler,COMPLETE
1580,0.2490890514279579,2025-04-24 22:29:30.789688,2025-04-24 22:29:34.094810,0 days 00:00:03.305122,0.06706280817386316,8,sqrt,1,14,1360,0.8815980259867416,TPESampler,COMPLETE
1581,0.232410165587956,2025-04-24 22:29:31.199373,2025-04-24 22:29:34.654690,0 days 00:00:03.455317,0.0947461724517076,12,sqrt,1,19,1356,0.8576764267929086,TPESampler,COMPLETE
1582,0.2490671109869643,2025-04-24 22:29:33.698228,2025-04-24 22:29:36.279441,0 days 00:00:02.581213,0.09887852209907769,11,sqrt,1,20,993,0.889564013119809,TPESampler,COMPLETE
1583,0.3081860675464407,2025-04-24 22:29:34.325461,2025-04-24 22:29:39.006456,0 days 00:00:04.680995,0.03048055361894685,3,,2,8,1298,0.7854259828061327,TPESampler,COMPLETE
1584,0.252652307324484,2025-04-24 22:29:34.883029,2025-04-24 22:29:37.563870,0 days 00:00:02.680841,0.06678817333168886,10,sqrt,1,14,1216,0.824049552277577,TPESampler,COMPLETE
1585,0.2597291201379433,2025-04-24 22:29:36.465385,2025-04-24 22:29:39.058418,0 days 00:00:02.593033,0.07072504833915871,10,sqrt,3,18,1131,0.910088241690275,TPESampler,COMPLETE
1586,0.24517274152830884,2025-04-24 22:29:37.778200,2025-04-24 22:29:40.918317,0 days 00:00:03.140117,0.04824361619824857,8,sqrt,1,16,1310,0.8440477363958738,TPESampler,COMPLETE
1587,0.2680750260175491,2025-04-24 22:29:39.157935,2025-04-24 22:29:42.106726,0 days 00:00:02.948791,0.05882582620227134,11,log2,1,10,1073,0.8914981630292403,TPESampler,COMPLETE
1588,0.541105521117579,2025-04-24 22:29:39.283835,2025-04-24 22:29:41.601630,0 days 00:00:02.317795,0.02088539442241424,12,log2,10,3,852,0.9567212372980337,TPESampler,COMPLETE
1589,0.48923808278968844,2025-04-24 22:29:41.127191,2025-04-24 22:29:42.879962,0 days 00:00:01.752771,0.012125618136202616,3,sqrt,2,20,585,0.8229106183955043,TPESampler,COMPLETE
1590,0.3194211739737606,2025-04-24 22:29:41.808720,2025-04-24 22:29:46.858821,0 days 00:00:05.050101,0.08342163619517638,12,,4,8,818,0.6577205584819695,TPESampler,COMPLETE
1591,0.265837294965467,2025-04-24 22:29:42.339926,2025-04-24 22:29:44.804834,0 days 00:00:02.464908,0.06105283565965656,9,sqrt,1,18,1148,0.9103781192846803,TPESampler,COMPLETE
1592,0.2310818190298331,2025-04-24 22:29:43.095400,2025-04-24 22:29:45.942964,0 days 00:00:02.847564,0.09785842953971703,9,sqrt,1,14,1442,0.8373045446273019,TPESampler,COMPLETE
1593,0.25108912950772266,2025-04-24 22:29:45.015601,2025-04-24 22:29:47.581192,0 days 00:00:02.565591,0.07637462526234495,9,sqrt,1,15,1140,0.8740986406944969,TPESampler,COMPLETE
1594,0.3269606951794487,2025-04-24 22:29:46.145403,2025-04-24 22:29:47.605431,0 days 00:00:01.460028,0.030471521271879645,8,sqrt,1,5,395,0.832690551584648,TPESampler,COMPLETE
1595,0.2514944883027682,2025-04-24 22:29:47.067831,2025-04-24 22:29:50.087185,0 days 00:00:03.019354,0.07996380559790399,10,sqrt,1,13,1256,0.8972999138467285,TPESampler,COMPLETE
