number,value,datetime_start,datetime_complete,duration,params_learning_rate,params_max_depth,params_max_features,params_min_samples_leaf,params_min_samples_split,params_n_estimators,params_subsample,system_attrs_auto:sampler,state
246,0.2669921997678634,2025-04-24 22:05:07.466912,2025-04-24 22:05:13.638690,0 days 00:00:06.171778,0.0928336249960005,10,,1,18,928,0.8807759720636515,TPESampler,COMPLETE
247,0.24792787890035187,2025-04-24 22:05:08.558763,2025-04-24 22:05:10.559765,0 days 00:00:02.001002,0.0986454847091126,9,sqrt,1,20,987,0.8507357636140739,TPESampler,COMPLETE
248,0.2559560075682038,2025-04-24 22:05:09.933478,2025-04-24 22:05:11.699846,0 days 00:00:01.766368,0.07891090451863776,8,sqrt,1,13,965,0.6298520672952334,TPESampler,COMPLETE
249,0.4227598037752603,2025-04-24 22:05:10.728662,2025-04-24 22:05:12.512040,0 days 00:00:01.783378,0.012956596838989242,3,,2,10,508,0.7143578433753569,TPESampler,COMPLETE
250,0.6146500446809781,2025-04-24 22:05:11.881003,2025-04-24 22:05:13.050340,0 days 00:00:01.169337,0.02380731348262251,6,log2,7,19,280,0.9289295248857771,TPESampler,COMPLETE
251,0.24857257834731344,2025-04-24 22:05:12.679473,2025-04-24 22:05:14.978710,0 days 00:00:02.299237,0.08881693401599193,9,sqrt,1,16,1190,0.8871250964958519,TPESampler,COMPLETE
252,0.3099394959069712,2025-04-24 22:05:13.241952,2025-04-24 22:05:16.857305,0 days 00:00:03.615353,0.03543303735303917,4,,3,14,831,0.9207833254803464,TPESampler,COMPLETE
253,0.4185097552012391,2025-04-24 22:05:13.823755,2025-04-24 22:05:14.884085,0 days 00:00:01.060330,0.03647895509335368,9,log2,1,15,189,0.6721356863916808,TPESampler,COMPLETE
254,0.24974788706146414,2025-04-24 22:05:15.035560,2025-04-24 22:05:18.103090,0 days 00:00:03.067530,0.07857406720545572,12,sqrt,1,19,1374,0.9071349116386666,TPESampler,COMPLETE
255,0.2535882932010659,2025-04-24 22:05:15.168905,2025-04-24 22:05:18.640583,0 days 00:00:03.471678,0.08990663522430196,12,sqrt,1,18,1495,0.8791472039744299,TPESampler,COMPLETE
256,0.24219504089517288,2025-04-24 22:05:17.039410,2025-04-24 22:05:19.497652,0 days 00:00:02.458242,0.09789120121251109,9,sqrt,1,20,993,0.9044265309269202,TPESampler,COMPLETE
257,0.23674596436913267,2025-04-24 22:05:18.281238,2025-04-24 22:05:20.881312,0 days 00:00:02.600074,0.09544005793422385,10,sqrt,1,20,1087,0.8180528582507871,TPESampler,COMPLETE
258,0.244469537011153,2025-04-24 22:05:18.810999,2025-04-24 22:05:21.869775,0 days 00:00:03.058776,0.04856108918482661,10,sqrt,1,17,1424,0.8184086042953886,TPESampler,COMPLETE
259,0.25364610658046177,2025-04-24 22:05:19.688129,2025-04-24 22:05:22.121994,0 days 00:00:02.433865,0.06874489708578287,9,sqrt,1,9,969,0.9248018154036665,TPESampler,COMPLETE
260,0.26015272399651657,2025-04-24 22:05:21.110803,2025-04-24 22:05:24.522380,0 days 00:00:03.411577,0.07006571317202748,11,log2,1,20,1479,0.932225760828434,TPESampler,COMPLETE
261,0.24039192606311835,2025-04-24 22:05:22.066596,2025-04-24 22:05:25.139735,0 days 00:00:03.073139,0.08117802249440406,8,sqrt,1,20,1304,0.8605383616652964,TPESampler,COMPLETE
262,0.2289090687655975,2025-04-24 22:05:22.365288,2025-04-24 22:05:25.267762,0 days 00:00:02.902474,0.08685465830991343,10,sqrt,1,17,1187,0.8245387112734196,TPESampler,COMPLETE
263,0.4128253045925125,2025-04-24 22:05:24.702730,2025-04-24 22:05:26.296802,0 days 00:00:01.594072,0.01707896158316996,8,,9,5,211,0.8207993137743969,TPESampler,COMPLETE
264,0.24581059948928702,2025-04-24 22:05:25.321511,2025-04-24 22:05:28.771230,0 days 00:00:03.449719,0.06901270909122387,10,sqrt,1,19,1485,0.7627859003637555,TPESampler,COMPLETE
265,0.32111742793587283,2025-04-24 22:05:25.479694,2025-04-24 22:05:28.842719,0 days 00:00:03.363025,0.051182979098910966,10,sqrt,6,20,1467,0.9399494287070588,TPESampler,COMPLETE
266,0.24542559580913184,2025-04-24 22:05:26.494734,2025-04-24 22:05:29.448925,0 days 00:00:02.954191,0.09856367282574471,12,sqrt,1,14,1205,0.8537328916797025,TPESampler,COMPLETE
267,0.2760325015166366,2025-04-24 22:05:28.920615,2025-04-24 22:05:32.035458,0 days 00:00:03.114843,0.08385323437128156,10,sqrt,4,12,1177,0.8720133208692548,TPESampler,COMPLETE
268,0.2386764070553234,2025-04-24 22:05:28.989036,2025-04-24 22:05:32.557580,0 days 00:00:03.568544,0.06578168925466074,10,sqrt,1,20,1278,0.822088294773591,TPESampler,COMPLETE
269,0.39723291608910705,2025-04-24 22:05:29.718129,2025-04-24 22:05:30.770644,0 days 00:00:01.052515,0.09754753721977225,10,sqrt,8,10,213,0.945886356248507,TPESampler,COMPLETE
270,0.24475237409978715,2025-04-24 22:05:30.954718,2025-04-24 22:05:33.524751,0 days 00:00:02.570033,0.07826953346352955,10,sqrt,1,20,1007,0.8835529297132132,TPESampler,COMPLETE
271,0.26085005199941513,2025-04-24 22:05:32.214895,2025-04-24 22:05:34.648154,0 days 00:00:02.433259,0.04602860464390299,12,sqrt,2,19,1231,0.6162631453940297,TPESampler,COMPLETE
272,0.31703028081747375,2025-04-24 22:05:32.756015,2025-04-24 22:05:40.443473,0 days 00:00:07.687458,0.08629148325473034,11,,4,14,1355,0.8003363023349663,TPESampler,COMPLETE
273,0.2586111817516748,2025-04-24 22:05:33.713200,2025-04-24 22:05:36.136639,0 days 00:00:02.423439,0.08738687528153247,11,sqrt,2,18,1168,0.8606996071282006,TPESampler,COMPLETE
274,0.293827276278363,2025-04-24 22:05:34.824442,2025-04-24 22:05:43.702881,0 days 00:00:08.878439,0.04647469613492018,10,,2,19,1401,0.8979796013893958,TPESampler,COMPLETE
275,0.2525462239595336,2025-04-24 22:05:36.306245,2025-04-24 22:05:38.539975,0 days 00:00:02.233730,0.09545316132054082,8,sqrt,2,14,1496,0.9963425705095621,TPESampler,COMPLETE
276,0.24757469979943225,2025-04-24 22:05:38.725901,2025-04-24 22:05:40.799879,0 days 00:00:02.073978,0.0891838889174233,10,sqrt,1,16,1179,0.7798055324513022,TPESampler,COMPLETE
277,0.4022128004743267,2025-04-24 22:05:40.608691,2025-04-24 22:05:42.705241,0 days 00:00:02.096550,0.09792924199431113,5,sqrt,9,10,1086,0.863222352618791,TPESampler,COMPLETE
278,0.261988612273221,2025-04-24 22:05:41.011065,2025-04-24 22:05:43.017302,0 days 00:00:02.006237,0.09415890633021196,11,sqrt,2,19,922,0.8206945533227579,TPESampler,COMPLETE
279,0.3127092645737806,2025-04-24 22:05:42.874536,2025-04-24 22:05:45.011899,0 days 00:00:02.137363,0.05390954185603842,9,sqrt,5,18,906,0.846263880432609,TPESampler,COMPLETE
280,0.2740423937895765,2025-04-24 22:05:43.236449,2025-04-24 22:05:46.263207,0 days 00:00:03.026758,0.03906086395284154,11,sqrt,3,20,1290,0.8780889912484888,TPESampler,COMPLETE
281,0.23530804243268255,2025-04-24 22:05:43.908476,2025-04-24 22:05:46.898610,0 days 00:00:02.990134,0.08946538850980357,11,sqrt,1,18,1243,0.8137110798390219,TPESampler,COMPLETE
282,0.27154615816507377,2025-04-24 22:05:45.226354,2025-04-24 22:05:47.725710,0 days 00:00:02.499356,0.06049134966087089,10,sqrt,2,13,1027,0.8485498289539731,TPESampler,COMPLETE
283,0.24124172608817435,2025-04-24 22:05:46.442685,2025-04-24 22:05:49.927303,0 days 00:00:03.484618,0.09988911082898404,8,sqrt,1,13,1480,0.8373784335468164,TPESampler,COMPLETE
284,0.275540245403038,2025-04-24 22:05:47.092061,2025-04-24 22:05:50.434531,0 days 00:00:03.342470,0.06305566947186067,10,sqrt,4,16,1341,0.8925038401714164,TPESampler,COMPLETE
285,0.43393618599452705,2025-04-24 22:05:47.899672,2025-04-24 22:05:50.869483,0 days 00:00:02.969811,0.09433991484181549,3,sqrt,10,17,1485,0.6858505300477006,TPESampler,COMPLETE
286,0.33196670272909967,2025-04-24 22:05:50.122791,2025-04-24 22:05:56.881585,0 days 00:00:06.758794,0.021771568010180195,10,,7,17,1210,0.7940311055498072,TPESampler,COMPLETE
287,0.23331017013893718,2025-04-24 22:05:50.626439,2025-04-24 22:05:53.500815,0 days 00:00:02.874376,0.06860529740104074,11,sqrt,1,16,1314,0.8014656404110745,TPESampler,COMPLETE
288,0.23701932439332044,2025-04-24 22:05:51.161025,2025-04-24 22:05:53.127574,0 days 00:00:01.966549,0.0994320087477531,11,sqrt,1,17,921,0.8628643543635227,TPESampler,COMPLETE
289,0.2579386113669911,2025-04-24 22:05:53.498545,2025-04-24 22:05:55.968044,0 days 00:00:02.469499,0.09441637270621413,10,sqrt,2,20,1285,0.8574009152648632,TPESampler,COMPLETE
290,0.25030012924745515,2025-04-24 22:05:53.675382,2025-04-24 22:05:56.452409,0 days 00:00:02.777027,0.09329381008261216,10,sqrt,2,20,1421,0.8541232873182736,TPESampler,COMPLETE
291,0.3042600146292035,2025-04-24 22:05:56.136747,2025-04-24 22:05:57.782886,0 days 00:00:01.646139,0.0823602018942997,8,,4,15,272,0.6897804583738945,TPESampler,COMPLETE
292,0.370838504177682,2025-04-24 22:05:56.615873,2025-04-24 22:06:03.021761,0 days 00:00:06.405888,0.01920584257905129,11,,9,7,1040,0.9045442873227092,TPESampler,COMPLETE
293,0.24719685972535244,2025-04-24 22:05:57.054881,2025-04-24 22:05:59.555685,0 days 00:00:02.500804,0.07701200002316558,10,sqrt,1,5,1331,0.854585607806158,TPESampler,COMPLETE
294,0.233433294901334,2025-04-24 22:05:57.952196,2025-04-24 22:06:00.490168,0 days 00:00:02.537972,0.08784940108335193,10,sqrt,1,19,1238,0.8925508635021642,TPESampler,COMPLETE
295,0.2670980897516242,2025-04-24 22:05:59.732360,2025-04-24 22:06:01.541444,0 days 00:00:01.809084,0.09290215828908015,10,sqrt,3,13,737,0.9607841119271727,TPESampler,COMPLETE
296,0.2507312409999748,2025-04-24 22:06:00.687368,2025-04-24 22:06:03.350799,0 days 00:00:02.663431,0.04314020611825553,10,sqrt,1,12,1376,0.8079859293563934,TPESampler,COMPLETE
297,0.237952533273912,2025-04-24 22:06:01.706243,2025-04-24 22:06:04.479698,0 days 00:00:02.773455,0.08786801922644942,11,sqrt,1,18,1282,0.7942200696399435,TPESampler,COMPLETE
298,0.38429230619686516,2025-04-24 22:06:03.212624,2025-04-24 22:06:06.161728,0 days 00:00:02.949104,0.018549544779992846,6,log2,4,12,1360,0.8276072490091917,TPESampler,COMPLETE
299,0.26596322559875923,2025-04-24 22:06:03.538285,2025-04-24 22:06:06.245136,0 days 00:00:02.706851,0.0831477211272387,11,sqrt,3,17,1053,0.8823510151882338,TPESampler,COMPLETE
300,0.23387169131914023,2025-04-24 22:06:04.676846,2025-04-24 22:06:07.235098,0 days 00:00:02.558252,0.08931302955868749,10,sqrt,1,17,1113,0.8457511933977614,TPESampler,COMPLETE
301,0.27014806968432636,2025-04-24 22:06:06.348540,2025-04-24 22:06:14.729122,0 days 00:00:08.380582,0.09786482782353267,9,,1,16,1448,0.779611170865377,TPESampler,COMPLETE
302,0.2589842319645586,2025-04-24 22:06:06.415616,2025-04-24 22:06:09.339213,0 days 00:00:02.923597,0.07578245336938852,11,sqrt,2,15,1384,0.7911538568589227,TPESampler,COMPLETE
303,0.24075736587823338,2025-04-24 22:06:07.412221,2025-04-24 22:06:09.712546,0 days 00:00:02.300325,0.06641423526347172,10,sqrt,1,18,1142,0.8918182469357244,TPESampler,COMPLETE
304,0.42349995542964763,2025-04-24 22:06:09.515511,2025-04-24 22:06:11.121434,0 days 00:00:01.605923,0.0283422744991769,8,log2,6,2,811,0.9682669156394099,TPESampler,COMPLETE
305,0.23775159040189203,2025-04-24 22:06:09.922160,2025-04-24 22:06:12.428383,0 days 00:00:02.506223,0.09865455149281296,10,sqrt,1,17,1221,0.9103838403999932,TPESampler,COMPLETE
306,0.2460114424067389,2025-04-24 22:06:11.335497,2025-04-24 22:06:13.566507,0 days 00:00:02.231010,0.09828286010059094,9,sqrt,1,15,1161,0.8565668325061749,TPESampler,COMPLETE
307,0.4972300814432069,2025-04-24 22:06:12.641127,2025-04-24 22:06:13.539963,0 days 00:00:00.898836,0.02014142765620666,10,sqrt,5,5,139,0.7440936085320315,TPESampler,COMPLETE
308,0.26837319397559,2025-04-24 22:06:13.670030,2025-04-24 22:06:20.798573,0 days 00:00:07.128543,0.05657744987749812,7,,1,12,1443,0.845337089736665,TPESampler,COMPLETE
309,0.3064933176830472,2025-04-24 22:06:13.717215,2025-04-24 22:06:21.338333,0 days 00:00:07.621118,0.022603752487386348,10,,5,7,1426,0.7681272747268625,TPESampler,COMPLETE
310,0.24439138839690375,2025-04-24 22:06:15.131209,2025-04-24 22:06:17.093325,0 days 00:00:01.962116,0.0747725105533803,11,sqrt,1,20,1116,0.8643233299466982,TPESampler,COMPLETE
311,0.24564838603973815,2025-04-24 22:06:17.285669,2025-04-24 22:06:19.236053,0 days 00:00:01.950384,0.09939506154400751,10,sqrt,1,20,1088,0.8367431107196852,TPESampler,COMPLETE
312,0.24257026402803075,2025-04-24 22:06:19.553631,2025-04-24 22:06:21.930841,0 days 00:00:02.377210,0.07563997725570797,10,sqrt,1,19,1337,0.9007561040443007,TPESampler,COMPLETE
313,0.37095802406163136,2025-04-24 22:06:21.006510,2025-04-24 22:06:25.149473,0 days 00:00:04.142963,0.012697858101018514,5,,7,16,980,0.7261878628123017,TPESampler,COMPLETE
314,0.260318598246556,2025-04-24 22:06:21.631903,2025-04-24 22:06:24.248506,0 days 00:00:02.616603,0.04331490791232006,10,sqrt,1,20,1250,0.9286659455854717,TPESampler,COMPLETE
315,0.23359760504551466,2025-04-24 22:06:22.106327,2025-04-24 22:06:24.719110,0 days 00:00:02.612783,0.06980982816573525,10,sqrt,1,12,1213,0.8493389445225676,TPESampler,COMPLETE
316,0.2770416286692447,2025-04-24 22:06:24.677716,2025-04-24 22:06:26.407877,0 days 00:00:01.730161,0.09874482330208129,5,sqrt,1,20,870,0.8849664722266123,TPESampler,COMPLETE
317,0.2979026956366315,2025-04-24 22:06:24.933443,2025-04-24 22:06:32.975464,0 days 00:00:08.042021,0.07500781745585738,12,,3,19,1186,0.8581417948710911,TPESampler,COMPLETE
318,0.3805455866003684,2025-04-24 22:06:25.395701,2025-04-24 22:06:27.064145,0 days 00:00:01.668444,0.012891520579625242,6,sqrt,2,17,694,0.8672485190829582,TPESampler,COMPLETE
319,0.24110597410130552,2025-04-24 22:06:26.728022,2025-04-24 22:06:28.629821,0 days 00:00:01.901799,0.08977017473870337,9,sqrt,1,12,1043,0.9935999416147372,TPESampler,COMPLETE
320,0.28943182722136046,2025-04-24 22:06:27.226126,2025-04-24 22:06:31.880491,0 days 00:00:04.654365,0.0459177411486987,8,,4,20,1199,0.6145709831392784,TPESampler,COMPLETE
321,0.41679440209878355,2025-04-24 22:06:29.092307,2025-04-24 22:06:30.955563,0 days 00:00:01.863256,0.010719550461364634,3,sqrt,6,13,1368,0.9845609518801637,TPESampler,COMPLETE
322,0.2443747201894062,2025-04-24 22:06:31.129264,2025-04-24 22:06:33.441968,0 days 00:00:02.312704,0.052119078822696854,9,sqrt,1,16,1356,0.8386009017541688,TPESampler,COMPLETE
323,0.2957525828691321,2025-04-24 22:06:32.056176,2025-04-24 22:06:39.119907,0 days 00:00:07.063731,0.01882425825676115,11,,3,10,1040,0.9244011089975951,TPESampler,COMPLETE
324,0.34607829394836603,2025-04-24 22:06:33.163391,2025-04-24 22:06:39.113982,0 days 00:00:05.950591,0.09820786372255425,7,,7,3,1348,0.8047034137516388,TPESampler,COMPLETE
325,0.2371473339291843,2025-04-24 22:06:33.629407,2025-04-24 22:06:35.880627,0 days 00:00:02.251220,0.08938608872702952,7,sqrt,1,9,1496,0.9019210266297848,TPESampler,COMPLETE
326,0.2977629002402262,2025-04-24 22:06:36.048350,2025-04-24 22:06:37.893157,0 days 00:00:01.844807,0.045588950743323996,11,log2,2,13,1293,0.873925668554452,TPESampler,COMPLETE
327,0.2514192709596059,2025-04-24 22:06:38.101508,2025-04-24 22:06:40.643819,0 days 00:00:02.542311,0.06486784830833517,9,sqrt,1,10,1264,0.9272134929941428,TPESampler,COMPLETE
328,0.3073489214767788,2025-04-24 22:06:39.269055,2025-04-24 22:06:41.759900,0 days 00:00:02.490845,0.017253292917719796,10,sqrt,1,18,914,0.6177860108472433,TPESampler,COMPLETE
329,0.24604909245288226,2025-04-24 22:06:39.319245,2025-04-24 22:06:42.963757,0 days 00:00:03.644512,0.06792488852973906,12,sqrt,1,9,1427,0.7848811590879374,TPESampler,COMPLETE
330,0.24040473609551566,2025-04-24 22:06:40.847563,2025-04-24 22:06:43.649658,0 days 00:00:02.802095,0.08286923565743216,11,sqrt,1,11,1074,0.8711907789046099,TPESampler,COMPLETE
331,0.526957865342663,2025-04-24 22:06:41.942314,2025-04-24 22:06:43.790783,0 days 00:00:01.848469,0.010378310704928199,4,log2,2,12,771,0.6146385518335589,TPESampler,COMPLETE
332,0.35735010522009286,2025-04-24 22:06:43.163113,2025-04-24 22:06:46.619505,0 days 00:00:03.456392,0.05881421662529714,6,,8,12,835,0.6924058682864146,TPESampler,COMPLETE
333,0.38792262549489037,2025-04-24 22:06:43.853790,2025-04-24 22:06:45.462789,0 days 00:00:01.608999,0.062405440974177384,11,,9,11,138,0.7308834392271225,TPESampler,COMPLETE
334,0.2515290685115398,2025-04-24 22:06:44.085373,2025-04-24 22:06:46.836501,0 days 00:00:02.751128,0.08721832000501963,10,sqrt,1,15,1261,0.8317839302140154,TPESampler,COMPLETE
335,0.311511323049847,2025-04-24 22:06:45.651311,2025-04-24 22:06:51.067962,0 days 00:00:05.416651,0.01661619407725448,5,,3,18,1359,0.642284379302672,TPESampler,COMPLETE
336,0.46974546750764484,2025-04-24 22:06:46.794241,2025-04-24 22:06:48.831088,0 days 00:00:02.036847,0.04929549125485427,9,log2,9,15,1105,0.7589055754413094,TPESampler,COMPLETE
337,0.24547407711525024,2025-04-24 22:06:47.070837,2025-04-24 22:06:49.991618,0 days 00:00:02.920781,0.052150723752770675,10,sqrt,1,16,1282,0.9035183388641568,TPESampler,COMPLETE
338,0.4658704182545604,2025-04-24 22:06:49.006893,2025-04-24 22:06:50.585475,0 days 00:00:01.578582,0.09219916828873319,5,log2,9,14,780,0.7222558501445444,TPESampler,COMPLETE
339,0.2626977892749481,2025-04-24 22:06:50.192805,2025-04-24 22:06:53.737993,0 days 00:00:03.545188,0.08719746659550877,10,sqrt,3,14,1464,0.9103575007073942,TPESampler,COMPLETE
340,0.2748500941963894,2025-04-24 22:06:50.773476,2025-04-24 22:06:53.831774,0 days 00:00:03.058298,0.09031697833412491,8,sqrt,3,7,1132,0.8410010249202039,TPESampler,COMPLETE
341,0.519686775499345,2025-04-24 22:06:51.341014,2025-04-24 22:06:54.004796,0 days 00:00:02.663782,0.010044186225636789,8,log2,6,4,1208,0.7752923879092298,TPESampler,COMPLETE
342,0.3855084767856192,2025-04-24 22:06:53.888147,2025-04-24 22:06:56.225183,0 days 00:00:02.337036,0.024198661912400075,4,log2,1,4,1033,0.7972309271435851,TPESampler,COMPLETE
343,0.24235001531344041,2025-04-24 22:06:54.000936,2025-04-24 22:06:56.962213,0 days 00:00:02.961277,0.057307594592663325,12,sqrt,1,12,1020,0.9373710450676528,TPESampler,COMPLETE
344,0.25875031305895513,2025-04-24 22:06:54.227703,2025-04-24 22:06:57.497852,0 days 00:00:03.270149,0.05220667275502391,12,sqrt,2,14,1237,0.7942700321381928,TPESampler,COMPLETE
345,0.45839614017564995,2025-04-24 22:06:56.402442,2025-04-24 22:06:58.332031,0 days 00:00:01.929589,0.028241543179027103,11,log2,6,15,870,0.6538693489629985,TPESampler,COMPLETE
346,0.26264983310799744,2025-04-24 22:06:57.148889,2025-04-24 22:06:59.991862,0 days 00:00:02.842973,0.09927599779703283,10,sqrt,2,5,1144,0.9286330148969498,TPESampler,COMPLETE
347,0.2643213091875154,2025-04-24 22:06:57.691419,2025-04-24 22:07:00.647655,0 days 00:00:02.956236,0.06278203101326328,10,sqrt,2,12,1257,0.9074274654756191,TPESampler,COMPLETE
348,0.2341281254600011,2025-04-24 22:06:58.511135,2025-04-24 22:07:01.603966,0 days 00:00:03.092831,0.08346500996634135,10,sqrt,1,18,1352,0.8170541461677873,TPESampler,COMPLETE
349,0.24671051512998585,2025-04-24 22:07:00.185621,2025-04-24 22:07:02.959067,0 days 00:00:02.773446,0.09721666167659791,11,sqrt,1,19,1134,0.8806380160146586,TPESampler,COMPLETE
350,0.22140828118157602,2025-04-24 22:07:00.845439,2025-04-24 22:07:04.136626,0 days 00:00:03.291187,0.09216133536412144,10,sqrt,1,19,1408,0.8590829555439288,TPESampler,COMPLETE
351,0.24284789535098952,2025-04-24 22:07:01.783663,2025-04-24 22:07:04.765787,0 days 00:00:02.982124,0.07412312987129328,9,sqrt,1,8,1268,0.8894769319646139,TPESampler,COMPLETE
352,0.2615734218843732,2025-04-24 22:07:03.141802,2025-04-24 22:07:05.699265,0 days 00:00:02.557463,0.07703388709904939,9,sqrt,3,20,1068,0.9400601116175954,TPESampler,COMPLETE
353,0.27395755930609533,2025-04-24 22:07:04.330174,2025-04-24 22:07:07.610946,0 days 00:00:03.280772,0.09019449595087699,9,log2,2,12,1480,0.8898377812703875,TPESampler,COMPLETE
354,0.2743788356009088,2025-04-24 22:07:04.966476,2025-04-24 22:07:07.741552,0 days 00:00:02.775076,0.07434146727079359,8,sqrt,2,14,1136,0.7888608335262982,TPESampler,COMPLETE
355,0.2837033875040474,2025-04-24 22:07:05.894737,2025-04-24 22:07:09.108819,0 days 00:00:03.214082,0.09203347618078722,9,sqrt,4,17,1333,0.701885883939049,TPESampler,COMPLETE
356,0.24058795983400505,2025-04-24 22:07:07.788984,2025-04-24 22:07:10.867024,0 days 00:00:03.078040,0.07196638510796395,9,sqrt,1,17,1261,0.8433998917922938,TPESampler,COMPLETE
357,0.2828183279687253,2025-04-24 22:07:07.912684,2025-04-24 22:07:11.100085,0 days 00:00:03.187401,0.050790047577840156,9,log2,1,16,1374,0.7352452011947304,TPESampler,COMPLETE
358,0.258926676439383,2025-04-24 22:07:09.289153,2025-04-24 22:07:12.661384,0 days 00:00:03.372231,0.06530636802988084,11,sqrt,2,16,1317,0.8723160991069917,TPESampler,COMPLETE
359,0.2477069057761405,2025-04-24 22:07:11.047079,2025-04-24 22:07:13.844759,0 days 00:00:02.797680,0.08059557495222058,10,sqrt,1,13,1289,0.9172471811594503,TPESampler,COMPLETE
360,0.26195121761647083,2025-04-24 22:07:11.324835,2025-04-24 22:07:14.429024,0 days 00:00:03.104189,0.09368460440274334,12,sqrt,2,20,1434,0.7510185569719088,TPESampler,COMPLETE
361,0.2564071352765872,2025-04-24 22:07:13.094053,2025-04-24 22:07:15.875387,0 days 00:00:02.781334,0.06575021756084996,10,sqrt,2,11,1333,0.8071774113882916,TPESampler,COMPLETE
362,0.3917849573345931,2025-04-24 22:07:14.058329,2025-04-24 22:07:15.646071,0 days 00:00:01.587742,0.019311990173448725,12,,8,12,188,0.7342408935681172,TPESampler,COMPLETE
363,0.2891472534153258,2025-04-24 22:07:14.607673,2025-04-24 22:07:17.093607,0 days 00:00:02.485934,0.050531721287868675,7,sqrt,2,19,1037,0.8599992121627884,TPESampler,COMPLETE
364,0.754571391606899,2025-04-24 22:07:15.828249,2025-04-24 22:07:17.001063,0 days 00:00:01.172814,0.015521328402268405,10,log2,7,5,262,0.6283331387463067,TPESampler,COMPLETE
365,0.2590697399921276,2025-04-24 22:07:16.119391,2025-04-24 22:07:19.335132,0 days 00:00:03.215741,0.0869811385954499,9,sqrt,2,16,1285,0.8226151766609091,TPESampler,COMPLETE
366,0.2521346822989744,2025-04-24 22:07:17.158276,2025-04-24 22:07:19.960191,0 days 00:00:02.801915,0.08763125010351301,8,sqrt,1,17,1147,0.8284102633563072,TPESampler,COMPLETE
367,0.24338090398968376,2025-04-24 22:07:17.234727,2025-04-24 22:07:20.639731,0 days 00:00:03.405004,0.08141086843990622,11,sqrt,1,15,1392,0.8273391776074294,TPESampler,COMPLETE
368,0.2433295065204233,2025-04-24 22:07:19.521754,2025-04-24 22:07:21.947020,0 days 00:00:02.425266,0.09867517023094849,10,sqrt,1,13,991,0.8980986965263434,TPESampler,COMPLETE
