number,value,datetime_start,datetime_complete,duration,params_learning_rate,params_max_depth,params_max_features,params_min_samples_leaf,params_min_samples_split,params_n_estimators,params_subsample,system_attrs_auto:sampler,state
2330,0.31648850761951675,2025-04-24 22:43:53.779883,2025-04-24 22:44:02.442669,0 days 00:00:08.662786,0.07870437233086718,9,,2,9,1396,0.9738243879778982,TPESampler,COMPLETE
2331,0.262249426104717,2025-04-24 22:43:54.757173,2025-04-24 22:44:03.644984,0 days 00:00:08.887811,0.08709198088881646,10,,1,17,1409,0.9122159739088299,TPESampler,COMPLETE
2332,0.2774162972386722,2025-04-24 22:43:58.549112,2025-04-24 22:44:00.573755,0 days 00:00:02.024643,0.07217090968935419,9,log2,1,20,1433,0.9855979563546465,TPESampler,COMPLETE
2333,0.23554269941569864,2025-04-24 22:44:00.761910,2025-04-24 22:44:03.302847,0 days 00:00:02.540937,0.08903036002448993,9,sqrt,1,13,1436,0.9340785196134692,TPESampler,COMPLETE
2334,0.7362288394101348,2025-04-24 22:44:02.648122,2025-04-24 22:44:03.550784,0 days 00:00:00.902662,0.03837778750913642,3,log2,10,3,135,0.829444929439146,TPESampler,COMPLETE
2335,0.46942167969030546,2025-04-24 22:44:03.511185,2025-04-24 22:44:05.984480,0 days 00:00:02.473295,0.0466087751401792,4,log2,10,12,1018,0.821849817855941,TPESampler,COMPLETE
2336,0.2599778309528958,2025-04-24 22:44:03.798857,2025-04-24 22:44:07.781002,0 days 00:00:03.982145,0.0897436832123956,11,sqrt,2,12,1468,0.9146960922785317,TPESampler,COMPLETE
2337,0.2606244783288378,2025-04-24 22:44:03.943894,2025-04-24 22:44:07.676982,0 days 00:00:03.733088,0.07954581305554556,12,sqrt,2,16,1430,0.9909728349375564,TPESampler,COMPLETE
2338,0.24713667781677306,2025-04-24 22:44:06.194696,2025-04-24 22:44:10.234837,0 days 00:00:04.040141,0.06004809074011107,11,sqrt,2,13,1495,0.9456323703616051,TPESampler,COMPLETE
2339,0.25060703107247917,2025-04-24 22:44:07.884219,2025-04-24 22:44:11.827569,0 days 00:00:03.943350,0.07054562486686643,9,sqrt,1,10,1474,0.8732562393778852,TPESampler,COMPLETE
2340,0.2403604432836127,2025-04-24 22:44:08.031256,2025-04-24 22:44:11.388033,0 days 00:00:03.356777,0.09626700145839737,10,sqrt,1,14,1169,0.9466767430133739,TPESampler,COMPLETE
2341,0.7477942740951145,2025-04-24 22:44:10.601041,2025-04-24 22:44:11.829159,0 days 00:00:01.228118,0.011820417694418073,3,log2,3,9,234,0.7568083428196347,TPESampler,COMPLETE
2342,0.2425312448072909,2025-04-24 22:44:11.599528,2025-04-24 22:44:15.088090,0 days 00:00:03.488562,0.07778772664885619,11,sqrt,1,13,1379,0.891545857364535,TPESampler,COMPLETE
2343,0.2377919251466304,2025-04-24 22:44:12.120887,2025-04-24 22:44:15.496635,0 days 00:00:03.375748,0.07089688974928139,11,sqrt,1,14,1260,0.8998487324720572,TPESampler,COMPLETE
2344,0.2559400687724185,2025-04-24 22:44:12.175922,2025-04-24 22:44:15.971382,0 days 00:00:03.795460,0.09679938102993164,12,sqrt,1,12,1245,0.9148074491452542,TPESampler,COMPLETE
2345,0.4090478918254666,2025-04-24 22:44:15.289355,2025-04-24 22:44:17.231247,0 days 00:00:01.941892,0.04692821043114208,12,sqrt,9,18,572,0.933724634924348,TPESampler,COMPLETE
2346,0.26274050791785936,2025-04-24 22:44:16.023673,2025-04-24 22:44:19.908573,0 days 00:00:03.884900,0.09403764937854005,7,sqrt,3,10,1500,0.9506832837857206,TPESampler,COMPLETE
2347,0.24353865439034267,2025-04-24 22:44:16.276814,2025-04-24 22:44:20.026596,0 days 00:00:03.749782,0.08919514511974916,10,sqrt,1,15,1462,0.9156950156500657,TPESampler,COMPLETE
2348,0.2371316634766518,2025-04-24 22:44:17.450042,2025-04-24 22:44:21.222568,0 days 00:00:03.772526,0.09671933326311237,10,sqrt,1,14,1492,0.861874496507012,TPESampler,COMPLETE
2349,0.26598082924055483,2025-04-24 22:44:20.086818,2025-04-24 22:44:28.089689,0 days 00:00:08.002871,0.08620395471009129,9,,1,19,1358,0.781898739885935,TPESampler,COMPLETE
2350,0.25509019171963476,2025-04-24 22:44:20.225461,2025-04-24 22:44:23.099814,0 days 00:00:02.874353,0.0688422816147352,8,sqrt,1,12,1291,0.987658176054488,TPESampler,COMPLETE
2351,0.31155666905754437,2025-04-24 22:44:21.435573,2025-04-24 22:44:23.146781,0 days 00:00:01.711208,0.06858031433811491,6,sqrt,4,14,704,0.6077606753507625,TPESampler,COMPLETE
2352,0.2679986212564459,2025-04-24 22:44:23.270461,2025-04-24 22:44:31.875141,0 days 00:00:08.604680,0.09338761067006385,9,,1,14,1232,0.9930830267614533,TPESampler,COMPLETE
2353,0.24709981629861985,2025-04-24 22:44:23.319587,2025-04-24 22:44:25.871179,0 days 00:00:02.551592,0.04153124857656695,12,sqrt,1,14,1253,0.9204691505363728,TPESampler,COMPLETE
2354,0.24693875216901853,2025-04-24 22:44:26.074597,2025-04-24 22:44:28.724556,0 days 00:00:02.649959,0.08428612235176385,12,sqrt,1,17,1404,0.9618460625452577,TPESampler,COMPLETE
2355,0.26198803773388835,2025-04-24 22:44:28.285945,2025-04-24 22:44:30.950946,0 days 00:00:02.665001,0.0988366739963785,12,sqrt,2,13,1241,0.9049553385015804,TPESampler,COMPLETE
2356,0.2592299057683742,2025-04-24 22:44:28.944858,2025-04-24 22:44:31.871834,0 days 00:00:02.926976,0.09578688357413186,12,sqrt,3,13,1431,0.8925022367326468,TPESampler,COMPLETE
2357,0.28527115384866397,2025-04-24 22:44:31.149714,2025-04-24 22:44:34.781231,0 days 00:00:03.631517,0.04576426720705237,10,sqrt,4,9,1482,0.9630254302876716,TPESampler,COMPLETE
2358,0.2538820548128662,2025-04-24 22:44:32.050863,2025-04-24 22:44:35.840614,0 days 00:00:03.789751,0.08170965451939691,9,sqrt,2,9,1492,0.9915386420637609,TPESampler,COMPLETE
2359,0.26504498305530816,2025-04-24 22:44:32.094100,2025-04-24 22:44:35.929060,0 days 00:00:03.834960,0.09086349342547614,11,sqrt,3,16,1465,0.8718521879065769,TPESampler,COMPLETE
2360,0.25681156074633266,2025-04-24 22:44:34.992078,2025-04-24 22:44:38.158576,0 days 00:00:03.166498,0.09584684487561708,11,sqrt,1,14,1370,0.9610140020874643,TPESampler,COMPLETE
2361,0.23819685677444558,2025-04-24 22:44:36.036450,2025-04-24 22:44:38.861061,0 days 00:00:02.824611,0.06921432456281212,12,sqrt,1,14,1196,0.9286832679525494,TPESampler,COMPLETE
2362,0.38618839002188055,2025-04-24 22:44:36.168547,2025-04-24 22:44:44.838548,0 days 00:00:08.670001,0.09207262095168245,12,,9,19,1171,0.9741265349136056,TPESampler,COMPLETE
2363,0.2697942446285707,2025-04-24 22:44:38.361662,2025-04-24 22:44:41.207201,0 days 00:00:02.845539,0.07763602630507954,8,sqrt,3,15,1466,0.9830349402763285,TPESampler,COMPLETE
2364,0.2565000466706237,2025-04-24 22:44:39.077286,2025-04-24 22:44:41.546163,0 days 00:00:02.468877,0.09357328409563787,10,sqrt,3,11,1255,0.8463814153827313,TPESampler,COMPLETE
2365,0.30593372352262443,2025-04-24 22:44:41.411432,2025-04-24 22:44:44.560635,0 days 00:00:03.149203,0.03805045566329814,11,,5,19,473,0.7512820122212824,TPESampler,COMPLETE
2366,0.29205137424733923,2025-04-24 22:44:41.853153,2025-04-24 22:44:43.484768,0 days 00:00:01.631615,0.08198990883662212,8,,1,19,226,0.6529726029518853,TPESampler,COMPLETE
2367,0.24681868625231468,2025-04-24 22:44:43.684283,2025-04-24 22:44:46.849234,0 days 00:00:03.164951,0.06466478146607153,11,sqrt,1,15,1269,0.9272305962824683,TPESampler,COMPLETE
2368,0.25242096106612133,2025-04-24 22:44:44.766482,2025-04-24 22:44:48.189687,0 days 00:00:03.423205,0.0973285838532944,11,sqrt,1,12,1296,0.9010036722275864,TPESampler,COMPLETE
2369,0.27411269340491984,2025-04-24 22:44:45.076009,2025-04-24 22:44:48.609671,0 days 00:00:03.533662,0.08935278632914814,10,sqrt,4,13,1443,0.9829098789309285,TPESampler,COMPLETE
2370,0.25670473954757134,2025-04-24 22:44:47.044077,2025-04-24 22:44:50.579124,0 days 00:00:03.535047,0.054206723214038174,8,sqrt,2,16,1454,0.9800940809314819,TPESampler,COMPLETE
2371,0.277276842284158,2025-04-24 22:44:48.396644,2025-04-24 22:44:52.167365,0 days 00:00:03.770721,0.06045620174416786,9,sqrt,3,15,1490,0.9201023579806111,TPESampler,COMPLETE
2372,0.4333768441074509,2025-04-24 22:44:48.900895,2025-04-24 22:44:50.302957,0 days 00:00:01.402062,0.06873816516063258,4,log2,4,5,336,0.8271063545497592,TPESampler,COMPLETE
2373,0.2608873783700295,2025-04-24 22:44:50.516626,2025-04-24 22:44:53.868361,0 days 00:00:03.351735,0.07255052892553578,9,sqrt,2,15,1472,0.9386109150927208,TPESampler,COMPLETE
2374,0.2786593204204894,2025-04-24 22:44:50.816550,2025-04-24 22:44:53.780513,0 days 00:00:02.963963,0.05344615970695158,10,sqrt,3,11,1139,0.7906585503155865,TPESampler,COMPLETE
2375,0.31978257062987614,2025-04-24 22:44:52.393152,2025-04-24 22:45:02.714652,0 days 00:00:10.321500,0.07814578977044441,10,,4,9,1480,0.9170631995905765,TPESampler,COMPLETE
2376,0.403465501043765,2025-04-24 22:44:53.963444,2025-04-24 22:44:56.269480,0 days 00:00:02.306036,0.02183326088002856,12,log2,6,10,1160,0.9923218852350142,TPESampler,COMPLETE
2377,0.23268420394879755,2025-04-24 22:44:54.090064,2025-04-24 22:44:57.370238,0 days 00:00:03.280174,0.07191580366011532,10,sqrt,1,20,1461,0.9009750987966021,TPESampler,COMPLETE
2378,0.26441355242532993,2025-04-24 22:44:56.471440,2025-04-24 22:44:59.174578,0 days 00:00:02.703138,0.07180835107362518,9,log2,1,12,1439,0.8390972994104106,TPESampler,COMPLETE
2379,0.3706692938415683,2025-04-24 22:44:57.573784,2025-04-24 22:44:59.182584,0 days 00:00:01.608800,0.05939810938043633,10,sqrt,7,19,628,0.7128209858587007,TPESampler,COMPLETE
2380,0.223685547359736,2025-04-24 22:44:59.342689,2025-04-24 22:45:01.952400,0 days 00:00:02.609711,0.09892574432652597,12,sqrt,1,16,1311,0.8651085936742341,TPESampler,COMPLETE
2381,0.29925708237094817,2025-04-24 22:44:59.394857,2025-04-24 22:45:02.283203,0 days 00:00:02.888346,0.0295303212402777,8,,1,19,449,0.7498390486616759,TPESampler,COMPLETE
2382,0.3195300396534793,2025-04-24 22:45:02.149992,2025-04-24 22:45:13.234462,0 days 00:00:11.084470,0.09099232367403266,12,,3,14,1447,0.9496445119616262,TPESampler,COMPLETE
2383,0.2434454205044358,2025-04-24 22:45:02.558583,2025-04-24 22:45:05.421222,0 days 00:00:02.862639,0.08504152815367569,12,sqrt,1,18,1415,0.8460288385142989,TPESampler,COMPLETE
2384,0.24887702398376657,2025-04-24 22:45:03.009879,2025-04-24 22:45:05.958746,0 days 00:00:02.948867,0.08632855901177774,12,sqrt,2,17,1498,0.8967390401227585,TPESampler,COMPLETE
2385,0.2541918882215468,2025-04-24 22:45:05.624752,2025-04-24 22:45:08.419401,0 days 00:00:02.794649,0.0994222592327297,9,sqrt,2,16,1472,0.9920751933965543,TPESampler,COMPLETE
2386,0.244905761295222,2025-04-24 22:45:06.205988,2025-04-24 22:45:09.214088,0 days 00:00:03.008100,0.07370541683442036,7,sqrt,1,12,1489,0.9028050380419382,TPESampler,COMPLETE
2387,0.3014524174498106,2025-04-24 22:45:08.636081,2025-04-24 22:45:19.264431,0 days 00:00:10.628350,0.07174331530301573,10,,3,15,1458,0.9889794066037835,TPESampler,COMPLETE
2388,0.2447443824889685,2025-04-24 22:45:09.442811,2025-04-24 22:45:11.439652,0 days 00:00:01.996841,0.08340573444795862,12,sqrt,1,17,1065,0.924471928091755,TPESampler,COMPLETE
2389,0.4036057403722025,2025-04-24 22:45:11.645437,2025-04-24 22:45:13.119191,0 days 00:00:01.473754,0.09750691432810918,12,log2,8,6,1008,0.9672488770702607,TPESampler,COMPLETE
2390,0.2599194139448234,2025-04-24 22:45:13.294093,2025-04-24 22:45:16.081946,0 days 00:00:02.787853,0.08861264162418267,12,sqrt,1,14,1209,0.8502209794247597,TPESampler,COMPLETE
2391,0.25419211613652615,2025-04-24 22:45:13.423179,2025-04-24 22:45:16.413845,0 days 00:00:02.990666,0.08466421512140815,8,sqrt,1,7,1387,0.9979895824665391,TPESampler,COMPLETE
2392,0.2426681536943498,2025-04-24 22:45:16.286556,2025-04-24 22:45:19.100443,0 days 00:00:02.813887,0.06959321444971915,9,sqrt,1,16,1484,0.9356824240788507,TPESampler,COMPLETE
2393,0.25546033393072715,2025-04-24 22:45:16.698226,2025-04-24 22:45:19.002167,0 days 00:00:02.303941,0.09760811110508762,12,sqrt,3,15,1109,0.9465345990377696,TPESampler,COMPLETE
2394,0.7036508504642012,2025-04-24 22:45:19.202716,2025-04-24 22:45:20.521163,0 days 00:00:01.318447,0.04637669217660662,6,log2,8,13,170,0.6012718417591367,TPESampler,COMPLETE
2395,0.3115359967661857,2025-04-24 22:45:19.326542,2025-04-24 22:45:26.258605,0 days 00:00:06.932063,0.01661048436989643,8,,4,18,1022,0.8814958181379132,TPESampler,COMPLETE
2396,0.24605594593937039,2025-04-24 22:45:19.488179,2025-04-24 22:45:22.922830,0 days 00:00:03.434651,0.06652167190861784,12,sqrt,1,17,1302,0.908215394129765,TPESampler,COMPLETE
2397,0.25760433835078717,2025-04-24 22:45:20.834300,2025-04-24 22:45:23.850429,0 days 00:00:03.016129,0.09645363361710643,11,sqrt,3,18,1457,0.9927389727010991,TPESampler,COMPLETE
2398,0.24155525555790391,2025-04-24 22:45:23.128793,2025-04-24 22:45:26.193477,0 days 00:00:03.064684,0.0980442980599133,10,sqrt,1,12,1384,0.843017583361986,TPESampler,COMPLETE
2399,0.602255905202561,2025-04-24 22:45:24.076503,2025-04-24 22:45:25.159773,0 days 00:00:01.083270,0.015718230741130015,5,log2,2,13,239,0.6198380392372194,TPESampler,COMPLETE
2400,0.26745970719469936,2025-04-24 22:45:25.397594,2025-04-24 22:45:28.467184,0 days 00:00:03.069590,0.06679956042054709,12,sqrt,3,16,1432,0.8251534258486547,TPESampler,COMPLETE
2401,0.39568357183501895,2025-04-24 22:45:26.377989,2025-04-24 22:45:31.811063,0 days 00:00:05.433074,0.08778195803873137,5,,10,6,1222,0.8178766900736756,TPESampler,COMPLETE
2402,0.30446775002645626,2025-04-24 22:45:26.500353,2025-04-24 22:45:30.651809,0 days 00:00:04.151456,0.018277582580508853,10,,2,15,597,0.8215415862740436,TPESampler,COMPLETE
2403,0.23726175913645434,2025-04-24 22:45:28.671466,2025-04-24 22:45:31.652357,0 days 00:00:02.980891,0.0884503358447107,12,sqrt,1,15,1500,0.8865586658471689,TPESampler,COMPLETE
2404,0.25390511514263747,2025-04-24 22:45:30.863920,2025-04-24 22:45:34.486199,0 days 00:00:03.622279,0.06357889003885278,9,sqrt,1,11,1483,0.9680290087025476,TPESampler,COMPLETE
2405,0.26069520009570013,2025-04-24 22:45:31.871956,2025-04-24 22:45:35.247729,0 days 00:00:03.375773,0.0772005625088953,12,sqrt,3,17,1198,0.891490877290232,TPESampler,COMPLETE
2406,0.49676765608097895,2025-04-24 22:45:32.055142,2025-04-24 22:45:34.051269,0 days 00:00:01.996127,0.06577704698637268,7,log2,10,15,663,0.6173271532474355,TPESampler,COMPLETE
2407,0.24790724389068258,2025-04-24 22:45:34.263218,2025-04-24 22:45:37.437668,0 days 00:00:03.174450,0.08916101075969425,8,sqrt,1,14,1411,0.9938381354490141,TPESampler,COMPLETE
2408,0.5586724241434701,2025-04-24 22:45:34.755841,2025-04-24 22:45:37.305352,0 days 00:00:02.549511,0.01597421253029847,4,log2,6,13,871,0.6784821530919373,TPESampler,COMPLETE
2409,0.3163819372668202,2025-04-24 22:45:35.513871,2025-04-24 22:45:40.067426,0 days 00:00:04.553555,0.03742789630540631,5,,5,11,988,0.6345883608469908,TPESampler,COMPLETE
2410,0.2566665658447528,2025-04-24 22:45:37.492650,2025-04-24 22:45:41.137772,0 days 00:00:03.645122,0.08748793322906227,12,sqrt,3,12,1481,0.7982599801187423,TPESampler,COMPLETE
2411,0.2745502441689243,2025-04-24 22:45:37.651305,2025-04-24 22:45:41.069550,0 days 00:00:03.418245,0.05011880935161792,9,sqrt,3,19,1444,0.9807058535094817,TPESampler,COMPLETE
2412,0.4214000736257117,2025-04-24 22:45:40.294094,2025-04-24 22:45:45.462135,0 days 00:00:05.168041,0.014406392217582723,3,,9,12,1246,0.9348286708089059,TPESampler,COMPLETE
2413,0.22689068740002893,2025-04-24 22:45:41.238467,2025-04-24 22:45:44.360623,0 days 00:00:03.122156,0.06563068017583261,10,sqrt,1,14,1358,0.8757872480933011,TPESampler,COMPLETE
2414,0.2551942181045768,2025-04-24 22:45:41.374224,2025-04-24 22:45:44.618840,0 days 00:00:03.244616,0.07191373040651161,9,sqrt,1,12,1490,0.9557219444034242,TPESampler,COMPLETE
2415,0.25501499296386043,2025-04-24 22:45:44.568715,2025-04-24 22:45:47.286915,0 days 00:00:02.718200,0.04243130447799446,11,sqrt,1,13,996,0.8085847733258723,TPESampler,COMPLETE
2416,0.23811167979756204,2025-04-24 22:45:44.940423,2025-04-24 22:45:48.202357,0 days 00:00:03.261934,0.09304293484209873,12,sqrt,1,16,1242,0.8384695606176394,TPESampler,COMPLETE
2417,0.24523472382370542,2025-04-24 22:45:45.690938,2025-04-24 22:45:49.414728,0 days 00:00:03.723790,0.07559946768386287,10,sqrt,1,12,1467,0.8626939176543903,TPESampler,COMPLETE
2418,0.29134080558255243,2025-04-24 22:45:47.498373,2025-04-24 22:45:51.150848,0 days 00:00:03.652475,0.03669065235630286,4,sqrt,1,7,1495,0.9844252689724732,TPESampler,COMPLETE
2419,0.5465830767452212,2025-04-24 22:45:48.428269,2025-04-24 22:45:51.603954,0 days 00:00:03.175685,0.013306739300547137,12,log2,7,2,1282,0.6204626092078591,TPESampler,COMPLETE
2420,0.24639373152274902,2025-04-24 22:45:49.632313,2025-04-24 22:45:53.648165,0 days 00:00:04.015852,0.09733228667190054,11,sqrt,1,17,1478,0.8671024339435692,TPESampler,COMPLETE
2421,0.763685789966409,2025-04-24 22:45:51.367711,2025-04-24 22:45:52.939761,0 days 00:00:01.572050,0.013268462468466895,7,log2,10,17,327,0.7040666976496608,TPESampler,COMPLETE
2422,0.242184818550629,2025-04-24 22:45:51.897817,2025-04-24 22:45:55.360378,0 days 00:00:03.462561,0.08556660288515729,10,sqrt,1,15,1408,0.9970861320322895,TPESampler,COMPLETE
2423,0.2922580986048198,2025-04-24 22:45:53.158548,2025-04-24 22:46:01.979994,0 days 00:00:08.821446,0.07726527644058952,7,,2,13,1475,0.9537214112804647,TPESampler,COMPLETE
2424,0.2693515797942085,2025-04-24 22:45:53.895801,2025-04-24 22:45:56.682024,0 days 00:00:02.786223,0.06165252252207505,9,log2,1,12,1465,0.9229887098223984,TPESampler,COMPLETE
2425,0.2593353993280456,2025-04-24 22:45:55.576130,2025-04-24 22:45:58.700604,0 days 00:00:03.124474,0.060462073074749385,10,sqrt,2,12,1376,0.8724317806798291,TPESampler,COMPLETE
2426,0.4309176664861664,2025-04-24 22:45:56.879981,2025-04-24 22:45:59.330802,0 days 00:00:02.450821,0.01759390228507137,9,sqrt,10,7,1194,0.9267325290849223,TPESampler,COMPLETE
2427,0.26167242896350207,2025-04-24 22:45:58.914203,2025-04-24 22:46:02.037734,0 days 00:00:03.123531,0.04833082615164706,11,sqrt,2,16,1478,0.9064815026850425,TPESampler,COMPLETE
2428,0.22839762801120092,2025-04-24 22:45:59.557611,2025-04-24 22:46:02.424590,0 days 00:00:02.866979,0.05607292239252045,12,sqrt,1,14,1306,0.8536791041946016,TPESampler,COMPLETE
2429,0.24959530326363047,2025-04-24 22:46:02.164586,2025-04-24 22:46:06.016771,0 days 00:00:03.852185,0.05958487030417587,10,sqrt,1,18,1495,0.9879357837133125,TPESampler,COMPLETE
2430,0.26438459452763313,2025-04-24 22:46:02.304848,2025-04-24 22:46:05.739833,0 days 00:00:03.434985,0.058432938538398635,9,sqrt,2,13,1258,0.9435413700194597,TPESampler,COMPLETE
2431,0.37179449095247613,2025-04-24 22:46:02.713462,2025-04-24 22:46:04.435160,0 days 00:00:01.721698,0.09373995296973715,8,sqrt,6,6,391,0.654620350078962,TPESampler,COMPLETE
2432,0.24126645082383938,2025-04-24 22:46:04.649059,2025-04-24 22:46:08.404700,0 days 00:00:03.755641,0.04769623428159708,11,sqrt,1,9,1412,0.8529585002954108,TPESampler,COMPLETE
2433,0.2734447160727498,2025-04-24 22:46:05.970639,2025-04-24 22:46:09.386993,0 days 00:00:03.416354,0.02963044840842321,10,sqrt,2,14,1410,0.8914180777837309,TPESampler,COMPLETE
2434,0.2868186858311626,2025-04-24 22:46:06.361799,2025-04-24 22:46:09.509753,0 days 00:00:03.147954,0.04489073663682726,8,sqrt,3,13,1175,0.8518304861338266,TPESampler,COMPLETE
2435,0.24843336357770543,2025-04-24 22:46:08.617473,2025-04-24 22:46:12.394367,0 days 00:00:03.776894,0.057767149059706334,10,sqrt,1,15,1486,0.9167372517848502,TPESampler,COMPLETE
2436,0.2590008151240468,2025-04-24 22:46:09.584623,2025-04-24 22:46:12.926200,0 days 00:00:03.341577,0.05429237275595284,11,sqrt,2,12,1241,0.8760302270625918,TPESampler,COMPLETE
2437,0.2529390562964037,2025-04-24 22:46:09.726662,2025-04-24 22:46:13.697202,0 days 00:00:03.970540,0.0998189549181219,11,sqrt,1,15,1428,0.9627530633943906,TPESampler,COMPLETE
2438,0.25669053715701984,2025-04-24 22:46:12.794493,2025-04-24 22:46:16.076864,0 days 00:00:03.282371,0.0981804350905883,12,sqrt,3,13,1226,0.8195219359988497,TPESampler,COMPLETE
2439,0.2667469985586093,2025-04-24 22:46:13.200509,2025-04-24 22:46:16.946856,0 days 00:00:03.746347,0.07780198495714939,8,sqrt,3,12,1412,0.8387426291336593,TPESampler,COMPLETE
2440,0.2660552064334587,2025-04-24 22:46:13.935783,2025-04-24 22:46:17.413453,0 days 00:00:03.477670,0.0961795293067022,12,sqrt,1,16,1388,0.9632796884699263,TPESampler,COMPLETE
2441,0.24805557124781538,2025-04-24 22:46:16.298053,2025-04-24 22:46:19.587847,0 days 00:00:03.289794,0.06375664380976996,11,sqrt,1,13,1116,0.878115998156843,TPESampler,COMPLETE
2442,0.2658119550912736,2025-04-24 22:46:17.175448,2025-04-24 22:46:20.384420,0 days 00:00:03.208972,0.08536837747848065,12,sqrt,2,15,1177,0.9227301717378079,TPESampler,COMPLETE
2443,0.29391898498691604,2025-04-24 22:46:17.725897,2025-04-24 22:46:20.796004,0 days 00:00:03.070107,0.06387515208023442,11,log2,2,13,1307,0.9869968477370742,TPESampler,COMPLETE
2444,0.26025209043877157,2025-04-24 22:46:19.822118,2025-04-24 22:46:22.907649,0 days 00:00:03.085531,0.06386062085062089,11,sqrt,2,12,1421,0.7733157303842708,TPESampler,COMPLETE
2445,0.3066428572457376,2025-04-24 22:46:20.623694,2025-04-24 22:46:28.235272,0 days 00:00:07.611578,0.06668353785534194,8,,4,4,1196,0.9152907773089213,TPESampler,COMPLETE
2446,0.4175926733236941,2025-04-24 22:46:21.072040,2025-04-24 22:46:22.849096,0 days 00:00:01.777056,0.018863053336123252,3,,5,12,408,0.8620836903778794,TPESampler,COMPLETE
2447,0.3901777693630638,2025-04-24 22:46:23.012273,2025-04-24 22:46:25.901915,0 days 00:00:02.889642,0.01290885831433139,3,sqrt,1,14,1315,0.8908429546024624,TPESampler,COMPLETE
2448,0.27372918036957244,2025-04-24 22:46:23.160152,2025-04-24 22:46:26.192431,0 days 00:00:03.032279,0.03389486330368415,11,sqrt,2,13,1406,0.8258011223832751,TPESampler,COMPLETE
2449,0.4271899391735477,2025-04-24 22:46:26.118324,2025-04-24 22:46:28.861068,0 days 00:00:02.742744,0.010851768794613526,12,sqrt,9,15,1257,0.883853040594909,TPESampler,COMPLETE
2450,0.24144167071556347,2025-04-24 22:46:26.425796,2025-04-24 22:46:29.917736,0 days 00:00:03.491940,0.09863924719710257,10,sqrt,1,16,1487,0.90504855220948,TPESampler,COMPLETE
2451,0.2699574409148662,2025-04-24 22:46:28.449698,2025-04-24 22:46:31.921805,0 days 00:00:03.472107,0.09989473511953068,11,log2,1,11,1375,0.951007211635504,TPESampler,COMPLETE
