number,value,datetime_start,datetime_complete,duration,params_learning_rate,params_max_depth,params_max_features,params_min_samples_leaf,params_min_samples_split,params_n_estimators,params_subsample,system_attrs_auto:sampler,state
492,0.27916691153053064,2025-04-24 22:09:34.377240,2025-04-24 22:09:36.719666,0 days 00:00:02.342426,0.06874989552313314,11,sqrt,4,12,1088,0.9606427361393285,TPESampler,COMPLETE
493,0.5392496425170604,2025-04-24 22:09:34.427737,2025-04-24 22:09:35.416669,0 days 00:00:00.988932,0.011477237901681987,9,sqrt,2,12,157,0.8377439529603766,TPESampler,COMPLETE
494,0.24214223442202482,2025-04-24 22:09:35.601927,2025-04-24 22:09:37.976550,0 days 00:00:02.374623,0.07211903979243146,11,sqrt,1,20,1307,0.8766223760047419,TPESampler,COMPLETE
495,0.2751942734105371,2025-04-24 22:09:36.885618,2025-04-24 22:09:45.169903,0 days 00:00:08.284285,0.06623632000419145,10,,1,18,1394,0.8472799380078168,TPESampler,COMPLETE
496,0.24463101219803773,2025-04-24 22:09:38.147035,2025-04-24 22:09:40.482322,0 days 00:00:02.335287,0.08847956571342414,12,sqrt,1,20,1434,0.7971645683782999,TPESampler,COMPLETE
497,0.3241104007166695,2025-04-24 22:09:40.664685,2025-04-24 22:09:45.829475,0 days 00:00:05.164790,0.014373670512319947,7,,5,9,1265,0.6548188498471521,TPESampler,COMPLETE
498,0.27501423151801435,2025-04-24 22:09:40.881913,2025-04-24 22:09:42.859088,0 days 00:00:01.977175,0.049225706012937374,10,sqrt,2,7,1056,0.9544995514878346,TPESampler,COMPLETE
499,0.27279969745003185,2025-04-24 22:09:43.047878,2025-04-24 22:09:45.172084,0 days 00:00:02.124206,0.09427040009289589,9,log2,1,19,1485,0.8765698852328182,TPESampler,COMPLETE
500,0.33712916767684403,2025-04-24 22:09:45.283507,2025-04-24 22:09:51.312874,0 days 00:00:06.029367,0.06427930263960628,5,,7,4,1209,0.9713528725846453,TPESampler,COMPLETE
501,0.6421826251370091,2025-04-24 22:09:45.343885,2025-04-24 22:09:47.150863,0 days 00:00:01.806978,0.01360731748050305,7,log2,8,5,792,0.6271840509639198,TPESampler,COMPLETE
502,0.26095601400708635,2025-04-24 22:09:46.048113,2025-04-24 22:09:48.726511,0 days 00:00:02.678398,0.09234499013406874,11,sqrt,1,13,1256,0.8880412920372701,TPESampler,COMPLETE
503,0.26863405890612835,2025-04-24 22:09:47.328720,2025-04-24 22:09:49.759692,0 days 00:00:02.430972,0.09515424463789271,10,sqrt,3,15,1151,0.9111389947197289,TPESampler,COMPLETE
504,0.4510005199914754,2025-04-24 22:09:48.907364,2025-04-24 22:09:50.278254,0 days 00:00:01.370890,0.024671957933037867,3,sqrt,7,17,588,0.697042833695837,TPESampler,COMPLETE
505,0.3387872285254567,2025-04-24 22:09:49.936732,2025-04-24 22:09:52.689319,0 days 00:00:02.752587,0.02018787351815454,7,,5,15,592,0.6804529729758406,TPESampler,COMPLETE
506,0.35762559939373406,2025-04-24 22:09:50.443437,2025-04-24 22:09:58.029294,0 days 00:00:07.585857,0.0876238749665678,12,,7,6,1251,0.7928629817705135,TPESampler,COMPLETE
507,0.23858625707294526,2025-04-24 22:09:51.494130,2025-04-24 22:09:53.929770,0 days 00:00:02.435640,0.0961031615050619,12,sqrt,1,13,1281,0.8204658048255817,TPESampler,COMPLETE
508,0.35832640839698027,2025-04-24 22:09:52.869313,2025-04-24 22:09:55.086015,0 days 00:00:02.216702,0.038760965363316656,10,sqrt,7,10,1204,0.7536036726868102,TPESampler,COMPLETE
509,0.2829820755722996,2025-04-24 22:09:54.101079,2025-04-24 22:09:56.142413,0 days 00:00:02.041334,0.09450621986116801,7,sqrt,4,9,1038,0.9570509123825657,TPESampler,COMPLETE
510,0.2563624264037618,2025-04-24 22:09:55.261776,2025-04-24 22:09:57.579073,0 days 00:00:02.317297,0.05058661967191812,7,sqrt,1,14,1223,0.870787746263717,TPESampler,COMPLETE
511,0.24717423316096138,2025-04-24 22:09:56.324630,2025-04-24 22:09:58.682799,0 days 00:00:02.358169,0.05167633611075128,10,sqrt,1,13,1093,0.8616955154268082,TPESampler,COMPLETE
512,0.2414555904025995,2025-04-24 22:09:57.753467,2025-04-24 22:10:01.067403,0 days 00:00:03.313936,0.06955649475146829,10,sqrt,1,12,1334,0.7192267811500317,TPESampler,COMPLETE
513,0.23177639863601754,2025-04-24 22:09:58.210970,2025-04-24 22:10:01.216378,0 days 00:00:03.005408,0.09434319174935839,11,sqrt,1,19,1142,0.9320931082164337,TPESampler,COMPLETE
514,0.26320586252831135,2025-04-24 22:09:58.892069,2025-04-24 22:10:02.203257,0 days 00:00:03.311188,0.09436680817145013,12,sqrt,2,20,1309,0.855016372082786,TPESampler,COMPLETE
515,0.39040037676347034,2025-04-24 22:10:01.225983,2025-04-24 22:10:06.217415,0 days 00:00:04.991432,0.03472685683920277,6,,9,14,1393,0.6036022548658011,TPESampler,COMPLETE
516,0.2444773277389296,2025-04-24 22:10:01.379500,2025-04-24 22:10:04.180980,0 days 00:00:02.801480,0.06243153525038723,11,sqrt,1,19,1264,0.9477957072472606,TPESampler,COMPLETE
517,0.27290559548549226,2025-04-24 22:10:02.380900,2025-04-24 22:10:04.643628,0 days 00:00:02.262728,0.08029973533874996,12,sqrt,4,18,992,0.8871140092279346,TPESampler,COMPLETE
518,0.41339116799630554,2025-04-24 22:10:04.363145,2025-04-24 22:10:05.496146,0 days 00:00:01.133001,0.021834254711533618,7,,8,19,145,0.8129253352471689,TPESampler,COMPLETE
519,0.37557265538049317,2025-04-24 22:10:04.819142,2025-04-24 22:10:07.438368,0 days 00:00:02.619226,0.043336446615201,10,,9,6,395,0.8415273598759021,TPESampler,COMPLETE
520,0.251970387023361,2025-04-24 22:10:05.707522,2025-04-24 22:10:07.892666,0 days 00:00:02.185144,0.07370569239911169,10,sqrt,1,19,1009,0.9189269821830224,TPESampler,COMPLETE
521,0.26041121399216155,2025-04-24 22:10:06.397331,2025-04-24 22:10:08.889817,0 days 00:00:02.492486,0.07146851222935016,11,sqrt,2,20,1117,0.9811829576066118,TPESampler,COMPLETE
522,0.27206912835309993,2025-04-24 22:10:07.612362,2025-04-24 22:10:10.097214,0 days 00:00:02.484852,0.09589061334437286,11,sqrt,3,18,1011,0.9625908799639017,TPESampler,COMPLETE
523,0.4375458311998277,2025-04-24 22:10:08.080995,2025-04-24 22:10:09.772467,0 days 00:00:01.691472,0.06544132991990406,8,sqrt,10,11,588,0.7234388112517652,TPESampler,COMPLETE
524,0.29453220870205377,2025-04-24 22:10:09.075375,2025-04-24 22:10:11.589272,0 days 00:00:02.513897,0.0895940424668476,11,log2,3,18,1109,0.9194184388814167,TPESampler,COMPLETE
525,0.3417635782691869,2025-04-24 22:10:09.959737,2025-04-24 22:10:11.338501,0 days 00:00:01.378764,0.07150017114027367,11,log2,4,3,411,0.97389725098015,TPESampler,COMPLETE
526,0.618188861432408,2025-04-24 22:10:10.291027,2025-04-24 22:10:11.745759,0 days 00:00:01.454732,0.012868248629478605,5,log2,5,10,466,0.8358144360413859,TPESampler,COMPLETE
527,0.2450077042702996,2025-04-24 22:10:11.539460,2025-04-24 22:10:14.224220,0 days 00:00:02.684760,0.07966719234559522,11,sqrt,1,19,1218,0.8728154857572347,TPESampler,COMPLETE
528,0.29065709427491937,2025-04-24 22:10:11.816661,2025-04-24 22:10:14.943726,0 days 00:00:03.127065,0.05887457255754149,7,log2,1,7,1218,0.8875477159831094,TPESampler,COMPLETE
529,0.2513620435602693,2025-04-24 22:10:11.950641,2025-04-24 22:10:14.950491,0 days 00:00:02.999850,0.09736078329238348,12,sqrt,1,16,993,0.9011266188272591,TPESampler,COMPLETE
530,0.42901488361843076,2025-04-24 22:10:14.593794,2025-04-24 22:10:17.326212,0 days 00:00:02.732418,0.01908525843300424,11,sqrt,8,15,1288,0.6184389466963873,TPESampler,COMPLETE
531,0.24057090975777173,2025-04-24 22:10:15.143014,2025-04-24 22:10:18.336848,0 days 00:00:03.193834,0.08054229194892515,10,sqrt,1,19,1222,0.9037734798677257,TPESampler,COMPLETE
532,0.25345433434009845,2025-04-24 22:10:15.208125,2025-04-24 22:10:18.513826,0 days 00:00:03.305701,0.08634974553989791,9,sqrt,1,16,1307,0.9577761311180892,TPESampler,COMPLETE
533,0.3085681496506162,2025-04-24 22:10:17.522172,2025-04-24 22:10:19.174802,0 days 00:00:01.652630,0.05906173058353781,6,sqrt,1,3,562,0.8399643152849722,TPESampler,COMPLETE
534,0.321640287963506,2025-04-24 22:10:18.515041,2025-04-24 22:10:28.003086,0 days 00:00:09.488045,0.07339535396667893,12,,2,17,1320,0.9202854128544884,TPESampler,COMPLETE
535,0.25945584066210553,2025-04-24 22:10:18.705430,2025-04-24 22:10:21.717941,0 days 00:00:03.012511,0.061115343498863973,12,sqrt,3,16,1491,0.9731492866769913,TPESampler,COMPLETE
536,0.3379746353637654,2025-04-24 22:10:19.379423,2025-04-24 22:10:21.091616,0 days 00:00:01.712193,0.05713630462958764,12,log2,4,2,792,0.8251878295029217,TPESampler,COMPLETE
537,0.6159816916488203,2025-04-24 22:10:21.271683,2025-04-24 22:10:22.696274,0 days 00:00:01.424591,0.014487314204531273,12,log2,9,4,776,0.725369458695372,TPESampler,COMPLETE
538,0.3539308696963683,2025-04-24 22:10:21.911393,2025-04-24 22:10:23.006772,0 days 00:00:01.095379,0.07180898397532623,12,log2,4,15,446,0.7877812698986969,TPESampler,COMPLETE
539,0.3849982374685595,2025-04-24 22:10:22.878761,2025-04-24 22:10:31.454606,0 days 00:00:08.575845,0.03139128061228395,12,,10,12,1426,0.8901802474042043,TPESampler,COMPLETE
540,0.2988091233801337,2025-04-24 22:10:23.192900,2025-04-24 22:10:24.685610,0 days 00:00:01.492710,0.0565378054852544,10,log2,1,20,830,0.9549777773612289,TPESampler,COMPLETE
541,0.3040462428141355,2025-04-24 22:10:24.868071,2025-04-24 22:10:26.348846,0 days 00:00:01.480775,0.08240148358395862,10,log2,3,12,952,0.837104681484402,TPESampler,COMPLETE
542,0.24678301450981308,2025-04-24 22:10:26.519398,2025-04-24 22:10:28.807415,0 days 00:00:02.288017,0.08337032313287153,11,sqrt,2,17,1294,0.9385327504005969,TPESampler,COMPLETE
543,0.2754349285663694,2025-04-24 22:10:28.183849,2025-04-24 22:10:30.191597,0 days 00:00:02.007748,0.09746547803975844,10,sqrt,4,17,1023,0.8311518651254598,TPESampler,COMPLETE
544,0.24986637507435247,2025-04-24 22:10:29.042231,2025-04-24 22:10:31.372262,0 days 00:00:02.330031,0.09373196003824434,11,sqrt,1,14,1147,0.9045521127211011,TPESampler,COMPLETE
545,0.2449217669730249,2025-04-24 22:10:30.373940,2025-04-24 22:10:33.113824,0 days 00:00:02.739884,0.09525628749591876,10,sqrt,1,20,1151,0.9789210246006574,TPESampler,COMPLETE
546,0.261145025163885,2025-04-24 22:10:31.522301,2025-04-24 22:10:34.249124,0 days 00:00:02.726823,0.08801017354786202,10,sqrt,1,20,1066,0.9079678056537804,TPESampler,COMPLETE
547,0.24096233352386331,2025-04-24 22:10:31.645225,2025-04-24 22:10:34.966507,0 days 00:00:03.321282,0.09352014588483043,12,sqrt,1,18,1271,0.8638672883883497,TPESampler,COMPLETE
548,0.24427864540108624,2025-04-24 22:10:33.362247,2025-04-24 22:10:36.420536,0 days 00:00:03.058289,0.09479232824640037,10,sqrt,1,15,1404,0.9527666307419302,TPESampler,COMPLETE
549,0.2555793613217011,2025-04-24 22:10:34.448773,2025-04-24 22:10:37.965426,0 days 00:00:03.516653,0.09641030233727052,8,sqrt,2,6,1374,0.8336855921712719,TPESampler,COMPLETE
550,0.25960008649080074,2025-04-24 22:10:35.250032,2025-04-24 22:10:38.661105,0 days 00:00:03.411073,0.04509524018281127,8,sqrt,1,20,1455,0.9338034002131868,TPESampler,COMPLETE
551,0.23802796429721562,2025-04-24 22:10:36.609986,2025-04-24 22:10:40.031273,0 days 00:00:03.421287,0.05527335772361941,11,sqrt,1,17,1450,0.9266187118086981,TPESampler,COMPLETE
552,0.2870162224765175,2025-04-24 22:10:38.142562,2025-04-24 22:10:41.296808,0 days 00:00:03.154246,0.05499576052993339,8,sqrt,4,20,1371,0.8481451396758775,TPESampler,COMPLETE
553,0.2332905599546791,2025-04-24 22:10:38.856159,2025-04-24 22:10:41.792594,0 days 00:00:02.936435,0.08464526135439975,10,sqrt,1,20,1233,0.8961948195225501,TPESampler,COMPLETE
554,0.254167677064164,2025-04-24 22:10:40.261647,2025-04-24 22:10:43.684127,0 days 00:00:03.422480,0.09835480889128487,11,sqrt,3,19,1451,0.9549304374897347,TPESampler,COMPLETE
555,0.23405493526486001,2025-04-24 22:10:41.487326,2025-04-24 22:10:44.238771,0 days 00:00:02.751445,0.09620701195133852,11,sqrt,1,20,1093,0.843387432145383,TPESampler,COMPLETE
556,0.2407469822048229,2025-04-24 22:10:41.962708,2025-04-24 22:10:44.966324,0 days 00:00:03.003616,0.09504814886109304,10,sqrt,1,20,1316,0.9034122436106997,TPESampler,COMPLETE
557,0.281937691095412,2025-04-24 22:10:43.866333,2025-04-24 22:10:52.189378,0 days 00:00:08.323045,0.08500441646176207,12,,1,11,1079,0.9185107157602769,TPESampler,COMPLETE
558,0.3322321344499822,2025-04-24 22:10:44.472158,2025-04-24 22:10:46.357921,0 days 00:00:01.885763,0.01306231218727124,12,,1,13,261,0.7337914826802299,TPESampler,COMPLETE
559,0.2534800632501868,2025-04-24 22:10:45.171563,2025-04-24 22:10:47.475641,0 days 00:00:02.304078,0.09979149447691159,12,sqrt,2,20,1244,0.8983617573935381,TPESampler,COMPLETE
560,0.2419326292711501,2025-04-24 22:10:46.530781,2025-04-24 22:10:49.084411,0 days 00:00:02.553630,0.09934103827924137,12,sqrt,1,15,1286,0.9421271473565563,TPESampler,COMPLETE
561,0.5103210318205229,2025-04-24 22:10:47.666341,2025-04-24 22:10:48.769777,0 days 00:00:01.103436,0.02775279805989189,9,log2,5,14,392,0.795033931290089,TPESampler,COMPLETE
562,0.38535477067407,2025-04-24 22:10:48.961568,2025-04-24 22:10:51.506502,0 days 00:00:02.544934,0.08060878999916997,3,sqrt,8,17,1491,0.9291102147769446,TPESampler,COMPLETE
563,0.2734252916137444,2025-04-24 22:10:49.260838,2025-04-24 22:10:52.033632,0 days 00:00:02.772794,0.09502831126305314,9,sqrt,4,18,1426,0.8776157203763129,TPESampler,COMPLETE
564,0.2471294174692741,2025-04-24 22:10:51.682626,2025-04-24 22:10:54.797016,0 days 00:00:03.114390,0.09086516784263814,10,sqrt,1,20,1182,0.894679150616972,TPESampler,COMPLETE
565,0.5504231002552938,2025-04-24 22:10:52.229697,2025-04-24 22:10:54.150397,0 days 00:00:01.920700,0.01014967235082515,12,log2,5,4,651,0.9342601931093933,TPESampler,COMPLETE
566,0.2511927848041183,2025-04-24 22:10:52.409126,2025-04-24 22:10:55.521614,0 days 00:00:03.112488,0.07951277174341286,9,sqrt,1,9,1145,0.9203092427969709,TPESampler,COMPLETE
567,0.28335490377543054,2025-04-24 22:10:54.342719,2025-04-24 22:10:57.067075,0 days 00:00:02.724356,0.09847389516152058,8,sqrt,3,20,1356,0.8955867562545988,TPESampler,COMPLETE
568,0.3868989706699284,2025-04-24 22:10:54.992708,2025-04-24 22:10:58.658380,0 days 00:00:03.665672,0.07358332858937601,9,,10,19,727,0.6708717484711202,TPESampler,COMPLETE
569,0.6871677446494335,2025-04-24 22:10:55.722453,2025-04-24 22:10:56.676774,0 days 00:00:00.954321,0.012728996843408735,3,sqrt,8,2,228,0.809323400232287,TPESampler,COMPLETE
570,0.23578199671675054,2025-04-24 22:10:56.854724,2025-04-24 22:10:59.665197,0 days 00:00:02.810473,0.09538488011857925,11,sqrt,1,19,1489,0.8827223112797452,TPESampler,COMPLETE
571,0.32322345165826927,2025-04-24 22:10:57.266936,2025-04-24 22:10:59.262602,0 days 00:00:01.995666,0.023087665983231136,11,,2,5,256,0.7603768011653502,TPESampler,COMPLETE
572,0.26794836119163956,2025-04-24 22:10:58.841191,2025-04-24 22:11:01.293585,0 days 00:00:02.452394,0.09874000966542855,11,log2,1,10,1009,0.9811976651473104,TPESampler,COMPLETE
573,0.24393067259711873,2025-04-24 22:10:59.450012,2025-04-24 22:11:02.029569,0 days 00:00:02.579557,0.08861275638980382,9,sqrt,1,7,1037,0.8770338679412556,TPESampler,COMPLETE
574,0.26820167824408353,2025-04-24 22:10:59.868673,2025-04-24 22:11:02.714006,0 days 00:00:02.845333,0.06582780855127182,11,sqrt,3,18,1142,0.8194109385481398,TPESampler,COMPLETE
575,0.6037209316396853,2025-04-24 22:11:01.505505,2025-04-24 22:11:02.655089,0 days 00:00:01.149584,0.013918814830627499,7,log2,3,5,243,0.9316844423047577,TPESampler,COMPLETE
576,0.23262420857836943,2025-04-24 22:11:02.249968,2025-04-24 22:11:05.645425,0 days 00:00:03.395457,0.09517603265249451,11,sqrt,1,20,1438,0.8760632213857275,TPESampler,COMPLETE
577,0.2797804694756738,2025-04-24 22:11:02.937652,2025-04-24 22:11:06.534960,0 days 00:00:03.597308,0.08599641090414527,10,sqrt,4,20,1415,0.767545366927784,TPESampler,COMPLETE
578,0.2381869430569705,2025-04-24 22:11:02.977467,2025-04-24 22:11:06.694765,0 days 00:00:03.717298,0.05650567789461083,10,sqrt,1,20,1498,0.8242994433819804,TPESampler,COMPLETE
579,0.23188762627844375,2025-04-24 22:11:05.891348,2025-04-24 22:11:09.444645,0 days 00:00:03.553297,0.06382745897086926,9,sqrt,1,13,1414,0.7858910384635178,TPESampler,COMPLETE
580,0.23694959898144416,2025-04-24 22:11:06.705053,2025-04-24 22:11:10.300924,0 days 00:00:03.595871,0.07672961806112033,11,sqrt,1,19,1416,0.8707512572351559,TPESampler,COMPLETE
581,0.39435242207779864,2025-04-24 22:11:06.900296,2025-04-24 22:11:09.439947,0 days 00:00:02.539651,0.05631038385180089,6,log2,7,14,1152,0.9417162707352599,TPESampler,COMPLETE
582,0.24469261036684764,2025-04-24 22:11:09.571590,2025-04-24 22:11:12.873506,0 days 00:00:03.301916,0.08540502671451103,10,sqrt,1,15,1362,0.7435866728788485,TPESampler,COMPLETE
583,0.25658189314139124,2025-04-24 22:11:09.627978,2025-04-24 22:11:13.095025,0 days 00:00:03.467047,0.05711713707862882,7,sqrt,1,15,1333,0.774642376824072,TPESampler,COMPLETE
584,0.24110793797301847,2025-04-24 22:11:10.551878,2025-04-24 22:11:14.183433,0 days 00:00:03.631555,0.0657468073858027,12,sqrt,1,15,1462,0.8260225075683207,TPESampler,COMPLETE
585,0.2637899571827696,2025-04-24 22:11:13.057016,2025-04-24 22:11:15.905369,0 days 00:00:02.848353,0.06432876234515715,8,sqrt,2,9,1256,0.8280260648993338,TPESampler,COMPLETE
586,0.21973388201901706,2025-04-24 22:11:13.316618,2025-04-24 22:11:16.654689,0 days 00:00:03.338071,0.08210159183240204,9,sqrt,1,14,1470,0.7946461586573427,TPESampler,COMPLETE
587,0.2527254154681232,2025-04-24 22:11:14.436072,2025-04-24 22:11:17.683434,0 days 00:00:03.247362,0.06933513545151992,11,log2,1,13,1336,0.856056460014378,TPESampler,COMPLETE
588,0.2317686842695195,2025-04-24 22:11:16.098477,2025-04-24 22:11:19.513466,0 days 00:00:03.414989,0.09803413882763103,11,sqrt,1,20,1362,0.8053319759275902,TPESampler,COMPLETE
589,0.42874731384881537,2025-04-24 22:11:16.854137,2025-04-24 22:11:20.071851,0 days 00:00:03.217714,0.01138349984848127,4,log2,2,13,1439,0.6729462822133749,TPESampler,COMPLETE
590,0.25865195543103897,2025-04-24 22:11:17.881346,2025-04-24 22:11:20.895190,0 days 00:00:03.013844,0.08229863574354393,8,sqrt,2,14,1442,0.736273963728677,TPESampler,COMPLETE
591,0.2765212773268173,2025-04-24 22:11:19.714178,2025-04-24 22:11:23.180382,0 days 00:00:03.466204,0.04524241497116373,10,sqrt,3,13,1345,0.7531628009020913,TPESampler,COMPLETE
592,0.3675151419803181,2025-04-24 22:11:20.483813,2025-04-24 22:11:22.121077,0 days 00:00:01.637264,0.03876751904515784,9,sqrt,7,8,485,0.9202962880860897,TPESampler,COMPLETE
593,0.2609166628712005,2025-04-24 22:11:21.088060,2025-04-24 22:11:23.883558,0 days 00:00:02.795498,0.03993746545299909,8,sqrt,1,10,1225,0.7606669214933288,TPESampler,COMPLETE
594,0.37955086336409943,2025-04-24 22:11:22.310258,2025-04-24 22:11:26.659559,0 days 00:00:04.349301,0.04920213144590983,5,,9,16,917,0.9256082676933892,TPESampler,COMPLETE
595,0.258516773680666,2025-04-24 22:11:23.354718,2025-04-24 22:11:25.875890,0 days 00:00:02.521172,0.0528091119565458,8,sqrt,1,12,1240,0.8073948641795199,TPESampler,COMPLETE
596,0.2487018201305796,2025-04-24 22:11:24.066416,2025-04-24 22:11:26.933036,0 days 00:00:02.866620,0.07851371179033124,8,sqrt,1,12,1471,0.8812617819170683,TPESampler,COMPLETE
597,0.2681250219643989,2025-04-24 22:11:26.048656,2025-04-24 22:11:29.196985,0 days 00:00:03.148329,0.09718980615175023,10,sqrt,3,15,1312,0.7640410545917348,TPESampler,COMPLETE
598,0.2742051921577644,2025-04-24 22:11:26.854693,2025-04-24 22:11:29.666797,0 days 00:00:02.812104,0.09596107781070623,11,sqrt,4,9,1125,0.8941504639612697,TPESampler,COMPLETE
599,0.2588686386748395,2025-04-24 22:11:27.159167,2025-04-24 22:11:30.456762,0 days 00:00:03.297595,0.09014090416576492,9,sqrt,2,12,1356,0.8274452714139503,TPESampler,COMPLETE
600,0.2738257345189387,2025-04-24 22:11:29.378057,2025-04-24 22:11:31.229449,0 days 00:00:01.851392,0.06711171932178275,9,sqrt,2,7,778,0.7943948627108269,TPESampler,COMPLETE
601,0.2874955345110857,2025-04-24 22:11:29.855802,2025-04-24 22:11:32.164700,0 days 00:00:02.308898,0.039014872322417925,12,,1,8,312,0.6184399041442513,TPESampler,COMPLETE
602,0.24548582736763647,2025-04-24 22:11:30.653256,2025-04-24 22:11:33.574165,0 days 00:00:02.920909,0.09548880597555753,9,sqrt,2,16,1391,0.8159246636316547,TPESampler,COMPLETE
603,0.25751290987944986,2025-04-24 22:11:31.406635,2025-04-24 22:11:34.291217,0 days 00:00:02.884582,0.061654404530572665,12,sqrt,2,20,1226,0.7647447028990149,TPESampler,COMPLETE
604,0.25995572090259494,2025-04-24 22:11:32.342869,2025-04-24 22:11:35.496022,0 days 00:00:03.153153,0.057117458201519186,9,sqrt,2,13,1367,0.760897650338846,TPESampler,COMPLETE
605,0.24356256310279054,2025-04-24 22:11:33.765795,2025-04-24 22:11:37.090001,0 days 00:00:03.324206,0.0758158496522781,8,sqrt,1,16,1409,0.7760632618767708,TPESampler,COMPLETE
606,0.2422852578540956,2025-04-24 22:11:34.490591,2025-04-24 22:11:37.732326,0 days 00:00:03.241735,0.08896152350096014,8,sqrt,1,13,1328,0.8024044733758817,TPESampler,COMPLETE
607,0.2344244795660289,2025-04-24 22:11:35.684240,2025-04-24 22:11:39.206651,0 days 00:00:03.522411,0.09181556479859684,11,sqrt,1,20,1433,0.7542341927152957,TPESampler,COMPLETE
608,0.23672459158485,2025-04-24 22:11:37.269127,2025-04-24 22:11:40.870820,0 days 00:00:03.601693,0.09837665630619535,10,sqrt,1,9,1472,0.8954054010593181,TPESampler,COMPLETE
609,0.24051437417809834,2025-04-24 22:11:37.946268,2025-04-24 22:11:41.546697,0 days 00:00:03.600429,0.06314915951930201,8,sqrt,1,14,1498,0.8748887226206865,TPESampler,COMPLETE
610,0.2380262662666848,2025-04-24 22:11:39.393626,2025-04-24 22:11:42.854395,0 days 00:00:03.460769,0.08433269571391493,12,sqrt,1,19,1441,0.8239755631956273,TPESampler,COMPLETE
611,0.5707013906566689,2025-04-24 22:11:41.052886,2025-04-24 22:11:42.136788,0 days 00:00:01.083902,0.08444596029034585,4,log2,8,20,244,0.6181335789574681,TPESampler,COMPLETE
612,0.2708887001587682,2025-04-24 22:11:41.763715,2025-04-24 22:11:45.047790,0 days 00:00:03.284075,0.09575051721672943,10,log2,1,16,1425,0.9589769868318994,TPESampler,COMPLETE
613,0.2604357130523998,2025-04-24 22:11:42.378256,2025-04-24 22:11:45.838480,0 days 00:00:03.460224,0.06672713661622719,9,sqrt,2,11,1427,0.791024768294242,TPESampler,COMPLETE
614,0.2549813566963534,2025-04-24 22:11:43.067502,2025-04-24 22:11:46.532964,0 days 00:00:03.465462,0.07929511735207434,11,sqrt,3,20,1435,0.8470950782198257,TPESampler,COMPLETE
