number,value,datetime_start,datetime_complete,duration,params_learning_rate,params_max_depth,params_max_features,params_min_samples_leaf,params_min_samples_split,params_n_estimators,params_subsample,system_attrs_auto:sampler,state
1964,0.2623394054518766,2025-04-24 22:36:41.284217,2025-04-24 22:36:44.904982,0 days 00:00:03.620765,0.05774922352189753,10,sqrt,2,18,1479,0.8792054221009333,TPESampler,COMPLETE
1965,0.23590844138640882,2025-04-24 22:36:41.900209,2025-04-24 22:36:45.041936,0 days 00:00:03.141727,0.09952199227674718,11,sqrt,1,16,1283,0.942257445630032,TPESampler,COMPLETE
1966,0.26713113292082785,2025-04-24 22:36:44.028628,2025-04-24 22:36:47.541200,0 days 00:00:03.512572,0.06277551636623221,10,sqrt,2,18,1355,0.8635799062274606,TPESampler,COMPLETE
1967,0.47983763561843173,2025-04-24 22:36:45.091321,2025-04-24 22:36:46.645783,0 days 00:00:01.554462,0.031269500805698895,4,sqrt,10,20,437,0.6850719205396083,TPESampler,COMPLETE
1968,0.26157180288224036,2025-04-24 22:36:45.270387,2025-04-24 22:36:48.494847,0 days 00:00:03.224460,0.09873662916843169,12,sqrt,3,17,1203,0.8456459428889197,TPESampler,COMPLETE
1969,0.26254257085518146,2025-04-24 22:36:46.853620,2025-04-24 22:36:50.165372,0 days 00:00:03.311752,0.08261285118157893,9,sqrt,2,20,1308,0.8097584725825471,TPESampler,COMPLETE
1970,0.2733588857075337,2025-04-24 22:36:47.755863,2025-04-24 22:36:51.016327,0 days 00:00:03.260464,0.04260681738053062,10,sqrt,3,15,1301,0.9344939083686097,TPESampler,COMPLETE
1971,0.23864832925054008,2025-04-24 22:36:48.694841,2025-04-24 22:36:52.084421,0 days 00:00:03.389580,0.06018838023687068,11,sqrt,1,17,1298,0.8170873855148844,TPESampler,COMPLETE
1972,0.2480549358982863,2025-04-24 22:36:50.359670,2025-04-24 22:36:53.938007,0 days 00:00:03.578337,0.08857984609294994,10,sqrt,1,15,1467,0.8350677620733686,TPESampler,COMPLETE
1973,0.2366394775534283,2025-04-24 22:36:51.248362,2025-04-24 22:36:54.630333,0 days 00:00:03.381971,0.06859907239899876,11,sqrt,1,17,1354,0.8479675181830435,TPESampler,COMPLETE
1974,0.2366309517064966,2025-04-24 22:36:52.299892,2025-04-24 22:36:55.470481,0 days 00:00:03.170589,0.09455297208918265,12,sqrt,1,20,1228,0.7679219120197064,TPESampler,COMPLETE
1975,0.220721288877715,2025-04-24 22:36:54.123547,2025-04-24 22:36:57.547710,0 days 00:00:03.424163,0.09816792080276765,12,sqrt,1,18,1352,0.8390618460568008,TPESampler,COMPLETE
1976,0.23393252568745465,2025-04-24 22:36:54.833082,2025-04-24 22:36:58.052769,0 days 00:00:03.219687,0.09773211505150908,10,sqrt,1,12,1278,0.9517562620255944,TPESampler,COMPLETE
1977,0.26326172212490234,2025-04-24 22:36:55.712315,2025-04-24 22:36:59.341441,0 days 00:00:03.629126,0.0921294188340772,10,sqrt,2,20,1442,0.826806280817208,TPESampler,COMPLETE
1978,0.22479196717577704,2025-04-24 22:36:57.757602,2025-04-24 22:37:01.104761,0 days 00:00:03.347159,0.09301559583556725,12,sqrt,1,18,1346,0.8501743369401994,TPESampler,COMPLETE
1979,0.26670579082915225,2025-04-24 22:36:58.278076,2025-04-24 22:37:01.648223,0 days 00:00:03.370147,0.09828447108663362,11,sqrt,3,17,1332,0.8616796467850636,TPESampler,COMPLETE
1980,0.23907749221449118,2025-04-24 22:36:59.557099,2025-04-24 22:37:02.997664,0 days 00:00:03.440565,0.0803752743467772,12,sqrt,1,16,1329,0.7797453264701506,TPESampler,COMPLETE
1981,0.2594137333553304,2025-04-24 22:37:01.301350,2025-04-24 22:37:04.591328,0 days 00:00:03.289978,0.06531903644170717,12,sqrt,3,19,1295,0.8189307500281441,TPESampler,COMPLETE
1982,0.2562920835164783,2025-04-24 22:37:01.876115,2025-04-24 22:37:05.269785,0 days 00:00:03.393670,0.061655019746417565,12,sqrt,2,15,1337,0.8097399804604739,TPESampler,COMPLETE
1983,0.23957101829785532,2025-04-24 22:37:03.207049,2025-04-24 22:37:06.516637,0 days 00:00:03.309588,0.09743473618810249,11,sqrt,1,12,1274,0.8652690121478402,TPESampler,COMPLETE
1984,0.22166008304511128,2025-04-24 22:37:04.793115,2025-04-24 22:37:08.388394,0 days 00:00:03.595279,0.09324464737474242,12,sqrt,1,15,1462,0.8985526462883769,TPESampler,COMPLETE
1985,0.23667176360077266,2025-04-24 22:37:05.470020,2025-04-24 22:37:09.137185,0 days 00:00:03.667165,0.0990964477373242,11,sqrt,1,19,1483,0.8090759062770729,TPESampler,COMPLETE
1986,0.24313767867782862,2025-04-24 22:37:06.752288,2025-04-24 22:37:09.998589,0 days 00:00:03.246301,0.09139007337921645,10,sqrt,1,20,1247,0.7751304991136246,TPESampler,COMPLETE
1987,0.24026256388064463,2025-04-24 22:37:08.595866,2025-04-24 22:37:11.607820,0 days 00:00:03.011954,0.05555349013124739,12,sqrt,1,13,1293,0.8442731961833669,TPESampler,COMPLETE
1988,0.4036343389592613,2025-04-24 22:37:09.378296,2025-04-24 22:37:11.720035,0 days 00:00:02.341739,0.029453624320145876,4,,8,3,506,0.6548452687808031,TPESampler,COMPLETE
1989,0.2641056049932162,2025-04-24 22:37:10.380804,2025-04-24 22:37:19.058820,0 days 00:00:08.678016,0.09624815579547868,12,,1,18,1125,0.8517039500317316,TPESampler,COMPLETE
1990,0.26545667021144254,2025-04-24 22:37:11.803296,2025-04-24 22:37:14.654347,0 days 00:00:02.851051,0.09478094779392568,12,sqrt,2,13,1312,0.9089702385331592,TPESampler,COMPLETE
1991,0.26367833519058614,2025-04-24 22:37:11.933637,2025-04-24 22:37:15.059626,0 days 00:00:03.125989,0.07963483555276606,12,sqrt,3,16,1459,0.8820280820340461,TPESampler,COMPLETE
1992,0.24132551749069936,2025-04-24 22:37:14.850766,2025-04-24 22:37:17.461794,0 days 00:00:02.611028,0.07770611248601772,12,sqrt,1,18,1268,0.8607845223380343,TPESampler,COMPLETE
1993,0.26880608550596574,2025-04-24 22:37:15.320835,2025-04-24 22:37:17.805449,0 days 00:00:02.484614,0.08872032513072337,12,sqrt,3,17,1187,0.8307538712059799,TPESampler,COMPLETE
1994,0.23902847060222937,2025-04-24 22:37:17.661617,2025-04-24 22:37:20.801079,0 days 00:00:03.139462,0.08353287350008089,12,sqrt,1,18,1317,0.8436245173647622,TPESampler,COMPLETE
1995,0.2451872297150665,2025-04-24 22:37:18.076913,2025-04-24 22:37:21.355748,0 days 00:00:03.278835,0.06960269804214966,12,sqrt,1,17,1289,0.8565527658836043,TPESampler,COMPLETE
1996,0.23811130041129747,2025-04-24 22:37:19.265317,2025-04-24 22:37:22.961119,0 days 00:00:03.695802,0.061286628564190836,12,sqrt,1,20,1333,0.870034693586901,TPESampler,COMPLETE
1997,0.22896921212332044,2025-04-24 22:37:21.004207,2025-04-24 22:37:24.823706,0 days 00:00:03.819499,0.08359481087992938,12,sqrt,1,18,1440,0.9213830001049372,TPESampler,COMPLETE
1998,0.24286215450828327,2025-04-24 22:37:21.581001,2025-04-24 22:37:24.571995,0 days 00:00:02.990994,0.09671595376929668,12,sqrt,2,16,1095,0.8206670656537899,TPESampler,COMPLETE
1999,0.25801856263264117,2025-04-24 22:37:23.176214,2025-04-24 22:37:26.631811,0 days 00:00:03.455597,0.0982048944748604,12,sqrt,3,13,1475,0.9999976019734759,TPESampler,COMPLETE
2000,0.28623717374845653,2025-04-24 22:37:24.777857,2025-04-24 22:37:27.621934,0 days 00:00:02.844077,0.0470338860790006,12,log2,1,20,1479,0.7643775458323604,TPESampler,COMPLETE
2001,0.35457674501919895,2025-04-24 22:37:25.126577,2025-04-24 22:37:27.837575,0 days 00:00:02.710998,0.03358827847345787,8,,7,4,344,0.985940655191586,TPESampler,COMPLETE
2002,0.3159883980562385,2025-04-24 22:37:26.834733,2025-04-24 22:37:36.602426,0 days 00:00:09.767693,0.06254037456841494,12,,2,17,1476,0.8341077299131783,TPESampler,COMPLETE
2003,0.24099787530372557,2025-04-24 22:37:27.804892,2025-04-24 22:37:30.316995,0 days 00:00:02.512103,0.0929205636551526,11,sqrt,1,16,1485,0.8904098010927722,TPESampler,COMPLETE
2004,0.3750025610311132,2025-04-24 22:37:28.021095,2025-04-24 22:37:35.304362,0 days 00:00:07.283267,0.03414359115238755,12,,9,19,1209,0.8524594633129164,TPESampler,COMPLETE
2005,0.2646762876213395,2025-04-24 22:37:30.497896,2025-04-24 22:37:32.816097,0 days 00:00:02.318201,0.09086379355308141,12,sqrt,2,18,1407,0.827400952196712,TPESampler,COMPLETE
2006,0.24105408275271947,2025-04-24 22:37:33.020869,2025-04-24 22:37:34.799590,0 days 00:00:01.778721,0.09411307458045658,12,sqrt,1,20,959,0.7506651877393624,TPESampler,COMPLETE
2007,0.34674356359652514,2025-04-24 22:37:34.997449,2025-04-24 22:37:37.531689,0 days 00:00:02.534240,0.031861691456088484,5,log2,1,2,1498,0.84956034178848,TPESampler,COMPLETE
2008,0.2908742745414906,2025-04-24 22:37:35.529185,2025-04-24 22:37:39.360677,0 days 00:00:03.831492,0.041824658207380724,9,,2,19,677,0.6010201880409697,TPESampler,COMPLETE
2009,0.26631790674777706,2025-04-24 22:37:36.830980,2025-04-24 22:37:39.612727,0 days 00:00:02.781747,0.09593259061551816,11,sqrt,3,20,1227,0.7979889696628557,TPESampler,COMPLETE
2010,0.6956387985448286,2025-04-24 22:37:37.731073,2025-04-24 22:37:38.662025,0 days 00:00:00.930952,0.012198069310153235,11,log2,3,4,149,0.7778020126241203,TPESampler,COMPLETE
2011,0.23515418644016217,2025-04-24 22:37:38.858748,2025-04-24 22:37:42.511649,0 days 00:00:03.652901,0.07231204665381619,12,sqrt,1,15,1407,0.8802641069028907,TPESampler,COMPLETE
2012,0.25514384254887973,2025-04-24 22:37:39.559864,2025-04-24 22:37:43.258965,0 days 00:00:03.699101,0.09703701381018248,12,sqrt,1,13,1458,0.8921886987151465,TPESampler,COMPLETE
2013,0.2586756902369287,2025-04-24 22:37:39.912486,2025-04-24 22:37:43.364672,0 days 00:00:03.452186,0.09689150924508023,12,sqrt,2,16,1369,0.8360994043532997,TPESampler,COMPLETE
2014,0.25832478061935615,2025-04-24 22:37:42.874675,2025-04-24 22:37:45.487101,0 days 00:00:02.612426,0.08860197711010384,12,sqrt,3,15,1207,0.9005299417944697,TPESampler,COMPLETE
2015,0.3853351607284874,2025-04-24 22:37:43.602608,2025-04-24 22:37:48.111092,0 days 00:00:04.508484,0.016019844680508207,11,,9,3,601,0.7303002861932387,TPESampler,COMPLETE
2016,0.2699570925615993,2025-04-24 22:37:43.686038,2025-04-24 22:37:47.307820,0 days 00:00:03.621782,0.08342263971856737,12,sqrt,4,17,1460,0.9687158743046382,TPESampler,COMPLETE
2017,0.24727367177415085,2025-04-24 22:37:45.861114,2025-04-24 22:37:49.318601,0 days 00:00:03.457487,0.05008079180237894,12,sqrt,1,16,1009,0.7055175461379974,TPESampler,COMPLETE
2018,0.2436745296983587,2025-04-24 22:37:47.673255,2025-04-24 22:37:51.302545,0 days 00:00:03.629290,0.09768628917015781,11,sqrt,1,16,1442,0.82214092014222,TPESampler,COMPLETE
2019,0.25243084894706064,2025-04-24 22:37:48.533508,2025-04-24 22:37:51.817617,0 days 00:00:03.284109,0.09172566226099542,12,sqrt,1,15,1251,0.8135517707271904,TPESampler,COMPLETE
2020,0.2585759324456126,2025-04-24 22:37:49.834161,2025-04-24 22:37:53.340659,0 days 00:00:03.506498,0.09541692609300537,12,sqrt,2,19,1348,0.8935627750494546,TPESampler,COMPLETE
2021,0.36736763659235927,2025-04-24 22:37:51.679121,2025-04-24 22:37:54.002303,0 days 00:00:02.323182,0.0868392179484772,3,log2,5,19,932,0.7600904595097793,TPESampler,COMPLETE
2022,0.2524788542047654,2025-04-24 22:37:52.187393,2025-04-24 22:37:56.226587,0 days 00:00:04.039194,0.08151428617237054,12,sqrt,2,14,1480,0.9058692158937008,TPESampler,COMPLETE
2023,0.2407417030164876,2025-04-24 22:37:53.768641,2025-04-24 22:37:57.162239,0 days 00:00:03.393598,0.0616589820908967,11,sqrt,1,13,1404,0.9344627798837857,TPESampler,COMPLETE
2024,0.2323441854916418,2025-04-24 22:37:54.236607,2025-04-24 22:37:57.856865,0 days 00:00:03.620258,0.08873974584661025,12,sqrt,1,13,1493,0.9591895332910175,TPESampler,COMPLETE
2025,0.2621500513519713,2025-04-24 22:37:56.728369,2025-04-24 22:38:00.467557,0 days 00:00:03.739188,0.02867811020099928,9,sqrt,1,13,1484,0.8273921893743624,TPESampler,COMPLETE
2026,0.24430832590166232,2025-04-24 22:37:57.396038,2025-04-24 22:38:01.000371,0 days 00:00:03.604333,0.07375796139674871,11,sqrt,1,14,1427,0.8555716343851302,TPESampler,COMPLETE
2027,0.26077495861282907,2025-04-24 22:37:58.065390,2025-04-24 22:38:01.772213,0 days 00:00:03.706823,0.07764129675369531,12,sqrt,2,18,1386,0.9220300451025424,TPESampler,COMPLETE
2028,0.2593754954900722,2025-04-24 22:38:00.671468,2025-04-24 22:38:03.510307,0 days 00:00:02.838839,0.08542594932651483,10,log2,1,20,1072,0.8073142324201411,TPESampler,COMPLETE
2029,0.5547205437278598,2025-04-24 22:38:01.245269,2025-04-24 22:38:03.426372,0 days 00:00:02.181103,0.02417792676378013,12,log2,9,18,779,0.7110539402525051,TPESampler,COMPLETE
2030,0.24995724698883115,2025-04-24 22:38:01.978976,2025-04-24 22:38:05.336023,0 days 00:00:03.357047,0.09427200976011793,12,sqrt,1,14,1281,0.879313435814405,TPESampler,COMPLETE
2031,0.406103006121708,2025-04-24 22:38:03.600535,2025-04-24 22:38:06.329212,0 days 00:00:02.728677,0.08511760393153474,3,,10,5,587,0.7907042945156029,TPESampler,COMPLETE
2032,0.2519746694833617,2025-04-24 22:38:03.722865,2025-04-24 22:38:06.949127,0 days 00:00:03.226262,0.06033447297597281,12,sqrt,2,20,1276,0.7378028754472722,TPESampler,COMPLETE
2033,0.34785678912078394,2025-04-24 22:38:05.535985,2025-04-24 22:38:07.865540,0 days 00:00:02.329555,0.032728727766180556,11,log2,4,17,1068,0.8402506143679086,TPESampler,COMPLETE
2034,0.39179139729496504,2025-04-24 22:38:06.573552,2025-04-24 22:38:07.928339,0 days 00:00:01.354787,0.06059419645184011,3,,5,11,172,0.6887386510699175,TPESampler,COMPLETE
2035,0.24189810000590262,2025-04-24 22:38:07.164882,2025-04-24 22:38:10.472994,0 days 00:00:03.308112,0.06697657787604727,12,sqrt,1,15,1241,0.8451088732199096,TPESampler,COMPLETE
2036,0.26318333868594923,2025-04-24 22:38:08.014567,2025-04-24 22:38:11.677291,0 days 00:00:03.662724,0.05499696696595105,11,sqrt,3,15,1499,0.8804233061066378,TPESampler,COMPLETE
2037,0.2369526647202677,2025-04-24 22:38:08.132884,2025-04-24 22:38:11.678764,0 days 00:00:03.545880,0.07860773646326923,11,sqrt,1,20,1375,0.777697168001156,TPESampler,COMPLETE
2038,0.25812338750987085,2025-04-24 22:38:10.671442,2025-04-24 22:38:14.045024,0 days 00:00:03.373582,0.03232837434469799,12,sqrt,1,20,1315,0.8579498525151426,TPESampler,COMPLETE
2039,0.23994549676649496,2025-04-24 22:38:11.841568,2025-04-24 22:38:15.354548,0 days 00:00:03.512980,0.09753766095336502,11,sqrt,1,17,1363,0.8395876287491936,TPESampler,COMPLETE
2040,0.2345187785003856,2025-04-24 22:38:11.893315,2025-04-24 22:38:15.409051,0 days 00:00:03.515736,0.08473135454376746,12,sqrt,1,16,1347,0.8637111978491733,TPESampler,COMPLETE
2041,0.26076106143577993,2025-04-24 22:38:14.239367,2025-04-24 22:38:17.377581,0 days 00:00:03.138214,0.09442542755049685,12,sqrt,3,19,1257,0.7986335492287961,TPESampler,COMPLETE
2042,0.31330467215311186,2025-04-24 22:38:15.544948,2025-04-24 22:38:18.990566,0 days 00:00:03.445618,0.05195897057308819,8,,5,5,543,0.7442501427506805,TPESampler,COMPLETE
2043,0.23325823799519294,2025-04-24 22:38:15.593188,2025-04-24 22:38:19.038430,0 days 00:00:03.445242,0.09892946869469536,12,sqrt,1,20,1500,0.9141428257758324,TPESampler,COMPLETE
2044,0.23121619486080133,2025-04-24 22:38:17.581391,2025-04-24 22:38:21.441607,0 days 00:00:03.860216,0.0959225810486503,12,sqrt,1,20,1441,0.7756906899463533,TPESampler,COMPLETE
2045,0.24164296961919057,2025-04-24 22:38:19.148690,2025-04-24 22:38:23.215000,0 days 00:00:04.066310,0.05462199009370538,12,sqrt,1,20,1470,0.8253458522290237,TPESampler,COMPLETE
2046,0.6778118557872941,2025-04-24 22:38:19.268139,2025-04-24 22:38:21.644778,0 days 00:00:02.376639,0.011493217568356336,3,log2,10,7,863,0.7785837158625676,TPESampler,COMPLETE
2047,0.24034720972633142,2025-04-24 22:38:21.686713,2025-04-24 22:38:24.831219,0 days 00:00:03.144506,0.09338979907450405,12,sqrt,1,20,1117,0.8881372492767369,TPESampler,COMPLETE
2048,0.744838092155505,2025-04-24 22:38:21.926839,2025-04-24 22:38:23.193843,0 days 00:00:01.267004,0.01875436640871684,7,log2,10,6,276,0.7735543156544602,TPESampler,COMPLETE
2049,0.23928163701312893,2025-04-24 22:38:23.350692,2025-04-24 22:38:26.207397,0 days 00:00:02.856705,0.09965720108400221,12,sqrt,1,18,1042,0.8124302140275944,TPESampler,COMPLETE
2050,0.26542002345961646,2025-04-24 22:38:23.390047,2025-04-24 22:38:26.378104,0 days 00:00:02.988057,0.09745849823233245,9,sqrt,3,20,1161,0.8667370590391518,TPESampler,COMPLETE
2051,0.2769146205635851,2025-04-24 22:38:25.046999,2025-04-24 22:38:34.545427,0 days 00:00:09.498428,0.06792245300392209,10,,1,13,1451,0.8687366968232413,TPESampler,COMPLETE
2052,0.29351308996982745,2025-04-24 22:38:26.376577,2025-04-24 22:38:32.338525,0 days 00:00:05.961948,0.027603249286994782,9,,3,4,1259,0.6250437623199017,TPESampler,COMPLETE
2053,0.25436496361463046,2025-04-24 22:38:26.612963,2025-04-24 22:38:28.759198,0 days 00:00:02.146235,0.08045235613729766,12,sqrt,2,12,1087,0.9850868052842192,TPESampler,COMPLETE
2054,0.23916618502726558,2025-04-24 22:38:28.946747,2025-04-24 22:38:31.196192,0 days 00:00:02.249445,0.04626174490625365,10,sqrt,1,11,1261,0.9302725673960127,TPESampler,COMPLETE
2055,0.26189587995231983,2025-04-24 22:38:31.398456,2025-04-24 22:38:33.935500,0 days 00:00:02.537044,0.09616093816047981,12,sqrt,2,17,1220,0.9079847781129984,TPESampler,COMPLETE
2056,0.4022393770825136,2025-04-24 22:38:32.530475,2025-04-24 22:38:34.056122,0 days 00:00:01.525647,0.05589932519896638,5,,9,2,264,0.8424915489189259,TPESampler,COMPLETE
2057,0.26991839878208257,2025-04-24 22:38:34.120029,2025-04-24 22:38:36.412885,0 days 00:00:02.292856,0.07151949962944465,10,sqrt,3,20,962,0.871507223589517,TPESampler,COMPLETE
2058,0.277270088069946,2025-04-24 22:38:34.269169,2025-04-24 22:38:44.790694,0 days 00:00:10.521525,0.09594224651544969,12,,1,20,1365,0.8392580381823435,TPESampler,COMPLETE
2059,0.2555317357301889,2025-04-24 22:38:34.871187,2025-04-24 22:38:37.794438,0 days 00:00:02.923251,0.07416399084691237,12,sqrt,2,17,1460,0.8478244273499401,TPESampler,COMPLETE
2060,0.3280830641657772,2025-04-24 22:38:36.611474,2025-04-24 22:38:39.337061,0 days 00:00:02.725587,0.0924770252954557,12,sqrt,7,5,1438,0.93162095349993,TPESampler,COMPLETE
2061,0.3641992816095578,2025-04-24 22:38:37.988006,2025-04-24 22:38:39.850690,0 days 00:00:01.862684,0.018013110052926398,8,log2,1,11,888,0.8398002932621246,TPESampler,COMPLETE
2062,0.2712893160566219,2025-04-24 22:38:39.542294,2025-04-24 22:38:41.459858,0 days 00:00:01.917564,0.08134445043194637,12,sqrt,3,15,807,0.9471558860540186,TPESampler,COMPLETE
2063,0.31219689878246937,2025-04-24 22:38:40.081944,2025-04-24 22:38:44.215417,0 days 00:00:04.133473,0.03975927491126459,3,,4,2,1368,0.6514750776048124,TPESampler,COMPLETE
2064,0.4710842169251285,2025-04-24 22:38:41.678246,2025-04-24 22:38:42.632864,0 days 00:00:00.954618,0.08584657384392815,11,log2,6,2,272,0.6092651515923142,TPESampler,COMPLETE
2065,0.30566428265994305,2025-04-24 22:38:42.828737,2025-04-24 22:38:44.638657,0 days 00:00:01.809920,0.04749035128697495,12,log2,3,12,1035,0.8171944431848776,TPESampler,COMPLETE
2066,0.2604540325484021,2025-04-24 22:38:44.434496,2025-04-24 22:38:48.303465,0 days 00:00:03.868969,0.09919852963277494,12,sqrt,3,18,1481,0.8855094061849623,TPESampler,COMPLETE
2067,0.2731860484621369,2025-04-24 22:38:44.892577,2025-04-24 22:38:48.198978,0 days 00:00:03.306401,0.09625444376159993,12,log2,2,20,1263,0.7109745054393006,TPESampler,COMPLETE
2068,0.4535254120416099,2025-04-24 22:38:45.052141,2025-04-24 22:38:47.022730,0 days 00:00:01.970589,0.03276565377068568,4,sqrt,10,5,565,0.9865972841435339,TPESampler,COMPLETE
2069,0.2983333676787529,2025-04-24 22:38:47.229002,2025-04-24 22:38:50.629711,0 days 00:00:03.400709,0.08139430964590398,11,log2,3,14,1365,0.8833071512843971,TPESampler,COMPLETE
2070,0.2663487740453575,2025-04-24 22:38:48.370729,2025-04-24 22:38:51.863298,0 days 00:00:03.492569,0.08650324897392483,12,sqrt,1,19,1267,0.8246424546108815,TPESampler,COMPLETE
2071,0.24650334101030208,2025-04-24 22:38:48.449886,2025-04-24 22:38:52.119120,0 days 00:00:03.669234,0.08371322761111841,11,sqrt,1,20,1348,0.8197895317647408,TPESampler,COMPLETE
2072,0.24080259280823685,2025-04-24 22:38:50.840555,2025-04-24 22:38:54.536390,0 days 00:00:03.695835,0.060436825424438775,12,sqrt,1,16,1420,0.8992698193567118,TPESampler,COMPLETE
2073,0.3259066594481186,2025-04-24 22:38:52.074959,2025-04-24 22:38:55.417962,0 days 00:00:03.343003,0.057483371274069286,12,sqrt,6,19,1305,0.8147185701146423,TPESampler,COMPLETE
2074,0.2454074263400753,2025-04-24 22:38:52.443694,2025-04-24 22:38:55.501685,0 days 00:00:03.057991,0.0722143028839017,12,sqrt,1,13,1085,0.9136292889311145,TPESampler,COMPLETE
2075,0.24611179448034015,2025-04-24 22:38:54.739048,2025-04-24 22:38:58.032189,0 days 00:00:03.293141,0.047524192936150414,10,sqrt,1,14,1257,0.7623937545445995,TPESampler,COMPLETE
2076,0.23845259457618156,2025-04-24 22:38:55.621749,2025-04-24 22:38:59.654314,0 days 00:00:04.032565,0.06403686953922341,10,sqrt,1,17,1495,0.8253734733895681,TPESampler,COMPLETE
2077,0.23609016570758398,2025-04-24 22:38:55.761136,2025-04-24 22:38:59.347364,0 days 00:00:03.586228,0.09735184344244502,12,sqrt,1,13,1287,0.8244742353570911,TPESampler,COMPLETE
2078,0.2585448382058364,2025-04-24 22:38:58.234931,2025-04-24 22:39:01.460444,0 days 00:00:03.225513,0.09879531029446668,12,sqrt,2,17,1201,0.7614602652586944,TPESampler,COMPLETE
2079,0.3423955763260615,2025-04-24 22:38:59.571860,2025-04-24 22:39:02.687772,0 days 00:00:03.115912,0.05667037122368223,12,sqrt,6,9,1312,0.6142195150659454,TPESampler,COMPLETE
2080,0.24181216217247897,2025-04-24 22:38:59.943209,2025-04-24 22:39:03.468406,0 days 00:00:03.525197,0.08398511572643096,12,sqrt,1,15,1308,0.8841257712198727,TPESampler,COMPLETE
2081,0.2680440528585047,2025-04-24 22:39:01.670538,2025-04-24 22:39:04.371737,0 days 00:00:02.701199,0.05924556183292639,12,sqrt,3,8,980,0.8985812672585304,TPESampler,COMPLETE
2082,0.250913495617809,2025-04-24 22:39:02.915879,2025-04-24 22:39:06.052362,0 days 00:00:03.136483,0.07325127320262641,10,sqrt,1,11,1452,0.8106489403677714,TPESampler,COMPLETE
2083,0.2761288829411721,2025-04-24 22:39:03.672633,2025-04-24 22:39:14.945486,0 days 00:00:11.272853,0.07730669917672907,12,,1,14,1313,0.948374601176818,TPESampler,COMPLETE
2084,0.2630224773447086,2025-04-24 22:39:04.585443,2025-04-24 22:39:06.589378,0 days 00:00:02.003935,0.0908657048435625,11,sqrt,3,20,901,0.8120790548808249,TPESampler,COMPLETE
2085,0.2674327953592514,2025-04-24 22:39:06.269153,2025-04-24 22:39:08.774040,0 days 00:00:02.504887,0.0961960191605589,11,sqrt,3,20,1219,0.9466880200631991,TPESampler,COMPLETE
