number,value,datetime_start,datetime_complete,duration,params_learning_rate,params_max_depth,params_max_features,params_min_samples_leaf,params_min_samples_split,params_n_estimators,params_subsample,system_attrs_auto:sampler,state
2086,0.2535968674639305,2025-04-24 22:39:06.836221,2025-04-24 22:39:09.774420,0 days 00:00:02.938199,0.09393881763592414,11,sqrt,2,20,1500,0.8581314143466163,TPESampler,COMPLETE
2087,0.26232529719968745,2025-04-24 22:39:08.983824,2025-04-24 22:39:11.542817,0 days 00:00:02.558993,0.06978975261722445,12,sqrt,3,10,1255,0.8127843002383051,TPESampler,COMPLETE
2088,0.23445470752694145,2025-04-24 22:39:09.977886,2025-04-24 22:39:13.029009,0 days 00:00:03.051123,0.06432501265996059,12,sqrt,1,13,1495,0.9026501875346146,TPESampler,COMPLETE
2089,0.5413847614403405,2025-04-24 22:39:11.754411,2025-04-24 22:39:13.967377,0 days 00:00:02.212966,0.015728641938386044,5,log2,9,5,1190,0.8467035195173956,TPESampler,COMPLETE
2090,0.2589141584691497,2025-04-24 22:39:13.227344,2025-04-24 22:39:16.814549,0 days 00:00:03.587205,0.0906414149389584,11,sqrt,2,15,1479,0.8868661258266253,TPESampler,COMPLETE
2091,0.2597138468382395,2025-04-24 22:39:14.174285,2025-04-24 22:39:16.903492,0 days 00:00:02.729207,0.09117049553714178,12,sqrt,2,20,1101,0.8470407165354282,TPESampler,COMPLETE
2092,0.22687027911591817,2025-04-24 22:39:15.139469,2025-04-24 22:39:18.362284,0 days 00:00:03.222815,0.0941646062820268,12,sqrt,1,19,1151,0.8223813675598958,TPESampler,COMPLETE
2093,0.24126772865661575,2025-04-24 22:39:16.989622,2025-04-24 22:39:20.609461,0 days 00:00:03.619839,0.09384731714755608,11,sqrt,1,14,1442,0.904156538593019,TPESampler,COMPLETE
2094,0.23997868929308347,2025-04-24 22:39:17.117404,2025-04-24 22:39:20.513149,0 days 00:00:03.395745,0.09964286750931313,11,sqrt,1,19,1207,0.8399636157884834,TPESampler,COMPLETE
2095,0.26021376597740464,2025-04-24 22:39:18.572945,2025-04-24 22:39:21.867365,0 days 00:00:03.294420,0.0864786078721078,12,sqrt,2,20,1296,0.800977027956055,TPESampler,COMPLETE
2096,0.24338709721733004,2025-04-24 22:39:20.699059,2025-04-24 22:39:23.591239,0 days 00:00:02.892180,0.08848687397289134,11,sqrt,1,20,1047,0.7993280641010369,TPESampler,COMPLETE
2097,0.8789990205542779,2025-04-24 22:39:20.816226,2025-04-24 22:39:21.959935,0 days 00:00:01.143709,0.010195068704273086,11,log2,10,17,110,0.6136767358223576,TPESampler,COMPLETE
2098,0.2618950802273702,2025-04-24 22:39:22.029995,2025-04-24 22:39:25.247611,0 days 00:00:03.217616,0.09225877450625765,12,sqrt,2,18,1496,0.85719542526723,TPESampler,COMPLETE
2099,0.2928613517963081,2025-04-24 22:39:22.167075,2025-04-24 22:39:27.973726,0 days 00:00:05.806651,0.07095280494281897,12,,2,13,788,0.7774782951734578,TPESampler,COMPLETE
2100,0.267679006316924,2025-04-24 22:39:23.789440,2025-04-24 22:39:26.731464,0 days 00:00:02.942024,0.09590771463970751,12,sqrt,3,17,1494,0.8140290979008704,TPESampler,COMPLETE
2101,0.25022300421103966,2025-04-24 22:39:25.449203,2025-04-24 22:39:27.923608,0 days 00:00:02.474405,0.06859550680857084,12,sqrt,1,20,1142,0.8516239094176183,TPESampler,COMPLETE
2102,0.26073212807410495,2025-04-24 22:39:26.931498,2025-04-24 22:39:29.842850,0 days 00:00:02.911352,0.06415285585648867,12,sqrt,1,17,1214,0.8498250454152767,TPESampler,COMPLETE
2103,0.3372154056581272,2025-04-24 22:39:28.083080,2025-04-24 22:39:34.280299,0 days 00:00:06.197219,0.010283456302703466,5,,2,3,1294,0.8150951821847383,TPESampler,COMPLETE
2104,0.28134545030452657,2025-04-24 22:39:28.125841,2025-04-24 22:39:30.497132,0 days 00:00:02.371291,0.09788932743925428,12,log2,2,12,1041,0.8208849253591797,TPESampler,COMPLETE
2105,0.37722622232564823,2025-04-24 22:39:30.110763,2025-04-24 22:39:32.174769,0 days 00:00:02.064006,0.05531392177092023,8,sqrt,8,2,859,0.9541952198142196,TPESampler,COMPLETE
2106,0.26440935472840826,2025-04-24 22:39:30.731499,2025-04-24 22:39:32.935789,0 days 00:00:02.204290,0.06794421633115913,12,sqrt,3,18,865,0.8659320095637019,TPESampler,COMPLETE
2107,0.23336278723985557,2025-04-24 22:39:32.377787,2025-04-24 22:39:35.411950,0 days 00:00:03.034163,0.09428253455262368,10,sqrt,1,17,1444,0.7871282822865684,TPESampler,COMPLETE
2108,0.3496637269879548,2025-04-24 22:39:33.145930,2025-04-24 22:39:36.701926,0 days 00:00:03.555996,0.034692750333947815,5,,7,16,790,0.7278123068033635,TPESampler,COMPLETE
2109,0.23952206840016949,2025-04-24 22:39:34.496067,2025-04-24 22:39:38.205061,0 days 00:00:03.708994,0.0828545238614538,12,sqrt,1,16,1486,0.870547329262124,TPESampler,COMPLETE
2110,0.46457628793794303,2025-04-24 22:39:35.622637,2025-04-24 22:39:36.596373,0 days 00:00:00.973736,0.06405457664318415,10,sqrt,10,18,166,0.7581530897593106,TPESampler,COMPLETE
2111,0.25121756854009303,2025-04-24 22:39:36.773221,2025-04-24 22:39:39.884064,0 days 00:00:03.110843,0.09774644746474354,12,sqrt,2,16,1168,0.9130648681305442,TPESampler,COMPLETE
2112,0.45061716306715077,2025-04-24 22:39:36.904275,2025-04-24 22:39:39.583323,0 days 00:00:02.679048,0.04040181266167709,11,log2,8,4,1106,0.8218874056095222,TPESampler,COMPLETE
2113,0.31422547714674914,2025-04-24 22:39:38.424761,2025-04-24 22:39:46.768079,0 days 00:00:08.343318,0.05532946119290631,12,,4,9,1241,0.7621877356268938,TPESampler,COMPLETE
2114,0.2639741894747141,2025-04-24 22:39:39.802663,2025-04-24 22:39:42.389939,0 days 00:00:02.587276,0.09450478277420521,12,sqrt,2,19,1209,0.7684987561489234,TPESampler,COMPLETE
2115,0.2429855116312565,2025-04-24 22:39:40.207013,2025-04-24 22:39:43.300372,0 days 00:00:03.093359,0.09495019388075014,12,sqrt,1,20,1494,0.8362587008592247,TPESampler,COMPLETE
2116,0.4439258617489309,2025-04-24 22:39:42.605301,2025-04-24 22:39:44.878598,0 days 00:00:02.273297,0.01140057149872597,5,sqrt,9,3,1144,0.9619225156587682,TPESampler,COMPLETE
2117,0.2421782378390893,2025-04-24 22:39:43.510282,2025-04-24 22:39:45.959410,0 days 00:00:02.449128,0.07898578545583447,12,sqrt,1,18,1069,0.7465662919957134,TPESampler,COMPLETE
2118,0.26540080346271056,2025-04-24 22:39:45.081670,2025-04-24 22:39:52.519283,0 days 00:00:07.437613,0.06168245363280754,10,,1,16,1082,0.8600681821477867,TPESampler,COMPLETE
2119,0.23189376264458228,2025-04-24 22:39:46.153241,2025-04-24 22:39:48.816980,0 days 00:00:02.663739,0.09065726409672291,11,sqrt,1,18,1287,0.8248357248605372,TPESampler,COMPLETE
2120,0.24147826372024722,2025-04-24 22:39:46.981395,2025-04-24 22:39:49.660095,0 days 00:00:02.678700,0.09650010632433735,12,sqrt,1,19,1292,0.7605498006509173,TPESampler,COMPLETE
2121,0.2698338203205909,2025-04-24 22:39:49.008315,2025-04-24 22:39:51.764698,0 days 00:00:02.756383,0.07231913064546404,10,sqrt,3,12,1369,0.9282044269723528,TPESampler,COMPLETE
2122,0.25012158960185515,2025-04-24 22:39:49.880112,2025-04-24 22:39:52.171513,0 days 00:00:02.291401,0.09932046619105045,11,sqrt,1,20,1115,0.8160146809637138,TPESampler,COMPLETE
2123,0.2701807135614946,2025-04-24 22:39:51.966780,2025-04-24 22:39:55.227716,0 days 00:00:03.260936,0.05942525462998828,10,sqrt,3,15,1279,0.8379891894163678,TPESampler,COMPLETE
2124,0.2731598778888662,2025-04-24 22:39:52.434130,2025-04-24 22:39:55.759834,0 days 00:00:03.325704,0.050862518699467285,12,log2,1,15,1332,0.8897165281064054,TPESampler,COMPLETE
2125,0.39629541663778667,2025-04-24 22:39:52.838403,2025-04-24 22:39:54.111094,0 days 00:00:01.272691,0.017046267848255164,12,sqrt,2,19,227,0.8099241952461402,TPESampler,COMPLETE
2126,0.48459162806639816,2025-04-24 22:39:54.316272,2025-04-24 22:39:57.394524,0 days 00:00:03.078252,0.03181232072607518,11,log2,10,15,1317,0.8430973684107783,TPESampler,COMPLETE
2127,0.2345039214291157,2025-04-24 22:39:55.453992,2025-04-24 22:39:59.029310,0 days 00:00:03.575318,0.08965768538077007,12,sqrt,1,14,1258,0.7586020226949604,TPESampler,COMPLETE
2128,0.3970698409863812,2025-04-24 22:39:56.003776,2025-04-24 22:39:58.136406,0 days 00:00:02.132630,0.07728819613564938,4,log2,6,10,712,0.7564106558190957,TPESampler,COMPLETE
2129,0.3129672782127868,2025-04-24 22:39:57.617561,2025-04-24 22:39:58.809130,0 days 00:00:01.191569,0.07445461553474093,10,sqrt,1,8,166,0.9744793449839889,TPESampler,COMPLETE
2130,0.24498656151920625,2025-04-24 22:39:58.347680,2025-04-24 22:40:02.074044,0 days 00:00:03.726364,0.055069000307590044,10,sqrt,1,18,1377,0.8708845296618848,TPESampler,COMPLETE
2131,0.25316512448623213,2025-04-24 22:39:59.058759,2025-04-24 22:40:02.007962,0 days 00:00:02.949203,0.06534430039191623,11,sqrt,1,15,1094,0.9299689606647721,TPESampler,COMPLETE
2132,0.2753733239354342,2025-04-24 22:39:59.291102,2025-04-24 22:40:02.491536,0 days 00:00:03.200434,0.09639673097822846,12,log2,2,8,1336,0.8723294480600845,TPESampler,COMPLETE
2133,0.2704110730202971,2025-04-24 22:40:02.181530,2025-04-24 22:40:05.555765,0 days 00:00:03.374235,0.060487181463433154,12,sqrt,2,20,991,0.8344098319412748,TPESampler,COMPLETE
2134,0.5911894397103679,2025-04-24 22:40:02.328924,2025-04-24 22:40:05.706300,0 days 00:00:03.377376,0.010374669602506568,7,log2,8,9,1454,0.6979052730900542,TPESampler,COMPLETE
2135,0.2975513628717659,2025-04-24 22:40:02.881654,2025-04-24 22:40:06.658729,0 days 00:00:03.777075,0.09790933426935637,11,sqrt,5,20,1391,0.762486445071631,TPESampler,COMPLETE
2136,0.24252769950688968,2025-04-24 22:40:05.757313,2025-04-24 22:40:09.597182,0 days 00:00:03.839869,0.06288864147989748,11,sqrt,1,18,1491,0.9380463583186641,TPESampler,COMPLETE
2137,0.2502885503572218,2025-04-24 22:40:05.941589,2025-04-24 22:40:09.749162,0 days 00:00:03.807573,0.09862056437575231,12,sqrt,3,14,1477,0.8201862541370981,TPESampler,COMPLETE
2138,0.2515433430835544,2025-04-24 22:40:06.900856,2025-04-24 22:40:09.835197,0 days 00:00:02.934341,0.058359723097164216,11,sqrt,1,17,1077,0.8333651625561113,TPESampler,COMPLETE
2139,0.2433395981008293,2025-04-24 22:40:09.798793,2025-04-24 22:40:13.969620,0 days 00:00:04.170827,0.05784249442749012,8,sqrt,1,12,1456,0.7804318991574352,TPESampler,COMPLETE
2140,0.3733544748350768,2025-04-24 22:40:09.975793,2025-04-24 22:40:13.069906,0 days 00:00:03.094113,0.07337509614322874,5,log2,6,20,931,0.9182684842870579,TPESampler,COMPLETE
2141,0.2427212388369805,2025-04-24 22:40:10.193068,2025-04-24 22:40:13.751092,0 days 00:00:03.558024,0.09932241181722229,12,sqrt,1,14,1021,0.8320139114436212,TPESampler,COMPLETE
2142,0.30036098275085404,2025-04-24 22:40:13.277375,2025-04-24 22:40:19.404931,0 days 00:00:06.127556,0.08875096482129087,11,,2,19,970,0.7448714568329304,TPESampler,COMPLETE
2143,0.24451573813530264,2025-04-24 22:40:13.989633,2025-04-24 22:40:16.848707,0 days 00:00:02.859074,0.09841985895782582,9,sqrt,1,18,1477,0.8799454144438671,TPESampler,COMPLETE
2144,0.24040810806542917,2025-04-24 22:40:14.181425,2025-04-24 22:40:16.838142,0 days 00:00:02.656717,0.09677782374010184,11,sqrt,1,19,1326,0.8900368112167197,TPESampler,COMPLETE
2145,0.2529164982343816,2025-04-24 22:40:17.003112,2025-04-24 22:40:19.432623,0 days 00:00:02.429511,0.09483796278800687,11,sqrt,2,20,1123,0.838876415075784,TPESampler,COMPLETE
2146,0.38236198414306444,2025-04-24 22:40:17.059174,2025-04-24 22:40:21.447956,0 days 00:00:04.388782,0.017686394291603146,3,,6,16,1126,0.8000650426600515,TPESampler,COMPLETE
2147,0.2899760127233745,2025-04-24 22:40:19.575276,2025-04-24 22:40:22.491962,0 days 00:00:02.916686,0.0812008746143638,5,,3,19,693,0.6274603058557631,TPESampler,COMPLETE
2148,0.25223245369833697,2025-04-24 22:40:19.621783,2025-04-24 22:40:22.389133,0 days 00:00:02.767350,0.06323949670011626,12,sqrt,1,9,1157,0.8900395920870404,TPESampler,COMPLETE
2149,0.23354421919214002,2025-04-24 22:40:21.715623,2025-04-24 22:40:24.666558,0 days 00:00:02.950935,0.08773676004270636,11,sqrt,1,20,1122,0.837874934953,TPESampler,COMPLETE
2150,0.35617682308562726,2025-04-24 22:40:22.611327,2025-04-24 22:40:24.260217,0 days 00:00:01.648890,0.04576027150736996,5,sqrt,2,3,381,0.7169059367357221,TPESampler,COMPLETE
2151,0.2672036469149567,2025-04-24 22:40:22.748324,2025-04-24 22:40:25.913391,0 days 00:00:03.165067,0.06251571333674134,12,sqrt,3,15,1116,0.8618017947233971,TPESampler,COMPLETE
2152,0.23438420690375725,2025-04-24 22:40:24.457590,2025-04-24 22:40:27.947534,0 days 00:00:03.489944,0.05773478897232826,12,sqrt,1,15,1382,0.8100985018110025,TPESampler,COMPLETE
2153,0.3998034090164341,2025-04-24 22:40:24.955290,2025-04-24 22:40:26.515447,0 days 00:00:01.560157,0.06341279628074656,7,,10,18,146,0.9362009680835276,TPESampler,COMPLETE
2154,0.23961757340490208,2025-04-24 22:40:26.119856,2025-04-24 22:40:29.796955,0 days 00:00:03.677099,0.05212099210175153,10,sqrt,1,15,1461,0.9164569654412329,TPESampler,COMPLETE
2155,0.2523907711649851,2025-04-24 22:40:26.757789,2025-04-24 22:40:29.380566,0 days 00:00:02.622777,0.07594232541045513,12,sqrt,1,20,895,0.6644211942195337,TPESampler,COMPLETE
2156,0.2418831928511214,2025-04-24 22:40:28.159191,2025-04-24 22:40:31.298899,0 days 00:00:03.139708,0.060043814746726924,12,sqrt,1,19,1170,0.7172460435479197,TPESampler,COMPLETE
2157,0.2451574334754948,2025-04-24 22:40:29.584280,2025-04-24 22:40:32.751751,0 days 00:00:03.167471,0.067280029967618,12,sqrt,1,15,1116,0.8708122679638491,TPESampler,COMPLETE
2158,0.3035015577319341,2025-04-24 22:40:30.193609,2025-04-24 22:40:32.780431,0 days 00:00:02.586822,0.08888559616049292,12,log2,3,17,935,0.8281457343959606,TPESampler,COMPLETE
2159,0.23540097357782278,2025-04-24 22:40:31.513240,2025-04-24 22:40:35.500044,0 days 00:00:03.986804,0.08788781583545968,11,sqrt,1,10,1500,0.8643293859188577,TPESampler,COMPLETE
2160,0.2380775974965087,2025-04-24 22:40:32.913441,2025-04-24 22:40:36.537951,0 days 00:00:03.624510,0.09442737209198154,12,sqrt,1,17,1385,0.8080965623105045,TPESampler,COMPLETE
2161,0.27782026988429825,2025-04-24 22:40:32.957851,2025-04-24 22:40:35.005848,0 days 00:00:02.047997,0.09431868864784776,10,sqrt,2,20,526,0.7012705585597225,TPESampler,COMPLETE
2162,0.26241287119506457,2025-04-24 22:40:35.335545,2025-04-24 22:40:39.132824,0 days 00:00:03.797279,0.09419638783594357,10,sqrt,3,15,1452,0.8039948063245843,TPESampler,COMPLETE
2163,0.2595371090657076,2025-04-24 22:40:35.841341,2025-04-24 22:40:39.377596,0 days 00:00:03.536255,0.09811393621307002,12,sqrt,3,18,1272,0.8777816651363087,TPESampler,COMPLETE
2164,0.48525481875306625,2025-04-24 22:40:36.759955,2025-04-24 22:40:39.383972,0 days 00:00:02.624017,0.010291058658957238,8,sqrt,9,5,1053,0.6250762682029072,TPESampler,COMPLETE
2165,0.25853522845690957,2025-04-24 22:40:39.346102,2025-04-24 22:40:42.241687,0 days 00:00:02.895585,0.08900811739384783,12,sqrt,1,20,1096,0.8186889778916112,TPESampler,COMPLETE
2166,0.41356359784456753,2025-04-24 22:40:39.695801,2025-04-24 22:40:41.452958,0 days 00:00:01.757157,0.02350753984497983,7,,9,10,206,0.7866972949049307,TPESampler,COMPLETE
2167,0.24444332468148725,2025-04-24 22:40:39.764315,2025-04-24 22:40:43.023173,0 days 00:00:03.258858,0.04319898308002589,11,sqrt,1,13,1191,0.7314169328469239,TPESampler,COMPLETE
2168,0.23665582455220988,2025-04-24 22:40:41.657669,2025-04-24 22:40:44.789981,0 days 00:00:03.132312,0.07806513153550952,12,sqrt,1,15,1169,0.8644651801797901,TPESampler,COMPLETE
2169,0.2579931686183876,2025-04-24 22:40:42.457514,2025-04-24 22:40:44.876952,0 days 00:00:02.419438,0.08437189659283116,11,sqrt,1,7,840,0.9630363417984699,TPESampler,COMPLETE
2170,0.22851176338345333,2025-04-24 22:40:43.236936,2025-04-24 22:40:46.781914,0 days 00:00:03.544978,0.09701945570597957,11,sqrt,1,15,1361,0.8908346378279239,TPESampler,COMPLETE
2171,0.2624520625185196,2025-04-24 22:40:44.969663,2025-04-24 22:40:48.354933,0 days 00:00:03.385270,0.07852748868851406,10,sqrt,3,13,1226,0.8720086973094165,TPESampler,COMPLETE
2172,0.27211240146416094,2025-04-24 22:40:45.114043,2025-04-24 22:40:48.717677,0 days 00:00:03.603634,0.0855670472208415,11,log2,1,15,1377,0.8846313413146817,TPESampler,COMPLETE
2173,0.268643960741849,2025-04-24 22:40:46.995713,2025-04-24 22:40:50.190685,0 days 00:00:03.194972,0.04950687001994992,11,sqrt,3,18,1172,0.8131757604563538,TPESampler,COMPLETE
2174,0.2685457135863395,2025-04-24 22:40:48.568476,2025-04-24 22:40:51.600070,0 days 00:00:03.031594,0.064795148670765,11,sqrt,3,20,1146,0.7765199973997664,TPESampler,COMPLETE
2175,0.2571047812403302,2025-04-24 22:40:48.981107,2025-04-24 22:40:52.470200,0 days 00:00:03.489093,0.06498188247638276,10,sqrt,2,20,1271,0.8676645872251342,TPESampler,COMPLETE
2176,0.34445099722491873,2025-04-24 22:40:50.389379,2025-04-24 22:40:53.104161,0 days 00:00:02.714782,0.07611503063611184,3,log2,1,15,1070,0.6360604326691942,TPESampler,COMPLETE
2177,0.4680234999540346,2025-04-24 22:40:51.813547,2025-04-24 22:40:53.661178,0 days 00:00:01.847631,0.0622784215235762,3,log2,8,10,575,0.9161305777085462,TPESampler,COMPLETE
2178,0.2409644777978933,2025-04-24 22:40:52.693988,2025-04-24 22:40:56.365538,0 days 00:00:03.671550,0.06803255877125904,9,sqrt,1,17,1434,0.9155360944170329,TPESampler,COMPLETE
2179,0.23981990409914394,2025-04-24 22:40:53.323389,2025-04-24 22:40:56.334002,0 days 00:00:03.010613,0.05954547427624071,12,sqrt,1,19,1121,0.8854222108586809,TPESampler,COMPLETE
2180,0.2550620992371171,2025-04-24 22:40:53.905620,2025-04-24 22:40:57.565640,0 days 00:00:03.660020,0.09574100787918471,12,sqrt,2,16,1423,0.9479308214072898,TPESampler,COMPLETE
2181,0.3026161631557167,2025-04-24 22:40:56.506288,2025-04-24 22:41:05.201851,0 days 00:00:08.695563,0.08162659675497744,12,,3,20,1201,0.8393727111556587,TPESampler,COMPLETE
2182,0.3409422275528164,2025-04-24 22:40:56.556807,2025-04-24 22:40:58.165845,0 days 00:00:01.609038,0.0977599273809629,4,sqrt,5,20,451,0.9872277194012192,TPESampler,COMPLETE
2183,0.24997211510751974,2025-04-24 22:40:57.765962,2025-04-24 22:41:00.292211,0 days 00:00:02.526249,0.0981152650742012,12,sqrt,2,20,1168,0.8694811197436378,TPESampler,COMPLETE
2184,0.26729974020860975,2025-04-24 22:40:58.381395,2025-04-24 22:41:00.739391,0 days 00:00:02.357996,0.09782527827871092,12,sqrt,1,9,1088,0.9978894494012633,TPESampler,COMPLETE
2185,0.23594071601884492,2025-04-24 22:41:00.507710,2025-04-24 22:41:03.477319,0 days 00:00:02.969609,0.07843055817370964,12,sqrt,1,14,1496,0.7611910793536845,TPESampler,COMPLETE
2186,0.23917009753363885,2025-04-24 22:41:00.995607,2025-04-24 22:41:03.894124,0 days 00:00:02.898517,0.07022940869602066,10,sqrt,1,18,1496,0.8504457000973911,TPESampler,COMPLETE
2187,0.2593927005810795,2025-04-24 22:41:03.674216,2025-04-24 22:41:05.828932,0 days 00:00:02.154716,0.09803337985892346,12,sqrt,3,20,962,0.7938527308614911,TPESampler,COMPLETE
2188,0.3033213777798407,2025-04-24 22:41:04.155259,2025-04-24 22:41:09.818706,0 days 00:00:05.663447,0.0187546684846203,12,,3,6,751,0.8110400131483531,TPESampler,COMPLETE
2189,0.3234029436846117,2025-04-24 22:41:05.432430,2025-04-24 22:41:07.840448,0 days 00:00:02.408018,0.09585142630214616,10,sqrt,6,18,1144,0.8756973466189817,TPESampler,COMPLETE
2190,0.2462411437915381,2025-04-24 22:41:06.039109,2025-04-24 22:41:08.442819,0 days 00:00:02.403710,0.04763471243757192,12,sqrt,1,17,1092,0.7905756442324076,TPESampler,COMPLETE
2191,0.2425996219657326,2025-04-24 22:41:08.036837,2025-04-24 22:41:11.066728,0 days 00:00:03.029891,0.08962891662462509,12,sqrt,1,17,1294,0.8798695782956092,TPESampler,COMPLETE
2192,0.23543339352886097,2025-04-24 22:41:08.666694,2025-04-24 22:41:11.804235,0 days 00:00:03.137541,0.09948086308946927,10,sqrt,1,20,1399,0.7939824899611663,TPESampler,COMPLETE
2193,0.37285843339851177,2025-04-24 22:41:10.031274,2025-04-24 22:41:16.281781,0 days 00:00:06.250507,0.010915489575697854,8,,8,10,1362,0.6353723264098268,TPESampler,COMPLETE
2194,0.24663575519216546,2025-04-24 22:41:11.263158,2025-04-24 22:41:13.948349,0 days 00:00:02.685191,0.07060746914498886,12,sqrt,1,19,1168,0.8095603860059236,TPESampler,COMPLETE
2195,0.24810505345940354,2025-04-24 22:41:12.027475,2025-04-24 22:41:14.736810,0 days 00:00:02.709335,0.09685135524254697,12,sqrt,1,14,1188,0.8866852756587533,TPESampler,COMPLETE
2196,0.2637108693929236,2025-04-24 22:41:14.145731,2025-04-24 22:41:16.270860,0 days 00:00:02.125129,0.09853241474931156,12,sqrt,2,19,917,0.7206202692102359,TPESampler,COMPLETE
2197,0.2312883157772476,2025-04-24 22:41:14.960542,2025-04-24 22:41:18.576943,0 days 00:00:03.616401,0.0986954466840831,10,sqrt,1,20,1435,0.8591716486887715,TPESampler,COMPLETE
2198,0.25668921752611856,2025-04-24 22:41:16.433643,2025-04-24 22:41:19.433947,0 days 00:00:03.000304,0.09373248215188847,10,sqrt,1,11,1187,0.9088480567511733,TPESampler,COMPLETE
2199,0.2692236344000023,2025-04-24 22:41:16.481865,2025-04-24 22:41:24.842176,0 days 00:00:08.360311,0.05742965756126102,12,,1,19,1147,0.7295934842610612,TPESampler,COMPLETE
2200,0.2884646875392697,2025-04-24 22:41:18.778766,2025-04-24 22:41:21.347378,0 days 00:00:02.568612,0.08922968531786296,10,log2,3,11,1429,0.971335950659335,TPESampler,COMPLETE
2201,0.26198831577979204,2025-04-24 22:41:19.650374,2025-04-24 22:41:22.623174,0 days 00:00:02.972800,0.06221808769018149,12,sqrt,3,19,1464,0.825753596887982,TPESampler,COMPLETE
2202,0.24651338397002534,2025-04-24 22:41:21.553296,2025-04-24 22:41:24.256054,0 days 00:00:02.702758,0.09776867993778682,10,sqrt,1,16,1313,0.8693292375046626,TPESampler,COMPLETE
2203,0.24813283458254082,2025-04-24 22:41:22.821500,2025-04-24 22:41:25.604093,0 days 00:00:02.782593,0.050931740609703444,10,sqrt,1,9,1208,0.8474469226248939,TPESampler,COMPLETE
2204,0.5273818422035897,2025-04-24 22:41:24.501703,2025-04-24 22:41:25.851475,0 days 00:00:01.349772,0.09664656090326203,9,log2,10,3,246,0.9348493713415817,TPESampler,COMPLETE
2205,0.24313276563656466,2025-04-24 22:41:25.113401,2025-04-24 22:41:28.727207,0 days 00:00:03.613806,0.09382891233507781,12,sqrt,1,18,1304,0.8892806063085634,TPESampler,COMPLETE
2206,0.2363499205479775,2025-04-24 22:41:25.862180,2025-04-24 22:41:29.376026,0 days 00:00:03.513846,0.09288434788634817,12,sqrt,1,19,1279,0.8120651487413844,TPESampler,COMPLETE
2207,0.23802992959434863,2025-04-24 22:41:26.069902,2025-04-24 22:41:28.992244,0 days 00:00:02.922342,0.064864886974447,12,sqrt,1,20,1006,0.8498080314630009,TPESampler,COMPLETE
