number,value,datetime_start,datetime_complete,duration,params_learning_rate,params_max_depth,params_max_features,params_min_samples_leaf,params_min_samples_split,params_n_estimators,params_subsample,system_attrs_auto:sampler,state
1596,0.5559594705103018,2025-04-24 22:29:47.851417,2025-04-24 22:29:49.281284,0 days 00:00:01.429867,0.01507385556353502,9,log2,4,19,393,0.750544354432752,TPESampler,COMPLETE
1597,0.35391927186193384,2025-04-24 22:29:47.904338,2025-04-24 22:29:53.471751,0 days 00:00:05.567413,0.012555444638112947,4,,4,17,1197,0.9325746536296575,TPESampler,COMPLETE
1598,0.3951737499002582,2025-04-24 22:29:49.501922,2025-04-24 22:29:55.919236,0 days 00:00:06.417314,0.035976396032046054,11,,10,18,1444,0.6326419659791753,TPESampler,COMPLETE
1599,0.24589498268558968,2025-04-24 22:29:50.329652,2025-04-24 22:29:52.492703,0 days 00:00:02.163051,0.09978346779236028,8,sqrt,1,14,1258,0.8457747008690917,TPESampler,COMPLETE
1600,0.24397305892798726,2025-04-24 22:29:52.684152,2025-04-24 22:29:54.779531,0 days 00:00:02.095379,0.09731405549249733,8,sqrt,1,19,1065,0.8184684889060754,TPESampler,COMPLETE
1601,0.39365672617598135,2025-04-24 22:29:53.666847,2025-04-24 22:29:59.311422,0 days 00:00:05.644575,0.017444418327737087,7,,10,15,1042,0.9921143451365109,TPESampler,COMPLETE
1602,0.3492626630835638,2025-04-24 22:29:54.980563,2025-04-24 22:29:59.250212,0 days 00:00:04.269649,0.036135429850592954,8,,8,15,692,0.9967535560995271,TPESampler,COMPLETE
1603,0.33676792588615523,2025-04-24 22:29:56.109972,2025-04-24 22:29:57.146814,0 days 00:00:01.036842,0.02261037623173235,12,sqrt,3,18,356,0.6580262875891913,TPESampler,COMPLETE
1604,0.26886486222929856,2025-04-24 22:29:57.337031,2025-04-24 22:29:59.082675,0 days 00:00:01.745644,0.07675673372479488,10,sqrt,2,16,919,0.8971389584591356,TPESampler,COMPLETE
1605,0.4225151882320097,2025-04-24 22:29:59.244984,2025-04-24 22:30:01.005331,0 days 00:00:01.760347,0.016487121514647516,10,,10,16,192,0.7219661208720077,TPESampler,COMPLETE
1606,0.2403985204615851,2025-04-24 22:29:59.512156,2025-04-24 22:30:02.631824,0 days 00:00:03.119668,0.06125062629780459,8,sqrt,1,20,1480,0.8534308316238797,TPESampler,COMPLETE
1607,0.25566524312219635,2025-04-24 22:29:59.725335,2025-04-24 22:30:02.477383,0 days 00:00:02.752048,0.08756939985501984,12,sqrt,3,11,1172,0.9031841609080604,TPESampler,COMPLETE
1608,0.2814555991475189,2025-04-24 22:30:01.454992,2025-04-24 22:30:08.949994,0 days 00:00:07.495002,0.09654203630204779,11,,1,16,1111,0.8008301128941713,TPESampler,COMPLETE
1609,0.48401345647820987,2025-04-24 22:30:02.650879,2025-04-24 22:30:04.260798,0 days 00:00:01.609919,0.010900165389083371,5,log2,1,11,729,0.7593822927937639,TPESampler,COMPLETE
1610,0.2594357754915784,2025-04-24 22:30:02.819566,2025-04-24 22:30:05.045068,0 days 00:00:02.225502,0.07607164087393328,8,sqrt,1,14,910,0.9407881438269892,TPESampler,COMPLETE
1611,0.2984832674855618,2025-04-24 22:30:04.453995,2025-04-24 22:30:06.622081,0 days 00:00:02.168086,0.03052946180650413,8,sqrt,4,16,1159,0.9817330022083903,TPESampler,COMPLETE
1612,0.31299936022312025,2025-04-24 22:30:05.248722,2025-04-24 22:30:13.127842,0 days 00:00:07.879120,0.03415774876171437,12,,4,6,1131,0.8990571371169589,TPESampler,COMPLETE
1613,0.2724712381331611,2025-04-24 22:30:06.845761,2025-04-24 22:30:14.319032,0 days 00:00:07.473271,0.09664510587754975,9,,1,16,1269,0.8717819513458227,TPESampler,COMPLETE
1614,0.24423123365105276,2025-04-24 22:30:09.156609,2025-04-24 22:30:11.445220,0 days 00:00:02.288611,0.09355202159096028,12,sqrt,1,18,1172,0.8849833328408956,TPESampler,COMPLETE
1615,0.2632612555847194,2025-04-24 22:30:11.635192,2025-04-24 22:30:14.007637,0 days 00:00:02.372445,0.08840408853358048,10,sqrt,3,16,1203,0.7833060388133629,TPESampler,COMPLETE
1616,0.23479153497410857,2025-04-24 22:30:13.319289,2025-04-24 22:30:16.744510,0 days 00:00:03.425221,0.09944625925141926,10,sqrt,1,14,1472,0.7239642467589196,TPESampler,COMPLETE
1617,0.43251134521768514,2025-04-24 22:30:14.213337,2025-04-24 22:30:17.361989,0 days 00:00:03.148652,0.030834592098810017,8,sqrt,10,16,1283,0.7748779967467988,TPESampler,COMPLETE
1618,0.27259423992575627,2025-04-24 22:30:14.598412,2025-04-24 22:30:18.074940,0 days 00:00:03.476528,0.061552255757910665,12,sqrt,3,13,1251,0.811694697797411,TPESampler,COMPLETE
1619,0.23403622655247272,2025-04-24 22:30:16.950861,2025-04-24 22:30:20.070406,0 days 00:00:03.119545,0.09779404681876545,10,sqrt,1,20,1214,0.820665271329422,TPESampler,COMPLETE
1620,0.2968213027624485,2025-04-24 22:30:17.573579,2025-04-24 22:30:19.989589,0 days 00:00:02.416010,0.08847514734408675,6,log2,1,17,848,0.9000352848324055,TPESampler,COMPLETE
1621,0.28933922289483316,2025-04-24 22:30:18.279361,2025-04-24 22:30:20.457617,0 days 00:00:02.178256,0.0605768106090184,10,log2,1,17,811,0.8262156122023773,TPESampler,COMPLETE
1622,0.26686817762157994,2025-04-24 22:30:20.165966,2025-04-24 22:30:22.907188,0 days 00:00:02.741222,0.04752402276720614,11,sqrt,3,20,1253,0.7083302903392276,TPESampler,COMPLETE
1623,0.25764610449507225,2025-04-24 22:30:20.303509,2025-04-24 22:30:22.729306,0 days 00:00:02.425797,0.0999022522784255,8,sqrt,2,15,992,0.8641486532159905,TPESampler,COMPLETE
1624,0.4118676846382049,2025-04-24 22:30:20.716707,2025-04-24 22:30:29.765580,0 days 00:00:09.048873,0.09997399834907522,12,,9,11,1497,0.852774804114591,TPESampler,COMPLETE
1625,0.24639501578732398,2025-04-24 22:30:22.905790,2025-04-24 22:30:24.900984,0 days 00:00:01.995194,0.09986259610559581,9,sqrt,1,14,1087,0.8300574253940506,TPESampler,COMPLETE
1626,0.2942884908364934,2025-04-24 22:30:23.139881,2025-04-24 22:30:30.776294,0 days 00:00:07.636413,0.08394713708591385,9,,3,18,1466,0.7739626148886958,TPESampler,COMPLETE
1627,0.23744499445868777,2025-04-24 22:30:25.074340,2025-04-24 22:30:27.468487,0 days 00:00:02.394147,0.07347844580929165,10,sqrt,1,14,1490,0.8984548844140514,TPESampler,COMPLETE
1628,0.2493799304421562,2025-04-24 22:30:27.677637,2025-04-24 22:30:29.946490,0 days 00:00:02.268853,0.05083552414555627,10,sqrt,1,17,1313,0.8886974349759438,TPESampler,COMPLETE
1629,0.24574201970595702,2025-04-24 22:30:29.940798,2025-04-24 22:30:32.915160,0 days 00:00:02.974362,0.08650403421399767,12,sqrt,1,20,1202,0.759216434212162,TPESampler,COMPLETE
1630,0.2622039630705033,2025-04-24 22:30:30.352345,2025-04-24 22:30:32.985921,0 days 00:00:02.633576,0.09349468874914871,10,log2,1,16,1156,0.8231147251272513,TPESampler,COMPLETE
1631,0.3336422152109377,2025-04-24 22:30:31.001276,2025-04-24 22:30:37.782532,0 days 00:00:06.781256,0.06227321184585858,7,,7,18,1398,0.7627340529271126,TPESampler,COMPLETE
1632,0.25988697526342314,2025-04-24 22:30:33.083148,2025-04-24 22:30:35.885231,0 days 00:00:02.802083,0.09185510452685834,10,sqrt,3,18,1297,0.8721073101875065,TPESampler,COMPLETE
1633,0.2764215418746162,2025-04-24 22:30:33.216455,2025-04-24 22:30:35.989658,0 days 00:00:02.773203,0.07326544685738871,10,sqrt,3,18,1303,0.8740324957544682,TPESampler,COMPLETE
1634,0.2460268584894718,2025-04-24 22:30:36.043973,2025-04-24 22:30:39.058505,0 days 00:00:03.014532,0.05793384342023011,12,sqrt,1,13,1216,0.888194268829618,TPESampler,COMPLETE
1635,0.26669524440373554,2025-04-24 22:30:36.214786,2025-04-24 22:30:39.144622,0 days 00:00:02.929836,0.09990047523628699,8,sqrt,3,17,1248,0.8450408748029287,TPESampler,COMPLETE
1636,0.2555545670995095,2025-04-24 22:30:37.995330,2025-04-24 22:30:41.103745,0 days 00:00:03.108415,0.06655303581483579,10,sqrt,2,20,1251,0.8858939526574114,TPESampler,COMPLETE
1637,0.25999069709621053,2025-04-24 22:30:39.227735,2025-04-24 22:30:42.111258,0 days 00:00:02.883523,0.0990499428098684,11,sqrt,2,17,1052,0.8475286244932485,TPESampler,COMPLETE
1638,0.41284130761866505,2025-04-24 22:30:39.303584,2025-04-24 22:30:41.098060,0 days 00:00:01.794476,0.010955183609147401,9,sqrt,4,3,430,0.8736198021770809,TPESampler,COMPLETE
1639,0.23451180983373615,2025-04-24 22:30:41.259006,2025-04-24 22:30:44.390541,0 days 00:00:03.131535,0.08173683876630299,10,sqrt,1,14,1347,0.9888367928662031,TPESampler,COMPLETE
1640,0.2447450263306197,2025-04-24 22:30:41.298999,2025-04-24 22:30:45.190763,0 days 00:00:03.891764,0.05863856435375871,8,sqrt,1,16,1490,0.8070633249256753,TPESampler,COMPLETE
1641,0.5409752886945964,2025-04-24 22:30:42.348040,2025-04-24 22:30:44.007039,0 days 00:00:01.658999,0.013288864864530632,8,log2,3,7,443,0.6031526040538175,TPESampler,COMPLETE
1642,0.2707151683614728,2025-04-24 22:30:44.219943,2025-04-24 22:30:53.418873,0 days 00:00:09.198930,0.06133436429214405,10,,1,20,1401,0.8726726945687076,TPESampler,COMPLETE
1643,0.345958326390712,2025-04-24 22:30:44.660484,2025-04-24 22:30:50.201372,0 days 00:00:05.540888,0.090744348785917,6,,8,11,1460,0.7101579820577568,TPESampler,COMPLETE
1644,0.26002806459828987,2025-04-24 22:30:45.440832,2025-04-24 22:30:47.832451,0 days 00:00:02.391619,0.06659030416227998,12,sqrt,2,20,1276,0.8246522518788421,TPESampler,COMPLETE
1645,0.5199454161151827,2025-04-24 22:30:48.211277,2025-04-24 22:30:50.165503,0 days 00:00:01.954226,0.010987251196558476,7,log2,5,10,986,0.7475661538305816,TPESampler,COMPLETE
1646,0.344637912310217,2025-04-24 22:30:50.314551,2025-04-24 22:30:52.012000,0 days 00:00:01.697449,0.056227791231879626,6,log2,4,2,733,0.8586054109713974,TPESampler,COMPLETE
1647,0.2441341096190587,2025-04-24 22:30:50.359043,2025-04-24 22:30:52.949953,0 days 00:00:02.590910,0.05745834195858305,10,sqrt,1,17,1084,0.840671801835922,TPESampler,COMPLETE
1648,0.2612492506418432,2025-04-24 22:30:52.239134,2025-04-24 22:30:54.826824,0 days 00:00:02.587690,0.08460772322601952,7,sqrt,1,13,1120,0.9185432818855942,TPESampler,COMPLETE
1649,0.24266915208743656,2025-04-24 22:30:53.133820,2025-04-24 22:30:56.158381,0 days 00:00:03.024561,0.06377404071685452,11,sqrt,1,15,1212,0.9096566360981586,TPESampler,COMPLETE
1650,0.230938788358444,2025-04-24 22:30:53.667688,2025-04-24 22:30:56.653884,0 days 00:00:02.986196,0.09967977544574685,8,sqrt,1,16,1183,0.8961394258783515,TPESampler,COMPLETE
1651,0.2740870404218463,2025-04-24 22:30:55.023845,2025-04-24 22:30:57.686638,0 days 00:00:02.662793,0.0971898106749563,10,sqrt,2,16,1014,0.8551418342848323,TPESampler,COMPLETE
1652,0.275131549867502,2025-04-24 22:30:56.357817,2025-04-24 22:30:59.554217,0 days 00:00:03.196400,0.06757190850906174,8,sqrt,3,13,1268,0.8218273489269962,TPESampler,COMPLETE
1653,0.2443826113899902,2025-04-24 22:30:56.887637,2025-04-24 22:31:00.033537,0 days 00:00:03.145900,0.0946805178848313,9,sqrt,1,20,1139,0.8946725386707038,TPESampler,COMPLETE
1654,0.5114056948131372,2025-04-24 22:30:57.901746,2025-04-24 22:31:00.597900,0 days 00:00:02.696154,0.01045778988461273,4,log2,5,2,1210,0.9254383132784707,TPESampler,COMPLETE
1655,0.27442598713650695,2025-04-24 22:30:59.773972,2025-04-24 22:31:03.256271,0 days 00:00:03.482299,0.060281550890090414,8,sqrt,3,20,1365,0.7664016213644266,TPESampler,COMPLETE
1656,0.25781077135644387,2025-04-24 22:31:00.311619,2025-04-24 22:31:03.268262,0 days 00:00:02.956643,0.08826593886974471,12,log2,1,19,1159,0.8224102259842395,TPESampler,COMPLETE
1657,0.26906949346144204,2025-04-24 22:31:00.846023,2025-04-24 22:31:04.518605,0 days 00:00:03.672582,0.06770014341338038,10,sqrt,3,17,1498,0.9095416815929197,TPESampler,COMPLETE
1658,0.2686973305135585,2025-04-24 22:31:03.412666,2025-04-24 22:31:06.440745,0 days 00:00:03.028079,0.06115698883482078,10,sqrt,3,15,1174,0.8852870087328109,TPESampler,COMPLETE
1659,0.25760479872244,2025-04-24 22:31:03.449543,2025-04-24 22:31:06.984396,0 days 00:00:03.534853,0.06519753882215883,10,sqrt,1,20,1375,0.9239845986262643,TPESampler,COMPLETE
1660,0.2501287789319599,2025-04-24 22:31:04.725582,2025-04-24 22:31:08.032096,0 days 00:00:03.306514,0.060209204317232284,10,sqrt,1,16,1369,0.8451937217188437,TPESampler,COMPLETE
1661,0.2733968850211836,2025-04-24 22:31:06.651413,2025-04-24 22:31:09.869500,0 days 00:00:03.218087,0.09144287083853027,8,sqrt,3,13,1256,0.8986838725290871,TPESampler,COMPLETE
1662,0.37357715282558945,2025-04-24 22:31:07.239557,2025-04-24 22:31:08.490068,0 days 00:00:01.250511,0.08598564808706169,3,sqrt,1,4,256,0.7754703545003034,TPESampler,COMPLETE
1663,0.24599545891483798,2025-04-24 22:31:08.277332,2025-04-24 22:31:11.453533,0 days 00:00:03.176201,0.06126971142402632,11,sqrt,1,11,1123,0.7854620071269047,TPESampler,COMPLETE
1664,0.45441968341566624,2025-04-24 22:31:08.737891,2025-04-24 22:31:10.023483,0 days 00:00:01.285592,0.03592035928392822,10,sqrt,8,9,266,0.6675063254850833,TPESampler,COMPLETE
1665,0.23736643781236802,2025-04-24 22:31:10.217434,2025-04-24 22:31:12.929498,0 days 00:00:02.712064,0.0659103242351082,11,sqrt,1,13,1060,0.8763107294941593,TPESampler,COMPLETE
1666,0.26005008633200977,2025-04-24 22:31:10.394390,2025-04-24 22:31:12.863462,0 days 00:00:02.469072,0.08376818640752019,12,sqrt,2,20,853,0.7965668039473232,TPESampler,COMPLETE
1667,0.3342550790496604,2025-04-24 22:31:11.682395,2025-04-24 22:31:14.450704,0 days 00:00:02.768309,0.08091229554450878,4,sqrt,5,2,1221,0.640141422137069,TPESampler,COMPLETE
1668,0.26138318623201806,2025-04-24 22:31:13.018005,2025-04-24 22:31:16.686402,0 days 00:00:03.668397,0.09561933339975097,10,sqrt,3,17,1413,0.8408609137705942,TPESampler,COMPLETE
1669,0.2539325085934885,2025-04-24 22:31:13.136978,2025-04-24 22:31:16.243470,0 days 00:00:03.106492,0.09110111724089402,9,sqrt,1,13,1166,0.9229718518381017,TPESampler,COMPLETE
1670,0.2539307790450014,2025-04-24 22:31:14.655153,2025-04-24 22:31:16.829848,0 days 00:00:02.174695,0.07377182146560503,10,sqrt,1,18,805,0.6996912053291502,TPESampler,COMPLETE
1671,0.6579434349657827,2025-04-24 22:31:16.550628,2025-04-24 22:31:18.441700,0 days 00:00:01.891072,0.010219952514986084,12,log2,6,17,715,0.6919651431698818,TPESampler,COMPLETE
1672,0.24238363963709136,2025-04-24 22:31:17.019733,2025-04-24 22:31:20.678790,0 days 00:00:03.659057,0.09921415404296038,12,sqrt,1,20,1403,0.8131012846959288,TPESampler,COMPLETE
1673,0.24784452378050156,2025-04-24 22:31:17.172963,2025-04-24 22:31:20.562580,0 days 00:00:03.389617,0.09743762685320742,10,sqrt,1,19,1270,0.786957823006538,TPESampler,COMPLETE
1674,0.239364119509356,2025-04-24 22:31:18.674471,2025-04-24 22:31:21.698355,0 days 00:00:03.023884,0.08848234314627806,11,sqrt,1,17,1146,0.8146030461437208,TPESampler,COMPLETE
1675,0.315871664234264,2025-04-24 22:31:20.727341,2025-04-24 22:31:22.625355,0 days 00:00:01.898014,0.0241161549167242,9,sqrt,1,15,598,0.6997841132959661,TPESampler,COMPLETE
1676,0.2476358361234401,2025-04-24 22:31:20.890912,2025-04-24 22:31:24.247810,0 days 00:00:03.356898,0.06612286715459495,10,sqrt,1,18,1258,0.7081434906017292,TPESampler,COMPLETE
1677,0.4713661710403697,2025-04-24 22:31:21.927560,2025-04-24 22:31:23.448075,0 days 00:00:01.520515,0.01802260831772763,3,sqrt,3,5,410,0.9198123299520937,TPESampler,COMPLETE
1678,0.23972498649031432,2025-04-24 22:31:22.821004,2025-04-24 22:31:26.146058,0 days 00:00:03.325054,0.05924502800003323,11,sqrt,1,14,1339,0.8600688226457033,TPESampler,COMPLETE
1679,0.2573336888158217,2025-04-24 22:31:23.650299,2025-04-24 22:31:26.780627,0 days 00:00:03.130328,0.06442460331068169,12,sqrt,3,20,1166,0.909883140605332,TPESampler,COMPLETE
1680,0.49852520764485203,2025-04-24 22:31:24.473902,2025-04-24 22:31:25.623168,0 days 00:00:01.149266,0.05844339748994597,4,log2,5,19,234,0.8802453795682589,TPESampler,COMPLETE
1681,0.25597395423619523,2025-04-24 22:31:25.821819,2025-04-24 22:31:29.364369,0 days 00:00:03.542550,0.09333030724635837,8,sqrt,1,20,1464,0.8416828125985414,TPESampler,COMPLETE
1682,0.24037435336033447,2025-04-24 22:31:26.384440,2025-04-24 22:31:29.470437,0 days 00:00:03.085997,0.09736471486256912,9,sqrt,1,14,1217,0.9060623062224211,TPESampler,COMPLETE
1683,0.2469104464304803,2025-04-24 22:31:26.994615,2025-04-24 22:31:30.086767,0 days 00:00:03.092152,0.061061441234987184,10,sqrt,1,20,1274,0.826236295864864,TPESampler,COMPLETE
1684,0.25928556194503477,2025-04-24 22:31:29.568579,2025-04-24 22:31:32.816213,0 days 00:00:03.247634,0.09255553955119854,10,sqrt,1,16,1196,0.8146727004618638,TPESampler,COMPLETE
1685,0.2617591630839232,2025-04-24 22:31:29.793083,2025-04-24 22:31:32.764412,0 days 00:00:02.971329,0.0926752078293217,12,sqrt,2,11,1049,0.9017700628700478,TPESampler,COMPLETE
1686,0.2502384366155215,2025-04-24 22:31:30.373703,2025-04-24 22:31:33.862353,0 days 00:00:03.488650,0.09943048091165824,11,sqrt,1,16,1387,0.9059764224542854,TPESampler,COMPLETE
1687,0.24366771396879014,2025-04-24 22:31:32.914986,2025-04-24 22:31:36.172427,0 days 00:00:03.257441,0.0988335835404099,12,sqrt,1,20,1272,0.9030268386407658,TPESampler,COMPLETE
1688,0.2657212050434083,2025-04-24 22:31:33.039352,2025-04-24 22:31:36.200872,0 days 00:00:03.161520,0.09911836270174171,10,sqrt,2,20,1230,0.8726854942746517,TPESampler,COMPLETE
1689,0.2491928248118559,2025-04-24 22:31:34.060038,2025-04-24 22:31:37.613507,0 days 00:00:03.553469,0.08767215008446301,11,sqrt,1,10,1431,0.9321166358801769,TPESampler,COMPLETE
1690,0.2466727447449035,2025-04-24 22:31:36.325344,2025-04-24 22:31:40.004742,0 days 00:00:03.679398,0.06919087776633533,8,sqrt,1,16,1478,0.873116017287947,TPESampler,COMPLETE
1691,0.2725048129723878,2025-04-24 22:31:36.369916,2025-04-24 22:31:40.034687,0 days 00:00:03.664771,0.0653017527650049,9,sqrt,3,12,1422,0.8826699010914669,TPESampler,COMPLETE
1692,0.27628846019986736,2025-04-24 22:31:37.819921,2025-04-24 22:31:40.977127,0 days 00:00:03.157206,0.08025349176069824,7,log2,1,14,1347,0.8673344408706063,TPESampler,COMPLETE
1693,0.2929232106262161,2025-04-24 22:31:40.165066,2025-04-24 22:31:43.289596,0 days 00:00:03.124530,0.04521800341889683,8,,2,11,593,0.6011202981101516,TPESampler,COMPLETE
1694,0.23319366020014237,2025-04-24 22:31:40.214683,2025-04-24 22:31:43.165059,0 days 00:00:02.950376,0.06896692924351396,11,sqrt,1,12,1410,0.8972374234793666,TPESampler,COMPLETE
1695,0.32803868313693774,2025-04-24 22:31:41.192472,2025-04-24 22:31:50.849755,0 days 00:00:09.657283,0.09666546826708995,12,,4,18,1479,0.878080841959466,TPESampler,COMPLETE
1696,0.2562854069174031,2025-04-24 22:31:43.358453,2025-04-24 22:31:45.910419,0 days 00:00:02.551966,0.09394004472485956,11,sqrt,2,16,1327,0.8498541116697842,TPESampler,COMPLETE
1697,0.6280386032992229,2025-04-24 22:31:43.510938,2025-04-24 22:31:44.575596,0 days 00:00:01.064658,0.038924709429784536,6,log2,9,10,209,0.7891858186282216,TPESampler,COMPLETE
1698,0.27816450130959613,2025-04-24 22:31:44.765108,2025-04-24 22:31:49.667207,0 days 00:00:04.902099,0.09702653452480113,7,,3,14,1171,0.6982788100910944,TPESampler,COMPLETE
1699,0.4154480115369623,2025-04-24 22:31:46.106118,2025-04-24 22:31:49.161213,0 days 00:00:03.055095,0.014484794931567374,3,,8,14,1198,0.6639466607760065,TPESampler,COMPLETE
1700,0.24870103100632743,2025-04-24 22:31:49.352751,2025-04-24 22:31:52.503837,0 days 00:00:03.151086,0.0982798377299137,10,sqrt,1,17,1383,0.8625666581344897,TPESampler,COMPLETE
1701,0.24903217928460353,2025-04-24 22:31:49.884091,2025-04-24 22:31:52.586146,0 days 00:00:02.702055,0.06555919882598772,10,sqrt,2,13,1118,0.7934422398835577,TPESampler,COMPLETE
1702,0.2403120589066231,2025-04-24 22:31:51.061947,2025-04-24 22:31:54.046242,0 days 00:00:02.984295,0.09561349832937321,12,sqrt,1,14,1135,0.8902931032644881,TPESampler,COMPLETE
1703,0.3695107394354089,2025-04-24 22:31:52.670697,2025-04-24 22:31:57.721380,0 days 00:00:05.050683,0.05375239783918833,6,,9,9,849,0.995336835111775,TPESampler,COMPLETE
1704,0.4239765571250582,2025-04-24 22:31:52.797984,2025-04-24 22:31:55.651301,0 days 00:00:02.853317,0.0804918928301599,7,log2,8,12,1497,0.7513420774175681,TPESampler,COMPLETE
1705,0.24842477447803912,2025-04-24 22:31:54.248237,2025-04-24 22:31:56.696795,0 days 00:00:02.448558,0.07246612015616369,10,sqrt,1,17,1078,0.8240629236634034,TPESampler,COMPLETE
1706,0.26628325556657867,2025-04-24 22:31:55.864650,2025-04-24 22:31:58.200055,0 days 00:00:02.335405,0.0613247339247176,10,log2,1,17,1202,0.9367797979103187,TPESampler,COMPLETE
1707,0.7283439911736163,2025-04-24 22:31:56.891595,2025-04-24 22:31:57.750569,0 days 00:00:00.858974,0.028203190149986866,10,log2,5,19,122,0.6685330963962872,TPESampler,COMPLETE
1708,0.23819231311982642,2025-04-24 22:31:57.894512,2025-04-24 22:32:01.399207,0 days 00:00:03.504695,0.06454584158381736,10,sqrt,1,16,1271,0.8597098215384448,TPESampler,COMPLETE
1709,0.24905251786462948,2025-04-24 22:31:57.941967,2025-04-24 22:32:01.628548,0 days 00:00:03.686581,0.09769118640804296,10,sqrt,1,11,1416,0.8112198215313529,TPESampler,COMPLETE
1710,0.2471928400015818,2025-04-24 22:31:58.545140,2025-04-24 22:32:01.571626,0 days 00:00:03.026486,0.07453986507443279,10,sqrt,1,17,1169,0.9337486884305519,TPESampler,COMPLETE
1711,0.24473520505652924,2025-04-24 22:32:01.570028,2025-04-24 22:32:05.090767,0 days 00:00:03.520739,0.0938530964045144,9,sqrt,1,20,1446,0.8733880633685245,TPESampler,COMPLETE
1712,0.25250207423701787,2025-04-24 22:32:01.824674,2025-04-24 22:32:05.181076,0 days 00:00:03.356402,0.06775648705867755,10,sqrt,1,15,1312,0.8687078006505272,TPESampler,COMPLETE
1713,0.2643096595192142,2025-04-24 22:32:01.890250,2025-04-24 22:32:04.750314,0 days 00:00:02.860064,0.08286943387175826,9,sqrt,1,20,983,0.857275021146199,TPESampler,COMPLETE
1714,0.2371697329982315,2025-04-24 22:32:04.952349,2025-04-24 22:32:07.647664,0 days 00:00:02.695315,0.06632221673054846,12,sqrt,1,20,1209,0.8598647221828952,TPESampler,COMPLETE
1715,0.3242379045986752,2025-04-24 22:32:05.353207,2025-04-24 22:32:11.813124,0 days 00:00:06.459917,0.08899951910685855,12,,5,12,863,0.8914201135021547,TPESampler,COMPLETE
1716,0.25419312381165415,2025-04-24 22:32:05.504328,2025-04-24 22:32:07.496546,0 days 00:00:01.992218,0.07075319857688543,11,sqrt,1,18,768,0.894819739284115,TPESampler,COMPLETE
1717,0.23401798881741798,2025-04-24 22:32:07.678984,2025-04-24 22:32:10.260503,0 days 00:00:02.581519,0.09732478572571952,12,sqrt,1,16,1374,0.8646346079554944,TPESampler,COMPLETE
1718,0.39072734219604405,2025-04-24 22:32:07.834356,2025-04-24 22:32:14.406738,0 days 00:00:06.572382,0.07975262915289955,5,,10,13,1466,0.9609342731909973,TPESampler,COMPLETE
