number,value,datetime_start,datetime_complete,duration,params_learning_rate,params_max_depth,params_max_features,params_min_samples_leaf,params_min_samples_split,params_n_estimators,params_subsample,system_attrs_auto:sampler,state
1352,0.2523653939338389,2025-04-24 22:25:06.890594,2025-04-24 22:25:09.271341,0 days 00:00:02.380747,0.0993321261401498,10,sqrt,1,16,1133,0.9167413283650397,TPESampler,COMPLETE
1353,0.27003685507420405,2025-04-24 22:25:08.677493,2025-04-24 22:25:11.187016,0 days 00:00:02.509523,0.06369493084459384,9,sqrt,2,17,1285,0.8022309384354517,TPESampler,COMPLETE
1354,0.28744323937618554,2025-04-24 22:25:09.472354,2025-04-24 22:25:11.605369,0 days 00:00:02.133015,0.05777515978911142,8,sqrt,3,20,1072,0.9486008880699697,TPESampler,COMPLETE
1355,0.24639150819652475,2025-04-24 22:25:11.391430,2025-04-24 22:25:13.930241,0 days 00:00:02.538811,0.050731487723260645,9,sqrt,1,15,1421,0.9163685653335369,TPESampler,COMPLETE
1356,0.28762615220748355,2025-04-24 22:25:11.849630,2025-04-24 22:25:14.000783,0 days 00:00:02.151153,0.09801600729401565,4,,3,11,602,0.6563913351163605,TPESampler,COMPLETE
1357,0.25365252246167186,2025-04-24 22:25:14.072498,2025-04-24 22:25:18.234356,0 days 00:00:04.161858,0.07065457271450579,9,sqrt,1,17,1340,0.8363866112289926,TPESampler,COMPLETE
1358,0.2575758062230532,2025-04-24 22:25:14.080153,2025-04-24 22:25:18.245968,0 days 00:00:04.165815,0.0863228610097318,8,sqrt,1,20,1366,0.8773740798906853,TPESampler,COMPLETE
1359,0.25916323159205507,2025-04-24 22:25:14.808436,2025-04-24 22:25:18.267707,0 days 00:00:03.459271,0.09788819523888455,9,sqrt,3,18,1118,0.9146660736377838,TPESampler,COMPLETE
1360,0.2595567612198873,2025-04-24 22:25:18.414919,2025-04-24 22:25:21.800799,0 days 00:00:03.385880,0.07490865029650505,11,sqrt,3,15,1224,0.8170097517925661,TPESampler,COMPLETE
1361,0.2544640530963751,2025-04-24 22:25:18.431224,2025-04-24 22:25:22.269017,0 days 00:00:03.837793,0.07109069083263231,9,sqrt,1,17,1298,0.8235625541071736,TPESampler,COMPLETE
1362,0.22765708849357733,2025-04-24 22:25:18.424818,2025-04-24 22:25:22.149334,0 days 00:00:03.724516,0.09773239892570718,11,sqrt,1,16,1295,0.8385244299216355,TPESampler,COMPLETE
1363,0.25265094431915414,2025-04-24 22:25:22.006953,2025-04-24 22:25:25.389631,0 days 00:00:03.382678,0.08907403169394212,12,log2,1,17,1358,0.8444856113611173,TPESampler,COMPLETE
1364,0.3547888857888134,2025-04-24 22:25:22.375426,2025-04-24 22:25:25.983192,0 days 00:00:03.607766,0.02430489284975818,7,log2,4,20,1485,0.7888616309118401,TPESampler,COMPLETE
1365,0.25463111143303546,2025-04-24 22:25:22.514016,2025-04-24 22:25:26.276738,0 days 00:00:03.762722,0.0889845343713306,10,log2,1,18,1476,0.7615040269464204,TPESampler,COMPLETE
1366,0.2704078577922268,2025-04-24 22:25:25.593481,2025-04-24 22:25:28.604707,0 days 00:00:03.011226,0.06592849120776137,11,sqrt,3,20,1232,0.874273041233465,TPESampler,COMPLETE
1367,0.27242014263387265,2025-04-24 22:25:26.214923,2025-04-24 22:25:29.216125,0 days 00:00:03.001202,0.09252904866515886,9,sqrt,2,14,1268,0.7863475064417847,TPESampler,COMPLETE
1368,0.2402813841258515,2025-04-24 22:25:26.602200,2025-04-24 22:25:30.289742,0 days 00:00:03.687542,0.0997738512764174,12,sqrt,1,17,1409,0.7643301375841474,TPESampler,COMPLETE
1369,0.27904401400550677,2025-04-24 22:25:28.818192,2025-04-24 22:25:31.922796,0 days 00:00:03.104604,0.09648764588350067,5,sqrt,2,11,1394,0.9354264418765361,TPESampler,COMPLETE
1370,0.23487771839480662,2025-04-24 22:25:29.415454,2025-04-24 22:25:32.289733,0 days 00:00:02.874279,0.07145834853901098,11,sqrt,1,14,1266,0.812072451074541,TPESampler,COMPLETE
1371,0.29453438742936144,2025-04-24 22:25:30.495061,2025-04-24 22:25:37.883810,0 days 00:00:07.388749,0.031032561724263177,8,,2,3,1288,0.8149487689960744,TPESampler,COMPLETE
1372,0.3227520278979474,2025-04-24 22:25:32.122091,2025-04-24 22:25:34.639297,0 days 00:00:02.517206,0.010582812252172056,10,sqrt,3,20,1152,0.6617373505329297,TPESampler,COMPLETE
1373,0.5661656912445546,2025-04-24 22:25:32.533461,2025-04-24 22:25:34.892200,0 days 00:00:02.358739,0.012247338071334227,12,log2,10,11,1354,0.8862106747828238,TPESampler,COMPLETE
1374,0.24700927045288615,2025-04-24 22:25:34.847265,2025-04-24 22:25:37.115497,0 days 00:00:02.268232,0.062294578636866604,10,sqrt,1,17,1204,0.783272369291108,TPESampler,COMPLETE
1375,0.33524339723561863,2025-04-24 22:25:35.170702,2025-04-24 22:25:39.068084,0 days 00:00:03.897382,0.015475554133493375,9,,5,3,582,0.9194968828547161,TPESampler,COMPLETE
1376,0.26002613783986567,2025-04-24 22:25:37.298945,2025-04-24 22:25:45.733415,0 days 00:00:08.434470,0.06571955540962357,8,,1,17,1475,0.8824016520981843,TPESampler,COMPLETE
1377,0.24018098207377556,2025-04-24 22:25:38.091768,2025-04-24 22:25:40.591357,0 days 00:00:02.499589,0.08945937722932358,12,sqrt,1,17,1282,0.8455622388679548,TPESampler,COMPLETE
1378,0.26560384374817475,2025-04-24 22:25:39.277331,2025-04-24 22:25:41.466733,0 days 00:00:02.189402,0.09624239591384631,12,sqrt,3,15,1026,0.7748582578659331,TPESampler,COMPLETE
1379,0.2493874286195873,2025-04-24 22:25:40.800760,2025-04-24 22:25:43.397995,0 days 00:00:02.597235,0.09351397351947568,10,sqrt,1,13,1314,0.8217737633804476,TPESampler,COMPLETE
1380,0.25367492983072576,2025-04-24 22:25:41.662139,2025-04-24 22:25:44.053285,0 days 00:00:02.391146,0.09868129520600434,12,sqrt,1,14,1131,0.8075161738557415,TPESampler,COMPLETE
1381,0.25968948535626896,2025-04-24 22:25:43.588951,2025-04-24 22:25:46.982624,0 days 00:00:03.393673,0.09768869670714266,9,log2,1,15,1412,0.8969634721334464,TPESampler,COMPLETE
1382,0.34592302648049766,2025-04-24 22:25:44.773152,2025-04-24 22:25:47.717819,0 days 00:00:02.944667,0.012139960498944457,6,sqrt,2,20,1262,0.8722560719164334,TPESampler,COMPLETE
1383,0.24173183575958304,2025-04-24 22:25:45.940235,2025-04-24 22:25:49.180968,0 days 00:00:03.240733,0.06152330868376904,9,sqrt,1,12,1482,0.8124206014903567,TPESampler,COMPLETE
1384,0.2505441590327833,2025-04-24 22:25:47.197463,2025-04-24 22:25:50.291068,0 days 00:00:03.093605,0.08664198356403335,10,sqrt,1,15,1110,0.7854677890194237,TPESampler,COMPLETE
1385,0.2559327846881275,2025-04-24 22:25:48.190448,2025-04-24 22:25:51.103090,0 days 00:00:02.912642,0.09155134985786202,12,sqrt,2,15,1069,0.8818101107975732,TPESampler,COMPLETE
1386,0.26312623597148516,2025-04-24 22:25:49.371035,2025-04-24 22:25:52.922418,0 days 00:00:03.551383,0.07283020667379855,9,sqrt,1,15,1473,0.7540260523434458,TPESampler,COMPLETE
1387,0.24431850846190964,2025-04-24 22:25:50.499227,2025-04-24 22:25:53.635967,0 days 00:00:03.136740,0.07618307452062634,9,sqrt,1,19,1169,0.8403594332366527,TPESampler,COMPLETE
1388,0.24860663189868087,2025-04-24 22:25:51.358439,2025-04-24 22:25:54.404669,0 days 00:00:03.046230,0.08784164639403652,10,sqrt,1,14,1206,0.8317799311166417,TPESampler,COMPLETE
1389,0.2677000645586951,2025-04-24 22:25:53.123629,2025-04-24 22:25:56.012156,0 days 00:00:02.888527,0.09962642129943518,10,sqrt,3,16,1245,0.8426549412907991,TPESampler,COMPLETE
1390,0.23689439744260576,2025-04-24 22:25:53.857957,2025-04-24 22:25:56.568638,0 days 00:00:02.710681,0.06054567173582507,10,sqrt,1,18,1163,0.8636286586805336,TPESampler,COMPLETE
1391,0.3307575341920535,2025-04-24 22:25:54.605477,2025-04-24 22:25:59.326357,0 days 00:00:04.720880,0.07966589060487712,9,,6,15,897,0.6680105139358024,TPESampler,COMPLETE
1392,0.2536627184376559,2025-04-24 22:25:56.199413,2025-04-24 22:25:58.589634,0 days 00:00:02.390221,0.06955553743769068,9,sqrt,1,14,1113,0.8793533080846678,TPESampler,COMPLETE
1393,0.2359659919072909,2025-04-24 22:25:56.764324,2025-04-24 22:25:59.599990,0 days 00:00:02.835666,0.09996744050081656,11,sqrt,1,13,1350,0.8586441648934274,TPESampler,COMPLETE
1394,0.26817170170458215,2025-04-24 22:25:58.784874,2025-04-24 22:26:01.260742,0 days 00:00:02.475868,0.06694089070073408,11,sqrt,3,20,1026,0.8282695723026376,TPESampler,COMPLETE
1395,0.2618557333464943,2025-04-24 22:25:59.556746,2025-04-24 22:26:02.139557,0 days 00:00:02.582811,0.06040742192485114,11,sqrt,3,16,1255,0.740247629323579,TPESampler,COMPLETE
1396,0.2819855743459233,2025-04-24 22:25:59.875924,2025-04-24 22:26:07.601717,0 days 00:00:07.725793,0.011820873075298608,10,,1,11,1417,0.6760809446410012,TPESampler,COMPLETE
1397,0.25420022616847093,2025-04-24 22:26:01.469232,2025-04-24 22:26:03.938227,0 days 00:00:02.468995,0.09915382495457363,10,sqrt,2,15,1162,0.8331392606143528,TPESampler,COMPLETE
1398,0.4043192080472088,2025-04-24 22:26:02.335197,2025-04-24 22:26:03.935121,0 days 00:00:01.599924,0.04167459336394385,3,log2,3,15,699,0.727408842025041,TPESampler,COMPLETE
1399,0.2938821247540501,2025-04-24 22:26:04.087776,2025-04-24 22:26:12.807508,0 days 00:00:08.719732,0.09434742510669651,10,,3,15,1348,0.8918924747190389,TPESampler,COMPLETE
1400,0.25773427427395723,2025-04-24 22:26:04.139530,2025-04-24 22:26:06.788305,0 days 00:00:02.648775,0.07476527417538636,11,sqrt,3,17,1500,0.7986438990316632,TPESampler,COMPLETE
1401,0.3519885977261224,2025-04-24 22:26:07.002771,2025-04-24 22:26:09.052763,0 days 00:00:02.049992,0.0685265175668507,6,log2,4,20,784,0.639905399924473,TPESampler,COMPLETE
1402,0.24581051571147416,2025-04-24 22:26:07.804723,2025-04-24 22:26:10.738804,0 days 00:00:02.934081,0.0777062888057737,10,sqrt,1,20,1482,0.8192906700190297,TPESampler,COMPLETE
1403,0.24663786770841858,2025-04-24 22:26:09.235858,2025-04-24 22:26:11.685881,0 days 00:00:02.450023,0.07226850339351053,10,sqrt,1,19,1226,0.9128350434679948,TPESampler,COMPLETE
1404,0.2429408787483106,2025-04-24 22:26:10.947474,2025-04-24 22:26:13.787849,0 days 00:00:02.840375,0.06615821988206953,12,sqrt,1,20,1309,0.8650821884785193,TPESampler,COMPLETE
1405,0.24073057337427983,2025-04-24 22:26:11.888784,2025-04-24 22:26:14.454239,0 days 00:00:02.565455,0.09585893993438745,11,sqrt,1,19,1053,0.8654344978235213,TPESampler,COMPLETE
1406,0.4302653654041331,2025-04-24 22:26:13.008728,2025-04-24 22:26:14.191445,0 days 00:00:01.182717,0.05764162479785016,12,log2,5,13,255,0.9318751639712933,TPESampler,COMPLETE
1407,0.25486262947401594,2025-04-24 22:26:13.997500,2025-04-24 22:26:16.851602,0 days 00:00:02.854102,0.05859630234618182,12,sqrt,1,15,1000,0.7935740715898073,TPESampler,COMPLETE
1408,0.26068529827807935,2025-04-24 22:26:14.452830,2025-04-24 22:26:17.848576,0 days 00:00:03.395746,0.07024112474323893,9,sqrt,2,16,1327,0.8559850794121262,TPESampler,COMPLETE
1409,0.24079905333436802,2025-04-24 22:26:14.854088,2025-04-24 22:26:17.820089,0 days 00:00:02.966001,0.06158921644308962,10,sqrt,1,14,1034,0.8659143725951395,TPESampler,COMPLETE
1410,0.24163715036994451,2025-04-24 22:26:17.048755,2025-04-24 22:26:19.954616,0 days 00:00:02.905861,0.06920909260016583,11,sqrt,1,17,1220,0.8312797448751508,TPESampler,COMPLETE
1411,0.3494276042047022,2025-04-24 22:26:17.988444,2025-04-24 22:26:23.121483,0 days 00:00:05.133039,0.011641500924181508,9,,7,18,858,0.7912392929607619,TPESampler,COMPLETE
1412,0.5068818034591578,2025-04-24 22:26:18.052507,2025-04-24 22:26:20.734849,0 days 00:00:02.682342,0.017683776168464713,8,log2,9,16,1418,0.9598635506949657,TPESampler,COMPLETE
1413,0.2735883001780058,2025-04-24 22:26:20.159592,2025-04-24 22:26:22.859381,0 days 00:00:02.699789,0.06437960992160793,8,sqrt,3,13,1409,0.8977678206409277,TPESampler,COMPLETE
1414,0.2455608202049878,2025-04-24 22:26:20.948099,2025-04-24 22:26:23.579443,0 days 00:00:02.631344,0.09825931444146697,10,sqrt,1,17,1167,0.8568740074332885,TPESampler,COMPLETE
1415,0.24468764861647926,2025-04-24 22:26:23.058474,2025-04-24 22:26:25.998476,0 days 00:00:02.940002,0.08900302030207435,6,sqrt,1,11,1346,0.807291403103737,TPESampler,COMPLETE
1416,0.3112109831043848,2025-04-24 22:26:23.387459,2025-04-24 22:26:27.734000,0 days 00:00:04.346541,0.021100957278557705,6,,4,7,924,0.6854402892459417,TPESampler,COMPLETE
1417,0.24707818119443603,2025-04-24 22:26:23.926438,2025-04-24 22:26:26.951545,0 days 00:00:03.025107,0.05693094641760812,10,sqrt,1,15,1490,0.8579864137355839,TPESampler,COMPLETE
1418,0.24328785151329196,2025-04-24 22:26:26.181461,2025-04-24 22:26:28.965889,0 days 00:00:02.784428,0.0767403652286128,8,sqrt,1,15,1293,0.9806911820684956,TPESampler,COMPLETE
1419,0.2461327933052312,2025-04-24 22:26:27.150179,2025-04-24 22:26:30.222896,0 days 00:00:03.072717,0.06292886337694209,12,sqrt,1,17,1200,0.7951724774292298,TPESampler,COMPLETE
1420,0.3957087851724894,2025-04-24 22:26:27.946794,2025-04-24 22:26:32.259332,0 days 00:00:04.312538,0.019228228484090452,6,,9,8,1015,0.6398462809114702,TPESampler,COMPLETE
1421,0.24549582426569572,2025-04-24 22:26:29.163684,2025-04-24 22:26:31.560716,0 days 00:00:02.397032,0.07303515025265425,10,sqrt,1,15,1077,0.9756021174307944,TPESampler,COMPLETE
1422,0.2673364488585019,2025-04-24 22:26:30.421484,2025-04-24 22:26:33.073090,0 days 00:00:02.651606,0.09983342801203264,10,sqrt,3,18,1130,0.8317666611714232,TPESampler,COMPLETE
1423,0.24558467366187506,2025-04-24 22:26:31.754375,2025-04-24 22:26:35.612403,0 days 00:00:03.858028,0.09949897018398533,12,sqrt,1,13,1486,0.8440177608457734,TPESampler,COMPLETE
1424,0.3897019940862375,2025-04-24 22:26:32.479298,2025-04-24 22:26:35.661117,0 days 00:00:03.181819,0.014090370985651725,5,log2,1,2,1365,0.6005769637578672,TPESampler,COMPLETE
1425,0.26337315335355693,2025-04-24 22:26:33.297468,2025-04-24 22:26:36.861872,0 days 00:00:03.564404,0.09743627196698001,10,sqrt,2,19,1427,0.7903198902559591,TPESampler,COMPLETE
1426,0.27782854639953625,2025-04-24 22:26:35.764495,2025-04-24 22:26:37.099491,0 days 00:00:01.334996,0.06609333865577481,12,sqrt,1,8,308,0.7426585898956102,TPESampler,COMPLETE
1427,0.2660023326217386,2025-04-24 22:26:35.811196,2025-04-24 22:26:38.754072,0 days 00:00:02.942876,0.09832173066417689,8,sqrt,2,17,1201,0.7696520490405866,TPESampler,COMPLETE
1428,0.24833035921035368,2025-04-24 22:26:37.063067,2025-04-24 22:26:39.591398,0 days 00:00:02.528331,0.08079581735738407,8,sqrt,1,16,1232,0.8882127093605112,TPESampler,COMPLETE
1429,0.33854620808593805,2025-04-24 22:26:37.302227,2025-04-24 22:26:41.733264,0 days 00:00:04.431037,0.02295826519112683,12,,7,6,741,0.6581269325227945,TPESampler,COMPLETE
1430,0.2509221049688867,2025-04-24 22:26:38.944630,2025-04-24 22:26:41.699220,0 days 00:00:02.754590,0.0939422124484347,12,sqrt,1,16,1221,0.9263034165476964,TPESampler,COMPLETE
1431,0.3391628420816823,2025-04-24 22:26:39.776028,2025-04-24 22:26:41.567457,0 days 00:00:01.791429,0.0720663191737121,11,log2,4,9,908,0.6032509609495971,TPESampler,COMPLETE
1432,0.23461828091694722,2025-04-24 22:26:41.749663,2025-04-24 22:26:44.807314,0 days 00:00:03.057651,0.08675220941323031,9,sqrt,1,16,1217,0.9200235301945194,TPESampler,COMPLETE
1433,0.309629677114809,2025-04-24 22:26:41.905166,2025-04-24 22:26:45.163236,0 days 00:00:03.258070,0.08212129698185155,11,log2,3,20,1253,0.7818121384817782,TPESampler,COMPLETE
1434,0.23416735905160727,2025-04-24 22:26:41.976719,2025-04-24 22:26:45.747395,0 days 00:00:03.770676,0.062286562297108744,12,sqrt,1,14,1248,0.9041794233317664,TPESampler,COMPLETE
1435,0.33047357174487396,2025-04-24 22:26:45.007636,2025-04-24 22:26:55.165009,0 days 00:00:10.157373,0.01091526156027266,12,,7,20,1408,0.9482541449719848,TPESampler,COMPLETE
1436,0.4081598991939336,2025-04-24 22:26:45.387021,2025-04-24 22:26:47.113422,0 days 00:00:01.726401,0.028776742107127544,5,log2,5,5,1006,0.9129685027675261,TPESampler,COMPLETE
1437,0.3858934207079816,2025-04-24 22:26:45.950718,2025-04-24 22:26:49.764150,0 days 00:00:03.813432,0.022339489613296588,7,,9,3,662,0.8214675048271983,TPESampler,COMPLETE
1438,0.4115597020648125,2025-04-24 22:26:47.306649,2025-04-24 22:26:49.180474,0 days 00:00:01.873825,0.07635205328776588,11,sqrt,8,7,908,0.6178801601622517,TPESampler,COMPLETE
1439,0.37635046546594964,2025-04-24 22:26:49.350713,2025-04-24 22:26:50.558359,0 days 00:00:01.207646,0.09582448279610387,3,sqrt,6,4,344,0.9213289143400772,TPESampler,COMPLETE
1440,0.23937206067530506,2025-04-24 22:26:49.984438,2025-04-24 22:26:52.818783,0 days 00:00:02.834345,0.08262584959039614,8,sqrt,1,13,1413,0.8339985913226141,TPESampler,COMPLETE
1441,0.24274170933117553,2025-04-24 22:26:50.748262,2025-04-24 22:26:52.902912,0 days 00:00:02.154650,0.0999694185815716,11,sqrt,1,15,995,0.8689060795984556,TPESampler,COMPLETE
1442,0.36983506088491913,2025-04-24 22:26:52.971688,2025-04-24 22:26:54.570878,0 days 00:00:01.599190,0.014966904057346233,12,,3,5,153,0.8769711727175715,TPESampler,COMPLETE
1443,0.32445926822690757,2025-04-24 22:26:53.106145,2025-04-24 22:26:55.208665,0 days 00:00:02.102520,0.024444730863062435,9,sqrt,5,7,1058,0.813481246659603,TPESampler,COMPLETE
1444,0.24625982578851524,2025-04-24 22:26:54.761621,2025-04-24 22:26:58.332588,0 days 00:00:03.570967,0.08223471627592796,10,sqrt,1,17,1360,0.8607458553210989,TPESampler,COMPLETE
1445,0.4765388556681084,2025-04-24 22:26:55.409341,2025-04-24 22:26:58.887197,0 days 00:00:03.477856,0.028953274096645516,6,log2,9,12,1356,0.7689158488641097,TPESampler,COMPLETE
1446,0.27237396384480755,2025-04-24 22:26:55.483206,2025-04-24 22:26:59.094838,0 days 00:00:03.611632,0.06253496016142253,9,sqrt,3,19,1266,0.8415091543323341,TPESampler,COMPLETE
1447,0.23761636990059004,2025-04-24 22:26:58.548148,2025-04-24 22:27:01.823905,0 days 00:00:03.275757,0.08509620429543122,11,sqrt,1,20,1427,0.855710922457314,TPESampler,COMPLETE
1448,0.25443505118053267,2025-04-24 22:26:59.132730,2025-04-24 22:27:02.065937,0 days 00:00:02.933207,0.0867510127298604,9,sqrt,1,17,1270,0.7448189921487061,TPESampler,COMPLETE
1449,0.38610549675114225,2025-04-24 22:26:59.389109,2025-04-24 22:27:02.290510,0 days 00:00:02.901401,0.017906282126972206,5,,7,19,513,0.9912330418751596,TPESampler,COMPLETE
1450,0.32693282672787044,2025-04-24 22:27:02.023659,2025-04-24 22:27:04.412729,0 days 00:00:02.389070,0.03639825249315857,7,log2,1,18,1058,0.8448552895861241,TPESampler,COMPLETE
1451,0.24722605123937286,2025-04-24 22:27:02.317234,2025-04-24 22:27:05.701332,0 days 00:00:03.384098,0.08852958173385905,11,sqrt,1,16,1204,0.8627684277724357,TPESampler,COMPLETE
1452,0.2554539855318818,2025-04-24 22:27:02.524131,2025-04-24 22:27:05.525511,0 days 00:00:03.001380,0.06629565282835814,11,sqrt,1,20,1027,0.8655969145214403,TPESampler,COMPLETE
1453,0.29077260896787904,2025-04-24 22:27:04.623498,2025-04-24 22:27:15.388206,0 days 00:00:10.764708,0.07281436486650937,12,,1,10,1404,0.9044270676670051,TPESampler,COMPLETE
1454,0.3398577160580654,2025-04-24 22:27:05.699865,2025-04-24 22:27:06.996971,0 days 00:00:01.297106,0.0316829864864426,11,log2,1,19,484,0.8394300910709225,TPESampler,COMPLETE
1455,0.23817836928647806,2025-04-24 22:27:05.916415,2025-04-24 22:27:08.723279,0 days 00:00:02.806864,0.07698865690592058,10,sqrt,1,16,1489,0.8068184766875154,TPESampler,COMPLETE
1456,0.24894838146009998,2025-04-24 22:27:07.241417,2025-04-24 22:27:09.764339,0 days 00:00:02.522922,0.09418368497450565,10,sqrt,1,20,1251,0.8290143022124107,TPESampler,COMPLETE
1457,0.27895141038993393,2025-04-24 22:27:08.918724,2025-04-24 22:27:11.224548,0 days 00:00:02.305824,0.057047775158377535,9,sqrt,3,15,1284,0.8047756414306046,TPESampler,COMPLETE
1458,0.273989502302656,2025-04-24 22:27:10.077402,2025-04-24 22:27:12.233964,0 days 00:00:02.156562,0.09975974215186822,11,sqrt,3,10,899,0.9930776773809524,TPESampler,COMPLETE
1459,0.3265047081965031,2025-04-24 22:27:11.407870,2025-04-24 22:27:13.172947,0 days 00:00:01.765077,0.07191687111416814,5,log2,4,9,1084,0.813247512595329,TPESampler,COMPLETE
1460,0.24300862185189098,2025-04-24 22:27:12.584214,2025-04-24 22:27:15.358174,0 days 00:00:02.773960,0.09845435409541152,9,sqrt,1,17,1291,0.9406800678329693,TPESampler,COMPLETE
1461,0.44708886871969894,2025-04-24 22:27:13.371250,2025-04-24 22:27:15.440403,0 days 00:00:02.069153,0.09855894928858994,5,log2,10,11,1230,0.9645805655985914,TPESampler,COMPLETE
1462,0.2682747504635759,2025-04-24 22:27:15.533511,2025-04-24 22:27:18.828819,0 days 00:00:03.295308,0.09353100494350784,10,sqrt,3,19,1067,0.968270949751253,TPESampler,COMPLETE
1463,0.27340351767753646,2025-04-24 22:27:15.543276,2025-04-24 22:27:18.777393,0 days 00:00:03.234117,0.09801563394368153,12,sqrt,3,15,1183,0.8557037138642939,TPESampler,COMPLETE
1464,0.2334359018905399,2025-04-24 22:27:15.597252,2025-04-24 22:27:19.223635,0 days 00:00:03.626383,0.09686340263612941,9,sqrt,1,16,1401,0.8956579942916724,TPESampler,COMPLETE
1465,0.3578285773025735,2025-04-24 22:27:18.943442,2025-04-24 22:27:21.993413,0 days 00:00:03.049971,0.010792455089516121,11,,5,15,380,0.6693875020716864,TPESampler,COMPLETE
1466,0.2660910168793954,2025-04-24 22:27:18.994695,2025-04-24 22:27:21.151701,0 days 00:00:02.157006,0.05932493883454207,9,sqrt,1,17,815,0.996775992962206,TPESampler,COMPLETE
1467,0.24848401414158122,2025-04-24 22:27:19.467922,2025-04-24 22:27:21.992206,0 days 00:00:02.524284,0.09993782716977463,8,sqrt,1,16,1321,0.7762899687863722,TPESampler,COMPLETE
1468,0.2878837188089513,2025-04-24 22:27:21.406892,2025-04-24 22:27:29.903669,0 days 00:00:08.496777,0.054615558909742165,10,,3,16,1075,0.9066960515269923,TPESampler,COMPLETE
1469,0.2623129782749073,2025-04-24 22:27:22.819260,2025-04-24 22:27:25.587696,0 days 00:00:02.768436,0.03152225724593288,10,sqrt,1,16,1107,0.8441305318399979,TPESampler,COMPLETE
1470,0.25846722781658865,2025-04-24 22:27:23.061725,2025-04-24 22:27:25.617855,0 days 00:00:02.556130,0.07602405926681474,11,sqrt,3,17,1149,0.8895248701080304,TPESampler,COMPLETE
1471,0.26639799242860557,2025-04-24 22:27:25.724493,2025-04-24 22:27:28.492211,0 days 00:00:02.767718,0.09702829820066927,12,sqrt,3,19,1343,0.8475823862924612,TPESampler,COMPLETE
1472,0.3159443962827538,2025-04-24 22:27:25.777471,2025-04-24 22:27:27.327869,0 days 00:00:01.550398,0.07152408127828586,5,sqrt,1,19,461,0.7917269985203994,TPESampler,COMPLETE
1473,0.2354992834597255,2025-04-24 22:27:27.521209,2025-04-24 22:27:30.101114,0 days 00:00:02.579905,0.06901751214541134,10,sqrt,1,18,1443,0.8764640707046365,TPESampler,COMPLETE
