number,value,datetime_start,datetime_complete,duration,params_learning_rate,params_max_depth,params_max_features,params_min_samples_leaf,params_min_samples_split,params_n_estimators,params_subsample,system_attrs_auto:sampler,state
1719,0.2543783138442696,2025-04-24 22:32:10.483241,2025-04-24 22:32:13.113618,0 days 00:00:02.630377,0.0996907636240942,11,sqrt,2,12,1332,0.9269884489248913,TPESampler,COMPLETE
1720,0.2693909178163217,2025-04-24 22:32:12.037468,2025-04-24 22:32:15.091272,0 days 00:00:03.053804,0.07129439807743822,9,sqrt,3,14,1411,0.7954462879559249,TPESampler,COMPLETE
1721,0.2370251179001635,2025-04-24 22:32:13.301188,2025-04-24 22:32:16.081651,0 days 00:00:02.780463,0.09670756348682817,10,sqrt,1,13,1207,0.8256437867276561,TPESampler,COMPLETE
1722,0.26815034704255025,2025-04-24 22:32:14.607498,2025-04-24 22:32:17.949881,0 days 00:00:03.342383,0.06096677463720878,8,sqrt,3,15,1326,0.9103003123022414,TPESampler,COMPLETE
1723,0.4527076447581485,2025-04-24 22:32:15.393489,2025-04-24 22:32:17.222476,0 days 00:00:01.828987,0.012097952720411675,5,sqrt,7,4,597,0.9479235003619435,TPESampler,COMPLETE
1724,0.44572280239343803,2025-04-24 22:32:16.358513,2025-04-24 22:32:18.315307,0 days 00:00:01.956794,0.014827676572399596,10,sqrt,10,17,599,0.9701214387607179,TPESampler,COMPLETE
1725,0.2554978017524483,2025-04-24 22:32:17.476748,2025-04-24 22:32:20.111465,0 days 00:00:02.634717,0.09981710038813668,12,sqrt,2,20,889,0.8748949085382055,TPESampler,COMPLETE
1726,0.2585534456698894,2025-04-24 22:32:18.131247,2025-04-24 22:32:21.219710,0 days 00:00:03.088463,0.07093938978228023,11,sqrt,3,20,1249,0.8271917957090291,TPESampler,COMPLETE
1727,0.2711302807089294,2025-04-24 22:32:18.569523,2025-04-24 22:32:21.307055,0 days 00:00:02.737532,0.06292526819618954,10,sqrt,3,17,1093,0.7991165868540681,TPESampler,COMPLETE
1728,0.2978165902601212,2025-04-24 22:32:20.313287,2025-04-24 22:32:22.916740,0 days 00:00:02.603453,0.09931668526473404,5,sqrt,3,16,1110,0.925172056408485,TPESampler,COMPLETE
1729,0.24121891486094493,2025-04-24 22:32:21.389920,2025-04-24 22:32:24.901874,0 days 00:00:03.511954,0.0821056482656138,10,sqrt,1,16,1398,0.8136216350742633,TPESampler,COMPLETE
1730,0.35924351355897827,2025-04-24 22:32:21.525871,2025-04-24 22:32:23.035500,0 days 00:00:01.509629,0.04643939451580052,5,,2,12,200,0.60499624381922,TPESampler,COMPLETE
1731,0.23850195724056503,2025-04-24 22:32:23.091710,2025-04-24 22:32:26.458609,0 days 00:00:03.366899,0.09400497199447738,9,sqrt,1,17,1500,0.7900235567468468,TPESampler,COMPLETE
1732,0.28130649870070074,2025-04-24 22:32:23.267896,2025-04-24 22:32:26.284697,0 days 00:00:03.016801,0.05001846401463952,8,sqrt,2,13,1207,0.6837178348922597,TPESampler,COMPLETE
1733,0.38268671029198925,2025-04-24 22:32:25.097023,2025-04-24 22:32:29.512847,0 days 00:00:04.415824,0.08868638187580465,12,,9,10,648,0.8162000596732966,TPESampler,COMPLETE
1734,0.32060521840792305,2025-04-24 22:32:26.457195,2025-04-24 22:32:28.591345,0 days 00:00:02.134150,0.011291825523296948,11,sqrt,4,13,1219,0.7505599960114101,TPESampler,COMPLETE
1735,0.28216233601130286,2025-04-24 22:32:26.666963,2025-04-24 22:32:32.003284,0 days 00:00:05.336321,0.0882051350660397,7,,1,9,1292,0.6274997366695432,TPESampler,COMPLETE
1736,0.31787232522808617,2025-04-24 22:32:28.780158,2025-04-24 22:32:34.339426,0 days 00:00:05.559268,0.032599270262837654,6,,5,19,1096,0.9684902955948552,TPESampler,COMPLETE
1737,0.26948930569524654,2025-04-24 22:32:29.704579,2025-04-24 22:32:32.047243,0 days 00:00:02.342664,0.08116946973958229,10,sqrt,3,12,1163,0.8889409889630607,TPESampler,COMPLETE
1738,0.2348428828355823,2025-04-24 22:32:32.158702,2025-04-24 22:32:35.125117,0 days 00:00:02.966415,0.09780690350188147,9,sqrt,1,16,1281,0.8833939327311643,TPESampler,COMPLETE
1739,0.2830149259666536,2025-04-24 22:32:32.208726,2025-04-24 22:32:35.211625,0 days 00:00:03.002899,0.031775973246408684,12,sqrt,3,15,1214,0.8805183706348256,TPESampler,COMPLETE
1740,0.5110398273522031,2025-04-24 22:32:34.540683,2025-04-24 22:32:36.496319,0 days 00:00:01.955636,0.04239307429014917,8,log2,10,9,831,0.7113328466637336,TPESampler,COMPLETE
1741,0.28675761271852834,2025-04-24 22:32:35.325131,2025-04-24 22:32:38.690597,0 days 00:00:03.365466,0.05645094246125486,6,sqrt,2,16,1216,0.8116192286762662,TPESampler,COMPLETE
1742,0.3356510446298834,2025-04-24 22:32:35.466300,2025-04-24 22:32:38.832119,0 days 00:00:03.365819,0.028770039316053254,6,log2,1,17,1396,0.9847241089622751,TPESampler,COMPLETE
1743,0.304386283977639,2025-04-24 22:32:36.703436,2025-04-24 22:32:38.958399,0 days 00:00:02.254963,0.037951997906623416,7,sqrt,2,17,785,0.6143575367874612,TPESampler,COMPLETE
1744,0.2498661466108464,2025-04-24 22:32:38.890293,2025-04-24 22:32:41.550786,0 days 00:00:02.660493,0.09924891998674708,11,sqrt,1,18,919,0.7966552061650347,TPESampler,COMPLETE
1745,0.2436445345150525,2025-04-24 22:32:39.086423,2025-04-24 22:32:42.336103,0 days 00:00:03.249680,0.09815826134308223,8,sqrt,1,13,1207,0.7262893624257314,TPESampler,COMPLETE
1746,0.5964594149213358,2025-04-24 22:32:39.229612,2025-04-24 22:32:41.159853,0 days 00:00:01.930241,0.01270820012483143,3,log2,3,3,565,0.7120704601908168,TPESampler,COMPLETE
1747,0.24327070147781843,2025-04-24 22:32:41.359934,2025-04-24 22:32:44.363133,0 days 00:00:03.003199,0.0951154212851904,9,sqrt,1,14,1456,0.9130827806835993,TPESampler,COMPLETE
1748,0.24388934265539156,2025-04-24 22:32:41.796003,2025-04-24 22:32:44.952628,0 days 00:00:03.156625,0.09769867922818477,8,sqrt,1,11,1302,0.8809670901935165,TPESampler,COMPLETE
1749,0.25810629543541647,2025-04-24 22:32:42.566415,2025-04-24 22:32:46.219952,0 days 00:00:03.653537,0.06209380384380036,7,sqrt,1,14,1271,0.827140494000911,TPESampler,COMPLETE
1750,0.3210537753771219,2025-04-24 22:32:44.812424,2025-04-24 22:32:46.518756,0 days 00:00:01.706332,0.0628622781773451,10,log2,1,3,489,0.8052930154465828,TPESampler,COMPLETE
1751,0.30573609046798944,2025-04-24 22:32:45.425030,2025-04-24 22:32:48.812982,0 days 00:00:03.387952,0.019931867034326152,12,log2,1,18,1470,0.8706764878753601,TPESampler,COMPLETE
1752,0.25642997259243455,2025-04-24 22:32:46.483600,2025-04-24 22:32:49.634789,0 days 00:00:03.151189,0.07200130180291445,9,sqrt,1,16,1107,0.8256744295407852,TPESampler,COMPLETE
1753,0.2642543300792599,2025-04-24 22:32:46.966358,2025-04-24 22:32:49.890425,0 days 00:00:02.924067,0.09958568650709967,8,sqrt,3,13,1103,0.9796377152746432,TPESampler,COMPLETE
1754,0.23640208024642229,2025-04-24 22:32:49.054185,2025-04-24 22:32:51.718672,0 days 00:00:02.664487,0.09892702803235566,9,sqrt,1,17,1002,0.926800323202622,TPESampler,COMPLETE
1755,0.24097418193727116,2025-04-24 22:32:49.953840,2025-04-24 22:32:53.755288,0 days 00:00:03.801448,0.08460701132635734,10,sqrt,1,12,1486,0.9246542040193806,TPESampler,COMPLETE
1756,0.2531009805113508,2025-04-24 22:32:50.168860,2025-04-24 22:32:53.539627,0 days 00:00:03.370767,0.0971260960143087,12,sqrt,2,20,1177,0.843965673589044,TPESampler,COMPLETE
1757,0.2441834022022871,2025-04-24 22:32:51.941111,2025-04-24 22:32:55.189426,0 days 00:00:03.248315,0.0662524625058676,10,sqrt,1,12,1176,0.876824991072287,TPESampler,COMPLETE
1758,0.547747278207604,2025-04-24 22:32:53.955551,2025-04-24 22:32:55.472738,0 days 00:00:01.517187,0.015708068418729567,10,sqrt,9,6,354,0.6204079144927532,TPESampler,COMPLETE
1759,0.2547184093565055,2025-04-24 22:32:54.049112,2025-04-24 22:32:57.286553,0 days 00:00:03.237441,0.03700238862422586,11,sqrt,1,18,1227,0.7731748014440954,TPESampler,COMPLETE
1760,0.29515711680421886,2025-04-24 22:32:55.425263,2025-04-24 22:32:58.840862,0 days 00:00:03.415599,0.03349945684473494,6,sqrt,2,17,1476,0.9202781796241823,TPESampler,COMPLETE
1761,0.2458273545046779,2025-04-24 22:32:55.749943,2025-04-24 22:32:59.024817,0 days 00:00:03.274874,0.09837826576245758,11,sqrt,1,16,1134,0.8585823895262865,TPESampler,COMPLETE
1762,0.2704605420775639,2025-04-24 22:32:57.486006,2025-04-24 22:33:01.064227,0 days 00:00:03.578221,0.09592006040388493,8,sqrt,2,10,1462,0.7854620001099993,TPESampler,COMPLETE
1763,0.4064956618506347,2025-04-24 22:32:59.034691,2025-04-24 22:33:01.007438,0 days 00:00:01.972747,0.01742866267904365,10,log2,3,3,672,0.8553896223895101,TPESampler,COMPLETE
1764,0.24704771952644072,2025-04-24 22:32:59.228930,2025-04-24 22:33:02.604261,0 days 00:00:03.375331,0.05898981570027367,10,sqrt,1,20,1324,0.7804322686312999,TPESampler,COMPLETE
1765,0.33821711117840775,2025-04-24 22:33:01.175764,2025-04-24 22:33:04.078422,0 days 00:00:02.902658,0.09716875725892751,8,log2,5,17,1219,0.7957379570399866,TPESampler,COMPLETE
1766,0.245802665075605,2025-04-24 22:33:01.300916,2025-04-24 22:33:04.418072,0 days 00:00:03.117156,0.07382118537423346,10,sqrt,1,17,1221,0.799744937095551,TPESampler,COMPLETE
1767,0.2890308578500392,2025-04-24 22:33:02.810352,2025-04-24 22:33:09.949839,0 days 00:00:07.139487,0.06390168651957291,11,,3,18,972,0.8574902407469438,TPESampler,COMPLETE
1768,0.2607715933023611,2025-04-24 22:33:04.286221,2025-04-24 22:33:06.697855,0 days 00:00:02.411634,0.09721162739028065,10,sqrt,3,18,1061,0.890227268960243,TPESampler,COMPLETE
1769,0.3792121961868583,2025-04-24 22:33:04.669888,2025-04-24 22:33:06.947271,0 days 00:00:02.277383,0.06354741244045599,9,log2,7,8,1368,0.9572132090466345,TPESampler,COMPLETE
1770,0.2638609297135637,2025-04-24 22:33:06.885112,2025-04-24 22:33:09.454563,0 days 00:00:02.569451,0.09757984536626937,10,sqrt,2,17,1144,0.8854256381181542,TPESampler,COMPLETE
1771,0.2605027981161378,2025-04-24 22:33:07.296305,2025-04-24 22:33:09.963153,0 days 00:00:02.666848,0.08823080583608828,9,sqrt,3,20,1273,0.7550851732925934,TPESampler,COMPLETE
1772,0.2555762197693818,2025-04-24 22:33:09.665538,2025-04-24 22:33:12.796386,0 days 00:00:03.130848,0.07497542666259532,10,sqrt,3,16,1267,0.7779485589368961,TPESampler,COMPLETE
1773,0.2801215014001012,2025-04-24 22:33:10.180647,2025-04-24 22:33:12.696083,0 days 00:00:02.515436,0.04273957923006974,12,sqrt,3,16,827,0.8955311442471668,TPESampler,COMPLETE
1774,0.27285547000593874,2025-04-24 22:33:10.232921,2025-04-24 22:33:14.107324,0 days 00:00:03.874403,0.08405610191757881,8,sqrt,3,17,1481,0.9723323709338316,TPESampler,COMPLETE
1775,0.25926463139807215,2025-04-24 22:33:12.861356,2025-04-24 22:33:16.015878,0 days 00:00:03.154522,0.09516888872439225,10,sqrt,2,17,1255,0.8948235899596124,TPESampler,COMPLETE
1776,0.2537272291456286,2025-04-24 22:33:12.980021,2025-04-24 22:33:16.722869,0 days 00:00:03.742848,0.09581561911842376,11,sqrt,1,14,1452,0.9262784883869,TPESampler,COMPLETE
1777,0.2490352006096374,2025-04-24 22:33:14.345550,2025-04-24 22:33:17.126679,0 days 00:00:02.781129,0.0593432908718821,10,sqrt,1,20,1145,0.8712981147911288,TPESampler,COMPLETE
1778,0.47700841044528863,2025-04-24 22:33:16.220322,2025-04-24 22:33:17.766981,0 days 00:00:01.546659,0.02422916660325043,8,sqrt,9,19,303,0.9242826320330955,TPESampler,COMPLETE
1779,0.420659312521212,2025-04-24 22:33:17.068111,2025-04-24 22:33:19.804970,0 days 00:00:02.736859,0.014293618156085916,12,sqrt,7,4,1106,0.6354368403797788,TPESampler,COMPLETE
1780,0.24877450057363373,2025-04-24 22:33:17.345546,2025-04-24 22:33:20.230601,0 days 00:00:02.885055,0.09314375939234508,10,sqrt,1,14,1054,0.7613340816261347,TPESampler,COMPLETE
1781,0.2469003994905967,2025-04-24 22:33:17.998785,2025-04-24 22:33:21.376893,0 days 00:00:03.378108,0.06917966148148268,12,sqrt,1,17,1227,0.879874977532381,TPESampler,COMPLETE
1782,0.32082785494845095,2025-04-24 22:33:20.005375,2025-04-24 22:33:22.750283,0 days 00:00:02.744908,0.07780751707272483,11,log2,4,14,1169,0.7682168458319573,TPESampler,COMPLETE
1783,0.23926727452897167,2025-04-24 22:33:20.486937,2025-04-24 22:33:23.568034,0 days 00:00:03.081097,0.06829333758487012,10,sqrt,1,15,1118,0.9010437952151144,TPESampler,COMPLETE
1784,0.25529166971809686,2025-04-24 22:33:21.591049,2025-04-24 22:33:24.335850,0 days 00:00:02.744801,0.0895621801688461,12,sqrt,3,19,1049,0.7528195873713217,TPESampler,COMPLETE
1785,0.30889559803906913,2025-04-24 22:33:22.952179,2025-04-24 22:33:26.004865,0 days 00:00:03.052686,0.09275397079599686,12,,2,5,334,0.8292628930023539,TPESampler,COMPLETE
1786,0.24359111865703,2025-04-24 22:33:23.764150,2025-04-24 22:33:26.353198,0 days 00:00:02.589048,0.06975148106469803,9,sqrt,1,17,1270,0.9045959800047474,TPESampler,COMPLETE
1787,0.23355518708634523,2025-04-24 22:33:24.548819,2025-04-24 22:33:27.707679,0 days 00:00:03.158860,0.06450816161442986,11,sqrt,1,17,1376,0.8188512021891823,TPESampler,COMPLETE
1788,0.27440430681572836,2025-04-24 22:33:26.217733,2025-04-24 22:33:29.168553,0 days 00:00:02.950820,0.041009222136003116,9,sqrt,1,14,1098,0.7707670914708843,TPESampler,COMPLETE
1789,0.5342306963775693,2025-04-24 22:33:26.627431,2025-04-24 22:33:28.062668,0 days 00:00:01.435237,0.02904831334696592,5,log2,7,10,403,0.9735315678208718,TPESampler,COMPLETE
1790,0.24766823138295893,2025-04-24 22:33:27.917011,2025-04-24 22:33:30.501895,0 days 00:00:02.584884,0.09660803324733756,10,sqrt,1,16,972,0.8531838766770476,TPESampler,COMPLETE
1791,0.2629062914980615,2025-04-24 22:33:28.309871,2025-04-24 22:33:31.235969,0 days 00:00:02.926098,0.06746360386203995,7,sqrt,1,19,1128,0.9309094942775445,TPESampler,COMPLETE
1792,0.2671710134110467,2025-04-24 22:33:29.370977,2025-04-24 22:33:32.604104,0 days 00:00:03.233127,0.07469051975839773,10,sqrt,3,20,1387,0.871600660391935,TPESampler,COMPLETE
1793,0.319690603895948,2025-04-24 22:33:30.701914,2025-04-24 22:33:36.758486,0 days 00:00:06.056572,0.017098979081717276,7,,5,17,1201,0.7427932639514018,TPESampler,COMPLETE
1794,0.26419486680270804,2025-04-24 22:33:31.439274,2025-04-24 22:33:34.394300,0 days 00:00:02.955026,0.049853146426734746,8,sqrt,1,11,1438,0.9245804477421153,TPESampler,COMPLETE
1795,0.42855643935763216,2025-04-24 22:33:32.800596,2025-04-24 22:33:34.427883,0 days 00:00:01.627287,0.032289754414399116,9,sqrt,9,18,640,0.7817795307088715,TPESampler,COMPLETE
1796,0.254123191128806,2025-04-24 22:33:34.565727,2025-04-24 22:33:37.108312,0 days 00:00:02.542585,0.09547083052440872,10,sqrt,2,13,1104,0.9080988371513471,TPESampler,COMPLETE
1797,0.2640646794856389,2025-04-24 22:33:34.611875,2025-04-24 22:33:37.247699,0 days 00:00:02.635824,0.0967669124304701,10,sqrt,3,12,1063,0.9330508579788425,TPESampler,COMPLETE
1798,0.23964611530403973,2025-04-24 22:33:36.971948,2025-04-24 22:33:40.714637,0 days 00:00:03.742689,0.06074202065316724,10,sqrt,1,12,1405,0.8378548018345566,TPESampler,COMPLETE
1799,0.3438394643519099,2025-04-24 22:33:37.348688,2025-04-24 22:33:40.708132,0 days 00:00:03.359444,0.042815574346439324,6,sqrt,6,3,1278,0.8214422298090684,TPESampler,COMPLETE
1800,0.433114555537879,2025-04-24 22:33:37.488358,2025-04-24 22:33:40.271454,0 days 00:00:02.783096,0.053808660064489464,12,log2,7,20,1070,0.6878022161840954,TPESampler,COMPLETE
1801,0.2684868384514547,2025-04-24 22:33:40.480630,2025-04-24 22:33:43.451147,0 days 00:00:02.970517,0.09693826466896867,9,sqrt,2,16,1213,0.7859734553292718,TPESampler,COMPLETE
1802,0.2739623843243624,2025-04-24 22:33:40.984483,2025-04-24 22:33:43.701836,0 days 00:00:02.717353,0.07637380827764181,9,sqrt,2,20,869,0.7860429116548144,TPESampler,COMPLETE
1803,0.24085215116953454,2025-04-24 22:33:41.031344,2025-04-24 22:33:44.966788,0 days 00:00:03.935444,0.07943689876168654,12,sqrt,1,20,1497,0.8356593640770449,TPESampler,COMPLETE
1804,0.31079033572183623,2025-04-24 22:33:43.652224,2025-04-24 22:33:47.910671,0 days 00:00:04.258447,0.04473162674492882,12,,5,9,528,0.8762989875954167,TPESampler,COMPLETE
1805,0.262705053150906,2025-04-24 22:33:43.987325,2025-04-24 22:33:46.504487,0 days 00:00:02.517162,0.05611818838631974,9,sqrt,1,14,1256,0.7546805388583827,TPESampler,COMPLETE
1806,0.2626322299968773,2025-04-24 22:33:45.160604,2025-04-24 22:33:47.236594,0 days 00:00:02.075990,0.06602306512327116,11,sqrt,1,18,906,0.91234726750766,TPESampler,COMPLETE
1807,0.25193845299398515,2025-04-24 22:33:46.697535,2025-04-24 22:33:49.380780,0 days 00:00:02.683245,0.0974532148366201,12,sqrt,1,19,1222,0.7856648080929479,TPESampler,COMPLETE
1808,0.36192541085190305,2025-04-24 22:33:47.495905,2025-04-24 22:33:55.534435,0 days 00:00:08.038530,0.03662622895683349,9,,9,20,1174,0.9932637324311161,TPESampler,COMPLETE
1809,0.4383108365847333,2025-04-24 22:33:48.119904,2025-04-24 22:33:49.356124,0 days 00:00:01.236220,0.017720707091933862,5,,9,18,203,0.6194862648730676,TPESampler,COMPLETE
1810,0.3213558505623243,2025-04-24 22:33:49.504215,2025-04-24 22:33:50.841916,0 days 00:00:01.337701,0.04437632202501698,8,sqrt,3,10,367,0.9711336808570099,TPESampler,COMPLETE
1811,0.2519911024331721,2025-04-24 22:33:49.543595,2025-04-24 22:33:51.963046,0 days 00:00:02.419451,0.09411858898506852,11,sqrt,1,13,971,0.91978897688128,TPESampler,COMPLETE
1812,0.23702285278417823,2025-04-24 22:33:51.051095,2025-04-24 22:33:53.685781,0 days 00:00:02.634686,0.07543499330547634,10,sqrt,1,20,1293,0.8689466965862406,TPESampler,COMPLETE
1813,0.25346824935446177,2025-04-24 22:33:52.162003,2025-04-24 22:33:54.910975,0 days 00:00:02.748972,0.09116592183348168,9,sqrt,1,18,1336,0.8560949080187351,TPESampler,COMPLETE
1814,0.2785601288321956,2025-04-24 22:33:53.884074,2025-04-24 22:33:56.873449,0 days 00:00:02.989375,0.0873276338370355,10,log2,1,9,1374,0.7909953263513185,TPESampler,COMPLETE
1815,0.26181011632783147,2025-04-24 22:33:55.113781,2025-04-24 22:33:58.675372,0 days 00:00:03.561591,0.07757915140525304,11,sqrt,3,12,1429,0.841413000441291,TPESampler,COMPLETE
1816,0.2731313363190315,2025-04-24 22:33:55.776889,2025-04-24 22:33:59.426512,0 days 00:00:03.649623,0.041068373125765494,10,sqrt,3,19,1448,0.8245423003994864,TPESampler,COMPLETE
1817,0.22656621367673263,2025-04-24 22:33:57.081478,2025-04-24 22:34:00.280564,0 days 00:00:03.199086,0.06791955599361969,11,sqrt,1,14,1234,0.7906781851670709,TPESampler,COMPLETE
1818,0.27079047469570144,2025-04-24 22:33:58.880275,2025-04-24 22:34:01.970441,0 days 00:00:03.090166,0.08386735001530865,9,sqrt,3,20,1296,0.9339470853698744,TPESampler,COMPLETE
1819,0.2614953127714904,2025-04-24 22:33:59.644582,2025-04-24 22:34:02.214212,0 days 00:00:02.569630,0.09889589226261146,10,sqrt,1,16,1034,0.8778587019268985,TPESampler,COMPLETE
1820,0.2835483186261471,2025-04-24 22:34:00.513876,2025-04-24 22:34:05.107102,0 days 00:00:04.593226,0.08248761181450967,3,,2,19,1176,0.9812474580787329,TPESampler,COMPLETE
1821,0.3360153353206076,2025-04-24 22:34:02.172606,2025-04-24 22:34:04.420862,0 days 00:00:02.248256,0.023112484792004347,8,,2,11,301,0.8756551838246779,TPESampler,COMPLETE
1822,0.27363730255850566,2025-04-24 22:34:02.569138,2025-04-24 22:34:04.446180,0 days 00:00:01.877042,0.09244842501359705,9,log2,1,19,1098,0.9498868369940436,TPESampler,COMPLETE
1823,0.3437912050718364,2025-04-24 22:34:04.612455,2025-04-24 22:34:09.541989,0 days 00:00:04.929534,0.03814839348747556,9,,8,5,877,0.6933874595142708,TPESampler,COMPLETE
1824,0.2536696311784327,2025-04-24 22:34:04.652891,2025-04-24 22:34:07.910144,0 days 00:00:03.257253,0.04907340407658425,12,sqrt,2,15,1467,0.7770797284520587,TPESampler,COMPLETE
1825,0.2537129080810806,2025-04-24 22:34:05.390066,2025-04-24 22:34:08.177228,0 days 00:00:02.787162,0.09945930983485832,11,sqrt,2,19,1375,0.8421526277694769,TPESampler,COMPLETE
1826,0.24393388882030567,2025-04-24 22:34:08.126481,2025-04-24 22:34:11.427529,0 days 00:00:03.301048,0.09631089313113247,7,sqrt,1,14,1447,0.9462598883341334,TPESampler,COMPLETE
1827,0.24122248822273454,2025-04-24 22:34:08.604554,2025-04-24 22:34:11.437946,0 days 00:00:02.833392,0.0710773815436931,12,sqrt,1,13,1147,0.7524131324415003,TPESampler,COMPLETE
1828,0.3610769311908357,2025-04-24 22:34:09.752455,2025-04-24 22:34:14.397709,0 days 00:00:04.645254,0.03395700490643039,5,,8,7,1072,0.7592644194539361,TPESampler,COMPLETE
1829,0.2582813400544905,2025-04-24 22:34:11.740945,2025-04-24 22:34:14.305860,0 days 00:00:02.564915,0.09381921924001049,11,sqrt,2,13,1217,0.7419639570697915,TPESampler,COMPLETE
1830,0.32538620175200605,2025-04-24 22:34:11.790088,2025-04-24 22:34:21.455920,0 days 00:00:09.665832,0.013724492529477267,11,,6,4,1473,0.8228595298291975,TPESampler,COMPLETE
1831,0.2636413927108303,2025-04-24 22:34:14.483175,2025-04-24 22:34:17.254986,0 days 00:00:02.771811,0.0674755314140863,11,sqrt,2,11,1365,0.8122549179749485,TPESampler,COMPLETE
1832,0.2713666993758025,2025-04-24 22:34:14.632933,2025-04-24 22:34:16.797165,0 days 00:00:02.164232,0.059188480554141235,11,sqrt,2,14,901,0.8182445774868113,TPESampler,COMPLETE
1833,0.2627205009884634,2025-04-24 22:34:17.048419,2025-04-24 22:34:19.816395,0 days 00:00:02.767976,0.05660833930803556,12,sqrt,3,16,1320,0.8858519666876948,TPESampler,COMPLETE
1834,0.35198246296306684,2025-04-24 22:34:17.636993,2025-04-24 22:34:19.668084,0 days 00:00:02.031091,0.011823088440276026,8,sqrt,4,6,912,0.7514394068822159,TPESampler,COMPLETE
1835,0.2633799287978827,2025-04-24 22:34:19.863631,2025-04-24 22:34:23.047638,0 days 00:00:03.184007,0.09879259368777657,10,sqrt,2,14,1446,0.8880205061138279,TPESampler,COMPLETE
1836,0.25341958748202437,2025-04-24 22:34:20.038448,2025-04-24 22:34:23.486206,0 days 00:00:03.447758,0.047504141438598185,11,sqrt,2,9,1472,0.7185500179803499,TPESampler,COMPLETE
1837,0.2385317807656539,2025-04-24 22:34:21.669418,2025-04-24 22:34:24.890406,0 days 00:00:03.220988,0.037783322201584375,12,sqrt,1,9,1240,0.8526658440717345,TPESampler,COMPLETE
1838,0.25078853745756363,2025-04-24 22:34:23.256558,2025-04-24 22:34:26.281242,0 days 00:00:03.024684,0.05225372180281183,12,sqrt,1,17,1250,0.7998616903524343,TPESampler,COMPLETE
1839,0.24500579386739893,2025-04-24 22:34:23.788041,2025-04-24 22:34:26.704747,0 days 00:00:02.916706,0.08852383482473065,10,sqrt,1,20,1272,0.7858261586093982,TPESampler,COMPLETE
1840,0.2837499638180239,2025-04-24 22:34:25.102596,2025-04-24 22:34:34.150643,0 days 00:00:09.048047,0.06489752536818229,11,,1,10,1487,0.7009989109742267,TPESampler,COMPLETE
1841,0.23429044757081133,2025-04-24 22:34:26.479786,2025-04-24 22:34:28.924457,0 days 00:00:02.444671,0.09777342952989079,11,sqrt,1,14,1154,0.8076779749208864,TPESampler,COMPLETE
