number,value,datetime_start,datetime_complete,duration,params_learning_rate,params_max_depth,params_max_features,params_min_samples_leaf,params_min_samples_split,params_n_estimators,params_subsample,system_attrs_auto:sampler,state
2208,0.24846324383668567,2025-04-24 22:41:28.943342,2025-04-24 22:41:32.599405,0 days 00:00:03.656063,0.06757726586438384,10,sqrt,1,20,1296,0.8925983107613301,TPESampler,COMPLETE
2209,0.2590762627375574,2025-04-24 22:41:29.255460,2025-04-24 22:41:32.949732,0 days 00:00:03.694272,0.08711081554649958,12,sqrt,3,11,1345,0.8726965813866112,TPESampler,COMPLETE
2210,0.2303560921232277,2025-04-24 22:41:29.763269,2025-04-24 22:41:33.705212,0 days 00:00:03.941943,0.09204239428854773,12,sqrt,1,16,1440,0.8286130000958831,TPESampler,COMPLETE
2211,0.22745952505531578,2025-04-24 22:41:32.796537,2025-04-24 22:41:36.545240,0 days 00:00:03.748703,0.09285640645916735,10,sqrt,1,14,1487,0.9502603907820234,TPESampler,COMPLETE
2212,0.4269314495666471,2025-04-24 22:41:33.218638,2025-04-24 22:41:36.605990,0 days 00:00:03.387352,0.03436171212865325,3,sqrt,9,16,1424,0.8468973617388876,TPESampler,COMPLETE
2213,0.22748185566267246,2025-04-24 22:41:33.920936,2025-04-24 22:41:37.644926,0 days 00:00:03.723990,0.09792763477819671,12,sqrt,1,14,1286,0.9268801068310659,TPESampler,COMPLETE
2214,0.539456825614432,2025-04-24 22:41:36.707694,2025-04-24 22:41:39.028944,0 days 00:00:02.321250,0.01115602621322693,5,log2,5,15,854,0.9569755008551953,TPESampler,COMPLETE
2215,0.26570413666213405,2025-04-24 22:41:36.847561,2025-04-24 22:41:40.160370,0 days 00:00:03.312809,0.06361200094603664,10,sqrt,2,14,1173,0.9939051207175125,TPESampler,COMPLETE
2216,0.26259353167283783,2025-04-24 22:41:37.901743,2025-04-24 22:41:40.964614,0 days 00:00:03.062871,0.07880595999739566,12,sqrt,3,14,1197,0.9303105860710268,TPESampler,COMPLETE
2217,0.3417267993537925,2025-04-24 22:41:39.238134,2025-04-24 22:41:43.845673,0 days 00:00:04.607539,0.037537592989303176,6,,6,3,802,0.9026264785628848,TPESampler,COMPLETE
2218,0.25837464205049615,2025-04-24 22:41:40.364551,2025-04-24 22:41:43.406502,0 days 00:00:03.041951,0.09325020830710284,11,sqrt,2,7,1427,0.9322775935105396,TPESampler,COMPLETE
2219,0.2409887642105114,2025-04-24 22:41:41.180730,2025-04-24 22:41:43.532756,0 days 00:00:02.352026,0.07524650475093556,10,sqrt,1,12,1128,0.9775334721430333,TPESampler,COMPLETE
2220,0.23499935454879312,2025-04-24 22:41:43.601885,2025-04-24 22:41:47.605715,0 days 00:00:04.003830,0.07787369144109704,11,sqrt,1,14,1397,0.9835254189673418,TPESampler,COMPLETE
2221,0.6276671722810242,2025-04-24 22:41:43.744452,2025-04-24 22:41:44.937845,0 days 00:00:01.193393,0.02802404651007253,11,log2,4,3,120,0.8140722228687278,TPESampler,COMPLETE
2222,0.4430801621414144,2025-04-24 22:41:44.113873,2025-04-24 22:41:47.236130,0 days 00:00:03.122257,0.04656087787780575,12,log2,9,19,1310,0.9902296461733359,TPESampler,COMPLETE
2223,0.23875881536489946,2025-04-24 22:41:45.182707,2025-04-24 22:41:49.101190,0 days 00:00:03.918483,0.07435932798539452,11,sqrt,1,14,1440,0.9579886917166919,TPESampler,COMPLETE
2224,0.2454498726675374,2025-04-24 22:41:47.454610,2025-04-24 22:41:51.014910,0 days 00:00:03.560300,0.0883834068829849,10,sqrt,1,13,1458,0.9538335155560214,TPESampler,COMPLETE
2225,0.26254299044514484,2025-04-24 22:41:47.870613,2025-04-24 22:41:51.016202,0 days 00:00:03.145589,0.058605335362961586,11,sqrt,2,13,1203,0.9157312347523436,TPESampler,COMPLETE
2226,0.2623676507188849,2025-04-24 22:41:49.315901,2025-04-24 22:41:52.603581,0 days 00:00:03.287680,0.07200525026412469,9,sqrt,2,13,1342,0.9780484201991251,TPESampler,COMPLETE
2227,0.24299598999064848,2025-04-24 22:41:51.174049,2025-04-24 22:41:54.444473,0 days 00:00:03.270424,0.07160379395325552,11,sqrt,1,15,1489,0.9640655404394283,TPESampler,COMPLETE
2228,0.28407651064315076,2025-04-24 22:41:51.215124,2025-04-24 22:41:57.551563,0 days 00:00:06.336439,0.02375771100331521,6,,1,5,1349,0.6668321897921708,TPESampler,COMPLETE
2229,0.23789566730008502,2025-04-24 22:41:52.823722,2025-04-24 22:41:55.806323,0 days 00:00:02.982601,0.0946479346313301,12,sqrt,1,11,1340,0.8239477647913428,TPESampler,COMPLETE
2230,0.25129568432662974,2025-04-24 22:41:54.644349,2025-04-24 22:41:57.701494,0 days 00:00:03.057145,0.07879546730725977,9,sqrt,2,11,1490,0.9211959927976271,TPESampler,COMPLETE
2231,0.25261780311672316,2025-04-24 22:41:56.009902,2025-04-24 22:41:59.442431,0 days 00:00:03.432529,0.08742061033273796,11,sqrt,2,13,1455,0.9082863646188553,TPESampler,COMPLETE
2232,0.24304149371315242,2025-04-24 22:41:57.751029,2025-04-24 22:42:00.761642,0 days 00:00:03.010613,0.09440947064510556,10,sqrt,1,12,1163,0.9743598367157544,TPESampler,COMPLETE
2233,0.2518224229689786,2025-04-24 22:41:57.932092,2025-04-24 22:42:01.321776,0 days 00:00:03.389684,0.06440029808072537,9,sqrt,1,12,1281,0.9000633398350967,TPESampler,COMPLETE
2234,0.26619135972456065,2025-04-24 22:41:59.655890,2025-04-24 22:42:03.610278,0 days 00:00:03.954388,0.08096070026002204,11,sqrt,2,15,1476,0.922887242691211,TPESampler,COMPLETE
2235,0.5177978646518525,2025-04-24 22:42:00.979325,2025-04-24 22:42:03.614785,0 days 00:00:02.635460,0.01064595939535822,11,log2,7,6,1102,0.950595418518418,TPESampler,COMPLETE
2236,0.2526589683127514,2025-04-24 22:42:01.569000,2025-04-24 22:42:05.325372,0 days 00:00:03.756372,0.0815752753104046,11,sqrt,1,10,1355,0.9701229019040911,TPESampler,COMPLETE
2237,0.25096807957377104,2025-04-24 22:42:03.781194,2025-04-24 22:42:07.493085,0 days 00:00:03.711891,0.07982502438722139,10,sqrt,2,14,1461,0.9642375988265098,TPESampler,COMPLETE
2238,0.22285705728083774,2025-04-24 22:42:03.835047,2025-04-24 22:42:07.667236,0 days 00:00:03.832189,0.09564260930738046,10,sqrt,1,15,1500,0.9772860878852452,TPESampler,COMPLETE
2239,0.25507975080525985,2025-04-24 22:42:05.543395,2025-04-24 22:42:09.105806,0 days 00:00:03.562411,0.09015093169827952,11,sqrt,2,10,1475,0.9679047230161888,TPESampler,COMPLETE
2240,0.23660163436585024,2025-04-24 22:42:07.749410,2025-04-24 22:42:11.247774,0 days 00:00:03.498364,0.09109021480969239,8,sqrt,1,17,1434,0.9903605558384119,TPESampler,COMPLETE
2241,0.3975525176167583,2025-04-24 22:42:07.887542,2025-04-24 22:42:11.246025,0 days 00:00:03.358483,0.024720156969585266,6,log2,2,15,615,0.7414102913729108,TPESampler,COMPLETE
2242,0.23142607269536752,2025-04-24 22:42:09.478229,2025-04-24 22:42:14.411282,0 days 00:00:04.933053,0.0775642854291098,8,sqrt,1,16,1498,0.9511561335743851,TPESampler,COMPLETE
2243,0.26589397958751537,2025-04-24 22:42:11.452301,2025-04-24 22:42:15.174111,0 days 00:00:03.721810,0.0961329020974564,10,sqrt,3,15,1327,0.9591678574584508,TPESampler,COMPLETE
2244,0.2614077044739956,2025-04-24 22:42:11.513616,2025-04-24 22:42:15.654923,0 days 00:00:04.141307,0.0605896385996944,11,sqrt,2,13,1473,0.9873143132643285,TPESampler,COMPLETE
2245,0.2644296163453255,2025-04-24 22:42:14.633958,2025-04-24 22:42:18.315965,0 days 00:00:03.682007,0.0736794684115043,11,sqrt,2,16,1485,0.9640375902286252,TPESampler,COMPLETE
2246,0.3430717832840294,2025-04-24 22:42:15.415127,2025-04-24 22:42:17.368906,0 days 00:00:01.953779,0.02833157243906521,5,sqrt,1,16,557,0.9967089750916471,TPESampler,COMPLETE
2247,0.25615382895068045,2025-04-24 22:42:16.118062,2025-04-24 22:42:19.510155,0 days 00:00:03.392093,0.08887450720168732,10,sqrt,1,18,1381,0.9750677223814902,TPESampler,COMPLETE
2248,0.2659512495930562,2025-04-24 22:42:17.583903,2025-04-24 22:42:21.203341,0 days 00:00:03.619438,0.09688634378112694,9,sqrt,2,14,1374,0.9372626879115961,TPESampler,COMPLETE
2249,0.2654672033863198,2025-04-24 22:42:18.550232,2025-04-24 22:42:22.015843,0 days 00:00:03.465611,0.09911795300917464,11,sqrt,2,14,1374,0.9523021646549762,TPESampler,COMPLETE
2250,0.24891505001267422,2025-04-24 22:42:19.722064,2025-04-24 22:42:23.046957,0 days 00:00:03.324893,0.08824258036968773,10,sqrt,1,10,1352,0.9363750389508004,TPESampler,COMPLETE
2251,0.2576056096916525,2025-04-24 22:42:21.457689,2025-04-24 22:42:24.997096,0 days 00:00:03.539407,0.08876536670953776,10,sqrt,2,16,1474,0.9373457047570217,TPESampler,COMPLETE
2252,0.23871360775696093,2025-04-24 22:42:22.332731,2025-04-24 22:42:25.890702,0 days 00:00:03.557971,0.09145089159516923,11,sqrt,1,16,1337,0.9422442995703937,TPESampler,COMPLETE
2253,0.2319406292164389,2025-04-24 22:42:23.431006,2025-04-24 22:42:27.133617,0 days 00:00:03.702611,0.09328405255908923,11,sqrt,1,15,1396,0.9373946545141714,TPESampler,COMPLETE
2254,0.25980173586624306,2025-04-24 22:42:25.209659,2025-04-24 22:42:28.816077,0 days 00:00:03.606418,0.06388862159257183,11,sqrt,3,17,1477,0.989323655638507,TPESampler,COMPLETE
2255,0.25679596823190226,2025-04-24 22:42:26.110999,2025-04-24 22:42:29.636115,0 days 00:00:03.525116,0.0877414253502324,10,sqrt,2,13,1430,0.9945647980288387,TPESampler,COMPLETE
2256,0.273505964859625,2025-04-24 22:42:27.345163,2025-04-24 22:42:30.740981,0 days 00:00:03.395818,0.0677065936341881,8,sqrt,3,11,1436,0.9838574114568674,TPESampler,COMPLETE
2257,0.24718394493557158,2025-04-24 22:42:29.023297,2025-04-24 22:42:32.472015,0 days 00:00:03.448718,0.05777601642825196,12,sqrt,1,17,1498,0.9949482405856264,TPESampler,COMPLETE
2258,0.31097215672207,2025-04-24 22:42:29.926384,2025-04-24 22:42:39.178754,0 days 00:00:09.252370,0.0642987550720382,8,,5,20,1448,0.9730496153720831,TPESampler,COMPLETE
2259,0.2557599207714193,2025-04-24 22:42:30.932308,2025-04-24 22:42:33.785529,0 days 00:00:02.853221,0.09012119640234133,10,sqrt,2,15,1411,0.9446171276918665,TPESampler,COMPLETE
2260,0.2522981388428021,2025-04-24 22:42:32.669312,2025-04-24 22:42:35.123724,0 days 00:00:02.454412,0.08776660875581803,11,sqrt,2,13,1099,0.9798054874195424,TPESampler,COMPLETE
2261,0.27394172254716015,2025-04-24 22:42:33.988500,2025-04-24 22:42:36.832158,0 days 00:00:02.843658,0.09511980331856,9,sqrt,4,14,1417,0.9504385854446654,TPESampler,COMPLETE
2262,0.3098253228455133,2025-04-24 22:42:35.326190,2025-04-24 22:42:37.987164,0 days 00:00:02.660974,0.06608066946891847,7,log2,3,13,1494,0.9286695349604549,TPESampler,COMPLETE
2263,0.24607705980879255,2025-04-24 22:42:37.040532,2025-04-24 22:42:40.259326,0 days 00:00:03.218794,0.09091634132778631,10,sqrt,1,15,1449,0.8971879922272861,TPESampler,COMPLETE
2264,0.23703256438182987,2025-04-24 22:42:38.187418,2025-04-24 22:42:41.679952,0 days 00:00:03.492534,0.08762988005225239,11,sqrt,1,13,1483,0.8714932887211513,TPESampler,COMPLETE
2265,0.26546139956076453,2025-04-24 22:42:39.388717,2025-04-24 22:42:42.649248,0 days 00:00:03.260531,0.056269710884991095,12,sqrt,3,11,1289,0.9421515067682581,TPESampler,COMPLETE
2266,0.2444575621557061,2025-04-24 22:42:40.464588,2025-04-24 22:42:43.358231,0 days 00:00:02.893643,0.06770262950288537,12,sqrt,1,16,1094,0.9974389556199421,TPESampler,COMPLETE
2267,0.23541820822610812,2025-04-24 22:42:41.919345,2025-04-24 22:42:44.786631,0 days 00:00:02.867286,0.09913049308372421,12,sqrt,1,11,1140,0.836187936762553,TPESampler,COMPLETE
2268,0.2578484399568778,2025-04-24 22:42:42.910602,2025-04-24 22:42:45.958441,0 days 00:00:03.047839,0.03474880073224792,10,sqrt,1,14,1217,0.9975553682675892,TPESampler,COMPLETE
2269,0.2709680102440151,2025-04-24 22:42:43.747255,2025-04-24 22:42:47.359742,0 days 00:00:03.612487,0.058115948073263785,11,sqrt,3,13,1394,0.9020440838530267,TPESampler,COMPLETE
2270,0.24051572211085065,2025-04-24 22:42:45.221450,2025-04-24 22:42:48.321480,0 days 00:00:03.100030,0.06598184374797986,12,sqrt,1,10,1191,0.8920216122442485,TPESampler,COMPLETE
2271,0.3011385602110379,2025-04-24 22:42:46.206203,2025-04-24 22:42:49.665119,0 days 00:00:03.458916,0.07702904642955972,10,log2,3,16,1325,0.8466014117846654,TPESampler,COMPLETE
2272,0.2679418886848655,2025-04-24 22:42:47.964728,2025-04-24 22:42:51.032943,0 days 00:00:03.068215,0.05676565049304086,10,sqrt,2,17,1171,0.9244917189928276,TPESampler,COMPLETE
2273,0.26244849808062476,2025-04-24 22:42:48.718434,2025-04-24 22:42:52.083558,0 days 00:00:03.365124,0.09707534979609378,12,sqrt,2,10,1267,0.9041758346469004,TPESampler,COMPLETE
2274,0.23949897350525423,2025-04-24 22:42:49.990987,2025-04-24 22:42:53.164907,0 days 00:00:03.173920,0.09254835652775943,11,sqrt,1,13,1137,0.9427447734476782,TPESampler,COMPLETE
2275,0.4208619963901995,2025-04-24 22:42:51.242178,2025-04-24 22:42:53.365053,0 days 00:00:02.122875,0.08258004176838281,9,sqrt,10,12,634,0.9566635971891605,TPESampler,COMPLETE
2276,0.3379529712795764,2025-04-24 22:42:52.332575,2025-04-24 22:42:55.239300,0 days 00:00:02.906725,0.09746244786336819,7,sqrt,6,11,1391,0.6156376084169786,TPESampler,COMPLETE
2277,0.24194190314462125,2025-04-24 22:42:53.458529,2025-04-24 22:42:57.171958,0 days 00:00:03.713429,0.09223968412650693,10,sqrt,1,15,1216,0.9984661553785257,TPESampler,COMPLETE
2278,0.6118373392052092,2025-04-24 22:42:53.595775,2025-04-24 22:42:55.392366,0 days 00:00:01.796591,0.010839760849854035,12,sqrt,7,13,263,0.603240548409029,TPESampler,COMPLETE
2279,0.2663838096273352,2025-04-24 22:42:55.477734,2025-04-24 22:42:58.595876,0 days 00:00:03.118142,0.047570251621945045,7,sqrt,1,16,1399,0.9790754386135967,TPESampler,COMPLETE
2280,0.3111706189412685,2025-04-24 22:42:55.676633,2025-04-24 22:42:58.298513,0 days 00:00:02.621880,0.017841615916417693,12,sqrt,4,3,934,0.8465934306029658,TPESampler,COMPLETE
2281,0.57280556015826,2025-04-24 22:42:57.397747,2025-04-24 22:42:58.831597,0 days 00:00:01.433850,0.011950899717447184,7,sqrt,6,15,191,0.9656682631348743,TPESampler,COMPLETE
2282,0.24426568794444387,2025-04-24 22:42:58.606057,2025-04-24 22:43:01.931235,0 days 00:00:03.325178,0.08291692591763075,9,sqrt,1,13,1280,0.9895380360047783,TPESampler,COMPLETE
2283,0.24856264185787727,2025-04-24 22:42:58.794454,2025-04-24 22:43:02.127176,0 days 00:00:03.332722,0.08648981374799938,10,sqrt,1,16,1286,0.9634831064131986,TPESampler,COMPLETE
2284,0.2326846714288786,2025-04-24 22:42:59.181876,2025-04-24 22:43:02.602166,0 days 00:00:03.420290,0.08281649000846783,12,sqrt,1,13,1258,0.980288510941613,TPESampler,COMPLETE
2285,0.2703716622584969,2025-04-24 22:43:02.121434,2025-04-24 22:43:05.327214,0 days 00:00:03.205780,0.08229748053285267,10,sqrt,3,10,1335,0.9042075883078231,TPESampler,COMPLETE
2286,0.25528264663163924,2025-04-24 22:43:02.337909,2025-04-24 22:43:05.690292,0 days 00:00:03.352383,0.08238059889002247,10,sqrt,1,11,1405,0.9172359919486869,TPESampler,COMPLETE
2287,0.36322900361686394,2025-04-24 22:43:02.971483,2025-04-24 22:43:05.863721,0 days 00:00:02.892238,0.0268196160073471,3,,1,17,672,0.7829844912015386,TPESampler,COMPLETE
2288,0.2516290696919166,2025-04-24 22:43:05.537503,2025-04-24 22:43:08.818240,0 days 00:00:03.280737,0.09872022679141755,12,sqrt,1,13,1248,0.9452561967919079,TPESampler,COMPLETE
2289,0.24657695973954658,2025-04-24 22:43:05.932551,2025-04-24 22:43:09.805940,0 days 00:00:03.873389,0.08964127892605626,12,sqrt,1,11,1414,0.9611404954996182,TPESampler,COMPLETE
2290,0.2639647039713196,2025-04-24 22:43:06.090609,2025-04-24 22:43:10.056604,0 days 00:00:03.965995,0.09953292091549738,9,sqrt,2,14,1500,0.8856612631024925,TPESampler,COMPLETE
2291,0.2545770472349006,2025-04-24 22:43:09.024117,2025-04-24 22:43:12.466396,0 days 00:00:03.442279,0.08935299980065674,12,log2,1,18,1263,0.9128473863042313,TPESampler,COMPLETE
2292,0.23073528730351017,2025-04-24 22:43:10.020589,2025-04-24 22:43:13.676953,0 days 00:00:03.656364,0.09939916931317931,11,sqrt,1,15,1391,0.9009468680356396,TPESampler,COMPLETE
2293,0.24438441310109713,2025-04-24 22:43:10.291597,2025-04-24 22:43:14.019677,0 days 00:00:03.728080,0.09022287063432023,12,sqrt,1,15,1461,0.8856229054980015,TPESampler,COMPLETE
2294,0.3778909132386706,2025-04-24 22:43:12.678227,2025-04-24 22:43:14.416437,0 days 00:00:01.738210,0.057317692371087504,3,,1,2,252,0.9028097227048407,TPESampler,COMPLETE
2295,0.26144525571030985,2025-04-24 22:43:13.878427,2025-04-24 22:43:16.932696,0 days 00:00:03.054269,0.08498573171075446,11,sqrt,2,13,1095,0.8906221109009813,TPESampler,COMPLETE
2296,0.23043928392447294,2025-04-24 22:43:14.320034,2025-04-24 22:43:17.233325,0 days 00:00:02.913291,0.09849667381887629,12,sqrt,1,13,1077,0.9898962527138085,TPESampler,COMPLETE
2297,0.24940149720021051,2025-04-24 22:43:14.769003,2025-04-24 22:43:18.428217,0 days 00:00:03.659214,0.09919598725302531,10,sqrt,1,14,1384,0.9472524912848653,TPESampler,COMPLETE
2298,0.2300525238042414,2025-04-24 22:43:17.156902,2025-04-24 22:43:20.514927,0 days 00:00:03.358025,0.09054396027654772,9,sqrt,1,13,1336,0.9109600807426588,TPESampler,COMPLETE
2299,0.255262908279289,2025-04-24 22:43:17.537263,2025-04-24 22:43:20.678472,0 days 00:00:03.141209,0.0834450524059595,12,sqrt,2,15,1203,0.9637860238035965,TPESampler,COMPLETE
2300,0.5219041636404037,2025-04-24 22:43:18.632279,2025-04-24 22:43:20.225489,0 days 00:00:01.593210,0.01406282863993751,4,sqrt,7,8,412,0.7162146450391967,TPESampler,COMPLETE
2301,0.2675361793024381,2025-04-24 22:43:20.428954,2025-04-24 22:43:23.824851,0 days 00:00:03.395897,0.09603214006846637,10,sqrt,2,13,1366,0.982646444195544,TPESampler,COMPLETE
2302,0.4258522565732369,2025-04-24 22:43:20.781836,2025-04-24 22:43:22.103451,0 days 00:00:01.321615,0.08997455640657698,5,log2,1,18,170,0.7662099577056886,TPESampler,COMPLETE
2303,0.25307455938965345,2025-04-24 22:43:20.968323,2025-04-24 22:43:24.818236,0 days 00:00:03.849913,0.09666301779205563,9,sqrt,2,17,1488,0.9425458371627895,TPESampler,COMPLETE
2304,0.22715955247061134,2025-04-24 22:43:22.302605,2025-04-24 22:43:25.960602,0 days 00:00:03.657997,0.08181587067005702,9,sqrt,1,12,1490,0.9736468385279966,TPESampler,COMPLETE
2305,0.24798912139971152,2025-04-24 22:43:24.035353,2025-04-24 22:43:27.729575,0 days 00:00:03.694222,0.05294649738456655,12,sqrt,1,19,1471,0.8964569894241153,TPESampler,COMPLETE
2306,0.27696161576025563,2025-04-24 22:43:25.029527,2025-04-24 22:43:28.727871,0 days 00:00:03.698344,0.05081142534701701,8,sqrt,2,16,1480,0.7164642572178495,TPESampler,COMPLETE
2307,0.28082315015557346,2025-04-24 22:43:26.163725,2025-04-24 22:43:29.105532,0 days 00:00:02.941807,0.06037655838505332,9,sqrt,4,11,1124,0.9926327641345261,TPESampler,COMPLETE
2308,0.26855028502525796,2025-04-24 22:43:27.942075,2025-04-24 22:43:31.606630,0 days 00:00:03.664555,0.058957647680398614,9,sqrt,3,14,1432,0.8856119421910706,TPESampler,COMPLETE
2309,0.5605129714638993,2025-04-24 22:43:28.939523,2025-04-24 22:43:30.739021,0 days 00:00:01.799498,0.020825887247112693,8,log2,7,8,560,0.8158125658275773,TPESampler,COMPLETE
2310,0.24341341443028164,2025-04-24 22:43:29.407572,2025-04-24 22:43:33.153277,0 days 00:00:03.745705,0.0963411848438202,10,sqrt,1,12,1481,0.9832300109185844,TPESampler,COMPLETE
2311,0.26075419284642437,2025-04-24 22:43:30.953245,2025-04-24 22:43:34.522585,0 days 00:00:03.569340,0.0891017632948161,9,sqrt,2,11,1449,0.9701578129484402,TPESampler,COMPLETE
2312,0.2591133147146132,2025-04-24 22:43:31.841574,2025-04-24 22:43:35.151395,0 days 00:00:03.309821,0.09165173751616766,9,sqrt,1,14,1362,0.9788065992081131,TPESampler,COMPLETE
2313,0.428235624242896,2025-04-24 22:43:33.364823,2025-04-24 22:43:36.478784,0 days 00:00:03.113961,0.018798230004695892,3,,9,20,720,0.743406693904553,TPESampler,COMPLETE
2314,0.273426340631497,2025-04-24 22:43:34.741573,2025-04-24 22:43:38.282219,0 days 00:00:03.540646,0.08641843149558452,12,log2,1,13,1430,0.9164589876080502,TPESampler,COMPLETE
2315,0.24874059687665703,2025-04-24 22:43:35.411268,2025-04-24 22:43:38.638495,0 days 00:00:03.227227,0.06253247453030421,8,sqrt,1,10,1294,0.9613335398165174,TPESampler,COMPLETE
2316,0.2544649024472068,2025-04-24 22:43:36.684835,2025-04-24 22:43:40.095958,0 days 00:00:03.411123,0.054695238537096985,9,sqrt,1,10,1232,0.9983561505279626,TPESampler,COMPLETE
2317,0.28074004242892253,2025-04-24 22:43:38.497631,2025-04-24 22:43:41.639670,0 days 00:00:03.142039,0.09106656577611864,10,log2,2,17,1298,0.9962897162523713,TPESampler,COMPLETE
2318,0.2474456301374032,2025-04-24 22:43:38.923708,2025-04-24 22:43:42.701577,0 days 00:00:03.777869,0.07057268850091555,11,sqrt,1,11,1488,0.9925048706435948,TPESampler,COMPLETE
2319,0.36498913972452274,2025-04-24 22:43:40.328430,2025-04-24 22:43:42.264139,0 days 00:00:01.935709,0.05187667573160309,12,sqrt,6,12,539,0.740080638134672,TPESampler,COMPLETE
2320,0.2659502337893548,2025-04-24 22:43:41.850575,2025-04-24 22:43:45.785812,0 days 00:00:03.935237,0.0719995785735494,9,sqrt,2,11,1466,0.9739503397289577,TPESampler,COMPLETE
2321,0.2764466841373187,2025-04-24 22:43:42.626038,2025-04-24 22:43:46.254855,0 days 00:00:03.628817,0.05509662172459862,9,sqrt,2,14,1437,0.8979099777600811,TPESampler,COMPLETE
2322,0.2455563539026955,2025-04-24 22:43:42.930051,2025-04-24 22:43:46.313970,0 days 00:00:03.383919,0.06491507333229381,9,sqrt,1,13,1346,0.9822342438613954,TPESampler,COMPLETE
2323,0.2699137602396249,2025-04-24 22:43:45.985868,2025-04-24 22:43:49.788772,0 days 00:00:03.802904,0.074054160653461,10,sqrt,3,15,1459,0.9325758986992457,TPESampler,COMPLETE
2324,0.2510253601237898,2025-04-24 22:43:46.502406,2025-04-24 22:43:50.161928,0 days 00:00:03.659522,0.06010366208082373,10,sqrt,1,14,1379,0.9907651961359172,TPESampler,COMPLETE
2325,0.2432654601836341,2025-04-24 22:43:46.527795,2025-04-24 22:43:50.638274,0 days 00:00:04.110479,0.05942906792033693,10,sqrt,1,13,1473,0.9371708805358591,TPESampler,COMPLETE
2326,0.2672323077535026,2025-04-24 22:43:49.994428,2025-04-24 22:43:53.188708,0 days 00:00:03.194280,0.06509062368958012,9,sqrt,3,12,1467,0.9511665626520718,TPESampler,COMPLETE
2327,0.2510746614384904,2025-04-24 22:43:50.396082,2025-04-24 22:43:53.443934,0 days 00:00:03.047852,0.05857743854673509,9,sqrt,1,12,1422,0.8846627258282336,TPESampler,COMPLETE
2328,0.27911779811431975,2025-04-24 22:43:50.918036,2025-04-24 22:43:58.349849,0 days 00:00:07.431813,0.025451238102990315,6,,1,19,1493,0.9504534794435926,TPESampler,COMPLETE
2329,0.5661449420168038,2025-04-24 22:43:53.400561,2025-04-24 22:43:54.567651,0 days 00:00:01.167090,0.010167768858859947,12,sqrt,10,2,362,0.827997902682053,TPESampler,COMPLETE
