number,value,datetime_start,datetime_complete,duration,params_learning_rate,params_max_depth,params_max_features,params_min_samples_leaf,params_min_samples_split,params_n_estimators,params_subsample,system_attrs_auto:sampler,state
1107,0.2548520147845312,2025-04-24 22:20:38.824543,2025-04-24 22:20:41.829385,0 days 00:00:03.004842,0.07855782199502782,8,sqrt,1,15,1258,0.7516991780751441,TPESampler,COMPLETE
1108,0.26025006459042865,2025-04-24 22:20:39.601004,2025-04-24 22:20:42.510875,0 days 00:00:02.909871,0.09512323800445087,10,sqrt,2,11,1308,0.8647874878706656,TPESampler,COMPLETE
1109,0.2644363109679108,2025-04-24 22:20:40.844006,2025-04-24 22:20:47.494387,0 days 00:00:06.650381,0.08990993196999852,9,,1,19,1163,0.8171240811304374,TPESampler,COMPLETE
1110,0.24645641824618733,2025-04-24 22:20:42.046066,2025-04-24 22:20:43.945845,0 days 00:00:01.899779,0.09644359545173815,9,sqrt,1,16,939,0.7974182029677971,TPESampler,COMPLETE
1111,0.35672814660167135,2025-04-24 22:20:42.716707,2025-04-24 22:20:45.961166,0 days 00:00:03.244459,0.012016440639455804,8,,3,14,522,0.984020150503713,TPESampler,COMPLETE
1112,0.27219165752977353,2025-04-24 22:20:44.129790,2025-04-24 22:20:45.894004,0 days 00:00:01.764214,0.09873388869756898,8,sqrt,3,9,987,0.9101996813371342,TPESampler,COMPLETE
1113,0.48037840288631767,2025-04-24 22:20:46.141709,2025-04-24 22:20:49.556085,0 days 00:00:03.414376,0.01438637382995807,11,log2,5,5,996,0.6927812022478964,TPESampler,COMPLETE
1114,0.24837018509868658,2025-04-24 22:20:46.226677,2025-04-24 22:20:50.317711,0 days 00:00:04.091034,0.05561721060575926,10,sqrt,1,13,1166,0.8550038430461202,TPESampler,COMPLETE
1115,0.29342186106577467,2025-04-24 22:20:47.775043,2025-04-24 22:20:51.158741,0 days 00:00:03.383698,0.08064030765314319,8,log2,2,16,1477,0.762218657267804,TPESampler,COMPLETE
1116,0.24421870805677484,2025-04-24 22:20:49.744918,2025-04-24 22:20:52.692772,0 days 00:00:02.947854,0.09928332227060248,8,sqrt,1,20,1195,0.8428792781983792,TPESampler,COMPLETE
1117,0.24328557974120868,2025-04-24 22:20:50.539076,2025-04-24 22:20:53.400825,0 days 00:00:02.861749,0.09470841341635182,7,sqrt,1,14,1106,0.7851025630869085,TPESampler,COMPLETE
1118,0.26382443409164147,2025-04-24 22:20:51.383131,2025-04-24 22:20:54.130470,0 days 00:00:02.747339,0.09483407173480415,10,sqrt,3,12,1139,0.7891740812798731,TPESampler,COMPLETE
1119,0.25265239668649214,2025-04-24 22:20:52.894279,2025-04-24 22:20:56.026232,0 days 00:00:03.131953,0.04742895657704389,10,sqrt,1,16,1369,0.9201492634651379,TPESampler,COMPLETE
1120,0.4225732108428319,2025-04-24 22:20:53.598941,2025-04-24 22:20:55.524473,0 days 00:00:01.925532,0.08749869381571039,7,sqrt,8,17,646,0.6249710352083462,TPESampler,COMPLETE
1121,0.31785887522037815,2025-04-24 22:20:54.330996,2025-04-24 22:20:56.806586,0 days 00:00:02.475590,0.05411242848994591,8,,4,20,273,0.8911489175683663,TPESampler,COMPLETE
1122,0.292761955194055,2025-04-24 22:20:55.710524,2025-04-24 22:20:58.284721,0 days 00:00:02.574197,0.0516137228832503,11,log2,2,19,1191,0.8956201355683312,TPESampler,COMPLETE
1123,0.27552558333512817,2025-04-24 22:20:56.226261,2025-04-24 22:20:58.831002,0 days 00:00:02.604741,0.09502089608084072,8,sqrt,3,14,1017,0.8848460502361305,TPESampler,COMPLETE
1124,0.2793493984119343,2025-04-24 22:20:57.052443,2025-04-24 22:21:00.454681,0 days 00:00:03.402238,0.05305060868671931,9,sqrt,2,14,1233,0.8655088297266449,TPESampler,COMPLETE
1125,0.5205631313633571,2025-04-24 22:20:58.479772,2025-04-24 22:21:01.736327,0 days 00:00:03.256555,0.021531643809075324,3,log2,8,5,1355,0.7127092444939583,TPESampler,COMPLETE
1126,0.25059546135851246,2025-04-24 22:20:59.049192,2025-04-24 22:21:02.322788,0 days 00:00:03.273596,0.09437059256538977,7,sqrt,1,14,1247,0.9751121249110338,TPESampler,COMPLETE
1127,0.3889934083372881,2025-04-24 22:21:00.657882,2025-04-24 22:21:03.004219,0 days 00:00:02.346337,0.02444547771956322,4,sqrt,7,12,838,0.9620455524473229,TPESampler,COMPLETE
1128,0.3072687880188811,2025-04-24 22:21:01.938831,2025-04-24 22:21:07.461285,0 days 00:00:05.522454,0.018849065825152046,12,,5,18,867,0.7250298038089608,TPESampler,COMPLETE
1129,0.27269919710577595,2025-04-24 22:21:02.510657,2025-04-24 22:21:04.634419,0 days 00:00:02.123762,0.09564494555595196,4,sqrt,1,12,1037,0.9114963573625791,TPESampler,COMPLETE
1130,0.5894819734344307,2025-04-24 22:21:03.214840,2025-04-24 22:21:04.722835,0 days 00:00:01.507995,0.02361324135101794,4,log2,10,12,690,0.8378454153885988,TPESampler,COMPLETE
1131,0.2621763118789546,2025-04-24 22:21:04.804155,2025-04-24 22:21:07.713733,0 days 00:00:02.909578,0.09664636192286324,11,sqrt,2,15,1323,0.8846599484086263,TPESampler,COMPLETE
1132,0.3102033108712399,2025-04-24 22:21:04.931256,2025-04-24 22:21:07.740771,0 days 00:00:02.809515,0.09434047418619082,9,log2,4,18,1341,0.9150773575522955,TPESampler,COMPLETE
1133,0.25197141329354494,2025-04-24 22:21:07.659061,2025-04-24 22:21:10.673660,0 days 00:00:03.014599,0.06754958314064931,9,sqrt,1,17,1274,0.8397008027195629,TPESampler,COMPLETE
1134,0.27563700230310395,2025-04-24 22:21:07.951931,2025-04-24 22:21:11.399732,0 days 00:00:03.447801,0.04959771647169881,9,sqrt,3,18,1297,0.8675328788206375,TPESampler,COMPLETE
1135,0.2567105486394035,2025-04-24 22:21:08.001261,2025-04-24 22:21:11.209054,0 days 00:00:03.207793,0.08597163709594687,11,sqrt,2,11,1166,0.8644070139338723,TPESampler,COMPLETE
1136,0.2435902801580692,2025-04-24 22:21:10.878356,2025-04-24 22:21:14.010390,0 days 00:00:03.132034,0.08810705598681412,9,sqrt,1,18,1281,0.9296324812924276,TPESampler,COMPLETE
1137,0.2824059446487245,2025-04-24 22:21:11.442338,2025-04-24 22:21:14.871972,0 days 00:00:03.429634,0.055825590424237646,9,sqrt,3,18,1467,0.8727504694593151,TPESampler,COMPLETE
1138,0.34107968256784427,2025-04-24 22:21:11.681529,2025-04-24 22:21:13.594539,0 days 00:00:01.913010,0.08592257864670383,11,sqrt,7,4,616,0.9772184098212299,TPESampler,COMPLETE
1139,0.240098648708249,2025-04-24 22:21:13.818748,2025-04-24 22:21:16.952439,0 days 00:00:03.133691,0.05945993335399594,11,sqrt,1,14,1372,0.9883687794176725,TPESampler,COMPLETE
1140,0.2575746345794533,2025-04-24 22:21:14.207101,2025-04-24 22:21:17.229349,0 days 00:00:03.022248,0.06584202421379866,8,sqrt,1,9,1306,0.910574903941723,TPESampler,COMPLETE
1141,0.24563959271178326,2025-04-24 22:21:15.119023,2025-04-24 22:21:18.796442,0 days 00:00:03.677419,0.06075566617218603,10,sqrt,1,18,1441,0.9259066296119512,TPESampler,COMPLETE
1142,0.24693907555260342,2025-04-24 22:21:17.153799,2025-04-24 22:21:20.731494,0 days 00:00:03.577695,0.0993917868552526,8,sqrt,1,12,1489,0.91631220409194,TPESampler,COMPLETE
1143,0.4919265702207665,2025-04-24 22:21:17.454183,2025-04-24 22:21:19.779771,0 days 00:00:02.325588,0.08922766452840128,6,log2,10,5,952,0.6106366222998038,TPESampler,COMPLETE
1144,0.25290204987006504,2025-04-24 22:21:19.000252,2025-04-24 22:21:21.639506,0 days 00:00:02.639254,0.06430850942487674,11,sqrt,1,20,1038,0.8505632673759123,TPESampler,COMPLETE
1145,0.2630973265301634,2025-04-24 22:21:19.989965,2025-04-24 22:21:23.149490,0 days 00:00:03.159525,0.06504768882873194,10,sqrt,3,17,1480,0.7504248784458589,TPESampler,COMPLETE
1146,0.25233380130388366,2025-04-24 22:21:20.939521,2025-04-24 22:21:23.764369,0 days 00:00:02.824848,0.06996637543773157,9,sqrt,1,16,1307,0.7903898239596937,TPESampler,COMPLETE
1147,0.6151738022655092,2025-04-24 22:21:21.851661,2025-04-24 22:21:24.265622,0 days 00:00:02.413961,0.011996267540885461,9,log2,8,5,823,0.8399463986572532,TPESampler,COMPLETE
1148,0.24279197756130863,2025-04-24 22:21:23.534979,2025-04-24 22:21:26.679099,0 days 00:00:03.144120,0.09841990071702685,11,sqrt,1,10,1263,0.8654694839093864,TPESampler,COMPLETE
1149,0.2443947158265557,2025-04-24 22:21:24.118392,2025-04-24 22:21:26.324688,0 days 00:00:02.206296,0.0835311641055289,10,sqrt,1,12,858,0.7891940718452398,TPESampler,COMPLETE
1150,0.3631976811383399,2025-04-24 22:21:24.626319,2025-04-24 22:21:26.278575,0 days 00:00:01.652256,0.04403370321811562,8,,7,19,258,0.6111593236583379,TPESampler,COMPLETE
1151,0.29732405638363096,2025-04-24 22:21:26.421992,2025-04-24 22:21:29.232064,0 days 00:00:02.810072,0.0894569511003052,11,log2,3,6,1098,0.8540185752652504,TPESampler,COMPLETE
1152,0.33829358369435,2025-04-24 22:21:26.503812,2025-04-24 22:21:29.726494,0 days 00:00:03.222682,0.04247453819742908,5,sqrt,5,11,1299,0.6073687219653567,TPESampler,COMPLETE
1153,0.24258062724827853,2025-04-24 22:21:26.969284,2025-04-24 22:21:30.632446,0 days 00:00:03.663162,0.09289094173334636,8,sqrt,1,17,1499,0.7912938628853129,TPESampler,COMPLETE
1154,0.2469507110718707,2025-04-24 22:21:29.562199,2025-04-24 22:21:32.254253,0 days 00:00:02.692054,0.07519211980459628,10,sqrt,1,12,1094,0.9393608528026027,TPESampler,COMPLETE
1155,0.2690413075198283,2025-04-24 22:21:29.910206,2025-04-24 22:21:33.181566,0 days 00:00:03.271360,0.06134250517430077,11,sqrt,2,12,1390,0.8987406873417975,TPESampler,COMPLETE
1156,0.2449075862697208,2025-04-24 22:21:30.819547,2025-04-24 22:21:33.976098,0 days 00:00:03.156551,0.08629505410652956,12,sqrt,1,14,1322,0.8848788240323944,TPESampler,COMPLETE
1157,0.2481768096164622,2025-04-24 22:21:32.456866,2025-04-24 22:21:35.653533,0 days 00:00:03.196667,0.09980104053828104,10,sqrt,1,19,1401,0.886018154204284,TPESampler,COMPLETE
1158,0.3375871072620329,2025-04-24 22:21:33.380201,2025-04-24 22:21:35.258538,0 days 00:00:01.878337,0.03172846710802207,12,log2,2,10,658,0.8691099280970397,TPESampler,COMPLETE
1159,0.23583876384054756,2025-04-24 22:21:34.191005,2025-04-24 22:21:37.509018,0 days 00:00:03.318013,0.09742750565255433,10,sqrt,1,15,1384,0.8353017815431668,TPESampler,COMPLETE
1160,0.27123146716474655,2025-04-24 22:21:35.448713,2025-04-24 22:21:37.744418,0 days 00:00:02.295705,0.09671933797275943,9,sqrt,2,19,909,0.8490433183532374,TPESampler,COMPLETE
1161,0.25860637073080545,2025-04-24 22:21:35.885625,2025-04-24 22:21:38.430428,0 days 00:00:02.544803,0.09517425957737884,9,sqrt,1,12,945,0.8311165191402852,TPESampler,COMPLETE
1162,0.2490340849109539,2025-04-24 22:21:37.705799,2025-04-24 22:21:39.589343,0 days 00:00:01.883544,0.09571099966266905,6,sqrt,1,10,889,0.8787712461582057,TPESampler,COMPLETE
1163,0.2640855235335126,2025-04-24 22:21:37.982941,2025-04-24 22:21:47.563579,0 days 00:00:09.580638,0.09954524589575947,11,,1,19,1418,0.8592870761682758,TPESampler,COMPLETE
1164,0.4771649460747436,2025-04-24 22:21:38.612163,2025-04-24 22:21:40.746302,0 days 00:00:02.134139,0.04495416865790856,5,log2,9,8,1350,0.6025022588284461,TPESampler,COMPLETE
1165,0.2508356341193176,2025-04-24 22:21:39.772123,2025-04-24 22:21:41.703151,0 days 00:00:01.931028,0.0930452073061719,10,sqrt,1,15,826,0.8986335734828813,TPESampler,COMPLETE
1166,0.246515255064836,2025-04-24 22:21:40.926581,2025-04-24 22:21:43.811392,0 days 00:00:02.884811,0.05249917362784821,11,sqrt,1,19,1408,0.8831199591810284,TPESampler,COMPLETE
1167,0.4533416721382676,2025-04-24 22:21:41.910036,2025-04-24 22:21:44.130388,0 days 00:00:02.220352,0.09973675087905816,9,log2,9,3,1425,0.6227056338475444,TPESampler,COMPLETE
1168,0.30272860481340647,2025-04-24 22:21:44.001746,2025-04-24 22:21:51.412345,0 days 00:00:07.410599,0.0974175028675803,9,,2,17,1176,0.9966323807659978,TPESampler,COMPLETE
1169,0.2647863187246367,2025-04-24 22:21:44.357685,2025-04-24 22:21:48.398168,0 days 00:00:04.040483,0.0928885376825415,7,,1,15,831,0.8548655778390406,TPESampler,COMPLETE
1170,0.3670601750418934,2025-04-24 22:21:47.769535,2025-04-24 22:21:48.666678,0 days 00:00:00.897143,0.08845029186935416,5,sqrt,5,18,284,0.608027343086694,TPESampler,COMPLETE
1171,0.4136914637238165,2025-04-24 22:21:48.587616,2025-04-24 22:21:51.171428,0 days 00:00:02.583812,0.011675993499308793,7,sqrt,8,16,1475,0.8490370970251228,TPESampler,COMPLETE
1172,0.2405527692038461,2025-04-24 22:21:48.891404,2025-04-24 22:21:51.125684,0 days 00:00:02.234280,0.0931357600703207,9,sqrt,1,11,1107,0.7648151463405966,TPESampler,COMPLETE
1173,0.2630886182651788,2025-04-24 22:21:51.264960,2025-04-24 22:21:54.100099,0 days 00:00:02.835139,0.09298986216316377,9,sqrt,2,18,1147,0.8879171490357037,TPESampler,COMPLETE
1174,0.2873779759960289,2025-04-24 22:21:51.331706,2025-04-24 22:21:54.520691,0 days 00:00:03.188985,0.05440915778073402,10,log2,2,16,1499,0.9000943471956181,TPESampler,COMPLETE
1175,0.2662052109985879,2025-04-24 22:21:51.885010,2025-04-24 22:21:56.705313,0 days 00:00:04.820303,0.09261233740672993,4,,1,9,1053,0.8898680801635207,TPESampler,COMPLETE
1176,0.34525932234302126,2025-04-24 22:21:54.305464,2025-04-24 22:21:56.752132,0 days 00:00:02.446668,0.028655624688251655,5,log2,1,16,1303,0.6658925545359333,TPESampler,COMPLETE
1177,0.24623888548829054,2025-04-24 22:21:54.738653,2025-04-24 22:21:57.404595,0 days 00:00:02.665942,0.09215858491865099,8,sqrt,1,15,1198,0.8343028417169206,TPESampler,COMPLETE
1178,0.4330002474041104,2025-04-24 22:21:56.857357,2025-04-24 22:21:59.303718,0 days 00:00:02.446361,0.03209265155676696,10,log2,6,3,1057,0.6225073874007863,TPESampler,COMPLETE
1179,0.2531480438536496,2025-04-24 22:21:56.902966,2025-04-24 22:22:00.122182,0 days 00:00:03.219216,0.0839242874003958,10,sqrt,1,17,1108,0.9033893716396615,TPESampler,COMPLETE
1180,0.3291679055159234,2025-04-24 22:21:57.688890,2025-04-24 22:22:00.367805,0 days 00:00:02.678915,0.011387604989723084,8,sqrt,1,12,1016,0.8228172333469328,TPESampler,COMPLETE
1181,0.26443238543891384,2025-04-24 22:21:59.503316,2025-04-24 22:22:02.129222,0 days 00:00:02.625906,0.05282495105097939,8,sqrt,1,20,1001,0.8205362847513603,TPESampler,COMPLETE
1182,0.2644537479944001,2025-04-24 22:22:00.324331,2025-04-24 22:22:03.474249,0 days 00:00:03.149918,0.0635765239858786,10,sqrt,3,13,1286,0.8598337290461999,TPESampler,COMPLETE
1183,0.26191669728278555,2025-04-24 22:22:00.613891,2025-04-24 22:22:03.575727,0 days 00:00:02.961836,0.09495324481777485,9,sqrt,3,13,1161,0.8452876070999236,TPESampler,COMPLETE
1184,0.32567559514915456,2025-04-24 22:22:02.323209,2025-04-24 22:22:04.882286,0 days 00:00:02.559077,0.05496181814202106,8,log2,4,14,1160,0.7964460067010689,TPESampler,COMPLETE
1185,0.2683623296143582,2025-04-24 22:22:03.645299,2025-04-24 22:22:05.876716,0 days 00:00:02.231417,0.09802686115056672,6,sqrt,1,16,781,0.9722359397721525,TPESampler,COMPLETE
1186,0.24031141021679386,2025-04-24 22:22:03.770601,2025-04-24 22:22:06.985453,0 days 00:00:03.214852,0.08953676193280959,11,sqrt,1,20,1404,0.9939493414750872,TPESampler,COMPLETE
1187,0.3307514133158171,2025-04-24 22:22:05.083554,2025-04-24 22:22:10.775716,0 days 00:00:05.692162,0.05638992513060587,7,,6,5,1281,0.671212093035328,TPESampler,COMPLETE
1188,0.23291255753012463,2025-04-24 22:22:06.080754,2025-04-24 22:22:08.899641,0 days 00:00:02.818887,0.0921867430617547,9,sqrt,1,11,1300,0.9086433724068886,TPESampler,COMPLETE
1189,0.244111199095683,2025-04-24 22:22:07.171288,2025-04-24 22:22:09.606062,0 days 00:00:02.434774,0.08821899819459275,10,sqrt,1,14,1242,0.9165800941879636,TPESampler,COMPLETE
1190,0.2991856519297806,2025-04-24 22:22:09.132267,2025-04-24 22:22:12.761933,0 days 00:00:03.629666,0.06802534985745423,4,,3,19,765,0.7924561366471319,TPESampler,COMPLETE
1191,0.2806978767530213,2025-04-24 22:22:09.954876,2025-04-24 22:22:12.818778,0 days 00:00:02.863902,0.05002505315142362,7,sqrt,3,13,1477,0.845128283952921,TPESampler,COMPLETE
1192,0.27069135353157103,2025-04-24 22:22:10.990958,2025-04-24 22:22:13.317091,0 days 00:00:02.326133,0.09982022014323767,11,sqrt,3,19,1011,0.8790357254789434,TPESampler,COMPLETE
1193,0.23960484925131603,2025-04-24 22:22:12.924872,2025-04-24 22:22:15.845710,0 days 00:00:02.920838,0.05223737771723033,10,sqrt,1,17,1120,0.7875561913514532,TPESampler,COMPLETE
1194,0.23990531625392467,2025-04-24 22:22:12.979508,2025-04-24 22:22:16.364851,0 days 00:00:03.385343,0.097800852773708,11,sqrt,1,20,1237,0.879053789184397,TPESampler,COMPLETE
1195,0.2657537448037091,2025-04-24 22:22:13.660060,2025-04-24 22:22:16.513960,0 days 00:00:02.853900,0.09367538866704944,9,sqrt,3,20,1063,0.8185963909982458,TPESampler,COMPLETE
1196,0.26719523826521896,2025-04-24 22:22:16.054237,2025-04-24 22:22:19.128615,0 days 00:00:03.074378,0.06491541764960312,9,sqrt,2,14,1229,0.9398373312589552,TPESampler,COMPLETE
1197,0.2617435146350984,2025-04-24 22:22:16.577639,2025-04-24 22:22:20.195781,0 days 00:00:03.618142,0.09041513390838017,12,sqrt,3,19,1466,0.8304754583971555,TPESampler,COMPLETE
1198,0.31119687729463247,2025-04-24 22:22:16.717933,2025-04-24 22:22:18.850090,0 days 00:00:02.132157,0.0730256496150864,9,log2,2,11,721,0.7859460408530385,TPESampler,COMPLETE
1199,0.34557340225348965,2025-04-24 22:22:19.046665,2025-04-24 22:22:20.246018,0 days 00:00:01.199353,0.03167544120432541,9,sqrt,2,19,297,0.8606562785920873,TPESampler,COMPLETE
1200,0.2580849733684024,2025-04-24 22:22:19.408253,2025-04-24 22:22:22.083796,0 days 00:00:02.675543,0.06936525583237482,10,sqrt,1,20,1133,0.7684199932257898,TPESampler,COMPLETE
1201,0.257881707644302,2025-04-24 22:22:20.362151,2025-04-24 22:22:24.266499,0 days 00:00:03.904348,0.06680916565607771,10,sqrt,3,15,1498,0.8497111192414128,TPESampler,COMPLETE
1202,0.42900664868823923,2025-04-24 22:22:20.405363,2025-04-24 22:22:22.324976,0 days 00:00:01.919613,0.04741197883892069,12,log2,7,18,582,0.9419146072962057,TPESampler,COMPLETE
1203,0.49821768392018373,2025-04-24 22:22:22.281507,2025-04-24 22:22:23.226209,0 days 00:00:00.944702,0.027384145366524084,5,sqrt,4,18,150,0.9187668071012887,TPESampler,COMPLETE
1204,0.23611273775009678,2025-04-24 22:22:22.594464,2025-04-24 22:22:25.310651,0 days 00:00:02.716187,0.09764258607238646,8,sqrt,1,10,1086,0.9183835034475486,TPESampler,COMPLETE
1205,0.46395526867729314,2025-04-24 22:22:23.441941,2025-04-24 22:22:25.559058,0 days 00:00:02.117117,0.020307809516327303,12,sqrt,10,18,814,0.6945130678780126,TPESampler,COMPLETE
1206,0.26937154826574766,2025-04-24 22:22:24.473346,2025-04-24 22:22:27.272023,0 days 00:00:02.798677,0.09511686919450998,9,sqrt,3,16,1224,0.8984888182475637,TPESampler,COMPLETE
1207,0.25961821624173376,2025-04-24 22:22:25.513309,2025-04-24 22:22:27.754671,0 days 00:00:02.241362,0.09933009082653887,10,sqrt,2,15,1044,0.9471669545575582,TPESampler,COMPLETE
1208,0.33870694046388683,2025-04-24 22:22:25.799624,2025-04-24 22:22:32.290812,0 days 00:00:06.491188,0.05135905484291062,10,,8,13,1247,0.7433633689679744,TPESampler,COMPLETE
1209,0.5290700702999285,2025-04-24 22:22:27.458788,2025-04-24 22:22:29.831587,0 days 00:00:02.372799,0.03455438895276354,5,log2,10,14,640,0.9754666735236073,TPESampler,COMPLETE
1210,0.2526742287330784,2025-04-24 22:22:28.113135,2025-04-24 22:22:32.373790,0 days 00:00:04.260655,0.09791945542689637,9,sqrt,1,16,1463,0.8766640698278907,TPESampler,COMPLETE
1211,0.24837018418755036,2025-04-24 22:22:30.213742,2025-04-24 22:22:32.727946,0 days 00:00:02.514204,0.09810681393962202,9,sqrt,1,19,1261,0.9226778069774708,TPESampler,COMPLETE
1212,0.38258719649927186,2025-04-24 22:22:32.450409,2025-04-24 22:22:38.176302,0 days 00:00:05.725893,0.05930816697617456,11,,9,3,904,0.8290905287133985,TPESampler,COMPLETE
1213,0.24566085853237843,2025-04-24 22:22:32.581304,2025-04-24 22:22:35.289934,0 days 00:00:02.708630,0.05699544110673548,10,sqrt,1,20,1266,0.8570540441522999,TPESampler,COMPLETE
1214,0.7188610889005469,2025-04-24 22:22:32.968208,2025-04-24 22:22:34.131392,0 days 00:00:01.163184,0.012461677454655644,6,log2,5,19,361,0.6088822465648345,TPESampler,COMPLETE
1215,0.26797554107780863,2025-04-24 22:22:34.314783,2025-04-24 22:22:36.555175,0 days 00:00:02.240392,0.05952141706499881,11,sqrt,3,16,1058,0.9098733378380984,TPESampler,COMPLETE
1216,0.242597614218469,2025-04-24 22:22:35.507477,2025-04-24 22:22:38.100767,0 days 00:00:02.593290,0.0574366632531899,9,sqrt,1,13,1362,0.8614741885070174,TPESampler,COMPLETE
1217,0.28323031364528983,2025-04-24 22:22:36.754301,2025-04-24 22:22:39.393602,0 days 00:00:02.639301,0.08409682871404746,9,log2,2,9,1330,0.9270939227396455,TPESampler,COMPLETE
1218,0.24293478610672373,2025-04-24 22:22:38.252190,2025-04-24 22:22:41.307617,0 days 00:00:03.055427,0.09343723228510148,9,sqrt,1,15,1215,0.7869846494576663,TPESampler,COMPLETE
1219,0.25519433570898925,2025-04-24 22:22:38.374031,2025-04-24 22:22:41.306260,0 days 00:00:02.932229,0.09986467029588904,11,sqrt,1,16,1091,0.9152820127392669,TPESampler,COMPLETE
1220,0.5016655426057633,2025-04-24 22:22:39.585810,2025-04-24 22:22:40.933035,0 days 00:00:01.347225,0.05394662678378258,11,log2,6,12,356,0.6151972629931441,TPESampler,COMPLETE
1221,0.266105635044115,2025-04-24 22:22:41.258014,2025-04-24 22:22:43.870204,0 days 00:00:02.612190,0.09873404569242693,11,sqrt,3,13,1034,0.8765820402175618,TPESampler,COMPLETE
1222,0.7011999537455177,2025-04-24 22:22:41.616005,2025-04-24 22:22:42.988479,0 days 00:00:01.372474,0.011520477959999912,5,log2,3,20,238,0.7524602720415317,TPESampler,COMPLETE
1223,0.24712165653373314,2025-04-24 22:22:41.655870,2025-04-24 22:22:44.672195,0 days 00:00:03.016325,0.06107339001024169,11,sqrt,1,17,1174,0.8383836158633348,TPESampler,COMPLETE
1224,0.3062096521467182,2025-04-24 22:22:43.230219,2025-04-24 22:22:48.883963,0 days 00:00:05.653744,0.028496381488659912,5,,3,4,1189,0.9985734475822525,TPESampler,COMPLETE
1225,0.26469159604249465,2025-04-24 22:22:44.061947,2025-04-24 22:22:46.651662,0 days 00:00:02.589715,0.058367070523985896,12,sqrt,2,13,1046,0.9171598692854155,TPESampler,COMPLETE
1226,0.23589777452671343,2025-04-24 22:22:44.939828,2025-04-24 22:22:47.797662,0 days 00:00:02.857834,0.09905106678810956,10,sqrt,1,14,1150,0.9322919086265928,TPESampler,COMPLETE
1227,0.25094754644401557,2025-04-24 22:22:47.114891,2025-04-24 22:22:49.891432,0 days 00:00:02.776541,0.09190921906650189,9,sqrt,1,14,1222,0.8261396146179013,TPESampler,COMPLETE
1228,0.24383433326139875,2025-04-24 22:22:48.020685,2025-04-24 22:22:51.438248,0 days 00:00:03.417563,0.05418906722292482,11,sqrt,1,14,1480,0.8361728939541028,TPESampler,COMPLETE
1229,0.3029302539458864,2025-04-24 22:22:49.216968,2025-04-24 22:22:52.382847,0 days 00:00:03.165879,0.07409666288529483,12,log2,4,14,1484,0.8404141667674039,TPESampler,COMPLETE
