number,value,datetime_start,datetime_complete,duration,params_learning_rate,params_max_depth,params_max_features,params_min_samples_leaf,params_min_samples_split,params_n_estimators,params_subsample,system_attrs_auto:sampler,state
1842,0.22808085638884543,2025-04-24 22:34:26.963674,2025-04-24 22:34:29.164483,0 days 00:00:02.200809,0.09249108873846655,12,sqrt,1,20,1050,0.7896175228851248,TPESampler,COMPLETE
1843,0.2689323434242887,2025-04-24 22:34:29.122473,2025-04-24 22:34:31.461060,0 days 00:00:02.338587,0.07311843976131388,12,sqrt,3,20,988,0.6986603624212532,TPESampler,COMPLETE
1844,0.24748454954167734,2025-04-24 22:34:29.642554,2025-04-24 22:34:32.190696,0 days 00:00:02.548142,0.06656011891296261,12,sqrt,1,10,1147,0.7991265693688238,TPESampler,COMPLETE
1845,0.24845972117790285,2025-04-24 22:34:31.658628,2025-04-24 22:34:34.039669,0 days 00:00:02.381041,0.08173571612077689,12,sqrt,1,19,1089,0.7389786285788482,TPESampler,COMPLETE
1846,0.2465966519212521,2025-04-24 22:34:32.393092,2025-04-24 22:34:34.302626,0 days 00:00:01.909534,0.08820104110691354,12,sqrt,1,16,792,0.7408817110841994,TPESampler,COMPLETE
1847,0.2702158190933422,2025-04-24 22:34:34.201415,2025-04-24 22:34:37.212234,0 days 00:00:03.010819,0.04355355204568319,12,sqrt,2,11,1046,0.7389218744870187,TPESampler,COMPLETE
1848,0.4854567416745581,2025-04-24 22:34:34.364152,2025-04-24 22:34:36.790995,0 days 00:00:02.426843,0.015302972987629658,4,sqrt,9,5,827,0.634571135438199,TPESampler,COMPLETE
1849,0.2803497841746889,2025-04-24 22:34:34.614772,2025-04-24 22:34:37.275726,0 days 00:00:02.660954,0.047248675904454154,11,sqrt,2,19,852,0.7656613857727775,TPESampler,COMPLETE
1850,0.26711922387351744,2025-04-24 22:34:36.996225,2025-04-24 22:34:40.725735,0 days 00:00:03.729510,0.09550526244915193,10,sqrt,3,19,1491,0.9110472528608362,TPESampler,COMPLETE
1851,0.2415720234155776,2025-04-24 22:34:37.428286,2025-04-24 22:34:40.446553,0 days 00:00:03.018267,0.08167829214790377,12,sqrt,1,20,1102,0.7775299786146894,TPESampler,COMPLETE
1852,0.2511204489097784,2025-04-24 22:34:37.558165,2025-04-24 22:34:40.697525,0 days 00:00:03.139360,0.09865621453528503,11,sqrt,1,18,1189,0.6858049352137547,TPESampler,COMPLETE
1853,0.37427661716387106,2025-04-24 22:34:40.652938,2025-04-24 22:34:42.043550,0 days 00:00:01.390612,0.06145634460636051,7,log2,2,20,283,0.9254176152337572,TPESampler,COMPLETE
1854,0.23561791887703742,2025-04-24 22:34:40.924016,2025-04-24 22:34:43.807552,0 days 00:00:02.883536,0.09136387869074852,11,sqrt,1,20,912,0.8446370146403909,TPESampler,COMPLETE
1855,0.25290420132461305,2025-04-24 22:34:40.966485,2025-04-24 22:34:43.727400,0 days 00:00:02.760915,0.0695134026738726,10,sqrt,1,20,854,0.7574974873606524,TPESampler,COMPLETE
1856,0.2562609112405611,2025-04-24 22:34:42.253919,2025-04-24 22:34:45.329978,0 days 00:00:03.076059,0.0846883435875141,12,sqrt,1,20,1161,0.8021070433214018,TPESampler,COMPLETE
1857,0.2634968409055355,2025-04-24 22:34:43.888033,2025-04-24 22:34:47.008914,0 days 00:00:03.120881,0.0582306331374824,12,sqrt,3,14,1159,0.8275949312294729,TPESampler,COMPLETE
1858,0.40473542000927476,2025-04-24 22:34:44.008060,2025-04-24 22:34:47.283789,0 days 00:00:03.275729,0.06804344467617424,12,sqrt,9,11,1294,0.8592331926849242,TPESampler,COMPLETE
1859,0.24389281869865276,2025-04-24 22:34:45.545354,2025-04-24 22:34:49.106814,0 days 00:00:03.561460,0.09895137070606805,9,sqrt,1,17,1463,0.9934196584246291,TPESampler,COMPLETE
1860,0.423629953854647,2025-04-24 22:34:47.234934,2025-04-24 22:34:48.496143,0 days 00:00:01.261209,0.05728268880868327,5,sqrt,7,16,229,0.7478317036284547,TPESampler,COMPLETE
1861,0.23871014646626534,2025-04-24 22:34:47.520072,2025-04-24 22:34:51.055874,0 days 00:00:03.535802,0.06438079485315533,10,sqrt,1,15,1444,0.7874129114790733,TPESampler,COMPLETE
1862,0.25715075946067917,2025-04-24 22:34:48.693287,2025-04-24 22:34:51.842123,0 days 00:00:03.148836,0.08242124488187841,12,sqrt,1,18,1202,0.8317020057090133,TPESampler,COMPLETE
1863,0.24302443941810298,2025-04-24 22:34:49.336656,2025-04-24 22:34:52.689401,0 days 00:00:03.352745,0.08662133782445731,12,sqrt,1,11,1314,0.9535160434801387,TPESampler,COMPLETE
1864,0.2560378036298744,2025-04-24 22:34:51.253250,2025-04-24 22:34:53.983841,0 days 00:00:02.730591,0.07435762655188848,12,sqrt,2,18,1004,0.8130931900107148,TPESampler,COMPLETE
1865,0.3015072228114409,2025-04-24 22:34:52.051372,2025-04-24 22:34:54.558264,0 days 00:00:02.506892,0.06554504841215374,8,log2,1,12,894,0.8910547476023086,TPESampler,COMPLETE
1866,0.29965563774443293,2025-04-24 22:34:52.925159,2025-04-24 22:34:55.723481,0 days 00:00:02.798322,0.04445531567409432,5,sqrt,3,11,1118,0.9781600597579219,TPESampler,COMPLETE
1867,0.26127869301194273,2025-04-24 22:34:54.183187,2025-04-24 22:34:57.274587,0 days 00:00:03.091400,0.08307724290688871,11,sqrt,3,20,1110,0.8153201173567199,TPESampler,COMPLETE
1868,0.33829230967604734,2025-04-24 22:34:54.795647,2025-04-24 22:34:58.082031,0 days 00:00:03.286384,0.0540844895966107,7,log2,4,4,1453,0.6132736263867674,TPESampler,COMPLETE
1869,0.24293706794140624,2025-04-24 22:34:55.934827,2025-04-24 22:34:58.345091,0 days 00:00:02.410264,0.08087429714620249,12,sqrt,1,19,732,0.833723620627909,TPESampler,COMPLETE
1870,0.2541141587997426,2025-04-24 22:34:57.487826,2025-04-24 22:35:00.985787,0 days 00:00:03.497961,0.06501698124963433,6,sqrt,1,17,1412,0.6889050534167129,TPESampler,COMPLETE
1871,0.2491156844369815,2025-04-24 22:34:58.309485,2025-04-24 22:35:00.954318,0 days 00:00:02.644833,0.05262150800390252,11,sqrt,1,12,928,0.9768577975817533,TPESampler,COMPLETE
1872,0.2687735706616749,2025-04-24 22:34:58.586063,2025-04-24 22:35:01.759871,0 days 00:00:03.173808,0.0630475273508847,11,sqrt,3,16,1194,0.7340902147547708,TPESampler,COMPLETE
1873,0.4810114710721359,2025-04-24 22:35:01.106480,2025-04-24 22:35:03.282390,0 days 00:00:02.175910,0.044671466237295634,11,log2,9,8,670,0.9107870752218089,TPESampler,COMPLETE
1874,0.4269293814514803,2025-04-24 22:35:01.152649,2025-04-24 22:35:04.374628,0 days 00:00:03.221979,0.0943938429035417,3,log2,7,9,1230,0.6001185600030043,TPESampler,COMPLETE
1875,0.2531874793021256,2025-04-24 22:35:02.031285,2025-04-24 22:35:04.925987,0 days 00:00:02.894702,0.0989605974255675,9,sqrt,1,19,1002,0.8091431739257746,TPESampler,COMPLETE
1876,0.24411813167137486,2025-04-24 22:35:03.492661,2025-04-24 22:35:07.254758,0 days 00:00:03.762097,0.062433539820536454,9,sqrt,1,15,1493,0.9508884831806371,TPESampler,COMPLETE
1877,0.44740194792786775,2025-04-24 22:35:04.590107,2025-04-24 22:35:06.274636,0 days 00:00:01.684529,0.012286924322333428,7,sqrt,6,20,472,0.7796681986465911,TPESampler,COMPLETE
1878,0.22836743987083188,2025-04-24 22:35:05.151968,2025-04-24 22:35:08.089630,0 days 00:00:02.937662,0.09705594297988827,12,sqrt,1,20,1172,0.7880325722424147,TPESampler,COMPLETE
1879,0.2592077303346604,2025-04-24 22:35:06.479914,2025-04-24 22:35:10.184017,0 days 00:00:03.704103,0.08314559721507692,11,sqrt,3,16,1383,0.8026564284016819,TPESampler,COMPLETE
1880,0.23459409799359435,2025-04-24 22:35:07.523641,2025-04-24 22:35:11.055528,0 days 00:00:03.531887,0.05875875026271024,11,sqrt,1,14,1287,0.829133555176633,TPESampler,COMPLETE
1881,0.29706169556737394,2025-04-24 22:35:08.329939,2025-04-24 22:35:11.964555,0 days 00:00:03.634616,0.02029800835000745,8,sqrt,3,6,1443,0.7740027372310386,TPESampler,COMPLETE
1882,0.26280165471422934,2025-04-24 22:35:10.531790,2025-04-24 22:35:13.584232,0 days 00:00:03.052442,0.07041504592889368,12,sqrt,2,16,1131,0.7690498362230971,TPESampler,COMPLETE
1883,0.26276958487397395,2025-04-24 22:35:11.260088,2025-04-24 22:35:14.482648,0 days 00:00:03.222560,0.0778636215118245,12,sqrt,3,20,1234,0.8419592258301424,TPESampler,COMPLETE
1884,0.23874056140065142,2025-04-24 22:35:12.182449,2025-04-24 22:35:15.201986,0 days 00:00:03.019537,0.09895032020217438,12,sqrt,1,16,1145,0.8027725219156034,TPESampler,COMPLETE
1885,0.2440862727920579,2025-04-24 22:35:13.789126,2025-04-24 22:35:16.410977,0 days 00:00:02.621851,0.06576556379162796,11,sqrt,1,20,1125,0.7918985162257319,TPESampler,COMPLETE
1886,0.2669075656946296,2025-04-24 22:35:14.695217,2025-04-24 22:35:20.123950,0 days 00:00:05.428733,0.06062043694835172,9,,1,15,905,0.7335428624388373,TPESampler,COMPLETE
1887,0.2505735738539325,2025-04-24 22:35:15.407104,2025-04-24 22:35:18.273608,0 days 00:00:02.866504,0.09862897109088341,10,sqrt,2,20,1329,0.766115638664434,TPESampler,COMPLETE
1888,0.2396523275272027,2025-04-24 22:35:16.627883,2025-04-24 22:35:19.563822,0 days 00:00:02.935939,0.0660918294877067,12,sqrt,1,18,1362,0.761632880855626,TPESampler,COMPLETE
1889,0.3374410618251252,2025-04-24 22:35:18.459040,2025-04-24 22:35:19.743818,0 days 00:00:01.284778,0.023775699120410644,10,sqrt,1,9,394,0.6083121976924353,TPESampler,COMPLETE
1890,0.28682626095441716,2025-04-24 22:35:19.738883,2025-04-24 22:35:21.647703,0 days 00:00:01.908820,0.07131239545036602,12,log2,1,19,709,0.689153594015204,TPESampler,COMPLETE
1891,0.35286535959063425,2025-04-24 22:35:19.990628,2025-04-24 22:35:22.651343,0 days 00:00:02.660715,0.028813646462896192,7,,4,16,288,0.970506164826678,TPESampler,COMPLETE
1892,0.837042707292796,2025-04-24 22:35:20.395169,2025-04-24 22:35:21.464740,0 days 00:00:01.069571,0.01262426686203261,11,log2,10,15,120,0.9902615945032454,TPESampler,COMPLETE
1893,0.29648805997683964,2025-04-24 22:35:21.701509,2025-04-24 22:35:24.083797,0 days 00:00:02.382288,0.08660198344937316,12,log2,3,20,1325,0.8755526012390112,TPESampler,COMPLETE
1894,0.3375444648259702,2025-04-24 22:35:21.880793,2025-04-24 22:35:31.917084,0 days 00:00:10.036291,0.09801221753819532,12,,2,11,1193,0.9808324612099174,TPESampler,COMPLETE
1895,0.4470517948907589,2025-04-24 22:35:22.865759,2025-04-24 22:35:24.683182,0 days 00:00:01.817423,0.0947447714628911,12,log2,10,14,958,0.9754658586340968,TPESampler,COMPLETE
1896,0.40631462938536433,2025-04-24 22:35:24.289613,2025-04-24 22:35:27.405158,0 days 00:00:03.115545,0.06646066918762727,3,,10,12,946,0.6933836607773485,TPESampler,COMPLETE
1897,0.429471705662063,2025-04-24 22:35:24.868121,2025-04-24 22:35:26.749274,0 days 00:00:01.881153,0.043770904385196395,4,sqrt,10,14,1069,0.9707536352711407,TPESampler,COMPLETE
1898,0.25471270884007685,2025-04-24 22:35:26.935463,2025-04-24 22:35:29.232576,0 days 00:00:02.297113,0.07492710549013883,11,sqrt,1,20,1025,0.7813548886542447,TPESampler,COMPLETE
1899,0.26822964459999393,2025-04-24 22:35:27.632465,2025-04-24 22:35:29.648159,0 days 00:00:02.015694,0.06671462553154164,12,sqrt,3,18,946,0.7624407440591631,TPESampler,COMPLETE
1900,0.5619898821392464,2025-04-24 22:35:29.469385,2025-04-24 22:35:31.034627,0 days 00:00:01.565242,0.011815605149275325,11,log2,7,16,723,0.993786886084011,TPESampler,COMPLETE
1901,0.24897150695647516,2025-04-24 22:35:29.945787,2025-04-24 22:35:32.056577,0 days 00:00:02.110790,0.07651895647472225,12,sqrt,1,19,852,0.8047648144880302,TPESampler,COMPLETE
1902,0.22709099542609212,2025-04-24 22:35:31.231304,2025-04-24 22:35:34.485631,0 days 00:00:03.254327,0.09706825882363215,10,sqrt,1,20,1283,0.8947514346001976,TPESampler,COMPLETE
1903,0.2673920557243704,2025-04-24 22:35:32.121125,2025-04-24 22:35:35.447356,0 days 00:00:03.326231,0.047516258022662024,10,sqrt,3,13,1388,0.8534913870515705,TPESampler,COMPLETE
1904,0.2663879237032708,2025-04-24 22:35:32.295665,2025-04-24 22:35:35.722117,0 days 00:00:03.426452,0.09168642011401451,12,sqrt,3,15,1431,0.8871869926744308,TPESampler,COMPLETE
1905,0.2428379651533017,2025-04-24 22:35:34.674224,2025-04-24 22:35:38.368466,0 days 00:00:03.694242,0.07351551995758378,12,sqrt,1,20,1399,0.7488709530501982,TPESampler,COMPLETE
1906,0.25238390199811545,2025-04-24 22:35:35.685329,2025-04-24 22:35:38.603651,0 days 00:00:02.918322,0.09587825781261314,11,sqrt,1,19,1167,0.7653492058565877,TPESampler,COMPLETE
1907,0.25427683364393233,2025-04-24 22:35:36.003102,2025-04-24 22:35:38.850061,0 days 00:00:02.846959,0.04160214463080969,11,sqrt,1,20,1077,0.9706860979669364,TPESampler,COMPLETE
1908,0.2685340626942121,2025-04-24 22:35:38.566652,2025-04-24 22:35:41.264510,0 days 00:00:02.697858,0.08343432023577496,12,sqrt,3,20,983,0.7693097990266746,TPESampler,COMPLETE
1909,0.2462885813881292,2025-04-24 22:35:38.876434,2025-04-24 22:35:42.041952,0 days 00:00:03.165518,0.06536838011804928,12,sqrt,1,20,1120,0.7698887858839346,TPESampler,COMPLETE
1910,0.26614507309447605,2025-04-24 22:35:39.110020,2025-04-24 22:35:42.317988,0 days 00:00:03.207968,0.06298570597275972,11,sqrt,2,20,1220,0.9081137621425875,TPESampler,COMPLETE
1911,0.2616016222721795,2025-04-24 22:35:41.471563,2025-04-24 22:35:44.980885,0 days 00:00:03.509322,0.09052700141231881,10,sqrt,2,17,1331,0.9302634496129171,TPESampler,COMPLETE
1912,0.24241389830939278,2025-04-24 22:35:42.280102,2025-04-24 22:35:45.232123,0 days 00:00:02.952021,0.0962277905301051,10,sqrt,1,20,1160,0.8677944676911471,TPESampler,COMPLETE
1913,0.2619986946337177,2025-04-24 22:35:42.529960,2025-04-24 22:35:46.165216,0 days 00:00:03.635256,0.06630525430856923,10,sqrt,3,19,1435,0.8221487171248375,TPESampler,COMPLETE
1914,0.2554818978944849,2025-04-24 22:35:45.187081,2025-04-24 22:35:47.946860,0 days 00:00:02.759779,0.0890063934694466,11,sqrt,3,19,1082,0.9177513812908636,TPESampler,COMPLETE
1915,0.4297762443242057,2025-04-24 22:35:45.530388,2025-04-24 22:35:47.917040,0 days 00:00:02.386652,0.08527773038127395,5,sqrt,10,18,846,0.7187467959308097,TPESampler,COMPLETE
1916,0.25311084178927734,2025-04-24 22:35:46.401778,2025-04-24 22:35:49.633293,0 days 00:00:03.231515,0.07577612017420526,11,sqrt,1,19,1163,0.9448565361495092,TPESampler,COMPLETE
1917,0.25136773754968617,2025-04-24 22:35:48.077294,2025-04-24 22:35:51.142266,0 days 00:00:03.064972,0.07297757132158189,9,sqrt,1,19,1262,0.9199857558131894,TPESampler,COMPLETE
1918,0.2628129948675065,2025-04-24 22:35:48.116729,2025-04-24 22:35:51.226373,0 days 00:00:03.109644,0.09129803270379566,10,sqrt,2,20,1222,0.9296592531984188,TPESampler,COMPLETE
1919,0.28990796045371814,2025-04-24 22:35:49.832622,2025-04-24 22:35:56.193400,0 days 00:00:06.360778,0.08866618230583215,10,,2,20,934,0.861928403007781,TPESampler,COMPLETE
1920,0.40068458423747444,2025-04-24 22:35:51.309330,2025-04-24 22:35:53.893142,0 days 00:00:02.583812,0.031728787305839286,12,sqrt,9,17,1341,0.946119008398374,TPESampler,COMPLETE
1921,0.24840562631868998,2025-04-24 22:35:51.426107,2025-04-24 22:35:53.866479,0 days 00:00:02.440372,0.09286767515095959,12,sqrt,1,20,1034,0.7981263033226224,TPESampler,COMPLETE
1922,0.2569459971293226,2025-04-24 22:35:54.016397,2025-04-24 22:36:02.286209,0 days 00:00:08.269812,0.08016016280695858,10,,1,19,1212,0.9100630710390635,TPESampler,COMPLETE
1923,0.23807877419173454,2025-04-24 22:35:54.060160,2025-04-24 22:35:56.894431,0 days 00:00:02.834271,0.07148370257186543,10,sqrt,1,20,1480,0.8648121488995542,TPESampler,COMPLETE
1924,0.2491746450098949,2025-04-24 22:35:56.395037,2025-04-24 22:35:58.655107,0 days 00:00:02.260070,0.09729910339307696,11,log2,1,20,1380,0.826770812740478,TPESampler,COMPLETE
1925,0.3086258489607572,2025-04-24 22:35:57.081677,2025-04-24 22:36:00.486577,0 days 00:00:03.404900,0.027062697656505746,12,,3,16,420,0.9637797365715147,TPESampler,COMPLETE
1926,0.24040809194527502,2025-04-24 22:35:58.843927,2025-04-24 22:36:00.487885,0 days 00:00:01.643958,0.09836439870865672,10,sqrt,1,20,915,0.8680010021414241,TPESampler,COMPLETE
1927,0.23587644965009244,2025-04-24 22:36:00.660512,2025-04-24 22:36:04.005470,0 days 00:00:03.344958,0.09487694358597484,10,sqrt,1,20,1478,0.944303202217025,TPESampler,COMPLETE
1928,0.26651391349945414,2025-04-24 22:36:00.712424,2025-04-24 22:36:03.863647,0 days 00:00:03.151223,0.09677097434017379,11,sqrt,3,17,1250,0.6844684602809303,TPESampler,COMPLETE
1929,0.2404651523822719,2025-04-24 22:36:02.504954,2025-04-24 22:36:05.526763,0 days 00:00:03.021809,0.08678929500803167,12,sqrt,1,18,1074,0.8704165109150108,TPESampler,COMPLETE
1930,0.24967028107198472,2025-04-24 22:36:04.057894,2025-04-24 22:36:06.895095,0 days 00:00:02.837201,0.09029299708978511,12,sqrt,1,20,1106,0.9226414454895323,TPESampler,COMPLETE
1931,0.2700572458216771,2025-04-24 22:36:04.229135,2025-04-24 22:36:07.355167,0 days 00:00:03.126032,0.09985468151902006,9,sqrt,3,18,1230,0.8597792887324969,TPESampler,COMPLETE
1932,0.23957150451953124,2025-04-24 22:36:05.726229,2025-04-24 22:36:09.376416,0 days 00:00:03.650187,0.09788088346573766,10,sqrt,1,18,1485,0.9047380406319422,TPESampler,COMPLETE
1933,0.2533014388569023,2025-04-24 22:36:07.107123,2025-04-24 22:36:09.983758,0 days 00:00:02.876635,0.07720094195305027,12,log2,1,17,1069,0.7592608493324098,TPESampler,COMPLETE
1934,0.24303650164580745,2025-04-24 22:36:07.605131,2025-04-24 22:36:10.857628,0 days 00:00:03.252497,0.07124719404090815,11,sqrt,1,18,1211,0.8913532971054029,TPESampler,COMPLETE
1935,0.25409854111215935,2025-04-24 22:36:09.583684,2025-04-24 22:36:11.993616,0 days 00:00:02.409932,0.09431634141202438,12,sqrt,1,18,873,0.7792678794226375,TPESampler,COMPLETE
1936,0.41295913602816164,2025-04-24 22:36:10.211051,2025-04-24 22:36:12.502466,0 days 00:00:02.291415,0.011236041141669158,4,,2,16,470,0.6404558781681179,TPESampler,COMPLETE
1937,0.2627850521417678,2025-04-24 22:36:11.055712,2025-04-24 22:36:13.836455,0 days 00:00:02.780743,0.08909584501636197,12,sqrt,3,17,1165,0.7487573098815008,TPESampler,COMPLETE
1938,0.264609578175076,2025-04-24 22:36:12.195154,2025-04-24 22:36:14.619259,0 days 00:00:02.424105,0.09429612258262493,10,sqrt,2,20,1006,0.7338982437040757,TPESampler,COMPLETE
1939,0.319692324446663,2025-04-24 22:36:12.724785,2025-04-24 22:36:15.947178,0 days 00:00:03.222393,0.07460957810328583,9,,6,13,470,0.7799799304259932,TPESampler,COMPLETE
1940,0.30102059743899395,2025-04-24 22:36:14.033226,2025-04-24 22:36:16.200459,0 days 00:00:02.167233,0.05634487627295864,11,log2,2,20,1106,0.7345887895285156,TPESampler,COMPLETE
1941,0.23875870268673022,2025-04-24 22:36:15.067800,2025-04-24 22:36:18.499317,0 days 00:00:03.431517,0.08905002065992801,10,sqrt,1,19,1251,0.91263077099984,TPESampler,COMPLETE
1942,0.2475701930219816,2025-04-24 22:36:16.328242,2025-04-24 22:36:19.484140,0 days 00:00:03.155898,0.05819241936133487,12,sqrt,1,20,1197,0.825140008649431,TPESampler,COMPLETE
1943,0.24079633342733212,2025-04-24 22:36:16.446367,2025-04-24 22:36:19.934542,0 days 00:00:03.488175,0.09487357363396985,12,sqrt,1,20,1240,0.8166794507514247,TPESampler,COMPLETE
1944,0.2604370578080051,2025-04-24 22:36:18.703996,2025-04-24 22:36:21.962990,0 days 00:00:03.258994,0.09881543745905216,12,sqrt,2,18,1173,0.799938753389467,TPESampler,COMPLETE
1945,0.2558401647517697,2025-04-24 22:36:19.696910,2025-04-24 22:36:23.016857,0 days 00:00:03.319947,0.08997335098042378,12,sqrt,2,19,1289,0.6832915895894336,TPESampler,COMPLETE
1946,0.26448120299933014,2025-04-24 22:36:20.209799,2025-04-24 22:36:23.359424,0 days 00:00:03.149625,0.0887947262971282,11,sqrt,2,20,1256,0.800491813681387,TPESampler,COMPLETE
1947,0.2639356257158296,2025-04-24 22:36:22.161656,2025-04-24 22:36:25.011146,0 days 00:00:02.849490,0.09489250414777028,9,sqrt,2,20,1220,0.9152417722212776,TPESampler,COMPLETE
1948,0.3249202103390011,2025-04-24 22:36:23.224883,2025-04-24 22:36:30.033640,0 days 00:00:06.808757,0.01998718579875237,11,,6,13,1307,0.6358450180969291,TPESampler,COMPLETE
1949,0.2452289030751448,2025-04-24 22:36:23.654730,2025-04-24 22:36:26.205163,0 days 00:00:02.550433,0.09287580497358294,10,sqrt,1,19,1193,0.9325046738327051,TPESampler,COMPLETE
1950,0.23507355231460583,2025-04-24 22:36:25.192341,2025-04-24 22:36:27.492027,0 days 00:00:02.299686,0.09675835245840567,12,sqrt,1,18,997,0.8477579402483565,TPESampler,COMPLETE
1951,0.2420527854606335,2025-04-24 22:36:26.393969,2025-04-24 22:36:28.517625,0 days 00:00:02.123656,0.05931191569556824,12,sqrt,1,20,884,0.7723293082471273,TPESampler,COMPLETE
1952,0.3374125292640176,2025-04-24 22:36:27.690369,2025-04-24 22:36:30.559460,0 days 00:00:02.869091,0.06036074764607087,7,,7,19,545,0.7631508837585111,TPESampler,COMPLETE
1953,0.3950516961070109,2025-04-24 22:36:28.726388,2025-04-24 22:36:31.766271,0 days 00:00:03.039883,0.01476421919996512,10,,10,13,455,0.8519099400576717,TPESampler,COMPLETE
1954,0.40556463921103064,2025-04-24 22:36:30.245367,2025-04-24 22:36:33.259816,0 days 00:00:03.014449,0.03121356453565454,10,sqrt,8,3,1396,0.6980502118788241,TPESampler,COMPLETE
1955,0.24102764992619266,2025-04-24 22:36:30.776987,2025-04-24 22:36:34.087925,0 days 00:00:03.310938,0.09822385050183631,10,sqrt,1,19,1272,0.9039500628052523,TPESampler,COMPLETE
1956,0.46280846090106875,2025-04-24 22:36:31.966039,2025-04-24 22:36:34.002061,0 days 00:00:02.036022,0.08796808063910336,7,log2,9,8,685,0.8433314232292606,TPESampler,COMPLETE
1957,0.23780273038023902,2025-04-24 22:36:33.472992,2025-04-24 22:36:36.528093,0 days 00:00:03.055101,0.09488674525462197,12,sqrt,1,20,1172,0.839597190490916,TPESampler,COMPLETE
1958,0.23983790410830652,2025-04-24 22:36:34.360285,2025-04-24 22:36:38.308642,0 days 00:00:03.948357,0.09418427662545523,12,sqrt,1,19,1482,0.8737956439520886,TPESampler,COMPLETE
1959,0.248072285290325,2025-04-24 22:36:34.417492,2025-04-24 22:36:37.883219,0 days 00:00:03.465727,0.06305365190493324,11,sqrt,1,16,1252,0.7256284268647176,TPESampler,COMPLETE
1960,0.2443976207014313,2025-04-24 22:36:36.930792,2025-04-24 22:36:40.678960,0 days 00:00:03.748168,0.06708375390147184,12,sqrt,1,14,1420,0.9255745751421112,TPESampler,COMPLETE
1961,0.23767956000386153,2025-04-24 22:36:38.082095,2025-04-24 22:36:41.018508,0 days 00:00:02.936413,0.09999130901541146,8,sqrt,1,20,1139,0.9090096260117845,TPESampler,COMPLETE
1962,0.2526478022483724,2025-04-24 22:36:38.580385,2025-04-24 22:36:41.669534,0 days 00:00:03.089149,0.057443688924199994,9,sqrt,1,18,1152,0.8550010936316343,TPESampler,COMPLETE
1963,0.23874980779810082,2025-04-24 22:36:40.883987,2025-04-24 22:36:43.832732,0 days 00:00:02.948745,0.09271623687674224,12,sqrt,1,16,1132,0.752811645045353,TPESampler,COMPLETE
