number,value,datetime_start,datetime_complete,duration,params_learning_rate,params_max_depth,params_max_features,params_min_samples_leaf,params_min_samples_split,params_n_estimators,params_subsample,system_attrs_auto:sampler,state
0,0.3765224403332717,2025-04-24 22:01:02.472010,2025-04-24 22:01:05.045539,0 days 00:00:02.573529,0.013350396661349068,6,sqrt,6,2,1238,0.8092590210675361,RandomSampler,COMPLETE
1,0.5661977037625435,2025-04-24 22:01:02.487020,2025-04-24 22:01:03.353513,0 days 00:00:00.866493,0.01431036327038398,11,sqrt,8,8,193,0.9143764720381161,RandomSampler,COMPLETE
2,0.3327661422882135,2025-04-24 22:01:02.554195,2025-04-24 22:01:04.514602,0 days 00:00:01.960407,0.04112924606984042,3,sqrt,1,6,941,0.9634679958727967,RandomSampler,COMPLETE
3,0.3687024853651145,2025-04-24 22:01:03.536229,2025-04-24 22:01:06.363252,0 days 00:00:02.827023,0.01719064145608021,6,,7,7,558,0.818102386327069,TPESampler,COMPLETE
4,0.38228118087984414,2025-04-24 22:01:04.691625,2025-04-24 22:01:06.130207,0 days 00:00:01.438582,0.08872918842112082,11,sqrt,8,12,852,0.7168298222992557,TPESampler,COMPLETE
5,0.3816083273078144,2025-04-24 22:01:05.235598,2025-04-24 22:01:10.226174,0 days 00:00:04.990576,0.06299768268263778,9,,9,10,1031,0.6848068384319246,TPESampler,COMPLETE
6,0.5830796042109857,2025-04-24 22:01:06.297225,2025-04-24 22:01:07.243372,0 days 00:00:00.946147,0.024278918012522768,10,log2,8,12,447,0.9445491732296354,TPESampler,COMPLETE
7,0.4434202096732141,2025-04-24 22:01:06.545789,2025-04-24 22:01:07.615850,0 days 00:00:01.070061,0.01096091632615081,8,sqrt,5,8,388,0.9796503318169905,TPESampler,COMPLETE
8,0.4173775196556521,2025-04-24 22:01:07.432714,2025-04-24 22:01:08.653372,0 days 00:00:01.220658,0.016879363664869734,6,sqrt,7,4,531,0.9695951617442211,TPESampler,COMPLETE
9,0.5103969756834759,2025-04-24 22:01:07.784312,2025-04-24 22:01:09.587177,0 days 00:00:01.802865,0.02466173316066952,10,log2,10,20,1128,0.8665968345600874,TPESampler,COMPLETE
10,0.35969738029735465,2025-04-24 22:01:08.826827,2025-04-24 22:01:10.454182,0 days 00:00:01.627355,0.016556038767249502,6,sqrt,3,13,737,0.6828829738622901,TPESampler,COMPLETE
11,0.5511654033979188,2025-04-24 22:01:09.974129,2025-04-24 22:01:11.976767,0 days 00:00:02.002638,0.019423587380129743,3,log2,8,19,1037,0.7910977345990728,TPESampler,COMPLETE
12,0.3006998358720309,2025-04-24 22:01:10.419637,2025-04-24 22:01:12.581225,0 days 00:00:02.161588,0.043597034682040375,5,sqrt,1,10,814,0.9621991042083435,TPESampler,COMPLETE
13,0.35345913509608234,2025-04-24 22:01:10.653336,2025-04-24 22:01:12.888741,0 days 00:00:02.235405,0.015239545332105392,5,sqrt,2,11,985,0.7202348781390822,TPESampler,COMPLETE
14,0.3404538141591984,2025-04-24 22:01:12.158401,2025-04-24 22:01:13.533150,0 days 00:00:01.374749,0.03379722715709394,6,sqrt,3,14,440,0.6365695072332138,TPESampler,COMPLETE
15,0.3279655858684317,2025-04-24 22:01:13.062206,2025-04-24 22:01:15.303984,0 days 00:00:02.241778,0.03448125310547454,3,sqrt,1,7,1046,0.9883735477664867,TPESampler,COMPLETE
16,0.28073470374671966,2025-04-24 22:01:13.250832,2025-04-24 22:01:16.076174,0 days 00:00:02.825342,0.04094121938654096,9,sqrt,3,7,1224,0.9894134352424593,TPESampler,COMPLETE
17,0.3802238728964781,2025-04-24 22:01:13.750562,2025-04-24 22:01:15.044441,0 days 00:00:01.293879,0.04358264818796085,4,sqrt,4,14,314,0.9737122538663548,TPESampler,COMPLETE
18,0.5597509766050123,2025-04-24 22:01:15.239698,2025-04-24 22:01:16.725612,0 days 00:00:01.485914,0.014165613738626886,3,log2,2,10,571,0.8991300516733178,TPESampler,COMPLETE
19,0.32070246544511044,2025-04-24 22:01:15.541752,2025-04-24 22:01:18.712156,0 days 00:00:03.170404,0.03912888082418866,3,sqrt,2,14,1460,0.9456105415910623,TPESampler,COMPLETE
20,0.28538720471566303,2025-04-24 22:01:16.256096,2025-04-24 22:01:19.257692,0 days 00:00:03.001596,0.02721850912870089,10,sqrt,2,2,1241,0.9820734199540722,TPESampler,COMPLETE
21,0.3068171397511628,2025-04-24 22:01:16.909389,2025-04-24 22:01:19.751968,0 days 00:00:02.842579,0.06629783379178458,10,log2,4,8,1446,0.9128948859831844,TPESampler,COMPLETE
22,0.33309109843822843,2025-04-24 22:01:18.892854,2025-04-24 22:01:25.169433,0 days 00:00:06.276579,0.02855599801079688,7,,6,7,1159,0.9825542437075361,TPESampler,COMPLETE
23,0.29380513679584935,2025-04-24 22:01:19.496879,2025-04-24 22:01:21.514539,0 days 00:00:02.017660,0.030792664386327457,11,sqrt,4,4,1009,0.8975365548468569,TPESampler,COMPLETE
24,0.25964629588322735,2025-04-24 22:01:19.935446,2025-04-24 22:01:22.744251,0 days 00:00:02.808805,0.05559849771522852,10,sqrt,1,5,1352,0.9930230834377587,TPESampler,COMPLETE
25,0.2988246295899452,2025-04-24 22:01:21.690913,2025-04-24 22:01:23.513056,0 days 00:00:01.822143,0.02189084465197078,11,sqrt,4,7,910,0.8908781816401001,TPESampler,COMPLETE
26,0.3124353638359566,2025-04-24 22:01:22.911342,2025-04-24 22:01:30.596697,0 days 00:00:07.685355,0.041770344017883126,10,,1,3,1104,0.9814022336476979,TPESampler,COMPLETE
27,0.25502021705856187,2025-04-24 22:01:23.694631,2025-04-24 22:01:25.817171,0 days 00:00:02.122540,0.06024355279376863,8,sqrt,1,7,1371,0.9229409279063121,TPESampler,COMPLETE
28,0.2953846269048501,2025-04-24 22:01:25.345255,2025-04-24 22:01:27.724551,0 days 00:00:02.379296,0.01730292076519921,11,sqrt,1,2,1019,0.9945691336571267,TPESampler,COMPLETE
29,0.24773797204028197,2025-04-24 22:01:25.995158,2025-04-24 22:01:28.485360,0 days 00:00:02.490202,0.06759832583898595,8,sqrt,1,5,1400,0.8594657197567646,TPESampler,COMPLETE
30,0.29351422456665516,2025-04-24 22:01:27.894397,2025-04-24 22:01:36.118859,0 days 00:00:08.224462,0.04392767629820109,10,,2,13,1329,0.8780938009968542,TPESampler,COMPLETE
31,0.27184947032839657,2025-04-24 22:01:28.655010,2025-04-24 22:01:31.348046,0 days 00:00:02.693036,0.08509518723118957,8,sqrt,3,7,1404,0.8571447281219104,TPESampler,COMPLETE
32,0.2604969999006561,2025-04-24 22:01:30.761641,2025-04-24 22:01:32.581688,0 days 00:00:01.820047,0.09667995972664115,10,sqrt,3,4,902,0.9281213017676639,TPESampler,COMPLETE
33,0.24471223974509482,2025-04-24 22:01:31.503348,2025-04-24 22:01:34.048701,0 days 00:00:02.545353,0.08251362433039722,7,sqrt,1,5,1446,0.8629484806391395,TPESampler,COMPLETE
34,0.256546848224885,2025-04-24 22:01:32.763481,2025-04-24 22:01:35.508931,0 days 00:00:02.745450,0.07694899351044569,10,sqrt,1,4,1386,0.9831526881819704,TPESampler,COMPLETE
35,0.3237808438634532,2025-04-24 22:01:34.259321,2025-04-24 22:01:36.203718,0 days 00:00:01.944397,0.061732961118056345,6,log2,2,3,1134,0.8294572356753883,TPESampler,COMPLETE
36,0.2608810904844518,2025-04-24 22:01:35.685357,2025-04-24 22:01:39.050374,0 days 00:00:03.365017,0.04187535487694085,9,sqrt,1,3,1497,0.7768186305492707,TPESampler,COMPLETE
37,0.2546486404133153,2025-04-24 22:01:36.267429,2025-04-24 22:01:39.402380,0 days 00:00:03.134951,0.05146218270502134,7,sqrt,1,5,1225,0.8814581229606316,TPESampler,COMPLETE
38,0.2571521959233195,2025-04-24 22:01:36.384095,2025-04-24 22:01:39.713793,0 days 00:00:03.329698,0.07855676772722653,6,sqrt,1,3,1443,0.8782951767977032,TPESampler,COMPLETE
39,0.2940497983228729,2025-04-24 22:01:39.352812,2025-04-24 22:01:46.953915,0 days 00:00:07.601103,0.058372476768436245,8,,3,4,1468,0.7925272174740051,TPESampler,COMPLETE
40,0.27596634801253767,2025-04-24 22:01:39.676339,2025-04-24 22:01:41.948100,0 days 00:00:02.271761,0.055849279062993154,7,sqrt,3,7,1128,0.7760238419387436,TPESampler,COMPLETE
41,0.247609494380881,2025-04-24 22:01:39.931703,2025-04-24 22:01:42.170113,0 days 00:00:02.238410,0.06675701097892801,7,sqrt,1,7,1114,0.8976711286289523,TPESampler,COMPLETE
42,0.3379530789097146,2025-04-24 22:01:42.118002,2025-04-24 22:01:44.593284,0 days 00:00:02.475282,0.030836244609454316,4,sqrt,5,2,1434,0.8556171361035949,TPESampler,COMPLETE
43,0.2659220569363624,2025-04-24 22:01:42.377935,2025-04-24 22:01:44.520156,0 days 00:00:02.142221,0.04449433740303716,7,sqrt,1,5,1031,0.8456812260202655,TPESampler,COMPLETE
44,0.2741677343587386,2025-04-24 22:01:44.654167,2025-04-24 22:01:51.184988,0 days 00:00:06.530821,0.06057797694005306,7,,1,10,1151,0.9686126350802015,TPESampler,COMPLETE
45,0.2413501860056789,2025-04-24 22:01:44.764795,2025-04-24 22:01:47.073276,0 days 00:00:02.308481,0.06665852326672489,9,sqrt,1,8,1363,0.8095431156329486,TPESampler,COMPLETE
46,0.3019176136454884,2025-04-24 22:01:47.125322,2025-04-24 22:01:49.097187,0 days 00:00:01.971865,0.04902694990248179,9,log2,1,9,911,0.8752829825380455,TPESampler,COMPLETE
47,0.271556915724302,2025-04-24 22:01:47.248940,2025-04-24 22:01:49.792363,0 days 00:00:02.543423,0.05726016959215827,9,sqrt,2,11,1352,0.7867303777177531,TPESampler,COMPLETE
48,0.28024282520507254,2025-04-24 22:01:49.376290,2025-04-24 22:01:52.455072,0 days 00:00:03.078782,0.09881444514555132,6,log2,1,12,1449,0.8154893371413043,TPESampler,COMPLETE
49,0.32148314236720005,2025-04-24 22:01:50.024372,2025-04-24 22:01:52.922662,0 days 00:00:02.898290,0.038352338968617956,6,log2,1,6,1410,0.9742884574932158,TPESampler,COMPLETE
50,0.2484198481027941,2025-04-24 22:01:51.376346,2025-04-24 22:01:54.559643,0 days 00:00:03.183297,0.08947149417816379,5,sqrt,1,8,1336,0.7511206735380019,TPESampler,COMPLETE
51,0.28793565985083974,2025-04-24 22:01:52.636121,2025-04-24 22:01:55.692549,0 days 00:00:03.056428,0.07765204284913801,9,log2,1,7,1391,0.8524049210732683,TPESampler,COMPLETE
52,0.2580375082059768,2025-04-24 22:01:53.081731,2025-04-24 22:01:55.085432,0 days 00:00:02.003701,0.09721783660808409,8,sqrt,1,9,699,0.8526713684367575,TPESampler,COMPLETE
53,0.2935825575729021,2025-04-24 22:01:54.736175,2025-04-24 22:01:57.724872,0 days 00:00:02.988697,0.06856809352786487,5,sqrt,2,9,1343,0.7598946918004977,TPESampler,COMPLETE
54,0.2748832281331857,2025-04-24 22:01:55.277722,2025-04-24 22:01:58.343538,0 days 00:00:03.065816,0.09229910207309582,5,sqrt,1,3,1325,0.7170257071235567,TPESampler,COMPLETE
55,0.24797048019122578,2025-04-24 22:01:55.901377,2025-04-24 22:01:58.887332,0 days 00:00:02.985955,0.09468104386108597,8,sqrt,1,10,1276,0.7762398854854299,TPESampler,COMPLETE
56,0.2841582671683376,2025-04-24 22:01:57.898574,2025-04-24 22:02:01.622928,0 days 00:00:03.724354,0.08720200785810646,3,,1,10,1123,0.6667364486693739,TPESampler,COMPLETE
57,0.2857143593857883,2025-04-24 22:01:58.550920,2025-04-24 22:02:01.083873,0 days 00:00:02.532953,0.07102530794548992,5,sqrt,2,9,1206,0.9032448582597686,TPESampler,COMPLETE
58,0.2611201167697776,2025-04-24 22:01:59.042950,2025-04-24 22:02:01.552741,0 days 00:00:02.509791,0.09196264277716287,9,sqrt,1,7,1169,0.7215161797643459,TPESampler,COMPLETE
59,0.6822067046676268,2025-04-24 22:02:01.262689,2025-04-24 22:02:02.364018,0 days 00:00:01.101329,0.020819190491901576,7,log2,10,17,476,0.638521001136271,TPESampler,COMPLETE
60,0.25538523079343134,2025-04-24 22:02:01.723147,2025-04-24 22:02:05.370666,0 days 00:00:03.647519,0.09351671652019769,9,sqrt,1,14,1454,0.7460570773271371,TPESampler,COMPLETE
61,0.24297771445530617,2025-04-24 22:02:01.801423,2025-04-24 22:02:05.398414,0 days 00:00:03.596991,0.097776365044469,9,sqrt,2,5,1470,0.7720381732457864,TPESampler,COMPLETE
62,0.3847893996473062,2025-04-24 22:02:02.541802,2025-04-24 22:02:04.381195,0 days 00:00:01.839393,0.020442005991605998,11,log2,2,10,597,0.6286918222549749,TPESampler,COMPLETE
63,0.2849366519045189,2025-04-24 22:02:04.557801,2025-04-24 22:02:11.799479,0 days 00:00:07.241678,0.08355739869333127,6,,1,5,1487,0.8367722066021199,TPESampler,COMPLETE
64,0.25161707391987026,2025-04-24 22:02:05.501751,2025-04-24 22:02:08.284627,0 days 00:00:02.782876,0.0727352982370974,9,sqrt,1,5,1347,0.7728535801567308,TPESampler,COMPLETE
65,0.333975854766019,2025-04-24 22:02:05.552400,2025-04-24 22:02:08.382193,0 days 00:00:02.829793,0.018392145715731965,10,log2,2,10,1406,0.7616311130355309,TPESampler,COMPLETE
66,0.2540192781007802,2025-04-24 22:02:08.450539,2025-04-24 22:02:11.043878,0 days 00:00:02.593339,0.09258171113190612,5,sqrt,1,11,1276,0.7436947155696729,TPESampler,COMPLETE
67,0.23459154708221225,2025-04-24 22:02:08.586752,2025-04-24 22:02:11.881191,0 days 00:00:03.294439,0.07688046442545539,10,sqrt,1,11,1289,0.8743474491221417,TPESampler,COMPLETE
68,0.39451223645526695,2025-04-24 22:02:11.211657,2025-04-24 22:02:14.472554,0 days 00:00:03.260897,0.08519489953024972,5,,10,3,754,0.7334864013559564,TPESampler,COMPLETE
69,0.26069407925307453,2025-04-24 22:02:11.935149,2025-04-24 22:02:14.483938,0 days 00:00:02.548789,0.07578715822994748,9,sqrt,2,13,1223,0.8775139646878855,TPESampler,COMPLETE
70,0.24005804587328558,2025-04-24 22:02:11.996108,2025-04-24 22:02:15.179383,0 days 00:00:03.183275,0.06944922786170656,11,sqrt,1,12,1450,0.901095764609999,TPESampler,COMPLETE
71,0.24763690240813171,2025-04-24 22:02:14.616263,2025-04-24 22:02:18.505060,0 days 00:00:03.888797,0.09784852481870225,8,sqrt,1,6,1490,0.7675799848942627,TPESampler,COMPLETE
72,0.25625432606094944,2025-04-24 22:02:14.664391,2025-04-24 22:02:17.399176,0 days 00:00:02.734785,0.09867206871599547,12,sqrt,1,10,940,0.8739300562580301,TPESampler,COMPLETE
73,0.26878243672147445,2025-04-24 22:02:15.374807,2025-04-24 22:02:18.567124,0 days 00:00:03.192317,0.04918877227846032,12,sqrt,3,8,1377,0.8593579496501748,TPESampler,COMPLETE
74,0.27759057744347576,2025-04-24 22:02:17.588101,2025-04-24 22:02:20.689313,0 days 00:00:03.101212,0.042223148858797487,9,sqrt,3,13,1416,0.9559717175700024,TPESampler,COMPLETE
75,0.2849357854554169,2025-04-24 22:02:18.651509,2025-04-24 22:02:22.188113,0 days 00:00:03.536604,0.0702884108709016,8,sqrt,4,2,1456,0.8817003380531055,TPESampler,COMPLETE
76,0.23249258764592687,2025-04-24 22:02:18.721926,2025-04-24 22:02:22.216068,0 days 00:00:03.494142,0.09113331373126339,9,sqrt,1,9,1427,0.8658727478954149,TPESampler,COMPLETE
77,0.2620857281808477,2025-04-24 22:02:20.875056,2025-04-24 22:02:23.807981,0 days 00:00:02.932925,0.08342418789782632,9,sqrt,3,4,1320,0.80984483858488,TPESampler,COMPLETE
78,0.2477704892897913,2025-04-24 22:02:22.332549,2025-04-24 22:02:25.862156,0 days 00:00:03.529607,0.0821001691023165,11,sqrt,1,12,1465,0.8366919992283235,TPESampler,COMPLETE
79,0.24540594800460752,2025-04-24 22:02:22.383423,2025-04-24 22:02:26.014691,0 days 00:00:03.631268,0.055855154535097415,12,sqrt,1,15,1465,0.867044088659832,TPESampler,COMPLETE
80,0.40599984069812606,2025-04-24 22:02:24.013424,2025-04-24 22:02:27.176689,0 days 00:00:03.163265,0.0478118278200674,9,sqrt,9,9,1468,0.8672485714626668,TPESampler,COMPLETE
81,0.24339571129584017,2025-04-24 22:02:26.035950,2025-04-24 22:02:29.114938,0 days 00:00:03.078988,0.07405568716061535,12,sqrt,1,16,1158,0.8788740004294553,TPESampler,COMPLETE
82,0.2770359109375687,2025-04-24 22:02:26.194699,2025-04-24 22:02:29.121468,0 days 00:00:02.926769,0.05641692529034694,11,log2,1,18,1182,0.8874201127943755,TPESampler,COMPLETE
83,0.2762145481286355,2025-04-24 22:02:27.345201,2025-04-24 22:02:30.408571,0 days 00:00:03.063370,0.08746108606117589,12,sqrt,4,2,1494,0.7431635884417338,TPESampler,COMPLETE
84,0.2585052019840407,2025-04-24 22:02:29.283979,2025-04-24 22:02:32.655275,0 days 00:00:03.371296,0.07402272323335958,11,sqrt,2,19,1469,0.8939941328761808,TPESampler,COMPLETE
85,0.2730026357099766,2025-04-24 22:02:29.333820,2025-04-24 22:02:32.118530,0 days 00:00:02.784710,0.04681607246357312,11,sqrt,2,19,1076,0.8181851837029229,TPESampler,COMPLETE
86,0.24513050282155857,2025-04-24 22:02:30.591650,2025-04-24 22:02:33.410576,0 days 00:00:02.818926,0.09693751342248721,12,sqrt,1,12,1226,0.9492734066553649,TPESampler,COMPLETE
87,0.24782603532336947,2025-04-24 22:02:32.290920,2025-04-24 22:02:34.857652,0 days 00:00:02.566732,0.04511796186235428,11,sqrt,1,15,1105,0.9448498376032547,TPESampler,COMPLETE
88,0.5920351587010325,2025-04-24 22:02:32.854715,2025-04-24 22:02:33.669041,0 days 00:00:00.814326,0.03447512832018719,5,sqrt,8,19,100,0.7531374529051917,TPESampler,COMPLETE
89,0.2775932290642902,2025-04-24 22:02:33.610106,2025-04-24 22:02:36.489145,0 days 00:00:02.879039,0.09269940790955944,10,log2,1,3,1445,0.6219334221836381,TPESampler,COMPLETE
90,0.24559209148276823,2025-04-24 22:02:33.922013,2025-04-24 22:02:36.392348,0 days 00:00:02.470335,0.09737276187636627,11,sqrt,2,16,1146,0.9720792977954594,TPESampler,COMPLETE
91,0.29855519467377173,2025-04-24 22:02:35.023177,2025-04-24 22:02:40.889227,0 days 00:00:05.866050,0.05979914688264101,11,,2,12,801,0.946988779452941,TPESampler,COMPLETE
92,0.22765688373244428,2025-04-24 22:02:36.543916,2025-04-24 22:02:38.974940,0 days 00:00:02.431024,0.0979769283262056,11,sqrt,1,13,1263,0.9266837304220462,TPESampler,COMPLETE
93,0.24737674495983303,2025-04-24 22:02:36.666810,2025-04-24 22:02:39.075569,0 days 00:00:02.408759,0.08930757868790848,11,sqrt,1,15,1243,0.9849123028970129,TPESampler,COMPLETE
94,0.26068639777798297,2025-04-24 22:02:39.146183,2025-04-24 22:02:42.215528,0 days 00:00:03.069345,0.048341657464093114,12,sqrt,2,13,1404,0.8849216623811704,TPESampler,COMPLETE
95,0.2404647422041919,2025-04-24 22:02:39.327835,2025-04-24 22:02:42.410729,0 days 00:00:03.082894,0.0797798292977768,12,sqrt,1,11,1496,0.9437239495694777,TPESampler,COMPLETE
96,0.2686530530454004,2025-04-24 22:02:41.085217,2025-04-24 22:02:47.933020,0 days 00:00:06.847803,0.07795092815804652,10,,1,18,1205,0.7857004865336481,TPESampler,COMPLETE
97,0.2581834850671503,2025-04-24 22:02:42.637363,2025-04-24 22:02:46.252470,0 days 00:00:03.615107,0.09353013176721506,9,sqrt,2,9,1484,0.8701979296861262,TPESampler,COMPLETE
98,0.2925057826996275,2025-04-24 22:02:42.917159,2025-04-24 22:02:46.267459,0 days 00:00:03.350300,0.07729985350828952,10,sqrt,5,10,1467,0.9949839019859097,TPESampler,COMPLETE
99,0.283470501774429,2025-04-24 22:02:46.529915,2025-04-24 22:02:57.467817,0 days 00:00:10.937902,0.08280641586704943,11,,1,13,1491,0.9194713904401026,TPESampler,COMPLETE
100,0.2441614669937292,2025-04-24 22:02:46.615471,2025-04-24 22:02:48.907946,0 days 00:00:02.292475,0.09391406648798693,11,sqrt,1,18,806,0.8837344171887626,TPESampler,COMPLETE
101,0.2563476460920209,2025-04-24 22:02:48.127885,2025-04-24 22:02:50.929102,0 days 00:00:02.801217,0.08973614899277661,12,sqrt,2,12,1454,0.9470257919744648,TPESampler,COMPLETE
102,0.2738703705287984,2025-04-24 22:02:49.219470,2025-04-24 22:02:50.512867,0 days 00:00:01.293397,0.08741224342309849,12,sqrt,2,20,362,0.8798487804229009,TPESampler,COMPLETE
103,0.2728209478019873,2025-04-24 22:02:50.884342,2025-04-24 22:02:52.532278,0 days 00:00:01.647936,0.09272498149967436,12,log2,1,15,608,0.8966284477457814,TPESampler,COMPLETE
104,0.23842709168705414,2025-04-24 22:02:51.240975,2025-04-24 22:02:53.361495,0 days 00:00:02.120520,0.06968216728511215,10,sqrt,1,16,862,0.8416832509670268,TPESampler,COMPLETE
105,0.28605128546916375,2025-04-24 22:02:53.104975,2025-04-24 22:02:54.945377,0 days 00:00:01.840402,0.08348356983819932,9,sqrt,3,20,723,0.7334182345136361,TPESampler,COMPLETE
106,0.2585612062047122,2025-04-24 22:02:53.683979,2025-04-24 22:02:55.610701,0 days 00:00:01.926722,0.08428548421193119,12,sqrt,2,19,822,0.8414923329582572,TPESampler,COMPLETE
107,0.2601133698008802,2025-04-24 22:02:55.221641,2025-04-24 22:02:57.183291,0 days 00:00:01.961650,0.08124195048001902,9,sqrt,2,16,945,0.8767400712064307,TPESampler,COMPLETE
108,0.4417369250410596,2025-04-24 22:02:55.792394,2025-04-24 22:02:57.102456,0 days 00:00:01.310062,0.03461357220919347,10,sqrt,8,3,514,0.6505812513114057,TPESampler,COMPLETE
109,0.23767138096578444,2025-04-24 22:02:57.239730,2025-04-24 22:03:00.054629,0 days 00:00:02.814899,0.09070339480175929,11,sqrt,1,17,985,0.8394514899161776,TPESampler,COMPLETE
110,0.29808254464208955,2025-04-24 22:02:57.317361,2025-04-24 22:02:59.397216,0 days 00:00:02.079855,0.07583874058299415,7,sqrt,2,18,449,0.9109815862652324,TPESampler,COMPLETE
111,0.3346950687770028,2025-04-24 22:02:58.275061,2025-04-24 22:03:06.510919,0 days 00:00:08.235858,0.09000476284937015,10,,2,7,1174,0.9069221207142933,TPESampler,COMPLETE
112,0.44706590962824133,2025-04-24 22:02:59.584364,2025-04-24 22:03:01.830286,0 days 00:00:02.245922,0.06426252084126294,4,log2,8,19,1355,0.6489338625232746,TPESampler,COMPLETE
113,0.28678692737363026,2025-04-24 22:03:00.295247,2025-04-24 22:03:01.913984,0 days 00:00:01.618737,0.05245975074941327,11,sqrt,3,13,596,0.8674865197160558,TPESampler,COMPLETE
114,0.25511920204160893,2025-04-24 22:03:02.133969,2025-04-24 22:03:03.849478,0 days 00:00:01.715509,0.09618305265155845,10,sqrt,1,20,811,0.9512618618782518,TPESampler,COMPLETE
115,0.28223090887466734,2025-04-24 22:03:02.290029,2025-04-24 22:03:04.779900,0 days 00:00:02.489871,0.07203394930418956,12,log2,2,9,1470,0.9719232288297889,TPESampler,COMPLETE
116,0.23787118055522435,2025-04-24 22:03:04.024199,2025-04-24 22:03:06.036690,0 days 00:00:02.012491,0.08159039428382867,12,sqrt,1,15,1097,0.7016158255336482,TPESampler,COMPLETE
117,0.26886535684100665,2025-04-24 22:03:04.946324,2025-04-24 22:03:11.461797,0 days 00:00:06.515473,0.05051756105689469,12,,1,17,946,0.8924532433564785,TPESampler,COMPLETE
118,0.2623792555310611,2025-04-24 22:03:06.200421,2025-04-24 22:03:07.987484,0 days 00:00:01.787063,0.08313440342976543,12,sqrt,3,16,1024,0.68738204137776,TPESampler,COMPLETE
119,0.26346978588296255,2025-04-24 22:03:06.665370,2025-04-24 22:03:10.960488,0 days 00:00:04.295118,0.08691315958044753,11,,1,15,698,0.8111356469088583,TPESampler,COMPLETE
120,0.36746059273066145,2025-04-24 22:03:08.145012,2025-04-24 22:03:12.052661,0 days 00:00:03.907649,0.02590914751562021,5,,8,3,1297,0.6397378731864743,TPESampler,COMPLETE
121,0.2579773088513701,2025-04-24 22:03:11.130813,2025-04-24 22:03:12.778233,0 days 00:00:01.647420,0.06702557404150389,11,sqrt,1,14,603,0.7951913494617988,TPESampler,COMPLETE
122,0.2606437224635687,2025-04-24 22:03:11.671649,2025-04-24 22:03:14.474952,0 days 00:00:02.803303,0.08155493988913613,11,log2,1,14,1290,0.6229152767004053,TPESampler,COMPLETE
