number,value,datetime_start,datetime_complete,duration,params_learning_rate,params_max_depth,params_max_features,params_min_samples_leaf,params_min_samples_split,params_n_estimators,params_subsample,system_attrs_auto:sampler,state
984,0.28206948819508315,2025-04-24 22:18:24.959224,2025-04-24 22:18:27.382435,0 days 00:00:02.423211,0.06983577022941101,9,sqrt,3,17,1023,0.8907194110823922,TPESampler,COMPLETE
985,0.24954149588028648,2025-04-24 22:18:27.322035,2025-04-24 22:18:30.025622,0 days 00:00:02.703587,0.09526130673441399,10,sqrt,1,17,1105,0.8316017556295497,TPESampler,COMPLETE
986,0.24607531487159529,2025-04-24 22:18:27.489742,2025-04-24 22:18:30.510410,0 days 00:00:03.020668,0.06696878313583193,11,sqrt,1,16,1037,0.7882422171883181,TPESampler,COMPLETE
987,0.5064375063104729,2025-04-24 22:18:27.578305,2025-04-24 22:18:28.759504,0 days 00:00:01.181199,0.020368946636687844,8,sqrt,1,2,110,0.6582386368926987,TPESampler,COMPLETE
988,0.27158435379280965,2025-04-24 22:18:28.952544,2025-04-24 22:18:31.241822,0 days 00:00:02.289278,0.0685969286705217,11,sqrt,2,13,789,0.8120786976640234,TPESampler,COMPLETE
989,0.24665852167310146,2025-04-24 22:18:30.222725,2025-04-24 22:18:33.108096,0 days 00:00:02.885371,0.07461731340314265,11,sqrt,1,17,1105,0.87298755320308,TPESampler,COMPLETE
990,0.2647827023613069,2025-04-24 22:18:30.704688,2025-04-24 22:18:33.916049,0 days 00:00:03.211361,0.09404387374216476,10,sqrt,2,14,1222,0.8591542249714803,TPESampler,COMPLETE
991,0.3912180010098097,2025-04-24 22:18:31.440941,2025-04-24 22:18:33.504374,0 days 00:00:02.063433,0.041210745794903435,3,log2,1,7,832,0.9377294154142336,TPESampler,COMPLETE
992,0.2531274747660343,2025-04-24 22:18:33.307894,2025-04-24 22:18:36.024636,0 days 00:00:02.716742,0.09506810951669228,12,sqrt,1,19,1027,0.7049871980563238,TPESampler,COMPLETE
993,0.24364806076357132,2025-04-24 22:18:33.719902,2025-04-24 22:18:36.801484,0 days 00:00:03.081582,0.09035739990285273,9,sqrt,1,14,1224,0.8906894770947362,TPESampler,COMPLETE
994,0.24914657634224618,2025-04-24 22:18:34.161145,2025-04-24 22:18:37.311317,0 days 00:00:03.150172,0.09502486478906254,10,sqrt,1,14,1247,0.898307683473673,TPESampler,COMPLETE
995,0.27026540364567714,2025-04-24 22:18:36.211775,2025-04-24 22:18:39.379349,0 days 00:00:03.167574,0.06554843508463919,9,sqrt,2,16,1301,0.9154474288685228,TPESampler,COMPLETE
996,0.2723602916709328,2025-04-24 22:18:37.013278,2025-04-24 22:18:39.812319,0 days 00:00:02.799041,0.06339686253991543,11,sqrt,3,15,1137,0.96057434267671,TPESampler,COMPLETE
997,0.24376599469928764,2025-04-24 22:18:37.518598,2025-04-24 22:18:40.608276,0 days 00:00:03.089678,0.07070719990298616,11,sqrt,1,17,1223,0.9282096152016104,TPESampler,COMPLETE
998,0.2540635819224393,2025-04-24 22:18:39.584242,2025-04-24 22:18:42.778635,0 days 00:00:03.194393,0.0630181412191244,9,sqrt,1,20,1285,0.8504148393600166,TPESampler,COMPLETE
999,0.270763379306186,2025-04-24 22:18:40.049156,2025-04-24 22:18:43.141680,0 days 00:00:03.092524,0.057267947136240595,11,sqrt,2,18,1134,0.8608926985008003,TPESampler,COMPLETE
1000,0.2467815318708136,2025-04-24 22:18:40.878765,2025-04-24 22:18:43.590622,0 days 00:00:02.711857,0.0940462341199324,12,sqrt,1,14,977,0.7928526134833224,TPESampler,COMPLETE
1001,0.24527203678388096,2025-04-24 22:18:42.970772,2025-04-24 22:18:45.514744,0 days 00:00:02.543972,0.06991509525170986,11,sqrt,1,15,1103,0.875298808395138,TPESampler,COMPLETE
1002,0.26969712642605154,2025-04-24 22:18:43.353617,2025-04-24 22:18:45.765567,0 days 00:00:02.411950,0.0985963435671108,9,sqrt,3,15,1078,0.9568258162565814,TPESampler,COMPLETE
1003,0.2587350208568519,2025-04-24 22:18:43.829715,2025-04-24 22:18:50.451445,0 days 00:00:06.621730,0.06507994220543689,8,,1,19,1090,0.8838000294348997,TPESampler,COMPLETE
1004,0.24954570428619077,2025-04-24 22:18:45.716500,2025-04-24 22:18:48.021185,0 days 00:00:02.304685,0.09193552113677878,10,sqrt,1,19,1141,0.8840854056275114,TPESampler,COMPLETE
1005,0.24718737765594243,2025-04-24 22:18:46.022663,2025-04-24 22:18:48.493807,0 days 00:00:02.471144,0.09802736353698778,6,sqrt,1,16,1155,0.863648666117247,TPESampler,COMPLETE
1006,0.23165932153510918,2025-04-24 22:18:48.203459,2025-04-24 22:18:50.843884,0 days 00:00:02.640425,0.0951389028714809,10,sqrt,1,17,1276,0.8232535321840809,TPESampler,COMPLETE
1007,0.2967348672897148,2025-04-24 22:18:48.667795,2025-04-24 22:18:50.718280,0 days 00:00:02.050485,0.09995047345827467,10,log2,2,17,963,0.8129872024316529,TPESampler,COMPLETE
1008,0.2743836369527238,2025-04-24 22:18:50.665644,2025-04-24 22:18:53.389241,0 days 00:00:02.723597,0.09906601362857353,7,log2,1,10,1141,0.8953057975784787,TPESampler,COMPLETE
1009,0.2566509999774966,2025-04-24 22:18:50.970717,2025-04-24 22:18:54.469721,0 days 00:00:03.499004,0.0524127112704435,11,sqrt,1,16,1343,0.8620459637059686,TPESampler,COMPLETE
1010,0.23900898188475858,2025-04-24 22:18:51.116803,2025-04-24 22:18:54.218563,0 days 00:00:03.101760,0.09236381979493859,10,sqrt,1,16,1152,0.8033419427321924,TPESampler,COMPLETE
1011,0.2415464530039211,2025-04-24 22:18:53.579877,2025-04-24 22:18:56.927822,0 days 00:00:03.347945,0.09226470708157695,10,sqrt,1,16,1322,0.8393784919897991,TPESampler,COMPLETE
1012,0.45795458435624536,2025-04-24 22:18:54.429689,2025-04-24 22:18:57.238469,0 days 00:00:02.808780,0.04237455696375383,8,log2,10,4,1369,0.9226948077419993,TPESampler,COMPLETE
1013,0.260004661570412,2025-04-24 22:18:54.678464,2025-04-24 22:18:58.311964,0 days 00:00:03.633500,0.06175886446774021,11,sqrt,2,16,1373,0.8641562266519491,TPESampler,COMPLETE
1014,0.2753316098096355,2025-04-24 22:18:57.114957,2025-04-24 22:18:59.593274,0 days 00:00:02.478317,0.06305428185348451,10,sqrt,3,16,1226,0.8447811648081653,TPESampler,COMPLETE
1015,0.3036040410307543,2025-04-24 22:18:57.439749,2025-04-24 22:18:59.635707,0 days 00:00:02.195958,0.042637309581263154,8,,2,8,339,0.7276674182918234,TPESampler,COMPLETE
1016,0.26372729618551105,2025-04-24 22:18:58.517239,2025-04-24 22:19:01.298726,0 days 00:00:02.781487,0.05728572135714184,8,sqrt,1,13,1250,0.9296583346739435,TPESampler,COMPLETE
1017,0.2300722256268454,2025-04-24 22:18:59.734843,2025-04-24 22:19:02.680116,0 days 00:00:02.945273,0.09711540048553356,9,sqrt,1,15,1317,0.7940693890543871,TPESampler,COMPLETE
1018,0.2689775144216629,2025-04-24 22:18:59.786047,2025-04-24 22:19:09.043845,0 days 00:00:09.257798,0.08680854004309492,12,,1,17,1191,0.8777657515858837,TPESampler,COMPLETE
1019,0.3647942701364804,2025-04-24 22:19:01.479390,2025-04-24 22:19:03.217927,0 days 00:00:01.738537,0.037290421595831076,6,sqrt,6,14,825,0.6906911738400672,TPESampler,COMPLETE
1020,0.2775574556561133,2025-04-24 22:19:02.858312,2025-04-24 22:19:05.159266,0 days 00:00:02.300954,0.06832943326447413,8,sqrt,2,17,1141,0.7251799897026819,TPESampler,COMPLETE
1021,0.3114711452056654,2025-04-24 22:19:03.392497,2025-04-24 22:19:05.618484,0 days 00:00:02.225987,0.07395775236217993,10,log2,4,19,1314,0.720522318004171,TPESampler,COMPLETE
1022,0.2548432898559046,2025-04-24 22:19:05.340386,2025-04-24 22:19:08.035802,0 days 00:00:02.695416,0.09610524358124005,8,sqrt,2,13,1417,0.7962357206902658,TPESampler,COMPLETE
1023,0.26850416705882507,2025-04-24 22:19:05.861838,2025-04-24 22:19:07.963185,0 days 00:00:02.101347,0.04052430001555396,10,sqrt,1,3,1024,0.6496367614145168,TPESampler,COMPLETE
1024,0.32287183397978686,2025-04-24 22:19:08.112364,2025-04-24 22:19:17.041950,0 days 00:00:08.929586,0.0677303509165011,10,,5,17,1424,0.8710919611507689,TPESampler,COMPLETE
1025,0.4365208609485639,2025-04-24 22:19:08.187646,2025-04-24 22:19:10.349390,0 days 00:00:02.161744,0.012995468134545007,3,,3,16,463,0.9315250340999276,TPESampler,COMPLETE
1026,0.2607364546733917,2025-04-24 22:19:09.221215,2025-04-24 22:19:11.992243,0 days 00:00:02.771028,0.048710722916796734,10,sqrt,2,6,1490,0.9484424017907267,TPESampler,COMPLETE
1027,0.3178997627181327,2025-04-24 22:19:10.540215,2025-04-24 22:19:12.470666,0 days 00:00:01.930451,0.06684614956245105,8,log2,3,17,1027,0.9051409937335114,TPESampler,COMPLETE
1028,0.26104185251458617,2025-04-24 22:19:12.185125,2025-04-24 22:19:14.158811,0 days 00:00:01.973686,0.09107589973530306,10,sqrt,3,15,1079,0.782362651413215,TPESampler,COMPLETE
1029,0.4071713780387853,2025-04-24 22:19:12.659069,2025-04-24 22:19:13.704664,0 days 00:00:01.045595,0.03173063486349445,7,,7,5,117,0.7054221115370312,TPESampler,COMPLETE
1030,0.25138997999246987,2025-04-24 22:19:14.079879,2025-04-24 22:19:16.492869,0 days 00:00:02.412990,0.08072833407130155,9,sqrt,1,13,1203,0.8146923634841884,TPESampler,COMPLETE
1031,0.24308870655471276,2025-04-24 22:19:14.404106,2025-04-24 22:19:16.957059,0 days 00:00:02.552953,0.09838550125852004,11,sqrt,2,17,1207,0.8553846819951145,TPESampler,COMPLETE
1032,0.2713079425553014,2025-04-24 22:19:16.672140,2025-04-24 22:19:19.277959,0 days 00:00:02.605819,0.08861102192244759,8,sqrt,2,17,1064,0.7942541017179578,TPESampler,COMPLETE
1033,0.24250382793317618,2025-04-24 22:19:17.195222,2025-04-24 22:19:20.602023,0 days 00:00:03.406801,0.06722347545335425,9,sqrt,1,16,1320,0.9089518432500303,TPESampler,COMPLETE
1034,0.2434768427080699,2025-04-24 22:19:17.239955,2025-04-24 22:19:20.603507,0 days 00:00:03.363552,0.090180093081039,9,sqrt,1,16,1316,0.8652884977533931,TPESampler,COMPLETE
1035,0.2360868566850511,2025-04-24 22:19:19.479621,2025-04-24 22:19:22.206093,0 days 00:00:02.726472,0.09887272005299166,10,sqrt,1,17,1222,0.7949230542813318,TPESampler,COMPLETE
1036,0.24819432702217492,2025-04-24 22:19:20.763998,2025-04-24 22:19:24.497737,0 days 00:00:03.733739,0.07554956836147379,10,sqrt,1,17,1465,0.8624144393648954,TPESampler,COMPLETE
1037,0.25278075156843055,2025-04-24 22:19:20.812952,2025-04-24 22:19:23.899547,0 days 00:00:03.086595,0.09244547834087406,8,sqrt,1,10,1092,0.9784345324031929,TPESampler,COMPLETE
1038,0.2508335953224757,2025-04-24 22:19:22.389669,2025-04-24 22:19:24.847507,0 days 00:00:02.457838,0.07426486989687128,10,sqrt,1,17,931,0.8693640930862145,TPESampler,COMPLETE
1039,0.33231609101585985,2025-04-24 22:19:24.097813,2025-04-24 22:19:26.182933,0 days 00:00:02.085120,0.046869351959286126,7,log2,2,10,821,0.6800457143987221,TPESampler,COMPLETE
1040,0.2599734600455204,2025-04-24 22:19:24.678319,2025-04-24 22:19:27.604921,0 days 00:00:02.926602,0.09569827473414226,9,sqrt,2,17,1220,0.7359056564594415,TPESampler,COMPLETE
1041,0.23130052707921478,2025-04-24 22:19:25.041558,2025-04-24 22:19:27.513327,0 days 00:00:02.471769,0.09329576131290546,9,sqrt,1,13,907,0.8181557330255146,TPESampler,COMPLETE
1042,0.23195999875722406,2025-04-24 22:19:26.367676,2025-04-24 22:19:29.891739,0 days 00:00:03.524063,0.09043701429835331,10,sqrt,1,15,1465,0.8963647445829643,TPESampler,COMPLETE
1043,0.2791002609036622,2025-04-24 22:19:27.663302,2025-04-24 22:19:29.993507,0 days 00:00:02.330205,0.0753023400768582,7,sqrt,2,11,811,0.8237386620024115,TPESampler,COMPLETE
1044,0.2853334986151995,2025-04-24 22:19:27.751726,2025-04-24 22:19:30.168734,0 days 00:00:02.417008,0.06846316368948155,11,sqrt,4,20,861,0.7956336759716092,TPESampler,COMPLETE
1045,0.3131098892014022,2025-04-24 22:19:30.120346,2025-04-24 22:19:33.354563,0 days 00:00:03.234217,0.055275804931219634,3,sqrt,2,5,1497,0.8376078568400495,TPESampler,COMPLETE
1046,0.2498412356572358,2025-04-24 22:19:30.167407,2025-04-24 22:19:32.965037,0 days 00:00:02.797630,0.09248574650270025,9,sqrt,1,12,776,0.8679349875588518,TPESampler,COMPLETE
1047,0.33478745564695284,2025-04-24 22:19:30.460396,2025-04-24 22:19:34.039726,0 days 00:00:03.579330,0.026680544694885646,3,sqrt,1,4,1491,0.6514096296748095,TPESampler,COMPLETE
1048,0.25575323999666105,2025-04-24 22:19:33.155887,2025-04-24 22:19:35.104086,0 days 00:00:01.948199,0.09683251437650231,10,sqrt,1,10,763,0.7828437637508906,TPESampler,COMPLETE
1049,0.28429636940695047,2025-04-24 22:19:33.591054,2025-04-24 22:19:41.021810,0 days 00:00:07.430756,0.06598916511640532,9,,3,19,1315,0.8314749749738534,TPESampler,COMPLETE
1050,0.34672115332456094,2025-04-24 22:19:34.247580,2025-04-24 22:19:36.165204,0 days 00:00:01.917624,0.07288813096871415,6,sqrt,6,8,1049,0.6767357483924326,TPESampler,COMPLETE
1051,0.28388509349203606,2025-04-24 22:19:35.298392,2025-04-24 22:19:44.497900,0 days 00:00:09.199508,0.026938467158001363,9,,2,13,1496,0.9595986186166109,TPESampler,COMPLETE
1052,0.42215872849114855,2025-04-24 22:19:36.351359,2025-04-24 22:19:37.980418,0 days 00:00:01.629059,0.028765436119540102,7,log2,7,20,1203,0.9088322896388856,TPESampler,COMPLETE
1053,0.4659740752257281,2025-04-24 22:19:38.167348,2025-04-24 22:19:39.467371,0 days 00:00:01.300023,0.03586297659420851,3,sqrt,10,8,814,0.6053883615926738,TPESampler,COMPLETE
1054,0.2704928476572682,2025-04-24 22:19:39.644389,2025-04-24 22:19:41.907998,0 days 00:00:02.263609,0.09086003096725828,8,sqrt,2,15,1382,0.8092769056482061,TPESampler,COMPLETE
1055,0.28466720650734545,2025-04-24 22:19:41.204397,2025-04-24 22:19:46.235884,0 days 00:00:05.031487,0.09894333027430105,9,,3,20,910,0.811794827451715,TPESampler,COMPLETE
1056,0.25719628129803995,2025-04-24 22:19:42.077642,2025-04-24 22:19:43.674806,0 days 00:00:01.597164,0.0791743147204827,8,sqrt,1,15,890,0.8501820578157897,TPESampler,COMPLETE
1057,0.27217018389297504,2025-04-24 22:19:43.859808,2025-04-24 22:19:50.852960,0 days 00:00:06.993152,0.08595666981795551,9,,1,14,1263,0.7964636990292733,TPESampler,COMPLETE
1058,0.26313528090809674,2025-04-24 22:19:44.683747,2025-04-24 22:19:46.231533,0 days 00:00:01.547786,0.043942423280380914,10,sqrt,1,11,838,0.7762982981677079,TPESampler,COMPLETE
1059,0.2600210565265538,2025-04-24 22:19:46.393201,2025-04-24 22:19:48.099859,0 days 00:00:01.706658,0.09061443233613138,11,sqrt,1,14,680,0.8900857666885306,TPESampler,COMPLETE
1060,0.25610120378665424,2025-04-24 22:19:46.442432,2025-04-24 22:19:48.800346,0 days 00:00:02.357914,0.05659244804792618,8,sqrt,1,6,1052,0.9138736887367112,TPESampler,COMPLETE
1061,0.33210815009643263,2025-04-24 22:19:48.297063,2025-04-24 22:19:54.445233,0 days 00:00:06.148170,0.02728129083301776,7,,6,4,1227,0.8372769753711753,TPESampler,COMPLETE
1062,0.27240730132360014,2025-04-24 22:19:48.997087,2025-04-24 22:19:50.693619,0 days 00:00:01.696532,0.08424669105876503,9,sqrt,3,9,921,0.8255246474369138,TPESampler,COMPLETE
1063,0.25120394298335447,2025-04-24 22:19:50.855411,2025-04-24 22:19:53.550796,0 days 00:00:02.695385,0.09918755092927849,7,sqrt,1,15,1394,0.8138360559007957,TPESampler,COMPLETE
1064,0.22989454987179792,2025-04-24 22:19:51.070858,2025-04-24 22:19:53.578528,0 days 00:00:02.507670,0.09908263662570349,8,sqrt,1,13,1244,0.9041740030548997,TPESampler,COMPLETE
1065,0.28270475861683236,2025-04-24 22:19:53.696744,2025-04-24 22:20:00.635331,0 days 00:00:06.938587,0.0982358170839785,8,,1,11,1230,0.9372806422843338,TPESampler,COMPLETE
1066,0.29845183530105174,2025-04-24 22:19:53.746430,2025-04-24 22:20:00.570575,0 days 00:00:06.824145,0.07614147065023805,8,,2,11,1193,0.9218182024938154,TPESampler,COMPLETE
1067,0.2639707966921101,2025-04-24 22:19:54.619820,2025-04-24 22:19:56.633497,0 days 00:00:02.013677,0.09728348755882468,8,sqrt,2,13,1332,0.953947850239018,TPESampler,COMPLETE
1068,0.26720870574227873,2025-04-24 22:19:56.800783,2025-04-24 22:19:58.955218,0 days 00:00:02.154435,0.06924365552095933,10,sqrt,3,14,1365,0.9225983925212999,TPESampler,COMPLETE
1069,0.2897542388303366,2025-04-24 22:19:59.130121,2025-04-24 22:20:04.157530,0 days 00:00:05.027409,0.03188127309010742,6,,2,12,1328,0.6536711491998953,TPESampler,COMPLETE
1070,0.24427571430358586,2025-04-24 22:20:00.715010,2025-04-24 22:20:03.107787,0 days 00:00:02.392777,0.09663583870700329,8,sqrt,1,13,1293,0.8864397093489963,TPESampler,COMPLETE
1071,0.33656246726258776,2025-04-24 22:20:00.789896,2025-04-24 22:20:06.272177,0 days 00:00:05.482281,0.066760847140711,12,,8,18,751,0.9077333179999866,TPESampler,COMPLETE
1072,0.2519336101449137,2025-04-24 22:20:03.278061,2025-04-24 22:20:05.151044,0 days 00:00:01.872983,0.08266600584065345,9,sqrt,1,14,927,0.8632374427342343,TPESampler,COMPLETE
1073,0.5661868353117836,2025-04-24 22:20:04.369832,2025-04-24 22:20:05.938384,0 days 00:00:01.568552,0.022646054769701985,6,log2,8,14,926,0.6033014063804364,TPESampler,COMPLETE
1074,0.41740640064348716,2025-04-24 22:20:05.333032,2025-04-24 22:20:06.270975,0 days 00:00:00.937943,0.049857606770407584,5,sqrt,7,2,262,0.8226929713401777,TPESampler,COMPLETE
1075,0.28468206405789004,2025-04-24 22:20:06.194100,2025-04-24 22:20:08.391694,0 days 00:00:02.197594,0.06744965361430136,8,sqrt,2,13,782,0.767124573922139,TPESampler,COMPLETE
1076,0.2366354700560248,2025-04-24 22:20:06.480324,2025-04-24 22:20:09.133681,0 days 00:00:02.653357,0.06840510222966711,9,sqrt,1,14,1062,0.8364846306124358,TPESampler,COMPLETE
1077,0.4663210764383888,2025-04-24 22:20:06.597705,2025-04-24 22:20:07.632572,0 days 00:00:01.034867,0.07071686409765315,12,sqrt,10,6,111,0.8593192781070604,TPESampler,COMPLETE
1078,0.27265827390090325,2025-04-24 22:20:07.829427,2025-04-24 22:20:09.995426,0 days 00:00:02.165999,0.09610763689375718,9,sqrt,2,14,801,0.819288692174873,TPESampler,COMPLETE
1079,0.3173254153903633,2025-04-24 22:20:08.605858,2025-04-24 22:20:11.382053,0 days 00:00:02.776195,0.08262235937324244,5,log2,1,16,1177,0.8065979896554291,TPESampler,COMPLETE
1080,0.36170025168254155,2025-04-24 22:20:09.359123,2025-04-24 22:20:11.617752,0 days 00:00:02.258629,0.029286637781115645,12,sqrt,7,11,832,0.9716140470946971,TPESampler,COMPLETE
1081,0.25393610238224956,2025-04-24 22:20:10.198529,2025-04-24 22:20:12.825420,0 days 00:00:02.626891,0.09831997865017186,8,sqrt,1,14,1121,0.900380902508424,TPESampler,COMPLETE
1082,0.2860105357710713,2025-04-24 22:20:11.576229,2025-04-24 22:20:20.021347,0 days 00:00:08.445118,0.017592398027500965,8,,1,5,1454,0.9427206623906453,TPESampler,COMPLETE
1083,0.2671116259011142,2025-04-24 22:20:11.856693,2025-04-24 22:20:14.361050,0 days 00:00:02.504357,0.09837808584895716,11,sqrt,3,16,1395,0.9150516868975472,TPESampler,COMPLETE
1084,0.2845814688118613,2025-04-24 22:20:13.001645,2025-04-24 22:20:18.821927,0 days 00:00:05.820282,0.09006001387184764,10,,1,11,904,0.881433004974655,TPESampler,COMPLETE
1085,0.2788552282688355,2025-04-24 22:20:14.549588,2025-04-24 22:20:16.297184,0 days 00:00:01.747596,0.06250985939945662,8,sqrt,2,11,977,0.9076369028577232,TPESampler,COMPLETE
1086,0.26760938277307117,2025-04-24 22:20:16.485556,2025-04-24 22:20:18.190597,0 days 00:00:01.705041,0.06914058008957194,10,log2,1,15,1124,0.8625842599555771,TPESampler,COMPLETE
1087,0.2574380034933329,2025-04-24 22:20:18.370092,2025-04-24 22:20:20.930306,0 days 00:00:02.560214,0.06400272118216864,6,sqrt,1,14,1266,0.9478638458512936,TPESampler,COMPLETE
1088,0.23978005824065093,2025-04-24 22:20:19.038181,2025-04-24 22:20:21.750069,0 days 00:00:02.711888,0.07813300067280565,7,sqrt,1,12,1220,0.8976578860148989,TPESampler,COMPLETE
1089,0.27433658152100526,2025-04-24 22:20:20.223257,2025-04-24 22:20:23.009859,0 days 00:00:02.786602,0.09884306930218517,8,sqrt,3,17,1364,0.9484615225615751,TPESampler,COMPLETE
1090,0.2862820543527867,2025-04-24 22:20:21.117652,2025-04-24 22:20:26.904882,0 days 00:00:05.787230,0.010774764636971792,12,,1,14,957,0.656729015972122,TPESampler,COMPLETE
1091,0.250946511745756,2025-04-24 22:20:21.924929,2025-04-24 22:20:24.138994,0 days 00:00:02.214065,0.09365559517993184,10,sqrt,2,10,1136,0.9411368725146572,TPESampler,COMPLETE
1092,0.3458828588471865,2025-04-24 22:20:23.187537,2025-04-24 22:20:26.535838,0 days 00:00:03.348301,0.017678013613043334,5,,1,11,730,0.8978504795902128,TPESampler,COMPLETE
1093,0.25479477010332824,2025-04-24 22:20:24.317578,2025-04-24 22:20:25.911296,0 days 00:00:01.593718,0.06772786812717829,9,sqrt,1,16,827,0.7879206182894155,TPESampler,COMPLETE
1094,0.28521347529148156,2025-04-24 22:20:26.087182,2025-04-24 22:20:28.391175,0 days 00:00:02.303993,0.08745702046254207,10,sqrt,4,13,887,0.879102912161341,TPESampler,COMPLETE
1095,0.2587362630035093,2025-04-24 22:20:26.749657,2025-04-24 22:20:29.994812,0 days 00:00:03.245155,0.09586931036337981,11,sqrt,2,13,1335,0.9630064509126901,TPESampler,COMPLETE
1096,0.24572022723353742,2025-04-24 22:20:27.124889,2025-04-24 22:20:29.962985,0 days 00:00:02.838096,0.08394570678708708,8,sqrt,1,10,1107,0.7957513090846586,TPESampler,COMPLETE
1097,0.45564826573631423,2025-04-24 22:20:28.586052,2025-04-24 22:20:30.965691,0 days 00:00:02.379639,0.029076777022333248,4,log2,8,11,1243,0.9174933208754031,TPESampler,COMPLETE
1098,0.2608458656105772,2025-04-24 22:20:30.125254,2025-04-24 22:20:32.717798,0 days 00:00:02.592544,0.08786818182734465,8,sqrt,1,14,972,0.8234175231821633,TPESampler,COMPLETE
1099,0.25322115422926655,2025-04-24 22:20:30.179545,2025-04-24 22:20:33.668258,0 days 00:00:03.488713,0.09483547267166333,10,sqrt,1,14,1319,0.9051212287279231,TPESampler,COMPLETE
1100,0.26965304948738894,2025-04-24 22:20:31.175823,2025-04-24 22:20:33.735148,0 days 00:00:02.559325,0.05288357778336889,10,sqrt,3,13,1026,0.7920092163111216,TPESampler,COMPLETE
1101,0.2848180570079096,2025-04-24 22:20:32.919618,2025-04-24 22:20:35.643723,0 days 00:00:02.724105,0.09767168660906173,10,sqrt,4,9,1095,0.6785750849690114,TPESampler,COMPLETE
1102,0.24455953501539282,2025-04-24 22:20:33.813462,2025-04-24 22:20:37.089900,0 days 00:00:03.276438,0.0965885990233799,10,sqrt,1,16,1386,0.9258561805760723,TPESampler,COMPLETE
1103,0.26472647127701154,2025-04-24 22:20:33.879809,2025-04-24 22:20:35.693821,0 days 00:00:01.814012,0.09955269096186341,9,sqrt,1,16,519,0.8019148707166712,TPESampler,COMPLETE
1104,0.2925298394262241,2025-04-24 22:20:35.808123,2025-04-24 22:20:38.632532,0 days 00:00:02.824409,0.0952745148233448,6,sqrt,3,20,1112,0.8501841084647834,TPESampler,COMPLETE
1105,0.24138373720247758,2025-04-24 22:20:35.857102,2025-04-24 22:20:39.379497,0 days 00:00:03.522395,0.08312418611617896,8,sqrt,1,18,1430,0.8445132833188691,TPESampler,COMPLETE
1106,0.27490795909009114,2025-04-24 22:20:37.297833,2025-04-24 22:20:40.656116,0 days 00:00:03.358283,0.09544392840116094,8,sqrt,2,16,1460,0.8713181574388675,TPESampler,COMPLETE
