number,value,datetime_start,datetime_complete,duration,params_learning_rate,params_max_depth,params_max_features,params_min_samples_leaf,params_min_samples_split,params_n_estimators,params_subsample,system_attrs_auto:sampler,state
2452,0.26564201181551444,2025-04-24 22:46:29.105061,2025-04-24 22:46:32.792977,0 days 00:00:03.687916,0.09552616803646125,9,sqrt,2,12,1486,0.9573591064630702,TPESampler,COMPLETE
2453,0.24494913101274782,2025-04-24 22:46:30.389418,2025-04-24 22:46:33.929632,0 days 00:00:03.540214,0.05198671264088171,10,sqrt,1,15,1380,0.7943170101831285,TPESampler,COMPLETE
2454,0.25352026457744126,2025-04-24 22:46:32.139095,2025-04-24 22:46:35.572103,0 days 00:00:03.433008,0.07272404712740387,10,sqrt,1,10,1286,0.9289225978087278,TPESampler,COMPLETE
2455,0.24628219480062474,2025-04-24 22:46:33.028992,2025-04-24 22:46:36.208313,0 days 00:00:03.179321,0.06011583799756139,10,sqrt,1,12,1218,0.8928746030022542,TPESampler,COMPLETE
2456,0.24956589086339998,2025-04-24 22:46:34.143643,2025-04-24 22:46:37.767994,0 days 00:00:03.624351,0.05291906369548293,9,sqrt,1,12,1461,0.9735695699964406,TPESampler,COMPLETE
2457,0.25913972292834575,2025-04-24 22:46:35.798207,2025-04-24 22:46:39.569305,0 days 00:00:03.771098,0.08888506512812727,10,sqrt,3,15,1492,0.9552867938798373,TPESampler,COMPLETE
2458,0.24421107404529446,2025-04-24 22:46:36.443842,2025-04-24 22:46:40.116175,0 days 00:00:03.672333,0.09905012881380207,12,sqrt,1,14,1411,0.8942739965319358,TPESampler,COMPLETE
2459,0.2595152004778666,2025-04-24 22:46:37.976164,2025-04-24 22:46:41.491844,0 days 00:00:03.515680,0.09848398514511876,7,sqrt,1,12,1401,0.964824221698778,TPESampler,COMPLETE
2460,0.26338813106512277,2025-04-24 22:46:39.773048,2025-04-24 22:46:43.167465,0 days 00:00:03.394417,0.09619552653266795,11,sqrt,3,11,1436,0.9199741676808474,TPESampler,COMPLETE
2461,0.2327976265338143,2025-04-24 22:46:40.373458,2025-04-24 22:46:43.580689,0 days 00:00:03.207231,0.07052800077059446,10,sqrt,1,15,1429,0.8918947769883232,TPESampler,COMPLETE
2462,0.27607342104633914,2025-04-24 22:46:41.692774,2025-04-24 22:46:48.996885,0 days 00:00:07.304111,0.07501419079126327,10,,1,12,1134,0.8394756661127512,TPESampler,COMPLETE
2463,0.32347373133207225,2025-04-24 22:46:43.372552,2025-04-24 22:46:53.712208,0 days 00:00:10.339656,0.06621485236998849,12,,2,15,1460,0.8778630412790303,TPESampler,COMPLETE
2464,0.2594070164637721,2025-04-24 22:46:43.874622,2025-04-24 22:46:46.002673,0 days 00:00:02.128051,0.06104841403354469,10,sqrt,1,12,1316,0.6710413487916733,TPESampler,COMPLETE
2465,0.23277204424714726,2025-04-24 22:46:46.225084,2025-04-24 22:46:48.758158,0 days 00:00:02.533074,0.06895427339423837,12,sqrt,1,12,1475,0.8668914126050262,TPESampler,COMPLETE
2466,0.3392503440595341,2025-04-24 22:46:48.960896,2025-04-24 22:46:51.418696,0 days 00:00:02.457800,0.03364022621724611,3,,3,6,626,0.8733072161910527,TPESampler,COMPLETE
2467,0.266428201186562,2025-04-24 22:46:49.236074,2025-04-24 22:46:51.988930,0 days 00:00:02.752856,0.06622187319754981,10,sqrt,2,13,1494,0.7972750993554332,TPESampler,COMPLETE
2468,0.2543642478487045,2025-04-24 22:46:51.650705,2025-04-24 22:46:54.071279,0 days 00:00:02.420574,0.09911076234297833,10,sqrt,2,12,1048,0.9214752472641184,TPESampler,COMPLETE
2469,0.2371295680013107,2025-04-24 22:46:52.299459,2025-04-24 22:46:55.939634,0 days 00:00:03.640175,0.09865972104925136,12,sqrt,1,13,1468,0.8587753593410423,TPESampler,COMPLETE
2470,0.43432221492104706,2025-04-24 22:46:53.932787,2025-04-24 22:46:55.330617,0 days 00:00:01.397830,0.09826741640843228,3,sqrt,9,10,318,0.879894303992971,TPESampler,COMPLETE
2471,0.24783436761826305,2025-04-24 22:46:54.356060,2025-04-24 22:46:57.950473,0 days 00:00:03.594413,0.0497349580516707,12,sqrt,1,10,1292,0.9860805704337261,TPESampler,COMPLETE
2472,0.25898157690010826,2025-04-24 22:46:55.534571,2025-04-24 22:46:59.328561,0 days 00:00:03.793990,0.07035669364017748,10,sqrt,3,16,1493,0.8843508604414875,TPESampler,COMPLETE
2473,0.25282017831448117,2025-04-24 22:46:56.188501,2025-04-24 22:46:59.266372,0 days 00:00:03.077871,0.06567695179015577,10,sqrt,1,13,1147,0.8369345232525447,TPESampler,COMPLETE
2474,0.26924564425552805,2025-04-24 22:46:58.164514,2025-04-24 22:47:01.308599,0 days 00:00:03.144085,0.09185695632484188,12,log2,1,12,1336,0.8122122229475439,TPESampler,COMPLETE
2475,0.33809343316216334,2025-04-24 22:46:59.439889,2025-04-24 22:47:06.135913,0 days 00:00:06.696024,0.022542728655451316,7,,7,18,1443,0.6181830654824609,TPESampler,COMPLETE
2476,0.24573256382375475,2025-04-24 22:46:59.579692,2025-04-24 22:47:02.734385,0 days 00:00:03.154693,0.08698525938464156,11,sqrt,1,20,1303,0.9239250719236073,TPESampler,COMPLETE
2477,0.2524937093574351,2025-04-24 22:47:01.521575,2025-04-24 22:47:04.567402,0 days 00:00:03.045827,0.05297249309174084,7,sqrt,1,14,1472,0.933178438542623,TPESampler,COMPLETE
2478,0.5710635612097832,2025-04-24 22:47:02.938619,2025-04-24 22:47:04.546445,0 days 00:00:01.607826,0.015652003965014847,5,log2,6,20,540,0.8537269934888826,TPESampler,COMPLETE
2479,0.24385499060627633,2025-04-24 22:47:04.712511,2025-04-24 22:47:07.790679,0 days 00:00:03.078168,0.047810120346822076,10,sqrt,1,15,1197,0.865068719103527,TPESampler,COMPLETE
2480,0.25561674099764686,2025-04-24 22:47:04.769508,2025-04-24 22:47:08.453538,0 days 00:00:03.684030,0.05162322580966376,8,sqrt,1,18,1493,0.8464711129386775,TPESampler,COMPLETE
2481,0.29441055170434816,2025-04-24 22:47:06.352470,2025-04-24 22:47:11.015193,0 days 00:00:04.662723,0.05219224112855313,3,,2,11,1253,0.6079696453521823,TPESampler,COMPLETE
2482,0.2516495963514079,2025-04-24 22:47:08.008013,2025-04-24 22:47:11.296575,0 days 00:00:03.288562,0.058139479903191786,10,sqrt,1,13,1326,0.9073611794327164,TPESampler,COMPLETE
2483,0.2545445925527597,2025-04-24 22:47:08.660321,2025-04-24 22:47:12.372388,0 days 00:00:03.712067,0.09954299412330454,10,sqrt,3,16,1488,0.9214561704645692,TPESampler,COMPLETE
2484,0.23561776779921356,2025-04-24 22:47:11.252145,2025-04-24 22:47:14.570696,0 days 00:00:03.318551,0.06625615332929652,9,sqrt,1,13,1385,0.8598615834128797,TPESampler,COMPLETE
2485,0.27168420297682955,2025-04-24 22:47:11.618503,2025-04-24 22:47:14.514866,0 days 00:00:02.896363,0.06890409322949768,11,sqrt,3,13,1089,0.8972995298030598,TPESampler,COMPLETE
2486,0.2560671010107421,2025-04-24 22:47:12.730983,2025-04-24 22:47:15.962291,0 days 00:00:03.231308,0.06621702890180016,12,sqrt,3,14,1256,0.8724881129667464,TPESampler,COMPLETE
2487,0.359554063662914,2025-04-24 22:47:14.683409,2025-04-24 22:47:16.225663,0 days 00:00:01.542254,0.06865497046316471,7,sqrt,5,20,225,0.9161879263701052,TPESampler,COMPLETE
2488,0.2869169825774074,2025-04-24 22:47:14.729798,2025-04-24 22:47:24.857436,0 days 00:00:10.127638,0.040647660796168654,12,,1,9,1271,0.8097009816962218,TPESampler,COMPLETE
2489,0.2556051651752775,2025-04-24 22:47:16.191882,2025-04-24 22:47:18.838328,0 days 00:00:02.646446,0.09578461542897403,12,sqrt,1,18,1290,0.9077561290107297,TPESampler,COMPLETE
2490,0.2482365096353468,2025-04-24 22:47:16.460165,2025-04-24 22:47:19.273045,0 days 00:00:02.812880,0.06470997034439112,12,sqrt,1,16,1392,0.8165652367552174,TPESampler,COMPLETE
2491,0.2348975282564614,2025-04-24 22:47:19.049603,2025-04-24 22:47:21.445856,0 days 00:00:02.396253,0.08838576942017204,10,sqrt,1,11,1081,0.8794684641515017,TPESampler,COMPLETE
2492,0.2546219419731879,2025-04-24 22:47:19.549625,2025-04-24 22:47:21.736158,0 days 00:00:02.186533,0.05997569084230733,9,sqrt,1,16,1042,0.9371679397374377,TPESampler,COMPLETE
2493,0.26475906800212046,2025-04-24 22:47:21.652400,2025-04-24 22:47:24.285547,0 days 00:00:02.633147,0.060159742291758904,11,sqrt,3,14,1285,0.8444019222387534,TPESampler,COMPLETE
2494,0.24854280120438374,2025-04-24 22:47:21.988537,2025-04-24 22:47:24.699566,0 days 00:00:02.711029,0.06756203392180536,9,sqrt,1,15,1350,0.8500054089785016,TPESampler,COMPLETE
2495,0.2848807821361024,2025-04-24 22:47:24.487689,2025-04-24 22:47:26.555987,0 days 00:00:02.068298,0.0469122243555139,12,sqrt,3,2,598,0.707444598344152,TPESampler,COMPLETE
2496,0.25046008605663395,2025-04-24 22:47:24.973640,2025-04-24 22:47:29.067477,0 days 00:00:04.093837,0.06534387757076368,10,sqrt,1,17,1494,0.8719854172358987,TPESampler,COMPLETE
2497,0.26663523622450713,2025-04-24 22:47:25.124876,2025-04-24 22:47:29.071531,0 days 00:00:03.946655,0.09829487416070533,9,sqrt,2,13,1487,0.975689388743304,TPESampler,COMPLETE
2498,0.581132650570109,2025-04-24 22:47:26.761595,2025-04-24 22:47:28.049390,0 days 00:00:01.287795,0.057853931985908956,12,log2,7,6,247,0.7277782592178166,TPESampler,COMPLETE
2499,0.24707443029306234,2025-04-24 22:47:28.274924,2025-04-24 22:47:30.631738,0 days 00:00:02.356814,0.042570082945521844,10,sqrt,1,11,1476,0.8799751828120037,TPESampler,COMPLETE
