number,value,datetime_start,datetime_complete,duration,params_constant_value,params_kernel_type,params_length_scale,params_noise_level,params_nu,system_attrs_auto:sampler,state
1850,0.8703401340201287,2025-04-24 22:20:44.198400,2025-04-24 22:20:53.207728,0 days 00:00:09.009328,0.015637231061333436,Matern,2.651117769909528e-05,0.10014445112352144,0.5,TPESampler,COMPLETE
1851,0.8703401340209144,2025-04-24 22:20:45.266529,2025-04-24 22:20:54.105305,0 days 00:00:08.838776,0.06647543392040367,RBF,26.65809249433278,0.01118865748747446,2.5,TPESampler,COMPLETE
1852,0.16334783865802804,2025-04-24 22:20:49.608326,2025-04-24 22:21:01.074997,0 days 00:00:11.466671,0.1042351994548278,RBF,717.3625901126338,0.5623959239964536,0.5,TPESampler,COMPLETE
1853,0.16334780938127333,2025-04-24 22:20:53.470028,2025-04-24 22:20:59.868100,0 days 00:00:06.398072,3.3291237058447027,RBF,2.9666022122186435,0.030428476076044538,2.5,TPESampler,COMPLETE
1854,0.16334781207613974,2025-04-24 22:20:54.368190,2025-04-24 22:21:02.029802,0 days 00:00:07.661612,23.38230756156599,RBF,0.8723362440195498,0.09832570942434339,0.5,TPESampler,COMPLETE
1855,0.16334780621016645,2025-04-24 22:21:00.156273,2025-04-24 22:21:07.127939,0 days 00:00:06.971666,1.3639766880462587,RBF,27.200034942382725,0.8792230015557572,0.5,TPESampler,COMPLETE
1856,0.89330808756605,2025-04-24 22:21:01.379974,2025-04-24 22:21:13.922542,0 days 00:00:12.542568,8.861509771471484e-05,Matern,0.0049857103846310345,0.0003940736671321518,2.5,TPESampler,COMPLETE
1857,0.16334781279334484,2025-04-24 22:21:02.318949,2025-04-24 22:21:08.167985,0 days 00:00:05.849036,5.4629359377018645,RBF,46.95659461000945,0.20748195864951108,2.5,TPESampler,COMPLETE
1858,0.16334781892703412,2025-04-24 22:21:07.471549,2025-04-24 22:21:14.225166,0 days 00:00:06.753617,6.527141396134555,RBF,6.932840066362724,0.3394900505032608,2.5,TPESampler,COMPLETE
1859,0.16334777637233502,2025-04-24 22:21:08.430739,2025-04-24 22:21:15.178437,0 days 00:00:06.747698,0.5388616783043442,RBF,1.571125716803673,0.010320253491609128,2.5,TPESampler,COMPLETE
1860,0.1633478231169631,2025-04-24 22:21:14.144073,2025-04-24 22:21:21.297695,0 days 00:00:07.153622,0.049379113714645866,RBF,6.705262121981084,0.9787927580617456,2.5,TPESampler,COMPLETE
1861,0.16334784196206953,2025-04-24 22:21:14.655068,2025-04-24 22:21:21.047742,0 days 00:00:06.392674,36.83434917122796,RBF,0.44934865720840433,0.04511969341759215,2.5,TPESampler,COMPLETE
1862,0.16334781206466742,2025-04-24 22:21:15.651540,2025-04-24 22:21:22.054976,0 days 00:00:06.403436,14.33508944031699,RBF,33.29372675242445,0.4324129159094458,2.5,TPESampler,COMPLETE
1863,0.9015771955315673,2025-04-24 22:21:21.339355,2025-04-24 22:21:36.661946,0 days 00:00:15.322591,22919.004944144253,Matern,0.02490045056687401,3.683724692093747e-05,2.5,TPESampler,COMPLETE
1864,0.16334780931754467,2025-04-24 22:21:21.551375,2025-04-24 22:21:40.698894,0 days 00:00:19.147519,2.920571957836304,RBF,0.5073625985559,0.8272967175722425,2.5,TPESampler,COMPLETE
1865,0.8703401202140757,2025-04-24 22:21:22.713216,2025-04-24 22:21:38.668089,0 days 00:00:15.954873,26.651484017066085,RBF,0.17060000809754405,0.0017524071736319457,2.5,TPESampler,COMPLETE
1866,0.9015771884243675,2025-04-24 22:21:37.300765,2025-04-24 22:21:44.578949,0 days 00:00:07.278184,0.0012211768784240742,RBF,148.39090032547003,0.9802782320008118,1.5,TPESampler,COMPLETE
1867,0.8703401340146637,2025-04-24 22:21:38.905972,2025-04-24 22:21:48.972511,0 days 00:00:10.066539,0.09389383368276488,RBF,3.1108296794151995,0.008581983948252036,2.5,TPESampler,COMPLETE
1868,0.8703401340211806,2025-04-24 22:21:40.994402,2025-04-24 22:21:53.077183,0 days 00:00:12.082781,0.3492076184367702,RBF,0.08345062155509175,0.9272476192505027,2.5,TPESampler,COMPLETE
1869,0.16334780879333644,2025-04-24 22:21:45.088703,2025-04-24 22:21:56.866732,0 days 00:00:11.778029,2.1120904536386265,RBF,2.6438426302127627,0.06330856598553583,2.5,TPESampler,COMPLETE
1870,0.8703401341351933,2025-04-24 22:21:49.420813,2025-04-24 22:21:55.295949,0 days 00:00:05.875136,41.5774991262786,RBF,0.0012945409773056718,0.06731002701169587,1.5,TPESampler,COMPLETE
1871,0.16334775450555628,2025-04-24 22:21:53.332580,2025-04-24 22:22:00.090303,0 days 00:00:06.757723,1.4470834969075759,RBF,283.264303341647,0.7364761247445016,2.5,TPESampler,COMPLETE
1872,0.8703401340195533,2025-04-24 22:21:55.593890,2025-04-24 22:22:07.722795,0 days 00:00:12.128905,1.0299292673242953e-07,RBF,0.0015210951672536832,0.0005133063924383932,2.5,TPESampler,COMPLETE
1873,0.16334780532342863,2025-04-24 22:21:57.172441,2025-04-24 22:22:02.916351,0 days 00:00:05.743910,5.616269109453842,RBF,25.727946551430072,0.8961304722358813,2.5,TPESampler,COMPLETE
1874,0.16334787570347095,2025-04-24 22:22:00.392768,2025-04-24 22:22:17.294882,0 days 00:00:16.902114,6.890918794330511e-05,RBF,0.5423804353673418,0.9632264896037073,2.5,TPESampler,COMPLETE
1875,0.16344312356283547,2025-04-24 22:22:03.233600,2025-04-24 22:22:12.481772,0 days 00:00:09.248172,1.7247609218211476e-06,Matern,0.59011764308993,3.013712505839844e-06,2.5,TPESampler,COMPLETE
1876,0.87034013397904,2025-04-24 22:22:08.040995,2025-04-24 22:22:12.140058,0 days 00:00:04.099063,4.424759719938494,RBF,0.014731603867202748,0.03250447502120845,2.5,TPESampler,COMPLETE
1877,0.16334781228782955,2025-04-24 22:22:12.400468,2025-04-24 22:22:35.391457,0 days 00:00:22.990989,1.8467332198225184,RBF,0.22489997417295154,0.7364374461299155,0.5,TPESampler,COMPLETE
1878,0.8703401340108428,2025-04-24 22:22:12.792175,2025-04-24 22:22:20.945345,0 days 00:00:08.153170,1.6757164564219729,RBF,0.10526281930342148,0.021248906191241274,2.5,TPESampler,COMPLETE
1879,0.9015771955346219,2025-04-24 22:22:17.912668,2025-04-24 22:22:29.485472,0 days 00:00:11.572804,15.537792616836517,Matern,0.025198760824573833,6.531288797607498e-06,2.5,TPESampler,COMPLETE
1880,0.16334782996251707,2025-04-24 22:22:22.238339,2025-04-24 22:22:38.552583,0 days 00:00:16.314244,4.113610472218447,RBF,1.103691747326954,0.863218206529571,0.5,TPESampler,COMPLETE
1881,0.8703401340218141,2025-04-24 22:22:29.866017,2025-04-24 22:22:38.038179,0 days 00:00:08.172162,94.57921263122188,RBF,0.13807644912691353,0.0161490808904855,2.5,TPESampler,COMPLETE
1882,0.870340134020747,2025-04-24 22:22:36.410272,2025-04-24 22:22:41.614585,0 days 00:00:05.204313,26927.448599488736,Matern,0.001341087614284127,0.008572757211487536,0.5,TPESampler,COMPLETE
1883,0.16334776891492067,2025-04-24 22:22:38.299470,2025-04-24 22:22:45.088893,0 days 00:00:06.789423,4.5327599223110155,RBF,6.256517825523477,0.018904856470475646,2.5,TPESampler,COMPLETE
1884,0.16334780974927918,2025-04-24 22:22:38.836997,2025-04-24 22:22:48.044399,0 days 00:00:09.207402,0.00540193952285227,RBF,0.24183300100859537,0.026383547328678123,2.5,TPESampler,COMPLETE
1885,0.8703401340208138,2025-04-24 22:22:41.918877,2025-04-24 22:22:55.991153,0 days 00:00:14.072276,0.00046681600941292644,RBF,0.005081667236886729,0.005683703928789385,2.5,TPESampler,COMPLETE
1886,0.8703401340202933,2025-04-24 22:22:45.392272,2025-04-24 22:22:52.849489,0 days 00:00:07.457217,0.27831649054223206,Matern,0.02452814541151485,5.622266195397104e-05,0.5,TPESampler,COMPLETE
1887,0.16334781053550726,2025-04-24 22:22:48.575371,2025-04-24 22:22:56.953933,0 days 00:00:08.378562,0.5793844954630752,RBF,2.7551413553694113,9.496853018947232e-05,0.5,TPESampler,COMPLETE
1888,0.16334780809899782,2025-04-24 22:22:53.123047,2025-04-24 22:23:01.727091,0 days 00:00:08.604044,0.3209120695471786,RBF,196.58717750875508,0.38744749425688796,0.5,TPESampler,COMPLETE
1889,0.1633478110220102,2025-04-24 22:22:56.439195,2025-04-24 22:23:02.861368,0 days 00:00:06.422173,0.21795000609154636,RBF,26.49233909435798,0.9510466601826832,1.5,TPESampler,COMPLETE
1890,0.8703401341499619,2025-04-24 22:22:57.263631,2025-04-24 22:23:04.189083,0 days 00:00:06.925452,0.00759695331930636,RBF,5.034799910815409,6.67980808315209e-05,0.5,TPESampler,COMPLETE
1891,0.163443144342573,2025-04-24 22:23:01.990501,2025-04-24 22:23:15.476901,0 days 00:00:13.486400,11.082664608680092,Matern,4.357935419691191,0.0003305119671918701,2.5,TPESampler,COMPLETE
1892,0.2197749551050011,2025-04-24 22:23:03.165653,2025-04-24 22:23:09.509857,0 days 00:00:06.344204,337.90615461600805,Matern,737.4542095311236,0.8979679060456572,0.5,TPESampler,COMPLETE
1893,0.16334777757456848,2025-04-24 22:23:04.430184,2025-04-24 22:23:11.107684,0 days 00:00:06.677500,5734.7756887788255,RBF,66.79213667619423,0.8777252860700254,0.5,TPESampler,COMPLETE
1894,0.16334781041651453,2025-04-24 22:23:09.818527,2025-04-24 22:23:16.820494,0 days 00:00:07.001967,0.2426544681115579,RBF,114.21739175445796,0.9819128922072096,0.5,TPESampler,COMPLETE
1895,0.16334781507449816,2025-04-24 22:23:11.412021,2025-04-24 22:23:19.235225,0 days 00:00:07.823204,5.820443316530319,RBF,5.125848488481204,0.7256494120633235,2.5,TPESampler,COMPLETE
1896,0.870340134026641,2025-04-24 22:23:15.777434,2025-04-24 22:23:21.773042,0 days 00:00:05.995608,0.23130959474680388,RBF,28.6415725680343,0.00014108417625602587,2.5,TPESampler,COMPLETE
1897,0.8703401340190626,2025-04-24 22:23:17.077803,2025-04-24 22:23:21.173499,0 days 00:00:04.095696,0.4554966342090402,RBF,0.0227916942260596,0.5568928483128163,1.5,TPESampler,COMPLETE
1898,0.16334771744055956,2025-04-24 22:23:19.532394,2025-04-24 22:23:26.288997,0 days 00:00:06.756603,960.3957616859284,RBF,6105.783323091194,0.5552202026916359,0.5,TPESampler,COMPLETE
1899,0.8703401340234905,2025-04-24 22:23:21.480222,2025-04-24 22:23:26.592664,0 days 00:00:05.112442,0.06821075905285519,RBF,5.947222479623962e-05,3.772617561248656e-05,1.5,TPESampler,COMPLETE
1900,0.16334781038621216,2025-04-24 22:23:22.122509,2025-04-24 22:23:26.885144,0 days 00:00:04.762635,0.07772396584889076,RBF,1.9146864004465884,0.9338788252992124,2.5,TPESampler,COMPLETE
1901,0.8703401340213175,2025-04-24 22:23:26.518310,2025-04-24 22:23:34.367898,0 days 00:00:07.849588,33.221133576756834,RBF,7413.291297898361,0.05099147819553569,0.5,TPESampler,COMPLETE
1902,0.16334781012452557,2025-04-24 22:23:26.843331,2025-04-24 22:23:36.655686,0 days 00:00:09.812355,19.86855903953928,RBF,11289.72162154791,0.6677481785075113,0.5,TPESampler,COMPLETE
1903,0.1633477994414437,2025-04-24 22:23:27.177192,2025-04-24 22:23:33.803975,0 days 00:00:06.626783,4370.402741098906,RBF,1979.7086456943248,0.42155632526918607,0.5,TPESampler,COMPLETE
1904,0.21977494961825142,2025-04-24 22:23:34.067249,2025-04-24 22:23:40.202334,0 days 00:00:06.135085,0.17606592853518643,Matern,262.95240859037415,0.6268844882358989,0.5,TPESampler,COMPLETE
1905,0.16334781093428757,2025-04-24 22:23:34.641979,2025-04-24 22:23:41.352931,0 days 00:00:06.710952,1232.398221610908,RBF,6338.870867981956,0.24956741989181797,0.5,TPESampler,COMPLETE
1906,0.16334783468607128,2025-04-24 22:23:36.964821,2025-04-24 22:23:48.763054,0 days 00:00:11.798233,2000.5220701583623,RBF,16356.748541863797,0.4195834800759139,0.5,TPESampler,COMPLETE
1907,0.16334782112810503,2025-04-24 22:23:40.509227,2025-04-24 22:23:47.758029,0 days 00:00:07.248802,27028.673967015337,RBF,17510.523602612077,0.3634852360801969,0.5,TPESampler,COMPLETE
1908,0.1633478094983796,2025-04-24 22:23:41.685605,2025-04-24 22:23:48.877771,0 days 00:00:07.192166,125.18909759867661,RBF,13632.601126858961,0.11601619033025834,0.5,TPESampler,COMPLETE
1909,0.16334780131025273,2025-04-24 22:23:48.220340,2025-04-24 22:23:53.685055,0 days 00:00:05.464715,560.7241027101521,RBF,80.10246570922125,0.7314285010552433,0.5,TPESampler,COMPLETE
1910,0.16334780838484342,2025-04-24 22:23:48.961984,2025-04-24 22:23:55.174416,0 days 00:00:06.212432,198.37369957038644,RBF,6989.698929049811,0.45986297547658284,0.5,TPESampler,COMPLETE
1911,0.16334779975085473,2025-04-24 22:23:49.120421,2025-04-24 22:23:56.286531,0 days 00:00:07.166110,145.5451812915749,RBF,5528.036892220509,0.4623417022436869,0.5,TPESampler,COMPLETE
1912,0.8703401340039457,2025-04-24 22:23:53.990182,2025-04-24 22:24:03.886948,0 days 00:00:09.896766,0.15155921395755703,RBF,0.00166135990893378,3.2457189984606017e-10,2.5,TPESampler,COMPLETE
1913,0.1633478081987956,2025-04-24 22:23:55.434550,2025-04-24 22:24:04.157616,0 days 00:00:08.723066,195.4949021301902,RBF,9189.536485882923,0.5107543776812938,0.5,TPESampler,COMPLETE
1914,0.8703401340212938,2025-04-24 22:23:56.585926,2025-04-24 22:24:03.565757,0 days 00:00:06.979831,0.0015745674180913,RBF,0.10695668880173288,2.75117278428423e-09,2.5,TPESampler,COMPLETE
1915,0.1633478092851846,2025-04-24 22:24:03.809851,2025-04-24 22:24:09.602517,0 days 00:00:05.792666,13.118626692095253,RBF,125.5233014401151,0.40784819056634564,0.5,TPESampler,COMPLETE
1916,0.9015771955241731,2025-04-24 22:24:04.121597,2025-04-24 22:24:08.121245,0 days 00:00:03.999648,13320.654034259118,RBF,0.059595664059808914,1.3927176559217264e-05,2.5,TPESampler,COMPLETE
1917,0.16334776953548866,2025-04-24 22:24:04.487089,2025-04-24 22:24:10.581297,0 days 00:00:06.094208,765.6448015120236,RBF,987.8239736762745,0.42809912085464646,0.5,TPESampler,COMPLETE
1918,0.1633478125050308,2025-04-24 22:24:08.423710,2025-04-24 22:24:14.715615,0 days 00:00:06.291905,10.909295965185313,RBF,263.38231423604844,0.17590810214556787,0.5,TPESampler,COMPLETE
1919,0.16334781667209264,2025-04-24 22:24:09.946576,2025-04-24 22:24:15.647610,0 days 00:00:05.701034,34077.03675899797,RBF,138.2738041364612,0.9045678458116863,2.5,TPESampler,COMPLETE
1920,0.16334781636879067,2025-04-24 22:24:10.854669,2025-04-24 22:24:17.977130,0 days 00:00:07.122461,3042.2802633665992,RBF,26148.077993001883,0.1146170715923607,0.5,TPESampler,COMPLETE
1921,0.16334780951553865,2025-04-24 22:24:15.017335,2025-04-24 22:24:21.799211,0 days 00:00:06.781876,1745.8635167915754,RBF,1632.2078599453537,0.3156735588180913,0.5,TPESampler,COMPLETE
1922,0.8703401340232981,2025-04-24 22:24:15.926954,2025-04-24 22:24:21.296793,0 days 00:00:05.369839,17447.443122826222,RBF,0.09274880339855505,0.026745764732167696,2.5,TPESampler,COMPLETE
1923,0.1633478096511793,2025-04-24 22:24:18.538694,2025-04-24 22:24:24.076787,0 days 00:00:05.538093,471.0493432005541,RBF,30.114515331166224,0.8445330638189477,0.5,TPESampler,COMPLETE
1924,0.9015779749019732,2025-04-24 22:24:21.793586,2025-04-24 22:24:24.940986,0 days 00:00:03.147400,56253.49134362325,RBF,0.9166361537860883,7.290902619408335e-05,2.5,TPESampler,COMPLETE
1925,0.16334781410504734,2025-04-24 22:24:22.074875,2025-04-24 22:24:28.528145,0 days 00:00:06.453270,606.725962057695,RBF,4425.6847019213665,0.5524515628057142,0.5,TPESampler,COMPLETE
1926,0.16334780841550903,2025-04-24 22:24:24.396506,2025-04-24 22:24:29.515598,0 days 00:00:05.119092,597.4002985082997,RBF,36.05391601567876,0.9229092937008103,2.5,TPESampler,COMPLETE
1927,0.8703401339308497,2025-04-24 22:24:25.217235,2025-04-24 22:24:35.597430,0 days 00:00:10.380195,39819.72520481901,RBF,1804.6896965471335,9.778119251156554e-08,2.5,TPESampler,COMPLETE
1928,0.16334780596357276,2025-04-24 22:24:28.829344,2025-04-24 22:24:34.392242,0 days 00:00:05.562898,13119.687195060114,RBF,713.8760514434239,0.8571226972074488,0.5,TPESampler,COMPLETE
1929,0.901577974819652,2025-04-24 22:24:29.817101,2025-04-24 22:24:35.905725,0 days 00:00:06.088624,0.6640904656591458,RBF,20323.2369742961,0.6724223129181635,0.5,TPESampler,COMPLETE
1930,0.8703401340255073,2025-04-24 22:24:34.696691,2025-04-24 22:24:43.618441,0 days 00:00:08.921750,6.347496915840284,RBF,3524.9707751012297,0.06232451203890292,0.5,TPESampler,COMPLETE
1931,0.1633478140760153,2025-04-24 22:24:35.829764,2025-04-24 22:24:42.737982,0 days 00:00:06.908218,2.927349549659223,RBF,0.8988468854132431,0.0019812763469324044,0.5,TPESampler,COMPLETE
1932,0.9015779577548556,2025-04-24 22:24:36.184975,2025-04-24 22:24:44.476235,0 days 00:00:08.291260,2.7686076367282508e-06,RBF,49548.22354518661,4.348145554764278e-05,0.5,TPESampler,COMPLETE
1933,0.1633478052889583,2025-04-24 22:24:43.045373,2025-04-24 22:24:50.313012,0 days 00:00:07.267639,2.419669041027176,RBF,0.2827988471155802,0.00013210074249265475,0.5,TPESampler,COMPLETE
1934,0.8703401340250737,2025-04-24 22:24:43.929260,2025-04-24 22:24:52.001314,0 days 00:00:08.072054,5232.9892373920875,RBF,85219.17830241311,0.021540768149849045,0.5,TPESampler,COMPLETE
1935,0.9015779748920356,2025-04-24 22:24:44.771951,2025-04-24 22:24:51.295880,0 days 00:00:06.523929,24.465890700406383,RBF,97199.67163078632,0.08352202423838981,0.5,TPESampler,COMPLETE
1936,0.16334781333123324,2025-04-24 22:24:50.612920,2025-04-24 22:24:59.253058,0 days 00:00:08.640138,67189.37804660526,RBF,87962.52862908655,0.5770520108699282,0.5,TPESampler,COMPLETE
1937,0.1633478097976231,2025-04-24 22:24:51.575245,2025-04-24 22:24:59.168931,0 days 00:00:07.593686,13.262644042710981,RBF,0.7933218885268685,0.9793832776038384,0.5,TPESampler,COMPLETE
1938,0.1633478093897706,2025-04-24 22:24:52.327430,2025-04-24 22:24:57.452917,0 days 00:00:05.125487,3409.7404747853043,RBF,18.392068409100492,0.8640494189152079,0.5,TPESampler,COMPLETE
1939,0.8703401340181157,2025-04-24 22:24:57.755959,2025-04-24 22:25:03.272235,0 days 00:00:05.516276,89681.44511748337,RBF,8.992473994021125,9.93566108751249e-06,2.5,TPESampler,COMPLETE
1940,0.9015771955342035,2025-04-24 22:24:59.395090,2025-04-24 22:25:03.302532,0 days 00:00:03.907442,3453.7787914143105,Matern,1.0040601332368474e-05,7.817809593544085e-07,0.5,TPESampler,COMPLETE
1941,0.16334782315189747,2025-04-24 22:24:59.439612,2025-04-24 22:25:07.357816,0 days 00:00:07.918204,2267.39370995047,RBF,2026.8532810166355,0.41431733054075837,0.5,TPESampler,COMPLETE
1942,0.16334821207243697,2025-04-24 22:25:03.469341,2025-04-24 22:25:16.580486,0 days 00:00:13.111145,1668.717369301298,RBF,21962.829418448724,0.8054766450147449,0.5,TPESampler,COMPLETE
1943,0.8703392300120517,2025-04-24 22:25:03.508734,2025-04-24 22:25:11.222817,0 days 00:00:07.714083,3.823106466933641,RBF,0.19572151624704523,2.151567617018334e-05,2.5,TPESampler,COMPLETE
1944,0.16334780890840972,2025-04-24 22:25:07.783558,2025-04-24 22:25:22.267274,0 days 00:00:14.483716,705.7946314212539,RBF,0.20750525195458905,0.006400232534966401,2.5,TPESampler,COMPLETE
1945,0.16334780563766782,2025-04-24 22:25:11.812264,2025-04-24 22:25:19.123069,0 days 00:00:07.310805,13169.68700290262,RBF,12706.76483657149,0.7527511496445689,0.5,TPESampler,COMPLETE
1946,0.8703401340309356,2025-04-24 22:25:16.905629,2025-04-24 22:25:26.117115,0 days 00:00:09.211486,0.00787145311576278,RBF,15965.672345052733,3.1074526256442535e-10,1.5,TPESampler,COMPLETE
1947,0.8703401340202261,2025-04-24 22:25:19.439696,2025-04-24 22:25:24.420912,0 days 00:00:04.981216,6.386901562027998,RBF,29.983058226531693,0.0015640314503501513,2.5,TPESampler,COMPLETE
1948,0.8703401340301009,2025-04-24 22:25:22.588939,2025-04-24 22:25:33.643844,0 days 00:00:11.054905,0.0013041283992039035,RBF,28.1064252492622,8.291559224531412e-06,2.5,TPESampler,COMPLETE
1949,0.16334783279324294,2025-04-24 22:25:24.723957,2025-04-24 22:25:31.767096,0 days 00:00:07.043139,2.4603808400018226,RBF,207.242087571754,0.6159859887099457,0.5,TPESampler,COMPLETE
1950,0.8703401339065896,2025-04-24 22:25:26.436026,2025-04-24 22:25:34.069233,0 days 00:00:07.633207,1.6164486352805288e-05,RBF,0.01858605290498648,2.7045270407557816e-06,2.5,TPESampler,COMPLETE
1951,0.2197749944061589,2025-04-24 22:25:32.059513,2025-04-24 22:25:38.295328,0 days 00:00:06.235815,72138.45099314328,Matern,578.6149235212548,0.4603316947751987,0.5,TPESampler,COMPLETE
1952,0.163347807757668,2025-04-24 22:25:33.964332,2025-04-24 22:25:40.302931,0 days 00:00:06.338599,5.898101848140288,RBF,815.270282002844,0.5235516533257567,0.5,TPESampler,COMPLETE
1953,0.16334777700059167,2025-04-24 22:25:34.380600,2025-04-24 22:25:40.699137,0 days 00:00:06.318537,19798.155794749935,RBF,2628.3682004203574,0.6524935868525295,0.5,TPESampler,COMPLETE
1954,0.1633478137351197,2025-04-24 22:25:38.550050,2025-04-24 22:25:45.101711,0 days 00:00:06.551661,824.253730609916,RBF,0.5079955261706417,0.00017251747362777092,2.5,TPESampler,COMPLETE
1955,0.16334773934506627,2025-04-24 22:25:40.560883,2025-04-24 22:25:48.172320,0 days 00:00:07.611437,1628.8323235801674,RBF,0.5226690152863948,0.009351400024569804,2.5,TPESampler,COMPLETE
1956,0.8703401340166141,2025-04-24 22:25:40.958608,2025-04-24 22:25:48.706437,0 days 00:00:07.747829,0.0006172233865568667,Matern,6.508832413920884,1.4265760604272068e-10,2.5,TPESampler,COMPLETE
1957,0.9015771955345837,2025-04-24 22:25:45.628593,2025-04-24 22:25:53.766129,0 days 00:00:08.137536,537.4184298492979,RBF,0.14256977085369146,9.051409393283372e-07,2.5,TPESampler,COMPLETE
1958,0.8703401340242288,2025-04-24 22:25:48.761270,2025-04-24 22:25:59.056066,0 days 00:00:10.294796,0.8749690533398168,RBF,52.641184782783974,0.017555887999709714,0.5,TPESampler,COMPLETE
1959,0.1633478118991055,2025-04-24 22:25:49.320815,2025-04-24 22:25:57.941720,0 days 00:00:08.620905,65593.33771237363,RBF,18.596497503462157,0.3018358948934722,0.5,TPESampler,COMPLETE
1960,0.1633477959922936,2025-04-24 22:25:54.011704,2025-04-24 22:26:02.742587,0 days 00:00:08.730883,0.2668047320290772,RBF,769.19866825199,0.07828695637871765,2.5,TPESampler,COMPLETE
1961,0.8703401340184683,2025-04-24 22:25:58.232093,2025-04-24 22:26:01.809321,0 days 00:00:03.577228,0.47507778604574313,RBF,0.019026063620350683,0.001474186207288549,0.5,TPESampler,COMPLETE
1962,0.8703401340195703,2025-04-24 22:25:59.389334,2025-04-24 22:26:03.653628,0 days 00:00:04.264294,34.42220607202577,Matern,0.00012212375690138868,0.0008377281718064928,1.5,TPESampler,COMPLETE
1963,0.16334778312822842,2025-04-24 22:26:02.059014,2025-04-24 22:26:07.932347,0 days 00:00:05.873333,1005.2073783222521,RBF,582.2473833062053,0.8296309975277982,0.5,TPESampler,COMPLETE
1964,0.8703401340208601,2025-04-24 22:26:03.054011,2025-04-24 22:26:11.572314,0 days 00:00:08.518303,118.73799103642813,RBF,68454.00422200996,0.026972479347118453,0.5,TPESampler,COMPLETE
1965,0.8703401340259848,2025-04-24 22:26:03.962517,2025-04-24 22:26:10.230582,0 days 00:00:06.268065,422.75750745276656,RBF,14.26014342316703,2.254127642327974e-06,2.5,TPESampler,COMPLETE
