number,value,datetime_start,datetime_complete,duration,params_constant_value,params_kernel_type,params_length_scale,params_noise_level,params_nu,system_attrs_auto:sampler,state
231,0.16334780531778834,2025-04-24 21:09:12.303479,2025-04-24 21:09:16.971981,0 days 00:00:04.668502,88055.70288048837,RBF,0.4934382405708851,0.3610262091414812,1.5,TPESampler,COMPLETE
232,0.1633478102522576,2025-04-24 21:09:16.202612,2025-04-24 21:09:30.723496,0 days 00:00:14.520884,54.210059289735476,RBF,0.2731458511990503,0.011615756446219382,1.5,TPESampler,COMPLETE
233,0.870340133831795,2025-04-24 21:09:17.328606,2025-04-24 21:09:27.022226,0 days 00:00:09.693620,0.0005604674347323835,RBF,0.10573183412436728,1.0438380108823297e-10,0.5,TPESampler,COMPLETE
234,0.16334780923324116,2025-04-24 21:09:23.782918,2025-04-24 21:09:30.812236,0 days 00:00:07.029318,54034.312514349665,RBF,4.057178761250582,0.0005845782240493269,1.5,TPESampler,COMPLETE
235,0.1633477871160795,2025-04-24 21:09:27.281552,2025-04-24 21:09:35.308597,0 days 00:00:08.027045,20116.275091002433,RBF,20.61157602778627,0.00314909954911957,1.5,TPESampler,COMPLETE
236,0.1633478092825985,2025-04-24 21:09:30.877352,2025-04-24 21:09:43.314547,0 days 00:00:12.437195,14718.763160214983,RBF,117.03801649922785,0.8384815530081587,0.5,TPESampler,COMPLETE
237,0.8703401340117194,2025-04-24 21:09:31.066804,2025-04-24 21:09:43.310260,0 days 00:00:12.243456,3.889345776932551,Matern,0.019872898562558194,0.5230930703780133,1.5,TPESampler,COMPLETE
238,0.16334780097912144,2025-04-24 21:09:35.961634,2025-04-24 21:09:48.620628,0 days 00:00:12.658994,7092.058666837893,RBF,88.47987875611851,0.0013280901735161007,1.5,TPESampler,COMPLETE
239,0.16334780089463755,2025-04-24 21:09:43.497472,2025-04-24 21:09:49.130818,0 days 00:00:05.633346,36068.14382634849,RBF,6.4624364757620985,0.9519569228384522,1.5,TPESampler,COMPLETE
240,0.16334779467924693,2025-04-24 21:09:43.552821,2025-04-24 21:09:49.839590,0 days 00:00:06.286769,6988.37255111416,RBF,22.05917876876808,0.0037144082425173137,1.5,TPESampler,COMPLETE
241,0.1633478229621239,2025-04-24 21:09:48.903681,2025-04-24 21:09:53.293882,0 days 00:00:04.390201,835.0745182762014,RBF,9.615527073835734,0.7360011478357646,1.5,TPESampler,COMPLETE
242,0.16334780509029415,2025-04-24 21:09:49.336206,2025-04-24 21:10:01.084357,0 days 00:00:11.748151,64170.21159318117,RBF,6.297751377162246,0.8108230390854115,1.5,TPESampler,COMPLETE
243,0.8703401343214414,2025-04-24 21:09:50.140926,2025-04-24 21:09:58.763164,0 days 00:00:08.622238,205.0600644952043,RBF,1824.3355429792807,0.0028114330086309596,1.5,TPESampler,COMPLETE
244,0.9015576648358354,2025-04-24 21:09:53.581271,2025-04-24 21:09:57.938037,0 days 00:00:04.356766,1.2270746333300006e-05,RBF,2.1760993730878084e-05,0.02155150959796601,0.5,TPESampler,COMPLETE
245,0.8703401340231762,2025-04-24 21:09:58.230415,2025-04-24 21:10:02.141286,0 days 00:00:03.910871,4.0187126961257045,Matern,2.00351040175362e-05,4.116029150239404e-05,0.5,TPESampler,COMPLETE
246,0.8703401340206846,2025-04-24 21:09:59.043544,2025-04-24 21:10:06.800957,0 days 00:00:07.757413,63409.59975084236,RBF,206.3785826456302,0.0009701380076570415,1.5,TPESampler,COMPLETE
247,0.8703401340342287,2025-04-24 21:10:01.367426,2025-04-24 21:10:07.486368,0 days 00:00:06.118942,153.03670744540003,RBF,0.08303538714412916,0.7464394226685641,1.5,TPESampler,COMPLETE
248,0.16334781482605643,2025-04-24 21:10:02.587222,2025-04-24 21:10:10.972907,0 days 00:00:08.385685,4622.696959645843,RBF,5.958527449580566,0.0011578165389715008,1.5,TPESampler,COMPLETE
249,0.21977561720046,2025-04-24 21:10:07.287309,2025-04-24 21:10:13.317053,0 days 00:00:06.029744,81378.7045409371,Matern,52.620634891989624,0.0004147395086315735,0.5,TPESampler,COMPLETE
250,0.16334780302740914,2025-04-24 21:10:07.762319,2025-04-24 21:10:12.298697,0 days 00:00:04.536378,864.4254056565633,RBF,55.6101273066373,0.018942842939347997,1.5,TPESampler,COMPLETE
251,0.1633477497986064,2025-04-24 21:10:11.226130,2025-04-24 21:10:17.886473,0 days 00:00:06.660343,30185.787695225717,RBF,1413.7582358226325,0.059979010542707545,0.5,TPESampler,COMPLETE
252,0.16334780060394288,2025-04-24 21:10:12.555283,2025-04-24 21:10:18.460334,0 days 00:00:05.905051,1466.2878006305268,RBF,1.1288469864687132,0.022487140318738632,1.5,TPESampler,COMPLETE
253,0.1633478089969,2025-04-24 21:10:13.575186,2025-04-24 21:10:20.698496,0 days 00:00:07.123310,25157.358047751746,RBF,12265.708070521905,0.25641661276337596,1.5,TPESampler,COMPLETE
254,0.16334780151851291,2025-04-24 21:10:18.176057,2025-04-24 21:10:23.569540,0 days 00:00:05.393483,73932.06337430445,RBF,53.099426509021924,0.2352560354096186,0.5,TPESampler,COMPLETE
255,0.8703401340216873,2025-04-24 21:10:18.694575,2025-04-24 21:10:26.454980,0 days 00:00:07.760405,12159.990170237079,RBF,8645.091527209037,0.0034101013028447064,0.5,TPESampler,COMPLETE
256,0.16334779747041422,2025-04-24 21:10:20.938511,2025-04-24 21:10:26.482728,0 days 00:00:05.544217,30176.07866092684,RBF,2078.859661600766,0.04116674054240597,0.5,TPESampler,COMPLETE
257,0.8703401340028754,2025-04-24 21:10:23.838373,2025-04-24 21:10:36.491988,0 days 00:00:12.653615,0.0007409706802097799,Matern,1.715419066802669e-05,0.019029680028818417,1.5,TPESampler,COMPLETE
258,0.16334779507793934,2025-04-24 21:10:26.631182,2025-04-24 21:10:32.409225,0 days 00:00:05.778043,1021.9760773130462,RBF,289.70419181019815,0.24770582026399454,0.5,TPESampler,COMPLETE
259,0.8703401340212364,2025-04-24 21:10:26.681176,2025-04-24 21:10:33.357755,0 days 00:00:06.676579,2.7830945683473922e-05,Matern,7.839277663140535,6.656896285097641e-07,0.5,TPESampler,COMPLETE
260,0.16334781124355321,2025-04-24 21:10:32.678917,2025-04-24 21:10:39.450102,0 days 00:00:06.771185,69813.79746547971,RBF,706.8826986387027,0.23546348619953947,0.5,TPESampler,COMPLETE
261,0.1633478114159449,2025-04-24 21:10:33.603909,2025-04-24 21:10:40.968921,0 days 00:00:07.365012,117.74694138631233,RBF,267.97680933153055,0.02039531314009863,0.5,TPESampler,COMPLETE
262,0.1633478580060244,2025-04-24 21:10:36.799982,2025-04-24 21:10:43.266516,0 days 00:00:06.466534,1119.12745188153,RBF,891.0512952483821,0.019899616567558346,0.5,TPESampler,COMPLETE
263,0.9015779748917055,2025-04-24 21:10:39.740492,2025-04-24 21:10:43.069242,0 days 00:00:03.328750,1.1034525305182884e-07,RBF,45406.402482527876,0.008435065729446354,2.5,TPESampler,COMPLETE
264,0.16334781120216724,2025-04-24 21:10:41.261812,2025-04-24 21:10:48.221334,0 days 00:00:06.959522,50212.02252562907,RBF,6417.261576298056,0.31906335935538066,0.5,TPESampler,COMPLETE
265,0.1633478363348057,2025-04-24 21:10:43.273902,2025-04-24 21:10:49.019734,0 days 00:00:05.745832,37176.90925650564,RBF,1097.8248792657944,0.009494364860387143,0.5,TPESampler,COMPLETE
266,0.16334783856857374,2025-04-24 21:10:43.496381,2025-04-24 21:10:48.524013,0 days 00:00:05.027632,19430.648009005297,RBF,319.2131072162298,0.08314956973573921,0.5,TPESampler,COMPLETE
267,0.16334780917541142,2025-04-24 21:10:48.431778,2025-04-24 21:10:54.065144,0 days 00:00:05.633366,69.9434274017507,RBF,13.476166588043151,0.00481771134274204,1.5,TPESampler,COMPLETE
268,0.16334779440048267,2025-04-24 21:10:48.773280,2025-04-24 21:10:54.145147,0 days 00:00:05.371867,1099.3657241519702,RBF,267.04292692313567,0.6756571651081263,0.5,TPESampler,COMPLETE
269,0.1633478089998933,2025-04-24 21:10:49.297289,2025-04-24 21:10:55.498228,0 days 00:00:06.200939,74625.05929922698,RBF,1.3424478110835223,0.00016144138281810145,1.5,TPESampler,COMPLETE
270,0.16334780932430007,2025-04-24 21:10:54.197083,2025-04-24 21:10:59.848693,0 days 00:00:05.651610,2446.92201901048,RBF,219.98771684843405,0.10947422646662497,0.5,TPESampler,COMPLETE
271,0.16334784593804677,2025-04-24 21:10:54.372165,2025-04-24 21:10:59.545908,0 days 00:00:05.173743,436.4330399191488,RBF,278.65643653255273,0.43125650114388114,0.5,TPESampler,COMPLETE
272,0.16334781970703513,2025-04-24 21:10:55.788236,2025-04-24 21:11:04.496670,0 days 00:00:08.708434,95715.3105160633,RBF,4091.878952748482,0.026476091395077728,0.5,TPESampler,COMPLETE
273,0.1633477969480717,2025-04-24 21:10:59.766329,2025-04-24 21:11:04.397390,0 days 00:00:04.631061,318.95903516699906,RBF,19.58332709548936,0.14083740562125538,0.5,TPESampler,COMPLETE
274,0.16334780950367306,2025-04-24 21:11:00.134375,2025-04-24 21:11:06.572459,0 days 00:00:06.438084,36.91624411349084,RBF,22.397192534992715,0.49624248528286513,0.5,TPESampler,COMPLETE
275,0.8703401340212038,2025-04-24 21:11:04.570537,2025-04-24 21:11:13.076903,0 days 00:00:08.506366,3.125646029688171,Matern,30.542940946626043,1.577784410154048e-09,2.5,TPESampler,COMPLETE
276,0.16334781462969336,2025-04-24 21:11:04.731265,2025-04-24 21:11:10.142960,0 days 00:00:05.411695,1480.8876288584609,RBF,20.79738022873792,0.012104933593800405,0.5,TPESampler,COMPLETE
277,0.16334781308256427,2025-04-24 21:11:06.845609,2025-04-24 21:11:13.163581,0 days 00:00:06.317972,2.8863049855118903,RBF,300.72490647536404,0.9451229225231821,0.5,TPESampler,COMPLETE
278,0.219774947428873,2025-04-24 21:11:10.395812,2025-04-24 21:11:17.919339,0 days 00:00:07.523527,429.1472362832852,Matern,20984.03072808071,0.900504423690358,0.5,TPESampler,COMPLETE
279,0.1633478034969235,2025-04-24 21:11:13.244620,2025-04-24 21:11:17.981397,0 days 00:00:04.736777,822.9075871360579,RBF,4.353300083740776,0.3518803206555771,0.5,TPESampler,COMPLETE
280,0.16334779195850097,2025-04-24 21:11:13.412154,2025-04-24 21:11:19.048488,0 days 00:00:05.636334,128.51823949741618,RBF,2.1226295877331944,0.26719224857343066,0.5,TPESampler,COMPLETE
281,0.9015775586159411,2025-04-24 21:11:18.108474,2025-04-24 21:11:21.795912,0 days 00:00:03.687438,244.4320351260503,Matern,5.717381825366501,2.84234401727763e-10,0.5,TPESampler,COMPLETE
282,0.16334777442080492,2025-04-24 21:11:18.166639,2025-04-24 21:11:23.661228,0 days 00:00:05.494589,1761.960080708208,RBF,69.8147141695422,0.5706336031920816,0.5,TPESampler,COMPLETE
283,0.1633478871940763,2025-04-24 21:11:19.351455,2025-04-24 21:11:24.640863,0 days 00:00:05.289408,26.78883783076887,RBF,5.706806540163342,0.01472931944011364,0.5,TPESampler,COMPLETE
284,0.1633478087738059,2025-04-24 21:11:22.060453,2025-04-24 21:11:34.637529,0 days 00:00:12.577076,1423.7664683080175,RBF,0.262192937709191,0.001663675510271307,1.5,TPESampler,COMPLETE
285,0.16334785465811158,2025-04-24 21:11:24.043444,2025-04-24 21:11:30.052346,0 days 00:00:06.008902,5353.346508578074,RBF,110.36025730054956,0.8853552134013701,0.5,TPESampler,COMPLETE
286,0.1633478160993437,2025-04-24 21:11:24.908115,2025-04-24 21:11:30.691088,0 days 00:00:05.782973,3892.6652999000776,RBF,7.283868788613733,0.003438929725864096,1.5,TPESampler,COMPLETE
287,0.16334780942363575,2025-04-24 21:11:30.328689,2025-04-24 21:11:42.379342,0 days 00:00:12.050653,176.20659624263132,RBF,0.6225101134378883,0.5118998432723512,0.5,TPESampler,COMPLETE
288,0.8703401340215177,2025-04-24 21:11:30.897571,2025-04-24 21:11:47.802321,0 days 00:00:16.904750,0.015052193534785385,RBF,0.20589256167729741,0.038061506464470284,1.5,TPESampler,COMPLETE
289,0.16334781673491233,2025-04-24 21:11:35.082896,2025-04-24 21:11:45.017452,0 days 00:00:09.934556,4774.063334423739,RBF,9.576200822216425,0.19050665669012362,2.5,TPESampler,COMPLETE
290,0.16334775740491914,2025-04-24 21:11:43.059913,2025-04-24 21:12:00.237290,0 days 00:00:17.177377,1174.7694425150273,RBF,27.701679856620235,0.0003030584373122079,1.5,TPESampler,COMPLETE
291,0.8703401338517532,2025-04-24 21:11:45.517215,2025-04-24 21:12:18.334874,0 days 00:00:32.817659,2.954558904693566e-07,RBF,0.1522187297367137,0.0003187813712631727,2.5,TPESampler,COMPLETE
292,0.8703401342060973,2025-04-24 21:11:48.499610,2025-04-24 21:12:07.752731,0 days 00:00:19.253121,4.3251565354153945,RBF,210.88368217727478,0.0004422913552760344,2.5,TPESampler,COMPLETE
293,0.1633478085471021,2025-04-24 21:12:01.040353,2025-04-24 21:12:22.239449,0 days 00:00:21.199096,0.2430273145630335,RBF,0.2328917215599638,3.705862215022674e-10,2.5,TPESampler,COMPLETE
294,0.16334780898323337,2025-04-24 21:12:08.983990,2025-04-24 21:12:21.293781,0 days 00:00:12.309791,442.07791417725065,RBF,6.871330453697655,0.0002547251164137257,1.5,TPESampler,COMPLETE
295,0.21977491155592832,2025-04-24 21:12:18.595266,2025-04-24 21:12:25.175782,0 days 00:00:06.580516,1818.822435510239,Matern,33.73974423454415,0.8784256432330885,0.5,TPESampler,COMPLETE
296,0.87034013402105,2025-04-24 21:12:21.575400,2025-04-24 21:12:30.412691,0 days 00:00:08.837291,69008.58476291643,RBF,3541.867348378507,0.00016462076891388285,1.5,TPESampler,COMPLETE
297,0.1633478091675473,2025-04-24 21:12:22.529396,2025-04-24 21:12:28.870386,0 days 00:00:06.340990,12806.237763179746,RBF,54.440932347994526,0.007490501769684628,1.5,TPESampler,COMPLETE
298,0.16334780738585825,2025-04-24 21:12:25.462743,2025-04-24 21:12:31.524984,0 days 00:00:06.062241,33912.93166075401,RBF,3.313883029151464,0.0001647536409789681,1.5,TPESampler,COMPLETE
299,0.8703401340212117,2025-04-24 21:12:29.166197,2025-04-24 21:12:36.757182,0 days 00:00:07.590985,0.7555138410661274,RBF,50.45518042189259,0.006147136821463633,1.5,TPESampler,COMPLETE
300,0.870340134035704,2025-04-24 21:12:30.699750,2025-04-24 21:12:37.576875,0 days 00:00:06.877125,22.20942573998083,RBF,125.20602217901047,0.0001952765658807603,1.5,TPESampler,COMPLETE
301,0.16334777859980074,2025-04-24 21:12:31.801404,2025-04-24 21:12:36.843454,0 days 00:00:05.042050,72.91036357943757,RBF,94.89081944664485,0.45813829341134193,0.5,TPESampler,COMPLETE
302,0.1633478093740563,2025-04-24 21:12:36.929042,2025-04-24 21:12:43.553643,0 days 00:00:06.624601,2.171287440175957,RBF,6.486422524459548,0.28980676032508845,0.5,TPESampler,COMPLETE
303,0.16334781442054905,2025-04-24 21:12:37.102727,2025-04-24 21:12:41.579416,0 days 00:00:04.476689,138.45176148739947,RBF,54.515539015099655,0.2731125195827937,0.5,TPESampler,COMPLETE
304,0.1633478156175831,2025-04-24 21:12:37.807666,2025-04-24 21:12:43.646946,0 days 00:00:05.839280,11.82466607073262,RBF,180.5983080197171,0.375302881742714,0.5,TPESampler,COMPLETE
305,0.16334781087057557,2025-04-24 21:12:41.865973,2025-04-24 21:12:49.428287,0 days 00:00:07.562314,44848.028780810164,RBF,70.90189860964284,0.0012475935999985371,1.5,TPESampler,COMPLETE
306,0.16334780790842554,2025-04-24 21:12:43.760289,2025-04-24 21:12:49.808801,0 days 00:00:06.048512,88.48085757167821,RBF,231.3292993206698,0.2019181098286718,0.5,TPESampler,COMPLETE
307,0.8703401340204827,2025-04-24 21:12:43.835118,2025-04-24 21:12:51.446046,0 days 00:00:07.610928,48.740847571233004,RBF,7.829664834056879,3.7745501267556317e-06,1.5,TPESampler,COMPLETE
308,0.16334776721384497,2025-04-24 21:12:49.693006,2025-04-24 21:12:55.253851,0 days 00:00:05.560845,1236.4044817017525,RBF,112.09891912036952,0.7513395702984422,0.5,TPESampler,COMPLETE
309,0.8703401340175035,2025-04-24 21:12:50.040069,2025-04-24 21:12:54.882665,0 days 00:00:04.842596,762.6261865826299,RBF,91.25415332812335,0.00025320234760531455,1.5,TPESampler,COMPLETE
310,0.8703401339762542,2025-04-24 21:12:51.758269,2025-04-24 21:12:56.705045,0 days 00:00:04.946776,29.65139135891919,RBF,4.6417247262274965e-05,0.012227957122321014,1.5,TPESampler,COMPLETE
311,0.1633478105173208,2025-04-24 21:12:55.141875,2025-04-24 21:13:04.220494,0 days 00:00:09.078619,1.8276368702827146,RBF,0.27395369096812755,0.1057048810098044,1.5,TPESampler,COMPLETE
312,0.16355846125148485,2025-04-24 21:12:55.528796,2025-04-24 21:13:01.956374,0 days 00:00:06.427578,738.2825045637787,Matern,19.15422104229194,0.03283410818607689,1.5,TPESampler,COMPLETE
313,0.16334780140181743,2025-04-24 21:12:57.053603,2025-04-24 21:13:02.251698,0 days 00:00:05.198095,955.0813936527861,RBF,16.606057905143743,0.365568961999506,0.5,TPESampler,COMPLETE
314,0.16334780626341455,2025-04-24 21:13:02.206472,2025-04-24 21:13:06.590057,0 days 00:00:04.383585,307.74019486901335,RBF,96.59957641618242,0.9921792558678243,0.5,TPESampler,COMPLETE
315,0.9015771954044477,2025-04-24 21:13:02.537455,2025-04-24 21:13:06.022393,0 days 00:00:03.484938,109.99168090812607,RBF,0.05744070487332901,0.0024294756712824523,0.5,TPESampler,COMPLETE
316,0.16334780903462842,2025-04-24 21:13:04.498570,2025-04-24 21:13:10.368057,0 days 00:00:05.869487,80539.45126240859,RBF,43.75916831023296,0.2346399416989274,0.5,TPESampler,COMPLETE
317,0.16334784932357374,2025-04-24 21:13:06.273210,2025-04-24 21:13:11.576975,0 days 00:00:05.303765,49156.771723123464,RBF,1.1349707831985745,0.007005748488800659,1.5,TPESampler,COMPLETE
318,0.16334781127395048,2025-04-24 21:13:06.925576,2025-04-24 21:13:16.348387,0 days 00:00:09.422811,0.0009441508358570327,RBF,0.6334748867669682,0.625924853350443,2.5,TPESampler,COMPLETE
319,0.901577195534268,2025-04-24 21:13:10.648061,2025-04-24 21:13:14.793378,0 days 00:00:04.145317,1993.991364561867,RBF,2.5694086940782646e-05,3.829442222493293e-06,0.5,TPESampler,COMPLETE
320,0.1633478093630325,2025-04-24 21:13:11.832102,2025-04-24 21:13:19.066879,0 days 00:00:07.234777,52250.9240496952,RBF,55.68364956688937,0.0014211692942994326,1.5,TPESampler,COMPLETE
321,0.16334780384127992,2025-04-24 21:13:15.356503,2025-04-24 21:13:21.238576,0 days 00:00:05.882073,420.5651122394707,RBF,326.07822764307764,0.7617243644539446,0.5,TPESampler,COMPLETE
322,0.16334778714016449,2025-04-24 21:13:16.603789,2025-04-24 21:13:21.950981,0 days 00:00:05.347192,29.990812528712887,RBF,3.133517102414436,0.03764256870091935,1.5,TPESampler,COMPLETE
323,0.16334779024485882,2025-04-24 21:13:19.356462,2025-04-24 21:13:25.120726,0 days 00:00:05.764264,6414.682767868119,RBF,0.7921625007592482,0.9746580468010664,0.5,TPESampler,COMPLETE
324,0.9014771676054816,2025-04-24 21:13:21.496679,2025-04-24 21:13:26.631332,0 days 00:00:05.134653,2.3598352241244564e-06,Matern,220.14127638974307,3.568992527111485e-07,2.5,TPESampler,COMPLETE
325,0.1633478089797793,2025-04-24 21:13:22.208024,2025-04-24 21:13:29.489447,0 days 00:00:07.281423,46.75776894655815,RBF,6.512493835032076,0.5327822702196453,1.5,TPESampler,COMPLETE
326,0.1633478093296333,2025-04-24 21:13:25.370253,2025-04-24 21:13:30.829341,0 days 00:00:05.459088,9010.274893553842,RBF,0.6619861633412376,0.23080122401881498,0.5,TPESampler,COMPLETE
327,0.870340134056184,2025-04-24 21:13:26.885495,2025-04-24 21:13:33.791591,0 days 00:00:06.906096,13.486514478970726,Matern,0.03926576192572768,5.723686218117204e-05,1.5,TPESampler,COMPLETE
328,0.16334781291741024,2025-04-24 21:13:29.841212,2025-04-24 21:13:45.414019,0 days 00:00:15.572807,215.38899198459248,RBF,1.8124584937185837,0.014699169134840437,1.5,TPESampler,COMPLETE
329,0.8703401340200755,2025-04-24 21:13:31.185219,2025-04-24 21:13:36.008533,0 days 00:00:04.823314,157.92739663318892,RBF,0.04420527144010009,0.20449930597059174,0.5,TPESampler,COMPLETE
330,0.8703401339788243,2025-04-24 21:13:34.062574,2025-04-24 21:13:45.703206,0 days 00:00:11.640632,45963.811163111204,RBF,0.14755948965818005,0.3341452102880768,0.5,TPESampler,COMPLETE
331,0.2197749373575395,2025-04-24 21:13:36.688640,2025-04-24 21:13:48.696322,0 days 00:00:12.007682,14.717486650556596,Matern,0.560521445414165,0.0777968128164305,0.5,TPESampler,COMPLETE
332,0.8703401340214783,2025-04-24 21:13:45.762736,2025-04-24 21:13:49.993781,0 days 00:00:04.231045,430.03621650284146,RBF,0.04088659274181854,0.009855831210882172,1.5,TPESampler,COMPLETE
333,0.16334780689420017,2025-04-24 21:13:45.922140,2025-04-24 21:13:55.039296,0 days 00:00:09.117156,19.94410700312435,RBF,0.9179427524913433,0.0011535342909490011,1.5,TPESampler,COMPLETE
334,0.16334779898883417,2025-04-24 21:13:48.982326,2025-04-24 21:13:55.689872,0 days 00:00:06.707546,491.1158112296055,RBF,1.0286311153691001,0.004712492499433289,0.5,TPESampler,COMPLETE
335,0.16334781366647488,2025-04-24 21:13:50.246869,2025-04-24 21:13:55.705123,0 days 00:00:05.458254,6290.769786912372,RBF,61.686258031333644,0.7753212824394227,0.5,TPESampler,COMPLETE
336,0.16334780899922482,2025-04-24 21:13:55.279815,2025-04-24 21:14:01.965147,0 days 00:00:06.685332,16.496299049202438,RBF,5.3039043886642485,0.002171171947138934,1.5,TPESampler,COMPLETE
337,0.9015771955346188,2025-04-24 21:13:56.038711,2025-04-24 21:14:00.205613,0 days 00:00:04.166902,16.315839998612322,RBF,0.05799466838288829,4.737147967901404e-09,1.5,TPESampler,COMPLETE
338,0.9015771955345716,2025-04-24 21:13:56.117376,2025-04-24 21:14:00.289949,0 days 00:00:04.172573,33.69513420942316,RBF,1.0663082163415358e-05,2.1470284381787109e-07,2.5,TPESampler,COMPLETE
339,0.16334781430551376,2025-04-24 21:14:00.378629,2025-04-24 21:14:08.129672,0 days 00:00:07.751043,16.053601058911052,RBF,148.73869166223275,0.026942311954826895,1.5,TPESampler,COMPLETE
340,0.1633478163856111,2025-04-24 21:14:00.423017,2025-04-24 21:14:05.946786,0 days 00:00:05.523769,7.667050688027512,RBF,3.979783095000482,0.03238516302510992,1.5,TPESampler,COMPLETE
341,0.16334780928567766,2025-04-24 21:14:02.211534,2025-04-24 21:14:07.595103,0 days 00:00:05.383569,96635.62103019953,RBF,1.6021211175569863,0.034826337721996954,0.5,TPESampler,COMPLETE
342,0.8703401339617176,2025-04-24 21:14:06.234115,2025-04-24 21:14:10.033882,0 days 00:00:03.799767,297.4744462866779,Matern,73491.15352564436,7.031031127316927e-10,0.5,TPESampler,COMPLETE
343,0.8703401340271961,2025-04-24 21:14:07.883199,2025-04-24 21:14:12.086312,0 days 00:00:04.203113,771.047282224655,RBF,0.060231395993570344,0.3058461177206243,1.5,TPESampler,COMPLETE
344,0.8703401340215193,2025-04-24 21:14:08.448803,2025-04-24 21:14:16.481478,0 days 00:00:08.032675,6.907842164984708e-07,RBF,0.0015570586160382279,1.4855326561398107e-07,2.5,TPESampler,COMPLETE
345,0.1633478089189619,2025-04-24 21:14:10.278002,2025-04-24 21:14:17.198000,0 days 00:00:06.919998,39896.18000692077,RBF,1.071628521304886,0.0028105900935290976,1.5,TPESampler,COMPLETE
346,0.8703401340176218,2025-04-24 21:14:12.364378,2025-04-24 21:14:25.036799,0 days 00:00:12.672421,1.6539390379822639e-06,RBF,5640.335288780449,6.077159574724181e-10,0.5,TPESampler,COMPLETE
