number,value,datetime_start,datetime_complete,duration,params_constant_value,params_kernel_type,params_length_scale,params_noise_level,params_nu,system_attrs_auto:sampler,state
928,0.21977494147896537,2025-04-24 21:38:21.216459,2025-04-24 21:38:26.970596,0 days 00:00:05.754137,892.3209821326443,Matern,0.6157751154676092,0.0006450067333334575,0.5,TPESampler,COMPLETE
929,0.8703401339490098,2025-04-24 21:38:23.803523,2025-04-24 21:38:29.104879,0 days 00:00:05.301356,2.764663151622509e-05,Matern,1.01302773491112e-05,1.1715668574280328e-08,2.5,TPESampler,COMPLETE
930,0.8703401340061138,2025-04-24 21:38:25.064689,2025-04-24 21:38:28.549045,0 days 00:00:03.484356,1.2112391194302503,RBF,0.013639737723472198,0.00044848725831428225,1.5,TPESampler,COMPLETE
931,0.9015771858485387,2025-04-24 21:38:27.232289,2025-04-24 21:38:30.839119,0 days 00:00:03.606830,2.008081647645721e-07,RBF,0.0020688873670257624,0.1975101614315186,1.5,TPESampler,COMPLETE
932,0.16334780470508303,2025-04-24 21:38:28.842347,2025-04-24 21:38:35.834222,0 days 00:00:06.991875,51.23948907783972,RBF,3.4076780282366586,0.0001199410756682422,1.5,TPESampler,COMPLETE
933,0.8703401339891764,2025-04-24 21:38:29.379397,2025-04-24 21:38:34.213905,0 days 00:00:04.834508,91.72630358491696,RBF,0.06449765786816904,8.993302593816975e-05,1.5,TPESampler,COMPLETE
934,0.8703401340212196,2025-04-24 21:38:31.253353,2025-04-24 21:38:38.720341,0 days 00:00:07.466988,0.018508034484625503,Matern,133.70180640867747,0.015789130729873757,0.5,TPESampler,COMPLETE
935,0.16344312295684685,2025-04-24 21:38:34.507995,2025-04-24 21:38:40.479946,0 days 00:00:05.971951,0.230614619827153,Matern,1.2012729554789237,5.064723469839048e-05,2.5,TPESampler,COMPLETE
936,0.16334780687772152,2025-04-24 21:38:36.079729,2025-04-24 21:38:42.556686,0 days 00:00:06.476957,3.867342193163802,RBF,2.2788180554415036,0.0001976612105951092,1.5,TPESampler,COMPLETE
937,0.16334781702988319,2025-04-24 21:38:38.959424,2025-04-24 21:38:46.423585,0 days 00:00:07.464161,98.5954185682289,RBF,4.1006417982927825,0.0006319777414021676,1.5,TPESampler,COMPLETE
938,0.163347762417084,2025-04-24 21:38:40.770602,2025-04-24 21:38:50.302351,0 days 00:00:09.531749,164.95721777466852,RBF,0.2922644529101879,0.00018600513862674717,1.5,TPESampler,COMPLETE
939,0.870340134028804,2025-04-24 21:38:42.849962,2025-04-24 21:38:46.702164,0 days 00:00:03.852202,2.5459496906077685,RBF,0.003848718197062504,9.306495022857444e-05,1.5,TPESampler,COMPLETE
940,0.8703401340211671,2025-04-24 21:38:46.634840,2025-04-24 21:38:53.909983,0 days 00:00:07.275143,461.6179701584562,RBF,13.607527632557929,2.2138414139735678e-09,0.5,TPESampler,COMPLETE
941,0.9015779689600949,2025-04-24 21:38:46.955162,2025-04-24 21:38:51.814280,0 days 00:00:04.859118,15.872515714166717,RBF,0.6906083327548258,1.4075707854913327e-05,1.5,TPESampler,COMPLETE
942,0.9015779748326284,2025-04-24 21:38:50.548429,2025-04-24 21:38:54.135787,0 days 00:00:03.587358,217.0947064245479,RBF,2.3710867677464478,7.316444164382327e-06,1.5,TPESampler,COMPLETE
943,0.16334780959218914,2025-04-24 21:38:52.060723,2025-04-24 21:39:03.934376,0 days 00:00:11.873653,18.431420059078093,RBF,0.2450341619300545,0.008491053469740557,1.5,TPESampler,COMPLETE
944,0.8703401340130327,2025-04-24 21:38:54.134771,2025-04-24 21:38:59.600279,0 days 00:00:05.465508,0.013020478666729635,RBF,1.2997145772071612,0.0010840188543759439,1.5,TPESampler,COMPLETE
945,0.163347808128003,2025-04-24 21:38:54.388628,2025-04-24 21:39:10.992915,0 days 00:00:16.604287,9.714268365689799,RBF,0.327813929558727,1.2844967385428188e-05,1.5,TPESampler,COMPLETE
946,0.8703401340727984,2025-04-24 21:38:59.886878,2025-04-24 21:39:04.463859,0 days 00:00:04.576981,0.012942857386362604,RBF,0.029144625296452294,3.49501101969491e-05,1.5,TPESampler,COMPLETE
947,0.8703401340480387,2025-04-24 21:39:04.225925,2025-04-24 21:39:11.680591,0 days 00:00:07.454666,1236.6415650108595,RBF,0.11595512165435368,0.028619694046251656,1.5,TPESampler,COMPLETE
948,0.16334779026504742,2025-04-24 21:39:04.686585,2025-04-24 21:39:17.062108,0 days 00:00:12.375523,915.0568943854443,RBF,20.551006888239474,9.526293984470598e-05,1.5,TPESampler,COMPLETE
949,0.21977495061837787,2025-04-24 21:39:11.444859,2025-04-24 21:39:20.500459,0 days 00:00:09.055600,0.04616203912204811,Matern,0.19658439577302456,3.234090452395306e-06,0.5,TPESampler,COMPLETE
950,0.8703401341885981,2025-04-24 21:39:11.905086,2025-04-24 21:39:19.479416,0 days 00:00:07.574330,3000.0165030793955,RBF,0.08999536792169278,3.2697054116754015e-05,1.5,TPESampler,COMPLETE
951,0.8703401340212943,2025-04-24 21:39:17.449452,2025-04-24 21:39:28.404275,0 days 00:00:10.954823,31.08942585504637,RBF,320.37812802855973,2.9748267462279185e-06,1.5,TPESampler,COMPLETE
952,0.16334781211988378,2025-04-24 21:39:19.752389,2025-04-24 21:39:25.912193,0 days 00:00:06.159804,42.49646793581871,RBF,3.0821808563912643,0.0003650613764666539,1.5,TPESampler,COMPLETE
953,0.8703401340223634,2025-04-24 21:39:20.748230,2025-04-24 21:39:24.303120,0 days 00:00:03.554890,0.9902350276858455,RBF,0.009367602332828275,0.00011648772982300838,0.5,TPESampler,COMPLETE
954,0.16334781109956134,2025-04-24 21:39:24.607945,2025-04-24 21:39:31.211819,0 days 00:00:06.603874,80463.69658230689,RBF,678.1215495105251,0.3267812313906866,1.5,TPESampler,COMPLETE
955,0.9015771955345249,2025-04-24 21:39:26.169051,2025-04-24 21:39:30.290186,0 days 00:00:04.121135,69.67140405830392,RBF,0.05664051070326457,2.0887566103526956e-07,1.5,TPESampler,COMPLETE
956,0.16334782474267528,2025-04-24 21:39:28.650937,2025-04-24 21:39:35.235445,0 days 00:00:06.584508,67105.29075563997,RBF,0.5438102674388451,0.005188802036220917,1.5,TPESampler,COMPLETE
957,0.8703401340111411,2025-04-24 21:39:30.571840,2025-04-24 21:39:41.384657,0 days 00:00:10.812817,0.0007245418532817642,Matern,13644.172509099877,5.9736514742468814e-09,1.5,TPESampler,COMPLETE
958,0.870340134010028,2025-04-24 21:39:31.497706,2025-04-24 21:39:38.840968,0 days 00:00:07.343262,7396.6367274279455,Matern,51.145574855202995,6.736002049630047e-10,2.5,TPESampler,COMPLETE
959,0.21977492541038743,2025-04-24 21:39:35.507224,2025-04-24 21:39:50.349868,0 days 00:00:14.842644,1.4692434475107312e-07,Matern,0.3004595639080484,0.0286568018027063,0.5,TPESampler,COMPLETE
960,0.8703401340207509,2025-04-24 21:39:39.103419,2025-04-24 21:39:48.001523,0 days 00:00:08.898104,713.7463294825982,RBF,189.28305875135143,0.00011147075051710134,1.5,TPESampler,COMPLETE
961,0.16334783935015604,2025-04-24 21:39:41.641475,2025-04-24 21:39:51.100882,0 days 00:00:09.459407,72.2564805713772,RBF,0.5646191502075527,3.2913852682497155e-05,2.5,TPESampler,COMPLETE
962,0.8703401340412911,2025-04-24 21:39:48.294232,2025-04-24 21:39:53.252369,0 days 00:00:04.958137,131.77713631382449,RBF,0.040350210528596185,0.003348614654646768,1.5,TPESampler,COMPLETE
963,0.16334780804213245,2025-04-24 21:39:50.646232,2025-04-24 21:39:59.237444,0 days 00:00:08.591212,1772.89046573906,RBF,82782.7487237219,0.8631181677065103,0.5,TPESampler,COMPLETE
964,0.16334780804117188,2025-04-24 21:39:51.351948,2025-04-24 21:40:00.227673,0 days 00:00:08.875725,240.3182195725362,RBF,0.26603526911169373,0.02191323309059641,2.5,TPESampler,COMPLETE
965,0.16334780678220953,2025-04-24 21:39:53.532985,2025-04-24 21:40:01.301621,0 days 00:00:07.768636,158.41283010250098,RBF,2.0426851345949424,0.010993396363486148,1.5,TPESampler,COMPLETE
966,0.8703401340112461,2025-04-24 21:39:59.517200,2025-04-24 21:40:07.467971,0 days 00:00:07.950771,91332.96057656135,RBF,18349.218745727307,0.0019830742315264153,2.5,TPESampler,COMPLETE
967,0.8703401340177711,2025-04-24 21:40:00.464186,2025-04-24 21:40:05.122698,0 days 00:00:04.658512,0.0010405811708932148,RBF,0.0024134340221079334,2.0383745424470516e-10,1.5,TPESampler,COMPLETE
968,0.16334781064567555,2025-04-24 21:40:01.581480,2025-04-24 21:40:08.843549,0 days 00:00:07.262069,1934.1622706162661,RBF,1.2748349880935548,0.0001268759746190051,1.5,TPESampler,COMPLETE
969,0.1633478063261731,2025-04-24 21:40:05.371725,2025-04-24 21:40:11.583622,0 days 00:00:06.211897,1.5717573197883143,RBF,3.7243974012078915,0.0008106734652698471,1.5,TPESampler,COMPLETE
970,0.16334779359322957,2025-04-24 21:40:07.731211,2025-04-24 21:40:15.587250,0 days 00:00:07.856039,0.21857955151342318,RBF,2.883868249564648,0.009095271688160952,2.5,TPESampler,COMPLETE
971,0.16344312276875905,2025-04-24 21:40:09.115546,2025-04-24 21:40:16.887001,0 days 00:00:07.771455,9249.761968168761,Matern,39232.76775974118,0.646431127559518,2.5,TPESampler,COMPLETE
972,0.8703401340212402,2025-04-24 21:40:11.863192,2025-04-24 21:40:16.398623,0 days 00:00:04.535431,1206.2559162570874,RBF,0.07076227113849297,0.1514770769507105,1.5,TPESampler,COMPLETE
973,0.8703401340220084,2025-04-24 21:40:15.893903,2025-04-24 21:40:26.572091,0 days 00:00:10.678188,15.933438993371636,RBF,197.35497301215142,0.0006127751162527917,1.5,TPESampler,COMPLETE
974,0.8703401340210275,2025-04-24 21:40:16.632560,2025-04-24 21:40:32.609918,0 days 00:00:15.977358,606.277340587693,RBF,4700.986597280812,0.004700162775513204,0.5,TPESampler,COMPLETE
975,0.8703401340213363,2025-04-24 21:40:17.179693,2025-04-24 21:40:28.059442,0 days 00:00:10.879749,0.43634310132776405,RBF,0.11167704106699383,0.7292889300904545,1.5,TPESampler,COMPLETE
976,0.8703401340211494,2025-04-24 21:40:27.017826,2025-04-24 21:40:32.326090,0 days 00:00:05.308264,54.80473060990477,RBF,81.79611636272847,0.002597371929594056,2.5,TPESampler,COMPLETE
977,0.16334781000891457,2025-04-24 21:40:28.308143,2025-04-24 21:40:35.072033,0 days 00:00:06.763890,63714.94555495244,RBF,4686.184075066714,0.8755723159873475,0.5,TPESampler,COMPLETE
978,0.8703401340212257,2025-04-24 21:40:32.530864,2025-04-24 21:40:39.246096,0 days 00:00:06.715232,0.0522105061911769,RBF,22.52634047374532,7.9313671745455e-05,1.5,TPESampler,COMPLETE
979,0.8703401340189679,2025-04-24 21:40:32.835055,2025-04-24 21:40:40.747839,0 days 00:00:07.912784,102.95583732105484,RBF,211.43560593306353,8.448966613597879e-06,0.5,TPESampler,COMPLETE
980,0.16334779801747196,2025-04-24 21:40:35.357821,2025-04-24 21:40:41.436253,0 days 00:00:06.078432,32469.9671133388,RBF,44.6834001256089,0.01987583122669344,1.5,TPESampler,COMPLETE
981,0.8703401340218252,2025-04-24 21:40:39.533967,2025-04-24 21:40:53.531037,0 days 00:00:13.997070,1.0564380099625698e-05,Matern,50389.88114370496,1.1863888462298413e-06,2.5,TPESampler,COMPLETE
982,0.8703401340129956,2025-04-24 21:40:40.996587,2025-04-24 21:40:47.648283,0 days 00:00:06.651696,0.8977901221524556,RBF,6.887716193403241,0.0006743344272429411,0.5,TPESampler,COMPLETE
983,0.16334781295024556,2025-04-24 21:40:41.646527,2025-04-24 21:40:52.389992,0 days 00:00:10.743465,55329.094551269984,RBF,18.963378669202093,0.8895970917808758,1.5,TPESampler,COMPLETE
984,0.1633477988133326,2025-04-24 21:40:47.900504,2025-04-24 21:40:55.380255,0 days 00:00:07.479751,164.07787424890557,RBF,35654.657126909915,0.0946911228521525,2.5,TPESampler,COMPLETE
985,0.16334756073208875,2025-04-24 21:40:52.682427,2025-04-24 21:40:58.596130,0 days 00:00:05.913703,66.21935282721739,RBF,10.911208454486944,0.0026271956468050246,2.5,TPESampler,COMPLETE
986,0.1633478090560773,2025-04-24 21:40:53.790691,2025-04-24 21:41:03.253130,0 days 00:00:09.462439,0.009302053049214255,RBF,0.22936610348391345,4.891838562239375e-07,1.5,TPESampler,COMPLETE
987,0.16334779574761327,2025-04-24 21:40:55.662135,2025-04-24 21:41:02.461015,0 days 00:00:06.798880,89634.49088986209,RBF,0.4483533211073306,0.04031379014977825,1.5,TPESampler,COMPLETE
988,0.8703401340376696,2025-04-24 21:40:58.894848,2025-04-24 21:41:04.058718,0 days 00:00:05.163870,0.06658714598161135,RBF,0.005719750922413357,0.003371007110130681,2.5,TPESampler,COMPLETE
989,0.9015779748797349,2025-04-24 21:41:02.731077,2025-04-24 21:41:07.515743,0 days 00:00:04.784666,1307.3668697764206,RBF,1.471451232911376,1.2397801625365041e-05,2.5,TPESampler,COMPLETE
990,0.16334779213476674,2025-04-24 21:41:03.559962,2025-04-24 21:41:08.868374,0 days 00:00:05.308412,190.3352500806948,RBF,17.46543177078019,0.003296229381477857,2.5,TPESampler,COMPLETE
991,0.16334780732385282,2025-04-24 21:41:04.308968,2025-04-24 21:41:09.567340,0 days 00:00:05.258372,3597.8906580284024,RBF,10.518461152332602,0.01885365734434106,2.5,TPESampler,COMPLETE
992,0.8703401340207642,2025-04-24 21:41:07.794733,2025-04-24 21:41:14.817158,0 days 00:00:07.022425,2.4164630069864894,RBF,10.150635951941092,0.0020581075912096043,2.5,TPESampler,COMPLETE
993,0.1633478354691475,2025-04-24 21:41:09.111760,2025-04-24 21:41:16.488809,0 days 00:00:07.377049,2852.976054653671,RBF,49.665494557329865,0.002130718848947634,2.5,TPESampler,COMPLETE
994,0.16334781727805342,2025-04-24 21:41:10.043814,2025-04-24 21:41:17.710049,0 days 00:00:07.666235,7.503739730771469,RBF,1.4890042798036922,0.000567310780392555,2.5,TPESampler,COMPLETE
995,0.8703401340136123,2025-04-24 21:41:15.069109,2025-04-24 21:41:28.821045,0 days 00:00:13.751936,0.005863393063296213,RBF,1016.3740907369836,0.0024277969499375014,0.5,TPESampler,COMPLETE
996,0.8703401340233533,2025-04-24 21:41:16.737964,2025-04-24 21:41:26.424061,0 days 00:00:09.686097,0.05515496885130753,RBF,346.85418364452704,0.00012588068384138652,2.5,TPESampler,COMPLETE
997,0.16334781233862172,2025-04-24 21:41:18.000111,2025-04-24 21:41:25.479212,0 days 00:00:07.479101,35.41063364807594,RBF,9.905871196850404,0.001044189678801008,2.5,TPESampler,COMPLETE
998,0.16334757019409946,2025-04-24 21:41:25.735977,2025-04-24 21:41:31.668560,0 days 00:00:05.932583,3337.72099252942,RBF,0.7463277285698021,0.0006099472508484519,2.5,TPESampler,COMPLETE
999,0.16334781016168323,2025-04-24 21:41:26.703950,2025-04-24 21:41:32.171825,0 days 00:00:05.467875,463.16691931767303,RBF,3226.1634935795373,0.9269353597306152,0.5,TPESampler,COMPLETE
1000,0.16355853366049186,2025-04-24 21:41:29.080532,2025-04-24 21:41:36.566051,0 days 00:00:07.485519,0.7603875243685546,Matern,1.3068741684005474,0.00010336926670947499,1.5,TPESampler,COMPLETE
1001,0.30237717141308756,2025-04-24 21:41:31.919309,2025-04-24 21:41:46.985507,0 days 00:00:15.066198,6698.248250661408,RBF,0.216742201268576,0.01863054557136441,2.5,TPESampler,COMPLETE
1002,0.16334783619722282,2025-04-24 21:41:32.409566,2025-04-24 21:41:40.610827,0 days 00:00:08.201261,1357.983194713589,RBF,19.135916668672266,0.00027845242991737443,2.5,TPESampler,COMPLETE
1003,0.87034013402094,2025-04-24 21:41:37.055445,2025-04-24 21:41:51.431594,0 days 00:00:14.376149,13646.367406683261,RBF,0.07084609823702621,5.0400472258292475e-05,2.5,TPESampler,COMPLETE
1004,0.8703401340158288,2025-04-24 21:41:40.882081,2025-04-24 21:41:48.945962,0 days 00:00:08.063881,0.48877277096959976,RBF,0.010648481230953511,2.714146490255528e-10,0.5,TPESampler,COMPLETE
1005,0.16334778765784388,2025-04-24 21:41:47.247306,2025-04-24 21:41:52.233822,0 days 00:00:04.986516,143.57881955207742,RBF,4.539164122750504,0.032244712197325706,2.5,TPESampler,COMPLETE
1006,0.16334776097074213,2025-04-24 21:41:49.205976,2025-04-24 21:41:54.980069,0 days 00:00:05.774093,1239.8687453571022,RBF,1.6234992219372266,0.001552345238724317,2.5,TPESampler,COMPLETE
1007,0.1633478089268325,2025-04-24 21:41:51.763695,2025-04-24 21:41:57.715018,0 days 00:00:05.951323,14007.839403204749,RBF,2.6328215068839396,0.0005864794205839299,2.5,TPESampler,COMPLETE
1008,0.8703401340214122,2025-04-24 21:41:52.488366,2025-04-24 21:41:59.053191,0 days 00:00:06.564825,21376.181673066534,RBF,0.026990420418891093,0.0013510651492422555,2.5,TPESampler,COMPLETE
1009,0.16334780033115973,2025-04-24 21:41:55.270867,2025-04-24 21:42:01.620768,0 days 00:00:06.349901,72.9912927049801,RBF,0.903010941520294,0.004376822263938623,2.5,TPESampler,COMPLETE
1010,0.163347802475251,2025-04-24 21:41:58.004814,2025-04-24 21:42:04.536105,0 days 00:00:06.531291,0.656599839186369,RBF,88.83438838980074,0.0274502109333271,2.5,TPESampler,COMPLETE
1011,0.8703401340213084,2025-04-24 21:41:59.299407,2025-04-24 21:42:03.969027,0 days 00:00:04.669620,2.3689623643388873,RBF,0.08864248591915896,0.0017425195379356685,2.5,TPESampler,COMPLETE
1012,0.8703401340291854,2025-04-24 21:42:02.027081,2025-04-24 21:42:08.559718,0 days 00:00:06.532637,21.206555163027645,RBF,0.030866302321038642,4.1134984401328765e-05,2.5,TPESampler,COMPLETE
1013,0.16334780755076322,2025-04-24 21:42:04.279199,2025-04-24 21:42:11.400499,0 days 00:00:07.121300,77345.50094006465,RBF,1.7327602651328247,0.006235795134519279,2.5,TPESampler,COMPLETE
1014,0.9015771955348381,2025-04-24 21:42:04.761921,2025-04-24 21:42:08.489354,0 days 00:00:03.727433,908.995141294208,RBF,3.1521656996821366e-05,9.082352689707748e-06,1.5,TPESampler,COMPLETE
1015,0.8703401340211412,2025-04-24 21:42:08.690067,2025-04-24 21:42:16.394208,0 days 00:00:07.704141,153.5674522044614,RBF,0.02038556247082215,0.00018579096947322245,2.5,TPESampler,COMPLETE
1016,0.8703401340242103,2025-04-24 21:42:08.781295,2025-04-24 21:42:16.131604,0 days 00:00:07.350309,330.1616756017232,RBF,0.1319347781523713,0.00025550494941336594,2.5,TPESampler,COMPLETE
1017,0.9015776966555974,2025-04-24 21:42:11.926777,2025-04-24 21:42:19.878478,0 days 00:00:07.951701,0.7337777171770259,RBF,5032.320709501706,0.8303174429595835,2.5,TPESampler,COMPLETE
1018,0.8703401340214287,2025-04-24 21:42:16.345651,2025-04-24 21:42:24.370299,0 days 00:00:08.024648,29.816332646212064,RBF,115.12057174206103,6.0878321191146964e-06,2.5,TPESampler,COMPLETE
1019,0.1633478092283131,2025-04-24 21:42:16.642179,2025-04-24 21:42:23.038134,0 days 00:00:06.395955,45272.23451752804,RBF,3.6109903985203204,5.5156249894638516e-05,2.5,TPESampler,COMPLETE
1020,0.1633478399457519,2025-04-24 21:42:20.197240,2025-04-24 21:42:26.430097,0 days 00:00:06.232857,39.41603795112726,RBF,0.7169315856654858,0.01220666958511291,2.5,TPESampler,COMPLETE
1021,0.16334781181341632,2025-04-24 21:42:23.290623,2025-04-24 21:42:29.756776,0 days 00:00:06.466153,13.198099191308799,RBF,2.3028584644906847,0.00015211156757321477,2.5,TPESampler,COMPLETE
1022,0.1633477981888744,2025-04-24 21:42:24.615676,2025-04-24 21:42:29.840565,0 days 00:00:05.224889,804.8829628260926,RBF,1.0201061735608485,0.00044038269157481013,2.5,TPESampler,COMPLETE
1023,0.1633478016244979,2025-04-24 21:42:26.674887,2025-04-24 21:42:33.545008,0 days 00:00:06.870121,3645.2601712407354,RBF,282.0201381058846,0.49714540657468503,2.5,TPESampler,COMPLETE
1024,0.16334777513598125,2025-04-24 21:42:29.956502,2025-04-24 21:42:37.483014,0 days 00:00:07.526512,1.2219359979029567,RBF,155.49275171692975,0.0422680352386188,0.5,TPESampler,COMPLETE
1025,0.8703401340209193,2025-04-24 21:42:30.024857,2025-04-24 21:42:38.939631,0 days 00:00:08.914774,278.5805221305538,RBF,181.05976233389134,0.00030499972495165895,2.5,TPESampler,COMPLETE
1026,0.8703401340215683,2025-04-24 21:42:33.834149,2025-04-24 21:42:38.043993,0 days 00:00:04.209844,16.88990208526321,RBF,0.01590873307530752,0.00020944892339287756,1.5,TPESampler,COMPLETE
1027,0.1633478105225139,2025-04-24 21:42:37.784908,2025-04-24 21:42:45.162023,0 days 00:00:07.377115,34389.61738633047,RBF,9657.889226593794,0.03954212113981431,0.5,TPESampler,COMPLETE
1028,0.9015779738537915,2025-04-24 21:42:38.296866,2025-04-24 21:42:44.176088,0 days 00:00:05.879222,132.50521189926638,RBF,80655.65759833403,0.7914267347029142,0.5,TPESampler,COMPLETE
1029,0.16334780838848506,2025-04-24 21:42:39.172683,2025-04-24 21:42:47.173863,0 days 00:00:08.001180,127.45919083500196,RBF,1.2157426677077188,0.0005031550003637064,0.5,TPESampler,COMPLETE
1030,0.16334782192493535,2025-04-24 21:42:44.502121,2025-04-24 21:42:50.528059,0 days 00:00:06.025938,489.7638499831596,RBF,1.5037640925899194,0.00014926707072949953,1.5,TPESampler,COMPLETE
1031,0.16334781101211748,2025-04-24 21:42:45.475948,2025-04-24 21:42:51.019252,0 days 00:00:05.543304,632.0768532471723,RBF,55.81421762700761,0.0029572027274632944,2.5,TPESampler,COMPLETE
1032,0.1634430930471381,2025-04-24 21:42:47.478543,2025-04-24 21:42:57.635095,0 days 00:00:10.156552,1.4527346768838517e-06,Matern,0.7546083542261586,1.5936067978280467e-08,2.5,TPESampler,COMPLETE
1033,0.16334780766593215,2025-04-24 21:42:50.777115,2025-04-24 21:42:57.665890,0 days 00:00:06.888775,199.07181248381855,RBF,1.6504423982944778,7.365956976046439e-05,2.5,TPESampler,COMPLETE
1034,0.8703401342658383,2025-04-24 21:42:51.295006,2025-04-24 21:43:00.016214,0 days 00:00:08.721208,563.6154677789602,RBF,207.52479769792922,0.00012006440881029603,0.5,TPESampler,COMPLETE
1035,0.8703401340214955,2025-04-24 21:42:57.805234,2025-04-24 21:43:07.627176,0 days 00:00:09.821942,37040.957758972465,RBF,781.3905472703935,0.0006148766229451393,0.5,TPESampler,COMPLETE
1036,0.1635585106595071,2025-04-24 21:42:57.851925,2025-04-24 21:43:04.865459,0 days 00:00:07.013534,243.30282805850544,Matern,13.740874332383028,9.245994125926361e-05,1.5,TPESampler,COMPLETE
1037,0.16334780504303653,2025-04-24 21:43:00.283238,2025-04-24 21:43:08.691244,0 days 00:00:08.408006,57.32491672044396,RBF,4241.236845120381,0.9943530700997564,0.5,TPESampler,COMPLETE
1038,0.16334778952378554,2025-04-24 21:43:05.155907,2025-04-24 21:43:11.772482,0 days 00:00:06.616575,83682.27902048723,RBF,3561.515309577386,0.007742908924981901,0.5,TPESampler,COMPLETE
1039,0.16344312573727746,2025-04-24 21:43:07.914126,2025-04-24 21:43:14.348789,0 days 00:00:06.434663,57142.82585880938,Matern,2.2593886794824805,0.0367519946998499,2.5,TPESampler,COMPLETE
1040,0.163347807822379,2025-04-24 21:43:08.979770,2025-04-24 21:43:14.026911,0 days 00:00:05.047141,0.9865381632278152,RBF,0.378018794422296,0.0002459360030926791,1.5,TPESampler,COMPLETE
1041,0.16334780909619068,2025-04-24 21:43:12.066281,2025-04-24 21:43:17.444965,0 days 00:00:05.378684,1281.4119094928885,RBF,0.7337312491151322,0.000636590351095956,2.5,TPESampler,COMPLETE
1042,0.8703401340216946,2025-04-24 21:43:14.309009,2025-04-24 21:43:19.971931,0 days 00:00:05.662922,8.105233699711087,RBF,38.3339685342587,0.0008480761011499143,1.5,TPESampler,COMPLETE
