number,value,datetime_start,datetime_complete,duration,params_constant_value,params_kernel_type,params_length_scale,params_noise_level,params_nu,system_attrs_auto:sampler,state
2314,0.16334780861517254,2025-04-24 22:40:27.662135,2025-04-24 22:40:47.594043,0 days 00:00:19.931908,424.6695403919631,RBF,93828.45951463544,0.7421313263706968,0.5,TPESampler,COMPLETE
2315,0.901577971450653,2025-04-24 22:40:28.521514,2025-04-24 22:40:35.286321,0 days 00:00:06.764807,0.06471181002628577,RBF,3804.708683316348,0.7256979493205102,0.5,TPESampler,COMPLETE
2316,0.8703401106784244,2025-04-24 22:40:32.951413,2025-04-24 22:40:41.271521,0 days 00:00:08.320108,25.920959370606166,RBF,0.17326872894443274,0.0003279754068067591,1.5,TPESampler,COMPLETE
2317,0.9015779620415811,2025-04-24 22:40:36.154938,2025-04-24 22:40:44.110295,0 days 00:00:07.955357,0.08837728147384719,RBF,3090.487932440862,0.8711063428943757,0.5,TPESampler,COMPLETE
2318,0.8703401340129933,2025-04-24 22:40:41.533315,2025-04-24 22:40:47.901978,0 days 00:00:06.368663,4430.500162742312,RBF,8.149150015618837,1.6516397425671212e-05,1.5,TPESampler,COMPLETE
2319,0.1633478209598569,2025-04-24 22:40:44.589500,2025-04-24 22:40:51.089481,0 days 00:00:06.499981,0.7962971236894304,RBF,20.31531134588043,0.4947601077826739,0.5,TPESampler,COMPLETE
2320,0.16334779927385298,2025-04-24 22:40:47.848922,2025-04-24 22:40:53.392487,0 days 00:00:05.543565,90043.77968389301,RBF,445.8579642734689,0.8225413495030361,0.5,TPESampler,COMPLETE
2321,0.1633478013296184,2025-04-24 22:40:48.220148,2025-04-24 22:40:55.068797,0 days 00:00:06.848649,28.64475322741877,RBF,1.338375630724659,0.9356669855219639,0.5,TPESampler,COMPLETE
2322,0.1633477412103216,2025-04-24 22:40:51.432084,2025-04-24 22:41:03.739006,0 days 00:00:12.306922,72048.57123953242,RBF,8.221796710047377,0.9456181981863505,0.5,TPESampler,COMPLETE
2323,0.16334778094711339,2025-04-24 22:40:53.702102,2025-04-24 22:41:00.202772,0 days 00:00:06.500670,13580.027506268094,RBF,338.4529503370097,0.9442889454286573,0.5,TPESampler,COMPLETE
2324,0.1633478055088084,2025-04-24 22:40:55.312802,2025-04-24 22:41:00.149383,0 days 00:00:04.836581,54.22027481373102,RBF,166.52002466954846,0.07409196110099017,0.5,TPESampler,COMPLETE
2325,0.9015771955333742,2025-04-24 22:41:00.340228,2025-04-24 22:41:04.648210,0 days 00:00:04.307982,37320.31924760759,RBF,0.0016445406256707224,1.0470733519607964e-06,0.5,TPESampler,COMPLETE
2326,0.163347833418104,2025-04-24 22:41:00.523866,2025-04-24 22:41:06.221143,0 days 00:00:05.697277,21.384620873193015,RBF,244.9660178722196,0.8331547564606835,0.5,TPESampler,COMPLETE
2327,0.9015779746046646,2025-04-24 22:41:04.191874,2025-04-24 22:41:11.880574,0 days 00:00:07.688700,0.901044145254411,RBF,14644.186083365144,0.2074596446157971,2.5,TPESampler,COMPLETE
2328,0.16344314842966184,2025-04-24 22:41:04.858401,2025-04-24 22:41:13.229207,0 days 00:00:08.370806,5.643091112745334,Matern,9186.404214464603,0.19092887513045426,2.5,TPESampler,COMPLETE
2329,0.1633478094566884,2025-04-24 22:41:06.478462,2025-04-24 22:41:13.966829,0 days 00:00:07.488367,53193.091456314214,RBF,7112.190149698202,0.05819357039408049,0.5,TPESampler,COMPLETE
2330,0.8703401340210107,2025-04-24 22:41:12.165757,2025-04-24 22:41:24.504855,0 days 00:00:12.339098,1.4692760468391277e-07,RBF,2311.9808694151366,6.146999681635836e-07,0.5,TPESampler,COMPLETE
2331,0.1633478098034772,2025-04-24 22:41:13.488907,2025-04-24 22:41:18.572184,0 days 00:00:05.083277,53.67085003843477,RBF,70.97342327232693,0.996777045213865,0.5,TPESampler,COMPLETE
2332,0.9015777366764908,2025-04-24 22:41:14.219999,2025-04-24 22:41:17.193372,0 days 00:00:02.973373,1.9883505774314734e-07,RBF,335.6276151676497,0.12068511134448771,1.5,TPESampler,COMPLETE
2333,0.16334781096054812,2025-04-24 22:41:17.449585,2025-04-24 22:41:23.565590,0 days 00:00:06.116005,114.44977402492752,RBF,2.6989467400883185,6.024487966180178e-05,1.5,TPESampler,COMPLETE
2334,0.9015779746201052,2025-04-24 22:41:18.876011,2025-04-24 22:41:26.181201,0 days 00:00:07.305190,0.0002432689441344426,RBF,9730.605378328251,0.022815927270732287,0.5,TPESampler,COMPLETE
2335,0.21977493868666423,2025-04-24 22:41:23.874392,2025-04-24 22:41:29.729236,0 days 00:00:05.854844,19.261481601601723,Matern,726.6141350225951,0.7130266491476336,0.5,TPESampler,COMPLETE
2336,0.16334777906783166,2025-04-24 22:41:24.790785,2025-04-24 22:41:33.122591,0 days 00:00:08.331806,8.540167762700968,RBF,2896.1646080380033,0.9387473023475821,0.5,TPESampler,COMPLETE
2337,0.8703401340258584,2025-04-24 22:41:26.480386,2025-04-24 22:41:36.959857,0 days 00:00:10.479471,0.00026754700054984785,Matern,48970.76811460014,3.1822717897705718e-06,0.5,TPESampler,COMPLETE
2338,0.16334780849639358,2025-04-24 22:41:30.024954,2025-04-24 22:41:36.064893,0 days 00:00:06.039939,13541.309551908122,RBF,9784.162827425145,0.9421077227878601,0.5,TPESampler,COMPLETE
2339,0.16334779802051674,2025-04-24 22:41:33.424993,2025-04-24 22:41:39.031521,0 days 00:00:05.606528,809.3960852769568,RBF,3468.6166261905855,0.9851891365237937,0.5,TPESampler,COMPLETE
2340,0.8703401340376552,2025-04-24 22:41:36.320457,2025-04-24 22:41:50.205083,0 days 00:00:13.884626,6.683284217820211e-05,Matern,0.0007281554789611161,0.0006954732453407891,1.5,TPESampler,COMPLETE
2341,0.16334770128202175,2025-04-24 22:41:37.243381,2025-04-24 22:41:44.387935,0 days 00:00:07.144554,0.8257104898899092,RBF,87.64749685237895,0.8348995127017946,0.5,TPESampler,COMPLETE
2342,0.2197749474364076,2025-04-24 22:41:39.326162,2025-04-24 22:41:46.150514,0 days 00:00:06.824352,44.06397761624401,Matern,2812.843942523778,0.00280772949552213,0.5,TPESampler,COMPLETE
2343,0.16334780904330487,2025-04-24 22:41:44.695604,2025-04-24 22:41:52.266783,0 days 00:00:07.571179,0.8507340366662274,RBF,3.24279280298135,0.4475192610530214,0.5,TPESampler,COMPLETE
2344,0.16334780972042307,2025-04-24 22:41:46.452294,2025-04-24 22:41:53.542430,0 days 00:00:07.090136,0.177747845731756,RBF,16.77125554145651,0.6367639629439285,0.5,TPESampler,COMPLETE
2345,0.8703401340212733,2025-04-24 22:41:50.466444,2025-04-24 22:41:54.618650,0 days 00:00:04.152206,1.6518865275637347,RBF,0.06834967462354267,0.10109369396135026,0.5,TPESampler,COMPLETE
2346,0.1633478225857054,2025-04-24 22:41:52.581370,2025-04-24 22:41:57.921245,0 days 00:00:05.339875,6.844878908433358,RBF,721.2556451231167,0.4352254427284522,2.5,TPESampler,COMPLETE
2347,0.16334780836036958,2025-04-24 22:41:53.854921,2025-04-24 22:42:01.420253,0 days 00:00:07.565332,10.233980711474965,RBF,0.41651779245452764,0.25818444223632675,0.5,TPESampler,COMPLETE
2348,0.8703401340850357,2025-04-24 22:41:54.862018,2025-04-24 22:42:01.416617,0 days 00:00:06.554599,0.30780014166326497,RBF,35.06088692762762,0.0001654733637392113,1.5,TPESampler,COMPLETE
2349,0.8703401340207965,2025-04-24 22:41:58.217222,2025-04-24 22:42:07.653983,0 days 00:00:09.436761,0.1078640445138187,RBF,21.037365552523518,0.02309726653553766,0.5,TPESampler,COMPLETE
2350,0.1633478102956462,2025-04-24 22:42:01.704866,2025-04-24 22:42:17.790403,0 days 00:00:16.085537,0.0005170180973586922,RBF,260.2209661708367,0.5690318721475806,0.5,TPESampler,COMPLETE
2351,0.8703401340213541,2025-04-24 22:42:01.751906,2025-04-24 22:42:12.282513,0 days 00:00:10.530607,0.03093290208559366,RBF,418.0635818148599,0.005099555322916013,0.5,TPESampler,COMPLETE
2352,0.1633477852565604,2025-04-24 22:42:07.936741,2025-04-24 22:42:13.370669,0 days 00:00:05.433928,267.01005260839304,RBF,171.085105406203,0.8456357816446709,2.5,TPESampler,COMPLETE
2353,0.16334780939485055,2025-04-24 22:42:12.564688,2025-04-24 22:42:17.694403,0 days 00:00:05.129715,463.8856466407867,RBF,1.1850776739987106,0.6252054068858037,0.5,TPESampler,COMPLETE
2354,0.1633477894609446,2025-04-24 22:42:13.675493,2025-04-24 22:42:20.405087,0 days 00:00:06.729594,0.9319063594837861,RBF,9.18109066567828,0.7932547647540598,0.5,TPESampler,COMPLETE
2355,0.16344312698103042,2025-04-24 22:42:17.919719,2025-04-24 22:42:24.017278,0 days 00:00:06.097559,62795.61056886083,Matern,167.99521211888964,0.010092998878317517,2.5,TPESampler,COMPLETE
2356,0.8703401340260902,2025-04-24 22:42:18.004451,2025-04-24 22:42:26.308327,0 days 00:00:08.303876,0.16010958089699592,RBF,67.63480422422953,0.004651778302320223,0.5,TPESampler,COMPLETE
2357,0.8703401340210778,2025-04-24 22:42:20.704421,2025-04-24 22:42:30.710541,0 days 00:00:10.006120,0.005182157624335463,Matern,1580.8894709595916,6.843655880867362e-06,1.5,TPESampler,COMPLETE
2358,0.16334780547718955,2025-04-24 22:42:24.318655,2025-04-24 22:42:30.795940,0 days 00:00:06.477285,46.51845976657612,RBF,1.8219716498170886,0.011710216376381664,0.5,TPESampler,COMPLETE
2359,0.16334779952308082,2025-04-24 22:42:26.608426,2025-04-24 22:42:36.816320,0 days 00:00:10.207894,1.9918265377221713,RBF,7.9517951719606055,0.0038955722232818643,0.5,TPESampler,COMPLETE
2360,0.9015779699011254,2025-04-24 22:42:30.939536,2025-04-24 22:42:34.592872,0 days 00:00:03.653336,28.663199928625264,RBF,0.7326620704234257,6.684779762225087e-10,2.5,TPESampler,COMPLETE
2361,0.16334780899852713,2025-04-24 22:42:31.009256,2025-04-24 22:42:38.195809,0 days 00:00:07.186553,0.0879223524824035,RBF,202.70093669341134,0.721727492044784,0.5,TPESampler,COMPLETE
2362,0.1633477699275541,2025-04-24 22:42:34.894031,2025-04-24 22:42:42.519280,0 days 00:00:07.625249,0.09535670688895513,RBF,0.4518336096620868,0.21919492204646496,0.5,TPESampler,COMPLETE
2363,0.16334778333043842,2025-04-24 22:42:37.118438,2025-04-24 22:42:45.226028,0 days 00:00:08.107590,0.015478452475866203,RBF,5.178178462080338,0.10501113101633526,0.5,TPESampler,COMPLETE
2364,0.8703401340220657,2025-04-24 22:42:38.817456,2025-04-24 22:42:47.279002,0 days 00:00:08.461546,0.12166925641460936,RBF,17.035744817130873,0.015314572318181235,0.5,TPESampler,COMPLETE
2365,0.16334781439952917,2025-04-24 22:42:42.823684,2025-04-24 22:42:50.904996,0 days 00:00:08.081312,0.2911904803855975,RBF,186.06712529897717,0.6456180994475915,0.5,TPESampler,COMPLETE
2366,0.8703401340205117,2025-04-24 22:42:45.527381,2025-04-24 22:42:57.831522,0 days 00:00:12.304141,6.198711116868098e-07,Matern,4466.380173318921,2.023631532643998e-09,0.5,TPESampler,COMPLETE
2367,0.16334781195304984,2025-04-24 22:42:47.629826,2025-04-24 22:42:52.840868,0 days 00:00:05.211042,13.036788853491913,RBF,125.92393864008378,0.9737587137034864,0.5,TPESampler,COMPLETE
2368,0.16334781247924335,2025-04-24 22:42:51.207505,2025-04-24 22:42:56.120899,0 days 00:00:04.913394,9039.31848694778,RBF,7.341665561213384,0.971543486424148,0.5,TPESampler,COMPLETE
2369,0.16334780540131302,2025-04-24 22:42:53.132224,2025-04-24 22:42:58.627917,0 days 00:00:05.495693,42017.58184053681,RBF,494.54575360630054,0.605551021125265,0.5,TPESampler,COMPLETE
2370,0.1633478049887457,2025-04-24 22:42:56.359154,2025-04-24 22:43:01.615607,0 days 00:00:05.256453,13099.75349321864,RBF,61.44401746874331,0.013426290428409203,2.5,TPESampler,COMPLETE
2371,0.16334778581132267,2025-04-24 22:42:58.154698,2025-04-24 22:43:04.795109,0 days 00:00:06.640411,180.32377055897354,RBF,0.4951232052731525,0.000504872985317373,1.5,TPESampler,COMPLETE
2372,0.1633478073794123,2025-04-24 22:42:58.875010,2025-04-24 22:43:04.489697,0 days 00:00:05.614687,0.002225348863812772,RBF,1.8942272924543706,0.903297380723148,0.5,TPESampler,COMPLETE
2373,0.16334781178245342,2025-04-24 22:43:01.908962,2025-04-24 22:43:07.232182,0 days 00:00:05.323220,54759.74375080945,RBF,39.17353454540439,0.993306419845461,0.5,TPESampler,COMPLETE
2374,0.1633478069231477,2025-04-24 22:43:04.757836,2025-04-24 22:43:14.446923,0 days 00:00:09.689087,0.17086576545945825,RBF,323.84680953157937,0.9671254383463475,0.5,TPESampler,COMPLETE
2375,0.1633477963448375,2025-04-24 22:43:05.076300,2025-04-24 22:43:11.231110,0 days 00:00:06.154810,3620.56250574193,RBF,8987.854441509959,0.04282398304311653,0.5,TPESampler,COMPLETE
2376,0.1633478090389049,2025-04-24 22:43:07.528072,2025-04-24 22:43:13.666417,0 days 00:00:06.138345,82984.87303229823,RBF,372.08914630718806,0.933078425002292,0.5,TPESampler,COMPLETE
2377,0.16334780108674526,2025-04-24 22:43:11.534638,2025-04-24 22:43:16.974716,0 days 00:00:05.440078,581.9921734989133,RBF,1.5972669590926605,0.03460581070004172,0.5,TPESampler,COMPLETE
2378,0.1633477631081545,2025-04-24 22:43:13.967117,2025-04-24 22:43:22.334812,0 days 00:00:08.367695,0.0035285779546554356,RBF,64.47487852626823,0.09291992850661,0.5,TPESampler,COMPLETE
2379,0.16334781849589686,2025-04-24 22:43:14.705579,2025-04-24 22:43:19.496889,0 days 00:00:04.791310,74425.64867286962,RBF,0.48851646446914276,0.88467575980853,0.5,TPESampler,COMPLETE
2380,0.16334780521814324,2025-04-24 22:43:17.257219,2025-04-24 22:43:21.737290,0 days 00:00:04.480071,148.8591727586516,RBF,13.786956515730871,0.014444267812966259,0.5,TPESampler,COMPLETE
2381,0.8703401340206107,2025-04-24 22:43:19.786596,2025-04-24 22:43:27.894262,0 days 00:00:08.107666,1.071470837319533,RBF,730.4805943123454,0.05023530014840785,2.5,TPESampler,COMPLETE
2382,0.8703401340206872,2025-04-24 22:43:22.024211,2025-04-24 22:43:30.352449,0 days 00:00:08.328238,1607.9319660648491,RBF,5124.554918718849,0.012281873914565668,0.5,TPESampler,COMPLETE
2383,0.16334780346673536,2025-04-24 22:43:22.598511,2025-04-24 22:43:29.029897,0 days 00:00:06.431386,7936.988478280558,RBF,3826.0722097507646,0.02329748106820859,0.5,TPESampler,COMPLETE
2384,0.16334786388961997,2025-04-24 22:43:28.194212,2025-04-24 22:43:33.295379,0 days 00:00:05.101167,1.9778910364451046,RBF,1.6180288044127866,0.015088777198165624,0.5,TPESampler,COMPLETE
2385,0.9015779739702887,2025-04-24 22:43:29.356651,2025-04-24 22:43:33.081918,0 days 00:00:03.725267,20.649413246731914,RBF,156.89781234527396,0.01921986747641457,2.5,TPESampler,COMPLETE
2386,0.1633478126247203,2025-04-24 22:43:30.647394,2025-04-24 22:43:37.734123,0 days 00:00:07.086729,0.09489108945513511,RBF,134.89887869485926,0.7933533085103255,0.5,TPESampler,COMPLETE
2387,0.8703401340198295,2025-04-24 22:43:33.298742,2025-04-24 22:43:42.795938,0 days 00:00:09.497196,86.65630245956697,RBF,1084.5570956441245,0.00035734896245830886,1.5,TPESampler,COMPLETE
2388,0.16334780837832405,2025-04-24 22:43:33.620794,2025-04-24 22:43:40.671332,0 days 00:00:07.050538,23.214784688107724,RBF,4.485507232807039,0.37573688238333225,0.5,TPESampler,COMPLETE
2389,0.9015771827745962,2025-04-24 22:43:38.039220,2025-04-24 22:43:41.611743,0 days 00:00:03.572523,1.52417899747136e-07,RBF,0.00503193445428123,0.17963650541378015,0.5,TPESampler,COMPLETE
2390,0.1633478359866307,2025-04-24 22:43:40.986110,2025-04-24 22:43:48.917357,0 days 00:00:07.931247,0.2347895766894481,RBF,18.117432839047375,0.5698530288642139,0.5,TPESampler,COMPLETE
2391,0.16334779670109084,2025-04-24 22:43:41.857417,2025-04-24 22:43:48.341221,0 days 00:00:06.483804,1224.9187670146234,RBF,22.143569651229594,0.9649398836412373,0.5,TPESampler,COMPLETE
2392,0.1635585151191742,2025-04-24 22:43:43.042851,2025-04-24 22:43:51.095856,0 days 00:00:08.053005,87.88139400905054,Matern,2.360030027796888,0.00031654721521685473,1.5,TPESampler,COMPLETE
2393,0.16334781321781336,2025-04-24 22:43:48.646022,2025-04-24 22:43:54.021738,0 days 00:00:05.375716,273.7694227298993,RBF,9.932109303905849,0.40757636172908723,0.5,TPESampler,COMPLETE
2394,0.1633477077363448,2025-04-24 22:43:49.148237,2025-04-24 22:43:55.585484,0 days 00:00:06.437247,1.6462713379734455,RBF,24.796118682952567,0.7581882058191243,0.5,TPESampler,COMPLETE
2395,0.16334781280990854,2025-04-24 22:43:51.384350,2025-04-24 22:43:56.976391,0 days 00:00:05.592041,39.12391953190227,RBF,10.690599462320352,0.9031510967318922,0.5,TPESampler,COMPLETE
2396,0.1633478061820639,2025-04-24 22:43:54.313739,2025-04-24 22:44:00.399167,0 days 00:00:06.085428,85390.53059814859,RBF,1677.2216285502554,0.009007307951064835,0.5,TPESampler,COMPLETE
2397,0.16334781868989143,2025-04-24 22:43:55.833230,2025-04-24 22:44:03.134458,0 days 00:00:07.301228,5.1803014403094325,RBF,157.9881816098028,0.7711807946809726,0.5,TPESampler,COMPLETE
2398,0.8703401340044636,2025-04-24 22:43:57.273733,2025-04-24 22:44:04.225971,0 days 00:00:06.952238,1.7981286482093378e-05,RBF,2.4794272365708468e-05,2.7696600165400724e-07,2.5,TPESampler,COMPLETE
2399,0.16334799831842484,2025-04-24 22:44:00.696933,2025-04-24 22:44:08.783520,0 days 00:00:08.086587,0.0018986755693478092,RBF,11.755068044935692,0.2720570968544378,0.5,TPESampler,COMPLETE
2400,0.16334778584412776,2025-04-24 22:44:03.438898,2025-04-24 22:44:13.336806,0 days 00:00:09.897908,0.03993576780036771,RBF,21.430235607039464,0.06140798884202445,0.5,TPESampler,COMPLETE
2401,0.16334783906380893,2025-04-24 22:44:04.491863,2025-04-24 22:44:19.748603,0 days 00:00:15.256740,0.13878896284354791,RBF,46.42092930949099,0.6060990569211684,0.5,TPESampler,COMPLETE
2402,0.16334782380666116,2025-04-24 22:44:09.070280,2025-04-24 22:44:15.937928,0 days 00:00:06.867648,0.11155516017921925,RBF,6.722503002725623,0.27955713279742006,0.5,TPESampler,COMPLETE
2403,0.16334781562619427,2025-04-24 22:44:13.630138,2025-04-24 22:44:22.631559,0 days 00:00:09.001421,9.390498154191388,RBF,8.93260673946209,0.9683482940987829,0.5,TPESampler,COMPLETE
2404,0.1633478787054546,2025-04-24 22:44:16.206099,2025-04-24 22:44:24.473609,0 days 00:00:08.267510,0.27335867913318795,RBF,33.52410842134313,0.556854196890446,0.5,TPESampler,COMPLETE
2405,0.9015771955346864,2025-04-24 22:44:20.048983,2025-04-24 22:44:23.855682,0 days 00:00:03.806699,4.965954127428512,RBF,5.054543215487809e-05,1.2805929840656228e-09,1.5,TPESampler,COMPLETE
2406,0.16334780927487105,2025-04-24 22:44:22.930238,2025-04-24 22:44:29.225663,0 days 00:00:06.295425,463.97724439723027,RBF,1.0495559199526017,0.498474919771369,0.5,TPESampler,COMPLETE
2407,0.16334780417377706,2025-04-24 22:44:24.176774,2025-04-24 22:44:32.684458,0 days 00:00:08.507684,0.011843172245081782,RBF,4.485668592904279,0.647881660618791,0.5,TPESampler,COMPLETE
2408,0.16334787304902085,2025-04-24 22:44:24.786470,2025-04-24 22:44:32.688647,0 days 00:00:07.902177,39.90282812942656,RBF,10.146341873355617,0.9674646877722399,0.5,TPESampler,COMPLETE
2409,0.870340134022103,2025-04-24 22:44:29.511284,2025-04-24 22:44:40.456437,0 days 00:00:10.945153,1.3485232290447826,RBF,21.81744379684005,0.018188423240741828,0.5,TPESampler,COMPLETE
2410,0.8703401340061004,2025-04-24 22:44:33.161692,2025-04-24 22:44:45.117045,0 days 00:00:11.955353,3.8731398786884257,RBF,449.51096763992473,0.003396442591518024,0.5,TPESampler,COMPLETE
2411,0.16334781056892503,2025-04-24 22:44:33.204956,2025-04-24 22:44:42.837736,0 days 00:00:09.632780,2.1363808708109278,RBF,88.57075150913938,0.0325092048042755,0.5,TPESampler,COMPLETE
2412,0.16334781498956177,2025-04-24 22:44:40.979415,2025-04-24 22:44:54.567226,0 days 00:00:13.587811,5.860538611834682,RBF,2.527123016644097,0.08255404768820071,0.5,TPESampler,COMPLETE
2413,0.16334781314185376,2025-04-24 22:44:43.133620,2025-04-24 22:44:52.990311,0 days 00:00:09.856691,0.18872226649720403,RBF,602.8277165466799,0.9099437901009628,0.5,TPESampler,COMPLETE
2414,0.16334776237308424,2025-04-24 22:44:45.386462,2025-04-24 22:44:52.672338,0 days 00:00:07.285876,0.7637825170115755,RBF,1.3095165073987964,0.05506956456959916,0.5,TPESampler,COMPLETE
2415,0.8703401341126324,2025-04-24 22:44:52.941792,2025-04-24 22:45:12.178967,0 days 00:00:19.237175,0.012564880986827192,RBF,2133.5493088429444,0.016371338034117555,1.5,TPESampler,COMPLETE
2416,0.16334781209228408,2025-04-24 22:44:53.313644,2025-04-24 22:44:59.815896,0 days 00:00:06.502252,12.8479138892144,RBF,18.8905043815007,0.6242325544991079,0.5,TPESampler,COMPLETE
2417,0.16334781120332,2025-04-24 22:44:54.877050,2025-04-24 22:45:05.486999,0 days 00:00:10.609949,0.036957328379455735,RBF,5.065403188711082,0.5812355742146905,0.5,TPESampler,COMPLETE
2418,0.8703401338459975,2025-04-24 22:45:00.126857,2025-04-24 22:45:10.568849,0 days 00:00:10.441992,12.123326525967412,RBF,0.1523667196068177,0.05058064247492572,0.5,TPESampler,COMPLETE
2419,0.16334783414719567,2025-04-24 22:45:06.180346,2025-04-24 22:45:16.385847,0 days 00:00:10.205501,55510.506480471784,RBF,60460.79949535769,0.4069142410534225,2.5,TPESampler,COMPLETE
2420,0.870340134018248,2025-04-24 22:45:10.820975,2025-04-24 22:45:21.467559,0 days 00:00:10.646584,0.8097651238193208,RBF,91.699924754667,0.013000875648867273,0.5,TPESampler,COMPLETE
2421,0.16334781255145744,2025-04-24 22:45:12.484206,2025-04-24 22:45:20.051274,0 days 00:00:07.567068,91404.05225275662,RBF,1800.353029568843,0.06757568666239853,0.5,TPESampler,COMPLETE
2422,0.16334781510979593,2025-04-24 22:45:16.634955,2025-04-24 22:45:23.229016,0 days 00:00:06.594061,202.47906648670065,RBF,171.97657325284456,0.8481133455457653,0.5,TPESampler,COMPLETE
2423,0.9015771955328075,2025-04-24 22:45:20.344755,2025-04-24 22:45:24.617238,0 days 00:00:04.272483,5.494352702312962,Matern,0.11277608948949311,1.1889904042446039e-08,2.5,TPESampler,COMPLETE
2424,0.16334780672106486,2025-04-24 22:45:21.785808,2025-04-24 22:45:29.228517,0 days 00:00:07.442709,82.63450496144041,RBF,2.9848032697872138,0.8911953041789729,0.5,TPESampler,COMPLETE
2425,0.21977453526282514,2025-04-24 22:45:23.533811,2025-04-24 22:45:29.460693,0 days 00:00:05.926882,1081.790860770877,Matern,5.7328646218812835,0.8947948056056771,0.5,TPESampler,COMPLETE
2426,0.16334780888491046,2025-04-24 22:45:24.918335,2025-04-24 22:45:31.276546,0 days 00:00:06.358211,2.516918403476939,RBF,97.85880262347509,0.07693029692790895,0.5,TPESampler,COMPLETE
2427,0.16334778858629026,2025-04-24 22:45:29.459271,2025-04-24 22:45:34.581506,0 days 00:00:05.122235,54606.96201933036,RBF,14.370455879039932,0.9057516402167173,2.5,TPESampler,COMPLETE
2428,0.16334780964618095,2025-04-24 22:45:29.761812,2025-04-24 22:45:36.890235,0 days 00:00:07.128423,1.921432924423051,RBF,2.476716340036144,0.4746680605821857,0.5,TPESampler,COMPLETE
2429,0.16334819207125106,2025-04-24 22:45:31.577069,2025-04-24 22:45:37.108893,0 days 00:00:05.531824,4.393185666827258,RBF,0.8344697271315858,0.024754308935426135,0.5,TPESampler,COMPLETE
