number,value,datetime_start,datetime_complete,duration,params_constant_value,params_kernel_type,params_length_scale,params_noise_level,params_nu,system_attrs_auto:sampler,state
812,0.8703401340209477,2025-04-24 21:33:16.848700,2025-04-24 21:33:24.356554,0 days 00:00:07.507854,198.4889880774043,RBF,1797.2979571547542,0.0003287603213397762,0.5,TPESampler,COMPLETE
813,0.8703401340139659,2025-04-24 21:33:23.014134,2025-04-24 21:33:33.253007,0 days 00:00:10.238873,4.928797354744895,RBF,68.74508351983242,0.0070410821263561085,1.5,TPESampler,COMPLETE
814,0.8703401340233008,2025-04-24 21:33:24.554315,2025-04-24 21:33:41.984851,0 days 00:00:17.430536,0.2287003874773745,RBF,0.0939983286554048,2.97701294775355e-06,0.5,TPESampler,COMPLETE
815,0.16334780744798238,2025-04-24 21:33:24.710265,2025-04-24 21:33:34.552805,0 days 00:00:09.842540,40.44638029615872,RBF,4.662679315565084,0.0004283105523420102,1.5,TPESampler,COMPLETE
816,0.8703401340113726,2025-04-24 21:33:33.703813,2025-04-24 21:33:42.910623,0 days 00:00:09.206810,0.13981189353752202,RBF,3.722739210706354,0.0015033446807941216,0.5,TPESampler,COMPLETE
817,0.8703401340402377,2025-04-24 21:33:35.239677,2025-04-24 21:33:42.632149,0 days 00:00:07.392472,5926.962949603691,RBF,8.12902208804859,7.908821265933672e-06,2.5,TPESampler,COMPLETE
818,0.8703401340212265,2025-04-24 21:33:42.233824,2025-04-24 21:33:46.907933,0 days 00:00:04.674109,83566.53479267376,RBF,151.63865865195643,4.382807453255803e-05,0.5,TPESampler,COMPLETE
819,0.8703401340211883,2025-04-24 21:33:42.847931,2025-04-24 21:33:46.883860,0 days 00:00:04.035929,23.95023020619708,RBF,0.00011243030283126148,0.0004853169106759952,2.5,TPESampler,COMPLETE
820,0.9015771955344503,2025-04-24 21:33:43.135949,2025-04-24 21:33:47.053269,0 days 00:00:03.917320,231.30793944394065,RBF,0.030444603167893908,5.0931505676734915e-08,0.5,TPESampler,COMPLETE
821,0.16334783173939404,2025-04-24 21:33:47.018487,2025-04-24 21:33:54.121968,0 days 00:00:07.103481,0.2819998078154262,RBF,4.957469052994326,0.04091047968220827,0.5,TPESampler,COMPLETE
822,0.1633478224818781,2025-04-24 21:33:47.062144,2025-04-24 21:33:53.423274,0 days 00:00:06.361130,0.29257024947820026,RBF,1.4337973526276544,0.0004274482342689238,0.5,TPESampler,COMPLETE
823,0.901577974895129,2025-04-24 21:33:47.217128,2025-04-24 21:33:54.781489,0 days 00:00:07.564361,4.019892894301996e-05,Matern,91706.90585833282,0.04036603151582968,1.5,TPESampler,COMPLETE
824,0.16334782772061168,2025-04-24 21:33:53.710110,2025-04-24 21:34:02.117855,0 days 00:00:08.407745,3.6259573638877787,RBF,0.5273259222742666,0.0015181672339382943,0.5,TPESampler,COMPLETE
825,0.8703401340401486,2025-04-24 21:33:54.335331,2025-04-24 21:34:03.574725,0 days 00:00:09.239394,8.177612612765079e-07,RBF,26.199346754146077,5.988232469226442e-09,0.5,TPESampler,COMPLETE
826,0.16334780791274872,2025-04-24 21:33:55.043038,2025-04-24 21:34:01.465591,0 days 00:00:06.422553,852.9262699041797,RBF,1509.646953926644,0.9915679000786768,2.5,TPESampler,COMPLETE
827,0.9015779748915469,2025-04-24 21:34:01.707678,2025-04-24 21:34:11.070356,0 days 00:00:09.362678,25.19225719793809,RBF,75139.7889330819,0.6535134718171556,0.5,TPESampler,COMPLETE
828,0.8703401340212163,2025-04-24 21:34:02.314650,2025-04-24 21:34:07.332163,0 days 00:00:05.017513,2.4591281333941715,RBF,0.013455220702756534,0.012568693998459477,1.5,TPESampler,COMPLETE
829,0.8703401340213178,2025-04-24 21:34:03.821939,2025-04-24 21:34:28.947413,0 days 00:00:25.125474,1.5148341491962942e-06,Matern,0.01657721524350925,3.013937631236609e-05,0.5,TPESampler,COMPLETE
830,0.21977494718523038,2025-04-24 21:34:07.817041,2025-04-24 21:34:23.893252,0 days 00:00:16.076211,9.947500004122118,Matern,77362.35061073543,0.10249521701975121,0.5,TPESampler,COMPLETE
831,0.1633478097659008,2025-04-24 21:34:11.534309,2025-04-24 21:34:25.330515,0 days 00:00:13.796206,1867.586344043258,RBF,27.068854294824884,0.0016200701554198442,2.5,TPESampler,COMPLETE
832,0.8703401340235201,2025-04-24 21:34:24.395218,2025-04-24 21:34:34.511659,0 days 00:00:10.116441,7.669167813678989,RBF,35.44441699748064,0.0025280373383682517,2.5,TPESampler,COMPLETE
833,0.21977494665341732,2025-04-24 21:34:25.804287,2025-04-24 21:34:40.184171,0 days 00:00:14.379884,15178.715912736108,Matern,599.3649558355862,0.12274518996958073,0.5,TPESampler,COMPLETE
834,0.8703401340196638,2025-04-24 21:34:29.203024,2025-04-24 21:34:38.929075,0 days 00:00:09.726051,178.0575027358757,RBF,0.13824666966380272,0.00017873019551482532,2.5,TPESampler,COMPLETE
835,0.8703401340229718,2025-04-24 21:34:35.546934,2025-04-24 21:34:41.531508,0 days 00:00:05.984574,0.0271063963942408,RBF,0.0012215893576166998,0.001090236247978889,0.5,TPESampler,COMPLETE
836,0.1633478088078064,2025-04-24 21:34:39.174463,2025-04-24 21:34:45.484890,0 days 00:00:06.310427,717.0698772365329,RBF,0.5836202654795037,0.0001851075340516392,1.5,TPESampler,COMPLETE
837,0.8703401340232618,2025-04-24 21:34:40.424501,2025-04-24 21:34:46.058703,0 days 00:00:05.634202,0.0008671479333874454,Matern,0.00018928356320302753,0.00027615071197783906,0.5,TPESampler,COMPLETE
838,0.16334781889637184,2025-04-24 21:34:41.779996,2025-04-24 21:34:48.708695,0 days 00:00:06.928699,0.13468729550015018,RBF,0.7936814013694996,0.04308817245285264,1.5,TPESampler,COMPLETE
839,0.8703401340196892,2025-04-24 21:34:45.765800,2025-04-24 21:34:50.277842,0 days 00:00:04.512042,0.00540902901991165,RBF,0.03138618330320204,0.0004527853218168516,0.5,TPESampler,COMPLETE
840,0.8703401339738885,2025-04-24 21:34:46.291323,2025-04-24 21:34:52.425443,0 days 00:00:06.134120,0.03740455433467994,RBF,10.741003877024546,3.500298579752695e-05,0.5,TPESampler,COMPLETE
841,0.8703401340206182,2025-04-24 21:34:48.955536,2025-04-24 21:34:55.051248,0 days 00:00:06.095712,0.059234825008555834,Matern,7.141069962107159e-05,4.3122261862781104e-10,0.5,TPESampler,COMPLETE
842,0.870340134020113,2025-04-24 21:34:50.553975,2025-04-24 21:34:57.266072,0 days 00:00:06.712097,412.69826382237983,RBF,3384.9255625253595,2.444902644714606e-06,2.5,TPESampler,COMPLETE
843,0.16334781169197887,2025-04-24 21:34:52.712197,2025-04-24 21:34:59.263859,0 days 00:00:06.551662,53954.91759985521,RBF,634.8091410148073,0.9082957802254269,0.5,TPESampler,COMPLETE
844,0.8703401340090018,2025-04-24 21:34:55.307840,2025-04-24 21:35:01.266771,0 days 00:00:05.958931,0.0650802240842468,RBF,2.0590235929060867,2.863632409905329e-05,2.5,TPESampler,COMPLETE
845,0.16334783177160603,2025-04-24 21:34:57.515875,2025-04-24 21:35:02.871863,0 days 00:00:05.355988,1.6820670837572884,RBF,2.3120712837842072,0.02350097774387225,1.5,TPESampler,COMPLETE
846,0.8703401340212015,2025-04-24 21:34:59.543031,2025-04-24 21:35:08.336706,0 days 00:00:08.793675,6.505594613564378e-06,Matern,0.05527744661040893,1.0065182303651433e-10,1.5,TPESampler,COMPLETE
847,0.16334780098325288,2025-04-24 21:35:01.628217,2025-04-24 21:35:08.484806,0 days 00:00:06.856589,35376.02116353121,RBF,112.31798967663673,0.0077804891013964865,1.5,TPESampler,COMPLETE
848,0.8703401340212958,2025-04-24 21:35:03.264392,2025-04-24 21:35:10.565132,0 days 00:00:07.300740,74245.65255527796,RBF,4363.221093216002,0.0030562867406936354,0.5,TPESampler,COMPLETE
849,0.16334779470091132,2025-04-24 21:35:08.550756,2025-04-24 21:35:14.005790,0 days 00:00:05.455034,720.7476886421143,RBF,58.340135394648286,0.0019248954588989978,1.5,TPESampler,COMPLETE
850,0.901577195533214,2025-04-24 21:35:08.710159,2025-04-24 21:35:12.789812,0 days 00:00:04.079653,82751.02837553974,RBF,0.014379073367355137,7.006034896303957e-06,2.5,TPESampler,COMPLETE
851,0.16334780667124738,2025-04-24 21:35:10.823783,2025-04-24 21:35:16.008146,0 days 00:00:05.184363,2560.534244468004,RBF,0.6553964373457012,0.1691789079615992,2.5,TPESampler,COMPLETE
852,0.16334781245039925,2025-04-24 21:35:13.075174,2025-04-24 21:35:19.462443,0 days 00:00:06.387269,4456.1738752420815,RBF,2.864895614738536,0.0036495376737577063,1.5,TPESampler,COMPLETE
853,0.8703401340220381,2025-04-24 21:35:14.324995,2025-04-24 21:35:24.114878,0 days 00:00:09.789883,24830.68711182829,RBF,27623.427155455167,0.006408054087994285,0.5,TPESampler,COMPLETE
854,0.8703401340265567,2025-04-24 21:35:16.273256,2025-04-24 21:35:25.853021,0 days 00:00:09.579765,2054.709737312356,RBF,3239.604016569514,0.01580948213660732,0.5,TPESampler,COMPLETE
855,0.16334781219608352,2025-04-24 21:35:19.768299,2025-04-24 21:35:26.427818,0 days 00:00:06.659519,505.42798195817875,RBF,13.290201769233454,0.000149774302436658,2.5,TPESampler,COMPLETE
856,0.16334780500061447,2025-04-24 21:35:24.395730,2025-04-24 21:35:31.434971,0 days 00:00:07.039241,13.676915452421916,RBF,3.2448366477769564,0.13211105388648928,1.5,TPESampler,COMPLETE
857,0.8923921484058993,2025-04-24 21:35:26.100555,2025-04-24 21:35:41.039255,0 days 00:00:14.938700,0.00393555079251253,Matern,0.009149920553569873,0.030941247756144537,1.5,TPESampler,COMPLETE
858,0.16334781424864217,2025-04-24 21:35:26.691420,2025-04-24 21:35:35.637399,0 days 00:00:08.945979,494.50194228678754,RBF,0.406316735579113,0.013958845066496613,1.5,TPESampler,COMPLETE
859,0.8703401340377386,2025-04-24 21:35:31.982775,2025-04-24 21:35:41.093936,0 days 00:00:09.111161,0.3549978530452177,RBF,47.254242662539575,4.6444999146832907e-10,1.5,TPESampler,COMPLETE
860,0.1633478072954738,2025-04-24 21:35:36.039901,2025-04-24 21:35:42.104221,0 days 00:00:06.064320,417.9078384857839,RBF,17.81696169086944,0.02139614421256751,1.5,TPESampler,COMPLETE
861,0.16334781112512295,2025-04-24 21:35:41.224026,2025-04-24 21:35:48.647389,0 days 00:00:07.423363,72.53800486534618,RBF,9858.096557747533,0.9012629776676694,0.5,TPESampler,COMPLETE
862,0.16334785671513022,2025-04-24 21:35:41.288319,2025-04-24 21:35:48.961792,0 days 00:00:07.673473,66219.66787325435,RBF,5085.246634227425,0.025471411788824644,0.5,TPESampler,COMPLETE
863,0.16334781500980916,2025-04-24 21:35:42.381547,2025-04-24 21:35:49.585883,0 days 00:00:07.204336,85894.07360651082,RBF,552.5688181147743,0.04796869658965603,0.5,TPESampler,COMPLETE
864,0.8703401339803055,2025-04-24 21:35:48.907408,2025-04-24 21:35:55.476591,0 days 00:00:06.569183,3150.059975270279,RBF,17.523021958141477,6.807375933728552e-08,1.5,TPESampler,COMPLETE
865,0.16334775138642557,2025-04-24 21:35:49.189252,2025-04-24 21:35:55.173478,0 days 00:00:05.984226,164.58778107686823,RBF,4.676474078008026,0.00502046821918907,1.5,TPESampler,COMPLETE
866,0.16334782743989232,2025-04-24 21:35:49.812381,2025-04-24 21:35:56.840550,0 days 00:00:07.028169,106.46825555072422,RBF,1.1779925870327912,0.7357674883891302,1.5,TPESampler,COMPLETE
867,0.8703401340212045,2025-04-24 21:35:55.438215,2025-04-24 21:36:00.806327,0 days 00:00:05.368112,28.466772962378535,RBF,41.393756062018305,0.00030602739709271977,1.5,TPESampler,COMPLETE
868,0.16334780101128765,2025-04-24 21:35:55.970915,2025-04-24 21:36:07.286943,0 days 00:00:11.316028,94101.48855404808,RBF,2434.5960380839338,0.633955888781757,1.5,TPESampler,COMPLETE
869,0.16334782856667457,2025-04-24 21:35:57.115429,2025-04-24 21:36:02.215885,0 days 00:00:05.100456,727.3421024908943,RBF,79.03684808774126,0.03195359062738521,1.5,TPESampler,COMPLETE
870,0.1635585104178646,2025-04-24 21:36:01.064055,2025-04-24 21:36:06.984600,0 days 00:00:05.920545,2975.8037900139375,Matern,48.3400014738975,0.7545992579906177,1.5,TPESampler,COMPLETE
871,0.8703401340285711,2025-04-24 21:36:02.474919,2025-04-24 21:36:07.575980,0 days 00:00:05.101061,102.58452914308985,Matern,80.08921250748487,9.281771880906529e-08,1.5,TPESampler,COMPLETE
872,0.16334786766594409,2025-04-24 21:36:07.202653,2025-04-24 21:36:13.896610,0 days 00:00:06.693957,4171.76129272283,RBF,3.5202532661794,0.0021084125777018174,1.5,TPESampler,COMPLETE
873,0.16334780856447417,2025-04-24 21:36:07.516510,2025-04-24 21:36:14.818451,0 days 00:00:07.301941,67079.26246663618,RBF,1566.8116130483327,0.5052422692869013,0.5,TPESampler,COMPLETE
874,0.16334781800024192,2025-04-24 21:36:07.849146,2025-04-24 21:36:17.371168,0 days 00:00:09.522022,110.06081213686265,RBF,0.4733696869083542,0.00014048868290655645,1.5,TPESampler,COMPLETE
875,0.1633477868308252,2025-04-24 21:36:14.188710,2025-04-24 21:36:19.698378,0 days 00:00:05.509668,2913.567961597755,RBF,17.62836981488682,0.001775873780643609,1.5,TPESampler,COMPLETE
876,0.1633478065151277,2025-04-24 21:36:15.085014,2025-04-24 21:36:19.872937,0 days 00:00:04.787923,22210.18627552156,RBF,11.480605603835363,0.0017842685719931025,2.5,TPESampler,COMPLETE
877,0.8703401340167123,2025-04-24 21:36:17.661476,2025-04-24 21:36:26.774705,0 days 00:00:09.113229,1.7779838352846253e-07,Matern,0.004505084873781844,1.5955143970317664e-05,1.5,TPESampler,COMPLETE
878,0.16334783507504155,2025-04-24 21:36:19.925334,2025-04-24 21:36:25.278884,0 days 00:00:05.353550,1758.790172935206,RBF,14.993531046165534,0.0005572194746528692,0.5,TPESampler,COMPLETE
879,0.8703401340221683,2025-04-24 21:36:20.131788,2025-04-24 21:36:30.388387,0 days 00:00:10.256599,208.88768007154414,RBF,1287.9033396438688,0.006551751457572388,2.5,TPESampler,COMPLETE
880,0.16334788133533407,2025-04-24 21:36:25.525897,2025-04-24 21:36:31.172644,0 days 00:00:05.646747,57960.16635153699,RBF,17.964231792016065,6.679621593927956e-05,1.5,TPESampler,COMPLETE
881,0.8703401340329157,2025-04-24 21:36:27.026253,2025-04-24 21:36:35.785762,0 days 00:00:08.759509,0.595980258110446,Matern,112.62685169575664,0.005855484671876743,1.5,TPESampler,COMPLETE
882,0.16334780401275198,2025-04-24 21:36:30.683652,2025-04-24 21:36:36.190510,0 days 00:00:05.506858,1195.2575282636367,RBF,662.1626998895543,0.024009730682014997,0.5,TPESampler,COMPLETE
883,0.16334781489453962,2025-04-24 21:36:31.405279,2025-04-24 21:36:37.293275,0 days 00:00:05.887996,4423.599821414403,RBF,8.603485571783434,0.017323916699780575,1.5,TPESampler,COMPLETE
884,0.8703401339973139,2025-04-24 21:36:36.072291,2025-04-24 21:36:44.400191,0 days 00:00:08.327900,9.372519590515564,RBF,1633.7936176724788,0.0001198422041845432,1.5,TPESampler,COMPLETE
885,0.16334781005012391,2025-04-24 21:36:36.401090,2025-04-24 21:36:43.955354,0 days 00:00:07.554264,1563.108734101221,RBF,0.43692445185044054,0.018865097981713187,1.5,TPESampler,COMPLETE
886,0.8703401340325313,2025-04-24 21:36:37.624800,2025-04-24 21:36:41.753552,0 days 00:00:04.128752,142.8368945150073,RBF,0.005388674775868972,0.00019835534682679539,0.5,TPESampler,COMPLETE
887,0.8703401340188721,2025-04-24 21:36:42.053151,2025-04-24 21:36:48.477177,0 days 00:00:06.424026,74.1424522903525,RBF,12.147978830600191,2.5688134750467426e-05,1.5,TPESampler,COMPLETE
888,0.16334781102781146,2025-04-24 21:36:44.276930,2025-04-24 21:36:52.043996,0 days 00:00:07.767066,142.03611949785346,RBF,1.552450054196513,0.00023039360833892645,2.5,TPESampler,COMPLETE
889,0.1633477996999399,2025-04-24 21:36:44.624537,2025-04-24 21:36:52.607621,0 days 00:00:07.983084,78930.43075809974,RBF,1720.0968087954168,0.0034095498893545666,1.5,TPESampler,COMPLETE
890,0.163347805985454,2025-04-24 21:36:48.729081,2025-04-24 21:36:55.946823,0 days 00:00:07.217742,48.451167136652224,RBF,2119.0192744928527,0.6954589209289219,0.5,TPESampler,COMPLETE
891,0.870340134020665,2025-04-24 21:36:52.341064,2025-04-24 21:36:56.741266,0 days 00:00:04.400202,39705.9085066255,Matern,9.385517525055101e-05,0.005459780620449405,2.5,TPESampler,COMPLETE
892,0.16334780848137181,2025-04-24 21:36:52.861840,2025-04-24 21:36:59.656462,0 days 00:00:06.794622,39.78309809573798,RBF,0.5010768627614366,0.0018357358351942649,1.5,TPESampler,COMPLETE
893,0.8703401340135841,2025-04-24 21:36:56.189201,2025-04-24 21:37:05.468591,0 days 00:00:09.279390,0.004764571257916982,RBF,2539.1300138597903,1.597823321531662e-07,0.5,TPESampler,COMPLETE
894,0.9015779746830822,2025-04-24 21:36:56.919126,2025-04-24 21:37:00.738606,0 days 00:00:03.819480,16113.588426183584,RBF,3.1172725600959246,1.598455219646034e-06,2.5,TPESampler,COMPLETE
895,0.8703401340203687,2025-04-24 21:36:59.942036,2025-04-24 21:37:05.390012,0 days 00:00:05.447976,199.81132609836018,RBF,275.86443822096754,0.0007080480642587008,0.5,TPESampler,COMPLETE
896,0.16334781573268944,2025-04-24 21:37:01.027537,2025-04-24 21:37:06.314411,0 days 00:00:05.286874,1271.456115357352,RBF,5.81279213565969,0.013031766469113524,1.5,TPESampler,COMPLETE
897,0.8703401339991556,2025-04-24 21:37:05.598170,2025-04-24 21:37:10.435928,0 days 00:00:04.837758,1716.1445634781987,RBF,0.08061276385726172,0.0003375334438619688,2.5,TPESampler,COMPLETE
898,0.16334780993535408,2025-04-24 21:37:05.649516,2025-04-24 21:37:12.972306,0 days 00:00:07.322790,61932.588954637045,RBF,54.401774833547385,0.035856444013346964,0.5,TPESampler,COMPLETE
899,0.1633478119111896,2025-04-24 21:37:06.636402,2025-04-24 21:37:13.743370,0 days 00:00:07.106968,42009.71657381963,RBF,491.42940520820486,0.9140124025331747,0.5,TPESampler,COMPLETE
900,0.16334779900079044,2025-04-24 21:37:11.054593,2025-04-24 21:37:22.038654,0 days 00:00:10.984061,0.003355946179061022,RBF,1.193452197951257,0.006656765145049628,0.5,TPESampler,COMPLETE
901,0.16334784605283523,2025-04-24 21:37:13.292514,2025-04-24 21:37:19.846823,0 days 00:00:06.554309,283.3331335055289,RBF,11338.435018609913,0.08085599797187024,0.5,TPESampler,COMPLETE
902,0.16334781187238342,2025-04-24 21:37:13.989054,2025-04-24 21:37:21.056797,0 days 00:00:07.067743,48679.36842508238,RBF,8306.107875761474,0.7744861783345132,0.5,TPESampler,COMPLETE
903,0.1633477931908376,2025-04-24 21:37:20.137339,2025-04-24 21:37:26.551659,0 days 00:00:06.414320,1.3332239535004733,RBF,1.1889107584900716,3.403598452107617e-05,0.5,TPESampler,COMPLETE
904,0.16334780931465076,2025-04-24 21:37:21.300914,2025-04-24 21:37:27.654086,0 days 00:00:06.353172,2506.2811867300425,RBF,272.0567712118341,0.025919537320710874,1.5,TPESampler,COMPLETE
905,0.8703401340203336,2025-04-24 21:37:22.327919,2025-04-24 21:37:29.515513,0 days 00:00:07.187594,1426.121438470548,RBF,2733.6485906733283,0.00011619534816238395,1.5,TPESampler,COMPLETE
906,0.1633478056873665,2025-04-24 21:37:26.829351,2025-04-24 21:37:42.295976,0 days 00:00:15.466625,23381.387470966256,RBF,0.22863548977226958,0.0007462397309861754,1.5,TPESampler,COMPLETE
907,0.8703401340205797,2025-04-24 21:37:27.978650,2025-04-24 21:37:37.639294,0 days 00:00:09.660644,1061.6649623448393,RBF,24097.594770215903,0.05058445465014513,0.5,TPESampler,COMPLETE
908,0.16334780991701983,2025-04-24 21:37:29.836465,2025-04-24 21:37:36.012674,0 days 00:00:06.176209,1894.4551041016537,RBF,951.3928724850733,0.0382160551890514,0.5,TPESampler,COMPLETE
909,0.8703401336923217,2025-04-24 21:37:36.299107,2025-04-24 21:37:40.702683,0 days 00:00:04.403576,0.045595874971871196,Matern,0.0014609069670066237,2.8460334509925014e-10,1.5,TPESampler,COMPLETE
910,0.8703401340220299,2025-04-24 21:37:37.900836,2025-04-24 21:37:45.704603,0 days 00:00:07.803767,23.972390861094727,RBF,279.7521497213831,0.0063662067001901,2.5,TPESampler,COMPLETE
911,0.1633478072107544,2025-04-24 21:37:41.004290,2025-04-24 21:37:45.849913,0 days 00:00:04.845623,101.05168469912839,RBF,4.5455951760211715,0.010667320336613023,1.5,TPESampler,COMPLETE
912,0.16334781502619225,2025-04-24 21:37:42.583502,2025-04-24 21:37:54.984047,0 days 00:00:12.400545,0.007691931451324111,RBF,0.3234929776129186,0.00011695102240783313,0.5,TPESampler,COMPLETE
913,0.16334781371237983,2025-04-24 21:37:45.928768,2025-04-24 21:37:51.085795,0 days 00:00:05.157027,5310.566571464532,RBF,1530.8565605266795,0.0349772423819927,2.5,TPESampler,COMPLETE
914,0.16334780987506414,2025-04-24 21:37:46.082914,2025-04-24 21:37:52.244528,0 days 00:00:06.161614,465.42931581379634,RBF,40.7771668868131,0.016810301844267364,0.5,TPESampler,COMPLETE
915,0.1633478743173394,2025-04-24 21:37:51.387806,2025-04-24 21:37:58.323858,0 days 00:00:06.936052,29.57994782090651,RBF,48.05948607933172,0.4907577313539293,1.5,TPESampler,COMPLETE
916,0.16344312365307212,2025-04-24 21:37:52.505155,2025-04-24 21:38:01.660302,0 days 00:00:09.155147,0.00029312636491106095,Matern,8.60398274661746,0.42433278354883286,2.5,TPESampler,COMPLETE
917,0.16334780081136363,2025-04-24 21:37:55.222313,2025-04-24 21:37:59.933936,0 days 00:00:04.711623,1137.0880139472977,RBF,10.999753457846765,0.8620582944847883,1.5,TPESampler,COMPLETE
918,0.9015779625959981,2025-04-24 21:37:58.623732,2025-04-24 21:38:08.011541,0 days 00:00:09.387809,7.5346095844402274e-06,Matern,3.7510099345174077,0.0038639178279508603,1.5,TPESampler,COMPLETE
919,0.16334780586199335,2025-04-24 21:38:00.186722,2025-04-24 21:38:09.708665,0 days 00:00:09.521943,0.14218911012968907,RBF,335.8066784955885,0.7604019516727075,1.5,TPESampler,COMPLETE
920,0.16334713406305676,2025-04-24 21:38:01.965453,2025-04-24 21:38:09.794941,0 days 00:00:07.829488,50.247272953428144,RBF,16.76507738315468,0.000997358765973144,1.5,TPESampler,COMPLETE
921,0.1633478131881915,2025-04-24 21:38:08.317768,2025-04-24 21:38:13.899904,0 days 00:00:05.582136,6174.767377468322,RBF,111.4398433379908,0.9996887085996805,0.5,TPESampler,COMPLETE
922,0.1634431431095077,2025-04-24 21:38:09.933823,2025-04-24 21:38:15.016019,0 days 00:00:05.082196,12.021894680479743,Matern,206.2484693203781,0.05094317033861886,2.5,TPESampler,COMPLETE
923,0.8703401340214356,2025-04-24 21:38:10.003526,2025-04-24 21:38:15.677082,0 days 00:00:05.673556,17.307462473801145,RBF,7.462507318786974,2.4607755738139373e-05,1.5,TPESampler,COMPLETE
924,0.8703401340187396,2025-04-24 21:38:14.199463,2025-04-24 21:38:20.450387,0 days 00:00:06.250924,91747.74822528276,RBF,106.83509687261427,3.1563052503601756e-05,2.5,TPESampler,COMPLETE
925,0.16334781131011197,2025-04-24 21:38:15.239001,2025-04-24 21:38:20.973416,0 days 00:00:05.734415,65342.99767238019,RBF,1.554097810176199,7.119630083295122e-05,2.5,TPESampler,COMPLETE
926,0.16334775974258,2025-04-24 21:38:15.914336,2025-04-24 21:38:23.548721,0 days 00:00:07.634385,38.34249177205913,RBF,0.4334702044425811,0.00011467261996552072,1.5,TPESampler,COMPLETE
927,0.901577974701729,2025-04-24 21:38:20.735686,2025-04-24 21:38:24.812847,0 days 00:00:04.077161,4393.331958804068,Matern,1.2728477323893752,1.52357672549197e-05,2.5,TPESampler,COMPLETE
