number,value,datetime_start,datetime_complete,duration,params_constant_value,params_kernel_type,params_length_scale,params_noise_level,params_nu,system_attrs_auto:sampler,state
347,0.1633478090390178,2025-04-24 21:14:16.744353,2025-04-24 21:14:23.216060,0 days 00:00:06.471707,409.26376388732314,RBF,36.7898713181559,0.013425129761405726,1.5,TPESampler,COMPLETE
348,0.16334780966067083,2025-04-24 21:14:17.419014,2025-04-24 21:14:23.510235,0 days 00:00:06.091221,81035.53344438184,RBF,73.4875927726022,0.20073493818880483,0.5,TPESampler,COMPLETE
349,0.16334780799984686,2025-04-24 21:14:23.467449,2025-04-24 21:14:30.782714,0 days 00:00:07.315265,52.46754821847401,RBF,1.9103468071968868,0.6730726102609333,0.5,TPESampler,COMPLETE
350,0.16334781265374074,2025-04-24 21:14:23.788805,2025-04-24 21:14:28.872856,0 days 00:00:05.084051,20968.55245544131,RBF,7.391583003649373,0.8904021570755192,0.5,TPESampler,COMPLETE
351,0.16334780504566904,2025-04-24 21:14:25.325301,2025-04-24 21:14:30.826971,0 days 00:00:05.501670,68036.91166918777,RBF,0.7794774337791999,0.0280087761358118,1.5,TPESampler,COMPLETE
352,0.8703401340212495,2025-04-24 21:14:29.161555,2025-04-24 21:14:38.641345,0 days 00:00:09.479790,139.46154513597233,RBF,4852.440195611835,0.006028963578881386,0.5,TPESampler,COMPLETE
353,0.21977494713617546,2025-04-24 21:14:30.938128,2025-04-24 21:14:38.548525,0 days 00:00:07.610397,0.00035017487072306177,Matern,2.49513189280101,0.37699136556866897,0.5,TPESampler,COMPLETE
354,0.8703401340212465,2025-04-24 21:14:31.000201,2025-04-24 21:14:38.952759,0 days 00:00:07.952558,1.625241139418555e-05,Matern,0.00018901624999933687,1.083399044473908e-06,1.5,TPESampler,COMPLETE
355,0.1633478084810532,2025-04-24 21:14:38.738875,2025-04-24 21:14:46.903466,0 days 00:00:08.164591,1.5939360524198043,RBF,3.05874512023489,0.9085741438519022,1.5,TPESampler,COMPLETE
356,0.9015771121085003,2025-04-24 21:14:38.787680,2025-04-24 21:14:42.656355,0 days 00:00:03.868675,6615.109764617543,Matern,0.25165416686871994,2.026547590356409e-08,1.5,TPESampler,COMPLETE
357,0.1633478118190188,2025-04-24 21:14:39.166008,2025-04-24 21:14:45.322386,0 days 00:00:06.156378,69745.56225937317,RBF,3.3211073785043106,0.006802430698693248,1.5,TPESampler,COMPLETE
358,0.16334780390074896,2025-04-24 21:14:42.944181,2025-04-24 21:14:50.132731,0 days 00:00:07.188550,127.05007513419928,RBF,2278.8106291197405,0.2949145901248474,2.5,TPESampler,COMPLETE
359,0.16334782002193998,2025-04-24 21:14:45.601487,2025-04-24 21:14:55.621796,0 days 00:00:10.020309,2621.864846041243,RBF,26.84566366369318,0.00018578362882462862,1.5,TPESampler,COMPLETE
360,0.8703401340236102,2025-04-24 21:14:47.151069,2025-04-24 21:14:54.815304,0 days 00:00:07.664235,491.8220657829786,RBF,0.12254259142276601,0.6791711014304641,0.5,TPESampler,COMPLETE
361,0.1633477860830683,2025-04-24 21:14:50.580007,2025-04-24 21:15:01.440951,0 days 00:00:10.860944,72806.67073638762,RBF,1136.0261831151686,0.007630046289070647,1.5,TPESampler,COMPLETE
362,0.8703401269367621,2025-04-24 21:14:55.066929,2025-04-24 21:15:04.570231,0 days 00:00:09.503302,2160.353128259395,RBF,0.1673846933608701,0.33424682604636397,1.5,TPESampler,COMPLETE
363,0.16334780290572662,2025-04-24 21:14:55.903291,2025-04-24 21:15:08.441739,0 days 00:00:12.538448,92.42695686501533,RBF,0.664541630339786,0.4176222938963925,2.5,TPESampler,COMPLETE
364,0.16355848717480856,2025-04-24 21:15:02.041040,2025-04-24 21:15:13.529467,0 days 00:00:11.488427,78111.67229165981,Matern,0.12525792803393543,0.009601891088753162,1.5,TPESampler,COMPLETE
365,0.8703401340213458,2025-04-24 21:15:04.865454,2025-04-24 21:15:11.787193,0 days 00:00:06.921739,6458.652252070133,RBF,1553.0497551850049,0.0036061001521347116,1.5,TPESampler,COMPLETE
366,0.8703401340212314,2025-04-24 21:15:08.741207,2025-04-24 21:15:18.209089,0 days 00:00:09.467882,2138.1387962979734,RBF,4217.668751907549,0.02461456887818257,1.5,TPESampler,COMPLETE
367,0.16334775668678142,2025-04-24 21:15:12.077665,2025-04-24 21:15:21.411295,0 days 00:00:09.333630,123.94740102232653,RBF,7956.836391593117,0.8639623196923489,0.5,TPESampler,COMPLETE
368,0.16334781188128372,2025-04-24 21:15:13.815288,2025-04-24 21:15:19.156482,0 days 00:00:05.341194,56792.72507930553,RBF,23.569966216851743,0.6505249457239137,1.5,TPESampler,COMPLETE
369,0.16334770986325475,2025-04-24 21:15:18.483929,2025-04-24 21:15:24.175914,0 days 00:00:05.691985,51958.487180269745,RBF,813.7602479282225,0.915148282938331,0.5,TPESampler,COMPLETE
370,0.901577967412867,2025-04-24 21:15:19.420446,2025-04-24 21:15:25.984699,0 days 00:00:06.564253,0.009491152685820015,RBF,2152.359692501811,0.27205541951017426,0.5,TPESampler,COMPLETE
371,0.16334780500537602,2025-04-24 21:15:21.699963,2025-04-24 21:15:28.586199,0 days 00:00:06.886236,129.1384687278298,RBF,2958.2365545911607,0.05229491380034735,0.5,TPESampler,COMPLETE
372,0.16344312919707188,2025-04-24 21:15:24.423916,2025-04-24 21:15:33.669512,0 days 00:00:09.245596,0.006618565160610234,Matern,0.5640196134722332,0.0021781121142672006,2.5,TPESampler,COMPLETE
373,0.397110575276495,2025-04-24 21:15:26.284762,2025-04-24 21:15:39.643732,0 days 00:00:13.358970,2.5724752499968795,RBF,7952.467513042435,0.9626884247735464,0.5,TPESampler,COMPLETE
374,0.16334779123325718,2025-04-24 21:15:28.843984,2025-04-24 21:15:36.032594,0 days 00:00:07.188610,1285.718512482417,RBF,5338.751498949858,0.11228958810722635,0.5,TPESampler,COMPLETE
375,0.16334780858606698,2025-04-24 21:15:33.974307,2025-04-24 21:15:40.698453,0 days 00:00:06.724146,63569.213885244506,RBF,5428.48087456726,0.5708307323502287,0.5,TPESampler,COMPLETE
376,0.87034013402175,2025-04-24 21:15:36.297115,2025-04-24 21:15:40.814261,0 days 00:00:04.517146,0.17217776705003565,Matern,218.1529594008273,1.7874429835764616e-08,0.5,TPESampler,COMPLETE
377,0.16334780911533234,2025-04-24 21:15:39.949355,2025-04-24 21:15:45.246624,0 days 00:00:05.297269,84967.33330834137,RBF,79.46989051572663,0.5363444837593595,0.5,TPESampler,COMPLETE
378,0.16334780202705362,2025-04-24 21:15:40.891708,2025-04-24 21:15:47.276576,0 days 00:00:06.384868,4805.524184756499,RBF,461.07480437699695,0.7014179544033233,0.5,TPESampler,COMPLETE
379,0.8703401340659505,2025-04-24 21:15:40.999771,2025-04-24 21:15:46.796859,0 days 00:00:05.797088,6.190575018582128e-05,RBF,2.581636038874109e-05,8.570070908871729e-08,0.5,TPESampler,COMPLETE
380,0.1633477487701333,2025-04-24 21:15:45.545030,2025-04-24 21:15:51.423857,0 days 00:00:05.878827,892.6744465265833,RBF,416.4318987747967,0.010192579469454559,0.5,TPESampler,COMPLETE
381,0.16334780670677598,2025-04-24 21:15:47.051968,2025-04-24 21:15:53.187468,0 days 00:00:06.135500,402.80024458448725,RBF,3362.6541108280276,0.33595061995293335,0.5,TPESampler,COMPLETE
382,0.1633476832947412,2025-04-24 21:15:47.486413,2025-04-24 21:15:53.932874,0 days 00:00:06.446461,11171.57175481412,RBF,2859.6434517016082,0.9267555476960269,0.5,TPESampler,COMPLETE
383,0.8703401340194695,2025-04-24 21:15:51.715426,2025-04-24 21:15:57.489773,0 days 00:00:05.774347,0.0005396491365296529,RBF,1.5817335483352812,1.9582338015196093e-07,2.5,TPESampler,COMPLETE
384,0.16334780910406102,2025-04-24 21:15:53.467124,2025-04-24 21:15:59.716769,0 days 00:00:06.249645,35048.33712262332,RBF,701.0378476539933,0.057967179086103875,0.5,TPESampler,COMPLETE
385,0.16334782138179102,2025-04-24 21:15:54.182149,2025-04-24 21:16:00.443725,0 days 00:00:06.261576,8881.611769330591,RBF,1916.9632112447446,0.2761745594529887,0.5,TPESampler,COMPLETE
386,0.8703401340203861,2025-04-24 21:15:57.779549,2025-04-24 21:16:05.754793,0 days 00:00:07.975244,5185.011360601384,RBF,443.58374151787814,0.0011947024555504894,0.5,TPESampler,COMPLETE
387,0.8703401340218782,2025-04-24 21:15:59.972644,2025-04-24 21:16:05.096626,0 days 00:00:05.123982,440.2409695101574,RBF,343.4177361707124,0.0006670081343934432,0.5,TPESampler,COMPLETE
388,0.9015760147036369,2025-04-24 21:16:00.689256,2025-04-24 21:16:04.111295,0 days 00:00:03.422039,2.4293605618266046e-05,Matern,7.780381796111124e-05,0.17141066967071894,0.5,TPESampler,COMPLETE
389,0.16334780946278357,2025-04-24 21:16:04.407103,2025-04-24 21:16:10.048849,0 days 00:00:05.641746,296.3678178620789,RBF,979.5193569451294,0.8331189189437004,0.5,TPESampler,COMPLETE
390,0.16334780905646298,2025-04-24 21:16:05.345826,2025-04-24 21:16:11.831309,0 days 00:00:06.485483,56353.90776865485,RBF,1654.217336236,0.008655443848111824,1.5,TPESampler,COMPLETE
391,0.21977494779924925,2025-04-24 21:16:05.964781,2025-04-24 21:16:14.201935,0 days 00:00:08.237154,98623.95023027914,Matern,1722.0144715084175,0.024215093523347997,0.5,TPESampler,COMPLETE
392,0.8703401339127285,2025-04-24 21:16:10.310574,2025-04-24 21:16:16.547805,0 days 00:00:06.237231,55713.263806142335,RBF,40.74284696830535,2.356254457076395e-05,2.5,TPESampler,COMPLETE
393,0.16334778673332379,2025-04-24 21:16:12.089388,2025-04-24 21:16:20.387994,0 days 00:00:08.298606,57277.86959080773,RBF,1133.8162731889174,0.4850007919478184,0.5,TPESampler,COMPLETE
394,0.16334780615454436,2025-04-24 21:16:14.525467,2025-04-24 21:16:20.325453,0 days 00:00:05.799986,430.77219677702936,RBF,11.969400041453225,0.004062837895271565,0.5,TPESampler,COMPLETE
395,0.16334782573328172,2025-04-24 21:16:16.818737,2025-04-24 21:16:22.194625,0 days 00:00:05.375888,96274.91527263695,RBF,8.788401740808759,0.42764994645979276,0.5,TPESampler,COMPLETE
396,0.1633477929517413,2025-04-24 21:16:20.507819,2025-04-24 21:16:29.267691,0 days 00:00:08.759872,63777.90233832242,RBF,1592.071098252265,0.5789892176988933,0.5,TPESampler,COMPLETE
397,0.16334780745188301,2025-04-24 21:16:20.560804,2025-04-24 21:16:28.397834,0 days 00:00:07.837030,8730.157950844898,RBF,161.6007033855019,0.805416044674246,0.5,TPESampler,COMPLETE
398,0.16334781880403274,2025-04-24 21:16:22.481436,2025-04-24 21:16:29.617917,0 days 00:00:07.136481,70750.77544804823,RBF,3641.1761387724796,0.26998602422872126,2.5,TPESampler,COMPLETE
399,0.16334777885270876,2025-04-24 21:16:28.655418,2025-04-24 21:16:36.171452,0 days 00:00:07.516034,99831.91481075042,RBF,3407.319399943543,0.006654933507649105,0.5,TPESampler,COMPLETE
400,0.16334780976516558,2025-04-24 21:16:29.505410,2025-04-24 21:16:35.057038,0 days 00:00:05.551628,96125.87181534,RBF,33.932418406054474,0.8210804016299781,0.5,TPESampler,COMPLETE
401,0.16334779574137914,2025-04-24 21:16:29.872072,2025-04-24 21:16:37.748804,0 days 00:00:07.876732,53126.48490256617,RBF,2119.830450448981,0.021300757378023442,0.5,TPESampler,COMPLETE
402,0.16334781226468392,2025-04-24 21:16:35.310636,2025-04-24 21:16:41.900834,0 days 00:00:06.590198,1303.9954640544797,RBF,408.01215257092997,0.00566877779014766,0.5,TPESampler,COMPLETE
403,0.16334780991186798,2025-04-24 21:16:36.428033,2025-04-24 21:16:42.295642,0 days 00:00:05.867609,694.1665368505093,RBF,296.25065128284564,0.11354875178791751,0.5,TPESampler,COMPLETE
404,0.1633478171600408,2025-04-24 21:16:38.026893,2025-04-24 21:16:44.326958,0 days 00:00:06.300065,41227.26949437157,RBF,253.20731615547828,0.004538352056761213,0.5,TPESampler,COMPLETE
405,0.8703401340197802,2025-04-24 21:16:42.160986,2025-04-24 21:16:56.032727,0 days 00:00:13.871741,4.636656867255669e-06,Matern,414.275903668722,1.1082083277450708e-10,1.5,TPESampler,COMPLETE
406,0.16334782772600911,2025-04-24 21:16:42.518202,2025-04-24 21:16:48.945167,0 days 00:00:06.426965,37077.20029431986,RBF,1299.1400260744254,0.9368701034233037,0.5,TPESampler,COMPLETE
407,0.8703401340209154,2025-04-24 21:16:44.568987,2025-04-24 21:16:52.303609,0 days 00:00:07.734622,7709.924901071243,RBF,5716.982185539944,0.000570830497692778,0.5,TPESampler,COMPLETE
408,0.16334780436762256,2025-04-24 21:16:49.192493,2025-04-24 21:16:55.944447,0 days 00:00:06.751954,53246.34803995351,RBF,47.75994255955772,0.0012628340604346827,0.5,TPESampler,COMPLETE
409,0.1633477751763858,2025-04-24 21:16:52.602742,2025-04-24 21:16:58.574231,0 days 00:00:05.971489,70380.02124845778,RBF,205.82708459396034,0.03503609571769033,0.5,TPESampler,COMPLETE
410,0.1635585155539746,2025-04-24 21:16:56.096827,2025-04-24 21:17:01.838161,0 days 00:00:05.741334,607.4108516547185,Matern,3266.5667535421194,0.5649230448351581,1.5,TPESampler,COMPLETE
411,0.16334780725301354,2025-04-24 21:16:56.221555,2025-04-24 21:17:03.459084,0 days 00:00:07.237529,41250.443768004894,RBF,3051.531796544449,0.5704224748784797,1.5,TPESampler,COMPLETE
412,0.16334775020760353,2025-04-24 21:16:58.825482,2025-04-24 21:17:04.773106,0 days 00:00:05.947624,60894.31104005281,RBF,1058.9339235762322,0.0053435961980877475,0.5,TPESampler,COMPLETE
413,0.16334780779972888,2025-04-24 21:17:02.144969,2025-04-24 21:17:09.535502,0 days 00:00:07.390533,24092.532255768678,RBF,3287.209988219762,0.285209382527871,0.5,TPESampler,COMPLETE
414,0.16334781652438327,2025-04-24 21:17:03.747030,2025-04-24 21:17:11.107151,0 days 00:00:07.360121,13866.93220030249,RBF,2511.5037567899817,0.2596390589719419,0.5,TPESampler,COMPLETE
415,0.163347805004096,2025-04-24 21:17:05.070701,2025-04-24 21:17:12.067123,0 days 00:00:06.996422,8795.842026724937,RBF,913.1763159897804,0.014885805748832836,0.5,TPESampler,COMPLETE
416,0.9015779700358741,2025-04-24 21:17:09.833005,2025-04-24 21:17:17.730600,0 days 00:00:07.897595,3.3794611466561265e-05,RBF,53104.58814408391,7.933748605745122e-05,1.5,TPESampler,COMPLETE
417,0.8703401340290836,2025-04-24 21:17:11.368995,2025-04-24 21:17:19.677012,0 days 00:00:08.308017,1.3322869231972645,RBF,2.854740736550452,4.059088908363372e-06,0.5,TPESampler,COMPLETE
418,0.16334777481250848,2025-04-24 21:17:12.343192,2025-04-24 21:17:18.327844,0 days 00:00:05.984652,22613.8613194567,RBF,1578.6827603647096,0.011578208481789505,0.5,TPESampler,COMPLETE
419,0.8703401340974223,2025-04-24 21:17:18.037217,2025-04-24 21:17:26.055899,0 days 00:00:08.018682,0.9576508791027478,RBF,343.261446436467,0.00439769484252775,0.5,TPESampler,COMPLETE
420,0.8703401340215507,2025-04-24 21:17:18.604407,2025-04-24 21:17:25.076691,0 days 00:00:06.472284,21514.9954966101,RBF,21586.82261065954,5.6821150663265755e-05,0.5,TPESampler,COMPLETE
421,0.8703401340210775,2025-04-24 21:17:19.922519,2025-04-24 21:17:30.802845,0 days 00:00:10.880326,11165.885824698156,RBF,699.6737989130396,0.00012248083525189104,0.5,TPESampler,COMPLETE
422,0.2197748389013774,2025-04-24 21:17:25.353698,2025-04-24 21:17:31.223625,0 days 00:00:05.869927,37.74566567524256,Matern,85.71885145192294,0.0031551898207959022,0.5,TPESampler,COMPLETE
423,0.870340134023407,2025-04-24 21:17:26.309140,2025-04-24 21:17:33.857458,0 days 00:00:07.548318,54341.726271069434,RBF,5265.793779501626,0.002409645645885929,0.5,TPESampler,COMPLETE
424,0.8703401340210095,2025-04-24 21:17:31.052716,2025-04-24 21:17:38.910166,0 days 00:00:07.857450,1501.3664898681009,RBF,1438.1041100698806,0.003555425072712454,0.5,TPESampler,COMPLETE
425,0.901577931481088,2025-04-24 21:17:31.385207,2025-04-24 21:17:35.677911,0 days 00:00:04.292704,3.7764832132039217e-06,Matern,84624.01025652094,0.05106109301022527,0.5,TPESampler,COMPLETE
426,0.8703401340196055,2025-04-24 21:17:34.104078,2025-04-24 21:17:40.699813,0 days 00:00:06.595735,8031.26893582578,RBF,1956.9347173019096,0.0008797049848382987,0.5,TPESampler,COMPLETE
427,0.8703401340212689,2025-04-24 21:17:35.957447,2025-04-24 21:17:47.757139,0 days 00:00:11.799692,196.25868437825034,RBF,8420.707227560064,0.0010588416544353722,2.5,TPESampler,COMPLETE
428,0.16334782588304356,2025-04-24 21:17:39.150295,2025-04-24 21:17:45.757300,0 days 00:00:06.607005,92593.87238857754,RBF,682.5276047797973,0.045271374130386385,0.5,TPESampler,COMPLETE
429,0.8703401340209503,2025-04-24 21:17:40.938826,2025-04-24 21:17:47.854912,0 days 00:00:06.916086,90059.16169328609,RBF,10492.282053398421,0.0008504457676723068,0.5,TPESampler,COMPLETE
430,0.16334780955658396,2025-04-24 21:17:46.011784,2025-04-24 21:17:57.174839,0 days 00:00:11.163055,42361.11422080149,RBF,64.36901485719308,0.004718820187367824,0.5,TPESampler,COMPLETE
431,0.16334780881986838,2025-04-24 21:17:47.943950,2025-04-24 21:17:55.893826,0 days 00:00:07.949876,92916.0445174065,RBF,2873.39393267779,0.013477534937897296,0.5,TPESampler,COMPLETE
432,0.16334782055035893,2025-04-24 21:17:47.987277,2025-04-24 21:17:54.975221,0 days 00:00:06.987944,1861.7893159401276,RBF,43.56656692545393,0.006291769155558715,0.5,TPESampler,COMPLETE
433,0.8703401340210692,2025-04-24 21:17:55.254072,2025-04-24 21:18:02.527872,0 days 00:00:07.273800,33.1817779357991,RBF,244.77734529355334,0.0054219616116473746,0.5,TPESampler,COMPLETE
434,0.8703401340204138,2025-04-24 21:17:56.149049,2025-04-24 21:18:07.450221,0 days 00:00:11.301172,71265.2609933869,RBF,57998.22828757397,0.004623044946103554,1.5,TPESampler,COMPLETE
435,0.16334780872467997,2025-04-24 21:17:57.457667,2025-04-24 21:18:03.043792,0 days 00:00:05.586125,1472.2792558525932,RBF,175.71265604207653,0.02398501869844838,0.5,TPESampler,COMPLETE
436,0.1633477955261702,2025-04-24 21:18:02.842326,2025-04-24 21:18:09.118908,0 days 00:00:06.276582,54073.90532055316,RBF,68.35674441545883,0.0037101984870531565,0.5,TPESampler,COMPLETE
437,0.16334780885146405,2025-04-24 21:18:03.280650,2025-04-24 21:18:09.203281,0 days 00:00:05.922631,455.71854086204775,RBF,2919.543924317315,0.7389822413247313,0.5,TPESampler,COMPLETE
438,0.1633478085077949,2025-04-24 21:18:07.774902,2025-04-24 21:18:14.627515,0 days 00:00:06.852613,94251.9633746242,RBF,39.180606669157726,0.0022331972604973313,0.5,TPESampler,COMPLETE
439,0.8703401340227226,2025-04-24 21:18:09.266779,2025-04-24 21:18:17.315479,0 days 00:00:08.048700,138.13555115032656,RBF,4366.725921723443,4.8066066719950674e-05,1.5,TPESampler,COMPLETE
440,0.8703401340232884,2025-04-24 21:18:09.378532,2025-04-24 21:18:13.990869,0 days 00:00:04.612337,97110.16933639716,RBF,0.050547522033564767,0.6443412658615114,1.5,TPESampler,COMPLETE
441,0.870340134020048,2025-04-24 21:18:14.280167,2025-04-24 21:18:21.350962,0 days 00:00:07.070795,46289.724903357994,RBF,3402.9265283728423,0.005794657696787228,0.5,TPESampler,COMPLETE
442,0.1633478094121396,2025-04-24 21:18:14.875847,2025-04-24 21:18:20.582709,0 days 00:00:05.706862,133.1867468487829,RBF,104.46779773898591,0.5868870935667128,0.5,TPESampler,COMPLETE
443,0.8703401339426888,2025-04-24 21:18:17.563790,2025-04-24 21:18:26.941248,0 days 00:00:09.377458,40.80921792532243,RBF,1547.7881751414616,0.007968628923834193,0.5,TPESampler,COMPLETE
444,0.1633478093695922,2025-04-24 21:18:20.836394,2025-04-24 21:18:26.722006,0 days 00:00:05.885612,53438.105139678206,RBF,1793.7337852321136,0.9864816467885501,0.5,TPESampler,COMPLETE
445,0.16334781585615374,2025-04-24 21:18:21.620926,2025-04-24 21:18:29.138409,0 days 00:00:07.517483,85846.77281288529,RBF,691.8894334411497,0.007072609850161935,0.5,TPESampler,COMPLETE
446,0.9015779097111928,2025-04-24 21:18:26.953946,2025-04-24 21:18:30.908554,0 days 00:00:03.954608,58785.08077920159,Matern,529.298071599662,5.618584307267943e-07,0.5,TPESampler,COMPLETE
447,0.16334780848102937,2025-04-24 21:18:27.168959,2025-04-24 21:18:37.694265,0 days 00:00:10.525306,68.3870607297016,RBF,0.27791733842132516,0.6687332656913507,1.5,TPESampler,COMPLETE
448,0.16334775391252576,2025-04-24 21:18:29.419650,2025-04-24 21:18:35.063038,0 days 00:00:05.643388,86971.88524722043,RBF,235.8169411147135,0.3982850528406253,1.5,TPESampler,COMPLETE
449,0.16334781796008993,2025-04-24 21:18:31.184841,2025-04-24 21:18:37.787385,0 days 00:00:06.602544,26163.672235832102,RBF,103.8387489379039,0.02656219734887412,2.5,TPESampler,COMPLETE
450,0.1633478009127631,2025-04-24 21:18:35.292704,2025-04-24 21:18:40.215205,0 days 00:00:04.922501,39670.439082722994,RBF,11.727940465472347,0.09064120524951513,1.5,TPESampler,COMPLETE
451,0.16334783519887403,2025-04-24 21:18:37.854453,2025-04-24 21:18:42.916984,0 days 00:00:05.062531,31250.371838842057,RBF,36.7250673607516,0.2161533093100882,1.5,TPESampler,COMPLETE
452,0.16334781248166266,2025-04-24 21:18:37.955009,2025-04-24 21:18:44.701893,0 days 00:00:06.746884,11333.12902096872,RBF,3056.9893561334925,0.7712582534244377,1.5,TPESampler,COMPLETE
453,0.16334780935354404,2025-04-24 21:18:40.445148,2025-04-24 21:18:47.088523,0 days 00:00:06.643375,107.26237803312166,RBF,4635.310240957525,0.6579603430316961,0.5,TPESampler,COMPLETE
454,0.9015779626147595,2025-04-24 21:18:43.158073,2025-04-24 21:18:47.148826,0 days 00:00:03.990753,1.3541590624082892e-06,RBF,1746.2599123643208,0.004813915013872879,0.5,TPESampler,COMPLETE
455,0.1633478163245502,2025-04-24 21:18:44.946553,2025-04-24 21:18:51.237421,0 days 00:00:06.290868,69453.70751398675,RBF,265.8600365779813,0.894095428512435,0.5,TPESampler,COMPLETE
456,0.9015771955338322,2025-04-24 21:18:47.287239,2025-04-24 21:18:51.329984,0 days 00:00:04.042745,25156.165720348337,Matern,3.3618980545674125e-05,8.319076499357355e-06,1.5,TPESampler,COMPLETE
457,0.16334780926236828,2025-04-24 21:18:47.339736,2025-04-24 21:18:52.479526,0 days 00:00:05.139790,41376.24222009493,RBF,119.58186388744733,0.40358600536746103,1.5,TPESampler,COMPLETE
458,0.8703401340174532,2025-04-24 21:18:51.426199,2025-04-24 21:19:03.297595,0 days 00:00:11.871396,90605.98649829777,RBF,55495.15044654914,0.0076587387604859,0.5,TPESampler,COMPLETE
459,0.8703401340233591,2025-04-24 21:18:51.515735,2025-04-24 21:19:01.587861,0 days 00:00:10.072126,14645.729681095348,RBF,4925.214563933223,3.302953340981105e-10,0.5,TPESampler,COMPLETE
460,0.1633478102157142,2025-04-24 21:18:52.724812,2025-04-24 21:18:59.403089,0 days 00:00:06.678277,681.7050814969317,RBF,3882.4728119664196,0.7228338418018102,0.5,TPESampler,COMPLETE
461,0.16334780923864628,2025-04-24 21:18:59.653367,2025-04-24 21:19:05.102335,0 days 00:00:05.448968,2546.9253962368275,RBF,107.59140403802125,0.019734930197155266,0.5,TPESampler,COMPLETE
462,0.1633478061305012,2025-04-24 21:19:01.827209,2025-04-24 21:19:07.355321,0 days 00:00:05.528112,1276.964729102311,RBF,92.78204745668076,0.11717523494422025,0.5,TPESampler,COMPLETE
463,0.16334780788681968,2025-04-24 21:19:03.576480,2025-04-24 21:19:08.691341,0 days 00:00:05.114861,3772.371204524064,RBF,0.7751241208269378,0.8506014735486778,1.5,TPESampler,COMPLETE
