number,value,datetime_start,datetime_complete,duration,params_constant_value,params_kernel_type,params_length_scale,params_noise_level,params_nu,system_attrs_auto:sampler,state
2430,0.1633478089905523,2025-04-24 22:45:34.893986,2025-04-24 22:45:39.616508,0 days 00:00:04.722522,23.52397223346488,RBF,32.7309766314341,0.008488575424551103,0.5,TPESampler,COMPLETE
2431,0.16334779071437025,2025-04-24 22:45:37.107251,2025-04-24 22:45:41.819875,0 days 00:00:04.712624,14.353737579884811,RBF,62.9767838693893,0.06308028200723263,0.5,TPESampler,COMPLETE
2432,0.16334784501707522,2025-04-24 22:45:37.398026,2025-04-24 22:45:42.235210,0 days 00:00:04.837184,6.255356229248854,RBF,44.46601178612833,0.06228375231269838,2.5,TPESampler,COMPLETE
2433,0.8703401340207636,2025-04-24 22:45:39.892550,2025-04-24 22:45:52.392750,0 days 00:00:12.500200,0.010340827152990352,RBF,63.1291461388633,0.024974157594753514,0.5,TPESampler,COMPLETE
2434,0.16334782693207273,2025-04-24 22:45:42.096977,2025-04-24 22:45:48.005272,0 days 00:00:05.908295,5.407904495473783,RBF,586.5368272634803,0.5212888198525444,1.5,TPESampler,COMPLETE
2435,0.1633478090963009,2025-04-24 22:45:42.495792,2025-04-24 22:45:48.032833,0 days 00:00:05.537041,910.7572554249259,RBF,117.63536963750775,0.9593784094600165,0.5,TPESampler,COMPLETE
2436,0.8703401340190106,2025-04-24 22:45:48.209532,2025-04-24 22:45:59.120536,0 days 00:00:10.911004,0.011815806691482387,RBF,597.0434278609088,0.010780385900454657,0.5,TPESampler,COMPLETE
2437,0.16334775983462996,2025-04-24 22:45:48.252749,2025-04-24 22:45:55.223037,0 days 00:00:06.970288,1.7299059015855305,RBF,24.129193176031862,0.42477969265466875,0.5,TPESampler,COMPLETE
2438,0.1633478043835022,2025-04-24 22:45:52.650647,2025-04-24 22:45:58.179956,0 days 00:00:05.529309,110.84677443968225,RBF,3.813098088273851,0.6787094679567951,2.5,TPESampler,COMPLETE
2439,0.8703401340178607,2025-04-24 22:45:55.535914,2025-04-24 22:46:00.538843,0 days 00:00:05.002929,54.785348677875355,RBF,0.0006815754711067372,2.048839091083554e-05,1.5,TPESampler,COMPLETE
2440,0.8703401340210287,2025-04-24 22:45:58.437123,2025-04-24 22:46:02.791641,0 days 00:00:04.354518,10886.818527293834,RBF,0.015429378030521693,0.7919385136366284,0.5,TPESampler,COMPLETE
2441,0.16334780875127516,2025-04-24 22:45:59.374703,2025-04-24 22:46:06.182600,0 days 00:00:06.807897,0.7009833253741035,RBF,33.49509354465072,0.8146398340461791,0.5,TPESampler,COMPLETE
2442,0.1633478103673442,2025-04-24 22:46:00.921534,2025-04-24 22:46:10.090446,0 days 00:00:09.168912,9.148809094364472,RBF,0.4223373847687444,2.3263486629512223e-05,1.5,TPESampler,COMPLETE
2443,0.16334780956954112,2025-04-24 22:46:03.114099,2025-04-24 22:46:10.669918,0 days 00:00:07.555819,83510.93348198262,RBF,6019.931616860702,0.5968268783632967,0.5,TPESampler,COMPLETE
2444,0.16334780729298984,2025-04-24 22:46:06.497123,2025-04-24 22:46:13.552757,0 days 00:00:07.055634,0.061069986618117286,RBF,114.62832128909076,0.7610658746132322,0.5,TPESampler,COMPLETE
2445,0.21977491752191874,2025-04-24 22:46:10.406511,2025-04-24 22:46:17.145424,0 days 00:00:06.738913,3.9834249283333114,Matern,5.067214674861252,0.014939307066227012,0.5,TPESampler,COMPLETE
2446,0.8703401340208735,2025-04-24 22:46:10.975252,2025-04-24 22:46:26.171722,0 days 00:00:15.196470,1.8727451182509882e-06,RBF,45866.70590458631,1.3943825934196863e-09,2.5,TPESampler,COMPLETE
2447,0.16334780343593716,2025-04-24 22:46:13.862406,2025-04-24 22:46:18.996097,0 days 00:00:05.133691,7.533291710747668,RBF,135.8694081794836,0.6581680820621982,0.5,TPESampler,COMPLETE
2448,0.16334780739326382,2025-04-24 22:46:17.441789,2025-04-24 22:46:22.499903,0 days 00:00:05.058114,516.2516725994757,RBF,196.79006167221942,0.027385233114653774,0.5,TPESampler,COMPLETE
2449,0.16334781003547585,2025-04-24 22:46:19.314522,2025-04-24 22:46:25.749265,0 days 00:00:06.434743,6.959257317865674,RBF,8.408825057487068,0.04621477719147644,0.5,TPESampler,COMPLETE
2450,0.8703401340213088,2025-04-24 22:46:22.789249,2025-04-24 22:46:28.728208,0 days 00:00:05.938959,264.07967581857537,RBF,0.11977671266311345,0.022106224333517017,0.5,TPESampler,COMPLETE
2451,0.9015779748760389,2025-04-24 22:46:26.202335,2025-04-24 22:46:31.624793,0 days 00:00:05.422458,4219.599190032213,Matern,12.049256461236782,2.796491891847756e-10,1.5,TPESampler,COMPLETE
2452,0.870340134015285,2025-04-24 22:46:26.572893,2025-04-24 22:46:39.279929,0 days 00:00:12.707036,0.00013238315633324333,RBF,16.755741194400912,1.75994253963559e-05,1.5,TPESampler,COMPLETE
2453,0.16334781436559012,2025-04-24 22:46:28.961820,2025-04-24 22:46:43.034869,0 days 00:00:14.073049,0.27051334639073626,RBF,0.21328424985384856,0.8165600570161092,0.5,TPESampler,COMPLETE
2454,0.8703401339924801,2025-04-24 22:46:32.135406,2025-04-24 22:46:44.872528,0 days 00:00:12.737122,5.158339721843045e-07,Matern,794.9984192943524,0.001025694834693817,2.5,TPESampler,COMPLETE
2455,0.163347805917781,2025-04-24 22:46:39.546916,2025-04-24 22:46:46.934926,0 days 00:00:07.388010,95354.55636901938,RBF,789.268219367948,0.23215428361035165,0.5,TPESampler,COMPLETE
2456,0.16334777268890854,2025-04-24 22:46:43.340230,2025-04-24 22:46:49.150286,0 days 00:00:05.810056,83934.63863467763,RBF,31.477884558349846,0.8446389737192573,0.5,TPESampler,COMPLETE
2457,0.1633478479020449,2025-04-24 22:46:45.177015,2025-04-24 22:46:51.009382,0 days 00:00:05.832367,26.49572689961266,RBF,87.4891058360355,0.7710921459635928,2.5,TPESampler,COMPLETE
2458,0.16334780685481745,2025-04-24 22:46:47.224788,2025-04-24 22:46:53.685118,0 days 00:00:06.460330,1547.8973530962335,RBF,383.03925158580745,0.7152846032697493,0.5,TPESampler,COMPLETE
2459,0.21549256607116857,2025-04-24 22:46:49.443939,2025-04-24 22:46:57.966974,0 days 00:00:08.523035,4.4057845808839446e-05,RBF,5.46817216924339,0.9931709791291524,2.5,TPESampler,COMPLETE
2460,0.1633478077017891,2025-04-24 22:46:51.299395,2025-04-24 22:47:00.288088,0 days 00:00:08.988693,7383.943911203479,RBF,70588.92556598962,0.9358302475129434,0.5,TPESampler,COMPLETE
2461,0.1633478152915969,2025-04-24 22:46:53.994463,2025-04-24 22:46:59.348824,0 days 00:00:05.354361,96343.05679606447,RBF,31.43481062044872,0.01463469265826628,0.5,TPESampler,COMPLETE
2462,0.8703401339901753,2025-04-24 22:46:58.278125,2025-04-24 22:47:06.709111,0 days 00:00:08.430986,259.7503823590387,RBF,32518.79755556759,0.013778829607822408,0.5,TPESampler,COMPLETE
2463,0.16334784304277458,2025-04-24 22:46:59.651441,2025-04-24 22:47:06.940247,0 days 00:00:07.288806,20.373005337999697,RBF,1.3031010637184115,0.00028615752473993417,1.5,TPESampler,COMPLETE
2464,0.16334782227457317,2025-04-24 22:47:00.592979,2025-04-24 22:47:06.088108,0 days 00:00:05.495129,432.0227934302226,RBF,1.1960360158824397,0.8434645291092084,0.5,TPESampler,COMPLETE
2465,0.8703401340082855,2025-04-24 22:47:06.431014,2025-04-24 22:47:10.240902,0 days 00:00:03.809888,286.3912152003879,RBF,0.06147376508934912,0.8881803501472437,0.5,TPESampler,COMPLETE
2466,0.1633478057508246,2025-04-24 22:47:06.964776,2025-04-24 22:47:13.267024,0 days 00:00:06.302248,2685.260186497269,RBF,138.04377111102292,0.02245592239121142,0.5,TPESampler,COMPLETE
2467,0.16334779226611243,2025-04-24 22:47:07.226106,2025-04-24 22:47:15.598228,0 days 00:00:08.372122,0.03957472385527846,RBF,263.4040107855589,0.10213017294256517,2.5,TPESampler,COMPLETE
2468,0.1633478165349912,2025-04-24 22:47:10.537969,2025-04-24 22:47:16.854919,0 days 00:00:06.316950,0.8384892900250717,RBF,3.191824079319232,0.00032291179844989143,1.5,TPESampler,COMPLETE
2469,0.8703401340198536,2025-04-24 22:47:13.573444,2025-04-24 22:47:23.781449,0 days 00:00:10.208005,0.006365388898153655,RBF,0.0027269922826779393,0.38737301917236705,2.5,TPESampler,COMPLETE
2470,0.1633478118091418,2025-04-24 22:47:15.915853,2025-04-24 22:47:22.964372,0 days 00:00:07.048519,0.4378843780774769,RBF,22.064084011828136,0.950146669102783,0.5,TPESampler,COMPLETE
2471,0.8716955940272741,2025-04-24 22:47:17.131545,2025-04-24 22:47:26.424029,0 days 00:00:09.292484,0.1128555795027418,RBF,11.54841393893728,0.009263312496897816,0.5,TPESampler,COMPLETE
2472,0.21977492885435174,2025-04-24 22:47:23.266560,2025-04-24 22:47:29.407294,0 days 00:00:06.140734,6.371131875279831,Matern,14657.035196150247,0.8343517402703738,0.5,TPESampler,COMPLETE
2473,0.16334780800009477,2025-04-24 22:47:24.072524,2025-04-24 22:47:30.061579,0 days 00:00:05.989055,4770.502495392723,RBF,1110.694029923017,0.023345421027945238,0.5,TPESampler,COMPLETE
2474,0.16334780415895567,2025-04-24 22:47:26.724391,2025-04-24 22:47:34.585698,0 days 00:00:07.861307,4908.000307430611,RBF,0.398678538818727,0.0001545913528886116,1.5,TPESampler,COMPLETE
2475,0.901577194104309,2025-04-24 22:47:29.763543,2025-04-24 22:47:32.382626,0 days 00:00:02.619083,1.421477552936734e-06,RBF,0.025966855485740317,0.34179113439948966,2.5,TPESampler,COMPLETE
2476,0.1633478055024911,2025-04-24 22:47:30.324814,2025-04-24 22:47:38.354312,0 days 00:00:08.029498,9.849218809137248,RBF,3.3916652095860935,0.8474305590221096,0.5,TPESampler,COMPLETE
2477,0.16334781025078593,2025-04-24 22:47:32.670635,2025-04-24 22:47:37.756377,0 days 00:00:05.085742,8495.904224456754,RBF,16.764882218378364,0.9432641604334595,0.5,TPESampler,COMPLETE
2478,0.8703401340201282,2025-04-24 22:47:34.909162,2025-04-24 22:47:42.794509,0 days 00:00:07.885347,0.3209762339333737,RBF,646.0789853829331,0.00931326064617805,0.5,TPESampler,COMPLETE
2479,0.16334780859683815,2025-04-24 22:47:38.002437,2025-04-24 22:47:46.041590,0 days 00:00:08.039153,1.443052858962999,RBF,1.4629723304262268,0.7207629990788172,0.5,TPESampler,COMPLETE
2480,0.8703401338992516,2025-04-24 22:47:38.953086,2025-04-24 22:47:46.589527,0 days 00:00:07.636441,49.891045061531806,Matern,1571.561978257795,8.077488719018339e-07,1.5,TPESampler,COMPLETE
2481,0.8703401340129826,2025-04-24 22:47:43.108511,2025-04-24 22:47:49.719085,0 days 00:00:06.610574,658.1448025055246,RBF,91.03860482347,3.2408227505481545e-06,1.5,TPESampler,COMPLETE
2482,0.8703401340197212,2025-04-24 22:47:46.305671,2025-04-24 22:47:55.603945,0 days 00:00:09.298274,2.2058145587421487,RBF,55.38575693341396,0.007712751431035512,2.5,TPESampler,COMPLETE
2483,0.16334780954854644,2025-04-24 22:47:46.937948,2025-04-24 22:47:55.152080,0 days 00:00:08.214132,0.705815217463125,RBF,90.04271833464928,0.9779691140218169,2.5,TPESampler,COMPLETE
2484,0.8703401339991641,2025-04-24 22:47:50.054959,2025-04-24 22:47:57.616643,0 days 00:00:07.561684,26593.168524474087,RBF,56359.6828781965,0.028134329489285285,0.5,TPESampler,COMPLETE
2485,0.8703401340202064,2025-04-24 22:47:55.434757,2025-04-24 22:48:05.638188,0 days 00:00:10.203431,6.684968479093124,RBF,63812.520517502555,2.3861013969064264e-06,2.5,TPESampler,COMPLETE
2486,0.16334780699696522,2025-04-24 22:47:55.889860,2025-04-24 22:48:01.606550,0 days 00:00:05.716690,93.51071734656189,RBF,374.83685458105805,0.0239095880323959,2.5,TPESampler,COMPLETE
2487,0.1633477982723071,2025-04-24 22:47:57.919443,2025-04-24 22:48:02.212006,0 days 00:00:04.292563,1599.2380140149126,RBF,4.132616390253158,0.03778779021489424,0.5,TPESampler,COMPLETE
2488,0.1633478153095379,2025-04-24 22:48:01.896426,2025-04-24 22:48:08.044340,0 days 00:00:06.147914,971.337065523061,RBF,2.0992517602180474,0.018707695419336114,0.5,TPESampler,COMPLETE
2489,0.16334780779624164,2025-04-24 22:48:02.499773,2025-04-24 22:48:08.220372,0 days 00:00:05.720599,1961.7069348727769,RBF,254.63697459461827,0.03497704110794183,0.5,TPESampler,COMPLETE
2490,0.16334780945123978,2025-04-24 22:48:05.936453,2025-04-24 22:48:12.318664,0 days 00:00:06.382211,1704.4707617969098,RBF,150.47969413291148,0.6527034794110188,0.5,TPESampler,COMPLETE
2491,0.1633477820038686,2025-04-24 22:48:08.300641,2025-04-24 22:48:15.805499,0 days 00:00:07.504858,10.2702401261157,RBF,6.953051293203082,0.9112692169797616,0.5,TPESampler,COMPLETE
2492,0.16334780900737492,2025-04-24 22:48:08.535026,2025-04-24 22:48:14.794807,0 days 00:00:06.259781,1772.9111182467007,RBF,1998.3133083821824,0.8769592865069793,0.5,TPESampler,COMPLETE
2493,0.1633478151252785,2025-04-24 22:48:12.642880,2025-04-24 22:48:18.997415,0 days 00:00:06.354535,1848.8449328769202,RBF,4812.236011437072,0.7866224502116149,0.5,TPESampler,COMPLETE
2494,0.16334781182461205,2025-04-24 22:48:15.063845,2025-04-24 22:48:33.626224,0 days 00:00:18.562379,0.015217857470311779,RBF,428.6903117388413,0.7605380226065591,0.5,TPESampler,COMPLETE
2495,0.16334781070747945,2025-04-24 22:48:16.061750,2025-04-24 22:48:21.918114,0 days 00:00:05.856364,1304.785250559274,RBF,57.461047071462126,0.02767467120246301,0.5,TPESampler,COMPLETE
2496,0.9015619317292112,2025-04-24 22:48:19.274801,2025-04-24 22:48:22.914154,0 days 00:00:03.639353,0.0002056350920885925,RBF,0.099190583017455,0.7202157993481947,2.5,TPESampler,COMPLETE
2497,0.8703401340186111,2025-04-24 22:48:22.324243,2025-04-24 22:48:35.230747,0 days 00:00:12.906504,2.8153308121253396e-06,Matern,0.00044470220843839794,0.013709867753189059,0.5,TPESampler,COMPLETE
2498,0.1633478078296977,2025-04-24 22:48:23.173209,2025-04-24 22:48:28.326632,0 days 00:00:05.153423,93894.6791258096,RBF,121.69847751176437,0.5846339289984115,0.5,TPESampler,COMPLETE
2499,0.8703401340067916,2025-04-24 22:48:28.643448,2025-04-24 22:48:33.015077,0 days 00:00:04.371629,79499.13741774582,Matern,7.273799272362809e-05,0.6844941574876218,0.5,TPESampler,COMPLETE
