number,value,datetime_start,datetime_complete,duration,params_constant_value,params_kernel_type,params_length_scale,params_noise_level,params_nu,system_attrs_auto:sampler,state
1966,0.16334780910627278,2025-04-24 22:26:08.224483,2025-04-24 22:26:14.832148,0 days 00:00:06.607665,61616.66477529273,RBF,697.3664478687887,0.523786303210398,0.5,TPESampler,COMPLETE
1967,0.16334780978056035,2025-04-24 22:26:10.535725,2025-04-24 22:26:18.990279,0 days 00:00:08.454554,63.83917136491028,RBF,0.6759451539343738,0.0005234064895718033,2.5,TPESampler,COMPLETE
1968,0.16344313288916404,2025-04-24 22:26:11.849854,2025-04-24 22:26:18.078332,0 days 00:00:06.228478,1.7201472930988513,Matern,65.26988698928672,0.106621224271323,2.5,TPESampler,COMPLETE
1969,0.16334776272859294,2025-04-24 22:26:15.224885,2025-04-24 22:26:20.815179,0 days 00:00:05.590294,508.1919534006923,RBF,1.0402771388319862,0.29344836962526505,2.5,TPESampler,COMPLETE
1970,0.9015779710227501,2025-04-24 22:26:18.381271,2025-04-24 22:26:26.707046,0 days 00:00:08.325775,2.9067899480233625e-07,RBF,1.9873360199126149,0.006281583702311925,1.5,TPESampler,COMPLETE
1971,0.901577072701206,2025-04-24 22:26:19.245090,2025-04-24 22:26:22.738311,0 days 00:00:03.493221,1.3353539208976218e-05,Matern,335.96372326799303,0.2517181357308132,1.5,TPESampler,COMPLETE
1972,0.8703401340212039,2025-04-24 22:26:21.116636,2025-04-24 22:26:29.023729,0 days 00:00:07.907093,0.07584928196238697,RBF,98.01832522273708,0.003211452435243576,0.5,TPESampler,COMPLETE
1973,0.16334781045981883,2025-04-24 22:26:23.045483,2025-04-24 22:26:28.107643,0 days 00:00:05.062160,9.78033202214248,RBF,162.88121443308015,0.9409959572081616,0.5,TPESampler,COMPLETE
1974,0.8703401340357374,2025-04-24 22:26:26.969120,2025-04-24 22:26:37.298092,0 days 00:00:10.328972,0.0012617605573931254,RBF,0.0035764045592246887,0.1653120306617302,0.5,TPESampler,COMPLETE
1975,0.8703401340212029,2025-04-24 22:26:28.425916,2025-04-24 22:26:32.561411,0 days 00:00:04.135495,14.669050527369247,RBF,0.026688694937447525,0.023108007739425493,1.5,TPESampler,COMPLETE
1976,0.16334778772928388,2025-04-24 22:26:29.304156,2025-04-24 22:26:36.175019,0 days 00:00:06.870863,1.7691129557987357,RBF,0.9088984025508342,0.0006974260573753724,2.5,TPESampler,COMPLETE
1977,0.16334782339161794,2025-04-24 22:26:32.851654,2025-04-24 22:26:37.595150,0 days 00:00:04.743496,51.17043994866537,RBF,29.72033306612951,0.025431193558260012,2.5,TPESampler,COMPLETE
1978,0.8703401340210014,2025-04-24 22:26:36.472263,2025-04-24 22:26:48.465966,0 days 00:00:11.993703,18.618474551781294,RBF,14.801529158148563,0.0010109397810832217,2.5,TPESampler,COMPLETE
1979,0.1633478091342105,2025-04-24 22:26:37.518233,2025-04-24 22:26:49.050083,0 days 00:00:11.531850,73636.71142174845,RBF,1494.5894650433934,0.7029401292495429,0.5,TPESampler,COMPLETE
1980,0.8703401340228191,2025-04-24 22:26:38.122810,2025-04-24 22:26:49.742723,0 days 00:00:11.619913,0.27734467189908946,RBF,0.1118821072663006,2.4838123625832053e-05,1.5,TPESampler,COMPLETE
1981,0.16334777335163195,2025-04-24 22:26:48.729729,2025-04-24 22:26:54.099579,0 days 00:00:05.369850,16.189842324041894,RBF,61.611697354823306,0.019194714010437534,2.5,TPESampler,COMPLETE
1982,0.1633478040896205,2025-04-24 22:26:49.498740,2025-04-24 22:27:00.134908,0 days 00:00:10.636168,0.0013531988943873614,RBF,1.4444280138476007,0.00873065385996713,0.5,TPESampler,COMPLETE
1983,0.16334781090002548,2025-04-24 22:26:49.983698,2025-04-24 22:26:56.303885,0 days 00:00:06.320187,3654.9709913804822,RBF,2.0960639793465345,0.00613593541988049,2.5,TPESampler,COMPLETE
1984,0.8703401340600029,2025-04-24 22:26:54.373406,2025-04-24 22:27:00.873597,0 days 00:00:06.500191,37589.46129836464,RBF,187.64344543238278,0.00023697402326064616,2.5,TPESampler,COMPLETE
1985,0.16334781420546726,2025-04-24 22:26:56.599302,2025-04-24 22:27:01.999541,0 days 00:00:05.400239,90.02325217369167,RBF,268.37662623592354,0.5264601614497737,0.5,TPESampler,COMPLETE
1986,0.1633478052008357,2025-04-24 22:27:00.425036,2025-04-24 22:27:10.104214,0 days 00:00:09.679178,0.675724527413749,RBF,0.2313679870908951,0.00018922115327954837,0.5,TPESampler,COMPLETE
1987,0.16334780905908391,2025-04-24 22:27:01.123019,2025-04-24 22:27:08.465571,0 days 00:00:07.342552,28.379798373773426,RBF,3.2757974283250397,0.5275908149409895,1.5,TPESampler,COMPLETE
1988,0.8703401340193972,2025-04-24 22:27:02.295157,2025-04-24 22:27:10.938208,0 days 00:00:08.643051,56.24946682804051,RBF,595.672776375401,5.006571709180126e-06,2.5,TPESampler,COMPLETE
1989,0.8703401340706324,2025-04-24 22:27:08.763970,2025-04-24 22:27:13.431474,0 days 00:00:04.667504,8485.280973498191,RBF,73.79280937769444,2.6080134332486906e-10,1.5,TPESampler,COMPLETE
1990,0.16334784279523124,2025-04-24 22:27:10.400795,2025-04-24 22:27:18.193898,0 days 00:00:07.793103,2.7728690345316784,RBF,362.6840800480874,0.9680594976629573,0.5,TPESampler,COMPLETE
1991,0.16334780201308555,2025-04-24 22:27:11.190566,2025-04-24 22:27:19.965847,0 days 00:00:08.775281,292.5313984218373,RBF,1002.1086051403647,0.8540635223925701,2.5,TPESampler,COMPLETE
1992,0.8703401303605485,2025-04-24 22:27:13.738135,2025-04-24 22:27:25.968190,0 days 00:00:12.230055,97070.91152047229,RBF,0.1643755411659816,0.0010083869349470848,2.5,TPESampler,COMPLETE
1993,0.8703401340204191,2025-04-24 22:27:18.788003,2025-04-24 22:27:27.837842,0 days 00:00:09.049839,5.615339012926969,RBF,4.97049153621833,5.3140163039587625e-05,1.5,TPESampler,COMPLETE
1994,0.870340134057056,2025-04-24 22:27:20.660720,2025-04-24 22:27:28.136818,0 days 00:00:07.476098,1566.2524044219376,RBF,0.017742748004023152,0.11926006146091993,2.5,TPESampler,COMPLETE
1995,0.163347809035626,2025-04-24 22:27:26.283155,2025-04-24 22:27:31.945745,0 days 00:00:05.662590,23.902145705370447,RBF,33.80690984072938,0.9790847432623491,0.5,TPESampler,COMPLETE
1996,0.8703401340211724,2025-04-24 22:27:28.104182,2025-04-24 22:27:34.269482,0 days 00:00:06.165300,0.0947441585377703,RBF,1.9111730840192844,0.005427708947449181,0.5,TPESampler,COMPLETE
1997,0.16334783509458128,2025-04-24 22:27:28.370171,2025-04-24 22:27:34.543411,0 days 00:00:06.173240,37.97365472618749,RBF,4.394000165766537,0.018040294936423118,2.5,TPESampler,COMPLETE
1998,0.16334778466107305,2025-04-24 22:27:32.389600,2025-04-24 22:27:41.639198,0 days 00:00:09.249598,13.613467133819286,RBF,381.83501744457925,0.028984846391339317,0.5,TPESampler,COMPLETE
1999,0.1633478327490777,2025-04-24 22:27:34.500010,2025-04-24 22:27:40.167085,0 days 00:00:05.667075,773.6387155849856,RBF,0.5526606282185578,3.8544397893099554e-05,2.5,TPESampler,COMPLETE
2000,0.1633478159805134,2025-04-24 22:27:34.829792,2025-04-24 22:27:43.709557,0 days 00:00:08.879765,690.7272003657865,RBF,57737.35527362068,0.2704841358648459,0.5,TPESampler,COMPLETE
2001,0.16334764311713,2025-04-24 22:27:40.475244,2025-04-24 22:27:46.605816,0 days 00:00:06.130572,38632.10074043327,RBF,2.4694610358398936,0.848273532673362,0.5,TPESampler,COMPLETE
2002,0.870340134027445,2025-04-24 22:27:41.903897,2025-04-24 22:27:49.724711,0 days 00:00:07.820814,0.13878763247809137,RBF,287.1393727153412,2.0401957931951744e-10,0.5,TPESampler,COMPLETE
2003,0.16334782127700914,2025-04-24 22:27:44.006052,2025-04-24 22:27:50.746296,0 days 00:00:06.740244,26.502665360702895,RBF,2.1172507410518433,0.002285460447526603,2.5,TPESampler,COMPLETE
2004,0.16334780922507253,2025-04-24 22:27:46.890912,2025-04-24 22:27:54.417128,0 days 00:00:07.526216,70555.37057571615,RBF,833.5868647800617,0.5667918625071072,0.5,TPESampler,COMPLETE
2005,0.8703401340212377,2025-04-24 22:27:50.040600,2025-04-24 22:27:55.796040,0 days 00:00:05.755440,46182.43879141204,RBF,0.08056515635738697,0.13532084624597748,0.5,TPESampler,COMPLETE
2006,0.16334780913045838,2025-04-24 22:27:51.195471,2025-04-24 22:27:56.507493,0 days 00:00:05.312022,1854.2927447984061,RBF,72.44452504268831,0.07201210019310551,0.5,TPESampler,COMPLETE
2007,0.8703401340221796,2025-04-24 22:27:54.736778,2025-04-24 22:27:58.704849,0 days 00:00:03.968071,79657.94580323317,RBF,0.012480288364790537,0.012132462669634463,0.5,TPESampler,COMPLETE
2008,0.16334780268659635,2025-04-24 22:27:56.089479,2025-04-24 22:28:01.196491,0 days 00:00:05.107012,541.255724532077,RBF,50.820170421733366,0.3389430554430784,0.5,TPESampler,COMPLETE
2009,0.16334780730748283,2025-04-24 22:27:56.792485,2025-04-24 22:28:10.479861,0 days 00:00:13.687376,35813.32003742373,RBF,0.328831098084733,0.049415981932539134,0.5,TPESampler,COMPLETE
2010,0.16334780705819985,2025-04-24 22:27:59.035475,2025-04-24 22:28:10.680250,0 days 00:00:11.644775,6397.940803476303,RBF,136.35821732462827,0.09364939505875,0.5,TPESampler,COMPLETE
2011,0.8703401340289577,2025-04-24 22:28:01.483496,2025-04-24 22:28:09.682009,0 days 00:00:08.198513,240.6785961263103,RBF,0.1349151458276223,0.7677698001436445,0.5,TPESampler,COMPLETE
2012,0.1633478612259812,2025-04-24 22:28:09.982325,2025-04-24 22:28:16.541623,0 days 00:00:06.559298,53.3343792371567,RBF,2.075615837574237,0.5347085085548711,0.5,TPESampler,COMPLETE
2013,0.1633477192418717,2025-04-24 22:28:10.724814,2025-04-24 22:28:15.182049,0 days 00:00:04.457235,8569.636873398003,RBF,0.9136011024133069,0.7943358559651544,0.5,TPESampler,COMPLETE
2014,0.16334780896372836,2025-04-24 22:28:10.962487,2025-04-24 22:28:17.253070,0 days 00:00:06.290583,4933.22013314492,RBF,4402.396310905282,0.9103828143339149,0.5,TPESampler,COMPLETE
2015,0.1633478106841173,2025-04-24 22:28:15.466852,2025-04-24 22:28:21.417615,0 days 00:00:05.950763,1153.6418946104643,RBF,3.3905318922977976,0.00022245720917762394,2.5,TPESampler,COMPLETE
2016,0.8703401340182736,2025-04-24 22:28:16.799946,2025-04-24 22:28:20.803776,0 days 00:00:04.003830,331.91107488096975,RBF,0.08161173645541496,0.012277746272531372,0.5,TPESampler,COMPLETE
2017,0.16334780387763045,2025-04-24 22:28:17.512193,2025-04-24 22:28:22.313118,0 days 00:00:04.800925,61219.551087698164,RBF,1.2467938498170499,0.25468719041464727,0.5,TPESampler,COMPLETE
2018,0.1633478117759703,2025-04-24 22:28:21.115272,2025-04-24 22:28:36.377109,0 days 00:00:15.261837,25127.756120315025,RBF,0.20064763563177895,0.8710160158337299,0.5,TPESampler,COMPLETE
2019,0.16334780955219777,2025-04-24 22:28:21.715151,2025-04-24 22:28:34.809903,0 days 00:00:13.094752,0.008170586488997341,RBF,0.4384645263667705,2.8182009193742776e-09,1.5,TPESampler,COMPLETE
2020,0.16334782555597477,2025-04-24 22:28:22.685633,2025-04-24 22:28:30.401999,0 days 00:00:07.716366,45.75562456835944,RBF,6.140325707803591,0.01579017488273891,0.5,TPESampler,COMPLETE
2021,0.16334780424443227,2025-04-24 22:28:30.670108,2025-04-24 22:28:35.777901,0 days 00:00:05.107793,49158.948021653676,RBF,9.347499472767748,0.12395965895581919,0.5,TPESampler,COMPLETE
2022,0.8703401340225454,2025-04-24 22:28:35.122973,2025-04-24 22:28:39.390645,0 days 00:00:04.267672,1981.6357074252544,RBF,0.0026655893958526305,0.03788559565810155,0.5,TPESampler,COMPLETE
2023,0.1633478154567031,2025-04-24 22:28:36.076289,2025-04-24 22:28:42.623087,0 days 00:00:06.546798,3954.179547551919,RBF,2.179943427859061,0.11508442095961326,0.5,TPESampler,COMPLETE
2024,0.16334780849962974,2025-04-24 22:28:36.639645,2025-04-24 22:28:42.624450,0 days 00:00:05.984805,2170.3573022344003,RBF,16.48916270894128,0.43084815222372846,0.5,TPESampler,COMPLETE
2025,0.8703401339151859,2025-04-24 22:28:39.689205,2025-04-24 22:28:46.533294,0 days 00:00:06.844089,119.69883542536117,RBF,0.13629531910910883,0.032285262260707714,0.5,TPESampler,COMPLETE
2026,0.16334780975113236,2025-04-24 22:28:43.090567,2025-04-24 22:28:53.116347,0 days 00:00:10.025780,1170.53424209753,RBF,0.34317460467812805,0.13444157832907885,0.5,TPESampler,COMPLETE
2027,0.16334779685497533,2025-04-24 22:28:43.140942,2025-04-24 22:28:50.621635,0 days 00:00:07.480693,76663.25693928875,RBF,2.070007477573992,0.7923930427278676,0.5,TPESampler,COMPLETE
2028,0.8703401340215423,2025-04-24 22:28:46.802991,2025-04-24 22:28:50.967601,0 days 00:00:04.164610,6559.400183756709,RBF,0.0011250617497227545,0.13279988865098136,0.5,TPESampler,COMPLETE
2029,0.870340087608387,2025-04-24 22:28:50.898243,2025-04-24 22:28:57.355850,0 days 00:00:06.457607,233.9972456488313,RBF,0.176957173884217,0.10095559465460052,0.5,TPESampler,COMPLETE
2030,0.16334781252560537,2025-04-24 22:28:51.514194,2025-04-24 22:28:59.555197,0 days 00:00:08.041003,56.263306460896565,RBF,5.309471301618032,0.13414885969684168,0.5,TPESampler,COMPLETE
2031,0.1633478133687061,2025-04-24 22:28:53.885047,2025-04-24 22:29:00.949663,0 days 00:00:07.064616,3367.989386956903,RBF,0.6212375579587207,0.061087473616926166,0.5,TPESampler,COMPLETE
2032,0.16334781461994516,2025-04-24 22:28:57.780541,2025-04-24 22:29:04.298371,0 days 00:00:06.517830,38350.69108997816,RBF,9.203869395451585,0.01814112728655381,0.5,TPESampler,COMPLETE
2033,0.2739341138235442,2025-04-24 22:28:59.865093,2025-04-24 22:29:09.810810,0 days 00:00:09.945717,94422.15239217177,RBF,0.25615464684955613,0.009323244119747021,0.5,TPESampler,COMPLETE
2034,0.16334780832877366,2025-04-24 22:29:01.324736,2025-04-24 22:29:12.805461,0 days 00:00:11.480725,2.208385049593993e-05,RBF,46.429849888297326,0.6737403192965997,2.5,TPESampler,COMPLETE
2035,0.163347809646371,2025-04-24 22:29:04.598772,2025-04-24 22:29:09.225371,0 days 00:00:04.626599,332.97557582207986,RBF,2.0449695329643247,0.30773772247150943,0.5,TPESampler,COMPLETE
2036,0.16334781545031127,2025-04-24 22:29:09.532465,2025-04-24 22:29:14.242808,0 days 00:00:04.710343,1022.7620798366659,RBF,0.9960418388669319,0.15877584405152126,0.5,TPESampler,COMPLETE
2037,0.1633478013787482,2025-04-24 22:29:10.124521,2025-04-24 22:29:15.508238,0 days 00:00:05.383717,349.7366936501639,RBF,8.698225022499678,0.01882348786499006,0.5,TPESampler,COMPLETE
2038,0.1633478090872262,2025-04-24 22:29:13.068569,2025-04-24 22:29:20.446535,0 days 00:00:07.377966,8536.03074548528,RBF,4.37055861514028,0.009399410846460792,0.5,TPESampler,COMPLETE
2039,0.1633478421570124,2025-04-24 22:29:14.632325,2025-04-24 22:29:25.125193,0 days 00:00:10.492868,16953.76132290546,RBF,0.43888727827229196,0.0987718195139533,0.5,TPESampler,COMPLETE
2040,0.8703401340224008,2025-04-24 22:29:15.808952,2025-04-24 22:29:24.506466,0 days 00:00:08.697514,32041.380211797503,RBF,0.12325232697770526,0.7343619357277151,0.5,TPESampler,COMPLETE
2041,0.16334782705528222,2025-04-24 22:29:20.890789,2025-04-24 22:29:27.103495,0 days 00:00:06.212706,14103.736634188428,RBF,3.298476464735806,0.4228593498594622,0.5,TPESampler,COMPLETE
2042,0.8703401341096327,2025-04-24 22:29:24.768524,2025-04-24 22:29:28.958641,0 days 00:00:04.190117,15422.0278754792,RBF,0.021314350856390784,0.26724953785229744,0.5,TPESampler,COMPLETE
2043,0.16334780780979266,2025-04-24 22:29:25.411583,2025-04-24 22:29:34.402698,0 days 00:00:08.991115,35035.636441185336,RBF,1.2326646641564933,0.010181639482161298,0.5,TPESampler,COMPLETE
2044,0.16334782590213173,2025-04-24 22:29:27.404928,2025-04-24 22:29:32.568457,0 days 00:00:05.163529,2556.6961055748325,RBF,69.83723163899559,0.16722469255028066,0.5,TPESampler,COMPLETE
2045,0.1633478178020846,2025-04-24 22:29:29.258181,2025-04-24 22:29:34.686192,0 days 00:00:05.428011,1637.7926839337877,RBF,184.50492969700642,0.8036863318561462,0.5,TPESampler,COMPLETE
2046,0.16334679192443663,2025-04-24 22:29:32.853351,2025-04-24 22:29:41.143812,0 days 00:00:08.290461,26932.983772454645,RBF,2.5238355587007173,0.003918569328491509,0.5,TPESampler,COMPLETE
2047,0.9015771955107164,2025-04-24 22:29:34.639579,2025-04-24 22:29:40.534838,0 days 00:00:05.895259,4465.193958703674,RBF,0.20002365394858088,0.0018289569714683314,0.5,TPESampler,COMPLETE
2048,0.16334781184231087,2025-04-24 22:29:34.986091,2025-04-24 22:29:45.003040,0 days 00:00:10.016949,96.84400661889188,RBF,0.45904629003413716,0.3358150800495925,0.5,TPESampler,COMPLETE
2049,0.16334780716255834,2025-04-24 22:29:40.795884,2025-04-24 22:29:51.016276,0 days 00:00:10.220392,74142.71386012471,RBF,60432.6668021305,0.06897153456948103,0.5,TPESampler,COMPLETE
2050,0.8703401339967825,2025-04-24 22:29:41.374939,2025-04-24 22:29:48.594642,0 days 00:00:07.219703,76335.44982298193,RBF,0.11005697829660213,0.7040582852003205,0.5,TPESampler,COMPLETE
2051,0.16334795273134126,2025-04-24 22:29:45.372642,2025-04-24 22:29:51.770257,0 days 00:00:06.397615,3512.9079790360292,RBF,3.522134114400019,0.9591361122315301,0.5,TPESampler,COMPLETE
2052,0.1633478114964444,2025-04-24 22:29:48.866703,2025-04-24 22:29:55.715156,0 days 00:00:06.848453,13744.440351938141,RBF,1.5690112332468236,4.2791931483509694e-05,0.5,TPESampler,COMPLETE
2053,0.16334775524316886,2025-04-24 22:29:51.319479,2025-04-24 22:29:57.884887,0 days 00:00:06.565408,173.81765542238537,RBF,1.4115906383449526,0.0015256537819606847,0.5,TPESampler,COMPLETE
2054,0.16334779590056236,2025-04-24 22:29:52.055107,2025-04-24 22:29:57.728841,0 days 00:00:05.673734,852.5301062011958,RBF,53.1400171152598,0.5104826238419684,0.5,TPESampler,COMPLETE
2055,0.16334780982800454,2025-04-24 22:29:56.002924,2025-04-24 22:30:05.577662,0 days 00:00:09.574738,0.03903776392625955,RBF,1.0714225628583367,3.750912528809923e-05,0.5,TPESampler,COMPLETE
2056,0.8703401341008007,2025-04-24 22:29:57.946485,2025-04-24 22:30:04.102602,0 days 00:00:06.156117,0.6152244533537023,RBF,24.41038871900735,1.100360953870399e-06,0.5,TPESampler,COMPLETE
2057,0.16334781051337857,2025-04-24 22:29:58.162374,2025-04-24 22:30:04.887370,0 days 00:00:06.724996,28068.966679863104,RBF,0.3965842720759379,0.28793633258130863,0.5,TPESampler,COMPLETE
2058,0.1633478198497718,2025-04-24 22:30:04.398879,2025-04-24 22:30:10.525772,0 days 00:00:06.126893,11385.326872406922,RBF,3.042290834150467,0.011520039157917696,0.5,TPESampler,COMPLETE
2059,0.16334779560172877,2025-04-24 22:30:05.157380,2025-04-24 22:30:11.722881,0 days 00:00:06.565501,316.8130997546792,RBF,1.4976873307965377,0.014628052155703689,0.5,TPESampler,COMPLETE
2060,0.16334780834316145,2025-04-24 22:30:05.878319,2025-04-24 22:30:10.214031,0 days 00:00:04.335712,21049.85716291918,RBF,2.0923074404236073,0.20049982268470046,0.5,TPESampler,COMPLETE
2061,0.16334780923397152,2025-04-24 22:30:10.480046,2025-04-24 22:30:16.279625,0 days 00:00:05.799579,5253.026318457943,RBF,1.7370061606419251,0.00011110211623739029,0.5,TPESampler,COMPLETE
2062,0.16334778026633734,2025-04-24 22:30:10.799384,2025-04-24 22:30:15.848224,0 days 00:00:05.048840,35072.25752834853,RBF,40.391094088383575,0.21707614903961367,0.5,TPESampler,COMPLETE
2063,0.16334785545756547,2025-04-24 22:30:12.041798,2025-04-24 22:30:17.847939,0 days 00:00:05.806141,956.888690270424,RBF,3.7987510112780116,0.000291252556709189,0.5,TPESampler,COMPLETE
2064,0.1633478068179797,2025-04-24 22:30:16.127932,2025-04-24 22:30:21.699111,0 days 00:00:05.571179,3969.201515323735,RBF,0.4538664701214761,0.0005260360056606809,0.5,TPESampler,COMPLETE
2065,0.8703401340152334,2025-04-24 22:30:16.631819,2025-04-24 22:30:21.026984,0 days 00:00:04.395165,85743.58462501041,RBF,0.010023531043675548,0.5688099635889392,0.5,TPESampler,COMPLETE
2066,0.16334781095128795,2025-04-24 22:30:18.143770,2025-04-24 22:30:22.986653,0 days 00:00:04.842883,57795.77109464148,RBF,10.405544701843407,0.5303863429752025,0.5,TPESampler,COMPLETE
2067,0.16334780796114218,2025-04-24 22:30:21.325930,2025-04-24 22:30:25.125340,0 days 00:00:03.799410,892.6151478744757,RBF,9.099490471987673,0.08022388988813788,0.5,TPESampler,COMPLETE
2068,0.16334781788552957,2025-04-24 22:30:21.934452,2025-04-24 22:30:27.271259,0 days 00:00:05.336807,3333.683658939086,RBF,6.608920432149061,0.9836105237285829,0.5,TPESampler,COMPLETE
2069,0.21977494255501967,2025-04-24 22:30:23.284029,2025-04-24 22:30:28.862214,0 days 00:00:05.578185,2381.695287152354,Matern,8.286795095730271,0.0074413502337144525,0.5,TPESampler,COMPLETE
2070,0.16334781223913353,2025-04-24 22:30:25.407263,2025-04-24 22:30:29.820733,0 days 00:00:04.413470,20591.435882925325,RBF,5.190247158948796,0.4356463064428276,0.5,TPESampler,COMPLETE
2071,0.16334781044592217,2025-04-24 22:30:27.571768,2025-04-24 22:30:32.583080,0 days 00:00:05.011312,17360.505669584236,RBF,0.7484698536975812,0.0008224977991765223,0.5,TPESampler,COMPLETE
2072,0.1633478030571555,2025-04-24 22:30:29.153452,2025-04-24 22:30:32.903530,0 days 00:00:03.750078,20668.44009874891,RBF,1.5015763005547915,0.35919349849670185,0.5,TPESampler,COMPLETE
2073,0.16334772175490309,2025-04-24 22:30:30.119316,2025-04-24 22:30:35.149179,0 days 00:00:05.029863,20669.24771863596,RBF,5.278602064197487,0.0011574987070003297,0.5,TPESampler,COMPLETE
2074,0.9015779749019732,2025-04-24 22:30:32.856371,2025-04-24 22:30:35.558855,0 days 00:00:02.702484,6752.096740850717,RBF,1.0290289465925277,0.002237386724038798,0.5,TPESampler,COMPLETE
2075,0.16334771699806458,2025-04-24 22:30:33.267674,2025-04-24 22:30:38.725110,0 days 00:00:05.457436,4948.504070849913,RBF,120.53814969999489,0.9494770673741603,0.5,TPESampler,COMPLETE
2076,0.1633479262527437,2025-04-24 22:30:35.520048,2025-04-24 22:30:45.628724,0 days 00:00:10.108676,826.7925275556638,RBF,25.3634850780341,0.0007461625786303401,0.5,TPESampler,COMPLETE
2077,0.901575941218293,2025-04-24 22:30:35.905434,2025-04-24 22:30:39.395809,0 days 00:00:03.490375,12293.980356129143,RBF,0.28087879262936233,0.00017556214025340027,0.5,TPESampler,COMPLETE
2078,0.870340134021414,2025-04-24 22:30:39.116111,2025-04-24 22:30:45.600372,0 days 00:00:06.484261,2556.7655526567632,RBF,0.09102406858366766,0.008951732852842658,0.5,TPESampler,COMPLETE
2079,0.16334781014370567,2025-04-24 22:30:39.671916,2025-04-24 22:30:48.437104,0 days 00:00:08.765188,710.8945997915545,RBF,1198.662201131527,0.11768376537855442,0.5,TPESampler,COMPLETE
2080,0.16334783160942834,2025-04-24 22:30:45.812804,2025-04-24 22:30:51.453580,0 days 00:00:05.640776,468.8477418309314,RBF,5.866708980467763,0.007135866530464483,0.5,TPESampler,COMPLETE
2081,0.1633478042413171,2025-04-24 22:30:45.855014,2025-04-24 22:30:52.638464,0 days 00:00:06.783450,6263.710365273809,RBF,2.0216026383673884,0.0004110415159628518,0.5,TPESampler,COMPLETE
