number,value,datetime_start,datetime_complete,duration,params_constant_value,params_kernel_type,params_length_scale,params_noise_level,params_nu,system_attrs_auto:sampler,state
1735,0.8703401340192862,2025-04-24 22:15:23.137034,2025-04-24 22:15:29.136059,0 days 00:00:05.999025,184.75370343716452,RBF,0.12233181396303641,0.013358577118928081,0.5,TPESampler,COMPLETE
1736,0.16334780587370276,2025-04-24 22:15:23.298827,2025-04-24 22:15:37.161158,0 days 00:00:13.862331,620.1884065109368,RBF,69334.00556312012,0.7284567995064326,0.5,TPESampler,COMPLETE
1737,0.16334780874923127,2025-04-24 22:15:29.312686,2025-04-24 22:15:36.670700,0 days 00:00:07.358014,87.29660527810292,RBF,5.8258829159388705,3.7166132910660515e-05,2.5,TPESampler,COMPLETE
1738,0.16355856379928002,2025-04-24 22:15:35.321938,2025-04-24 22:15:45.480065,0 days 00:00:10.158127,34.604819601234524,Matern,291.06828386624846,0.02399408327206935,1.5,TPESampler,COMPLETE
1739,0.16334781606528845,2025-04-24 22:15:36.920646,2025-04-24 22:15:50.824253,0 days 00:00:13.903607,40.56673592205585,RBF,0.21474829751075433,0.00047700291910040833,1.5,TPESampler,COMPLETE
1740,0.16334781418225422,2025-04-24 22:15:37.476245,2025-04-24 22:15:45.910248,0 days 00:00:08.434003,745.0600097942182,RBF,26.00665538647298,0.0008899501534379941,2.5,TPESampler,COMPLETE
1741,0.16334786410802343,2025-04-24 22:15:45.773495,2025-04-24 22:15:52.378668,0 days 00:00:06.605173,1.3949280942277558,RBF,7.704571473236939,0.8876231861487766,0.5,TPESampler,COMPLETE
1742,0.8703401340215193,2025-04-24 22:15:46.180159,2025-04-24 22:15:54.465928,0 days 00:00:08.285769,1.74764163151211e-07,RBF,0.024882558048312534,2.0640558921131e-08,1.5,TPESampler,COMPLETE
1743,0.9015751985018517,2025-04-24 22:15:51.096099,2025-04-24 22:15:54.507718,0 days 00:00:03.411619,1.2531810885852137e-05,RBF,0.522942925550255,0.2342943098515795,2.5,TPESampler,COMPLETE
1744,0.16334778743348033,2025-04-24 22:15:52.685617,2025-04-24 22:16:01.588179,0 days 00:00:08.902562,0.38874486114636386,RBF,1.4631630057461331,9.892531713282816e-05,0.5,TPESampler,COMPLETE
1745,0.8703401340212207,2025-04-24 22:15:54.677177,2025-04-24 22:16:03.375085,0 days 00:00:08.697908,89.31652679211382,RBF,26.028086588555745,0.0007659172431143077,1.5,TPESampler,COMPLETE
1746,0.8703401340212047,2025-04-24 22:15:54.730680,2025-04-24 22:16:04.494346,0 days 00:00:09.763666,0.0965498592351068,Matern,156.72408468547687,7.56510070560202e-08,1.5,TPESampler,COMPLETE
1747,0.16334780917205974,2025-04-24 22:16:01.852609,2025-04-24 22:16:06.652852,0 days 00:00:04.800243,12.107734505013386,RBF,75.29233631336258,0.02525044582451724,2.5,TPESampler,COMPLETE
1748,0.9015779749019732,2025-04-24 22:16:03.651765,2025-04-24 22:16:06.749864,0 days 00:00:03.098099,1682.4355394666384,RBF,1.6060061570595274,0.0020706840619478975,2.5,TPESampler,COMPLETE
1749,0.9015771955339498,2025-04-24 22:16:04.758568,2025-04-24 22:16:08.751299,0 days 00:00:03.992731,15602.203481134395,RBF,1.7832580939263896e-05,5.015066373483516e-10,1.5,TPESampler,COMPLETE
1750,0.16334783833029584,2025-04-24 22:16:06.856700,2025-04-24 22:16:11.710827,0 days 00:00:04.854127,1587.509004936771,RBF,1.2738351553190241,0.9065278562784782,2.5,TPESampler,COMPLETE
1751,0.8703401340056108,2025-04-24 22:16:06.898288,2025-04-24 22:16:13.031859,0 days 00:00:06.133571,0.22384396194727396,Matern,0.0005076965921614532,0.45649053165585274,1.5,TPESampler,COMPLETE
1752,0.16334781060894876,2025-04-24 22:16:09.045838,2025-04-24 22:16:13.850224,0 days 00:00:04.804386,0.20013663293687955,RBF,0.8606681595424689,0.005842610197254895,1.5,TPESampler,COMPLETE
1753,0.16334778730355703,2025-04-24 22:16:11.964726,2025-04-24 22:16:19.084226,0 days 00:00:07.119500,0.05686281085540647,RBF,0.3707806179899132,0.5615055531962122,2.5,TPESampler,COMPLETE
1754,0.9015779745056002,2025-04-24 22:16:13.362990,2025-04-24 22:16:17.736560,0 days 00:00:04.373570,23012.6421985144,RBF,0.7898148302356639,1.314213552148495e-05,2.5,TPESampler,COMPLETE
1755,0.9015378607101119,2025-04-24 22:16:14.101037,2025-04-24 22:16:18.059155,0 days 00:00:03.958118,0.0003728496070503018,Matern,231.2445379940909,0.0018617001503751045,1.5,TPESampler,COMPLETE
1756,0.9015771955333649,2025-04-24 22:16:17.980648,2025-04-24 22:16:22.146582,0 days 00:00:04.165934,97558.42280006893,RBF,0.06476905328725598,2.06295645928533e-05,1.5,TPESampler,COMPLETE
1757,0.16334782342949497,2025-04-24 22:16:18.330081,2025-04-24 22:16:26.492505,0 days 00:00:08.162424,539.4176835555835,RBF,3.973334238241928,1.8688393549866033e-05,2.5,TPESampler,COMPLETE
1758,0.8703401340214156,2025-04-24 22:16:19.392567,2025-04-24 22:16:24.155988,0 days 00:00:04.763421,13.614034812331008,RBF,0.0016853725754086004,0.10596168313543843,0.5,TPESampler,COMPLETE
1759,0.16334781428391137,2025-04-24 22:16:22.367121,2025-04-24 22:16:29.587262,0 days 00:00:07.220141,3.0341177489322018,RBF,2.5114571096443825,0.0015231787691951234,2.5,TPESampler,COMPLETE
1760,0.8703401340172966,2025-04-24 22:16:24.459123,2025-04-24 22:16:29.852222,0 days 00:00:05.393099,19.52190677631075,RBF,31.562253728816135,0.0008277242139215647,2.5,TPESampler,COMPLETE
1761,0.870340134020535,2025-04-24 22:16:26.799415,2025-04-24 22:16:34.403338,0 days 00:00:07.603923,21.851707731545822,RBF,11.693964568726111,1.6385440877663028e-05,0.5,TPESampler,COMPLETE
1762,0.1633478083297673,2025-04-24 22:16:29.773728,2025-04-24 22:16:36.886615,0 days 00:00:07.112887,13109.059232710577,RBF,13202.0603668427,0.8393814700540642,0.5,TPESampler,COMPLETE
1763,0.8703401340287747,2025-04-24 22:16:30.137496,2025-04-24 22:16:34.320116,0 days 00:00:04.182620,0.03397040313204678,RBF,0.08536780663518151,0.0004631798703658764,0.5,TPESampler,COMPLETE
1764,0.16334781341041107,2025-04-24 22:16:34.534148,2025-04-24 22:16:45.247007,0 days 00:00:10.712859,0.012817279040233099,RBF,0.4207284024541505,0.0020807570218918906,2.5,TPESampler,COMPLETE
1765,0.8703401340203806,2025-04-24 22:16:34.636632,2025-04-24 22:16:47.420803,0 days 00:00:12.784171,8.457984498755138e-06,RBF,2916.8675285422073,0.0002444096734292837,2.5,TPESampler,COMPLETE
1766,0.2197749497323065,2025-04-24 22:16:37.172275,2025-04-24 22:16:43.774937,0 days 00:00:06.602662,67.87143302539641,Matern,59.717755043938105,0.05041513897781432,0.5,TPESampler,COMPLETE
1767,0.1633478168165386,2025-04-24 22:16:44.073328,2025-04-24 22:16:49.781208,0 days 00:00:05.707880,9.920430547047818,RBF,13.334214599913645,0.062436601652305676,2.5,TPESampler,COMPLETE
1768,0.8703401340196597,2025-04-24 22:16:45.546237,2025-04-24 22:16:52.872347,0 days 00:00:07.326110,3640.3660231026365,RBF,40.73305883633804,6.955586303834551e-08,2.5,TPESampler,COMPLETE
1769,0.16334780942550528,2025-04-24 22:16:47.719922,2025-04-24 22:16:54.906752,0 days 00:00:07.186830,25.190561844711297,RBF,0.8624179919776104,0.054966001334970344,2.5,TPESampler,COMPLETE
1770,0.1633478094816446,2025-04-24 22:16:50.080100,2025-04-24 22:16:57.987844,0 days 00:00:07.907744,4.372853942698649,RBF,36.61152334924935,0.20825311966465287,1.5,TPESampler,COMPLETE
1771,0.8703401340520299,2025-04-24 22:16:53.156588,2025-04-24 22:17:04.102955,0 days 00:00:10.946367,0.014196443917973428,RBF,0.1272818149162763,8.885497280777986e-06,0.5,TPESampler,COMPLETE
1772,0.16334781419776606,2025-04-24 22:16:55.458394,2025-04-24 22:17:04.784309,0 days 00:00:09.325915,219.01842617936458,RBF,7.842749111045874,0.029742723932023922,2.5,TPESampler,COMPLETE
1773,0.8703401339905635,2025-04-24 22:16:58.556569,2025-04-24 22:17:10.838664,0 days 00:00:12.282095,7.469284767745966,RBF,431.0107604312837,0.002505373297445781,0.5,TPESampler,COMPLETE
1774,0.9015771955350631,2025-04-24 22:17:04.360579,2025-04-24 22:17:08.906243,0 days 00:00:04.545664,171.49965445048642,RBF,4.607859228485856,6.994304543915199e-06,1.5,TPESampler,COMPLETE
1775,0.1633479103155613,2025-04-24 22:17:04.995871,2025-04-24 22:17:10.748014,0 days 00:00:05.752143,2738.0240320626,RBF,0.9294494443817348,0.00029396168479086434,2.5,TPESampler,COMPLETE
1776,0.1633478117109017,2025-04-24 22:17:09.171384,2025-04-24 22:17:14.653428,0 days 00:00:05.482044,350.2396592563042,RBF,100.52110218663137,0.017642981987637568,2.5,TPESampler,COMPLETE
1777,0.16334781042031724,2025-04-24 22:17:10.975487,2025-04-24 22:17:28.692733,0 days 00:00:17.717246,7.793413283695336,RBF,0.21789674053184804,0.848409219445806,1.5,TPESampler,COMPLETE
1778,0.16334793334601508,2025-04-24 22:17:11.044299,2025-04-24 22:17:18.234207,0 days 00:00:07.189908,907.2141996926018,RBF,497.2108569507344,0.7018306089196685,0.5,TPESampler,COMPLETE
1779,0.16334780940467228,2025-04-24 22:17:14.965851,2025-04-24 22:17:21.647217,0 days 00:00:06.681366,573.3083830089702,RBF,661.999619040087,0.670720181652853,0.5,TPESampler,COMPLETE
1780,0.8703401340325483,2025-04-24 22:17:18.531682,2025-04-24 22:17:26.862787,0 days 00:00:08.331105,7.6061863621008,RBF,48.56432639986018,0.011298174377297831,2.5,TPESampler,COMPLETE
1781,0.21977493308050308,2025-04-24 22:17:22.173175,2025-04-24 22:17:30.904748,0 days 00:00:08.731573,0.08137979073855285,Matern,3280.7914719256255,0.16603729998820246,0.5,TPESampler,COMPLETE
1782,0.9015779747922922,2025-04-24 22:17:27.148597,2025-04-24 22:17:30.973892,0 days 00:00:03.825295,58879.47089358052,Matern,2.763933100909154,1.729156830362314e-06,1.5,TPESampler,COMPLETE
1783,0.1633478124817503,2025-04-24 22:17:28.997496,2025-04-24 22:17:35.144921,0 days 00:00:06.147425,26869.54820541959,RBF,9.661532813759848,0.03955510806825784,2.5,TPESampler,COMPLETE
1784,0.16334761012871993,2025-04-24 22:17:31.107581,2025-04-24 22:17:38.063812,0 days 00:00:06.956231,0.9715750123107065,RBF,66.72831845645443,0.9066060077351115,0.5,TPESampler,COMPLETE
1785,0.8703401340211738,2025-04-24 22:17:31.227089,2025-04-24 22:17:38.364436,0 days 00:00:07.137347,0.28896771147292727,RBF,7.188076522433534,0.01758451700732176,0.5,TPESampler,COMPLETE
1786,0.16334780964041654,2025-04-24 22:17:35.450845,2025-04-24 22:17:50.608188,0 days 00:00:15.157343,0.569735936178009,RBF,142.86820115403637,0.8111609077713479,2.5,TPESampler,COMPLETE
1787,0.16334781268122658,2025-04-24 22:17:38.289302,2025-04-24 22:17:49.074669,0 days 00:00:10.785367,0.2867652748355211,RBF,0.7724064927158685,0.010637424026743695,0.5,TPESampler,COMPLETE
1788,0.8703401321666396,2025-04-24 22:17:38.646345,2025-04-24 22:17:50.606699,0 days 00:00:11.960354,0.003191727066487967,RBF,0.16108338368677463,1.6110274900372817e-08,0.5,TPESampler,COMPLETE
1789,0.1633477033142318,2025-04-24 22:17:50.222615,2025-04-24 22:17:56.508742,0 days 00:00:06.286127,1.2111264871051293,RBF,4.04009251322841,0.09764002285143174,2.5,TPESampler,COMPLETE
1790,0.163347809042093,2025-04-24 22:17:50.947301,2025-04-24 22:17:57.374397,0 days 00:00:06.427096,0.03303657825435115,RBF,26.210445578250287,0.11679168038928718,0.5,TPESampler,COMPLETE
1791,0.16334786430000595,2025-04-24 22:17:50.998620,2025-04-24 22:17:56.610341,0 days 00:00:05.611721,654.3305161363268,RBF,6.763045029141839,0.0006938072721079965,2.5,TPESampler,COMPLETE
1792,0.8703401340192994,2025-04-24 22:17:56.718193,2025-04-24 22:18:10.189103,0 days 00:00:13.470910,0.3291433975557606,RBF,3113.7476972361173,0.05027641397758973,0.5,TPESampler,COMPLETE
1793,0.16334780916165367,2025-04-24 22:17:56.877061,2025-04-24 22:18:04.025895,0 days 00:00:07.148834,0.13118977337998297,RBF,13.682152629652316,0.13160128166206717,2.5,TPESampler,COMPLETE
1794,0.8703401340222595,2025-04-24 22:17:57.629694,2025-04-24 22:18:14.817188,0 days 00:00:17.187494,2.550893643609498e-07,Matern,35792.06313730528,1.6896796624704053e-09,1.5,TPESampler,COMPLETE
1795,0.16334777986559515,2025-04-24 22:18:04.296156,2025-04-24 22:18:10.314786,0 days 00:00:06.018630,0.1146064972340551,RBF,7.066160771716729,0.10250903007556324,0.5,TPESampler,COMPLETE
1796,0.1633478296282614,2025-04-24 22:18:10.398052,2025-04-24 22:18:17.148378,0 days 00:00:06.750326,0.9472670402083031,RBF,157.88313097353844,0.839226290538454,0.5,TPESampler,COMPLETE
1797,0.16334785257658252,2025-04-24 22:18:10.558413,2025-04-24 22:18:15.942974,0 days 00:00:05.384561,29.567317146225708,RBF,30.851326928965857,0.2722690360207513,0.5,TPESampler,COMPLETE
1798,0.21977494794884314,2025-04-24 22:18:15.084975,2025-04-24 22:18:21.565151,0 days 00:00:06.480176,4.348119408669401,Matern,3.711438602647685,0.0001386532185076833,0.5,TPESampler,COMPLETE
1799,0.16334781698041043,2025-04-24 22:18:16.245960,2025-04-24 22:18:22.991332,0 days 00:00:06.745372,0.017744477594085876,RBF,0.393870894713596,0.058479480250591555,2.5,TPESampler,COMPLETE
1800,0.16334780293096954,2025-04-24 22:18:17.439783,2025-04-24 22:18:24.263594,0 days 00:00:06.823811,0.10071278031283208,RBF,91.05485096875177,0.05894936719982266,2.5,TPESampler,COMPLETE
1801,0.1633478184721794,2025-04-24 22:18:21.872815,2025-04-24 22:18:28.951552,0 days 00:00:07.078737,5.800833484727082,RBF,8.674040096752513,0.010513143535826582,0.5,TPESampler,COMPLETE
1802,0.16334781051065966,2025-04-24 22:18:23.317497,2025-04-24 22:18:29.868640,0 days 00:00:06.551143,0.28574286050554376,RBF,1.312403913264933,0.2199455534003574,2.5,TPESampler,COMPLETE
1803,0.16334781110251728,2025-04-24 22:18:24.600003,2025-04-24 22:18:32.077468,0 days 00:00:07.477465,1.927406109859847,RBF,13.1612004309405,0.05828625605302445,0.5,TPESampler,COMPLETE
1804,0.9015388695534409,2025-04-24 22:18:29.261573,2025-04-24 22:18:33.493805,0 days 00:00:04.232232,3.750715414868488e-05,RBF,66.30802211818333,0.00036692478356140643,0.5,TPESampler,COMPLETE
1805,0.9015779733711732,2025-04-24 22:18:30.098855,2025-04-24 22:18:37.923186,0 days 00:00:07.824331,0.022747133127082594,RBF,4894.299099521895,0.08815494344216666,0.5,TPESampler,COMPLETE
1806,0.16334783334069244,2025-04-24 22:18:32.369940,2025-04-24 22:18:43.886890,0 days 00:00:11.516950,63.77371745836599,RBF,32.787940445667836,0.7381819729553024,0.5,TPESampler,COMPLETE
1807,0.8703401340189673,2025-04-24 22:18:33.791800,2025-04-24 22:18:43.302601,0 days 00:00:09.510801,2.446494458318625,RBF,0.12834017766197903,0.06430283171016572,2.5,TPESampler,COMPLETE
1808,0.8703401339927085,2025-04-24 22:18:38.416471,2025-04-24 22:18:54.499725,0 days 00:00:16.083254,0.14578649512479014,RBF,0.1463380185542917,0.0490638193695941,2.5,TPESampler,COMPLETE
1809,0.16334780217329875,2025-04-24 22:18:43.961765,2025-04-24 22:18:55.811109,0 days 00:00:11.849344,57.210149869910126,RBF,13.041882328059067,0.3635818530906606,2.5,TPESampler,COMPLETE
1810,0.21977494812438653,2025-04-24 22:18:44.449396,2025-04-24 22:18:58.838426,0 days 00:00:14.389030,2.6230266482921396e-07,Matern,2.934085447082434,1.3847246123656948e-05,0.5,TPESampler,COMPLETE
1811,0.46796296754516536,2025-04-24 22:18:54.750345,2025-04-24 22:19:07.830516,0 days 00:00:13.080171,4.0243060327490765,RBF,8681.651294627996,0.9516861497491942,0.5,TPESampler,COMPLETE
1812,0.16334780007569863,2025-04-24 22:18:56.055175,2025-04-24 22:19:01.659506,0 days 00:00:05.604331,0.34482169646829824,RBF,0.4095462888081201,0.6176502506899914,2.5,TPESampler,COMPLETE
1813,0.16334778074580614,2025-04-24 22:18:59.138439,2025-04-24 22:19:05.315753,0 days 00:00:06.177314,0.05893507859220171,RBF,0.8131201140593844,0.3577479336848846,0.5,TPESampler,COMPLETE
1814,0.8703401340211393,2025-04-24 22:19:01.982668,2025-04-24 22:19:07.826902,0 days 00:00:05.844234,0.5031370462223919,RBF,0.0013325458233994767,0.463180678464702,2.5,TPESampler,COMPLETE
1815,0.1633477715703381,2025-04-24 22:19:05.598435,2025-04-24 22:19:12.779621,0 days 00:00:07.181186,0.09406863416375871,RBF,9.364239346716321,0.6134452630164314,0.5,TPESampler,COMPLETE
1816,0.1633479188832187,2025-04-24 22:19:08.022819,2025-04-24 22:19:14.811699,0 days 00:00:06.788880,0.33035501089633185,RBF,8.125305065315741,0.7339478115911294,2.5,TPESampler,COMPLETE
1817,0.9015771955343116,2025-04-24 22:19:08.109231,2025-04-24 22:19:12.470571,0 days 00:00:04.361340,1305.1596113294115,Matern,0.002775994875469559,5.355466030761931e-08,1.5,TPESampler,COMPLETE
1818,0.16334780945985228,2025-04-24 22:19:12.738223,2025-04-24 22:19:21.685405,0 days 00:00:08.947182,0.37377470016901004,RBF,843.2024967390505,0.1053116603169157,0.5,TPESampler,COMPLETE
1819,0.9015771955345242,2025-04-24 22:19:13.122156,2025-04-24 22:19:17.222486,0 days 00:00:04.100330,70.4733300224305,RBF,2.891425595356142e-05,2.497743394649643e-10,0.5,TPESampler,COMPLETE
1820,0.16334779276890404,2025-04-24 22:19:15.160114,2025-04-24 22:19:22.000141,0 days 00:00:06.840027,3.234712759357804,RBF,84.17598316798983,0.43797188909989543,0.5,TPESampler,COMPLETE
1821,0.16334782225757669,2025-04-24 22:19:17.528003,2025-04-24 22:19:26.740885,0 days 00:00:09.212882,0.23856284267001565,RBF,186.45217226037957,0.08565703914115096,0.5,TPESampler,COMPLETE
1822,0.16334780885426087,2025-04-24 22:19:21.953967,2025-04-24 22:19:32.196653,0 days 00:00:10.242686,0.0030390060326072727,RBF,129.49694806022657,0.22826259182814687,0.5,TPESampler,COMPLETE
1823,0.16334780899486265,2025-04-24 22:19:22.260078,2025-04-24 22:19:29.511029,0 days 00:00:07.250951,0.8873652378487025,RBF,12.84701802207199,0.9647707104358207,0.5,TPESampler,COMPLETE
1824,0.16334780564486695,2025-04-24 22:19:27.028550,2025-04-24 22:19:39.448896,0 days 00:00:12.420346,1.073372814662823,RBF,5.759860757860692,0.027900906024576382,2.5,TPESampler,COMPLETE
1825,0.8703400953326919,2025-04-24 22:19:29.812460,2025-04-24 22:19:37.755788,0 days 00:00:07.943328,0.7342476999835882,RBF,0.1759453988029019,0.02324592046079575,1.5,TPESampler,COMPLETE
1826,0.1633477937807068,2025-04-24 22:19:32.748367,2025-04-24 22:19:42.423314,0 days 00:00:09.674947,22.42270248900855,RBF,0.33165274776895814,0.08757362569922694,2.5,TPESampler,COMPLETE
1827,0.16334780203175797,2025-04-24 22:19:38.021999,2025-04-24 22:19:48.352270,0 days 00:00:10.330271,0.04860702682504759,RBF,0.27249837229831064,0.0014775683515599605,2.5,TPESampler,COMPLETE
1828,0.16334778524777158,2025-04-24 22:19:39.754561,2025-04-24 22:19:47.773776,0 days 00:00:08.019215,0.0008773403007071647,RBF,26.504162330981785,0.07098788813438278,2.5,TPESampler,COMPLETE
1829,0.8703401340208811,2025-04-24 22:19:42.681692,2025-04-24 22:19:49.288653,0 days 00:00:06.606961,3920.5705369917655,RBF,2.8529281582311793e-05,0.0009257836931482626,0.5,TPESampler,COMPLETE
1830,0.8703401340397773,2025-04-24 22:19:48.068996,2025-04-24 22:19:57.084960,0 days 00:00:09.015964,0.11668292610954288,Matern,580.8788360513926,0.008811307447103267,2.5,TPESampler,COMPLETE
1831,0.8703401340213853,2025-04-24 22:19:48.617746,2025-04-24 22:19:57.173998,0 days 00:00:08.556252,0.005606947954153338,RBF,18.35884590498436,0.0024946683347674987,0.5,TPESampler,COMPLETE
1832,0.16334764229819432,2025-04-24 22:19:49.557647,2025-04-24 22:19:55.361384,0 days 00:00:05.803737,3.922276067676817,RBF,1.110618809218571,0.08827752392104324,2.5,TPESampler,COMPLETE
1833,0.1633481402256543,2025-04-24 22:19:55.663318,2025-04-24 22:20:07.214835,0 days 00:00:11.551517,1.6608727772691179,RBF,1.015424661473747,0.9849749309520389,2.5,TPESampler,COMPLETE
1834,0.16334779368887212,2025-04-24 22:19:57.279988,2025-04-24 22:20:16.135093,0 days 00:00:18.855105,0.01828580276224083,RBF,638.0718764195524,0.47187068687711853,0.5,TPESampler,COMPLETE
1835,0.8703401341008301,2025-04-24 22:19:57.319181,2025-04-24 22:20:07.944568,0 days 00:00:10.625387,0.018611056799209307,RBF,19.02377967556295,0.030531636979794406,2.5,TPESampler,COMPLETE
1836,0.16334781588078254,2025-04-24 22:20:07.467704,2025-04-24 22:20:18.393378,0 days 00:00:10.925674,59.98360931478169,RBF,0.2555735335191336,0.5429495761231088,2.5,TPESampler,COMPLETE
1837,0.1633478165883655,2025-04-24 22:20:08.179785,2025-04-24 22:20:13.528118,0 days 00:00:05.348333,25.242028155079815,RBF,38.50545118201242,0.1144281474519269,2.5,TPESampler,COMPLETE
1838,0.870340134021209,2025-04-24 22:20:13.831196,2025-04-24 22:20:17.831306,0 days 00:00:04.000110,0.8158962142039966,RBF,0.007887382858122486,0.01089823250719989,2.5,TPESampler,COMPLETE
1839,0.1633477969850724,2025-04-24 22:20:16.441849,2025-04-24 22:20:23.414571,0 days 00:00:06.972722,0.5657476618885485,RBF,1.2815913219253667,0.02438845319312406,2.5,TPESampler,COMPLETE
1840,0.16344312161856736,2025-04-24 22:20:18.130218,2025-04-24 22:20:25.826916,0 days 00:00:07.696698,0.027534806101587133,Matern,3.1570023034672876,0.12398132634254483,2.5,TPESampler,COMPLETE
1841,0.1633478123714152,2025-04-24 22:20:18.631673,2025-04-24 22:20:29.260405,0 days 00:00:10.628732,0.01193867782366991,RBF,236.7478549283667,0.6269866956810566,0.5,TPESampler,COMPLETE
1842,0.870340134021184,2025-04-24 22:20:23.684385,2025-04-24 22:20:27.832702,0 days 00:00:04.148317,21508.609732177363,RBF,1.6334262252810617e-05,0.006648661005886836,1.5,TPESampler,COMPLETE
1843,0.8703401340257242,2025-04-24 22:20:26.120636,2025-04-24 22:20:37.601008,0 days 00:00:11.480372,0.0019414871752119233,RBF,0.03173994166683854,0.8156591265399856,2.5,TPESampler,COMPLETE
1844,0.1633478006295301,2025-04-24 22:20:28.140337,2025-04-24 22:20:34.740321,0 days 00:00:06.599984,0.15914188985475816,RBF,1.4543406877631813,0.006823694056842204,2.5,TPESampler,COMPLETE
1845,0.8703401340196957,2025-04-24 22:20:29.543827,2025-04-24 22:20:33.888414,0 days 00:00:04.344587,83.25706219094718,RBF,0.0932384462669087,0.9292156115735666,2.5,TPESampler,COMPLETE
1846,0.16334780915522906,2025-04-24 22:20:34.147914,2025-04-24 22:20:43.780472,0 days 00:00:09.632558,9.919952962335136,RBF,0.6483102980434422,0.01992566934634481,2.5,TPESampler,COMPLETE
1847,0.16334786506070934,2025-04-24 22:20:35.007062,2025-04-24 22:20:43.781956,0 days 00:00:08.774894,7.636038037668944,RBF,1.7017743414352553,0.04839190437091465,2.5,TPESampler,COMPLETE
1848,0.8703401340202744,2025-04-24 22:20:37.901854,2025-04-24 22:20:45.047944,0 days 00:00:07.146090,4.023032270014657,RBF,0.10808563896270947,0.04473898345886287,2.5,TPESampler,COMPLETE
1849,0.8703401340177599,2025-04-24 22:20:44.146443,2025-04-24 22:20:49.311967,0 days 00:00:05.165524,0.08053020274559312,RBF,2.1816682223076116,0.006558526890308722,2.5,TPESampler,COMPLETE
