number,value,datetime_start,datetime_complete,duration,params_constant_value,params_kernel_type,params_length_scale,params_noise_level,params_nu,system_attrs_auto:sampler,state
1620,0.16334781404424334,2025-04-24 22:09:50.140486,2025-04-24 22:09:59.651276,0 days 00:00:09.510790,20.867345515311097,RBF,431.58727956525195,0.8935570593783059,0.5,TPESampler,COMPLETE
1621,0.8703401340202019,2025-04-24 22:09:50.830337,2025-04-24 22:09:58.935582,0 days 00:00:08.105245,10415.584219312716,RBF,17.662494873279396,5.324244855784825e-05,2.5,TPESampler,COMPLETE
1622,0.8703401339660365,2025-04-24 22:09:50.882427,2025-04-24 22:09:59.629863,0 days 00:00:08.747436,0.05629970322484681,RBF,1.9422471857978834,0.010811523224018856,2.5,TPESampler,COMPLETE
1623,0.1633478139488439,2025-04-24 22:09:59.596383,2025-04-24 22:10:06.007438,0 days 00:00:06.411055,0.002227612267515204,RBF,1.6344635384567632,0.07606472188425649,1.5,TPESampler,COMPLETE
1624,0.8703401340197232,2025-04-24 22:09:59.814119,2025-04-24 22:10:09.685724,0 days 00:00:09.871605,3.918847574876773,RBF,31291.820995057915,0.0031900375757372705,1.5,TPESampler,COMPLETE
1625,0.1633477487742222,2025-04-24 22:09:59.911890,2025-04-24 22:10:07.747770,0 days 00:00:07.835880,99.07714372106491,RBF,0.8491549831010453,0.0018284875207555276,2.5,TPESampler,COMPLETE
1626,0.1633478125519886,2025-04-24 22:10:06.293225,2025-04-24 22:10:10.782542,0 days 00:00:04.489317,24.616092403020794,RBF,7.635007646935644,0.012867073500183752,2.5,TPESampler,COMPLETE
1627,0.8703401340189002,2025-04-24 22:10:08.033209,2025-04-24 22:10:12.328273,0 days 00:00:04.295064,98.00483528599533,RBF,0.035264441602376316,0.0005715639790479525,2.5,TPESampler,COMPLETE
1628,0.16334784893078724,2025-04-24 22:10:09.981803,2025-04-24 22:10:18.088180,0 days 00:00:08.106377,2064.148791032482,RBF,1.3056267811175335,0.07508088728594278,2.5,TPESampler,COMPLETE
1629,0.8703401340222724,2025-04-24 22:10:11.082997,2025-04-24 22:10:18.698055,0 days 00:00:07.615058,2877.359010253811,RBF,0.10923269756058909,0.0009925605314813888,2.5,TPESampler,COMPLETE
1630,0.9015779748895197,2025-04-24 22:10:12.962666,2025-04-24 22:10:22.214002,0 days 00:00:09.251336,7.466938151263328e-05,Matern,54218.519224834024,0.0432562138007537,2.5,TPESampler,COMPLETE
1631,0.8703401340051002,2025-04-24 22:10:18.588326,2025-04-24 22:10:24.155233,0 days 00:00:05.566907,666.3563143712391,RBF,0.005310793743708914,0.0034619076782771824,2.5,TPESampler,COMPLETE
1632,0.8703401340214985,2025-04-24 22:10:19.061589,2025-04-24 22:10:24.164684,0 days 00:00:05.103095,59.79866439029034,RBF,25.09889588217919,3.280697781171015e-07,1.5,TPESampler,COMPLETE
1633,0.16334783441837689,2025-04-24 22:10:22.515394,2025-04-24 22:10:41.704843,0 days 00:00:19.189449,0.569538083689272,RBF,11.54524763993172,0.9398166052152228,0.5,TPESampler,COMPLETE
1634,0.8703401340135146,2025-04-24 22:10:24.354707,2025-04-24 22:10:37.879930,0 days 00:00:13.525223,0.43050572037279017,RBF,0.14247632569601293,0.0016647571248553446,2.5,TPESampler,COMPLETE
1635,0.8703401340136913,2025-04-24 22:10:24.392814,2025-04-24 22:10:38.982956,0 days 00:00:14.590142,6.435107760544614,RBF,0.14221253265593414,0.001180788760445303,2.5,TPESampler,COMPLETE
1636,0.1634431217552197,2025-04-24 22:10:38.589794,2025-04-24 22:10:46.493024,0 days 00:00:07.903230,0.0024318820923203486,Matern,0.9093133177177328,0.21385932250670844,2.5,TPESampler,COMPLETE
1637,0.1633478237281134,2025-04-24 22:10:39.224982,2025-04-24 22:10:46.397617,0 days 00:00:07.172635,189.56223906227112,RBF,21.195183497814966,0.001071461036157999,2.5,TPESampler,COMPLETE
1638,0.8703401340326248,2025-04-24 22:10:42.012280,2025-04-24 22:10:46.372276,0 days 00:00:04.359996,19.34667922980059,RBF,0.004683248604788363,0.00484468143337141,2.5,TPESampler,COMPLETE
1639,0.870340133972954,2025-04-24 22:10:46.522037,2025-04-24 22:10:56.226090,0 days 00:00:09.704053,62701.66989542839,RBF,98891.13834959746,4.212601103886616e-08,0.5,TPESampler,COMPLETE
1640,0.9015771955343257,2025-04-24 22:10:46.572489,2025-04-24 22:10:50.932302,0 days 00:00:04.359813,778.2534856869155,RBF,0.055042908300711194,1.083791702832858e-05,2.5,TPESampler,COMPLETE
1641,0.16334780820925038,2025-04-24 22:10:46.701009,2025-04-24 22:10:58.972409,0 days 00:00:12.271400,47.700090379803385,RBF,0.25004575882743246,0.005474157536339489,2.5,TPESampler,COMPLETE
1642,0.901577195535111,2025-04-24 22:10:51.224453,2025-04-24 22:10:55.901215,0 days 00:00:04.676762,292.866197810218,Matern,0.004955922077648387,8.811691455228127e-07,0.5,TPESampler,COMPLETE
1643,0.8703401340215193,2025-04-24 22:10:56.177546,2025-04-24 22:11:07.640171,0 days 00:00:11.462625,3.2600479789116026e-06,Matern,5.24658946043259e-05,3.229490349052854e-09,1.5,TPESampler,COMPLETE
1644,0.8703401340204422,2025-04-24 22:10:56.539908,2025-04-24 22:11:01.083540,0 days 00:00:04.543632,735.9579978422639,RBF,0.02062808791808168,0.008863963297060585,2.5,TPESampler,COMPLETE
1645,0.1633478125241717,2025-04-24 22:10:59.223786,2025-04-24 22:11:11.724945,0 days 00:00:12.501159,273.7537528235969,RBF,2.8647434523670925,0.0007831759086741987,2.5,TPESampler,COMPLETE
1646,0.87034013392745,2025-04-24 22:11:01.334928,2025-04-24 22:11:11.510978,0 days 00:00:10.176050,13.31620838248128,RBF,0.1502570018665851,0.0008996085441225443,2.5,TPESampler,COMPLETE
1647,0.16334780406797433,2025-04-24 22:11:08.326353,2025-04-24 22:11:16.383807,0 days 00:00:08.057454,39.95147271421757,RBF,0.5621703724391498,0.004426526971783927,2.5,TPESampler,COMPLETE
1648,0.16334780767865162,2025-04-24 22:11:11.726951,2025-04-24 22:11:17.840039,0 days 00:00:06.113088,246.237526245504,RBF,8.965607309449506,0.00034088712536394357,2.5,TPESampler,COMPLETE
1649,0.16334780973938115,2025-04-24 22:11:11.985796,2025-04-24 22:11:17.302995,0 days 00:00:05.317199,643.0380678213289,RBF,3.883242403422488,0.014210433391001233,2.5,TPESampler,COMPLETE
1650,0.16334781972336856,2025-04-24 22:11:16.630350,2025-04-24 22:11:24.110380,0 days 00:00:07.480030,3.9636414107698026,RBF,1.2844768243209737,0.0003041904274382646,2.5,TPESampler,COMPLETE
1651,0.16334781449888494,2025-04-24 22:11:17.577153,2025-04-24 22:11:24.624555,0 days 00:00:07.047402,9.256465255813852,RBF,5.445613660258898,0.00020566173735881913,2.5,TPESampler,COMPLETE
1652,0.8703401340212998,2025-04-24 22:11:18.117292,2025-04-24 22:11:27.565926,0 days 00:00:09.448634,0.05484769855777506,RBF,16.42396132374221,0.0008587972692575556,1.5,TPESampler,COMPLETE
1653,0.870340134035809,2025-04-24 22:11:24.368412,2025-04-24 22:11:37.747514,0 days 00:00:13.379102,0.17707752017226538,RBF,0.0798536026986678,5.002769339885436e-06,2.5,TPESampler,COMPLETE
1654,0.16334780865607398,2025-04-24 22:11:24.901218,2025-04-24 22:11:36.109207,0 days 00:00:11.207989,23009.385410304414,RBF,0.4313829907151235,0.00021814890440200607,2.5,TPESampler,COMPLETE
1655,0.8703401340211999,2025-04-24 22:11:27.960433,2025-04-24 22:11:36.824473,0 days 00:00:08.864040,0.6193133204129772,RBF,16.875999524521866,0.001488740268021709,2.5,TPESampler,COMPLETE
1656,0.8703401339983216,2025-04-24 22:11:36.466471,2025-04-24 22:11:41.679469,0 days 00:00:05.212998,0.37044039738520784,RBF,0.07061448587989304,5.377309172914058e-05,0.5,TPESampler,COMPLETE
1657,0.16334781335342158,2025-04-24 22:11:37.357000,2025-04-24 22:11:45.250004,0 days 00:00:07.893004,2164.4795555905703,RBF,24.299297465082358,0.00018770114794520605,2.5,TPESampler,COMPLETE
1658,0.1633478078445068,2025-04-24 22:11:38.063760,2025-04-24 22:11:43.604096,0 days 00:00:05.540336,11.643613792639274,RBF,14.41345266714526,0.01657254854526886,2.5,TPESampler,COMPLETE
1659,0.16334778771545627,2025-04-24 22:11:41.946547,2025-04-24 22:11:50.870953,0 days 00:00:08.924406,0.6076202653004422,RBF,386.2166252058206,0.8527462448970237,2.5,TPESampler,COMPLETE
1660,0.16334778195245647,2025-04-24 22:11:43.842729,2025-04-24 22:11:51.012233,0 days 00:00:07.169504,0.15963298600234008,RBF,37.64934270011078,0.2294010531312093,0.5,TPESampler,COMPLETE
1661,0.16334783916831383,2025-04-24 22:11:45.579980,2025-04-24 22:11:51.429897,0 days 00:00:05.849917,2834.006306945076,RBF,0.9109503574333301,0.00030987611969114453,2.5,TPESampler,COMPLETE
1662,0.16334781185767214,2025-04-24 22:11:51.076499,2025-04-24 22:11:59.908665,0 days 00:00:08.832166,12481.883374923564,RBF,1.037720319514739,0.009036539231095635,2.5,TPESampler,COMPLETE
1663,0.8703401340189242,2025-04-24 22:11:51.282718,2025-04-24 22:12:11.571966,0 days 00:00:20.289248,0.00044987391058434154,RBF,0.1081909631458833,0.8138003737096308,2.5,TPESampler,COMPLETE
1664,0.16334782732444625,2025-04-24 22:11:51.738219,2025-04-24 22:11:59.535853,0 days 00:00:07.797634,213.30637027427903,RBF,9.116087588554883,0.04304469027967473,2.5,TPESampler,COMPLETE
1665,0.16334780916392186,2025-04-24 22:11:59.928465,2025-04-24 22:12:15.350903,0 days 00:00:15.422438,1.608465158884921,RBF,0.6301914504066982,0.9842065361618878,2.5,TPESampler,COMPLETE
1666,0.16344302599219324,2025-04-24 22:12:00.315909,2025-04-24 22:12:12.597371,0 days 00:00:12.281462,31735.168809875537,Matern,5.254982504411343,4.8457791504432295e-05,2.5,TPESampler,COMPLETE
1667,0.8703401338365266,2025-04-24 22:12:11.802331,2025-04-24 22:12:26.968402,0 days 00:00:15.166071,1133.4996120760632,RBF,0.1519303972816022,3.811267811995163e-05,2.5,TPESampler,COMPLETE
1668,0.8703401339342933,2025-04-24 22:12:13.813705,2025-04-24 22:12:26.964649,0 days 00:00:13.150944,69.93355320531586,RBF,0.11209520159010662,0.020214277500067337,2.5,TPESampler,COMPLETE
1669,0.8703401340145651,2025-04-24 22:12:16.148102,2025-04-24 22:12:33.497926,0 days 00:00:17.349824,2.035646575242558,RBF,55.16923878433221,0.0034143080424046354,0.5,TPESampler,COMPLETE
1670,0.16334781006133398,2025-04-24 22:12:27.179906,2025-04-24 22:12:33.359266,0 days 00:00:06.179360,0.12488677476387493,RBF,3.8185749008966314,0.813132904234698,2.5,TPESampler,COMPLETE
1671,0.16334780522064846,2025-04-24 22:12:27.227357,2025-04-24 22:12:32.405259,0 days 00:00:05.177902,12.492216150662296,RBF,6.830053576119066,0.037034670812435264,2.5,TPESampler,COMPLETE
1672,0.16334773175649553,2025-04-24 22:12:32.675994,2025-04-24 22:12:38.736167,0 days 00:00:06.060173,64.97345621635948,RBF,3.3296862777849605,0.003976940069718759,2.5,TPESampler,COMPLETE
1673,0.16334780715993155,2025-04-24 22:12:33.580764,2025-04-24 22:12:41.514992,0 days 00:00:07.934228,0.5766825968133095,RBF,0.2670668270688512,0.008809841899374575,2.5,TPESampler,COMPLETE
1674,0.8703401340212904,2025-04-24 22:12:33.750856,2025-04-24 22:12:43.306041,0 days 00:00:09.555185,0.007290810003888007,RBF,33.52480564371918,0.010995661797873,2.5,TPESampler,COMPLETE
1675,0.8703401339422124,2025-04-24 22:12:38.988574,2025-04-24 22:12:43.222087,0 days 00:00:04.233513,132.38594727703958,RBF,0.08527835440560019,0.00032511846359365885,0.5,TPESampler,COMPLETE
1676,0.8703401340210896,2025-04-24 22:12:41.836264,2025-04-24 22:12:49.784311,0 days 00:00:07.948047,0.6061799875032062,Matern,0.0005434390092078282,4.0206160691440156e-08,2.5,TPESampler,COMPLETE
1677,0.8703401340338258,2025-04-24 22:12:43.432295,2025-04-24 22:12:49.960518,0 days 00:00:06.528223,341.8695304369906,RBF,53.532433613157835,2.8829495414119407e-05,2.5,TPESampler,COMPLETE
1678,0.8703401340204424,2025-04-24 22:12:43.552301,2025-04-24 22:12:55.326771,0 days 00:00:11.774470,0.004824480430435531,RBF,35797.40605411233,8.52765662791105e-06,2.5,TPESampler,COMPLETE
1679,0.8703401340651001,2025-04-24 22:12:50.026592,2025-04-24 22:12:55.349963,0 days 00:00:05.323371,26.28618940475567,RBF,226.28864715609728,0.000224426878972643,2.5,TPESampler,COMPLETE
1680,0.16334780698391527,2025-04-24 22:12:50.173488,2025-04-24 22:12:54.988015,0 days 00:00:04.814527,24.222100166081336,RBF,18.289322151920572,0.06745276538041226,2.5,TPESampler,COMPLETE
1681,0.16334780936949,2025-04-24 22:12:55.276562,2025-04-24 22:13:01.691603,0 days 00:00:06.415041,0.5991988727976343,RBF,462.31724372096886,0.4008325305073807,0.5,TPESampler,COMPLETE
1682,0.16334781153194444,2025-04-24 22:12:55.559819,2025-04-24 22:13:01.633531,0 days 00:00:06.073712,28.232496662222328,RBF,12.961521402372112,0.7405988814625977,0.5,TPESampler,COMPLETE
1683,0.16334781060608167,2025-04-24 22:12:55.626324,2025-04-24 22:13:00.534290,0 days 00:00:04.907966,62.48561976238404,RBF,17.98474684762473,0.008816642342808122,2.5,TPESampler,COMPLETE
1684,0.8703401340198299,2025-04-24 22:13:00.834138,2025-04-24 22:13:08.448858,0 days 00:00:07.614720,8.181459138899537,RBF,17.40876663735885,0.0015825640503157824,2.5,TPESampler,COMPLETE
1685,0.16334782899077438,2025-04-24 22:13:01.821497,2025-04-24 22:13:10.109207,0 days 00:00:08.287710,1935.8037566154874,RBF,6.725476351965595,0.004293908554911781,2.5,TPESampler,COMPLETE
1686,0.16334782449399343,2025-04-24 22:13:01.969478,2025-04-24 22:13:10.199684,0 days 00:00:08.230206,43.988816968376334,RBF,8.425986493064299,0.000489524015438945,2.5,TPESampler,COMPLETE
1687,0.16334778456656612,2025-04-24 22:13:08.721803,2025-04-24 22:13:18.002783,0 days 00:00:09.280980,1.690664341579971,RBF,1.786039955825088,5.6091922274879496e-05,1.5,TPESampler,COMPLETE
1688,0.8703401340181222,2025-04-24 22:13:10.283322,2025-04-24 22:13:19.982778,0 days 00:00:09.699456,0.20240050939561768,RBF,12.737705314660573,0.012650311843328139,2.5,TPESampler,COMPLETE
1689,0.1633478092270235,2025-04-24 22:13:10.472648,2025-04-24 22:13:20.122847,0 days 00:00:09.650199,2.156959809604611,RBF,0.6486165101604866,2.6165009239653413e-05,0.5,TPESampler,COMPLETE
1690,0.1633478033565768,2025-04-24 22:13:18.295536,2025-04-24 22:13:30.768460,0 days 00:00:12.472924,1327.406616242572,RBF,4.994184441929879,0.000166926683810302,1.5,TPESampler,COMPLETE
1691,0.8703401340215986,2025-04-24 22:13:20.197081,2025-04-24 22:13:29.585179,0 days 00:00:09.388098,14.450353265525683,RBF,160.0477926250142,2.3160004613110348e-05,1.5,TPESampler,COMPLETE
1692,0.8703401340217886,2025-04-24 22:13:20.403077,2025-04-24 22:13:25.425456,0 days 00:00:05.022379,22398.266572022403,RBF,200.14826045878897,2.7776750412933215e-05,2.5,TPESampler,COMPLETE
1693,0.1633478095906908,2025-04-24 22:13:25.728319,2025-04-24 22:13:32.883052,0 days 00:00:07.154733,604.0382991122293,RBF,26.463404553165105,0.0013780829662721672,2.5,TPESampler,COMPLETE
1694,0.8703401340126443,2025-04-24 22:13:29.877901,2025-04-24 22:13:38.652944,0 days 00:00:08.775043,9.686747600806951,RBF,731.4190990244886,0.003270999215517837,1.5,TPESampler,COMPLETE
1695,0.16334780666753348,2025-04-24 22:13:31.028566,2025-04-24 22:13:38.981985,0 days 00:00:07.953419,15.842070658381822,RBF,7.504864314515245,0.8735829019216883,2.5,TPESampler,COMPLETE
1696,0.16334781469581783,2025-04-24 22:13:33.147625,2025-04-24 22:13:41.109913,0 days 00:00:07.962288,212.11516428457156,RBF,8.654600266610903,5.096882342293694e-05,1.5,TPESampler,COMPLETE
1697,0.16334780878069927,2025-04-24 22:13:38.917740,2025-04-24 22:13:46.453913,0 days 00:00:07.536173,2.1771931507105258,RBF,54.993784586540094,0.026558707929882852,2.5,TPESampler,COMPLETE
1698,0.16334780941502433,2025-04-24 22:13:39.251077,2025-04-24 22:13:45.334227,0 days 00:00:06.083150,0.3071754894400602,RBF,0.5779336672823403,0.029006034629699695,2.5,TPESampler,COMPLETE
1699,0.1633477873467781,2025-04-24 22:13:41.404115,2025-04-24 22:13:48.626567,0 days 00:00:07.222452,2563.848145626461,RBF,10.81880222318059,0.006769898682868562,2.5,TPESampler,COMPLETE
1700,0.8703401340220516,2025-04-24 22:13:45.637039,2025-04-24 22:13:51.503407,0 days 00:00:05.866368,115.4200960836235,Matern,0.015573592577602149,0.012272849470572682,2.5,TPESampler,COMPLETE
1701,0.16334780966123344,2025-04-24 22:13:46.907500,2025-04-24 22:13:57.506852,0 days 00:00:10.599352,27.601809451591624,RBF,3.297545877866151,0.5581608424981109,1.5,TPESampler,COMPLETE
1702,0.1635585149408201,2025-04-24 22:13:49.075296,2025-04-24 22:13:59.684175,0 days 00:00:10.608879,0.014153892731501186,Matern,1.312458302718214,1.257807566335541e-10,1.5,TPESampler,COMPLETE
1703,0.8703401340178589,2025-04-24 22:13:51.732324,2025-04-24 22:14:01.276346,0 days 00:00:09.544022,1.1716207565916616,RBF,1656.2802684863889,0.004358256611059275,0.5,TPESampler,COMPLETE
1704,0.1634431364083884,2025-04-24 22:13:57.808925,2025-04-24 22:14:05.199242,0 days 00:00:07.390317,465.22502465280246,Matern,2.8339236490115245,0.012186473423460522,2.5,TPESampler,COMPLETE
1705,0.1635584272343068,2025-04-24 22:13:59.948063,2025-04-24 22:14:07.370713,0 days 00:00:07.422650,2.315048868200007,Matern,3.124014897828081,0.003766272002553022,1.5,TPESampler,COMPLETE
1706,0.16334783955374696,2025-04-24 22:14:01.551788,2025-04-24 22:14:20.677260,0 days 00:00:19.125472,0.03653284863932686,RBF,0.5060170763687989,0.001024859230451341,0.5,TPESampler,COMPLETE
1707,0.8703401340201434,2025-04-24 22:14:05.506857,2025-04-24 22:14:18.654473,0 days 00:00:13.147616,0.18585993904114073,Matern,0.0332625456651506,0.37104384480519437,2.5,TPESampler,COMPLETE
1708,0.16334785724811945,2025-04-24 22:14:07.884749,2025-04-24 22:14:22.507521,0 days 00:00:14.622772,0.08014913972277368,RBF,173.73693702811178,0.6686083126434496,2.5,TPESampler,COMPLETE
1709,0.8703401340203516,2025-04-24 22:14:18.900458,2025-04-24 22:14:23.864160,0 days 00:00:04.963702,32.941156462329175,RBF,0.019879714724813143,0.06495229819039249,2.5,TPESampler,COMPLETE
1710,0.163347809815951,2025-04-24 22:14:21.019217,2025-04-24 22:14:27.667909,0 days 00:00:06.648692,12.529831253208803,RBF,9.83989910297423,0.004022923590451723,0.5,TPESampler,COMPLETE
1711,0.8703401340257418,2025-04-24 22:14:22.801444,2025-04-24 22:14:32.330857,0 days 00:00:09.529413,71511.98523681998,RBF,0.0011924488947138666,0.000254544415935435,2.5,TPESampler,COMPLETE
1712,0.16334782397453507,2025-04-24 22:14:24.167290,2025-04-24 22:14:34.308008,0 days 00:00:10.140718,8.480963474472711,RBF,7349.692033865729,0.889765631355821,0.5,TPESampler,COMPLETE
1713,0.16334780935007948,2025-04-24 22:14:27.931204,2025-04-24 22:14:34.234877,0 days 00:00:06.303673,128.04821394500792,RBF,1.4201387050592824,0.023550003138996294,2.5,TPESampler,COMPLETE
1714,0.8703401340199104,2025-04-24 22:14:32.626638,2025-04-24 22:14:41.818862,0 days 00:00:09.192224,0.0914754887002206,RBF,4.147769780903229,0.034501194819724586,2.5,TPESampler,COMPLETE
1715,0.1633478094167917,2025-04-24 22:14:34.670911,2025-04-24 22:14:42.474963,0 days 00:00:07.804052,1080.105240124675,RBF,41.18336063029912,0.05097879583404463,2.5,TPESampler,COMPLETE
1716,0.8703401340458166,2025-04-24 22:14:34.779968,2025-04-24 22:14:44.890426,0 days 00:00:10.110458,0.11428714943667466,RBF,0.02635223592395689,0.6765587994165657,2.5,TPESampler,COMPLETE
1717,0.16334779759620102,2025-04-24 22:14:42.077364,2025-04-24 22:14:47.538579,0 days 00:00:05.461215,1.4753879670799834,RBF,1.00397066225055,0.015951917922880657,2.5,TPESampler,COMPLETE
1718,0.1633477966156108,2025-04-24 22:14:42.762025,2025-04-24 22:14:49.925716,0 days 00:00:07.163691,12.012707127434656,RBF,1.0650703951855751,0.036312096116073424,1.5,TPESampler,COMPLETE
1719,0.8703401340232868,2025-04-24 22:14:45.193585,2025-04-24 22:14:50.386174,0 days 00:00:05.192589,259.2506171479527,RBF,0.05937795304041562,7.883394806051977e-05,1.5,TPESampler,COMPLETE
1720,0.16334782074766022,2025-04-24 22:14:47.827494,2025-04-24 22:14:56.760161,0 days 00:00:08.932667,0.4462410628736846,RBF,53.806180445858296,0.03869330432914284,1.5,TPESampler,COMPLETE
1721,0.1633478080861813,2025-04-24 22:14:50.216465,2025-04-24 22:14:55.865966,0 days 00:00:05.649501,88706.22984450693,RBF,56.474929670166055,0.7055439080736094,0.5,TPESampler,COMPLETE
1722,0.16334779603615834,2025-04-24 22:14:50.627789,2025-04-24 22:14:58.892272,0 days 00:00:08.264483,3.116417700712643,RBF,1.29652338434548,0.7716266416502692,2.5,TPESampler,COMPLETE
1723,0.16334781069182885,2025-04-24 22:14:56.159617,2025-04-24 22:15:05.742669,0 days 00:00:09.583052,0.006230589037617936,RBF,34.48138343581783,0.9254295741553967,2.5,TPESampler,COMPLETE
1724,0.16334781257099984,2025-04-24 22:14:57.056167,2025-04-24 22:15:02.558503,0 days 00:00:05.502336,82760.22897761052,RBF,3.1875919273015776,0.0007791929559095727,2.5,TPESampler,COMPLETE
1725,0.9015779710719437,2025-04-24 22:14:59.204224,2025-04-24 22:15:06.472191,0 days 00:00:07.267967,0.00010878755781273909,RBF,0.44500895186316247,0.010339374566810318,2.5,TPESampler,COMPLETE
1726,0.8703401340181334,2025-04-24 22:15:02.822383,2025-04-24 22:15:09.584980,0 days 00:00:06.762597,80473.33455969823,RBF,13.088264701800943,2.5919485221588383e-05,2.5,TPESampler,COMPLETE
1727,0.870340134037659,2025-04-24 22:15:06.010389,2025-04-24 22:15:15.075366,0 days 00:00:09.064977,1.3475649013530964,RBF,110.04120456164512,0.0018402536040527328,2.5,TPESampler,COMPLETE
1728,0.870340134020098,2025-04-24 22:15:06.732918,2025-04-24 22:15:11.065147,0 days 00:00:04.332229,0.08155403589902689,RBF,0.0007242827234457053,0.00018670255341836974,0.5,TPESampler,COMPLETE
1729,0.16334780953407035,2025-04-24 22:15:09.898869,2025-04-24 22:15:17.404121,0 days 00:00:07.505252,4.860162032964763,RBF,0.939008117884545,0.009783894364755968,0.5,TPESampler,COMPLETE
1730,0.1633478095733151,2025-04-24 22:15:11.327368,2025-04-24 22:15:16.674342,0 days 00:00:05.346974,1852.9085800975506,RBF,6.207569015769722,0.65649770010395,0.5,TPESampler,COMPLETE
1731,0.16334782910963888,2025-04-24 22:15:15.393274,2025-04-24 22:15:20.258916,0 days 00:00:04.865642,85.71194787611104,RBF,8.514424678017797,0.02670190198127252,2.5,TPESampler,COMPLETE
1732,0.16334780775474558,2025-04-24 22:15:16.920763,2025-04-24 22:15:22.931165,0 days 00:00:06.010402,126.87049667522874,RBF,949.4125648713049,0.7905200199630744,0.5,TPESampler,COMPLETE
1733,0.16334783540733896,2025-04-24 22:15:17.624581,2025-04-24 22:15:22.979849,0 days 00:00:05.355268,134.97209628210302,RBF,6.921447539842658,0.5066423768179696,2.5,TPESampler,COMPLETE
1734,0.8703401340208383,2025-04-24 22:15:20.568458,2025-04-24 22:15:35.058058,0 days 00:00:14.489600,2.064270500904497e-05,RBF,26.037494454877123,0.06249602772469955,0.5,TPESampler,COMPLETE
