number,value,datetime_start,datetime_complete,duration,params_constant_value,params_kernel_type,params_length_scale,params_noise_level,params_nu,system_attrs_auto:sampler,state
2198,0.16334780978971897,2025-04-24 22:35:32.864944,2025-04-24 22:35:38.216245,0 days 00:00:05.351301,74531.42153335281,RBF,50.32484509427242,0.3128710666417761,0.5,TPESampler,COMPLETE
2199,0.16334782164079056,2025-04-24 22:35:32.947654,2025-04-24 22:35:43.186328,0 days 00:00:10.238674,5175.043318076842,RBF,1.5425056047011576,0.0030967284651608707,0.5,TPESampler,COMPLETE
2200,0.901577974900538,2025-04-24 22:35:35.760953,2025-04-24 22:35:39.818809,0 days 00:00:04.057856,57526.65295269313,RBF,1.4788926051664655,1.5486616592454812e-05,0.5,TPESampler,COMPLETE
2201,0.16334779734065788,2025-04-24 22:35:38.473157,2025-04-24 22:35:44.337538,0 days 00:00:05.864381,159.3870443201613,RBF,0.4013812003755146,0.6887843276967341,0.5,TPESampler,COMPLETE
2202,0.1633477962409806,2025-04-24 22:35:40.123823,2025-04-24 22:35:46.105519,0 days 00:00:05.981696,43948.32783274185,RBF,1.7634145576458804,0.009594808570393161,0.5,TPESampler,COMPLETE
2203,0.8703401340172165,2025-04-24 22:35:43.476165,2025-04-24 22:35:52.361922,0 days 00:00:08.885757,6442.859374706161,RBF,8615.458393903764,0.024717354624218615,0.5,TPESampler,COMPLETE
2204,0.16334780872728139,2025-04-24 22:35:44.585785,2025-04-24 22:35:59.074625,0 days 00:00:14.488840,0.0028503586728199433,RBF,0.6824561991217459,0.01317177976612089,2.5,TPESampler,COMPLETE
2205,0.16334781879309485,2025-04-24 22:35:46.422323,2025-04-24 22:35:52.461777,0 days 00:00:06.039454,3295.4131318375103,RBF,367.826595154257,0.011770691353726142,0.5,TPESampler,COMPLETE
2206,0.8703401340063288,2025-04-24 22:35:52.618746,2025-04-24 22:35:59.710186,0 days 00:00:07.091440,1478.364634737057,RBF,0.11177181602043874,0.9746117497319631,0.5,TPESampler,COMPLETE
2207,0.8703401339762349,2025-04-24 22:35:52.734178,2025-04-24 22:36:00.949661,0 days 00:00:08.215483,0.003404912072511623,Matern,0.06590308017292223,4.260326801600846e-05,1.5,TPESampler,COMPLETE
2208,0.8878012709119939,2025-04-24 22:35:59.665302,2025-04-24 22:36:08.688941,0 days 00:00:09.023639,0.010853311319988889,RBF,0.024643126371908745,0.017126429935359525,2.5,TPESampler,COMPLETE
2209,0.21977494437522205,2025-04-24 22:36:00.067185,2025-04-24 22:36:04.585787,0 days 00:00:04.518602,0.03130435129472953,Matern,2.377670068913154,0.7671020655436328,0.5,TPESampler,COMPLETE
2210,0.16334780040101216,2025-04-24 22:36:01.253300,2025-04-24 22:36:11.734415,0 days 00:00:10.481115,0.010771982929707002,RBF,48.8970909730972,0.544776666257803,0.5,TPESampler,COMPLETE
2211,0.8703401340212256,2025-04-24 22:36:04.863820,2025-04-24 22:36:20.215179,0 days 00:00:15.351359,3.0038327668395276e-07,Matern,82.47563295639057,0.027199983562186163,0.5,TPESampler,COMPLETE
2212,0.9015771955343959,2025-04-24 22:36:08.986224,2025-04-24 22:36:16.004972,0 days 00:00:07.018748,168.2569756046555,RBF,0.10548657860857061,1.4487267014618187e-05,1.5,TPESampler,COMPLETE
2213,0.8703401340131407,2025-04-24 22:36:12.130863,2025-04-24 22:36:23.130459,0 days 00:00:10.999596,0.0047660081949340025,RBF,15.032013747439194,0.013513948248748924,2.5,TPESampler,COMPLETE
2214,0.16334780699419368,2025-04-24 22:36:16.274174,2025-04-24 22:36:22.434768,0 days 00:00:06.160594,11.8788743105845,RBF,2520.599424692794,0.2078301299525232,2.5,TPESampler,COMPLETE
2215,0.16334780950365657,2025-04-24 22:36:20.517194,2025-04-24 22:36:27.128646,0 days 00:00:06.611452,95176.50245992064,RBF,1.5391292319912417,0.00722450285833334,0.5,TPESampler,COMPLETE
2216,0.21977495155893018,2025-04-24 22:36:22.690936,2025-04-24 22:36:28.468098,0 days 00:00:05.777162,6.8356996304140525,Matern,111.91411928370105,0.13887985169031744,0.5,TPESampler,COMPLETE
2217,0.16334780769067025,2025-04-24 22:36:23.418978,2025-04-24 22:36:30.694778,0 days 00:00:07.275800,45435.8574476539,RBF,20454.536746954236,0.9303741584539813,0.5,TPESampler,COMPLETE
2218,0.16334789600080432,2025-04-24 22:36:27.375856,2025-04-24 22:36:33.631004,0 days 00:00:06.255148,128.34292269194023,RBF,6834.433690775162,0.6086145564684076,0.5,TPESampler,COMPLETE
2219,0.16334780883356775,2025-04-24 22:36:28.762770,2025-04-24 22:36:35.920927,0 days 00:00:07.158157,658.4000260358339,RBF,10207.359040181169,0.8583740413197829,0.5,TPESampler,COMPLETE
2220,0.1633478125552124,2025-04-24 22:36:31.002341,2025-04-24 22:36:35.892097,0 days 00:00:04.889756,893.5701325191536,RBF,2.404058344160052,0.44440772709953713,0.5,TPESampler,COMPLETE
2221,0.163347729216538,2025-04-24 22:36:33.929970,2025-04-24 22:36:39.562831,0 days 00:00:05.632861,1068.2871080597067,RBF,646.917508408126,0.4948380663039755,0.5,TPESampler,COMPLETE
2222,0.1633478034186462,2025-04-24 22:36:36.074929,2025-04-24 22:36:40.875205,0 days 00:00:04.800276,59920.79217276247,RBF,1.820329281005266,0.8012268224353732,0.5,TPESampler,COMPLETE
2223,0.16334777222140723,2025-04-24 22:36:36.118764,2025-04-24 22:36:41.559817,0 days 00:00:05.441053,1025.188583617103,RBF,4.504204584418036,0.8340969066445187,0.5,TPESampler,COMPLETE
2224,0.16334780876748178,2025-04-24 22:36:39.895250,2025-04-24 22:36:44.537487,0 days 00:00:04.642237,1057.8364051456965,RBF,19.641135973808037,0.025653290840255808,0.5,TPESampler,COMPLETE
2225,0.16334790621832004,2025-04-24 22:36:41.128937,2025-04-24 22:36:48.768948,0 days 00:00:07.640011,41616.81923031742,RBF,3442.9871341075163,0.07196670219912182,0.5,TPESampler,COMPLETE
2226,0.1633478055248086,2025-04-24 22:36:41.798932,2025-04-24 22:36:52.714965,0 days 00:00:10.916033,1327.6401107830643,RBF,33623.91670864801,0.946836471721266,0.5,TPESampler,COMPLETE
2227,0.8703401338753824,2025-04-24 22:36:44.842567,2025-04-24 22:36:50.921954,0 days 00:00:06.079387,210.95276378380126,RBF,21.40381088987836,9.287738896621026e-06,0.5,TPESampler,COMPLETE
2228,0.8703399929138605,2025-04-24 22:36:49.072459,2025-04-24 22:36:56.170442,0 days 00:00:07.097983,111.15049222539407,RBF,0.18343881677797624,0.0013309068729226896,0.5,TPESampler,COMPLETE
2229,0.1633477923230861,2025-04-24 22:36:51.674332,2025-04-24 22:36:59.605929,0 days 00:00:07.931597,1169.5035115842954,RBF,240.96885718968764,0.697003834909977,0.5,TPESampler,COMPLETE
2230,0.8703401340200219,2025-04-24 22:36:53.192703,2025-04-24 22:37:02.733814,0 days 00:00:09.541111,0.214908843811576,RBF,154.74607824522764,0.0038798495542316184,2.5,TPESampler,COMPLETE
2231,0.16334780923478995,2025-04-24 22:36:56.461339,2025-04-24 22:37:02.789747,0 days 00:00:06.328408,0.7075480373078069,RBF,25.592392149342942,0.8076963124283859,0.5,TPESampler,COMPLETE
2232,0.9015771955353032,2025-04-24 22:36:59.858016,2025-04-24 22:37:03.893088,0 days 00:00:04.035072,7.429527895273137,RBF,2.347468995061027,2.294733878161309e-06,1.5,TPESampler,COMPLETE
2233,0.16334783145580198,2025-04-24 22:37:02.917848,2025-04-24 22:37:11.953955,0 days 00:00:09.036107,0.0014524109069115581,RBF,0.3942430625821042,0.9952686674330712,2.5,TPESampler,COMPLETE
2234,0.8703401340192852,2025-04-24 22:37:02.990541,2025-04-24 22:37:15.240117,0 days 00:00:12.249576,1.5988061660030182e-06,RBF,10.775725800316541,0.0004938334181934935,2.5,TPESampler,COMPLETE
2235,0.16334781018200764,2025-04-24 22:37:04.139495,2025-04-24 22:37:09.388934,0 days 00:00:05.249439,40214.93838735715,RBF,125.41021696881698,0.678295922925661,0.5,TPESampler,COMPLETE
2236,0.16334779956577347,2025-04-24 22:37:09.693474,2025-04-24 22:37:14.413837,0 days 00:00:04.720363,883.770608214245,RBF,59.97934549777344,0.06146136662951252,0.5,TPESampler,COMPLETE
2237,0.1633478112092365,2025-04-24 22:37:12.234703,2025-04-24 22:37:18.638782,0 days 00:00:06.404079,47767.75623125546,RBF,0.6088210637412153,0.0006662565718863837,0.5,TPESampler,COMPLETE
2238,0.870340134037793,2025-04-24 22:37:14.671566,2025-04-24 22:37:19.598238,0 days 00:00:04.926672,69228.83235485571,RBF,158.7310207010376,2.375683910110541e-06,0.5,TPESampler,COMPLETE
2239,0.1633478339867382,2025-04-24 22:37:15.486492,2025-04-24 22:37:20.305356,0 days 00:00:04.818864,4255.338452947052,RBF,83.4093048832348,0.7462347607280869,0.5,TPESampler,COMPLETE
2240,0.16334780543157906,2025-04-24 22:37:18.936877,2025-04-24 22:37:30.630277,0 days 00:00:11.693400,24.60429921670117,RBF,1525.5883564546928,0.8521212781412932,0.5,TPESampler,COMPLETE
2241,0.870340074233351,2025-04-24 22:37:19.865786,2025-04-24 22:37:35.579743,0 days 00:00:15.713957,0.045152745245740936,RBF,0.17830644408555496,0.6067894000625598,2.5,TPESampler,COMPLETE
2242,0.8703401340687736,2025-04-24 22:37:20.596664,2025-04-24 22:37:35.329798,0 days 00:00:14.733134,8.080377564415006,RBF,50.243062389758244,7.981675805959833e-05,1.5,TPESampler,COMPLETE
2243,0.8703401340218209,2025-04-24 22:37:31.125178,2025-04-24 22:37:41.662830,0 days 00:00:10.537652,4.481935345104759,RBF,1491.3380151375384,0.0037227713055150405,2.5,TPESampler,COMPLETE
2244,0.870340134021015,2025-04-24 22:37:35.629519,2025-04-24 22:37:40.576837,0 days 00:00:04.947318,14.404977033789438,RBF,0.002401204202223487,0.9184168436182438,2.5,TPESampler,COMPLETE
2245,0.16334777429981645,2025-04-24 22:37:35.874099,2025-04-24 22:37:40.619886,0 days 00:00:04.745787,536.3334722235113,RBF,70.02623999820477,0.012854980121196402,0.5,TPESampler,COMPLETE
2246,0.16355851097594443,2025-04-24 22:37:40.776549,2025-04-24 22:38:05.651220,0 days 00:00:24.874671,1.0375211058529874e-06,Matern,67388.16960985029,4.564725250490613e-05,1.5,TPESampler,COMPLETE
2247,0.16334781066657114,2025-04-24 22:37:40.817606,2025-04-24 22:37:48.369002,0 days 00:00:07.551396,0.06394837593847376,RBF,1.4793457325024417,0.11750124743696001,2.5,TPESampler,COMPLETE
2248,0.870340134021088,2025-04-24 22:37:41.935621,2025-04-24 22:37:49.076886,0 days 00:00:07.141265,0.004791549687670457,Matern,2.4764194176385135,1.513353064881908e-06,2.5,TPESampler,COMPLETE
2249,0.870340134020875,2025-04-24 22:37:48.637160,2025-04-24 22:37:55.365407,0 days 00:00:06.728247,2.010327679785066e-05,Matern,0.00021263616100928182,4.078251323753179e-06,2.5,TPESampler,COMPLETE
2250,0.16334772129814126,2025-04-24 22:37:49.344148,2025-04-24 22:37:55.144156,0 days 00:00:05.800008,14.464440818000757,RBF,846.9302446865125,0.8949550262780485,0.5,TPESampler,COMPLETE
2251,0.8703401340223628,2025-04-24 22:37:55.377439,2025-04-24 22:38:03.540295,0 days 00:00:08.162856,7.30554841479265,RBF,17803.10698706882,0.0059331297075579095,0.5,TPESampler,COMPLETE
2252,0.1633478105095463,2025-04-24 22:37:55.672766,2025-04-24 22:38:03.221197,0 days 00:00:07.548431,7.515669774091652,RBF,1494.814595147324,0.2871701450887652,0.5,TPESampler,COMPLETE
2253,0.21977494978904713,2025-04-24 22:38:03.491996,2025-04-24 22:38:09.483121,0 days 00:00:05.991125,415.64715717681145,Matern,8.53022980345518,0.3186849153998584,0.5,TPESampler,COMPLETE
2254,0.16334781024646497,2025-04-24 22:38:03.869832,2025-04-24 22:38:11.138902,0 days 00:00:07.269070,1.107927746509633,RBF,2881.657722613172,0.11519460440372845,0.5,TPESampler,COMPLETE
2255,0.9015779748957368,2025-04-24 22:38:05.949830,2025-04-24 22:38:12.842848,0 days 00:00:06.893018,30.474397582620657,RBF,87798.60509788715,0.27314621065866473,0.5,TPESampler,COMPLETE
2256,0.16334780635463153,2025-04-24 22:38:09.777201,2025-04-24 22:38:15.924941,0 days 00:00:06.147740,6.165638701228545,RBF,29.478927049939944,0.02906003709359409,0.5,TPESampler,COMPLETE
2257,0.16334782325669298,2025-04-24 22:38:11.390878,2025-04-24 22:38:17.265695,0 days 00:00:05.874817,217.0080223428037,RBF,5.016730292380937,0.9488022540041144,0.5,TPESampler,COMPLETE
2258,0.8703401340216791,2025-04-24 22:38:13.132117,2025-04-24 22:38:21.648421,0 days 00:00:08.516304,1.8945011306860313,RBF,2131.4614708357744,0.020263243070024712,0.5,TPESampler,COMPLETE
2259,0.16334781172309826,2025-04-24 22:38:16.224025,2025-04-24 22:38:24.051026,0 days 00:00:07.827001,0.2305118935343011,RBF,11087.482898557413,0.01991461203505387,0.5,TPESampler,COMPLETE
2260,0.16334780829200812,2025-04-24 22:38:17.559141,2025-04-24 22:38:24.141794,0 days 00:00:06.582653,2535.1710755710924,RBF,4796.665295258751,0.9887482804620263,0.5,TPESampler,COMPLETE
2261,0.8703401339458858,2025-04-24 22:38:22.035346,2025-04-24 22:38:33.061752,0 days 00:00:11.026406,6.191099551217547e-05,Matern,49.9274422516606,0.00011709573548024762,0.5,TPESampler,COMPLETE
2262,0.8703401340006848,2025-04-24 22:38:24.287568,2025-04-24 22:38:33.479486,0 days 00:00:09.191918,2.23230330483643,RBF,635.6863248722,0.0038526987776602555,0.5,TPESampler,COMPLETE
2263,0.8703401340884628,2025-04-24 22:38:24.418842,2025-04-24 22:38:29.153859,0 days 00:00:04.735017,2374.3778537502453,RBF,0.030405416953882967,0.0005903353367178948,1.5,TPESampler,COMPLETE
2264,0.16334780927993553,2025-04-24 22:38:29.446455,2025-04-24 22:38:35.781914,0 days 00:00:06.335459,65.83891943578209,RBF,427.43866631360726,0.5524224577495416,0.5,TPESampler,COMPLETE
2265,0.8703401340212689,2025-04-24 22:38:33.343619,2025-04-24 22:38:42.790097,0 days 00:00:09.446478,110.29443955724834,RBF,1730.7345804791032,0.028216374089628876,0.5,TPESampler,COMPLETE
2266,0.16334780629836337,2025-04-24 22:38:33.741544,2025-04-24 22:38:39.784639,0 days 00:00:06.043095,27.206493016924323,RBF,2740.6724306248734,0.2004177395413717,0.5,TPESampler,COMPLETE
2267,0.1633478158396699,2025-04-24 22:38:36.076736,2025-04-24 22:38:47.384666,0 days 00:00:11.307930,0.1823746204788929,RBF,201.56749283967352,0.4318309459333344,0.5,TPESampler,COMPLETE
2268,0.16334780416649072,2025-04-24 22:38:40.083336,2025-04-24 22:38:47.538396,0 days 00:00:07.455060,0.045376511387205457,RBF,8.729751960969038,0.859354915574397,0.5,TPESampler,COMPLETE
2269,0.1633478085661985,2025-04-24 22:38:43.043420,2025-04-24 22:38:49.850210,0 days 00:00:06.806790,1.7674759189685547,RBF,133.99966735830722,0.05051799919008611,0.5,TPESampler,COMPLETE
2270,0.16334767343704912,2025-04-24 22:38:47.548953,2025-04-24 22:38:53.724669,0 days 00:00:06.175716,24.028697417710315,RBF,17.091893763115266,0.8992241700791028,0.5,TPESampler,COMPLETE
2271,0.1633478107716637,2025-04-24 22:38:47.855026,2025-04-24 22:38:55.686319,0 days 00:00:07.831293,2216.9629368378173,RBF,5879.973856575198,0.033636560512565826,0.5,TPESampler,COMPLETE
2272,0.8703401340258685,2025-04-24 22:38:50.091517,2025-04-24 22:39:01.433041,0 days 00:00:11.341524,19.040260987988148,RBF,556.8789266954125,0.026960267586337135,0.5,TPESampler,COMPLETE
2273,0.163347804213027,2025-04-24 22:38:54.006253,2025-04-24 22:39:00.515489,0 days 00:00:06.509236,1.03830725118669,RBF,52.94193993755556,0.08755022952219475,0.5,TPESampler,COMPLETE
2274,0.8703401340214241,2025-04-24 22:38:56.123065,2025-04-24 22:39:04.780132,0 days 00:00:08.657067,0.04097462125960765,RBF,208.90573095757773,4.23252430642299e-08,1.5,TPESampler,COMPLETE
2275,0.16334780886180694,2025-04-24 22:39:00.768044,2025-04-24 22:39:07.281646,0 days 00:00:06.513602,1.4138264847013453,RBF,2.8378657554997875,0.5392032774699838,0.5,TPESampler,COMPLETE
2276,0.16334795635804056,2025-04-24 22:39:01.744296,2025-04-24 22:39:07.536316,0 days 00:00:05.792020,7.972064643121584,RBF,50.155535760988286,0.41250054000430897,0.5,TPESampler,COMPLETE
2277,0.16334780679147973,2025-04-24 22:39:05.088214,2025-04-24 22:39:09.831456,0 days 00:00:04.743242,47.654512841889066,RBF,716.8369017165062,0.4229913628885032,0.5,TPESampler,COMPLETE
2278,0.16334780638246424,2025-04-24 22:39:07.681443,2025-04-24 22:39:14.183640,0 days 00:00:06.502197,1.5558551215787637,RBF,16.71360394498345,0.0315150453355672,0.5,TPESampler,COMPLETE
2279,0.16334780908234117,2025-04-24 22:39:07.841599,2025-04-24 22:39:17.037555,0 days 00:00:09.195956,1043.6701835297192,RBF,88059.08694791615,0.3812376063367621,1.5,TPESampler,COMPLETE
2280,0.16334781284266459,2025-04-24 22:39:10.120016,2025-04-24 22:39:16.989788,0 days 00:00:06.869772,5.253507418066019,RBF,3.261626674974544,0.05203561563922813,0.5,TPESampler,COMPLETE
2281,0.16334791782134675,2025-04-24 22:39:14.507968,2025-04-24 22:39:20.582322,0 days 00:00:06.074354,9.4444251896431,RBF,226.64519109433627,0.14296383302040583,0.5,TPESampler,COMPLETE
2282,0.16334781189867387,2025-04-24 22:39:17.180334,2025-04-24 22:39:21.940330,0 days 00:00:04.759996,31.29911752878542,RBF,107.05798419744526,0.02191476811326812,0.5,TPESampler,COMPLETE
2283,0.163347817435743,2025-04-24 22:39:17.223092,2025-04-24 22:39:22.879077,0 days 00:00:05.655985,18.643814622409796,RBF,50.68783205836607,0.6501435177345143,0.5,TPESampler,COMPLETE
2284,0.16334781213132718,2025-04-24 22:39:20.834805,2025-04-24 22:39:27.554150,0 days 00:00:06.719345,21.028592227357276,RBF,6.474929403889863,0.42930414018167484,0.5,TPESampler,COMPLETE
2285,0.16334779490885423,2025-04-24 22:39:22.230850,2025-04-24 22:39:28.112689,0 days 00:00:05.881839,13.264072378972786,RBF,44.61616164308292,0.09794997256832891,0.5,TPESampler,COMPLETE
2286,0.9015779748249031,2025-04-24 22:39:23.196486,2025-04-24 22:39:29.971962,0 days 00:00:06.775476,1.4759746295961929,RBF,24091.486035078095,0.2354061871318923,0.5,TPESampler,COMPLETE
2287,0.8703401340215478,2025-04-24 22:39:27.847493,2025-04-24 22:39:38.421058,0 days 00:00:10.573565,0.33507499815368397,RBF,589.2444645095258,0.03293214419534877,0.5,TPESampler,COMPLETE
2288,0.16334778254858082,2025-04-24 22:39:28.408700,2025-04-24 22:39:36.356044,0 days 00:00:07.947344,15.011552887594805,RBF,2.6267016343370075,0.7252887348175674,0.5,TPESampler,COMPLETE
2289,0.21977494750474755,2025-04-24 22:39:30.305291,2025-04-24 22:39:40.346398,0 days 00:00:10.041107,57386.62956259313,Matern,0.09279935801515765,0.20954524065222607,0.5,TPESampler,COMPLETE
2290,0.1633478110624219,2025-04-24 22:39:36.650755,2025-04-24 22:39:41.263962,0 days 00:00:04.613207,67.30875112415325,RBF,5.172745472162579,0.03481443552358076,0.5,TPESampler,COMPLETE
2291,0.16334780937441912,2025-04-24 22:39:38.705569,2025-04-24 22:39:45.013979,0 days 00:00:06.308410,19050.347333342776,RBF,266.49131735112206,0.7460387913616146,0.5,TPESampler,COMPLETE
2292,0.16334781840641022,2025-04-24 22:39:40.624471,2025-04-24 22:39:47.015407,0 days 00:00:06.390936,3.0261755026799992,RBF,50.767727272070346,0.4800180226397542,0.5,TPESampler,COMPLETE
2293,0.9015779382258441,2025-04-24 22:39:41.476007,2025-04-24 22:39:45.336716,0 days 00:00:03.860709,22916.575683304985,Matern,76264.35020384147,5.146117498413832e-09,0.5,TPESampler,COMPLETE
2294,0.9015779739081533,2025-04-24 22:39:45.297010,2025-04-24 22:39:52.260631,0 days 00:00:06.963621,4.2975206743039444e-05,RBF,5276.845558836188,0.009477418928504318,1.5,TPESampler,COMPLETE
2295,0.16334777735472966,2025-04-24 22:39:45.612836,2025-04-24 22:39:50.542176,0 days 00:00:04.929340,21.10664233807682,RBF,96.81143841495387,0.7862810010875436,0.5,TPESampler,COMPLETE
2296,0.16334780885909478,2025-04-24 22:39:47.289464,2025-04-24 22:39:52.631895,0 days 00:00:05.342431,5.978244092513483,RBF,17.68799649704389,0.023721237001057546,0.5,TPESampler,COMPLETE
2297,0.16334781092967546,2025-04-24 22:39:50.775824,2025-04-24 22:39:55.563997,0 days 00:00:04.788173,5.6380069041834275,RBF,1739.834867340997,0.4445057601407542,0.5,TPESampler,COMPLETE
2298,0.1633478120484499,2025-04-24 22:39:52.566138,2025-04-24 22:40:04.455948,0 days 00:00:11.889810,0.09138367522928256,RBF,1754.824922599621,0.17316435253672466,0.5,TPESampler,COMPLETE
2299,0.1633478121387339,2025-04-24 22:39:52.942133,2025-04-24 22:40:02.622758,0 days 00:00:09.680625,43.54562280128963,RBF,26348.870300575465,0.5496911765201292,0.5,TPESampler,COMPLETE
2300,0.16334780891700976,2025-04-24 22:39:55.813247,2025-04-24 22:40:02.601226,0 days 00:00:06.787979,53.04070390981713,RBF,1094.7444311429997,0.04969231976170115,0.5,TPESampler,COMPLETE
2301,0.1633478076629133,2025-04-24 22:40:02.780705,2025-04-24 22:40:08.350352,0 days 00:00:05.569647,325.3104587023524,RBF,172.4494907617228,0.2697204189347055,0.5,TPESampler,COMPLETE
2302,0.16334780363814214,2025-04-24 22:40:02.834533,2025-04-24 22:40:08.671074,0 days 00:00:05.836541,5.28626442167434,RBF,96.4152733416497,0.6158893565999546,0.5,TPESampler,COMPLETE
2303,0.16334780933028423,2025-04-24 22:40:04.694745,2025-04-24 22:40:10.364086,0 days 00:00:05.669341,25.374665987622794,RBF,1254.017212570196,0.3990944768408378,0.5,TPESampler,COMPLETE
2304,0.16334779279916406,2025-04-24 22:40:08.622762,2025-04-24 22:40:13.361622,0 days 00:00:04.738860,1018.5960797423227,RBF,1.8005661629697132,0.5467291110160792,0.5,TPESampler,COMPLETE
2305,0.16334780937465276,2025-04-24 22:40:09.025446,2025-04-24 22:40:16.001641,0 days 00:00:06.976195,4.65604522491891,RBF,5.763426722651558,0.33570820095894155,0.5,TPESampler,COMPLETE
2306,0.1633478370235807,2025-04-24 22:40:10.636689,2025-04-24 22:40:15.293208,0 days 00:00:04.656519,176.26035534818473,RBF,187.53819543541337,0.04942682925947858,0.5,TPESampler,COMPLETE
2307,0.163347808131956,2025-04-24 22:40:13.670011,2025-04-24 22:40:18.953141,0 days 00:00:05.283130,1369.8142334892113,RBF,1886.0941896120075,0.640159193729274,2.5,TPESampler,COMPLETE
2308,0.16334780693515524,2025-04-24 22:40:15.628794,2025-04-24 22:40:21.129152,0 days 00:00:05.500358,490.2826802545995,RBF,144.15051497972192,0.7906818567815204,0.5,TPESampler,COMPLETE
2309,0.16334780915052594,2025-04-24 22:40:16.282816,2025-04-24 22:40:21.184069,0 days 00:00:04.901253,2209.4433371467862,RBF,22.20947656088452,0.7601421485064582,0.5,TPESampler,COMPLETE
2310,0.16334775997315898,2025-04-24 22:40:19.211679,2025-04-24 22:40:25.198384,0 days 00:00:05.986705,542.6638718497641,RBF,591.3343864102147,0.5219310884447739,0.5,TPESampler,COMPLETE
2311,0.16334781276051885,2025-04-24 22:40:21.320306,2025-04-24 22:40:27.408805,0 days 00:00:06.088499,344.0421751654042,RBF,1803.7634204014755,0.5476798839613771,0.5,TPESampler,COMPLETE
2312,0.9015779749017945,2025-04-24 22:40:21.515915,2025-04-24 22:40:28.247499,0 days 00:00:06.731584,0.6770553866979279,RBF,97457.50450006133,0.21949462975411296,0.5,TPESampler,COMPLETE
2313,0.16334780575517632,2025-04-24 22:40:25.445317,2025-04-24 22:40:32.648074,0 days 00:00:07.202757,4.192552665231538,RBF,6.7249915854591915,0.5222448531110366,0.5,TPESampler,COMPLETE
