number,value,datetime_start,datetime_complete,duration,params_constant_value,params_kernel_type,params_length_scale,params_noise_level,params_nu,system_attrs_auto:sampler,state
464,0.16334781006468435,2025-04-24 21:19:05.355150,2025-04-24 21:19:10.750509,0 days 00:00:05.395359,71.68605821300952,RBF,25.544892379110344,0.4070931654651848,1.5,TPESampler,COMPLETE
465,0.21977485678061962,2025-04-24 21:19:07.622555,2025-04-24 21:19:13.879031,0 days 00:00:06.256476,33227.765072026654,Matern,9.810671449470197,0.2184213910990256,0.5,TPESampler,COMPLETE
466,0.16334789593618648,2025-04-24 21:19:08.938418,2025-04-24 21:19:21.070949,0 days 00:00:12.132531,437.093057480217,RBF,203.27640653446045,0.007579797068360236,0.5,TPESampler,COMPLETE
467,0.16334780924439476,2025-04-24 21:19:11.049262,2025-04-24 21:19:17.977924,0 days 00:00:06.928662,71416.47659158823,RBF,531.2623288095783,0.04142299599482182,0.5,TPESampler,COMPLETE
468,0.8703401339564408,2025-04-24 21:19:14.121989,2025-04-24 21:19:22.941756,0 days 00:00:08.819767,375.2112371619576,RBF,23323.96187820795,0.0254708035876838,0.5,TPESampler,COMPLETE
469,0.16334780578865873,2025-04-24 21:19:18.231513,2025-04-24 21:19:25.603525,0 days 00:00:07.372012,125.45979304998255,RBF,76.93465724566562,0.45236024648099227,0.5,TPESampler,COMPLETE
470,0.8703401340138157,2025-04-24 21:19:21.323458,2025-04-24 21:19:30.698975,0 days 00:00:09.375517,483.2768386351061,RBF,1516.5536096110623,0.01019937352313837,0.5,TPESampler,COMPLETE
471,0.16334780731476584,2025-04-24 21:19:23.237959,2025-04-24 21:19:28.498126,0 days 00:00:05.260167,19942.73063087955,RBF,25.182354816862738,0.01791952613835042,0.5,TPESampler,COMPLETE
472,0.1633477838103735,2025-04-24 21:19:26.060749,2025-04-24 21:19:31.235033,0 days 00:00:05.174284,73911.23703492517,RBF,6.849188480554071,0.284693410423936,2.5,TPESampler,COMPLETE
473,0.163558527619846,2025-04-24 21:19:28.743117,2025-04-24 21:19:41.276929,0 days 00:00:12.533812,0.07180434414766737,Matern,1650.035622860962,0.6928054218417417,1.5,TPESampler,COMPLETE
474,0.8703401340922708,2025-04-24 21:19:30.995297,2025-04-24 21:19:41.368856,0 days 00:00:10.373559,504.74507687588994,RBF,1083.672909024964,4.4020741567438835e-07,0.5,TPESampler,COMPLETE
475,0.16334780946992417,2025-04-24 21:19:31.521723,2025-04-24 21:19:37.299226,0 days 00:00:05.777503,1015.1197118337974,RBF,306.46293520640063,0.615772448964537,0.5,TPESampler,COMPLETE
476,0.16334784230274332,2025-04-24 21:19:37.546881,2025-04-24 21:19:44.206289,0 days 00:00:06.659408,1.9142098870549658,RBF,251.63330844089793,0.7592705660507513,0.5,TPESampler,COMPLETE
477,0.16334781437402554,2025-04-24 21:19:41.456048,2025-04-24 21:19:53.266029,0 days 00:00:11.809981,77561.49628484399,RBF,885.9176111741033,0.2756338595873652,1.5,TPESampler,COMPLETE
478,0.1633478123971009,2025-04-24 21:19:41.622434,2025-04-24 21:19:53.802104,0 days 00:00:12.179670,185.09353793039983,RBF,4954.23309296779,0.913128556453357,0.5,TPESampler,COMPLETE
479,0.9015771955346736,2025-04-24 21:19:44.480853,2025-04-24 21:19:53.531885,0 days 00:00:09.051032,6.334590769643263,RBF,0.14684844499143399,4.961582337339549e-06,2.5,TPESampler,COMPLETE
480,0.16334780736414709,2025-04-24 21:19:53.594422,2025-04-24 21:19:59.580347,0 days 00:00:05.985925,482.7558439299361,RBF,1.1892948527752054,0.9174349824642747,1.5,TPESampler,COMPLETE
481,0.901577195533369,2025-04-24 21:19:53.710924,2025-04-24 21:19:57.741668,0 days 00:00:04.030744,38360.99806310581,Matern,0.0015130463239955991,1.4401220478954881e-06,2.5,TPESampler,COMPLETE
482,0.16334781995205389,2025-04-24 21:19:54.012968,2025-04-24 21:20:00.168966,0 days 00:00:06.155998,2.283141748464738,RBF,98.98263094900045,0.18987153033385124,2.5,TPESampler,COMPLETE
483,0.8703401340159326,2025-04-24 21:19:57.982567,2025-04-24 21:20:04.744759,0 days 00:00:06.762192,99807.37483662747,RBF,2590.9720548805235,0.0015671644824400664,0.5,TPESampler,COMPLETE
484,0.1633478080149666,2025-04-24 21:19:59.822186,2025-04-24 21:20:06.272832,0 days 00:00:06.450646,91624.98195271991,RBF,4226.872110459145,0.950755621988786,0.5,TPESampler,COMPLETE
485,0.1633478080921468,2025-04-24 21:20:00.393257,2025-04-24 21:20:12.609780,0 days 00:00:12.216523,1.5962987232455197e-06,RBF,0.35875725493274657,8.351837444173471e-10,2.5,TPESampler,COMPLETE
486,0.1633478102798552,2025-04-24 21:20:05.021374,2025-04-24 21:20:10.191659,0 days 00:00:05.170285,89568.52210116411,RBF,109.40915629506871,0.03644981382463176,0.5,TPESampler,COMPLETE
487,0.16334779451684894,2025-04-24 21:20:06.508635,2025-04-24 21:20:11.304734,0 days 00:00:04.796099,19519.275936632883,RBF,1.0366219627133761,0.7445633975024017,1.5,TPESampler,COMPLETE
488,0.16334780983074626,2025-04-24 21:20:10.463532,2025-04-24 21:20:15.459386,0 days 00:00:04.995854,51698.74389272115,RBF,72.23874940247828,0.7498136797332223,0.5,TPESampler,COMPLETE
489,0.8703401340218202,2025-04-24 21:20:11.592778,2025-04-24 21:20:19.817550,0 days 00:00:08.224772,5474.754762050637,RBF,3801.6363897531005,0.013480987255213267,0.5,TPESampler,COMPLETE
490,0.8703401340350907,2025-04-24 21:20:12.903904,2025-04-24 21:20:15.557413,0 days 00:00:02.653509,148.03150741037123,RBF,0.01335667979473683,0.0250701408494099,1.5,TPESampler,COMPLETE
491,0.1633478429369245,2025-04-24 21:20:15.638081,2025-04-24 21:20:21.242120,0 days 00:00:05.604039,275.850656141432,RBF,1130.415660231218,0.2825106963817229,1.5,TPESampler,COMPLETE
492,0.16334780893679926,2025-04-24 21:20:15.691950,2025-04-24 21:20:20.861546,0 days 00:00:05.169596,0.3503043080579927,RBF,1.0404618661052862,0.00021814245051495404,1.5,TPESampler,COMPLETE
493,0.1633478105670624,2025-04-24 21:20:20.091644,2025-04-24 21:20:25.265652,0 days 00:00:05.174008,333.131034671021,RBF,572.2663811635791,0.5403300515166591,0.5,TPESampler,COMPLETE
494,0.16334781503726448,2025-04-24 21:20:21.131336,2025-04-24 21:20:26.715845,0 days 00:00:05.584509,813.7765265507566,RBF,2.2300244314327635,0.025305581947703545,1.5,TPESampler,COMPLETE
495,0.8703401340229306,2025-04-24 21:20:21.518169,2025-04-24 21:20:32.462002,0 days 00:00:10.943833,2.3117135999641136,Matern,6463.044794664784,0.00010090181616616238,1.5,TPESampler,COMPLETE
496,0.16334779946856523,2025-04-24 21:20:25.554201,2025-04-24 21:20:31.426290,0 days 00:00:05.872089,64.10874694968619,RBF,13.669165399807854,0.938209327487864,0.5,TPESampler,COMPLETE
497,0.16334777092228678,2025-04-24 21:20:27.002497,2025-04-24 21:20:31.963488,0 days 00:00:04.960991,49692.14587687666,RBF,2.9435993505622244,0.8790307784275011,1.5,TPESampler,COMPLETE
498,0.16334781082437025,2025-04-24 21:20:31.703438,2025-04-24 21:20:36.556263,0 days 00:00:04.852825,5659.23759760324,RBF,77.08076093549215,0.8706247118351994,1.5,TPESampler,COMPLETE
499,0.16334780185086545,2025-04-24 21:20:32.227926,2025-04-24 21:20:37.336080,0 days 00:00:05.108154,42897.40601299748,RBF,16.81734371758873,0.029263887239433913,1.5,TPESampler,COMPLETE
500,0.9015771955345997,2025-04-24 21:20:32.736086,2025-04-24 21:20:36.171023,0 days 00:00:03.434937,716.8141088568409,Matern,1.3561613817936186e-05,9.855452310369557e-10,0.5,TPESampler,COMPLETE
501,0.16334780928680498,2025-04-24 21:20:36.552385,2025-04-24 21:20:41.415526,0 days 00:00:04.863141,17719.858239807505,RBF,15.764637901609168,0.5608782151689891,1.5,TPESampler,COMPLETE
502,0.8703401340151304,2025-04-24 21:20:36.762865,2025-04-24 21:20:45.969725,0 days 00:00:09.206860,3.6756173967889246e-05,RBF,42.776445173689126,1.9054773319862706e-07,1.5,TPESampler,COMPLETE
503,0.16334783181536042,2025-04-24 21:20:37.598003,2025-04-24 21:20:43.642903,0 days 00:00:06.044900,327.7749253218027,RBF,0.8128912379015304,0.027869213807452844,1.5,TPESampler,COMPLETE
504,0.16334778207394693,2025-04-24 21:20:41.656811,2025-04-24 21:20:51.543688,0 days 00:00:09.886877,52956.23859361991,RBF,0.25134623378739,0.021026527769593656,1.5,TPESampler,COMPLETE
505,0.1633479105130324,2025-04-24 21:20:44.020445,2025-04-24 21:20:48.764710,0 days 00:00:04.744265,813.3422505262309,RBF,6.789369271742355,0.24467701723874985,1.5,TPESampler,COMPLETE
506,0.8703401340180617,2025-04-24 21:20:46.226307,2025-04-24 21:20:51.388710,0 days 00:00:05.162403,16.49498440339875,RBF,0.0009396108587549501,0.3468027008447587,2.5,TPESampler,COMPLETE
507,0.16334781007070834,2025-04-24 21:20:49.059226,2025-04-24 21:20:54.757516,0 days 00:00:05.698290,72760.63585566956,RBF,4.5730717888241905,0.0610680964273307,1.5,TPESampler,COMPLETE
508,0.8703401340201609,2025-04-24 21:20:51.591233,2025-04-24 21:21:00.705972,0 days 00:00:09.114739,2532.5478877875216,RBF,4268.5413416065785,0.008758633315409901,0.5,TPESampler,COMPLETE
509,0.16334786215533437,2025-04-24 21:20:51.797388,2025-04-24 21:20:56.813426,0 days 00:00:05.016038,98583.23775502438,RBF,3.317905378767215,0.5353474067050424,1.5,TPESampler,COMPLETE
510,0.8703401340606995,2025-04-24 21:20:55.001805,2025-04-24 21:20:59.356526,0 days 00:00:04.354721,74929.62861335227,RBF,0.020270243297935066,0.00880663107699598,1.5,TPESampler,COMPLETE
511,0.16334781525142197,2025-04-24 21:20:57.095626,2025-04-24 21:21:02.668669,0 days 00:00:05.573043,31591.84710782476,RBF,24.81963911364778,0.9602474110540533,1.5,TPESampler,COMPLETE
512,0.16334778304630593,2025-04-24 21:20:59.649595,2025-04-24 21:21:10.658706,0 days 00:00:11.009111,47420.349318235734,RBF,0.7743133454225628,0.9663673107524487,1.5,TPESampler,COMPLETE
513,0.870340134019008,2025-04-24 21:21:00.956665,2025-04-24 21:21:11.825923,0 days 00:00:10.869258,4.316687833060284e-06,Matern,59.95236119800055,0.003575383895945619,2.5,TPESampler,COMPLETE
514,0.16334781254536743,2025-04-24 21:21:02.927525,2025-04-24 21:21:11.156548,0 days 00:00:08.229023,1798.590775863749,RBF,2528.4131420912736,0.03049181899132858,0.5,TPESampler,COMPLETE
515,0.163558389917904,2025-04-24 21:21:10.908316,2025-04-24 21:21:16.930633,0 days 00:00:06.022317,35075.53455194964,Matern,17.208654260821596,0.13925301964409126,1.5,TPESampler,COMPLETE
516,0.16344314026828932,2025-04-24 21:21:11.392439,2025-04-24 21:21:21.698230,0 days 00:00:10.305791,28.318860980330037,Matern,0.1506505911875637,0.4268803252626978,2.5,TPESampler,COMPLETE
517,0.870340134035795,2025-04-24 21:21:12.081066,2025-04-24 21:21:20.112426,0 days 00:00:08.031360,42642.477543711655,RBF,22907.5249897203,0.00022876734738124698,2.5,TPESampler,COMPLETE
518,0.8703401340199739,2025-04-24 21:21:17.180374,2025-04-24 21:21:24.405940,0 days 00:00:07.225566,0.03872446756613026,Matern,1370.9243314599325,1.4379693914639088e-05,0.5,TPESampler,COMPLETE
519,0.16334781397181708,2025-04-24 21:21:20.354862,2025-04-24 21:21:27.322722,0 days 00:00:06.967860,301.5325205956757,RBF,10106.708892518014,0.8988916751494835,0.5,TPESampler,COMPLETE
520,0.9015771955345012,2025-04-24 21:21:21.946335,2025-04-24 21:21:25.955383,0 days 00:00:04.009048,102.1983864972318,Matern,0.0001418482247076299,1.0003950965177575e-09,1.5,TPESampler,COMPLETE
521,0.8703401340210791,2025-04-24 21:21:24.652561,2025-04-24 21:21:29.042432,0 days 00:00:04.389871,3583.8257181766053,RBF,0.0011375789923186443,0.5420962835804956,1.5,TPESampler,COMPLETE
522,0.8703401339819561,2025-04-24 21:21:26.248107,2025-04-24 21:21:34.201156,0 days 00:00:07.953049,0.14052212201362446,RBF,0.0002179254308731839,2.688273721541785e-08,1.5,TPESampler,COMPLETE
523,0.8703401339844118,2025-04-24 21:21:27.574677,2025-04-24 21:21:35.343263,0 days 00:00:07.768586,1731.9049498656063,RBF,1457.834662223167,0.013627359255687182,0.5,TPESampler,COMPLETE
524,0.21977494885250143,2025-04-24 21:21:29.288626,2025-04-24 21:21:36.362501,0 days 00:00:07.073875,863.7397354921989,Matern,3470.7856889934883,0.023778722341975245,0.5,TPESampler,COMPLETE
525,0.8703401340199844,2025-04-24 21:21:34.454644,2025-04-24 21:21:41.435234,0 days 00:00:06.980590,23025.9043290274,RBF,247.27868797632908,5.665629607641172e-05,0.5,TPESampler,COMPLETE
526,0.8703401340211796,2025-04-24 21:21:35.600261,2025-04-24 21:21:43.366806,0 days 00:00:07.766545,60359.60145819519,RBF,10903.353000785632,0.0068002724263763565,0.5,TPESampler,COMPLETE
527,0.1633478117213396,2025-04-24 21:21:36.653814,2025-04-24 21:21:41.519769,0 days 00:00:04.865955,534.8942282628212,RBF,42.62972546468962,0.013249354143938952,1.5,TPESampler,COMPLETE
528,0.16334780427988654,2025-04-24 21:21:41.642635,2025-04-24 21:21:52.175098,0 days 00:00:10.532463,73596.97765727021,RBF,237.77443261415993,0.003955410935760093,0.5,TPESampler,COMPLETE
529,0.8703401340212843,2025-04-24 21:21:41.711329,2025-04-24 21:21:53.987463,0 days 00:00:12.276134,10.83336812426255,RBF,923.9119415952741,0.016268244687760457,0.5,TPESampler,COMPLETE
530,0.8703401340212099,2025-04-24 21:21:43.625365,2025-04-24 21:21:54.067166,0 days 00:00:10.441801,41.269376356635505,RBF,37.276217652617625,0.001888671758341569,0.5,TPESampler,COMPLETE
531,0.16334780737025154,2025-04-24 21:21:52.413919,2025-04-24 21:21:59.145535,0 days 00:00:06.731616,90850.30853773218,RBF,105.44963224935488,0.1532770566569909,1.5,TPESampler,COMPLETE
532,0.16334780958771833,2025-04-24 21:21:54.124589,2025-04-24 21:22:01.415512,0 days 00:00:07.290923,68726.18536977883,RBF,3296.8395669415195,0.1780601887388512,0.5,TPESampler,COMPLETE
533,0.8703401340214667,2025-04-24 21:21:54.238094,2025-04-24 21:22:09.605952,0 days 00:00:15.367858,1.7400291248655363e-05,Matern,13753.188583405481,1.5122180833263416e-06,1.5,TPESampler,COMPLETE
534,0.8703401340179032,2025-04-24 21:21:59.401015,2025-04-24 21:22:09.667228,0 days 00:00:10.266213,137.14969049571212,RBF,13221.913811557917,0.00032790007556942686,0.5,TPESampler,COMPLETE
535,0.1633477992026884,2025-04-24 21:22:01.711011,2025-04-24 21:22:09.335314,0 days 00:00:07.624303,1521.5220345499686,RBF,45081.231352428236,0.23697547837489275,0.5,TPESampler,COMPLETE
536,0.16334780935458415,2025-04-24 21:22:09.559964,2025-04-24 21:22:16.969149,0 days 00:00:07.409185,47988.67656497107,RBF,1031.9746949794123,0.03530551454921715,0.5,TPESampler,COMPLETE
537,0.8703401340203483,2025-04-24 21:22:09.797055,2025-04-24 21:22:14.296423,0 days 00:00:04.499368,191.65722619861225,RBF,0.012170866894911642,0.00017851557431687302,1.5,TPESampler,COMPLETE
538,0.9015771955342313,2025-04-24 21:22:09.880185,2025-04-24 21:22:13.852420,0 days 00:00:03.972235,2752.784078386543,RBF,0.008051978477648162,7.223328702183463e-06,1.5,TPESampler,COMPLETE
539,0.16334780886344377,2025-04-24 21:22:14.105873,2025-04-24 21:22:19.192730,0 days 00:00:05.086857,55.76838000111746,RBF,70.07863325473808,0.05832711684631556,0.5,TPESampler,COMPLETE
540,0.16334782615691856,2025-04-24 21:22:14.471119,2025-04-24 21:22:20.580288,0 days 00:00:06.109169,6111.645831863997,RBF,6328.811522701294,0.9996092458638944,0.5,TPESampler,COMPLETE
541,0.8703401340237349,2025-04-24 21:22:17.267992,2025-04-24 21:22:23.917378,0 days 00:00:06.649386,443.5081403244424,RBF,87.8194408794056,2.1105279922045465e-05,1.5,TPESampler,COMPLETE
542,0.16334780715802263,2025-04-24 21:22:19.443872,2025-04-24 21:22:25.734208,0 days 00:00:06.290336,211.3262810684964,RBF,0.8494707261229265,0.015374977924153712,1.5,TPESampler,COMPLETE
543,0.16334782724709412,2025-04-24 21:22:20.827875,2025-04-24 21:22:27.230152,0 days 00:00:06.402277,1930.3333992446546,RBF,157.49045480993422,0.8187244474593898,0.5,TPESampler,COMPLETE
544,0.16334780862562967,2025-04-24 21:22:24.213822,2025-04-24 21:22:33.443829,0 days 00:00:09.230007,9805.629278934968,RBF,0.28301319026775,0.8025888322505405,1.5,TPESampler,COMPLETE
545,0.1633478173412296,2025-04-24 21:22:26.091748,2025-04-24 21:22:30.172987,0 days 00:00:04.081239,166.31123389029725,RBF,33.9016973637626,0.011734541693799118,0.5,TPESampler,COMPLETE
546,0.16334780989058986,2025-04-24 21:22:27.555660,2025-04-24 21:22:33.770244,0 days 00:00:06.214584,57200.19155206645,RBF,322.63187486672086,0.007562685563763341,0.5,TPESampler,COMPLETE
547,0.16334781120640662,2025-04-24 21:22:30.417498,2025-04-24 21:22:37.941335,0 days 00:00:07.523837,87117.57539928729,RBF,8249.052602675807,0.04289484866052674,0.5,TPESampler,COMPLETE
548,0.1633478129123654,2025-04-24 21:22:33.694811,2025-04-24 21:22:40.209835,0 days 00:00:06.515024,2.808099750711102,RBF,207.28211531537258,0.21793991177332325,1.5,TPESampler,COMPLETE
549,0.16334778495441563,2025-04-24 21:22:33.992558,2025-04-24 21:22:39.537908,0 days 00:00:05.545350,518.9173601954814,RBF,129.68146046049677,0.23898764743235507,1.5,TPESampler,COMPLETE
550,0.21977496394893473,2025-04-24 21:22:38.192168,2025-04-24 21:22:43.440817,0 days 00:00:05.248649,34.415525811888884,Matern,299.2003873383616,0.31887542651374673,0.5,TPESampler,COMPLETE
551,0.8703401340215193,2025-04-24 21:22:39.775440,2025-04-24 21:22:47.975038,0 days 00:00:08.199598,8.62885021679246e-06,Matern,0.000353194413397859,1.747247901925512e-10,0.5,TPESampler,COMPLETE
552,0.1633477947105581,2025-04-24 21:22:40.446952,2025-04-24 21:22:51.708846,0 days 00:00:11.261894,5.151532688735714,RBF,9429.168539132394,0.7012078083578535,0.5,TPESampler,COMPLETE
553,0.1633478124392695,2025-04-24 21:22:43.688271,2025-04-24 21:22:49.651004,0 days 00:00:05.962733,329.0306018482456,RBF,141.90332580010175,0.4146525869567118,2.5,TPESampler,COMPLETE
554,0.8703401339928517,2025-04-24 21:22:48.267283,2025-04-24 21:23:01.757649,0 days 00:00:13.490366,1.2012196585350542e-05,Matern,14441.231104810853,2.581477853286585e-07,0.5,TPESampler,COMPLETE
555,0.1633478008113301,2025-04-24 21:22:49.905198,2025-04-24 21:22:55.870112,0 days 00:00:05.964914,76538.45175604688,RBF,77.0137100257471,0.3831457872234582,1.5,TPESampler,COMPLETE
556,0.16334781154172953,2025-04-24 21:22:52.015958,2025-04-24 21:22:58.422236,0 days 00:00:06.406278,2631.1813693012327,RBF,1.5894477376319294,0.0280720004699828,1.5,TPESampler,COMPLETE
557,0.16334777958518865,2025-04-24 21:22:56.128462,2025-04-24 21:23:01.675152,0 days 00:00:05.546690,596.5463949387309,RBF,416.69612362489516,0.4602637280093308,0.5,TPESampler,COMPLETE
558,0.8703401340212792,2025-04-24 21:22:58.698814,2025-04-24 21:23:07.165847,0 days 00:00:08.467033,283.46788482645417,RBF,1060.778878939033,0.010679159905288987,0.5,TPESampler,COMPLETE
559,0.16334781447581445,2025-04-24 21:23:01.868464,2025-04-24 21:23:07.179070,0 days 00:00:05.310606,62791.501971691454,RBF,73.06430697385122,0.016039217300438575,1.5,TPESampler,COMPLETE
560,0.1635585794514183,2025-04-24 21:23:01.938421,2025-04-24 21:23:09.817439,0 days 00:00:07.879018,0.07683645618698144,Matern,0.9438843769389386,1.3778049829395854e-08,1.5,TPESampler,COMPLETE
561,0.16334768323467797,2025-04-24 21:23:07.359856,2025-04-24 21:23:15.527024,0 days 00:00:08.167168,129.7747954243936,RBF,1.2797855205691053,0.00017123021070654154,1.5,TPESampler,COMPLETE
562,0.8703401340263673,2025-04-24 21:23:07.401628,2025-04-24 21:23:17.910779,0 days 00:00:10.509151,50289.55930424095,Matern,28285.45723448324,0.003867815685976523,2.5,TPESampler,COMPLETE
563,0.1635585111506983,2025-04-24 21:23:10.075279,2025-04-24 21:23:18.439042,0 days 00:00:08.363763,0.07330848742290007,Matern,1.2224948601931485,0.004026963169318175,1.5,TPESampler,COMPLETE
564,0.8703401340097795,2025-04-24 21:23:15.815409,2025-04-24 21:23:26.617686,0 days 00:00:10.802277,29.908570030628685,RBF,82114.01631982486,4.026394724041359e-09,1.5,TPESampler,COMPLETE
565,0.9015779749019732,2025-04-24 21:23:18.195684,2025-04-24 21:23:21.346207,0 days 00:00:03.150523,271.589980318045,RBF,0.774102764547844,0.002158613697164608,1.5,TPESampler,COMPLETE
566,0.16355851486259465,2025-04-24 21:23:18.683569,2025-04-24 21:23:26.960962,0 days 00:00:08.277393,1850.2816663223705,Matern,0.8581744215067905,7.020269050215547e-05,1.5,TPESampler,COMPLETE
567,0.8703401340214325,2025-04-24 21:23:21.629820,2025-04-24 21:23:26.807209,0 days 00:00:05.177389,64.15087784211441,RBF,10.613331042964885,1.5147218172273038e-05,1.5,TPESampler,COMPLETE
568,0.1633477640521713,2025-04-24 21:23:26.814279,2025-04-24 21:23:31.973274,0 days 00:00:05.158995,127.98626208672104,RBF,37.829578657726366,0.0068296430106985825,1.5,TPESampler,COMPLETE
569,0.16334784136677355,2025-04-24 21:23:26.994649,2025-04-24 21:23:33.452768,0 days 00:00:06.458119,1318.3655577322934,RBF,2.2580136977221614,2.4408410380980297e-05,1.5,TPESampler,COMPLETE
570,0.163347806072995,2025-04-24 21:23:27.167690,2025-04-24 21:23:35.405436,0 days 00:00:08.237746,86.8650899957155,RBF,0.378910029338243,8.722232944713487e-05,1.5,TPESampler,COMPLETE
571,0.16334781283787447,2025-04-24 21:23:32.297979,2025-04-24 21:23:39.240094,0 days 00:00:06.942115,2.325367533067809,RBF,0.33149590545482993,0.00016918445548641308,1.5,TPESampler,COMPLETE
572,0.16334773275226863,2025-04-24 21:23:33.743158,2025-04-24 21:23:41.391787,0 days 00:00:07.648629,12.322048400477644,RBF,0.5252414370370604,0.6802209636397266,1.5,TPESampler,COMPLETE
573,0.8703401340213892,2025-04-24 21:23:35.687405,2025-04-24 21:23:44.136584,0 days 00:00:08.449179,0.17225913829109468,RBF,12.205208021892819,0.008894471322017103,1.5,TPESampler,COMPLETE
574,0.8703401340264462,2025-04-24 21:23:39.527308,2025-04-24 21:23:46.457780,0 days 00:00:06.930472,1.0653806605205927,RBF,102.34155503175538,0.00019205027496833988,1.5,TPESampler,COMPLETE
575,0.16334780930215895,2025-04-24 21:23:41.641147,2025-04-24 21:23:47.132966,0 days 00:00:05.491819,0.21031891440797926,RBF,1.942310458786802,0.46311990399356895,1.5,TPESampler,COMPLETE
576,0.16355850885691162,2025-04-24 21:23:44.461426,2025-04-24 21:23:57.097787,0 days 00:00:12.636361,5.72177805351481,Matern,6.130723147923778,0.35309219085126453,1.5,TPESampler,COMPLETE
577,0.8703401339872342,2025-04-24 21:23:46.699504,2025-04-24 21:23:56.552298,0 days 00:00:09.852794,14.36924019643476,RBF,235.11315834504418,0.0003200172755494247,1.5,TPESampler,COMPLETE
578,0.8703397609429285,2025-04-24 21:23:47.357377,2025-04-24 21:23:55.669988,0 days 00:00:08.312611,9.84384137719846,RBF,0.18958079188341542,0.559899807945495,1.5,TPESampler,COMPLETE
579,0.16334784251567652,2025-04-24 21:23:55.879931,2025-04-24 21:24:04.372264,0 days 00:00:08.492333,36.80467132381269,RBF,1.5781048071812966,0.0009828226450164222,1.5,TPESampler,COMPLETE
