number,value,datetime_start,datetime_complete,duration,params_constant_value,params_kernel_type,params_length_scale,params_noise_level,params_nu,system_attrs_auto:sampler,state
1158,0.8703401340212787,2025-04-24 21:47:45.882494,2025-04-24 21:47:50.605351,0 days 00:00:04.722857,17554.063871390787,RBF,6.922062440720128,2.0139867510493408e-05,2.5,TPESampler,COMPLETE
1159,0.870340134027487,2025-04-24 21:47:47.277597,2025-04-24 21:47:52.336699,0 days 00:00:05.059102,2295.0183879795504,RBF,0.011329001213494396,9.409714902267593e-05,2.5,TPESampler,COMPLETE
1160,0.1633478071607648,2025-04-24 21:47:50.898066,2025-04-24 21:47:56.772357,0 days 00:00:05.874291,1496.7198902432751,RBF,14.33490218230669,0.00022305076037719133,2.5,TPESampler,COMPLETE
1161,0.8703401340256479,2025-04-24 21:47:51.620242,2025-04-24 21:48:01.676958,0 days 00:00:10.056716,96928.8071576611,RBF,1198.1443536392223,6.740788127565274e-05,0.5,TPESampler,COMPLETE
1162,0.16334780988864087,2025-04-24 21:47:52.581808,2025-04-24 21:47:58.338319,0 days 00:00:05.756511,1118.225756061846,RBF,6.497657030238131,0.0008666207268445327,2.5,TPESampler,COMPLETE
1163,0.8703401340200637,2025-04-24 21:47:57.070924,2025-04-24 21:48:03.442419,0 days 00:00:06.371495,17079.965393868384,RBF,181.03793554194974,0.00036744229170537583,2.5,TPESampler,COMPLETE
1164,0.16334769301204416,2025-04-24 21:47:58.627339,2025-04-24 21:48:06.146529,0 days 00:00:07.519190,7.894844380107475,RBF,5.8720787119356,0.5646866294616159,2.5,TPESampler,COMPLETE
1165,0.16334780620166203,2025-04-24 21:48:01.926436,2025-04-24 21:48:07.465325,0 days 00:00:05.538889,1017.8786522144451,RBF,0.5011456059720233,0.011599067680996774,2.5,TPESampler,COMPLETE
1166,0.16334781060141348,2025-04-24 21:48:03.687154,2025-04-24 21:48:09.959597,0 days 00:00:06.272443,63234.51925651373,RBF,554.891094853917,0.052905907299214,0.5,TPESampler,COMPLETE
1167,0.16334784803882857,2025-04-24 21:48:06.467018,2025-04-24 21:48:13.361353,0 days 00:00:06.894335,0.7331895865895393,RBF,29.617061834633795,0.07158050595965398,2.5,TPESampler,COMPLETE
1168,0.8703401340203974,2025-04-24 21:48:07.722432,2025-04-24 21:48:17.173329,0 days 00:00:09.450897,0.8584884175651266,RBF,334.45697847485724,0.003449892817951365,2.5,TPESampler,COMPLETE
1169,0.16334780875855137,2025-04-24 21:48:10.245441,2025-04-24 21:48:15.109722,0 days 00:00:04.864281,5926.318226580769,RBF,7.0684931232642985,0.07025922081121472,2.5,TPESampler,COMPLETE
1170,0.16334781907793688,2025-04-24 21:48:13.611072,2025-04-24 21:48:21.085642,0 days 00:00:07.474570,0.8344219856283618,RBF,124.35764121386909,0.14279527085123234,2.5,TPESampler,COMPLETE
1171,0.16334778965491595,2025-04-24 21:48:15.360302,2025-04-24 21:48:22.741753,0 days 00:00:07.381451,0.5867493386859763,RBF,9.845637076041132,0.14057458332903225,2.5,TPESampler,COMPLETE
1172,0.1633478094064026,2025-04-24 21:48:17.425654,2025-04-24 21:48:29.317156,0 days 00:00:11.891502,2.6529630361341527,RBF,92.67826058571171,0.7670222536935288,2.5,TPESampler,COMPLETE
1173,0.1633477942436508,2025-04-24 21:48:21.526290,2025-04-24 21:48:35.958130,0 days 00:00:14.431840,1.0633162556071096,RBF,5.167045325755785,0.022674054873209386,2.5,TPESampler,COMPLETE
1174,0.8703401339522309,2025-04-24 21:48:23.229664,2025-04-24 21:48:34.981585,0 days 00:00:11.751921,43.049587123699816,RBF,0.14914381436633847,0.08820608636841612,2.5,TPESampler,COMPLETE
1175,0.1633478178802614,2025-04-24 21:48:30.006669,2025-04-24 21:48:43.039399,0 days 00:00:13.032730,68757.82256533625,RBF,3558.5288951617385,0.03213641891726218,1.5,TPESampler,COMPLETE
1176,0.8703401340185981,2025-04-24 21:48:35.240669,2025-04-24 21:48:43.901328,0 days 00:00:08.660659,12.830484682040305,RBF,25.296046386581047,0.0021565714060988715,2.5,TPESampler,COMPLETE
1177,0.16334782910129247,2025-04-24 21:48:36.204222,2025-04-24 21:48:44.301421,0 days 00:00:08.097199,194.43478705220787,RBF,58.478573266848606,0.6343100233361668,2.5,TPESampler,COMPLETE
1178,0.9015766710435535,2025-04-24 21:48:43.323780,2025-04-24 21:48:50.173664,0 days 00:00:06.849884,27121.052566897837,RBF,0.3189938009777378,0.00014301728080192184,2.5,TPESampler,COMPLETE
1179,0.8703401309825222,2025-04-24 21:48:44.188864,2025-04-24 21:48:56.456452,0 days 00:00:12.267588,1.012508455913659,RBF,0.1635485904994993,0.08161340046736194,2.5,TPESampler,COMPLETE
1180,0.8703401340197224,2025-04-24 21:48:44.597576,2025-04-24 21:48:57.207324,0 days 00:00:12.609748,259.2317874751222,RBF,0.10684287825644037,9.594366127879633e-05,2.5,TPESampler,COMPLETE
1181,0.16334766706362783,2025-04-24 21:48:51.139811,2025-04-24 21:49:00.799163,0 days 00:00:09.659352,25.285370471004683,RBF,110.4016506205312,0.20268957392255438,2.5,TPESampler,COMPLETE
1182,0.8703401340208181,2025-04-24 21:48:56.892377,2025-04-24 21:49:01.676603,0 days 00:00:04.784226,132.54567276188345,Matern,50.433248547272385,7.3881218648937e-06,2.5,TPESampler,COMPLETE
1183,0.16334779526737467,2025-04-24 21:48:57.454878,2025-04-24 21:49:02.474747,0 days 00:00:05.019869,339.7131577806705,RBF,3.595556786741819,0.3537799010697334,2.5,TPESampler,COMPLETE
1184,0.8703401340675659,2025-04-24 21:49:01.047792,2025-04-24 21:49:09.024318,0 days 00:00:07.976526,6.691461949153574,RBF,29639.471319997185,0.02506727205318117,2.5,TPESampler,COMPLETE
1185,0.16334738960594952,2025-04-24 21:49:01.937919,2025-04-24 21:49:06.937312,0 days 00:00:04.999393,187.25173689350174,RBF,19.43803881433743,0.011243108497189368,2.5,TPESampler,COMPLETE
1186,0.1633478091931991,2025-04-24 21:49:02.737635,2025-04-24 21:49:09.106736,0 days 00:00:06.369101,77.30632367467948,RBF,1.772082269056778,0.6188886794832065,2.5,TPESampler,COMPLETE
1187,0.16334780687304462,2025-04-24 21:49:07.235934,2025-04-24 21:49:12.900556,0 days 00:00:05.664622,58.77937914743356,RBF,13.830939755876024,0.41462528359279066,2.5,TPESampler,COMPLETE
1188,0.16344316423176058,2025-04-24 21:49:09.181661,2025-04-24 21:49:18.317807,0 days 00:00:09.136146,0.07635387576649702,Matern,189.15964438565967,0.7822761807929408,2.5,TPESampler,COMPLETE
1189,0.8703401340268209,2025-04-24 21:49:09.290265,2025-04-24 21:49:16.955995,0 days 00:00:07.665730,9.622544309377988,RBF,1105.1184664519772,0.04421264743227932,2.5,TPESampler,COMPLETE
1190,0.8703401340209537,2025-04-24 21:49:13.183612,2025-04-24 21:49:19.720560,0 days 00:00:06.536948,224.95635937607105,Matern,268.8686310052729,0.0012367729018554147,2.5,TPESampler,COMPLETE
1191,0.1633477983169224,2025-04-24 21:49:17.221536,2025-04-24 21:49:23.732025,0 days 00:00:06.510489,12.270968842293616,RBF,101.12448666305973,0.10919174167547917,2.5,TPESampler,COMPLETE
1192,0.1633478269264105,2025-04-24 21:49:18.620581,2025-04-24 21:49:25.636122,0 days 00:00:07.015541,28.630518781865664,RBF,6.547966093508733,0.7113382196613901,2.5,TPESampler,COMPLETE
1193,0.16334780872442403,2025-04-24 21:49:19.983958,2025-04-24 21:49:25.935264,0 days 00:00:05.951306,7.093019249456331,RBF,1.3250279933965046,0.034393605262380986,2.5,TPESampler,COMPLETE
1194,0.16334780955166517,2025-04-24 21:49:23.983647,2025-04-24 21:49:29.356259,0 days 00:00:05.372612,7.5182874864314,RBF,470.14317085518275,0.15047478398440686,2.5,TPESampler,COMPLETE
1195,0.16334781288866138,2025-04-24 21:49:25.892996,2025-04-24 21:49:31.552548,0 days 00:00:05.659552,94.5917262428007,RBF,186.9919792849946,0.030784983415547765,2.5,TPESampler,COMPLETE
1196,0.16334794627795762,2025-04-24 21:49:26.262521,2025-04-24 21:49:33.588145,0 days 00:00:07.325624,8.842869672080388,RBF,15.091680718532997,0.6988604459082538,2.5,TPESampler,COMPLETE
1197,0.16334781014211386,2025-04-24 21:49:29.619575,2025-04-24 21:49:37.511832,0 days 00:00:07.892257,2.9455138297729655,RBF,6.81041545152422,0.006612829972169301,2.5,TPESampler,COMPLETE
1198,0.16334781383247557,2025-04-24 21:49:31.843693,2025-04-24 21:49:36.959823,0 days 00:00:05.116130,5013.647943766976,RBF,20.222990069254518,0.16545723071201707,2.5,TPESampler,COMPLETE
1199,0.16334774040798294,2025-04-24 21:49:33.891552,2025-04-24 21:49:40.812509,0 days 00:00:06.920957,0.6460980443424538,RBF,2.2076693874736284,0.3818202252175831,2.5,TPESampler,COMPLETE
1200,0.16334839695667783,2025-04-24 21:49:37.230104,2025-04-24 21:49:42.103976,0 days 00:00:04.873872,253.28855247201284,RBF,24.472049048488444,0.011867842621353345,2.5,TPESampler,COMPLETE
1201,0.16334779921864767,2025-04-24 21:49:37.811910,2025-04-24 21:49:44.764134,0 days 00:00:06.952224,3967.5180285384563,RBF,3713.510079555234,0.07641203551418639,2.5,TPESampler,COMPLETE
1202,0.16334781351767516,2025-04-24 21:49:41.111601,2025-04-24 21:49:45.514799,0 days 00:00:04.403198,51.4379866908668,RBF,32.334191229023574,0.0904142924299684,2.5,TPESampler,COMPLETE
1203,0.1633478093260472,2025-04-24 21:49:42.351097,2025-04-24 21:49:48.961098,0 days 00:00:06.610001,1.2885123889675276,RBF,8.031468934050464,0.047094331566798785,2.5,TPESampler,COMPLETE
1204,0.16334781487345185,2025-04-24 21:49:45.050246,2025-04-24 21:49:51.450278,0 days 00:00:06.400032,1.0861337523644807,RBF,1.5812507502232824,0.6441617108562151,2.5,TPESampler,COMPLETE
1205,0.16334772670410902,2025-04-24 21:49:45.745098,2025-04-24 21:49:53.266927,0 days 00:00:07.521829,0.229172722356977,RBF,0.9439908825807697,0.10622369329094893,2.5,TPESampler,COMPLETE
1206,0.8703401340210442,2025-04-24 21:49:49.250945,2025-04-24 21:49:58.283151,0 days 00:00:09.032206,0.010679174075585185,RBF,60.49917585116021,0.004286408402897919,2.5,TPESampler,COMPLETE
1207,0.1633478085984581,2025-04-24 21:49:51.758739,2025-04-24 21:49:57.347841,0 days 00:00:05.589102,491.14702740769303,RBF,199.09825105017867,0.007344630483493016,2.5,TPESampler,COMPLETE
1208,0.16334780073644045,2025-04-24 21:49:53.528619,2025-04-24 21:50:02.968815,0 days 00:00:09.440196,1.1547260226339835,RBF,3.505437698047821,0.7771768599624581,2.5,TPESampler,COMPLETE
1209,0.16334780388174752,2025-04-24 21:49:57.669809,2025-04-24 21:50:08.591686,0 days 00:00:10.921877,0.007984320820577769,RBF,0.768369268237638,0.23784423652637515,2.5,TPESampler,COMPLETE
1210,0.8703401340770741,2025-04-24 21:49:58.512762,2025-04-24 21:50:08.852311,0 days 00:00:10.339549,0.0007794416092785316,RBF,0.08806144463364575,0.0006539074301712093,2.5,TPESampler,COMPLETE
1211,0.1633477932948159,2025-04-24 21:50:03.647955,2025-04-24 21:50:14.193073,0 days 00:00:10.545118,3.8087399291133943,RBF,2.2231438700284594,0.8627339279952126,2.5,TPESampler,COMPLETE
1212,0.8703401340220206,2025-04-24 21:50:08.905913,2025-04-24 21:50:17.163239,0 days 00:00:08.257326,0.023949382403415195,RBF,0.043754919632721954,0.1151518926283367,2.5,TPESampler,COMPLETE
1213,0.16334781014076377,2025-04-24 21:50:09.121377,2025-04-24 21:50:20.459753,0 days 00:00:11.338376,0.036948409220193566,RBF,0.27003621682802725,0.000564440152671938,2.5,TPESampler,COMPLETE
1214,0.16334780533134854,2025-04-24 21:50:14.547622,2025-04-24 21:50:23.811765,0 days 00:00:09.264143,0.01499155745022914,RBF,4.726431983290983,0.08619698443472633,2.5,TPESampler,COMPLETE
1215,0.8703401340212154,2025-04-24 21:50:17.449545,2025-04-24 21:50:21.717572,0 days 00:00:04.268027,1.8106997393409616,RBF,0.06005301118410215,0.023814832993467136,2.5,TPESampler,COMPLETE
1216,0.1633478108618788,2025-04-24 21:50:20.768045,2025-04-24 21:50:27.529876,0 days 00:00:06.761831,0.13775243111948818,RBF,1.0945319478730253,0.6064530142344327,2.5,TPESampler,COMPLETE
1217,0.16334780974503152,2025-04-24 21:50:21.970444,2025-04-24 21:50:29.116282,0 days 00:00:07.145838,1.9920762588048635,RBF,3.6742088342435832,0.3113065329166914,2.5,TPESampler,COMPLETE
1218,0.16334781094830284,2025-04-24 21:50:24.125921,2025-04-24 21:50:30.763751,0 days 00:00:06.637830,0.5602315389598811,RBF,0.6862542267507642,0.04465781452629845,2.5,TPESampler,COMPLETE
1219,0.16334781705115511,2025-04-24 21:50:27.794346,2025-04-24 21:50:38.201849,0 days 00:00:10.407503,0.15961558894483266,RBF,1.397302984450126,0.02122919826850372,2.5,TPESampler,COMPLETE
1220,0.8703401340184133,2025-04-24 21:50:29.422814,2025-04-24 21:50:46.414209,0 days 00:00:16.991395,8.670765998609018e-06,RBF,16.82888308459152,0.03550513227221247,2.5,TPESampler,COMPLETE
1221,0.1633477939362927,2025-04-24 21:50:31.072034,2025-04-24 21:51:01.103754,0 days 00:00:30.031720,0.002053707768108612,RBF,0.1897998753512128,0.3300092012922748,2.5,TPESampler,COMPLETE
1222,0.16334780987432077,2025-04-24 21:50:38.663345,2025-04-24 21:50:53.163484,0 days 00:00:14.500139,0.0930445169929666,RBF,0.33141588099529423,0.23650672959436467,2.5,TPESampler,COMPLETE
1223,0.16334780728356202,2025-04-24 21:50:47.137574,2025-04-24 21:50:57.702506,0 days 00:00:10.564932,0.04697444213500745,RBF,105.68548691204057,0.07615857512136416,2.5,TPESampler,COMPLETE
1224,0.16334779992022083,2025-04-24 21:50:53.640384,2025-04-24 21:51:00.347403,0 days 00:00:06.707019,1.7235870633900672,RBF,515.2757192535189,0.2623915355889509,2.5,TPESampler,COMPLETE
1225,0.16334780273822108,2025-04-24 21:50:57.985962,2025-04-24 21:51:06.159486,0 days 00:00:08.173524,0.03717057401240499,RBF,15.823338017930068,0.16236701860657335,2.5,TPESampler,COMPLETE
1226,0.16334780555528164,2025-04-24 21:51:00.614939,2025-04-24 21:51:12.442657,0 days 00:00:11.827718,8.41054796093337,RBF,0.2661300288446271,0.2727614574341714,2.5,TPESampler,COMPLETE
1227,0.9015771955337405,2025-04-24 21:51:01.328177,2025-04-24 21:51:05.826602,0 days 00:00:04.498425,34483.53857797977,Matern,7.665310010614343e-05,2.430405510088301e-09,2.5,TPESampler,COMPLETE
1228,0.163347802310053,2025-04-24 21:51:06.102578,2025-04-24 21:51:15.406103,0 days 00:00:09.303525,0.09860492226255844,RBF,7.670492519763641,0.5840454321977976,2.5,TPESampler,COMPLETE
1229,0.8703401340211395,2025-04-24 21:51:06.477170,2025-04-24 21:51:17.659992,0 days 00:00:11.182822,15.460458279557145,RBF,63.75280067040267,0.017135407351839257,2.5,TPESampler,COMPLETE
1230,0.16334780251541092,2025-04-24 21:51:13.058936,2025-04-24 21:51:19.592139,0 days 00:00:06.533203,104.77750348736029,RBF,4.54375183465653,0.056513167718654216,2.5,TPESampler,COMPLETE
1231,0.8703401340167932,2025-04-24 21:51:15.858720,2025-04-24 21:51:26.107080,0 days 00:00:10.248360,68163.7529025198,RBF,8690.70207370955,5.074679228871662e-10,2.5,TPESampler,COMPLETE
1232,0.8703401340212609,2025-04-24 21:51:17.932487,2025-04-24 21:51:24.287175,0 days 00:00:06.354688,0.20700816173801742,RBF,0.024731508995429613,0.48396344419077025,2.5,TPESampler,COMPLETE
1233,0.8703401340079052,2025-04-24 21:51:19.915762,2025-04-24 21:51:34.749719,0 days 00:00:14.833957,3.5599074382183874e-07,RBF,22006.579396472298,1.1929311793383903e-10,1.5,TPESampler,COMPLETE
1234,0.870340134019693,2025-04-24 21:51:24.592275,2025-04-24 21:51:30.118666,0 days 00:00:05.526391,0.35502259255898044,Matern,0.0693557412409053,0.007153909270825612,2.5,TPESampler,COMPLETE
1235,0.1633478055688881,2025-04-24 21:51:26.421652,2025-04-24 21:51:34.399212,0 days 00:00:07.977560,6.321601756527264,RBF,2.538320456214609,0.040737879168440766,2.5,TPESampler,COMPLETE
1236,0.16334790653806364,2025-04-24 21:51:30.381812,2025-04-24 21:51:35.524988,0 days 00:00:05.143176,22.424884039302356,RBF,7.015947689130687,0.02127481963986146,2.5,TPESampler,COMPLETE
1237,0.9015771955339735,2025-04-24 21:51:34.674864,2025-04-24 21:51:38.824626,0 days 00:00:04.149762,13985.471206621252,RBF,1.1115494256426319e-05,7.610138269312251e-06,2.5,TPESampler,COMPLETE
1238,0.21977494217250237,2025-04-24 21:51:35.034960,2025-04-24 21:51:40.877335,0 days 00:00:05.842375,0.29637458442018816,Matern,2.5402589171593064,0.005813665261535773,0.5,TPESampler,COMPLETE
1239,0.16334780031839738,2025-04-24 21:51:35.765859,2025-04-24 21:51:45.273732,0 days 00:00:09.507873,0.03610375361794582,RBF,45.49894205166267,0.6795132924727392,2.5,TPESampler,COMPLETE
1240,0.16334780949772634,2025-04-24 21:51:39.096979,2025-04-24 21:51:44.935400,0 days 00:00:05.838421,0.3735916757705052,RBF,1.3139218844597338,0.0018508203341887023,2.5,TPESampler,COMPLETE
1241,0.8703401340327379,2025-04-24 21:51:41.185313,2025-04-24 21:51:50.166035,0 days 00:00:08.980722,0.5108273091902585,RBF,49.75501541275208,0.008281698675971384,2.5,TPESampler,COMPLETE
1242,0.8703401340192871,2025-04-24 21:51:45.212169,2025-04-24 21:51:52.045116,0 days 00:00:06.832947,0.018325703117476624,RBF,6.697582197702543,0.0011512580064342416,0.5,TPESampler,COMPLETE
1243,0.8703401339794304,2025-04-24 21:51:45.533719,2025-04-24 21:51:50.254943,0 days 00:00:04.721224,0.0012042219500010716,RBF,3.478940416560777e-05,4.797411450945091e-07,1.5,TPESampler,COMPLETE
1244,0.870340134020475,2025-04-24 21:51:50.371494,2025-04-24 21:52:02.094451,0 days 00:00:11.722957,158.59973297227023,RBF,1018.0195439238742,0.005835226364539991,2.5,TPESampler,COMPLETE
1245,0.16334778689967236,2025-04-24 21:51:50.494230,2025-04-24 21:51:57.528346,0 days 00:00:07.034116,21.15791346275031,RBF,457.67845396389197,0.731762105214921,2.5,TPESampler,COMPLETE
1246,0.16334780677246827,2025-04-24 21:51:52.315209,2025-04-24 21:51:58.095004,0 days 00:00:05.779795,399.4042448214047,RBF,9.753233807784452,0.007602351283794615,2.5,TPESampler,COMPLETE
1247,0.8703401340159694,2025-04-24 21:51:57.836535,2025-04-24 21:52:03.071190,0 days 00:00:05.234655,5.2241240610929855,RBF,0.035224977059499264,0.9881386732536515,2.5,TPESampler,COMPLETE
1248,0.25129081144244686,2025-04-24 21:51:58.363277,2025-04-24 21:52:10.717964,0 days 00:00:12.354687,0.05172877581208492,RBF,375.7726823607083,0.9798618493165295,2.5,TPESampler,COMPLETE
1249,0.8703401340210388,2025-04-24 21:52:02.372048,2025-04-24 21:52:11.870671,0 days 00:00:09.498623,6.961552674696534,RBF,30.85393299274496,0.009514346911857196,2.5,TPESampler,COMPLETE
1250,0.8703401340190986,2025-04-24 21:52:03.370403,2025-04-24 21:52:11.085653,0 days 00:00:07.715250,0.10126555463316989,RBF,3.2793372420835674,0.002261220854592983,2.5,TPESampler,COMPLETE
1251,0.16334780748241237,2025-04-24 21:52:10.994102,2025-04-24 21:52:17.000717,0 days 00:00:06.006615,386.21880612292944,RBF,1132.511140477703,0.13246643301957103,2.5,TPESampler,COMPLETE
1252,0.16334778741633318,2025-04-24 21:52:11.358691,2025-04-24 21:52:20.348213,0 days 00:00:08.989522,6.7115946042606955,RBF,11.672827628360691,0.9329446635696487,2.5,TPESampler,COMPLETE
1253,0.16334781499803033,2025-04-24 21:52:12.201554,2025-04-24 21:52:18.826464,0 days 00:00:06.624910,112.73912876893831,RBF,4.8536477105511455,0.9928537899262087,2.5,TPESampler,COMPLETE
1254,0.9012359984650335,2025-04-24 21:52:17.247945,2025-04-24 21:52:30.628016,0 days 00:00:13.380071,0.0005036581679040411,RBF,0.9098319453523535,0.0075420086238509034,2.5,TPESampler,COMPLETE
1255,0.1633478093030209,2025-04-24 21:52:19.096117,2025-04-24 21:52:26.755684,0 days 00:00:07.659567,66431.87088954658,RBF,7.230631691420548,0.009969665317757264,0.5,TPESampler,COMPLETE
1256,0.1633477717872002,2025-04-24 21:52:20.593966,2025-04-24 21:52:27.897662,0 days 00:00:07.303696,0.004529419928980108,RBF,0.6504599528902169,0.19150426921123567,0.5,TPESampler,COMPLETE
1257,0.163347759358503,2025-04-24 21:52:27.030496,2025-04-24 21:52:33.274655,0 days 00:00:06.244159,17.957200021890745,RBF,5.853057995040901,0.009417587195562419,2.5,TPESampler,COMPLETE
1258,0.16334779619375356,2025-04-24 21:52:28.203310,2025-04-24 21:52:33.217799,0 days 00:00:05.014489,882.2936270259478,RBF,6.616242294427755,0.003602247796556061,2.5,TPESampler,COMPLETE
1259,0.16334780652031813,2025-04-24 21:52:30.887727,2025-04-24 21:52:38.727203,0 days 00:00:07.839476,0.9601837945244106,RBF,5.742460914757847,0.769164233418467,2.5,TPESampler,COMPLETE
1260,0.870340134021446,2025-04-24 21:52:33.443165,2025-04-24 21:52:48.188764,0 days 00:00:14.745599,20.743543864975475,Matern,78284.39638113884,5.193933540976654e-09,2.5,TPESampler,COMPLETE
1261,0.1634431235211818,2025-04-24 21:52:33.488848,2025-04-24 21:52:41.363142,0 days 00:00:07.874294,13.708184607512006,Matern,0.9065471639890077,0.07496723879755685,2.5,TPESampler,COMPLETE
1262,0.9015771955347484,2025-04-24 21:52:38.991314,2025-04-24 21:52:43.311964,0 days 00:00:04.320650,362.8546862205214,RBF,0.05839961605188158,7.372788400383128e-06,0.5,TPESampler,COMPLETE
1263,0.21977494768121067,2025-04-24 21:52:41.710159,2025-04-24 21:52:50.910903,0 days 00:00:09.200744,1.6612973188952448e-07,Matern,2.959540770811478,2.0942876393094797e-08,0.5,TPESampler,COMPLETE
1264,0.8703401340206611,2025-04-24 21:52:43.655509,2025-04-24 21:52:52.497924,0 days 00:00:08.842415,303.49690792769337,RBF,2233.456330838501,0.0005067259531454039,2.5,TPESampler,COMPLETE
1265,0.16334778394760516,2025-04-24 21:52:48.519149,2025-04-24 21:52:54.685718,0 days 00:00:06.166569,47.79301546857462,RBF,307.0068594139664,0.8287753553637455,2.5,TPESampler,COMPLETE
1266,0.16344297400725735,2025-04-24 21:52:51.176342,2025-04-24 21:52:56.965864,0 days 00:00:05.789522,80.37853603068736,Matern,17.29410031840723,0.13268104714325601,2.5,TPESampler,COMPLETE
1267,0.8703401340222843,2025-04-24 21:52:52.757435,2025-04-24 21:53:03.326873,0 days 00:00:10.569438,2.2424992954596568,RBF,469.10547667111797,0.00040818195611576585,2.5,TPESampler,COMPLETE
1268,0.1633478182544916,2025-04-24 21:52:54.984820,2025-04-24 21:53:02.969595,0 days 00:00:07.984775,2.409416254490449,RBF,1.8605114404389715,0.003058056284796508,0.5,TPESampler,COMPLETE
1269,0.901577742347805,2025-04-24 21:52:57.233647,2025-04-24 21:53:00.545761,0 days 00:00:03.312114,826.063523591125,Matern,15.831988756803232,1.0848085141627772e-05,0.5,TPESampler,COMPLETE
1270,0.8703401340197775,2025-04-24 21:53:00.796975,2025-04-24 21:53:07.641563,0 days 00:00:06.844588,0.00021164334630617695,RBF,3.1054357216094846,7.765270379114623e-06,0.5,TPESampler,COMPLETE
1271,0.1633477603169887,2025-04-24 21:53:03.244438,2025-04-24 21:53:10.592732,0 days 00:00:07.348294,2483.5063528646415,RBF,0.5883380289633312,0.07354161912839906,2.5,TPESampler,COMPLETE
1272,0.1633478093554991,2025-04-24 21:53:03.547515,2025-04-24 21:53:10.914632,0 days 00:00:07.367117,9542.270365861263,RBF,76.88824943652463,0.0013227734931039758,2.5,TPESampler,COMPLETE
1273,0.1633477837877978,2025-04-24 21:53:07.945601,2025-04-24 21:53:15.801021,0 days 00:00:07.855420,61781.77914006476,RBF,1866.4558896302387,0.06108078288710902,0.5,TPESampler,COMPLETE
