number,value,datetime_start,datetime_complete,duration,params_constant_value,params_kernel_type,params_length_scale,params_noise_level,params_nu,system_attrs_auto:sampler,state
1274,0.1633478081693558,2025-04-24 21:53:10.868397,2025-04-24 21:53:22.478737,0 days 00:00:11.610340,4.430419036182563,RBF,0.44452074796987145,0.15976235790844326,2.5,TPESampler,COMPLETE
1275,0.8703399835860733,2025-04-24 21:53:11.189475,2025-04-24 21:53:22.409044,0 days 00:00:11.219569,0.1007402510251566,RBF,11.827023158023465,0.05166647231381258,1.5,TPESampler,COMPLETE
1276,0.8703401340214917,2025-04-24 21:53:16.156545,2025-04-24 21:53:32.023171,0 days 00:00:15.866626,32473.629941868294,RBF,25.609578696008203,1.0648234074119535e-06,2.5,TPESampler,COMPLETE
1277,0.16334781596028133,2025-04-24 21:53:22.615909,2025-04-24 21:53:34.882700,0 days 00:00:12.266791,653.2817404498264,RBF,10.945515221928494,0.006128726547605102,2.5,TPESampler,COMPLETE
1278,0.8703401340141349,2025-04-24 21:53:22.688725,2025-04-24 21:53:33.773403,0 days 00:00:11.084678,0.0714763625229207,RBF,0.1427097508138803,0.00012532854858515635,0.5,TPESampler,COMPLETE
1279,0.9015779688162837,2025-04-24 21:53:32.753374,2025-04-24 21:53:40.326300,0 days 00:00:07.572926,22.680482269895503,RBF,31700.904949088515,0.7421790465586009,2.5,TPESampler,COMPLETE
1280,0.9015742279927196,2025-04-24 21:53:34.009403,2025-04-24 21:53:38.915021,0 days 00:00:04.905618,5.205690600569766e-07,Matern,0.26614680485824754,0.02637408000775294,2.5,TPESampler,COMPLETE
1281,0.8703401340212739,2025-04-24 21:53:35.187580,2025-04-24 21:53:44.933154,0 days 00:00:09.745574,70.91944101304988,RBF,728.5472533979078,0.023622252595514565,2.5,TPESampler,COMPLETE
1282,0.16334781673543955,2025-04-24 21:53:39.239446,2025-04-24 21:53:49.952121,0 days 00:00:10.712675,0.008167713629312305,RBF,0.8283581858933765,0.04404587875257121,2.5,TPESampler,COMPLETE
1283,0.8703401342549416,2025-04-24 21:53:40.630272,2025-04-24 21:53:51.097452,0 days 00:00:10.467180,54252.598766914176,RBF,918.2606465583326,0.0008427489735573979,0.5,TPESampler,COMPLETE
1284,0.16334780912267013,2025-04-24 21:53:45.191855,2025-04-24 21:53:54.136946,0 days 00:00:08.945091,0.05682497199409581,RBF,0.259981603265564,0.03833313229811354,2.5,TPESampler,COMPLETE
1285,0.8703401340211917,2025-04-24 21:53:50.256040,2025-04-24 21:53:55.585104,0 days 00:00:05.329064,18428.62883921618,RBF,0.00012979890450940347,0.20477059647031842,2.5,TPESampler,COMPLETE
1286,0.16334778870746094,2025-04-24 21:53:51.371966,2025-04-24 21:53:56.317221,0 days 00:00:04.945255,3000.3711765487296,RBF,27.27925663466382,0.011493485728894857,2.5,TPESampler,COMPLETE
1287,0.8703401340210992,2025-04-24 21:53:54.409418,2025-04-24 21:54:03.618867,0 days 00:00:09.209449,6.901213903639499,RBF,121.10768435197717,0.012701707827687538,2.5,TPESampler,COMPLETE
1288,0.16334780312884015,2025-04-24 21:53:55.892955,2025-04-24 21:54:02.632051,0 days 00:00:06.739096,97042.32936382115,RBF,8596.83824506508,0.10902599912801969,0.5,TPESampler,COMPLETE
1289,0.8703401340712407,2025-04-24 21:53:56.623863,2025-04-24 21:54:03.924588,0 days 00:00:07.300725,53.5207283094276,RBF,68.09305054710747,0.0006958705657987706,2.5,TPESampler,COMPLETE
1290,0.16334779580517153,2025-04-24 21:54:02.943423,2025-04-24 21:54:12.942038,0 days 00:00:09.998615,42528.901368820196,RBF,678.9792654849322,0.622251087916315,0.5,TPESampler,COMPLETE
1291,0.8703376346513563,2025-04-24 21:54:03.836962,2025-04-24 21:54:15.280120,0 days 00:00:11.443158,0.03550311883485631,RBF,0.20088708142370526,0.9838018744997618,1.5,TPESampler,COMPLETE
1292,0.16334780956998068,2025-04-24 21:54:04.231233,2025-04-24 21:54:15.049437,0 days 00:00:10.818204,86604.1294844491,RBF,2049.261852684091,0.6888621264127696,0.5,TPESampler,COMPLETE
1293,0.16334780911235938,2025-04-24 21:54:13.530519,2025-04-24 21:54:20.508328,0 days 00:00:06.977809,82652.60560072429,RBF,4.530638316780914,0.0018523246171126468,2.5,TPESampler,COMPLETE
1294,0.8703401340218075,2025-04-24 21:54:15.325990,2025-04-24 21:54:23.961553,0 days 00:00:08.635563,0.5082598867547351,RBF,339.52710762040897,0.00543314541392907,1.5,TPESampler,COMPLETE
1295,0.1633478024849901,2025-04-24 21:54:15.514575,2025-04-24 21:54:22.654885,0 days 00:00:07.140310,8.754372803155112,RBF,6.465757952455234,0.013620367210122537,2.5,TPESampler,COMPLETE
1296,0.8703401340583948,2025-04-24 21:54:20.811061,2025-04-24 21:54:27.658731,0 days 00:00:06.847670,258.62424031415986,RBF,99.75160693362051,8.036493203513561e-05,2.5,TPESampler,COMPLETE
1297,0.1633477926366376,2025-04-24 21:54:22.912773,2025-04-24 21:54:33.129049,0 days 00:00:10.216276,46.98504720591416,RBF,0.2748553250968802,0.04883204921028807,2.5,TPESampler,COMPLETE
1298,0.8703401340547571,2025-04-24 21:54:24.302703,2025-04-24 21:54:27.930156,0 days 00:00:03.627453,0.8764593449165201,RBF,0.05341669031696914,0.00315723808572045,2.5,TPESampler,COMPLETE
1299,0.870340133999392,2025-04-24 21:54:27.890406,2025-04-24 21:54:34.327281,0 days 00:00:06.436875,112.93159591840717,RBF,70.86844137673471,0.00019525225703384262,0.5,TPESampler,COMPLETE
1300,0.8703401340215193,2025-04-24 21:54:28.234377,2025-04-24 21:54:36.947707,0 days 00:00:08.713330,5.733650143560324e-07,RBF,8.712672032946255e-05,1.0716361284081751e-10,1.5,TPESampler,COMPLETE
1301,0.8703401340197789,2025-04-24 21:54:33.389236,2025-04-24 21:54:39.041429,0 days 00:00:05.652193,0.2164807021593963,Matern,0.00015053248281355022,2.8877603397488738e-05,2.5,TPESampler,COMPLETE
1302,0.16334780705653937,2025-04-24 21:54:34.581278,2025-04-24 21:54:39.780178,0 days 00:00:05.198900,108.83143256282695,RBF,6.245151456976412,0.013730644154700341,0.5,TPESampler,COMPLETE
1303,0.16334777393029729,2025-04-24 21:54:37.265124,2025-04-24 21:54:44.620557,0 days 00:00:07.355433,668.4787265891877,RBF,0.648721749477369,0.0065782173389334715,2.5,TPESampler,COMPLETE
1304,0.1633478111044048,2025-04-24 21:54:39.353319,2025-04-24 21:54:44.647733,0 days 00:00:05.294414,20956.35089635003,RBF,15.706080744268107,0.4240637059059535,0.5,TPESampler,COMPLETE
1305,0.16334780646373073,2025-04-24 21:54:40.036205,2025-04-24 21:54:46.959663,0 days 00:00:06.923458,51.03723912901065,RBF,12.813247532243926,0.5103814176926113,2.5,TPESampler,COMPLETE
1306,0.8703401340236386,2025-04-24 21:54:44.822826,2025-04-24 21:54:54.789398,0 days 00:00:09.966572,289.1312499373118,RBF,2121.311042201595,0.017481451420615968,2.5,TPESampler,COMPLETE
1307,0.870340134021854,2025-04-24 21:54:44.864341,2025-04-24 21:54:56.507983,0 days 00:00:11.643642,1781.3920420185138,RBF,18022.044575016967,0.0026074081787423745,2.5,TPESampler,COMPLETE
1308,0.1633478379488403,2025-04-24 21:54:47.232571,2025-04-24 21:54:54.047226,0 days 00:00:06.814655,2803.0855130528107,RBF,13.524944623416207,9.882718766305878e-05,2.5,TPESampler,COMPLETE
1309,0.16334781742043003,2025-04-24 21:54:54.352253,2025-04-24 21:55:04.197807,0 days 00:00:09.845554,95616.270154977,RBF,1546.8251504540485,0.3931360966304567,0.5,TPESampler,COMPLETE
1310,0.1633478077818736,2025-04-24 21:54:55.071311,2025-04-24 21:55:06.395980,0 days 00:00:11.324669,0.9441745906924521,RBF,50.104102352236616,0.40479176826250035,2.5,TPESampler,COMPLETE
1311,0.870339916425733,2025-04-24 21:54:56.832427,2025-04-24 21:55:04.423844,0 days 00:00:07.591417,0.39115579897754826,RBF,0.186163074454889,0.03202737973224828,2.5,TPESampler,COMPLETE
1312,0.16334781660799472,2025-04-24 21:55:04.505719,2025-04-24 21:55:10.319509,0 days 00:00:05.813790,2.2262553896691117,RBF,0.9768082778640612,0.13133383537652277,1.5,TPESampler,COMPLETE
1313,0.16334781810263738,2025-04-24 21:55:04.664043,2025-04-24 21:55:13.225554,0 days 00:00:08.561511,99550.5508418164,RBF,611.1605020459268,0.0023343430303973387,0.5,TPESampler,COMPLETE
1314,0.1633478095286501,2025-04-24 21:55:06.686391,2025-04-24 21:55:14.380026,0 days 00:00:07.693635,211.68396655496642,RBF,5.8217069174905145,0.005900216373632561,2.5,TPESampler,COMPLETE
1315,0.870340134017572,2025-04-24 21:55:10.631250,2025-04-24 21:55:19.548712,0 days 00:00:08.917462,2.6397338898675473,RBF,10.279317492297514,0.0009983343665837237,1.5,TPESampler,COMPLETE
1316,0.8703401340319629,2025-04-24 21:55:13.722662,2025-04-24 21:55:24.984153,0 days 00:00:11.261491,0.16489562324352516,RBF,35.66514711761109,0.0006442197733759988,2.5,TPESampler,COMPLETE
1317,0.16334781220658187,2025-04-24 21:55:14.611080,2025-04-24 21:55:24.963966,0 days 00:00:10.352886,0.9545630025119998,RBF,17.622347480597636,0.8978023368438344,2.5,TPESampler,COMPLETE
1318,0.16334778254631713,2025-04-24 21:55:19.864016,2025-04-24 21:55:28.740176,0 days 00:00:08.876160,1.1338786745073837,RBF,0.41303926586937517,0.4535405611925496,0.5,TPESampler,COMPLETE
1319,0.1633478089729316,2025-04-24 21:55:25.180497,2025-04-24 21:55:33.162315,0 days 00:00:07.981818,88463.4181880523,RBF,58.57811242458675,0.0029639779050983786,0.5,TPESampler,COMPLETE
1320,0.1633478406106952,2025-04-24 21:55:25.232585,2025-04-24 21:55:38.521616,0 days 00:00:13.289031,43286.88236094071,RBF,0.27946721637991234,0.8631535719187734,2.5,TPESampler,COMPLETE
1321,0.8703401340146052,2025-04-24 21:55:29.079255,2025-04-24 21:55:38.926116,0 days 00:00:09.846861,4603.213802531484,RBF,438.30225721512267,0.001896804922047985,2.5,TPESampler,COMPLETE
1322,0.16334781633384643,2025-04-24 21:55:33.440929,2025-04-24 21:55:40.217645,0 days 00:00:06.776716,39002.43358518387,RBF,172.60906336928485,0.06934254651517274,2.5,TPESampler,COMPLETE
1323,0.16334802153180267,2025-04-24 21:55:38.786778,2025-04-24 21:55:45.822025,0 days 00:00:07.035247,118.10601582268062,RBF,1.566258010079594,0.21949286223369197,2.5,TPESampler,COMPLETE
1324,0.16334780783894454,2025-04-24 21:55:39.200151,2025-04-24 21:55:46.755961,0 days 00:00:07.555810,75.47183482470437,RBF,123.23391398406984,0.06718887527664169,2.5,TPESampler,COMPLETE
1325,0.8703401340183023,2025-04-24 21:55:40.491961,2025-04-24 21:55:48.266934,0 days 00:00:07.774973,836.443393118557,RBF,20.870224064574817,7.434349117412344e-05,2.5,TPESampler,COMPLETE
1326,0.8703401340271428,2025-04-24 21:55:46.122941,2025-04-24 21:55:56.630385,0 days 00:00:10.507444,0.96842994036333,RBF,1859.8837090995598,0.009711631393715413,2.5,TPESampler,COMPLETE
1327,0.16334780182462663,2025-04-24 21:55:46.995733,2025-04-24 21:55:55.784089,0 days 00:00:08.788356,0.0018741323329480256,RBF,4.3587892306733895,0.2295523312715294,2.5,TPESampler,COMPLETE
1328,0.8703401340215193,2025-04-24 21:55:48.590105,2025-04-24 21:55:57.693539,0 days 00:00:09.103434,3.445637138953426e-07,RBF,0.0522356852659947,7.517055303159254e-09,0.5,TPESampler,COMPLETE
1329,0.8703401340001099,2025-04-24 21:55:56.116080,2025-04-24 21:56:19.932452,0 days 00:00:23.816372,44.089556408537746,RBF,56.15706421529051,0.006274794947841626,2.5,TPESampler,COMPLETE
1330,0.16334780128401144,2025-04-24 21:55:56.900525,2025-04-24 21:56:16.694613,0 days 00:00:19.794088,89966.07281071805,RBF,3149.207214702429,0.030624710695588062,0.5,TPESampler,COMPLETE
1331,0.8703401340118231,2025-04-24 21:55:57.973673,2025-04-24 21:56:14.946772,0 days 00:00:16.973099,55864.07464134336,RBF,0.03889346871893878,0.0005227816899154776,2.5,TPESampler,COMPLETE
1332,0.16334780684130024,2025-04-24 21:56:15.639172,2025-04-24 21:56:21.782175,0 days 00:00:06.143003,815.5175430041992,RBF,94.01039229137345,0.019525298958089223,0.5,TPESampler,COMPLETE
1333,0.9015771955260847,2025-04-24 21:56:17.194890,2025-04-24 21:56:21.050654,0 days 00:00:03.855764,11086.724505488797,Matern,0.1109082515906125,0.0018730137876472887,2.5,TPESampler,COMPLETE
1334,0.1633478218415912,2025-04-24 21:56:20.307022,2025-04-24 21:56:28.037654,0 days 00:00:07.730632,1.6577656728928518,RBF,1.140027743995554,0.008245978578528526,2.5,TPESampler,COMPLETE
1335,0.219774908458001,2025-04-24 21:56:21.289823,2025-04-24 21:56:28.418781,0 days 00:00:07.128958,48479.562088383354,Matern,205.59191599687395,0.044817330745608584,0.5,TPESampler,COMPLETE
1336,0.16334782618408542,2025-04-24 21:56:22.036521,2025-04-24 21:56:27.968422,0 days 00:00:05.931901,76091.58428254494,RBF,247.07241526197282,0.061732965840606537,0.5,TPESampler,COMPLETE
1337,0.163347776349939,2025-04-24 21:56:28.148609,2025-04-24 21:56:33.894267,0 days 00:00:05.745658,56.31120993014336,RBF,417.19718827232094,0.7523830668464813,2.5,TPESampler,COMPLETE
1338,0.9015779748978379,2025-04-24 21:56:28.281368,2025-04-24 21:56:32.883462,0 days 00:00:04.602094,75399.26711211252,RBF,1.8713347125985973,4.541755565287195e-06,2.5,TPESampler,COMPLETE
1339,0.8703401340541936,2025-04-24 21:56:28.672694,2025-04-24 21:56:34.245588,0 days 00:00:05.572894,4.4177556353011465,RBF,4.851386605317856,2.5449405177706727e-05,0.5,TPESampler,COMPLETE
1340,0.1633478074755318,2025-04-24 21:56:33.184085,2025-04-24 21:56:41.870284,0 days 00:00:08.686199,4.794929206259629,RBF,4.339860558284706,0.6818522577748248,2.5,TPESampler,COMPLETE
1341,0.8703401340318976,2025-04-24 21:56:34.168417,2025-04-24 21:56:43.886317,0 days 00:00:09.717900,9.33838629964802e-07,Matern,40.6067880722433,1.663346723621231e-10,2.5,TPESampler,COMPLETE
1342,0.16334780230339466,2025-04-24 21:56:34.526764,2025-04-24 21:56:40.174021,0 days 00:00:05.647257,0.18677691041060238,RBF,1.850723270527241,0.6697391198058611,2.5,TPESampler,COMPLETE
1343,0.870340134024903,2025-04-24 21:56:40.430978,2025-04-24 21:56:48.536215,0 days 00:00:08.105237,80811.49598664031,RBF,6283.719731707764,0.0030780959291086003,0.5,TPESampler,COMPLETE
1344,0.16334776939016948,2025-04-24 21:56:42.116023,2025-04-24 21:56:49.012993,0 days 00:00:06.896970,71914.72570789495,RBF,28.043574596998432,0.23416093625882356,0.5,TPESampler,COMPLETE
1345,0.1633477930639795,2025-04-24 21:56:44.147850,2025-04-24 21:56:51.635834,0 days 00:00:07.487984,97280.38093271534,RBF,11541.98751950937,0.33232932759936873,0.5,TPESampler,COMPLETE
1346,0.16334780939498234,2025-04-24 21:56:48.842963,2025-04-24 21:56:54.305327,0 days 00:00:05.462364,212.5133177258777,RBF,88.90172747235744,0.7569577288754995,0.5,TPESampler,COMPLETE
1347,0.16334782082835472,2025-04-24 21:56:49.314583,2025-04-24 21:56:58.973799,0 days 00:00:09.659216,1514.1693743627206,RBF,21.654935115132492,0.0005268541672667723,2.5,TPESampler,COMPLETE
1348,0.1633478131377841,2025-04-24 21:56:51.937137,2025-04-24 21:56:59.447839,0 days 00:00:07.510702,3.28583265038324,RBF,1.332775628440768,0.005844866430308467,1.5,TPESampler,COMPLETE
1349,0.8703401340211931,2025-04-24 21:56:54.561914,2025-04-24 21:57:08.358059,0 days 00:00:13.796145,1.3102858793968118e-07,RBF,9.234580737436105e-05,1.866539273108323e-05,0.5,TPESampler,COMPLETE
1350,0.8703401223326108,2025-04-24 21:56:59.291257,2025-04-24 21:57:06.857790,0 days 00:00:07.566533,2.9599854032716455,RBF,0.1697824774620109,0.00022214394933927652,0.5,TPESampler,COMPLETE
1351,0.16334779912213582,2025-04-24 21:56:59.785454,2025-04-24 21:57:09.904650,0 days 00:00:10.119196,30.514761686537497,RBF,2.5273492188727356,0.004434398809302612,2.5,TPESampler,COMPLETE
1352,0.9015770823368617,2025-04-24 21:57:07.114763,2025-04-24 21:57:10.750616,0 days 00:00:03.635853,7.693556271330413e-06,RBF,0.0070347057947697696,0.0698336414831393,2.5,TPESampler,COMPLETE
1353,0.870340134021245,2025-04-24 21:57:08.618342,2025-04-24 21:57:12.576982,0 days 00:00:03.958640,1.1160518041543883,RBF,0.017867055254794418,0.005954887549389257,0.5,TPESampler,COMPLETE
1354,0.16334780855164782,2025-04-24 21:57:10.162854,2025-04-24 21:57:16.075212,0 days 00:00:05.912358,61607.35892665261,RBF,6.199332907087232,0.000971080378897382,2.5,TPESampler,COMPLETE
1355,0.8703401338693071,2025-04-24 21:57:11.037033,2025-04-24 21:57:19.036841,0 days 00:00:07.999808,0.06548703043295896,RBF,21.878553102421602,0.006700560612154676,2.5,TPESampler,COMPLETE
1356,0.1633478032600401,2025-04-24 21:57:12.871860,2025-04-24 21:57:18.712061,0 days 00:00:05.840201,1237.8013960624003,RBF,26.572137820820704,0.7932929443159064,0.5,TPESampler,COMPLETE
1357,0.16334782579128565,2025-04-24 21:57:16.371452,2025-04-24 21:57:26.228634,0 days 00:00:09.857182,206.22086990182805,RBF,215.91670735850593,0.009003325944691212,2.5,TPESampler,COMPLETE
1358,0.870340134021201,2025-04-24 21:57:18.995982,2025-04-24 21:57:24.504969,0 days 00:00:05.508987,446.71318342880585,RBF,0.08000526359189927,0.8633995133222077,2.5,TPESampler,COMPLETE
1359,0.1633478152975525,2025-04-24 21:57:19.331092,2025-04-24 21:57:25.303257,0 days 00:00:05.972165,3326.812938818064,RBF,71.452478258523,0.034859582835382756,2.5,TPESampler,COMPLETE
1360,0.16334780826336281,2025-04-24 21:57:24.807147,2025-04-24 21:57:36.908836,0 days 00:00:12.101689,0.11333119836999811,RBF,0.23311422866319856,0.9247719216000361,2.5,TPESampler,COMPLETE
1361,0.8703401340283844,2025-04-24 21:57:25.569271,2025-04-24 21:57:30.929931,0 days 00:00:05.360660,3.6948112461559077,RBF,0.043517640469990716,0.5496522332500076,1.5,TPESampler,COMPLETE
1362,0.16334779723562126,2025-04-24 21:57:26.625403,2025-04-24 21:57:37.469683,0 days 00:00:10.844280,2679.658241780364,RBF,62065.20528189905,0.8398302719334695,0.5,TPESampler,COMPLETE
1363,0.8703401340219018,2025-04-24 21:57:31.244663,2025-04-24 21:57:38.508979,0 days 00:00:07.264316,12.029922786511898,RBF,58.48435325538281,0.0001805859807668155,1.5,TPESampler,COMPLETE
1364,0.1633478114760723,2025-04-24 21:57:37.220252,2025-04-24 21:57:43.102692,0 days 00:00:05.882440,3649.9456939446577,RBF,305.5022078353609,0.023847524201836133,0.5,TPESampler,COMPLETE
1365,0.1633478078436155,2025-04-24 21:57:37.745000,2025-04-24 21:57:43.839349,0 days 00:00:06.094349,76.72470862531613,RBF,53.45335232890185,0.8880709425415941,2.5,TPESampler,COMPLETE
1366,0.16334782103498652,2025-04-24 21:57:38.748622,2025-04-24 21:57:44.310001,0 days 00:00:05.561379,81.51997642379348,RBF,11.399030818012777,0.010188985451174295,2.5,TPESampler,COMPLETE
1367,0.8703401340221316,2025-04-24 21:57:43.364589,2025-04-24 21:57:53.296161,0 days 00:00:09.931572,0.12098679091642417,RBF,418.1877152857115,1.2704695926883228e-05,1.5,TPESampler,COMPLETE
1368,0.8703401340213597,2025-04-24 21:57:44.069933,2025-04-24 21:57:53.777023,0 days 00:00:09.707090,1838.4151338953725,RBF,682.8965545339593,0.00015872224384464473,0.5,TPESampler,COMPLETE
1369,0.16334780437765306,2025-04-24 21:57:44.548304,2025-04-24 21:57:52.951045,0 days 00:00:08.402741,0.06552644391016897,RBF,0.5877147918587036,0.014688700871996413,0.5,TPESampler,COMPLETE
1370,0.8703401339632527,2025-04-24 21:57:53.249687,2025-04-24 21:57:59.284738,0 days 00:00:06.035051,7.197373779284518,RBF,109.97465911098115,0.0013879132782864494,1.5,TPESampler,COMPLETE
1371,0.16334778847909065,2025-04-24 21:57:53.674895,2025-04-24 21:57:59.673787,0 days 00:00:05.998892,1145.2844487935272,RBF,3751.8345876154854,0.3053749652051363,0.5,TPESampler,COMPLETE
1372,0.1633478114779211,2025-04-24 21:57:54.031535,2025-04-24 21:57:59.553994,0 days 00:00:05.522459,3455.251428640831,RBF,15.094947199102585,0.0006063165260926064,0.5,TPESampler,COMPLETE
1373,0.16334782392843603,2025-04-24 21:57:59.510208,2025-04-24 21:58:08.607108,0 days 00:00:09.096900,15.646223897737139,RBF,4.233735162773831,0.004259103964905012,1.5,TPESampler,COMPLETE
1374,0.8703401340125282,2025-04-24 21:57:59.822988,2025-04-24 21:58:06.109861,0 days 00:00:06.286873,0.24691900183130622,RBF,0.01525095833900352,0.6275502704813556,2.5,TPESampler,COMPLETE
1375,0.163347812296394,2025-04-24 21:57:59.874345,2025-04-24 21:58:06.464189,0 days 00:00:06.589844,12.79190336487309,RBF,3.9010457057583565,0.000516720409449014,2.5,TPESampler,COMPLETE
1376,0.16334781453422653,2025-04-24 21:58:06.382666,2025-04-24 21:58:15.616316,0 days 00:00:09.233650,12.920696062241625,RBF,0.3377979068410013,0.818589443711575,2.5,TPESampler,COMPLETE
1377,0.8703401340179756,2025-04-24 21:58:06.721135,2025-04-24 21:58:16.701992,0 days 00:00:09.980857,288.97079948430905,RBF,363.8634367496019,2.9583335139267244e-05,2.5,TPESampler,COMPLETE
1378,0.8703401340192695,2025-04-24 21:58:08.918079,2025-04-24 21:58:13.848324,0 days 00:00:04.930245,10949.883873602128,Matern,0.00038097221227806365,0.09898354775549055,1.5,TPESampler,COMPLETE
1379,0.163443164663898,2025-04-24 21:58:14.159714,2025-04-24 21:58:19.808873,0 days 00:00:05.649159,73.5001804024506,Matern,403.78595679409693,0.242117039619333,2.5,TPESampler,COMPLETE
1380,0.16344321346709945,2025-04-24 21:58:15.939350,2025-04-24 21:58:21.518303,0 days 00:00:05.578953,14729.449608694304,Matern,78.31925478999574,0.6606008155415698,2.5,TPESampler,COMPLETE
1381,0.16334778085179183,2025-04-24 21:58:16.993447,2025-04-24 21:58:24.372165,0 days 00:00:07.378718,0.9804525830443497,RBF,2.934674161079137,0.48493488668001383,1.5,TPESampler,COMPLETE
1382,0.1633478189511006,2025-04-24 21:58:20.144225,2025-04-24 21:58:29.151833,0 days 00:00:09.007608,6.609675980523773,RBF,3.622300367506381,0.014659899704538055,2.5,TPESampler,COMPLETE
1383,0.16334780484034706,2025-04-24 21:58:21.830481,2025-04-24 21:58:27.796385,0 days 00:00:05.965904,16629.439722162722,RBF,607.9469045781374,0.5530992735442399,0.5,TPESampler,COMPLETE
1384,0.8703401340211437,2025-04-24 21:58:24.685067,2025-04-24 21:58:31.569886,0 days 00:00:06.884819,12.032087908203529,RBF,57.090344480928565,0.0010695008409234413,2.5,TPESampler,COMPLETE
1385,0.1633478066937007,2025-04-24 21:58:28.106652,2025-04-24 21:58:35.641394,0 days 00:00:07.534742,26671.01366815639,RBF,21816.81691219639,0.9953074942488815,0.5,TPESampler,COMPLETE
1386,0.9015779748834999,2025-04-24 21:58:29.459876,2025-04-24 21:58:33.432595,0 days 00:00:03.972719,90608.20117486805,RBF,0.805101072966819,4.951336709787379e-05,2.5,TPESampler,COMPLETE
1387,0.16334780962928136,2025-04-24 21:58:31.832603,2025-04-24 21:58:45.447030,0 days 00:00:13.614427,2842.107153350395,RBF,0.2624625164184518,0.0007603031651882059,2.5,TPESampler,COMPLETE
1388,0.8703401340215193,2025-04-24 21:58:33.717063,2025-04-24 21:58:45.404563,0 days 00:00:11.687500,7.764578630975185e-06,Matern,0.04303610286598144,1.2161687900682323e-07,1.5,TPESampler,COMPLETE
1389,0.16334780351485595,2025-04-24 21:58:35.990125,2025-04-24 21:58:43.477046,0 days 00:00:07.486921,18595.796491834837,RBF,129.00739451734043,0.8890114489255088,0.5,TPESampler,COMPLETE
