number,value,datetime_start,datetime_complete,duration,params_constant_value,params_kernel_type,params_length_scale,params_noise_level,params_nu,system_attrs_auto:sampler,state
1043,0.9015779741431311,2025-04-24 21:43:14.647976,2025-04-24 21:43:17.529098,0 days 00:00:02.881122,55189.13983785866,RBF,0.5209694994419093,6.933236167118725e-05,2.5,TPESampler,COMPLETE
1044,0.8703401340209233,2025-04-24 21:43:17.639725,2025-04-24 21:43:22.579327,0 days 00:00:04.939602,4.54447836079853,RBF,0.0006693816977763628,0.2725053641886849,1.5,TPESampler,COMPLETE
1045,0.8703401340208393,2025-04-24 21:43:17.682370,2025-04-24 21:43:25.666477,0 days 00:00:07.984107,2191.557439420518,RBF,5052.1130351843485,0.014971333847528,0.5,TPESampler,COMPLETE
1046,0.8703401340198541,2025-04-24 21:43:20.246921,2025-04-24 21:43:25.395310,0 days 00:00:05.148389,26.92718671409777,RBF,0.05983496801853294,0.45219522832395265,2.5,TPESampler,COMPLETE
1047,0.8703401341226935,2025-04-24 21:43:22.836485,2025-04-24 21:43:28.101155,0 days 00:00:05.264670,98.18970437976759,RBF,173.097641535139,0.005429791001163768,2.5,TPESampler,COMPLETE
1048,0.8703401340210722,2025-04-24 21:43:25.618665,2025-04-24 21:43:33.208234,0 days 00:00:07.589569,6.755813516495776,Matern,1978.3905949552245,4.826753008759268e-07,2.5,TPESampler,COMPLETE
1049,0.8703401340425216,2025-04-24 21:43:25.955572,2025-04-24 21:43:32.801207,0 days 00:00:06.845635,28.648807206841568,RBF,43.38770183388547,2.675901376885617e-05,1.5,TPESampler,COMPLETE
1050,0.8703401339874772,2025-04-24 21:43:28.337310,2025-04-24 21:43:37.646177,0 days 00:00:09.308867,11.676455939182507,RBF,4202.106232373143,0.0040847842919802735,0.5,TPESampler,COMPLETE
1051,0.8703401340302988,2025-04-24 21:43:33.083498,2025-04-24 21:43:39.523374,0 days 00:00:06.439876,227.6121860495112,Matern,0.04194862747911548,0.00143066699061095,1.5,TPESampler,COMPLETE
1052,0.8703401340232091,2025-04-24 21:43:33.433295,2025-04-24 21:43:45.405815,0 days 00:00:11.972520,526.3353677921573,RBF,137.77688788361928,0.00047329488427139523,1.5,TPESampler,COMPLETE
1053,0.16334775794570683,2025-04-24 21:43:37.995166,2025-04-24 21:43:46.621424,0 days 00:00:08.626258,622.7381692285079,RBF,2176.110620971792,0.02481791597543611,0.5,TPESampler,COMPLETE
1054,0.8703401340248706,2025-04-24 21:43:39.770892,2025-04-24 21:43:46.034310,0 days 00:00:06.263418,76.1868871778143,RBF,13.094718236366527,8.671612171446621e-05,2.5,TPESampler,COMPLETE
1055,0.1633478278901829,2025-04-24 21:43:45.895652,2025-04-24 21:43:51.424511,0 days 00:00:05.528859,6.519533708131242,RBF,647.5250489450456,0.922610981516181,0.5,TPESampler,COMPLETE
1056,0.1633478386241529,2025-04-24 21:43:46.292211,2025-04-24 21:43:52.415269,0 days 00:00:06.123058,38043.98203862929,RBF,164.5047326559339,0.008983362297246398,0.5,TPESampler,COMPLETE
1057,0.8703401340169669,2025-04-24 21:43:46.896789,2025-04-24 21:43:52.112794,0 days 00:00:05.216005,371.9370166930611,RBF,585.8139973929891,0.0010905648117520822,0.5,TPESampler,COMPLETE
1058,0.16344311470706752,2025-04-24 21:43:51.667747,2025-04-24 21:43:59.400565,0 days 00:00:07.732818,9.14958470798983,Matern,2.358734405873109,0.002817698616499552,2.5,TPESampler,COMPLETE
1059,0.8703401340206589,2025-04-24 21:43:52.355057,2025-04-24 21:44:03.307984,0 days 00:00:10.952927,24.806967913581488,RBF,6386.684204132498,0.0020752151439557124,0.5,TPESampler,COMPLETE
1060,0.8703401340208649,2025-04-24 21:43:52.646874,2025-04-24 21:44:01.373219,0 days 00:00:08.726345,55.063956563244886,RBF,45688.19862033373,0.042131021653852053,0.5,TPESampler,COMPLETE
1061,0.8703401340842651,2025-04-24 21:43:59.689439,2025-04-24 21:44:07.073630,0 days 00:00:07.384191,134.01316801524567,RBF,2461.974177632421,0.002759496666366659,0.5,TPESampler,COMPLETE
1062,0.8703401340125343,2025-04-24 21:44:01.657660,2025-04-24 21:44:08.833895,0 days 00:00:07.176235,3.9324718245731347,RBF,173.56848321490065,0.009725675000849726,0.5,TPESampler,COMPLETE
1063,0.16334781101847795,2025-04-24 21:44:03.618701,2025-04-24 21:44:10.005097,0 days 00:00:06.386396,1774.5305708721755,RBF,821.3819219960045,0.015302501475950537,0.5,TPESampler,COMPLETE
1064,0.9015771955351618,2025-04-24 21:44:07.364631,2025-04-24 21:44:11.088702,0 days 00:00:03.724071,1.1660259088541696,Matern,1.4944123683824851e-05,3.2144850270719503e-06,1.5,TPESampler,COMPLETE
1065,0.16334781265243473,2025-04-24 21:44:09.137260,2025-04-24 21:44:16.013292,0 days 00:00:06.876032,2009.1979393888141,RBF,851.3810656126539,0.010875537907241366,0.5,TPESampler,COMPLETE
1066,0.16334800483378056,2025-04-24 21:44:10.253098,2025-04-24 21:44:16.074072,0 days 00:00:05.820974,52040.420336320996,RBF,5.497675574357576,7.149329315292059e-05,0.5,TPESampler,COMPLETE
1067,0.8703401340216914,2025-04-24 21:44:11.391484,2025-04-24 21:44:19.509946,0 days 00:00:08.118462,58392.36410933024,RBF,93754.63564460352,0.011919049765200319,0.5,TPESampler,COMPLETE
1068,0.8703401340088479,2025-04-24 21:44:16.216480,2025-04-24 21:44:24.958617,0 days 00:00:08.742137,16355.09516334809,RBF,73412.6627403681,6.425801308867604e-05,0.5,TPESampler,COMPLETE
1069,0.16334781827463254,2025-04-24 21:44:16.271420,2025-04-24 21:44:23.791551,0 days 00:00:07.520131,1465.0885799584687,RBF,722.6986952161981,0.9811445161407656,0.5,TPESampler,COMPLETE
1070,0.163347809558028,2025-04-24 21:44:19.794825,2025-04-24 21:44:26.426177,0 days 00:00:06.631352,4730.297265539243,RBF,1507.8010285317014,0.47422537435940015,0.5,TPESampler,COMPLETE
1071,0.8703401340212437,2025-04-24 21:44:24.093083,2025-04-24 21:44:32.603333,0 days 00:00:08.510250,308.172538223984,RBF,1263.7202844103592,0.004633317179819482,0.5,TPESampler,COMPLETE
1072,0.8703401340487851,2025-04-24 21:44:25.244757,2025-04-24 21:44:33.181120,0 days 00:00:07.936363,1094.1873906321025,RBF,46856.113759233456,0.025583396893605476,0.5,TPESampler,COMPLETE
1073,0.8703401340569042,2025-04-24 21:44:26.707281,2025-04-24 21:44:37.148917,0 days 00:00:10.441636,5.927425971957351,RBF,8952.920544544977,0.0003616056800321155,2.5,TPESampler,COMPLETE
1074,0.1633477702908693,2025-04-24 21:44:32.855654,2025-04-24 21:44:38.873050,0 days 00:00:06.017396,126.21013769165302,RBF,13.170941670084217,0.00423557357348208,0.5,TPESampler,COMPLETE
1075,0.21977494769978703,2025-04-24 21:44:33.427707,2025-04-24 21:44:41.493254,0 days 00:00:08.065547,0.08185657635078321,Matern,0.1842932622030852,1.6085063068831222e-09,0.5,TPESampler,COMPLETE
1076,0.16334780937253982,2025-04-24 21:44:37.441303,2025-04-24 21:44:44.091332,0 days 00:00:06.650029,82221.31907927954,RBF,248.78557414622617,0.002289417874621965,2.5,TPESampler,COMPLETE
1077,0.16334776424617123,2025-04-24 21:44:39.126114,2025-04-24 21:44:45.926882,0 days 00:00:06.800768,60102.48921039975,RBF,746.1161192713391,0.05573165167938415,0.5,TPESampler,COMPLETE
1078,0.16334782409755094,2025-04-24 21:44:41.788118,2025-04-24 21:44:46.756109,0 days 00:00:04.967991,164.15434320410253,RBF,433.07669159624487,0.06052766406741579,0.5,TPESampler,COMPLETE
1079,0.901577195534181,2025-04-24 21:44:44.406035,2025-04-24 21:44:48.253858,0 days 00:00:03.847823,4097.987905363959,RBF,0.022973408154900177,6.072019919507197e-10,1.5,TPESampler,COMPLETE
1080,0.16334779470517272,2025-04-24 21:44:46.225471,2025-04-24 21:44:52.481019,0 days 00:00:06.255548,3123.6639114001687,RBF,1829.7270562547678,0.9145380042770268,0.5,TPESampler,COMPLETE
1081,0.870340134019369,2025-04-24 21:44:46.990533,2025-04-24 21:44:54.798948,0 days 00:00:07.808415,157.57543058894132,RBF,485.3069865066093,0.010748603372505947,2.5,TPESampler,COMPLETE
1082,0.8703401340202331,2025-04-24 21:44:48.546799,2025-04-24 21:44:52.787474,0 days 00:00:04.240675,3854.322633488853,RBF,0.03582742236639295,0.017317208292299813,2.5,TPESampler,COMPLETE
1083,0.8703401340112277,2025-04-24 21:44:52.706940,2025-04-24 21:44:58.320951,0 days 00:00:05.614011,89321.1180483492,RBF,23.878753479950962,4.2084029397461156e-05,1.5,TPESampler,COMPLETE
1084,0.870340134021789,2025-04-24 21:44:53.104800,2025-04-24 21:44:58.109313,0 days 00:00:05.004513,13.307980631410388,Matern,0.0019684694650332975,0.09110471802304144,0.5,TPESampler,COMPLETE
1085,0.16334780917489147,2025-04-24 21:44:55.048461,2025-04-24 21:45:01.280900,0 days 00:00:06.232439,46.96664762573308,RBF,1.938249152903008,0.0009603117190131851,2.5,TPESampler,COMPLETE
1086,0.16334780969186366,2025-04-24 21:44:58.308809,2025-04-24 21:45:05.441992,0 days 00:00:07.133183,85758.56039169151,RBF,35856.65915712663,0.19575489596961476,0.5,TPESampler,COMPLETE
1087,0.8703401340174989,2025-04-24 21:44:58.597469,2025-04-24 21:45:04.903959,0 days 00:00:06.306490,1131.7509281330092,RBF,21.991711892261108,1.058687308823657e-06,2.5,TPESampler,COMPLETE
1088,0.16334780563650717,2025-04-24 21:45:01.524942,2025-04-24 21:45:06.317920,0 days 00:00:04.792978,240.09763098671348,RBF,10.525462477361193,0.03715161070013871,2.5,TPESampler,COMPLETE
1089,0.1633478095218053,2025-04-24 21:45:05.196215,2025-04-24 21:45:11.042658,0 days 00:00:05.846443,6836.502015512149,RBF,10.431897068127542,0.0007611093871041364,1.5,TPESampler,COMPLETE
1090,0.16334782385773997,2025-04-24 21:45:05.690818,2025-04-24 21:45:12.388229,0 days 00:00:06.697411,68349.12961307786,RBF,242.34646421900794,0.01013815242260292,0.5,TPESampler,COMPLETE
1091,0.16334780927199596,2025-04-24 21:45:06.624905,2025-04-24 21:45:13.949545,0 days 00:00:07.324640,0.6918310970155871,RBF,0.7560476710321739,0.0002283678905602736,0.5,TPESampler,COMPLETE
1092,0.8703401340434949,2025-04-24 21:45:11.303889,2025-04-24 21:45:20.400607,0 days 00:00:09.096718,2.3503701034981643e-07,RBF,3.915211036549104,6.061622682673524e-06,1.5,TPESampler,COMPLETE
1093,0.16334782128503927,2025-04-24 21:45:12.686664,2025-04-24 21:45:19.846476,0 days 00:00:07.159812,378.9996406759978,RBF,1376.9458347056582,0.024325777292949276,2.5,TPESampler,COMPLETE
1094,0.8703401340217818,2025-04-24 21:45:14.281133,2025-04-24 21:45:23.049617,0 days 00:00:08.768484,529.4294583617841,RBF,4023.4062733145406,0.011175634622374768,0.5,TPESampler,COMPLETE
1095,0.8703401340205125,2025-04-24 21:45:20.158418,2025-04-24 21:45:28.555595,0 days 00:00:08.397177,8.534673425404634,RBF,0.13477516236550016,0.02041379442533845,0.5,TPESampler,COMPLETE
1096,0.2197749467222067,2025-04-24 21:45:20.638230,2025-04-24 21:45:31.467784,0 days 00:00:10.829554,833.6779969899752,Matern,2186.1384898120727,0.09768945770943828,0.5,TPESampler,COMPLETE
1097,0.16334780643346772,2025-04-24 21:45:23.650053,2025-04-24 21:45:31.497343,0 days 00:00:07.847290,240.05583181017437,RBF,410.88656357410736,0.03090281802779204,0.5,TPESampler,COMPLETE
1098,0.8703401340238268,2025-04-24 21:45:28.808754,2025-04-24 21:45:40.754086,0 days 00:00:11.945332,3.931426339345595,Matern,73110.88739663013,7.1607770229361646e-09,1.5,TPESampler,COMPLETE
1099,0.8703401339898429,2025-04-24 21:45:31.631895,2025-04-24 21:45:35.427175,0 days 00:00:03.795280,1.363733966847427,RBF,2.1407932600509917e-05,0.010871306922405764,0.5,TPESampler,COMPLETE
1100,0.16334780572734015,2025-04-24 21:45:31.699549,2025-04-24 21:45:37.332805,0 days 00:00:05.633256,59.656548982877744,RBF,1847.2808612742429,0.8446016682411465,0.5,TPESampler,COMPLETE
1101,0.8703401340220726,2025-04-24 21:45:35.738886,2025-04-24 21:45:43.026349,0 days 00:00:07.287463,1599.0680279337282,RBF,441.47169476727674,0.0009702065909839281,1.5,TPESampler,COMPLETE
1102,0.21977507545123345,2025-04-24 21:45:37.629693,2025-04-24 21:45:44.000920,0 days 00:00:06.371227,6098.643663581908,Matern,14670.020791175531,0.002460399159767863,0.5,TPESampler,COMPLETE
1103,0.8703401340730216,2025-04-24 21:45:41.050605,2025-04-24 21:45:48.101329,0 days 00:00:07.050724,0.04065035954754354,Matern,16041.752810822813,2.1850209893175403e-10,0.5,TPESampler,COMPLETE
1104,0.9015779732709946,2025-04-24 21:45:43.297242,2025-04-24 21:45:46.523680,0 days 00:00:03.226438,2982.10354458067,RBF,0.6069405910560802,2.0382638042913038e-05,2.5,TPESampler,COMPLETE
1105,0.8703401340336268,2025-04-24 21:45:44.306935,2025-04-24 21:45:53.322496,0 days 00:00:09.015561,2.5647036025075414,RBF,458.2584503915296,0.0018627736102758668,2.5,TPESampler,COMPLETE
1106,0.8703401340060503,2025-04-24 21:45:46.841277,2025-04-24 21:45:51.665550,0 days 00:00:04.824273,0.003367110195679593,RBF,0.00047962749308734146,2.3683181866507578e-07,2.5,TPESampler,COMPLETE
1107,0.1633478115453169,2025-04-24 21:45:48.398840,2025-04-24 21:45:55.532095,0 days 00:00:07.133255,766.5673284785286,RBF,889.2954427588643,0.02001692644299217,0.5,TPESampler,COMPLETE
1108,0.16334781470942358,2025-04-24 21:45:51.973907,2025-04-24 21:45:57.779894,0 days 00:00:05.805987,33657.47921698049,RBF,536.4871903299293,0.05444689757874914,0.5,TPESampler,COMPLETE
1109,0.16334779265459848,2025-04-24 21:45:53.615075,2025-04-24 21:46:07.106447,0 days 00:00:13.491372,1625.729702849185,RBF,0.8614018127452437,0.0031555344851993804,0.5,TPESampler,COMPLETE
1110,0.16334780723649958,2025-04-24 21:45:55.843169,2025-04-24 21:46:01.483311,0 days 00:00:05.640142,1133.3552545559328,RBF,96.63275747576473,0.07200956374275248,0.5,TPESampler,COMPLETE
1111,0.16334780620295936,2025-04-24 21:45:58.065067,2025-04-24 21:46:04.028679,0 days 00:00:05.963612,3184.433012473743,RBF,13020.168991365043,0.9335349267745915,0.5,TPESampler,COMPLETE
1112,0.16334780986274808,2025-04-24 21:46:01.780610,2025-04-24 21:46:08.429856,0 days 00:00:06.649246,71.49099024994688,RBF,0.6923261037606677,0.006350555208892162,1.5,TPESampler,COMPLETE
1113,0.9015779749019732,2025-04-24 21:46:04.329130,2025-04-24 21:46:07.539171,0 days 00:00:03.210041,3023.2853143691505,RBF,1.4392338840658874,0.0024089951008785812,2.5,TPESampler,COMPLETE
1114,0.1633477353167185,2025-04-24 21:46:07.394600,2025-04-24 21:46:12.057041,0 days 00:00:04.662441,50.91572638558868,RBF,7.484040216571057,0.16927714692468496,2.5,TPESampler,COMPLETE
1115,0.1633478182424686,2025-04-24 21:46:07.862020,2025-04-24 21:46:13.676907,0 days 00:00:05.814887,12.128258007504758,RBF,4.4858036926841285,0.002877974947826926,2.5,TPESampler,COMPLETE
1116,0.8703401340218418,2025-04-24 21:46:08.705851,2025-04-24 21:46:20.268042,0 days 00:00:11.562191,1708.8086843733226,RBF,89620.69868550867,0.0025019300130854558,0.5,TPESampler,COMPLETE
1117,0.16334779249887746,2025-04-24 21:46:12.371096,2025-04-24 21:46:17.745690,0 days 00:00:05.374594,7558.544117494618,RBF,3.5351391080949814,0.029111341258204235,2.5,TPESampler,COMPLETE
1118,0.163347806544463,2025-04-24 21:46:13.974781,2025-04-24 21:46:19.133744,0 days 00:00:05.158963,312.4815873332645,RBF,124.56155488588827,0.34142528978773357,2.5,TPESampler,COMPLETE
1119,0.16334780883570887,2025-04-24 21:46:18.049679,2025-04-24 21:46:22.509188,0 days 00:00:04.459509,34.783830972065644,RBF,18.251647265960415,0.03328387068371714,2.5,TPESampler,COMPLETE
1120,0.16334780611524527,2025-04-24 21:46:19.399042,2025-04-24 21:46:27.547282,0 days 00:00:08.148240,9.894370740547533,RBF,0.4734806338645154,0.020808486015219826,2.5,TPESampler,COMPLETE
1121,0.1633478092867325,2025-04-24 21:46:20.552132,2025-04-24 21:46:25.053859,0 days 00:00:04.501727,900.4061092118296,RBF,22.30577801281852,0.2261596301695031,2.5,TPESampler,COMPLETE
1122,0.8703401340205535,2025-04-24 21:46:22.801371,2025-04-24 21:46:29.646063,0 days 00:00:06.844692,78.98984093623949,RBF,79.75107486404588,0.0018332327949481027,2.5,TPESampler,COMPLETE
1123,0.16334780924244272,2025-04-24 21:46:25.345442,2025-04-24 21:46:30.942535,0 days 00:00:05.597093,73.7635690345813,RBF,180.1517860697624,0.23382890705842838,2.5,TPESampler,COMPLETE
1124,0.16334780958384243,2025-04-24 21:46:27.799630,2025-04-24 21:46:33.095805,0 days 00:00:05.296175,4.2965627358970595,RBF,382.73487071115534,0.1435699808776951,2.5,TPESampler,COMPLETE
1125,0.16334779683818218,2025-04-24 21:46:29.891655,2025-04-24 21:46:34.591754,0 days 00:00:04.700099,367.71719143094214,RBF,4.942182387492494,0.1492085999325878,2.5,TPESampler,COMPLETE
1126,0.16334781208855653,2025-04-24 21:46:31.226944,2025-04-24 21:46:37.323249,0 days 00:00:06.096305,35.79949155842994,RBF,1.2912981100510699,0.0061375670382740445,2.5,TPESampler,COMPLETE
1127,0.8703401339746709,2025-04-24 21:46:33.380895,2025-04-24 21:46:37.906009,0 days 00:00:04.525114,375.0848303486142,RBF,174.41699719060944,0.003403922027300588,1.5,TPESampler,COMPLETE
1128,0.8703401340207487,2025-04-24 21:46:34.840922,2025-04-24 21:46:39.678901,0 days 00:00:04.837979,29.66141977734813,RBF,0.011185909107202756,0.019065720419994273,2.5,TPESampler,COMPLETE
1129,0.16334780914310396,2025-04-24 21:46:37.638808,2025-04-24 21:46:44.253221,0 days 00:00:06.614413,7.061931344435908,RBF,3.620438861529459,5.141495406789231e-05,2.5,TPESampler,COMPLETE
1130,0.9015779748792075,2025-04-24 21:46:38.224765,2025-04-24 21:46:45.786383,0 days 00:00:07.561618,0.00029448772711966695,RBF,32402.47021024048,0.021111316911080237,2.5,TPESampler,COMPLETE
1131,0.16334780922239625,2025-04-24 21:46:39.983936,2025-04-24 21:46:46.261386,0 days 00:00:06.277450,24654.416451189554,RBF,349.269228257207,0.6158134674838475,2.5,TPESampler,COMPLETE
1132,0.16334782648768315,2025-04-24 21:46:44.515869,2025-04-24 21:46:50.230280,0 days 00:00:05.714411,55361.29673894399,RBF,4.882260552439709,0.00044619969639266255,2.5,TPESampler,COMPLETE
1133,0.16334782047123522,2025-04-24 21:46:46.062678,2025-04-24 21:46:51.777387,0 days 00:00:05.714709,303.27259991894044,RBF,24.89097364176933,0.8236079705864711,2.5,TPESampler,COMPLETE
1134,0.1633478092118172,2025-04-24 21:46:46.529320,2025-04-24 21:46:51.986085,0 days 00:00:05.456765,73.85050102059878,RBF,12.688018018674416,0.006380565906726222,2.5,TPESampler,COMPLETE
1135,0.8703401340272755,2025-04-24 21:46:50.492440,2025-04-24 21:46:55.625491,0 days 00:00:05.133051,349.0336513798687,RBF,0.06707703526657738,0.0009692885247030167,2.5,TPESampler,COMPLETE
1136,0.16334781268579873,2025-04-24 21:46:51.996343,2025-04-24 21:46:58.026015,0 days 00:00:06.029672,15695.097266633964,RBF,182.78023175268947,0.920397518722842,0.5,TPESampler,COMPLETE
1137,0.16334772100090517,2025-04-24 21:46:52.293970,2025-04-24 21:46:57.985067,0 days 00:00:05.691097,2734.4604564483907,RBF,10.045370940234324,0.0001280258454841397,2.5,TPESampler,COMPLETE
1138,0.16334781114226546,2025-04-24 21:46:55.881085,2025-04-24 21:47:03.578317,0 days 00:00:07.697232,8.138885930387284,RBF,0.357705295545386,0.08721795306980017,1.5,TPESampler,COMPLETE
1139,0.8703401340198044,2025-04-24 21:46:58.177031,2025-04-24 21:47:04.989052,0 days 00:00:06.812021,589.9495963694606,RBF,19.455321180321118,3.4125171015699672e-06,2.5,TPESampler,COMPLETE
1140,0.8703401340211419,2025-04-24 21:46:58.212450,2025-04-24 21:47:06.539466,0 days 00:00:08.327016,337.24061177100646,RBF,7254.755657681552,0.00014305227207080882,2.5,TPESampler,COMPLETE
1141,0.16334781162452877,2025-04-24 21:47:03.882772,2025-04-24 21:47:10.374674,0 days 00:00:06.491902,0.17968879899723023,RBF,4.4504000746561205,0.10450008336392139,2.5,TPESampler,COMPLETE
1142,0.870340134021015,2025-04-24 21:47:05.289505,2025-04-24 21:47:10.678724,0 days 00:00:05.389219,128.0744150941719,RBF,28.851986524681937,0.00014669820403820325,2.5,TPESampler,COMPLETE
1143,0.16334780987506775,2025-04-24 21:47:06.822156,2025-04-24 21:47:14.021160,0 days 00:00:07.199004,2.953109640974095,RBF,9.424181573978023,0.04069964167365958,2.5,TPESampler,COMPLETE
1144,0.9015738016376942,2025-04-24 21:47:10.636648,2025-04-24 21:47:14.947002,0 days 00:00:04.310354,1.3277074981351825e-06,Matern,0.00011993114934665288,0.025208934501913794,1.5,TPESampler,COMPLETE
1145,0.16334784674939604,2025-04-24 21:47:10.986333,2025-04-24 21:47:18.119627,0 days 00:00:07.133294,16.30041364817333,RBF,0.4243145150642546,0.4132096139829921,2.5,TPESampler,COMPLETE
1146,0.8703401340366349,2025-04-24 21:47:14.332464,2025-04-24 21:47:23.808177,0 days 00:00:09.475713,4835.415849473873,RBF,516.7271021544442,1.3738110084694628e-05,2.5,TPESampler,COMPLETE
1147,0.8703401341371529,2025-04-24 21:47:15.217615,2025-04-24 21:47:32.277321,0 days 00:00:17.059706,2.6060001918933692e-05,Matern,6404.928047344907,1.1018463169413748e-09,2.5,TPESampler,COMPLETE
1148,0.16334780582699565,2025-04-24 21:47:18.410135,2025-04-24 21:47:27.185059,0 days 00:00:08.774924,332.39889751428785,RBF,0.3196363164133669,0.5400018510120309,2.5,TPESampler,COMPLETE
1149,0.16334780636210255,2025-04-24 21:47:24.103376,2025-04-24 21:47:29.546121,0 days 00:00:05.442745,5742.0965481885405,RBF,1.8759963838859304,0.0005601122919956176,2.5,TPESampler,COMPLETE
1150,0.9015779717669574,2025-04-24 21:47:27.483730,2025-04-24 21:47:31.387287,0 days 00:00:03.903557,2573.9047820437154,RBF,0.49302192791344585,1.6862454974497235e-06,2.5,TPESampler,COMPLETE
1151,0.8703401340231982,2025-04-24 21:47:29.840822,2025-04-24 21:47:37.937324,0 days 00:00:08.096502,5266.122698643483,RBF,217.00646529751575,0.0005561298137164844,2.5,TPESampler,COMPLETE
1152,0.16334780962945805,2025-04-24 21:47:31.667649,2025-04-24 21:47:38.645262,0 days 00:00:06.977613,13.128926653278238,RBF,2.3129197268789348,2.053307810829701e-05,2.5,TPESampler,COMPLETE
1153,0.16334779523125276,2025-04-24 21:47:32.534105,2025-04-24 21:47:37.850136,0 days 00:00:05.316031,173.40832194391774,RBF,4.079506358477821,4.698066186014804e-05,2.5,TPESampler,COMPLETE
1154,0.8703401340200582,2025-04-24 21:47:38.026420,2025-04-24 21:47:43.494965,0 days 00:00:05.468545,25378.042695699707,RBF,8.340689051709052,3.9255324838847095e-05,2.5,TPESampler,COMPLETE
1155,0.16334781413664812,2025-04-24 21:47:38.133447,2025-04-24 21:47:45.565485,0 days 00:00:07.432038,0.9492517208930084,RBF,0.6248673357931809,0.5477068980311238,2.5,TPESampler,COMPLETE
1156,0.8703401340215193,2025-04-24 21:47:38.853803,2025-04-24 21:47:47.023947,0 days 00:00:08.170144,7.3165167863455885e-06,RBF,0.00018932729520905621,7.690375741241169e-10,0.5,TPESampler,COMPLETE
1157,0.16334783807897454,2025-04-24 21:47:43.788115,2025-04-24 21:47:51.365270,0 days 00:00:07.577155,176.33488396063166,RBF,8.433708536679967,7.51769949288888e-05,2.5,TPESampler,COMPLETE
