number,value,datetime_start,datetime_complete,duration,params_constant_value,params_kernel_type,params_length_scale,params_noise_level,params_nu,system_attrs_auto:sampler,state
0,0.8703401340174886,2025-04-24 20:58:39.930998,2025-04-24 20:58:53.682719,0 days 00:00:13.751721,0.009324057163008456,Matern,54179.22730500401,2.6066162555868583e-06,0.5,RandomSampler,COMPLETE
1,0.8703401341791079,2025-04-24 20:58:39.944135,2025-04-24 20:58:54.927356,0 days 00:00:14.983221,4.215007015051681e-05,Matern,6196.815408502403,3.9388898074473943e-10,1.5,RandomSampler,COMPLETE
2,0.8703401340194818,2025-04-24 20:58:40.004048,2025-04-24 20:58:52.331012,0 days 00:00:12.326964,9983.19028791976,RBF,3322.761260404346,2.1395713886586316e-07,2.5,RandomSampler,COMPLETE
3,0.870340134125663,2025-04-24 20:58:52.574099,2025-04-24 20:58:57.243149,0 days 00:00:04.669050,0.7654676634535161,RBF,0.008441628555318652,0.22792252647277092,1.5,TPESampler,COMPLETE
4,0.8703401340201858,2025-04-24 20:58:53.883453,2025-04-24 20:59:03.516763,0 days 00:00:09.633310,0.3771920942913779,RBF,1.8619028054348379,1.800155837827319e-08,0.5,TPESampler,COMPLETE
5,0.8703401340237412,2025-04-24 20:58:55.156640,2025-04-24 20:59:02.244590,0 days 00:00:07.087950,2.569095950874724e-05,RBF,0.025768043586273135,2.0387903676264352e-05,1.5,TPESampler,COMPLETE
6,0.8703401340196633,2025-04-24 20:58:57.467319,2025-04-24 20:59:01.216251,0 days 00:00:03.748932,468.62525641884287,RBF,4.5792585334584965e-05,0.0710136706534846,2.5,TPESampler,COMPLETE
7,0.8703401339107237,2025-04-24 20:59:01.454752,2025-04-24 20:59:21.399722,0 days 00:00:19.944970,2.8287274797460416e-06,Matern,11830.015967818237,2.922834684267806e-06,0.5,TPESampler,COMPLETE
8,0.8703401340212522,2025-04-24 20:59:02.442267,2025-04-24 20:59:17.834443,0 days 00:00:15.392176,104.71470088051609,RBF,199.10601384855428,2.510162887663882e-07,1.5,TPESampler,COMPLETE
9,0.8703401340042605,2025-04-24 20:59:03.744120,2025-04-24 20:59:15.822472,0 days 00:00:12.078352,0.0036874209386965505,RBF,0.14469386567854428,7.818058890307556e-07,0.5,TPESampler,COMPLETE
10,0.21977496360847107,2025-04-24 20:59:16.017297,2025-04-24 20:59:22.076545,0 days 00:00:06.059248,444.80357801044033,Matern,17.286922597955364,0.001807119047769026,0.5,TPESampler,COMPLETE
11,0.8703401340211713,2025-04-24 20:59:18.059262,2025-04-24 20:59:23.275096,0 days 00:00:05.215834,0.0003123287576184307,RBF,0.0008642441350270051,5.709265416280126e-10,2.5,TPESampler,COMPLETE
12,0.8703401340422099,2025-04-24 20:59:21.640071,2025-04-24 20:59:33.999436,0 days 00:00:12.359365,2.4807373888821906e-07,Matern,6.4999737068683645,0.0006858049694195814,0.5,TPESampler,COMPLETE
13,0.21977498875999094,2025-04-24 20:59:22.279042,2025-04-24 20:59:28.560639,0 days 00:00:06.281597,76.64667995481976,Matern,63.63778634898193,0.16444441504103885,0.5,TPESampler,COMPLETE
14,0.9015777755952701,2025-04-24 20:59:23.497239,2025-04-24 20:59:28.240009,0 days 00:00:04.742770,9691.113059721529,Matern,5.6426970017226115,1.4668411329156366e-05,0.5,TPESampler,COMPLETE
15,0.21977494793057445,2025-04-24 20:59:28.484682,2025-04-24 20:59:36.042713,0 days 00:00:07.558031,35.22792755488954,Matern,54657.05946174904,0.3466580109501904,0.5,TPESampler,COMPLETE
16,0.8703401340153274,2025-04-24 20:59:28.831122,2025-04-24 20:59:37.479450,0 days 00:00:08.648328,0.04600367181767466,Matern,0.002343580163557618,0.592560356619792,0.5,TPESampler,COMPLETE
17,0.163443126124561,2025-04-24 20:59:34.234271,2025-04-24 20:59:42.574573,0 days 00:00:08.340302,0.02618011546233888,Matern,82.92829098425447,0.06012243403296793,2.5,TPESampler,COMPLETE
18,0.21977496029470697,2025-04-24 20:59:36.281748,2025-04-24 20:59:56.825537,0 days 00:00:20.543789,0.0057562222060165225,Matern,12983.779126939899,0.16096820477949877,0.5,TPESampler,COMPLETE
19,0.2197749473626107,2025-04-24 20:59:37.717009,2025-04-24 20:59:45.860878,0 days 00:00:08.143869,28663.783001649274,Matern,31010.23078251068,0.09113708577830597,0.5,TPESampler,COMPLETE
20,0.8703401340466456,2025-04-24 20:59:42.772734,2025-04-24 20:59:54.007573,0 days 00:00:11.234839,0.05602957210750046,Matern,175.44582789827922,0.0025585974462420816,2.5,TPESampler,COMPLETE
21,0.8703401339971035,2025-04-24 20:59:46.055708,2025-04-24 20:59:56.913422,0 days 00:00:10.857714,1.2713610140055465,RBF,31789.70977847522,0.004824846947475521,2.5,TPESampler,COMPLETE
22,0.8703401340212094,2025-04-24 20:59:54.212690,2025-04-24 21:00:01.909476,0 days 00:00:07.696786,29748.555216784676,Matern,28823.702817877936,0.0004186939213077259,1.5,TPESampler,COMPLETE
23,0.16334779134338864,2025-04-24 20:59:56.976433,2025-04-24 21:00:07.406477,0 days 00:00:10.430044,425.99517491587045,RBF,65323.00327564737,0.14935473448251307,0.5,TPESampler,COMPLETE
24,0.21977494729417618,2025-04-24 20:59:57.082728,2025-04-24 21:00:04.164469,0 days 00:00:07.081741,52.1825090943967,Matern,47662.28675783638,0.12686750408196465,0.5,TPESampler,COMPLETE
25,0.163443106624183,2025-04-24 21:00:02.138669,2025-04-24 21:00:11.654588,0 days 00:00:09.515919,11.638178422051777,Matern,1331.9266060598075,0.26419573075378383,2.5,TPESampler,COMPLETE
26,0.9015767416476295,2025-04-24 21:00:04.410210,2025-04-24 21:00:09.970686,0 days 00:00:05.560476,1.581160232687413e-05,Matern,0.03186864623008665,0.4869527243677971,2.5,TPESampler,COMPLETE
27,0.870340134023413,2025-04-24 21:00:07.977578,2025-04-24 21:00:20.565577,0 days 00:00:12.587999,3315.327153068268,RBF,25157.54597698293,0.04117135681992674,0.5,TPESampler,COMPLETE
28,0.8703401340206758,2025-04-24 21:00:10.211704,2025-04-24 21:00:18.882793,0 days 00:00:08.671089,0.27067186395178783,RBF,78654.64507055879,0.0002589075122258206,0.5,TPESampler,COMPLETE
29,0.1634431706317519,2025-04-24 21:00:11.860822,2025-04-24 21:00:17.047272,0 days 00:00:05.186450,576.6567820096444,Matern,45.22017055922381,0.17326620799599063,2.5,TPESampler,COMPLETE
30,0.8703401340415456,2025-04-24 21:00:17.244874,2025-04-24 21:00:25.763632,0 days 00:00:08.518758,0.029643047195139313,Matern,51.82270530166092,0.014768078782072888,1.5,TPESampler,COMPLETE
31,0.9015779184734973,2025-04-24 21:00:19.087854,2025-04-24 21:00:25.669026,0 days 00:00:06.581172,5.074197724582199e-05,RBF,724.2200969653393,0.14384948458325117,2.5,TPESampler,COMPLETE
32,0.9015779655009732,2025-04-24 21:00:20.776477,2025-04-24 21:00:27.160343,0 days 00:00:06.383866,0.021675395031263648,Matern,2899.718905499778,0.33713425966212246,2.5,TPESampler,COMPLETE
33,0.1634431236642173,2025-04-24 21:00:25.837075,2025-04-24 21:00:31.282529,0 days 00:00:05.445454,3342.1949336660755,Matern,67.05459587903653,0.021342986857460246,2.5,TPESampler,COMPLETE
34,0.1634431926591994,2025-04-24 21:00:26.008766,2025-04-24 21:00:31.872972,0 days 00:00:05.864206,16811.849544822515,Matern,573.1949175803495,0.08815171660879331,2.5,TPESampler,COMPLETE
35,0.16334782137205486,2025-04-24 21:00:27.461068,2025-04-24 21:00:33.342152,0 days 00:00:05.881084,116.72105927655551,RBF,4.319213555850795,0.0014053135423472897,2.5,TPESampler,COMPLETE
36,0.16344312896707805,2025-04-24 21:00:31.597475,2025-04-24 21:00:45.285209,0 days 00:00:13.687734,493.6091256507719,Matern,5.310461944439183,4.761517131168804e-05,2.5,TPESampler,COMPLETE
37,0.16334781313429375,2025-04-24 21:00:32.168079,2025-04-24 21:00:42.067276,0 days 00:00:09.899197,50.939441699773205,RBF,1393.1079748409045,0.04367908442772383,1.5,TPESampler,COMPLETE
38,0.8703400481377283,2025-04-24 21:00:33.685070,2025-04-24 21:00:41.433903,0 days 00:00:07.748833,495.5764486540371,RBF,6.090858263095917,0.00010488502874336027,2.5,TPESampler,COMPLETE
39,0.8703401340219525,2025-04-24 21:00:41.686597,2025-04-24 21:00:47.692274,0 days 00:00:06.005677,11946.95648012685,Matern,0.010043598915672474,0.10761939160424,2.5,TPESampler,COMPLETE
40,0.1633478305365437,2025-04-24 21:00:42.318120,2025-04-24 21:00:52.075576,0 days 00:00:09.757456,76.76825613690723,RBF,463.34088696496474,0.5267819799185702,1.5,TPESampler,COMPLETE
41,0.8703401340188434,2025-04-24 21:00:45.613526,2025-04-24 21:00:59.835959,0 days 00:00:14.222433,0.08649838313513347,RBF,178.70666763874263,0.0007073365785197448,1.5,TPESampler,COMPLETE
42,0.901577195523202,2025-04-24 21:00:47.972522,2025-04-24 21:00:53.505764,0 days 00:00:05.533242,160.93883888336865,RBF,0.1757197108603317,0.0023329963304136656,0.5,TPESampler,COMPLETE
43,0.16334789861600377,2025-04-24 21:00:53.027900,2025-04-24 21:00:58.223992,0 days 00:00:05.196092,45.6730366454716,RBF,49.18205838483064,0.03595219479733672,1.5,TPESampler,COMPLETE
44,0.1633478046593444,2025-04-24 21:00:53.720621,2025-04-24 21:00:58.552745,0 days 00:00:04.832124,3353.716133775494,RBF,38.20032896955945,0.28640989962794094,1.5,TPESampler,COMPLETE
45,0.16334781518188785,2025-04-24 21:00:58.473419,2025-04-24 21:01:05.753275,0 days 00:00:07.279856,1268.25377694637,RBF,18605.06999478044,0.25538686219117984,1.5,TPESampler,COMPLETE
46,0.16334780899826393,2025-04-24 21:00:58.770306,2025-04-24 21:01:03.849734,0 days 00:00:05.079428,21831.188608148193,RBF,0.7388608203918897,0.00541415712385921,1.5,TPESampler,COMPLETE
47,0.9015779431791794,2025-04-24 21:01:00.138527,2025-04-24 21:01:06.470573,0 days 00:00:06.332046,0.018593772714425548,RBF,1520.7130251643637,0.7421315570334323,1.5,TPESampler,COMPLETE
48,0.16334780409397281,2025-04-24 21:01:04.149417,2025-04-24 21:01:12.108990,0 days 00:00:07.959573,26913.090744104924,RBF,0.7176531375940086,0.0014355942563532408,1.5,TPESampler,COMPLETE
49,0.8703401340355468,2025-04-24 21:01:06.011311,2025-04-24 21:01:11.492339,0 days 00:00:05.481028,56524.21393822202,RBF,0.01729616917828215,0.7727381023154104,1.5,TPESampler,COMPLETE
50,0.870340134021326,2025-04-24 21:01:06.732407,2025-04-24 21:01:17.700900,0 days 00:00:10.968493,69220.21943451077,RBF,91334.27323541374,0.0047471624597946105,1.5,TPESampler,COMPLETE
51,0.8703400156533964,2025-04-24 21:01:11.754207,2025-04-24 21:01:20.972401,0 days 00:00:09.218194,9521.938892147618,Matern,0.09635045874804246,0.005115816977203157,1.5,TPESampler,COMPLETE
52,0.8703401334628224,2025-04-24 21:01:12.342679,2025-04-24 21:01:25.325831,0 days 00:00:12.983152,3070.6532486937786,RBF,0.1565668603073322,0.0001104851644302079,1.5,TPESampler,COMPLETE
53,0.16334780830929266,2025-04-24 21:01:18.841311,2025-04-24 21:01:29.146802,0 days 00:00:10.305491,59533.41463633023,RBF,23.420738167617188,0.0007660229539966626,1.5,TPESampler,COMPLETE
54,0.16334780801558088,2025-04-24 21:01:21.685194,2025-04-24 21:01:30.390617,0 days 00:00:08.705423,0.7021224497357603,RBF,216.16053741354645,0.23292138834104625,0.5,TPESampler,COMPLETE
55,0.1633478098343211,2025-04-24 21:01:25.583376,2025-04-24 21:01:31.348255,0 days 00:00:05.764879,1326.2583339333187,RBF,244.2810684827817,0.8930811538961945,1.5,TPESampler,COMPLETE
56,0.8703401340464781,2025-04-24 21:01:29.450287,2025-04-24 21:01:34.302550,0 days 00:00:04.852263,25346.035789943824,RBF,97.6471055983541,3.413777820675898e-05,1.5,TPESampler,COMPLETE
57,0.9015779748921476,2025-04-24 21:01:30.644928,2025-04-24 21:01:36.966949,0 days 00:00:06.322021,1.342806170432012,RBF,48629.83628356188,0.3865516108873294,0.5,TPESampler,COMPLETE
58,0.16334777863366495,2025-04-24 21:01:31.614818,2025-04-24 21:01:37.287553,0 days 00:00:05.672735,59250.279687441376,RBF,6.795928164053882,0.014505408120042229,1.5,TPESampler,COMPLETE
59,0.16334780693326797,2025-04-24 21:01:34.599160,2025-04-24 21:01:42.740675,0 days 00:00:08.141515,0.242731208671157,RBF,8.4478389504581,0.03911668180804717,0.5,TPESampler,COMPLETE
60,0.8703401340288506,2025-04-24 21:01:37.214276,2025-04-24 21:01:43.398829,0 days 00:00:06.184553,82945.68930334113,RBF,268.64215838383313,6.480548397708519e-05,0.5,TPESampler,COMPLETE
61,0.16334781081985553,2025-04-24 21:01:37.539419,2025-04-24 21:01:43.627982,0 days 00:00:06.088563,36491.697982059064,RBF,19.45060823377573,0.009441563402523766,1.5,TPESampler,COMPLETE
62,0.16334780872525118,2025-04-24 21:01:43.041906,2025-04-24 21:01:50.534511,0 days 00:00:07.492605,0.014998957880561494,RBF,22.018934471475745,0.40079994336482494,0.5,TPESampler,COMPLETE
63,0.16334783632127162,2025-04-24 21:01:43.595508,2025-04-24 21:01:48.943011,0 days 00:00:05.347503,17.000653559570598,RBF,179.27648767228962,0.04063920935096019,0.5,TPESampler,COMPLETE
64,0.9015771955345325,2025-04-24 21:01:43.848156,2025-04-24 21:01:48.124519,0 days 00:00:04.276363,61.684244350573344,Matern,6.435227880963999e-05,1.5638486142653296e-06,2.5,TPESampler,COMPLETE
65,0.163347797006686,2025-04-24 21:01:48.421909,2025-04-24 21:02:00.499317,0 days 00:00:12.077408,49326.89616881455,RBF,51242.23258242129,0.7651922349834092,0.5,TPESampler,COMPLETE
66,0.16334780833839502,2025-04-24 21:01:49.184629,2025-04-24 21:02:02.252453,0 days 00:00:13.067824,6.473132986021956,RBF,1.5002869560756278,0.6729017337367571,0.5,TPESampler,COMPLETE
67,0.8703401340213269,2025-04-24 21:01:50.800893,2025-04-24 21:02:00.082813,0 days 00:00:09.281920,0.00445451521828155,RBF,0.13030019054680594,0.00025914836888627,2.5,TPESampler,COMPLETE
68,0.16334781301146853,2025-04-24 21:02:00.331406,2025-04-24 21:02:07.620475,0 days 00:00:07.289069,5506.167548901192,RBF,51957.0327294428,0.05789342976650269,2.5,TPESampler,COMPLETE
69,0.16334780820100667,2025-04-24 21:02:00.705121,2025-04-24 21:02:08.840794,0 days 00:00:08.135673,47403.68056009735,RBF,26385.44219497938,0.3062776217191525,0.5,TPESampler,COMPLETE
70,0.163347806630793,2025-04-24 21:02:02.499602,2025-04-24 21:02:11.390972,0 days 00:00:08.891370,40310.3655916116,RBF,47709.58327317421,0.22091705340817927,0.5,TPESampler,COMPLETE
71,0.8703401340201488,2025-04-24 21:02:07.884791,2025-04-24 21:02:14.086138,0 days 00:00:06.201347,4.624402833315947,RBF,28.03433581842488,0.000614603036702305,0.5,TPESampler,COMPLETE
72,0.8703401340231706,2025-04-24 21:02:09.133024,2025-04-24 21:02:13.028484,0 days 00:00:03.895460,0.007163012997451224,RBF,0.010357328824613475,0.002346205340577941,0.5,TPESampler,COMPLETE
73,0.16334779190237467,2025-04-24 21:02:11.646601,2025-04-24 21:02:19.438803,0 days 00:00:07.792202,243.01013627442214,RBF,15498.839257177107,0.7675241642959487,0.5,TPESampler,COMPLETE
74,0.16334780305480714,2025-04-24 21:02:13.329385,2025-04-24 21:02:18.111771,0 days 00:00:04.782386,60295.327314790426,RBF,187.9418994715291,0.028353990464378746,0.5,TPESampler,COMPLETE
75,0.8703401336182455,2025-04-24 21:02:14.422612,2025-04-24 21:02:24.011538,0 days 00:00:09.588926,123.08938346071795,Matern,20775.426654921852,5.276131748194695e-10,1.5,TPESampler,COMPLETE
76,0.8703401340571569,2025-04-24 21:02:18.398222,2025-04-24 21:02:27.763934,0 days 00:00:09.365712,99981.48109711251,RBF,30614.04583232759,0.003846350378216641,0.5,TPESampler,COMPLETE
77,0.16334781256158565,2025-04-24 21:02:19.757915,2025-04-24 21:02:25.528670,0 days 00:00:05.770755,68115.07838743503,RBF,6.5172571825121395,0.046495219360103826,0.5,TPESampler,COMPLETE
78,0.16334780846188984,2025-04-24 21:02:24.294189,2025-04-24 21:02:30.866759,0 days 00:00:06.572570,5198.141933970876,RBF,15439.678135273554,0.4533701768756483,0.5,TPESampler,COMPLETE
79,0.16334769720904146,2025-04-24 21:02:25.790386,2025-04-24 21:02:35.456463,0 days 00:00:09.666077,85529.38814818552,RBF,1720.810544354326,0.38484053484875735,0.5,TPESampler,COMPLETE
80,0.16334782780130483,2025-04-24 21:02:28.055528,2025-04-24 21:02:33.450772,0 days 00:00:05.395244,74.26083040141275,RBF,1040.6652637495647,0.3349215668879735,0.5,TPESampler,COMPLETE
81,0.9012365621209459,2025-04-24 21:02:31.159829,2025-04-24 21:02:42.412105,0 days 00:00:11.252276,63.01462072799063,RBF,76919.96473221834,0.04285903062742011,0.5,TPESampler,COMPLETE
82,0.16334779628976556,2025-04-24 21:02:33.705325,2025-04-24 21:02:40.866932,0 days 00:00:07.161607,15356.822042676815,RBF,84963.32848828337,0.08638352301268112,0.5,TPESampler,COMPLETE
83,0.16334780738972915,2025-04-24 21:02:35.756399,2025-04-24 21:02:43.110646,0 days 00:00:07.354247,66454.72449360142,RBF,431.4124673227822,0.19967793771692346,0.5,TPESampler,COMPLETE
84,0.16355850645513909,2025-04-24 21:02:41.163811,2025-04-24 21:02:49.119582,0 days 00:00:07.955771,92539.2294335177,Matern,246.64279499668308,0.08709343588323881,1.5,TPESampler,COMPLETE
85,0.16334779829696483,2025-04-24 21:02:42.702875,2025-04-24 21:03:07.399827,0 days 00:00:24.696952,212.15486401300333,RBF,55688.605219420395,0.898141096361105,0.5,TPESampler,COMPLETE
86,0.870340134019871,2025-04-24 21:02:43.314022,2025-04-24 21:03:00.623947,0 days 00:00:17.309925,0.0008171187988391951,Matern,0.011884578049658772,5.734990562358919e-09,0.5,TPESampler,COMPLETE
87,0.9015771955351941,2025-04-24 21:02:49.774580,2025-04-24 21:03:01.532156,0 days 00:00:11.757576,2.8339165595062843,Matern,0.03033017053469311,2.1036478253777355e-10,1.5,TPESampler,COMPLETE
88,0.16334780973276175,2025-04-24 21:03:00.846787,2025-04-24 21:03:06.325240,0 days 00:00:05.478453,27483.791612505374,RBF,23.182631412177095,0.09314750810290763,2.5,TPESampler,COMPLETE
89,0.9015764228191323,2025-04-24 21:03:01.765916,2025-04-24 21:03:04.497402,0 days 00:00:02.731486,1.9882715590333442e-05,RBF,4.0698524279445645e-05,0.42948588577336144,1.5,TPESampler,COMPLETE
90,0.8703401340204067,2025-04-24 21:03:04.803093,2025-04-24 21:03:14.852825,0 days 00:00:10.049732,292.18884460283465,RBF,87698.67159945119,9.982031029885073e-05,0.5,TPESampler,COMPLETE
91,0.9015771955331853,2025-04-24 21:03:06.631781,2025-04-24 21:03:10.818325,0 days 00:00:04.186544,94814.38716207628,Matern,0.0010875774238912823,1.3302631212017456e-06,0.5,TPESampler,COMPLETE
92,0.1633478416633373,2025-04-24 21:03:07.653351,2025-04-24 21:03:12.944104,0 days 00:00:05.290753,486.04418858401766,RBF,984.5346389579696,0.060292696770665906,0.5,TPESampler,COMPLETE
93,0.8703401340199762,2025-04-24 21:03:11.113143,2025-04-24 21:03:22.060776,0 days 00:00:10.947633,0.0019260201813964734,Matern,2783.795521497092,2.0112648823047717e-08,2.5,TPESampler,COMPLETE
94,0.16334781991475275,2025-04-24 21:03:13.350520,2025-04-24 21:03:20.586693,0 days 00:00:07.236173,479.55659518404576,RBF,37936.923447660534,0.07491780473411173,0.5,TPESampler,COMPLETE
95,0.9015779721468902,2025-04-24 21:03:15.115401,2025-04-24 21:03:19.464273,0 days 00:00:04.348872,13138.921506015511,Matern,0.5580307734767587,4.547075903842679e-09,2.5,TPESampler,COMPLETE
96,0.16334779517838935,2025-04-24 21:03:19.708440,2025-04-24 21:03:24.163709,0 days 00:00:04.455269,20189.72690380464,RBF,0.9490178858252892,0.15279731682268277,1.5,TPESampler,COMPLETE
97,0.9015779710814339,2025-04-24 21:03:20.828435,2025-04-24 21:03:23.750932,0 days 00:00:02.922497,1.0162619736301292e-07,Matern,3409.4990410764904,0.3689061059519723,2.5,TPESampler,COMPLETE
98,0.8703401340311294,2025-04-24 21:03:22.305490,2025-04-24 21:03:26.440134,0 days 00:00:04.134644,7182.376016728329,RBF,2.713995554948852e-05,0.025968144610884685,0.5,TPESampler,COMPLETE
99,0.16334776009954324,2025-04-24 21:03:24.000630,2025-04-24 21:03:29.210647,0 days 00:00:05.210017,82037.65022616411,RBF,2.4866395940211925,0.37855113449636874,1.5,TPESampler,COMPLETE
100,0.16334780865780382,2025-04-24 21:03:24.362528,2025-04-24 21:03:32.714643,0 days 00:00:08.352115,2972.0315233823326,RBF,72601.44650367806,0.7110111994690698,0.5,TPESampler,COMPLETE
101,0.9015779749019732,2025-04-24 21:03:26.773488,2025-04-24 21:03:29.723229,0 days 00:00:02.949741,81.26019145842781,RBF,0.7304228763740948,0.002343708713947123,1.5,TPESampler,COMPLETE
102,0.16334780191491488,2025-04-24 21:03:29.491948,2025-04-24 21:03:34.374680,0 days 00:00:04.882732,48621.31868129823,RBF,14.30982299975498,0.014106825301827356,1.5,TPESampler,COMPLETE
103,0.9015771955337833,2025-04-24 21:03:29.921162,2025-04-24 21:03:33.738727,0 days 00:00:03.817565,29908.053182061376,RBF,0.012179060280374505,4.776009784682457e-10,0.5,TPESampler,COMPLETE
104,0.16334775272307597,2025-04-24 21:03:32.958794,2025-04-24 21:03:37.969999,0 days 00:00:05.011205,11339.989746871577,RBF,1.9293887833354115,0.34023610549740624,1.5,TPESampler,COMPLETE
105,0.8703401340212745,2025-04-24 21:03:33.991124,2025-04-24 21:03:40.929799,0 days 00:00:06.938675,58986.89313239561,RBF,0.005573518813936491,0.0005892126726907986,1.5,TPESampler,COMPLETE
106,0.16334780398032142,2025-04-24 21:03:34.588949,2025-04-24 21:03:39.729545,0 days 00:00:05.140596,15388.99160248936,RBF,1.6844510598075055,0.08767686529999731,1.5,TPESampler,COMPLETE
107,0.1633478077585363,2025-04-24 21:03:38.257958,2025-04-24 21:03:45.021086,0 days 00:00:06.763128,64383.097660995685,RBF,2.595113785323678,0.4666532929444739,1.5,TPESampler,COMPLETE
108,0.8703401340491204,2025-04-24 21:03:39.981122,2025-04-24 21:03:46.262611,0 days 00:00:06.281489,3573.026602895342,RBF,0.1032661804648851,0.24424501333757362,1.5,TPESampler,COMPLETE
109,0.16355851057344523,2025-04-24 21:03:41.282385,2025-04-24 21:03:52.982312,0 days 00:00:11.699927,1.39461897439367e-07,Matern,0.2763862268652852,4.113996297109856e-09,1.5,TPESampler,COMPLETE
110,0.1633478070908454,2025-04-24 21:03:45.380669,2025-04-24 21:03:51.467461,0 days 00:00:06.086792,36254.45662901671,RBF,574.3485726312437,0.18364450632714496,1.5,TPESampler,COMPLETE
111,0.8703401340213169,2025-04-24 21:03:46.585036,2025-04-24 21:03:56.343082,0 days 00:00:09.758046,0.1642689493702519,Matern,0.0006157188532690396,2.4788097951227287e-06,1.5,TPESampler,COMPLETE
112,0.21977494635675876,2025-04-24 21:03:51.725758,2025-04-24 21:03:57.608487,0 days 00:00:05.882729,25529.038207047764,Matern,1802.0816563288174,0.6102178175980406,0.5,TPESampler,COMPLETE
113,0.16334776149529023,2025-04-24 21:03:53.229374,2025-04-24 21:03:58.884820,0 days 00:00:05.655446,15808.617875212032,RBF,316.2502974736611,0.2262223608219231,0.5,TPESampler,COMPLETE
114,0.16355851501278462,2025-04-24 21:03:56.609865,2025-04-24 21:04:04.685381,0 days 00:00:08.075516,29176.229982529116,Matern,0.38525427984018534,0.6076492080361645,1.5,TPESampler,COMPLETE
