number,value,datetime_start,datetime_complete,duration,params_constant_value,params_kernel_type,params_length_scale,params_noise_level,params_nu,system_attrs_auto:sampler,state
1505,0.16334782244412008,2025-04-24 22:04:05.437257,2025-04-24 22:04:11.982762,0 days 00:00:06.545505,64526.57984488453,RBF,2362.7350715333796,0.7879631935387756,0.5,TPESampler,COMPLETE
1506,0.16334777117150465,2025-04-24 22:04:09.725142,2025-04-24 22:04:16.229238,0 days 00:00:06.504096,106.83742478056811,RBF,0.5269333722495446,0.005848851411069465,2.5,TPESampler,COMPLETE
1507,0.16355857333243368,2025-04-24 22:04:12.248898,2025-04-24 22:04:23.741462,0 days 00:00:11.492564,0.01162789467483041,Matern,2.8809084971886922,0.6371381476594958,1.5,TPESampler,COMPLETE
1508,0.8703401340213158,2025-04-24 22:04:12.531030,2025-04-24 22:04:19.896802,0 days 00:00:07.365772,0.033886635101105046,RBF,3.2658786806236413,3.949863996068371e-05,0.5,TPESampler,COMPLETE
1509,0.16334781174598528,2025-04-24 22:04:16.524101,2025-04-24 22:04:25.065721,0 days 00:00:08.541620,33167.525497798815,RBF,78738.57514069893,0.9090710515109861,0.5,TPESampler,COMPLETE
1510,0.8703401340209389,2025-04-24 22:04:20.191861,2025-04-24 22:04:25.035859,0 days 00:00:04.843998,1529.8694069441897,RBF,55.96522836354411,9.85633357336784e-05,2.5,TPESampler,COMPLETE
1511,0.16334766470754988,2025-04-24 22:04:24.034806,2025-04-24 22:04:35.797156,0 days 00:00:11.762350,0.005702762912363131,RBF,0.45433251797106716,0.7556642066668895,2.5,TPESampler,COMPLETE
1512,0.8703401340348872,2025-04-24 22:04:25.230198,2025-04-24 22:04:33.334843,0 days 00:00:08.104645,0.40667172813188157,RBF,37.66420195732088,0.01601374666359,2.5,TPESampler,COMPLETE
1513,0.163347808496811,2025-04-24 22:04:25.272533,2025-04-24 22:04:31.773909,0 days 00:00:06.501376,291.29516116577776,RBF,452.7130577522054,0.8997483882518361,2.5,TPESampler,COMPLETE
1514,0.16334780957909084,2025-04-24 22:04:32.077402,2025-04-24 22:04:38.877679,0 days 00:00:06.800277,29.902966495472786,RBF,1.2365147529117997,0.05187433721031529,2.5,TPESampler,COMPLETE
1515,0.1633477877309544,2025-04-24 22:04:33.589404,2025-04-24 22:04:39.439407,0 days 00:00:05.850003,84686.96355246806,RBF,406.0651666692557,0.02220020000468031,2.5,TPESampler,COMPLETE
1516,0.870340134020756,2025-04-24 22:04:36.105111,2025-04-24 22:04:43.597405,0 days 00:00:07.492294,1625.0970709198746,RBF,13.506192097824156,7.658483004263385e-07,0.5,TPESampler,COMPLETE
1517,0.16334778839961825,2025-04-24 22:04:39.172801,2025-04-24 22:04:47.693175,0 days 00:00:08.520374,0.0022067233342404294,RBF,1.8227057074295414,0.7726571886249316,2.5,TPESampler,COMPLETE
1518,0.8703401340211385,2025-04-24 22:04:39.702491,2025-04-24 22:04:44.156177,0 days 00:00:04.453686,0.019381854606918335,RBF,0.007418483560079303,0.0002820410926227362,2.5,TPESampler,COMPLETE
1519,0.8703401339975655,2025-04-24 22:04:43.893838,2025-04-24 22:04:48.723842,0 days 00:00:04.830004,0.06921749814434551,RBF,0.0063347135732859695,0.0045713368075582786,2.5,TPESampler,COMPLETE
1520,0.16334782604503384,2025-04-24 22:04:44.446739,2025-04-24 22:04:50.658413,0 days 00:00:06.211674,0.11984033534475591,RBF,1.9368437151206659,0.298677368728469,2.5,TPESampler,COMPLETE
1521,0.2632226331221404,2025-04-24 22:04:47.983640,2025-04-24 22:04:54.432620,0 days 00:00:06.448980,0.0008462108134902809,RBF,2.9814261379513716,0.6690335458798324,2.5,TPESampler,COMPLETE
1522,0.1633478072269798,2025-04-24 22:04:49.007100,2025-04-24 22:04:55.277598,0 days 00:00:06.270498,17.722337178449116,RBF,4.581793047341049,0.27512276443523376,2.5,TPESampler,COMPLETE
1523,0.8703401338373555,2025-04-24 22:04:50.956480,2025-04-24 22:04:55.204161,0 days 00:00:04.247681,0.3494982785071035,RBF,0.0485064828498187,0.11643033563046974,2.5,TPESampler,COMPLETE
1524,0.16334780526310674,2025-04-24 22:04:54.720070,2025-04-24 22:05:00.881492,0 days 00:00:06.161422,20315.908916446057,RBF,109.82127647796052,0.817235868507228,0.5,TPESampler,COMPLETE
1525,0.8703401340703599,2025-04-24 22:04:55.383432,2025-04-24 22:05:00.546598,0 days 00:00:05.163166,0.08555159402759846,RBF,0.0012846330952741014,0.050182905611738486,2.5,TPESampler,COMPLETE
1526,0.16334780768786436,2025-04-24 22:04:55.460124,2025-04-24 22:05:11.823431,0 days 00:00:16.363307,0.0014155485460975875,RBF,0.29965952098353793,0.37526682149125873,2.5,TPESampler,COMPLETE
1527,0.8703401340745757,2025-04-24 22:05:00.824927,2025-04-24 22:05:12.393490,0 days 00:00:11.568563,0.012013112608752497,RBF,0.046284761571372006,0.21126381952196058,2.5,TPESampler,COMPLETE
1528,0.901577195533211,2025-04-24 22:05:01.134957,2025-04-24 22:05:07.783564,0 days 00:00:06.648607,83942.70726250508,RBF,0.11284415470165082,1.5327066548630556e-06,2.5,TPESampler,COMPLETE
1529,0.16334780383340872,2025-04-24 22:05:08.093156,2025-04-24 22:05:23.371394,0 days 00:00:15.278238,0.009533602892204791,RBF,0.24198131115934704,0.20394818369692383,2.5,TPESampler,COMPLETE
1530,0.9015324647754628,2025-04-24 22:05:12.154178,2025-04-24 22:05:15.468290,0 days 00:00:03.314112,0.0005823590161612121,RBF,0.0018339608502291344,0.7328311949987816,2.5,TPESampler,COMPLETE
1531,0.8703401340209668,2025-04-24 22:05:12.660962,2025-04-24 22:05:17.571593,0 days 00:00:04.910631,0.6214312226261297,Matern,1.67481425527581e-05,0.34032227403320586,2.5,TPESampler,COMPLETE
1532,0.163347810661663,2025-04-24 22:05:15.791922,2025-04-24 22:05:22.252646,0 days 00:00:06.460724,0.0010065592139955064,RBF,3.8261154921478,0.34083831396364167,2.5,TPESampler,COMPLETE
1533,0.1633478095253368,2025-04-24 22:05:17.871075,2025-04-24 22:05:25.864028,0 days 00:00:07.992953,0.13821471218051137,RBF,0.9902903810111534,0.14463947802446164,2.5,TPESampler,COMPLETE
1534,0.16334783056213348,2025-04-24 22:05:22.553635,2025-04-24 22:05:35.238024,0 days 00:00:12.684389,0.0367917694171628,RBF,0.2551515422627893,0.5439325054671182,2.5,TPESampler,COMPLETE
1535,0.3280760220026815,2025-04-24 22:05:23.705968,2025-04-24 22:05:37.787593,0 days 00:00:14.081625,0.0017533869466388058,RBF,1.0531378878397963,0.029344261065185836,2.5,TPESampler,COMPLETE
1536,0.16334780394289522,2025-04-24 22:05:26.137151,2025-04-24 22:05:37.735162,0 days 00:00:11.598011,0.002082845331001456,RBF,1.4799338317570903,0.9037313970079627,2.5,TPESampler,COMPLETE
1537,0.9015474621715399,2025-04-24 22:05:35.538716,2025-04-24 22:05:41.694768,0 days 00:00:06.156052,0.0001396037332610612,RBF,0.029338732080393445,0.01549504724419711,1.5,TPESampler,COMPLETE
1538,0.1633478149837595,2025-04-24 22:05:37.914531,2025-04-24 22:05:57.725458,0 days 00:00:19.810927,0.00037872346455156695,RBF,3.3145394116681492,0.0029869637255372145,2.5,TPESampler,COMPLETE
1539,0.8703401340211459,2025-04-24 22:05:38.026396,2025-04-24 22:06:04.096229,0 days 00:00:26.069833,1.0018064013819513e-05,Matern,0.011246998105611583,8.987244112558666e-08,0.5,TPESampler,COMPLETE
1540,0.16334780031211832,2025-04-24 22:05:42.414225,2025-04-24 22:06:10.805552,0 days 00:00:28.391327,2.518220693510653,RBF,0.19801379917427278,0.029291523777835046,2.5,TPESampler,COMPLETE
1541,0.16334780994549566,2025-04-24 22:05:59.109202,2025-04-24 22:06:12.848998,0 days 00:00:13.739796,0.0917430630363194,RBF,1.352519932639952,0.0057534042048498915,2.5,TPESampler,COMPLETE
1542,0.16334780923750464,2025-04-24 22:06:04.362761,2025-04-24 22:06:13.191587,0 days 00:00:08.828826,3.118097796791752,RBF,0.3636594445259361,0.7307217241737697,2.5,TPESampler,COMPLETE
1543,0.9015757834202105,2025-04-24 22:06:11.097053,2025-04-24 22:06:15.666680,0 days 00:00:04.569627,2.7166642130259996e-05,RBF,0.07108220501387652,0.17912217485997953,0.5,TPESampler,COMPLETE
1544,0.16334778588439736,2025-04-24 22:06:13.152730,2025-04-24 22:06:29.447141,0 days 00:00:16.294411,0.0014700139225098034,RBF,0.40937866890634644,0.03156888684872188,2.5,TPESampler,COMPLETE
1545,0.8703401339933733,2025-04-24 22:06:13.479250,2025-04-24 22:06:20.249737,0 days 00:00:06.770487,7.048425145893037,RBF,0.003111990917470768,1.6938603506211124e-05,0.5,TPESampler,COMPLETE
1546,0.1633477980501411,2025-04-24 22:06:15.890225,2025-04-24 22:06:23.935513,0 days 00:00:08.045288,0.06384401419409903,RBF,5.5657187883941655,0.49209015667905065,2.5,TPESampler,COMPLETE
1547,0.16334785598602994,2025-04-24 22:06:20.531633,2025-04-24 22:06:29.592614,0 days 00:00:09.060981,0.8366928251980922,RBF,14.443775915687905,0.9995140494897138,2.5,TPESampler,COMPLETE
1548,0.8703401340217177,2025-04-24 22:06:24.222874,2025-04-24 22:06:38.716559,0 days 00:00:14.493685,1.1695393103979849e-06,Matern,233.06213647159956,3.070484952436957e-08,1.5,TPESampler,COMPLETE
1549,0.8703401340221583,2025-04-24 22:06:29.653040,2025-04-24 22:06:39.039251,0 days 00:00:09.386211,0.10887679232064407,RBF,29.45211284239068,0.004251507006433576,0.5,TPESampler,COMPLETE
1550,0.16334778404823277,2025-04-24 22:06:29.820354,2025-04-24 22:06:37.091683,0 days 00:00:07.271329,65482.19950730362,RBF,0.5057391484128962,0.001380795936805543,0.5,TPESampler,COMPLETE
1551,0.9015779734593451,2025-04-24 22:06:37.336984,2025-04-24 22:06:40.683664,0 days 00:00:03.346680,13.285307100809671,RBF,1.0101463806294628,1.7805977500511129e-07,0.5,TPESampler,COMPLETE
1552,0.9015779721919382,2025-04-24 22:06:38.994409,2025-04-24 22:06:43.813312,0 days 00:00:04.818903,100.3829205471329,RBF,0.7784112737405762,1.9129403357316756e-07,2.5,TPESampler,COMPLETE
1553,0.16334779905863242,2025-04-24 22:06:39.349730,2025-04-24 22:06:53.413470,0 days 00:00:14.063740,3460.1977752340176,RBF,11100.01927480473,0.04521505085762972,0.5,TPESampler,COMPLETE
1554,0.8881023809309747,2025-04-24 22:06:41.008267,2025-04-24 22:07:03.862739,0 days 00:00:22.854472,0.004187305164905664,RBF,0.13050680713160437,0.5627458570563842,2.5,TPESampler,COMPLETE
1555,0.16334780915647726,2025-04-24 22:06:44.386145,2025-04-24 22:07:01.915983,0 days 00:00:17.529838,8.369427240384127,RBF,3.9198887564395917,0.00040480681167693575,2.5,TPESampler,COMPLETE
1556,0.9015772206083411,2025-04-24 22:06:53.957295,2025-04-24 22:07:01.919596,0 days 00:00:07.962301,4.063849059929604,Matern,6.572267948392239,2.8303337528847897e-06,0.5,TPESampler,COMPLETE
1557,0.16334780955761008,2025-04-24 22:07:02.396111,2025-04-24 22:07:07.774964,0 days 00:00:05.378853,864.7790238957721,RBF,15.605224182386353,0.036936443801261216,0.5,TPESampler,COMPLETE
1558,0.16334780156561193,2025-04-24 22:07:02.445836,2025-04-24 22:07:11.450987,0 days 00:00:09.005151,434.46296180265307,RBF,4541.234219297832,0.6265592822555014,0.5,TPESampler,COMPLETE
1559,0.9015504782951002,2025-04-24 22:07:04.142917,2025-04-24 22:07:07.434688,0 days 00:00:03.291771,0.00013374055411328735,RBF,0.010449314677540062,0.09047197041760287,2.5,TPESampler,COMPLETE
1560,0.8703401340271169,2025-04-24 22:07:07.701807,2025-04-24 22:07:13.505272,0 days 00:00:05.803465,56.208329256820754,RBF,2199.177659217075,1.3643884885291338e-08,2.5,TPESampler,COMPLETE
1561,0.870340134027757,2025-04-24 22:07:08.055085,2025-04-24 22:07:22.218506,0 days 00:00:14.163421,1.5768439668407085e-07,Matern,2811.233419020295,9.093483984808544e-05,0.5,TPESampler,COMPLETE
1562,0.9015667277703767,2025-04-24 22:07:11.750582,2025-04-24 22:07:15.336848,0 days 00:00:03.586266,0.00013796744187609172,RBF,0.03323116855658092,0.28666515682562327,2.5,TPESampler,COMPLETE
1563,0.16334781380724078,2025-04-24 22:07:13.770366,2025-04-24 22:07:22.220105,0 days 00:00:08.449739,88038.56700024419,RBF,130.01531901839437,0.0010398384262613294,0.5,TPESampler,COMPLETE
1564,0.1633477950152919,2025-04-24 22:07:15.638389,2025-04-24 22:07:21.503592,0 days 00:00:05.865203,2770.8701559724886,RBF,224.286484317728,0.02634803445508934,0.5,TPESampler,COMPLETE
1565,0.16334779070006694,2025-04-24 22:07:21.781590,2025-04-24 22:07:27.736274,0 days 00:00:05.954684,53567.8769265626,RBF,3.905632311139063,8.560054952115695e-05,2.5,TPESampler,COMPLETE
1566,0.16334781135774315,2025-04-24 22:07:22.434993,2025-04-24 22:07:27.676760,0 days 00:00:05.241767,50.84602826342079,RBF,258.172648108346,0.04656818594108788,0.5,TPESampler,COMPLETE
1567,0.21977494769143513,2025-04-24 22:07:22.484403,2025-04-24 22:07:30.695435,0 days 00:00:08.211032,0.0044877995622951096,Matern,0.11064776161859673,0.006360118137344295,0.5,TPESampler,COMPLETE
1568,0.16334780578696492,2025-04-24 22:07:27.864602,2025-04-24 22:07:56.632622,0 days 00:00:28.768020,0.00018163214466040967,RBF,745.4978074721332,0.11313408446842528,2.5,TPESampler,COMPLETE
1569,0.9015779749001955,2025-04-24 22:07:28.020413,2025-04-24 22:07:32.038547,0 days 00:00:04.018134,13377.605682397978,Matern,22.490381070407235,2.680701701169675e-07,2.5,TPESampler,COMPLETE
1570,0.8703401340357109,2025-04-24 22:07:30.948596,2025-04-24 22:07:35.301693,0 days 00:00:04.353097,1.4349806146130946,RBF,0.023219005492949543,5.120157602298739e-05,0.5,TPESampler,COMPLETE
1571,0.1633477935681191,2025-04-24 22:07:32.339429,2025-04-24 22:07:37.631398,0 days 00:00:05.291969,600.3501931079455,RBF,323.5636425681327,0.11148530891770908,0.5,TPESampler,COMPLETE
1572,0.8703401340632201,2025-04-24 22:07:35.604812,2025-04-24 22:07:44.762433,0 days 00:00:09.157621,4505.606324750731,RBF,4101.895755702241,0.010934894881314047,0.5,TPESampler,COMPLETE
1573,0.8703401340220488,2025-04-24 22:07:37.929655,2025-04-24 22:07:48.439346,0 days 00:00:10.509691,0.02614216354909687,RBF,0.06832087979939423,0.7468757027889736,2.5,TPESampler,COMPLETE
1574,0.8703401340353023,2025-04-24 22:07:45.090105,2025-04-24 22:07:51.979573,0 days 00:00:06.889468,0.03943937179531482,RBF,1.3218658298249055,2.7632561444784563e-06,0.5,TPESampler,COMPLETE
1575,0.8703401340156353,2025-04-24 22:07:48.740106,2025-04-24 22:07:57.207917,0 days 00:00:08.467811,0.0690189809021585,RBF,46823.36640155356,2.2079712004718556e-07,1.5,TPESampler,COMPLETE
1576,0.16334780698580764,2025-04-24 22:07:52.301572,2025-04-24 22:07:58.598491,0 days 00:00:06.296919,63961.862184766374,RBF,12.503582234334656,0.0022159010103606864,2.5,TPESampler,COMPLETE
1577,0.16334780757578446,2025-04-24 22:07:56.896962,2025-04-24 22:08:12.437987,0 days 00:00:15.541025,1.658866425236248,RBF,8.131671655332209,0.06530581802408472,2.5,TPESampler,COMPLETE
1578,0.9014812678697197,2025-04-24 22:07:57.463457,2025-04-24 22:08:04.568223,0 days 00:00:07.104766,0.0009293356664552125,RBF,0.17974708460666697,0.0038551139248898325,0.5,TPESampler,COMPLETE
1579,0.8703401340217637,2025-04-24 22:07:59.156592,2025-04-24 22:08:09.784085,0 days 00:00:10.627493,667.6679784706023,RBF,5.900178114420631,1.0547912154184971e-05,2.5,TPESampler,COMPLETE
1580,0.16334779869249488,2025-04-24 22:08:04.834260,2025-04-24 22:08:11.162278,0 days 00:00:06.328018,394.7779550966398,RBF,1.3645592021139765,0.017306507068789504,2.5,TPESampler,COMPLETE
1581,0.9015771955348897,2025-04-24 22:08:10.060536,2025-04-24 22:08:14.478426,0 days 00:00:04.417890,930.0233498987492,RBF,0.07658781377420004,2.7482713847057626e-06,1.5,TPESampler,COMPLETE
1582,0.1633478392704059,2025-04-24 22:08:11.654939,2025-04-24 22:08:18.861850,0 days 00:00:07.206911,15.01269189981041,RBF,20.56702099817223,0.9921942709134048,2.5,TPESampler,COMPLETE
1583,0.8703401340107578,2025-04-24 22:08:12.683042,2025-04-24 22:08:18.121431,0 days 00:00:05.438389,0.030061298131960193,RBF,0.00032976426713659764,3.0617404084973206e-07,0.5,TPESampler,COMPLETE
1584,0.1633478114130533,2025-04-24 22:08:14.745794,2025-04-24 22:08:20.915868,0 days 00:00:06.170074,860.2607658037939,RBF,1.7452862672789895,0.0013322492717723303,2.5,TPESampler,COMPLETE
1585,0.1633478040648351,2025-04-24 22:08:18.411471,2025-04-24 22:08:23.643345,0 days 00:00:05.231874,1.2725724347928764,RBF,2.301809230478145,0.0005345157162817266,0.5,TPESampler,COMPLETE
1586,0.16334782314505444,2025-04-24 22:08:19.141988,2025-04-24 22:08:25.633781,0 days 00:00:06.491793,0.18249067673589947,RBF,3.7816698055100133,0.6844287522974052,1.5,TPESampler,COMPLETE
1587,0.8703401340245002,2025-04-24 22:08:21.169685,2025-04-24 22:08:27.708993,0 days 00:00:06.539308,0.00985241711008076,RBF,0.02438191634561503,0.006190067606509303,1.5,TPESampler,COMPLETE
1588,0.16334748494978737,2025-04-24 22:08:23.952192,2025-04-24 22:08:32.467704,0 days 00:00:08.515512,11.794225857803944,RBF,46.281257872044655,0.8217906154330187,0.5,TPESampler,COMPLETE
1589,0.8703401340258082,2025-04-24 22:08:25.935395,2025-04-24 22:08:34.509339,0 days 00:00:08.573944,25660.70883367337,RBF,4954.471067728293,0.0007019776966002213,0.5,TPESampler,COMPLETE
1590,0.8703401340209477,2025-04-24 22:08:28.000873,2025-04-24 22:08:37.278856,0 days 00:00:09.277983,1.0470476038921432,RBF,0.1108031352250819,0.949470045061138,2.5,TPESampler,COMPLETE
1591,0.16334780861538334,2025-04-24 22:08:32.945770,2025-04-24 22:08:43.167699,0 days 00:00:10.221929,1.4730291382858323,RBF,75.99594477899022,0.13116380927649104,0.5,TPESampler,COMPLETE
1592,0.16334780166733698,2025-04-24 22:08:35.198398,2025-04-24 22:08:42.329754,0 days 00:00:07.131356,27.849903764615664,RBF,154.78105721684423,0.2796161732720063,0.5,TPESampler,COMPLETE
1593,0.21977494838165734,2025-04-24 22:08:37.545010,2025-04-24 22:08:44.465853,0 days 00:00:06.920843,3.7588541259088686,Matern,0.9959280854268859,0.3447620459763898,0.5,TPESampler,COMPLETE
1594,0.16334781409344187,2025-04-24 22:08:42.676906,2025-04-24 22:08:50.378449,0 days 00:00:07.701543,1.6191368139627884,RBF,0.3708945553117724,0.2063512996855618,0.5,TPESampler,COMPLETE
1595,0.8703401340123592,2025-04-24 22:08:43.394574,2025-04-24 22:08:55.846252,0 days 00:00:12.451678,0.1496851377129965,RBF,933.0779705013895,0.030699169164463705,0.5,TPESampler,COMPLETE
1596,0.1633477990778759,2025-04-24 22:08:44.722671,2025-04-24 22:08:50.674024,0 days 00:00:05.951353,0.002754919148017822,RBF,16.300839012214034,0.5359958901340308,0.5,TPESampler,COMPLETE
1597,0.16334779555542756,2025-04-24 22:08:50.635502,2025-04-24 22:08:56.166677,0 days 00:00:05.531175,4.57004102443026,RBF,168.22365091705788,0.20432907372136047,0.5,TPESampler,COMPLETE
1598,0.1633478087687306,2025-04-24 22:08:51.006917,2025-04-24 22:09:02.640074,0 days 00:00:11.633157,1.4150573992345832,RBF,6.1238723028319875,0.0022636502251244966,0.5,TPESampler,COMPLETE
1599,0.8703401340080719,2025-04-24 22:08:56.093146,2025-04-24 22:09:06.303293,0 days 00:00:10.210147,513.8093663247325,RBF,0.14392741917870383,0.18456473833344378,0.5,TPESampler,COMPLETE
1600,0.1633478063319933,2025-04-24 22:08:56.455537,2025-04-24 22:09:10.355108,0 days 00:00:13.899571,0.10001354623587888,RBF,13.832770573593699,0.48615510785453053,0.5,TPESampler,COMPLETE
1601,0.16334781388461822,2025-04-24 22:09:03.226446,2025-04-24 22:09:16.118351,0 days 00:00:12.891905,428.81539944180463,RBF,3389.1315736729093,0.8572269734832578,0.5,TPESampler,COMPLETE
1602,0.16334781101577805,2025-04-24 22:09:06.584459,2025-04-24 22:09:11.403985,0 days 00:00:04.819526,185.54895734608618,RBF,7.334624019514307,0.19492269945863186,0.5,TPESampler,COMPLETE
1603,0.16334783047237933,2025-04-24 22:09:10.644598,2025-04-24 22:09:17.402403,0 days 00:00:06.757805,0.6714775161294902,RBF,3.3353925498108015,0.00020754675267807313,2.5,TPESampler,COMPLETE
1604,0.16334790680383401,2025-04-24 22:09:11.639668,2025-04-24 22:09:17.317481,0 days 00:00:05.677813,9.247987138286225,RBF,871.8560784287088,0.2871882099388348,0.5,TPESampler,COMPLETE
1605,0.16334781848046426,2025-04-24 22:09:16.385792,2025-04-24 22:09:21.271971,0 days 00:00:04.886179,65.47556540934686,RBF,17.459345280713325,0.03390694968436525,2.5,TPESampler,COMPLETE
1606,0.16334780920994152,2025-04-24 22:09:17.521677,2025-04-24 22:09:22.214234,0 days 00:00:04.692557,35.43070011609874,RBF,69.66103767713054,0.3504903106487633,0.5,TPESampler,COMPLETE
1607,0.16334782502802536,2025-04-24 22:09:17.635528,2025-04-24 22:09:24.969590,0 days 00:00:07.334062,0.40249548427885523,RBF,14.37246152933269,0.8090434944847633,2.5,TPESampler,COMPLETE
1608,0.16334781879813795,2025-04-24 22:09:21.532599,2025-04-24 22:09:31.960099,0 days 00:00:10.427500,2.953131668556782,RBF,0.3144083990132082,0.843416138725704,1.5,TPESampler,COMPLETE
1609,0.16334780433522564,2025-04-24 22:09:22.487329,2025-04-24 22:09:28.062753,0 days 00:00:05.575424,21.47854249113372,RBF,17.91224124481882,0.5199877565992196,0.5,TPESampler,COMPLETE
1610,0.16334781873610624,2025-04-24 22:09:25.237515,2025-04-24 22:09:32.759302,0 days 00:00:07.521787,93092.0756156067,RBF,1681.7102895941996,0.9013875360563628,0.5,TPESampler,COMPLETE
1611,0.8703401337811733,2025-04-24 22:09:28.403417,2025-04-24 22:09:37.712253,0 days 00:00:09.308836,0.012484050021432266,RBF,0.07752061308210494,0.01758512523316645,2.5,TPESampler,COMPLETE
1612,0.16334781483408506,2025-04-24 22:09:32.272728,2025-04-24 22:09:37.414420,0 days 00:00:05.141692,35.183426023731435,RBF,28.243744046016126,0.11696273253275605,0.5,TPESampler,COMPLETE
1613,0.8703401340214084,2025-04-24 22:09:33.046079,2025-04-24 22:09:38.479443,0 days 00:00:05.433364,12369.548068875047,Matern,0.004536933540660656,0.9746727279423825,2.5,TPESampler,COMPLETE
1614,0.1633478125774626,2025-04-24 22:09:37.642775,2025-04-24 22:09:44.821709,0 days 00:00:07.178934,9.019221856637527,RBF,3.462574621286731,0.6078648377273157,0.5,TPESampler,COMPLETE
1615,0.16334781601312034,2025-04-24 22:09:37.961151,2025-04-24 22:09:44.147863,0 days 00:00:06.186712,6.2456989851904545,RBF,6.064979675131048,0.09925097023350599,0.5,TPESampler,COMPLETE
1616,0.16334780716791403,2025-04-24 22:09:38.725880,2025-04-24 22:09:44.473873,0 days 00:00:05.747993,260.6913155462349,RBF,12.631701408151741,0.7950275836374483,0.5,TPESampler,COMPLETE
1617,0.16334781109197682,2025-04-24 22:09:44.434817,2025-04-24 22:09:50.605405,0 days 00:00:06.170588,0.19473371763626038,RBF,0.6866050415644083,0.4749342404896066,0.5,TPESampler,COMPLETE
1618,0.8703401340213812,2025-04-24 22:09:44.773039,2025-04-24 22:09:49.855187,0 days 00:00:05.082148,0.08367457550095304,RBF,0.04083655690801264,0.01172322426401951,0.5,TPESampler,COMPLETE
1619,0.16334781617429658,2025-04-24 22:09:45.094686,2025-04-24 22:09:50.664768,0 days 00:00:05.570082,362.14062192482226,RBF,1079.591996939987,0.9471687003438332,0.5,TPESampler,COMPLETE
