number,value,datetime_start,datetime_complete,duration,params_constant_value,params_kernel_type,params_length_scale,params_noise_level,params_nu,system_attrs_auto:sampler,state
2082,0.16334781188660447,2025-04-24 22:30:49.145477,2025-04-24 22:30:59.974870,0 days 00:00:10.829393,23196.314378135423,RBF,0.4075815226558863,0.001923524452154135,0.5,TPESampler,COMPLETE
2083,0.9015779749019732,2025-04-24 22:30:51.701271,2025-04-24 22:30:55.224616,0 days 00:00:03.523345,49174.50650754724,RBF,0.6232021751339522,0.002501100440414237,0.5,TPESampler,COMPLETE
2084,0.16334781002791837,2025-04-24 22:30:52.940111,2025-04-24 22:30:59.339051,0 days 00:00:06.398940,3673.5803892102163,RBF,10.912112729012412,0.002442825507649729,0.5,TPESampler,COMPLETE
2085,0.16334781988461347,2025-04-24 22:30:55.462028,2025-04-24 22:31:00.562099,0 days 00:00:05.100071,16899.206018953864,RBF,0.5240637967323285,0.41577400294448225,0.5,TPESampler,COMPLETE
2086,0.8703401340212178,2025-04-24 22:30:59.650299,2025-04-24 22:31:06.040382,0 days 00:00:06.390083,2183.7430995216337,RBF,0.07421518749597081,0.20041291840624886,0.5,TPESampler,COMPLETE
2087,0.1633478308610959,2025-04-24 22:31:00.283872,2025-04-24 22:31:09.854886,0 days 00:00:09.571014,15848.334566353644,RBF,700.5606380361886,0.034382098444851086,0.5,TPESampler,COMPLETE
2088,0.870340134021206,2025-04-24 22:31:01.102226,2025-04-24 22:31:10.205964,0 days 00:00:09.103738,3.091333470565179,Matern,36274.40731677983,0.00021717795765878624,0.5,TPESampler,COMPLETE
2089,0.16334780949301808,2025-04-24 22:31:06.308414,2025-04-24 22:31:12.589615,0 days 00:00:06.281201,35259.54735707016,RBF,5.402443216847335,0.0003361913027682965,0.5,TPESampler,COMPLETE
2090,0.16334780922973186,2025-04-24 22:31:10.125844,2025-04-24 22:31:15.049504,0 days 00:00:04.923660,92297.66493780124,RBF,6.710737221682385,0.0006119978251786414,0.5,TPESampler,COMPLETE
2091,0.16334781093141018,2025-04-24 22:31:10.468523,2025-04-24 22:31:16.001374,0 days 00:00:05.532851,83937.19116722314,RBF,2.4632461125054594,0.00023358173623820746,0.5,TPESampler,COMPLETE
2092,0.16334784778465325,2025-04-24 22:31:12.863757,2025-04-24 22:31:18.486022,0 days 00:00:05.622265,28128.757887423104,RBF,0.6168715044754728,0.04340597429348102,0.5,TPESampler,COMPLETE
2093,0.16334780956472633,2025-04-24 22:31:15.364187,2025-04-24 22:31:19.875781,0 days 00:00:04.511594,38002.01623761754,RBF,17.56053938634197,0.012495479116392089,0.5,TPESampler,COMPLETE
2094,0.1633477688892129,2025-04-24 22:31:16.284552,2025-04-24 22:31:21.463732,0 days 00:00:05.179180,20295.331303877007,RBF,9.460929992741816,0.03610136980852829,0.5,TPESampler,COMPLETE
2095,0.16334780741823615,2025-04-24 22:31:18.802925,2025-04-24 22:31:24.877025,0 days 00:00:06.074100,23486.831848227535,RBF,16.650998911778167,0.005160391862798498,0.5,TPESampler,COMPLETE
2096,0.1633478094363165,2025-04-24 22:31:20.174060,2025-04-24 22:31:24.917101,0 days 00:00:04.743041,45245.960517227475,RBF,10.17752168705261,0.6637928279260049,0.5,TPESampler,COMPLETE
2097,0.9015754829012617,2025-04-24 22:31:21.744722,2025-04-24 22:31:25.110395,0 days 00:00:03.365673,56013.11468990439,RBF,0.04916773480102942,9.602799426963965e-05,0.5,TPESampler,COMPLETE
2098,0.8703401340127908,2025-04-24 22:31:25.032823,2025-04-24 22:31:30.970117,0 days 00:00:05.937294,906.7872733257504,RBF,71.56161906624371,0.00022568813504329787,0.5,TPESampler,COMPLETE
2099,0.16334780594460227,2025-04-24 22:31:25.073604,2025-04-24 22:31:30.393801,0 days 00:00:05.320197,707.9399468004223,RBF,5.4828808737584405,0.7524257490211631,0.5,TPESampler,COMPLETE
2100,0.16334780489269407,2025-04-24 22:31:25.366191,2025-04-24 22:31:31.544235,0 days 00:00:06.178044,18018.550265192232,RBF,477.22072257793064,0.7006778729051196,0.5,TPESampler,COMPLETE
2101,0.16334783764167887,2025-04-24 22:31:30.696605,2025-04-24 22:31:37.083958,0 days 00:00:06.387353,95419.406274724,RBF,3.184268456089316,0.01406133088180926,0.5,TPESampler,COMPLETE
2102,0.1633478111610086,2025-04-24 22:31:31.270591,2025-04-24 22:31:37.640377,0 days 00:00:06.369786,158.56130225558147,RBF,2.439377537789945,0.01167876662333142,0.5,TPESampler,COMPLETE
2103,0.16334789709867703,2025-04-24 22:31:31.811130,2025-04-24 22:31:37.984845,0 days 00:00:06.173715,3249.7637422670864,RBF,0.8883005603849654,0.022414165786293926,0.5,TPESampler,COMPLETE
2104,0.16334778074032485,2025-04-24 22:31:37.382766,2025-04-24 22:31:43.191874,0 days 00:00:05.809108,71382.92376915102,RBF,77.15607278477438,0.01641758147522331,0.5,TPESampler,COMPLETE
2105,0.16334780390091577,2025-04-24 22:31:37.939477,2025-04-24 22:31:43.241878,0 days 00:00:05.302401,76319.77084672014,RBF,6.690496740728029,0.04339022725293119,0.5,TPESampler,COMPLETE
2106,0.1633478069068703,2025-04-24 22:31:38.258072,2025-04-24 22:31:43.761351,0 days 00:00:05.503279,35.977435431684164,RBF,42.047988266583545,0.8839304497616355,0.5,TPESampler,COMPLETE
2107,0.16334777154694904,2025-04-24 22:31:43.385352,2025-04-24 22:31:48.798598,0 days 00:00:05.413246,3367.567461812878,RBF,5.6228853531023795,0.006429875998104781,0.5,TPESampler,COMPLETE
2108,0.8703401340236896,2025-04-24 22:31:43.430530,2025-04-24 22:31:48.478182,0 days 00:00:05.047652,16.216233057297867,RBF,0.008266847959266369,0.6632114905076061,0.5,TPESampler,COMPLETE
2109,0.8703401340278325,2025-04-24 22:31:44.141020,2025-04-24 22:31:52.297618,0 days 00:00:08.156598,14875.721136461474,RBF,0.017714968339554563,0.000714593863570684,0.5,TPESampler,COMPLETE
2110,0.16334780690185963,2025-04-24 22:31:48.756891,2025-04-24 22:31:54.785327,0 days 00:00:06.028436,1821.012631132694,RBF,9.893531780014653,0.00011606497359411988,0.5,TPESampler,COMPLETE
2111,0.16334784965708746,2025-04-24 22:31:49.164640,2025-04-24 22:31:53.728715,0 days 00:00:04.564075,661.8026905391953,RBF,15.58002982676933,0.022842079963593862,0.5,TPESampler,COMPLETE
2112,0.1633478096166775,2025-04-24 22:31:52.594067,2025-04-24 22:31:57.650709,0 days 00:00:05.056642,25124.403690572846,RBF,13.605730736605343,0.005865201039852239,0.5,TPESampler,COMPLETE
2113,0.16334781566363868,2025-04-24 22:31:54.031587,2025-04-24 22:31:59.240273,0 days 00:00:05.208686,2078.589166572402,RBF,266.9054567943233,0.48864170606347446,0.5,TPESampler,COMPLETE
2114,0.16334780407375152,2025-04-24 22:31:55.100303,2025-04-24 22:32:00.537396,0 days 00:00:05.437093,892.3400825669846,RBF,10.790238307129504,0.0015527391304674572,0.5,TPESampler,COMPLETE
2115,0.1633478089647638,2025-04-24 22:31:57.930454,2025-04-24 22:32:03.572353,0 days 00:00:05.641899,71797.52974589246,RBF,547.4346618254995,0.3160861540186543,0.5,TPESampler,COMPLETE
2116,0.1633478185253786,2025-04-24 22:31:59.532532,2025-04-24 22:32:04.218453,0 days 00:00:04.685921,21000.633669766852,RBF,20.845360448410222,0.03454252060023022,0.5,TPESampler,COMPLETE
2117,0.16334780897208062,2025-04-24 22:32:00.835586,2025-04-24 22:32:06.135244,0 days 00:00:05.299658,2710.3513737531207,RBF,152.27644783821844,0.4254273233909899,0.5,TPESampler,COMPLETE
2118,0.1633478091685991,2025-04-24 22:32:03.813793,2025-04-24 22:32:07.947914,0 days 00:00:04.134121,552.2068984722671,RBF,11.412462670136538,0.2539431479519642,0.5,TPESampler,COMPLETE
2119,0.16334780649910124,2025-04-24 22:32:04.452920,2025-04-24 22:32:09.124716,0 days 00:00:04.671796,7129.834178268074,RBF,4.921948093730768,0.24936810743913207,0.5,TPESampler,COMPLETE
2120,0.8703401345353303,2025-04-24 22:32:06.435699,2025-04-24 22:32:10.137558,0 days 00:00:03.701859,2670.0783364856106,RBF,0.030206089579365554,0.010192785981146443,0.5,TPESampler,COMPLETE
2121,0.21977494760535782,2025-04-24 22:32:08.233452,2025-04-24 22:32:16.351324,0 days 00:00:08.117872,26942.916684095402,Matern,31131.39371349621,0.011825753873026215,0.5,TPESampler,COMPLETE
2122,0.16334780918859207,2025-04-24 22:32:09.427335,2025-04-24 22:32:24.700114,0 days 00:00:15.272779,626.1648518926565,RBF,114.55004889447953,0.5885132362197231,0.5,TPESampler,COMPLETE
2123,0.9015771833647203,2025-04-24 22:32:10.384510,2025-04-24 22:32:14.727494,0 days 00:00:04.342984,1413.2658022668797,RBF,0.2849697331885246,5.8700405529186075e-06,0.5,TPESampler,COMPLETE
2124,0.8703401340144133,2025-04-24 22:32:15.070529,2025-04-24 22:32:23.253699,0 days 00:00:08.183170,85837.58343548217,RBF,0.14166215427023549,0.027775863162773605,0.5,TPESampler,COMPLETE
2125,0.16334780680888453,2025-04-24 22:32:16.992796,2025-04-24 22:32:25.546725,0 days 00:00:08.553929,3078.4551405532543,RBF,21.781407893576098,0.6344023104307751,0.5,TPESampler,COMPLETE
2126,0.8703401340219138,2025-04-24 22:32:23.560157,2025-04-24 22:32:27.596086,0 days 00:00:04.035929,161.27107254970366,RBF,0.05334593353779222,0.46723569676928,0.5,TPESampler,COMPLETE
2127,0.8703401340317274,2025-04-24 22:32:24.962508,2025-04-24 22:32:32.852978,0 days 00:00:07.890470,34.950563430265184,RBF,285.90661324555555,0.008578796937636251,0.5,TPESampler,COMPLETE
2128,0.16334780151444525,2025-04-24 22:32:25.826001,2025-04-24 22:32:33.906196,0 days 00:00:08.080195,579.4024968514383,RBF,19129.76277233352,0.6763835579497414,0.5,TPESampler,COMPLETE
2129,0.8703401340293364,2025-04-24 22:32:27.833380,2025-04-24 22:32:32.792270,0 days 00:00:04.958890,2325.320519642444,RBF,0.08873285154045496,0.2415582186111794,0.5,TPESampler,COMPLETE
2130,0.16334781568642648,2025-04-24 22:32:33.001135,2025-04-24 22:32:38.029301,0 days 00:00:05.028166,43003.96138750881,RBF,7.54244732113733,0.5204295430305691,0.5,TPESampler,COMPLETE
2131,0.16334782364010614,2025-04-24 22:32:33.132355,2025-04-24 22:32:39.096671,0 days 00:00:05.964316,228.85084916428355,RBF,193.92152553413376,0.7778145099979721,0.5,TPESampler,COMPLETE
2132,0.16334781216430952,2025-04-24 22:32:34.155537,2025-04-24 22:32:40.752104,0 days 00:00:06.596567,27499.13523882616,RBF,14.312038454425513,0.6989770733852135,0.5,TPESampler,COMPLETE
2133,0.16334780975758945,2025-04-24 22:32:38.272019,2025-04-24 22:32:46.195279,0 days 00:00:07.923260,38881.441994122455,RBF,33.58144332140815,6.772070204197257e-05,0.5,TPESampler,COMPLETE
2134,0.8703401340119714,2025-04-24 22:32:39.373462,2025-04-24 22:32:45.376793,0 days 00:00:06.003331,168.31829817441377,RBF,354.77775996029237,0.010034389897050284,0.5,TPESampler,COMPLETE
2135,0.8703401340235005,2025-04-24 22:32:41.051256,2025-04-24 22:32:50.113296,0 days 00:00:09.062040,1.916520183766401e-07,RBF,4.629276786638558,3.342780610701968e-10,1.5,TPESampler,COMPLETE
2136,0.1633478464417316,2025-04-24 22:32:45.685209,2025-04-24 22:32:50.929689,0 days 00:00:05.244480,1362.9334674543709,RBF,287.30446691547417,0.9586251493169762,0.5,TPESampler,COMPLETE
2137,0.1633477963880665,2025-04-24 22:32:46.490093,2025-04-24 22:32:51.776656,0 days 00:00:05.286563,1263.802349683969,RBF,18.443799386133,0.6541442814074095,0.5,TPESampler,COMPLETE
2138,0.16334780920090808,2025-04-24 22:32:50.416710,2025-04-24 22:32:55.410776,0 days 00:00:04.994066,13011.454477794325,RBF,10.181173769572789,0.8331324136473375,0.5,TPESampler,COMPLETE
2139,0.16334780526111978,2025-04-24 22:32:51.235421,2025-04-24 22:32:57.099427,0 days 00:00:05.864006,462.98679448641747,RBF,2037.3987920377983,0.9601809068577295,0.5,TPESampler,COMPLETE
2140,0.1633478064086532,2025-04-24 22:32:52.014420,2025-04-24 22:33:04.101564,0 days 00:00:12.087144,51245.129580389956,RBF,0.754554923433287,0.04486813589658197,0.5,TPESampler,COMPLETE
2141,0.21977498508883492,2025-04-24 22:32:55.744371,2025-04-24 22:33:01.885261,0 days 00:00:06.140890,70664.11540156128,Matern,32.57784364976357,0.440877174379734,0.5,TPESampler,COMPLETE
2142,0.8703401340232053,2025-04-24 22:32:57.330222,2025-04-24 22:33:05.918205,0 days 00:00:08.587983,0.8379135460816918,RBF,1.14619853179863e-05,4.799444546078949e-06,2.5,TPESampler,COMPLETE
2143,0.16334781149755062,2025-04-24 22:33:02.191725,2025-04-24 22:33:09.275657,0 days 00:00:07.083932,82005.65091289699,RBF,1069.2665378065014,0.15629258628920015,0.5,TPESampler,COMPLETE
2144,0.16334779942322672,2025-04-24 22:33:04.402629,2025-04-24 22:33:11.154617,0 days 00:00:06.751988,6894.096767393862,RBF,1992.557940352062,0.05209630259098427,0.5,TPESampler,COMPLETE
2145,0.1633478700736244,2025-04-24 22:33:06.213422,2025-04-24 22:33:17.037772,0 days 00:00:10.824350,5650.308490490294,RBF,0.26310964712318374,0.6467291920038795,0.5,TPESampler,COMPLETE
2146,0.8703401340212767,2025-04-24 22:33:09.546272,2025-04-24 22:33:14.199055,0 days 00:00:04.652783,4613.937989269421,RBF,0.018260945389812076,0.7864602213532267,0.5,TPESampler,COMPLETE
2147,0.16334780879316876,2025-04-24 22:33:11.463782,2025-04-24 22:33:19.590536,0 days 00:00:08.126754,18.267305612629002,RBF,4.278201998680048,0.8872433178620375,0.5,TPESampler,COMPLETE
2148,0.901577973617484,2025-04-24 22:33:14.524925,2025-04-24 22:33:18.174839,0 days 00:00:03.649914,2902.781231935791,RBF,0.7240325247154613,9.620665029232142e-06,1.5,TPESampler,COMPLETE
2149,0.9015564158284526,2025-04-24 22:33:17.374240,2025-04-24 22:33:23.385124,0 days 00:00:06.010884,0.0002110920961925438,Matern,0.012282091414522503,0.1783624368762986,2.5,TPESampler,COMPLETE
2150,0.8703401340200301,2025-04-24 22:33:18.523060,2025-04-24 22:33:27.022973,0 days 00:00:08.499913,2.5648614809163366,Matern,280.8547109675208,1.4927398177579955e-10,2.5,TPESampler,COMPLETE
2151,0.16334781479525706,2025-04-24 22:33:19.950374,2025-04-24 22:33:26.941050,0 days 00:00:06.990676,81990.28190390863,RBF,5700.390011753963,0.8616449054048784,0.5,TPESampler,COMPLETE
2152,0.16334781024006112,2025-04-24 22:33:23.647918,2025-04-24 22:33:28.722207,0 days 00:00:05.074289,612.6994421544607,RBF,8.052952931835948,0.012421138603756977,0.5,TPESampler,COMPLETE
2153,0.9015771954714313,2025-04-24 22:33:27.165467,2025-04-24 22:33:33.638712,0 days 00:00:06.473245,15375.71539441752,Matern,0.07089761248640326,0.002427518085073494,0.5,TPESampler,COMPLETE
2154,0.8703400359179627,2025-04-24 22:33:27.304901,2025-04-24 22:33:33.861201,0 days 00:00:06.556300,252.24975170414302,RBF,0.18123003324208936,0.641028760177118,0.5,TPESampler,COMPLETE
2155,0.1633478026470963,2025-04-24 22:33:29.192038,2025-04-24 22:33:36.658763,0 days 00:00:07.466725,85636.28276942982,RBF,12.267887440491815,0.18422710022475874,0.5,TPESampler,COMPLETE
2156,0.16334780930996395,2025-04-24 22:33:33.945295,2025-04-24 22:33:39.582185,0 days 00:00:05.636890,8744.542615444347,RBF,165.3763613874241,0.7047404055068137,0.5,TPESampler,COMPLETE
2157,0.16334780588262707,2025-04-24 22:33:34.112981,2025-04-24 22:33:40.792197,0 days 00:00:06.679216,7.260509403411483,RBF,5517.7447526678325,0.40298956110905637,1.5,TPESampler,COMPLETE
2158,0.16334779722278908,2025-04-24 22:33:36.923822,2025-04-24 22:33:46.429698,0 days 00:00:09.505876,162.36983854605535,RBF,26429.641500546262,0.6639991950537453,0.5,TPESampler,COMPLETE
2159,0.16334780218122621,2025-04-24 22:33:39.886442,2025-04-24 22:33:45.536563,0 days 00:00:05.650121,19692.85081900823,RBF,19.74108005476234,0.00016539270286694264,0.5,TPESampler,COMPLETE
2160,0.8703401340211997,2025-04-24 22:33:41.090070,2025-04-24 22:33:51.936203,0 days 00:00:10.846133,26.694662707123932,RBF,1167.1649492083964,0.021762603523430613,0.5,TPESampler,COMPLETE
2161,0.16334781407741775,2025-04-24 22:33:45.790678,2025-04-24 22:33:53.748327,0 days 00:00:07.957649,88065.75344395211,RBF,16344.018699703034,0.9793728435146859,0.5,TPESampler,COMPLETE
2162,0.21977494941703074,2025-04-24 22:33:46.714120,2025-04-24 22:33:52.556213,0 days 00:00:05.842093,25965.50145994459,Matern,3.372189292484698,0.006130890890353432,0.5,TPESampler,COMPLETE
2163,0.16334780015218575,2025-04-24 22:33:52.285696,2025-04-24 22:33:58.175005,0 days 00:00:05.889309,42370.27537720493,RBF,237.27731122332173,0.01901445950186145,0.5,TPESampler,COMPLETE
2164,0.8703401340142785,2025-04-24 22:33:52.831305,2025-04-24 22:33:56.738137,0 days 00:00:03.906832,73.62939900187274,Matern,0.04037416794682809,0.018591239439031557,0.5,TPESampler,COMPLETE
2165,0.21977494794895577,2025-04-24 22:33:54.064990,2025-04-24 22:34:01.096612,0 days 00:00:07.031622,5407.179024921,Matern,66776.64580446795,0.8049264855866163,0.5,TPESampler,COMPLETE
2166,0.2197749436073795,2025-04-24 22:33:57.033779,2025-04-24 22:34:02.892369,0 days 00:00:05.858590,2050.8850885061547,Matern,0.6224837048093426,0.46631874017440544,0.5,TPESampler,COMPLETE
2167,0.8703401339888516,2025-04-24 22:33:58.476090,2025-04-24 22:34:02.705478,0 days 00:00:04.229388,61347.07510933014,RBF,0.07157573431380981,0.008261075649738036,0.5,TPESampler,COMPLETE
2168,0.16334782960510302,2025-04-24 22:34:01.388211,2025-04-24 22:34:07.432604,0 days 00:00:06.044393,40150.740600837016,RBF,159.46306365118215,0.18862967657293764,0.5,TPESampler,COMPLETE
2169,0.8703401340211919,2025-04-24 22:34:02.983349,2025-04-24 22:34:09.583136,0 days 00:00:06.599787,97.48874765281145,RBF,353.38241102035,0.012921634326667026,0.5,TPESampler,COMPLETE
2170,0.8703401340215193,2025-04-24 22:34:03.215070,2025-04-24 22:34:10.875851,0 days 00:00:07.660781,2.4116889408184395e-06,RBF,5.520107096812577e-05,7.356092122640839e-06,1.5,TPESampler,COMPLETE
2171,0.1633478127309661,2025-04-24 22:34:07.676725,2025-04-24 22:34:12.935861,0 days 00:00:05.259136,702.4217253227995,RBF,19.809720662788216,0.006460555210543323,0.5,TPESampler,COMPLETE
2172,0.16334780068506202,2025-04-24 22:34:09.822329,2025-04-24 22:34:17.100890,0 days 00:00:07.278561,42949.99814382841,RBF,162.6074145397233,0.6223836670769971,0.5,TPESampler,COMPLETE
2173,0.8703401340039557,2025-04-24 22:34:11.179742,2025-04-24 22:34:22.767432,0 days 00:00:11.587690,67.53495948711196,RBF,4944.258962944803,0.036167337564492225,0.5,TPESampler,COMPLETE
2174,0.8703401342963752,2025-04-24 22:34:13.241290,2025-04-24 22:34:20.085638,0 days 00:00:06.844348,743.99780543019,RBF,0.1144151159081884,3.702484327701896e-05,0.5,TPESampler,COMPLETE
2175,0.1633478093482721,2025-04-24 22:34:17.742011,2025-04-24 22:34:23.473912,0 days 00:00:05.731901,48860.61144280299,RBF,0.4350499679505186,0.9848534774076368,0.5,TPESampler,COMPLETE
2176,0.8703401340213917,2025-04-24 22:34:20.351952,2025-04-24 22:34:28.487975,0 days 00:00:08.136023,0.012908166361035249,RBF,0.04248863555178073,0.027828271022522846,2.5,TPESampler,COMPLETE
2177,0.16334781175820093,2025-04-24 22:34:23.000069,2025-04-24 22:34:28.671373,0 days 00:00:05.671304,179.7125921222604,RBF,2.6188603146783933,0.9017936367249052,0.5,TPESampler,COMPLETE
2178,0.16334783236818493,2025-04-24 22:34:23.727859,2025-04-24 22:34:28.742407,0 days 00:00:05.014548,483.7147821103646,RBF,473.7533975583023,0.0294424546159062,0.5,TPESampler,COMPLETE
2179,0.16334780988416442,2025-04-24 22:34:28.674656,2025-04-24 22:34:34.374863,0 days 00:00:05.700207,87315.7710718739,RBF,9.482133581273828,0.00018981287250944507,0.5,TPESampler,COMPLETE
2180,0.16334781435130433,2025-04-24 22:34:28.925464,2025-04-24 22:34:34.690549,0 days 00:00:05.765085,2326.180560469949,RBF,217.13387591309825,0.03584634831668327,0.5,TPESampler,COMPLETE
2181,0.1633479231639603,2025-04-24 22:34:29.114773,2025-04-24 22:34:36.449922,0 days 00:00:07.335149,2.440343730156597,RBF,132.14604729947862,0.7475663764171547,0.5,TPESampler,COMPLETE
2182,0.16334783103049685,2025-04-24 22:34:34.630317,2025-04-24 22:34:38.529630,0 days 00:00:03.899313,38388.7485393784,RBF,0.7800748346631571,0.9792685074654514,0.5,TPESampler,COMPLETE
2183,0.16334780767246873,2025-04-24 22:34:34.993239,2025-04-24 22:34:42.241306,0 days 00:00:07.248067,0.003672462475071273,RBF,6.715782553869185,0.7028966062582275,2.5,TPESampler,COMPLETE
2184,0.1633478057039358,2025-04-24 22:34:36.788889,2025-04-24 22:34:46.219561,0 days 00:00:09.430672,71.67279783377502,RBF,12.355365846723469,0.005452067382905231,0.5,TPESampler,COMPLETE
2185,0.870340133583344,2025-04-24 22:34:38.820293,2025-04-24 22:35:10.410599,0 days 00:00:31.590306,0.00684476702152149,RBF,0.15570063726580113,0.8130853694274678,0.5,TPESampler,COMPLETE
2186,0.8703400769279772,2025-04-24 22:34:42.913739,2025-04-24 22:34:59.725712,0 days 00:00:16.811973,571.0700276519365,RBF,0.1781072482598301,0.000725209021450859,0.5,TPESampler,COMPLETE
2187,0.9015777253701195,2025-04-24 22:34:48.309779,2025-04-24 22:35:00.878317,0 days 00:00:12.568538,69.33255374225425,Matern,39.049023227837345,7.722383200866426e-09,0.5,TPESampler,COMPLETE
2188,0.8703401340254593,2025-04-24 22:35:00.753530,2025-04-24 22:35:14.631309,0 days 00:00:13.877779,50.1757634504517,RBF,7379.020914663,0.014591737671629655,0.5,TPESampler,COMPLETE
2189,0.1633478347337276,2025-04-24 22:35:01.528031,2025-04-24 22:35:12.380293,0 days 00:00:10.852262,92592.32871412378,RBF,228.85136972503096,0.023055630655493927,0.5,TPESampler,COMPLETE
2190,0.8703401340242122,2025-04-24 22:35:10.668931,2025-04-24 22:35:23.088141,0 days 00:00:12.419210,85.6121046314589,RBF,35104.64716533895,4.3010439987448974e-06,1.5,TPESampler,COMPLETE
2191,0.16334781149855673,2025-04-24 22:35:12.677237,2025-04-24 22:35:18.413369,0 days 00:00:05.736132,68134.68628148819,RBF,16.802777717207316,0.9181208143149898,0.5,TPESampler,COMPLETE
2192,0.8703401340195771,2025-04-24 22:35:14.920840,2025-04-24 22:35:23.670053,0 days 00:00:08.749213,4248.28471657877,Matern,70641.54907667804,3.1684223082544743e-10,2.5,TPESampler,COMPLETE
2193,0.1633480088662846,2025-04-24 22:35:18.718857,2025-04-24 22:35:24.509671,0 days 00:00:05.790814,29.8477131766538,RBF,1566.5904745076389,0.06171253026607163,0.5,TPESampler,COMPLETE
2194,0.16334780375693791,2025-04-24 22:35:23.389214,2025-04-24 22:35:28.524262,0 days 00:00:05.135048,105.81633468520243,RBF,200.73977790837702,0.4393653346844925,0.5,TPESampler,COMPLETE
2195,0.8703401340596779,2025-04-24 22:35:23.971198,2025-04-24 22:35:32.738625,0 days 00:00:08.767427,52581.142153595894,RBF,20521.23675984664,1.8882827530559035e-06,1.5,TPESampler,COMPLETE
2196,0.870340134023004,2025-04-24 22:35:24.744762,2025-04-24 22:35:32.660140,0 days 00:00:07.915378,754.3115839699542,RBF,72287.40439634223,0.03224335243694259,0.5,TPESampler,COMPLETE
2197,0.16334781248746352,2025-04-24 22:35:28.867675,2025-04-24 22:35:35.424490,0 days 00:00:06.556815,10.450636293196277,RBF,1990.0900668419765,0.866501341052742,0.5,TPESampler,COMPLETE
