[I 2024-12-04 20:24:04,807] Trial 1822 finished with value: 0.6858637693076529 and parameters: {'n_estimators': 435, 'max_depth': 50, 'min_samples_split': 2, 'min_samples_leaf': 2, 'max_features': 'sqrt', 'bootstrap': False, 'criterion': 'squared_error'}. Best is trial 1631 with value: 0.32128932742921457.
[I 2024-12-04 20:24:05,769] Trial 1823 finished with value: 1.274110702984799 and parameters: {'n_estimators': 960, 'max_depth': 38, 'min_samples_split': 2, 'min_samples_leaf': 10, 'max_features': 'log2', 'bootstrap': True, 'criterion': 'squared_error'}. Best is trial 1631 with value: 0.32128932742921457.
[I 2024-12-04 20:24:06,862] Trial 1825 finished with value: 0.6832516034128606 and parameters: {'n_estimators': 432, 'max_depth': 50, 'min_samples_split': 4, 'min_samples_leaf': 2, 'max_features': 'sqrt', 'bootstrap': False, 'criterion': 'squared_error'}. Best is trial 1631 with value: 0.32128932742921457.
[I 2024-12-04 20:24:08,021] Trial 1826 finished with value: 0.3238565266737387 and parameters: {'n_estimators': 336, 'max_depth': 50, 'min_samples_split': 2, 'min_samples_leaf': 1, 'max_features': 'sqrt', 'bootstrap': False, 'criterion': 'squared_error'}. Best is trial 1631 with value: 0.32128932742921457.
[I 2024-12-04 20:24:08,090] Trial 1827 finished with value: 0.6665240220379198 and parameters: {'n_estimators': 346, 'max_depth': 50, 'min_samples_split': 4, 'min_samples_leaf': 2, 'max_features': 'sqrt', 'bootstrap': False, 'criterion': 'squared_error'}. Best is trial 1631 with value: 0.32128932742921457.
[I 2024-12-04 20:24:10,098] Trial 1829 finished with value: 0.3464369186005454 and parameters: {'n_estimators': 315, 'max_depth': 42, 'min_samples_split': 2, 'min_samples_leaf': 1, 'max_features': 'sqrt', 'bootstrap': False, 'criterion': 'squared_error'}. Best is trial 1631 with value: 0.32128932742921457.
[I 2024-12-04 20:24:11,209] Trial 1830 finished with value: 0.37117887363486224 and parameters: {'n_estimators': 112, 'max_depth': 44, 'min_samples_split': 2, 'min_samples_leaf': 1, 'max_features': 'sqrt', 'bootstrap': False, 'criterion': 'squared_error'}. Best is trial 1631 with value: 0.32128932742921457.
[I 2024-12-04 20:24:11,277] Trial 1828 finished with value: 0.5280315700953045 and parameters: {'n_estimators': 132, 'max_depth': 50, 'min_samples_split': 3, 'min_samples_leaf': 1, 'max_features': 'log2', 'bootstrap': False, 'criterion': 'absolute_error'}. Best is trial 1631 with value: 0.32128932742921457.
[I 2024-12-04 20:24:12,862] Trial 1832 finished with value: 0.336558033843458 and parameters: {'n_estimators': 127, 'max_depth': 50, 'min_samples_split': 2, 'min_samples_leaf': 1, 'max_features': 'sqrt', 'bootstrap': False, 'criterion': 'squared_error'}. Best is trial 1631 with value: 0.32128932742921457.
[I 2024-12-04 20:24:13,507] Trial 1831 finished with value: 1.2956145889095148 and parameters: {'n_estimators': 698, 'max_depth': 16, 'min_samples_split': 2, 'min_samples_leaf': 10, 'max_features': 'sqrt', 'bootstrap': True, 'criterion': 'absolute_error'}. Best is trial 1631 with value: 0.32128932742921457.
[I 2024-12-04 20:24:14,352] Trial 1833 finished with value: 0.6702505305869959 and parameters: {'n_estimators': 282, 'max_depth': 43, 'min_samples_split': 2, 'min_samples_leaf': 2, 'max_features': 'sqrt', 'bootstrap': False, 'criterion': 'squared_error'}. Best is trial 1631 with value: 0.32128932742921457.
[I 2024-12-04 20:24:14,704] Trial 1834 finished with value: 0.648985330067186 and parameters: {'n_estimators': 167, 'max_depth': 50, 'min_samples_split': 2, 'min_samples_leaf': 2, 'max_features': 'sqrt', 'bootstrap': False, 'criterion': 'squared_error'}. Best is trial 1631 with value: 0.32128932742921457.
[I 2024-12-04 20:24:15,697] Trial 1835 finished with value: 1.0515331229624623 and parameters: {'n_estimators': 398, 'max_depth': 49, 'min_samples_split': 2, 'min_samples_leaf': 2, 'max_features': 'log2', 'bootstrap': False, 'criterion': 'squared_error'}. Best is trial 1631 with value: 0.32128932742921457.
[I 2024-12-04 20:24:16,724] Trial 1836 finished with value: 0.3573661899946124 and parameters: {'n_estimators': 341, 'max_depth': 50, 'min_samples_split': 3, 'min_samples_leaf': 1, 'max_features': 'sqrt', 'bootstrap': False, 'criterion': 'squared_error'}. Best is trial 1631 with value: 0.32128932742921457.
[I 2024-12-04 20:24:17,998] Trial 1837 finished with value: 0.32369937626844103 and parameters: {'n_estimators': 391, 'max_depth': 50, 'min_samples_split': 2, 'min_samples_leaf': 1, 'max_features': 'sqrt', 'bootstrap': False, 'criterion': 'squared_error'}. Best is trial 1631 with value: 0.32128932742921457.
[I 2024-12-04 20:24:18,579] Trial 1838 finished with value: 0.32586237884113484 and parameters: {'n_estimators': 277, 'max_depth': 50, 'min_samples_split': 2, 'min_samples_leaf': 1, 'max_features': 'sqrt', 'bootstrap': False, 'criterion': 'squared_error'}. Best is trial 1631 with value: 0.32128932742921457.
[I 2024-12-04 20:24:21,120] Trial 1839 finished with value: 0.509774736087068 and parameters: {'n_estimators': 638, 'max_depth': 12, 'min_samples_split': 6, 'min_samples_leaf': 3, 'max_features': None, 'bootstrap': True, 'criterion': 'squared_error'}. Best is trial 1631 with value: 0.32128932742921457.
[I 2024-12-04 20:24:21,129] Trial 1840 finished with value: 0.3289114488652024 and parameters: {'n_estimators': 483, 'max_depth': 50, 'min_samples_split': 2, 'min_samples_leaf': 1, 'max_features': 'sqrt', 'bootstrap': False, 'criterion': 'squared_error'}. Best is trial 1631 with value: 0.32128932742921457.
[I 2024-12-04 20:24:22,995] Trial 1842 finished with value: 0.35697724723553803 and parameters: {'n_estimators': 274, 'max_depth': 50, 'min_samples_split': 3, 'min_samples_leaf': 1, 'max_features': 'sqrt', 'bootstrap': False, 'criterion': 'squared_error'}. Best is trial 1631 with value: 0.32128932742921457.
[I 2024-12-04 20:24:23,063] Trial 1841 finished with value: 0.41114540405665095 and parameters: {'n_estimators': 411, 'max_depth': 50, 'min_samples_split': 3, 'min_samples_leaf': 1, 'max_features': 'sqrt', 'bootstrap': True, 'criterion': 'squared_error'}. Best is trial 1631 with value: 0.32128932742921457.
[I 2024-12-04 20:24:25,032] Trial 1843 finished with value: 0.41100459843448506 and parameters: {'n_estimators': 399, 'max_depth': 43, 'min_samples_split': 4, 'min_samples_leaf': 1, 'max_features': 'sqrt', 'bootstrap': False, 'criterion': 'squared_error'}. Best is trial 1631 with value: 0.32128932742921457.
[I 2024-12-04 20:24:25,380] Trial 1844 finished with value: 0.8235758775192353 and parameters: {'n_estimators': 794, 'max_depth': 27, 'min_samples_split': 4, 'min_samples_leaf': 1, 'max_features': 'log2', 'bootstrap': False, 'criterion': 'squared_error'}. Best is trial 1631 with value: 0.32128932742921457.
[I 2024-12-04 20:24:27,246] Trial 1845 finished with value: 0.3232888595106857 and parameters: {'n_estimators': 386, 'max_depth': 50, 'min_samples_split': 2, 'min_samples_leaf': 1, 'max_features': 'sqrt', 'bootstrap': False, 'criterion': 'squared_error'}. Best is trial 1631 with value: 0.32128932742921457.
[I 2024-12-04 20:24:27,660] Trial 1846 finished with value: 0.32339780767094983 and parameters: {'n_estimators': 365, 'max_depth': 50, 'min_samples_split': 2, 'min_samples_leaf': 1, 'max_features': 'sqrt', 'bootstrap': False, 'criterion': 'squared_error'}. Best is trial 1631 with value: 0.32128932742921457.
[I 2024-12-04 20:24:29,121] Trial 1848 finished with value: 0.3897834813084361 and parameters: {'n_estimators': 225, 'max_depth': 41, 'min_samples_split': 3, 'min_samples_leaf': 1, 'max_features': 'sqrt', 'bootstrap': False, 'criterion': 'squared_error'}. Best is trial 1631 with value: 0.32128932742921457.
[I 2024-12-04 20:24:30,145] Trial 1847 finished with value: 0.32742724725878997 and parameters: {'n_estimators': 520, 'max_depth': 50, 'min_samples_split': 2, 'min_samples_leaf': 1, 'max_features': 'sqrt', 'bootstrap': False, 'criterion': 'squared_error'}. Best is trial 1631 with value: 0.32128932742921457.
[I 2024-12-04 20:24:31,231] Trial 1849 finished with value: 0.3929137147778931 and parameters: {'n_estimators': 482, 'max_depth': 50, 'min_samples_split': 4, 'min_samples_leaf': 1, 'max_features': 'sqrt', 'bootstrap': False, 'criterion': 'squared_error'}. Best is trial 1631 with value: 0.32128932742921457.
[I 2024-12-04 20:24:32,319] Trial 1850 finished with value: 0.34590911740072167 and parameters: {'n_estimators': 368, 'max_depth': 42, 'min_samples_split': 2, 'min_samples_leaf': 1, 'max_features': 'sqrt', 'bootstrap': False, 'criterion': 'squared_error'}. Best is trial 1631 with value: 0.32128932742921457.
[I 2024-12-04 20:24:33,856] Trial 1852 finished with value: 0.32618657432518644 and parameters: {'n_estimators': 233, 'max_depth': 50, 'min_samples_split': 2, 'min_samples_leaf': 1, 'max_features': 'sqrt', 'bootstrap': False, 'criterion': 'squared_error'}. Best is trial 1631 with value: 0.32128932742921457.
[I 2024-12-04 20:24:38,125] Trial 1853 finished with value: 0.4311403418098798 and parameters: {'n_estimators': 481, 'max_depth': 40, 'min_samples_split': 3, 'min_samples_leaf': 1, 'max_features': None, 'bootstrap': False, 'criterion': 'squared_error'}. Best is trial 1631 with value: 0.32128932742921457.
[I 2024-12-04 20:24:39,847] Trial 1854 finished with value: 1.287503449693538 and parameters: {'n_estimators': 521, 'max_depth': 46, 'min_samples_split': 10, 'min_samples_leaf': 14, 'max_features': 'sqrt', 'bootstrap': False, 'criterion': 'absolute_error'}. Best is trial 1631 with value: 0.32128932742921457.
[I 2024-12-04 20:24:41,080] Trial 1855 finished with value: 0.6748662142272241 and parameters: {'n_estimators': 332, 'max_depth': 43, 'min_samples_split': 3, 'min_samples_leaf': 2, 'max_features': 'sqrt', 'bootstrap': False, 'criterion': 'squared_error'}. Best is trial 1631 with value: 0.32128932742921457.
[I 2024-12-04 20:24:44,377] Trial 1856 finished with value: 0.5373565723161604 and parameters: {'n_estimators': 443, 'max_depth': 37, 'min_samples_split': 2, 'min_samples_leaf': 2, 'max_features': None, 'bootstrap': False, 'criterion': 'squared_error'}. Best is trial 1631 with value: 0.32128932742921457.
[I 2024-12-04 20:24:45,310] Trial 1857 finished with value: 1.2109933740887342 and parameters: {'n_estimators': 231, 'max_depth': 50, 'min_samples_split': 12, 'min_samples_leaf': 14, 'max_features': 'sqrt', 'bootstrap': False, 'criterion': 'squared_error'}. Best is trial 1631 with value: 0.32128932742921457.
[I 2024-12-04 20:24:55,670] Trial 1851 finished with value: 0.47319747397683126 and parameters: {'n_estimators': 532, 'max_depth': 48, 'min_samples_split': 6, 'min_samples_leaf': 2, 'max_features': None, 'bootstrap': True, 'criterion': 'absolute_error'}. Best is trial 1631 with value: 0.32128932742921457.
[I 2024-12-04 20:24:57,015] Trial 1859 finished with value: 0.5128240355992346 and parameters: {'n_estimators': 355, 'max_depth': 50, 'min_samples_split': 10, 'min_samples_leaf': 1, 'max_features': 'sqrt', 'bootstrap': False, 'criterion': 'squared_error'}. Best is trial 1631 with value: 0.32128932742921457.
[I 2024-12-04 20:24:58,170] Trial 1858 finished with value: 0.5769740972756834 and parameters: {'n_estimators': 458, 'max_depth': 35, 'min_samples_split': 6, 'min_samples_leaf': 1, 'max_features': 'sqrt', 'bootstrap': False, 'criterion': 'absolute_error'}. Best is trial 1631 with value: 0.32128932742921457.
[I 2024-12-04 20:24:59,189] Trial 1860 finished with value: 0.39732490044110474 and parameters: {'n_estimators': 467, 'max_depth': 41, 'min_samples_split': 3, 'min_samples_leaf': 1, 'max_features': 'sqrt', 'bootstrap': False, 'criterion': 'squared_error'}. Best is trial 1631 with value: 0.32128932742921457.
[I 2024-12-04 20:25:00,346] Trial 1861 finished with value: 0.3471378539924167 and parameters: {'n_estimators': 379, 'max_depth': 43, 'min_samples_split': 2, 'min_samples_leaf': 1, 'max_features': 'sqrt', 'bootstrap': False, 'criterion': 'squared_error'}. Best is trial 1631 with value: 0.32128932742921457.
[I 2024-12-04 20:25:00,413] Trial 1862 finished with value: 0.5760275404992498 and parameters: {'n_estimators': 178, 'max_depth': 41, 'min_samples_split': 2, 'min_samples_leaf': 1, 'max_features': 'log2', 'bootstrap': False, 'criterion': 'squared_error'}. Best is trial 1631 with value: 0.32128932742921457.
[I 2024-12-04 20:25:01,872] Trial 1863 finished with value: 0.667446203076025 and parameters: {'n_estimators': 326, 'max_depth': 50, 'min_samples_split': 2, 'min_samples_leaf': 2, 'max_features': 'sqrt', 'bootstrap': False, 'criterion': 'squared_error'}. Best is trial 1631 with value: 0.32128932742921457.
[I 2024-12-04 20:25:02,448] Trial 1864 finished with value: 0.34422616553827934 and parameters: {'n_estimators': 266, 'max_depth': 41, 'min_samples_split': 2, 'min_samples_leaf': 1, 'max_features': 'sqrt', 'bootstrap': False, 'criterion': 'squared_error'}. Best is trial 1631 with value: 0.32128932742921457.
[I 2024-12-04 20:25:03,602] Trial 1865 finished with value: 0.3855241914136392 and parameters: {'n_estimators': 250, 'max_depth': 50, 'min_samples_split': 4, 'min_samples_leaf': 1, 'max_features': 'sqrt', 'bootstrap': False, 'criterion': 'squared_error'}. Best is trial 1631 with value: 0.32128932742921457.
[I 2024-12-04 20:25:05,431] Trial 1867 finished with value: 0.3250062651881157 and parameters: {'n_estimators': 301, 'max_depth': 50, 'min_samples_split': 2, 'min_samples_leaf': 1, 'max_features': 'sqrt', 'bootstrap': False, 'criterion': 'squared_error'}. Best is trial 1631 with value: 0.32128932742921457.
[I 2024-12-04 20:25:07,512] Trial 1868 finished with value: 0.5079602747151357 and parameters: {'n_estimators': 444, 'max_depth': 49, 'min_samples_split': 2, 'min_samples_leaf': 1, 'max_features': 'log2', 'bootstrap': False, 'criterion': 'squared_error'}. Best is trial 1631 with value: 0.32128932742921457.
[I 2024-12-04 20:25:08,794] Trial 1866 finished with value: 1.008038367722297 and parameters: {'n_estimators': 693, 'max_depth': 49, 'min_samples_split': 22, 'min_samples_leaf': 2, 'max_features': 'sqrt', 'bootstrap': True, 'criterion': 'absolute_error'}. Best is trial 1631 with value: 0.32128932742921457.
[I 2024-12-04 20:25:08,969] Trial 1869 finished with value: 0.6921140228761337 and parameters: {'n_estimators': 463, 'max_depth': 50, 'min_samples_split': 2, 'min_samples_leaf': 2, 'max_features': 'sqrt', 'bootstrap': False, 'criterion': 'squared_error'}. Best is trial 1631 with value: 0.32128932742921457.
[I 2024-12-04 20:25:10,228] Trial 1870 finished with value: 0.6625664198762813 and parameters: {'n_estimators': 303, 'max_depth': 50, 'min_samples_split': 2, 'min_samples_leaf': 2, 'max_features': 'sqrt', 'bootstrap': False, 'criterion': 'squared_error'}. Best is trial 1631 with value: 0.32128932742921457.
[I 2024-12-04 20:25:10,764] Trial 1871 finished with value: 0.7052270982934952 and parameters: {'n_estimators': 440, 'max_depth': 32, 'min_samples_split': 2, 'min_samples_leaf': 2, 'max_features': 'sqrt', 'bootstrap': False, 'criterion': 'squared_error'}. Best is trial 1631 with value: 0.32128932742921457.
[I 2024-12-04 20:25:12,093] Trial 1872 finished with value: 0.7972631487376663 and parameters: {'n_estimators': 481, 'max_depth': 49, 'min_samples_split': 2, 'min_samples_leaf': 2, 'max_features': 'sqrt', 'bootstrap': True, 'criterion': 'squared_error'}. Best is trial 1631 with value: 0.32128932742921457.
[I 2024-12-04 20:25:13,046] Trial 1873 finished with value: 0.4042014559802922 and parameters: {'n_estimators': 442, 'max_depth': 43, 'min_samples_split': 3, 'min_samples_leaf': 1, 'max_features': 'sqrt', 'bootstrap': False, 'criterion': 'squared_error'}. Best is trial 1631 with value: 0.32128932742921457.
[I 2024-12-04 20:25:13,840] Trial 1874 finished with value: 0.3469858365090585 and parameters: {'n_estimators': 220, 'max_depth': 42, 'min_samples_split': 2, 'min_samples_leaf': 1, 'max_features': 'sqrt', 'bootstrap': False, 'criterion': 'squared_error'}. Best is trial 1631 with value: 0.32128932742921457.
[I 2024-12-04 20:25:15,039] Trial 1876 finished with value: 0.3891256363472834 and parameters: {'n_estimators': 178, 'max_depth': 50, 'min_samples_split': 4, 'min_samples_leaf': 1, 'max_features': 'sqrt', 'bootstrap': False, 'criterion': 'squared_error'}. Best is trial 1631 with value: 0.32128932742921457.
[I 2024-12-04 20:25:15,351] Trial 1824 finished with value: 0.5769690795871373 and parameters: {'n_estimators': 868, 'max_depth': 47, 'min_samples_split': 31, 'min_samples_leaf': 2, 'max_features': None, 'bootstrap': False, 'criterion': 'absolute_error'}. Best is trial 1631 with value: 0.32128932742921457.
[I 2024-12-04 20:25:15,915] Trial 1875 finished with value: 0.32853599308384795 and parameters: {'n_estimators': 461, 'max_depth': 50, 'min_samples_split': 2, 'min_samples_leaf': 1, 'max_features': 'sqrt', 'bootstrap': False, 'criterion': 'squared_error'}. Best is trial 1631 with value: 0.32128932742921457.
[I 2024-12-04 20:25:16,635] Trial 1877 finished with value: 0.33638168634443355 and parameters: {'n_estimators': 149, 'max_depth': 50, 'min_samples_split': 2, 'min_samples_leaf': 1, 'max_features': 'sqrt', 'bootstrap': False, 'criterion': 'squared_error'}. Best is trial 1631 with value: 0.32128932742921457.
[I 2024-12-04 20:25:17,767] Trial 1879 finished with value: 0.39002941116160855 and parameters: {'n_estimators': 316, 'max_depth': 42, 'min_samples_split': 3, 'min_samples_leaf': 1, 'max_features': 'sqrt', 'bootstrap': False, 'criterion': 'squared_error'}. Best is trial 1631 with value: 0.32128932742921457.
[I 2024-12-04 20:25:17,775] Trial 1878 finished with value: 0.3490690241274334 and parameters: {'n_estimators': 382, 'max_depth': 42, 'min_samples_split': 2, 'min_samples_leaf': 1, 'max_features': 'sqrt', 'bootstrap': False, 'criterion': 'squared_error'}. Best is trial 1631 with value: 0.32128932742921457.
[I 2024-12-04 20:25:18,769] Trial 1880 finished with value: 0.43391479833005003 and parameters: {'n_estimators': 123, 'max_depth': 49, 'min_samples_split': 2, 'min_samples_leaf': 1, 'max_features': None, 'bootstrap': False, 'criterion': 'squared_error'}. Best is trial 1631 with value: 0.32128932742921457.
[I 2024-12-04 20:25:19,369] Trial 1881 finished with value: 0.9222468884201628 and parameters: {'n_estimators': 340, 'max_depth': 24, 'min_samples_split': 7, 'min_samples_leaf': 4, 'max_features': 'sqrt', 'bootstrap': False, 'criterion': 'squared_error'}. Best is trial 1631 with value: 0.32128932742921457.
[I 2024-12-04 20:25:20,498] Trial 1882 finished with value: 0.3236326678212457 and parameters: {'n_estimators': 317, 'max_depth': 50, 'min_samples_split': 2, 'min_samples_leaf': 1, 'max_features': 'sqrt', 'bootstrap': False, 'criterion': 'squared_error'}. Best is trial 1631 with value: 0.32128932742921457.
[I 2024-12-04 20:25:21,271] Trial 1883 finished with value: 0.36280291343041615 and parameters: {'n_estimators': 428, 'max_depth': 50, 'min_samples_split': 3, 'min_samples_leaf': 1, 'max_features': 'sqrt', 'bootstrap': False, 'criterion': 'squared_error'}. Best is trial 1631 with value: 0.32128932742921457.
[I 2024-12-04 20:25:21,522] Trial 1884 finished with value: 0.38985756070651323 and parameters: {'n_estimators': 439, 'max_depth': 50, 'min_samples_split': 4, 'min_samples_leaf': 1, 'max_features': 'sqrt', 'bootstrap': False, 'criterion': 'squared_error'}. Best is trial 1631 with value: 0.32128932742921457.
[I 2024-12-04 20:25:21,763] Trial 1885 finished with value: 1.286150009984036 and parameters: {'n_estimators': 155, 'max_depth': 29, 'min_samples_split': 44, 'min_samples_leaf': 10, 'max_features': 'sqrt', 'bootstrap': False, 'criterion': 'absolute_error'}. Best is trial 1631 with value: 0.32128932742921457.
[I 2024-12-04 20:25:23,693] Trial 1887 finished with value: 0.6856872608058939 and parameters: {'n_estimators': 427, 'max_depth': 44, 'min_samples_split': 2, 'min_samples_leaf': 2, 'max_features': 'sqrt', 'bootstrap': False, 'criterion': 'squared_error'}. Best is trial 1631 with value: 0.32128932742921457.
[I 2024-12-04 20:25:23,758] Trial 1888 finished with value: 0.7018669786514674 and parameters: {'n_estimators': 446, 'max_depth': 41, 'min_samples_split': 2, 'min_samples_leaf': 2, 'max_features': 'sqrt', 'bootstrap': False, 'criterion': 'squared_error'}. Best is trial 1631 with value: 0.32128932742921457.
[I 2024-12-04 20:25:23,957] Trial 1886 finished with value: 0.3902904434596696 and parameters: {'n_estimators': 312, 'max_depth': 42, 'min_samples_split': 3, 'min_samples_leaf': 1, 'max_features': 'sqrt', 'bootstrap': False, 'criterion': 'squared_error'}. Best is trial 1631 with value: 0.32128932742921457.
[I 2024-12-04 20:25:25,921] Trial 1889 finished with value: 0.3235478435313454 and parameters: {'n_estimators': 259, 'max_depth': 50, 'min_samples_split': 2, 'min_samples_leaf': 1, 'max_features': 'sqrt', 'bootstrap': False, 'criterion': 'squared_error'}. Best is trial 1631 with value: 0.32128932742921457.
[I 2024-12-04 20:25:25,929] Trial 1891 finished with value: 0.6842272441400097 and parameters: {'n_estimators': 422, 'max_depth': 50, 'min_samples_split': 2, 'min_samples_leaf': 2, 'max_features': 'sqrt', 'bootstrap': False, 'criterion': 'squared_error'}. Best is trial 1631 with value: 0.32128932742921457.
[I 2024-12-04 20:25:27,786] Trial 1892 finished with value: 0.3426679990214276 and parameters: {'n_estimators': 219, 'max_depth': 43, 'min_samples_split': 2, 'min_samples_leaf': 1, 'max_features': 'sqrt', 'bootstrap': False, 'criterion': 'squared_error'}. Best is trial 1631 with value: 0.32128932742921457.
[I 2024-12-04 20:25:27,787] Trial 1890 finished with value: 0.32728765972010504 and parameters: {'n_estimators': 624, 'max_depth': 50, 'min_samples_split': 2, 'min_samples_leaf': 1, 'max_features': 'sqrt', 'bootstrap': False, 'criterion': 'squared_error'}. Best is trial 1631 with value: 0.32128932742921457.
