[I 2024-12-04 20:54:35,126] Trial 2337 finished with value: 0.3592112363676808 and parameters: {'kernel_type': 'Matern', 'length_scale': 6.4142202830283, 'noise_level': 0.0027779569263600206, 'constant_value': 6342.347019355269, 'nu': 0.5}. Best is trial 1997 with value: 0.359156695282073.
[I 2024-12-04 20:54:35,137] Trial 2339 finished with value: 1.0916561421021027 and parameters: {'kernel_type': 'Matern', 'length_scale': 0.5774336901352108, 'noise_level': 2.154890154365946e-05, 'constant_value': 14809.394786193603, 'nu': 0.5}. Best is trial 1997 with value: 0.359156695282073.
[I 2024-12-04 20:54:36,801] Trial 2338 finished with value: 0.35920430250013746 and parameters: {'kernel_type': 'Matern', 'length_scale': 0.23239715745408335, 'noise_level': 0.0010436259643761992, 'constant_value': 5208.319862502509, 'nu': 0.5}. Best is trial 1997 with value: 0.359156695282073.
[I 2024-12-04 20:54:39,796] Trial 2341 finished with value: 1.0624161172695188 and parameters: {'kernel_type': 'RBF', 'length_scale': 2.786967137922323, 'noise_level': 0.005419483485986961, 'constant_value': 0.026708286398543994, 'nu': 2.5}. Best is trial 1997 with value: 0.359156695282073.
[I 2024-12-04 20:54:41,116] Trial 2340 finished with value: 0.3592112402395683 and parameters: {'kernel_type': 'Matern', 'length_scale': 503.25186520022316, 'noise_level': 4.025065234580985e-05, 'constant_value': 758.3073354014182, 'nu': 0.5}. Best is trial 1997 with value: 0.359156695282073.
[I 2024-12-04 20:54:42,098] Trial 2342 finished with value: 0.35921123882734574 and parameters: {'kernel_type': 'Matern', 'length_scale': 10.700466554046354, 'noise_level': 0.000893015478401512, 'constant_value': 48854.03146236503, 'nu': 0.5}. Best is trial 1997 with value: 0.359156695282073.
[I 2024-12-04 20:54:44,361] Trial 2344 finished with value: 1.091656572703009 and parameters: {'kernel_type': 'Matern', 'length_scale': 2.7274333448136043, 'noise_level': 3.250532775756355e-05, 'constant_value': 76934.56834265955, 'nu': 0.5}. Best is trial 1997 with value: 0.359156695282073.
[I 2024-12-04 20:54:45,398] Trial 2343 finished with value: 0.35922523414145374 and parameters: {'kernel_type': 'Matern', 'length_scale': 0.3256966338134612, 'noise_level': 0.0009981825416815432, 'constant_value': 18350.86544136289, 'nu': 0.5}. Best is trial 1997 with value: 0.359156695282073.
[I 2024-12-04 20:54:45,733] Trial 2345 finished with value: 1.091656613611351 and parameters: {'kernel_type': 'Matern', 'length_scale': 62.631247310692146, 'noise_level': 1.3030125694117925e-06, 'constant_value': 40277.893141071465, 'nu': 0.5}. Best is trial 1997 with value: 0.359156695282073.
[I 2024-12-04 20:54:51,663] Trial 2346 finished with value: 0.35921129150325665 and parameters: {'kernel_type': 'Matern', 'length_scale': 0.41023154374493453, 'noise_level': 0.000493529801717115, 'constant_value': 72460.33454644718, 'nu': 0.5}. Best is trial 1997 with value: 0.359156695282073.
[I 2024-12-04 20:54:52,308] Trial 2348 finished with value: 1.091655849386216 and parameters: {'kernel_type': 'Matern', 'length_scale': 0.030957583137569817, 'noise_level': 2.88063397991009e-05, 'constant_value': 4828.87625722829, 'nu': 0.5}. Best is trial 1997 with value: 0.359156695282073.
[I 2024-12-04 20:54:54,993] Trial 2347 finished with value: 1.062416117289662 and parameters: {'kernel_type': 'Matern', 'length_scale': 0.015831131134360518, 'noise_level': 0.002602693932087427, 'constant_value': 9124.898907037888, 'nu': 2.5}. Best is trial 1997 with value: 0.359156695282073.
[I 2024-12-04 20:54:57,007] Trial 2349 finished with value: 1.062415290094791 and parameters: {'kernel_type': 'Matern', 'length_scale': 0.07420066116921299, 'noise_level': 0.002363965968190589, 'constant_value': 4054.4176766844503, 'nu': 0.5}. Best is trial 1997 with value: 0.359156695282073.
[I 2024-12-04 20:54:57,994] Trial 2350 finished with value: 0.35921114235499985 and parameters: {'kernel_type': 'Matern', 'length_scale': 1.3168284311056633, 'noise_level': 0.0002540615059082506, 'constant_value': 47939.735803792464, 'nu': 0.5}. Best is trial 1997 with value: 0.359156695282073.
[I 2024-12-04 20:54:59,719] Trial 2352 finished with value: 1.0916566893789788 and parameters: {'kernel_type': 'Matern', 'length_scale': 0.6488448286226907, 'noise_level': 0.005384552980232408, 'constant_value': 3297.195993658718, 'nu': 0.5}. Best is trial 1997 with value: 0.359156695282073.
[I 2024-12-04 20:55:03,180] Trial 2354 finished with value: 1.0916558493884858 and parameters: {'kernel_type': 'Matern', 'length_scale': 0.039502099768917893, 'noise_level': 2.157406126252056e-06, 'constant_value': 24700.256185069797, 'nu': 0.5}. Best is trial 1997 with value: 0.359156695282073.
[I 2024-12-04 20:55:03,320] Trial 2353 finished with value: 0.35920762282998836 and parameters: {'kernel_type': 'Matern', 'length_scale': 973.1081743627103, 'noise_level': 0.0009647507096170854, 'constant_value': 52294.484679706016, 'nu': 0.5}. Best is trial 1997 with value: 0.359156695282073.
[I 2024-12-04 20:55:03,954] Trial 2351 finished with value: 1.0624161175956433 and parameters: {'kernel_type': 'Matern', 'length_scale': 0.00015618397041491076, 'noise_level': 0.00022542195826593723, 'constant_value': 4221.096073060402, 'nu': 0.5}. Best is trial 1997 with value: 0.359156695282073.
[I 2024-12-04 20:55:06,996] Trial 2355 finished with value: 1.0916566075401184 and parameters: {'kernel_type': 'Matern', 'length_scale': 30.51833435515997, 'noise_level': 1.4572048962897468e-05, 'constant_value': 35527.55451910546, 'nu': 0.5}. Best is trial 1997 with value: 0.359156695282073.
[I 2024-12-04 20:55:08,442] Trial 2356 finished with value: 0.3592112384930524 and parameters: {'kernel_type': 'Matern', 'length_scale': 6564.966455144011, 'noise_level': 0.0019072872507626673, 'constant_value': 57630.94531735919, 'nu': 0.5}. Best is trial 1997 with value: 0.359156695282073.
[I 2024-12-04 20:55:09,179] Trial 2357 finished with value: 0.35921124353190503 and parameters: {'kernel_type': 'Matern', 'length_scale': 48.87971024671361, 'noise_level': 6.745184253718123e-05, 'constant_value': 4635.986555901883, 'nu': 0.5}. Best is trial 1997 with value: 0.359156695282073.
[I 2024-12-04 20:55:12,489] Trial 2358 finished with value: 0.3592112435533644 and parameters: {'kernel_type': 'Matern', 'length_scale': 1627.0752204940413, 'noise_level': 0.0012266189656975793, 'constant_value': 37226.47042470372, 'nu': 0.5}. Best is trial 1997 with value: 0.359156695282073.
[I 2024-12-04 20:55:13,975] Trial 2360 finished with value: 0.35921124022047907 and parameters: {'kernel_type': 'Matern', 'length_scale': 8.197091515566273, 'noise_level': 0.0005402875707698028, 'constant_value': 14790.163355852583, 'nu': 0.5}. Best is trial 1997 with value: 0.359156695282073.
[I 2024-12-04 20:55:15,851] Trial 2359 finished with value: 0.3592114485198328 and parameters: {'kernel_type': 'Matern', 'length_scale': 2646.2747739958827, 'noise_level': 0.010019586713585315, 'constant_value': 68941.96131038028, 'nu': 0.5}. Best is trial 1997 with value: 0.359156695282073.
[I 2024-12-04 20:55:15,930] Trial 2361 finished with value: 1.0916567048549892 and parameters: {'kernel_type': 'Matern', 'length_scale': 30782.46246193448, 'noise_level': 1.3367687800965202e-05, 'constant_value': 23383.853765579126, 'nu': 0.5}. Best is trial 1997 with value: 0.359156695282073.
[I 2024-12-04 20:55:18,939] Trial 2362 finished with value: 0.35920870525133514 and parameters: {'kernel_type': 'Matern', 'length_scale': 93.38658573101924, 'noise_level': 0.0002967676118296589, 'constant_value': 8575.212508712872, 'nu': 0.5}. Best is trial 1997 with value: 0.359156695282073.
[I 2024-12-04 20:55:21,626] Trial 2364 finished with value: 0.35920994236127807 and parameters: {'kernel_type': 'Matern', 'length_scale': 688.425277691969, 'noise_level': 0.00018497101713370507, 'constant_value': 87890.74817925072, 'nu': 0.5}. Best is trial 1997 with value: 0.359156695282073.
[I 2024-12-04 20:55:22,382] Trial 2363 finished with value: 1.0624161172684001 and parameters: {'kernel_type': 'RBF', 'length_scale': 321.15119764592754, 'noise_level': 0.001065925248610757, 'constant_value': 40748.94779622537, 'nu': 0.5}. Best is trial 1997 with value: 0.359156695282073.
[I 2024-12-04 20:55:24,972] Trial 2365 finished with value: 0.3592112182070471 and parameters: {'kernel_type': 'Matern', 'length_scale': 4842.3038661256805, 'noise_level': 0.0006032835078703887, 'constant_value': 9809.239333500549, 'nu': 0.5}. Best is trial 1997 with value: 0.359156695282073.
[I 2024-12-04 20:55:25,869] Trial 2367 finished with value: 1.0916566970959545 and parameters: {'kernel_type': 'Matern', 'length_scale': 32.26968031275101, 'noise_level': 6.074339960615584e-05, 'constant_value': 93479.0720652835, 'nu': 0.5}. Best is trial 1997 with value: 0.359156695282073.
[I 2024-12-04 20:55:27,328] Trial 2366 finished with value: 1.0624161171635071 and parameters: {'kernel_type': 'Matern', 'length_scale': 497.74484395041446, 'noise_level': 3.606624329600357e-06, 'constant_value': 38.97472919029972, 'nu': 0.5}. Best is trial 1997 with value: 0.359156695282073.
[I 2024-12-04 20:55:30,677] Trial 2370 finished with value: 1.0916564014509622 and parameters: {'kernel_type': 'Matern', 'length_scale': 4.471612740980445, 'noise_level': 5.290869039789428e-06, 'constant_value': 2771.5350815991674, 'nu': 0.5}. Best is trial 1997 with value: 0.359156695282073.
[I 2024-12-04 20:55:30,773] Trial 2368 finished with value: 0.35921124143884026 and parameters: {'kernel_type': 'Matern', 'length_scale': 1991.4252598375856, 'noise_level': 0.0041586135657497615, 'constant_value': 52686.61738906712, 'nu': 0.5}. Best is trial 1997 with value: 0.359156695282073.
[I 2024-12-04 20:55:31,903] Trial 2369 finished with value: 0.3592112375395238 and parameters: {'kernel_type': 'Matern', 'length_scale': 3925.9023122267577, 'noise_level': 0.0002354664422930332, 'constant_value': 9324.362395483166, 'nu': 0.5}. Best is trial 1997 with value: 0.359156695282073.
[I 2024-12-04 20:55:35,498] Trial 2373 finished with value: 1.0916566700950086 and parameters: {'kernel_type': 'Matern', 'length_scale': 360.2870679912224, 'noise_level': 2.136154594842175e-05, 'constant_value': 6417.797091646922, 'nu': 0.5}. Best is trial 1997 with value: 0.359156695282073.
[I 2024-12-04 20:55:35,499] Trial 2371 finished with value: 0.35921142890948965 and parameters: {'kernel_type': 'Matern', 'length_scale': 213.99270456986005, 'noise_level': 0.002816808572121256, 'constant_value': 58594.47844953704, 'nu': 0.5}. Best is trial 1997 with value: 0.359156695282073.
[I 2024-12-04 20:55:36,721] Trial 2372 finished with value: 0.3592112602968993 and parameters: {'kernel_type': 'Matern', 'length_scale': 620.7218791393988, 'noise_level': 0.00031084998534191123, 'constant_value': 29079.50528480028, 'nu': 0.5}. Best is trial 1997 with value: 0.359156695282073.
[I 2024-12-04 20:55:40,333] Trial 2376 finished with value: 1.0916566639340672 and parameters: {'kernel_type': 'Matern', 'length_scale': 1921.36860127845, 'noise_level': 7.986818482484943e-06, 'constant_value': 608.2275946062995, 'nu': 0.5}. Best is trial 1997 with value: 0.359156695282073.
[I 2024-12-04 20:55:40,556] Trial 2374 finished with value: 0.3592112433124218 and parameters: {'kernel_type': 'Matern', 'length_scale': 173.21776881145487, 'noise_level': 0.0012430904249763279, 'constant_value': 98910.75403264636, 'nu': 0.5}. Best is trial 1997 with value: 0.359156695282073.
[I 2024-12-04 20:55:43,850] Trial 2377 finished with value: 1.0916566830787398 and parameters: {'kernel_type': 'Matern', 'length_scale': 2132.0939782071887, 'noise_level': 8.669624959996981e-06, 'constant_value': 66464.84177768728, 'nu': 0.5}. Best is trial 1997 with value: 0.359156695282073.
[I 2024-12-04 20:55:45,927] Trial 2378 finished with value: 0.35921123805867927 and parameters: {'kernel_type': 'Matern', 'length_scale': 167.0405338163282, 'noise_level': 0.001378009171327275, 'constant_value': 23152.47121396736, 'nu': 0.5}. Best is trial 1997 with value: 0.359156695282073.
[I 2024-12-04 20:55:47,826] Trial 2379 finished with value: 1.0916565911798668 and parameters: {'kernel_type': 'Matern', 'length_scale': 52.01092665654111, 'noise_level': 2.1983165087423227e-06, 'constant_value': 9040.872131066924, 'nu': 0.5}. Best is trial 1997 with value: 0.359156695282073.
[I 2024-12-04 20:55:48,816] Trial 2375 finished with value: 1.0624161172644877 and parameters: {'kernel_type': 'Matern', 'length_scale': 39161.806347096106, 'noise_level': 1.8493808717325712e-08, 'constant_value': 1.1567099461784094e-07, 'nu': 2.5}. Best is trial 1997 with value: 0.359156695282073.
[I 2024-12-04 20:55:50,052] Trial 2380 finished with value: 1.0916558493873283 and parameters: {'kernel_type': 'Matern', 'length_scale': 0.03123522378625669, 'noise_level': 4.0177353132375275e-05, 'constant_value': 1295.1787771812653, 'nu': 0.5}. Best is trial 1997 with value: 0.359156695282073.
[I 2024-12-04 20:55:54,759] Trial 2382 finished with value: 0.3592111617441621 and parameters: {'kernel_type': 'Matern', 'length_scale': 28.67712455832926, 'noise_level': 6.062410984509861e-05, 'constant_value': 2267.718315906316, 'nu': 0.5}. Best is trial 1997 with value: 0.359156695282073.
[I 2024-12-04 20:55:55,324] Trial 2381 finished with value: 1.0624161172525075 and parameters: {'kernel_type': 'Matern', 'length_scale': 184.3067725065701, 'noise_level': 0.00026569400924440897, 'constant_value': 769.1647561348541, 'nu': 2.5}. Best is trial 1997 with value: 0.359156695282073.
[I 2024-12-04 20:55:55,638] Trial 2383 finished with value: 0.3592111601225616 and parameters: {'kernel_type': 'Matern', 'length_scale': 195.04410166634264, 'noise_level': 0.00030986557142369806, 'constant_value': 14347.28387459048, 'nu': 0.5}. Best is trial 1997 with value: 0.359156695282073.
[I 2024-12-04 20:55:58,152] Trial 2386 finished with value: 1.091656692634957 and parameters: {'kernel_type': 'Matern', 'length_scale': 55.50971735247348, 'noise_level': 5.498032016694917e-05, 'constant_value': 18852.530344574643, 'nu': 0.5}. Best is trial 1997 with value: 0.359156695282073.
[I 2024-12-04 20:55:58,157] Trial 2385 finished with value: 1.0916567265037453 and parameters: {'kernel_type': 'RBF', 'length_scale': 2.4017677780218114, 'noise_level': 9.271948569964025e-10, 'constant_value': 13.524651546989498, 'nu': 2.5}. Best is trial 1997 with value: 0.359156695282073.
[I 2024-12-04 20:55:58,648] Trial 2384 finished with value: 1.091656664164468 and parameters: {'kernel_type': 'Matern', 'length_scale': 385.1130708574219, 'noise_level': 1.8756426856024463e-05, 'constant_value': 3895.60910461119, 'nu': 0.5}. Best is trial 1997 with value: 0.359156695282073.
[I 2024-12-04 20:56:03,905] Trial 2389 finished with value: 0.3592112123261 and parameters: {'kernel_type': 'Matern', 'length_scale': 12.696498542840528, 'noise_level': 0.00015762883031859574, 'constant_value': 98287.36026005645, 'nu': 0.5}. Best is trial 1997 with value: 0.359156695282073.
[I 2024-12-04 20:56:04,658] Trial 2388 finished with value: 0.35921123989517817 and parameters: {'kernel_type': 'Matern', 'length_scale': 17218.513903258583, 'noise_level': 0.0009246284186875343, 'constant_value': 4683.353736547551, 'nu': 0.5}. Best is trial 1997 with value: 0.359156695282073.
[I 2024-12-04 20:56:05,865] Trial 2387 finished with value: 1.062416117269883 and parameters: {'kernel_type': 'RBF', 'length_scale': 9739.70879581038, 'noise_level': 2.580204959762988e-10, 'constant_value': 28.83899560184494, 'nu': 1.5}. Best is trial 1997 with value: 0.359156695282073.
[I 2024-12-04 20:56:10,106] Trial 2391 finished with value: 0.3592112385383991 and parameters: {'kernel_type': 'Matern', 'length_scale': 961.6917148344255, 'noise_level': 0.0004238311347796415, 'constant_value': 12009.978458302448, 'nu': 0.5}. Best is trial 1997 with value: 0.359156695282073.
[I 2024-12-04 20:56:10,111] Trial 2390 finished with value: 0.35921123907026037 and parameters: {'kernel_type': 'Matern', 'length_scale': 699.71063469697, 'noise_level': 0.0005637005909885075, 'constant_value': 4439.174186186859, 'nu': 0.5}. Best is trial 1997 with value: 0.359156695282073.
[I 2024-12-04 20:56:11,287] Trial 2392 finished with value: 0.3592110318613742 and parameters: {'kernel_type': 'Matern', 'length_scale': 47.38663644603766, 'noise_level': 0.00019609978664796783, 'constant_value': 49039.31431081301, 'nu': 0.5}. Best is trial 1997 with value: 0.359156695282073.
[I 2024-12-04 20:56:13,439] Trial 2393 finished with value: 1.0916566935026022 and parameters: {'kernel_type': 'Matern', 'length_scale': 5569.467563518191, 'noise_level': 1.152750010088326e-05, 'constant_value': 31624.531066268017, 'nu': 0.5}. Best is trial 1997 with value: 0.359156695282073.
[I 2024-12-04 20:56:14,779] Trial 2395 finished with value: 1.0916566719375014 and parameters: {'kernel_type': 'Matern', 'length_scale': 523.8203323086673, 'noise_level': 1.3678351789350588e-05, 'constant_value': 87889.90250632446, 'nu': 0.5}. Best is trial 1997 with value: 0.359156695282073.
[I 2024-12-04 20:56:16,601] Trial 2394 finished with value: 1.0624161172414295 and parameters: {'kernel_type': 'Matern', 'length_scale': 69.33680267543835, 'noise_level': 3.1319604781181434e-08, 'constant_value': 39.623263005256796, 'nu': 2.5}. Best is trial 1997 with value: 0.359156695282073.
[I 2024-12-04 20:56:20,009] Trial 2396 finished with value: 0.3592112007490133 and parameters: {'kernel_type': 'Matern', 'length_scale': 342.95057895923827, 'noise_level': 0.013031134843879737, 'constant_value': 79778.57173904819, 'nu': 0.5}. Best is trial 1997 with value: 0.359156695282073.
[I 2024-12-04 20:56:20,016] Trial 2397 finished with value: 0.3592111410551884 and parameters: {'kernel_type': 'Matern', 'length_scale': 0.5872601283544205, 'noise_level': 0.00016583883877305532, 'constant_value': 21898.306327926188, 'nu': 0.5}. Best is trial 1997 with value: 0.359156695282073.
[I 2024-12-04 20:56:22,517] Trial 2398 finished with value: 0.3592180786428932 and parameters: {'kernel_type': 'Matern', 'length_scale': 3020.610977847704, 'noise_level': 0.0007009347227261543, 'constant_value': 74473.70673678782, 'nu': 0.5}. Best is trial 1997 with value: 0.359156695282073.
[I 2024-12-04 20:56:25,868] Trial 2399 finished with value: 0.359208847947621 and parameters: {'kernel_type': 'Matern', 'length_scale': 2975.1861479752733, 'noise_level': 9.069057084064019e-05, 'constant_value': 83688.19415901514, 'nu': 0.5}. Best is trial 1997 with value: 0.359156695282073.
[I 2024-12-04 20:56:25,873] Trial 2400 finished with value: 0.3592112735500111 and parameters: {'kernel_type': 'Matern', 'length_scale': 93.46869035193706, 'noise_level': 0.0006197373075986261, 'constant_value': 78421.18341407638, 'nu': 0.5}. Best is trial 1997 with value: 0.359156695282073.
[I 2024-12-04 20:56:27,625] Trial 2401 finished with value: 0.3592103698969288 and parameters: {'kernel_type': 'Matern', 'length_scale': 127.2783936765188, 'noise_level': 0.0012115906499020296, 'constant_value': 69039.64721392628, 'nu': 0.5}. Best is trial 1997 with value: 0.359156695282073.
[I 2024-12-04 20:56:29,366] Trial 2402 finished with value: 1.0916567282546075 and parameters: {'kernel_type': 'Matern', 'length_scale': 15.166277296546234, 'noise_level': 1.0596429951776931e-05, 'constant_value': 1286.0186621254363, 'nu': 1.5}. Best is trial 1997 with value: 0.359156695282073.
[I 2024-12-04 20:56:33,534] Trial 2403 finished with value: 1.0624161172757052 and parameters: {'kernel_type': 'Matern', 'length_scale': 78359.93896726996, 'noise_level': 1.9391066612745104e-06, 'constant_value': 2660.4667944326497, 'nu': 0.5}. Best is trial 1997 with value: 0.359156695282073.
[I 2024-12-04 20:56:34,318] Trial 2404 finished with value: 0.3592095847741431 and parameters: {'kernel_type': 'Matern', 'length_scale': 15200.51304015535, 'noise_level': 0.0001839608661326675, 'constant_value': 11362.129622258988, 'nu': 0.5}. Best is trial 1997 with value: 0.359156695282073.
[I 2024-12-04 20:56:36,192] Trial 2405 finished with value: 0.3592112399565588 and parameters: {'kernel_type': 'Matern', 'length_scale': 3594.6883552804384, 'noise_level': 0.001127253957619568, 'constant_value': 54557.92577594511, 'nu': 0.5}. Best is trial 1997 with value: 0.359156695282073.
[I 2024-12-04 20:56:39,489] Trial 2406 finished with value: 1.0624161171088915 and parameters: {'kernel_type': 'Matern', 'length_scale': 12316.186475978326, 'noise_level': 0.0002866306851553114, 'constant_value': 3617.2026577048755, 'nu': 1.5}. Best is trial 1997 with value: 0.359156695282073.
[I 2024-12-04 20:56:41,137] Trial 2407 finished with value: 1.0624161172229367 and parameters: {'kernel_type': 'RBF', 'length_scale': 702.7751735602802, 'noise_level': 4.270150632756863e-05, 'constant_value': 932.9127174456439, 'nu': 0.5}. Best is trial 1997 with value: 0.359156695282073.
[I 2024-12-04 20:56:41,929] Trial 2408 finished with value: 0.35920984205621564 and parameters: {'kernel_type': 'Matern', 'length_scale': 257.1986634741396, 'noise_level': 5.198366204495602e-05, 'constant_value': 10217.176502371125, 'nu': 0.5}. Best is trial 1997 with value: 0.359156695282073.
[I 2024-12-04 20:56:45,694] Trial 2409 finished with value: 0.359211369025928 and parameters: {'kernel_type': 'Matern', 'length_scale': 39756.55881266202, 'noise_level': 0.001381605618982708, 'constant_value': 25696.309662536663, 'nu': 0.5}. Best is trial 1997 with value: 0.359156695282073.
[I 2024-12-04 20:56:47,291] Trial 2410 finished with value: 0.35921104164749296 and parameters: {'kernel_type': 'Matern', 'length_scale': 2579.4043101501566, 'noise_level': 0.00015282350217165754, 'constant_value': 17187.198713078764, 'nu': 0.5}. Best is trial 1997 with value: 0.359156695282073.
