[I 2024-12-04 20:00:23,728] Trial 481 finished with value: 0.14249505898564666 and parameters: {'kernel_type': 'Matern', 'length_scale': 7.172129678878797, 'noise_level': 0.02215043286478063, 'constant_value': 83904.70598517865, 'nu': 1.5}. Best is trial 254 with value: 0.13754915492432768.
[I 2024-12-04 20:00:24,614] Trial 480 finished with value: 0.1424951682377176 and parameters: {'kernel_type': 'Matern', 'length_scale': 0.6457583403987057, 'noise_level': 0.003911694949800979, 'constant_value': 1.6791588228617693, 'nu': 1.5}. Best is trial 254 with value: 0.13754915492432768.
[I 2024-12-04 20:00:29,602] Trial 484 finished with value: 0.14771044587851975 and parameters: {'kernel_type': 'RBF', 'length_scale': 88.87358200434701, 'noise_level': 0.6891010845286175, 'constant_value': 24362.519161174445, 'nu': 1.5}. Best is trial 254 with value: 0.13754915492432768.
[I 2024-12-04 20:00:31,508] Trial 485 finished with value: 0.1424950633273372 and parameters: {'kernel_type': 'Matern', 'length_scale': 243.54752012993356, 'noise_level': 0.01325850007008007, 'constant_value': 324.4432823338648, 'nu': 1.5}. Best is trial 254 with value: 0.13754915492432768.
[I 2024-12-04 20:00:34,614] Trial 483 finished with value: 0.9864686819118943 and parameters: {'kernel_type': 'RBF', 'length_scale': 15.255539604134203, 'noise_level': 7.743741445468515e-05, 'constant_value': 1.23923224518695e-07, 'nu': 1.5}. Best is trial 254 with value: 0.13754915492432768.
[I 2024-12-04 20:00:37,656] Trial 486 finished with value: 0.9864686819066847 and parameters: {'kernel_type': 'RBF', 'length_scale': 15.037858588372853, 'noise_level': 5.486381137464822e-08, 'constant_value': 0.6257750770136611, 'nu': 0.5}. Best is trial 254 with value: 0.13754915492432768.
[I 2024-12-04 20:00:41,559] Trial 488 finished with value: 0.19720003440833161 and parameters: {'kernel_type': 'Matern', 'length_scale': 0.7992429169657009, 'noise_level': 0.8186358387641202, 'constant_value': 840.8030285516826, 'nu': 0.5}. Best is trial 254 with value: 0.13754915492432768.
[I 2024-12-04 20:00:42,959] Trial 487 finished with value: 0.1424950651120811 and parameters: {'kernel_type': 'Matern', 'length_scale': 43.75565554899106, 'noise_level': 0.01591608684027611, 'constant_value': 0.8645363983862421, 'nu': 1.5}. Best is trial 254 with value: 0.13754915492432768.
[I 2024-12-04 20:00:43,464] Trial 489 finished with value: 0.1424950653644327 and parameters: {'kernel_type': 'Matern', 'length_scale': 77.72423768564127, 'noise_level': 0.04011758687789968, 'constant_value': 543.851324489945, 'nu': 1.5}. Best is trial 254 with value: 0.13754915492432768.
[I 2024-12-04 20:00:48,255] Trial 490 finished with value: 0.14249514713045283 and parameters: {'kernel_type': 'Matern', 'length_scale': 21.083625156337867, 'noise_level': 0.022726049526630498, 'constant_value': 1373.8271265146743, 'nu': 1.5}. Best is trial 254 with value: 0.13754915492432768.
[I 2024-12-04 20:00:51,282] Trial 491 finished with value: 0.14249503606391314 and parameters: {'kernel_type': 'Matern', 'length_scale': 52.52190814132475, 'noise_level': 0.7498552050277013, 'constant_value': 118.49254485162052, 'nu': 1.5}. Best is trial 254 with value: 0.13754915492432768.
[I 2024-12-04 20:00:52,161] Trial 492 finished with value: 0.142495062246641 and parameters: {'kernel_type': 'Matern', 'length_scale': 0.31707993452769073, 'noise_level': 0.38892780429720847, 'constant_value': 2.325012298172081, 'nu': 1.5}. Best is trial 254 with value: 0.13754915492432768.
[I 2024-12-04 20:00:54,558] Trial 493 finished with value: 0.14249483874631735 and parameters: {'kernel_type': 'Matern', 'length_scale': 13.544113203735044, 'noise_level': 0.08210194722535401, 'constant_value': 90329.49166107447, 'nu': 1.5}. Best is trial 254 with value: 0.13754915492432768.
[I 2024-12-04 20:00:57,469] Trial 495 finished with value: 0.14469882000246037 and parameters: {'kernel_type': 'Matern', 'length_scale': 110.51352886561482, 'noise_level': 0.03445662578614935, 'constant_value': 484.73304794612113, 'nu': 2.5}. Best is trial 254 with value: 0.13754915492432768.
[I 2024-12-04 20:01:01,108] Trial 494 finished with value: 0.9864686819227246 and parameters: {'kernel_type': 'Matern', 'length_scale': 79856.95097514252, 'noise_level': 0.007538728662209265, 'constant_value': 127.38143594493471, 'nu': 1.5}. Best is trial 254 with value: 0.13754915492432768.
[I 2024-12-04 20:01:02,297] Trial 496 finished with value: 0.1424951184985389 and parameters: {'kernel_type': 'Matern', 'length_scale': 0.7106611203575043, 'noise_level': 0.012037414670481828, 'constant_value': 32.638683962682435, 'nu': 1.5}. Best is trial 254 with value: 0.13754915492432768.
[I 2024-12-04 20:01:07,196] Trial 498 finished with value: 0.14249507542349094 and parameters: {'kernel_type': 'Matern', 'length_scale': 236.86114049228823, 'noise_level': 0.7488181358816164, 'constant_value': 10867.163423544347, 'nu': 1.5}. Best is trial 254 with value: 0.13754915492432768.
[I 2024-12-04 20:01:07,699] Trial 499 finished with value: 0.9982166473110062 and parameters: {'kernel_type': 'Matern', 'length_scale': 0.0007110102589742133, 'noise_level': 0.06568487043804319, 'constant_value': 9.629559686898714e-07, 'nu': 2.5}. Best is trial 254 with value: 0.13754915492432768.
[I 2024-12-04 20:01:11,005] Trial 497 finished with value: 0.13781180213664246 and parameters: {'kernel_type': 'Matern', 'length_scale': 0.18108960685990985, 'noise_level': 0.41328320294718873, 'constant_value': 608.2487815081857, 'nu': 1.5}. Best is trial 254 with value: 0.13754915492432768.
[I 2024-12-04 20:01:14,719] Trial 500 finished with value: 0.14249512563720887 and parameters: {'kernel_type': 'Matern', 'length_scale': 9.586087817507643, 'noise_level': 0.9651162617257846, 'constant_value': 1354.9252339171437, 'nu': 1.5}. Best is trial 254 with value: 0.13754915492432768.
[I 2024-12-04 20:01:17,914] Trial 502 finished with value: 0.14249506308642118 and parameters: {'kernel_type': 'Matern', 'length_scale': 0.37651221870724677, 'noise_level': 0.16184576125910688, 'constant_value': 43.40831252085453, 'nu': 1.5}. Best is trial 254 with value: 0.13754915492432768.
[I 2024-12-04 20:01:17,956] Trial 501 finished with value: 0.14249506048967162 and parameters: {'kernel_type': 'Matern', 'length_scale': 26818.99046900183, 'noise_level': 0.711790390996155, 'constant_value': 61.22943963165426, 'nu': 1.5}. Best is trial 254 with value: 0.13754915492432768.
[I 2024-12-04 20:01:19,242] Trial 503 finished with value: 0.9864669091887899 and parameters: {'kernel_type': 'Matern', 'length_scale': 0.11327834862112048, 'noise_level': 0.33027048949237214, 'constant_value': 816.6320692858822, 'nu': 1.5}. Best is trial 254 with value: 0.13754915492432768.
[I 2024-12-04 20:01:25,089] Trial 505 finished with value: 0.9864686819508285 and parameters: {'kernel_type': 'RBF', 'length_scale': 3618.8702826471085, 'noise_level': 8.77598111494271e-06, 'constant_value': 438.6962910763879, 'nu': 1.5}. Best is trial 254 with value: 0.13754915492432768.
[I 2024-12-04 20:01:28,648] Trial 506 finished with value: 0.1424949625445605 and parameters: {'kernel_type': 'Matern', 'length_scale': 9.741677357928747, 'noise_level': 0.5568903876020697, 'constant_value': 302.0423399426421, 'nu': 1.5}. Best is trial 254 with value: 0.13754915492432768.
[I 2024-12-04 20:01:29,676] Trial 504 finished with value: 0.14249508567648744 and parameters: {'kernel_type': 'Matern', 'length_scale': 0.12272206165228879, 'noise_level': 0.7743862445079304, 'constant_value': 310.28239616543414, 'nu': 1.5}. Best is trial 254 with value: 0.13754915492432768.
[I 2024-12-04 20:01:33,034] Trial 508 finished with value: 0.9864686819218003 and parameters: {'kernel_type': 'Matern', 'length_scale': 0.0035564091706105057, 'noise_level': 0.06243454932640154, 'constant_value': 0.8080883200245257, 'nu': 1.5}. Best is trial 254 with value: 0.13754915492432768.
[I 2024-12-04 20:01:38,896] Trial 507 finished with value: 0.9864686819521453 and parameters: {'kernel_type': 'Matern', 'length_scale': 0.00021930601590052716, 'noise_level': 0.010859771543286146, 'constant_value': 0.00037792771845991376, 'nu': 0.5}. Best is trial 254 with value: 0.13754915492432768.
[I 2024-12-04 20:01:41,428] Trial 510 finished with value: 0.9864686819230483 and parameters: {'kernel_type': 'Matern', 'length_scale': 0.024445618708843174, 'noise_level': 0.09148065808111831, 'constant_value': 5169.868746365146, 'nu': 1.5}. Best is trial 254 with value: 0.13754915492432768.
[I 2024-12-04 20:01:42,497] Trial 509 finished with value: 0.14249505878549942 and parameters: {'kernel_type': 'Matern', 'length_scale': 0.6670102092739905, 'noise_level': 0.7402051427604465, 'constant_value': 1126.9316616189951, 'nu': 1.5}. Best is trial 254 with value: 0.13754915492432768.
[I 2024-12-04 20:01:46,026] Trial 511 finished with value: 0.14249524801977215 and parameters: {'kernel_type': 'Matern', 'length_scale': 5.503220837334181, 'noise_level': 0.4742382192415165, 'constant_value': 44096.73104036864, 'nu': 1.5}. Best is trial 254 with value: 0.13754915492432768.
[I 2024-12-04 20:01:51,398] Trial 512 finished with value: 0.1424950643520921 and parameters: {'kernel_type': 'Matern', 'length_scale': 312.785691171031, 'noise_level': 0.1665949154484737, 'constant_value': 0.6655296839324315, 'nu': 1.5}. Best is trial 254 with value: 0.13754915492432768.
[I 2024-12-04 20:01:52,151] Trial 514 finished with value: 0.19720001068508394 and parameters: {'kernel_type': 'Matern', 'length_scale': 96.05656846028192, 'noise_level': 0.12408132643826857, 'constant_value': 62.42940949452852, 'nu': 0.5}. Best is trial 254 with value: 0.13754915492432768.
[I 2024-12-04 20:01:53,640] Trial 513 finished with value: 0.14249507408749681 and parameters: {'kernel_type': 'Matern', 'length_scale': 17.741146870050535, 'noise_level': 0.9471885205824615, 'constant_value': 27.802466123478723, 'nu': 1.5}. Best is trial 254 with value: 0.13754915492432768.
[I 2024-12-04 20:01:56,281] Trial 515 finished with value: 0.14249509481645048 and parameters: {'kernel_type': 'Matern', 'length_scale': 13846.415167636424, 'noise_level': 0.06823262550068755, 'constant_value': 51581.80240538745, 'nu': 1.5}. Best is trial 254 with value: 0.13754915492432768.
[I 2024-12-04 20:01:58,514] Trial 517 finished with value: 0.98646868191422 and parameters: {'kernel_type': 'Matern', 'length_scale': 0.0009113213215761387, 'noise_level': 0.6636086616913619, 'constant_value': 2002.2027607636621, 'nu': 1.5}. Best is trial 254 with value: 0.13754915492432768.
[I 2024-12-04 20:01:59,174] Trial 516 finished with value: 0.14249477838303176 and parameters: {'kernel_type': 'Matern', 'length_scale': 175.7918014401451, 'noise_level': 0.005744493300388814, 'constant_value': 4993.946274587922, 'nu': 1.5}. Best is trial 254 with value: 0.13754915492432768.
[I 2024-12-04 20:02:05,747] Trial 518 finished with value: 0.14249518584841245 and parameters: {'kernel_type': 'Matern', 'length_scale': 341.0890592010974, 'noise_level': 0.6878600938091699, 'constant_value': 3512.8967349077316, 'nu': 1.5}. Best is trial 254 with value: 0.13754915492432768.
[I 2024-12-04 20:02:06,505] Trial 519 finished with value: 0.9864686819854354 and parameters: {'kernel_type': 'Matern', 'length_scale': 0.02468277312782472, 'noise_level': 1.3068232695177641e-08, 'constant_value': 0.08669848795018965, 'nu': 0.5}. Best is trial 254 with value: 0.13754915492432768.
[I 2024-12-04 20:02:10,900] Trial 520 finished with value: 0.9864686819279931 and parameters: {'kernel_type': 'Matern', 'length_scale': 2054.4158596057323, 'noise_level': 0.002194383581724857, 'constant_value': 33.602021158868254, 'nu': 1.5}. Best is trial 254 with value: 0.13754915492432768.
[I 2024-12-04 20:02:11,925] Trial 521 finished with value: 0.14249513288495222 and parameters: {'kernel_type': 'Matern', 'length_scale': 250.85029727807012, 'noise_level': 0.008599320890129237, 'constant_value': 1360.9070868148078, 'nu': 1.5}. Best is trial 254 with value: 0.13754915492432768.
[I 2024-12-04 20:02:11,964] Trial 522 finished with value: 0.9864686819312722 and parameters: {'kernel_type': 'Matern', 'length_scale': 2375.006706658006, 'noise_level': 0.0015305491474181042, 'constant_value': 22610.668230024046, 'nu': 1.5}. Best is trial 254 with value: 0.13754915492432768.
[I 2024-12-04 20:02:18,913] Trial 525 finished with value: 0.1972000081689744 and parameters: {'kernel_type': 'Matern', 'length_scale': 114.10361122580102, 'noise_level': 0.3892254497044585, 'constant_value': 0.009628261292798267, 'nu': 0.5}. Best is trial 254 with value: 0.13754915492432768.
[I 2024-12-04 20:02:20,203] Trial 523 finished with value: 0.14249504049738843 and parameters: {'kernel_type': 'Matern', 'length_scale': 4.726137801032963, 'noise_level': 0.03908632529940517, 'constant_value': 0.024612084715488848, 'nu': 1.5}. Best is trial 254 with value: 0.13754915492432768.
[I 2024-12-04 20:02:22,014] Trial 524 finished with value: 0.1477103574351002 and parameters: {'kernel_type': 'RBF', 'length_scale': 0.32890994200484935, 'noise_level': 0.007411531333257734, 'constant_value': 205.83934451397351, 'nu': 1.5}. Best is trial 254 with value: 0.13754915492432768.
[I 2024-12-04 20:02:25,938] Trial 527 finished with value: 0.1424950919266967 and parameters: {'kernel_type': 'Matern', 'length_scale': 231.3513838239168, 'noise_level': 0.0027987554922079875, 'constant_value': 589.9948400061868, 'nu': 1.5}. Best is trial 254 with value: 0.13754915492432768.
[I 2024-12-04 20:02:26,430] Trial 526 finished with value: 0.9864686819797863 and parameters: {'kernel_type': 'Matern', 'length_scale': 98748.68920616496, 'noise_level': 5.10424373981024e-08, 'constant_value': 29355.21259033893, 'nu': 1.5}. Best is trial 254 with value: 0.13754915492432768.
[I 2024-12-04 20:02:28,998] Trial 528 finished with value: 0.14249522734467693 and parameters: {'kernel_type': 'Matern', 'length_scale': 1412.5767442081958, 'noise_level': 0.038629269385993155, 'constant_value': 71.59215016779417, 'nu': 1.5}. Best is trial 254 with value: 0.13754915492432768.
[I 2024-12-04 20:02:33,148] Trial 530 finished with value: 0.14249508261636068 and parameters: {'kernel_type': 'Matern', 'length_scale': 0.6553123939722351, 'noise_level': 0.8893359320637092, 'constant_value': 0.05753516322997398, 'nu': 1.5}. Best is trial 254 with value: 0.13754915492432768.
[I 2024-12-04 20:02:36,184] Trial 531 finished with value: 0.14469890021260376 and parameters: {'kernel_type': 'Matern', 'length_scale': 32.35665540550456, 'noise_level': 0.5160184549254803, 'constant_value': 0.09320038616418279, 'nu': 2.5}. Best is trial 254 with value: 0.13754915492432768.
[I 2024-12-04 20:02:36,230] Trial 529 finished with value: 0.9864686819365869 and parameters: {'kernel_type': 'RBF', 'length_scale': 6945.137597848505, 'noise_level': 1.546349721987176e-05, 'constant_value': 94533.28512037979, 'nu': 0.5}. Best is trial 254 with value: 0.13754915492432768.
[I 2024-12-04 20:02:43,606] Trial 532 finished with value: 0.14249545072472206 and parameters: {'kernel_type': 'Matern', 'length_scale': 1.7012865235268861, 'noise_level': 0.005765129769164947, 'constant_value': 91.46498827815618, 'nu': 1.5}. Best is trial 254 with value: 0.13754915492432768.
[I 2024-12-04 20:02:43,734] Trial 533 finished with value: 0.9864686819076514 and parameters: {'kernel_type': 'Matern', 'length_scale': 0.02590531114239554, 'noise_level': 0.00036156696865119643, 'constant_value': 0.10567090341078779, 'nu': 1.5}. Best is trial 254 with value: 0.13754915492432768.
[I 2024-12-04 20:02:47,233] Trial 534 finished with value: 0.1424950657405524 and parameters: {'kernel_type': 'Matern', 'length_scale': 41.89100706809, 'noise_level': 0.872789205516258, 'constant_value': 4.249213338028887, 'nu': 1.5}. Best is trial 254 with value: 0.13754915492432768.
[I 2024-12-04 20:02:49,292] Trial 535 finished with value: 0.14249500997919556 and parameters: {'kernel_type': 'Matern', 'length_scale': 265.06957479676095, 'noise_level': 0.011373685982821643, 'constant_value': 514.8120298246972, 'nu': 1.5}. Best is trial 254 with value: 0.13754915492432768.
[I 2024-12-04 20:02:52,405] Trial 536 finished with value: 0.1424950797606236 and parameters: {'kernel_type': 'Matern', 'length_scale': 1279.4770383156815, 'noise_level': 0.4381121465099568, 'constant_value': 4.893470981975981, 'nu': 1.5}. Best is trial 254 with value: 0.13754915492432768.
[I 2024-12-04 20:02:54,012] Trial 537 finished with value: 0.14249506342384274 and parameters: {'kernel_type': 'Matern', 'length_scale': 5.6722312660161895, 'noise_level': 0.03334901364557895, 'constant_value': 28.79544911087074, 'nu': 1.5}. Best is trial 254 with value: 0.13754915492432768.
[I 2024-12-04 20:02:58,534] Trial 538 finished with value: 0.14249504556871603 and parameters: {'kernel_type': 'Matern', 'length_scale': 0.3241645979285328, 'noise_level': 0.7936112195003319, 'constant_value': 71.94499288117481, 'nu': 1.5}. Best is trial 254 with value: 0.13754915492432768.
[I 2024-12-04 20:02:59,016] Trial 539 finished with value: 0.9864686821024161 and parameters: {'kernel_type': 'RBF', 'length_scale': 8.170231287019659, 'noise_level': 2.3927233752399327e-10, 'constant_value': 12.119203914429942, 'nu': 2.5}. Best is trial 254 with value: 0.13754915492432768.
[I 2024-12-04 20:03:02,332] Trial 540 finished with value: 0.14249502234423542 and parameters: {'kernel_type': 'Matern', 'length_scale': 84.39646391104294, 'noise_level': 0.953414425700792, 'constant_value': 379.0677809508182, 'nu': 1.5}. Best is trial 254 with value: 0.13754915492432768.
[I 2024-12-04 20:03:05,426] Trial 541 finished with value: 0.14249547819401465 and parameters: {'kernel_type': 'Matern', 'length_scale': 6.987852417576825, 'noise_level': 0.013364055944339799, 'constant_value': 0.34924534481726244, 'nu': 1.5}. Best is trial 254 with value: 0.13754915492432768.
[I 2024-12-04 20:03:06,582] Trial 542 finished with value: 0.14771032616904367 and parameters: {'kernel_type': 'RBF', 'length_scale': 1.8530788203756965, 'noise_level': 3.241729474600281e-05, 'constant_value': 752.2739043388243, 'nu': 0.5}. Best is trial 254 with value: 0.13754915492432768.
[I 2024-12-04 20:03:08,988] Trial 543 finished with value: 0.14249500877178553 and parameters: {'kernel_type': 'Matern', 'length_scale': 292.3796414196537, 'noise_level': 0.0046851348043858865, 'constant_value': 18437.278694587407, 'nu': 1.5}. Best is trial 254 with value: 0.13754915492432768.
[I 2024-12-04 20:03:11,943] Trial 545 finished with value: 0.14249506416447066 and parameters: {'kernel_type': 'Matern', 'length_scale': 30.346144679588715, 'noise_level': 0.4678341790626649, 'constant_value': 95384.07534531181, 'nu': 1.5}. Best is trial 254 with value: 0.13754915492432768.
[I 2024-12-04 20:03:12,422] Trial 544 finished with value: 0.14249506025423084 and parameters: {'kernel_type': 'Matern', 'length_scale': 27.600553767738386, 'noise_level': 0.9432958525117631, 'constant_value': 1832.7388078987406, 'nu': 1.5}. Best is trial 254 with value: 0.13754915492432768.
[I 2024-12-04 20:03:16,283] Trial 548 finished with value: 0.9864686501745831 and parameters: {'kernel_type': 'Matern', 'length_scale': 0.08876151079318172, 'noise_level': 0.006924926190133231, 'constant_value': 9.973376529437518, 'nu': 1.5}. Best is trial 254 with value: 0.13754915492432768.
[I 2024-12-04 20:03:20,575] Trial 547 finished with value: 0.9864686819369773 and parameters: {'kernel_type': 'Matern', 'length_scale': 314.11967731610315, 'noise_level': 0.01246417768525903, 'constant_value': 0.2076036050542651, 'nu': 1.5}. Best is trial 254 with value: 0.13754915492432768.
[I 2024-12-04 20:03:21,670] Trial 546 finished with value: 0.9864686819539844 and parameters: {'kernel_type': 'Matern', 'length_scale': 105.09459201737562, 'noise_level': 0.017477741853751297, 'constant_value': 0.0006536531659126982, 'nu': 1.5}. Best is trial 254 with value: 0.13754915492432768.
[I 2024-12-04 20:03:24,118] Trial 549 finished with value: 0.14249506322966418 and parameters: {'kernel_type': 'Matern', 'length_scale': 13.580133016786448, 'noise_level': 0.022158445508948545, 'constant_value': 1.0255289971171258, 'nu': 1.5}. Best is trial 254 with value: 0.13754915492432768.
[I 2024-12-04 20:03:25,654] Trial 550 finished with value: 0.998217109479701 and parameters: {'kernel_type': 'Matern', 'length_scale': 52898.014749785245, 'noise_level': 0.0008644389200258005, 'constant_value': 4.546108719670221e-07, 'nu': 2.5}. Best is trial 254 with value: 0.13754915492432768.
[I 2024-12-04 20:03:28,542] Trial 551 finished with value: 0.19720003350590792 and parameters: {'kernel_type': 'Matern', 'length_scale': 17.095139604982013, 'noise_level': 0.001473996574051998, 'constant_value': 55008.266573584966, 'nu': 0.5}. Best is trial 254 with value: 0.13754915492432768.
[I 2024-12-04 20:03:29,254] Trial 552 finished with value: 0.9864686819158217 and parameters: {'kernel_type': 'RBF', 'length_scale': 3.494052440926461e-05, 'noise_level': 0.7917236097335613, 'constant_value': 11.127271821145255, 'nu': 0.5}. Best is trial 254 with value: 0.13754915492432768.
[I 2024-12-04 20:03:33,253] Trial 554 finished with value: 0.9864686310863717 and parameters: {'kernel_type': 'Matern', 'length_scale': 0.10564633075375654, 'noise_level': 0.44673916880831194, 'constant_value': 2343.181807458372, 'nu': 2.5}. Best is trial 254 with value: 0.13754915492432768.
[I 2024-12-04 20:03:36,097] Trial 555 finished with value: 0.1424950739356416 and parameters: {'kernel_type': 'Matern', 'length_scale': 4124.552700481121, 'noise_level': 0.9724333061432616, 'constant_value': 535.2205268208231, 'nu': 1.5}. Best is trial 254 with value: 0.13754915492432768.
[I 2024-12-04 20:03:37,595] Trial 553 finished with value: 0.14249505958357708 and parameters: {'kernel_type': 'Matern', 'length_scale': 63.0308550474519, 'noise_level': 0.7873636307114517, 'constant_value': 0.005947366260938297, 'nu': 1.5}. Best is trial 254 with value: 0.13754915492432768.
