[I 2024-12-04 13:20:47,906] Trial 1741 finished with value: 0.35254157820341764 and parameters: {'n_estimators': 847, 'learning_rate': 0.05202692389821024, 'max_depth': 7, 'min_samples_split': 4, 'min_samples_leaf': 3, 'subsample': 0.9308470171153169, 'max_features': 'sqrt'}. Best is trial 1389 with value: 0.22332552856343169.
[I 2024-12-04 13:20:53,940] Trial 1733 finished with value: 0.25609180625901745 and parameters: {'n_estimators': 1240, 'learning_rate': 0.09980565119207932, 'max_depth': 9, 'min_samples_split': 6, 'min_samples_leaf': 1, 'subsample': 0.8289813761738937, 'max_features': 'sqrt'}. Best is trial 1389 with value: 0.22332552856343169.
[I 2024-12-04 13:20:54,159] Trial 1748 finished with value: 0.5046056449002003 and parameters: {'n_estimators': 640, 'learning_rate': 0.052183812990470875, 'max_depth': 7, 'min_samples_split': 2, 'min_samples_leaf': 5, 'subsample': 0.9890290164651059, 'max_features': 'log2'}. Best is trial 1389 with value: 0.22332552856343169.
[I 2024-12-04 13:20:54,776] Trial 1758 finished with value: 0.4549582333150914 and parameters: {'n_estimators': 314, 'learning_rate': 0.01602162565923104, 'max_depth': 5, 'min_samples_split': 20, 'min_samples_leaf': 5, 'subsample': 0.9507504967160585, 'max_features': None}. Best is trial 1389 with value: 0.22332552856343169.
[I 2024-12-04 13:21:03,185] Trial 1736 finished with value: 0.5904094687697307 and parameters: {'n_estimators': 1241, 'learning_rate': 0.04669555342557331, 'max_depth': 10, 'min_samples_split': 4, 'min_samples_leaf': 9, 'subsample': 0.8691489769582674, 'max_features': 'log2'}. Best is trial 1389 with value: 0.22332552856343169.
[I 2024-12-04 13:21:06,718] Trial 1745 finished with value: 0.23591403918965861 and parameters: {'n_estimators': 995, 'learning_rate': 0.09948445194220808, 'max_depth': 7, 'min_samples_split': 5, 'min_samples_leaf': 1, 'subsample': 0.8687794670489783, 'max_features': 'sqrt'}. Best is trial 1389 with value: 0.22332552856343169.
[I 2024-12-04 13:21:09,572] Trial 1743 finished with value: 0.24556566645185832 and parameters: {'n_estimators': 1073, 'learning_rate': 0.08707671555488394, 'max_depth': 12, 'min_samples_split': 10, 'min_samples_leaf': 1, 'subsample': 0.6620229809720803, 'max_features': 'sqrt'}. Best is trial 1389 with value: 0.22332552856343169.
[I 2024-12-04 13:21:11,367] Trial 1738 finished with value: 0.3438770394288574 and parameters: {'n_estimators': 1262, 'learning_rate': 0.062095745372191126, 'max_depth': 9, 'min_samples_split': 4, 'min_samples_leaf': 3, 'subsample': 0.8782980783953898, 'max_features': 'sqrt'}. Best is trial 1389 with value: 0.22332552856343169.
[I 2024-12-04 13:21:11,417] Trial 1734 finished with value: 0.2504337076819825 and parameters: {'n_estimators': 1484, 'learning_rate': 0.03884575748951192, 'max_depth': 10, 'min_samples_split': 6, 'min_samples_leaf': 1, 'subsample': 0.6671919096301079, 'max_features': 'sqrt'}. Best is trial 1389 with value: 0.22332552856343169.
[I 2024-12-04 13:21:14,366] Trial 1755 finished with value: 0.3661304893626893 and parameters: {'n_estimators': 699, 'learning_rate': 0.09456341256816582, 'max_depth': 9, 'min_samples_split': 6, 'min_samples_leaf': 3, 'subsample': 0.7485649887578717, 'max_features': 'sqrt'}. Best is trial 1389 with value: 0.22332552856343169.
[I 2024-12-04 13:21:26,246] Trial 1742 finished with value: 0.295759991965879 and parameters: {'n_estimators': 1387, 'learning_rate': 0.09979835479925894, 'max_depth': 7, 'min_samples_split': 6, 'min_samples_leaf': 2, 'subsample': 0.8832884869292552, 'max_features': 'sqrt'}. Best is trial 1389 with value: 0.22332552856343169.
[I 2024-12-04 13:21:31,230] Trial 1747 finished with value: 0.48064579101674315 and parameters: {'n_estimators': 1197, 'learning_rate': 0.09743190184605413, 'max_depth': 9, 'min_samples_split': 18, 'min_samples_leaf': 10, 'subsample': 0.9386479565094663, 'max_features': None}. Best is trial 1389 with value: 0.22332552856343169.
[I 2024-12-04 13:21:33,872] Trial 1746 finished with value: 0.24628846279359415 and parameters: {'n_estimators': 1313, 'learning_rate': 0.09264375469432536, 'max_depth': 7, 'min_samples_split': 7, 'min_samples_leaf': 1, 'subsample': 0.8225493294854083, 'max_features': 'sqrt'}. Best is trial 1389 with value: 0.22332552856343169.
[I 2024-12-04 13:21:35,599] Trial 1744 finished with value: 0.9970556912905514 and parameters: {'n_estimators': 1453, 'learning_rate': 0.011607954298774079, 'max_depth': 9, 'min_samples_split': 3, 'min_samples_leaf': 10, 'subsample': 0.641119186656415, 'max_features': 'log2'}. Best is trial 1389 with value: 0.22332552856343169.
[I 2024-12-04 13:21:36,654] Trial 1757 finished with value: 0.5007854499322141 and parameters: {'n_estimators': 995, 'learning_rate': 0.09481393174289296, 'max_depth': 3, 'min_samples_split': 18, 'min_samples_leaf': 6, 'subsample': 0.6337653784422226, 'max_features': 'log2'}. Best is trial 1389 with value: 0.22332552856343169.
[I 2024-12-04 13:21:38,744] Trial 1753 finished with value: 0.28274091363008597 and parameters: {'n_estimators': 1165, 'learning_rate': 0.06247912943090268, 'max_depth': 8, 'min_samples_split': 2, 'min_samples_leaf': 2, 'subsample': 0.8621067122805591, 'max_features': 'sqrt'}. Best is trial 1389 with value: 0.22332552856343169.
[I 2024-12-04 13:21:39,225] Trial 1766 finished with value: 0.4863864874656637 and parameters: {'n_estimators': 622, 'learning_rate': 0.013489085133877792, 'max_depth': 12, 'min_samples_split': 5, 'min_samples_leaf': 10, 'subsample': 0.8444331738875303, 'max_features': None}. Best is trial 1389 with value: 0.22332552856343169.
[I 2024-12-04 13:21:44,898] Trial 1761 finished with value: 0.2517943754733447 and parameters: {'n_estimators': 927, 'learning_rate': 0.052959241333445366, 'max_depth': 8, 'min_samples_split': 4, 'min_samples_leaf': 1, 'subsample': 0.8101561283275681, 'max_features': 'sqrt'}. Best is trial 1389 with value: 0.22332552856343169.
[I 2024-12-04 13:21:46,916] Trial 1751 finished with value: 0.2362909358811465 and parameters: {'n_estimators': 1334, 'learning_rate': 0.05503073123371908, 'max_depth': 12, 'min_samples_split': 3, 'min_samples_leaf': 1, 'subsample': 0.6885044445779142, 'max_features': 'sqrt'}. Best is trial 1389 with value: 0.22332552856343169.
[I 2024-12-04 13:21:50,102] Trial 1769 finished with value: 0.47486783792732834 and parameters: {'n_estimators': 698, 'learning_rate': 0.0731661705403763, 'max_depth': 3, 'min_samples_split': 13, 'min_samples_leaf': 10, 'subsample': 0.9803959300699696, 'max_features': None}. Best is trial 1389 with value: 0.22332552856343169.
[I 2024-12-04 13:21:50,103] Trial 1750 finished with value: 0.2398083438305946 and parameters: {'n_estimators': 1407, 'learning_rate': 0.09286051990743079, 'max_depth': 6, 'min_samples_split': 6, 'min_samples_leaf': 1, 'subsample': 0.6998667982319746, 'max_features': 'sqrt'}. Best is trial 1389 with value: 0.22332552856343169.
[I 2024-12-04 13:21:53,633] Trial 1765 finished with value: 0.8204810431455031 and parameters: {'n_estimators': 940, 'learning_rate': 0.02923234400603725, 'max_depth': 12, 'min_samples_split': 6, 'min_samples_leaf': 6, 'subsample': 0.6094914412079707, 'max_features': 'log2'}. Best is trial 1389 with value: 0.22332552856343169.
[I 2024-12-04 13:21:55,091] Trial 1754 finished with value: 0.25611234274633704 and parameters: {'n_estimators': 1323, 'learning_rate': 0.0896606020676806, 'max_depth': 8, 'min_samples_split': 2, 'min_samples_leaf': 1, 'subsample': 0.8986546588045926, 'max_features': 'sqrt'}. Best is trial 1389 with value: 0.22332552856343169.
[I 2024-12-04 13:21:55,612] Trial 1762 finished with value: 0.30109977053641535 and parameters: {'n_estimators': 1045, 'learning_rate': 0.08040892339279239, 'max_depth': 4, 'min_samples_split': 11, 'min_samples_leaf': 2, 'subsample': 0.758517933977263, 'max_features': 'sqrt'}. Best is trial 1389 with value: 0.22332552856343169.
[I 2024-12-04 13:21:56,340] Trial 1767 finished with value: 0.2589689184297901 and parameters: {'n_estimators': 907, 'learning_rate': 0.06429790988557427, 'max_depth': 9, 'min_samples_split': 7, 'min_samples_leaf': 1, 'subsample': 0.9575892477783168, 'max_features': 'sqrt'}. Best is trial 1389 with value: 0.22332552856343169.
[I 2024-12-04 13:21:59,387] Trial 1749 finished with value: 0.4224400065668931 and parameters: {'n_estimators': 1459, 'learning_rate': 0.09078004749772899, 'max_depth': 9, 'min_samples_split': 4, 'min_samples_leaf': 4, 'subsample': 0.7350473880622634, 'max_features': None}. Best is trial 1389 with value: 0.22332552856343169.
[I 2024-12-04 13:21:59,392] Trial 1760 finished with value: 0.2623062600285395 and parameters: {'n_estimators': 1171, 'learning_rate': 0.06338000862892446, 'max_depth': 7, 'min_samples_split': 5, 'min_samples_leaf': 1, 'subsample': 0.8692325481398382, 'max_features': 'sqrt'}. Best is trial 1389 with value: 0.22332552856343169.
[I 2024-12-04 13:21:59,397] Trial 1752 finished with value: 0.241445880351245 and parameters: {'n_estimators': 1471, 'learning_rate': 0.08704445172396655, 'max_depth': 8, 'min_samples_split': 2, 'min_samples_leaf': 1, 'subsample': 0.7488517136696389, 'max_features': 'sqrt'}. Best is trial 1389 with value: 0.22332552856343169.
[I 2024-12-04 13:22:03,660] Trial 1770 finished with value: 0.27798417929844715 and parameters: {'n_estimators': 845, 'learning_rate': 0.07339615838914064, 'max_depth': 6, 'min_samples_split': 6, 'min_samples_leaf': 1, 'subsample': 0.8425122752292945, 'max_features': 'sqrt'}. Best is trial 1389 with value: 0.22332552856343169.
[I 2024-12-04 13:22:06,014] Trial 1771 finished with value: 0.2507380891051753 and parameters: {'n_estimators': 912, 'learning_rate': 0.08861626025797882, 'max_depth': 8, 'min_samples_split': 3, 'min_samples_leaf': 1, 'subsample': 0.9027283882334637, 'max_features': 'sqrt'}. Best is trial 1389 with value: 0.22332552856343169.
[I 2024-12-04 13:22:07,997] Trial 1756 finished with value: 0.4656999107993233 and parameters: {'n_estimators': 1496, 'learning_rate': 0.03080008396936939, 'max_depth': 7, 'min_samples_split': 7, 'min_samples_leaf': 9, 'subsample': 0.6908609641018671, 'max_features': 'sqrt'}. Best is trial 1389 with value: 0.22332552856343169.
[I 2024-12-04 13:22:13,788] Trial 1763 finished with value: 0.24665615178001124 and parameters: {'n_estimators': 1275, 'learning_rate': 0.04692261739380698, 'max_depth': 10, 'min_samples_split': 2, 'min_samples_leaf': 1, 'subsample': 0.6092874876877353, 'max_features': 'sqrt'}. Best is trial 1389 with value: 0.22332552856343169.
[I 2024-12-04 13:22:13,944] Trial 1777 finished with value: 0.2271936242343406 and parameters: {'n_estimators': 769, 'learning_rate': 0.09829866826427631, 'max_depth': 7, 'min_samples_split': 3, 'min_samples_leaf': 1, 'subsample': 0.8657081672351221, 'max_features': 'sqrt'}. Best is trial 1389 with value: 0.22332552856343169.
[I 2024-12-04 13:22:13,979] Trial 1759 finished with value: 0.36069897363915177 and parameters: {'n_estimators': 1452, 'learning_rate': 0.069976568420645, 'max_depth': 6, 'min_samples_split': 2, 'min_samples_leaf': 3, 'subsample': 0.6730317897830238, 'max_features': 'sqrt'}. Best is trial 1389 with value: 0.22332552856343169.
[I 2024-12-04 13:22:14,940] Trial 1768 finished with value: 0.30930615572737796 and parameters: {'n_estimators': 1131, 'learning_rate': 0.08155839048471072, 'max_depth': 9, 'min_samples_split': 5, 'min_samples_leaf': 2, 'subsample': 0.9741641736353605, 'max_features': 'sqrt'}. Best is trial 1389 with value: 0.22332552856343169.
[I 2024-12-04 13:22:18,192] Trial 1773 finished with value: 0.29694889273214753 and parameters: {'n_estimators': 1016, 'learning_rate': 0.0961330154206779, 'max_depth': 9, 'min_samples_split': 8, 'min_samples_leaf': 2, 'subsample': 0.927837088320852, 'max_features': 'sqrt'}. Best is trial 1389 with value: 0.22332552856343169.
[I 2024-12-04 13:22:18,261] Trial 1772 finished with value: 0.3844018231341953 and parameters: {'n_estimators': 975, 'learning_rate': 0.0949607688810529, 'max_depth': 4, 'min_samples_split': 2, 'min_samples_leaf': 3, 'subsample': 0.8745177100125525, 'max_features': 'log2'}. Best is trial 1389 with value: 0.22332552856343169.
[I 2024-12-04 13:22:21,665] Trial 1775 finished with value: 0.2621928476545901 and parameters: {'n_estimators': 1025, 'learning_rate': 0.08967350940938762, 'max_depth': 8, 'min_samples_split': 9, 'min_samples_leaf': 1, 'subsample': 0.9130276940005796, 'max_features': 'sqrt'}. Best is trial 1389 with value: 0.22332552856343169.
[I 2024-12-04 13:22:30,161] Trial 1764 finished with value: 0.24796901930126303 and parameters: {'n_estimators': 1484, 'learning_rate': 0.06642600375811283, 'max_depth': 9, 'min_samples_split': 2, 'min_samples_leaf': 1, 'subsample': 0.6723285623405548, 'max_features': 'sqrt'}. Best is trial 1389 with value: 0.22332552856343169.
[I 2024-12-04 13:22:33,942] Trial 1778 finished with value: 0.24657694023244697 and parameters: {'n_estimators': 1135, 'learning_rate': 0.06495921159317139, 'max_depth': 8, 'min_samples_split': 6, 'min_samples_leaf': 1, 'subsample': 0.8116708598586414, 'max_features': 'sqrt'}. Best is trial 1389 with value: 0.22332552856343169.
[I 2024-12-04 13:22:37,108] Trial 1776 finished with value: 0.2925543073263033 and parameters: {'n_estimators': 1221, 'learning_rate': 0.06858995360227825, 'max_depth': 8, 'min_samples_split': 5, 'min_samples_leaf': 2, 'subsample': 0.9309345535285962, 'max_features': 'sqrt'}. Best is trial 1389 with value: 0.22332552856343169.
[I 2024-12-04 13:22:40,155] Trial 1780 finished with value: 0.2530811024338943 and parameters: {'n_estimators': 1004, 'learning_rate': 0.08961602384408866, 'max_depth': 5, 'min_samples_split': 2, 'min_samples_leaf': 1, 'subsample': 0.8635199031944513, 'max_features': 'sqrt'}. Best is trial 1389 with value: 0.22332552856343169.
[I 2024-12-04 13:22:42,612] Trial 1779 finished with value: 0.3380397958972352 and parameters: {'n_estimators': 1130, 'learning_rate': 0.07342990257309708, 'max_depth': 8, 'min_samples_split': 2, 'min_samples_leaf': 3, 'subsample': 0.8981891223606664, 'max_features': 'sqrt'}. Best is trial 1389 with value: 0.22332552856343169.
[I 2024-12-04 13:22:46,246] Trial 1774 finished with value: 0.2826836097756187 and parameters: {'n_estimators': 1444, 'learning_rate': 0.039263887056335926, 'max_depth': 9, 'min_samples_split': 2, 'min_samples_leaf': 2, 'subsample': 0.7203527034374585, 'max_features': 'sqrt'}. Best is trial 1389 with value: 0.22332552856343169.
[I 2024-12-04 13:22:48,277] Trial 1783 finished with value: 0.2679380774577326 and parameters: {'n_estimators': 1007, 'learning_rate': 0.07148411012731326, 'max_depth': 9, 'min_samples_split': 2, 'min_samples_leaf': 1, 'subsample': 0.901418466996408, 'max_features': 'sqrt'}. Best is trial 1389 with value: 0.22332552856343169.
[I 2024-12-04 13:22:51,424] Trial 1784 finished with value: 0.2873161426292291 and parameters: {'n_estimators': 1003, 'learning_rate': 0.0987924431105512, 'max_depth': 8, 'min_samples_split': 3, 'min_samples_leaf': 2, 'subsample': 0.9895347905272924, 'max_features': 'sqrt'}. Best is trial 1389 with value: 0.22332552856343169.
[I 2024-12-04 13:22:52,485] Trial 1781 finished with value: 0.3132463382942855 and parameters: {'n_estimators': 1163, 'learning_rate': 0.09403696618889384, 'max_depth': 10, 'min_samples_split': 5, 'min_samples_leaf': 2, 'subsample': 0.904604795459759, 'max_features': 'sqrt'}. Best is trial 1389 with value: 0.22332552856343169.
[I 2024-12-04 13:22:56,235] Trial 1785 finished with value: 0.25961535305665434 and parameters: {'n_estimators': 1055, 'learning_rate': 0.0943316418337406, 'max_depth': 6, 'min_samples_split': 4, 'min_samples_leaf': 1, 'subsample': 0.795135734123993, 'max_features': 'sqrt'}. Best is trial 1389 with value: 0.22332552856343169.
[I 2024-12-04 13:23:00,846] Trial 1799 finished with value: 0.3322724994180261 and parameters: {'n_estimators': 588, 'learning_rate': 0.08503302383341535, 'max_depth': 12, 'min_samples_split': 5, 'min_samples_leaf': 2, 'subsample': 0.9694555240489842, 'max_features': 'sqrt'}. Best is trial 1389 with value: 0.22332552856343169.
[I 2024-12-04 13:23:03,015] Trial 1786 finished with value: 0.2892208682684365 and parameters: {'n_estimators': 1099, 'learning_rate': 0.05773328436751925, 'max_depth': 6, 'min_samples_split': 9, 'min_samples_leaf': 2, 'subsample': 0.9262480185450171, 'max_features': 'sqrt'}. Best is trial 1389 with value: 0.22332552856343169.
[I 2024-12-04 13:23:03,141] Trial 1787 finished with value: 0.2536009955318601 and parameters: {'n_estimators': 1037, 'learning_rate': 0.060549614417444164, 'max_depth': 8, 'min_samples_split': 7, 'min_samples_leaf': 1, 'subsample': 0.9109814439243067, 'max_features': 'sqrt'}. Best is trial 1389 with value: 0.22332552856343169.
[I 2024-12-04 13:23:05,604] Trial 1782 finished with value: 0.23594256525928836 and parameters: {'n_estimators': 1284, 'learning_rate': 0.08946915167235886, 'max_depth': 8, 'min_samples_split': 5, 'min_samples_leaf': 1, 'subsample': 0.9411207441889554, 'max_features': 'sqrt'}. Best is trial 1389 with value: 0.22332552856343169.
[I 2024-12-04 13:23:06,101] Trial 1801 finished with value: 0.2963341096291433 and parameters: {'n_estimators': 549, 'learning_rate': 0.09159079143048428, 'max_depth': 6, 'min_samples_split': 6, 'min_samples_leaf': 2, 'subsample': 0.8100213757008741, 'max_features': 'sqrt'}. Best is trial 1389 with value: 0.22332552856343169.
[I 2024-12-04 13:23:11,102] Trial 1791 finished with value: 0.2582785361011105 and parameters: {'n_estimators': 1009, 'learning_rate': 0.08545524350055955, 'max_depth': 7, 'min_samples_split': 9, 'min_samples_leaf': 1, 'subsample': 0.8227247940982318, 'max_features': 'sqrt'}. Best is trial 1389 with value: 0.22332552856343169.
[I 2024-12-04 13:23:14,425] Trial 1792 finished with value: 0.27635074811303684 and parameters: {'n_estimators': 874, 'learning_rate': 0.09953330008307823, 'max_depth': 6, 'min_samples_split': 5, 'min_samples_leaf': 2, 'subsample': 0.8155715954050826, 'max_features': 'sqrt'}. Best is trial 1389 with value: 0.22332552856343169.
[I 2024-12-04 13:23:19,717] Trial 1802 finished with value: 0.2592531827047952 and parameters: {'n_estimators': 733, 'learning_rate': 0.08889602746988984, 'max_depth': 8, 'min_samples_split': 6, 'min_samples_leaf': 1, 'subsample': 0.7636351088796413, 'max_features': 'sqrt'}. Best is trial 1389 with value: 0.22332552856343169.
[I 2024-12-04 13:23:19,736] Trial 1788 finished with value: 0.3431961307300669 and parameters: {'n_estimators': 1233, 'learning_rate': 0.09583953946366162, 'max_depth': 7, 'min_samples_split': 5, 'min_samples_leaf': 3, 'subsample': 0.8492653262421975, 'max_features': 'sqrt'}. Best is trial 1389 with value: 0.22332552856343169.
[I 2024-12-04 13:23:22,584] Trial 1789 finished with value: 0.25014802351652843 and parameters: {'n_estimators': 1179, 'learning_rate': 0.058141585022194575, 'max_depth': 8, 'min_samples_split': 2, 'min_samples_leaf': 1, 'subsample': 0.8143148424599959, 'max_features': 'sqrt'}. Best is trial 1389 with value: 0.22332552856343169.
[I 2024-12-04 13:23:26,997] Trial 1805 finished with value: 0.3633366297725933 and parameters: {'n_estimators': 646, 'learning_rate': 0.07958995447675844, 'max_depth': 9, 'min_samples_split': 6, 'min_samples_leaf': 3, 'subsample': 0.8632546733384896, 'max_features': 'sqrt'}. Best is trial 1389 with value: 0.22332552856343169.
[I 2024-12-04 13:23:29,410] Trial 1803 finished with value: 0.28393146973651 and parameters: {'n_estimators': 764, 'learning_rate': 0.09239736173171449, 'max_depth': 8, 'min_samples_split': 5, 'min_samples_leaf': 2, 'subsample': 0.8907864492326436, 'max_features': 'sqrt'}. Best is trial 1389 with value: 0.22332552856343169.
[I 2024-12-04 13:23:29,432] Trial 1804 finished with value: 0.3443019280183347 and parameters: {'n_estimators': 733, 'learning_rate': 0.07964946363133829, 'max_depth': 7, 'min_samples_split': 5, 'min_samples_leaf': 3, 'subsample': 0.8908316890328288, 'max_features': 'sqrt'}. Best is trial 1389 with value: 0.22332552856343169.
[I 2024-12-04 13:23:34,173] Trial 1809 finished with value: 0.2815222451421732 and parameters: {'n_estimators': 621, 'learning_rate': 0.06898195995545177, 'max_depth': 9, 'min_samples_split': 6, 'min_samples_leaf': 1, 'subsample': 0.9295936979787967, 'max_features': 'sqrt'}. Best is trial 1389 with value: 0.22332552856343169.
[I 2024-12-04 13:23:36,753] Trial 1810 finished with value: 0.26676382232816087 and parameters: {'n_estimators': 638, 'learning_rate': 0.0899190488434791, 'max_depth': 6, 'min_samples_split': 2, 'min_samples_leaf': 1, 'subsample': 0.862101161201903, 'max_features': 'sqrt'}. Best is trial 1389 with value: 0.22332552856343169.
[I 2024-12-04 13:23:38,912] Trial 1790 finished with value: 0.3543805903033618 and parameters: {'n_estimators': 1433, 'learning_rate': 0.04657993375799096, 'max_depth': 6, 'min_samples_split': 10, 'min_samples_leaf': 3, 'subsample': 0.8028686242220561, 'max_features': 'sqrt'}. Best is trial 1389 with value: 0.22332552856343169.
[I 2024-12-04 13:23:40,024] Trial 1812 finished with value: 0.28424883201013607 and parameters: {'n_estimators': 627, 'learning_rate': 0.09491434425296545, 'max_depth': 3, 'min_samples_split': 5, 'min_samples_leaf': 1, 'subsample': 0.8586964802869248, 'max_features': 'sqrt'}. Best is trial 1389 with value: 0.22332552856343169.
[I 2024-12-04 13:23:42,569] Trial 1796 finished with value: 0.2439870224972593 and parameters: {'n_estimators': 1255, 'learning_rate': 0.09552816024472256, 'max_depth': 9, 'min_samples_split': 10, 'min_samples_leaf': 1, 'subsample': 0.8718032002542366, 'max_features': 'sqrt'}. Best is trial 1389 with value: 0.22332552856343169.
