[I 2024-12-04 11:53:43,361] Trial 389 finished with value: 0.8241861685151659 and parameters: {'max_depth': 35, 'min_samples_split': 2, 'min_samples_leaf': 2, 'max_features': 'sqrt', 'criterion': 'squared_error', 'splitter': 'best'}. Best is trial 368 with value: 0.6055877317086851.
[I 2024-12-04 11:53:43,881] Trial 371 finished with value: 0.7291342883560936 and parameters: {'max_depth': 35, 'min_samples_split': 5, 'min_samples_leaf': 1, 'max_features': 'sqrt', 'criterion': 'squared_error', 'splitter': 'best'}. Best is trial 368 with value: 0.6055877317086851.
[I 2024-12-04 11:53:44,231] Trial 393 finished with value: 0.6960703836181407 and parameters: {'max_depth': 32, 'min_samples_split': 2, 'min_samples_leaf': 1, 'max_features': 'sqrt', 'criterion': 'squared_error', 'splitter': 'best'}. Best is trial 368 with value: 0.6055877317086851.
[I 2024-12-04 11:53:44,520] Trial 386 finished with value: 0.8300015320785108 and parameters: {'max_depth': 26, 'min_samples_split': 5, 'min_samples_leaf': 2, 'max_features': 'sqrt', 'criterion': 'squared_error', 'splitter': 'best'}. Best is trial 368 with value: 0.6055877317086851.
[I 2024-12-04 11:53:45,378] Trial 376 finished with value: 0.8391355810268111 and parameters: {'max_depth': 29, 'min_samples_split': 8, 'min_samples_leaf': 2, 'max_features': 'sqrt', 'criterion': 'squared_error', 'splitter': 'best'}. Best is trial 368 with value: 0.6055877317086851.
[I 2024-12-04 11:53:46,218] Trial 390 finished with value: 0.8391355810268111 and parameters: {'max_depth': 33, 'min_samples_split': 8, 'min_samples_leaf': 2, 'max_features': 'sqrt', 'criterion': 'squared_error', 'splitter': 'best'}. Best is trial 368 with value: 0.6055877317086851.
[I 2024-12-04 11:53:46,359] Trial 402 finished with value: 0.7271069002219231 and parameters: {'max_depth': 33, 'min_samples_split': 5, 'min_samples_leaf': 1, 'max_features': 'sqrt', 'criterion': 'squared_error', 'splitter': 'best'}. Best is trial 368 with value: 0.6055877317086851.
[I 2024-12-04 11:53:46,499] Trial 399 finished with value: 0.7030091902207406 and parameters: {'max_depth': 35, 'min_samples_split': 7, 'min_samples_leaf': 1, 'max_features': 'sqrt', 'criterion': 'squared_error', 'splitter': 'best'}. Best is trial 368 with value: 0.6055877317086851.
[I 2024-12-04 11:53:46,785] Trial 381 finished with value: 0.71281860532467 and parameters: {'max_depth': 31, 'min_samples_split': 6, 'min_samples_leaf': 1, 'max_features': 'sqrt', 'criterion': 'squared_error', 'splitter': 'best'}. Best is trial 368 with value: 0.6055877317086851.
[I 2024-12-04 11:53:46,936] Trial 391 finished with value: 0.7440454520811575 and parameters: {'max_depth': 28, 'min_samples_split': 7, 'min_samples_leaf': 1, 'max_features': 'sqrt', 'criterion': 'squared_error', 'splitter': 'best'}. Best is trial 368 with value: 0.6055877317086851.
[I 2024-12-04 11:53:46,952] Trial 404 finished with value: 0.8163908890442707 and parameters: {'max_depth': 29, 'min_samples_split': 15, 'min_samples_leaf': 3, 'max_features': 'sqrt', 'criterion': 'friedman_mse', 'splitter': 'best'}. Best is trial 368 with value: 0.6055877317086851.
[I 2024-12-04 11:53:47,058] Trial 397 finished with value: 0.8257772134964163 and parameters: {'max_depth': 21, 'min_samples_split': 13, 'min_samples_leaf': 7, 'max_features': 'sqrt', 'criterion': 'friedman_mse', 'splitter': 'best'}. Best is trial 368 with value: 0.6055877317086851.
[I 2024-12-04 11:53:47,266] Trial 394 finished with value: 0.8056989539390975 and parameters: {'max_depth': 28, 'min_samples_split': 8, 'min_samples_leaf': 3, 'max_features': 'sqrt', 'criterion': 'friedman_mse', 'splitter': 'best'}. Best is trial 368 with value: 0.6055877317086851.
[I 2024-12-04 11:53:48,626] Trial 407 finished with value: 0.7007608286806496 and parameters: {'max_depth': 30, 'min_samples_split': 14, 'min_samples_leaf': 1, 'max_features': 'sqrt', 'criterion': 'friedman_mse', 'splitter': 'best'}. Best is trial 368 with value: 0.6055877317086851.
[I 2024-12-04 11:53:48,627] Trial 400 finished with value: 1.0816149376799358 and parameters: {'max_depth': 12, 'min_samples_split': 12, 'min_samples_leaf': 9, 'max_features': 'sqrt', 'criterion': 'squared_error', 'splitter': 'random'}. Best is trial 368 with value: 0.6055877317086851.
[I 2024-12-04 11:53:48,776] Trial 395 finished with value: 0.6868714023038909 and parameters: {'max_depth': 34, 'min_samples_split': 15, 'min_samples_leaf': 1, 'max_features': 'sqrt', 'criterion': 'friedman_mse', 'splitter': 'best'}. Best is trial 368 with value: 0.6055877317086851.
[I 2024-12-04 11:53:49,287] Trial 409 finished with value: 1.0816149376799358 and parameters: {'max_depth': 8, 'min_samples_split': 5, 'min_samples_leaf': 6, 'max_features': 'sqrt', 'criterion': 'squared_error', 'splitter': 'random'}. Best is trial 368 with value: 0.6055877317086851.
[I 2024-12-04 11:53:50,214] Trial 401 finished with value: 0.6945768284293156 and parameters: {'max_depth': 35, 'min_samples_split': 9, 'min_samples_leaf': 1, 'max_features': 'sqrt', 'criterion': 'squared_error', 'splitter': 'best'}. Best is trial 368 with value: 0.6055877317086851.
[I 2024-12-04 11:53:50,438] Trial 406 finished with value: 0.8266069286848198 and parameters: {'max_depth': 26, 'min_samples_split': 10, 'min_samples_leaf': 2, 'max_features': 'sqrt', 'criterion': 'friedman_mse', 'splitter': 'best'}. Best is trial 368 with value: 0.6055877317086851.
[I 2024-12-04 11:53:50,446] Trial 396 finished with value: 0.7790901895000184 and parameters: {'max_depth': 21, 'min_samples_split': 13, 'min_samples_leaf': 1, 'max_features': 'sqrt', 'criterion': 'friedman_mse', 'splitter': 'best'}. Best is trial 368 with value: 0.6055877317086851.
[I 2024-12-04 11:53:50,708] Trial 392 finished with value: 0.7042141111383996 and parameters: {'max_depth': 31, 'min_samples_split': 7, 'min_samples_leaf': 1, 'max_features': 'log2', 'criterion': 'friedman_mse', 'splitter': 'best'}. Best is trial 368 with value: 0.6055877317086851.
[I 2024-12-04 11:53:50,713] Trial 413 finished with value: 0.7722845288492907 and parameters: {'max_depth': 30, 'min_samples_split': 8, 'min_samples_leaf': 1, 'max_features': 'sqrt', 'criterion': 'friedman_mse', 'splitter': 'best'}. Best is trial 368 with value: 0.6055877317086851.
[I 2024-12-04 11:53:50,714] Trial 398 finished with value: 0.859140372742846 and parameters: {'max_depth': 18, 'min_samples_split': 13, 'min_samples_leaf': 3, 'max_features': 'sqrt', 'criterion': 'friedman_mse', 'splitter': 'best'}. Best is trial 368 with value: 0.6055877317086851.
[I 2024-12-04 11:53:51,006] Trial 405 finished with value: 0.658104097326617 and parameters: {'max_depth': 29, 'min_samples_split': 8, 'min_samples_leaf': 1, 'max_features': 'sqrt', 'criterion': 'friedman_mse', 'splitter': 'best'}. Best is trial 368 with value: 0.6055877317086851.
[I 2024-12-04 11:53:51,387] Trial 411 finished with value: 1.075383350593605 and parameters: {'max_depth': 35, 'min_samples_split': 3, 'min_samples_leaf': 10, 'max_features': 'sqrt', 'criterion': 'absolute_error', 'splitter': 'random'}. Best is trial 368 with value: 0.6055877317086851.
[I 2024-12-04 11:53:52,183] Trial 408 finished with value: 0.6610475158620678 and parameters: {'max_depth': 27, 'min_samples_split': 18, 'min_samples_leaf': 1, 'max_features': 'sqrt', 'criterion': 'friedman_mse', 'splitter': 'best'}. Best is trial 368 with value: 0.6055877317086851.
[I 2024-12-04 11:53:52,561] Trial 417 finished with value: 0.6880100376172948 and parameters: {'max_depth': 29, 'min_samples_split': 7, 'min_samples_leaf': 1, 'max_features': 'sqrt', 'criterion': 'squared_error', 'splitter': 'best'}. Best is trial 368 with value: 0.6055877317086851.
[I 2024-12-04 11:53:53,389] Trial 403 finished with value: 0.6880100376172948 and parameters: {'max_depth': 29, 'min_samples_split': 7, 'min_samples_leaf': 1, 'max_features': 'sqrt', 'criterion': 'friedman_mse', 'splitter': 'best'}. Best is trial 368 with value: 0.6055877317086851.
[I 2024-12-04 11:53:53,933] Trial 418 finished with value: 0.8163908890442707 and parameters: {'max_depth': 35, 'min_samples_split': 15, 'min_samples_leaf': 3, 'max_features': 'sqrt', 'criterion': 'friedman_mse', 'splitter': 'best'}. Best is trial 368 with value: 0.6055877317086851.
[I 2024-12-04 11:53:54,212] Trial 428 finished with value: 0.7017910226138865 and parameters: {'max_depth': 32, 'min_samples_split': 14, 'min_samples_leaf': 1, 'max_features': 'sqrt', 'criterion': 'friedman_mse', 'splitter': 'best'}. Best is trial 368 with value: 0.6055877317086851.
[I 2024-12-04 11:53:54,363] Trial 427 finished with value: 0.8105579954451577 and parameters: {'max_depth': 28, 'min_samples_split': 12, 'min_samples_leaf': 3, 'max_features': 'sqrt', 'criterion': 'friedman_mse', 'splitter': 'best'}. Best is trial 368 with value: 0.6055877317086851.
[I 2024-12-04 11:53:54,461] Trial 420 finished with value: 0.8101385948198155 and parameters: {'max_depth': 34, 'min_samples_split': 6, 'min_samples_leaf': 3, 'max_features': 'sqrt', 'criterion': 'squared_error', 'splitter': 'best'}. Best is trial 368 with value: 0.6055877317086851.
[I 2024-12-04 11:53:54,590] Trial 412 finished with value: 0.7310409829645067 and parameters: {'max_depth': 26, 'min_samples_split': 12, 'min_samples_leaf': 1, 'max_features': 'sqrt', 'criterion': 'friedman_mse', 'splitter': 'best'}. Best is trial 368 with value: 0.6055877317086851.
[I 2024-12-04 11:53:54,873] Trial 416 finished with value: 0.8286026532825466 and parameters: {'max_depth': 25, 'min_samples_split': 9, 'min_samples_leaf': 3, 'max_features': 'sqrt', 'criterion': 'absolute_error', 'splitter': 'best'}. Best is trial 368 with value: 0.6055877317086851.
[I 2024-12-04 11:53:55,830] Trial 425 finished with value: 0.7674771189356004 and parameters: {'max_depth': 28, 'min_samples_split': 2, 'min_samples_leaf': 1, 'max_features': 'sqrt', 'criterion': 'squared_error', 'splitter': 'random'}. Best is trial 368 with value: 0.6055877317086851.
[I 2024-12-04 11:53:55,986] Trial 419 finished with value: 0.6431029613053907 and parameters: {'max_depth': 30, 'min_samples_split': 9, 'min_samples_leaf': 1, 'max_features': 'sqrt', 'criterion': 'friedman_mse', 'splitter': 'best'}. Best is trial 368 with value: 0.6055877317086851.
[I 2024-12-04 11:53:56,009] Trial 414 finished with value: 1.0740768482351102 and parameters: {'max_depth': 1, 'min_samples_split': 17, 'min_samples_leaf': 7, 'max_features': 'log2', 'criterion': 'absolute_error', 'splitter': 'best'}. Best is trial 368 with value: 0.6055877317086851.
[I 2024-12-04 11:53:56,277] Trial 433 finished with value: 0.68655352883041 and parameters: {'max_depth': 30, 'min_samples_split': 13, 'min_samples_leaf': 1, 'max_features': 'sqrt', 'criterion': 'friedman_mse', 'splitter': 'best'}. Best is trial 368 with value: 0.6055877317086851.
[I 2024-12-04 11:53:56,443] Trial 415 finished with value: 0.7053339665768132 and parameters: {'max_depth': 31, 'min_samples_split': 16, 'min_samples_leaf': 1, 'max_features': 'sqrt', 'criterion': 'squared_error', 'splitter': 'best'}. Best is trial 368 with value: 0.6055877317086851.
[I 2024-12-04 11:53:57,087] Trial 429 finished with value: 0.6743679418637896 and parameters: {'max_depth': 31, 'min_samples_split': 7, 'min_samples_leaf': 1, 'max_features': 'sqrt', 'criterion': 'friedman_mse', 'splitter': 'best'}. Best is trial 368 with value: 0.6055877317086851.
[I 2024-12-04 11:53:57,688] Trial 421 finished with value: 0.8131482590578788 and parameters: {'max_depth': 31, 'min_samples_split': 10, 'min_samples_leaf': 3, 'max_features': 'sqrt', 'criterion': 'friedman_mse', 'splitter': 'best'}. Best is trial 368 with value: 0.6055877317086851.
[I 2024-12-04 11:53:57,757] Trial 422 finished with value: 0.704730236268001 and parameters: {'max_depth': 21, 'min_samples_split': 10, 'min_samples_leaf': 1, 'max_features': 'sqrt', 'criterion': 'friedman_mse', 'splitter': 'best'}. Best is trial 368 with value: 0.6055877317086851.
[I 2024-12-04 11:53:58,512] Trial 435 finished with value: 0.7241223131723469 and parameters: {'max_depth': 23, 'min_samples_split': 9, 'min_samples_leaf': 1, 'max_features': 'sqrt', 'criterion': 'friedman_mse', 'splitter': 'best'}. Best is trial 368 with value: 0.6055877317086851.
[I 2024-12-04 11:53:58,721] Trial 426 finished with value: 1.0909840109486761 and parameters: {'max_depth': 27, 'min_samples_split': 15, 'min_samples_leaf': 7, 'max_features': 'log2', 'criterion': 'squared_error', 'splitter': 'random'}. Best is trial 368 with value: 0.6055877317086851.
[I 2024-12-04 11:53:58,731] Trial 410 finished with value: 0.7155658808975296 and parameters: {'max_depth': 35, 'min_samples_split': 17, 'min_samples_leaf': 1, 'max_features': 'sqrt', 'criterion': 'friedman_mse', 'splitter': 'best'}. Best is trial 368 with value: 0.6055877317086851.
[I 2024-12-04 11:53:59,765] Trial 432 finished with value: 0.7114266712285047 and parameters: {'max_depth': 29, 'min_samples_split': 10, 'min_samples_leaf': 1, 'max_features': 'sqrt', 'criterion': 'squared_error', 'splitter': 'best'}. Best is trial 368 with value: 0.6055877317086851.
[I 2024-12-04 11:53:59,945] Trial 423 finished with value: 0.7572170189088057 and parameters: {'max_depth': 21, 'min_samples_split': 10, 'min_samples_leaf': 1, 'max_features': 'sqrt', 'criterion': 'absolute_error', 'splitter': 'best'}. Best is trial 368 with value: 0.6055877317086851.
[I 2024-12-04 11:53:59,946] Trial 424 finished with value: 0.7205130543696373 and parameters: {'max_depth': 31, 'min_samples_split': 8, 'min_samples_leaf': 1, 'max_features': 'sqrt', 'criterion': 'friedman_mse', 'splitter': 'best'}. Best is trial 368 with value: 0.6055877317086851.
[I 2024-12-04 11:54:00,144] Trial 431 finished with value: 0.8105579954451577 and parameters: {'max_depth': 31, 'min_samples_split': 12, 'min_samples_leaf': 3, 'max_features': 'sqrt', 'criterion': 'squared_error', 'splitter': 'best'}. Best is trial 368 with value: 0.6055877317086851.
[I 2024-12-04 11:54:00,964] Trial 436 finished with value: 0.8125271942876539 and parameters: {'max_depth': 35, 'min_samples_split': 11, 'min_samples_leaf': 3, 'max_features': 'sqrt', 'criterion': 'friedman_mse', 'splitter': 'best'}. Best is trial 368 with value: 0.6055877317086851.
[I 2024-12-04 11:54:00,966] Trial 441 finished with value: 1.091656728529238 and parameters: {'max_depth': 29, 'min_samples_split': 3, 'min_samples_leaf': 10, 'max_features': 'log2', 'criterion': 'squared_error', 'splitter': 'best'}. Best is trial 368 with value: 0.6055877317086851.
[I 2024-12-04 11:54:01,441] Trial 430 finished with value: 1.0773504742716358 and parameters: {'max_depth': 6, 'min_samples_split': 4, 'min_samples_leaf': 1, 'max_features': 'log2', 'criterion': 'squared_error', 'splitter': 'best'}. Best is trial 368 with value: 0.6055877317086851.
[I 2024-12-04 11:54:01,546] Trial 437 finished with value: 0.8101385948198155 and parameters: {'max_depth': 33, 'min_samples_split': 6, 'min_samples_leaf': 3, 'max_features': 'sqrt', 'criterion': 'friedman_mse', 'splitter': 'best'}. Best is trial 368 with value: 0.6055877317086851.
[I 2024-12-04 11:54:01,744] Trial 440 finished with value: 1.0753381761853185 and parameters: {'max_depth': 24, 'min_samples_split': 15, 'min_samples_leaf': 9, 'max_features': 'log2', 'criterion': 'absolute_error', 'splitter': 'random'}. Best is trial 368 with value: 0.6055877317086851.
[I 2024-12-04 11:54:01,778] Trial 438 finished with value: 0.6431029613053907 and parameters: {'max_depth': 30, 'min_samples_split': 9, 'min_samples_leaf': 1, 'max_features': 'sqrt', 'criterion': 'friedman_mse', 'splitter': 'best'}. Best is trial 368 with value: 0.6055877317086851.
[I 2024-12-04 11:54:02,919] Trial 449 finished with value: 0.6595568366176189 and parameters: {'max_depth': 35, 'min_samples_split': 8, 'min_samples_leaf': 1, 'max_features': 'sqrt', 'criterion': 'friedman_mse', 'splitter': 'best'}. Best is trial 368 with value: 0.6055877317086851.
[I 2024-12-04 11:54:02,953] Trial 434 finished with value: 0.7835677424945513 and parameters: {'max_depth': 34, 'min_samples_split': 16, 'min_samples_leaf': 1, 'max_features': 'sqrt', 'criterion': 'friedman_mse', 'splitter': 'random'}. Best is trial 368 with value: 0.6055877317086851.
[I 2024-12-04 11:54:03,258] Trial 445 finished with value: 0.676636829282285 and parameters: {'max_depth': 35, 'min_samples_split': 6, 'min_samples_leaf': 1, 'max_features': 'sqrt', 'criterion': 'squared_error', 'splitter': 'best'}. Best is trial 368 with value: 0.6055877317086851.
[I 2024-12-04 11:54:03,407] Trial 446 finished with value: 1.0921324065309432 and parameters: {'max_depth': 1, 'min_samples_split': 18, 'min_samples_leaf': 4, 'max_features': 'sqrt', 'criterion': 'squared_error', 'splitter': 'random'}. Best is trial 368 with value: 0.6055877317086851.
[I 2024-12-04 11:54:03,628] Trial 448 finished with value: 0.71281860532467 and parameters: {'max_depth': 31, 'min_samples_split': 6, 'min_samples_leaf': 1, 'max_features': 'sqrt', 'criterion': 'squared_error', 'splitter': 'best'}. Best is trial 368 with value: 0.6055877317086851.
[I 2024-12-04 11:54:03,812] Trial 442 finished with value: 0.8066762268897443 and parameters: {'max_depth': 34, 'min_samples_split': 9, 'min_samples_leaf': 3, 'max_features': 'sqrt', 'criterion': 'squared_error', 'splitter': 'best'}. Best is trial 368 with value: 0.6055877317086851.
[I 2024-12-04 11:54:04,283] Trial 444 finished with value: 0.8266069286848198 and parameters: {'max_depth': 27, 'min_samples_split': 10, 'min_samples_leaf': 2, 'max_features': 'sqrt', 'criterion': 'friedman_mse', 'splitter': 'best'}. Best is trial 368 with value: 0.6055877317086851.
[I 2024-12-04 11:54:04,319] Trial 452 finished with value: 0.6431029613053907 and parameters: {'max_depth': 30, 'min_samples_split': 9, 'min_samples_leaf': 1, 'max_features': 'sqrt', 'criterion': 'friedman_mse', 'splitter': 'best'}. Best is trial 368 with value: 0.6055877317086851.
[I 2024-12-04 11:54:05,920] Trial 443 finished with value: 0.7114266712285047 and parameters: {'max_depth': 29, 'min_samples_split': 10, 'min_samples_leaf': 1, 'max_features': 'sqrt', 'criterion': 'friedman_mse', 'splitter': 'best'}. Best is trial 368 with value: 0.6055877317086851.
[I 2024-12-04 11:54:06,877] Trial 456 finished with value: 0.6738777154399399 and parameters: {'max_depth': 30, 'min_samples_split': 16, 'min_samples_leaf': 1, 'max_features': 'sqrt', 'criterion': 'friedman_mse', 'splitter': 'best'}. Best is trial 368 with value: 0.6055877317086851.
[I 2024-12-04 11:54:06,919] Trial 447 finished with value: 0.6431029613053907 and parameters: {'max_depth': 30, 'min_samples_split': 9, 'min_samples_leaf': 1, 'max_features': 'sqrt', 'criterion': 'friedman_mse', 'splitter': 'best'}. Best is trial 368 with value: 0.6055877317086851.
[I 2024-12-04 11:54:06,964] Trial 457 finished with value: 0.6663498307647309 and parameters: {'max_depth': 25, 'min_samples_split': 7, 'min_samples_leaf': 1, 'max_features': 'sqrt', 'criterion': 'friedman_mse', 'splitter': 'best'}. Best is trial 368 with value: 0.6055877317086851.
[I 2024-12-04 11:54:07,410] Trial 439 finished with value: 1.0909824780729842 and parameters: {'max_depth': 1, 'min_samples_split': 10, 'min_samples_leaf': 4, 'max_features': 'sqrt', 'criterion': 'friedman_mse', 'splitter': 'best'}. Best is trial 368 with value: 0.6055877317086851.
[I 2024-12-04 11:54:07,768] Trial 459 finished with value: 0.6789802738421568 and parameters: {'max_depth': 35, 'min_samples_split': 13, 'min_samples_leaf': 1, 'max_features': 'sqrt', 'criterion': 'squared_error', 'splitter': 'best'}. Best is trial 368 with value: 0.6055877317086851.
[I 2024-12-04 11:54:08,069] Trial 467 finished with value: 0.7440454520811575 and parameters: {'max_depth': 28, 'min_samples_split': 7, 'min_samples_leaf': 1, 'max_features': 'sqrt', 'criterion': 'friedman_mse', 'splitter': 'best'}. Best is trial 368 with value: 0.6055877317086851.
[I 2024-12-04 11:54:08,359] Trial 451 finished with value: 0.6930885951707311 and parameters: {'max_depth': 28, 'min_samples_split': 8, 'min_samples_leaf': 1, 'max_features': 'sqrt', 'criterion': 'friedman_mse', 'splitter': 'best'}. Best is trial 368 with value: 0.6055877317086851.
[I 2024-12-04 11:54:08,404] Trial 455 finished with value: 0.6694087139298565 and parameters: {'max_depth': 29, 'min_samples_split': 9, 'min_samples_leaf': 1, 'max_features': 'sqrt', 'criterion': 'friedman_mse', 'splitter': 'best'}. Best is trial 368 with value: 0.6055877317086851.
[I 2024-12-04 11:54:09,555] Trial 466 finished with value: 0.838409318749501 and parameters: {'max_depth': 29, 'min_samples_split': 5, 'min_samples_leaf': 2, 'max_features': 'sqrt', 'criterion': 'absolute_error', 'splitter': 'random'}. Best is trial 368 with value: 0.6055877317086851.
[I 2024-12-04 11:54:09,586] Trial 453 finished with value: 0.7987748637010382 and parameters: {'max_depth': 25, 'min_samples_split': 7, 'min_samples_leaf': 3, 'max_features': 'sqrt', 'criterion': 'friedman_mse', 'splitter': 'best'}. Best is trial 368 with value: 0.6055877317086851.
[I 2024-12-04 11:54:09,905] Trial 454 finished with value: 0.6729342005795047 and parameters: {'max_depth': 23, 'min_samples_split': 13, 'min_samples_leaf': 1, 'max_features': 'sqrt', 'criterion': 'friedman_mse', 'splitter': 'best'}. Best is trial 368 with value: 0.6055877317086851.
[I 2024-12-04 11:54:10,100] Trial 463 finished with value: 1.0816149376799358 and parameters: {'max_depth': 34, 'min_samples_split': 17, 'min_samples_leaf': 10, 'max_features': 'sqrt', 'criterion': 'friedman_mse', 'splitter': 'random'}. Best is trial 368 with value: 0.6055877317086851.
[I 2024-12-04 11:54:10,106] Trial 460 finished with value: 0.6671320020529113 and parameters: {'max_depth': 30, 'min_samples_split': 6, 'min_samples_leaf': 1, 'max_features': 'sqrt', 'criterion': 'friedman_mse', 'splitter': 'best'}. Best is trial 368 with value: 0.6055877317086851.
