[I 2024-12-03 18:53:15,333] Trial 1395 finished with value: 0.5302103838985462 and parameters: {'kernel': 'rbf', 'C': 24.838807350443318, 'gamma': 0.17832765156903, 'epsilon': 0.25457949655117373}. Best is trial 88 with value: 0.3542875001421725.
[I 2024-12-03 18:53:16,863] Trial 1396 finished with value: 0.3646754011038834 and parameters: {'kernel': 'rbf', 'C': 78.56157559933632, 'gamma': 0.03632385999962253, 'epsilon': 0.14130972380204654}. Best is trial 88 with value: 0.3542875001421725.
[I 2024-12-03 18:53:16,889] Trial 1393 finished with value: 0.36779859686700817 and parameters: {'kernel': 'rbf', 'C': 86.24755585413924, 'gamma': 0.0431190299198362, 'epsilon': 0.029192522805343915}. Best is trial 88 with value: 0.3542875001421725.
[I 2024-12-03 18:53:18,102] Trial 1350 finished with value: 1.398711490878197 and parameters: {'kernel': 'poly', 'C': 30.51388896039663, 'gamma': 0.01733556245256392, 'epsilon': 0.032400505962063675}. Best is trial 88 with value: 0.3542875001421725.
[I 2024-12-03 18:53:18,268] Trial 1397 finished with value: 0.36407446854460274 and parameters: {'kernel': 'rbf', 'C': 99.21381360006093, 'gamma': 0.052186865080556505, 'epsilon': 0.08766081900682914}. Best is trial 88 with value: 0.3542875001421725.
[I 2024-12-03 18:53:19,411] Trial 1398 finished with value: 0.4242364242298333 and parameters: {'kernel': 'rbf', 'C': 18.442011275256373, 'gamma': 0.024441349996139995, 'epsilon': 0.06971278278056227}. Best is trial 88 with value: 0.3542875001421725.
[I 2024-12-03 18:53:19,509] Trial 1399 finished with value: 0.3602777414234231 and parameters: {'kernel': 'rbf', 'C': 89.63905493790448, 'gamma': 0.04016074966227856, 'epsilon': 0.09163263163472514}. Best is trial 88 with value: 0.3542875001421725.
[I 2024-12-03 18:53:19,898] Trial 1400 finished with value: 0.3768969759708183 and parameters: {'kernel': 'rbf', 'C': 98.50305071764083, 'gamma': 0.06531662509783828, 'epsilon': 0.20646120930636244}. Best is trial 88 with value: 0.3542875001421725.
[I 2024-12-03 18:53:20,988] Trial 1401 finished with value: 0.40871890758036117 and parameters: {'kernel': 'rbf', 'C': 19.145045463602987, 'gamma': 0.06166731199026464, 'epsilon': 0.27099937594919393}. Best is trial 88 with value: 0.3542875001421725.
[I 2024-12-03 18:53:21,934] Trial 1403 finished with value: 0.4337897038391789 and parameters: {'kernel': 'rbf', 'C': 96.01359349215174, 'gamma': 0.006805195671203144, 'epsilon': 0.17126417950640402}. Best is trial 88 with value: 0.3542875001421725.
[I 2024-12-03 18:53:22,528] Trial 1404 finished with value: 28.69625625278048 and parameters: {'kernel': 'sigmoid', 'C': 1.4948865754575, 'gamma': 0.029778726120715648, 'epsilon': 0.04536159332576539}. Best is trial 88 with value: 0.3542875001421725.
[I 2024-12-03 18:53:23,429] Trial 1405 finished with value: 0.646480637964061 and parameters: {'kernel': 'rbf', 'C': 15.195837220870228, 'gamma': 0.4129319136061061, 'epsilon': 0.11553507626633425}. Best is trial 88 with value: 0.3542875001421725.
[I 2024-12-03 18:53:23,841] Trial 1406 finished with value: 0.3691359011156655 and parameters: {'kernel': 'rbf', 'C': 96.64680777397675, 'gamma': 0.019171198112327526, 'epsilon': 0.2253646900260032}. Best is trial 88 with value: 0.3542875001421725.
[I 2024-12-03 18:53:25,130] Trial 1407 finished with value: 0.3631083143531888 and parameters: {'kernel': 'rbf', 'C': 94.10123741987834, 'gamma': 0.0406558651798865, 'epsilon': 0.27356977765629026}. Best is trial 88 with value: 0.3542875001421725.
[I 2024-12-03 18:53:26,564] Trial 1408 finished with value: 0.3879460432182836 and parameters: {'kernel': 'rbf', 'C': 98.70374608696875, 'gamma': 0.08335405135413311, 'epsilon': 0.17560040609305522}. Best is trial 88 with value: 0.3542875001421725.
[I 2024-12-03 18:53:26,676] Trial 1409 finished with value: 1.0996270707359441 and parameters: {'kernel': 'poly', 'C': 0.318487939159417, 'gamma': 0.00011194903474865154, 'epsilon': 0.9086069581609484}. Best is trial 88 with value: 0.3542875001421725.
[I 2024-12-03 18:53:27,863] Trial 1410 finished with value: 0.510208945199065 and parameters: {'kernel': 'rbf', 'C': 19.768524455275248, 'gamma': 0.20930148642594654, 'epsilon': 0.03783454755767226}. Best is trial 88 with value: 0.3542875001421725.
[I 2024-12-03 18:53:28,824] Trial 1411 finished with value: 1.0698678185958708 and parameters: {'kernel': 'rbf', 'C': 0.001217362356375294, 'gamma': 0.0007879997813198665, 'epsilon': 0.06933742981975072}. Best is trial 88 with value: 0.3542875001421725.
[I 2024-12-03 18:53:28,826] Trial 1412 finished with value: 0.4369527788890731 and parameters: {'kernel': 'rbf', 'C': 18.08632393345414, 'gamma': 0.014270906564573367, 'epsilon': 0.16951650594367565}. Best is trial 88 with value: 0.3542875001421725.
[I 2024-12-03 18:53:30,232] Trial 1413 finished with value: 0.417722408458063 and parameters: {'kernel': 'rbf', 'C': 25.226465733063126, 'gamma': 0.021648923187631782, 'epsilon': 0.0816541635083651}. Best is trial 88 with value: 0.3542875001421725.
[I 2024-12-03 18:53:30,959] Trial 1415 finished with value: 0.4500979821852952 and parameters: {'kernel': 'rbf', 'C': 16.06555600759018, 'gamma': 0.11931622367550697, 'epsilon': 0.17158620799287932}. Best is trial 88 with value: 0.3542875001421725.
[I 2024-12-03 18:53:32,121] Trial 1414 finished with value: 0.38038070141914015 and parameters: {'kernel': 'rbf', 'C': 93.25172812744363, 'gamma': 0.059134966035484376, 'epsilon': 0.03679664530483295}. Best is trial 88 with value: 0.3542875001421725.
[I 2024-12-03 18:53:32,292] Trial 1416 finished with value: 0.38262464593985757 and parameters: {'kernel': 'rbf', 'C': 92.01639842276155, 'gamma': 0.017448077456058697, 'epsilon': 0.09502926916934286}. Best is trial 88 with value: 0.3542875001421725.
[I 2024-12-03 18:53:33,390] Trial 1417 finished with value: 0.37922695299861287 and parameters: {'kernel': 'rbf', 'C': 98.26667428451111, 'gamma': 0.07023801159338769, 'epsilon': 0.0929451055379358}. Best is trial 88 with value: 0.3542875001421725.
[I 2024-12-03 18:53:33,714] Trial 1418 finished with value: 0.6366684151611249 and parameters: {'kernel': 'rbf', 'C': 90.25936541583832, 'gamma': 0.3867292810775511, 'epsilon': 0.13152587864735654}. Best is trial 88 with value: 0.3542875001421725.
[I 2024-12-03 18:53:33,764] Trial 1419 finished with value: 0.5070274824152081 and parameters: {'kernel': 'rbf', 'C': 24.394826326376762, 'gamma': 0.06772587366396121, 'epsilon': 0.5534170901400368}. Best is trial 88 with value: 0.3542875001421725.
[I 2024-12-03 18:53:35,009] Trial 1420 finished with value: 0.5010860788651129 and parameters: {'kernel': 'rbf', 'C': 94.30137516182907, 'gamma': 0.1704053532603618, 'epsilon': 0.1863296466356688}. Best is trial 88 with value: 0.3542875001421725.
[I 2024-12-03 18:53:35,795] Trial 1422 finished with value: 0.5132120854556665 and parameters: {'kernel': 'rbf', 'C': 97.2983497988078, 'gamma': 0.14234412236362445, 'epsilon': 0.31649537888419743}. Best is trial 88 with value: 0.3542875001421725.
[I 2024-12-03 18:53:37,247] Trial 1424 finished with value: 0.43980099080358764 and parameters: {'kernel': 'rbf', 'C': 96.16474181897456, 'gamma': 0.03736255822892975, 'epsilon': 0.5743344989474415}. Best is trial 88 with value: 0.3542875001421725.
[I 2024-12-03 18:53:37,249] Trial 1423 finished with value: 0.36656909473876287 and parameters: {'kernel': 'rbf', 'C': 98.13603877404285, 'gamma': 0.02690357687786467, 'epsilon': 0.08543618435378073}. Best is trial 88 with value: 0.3542875001421725.
[I 2024-12-03 18:53:38,054] Trial 1421 finished with value: 0.376620017934776 and parameters: {'kernel': 'rbf', 'C': 96.81394973461379, 'gamma': 0.019332353489008566, 'epsilon': 0.026664685900313817}. Best is trial 88 with value: 0.3542875001421725.
[I 2024-12-03 18:53:39,283] Trial 1426 finished with value: 0.4245335420030461 and parameters: {'kernel': 'rbf', 'C': 20.916625210311576, 'gamma': 0.017323218096332117, 'epsilon': 0.18913780357654617}. Best is trial 88 with value: 0.3542875001421725.
[I 2024-12-03 18:53:40,286] Trial 1427 finished with value: 0.39739155592147885 and parameters: {'kernel': 'rbf', 'C': 91.39286606715362, 'gamma': 0.011957781748626791, 'epsilon': 0.1744072907941932}. Best is trial 88 with value: 0.3542875001421725.
[I 2024-12-03 18:53:40,403] Trial 1425 finished with value: 0.39026585548716586 and parameters: {'kernel': 'rbf', 'C': 94.83621062704127, 'gamma': 0.01615102897619471, 'epsilon': 0.05175215263001243}. Best is trial 88 with value: 0.3542875001421725.
[I 2024-12-03 18:53:42,500] Trial 1428 finished with value: 0.4112645388706532 and parameters: {'kernel': 'rbf', 'C': 17.701785786905585, 'gamma': 0.08677998325420876, 'epsilon': 0.09774401812573949}. Best is trial 88 with value: 0.3542875001421725.
[I 2024-12-03 18:53:43,230] Trial 1430 finished with value: 0.48159330590778143 and parameters: {'kernel': 'rbf', 'C': 3.6991487366521083, 'gamma': 0.07315272937554945, 'epsilon': 0.20995427523596852}. Best is trial 88 with value: 0.3542875001421725.
[I 2024-12-03 18:53:43,480] Trial 1429 finished with value: 1928.7478772540405 and parameters: {'kernel': 'sigmoid', 'C': 91.65231488810639, 'gamma': 0.0691621252255737, 'epsilon': 0.06758953766049153}. Best is trial 88 with value: 0.3542875001421725.
[I 2024-12-03 18:53:44,846] Trial 1431 finished with value: 0.39306402828286496 and parameters: {'kernel': 'rbf', 'C': 25.310162112594654, 'gamma': 0.04016879684640839, 'epsilon': 0.11673703217256119}. Best is trial 88 with value: 0.3542875001421725.
[I 2024-12-03 18:53:45,916] Trial 1337 finished with value: 0.8020635701558416 and parameters: {'kernel': 'linear', 'C': 63.94197251781446, 'gamma': 0.19115535144682955, 'epsilon': 0.05931693162312277}. Best is trial 88 with value: 0.3542875001421725.
[I 2024-12-03 18:53:45,926] Trial 1433 finished with value: 0.3874923895878819 and parameters: {'kernel': 'rbf', 'C': 96.19575548827291, 'gamma': 0.08217954841752642, 'epsilon': 0.08707151716814264}. Best is trial 88 with value: 0.3542875001421725.
[I 2024-12-03 18:53:46,894] Trial 1434 finished with value: 0.3654851530947165 and parameters: {'kernel': 'rbf', 'C': 93.49140511484715, 'gamma': 0.024130395933545917, 'epsilon': 0.11507304151412488}. Best is trial 88 with value: 0.3542875001421725.
[I 2024-12-03 18:53:47,644] Trial 1435 finished with value: 0.40758668640752993 and parameters: {'kernel': 'rbf', 'C': 19.836050021021894, 'gamma': 0.025909285446870815, 'epsilon': 0.21324907470866036}. Best is trial 88 with value: 0.3542875001421725.
[I 2024-12-03 18:53:48,858] Trial 1437 finished with value: 0.4455923658954125 and parameters: {'kernel': 'rbf', 'C': 4.318213959059872, 'gamma': 0.028448387461848187, 'epsilon': 0.03678164068404621}. Best is trial 88 with value: 0.3542875001421725.
[I 2024-12-03 18:53:48,886] Trial 1436 finished with value: 0.7983293716201239 and parameters: {'kernel': 'linear', 'C': 0.8157757144205133, 'gamma': 0.08752110613569743, 'epsilon': 0.013639286670289158}. Best is trial 88 with value: 0.3542875001421725.
[I 2024-12-03 18:53:50,080] Trial 1438 finished with value: 0.50624786147483 and parameters: {'kernel': 'rbf', 'C': 19.33959027319681, 'gamma': 0.18498552956627604, 'epsilon': 0.14723154642474323}. Best is trial 88 with value: 0.3542875001421725.
[I 2024-12-03 18:53:50,344] Trial 1440 finished with value: 0.6155451102166916 and parameters: {'kernel': 'rbf', 'C': 96.74771564291515, 'gamma': 0.08395466793244798, 'epsilon': 0.7180486013189943}. Best is trial 88 with value: 0.3542875001421725.
[I 2024-12-03 18:53:51,708] Trial 1442 finished with value: 0.8200588866014569 and parameters: {'kernel': 'linear', 'C': 0.021021327470619397, 'gamma': 0.0019041205442229747, 'epsilon': 0.2421989834969956}. Best is trial 88 with value: 0.3542875001421725.
[I 2024-12-03 18:53:51,710] Trial 1441 finished with value: 0.41675370754770674 and parameters: {'kernel': 'rbf', 'C': 20.079527810592747, 'gamma': 0.03648855695931929, 'epsilon': 0.07319799967209847}. Best is trial 88 with value: 0.3542875001421725.
[I 2024-12-03 18:53:53,251] Trial 1444 finished with value: 0.456766630915928 and parameters: {'kernel': 'rbf', 'C': 17.792732459239442, 'gamma': 0.005702003104685202, 'epsilon': 0.4850569388808707}. Best is trial 88 with value: 0.3542875001421725.
[I 2024-12-03 18:53:53,253] Trial 1443 finished with value: 0.4045700044137727 and parameters: {'kernel': 'rbf', 'C': 20.22453557322378, 'gamma': 0.06612585830250885, 'epsilon': 0.22304932487613552}. Best is trial 88 with value: 0.3542875001421725.
[I 2024-12-03 18:53:54,917] Trial 1445 finished with value: 0.41289020387427566 and parameters: {'kernel': 'rbf', 'C': 18.511719638150456, 'gamma': 0.024967770872058315, 'epsilon': 0.18856206533393696}. Best is trial 88 with value: 0.3542875001421725.
[I 2024-12-03 18:53:56,438] Trial 1447 finished with value: 0.361992708813482 and parameters: {'kernel': 'rbf', 'C': 95.82470817436787, 'gamma': 0.03900349701992164, 'epsilon': 0.27494456195756084}. Best is trial 88 with value: 0.3542875001421725.
[I 2024-12-03 18:53:57,973] Trial 1448 finished with value: 0.94221733967643 and parameters: {'kernel': 'rbf', 'C': 0.013319323362967313, 'gamma': 0.12186610495966729, 'epsilon': 0.10882190406450981}. Best is trial 88 with value: 0.3542875001421725.
[I 2024-12-03 18:53:59,379] Trial 1449 finished with value: 0.3604312549558928 and parameters: {'kernel': 'rbf', 'C': 96.70290315661724, 'gamma': 0.036480158784874483, 'epsilon': 0.1558667032642889}. Best is trial 88 with value: 0.3542875001421725.
[I 2024-12-03 18:54:00,726] Trial 1450 finished with value: 0.4871910106457912 and parameters: {'kernel': 'rbf', 'C': 19.725582980240343, 'gamma': 0.16797599847439776, 'epsilon': 0.12033123150191656}. Best is trial 88 with value: 0.3542875001421725.
[I 2024-12-03 18:54:02,186] Trial 1451 finished with value: 1107.0228175355737 and parameters: {'kernel': 'sigmoid', 'C': 51.95184961199254, 'gamma': 0.03926778623748404, 'epsilon': 0.3654878829036925}. Best is trial 88 with value: 0.3542875001421725.
[I 2024-12-03 18:54:03,469] Trial 1452 finished with value: 0.5462220425387726 and parameters: {'kernel': 'rbf', 'C': 89.33832496159947, 'gamma': 0.22713869818369836, 'epsilon': 0.1584578758286704}. Best is trial 88 with value: 0.3542875001421725.
[I 2024-12-03 18:54:06,246] Trial 1453 finished with value: 0.3639748949657328 and parameters: {'kernel': 'rbf', 'C': 89.82087820122518, 'gamma': 0.042137518746138476, 'epsilon': 0.05370309094638972}. Best is trial 88 with value: 0.3542875001421725.
[I 2024-12-03 18:54:08,089] Trial 1454 finished with value: 0.39990936359650026 and parameters: {'kernel': 'rbf', 'C': 90.70068244694161, 'gamma': 0.002601972268243996, 'epsilon': 0.02265549700540748}. Best is trial 88 with value: 0.3542875001421725.
[I 2024-12-03 18:54:09,643] Trial 1455 finished with value: 0.40245959661425723 and parameters: {'kernel': 'rbf', 'C': 17.289580697723704, 'gamma': 0.00831079246037254, 'epsilon': 0.045310527898677816}. Best is trial 88 with value: 0.3542875001421725.
[I 2024-12-03 18:54:11,137] Trial 1456 finished with value: 0.3880512121787296 and parameters: {'kernel': 'rbf', 'C': 89.25019611786742, 'gamma': 0.08792413077289193, 'epsilon': 0.11059375755859868}. Best is trial 88 with value: 0.3542875001421725.
[I 2024-12-03 18:54:39,743] Trial 1371 finished with value: 3.543566305695225 and parameters: {'kernel': 'poly', 'C': 90.67329726326041, 'gamma': 0.055456968083056515, 'epsilon': 0.21705714478046614}. Best is trial 88 with value: 0.3542875001421725.
[I 2024-12-03 18:54:41,090] Trial 1458 finished with value: 0.524101290206292 and parameters: {'kernel': 'rbf', 'C': 95.6580635578682, 'gamma': 0.21528870853522902, 'epsilon': 0.09697558735838159}. Best is trial 88 with value: 0.3542875001421725.
[I 2024-12-03 18:54:42,300] Trial 1459 finished with value: 0.3877133109101892 and parameters: {'kernel': 'rbf', 'C': 24.261465545722682, 'gamma': 0.03923456563971673, 'epsilon': 0.22261531777750648}. Best is trial 88 with value: 0.3542875001421725.
[I 2024-12-03 18:54:43,684] Trial 1460 finished with value: 0.46621520279933726 and parameters: {'kernel': 'rbf', 'C': 6.209591918461447, 'gamma': 0.07310858506784569, 'epsilon': 0.0908150444271041}. Best is trial 88 with value: 0.3542875001421725.
[I 2024-12-03 18:54:56,104] Trial 1432 finished with value: 0.7687127474989889 and parameters: {'kernel': 'linear', 'C': 87.46242305095006, 'gamma': 0.08421887872880186, 'epsilon': 0.1448765553881072}. Best is trial 88 with value: 0.3542875001421725.
[I 2024-12-03 18:54:57,659] Trial 1462 finished with value: 0.9037864129633773 and parameters: {'kernel': 'linear', 'C': 0.001092494106318322, 'gamma': 0.4464715024617582, 'epsilon': 0.02308365454203766}. Best is trial 88 with value: 0.3542875001421725.
[I 2024-12-03 18:54:59,046] Trial 1463 finished with value: 0.37017207653188783 and parameters: {'kernel': 'rbf', 'C': 98.06539114563242, 'gamma': 0.02238618509957442, 'epsilon': 0.37374628556722367}. Best is trial 88 with value: 0.3542875001421725.
[I 2024-12-03 18:55:00,874] Trial 1464 finished with value: 0.4245052778284418 and parameters: {'kernel': 'rbf', 'C': 15.381576760298266, 'gamma': 0.031362339494658706, 'epsilon': 0.09688970277802164}. Best is trial 88 with value: 0.3542875001421725.
[I 2024-12-03 18:55:02,363] Trial 1465 finished with value: 0.37166603444082097 and parameters: {'kernel': 'rbf', 'C': 98.30468929607028, 'gamma': 0.02394030606069531, 'epsilon': 0.19295779035850125}. Best is trial 88 with value: 0.3542875001421725.
[I 2024-12-03 18:55:04,726] Trial 1466 finished with value: 0.3890733067643268 and parameters: {'kernel': 'rbf', 'C': 25.829478330244303, 'gamma': 0.0523300837351614, 'epsilon': 0.04656348261162642}. Best is trial 88 with value: 0.3542875001421725.
[I 2024-12-03 18:55:06,700] Trial 1467 finished with value: 0.38121509779276724 and parameters: {'kernel': 'rbf', 'C': 29.475854387760677, 'gamma': 0.053842969843054304, 'epsilon': 0.10482384023732962}. Best is trial 88 with value: 0.3542875001421725.
[I 2024-12-03 18:55:08,106] Trial 1468 finished with value: 0.3995593070614027 and parameters: {'kernel': 'rbf', 'C': 26.372351470426306, 'gamma': 0.008335930698848654, 'epsilon': 0.11379280174509102}. Best is trial 88 with value: 0.3542875001421725.
[I 2024-12-03 18:55:09,354] Trial 1469 finished with value: 0.36347511518393527 and parameters: {'kernel': 'rbf', 'C': 96.28621112769386, 'gamma': 0.04224931152872243, 'epsilon': 0.26584336525400215}. Best is trial 88 with value: 0.3542875001421725.
[I 2024-12-03 18:55:10,527] Trial 1470 finished with value: 0.3904880208696094 and parameters: {'kernel': 'rbf', 'C': 94.19414833444847, 'gamma': 0.056416924320168316, 'epsilon': 0.32354448012222614}. Best is trial 88 with value: 0.3542875001421725.
[I 2024-12-03 18:55:12,198] Trial 1471 finished with value: 0.4163503945608172 and parameters: {'kernel': 'rbf', 'C': 85.39685308412821, 'gamma': 0.010481067093273379, 'epsilon': 0.08651642630608965}. Best is trial 88 with value: 0.3542875001421725.
[I 2024-12-03 18:55:13,476] Trial 1472 finished with value: 0.37236717175515893 and parameters: {'kernel': 'rbf', 'C': 94.51817800259319, 'gamma': 0.01822609094767676, 'epsilon': 0.1994297851275021}. Best is trial 88 with value: 0.3542875001421725.
[I 2024-12-03 18:55:14,760] Trial 1473 finished with value: 0.47284113263724264 and parameters: {'kernel': 'rbf', 'C': 96.3438976146911, 'gamma': 0.1108847520718794, 'epsilon': 0.31926371280296584}. Best is trial 88 with value: 0.3542875001421725.
[I 2024-12-03 18:55:16,432] Trial 1474 finished with value: 0.6915101698817058 and parameters: {'kernel': 'rbf', 'C': 86.03865323385634, 'gamma': 0.5450824430726231, 'epsilon': 0.06049839140540267}. Best is trial 88 with value: 0.3542875001421725.
[I 2024-12-03 18:55:18,787] Trial 1475 finished with value: 0.40898248234321966 and parameters: {'kernel': 'rbf', 'C': 18.52388644610672, 'gamma': 0.05554472746411877, 'epsilon': 0.02967210283428004}. Best is trial 88 with value: 0.3542875001421725.
[I 2024-12-03 18:55:21,602] Trial 1476 finished with value: 0.3664249859616588 and parameters: {'kernel': 'rbf', 'C': 98.9198852834393, 'gamma': 0.026055730988643545, 'epsilon': 0.11668806851578555}. Best is trial 88 with value: 0.3542875001421725.
[I 2024-12-03 18:55:23,715] Trial 1477 finished with value: 0.41221846648592014 and parameters: {'kernel': 'rbf', 'C': 98.11838470275461, 'gamma': 0.010708651586862218, 'epsilon': 0.07523132798203598}. Best is trial 88 with value: 0.3542875001421725.
[I 2024-12-03 18:55:35,448] Trial 1478 finished with value: 0.7387756382914282 and parameters: {'kernel': 'linear', 'C': 10.540553985451654, 'gamma': 0.010293279714959016, 'epsilon': 0.24732261078347315}. Best is trial 88 with value: 0.3542875001421725.
[I 2024-12-03 18:55:37,187] Trial 1479 finished with value: 0.48073695728124116 and parameters: {'kernel': 'rbf', 'C': 19.053816020462193, 'gamma': 0.16804802464992638, 'epsilon': 0.06730077478754708}. Best is trial 88 with value: 0.3542875001421725.
[I 2024-12-03 18:55:38,856] Trial 1480 finished with value: 0.37951012576615506 and parameters: {'kernel': 'rbf', 'C': 90.43280170656382, 'gamma': 0.07379982566620365, 'epsilon': 0.12139258512447394}. Best is trial 88 with value: 0.3542875001421725.
[I 2024-12-03 18:55:41,630] Trial 1481 finished with value: 0.3696528283933595 and parameters: {'kernel': 'rbf', 'C': 93.5674703453007, 'gamma': 0.051215700334869475, 'epsilon': 0.03100226679058909}. Best is trial 88 with value: 0.3542875001421725.
[I 2024-12-03 18:55:43,040] Trial 1482 finished with value: 0.4299045900458417 and parameters: {'kernel': 'rbf', 'C': 20.357159263210903, 'gamma': 0.013231023906106193, 'epsilon': 0.30357466919416676}. Best is trial 88 with value: 0.3542875001421725.
