[I 2024-12-04 00:05:50,452] Trial 65 finished with value: 0.9264439122958424 and parameters: {'kernel': 'rbf', 'C': 0.002804607287652506, 'gamma': 0.01209586149790325, 'epsilon': 0.19306421721716174}. Best is trial 59 with value: 0.15463293808006018.
[I 2024-12-04 00:05:50,880] Trial 67 finished with value: 2649.2079391292536 and parameters: {'kernel': 'sigmoid', 'C': 99.51252015464613, 'gamma': 0.26215531881744203, 'epsilon': 0.006606658336203358}. Best is trial 59 with value: 0.15463293808006018.
[I 2024-12-04 00:05:51,698] Trial 58 finished with value: 0.16302812577818482 and parameters: {'kernel': 'rbf', 'C': 75.29132918977223, 'gamma': 0.017134316606516035, 'epsilon': 0.002901327306475728}. Best is trial 59 with value: 0.15463293808006018.
[I 2024-12-04 00:05:51,917] Trial 63 finished with value: 0.1772617706528546 and parameters: {'kernel': 'rbf', 'C': 27.324567032007998, 'gamma': 0.009086619574963692, 'epsilon': 0.04097429827335909}. Best is trial 59 with value: 0.15463293808006018.
[I 2024-12-04 00:05:51,942] Trial 23 finished with value: 0.3213235977534578 and parameters: {'kernel': 'linear', 'C': 26.806691905110714, 'gamma': 0.0001558756076636744, 'epsilon': 0.10976342166688317}. Best is trial 59 with value: 0.15463293808006018.
[I 2024-12-04 00:05:52,001] Trial 71 finished with value: 10.763947742669798 and parameters: {'kernel': 'sigmoid', 'C': 0.6059312640946859, 'gamma': 0.017760609927603747, 'epsilon': 0.011641341392690477}. Best is trial 59 with value: 0.15463293808006018.
[I 2024-12-04 00:05:52,083] Trial 69 finished with value: 0.15531126236179432 and parameters: {'kernel': 'rbf', 'C': 74.73288737120052, 'gamma': 0.006436601325817916, 'epsilon': 0.05294430951035396}. Best is trial 59 with value: 0.15463293808006018.
[I 2024-12-04 00:05:52,099] Trial 72 finished with value: 0.18569207411041644 and parameters: {'kernel': 'rbf', 'C': 7.390029102865937, 'gamma': 0.020997383322814908, 'epsilon': 0.0027010443705974105}. Best is trial 59 with value: 0.15463293808006018.
[I 2024-12-04 00:05:52,164] Trial 60 finished with value: 0.1948790009375615 and parameters: {'kernel': 'rbf', 'C': 39.791791771478785, 'gamma': 0.04650285282719339, 'epsilon': 0.0012110034863090121}. Best is trial 59 with value: 0.15463293808006018.
[I 2024-12-04 00:05:52,424] Trial 76 finished with value: 0.15657484778938857 and parameters: {'kernel': 'rbf', 'C': 92.20447774996303, 'gamma': 0.014354931012341924, 'epsilon': 0.01989040939949392}. Best is trial 59 with value: 0.15463293808006018.
[I 2024-12-04 00:05:52,478] Trial 68 finished with value: 0.8350247703548863 and parameters: {'kernel': 'poly', 'C': 17.453275462850446, 'gamma': 0.0022828735270935814, 'epsilon': 0.041217467264975764}. Best is trial 59 with value: 0.15463293808006018.
[I 2024-12-04 00:05:53,025] Trial 70 finished with value: 0.22984719939304155 and parameters: {'kernel': 'rbf', 'C': 79.99878189422486, 'gamma': 0.09005445298871173, 'epsilon': 0.01130687405976632}. Best is trial 59 with value: 0.15463293808006018.
[I 2024-12-04 00:05:53,068] Trial 79 finished with value: 0.20737886778839912 and parameters: {'kernel': 'rbf', 'C': 60.86302825885006, 'gamma': 0.003610403442707545, 'epsilon': 0.091204727830985}. Best is trial 59 with value: 0.15463293808006018.
[I 2024-12-04 00:05:53,129] Trial 77 finished with value: 0.26246301979387154 and parameters: {'kernel': 'rbf', 'C': 8.383574974100396, 'gamma': 0.006255332701569167, 'epsilon': 0.054538615634016005}. Best is trial 59 with value: 0.15463293808006018.
[I 2024-12-04 00:05:53,141] Trial 83 finished with value: 0.2177845987157758 and parameters: {'kernel': 'rbf', 'C': 74.76707437975267, 'gamma': 0.00231089056648847, 'epsilon': 0.10006391490620459}. Best is trial 59 with value: 0.15463293808006018.
[I 2024-12-04 00:05:53,190] Trial 74 finished with value: 0.28652386119892653 and parameters: {'kernel': 'rbf', 'C': 3.521951463696363, 'gamma': 0.008289961344030608, 'epsilon': 0.01072137181887531}. Best is trial 59 with value: 0.15463293808006018.
[I 2024-12-04 00:05:53,422] Trial 5 finished with value: 0.35370929237040505 and parameters: {'kernel': 'linear', 'C': 5.909504999449664, 'gamma': 0.061915069744202335, 'epsilon': 0.001064913900342799}. Best is trial 59 with value: 0.15463293808006018.
[I 2024-12-04 00:05:54,426] Trial 75 finished with value: 0.14524980186819436 and parameters: {'kernel': 'rbf', 'C': 51.06540809260771, 'gamma': 0.010218283778388937, 'epsilon': 0.004358645602604049}. Best is trial 75 with value: 0.14524980186819436.
[I 2024-12-04 00:05:54,488] Trial 82 finished with value: 0.20585377566196425 and parameters: {'kernel': 'rbf', 'C': 89.0968491025854, 'gamma': 0.036342492390581196, 'epsilon': 0.13749289312803534}. Best is trial 75 with value: 0.14524980186819436.
[I 2024-12-04 00:05:54,650] Trial 81 finished with value: 0.6975819106674033 and parameters: {'kernel': 'poly', 'C': 0.01153763480906435, 'gamma': 0.07947883509162222, 'epsilon': 0.04484789479095832}. Best is trial 75 with value: 0.14524980186819436.
[I 2024-12-04 00:05:54,656] Trial 80 finished with value: 0.16084118231845215 and parameters: {'kernel': 'rbf', 'C': 52.086623924997376, 'gamma': 0.006802814319160538, 'epsilon': 0.029298168327275508}. Best is trial 75 with value: 0.14524980186819436.
[I 2024-12-04 00:05:54,748] Trial 86 finished with value: 0.9536493094732954 and parameters: {'kernel': 'sigmoid', 'C': 0.0063466849521052115, 'gamma': 0.003250450587871501, 'epsilon': 0.5650981145643277}. Best is trial 75 with value: 0.14524980186819436.
[I 2024-12-04 00:05:54,866] Trial 84 finished with value: 0.1693990124355746 and parameters: {'kernel': 'rbf', 'C': 80.16392736892927, 'gamma': 0.023444684663934505, 'epsilon': 0.024272968320151408}. Best is trial 75 with value: 0.14524980186819436.
[I 2024-12-04 00:05:56,103] Trial 85 finished with value: 0.21073690475435905 and parameters: {'kernel': 'rbf', 'C': 47.30592101642526, 'gamma': 0.003578371455841864, 'epsilon': 0.01482192071265209}. Best is trial 75 with value: 0.14524980186819436.
[I 2024-12-04 00:05:56,458] Trial 92 finished with value: 0.1884633503906005 and parameters: {'kernel': 'rbf', 'C': 86.6427550568216, 'gamma': 0.038488491953122594, 'epsilon': 0.037427683212064425}. Best is trial 75 with value: 0.14524980186819436.
[I 2024-12-04 00:05:57,084] Trial 90 finished with value: 0.16954528285662385 and parameters: {'kernel': 'rbf', 'C': 73.20792000888746, 'gamma': 0.023691940229865177, 'epsilon': 0.01640050919251262}. Best is trial 75 with value: 0.14524980186819436.
[I 2024-12-04 00:05:57,085] Trial 73 finished with value: 1463.3181635195006 and parameters: {'kernel': 'sigmoid', 'C': 84.58559478027355, 'gamma': 0.016748344654725612, 'epsilon': 0.056433379912840795}. Best is trial 75 with value: 0.14524980186819436.
[I 2024-12-04 00:05:57,162] Trial 89 finished with value: 0.1677016001711018 and parameters: {'kernel': 'rbf', 'C': 77.75312404878743, 'gamma': 0.004391309516596662, 'epsilon': 0.001692507972195823}. Best is trial 75 with value: 0.14524980186819436.
[I 2024-12-04 00:05:57,408] Trial 88 finished with value: 0.14663218072460824 and parameters: {'kernel': 'rbf', 'C': 72.15958477475303, 'gamma': 0.00720330122614716, 'epsilon': 0.0038276057660951634}. Best is trial 75 with value: 0.14524980186819436.
[I 2024-12-04 00:05:57,848] Trial 93 finished with value: 0.4550639328844125 and parameters: {'kernel': 'rbf', 'C': 1.3535926990365197, 'gamma': 0.01388519642147079, 'epsilon': 0.7319089692165242}. Best is trial 75 with value: 0.14524980186819436.
[I 2024-12-04 00:05:57,981] Trial 87 finished with value: 0.20982300704797086 and parameters: {'kernel': 'rbf', 'C': 35.2876808543707, 'gamma': 0.004498306747814195, 'epsilon': 0.023147309589022304}. Best is trial 75 with value: 0.14524980186819436.
[I 2024-12-04 00:05:58,061] Trial 98 finished with value: 0.9986646664438837 and parameters: {'kernel': 'poly', 'C': 0.006136284513685628, 'gamma': 0.00012293364777858577, 'epsilon': 0.0012579647930884487}. Best is trial 75 with value: 0.14524980186819436.
[I 2024-12-04 00:05:58,092] Trial 101 finished with value: 327.0446399067282 and parameters: {'kernel': 'sigmoid', 'C': 45.89631420002502, 'gamma': 0.0050431483328286, 'epsilon': 0.005345392843196175}. Best is trial 75 with value: 0.14524980186819436.
[I 2024-12-04 00:05:58,627] Trial 94 finished with value: 0.14722497903525744 and parameters: {'kernel': 'rbf', 'C': 38.38584964542713, 'gamma': 0.01675043474188608, 'epsilon': 0.006709375960389713}. Best is trial 75 with value: 0.14524980186819436.
[I 2024-12-04 00:05:58,664] Trial 100 finished with value: 0.14799838714212613 and parameters: {'kernel': 'rbf', 'C': 34.30442273822552, 'gamma': 0.012269403691434944, 'epsilon': 0.001030708594042349}. Best is trial 75 with value: 0.14524980186819436.
[I 2024-12-04 00:05:58,808] Trial 49 finished with value: 0.3517533474337317 and parameters: {'kernel': 'linear', 'C': 7.691235667217068, 'gamma': 0.04943428739564864, 'epsilon': 0.006444047322568328}. Best is trial 75 with value: 0.14524980186819436.
[I 2024-12-04 00:05:59,247] Trial 103 finished with value: 0.17798784160287423 and parameters: {'kernel': 'rbf', 'C': 94.0038309829029, 'gamma': 0.003352378510162416, 'epsilon': 0.003466609657364801}. Best is trial 75 with value: 0.14524980186819436.
[I 2024-12-04 00:05:59,527] Trial 102 finished with value: 0.29154589517847695 and parameters: {'kernel': 'rbf', 'C': 8.470773916615466, 'gamma': 0.003380393953950636, 'epsilon': 0.002160668537847097}. Best is trial 75 with value: 0.14524980186819436.
[I 2024-12-04 00:05:59,587] Trial 95 finished with value: 0.16157933994535092 and parameters: {'kernel': 'rbf', 'C': 77.3496998432958, 'gamma': 0.004905410527134908, 'epsilon': 0.001132504783488354}. Best is trial 75 with value: 0.14524980186819436.
[I 2024-12-04 00:06:00,254] Trial 104 finished with value: 0.14510753309086602 and parameters: {'kernel': 'rbf', 'C': 51.24403984004056, 'gamma': 0.011317585019063506, 'epsilon': 0.01750945844360071}. Best is trial 104 with value: 0.14510753309086602.
[I 2024-12-04 00:06:01,016] Trial 99 finished with value: 0.14760720409095637 and parameters: {'kernel': 'rbf', 'C': 71.72309456168999, 'gamma': 0.012469267445521402, 'epsilon': 0.004760126764199469}. Best is trial 104 with value: 0.14510753309086602.
[I 2024-12-04 00:06:01,033] Trial 105 finished with value: 0.15682119998591204 and parameters: {'kernel': 'rbf', 'C': 98.51206359930755, 'gamma': 0.012479247103147803, 'epsilon': 0.04135153998168184}. Best is trial 104 with value: 0.14510753309086602.
[I 2024-12-04 00:06:01,033] Trial 107 finished with value: 0.19458139783637138 and parameters: {'kernel': 'rbf', 'C': 96.84487949455601, 'gamma': 0.002600692543442255, 'epsilon': 0.009383478281754315}. Best is trial 104 with value: 0.14510753309086602.
[I 2024-12-04 00:06:01,169] Trial 112 finished with value: 0.19277128065312568 and parameters: {'kernel': 'rbf', 'C': 50.75969300380473, 'gamma': 0.004333071203209862, 'epsilon': 0.00743240355969433}. Best is trial 104 with value: 0.14510753309086602.
[I 2024-12-04 00:06:01,491] Trial 96 finished with value: 0.16000884738488044 and parameters: {'kernel': 'rbf', 'C': 77.71841455782004, 'gamma': 0.015476288875689147, 'epsilon': 0.0029330941941815565}. Best is trial 104 with value: 0.14510753309086602.
[I 2024-12-04 00:06:01,537] Trial 106 finished with value: 0.16735345982253647 and parameters: {'kernel': 'rbf', 'C': 60.424138288129015, 'gamma': 0.021539984830628224, 'epsilon': 0.0041613504889250015}. Best is trial 104 with value: 0.14510753309086602.
[I 2024-12-04 00:06:01,743] Trial 116 finished with value: 0.5295971333781869 and parameters: {'kernel': 'linear', 'C': 0.008594546611760666, 'gamma': 0.9775078061072117, 'epsilon': 0.0010311806287647799}. Best is trial 104 with value: 0.14510753309086602.
[I 2024-12-04 00:06:01,908] Trial 113 finished with value: 48.232623106706214 and parameters: {'kernel': 'sigmoid', 'C': 37.34037134471129, 'gamma': 0.0016757636508260211, 'epsilon': 0.0013918050138694046}. Best is trial 104 with value: 0.14510753309086602.
[I 2024-12-04 00:06:02,114] Trial 111 finished with value: 0.7728556230406891 and parameters: {'kernel': 'sigmoid', 'C': 2.7426137509892716, 'gamma': 0.0001239406922663352, 'epsilon': 0.9535042692227845}. Best is trial 104 with value: 0.14510753309086602.
[I 2024-12-04 00:06:02,185] Trial 110 finished with value: 0.27200031837999655 and parameters: {'kernel': 'rbf', 'C': 10.385761142449056, 'gamma': 0.0042044198483744515, 'epsilon': 0.0010068894097117523}. Best is trial 104 with value: 0.14510753309086602.
[I 2024-12-04 00:06:03,915] Trial 122 finished with value: 1705.6824701446603 and parameters: {'kernel': 'sigmoid', 'C': 61.64010738703307, 'gamma': 0.2991702850842977, 'epsilon': 0.3660458873107608}. Best is trial 108 with value: 0.1445053319110521.
[I 2024-12-04 00:06:04,101] Trial 109 finished with value: 0.6360722156642369 and parameters: {'kernel': 'linear', 'C': 0.0010869266847256234, 'gamma': 0.0003319311190015352, 'epsilon': 0.07060506146018122}. Best is trial 108 with value: 0.1445053319110521.
[I 2024-12-04 00:06:04,101] Trial 108 finished with value: 0.1445053319110521 and parameters: {'kernel': 'rbf', 'C': 60.688606766151246, 'gamma': 0.011694114188217192, 'epsilon': 0.023708700711429727}. Best is trial 108 with value: 0.1445053319110521.
[I 2024-12-04 00:06:04,452] Trial 121 finished with value: 0.1483602536946126 and parameters: {'kernel': 'rbf', 'C': 65.08383261177461, 'gamma': 0.012181038503255949, 'epsilon': 0.008989523375053094}. Best is trial 108 with value: 0.1445053319110521.
[I 2024-12-04 00:06:04,457] Trial 128 finished with value: 0.495730600617491 and parameters: {'kernel': 'linear', 'C': 0.07998315641893189, 'gamma': 0.029123596776339078, 'epsilon': 0.9587368281175779}. Best is trial 108 with value: 0.1445053319110521.
[I 2024-12-04 00:06:05,527] Trial 115 finished with value: 0.17093826902335515 and parameters: {'kernel': 'rbf', 'C': 72.01018541094751, 'gamma': 0.019038153465622498, 'epsilon': 0.09229676939306071}. Best is trial 108 with value: 0.1445053319110521.
[I 2024-12-04 00:06:05,658] Trial 123 finished with value: 0.2159757667702742 and parameters: {'kernel': 'rbf', 'C': 19.718557608353862, 'gamma': 0.007066815848381791, 'epsilon': 0.004634555379343359}. Best is trial 108 with value: 0.1445053319110521.
[I 2024-12-04 00:06:05,659] Trial 119 finished with value: 0.16448959370314864 and parameters: {'kernel': 'rbf', 'C': 69.89414721112126, 'gamma': 0.019318924461122725, 'epsilon': 0.00899020325283349}. Best is trial 108 with value: 0.1445053319110521.
[I 2024-12-04 00:06:05,932] Trial 130 finished with value: 0.9758062324380273 and parameters: {'kernel': 'rbf', 'C': 0.003943927492371752, 'gamma': 0.0011876535089918275, 'epsilon': 0.008815191017687005}. Best is trial 108 with value: 0.1445053319110521.
[I 2024-12-04 00:06:06,168] Trial 124 finished with value: 0.16596283075158744 and parameters: {'kernel': 'rbf', 'C': 71.48842339958412, 'gamma': 0.018700496952888383, 'epsilon': 0.0025243681555157}. Best is trial 108 with value: 0.1445053319110521.
[I 2024-12-04 00:06:06,260] Trial 129 finished with value: 0.16045886400503676 and parameters: {'kernel': 'rbf', 'C': 62.51015658806258, 'gamma': 0.005745837841013741, 'epsilon': 0.0136665520830987}. Best is trial 108 with value: 0.1445053319110521.
[I 2024-12-04 00:06:06,487] Trial 126 finished with value: 0.16905628811830223 and parameters: {'kernel': 'rbf', 'C': 18.86473242686637, 'gamma': 0.012755272747510772, 'epsilon': 0.013470910413754358}. Best is trial 108 with value: 0.1445053319110521.
[I 2024-12-04 00:06:06,584] Trial 131 finished with value: 0.47421190473160213 and parameters: {'kernel': 'rbf', 'C': 3.3645720468524694, 'gamma': 0.0009523783885722719, 'epsilon': 0.04008705204988985}. Best is trial 108 with value: 0.1445053319110521.
[I 2024-12-04 00:06:06,841] Trial 125 finished with value: 0.17610537119462102 and parameters: {'kernel': 'rbf', 'C': 17.744926312756487, 'gamma': 0.036963864612148754, 'epsilon': 0.028122350658945635}. Best is trial 108 with value: 0.1445053319110521.
[I 2024-12-04 00:06:06,874] Trial 33 finished with value: 0.5288861300270574 and parameters: {'kernel': 'poly', 'C': 4.20117626773278, 'gamma': 0.08472998647608508, 'epsilon': 0.43562024667210253}. Best is trial 108 with value: 0.1445053319110521.
[I 2024-12-04 00:06:06,959] Trial 134 finished with value: 0.1450424984891497 and parameters: {'kernel': 'rbf', 'C': 81.50314875037631, 'gamma': 0.007324490119408478, 'epsilon': 0.012605814461920706}. Best is trial 108 with value: 0.1445053319110521.
[I 2024-12-04 00:06:07,262] Trial 133 finished with value: 0.1685438296986446 and parameters: {'kernel': 'rbf', 'C': 81.77279688414282, 'gamma': 0.0047376189574495145, 'epsilon': 0.052792122197430416}. Best is trial 108 with value: 0.1445053319110521.
[I 2024-12-04 00:06:07,314] Trial 120 finished with value: 0.18925077264677795 and parameters: {'kernel': 'rbf', 'C': 81.8222829135753, 'gamma': 0.03779850733801616, 'epsilon': 0.004521726719333502}. Best is trial 108 with value: 0.1445053319110521.
[I 2024-12-04 00:06:07,369] Trial 139 finished with value: 1.9173570571428848 and parameters: {'kernel': 'sigmoid', 'C': 0.06839125900665138, 'gamma': 0.4458857137191924, 'epsilon': 0.918011566519823}. Best is trial 108 with value: 0.1445053319110521.
[I 2024-12-04 00:06:07,388] Trial 135 finished with value: 0.47950987846877346 and parameters: {'kernel': 'linear', 'C': 0.014541076626800722, 'gamma': 0.03427929813893445, 'epsilon': 0.009370000780832104}. Best is trial 108 with value: 0.1445053319110521.
[I 2024-12-04 00:06:07,455] Trial 132 finished with value: 0.1506769102144473 and parameters: {'kernel': 'rbf', 'C': 25.04926853881137, 'gamma': 0.014932310276877882, 'epsilon': 0.044637484233732656}. Best is trial 108 with value: 0.1445053319110521.
[I 2024-12-04 00:06:08,750] Trial 138 finished with value: 0.17276604855609448 and parameters: {'kernel': 'rbf', 'C': 82.31403106657552, 'gamma': 0.003837272211892805, 'epsilon': 0.023091707197551103}. Best is trial 108 with value: 0.1445053319110521.
[I 2024-12-04 00:06:09,185] Trial 137 finished with value: 0.15653898715277642 and parameters: {'kernel': 'rbf', 'C': 89.59943856491964, 'gamma': 0.011990055127298118, 'epsilon': 0.044440162965144844}. Best is trial 108 with value: 0.1445053319110521.
[I 2024-12-04 00:06:09,231] Trial 136 finished with value: 0.9664864324346887 and parameters: {'kernel': 'poly', 'C': 0.002280841476624202, 'gamma': 0.002660437180880128, 'epsilon': 0.05095446268399228}. Best is trial 108 with value: 0.1445053319110521.
[I 2024-12-04 00:06:09,868] Trial 140 finished with value: 0.249397483131754 and parameters: {'kernel': 'rbf', 'C': 7.956381023527682, 'gamma': 0.009084970317925364, 'epsilon': 0.010668677784318247}. Best is trial 108 with value: 0.1445053319110521.
[I 2024-12-04 00:06:10,322] Trial 146 finished with value: 0.9874974548110457 and parameters: {'kernel': 'rbf', 'C': 0.004255285929959857, 'gamma': 0.5757526464655037, 'epsilon': 0.029110570148963604}. Best is trial 108 with value: 0.1445053319110521.
[I 2024-12-04 00:06:10,324] Trial 144 finished with value: 0.5191612289401096 and parameters: {'kernel': 'rbf', 'C': 0.201425298937083, 'gamma': 0.0074240660983423135, 'epsilon': 0.08561877708238402}. Best is trial 108 with value: 0.1445053319110521.
[I 2024-12-04 00:06:10,330] Trial 143 finished with value: 0.14707885135939142 and parameters: {'kernel': 'rbf', 'C': 28.797891806795036, 'gamma': 0.015246001730622231, 'epsilon': 0.008908603122361337}. Best is trial 108 with value: 0.1445053319110521.
[I 2024-12-04 00:06:10,660] Trial 141 finished with value: 0.1757309874963762 and parameters: {'kernel': 'rbf', 'C': 99.72842471862826, 'gamma': 0.025341517774012362, 'epsilon': 0.016607419960566833}. Best is trial 108 with value: 0.1445053319110521.
[I 2024-12-04 00:06:10,717] Trial 147 finished with value: 0.8239795452183237 and parameters: {'kernel': 'poly', 'C': 73.88806517450978, 'gamma': 0.0016265431622471721, 'epsilon': 0.010153354855606339}. Best is trial 108 with value: 0.1445053319110521.
[I 2024-12-04 00:06:10,719] Trial 142 finished with value: 0.27987529373498427 and parameters: {'kernel': 'rbf', 'C': 8.054180794293563, 'gamma': 0.008209746106979485, 'epsilon': 0.23997255125739966}. Best is trial 108 with value: 0.1445053319110521.
[I 2024-12-04 00:06:10,846] Trial 151 finished with value: 0.2111463445768431 and parameters: {'kernel': 'rbf', 'C': 12.440786559176152, 'gamma': 0.01034204385644883, 'epsilon': 0.030486478037631527}. Best is trial 108 with value: 0.1445053319110521.
[I 2024-12-04 00:06:11,173] Trial 150 finished with value: 33.68257010584623 and parameters: {'kernel': 'sigmoid', 'C': 12.780844489293681, 'gamma': 0.0025101324710652792, 'epsilon': 0.03516562991638957}. Best is trial 108 with value: 0.1445053319110521.
[I 2024-12-04 00:06:11,990] Trial 155 finished with value: 0.21800966081146844 and parameters: {'kernel': 'rbf', 'C': 3.6739011243993276, 'gamma': 0.025020269843749117, 'epsilon': 0.08622324908444849}. Best is trial 108 with value: 0.1445053319110521.
[I 2024-12-04 00:06:12,383] Trial 152 finished with value: 0.20679340835274962 and parameters: {'kernel': 'rbf', 'C': 5.516504940863706, 'gamma': 0.020071503534068676, 'epsilon': 0.08871513960587873}. Best is trial 108 with value: 0.1445053319110521.
[I 2024-12-04 00:06:12,470] Trial 148 finished with value: 0.2286581248322549 and parameters: {'kernel': 'rbf', 'C': 7.497212412325744, 'gamma': 0.012502319351840175, 'epsilon': 0.0075814380428926185}. Best is trial 108 with value: 0.1445053319110521.
[I 2024-12-04 00:06:13,143] Trial 154 finished with value: 0.18941009256592 and parameters: {'kernel': 'rbf', 'C': 8.050343710024999, 'gamma': 0.05114373565610243, 'epsilon': 0.005599936823894734}. Best is trial 108 with value: 0.1445053319110521.
