[I 2024-12-04 15:05:18,337] Trial 1050 finished with value: 0.4883033211468651 and parameters: {'kernel_type': 'Matern', 'length_scale': 228.6293815039775, 'noise_level': 0.7411523216400082, 'constant_value': 0.6376760715385232, 'nu': 0.5}. Best is trial 386 with value: 0.4872991004520934.
[I 2024-12-04 15:05:18,362] Trial 1053 finished with value: 0.4883034130391318 and parameters: {'kernel_type': 'Matern', 'length_scale': 417.56601561305354, 'noise_level': 0.9397670394430444, 'constant_value': 3532.5833730990093, 'nu': 0.5}. Best is trial 386 with value: 0.4872991004520934.
[I 2024-12-04 15:05:18,491] Trial 1056 finished with value: 0.4883034251623159 and parameters: {'kernel_type': 'Matern', 'length_scale': 40977.197633214644, 'noise_level': 0.02228911233479, 'constant_value': 2288.5295748285757, 'nu': 0.5}. Best is trial 386 with value: 0.4872991004520934.
[I 2024-12-04 15:05:18,720] Trial 1052 finished with value: 0.48830338861399425 and parameters: {'kernel_type': 'Matern', 'length_scale': 21.563714502924217, 'noise_level': 0.7322033041998859, 'constant_value': 1455.3270677826902, 'nu': 0.5}. Best is trial 386 with value: 0.4872991004520934.
[I 2024-12-04 15:05:18,725] Trial 1054 finished with value: 0.4883034128500332 and parameters: {'kernel_type': 'Matern', 'length_scale': 720.2270567311189, 'noise_level': 0.017284570953845176, 'constant_value': 13551.562643063504, 'nu': 0.5}. Best is trial 386 with value: 0.4872991004520934.
[I 2024-12-04 15:05:20,380] Trial 1051 finished with value: 0.4883034370614204 and parameters: {'kernel_type': 'Matern', 'length_scale': 67241.62389001739, 'noise_level': 0.8333504649427971, 'constant_value': 3428.98498736753, 'nu': 0.5}. Best is trial 386 with value: 0.4872991004520934.
[I 2024-12-04 15:05:20,933] Trial 1055 finished with value: 1.2401112325176429 and parameters: {'kernel_type': 'Matern', 'length_scale': 3178.355549388683, 'noise_level': 0.0037066604632938443, 'constant_value': 15.63081238002891, 'nu': 0.5}. Best is trial 386 with value: 0.4872991004520934.
[I 2024-12-04 15:05:22,260] Trial 1048 finished with value: 1.2401112326647976 and parameters: {'kernel_type': 'RBF', 'length_scale': 90865.03627125948, 'noise_level': 0.005425074610227106, 'constant_value': 9172.568495344296, 'nu': 0.5}. Best is trial 386 with value: 0.4872991004520934.
[I 2024-12-04 15:05:23,022] Trial 1064 finished with value: 0.48830341591346726 and parameters: {'kernel_type': 'Matern', 'length_scale': 31.68606685004329, 'noise_level': 0.6386287570125485, 'constant_value': 26935.835800272394, 'nu': 0.5}. Best is trial 386 with value: 0.4872991004520934.
[I 2024-12-04 15:05:24,213] Trial 1063 finished with value: 0.48830338373663085 and parameters: {'kernel_type': 'Matern', 'length_scale': 63400.13484436932, 'noise_level': 0.7849065490866515, 'constant_value': 10577.652630634655, 'nu': 0.5}. Best is trial 386 with value: 0.4872991004520934.
[I 2024-12-04 15:05:24,331] Trial 1062 finished with value: 1.2614547953941473 and parameters: {'kernel_type': 'Matern', 'length_scale': 237.5299497246347, 'noise_level': 0.019294171737357323, 'constant_value': 77682.39360530958, 'nu': 0.5}. Best is trial 386 with value: 0.4872991004520934.
[I 2024-12-04 15:05:24,465] Trial 1066 finished with value: 0.48830337065782126 and parameters: {'kernel_type': 'Matern', 'length_scale': 444.6916336921657, 'noise_level': 0.016384465502647376, 'constant_value': 1725.3150449721766, 'nu': 0.5}. Best is trial 386 with value: 0.4872991004520934.
[I 2024-12-04 15:05:24,526] Trial 1068 finished with value: 1.2401112324896084 and parameters: {'kernel_type': 'Matern', 'length_scale': 21508.6324779608, 'noise_level': 0.008752457273802004, 'constant_value': 29.73706105471305, 'nu': 0.5}. Best is trial 386 with value: 0.4872991004520934.
[I 2024-12-04 15:05:24,529] Trial 1060 finished with value: 0.4883034209857814 and parameters: {'kernel_type': 'Matern', 'length_scale': 2347.0681092756236, 'noise_level': 0.9859629329789332, 'constant_value': 5223.219989467318, 'nu': 0.5}. Best is trial 386 with value: 0.4872991004520934.
[I 2024-12-04 15:05:24,688] Trial 1065 finished with value: 0.48830339758702707 and parameters: {'kernel_type': 'Matern', 'length_scale': 391.88103889080764, 'noise_level': 0.6739877238926556, 'constant_value': 45.70929975989833, 'nu': 0.5}. Best is trial 386 with value: 0.4872991004520934.
[I 2024-12-04 15:05:24,878] Trial 1059 finished with value: 0.4883034166360196 and parameters: {'kernel_type': 'Matern', 'length_scale': 10490.119260605828, 'noise_level': 0.1082074951622751, 'constant_value': 98574.32682756433, 'nu': 0.5}. Best is trial 386 with value: 0.4872991004520934.
[I 2024-12-04 15:05:28,373] Trial 1057 finished with value: 0.4883034472458357 and parameters: {'kernel_type': 'Matern', 'length_scale': 5580.3549395683485, 'noise_level': 0.16842372680215806, 'constant_value': 0.032418608200721684, 'nu': 0.5}. Best is trial 386 with value: 0.4872991004520934.
[I 2024-12-04 15:05:28,524] Trial 1073 finished with value: 1.2401112319614174 and parameters: {'kernel_type': 'RBF', 'length_scale': 2.2634688410805107e-05, 'noise_level': 0.00022900853523378194, 'constant_value': 6.406085917729957e-06, 'nu': 1.5}. Best is trial 386 with value: 0.4872991004520934.
[I 2024-12-04 15:05:28,552] Trial 1074 finished with value: 0.48830341823976037 and parameters: {'kernel_type': 'Matern', 'length_scale': 8218.58411947909, 'noise_level': 0.013144702166310553, 'constant_value': 445.06355731434354, 'nu': 0.5}. Best is trial 386 with value: 0.4872991004520934.
[I 2024-12-04 15:05:28,836] Trial 1067 finished with value: 0.6443853571857497 and parameters: {'kernel_type': 'RBF', 'length_scale': 549.7975137337929, 'noise_level': 0.14135888621712267, 'constant_value': 1966.164343706126, 'nu': 0.5}. Best is trial 386 with value: 0.4872991004520934.
[I 2024-12-04 15:05:29,225] Trial 1077 finished with value: 1.2401112325314423 and parameters: {'kernel_type': 'Matern', 'length_scale': 87324.09311917893, 'noise_level': 0.00016989452057353043, 'constant_value': 1210.264517307709, 'nu': 0.5}. Best is trial 386 with value: 0.4872991004520934.
[I 2024-12-04 15:05:30,313] Trial 1070 finished with value: 0.48830341706649466 and parameters: {'kernel_type': 'Matern', 'length_scale': 10.624845857152495, 'noise_level': 0.9046311401022408, 'constant_value': 3.365875867089109, 'nu': 0.5}. Best is trial 386 with value: 0.4872991004520934.
[I 2024-12-04 15:05:30,837] Trial 1069 finished with value: 0.4883034172216644 and parameters: {'kernel_type': 'Matern', 'length_scale': 45.44480589742446, 'noise_level': 0.9608642732803113, 'constant_value': 14447.813044699265, 'nu': 0.5}. Best is trial 386 with value: 0.4872991004520934.
[I 2024-12-04 15:05:31,609] Trial 1071 finished with value: 0.4883033985934503 and parameters: {'kernel_type': 'Matern', 'length_scale': 83606.5127271586, 'noise_level': 0.00896758320796992, 'constant_value': 1500.770167775304, 'nu': 0.5}. Best is trial 386 with value: 0.4872991004520934.
[I 2024-12-04 15:05:33,535] Trial 1072 finished with value: 1.2401112325798487 and parameters: {'kernel_type': 'RBF', 'length_scale': 0.215112394062443, 'noise_level': 2.7778135462922953e-08, 'constant_value': 0.02754581873472101, 'nu': 0.5}. Best is trial 386 with value: 0.4872991004520934.
[I 2024-12-04 15:05:33,543] Trial 1076 finished with value: 0.4883034211143155 and parameters: {'kernel_type': 'Matern', 'length_scale': 23.770232010417878, 'noise_level': 0.028341035263801852, 'constant_value': 14.568933495927167, 'nu': 0.5}. Best is trial 386 with value: 0.4872991004520934.
[I 2024-12-04 15:05:33,639] Trial 1061 finished with value: 0.48830342499689205 and parameters: {'kernel_type': 'Matern', 'length_scale': 4397.470628932023, 'noise_level': 0.020601813771620986, 'constant_value': 2024.9054766427726, 'nu': 0.5}. Best is trial 386 with value: 0.4872991004520934.
[I 2024-12-04 15:05:33,998] Trial 1078 finished with value: 0.48830341125561405 and parameters: {'kernel_type': 'Matern', 'length_scale': 2480.9199761928485, 'noise_level': 0.010192781128818959, 'constant_value': 52039.88543423236, 'nu': 0.5}. Best is trial 386 with value: 0.4872991004520934.
[I 2024-12-04 15:05:35,328] Trial 1075 finished with value: 0.4883034190659962 and parameters: {'kernel_type': 'Matern', 'length_scale': 92043.08071573754, 'noise_level': 0.8733021465276406, 'constant_value': 2077.6288392062347, 'nu': 0.5}. Best is trial 386 with value: 0.4872991004520934.
[I 2024-12-04 15:05:36,121] Trial 1080 finished with value: 0.48830340911350856 and parameters: {'kernel_type': 'Matern', 'length_scale': 808.9448835538922, 'noise_level': 0.9380797216493018, 'constant_value': 1017.7499232891369, 'nu': 0.5}. Best is trial 386 with value: 0.4872991004520934.
[I 2024-12-04 15:05:36,469] Trial 1081 finished with value: 1.2614547976352497 and parameters: {'kernel_type': 'RBF', 'length_scale': 86142.98644516229, 'noise_level': 0.15671979500182323, 'constant_value': 17.331611981235604, 'nu': 0.5}. Best is trial 386 with value: 0.4872991004520934.
[I 2024-12-04 15:05:36,538] Trial 1082 finished with value: 0.4883034178618988 and parameters: {'kernel_type': 'Matern', 'length_scale': 756.7884661176856, 'noise_level': 0.07912066439971964, 'constant_value': 49818.606484482225, 'nu': 0.5}. Best is trial 386 with value: 0.4872991004520934.
[I 2024-12-04 15:05:37,690] Trial 1083 finished with value: 0.48830345722782387 and parameters: {'kernel_type': 'Matern', 'length_scale': 166.21684625997665, 'noise_level': 0.8222859080833784, 'constant_value': 159.56553107646454, 'nu': 0.5}. Best is trial 386 with value: 0.4872991004520934.
[I 2024-12-04 15:05:38,861] Trial 1085 finished with value: 0.4883034015065044 and parameters: {'kernel_type': 'Matern', 'length_scale': 94573.63373511701, 'noise_level': 0.895444327926214, 'constant_value': 2223.4944131651646, 'nu': 0.5}. Best is trial 386 with value: 0.4872991004520934.
[I 2024-12-04 15:05:39,086] Trial 1093 finished with value: 0.48832352190468203 and parameters: {'kernel_type': 'Matern', 'length_scale': 123.97388669687525, 'noise_level': 0.02151527754769393, 'constant_value': 29.400330093794974, 'nu': 0.5}. Best is trial 386 with value: 0.4872991004520934.
[I 2024-12-04 15:05:39,821] Trial 1087 finished with value: 0.48830341890196327 and parameters: {'kernel_type': 'Matern', 'length_scale': 3673.2983610043934, 'noise_level': 0.3342026702603014, 'constant_value': 81573.57276497922, 'nu': 0.5}. Best is trial 386 with value: 0.4872991004520934.
[I 2024-12-04 15:05:40,603] Trial 1086 finished with value: 0.4883033792223232 and parameters: {'kernel_type': 'Matern', 'length_scale': 349.0802048186193, 'noise_level': 0.0325734407115955, 'constant_value': 1.0085364877771503, 'nu': 0.5}. Best is trial 386 with value: 0.4872991004520934.
[I 2024-12-04 15:05:41,029] Trial 1079 finished with value: 1.240111232585159 and parameters: {'kernel_type': 'RBF', 'length_scale': 11663.157361205689, 'noise_level': 2.2874496718341428e-08, 'constant_value': 10609.022817599416, 'nu': 2.5}. Best is trial 386 with value: 0.4872991004520934.
[I 2024-12-04 15:05:42,378] Trial 1084 finished with value: 1.2401112317007537 and parameters: {'kernel_type': 'Matern', 'length_scale': 48387.65131802151, 'noise_level': 0.01730567085412287, 'constant_value': 7320.486729345608, 'nu': 1.5}. Best is trial 386 with value: 0.4872991004520934.
[I 2024-12-04 15:05:42,388] Trial 1094 finished with value: 0.48830341579317016 and parameters: {'kernel_type': 'Matern', 'length_scale': 516.918289954371, 'noise_level': 0.8327802272779423, 'constant_value': 61.583345027570324, 'nu': 0.5}. Best is trial 386 with value: 0.4872991004520934.
[I 2024-12-04 15:05:42,941] Trial 1096 finished with value: 0.48830341602607513 and parameters: {'kernel_type': 'Matern', 'length_scale': 95849.91381961522, 'noise_level': 0.6573993792784806, 'constant_value': 93473.29445203175, 'nu': 0.5}. Best is trial 386 with value: 0.4872991004520934.
[I 2024-12-04 15:05:43,181] Trial 1090 finished with value: 0.48830341749459455 and parameters: {'kernel_type': 'Matern', 'length_scale': 48277.694925553995, 'noise_level': 0.009235200273994475, 'constant_value': 98732.86923409309, 'nu': 0.5}. Best is trial 386 with value: 0.4872991004520934.
[I 2024-12-04 15:05:43,976] Trial 1092 finished with value: 1.2401112325776604 and parameters: {'kernel_type': 'Matern', 'length_scale': 14.935358055953008, 'noise_level': 0.01334671656248836, 'constant_value': 0.0008444095103228579, 'nu': 0.5}. Best is trial 386 with value: 0.4872991004520934.
[I 2024-12-04 15:05:44,798] Trial 1100 finished with value: 0.4883031364687399 and parameters: {'kernel_type': 'Matern', 'length_scale': 4243.467747792728, 'noise_level': 0.012959135438096273, 'constant_value': 420.61620156558024, 'nu': 0.5}. Best is trial 386 with value: 0.4872991004520934.
[I 2024-12-04 15:05:45,162] Trial 1091 finished with value: 0.48830341587129406 and parameters: {'kernel_type': 'Matern', 'length_scale': 781.1915107202984, 'noise_level': 0.9346901413527755, 'constant_value': 1848.695258195588, 'nu': 0.5}. Best is trial 386 with value: 0.4872991004520934.
[I 2024-12-04 15:05:46,827] Trial 1089 finished with value: 0.5273055033229529 and parameters: {'kernel_type': 'Matern', 'length_scale': 156.12955907645156, 'noise_level': 0.04251565687507407, 'constant_value': 95854.84732858586, 'nu': 1.5}. Best is trial 386 with value: 0.4872991004520934.
[I 2024-12-04 15:05:46,832] Trial 1097 finished with value: 1.2614547950037807 and parameters: {'kernel_type': 'Matern', 'length_scale': 0.7265097710694792, 'noise_level': 0.025788618036104508, 'constant_value': 16.983747103082056, 'nu': 0.5}. Best is trial 386 with value: 0.4872991004520934.
[I 2024-12-04 15:05:47,519] Trial 1103 finished with value: 0.48830342020226625 and parameters: {'kernel_type': 'Matern', 'length_scale': 1460.6489087349876, 'noise_level': 0.3172900281012602, 'constant_value': 96991.33584565189, 'nu': 0.5}. Best is trial 386 with value: 0.4872991004520934.
[I 2024-12-04 15:05:49,107] Trial 1095 finished with value: 0.48830325531999413 and parameters: {'kernel_type': 'Matern', 'length_scale': 8317.65907666094, 'noise_level': 0.807410501536384, 'constant_value': 94856.07225649105, 'nu': 0.5}. Best is trial 386 with value: 0.4872991004520934.
[I 2024-12-04 15:05:50,553] Trial 1104 finished with value: 1.2401112325802588 and parameters: {'kernel_type': 'Matern', 'length_scale': 19917.809294563856, 'noise_level': 0.0004992932435141852, 'constant_value': 18.459393554187194, 'nu': 0.5}. Best is trial 386 with value: 0.4872991004520934.
[I 2024-12-04 15:05:51,439] Trial 1088 finished with value: 1.2401112326095003 and parameters: {'kernel_type': 'RBF', 'length_scale': 478.33429969431654, 'noise_level': 5.074256808996779e-05, 'constant_value': 14.927656531346768, 'nu': 0.5}. Best is trial 386 with value: 0.4872991004520934.
[I 2024-12-04 15:05:51,479] Trial 1102 finished with value: 0.4883034346199825 and parameters: {'kernel_type': 'Matern', 'length_scale': 1.0996148196394642, 'noise_level': 0.3183314397120152, 'constant_value': 11.644117659111465, 'nu': 0.5}. Best is trial 386 with value: 0.4872991004520934.
[I 2024-12-04 15:05:51,482] Trial 1098 finished with value: 1.2401112324935806 and parameters: {'kernel_type': 'Matern', 'length_scale': 9150.731013785824, 'noise_level': 0.014506827892878577, 'constant_value': 5.603499948482126, 'nu': 0.5}. Best is trial 386 with value: 0.4872991004520934.
[I 2024-12-04 15:05:51,641] Trial 1099 finished with value: 1.2614543702025727 and parameters: {'kernel_type': 'RBF', 'length_scale': 0.07852742211219332, 'noise_level': 1.4783639504342018e-07, 'constant_value': 36496.90201377852, 'nu': 0.5}. Best is trial 386 with value: 0.4872991004520934.
[I 2024-12-04 15:05:53,072] Trial 1101 finished with value: 1.240111232753236 and parameters: {'kernel_type': 'Matern', 'length_scale': 94923.4923415482, 'noise_level': 0.04739194362593892, 'constant_value': 0.7028304196095541, 'nu': 0.5}. Best is trial 386 with value: 0.4872991004520934.
[I 2024-12-04 15:05:54,131] Trial 1110 finished with value: 0.48830345725032426 and parameters: {'kernel_type': 'Matern', 'length_scale': 4951.220092955668, 'noise_level': 0.0025702766261990594, 'constant_value': 134.5200508383482, 'nu': 0.5}. Best is trial 386 with value: 0.4872991004520934.
[I 2024-12-04 15:05:54,308] Trial 1106 finished with value: 1.261454797632889 and parameters: {'kernel_type': 'Matern', 'length_scale': 12.803600537460479, 'noise_level': 4.330932228085064e-06, 'constant_value': 49.91170671164758, 'nu': 1.5}. Best is trial 386 with value: 0.4872991004520934.
[I 2024-12-04 15:05:54,375] Trial 1108 finished with value: 0.527305384666632 and parameters: {'kernel_type': 'Matern', 'length_scale': 317.72819373061674, 'noise_level': 0.1330760176834716, 'constant_value': 0.41075467313449404, 'nu': 1.5}. Best is trial 386 with value: 0.4872991004520934.
[I 2024-12-04 15:05:54,804] Trial 1109 finished with value: 1.2614547976352335 and parameters: {'kernel_type': 'RBF', 'length_scale': 24539.059348990722, 'noise_level': 0.05662205153033153, 'constant_value': 0.037490756818333824, 'nu': 0.5}. Best is trial 386 with value: 0.4872991004520934.
[I 2024-12-04 15:05:55,515] Trial 1111 finished with value: 0.48830309064912597 and parameters: {'kernel_type': 'Matern', 'length_scale': 64566.30612974347, 'noise_level': 0.03249090257002861, 'constant_value': 187.18760538795283, 'nu': 0.5}. Best is trial 386 with value: 0.4872991004520934.
[I 2024-12-04 15:05:55,956] Trial 1107 finished with value: 1.2401112325824726 and parameters: {'kernel_type': 'Matern', 'length_scale': 825.4727240113729, 'noise_level': 0.020967711095994934, 'constant_value': 1.2901570577609984, 'nu': 2.5}. Best is trial 386 with value: 0.4872991004520934.
[I 2024-12-04 15:05:55,964] Trial 1113 finished with value: 0.48830341889043 and parameters: {'kernel_type': 'Matern', 'length_scale': 159.3355714458136, 'noise_level': 0.01405683672157596, 'constant_value': 66.67573036308853, 'nu': 0.5}. Best is trial 386 with value: 0.4872991004520934.
[I 2024-12-04 15:05:56,266] Trial 1114 finished with value: 0.48830341986000786 and parameters: {'kernel_type': 'Matern', 'length_scale': 85099.0076494558, 'noise_level': 1.5247969827101768e-10, 'constant_value': 15280.50681956239, 'nu': 0.5}. Best is trial 386 with value: 0.4872991004520934.
[I 2024-12-04 15:05:56,391] Trial 1105 finished with value: 1.2401112325811152 and parameters: {'kernel_type': 'Matern', 'length_scale': 4070.9592749619587, 'noise_level': 0.005624678524012296, 'constant_value': 169.05722624191873, 'nu': 1.5}. Best is trial 386 with value: 0.4872991004520934.
[I 2024-12-04 15:05:57,201] Trial 1116 finished with value: 1.2401112272406196 and parameters: {'kernel_type': 'Matern', 'length_scale': 3.44257659118198e-05, 'noise_level': 2.1512412749164532e-07, 'constant_value': 1.76670626382424e-07, 'nu': 1.5}. Best is trial 386 with value: 0.4872991004520934.
[I 2024-12-04 15:05:57,890] Trial 1115 finished with value: 0.4883034239613647 and parameters: {'kernel_type': 'Matern', 'length_scale': 884.2662779278985, 'noise_level': 0.013302276023429196, 'constant_value': 7.032098332840324, 'nu': 0.5}. Best is trial 386 with value: 0.4872991004520934.
[I 2024-12-04 15:05:58,224] Trial 1119 finished with value: 0.4883035138225983 and parameters: {'kernel_type': 'Matern', 'length_scale': 1909.7933824593642, 'noise_level': 0.01808580408129984, 'constant_value': 749.8920653412281, 'nu': 0.5}. Best is trial 386 with value: 0.4872991004520934.
[I 2024-12-04 15:05:59,279] Trial 1117 finished with value: 0.4883035037185409 and parameters: {'kernel_type': 'Matern', 'length_scale': 4319.444447325101, 'noise_level': 0.08492128032840422, 'constant_value': 355.55914089234125, 'nu': 0.5}. Best is trial 386 with value: 0.4872991004520934.
[I 2024-12-04 15:06:01,607] Trial 1127 finished with value: 0.4883034211556053 and parameters: {'kernel_type': 'Matern', 'length_scale': 18672.535556830517, 'noise_level': 0.00027795582906680585, 'constant_value': 460.6505025117434, 'nu': 0.5}. Best is trial 386 with value: 0.4872991004520934.
[I 2024-12-04 15:06:02,478] Trial 1121 finished with value: 0.4883034212511021 and parameters: {'kernel_type': 'Matern', 'length_scale': 8558.653075366976, 'noise_level': 0.06580750907454677, 'constant_value': 7.973371568514898, 'nu': 0.5}. Best is trial 386 with value: 0.4872991004520934.
[I 2024-12-04 15:06:04,064] Trial 1126 finished with value: 0.48830342092103934 and parameters: {'kernel_type': 'Matern', 'length_scale': 25999.07674447791, 'noise_level': 0.0005423245280771325, 'constant_value': 542.3787069060662, 'nu': 0.5}. Best is trial 386 with value: 0.4872991004520934.
[I 2024-12-04 15:06:04,312] Trial 1123 finished with value: 1.240111232608625 and parameters: {'kernel_type': 'Matern', 'length_scale': 6294.4240188028925, 'noise_level': 0.011529597228454676, 'constant_value': 14.094617516327268, 'nu': 0.5}. Best is trial 386 with value: 0.4872991004520934.
[I 2024-12-04 15:06:05,168] Trial 1122 finished with value: 0.6443850448762337 and parameters: {'kernel_type': 'RBF', 'length_scale': 85.57842075204586, 'noise_level': 0.302082662979734, 'constant_value': 92427.20618125219, 'nu': 1.5}. Best is trial 386 with value: 0.4872991004520934.
[I 2024-12-04 15:06:05,406] Trial 1112 finished with value: 1.2614547976351516 and parameters: {'kernel_type': 'RBF', 'length_scale': 10322.073516474866, 'noise_level': 0.8059078316587646, 'constant_value': 0.04265278082384689, 'nu': 2.5}. Best is trial 386 with value: 0.4872991004520934.
[I 2024-12-04 15:06:07,421] Trial 1131 finished with value: 1.2614543702026897 and parameters: {'kernel_type': 'Matern', 'length_scale': 0.0003503014721647711, 'noise_level': 3.146291112916693e-08, 'constant_value': 191.05809764717307, 'nu': 2.5}. Best is trial 386 with value: 0.4872991004520934.
