[I 2024-12-04 13:13:10,226] Trial 1524 finished with value: 0.2461547239773381 and parameters: {'n_estimators': 1490, 'learning_rate': 0.09557476273278159, 'max_depth': 9, 'min_samples_split': 15, 'min_samples_leaf': 2, 'subsample': 0.6538952374306153, 'max_features': 'sqrt'}. Best is trial 1137 with value: 0.19687116000636118.
[I 2024-12-04 13:13:12,358] Trial 1526 finished with value: 0.2131108679417582 and parameters: {'n_estimators': 1471, 'learning_rate': 0.07499151071802644, 'max_depth': 11, 'min_samples_split': 17, 'min_samples_leaf': 1, 'subsample': 0.6899957994652469, 'max_features': 'sqrt'}. Best is trial 1137 with value: 0.19687116000636118.
[I 2024-12-04 13:13:17,197] Trial 1557 finished with value: 0.33137745638413996 and parameters: {'n_estimators': 313, 'learning_rate': 0.07374294332763909, 'max_depth': 11, 'min_samples_split': 4, 'min_samples_leaf': 6, 'subsample': 0.9992116836080633, 'max_features': 'sqrt'}. Best is trial 1137 with value: 0.19687116000636118.
[I 2024-12-04 13:13:19,289] Trial 1551 finished with value: 0.49537725934811755 and parameters: {'n_estimators': 644, 'learning_rate': 0.035994104253518296, 'max_depth': 4, 'min_samples_split': 20, 'min_samples_leaf': 5, 'subsample': 0.8137280701054834, 'max_features': 'log2'}. Best is trial 1137 with value: 0.19687116000636118.
[I 2024-12-04 13:13:21,714] Trial 1527 finished with value: 0.24720943139325066 and parameters: {'n_estimators': 1320, 'learning_rate': 0.07195794190763818, 'max_depth': 12, 'min_samples_split': 20, 'min_samples_leaf': 1, 'subsample': 0.7753091742947753, 'max_features': None}. Best is trial 1137 with value: 0.19687116000636118.
[I 2024-12-04 13:13:24,280] Trial 1538 finished with value: 0.2591457608458693 and parameters: {'n_estimators': 1191, 'learning_rate': 0.059837673316429904, 'max_depth': 10, 'min_samples_split': 17, 'min_samples_leaf': 1, 'subsample': 0.6070777648226795, 'max_features': 'log2'}. Best is trial 1137 with value: 0.19687116000636118.
[I 2024-12-04 13:13:27,341] Trial 1539 finished with value: 0.2367366857093221 and parameters: {'n_estimators': 1202, 'learning_rate': 0.0915655019151253, 'max_depth': 8, 'min_samples_split': 14, 'min_samples_leaf': 1, 'subsample': 0.6130789840969061, 'max_features': 'sqrt'}. Best is trial 1137 with value: 0.19687116000636118.
[I 2024-12-04 13:13:30,843] Trial 1529 finished with value: 0.29274558705762865 and parameters: {'n_estimators': 1454, 'learning_rate': 0.06555674640461427, 'max_depth': 11, 'min_samples_split': 14, 'min_samples_leaf': 2, 'subsample': 0.6109202545735231, 'max_features': None}. Best is trial 1137 with value: 0.19687116000636118.
[I 2024-12-04 13:13:33,105] Trial 1534 finished with value: 0.23385084500253644 and parameters: {'n_estimators': 1437, 'learning_rate': 0.09495106712326397, 'max_depth': 9, 'min_samples_split': 17, 'min_samples_leaf': 1, 'subsample': 0.6626432791945286, 'max_features': 'sqrt'}. Best is trial 1137 with value: 0.19687116000636118.
[I 2024-12-04 13:13:36,530] Trial 1536 finished with value: 0.2262138726267257 and parameters: {'n_estimators': 1456, 'learning_rate': 0.09812306100365019, 'max_depth': 12, 'min_samples_split': 14, 'min_samples_leaf': 1, 'subsample': 0.6694852649875443, 'max_features': 'sqrt'}. Best is trial 1137 with value: 0.19687116000636118.
[I 2024-12-04 13:13:41,070] Trial 1544 finished with value: 0.22619116178032644 and parameters: {'n_estimators': 1233, 'learning_rate': 0.05412888781097618, 'max_depth': 11, 'min_samples_split': 17, 'min_samples_leaf': 1, 'subsample': 0.6533354869765301, 'max_features': 'sqrt'}. Best is trial 1137 with value: 0.19687116000636118.
[I 2024-12-04 13:13:42,076] Trial 1542 finished with value: 0.21886375224545127 and parameters: {'n_estimators': 1304, 'learning_rate': 0.07495911079134845, 'max_depth': 12, 'min_samples_split': 19, 'min_samples_leaf': 1, 'subsample': 0.8064745601823962, 'max_features': 'sqrt'}. Best is trial 1137 with value: 0.19687116000636118.
[I 2024-12-04 13:13:43,771] Trial 1543 finished with value: 0.24248839498525948 and parameters: {'n_estimators': 1295, 'learning_rate': 0.06351517578272255, 'max_depth': 10, 'min_samples_split': 16, 'min_samples_leaf': 2, 'subsample': 0.6099793794262871, 'max_features': 'sqrt'}. Best is trial 1137 with value: 0.19687116000636118.
[I 2024-12-04 13:13:47,899] Trial 1541 finished with value: 0.2114882056468079 and parameters: {'n_estimators': 1419, 'learning_rate': 0.06452801200585985, 'max_depth': 10, 'min_samples_split': 17, 'min_samples_leaf': 1, 'subsample': 0.7139350783574057, 'max_features': 'sqrt'}. Best is trial 1137 with value: 0.19687116000636118.
[I 2024-12-04 13:13:51,723] Trial 1540 finished with value: 0.22818985228917743 and parameters: {'n_estimators': 1488, 'learning_rate': 0.08090919285919572, 'max_depth': 10, 'min_samples_split': 16, 'min_samples_leaf': 2, 'subsample': 0.6382654862651451, 'max_features': 'sqrt'}. Best is trial 1137 with value: 0.19687116000636118.
[I 2024-12-04 13:13:55,237] Trial 1546 finished with value: 0.3090551778479513 and parameters: {'n_estimators': 1410, 'learning_rate': 0.017402424379218056, 'max_depth': 6, 'min_samples_split': 20, 'min_samples_leaf': 2, 'subsample': 0.8061461592063475, 'max_features': 'sqrt'}. Best is trial 1137 with value: 0.19687116000636118.
[I 2024-12-04 13:13:58,602] Trial 1575 finished with value: 0.8421301386510806 and parameters: {'n_estimators': 171, 'learning_rate': 0.02880648407332997, 'max_depth': 5, 'min_samples_split': 7, 'min_samples_leaf': 9, 'subsample': 0.6711303821451454, 'max_features': 'log2'}. Best is trial 1137 with value: 0.19687116000636118.
[I 2024-12-04 13:13:58,709] Trial 1545 finished with value: 0.2159458916626167 and parameters: {'n_estimators': 1494, 'learning_rate': 0.0897484418220207, 'max_depth': 9, 'min_samples_split': 18, 'min_samples_leaf': 1, 'subsample': 0.6374616768947208, 'max_features': 'sqrt'}. Best is trial 1137 with value: 0.19687116000636118.
[I 2024-12-04 13:13:59,818] Trial 1548 finished with value: 0.24881901141475937 and parameters: {'n_estimators': 1385, 'learning_rate': 0.0954884927397276, 'max_depth': 12, 'min_samples_split': 20, 'min_samples_leaf': 3, 'subsample': 0.7356391919679933, 'max_features': 'sqrt'}. Best is trial 1137 with value: 0.19687116000636118.
[I 2024-12-04 13:13:59,825] Trial 1547 finished with value: 0.2266068838812773 and parameters: {'n_estimators': 1435, 'learning_rate': 0.09543595990907856, 'max_depth': 10, 'min_samples_split': 15, 'min_samples_leaf': 2, 'subsample': 0.6094590032434587, 'max_features': 'sqrt'}. Best is trial 1137 with value: 0.19687116000636118.
[I 2024-12-04 13:14:01,787] Trial 1562 finished with value: 0.6790128117996095 and parameters: {'n_estimators': 854, 'learning_rate': 0.011218788435288488, 'max_depth': 7, 'min_samples_split': 13, 'min_samples_leaf': 8, 'subsample': 0.8747290807023202, 'max_features': 'log2'}. Best is trial 1137 with value: 0.19687116000636118.
[I 2024-12-04 13:14:02,408] Trial 1550 finished with value: 0.2338593501440769 and parameters: {'n_estimators': 1361, 'learning_rate': 0.09886274812816159, 'max_depth': 12, 'min_samples_split': 20, 'min_samples_leaf': 1, 'subsample': 0.7598232858720071, 'max_features': 'sqrt'}. Best is trial 1137 with value: 0.19687116000636118.
[I 2024-12-04 13:14:05,673] Trial 1549 finished with value: 0.23086845172399253 and parameters: {'n_estimators': 1411, 'learning_rate': 0.062476750412194255, 'max_depth': 12, 'min_samples_split': 20, 'min_samples_leaf': 1, 'subsample': 0.7210883271096268, 'max_features': 'sqrt'}. Best is trial 1137 with value: 0.19687116000636118.
[I 2024-12-04 13:14:08,492] Trial 1555 finished with value: 0.21372500993388024 and parameters: {'n_estimators': 1153, 'learning_rate': 0.07036501210099695, 'max_depth': 11, 'min_samples_split': 15, 'min_samples_leaf': 1, 'subsample': 0.6033319461405264, 'max_features': 'sqrt'}. Best is trial 1137 with value: 0.19687116000636118.
[I 2024-12-04 13:14:13,258] Trial 1552 finished with value: 0.21590783752405998 and parameters: {'n_estimators': 1430, 'learning_rate': 0.09179469886137766, 'max_depth': 10, 'min_samples_split': 19, 'min_samples_leaf': 1, 'subsample': 0.7098451906442973, 'max_features': 'sqrt'}. Best is trial 1137 with value: 0.19687116000636118.
[I 2024-12-04 13:14:15,176] Trial 1553 finished with value: 0.227594975496863 and parameters: {'n_estimators': 1426, 'learning_rate': 0.09995541353888675, 'max_depth': 12, 'min_samples_split': 15, 'min_samples_leaf': 2, 'subsample': 0.7301450107977323, 'max_features': 'sqrt'}. Best is trial 1137 with value: 0.19687116000636118.
[I 2024-12-04 13:14:16,757] Trial 1556 finished with value: 0.2932150484502193 and parameters: {'n_estimators': 1327, 'learning_rate': 0.09820696938846406, 'max_depth': 10, 'min_samples_split': 17, 'min_samples_leaf': 4, 'subsample': 0.6278582145717858, 'max_features': 'log2'}. Best is trial 1137 with value: 0.19687116000636118.
[I 2024-12-04 13:14:18,679] Trial 1554 finished with value: 0.23732710126009843 and parameters: {'n_estimators': 1458, 'learning_rate': 0.06990075403843188, 'max_depth': 9, 'min_samples_split': 18, 'min_samples_leaf': 1, 'subsample': 0.6079614555435585, 'max_features': 'sqrt'}. Best is trial 1137 with value: 0.19687116000636118.
[I 2024-12-04 13:14:22,325] Trial 1561 finished with value: 0.21791031511469847 and parameters: {'n_estimators': 1248, 'learning_rate': 0.08077234253949826, 'max_depth': 10, 'min_samples_split': 15, 'min_samples_leaf': 1, 'subsample': 0.6031189332065268, 'max_features': 'sqrt'}. Best is trial 1137 with value: 0.19687116000636118.
[I 2024-12-04 13:14:23,784] Trial 1559 finished with value: 0.2318049441909429 and parameters: {'n_estimators': 1282, 'learning_rate': 0.08637267082561084, 'max_depth': 10, 'min_samples_split': 15, 'min_samples_leaf': 1, 'subsample': 0.616917088994164, 'max_features': 'sqrt'}. Best is trial 1137 with value: 0.19687116000636118.
[I 2024-12-04 13:14:23,807] Trial 1558 finished with value: 0.28994283088811995 and parameters: {'n_estimators': 1186, 'learning_rate': 0.09569527312018607, 'max_depth': 12, 'min_samples_split': 15, 'min_samples_leaf': 3, 'subsample': 0.7029477839250946, 'max_features': None}. Best is trial 1137 with value: 0.19687116000636118.
[I 2024-12-04 13:14:26,167] Trial 1563 finished with value: 0.49816493129307643 and parameters: {'n_estimators': 1242, 'learning_rate': 0.030250305863262994, 'max_depth': 5, 'min_samples_split': 14, 'min_samples_leaf': 9, 'subsample': 0.8785682415022263, 'max_features': 'log2'}. Best is trial 1137 with value: 0.19687116000636118.
[I 2024-12-04 13:14:29,696] Trial 1560 finished with value: 0.3882447409264871 and parameters: {'n_estimators': 1391, 'learning_rate': 0.02674011564791509, 'max_depth': 8, 'min_samples_split': 11, 'min_samples_leaf': 7, 'subsample': 0.6093208803716232, 'max_features': 'sqrt'}. Best is trial 1137 with value: 0.19687116000636118.
[I 2024-12-04 13:14:30,228] Trial 1591 finished with value: 0.3840118409170787 and parameters: {'n_estimators': 111, 'learning_rate': 0.09224008435274288, 'max_depth': 8, 'min_samples_split': 9, 'min_samples_leaf': 5, 'subsample': 0.6745623554305, 'max_features': 'sqrt'}. Best is trial 1137 with value: 0.19687116000636118.
[I 2024-12-04 13:14:34,731] Trial 1579 finished with value: 0.478462787038213 and parameters: {'n_estimators': 647, 'learning_rate': 0.02794037908137871, 'max_depth': 6, 'min_samples_split': 2, 'min_samples_leaf': 5, 'subsample': 0.8369278862391045, 'max_features': 'log2'}. Best is trial 1137 with value: 0.19687116000636118.
[I 2024-12-04 13:14:36,804] Trial 1566 finished with value: 0.24991935027302073 and parameters: {'n_estimators': 1276, 'learning_rate': 0.09917584431338287, 'max_depth': 9, 'min_samples_split': 16, 'min_samples_leaf': 3, 'subsample': 0.6831810022928011, 'max_features': 'sqrt'}. Best is trial 1137 with value: 0.19687116000636118.
[I 2024-12-04 13:14:37,934] Trial 1570 finished with value: 0.22066420654528263 and parameters: {'n_estimators': 1142, 'learning_rate': 0.09657780444143434, 'max_depth': 10, 'min_samples_split': 18, 'min_samples_leaf': 1, 'subsample': 0.6032286845818629, 'max_features': 'sqrt'}. Best is trial 1137 with value: 0.19687116000636118.
[I 2024-12-04 13:14:39,589] Trial 1568 finished with value: 0.5411262189737271 and parameters: {'n_estimators': 1272, 'learning_rate': 0.01993137365684454, 'max_depth': 10, 'min_samples_split': 17, 'min_samples_leaf': 7, 'subsample': 0.6341089506889006, 'max_features': 'log2'}. Best is trial 1137 with value: 0.19687116000636118.
[I 2024-12-04 13:14:40,488] Trial 1565 finished with value: 0.22549278649860693 and parameters: {'n_estimators': 1437, 'learning_rate': 0.0936064562014175, 'max_depth': 11, 'min_samples_split': 19, 'min_samples_leaf': 1, 'subsample': 0.602983001401987, 'max_features': 'sqrt'}. Best is trial 1137 with value: 0.19687116000636118.
[I 2024-12-04 13:14:42,317] Trial 1590 finished with value: 0.38658352036266325 and parameters: {'n_estimators': 312, 'learning_rate': 0.02432311922551018, 'max_depth': 11, 'min_samples_split': 2, 'min_samples_leaf': 9, 'subsample': 0.7757925229363072, 'max_features': None}. Best is trial 1137 with value: 0.19687116000636118.
[I 2024-12-04 13:14:42,324] Trial 1564 finished with value: 0.26583610573723837 and parameters: {'n_estimators': 1489, 'learning_rate': 0.04274571341986108, 'max_depth': 8, 'min_samples_split': 14, 'min_samples_leaf': 3, 'subsample': 0.7050698220951461, 'max_features': 'sqrt'}. Best is trial 1137 with value: 0.19687116000636118.
[I 2024-12-04 13:14:44,023] Trial 1571 finished with value: 0.22423675416505945 and parameters: {'n_estimators': 1183, 'learning_rate': 0.06357219549900496, 'max_depth': 11, 'min_samples_split': 18, 'min_samples_leaf': 1, 'subsample': 0.6037345713521657, 'max_features': 'sqrt'}. Best is trial 1137 with value: 0.19687116000636118.
[I 2024-12-04 13:14:49,271] Trial 1572 finished with value: 0.2545335862477249 and parameters: {'n_estimators': 1249, 'learning_rate': 0.05086116097252802, 'max_depth': 10, 'min_samples_split': 17, 'min_samples_leaf': 3, 'subsample': 0.6371571604507356, 'max_features': 'sqrt'}. Best is trial 1137 with value: 0.19687116000636118.
[I 2024-12-04 13:14:49,317] Trial 1567 finished with value: 0.22666426007685836 and parameters: {'n_estimators': 1476, 'learning_rate': 0.05662885097523158, 'max_depth': 11, 'min_samples_split': 17, 'min_samples_leaf': 1, 'subsample': 0.6734213605665992, 'max_features': 'sqrt'}. Best is trial 1137 with value: 0.19687116000636118.
[I 2024-12-04 13:14:50,923] Trial 1569 finished with value: 0.2196024837682541 and parameters: {'n_estimators': 1421, 'learning_rate': 0.08441243646386716, 'max_depth': 12, 'min_samples_split': 20, 'min_samples_leaf': 1, 'subsample': 0.7795764954234813, 'max_features': 'log2'}. Best is trial 1137 with value: 0.19687116000636118.
[I 2024-12-04 13:14:56,007] Trial 1576 finished with value: 0.41205358895879224 and parameters: {'n_estimators': 1236, 'learning_rate': 0.037015591352592046, 'max_depth': 9, 'min_samples_split': 12, 'min_samples_leaf': 10, 'subsample': 0.8981482696008187, 'max_features': 'sqrt'}. Best is trial 1137 with value: 0.19687116000636118.
[I 2024-12-04 13:14:56,391] Trial 1578 finished with value: 0.21880447877636344 and parameters: {'n_estimators': 1138, 'learning_rate': 0.09817862974249753, 'max_depth': 12, 'min_samples_split': 16, 'min_samples_leaf': 1, 'subsample': 0.6080611433853839, 'max_features': 'sqrt'}. Best is trial 1137 with value: 0.19687116000636118.
[I 2024-12-04 13:15:01,654] Trial 1577 finished with value: 0.24917701620967483 and parameters: {'n_estimators': 1339, 'learning_rate': 0.09223614722733933, 'max_depth': 10, 'min_samples_split': 16, 'min_samples_leaf': 3, 'subsample': 0.6876090449415448, 'max_features': 'sqrt'}. Best is trial 1137 with value: 0.19687116000636118.
[I 2024-12-04 13:15:02,783] Trial 1598 finished with value: 0.3093284549151645 and parameters: {'n_estimators': 552, 'learning_rate': 0.06502347093679323, 'max_depth': 4, 'min_samples_split': 15, 'min_samples_leaf': 2, 'subsample': 0.6408606162100039, 'max_features': 'sqrt'}. Best is trial 1137 with value: 0.19687116000636118.
[I 2024-12-04 13:15:04,344] Trial 1602 finished with value: 0.4615915918135162 and parameters: {'n_estimators': 404, 'learning_rate': 0.03984366574536821, 'max_depth': 5, 'min_samples_split': 5, 'min_samples_leaf': 3, 'subsample': 0.6581618260080038, 'max_features': 'log2'}. Best is trial 1137 with value: 0.19687116000636118.
[I 2024-12-04 13:15:04,346] Trial 1573 finished with value: 0.29098915097733474 and parameters: {'n_estimators': 1391, 'learning_rate': 0.07441562128297693, 'max_depth': 10, 'min_samples_split': 16, 'min_samples_leaf': 2, 'subsample': 0.674375128126212, 'max_features': None}. Best is trial 1137 with value: 0.19687116000636118.
[I 2024-12-04 13:15:05,436] Trial 1574 finished with value: 0.21230704110113596 and parameters: {'n_estimators': 1484, 'learning_rate': 0.0773903330980421, 'max_depth': 12, 'min_samples_split': 15, 'min_samples_leaf': 1, 'subsample': 0.6011279394488938, 'max_features': 'sqrt'}. Best is trial 1137 with value: 0.19687116000636118.
[I 2024-12-04 13:15:08,617] Trial 1588 finished with value: 0.4220666056150522 and parameters: {'n_estimators': 1013, 'learning_rate': 0.07112736361702103, 'max_depth': 12, 'min_samples_split': 13, 'min_samples_leaf': 10, 'subsample': 0.6496821922480588, 'max_features': 'sqrt'}. Best is trial 1137 with value: 0.19687116000636118.
[I 2024-12-04 13:15:10,578] Trial 1582 finished with value: 0.4000843261610326 and parameters: {'n_estimators': 1225, 'learning_rate': 0.023420453541355683, 'max_depth': 3, 'min_samples_split': 20, 'min_samples_leaf': 7, 'subsample': 0.8141571855683795, 'max_features': 'sqrt'}. Best is trial 1137 with value: 0.19687116000636118.
[I 2024-12-04 13:15:12,135] Trial 1583 finished with value: 0.30889260277108005 and parameters: {'n_estimators': 1114, 'learning_rate': 0.010406879132515564, 'max_depth': 8, 'min_samples_split': 20, 'min_samples_leaf': 3, 'subsample': 0.9059065074358208, 'max_features': None}. Best is trial 1137 with value: 0.19687116000636118.
[I 2024-12-04 13:15:16,604] Trial 1587 finished with value: 0.265497643609029 and parameters: {'n_estimators': 1267, 'learning_rate': 0.09752272123907745, 'max_depth': 7, 'min_samples_split': 16, 'min_samples_leaf': 2, 'subsample': 0.61889022357446, 'max_features': 'log2'}. Best is trial 1137 with value: 0.19687116000636118.
[I 2024-12-04 13:15:17,721] Trial 1586 finished with value: 0.23983155309346202 and parameters: {'n_estimators': 1289, 'learning_rate': 0.0627971366999504, 'max_depth': 12, 'min_samples_split': 17, 'min_samples_leaf': 1, 'subsample': 0.7211515238622473, 'max_features': 'sqrt'}. Best is trial 1137 with value: 0.19687116000636118.
[I 2024-12-04 13:15:19,209] Trial 1580 finished with value: 0.22867861692796898 and parameters: {'n_estimators': 1499, 'learning_rate': 0.08116191941551792, 'max_depth': 11, 'min_samples_split': 11, 'min_samples_leaf': 1, 'subsample': 0.6001057105497104, 'max_features': 'sqrt'}. Best is trial 1137 with value: 0.19687116000636118.
[I 2024-12-04 13:15:22,374] Trial 1584 finished with value: 0.4332650872457708 and parameters: {'n_estimators': 1490, 'learning_rate': 0.08279614801239307, 'max_depth': 10, 'min_samples_split': 15, 'min_samples_leaf': 10, 'subsample': 0.9450168481608223, 'max_features': 'log2'}. Best is trial 1137 with value: 0.19687116000636118.
[I 2024-12-04 13:15:23,012] Trial 1593 finished with value: 0.2357537555084793 and parameters: {'n_estimators': 1168, 'learning_rate': 0.08270787095062125, 'max_depth': 10, 'min_samples_split': 16, 'min_samples_leaf': 1, 'subsample': 0.6967014525228954, 'max_features': 'sqrt'}. Best is trial 1137 with value: 0.19687116000636118.
[I 2024-12-04 13:15:26,648] Trial 1581 finished with value: 0.2679923968125382 and parameters: {'n_estimators': 1456, 'learning_rate': 0.09065770362960614, 'max_depth': 11, 'min_samples_split': 13, 'min_samples_leaf': 1, 'subsample': 0.6290463091089433, 'max_features': None}. Best is trial 1137 with value: 0.19687116000636118.
[I 2024-12-04 13:15:32,559] Trial 1622 finished with value: 0.613313298110658 and parameters: {'n_estimators': 159, 'learning_rate': 0.050610829329095636, 'max_depth': 9, 'min_samples_split': 14, 'min_samples_leaf': 6, 'subsample': 0.8942052340460191, 'max_features': 'log2'}. Best is trial 1137 with value: 0.19687116000636118.
[I 2024-12-04 13:15:33,004] Trial 1619 finished with value: 0.591544501809433 and parameters: {'n_estimators': 302, 'learning_rate': 0.015089793207632589, 'max_depth': 7, 'min_samples_split': 19, 'min_samples_leaf': 1, 'subsample': 0.8047400323759919, 'max_features': 'log2'}. Best is trial 1137 with value: 0.19687116000636118.
[I 2024-12-04 13:15:34,635] Trial 1585 finished with value: 0.30638447949690484 and parameters: {'n_estimators': 1497, 'learning_rate': 0.09881164095592991, 'max_depth': 11, 'min_samples_split': 17, 'min_samples_leaf': 2, 'subsample': 0.6572572923487904, 'max_features': None}. Best is trial 1137 with value: 0.19687116000636118.
[I 2024-12-04 13:15:34,640] Trial 1589 finished with value: 0.38009600719432585 and parameters: {'n_estimators': 1473, 'learning_rate': 0.02875034100054946, 'max_depth': 4, 'min_samples_split': 18, 'min_samples_leaf': 8, 'subsample': 0.9729774818234374, 'max_features': None}. Best is trial 1137 with value: 0.19687116000636118.
[I 2024-12-04 13:15:37,216] Trial 1592 finished with value: 0.24531769078981325 and parameters: {'n_estimators': 1491, 'learning_rate': 0.09779315510697391, 'max_depth': 8, 'min_samples_split': 12, 'min_samples_leaf': 2, 'subsample': 0.602769253512284, 'max_features': 'sqrt'}. Best is trial 1137 with value: 0.19687116000636118.
