[I 2024-12-04 15:05:49,944] Trial 668 finished with value: 0.13435440544601704 and parameters: {'kernel_type': 'Matern', 'length_scale': 368.8195301691212, 'noise_level': 0.00013469383351666947, 'constant_value': 803.7852947239096, 'nu': 1.5}. Best is trial 667 with value: 0.1343538855187432.
[I 2024-12-04 15:05:50,944] Trial 674 finished with value: 1.2693635028569556 and parameters: {'kernel_type': 'Matern', 'length_scale': 0.03648160928153474, 'noise_level': 0.007867264188668826, 'constant_value': 951.1145700184031, 'nu': 1.5}. Best is trial 667 with value: 0.1343538855187432.
[I 2024-12-04 15:05:51,751] Trial 671 finished with value: 0.13435421719562532 and parameters: {'kernel_type': 'Matern', 'length_scale': 5.540208470967216, 'noise_level': 0.09748132147664958, 'constant_value': 754.2767005413032, 'nu': 1.5}. Best is trial 667 with value: 0.1343538855187432.
[I 2024-12-04 15:05:54,577] Trial 673 finished with value: 0.15167297592865758 and parameters: {'kernel_type': 'RBF', 'length_scale': 143.6220983524904, 'noise_level': 0.0266797904999897, 'constant_value': 585.6285906173754, 'nu': 1.5}. Best is trial 667 with value: 0.1343538855187432.
[I 2024-12-04 15:05:54,798] Trial 683 finished with value: 0.14859825850517877 and parameters: {'kernel_type': 'Matern', 'length_scale': 0.90836425406252, 'noise_level': 0.013760627570287084, 'constant_value': 43284.25561839998, 'nu': 2.5}. Best is trial 667 with value: 0.1343538855187432.
[I 2024-12-04 15:05:54,802] Trial 666 finished with value: 0.15167297538764618 and parameters: {'kernel_type': 'RBF', 'length_scale': 0.7448615300308731, 'noise_level': 0.0018601697597764697, 'constant_value': 91210.96962744296, 'nu': 1.5}. Best is trial 667 with value: 0.1343538855187432.
[I 2024-12-04 15:05:54,895] Trial 670 finished with value: 1.269363502856978 and parameters: {'kernel_type': 'RBF', 'length_scale': 21.880773985463343, 'noise_level': 9.433474780294533e-07, 'constant_value': 9504.20414274401, 'nu': 2.5}. Best is trial 667 with value: 0.1343538855187432.
[I 2024-12-04 15:05:56,257] Trial 672 finished with value: 0.1343543070132106 and parameters: {'kernel_type': 'Matern', 'length_scale': 38.74794736728519, 'noise_level': 0.28351075095907, 'constant_value': 1571.6694680039186, 'nu': 1.5}. Best is trial 667 with value: 0.1343538855187432.
[I 2024-12-04 15:05:56,315] Trial 676 finished with value: 0.13435439900201104 and parameters: {'kernel_type': 'Matern', 'length_scale': 2.3329504408343538, 'noise_level': 0.019205854263834716, 'constant_value': 11913.466602132674, 'nu': 1.5}. Best is trial 667 with value: 0.1343538855187432.
[I 2024-12-04 15:05:57,729] Trial 684 finished with value: 0.13435433927613658 and parameters: {'kernel_type': 'Matern', 'length_scale': 5.266612254090496, 'noise_level': 0.0016128935763301756, 'constant_value': 24015.20946949671, 'nu': 1.5}. Best is trial 667 with value: 0.1343538855187432.
[I 2024-12-04 15:05:58,569] Trial 682 finished with value: 0.13435440502106957 and parameters: {'kernel_type': 'Matern', 'length_scale': 1.2333006718537753, 'noise_level': 0.0005155361727061449, 'constant_value': 9.622468374571245, 'nu': 1.5}. Best is trial 667 with value: 0.1343538855187432.
[I 2024-12-04 15:05:59,827] Trial 677 finished with value: 0.134354369706184 and parameters: {'kernel_type': 'Matern', 'length_scale': 14.648092859232197, 'noise_level': 0.0044644426959211825, 'constant_value': 75297.44020011392, 'nu': 1.5}. Best is trial 667 with value: 0.1343538855187432.
[I 2024-12-04 15:06:00,175] Trial 686 finished with value: 0.13435426258589317 and parameters: {'kernel_type': 'Matern', 'length_scale': 7.115968508067407, 'noise_level': 0.02199932547241728, 'constant_value': 40395.17921512762, 'nu': 1.5}. Best is trial 667 with value: 0.1343538855187432.
[I 2024-12-04 15:06:00,850] Trial 675 finished with value: 1.269363502857104 and parameters: {'kernel_type': 'Matern', 'length_scale': 7.172729128881188, 'noise_level': 1.804969029743072e-06, 'constant_value': 0.00013345890922088712, 'nu': 1.5}. Best is trial 667 with value: 0.1343538855187432.
[I 2024-12-04 15:06:03,527] Trial 681 finished with value: 0.1343543921700514 and parameters: {'kernel_type': 'Matern', 'length_scale': 35.737317695342625, 'noise_level': 0.00666192069504606, 'constant_value': 36113.47049821807, 'nu': 1.5}. Best is trial 667 with value: 0.1343538855187432.
[I 2024-12-04 15:06:03,842] Trial 678 finished with value: 0.13435438109360198 and parameters: {'kernel_type': 'Matern', 'length_scale': 0.27895760241380835, 'noise_level': 0.8477282536816433, 'constant_value': 77480.320809336, 'nu': 1.5}. Best is trial 667 with value: 0.1343538855187432.
[I 2024-12-04 15:06:04,216] Trial 685 finished with value: 0.13435440243502791 and parameters: {'kernel_type': 'Matern', 'length_scale': 587.924186562422, 'noise_level': 0.8337120579254333, 'constant_value': 96531.9857952473, 'nu': 1.5}. Best is trial 667 with value: 0.1343538855187432.
[I 2024-12-04 15:06:04,374] Trial 680 finished with value: 0.1725103843261619 and parameters: {'kernel_type': 'Matern', 'length_scale': 3.213636227850809, 'noise_level': 0.043778986028159335, 'constant_value': 71988.2999138688, 'nu': 0.5}. Best is trial 667 with value: 0.1343538855187432.
[I 2024-12-04 15:06:04,402] Trial 689 finished with value: 0.13435440333175094 and parameters: {'kernel_type': 'Matern', 'length_scale': 2.79738443068447, 'noise_level': 0.058617155935261823, 'constant_value': 7.882485153264495, 'nu': 1.5}. Best is trial 667 with value: 0.1343538855187432.
[I 2024-12-04 15:06:06,010] Trial 691 finished with value: 0.14859827310125906 and parameters: {'kernel_type': 'Matern', 'length_scale': 0.22860103742369633, 'noise_level': 4.919767433792896e-05, 'constant_value': 1.1606451909117836, 'nu': 2.5}. Best is trial 667 with value: 0.1343538855187432.
[I 2024-12-04 15:06:07,163] Trial 693 finished with value: 1.269363502850742 and parameters: {'kernel_type': 'Matern', 'length_scale': 0.036865763150823336, 'noise_level': 4.756419603057515e-06, 'constant_value': 0.09911256869798725, 'nu': 1.5}. Best is trial 667 with value: 0.1343538855187432.
[I 2024-12-04 15:06:08,089] Trial 687 finished with value: 0.13435447908283304 and parameters: {'kernel_type': 'Matern', 'length_scale': 1784.4944953478685, 'noise_level': 0.004146949126139556, 'constant_value': 70998.5442825072, 'nu': 1.5}. Best is trial 667 with value: 0.1343538855187432.
[I 2024-12-04 15:06:08,817] Trial 695 finished with value: 0.1343543673385006 and parameters: {'kernel_type': 'Matern', 'length_scale': 5.176867825417436, 'noise_level': 0.48704748253845215, 'constant_value': 560.9021571486059, 'nu': 1.5}. Best is trial 667 with value: 0.1343538855187432.
[I 2024-12-04 15:06:10,029] Trial 692 finished with value: 0.13435438648984707 and parameters: {'kernel_type': 'Matern', 'length_scale': 1.7689102582492882, 'noise_level': 0.07006971061729016, 'constant_value': 61.2698984062842, 'nu': 1.5}. Best is trial 667 with value: 0.1343538855187432.
[I 2024-12-04 15:06:12,289] Trial 690 finished with value: 1.2693635028574013 and parameters: {'kernel_type': 'RBF', 'length_scale': 51323.631078825965, 'noise_level': 0.0062000607997074655, 'constant_value': 16461.872504160165, 'nu': 1.5}. Best is trial 667 with value: 0.1343538855187432.
[I 2024-12-04 15:06:12,617] Trial 679 finished with value: 0.13435422052029414 and parameters: {'kernel_type': 'Matern', 'length_scale': 1.579525142907357, 'noise_level': 9.392050981367341e-05, 'constant_value': 1385.7904520159998, 'nu': 1.5}. Best is trial 667 with value: 0.1343538855187432.
[I 2024-12-04 15:06:13,234] Trial 698 finished with value: 0.13435469397897992 and parameters: {'kernel_type': 'Matern', 'length_scale': 65.41144886660688, 'noise_level': 0.005928077621986443, 'constant_value': 1669.4998537092351, 'nu': 1.5}. Best is trial 667 with value: 0.1343538855187432.
[I 2024-12-04 15:06:14,460] Trial 688 finished with value: 0.13435440676617166 and parameters: {'kernel_type': 'Matern', 'length_scale': 498.95307172860396, 'noise_level': 0.0286761034830851, 'constant_value': 833.3382718257579, 'nu': 1.5}. Best is trial 667 with value: 0.1343538855187432.
[I 2024-12-04 15:06:14,633] Trial 694 finished with value: 1.3007739235931985 and parameters: {'kernel_type': 'RBF', 'length_scale': 0.0002724404358040574, 'noise_level': 4.510042819029897e-08, 'constant_value': 27022.091363118405, 'nu': 0.5}. Best is trial 667 with value: 0.1343538855187432.
[I 2024-12-04 15:06:15,902] Trial 697 finished with value: 0.13435438316800188 and parameters: {'kernel_type': 'Matern', 'length_scale': 18.242146654289687, 'noise_level': 0.02175549158673894, 'constant_value': 93620.62461635828, 'nu': 1.5}. Best is trial 667 with value: 0.1343538855187432.
[I 2024-12-04 15:06:20,189] Trial 707 finished with value: 0.13435455184210007 and parameters: {'kernel_type': 'Matern', 'length_scale': 27.49589798096475, 'noise_level': 0.00013458458144959912, 'constant_value': 3095.159118615745, 'nu': 1.5}. Best is trial 667 with value: 0.1343538855187432.
[I 2024-12-04 15:06:20,613] Trial 706 finished with value: 0.13435439753210662 and parameters: {'kernel_type': 'Matern', 'length_scale': 12.800954984036734, 'noise_level': 0.12147859455141484, 'constant_value': 457.6353944280053, 'nu': 1.5}. Best is trial 667 with value: 0.1343538855187432.
[I 2024-12-04 15:06:21,073] Trial 696 finished with value: 0.13435434277054836 and parameters: {'kernel_type': 'Matern', 'length_scale': 2.4904676243271657, 'noise_level': 0.00031385481429594385, 'constant_value': 8667.218716131281, 'nu': 1.5}. Best is trial 667 with value: 0.1343538855187432.
[I 2024-12-04 15:06:23,630] Trial 700 finished with value: 0.13435422086699492 and parameters: {'kernel_type': 'Matern', 'length_scale': 16692.68521447885, 'noise_level': 0.8151215085782684, 'constant_value': 113.71231481214838, 'nu': 1.5}. Best is trial 667 with value: 0.1343538855187432.
[I 2024-12-04 15:06:23,651] Trial 703 finished with value: 1.269363502857763 and parameters: {'kernel_type': 'RBF', 'length_scale': 0.000165499853379206, 'noise_level': 5.871076984901479e-07, 'constant_value': 0.032870269828787484, 'nu': 1.5}. Best is trial 667 with value: 0.1343538855187432.
[I 2024-12-04 15:06:24,078] Trial 711 finished with value: 1.3007739181576143 and parameters: {'kernel_type': 'Matern', 'length_scale': 0.17603853060196517, 'noise_level': 8.384371022038614e-06, 'constant_value': 1208.3961847780581, 'nu': 1.5}. Best is trial 667 with value: 0.1343538855187432.
[I 2024-12-04 15:06:24,147] Trial 710 finished with value: 1.2693635028569532 and parameters: {'kernel_type': 'Matern', 'length_scale': 94738.74017085874, 'noise_level': 0.01769676767392817, 'constant_value': 88213.54062489462, 'nu': 1.5}. Best is trial 667 with value: 0.1343538855187432.
[I 2024-12-04 15:06:24,152] Trial 704 finished with value: 0.15167297629196633 and parameters: {'kernel_type': 'RBF', 'length_scale': 4.166191089138104, 'noise_level': 9.010169662480859e-10, 'constant_value': 9.592582872542686e-06, 'nu': 1.5}. Best is trial 667 with value: 0.1343538855187432.
[I 2024-12-04 15:06:24,843] Trial 699 finished with value: 0.13435438562524446 and parameters: {'kernel_type': 'Matern', 'length_scale': 13689.15631704191, 'noise_level': 0.036234770117496824, 'constant_value': 90052.52744667849, 'nu': 1.5}. Best is trial 667 with value: 0.1343538855187432.
[I 2024-12-04 15:06:25,963] Trial 712 finished with value: 0.134354501068804 and parameters: {'kernel_type': 'Matern', 'length_scale': 69.72469142799095, 'noise_level': 0.018997147653308403, 'constant_value': 4845.571542997997, 'nu': 1.5}. Best is trial 667 with value: 0.1343538855187432.
[I 2024-12-04 15:06:27,020] Trial 715 finished with value: 1.2693635028564851 and parameters: {'kernel_type': 'Matern', 'length_scale': 348.93052564646104, 'noise_level': 2.062640292955426e-10, 'constant_value': 0.038708619009098166, 'nu': 0.5}. Best is trial 667 with value: 0.1343538855187432.
[I 2024-12-04 15:06:27,590] Trial 705 finished with value: 0.13435448019602117 and parameters: {'kernel_type': 'Matern', 'length_scale': 528.9287303915372, 'noise_level': 0.0014746876275926301, 'constant_value': 64514.59071772836, 'nu': 1.5}. Best is trial 667 with value: 0.1343538855187432.
[I 2024-12-04 15:06:27,651] Trial 702 finished with value: 0.13435439990815745 and parameters: {'kernel_type': 'Matern', 'length_scale': 1.5576113917522967, 'noise_level': 0.02105983511764894, 'constant_value': 405.03750672616826, 'nu': 1.5}. Best is trial 667 with value: 0.1343538855187432.
[I 2024-12-04 15:06:28,148] Trial 708 finished with value: 0.13435440421453534 and parameters: {'kernel_type': 'Matern', 'length_scale': 69.53007378760208, 'noise_level': 0.07848336786021999, 'constant_value': 1413.6919443044192, 'nu': 1.5}. Best is trial 667 with value: 0.1343538855187432.
[I 2024-12-04 15:06:29,251] Trial 716 finished with value: 0.1343544001005396 and parameters: {'kernel_type': 'Matern', 'length_scale': 3.9371597328351076, 'noise_level': 0.0005539294745545645, 'constant_value': 123.96771503204849, 'nu': 1.5}. Best is trial 667 with value: 0.1343538855187432.
[I 2024-12-04 15:06:29,252] Trial 714 finished with value: 1.3007739092835764 and parameters: {'kernel_type': 'Matern', 'length_scale': 0.19631322954771957, 'noise_level': 0.0010425858945012723, 'constant_value': 461.7946898450579, 'nu': 1.5}. Best is trial 667 with value: 0.1343538855187432.
[I 2024-12-04 15:06:31,523] Trial 720 finished with value: 1.3007745979657548 and parameters: {'kernel_type': 'Matern', 'length_scale': 11.673441138695805, 'noise_level': 3.839722433378331e-06, 'constant_value': 64005.7931429033, 'nu': 1.5}. Best is trial 667 with value: 0.1343538855187432.
[I 2024-12-04 15:06:33,665] Trial 709 finished with value: 0.13435440640524657 and parameters: {'kernel_type': 'Matern', 'length_scale': 3.650168016230175, 'noise_level': 1.861942819191777e-05, 'constant_value': 644.6697462500595, 'nu': 1.5}. Best is trial 667 with value: 0.1343538855187432.
[I 2024-12-04 15:06:33,923] Trial 701 finished with value: 0.1343543399797153 and parameters: {'kernel_type': 'Matern', 'length_scale': 29.356812083440445, 'noise_level': 9.517307511780475e-05, 'constant_value': 74.91653528777401, 'nu': 1.5}. Best is trial 667 with value: 0.1343538855187432.
[I 2024-12-04 15:06:34,589] Trial 717 finished with value: 1.2693635028556496 and parameters: {'kernel_type': 'Matern', 'length_scale': 0.05629729230771672, 'noise_level': 2.5056954419573584e-05, 'constant_value': 942.8908320907324, 'nu': 1.5}. Best is trial 667 with value: 0.1343538855187432.
[I 2024-12-04 15:06:34,938] Trial 713 finished with value: 0.14859823823066448 and parameters: {'kernel_type': 'Matern', 'length_scale': 19.782058667366435, 'noise_level': 0.005077142385184592, 'constant_value': 1048.504469251197, 'nu': 2.5}. Best is trial 667 with value: 0.1343538855187432.
[I 2024-12-04 15:06:38,198] Trial 723 finished with value: 1.2693635028569847 and parameters: {'kernel_type': 'Matern', 'length_scale': 5.892991085954201, 'noise_level': 1.5776220276556746e-07, 'constant_value': 0.0002492232038765855, 'nu': 0.5}. Best is trial 667 with value: 0.1343538855187432.
[I 2024-12-04 15:06:38,406] Trial 724 finished with value: 0.13435443752921797 and parameters: {'kernel_type': 'Matern', 'length_scale': 5.721398357441394, 'noise_level': 4.130899142872534e-05, 'constant_value': 15402.471417275234, 'nu': 1.5}. Best is trial 667 with value: 0.1343538855187432.
[I 2024-12-04 15:06:38,776] Trial 722 finished with value: 0.13435439015568476 and parameters: {'kernel_type': 'Matern', 'length_scale': 77.0754501484539, 'noise_level': 0.0007104090976529026, 'constant_value': 410.95901078418495, 'nu': 1.5}. Best is trial 667 with value: 0.1343538855187432.
[I 2024-12-04 15:06:38,805] Trial 718 finished with value: 0.1343544443995862 and parameters: {'kernel_type': 'Matern', 'length_scale': 2.1983417700070245, 'noise_level': 0.0020700497102572385, 'constant_value': 19.975459044416304, 'nu': 1.5}. Best is trial 667 with value: 0.1343538855187432.
[I 2024-12-04 15:06:38,806] Trial 725 finished with value: 0.15167293797628828 and parameters: {'kernel_type': 'RBF', 'length_scale': 8.348533910733389, 'noise_level': 9.562755164844246e-05, 'constant_value': 29.868910752377598, 'nu': 1.5}. Best is trial 667 with value: 0.1343538855187432.
[I 2024-12-04 15:06:40,853] Trial 719 finished with value: 1.269363502856445 and parameters: {'kernel_type': 'RBF', 'length_scale': 1.258338487277848e-05, 'noise_level': 1.2917909908276824e-05, 'constant_value': 5.363062748970256e-05, 'nu': 1.5}. Best is trial 667 with value: 0.1343538855187432.
[I 2024-12-04 15:06:42,804] Trial 731 finished with value: 0.1343543800179248 and parameters: {'kernel_type': 'Matern', 'length_scale': 444.0137777495962, 'noise_level': 0.7634364481129251, 'constant_value': 606.7355343812965, 'nu': 1.5}. Best is trial 667 with value: 0.1343538855187432.
[I 2024-12-04 15:06:43,182] Trial 726 finished with value: 1.2693635028570431 and parameters: {'kernel_type': 'Matern', 'length_scale': 13773.208931960085, 'noise_level': 5.739207166437619e-05, 'constant_value': 451.0753092344492, 'nu': 1.5}. Best is trial 667 with value: 0.1343538855187432.
[I 2024-12-04 15:06:45,927] Trial 730 finished with value: 0.13435439622094644 and parameters: {'kernel_type': 'Matern', 'length_scale': 889.5722991895193, 'noise_level': 0.017696067522941984, 'constant_value': 55163.93212235165, 'nu': 1.5}. Best is trial 667 with value: 0.1343538855187432.
[I 2024-12-04 15:06:45,996] Trial 727 finished with value: 0.13435440458810535 and parameters: {'kernel_type': 'Matern', 'length_scale': 281.7622997967071, 'noise_level': 0.07949041664030065, 'constant_value': 605.6311982431096, 'nu': 1.5}. Best is trial 667 with value: 0.1343538855187432.
[I 2024-12-04 15:06:46,015] Trial 721 finished with value: 0.17251040134334922 and parameters: {'kernel_type': 'Matern', 'length_scale': 0.10608291875239884, 'noise_level': 0.00013553481891792908, 'constant_value': 3.938005097849881e-07, 'nu': 0.5}. Best is trial 667 with value: 0.1343538855187432.
[I 2024-12-04 15:06:46,762] Trial 738 finished with value: 1.2693635028589079 and parameters: {'kernel_type': 'RBF', 'length_scale': 0.09503541750565075, 'noise_level': 0.3696357256791464, 'constant_value': 23.51223491985897, 'nu': 2.5}. Best is trial 667 with value: 0.1343538855187432.
[I 2024-12-04 15:06:47,060] Trial 733 finished with value: 0.13435439728601883 and parameters: {'kernel_type': 'Matern', 'length_scale': 204.9275615400013, 'noise_level': 0.0075133986150151015, 'constant_value': 864.9071928590829, 'nu': 1.5}. Best is trial 667 with value: 0.1343538855187432.
[I 2024-12-04 15:06:50,159] Trial 737 finished with value: 0.1343543961818584 and parameters: {'kernel_type': 'Matern', 'length_scale': 2.2405782573670656, 'noise_level': 0.00012163099564051856, 'constant_value': 823.1057350133253, 'nu': 1.5}. Best is trial 667 with value: 0.1343538855187432.
[I 2024-12-04 15:06:50,355] Trial 728 finished with value: 0.13435441999155492 and parameters: {'kernel_type': 'Matern', 'length_scale': 1.3954003201313752, 'noise_level': 0.0025783647209264206, 'constant_value': 540.5155668275266, 'nu': 1.5}. Best is trial 667 with value: 0.1343538855187432.
[I 2024-12-04 15:06:50,408] Trial 732 finished with value: 1.2693635028573944 and parameters: {'kernel_type': 'RBF', 'length_scale': 90565.46938320709, 'noise_level': 4.7011475597712726e-07, 'constant_value': 640.9451368028596, 'nu': 2.5}. Best is trial 667 with value: 0.1343538855187432.
[I 2024-12-04 15:06:52,648] Trial 739 finished with value: 1.2693635028534895 and parameters: {'kernel_type': 'RBF', 'length_scale': 0.029156984184415334, 'noise_level': 6.513082377648688e-06, 'constant_value': 33.071802416344035, 'nu': 1.5}. Best is trial 667 with value: 0.1343538855187432.
[I 2024-12-04 15:06:53,385] Trial 734 finished with value: 0.13435439561103463 and parameters: {'kernel_type': 'Matern', 'length_scale': 91.77040277966623, 'noise_level': 0.04894846336249025, 'constant_value': 68306.11792193995, 'nu': 1.5}. Best is trial 667 with value: 0.1343538855187432.
[I 2024-12-04 15:06:58,555] Trial 736 finished with value: 0.1725103985694154 and parameters: {'kernel_type': 'Matern', 'length_scale': 126.5092586636545, 'noise_level': 5.547521930490763e-05, 'constant_value': 8543.443197481809, 'nu': 0.5}. Best is trial 667 with value: 0.1343538855187432.
[I 2024-12-04 15:06:58,750] Trial 741 finished with value: 0.13435481654405296 and parameters: {'kernel_type': 'Matern', 'length_scale': 33.09547902583813, 'noise_level': 0.0012990332231013878, 'constant_value': 2497.3610298101685, 'nu': 1.5}. Best is trial 667 with value: 0.1343538855187432.
[I 2024-12-04 15:07:01,196] Trial 729 finished with value: 0.1725103952413027 and parameters: {'kernel_type': 'Matern', 'length_scale': 49.122810515070654, 'noise_level': 0.001721755287470311, 'constant_value': 42.15767204902826, 'nu': 0.5}. Best is trial 667 with value: 0.1343538855187432.
[I 2024-12-04 15:07:06,529] Trial 748 finished with value: 0.1343544017202242 and parameters: {'kernel_type': 'Matern', 'length_scale': 2.138982059695001, 'noise_level': 0.002470911599026851, 'constant_value': 92323.11409400364, 'nu': 1.5}. Best is trial 667 with value: 0.1343538855187432.
[I 2024-12-04 15:07:06,558] Trial 740 finished with value: 0.1343543913668561 and parameters: {'kernel_type': 'Matern', 'length_scale': 13.988984365838013, 'noise_level': 0.013380384788977535, 'constant_value': 38.274884588626364, 'nu': 1.5}. Best is trial 667 with value: 0.1343538855187432.
[I 2024-12-04 15:07:07,614] Trial 743 finished with value: 0.1343543829785343 and parameters: {'kernel_type': 'Matern', 'length_scale': 3.4010852902860256, 'noise_level': 0.02402390529614787, 'constant_value': 835.1576518192937, 'nu': 1.5}. Best is trial 667 with value: 0.1343538855187432.
