[I 2024-12-04 12:21:23,533] Trial 196 finished with value: 0.23803432387783077 and parameters: {'n_estimators': 1452, 'learning_rate': 0.07766180778983155, 'max_depth': 11, 'min_samples_split': 7, 'min_samples_leaf': 1, 'subsample': 0.7183219911067286, 'max_features': 'log2'}. Best is trial 204 with value: 0.22230397456137438.
[I 2024-12-04 12:21:24,310] Trial 208 finished with value: 0.24948642904665116 and parameters: {'n_estimators': 987, 'learning_rate': 0.04595518461472349, 'max_depth': 11, 'min_samples_split': 18, 'min_samples_leaf': 2, 'subsample': 0.8466951327232762, 'max_features': 'sqrt'}. Best is trial 204 with value: 0.22230397456137438.
[I 2024-12-04 12:21:25,325] Trial 198 finished with value: 0.23615144317826328 and parameters: {'n_estimators': 1307, 'learning_rate': 0.046842637657326026, 'max_depth': 10, 'min_samples_split': 15, 'min_samples_leaf': 1, 'subsample': 0.9853410847361356, 'max_features': 'sqrt'}. Best is trial 204 with value: 0.22230397456137438.
[I 2024-12-04 12:21:27,467] Trial 211 finished with value: 0.24446950915289145 and parameters: {'n_estimators': 955, 'learning_rate': 0.057214690775160046, 'max_depth': 10, 'min_samples_split': 11, 'min_samples_leaf': 1, 'subsample': 0.6084674830099092, 'max_features': 'sqrt'}. Best is trial 204 with value: 0.22230397456137438.
[I 2024-12-04 12:21:29,343] Trial 209 finished with value: 0.23383031387341388 and parameters: {'n_estimators': 1018, 'learning_rate': 0.08435128013033097, 'max_depth': 11, 'min_samples_split': 12, 'min_samples_leaf': 2, 'subsample': 0.8119725123876637, 'max_features': 'sqrt'}. Best is trial 204 with value: 0.22230397456137438.
[I 2024-12-04 12:21:29,650] Trial 202 finished with value: 0.24720305227325823 and parameters: {'n_estimators': 1104, 'learning_rate': 0.0924758114649988, 'max_depth': 6, 'min_samples_split': 7, 'min_samples_leaf': 1, 'subsample': 0.6442438726442796, 'max_features': 'sqrt'}. Best is trial 204 with value: 0.22230397456137438.
[I 2024-12-04 12:21:30,919] Trial 210 finished with value: 0.2808320393686602 and parameters: {'n_estimators': 950, 'learning_rate': 0.06847959818383702, 'max_depth': 11, 'min_samples_split': 18, 'min_samples_leaf': 2, 'subsample': 0.6070535509816245, 'max_features': 'log2'}. Best is trial 204 with value: 0.22230397456137438.
[I 2024-12-04 12:21:32,645] Trial 203 finished with value: 0.22740095583156028 and parameters: {'n_estimators': 1302, 'learning_rate': 0.07328068171223644, 'max_depth': 10, 'min_samples_split': 8, 'min_samples_leaf': 1, 'subsample': 0.9469504034738502, 'max_features': 'sqrt'}. Best is trial 204 with value: 0.22230397456137438.
[I 2024-12-04 12:21:33,915] Trial 201 finished with value: 0.26954892183838747 and parameters: {'n_estimators': 1231, 'learning_rate': 0.0510175625455404, 'max_depth': 7, 'min_samples_split': 10, 'min_samples_leaf': 1, 'subsample': 0.6671266744359098, 'max_features': None}. Best is trial 204 with value: 0.22230397456137438.
[I 2024-12-04 12:21:37,876] Trial 213 finished with value: 0.23386296038387738 and parameters: {'n_estimators': 1011, 'learning_rate': 0.07614794758425414, 'max_depth': 8, 'min_samples_split': 15, 'min_samples_leaf': 1, 'subsample': 0.8668781548263984, 'max_features': 'sqrt'}. Best is trial 204 with value: 0.22230397456137438.
[I 2024-12-04 12:21:38,619] Trial 200 finished with value: 0.25775837769033605 and parameters: {'n_estimators': 1396, 'learning_rate': 0.07589680077170839, 'max_depth': 10, 'min_samples_split': 18, 'min_samples_leaf': 3, 'subsample': 0.8959815993552653, 'max_features': 'sqrt'}. Best is trial 204 with value: 0.22230397456137438.
[I 2024-12-04 12:21:45,854] Trial 205 finished with value: 0.2460847817319797 and parameters: {'n_estimators': 1368, 'learning_rate': 0.08314385351760077, 'max_depth': 9, 'min_samples_split': 18, 'min_samples_leaf': 1, 'subsample': 0.9548644770682889, 'max_features': 'sqrt'}. Best is trial 204 with value: 0.22230397456137438.
[I 2024-12-04 12:21:45,917] Trial 212 finished with value: 0.242842687741607 and parameters: {'n_estimators': 1273, 'learning_rate': 0.09520904194334841, 'max_depth': 10, 'min_samples_split': 14, 'min_samples_leaf': 1, 'subsample': 0.6701457162993644, 'max_features': 'log2'}. Best is trial 204 with value: 0.22230397456137438.
[I 2024-12-04 12:21:45,925] Trial 206 finished with value: 0.25886353484831054 and parameters: {'n_estimators': 1497, 'learning_rate': 0.05452376238830963, 'max_depth': 9, 'min_samples_split': 3, 'min_samples_leaf': 3, 'subsample': 0.6319620572320638, 'max_features': 'sqrt'}. Best is trial 204 with value: 0.22230397456137438.
[I 2024-12-04 12:21:49,208] Trial 217 finished with value: 0.23320101824364134 and parameters: {'n_estimators': 1017, 'learning_rate': 0.09196994550871548, 'max_depth': 12, 'min_samples_split': 12, 'min_samples_leaf': 2, 'subsample': 0.9134506635401461, 'max_features': 'sqrt'}. Best is trial 204 with value: 0.22230397456137438.
[I 2024-12-04 12:21:49,814] Trial 218 finished with value: 0.2449287182754103 and parameters: {'n_estimators': 1048, 'learning_rate': 0.07871372437037111, 'max_depth': 12, 'min_samples_split': 12, 'min_samples_leaf': 2, 'subsample': 0.9896109791100413, 'max_features': 'sqrt'}. Best is trial 204 with value: 0.22230397456137438.
[I 2024-12-04 12:21:53,734] Trial 219 finished with value: 0.256234756393875 and parameters: {'n_estimators': 1051, 'learning_rate': 0.042906063757198964, 'max_depth': 9, 'min_samples_split': 11, 'min_samples_leaf': 1, 'subsample': 0.7257400610258157, 'max_features': 'sqrt'}. Best is trial 204 with value: 0.22230397456137438.
[I 2024-12-04 12:21:55,350] Trial 216 finished with value: 0.24192605653647922 and parameters: {'n_estimators': 1191, 'learning_rate': 0.05690218891077417, 'max_depth': 12, 'min_samples_split': 8, 'min_samples_leaf': 3, 'subsample': 0.8683980635278942, 'max_features': 'sqrt'}. Best is trial 204 with value: 0.22230397456137438.
[I 2024-12-04 12:21:57,018] Trial 215 finished with value: 0.2467809496989492 and parameters: {'n_estimators': 1381, 'learning_rate': 0.0517515938030466, 'max_depth': 6, 'min_samples_split': 13, 'min_samples_leaf': 1, 'subsample': 0.7119602910236177, 'max_features': 'sqrt'}. Best is trial 204 with value: 0.22230397456137438.
[I 2024-12-04 12:22:08,110] Trial 223 finished with value: 0.25360613127675535 and parameters: {'n_estimators': 1048, 'learning_rate': 0.08493081501269191, 'max_depth': 8, 'min_samples_split': 15, 'min_samples_leaf': 2, 'subsample': 0.6623582881842602, 'max_features': 'sqrt'}. Best is trial 204 with value: 0.22230397456137438.
[I 2024-12-04 12:22:10,655] Trial 220 finished with value: 0.2671351551882284 and parameters: {'n_estimators': 1328, 'learning_rate': 0.055536906699182105, 'max_depth': 10, 'min_samples_split': 16, 'min_samples_leaf': 2, 'subsample': 0.955511986998884, 'max_features': 'log2'}. Best is trial 204 with value: 0.22230397456137438.
[I 2024-12-04 12:22:12,962] Trial 222 finished with value: 0.26892833743333866 and parameters: {'n_estimators': 1277, 'learning_rate': 0.07531347147592507, 'max_depth': 8, 'min_samples_split': 20, 'min_samples_leaf': 2, 'subsample': 0.7557477909867543, 'max_features': 'log2'}. Best is trial 204 with value: 0.22230397456137438.
[I 2024-12-04 12:22:17,507] Trial 221 finished with value: 0.29327061926701237 and parameters: {'n_estimators': 1428, 'learning_rate': 0.0863469130469643, 'max_depth': 7, 'min_samples_split': 16, 'min_samples_leaf': 3, 'subsample': 0.6861806772149099, 'max_features': 'log2'}. Best is trial 204 with value: 0.22230397456137438.
[I 2024-12-04 12:22:18,330] Trial 238 finished with value: 0.2704648333307283 and parameters: {'n_estimators': 724, 'learning_rate': 0.02928792048218741, 'max_depth': 11, 'min_samples_split': 14, 'min_samples_leaf': 1, 'subsample': 0.8118806414737212, 'max_features': 'sqrt'}. Best is trial 204 with value: 0.22230397456137438.
[I 2024-12-04 12:22:24,521] Trial 224 finished with value: 0.23572216931904583 and parameters: {'n_estimators': 1309, 'learning_rate': 0.06081731625012241, 'max_depth': 8, 'min_samples_split': 16, 'min_samples_leaf': 1, 'subsample': 0.7564186745414478, 'max_features': 'sqrt'}. Best is trial 204 with value: 0.22230397456137438.
[I 2024-12-04 12:22:26,615] Trial 229 finished with value: 0.23694937066434188 and parameters: {'n_estimators': 1196, 'learning_rate': 0.0837199926392903, 'max_depth': 10, 'min_samples_split': 13, 'min_samples_leaf': 1, 'subsample': 0.703356518802192, 'max_features': 'sqrt'}. Best is trial 204 with value: 0.22230397456137438.
[I 2024-12-04 12:22:27,033] Trial 230 finished with value: 0.24036799532141281 and parameters: {'n_estimators': 1184, 'learning_rate': 0.09153683195901573, 'max_depth': 6, 'min_samples_split': 7, 'min_samples_leaf': 1, 'subsample': 0.8260849708218715, 'max_features': 'sqrt'}. Best is trial 204 with value: 0.22230397456137438.
[I 2024-12-04 12:22:28,812] Trial 226 finished with value: 0.22026593151948148 and parameters: {'n_estimators': 1276, 'learning_rate': 0.06690610346827806, 'max_depth': 12, 'min_samples_split': 7, 'min_samples_leaf': 1, 'subsample': 0.739228018341147, 'max_features': 'sqrt'}. Best is trial 226 with value: 0.22026593151948148.
[I 2024-12-04 12:22:32,144] Trial 236 finished with value: 0.2509568381329419 and parameters: {'n_estimators': 959, 'learning_rate': 0.08653017691156628, 'max_depth': 8, 'min_samples_split': 11, 'min_samples_leaf': 2, 'subsample': 0.848670473428567, 'max_features': 'sqrt'}. Best is trial 226 with value: 0.22026593151948148.
[I 2024-12-04 12:22:33,241] Trial 239 finished with value: 0.2580396012181854 and parameters: {'n_estimators': 910, 'learning_rate': 0.06785378550687356, 'max_depth': 7, 'min_samples_split': 18, 'min_samples_leaf': 1, 'subsample': 0.984745072530364, 'max_features': 'sqrt'}. Best is trial 226 with value: 0.22026593151948148.
[I 2024-12-04 12:22:35,732] Trial 225 finished with value: 0.23224450240993147 and parameters: {'n_estimators': 1485, 'learning_rate': 0.09189335438482561, 'max_depth': 9, 'min_samples_split': 20, 'min_samples_leaf': 2, 'subsample': 0.7107626230876233, 'max_features': 'sqrt'}. Best is trial 226 with value: 0.22026593151948148.
[I 2024-12-04 12:22:36,540] Trial 243 finished with value: 0.2642416841756805 and parameters: {'n_estimators': 862, 'learning_rate': 0.05579695959435357, 'max_depth': 8, 'min_samples_split': 14, 'min_samples_leaf': 1, 'subsample': 0.8966128387727411, 'max_features': 'sqrt'}. Best is trial 226 with value: 0.22026593151948148.
[I 2024-12-04 12:22:37,191] Trial 227 finished with value: 0.23584188778397425 and parameters: {'n_estimators': 1453, 'learning_rate': 0.07408071652247428, 'max_depth': 10, 'min_samples_split': 8, 'min_samples_leaf': 2, 'subsample': 0.7662197067027418, 'max_features': 'sqrt'}. Best is trial 226 with value: 0.22026593151948148.
[I 2024-12-04 12:22:39,290] Trial 231 finished with value: 0.26011148914555277 and parameters: {'n_estimators': 1313, 'learning_rate': 0.023668237753295452, 'max_depth': 10, 'min_samples_split': 17, 'min_samples_leaf': 2, 'subsample': 0.9707462220158052, 'max_features': 'sqrt'}. Best is trial 226 with value: 0.22026593151948148.
[I 2024-12-04 12:22:41,133] Trial 241 finished with value: 0.24295324239515245 and parameters: {'n_estimators': 989, 'learning_rate': 0.0957448737689466, 'max_depth': 10, 'min_samples_split': 9, 'min_samples_leaf': 2, 'subsample': 0.7601506135246762, 'max_features': 'sqrt'}. Best is trial 226 with value: 0.22026593151948148.
[I 2024-12-04 12:22:41,214] Trial 232 finished with value: 0.2410810187418657 and parameters: {'n_estimators': 1344, 'learning_rate': 0.039983931942996126, 'max_depth': 10, 'min_samples_split': 17, 'min_samples_leaf': 2, 'subsample': 0.9897804308859061, 'max_features': 'sqrt'}. Best is trial 226 with value: 0.22026593151948148.
[I 2024-12-04 12:22:41,465] Trial 228 finished with value: 0.23832987715543139 and parameters: {'n_estimators': 1452, 'learning_rate': 0.06695932066508253, 'max_depth': 12, 'min_samples_split': 16, 'min_samples_leaf': 2, 'subsample': 0.6110266849448315, 'max_features': 'sqrt'}. Best is trial 226 with value: 0.22026593151948148.
[I 2024-12-04 12:22:42,667] Trial 240 finished with value: 0.23489452499102934 and parameters: {'n_estimators': 1052, 'learning_rate': 0.09935241346244793, 'max_depth': 9, 'min_samples_split': 18, 'min_samples_leaf': 2, 'subsample': 0.8988048765026391, 'max_features': 'sqrt'}. Best is trial 226 with value: 0.22026593151948148.
[I 2024-12-04 12:22:44,614] Trial 235 finished with value: 0.2576333880024068 and parameters: {'n_estimators': 1130, 'learning_rate': 0.06532704979554375, 'max_depth': 8, 'min_samples_split': 19, 'min_samples_leaf': 1, 'subsample': 0.9351593834645491, 'max_features': None}. Best is trial 226 with value: 0.22026593151948148.
[I 2024-12-04 12:22:45,730] Trial 247 finished with value: 0.22549434516760575 and parameters: {'n_estimators': 887, 'learning_rate': 0.09635353838222074, 'max_depth': 10, 'min_samples_split': 16, 'min_samples_leaf': 1, 'subsample': 0.9769395138281435, 'max_features': 'sqrt'}. Best is trial 226 with value: 0.22026593151948148.
[I 2024-12-04 12:22:46,063] Trial 246 finished with value: 0.2565177939197503 and parameters: {'n_estimators': 933, 'learning_rate': 0.07867869633870961, 'max_depth': 10, 'min_samples_split': 19, 'min_samples_leaf': 2, 'subsample': 0.9469282450225388, 'max_features': 'log2'}. Best is trial 226 with value: 0.22026593151948148.
[I 2024-12-04 12:22:50,230] Trial 242 finished with value: 0.2387178275133738 and parameters: {'n_estimators': 1116, 'learning_rate': 0.0826161764998835, 'max_depth': 8, 'min_samples_split': 10, 'min_samples_leaf': 1, 'subsample': 0.9820541364207435, 'max_features': 'sqrt'}. Best is trial 226 with value: 0.22026593151948148.
[I 2024-12-04 12:22:50,280] Trial 233 finished with value: 0.2586540767754397 and parameters: {'n_estimators': 1339, 'learning_rate': 0.0786876961655292, 'max_depth': 12, 'min_samples_split': 13, 'min_samples_leaf': 3, 'subsample': 0.76460376177954, 'max_features': 'sqrt'}. Best is trial 226 with value: 0.22026593151948148.
[I 2024-12-04 12:22:50,561] Trial 248 finished with value: 0.23678002511629248 and parameters: {'n_estimators': 959, 'learning_rate': 0.08012950744823878, 'max_depth': 10, 'min_samples_split': 15, 'min_samples_leaf': 1, 'subsample': 0.8492624187766961, 'max_features': 'sqrt'}. Best is trial 226 with value: 0.22026593151948148.
[I 2024-12-04 12:22:51,420] Trial 234 finished with value: 0.2474874708114858 and parameters: {'n_estimators': 1404, 'learning_rate': 0.049836665660175694, 'max_depth': 11, 'min_samples_split': 4, 'min_samples_leaf': 2, 'subsample': 0.9841190558478364, 'max_features': 'sqrt'}. Best is trial 226 with value: 0.22026593151948148.
[I 2024-12-04 12:22:59,364] Trial 251 finished with value: 0.22404786808713406 and parameters: {'n_estimators': 1063, 'learning_rate': 0.09943011142043447, 'max_depth': 12, 'min_samples_split': 8, 'min_samples_leaf': 1, 'subsample': 0.8622024230141487, 'max_features': 'sqrt'}. Best is trial 226 with value: 0.22026593151948148.
[I 2024-12-04 12:22:59,711] Trial 244 finished with value: 0.2478200435683649 and parameters: {'n_estimators': 1209, 'learning_rate': 0.07890388950041484, 'max_depth': 8, 'min_samples_split': 5, 'min_samples_leaf': 2, 'subsample': 0.7051128073392492, 'max_features': 'sqrt'}. Best is trial 226 with value: 0.22026593151948148.
[I 2024-12-04 12:23:05,040] Trial 250 finished with value: 0.24661866702176943 and parameters: {'n_estimators': 1232, 'learning_rate': 0.07080794574971913, 'max_depth': 10, 'min_samples_split': 9, 'min_samples_leaf': 2, 'subsample': 0.9013189249243567, 'max_features': 'sqrt'}. Best is trial 226 with value: 0.22026593151948148.
[I 2024-12-04 12:23:05,474] Trial 237 finished with value: 0.29997610212637665 and parameters: {'n_estimators': 1362, 'learning_rate': 0.036261123420357144, 'max_depth': 12, 'min_samples_split': 12, 'min_samples_leaf': 2, 'subsample': 0.9954004248889462, 'max_features': None}. Best is trial 226 with value: 0.22026593151948148.
[I 2024-12-04 12:23:07,947] Trial 245 finished with value: 0.3057425797392377 and parameters: {'n_estimators': 1239, 'learning_rate': 0.093612801118254, 'max_depth': 11, 'min_samples_split': 5, 'min_samples_leaf': 3, 'subsample': 0.6199032793054935, 'max_features': None}. Best is trial 226 with value: 0.22026593151948148.
[I 2024-12-04 12:23:09,038] Trial 249 finished with value: 0.22725565448161353 and parameters: {'n_estimators': 1260, 'learning_rate': 0.07709495588167078, 'max_depth': 8, 'min_samples_split': 14, 'min_samples_leaf': 1, 'subsample': 0.8765683250631444, 'max_features': 'sqrt'}. Best is trial 226 with value: 0.22026593151948148.
[I 2024-12-04 12:23:10,548] Trial 253 finished with value: 0.24554996339634147 and parameters: {'n_estimators': 1083, 'learning_rate': 0.0975466216513836, 'max_depth': 9, 'min_samples_split': 2, 'min_samples_leaf': 2, 'subsample': 0.6628531372721083, 'max_features': 'sqrt'}. Best is trial 226 with value: 0.22026593151948148.
[I 2024-12-04 12:23:15,665] Trial 252 finished with value: 0.23439638614827965 and parameters: {'n_estimators': 1237, 'learning_rate': 0.043207527984602916, 'max_depth': 9, 'min_samples_split': 4, 'min_samples_leaf': 1, 'subsample': 0.6555545648865673, 'max_features': 'sqrt'}. Best is trial 226 with value: 0.22026593151948148.
[I 2024-12-04 12:23:23,899] Trial 254 finished with value: 0.22264005196689446 and parameters: {'n_estimators': 1302, 'learning_rate': 0.07299301392796427, 'max_depth': 10, 'min_samples_split': 11, 'min_samples_leaf': 1, 'subsample': 0.809384027412963, 'max_features': 'sqrt'}. Best is trial 226 with value: 0.22026593151948148.
[I 2024-12-04 12:23:27,462] Trial 262 finished with value: 0.28665638180345987 and parameters: {'n_estimators': 1004, 'learning_rate': 0.08953731204585427, 'max_depth': 7, 'min_samples_split': 18, 'min_samples_leaf': 2, 'subsample': 0.6274858878223186, 'max_features': 'log2'}. Best is trial 226 with value: 0.22026593151948148.
[I 2024-12-04 12:23:32,497] Trial 258 finished with value: 0.24911102605077776 and parameters: {'n_estimators': 1195, 'learning_rate': 0.05665821547568117, 'max_depth': 9, 'min_samples_split': 14, 'min_samples_leaf': 1, 'subsample': 0.7431175942023107, 'max_features': 'sqrt'}. Best is trial 226 with value: 0.22026593151948148.
[I 2024-12-04 12:23:33,654] Trial 255 finished with value: 0.28761468985721733 and parameters: {'n_estimators': 1413, 'learning_rate': 0.07989270081527952, 'max_depth': 10, 'min_samples_split': 18, 'min_samples_leaf': 3, 'subsample': 0.6086239201390232, 'max_features': 'log2'}. Best is trial 226 with value: 0.22026593151948148.
[I 2024-12-04 12:23:34,321] Trial 257 finished with value: 0.2499646388519563 and parameters: {'n_estimators': 1288, 'learning_rate': 0.047832053516450625, 'max_depth': 8, 'min_samples_split': 17, 'min_samples_leaf': 1, 'subsample': 0.7299373599792481, 'max_features': 'sqrt'}. Best is trial 226 with value: 0.22026593151948148.
[I 2024-12-04 12:23:37,997] Trial 259 finished with value: 0.21062976081411197 and parameters: {'n_estimators': 1273, 'learning_rate': 0.09517041127378957, 'max_depth': 11, 'min_samples_split': 15, 'min_samples_leaf': 1, 'subsample': 0.6408148551289552, 'max_features': 'sqrt'}. Best is trial 259 with value: 0.21062976081411197.
[I 2024-12-04 12:23:40,071] Trial 261 finished with value: 0.2335241024821706 and parameters: {'n_estimators': 1231, 'learning_rate': 0.05062955339453423, 'max_depth': 11, 'min_samples_split': 6, 'min_samples_leaf': 1, 'subsample': 0.6768679604123917, 'max_features': 'sqrt'}. Best is trial 259 with value: 0.21062976081411197.
[I 2024-12-04 12:23:41,896] Trial 270 finished with value: 0.23751195895102264 and parameters: {'n_estimators': 928, 'learning_rate': 0.0962295480369075, 'max_depth': 8, 'min_samples_split': 18, 'min_samples_leaf': 1, 'subsample': 0.8285118002419334, 'max_features': 'sqrt'}. Best is trial 259 with value: 0.21062976081411197.
[I 2024-12-04 12:23:41,911] Trial 266 finished with value: 0.26935548165169504 and parameters: {'n_estimators': 1074, 'learning_rate': 0.04702190116154457, 'max_depth': 8, 'min_samples_split': 20, 'min_samples_leaf': 2, 'subsample': 0.8680192190725299, 'max_features': 'sqrt'}. Best is trial 259 with value: 0.21062976081411197.
[I 2024-12-04 12:23:41,951] Trial 268 finished with value: 0.25174760364794774 and parameters: {'n_estimators': 1023, 'learning_rate': 0.0904528341245044, 'max_depth': 10, 'min_samples_split': 17, 'min_samples_leaf': 3, 'subsample': 0.8995308318402634, 'max_features': 'sqrt'}. Best is trial 259 with value: 0.21062976081411197.
[I 2024-12-04 12:23:46,436] Trial 274 finished with value: 0.23319900889212886 and parameters: {'n_estimators': 830, 'learning_rate': 0.07579067315573794, 'max_depth': 10, 'min_samples_split': 17, 'min_samples_leaf': 1, 'subsample': 0.9547903068789642, 'max_features': 'sqrt'}. Best is trial 259 with value: 0.21062976081411197.
[I 2024-12-04 12:23:47,492] Trial 256 finished with value: 0.3214989971932213 and parameters: {'n_estimators': 1402, 'learning_rate': 0.08824941707978444, 'max_depth': 10, 'min_samples_split': 10, 'min_samples_leaf': 2, 'subsample': 0.9521058955043057, 'max_features': None}. Best is trial 259 with value: 0.21062976081411197.
[I 2024-12-04 12:23:49,363] Trial 260 finished with value: 0.22960433960719018 and parameters: {'n_estimators': 1457, 'learning_rate': 0.0641667515267312, 'max_depth': 10, 'min_samples_split': 9, 'min_samples_leaf': 1, 'subsample': 0.9546440653709793, 'max_features': 'sqrt'}. Best is trial 259 with value: 0.21062976081411197.
