[I 2024-12-03 18:41:42,763] Trial 41 finished with value: 67.0184842556906 and parameters: {'kernel': 'sigmoid', 'C': 3.011849031689058, 'gamma': 0.19829346546890922, 'epsilon': 0.04245381194727062}. Best is trial 52 with value: 0.36614321458791227.
[I 2024-12-03 18:41:42,786] Trial 59 finished with value: 0.3992421401172897 and parameters: {'kernel': 'rbf', 'C': 20.14512082224528, 'gamma': 0.055943303339450134, 'epsilon': 0.07036472412191239}. Best is trial 52 with value: 0.36614321458791227.
[I 2024-12-03 18:41:43,073] Trial 49 finished with value: 0.40885021100358826 and parameters: {'kernel': 'rbf', 'C': 83.55202224938719, 'gamma': 0.016304623242200174, 'epsilon': 0.0010763063221616402}. Best is trial 52 with value: 0.36614321458791227.
[I 2024-12-03 18:41:43,298] Trial 58 finished with value: 2.9382364009711157 and parameters: {'kernel': 'poly', 'C': 15.19275280632444, 'gamma': 0.03152325125530595, 'epsilon': 0.8020767526536956}. Best is trial 52 with value: 0.36614321458791227.
[I 2024-12-03 18:41:43,470] Trial 50 finished with value: 0.7494000282708845 and parameters: {'kernel': 'linear', 'C': 20.45486028571637, 'gamma': 0.0031810378170184983, 'epsilon': 0.21190020141956228}. Best is trial 52 with value: 0.36614321458791227.
[I 2024-12-03 18:41:43,476] Trial 56 finished with value: 0.7259355672167307 and parameters: {'kernel': 'linear', 'C': 4.249191720101828, 'gamma': 0.11159423754845234, 'epsilon': 0.3738035930255818}. Best is trial 52 with value: 0.36614321458791227.
[I 2024-12-03 18:41:43,659] Trial 55 finished with value: 0.38899248159418526 and parameters: {'kernel': 'rbf', 'C': 47.51047920123465, 'gamma': 0.0267403826625884, 'epsilon': 0.06014156272977054}. Best is trial 52 with value: 0.36614321458791227.
[I 2024-12-03 18:41:44,624] Trial 65 finished with value: 0.5567418752313918 and parameters: {'kernel': 'rbf', 'C': 0.630401482163432, 'gamma': 0.05809625377046562, 'epsilon': 0.060621384212960226}. Best is trial 52 with value: 0.36614321458791227.
[I 2024-12-03 18:41:44,651] Trial 53 finished with value: 0.36969411489467074 and parameters: {'kernel': 'rbf', 'C': 92.82342970938058, 'gamma': 0.021557284777421786, 'epsilon': 0.06503702985884098}. Best is trial 52 with value: 0.36614321458791227.
[I 2024-12-03 18:41:44,921] Trial 67 finished with value: 0.43711324003817725 and parameters: {'kernel': 'rbf', 'C': 10.455149183048354, 'gamma': 0.07194012171925565, 'epsilon': 0.09011472760946355}. Best is trial 52 with value: 0.36614321458791227.
[I 2024-12-03 18:41:46,275] Trial 66 finished with value: 0.40857495906077784 and parameters: {'kernel': 'rbf', 'C': 97.75809254412886, 'gamma': 0.011715774386599377, 'epsilon': 0.055482425355941827}. Best is trial 52 with value: 0.36614321458791227.
[I 2024-12-03 18:41:46,705] Trial 73 finished with value: 0.37909680749092484 and parameters: {'kernel': 'rbf', 'C': 42.244069998627495, 'gamma': 0.033283029777940884, 'epsilon': 0.08338319996809748}. Best is trial 52 with value: 0.36614321458791227.
[I 2024-12-03 18:41:46,756] Trial 69 finished with value: 0.42306587645817256 and parameters: {'kernel': 'rbf', 'C': 46.48875625867004, 'gamma': 0.00931664908768457, 'epsilon': 0.10652784246636497}. Best is trial 52 with value: 0.36614321458791227.
[I 2024-12-03 18:41:46,794] Trial 70 finished with value: 0.3683412889645762 and parameters: {'kernel': 'rbf', 'C': 53.46854167639001, 'gamma': 0.04144588074714496, 'epsilon': 0.09902848214263953}. Best is trial 52 with value: 0.36614321458791227.
[I 2024-12-03 18:41:47,135] Trial 75 finished with value: 932.2474096783235 and parameters: {'kernel': 'sigmoid', 'C': 43.434741742480725, 'gamma': 0.044893718689137135, 'epsilon': 0.03509012973967758}. Best is trial 52 with value: 0.36614321458791227.
[I 2024-12-03 18:41:47,329] Trial 71 finished with value: 0.5213165931686571 and parameters: {'kernel': 'rbf', 'C': 2.8694809980964364, 'gamma': 0.09237071065245651, 'epsilon': 0.33450188996955865}. Best is trial 52 with value: 0.36614321458791227.
[I 2024-12-03 18:41:47,709] Trial 64 finished with value: 0.9909613413057015 and parameters: {'kernel': 'sigmoid', 'C': 0.004752799400250777, 'gamma': 0.04061976650628823, 'epsilon': 0.11136586437535755}. Best is trial 52 with value: 0.36614321458791227.
[I 2024-12-03 18:41:48,713] Trial 68 finished with value: 0.3697636521568696 and parameters: {'kernel': 'rbf', 'C': 61.811908013705285, 'gamma': 0.03474587822958667, 'epsilon': 0.02438087812364249}. Best is trial 52 with value: 0.36614321458791227.
[I 2024-12-03 18:41:49,019] Trial 72 finished with value: 0.3690431119384219 and parameters: {'kernel': 'rbf', 'C': 80.25073323917005, 'gamma': 0.03383198707937887, 'epsilon': 0.06473352617226386}. Best is trial 52 with value: 0.36614321458791227.
[I 2024-12-03 18:41:49,062] Trial 74 finished with value: 1.0638158081776223 and parameters: {'kernel': 'rbf', 'C': 0.004041526676614308, 'gamma': 0.00048497268835273946, 'epsilon': 0.001300154379543788}. Best is trial 52 with value: 0.36614321458791227.
[I 2024-12-03 18:41:49,064] Trial 83 finished with value: 0.49318125069756213 and parameters: {'kernel': 'rbf', 'C': 52.419490852811556, 'gamma': 0.18846858416779472, 'epsilon': 0.06487998039562715}. Best is trial 52 with value: 0.36614321458791227.
[I 2024-12-03 18:41:49,071] Trial 78 finished with value: 0.47471570119952405 and parameters: {'kernel': 'rbf', 'C': 25.72865676921998, 'gamma': 0.11844161632078831, 'epsilon': 0.2890925539472362}. Best is trial 52 with value: 0.36614321458791227.
[I 2024-12-03 18:41:49,356] Trial 77 finished with value: 0.37103362183634825 and parameters: {'kernel': 'rbf', 'C': 70.99607062790945, 'gamma': 0.05697768076995978, 'epsilon': 0.22731490059392842}. Best is trial 52 with value: 0.36614321458791227.
[I 2024-12-03 18:41:49,464] Trial 87 finished with value: 2.831022267015156 and parameters: {'kernel': 'poly', 'C': 90.56564499354549, 'gamma': 0.005113195902121853, 'epsilon': 0.09929657605160153}. Best is trial 52 with value: 0.36614321458791227.
[I 2024-12-03 18:41:49,951] Trial 85 finished with value: 57.02321798931943 and parameters: {'kernel': 'sigmoid', 'C': 3.3534973163972275, 'gamma': 0.019987121131611947, 'epsilon': 0.16135370818551614}. Best is trial 52 with value: 0.36614321458791227.
[I 2024-12-03 18:41:50,225] Trial 76 finished with value: 0.37520113791960974 and parameters: {'kernel': 'rbf', 'C': 50.31732877356805, 'gamma': 0.03193176733222594, 'epsilon': 0.052498631626176566}. Best is trial 52 with value: 0.36614321458791227.
[I 2024-12-03 18:41:50,771] Trial 1 finished with value: 0.9330803818485092 and parameters: {'kernel': 'poly', 'C': 0.7615143933835007, 'gamma': 0.07085399952410935, 'epsilon': 0.04673152782818413}. Best is trial 88 with value: 0.3542875001421725.
[I 2024-12-03 18:41:50,919] Trial 80 finished with value: 0.407003490401026 and parameters: {'kernel': 'rbf', 'C': 23.492045281476454, 'gamma': 0.01318312519369713, 'epsilon': 0.059004397226296836}. Best is trial 88 with value: 0.3542875001421725.
[I 2024-12-03 18:41:51,186] Trial 88 finished with value: 0.3542875001421725 and parameters: {'kernel': 'rbf', 'C': 86.7533711170639, 'gamma': 0.049107731993338434, 'epsilon': 0.11192072437420901}. Best is trial 88 with value: 0.3542875001421725.
[I 2024-12-03 18:41:51,191] Trial 84 finished with value: 0.8003367820483941 and parameters: {'kernel': 'linear', 'C': 1.616552648393614, 'gamma': 0.1939891461891881, 'epsilon': 0.03336719724438101}. Best is trial 88 with value: 0.3542875001421725.
[I 2024-12-03 18:41:51,194] Trial 79 finished with value: 0.37378156593841105 and parameters: {'kernel': 'rbf', 'C': 82.03137630154141, 'gamma': 0.05164486816703423, 'epsilon': 0.009888549123196817}. Best is trial 88 with value: 0.3542875001421725.
[I 2024-12-03 18:41:51,624] Trial 86 finished with value: 1.4083069385191107 and parameters: {'kernel': 'poly', 'C': 0.19894159590523222, 'gamma': 0.0045878959597235765, 'epsilon': 0.3981278495760198}. Best is trial 88 with value: 0.3542875001421725.
[I 2024-12-03 18:41:51,939] Trial 81 finished with value: 0.3881856999335696 and parameters: {'kernel': 'rbf', 'C': 78.61586546960082, 'gamma': 0.08268097467397344, 'epsilon': 0.18043633174184545}. Best is trial 88 with value: 0.3542875001421725.
[I 2024-12-03 18:41:52,197] Trial 91 finished with value: 1324.2942027765496 and parameters: {'kernel': 'sigmoid', 'C': 61.98335819083303, 'gamma': 0.0588045326918084, 'epsilon': 0.4384624941969866}. Best is trial 88 with value: 0.3542875001421725.
[I 2024-12-03 18:41:52,410] Trial 93 finished with value: 0.3773168602319461 and parameters: {'kernel': 'rbf', 'C': 45.82869244815546, 'gamma': 0.02353356100244387, 'epsilon': 0.22597417858930083}. Best is trial 88 with value: 0.3542875001421725.
[I 2024-12-03 18:41:52,748] Trial 89 finished with value: 0.36083727303450536 and parameters: {'kernel': 'rbf', 'C': 92.89380705424344, 'gamma': 0.05493824178233998, 'epsilon': 0.14491407695459868}. Best is trial 88 with value: 0.3542875001421725.
[I 2024-12-03 18:41:53,141] Trial 82 finished with value: 0.419113694737866 and parameters: {'kernel': 'rbf', 'C': 93.04305517008592, 'gamma': 0.12520732078422106, 'epsilon': 0.007226135698795369}. Best is trial 88 with value: 0.3542875001421725.
[I 2024-12-03 18:41:53,484] Trial 92 finished with value: 0.43511982154808754 and parameters: {'kernel': 'rbf', 'C': 90.75753385784179, 'gamma': 0.05050565912320135, 'epsilon': 0.4950439382298423}. Best is trial 88 with value: 0.3542875001421725.
[I 2024-12-03 18:41:53,940] Trial 95 finished with value: 0.3827354597500181 and parameters: {'kernel': 'rbf', 'C': 54.393847659014995, 'gamma': 0.02866015309449892, 'epsilon': 0.014678765294603168}. Best is trial 88 with value: 0.3542875001421725.
[I 2024-12-03 18:41:54,039] Trial 94 finished with value: 2.4525283047594613 and parameters: {'kernel': 'poly', 'C': 0.008791212908545119, 'gamma': 0.18580901700163557, 'epsilon': 0.008976184845173032}. Best is trial 88 with value: 0.3542875001421725.
[I 2024-12-03 18:41:54,287] Trial 98 finished with value: 0.3596042432342676 and parameters: {'kernel': 'rbf', 'C': 67.55667703082052, 'gamma': 0.049722189072204825, 'epsilon': 0.2018103699719953}. Best is trial 88 with value: 0.3542875001421725.
[I 2024-12-03 18:41:54,455] Trial 103 finished with value: 0.9972975470484936 and parameters: {'kernel': 'sigmoid', 'C': 0.004389202131329739, 'gamma': 0.012734804197403799, 'epsilon': 0.00106075782841556}. Best is trial 88 with value: 0.3542875001421725.
[I 2024-12-03 18:41:55,170] Trial 97 finished with value: 1468.5745152924815 and parameters: {'kernel': 'sigmoid', 'C': 74.07505730510387, 'gamma': 0.1309746775219258, 'epsilon': 0.004632779450672611}. Best is trial 88 with value: 0.3542875001421725.
[I 2024-12-03 18:41:55,171] Trial 101 finished with value: 0.38297851260300203 and parameters: {'kernel': 'rbf', 'C': 97.06747079240773, 'gamma': 0.06720503993839179, 'epsilon': 0.03619637262199223}. Best is trial 88 with value: 0.3542875001421725.
[I 2024-12-03 18:41:55,329] Trial 105 finished with value: 0.6775715192488044 and parameters: {'kernel': 'rbf', 'C': 97.79203650787329, 'gamma': 0.22674975483174628, 'epsilon': 0.5792108422148293}. Best is trial 88 with value: 0.3542875001421725.
[I 2024-12-03 18:41:56,004] Trial 102 finished with value: 0.3747160832175283 and parameters: {'kernel': 'rbf', 'C': 43.08680749916071, 'gamma': 0.04659059241433297, 'epsilon': 0.21559873015941267}. Best is trial 88 with value: 0.3542875001421725.
[I 2024-12-03 18:41:56,170] Trial 104 finished with value: 0.3772931932869289 and parameters: {'kernel': 'rbf', 'C': 41.268003312418685, 'gamma': 0.027633893724578435, 'epsilon': 0.2131981771995215}. Best is trial 88 with value: 0.3542875001421725.
[I 2024-12-03 18:41:56,560] Trial 107 finished with value: 0.39249446280900246 and parameters: {'kernel': 'rbf', 'C': 64.79101783828287, 'gamma': 0.09599471935331694, 'epsilon': 0.09089274514364083}. Best is trial 88 with value: 0.3542875001421725.
[I 2024-12-03 18:41:56,677] Trial 106 finished with value: 0.3673416699885492 and parameters: {'kernel': 'rbf', 'C': 46.322155141461934, 'gamma': 0.06243663797001075, 'epsilon': 0.163853271393293}. Best is trial 88 with value: 0.3542875001421725.
[I 2024-12-03 18:41:57,070] Trial 109 finished with value: 0.4792412095846513 and parameters: {'kernel': 'rbf', 'C': 2.5753135511672234, 'gamma': 0.01306572159359264, 'epsilon': 0.14243404716609356}. Best is trial 88 with value: 0.3542875001421725.
[I 2024-12-03 18:41:57,500] Trial 96 finished with value: 830.8055632408146 and parameters: {'kernel': 'sigmoid', 'C': 32.08835065778016, 'gamma': 0.36395634757830525, 'epsilon': 0.08421130224158334}. Best is trial 88 with value: 0.3542875001421725.
[I 2024-12-03 18:41:57,733] Trial 110 finished with value: 0.45320362330160946 and parameters: {'kernel': 'rbf', 'C': 69.06246137577442, 'gamma': 0.14158444320934543, 'epsilon': 0.1330254451843902}. Best is trial 88 with value: 0.3542875001421725.
[I 2024-12-03 18:41:58,021] Trial 45 finished with value: 0.796842336153792 and parameters: {'kernel': 'linear', 'C': 68.73605388308776, 'gamma': 0.009874976018686192, 'epsilon': 0.018788705501495147}. Best is trial 88 with value: 0.3542875001421725.
[I 2024-12-03 18:41:58,046] Trial 119 finished with value: 0.9201355858773893 and parameters: {'kernel': 'sigmoid', 'C': 0.1560864622156398, 'gamma': 0.0006149727765347749, 'epsilon': 0.5382669641709193}. Best is trial 88 with value: 0.3542875001421725.
[I 2024-12-03 18:41:58,048] Trial 108 finished with value: 0.3663921076500199 and parameters: {'kernel': 'rbf', 'C': 68.40315559194943, 'gamma': 0.0317414558496496, 'epsilon': 0.13363967084961423}. Best is trial 88 with value: 0.3542875001421725.
[I 2024-12-03 18:41:58,133] Trial 112 finished with value: 78.10508160495357 and parameters: {'kernel': 'sigmoid', 'C': 29.128353288196923, 'gamma': 0.002253749126636531, 'epsilon': 0.03163057588176385}. Best is trial 88 with value: 0.3542875001421725.
[I 2024-12-03 18:41:58,408] Trial 116 finished with value: 0.3667658202741689 and parameters: {'kernel': 'rbf', 'C': 86.77262946734616, 'gamma': 0.030098821450455924, 'epsilon': 0.08745314047739856}. Best is trial 88 with value: 0.3542875001421725.
[I 2024-12-03 18:41:58,451] Trial 118 finished with value: 0.40511656878684915 and parameters: {'kernel': 'rbf', 'C': 78.06563908993192, 'gamma': 0.0077816516797578825, 'epsilon': 0.2754507000854799}. Best is trial 88 with value: 0.3542875001421725.
[I 2024-12-03 18:41:59,008] Trial 117 finished with value: 1.030461276766858 and parameters: {'kernel': 'rbf', 'C': 0.009276597144994639, 'gamma': 0.0012123389024087613, 'epsilon': 0.22658982737990363}. Best is trial 88 with value: 0.3542875001421725.
[I 2024-12-03 18:42:00,172] Trial 115 finished with value: 1.0878415554198986 and parameters: {'kernel': 'poly', 'C': 2.415608652923699, 'gamma': 0.0001083513891732529, 'epsilon': 0.8462625166561347}. Best is trial 88 with value: 0.3542875001421725.
[I 2024-12-03 18:42:00,246] Trial 114 finished with value: 0.8959985874763559 and parameters: {'kernel': 'linear', 'C': 0.0014837096615161183, 'gamma': 0.0004611795670964625, 'epsilon': 0.005215911002745971}. Best is trial 88 with value: 0.3542875001421725.
[I 2024-12-03 18:42:00,468] Trial 120 finished with value: 0.36188093230347995 and parameters: {'kernel': 'rbf', 'C': 93.05248186560836, 'gamma': 0.03807007179935996, 'epsilon': 0.0821772690605461}. Best is trial 88 with value: 0.3542875001421725.
[I 2024-12-03 18:42:00,777] Trial 113 finished with value: 0.8620441350603004 and parameters: {'kernel': 'linear', 'C': 0.028046411218439808, 'gamma': 0.00021124770167763203, 'epsilon': 0.016193789245904987}. Best is trial 88 with value: 0.3542875001421725.
[I 2024-12-03 18:42:00,778] Trial 111 finished with value: 0.4009989162922332 and parameters: {'kernel': 'rbf', 'C': 18.647123296680423, 'gamma': 0.011419410290969061, 'epsilon': 0.03703542810058955}. Best is trial 88 with value: 0.3542875001421725.
[I 2024-12-03 18:42:00,784] Trial 126 finished with value: 0.3713130040445584 and parameters: {'kernel': 'rbf', 'C': 98.01974512762573, 'gamma': 0.01975374831564769, 'epsilon': 0.19598106670398746}. Best is trial 88 with value: 0.3542875001421725.
[I 2024-12-03 18:42:01,026] Trial 123 finished with value: 1.5197204579794243 and parameters: {'kernel': 'sigmoid', 'C': 0.03182447872943111, 'gamma': 0.7846520198923008, 'epsilon': 0.560084820620543}. Best is trial 88 with value: 0.3542875001421725.
[I 2024-12-03 18:42:01,433] Trial 131 finished with value: 0.3667301145778386 and parameters: {'kernel': 'rbf', 'C': 65.06324390031355, 'gamma': 0.029406992306716485, 'epsilon': 0.09997053005145239}. Best is trial 88 with value: 0.3542875001421725.
[I 2024-12-03 18:42:01,583] Trial 130 finished with value: 1.973110089262014 and parameters: {'kernel': 'sigmoid', 'C': 0.4946545582721708, 'gamma': 0.0036005191853537184, 'epsilon': 0.004883801505781725}. Best is trial 88 with value: 0.3542875001421725.
[I 2024-12-03 18:42:02,719] Trial 124 finished with value: 0.7875316662160204 and parameters: {'kernel': 'linear', 'C': 3.7325592678357378, 'gamma': 0.013704267081153538, 'epsilon': 0.07646272089614335}. Best is trial 88 with value: 0.3542875001421725.
[I 2024-12-03 18:42:03,412] Trial 133 finished with value: 0.41870774167395264 and parameters: {'kernel': 'rbf', 'C': 95.157816547918, 'gamma': 0.006820742654394526, 'epsilon': 0.03957304397656951}. Best is trial 88 with value: 0.3542875001421725.
[I 2024-12-03 18:42:03,647] Trial 122 finished with value: 1.072407615033086 and parameters: {'kernel': 'rbf', 'C': 0.001095019159150749, 'gamma': 0.00023966905657829272, 'epsilon': 0.024224002526197257}. Best is trial 88 with value: 0.3542875001421725.
[I 2024-12-03 18:42:04,016] Trial 129 finished with value: 0.3948405674471625 and parameters: {'kernel': 'rbf', 'C': 53.01605405407328, 'gamma': 0.006670863498026829, 'epsilon': 0.0834315944291432}. Best is trial 88 with value: 0.3542875001421725.
[I 2024-12-03 18:42:04,405] Trial 125 finished with value: 0.35662661601702333 and parameters: {'kernel': 'rbf', 'C': 66.01066998940482, 'gamma': 0.05339489611778987, 'epsilon': 0.11015312744643173}. Best is trial 88 with value: 0.3542875001421725.
[I 2024-12-03 18:42:04,406] Trial 137 finished with value: 0.41745977541598395 and parameters: {'kernel': 'rbf', 'C': 21.71953905818566, 'gamma': 0.026760473149689455, 'epsilon': 0.09363845101498601}. Best is trial 88 with value: 0.3542875001421725.
[I 2024-12-03 18:42:05,563] Trial 63 finished with value: 0.784030052904619 and parameters: {'kernel': 'linear', 'C': 78.45283280557925, 'gamma': 0.04462809621002939, 'epsilon': 0.12980781538708974}. Best is trial 88 with value: 0.3542875001421725.
[I 2024-12-03 18:42:05,655] Trial 135 finished with value: 0.37741165443430696 and parameters: {'kernel': 'rbf', 'C': 79.98507665021793, 'gamma': 0.01772420096207011, 'epsilon': 0.1753990657211171}. Best is trial 88 with value: 0.3542875001421725.
[I 2024-12-03 18:42:05,905] Trial 138 finished with value: 0.3895769689118802 and parameters: {'kernel': 'rbf', 'C': 92.16966494211403, 'gamma': 0.01627271440408863, 'epsilon': 0.07607829898926946}. Best is trial 88 with value: 0.3542875001421725.
[I 2024-12-03 18:42:05,979] Trial 127 finished with value: 0.5447734961426246 and parameters: {'kernel': 'rbf', 'C': 3.490166552579658, 'gamma': 0.2051734383744816, 'epsilon': 0.04838334279914195}. Best is trial 88 with value: 0.3542875001421725.
[I 2024-12-03 18:42:07,126] Trial 128 finished with value: 0.37547390287193755 and parameters: {'kernel': 'rbf', 'C': 83.51856179594971, 'gamma': 0.07206843185364667, 'epsilon': 0.1450966617845961}. Best is trial 88 with value: 0.3542875001421725.
[I 2024-12-03 18:42:07,422] Trial 121 finished with value: 0.8488562818458946 and parameters: {'kernel': 'sigmoid', 'C': 32.20065957346356, 'gamma': 0.0001319064210258025, 'epsilon': 0.7508493783238235}. Best is trial 88 with value: 0.3542875001421725.
[I 2024-12-03 18:42:09,956] Trial 140 finished with value: 0.3691489584176066 and parameters: {'kernel': 'rbf', 'C': 66.34946065817094, 'gamma': 0.028028054452803527, 'epsilon': 0.08261740346022046}. Best is trial 88 with value: 0.3542875001421725.
[I 2024-12-03 18:42:09,994] Trial 141 finished with value: 0.38336684292277695 and parameters: {'kernel': 'rbf', 'C': 35.61521596015372, 'gamma': 0.08601536198460888, 'epsilon': 0.071208921672478}. Best is trial 88 with value: 0.3542875001421725.
[I 2024-12-03 18:42:10,298] Trial 143 finished with value: 0.3682233251425836 and parameters: {'kernel': 'rbf', 'C': 86.42679623759976, 'gamma': 0.0336378506895995, 'epsilon': 0.06780161200813092}. Best is trial 88 with value: 0.3542875001421725.
[I 2024-12-03 18:42:10,301] Trial 145 finished with value: 1925.978492278649 and parameters: {'kernel': 'sigmoid', 'C': 97.16217900232797, 'gamma': 0.033924316529842596, 'epsilon': 0.11942834268575044}. Best is trial 88 with value: 0.3542875001421725.
[I 2024-12-03 18:42:10,489] Trial 146 finished with value: 0.3686033874836492 and parameters: {'kernel': 'rbf', 'C': 80.18562733709408, 'gamma': 0.024899255435116625, 'epsilon': 0.03466194042895349}. Best is trial 88 with value: 0.3542875001421725.
[I 2024-12-03 18:42:11,726] Trial 148 finished with value: 0.5569143277269438 and parameters: {'kernel': 'rbf', 'C': 58.44653523249635, 'gamma': 0.25898595261962826, 'epsilon': 0.08485457766472855}. Best is trial 88 with value: 0.3542875001421725.
[I 2024-12-03 18:42:11,917] Trial 150 finished with value: 1.0717984021871205 and parameters: {'kernel': 'rbf', 'C': 0.005291106756250417, 'gamma': 0.9237267690807124, 'epsilon': 0.1920614915938968}. Best is trial 88 with value: 0.3542875001421725.
[I 2024-12-03 18:42:12,059] Trial 147 finished with value: 0.36319929934261197 and parameters: {'kernel': 'rbf', 'C': 72.47001042988525, 'gamma': 0.042337712443267075, 'epsilon': 0.07627712311503664}. Best is trial 88 with value: 0.3542875001421725.
