[I 2024-12-03 18:43:09,730] Trial 314 finished with value: 0.7368551436397894 and parameters: {'kernel': 'linear', 'C': 36.47579621378471, 'gamma': 0.5245409365726658, 'epsilon': 0.4271470896232119}. Best is trial 88 with value: 0.3542875001421725.
[I 2024-12-03 18:43:09,864] Trial 330 finished with value: 0.3722358891415445 and parameters: {'kernel': 'rbf', 'C': 46.3468023987111, 'gamma': 0.027729930188069483, 'epsilon': 0.26198175711099325}. Best is trial 88 with value: 0.3542875001421725.
[I 2024-12-03 18:43:10,067] Trial 331 finished with value: 0.4002338995179786 and parameters: {'kernel': 'rbf', 'C': 98.51621459956078, 'gamma': 0.0825560760099402, 'epsilon': 0.23135513692754894}. Best is trial 88 with value: 0.3542875001421725.
[I 2024-12-03 18:43:10,123] Trial 319 finished with value: 0.39640850399134364 and parameters: {'kernel': 'rbf', 'C': 38.620617261832066, 'gamma': 0.05213795899151284, 'epsilon': 0.3280643698930603}. Best is trial 88 with value: 0.3542875001421725.
[I 2024-12-03 18:43:10,546] Trial 328 finished with value: 0.6823933838378637 and parameters: {'kernel': 'rbf', 'C': 67.72262592875822, 'gamma': 0.06906828815902548, 'epsilon': 0.8780277087777091}. Best is trial 88 with value: 0.3542875001421725.
[I 2024-12-03 18:43:11,162] Trial 332 finished with value: 0.7528250333816751 and parameters: {'kernel': 'linear', 'C': 5.984579339814902, 'gamma': 0.03730009175367351, 'epsilon': 0.1991669254586769}. Best is trial 88 with value: 0.3542875001421725.
[I 2024-12-03 18:43:11,190] Trial 316 finished with value: 2.919209420111022 and parameters: {'kernel': 'poly', 'C': 0.20684341733656328, 'gamma': 0.14857817371818177, 'epsilon': 0.7487208809970157}. Best is trial 88 with value: 0.3542875001421725.
[I 2024-12-03 18:43:11,717] Trial 333 finished with value: 0.41380195486063515 and parameters: {'kernel': 'rbf', 'C': 92.4436188605561, 'gamma': 0.03496642180039936, 'epsilon': 0.488517074705427}. Best is trial 88 with value: 0.3542875001421725.
[I 2024-12-03 18:43:12,124] Trial 337 finished with value: 1570.1481750708508 and parameters: {'kernel': 'sigmoid', 'C': 72.36248909144865, 'gamma': 0.04426100889156248, 'epsilon': 0.33541317692671513}. Best is trial 88 with value: 0.3542875001421725.
[I 2024-12-03 18:43:12,815] Trial 335 finished with value: 0.444775033012382 and parameters: {'kernel': 'rbf', 'C': 9.504589666452825, 'gamma': 0.07287328841414935, 'epsilon': 0.055990376942288}. Best is trial 88 with value: 0.3542875001421725.
[I 2024-12-03 18:43:12,911] Trial 339 finished with value: 0.4212254762984185 and parameters: {'kernel': 'rbf', 'C': 79.89522454333351, 'gamma': 0.10760072036817006, 'epsilon': 0.17971151389689682}. Best is trial 88 with value: 0.3542875001421725.
[I 2024-12-03 18:43:13,003] Trial 334 finished with value: 0.49188930196700636 and parameters: {'kernel': 'rbf', 'C': 14.958639302183517, 'gamma': 0.1714919353841565, 'epsilon': 0.09754156344428622}. Best is trial 88 with value: 0.3542875001421725.
[I 2024-12-03 18:43:13,379] Trial 342 finished with value: 0.41746137758105567 and parameters: {'kernel': 'rbf', 'C': 15.023921468072807, 'gamma': 0.047340848826671666, 'epsilon': 0.12693574570253638}. Best is trial 88 with value: 0.3542875001421725.
[I 2024-12-03 18:43:13,665] Trial 340 finished with value: 0.42028358400179205 and parameters: {'kernel': 'rbf', 'C': 13.89025640978589, 'gamma': 0.0610926175525569, 'epsilon': 0.08337329793647452}. Best is trial 88 with value: 0.3542875001421725.
[I 2024-12-03 18:43:14,357] Trial 347 finished with value: 1.484884215118107 and parameters: {'kernel': 'poly', 'C': 0.007605535331888184, 'gamma': 0.04197715573103278, 'epsilon': 0.0892688073576552}. Best is trial 88 with value: 0.3542875001421725.
[I 2024-12-03 18:43:14,784] Trial 336 finished with value: 0.37625183786229494 and parameters: {'kernel': 'rbf', 'C': 74.73941628797401, 'gamma': 0.018375379482042334, 'epsilon': 0.18535846083352409}. Best is trial 88 with value: 0.3542875001421725.
[I 2024-12-03 18:43:15,002] Trial 338 finished with value: 0.6638859214485086 and parameters: {'kernel': 'rbf', 'C': 23.624928358237895, 'gamma': 0.00013704809441047585, 'epsilon': 0.00923368823905816}. Best is trial 88 with value: 0.3542875001421725.
[I 2024-12-03 18:43:15,139] Trial 343 finished with value: 0.35756995599264135 and parameters: {'kernel': 'rbf', 'C': 97.5127900878407, 'gamma': 0.03612574373029319, 'epsilon': 0.22492679485646414}. Best is trial 88 with value: 0.3542875001421725.
[I 2024-12-03 18:43:15,164] Trial 349 finished with value: 0.37288911398104846 and parameters: {'kernel': 'rbf', 'C': 95.18882114015945, 'gamma': 0.017907034485325837, 'epsilon': 0.19108256755169556}. Best is trial 88 with value: 0.3542875001421725.
[I 2024-12-03 18:43:15,241] Trial 350 finished with value: 0.35507939112106335 and parameters: {'kernel': 'rbf', 'C': 84.47954396188743, 'gamma': 0.044953414966665106, 'epsilon': 0.11731605581345543}. Best is trial 88 with value: 0.3542875001421725.
[I 2024-12-03 18:43:15,692] Trial 344 finished with value: 0.36723907340454964 and parameters: {'kernel': 'rbf', 'C': 97.41261856555863, 'gamma': 0.023955899299258347, 'epsilon': 0.34423563538940966}. Best is trial 88 with value: 0.3542875001421725.
[I 2024-12-03 18:43:16,252] Trial 351 finished with value: 0.6051505958984834 and parameters: {'kernel': 'rbf', 'C': 84.01574620278662, 'gamma': 0.3506773127443806, 'epsilon': 0.0367588118295505}. Best is trial 88 with value: 0.3542875001421725.
[I 2024-12-03 18:43:16,283] Trial 345 finished with value: 1.0645038466418915 and parameters: {'kernel': 'sigmoid', 'C': 0.001392722800041779, 'gamma': 0.37546199369408934, 'epsilon': 0.0031419949254848194}. Best is trial 88 with value: 0.3542875001421725.
[I 2024-12-03 18:43:16,344] Trial 348 finished with value: 0.4568528528374628 and parameters: {'kernel': 'rbf', 'C': 96.65486850121427, 'gamma': 0.1296095191316076, 'epsilon': 0.19781172406380754}. Best is trial 88 with value: 0.3542875001421725.
[I 2024-12-03 18:43:17,173] Trial 357 finished with value: 0.35855464418053834 and parameters: {'kernel': 'rbf', 'C': 98.18055935002918, 'gamma': 0.03979344197000294, 'epsilon': 0.25052183196842004}. Best is trial 88 with value: 0.3542875001421725.
[I 2024-12-03 18:43:17,585] Trial 353 finished with value: 0.3875943878712306 and parameters: {'kernel': 'rbf', 'C': 93.1646424556664, 'gamma': 0.08132805727743285, 'epsilon': 0.18488241065505198}. Best is trial 88 with value: 0.3542875001421725.
[I 2024-12-03 18:43:17,723] Trial 352 finished with value: 0.41249439057384607 and parameters: {'kernel': 'rbf', 'C': 19.072157444153177, 'gamma': 0.09526239269127582, 'epsilon': 0.038439982307010255}. Best is trial 88 with value: 0.3542875001421725.
[I 2024-12-03 18:43:17,752] Trial 355 finished with value: 0.3612472761743716 and parameters: {'kernel': 'rbf', 'C': 96.91727144607324, 'gamma': 0.03515815836999247, 'epsilon': 0.16589207916860843}. Best is trial 88 with value: 0.3542875001421725.
[I 2024-12-03 18:43:18,121] Trial 346 finished with value: 0.45905143261174647 and parameters: {'kernel': 'rbf', 'C': 81.32246889009463, 'gamma': 0.13850015004826063, 'epsilon': 0.16872824924654917}. Best is trial 88 with value: 0.3542875001421725.
[I 2024-12-03 18:43:18,250] Trial 341 finished with value: 0.8722293056657937 and parameters: {'kernel': 'rbf', 'C': 0.18862252862469575, 'gamma': 0.0003329055002516636, 'epsilon': 0.1668608626890157}. Best is trial 88 with value: 0.3542875001421725.
[I 2024-12-03 18:43:18,263] Trial 358 finished with value: 0.3810062702113091 and parameters: {'kernel': 'rbf', 'C': 77.64004478613408, 'gamma': 0.07826003869976753, 'epsilon': 0.06104466252848029}. Best is trial 88 with value: 0.3542875001421725.
[I 2024-12-03 18:43:19,777] Trial 360 finished with value: 2024.2281450205703 and parameters: {'kernel': 'sigmoid', 'C': 94.74326173093566, 'gamma': 0.03984151723440854, 'epsilon': 0.08767552044929351}. Best is trial 88 with value: 0.3542875001421725.
[I 2024-12-03 18:43:21,323] Trial 366 finished with value: 0.42763363363006673 and parameters: {'kernel': 'rbf', 'C': 12.60452095450209, 'gamma': 0.05697177054605622, 'epsilon': 0.08859387365798888}. Best is trial 88 with value: 0.3542875001421725.
[I 2024-12-03 18:43:21,370] Trial 365 finished with value: 1.0601745805912883 and parameters: {'kernel': 'sigmoid', 'C': 0.00601993460248628, 'gamma': 0.0006882975089872813, 'epsilon': 0.011305563818382878}. Best is trial 88 with value: 0.3542875001421725.
[I 2024-12-03 18:43:21,819] Trial 363 finished with value: 0.400769358380559 and parameters: {'kernel': 'rbf', 'C': 87.0339258956112, 'gamma': 0.012111023837641937, 'epsilon': 0.14064140913939813}. Best is trial 88 with value: 0.3542875001421725.
[I 2024-12-03 18:43:21,820] Trial 362 finished with value: 0.4322352890409902 and parameters: {'kernel': 'rbf', 'C': 8.575553168724259, 'gamma': 0.02396847240481766, 'epsilon': 0.049108940810267725}. Best is trial 88 with value: 0.3542875001421725.
[I 2024-12-03 18:43:22,028] Trial 369 finished with value: 0.4311756285791095 and parameters: {'kernel': 'rbf', 'C': 16.709340749368792, 'gamma': 0.019910919017710523, 'epsilon': 0.14748151343884586}. Best is trial 88 with value: 0.3542875001421725.
[I 2024-12-03 18:43:22,396] Trial 368 finished with value: 1.7092548271681396 and parameters: {'kernel': 'sigmoid', 'C': 0.06583849718357493, 'gamma': 0.04090306183483618, 'epsilon': 0.0306680309829639}. Best is trial 88 with value: 0.3542875001421725.
[I 2024-12-03 18:43:22,524] Trial 262 finished with value: 0.8010428357789658 and parameters: {'kernel': 'linear', 'C': 56.69611321186355, 'gamma': 0.04598976856402515, 'epsilon': 0.07405423782558299}. Best is trial 88 with value: 0.3542875001421725.
[I 2024-12-03 18:43:22,527] Trial 356 finished with value: 0.38924814345016956 and parameters: {'kernel': 'rbf', 'C': 69.53443112584738, 'gamma': 0.07232845486083979, 'epsilon': 0.2454341711357023}. Best is trial 88 with value: 0.3542875001421725.
[I 2024-12-03 18:43:22,579] Trial 370 finished with value: 1.3710867623835439 and parameters: {'kernel': 'sigmoid', 'C': 0.5834909880073276, 'gamma': 0.0019484434518252404, 'epsilon': 0.034323720958455164}. Best is trial 88 with value: 0.3542875001421725.
[I 2024-12-03 18:43:23,305] Trial 361 finished with value: 0.3700226457472395 and parameters: {'kernel': 'rbf', 'C': 88.16300662891207, 'gamma': 0.026038322274916745, 'epsilon': 0.20046529721967166}. Best is trial 88 with value: 0.3542875001421725.
[I 2024-12-03 18:43:23,328] Trial 374 finished with value: 0.41490058201006763 and parameters: {'kernel': 'rbf', 'C': 98.21158999917662, 'gamma': 0.11592771777683178, 'epsilon': 0.10969017969266934}. Best is trial 88 with value: 0.3542875001421725.
[I 2024-12-03 18:43:23,566] Trial 373 finished with value: 0.44946926217191 and parameters: {'kernel': 'rbf', 'C': 7.036385916993804, 'gamma': 0.05041095030457078, 'epsilon': 0.30727215287780213}. Best is trial 88 with value: 0.3542875001421725.
[I 2024-12-03 18:43:23,972] Trial 375 finished with value: 0.4714532912822218 and parameters: {'kernel': 'rbf', 'C': 8.921697360815877, 'gamma': 0.07321593450582488, 'epsilon': 0.39609136971007003}. Best is trial 88 with value: 0.3542875001421725.
[I 2024-12-03 18:43:25,070] Trial 371 finished with value: 0.43638220323294946 and parameters: {'kernel': 'rbf', 'C': 65.66295369907226, 'gamma': 0.13824554975160538, 'epsilon': 0.06673377420173526}. Best is trial 88 with value: 0.3542875001421725.
[I 2024-12-03 18:43:25,627] Trial 372 finished with value: 0.36560001003238196 and parameters: {'kernel': 'rbf', 'C': 89.48063617283616, 'gamma': 0.03185546132244933, 'epsilon': 0.145636921532954}. Best is trial 88 with value: 0.3542875001421725.
[I 2024-12-03 18:43:25,859] Trial 377 finished with value: 0.3613455395256827 and parameters: {'kernel': 'rbf', 'C': 97.17373133393481, 'gamma': 0.03485154053892075, 'epsilon': 0.16744987231832875}. Best is trial 88 with value: 0.3542875001421725.
[I 2024-12-03 18:43:26,055] Trial 380 finished with value: 0.4593196458856351 and parameters: {'kernel': 'rbf', 'C': 12.466742068961915, 'gamma': 0.0028486245088837326, 'epsilon': 0.19089215736151222}. Best is trial 88 with value: 0.3542875001421725.
[I 2024-12-03 18:43:26,057] Trial 376 finished with value: 0.39839476844636673 and parameters: {'kernel': 'rbf', 'C': 86.67261308442727, 'gamma': 0.05825824859732429, 'epsilon': 0.34205716915740275}. Best is trial 88 with value: 0.3542875001421725.
[I 2024-12-03 18:43:26,381] Trial 386 finished with value: 0.8669166405523527 and parameters: {'kernel': 'linear', 'C': 0.022336336686994657, 'gamma': 0.0007562871732442209, 'epsilon': 0.0013037496125574374}. Best is trial 88 with value: 0.3542875001421725.
[I 2024-12-03 18:43:27,310] Trial 381 finished with value: 0.41272752554666026 and parameters: {'kernel': 'rbf', 'C': 12.828461335896133, 'gamma': 0.017320220367509725, 'epsilon': 0.06523814820140618}. Best is trial 88 with value: 0.3542875001421725.
[I 2024-12-03 18:43:27,483] Trial 383 finished with value: 0.7184243692692522 and parameters: {'kernel': 'rbf', 'C': 0.13919938271288868, 'gamma': 0.007025379023685492, 'epsilon': 0.001749465811584686}. Best is trial 88 with value: 0.3542875001421725.
[I 2024-12-03 18:43:28,129] Trial 379 finished with value: 0.3678114609214349 and parameters: {'kernel': 'rbf', 'C': 95.65849606693614, 'gamma': 0.029617806853077595, 'epsilon': 0.025384318345318735}. Best is trial 88 with value: 0.3542875001421725.
[I 2024-12-03 18:43:29,048] Trial 10 finished with value: 4.566713580373024 and parameters: {'kernel': 'poly', 'C': 0.5671271357164803, 'gamma': 0.3539570436947604, 'epsilon': 0.24566777325252107}. Best is trial 88 with value: 0.3542875001421725.
[I 2024-12-03 18:43:29,135] Trial 390 finished with value: 0.36725984172840115 and parameters: {'kernel': 'rbf', 'C': 68.5567024919779, 'gamma': 0.03413979111858209, 'epsilon': 0.06340860761999437}. Best is trial 88 with value: 0.3542875001421725.
[I 2024-12-03 18:43:29,340] Trial 387 finished with value: 1.0643017716218655 and parameters: {'kernel': 'poly', 'C': 0.007786907326860366, 'gamma': 0.0020058643310747726, 'epsilon': 0.7093876282315159}. Best is trial 88 with value: 0.3542875001421725.
[I 2024-12-03 18:43:29,589] Trial 389 finished with value: 0.4183999496747535 and parameters: {'kernel': 'rbf', 'C': 16.28677870602612, 'gamma': 0.04414817736756517, 'epsilon': 0.09778431452648448}. Best is trial 88 with value: 0.3542875001421725.
[I 2024-12-03 18:43:29,837] Trial 395 finished with value: 0.3797533116469485 and parameters: {'kernel': 'rbf', 'C': 86.0167731633443, 'gamma': 0.07602516086735812, 'epsilon': 0.08360874357657361}. Best is trial 88 with value: 0.3542875001421725.
[I 2024-12-03 18:43:29,839] Trial 392 finished with value: 0.42493893312871484 and parameters: {'kernel': 'rbf', 'C': 94.77890026914278, 'gamma': 0.08929242541672482, 'epsilon': 0.28052022741332205}. Best is trial 88 with value: 0.3542875001421725.
[I 2024-12-03 18:43:29,855] Trial 385 finished with value: 0.38582373349004445 and parameters: {'kernel': 'rbf', 'C': 93.34717636494088, 'gamma': 0.08091489445195277, 'epsilon': 0.07306940048922332}. Best is trial 88 with value: 0.3542875001421725.
[I 2024-12-03 18:43:29,902] Trial 382 finished with value: 0.37310461327355 and parameters: {'kernel': 'rbf', 'C': 90.25905511905346, 'gamma': 0.02109733109732042, 'epsilon': 0.07654132212787144}. Best is trial 88 with value: 0.3542875001421725.
/zhome/b1/0/88900/miniconda3/envs/critprops/lib/python3.9/site-packages/optuna/_experimental.py:31: ExperimentalWarning: Argument ``multivariate`` is an experimental feature. The interface can change in the future.
  warnings.warn(
/zhome/b1/0/88900/miniconda3/envs/critprops/lib/python3.9/site-packages/optuna/_experimental.py:31: ExperimentalWarning: Argument ``constant_liar`` is an experimental feature. The interface can change in the future.
  warnings.warn(
[I 2024-12-03 18:43:30,121] Trial 391 finished with value: 0.3688317506375366 and parameters: {'kernel': 'rbf', 'C': 97.5244790707868, 'gamma': 0.027482549743947874, 'epsilon': 0.1772373996196006}. Best is trial 88 with value: 0.3542875001421725.
[I 2024-12-03 18:43:30,406] Trial 388 finished with value: 0.748318586768874 and parameters: {'kernel': 'rbf', 'C': 83.97739067712403, 'gamma': 0.6670022108681254, 'epsilon': 0.13848713632448195}. Best is trial 88 with value: 0.3542875001421725.
[I 2024-12-03 18:43:31,811] Trial 393 finished with value: 0.404269454514224 and parameters: {'kernel': 'rbf', 'C': 85.03061447559966, 'gamma': 0.010834530297538648, 'epsilon': 0.17944277697850405}. Best is trial 88 with value: 0.3542875001421725.
[I 2024-12-03 18:43:32,038] Trial 397 finished with value: 0.43463356002088227 and parameters: {'kernel': 'rbf', 'C': 10.432819577672666, 'gamma': 0.04455086763411445, 'epsilon': 0.13090958434974723}. Best is trial 88 with value: 0.3542875001421725.
[I 2024-12-03 18:43:32,393] Trial 399 finished with value: 0.422646416830655 and parameters: {'kernel': 'rbf', 'C': 13.909271008012187, 'gamma': 0.08429616356654007, 'epsilon': 0.02335328351262044}. Best is trial 88 with value: 0.3542875001421725.
[I 2024-12-03 18:43:32,609] Trial 396 finished with value: 1.0478329991841178 and parameters: {'kernel': 'rbf', 'C': 0.0013044763987841376, 'gamma': 0.06598739887026132, 'epsilon': 0.04938404072068175}. Best is trial 88 with value: 0.3542875001421725.
[I 2024-12-03 18:43:32,626] Trial 394 finished with value: 0.36650097434645823 and parameters: {'kernel': 'rbf', 'C': 97.99668080067022, 'gamma': 0.023330044660284065, 'epsilon': 0.09025124453255245}. Best is trial 88 with value: 0.3542875001421725.
[I 2024-12-03 18:43:32,627] Trial 364 finished with value: 0.9757886958006432 and parameters: {'kernel': 'poly', 'C': 25.29430230690063, 'gamma': 0.02460549270053852, 'epsilon': 0.10305894618164838}. Best is trial 88 with value: 0.3542875001421725.
[I 2024-12-03 18:43:33,645] Trial 398 finished with value: 1.1456197469041431 and parameters: {'kernel': 'poly', 'C': 2.7621558463328384, 'gamma': 0.0005992305895918556, 'epsilon': 0.0010781262928352055}. Best is trial 88 with value: 0.3542875001421725.
[I 2024-12-03 18:43:34,673] Trial 405 finished with value: 0.3961888484034061 and parameters: {'kernel': 'rbf', 'C': 87.12497243242231, 'gamma': 0.09665537135653643, 'epsilon': 0.04887410833038924}. Best is trial 88 with value: 0.3542875001421725.
[I 2024-12-03 18:43:34,673] Trial 401 finished with value: 0.6215841664120986 and parameters: {'kernel': 'rbf', 'C': 7.007926832832085, 'gamma': 0.3269099248006118, 'epsilon': 0.2082937503176777}. Best is trial 88 with value: 0.3542875001421725.
[I 2024-12-03 18:43:34,798] Trial 400 finished with value: 0.42909094440149176 and parameters: {'kernel': 'rbf', 'C': 93.83907305545807, 'gamma': 0.04152418685655528, 'epsilon': 0.5199984726738984}. Best is trial 88 with value: 0.3542875001421725.
[I 2024-12-03 18:43:35,313] Trial 402 finished with value: 0.4208984402357299 and parameters: {'kernel': 'rbf', 'C': 19.467351998231987, 'gamma': 0.10797952369358531, 'epsilon': 0.11291157530095919}. Best is trial 88 with value: 0.3542875001421725.
[I 2024-12-03 18:43:35,543] Trial 406 finished with value: 0.4358851307006347 and parameters: {'kernel': 'rbf', 'C': 16.00546149257789, 'gamma': 0.010322469356059563, 'epsilon': 0.281024783904503}. Best is trial 88 with value: 0.3542875001421725.
[I 2024-12-03 18:43:35,615] Trial 408 finished with value: 0.4268637070158102 and parameters: {'kernel': 'rbf', 'C': 11.558387337353816, 'gamma': 0.049023536289792106, 'epsilon': 0.15213067979938377}. Best is trial 88 with value: 0.3542875001421725.
[I 2024-12-03 18:43:35,842] Trial 384 finished with value: 0.8045758465228557 and parameters: {'kernel': 'linear', 'C': 16.257153722352303, 'gamma': 0.00803478683941247, 'epsilon': 0.04420855013556738}. Best is trial 88 with value: 0.3542875001421725.
[I 2024-12-03 18:43:36,538] Trial 410 finished with value: 0.36382921393369094 and parameters: {'kernel': 'rbf', 'C': 95.45608346825858, 'gamma': 0.035796433920114994, 'epsilon': 0.08490822156568223}. Best is trial 88 with value: 0.3542875001421725.
[I 2024-12-03 18:43:36,565] Trial 409 finished with value: 0.9011641542042869 and parameters: {'kernel': 'linear', 'C': 0.0012520105358212869, 'gamma': 0.0068246300329746976, 'epsilon': 0.014599396143842331}. Best is trial 88 with value: 0.3542875001421725.
[I 2024-12-03 18:43:36,744] Trial 407 finished with value: 0.36760775698394615 and parameters: {'kernel': 'rbf', 'C': 87.3524072234401, 'gamma': 0.0641819365069038, 'epsilon': 0.10657153363760799}. Best is trial 88 with value: 0.3542875001421725.
[I 2024-12-03 18:43:36,820] Trial 411 finished with value: 0.43548328881168624 and parameters: {'kernel': 'rbf', 'C': 12.382637349388004, 'gamma': 0.0168303611113925, 'epsilon': 0.14852213915462184}. Best is trial 88 with value: 0.3542875001421725.
[I 2024-12-03 18:43:37,630] Trial 413 finished with value: 0.4377886554003654 and parameters: {'kernel': 'rbf', 'C': 9.804427758297702, 'gamma': 0.008807593045579582, 'epsilon': 0.21169750337503043}. Best is trial 88 with value: 0.3542875001421725.
[I 2024-12-03 18:43:37,634] Trial 404 finished with value: 0.39983855567303306 and parameters: {'kernel': 'rbf', 'C': 24.44900240851044, 'gamma': 0.0082849930750603, 'epsilon': 0.04966301720611249}. Best is trial 88 with value: 0.3542875001421725.
[I 2024-12-03 18:43:37,636] Trial 414 finished with value: 0.4373834249952011 and parameters: {'kernel': 'rbf', 'C': 13.345452707677568, 'gamma': 0.012382451756706275, 'epsilon': 0.28214522188158564}. Best is trial 88 with value: 0.3542875001421725.
[I 2024-12-03 18:43:37,765] Trial 415 finished with value: 0.4074963783522081 and parameters: {'kernel': 'rbf', 'C': 79.99320435006572, 'gamma': 0.11351164312128521, 'epsilon': 0.020281810317579675}. Best is trial 88 with value: 0.3542875001421725.
