[I 2024-12-04 12:38:34,712] Trial 661 finished with value: 0.2488278383774987 and parameters: {'n_estimators': 1421, 'learning_rate': 0.0981896416659331, 'max_depth': 10, 'min_samples_split': 15, 'min_samples_leaf': 2, 'subsample': 0.7191678031921579, 'max_features': 'sqrt'}. Best is trial 611 with value: 0.2042243937933349.
[I 2024-12-04 12:38:35,472] Trial 673 finished with value: 0.39761441984151236 and parameters: {'n_estimators': 826, 'learning_rate': 0.011943012656435539, 'max_depth': 12, 'min_samples_split': 5, 'min_samples_leaf': 2, 'subsample': 0.9548835168687285, 'max_features': 'log2'}. Best is trial 611 with value: 0.2042243937933349.
[I 2024-12-04 12:38:36,931] Trial 664 finished with value: 0.21558768393222383 and parameters: {'n_estimators': 1227, 'learning_rate': 0.09303214373926152, 'max_depth': 11, 'min_samples_split': 12, 'min_samples_leaf': 1, 'subsample': 0.6111285510892231, 'max_features': 'sqrt'}. Best is trial 611 with value: 0.2042243937933349.
[I 2024-12-04 12:38:46,221] Trial 667 finished with value: 0.23403518256184278 and parameters: {'n_estimators': 1429, 'learning_rate': 0.05780473640834179, 'max_depth': 10, 'min_samples_split': 14, 'min_samples_leaf': 1, 'subsample': 0.6063636126625059, 'max_features': 'sqrt'}. Best is trial 611 with value: 0.2042243937933349.
[I 2024-12-04 12:38:46,314] Trial 666 finished with value: 0.22126317499130493 and parameters: {'n_estimators': 1445, 'learning_rate': 0.042056295359655965, 'max_depth': 10, 'min_samples_split': 14, 'min_samples_leaf': 1, 'subsample': 0.6271516032093895, 'max_features': 'sqrt'}. Best is trial 611 with value: 0.2042243937933349.
[I 2024-12-04 12:38:49,044] Trial 694 finished with value: 0.44401211819246833 and parameters: {'n_estimators': 268, 'learning_rate': 0.015494859456556787, 'max_depth': 9, 'min_samples_split': 6, 'min_samples_leaf': 3, 'subsample': 0.9217019262615304, 'max_features': 'sqrt'}. Best is trial 611 with value: 0.2042243937933349.
[I 2024-12-04 12:38:53,625] Trial 670 finished with value: 0.2233251762324852 and parameters: {'n_estimators': 1369, 'learning_rate': 0.09406415833697668, 'max_depth': 9, 'min_samples_split': 12, 'min_samples_leaf': 1, 'subsample': 0.6101206878951877, 'max_features': 'sqrt'}. Best is trial 611 with value: 0.2042243937933349.
[I 2024-12-04 12:38:55,664] Trial 680 finished with value: 0.27620627434071393 and parameters: {'n_estimators': 909, 'learning_rate': 0.04646023588840274, 'max_depth': 10, 'min_samples_split': 20, 'min_samples_leaf': 4, 'subsample': 0.6246229070627213, 'max_features': 'sqrt'}. Best is trial 611 with value: 0.2042243937933349.
[I 2024-12-04 12:38:59,355] Trial 672 finished with value: 0.21694147630024654 and parameters: {'n_estimators': 1318, 'learning_rate': 0.0453721338200544, 'max_depth': 12, 'min_samples_split': 18, 'min_samples_leaf': 1, 'subsample': 0.6508212391132357, 'max_features': 'sqrt'}. Best is trial 611 with value: 0.2042243937933349.
[I 2024-12-04 12:39:02,169] Trial 691 finished with value: 0.41431323579009616 and parameters: {'n_estimators': 491, 'learning_rate': 0.010911957808185914, 'max_depth': 5, 'min_samples_split': 6, 'min_samples_leaf': 8, 'subsample': 0.6432019885696383, 'max_features': None}. Best is trial 611 with value: 0.2042243937933349.
[I 2024-12-04 12:39:05,303] Trial 676 finished with value: 0.20664602259115938 and parameters: {'n_estimators': 1237, 'learning_rate': 0.08920002617293821, 'max_depth': 12, 'min_samples_split': 20, 'min_samples_leaf': 1, 'subsample': 0.6192197545083047, 'max_features': 'sqrt'}. Best is trial 611 with value: 0.2042243937933349.
[I 2024-12-04 12:39:13,141] Trial 675 finished with value: 0.23644001555615843 and parameters: {'n_estimators': 1411, 'learning_rate': 0.0947842531303336, 'max_depth': 11, 'min_samples_split': 12, 'min_samples_leaf': 2, 'subsample': 0.6440156360250971, 'max_features': 'sqrt'}. Best is trial 611 with value: 0.2042243937933349.
[I 2024-12-04 12:39:15,471] Trial 674 finished with value: 0.21797143361152393 and parameters: {'n_estimators': 1481, 'learning_rate': 0.055814611872337834, 'max_depth': 12, 'min_samples_split': 18, 'min_samples_leaf': 1, 'subsample': 0.6644224317929375, 'max_features': 'sqrt'}. Best is trial 611 with value: 0.2042243937933349.
[I 2024-12-04 12:39:18,856] Trial 679 finished with value: 0.26223390782380074 and parameters: {'n_estimators': 1364, 'learning_rate': 0.06052865383797828, 'max_depth': 12, 'min_samples_split': 19, 'min_samples_leaf': 2, 'subsample': 0.628620202046587, 'max_features': 'log2'}. Best is trial 611 with value: 0.2042243937933349.
[I 2024-12-04 12:39:19,672] Trial 677 finished with value: 0.2413730149017641 and parameters: {'n_estimators': 1454, 'learning_rate': 0.05961453547308123, 'max_depth': 10, 'min_samples_split': 19, 'min_samples_leaf': 2, 'subsample': 0.6132556424036291, 'max_features': 'sqrt'}. Best is trial 611 with value: 0.2042243937933349.
[I 2024-12-04 12:39:25,051] Trial 683 finished with value: 0.3913324883024535 and parameters: {'n_estimators': 1175, 'learning_rate': 0.04566354064975031, 'max_depth': 6, 'min_samples_split': 19, 'min_samples_leaf': 10, 'subsample': 0.6573381124009543, 'max_features': None}. Best is trial 611 with value: 0.2042243937933349.
[I 2024-12-04 12:39:25,608] Trial 678 finished with value: 0.2243072047642917 and parameters: {'n_estimators': 1477, 'learning_rate': 0.08306201112285745, 'max_depth': 10, 'min_samples_split': 10, 'min_samples_leaf': 1, 'subsample': 0.6695101880911043, 'max_features': 'sqrt'}. Best is trial 611 with value: 0.2042243937933349.
[I 2024-12-04 12:39:27,251] Trial 682 finished with value: 0.4424007363163833 and parameters: {'n_estimators': 1365, 'learning_rate': 0.06546674419929642, 'max_depth': 10, 'min_samples_split': 18, 'min_samples_leaf': 9, 'subsample': 0.7645553558201942, 'max_features': 'log2'}. Best is trial 611 with value: 0.2042243937933349.
[I 2024-12-04 12:39:33,897] Trial 692 finished with value: 0.3308834292288729 and parameters: {'n_estimators': 974, 'learning_rate': 0.060449591910494, 'max_depth': 3, 'min_samples_split': 6, 'min_samples_leaf': 5, 'subsample': 0.8045144583684269, 'max_features': 'sqrt'}. Best is trial 611 with value: 0.2042243937933349.
[I 2024-12-04 12:39:36,182] Trial 681 finished with value: 0.21262133442927564 and parameters: {'n_estimators': 1500, 'learning_rate': 0.09269097208052283, 'max_depth': 11, 'min_samples_split': 12, 'min_samples_leaf': 1, 'subsample': 0.6433899223317193, 'max_features': 'sqrt'}. Best is trial 611 with value: 0.2042243937933349.
[I 2024-12-04 12:39:38,157] Trial 687 finished with value: 0.23059330628612362 and parameters: {'n_estimators': 1284, 'learning_rate': 0.086460123940383, 'max_depth': 12, 'min_samples_split': 15, 'min_samples_leaf': 1, 'subsample': 0.6078765266418872, 'max_features': 'sqrt'}. Best is trial 611 with value: 0.2042243937933349.
[I 2024-12-04 12:39:40,429] Trial 695 finished with value: 0.49741687923558797 and parameters: {'n_estimators': 1020, 'learning_rate': 0.022326909851670743, 'max_depth': 3, 'min_samples_split': 19, 'min_samples_leaf': 5, 'subsample': 0.9563804088278329, 'max_features': 'log2'}. Best is trial 611 with value: 0.2042243937933349.
[I 2024-12-04 12:39:40,469] Trial 693 finished with value: 0.22427005954671358 and parameters: {'n_estimators': 1204, 'learning_rate': 0.07993743110859258, 'max_depth': 10, 'min_samples_split': 15, 'min_samples_leaf': 1, 'subsample': 0.6230928696344127, 'max_features': 'sqrt'}. Best is trial 611 with value: 0.2042243937933349.
[I 2024-12-04 12:39:42,613] Trial 684 finished with value: 0.2320177278582828 and parameters: {'n_estimators': 1498, 'learning_rate': 0.0270588328766642, 'max_depth': 12, 'min_samples_split': 20, 'min_samples_leaf': 1, 'subsample': 0.6376417722822985, 'max_features': 'sqrt'}. Best is trial 611 with value: 0.2042243937933349.
[I 2024-12-04 12:39:44,054] Trial 689 finished with value: 0.21246871265989883 and parameters: {'n_estimators': 1328, 'learning_rate': 0.09743648604511479, 'max_depth': 12, 'min_samples_split': 14, 'min_samples_leaf': 1, 'subsample': 0.6516509791687606, 'max_features': 'sqrt'}. Best is trial 611 with value: 0.2042243937933349.
[I 2024-12-04 12:39:46,744] Trial 699 finished with value: 0.3648962968710441 and parameters: {'n_estimators': 1012, 'learning_rate': 0.06419030901741958, 'max_depth': 6, 'min_samples_split': 3, 'min_samples_leaf': 5, 'subsample': 0.7274396600973041, 'max_features': 'log2'}. Best is trial 611 with value: 0.2042243937933349.
[I 2024-12-04 12:39:46,758] Trial 686 finished with value: 0.22101582031465783 and parameters: {'n_estimators': 1467, 'learning_rate': 0.07445971870643016, 'max_depth': 12, 'min_samples_split': 17, 'min_samples_leaf': 1, 'subsample': 0.6257728452250253, 'max_features': 'sqrt'}. Best is trial 611 with value: 0.2042243937933349.
[I 2024-12-04 12:39:46,776] Trial 706 finished with value: 0.5370982635770015 and parameters: {'n_estimators': 809, 'learning_rate': 0.04050909195422991, 'max_depth': 8, 'min_samples_split': 18, 'min_samples_leaf': 9, 'subsample': 0.741115894879101, 'max_features': 'log2'}. Best is trial 611 with value: 0.2042243937933349.
[I 2024-12-04 12:39:47,907] Trial 688 finished with value: 0.365355079940983 and parameters: {'n_estimators': 1302, 'learning_rate': 0.05137679239125924, 'max_depth': 12, 'min_samples_split': 3, 'min_samples_leaf': 9, 'subsample': 0.673077071428301, 'max_features': None}. Best is trial 611 with value: 0.2042243937933349.
[I 2024-12-04 12:39:52,217] Trial 685 finished with value: 0.30213329805788114 and parameters: {'n_estimators': 1435, 'learning_rate': 0.08456588045652706, 'max_depth': 11, 'min_samples_split': 20, 'min_samples_leaf': 2, 'subsample': 0.6234184491666216, 'max_features': None}. Best is trial 611 with value: 0.2042243937933349.
[I 2024-12-04 12:40:02,626] Trial 690 finished with value: 0.23597041305647887 and parameters: {'n_estimators': 1485, 'learning_rate': 0.04949203746364606, 'max_depth': 10, 'min_samples_split': 14, 'min_samples_leaf': 1, 'subsample': 0.6777519766853022, 'max_features': 'sqrt'}. Best is trial 611 with value: 0.2042243937933349.
[I 2024-12-04 12:40:04,862] Trial 697 finished with value: 0.23755119998569052 and parameters: {'n_estimators': 1326, 'learning_rate': 0.052629059348398406, 'max_depth': 12, 'min_samples_split': 20, 'min_samples_leaf': 2, 'subsample': 0.6240899664144777, 'max_features': 'sqrt'}. Best is trial 611 with value: 0.2042243937933349.
[I 2024-12-04 12:40:08,295] Trial 702 finished with value: 0.24894187753742145 and parameters: {'n_estimators': 1268, 'learning_rate': 0.055677615971258795, 'max_depth': 10, 'min_samples_split': 11, 'min_samples_leaf': 2, 'subsample': 0.6057643679495381, 'max_features': 'sqrt'}. Best is trial 611 with value: 0.2042243937933349.
[I 2024-12-04 12:40:09,681] Trial 708 finished with value: 0.28951874222051405 and parameters: {'n_estimators': 1084, 'learning_rate': 0.03692363660240567, 'max_depth': 12, 'min_samples_split': 13, 'min_samples_leaf': 2, 'subsample': 0.6481803409490259, 'max_features': 'log2'}. Best is trial 611 with value: 0.2042243937933349.
[I 2024-12-04 12:40:10,900] Trial 696 finished with value: 0.22195512059591774 and parameters: {'n_estimators': 1464, 'learning_rate': 0.06111463748016018, 'max_depth': 12, 'min_samples_split': 19, 'min_samples_leaf': 1, 'subsample': 0.6344441610170378, 'max_features': 'sqrt'}. Best is trial 611 with value: 0.2042243937933349.
[I 2024-12-04 12:40:12,282] Trial 698 finished with value: 0.22433455086730658 and parameters: {'n_estimators': 1429, 'learning_rate': 0.0650255873679832, 'max_depth': 11, 'min_samples_split': 20, 'min_samples_leaf': 1, 'subsample': 0.6429672105550617, 'max_features': 'sqrt'}. Best is trial 611 with value: 0.2042243937933349.
[I 2024-12-04 12:40:13,692] Trial 704 finished with value: 0.4497113637313799 and parameters: {'n_estimators': 1315, 'learning_rate': 0.010448700993042705, 'max_depth': 3, 'min_samples_split': 5, 'min_samples_leaf': 4, 'subsample': 0.8489375567068915, 'max_features': 'sqrt'}. Best is trial 611 with value: 0.2042243937933349.
[I 2024-12-04 12:40:15,847] Trial 701 finished with value: 0.2544370522055417 and parameters: {'n_estimators': 1284, 'learning_rate': 0.06855858272485592, 'max_depth': 11, 'min_samples_split': 16, 'min_samples_leaf': 1, 'subsample': 0.6167698956857524, 'max_features': None}. Best is trial 611 with value: 0.2042243937933349.
[I 2024-12-04 12:40:16,913] Trial 705 finished with value: 0.2600105946392545 and parameters: {'n_estimators': 1316, 'learning_rate': 0.09596183799405114, 'max_depth': 10, 'min_samples_split': 11, 'min_samples_leaf': 3, 'subsample': 0.6190172203778558, 'max_features': 'sqrt'}. Best is trial 611 with value: 0.2042243937933349.
[I 2024-12-04 12:40:17,180] Trial 700 finished with value: 0.2215350593341239 and parameters: {'n_estimators': 1455, 'learning_rate': 0.09785710653435446, 'max_depth': 12, 'min_samples_split': 14, 'min_samples_leaf': 1, 'subsample': 0.6051746594961047, 'max_features': 'sqrt'}. Best is trial 611 with value: 0.2042243937933349.
[I 2024-12-04 12:40:22,928] Trial 703 finished with value: 0.21337077897983422 and parameters: {'n_estimators': 1472, 'learning_rate': 0.07757805410422036, 'max_depth': 11, 'min_samples_split': 16, 'min_samples_leaf': 1, 'subsample': 0.6689325843123428, 'max_features': 'sqrt'}. Best is trial 611 with value: 0.2042243937933349.
[I 2024-12-04 12:40:25,587] Trial 713 finished with value: 0.2267035646966191 and parameters: {'n_estimators': 1006, 'learning_rate': 0.07293134217301629, 'max_depth': 11, 'min_samples_split': 20, 'min_samples_leaf': 1, 'subsample': 0.6488138015379836, 'max_features': 'sqrt'}. Best is trial 611 with value: 0.2042243937933349.
[I 2024-12-04 12:40:25,629] Trial 707 finished with value: 0.240375630226092 and parameters: {'n_estimators': 1366, 'learning_rate': 0.09034622421949032, 'max_depth': 12, 'min_samples_split': 15, 'min_samples_leaf': 3, 'subsample': 0.616944565412211, 'max_features': 'sqrt'}. Best is trial 611 with value: 0.2042243937933349.
[I 2024-12-04 12:40:30,446] Trial 724 finished with value: 0.6251831324822177 and parameters: {'n_estimators': 524, 'learning_rate': 0.03756956825456587, 'max_depth': 8, 'min_samples_split': 3, 'min_samples_leaf': 9, 'subsample': 0.7866909435152403, 'max_features': 'log2'}. Best is trial 611 with value: 0.2042243937933349.
[I 2024-12-04 12:40:34,252] Trial 709 finished with value: 0.26041865502061523 and parameters: {'n_estimators': 1429, 'learning_rate': 0.03607760373656313, 'max_depth': 12, 'min_samples_split': 17, 'min_samples_leaf': 3, 'subsample': 0.6842286855606291, 'max_features': 'sqrt'}. Best is trial 611 with value: 0.2042243937933349.
[I 2024-12-04 12:40:36,714] Trial 710 finished with value: 0.23964886361094787 and parameters: {'n_estimators': 1330, 'learning_rate': 0.08360601150329486, 'max_depth': 10, 'min_samples_split': 19, 'min_samples_leaf': 2, 'subsample': 0.6114489134778199, 'max_features': 'sqrt'}. Best is trial 611 with value: 0.2042243937933349.
[I 2024-12-04 12:40:37,912] Trial 711 finished with value: 0.21738838842192784 and parameters: {'n_estimators': 1307, 'learning_rate': 0.07600428966787401, 'max_depth': 12, 'min_samples_split': 20, 'min_samples_leaf': 1, 'subsample': 0.6146478248868112, 'max_features': 'sqrt'}. Best is trial 611 with value: 0.2042243937933349.
[I 2024-12-04 12:40:39,418] Trial 712 finished with value: 0.22180456256275585 and parameters: {'n_estimators': 1267, 'learning_rate': 0.08178624959130698, 'max_depth': 11, 'min_samples_split': 20, 'min_samples_leaf': 1, 'subsample': 0.6135943031142822, 'max_features': 'sqrt'}. Best is trial 611 with value: 0.2042243937933349.
[I 2024-12-04 12:40:43,434] Trial 727 finished with value: 0.32497533169460835 and parameters: {'n_estimators': 643, 'learning_rate': 0.05042796317431576, 'max_depth': 4, 'min_samples_split': 19, 'min_samples_leaf': 5, 'subsample': 0.9811027713355813, 'max_features': None}. Best is trial 611 with value: 0.2042243937933349.
[I 2024-12-04 12:40:44,014] Trial 736 finished with value: 0.3805030674432538 and parameters: {'n_estimators': 259, 'learning_rate': 0.023400038986700476, 'max_depth': 6, 'min_samples_split': 18, 'min_samples_leaf': 7, 'subsample': 0.862801679063913, 'max_features': None}. Best is trial 611 with value: 0.2042243937933349.
[I 2024-12-04 12:40:47,976] Trial 731 finished with value: 0.44991063091534844 and parameters: {'n_estimators': 575, 'learning_rate': 0.07506097228379056, 'max_depth': 3, 'min_samples_split': 8, 'min_samples_leaf': 7, 'subsample': 0.9452138779120831, 'max_features': 'log2'}. Best is trial 611 with value: 0.2042243937933349.
[I 2024-12-04 12:40:48,144] Trial 739 finished with value: 0.6157651105921229 and parameters: {'n_estimators': 275, 'learning_rate': 0.02005204476400302, 'max_depth': 3, 'min_samples_split': 18, 'min_samples_leaf': 8, 'subsample': 0.9230093603447096, 'max_features': 'sqrt'}. Best is trial 611 with value: 0.2042243937933349.
[I 2024-12-04 12:40:50,559] Trial 716 finished with value: 0.24494447998173857 and parameters: {'n_estimators': 1269, 'learning_rate': 0.06465928082135299, 'max_depth': 12, 'min_samples_split': 20, 'min_samples_leaf': 3, 'subsample': 0.7070752376268512, 'max_features': 'sqrt'}. Best is trial 611 with value: 0.2042243937933349.
[I 2024-12-04 12:40:56,557] Trial 714 finished with value: 0.21515044170961786 and parameters: {'n_estimators': 1394, 'learning_rate': 0.07851504227810903, 'max_depth': 12, 'min_samples_split': 14, 'min_samples_leaf': 1, 'subsample': 0.7014046303939642, 'max_features': 'sqrt'}. Best is trial 611 with value: 0.2042243937933349.
[I 2024-12-04 12:40:59,651] Trial 719 finished with value: 0.22495619890281207 and parameters: {'n_estimators': 1262, 'learning_rate': 0.0898194380573993, 'max_depth': 11, 'min_samples_split': 14, 'min_samples_leaf': 1, 'subsample': 0.6630146983447038, 'max_features': 'sqrt'}. Best is trial 611 with value: 0.2042243937933349.
[I 2024-12-04 12:41:01,011] Trial 715 finished with value: 0.2328250394445144 and parameters: {'n_estimators': 1449, 'learning_rate': 0.038508562850670336, 'max_depth': 12, 'min_samples_split': 16, 'min_samples_leaf': 1, 'subsample': 0.6093252497966967, 'max_features': 'sqrt'}. Best is trial 611 with value: 0.2042243937933349.
[I 2024-12-04 12:41:02,256] Trial 717 finished with value: 0.2202052341525965 and parameters: {'n_estimators': 1364, 'learning_rate': 0.09286957363110834, 'max_depth': 11, 'min_samples_split': 18, 'min_samples_leaf': 1, 'subsample': 0.6393163608925072, 'max_features': 'sqrt'}. Best is trial 611 with value: 0.2042243937933349.
[I 2024-12-04 12:41:02,764] Trial 732 finished with value: 0.7076929600149199 and parameters: {'n_estimators': 767, 'learning_rate': 0.016494454158537487, 'max_depth': 8, 'min_samples_split': 6, 'min_samples_leaf': 9, 'subsample': 0.6071405063102142, 'max_features': 'log2'}. Best is trial 611 with value: 0.2042243937933349.
[I 2024-12-04 12:41:08,473] Trial 722 finished with value: 0.22508225658426192 and parameters: {'n_estimators': 1241, 'learning_rate': 0.09636180639642657, 'max_depth': 10, 'min_samples_split': 15, 'min_samples_leaf': 2, 'subsample': 0.6890985144402535, 'max_features': 'sqrt'}. Best is trial 611 with value: 0.2042243937933349.
[I 2024-12-04 12:41:10,115] Trial 725 finished with value: 0.2303035528534621 and parameters: {'n_estimators': 1152, 'learning_rate': 0.08910981097086912, 'max_depth': 12, 'min_samples_split': 20, 'min_samples_leaf': 2, 'subsample': 0.6299951189271347, 'max_features': 'sqrt'}. Best is trial 611 with value: 0.2042243937933349.
[I 2024-12-04 12:41:10,119] Trial 718 finished with value: 0.2534797858745734 and parameters: {'n_estimators': 1448, 'learning_rate': 0.04702358102951379, 'max_depth': 12, 'min_samples_split': 13, 'min_samples_leaf': 3, 'subsample': 0.701129631371071, 'max_features': 'sqrt'}. Best is trial 611 with value: 0.2042243937933349.
[I 2024-12-04 12:41:16,483] Trial 734 finished with value: 0.23764271301289377 and parameters: {'n_estimators': 858, 'learning_rate': 0.08568222670274858, 'max_depth': 9, 'min_samples_split': 18, 'min_samples_leaf': 1, 'subsample': 0.6441823349448755, 'max_features': 'sqrt'}. Best is trial 611 with value: 0.2042243937933349.
[I 2024-12-04 12:41:16,559] Trial 729 finished with value: 0.23004607142051398 and parameters: {'n_estimators': 1126, 'learning_rate': 0.08053262837738631, 'max_depth': 12, 'min_samples_split': 13, 'min_samples_leaf': 2, 'subsample': 0.7020181000713478, 'max_features': 'sqrt'}. Best is trial 611 with value: 0.2042243937933349.
[I 2024-12-04 12:41:17,796] Trial 721 finished with value: 0.25232022049446823 and parameters: {'n_estimators': 1458, 'learning_rate': 0.03775170384283967, 'max_depth': 11, 'min_samples_split': 18, 'min_samples_leaf': 3, 'subsample': 0.6069481131561162, 'max_features': 'sqrt'}. Best is trial 611 with value: 0.2042243937933349.
[I 2024-12-04 12:41:20,734] Trial 720 finished with value: 0.21625700349515742 and parameters: {'n_estimators': 1486, 'learning_rate': 0.06921018962614887, 'max_depth': 12, 'min_samples_split': 15, 'min_samples_leaf': 1, 'subsample': 0.6631016899588004, 'max_features': 'sqrt'}. Best is trial 611 with value: 0.2042243937933349.
[I 2024-12-04 12:41:22,910] Trial 747 finished with value: 0.4160095737520152 and parameters: {'n_estimators': 528, 'learning_rate': 0.0560021035072798, 'max_depth': 10, 'min_samples_split': 8, 'min_samples_leaf': 8, 'subsample': 0.6113805587149543, 'max_features': 'sqrt'}. Best is trial 611 with value: 0.2042243937933349.
[I 2024-12-04 12:41:23,111] Trial 735 finished with value: 0.2586313823114742 and parameters: {'n_estimators': 928, 'learning_rate': 0.09193237402759184, 'max_depth': 9, 'min_samples_split': 19, 'min_samples_leaf': 3, 'subsample': 0.6503978410823829, 'max_features': 'sqrt'}. Best is trial 611 with value: 0.2042243937933349.
