[I 2024-12-04 12:07:41,382] Trial 2309 finished with value: 0.5012455514307295 and parameters: {'max_depth': 30, 'min_samples_split': 11, 'min_samples_leaf': 1, 'max_features': 'sqrt', 'criterion': 'friedman_mse', 'splitter': 'best'}. Best is trial 458 with value: 0.430928156546456.
[I 2024-12-04 12:07:41,782] Trial 2315 finished with value: 0.5834257575214995 and parameters: {'max_depth': 23, 'min_samples_split': 13, 'min_samples_leaf': 1, 'max_features': 'sqrt', 'criterion': 'friedman_mse', 'splitter': 'best'}. Best is trial 458 with value: 0.430928156546456.
[I 2024-12-04 12:07:41,797] Trial 2313 finished with value: 0.9986705309945677 and parameters: {'max_depth': 6, 'min_samples_split': 3, 'min_samples_leaf': 6, 'max_features': 'log2', 'criterion': 'absolute_error', 'splitter': 'best'}. Best is trial 458 with value: 0.430928156546456.
[I 2024-12-04 12:07:41,839] Trial 2318 finished with value: 0.584300197786044 and parameters: {'max_depth': 32, 'min_samples_split': 13, 'min_samples_leaf': 3, 'max_features': 'sqrt', 'criterion': 'squared_error', 'splitter': 'best'}. Best is trial 458 with value: 0.430928156546456.
[I 2024-12-04 12:07:41,850] Trial 2317 finished with value: 0.5641364352696134 and parameters: {'max_depth': 35, 'min_samples_split': 16, 'min_samples_leaf': 2, 'max_features': 'sqrt', 'criterion': 'friedman_mse', 'splitter': 'best'}. Best is trial 458 with value: 0.430928156546456.
[I 2024-12-04 12:07:41,996] Trial 2316 finished with value: 0.5459840798044118 and parameters: {'max_depth': 35, 'min_samples_split': 13, 'min_samples_leaf': 2, 'max_features': 'sqrt', 'criterion': 'friedman_mse', 'splitter': 'best'}. Best is trial 458 with value: 0.430928156546456.
[I 2024-12-04 12:07:42,289] Trial 2300 finished with value: 0.5459840798044118 and parameters: {'max_depth': 35, 'min_samples_split': 12, 'min_samples_leaf': 2, 'max_features': 'sqrt', 'criterion': 'friedman_mse', 'splitter': 'best'}. Best is trial 458 with value: 0.430928156546456.
[I 2024-12-04 12:07:42,675] Trial 2319 finished with value: 0.4615785299849214 and parameters: {'max_depth': 35, 'min_samples_split': 10, 'min_samples_leaf': 1, 'max_features': 'sqrt', 'criterion': 'friedman_mse', 'splitter': 'best'}. Best is trial 458 with value: 0.430928156546456.
[I 2024-12-04 12:07:43,976] Trial 2306 finished with value: 0.5260707068792781 and parameters: {'max_depth': 30, 'min_samples_split': 10, 'min_samples_leaf': 1, 'max_features': 'sqrt', 'criterion': 'friedman_mse', 'splitter': 'best'}. Best is trial 458 with value: 0.430928156546456.
[I 2024-12-04 12:07:44,501] Trial 2296 finished with value: 0.5383324524629657 and parameters: {'max_depth': 29, 'min_samples_split': 19, 'min_samples_leaf': 1, 'max_features': 'sqrt', 'criterion': 'friedman_mse', 'splitter': 'best'}. Best is trial 458 with value: 0.430928156546456.
[I 2024-12-04 12:07:45,066] Trial 2321 finished with value: 0.430928156546456 and parameters: {'max_depth': 35, 'min_samples_split': 13, 'min_samples_leaf': 1, 'max_features': 'sqrt', 'criterion': 'friedman_mse', 'splitter': 'best'}. Best is trial 458 with value: 0.430928156546456.
[I 2024-12-04 12:07:45,483] Trial 2322 finished with value: 0.7844362007659383 and parameters: {'max_depth': 22, 'min_samples_split': 3, 'min_samples_leaf': 7, 'max_features': 'sqrt', 'criterion': 'absolute_error', 'splitter': 'best'}. Best is trial 458 with value: 0.430928156546456.
[I 2024-12-04 12:07:46,214] Trial 2320 finished with value: 0.584300197786044 and parameters: {'max_depth': 35, 'min_samples_split': 12, 'min_samples_leaf': 3, 'max_features': 'sqrt', 'criterion': 'friedman_mse', 'splitter': 'best'}. Best is trial 458 with value: 0.430928156546456.
[I 2024-12-04 12:07:48,395] Trial 2335 finished with value: 0.430928156546456 and parameters: {'max_depth': 35, 'min_samples_split': 13, 'min_samples_leaf': 1, 'max_features': 'sqrt', 'criterion': 'friedman_mse', 'splitter': 'best'}. Best is trial 458 with value: 0.430928156546456.
[I 2024-12-04 12:07:48,402] Trial 2323 finished with value: 0.48913122864637676 and parameters: {'max_depth': 35, 'min_samples_split': 16, 'min_samples_leaf': 1, 'max_features': 'sqrt', 'criterion': 'friedman_mse', 'splitter': 'best'}. Best is trial 458 with value: 0.430928156546456.
[I 2024-12-04 12:07:48,617] Trial 2332 finished with value: 0.9597516113963797 and parameters: {'max_depth': 24, 'min_samples_split': 8, 'min_samples_leaf': 6, 'max_features': 'sqrt', 'criterion': 'squared_error', 'splitter': 'random'}. Best is trial 458 with value: 0.430928156546456.
[I 2024-12-04 12:07:49,102] Trial 2328 finished with value: 0.48913122864637676 and parameters: {'max_depth': 35, 'min_samples_split': 16, 'min_samples_leaf': 1, 'max_features': 'sqrt', 'criterion': 'friedman_mse', 'splitter': 'best'}. Best is trial 458 with value: 0.430928156546456.
[I 2024-12-04 12:07:49,103] Trial 2330 finished with value: 0.9986705309945677 and parameters: {'max_depth': 2, 'min_samples_split': 18, 'min_samples_leaf': 9, 'max_features': 'log2', 'criterion': 'absolute_error', 'splitter': 'best'}. Best is trial 458 with value: 0.430928156546456.
[I 2024-12-04 12:07:49,587] Trial 2327 finished with value: 0.584300197786044 and parameters: {'max_depth': 30, 'min_samples_split': 12, 'min_samples_leaf': 3, 'max_features': 'sqrt', 'criterion': 'friedman_mse', 'splitter': 'best'}. Best is trial 458 with value: 0.430928156546456.
[I 2024-12-04 12:07:50,288] Trial 2333 finished with value: 0.4399442512678781 and parameters: {'max_depth': 35, 'min_samples_split': 14, 'min_samples_leaf': 1, 'max_features': 'sqrt', 'criterion': 'friedman_mse', 'splitter': 'best'}. Best is trial 458 with value: 0.430928156546456.
[I 2024-12-04 12:07:50,470] Trial 2337 finished with value: 0.4615785299849214 and parameters: {'max_depth': 35, 'min_samples_split': 10, 'min_samples_leaf': 1, 'max_features': 'sqrt', 'criterion': 'friedman_mse', 'splitter': 'best'}. Best is trial 458 with value: 0.430928156546456.
[I 2024-12-04 12:07:50,774] Trial 2336 finished with value: 0.584300197786044 and parameters: {'max_depth': 30, 'min_samples_split': 13, 'min_samples_leaf': 3, 'max_features': 'sqrt', 'criterion': 'friedman_mse', 'splitter': 'best'}. Best is trial 458 with value: 0.430928156546456.
[I 2024-12-04 12:07:50,882] Trial 2340 finished with value: 0.47495142754566344 and parameters: {'max_depth': 35, 'min_samples_split': 11, 'min_samples_leaf': 1, 'max_features': 'sqrt', 'criterion': 'friedman_mse', 'splitter': 'best'}. Best is trial 458 with value: 0.430928156546456.
[I 2024-12-04 12:07:51,266] Trial 2324 finished with value: 0.993306423171686 and parameters: {'max_depth': 2, 'min_samples_split': 9, 'min_samples_leaf': 1, 'max_features': 'log2', 'criterion': 'friedman_mse', 'splitter': 'best'}. Best is trial 458 with value: 0.430928156546456.
[I 2024-12-04 12:07:51,592] Trial 2334 finished with value: 0.5178071867440288 and parameters: {'max_depth': 30, 'min_samples_split': 12, 'min_samples_leaf': 1, 'max_features': 'sqrt', 'criterion': 'friedman_mse', 'splitter': 'best'}. Best is trial 458 with value: 0.430928156546456.
[I 2024-12-04 12:07:52,295] Trial 2326 finished with value: 0.4713924065212343 and parameters: {'max_depth': 30, 'min_samples_split': 13, 'min_samples_leaf': 1, 'max_features': 'sqrt', 'criterion': 'friedman_mse', 'splitter': 'best'}. Best is trial 458 with value: 0.430928156546456.
[I 2024-12-04 12:07:52,370] Trial 2347 finished with value: 0.530471704746649 and parameters: {'max_depth': 35, 'min_samples_split': 13, 'min_samples_leaf': 1, 'max_features': 'sqrt', 'criterion': 'absolute_error', 'splitter': 'best'}. Best is trial 458 with value: 0.430928156546456.
[I 2024-12-04 12:07:54,074] Trial 2329 finished with value: 0.5459840798044118 and parameters: {'max_depth': 35, 'min_samples_split': 12, 'min_samples_leaf': 2, 'max_features': 'sqrt', 'criterion': 'friedman_mse', 'splitter': 'best'}. Best is trial 458 with value: 0.430928156546456.
[I 2024-12-04 12:07:54,568] Trial 2341 finished with value: 0.584300197786044 and parameters: {'max_depth': 35, 'min_samples_split': 13, 'min_samples_leaf': 3, 'max_features': 'sqrt', 'criterion': 'friedman_mse', 'splitter': 'best'}. Best is trial 458 with value: 0.430928156546456.
[I 2024-12-04 12:07:54,898] Trial 2342 finished with value: 0.5526281900399846 and parameters: {'max_depth': 30, 'min_samples_split': 15, 'min_samples_leaf': 1, 'max_features': 'sqrt', 'criterion': 'friedman_mse', 'splitter': 'best'}. Best is trial 458 with value: 0.430928156546456.
[I 2024-12-04 12:07:55,502] Trial 2351 finished with value: 0.9381757790636528 and parameters: {'max_depth': 5, 'min_samples_split': 2, 'min_samples_leaf': 6, 'max_features': 'sqrt', 'criterion': 'squared_error', 'splitter': 'best'}. Best is trial 458 with value: 0.430928156546456.
[I 2024-12-04 12:07:55,871] Trial 2343 finished with value: 0.584300197786044 and parameters: {'max_depth': 29, 'min_samples_split': 17, 'min_samples_leaf': 3, 'max_features': 'sqrt', 'criterion': 'friedman_mse', 'splitter': 'best'}. Best is trial 458 with value: 0.430928156546456.
[I 2024-12-04 12:07:55,899] Trial 2345 finished with value: 0.4713924065212343 and parameters: {'max_depth': 30, 'min_samples_split': 13, 'min_samples_leaf': 1, 'max_features': 'sqrt', 'criterion': 'friedman_mse', 'splitter': 'best'}. Best is trial 458 with value: 0.430928156546456.
[I 2024-12-04 12:07:56,236] Trial 2349 finished with value: 0.584300197786044 and parameters: {'max_depth': 35, 'min_samples_split': 14, 'min_samples_leaf': 3, 'max_features': 'sqrt', 'criterion': 'friedman_mse', 'splitter': 'best'}. Best is trial 458 with value: 0.430928156546456.
[I 2024-12-04 12:07:56,361] Trial 2338 finished with value: 0.5641364352696134 and parameters: {'max_depth': 35, 'min_samples_split': 17, 'min_samples_leaf': 2, 'max_features': 'sqrt', 'criterion': 'friedman_mse', 'splitter': 'best'}. Best is trial 458 with value: 0.430928156546456.
[I 2024-12-04 12:07:56,959] Trial 2344 finished with value: 0.6136108715112272 and parameters: {'max_depth': 20, 'min_samples_split': 12, 'min_samples_leaf': 3, 'max_features': 'sqrt', 'criterion': 'absolute_error', 'splitter': 'best'}. Best is trial 458 with value: 0.430928156546456.
[I 2024-12-04 12:07:56,960] Trial 2331 finished with value: 0.430928156546456 and parameters: {'max_depth': 35, 'min_samples_split': 13, 'min_samples_leaf': 1, 'max_features': 'sqrt', 'criterion': 'friedman_mse', 'splitter': 'best'}. Best is trial 458 with value: 0.430928156546456.
[I 2024-12-04 12:07:57,379] Trial 2325 finished with value: 0.5526281900399846 and parameters: {'max_depth': 30, 'min_samples_split': 15, 'min_samples_leaf': 1, 'max_features': 'sqrt', 'criterion': 'friedman_mse', 'splitter': 'best'}. Best is trial 458 with value: 0.430928156546456.
[I 2024-12-04 12:07:57,771] Trial 2356 finished with value: 0.5540396621454082 and parameters: {'max_depth': 35, 'min_samples_split': 15, 'min_samples_leaf': 1, 'max_features': 'log2', 'criterion': 'friedman_mse', 'splitter': 'best'}. Best is trial 458 with value: 0.430928156546456.
[I 2024-12-04 12:07:58,287] Trial 2350 finished with value: 0.9768226224263046 and parameters: {'max_depth': 1, 'min_samples_split': 18, 'min_samples_leaf': 1, 'max_features': 'sqrt', 'criterion': 'absolute_error', 'splitter': 'best'}. Best is trial 458 with value: 0.430928156546456.
[I 2024-12-04 12:07:58,630] Trial 2348 finished with value: 0.4399442512678781 and parameters: {'max_depth': 35, 'min_samples_split': 14, 'min_samples_leaf': 1, 'max_features': 'sqrt', 'criterion': 'friedman_mse', 'splitter': 'best'}. Best is trial 458 with value: 0.430928156546456.
[I 2024-12-04 12:07:58,811] Trial 2339 finished with value: 0.9597516113963797 and parameters: {'max_depth': 18, 'min_samples_split': 20, 'min_samples_leaf': 10, 'max_features': 'sqrt', 'criterion': 'friedman_mse', 'splitter': 'random'}. Best is trial 458 with value: 0.430928156546456.
[I 2024-12-04 12:07:59,485] Trial 2352 finished with value: 0.4914699729644116 and parameters: {'max_depth': 30, 'min_samples_split': 16, 'min_samples_leaf': 1, 'max_features': 'sqrt', 'criterion': 'friedman_mse', 'splitter': 'best'}. Best is trial 458 with value: 0.430928156546456.
[I 2024-12-04 12:08:00,098] Trial 2355 finished with value: 0.5858505599509766 and parameters: {'max_depth': 35, 'min_samples_split': 10, 'min_samples_leaf': 3, 'max_features': 'sqrt', 'criterion': 'friedman_mse', 'splitter': 'best'}. Best is trial 458 with value: 0.430928156546456.
[I 2024-12-04 12:08:00,177] Trial 2357 finished with value: 0.5459840798044118 and parameters: {'max_depth': 35, 'min_samples_split': 12, 'min_samples_leaf': 2, 'max_features': 'sqrt', 'criterion': 'friedman_mse', 'splitter': 'best'}. Best is trial 458 with value: 0.430928156546456.
[I 2024-12-04 12:08:00,548] Trial 2353 finished with value: 0.5178071867440288 and parameters: {'max_depth': 30, 'min_samples_split': 12, 'min_samples_leaf': 1, 'max_features': 'sqrt', 'criterion': 'friedman_mse', 'splitter': 'best'}. Best is trial 458 with value: 0.430928156546456.
[I 2024-12-04 12:08:01,055] Trial 2346 finished with value: 0.48913122864637676 and parameters: {'max_depth': 35, 'min_samples_split': 16, 'min_samples_leaf': 1, 'max_features': 'sqrt', 'criterion': 'friedman_mse', 'splitter': 'best'}. Best is trial 458 with value: 0.430928156546456.
[I 2024-12-04 12:08:01,270] Trial 2354 finished with value: 0.8558428381311738 and parameters: {'max_depth': 14, 'min_samples_split': 15, 'min_samples_leaf': 3, 'max_features': 'log2', 'criterion': 'squared_error', 'splitter': 'best'}. Best is trial 458 with value: 0.430928156546456.
[I 2024-12-04 12:08:01,340] Trial 2361 finished with value: 0.5045494824944808 and parameters: {'max_depth': 35, 'min_samples_split': 7, 'min_samples_leaf': 1, 'max_features': 'sqrt', 'criterion': 'friedman_mse', 'splitter': 'best'}. Best is trial 458 with value: 0.430928156546456.
[I 2024-12-04 12:08:01,752] Trial 2362 finished with value: 0.9625068790481612 and parameters: {'max_depth': 14, 'min_samples_split': 5, 'min_samples_leaf': 5, 'max_features': 'log2', 'criterion': 'squared_error', 'splitter': 'random'}. Best is trial 458 with value: 0.430928156546456.
[I 2024-12-04 12:08:01,754] Trial 2360 finished with value: 0.6984405305992375 and parameters: {'max_depth': 35, 'min_samples_split': 17, 'min_samples_leaf': 2, 'max_features': 'sqrt', 'criterion': 'absolute_error', 'splitter': 'best'}. Best is trial 458 with value: 0.430928156546456.
[I 2024-12-04 12:08:02,428] Trial 2363 finished with value: 0.5114775627050339 and parameters: {'max_depth': 30, 'min_samples_split': 8, 'min_samples_leaf': 1, 'max_features': 'sqrt', 'criterion': 'friedman_mse', 'splitter': 'best'}. Best is trial 458 with value: 0.430928156546456.
[I 2024-12-04 12:08:03,663] Trial 2364 finished with value: 0.4399442512678781 and parameters: {'max_depth': 35, 'min_samples_split': 14, 'min_samples_leaf': 1, 'max_features': 'sqrt', 'criterion': 'friedman_mse', 'splitter': 'best'}. Best is trial 458 with value: 0.430928156546456.
[I 2024-12-04 12:08:05,003] Trial 2365 finished with value: 0.6956034395868106 and parameters: {'max_depth': 21, 'min_samples_split': 4, 'min_samples_leaf': 10, 'max_features': 'sqrt', 'criterion': 'squared_error', 'splitter': 'best'}. Best is trial 458 with value: 0.430928156546456.
[I 2024-12-04 12:08:05,830] Trial 2359 finished with value: 0.47495142754566344 and parameters: {'max_depth': 35, 'min_samples_split': 11, 'min_samples_leaf': 1, 'max_features': 'sqrt', 'criterion': 'friedman_mse', 'splitter': 'best'}. Best is trial 458 with value: 0.430928156546456.
[I 2024-12-04 12:08:06,512] Trial 2358 finished with value: 0.543086762165181 and parameters: {'max_depth': 35, 'min_samples_split': 11, 'min_samples_leaf': 1, 'max_features': 'log2', 'criterion': 'friedman_mse', 'splitter': 'best'}. Best is trial 458 with value: 0.430928156546456.
[I 2024-12-04 12:08:06,514] Trial 2367 finished with value: 0.5178360218831576 and parameters: {'max_depth': 29, 'min_samples_split': 11, 'min_samples_leaf': 1, 'max_features': 'sqrt', 'criterion': 'friedman_mse', 'splitter': 'best'}. Best is trial 458 with value: 0.430928156546456.
[I 2024-12-04 12:08:07,719] Trial 2379 finished with value: 0.584300197786044 and parameters: {'max_depth': 35, 'min_samples_split': 16, 'min_samples_leaf': 3, 'max_features': 'sqrt', 'criterion': 'friedman_mse', 'splitter': 'best'}. Best is trial 458 with value: 0.430928156546456.
[I 2024-12-04 12:08:07,901] Trial 2371 finished with value: 0.5536809488663907 and parameters: {'max_depth': 30, 'min_samples_split': 14, 'min_samples_leaf': 2, 'max_features': 'sqrt', 'criterion': 'friedman_mse', 'splitter': 'best'}. Best is trial 458 with value: 0.430928156546456.
[I 2024-12-04 12:08:08,961] Trial 2369 finished with value: 0.584300197786044 and parameters: {'max_depth': 35, 'min_samples_split': 13, 'min_samples_leaf': 3, 'max_features': 'sqrt', 'criterion': 'friedman_mse', 'splitter': 'best'}. Best is trial 458 with value: 0.430928156546456.
[I 2024-12-04 12:08:09,444] Trial 2368 finished with value: 0.5858505599509766 and parameters: {'max_depth': 28, 'min_samples_split': 10, 'min_samples_leaf': 3, 'max_features': 'sqrt', 'criterion': 'friedman_mse', 'splitter': 'best'}. Best is trial 458 with value: 0.430928156546456.
[I 2024-12-04 12:08:09,447] Trial 2373 finished with value: 0.47344856982335537 and parameters: {'max_depth': 35, 'min_samples_split': 12, 'min_samples_leaf': 1, 'max_features': 'sqrt', 'criterion': 'squared_error', 'splitter': 'best'}. Best is trial 458 with value: 0.430928156546456.
[I 2024-12-04 12:08:09,795] Trial 2372 finished with value: 0.6992211263931477 and parameters: {'max_depth': 16, 'min_samples_split': 18, 'min_samples_leaf': 5, 'max_features': 'sqrt', 'criterion': 'squared_error', 'splitter': 'best'}. Best is trial 458 with value: 0.430928156546456.
[I 2024-12-04 12:08:09,878] Trial 2366 finished with value: 0.5319670614340929 and parameters: {'max_depth': 29, 'min_samples_split': 15, 'min_samples_leaf': 1, 'max_features': 'sqrt', 'criterion': 'squared_error', 'splitter': 'best'}. Best is trial 458 with value: 0.430928156546456.
[I 2024-12-04 12:08:10,335] Trial 2370 finished with value: 0.5178071867440288 and parameters: {'max_depth': 30, 'min_samples_split': 12, 'min_samples_leaf': 1, 'max_features': 'sqrt', 'criterion': 'friedman_mse', 'splitter': 'best'}. Best is trial 458 with value: 0.430928156546456.
[I 2024-12-04 12:08:11,532] Trial 2378 finished with value: 0.47495142754566344 and parameters: {'max_depth': 35, 'min_samples_split': 11, 'min_samples_leaf': 1, 'max_features': 'sqrt', 'criterion': 'friedman_mse', 'splitter': 'best'}. Best is trial 458 with value: 0.430928156546456.
[I 2024-12-04 12:08:12,176] Trial 2376 finished with value: 0.584300197786044 and parameters: {'max_depth': 30, 'min_samples_split': 13, 'min_samples_leaf': 3, 'max_features': 'sqrt', 'criterion': 'friedman_mse', 'splitter': 'best'}. Best is trial 458 with value: 0.430928156546456.
[I 2024-12-04 12:08:12,341] Trial 2377 finished with value: 0.5273419897492498 and parameters: {'max_depth': 35, 'min_samples_split': 15, 'min_samples_leaf': 1, 'max_features': 'sqrt', 'criterion': 'friedman_mse', 'splitter': 'best'}. Best is trial 458 with value: 0.430928156546456.
[I 2024-12-04 12:08:12,560] Trial 2374 finished with value: 0.5615513230084576 and parameters: {'max_depth': 30, 'min_samples_split': 11, 'min_samples_leaf': 2, 'max_features': 'sqrt', 'criterion': 'friedman_mse', 'splitter': 'best'}. Best is trial 458 with value: 0.430928156546456.
[I 2024-12-04 12:08:13,567] Trial 2375 finished with value: 0.8558428381311738 and parameters: {'max_depth': 29, 'min_samples_split': 11, 'min_samples_leaf': 3, 'max_features': 'log2', 'criterion': 'friedman_mse', 'splitter': 'best'}. Best is trial 458 with value: 0.430928156546456.
[I 2024-12-04 12:08:13,898] Trial 2385 finished with value: 0.5459840798044118 and parameters: {'max_depth': 35, 'min_samples_split': 12, 'min_samples_leaf': 2, 'max_features': 'sqrt', 'criterion': 'friedman_mse', 'splitter': 'best'}. Best is trial 458 with value: 0.430928156546456.
[I 2024-12-04 12:08:14,054] Trial 2389 finished with value: 0.430928156546456 and parameters: {'max_depth': 35, 'min_samples_split': 13, 'min_samples_leaf': 1, 'max_features': 'sqrt', 'criterion': 'friedman_mse', 'splitter': 'best'}. Best is trial 458 with value: 0.430928156546456.
[I 2024-12-04 12:08:14,142] Trial 2386 finished with value: 0.4713924065212343 and parameters: {'max_depth': 30, 'min_samples_split': 13, 'min_samples_leaf': 1, 'max_features': 'sqrt', 'criterion': 'friedman_mse', 'splitter': 'best'}. Best is trial 458 with value: 0.430928156546456.
[I 2024-12-04 12:08:15,096] Trial 2390 finished with value: 0.6123285821712405 and parameters: {'max_depth': 24, 'min_samples_split': 15, 'min_samples_leaf': 1, 'max_features': 'sqrt', 'criterion': 'friedman_mse', 'splitter': 'best'}. Best is trial 458 with value: 0.430928156546456.
[I 2024-12-04 12:08:15,100] Trial 2387 finished with value: 0.9986705309945677 and parameters: {'max_depth': 20, 'min_samples_split': 20, 'min_samples_leaf': 7, 'max_features': 'log2', 'criterion': 'absolute_error', 'splitter': 'best'}. Best is trial 458 with value: 0.430928156546456.
[I 2024-12-04 12:08:15,286] Trial 2380 finished with value: 0.720403600808402 and parameters: {'max_depth': 29, 'min_samples_split': 15, 'min_samples_leaf': 3, 'max_features': 'sqrt', 'criterion': 'friedman_mse', 'splitter': 'random'}. Best is trial 458 with value: 0.430928156546456.
[I 2024-12-04 12:08:15,482] Trial 2383 finished with value: 0.4615785299849214 and parameters: {'max_depth': 35, 'min_samples_split': 10, 'min_samples_leaf': 1, 'max_features': 'sqrt', 'criterion': 'friedman_mse', 'splitter': 'best'}. Best is trial 458 with value: 0.430928156546456.
