[I 2024-12-03 18:48:25,958] Trial 1044 finished with value: 1011.6720293877438 and parameters: {'kernel': 'sigmoid', 'C': 96.18564276375191, 'gamma': 0.00855181908667367, 'epsilon': 0.086579456893462}. Best is trial 88 with value: 0.3542875001421725.
[I 2024-12-03 18:48:26,016] Trial 1045 finished with value: 0.4264788179003376 and parameters: {'kernel': 'rbf', 'C': 18.222219881277244, 'gamma': 0.10343426936762624, 'epsilon': 0.1668406540402876}. Best is trial 88 with value: 0.3542875001421725.
[I 2024-12-03 18:48:26,937] Trial 1046 finished with value: 0.4288048091032132 and parameters: {'kernel': 'rbf', 'C': 17.937126559134335, 'gamma': 0.014909225324985701, 'epsilon': 0.2703339101506442}. Best is trial 88 with value: 0.3542875001421725.
[I 2024-12-03 18:48:26,938] Trial 1023 finished with value: 1.885423904820435 and parameters: {'kernel': 'poly', 'C': 58.75708694262662, 'gamma': 0.038180827606030976, 'epsilon': 0.48765570208354814}. Best is trial 88 with value: 0.3542875001421725.
[I 2024-12-03 18:48:27,379] Trial 1047 finished with value: 0.3550012324206531 and parameters: {'kernel': 'rbf', 'C': 99.18290303376027, 'gamma': 0.04585921752568829, 'epsilon': 0.10174930370188622}. Best is trial 88 with value: 0.3542875001421725.
[I 2024-12-03 18:48:27,558] Trial 1048 finished with value: 0.6229622149975298 and parameters: {'kernel': 'rbf', 'C': 98.91445759613428, 'gamma': 0.04389372472060687, 'epsilon': 0.9149534800933651}. Best is trial 88 with value: 0.3542875001421725.
[I 2024-12-03 18:48:28,300] Trial 1049 finished with value: 0.4161850928342469 and parameters: {'kernel': 'rbf', 'C': 19.907564628421387, 'gamma': 0.015658530533039547, 'epsilon': 0.06294069335466472}. Best is trial 88 with value: 0.3542875001421725.
[I 2024-12-03 18:48:28,993] Trial 1050 finished with value: 0.3699208590537022 and parameters: {'kernel': 'rbf', 'C': 96.88126639374242, 'gamma': 0.022305182356274558, 'epsilon': 0.370395134629658}. Best is trial 88 with value: 0.3542875001421725.
[I 2024-12-03 18:48:29,437] Trial 1051 finished with value: 0.41730642285076364 and parameters: {'kernel': 'rbf', 'C': 93.46026890257966, 'gamma': 0.12170199922128418, 'epsilon': 0.07035607833826447}. Best is trial 88 with value: 0.3542875001421725.
[I 2024-12-03 18:48:30,210] Trial 1052 finished with value: 0.3662431606554248 and parameters: {'kernel': 'rbf', 'C': 97.37648638566958, 'gamma': 0.02369986646686954, 'epsilon': 0.09393025298977341}. Best is trial 88 with value: 0.3542875001421725.
[I 2024-12-03 18:48:30,492] Trial 1054 finished with value: 0.3720067619140692 and parameters: {'kernel': 'rbf', 'C': 93.18848663388903, 'gamma': 0.02040354108291034, 'epsilon': 0.14055977185814228}. Best is trial 88 with value: 0.3542875001421725.
[I 2024-12-03 18:48:30,900] Trial 1053 finished with value: 0.3971056106387502 and parameters: {'kernel': 'rbf', 'C': 29.4337975178881, 'gamma': 0.03799634102186539, 'epsilon': 0.03881828094917192}. Best is trial 88 with value: 0.3542875001421725.
[I 2024-12-03 18:48:31,474] Trial 1055 finished with value: 0.35964938766341675 and parameters: {'kernel': 'rbf', 'C': 91.80652148374588, 'gamma': 0.04871020122522051, 'epsilon': 0.06346362186804011}. Best is trial 88 with value: 0.3542875001421725.
[I 2024-12-03 18:48:31,779] Trial 1056 finished with value: 0.5327941036966589 and parameters: {'kernel': 'rbf', 'C': 23.93383400551255, 'gamma': 0.18538428280076052, 'epsilon': 0.24233838354988882}. Best is trial 88 with value: 0.3542875001421725.
[I 2024-12-03 18:48:31,919] Trial 1057 finished with value: 0.37554922008138614 and parameters: {'kernel': 'rbf', 'C': 99.55163182313119, 'gamma': 0.013895800530163049, 'epsilon': 0.3824309358367689}. Best is trial 88 with value: 0.3542875001421725.
[I 2024-12-03 18:48:32,631] Trial 1058 finished with value: 2.454475714621385 and parameters: {'kernel': 'poly', 'C': 22.89853354748989, 'gamma': 0.005661939397558469, 'epsilon': 0.15673888978214964}. Best is trial 88 with value: 0.3542875001421725.
[I 2024-12-03 18:48:33,388] Trial 1059 finished with value: 0.3930899355290593 and parameters: {'kernel': 'rbf', 'C': 24.21767430095233, 'gamma': 0.044071494265635586, 'epsilon': 0.10404334744492821}. Best is trial 88 with value: 0.3542875001421725.
[I 2024-12-03 18:48:33,553] Trial 1060 finished with value: 0.37734330821983764 and parameters: {'kernel': 'rbf', 'C': 98.08615121816959, 'gamma': 0.06214478276509674, 'epsilon': 0.23212911762337413}. Best is trial 88 with value: 0.3542875001421725.
[I 2024-12-03 18:48:34,289] Trial 1061 finished with value: 1914.7984949075255 and parameters: {'kernel': 'sigmoid', 'C': 95.6523269061366, 'gamma': 0.12753534265787483, 'epsilon': 0.046610678619167865}. Best is trial 88 with value: 0.3542875001421725.
[I 2024-12-03 18:48:35,735] Trial 1063 finished with value: 0.39256338216832715 and parameters: {'kernel': 'rbf', 'C': 20.636486676699278, 'gamma': 0.05527990528611051, 'epsilon': 0.1373615153281413}. Best is trial 88 with value: 0.3542875001421725.
[I 2024-12-03 18:48:35,987] Trial 1065 finished with value: 0.3655518148457854 and parameters: {'kernel': 'rbf', 'C': 99.46172819483863, 'gamma': 0.056445900938123704, 'epsilon': 0.1797962762452248}. Best is trial 88 with value: 0.3542875001421725.
[I 2024-12-03 18:48:36,115] Trial 1064 finished with value: 0.5982463266943053 and parameters: {'kernel': 'rbf', 'C': 91.78215095476024, 'gamma': 0.1709845350763246, 'epsilon': 0.47628616574281935}. Best is trial 88 with value: 0.3542875001421725.
[I 2024-12-03 18:48:36,762] Trial 1066 finished with value: 0.3900428958600808 and parameters: {'kernel': 'rbf', 'C': 87.89087205462704, 'gamma': 0.08860729052944383, 'epsilon': 0.06661938355696836}. Best is trial 88 with value: 0.3542875001421725.
[I 2024-12-03 18:48:37,718] Trial 1067 finished with value: 0.43468733189311903 and parameters: {'kernel': 'rbf', 'C': 13.770973228677379, 'gamma': 0.03408537122781369, 'epsilon': 0.042416746802570404}. Best is trial 88 with value: 0.3542875001421725.
[I 2024-12-03 18:48:37,751] Trial 1068 finished with value: 0.8666946676777688 and parameters: {'kernel': 'linear', 'C': 0.0011069431225693702, 'gamma': 0.01686946264037412, 'epsilon': 0.5840378505929517}. Best is trial 88 with value: 0.3542875001421725.
[I 2024-12-03 18:48:38,092] Trial 1062 finished with value: 2.1409261866995917 and parameters: {'kernel': 'poly', 'C': 0.002399026637027797, 'gamma': 0.3328873087397983, 'epsilon': 0.014658743567355494}. Best is trial 88 with value: 0.3542875001421725.
[I 2024-12-03 18:48:38,213] Trial 1069 finished with value: 0.4243763533703845 and parameters: {'kernel': 'rbf', 'C': 16.22834430953487, 'gamma': 0.10462202409274002, 'epsilon': 0.08247613188037622}. Best is trial 88 with value: 0.3542875001421725.
[I 2024-12-03 18:48:38,357] Trial 921 finished with value: 0.7798232171959154 and parameters: {'kernel': 'linear', 'C': 91.16805904521327, 'gamma': 0.018216737582747628, 'epsilon': 0.14053633558773854}. Best is trial 88 with value: 0.3542875001421725.
[I 2024-12-03 18:48:38,816] Trial 1070 finished with value: 0.4472142082230777 and parameters: {'kernel': 'rbf', 'C': 16.390830724833137, 'gamma': 0.05983776404527284, 'epsilon': 0.43162718559673197}. Best is trial 88 with value: 0.3542875001421725.
[I 2024-12-03 18:48:40,896] Trial 1072 finished with value: 0.4129531715625716 and parameters: {'kernel': 'rbf', 'C': 97.71233638978602, 'gamma': 0.11675281436818938, 'epsilon': 0.08966477434488229}. Best is trial 88 with value: 0.3542875001421725.
[I 2024-12-03 18:48:41,075] Trial 1073 finished with value: 0.36266499010506464 and parameters: {'kernel': 'rbf', 'C': 93.02808566490162, 'gamma': 0.05587748371229626, 'epsilon': 0.1104290438746399}. Best is trial 88 with value: 0.3542875001421725.
[I 2024-12-03 18:48:41,206] Trial 1074 finished with value: 0.4060846588763874 and parameters: {'kernel': 'rbf', 'C': 22.652326018373913, 'gamma': 0.026558465585419865, 'epsilon': 0.1791683460009415}. Best is trial 88 with value: 0.3542875001421725.
[I 2024-12-03 18:48:41,358] Trial 1071 finished with value: 0.43949830917388216 and parameters: {'kernel': 'rbf', 'C': 20.12480932500658, 'gamma': 0.016563531380852325, 'epsilon': 0.12749823100038707}. Best is trial 88 with value: 0.3542875001421725.
[I 2024-12-03 18:48:41,963] Trial 1075 finished with value: 0.8395044775042839 and parameters: {'kernel': 'linear', 'C': 0.06603763177600973, 'gamma': 0.0018624562534253044, 'epsilon': 0.05687872719553337}. Best is trial 88 with value: 0.3542875001421725.
[I 2024-12-03 18:48:42,140] Trial 1076 finished with value: 0.5088848091194438 and parameters: {'kernel': 'rbf', 'C': 96.57146989146827, 'gamma': 0.1959219686384651, 'epsilon': 0.11281995550839048}. Best is trial 88 with value: 0.3542875001421725.
[I 2024-12-03 18:48:43,439] Trial 1078 finished with value: 0.43839296181885873 and parameters: {'kernel': 'rbf', 'C': 94.45943694813936, 'gamma': 0.005597173279460326, 'epsilon': 0.18303604363582324}. Best is trial 88 with value: 0.3542875001421725.
[I 2024-12-03 18:48:44,099] Trial 1080 finished with value: 0.4030870932580688 and parameters: {'kernel': 'rbf', 'C': 98.08015708131609, 'gamma': 0.01051170651674329, 'epsilon': 0.1479455537261036}. Best is trial 88 with value: 0.3542875001421725.
[I 2024-12-03 18:48:44,100] Trial 1081 finished with value: 0.5228521114705907 and parameters: {'kernel': 'rbf', 'C': 88.63487504663735, 'gamma': 0.1526155168430645, 'epsilon': 0.31122995653632424}. Best is trial 88 with value: 0.3542875001421725.
[I 2024-12-03 18:48:44,819] Trial 1082 finished with value: 0.4134121148641236 and parameters: {'kernel': 'rbf', 'C': 21.6567373588119, 'gamma': 0.07788658966379292, 'epsilon': 0.2554761635705973}. Best is trial 88 with value: 0.3542875001421725.
[I 2024-12-03 18:48:45,580] Trial 1083 finished with value: 0.495188062882478 and parameters: {'kernel': 'rbf', 'C': 96.92655494740765, 'gamma': 0.1387142271087065, 'epsilon': 0.2763674230496718}. Best is trial 88 with value: 0.3542875001421725.
[I 2024-12-03 18:48:46,073] Trial 1084 finished with value: 0.4001624503320648 and parameters: {'kernel': 'rbf', 'C': 16.21885725061698, 'gamma': 0.011295467253554178, 'epsilon': 0.03629816013546519}. Best is trial 88 with value: 0.3542875001421725.
[I 2024-12-03 18:48:46,243] Trial 1085 finished with value: 0.4211998478483189 and parameters: {'kernel': 'rbf', 'C': 18.12157269703702, 'gamma': 0.026083208450652595, 'epsilon': 0.09148578191592897}. Best is trial 88 with value: 0.3542875001421725.
[I 2024-12-03 18:48:46,300] Trial 1086 finished with value: 0.4898655067092118 and parameters: {'kernel': 'rbf', 'C': 3.9495948400342558, 'gamma': 0.022678477982894737, 'epsilon': 0.45107599818999267}. Best is trial 88 with value: 0.3542875001421725.
[I 2024-12-03 18:48:47,679] Trial 1087 finished with value: 0.3602491508380024 and parameters: {'kernel': 'rbf', 'C': 93.02053716817387, 'gamma': 0.03710967301824631, 'epsilon': 0.15698278966059426}. Best is trial 88 with value: 0.3542875001421725.
[I 2024-12-03 18:48:49,298] Trial 1091 finished with value: 0.38872506727257106 and parameters: {'kernel': 'rbf', 'C': 99.56821310945732, 'gamma': 0.02245514467136382, 'epsilon': 0.48120968027559735}. Best is trial 88 with value: 0.3542875001421725.
[I 2024-12-03 18:48:50,064] Trial 1089 finished with value: 0.3714434969895245 and parameters: {'kernel': 'rbf', 'C': 97.90291270605059, 'gamma': 0.03284101907825498, 'epsilon': 0.04553184003143759}. Best is trial 88 with value: 0.3542875001421725.
[I 2024-12-03 18:48:50,745] Trial 1092 finished with value: 3.0997627238872347 and parameters: {'kernel': 'sigmoid', 'C': 0.19069473200204243, 'gamma': 0.02030884750692898, 'epsilon': 0.11713800496104963}. Best is trial 88 with value: 0.3542875001421725.
[I 2024-12-03 18:48:51,254] Trial 1093 finished with value: 0.4057639370723632 and parameters: {'kernel': 'rbf', 'C': 18.401044677982075, 'gamma': 0.03395753348861337, 'epsilon': 0.22980403006032446}. Best is trial 88 with value: 0.3542875001421725.
[I 2024-12-03 18:48:51,998] Trial 1094 finished with value: 0.43066018673013207 and parameters: {'kernel': 'rbf', 'C': 22.114751342039867, 'gamma': 0.008658981516573374, 'epsilon': 0.31087612807465675}. Best is trial 88 with value: 0.3542875001421725.
[I 2024-12-03 18:48:52,079] Trial 1088 finished with value: 2.732605244229363 and parameters: {'kernel': 'poly', 'C': 6.823079609063652, 'gamma': 0.02045778589500622, 'epsilon': 0.10222808951956255}. Best is trial 88 with value: 0.3542875001421725.
[I 2024-12-03 18:48:52,772] Trial 1095 finished with value: 0.3833536414229335 and parameters: {'kernel': 'rbf', 'C': 30.391489398944053, 'gamma': 0.0733096802115413, 'epsilon': 0.11063211595743998}. Best is trial 88 with value: 0.3542875001421725.
[I 2024-12-03 18:48:53,886] Trial 1097 finished with value: 0.37786308716755684 and parameters: {'kernel': 'rbf', 'C': 94.71574172695848, 'gamma': 0.015157023030723625, 'epsilon': 0.20427068692326378}. Best is trial 88 with value: 0.3542875001421725.
[I 2024-12-03 18:48:55,124] Trial 1099 finished with value: 0.5483950720957737 and parameters: {'kernel': 'rbf', 'C': 17.57756589320312, 'gamma': 0.22738070336950117, 'epsilon': 0.16728540174280004}. Best is trial 88 with value: 0.3542875001421725.
[I 2024-12-03 18:48:55,946] Trial 1098 finished with value: 0.3664124094849996 and parameters: {'kernel': 'rbf', 'C': 97.64415666222624, 'gamma': 0.026749057431423393, 'epsilon': 0.036006682422330794}. Best is trial 88 with value: 0.3542875001421725.
[I 2024-12-03 18:48:56,301] Trial 1029 finished with value: 0.7519723404342414 and parameters: {'kernel': 'linear', 'C': 92.48706514772414, 'gamma': 0.17827148062615797, 'epsilon': 0.21303447810329085}. Best is trial 88 with value: 0.3542875001421725.
[I 2024-12-03 18:48:57,287] Trial 1101 finished with value: 1.0363130280023438 and parameters: {'kernel': 'rbf', 'C': 0.0020901212121038656, 'gamma': 0.01292203586742973, 'epsilon': 0.30122921900805527}. Best is trial 88 with value: 0.3542875001421725.
[I 2024-12-03 18:48:58,818] Trial 1103 finished with value: 0.39044496232576326 and parameters: {'kernel': 'rbf', 'C': 88.52940354138022, 'gamma': 0.08993246940928966, 'epsilon': 0.07896501653266987}. Best is trial 88 with value: 0.3542875001421725.
[I 2024-12-03 18:49:00,153] Trial 1104 finished with value: 0.4067602105019953 and parameters: {'kernel': 'rbf', 'C': 16.878881346237335, 'gamma': 0.05617975515427175, 'epsilon': 0.11151281353939917}. Best is trial 88 with value: 0.3542875001421725.
[I 2024-12-03 18:49:01,525] Trial 1105 finished with value: 2.912391651494466 and parameters: {'kernel': 'sigmoid', 'C': 17.869531256845573, 'gamma': 0.0005195828365443214, 'epsilon': 0.008156237337259079}. Best is trial 88 with value: 0.3542875001421725.
[I 2024-12-03 18:49:02,859] Trial 1106 finished with value: 0.36567268388446444 and parameters: {'kernel': 'rbf', 'C': 96.58120738250169, 'gamma': 0.03135115391090707, 'epsilon': 0.17455460054795754}. Best is trial 88 with value: 0.3542875001421725.
[I 2024-12-03 18:49:04,444] Trial 1107 finished with value: 0.42259018113085534 and parameters: {'kernel': 'rbf', 'C': 17.629624982276244, 'gamma': 0.10799900853770612, 'epsilon': 0.04000465846094881}. Best is trial 88 with value: 0.3542875001421725.
[I 2024-12-03 18:49:05,906] Trial 1108 finished with value: 0.3675705434854485 and parameters: {'kernel': 'rbf', 'C': 96.86117573479896, 'gamma': 0.022360390179353897, 'epsilon': 0.13998957061389738}. Best is trial 88 with value: 0.3542875001421725.
[I 2024-12-03 18:49:07,748] Trial 1109 finished with value: 0.44697448165691556 and parameters: {'kernel': 'rbf', 'C': 10.166668364265142, 'gamma': 0.08916455597987208, 'epsilon': 0.0053837190324025124}. Best is trial 88 with value: 0.3542875001421725.
[I 2024-12-03 18:49:09,187] Trial 1110 finished with value: 0.39878725050201985 and parameters: {'kernel': 'rbf', 'C': 19.51153467492267, 'gamma': 0.011493652315238497, 'epsilon': 0.07206249912432158}. Best is trial 88 with value: 0.3542875001421725.
[I 2024-12-03 18:49:10,444] Trial 1111 finished with value: 0.407138132917169 and parameters: {'kernel': 'rbf', 'C': 87.75598309766625, 'gamma': 0.10094680832411873, 'epsilon': 0.16193983033004045}. Best is trial 88 with value: 0.3542875001421725.
[I 2024-12-03 18:49:11,541] Trial 1112 finished with value: 0.3984873725532219 and parameters: {'kernel': 'rbf', 'C': 27.131206552053413, 'gamma': 0.03605128035827278, 'epsilon': 0.3596996015738155}. Best is trial 88 with value: 0.3542875001421725.
[I 2024-12-03 18:49:12,999] Trial 1113 finished with value: 0.3958578940342366 and parameters: {'kernel': 'rbf', 'C': 26.142043936147306, 'gamma': 0.08896562738489029, 'epsilon': 0.05549422356353925}. Best is trial 88 with value: 0.3542875001421725.
[I 2024-12-03 18:49:14,289] Trial 1114 finished with value: 0.4449298401712458 and parameters: {'kernel': 'rbf', 'C': 24.50161295013525, 'gamma': 0.12442232425965685, 'epsilon': 0.1469974932933515}. Best is trial 88 with value: 0.3542875001421725.
[I 2024-12-03 18:49:16,536] Trial 1115 finished with value: 0.3687967236018738 and parameters: {'kernel': 'rbf', 'C': 92.33927571917265, 'gamma': 0.027421111489289135, 'epsilon': 0.19524086682859496}. Best is trial 88 with value: 0.3542875001421725.
[I 2024-12-03 18:49:19,182] Trial 1116 finished with value: 0.3830385070727362 and parameters: {'kernel': 'rbf', 'C': 98.4067841007993, 'gamma': 0.017455863496717173, 'epsilon': 0.029378367139469938}. Best is trial 88 with value: 0.3542875001421725.
[I 2024-12-03 18:49:20,545] Trial 1117 finished with value: 0.5852349163491668 and parameters: {'kernel': 'rbf', 'C': 99.84709822977499, 'gamma': 0.302581082822948, 'epsilon': 0.08577787347243947}. Best is trial 88 with value: 0.3542875001421725.
[I 2024-12-03 18:49:21,957] Trial 1118 finished with value: 314.3579782217669 and parameters: {'kernel': 'sigmoid', 'C': 14.720468980485634, 'gamma': 0.059348874338396855, 'epsilon': 0.07022778072428873}. Best is trial 88 with value: 0.3542875001421725.
[I 2024-12-03 18:49:23,026] Trial 1090 finished with value: 0.7463698087137791 and parameters: {'kernel': 'linear', 'C': 74.13836112452424, 'gamma': 0.027823162507954895, 'epsilon': 0.43858584267150413}. Best is trial 88 with value: 0.3542875001421725.
[I 2024-12-03 18:49:23,251] Trial 1119 finished with value: 0.3976005349231789 and parameters: {'kernel': 'rbf', 'C': 19.779243054578288, 'gamma': 0.049204162692224426, 'epsilon': 0.13648996694785334}. Best is trial 88 with value: 0.3542875001421725.
[I 2024-12-03 18:49:24,254] Trial 1120 finished with value: 0.49078807951088976 and parameters: {'kernel': 'rbf', 'C': 92.9311762050181, 'gamma': 0.06497735300828082, 'epsilon': 0.5517582363634695}. Best is trial 88 with value: 0.3542875001421725.
[I 2024-12-03 18:49:24,727] Trial 1121 finished with value: 0.4279495819038949 and parameters: {'kernel': 'rbf', 'C': 17.39758003764553, 'gamma': 0.018030010716746814, 'epsilon': 0.22019560253876924}. Best is trial 88 with value: 0.3542875001421725.
[I 2024-12-03 18:49:25,614] Trial 1122 finished with value: 0.43632011884275007 and parameters: {'kernel': 'rbf', 'C': 15.18461747102939, 'gamma': 0.10510845110137094, 'epsilon': 0.18920895023993134}. Best is trial 88 with value: 0.3542875001421725.
[I 2024-12-03 18:49:26,401] Trial 1123 finished with value: 0.42198895506145084 and parameters: {'kernel': 'rbf', 'C': 95.84952296376103, 'gamma': 0.008492523600700052, 'epsilon': 0.16123527538220492}. Best is trial 88 with value: 0.3542875001421725.
[I 2024-12-03 18:49:27,478] Trial 1124 finished with value: 0.4024084104968804 and parameters: {'kernel': 'rbf', 'C': 96.19270206551731, 'gamma': 0.013609966044812932, 'epsilon': 0.06627899075630495}. Best is trial 88 with value: 0.3542875001421725.
[I 2024-12-03 18:49:27,645] Trial 1125 finished with value: 0.4017054391260223 and parameters: {'kernel': 'rbf', 'C': 90.75523165329463, 'gamma': 0.08636660634709564, 'epsilon': 0.21562488810470187}. Best is trial 88 with value: 0.3542875001421725.
[I 2024-12-03 18:49:29,000] Trial 1126 finished with value: 2.1017162348751297 and parameters: {'kernel': 'sigmoid', 'C': 4.567289290166511, 'gamma': 0.0008128267477459166, 'epsilon': 0.15246891677324184}. Best is trial 88 with value: 0.3542875001421725.
[I 2024-12-03 18:49:29,540] Trial 1127 finished with value: 0.36820180659851537 and parameters: {'kernel': 'rbf', 'C': 95.62790836957156, 'gamma': 0.021662749832229197, 'epsilon': 0.13981645812822657}. Best is trial 88 with value: 0.3542875001421725.
[I 2024-12-03 18:49:31,028] Trial 1128 finished with value: 0.41086288170046714 and parameters: {'kernel': 'rbf', 'C': 96.17449166583047, 'gamma': 0.11763304239085758, 'epsilon': 0.0315935521885002}. Best is trial 88 with value: 0.3542875001421725.
[I 2024-12-03 18:49:31,690] Trial 1129 finished with value: 0.36424563533883236 and parameters: {'kernel': 'rbf', 'C': 92.43404016293464, 'gamma': 0.035657282862470996, 'epsilon': 0.08928251509936445}. Best is trial 88 with value: 0.3542875001421725.
[I 2024-12-03 18:49:32,421] Trial 1130 finished with value: 0.5479133383767629 and parameters: {'kernel': 'rbf', 'C': 93.16993197418464, 'gamma': 0.22597028842992228, 'epsilon': 0.17017679413069825}. Best is trial 88 with value: 0.3542875001421725.
[I 2024-12-03 18:49:33,246] Trial 1131 finished with value: 0.4819571662761957 and parameters: {'kernel': 'rbf', 'C': 2.943698438232272, 'gamma': 0.04991896783361854, 'epsilon': 0.07611079920026144}. Best is trial 88 with value: 0.3542875001421725.
[I 2024-12-03 18:49:33,946] Trial 1132 finished with value: 0.4052873942126388 and parameters: {'kernel': 'rbf', 'C': 19.99124346169477, 'gamma': 0.032785365407248454, 'epsilon': 0.3580819908465347}. Best is trial 88 with value: 0.3542875001421725.
