[I 2024-12-04 14:54:26,257] Trial 6 finished with value: 1.0624161172447073 and parameters: {'kernel_type': 'RBF', 'length_scale': 0.0005376818675707903, 'noise_level': 0.685078083235624, 'constant_value': 64349.11922485262, 'nu': 0.5}. Best is trial 1 with value: 1.062416116480334.
[W 2024-12-04 14:54:27,149] Trial 15 failed with parameters: {'kernel_type': 'Matern'} because of the following error: StorageInternalError('An exception is raised during the commit. This typically happens due to invalid data in the commit, e.g. exceeding max length. ').
Traceback (most recent call last):
  File "/zhome/b1/0/88900/miniconda3/envs/critprops/lib/python3.9/site-packages/sqlalchemy/engine/base.py", line 1967, in _exec_single_context
    self.dialect.do_execute(
  File "/zhome/b1/0/88900/miniconda3/envs/critprops/lib/python3.9/site-packages/sqlalchemy/engine/default.py", line 941, in do_execute
    cursor.execute(statement, parameters)
sqlite3.OperationalError: database is locked

The above exception was the direct cause of the following exception:

Traceback (most recent call last):
  File "/zhome/b1/0/88900/miniconda3/envs/critprops/lib/python3.9/site-packages/optuna/storages/_rdb/storage.py", line 81, in _create_scoped_session
    session.commit()
  File "/zhome/b1/0/88900/miniconda3/envs/critprops/lib/python3.9/site-packages/sqlalchemy/orm/session.py", line 2028, in commit
    trans.commit(_to_root=True)
  File "<string>", line 2, in commit
  File "/zhome/b1/0/88900/miniconda3/envs/critprops/lib/python3.9/site-packages/sqlalchemy/orm/state_changes.py", line 139, in _go
    ret_value = fn(self, *arg, **kw)
  File "/zhome/b1/0/88900/miniconda3/envs/critprops/lib/python3.9/site-packages/sqlalchemy/orm/session.py", line 1313, in commit
    self._prepare_impl()
  File "<string>", line 2, in _prepare_impl
  File "/zhome/b1/0/88900/miniconda3/envs/critprops/lib/python3.9/site-packages/sqlalchemy/orm/state_changes.py", line 139, in _go
    ret_value = fn(self, *arg, **kw)
  File "/zhome/b1/0/88900/miniconda3/envs/critprops/lib/python3.9/site-packages/sqlalchemy/orm/session.py", line 1288, in _prepare_impl
    self.session.flush()
  File "/zhome/b1/0/88900/miniconda3/envs/critprops/lib/python3.9/site-packages/sqlalchemy/orm/session.py", line 4352, in flush
    self._flush(objects)
  File "/zhome/b1/0/88900/miniconda3/envs/critprops/lib/python3.9/site-packages/sqlalchemy/orm/session.py", line 4488, in _flush
    transaction.rollback(_capture_exception=True)
  File "/zhome/b1/0/88900/miniconda3/envs/critprops/lib/python3.9/site-packages/sqlalchemy/util/langhelpers.py", line 146, in __exit__
    raise exc_value.with_traceback(exc_tb)
  File "/zhome/b1/0/88900/miniconda3/envs/critprops/lib/python3.9/site-packages/sqlalchemy/orm/session.py", line 4448, in _flush
    flush_context.execute()
  File "/zhome/b1/0/88900/miniconda3/envs/critprops/lib/python3.9/site-packages/sqlalchemy/orm/unitofwork.py", line 466, in execute
    rec.execute(self)
  File "/zhome/b1/0/88900/miniconda3/envs/critprops/lib/python3.9/site-packages/sqlalchemy/orm/unitofwork.py", line 642, in execute
    util.preloaded.orm_persistence.save_obj(
  File "/zhome/b1/0/88900/miniconda3/envs/critprops/lib/python3.9/site-packages/sqlalchemy/orm/persistence.py", line 93, in save_obj
    _emit_insert_statements(
  File "/zhome/b1/0/88900/miniconda3/envs/critprops/lib/python3.9/site-packages/sqlalchemy/orm/persistence.py", line 1233, in _emit_insert_statements
    result = connection.execute(
  File "/zhome/b1/0/88900/miniconda3/envs/critprops/lib/python3.9/site-packages/sqlalchemy/engine/base.py", line 1418, in execute
    return meth(
  File "/zhome/b1/0/88900/miniconda3/envs/critprops/lib/python3.9/site-packages/sqlalchemy/sql/elements.py", line 515, in _execute_on_connection
    return connection._execute_clauseelement(
  File "/zhome/b1/0/88900/miniconda3/envs/critprops/lib/python3.9/site-packages/sqlalchemy/engine/base.py", line 1640, in _execute_clauseelement
    ret = self._execute_context(
  File "/zhome/b1/0/88900/miniconda3/envs/critprops/lib/python3.9/site-packages/sqlalchemy/engine/base.py", line 1846, in _execute_context
    return self._exec_single_context(
  File "/zhome/b1/0/88900/miniconda3/envs/critprops/lib/python3.9/site-packages/sqlalchemy/engine/base.py", line 1986, in _exec_single_context
    self._handle_dbapi_exception(
  File "/zhome/b1/0/88900/miniconda3/envs/critprops/lib/python3.9/site-packages/sqlalchemy/engine/base.py", line 2355, in _handle_dbapi_exception
    raise sqlalchemy_exception.with_traceback(exc_info[2]) from e
  File "/zhome/b1/0/88900/miniconda3/envs/critprops/lib/python3.9/site-packages/sqlalchemy/engine/base.py", line 1967, in _exec_single_context
    self.dialect.do_execute(
  File "/zhome/b1/0/88900/miniconda3/envs/critprops/lib/python3.9/site-packages/sqlalchemy/engine/default.py", line 941, in do_execute
    cursor.execute(statement, parameters)
sqlalchemy.exc.OperationalError: (sqlite3.OperationalError) database is locked
[SQL: INSERT INTO trial_params (trial_id, param_name, param_value, distribution_json) VALUES (?, ?, ?, ?)]
[parameters: (16, 'length_scale', 2030.812908631428, '{"name": "FloatDistribution", "attributes": {"step": null, "low": 1e-05, "high": 100000.0, "log": true}}')]
(Background on this error at: https://sqlalche.me/e/20/e3q8)

The above exception was the direct cause of the following exception:

Traceback (most recent call last):
  File "/zhome/b1/0/88900/miniconda3/envs/critprops/lib/python3.9/site-packages/optuna/study/_optimize.py", line 197, in _run_trial
    value_or_values = func(trial)
  File "/zhome/b1/0/88900/Documents/fair_gc/src/optims.py", line 242, in objective
    params = {
  File "/zhome/b1/0/88900/Documents/fair_gc/src/optims.py", line 243, in <dictcomp>
    name: suggest_fn(trial, name)
  File "/zhome/b1/0/88900/Documents/fair_gc/src/optims.py", line 157, in <lambda>
    return lambda trial, name: trial.suggest_float(
  File "/zhome/b1/0/88900/miniconda3/envs/critprops/lib/python3.9/site-packages/optuna/trial/_trial.py", line 161, in suggest_float
    suggested_value = self._suggest(name, distribution)
  File "/zhome/b1/0/88900/miniconda3/envs/critprops/lib/python3.9/site-packages/optuna/trial/_trial.py", line 637, in _suggest
    storage.set_trial_param(trial_id, name, param_value_in_internal_repr, distribution)
  File "/zhome/b1/0/88900/miniconda3/envs/critprops/lib/python3.9/site-packages/optuna/storages/_cached_storage.py", line 171, in set_trial_param
    self._backend.set_trial_param(trial_id, param_name, param_value_internal, distribution)
  File "/zhome/b1/0/88900/miniconda3/envs/critprops/lib/python3.9/site-packages/optuna/storages/_rdb/storage.py", line 585, in set_trial_param
    self._set_trial_param_without_commit(
  File "/zhome/b1/0/88900/miniconda3/envs/critprops/lib/python3.9/contextlib.py", line 126, in __exit__
    next(self.gen)
  File "/zhome/b1/0/88900/miniconda3/envs/critprops/lib/python3.9/site-packages/optuna/storages/_rdb/storage.py", line 98, in _create_scoped_session
    raise optuna.exceptions.StorageInternalError(message) from e
optuna.exceptions.StorageInternalError: An exception is raised during the commit. This typically happens due to invalid data in the commit, e.g. exceeding max length. 
[W 2024-12-04 14:54:27,231] Trial 30 failed with parameters: {'kernel_type': 'Matern', 'length_scale': 96.26651192953216} because of the following error: StorageInternalError('An exception is raised during the commit. This typically happens due to invalid data in the commit, e.g. exceeding max length. ').
Traceback (most recent call last):
  File "/zhome/b1/0/88900/miniconda3/envs/critprops/lib/python3.9/site-packages/sqlalchemy/engine/base.py", line 1967, in _exec_single_context
    self.dialect.do_execute(
  File "/zhome/b1/0/88900/miniconda3/envs/critprops/lib/python3.9/site-packages/sqlalchemy/engine/default.py", line 941, in do_execute
    cursor.execute(statement, parameters)
sqlite3.OperationalError: database is locked

The above exception was the direct cause of the following exception:

Traceback (most recent call last):
  File "/zhome/b1/0/88900/miniconda3/envs/critprops/lib/python3.9/site-packages/optuna/storages/_rdb/storage.py", line 81, in _create_scoped_session
    session.commit()
  File "/zhome/b1/0/88900/miniconda3/envs/critprops/lib/python3.9/site-packages/sqlalchemy/orm/session.py", line 2028, in commit
    trans.commit(_to_root=True)
  File "<string>", line 2, in commit
  File "/zhome/b1/0/88900/miniconda3/envs/critprops/lib/python3.9/site-packages/sqlalchemy/orm/state_changes.py", line 139, in _go
    ret_value = fn(self, *arg, **kw)
  File "/zhome/b1/0/88900/miniconda3/envs/critprops/lib/python3.9/site-packages/sqlalchemy/orm/session.py", line 1313, in commit
    self._prepare_impl()
  File "<string>", line 2, in _prepare_impl
  File "/zhome/b1/0/88900/miniconda3/envs/critprops/lib/python3.9/site-packages/sqlalchemy/orm/state_changes.py", line 139, in _go
    ret_value = fn(self, *arg, **kw)
  File "/zhome/b1/0/88900/miniconda3/envs/critprops/lib/python3.9/site-packages/sqlalchemy/orm/session.py", line 1288, in _prepare_impl
    self.session.flush()
  File "/zhome/b1/0/88900/miniconda3/envs/critprops/lib/python3.9/site-packages/sqlalchemy/orm/session.py", line 4352, in flush
    self._flush(objects)
  File "/zhome/b1/0/88900/miniconda3/envs/critprops/lib/python3.9/site-packages/sqlalchemy/orm/session.py", line 4488, in _flush
    transaction.rollback(_capture_exception=True)
  File "/zhome/b1/0/88900/miniconda3/envs/critprops/lib/python3.9/site-packages/sqlalchemy/util/langhelpers.py", line 146, in __exit__
    raise exc_value.with_traceback(exc_tb)
  File "/zhome/b1/0/88900/miniconda3/envs/critprops/lib/python3.9/site-packages/sqlalchemy/orm/session.py", line 4448, in _flush
    flush_context.execute()
  File "/zhome/b1/0/88900/miniconda3/envs/critprops/lib/python3.9/site-packages/sqlalchemy/orm/unitofwork.py", line 466, in execute
    rec.execute(self)
  File "/zhome/b1/0/88900/miniconda3/envs/critprops/lib/python3.9/site-packages/sqlalchemy/orm/unitofwork.py", line 642, in execute
    util.preloaded.orm_persistence.save_obj(
  File "/zhome/b1/0/88900/miniconda3/envs/critprops/lib/python3.9/site-packages/sqlalchemy/orm/persistence.py", line 93, in save_obj
    _emit_insert_statements(
  File "/zhome/b1/0/88900/miniconda3/envs/critprops/lib/python3.9/site-packages/sqlalchemy/orm/persistence.py", line 1233, in _emit_insert_statements
    result = connection.execute(
  File "/zhome/b1/0/88900/miniconda3/envs/critprops/lib/python3.9/site-packages/sqlalchemy/engine/base.py", line 1418, in execute
    return meth(
  File "/zhome/b1/0/88900/miniconda3/envs/critprops/lib/python3.9/site-packages/sqlalchemy/sql/elements.py", line 515, in _execute_on_connection
    return connection._execute_clauseelement(
  File "/zhome/b1/0/88900/miniconda3/envs/critprops/lib/python3.9/site-packages/sqlalchemy/engine/base.py", line 1640, in _execute_clauseelement
    ret = self._execute_context(
  File "/zhome/b1/0/88900/miniconda3/envs/critprops/lib/python3.9/site-packages/sqlalchemy/engine/base.py", line 1846, in _execute_context
    return self._exec_single_context(
  File "/zhome/b1/0/88900/miniconda3/envs/critprops/lib/python3.9/site-packages/sqlalchemy/engine/base.py", line 1986, in _exec_single_context
    self._handle_dbapi_exception(
  File "/zhome/b1/0/88900/miniconda3/envs/critprops/lib/python3.9/site-packages/sqlalchemy/engine/base.py", line 2355, in _handle_dbapi_exception
    raise sqlalchemy_exception.with_traceback(exc_info[2]) from e
  File "/zhome/b1/0/88900/miniconda3/envs/critprops/lib/python3.9/site-packages/sqlalchemy/engine/base.py", line 1967, in _exec_single_context
    self.dialect.do_execute(
  File "/zhome/b1/0/88900/miniconda3/envs/critprops/lib/python3.9/site-packages/sqlalchemy/engine/default.py", line 941, in do_execute
    cursor.execute(statement, parameters)
sqlalchemy.exc.OperationalError: (sqlite3.OperationalError) database is locked
[SQL: INSERT INTO trial_params (trial_id, param_name, param_value, distribution_json) VALUES (?, ?, ?, ?)]
[parameters: (31, 'noise_level', 4.593239544594356e-09, '{"name": "FloatDistribution", "attributes": {"step": null, "low": 1e-10, "high": 1.0, "log": true}}')]
(Background on this error at: https://sqlalche.me/e/20/e3q8)

The above exception was the direct cause of the following exception:

Traceback (most recent call last):
  File "/zhome/b1/0/88900/miniconda3/envs/critprops/lib/python3.9/site-packages/optuna/study/_optimize.py", line 197, in _run_trial
    value_or_values = func(trial)
  File "/zhome/b1/0/88900/Documents/fair_gc/src/optims.py", line 242, in objective
    params = {
  File "/zhome/b1/0/88900/Documents/fair_gc/src/optims.py", line 243, in <dictcomp>
    name: suggest_fn(trial, name)
  File "/zhome/b1/0/88900/Documents/fair_gc/src/optims.py", line 157, in <lambda>
    return lambda trial, name: trial.suggest_float(
  File "/zhome/b1/0/88900/miniconda3/envs/critprops/lib/python3.9/site-packages/optuna/trial/_trial.py", line 161, in suggest_float
    suggested_value = self._suggest(name, distribution)
  File "/zhome/b1/0/88900/miniconda3/envs/critprops/lib/python3.9/site-packages/optuna/trial/_trial.py", line 637, in _suggest
    storage.set_trial_param(trial_id, name, param_value_in_internal_repr, distribution)
  File "/zhome/b1/0/88900/miniconda3/envs/critprops/lib/python3.9/site-packages/optuna/storages/_cached_storage.py", line 171, in set_trial_param
    self._backend.set_trial_param(trial_id, param_name, param_value_internal, distribution)
  File "/zhome/b1/0/88900/miniconda3/envs/critprops/lib/python3.9/site-packages/optuna/storages/_rdb/storage.py", line 585, in set_trial_param
    self._set_trial_param_without_commit(
  File "/zhome/b1/0/88900/miniconda3/envs/critprops/lib/python3.9/contextlib.py", line 126, in __exit__
    next(self.gen)
  File "/zhome/b1/0/88900/miniconda3/envs/critprops/lib/python3.9/site-packages/optuna/storages/_rdb/storage.py", line 98, in _create_scoped_session
    raise optuna.exceptions.StorageInternalError(message) from e
optuna.exceptions.StorageInternalError: An exception is raised during the commit. This typically happens due to invalid data in the commit, e.g. exceeding max length. 
[W 2024-12-04 14:54:27,353] Trial 15 failed with value None.
[I 2024-12-04 14:54:27,370] Trial 0 finished with value: 1.062416117210382 and parameters: {'kernel_type': 'Matern', 'length_scale': 3.0750782369993868, 'noise_level': 1.464162756012208e-10, 'constant_value': 1.9557910167111552e-05, 'nu': 0.5}. Best is trial 1 with value: 1.062416116480334.
[W 2024-12-04 14:54:27,476] Trial 30 failed with value None.
[I 2024-12-04 14:54:28,543] Trial 18 finished with value: 1.0916558487712023 and parameters: {'kernel_type': 'Matern', 'length_scale': 0.0023382091538031702, 'noise_level': 0.4370430503564971, 'constant_value': 3.8417765728432097e-07, 'nu': 0.5}. Best is trial 1 with value: 1.062416116480334.
[I 2024-12-04 14:54:30,504] Trial 23 finished with value: 1.0624161176585436 and parameters: {'kernel_type': 'Matern', 'length_scale': 0.00031376599107646295, 'noise_level': 2.475381961423049e-08, 'constant_value': 0.0007759649317297541, 'nu': 1.5}. Best is trial 1 with value: 1.062416116480334.
[I 2024-12-04 14:54:31,473] Trial 29 finished with value: 1.0624161173193138 and parameters: {'kernel_type': 'RBF', 'length_scale': 3.4517110306697534e-05, 'noise_level': 8.546072157155574e-06, 'constant_value': 0.0023563051022975905, 'nu': 1.5}. Best is trial 5 with value: 0.42868340528497567.
[I 2024-12-04 14:54:31,619] Trial 5 finished with value: 0.42868340528497567 and parameters: {'kernel_type': 'RBF', 'length_scale': 0.6733750120193986, 'noise_level': 0.00043419810066552285, 'constant_value': 14.96927637473379, 'nu': 0.5}. Best is trial 5 with value: 0.42868340528497567.
[I 2024-12-04 14:54:31,882] Trial 20 finished with value: 1.0916567048549914 and parameters: {'kernel_type': 'Matern', 'length_scale': 40358.143272049114, 'noise_level': 3.831846382460837e-06, 'constant_value': 45798.66041561267, 'nu': 0.5}. Best is trial 5 with value: 0.42868340528497567.
[I 2024-12-04 14:54:32,284] Trial 12 finished with value: 1.0916566892295094 and parameters: {'kernel_type': 'Matern', 'length_scale': 10294.647396383172, 'noise_level': 1.1774614987571467e-06, 'constant_value': 2068.37249359923, 'nu': 0.5}. Best is trial 5 with value: 0.42868340528497567.
[I 2024-12-04 14:54:33,267] Trial 16 finished with value: 1.0916558493820858 and parameters: {'kernel_type': 'RBF', 'length_scale': 8.857582842966513e-05, 'noise_level': 0.00012524633968714275, 'constant_value': 36084.467961540184, 'nu': 2.5}. Best is trial 5 with value: 0.42868340528497567.
[I 2024-12-04 14:54:33,274] Trial 21 finished with value: 1.0624161172629076 and parameters: {'kernel_type': 'RBF', 'length_scale': 0.0001724659545009061, 'noise_level': 9.501963961548805e-08, 'constant_value': 5.61921584588732e-06, 'nu': 2.5}. Best is trial 5 with value: 0.42868340528497567.
[I 2024-12-04 14:54:33,473] Trial 14 finished with value: 1.0624161171368185 and parameters: {'kernel_type': 'Matern', 'length_scale': 0.0003271193214612847, 'noise_level': 0.0002869762344919207, 'constant_value': 0.014053628923800538, 'nu': 2.5}. Best is trial 5 with value: 0.42868340528497567.
[I 2024-12-04 14:54:35,944] Trial 26 finished with value: 1.091655849387546 and parameters: {'kernel_type': 'Matern', 'length_scale': 0.002601916444763517, 'noise_level': 5.838865194979889e-08, 'constant_value': 870.7922123661364, 'nu': 0.5}. Best is trial 5 with value: 0.42868340528497567.
[I 2024-12-04 14:54:36,924] Trial 4 finished with value: 1.0624161173053857 and parameters: {'kernel_type': 'Matern', 'length_scale': 845.5182115798916, 'noise_level': 2.1400595261725298e-09, 'constant_value': 1.8084930066694855, 'nu': 2.5}. Best is trial 5 with value: 0.42868340528497567.
[I 2024-12-04 14:54:37,343] Trial 25 finished with value: 1.062416116984471 and parameters: {'kernel_type': 'RBF', 'length_scale': 7.491259117836848e-05, 'noise_level': 0.003902334157929847, 'constant_value': 0.5471118432645143, 'nu': 1.5}. Best is trial 5 with value: 0.42868340528497567.
[I 2024-12-04 14:54:37,676] Trial 10 finished with value: 1.0624161172902336 and parameters: {'kernel_type': 'RBF', 'length_scale': 710.308669217242, 'noise_level': 9.563679229466327e-10, 'constant_value': 0.0012788895014127235, 'nu': 0.5}. Best is trial 5 with value: 0.42868340528497567.
[I 2024-12-04 14:54:38,228] Trial 27 finished with value: 0.42868352138505444 and parameters: {'kernel_type': 'RBF', 'length_scale': 1.538179616178535, 'noise_level': 0.6337168879251834, 'constant_value': 0.20400782520460556, 'nu': 1.5}. Best is trial 5 with value: 0.42868340528497567.
[I 2024-12-04 14:54:39,233] Trial 13 finished with value: 0.4286835158575015 and parameters: {'kernel_type': 'RBF', 'length_scale': 1.0078861409293436, 'noise_level': 1.8150869564512744e-08, 'constant_value': 0.1036778638580922, 'nu': 2.5}. Best is trial 5 with value: 0.42868340528497567.
[I 2024-12-04 14:54:39,270] Trial 31 finished with value: 1.0624161172798345 and parameters: {'kernel_type': 'RBF', 'length_scale': 0.0035397896844716714, 'noise_level': 6.283963157801543e-09, 'constant_value': 1.2790567775893807e-05, 'nu': 0.5}. Best is trial 5 with value: 0.42868340528497567.
[I 2024-12-04 14:54:39,286] Trial 7 finished with value: 1.062416117240842 and parameters: {'kernel_type': 'RBF', 'length_scale': 27.83712686345102, 'noise_level': 2.905826739909479e-06, 'constant_value': 0.002754228265420756, 'nu': 2.5}. Best is trial 5 with value: 0.42868340528497567.
[I 2024-12-04 14:54:39,828] Trial 28 finished with value: 1.0624161172688744 and parameters: {'kernel_type': 'Matern', 'length_scale': 129.19025546991963, 'noise_level': 1.3185033140776901e-05, 'constant_value': 0.0052360098195849076, 'nu': 0.5}. Best is trial 5 with value: 0.42868340528497567.
[I 2024-12-04 14:54:40,068] Trial 24 finished with value: 1.0624161173986777 and parameters: {'kernel_type': 'Matern', 'length_scale': 0.0028763133848422593, 'noise_level': 3.2229986059515996e-07, 'constant_value': 0.5959067499534713, 'nu': 1.5}. Best is trial 5 with value: 0.42868340528497567.
[I 2024-12-04 14:54:41,121] Trial 9 finished with value: 1.0624161183675143 and parameters: {'kernel_type': 'Matern', 'length_scale': 2720.3532202189335, 'noise_level': 2.988829770515664e-10, 'constant_value': 0.13356349801137504, 'nu': 1.5}. Best is trial 5 with value: 0.42868340528497567.
[I 2024-12-04 14:54:42,029] Trial 22 finished with value: 1.0624161172629076 and parameters: {'kernel_type': 'RBF', 'length_scale': 0.00483961661898247, 'noise_level': 3.7302595302028654e-10, 'constant_value': 3.3957319891500615e-07, 'nu': 1.5}. Best is trial 5 with value: 0.42868340528497567.
[I 2024-12-04 14:54:42,612] Trial 8 finished with value: 1.0624161166029198 and parameters: {'kernel_type': 'Matern', 'length_scale': 3868.582004780601, 'noise_level': 4.902275677086109e-07, 'constant_value': 1710.842634922091, 'nu': 1.5}. Best is trial 5 with value: 0.42868340528497567.
