[I 2024-12-03 19:13:11,473] Trial 1869 finished with value: 0.13822420483525202 and parameters: {'kernel': 'linear', 'C': 6.071762483199705, 'gamma': 0.0014868466443798598, 'epsilon': 0.01298732877514673}. Best is trial 345 with value: 0.13438257115663557.
[I 2024-12-03 19:13:12,077] Trial 1853 finished with value: 0.13509612574522306 and parameters: {'kernel': 'linear', 'C': 25.885514518293192, 'gamma': 0.02280987856075382, 'epsilon': 0.03932550599987082}. Best is trial 345 with value: 0.13438257115663557.
[I 2024-12-03 19:13:12,078] Trial 1878 finished with value: 0.36366484744647876 and parameters: {'kernel': 'linear', 'C': 9.085131017940538, 'gamma': 0.0023272725237108837, 'epsilon': 0.6263948609851226}. Best is trial 345 with value: 0.13438257115663557.
[I 2024-12-03 19:13:12,869] Trial 1870 finished with value: 0.13614591398611028 and parameters: {'kernel': 'linear', 'C': 9.129350722907036, 'gamma': 0.0024348652956277354, 'epsilon': 0.035591517761604886}. Best is trial 345 with value: 0.13438257115663557.
[I 2024-12-03 19:13:13,080] Trial 1873 finished with value: 0.13824732755722172 and parameters: {'kernel': 'linear', 'C': 2.942059475078915, 'gamma': 0.00485245414567168, 'epsilon': 0.010802779010370996}. Best is trial 345 with value: 0.13438257115663557.
[I 2024-12-03 19:13:13,105] Trial 1874 finished with value: 0.13797699507950084 and parameters: {'kernel': 'linear', 'C': 21.6776669338195, 'gamma': 0.003118512682905768, 'epsilon': 0.08245037587454623}. Best is trial 345 with value: 0.13438257115663557.
[I 2024-12-03 19:13:14,993] Trial 1880 finished with value: 0.1431378514381528 and parameters: {'kernel': 'linear', 'C': 5.706324830990404, 'gamma': 0.0042416238057622615, 'epsilon': 0.08768449921310878}. Best is trial 345 with value: 0.13438257115663557.
[I 2024-12-03 19:13:15,661] Trial 1882 finished with value: 0.16735365376681663 and parameters: {'kernel': 'linear', 'C': 0.27866375346177025, 'gamma': 0.0017211794463559125, 'epsilon': 0.023405125152730015}. Best is trial 345 with value: 0.13438257115663557.
[I 2024-12-03 19:13:16,832] Trial 1883 finished with value: 0.16085521518537632 and parameters: {'kernel': 'linear', 'C': 19.24685216896298, 'gamma': 0.004562251121777456, 'epsilon': 0.1693434610019526}. Best is trial 345 with value: 0.13438257115663557.
[I 2024-12-03 19:13:17,635] Trial 1799 finished with value: 0.13556687322019453 and parameters: {'kernel': 'linear', 'C': 85.33274938579429, 'gamma': 0.0005726355228165427, 'epsilon': 0.027744044910597856}. Best is trial 345 with value: 0.13438257115663557.
[I 2024-12-03 19:13:17,710] Trial 1881 finished with value: 0.13604554898368404 and parameters: {'kernel': 'linear', 'C': 5.810202374246646, 'gamma': 0.0051919666366085455, 'epsilon': 0.0534997694080232}. Best is trial 345 with value: 0.13438257115663557.
[I 2024-12-03 19:13:17,884] Trial 1865 finished with value: 0.13800768835077365 and parameters: {'kernel': 'linear', 'C': 17.88504788215281, 'gamma': 0.007820223205321018, 'epsilon': 0.016334348120023982}. Best is trial 345 with value: 0.13438257115663557.
[I 2024-12-03 19:13:19,001] Trial 1823 finished with value: 0.1370585980693519 and parameters: {'kernel': 'linear', 'C': 95.02099012155138, 'gamma': 0.04430164692400833, 'epsilon': 0.04727826661858048}. Best is trial 345 with value: 0.13438257115663557.
[I 2024-12-03 19:13:21,704] Trial 1889 finished with value: 0.18519778234920495 and parameters: {'kernel': 'rbf', 'C': 63.273623044916825, 'gamma': 0.021017737762065367, 'epsilon': 0.0023352043939089085}. Best is trial 345 with value: 0.13438257115663557.
[I 2024-12-03 19:13:22,325] Trial 1871 finished with value: 0.13498963063207142 and parameters: {'kernel': 'linear', 'C': 21.595580819708317, 'gamma': 0.003038935311263413, 'epsilon': 0.03931574405392578}. Best is trial 345 with value: 0.13438257115663557.
[I 2024-12-03 19:13:24,954] Trial 1875 finished with value: 0.13784141257053592 and parameters: {'kernel': 'linear', 'C': 15.324087457388393, 'gamma': 0.0008295522762102979, 'epsilon': 0.017725644011557184}. Best is trial 345 with value: 0.13438257115663557.
[I 2024-12-03 19:13:26,503] Trial 1879 finished with value: 0.13510812685518672 and parameters: {'kernel': 'linear', 'C': 19.852672657449663, 'gamma': 0.0011510341434292145, 'epsilon': 0.06387718052449508}. Best is trial 345 with value: 0.13438257115663557.
[I 2024-12-03 19:13:27,958] Trial 1802 finished with value: 0.13701264755486892 and parameters: {'kernel': 'linear', 'C': 99.33926930581733, 'gamma': 0.0005809181891506245, 'epsilon': 0.02274450091304009}. Best is trial 345 with value: 0.13438257115663557.
[I 2024-12-03 19:13:29,221] Trial 1896 finished with value: 0.8162914009128144 and parameters: {'kernel': 'poly', 'C': 8.188342657860476, 'gamma': 0.005640174454089114, 'epsilon': 0.06694818776408468}. Best is trial 345 with value: 0.13438257115663557.
[I 2024-12-03 19:13:29,844] Trial 1895 finished with value: 0.35011426373262955 and parameters: {'kernel': 'poly', 'C': 14.717668824559968, 'gamma': 0.025815235209988314, 'epsilon': 0.0011093529860079813}. Best is trial 345 with value: 0.13438257115663557.
[I 2024-12-03 19:13:30,621] Trial 1897 finished with value: 1.3168837424773812 and parameters: {'kernel': 'sigmoid', 'C': 0.007224887152054128, 'gamma': 0.0024257365082288045, 'epsilon': 0.004043439834462574}. Best is trial 345 with value: 0.13438257115663557.
[I 2024-12-03 19:13:31,425] Trial 1863 finished with value: 0.1357128970891831 and parameters: {'kernel': 'linear', 'C': 25.907387799347482, 'gamma': 0.003927829600015466, 'epsilon': 0.026817335569774958}. Best is trial 345 with value: 0.13438257115663557.
[I 2024-12-03 19:13:32,389] Trial 1884 finished with value: 0.1350823093922682 and parameters: {'kernel': 'linear', 'C': 18.203119397649065, 'gamma': 0.005890156277034875, 'epsilon': 0.03867217345413714}. Best is trial 345 with value: 0.13438257115663557.
[I 2024-12-03 19:13:32,532] Trial 1885 finished with value: 0.13658644623605187 and parameters: {'kernel': 'linear', 'C': 29.864636250588784, 'gamma': 0.002735738752806371, 'epsilon': 0.05045326940848214}. Best is trial 345 with value: 0.13438257115663557.
[I 2024-12-03 19:13:34,104] Trial 1902 finished with value: 956.5558497008203 and parameters: {'kernel': 'sigmoid', 'C': 81.24290236491046, 'gamma': 0.020212205104416528, 'epsilon': 0.005010188023563065}. Best is trial 345 with value: 0.13438257115663557.
[I 2024-12-03 19:13:35,411] Trial 1900 finished with value: 0.14919639433012488 and parameters: {'kernel': 'linear', 'C': 10.758363003510592, 'gamma': 0.018868890742410858, 'epsilon': 0.13515970353095744}. Best is trial 345 with value: 0.13438257115663557.
[I 2024-12-03 19:13:36,323] Trial 1886 finished with value: 0.13543411383566173 and parameters: {'kernel': 'linear', 'C': 20.534808780044077, 'gamma': 0.00286358887729124, 'epsilon': 0.03108226686027887}. Best is trial 345 with value: 0.13438257115663557.
[I 2024-12-03 19:13:36,323] Trial 1891 finished with value: 0.13452286032944583 and parameters: {'kernel': 'linear', 'C': 16.723693881057464, 'gamma': 0.0016918325594133788, 'epsilon': 0.04022238230820997}. Best is trial 345 with value: 0.13438257115663557.
[I 2024-12-03 19:13:36,510] Trial 1904 finished with value: 0.3650308028503803 and parameters: {'kernel': 'linear', 'C': 89.00567970696356, 'gamma': 0.006502391357082255, 'epsilon': 0.6313907066913828}. Best is trial 345 with value: 0.13438257115663557.
[I 2024-12-03 19:13:36,733] Trial 1888 finished with value: 0.1424180040375557 and parameters: {'kernel': 'linear', 'C': 86.5476527995355, 'gamma': 0.002644409012776564, 'epsilon': 0.116504533342903}. Best is trial 345 with value: 0.13438257115663557.
[I 2024-12-03 19:13:38,842] Trial 1798 finished with value: 0.1365480529638378 and parameters: {'kernel': 'linear', 'C': 98.20288977533156, 'gamma': 0.003901078909744554, 'epsilon': 0.024143977317973842}. Best is trial 345 with value: 0.13438257115663557.
[I 2024-12-03 19:13:40,955] Trial 1905 finished with value: 0.1351105124742746 and parameters: {'kernel': 'linear', 'C': 4.155595844811564, 'gamma': 0.0006001736587155465, 'epsilon': 0.05072337966060047}. Best is trial 345 with value: 0.13438257115663557.
[I 2024-12-03 19:13:43,369] Trial 1909 finished with value: 0.14111339110071816 and parameters: {'kernel': 'linear', 'C': 14.908294017396678, 'gamma': 0.001309411774730994, 'epsilon': 0.0966755507756842}. Best is trial 345 with value: 0.13438257115663557.
[I 2024-12-03 19:13:44,660] Trial 1911 finished with value: 0.34104700332257604 and parameters: {'kernel': 'linear', 'C': 0.008192326637291048, 'gamma': 0.6334216083246873, 'epsilon': 0.008364870986510602}. Best is trial 345 with value: 0.13438257115663557.
[I 2024-12-03 19:13:45,192] Trial 1864 finished with value: 0.1374380890418357 and parameters: {'kernel': 'linear', 'C': 52.814466371745574, 'gamma': 0.5643446132445238, 'epsilon': 0.021238652712479017}. Best is trial 345 with value: 0.13438257115663557.
[I 2024-12-03 19:13:45,414] Trial 1908 finished with value: 0.13586342507330043 and parameters: {'kernel': 'linear', 'C': 5.557867471820747, 'gamma': 0.0017856844865044611, 'epsilon': 0.03599407837359588}. Best is trial 345 with value: 0.13438257115663557.
[I 2024-12-03 19:13:46,305] Trial 1907 finished with value: 0.13866676278003917 and parameters: {'kernel': 'linear', 'C': 23.32414527873642, 'gamma': 0.002294117351634027, 'epsilon': 0.08430556092976282}. Best is trial 345 with value: 0.13438257115663557.
[I 2024-12-03 19:13:47,180] Trial 1892 finished with value: 0.13780985393518672 and parameters: {'kernel': 'linear', 'C': 23.400692435637907, 'gamma': 0.0014515995249356792, 'epsilon': 0.021174058454720576}. Best is trial 345 with value: 0.13438257115663557.
[I 2024-12-03 19:13:47,181] Trial 1914 finished with value: 0.2856751671944846 and parameters: {'kernel': 'linear', 'C': 0.022136900989331035, 'gamma': 0.028459832335050332, 'epsilon': 0.005435197763027104}. Best is trial 345 with value: 0.13438257115663557.
[I 2024-12-03 19:13:47,182] Trial 1887 finished with value: 0.13813285980337447 and parameters: {'kernel': 'linear', 'C': 23.82902736616863, 'gamma': 0.0034052117959120815, 'epsilon': 0.0214998063181439}. Best is trial 345 with value: 0.13438257115663557.
[I 2024-12-03 19:13:48,334] Trial 1913 finished with value: 0.17533786814411764 and parameters: {'kernel': 'linear', 'C': 13.777043982863601, 'gamma': 0.0026806658616648927, 'epsilon': 0.20357693376310543}. Best is trial 345 with value: 0.13438257115663557.
[I 2024-12-03 19:13:48,453] Trial 1915 finished with value: 0.18184626800192064 and parameters: {'kernel': 'linear', 'C': 0.5003426949684492, 'gamma': 0.006250821040469311, 'epsilon': 0.12421698317254665}. Best is trial 345 with value: 0.13438257115663557.
[I 2024-12-03 19:13:49,223] Trial 1912 finished with value: 0.13731298058808525 and parameters: {'kernel': 'linear', 'C': 2.6966172455758595, 'gamma': 0.001029646002293198, 'epsilon': 0.027709783037011486}. Best is trial 345 with value: 0.13438257115663557.
[I 2024-12-03 19:13:50,196] Trial 1910 finished with value: 0.13639367975750122 and parameters: {'kernel': 'linear', 'C': 5.752909185718664, 'gamma': 0.005341428392047769, 'epsilon': 0.02551107595931301}. Best is trial 345 with value: 0.13438257115663557.
[I 2024-12-03 19:13:51,121] Trial 1822 finished with value: 0.13573564405482275 and parameters: {'kernel': 'linear', 'C': 99.97394076660065, 'gamma': 0.0031798152625867582, 'epsilon': 0.03641576027705322}. Best is trial 345 with value: 0.13438257115663557.
[I 2024-12-03 19:13:52,017] Trial 1901 finished with value: 0.13800762712246742 and parameters: {'kernel': 'linear', 'C': 21.412062794943946, 'gamma': 0.000922888232496228, 'epsilon': 0.01660840872498908}. Best is trial 345 with value: 0.13438257115663557.
[I 2024-12-03 19:13:52,840] Trial 1921 finished with value: 0.1454864570946513 and parameters: {'kernel': 'linear', 'C': 3.6030023997147085, 'gamma': 0.003996390745909955, 'epsilon': 0.08897130217474694}. Best is trial 345 with value: 0.13438257115663557.
[I 2024-12-03 19:13:53,405] Trial 1818 finished with value: 0.13826517065472788 and parameters: {'kernel': 'linear', 'C': 88.18737910597729, 'gamma': 0.03933824086531838, 'epsilon': 0.015352312329880732}. Best is trial 345 with value: 0.13438257115663557.
[I 2024-12-03 19:13:54,212] Trial 1894 finished with value: 0.13520937531705807 and parameters: {'kernel': 'linear', 'C': 28.466178874501068, 'gamma': 0.008649573292915122, 'epsilon': 0.06440289404684532}. Best is trial 345 with value: 0.13438257115663557.
[I 2024-12-03 19:13:54,653] Trial 1923 finished with value: 0.1381967942779603 and parameters: {'kernel': 'linear', 'C': 1.9083461582127708, 'gamma': 0.001631971521143314, 'epsilon': 0.026932054737458036}. Best is trial 345 with value: 0.13438257115663557.
[I 2024-12-03 19:13:54,915] Trial 1906 finished with value: 0.13706349551913496 and parameters: {'kernel': 'linear', 'C': 8.92743453599901, 'gamma': 0.0006484754369955744, 'epsilon': 0.021874229132186403}. Best is trial 345 with value: 0.13438257115663557.
[I 2024-12-03 19:13:55,596] Trial 1920 finished with value: 0.13800519902605293 and parameters: {'kernel': 'linear', 'C': 2.200426917405553, 'gamma': 0.0012900891659146834, 'epsilon': 0.003122899461672078}. Best is trial 345 with value: 0.13438257115663557.
[I 2024-12-03 19:13:56,375] Trial 1926 finished with value: 0.15292571737279384 and parameters: {'kernel': 'linear', 'C': 0.5177590129543449, 'gamma': 0.42234167949307844, 'epsilon': 0.009576283769818016}. Best is trial 345 with value: 0.13438257115663557.
[I 2024-12-03 19:13:57,918] Trial 1919 finished with value: 0.13511247983783506 and parameters: {'kernel': 'linear', 'C': 16.643241923279582, 'gamma': 0.0004237199958396276, 'epsilon': 0.061520181317197074}. Best is trial 345 with value: 0.13438257115663557.
[I 2024-12-03 19:13:58,022] Trial 1928 finished with value: 0.1525596472155579 and parameters: {'kernel': 'linear', 'C': 3.2971208614506677, 'gamma': 0.012379106029748229, 'epsilon': 0.11381873209973636}. Best is trial 345 with value: 0.13438257115663557.
[I 2024-12-03 19:13:58,672] Trial 1890 finished with value: 0.13786580929248302 and parameters: {'kernel': 'linear', 'C': 27.345614141464885, 'gamma': 0.004183053569788211, 'epsilon': 0.013247538551560903}. Best is trial 345 with value: 0.13438257115663557.
[I 2024-12-03 19:13:59,114] Trial 1924 finished with value: 0.13699676228582655 and parameters: {'kernel': 'linear', 'C': 9.08783214343017, 'gamma': 0.00628678223077429, 'epsilon': 0.04521237843582267}. Best is trial 345 with value: 0.13438257115663557.
[I 2024-12-03 19:14:00,274] Trial 1933 finished with value: 5.28463944418601 and parameters: {'kernel': 'sigmoid', 'C': 6.958750002307771, 'gamma': 0.0034914644461928796, 'epsilon': 0.04300121864762564}. Best is trial 345 with value: 0.13438257115663557.
[I 2024-12-03 19:14:00,904] Trial 1931 finished with value: 0.1348795744034421 and parameters: {'kernel': 'linear', 'C': 6.59440540944226, 'gamma': 0.0021871084361913757, 'epsilon': 0.06381621268502376}. Best is trial 345 with value: 0.13438257115663557.
[I 2024-12-03 19:14:02,247] Trial 1929 finished with value: 0.13717100194833448 and parameters: {'kernel': 'linear', 'C': 2.88688586810337, 'gamma': 0.00546036963469211, 'epsilon': 0.022149006566029972}. Best is trial 345 with value: 0.13438257115663557.
[I 2024-12-03 19:14:02,595] Trial 1898 finished with value: 0.13570383898655283 and parameters: {'kernel': 'linear', 'C': 32.050976381341165, 'gamma': 0.005925691948651324, 'epsilon': 0.035114165569300165}. Best is trial 345 with value: 0.13438257115663557.
[I 2024-12-03 19:14:04,357] Trial 1918 finished with value: 0.13749699313004635 and parameters: {'kernel': 'linear', 'C': 18.264192056575357, 'gamma': 0.0008909350942385119, 'epsilon': 0.022199485820987564}. Best is trial 345 with value: 0.13438257115663557.
[I 2024-12-03 19:14:05,336] Trial 1932 finished with value: 0.13698124750826693 and parameters: {'kernel': 'linear', 'C': 5.0258876845867215, 'gamma': 0.001625065103320319, 'epsilon': 0.021342933042996677}. Best is trial 345 with value: 0.13438257115663557.
[I 2024-12-03 19:14:06,214] Trial 1940 finished with value: 0.7508373634526003 and parameters: {'kernel': 'poly', 'C': 5.90575014946406, 'gamma': 0.001189285662557909, 'epsilon': 0.015302923389488625}. Best is trial 345 with value: 0.13438257115663557.
[I 2024-12-03 19:14:07,865] Trial 1942 finished with value: 0.23745737179756995 and parameters: {'kernel': 'rbf', 'C': 3.706600717361299, 'gamma': 0.00737807880451102, 'epsilon': 0.05478172293398199}. Best is trial 345 with value: 0.13438257115663557.
[I 2024-12-03 19:14:07,924] Trial 1925 finished with value: 0.13811920921444426 and parameters: {'kernel': 'linear', 'C': 66.5651429010909, 'gamma': 0.0009078617738157345, 'epsilon': 0.08111189946805414}. Best is trial 345 with value: 0.13438257115663557.
[I 2024-12-03 19:14:08,118] Trial 1939 finished with value: 0.13626496496160276 and parameters: {'kernel': 'linear', 'C': 4.787469613338018, 'gamma': 0.005912278845894511, 'epsilon': 0.028802069307482785}. Best is trial 345 with value: 0.13438257115663557.
[I 2024-12-03 19:14:08,230] Trial 1916 finished with value: 0.1350536271947477 and parameters: {'kernel': 'linear', 'C': 15.871050150010197, 'gamma': 0.0011695742402296593, 'epsilon': 0.0580108953357484}. Best is trial 345 with value: 0.13438257115663557.
[I 2024-12-03 19:14:08,644] Trial 1922 finished with value: 0.13540434939460885 and parameters: {'kernel': 'linear', 'C': 14.392356834172942, 'gamma': 0.0010382269554218677, 'epsilon': 0.028703717458009415}. Best is trial 345 with value: 0.13438257115663557.
[I 2024-12-03 19:14:10,147] Trial 1944 finished with value: 1.192502240721085 and parameters: {'kernel': 'sigmoid', 'C': 92.8346115876645, 'gamma': 0.0008127247326778087, 'epsilon': 0.005422435872952861}. Best is trial 345 with value: 0.13438257115663557.
[I 2024-12-03 19:14:12,861] Trial 1860 finished with value: 0.13552414406292543 and parameters: {'kernel': 'linear', 'C': 98.53656805932405, 'gamma': 0.006038172580428315, 'epsilon': 0.04127582828688197}. Best is trial 345 with value: 0.13438257115663557.
[I 2024-12-03 19:14:14,405] Trial 1948 finished with value: 0.1505728469174519 and parameters: {'kernel': 'linear', 'C': 11.09523650888834, 'gamma': 0.0036226047444918807, 'epsilon': 0.1420319657099359}. Best is trial 345 with value: 0.13438257115663557.
[I 2024-12-03 19:14:15,664] Trial 1950 finished with value: 0.5645596955506978 and parameters: {'kernel': 'rbf', 'C': 91.2357970343521, 'gamma': 0.1426636226790539, 'epsilon': 0.11866284832203622}. Best is trial 345 with value: 0.13438257115663557.
[I 2024-12-03 19:14:16,406] Trial 1935 finished with value: 0.13539627445385052 and parameters: {'kernel': 'linear', 'C': 21.39419736123027, 'gamma': 0.0016166039475503328, 'epsilon': 0.04120439740590655}. Best is trial 345 with value: 0.13438257115663557.
[I 2024-12-03 19:14:16,930] Trial 1936 finished with value: 0.13516298188228848 and parameters: {'kernel': 'linear', 'C': 19.184455013924445, 'gamma': 0.0037045931147474754, 'epsilon': 0.05629493101910347}. Best is trial 345 with value: 0.13438257115663557.
[I 2024-12-03 19:14:17,151] Trial 1951 finished with value: 0.19121469734550353 and parameters: {'kernel': 'rbf', 'C': 17.186601243978316, 'gamma': 0.002237445586417282, 'epsilon': 0.06369868692178202}. Best is trial 345 with value: 0.13438257115663557.
[I 2024-12-03 19:14:17,928] Trial 1813 finished with value: 0.13827631663175527 and parameters: {'kernel': 'linear', 'C': 86.6175620296811, 'gamma': 0.006467292942771109, 'epsilon': 0.012393750373219974}. Best is trial 345 with value: 0.13438257115663557.
[I 2024-12-03 19:14:18,156] Trial 1927 finished with value: 0.1353893694296622 and parameters: {'kernel': 'linear', 'C': 16.469505319625693, 'gamma': 0.0013741332621354857, 'epsilon': 0.030765225570782664}. Best is trial 345 with value: 0.13438257115663557.
[I 2024-12-03 19:14:18,592] Trial 1945 finished with value: 0.1397163714314714 and parameters: {'kernel': 'linear', 'C': 19.656481551844585, 'gamma': 0.00824116817870967, 'epsilon': 0.08715281308379005}. Best is trial 345 with value: 0.13438257115663557.
[I 2024-12-03 19:14:19,176] Trial 1852 finished with value: 0.13793462443773857 and parameters: {'kernel': 'linear', 'C': 98.32244863136485, 'gamma': 0.013138473767279708, 'epsilon': 0.014425208871162706}. Best is trial 345 with value: 0.13438257115663557.
[I 2024-12-03 19:14:19,189] Trial 1954 finished with value: 0.7754466879409576 and parameters: {'kernel': 'poly', 'C': 0.0010762745872489724, 'gamma': 0.02530081785247812, 'epsilon': 0.010890063212764312}. Best is trial 345 with value: 0.13438257115663557.
[I 2024-12-03 19:14:19,985] Trial 1956 finished with value: 0.9666308195931459 and parameters: {'kernel': 'poly', 'C': 10.493531117587143, 'gamma': 0.0028637738485808696, 'epsilon': 0.6164755575455799}. Best is trial 345 with value: 0.13438257115663557.
[I 2024-12-03 19:14:20,174] Trial 1937 finished with value: 0.1416323513822702 and parameters: {'kernel': 'linear', 'C': 98.06928335229797, 'gamma': 0.0029007624775742404, 'epsilon': 0.1146424073366278}. Best is trial 345 with value: 0.13438257115663557.
[I 2024-12-03 19:14:20,960] Trial 1955 finished with value: 0.34702035290289845 and parameters: {'kernel': 'linear', 'C': 0.007285294855017246, 'gamma': 0.0035889913553664426, 'epsilon': 0.010458301805824938}. Best is trial 345 with value: 0.13438257115663557.
[I 2024-12-03 19:14:21,381] Trial 1953 finished with value: 0.1402763331717333 and parameters: {'kernel': 'linear', 'C': 5.4506625266073945, 'gamma': 0.02795292179320634, 'epsilon': 0.08030788302162598}. Best is trial 345 with value: 0.13438257115663557.
