[I 2024-12-04 13:40:00,113] Trial 2193 finished with value: 0.2259228585978613 and parameters: {'n_estimators': 1188, 'learning_rate': 0.09559766516047144, 'max_depth': 12, 'min_samples_split': 17, 'min_samples_leaf': 1, 'subsample': 0.6748624841005669, 'max_features': 'sqrt'}. Best is trial 1137 with value: 0.19687116000636118.
[I 2024-12-04 13:40:02,315] Trial 2210 finished with value: 0.4707670285905132 and parameters: {'n_estimators': 485, 'learning_rate': 0.017602576735777413, 'max_depth': 11, 'min_samples_split': 14, 'min_samples_leaf': 9, 'subsample': 0.8148417290720749, 'max_features': 'sqrt'}. Best is trial 1137 with value: 0.19687116000636118.
[I 2024-12-04 13:40:03,453] Trial 2194 finished with value: 0.2453386197770607 and parameters: {'n_estimators': 1190, 'learning_rate': 0.09723390685542797, 'max_depth': 11, 'min_samples_split': 18, 'min_samples_leaf': 2, 'subsample': 0.6001229422372865, 'max_features': 'sqrt'}. Best is trial 1137 with value: 0.19687116000636118.
[I 2024-12-04 13:40:03,462] Trial 2180 finished with value: 0.2504628519538952 and parameters: {'n_estimators': 1483, 'learning_rate': 0.07398239096368052, 'max_depth': 8, 'min_samples_split': 19, 'min_samples_leaf': 1, 'subsample': 0.6607030946911506, 'max_features': None}. Best is trial 1137 with value: 0.19687116000636118.
[I 2024-12-04 13:40:08,476] Trial 2199 finished with value: 0.2374221259080933 and parameters: {'n_estimators': 1102, 'learning_rate': 0.061923177925512884, 'max_depth': 12, 'min_samples_split': 20, 'min_samples_leaf': 2, 'subsample': 0.7039456333260692, 'max_features': 'sqrt'}. Best is trial 1137 with value: 0.19687116000636118.
[I 2024-12-04 13:40:08,483] Trial 2188 finished with value: 0.22550920785083448 and parameters: {'n_estimators': 1491, 'learning_rate': 0.09866279764279051, 'max_depth': 12, 'min_samples_split': 15, 'min_samples_leaf': 1, 'subsample': 0.7084671393694256, 'max_features': 'sqrt'}. Best is trial 1137 with value: 0.19687116000636118.
[I 2024-12-04 13:40:08,490] Trial 2189 finished with value: 0.25795745113498514 and parameters: {'n_estimators': 1471, 'learning_rate': 0.09975310963518592, 'max_depth': 10, 'min_samples_split': 15, 'min_samples_leaf': 3, 'subsample': 0.7194540129630974, 'max_features': 'sqrt'}. Best is trial 1137 with value: 0.19687116000636118.
[I 2024-12-04 13:40:21,495] Trial 2195 finished with value: 0.2519217415274169 and parameters: {'n_estimators': 1487, 'learning_rate': 0.08955366640477168, 'max_depth': 12, 'min_samples_split': 19, 'min_samples_leaf': 3, 'subsample': 0.6006567153553859, 'max_features': 'sqrt'}. Best is trial 1137 with value: 0.19687116000636118.
[I 2024-12-04 13:40:23,145] Trial 2224 finished with value: 0.3369621499953855 and parameters: {'n_estimators': 214, 'learning_rate': 0.07009488230681912, 'max_depth': 6, 'min_samples_split': 3, 'min_samples_leaf': 2, 'subsample': 0.916026102886528, 'max_features': 'sqrt'}. Best is trial 1137 with value: 0.19687116000636118.
[I 2024-12-04 13:40:23,473] Trial 2200 finished with value: 0.22493190680069214 and parameters: {'n_estimators': 1269, 'learning_rate': 0.09987703742549883, 'max_depth': 12, 'min_samples_split': 20, 'min_samples_leaf': 1, 'subsample': 0.7498356978810792, 'max_features': 'sqrt'}. Best is trial 1137 with value: 0.19687116000636118.
[I 2024-12-04 13:40:24,722] Trial 2203 finished with value: 0.2150277910653887 and parameters: {'n_estimators': 1248, 'learning_rate': 0.09486466160830699, 'max_depth': 11, 'min_samples_split': 17, 'min_samples_leaf': 1, 'subsample': 0.6164001298799444, 'max_features': 'sqrt'}. Best is trial 1137 with value: 0.19687116000636118.
[I 2024-12-04 13:40:25,152] Trial 2196 finished with value: 0.236316535177349 and parameters: {'n_estimators': 1491, 'learning_rate': 0.0838573342595235, 'max_depth': 11, 'min_samples_split': 16, 'min_samples_leaf': 2, 'subsample': 0.6634847540848181, 'max_features': 'sqrt'}. Best is trial 1137 with value: 0.19687116000636118.
[I 2024-12-04 13:40:30,955] Trial 2197 finished with value: 0.24646384344604433 and parameters: {'n_estimators': 1500, 'learning_rate': 0.09630223430683231, 'max_depth': 10, 'min_samples_split': 20, 'min_samples_leaf': 3, 'subsample': 0.6280521282943562, 'max_features': 'sqrt'}. Best is trial 1137 with value: 0.19687116000636118.
[I 2024-12-04 13:40:31,908] Trial 2191 finished with value: 0.31351043480118745 and parameters: {'n_estimators': 1497, 'learning_rate': 0.01803398714570208, 'max_depth': 12, 'min_samples_split': 7, 'min_samples_leaf': 5, 'subsample': 0.9877792690838257, 'max_features': None}. Best is trial 1137 with value: 0.19687116000636118.
[I 2024-12-04 13:40:34,011] Trial 2211 finished with value: 0.46678850735156335 and parameters: {'n_estimators': 998, 'learning_rate': 0.015629745966001175, 'max_depth': 6, 'min_samples_split': 15, 'min_samples_leaf': 3, 'subsample': 0.691536484254376, 'max_features': 'log2'}. Best is trial 1137 with value: 0.19687116000636118.
[I 2024-12-04 13:40:34,410] Trial 2201 finished with value: 0.24320584264629883 and parameters: {'n_estimators': 1490, 'learning_rate': 0.0833852611534413, 'max_depth': 10, 'min_samples_split': 17, 'min_samples_leaf': 2, 'subsample': 0.6008495553560094, 'max_features': 'sqrt'}. Best is trial 1137 with value: 0.19687116000636118.
[I 2024-12-04 13:40:37,669] Trial 2208 finished with value: 0.22484104983549755 and parameters: {'n_estimators': 1222, 'learning_rate': 0.09967827963679825, 'max_depth': 10, 'min_samples_split': 20, 'min_samples_leaf': 1, 'subsample': 0.680497501261916, 'max_features': 'sqrt'}. Best is trial 1137 with value: 0.19687116000636118.
[I 2024-12-04 13:40:40,808] Trial 2202 finished with value: 0.2277309508146588 and parameters: {'n_estimators': 1499, 'learning_rate': 0.0933440259526125, 'max_depth': 12, 'min_samples_split': 13, 'min_samples_leaf': 1, 'subsample': 0.6638150737302038, 'max_features': 'sqrt'}. Best is trial 1137 with value: 0.19687116000636118.
[I 2024-12-04 13:40:43,234] Trial 2204 finished with value: 0.20168668854522506 and parameters: {'n_estimators': 1489, 'learning_rate': 0.09682641765191528, 'max_depth': 12, 'min_samples_split': 17, 'min_samples_leaf': 1, 'subsample': 0.6637565209805681, 'max_features': 'sqrt'}. Best is trial 1137 with value: 0.19687116000636118.
[I 2024-12-04 13:40:43,569] Trial 2205 finished with value: 0.24631747327011466 and parameters: {'n_estimators': 1474, 'learning_rate': 0.08285361146696105, 'max_depth': 7, 'min_samples_split': 20, 'min_samples_leaf': 1, 'subsample': 0.6583809652268159, 'max_features': 'sqrt'}. Best is trial 1137 with value: 0.19687116000636118.
[I 2024-12-04 13:40:44,272] Trial 2216 finished with value: 0.49099704746780637 and parameters: {'n_estimators': 986, 'learning_rate': 0.017301903535832715, 'max_depth': 4, 'min_samples_split': 2, 'min_samples_leaf': 4, 'subsample': 0.8438122497002625, 'max_features': 'log2'}. Best is trial 1137 with value: 0.19687116000636118.
[I 2024-12-04 13:40:45,976] Trial 2214 finished with value: 0.33658592930518944 and parameters: {'n_estimators': 1060, 'learning_rate': 0.01973757067423223, 'max_depth': 10, 'min_samples_split': 9, 'min_samples_leaf': 6, 'subsample': 0.993044944612853, 'max_features': 'sqrt'}. Best is trial 1137 with value: 0.19687116000636118.
[I 2024-12-04 13:40:55,120] Trial 2209 finished with value: 0.2125091619346471 and parameters: {'n_estimators': 1499, 'learning_rate': 0.06872813839381797, 'max_depth': 11, 'min_samples_split': 14, 'min_samples_leaf': 1, 'subsample': 0.6465296623528041, 'max_features': 'sqrt'}. Best is trial 1137 with value: 0.19687116000636118.
[I 2024-12-04 13:40:58,699] Trial 2217 finished with value: 0.29893919353675685 and parameters: {'n_estimators': 1161, 'learning_rate': 0.050930400940151575, 'max_depth': 10, 'min_samples_split': 20, 'min_samples_leaf': 3, 'subsample': 0.6959953448247802, 'max_features': 'log2'}. Best is trial 1137 with value: 0.19687116000636118.
[I 2024-12-04 13:41:03,331] Trial 2213 finished with value: 0.25360681701224286 and parameters: {'n_estimators': 1416, 'learning_rate': 0.09698882039154688, 'max_depth': 12, 'min_samples_split': 20, 'min_samples_leaf': 3, 'subsample': 0.673104412124009, 'max_features': 'sqrt'}. Best is trial 1137 with value: 0.19687116000636118.
[I 2024-12-04 13:41:04,723] Trial 2212 finished with value: 0.2237086619758733 and parameters: {'n_estimators': 1467, 'learning_rate': 0.09314896288966378, 'max_depth': 11, 'min_samples_split': 15, 'min_samples_leaf': 1, 'subsample': 0.605943837480588, 'max_features': 'sqrt'}. Best is trial 1137 with value: 0.19687116000636118.
[I 2024-12-04 13:41:07,203] Trial 2243 finished with value: 0.3707745349867297 and parameters: {'n_estimators': 218, 'learning_rate': 0.043220543743626966, 'max_depth': 11, 'min_samples_split': 10, 'min_samples_leaf': 8, 'subsample': 0.894938163919335, 'max_features': None}. Best is trial 1137 with value: 0.19687116000636118.
[I 2024-12-04 13:41:07,214] Trial 2219 finished with value: 0.24654451920901072 and parameters: {'n_estimators': 1205, 'learning_rate': 0.09531450693085629, 'max_depth': 10, 'min_samples_split': 15, 'min_samples_leaf': 1, 'subsample': 0.6861836279269988, 'max_features': 'sqrt'}. Best is trial 1137 with value: 0.19687116000636118.
[I 2024-12-04 13:41:07,637] Trial 2231 finished with value: 0.2870322197430552 and parameters: {'n_estimators': 670, 'learning_rate': 0.03862492764756771, 'max_depth': 9, 'min_samples_split': 20, 'min_samples_leaf': 4, 'subsample': 0.949599620953504, 'max_features': 'sqrt'}. Best is trial 1137 with value: 0.19687116000636118.
[I 2024-12-04 13:41:11,832] Trial 2220 finished with value: 0.21222699253337432 and parameters: {'n_estimators': 1157, 'learning_rate': 0.0975203073719122, 'max_depth': 9, 'min_samples_split': 17, 'min_samples_leaf': 1, 'subsample': 0.7069414415332663, 'max_features': 'sqrt'}. Best is trial 1137 with value: 0.19687116000636118.
[I 2024-12-04 13:41:11,858] Trial 2215 finished with value: 0.26077762049378195 and parameters: {'n_estimators': 1477, 'learning_rate': 0.0998394608162364, 'max_depth': 12, 'min_samples_split': 16, 'min_samples_leaf': 4, 'subsample': 0.6134903289004785, 'max_features': 'sqrt'}. Best is trial 1137 with value: 0.19687116000636118.
[I 2024-12-04 13:41:17,379] Trial 2235 finished with value: 0.534347311446973 and parameters: {'n_estimators': 691, 'learning_rate': 0.027255517589072673, 'max_depth': 4, 'min_samples_split': 10, 'min_samples_leaf': 5, 'subsample': 0.7434030964526221, 'max_features': 'log2'}. Best is trial 1137 with value: 0.19687116000636118.
[I 2024-12-04 13:41:18,495] Trial 2221 finished with value: 0.21040557960238412 and parameters: {'n_estimators': 1169, 'learning_rate': 0.09154178718667404, 'max_depth': 12, 'min_samples_split': 20, 'min_samples_leaf': 1, 'subsample': 0.7146769360257302, 'max_features': 'sqrt'}. Best is trial 1137 with value: 0.19687116000636118.
[I 2024-12-04 13:41:19,973] Trial 2222 finished with value: 0.25377006432107835 and parameters: {'n_estimators': 1269, 'learning_rate': 0.06770110603137999, 'max_depth': 12, 'min_samples_split': 13, 'min_samples_leaf': 3, 'subsample': 0.6481329903467379, 'max_features': 'sqrt'}. Best is trial 1137 with value: 0.19687116000636118.
[I 2024-12-04 13:41:20,292] Trial 2218 finished with value: 0.2225638227594308 and parameters: {'n_estimators': 1488, 'learning_rate': 0.0990046156587329, 'max_depth': 11, 'min_samples_split': 14, 'min_samples_leaf': 1, 'subsample': 0.6730774895092564, 'max_features': 'sqrt'}. Best is trial 1137 with value: 0.19687116000636118.
[I 2024-12-04 13:41:25,497] Trial 2240 finished with value: 0.30497676769572357 and parameters: {'n_estimators': 635, 'learning_rate': 0.07773900086452853, 'max_depth': 6, 'min_samples_split': 13, 'min_samples_leaf': 2, 'subsample': 0.8585121667629612, 'max_features': 'log2'}. Best is trial 1137 with value: 0.19687116000636118.
[I 2024-12-04 13:41:25,887] Trial 2230 finished with value: 0.42135063929016686 and parameters: {'n_estimators': 1144, 'learning_rate': 0.06074469606636873, 'max_depth': 11, 'min_samples_split': 9, 'min_samples_leaf': 8, 'subsample': 0.9936610090273282, 'max_features': 'log2'}. Best is trial 1137 with value: 0.19687116000636118.
[I 2024-12-04 13:41:25,897] Trial 2232 finished with value: 0.2547931834840779 and parameters: {'n_estimators': 898, 'learning_rate': 0.09632796511349767, 'max_depth': 12, 'min_samples_split': 19, 'min_samples_leaf': 3, 'subsample': 0.6591634203485957, 'max_features': 'sqrt'}. Best is trial 1137 with value: 0.19687116000636118.
[I 2024-12-04 13:41:28,758] Trial 2226 finished with value: 0.2086969280170036 and parameters: {'n_estimators': 1224, 'learning_rate': 0.0924938741153293, 'max_depth': 12, 'min_samples_split': 14, 'min_samples_leaf': 1, 'subsample': 0.6086136234331744, 'max_features': 'sqrt'}. Best is trial 1137 with value: 0.19687116000636118.
[I 2024-12-04 13:41:30,240] Trial 2228 finished with value: 0.21483026194639163 and parameters: {'n_estimators': 1179, 'learning_rate': 0.09694597902578767, 'max_depth': 11, 'min_samples_split': 16, 'min_samples_leaf': 1, 'subsample': 0.6859022864785175, 'max_features': 'sqrt'}. Best is trial 1137 with value: 0.19687116000636118.
[I 2024-12-04 13:41:32,557] Trial 2225 finished with value: 0.26333279177666896 and parameters: {'n_estimators': 1118, 'learning_rate': 0.08859548800124915, 'max_depth': 12, 'min_samples_split': 17, 'min_samples_leaf': 1, 'subsample': 0.7483895355073242, 'max_features': None}. Best is trial 1137 with value: 0.19687116000636118.
[I 2024-12-04 13:41:35,793] Trial 2227 finished with value: 0.2248232533854794 and parameters: {'n_estimators': 1271, 'learning_rate': 0.09609205521808618, 'max_depth': 11, 'min_samples_split': 16, 'min_samples_leaf': 1, 'subsample': 0.600231506224745, 'max_features': 'sqrt'}. Best is trial 1137 with value: 0.19687116000636118.
[I 2024-12-04 13:41:36,062] Trial 2223 finished with value: 0.25755792424714363 and parameters: {'n_estimators': 1443, 'learning_rate': 0.09622977068815114, 'max_depth': 10, 'min_samples_split': 12, 'min_samples_leaf': 3, 'subsample': 0.6309646131277766, 'max_features': 'sqrt'}. Best is trial 1137 with value: 0.19687116000636118.
[I 2024-12-04 13:41:36,799] Trial 2233 finished with value: 0.2606061882091448 and parameters: {'n_estimators': 1076, 'learning_rate': 0.08851772876896045, 'max_depth': 11, 'min_samples_split': 20, 'min_samples_leaf': 3, 'subsample': 0.6784597536972735, 'max_features': 'sqrt'}. Best is trial 1137 with value: 0.19687116000636118.
[I 2024-12-04 13:41:39,244] Trial 2254 finished with value: 0.3249555184142679 and parameters: {'n_estimators': 296, 'learning_rate': 0.07657752723587685, 'max_depth': 3, 'min_samples_split': 3, 'min_samples_leaf': 2, 'subsample': 0.9088935847806159, 'max_features': None}. Best is trial 1137 with value: 0.19687116000636118.
[I 2024-12-04 13:41:43,166] Trial 2237 finished with value: 0.3250353153204351 and parameters: {'n_estimators': 953, 'learning_rate': 0.01608504285589863, 'max_depth': 5, 'min_samples_split': 3, 'min_samples_leaf': 4, 'subsample': 0.9814907383482394, 'max_features': None}. Best is trial 1137 with value: 0.19687116000636118.
[I 2024-12-04 13:41:45,098] Trial 2229 finished with value: 0.2230502367708319 and parameters: {'n_estimators': 1432, 'learning_rate': 0.09933992427203889, 'max_depth': 10, 'min_samples_split': 18, 'min_samples_leaf': 1, 'subsample': 0.705071314045887, 'max_features': 'sqrt'}. Best is trial 1137 with value: 0.19687116000636118.
[I 2024-12-04 13:41:50,842] Trial 2263 finished with value: 0.41993382693293163 and parameters: {'n_estimators': 112, 'learning_rate': 0.016750168358868358, 'max_depth': 8, 'min_samples_split': 14, 'min_samples_leaf': 1, 'subsample': 0.7192539915547822, 'max_features': None}. Best is trial 1137 with value: 0.19687116000636118.
[I 2024-12-04 13:41:53,392] Trial 2234 finished with value: 0.22137325304839892 and parameters: {'n_estimators': 1305, 'learning_rate': 0.09865324801206846, 'max_depth': 12, 'min_samples_split': 20, 'min_samples_leaf': 1, 'subsample': 0.6985609480089464, 'max_features': 'sqrt'}. Best is trial 1137 with value: 0.19687116000636118.
[I 2024-12-04 13:41:55,565] Trial 2239 finished with value: 0.24442172726303227 and parameters: {'n_estimators': 1194, 'learning_rate': 0.09958303978978408, 'max_depth': 10, 'min_samples_split': 18, 'min_samples_leaf': 3, 'subsample': 0.6547356001792003, 'max_features': 'sqrt'}. Best is trial 1137 with value: 0.19687116000636118.
[I 2024-12-04 13:41:55,987] Trial 2238 finished with value: 0.2612467091569815 and parameters: {'n_estimators': 1206, 'learning_rate': 0.061842978058562065, 'max_depth': 10, 'min_samples_split': 12, 'min_samples_leaf': 3, 'subsample': 0.6664403625859647, 'max_features': 'sqrt'}. Best is trial 1137 with value: 0.19687116000636118.
[I 2024-12-04 13:42:00,432] Trial 2244 finished with value: 0.22519121925589586 and parameters: {'n_estimators': 1125, 'learning_rate': 0.09482053774712254, 'max_depth': 11, 'min_samples_split': 17, 'min_samples_leaf': 1, 'subsample': 0.6919391648355266, 'max_features': 'sqrt'}. Best is trial 1137 with value: 0.19687116000636118.
[I 2024-12-04 13:42:04,536] Trial 2248 finished with value: 0.23066237958668254 and parameters: {'n_estimators': 953, 'learning_rate': 0.06607992316377446, 'max_depth': 11, 'min_samples_split': 18, 'min_samples_leaf': 1, 'subsample': 0.6966831862882316, 'max_features': 'sqrt'}. Best is trial 1137 with value: 0.19687116000636118.
[I 2024-12-04 13:42:06,184] Trial 2236 finished with value: 0.22140939043398591 and parameters: {'n_estimators': 1495, 'learning_rate': 0.09683347574957825, 'max_depth': 10, 'min_samples_split': 16, 'min_samples_leaf': 1, 'subsample': 0.6605488260484761, 'max_features': 'sqrt'}. Best is trial 1137 with value: 0.19687116000636118.
[I 2024-12-04 13:42:11,024] Trial 2246 finished with value: 0.21728954485865395 and parameters: {'n_estimators': 1231, 'learning_rate': 0.0999011867789823, 'max_depth': 11, 'min_samples_split': 20, 'min_samples_leaf': 1, 'subsample': 0.7226778455476974, 'max_features': 'sqrt'}. Best is trial 1137 with value: 0.19687116000636118.
[I 2024-12-04 13:42:15,345] Trial 2273 finished with value: 0.4159152195063214 and parameters: {'n_estimators': 221, 'learning_rate': 0.030588900302141, 'max_depth': 4, 'min_samples_split': 9, 'min_samples_leaf': 8, 'subsample': 0.9847113916409312, 'max_features': None}. Best is trial 1137 with value: 0.19687116000636118.
[I 2024-12-04 13:42:17,744] Trial 2249 finished with value: 0.24133464769266041 and parameters: {'n_estimators': 1147, 'learning_rate': 0.06945067628041823, 'max_depth': 12, 'min_samples_split': 17, 'min_samples_leaf': 2, 'subsample': 0.7385650201926589, 'max_features': 'sqrt'}. Best is trial 1137 with value: 0.19687116000636118.
[I 2024-12-04 13:42:21,105] Trial 2241 finished with value: 0.23451137020371737 and parameters: {'n_estimators': 1468, 'learning_rate': 0.06380666827360318, 'max_depth': 11, 'min_samples_split': 17, 'min_samples_leaf': 2, 'subsample': 0.6673530438284673, 'max_features': 'sqrt'}. Best is trial 1137 with value: 0.19687116000636118.
[I 2024-12-04 13:42:22,080] Trial 2245 finished with value: 0.21782126491456832 and parameters: {'n_estimators': 1474, 'learning_rate': 0.09226954171647272, 'max_depth': 12, 'min_samples_split': 20, 'min_samples_leaf': 2, 'subsample': 0.6006767989274246, 'max_features': 'sqrt'}. Best is trial 1137 with value: 0.19687116000636118.
[I 2024-12-04 13:42:24,549] Trial 2242 finished with value: 0.25668433236677873 and parameters: {'n_estimators': 1356, 'learning_rate': 0.09012607917834849, 'max_depth': 12, 'min_samples_split': 16, 'min_samples_leaf': 1, 'subsample': 0.6032095767531732, 'max_features': None}. Best is trial 1137 with value: 0.19687116000636118.
[I 2024-12-04 13:42:29,311] Trial 2251 finished with value: 0.24814943094220523 and parameters: {'n_estimators': 1249, 'learning_rate': 0.05766717037289381, 'max_depth': 12, 'min_samples_split': 19, 'min_samples_leaf': 3, 'subsample': 0.7076146120051366, 'max_features': 'sqrt'}. Best is trial 1137 with value: 0.19687116000636118.
[I 2024-12-04 13:42:31,442] Trial 2247 finished with value: 0.27335768758585743 and parameters: {'n_estimators': 1492, 'learning_rate': 0.09869499900675048, 'max_depth': 12, 'min_samples_split': 16, 'min_samples_leaf': 3, 'subsample': 0.755318445438196, 'max_features': 'sqrt'}. Best is trial 1137 with value: 0.19687116000636118.
[I 2024-12-04 13:42:32,897] Trial 2253 finished with value: 0.25255866528226883 and parameters: {'n_estimators': 1218, 'learning_rate': 0.07714228894326271, 'max_depth': 12, 'min_samples_split': 18, 'min_samples_leaf': 3, 'subsample': 0.723389953856234, 'max_features': 'sqrt'}. Best is trial 1137 with value: 0.19687116000636118.
[I 2024-12-04 13:42:36,518] Trial 2274 finished with value: 0.3328535664727487 and parameters: {'n_estimators': 475, 'learning_rate': 0.07392154894201385, 'max_depth': 10, 'min_samples_split': 2, 'min_samples_leaf': 6, 'subsample': 0.8407585063851688, 'max_features': None}. Best is trial 1137 with value: 0.19687116000636118.
[I 2024-12-04 13:42:38,409] Trial 2262 finished with value: 0.3874359740104237 and parameters: {'n_estimators': 912, 'learning_rate': 0.010198488329972494, 'max_depth': 4, 'min_samples_split': 16, 'min_samples_leaf': 7, 'subsample': 0.7609936360486674, 'max_features': None}. Best is trial 1137 with value: 0.19687116000636118.
[I 2024-12-04 13:42:43,090] Trial 2252 finished with value: 0.21155433671945947 and parameters: {'n_estimators': 1438, 'learning_rate': 0.08342968868010746, 'max_depth': 12, 'min_samples_split': 17, 'min_samples_leaf': 1, 'subsample': 0.6734798559366746, 'max_features': 'sqrt'}. Best is trial 1137 with value: 0.19687116000636118.
