[I 2024-12-04 15:09:35,598] Trial 893 finished with value: 0.14859826885031244 and parameters: {'kernel_type': 'Matern', 'length_scale': 0.714595666271971, 'noise_level': 0.0005508612425804954, 'constant_value': 74.0344509280545, 'nu': 2.5}. Best is trial 750 with value: 0.13435342446039877.
[I 2024-12-04 15:09:36,027] Trial 899 finished with value: 1.2693635028557886 and parameters: {'kernel_type': 'Matern', 'length_scale': 0.03477888792709687, 'noise_level': 1.8044465612483433e-07, 'constant_value': 0.2147349289759967, 'nu': 1.5}. Best is trial 750 with value: 0.13435342446039877.
[I 2024-12-04 15:09:36,845] Trial 873 finished with value: 0.13435434469007332 and parameters: {'kernel_type': 'Matern', 'length_scale': 0.16842598573516288, 'noise_level': 3.4612949431782554e-10, 'constant_value': 0.01842675579339487, 'nu': 1.5}. Best is trial 750 with value: 0.13435342446039877.
[I 2024-12-04 15:09:37,429] Trial 900 finished with value: 0.13435439752064288 and parameters: {'kernel_type': 'Matern', 'length_scale': 22.677539740323514, 'noise_level': 0.016853141173480184, 'constant_value': 82998.25123405208, 'nu': 1.5}. Best is trial 750 with value: 0.13435342446039877.
[I 2024-12-04 15:09:37,555] Trial 889 finished with value: 1.2693635028563728 and parameters: {'kernel_type': 'Matern', 'length_scale': 0.03566720167372404, 'noise_level': 0.00018387510115150686, 'constant_value': 70094.21341599897, 'nu': 0.5}. Best is trial 750 with value: 0.13435342446039877.
[I 2024-12-04 15:09:37,812] Trial 897 finished with value: 1.3007745979585956 and parameters: {'kernel_type': 'Matern', 'length_scale': 1.384703776302145, 'noise_level': 2.722068614390677e-05, 'constant_value': 53115.5345058044, 'nu': 1.5}. Best is trial 750 with value: 0.13435342446039877.
[I 2024-12-04 15:09:38,501] Trial 902 finished with value: 0.13435441744872356 and parameters: {'kernel_type': 'Matern', 'length_scale': 1279.316108278186, 'noise_level': 0.142592798786687, 'constant_value': 85002.95622147805, 'nu': 1.5}. Best is trial 750 with value: 0.13435342446039877.
[I 2024-12-04 15:09:39,496] Trial 892 finished with value: 0.1343544041986404 and parameters: {'kernel_type': 'Matern', 'length_scale': 36.15492518841655, 'noise_level': 0.0029894841512299163, 'constant_value': 42235.24071849236, 'nu': 1.5}. Best is trial 750 with value: 0.13435342446039877.
[I 2024-12-04 15:09:40,782] Trial 896 finished with value: 0.1485982689751955 and parameters: {'kernel_type': 'Matern', 'length_scale': 55.5742997489061, 'noise_level': 0.004113719161433532, 'constant_value': 19789.43118848634, 'nu': 2.5}. Best is trial 750 with value: 0.13435342446039877.
[I 2024-12-04 15:09:42,375] Trial 901 finished with value: 0.13435439564876167 and parameters: {'kernel_type': 'Matern', 'length_scale': 21.96456380581804, 'noise_level': 0.07854069505085345, 'constant_value': 11513.269834401242, 'nu': 1.5}. Best is trial 750 with value: 0.13435342446039877.
[I 2024-12-04 15:09:42,614] Trial 906 finished with value: 0.1343544096502963 and parameters: {'kernel_type': 'Matern', 'length_scale': 259.35247339666665, 'noise_level': 0.012269299315894988, 'constant_value': 36776.42354988641, 'nu': 1.5}. Best is trial 750 with value: 0.13435342446039877.
[I 2024-12-04 15:09:43,404] Trial 898 finished with value: 0.13435439791568257 and parameters: {'kernel_type': 'Matern', 'length_scale': 330.47980453392745, 'noise_level': 0.0002526615068643826, 'constant_value': 85279.40732640115, 'nu': 1.5}. Best is trial 750 with value: 0.13435342446039877.
[I 2024-12-04 15:09:43,738] Trial 894 finished with value: 0.13435443109344647 and parameters: {'kernel_type': 'Matern', 'length_scale': 6.892288980979761, 'noise_level': 0.00285770024807548, 'constant_value': 2258.854401303184, 'nu': 1.5}. Best is trial 750 with value: 0.13435342446039877.
[I 2024-12-04 15:09:44,014] Trial 904 finished with value: 0.13435439575932734 and parameters: {'kernel_type': 'Matern', 'length_scale': 491.7364947911705, 'noise_level': 0.045992414117251836, 'constant_value': 11401.436974029832, 'nu': 1.5}. Best is trial 750 with value: 0.13435342446039877.
[I 2024-12-04 15:09:45,881] Trial 905 finished with value: 0.13435427500057748 and parameters: {'kernel_type': 'Matern', 'length_scale': 1122.2343213377198, 'noise_level': 0.0025778314154427154, 'constant_value': 68700.91493387948, 'nu': 1.5}. Best is trial 750 with value: 0.13435342446039877.
[I 2024-12-04 15:09:45,904] Trial 908 finished with value: 0.13435440047969946 and parameters: {'kernel_type': 'Matern', 'length_scale': 37.680616971243985, 'noise_level': 0.9342432846214062, 'constant_value': 53039.311480275406, 'nu': 1.5}. Best is trial 750 with value: 0.13435342446039877.
[I 2024-12-04 15:09:46,765] Trial 907 finished with value: 0.13435428404240884 and parameters: {'kernel_type': 'Matern', 'length_scale': 189.67584154268872, 'noise_level': 0.056871717426588475, 'constant_value': 37968.252094956275, 'nu': 1.5}. Best is trial 750 with value: 0.13435342446039877.
[I 2024-12-04 15:09:47,137] Trial 909 finished with value: 0.1343543907079217 and parameters: {'kernel_type': 'Matern', 'length_scale': 6.136538079169464, 'noise_level': 0.5574739742621244, 'constant_value': 89954.43891086959, 'nu': 1.5}. Best is trial 750 with value: 0.13435342446039877.
[I 2024-12-04 15:09:48,331] Trial 903 finished with value: 0.13435442296053376 and parameters: {'kernel_type': 'Matern', 'length_scale': 474.46847449257433, 'noise_level': 0.7552075890791213, 'constant_value': 13863.233880982762, 'nu': 1.5}. Best is trial 750 with value: 0.13435342446039877.
[I 2024-12-04 15:09:50,797] Trial 914 finished with value: 0.13435439988765488 and parameters: {'kernel_type': 'Matern', 'length_scale': 818.8020862588155, 'noise_level': 0.0017983544330687903, 'constant_value': 86080.25981895649, 'nu': 1.5}. Best is trial 750 with value: 0.13435342446039877.
[I 2024-12-04 15:09:54,342] Trial 910 finished with value: 0.13435440630899728 and parameters: {'kernel_type': 'Matern', 'length_scale': 15878.887083676602, 'noise_level': 0.2591404486516329, 'constant_value': 38192.74813841436, 'nu': 1.5}. Best is trial 750 with value: 0.13435342446039877.
[I 2024-12-04 15:09:54,759] Trial 917 finished with value: 0.13435440006225233 and parameters: {'kernel_type': 'Matern', 'length_scale': 2962.763325253389, 'noise_level': 0.01564700328747604, 'constant_value': 82903.74688539575, 'nu': 1.5}. Best is trial 750 with value: 0.13435342446039877.
[I 2024-12-04 15:09:57,237] Trial 915 finished with value: 0.13435397707834396 and parameters: {'kernel_type': 'Matern', 'length_scale': 27.373779141952536, 'noise_level': 0.04121278453816044, 'constant_value': 43837.136377997165, 'nu': 1.5}. Best is trial 750 with value: 0.13435342446039877.
[I 2024-12-04 15:09:57,829] Trial 920 finished with value: 0.13435447052178143 and parameters: {'kernel_type': 'Matern', 'length_scale': 21.569048868568768, 'noise_level': 0.912326099486132, 'constant_value': 4055.1724317099793, 'nu': 1.5}. Best is trial 750 with value: 0.13435342446039877.
[I 2024-12-04 15:09:59,639] Trial 913 finished with value: 1.2693635028569898 and parameters: {'kernel_type': 'Matern', 'length_scale': 71623.58681892624, 'noise_level': 4.7107080203154666e-05, 'constant_value': 0.0933334927879062, 'nu': 2.5}. Best is trial 750 with value: 0.13435342446039877.
[I 2024-12-04 15:10:00,144] Trial 922 finished with value: 1.2693635028571573 and parameters: {'kernel_type': 'Matern', 'length_scale': 57062.66050027626, 'noise_level': 1.4522189399976492e-09, 'constant_value': 3.1403571677969566, 'nu': 0.5}. Best is trial 750 with value: 0.13435342446039877.
[I 2024-12-04 15:10:01,153] Trial 928 finished with value: 0.13435442303974793 and parameters: {'kernel_type': 'Matern', 'length_scale': 1225.4118369656642, 'noise_level': 0.0022974793548549296, 'constant_value': 74060.1375183797, 'nu': 1.5}. Best is trial 750 with value: 0.13435342446039877.
[I 2024-12-04 15:10:01,158] Trial 916 finished with value: 0.15167298133378038 and parameters: {'kernel_type': 'RBF', 'length_scale': 6.6668783771769435, 'noise_level': 0.001984552580158911, 'constant_value': 71287.59353345251, 'nu': 1.5}. Best is trial 750 with value: 0.13435342446039877.
[I 2024-12-04 15:10:01,438] Trial 912 finished with value: 0.13435439367028568 and parameters: {'kernel_type': 'Matern', 'length_scale': 182.2873341295344, 'noise_level': 0.07730147446597277, 'constant_value': 1976.8846455414755, 'nu': 1.5}. Best is trial 750 with value: 0.13435342446039877.
[I 2024-12-04 15:10:01,706] Trial 927 finished with value: 0.13435438242421271 and parameters: {'kernel_type': 'Matern', 'length_scale': 272.2091280729679, 'noise_level': 0.00578326932024232, 'constant_value': 40353.857973572965, 'nu': 1.5}. Best is trial 750 with value: 0.13435342446039877.
[I 2024-12-04 15:10:01,879] Trial 923 finished with value: 0.15167303599955373 and parameters: {'kernel_type': 'RBF', 'length_scale': 63.719503244044105, 'noise_level': 0.5873854272190034, 'constant_value': 47543.662116567844, 'nu': 2.5}. Best is trial 750 with value: 0.13435342446039877.
[I 2024-12-04 15:10:03,274] Trial 911 finished with value: 0.13435440758615552 and parameters: {'kernel_type': 'Matern', 'length_scale': 3819.563464390154, 'noise_level': 0.6166846093125358, 'constant_value': 63840.618128929615, 'nu': 1.5}. Best is trial 750 with value: 0.13435342446039877.
[I 2024-12-04 15:10:03,275] Trial 919 finished with value: 1.2693635028569692 and parameters: {'kernel_type': 'Matern', 'length_scale': 0.04272583461051611, 'noise_level': 1.3821752459922355e-09, 'constant_value': 9.32077053201146e-06, 'nu': 2.5}. Best is trial 750 with value: 0.13435342446039877.
[I 2024-12-04 15:10:04,532] Trial 921 finished with value: 0.13435445856190692 and parameters: {'kernel_type': 'Matern', 'length_scale': 38.25344883434983, 'noise_level': 0.049603388071737496, 'constant_value': 44724.08965454187, 'nu': 1.5}. Best is trial 750 with value: 0.13435342446039877.
[I 2024-12-04 15:10:05,428] Trial 918 finished with value: 0.13435439145413805 and parameters: {'kernel_type': 'Matern', 'length_scale': 25.17742507321639, 'noise_level': 0.620754656241105, 'constant_value': 66554.1835895093, 'nu': 1.5}. Best is trial 750 with value: 0.13435342446039877.
[I 2024-12-04 15:10:06,212] Trial 924 finished with value: 0.13435439763293847 and parameters: {'kernel_type': 'Matern', 'length_scale': 59.30360372593228, 'noise_level': 0.005793192868526214, 'constant_value': 66654.9996905348, 'nu': 1.5}. Best is trial 750 with value: 0.13435342446039877.
[I 2024-12-04 15:10:06,260] Trial 925 finished with value: 0.1343544143589938 and parameters: {'kernel_type': 'Matern', 'length_scale': 49.04421006864941, 'noise_level': 0.03943459070453576, 'constant_value': 24761.03325565618, 'nu': 1.5}. Best is trial 750 with value: 0.13435342446039877.
[I 2024-12-04 15:10:06,541] Trial 930 finished with value: 0.13435441333318096 and parameters: {'kernel_type': 'Matern', 'length_scale': 1.7290460596417796, 'noise_level': 0.012285920161192386, 'constant_value': 76495.31907220918, 'nu': 1.5}. Best is trial 750 with value: 0.13435342446039877.
[I 2024-12-04 15:10:08,918] Trial 936 finished with value: 0.1343543743484756 and parameters: {'kernel_type': 'Matern', 'length_scale': 16.828650696388785, 'noise_level': 0.003463224972897337, 'constant_value': 41615.982190742085, 'nu': 1.5}. Best is trial 750 with value: 0.13435342446039877.
[I 2024-12-04 15:10:09,071] Trial 929 finished with value: 0.13435439698300713 and parameters: {'kernel_type': 'Matern', 'length_scale': 4.8965491275690365, 'noise_level': 0.0022552169925550395, 'constant_value': 92129.24227520346, 'nu': 1.5}. Best is trial 750 with value: 0.13435342446039877.
[I 2024-12-04 15:10:09,329] Trial 926 finished with value: 0.13435434090366083 and parameters: {'kernel_type': 'Matern', 'length_scale': 11.684457562352575, 'noise_level': 5.5875427770203885e-05, 'constant_value': 59680.06177375476, 'nu': 1.5}. Best is trial 750 with value: 0.13435342446039877.
[I 2024-12-04 15:10:09,768] Trial 935 finished with value: 0.13435454650454487 and parameters: {'kernel_type': 'Matern', 'length_scale': 955.8785457997392, 'noise_level': 0.9364521168440748, 'constant_value': 5478.9244498914195, 'nu': 1.5}. Best is trial 750 with value: 0.13435342446039877.
[I 2024-12-04 15:10:10,475] Trial 934 finished with value: 0.13435439260089868 and parameters: {'kernel_type': 'Matern', 'length_scale': 26.357162054356003, 'noise_level': 0.04126204538815036, 'constant_value': 1411.373604246697, 'nu': 1.5}. Best is trial 750 with value: 0.13435342446039877.
[I 2024-12-04 15:10:13,846] Trial 939 finished with value: 0.13435440296649476 and parameters: {'kernel_type': 'Matern', 'length_scale': 5.0406851986881325, 'noise_level': 0.006471883951082435, 'constant_value': 80189.95620921522, 'nu': 1.5}. Best is trial 750 with value: 0.13435342446039877.
[I 2024-12-04 15:10:16,402] Trial 933 finished with value: 0.1343543506111831 and parameters: {'kernel_type': 'Matern', 'length_scale': 181.56551394107206, 'noise_level': 0.07305170380083346, 'constant_value': 32362.059625993057, 'nu': 1.5}. Best is trial 750 with value: 0.13435342446039877.
[I 2024-12-04 15:10:16,694] Trial 937 finished with value: 0.1343543472173339 and parameters: {'kernel_type': 'Matern', 'length_scale': 4.00973695006596, 'noise_level': 0.028801568636602902, 'constant_value': 83658.61655949919, 'nu': 1.5}. Best is trial 750 with value: 0.13435342446039877.
[I 2024-12-04 15:10:19,801] Trial 932 finished with value: 0.13435439268667548 and parameters: {'kernel_type': 'Matern', 'length_scale': 17.862263499254325, 'noise_level': 0.18065385497549602, 'constant_value': 91126.23608346957, 'nu': 1.5}. Best is trial 750 with value: 0.13435342446039877.
[I 2024-12-04 15:10:21,225] Trial 940 finished with value: 0.14859825683466246 and parameters: {'kernel_type': 'Matern', 'length_scale': 3.1932897218419938, 'noise_level': 0.812280704819912, 'constant_value': 3952.8252989935936, 'nu': 2.5}. Best is trial 750 with value: 0.13435342446039877.
[I 2024-12-04 15:10:23,640] Trial 947 finished with value: 1.2693635028569692 and parameters: {'kernel_type': 'RBF', 'length_scale': 8.909715139011688e-05, 'noise_level': 6.216076410246557e-06, 'constant_value': 2.1927530989780314e-07, 'nu': 2.5}. Best is trial 750 with value: 0.13435342446039877.
[I 2024-12-04 15:10:25,057] Trial 944 finished with value: 0.13435450162686857 and parameters: {'kernel_type': 'Matern', 'length_scale': 43.433631216343834, 'noise_level': 0.008501265525695806, 'constant_value': 46243.902785125436, 'nu': 1.5}. Best is trial 750 with value: 0.13435342446039877.
[I 2024-12-04 15:10:25,435] Trial 931 finished with value: 1.2693635028569692 and parameters: {'kernel_type': 'Matern', 'length_scale': 4.148896963009245e-05, 'noise_level': 3.3720795316001246e-09, 'constant_value': 1.366867011618955e-06, 'nu': 0.5}. Best is trial 750 with value: 0.13435342446039877.
[I 2024-12-04 15:10:26,865] Trial 948 finished with value: 0.13435415191951777 and parameters: {'kernel_type': 'Matern', 'length_scale': 40.55997642899296, 'noise_level': 0.3041124551623459, 'constant_value': 91703.28660766939, 'nu': 1.5}. Best is trial 750 with value: 0.13435342446039877.
[I 2024-12-04 15:10:27,089] Trial 942 finished with value: 1.2693635028574077 and parameters: {'kernel_type': 'Matern', 'length_scale': 1826.2205499704771, 'noise_level': 6.987488878163381e-06, 'constant_value': 0.002348806985865915, 'nu': 1.5}. Best is trial 750 with value: 0.13435342446039877.
[I 2024-12-04 15:10:27,864] Trial 954 finished with value: 1.3007745979657548 and parameters: {'kernel_type': 'Matern', 'length_scale': 19.821881296208357, 'noise_level': 0.0012459689288572074, 'constant_value': 65713.7203112106, 'nu': 1.5}. Best is trial 750 with value: 0.13435342446039877.
[I 2024-12-04 15:10:28,003] Trial 941 finished with value: 1.2693635028570178 and parameters: {'kernel_type': 'Matern', 'length_scale': 7.178188852280327, 'noise_level': 1.0007501408976499e-07, 'constant_value': 0.00021703799382780892, 'nu': 1.5}. Best is trial 750 with value: 0.13435342446039877.
[I 2024-12-04 15:10:29,853] Trial 953 finished with value: 0.13435442207603587 and parameters: {'kernel_type': 'Matern', 'length_scale': 24.62249957299416, 'noise_level': 0.024237448773226613, 'constant_value': 766.00250504466, 'nu': 1.5}. Best is trial 750 with value: 0.13435342446039877.
[I 2024-12-04 15:10:29,987] Trial 952 finished with value: 0.15167297596125592 and parameters: {'kernel_type': 'RBF', 'length_scale': 94.68599714589833, 'noise_level': 0.16765177856251995, 'constant_value': 11066.817923592904, 'nu': 1.5}. Best is trial 750 with value: 0.13435342446039877.
[I 2024-12-04 15:10:31,309] Trial 949 finished with value: 0.13435437992470317 and parameters: {'kernel_type': 'Matern', 'length_scale': 41.12625490715123, 'noise_level': 0.6621503470094696, 'constant_value': 54025.76683310543, 'nu': 1.5}. Best is trial 750 with value: 0.13435342446039877.
[I 2024-12-04 15:10:32,579] Trial 943 finished with value: 0.1343543993750186 and parameters: {'kernel_type': 'Matern', 'length_scale': 375.32667105681753, 'noise_level': 0.05084650822587165, 'constant_value': 68753.98065733067, 'nu': 1.5}. Best is trial 750 with value: 0.13435342446039877.
[I 2024-12-04 15:10:32,879] Trial 951 finished with value: 0.13435441915232202 and parameters: {'kernel_type': 'Matern', 'length_scale': 178.65164851754687, 'noise_level': 0.009482342944386, 'constant_value': 97584.51159610719, 'nu': 1.5}. Best is trial 750 with value: 0.13435342446039877.
[I 2024-12-04 15:10:33,408] Trial 946 finished with value: 0.15167297758534204 and parameters: {'kernel_type': 'RBF', 'length_scale': 211.89468368844265, 'noise_level': 0.0021603871757035426, 'constant_value': 1843.379325727445, 'nu': 2.5}. Best is trial 750 with value: 0.13435342446039877.
[I 2024-12-04 15:10:33,444] Trial 961 finished with value: 0.1343544002497566 and parameters: {'kernel_type': 'Matern', 'length_scale': 1680.5379927242352, 'noise_level': 0.1568765897613687, 'constant_value': 92504.48903310495, 'nu': 1.5}. Best is trial 750 with value: 0.13435342446039877.
[I 2024-12-04 15:10:33,662] Trial 955 finished with value: 1.2693635028568966 and parameters: {'kernel_type': 'Matern', 'length_scale': 0.05221711963221948, 'noise_level': 2.5795807393685952e-06, 'constant_value': 0.3985363438456017, 'nu': 1.5}. Best is trial 750 with value: 0.13435342446039877.
[I 2024-12-04 15:10:34,969] Trial 938 finished with value: 0.13435405075759307 and parameters: {'kernel_type': 'Matern', 'length_scale': 1.9734724517387137, 'noise_level': 0.1729562479816399, 'constant_value': 783.030284998906, 'nu': 1.5}. Best is trial 750 with value: 0.13435342446039877.
[I 2024-12-04 15:10:35,349] Trial 959 finished with value: 0.13435440959624229 and parameters: {'kernel_type': 'Matern', 'length_scale': 2.179964573511267, 'noise_level': 2.58799493926682e-07, 'constant_value': 0.29848008200302034, 'nu': 1.5}. Best is trial 750 with value: 0.13435342446039877.
[I 2024-12-04 15:10:36,040] Trial 958 finished with value: 0.1343544022177836 and parameters: {'kernel_type': 'Matern', 'length_scale': 3.6781526696482274, 'noise_level': 0.7452709520806079, 'constant_value': 2273.4433308182156, 'nu': 1.5}. Best is trial 750 with value: 0.13435342446039877.
[I 2024-12-04 15:10:37,423] Trial 956 finished with value: 0.17251037570872457 and parameters: {'kernel_type': 'Matern', 'length_scale': 3.398169884380617, 'noise_level': 0.00016106619232684078, 'constant_value': 98909.90404409594, 'nu': 0.5}. Best is trial 750 with value: 0.13435342446039877.
[I 2024-12-04 15:10:38,279] Trial 960 finished with value: 0.13435433208950986 and parameters: {'kernel_type': 'Matern', 'length_scale': 108.39963676182248, 'noise_level': 0.28333631623211064, 'constant_value': 664.6518675799067, 'nu': 1.5}. Best is trial 750 with value: 0.13435342446039877.
[I 2024-12-04 15:10:38,697] Trial 962 finished with value: 0.13435442118758337 and parameters: {'kernel_type': 'Matern', 'length_scale': 304.7525397500549, 'noise_level': 0.5698526392461886, 'constant_value': 80218.2717774495, 'nu': 1.5}. Best is trial 750 with value: 0.13435342446039877.
[I 2024-12-04 15:10:39,000] Trial 950 finished with value: 0.13435441639317441 and parameters: {'kernel_type': 'Matern', 'length_scale': 53.24920363437944, 'noise_level': 0.0007897356955487376, 'constant_value': 70898.75194684361, 'nu': 1.5}. Best is trial 750 with value: 0.13435342446039877.
[I 2024-12-04 15:10:39,312] Trial 957 finished with value: 0.1343543389744411 and parameters: {'kernel_type': 'Matern', 'length_scale': 15.170782066276088, 'noise_level': 0.5758598895056183, 'constant_value': 801.608193868059, 'nu': 1.5}. Best is trial 750 with value: 0.13435342446039877.
[I 2024-12-04 15:10:39,515] Trial 967 finished with value: 0.13435439766532 and parameters: {'kernel_type': 'Matern', 'length_scale': 64.1904906309607, 'noise_level': 0.22489566559464963, 'constant_value': 5180.763511123601, 'nu': 1.5}. Best is trial 750 with value: 0.13435342446039877.
[I 2024-12-04 15:10:39,527] Trial 964 finished with value: 0.13435441319641303 and parameters: {'kernel_type': 'Matern', 'length_scale': 22.746618958699255, 'noise_level': 0.8469177855513568, 'constant_value': 686.5135583485824, 'nu': 1.5}. Best is trial 750 with value: 0.13435342446039877.
[I 2024-12-04 15:10:40,554] Trial 966 finished with value: 0.13435422843077832 and parameters: {'kernel_type': 'Matern', 'length_scale': 223.8298964134935, 'noise_level': 0.1263032199907453, 'constant_value': 98943.3747959478, 'nu': 1.5}. Best is trial 750 with value: 0.13435342446039877.
[I 2024-12-04 15:10:41,324] Trial 963 finished with value: 0.13435436994352126 and parameters: {'kernel_type': 'Matern', 'length_scale': 237.02596578756555, 'noise_level': 0.6307034532669862, 'constant_value': 20412.996260543852, 'nu': 1.5}. Best is trial 750 with value: 0.13435342446039877.
