[I 2024-12-03 18:55:45,346] Trial 1483 finished with value: 0.3774285990181538 and parameters: {'kernel': 'rbf', 'C': 94.96061178560608, 'gamma': 0.065586627019019, 'epsilon': 0.051892291424904466}. Best is trial 88 with value: 0.3542875001421725.
[I 2024-12-03 18:55:46,725] Trial 1484 finished with value: 0.40240571340733444 and parameters: {'kernel': 'rbf', 'C': 17.202994499931556, 'gamma': 0.046499866175763904, 'epsilon': 0.22298142666257342}. Best is trial 88 with value: 0.3542875001421725.
[I 2024-12-03 18:55:48,566] Trial 1485 finished with value: 0.3611119005294209 and parameters: {'kernel': 'rbf', 'C': 98.29396401236566, 'gamma': 0.0369094950745535, 'epsilon': 0.10822220170303053}. Best is trial 88 with value: 0.3542875001421725.
[I 2024-12-03 18:55:49,888] Trial 1486 finished with value: 0.9845393313911821 and parameters: {'kernel': 'sigmoid', 'C': 0.008468961993815891, 'gamma': 0.005646948601954029, 'epsilon': 0.2715389639591354}. Best is trial 88 with value: 0.3542875001421725.
[I 2024-12-03 18:55:50,931] Trial 1487 finished with value: 0.46061235232753245 and parameters: {'kernel': 'rbf', 'C': 4.102125504698442, 'gamma': 0.029440276803606887, 'epsilon': 0.11496369662225113}. Best is trial 88 with value: 0.3542875001421725.
[I 2024-12-03 18:55:53,325] Trial 1488 finished with value: 0.7961306602772882 and parameters: {'kernel': 'linear', 'C': 4.1919451743785165, 'gamma': 0.00012130089179802424, 'epsilon': 0.008010256721063872}. Best is trial 88 with value: 0.3542875001421725.
[I 2024-12-03 18:55:54,133] Trial 1489 finished with value: 0.4546883004296877 and parameters: {'kernel': 'rbf', 'C': 12.079238439570524, 'gamma': 0.06447349413327648, 'epsilon': 0.41381826572544006}. Best is trial 88 with value: 0.3542875001421725.
[I 2024-12-03 18:55:56,261] Trial 1490 finished with value: 2.9311500055807542 and parameters: {'kernel': 'poly', 'C': 40.440374265025966, 'gamma': 0.005653934780500758, 'epsilon': 0.001227117248028195}. Best is trial 88 with value: 0.3542875001421725.
[I 2024-12-03 18:55:57,564] Trial 1491 finished with value: 0.4484600567012826 and parameters: {'kernel': 'rbf', 'C': 98.92678200362093, 'gamma': 0.12339918544278784, 'epsilon': 0.19682073592948776}. Best is trial 88 with value: 0.3542875001421725.
[I 2024-12-03 18:55:58,926] Trial 1492 finished with value: 1.1026605662013191 and parameters: {'kernel': 'poly', 'C': 2.1162841638332637, 'gamma': 0.0004362635743985899, 'epsilon': 0.23356760524982853}. Best is trial 88 with value: 0.3542875001421725.
[I 2024-12-03 18:56:00,337] Trial 1493 finished with value: 0.36328431347248996 and parameters: {'kernel': 'rbf', 'C': 95.69137473561402, 'gamma': 0.032892001441569896, 'epsilon': 0.17961744149884346}. Best is trial 88 with value: 0.3542875001421725.
[I 2024-12-03 18:56:02,177] Trial 1494 finished with value: 0.35599490181554705 and parameters: {'kernel': 'rbf', 'C': 95.73606543549533, 'gamma': 0.04623302622555272, 'epsilon': 0.08770423266456148}. Best is trial 88 with value: 0.3542875001421725.
[I 2024-12-03 18:56:05,225] Trial 1495 finished with value: 0.5617585964799432 and parameters: {'kernel': 'rbf', 'C': 28.366638713591332, 'gamma': 0.2761936870755833, 'epsilon': 0.030328994973251693}. Best is trial 88 with value: 0.3542875001421725.
[I 2024-12-03 18:56:07,264] Trial 1496 finished with value: 0.4398159761191522 and parameters: {'kernel': 'rbf', 'C': 13.608384743739077, 'gamma': 0.02433063365795201, 'epsilon': 0.029736051891802777}. Best is trial 88 with value: 0.3542875001421725.
[I 2024-12-03 18:56:09,544] Trial 1497 finished with value: 0.36047128431020364 and parameters: {'kernel': 'rbf', 'C': 90.61576633458064, 'gamma': 0.048496904647985103, 'epsilon': 0.05939692232961221}. Best is trial 88 with value: 0.3542875001421725.
[I 2024-12-03 18:56:11,330] Trial 1498 finished with value: 0.3844436151974514 and parameters: {'kernel': 'rbf', 'C': 28.95648726895789, 'gamma': 0.0479638988365603, 'epsilon': 0.05706612940581382}. Best is trial 88 with value: 0.3542875001421725.
[I 2024-12-03 18:56:13,441] Trial 1499 finished with value: 0.385992527852096 and parameters: {'kernel': 'rbf', 'C': 85.04680779077948, 'gamma': 0.07924782688873275, 'epsilon': 0.03860764274106484}. Best is trial 88 with value: 0.3542875001421725.
[I 2024-12-03 18:56:14,920] Trial 1439 finished with value: 0.7846288154331428 and parameters: {'kernel': 'linear', 'C': 95.60717541723476, 'gamma': 0.017868472097525158, 'epsilon': 0.10013634846629141}. Best is trial 88 with value: 0.3542875001421725.
[I 2024-12-03 18:56:15,180] Trial 1500 finished with value: 0.42179482319417333 and parameters: {'kernel': 'rbf', 'C': 16.58219143411256, 'gamma': 0.028955397860484514, 'epsilon': 0.11506357256416809}. Best is trial 88 with value: 0.3542875001421725.
[I 2024-12-03 18:56:16,472] Trial 1501 finished with value: 0.3966123768414337 and parameters: {'kernel': 'rbf', 'C': 19.19101372418864, 'gamma': 0.010869763962115005, 'epsilon': 0.05968133015679143}. Best is trial 88 with value: 0.3542875001421725.
[I 2024-12-03 18:56:18,443] Trial 1503 finished with value: 0.3678538888926051 and parameters: {'kernel': 'rbf', 'C': 87.77882711644818, 'gamma': 0.05912979155927197, 'epsilon': 0.07417939104551881}. Best is trial 88 with value: 0.3542875001421725.
[I 2024-12-03 18:56:18,605] Trial 1502 finished with value: 0.4050103790652915 and parameters: {'kernel': 'rbf', 'C': 88.89950012925597, 'gamma': 0.013695118096010839, 'epsilon': 0.029048949057289268}. Best is trial 88 with value: 0.3542875001421725.
[I 2024-12-03 18:56:20,562] Trial 1504 finished with value: 304.76462767036594 and parameters: {'kernel': 'sigmoid', 'C': 14.460424212969711, 'gamma': 0.06898669038799916, 'epsilon': 0.16307597256278644}. Best is trial 88 with value: 0.3542875001421725.
[I 2024-12-03 18:56:20,803] Trial 1505 finished with value: 0.40080726260600874 and parameters: {'kernel': 'rbf', 'C': 91.46818458343124, 'gamma': 0.10277178481274439, 'epsilon': 0.11608668142493624}. Best is trial 88 with value: 0.3542875001421725.
[I 2024-12-03 18:56:22,436] Trial 1506 finished with value: 0.5118369802619467 and parameters: {'kernel': 'rbf', 'C': 19.83990302552677, 'gamma': 0.20299699566670582, 'epsilon': 0.09227679935595176}. Best is trial 88 with value: 0.3542875001421725.
[I 2024-12-03 18:56:23,849] Trial 1508 finished with value: 2.67708468826437 and parameters: {'kernel': 'poly', 'C': 72.80607133196119, 'gamma': 0.004037887180966509, 'epsilon': 0.0925435468134687}. Best is trial 88 with value: 0.3542875001421725.
[I 2024-12-03 18:56:26,638] Trial 1509 finished with value: 0.376847515741024 and parameters: {'kernel': 'rbf', 'C': 56.53112003506287, 'gamma': 0.045053381613394915, 'epsilon': 0.01037730276256875}. Best is trial 88 with value: 0.3542875001421725.
[I 2024-12-03 18:56:27,924] Trial 1510 finished with value: 0.43096861114937224 and parameters: {'kernel': 'rbf', 'C': 24.012645118055524, 'gamma': 0.002589292376721165, 'epsilon': 0.15484490890071628}. Best is trial 88 with value: 0.3542875001421725.
[I 2024-12-03 18:56:29,817] Trial 1511 finished with value: 0.40826784441547664 and parameters: {'kernel': 'rbf', 'C': 21.364940111437996, 'gamma': 0.09698963443198595, 'epsilon': 0.07034537594727003}. Best is trial 88 with value: 0.3542875001421725.
[I 2024-12-03 18:56:31,756] Trial 1512 finished with value: 0.3687008218650911 and parameters: {'kernel': 'rbf', 'C': 63.20536966328492, 'gamma': 0.001844753263994923, 'epsilon': 0.002382071136417876}. Best is trial 88 with value: 0.3542875001421725.
[I 2024-12-03 18:56:34,042] Trial 1513 finished with value: 0.3959640223196425 and parameters: {'kernel': 'rbf', 'C': 19.288389166114356, 'gamma': 0.010883533670213736, 'epsilon': 0.09699908908831018}. Best is trial 88 with value: 0.3542875001421725.
[I 2024-12-03 18:56:55,387] Trial 1457 finished with value: 0.8041118882726379 and parameters: {'kernel': 'linear', 'C': 99.9451780457154, 'gamma': 0.0011540802772830878, 'epsilon': 0.006719382673510919}. Best is trial 88 with value: 0.3542875001421725.
[I 2024-12-03 18:56:56,694] Trial 1515 finished with value: 0.41255234426654736 and parameters: {'kernel': 'rbf', 'C': 22.27489321454686, 'gamma': 0.02449732669475176, 'epsilon': 0.14931739684878484}. Best is trial 88 with value: 0.3542875001421725.
[I 2024-12-03 18:56:58,034] Trial 1516 finished with value: 0.42433261114526527 and parameters: {'kernel': 'rbf', 'C': 21.298642828015325, 'gamma': 0.10935620022249078, 'epsilon': 0.12887786305080334}. Best is trial 88 with value: 0.3542875001421725.
[I 2024-12-03 18:56:59,680] Trial 1517 finished with value: 0.3970168591684708 and parameters: {'kernel': 'rbf', 'C': 94.43074136023154, 'gamma': 0.014081389792770302, 'epsilon': 0.041605722322822634}. Best is trial 88 with value: 0.3542875001421725.
[I 2024-12-03 18:57:00,606] Trial 1518 finished with value: 0.3900611406476023 and parameters: {'kernel': 'rbf', 'C': 22.03612001295374, 'gamma': 0.05765774585043176, 'epsilon': 0.1571668539343053}. Best is trial 88 with value: 0.3542875001421725.
[I 2024-12-03 18:57:18,734] Trial 1514 finished with value: 0.8085700616525833 and parameters: {'kernel': 'linear', 'C': 29.0729027004773, 'gamma': 0.029804846144085483, 'epsilon': 0.03828289436500202}. Best is trial 88 with value: 0.3542875001421725.
[I 2024-12-03 18:57:21,935] Trial 1520 finished with value: 0.7419507745370009 and parameters: {'kernel': 'linear', 'C': 7.808494959018259, 'gamma': 0.07798282799521683, 'epsilon': 0.42364712977615576}. Best is trial 88 with value: 0.3542875001421725.
[I 2024-12-03 18:57:23,459] Trial 1521 finished with value: 1.679079531779568 and parameters: {'kernel': 'poly', 'C': 0.0014754910705875928, 'gamma': 0.0180305754092184, 'epsilon': 0.06673337442942792}. Best is trial 88 with value: 0.3542875001421725.
[I 2024-12-03 18:57:25,121] Trial 1522 finished with value: 0.47310854168945093 and parameters: {'kernel': 'rbf', 'C': 92.79930845541304, 'gamma': 0.1735262894801559, 'epsilon': 0.03236820782771403}. Best is trial 88 with value: 0.3542875001421725.
[I 2024-12-03 18:57:26,504] Trial 1523 finished with value: 0.4784761949224146 and parameters: {'kernel': 'rbf', 'C': 4.454716354590412, 'gamma': 0.07127811158569348, 'epsilon': 0.07276394513559364}. Best is trial 88 with value: 0.3542875001421725.
[I 2024-12-03 18:57:28,327] Trial 1524 finished with value: 0.3670334352241569 and parameters: {'kernel': 'rbf', 'C': 94.1960974830568, 'gamma': 0.0273069834476368, 'epsilon': 0.06732871080720092}. Best is trial 88 with value: 0.3542875001421725.
[I 2024-12-03 18:57:29,673] Trial 1525 finished with value: 1.071024849730232 and parameters: {'kernel': 'sigmoid', 'C': 0.0010821965060612245, 'gamma': 0.9076674263939711, 'epsilon': 0.14903914970143242}. Best is trial 88 with value: 0.3542875001421725.
[I 2024-12-03 18:57:31,344] Trial 1526 finished with value: 0.38828554046780467 and parameters: {'kernel': 'rbf', 'C': 89.25138146006063, 'gamma': 0.08322330463980289, 'epsilon': 0.04494860147153363}. Best is trial 88 with value: 0.3542875001421725.
[I 2024-12-03 18:57:32,173] Trial 1355 finished with value: 1.2033142572493554 and parameters: {'kernel': 'poly', 'C': 0.16493640533453904, 'gamma': 0.18424070114730132, 'epsilon': 0.007101360160702914}. Best is trial 88 with value: 0.3542875001421725.
[I 2024-12-03 18:57:33,212] Trial 1527 finished with value: 0.4285234594281638 and parameters: {'kernel': 'rbf', 'C': 18.564301780095178, 'gamma': 0.027019717057987853, 'epsilon': 0.04502262699149707}. Best is trial 88 with value: 0.3542875001421725.
[I 2024-12-03 18:57:33,984] Trial 1528 finished with value: 0.4171119381166309 and parameters: {'kernel': 'rbf', 'C': 20.380248198448395, 'gamma': 0.022632624978761645, 'epsilon': 0.13927984410344293}. Best is trial 88 with value: 0.3542875001421725.
[I 2024-12-03 18:57:34,582] Trial 1529 finished with value: 0.5843692110277277 and parameters: {'kernel': 'rbf', 'C': 17.32660689014252, 'gamma': 0.2670084549411432, 'epsilon': 0.198199705586248}. Best is trial 88 with value: 0.3542875001421725.
[I 2024-12-03 18:57:35,607] Trial 1530 finished with value: 0.3762822607055553 and parameters: {'kernel': 'rbf', 'C': 91.9443337819396, 'gamma': 0.06999829823914124, 'epsilon': 0.12450648165850982}. Best is trial 88 with value: 0.3542875001421725.
[I 2024-12-03 18:57:36,438] Trial 1531 finished with value: 0.44821740357076423 and parameters: {'kernel': 'rbf', 'C': 97.85905371584407, 'gamma': 0.1446974264201098, 'epsilon': 0.09297443051532141}. Best is trial 88 with value: 0.3542875001421725.
[I 2024-12-03 18:57:37,229] Trial 1532 finished with value: 0.41754315264005704 and parameters: {'kernel': 'rbf', 'C': 21.166418042686352, 'gamma': 0.02194151994054272, 'epsilon': 0.12243722410027646}. Best is trial 88 with value: 0.3542875001421725.
[I 2024-12-03 18:57:37,648] Trial 1533 finished with value: 0.451529474550092 and parameters: {'kernel': 'rbf', 'C': 22.065064352418215, 'gamma': 0.013224031069259425, 'epsilon': 0.4707496482219294}. Best is trial 88 with value: 0.3542875001421725.
[I 2024-12-03 18:57:39,191] Trial 1534 finished with value: 0.4200600672634396 and parameters: {'kernel': 'rbf', 'C': 96.03896774007909, 'gamma': 0.009060712615765569, 'epsilon': 0.07197662037400362}. Best is trial 88 with value: 0.3542875001421725.
[I 2024-12-03 18:57:40,185] Trial 1535 finished with value: 0.3874101160710883 and parameters: {'kernel': 'rbf', 'C': 25.024981094488545, 'gamma': 0.04807254197419739, 'epsilon': 0.1138708638627207}. Best is trial 88 with value: 0.3542875001421725.
[I 2024-12-03 18:57:40,572] Trial 1536 finished with value: 0.5779008290813977 and parameters: {'kernel': 'rbf', 'C': 87.89804414349763, 'gamma': 0.006127787988611393, 'epsilon': 0.7335656411747027}. Best is trial 88 with value: 0.3542875001421725.
[I 2024-12-03 18:57:41,753] Trial 1537 finished with value: 0.8684470679752686 and parameters: {'kernel': 'rbf', 'C': 0.39190551344350966, 'gamma': 0.00018209550705277125, 'epsilon': 0.004475281102083589}. Best is trial 88 with value: 0.3542875001421725.
[I 2024-12-03 18:57:42,499] Trial 1538 finished with value: 0.39533557839473926 and parameters: {'kernel': 'rbf', 'C': 91.48744852933491, 'gamma': 0.012804929750307911, 'epsilon': 0.1588093292912504}. Best is trial 88 with value: 0.3542875001421725.
[I 2024-12-03 18:57:43,245] Trial 1539 finished with value: 0.39044276825399765 and parameters: {'kernel': 'rbf', 'C': 27.695845150710632, 'gamma': 0.07550535404889683, 'epsilon': 0.1555406553201448}. Best is trial 88 with value: 0.3542875001421725.
[I 2024-12-03 18:58:26,784] Trial 1541 finished with value: 0.723337444573092 and parameters: {'kernel': 'linear', 'C': 91.33713425383573, 'gamma': 0.49568260676888937, 'epsilon': 0.2763699237157267}. Best is trial 88 with value: 0.3542875001421725.
[I 2024-12-03 18:58:28,074] Trial 1542 finished with value: 0.4993984727186757 and parameters: {'kernel': 'rbf', 'C': 90.72777194546637, 'gamma': 0.16129351278226947, 'epsilon': 0.21221616791583692}. Best is trial 88 with value: 0.3542875001421725.
[I 2024-12-03 18:59:42,362] Trial 1540 finished with value: 0.8021583415852134 and parameters: {'kernel': 'linear', 'C': 80.44289943106857, 'gamma': 0.037605805594452306, 'epsilon': 0.05476314243577355}. Best is trial 88 with value: 0.3542875001421725.
[I 2024-12-03 18:59:43,527] Trial 1544 finished with value: 0.3911047687179585 and parameters: {'kernel': 'rbf', 'C': 22.56961557647609, 'gamma': 0.041671765776376594, 'epsilon': 0.25418544830290585}. Best is trial 88 with value: 0.3542875001421725.
[I 2024-12-03 18:59:45,021] Trial 1545 finished with value: 0.40109546801486784 and parameters: {'kernel': 'rbf', 'C': 18.651155188943687, 'gamma': 0.06843291842185587, 'epsilon': 0.06178051427781091}. Best is trial 88 with value: 0.3542875001421725.
[I 2024-12-03 18:59:46,296] Trial 1546 finished with value: 0.43710098239128353 and parameters: {'kernel': 'rbf', 'C': 99.29374929689308, 'gamma': 0.1232162929863585, 'epsilon': 0.16114758008601143}. Best is trial 88 with value: 0.3542875001421725.
[I 2024-12-03 18:59:47,799] Trial 1547 finished with value: 0.41585133422567716 and parameters: {'kernel': 'rbf', 'C': 28.990462902025858, 'gamma': 0.022862168077121197, 'epsilon': 0.07385818179250205}. Best is trial 88 with value: 0.3542875001421725.
[I 2024-12-03 18:59:49,190] Trial 1548 finished with value: 0.3636111739785957 and parameters: {'kernel': 'rbf', 'C': 97.42063288241651, 'gamma': 0.055512318828543884, 'epsilon': 0.12994723425160265}. Best is trial 88 with value: 0.3542875001421725.
[I 2024-12-03 18:59:50,752] Trial 1549 finished with value: 0.4226442341950381 and parameters: {'kernel': 'rbf', 'C': 23.537038455576408, 'gamma': 0.026120892215568566, 'epsilon': 0.054086575148664474}. Best is trial 88 with value: 0.3542875001421725.
[I 2024-12-03 18:59:52,125] Trial 1550 finished with value: 0.8337386329772726 and parameters: {'kernel': 'linear', 'C': 0.06478882998447372, 'gamma': 0.004239666476631158, 'epsilon': 0.010341691424217694}. Best is trial 88 with value: 0.3542875001421725.
[I 2024-12-03 18:59:53,253] Trial 1551 finished with value: 0.3942668687839485 and parameters: {'kernel': 'rbf', 'C': 20.52486469014397, 'gamma': 0.04074507278079029, 'epsilon': 0.2708743709680705}. Best is trial 88 with value: 0.3542875001421725.
[I 2024-12-03 18:59:54,655] Trial 1552 finished with value: 108.64555342252197 and parameters: {'kernel': 'sigmoid', 'C': 32.31219397395873, 'gamma': 0.0026253481948425635, 'epsilon': 0.027728319786345015}. Best is trial 88 with value: 0.3542875001421725.
[I 2024-12-03 18:59:55,751] Trial 1553 finished with value: 0.5350699041189452 and parameters: {'kernel': 'rbf', 'C': 19.357131711415153, 'gamma': 0.15550508071324523, 'epsilon': 0.33667642960369704}. Best is trial 88 with value: 0.3542875001421725.
[I 2024-12-03 18:59:56,726] Trial 1554 finished with value: 0.6401405192100883 and parameters: {'kernel': 'rbf', 'C': 19.067762956728288, 'gamma': 0.04669031717334858, 'epsilon': 0.8489332974573893}. Best is trial 88 with value: 0.3542875001421725.
[I 2024-12-03 18:59:58,272] Trial 1555 finished with value: 0.36635809013682274 and parameters: {'kernel': 'rbf', 'C': 88.58812138751662, 'gamma': 0.024363442936214376, 'epsilon': 0.09463398588292225}. Best is trial 88 with value: 0.3542875001421725.
[I 2024-12-03 18:59:59,496] Trial 1556 finished with value: 0.4259103685492212 and parameters: {'kernel': 'rbf', 'C': 29.38664427255399, 'gamma': 0.012006992369872415, 'epsilon': 0.1644311137960645}. Best is trial 88 with value: 0.3542875001421725.
[I 2024-12-03 19:01:27,220] Trial 676 finished with value: 2.758861665698772 and parameters: {'kernel': 'poly', 'C': 7.160137773412094, 'gamma': 0.11465011604433464, 'epsilon': 0.04363081679359102}. Best is trial 88 with value: 0.3542875001421725.
[I 2024-12-03 19:01:28,930] Trial 1558 finished with value: 1898.0191728477776 and parameters: {'kernel': 'sigmoid', 'C': 98.19088103034427, 'gamma': 0.03166849831372407, 'epsilon': 0.13875798744221404}. Best is trial 88 with value: 0.3542875001421725.
[I 2024-12-03 19:01:31,301] Trial 1559 finished with value: 0.39081026802469254 and parameters: {'kernel': 'rbf', 'C': 86.42818703396851, 'gamma': 0.0848019208616421, 'epsilon': 0.18131161617549424}. Best is trial 88 with value: 0.3542875001421725.
[I 2024-12-03 19:01:33,009] Trial 1560 finished with value: 0.5207373550280983 and parameters: {'kernel': 'rbf', 'C': 87.48750305259769, 'gamma': 0.21883858496448855, 'epsilon': 0.05443249473859524}. Best is trial 88 with value: 0.3542875001421725.
[I 2024-12-03 19:01:34,623] Trial 1561 finished with value: 0.39983919930917644 and parameters: {'kernel': 'rbf', 'C': 23.948331115684688, 'gamma': 0.023738754401468894, 'epsilon': 0.339722192812901}. Best is trial 88 with value: 0.3542875001421725.
[I 2024-12-03 19:01:36,187] Trial 1562 finished with value: 0.3887960035954114 and parameters: {'kernel': 'rbf', 'C': 99.43209500185705, 'gamma': 0.012016952420978718, 'epsilon': 0.241679296963335}. Best is trial 88 with value: 0.3542875001421725.
[I 2024-12-03 19:01:37,969] Trial 1563 finished with value: 0.40635091146687125 and parameters: {'kernel': 'rbf', 'C': 18.63105452148383, 'gamma': 0.08052144626728694, 'epsilon': 0.05865726728300106}. Best is trial 88 with value: 0.3542875001421725.
[I 2024-12-03 19:01:39,387] Trial 1564 finished with value: 0.3803550072474342 and parameters: {'kernel': 'rbf', 'C': 98.1069400181303, 'gamma': 0.06320230807887191, 'epsilon': 0.24483096652213357}. Best is trial 88 with value: 0.3542875001421725.
[I 2024-12-03 19:01:40,916] Trial 1565 finished with value: 0.36016792930709945 and parameters: {'kernel': 'rbf', 'C': 98.53471534327541, 'gamma': 0.03466562567529197, 'epsilon': 0.1906533852502001}. Best is trial 88 with value: 0.3542875001421725.
[I 2024-12-03 19:01:42,335] Trial 1566 finished with value: 0.43430213801653617 and parameters: {'kernel': 'rbf', 'C': 83.35854690540876, 'gamma': 0.0029258582386574223, 'epsilon': 0.28421946107898954}. Best is trial 88 with value: 0.3542875001421725.
[I 2024-12-03 19:01:44,021] Trial 1567 finished with value: 1.3380569455497553 and parameters: {'kernel': 'poly', 'C': 74.77319965136428, 'gamma': 0.001725193243419044, 'epsilon': 0.007420928614881222}. Best is trial 88 with value: 0.3542875001421725.
[I 2024-12-03 19:01:46,339] Trial 1568 finished with value: 0.38823520605867917 and parameters: {'kernel': 'rbf', 'C': 95.31129833341997, 'gamma': 0.07489646747960041, 'epsilon': 0.03111557841727158}. Best is trial 88 with value: 0.3542875001421725.
[I 2024-12-03 19:01:47,761] Trial 1569 finished with value: 1341.7127679068262 and parameters: {'kernel': 'sigmoid', 'C': 56.93261857348161, 'gamma': 0.2568299621191866, 'epsilon': 0.12408599270737364}. Best is trial 88 with value: 0.3542875001421725.
