[I 2024-12-04 11:52:40,718] Trial 159 finished with value: 1.0746652081803512 and parameters: {'max_depth': 19, 'min_samples_split': 19, 'min_samples_leaf': 3, 'max_features': 'sqrt', 'criterion': 'friedman_mse', 'splitter': 'best'}. Best is trial 45 with value: 0.5614145525970277.
[I 2024-12-04 11:52:40,747] Trial 166 finished with value: 0.9424778759919019 and parameters: {'max_depth': 35, 'min_samples_split': 8, 'min_samples_leaf': 2, 'max_features': 'log2', 'criterion': 'squared_error', 'splitter': 'best'}. Best is trial 45 with value: 0.5614145525970277.
[I 2024-12-04 11:52:40,801] Trial 152 finished with value: 0.9701084854708626 and parameters: {'max_depth': 26, 'min_samples_split': 14, 'min_samples_leaf': 1, 'max_features': 'sqrt', 'criterion': 'friedman_mse', 'splitter': 'random'}. Best is trial 45 with value: 0.5614145525970277.
[I 2024-12-04 11:52:40,991] Trial 146 finished with value: 1.0746652081803512 and parameters: {'max_depth': 22, 'min_samples_split': 18, 'min_samples_leaf': 3, 'max_features': 'sqrt', 'criterion': 'friedman_mse', 'splitter': 'best'}. Best is trial 45 with value: 0.5614145525970277.
[I 2024-12-04 11:52:41,162] Trial 151 finished with value: 1.0855266432011492 and parameters: {'max_depth': 32, 'min_samples_split': 11, 'min_samples_leaf': 8, 'max_features': 'sqrt', 'criterion': 'squared_error', 'splitter': 'best'}. Best is trial 45 with value: 0.5614145525970277.
[I 2024-12-04 11:52:41,335] Trial 141 finished with value: 0.6033893981188482 and parameters: {'max_depth': 27, 'min_samples_split': 16, 'min_samples_leaf': 1, 'max_features': 'sqrt', 'criterion': 'friedman_mse', 'splitter': 'best'}. Best is trial 45 with value: 0.5614145525970277.
[I 2024-12-04 11:52:41,659] Trial 161 finished with value: 0.5823455371770782 and parameters: {'max_depth': 22, 'min_samples_split': 20, 'min_samples_leaf': 1, 'max_features': 'sqrt', 'criterion': 'friedman_mse', 'splitter': 'best'}. Best is trial 45 with value: 0.5614145525970277.
[I 2024-12-04 11:52:41,668] Trial 169 finished with value: 0.5945975836542683 and parameters: {'max_depth': 33, 'min_samples_split': 20, 'min_samples_leaf': 2, 'max_features': 'sqrt', 'criterion': 'squared_error', 'splitter': 'best'}. Best is trial 45 with value: 0.5614145525970277.
[I 2024-12-04 11:52:41,944] Trial 163 finished with value: 0.6123309477428763 and parameters: {'max_depth': 23, 'min_samples_split': 17, 'min_samples_leaf': 2, 'max_features': 'sqrt', 'criterion': 'squared_error', 'splitter': 'best'}. Best is trial 45 with value: 0.5614145525970277.
[I 2024-12-04 11:52:42,600] Trial 154 finished with value: 0.944655248066478 and parameters: {'max_depth': 26, 'min_samples_split': 19, 'min_samples_leaf': 2, 'max_features': 'sqrt', 'criterion': 'absolute_error', 'splitter': 'random'}. Best is trial 45 with value: 0.5614145525970277.
[I 2024-12-04 11:52:42,795] Trial 153 finished with value: 0.5764982667487542 and parameters: {'max_depth': 21, 'min_samples_split': 18, 'min_samples_leaf': 1, 'max_features': 'sqrt', 'criterion': 'friedman_mse', 'splitter': 'best'}. Best is trial 45 with value: 0.5614145525970277.
[I 2024-12-04 11:52:43,256] Trial 167 finished with value: 0.6366870857247696 and parameters: {'max_depth': 28, 'min_samples_split': 15, 'min_samples_leaf': 2, 'max_features': 'sqrt', 'criterion': 'squared_error', 'splitter': 'best'}. Best is trial 45 with value: 0.5614145525970277.
[I 2024-12-04 11:52:43,706] Trial 164 finished with value: 0.5932995079316209 and parameters: {'max_depth': 33, 'min_samples_split': 13, 'min_samples_leaf': 2, 'max_features': 'sqrt', 'criterion': 'squared_error', 'splitter': 'best'}. Best is trial 45 with value: 0.5614145525970277.
[I 2024-12-04 11:52:44,685] Trial 155 finished with value: 1.261454797635251 and parameters: {'max_depth': 16, 'min_samples_split': 5, 'min_samples_leaf': 10, 'max_features': 'log2', 'criterion': 'friedman_mse', 'splitter': 'best'}. Best is trial 45 with value: 0.5614145525970277.
[I 2024-12-04 11:52:44,996] Trial 171 finished with value: 0.7293378969603873 and parameters: {'max_depth': 32, 'min_samples_split': 16, 'min_samples_leaf': 1, 'max_features': 'log2', 'criterion': 'absolute_error', 'splitter': 'best'}. Best is trial 45 with value: 0.5614145525970277.
[I 2024-12-04 11:52:45,609] Trial 165 finished with value: 0.8231609083073961 and parameters: {'max_depth': 33, 'min_samples_split': 14, 'min_samples_leaf': 1, 'max_features': 'sqrt', 'criterion': 'absolute_error', 'splitter': 'best'}. Best is trial 45 with value: 0.5614145525970277.
[I 2024-12-04 11:52:45,617] Trial 168 finished with value: 0.5804262688971131 and parameters: {'max_depth': 18, 'min_samples_split': 17, 'min_samples_leaf': 1, 'max_features': 'sqrt', 'criterion': 'friedman_mse', 'splitter': 'best'}. Best is trial 45 with value: 0.5614145525970277.
[I 2024-12-04 11:52:45,833] Trial 175 finished with value: 0.592194526289726 and parameters: {'max_depth': 33, 'min_samples_split': 16, 'min_samples_leaf': 1, 'max_features': 'sqrt', 'criterion': 'squared_error', 'splitter': 'best'}. Best is trial 45 with value: 0.5614145525970277.
[I 2024-12-04 11:52:46,058] Trial 170 finished with value: 0.5784943231450516 and parameters: {'max_depth': 27, 'min_samples_split': 14, 'min_samples_leaf': 1, 'max_features': 'sqrt', 'criterion': 'squared_error', 'splitter': 'best'}. Best is trial 45 with value: 0.5614145525970277.
[I 2024-12-04 11:52:46,409] Trial 172 finished with value: 0.6241169559432111 and parameters: {'max_depth': 30, 'min_samples_split': 16, 'min_samples_leaf': 1, 'max_features': 'sqrt', 'criterion': 'squared_error', 'splitter': 'best'}. Best is trial 45 with value: 0.5614145525970277.
[I 2024-12-04 11:52:46,433] Trial 182 finished with value: 1.1144097880659547 and parameters: {'max_depth': 25, 'min_samples_split': 14, 'min_samples_leaf': 2, 'max_features': 'sqrt', 'criterion': 'squared_error', 'splitter': 'random'}. Best is trial 45 with value: 0.5614145525970277.
[I 2024-12-04 11:52:46,761] Trial 181 finished with value: 1.1782798013992881 and parameters: {'max_depth': 34, 'min_samples_split': 16, 'min_samples_leaf': 2, 'max_features': 'log2', 'criterion': 'squared_error', 'splitter': 'random'}. Best is trial 45 with value: 0.5614145525970277.
[I 2024-12-04 11:52:46,854] Trial 177 finished with value: 0.5840756540504097 and parameters: {'max_depth': 15, 'min_samples_split': 20, 'min_samples_leaf': 2, 'max_features': 'sqrt', 'criterion': 'friedman_mse', 'splitter': 'best'}. Best is trial 45 with value: 0.5614145525970277.
[I 2024-12-04 11:52:48,112] Trial 184 finished with value: 1.0746652081803512 and parameters: {'max_depth': 35, 'min_samples_split': 13, 'min_samples_leaf': 3, 'max_features': 'sqrt', 'criterion': 'friedman_mse', 'splitter': 'best'}. Best is trial 45 with value: 0.5614145525970277.
[I 2024-12-04 11:52:48,114] Trial 178 finished with value: 0.6071641840798986 and parameters: {'max_depth': 21, 'min_samples_split': 16, 'min_samples_leaf': 1, 'max_features': 'sqrt', 'criterion': 'friedman_mse', 'splitter': 'best'}. Best is trial 45 with value: 0.5614145525970277.
[I 2024-12-04 11:52:48,354] Trial 173 finished with value: 0.5803899068012356 and parameters: {'max_depth': 27, 'min_samples_split': 19, 'min_samples_leaf': 1, 'max_features': 'sqrt', 'criterion': 'friedman_mse', 'splitter': 'best'}. Best is trial 45 with value: 0.5614145525970277.
[I 2024-12-04 11:52:48,363] Trial 187 finished with value: 0.5733794981369233 and parameters: {'max_depth': 22, 'min_samples_split': 13, 'min_samples_leaf': 1, 'max_features': 'sqrt', 'criterion': 'friedman_mse', 'splitter': 'best'}. Best is trial 45 with value: 0.5614145525970277.
[I 2024-12-04 11:52:48,760] Trial 186 finished with value: 1.261454797635251 and parameters: {'max_depth': 23, 'min_samples_split': 19, 'min_samples_leaf': 6, 'max_features': 'log2', 'criterion': 'squared_error', 'splitter': 'random'}. Best is trial 45 with value: 0.5614145525970277.
[I 2024-12-04 11:52:49,198] Trial 180 finished with value: 1.1134686421038351 and parameters: {'max_depth': 22, 'min_samples_split': 19, 'min_samples_leaf': 2, 'max_features': 'sqrt', 'criterion': 'friedman_mse', 'splitter': 'random'}. Best is trial 45 with value: 0.5614145525970277.
[I 2024-12-04 11:52:49,880] Trial 188 finished with value: 0.9424778759919019 and parameters: {'max_depth': 21, 'min_samples_split': 19, 'min_samples_leaf': 3, 'max_features': 'log2', 'criterion': 'friedman_mse', 'splitter': 'best'}. Best is trial 45 with value: 0.5614145525970277.
[I 2024-12-04 11:52:50,132] Trial 189 finished with value: 0.6358251849717234 and parameters: {'max_depth': 21, 'min_samples_split': 15, 'min_samples_leaf': 1, 'max_features': 'sqrt', 'criterion': 'friedman_mse', 'splitter': 'best'}. Best is trial 45 with value: 0.5614145525970277.
[I 2024-12-04 11:52:50,309] Trial 183 finished with value: 0.6482805331741939 and parameters: {'max_depth': 22, 'min_samples_split': 10, 'min_samples_leaf': 1, 'max_features': 'sqrt', 'criterion': 'friedman_mse', 'splitter': 'best'}. Best is trial 45 with value: 0.5614145525970277.
[I 2024-12-04 11:52:52,986] Trial 176 finished with value: 1.261454797635251 and parameters: {'max_depth': 8, 'min_samples_split': 20, 'min_samples_leaf': 8, 'max_features': 'log2', 'criterion': 'squared_error', 'splitter': 'random'}. Best is trial 45 with value: 0.5614145525970277.
[I 2024-12-04 11:52:53,155] Trial 179 finished with value: 1.0746652081803512 and parameters: {'max_depth': 22, 'min_samples_split': 18, 'min_samples_leaf': 3, 'max_features': 'sqrt', 'criterion': 'friedman_mse', 'splitter': 'best'}. Best is trial 45 with value: 0.5614145525970277.
[I 2024-12-04 11:52:53,156] Trial 190 finished with value: 0.5785444383766838 and parameters: {'max_depth': 26, 'min_samples_split': 20, 'min_samples_leaf': 1, 'max_features': 'sqrt', 'criterion': 'friedman_mse', 'splitter': 'best'}. Best is trial 45 with value: 0.5614145525970277.
[I 2024-12-04 11:52:53,166] Trial 193 finished with value: 1.0235942156102853 and parameters: {'max_depth': 16, 'min_samples_split': 20, 'min_samples_leaf': 2, 'max_features': 'sqrt', 'criterion': 'absolute_error', 'splitter': 'best'}. Best is trial 45 with value: 0.5614145525970277.
[I 2024-12-04 11:52:53,360] Trial 194 finished with value: 0.6123229869161847 and parameters: {'max_depth': 22, 'min_samples_split': 15, 'min_samples_leaf': 2, 'max_features': 'sqrt', 'criterion': 'friedman_mse', 'splitter': 'best'}. Best is trial 45 with value: 0.5614145525970277.
[I 2024-12-04 11:52:53,898] Trial 198 finished with value: 0.5656162715705985 and parameters: {'max_depth': 20, 'min_samples_split': 17, 'min_samples_leaf': 1, 'max_features': 'sqrt', 'criterion': 'friedman_mse', 'splitter': 'best'}. Best is trial 45 with value: 0.5614145525970277.
[I 2024-12-04 11:52:54,033] Trial 195 finished with value: 0.5875137637998102 and parameters: {'max_depth': 35, 'min_samples_split': 18, 'min_samples_leaf': 1, 'max_features': 'sqrt', 'criterion': 'squared_error', 'splitter': 'best'}. Best is trial 45 with value: 0.5614145525970277.
[I 2024-12-04 11:52:54,337] Trial 174 finished with value: 0.6123309477428763 and parameters: {'max_depth': 23, 'min_samples_split': 15, 'min_samples_leaf': 2, 'max_features': 'sqrt', 'criterion': 'friedman_mse', 'splitter': 'best'}. Best is trial 45 with value: 0.5614145525970277.
[I 2024-12-04 11:52:54,839] Trial 200 finished with value: 0.5615729837236106 and parameters: {'max_depth': 31, 'min_samples_split': 14, 'min_samples_leaf': 1, 'max_features': 'sqrt', 'criterion': 'friedman_mse', 'splitter': 'best'}. Best is trial 45 with value: 0.5614145525970277.
[I 2024-12-04 11:52:55,356] Trial 204 finished with value: 0.6233446187199785 and parameters: {'max_depth': 18, 'min_samples_split': 8, 'min_samples_leaf': 2, 'max_features': 'sqrt', 'criterion': 'squared_error', 'splitter': 'best'}. Best is trial 45 with value: 0.5614145525970277.
[I 2024-12-04 11:52:55,773] Trial 202 finished with value: 0.6025652836913528 and parameters: {'max_depth': 34, 'min_samples_split': 11, 'min_samples_leaf': 1, 'max_features': 'sqrt', 'criterion': 'squared_error', 'splitter': 'best'}. Best is trial 45 with value: 0.5614145525970277.
[I 2024-12-04 11:52:55,781] Trial 203 finished with value: 0.5877723420587634 and parameters: {'max_depth': 25, 'min_samples_split': 15, 'min_samples_leaf': 1, 'max_features': 'sqrt', 'criterion': 'friedman_mse', 'splitter': 'best'}. Best is trial 45 with value: 0.5614145525970277.
[I 2024-12-04 11:52:55,788] Trial 199 finished with value: 0.5700768096345179 and parameters: {'max_depth': 21, 'min_samples_split': 19, 'min_samples_leaf': 2, 'max_features': 'sqrt', 'criterion': 'friedman_mse', 'splitter': 'best'}. Best is trial 45 with value: 0.5614145525970277.
[I 2024-12-04 11:52:55,914] Trial 213 finished with value: 0.9526599532305388 and parameters: {'max_depth': 12, 'min_samples_split': 8, 'min_samples_leaf': 2, 'max_features': 'log2', 'criterion': 'absolute_error', 'splitter': 'best'}. Best is trial 45 with value: 0.5614145525970277.
[I 2024-12-04 11:52:55,930] Trial 207 finished with value: 0.6839704139151704 and parameters: {'max_depth': 30, 'min_samples_split': 11, 'min_samples_leaf': 1, 'max_features': 'sqrt', 'criterion': 'friedman_mse', 'splitter': 'best'}. Best is trial 45 with value: 0.5614145525970277.
[I 2024-12-04 11:52:56,557] Trial 192 finished with value: 1.259809444253076 and parameters: {'max_depth': 32, 'min_samples_split': 5, 'min_samples_leaf': 7, 'max_features': 'sqrt', 'criterion': 'friedman_mse', 'splitter': 'random'}. Best is trial 45 with value: 0.5614145525970277.
[I 2024-12-04 11:52:57,020] Trial 191 finished with value: 0.5951824649333685 and parameters: {'max_depth': 30, 'min_samples_split': 17, 'min_samples_leaf': 1, 'max_features': 'sqrt', 'criterion': 'friedman_mse', 'splitter': 'best'}. Best is trial 45 with value: 0.5614145525970277.
[I 2024-12-04 11:52:57,294] Trial 206 finished with value: 1.0855266432011492 and parameters: {'max_depth': 20, 'min_samples_split': 9, 'min_samples_leaf': 8, 'max_features': 'sqrt', 'criterion': 'friedman_mse', 'splitter': 'best'}. Best is trial 45 with value: 0.5614145525970277.
[I 2024-12-04 11:52:57,300] Trial 201 finished with value: 0.8387576705440783 and parameters: {'max_depth': 33, 'min_samples_split': 11, 'min_samples_leaf': 1, 'max_features': 'sqrt', 'criterion': 'squared_error', 'splitter': 'random'}. Best is trial 45 with value: 0.5614145525970277.
[I 2024-12-04 11:52:57,592] Trial 197 finished with value: 0.5823080139356801 and parameters: {'max_depth': 35, 'min_samples_split': 13, 'min_samples_leaf': 1, 'max_features': 'sqrt', 'criterion': 'friedman_mse', 'splitter': 'best'}. Best is trial 45 with value: 0.5614145525970277.
[I 2024-12-04 11:52:57,869] Trial 185 finished with value: 0.7461366010043476 and parameters: {'max_depth': 10, 'min_samples_split': 13, 'min_samples_leaf': 2, 'max_features': 'sqrt', 'criterion': 'friedman_mse', 'splitter': 'best'}. Best is trial 45 with value: 0.5614145525970277.
[I 2024-12-04 11:52:58,448] Trial 205 finished with value: 0.8516129540673686 and parameters: {'max_depth': 19, 'min_samples_split': 14, 'min_samples_leaf': 1, 'max_features': 'log2', 'criterion': 'friedman_mse', 'splitter': 'best'}. Best is trial 45 with value: 0.5614145525970277.
[I 2024-12-04 11:52:58,797] Trial 218 finished with value: 1.422615004128031 and parameters: {'max_depth': 27, 'min_samples_split': 2, 'min_samples_leaf': 6, 'max_features': 'sqrt', 'criterion': 'absolute_error', 'splitter': 'best'}. Best is trial 45 with value: 0.5614145525970277.
[I 2024-12-04 11:52:58,974] Trial 210 finished with value: 1.0746652081803512 and parameters: {'max_depth': 13, 'min_samples_split': 17, 'min_samples_leaf': 3, 'max_features': 'sqrt', 'criterion': 'friedman_mse', 'splitter': 'best'}. Best is trial 45 with value: 0.5614145525970277.
[I 2024-12-04 11:52:59,152] Trial 209 finished with value: 0.5729445200747079 and parameters: {'max_depth': 20, 'min_samples_split': 17, 'min_samples_leaf': 2, 'max_features': 'sqrt', 'criterion': 'friedman_mse', 'splitter': 'best'}. Best is trial 45 with value: 0.5614145525970277.
[I 2024-12-04 11:52:59,271] Trial 196 finished with value: 0.5837193420044962 and parameters: {'max_depth': 24, 'min_samples_split': 19, 'min_samples_leaf': 1, 'max_features': 'sqrt', 'criterion': 'friedman_mse', 'splitter': 'best'}. Best is trial 45 with value: 0.5614145525970277.
[I 2024-12-04 11:52:59,930] Trial 208 finished with value: 1.205547579291052 and parameters: {'max_depth': 16, 'min_samples_split': 3, 'min_samples_leaf': 2, 'max_features': 'sqrt', 'criterion': 'absolute_error', 'splitter': 'random'}. Best is trial 45 with value: 0.5614145525970277.
[I 2024-12-04 11:53:00,278] Trial 212 finished with value: 0.5764049018163563 and parameters: {'max_depth': 22, 'min_samples_split': 16, 'min_samples_leaf': 1, 'max_features': 'sqrt', 'criterion': 'squared_error', 'splitter': 'best'}. Best is trial 45 with value: 0.5614145525970277.
[I 2024-12-04 11:53:00,563] Trial 211 finished with value: 0.9424778759919019 and parameters: {'max_depth': 27, 'min_samples_split': 16, 'min_samples_leaf': 3, 'max_features': 'log2', 'criterion': 'squared_error', 'splitter': 'best'}. Best is trial 45 with value: 0.5614145525970277.
[I 2024-12-04 11:53:02,194] Trial 217 finished with value: 0.6015016060887844 and parameters: {'max_depth': 14, 'min_samples_split': 20, 'min_samples_leaf': 1, 'max_features': 'sqrt', 'criterion': 'friedman_mse', 'splitter': 'best'}. Best is trial 45 with value: 0.5614145525970277.
[I 2024-12-04 11:53:02,894] Trial 221 finished with value: 1.261454797635251 and parameters: {'max_depth': 6, 'min_samples_split': 7, 'min_samples_leaf': 10, 'max_features': 'log2', 'criterion': 'friedman_mse', 'splitter': 'random'}. Best is trial 45 with value: 0.5614145525970277.
[I 2024-12-04 11:53:03,307] Trial 215 finished with value: 0.5728219443191909 and parameters: {'max_depth': 20, 'min_samples_split': 18, 'min_samples_leaf': 2, 'max_features': 'sqrt', 'criterion': 'friedman_mse', 'splitter': 'best'}. Best is trial 45 with value: 0.5614145525970277.
[I 2024-12-04 11:53:03,559] Trial 216 finished with value: 1.0746652081803512 and parameters: {'max_depth': 18, 'min_samples_split': 19, 'min_samples_leaf': 3, 'max_features': 'sqrt', 'criterion': 'friedman_mse', 'splitter': 'best'}. Best is trial 45 with value: 0.5614145525970277.
[I 2024-12-04 11:53:03,652] Trial 227 finished with value: 1.2194864098993115 and parameters: {'max_depth': 15, 'min_samples_split': 12, 'min_samples_leaf': 1, 'max_features': 'sqrt', 'criterion': 'absolute_error', 'splitter': 'random'}. Best is trial 45 with value: 0.5614145525970277.
[I 2024-12-04 11:53:03,684] Trial 224 finished with value: 0.6033893981188482 and parameters: {'max_depth': 27, 'min_samples_split': 15, 'min_samples_leaf': 1, 'max_features': 'sqrt', 'criterion': 'friedman_mse', 'splitter': 'best'}. Best is trial 45 with value: 0.5614145525970277.
[I 2024-12-04 11:53:04,291] Trial 225 finished with value: 0.6482805331741939 and parameters: {'max_depth': 22, 'min_samples_split': 10, 'min_samples_leaf': 1, 'max_features': 'sqrt', 'criterion': 'squared_error', 'splitter': 'best'}. Best is trial 45 with value: 0.5614145525970277.
[I 2024-12-04 11:53:04,642] Trial 220 finished with value: 0.5700768096345179 and parameters: {'max_depth': 21, 'min_samples_split': 18, 'min_samples_leaf': 2, 'max_features': 'sqrt', 'criterion': 'friedman_mse', 'splitter': 'best'}. Best is trial 45 with value: 0.5614145525970277.
[I 2024-12-04 11:53:04,715] Trial 214 finished with value: 0.582124097252253 and parameters: {'max_depth': 17, 'min_samples_split': 15, 'min_samples_leaf': 2, 'max_features': 'sqrt', 'criterion': 'friedman_mse', 'splitter': 'best'}. Best is trial 45 with value: 0.5614145525970277.
[I 2024-12-04 11:53:05,034] Trial 219 finished with value: 1.0746652081803512 and parameters: {'max_depth': 29, 'min_samples_split': 17, 'min_samples_leaf': 3, 'max_features': 'sqrt', 'criterion': 'friedman_mse', 'splitter': 'best'}. Best is trial 45 with value: 0.5614145525970277.
[I 2024-12-04 11:53:05,692] Trial 231 finished with value: 0.5927976346495639 and parameters: {'max_depth': 19, 'min_samples_split': 17, 'min_samples_leaf': 2, 'max_features': 'sqrt', 'criterion': 'friedman_mse', 'splitter': 'best'}. Best is trial 45 with value: 0.5614145525970277.
[I 2024-12-04 11:53:06,097] Trial 229 finished with value: 0.9558089505727682 and parameters: {'max_depth': 23, 'min_samples_split': 15, 'min_samples_leaf': 2, 'max_features': 'sqrt', 'criterion': 'absolute_error', 'splitter': 'best'}. Best is trial 45 with value: 0.5614145525970277.
[I 2024-12-04 11:53:06,157] Trial 237 finished with value: 1.259809444253076 and parameters: {'max_depth': 5, 'min_samples_split': 10, 'min_samples_leaf': 7, 'max_features': 'sqrt', 'criterion': 'squared_error', 'splitter': 'random'}. Best is trial 45 with value: 0.5614145525970277.
[I 2024-12-04 11:53:06,578] Trial 230 finished with value: 1.0746652081803512 and parameters: {'max_depth': 23, 'min_samples_split': 20, 'min_samples_leaf': 3, 'max_features': 'sqrt', 'criterion': 'friedman_mse', 'splitter': 'best'}. Best is trial 45 with value: 0.5614145525970277.
[I 2024-12-04 11:53:06,596] Trial 232 finished with value: 0.5927976346495639 and parameters: {'max_depth': 19, 'min_samples_split': 16, 'min_samples_leaf': 2, 'max_features': 'sqrt', 'criterion': 'friedman_mse', 'splitter': 'best'}. Best is trial 45 with value: 0.5614145525970277.
[I 2024-12-04 11:53:06,655] Trial 235 finished with value: 1.261454797635251 and parameters: {'max_depth': 1, 'min_samples_split': 18, 'min_samples_leaf': 4, 'max_features': 'log2', 'criterion': 'friedman_mse', 'splitter': 'random'}. Best is trial 45 with value: 0.5614145525970277.
