[I 2024-12-04 12:22:38,807] Trial 2145 finished with value: 0.3051436883519555 and parameters: {'n_estimators': 531, 'max_depth': 44, 'min_samples_split': 2, 'min_samples_leaf': 1, 'max_features': 'sqrt', 'bootstrap': False, 'criterion': 'squared_error'}. Best is trial 341 with value: 0.2909369124469028.
[I 2024-12-04 12:22:38,954] Trial 2137 finished with value: 0.2941391388468512 and parameters: {'n_estimators': 573, 'max_depth': 50, 'min_samples_split': 3, 'min_samples_leaf': 1, 'max_features': 'sqrt', 'bootstrap': False, 'criterion': 'squared_error'}. Best is trial 341 with value: 0.2909369124469028.
[I 2024-12-04 12:22:38,961] Trial 2140 finished with value: 0.4409541899128288 and parameters: {'n_estimators': 452, 'max_depth': 50, 'min_samples_split': 4, 'min_samples_leaf': 2, 'max_features': 'sqrt', 'bootstrap': False, 'criterion': 'squared_error'}. Best is trial 341 with value: 0.2909369124469028.
[I 2024-12-04 12:22:39,395] Trial 2150 finished with value: 0.5344006937577913 and parameters: {'n_estimators': 452, 'max_depth': 9, 'min_samples_split': 38, 'min_samples_leaf': 15, 'max_features': None, 'bootstrap': False, 'criterion': 'squared_error'}. Best is trial 341 with value: 0.2909369124469028.
[I 2024-12-04 12:22:39,634] Trial 2147 finished with value: 0.2940096954816661 and parameters: {'n_estimators': 582, 'max_depth': 50, 'min_samples_split': 3, 'min_samples_leaf': 1, 'max_features': 'sqrt', 'bootstrap': False, 'criterion': 'squared_error'}. Best is trial 341 with value: 0.2909369124469028.
[I 2024-12-04 12:22:40,516] Trial 2142 finished with value: 0.88913236109111 and parameters: {'n_estimators': 631, 'max_depth': 25, 'min_samples_split': 27, 'min_samples_leaf': 5, 'max_features': 'log2', 'bootstrap': False, 'criterion': 'squared_error'}. Best is trial 341 with value: 0.2909369124469028.
[I 2024-12-04 12:22:40,519] Trial 2144 finished with value: 0.7894968316475756 and parameters: {'n_estimators': 640, 'max_depth': 35, 'min_samples_split': 44, 'min_samples_leaf': 2, 'max_features': 'log2', 'bootstrap': True, 'criterion': 'squared_error'}. Best is trial 341 with value: 0.2909369124469028.
[I 2024-12-04 12:22:42,077] Trial 2158 finished with value: 0.31177053450880404 and parameters: {'n_estimators': 498, 'max_depth': 50, 'min_samples_split': 7, 'min_samples_leaf': 1, 'max_features': 'sqrt', 'bootstrap': False, 'criterion': 'squared_error'}. Best is trial 341 with value: 0.2909369124469028.
[I 2024-12-04 12:22:42,081] Trial 2146 finished with value: 0.5973915419202029 and parameters: {'n_estimators': 535, 'max_depth': 19, 'min_samples_split': 47, 'min_samples_leaf': 4, 'max_features': 'sqrt', 'bootstrap': False, 'criterion': 'absolute_error'}. Best is trial 341 with value: 0.2909369124469028.
[I 2024-12-04 12:22:42,350] Trial 2153 finished with value: 0.4433841426221063 and parameters: {'n_estimators': 533, 'max_depth': 43, 'min_samples_split': 2, 'min_samples_leaf': 2, 'max_features': 'sqrt', 'bootstrap': False, 'criterion': 'squared_error'}. Best is trial 341 with value: 0.2909369124469028.
[I 2024-12-04 12:22:42,567] Trial 2151 finished with value: 0.8961206084046602 and parameters: {'n_estimators': 565, 'max_depth': 49, 'min_samples_split': 3, 'min_samples_leaf': 13, 'max_features': 'sqrt', 'bootstrap': True, 'criterion': 'squared_error'}. Best is trial 341 with value: 0.2909369124469028.
[I 2024-12-04 12:22:43,028] Trial 2148 finished with value: 0.3765357853354457 and parameters: {'n_estimators': 550, 'max_depth': 50, 'min_samples_split': 3, 'min_samples_leaf': 1, 'max_features': 'log2', 'bootstrap': False, 'criterion': 'squared_error'}. Best is trial 341 with value: 0.2909369124469028.
[I 2024-12-04 12:22:44,475] Trial 2155 finished with value: 0.30678504637876197 and parameters: {'n_estimators': 569, 'max_depth': 44, 'min_samples_split': 4, 'min_samples_leaf': 1, 'max_features': 'sqrt', 'bootstrap': False, 'criterion': 'squared_error'}. Best is trial 341 with value: 0.2909369124469028.
[I 2024-12-04 12:22:45,460] Trial 2154 finished with value: 0.31962728636973553 and parameters: {'n_estimators': 649, 'max_depth': 41, 'min_samples_split': 5, 'min_samples_leaf': 1, 'max_features': 'sqrt', 'bootstrap': False, 'criterion': 'squared_error'}. Best is trial 341 with value: 0.2909369124469028.
[I 2024-12-04 12:22:45,790] Trial 2156 finished with value: 0.3036707594098849 and parameters: {'n_estimators': 533, 'max_depth': 50, 'min_samples_split': 5, 'min_samples_leaf': 1, 'max_features': 'sqrt', 'bootstrap': False, 'criterion': 'squared_error'}. Best is trial 341 with value: 0.2909369124469028.
[I 2024-12-04 12:22:47,866] Trial 2159 finished with value: 0.44035803108154453 and parameters: {'n_estimators': 497, 'max_depth': 50, 'min_samples_split': 3, 'min_samples_leaf': 2, 'max_features': 'sqrt', 'bootstrap': False, 'criterion': 'squared_error'}. Best is trial 341 with value: 0.2909369124469028.
[I 2024-12-04 12:22:47,871] Trial 2157 finished with value: 0.30675744527296855 and parameters: {'n_estimators': 550, 'max_depth': 43, 'min_samples_split': 4, 'min_samples_leaf': 1, 'max_features': 'sqrt', 'bootstrap': False, 'criterion': 'squared_error'}. Best is trial 341 with value: 0.2909369124469028.
[I 2024-12-04 12:22:50,147] Trial 2162 finished with value: 0.2982583407833097 and parameters: {'n_estimators': 455, 'max_depth': 50, 'min_samples_split': 2, 'min_samples_leaf': 1, 'max_features': 'sqrt', 'bootstrap': False, 'criterion': 'squared_error'}. Best is trial 341 with value: 0.2909369124469028.
[I 2024-12-04 12:22:54,300] Trial 2166 finished with value: 0.4412654650236203 and parameters: {'n_estimators': 640, 'max_depth': 50, 'min_samples_split': 3, 'min_samples_leaf': 2, 'max_features': 'sqrt', 'bootstrap': False, 'criterion': 'squared_error'}. Best is trial 341 with value: 0.2909369124469028.
[I 2024-12-04 12:22:54,532] Trial 2161 finished with value: 0.2933630328132548 and parameters: {'n_estimators': 519, 'max_depth': 50, 'min_samples_split': 3, 'min_samples_leaf': 1, 'max_features': 'sqrt', 'bootstrap': False, 'criterion': 'squared_error'}. Best is trial 341 with value: 0.2909369124469028.
[I 2024-12-04 12:22:55,391] Trial 2160 finished with value: 0.29363905075231 and parameters: {'n_estimators': 731, 'max_depth': 50, 'min_samples_split': 3, 'min_samples_leaf': 1, 'max_features': 'sqrt', 'bootstrap': False, 'criterion': 'squared_error'}. Best is trial 341 with value: 0.2909369124469028.
[I 2024-12-04 12:22:57,877] Trial 2168 finished with value: 0.3005919944753592 and parameters: {'n_estimators': 615, 'max_depth': 50, 'min_samples_split': 4, 'min_samples_leaf': 1, 'max_features': 'sqrt', 'bootstrap': False, 'criterion': 'squared_error'}. Best is trial 341 with value: 0.2909369124469028.
[I 2024-12-04 12:22:58,265] Trial 2164 finished with value: 0.2940769877708777 and parameters: {'n_estimators': 567, 'max_depth': 50, 'min_samples_split': 3, 'min_samples_leaf': 1, 'max_features': 'sqrt', 'bootstrap': False, 'criterion': 'squared_error'}. Best is trial 341 with value: 0.2909369124469028.
[I 2024-12-04 12:22:58,390] Trial 2170 finished with value: 0.30315048461620936 and parameters: {'n_estimators': 614, 'max_depth': 45, 'min_samples_split': 2, 'min_samples_leaf': 1, 'max_features': 'sqrt', 'bootstrap': False, 'criterion': 'squared_error'}. Best is trial 341 with value: 0.2909369124469028.
[I 2024-12-04 12:22:59,019] Trial 2172 finished with value: 0.30512166721810924 and parameters: {'n_estimators': 427, 'max_depth': 44, 'min_samples_split': 2, 'min_samples_leaf': 1, 'max_features': 'sqrt', 'bootstrap': False, 'criterion': 'squared_error'}. Best is trial 341 with value: 0.2909369124469028.
[I 2024-12-04 12:23:01,183] Trial 2163 finished with value: 0.8434445677754995 and parameters: {'n_estimators': 160, 'max_depth': 49, 'min_samples_split': 11, 'min_samples_leaf': 15, 'max_features': 'sqrt', 'bootstrap': False, 'criterion': 'squared_error'}. Best is trial 341 with value: 0.2909369124469028.
[I 2024-12-04 12:23:02,069] Trial 2165 finished with value: 0.2985159998280107 and parameters: {'n_estimators': 537, 'max_depth': 45, 'min_samples_split': 3, 'min_samples_leaf': 1, 'max_features': 'sqrt', 'bootstrap': False, 'criterion': 'squared_error'}. Best is trial 341 with value: 0.2909369124469028.
[I 2024-12-04 12:23:03,484] Trial 2175 finished with value: 0.3103100200817394 and parameters: {'n_estimators': 411, 'max_depth': 42, 'min_samples_split': 4, 'min_samples_leaf': 1, 'max_features': 'sqrt', 'bootstrap': False, 'criterion': 'squared_error'}. Best is trial 341 with value: 0.2909369124469028.
[I 2024-12-04 12:23:03,520] Trial 2178 finished with value: 0.31033200188138865 and parameters: {'n_estimators': 558, 'max_depth': 42, 'min_samples_split': 4, 'min_samples_leaf': 1, 'max_features': 'sqrt', 'bootstrap': False, 'criterion': 'squared_error'}. Best is trial 341 with value: 0.2909369124469028.
[I 2024-12-04 12:23:03,522] Trial 2174 finished with value: 0.3054683390230045 and parameters: {'n_estimators': 694, 'max_depth': 50, 'min_samples_split': 5, 'min_samples_leaf': 1, 'max_features': 'sqrt', 'bootstrap': False, 'criterion': 'squared_error'}. Best is trial 341 with value: 0.2909369124469028.
[I 2024-12-04 12:23:04,137] Trial 2179 finished with value: 0.304893366565326 and parameters: {'n_estimators': 500, 'max_depth': 41, 'min_samples_split': 3, 'min_samples_leaf': 1, 'max_features': 'sqrt', 'bootstrap': False, 'criterion': 'squared_error'}. Best is trial 341 with value: 0.2909369124469028.
[I 2024-12-04 12:23:04,217] Trial 2169 finished with value: 0.3872693661407751 and parameters: {'n_estimators': 604, 'max_depth': 40, 'min_samples_split': 5, 'min_samples_leaf': 1, 'max_features': None, 'bootstrap': False, 'criterion': 'squared_error'}. Best is trial 341 with value: 0.2909369124469028.
[I 2024-12-04 12:23:04,394] Trial 2176 finished with value: 0.3858849496216517 and parameters: {'n_estimators': 391, 'max_depth': 47, 'min_samples_split': 5, 'min_samples_leaf': 1, 'max_features': None, 'bootstrap': False, 'criterion': 'squared_error'}. Best is trial 341 with value: 0.2909369124469028.
[I 2024-12-04 12:23:04,868] Trial 2173 finished with value: 0.2941391388468512 and parameters: {'n_estimators': 573, 'max_depth': 50, 'min_samples_split': 3, 'min_samples_leaf': 1, 'max_features': 'sqrt', 'bootstrap': False, 'criterion': 'squared_error'}. Best is trial 341 with value: 0.2909369124469028.
[I 2024-12-04 12:23:05,524] Trial 2180 finished with value: 0.3191589521930716 and parameters: {'n_estimators': 493, 'max_depth': 46, 'min_samples_split': 2, 'min_samples_leaf': 1, 'max_features': 'sqrt', 'bootstrap': True, 'criterion': 'squared_error'}. Best is trial 341 with value: 0.2909369124469028.
[I 2024-12-04 12:23:06,235] Trial 2183 finished with value: 0.38466614470731886 and parameters: {'n_estimators': 740, 'max_depth': 50, 'min_samples_split': 4, 'min_samples_leaf': 1, 'max_features': 'log2', 'bootstrap': False, 'criterion': 'squared_error'}. Best is trial 341 with value: 0.2909369124469028.
[I 2024-12-04 12:23:06,236] Trial 2177 finished with value: 0.4405347848686634 and parameters: {'n_estimators': 575, 'max_depth': 50, 'min_samples_split': 3, 'min_samples_leaf': 2, 'max_features': 'sqrt', 'bootstrap': False, 'criterion': 'squared_error'}. Best is trial 341 with value: 0.2909369124469028.
[I 2024-12-04 12:23:06,308] Trial 2167 finished with value: 0.44310254162630786 and parameters: {'n_estimators': 623, 'max_depth': 42, 'min_samples_split': 5, 'min_samples_leaf': 2, 'max_features': 'sqrt', 'bootstrap': False, 'criterion': 'squared_error'}. Best is trial 341 with value: 0.2909369124469028.
[I 2024-12-04 12:23:06,375] Trial 2182 finished with value: 0.2989906067702387 and parameters: {'n_estimators': 419, 'max_depth': 50, 'min_samples_split': 2, 'min_samples_leaf': 1, 'max_features': 'sqrt', 'bootstrap': False, 'criterion': 'squared_error'}. Best is trial 341 with value: 0.2909369124469028.
[I 2024-12-04 12:23:06,648] Trial 2185 finished with value: 0.5001354472805792 and parameters: {'n_estimators': 722, 'max_depth': 19, 'min_samples_split': 10, 'min_samples_leaf': 1, 'max_features': 'sqrt', 'bootstrap': True, 'criterion': 'squared_error'}. Best is trial 341 with value: 0.2909369124469028.
[I 2024-12-04 12:23:07,700] Trial 2189 finished with value: 0.37717411515987204 and parameters: {'n_estimators': 320, 'max_depth': 37, 'min_samples_split': 9, 'min_samples_leaf': 1, 'max_features': 'sqrt', 'bootstrap': True, 'criterion': 'squared_error'}. Best is trial 341 with value: 0.2909369124469028.
[I 2024-12-04 12:23:08,445] Trial 2184 finished with value: 0.8033890495941617 and parameters: {'n_estimators': 431, 'max_depth': 9, 'min_samples_split': 6, 'min_samples_leaf': 1, 'max_features': 'log2', 'bootstrap': True, 'criterion': 'squared_error'}. Best is trial 341 with value: 0.2909369124469028.
[I 2024-12-04 12:23:10,211] Trial 2181 finished with value: 0.3088986822823561 and parameters: {'n_estimators': 687, 'max_depth': 40, 'min_samples_split': 3, 'min_samples_leaf': 1, 'max_features': 'sqrt', 'bootstrap': False, 'criterion': 'squared_error'}. Best is trial 341 with value: 0.2909369124469028.
[I 2024-12-04 12:23:11,277] Trial 2191 finished with value: 0.44685139496656334 and parameters: {'n_estimators': 323, 'max_depth': 40, 'min_samples_split': 5, 'min_samples_leaf': 1, 'max_features': 'log2', 'bootstrap': False, 'criterion': 'squared_error'}. Best is trial 341 with value: 0.2909369124469028.
[I 2024-12-04 12:23:11,326] Trial 2187 finished with value: 0.30990579886828556 and parameters: {'n_estimators': 745, 'max_depth': 42, 'min_samples_split': 2, 'min_samples_leaf': 1, 'max_features': 'sqrt', 'bootstrap': False, 'criterion': 'squared_error'}. Best is trial 341 with value: 0.2909369124469028.
[I 2024-12-04 12:23:11,332] Trial 2190 finished with value: 0.30004217212068734 and parameters: {'n_estimators': 383, 'max_depth': 50, 'min_samples_split': 4, 'min_samples_leaf': 1, 'max_features': 'sqrt', 'bootstrap': False, 'criterion': 'squared_error'}. Best is trial 341 with value: 0.2909369124469028.
[I 2024-12-04 12:23:12,217] Trial 2192 finished with value: 0.31564268664688877 and parameters: {'n_estimators': 369, 'max_depth': 37, 'min_samples_split': 3, 'min_samples_leaf': 1, 'max_features': 'sqrt', 'bootstrap': False, 'criterion': 'squared_error'}. Best is trial 341 with value: 0.2909369124469028.
[I 2024-12-04 12:23:17,101] Trial 2195 finished with value: 0.44534252514045675 and parameters: {'n_estimators': 455, 'max_depth': 40, 'min_samples_split': 3, 'min_samples_leaf': 2, 'max_features': 'sqrt', 'bootstrap': False, 'criterion': 'squared_error'}. Best is trial 341 with value: 0.2909369124469028.
[I 2024-12-04 12:23:20,003] Trial 2199 finished with value: 0.306888552409571 and parameters: {'n_estimators': 457, 'max_depth': 44, 'min_samples_split': 4, 'min_samples_leaf': 1, 'max_features': 'sqrt', 'bootstrap': False, 'criterion': 'squared_error'}. Best is trial 341 with value: 0.2909369124469028.
[I 2024-12-04 12:23:21,284] Trial 2210 finished with value: 0.44120949849598967 and parameters: {'n_estimators': 366, 'max_depth': 50, 'min_samples_split': 2, 'min_samples_leaf': 2, 'max_features': 'sqrt', 'bootstrap': False, 'criterion': 'squared_error'}. Best is trial 341 with value: 0.2909369124469028.
[I 2024-12-04 12:23:22,241] Trial 2194 finished with value: 0.30048758711583695 and parameters: {'n_estimators': 638, 'max_depth': 44, 'min_samples_split': 3, 'min_samples_leaf': 1, 'max_features': 'sqrt', 'bootstrap': False, 'criterion': 'squared_error'}. Best is trial 341 with value: 0.2909369124469028.
[I 2024-12-04 12:23:22,249] Trial 2197 finished with value: 0.30989349011230266 and parameters: {'n_estimators': 535, 'max_depth': 42, 'min_samples_split': 2, 'min_samples_leaf': 1, 'max_features': 'sqrt', 'bootstrap': False, 'criterion': 'squared_error'}. Best is trial 341 with value: 0.2909369124469028.
[I 2024-12-04 12:23:24,970] Trial 2204 finished with value: 0.30275928121963036 and parameters: {'n_estimators': 340, 'max_depth': 42, 'min_samples_split': 3, 'min_samples_leaf': 1, 'max_features': 'sqrt', 'bootstrap': False, 'criterion': 'squared_error'}. Best is trial 341 with value: 0.2909369124469028.
[I 2024-12-04 12:23:26,475] Trial 2201 finished with value: 0.442352302680866 and parameters: {'n_estimators': 368, 'max_depth': 44, 'min_samples_split': 5, 'min_samples_leaf': 2, 'max_features': 'sqrt', 'bootstrap': False, 'criterion': 'squared_error'}. Best is trial 341 with value: 0.2909369124469028.
[I 2024-12-04 12:23:27,721] Trial 2193 finished with value: 0.2984796853506347 and parameters: {'n_estimators': 559, 'max_depth': 50, 'min_samples_split': 2, 'min_samples_leaf': 1, 'max_features': 'sqrt', 'bootstrap': False, 'criterion': 'squared_error'}. Best is trial 341 with value: 0.2909369124469028.
[I 2024-12-04 12:23:29,887] Trial 2209 finished with value: 0.44215677439275863 and parameters: {'n_estimators': 421, 'max_depth': 43, 'min_samples_split': 6, 'min_samples_leaf': 2, 'max_features': 'sqrt', 'bootstrap': False, 'criterion': 'squared_error'}. Best is trial 341 with value: 0.2909369124469028.
[I 2024-12-04 12:23:31,708] Trial 2200 finished with value: 0.44066783966058126 and parameters: {'n_estimators': 630, 'max_depth': 50, 'min_samples_split': 2, 'min_samples_leaf': 2, 'max_features': 'sqrt', 'bootstrap': False, 'criterion': 'squared_error'}. Best is trial 341 with value: 0.2909369124469028.
[I 2024-12-04 12:23:32,054] Trial 2213 finished with value: 0.30655793120924896 and parameters: {'n_estimators': 333, 'max_depth': 44, 'min_samples_split': 4, 'min_samples_leaf': 1, 'max_features': 'sqrt', 'bootstrap': False, 'criterion': 'squared_error'}. Best is trial 341 with value: 0.2909369124469028.
[I 2024-12-04 12:23:32,063] Trial 2208 finished with value: 0.30406481845624544 and parameters: {'n_estimators': 427, 'max_depth': 50, 'min_samples_split': 5, 'min_samples_leaf': 1, 'max_features': 'sqrt', 'bootstrap': False, 'criterion': 'squared_error'}. Best is trial 341 with value: 0.2909369124469028.
[I 2024-12-04 12:23:33,475] Trial 2218 finished with value: 0.44424064456491297 and parameters: {'n_estimators': 339, 'max_depth': 44, 'min_samples_split': 3, 'min_samples_leaf': 2, 'max_features': 'sqrt', 'bootstrap': False, 'criterion': 'squared_error'}. Best is trial 341 with value: 0.2909369124469028.
[I 2024-12-04 12:23:33,561] Trial 2205 finished with value: 0.3015531114205945 and parameters: {'n_estimators': 341, 'max_depth': 43, 'min_samples_split': 3, 'min_samples_leaf': 1, 'max_features': 'sqrt', 'bootstrap': False, 'criterion': 'squared_error'}. Best is trial 341 with value: 0.2909369124469028.
[I 2024-12-04 12:23:33,561] Trial 2186 finished with value: 0.43410350324399527 and parameters: {'n_estimators': 128, 'max_depth': 21, 'min_samples_split': 2, 'min_samples_leaf': 1, 'max_features': None, 'bootstrap': False, 'criterion': 'absolute_error'}. Best is trial 341 with value: 0.2909369124469028.
[I 2024-12-04 12:23:33,661] Trial 2207 finished with value: 0.3000962319682328 and parameters: {'n_estimators': 499, 'max_depth': 50, 'min_samples_split': 4, 'min_samples_leaf': 1, 'max_features': 'sqrt', 'bootstrap': False, 'criterion': 'squared_error'}. Best is trial 341 with value: 0.2909369124469028.
[I 2024-12-04 12:23:35,433] Trial 2202 finished with value: 0.29846545949923114 and parameters: {'n_estimators': 443, 'max_depth': 50, 'min_samples_split': 2, 'min_samples_leaf': 1, 'max_features': 'sqrt', 'bootstrap': False, 'criterion': 'squared_error'}. Best is trial 341 with value: 0.2909369124469028.
[I 2024-12-04 12:23:35,804] Trial 2215 finished with value: 0.4790577370562628 and parameters: {'n_estimators': 386, 'max_depth': 41, 'min_samples_split': 4, 'min_samples_leaf': 2, 'max_features': 'sqrt', 'bootstrap': True, 'criterion': 'squared_error'}. Best is trial 341 with value: 0.2909369124469028.
[I 2024-12-04 12:23:35,947] Trial 2203 finished with value: 0.9561661510577436 and parameters: {'n_estimators': 632, 'max_depth': 20, 'min_samples_split': 2, 'min_samples_leaf': 8, 'max_features': 'log2', 'bootstrap': True, 'criterion': 'absolute_error'}. Best is trial 341 with value: 0.2909369124469028.
[I 2024-12-04 12:23:36,133] Trial 2211 finished with value: 0.30068333403215 and parameters: {'n_estimators': 604, 'max_depth': 50, 'min_samples_split': 4, 'min_samples_leaf': 1, 'max_features': 'sqrt', 'bootstrap': False, 'criterion': 'squared_error'}. Best is trial 341 with value: 0.2909369124469028.
[I 2024-12-04 12:23:39,415] Trial 2216 finished with value: 0.3737073350079008 and parameters: {'n_estimators': 531, 'max_depth': 29, 'min_samples_split': 5, 'min_samples_leaf': 1, 'max_features': 'sqrt', 'bootstrap': False, 'criterion': 'squared_error'}. Best is trial 341 with value: 0.2909369124469028.
[I 2024-12-04 12:23:40,292] Trial 2221 finished with value: 0.30729130893265016 and parameters: {'n_estimators': 243, 'max_depth': 44, 'min_samples_split': 4, 'min_samples_leaf': 1, 'max_features': 'sqrt', 'bootstrap': False, 'criterion': 'squared_error'}. Best is trial 341 with value: 0.2909369124469028.
[I 2024-12-04 12:23:41,904] Trial 2171 finished with value: 0.45393649884992093 and parameters: {'n_estimators': 601, 'max_depth': 48, 'min_samples_split': 38, 'min_samples_leaf': 7, 'max_features': None, 'bootstrap': False, 'criterion': 'absolute_error'}. Best is trial 341 with value: 0.2909369124469028.
[I 2024-12-04 12:23:42,444] Trial 2225 finished with value: 0.9702968248323387 and parameters: {'n_estimators': 215, 'max_depth': 8, 'min_samples_split': 11, 'min_samples_leaf': 13, 'max_features': 'log2', 'bootstrap': True, 'criterion': 'absolute_error'}. Best is trial 341 with value: 0.2909369124469028.
