[I 2024-12-04 12:08:38,489] Trial 2465 finished with value: 0.5718668665680694 and parameters: {'max_depth': 32, 'min_samples_split': 20, 'min_samples_leaf': 1, 'max_features': 'sqrt', 'criterion': 'friedman_mse', 'splitter': 'best'}. Best is trial 245 with value: 0.5517975516810654.
[I 2024-12-04 12:08:38,796] Trial 2462 finished with value: 0.8137103604192361 and parameters: {'max_depth': 30, 'min_samples_split': 19, 'min_samples_leaf': 1, 'max_features': 'log2', 'criterion': 'absolute_error', 'splitter': 'best'}. Best is trial 245 with value: 0.5517975516810654.
[I 2024-12-04 12:08:38,828] Trial 2469 finished with value: 1.2387090204317202 and parameters: {'max_depth': 29, 'min_samples_split': 17, 'min_samples_leaf': 3, 'max_features': 'sqrt', 'criterion': 'friedman_mse', 'splitter': 'random'}. Best is trial 245 with value: 0.5517975516810654.
[I 2024-12-04 12:08:39,333] Trial 2482 finished with value: 0.6366870857247696 and parameters: {'max_depth': 30, 'min_samples_split': 17, 'min_samples_leaf': 2, 'max_features': 'sqrt', 'criterion': 'friedman_mse', 'splitter': 'best'}. Best is trial 245 with value: 0.5517975516810654.
[I 2024-12-04 12:08:40,002] Trial 2478 finished with value: 0.7713529562206075 and parameters: {'max_depth': 29, 'min_samples_split': 20, 'min_samples_leaf': 1, 'max_features': 'log2', 'criterion': 'friedman_mse', 'splitter': 'best'}. Best is trial 245 with value: 0.5517975516810654.
[I 2024-12-04 12:08:40,185] Trial 2475 finished with value: 1.0746652081803512 and parameters: {'max_depth': 30, 'min_samples_split': 17, 'min_samples_leaf': 3, 'max_features': 'sqrt', 'criterion': 'friedman_mse', 'splitter': 'best'}. Best is trial 245 with value: 0.5517975516810654.
[I 2024-12-04 12:08:40,294] Trial 2443 finished with value: 0.5782048303592521 and parameters: {'max_depth': 22, 'min_samples_split': 18, 'min_samples_leaf': 1, 'max_features': 'sqrt', 'criterion': 'friedman_mse', 'splitter': 'best'}. Best is trial 245 with value: 0.5517975516810654.
[I 2024-12-04 12:08:40,429] Trial 2467 finished with value: 0.5718668665680694 and parameters: {'max_depth': 32, 'min_samples_split': 20, 'min_samples_leaf': 1, 'max_features': 'sqrt', 'criterion': 'friedman_mse', 'splitter': 'best'}. Best is trial 245 with value: 0.5517975516810654.
[I 2024-12-04 12:08:40,741] Trial 2476 finished with value: 0.5930831005428419 and parameters: {'max_depth': 31, 'min_samples_split': 17, 'min_samples_leaf': 1, 'max_features': 'sqrt', 'criterion': 'friedman_mse', 'splitter': 'best'}. Best is trial 245 with value: 0.5517975516810654.
[I 2024-12-04 12:08:40,748] Trial 2474 finished with value: 1.261454797635251 and parameters: {'max_depth': 26, 'min_samples_split': 15, 'min_samples_leaf': 6, 'max_features': 'log2', 'criterion': 'squared_error', 'splitter': 'best'}. Best is trial 245 with value: 0.5517975516810654.
[I 2024-12-04 12:08:40,938] Trial 2461 finished with value: 0.5517975516810654 and parameters: {'max_depth': 29, 'min_samples_split': 17, 'min_samples_leaf': 1, 'max_features': 'sqrt', 'criterion': 'friedman_mse', 'splitter': 'best'}. Best is trial 245 with value: 0.5517975516810654.
[I 2024-12-04 12:08:41,521] Trial 2473 finished with value: 1.2075570925325374 and parameters: {'max_depth': 16, 'min_samples_split': 6, 'min_samples_leaf': 1, 'max_features': 'sqrt', 'criterion': 'absolute_error', 'splitter': 'random'}. Best is trial 245 with value: 0.5517975516810654.
[I 2024-12-04 12:08:41,527] Trial 2472 finished with value: 0.5856844165343162 and parameters: {'max_depth': 28, 'min_samples_split': 18, 'min_samples_leaf': 1, 'max_features': 'sqrt', 'criterion': 'friedman_mse', 'splitter': 'best'}. Best is trial 245 with value: 0.5517975516810654.
[I 2024-12-04 12:08:41,530] Trial 2468 finished with value: 1.0746652081803512 and parameters: {'max_depth': 35, 'min_samples_split': 20, 'min_samples_leaf': 3, 'max_features': 'sqrt', 'criterion': 'friedman_mse', 'splitter': 'best'}. Best is trial 245 with value: 0.5517975516810654.
[I 2024-12-04 12:08:41,541] Trial 2477 finished with value: 0.592449262341927 and parameters: {'max_depth': 25, 'min_samples_split': 18, 'min_samples_leaf': 2, 'max_features': 'sqrt', 'criterion': 'friedman_mse', 'splitter': 'best'}. Best is trial 245 with value: 0.5517975516810654.
[I 2024-12-04 12:08:41,630] Trial 2471 finished with value: 1.0746652081803512 and parameters: {'max_depth': 25, 'min_samples_split': 17, 'min_samples_leaf': 3, 'max_features': 'sqrt', 'criterion': 'friedman_mse', 'splitter': 'best'}. Best is trial 245 with value: 0.5517975516810654.
[I 2024-12-04 12:08:41,980] Trial 2464 finished with value: 0.5957889156966119 and parameters: {'max_depth': 26, 'min_samples_split': 17, 'min_samples_leaf': 1, 'max_features': 'sqrt', 'criterion': 'friedman_mse', 'splitter': 'best'}. Best is trial 245 with value: 0.5517975516810654.
[I 2024-12-04 12:08:42,222] Trial 2483 finished with value: 0.5693224466498369 and parameters: {'max_depth': 22, 'min_samples_split': 17, 'min_samples_leaf': 1, 'max_features': 'sqrt', 'criterion': 'friedman_mse', 'splitter': 'best'}. Best is trial 245 with value: 0.5517975516810654.
[I 2024-12-04 12:08:42,740] Trial 2480 finished with value: 0.5963013888683532 and parameters: {'max_depth': 25, 'min_samples_split': 16, 'min_samples_leaf': 1, 'max_features': 'sqrt', 'criterion': 'friedman_mse', 'splitter': 'best'}. Best is trial 245 with value: 0.5517975516810654.
[I 2024-12-04 12:08:43,070] Trial 2486 finished with value: 0.5661894660889475 and parameters: {'max_depth': 30, 'min_samples_split': 18, 'min_samples_leaf': 1, 'max_features': 'sqrt', 'criterion': 'friedman_mse', 'splitter': 'best'}. Best is trial 245 with value: 0.5517975516810654.
[I 2024-12-04 12:08:43,462] Trial 2484 finished with value: 1.0149717747674767 and parameters: {'max_depth': 28, 'min_samples_split': 17, 'min_samples_leaf': 1, 'max_features': 'sqrt', 'criterion': 'absolute_error', 'splitter': 'best'}. Best is trial 245 with value: 0.5517975516810654.
[I 2024-12-04 12:08:43,467] Trial 2481 finished with value: 0.6366870857247696 and parameters: {'max_depth': 26, 'min_samples_split': 17, 'min_samples_leaf': 2, 'max_features': 'sqrt', 'criterion': 'friedman_mse', 'splitter': 'best'}. Best is trial 245 with value: 0.5517975516810654.
[I 2024-12-04 12:08:43,746] Trial 2479 finished with value: 0.6076714769073656 and parameters: {'max_depth': 28, 'min_samples_split': 16, 'min_samples_leaf': 1, 'max_features': 'sqrt', 'criterion': 'friedman_mse', 'splitter': 'best'}. Best is trial 245 with value: 0.5517975516810654.
[I 2024-12-04 12:08:43,896] Trial 2485 finished with value: 0.5517975516810654 and parameters: {'max_depth': 29, 'min_samples_split': 17, 'min_samples_leaf': 1, 'max_features': 'sqrt', 'criterion': 'friedman_mse', 'splitter': 'best'}. Best is trial 245 with value: 0.5517975516810654.
[I 2024-12-04 12:08:45,643] Trial 2493 finished with value: 0.5517975516810654 and parameters: {'max_depth': 29, 'min_samples_split': 17, 'min_samples_leaf': 1, 'max_features': 'sqrt', 'criterion': 'friedman_mse', 'splitter': 'best'}. Best is trial 245 with value: 0.5517975516810654.
[I 2024-12-04 12:08:45,858] Trial 2490 finished with value: 0.5854261816964598 and parameters: {'max_depth': 28, 'min_samples_split': 20, 'min_samples_leaf': 1, 'max_features': 'sqrt', 'criterion': 'friedman_mse', 'splitter': 'best'}. Best is trial 245 with value: 0.5517975516810654.
[I 2024-12-04 12:08:46,021] Trial 2498 finished with value: 0.5801717998172633 and parameters: {'max_depth': 28, 'min_samples_split': 17, 'min_samples_leaf': 1, 'max_features': 'sqrt', 'criterion': 'friedman_mse', 'splitter': 'best'}. Best is trial 245 with value: 0.5517975516810654.
[I 2024-12-04 12:08:46,111] Trial 2487 finished with value: 0.8068014725998758 and parameters: {'max_depth': 22, 'min_samples_split': 17, 'min_samples_leaf': 1, 'max_features': 'log2', 'criterion': 'friedman_mse', 'splitter': 'best'}. Best is trial 245 with value: 0.5517975516810654.
[I 2024-12-04 12:08:46,421] Trial 2491 finished with value: 0.6004802931373475 and parameters: {'max_depth': 29, 'min_samples_split': 16, 'min_samples_leaf': 1, 'max_features': 'sqrt', 'criterion': 'friedman_mse', 'splitter': 'best'}. Best is trial 245 with value: 0.5517975516810654.
[I 2024-12-04 12:08:46,459] Trial 2488 finished with value: 1.0746652081803512 and parameters: {'max_depth': 28, 'min_samples_split': 16, 'min_samples_leaf': 3, 'max_features': 'sqrt', 'criterion': 'friedman_mse', 'splitter': 'best'}. Best is trial 245 with value: 0.5517975516810654.
[I 2024-12-04 12:08:46,548] Trial 2495 finished with value: 0.5718668665680694 and parameters: {'max_depth': 32, 'min_samples_split': 18, 'min_samples_leaf': 1, 'max_features': 'sqrt', 'criterion': 'friedman_mse', 'splitter': 'best'}. Best is trial 245 with value: 0.5517975516810654.
[I 2024-12-04 12:08:46,625] Trial 2492 finished with value: 0.6366870857247696 and parameters: {'max_depth': 29, 'min_samples_split': 17, 'min_samples_leaf': 2, 'max_features': 'sqrt', 'criterion': 'friedman_mse', 'splitter': 'best'}. Best is trial 245 with value: 0.5517975516810654.
[I 2024-12-04 12:08:46,744] Trial 2494 finished with value: 0.5945975836542683 and parameters: {'max_depth': 32, 'min_samples_split': 18, 'min_samples_leaf': 2, 'max_features': 'sqrt', 'criterion': 'friedman_mse', 'splitter': 'best'}. Best is trial 245 with value: 0.5517975516810654.
[I 2024-12-04 12:08:46,844] Trial 2497 finished with value: 0.5619342153963266 and parameters: {'max_depth': 32, 'min_samples_split': 17, 'min_samples_leaf': 1, 'max_features': 'sqrt', 'criterion': 'friedman_mse', 'splitter': 'best'}. Best is trial 245 with value: 0.5517975516810654.
[I 2024-12-04 12:08:46,955] Trial 2489 finished with value: 0.5951824649333685 and parameters: {'max_depth': 30, 'min_samples_split': 17, 'min_samples_leaf': 1, 'max_features': 'sqrt', 'criterion': 'friedman_mse', 'splitter': 'best'}. Best is trial 245 with value: 0.5517975516810654.
[I 2024-12-04 12:08:47,054] Trial 2496 finished with value: 0.9424778759919019 and parameters: {'max_depth': 31, 'min_samples_split': 19, 'min_samples_leaf': 3, 'max_features': 'log2', 'criterion': 'friedman_mse', 'splitter': 'best'}. Best is trial 245 with value: 0.5517975516810654.
[I 2024-12-04 12:08:47,141] Trial 2499 finished with value: 1.0874428099108078 and parameters: {'max_depth': 14, 'min_samples_split': 16, 'min_samples_leaf': 10, 'max_features': 'sqrt', 'criterion': 'squared_error', 'splitter': 'best'}. Best is trial 245 with value: 0.5517975516810654.
