[I 2024-12-03 18:44:32,913] Trial 923 finished with value: 0.5818130973946628 and parameters: {'kernel': 'linear', 'C': 0.577451736003023, 'gamma': 0.0005509088836084094, 'epsilon': 0.0015432206512079024}. Best is trial 482 with value: 0.4491649651596098.
[I 2024-12-03 18:44:33,216] Trial 907 finished with value: 0.4643683876261911 and parameters: {'kernel': 'rbf', 'C': 95.56626446935287, 'gamma': 0.018369272802032266, 'epsilon': 0.012356410034978784}. Best is trial 482 with value: 0.4491649651596098.
[I 2024-12-03 18:44:34,251] Trial 930 finished with value: 0.553844476381614 and parameters: {'kernel': 'rbf', 'C': 96.91540020027915, 'gamma': 0.00485971978984902, 'epsilon': 0.23476003161793926}. Best is trial 482 with value: 0.4491649651596098.
[I 2024-12-03 18:44:34,309] Trial 933 finished with value: 0.6733297173819216 and parameters: {'kernel': 'rbf', 'C': 70.80438257052724, 'gamma': 0.3701119927800151, 'epsilon': 0.10356752210825135}. Best is trial 482 with value: 0.4491649651596098.
[I 2024-12-03 18:44:34,440] Trial 926 finished with value: 0.5431558109723162 and parameters: {'kernel': 'rbf', 'C': 19.012909021854746, 'gamma': 0.007921576757407983, 'epsilon': 0.03859793023296226}. Best is trial 482 with value: 0.4491649651596098.
[I 2024-12-03 18:44:34,452] Trial 929 finished with value: 0.6420103681042991 and parameters: {'kernel': 'rbf', 'C': 84.46059105468456, 'gamma': 0.0780246500367763, 'epsilon': 0.02621667219667216}. Best is trial 482 with value: 0.4491649651596098.
[I 2024-12-03 18:44:34,553] Trial 934 finished with value: 0.5916373278776068 and parameters: {'kernel': 'rbf', 'C': 94.24833889435551, 'gamma': 0.1077858076487407, 'epsilon': 0.17842249934808355}. Best is trial 482 with value: 0.4491649651596098.
[I 2024-12-03 18:44:34,594] Trial 941 finished with value: 0.47927193946870944 and parameters: {'kernel': 'rbf', 'C': 95.39824676513763, 'gamma': 0.016601550135989466, 'epsilon': 0.13200149246657697}. Best is trial 482 with value: 0.4491649651596098.
[I 2024-12-03 18:44:34,600] Trial 927 finished with value: 0.5778064262831235 and parameters: {'kernel': 'rbf', 'C': 22.531469027494527, 'gamma': 0.0768954699789831, 'epsilon': 0.02905379044847253}. Best is trial 482 with value: 0.4491649651596098.
[I 2024-12-03 18:44:34,741] Trial 932 finished with value: 0.45590434189882634 and parameters: {'kernel': 'rbf', 'C': 82.157136677975, 'gamma': 0.013997284445278315, 'epsilon': 0.04092682993666361}. Best is trial 482 with value: 0.4491649651596098.
[I 2024-12-03 18:44:34,753] Trial 919 finished with value: 0.4684563848064208 and parameters: {'kernel': 'rbf', 'C': 91.99822757300652, 'gamma': 0.021163798439814863, 'epsilon': 0.06890592270162796}. Best is trial 482 with value: 0.4491649651596098.
[I 2024-12-03 18:44:35,091] Trial 937 finished with value: 0.48890716138953944 and parameters: {'kernel': 'rbf', 'C': 23.455383505537363, 'gamma': 0.014798979435436732, 'epsilon': 0.03376781275345312}. Best is trial 482 with value: 0.4491649651596098.
[I 2024-12-03 18:44:35,219] Trial 943 finished with value: 0.9919054095513387 and parameters: {'kernel': 'rbf', 'C': 0.112183520840731, 'gamma': 0.05129096906055316, 'epsilon': 0.4027894631345614}. Best is trial 482 with value: 0.4491649651596098.
[I 2024-12-03 18:44:35,234] Trial 928 finished with value: 0.5730809320219302 and parameters: {'kernel': 'linear', 'C': 94.99492969340082, 'gamma': 0.01754286262723769, 'epsilon': 0.09268444917948696}. Best is trial 482 with value: 0.4491649651596098.
[I 2024-12-03 18:44:35,617] Trial 925 finished with value: 0.9466755488624847 and parameters: {'kernel': 'poly', 'C': 13.39577419925227, 'gamma': 0.013880938864308875, 'epsilon': 0.07162404557065966}. Best is trial 482 with value: 0.4491649651596098.
[I 2024-12-03 18:44:35,737] Trial 924 finished with value: 0.635887795379789 and parameters: {'kernel': 'rbf', 'C': 96.94001458037667, 'gamma': 0.052120581657576666, 'epsilon': 0.05310196547220108}. Best is trial 482 with value: 0.4491649651596098.
[I 2024-12-03 18:44:36,107] Trial 939 finished with value: 0.4999662491372697 and parameters: {'kernel': 'rbf', 'C': 14.91983563949283, 'gamma': 0.020311972730145702, 'epsilon': 0.2250971990349201}. Best is trial 482 with value: 0.4491649651596098.
[I 2024-12-03 18:44:36,118] Trial 936 finished with value: 0.6515988185033297 and parameters: {'kernel': 'rbf', 'C': 13.938903956632666, 'gamma': 0.002831462962817266, 'epsilon': 0.013660647576457914}. Best is trial 482 with value: 0.4491649651596098.
[I 2024-12-03 18:44:36,304] Trial 935 finished with value: 0.518002852989606 and parameters: {'kernel': 'rbf', 'C': 18.6320340976379, 'gamma': 0.012910099699815188, 'epsilon': 0.11285670777312277}. Best is trial 482 with value: 0.4491649651596098.
[I 2024-12-03 18:44:36,532] Trial 942 finished with value: 0.5947342591495973 and parameters: {'kernel': 'rbf', 'C': 92.31456881658357, 'gamma': 0.04390979981596276, 'epsilon': 0.035125377616219915}. Best is trial 482 with value: 0.4491649651596098.
[I 2024-12-03 18:44:37,121] Trial 938 finished with value: 0.4700727348486647 and parameters: {'kernel': 'rbf', 'C': 98.33975335881883, 'gamma': 0.008129168491919999, 'epsilon': 0.09401745346312747}. Best is trial 482 with value: 0.4491649651596098.
[I 2024-12-03 18:44:37,153] Trial 944 finished with value: 0.583694011968824 and parameters: {'kernel': 'rbf', 'C': 80.87727091453388, 'gamma': 0.0014449119829585575, 'epsilon': 0.03998424926713664}. Best is trial 482 with value: 0.4491649651596098.
[I 2024-12-03 18:44:37,272] Trial 940 finished with value: 68.64416111112136 and parameters: {'kernel': 'sigmoid', 'C': 79.9361505432205, 'gamma': 0.00793591836762304, 'epsilon': 0.0542473754478632}. Best is trial 482 with value: 0.4491649651596098.
[I 2024-12-03 18:44:39,208] Trial 949 finished with value: 1.3735381936768272 and parameters: {'kernel': 'rbf', 'C': 0.0012608429941916779, 'gamma': 0.00012399019482062915, 'epsilon': 0.002611383176668405}. Best is trial 482 with value: 0.4491649651596098.
[I 2024-12-03 18:44:39,557] Trial 945 finished with value: 0.4774722933179031 and parameters: {'kernel': 'rbf', 'C': 18.77942169524145, 'gamma': 0.03768598189515037, 'epsilon': 0.04958738734620428}. Best is trial 482 with value: 0.4491649651596098.
[I 2024-12-03 18:44:39,671] Trial 947 finished with value: 0.5029128844697506 and parameters: {'kernel': 'rbf', 'C': 20.665652493251166, 'gamma': 0.013694063649391682, 'epsilon': 0.07930701981858035}. Best is trial 482 with value: 0.4491649651596098.
[I 2024-12-03 18:44:39,675] Trial 948 finished with value: 0.9964319146424299 and parameters: {'kernel': 'poly', 'C': 0.46702574671636904, 'gamma': 0.03171298031145414, 'epsilon': 0.05622171291824017}. Best is trial 482 with value: 0.4491649651596098.
[I 2024-12-03 18:44:40,162] Trial 956 finished with value: 0.4670148105255198 and parameters: {'kernel': 'rbf', 'C': 81.80964240834878, 'gamma': 0.010451116126733563, 'epsilon': 0.035997007515603856}. Best is trial 482 with value: 0.4491649651596098.
[I 2024-12-03 18:44:41,435] Trial 946 finished with value: 0.6599304299149197 and parameters: {'kernel': 'rbf', 'C': 17.554318049967634, 'gamma': 0.0020661507632880223, 'epsilon': 0.05305368201831033}. Best is trial 482 with value: 0.4491649651596098.
[I 2024-12-03 18:44:41,675] Trial 963 finished with value: 0.5378411676580507 and parameters: {'kernel': 'rbf', 'C': 92.97822788318479, 'gamma': 0.0032639138884986243, 'epsilon': 0.032932109722180816}. Best is trial 482 with value: 0.4491649651596098.
[I 2024-12-03 18:44:42,001] Trial 955 finished with value: 0.46089492095478524 and parameters: {'kernel': 'rbf', 'C': 97.83698314542552, 'gamma': 0.01140753254461315, 'epsilon': 0.02552580938188578}. Best is trial 482 with value: 0.4491649651596098.
[I 2024-12-03 18:44:42,007] Trial 954 finished with value: 0.45897834557990574 and parameters: {'kernel': 'rbf', 'C': 89.30753025950057, 'gamma': 0.011134172505106786, 'epsilon': 0.052455824995878884}. Best is trial 482 with value: 0.4491649651596098.
[I 2024-12-03 18:44:42,338] Trial 950 finished with value: 0.5242054137917781 and parameters: {'kernel': 'rbf', 'C': 93.54420765416937, 'gamma': 0.023313721904069395, 'epsilon': 0.13270783022204097}. Best is trial 482 with value: 0.4491649651596098.
[I 2024-12-03 18:44:42,493] Trial 931 finished with value: 0.46438707573780985 and parameters: {'kernel': 'rbf', 'C': 94.29708163041948, 'gamma': 0.010418134214094163, 'epsilon': 0.032192034691983736}. Best is trial 482 with value: 0.4491649651596098.
[I 2024-12-03 18:44:42,721] Trial 953 finished with value: 0.5317331929409868 and parameters: {'kernel': 'rbf', 'C': 24.0453187042207, 'gamma': 0.00904346806711946, 'epsilon': 0.10892350691528994}. Best is trial 482 with value: 0.4491649651596098.
[I 2024-12-03 18:44:43,023] Trial 957 finished with value: 0.6305902902194147 and parameters: {'kernel': 'rbf', 'C': 12.02777375528684, 'gamma': 0.003831286406490753, 'epsilon': 0.05067907066007123}. Best is trial 482 with value: 0.4491649651596098.
[I 2024-12-03 18:44:43,918] Trial 962 finished with value: 0.5786224829720057 and parameters: {'kernel': 'rbf', 'C': 18.66197494017932, 'gamma': 0.004174712581229601, 'epsilon': 0.12700263739478276}. Best is trial 482 with value: 0.4491649651596098.
[I 2024-12-03 18:44:44,227] Trial 960 finished with value: 0.5734824015054377 and parameters: {'kernel': 'rbf', 'C': 98.81274550148255, 'gamma': 0.03814522953302254, 'epsilon': 0.052454426941297094}. Best is trial 482 with value: 0.4491649651596098.
[I 2024-12-03 18:44:44,747] Trial 958 finished with value: 1.1521212789454338 and parameters: {'kernel': 'sigmoid', 'C': 0.08804197574763858, 'gamma': 0.04620574723478556, 'epsilon': 0.13012385819558317}. Best is trial 482 with value: 0.4491649651596098.
[I 2024-12-03 18:44:45,140] Trial 968 finished with value: 0.4739853763894868 and parameters: {'kernel': 'rbf', 'C': 96.94724651694864, 'gamma': 0.008116645737272103, 'epsilon': 0.042133203824354114}. Best is trial 482 with value: 0.4491649651596098.
[I 2024-12-03 18:44:45,650] Trial 951 finished with value: 0.8644335662749236 and parameters: {'kernel': 'linear', 'C': 0.0023210301185850354, 'gamma': 0.0032727784004681596, 'epsilon': 0.0036619029753320468}. Best is trial 482 with value: 0.4491649651596098.
[I 2024-12-03 18:44:45,660] Trial 952 finished with value: 0.5123788167220373 and parameters: {'kernel': 'rbf', 'C': 82.2708576071019, 'gamma': 0.02193718253456465, 'epsilon': 0.1579931564741064}. Best is trial 482 with value: 0.4491649651596098.
[I 2024-12-03 18:44:46,020] Trial 965 finished with value: 0.482285041407985 and parameters: {'kernel': 'rbf', 'C': 20.42987908602761, 'gamma': 0.01787731158641219, 'epsilon': 0.07822796578671522}. Best is trial 482 with value: 0.4491649651596098.
[I 2024-12-03 18:44:46,206] Trial 959 finished with value: 1.369697918660562 and parameters: {'kernel': 'sigmoid', 'C': 0.0010306090125370905, 'gamma': 0.005434953157285997, 'epsilon': 0.0014359351275617367}. Best is trial 482 with value: 0.4491649651596098.
[I 2024-12-03 18:44:46,496] Trial 967 finished with value: 0.5530680281941796 and parameters: {'kernel': 'rbf', 'C': 19.69529833710003, 'gamma': 0.06901822986287336, 'epsilon': 0.09018532076324988}. Best is trial 482 with value: 0.4491649651596098.
[I 2024-12-03 18:44:46,545] Trial 964 finished with value: 1.1043739714197243 and parameters: {'kernel': 'poly', 'C': 0.33932060884364607, 'gamma': 0.005478165437458637, 'epsilon': 0.16703581802201897}. Best is trial 482 with value: 0.4491649651596098.
[I 2024-12-03 18:44:46,676] Trial 961 finished with value: 0.5301776923856626 and parameters: {'kernel': 'rbf', 'C': 87.41075129058048, 'gamma': 0.0037205710659486474, 'epsilon': 0.043350005563698696}. Best is trial 482 with value: 0.4491649651596098.
[I 2024-12-03 18:44:46,726] Trial 975 finished with value: 0.5678032796575604 and parameters: {'kernel': 'rbf', 'C': 90.12577608204333, 'gamma': 0.032569926207568226, 'epsilon': 0.2735091144498925}. Best is trial 482 with value: 0.4491649651596098.
[I 2024-12-03 18:44:46,751] Trial 972 finished with value: 0.7403661696312147 and parameters: {'kernel': 'poly', 'C': 5.391674174046488, 'gamma': 0.12868094351235468, 'epsilon': 0.013879268399406884}. Best is trial 482 with value: 0.4491649651596098.
[I 2024-12-03 18:44:46,915] Trial 970 finished with value: 0.4852745287830781 and parameters: {'kernel': 'rbf', 'C': 95.55415579002042, 'gamma': 0.006573544698217411, 'epsilon': 0.05897954055360106}. Best is trial 482 with value: 0.4491649651596098.
[I 2024-12-03 18:44:47,234] Trial 977 finished with value: 0.552664922131978 and parameters: {'kernel': 'rbf', 'C': 96.49277885549351, 'gamma': 0.0023154750083619123, 'epsilon': 0.13086073388538044}. Best is trial 482 with value: 0.4491649651596098.
[I 2024-12-03 18:44:47,636] Trial 966 finished with value: 0.46923231526640335 and parameters: {'kernel': 'rbf', 'C': 20.009964201850266, 'gamma': 0.0335667432208026, 'epsilon': 0.041377744467480534}. Best is trial 482 with value: 0.4491649651596098.
[I 2024-12-03 18:44:47,998] Trial 980 finished with value: 0.7489666758268608 and parameters: {'kernel': 'poly', 'C': 98.68111473957894, 'gamma': 0.03618279197332766, 'epsilon': 0.05448059805765324}. Best is trial 482 with value: 0.4491649651596098.
[I 2024-12-03 18:44:48,165] Trial 978 finished with value: 0.6251965956190472 and parameters: {'kernel': 'rbf', 'C': 2.6144469088801734, 'gamma': 0.02810287345606973, 'epsilon': 0.7670018790356589}. Best is trial 482 with value: 0.4491649651596098.
[I 2024-12-03 18:44:48,207] Trial 971 finished with value: 0.497478031592641 and parameters: {'kernel': 'rbf', 'C': 19.81024493864781, 'gamma': 0.019389010698111254, 'epsilon': 0.26379304802591264}. Best is trial 482 with value: 0.4491649651596098.
[I 2024-12-03 18:44:48,528] Trial 974 finished with value: 0.495726015585944 and parameters: {'kernel': 'rbf', 'C': 85.19263959158755, 'gamma': 0.0255410434838603, 'epsilon': 0.07634391190833405}. Best is trial 482 with value: 0.4491649651596098.
[I 2024-12-03 18:44:48,534] Trial 969 finished with value: 0.47058077595044673 and parameters: {'kernel': 'rbf', 'C': 16.65252719350672, 'gamma': 0.025641570090231484, 'epsilon': 0.05186792472573386}. Best is trial 482 with value: 0.4491649651596098.
[I 2024-12-03 18:44:49,342] Trial 973 finished with value: 0.660792176693576 and parameters: {'kernel': 'rbf', 'C': 3.7775217635599896, 'gamma': 0.009357267856605485, 'epsilon': 0.06020074097791006}. Best is trial 482 with value: 0.4491649651596098.
[I 2024-12-03 18:44:49,798] Trial 984 finished with value: 0.5776975922100186 and parameters: {'kernel': 'rbf', 'C': 13.224746527958153, 'gamma': 0.0053312225843240146, 'epsilon': 0.13623655831593365}. Best is trial 482 with value: 0.4491649651596098.
[I 2024-12-03 18:44:50,562] Trial 976 finished with value: 0.5212415685000682 and parameters: {'kernel': 'rbf', 'C': 99.58889266059113, 'gamma': 0.003785627793399011, 'epsilon': 0.0946237599543565}. Best is trial 482 with value: 0.4491649651596098.
[I 2024-12-03 18:44:50,938] Trial 981 finished with value: 0.49662281017097704 and parameters: {'kernel': 'rbf', 'C': 17.56975964416682, 'gamma': 0.016985506542039293, 'epsilon': 0.03244950969645215}. Best is trial 482 with value: 0.4491649651596098.
[I 2024-12-03 18:44:51,181] Trial 979 finished with value: 0.4664654200667978 and parameters: {'kernel': 'rbf', 'C': 98.87403312894405, 'gamma': 0.009082371479991568, 'epsilon': 0.06294236319447848}. Best is trial 482 with value: 0.4491649651596098.
[I 2024-12-03 18:44:51,331] Trial 982 finished with value: 0.4795401840876954 and parameters: {'kernel': 'rbf', 'C': 85.14858488873983, 'gamma': 0.024517406791699337, 'epsilon': 0.018558062119328013}. Best is trial 482 with value: 0.4491649651596098.
[I 2024-12-03 18:44:51,431] Trial 988 finished with value: 0.6309845726461457 and parameters: {'kernel': 'rbf', 'C': 91.24433215900635, 'gamma': 0.07048191535464526, 'epsilon': 0.10149552097273945}. Best is trial 482 with value: 0.4491649651596098.
[I 2024-12-03 18:44:51,432] Trial 985 finished with value: 1.3662063317935098 and parameters: {'kernel': 'rbf', 'C': 0.0013761080750863226, 'gamma': 0.004492758657801693, 'epsilon': 0.0013667913776167328}. Best is trial 482 with value: 0.4491649651596098.
[I 2024-12-03 18:44:52,276] Trial 994 finished with value: 0.4718453778647163 and parameters: {'kernel': 'rbf', 'C': 97.67676062462508, 'gamma': 0.008773804852435986, 'epsilon': 0.15088135466344998}. Best is trial 482 with value: 0.4491649651596098.
[I 2024-12-03 18:44:52,585] Trial 993 finished with value: 258.829409775621 and parameters: {'kernel': 'sigmoid', 'C': 31.10875910749983, 'gamma': 0.10349008580081871, 'epsilon': 0.006886495527089183}. Best is trial 482 with value: 0.4491649651596098.
[I 2024-12-03 18:44:53,027] Trial 983 finished with value: 0.8983923587319329 and parameters: {'kernel': 'linear', 'C': 0.0018842440614851377, 'gamma': 0.45496362241563404, 'epsilon': 0.007711027088332344}. Best is trial 482 with value: 0.4491649651596098.
[I 2024-12-03 18:44:53,763] Trial 990 finished with value: 0.49470469715717597 and parameters: {'kernel': 'rbf', 'C': 94.5814749639032, 'gamma': 0.007813876464174698, 'epsilon': 0.189523588389831}. Best is trial 482 with value: 0.4491649651596098.
[I 2024-12-03 18:44:54,213] Trial 991 finished with value: 0.6137305951219187 and parameters: {'kernel': 'rbf', 'C': 14.445484531797304, 'gamma': 0.00364960846351532, 'epsilon': 0.01896123161539955}. Best is trial 482 with value: 0.4491649651596098.
[I 2024-12-03 18:44:54,214] Trial 992 finished with value: 40.22334788714035 and parameters: {'kernel': 'sigmoid', 'C': 9.49125055059889, 'gamma': 0.022547569181357155, 'epsilon': 0.08414700691913227}. Best is trial 482 with value: 0.4491649651596098.
[I 2024-12-03 18:44:55,324] Trial 995 finished with value: 0.5489952139692219 and parameters: {'kernel': 'rbf', 'C': 16.067419372627942, 'gamma': 0.008489217124081502, 'epsilon': 0.02701747868993597}. Best is trial 1002 with value: 0.44903193867462854.
[I 2024-12-03 18:44:55,332] Trial 1001 finished with value: 1.3344367724201844 and parameters: {'kernel': 'rbf', 'C': 0.0010590179009984054, 'gamma': 0.00011385687905444866, 'epsilon': 0.3784828665312576}. Best is trial 1002 with value: 0.44903193867462854.
[I 2024-12-03 18:44:55,623] Trial 996 finished with value: 0.5612473197002713 and parameters: {'kernel': 'linear', 'C': 37.565679781250346, 'gamma': 0.0025297226596117752, 'epsilon': 0.028902540624573682}. Best is trial 1002 with value: 0.44903193867462854.
[I 2024-12-03 18:44:55,847] Trial 999 finished with value: 1.2490952386355714 and parameters: {'kernel': 'rbf', 'C': 0.02104586492616723, 'gamma': 0.004153771854621924, 'epsilon': 0.6075671305236822}. Best is trial 1002 with value: 0.44903193867462854.
[I 2024-12-03 18:44:55,939] Trial 1007 finished with value: 1.2444491663077355 and parameters: {'kernel': 'rbf', 'C': 0.019225211413819145, 'gamma': 0.015745586867156224, 'epsilon': 0.06789380530916045}. Best is trial 1002 with value: 0.44903193867462854.
[I 2024-12-03 18:44:56,229] Trial 987 finished with value: 0.8816811374635987 and parameters: {'kernel': 'rbf', 'C': 5.337172590792439, 'gamma': 0.0001953517075602901, 'epsilon': 0.003807555374547227}. Best is trial 1002 with value: 0.44903193867462854.
[I 2024-12-03 18:44:56,892] Trial 1002 finished with value: 0.44903193867462854 and parameters: {'kernel': 'rbf', 'C': 90.56876910213519, 'gamma': 0.013869074427831298, 'epsilon': 0.06460823618548264}. Best is trial 1002 with value: 0.44903193867462854.
[I 2024-12-03 18:44:57,096] Trial 1003 finished with value: 0.5668814940129868 and parameters: {'kernel': 'linear', 'C': 20.530010283540186, 'gamma': 0.011256801087807498, 'epsilon': 0.04305135781371306}. Best is trial 1002 with value: 0.44903193867462854.
[I 2024-12-03 18:44:57,199] Trial 997 finished with value: 0.5024659489815161 and parameters: {'kernel': 'rbf', 'C': 94.06203187229461, 'gamma': 0.022534379811202026, 'epsilon': 0.1077559242740751}. Best is trial 1002 with value: 0.44903193867462854.
[I 2024-12-03 18:44:57,356] Trial 1009 finished with value: 0.5978081015954111 and parameters: {'kernel': 'rbf', 'C': 96.47815070640335, 'gamma': 0.044032855808807614, 'epsilon': 0.03758070886216413}. Best is trial 1002 with value: 0.44903193867462854.
[I 2024-12-03 18:44:57,977] Trial 1014 finished with value: 149.46677426473312 and parameters: {'kernel': 'sigmoid', 'C': 74.01219077821294, 'gamma': 0.012633287796935455, 'epsilon': 0.02368170563265126}. Best is trial 1002 with value: 0.44903193867462854.
[I 2024-12-03 18:44:58,012] Trial 989 finished with value: 0.529359215321058 and parameters: {'kernel': 'rbf', 'C': 18.795008061702795, 'gamma': 0.010142810803165689, 'epsilon': 0.07939008930550724}. Best is trial 1002 with value: 0.44903193867462854.
[I 2024-12-03 18:44:58,247] Trial 1011 finished with value: 0.6138718989990395 and parameters: {'kernel': 'rbf', 'C': 21.53471407979828, 'gamma': 0.16833029351659343, 'epsilon': 0.013054008495679089}. Best is trial 1002 with value: 0.44903193867462854.
[I 2024-12-03 18:44:58,700] Trial 986 finished with value: 0.5015330072698178 and parameters: {'kernel': 'rbf', 'C': 21.906610031870322, 'gamma': 0.013721062875535199, 'epsilon': 0.03147220564034572}. Best is trial 1002 with value: 0.44903193867462854.
[I 2024-12-03 18:44:58,707] Trial 1015 finished with value: 1.2195636277426543 and parameters: {'kernel': 'sigmoid', 'C': 0.03440700609594768, 'gamma': 0.4628604610208089, 'epsilon': 0.7717312212755485}. Best is trial 1002 with value: 0.44903193867462854.
[I 2024-12-03 18:44:59,162] Trial 1000 finished with value: 0.550807640098972 and parameters: {'kernel': 'rbf', 'C': 98.32532216234219, 'gamma': 0.03205106117877187, 'epsilon': 0.1403059256970534}. Best is trial 1002 with value: 0.44903193867462854.
