[I 2024-12-03 18:42:12,125] Trial 136 finished with value: 0.789156193840528 and parameters: {'kernel': 'linear', 'C': 77.34500448345683, 'gamma': 0.0404855387480542, 'epsilon': 0.5918489381099207}. Best is trial 88 with value: 0.3542875001421725.
[I 2024-12-03 18:42:12,582] Trial 100 finished with value: 0.7891483425446942 and parameters: {'kernel': 'linear', 'C': 39.71444356440122, 'gamma': 0.5036504918068377, 'epsilon': 0.09661286020802821}. Best is trial 88 with value: 0.3542875001421725.
[I 2024-12-03 18:42:13,150] Trial 153 finished with value: 0.37843077432575956 and parameters: {'kernel': 'rbf', 'C': 96.09619230593148, 'gamma': 0.06906574067019973, 'epsilon': 0.08260461738784991}. Best is trial 88 with value: 0.3542875001421725.
[I 2024-12-03 18:42:13,543] Trial 134 finished with value: 0.828118004885892 and parameters: {'kernel': 'rbf', 'C': 1.6300743763914214, 'gamma': 0.00012544163751239087, 'epsilon': 0.0010091813438248528}. Best is trial 88 with value: 0.3542875001421725.
[I 2024-12-03 18:42:14,290] Trial 142 finished with value: 0.4683835188171823 and parameters: {'kernel': 'rbf', 'C': 4.590640887848822, 'gamma': 0.03386033096670207, 'epsilon': 0.15492175853811993}. Best is trial 88 with value: 0.3542875001421725.
[I 2024-12-03 18:42:14,886] Trial 152 finished with value: 0.40938862267503195 and parameters: {'kernel': 'rbf', 'C': 23.042823483648778, 'gamma': 0.03864862670601175, 'epsilon': 0.05140269907554764}. Best is trial 88 with value: 0.3542875001421725.
[I 2024-12-03 18:42:15,217] Trial 154 finished with value: 0.4356489492742958 and parameters: {'kernel': 'rbf', 'C': 10.70026064954816, 'gamma': 0.057079678470376045, 'epsilon': 0.11334900423154087}. Best is trial 88 with value: 0.3542875001421725.
[I 2024-12-03 18:42:15,218] Trial 161 finished with value: 0.44750626882032973 and parameters: {'kernel': 'rbf', 'C': 8.043569409885349, 'gamma': 0.0340704813389118, 'epsilon': 0.045878959321176124}. Best is trial 88 with value: 0.3542875001421725.
[I 2024-12-03 18:42:15,477] Trial 151 finished with value: 2.454690103361262 and parameters: {'kernel': 'poly', 'C': 0.8548429976618451, 'gamma': 0.01440822189291215, 'epsilon': 0.0015556053316333964}. Best is trial 88 with value: 0.3542875001421725.
[I 2024-12-03 18:42:15,478] Trial 156 finished with value: 0.35609881715272046 and parameters: {'kernel': 'rbf', 'C': 88.22433221647017, 'gamma': 0.048015047229154006, 'epsilon': 0.08284379412489586}. Best is trial 88 with value: 0.3542875001421725.
[I 2024-12-03 18:42:16,636] Trial 157 finished with value: 0.3603572048265548 and parameters: {'kernel': 'rbf', 'C': 84.12793031118659, 'gamma': 0.05243659661636638, 'epsilon': 0.06182122587354265}. Best is trial 88 with value: 0.3542875001421725.
[I 2024-12-03 18:42:16,951] Trial 158 finished with value: 0.3669278013040478 and parameters: {'kernel': 'rbf', 'C': 88.04211531070897, 'gamma': 0.04348460928039447, 'epsilon': 0.03311117984336206}. Best is trial 88 with value: 0.3542875001421725.
[I 2024-12-03 18:42:16,952] Trial 163 finished with value: 0.37472717344252227 and parameters: {'kernel': 'rbf', 'C': 95.1434726870316, 'gamma': 0.01960995640211697, 'epsilon': 0.10894551391086058}. Best is trial 88 with value: 0.3542875001421725.
[I 2024-12-03 18:42:17,441] Trial 144 finished with value: 0.849182835359525 and parameters: {'kernel': 'linear', 'C': 0.04288246067463619, 'gamma': 0.41492612832487613, 'epsilon': 0.009168313165730949}. Best is trial 88 with value: 0.3542875001421725.
[I 2024-12-03 18:42:17,470] Trial 159 finished with value: 0.358927924801308 and parameters: {'kernel': 'rbf', 'C': 93.07464966005708, 'gamma': 0.04874518249920757, 'epsilon': 0.06822364947360213}. Best is trial 88 with value: 0.3542875001421725.
[I 2024-12-03 18:42:17,967] Trial 155 finished with value: 0.3762591259100836 and parameters: {'kernel': 'rbf', 'C': 34.24909776046282, 'gamma': 0.04885512249288763, 'epsilon': 0.11526001322382712}. Best is trial 88 with value: 0.3542875001421725.
[I 2024-12-03 18:42:19,286] Trial 149 finished with value: 0.39596856160679766 and parameters: {'kernel': 'rbf', 'C': 77.77318017288775, 'gamma': 0.10007825527729464, 'epsilon': 0.0909340652068562}. Best is trial 88 with value: 0.3542875001421725.
[I 2024-12-03 18:42:19,298] Trial 162 finished with value: 0.9092285623455589 and parameters: {'kernel': 'sigmoid', 'C': 2.727724356544892, 'gamma': 0.00016887125866352283, 'epsilon': 0.006056070789616599}. Best is trial 88 with value: 0.3542875001421725.
[I 2024-12-03 18:42:20,304] Trial 160 finished with value: 0.4374333653143358 and parameters: {'kernel': 'rbf', 'C': 96.32577401928941, 'gamma': 0.12739525360671725, 'epsilon': 0.14291713257677557}. Best is trial 88 with value: 0.3542875001421725.
[I 2024-12-03 18:42:21,411] Trial 167 finished with value: 0.44518486974989646 and parameters: {'kernel': 'rbf', 'C': 79.67747097299905, 'gamma': 0.14937049571519173, 'epsilon': 0.027122741903500863}. Best is trial 88 with value: 0.3542875001421725.
[I 2024-12-03 18:42:21,953] Trial 174 finished with value: 0.45419934381969557 and parameters: {'kernel': 'rbf', 'C': 7.923713525730834, 'gamma': 0.024332092994994493, 'epsilon': 0.40544157421891347}. Best is trial 88 with value: 0.3542875001421725.
[I 2024-12-03 18:42:22,242] Trial 172 finished with value: 0.7948704238618329 and parameters: {'kernel': 'linear', 'C': 0.014670969001684466, 'gamma': 0.006210932609421537, 'epsilon': 0.7197134616571544}. Best is trial 88 with value: 0.3542875001421725.
[I 2024-12-03 18:42:22,342] Trial 173 finished with value: 0.36162230698183273 and parameters: {'kernel': 'rbf', 'C': 75.69269766615163, 'gamma': 0.058455096627041604, 'epsilon': 0.06851550802841826}. Best is trial 88 with value: 0.3542875001421725.
[I 2024-12-03 18:42:22,935] Trial 164 finished with value: 0.37037197088458945 and parameters: {'kernel': 'rbf', 'C': 57.82451094609292, 'gamma': 0.04356946400699477, 'epsilon': 0.05281280125325465}. Best is trial 88 with value: 0.3542875001421725.
[I 2024-12-03 18:42:23,201] Trial 170 finished with value: 0.3565867192753982 and parameters: {'kernel': 'rbf', 'C': 77.64243403603912, 'gamma': 0.05534372428807054, 'epsilon': 0.09434595037434136}. Best is trial 88 with value: 0.3542875001421725.
[I 2024-12-03 18:42:23,531] Trial 165 finished with value: 0.3794343902139958 and parameters: {'kernel': 'rbf', 'C': 37.87461123663577, 'gamma': 0.06021768374047469, 'epsilon': 0.03635557502716053}. Best is trial 88 with value: 0.3542875001421725.
[I 2024-12-03 18:42:23,916] Trial 176 finished with value: 0.40443067782019315 and parameters: {'kernel': 'rbf', 'C': 99.73576465502347, 'gamma': 0.11024061444631632, 'epsilon': 0.03186505342462703}. Best is trial 88 with value: 0.3542875001421725.
[I 2024-12-03 18:42:24,095] Trial 183 finished with value: 0.36550139234120127 and parameters: {'kernel': 'rbf', 'C': 82.97314608896396, 'gamma': 0.03336868501039952, 'epsilon': 0.17040749494578708}. Best is trial 88 with value: 0.3542875001421725.
[I 2024-12-03 18:42:24,227] Trial 171 finished with value: 0.4938116335079449 and parameters: {'kernel': 'rbf', 'C': 5.977490035695956, 'gamma': 0.1483154485022874, 'epsilon': 0.14779212933160152}. Best is trial 88 with value: 0.3542875001421725.
[I 2024-12-03 18:42:24,413] Trial 168 finished with value: 0.38300724554584487 and parameters: {'kernel': 'rbf', 'C': 44.25115895136414, 'gamma': 0.03214909078020664, 'epsilon': 0.03556739992435714}. Best is trial 88 with value: 0.3542875001421725.
[I 2024-12-03 18:42:24,814] Trial 166 finished with value: 0.3990405120210511 and parameters: {'kernel': 'rbf', 'C': 75.89311674084315, 'gamma': 0.07225591776027579, 'epsilon': 0.2847831589051867}. Best is trial 88 with value: 0.3542875001421725.
[I 2024-12-03 18:42:24,970] Trial 181 finished with value: 0.3665198986008111 and parameters: {'kernel': 'rbf', 'C': 69.62317502937174, 'gamma': 0.032645825550322784, 'epsilon': 0.14291807705527718}. Best is trial 88 with value: 0.3542875001421725.
[I 2024-12-03 18:42:24,972] Trial 177 finished with value: 0.3899324894349094 and parameters: {'kernel': 'rbf', 'C': 96.30022348632347, 'gamma': 0.08884852005934765, 'epsilon': 0.151331178958393}. Best is trial 88 with value: 0.3542875001421725.
[I 2024-12-03 18:42:25,149] Trial 182 finished with value: 0.38884925153827954 and parameters: {'kernel': 'rbf', 'C': 97.27207487517597, 'gamma': 0.08627636333498254, 'epsilon': 0.08446128084475796}. Best is trial 88 with value: 0.3542875001421725.
[I 2024-12-03 18:42:25,633] Trial 180 finished with value: 1.0498392549955757 and parameters: {'kernel': 'poly', 'C': 0.0011094339496086532, 'gamma': 0.003183625981880148, 'epsilon': 0.0011939501917113571}. Best is trial 88 with value: 0.3542875001421725.
[I 2024-12-03 18:42:25,751] Trial 175 finished with value: 0.37179587714317847 and parameters: {'kernel': 'rbf', 'C': 75.32833641263248, 'gamma': 0.023459644458262197, 'epsilon': 0.10610812276484988}. Best is trial 88 with value: 0.3542875001421725.
[I 2024-12-03 18:42:26,110] Trial 178 finished with value: 0.37019611963382887 and parameters: {'kernel': 'rbf', 'C': 89.26267556386215, 'gamma': 0.032165215551433514, 'epsilon': 0.05724157022057926}. Best is trial 88 with value: 0.3542875001421725.
[I 2024-12-03 18:42:26,335] Trial 187 finished with value: 0.43499075928829456 and parameters: {'kernel': 'rbf', 'C': 16.339915309770753, 'gamma': 0.010702724339356668, 'epsilon': 0.2876596537215215}. Best is trial 88 with value: 0.3542875001421725.
[I 2024-12-03 18:42:26,564] Trial 190 finished with value: 0.4327769374017363 and parameters: {'kernel': 'rbf', 'C': 61.74578493330522, 'gamma': 0.007641072100259639, 'epsilon': 0.1590861090747736}. Best is trial 88 with value: 0.3542875001421725.
[I 2024-12-03 18:42:27,650] Trial 179 finished with value: 0.40442126008697793 and parameters: {'kernel': 'rbf', 'C': 92.72726442377679, 'gamma': 0.012644254436918596, 'epsilon': 0.11923517367880092}. Best is trial 88 with value: 0.3542875001421725.
[I 2024-12-03 18:42:28,432] Trial 184 finished with value: 0.3693140642550315 and parameters: {'kernel': 'rbf', 'C': 77.82696114841791, 'gamma': 0.0306463363404396, 'epsilon': 0.3554881651122092}. Best is trial 88 with value: 0.3542875001421725.
[I 2024-12-03 18:42:29,470] Trial 197 finished with value: 0.41611361328764973 and parameters: {'kernel': 'rbf', 'C': 14.770828972522928, 'gamma': 0.06961102818275469, 'epsilon': 0.21674426451994677}. Best is trial 88 with value: 0.3542875001421725.
[I 2024-12-03 18:42:29,475] Trial 194 finished with value: 0.36746383937455457 and parameters: {'kernel': 'rbf', 'C': 57.27307241030569, 'gamma': 0.03890274769081981, 'epsilon': 0.09225317232938446}. Best is trial 88 with value: 0.3542875001421725.
[I 2024-12-03 18:42:29,476] Trial 189 finished with value: 0.4160511098862263 and parameters: {'kernel': 'rbf', 'C': 22.6648123442439, 'gamma': 0.025455383123688325, 'epsilon': 0.10397689553907524}. Best is trial 88 with value: 0.3542875001421725.
[I 2024-12-03 18:42:29,972] Trial 199 finished with value: 0.3684164102580398 and parameters: {'kernel': 'rbf', 'C': 95.11961500095154, 'gamma': 0.02937186095488024, 'epsilon': 0.09047354655236434}. Best is trial 88 with value: 0.3542875001421725.
[I 2024-12-03 18:42:30,007] Trial 203 finished with value: 0.860042855235582 and parameters: {'kernel': 'linear', 'C': 0.030848211783145982, 'gamma': 0.0065026079918791, 'epsilon': 0.041549866972456745}. Best is trial 88 with value: 0.3542875001421725.
[I 2024-12-03 18:42:30,011] Trial 191 finished with value: 0.6193461587473272 and parameters: {'kernel': 'rbf', 'C': 87.47086763515762, 'gamma': 0.3708430258487007, 'epsilon': 0.06786426197389796}. Best is trial 88 with value: 0.3542875001421725.
[I 2024-12-03 18:42:30,155] Trial 186 finished with value: 0.8101008375678745 and parameters: {'kernel': 'poly', 'C': 4.952338406796826, 'gamma': 0.0431725515302688, 'epsilon': 0.07339493944083537}. Best is trial 88 with value: 0.3542875001421725.
[I 2024-12-03 18:42:30,158] Trial 185 finished with value: 0.36698430296166606 and parameters: {'kernel': 'rbf', 'C': 82.83147474617502, 'gamma': 0.04394400416489366, 'epsilon': 0.2799038602486834}. Best is trial 88 with value: 0.3542875001421725.
[I 2024-12-03 18:42:30,473] Trial 196 finished with value: 0.4181548976648493 and parameters: {'kernel': 'rbf', 'C': 15.249857364482025, 'gamma': 0.08437762501980758, 'epsilon': 0.17404273396977252}. Best is trial 88 with value: 0.3542875001421725.
[I 2024-12-03 18:42:30,726] Trial 195 finished with value: 0.4991445187399626 and parameters: {'kernel': 'rbf', 'C': 10.787436399159759, 'gamma': 0.1812884118856341, 'epsilon': 0.044714590015976496}. Best is trial 88 with value: 0.3542875001421725.
[I 2024-12-03 18:42:30,921] Trial 205 finished with value: 1.078059899656143 and parameters: {'kernel': 'sigmoid', 'C': 0.0012680838548308614, 'gamma': 0.013872916181193675, 'epsilon': 0.8396421600192484}. Best is trial 88 with value: 0.3542875001421725.
[I 2024-12-03 18:42:31,197] Trial 201 finished with value: 0.4580983660682839 and parameters: {'kernel': 'rbf', 'C': 12.76190938577215, 'gamma': 0.13871631860219658, 'epsilon': 0.07853791632874507}. Best is trial 88 with value: 0.3542875001421725.
[I 2024-12-03 18:42:31,199] Trial 206 finished with value: 0.40766266146214675 and parameters: {'kernel': 'rbf', 'C': 65.84398475029978, 'gamma': 0.08466051250541837, 'epsilon': 0.24835783080542717}. Best is trial 88 with value: 0.3542875001421725.
[I 2024-12-03 18:42:31,310] Trial 204 finished with value: 0.4622992920835004 and parameters: {'kernel': 'rbf', 'C': 58.308493101721204, 'gamma': 0.06526800726676085, 'epsilon': 0.48489467649577717}. Best is trial 88 with value: 0.3542875001421725.
[I 2024-12-03 18:42:31,322] Trial 139 finished with value: 0.7997669086943305 and parameters: {'kernel': 'linear', 'C': 66.71689328894287, 'gamma': 0.05192011417789518, 'epsilon': 0.025103651672046604}. Best is trial 88 with value: 0.3542875001421725.
[I 2024-12-03 18:42:31,441] Trial 198 finished with value: 0.38029970540013586 and parameters: {'kernel': 'rbf', 'C': 88.5489072137691, 'gamma': 0.07574882289605679, 'epsilon': 0.08555739011781656}. Best is trial 88 with value: 0.3542875001421725.
[I 2024-12-03 18:42:31,888] Trial 192 finished with value: 0.3666682615663163 and parameters: {'kernel': 'rbf', 'C': 96.35463612039696, 'gamma': 0.03904405541412017, 'epsilon': 0.04417922528731542}. Best is trial 88 with value: 0.3542875001421725.
[I 2024-12-03 18:42:33,676] Trial 208 finished with value: 0.44139787321364465 and parameters: {'kernel': 'rbf', 'C': 15.196958717096791, 'gamma': 0.022765653707703087, 'epsilon': 0.01753278272499975}. Best is trial 88 with value: 0.3542875001421725.
[I 2024-12-03 18:42:33,811] Trial 193 finished with value: 0.3759328318370654 and parameters: {'kernel': 'rbf', 'C': 67.10643986527195, 'gamma': 0.024764196352214354, 'epsilon': 0.40521470465006126}. Best is trial 88 with value: 0.3542875001421725.
[I 2024-12-03 18:42:34,548] Trial 214 finished with value: 0.37066351007237064 and parameters: {'kernel': 'rbf', 'C': 59.68012006012538, 'gamma': 0.02577761173287478, 'epsilon': 0.28844410520623215}. Best is trial 88 with value: 0.3542875001421725.
[I 2024-12-03 18:42:34,608] Trial 210 finished with value: 0.3934423872405186 and parameters: {'kernel': 'rbf', 'C': 71.52924897736222, 'gamma': 0.019433063170957887, 'epsilon': 0.030779416947777558}. Best is trial 88 with value: 0.3542875001421725.
[I 2024-12-03 18:42:35,003] Trial 211 finished with value: 0.37622847924346536 and parameters: {'kernel': 'rbf', 'C': 76.21175074660336, 'gamma': 0.06915506075392379, 'epsilon': 0.037335757508305006}. Best is trial 88 with value: 0.3542875001421725.
[I 2024-12-03 18:42:35,261] Trial 209 finished with value: 0.39162692799895166 and parameters: {'kernel': 'rbf', 'C': 77.7103411564873, 'gamma': 0.017651012869999254, 'epsilon': 0.07193629727584266}. Best is trial 88 with value: 0.3542875001421725.
[I 2024-12-03 18:42:35,463] Trial 215 finished with value: 0.3905340397216341 and parameters: {'kernel': 'rbf', 'C': 77.44011605523255, 'gamma': 0.09204534325555773, 'epsilon': 0.10558337078666338}. Best is trial 88 with value: 0.3542875001421725.
[I 2024-12-03 18:42:35,471] Trial 213 finished with value: 215.61001229581424 and parameters: {'kernel': 'sigmoid', 'C': 10.491769899428185, 'gamma': 0.09221758292072346, 'epsilon': 0.11701066688100614}. Best is trial 88 with value: 0.3542875001421725.
[I 2024-12-03 18:42:35,549] Trial 221 finished with value: 0.3807960869784572 and parameters: {'kernel': 'rbf', 'C': 91.06324762055885, 'gamma': 0.06125299555820493, 'epsilon': 0.03238283874639665}. Best is trial 88 with value: 0.3542875001421725.
[I 2024-12-03 18:42:35,980] Trial 222 finished with value: 0.40051873646498365 and parameters: {'kernel': 'rbf', 'C': 79.88989544519846, 'gamma': 0.09894796923757912, 'epsilon': 0.14294063053264325}. Best is trial 88 with value: 0.3542875001421725.
[I 2024-12-03 18:42:36,157] Trial 218 finished with value: 0.610583947359284 and parameters: {'kernel': 'rbf', 'C': 96.90248774050886, 'gamma': 0.3115633423334906, 'epsilon': 0.19531714686887366}. Best is trial 88 with value: 0.3542875001421725.
[I 2024-12-03 18:42:36,206] Trial 220 finished with value: 0.3694431813719237 and parameters: {'kernel': 'rbf', 'C': 95.1079991670605, 'gamma': 0.020774140117825256, 'epsilon': 0.21835765966722548}. Best is trial 88 with value: 0.3542875001421725.
[I 2024-12-03 18:42:37,117] Trial 207 finished with value: 238.19675640672781 and parameters: {'kernel': 'sigmoid', 'C': 99.04226823747136, 'gamma': 0.002088757448324629, 'epsilon': 0.29259103645553314}. Best is trial 88 with value: 0.3542875001421725.
[I 2024-12-03 18:42:37,132] Trial 217 finished with value: 0.3668855125173803 and parameters: {'kernel': 'rbf', 'C': 88.51298971463372, 'gamma': 0.02851188607701228, 'epsilon': 0.06470017545663785}. Best is trial 88 with value: 0.3542875001421725.
[I 2024-12-03 18:42:37,703] Trial 228 finished with value: 0.43092243665734 and parameters: {'kernel': 'rbf', 'C': 13.03519542127401, 'gamma': 0.040683373275300756, 'epsilon': 0.07705325422009071}. Best is trial 88 with value: 0.3542875001421725.
[I 2024-12-03 18:42:37,896] Trial 224 finished with value: 0.4294147841138398 and parameters: {'kernel': 'rbf', 'C': 6.658929725636186, 'gamma': 0.009314377269173583, 'epsilon': 0.09922185576406739}. Best is trial 88 with value: 0.3542875001421725.
[I 2024-12-03 18:42:38,185] Trial 226 finished with value: 1961.3058424951898 and parameters: {'kernel': 'sigmoid', 'C': 91.75879806671806, 'gamma': 0.06035847829546913, 'epsilon': 0.032642571039387}. Best is trial 88 with value: 0.3542875001421725.
[I 2024-12-03 18:42:38,634] Trial 230 finished with value: 0.37061073437491754 and parameters: {'kernel': 'rbf', 'C': 64.1864906197582, 'gamma': 0.04098513059863113, 'epsilon': 0.04626079261737884}. Best is trial 88 with value: 0.3542875001421725.
[I 2024-12-03 18:42:38,650] Trial 216 finished with value: 0.4463225848780376 and parameters: {'kernel': 'rbf', 'C': 7.376872730419328, 'gamma': 0.03163518859434064, 'epsilon': 0.07434635022241097}. Best is trial 88 with value: 0.3542875001421725.
[I 2024-12-03 18:42:38,877] Trial 223 finished with value: 1.0743553174624307 and parameters: {'kernel': 'poly', 'C': 0.41428923084513164, 'gamma': 0.00010746633539727178, 'epsilon': 0.10505091252678236}. Best is trial 88 with value: 0.3542875001421725.
[I 2024-12-03 18:42:39,187] Trial 188 finished with value: 0.7887237760872366 and parameters: {'kernel': 'linear', 'C': 23.516250760127242, 'gamma': 0.06355959628869384, 'epsilon': 0.08242936062670496}. Best is trial 88 with value: 0.3542875001421725.
[I 2024-12-03 18:42:39,189] Trial 231 finished with value: 0.38599685195387695 and parameters: {'kernel': 'rbf', 'C': 71.50418392705991, 'gamma': 0.019824683145960847, 'epsilon': 0.10097673859063672}. Best is trial 88 with value: 0.3542875001421725.
[I 2024-12-03 18:42:39,202] Trial 227 finished with value: 0.3662881310903419 and parameters: {'kernel': 'rbf', 'C': 98.02479573461304, 'gamma': 0.05888338572170087, 'epsilon': 0.113477891600652}. Best is trial 88 with value: 0.3542875001421725.
[I 2024-12-03 18:42:39,206] Trial 225 finished with value: 0.3560004640150592 and parameters: {'kernel': 'rbf', 'C': 98.40851793056872, 'gamma': 0.04167547030027004, 'epsilon': 0.14048640131862236}. Best is trial 88 with value: 0.3542875001421725.
[I 2024-12-03 18:42:39,212] Trial 219 finished with value: 0.3830812087033763 and parameters: {'kernel': 'rbf', 'C': 90.45547752835004, 'gamma': 0.07725710771070933, 'epsilon': 0.06319345097609139}. Best is trial 88 with value: 0.3542875001421725.
[I 2024-12-03 18:42:40,003] Trial 235 finished with value: 0.42025565434674556 and parameters: {'kernel': 'rbf', 'C': 96.14217129706476, 'gamma': 0.00807285109837427, 'epsilon': 0.04162232112728448}. Best is trial 88 with value: 0.3542875001421725.
[I 2024-12-03 18:42:40,710] Trial 234 finished with value: 0.3746267723980924 and parameters: {'kernel': 'rbf', 'C': 88.60518154598482, 'gamma': 0.017285548606672647, 'epsilon': 0.21059567473833837}. Best is trial 88 with value: 0.3542875001421725.
[I 2024-12-03 18:42:41,278] Trial 237 finished with value: 0.3691401556647644 and parameters: {'kernel': 'rbf', 'C': 76.97360550526189, 'gamma': 0.05473492147116347, 'epsilon': 0.22603637525706646}. Best is trial 88 with value: 0.3542875001421725.
[I 2024-12-03 18:42:41,357] Trial 232 finished with value: 0.38433829720365836 and parameters: {'kernel': 'rbf', 'C': 63.40621811950335, 'gamma': 0.0198078474510533, 'epsilon': 0.14900802729347004}. Best is trial 88 with value: 0.3542875001421725.
[I 2024-12-03 18:42:41,893] Trial 229 finished with value: 0.3636659824533986 and parameters: {'kernel': 'rbf', 'C': 59.65896913469779, 'gamma': 0.04516241717807653, 'epsilon': 0.15912359922129643}. Best is trial 88 with value: 0.3542875001421725.
