[I 2024-12-04 15:25:17,857] Trial 2192 finished with value: 0.6419523941957198 and parameters: {'n_estimators': 1252, 'learning_rate': 0.013478411799141598, 'max_depth': 6, 'min_samples_split': 2, 'min_samples_leaf': 8, 'subsample': 0.8553669427762581, 'max_features': None}. Best is trial 1435 with value: 0.45467030752684195.
[I 2024-12-04 15:25:20,492] Trial 2200 finished with value: 0.4944907616607132 and parameters: {'n_estimators': 970, 'learning_rate': 0.06204959948524643, 'max_depth': 12, 'min_samples_split': 17, 'min_samples_leaf': 1, 'subsample': 0.9242929321099634, 'max_features': None}. Best is trial 1435 with value: 0.45467030752684195.
[I 2024-12-04 15:25:20,962] Trial 2197 finished with value: 0.8409789835831432 and parameters: {'n_estimators': 1373, 'learning_rate': 0.010598339005423792, 'max_depth': 7, 'min_samples_split': 8, 'min_samples_leaf': 10, 'subsample': 0.6987669115254784, 'max_features': 'sqrt'}. Best is trial 1435 with value: 0.45467030752684195.
[I 2024-12-04 15:25:21,798] Trial 2193 finished with value: 0.6794814218452074 and parameters: {'n_estimators': 1475, 'learning_rate': 0.038793313288390745, 'max_depth': 10, 'min_samples_split': 6, 'min_samples_leaf': 2, 'subsample': 0.9330513189137573, 'max_features': 'log2'}. Best is trial 1435 with value: 0.45467030752684195.
[I 2024-12-04 15:25:21,807] Trial 2211 finished with value: 0.6453985604056627 and parameters: {'n_estimators': 628, 'learning_rate': 0.09564217631151437, 'max_depth': 10, 'min_samples_split': 15, 'min_samples_leaf': 3, 'subsample': 0.9876121698338185, 'max_features': None}. Best is trial 1435 with value: 0.45467030752684195.
[I 2024-12-04 15:25:23,063] Trial 2205 finished with value: 0.4930776134078598 and parameters: {'n_estimators': 739, 'learning_rate': 0.08047248959626213, 'max_depth': 10, 'min_samples_split': 17, 'min_samples_leaf': 1, 'subsample': 0.9967506774592837, 'max_features': None}. Best is trial 1435 with value: 0.45467030752684195.
[I 2024-12-04 15:25:23,949] Trial 2204 finished with value: 0.638909998449 and parameters: {'n_estimators': 827, 'learning_rate': 0.09645466051438675, 'max_depth': 12, 'min_samples_split': 20, 'min_samples_leaf': 2, 'subsample': 0.9350315583822266, 'max_features': None}. Best is trial 1435 with value: 0.45467030752684195.
[I 2024-12-04 15:25:24,495] Trial 2214 finished with value: 1.003946938958839 and parameters: {'n_estimators': 711, 'learning_rate': 0.014614802841765133, 'max_depth': 3, 'min_samples_split': 5, 'min_samples_leaf': 5, 'subsample': 0.7393606579379911, 'max_features': 'log2'}. Best is trial 1435 with value: 0.45467030752684195.
[I 2024-12-04 15:25:25,759] Trial 2210 finished with value: 0.4909907376493166 and parameters: {'n_estimators': 688, 'learning_rate': 0.09423377026358297, 'max_depth': 12, 'min_samples_split': 17, 'min_samples_leaf': 1, 'subsample': 0.9780693457565872, 'max_features': None}. Best is trial 1435 with value: 0.45467030752684195.
[I 2024-12-04 15:25:27,080] Trial 2207 finished with value: 0.6485679016204202 and parameters: {'n_estimators': 1037, 'learning_rate': 0.09381668244951387, 'max_depth': 12, 'min_samples_split': 19, 'min_samples_leaf': 3, 'subsample': 0.9803919650955976, 'max_features': 'log2'}. Best is trial 1435 with value: 0.45467030752684195.
[I 2024-12-04 15:25:29,529] Trial 2203 finished with value: 0.49345434671824523 and parameters: {'n_estimators': 987, 'learning_rate': 0.06786809926395511, 'max_depth': 11, 'min_samples_split': 20, 'min_samples_leaf': 1, 'subsample': 0.9980917884240574, 'max_features': None}. Best is trial 1435 with value: 0.45467030752684195.
[I 2024-12-04 15:25:30,333] Trial 2213 finished with value: 0.4952149804657983 and parameters: {'n_estimators': 744, 'learning_rate': 0.06506684212514038, 'max_depth': 10, 'min_samples_split': 16, 'min_samples_leaf': 1, 'subsample': 0.9592726038528168, 'max_features': None}. Best is trial 1435 with value: 0.45467030752684195.
[I 2024-12-04 15:25:30,565] Trial 2221 finished with value: 0.6590728233210188 and parameters: {'n_estimators': 649, 'learning_rate': 0.08246997031981007, 'max_depth': 8, 'min_samples_split': 16, 'min_samples_leaf': 5, 'subsample': 0.7091983662387842, 'max_features': 'log2'}. Best is trial 1435 with value: 0.45467030752684195.
[I 2024-12-04 15:25:33,595] Trial 2240 finished with value: 0.5883242439298424 and parameters: {'n_estimators': 139, 'learning_rate': 0.023460079634915903, 'max_depth': 3, 'min_samples_split': 7, 'min_samples_leaf': 6, 'subsample': 0.6851459984223349, 'max_features': None}. Best is trial 1435 with value: 0.45467030752684195.
[I 2024-12-04 15:25:34,231] Trial 2226 finished with value: 0.556594468426549 and parameters: {'n_estimators': 661, 'learning_rate': 0.09695686176045896, 'max_depth': 10, 'min_samples_split': 20, 'min_samples_leaf': 1, 'subsample': 0.9991764743367556, 'max_features': 'sqrt'}. Best is trial 1435 with value: 0.45467030752684195.
[I 2024-12-04 15:25:34,740] Trial 2236 finished with value: 0.5504011037533205 and parameters: {'n_estimators': 303, 'learning_rate': 0.04097503045645224, 'max_depth': 3, 'min_samples_split': 16, 'min_samples_leaf': 5, 'subsample': 0.9708880544177381, 'max_features': None}. Best is trial 1435 with value: 0.45467030752684195.
[I 2024-12-04 15:25:35,205] Trial 2215 finished with value: 0.48237185158784956 and parameters: {'n_estimators': 742, 'learning_rate': 0.043565472399374604, 'max_depth': 12, 'min_samples_split': 20, 'min_samples_leaf': 1, 'subsample': 0.9965652582701835, 'max_features': None}. Best is trial 1435 with value: 0.45467030752684195.
[I 2024-12-04 15:25:37,725] Trial 2209 finished with value: 0.475029366790182 and parameters: {'n_estimators': 1043, 'learning_rate': 0.07267852261629615, 'max_depth': 12, 'min_samples_split': 20, 'min_samples_leaf': 1, 'subsample': 0.99425499314729, 'max_features': None}. Best is trial 1435 with value: 0.45467030752684195.
[I 2024-12-04 15:25:40,196] Trial 2225 finished with value: 0.6311297581966614 and parameters: {'n_estimators': 736, 'learning_rate': 0.06194534700922475, 'max_depth': 12, 'min_samples_split': 17, 'min_samples_leaf': 2, 'subsample': 0.9855151909777841, 'max_features': None}. Best is trial 1435 with value: 0.45467030752684195.
[I 2024-12-04 15:25:41,336] Trial 2206 finished with value: 0.5509776364416229 and parameters: {'n_estimators': 1474, 'learning_rate': 0.09407273670877925, 'max_depth': 3, 'min_samples_split': 13, 'min_samples_leaf': 1, 'subsample': 0.650594890266903, 'max_features': None}. Best is trial 1435 with value: 0.45467030752684195.
[I 2024-12-04 15:25:42,141] Trial 2212 finished with value: 0.48268902785314416 and parameters: {'n_estimators': 1068, 'learning_rate': 0.0543856306795378, 'max_depth': 12, 'min_samples_split': 19, 'min_samples_leaf': 1, 'subsample': 0.9422195478357581, 'max_features': None}. Best is trial 1435 with value: 0.45467030752684195.
[I 2024-12-04 15:25:42,873] Trial 2218 finished with value: 0.49148377639563406 and parameters: {'n_estimators': 990, 'learning_rate': 0.03966607056035094, 'max_depth': 10, 'min_samples_split': 18, 'min_samples_leaf': 1, 'subsample': 0.9903917974603897, 'max_features': None}. Best is trial 1435 with value: 0.45467030752684195.
[I 2024-12-04 15:25:43,617] Trial 2220 finished with value: 0.4888909912223392 and parameters: {'n_estimators': 937, 'learning_rate': 0.0755425599766405, 'max_depth': 10, 'min_samples_split': 20, 'min_samples_leaf': 1, 'subsample': 0.9958413221170456, 'max_features': None}. Best is trial 1435 with value: 0.45467030752684195.
[I 2024-12-04 15:25:44,147] Trial 2241 finished with value: 0.571790320780275 and parameters: {'n_estimators': 508, 'learning_rate': 0.014434304500677526, 'max_depth': 12, 'min_samples_split': 13, 'min_samples_leaf': 1, 'subsample': 0.7647194155629466, 'max_features': 'sqrt'}. Best is trial 1435 with value: 0.45467030752684195.
[I 2024-12-04 15:25:44,973] Trial 2223 finished with value: 0.4806840352922527 and parameters: {'n_estimators': 932, 'learning_rate': 0.09534964172709397, 'max_depth': 12, 'min_samples_split': 20, 'min_samples_leaf': 1, 'subsample': 0.8950707094518198, 'max_features': None}. Best is trial 1435 with value: 0.45467030752684195.
[I 2024-12-04 15:25:45,907] Trial 2216 finished with value: 0.4771597974397018 and parameters: {'n_estimators': 1124, 'learning_rate': 0.0937884425370382, 'max_depth': 12, 'min_samples_split': 20, 'min_samples_leaf': 1, 'subsample': 0.9848152525128916, 'max_features': None}. Best is trial 1435 with value: 0.45467030752684195.
[I 2024-12-04 15:25:48,301] Trial 2229 finished with value: 0.645081820363008 and parameters: {'n_estimators': 884, 'learning_rate': 0.07954228301052585, 'max_depth': 12, 'min_samples_split': 17, 'min_samples_leaf': 3, 'subsample': 0.9251459473366144, 'max_features': None}. Best is trial 1435 with value: 0.45467030752684195.
[I 2024-12-04 15:25:48,642] Trial 2217 finished with value: 0.5068921171817321 and parameters: {'n_estimators': 1136, 'learning_rate': 0.05894249774779844, 'max_depth': 12, 'min_samples_split': 15, 'min_samples_leaf': 1, 'subsample': 0.9991056277786128, 'max_features': None}. Best is trial 1435 with value: 0.45467030752684195.
[I 2024-12-04 15:25:48,643] Trial 2233 finished with value: 0.5179528025320225 and parameters: {'n_estimators': 773, 'learning_rate': 0.06133816282957321, 'max_depth': 12, 'min_samples_split': 16, 'min_samples_leaf': 1, 'subsample': 0.9863768941183718, 'max_features': None}. Best is trial 1435 with value: 0.45467030752684195.
[I 2024-12-04 15:25:50,444] Trial 2232 finished with value: 0.8014454210848087 and parameters: {'n_estimators': 1090, 'learning_rate': 0.02912615185698215, 'max_depth': 6, 'min_samples_split': 7, 'min_samples_leaf': 6, 'subsample': 0.6970243066489146, 'max_features': 'log2'}. Best is trial 1435 with value: 0.45467030752684195.
[I 2024-12-04 15:25:52,782] Trial 2230 finished with value: 0.47966911065606926 and parameters: {'n_estimators': 938, 'learning_rate': 0.07037336273902525, 'max_depth': 12, 'min_samples_split': 20, 'min_samples_leaf': 1, 'subsample': 0.9843471221518921, 'max_features': None}. Best is trial 1435 with value: 0.45467030752684195.
[I 2024-12-04 15:25:53,539] Trial 2224 finished with value: 0.6261807089724396 and parameters: {'n_estimators': 1072, 'learning_rate': 0.06595429483710011, 'max_depth': 12, 'min_samples_split': 20, 'min_samples_leaf': 2, 'subsample': 0.9872629713682344, 'max_features': None}. Best is trial 1435 with value: 0.45467030752684195.
[I 2024-12-04 15:25:53,541] Trial 2219 finished with value: 0.4819628883670452 and parameters: {'n_estimators': 1220, 'learning_rate': 0.08133061318852405, 'max_depth': 12, 'min_samples_split': 20, 'min_samples_leaf': 1, 'subsample': 0.9109156636560711, 'max_features': None}. Best is trial 1435 with value: 0.45467030752684195.
[I 2024-12-04 15:25:53,542] Trial 2227 finished with value: 0.46254137207691276 and parameters: {'n_estimators': 977, 'learning_rate': 0.0674174903359605, 'max_depth': 12, 'min_samples_split': 20, 'min_samples_leaf': 1, 'subsample': 0.9990360448020362, 'max_features': None}. Best is trial 1435 with value: 0.45467030752684195.
[I 2024-12-04 15:25:53,922] Trial 2228 finished with value: 0.6289465928002413 and parameters: {'n_estimators': 1053, 'learning_rate': 0.04106935004931675, 'max_depth': 10, 'min_samples_split': 17, 'min_samples_leaf': 2, 'subsample': 0.9084424056120803, 'max_features': None}. Best is trial 1435 with value: 0.45467030752684195.
[I 2024-12-04 15:25:53,929] Trial 2231 finished with value: 0.49062270662428475 and parameters: {'n_estimators': 962, 'learning_rate': 0.09717283791160758, 'max_depth': 10, 'min_samples_split': 17, 'min_samples_leaf': 1, 'subsample': 0.9032314711553977, 'max_features': None}. Best is trial 1435 with value: 0.45467030752684195.
[I 2024-12-04 15:25:55,287] Trial 2234 finished with value: 0.6407724253791732 and parameters: {'n_estimators': 861, 'learning_rate': 0.06224613397879902, 'max_depth': 10, 'min_samples_split': 17, 'min_samples_leaf': 2, 'subsample': 0.9329629087937112, 'max_features': None}. Best is trial 1435 with value: 0.45467030752684195.
[I 2024-12-04 15:25:56,404] Trial 2259 finished with value: 0.5784195502508301 and parameters: {'n_estimators': 169, 'learning_rate': 0.042688239243030016, 'max_depth': 10, 'min_samples_split': 14, 'min_samples_leaf': 1, 'subsample': 0.7036437908136521, 'max_features': 'sqrt'}. Best is trial 1435 with value: 0.45467030752684195.
[I 2024-12-04 15:25:56,860] Trial 2255 finished with value: 0.6069139623945171 and parameters: {'n_estimators': 246, 'learning_rate': 0.022143147777552673, 'max_depth': 9, 'min_samples_split': 7, 'min_samples_leaf': 1, 'subsample': 0.9588069377329982, 'max_features': 'sqrt'}. Best is trial 1435 with value: 0.45467030752684195.
[I 2024-12-04 15:25:58,793] Trial 2242 finished with value: 0.5732163989106731 and parameters: {'n_estimators': 767, 'learning_rate': 0.08228967039591015, 'max_depth': 9, 'min_samples_split': 20, 'min_samples_leaf': 5, 'subsample': 0.86232310821193, 'max_features': None}. Best is trial 1435 with value: 0.45467030752684195.
[I 2024-12-04 15:26:02,163] Trial 2238 finished with value: 0.4925824960292956 and parameters: {'n_estimators': 924, 'learning_rate': 0.0656268750905546, 'max_depth': 12, 'min_samples_split': 17, 'min_samples_leaf': 1, 'subsample': 0.9922107058450574, 'max_features': None}. Best is trial 1435 with value: 0.45467030752684195.
[I 2024-12-04 15:26:02,614] Trial 2239 finished with value: 0.4766661657511982 and parameters: {'n_estimators': 883, 'learning_rate': 0.09512843548090046, 'max_depth': 12, 'min_samples_split': 19, 'min_samples_leaf': 1, 'subsample': 0.9750906640419638, 'max_features': None}. Best is trial 1435 with value: 0.45467030752684195.
[I 2024-12-04 15:26:03,434] Trial 2235 finished with value: 0.4786928332637645 and parameters: {'n_estimators': 1046, 'learning_rate': 0.04768557006382466, 'max_depth': 12, 'min_samples_split': 20, 'min_samples_leaf': 1, 'subsample': 0.9375637698383678, 'max_features': None}. Best is trial 1435 with value: 0.45467030752684195.
[I 2024-12-04 15:26:04,048] Trial 2237 finished with value: 0.48703147869175695 and parameters: {'n_estimators': 1027, 'learning_rate': 0.06241845955608634, 'max_depth': 11, 'min_samples_split': 17, 'min_samples_leaf': 1, 'subsample': 0.9331383745349202, 'max_features': None}. Best is trial 1435 with value: 0.45467030752684195.
[I 2024-12-04 15:26:06,817] Trial 2249 finished with value: 0.4745142494019864 and parameters: {'n_estimators': 765, 'learning_rate': 0.06267135199054358, 'max_depth': 10, 'min_samples_split': 20, 'min_samples_leaf': 1, 'subsample': 0.9385576832354611, 'max_features': None}. Best is trial 1435 with value: 0.45467030752684195.
[I 2024-12-04 15:26:07,181] Trial 2264 finished with value: 0.661173884381796 and parameters: {'n_estimators': 261, 'learning_rate': 0.011867973061643356, 'max_depth': 12, 'min_samples_split': 13, 'min_samples_leaf': 10, 'subsample': 0.7526127095281625, 'max_features': None}. Best is trial 1435 with value: 0.45467030752684195.
[I 2024-12-04 15:26:08,697] Trial 2243 finished with value: 0.764351664211862 and parameters: {'n_estimators': 1131, 'learning_rate': 0.03242223127834171, 'max_depth': 11, 'min_samples_split': 20, 'min_samples_leaf': 10, 'subsample': 0.6045640598079016, 'max_features': None}. Best is trial 1435 with value: 0.45467030752684195.
[I 2024-12-04 15:26:10,324] Trial 2244 finished with value: 0.6689308568604959 and parameters: {'n_estimators': 1032, 'learning_rate': 0.09787970323582484, 'max_depth': 12, 'min_samples_split': 16, 'min_samples_leaf': 3, 'subsample': 0.8745637017148737, 'max_features': None}. Best is trial 1435 with value: 0.45467030752684195.
[I 2024-12-04 15:26:10,993] Trial 2246 finished with value: 0.7830030643134744 and parameters: {'n_estimators': 1032, 'learning_rate': 0.0936859138027233, 'max_depth': 8, 'min_samples_split': 7, 'min_samples_leaf': 10, 'subsample': 0.7850902868435286, 'max_features': None}. Best is trial 1435 with value: 0.45467030752684195.
[I 2024-12-04 15:26:11,570] Trial 2276 finished with value: 1.0725636216466587 and parameters: {'n_estimators': 144, 'learning_rate': 0.039399696901442384, 'max_depth': 4, 'min_samples_split': 18, 'min_samples_leaf': 10, 'subsample': 0.6238745497887, 'max_features': 'sqrt'}. Best is trial 1435 with value: 0.45467030752684195.
[I 2024-12-04 15:26:12,979] Trial 2250 finished with value: 0.6167222436114489 and parameters: {'n_estimators': 870, 'learning_rate': 0.08015317906179394, 'max_depth': 12, 'min_samples_split': 20, 'min_samples_leaf': 2, 'subsample': 0.999729567246722, 'max_features': None}. Best is trial 1435 with value: 0.45467030752684195.
[I 2024-12-04 15:26:14,011] Trial 2251 finished with value: 0.4804043348595993 and parameters: {'n_estimators': 819, 'learning_rate': 0.09198531684247034, 'max_depth': 10, 'min_samples_split': 20, 'min_samples_leaf': 1, 'subsample': 0.8811506997273284, 'max_features': None}. Best is trial 1435 with value: 0.45467030752684195.
[I 2024-12-04 15:26:14,638] Trial 2258 finished with value: 0.5153469791126559 and parameters: {'n_estimators': 610, 'learning_rate': 0.0956004652509236, 'max_depth': 11, 'min_samples_split': 15, 'min_samples_leaf': 1, 'subsample': 0.9993812361804713, 'max_features': None}. Best is trial 1435 with value: 0.45467030752684195.
[I 2024-12-04 15:26:14,640] Trial 2262 finished with value: 0.6267896278306408 and parameters: {'n_estimators': 549, 'learning_rate': 0.08243626156055457, 'max_depth': 12, 'min_samples_split': 17, 'min_samples_leaf': 3, 'subsample': 0.9378585211654459, 'max_features': None}. Best is trial 1435 with value: 0.45467030752684195.
[I 2024-12-04 15:26:14,990] Trial 2252 finished with value: 0.7611705846835098 and parameters: {'n_estimators': 835, 'learning_rate': 0.0850034108527637, 'max_depth': 12, 'min_samples_split': 6, 'min_samples_leaf': 9, 'subsample': 0.8875378724795949, 'max_features': None}. Best is trial 1435 with value: 0.45467030752684195.
[I 2024-12-04 15:26:15,214] Trial 2247 finished with value: 0.4933540929857306 and parameters: {'n_estimators': 1017, 'learning_rate': 0.059071756489818605, 'max_depth': 10, 'min_samples_split': 19, 'min_samples_leaf': 1, 'subsample': 0.998093403022169, 'max_features': None}. Best is trial 1435 with value: 0.45467030752684195.
[I 2024-12-04 15:26:17,671] Trial 2245 finished with value: 0.6196048610010926 and parameters: {'n_estimators': 1185, 'learning_rate': 0.04944213672500378, 'max_depth': 10, 'min_samples_split': 20, 'min_samples_leaf': 3, 'subsample': 0.9803894009439152, 'max_features': None}. Best is trial 1435 with value: 0.45467030752684195.
[I 2024-12-04 15:26:19,555] Trial 2248 finished with value: 0.5780757146530167 and parameters: {'n_estimators': 1323, 'learning_rate': 0.013021381733077212, 'max_depth': 3, 'min_samples_split': 14, 'min_samples_leaf': 4, 'subsample': 0.6753303088371492, 'max_features': None}. Best is trial 1435 with value: 0.45467030752684195.
[I 2024-12-04 15:26:20,434] Trial 2277 finished with value: 0.8867933392205247 and parameters: {'n_estimators': 310, 'learning_rate': 0.012010944886874845, 'max_depth': 4, 'min_samples_split': 14, 'min_samples_leaf': 6, 'subsample': 0.9185340714701078, 'max_features': 'sqrt'}. Best is trial 1435 with value: 0.45467030752684195.
[I 2024-12-04 15:26:20,444] Trial 2254 finished with value: 0.4672758925983579 and parameters: {'n_estimators': 869, 'learning_rate': 0.07312617822527119, 'max_depth': 12, 'min_samples_split': 19, 'min_samples_leaf': 1, 'subsample': 0.9932497767429835, 'max_features': None}. Best is trial 1435 with value: 0.45467030752684195.
[I 2024-12-04 15:26:23,339] Trial 2256 finished with value: 0.4861469043327924 and parameters: {'n_estimators': 939, 'learning_rate': 0.08319959439724563, 'max_depth': 12, 'min_samples_split': 17, 'min_samples_leaf': 1, 'subsample': 0.9185331579386283, 'max_features': None}. Best is trial 1435 with value: 0.45467030752684195.
[I 2024-12-04 15:26:23,478] Trial 2261 finished with value: 0.6156216191258391 and parameters: {'n_estimators': 865, 'learning_rate': 0.014676381098601362, 'max_depth': 8, 'min_samples_split': 6, 'min_samples_leaf': 3, 'subsample': 0.8208242411380339, 'max_features': None}. Best is trial 1435 with value: 0.45467030752684195.
[I 2024-12-04 15:26:24,935] Trial 2263 finished with value: 0.62953628419523 and parameters: {'n_estimators': 783, 'learning_rate': 0.07581483688905914, 'max_depth': 10, 'min_samples_split': 18, 'min_samples_leaf': 3, 'subsample': 0.9927317181034984, 'max_features': None}. Best is trial 1435 with value: 0.45467030752684195.
[I 2024-12-04 15:26:27,808] Trial 2260 finished with value: 0.47718563765948263 and parameters: {'n_estimators': 959, 'learning_rate': 0.09934341414871141, 'max_depth': 12, 'min_samples_split': 18, 'min_samples_leaf': 1, 'subsample': 0.9241636168050263, 'max_features': None}. Best is trial 1435 with value: 0.45467030752684195.
[I 2024-12-04 15:26:28,374] Trial 2284 finished with value: 1.2064726560115107 and parameters: {'n_estimators': 281, 'learning_rate': 0.010958845763631578, 'max_depth': 9, 'min_samples_split': 10, 'min_samples_leaf': 9, 'subsample': 0.6229173581755005, 'max_features': 'log2'}. Best is trial 1435 with value: 0.45467030752684195.
[I 2024-12-04 15:26:28,376] Trial 2273 finished with value: 0.7617168740446645 and parameters: {'n_estimators': 728, 'learning_rate': 0.09868236729546116, 'max_depth': 3, 'min_samples_split': 19, 'min_samples_leaf': 10, 'subsample': 0.7749710811278002, 'max_features': None}. Best is trial 1435 with value: 0.45467030752684195.
[I 2024-12-04 15:26:31,148] Trial 2272 finished with value: 0.47446583148046734 and parameters: {'n_estimators': 758, 'learning_rate': 0.09966288642598552, 'max_depth': 12, 'min_samples_split': 19, 'min_samples_leaf': 1, 'subsample': 0.9643827615749565, 'max_features': None}. Best is trial 1435 with value: 0.45467030752684195.
