[I 2024-12-04 20:32:24,660] Trial 2202 finished with value: 0.5519030251715255 and parameters: {'n_estimators': 1000, 'max_depth': 34, 'min_samples_split': 17, 'min_samples_leaf': 3, 'max_features': None, 'bootstrap': False, 'criterion': 'absolute_error'}. Best is trial 1631 with value: 0.32128932742921457.
[I 2024-12-04 20:32:25,830] Trial 2250 finished with value: 0.6830136803398659 and parameters: {'n_estimators': 424, 'max_depth': 50, 'min_samples_split': 4, 'min_samples_leaf': 2, 'max_features': 'sqrt', 'bootstrap': False, 'criterion': 'squared_error'}. Best is trial 1631 with value: 0.32128932742921457.
[I 2024-12-04 20:32:27,587] Trial 2252 finished with value: 0.916116973132279 and parameters: {'n_estimators': 709, 'max_depth': 14, 'min_samples_split': 4, 'min_samples_leaf': 2, 'max_features': 'sqrt', 'bootstrap': True, 'criterion': 'squared_error'}. Best is trial 1631 with value: 0.32128932742921457.
[I 2024-12-04 20:32:28,374] Trial 2251 finished with value: 0.327412594047081 and parameters: {'n_estimators': 626, 'max_depth': 50, 'min_samples_split': 2, 'min_samples_leaf': 1, 'max_features': 'sqrt', 'bootstrap': False, 'criterion': 'squared_error'}. Best is trial 1631 with value: 0.32128932742921457.
[I 2024-12-04 20:32:29,314] Trial 2254 finished with value: 1.1223257608938395 and parameters: {'n_estimators': 134, 'max_depth': 15, 'min_samples_split': 2, 'min_samples_leaf': 2, 'max_features': 'log2', 'bootstrap': False, 'criterion': 'squared_error'}. Best is trial 1631 with value: 0.32128932742921457.
[I 2024-12-04 20:32:29,965] Trial 2253 finished with value: 0.36740241207798763 and parameters: {'n_estimators': 455, 'max_depth': 50, 'min_samples_split': 3, 'min_samples_leaf': 1, 'max_features': 'sqrt', 'bootstrap': False, 'criterion': 'squared_error'}. Best is trial 1631 with value: 0.32128932742921457.
[I 2024-12-04 20:32:32,069] Trial 2255 finished with value: 0.35625685470442986 and parameters: {'n_estimators': 464, 'max_depth': 43, 'min_samples_split': 2, 'min_samples_leaf': 1, 'max_features': 'sqrt', 'bootstrap': False, 'criterion': 'squared_error'}. Best is trial 1631 with value: 0.32128932742921457.
[I 2024-12-04 20:32:32,452] Trial 2256 finished with value: 0.35044570928060376 and parameters: {'n_estimators': 419, 'max_depth': 43, 'min_samples_split': 2, 'min_samples_leaf': 1, 'max_features': 'sqrt', 'bootstrap': False, 'criterion': 'squared_error'}. Best is trial 1631 with value: 0.32128932742921457.
[I 2024-12-04 20:32:34,299] Trial 2257 finished with value: 0.3458150697253777 and parameters: {'n_estimators': 371, 'max_depth': 43, 'min_samples_split': 2, 'min_samples_leaf': 1, 'max_features': 'sqrt', 'bootstrap': False, 'criterion': 'squared_error'}. Best is trial 1631 with value: 0.32128932742921457.
[I 2024-12-04 20:32:35,256] Trial 2258 finished with value: 0.328525102542536 and parameters: {'n_estimators': 459, 'max_depth': 50, 'min_samples_split': 2, 'min_samples_leaf': 1, 'max_features': 'sqrt', 'bootstrap': False, 'criterion': 'squared_error'}. Best is trial 1631 with value: 0.32128932742921457.
[I 2024-12-04 20:32:36,775] Trial 2259 finished with value: 0.3491652966669052 and parameters: {'n_estimators': 405, 'max_depth': 44, 'min_samples_split': 2, 'min_samples_leaf': 1, 'max_features': 'sqrt', 'bootstrap': False, 'criterion': 'squared_error'}. Best is trial 1631 with value: 0.32128932742921457.
[I 2024-12-04 20:32:37,681] Trial 2260 finished with value: 0.32369937626844103 and parameters: {'n_estimators': 391, 'max_depth': 50, 'min_samples_split': 2, 'min_samples_leaf': 1, 'max_features': 'sqrt', 'bootstrap': False, 'criterion': 'squared_error'}. Best is trial 1631 with value: 0.32128932742921457.
[I 2024-12-04 20:32:39,488] Trial 2262 finished with value: 0.3658603698361101 and parameters: {'n_estimators': 399, 'max_depth': 49, 'min_samples_split': 3, 'min_samples_leaf': 1, 'max_features': 'sqrt', 'bootstrap': False, 'criterion': 'squared_error'}. Best is trial 1631 with value: 0.32128932742921457.
[I 2024-12-04 20:32:41,439] Trial 2263 finished with value: 0.3358282323866703 and parameters: {'n_estimators': 357, 'max_depth': 45, 'min_samples_split': 2, 'min_samples_leaf': 1, 'max_features': 'sqrt', 'bootstrap': False, 'criterion': 'squared_error'}. Best is trial 1631 with value: 0.32128932742921457.
[I 2024-12-04 20:32:42,817] Trial 2264 finished with value: 1.3320977736699273 and parameters: {'n_estimators': 415, 'max_depth': 9, 'min_samples_split': 49, 'min_samples_leaf': 6, 'max_features': 'log2', 'bootstrap': True, 'criterion': 'absolute_error'}. Best is trial 1631 with value: 0.32128932742921457.
[I 2024-12-04 20:32:44,405] Trial 2265 finished with value: 0.3876892631578432 and parameters: {'n_estimators': 362, 'max_depth': 49, 'min_samples_split': 4, 'min_samples_leaf': 1, 'max_features': 'sqrt', 'bootstrap': False, 'criterion': 'squared_error'}. Best is trial 1631 with value: 0.32128932742921457.
[I 2024-12-04 20:32:45,845] Trial 2266 finished with value: 0.691224204476338 and parameters: {'n_estimators': 481, 'max_depth': 50, 'min_samples_split': 2, 'min_samples_leaf': 2, 'max_features': 'sqrt', 'bootstrap': False, 'criterion': 'squared_error'}. Best is trial 1631 with value: 0.32128932742921457.
[I 2024-12-04 20:32:45,849] Trial 2261 finished with value: 0.5954976551161507 and parameters: {'n_estimators': 590, 'max_depth': 48, 'min_samples_split': 2, 'min_samples_leaf': 7, 'max_features': None, 'bootstrap': True, 'criterion': 'absolute_error'}. Best is trial 1631 with value: 0.32128932742921457.
[I 2024-12-04 20:32:47,894] Trial 2268 finished with value: 0.7963359560056269 and parameters: {'n_estimators': 497, 'max_depth': 42, 'min_samples_split': 3, 'min_samples_leaf': 2, 'max_features': 'sqrt', 'bootstrap': True, 'criterion': 'squared_error'}. Best is trial 1631 with value: 0.32128932742921457.
[I 2024-12-04 20:32:48,151] Trial 2267 finished with value: 1.2530212171839403 and parameters: {'n_estimators': 369, 'max_depth': 23, 'min_samples_split': 6, 'min_samples_leaf': 2, 'max_features': 'log2', 'bootstrap': True, 'criterion': 'absolute_error'}. Best is trial 1631 with value: 0.32128932742921457.
[I 2024-12-04 20:32:50,416] Trial 2270 finished with value: 0.32382732250479473 and parameters: {'n_estimators': 358, 'max_depth': 50, 'min_samples_split': 2, 'min_samples_leaf': 1, 'max_features': 'sqrt', 'bootstrap': False, 'criterion': 'squared_error'}. Best is trial 1631 with value: 0.32128932742921457.
[I 2024-12-04 20:32:50,493] Trial 2269 finished with value: 0.32882969249087707 and parameters: {'n_estimators': 455, 'max_depth': 50, 'min_samples_split': 2, 'min_samples_leaf': 1, 'max_features': 'sqrt', 'bootstrap': False, 'criterion': 'squared_error'}. Best is trial 1631 with value: 0.32128932742921457.
[I 2024-12-04 20:32:52,836] Trial 2271 finished with value: 0.3233051337543817 and parameters: {'n_estimators': 364, 'max_depth': 50, 'min_samples_split': 2, 'min_samples_leaf': 1, 'max_features': 'sqrt', 'bootstrap': False, 'criterion': 'squared_error'}. Best is trial 1631 with value: 0.32128932742921457.
[I 2024-12-04 20:32:53,973] Trial 2272 finished with value: 0.4679672650182285 and parameters: {'n_estimators': 474, 'max_depth': 50, 'min_samples_split': 7, 'min_samples_leaf': 1, 'max_features': None, 'bootstrap': True, 'criterion': 'squared_error'}. Best is trial 1631 with value: 0.32128932742921457.
[I 2024-12-04 20:32:53,976] Trial 2273 finished with value: 0.6644914073277952 and parameters: {'n_estimators': 275, 'max_depth': 44, 'min_samples_split': 2, 'min_samples_leaf': 2, 'max_features': 'sqrt', 'bootstrap': False, 'criterion': 'squared_error'}. Best is trial 1631 with value: 0.32128932742921457.
[I 2024-12-04 20:32:55,742] Trial 2274 finished with value: 1.2527211120053265 and parameters: {'n_estimators': 495, 'max_depth': 8, 'min_samples_split': 5, 'min_samples_leaf': 5, 'max_features': 'log2', 'bootstrap': True, 'criterion': 'squared_error'}. Best is trial 1631 with value: 0.32128932742921457.
[I 2024-12-04 20:32:56,344] Trial 2275 finished with value: 0.39072220588045947 and parameters: {'n_estimators': 366, 'max_depth': 42, 'min_samples_split': 3, 'min_samples_leaf': 1, 'max_features': 'sqrt', 'bootstrap': False, 'criterion': 'squared_error'}. Best is trial 1631 with value: 0.32128932742921457.
[I 2024-12-04 20:32:57,814] Trial 2277 finished with value: 0.6775414762617664 and parameters: {'n_estimators': 353, 'max_depth': 42, 'min_samples_split': 2, 'min_samples_leaf': 2, 'max_features': 'sqrt', 'bootstrap': False, 'criterion': 'squared_error'}. Best is trial 1631 with value: 0.32128932742921457.
[I 2024-12-04 20:32:57,990] Trial 2276 finished with value: 0.4178161737897295 and parameters: {'n_estimators': 509, 'max_depth': 42, 'min_samples_split': 4, 'min_samples_leaf': 1, 'max_features': 'sqrt', 'bootstrap': False, 'criterion': 'squared_error'}. Best is trial 1631 with value: 0.32128932742921457.
[I 2024-12-04 20:33:00,025] Trial 2278 finished with value: 0.3224931465525256 and parameters: {'n_estimators': 345, 'max_depth': 50, 'min_samples_split': 2, 'min_samples_leaf': 1, 'max_features': 'sqrt', 'bootstrap': False, 'criterion': 'squared_error'}. Best is trial 1631 with value: 0.32128932742921457.
[I 2024-12-04 20:33:00,094] Trial 2279 finished with value: 0.3920068536517416 and parameters: {'n_estimators': 491, 'max_depth': 50, 'min_samples_split': 4, 'min_samples_leaf': 1, 'max_features': 'sqrt', 'bootstrap': False, 'criterion': 'squared_error'}. Best is trial 1631 with value: 0.32128932742921457.
[I 2024-12-04 20:33:01,727] Trial 2249 finished with value: 0.5707027653649623 and parameters: {'n_estimators': 744, 'max_depth': 16, 'min_samples_split': 35, 'min_samples_leaf': 4, 'max_features': None, 'bootstrap': False, 'criterion': 'absolute_error'}. Best is trial 1631 with value: 0.32128932742921457.
[I 2024-12-04 20:33:01,729] Trial 2281 finished with value: 0.6670085698600065 and parameters: {'n_estimators': 355, 'max_depth': 50, 'min_samples_split': 2, 'min_samples_leaf': 2, 'max_features': 'sqrt', 'bootstrap': False, 'criterion': 'squared_error'}. Best is trial 1631 with value: 0.32128932742921457.
[I 2024-12-04 20:33:04,026] Trial 2282 finished with value: 0.38658945342128254 and parameters: {'n_estimators': 372, 'max_depth': 50, 'min_samples_split': 4, 'min_samples_leaf': 1, 'max_features': 'sqrt', 'bootstrap': False, 'criterion': 'squared_error'}. Best is trial 1631 with value: 0.32128932742921457.
[I 2024-12-04 20:33:04,215] Trial 2283 finished with value: 0.8098142069295023 and parameters: {'n_estimators': 842, 'max_depth': 47, 'min_samples_split': 37, 'min_samples_leaf': 1, 'max_features': 'log2', 'bootstrap': False, 'criterion': 'squared_error'}. Best is trial 1631 with value: 0.32128932742921457.
[I 2024-12-04 20:33:05,631] Trial 2285 finished with value: 0.666978334152287 and parameters: {'n_estimators': 323, 'max_depth': 50, 'min_samples_split': 2, 'min_samples_leaf': 2, 'max_features': 'sqrt', 'bootstrap': False, 'criterion': 'squared_error'}. Best is trial 1631 with value: 0.32128932742921457.
[I 2024-12-04 20:33:05,722] Trial 2284 finished with value: 0.37582652715997583 and parameters: {'n_estimators': 283, 'max_depth': 44, 'min_samples_split': 3, 'min_samples_leaf': 1, 'max_features': 'sqrt', 'bootstrap': False, 'criterion': 'squared_error'}. Best is trial 1631 with value: 0.32128932742921457.
[I 2024-12-04 20:33:08,092] Trial 2286 finished with value: 0.34850739610110254 and parameters: {'n_estimators': 397, 'max_depth': 44, 'min_samples_split': 2, 'min_samples_leaf': 1, 'max_features': 'sqrt', 'bootstrap': False, 'criterion': 'squared_error'}. Best is trial 1631 with value: 0.32128932742921457.
[I 2024-12-04 20:33:08,741] Trial 2287 finished with value: 0.327341504507846 and parameters: {'n_estimators': 522, 'max_depth': 50, 'min_samples_split': 2, 'min_samples_leaf': 1, 'max_features': 'sqrt', 'bootstrap': False, 'criterion': 'squared_error'}. Best is trial 1631 with value: 0.32128932742921457.
[I 2024-12-04 20:33:10,305] Trial 2289 finished with value: 0.5341384464604845 and parameters: {'n_estimators': 321, 'max_depth': 49, 'min_samples_split': 3, 'min_samples_leaf': 1, 'max_features': 'log2', 'bootstrap': False, 'criterion': 'squared_error'}. Best is trial 1631 with value: 0.32128932742921457.
[I 2024-12-04 20:33:10,310] Trial 2288 finished with value: 0.3656042854726693 and parameters: {'n_estimators': 444, 'max_depth': 50, 'min_samples_split': 3, 'min_samples_leaf': 1, 'max_features': 'sqrt', 'bootstrap': False, 'criterion': 'squared_error'}. Best is trial 1631 with value: 0.32128932742921457.
[I 2024-12-04 20:33:12,720] Trial 2290 finished with value: 0.3233522130985557 and parameters: {'n_estimators': 410, 'max_depth': 50, 'min_samples_split': 2, 'min_samples_leaf': 1, 'max_features': 'sqrt', 'bootstrap': False, 'criterion': 'squared_error'}. Best is trial 1631 with value: 0.32128932742921457.
[I 2024-12-04 20:33:13,348] Trial 2291 finished with value: 0.43410478874358066 and parameters: {'n_estimators': 213, 'max_depth': 50, 'min_samples_split': 2, 'min_samples_leaf': 1, 'max_features': None, 'bootstrap': False, 'criterion': 'squared_error'}. Best is trial 1631 with value: 0.32128932742921457.
[I 2024-12-04 20:33:14,500] Trial 2292 finished with value: 0.35682030948945154 and parameters: {'n_estimators': 266, 'max_depth': 50, 'min_samples_split': 3, 'min_samples_leaf': 1, 'max_features': 'sqrt', 'bootstrap': False, 'criterion': 'squared_error'}. Best is trial 1631 with value: 0.32128932742921457.
[I 2024-12-04 20:33:15,136] Trial 2293 finished with value: 0.3949854405522557 and parameters: {'n_estimators': 296, 'max_depth': 43, 'min_samples_split': 3, 'min_samples_leaf': 1, 'max_features': 'sqrt', 'bootstrap': False, 'criterion': 'squared_error'}. Best is trial 1631 with value: 0.32128932742921457.
[I 2024-12-04 20:33:16,568] Trial 2295 finished with value: 0.667803096610122 and parameters: {'n_estimators': 353, 'max_depth': 50, 'min_samples_split': 3, 'min_samples_leaf': 2, 'max_features': 'sqrt', 'bootstrap': False, 'criterion': 'squared_error'}. Best is trial 1631 with value: 0.32128932742921457.
[I 2024-12-04 20:33:16,910] Trial 2294 finished with value: 0.3478845089614015 and parameters: {'n_estimators': 361, 'max_depth': 44, 'min_samples_split': 2, 'min_samples_leaf': 1, 'max_features': 'sqrt', 'bootstrap': False, 'criterion': 'squared_error'}. Best is trial 1631 with value: 0.32128932742921457.
[I 2024-12-04 20:33:18,740] Trial 2296 finished with value: 1.3333262886987824 and parameters: {'n_estimators': 723, 'max_depth': 29, 'min_samples_split': 44, 'min_samples_leaf': 6, 'max_features': 'log2', 'bootstrap': True, 'criterion': 'absolute_error'}. Best is trial 1631 with value: 0.32128932742921457.
[I 2024-12-04 20:33:19,030] Trial 2297 finished with value: 0.4196243534632254 and parameters: {'n_estimators': 417, 'max_depth': 45, 'min_samples_split': 3, 'min_samples_leaf': 1, 'max_features': 'sqrt', 'bootstrap': True, 'criterion': 'squared_error'}. Best is trial 1631 with value: 0.32128932742921457.
[I 2024-12-04 20:33:20,687] Trial 2298 finished with value: 0.6903036833034496 and parameters: {'n_estimators': 468, 'max_depth': 50, 'min_samples_split': 2, 'min_samples_leaf': 2, 'max_features': 'sqrt', 'bootstrap': False, 'criterion': 'squared_error'}. Best is trial 1631 with value: 0.32128932742921457.
[I 2024-12-04 20:33:21,129] Trial 2299 finished with value: 0.40516989390863345 and parameters: {'n_estimators': 333, 'max_depth': 33, 'min_samples_split': 2, 'min_samples_leaf': 1, 'max_features': 'sqrt', 'bootstrap': False, 'criterion': 'squared_error'}. Best is trial 1631 with value: 0.32128932742921457.
[I 2024-12-04 20:33:22,938] Trial 2301 finished with value: 0.3688005312664708 and parameters: {'n_estimators': 276, 'max_depth': 50, 'min_samples_split': 2, 'min_samples_leaf': 1, 'max_features': 'sqrt', 'bootstrap': True, 'criterion': 'squared_error'}. Best is trial 1631 with value: 0.32128932742921457.
[I 2024-12-04 20:33:24,183] Trial 2280 finished with value: 0.5646329398911086 and parameters: {'n_estimators': 616, 'max_depth': 30, 'min_samples_split': 5, 'min_samples_leaf': 6, 'max_features': None, 'bootstrap': False, 'criterion': 'absolute_error'}. Best is trial 1631 with value: 0.32128932742921457.
[I 2024-12-04 20:33:24,715] Trial 2302 finished with value: 0.3865790898716905 and parameters: {'n_estimators': 364, 'max_depth': 50, 'min_samples_split': 4, 'min_samples_leaf': 1, 'max_features': 'sqrt', 'bootstrap': False, 'criterion': 'squared_error'}. Best is trial 1631 with value: 0.32128932742921457.
[I 2024-12-04 20:33:25,852] Trial 2304 finished with value: 1.2849136280380429 and parameters: {'n_estimators': 201, 'max_depth': 50, 'min_samples_split': 4, 'min_samples_leaf': 14, 'max_features': 'log2', 'bootstrap': True, 'criterion': 'squared_error'}. Best is trial 1631 with value: 0.32128932742921457.
[I 2024-12-04 20:33:26,460] Trial 2303 finished with value: 0.3465513437580999 and parameters: {'n_estimators': 311, 'max_depth': 44, 'min_samples_split': 2, 'min_samples_leaf': 1, 'max_features': 'sqrt', 'bootstrap': False, 'criterion': 'squared_error'}. Best is trial 1631 with value: 0.32128932742921457.
[I 2024-12-04 20:33:28,340] Trial 2300 finished with value: 1.016653863106768 and parameters: {'n_estimators': 841, 'max_depth': 17, 'min_samples_split': 3, 'min_samples_leaf': 2, 'max_features': 'sqrt', 'bootstrap': True, 'criterion': 'absolute_error'}. Best is trial 1631 with value: 0.32128932742921457.
[I 2024-12-04 20:33:28,751] Trial 2306 finished with value: 1.341440164960671 and parameters: {'n_estimators': 960, 'max_depth': 28, 'min_samples_split': 11, 'min_samples_leaf': 15, 'max_features': 'log2', 'bootstrap': False, 'criterion': 'absolute_error'}. Best is trial 1631 with value: 0.32128932742921457.
[I 2024-12-04 20:33:29,596] Trial 2305 finished with value: 0.36511458915634265 and parameters: {'n_estimators': 624, 'max_depth': 40, 'min_samples_split': 2, 'min_samples_leaf': 1, 'max_features': 'sqrt', 'bootstrap': False, 'criterion': 'squared_error'}. Best is trial 1631 with value: 0.32128932742921457.
[I 2024-12-04 20:33:30,991] Trial 2307 finished with value: 0.3241499955982882 and parameters: {'n_estimators': 305, 'max_depth': 50, 'min_samples_split': 2, 'min_samples_leaf': 1, 'max_features': 'sqrt', 'bootstrap': False, 'criterion': 'squared_error'}. Best is trial 1631 with value: 0.32128932742921457.
[I 2024-12-04 20:33:31,084] Trial 2308 finished with value: 0.57809550742622 and parameters: {'n_estimators': 306, 'max_depth': 41, 'min_samples_split': 2, 'min_samples_leaf': 1, 'max_features': 'log2', 'bootstrap': False, 'criterion': 'squared_error'}. Best is trial 1631 with value: 0.32128932742921457.
[I 2024-12-04 20:33:32,353] Trial 2309 finished with value: 0.323108907688658 and parameters: {'n_estimators': 395, 'max_depth': 50, 'min_samples_split': 2, 'min_samples_leaf': 1, 'max_features': 'sqrt', 'bootstrap': False, 'criterion': 'squared_error'}. Best is trial 1631 with value: 0.32128932742921457.
[I 2024-12-04 20:33:32,704] Trial 2311 finished with value: 0.6213033753095675 and parameters: {'n_estimators': 106, 'max_depth': 49, 'min_samples_split': 27, 'min_samples_leaf': 1, 'max_features': None, 'bootstrap': True, 'criterion': 'squared_error'}. Best is trial 1631 with value: 0.32128932742921457.
[I 2024-12-04 20:33:34,085] Trial 2312 finished with value: 1.2647749306428941 and parameters: {'n_estimators': 942, 'max_depth': 30, 'min_samples_split': 2, 'min_samples_leaf': 9, 'max_features': 'log2', 'bootstrap': False, 'criterion': 'squared_error'}. Best is trial 1631 with value: 0.32128932742921457.
[I 2024-12-04 20:33:34,561] Trial 2313 finished with value: 0.6770583963040057 and parameters: {'n_estimators': 346, 'max_depth': 42, 'min_samples_split': 4, 'min_samples_leaf': 2, 'max_features': 'sqrt', 'bootstrap': False, 'criterion': 'squared_error'}. Best is trial 1631 with value: 0.32128932742921457.
[I 2024-12-04 20:33:35,372] Trial 2310 finished with value: 0.5373542998016747 and parameters: {'n_estimators': 406, 'max_depth': 49, 'min_samples_split': 2, 'min_samples_leaf': 2, 'max_features': None, 'bootstrap': False, 'criterion': 'squared_error'}. Best is trial 1631 with value: 0.32128932742921457.
[I 2024-12-04 20:33:36,683] Trial 2315 finished with value: 0.35642643591793816 and parameters: {'n_estimators': 293, 'max_depth': 50, 'min_samples_split': 3, 'min_samples_leaf': 1, 'max_features': 'sqrt', 'bootstrap': False, 'criterion': 'squared_error'}. Best is trial 1631 with value: 0.32128932742921457.
[I 2024-12-04 20:33:36,692] Trial 2314 finished with value: 0.3232888595106857 and parameters: {'n_estimators': 386, 'max_depth': 50, 'min_samples_split': 2, 'min_samples_leaf': 1, 'max_features': 'sqrt', 'bootstrap': False, 'criterion': 'squared_error'}. Best is trial 1631 with value: 0.32128932742921457.
[I 2024-12-04 20:33:37,081] Trial 2316 finished with value: 0.6936060476247308 and parameters: {'n_estimators': 412, 'max_depth': 41, 'min_samples_split': 2, 'min_samples_leaf': 2, 'max_features': 'sqrt', 'bootstrap': False, 'criterion': 'squared_error'}. Best is trial 1631 with value: 0.32128932742921457.
[I 2024-12-04 20:33:38,792] Trial 2318 finished with value: 1.1640461186705835 and parameters: {'n_estimators': 521, 'max_depth': 23, 'min_samples_split': 4, 'min_samples_leaf': 2, 'max_features': 'log2', 'bootstrap': True, 'criterion': 'squared_error'}. Best is trial 1631 with value: 0.32128932742921457.
[I 2024-12-04 20:33:39,934] Trial 2319 finished with value: 0.3237071069356298 and parameters: {'n_estimators': 334, 'max_depth': 50, 'min_samples_split': 2, 'min_samples_leaf': 1, 'max_features': 'sqrt', 'bootstrap': False, 'criterion': 'squared_error'}. Best is trial 1631 with value: 0.32128932742921457.
