[I 2024-12-04 15:02:13,311] Trial 752 finished with value: 1.2401112325329569 and parameters: {'kernel_type': 'Matern', 'length_scale': 1.5370475839326025, 'noise_level': 9.91488756921466e-05, 'constant_value': 0.0018561312595508509, 'nu': 2.5}. Best is trial 386 with value: 0.4872991004520934.
[I 2024-12-04 15:02:13,358] Trial 746 finished with value: 1.2401112326153203 and parameters: {'kernel_type': 'RBF', 'length_scale': 41399.20283907646, 'noise_level': 1.979357575402427e-10, 'constant_value': 25025.176218615718, 'nu': 0.5}. Best is trial 386 with value: 0.4872991004520934.
[I 2024-12-04 15:02:14,100] Trial 756 finished with value: 0.4883034187979068 and parameters: {'kernel_type': 'Matern', 'length_scale': 21.744794574521816, 'noise_level': 0.6619512169655386, 'constant_value': 1.4247740548470529, 'nu': 0.5}. Best is trial 386 with value: 0.4872991004520934.
[I 2024-12-04 15:02:14,510] Trial 751 finished with value: 0.527305164850069 and parameters: {'kernel_type': 'Matern', 'length_scale': 78.35180996803335, 'noise_level': 0.0318010918503455, 'constant_value': 1531.4813923445756, 'nu': 1.5}. Best is trial 386 with value: 0.4872991004520934.
[I 2024-12-04 15:02:15,800] Trial 754 finished with value: 1.2614547976339512 and parameters: {'kernel_type': 'RBF', 'length_scale': 2.1204700276840582, 'noise_level': 0.0008309978476774738, 'constant_value': 1.2616197515176719e-05, 'nu': 0.5}. Best is trial 386 with value: 0.4872991004520934.
[I 2024-12-04 15:02:16,446] Trial 755 finished with value: 0.48830344682766863 and parameters: {'kernel_type': 'Matern', 'length_scale': 3.6724991940544, 'noise_level': 0.041516289270713755, 'constant_value': 11.98151081918541, 'nu': 0.5}. Best is trial 386 with value: 0.4872991004520934.
[I 2024-12-04 15:02:16,498] Trial 757 finished with value: 1.2401112325594918 and parameters: {'kernel_type': 'RBF', 'length_scale': 4976.51839408433, 'noise_level': 0.003069627759023182, 'constant_value': 0.2864126724745, 'nu': 2.5}. Best is trial 386 with value: 0.4872991004520934.
[I 2024-12-04 15:02:17,023] Trial 753 finished with value: 0.6443862947008303 and parameters: {'kernel_type': 'RBF', 'length_scale': 15.423656778073076, 'noise_level': 0.025642260260381782, 'constant_value': 37523.3503635741, 'nu': 2.5}. Best is trial 386 with value: 0.4872991004520934.
[I 2024-12-04 15:02:17,982] Trial 758 finished with value: 0.4883034023193755 and parameters: {'kernel_type': 'Matern', 'length_scale': 25.44470443176478, 'noise_level': 0.002198677222124216, 'constant_value': 72.49881633907758, 'nu': 0.5}. Best is trial 386 with value: 0.4872991004520934.
[I 2024-12-04 15:02:18,361] Trial 760 finished with value: 0.4883034186987496 and parameters: {'kernel_type': 'Matern', 'length_scale': 114.04672251559424, 'noise_level': 0.8041439369425483, 'constant_value': 2721.2048572480862, 'nu': 0.5}. Best is trial 386 with value: 0.4872991004520934.
[I 2024-12-04 15:02:19,204] Trial 773 finished with value: 1.2614547884169849 and parameters: {'kernel_type': 'Matern', 'length_scale': 165.52074052311494, 'noise_level': 0.00011408221906923943, 'constant_value': 293.2481757832431, 'nu': 0.5}. Best is trial 386 with value: 0.4872991004520934.
[I 2024-12-04 15:02:19,205] Trial 768 finished with value: 0.4883033752305091 and parameters: {'kernel_type': 'Matern', 'length_scale': 1.7711384523460427, 'noise_level': 0.311840382094599, 'constant_value': 26.607221131370903, 'nu': 0.5}. Best is trial 386 with value: 0.4872991004520934.
[I 2024-12-04 15:02:19,636] Trial 763 finished with value: 0.4883034145509584 and parameters: {'kernel_type': 'Matern', 'length_scale': 286.3479915463776, 'noise_level': 0.0021352747362562794, 'constant_value': 435.9669904082751, 'nu': 0.5}. Best is trial 386 with value: 0.4872991004520934.
[I 2024-12-04 15:02:21,143] Trial 770 finished with value: 0.4883034234189689 and parameters: {'kernel_type': 'Matern', 'length_scale': 2.25169386072864, 'noise_level': 0.01003571976923165, 'constant_value': 0.08555919286089742, 'nu': 0.5}. Best is trial 386 with value: 0.4872991004520934.
[I 2024-12-04 15:02:21,906] Trial 764 finished with value: 0.48830338164446574 and parameters: {'kernel_type': 'Matern', 'length_scale': 189.3041836826766, 'noise_level': 0.012214522910150334, 'constant_value': 190.42674437629347, 'nu': 0.5}. Best is trial 386 with value: 0.4872991004520934.
[I 2024-12-04 15:02:23,482] Trial 777 finished with value: 0.48830342724324943 and parameters: {'kernel_type': 'Matern', 'length_scale': 2.2604441938566797, 'noise_level': 0.8601030094046157, 'constant_value': 882.399575724446, 'nu': 0.5}. Best is trial 386 with value: 0.4872991004520934.
[I 2024-12-04 15:02:23,758] Trial 766 finished with value: 0.4883031851710519 and parameters: {'kernel_type': 'Matern', 'length_scale': 535.9601603062458, 'noise_level': 0.6625798556223924, 'constant_value': 1115.2546921555058, 'nu': 0.5}. Best is trial 386 with value: 0.4872991004520934.
[I 2024-12-04 15:02:23,761] Trial 772 finished with value: 0.48830339942576506 and parameters: {'kernel_type': 'Matern', 'length_scale': 4.108185757073518, 'noise_level': 0.723402513382772, 'constant_value': 0.020584639418220006, 'nu': 0.5}. Best is trial 386 with value: 0.4872991004520934.
[I 2024-12-04 15:02:24,636] Trial 774 finished with value: 0.488303419310998 and parameters: {'kernel_type': 'Matern', 'length_scale': 225.0253128580969, 'noise_level': 0.7445956702682613, 'constant_value': 18.75156233024885, 'nu': 0.5}. Best is trial 386 with value: 0.4872991004520934.
[I 2024-12-04 15:02:25,124] Trial 771 finished with value: 1.2401112326930137 and parameters: {'kernel_type': 'Matern', 'length_scale': 0.006087621291399052, 'noise_level': 0.0004552128550161539, 'constant_value': 0.0077057085795916936, 'nu': 1.5}. Best is trial 386 with value: 0.4872991004520934.
[I 2024-12-04 15:02:26,085] Trial 767 finished with value: 0.4883031873683885 and parameters: {'kernel_type': 'Matern', 'length_scale': 1087.5364712380351, 'noise_level': 0.9998384289759521, 'constant_value': 5698.384510422752, 'nu': 0.5}. Best is trial 386 with value: 0.4872991004520934.
[I 2024-12-04 15:02:26,712] Trial 775 finished with value: 1.2401112325337484 and parameters: {'kernel_type': 'Matern', 'length_scale': 47731.69067056484, 'noise_level': 0.0007911513856843126, 'constant_value': 2.148070112549742, 'nu': 0.5}. Best is trial 386 with value: 0.4872991004520934.
[I 2024-12-04 15:02:26,713] Trial 781 finished with value: 0.4883034925808414 and parameters: {'kernel_type': 'Matern', 'length_scale': 101.47718134785586, 'noise_level': 0.2391497191915743, 'constant_value': 95.12235512110317, 'nu': 0.5}. Best is trial 386 with value: 0.4872991004520934.
[I 2024-12-04 15:02:27,169] Trial 762 finished with value: 0.4883033493638662 and parameters: {'kernel_type': 'Matern', 'length_scale': 19.630830187089835, 'noise_level': 0.009804507403675906, 'constant_value': 360.7115357940765, 'nu': 0.5}. Best is trial 386 with value: 0.4872991004520934.
[I 2024-12-04 15:02:27,314] Trial 759 finished with value: 0.4883032439947964 and parameters: {'kernel_type': 'Matern', 'length_scale': 620.4507156348681, 'noise_level': 0.00018396759799600191, 'constant_value': 212.00931684394706, 'nu': 0.5}. Best is trial 386 with value: 0.4872991004520934.
[I 2024-12-04 15:02:28,297] Trial 776 finished with value: 0.48830358710971283 and parameters: {'kernel_type': 'Matern', 'length_scale': 97.61980085479057, 'noise_level': 0.7232564839120603, 'constant_value': 177.09528631574958, 'nu': 0.5}. Best is trial 386 with value: 0.4872991004520934.
[I 2024-12-04 15:02:29,312] Trial 778 finished with value: 0.48830337692870296 and parameters: {'kernel_type': 'Matern', 'length_scale': 0.38938933110116836, 'noise_level': 0.005098771741116917, 'constant_value': 13.417241740028173, 'nu': 0.5}. Best is trial 386 with value: 0.4872991004520934.
[I 2024-12-04 15:02:29,466] Trial 779 finished with value: 0.4883034431795849 and parameters: {'kernel_type': 'Matern', 'length_scale': 2090.908930103328, 'noise_level': 0.01844462850062542, 'constant_value': 34.18472869199732, 'nu': 0.5}. Best is trial 386 with value: 0.4872991004520934.
[I 2024-12-04 15:02:29,651] Trial 780 finished with value: 0.48830341656135384 and parameters: {'kernel_type': 'Matern', 'length_scale': 485.8850766697482, 'noise_level': 0.13395080235911724, 'constant_value': 580.9127098568372, 'nu': 0.5}. Best is trial 386 with value: 0.4872991004520934.
[I 2024-12-04 15:02:29,810] Trial 761 finished with value: 0.48830344002466786 and parameters: {'kernel_type': 'Matern', 'length_scale': 176.09624878575923, 'noise_level': 0.0002740753216587581, 'constant_value': 1377.9450254107414, 'nu': 0.5}. Best is trial 386 with value: 0.4872991004520934.
[I 2024-12-04 15:02:31,914] Trial 786 finished with value: 0.4883034068948481 and parameters: {'kernel_type': 'Matern', 'length_scale': 922.0766631964979, 'noise_level': 0.2690098638360411, 'constant_value': 1028.4343453844444, 'nu': 0.5}. Best is trial 386 with value: 0.4872991004520934.
[I 2024-12-04 15:02:32,219] Trial 783 finished with value: 0.48830342328596404 and parameters: {'kernel_type': 'Matern', 'length_scale': 315.368958269857, 'noise_level': 0.30170312907275115, 'constant_value': 110.3335876665752, 'nu': 0.5}. Best is trial 386 with value: 0.4872991004520934.
[I 2024-12-04 15:02:33,619] Trial 765 finished with value: 1.2401112325059693 and parameters: {'kernel_type': 'RBF', 'length_scale': 119.58805384457078, 'noise_level': 4.564827833206813e-06, 'constant_value': 1.2837115206060426e-07, 'nu': 0.5}. Best is trial 386 with value: 0.4872991004520934.
[I 2024-12-04 15:02:33,941] Trial 782 finished with value: 0.48830342386732406 and parameters: {'kernel_type': 'Matern', 'length_scale': 167.8133983715918, 'noise_level': 0.7258207936176193, 'constant_value': 207.0664765091739, 'nu': 0.5}. Best is trial 386 with value: 0.4872991004520934.
[I 2024-12-04 15:02:34,847] Trial 785 finished with value: 0.4883034367469547 and parameters: {'kernel_type': 'Matern', 'length_scale': 758.6771547579358, 'noise_level': 0.4319927894860493, 'constant_value': 446.4767034082361, 'nu': 0.5}. Best is trial 386 with value: 0.4872991004520934.
[I 2024-12-04 15:02:35,324] Trial 769 finished with value: 0.6443853805520222 and parameters: {'kernel_type': 'RBF', 'length_scale': 850.3309966621498, 'noise_level': 0.9462590901625523, 'constant_value': 72.88625934681617, 'nu': 0.5}. Best is trial 386 with value: 0.4872991004520934.
[I 2024-12-04 15:02:35,562] Trial 790 finished with value: 0.48830341855306303 and parameters: {'kernel_type': 'Matern', 'length_scale': 14983.809627363007, 'noise_level': 0.8294131320337909, 'constant_value': 1148.5339182835546, 'nu': 0.5}. Best is trial 386 with value: 0.4872991004520934.
[I 2024-12-04 15:02:35,677] Trial 789 finished with value: 0.5663936489763994 and parameters: {'kernel_type': 'Matern', 'length_scale': 6291.845732030192, 'noise_level': 0.42352595341053945, 'constant_value': 98187.07239072122, 'nu': 2.5}. Best is trial 386 with value: 0.4872991004520934.
[I 2024-12-04 15:02:35,725] Trial 791 finished with value: 0.4883034187558111 and parameters: {'kernel_type': 'Matern', 'length_scale': 2054.119140208771, 'noise_level': 0.4583193715946861, 'constant_value': 2037.1080869004918, 'nu': 0.5}. Best is trial 386 with value: 0.4872991004520934.
[I 2024-12-04 15:02:37,265] Trial 787 finished with value: 0.4883034251956873 and parameters: {'kernel_type': 'Matern', 'length_scale': 29.937077689114552, 'noise_level': 0.5654367393731672, 'constant_value': 259.160822967569, 'nu': 0.5}. Best is trial 386 with value: 0.4872991004520934.
[I 2024-12-04 15:02:37,271] Trial 784 finished with value: 0.4883034807334884 and parameters: {'kernel_type': 'Matern', 'length_scale': 31274.50169778365, 'noise_level': 0.9665501663524191, 'constant_value': 8757.12667237261, 'nu': 0.5}. Best is trial 386 with value: 0.4872991004520934.
[I 2024-12-04 15:02:38,040] Trial 788 finished with value: 0.48830350858602206 and parameters: {'kernel_type': 'Matern', 'length_scale': 2346.5988444190693, 'noise_level': 0.8407638619573072, 'constant_value': 19826.452063060253, 'nu': 0.5}. Best is trial 386 with value: 0.4872991004520934.
[I 2024-12-04 15:02:39,016] Trial 799 finished with value: 0.48830328073081397 and parameters: {'kernel_type': 'Matern', 'length_scale': 130.41347886630655, 'noise_level': 0.3850833897298163, 'constant_value': 2913.2636643305186, 'nu': 0.5}. Best is trial 386 with value: 0.4872991004520934.
[I 2024-12-04 15:02:39,164] Trial 793 finished with value: 0.48830355728485014 and parameters: {'kernel_type': 'Matern', 'length_scale': 401.4274753569484, 'noise_level': 0.48471813113107637, 'constant_value': 6159.868091893663, 'nu': 0.5}. Best is trial 386 with value: 0.4872991004520934.
[I 2024-12-04 15:02:40,397] Trial 801 finished with value: 1.2401112326804067 and parameters: {'kernel_type': 'Matern', 'length_scale': 39752.12232715563, 'noise_level': 6.110311442347917e-05, 'constant_value': 302.78154229232575, 'nu': 0.5}. Best is trial 386 with value: 0.4872991004520934.
[I 2024-12-04 15:02:40,684] Trial 792 finished with value: 1.2401112325388133 and parameters: {'kernel_type': 'RBF', 'length_scale': 27268.090471378666, 'noise_level': 0.02725601485489883, 'constant_value': 149.387747880943, 'nu': 0.5}. Best is trial 386 with value: 0.4872991004520934.
[I 2024-12-04 15:02:42,381] Trial 800 finished with value: 1.2401112324179129 and parameters: {'kernel_type': 'Matern', 'length_scale': 0.012041968553847822, 'noise_level': 0.4439089327234853, 'constant_value': 5.608047162710529, 'nu': 0.5}. Best is trial 386 with value: 0.4872991004520934.
[I 2024-12-04 15:02:42,756] Trial 796 finished with value: 1.2401112313152227 and parameters: {'kernel_type': 'Matern', 'length_scale': 389.8357393596583, 'noise_level': 9.694211101901002e-06, 'constant_value': 6.185580326635409, 'nu': 0.5}. Best is trial 386 with value: 0.4872991004520934.
[I 2024-12-04 15:02:42,976] Trial 797 finished with value: 0.5663936685606771 and parameters: {'kernel_type': 'Matern', 'length_scale': 91.11134423563497, 'noise_level': 0.1504002978588575, 'constant_value': 265.3291634052271, 'nu': 2.5}. Best is trial 386 with value: 0.4872991004520934.
[I 2024-12-04 15:02:43,025] Trial 802 finished with value: 1.2401112321258545 and parameters: {'kernel_type': 'RBF', 'length_scale': 94.81654900709982, 'noise_level': 0.0001620393436450814, 'constant_value': 0.03725087397483203, 'nu': 0.5}. Best is trial 386 with value: 0.4872991004520934.
[I 2024-12-04 15:02:43,266] Trial 798 finished with value: 0.48830342157795326 and parameters: {'kernel_type': 'Matern', 'length_scale': 4308.304256442946, 'noise_level': 0.5159033236967953, 'constant_value': 45.48923974541935, 'nu': 0.5}. Best is trial 386 with value: 0.4872991004520934.
[I 2024-12-04 15:02:43,288] Trial 795 finished with value: 0.48830334107124956 and parameters: {'kernel_type': 'Matern', 'length_scale': 169.72080662847196, 'noise_level': 0.8872774864796511, 'constant_value': 35260.79125487355, 'nu': 0.5}. Best is trial 386 with value: 0.4872991004520934.
[I 2024-12-04 15:02:45,938] Trial 808 finished with value: 1.2401112331482622 and parameters: {'kernel_type': 'Matern', 'length_scale': 44.873959795426096, 'noise_level': 0.014220407195365853, 'constant_value': 0.01628617373510599, 'nu': 0.5}. Best is trial 386 with value: 0.4872991004520934.
[I 2024-12-04 15:02:46,067] Trial 809 finished with value: 1.2614543702025833 and parameters: {'kernel_type': 'Matern', 'length_scale': 0.0018508398925743273, 'noise_level': 1.283409924523482e-09, 'constant_value': 24754.54649855314, 'nu': 1.5}. Best is trial 386 with value: 0.4872991004520934.
[I 2024-12-04 15:02:46,301] Trial 803 finished with value: 0.4883037468777167 and parameters: {'kernel_type': 'Matern', 'length_scale': 757.6294167524047, 'noise_level': 0.6274568941823577, 'constant_value': 4958.626807649372, 'nu': 0.5}. Best is trial 386 with value: 0.4872991004520934.
[I 2024-12-04 15:02:46,545] Trial 807 finished with value: 0.48830369987768285 and parameters: {'kernel_type': 'Matern', 'length_scale': 69.95087827100076, 'noise_level': 0.8272282695460286, 'constant_value': 5488.228209500811, 'nu': 0.5}. Best is trial 386 with value: 0.4872991004520934.
[I 2024-12-04 15:02:48,024] Trial 806 finished with value: 0.4883034162335029 and parameters: {'kernel_type': 'Matern', 'length_scale': 68627.99866995944, 'noise_level': 0.899949538996442, 'constant_value': 1126.1848285445242, 'nu': 0.5}. Best is trial 386 with value: 0.4872991004520934.
[I 2024-12-04 15:02:49,415] Trial 804 finished with value: 1.2401112327576853 and parameters: {'kernel_type': 'Matern', 'length_scale': 66549.43298869213, 'noise_level': 0.012958058878594128, 'constant_value': 20.584799897330125, 'nu': 0.5}. Best is trial 386 with value: 0.4872991004520934.
[I 2024-12-04 15:02:49,591] Trial 794 finished with value: 0.4883034287394421 and parameters: {'kernel_type': 'Matern', 'length_scale': 1317.1508743281684, 'noise_level': 2.401913244532051e-05, 'constant_value': 257.2815436543452, 'nu': 0.5}. Best is trial 386 with value: 0.4872991004520934.
[I 2024-12-04 15:02:49,894] Trial 805 finished with value: 0.48830339701787834 and parameters: {'kernel_type': 'Matern', 'length_scale': 2.5026769984371033, 'noise_level': 0.0021140500567605187, 'constant_value': 0.5917860419825575, 'nu': 0.5}. Best is trial 386 with value: 0.4872991004520934.
[I 2024-12-04 15:02:49,987] Trial 814 finished with value: 0.4883031183891107 and parameters: {'kernel_type': 'Matern', 'length_scale': 982.9848026645705, 'noise_level': 0.7357853991060933, 'constant_value': 4114.914515421225, 'nu': 0.5}. Best is trial 386 with value: 0.4872991004520934.
[I 2024-12-04 15:02:50,829] Trial 812 finished with value: 0.48830336911101213 and parameters: {'kernel_type': 'Matern', 'length_scale': 31.400317027567404, 'noise_level': 0.6697052909182781, 'constant_value': 0.007679628157196909, 'nu': 0.5}. Best is trial 386 with value: 0.4872991004520934.
[I 2024-12-04 15:02:51,093] Trial 811 finished with value: 0.48830339457749095 and parameters: {'kernel_type': 'Matern', 'length_scale': 3.3453551055919246, 'noise_level': 0.883071363256782, 'constant_value': 387.1387313326196, 'nu': 0.5}. Best is trial 386 with value: 0.4872991004520934.
[I 2024-12-04 15:02:52,794] Trial 816 finished with value: 1.2401112322421817 and parameters: {'kernel_type': 'RBF', 'length_scale': 0.0006526606285599589, 'noise_level': 0.010856891315911553, 'constant_value': 12.40949803895294, 'nu': 2.5}. Best is trial 386 with value: 0.4872991004520934.
[I 2024-12-04 15:02:52,977] Trial 815 finished with value: 0.4883032878496328 and parameters: {'kernel_type': 'Matern', 'length_scale': 357.4481541747323, 'noise_level': 0.7243507835768237, 'constant_value': 6653.157027682214, 'nu': 0.5}. Best is trial 386 with value: 0.4872991004520934.
[I 2024-12-04 15:02:53,614] Trial 813 finished with value: 0.4883034163403539 and parameters: {'kernel_type': 'Matern', 'length_scale': 2762.1613591723235, 'noise_level': 0.6138282474926376, 'constant_value': 82085.8503075352, 'nu': 0.5}. Best is trial 386 with value: 0.4872991004520934.
[I 2024-12-04 15:02:54,275] Trial 820 finished with value: 0.48830340797036764 and parameters: {'kernel_type': 'Matern', 'length_scale': 126.61619476701637, 'noise_level': 0.6903812291670306, 'constant_value': 40223.35717481645, 'nu': 0.5}. Best is trial 386 with value: 0.4872991004520934.
[I 2024-12-04 15:02:55,333] Trial 827 finished with value: 0.4883024457962975 and parameters: {'kernel_type': 'Matern', 'length_scale': 1739.4071085290523, 'noise_level': 0.9856608715868422, 'constant_value': 14422.696540221934, 'nu': 0.5}. Best is trial 386 with value: 0.4872991004520934.
[I 2024-12-04 15:02:55,464] Trial 817 finished with value: 0.4883035825084268 and parameters: {'kernel_type': 'Matern', 'length_scale': 60.10964592989284, 'noise_level': 0.884805347408049, 'constant_value': 381.4122396049535, 'nu': 0.5}. Best is trial 386 with value: 0.4872991004520934.
[I 2024-12-04 15:02:55,737] Trial 819 finished with value: 0.48830342081153855 and parameters: {'kernel_type': 'Matern', 'length_scale': 2.166268343784475, 'noise_level': 0.7028503363676493, 'constant_value': 46.31223027397623, 'nu': 0.5}. Best is trial 386 with value: 0.4872991004520934.
[I 2024-12-04 15:02:55,834] Trial 824 finished with value: 0.4883034188129946 and parameters: {'kernel_type': 'Matern', 'length_scale': 2312.8731732245587, 'noise_level': 0.23638546117536557, 'constant_value': 51.242761271496356, 'nu': 0.5}. Best is trial 386 with value: 0.4872991004520934.
[I 2024-12-04 15:02:55,836] Trial 818 finished with value: 1.2614547859963354 and parameters: {'kernel_type': 'Matern', 'length_scale': 155.56035062797932, 'noise_level': 6.064415689647013e-06, 'constant_value': 24058.970525331963, 'nu': 0.5}. Best is trial 386 with value: 0.4872991004520934.
[I 2024-12-04 15:02:56,367] Trial 822 finished with value: 1.2401112319881247 and parameters: {'kernel_type': 'Matern', 'length_scale': 120.86417051104743, 'noise_level': 0.00022748066355113506, 'constant_value': 30.112335375200598, 'nu': 2.5}. Best is trial 386 with value: 0.4872991004520934.
[I 2024-12-04 15:02:57,385] Trial 823 finished with value: 0.6443853154123492 and parameters: {'kernel_type': 'RBF', 'length_scale': 11.951560716311283, 'noise_level': 0.9939901761626603, 'constant_value': 3938.3948339793233, 'nu': 0.5}. Best is trial 386 with value: 0.4872991004520934.
[I 2024-12-04 15:02:58,084] Trial 826 finished with value: 0.48830383934589755 and parameters: {'kernel_type': 'Matern', 'length_scale': 10988.479038054495, 'noise_level': 0.7330498380356029, 'constant_value': 13.425810146667954, 'nu': 0.5}. Best is trial 386 with value: 0.4872991004520934.
