[I 2024-12-04 00:16:19,749] Trial 1113 finished with value: 0.1423866030011481 and parameters: {'kernel': 'rbf', 'C': 94.95135366886305, 'gamma': 0.006759932040160533, 'epsilon': 0.003003016393588138}. Best is trial 973 with value: 0.1397919550170376.
[I 2024-12-04 00:16:19,792] Trial 1116 finished with value: 0.15474919438810178 and parameters: {'kernel': 'rbf', 'C': 20.38391327060612, 'gamma': 0.015412629690038383, 'epsilon': 0.003523316125209547}. Best is trial 973 with value: 0.1397919550170376.
[I 2024-12-04 00:16:20,623] Trial 1114 finished with value: 0.15482318255557662 and parameters: {'kernel': 'rbf', 'C': 97.33854658881259, 'gamma': 0.004817406638993312, 'epsilon': 0.0011656656348938562}. Best is trial 973 with value: 0.1397919550170376.
[I 2024-12-04 00:16:21,113] Trial 1118 finished with value: 0.15705683159764022 and parameters: {'kernel': 'rbf', 'C': 99.83171763605489, 'gamma': 0.004476947287641018, 'epsilon': 0.0024335001200161675}. Best is trial 973 with value: 0.1397919550170376.
[I 2024-12-04 00:16:21,472] Trial 1119 finished with value: 0.18576335965729382 and parameters: {'kernel': 'rbf', 'C': 16.41794570518225, 'gamma': 0.011159711151658504, 'epsilon': 0.0023459460886814123}. Best is trial 973 with value: 0.1397919550170376.
[I 2024-12-04 00:16:22,324] Trial 1121 finished with value: 0.5934577289171016 and parameters: {'kernel': 'sigmoid', 'C': 25.008510121790998, 'gamma': 0.00015589034592210368, 'epsilon': 0.025665717813585617}. Best is trial 973 with value: 0.1397919550170376.
[I 2024-12-04 00:16:22,702] Trial 1120 finished with value: 0.20675928246865763 and parameters: {'kernel': 'rbf', 'C': 19.33399340545643, 'gamma': 0.007841153779686366, 'epsilon': 0.0022245084215642766}. Best is trial 973 with value: 0.1397919550170376.
[I 2024-12-04 00:16:23,018] Trial 1117 finished with value: 0.1562763789370127 and parameters: {'kernel': 'rbf', 'C': 88.64938571413445, 'gamma': 0.013482107476011918, 'epsilon': 0.00397802473056262}. Best is trial 973 with value: 0.1397919550170376.
[I 2024-12-04 00:16:23,562] Trial 1123 finished with value: 0.26323271359507755 and parameters: {'kernel': 'rbf', 'C': 25.909769050693708, 'gamma': 0.002156866378703657, 'epsilon': 0.003245831270985638}. Best is trial 973 with value: 0.1397919550170376.
[I 2024-12-04 00:16:23,700] Trial 1122 finished with value: 0.15194369154750142 and parameters: {'kernel': 'rbf', 'C': 16.104704796762526, 'gamma': 0.021335553032431013, 'epsilon': 0.0012071017412659693}. Best is trial 973 with value: 0.1397919550170376.
[I 2024-12-04 00:16:23,759] Trial 1124 finished with value: 0.5023606887553528 and parameters: {'kernel': 'rbf', 'C': 0.512685030177237, 'gamma': 0.0032994097648876637, 'epsilon': 0.0011949168034914512}. Best is trial 973 with value: 0.1397919550170376.
[I 2024-12-04 00:16:25,606] Trial 1126 finished with value: 0.9985679311358994 and parameters: {'kernel': 'poly', 'C': 0.019180533307950103, 'gamma': 0.00019782022339510252, 'epsilon': 0.003613622769147201}. Best is trial 973 with value: 0.1397919550170376.
[I 2024-12-04 00:16:26,765] Trial 1127 finished with value: 0.18383037728644458 and parameters: {'kernel': 'rbf', 'C': 97.62173472560727, 'gamma': 0.0030496109754971994, 'epsilon': 0.004438405901720283}. Best is trial 973 with value: 0.1397919550170376.
[I 2024-12-04 00:16:28,048] Trial 1128 finished with value: 0.18554711232529045 and parameters: {'kernel': 'rbf', 'C': 15.830398626692837, 'gamma': 0.044207934194493204, 'epsilon': 0.005129859584470091}. Best is trial 973 with value: 0.1397919550170376.
[I 2024-12-04 00:16:28,273] Trial 1130 finished with value: 0.1498132882748196 and parameters: {'kernel': 'rbf', 'C': 26.12326861924547, 'gamma': 0.022057696621138437, 'epsilon': 0.0036535097802545325}. Best is trial 973 with value: 0.1397919550170376.
[I 2024-12-04 00:16:28,291] Trial 1129 finished with value: 0.1817010622378234 and parameters: {'kernel': 'rbf', 'C': 23.452773074283755, 'gamma': 0.037761481052345024, 'epsilon': 0.005626569399176466}. Best is trial 973 with value: 0.1397919550170376.
[I 2024-12-04 00:16:31,502] Trial 1132 finished with value: 0.14165218346971178 and parameters: {'kernel': 'rbf', 'C': 92.58252774654252, 'gamma': 0.006925887228781716, 'epsilon': 0.0011429121235636927}. Best is trial 973 with value: 0.1397919550170376.
[I 2024-12-04 00:16:31,685] Trial 1133 finished with value: 0.15831758657016115 and parameters: {'kernel': 'rbf', 'C': 16.132381128814288, 'gamma': 0.017675145818634292, 'epsilon': 0.0010660111887191388}. Best is trial 973 with value: 0.1397919550170376.
[I 2024-12-04 00:16:32,089] Trial 1131 finished with value: 0.18910998465479886 and parameters: {'kernel': 'rbf', 'C': 99.03648969721765, 'gamma': 0.03530354401120901, 'epsilon': 0.004687001115571344}. Best is trial 973 with value: 0.1397919550170376.
[I 2024-12-04 00:16:34,453] Trial 1136 finished with value: 0.9212590369197643 and parameters: {'kernel': 'poly', 'C': 62.5760772123543, 'gamma': 0.0005237059143130136, 'epsilon': 0.08399472085546793}. Best is trial 973 with value: 0.1397919550170376.
[I 2024-12-04 00:16:35,516] Trial 1134 finished with value: 0.16252924590464848 and parameters: {'kernel': 'rbf', 'C': 91.18339534276693, 'gamma': 0.014886110584583386, 'epsilon': 0.0022903840270772553}. Best is trial 973 with value: 0.1397919550170376.
[I 2024-12-04 00:16:36,228] Trial 1138 finished with value: 0.23125352075369476 and parameters: {'kernel': 'rbf', 'C': 28.044555565010484, 'gamma': 0.004159028552674364, 'epsilon': 0.0024599050004637346}. Best is trial 973 with value: 0.1397919550170376.
[I 2024-12-04 00:16:37,344] Trial 1139 finished with value: 0.25829061520449703 and parameters: {'kernel': 'rbf', 'C': 99.05612564918555, 'gamma': 0.0007303461308175521, 'epsilon': 0.0019835773066710473}. Best is trial 973 with value: 0.1397919550170376.
[I 2024-12-04 00:16:37,655] Trial 1137 finished with value: 0.15019117927621178 and parameters: {'kernel': 'rbf', 'C': 99.85478676337422, 'gamma': 0.005417477856500468, 'epsilon': 0.004416527999066287}. Best is trial 973 with value: 0.1397919550170376.
[I 2024-12-04 00:16:40,841] Trial 1143 finished with value: 0.20098299225955232 and parameters: {'kernel': 'rbf', 'C': 19.538663538881806, 'gamma': 0.008240311473241453, 'epsilon': 0.001158969589659185}. Best is trial 973 with value: 0.1397919550170376.
[I 2024-12-04 00:16:41,385] Trial 1125 finished with value: 0.34921254740045554 and parameters: {'kernel': 'linear', 'C': 5.642624420876639, 'gamma': 0.7890970652744547, 'epsilon': 0.02339621062006688}. Best is trial 973 with value: 0.1397919550170376.
[I 2024-12-04 00:16:44,205] Trial 1144 finished with value: 0.14866585861960663 and parameters: {'kernel': 'rbf', 'C': 97.98744605217986, 'gamma': 0.005625844122634187, 'epsilon': 0.005007498296281396}. Best is trial 973 with value: 0.1397919550170376.
[I 2024-12-04 00:16:46,021] Trial 1146 finished with value: 0.2879619068217719 and parameters: {'kernel': 'rbf', 'C': 15.668214431822086, 'gamma': 0.0021040611665470287, 'epsilon': 0.0026745657354187388}. Best is trial 973 with value: 0.1397919550170376.
[I 2024-12-04 00:16:48,486] Trial 1142 finished with value: 0.21669284364665642 and parameters: {'kernel': 'rbf', 'C': 99.15669775487684, 'gamma': 0.06667114617708947, 'epsilon': 0.0010989834032607915}. Best is trial 973 with value: 0.1397919550170376.
[I 2024-12-04 00:16:52,184] Trial 808 finished with value: 0.35408019757449605 and parameters: {'kernel': 'linear', 'C': 92.43893772515142, 'gamma': 0.010921697785961661, 'epsilon': 0.00367627390597196}. Best is trial 973 with value: 0.1397919550170376.
[I 2024-12-04 00:16:52,917] Trial 1148 finished with value: 0.14177675401517115 and parameters: {'kernel': 'rbf', 'C': 89.26420164531118, 'gamma': 0.00955659573122531, 'epsilon': 0.0040190469095206256}. Best is trial 973 with value: 0.1397919550170376.
[I 2024-12-04 00:16:53,385] Trial 1147 finished with value: 0.17169921414062186 and parameters: {'kernel': 'rbf', 'C': 90.94082942256813, 'gamma': 0.020260176647206765, 'epsilon': 0.001064119111826063}. Best is trial 973 with value: 0.1397919550170376.
[I 2024-12-04 00:16:54,893] Trial 1149 finished with value: 0.16115745005181892 and parameters: {'kernel': 'rbf', 'C': 63.486733279267774, 'gamma': 0.0057075888020700774, 'epsilon': 0.0010543825498700117}. Best is trial 973 with value: 0.1397919550170376.
[I 2024-12-04 00:16:55,237] Trial 1151 finished with value: 0.26213795027770537 and parameters: {'kernel': 'rbf', 'C': 16.23718506440619, 'gamma': 0.0035228655952691365, 'epsilon': 0.0029354221145620504}. Best is trial 973 with value: 0.1397919550170376.
[I 2024-12-04 00:16:55,886] Trial 1150 finished with value: 0.19304722191670287 and parameters: {'kernel': 'rbf', 'C': 14.992762843676102, 'gamma': 0.049818351306360746, 'epsilon': 0.001060276215430026}. Best is trial 973 with value: 0.1397919550170376.
[I 2024-12-04 00:16:56,326] Trial 722 finished with value: 0.3530867761587356 and parameters: {'kernel': 'linear', 'C': 82.38393229419069, 'gamma': 0.005602362959189507, 'epsilon': 0.002446908129683583}. Best is trial 973 with value: 0.1397919550170376.
[I 2024-12-04 00:16:56,654] Trial 1152 finished with value: 0.25707287278674906 and parameters: {'kernel': 'rbf', 'C': 23.719185627917945, 'gamma': 0.0028170202254906517, 'epsilon': 0.0031230366559160797}. Best is trial 973 with value: 0.1397919550170376.
[I 2024-12-04 00:16:58,402] Trial 1155 finished with value: 0.29337328010500274 and parameters: {'kernel': 'rbf', 'C': 13.299955422308322, 'gamma': 0.002227929260107633, 'epsilon': 0.0010603400502141858}. Best is trial 973 with value: 0.1397919550170376.
[I 2024-12-04 00:16:58,618] Trial 1153 finished with value: 0.14459184660318886 and parameters: {'kernel': 'rbf', 'C': 91.63569631820006, 'gamma': 0.006402104128718141, 'epsilon': 0.0010623788158965015}. Best is trial 973 with value: 0.1397919550170376.
[I 2024-12-04 00:17:01,931] Trial 1156 finished with value: 0.16063665263235907 and parameters: {'kernel': 'rbf', 'C': 96.48351197571009, 'gamma': 0.014011685667698412, 'epsilon': 0.0022714916130634976}. Best is trial 973 with value: 0.1397919550170376.
[I 2024-12-04 00:17:03,134] Trial 1158 finished with value: 0.1408712040744083 and parameters: {'kernel': 'rbf', 'C': 98.82183196647028, 'gamma': 0.007124689985197763, 'epsilon': 0.0028475882597905214}. Best is trial 973 with value: 0.1397919550170376.
[I 2024-12-04 00:17:03,196] Trial 1154 finished with value: 0.1867265676853411 and parameters: {'kernel': 'rbf', 'C': 86.53424979799036, 'gamma': 0.03348760893727807, 'epsilon': 0.0010241375540268331}. Best is trial 973 with value: 0.1397919550170376.
[I 2024-12-04 00:17:04,380] Trial 1159 finished with value: 1684.407480058457 and parameters: {'kernel': 'sigmoid', 'C': 93.50911209731755, 'gamma': 0.018436503215952683, 'epsilon': 0.0014047224238720186}. Best is trial 973 with value: 0.1397919550170376.
[I 2024-12-04 00:17:05,525] Trial 1103 finished with value: 0.3540473941264547 and parameters: {'kernel': 'linear', 'C': 16.88206689861743, 'gamma': 0.000299850121890669, 'epsilon': 0.0037718316905008134}. Best is trial 973 with value: 0.1397919550170376.
[I 2024-12-04 00:17:05,528] Trial 1161 finished with value: 0.2634602363962949 and parameters: {'kernel': 'rbf', 'C': 24.31604212318064, 'gamma': 0.002326968913868123, 'epsilon': 0.00100271115144411}. Best is trial 973 with value: 0.1397919550170376.
[I 2024-12-04 00:17:06,283] Trial 1162 finished with value: 0.5454566179670213 and parameters: {'kernel': 'rbf', 'C': 1.8443485696703392, 'gamma': 0.0006124663387460395, 'epsilon': 0.00935924460008643}. Best is trial 973 with value: 0.1397919550170376.
[I 2024-12-04 00:17:08,008] Trial 1164 finished with value: 0.3869162851549587 and parameters: {'kernel': 'rbf', 'C': 2.1560951636947783, 'gamma': 0.0034347482217461597, 'epsilon': 0.008350525856112094}. Best is trial 973 with value: 0.1397919550170376.
[I 2024-12-04 00:17:08,038] Trial 1160 finished with value: 0.15887696759895828 and parameters: {'kernel': 'rbf', 'C': 92.18977740573482, 'gamma': 0.013613252157202034, 'epsilon': 0.0012631379405194274}. Best is trial 973 with value: 0.1397919550170376.
[I 2024-12-04 00:17:09,396] Trial 1165 finished with value: 0.1482077655537597 and parameters: {'kernel': 'rbf', 'C': 21.377379911193092, 'gamma': 0.021111114144251448, 'epsilon': 0.003116468897700193}. Best is trial 973 with value: 0.1397919550170376.
[I 2024-12-04 00:17:10,104] Trial 1167 finished with value: 0.28210880163781094 and parameters: {'kernel': 'rbf', 'C': 17.627799804007406, 'gamma': 0.0020721346829914423, 'epsilon': 0.002085816294184485}. Best is trial 973 with value: 0.1397919550170376.
[I 2024-12-04 00:17:10,688] Trial 1163 finished with value: 0.15269963865060712 and parameters: {'kernel': 'rbf', 'C': 95.22796746466221, 'gamma': 0.012212266236152257, 'epsilon': 0.0033236839062153697}. Best is trial 973 with value: 0.1397919550170376.
[I 2024-12-04 00:17:10,689] Trial 1166 finished with value: 0.1538751719216346 and parameters: {'kernel': 'rbf', 'C': 16.19128988307601, 'gamma': 0.019731404129899332, 'epsilon': 0.0010550467627133782}. Best is trial 973 with value: 0.1397919550170376.
[I 2024-12-04 00:17:12,952] Trial 1170 finished with value: 0.2662452842824803 and parameters: {'kernel': 'rbf', 'C': 19.400705604290863, 'gamma': 0.002692093469892717, 'epsilon': 0.0010439286486937144}. Best is trial 973 with value: 0.1397919550170376.
[I 2024-12-04 00:17:13,001] Trial 1169 finished with value: 0.19464901185665484 and parameters: {'kernel': 'rbf', 'C': 91.0417690412726, 'gamma': 0.002779512151784032, 'epsilon': 0.001018648644823908}. Best is trial 973 with value: 0.1397919550170376.
[I 2024-12-04 00:17:13,244] Trial 1168 finished with value: 0.16368115459130333 and parameters: {'kernel': 'rbf', 'C': 94.23021210097146, 'gamma': 0.015224069782340114, 'epsilon': 0.0036033894890899216}. Best is trial 973 with value: 0.1397919550170376.
[I 2024-12-04 00:17:17,393] Trial 1172 finished with value: 0.15613436216470328 and parameters: {'kernel': 'rbf', 'C': 95.21939073750154, 'gamma': 0.004660827116388989, 'epsilon': 0.003300273886091404}. Best is trial 973 with value: 0.1397919550170376.
[I 2024-12-04 00:17:17,421] Trial 1173 finished with value: 0.16471901450483517 and parameters: {'kernel': 'rbf', 'C': 93.74630035882979, 'gamma': 0.004008773517292928, 'epsilon': 0.003367479621372288}. Best is trial 973 with value: 0.1397919550170376.
[I 2024-12-04 00:17:18,757] Trial 1171 finished with value: 0.17572527151634307 and parameters: {'kernel': 'rbf', 'C': 97.65257089305464, 'gamma': 0.023376560787325713, 'epsilon': 0.0010578917038921865}. Best is trial 973 with value: 0.1397919550170376.
[I 2024-12-04 00:17:21,022] Trial 1176 finished with value: 0.1494203466628544 and parameters: {'kernel': 'rbf', 'C': 21.374639353612718, 'gamma': 0.02234573467924367, 'epsilon': 0.0027069544908105833}. Best is trial 973 with value: 0.1397919550170376.
[I 2024-12-04 00:17:21,938] Trial 1175 finished with value: 0.15091766597515158 and parameters: {'kernel': 'rbf', 'C': 81.93291075436524, 'gamma': 0.00580800969276669, 'epsilon': 0.0010129117940874575}. Best is trial 973 with value: 0.1397919550170376.
[I 2024-12-04 00:17:22,185] Trial 1174 finished with value: 0.18115427165872883 and parameters: {'kernel': 'rbf', 'C': 97.28582610670433, 'gamma': 0.027360516955694192, 'epsilon': 0.002353561448164093}. Best is trial 973 with value: 0.1397919550170376.
[I 2024-12-04 00:17:22,966] Trial 1177 finished with value: 0.1476263259231821 and parameters: {'kernel': 'rbf', 'C': 36.310608111444154, 'gamma': 0.012369360065729092, 'epsilon': 0.001025096387810613}. Best is trial 973 with value: 0.1397919550170376.
[I 2024-12-04 00:17:23,982] Trial 1178 finished with value: 0.23061297430152478 and parameters: {'kernel': 'rbf', 'C': 93.00453326576942, 'gamma': 0.0013888310350241237, 'epsilon': 0.002512451763812977}. Best is trial 973 with value: 0.1397919550170376.
[I 2024-12-04 00:17:25,907] Trial 1180 finished with value: 0.16103599365663507 and parameters: {'kernel': 'rbf', 'C': 16.93918489670768, 'gamma': 0.015719389461603457, 'epsilon': 0.006227964613783177}. Best is trial 973 with value: 0.1397919550170376.
[I 2024-12-04 00:17:26,972] Trial 1181 finished with value: 0.1756117661742061 and parameters: {'kernel': 'rbf', 'C': 28.630407587092318, 'gamma': 0.008298252953837479, 'epsilon': 0.0010456818550674297}. Best is trial 973 with value: 0.1397919550170376.
[I 2024-12-04 00:17:26,996] Trial 1179 finished with value: 0.1410599001151882 and parameters: {'kernel': 'rbf', 'C': 96.61231924895587, 'gamma': 0.006975544528037845, 'epsilon': 0.002460889793226595}. Best is trial 973 with value: 0.1397919550170376.
[I 2024-12-04 00:17:26,999] Trial 1182 finished with value: 0.18467664173805867 and parameters: {'kernel': 'rbf', 'C': 13.168489534373471, 'gamma': 0.013413168608140486, 'epsilon': 0.0030074269679225166}. Best is trial 973 with value: 0.1397919550170376.
[I 2024-12-04 00:17:27,886] Trial 784 finished with value: 0.352382367281297 and parameters: {'kernel': 'linear', 'C': 79.74034774661784, 'gamma': 0.003913455459999668, 'epsilon': 0.0011443894105367283}. Best is trial 973 with value: 0.1397919550170376.
[I 2024-12-04 00:17:29,805] Trial 1184 finished with value: 0.34964348609340024 and parameters: {'kernel': 'rbf', 'C': 1.9804212879498049, 'gamma': 0.00550586505744833, 'epsilon': 0.0028170500936025}. Best is trial 973 with value: 0.1397919550170376.
[I 2024-12-04 00:17:30,104] Trial 1185 finished with value: 0.23785400397729947 and parameters: {'kernel': 'rbf', 'C': 18.722639924547643, 'gamma': 0.005348464117285671, 'epsilon': 0.007873219407757733}. Best is trial 973 with value: 0.1397919550170376.
[I 2024-12-04 00:17:31,130] Trial 1187 finished with value: 0.24990784694738974 and parameters: {'kernel': 'rbf', 'C': 20.415831466195776, 'gamma': 0.003911464193424238, 'epsilon': 0.002937708542732464}. Best is trial 973 with value: 0.1397919550170376.
[I 2024-12-04 00:17:31,295] Trial 1186 finished with value: 0.1497031441421831 and parameters: {'kernel': 'rbf', 'C': 25.853981070793985, 'gamma': 0.014554111875853976, 'epsilon': 0.007567278138422612}. Best is trial 973 with value: 0.1397919550170376.
[I 2024-12-04 00:17:32,532] Trial 1183 finished with value: 0.14049022067168176 and parameters: {'kernel': 'rbf', 'C': 97.55204202482035, 'gamma': 0.009109683368330092, 'epsilon': 0.001306469475193093}. Best is trial 973 with value: 0.1397919550170376.
[I 2024-12-04 00:17:33,274] Trial 1188 finished with value: 0.18493920486241466 and parameters: {'kernel': 'rbf', 'C': 18.35839136563331, 'gamma': 0.010341771872740855, 'epsilon': 0.001964769860486452}. Best is trial 973 with value: 0.1397919550170376.
[I 2024-12-04 00:17:33,342] Trial 1145 finished with value: 0.3521028169229082 and parameters: {'kernel': 'linear', 'C': 15.809817295997753, 'gamma': 0.006141305265991827, 'epsilon': 0.0049617538341013775}. Best is trial 973 with value: 0.1397919550170376.
[I 2024-12-04 00:17:33,813] Trial 1190 finished with value: 0.2666987938532023 and parameters: {'kernel': 'rbf', 'C': 18.608702227848386, 'gamma': 0.00278863935519018, 'epsilon': 0.002416298192671793}. Best is trial 973 with value: 0.1397919550170376.
[I 2024-12-04 00:17:35,111] Trial 1192 finished with value: 0.23347318408574524 and parameters: {'kernel': 'rbf', 'C': 26.622036985591084, 'gamma': 0.004188400488864961, 'epsilon': 0.0023190877687749183}. Best is trial 973 with value: 0.1397919550170376.
[I 2024-12-04 00:17:35,782] Trial 1195 finished with value: 0.42746723666118636 and parameters: {'kernel': 'linear', 'C': 0.031584663706646206, 'gamma': 0.10788877980629408, 'epsilon': 0.24651395913752708}. Best is trial 973 with value: 0.1397919550170376.
[I 2024-12-04 00:17:36,148] Trial 1189 finished with value: 0.14892806104437972 and parameters: {'kernel': 'rbf', 'C': 99.42383756018681, 'gamma': 0.011397846924774406, 'epsilon': 0.0042154474930538414}. Best is trial 973 with value: 0.1397919550170376.
[I 2024-12-04 00:17:36,243] Trial 1194 finished with value: 311.0109248991525 and parameters: {'kernel': 'sigmoid', 'C': 90.41141389681616, 'gamma': 0.0028873672204402954, 'epsilon': 0.006404090881906109}. Best is trial 973 with value: 0.1397919550170376.
[I 2024-12-04 00:17:36,262] Trial 1191 finished with value: 0.14943787021738744 and parameters: {'kernel': 'rbf', 'C': 95.65216256885704, 'gamma': 0.01167952564549022, 'epsilon': 0.0043672339496281815}. Best is trial 973 with value: 0.1397919550170376.
[I 2024-12-04 00:17:37,170] Trial 1196 finished with value: 0.7575309499546162 and parameters: {'kernel': 'poly', 'C': 95.59230684368201, 'gamma': 0.0025693451430897243, 'epsilon': 0.2542981276787582}. Best is trial 973 with value: 0.1397919550170376.
[I 2024-12-04 00:17:38,161] Trial 1193 finished with value: 0.1405971816840517 and parameters: {'kernel': 'rbf', 'C': 99.2075048381905, 'gamma': 0.006981705241599807, 'epsilon': 0.0014144320074444211}. Best is trial 973 with value: 0.1397919550170376.
[I 2024-12-04 00:17:39,453] Trial 1197 finished with value: 0.1567236017609066 and parameters: {'kernel': 'rbf', 'C': 21.76031407146508, 'gamma': 0.014172526967859676, 'epsilon': 0.001020414076980169}. Best is trial 973 with value: 0.1397919550170376.
[I 2024-12-04 00:17:41,024] Trial 1199 finished with value: 0.24542069668075792 and parameters: {'kernel': 'rbf', 'C': 91.6718640153585, 'gamma': 0.11040646482975772, 'epsilon': 0.004784478639189331}. Best is trial 973 with value: 0.1397919550170376.
[I 2024-12-04 00:17:41,164] Trial 1202 finished with value: 0.2018983925001759 and parameters: {'kernel': 'rbf', 'C': 93.47620706254895, 'gamma': 0.0023675233534950087, 'epsilon': 0.005791945935588969}. Best is trial 973 with value: 0.1397919550170376.
