[I 2024-12-04 13:11:46,475] Trial 1539 finished with value: 0.4835086196628024 and parameters: {'n_estimators': 1291, 'learning_rate': 0.02706951400630772, 'max_depth': 3, 'min_samples_split': 11, 'min_samples_leaf': 9, 'subsample': 0.8073908429541549, 'max_features': 'sqrt'}. Best is trial 1389 with value: 0.22332552856343169.
[I 2024-12-04 13:11:49,228] Trial 1540 finished with value: 0.23607097308438071 and parameters: {'n_estimators': 1247, 'learning_rate': 0.049404389865539904, 'max_depth': 9, 'min_samples_split': 6, 'min_samples_leaf': 1, 'subsample': 0.6556243136361929, 'max_features': 'sqrt'}. Best is trial 1389 with value: 0.22332552856343169.
[I 2024-12-04 13:11:55,640] Trial 1537 finished with value: 0.2616651839798805 and parameters: {'n_estimators': 1491, 'learning_rate': 0.05842697791964655, 'max_depth': 5, 'min_samples_split': 4, 'min_samples_leaf': 1, 'subsample': 0.8450434819151837, 'max_features': 'sqrt'}. Best is trial 1389 with value: 0.22332552856343169.
[I 2024-12-04 13:11:57,310] Trial 1538 finished with value: 0.24235662267030197 and parameters: {'n_estimators': 1466, 'learning_rate': 0.058405700624683865, 'max_depth': 7, 'min_samples_split': 7, 'min_samples_leaf': 1, 'subsample': 0.7440670338931957, 'max_features': 'sqrt'}. Best is trial 1389 with value: 0.22332552856343169.
[I 2024-12-04 13:12:02,232] Trial 1545 finished with value: 0.26273928550971376 and parameters: {'n_estimators': 1171, 'learning_rate': 0.06876057134259479, 'max_depth': 10, 'min_samples_split': 2, 'min_samples_leaf': 1, 'subsample': 0.6931983649399528, 'max_features': 'sqrt'}. Best is trial 1389 with value: 0.22332552856343169.
[I 2024-12-04 13:12:07,232] Trial 1546 finished with value: 0.3624591841302591 and parameters: {'n_estimators': 1291, 'learning_rate': 0.09821471895881416, 'max_depth': 6, 'min_samples_split': 4, 'min_samples_leaf': 3, 'subsample': 0.6771387428267728, 'max_features': 'sqrt'}. Best is trial 1389 with value: 0.22332552856343169.
[I 2024-12-04 13:12:10,300] Trial 1541 finished with value: 0.23396233394641727 and parameters: {'n_estimators': 1496, 'learning_rate': 0.09026484847659186, 'max_depth': 6, 'min_samples_split': 2, 'min_samples_leaf': 1, 'subsample': 0.8117206930064325, 'max_features': 'sqrt'}. Best is trial 1389 with value: 0.22332552856343169.
[I 2024-12-04 13:12:12,151] Trial 1553 finished with value: 0.30311568805041617 and parameters: {'n_estimators': 1063, 'learning_rate': 0.057390597302070814, 'max_depth': 7, 'min_samples_split': 2, 'min_samples_leaf': 2, 'subsample': 0.7776843760829454, 'max_features': 'log2'}. Best is trial 1389 with value: 0.22332552856343169.
[I 2024-12-04 13:12:12,235] Trial 1544 finished with value: 0.23180407468818767 and parameters: {'n_estimators': 1402, 'learning_rate': 0.08014987519921811, 'max_depth': 5, 'min_samples_split': 2, 'min_samples_leaf': 1, 'subsample': 0.7028670788591231, 'max_features': 'sqrt'}. Best is trial 1389 with value: 0.22332552856343169.
[I 2024-12-04 13:12:17,655] Trial 1550 finished with value: 0.27969645944458577 and parameters: {'n_estimators': 1188, 'learning_rate': 0.09131724435513511, 'max_depth': 10, 'min_samples_split': 8, 'min_samples_leaf': 1, 'subsample': 0.7796622766202718, 'max_features': 'sqrt'}. Best is trial 1389 with value: 0.22332552856343169.
[I 2024-12-04 13:12:20,982] Trial 1548 finished with value: 0.2600537653786958 and parameters: {'n_estimators': 1365, 'learning_rate': 0.062202377359901743, 'max_depth': 6, 'min_samples_split': 2, 'min_samples_leaf': 1, 'subsample': 0.7266896260655274, 'max_features': 'sqrt'}. Best is trial 1389 with value: 0.22332552856343169.
[I 2024-12-04 13:12:20,998] Trial 1547 finished with value: 0.31362643778122246 and parameters: {'n_estimators': 1439, 'learning_rate': 0.09167770092276271, 'max_depth': 6, 'min_samples_split': 5, 'min_samples_leaf': 2, 'subsample': 0.6581990359262159, 'max_features': 'sqrt'}. Best is trial 1389 with value: 0.22332552856343169.
[I 2024-12-04 13:12:24,386] Trial 1561 finished with value: 0.44847864885371463 and parameters: {'n_estimators': 981, 'learning_rate': 0.06913830070242075, 'max_depth': 12, 'min_samples_split': 18, 'min_samples_leaf': 7, 'subsample': 0.8555341179084273, 'max_features': 'log2'}. Best is trial 1389 with value: 0.22332552856343169.
[I 2024-12-04 13:12:28,626] Trial 1554 finished with value: 0.5362376794348885 and parameters: {'n_estimators': 1281, 'learning_rate': 0.08447654076939139, 'max_depth': 8, 'min_samples_split': 15, 'min_samples_leaf': 10, 'subsample': 0.7136493845228962, 'max_features': 'log2'}. Best is trial 1389 with value: 0.22332552856343169.
[I 2024-12-04 13:12:28,651] Trial 1549 finished with value: 0.33545255157099 and parameters: {'n_estimators': 1330, 'learning_rate': 0.019717632444289937, 'max_depth': 8, 'min_samples_split': 18, 'min_samples_leaf': 2, 'subsample': 0.8560844951468884, 'max_features': None}. Best is trial 1389 with value: 0.22332552856343169.
[I 2024-12-04 13:12:30,384] Trial 1551 finished with value: 0.28599172069181134 and parameters: {'n_estimators': 1329, 'learning_rate': 0.0728128589254258, 'max_depth': 5, 'min_samples_split': 17, 'min_samples_leaf': 1, 'subsample': 0.6339037382210096, 'max_features': None}. Best is trial 1389 with value: 0.22332552856343169.
[I 2024-12-04 13:12:31,376] Trial 1552 finished with value: 0.24735531167023417 and parameters: {'n_estimators': 1354, 'learning_rate': 0.07205572188550455, 'max_depth': 7, 'min_samples_split': 2, 'min_samples_leaf': 1, 'subsample': 0.6642745746343628, 'max_features': 'sqrt'}. Best is trial 1389 with value: 0.22332552856343169.
[I 2024-12-04 13:12:31,744] Trial 1557 finished with value: 0.3543909053841768 and parameters: {'n_estimators': 1220, 'learning_rate': 0.04647105336968785, 'max_depth': 6, 'min_samples_split': 2, 'min_samples_leaf': 4, 'subsample': 0.7665221325888506, 'max_features': 'sqrt'}. Best is trial 1389 with value: 0.22332552856343169.
[I 2024-12-04 13:12:34,676] Trial 1565 finished with value: 0.2623758166768266 and parameters: {'n_estimators': 826, 'learning_rate': 0.03919196924907169, 'max_depth': 11, 'min_samples_split': 13, 'min_samples_leaf': 1, 'subsample': 0.8359290289934878, 'max_features': 'sqrt'}. Best is trial 1389 with value: 0.22332552856343169.
[I 2024-12-04 13:12:36,057] Trial 1562 finished with value: 0.26089322722394 and parameters: {'n_estimators': 1098, 'learning_rate': 0.047861209897287996, 'max_depth': 9, 'min_samples_split': 13, 'min_samples_leaf': 1, 'subsample': 0.6132423128307168, 'max_features': 'sqrt'}. Best is trial 1389 with value: 0.22332552856343169.
[I 2024-12-04 13:12:36,067] Trial 1555 finished with value: 0.30432610676346356 and parameters: {'n_estimators': 1335, 'learning_rate': 0.09450000848417986, 'max_depth': 9, 'min_samples_split': 2, 'min_samples_leaf': 2, 'subsample': 0.6026489451609374, 'max_features': 'sqrt'}. Best is trial 1389 with value: 0.22332552856343169.
[I 2024-12-04 13:12:42,335] Trial 1559 finished with value: 0.28313125893921065 and parameters: {'n_estimators': 1294, 'learning_rate': 0.0982307426534095, 'max_depth': 7, 'min_samples_split': 2, 'min_samples_leaf': 2, 'subsample': 0.9572546215823836, 'max_features': 'sqrt'}. Best is trial 1389 with value: 0.22332552856343169.
[I 2024-12-04 13:12:43,805] Trial 1583 finished with value: 0.4285889178670234 and parameters: {'n_estimators': 157, 'learning_rate': 0.09077854771483057, 'max_depth': 11, 'min_samples_split': 12, 'min_samples_leaf': 5, 'subsample': 0.6373908305688111, 'max_features': 'sqrt'}. Best is trial 1389 with value: 0.22332552856343169.
[I 2024-12-04 13:12:43,820] Trial 1556 finished with value: 0.289155540303078 and parameters: {'n_estimators': 1379, 'learning_rate': 0.057673383103956984, 'max_depth': 9, 'min_samples_split': 6, 'min_samples_leaf': 2, 'subsample': 0.8970688468547175, 'max_features': 'sqrt'}. Best is trial 1389 with value: 0.22332552856343169.
[I 2024-12-04 13:12:47,254] Trial 1560 finished with value: 0.4281485354560212 and parameters: {'n_estimators': 1311, 'learning_rate': 0.01135163018015971, 'max_depth': 3, 'min_samples_split': 14, 'min_samples_leaf': 7, 'subsample': 0.7410773913765862, 'max_features': None}. Best is trial 1389 with value: 0.22332552856343169.
[I 2024-12-04 13:12:50,069] Trial 1558 finished with value: 0.261028522306914 and parameters: {'n_estimators': 1422, 'learning_rate': 0.06012865577449541, 'max_depth': 8, 'min_samples_split': 6, 'min_samples_leaf': 1, 'subsample': 0.6900846159834371, 'max_features': 'log2'}. Best is trial 1389 with value: 0.22332552856343169.
[I 2024-12-04 13:12:51,477] Trial 1566 finished with value: 0.28528245056337903 and parameters: {'n_estimators': 1136, 'learning_rate': 0.0992812444806486, 'max_depth': 5, 'min_samples_split': 5, 'min_samples_leaf': 2, 'subsample': 0.8417423120279515, 'max_features': 'sqrt'}. Best is trial 1389 with value: 0.22332552856343169.
[I 2024-12-04 13:12:52,478] Trial 1567 finished with value: 0.858334093052381 and parameters: {'n_estimators': 1096, 'learning_rate': 0.014856210826517379, 'max_depth': 8, 'min_samples_split': 10, 'min_samples_leaf': 7, 'subsample': 0.9785102577344819, 'max_features': 'log2'}. Best is trial 1389 with value: 0.22332552856343169.
[I 2024-12-04 13:12:57,786] Trial 1564 finished with value: 0.2753547390613753 and parameters: {'n_estimators': 1251, 'learning_rate': 0.09867397763134263, 'max_depth': 8, 'min_samples_split': 7, 'min_samples_leaf': 2, 'subsample': 0.7929625618958979, 'max_features': 'sqrt'}. Best is trial 1389 with value: 0.22332552856343169.
[I 2024-12-04 13:13:03,008] Trial 1570 finished with value: 0.42483654814244454 and parameters: {'n_estimators': 1098, 'learning_rate': 0.043083098289366156, 'max_depth': 3, 'min_samples_split': 3, 'min_samples_leaf': 7, 'subsample': 0.7835197515894143, 'max_features': None}. Best is trial 1389 with value: 0.22332552856343169.
[I 2024-12-04 13:13:09,082] Trial 1563 finished with value: 0.23352151058322526 and parameters: {'n_estimators': 1490, 'learning_rate': 0.08830273574815718, 'max_depth': 6, 'min_samples_split': 2, 'min_samples_leaf': 1, 'subsample': 0.7163733583741395, 'max_features': 'sqrt'}. Best is trial 1389 with value: 0.22332552856343169.
[I 2024-12-04 13:13:17,332] Trial 1572 finished with value: 0.28503895793645034 and parameters: {'n_estimators': 1292, 'learning_rate': 0.09417616773182182, 'max_depth': 8, 'min_samples_split': 2, 'min_samples_leaf': 2, 'subsample': 0.8969132710465372, 'max_features': 'sqrt'}. Best is trial 1389 with value: 0.22332552856343169.
[I 2024-12-04 13:13:18,457] Trial 1569 finished with value: 0.47605479962732905 and parameters: {'n_estimators': 1352, 'learning_rate': 0.02108191046515039, 'max_depth': 4, 'min_samples_split': 3, 'min_samples_leaf': 10, 'subsample': 0.9470798155703785, 'max_features': None}. Best is trial 1389 with value: 0.22332552856343169.
[I 2024-12-04 13:13:19,219] Trial 1568 finished with value: 0.33451575844960924 and parameters: {'n_estimators': 1323, 'learning_rate': 0.06052636503755071, 'max_depth': 8, 'min_samples_split': 5, 'min_samples_leaf': 1, 'subsample': 0.683180247281935, 'max_features': None}. Best is trial 1389 with value: 0.22332552856343169.
[I 2024-12-04 13:13:21,291] Trial 1599 finished with value: 0.9790024783446364 and parameters: {'n_estimators': 150, 'learning_rate': 0.02251856317076039, 'max_depth': 6, 'min_samples_split': 7, 'min_samples_leaf': 1, 'subsample': 0.8597671546122392, 'max_features': 'log2'}. Best is trial 1389 with value: 0.22332552856343169.
[I 2024-12-04 13:13:21,333] Trial 1600 finished with value: 0.42711238969149884 and parameters: {'n_estimators': 119, 'learning_rate': 0.06856383551178742, 'max_depth': 9, 'min_samples_split': 20, 'min_samples_leaf': 5, 'subsample': 0.6649547489434267, 'max_features': None}. Best is trial 1389 with value: 0.22332552856343169.
[I 2024-12-04 13:13:21,374] Trial 1578 finished with value: 0.4476750127015499 and parameters: {'n_estimators': 944, 'learning_rate': 0.09285118626902682, 'max_depth': 11, 'min_samples_split': 20, 'min_samples_leaf': 9, 'subsample': 0.8648053545910629, 'max_features': 'sqrt'}. Best is trial 1389 with value: 0.22332552856343169.
[I 2024-12-04 13:13:22,874] Trial 1571 finished with value: 0.35505067135387713 and parameters: {'n_estimators': 1340, 'learning_rate': 0.09926645701254191, 'max_depth': 11, 'min_samples_split': 4, 'min_samples_leaf': 3, 'subsample': 0.6828721971698019, 'max_features': 'sqrt'}. Best is trial 1389 with value: 0.22332552856343169.
[I 2024-12-04 13:13:28,685] Trial 1576 finished with value: 0.3493900376257909 and parameters: {'n_estimators': 1080, 'learning_rate': 0.0934032303791145, 'max_depth': 6, 'min_samples_split': 7, 'min_samples_leaf': 3, 'subsample': 0.7649611685355904, 'max_features': 'sqrt'}. Best is trial 1389 with value: 0.22332552856343169.
[I 2024-12-04 13:13:29,069] Trial 1575 finished with value: 0.38997295460340387 and parameters: {'n_estimators': 1263, 'learning_rate': 0.0736508702567054, 'max_depth': 6, 'min_samples_split': 20, 'min_samples_leaf': 5, 'subsample': 0.9467286255827134, 'max_features': 'sqrt'}. Best is trial 1389 with value: 0.22332552856343169.
[I 2024-12-04 13:13:32,714] Trial 1581 finished with value: 0.33710856062563044 and parameters: {'n_estimators': 878, 'learning_rate': 0.024561580673450906, 'max_depth': 10, 'min_samples_split': 16, 'min_samples_leaf': 2, 'subsample': 0.7317429896155315, 'max_features': None}. Best is trial 1389 with value: 0.22332552856343169.
[I 2024-12-04 13:13:33,790] Trial 1593 finished with value: 0.3837761917861039 and parameters: {'n_estimators': 488, 'learning_rate': 0.07020024135047566, 'max_depth': 7, 'min_samples_split': 18, 'min_samples_leaf': 5, 'subsample': 0.8516518504956143, 'max_features': 'sqrt'}. Best is trial 1389 with value: 0.22332552856343169.
[I 2024-12-04 13:13:42,482] Trial 1574 finished with value: 0.36551193525794395 and parameters: {'n_estimators': 1456, 'learning_rate': 0.04427737846503996, 'max_depth': 10, 'min_samples_split': 8, 'min_samples_leaf': 3, 'subsample': 0.68948438205497, 'max_features': 'sqrt'}. Best is trial 1389 with value: 0.22332552856343169.
[I 2024-12-04 13:13:42,960] Trial 1573 finished with value: 0.2517898984433417 and parameters: {'n_estimators': 1476, 'learning_rate': 0.09840737115160052, 'max_depth': 12, 'min_samples_split': 4, 'min_samples_leaf': 1, 'subsample': 0.6529002356241871, 'max_features': 'sqrt'}. Best is trial 1389 with value: 0.22332552856343169.
[I 2024-12-04 13:13:42,975] Trial 1602 finished with value: 0.5415917641120919 and parameters: {'n_estimators': 214, 'learning_rate': 0.01727800835337382, 'max_depth': 4, 'min_samples_split': 20, 'min_samples_leaf': 9, 'subsample': 0.6063527327902961, 'max_features': None}. Best is trial 1389 with value: 0.22332552856343169.
[I 2024-12-04 13:13:45,834] Trial 1580 finished with value: 0.2866596904385657 and parameters: {'n_estimators': 1232, 'learning_rate': 0.053654432455690224, 'max_depth': 10, 'min_samples_split': 5, 'min_samples_leaf': 2, 'subsample': 0.6573828347163129, 'max_features': 'sqrt'}. Best is trial 1389 with value: 0.22332552856343169.
[I 2024-12-04 13:13:45,872] Trial 1584 finished with value: 0.3450792720027718 and parameters: {'n_estimators': 1092, 'learning_rate': 0.09849858586535892, 'max_depth': 7, 'min_samples_split': 4, 'min_samples_leaf': 3, 'subsample': 0.8287659269200826, 'max_features': 'sqrt'}. Best is trial 1389 with value: 0.22332552856343169.
[I 2024-12-04 13:13:54,029] Trial 1577 finished with value: 0.32356001453739686 and parameters: {'n_estimators': 1458, 'learning_rate': 0.06598093043957205, 'max_depth': 4, 'min_samples_split': 4, 'min_samples_leaf': 2, 'subsample': 0.6898183495743434, 'max_features': 'log2'}. Best is trial 1389 with value: 0.22332552856343169.
[I 2024-12-04 13:13:56,909] Trial 1604 finished with value: 0.3016755339633668 and parameters: {'n_estimators': 283, 'learning_rate': 0.08283454097228235, 'max_depth': 11, 'min_samples_split': 19, 'min_samples_leaf': 2, 'subsample': 0.6443735027231341, 'max_features': 'sqrt'}. Best is trial 1389 with value: 0.22332552856343169.
[I 2024-12-04 13:13:58,604] Trial 1579 finished with value: 0.2561997919967595 and parameters: {'n_estimators': 1467, 'learning_rate': 0.06999619212457495, 'max_depth': 3, 'min_samples_split': 2, 'min_samples_leaf': 1, 'subsample': 0.6540224480947046, 'max_features': 'sqrt'}. Best is trial 1389 with value: 0.22332552856343169.
[I 2024-12-04 13:13:58,715] Trial 1587 finished with value: 0.37142270326090726 and parameters: {'n_estimators': 1187, 'learning_rate': 0.04636664386772948, 'max_depth': 4, 'min_samples_split': 2, 'min_samples_leaf': 3, 'subsample': 0.7179664125682051, 'max_features': 'sqrt'}. Best is trial 1389 with value: 0.22332552856343169.
[I 2024-12-04 13:14:01,738] Trial 1589 finished with value: 0.3068002691139567 and parameters: {'n_estimators': 1053, 'learning_rate': 0.056350667898339896, 'max_depth': 7, 'min_samples_split': 2, 'min_samples_leaf': 2, 'subsample': 0.8104210672456079, 'max_features': 'sqrt'}. Best is trial 1389 with value: 0.22332552856343169.
[I 2024-12-04 13:14:01,750] Trial 1594 finished with value: 0.2872469471477095 and parameters: {'n_estimators': 943, 'learning_rate': 0.0998259345749754, 'max_depth': 10, 'min_samples_split': 3, 'min_samples_leaf': 2, 'subsample': 0.8578503938648326, 'max_features': 'sqrt'}. Best is trial 1389 with value: 0.22332552856343169.
[I 2024-12-04 13:14:03,219] Trial 1585 finished with value: 0.26061935472182424 and parameters: {'n_estimators': 1220, 'learning_rate': 0.0860343029694766, 'max_depth': 8, 'min_samples_split': 2, 'min_samples_leaf': 1, 'subsample': 0.8230310657810723, 'max_features': 'log2'}. Best is trial 1389 with value: 0.22332552856343169.
[I 2024-12-04 13:14:04,111] Trial 1597 finished with value: 0.3294916482921159 and parameters: {'n_estimators': 791, 'learning_rate': 0.08499779566542981, 'max_depth': 8, 'min_samples_split': 3, 'min_samples_leaf': 1, 'subsample': 0.7144613366639236, 'max_features': None}. Best is trial 1389 with value: 0.22332552856343169.
[I 2024-12-04 13:14:06,703] Trial 1582 finished with value: 0.2924147323586827 and parameters: {'n_estimators': 1492, 'learning_rate': 0.050642880731330726, 'max_depth': 12, 'min_samples_split': 3, 'min_samples_leaf': 2, 'subsample': 0.6190205924911824, 'max_features': 'sqrt'}. Best is trial 1389 with value: 0.22332552856343169.
[I 2024-12-04 13:14:11,098] Trial 1590 finished with value: 0.2964553836315883 and parameters: {'n_estimators': 1279, 'learning_rate': 0.060204829033203594, 'max_depth': 4, 'min_samples_split': 5, 'min_samples_leaf': 2, 'subsample': 0.7269450130874419, 'max_features': 'sqrt'}. Best is trial 1389 with value: 0.22332552856343169.
[I 2024-12-04 13:14:11,268] Trial 1605 finished with value: 0.37077861388824573 and parameters: {'n_estimators': 595, 'learning_rate': 0.07486653732140826, 'max_depth': 7, 'min_samples_split': 2, 'min_samples_leaf': 4, 'subsample': 0.856776188156555, 'max_features': 'sqrt'}. Best is trial 1389 with value: 0.22332552856343169.
[I 2024-12-04 13:14:11,814] Trial 1610 finished with value: 0.8398446410198327 and parameters: {'n_estimators': 423, 'learning_rate': 0.024750533758139005, 'max_depth': 7, 'min_samples_split': 5, 'min_samples_leaf': 4, 'subsample': 0.7102311208304732, 'max_features': 'log2'}. Best is trial 1389 with value: 0.22332552856343169.
[I 2024-12-04 13:14:13,338] Trial 1586 finished with value: 0.26471006611899645 and parameters: {'n_estimators': 1428, 'learning_rate': 0.09849720620469818, 'max_depth': 3, 'min_samples_split': 2, 'min_samples_leaf': 1, 'subsample': 0.7259299920651562, 'max_features': 'sqrt'}. Best is trial 1389 with value: 0.22332552856343169.
[I 2024-12-04 13:14:19,875] Trial 1588 finished with value: 0.2789403760758237 and parameters: {'n_estimators': 1452, 'learning_rate': 0.09832364072007585, 'max_depth': 5, 'min_samples_split': 2, 'min_samples_leaf': 2, 'subsample': 0.6701621053503833, 'max_features': 'sqrt'}. Best is trial 1389 with value: 0.22332552856343169.
[I 2024-12-04 13:14:21,217] Trial 1606 finished with value: 0.4788308531188584 and parameters: {'n_estimators': 674, 'learning_rate': 0.04398032380111839, 'max_depth': 4, 'min_samples_split': 5, 'min_samples_leaf': 9, 'subsample': 0.815259587420063, 'max_features': 'sqrt'}. Best is trial 1389 with value: 0.22332552856343169.
[I 2024-12-04 13:14:25,873] Trial 1595 finished with value: 0.25602046807647477 and parameters: {'n_estimators': 1278, 'learning_rate': 0.06253213533953418, 'max_depth': 5, 'min_samples_split': 2, 'min_samples_leaf': 1, 'subsample': 0.7824327572162597, 'max_features': 'sqrt'}. Best is trial 1389 with value: 0.22332552856343169.
[I 2024-12-04 13:14:26,527] Trial 1592 finished with value: 0.24495895609959975 and parameters: {'n_estimators': 1403, 'learning_rate': 0.07073111795430319, 'max_depth': 4, 'min_samples_split': 2, 'min_samples_leaf': 1, 'subsample': 0.7112257896937972, 'max_features': 'sqrt'}. Best is trial 1389 with value: 0.22332552856343169.
[I 2024-12-04 13:14:30,193] Trial 1591 finished with value: 0.26591415924037126 and parameters: {'n_estimators': 1410, 'learning_rate': 0.077628451468767, 'max_depth': 4, 'min_samples_split': 2, 'min_samples_leaf': 1, 'subsample': 0.7977233819187411, 'max_features': 'sqrt'}. Best is trial 1389 with value: 0.22332552856343169.
[I 2024-12-04 13:14:34,096] Trial 1615 finished with value: 0.3591848987664622 and parameters: {'n_estimators': 622, 'learning_rate': 0.044644164640843566, 'max_depth': 10, 'min_samples_split': 4, 'min_samples_leaf': 4, 'subsample': 0.9557985422254313, 'max_features': 'sqrt'}. Best is trial 1389 with value: 0.22332552856343169.
