[I 2024-12-04 00:34:23,576] Trial 2094 finished with value: 0.352383378848207 and parameters: {'kernel': 'linear', 'C': 21.65567435048594, 'gamma': 0.0016900444872439636, 'epsilon': 0.005939914548884171}. Best is trial 1479 with value: 0.13978216740910654.
[I 2024-12-04 00:34:24,306] Trial 2147 finished with value: 0.19963945550263287 and parameters: {'kernel': 'rbf', 'C': 18.52207014355059, 'gamma': 0.008706654748876457, 'epsilon': 0.0015936613296400554}. Best is trial 1479 with value: 0.13978216740910654.
[I 2024-12-04 00:34:24,948] Trial 2149 finished with value: 0.31341588272429133 and parameters: {'kernel': 'rbf', 'C': 1.3116957044374948, 'gamma': 0.014829411874566501, 'epsilon': 0.01623198515051574}. Best is trial 1479 with value: 0.13978216740910654.
[I 2024-12-04 00:34:25,852] Trial 2148 finished with value: 0.1512885368696475 and parameters: {'kernel': 'rbf', 'C': 98.67644936782534, 'gamma': 0.005245123537077865, 'epsilon': 0.0013515109712497002}. Best is trial 1479 with value: 0.13978216740910654.
[I 2024-12-04 00:34:27,414] Trial 2150 finished with value: 0.2794625443171122 and parameters: {'kernel': 'rbf', 'C': 10.716896724459946, 'gamma': 0.0034017158862809623, 'epsilon': 0.0010427677812999746}. Best is trial 1479 with value: 0.13978216740910654.
[I 2024-12-04 00:34:28,359] Trial 2152 finished with value: 0.15004013468316763 and parameters: {'kernel': 'rbf', 'C': 30.762548688964106, 'gamma': 0.012324783840379, 'epsilon': 0.0010720237233725126}. Best is trial 1479 with value: 0.13978216740910654.
[I 2024-12-04 00:34:28,456] Trial 2153 finished with value: 0.214997667946807 and parameters: {'kernel': 'rbf', 'C': 24.167870853469278, 'gamma': 0.005908804018221544, 'epsilon': 0.0010506716596352344}. Best is trial 1479 with value: 0.13978216740910654.
[I 2024-12-04 00:34:29,225] Trial 2155 finished with value: 0.25627952179185776 and parameters: {'kernel': 'rbf', 'C': 3.147046479663225, 'gamma': 0.01686753373381082, 'epsilon': 0.001026473569781934}. Best is trial 1479 with value: 0.13978216740910654.
[I 2024-12-04 00:34:29,754] Trial 2151 finished with value: 0.15103865834135557 and parameters: {'kernel': 'rbf', 'C': 92.8147786735856, 'gamma': 0.005488830084391657, 'epsilon': 0.0026971067309602787}. Best is trial 1479 with value: 0.13978216740910654.
[I 2024-12-04 00:34:30,327] Trial 2154 finished with value: 0.14073802480482286 and parameters: {'kernel': 'rbf', 'C': 78.71031533432189, 'gamma': 0.008417120366150041, 'epsilon': 0.0010243773018319313}. Best is trial 1479 with value: 0.13978216740910654.
[I 2024-12-04 00:34:30,408] Trial 2156 finished with value: 0.2694606555611765 and parameters: {'kernel': 'rbf', 'C': 10.885639838055, 'gamma': 0.004291027146214106, 'epsilon': 0.002660569129645418}. Best is trial 1479 with value: 0.13978216740910654.
[I 2024-12-04 00:34:32,129] Trial 2158 finished with value: 0.1478955469893927 and parameters: {'kernel': 'rbf', 'C': 30.42320153187559, 'gamma': 0.01390576449623388, 'epsilon': 0.0010903739776551452}. Best is trial 1479 with value: 0.13978216740910654.
[I 2024-12-04 00:34:32,129] Trial 2157 finished with value: 0.16184303416931162 and parameters: {'kernel': 'rbf', 'C': 19.01962359606299, 'gamma': 0.01428642233515064, 'epsilon': 0.0010299306918309448}. Best is trial 1479 with value: 0.13978216740910654.
[I 2024-12-04 00:34:33,783] Trial 2160 finished with value: 0.21679719867283237 and parameters: {'kernel': 'rbf', 'C': 85.45688068952451, 'gamma': 0.002053007658145455, 'epsilon': 0.0010893755714325997}. Best is trial 1479 with value: 0.13978216740910654.
[I 2024-12-04 00:34:35,028] Trial 2162 finished with value: 0.21327649365280207 and parameters: {'kernel': 'rbf', 'C': 98.68551969446561, 'gamma': 0.0018811665272695948, 'epsilon': 0.0015273872244790042}. Best is trial 1479 with value: 0.13978216740910654.
[I 2024-12-04 00:34:35,238] Trial 2164 finished with value: 0.27141664829538736 and parameters: {'kernel': 'rbf', 'C': 19.39190690032093, 'gamma': 0.00229067131283786, 'epsilon': 0.001098873362034842}. Best is trial 1479 with value: 0.13978216740910654.
[I 2024-12-04 00:34:35,457] Trial 2163 finished with value: 0.2136917595781165 and parameters: {'kernel': 'rbf', 'C': 14.97068734824409, 'gamma': 0.0089015765421645, 'epsilon': 0.0022787918321391576}. Best is trial 1479 with value: 0.13978216740910654.
[I 2024-12-04 00:34:35,458] Trial 2159 finished with value: 0.1850239839220632 and parameters: {'kernel': 'rbf', 'C': 32.634942766593, 'gamma': 0.036758207256434514, 'epsilon': 0.0010345226527272006}. Best is trial 1479 with value: 0.13978216740910654.
[I 2024-12-04 00:34:36,337] Trial 2165 finished with value: 0.2621940530494016 and parameters: {'kernel': 'rbf', 'C': 27.12732507542951, 'gamma': 0.0021745942615265046, 'epsilon': 0.0010127424250850675}. Best is trial 1479 with value: 0.13978216740910654.
[I 2024-12-04 00:34:37,601] Trial 2161 finished with value: 0.15364893208678856 and parameters: {'kernel': 'rbf', 'C': 98.67409917407635, 'gamma': 0.01224742641320219, 'epsilon': 0.0011045409156038672}. Best is trial 1479 with value: 0.13978216740910654.
[I 2024-12-04 00:34:37,679] Trial 2166 finished with value: 0.2397037071104991 and parameters: {'kernel': 'rbf', 'C': 18.755294666945495, 'gamma': 0.005090761100712341, 'epsilon': 0.002616539120620797}. Best is trial 1479 with value: 0.13978216740910654.
[I 2024-12-04 00:34:39,250] Trial 2169 finished with value: 0.21572398406404572 and parameters: {'kernel': 'rbf', 'C': 18.094518299487113, 'gamma': 0.0074785843384686905, 'epsilon': 0.0021305330559232066}. Best is trial 1479 with value: 0.13978216740910654.
[I 2024-12-04 00:34:40,317] Trial 2171 finished with value: 0.9868736076073565 and parameters: {'kernel': 'sigmoid', 'C': 0.0012449799351708806, 'gamma': 0.005413351102680111, 'epsilon': 0.7772510533607633}. Best is trial 1479 with value: 0.13978216740910654.
[I 2024-12-04 00:34:41,418] Trial 2168 finished with value: 0.14173204041632947 and parameters: {'kernel': 'rbf', 'C': 87.13558159178967, 'gamma': 0.00715316153959439, 'epsilon': 0.0010058046560706784}. Best is trial 1479 with value: 0.13978216740910654.
[I 2024-12-04 00:34:41,484] Trial 2167 finished with value: 0.14091653770521864 and parameters: {'kernel': 'rbf', 'C': 96.39730260161429, 'gamma': 0.006937824121765941, 'epsilon': 0.0010551921240585648}. Best is trial 1479 with value: 0.13978216740910654.
[I 2024-12-04 00:34:43,906] Trial 2174 finished with value: 0.2178429308182012 and parameters: {'kernel': 'rbf', 'C': 2.5497585837883756, 'gamma': 0.04833506114115293, 'epsilon': 0.0011432991063153174}. Best is trial 1479 with value: 0.13978216740910654.
[I 2024-12-04 00:34:44,691] Trial 2176 finished with value: 217.5179735012949 and parameters: {'kernel': 'sigmoid', 'C': 15.793386155949033, 'gamma': 0.011081451079427148, 'epsilon': 0.0010406951172024666}. Best is trial 1479 with value: 0.13978216740910654.
[I 2024-12-04 00:34:44,771] Trial 2173 finished with value: 0.2279875191288213 and parameters: {'kernel': 'rbf', 'C': 26.56972493540482, 'gamma': 0.08858104501117375, 'epsilon': 0.0010146408827086404}. Best is trial 1479 with value: 0.13978216740910654.
[I 2024-12-04 00:34:47,013] Trial 2172 finished with value: 0.1987417455954222 and parameters: {'kernel': 'rbf', 'C': 76.00781972826323, 'gamma': 0.045414497298348004, 'epsilon': 0.001020238000475105}. Best is trial 1479 with value: 0.13978216740910654.
[I 2024-12-04 00:34:48,243] Trial 2177 finished with value: 0.15563497996847228 and parameters: {'kernel': 'rbf', 'C': 92.24645151064686, 'gamma': 0.0048628364033197514, 'epsilon': 0.002749357551955396}. Best is trial 1479 with value: 0.13978216740910654.
[I 2024-12-04 00:34:48,243] Trial 2179 finished with value: 0.18995293623838488 and parameters: {'kernel': 'rbf', 'C': 25.661696635776206, 'gamma': 0.007630137022107235, 'epsilon': 0.0029343722408806385}. Best is trial 1479 with value: 0.13978216740910654.
[I 2024-12-04 00:34:48,275] Trial 2178 finished with value: 0.18332671900197156 and parameters: {'kernel': 'rbf', 'C': 12.239680313402962, 'gamma': 0.014596431869950077, 'epsilon': 0.0010247343970209632}. Best is trial 1479 with value: 0.13978216740910654.
[I 2024-12-04 00:34:50,611] Trial 2180 finished with value: 0.1740220921623758 and parameters: {'kernel': 'rbf', 'C': 76.42073871414671, 'gamma': 0.0040686502107857075, 'epsilon': 0.0010375377664498392}. Best is trial 1479 with value: 0.13978216740910654.
[I 2024-12-04 00:34:51,815] Trial 2181 finished with value: 0.22072660070092093 and parameters: {'kernel': 'rbf', 'C': 27.219732355632935, 'gamma': 0.004897045689696884, 'epsilon': 0.0010208291984805775}. Best is trial 1479 with value: 0.13978216740910654.
[I 2024-12-04 00:34:53,032] Trial 2184 finished with value: 1176.1099550557722 and parameters: {'kernel': 'sigmoid', 'C': 68.66566270187005, 'gamma': 0.01632167270125374, 'epsilon': 0.0010302220317865284}. Best is trial 1479 with value: 0.13978216740910654.
[I 2024-12-04 00:34:54,410] Trial 2185 finished with value: 0.3172968483066951 and parameters: {'kernel': 'rbf', 'C': 32.10869403026196, 'gamma': 0.0007798950758077395, 'epsilon': 0.003194769815206169}. Best is trial 1479 with value: 0.13978216740910654.
[I 2024-12-04 00:34:54,661] Trial 2109 finished with value: 0.3527760651158978 and parameters: {'kernel': 'linear', 'C': 18.39911076838417, 'gamma': 0.007931891557306983, 'epsilon': 0.001517510840956305}. Best is trial 1479 with value: 0.13978216740910654.
[I 2024-12-04 00:34:56,076] Trial 2186 finished with value: 0.2362384610476135 and parameters: {'kernel': 'rbf', 'C': 96.57536836200762, 'gamma': 0.0011925855221484214, 'epsilon': 0.0012713279302599483}. Best is trial 1479 with value: 0.13978216740910654.
[I 2024-12-04 00:34:56,116] Trial 2182 finished with value: 0.1556249654973732 and parameters: {'kernel': 'rbf', 'C': 96.39947060989687, 'gamma': 0.012704435996041392, 'epsilon': 0.0010706756427726147}. Best is trial 1479 with value: 0.13978216740910654.
[I 2024-12-04 00:34:56,118] Trial 117 finished with value: 0.7391051072376464 and parameters: {'kernel': 'poly', 'C': 96.07383405524679, 'gamma': 0.0300933034530559, 'epsilon': 0.001013427614872232}. Best is trial 1479 with value: 0.13978216740910654.
[I 2024-12-04 00:34:57,766] Trial 2183 finished with value: 0.1999438573825779 and parameters: {'kernel': 'rbf', 'C': 92.58121885030546, 'gamma': 0.043345146477022756, 'epsilon': 0.0018912328550926606}. Best is trial 1479 with value: 0.13978216740910654.
[I 2024-12-04 00:34:58,844] Trial 2190 finished with value: 0.25513769834012 and parameters: {'kernel': 'rbf', 'C': 21.228559928298143, 'gamma': 0.003259192379133025, 'epsilon': 0.0023162056468742456}. Best is trial 1479 with value: 0.13978216740910654.
[I 2024-12-04 00:34:59,009] Trial 2188 finished with value: 0.23214728127194484 and parameters: {'kernel': 'rbf', 'C': 94.4658698141558, 'gamma': 0.0925873667211789, 'epsilon': 0.0010396773561041303}. Best is trial 1479 with value: 0.13978216740910654.
[I 2024-12-04 00:34:59,314] Trial 2191 finished with value: 0.2121725948464637 and parameters: {'kernel': 'rbf', 'C': 64.04935873070296, 'gamma': 0.002801866362357234, 'epsilon': 0.0010014693210019074}. Best is trial 1479 with value: 0.13978216740910654.
[I 2024-12-04 00:34:59,339] Trial 2189 finished with value: 0.19033239267035498 and parameters: {'kernel': 'rbf', 'C': 27.66840147778986, 'gamma': 0.007239510144349274, 'epsilon': 0.003182248406220415}. Best is trial 1479 with value: 0.13978216740910654.
[I 2024-12-04 00:35:01,084] Trial 2192 finished with value: 0.15229660206864018 and parameters: {'kernel': 'rbf', 'C': 23.187171038281004, 'gamma': 0.02435152011836168, 'epsilon': 0.002548365813664853}. Best is trial 1479 with value: 0.13978216740910654.
[I 2024-12-04 00:35:01,552] Trial 2193 finished with value: 0.26109194474310704 and parameters: {'kernel': 'rbf', 'C': 23.919174863997632, 'gamma': 0.002518765680287832, 'epsilon': 0.006567239996896781}. Best is trial 1479 with value: 0.13978216740910654.
[I 2024-12-04 00:35:01,569] Trial 2187 finished with value: 0.20038506823856475 and parameters: {'kernel': 'rbf', 'C': 99.9231257330131, 'gamma': 0.042494439029388494, 'epsilon': 0.002030456585610518}. Best is trial 1479 with value: 0.13978216740910654.
[I 2024-12-04 00:35:01,898] Trial 2175 finished with value: 0.519918999857114 and parameters: {'kernel': 'poly', 'C': 12.356118760146225, 'gamma': 0.023977018682452198, 'epsilon': 0.0010243513566664066}. Best is trial 1479 with value: 0.13978216740910654.
[I 2024-12-04 00:35:02,898] Trial 2196 finished with value: 0.17526309373304455 and parameters: {'kernel': 'rbf', 'C': 6.930740360162478, 'gamma': 0.03744714996176721, 'epsilon': 0.00847444345310037}. Best is trial 1479 with value: 0.13978216740910654.
[I 2024-12-04 00:35:04,113] Trial 2195 finished with value: 0.1448630484062682 and parameters: {'kernel': 'rbf', 'C': 97.82033991272357, 'gamma': 0.010855858124478812, 'epsilon': 0.002090821178829763}. Best is trial 1479 with value: 0.13978216740910654.
[I 2024-12-04 00:35:04,174] Trial 2197 finished with value: 0.22087982517678365 and parameters: {'kernel': 'rbf', 'C': 24.886742538074348, 'gamma': 0.005339355827706776, 'epsilon': 0.002442031840387975}. Best is trial 1479 with value: 0.13978216740910654.
[I 2024-12-04 00:35:05,013] Trial 2194 finished with value: 0.17218704804729196 and parameters: {'kernel': 'rbf', 'C': 92.93011779465469, 'gamma': 0.021000931892166765, 'epsilon': 0.002008492862193512}. Best is trial 1479 with value: 0.13978216740910654.
[I 2024-12-04 00:35:05,258] Trial 2199 finished with value: 0.14964339169490432 and parameters: {'kernel': 'rbf', 'C': 20.28236633345342, 'gamma': 0.01809224791942603, 'epsilon': 0.0010316254867441753}. Best is trial 1479 with value: 0.13978216740910654.
[I 2024-12-04 00:35:05,661] Trial 2201 finished with value: 0.28786840121361656 and parameters: {'kernel': 'rbf', 'C': 5.50178875047949, 'gamma': 0.005330947951050429, 'epsilon': 0.0010294368425929224}. Best is trial 1479 with value: 0.13978216740910654.
[I 2024-12-04 00:35:05,854] Trial 1808 finished with value: 0.35223879672729597 and parameters: {'kernel': 'linear', 'C': 98.59001406232429, 'gamma': 0.011278627714727447, 'epsilon': 0.0017101484359002088}. Best is trial 1479 with value: 0.13978216740910654.
[I 2024-12-04 00:35:06,043] Trial 2200 finished with value: 0.18059413762249743 and parameters: {'kernel': 'rbf', 'C': 16.048671916743196, 'gamma': 0.0400330314834549, 'epsilon': 0.0010182333432063025}. Best is trial 1479 with value: 0.13978216740910654.
[I 2024-12-04 00:35:07,332] Trial 2203 finished with value: 0.4242098568970597 and parameters: {'kernel': 'rbf', 'C': 9.097677610399154, 'gamma': 0.0007561475592923524, 'epsilon': 0.0010182233001550496}. Best is trial 1479 with value: 0.13978216740910654.
[I 2024-12-04 00:35:07,955] Trial 2198 finished with value: 0.1813480440041078 and parameters: {'kernel': 'rbf', 'C': 99.1472743951073, 'gamma': 0.027212636806699747, 'epsilon': 0.00165443797721099}. Best is trial 1479 with value: 0.13978216740910654.
[I 2024-12-04 00:35:08,507] Trial 2204 finished with value: 0.191769025478329 and parameters: {'kernel': 'rbf', 'C': 20.50603741170543, 'gamma': 0.008753561293927594, 'epsilon': 0.0010419324768437266}. Best is trial 1479 with value: 0.13978216740910654.
[I 2024-12-04 00:35:09,368] Trial 2206 finished with value: 1339.8379680592393 and parameters: {'kernel': 'sigmoid', 'C': 89.75073566459095, 'gamma': 0.012710630688859404, 'epsilon': 0.005785676695878577}. Best is trial 1479 with value: 0.13978216740910654.
[I 2024-12-04 00:35:09,502] Trial 2205 finished with value: 0.1537993020481337 and parameters: {'kernel': 'rbf', 'C': 99.78967831707917, 'gamma': 0.004852557714181921, 'epsilon': 0.001295628472087283}. Best is trial 1479 with value: 0.13978216740910654.
[I 2024-12-04 00:35:10,253] Trial 2208 finished with value: 0.24158370948785396 and parameters: {'kernel': 'rbf', 'C': 21.361108201967063, 'gamma': 0.004410414770754468, 'epsilon': 0.0020979049014475232}. Best is trial 1479 with value: 0.13978216740910654.
[I 2024-12-04 00:35:12,303] Trial 2211 finished with value: 0.16084502693956923 and parameters: {'kernel': 'rbf', 'C': 23.62579978602074, 'gamma': 0.0121042399278151, 'epsilon': 0.0019487445346691842}. Best is trial 1479 with value: 0.13978216740910654.
[I 2024-12-04 00:35:13,166] Trial 2212 finished with value: 0.2574607899826866 and parameters: {'kernel': 'rbf', 'C': 99.19455842482144, 'gamma': 0.0007430739234473908, 'epsilon': 0.0024628026516586047}. Best is trial 1479 with value: 0.13978216740910654.
[I 2024-12-04 00:35:13,446] Trial 2210 finished with value: 0.14737862238261729 and parameters: {'kernel': 'rbf', 'C': 91.6518288874671, 'gamma': 0.006036869714330073, 'epsilon': 0.0025127086616967944}. Best is trial 1479 with value: 0.13978216740910654.
[I 2024-12-04 00:35:14,350] Trial 2213 finished with value: 0.6014628668086195 and parameters: {'kernel': 'poly', 'C': 17.359499958485998, 'gamma': 0.011813078536191023, 'epsilon': 0.0024841055190091424}. Best is trial 1479 with value: 0.13978216740910654.
[I 2024-12-04 00:35:14,780] Trial 2215 finished with value: 0.7586062198557929 and parameters: {'kernel': 'rbf', 'C': 0.057886387117746206, 'gamma': 0.0014629228477620409, 'epsilon': 0.03168876694782742}. Best is trial 1479 with value: 0.13978216740910654.
[I 2024-12-04 00:35:14,951] Trial 2209 finished with value: 0.1783253244153382 and parameters: {'kernel': 'rbf', 'C': 76.64462719466725, 'gamma': 0.027030311006801613, 'epsilon': 0.0010041349884794392}. Best is trial 1479 with value: 0.13978216740910654.
[I 2024-12-04 00:35:14,952] Trial 2214 finished with value: 0.1735674411443392 and parameters: {'kernel': 'rbf', 'C': 21.471915573059675, 'gamma': 0.033981738756242934, 'epsilon': 0.005813675306286214}. Best is trial 1479 with value: 0.13978216740910654.
[I 2024-12-04 00:35:16,571] Trial 2216 finished with value: 0.263019599743559 and parameters: {'kernel': 'rbf', 'C': 17.741770899167058, 'gamma': 0.00319913233636375, 'epsilon': 0.0010522959923433355}. Best is trial 1479 with value: 0.13978216740910654.
[I 2024-12-04 00:35:18,682] Trial 2207 finished with value: 0.52647130360983 and parameters: {'kernel': 'poly', 'C': 0.02089044432516818, 'gamma': 0.19000025709245577, 'epsilon': 0.08379106162618546}. Best is trial 1479 with value: 0.13978216740910654.
[I 2024-12-04 00:35:18,950] Trial 2219 finished with value: 0.17674119535610522 and parameters: {'kernel': 'rbf', 'C': 20.43787710250429, 'gamma': 0.010575470265688244, 'epsilon': 0.0022097207889346902}. Best is trial 1479 with value: 0.13978216740910654.
[I 2024-12-04 00:35:19,593] Trial 2218 finished with value: 0.15439877379187364 and parameters: {'kernel': 'rbf', 'C': 95.35463625891701, 'gamma': 0.004897696702100327, 'epsilon': 0.0019398161165652239}. Best is trial 1479 with value: 0.13978216740910654.
[I 2024-12-04 00:35:20,503] Trial 2222 finished with value: 480.76540180850907 and parameters: {'kernel': 'sigmoid', 'C': 88.09515797834771, 'gamma': 0.004029961050019582, 'epsilon': 0.11062601027229524}. Best is trial 1479 with value: 0.13978216740910654.
[I 2024-12-04 00:35:21,405] Trial 2223 finished with value: 0.9988845987772206 and parameters: {'kernel': 'poly', 'C': 0.0026445225058839, 'gamma': 0.00013199838677848384, 'epsilon': 0.015022816040457654}. Best is trial 1479 with value: 0.13978216740910654.
[I 2024-12-04 00:35:21,484] Trial 2220 finished with value: 0.16348056218035734 and parameters: {'kernel': 'rbf', 'C': 96.85637375833129, 'gamma': 0.015498733366684161, 'epsilon': 0.00826036413424773}. Best is trial 1479 with value: 0.13978216740910654.
[I 2024-12-04 00:35:21,622] Trial 2221 finished with value: 0.1420477142567978 and parameters: {'kernel': 'rbf', 'C': 91.34433198774953, 'gamma': 0.007817908148991075, 'epsilon': 0.005405363169142428}. Best is trial 1479 with value: 0.13978216740910654.
[I 2024-12-04 00:35:22,728] Trial 2224 finished with value: 0.6931224778545197 and parameters: {'kernel': 'poly', 'C': 97.37370273300336, 'gamma': 0.004073109938518484, 'epsilon': 0.0018758924674394761}. Best is trial 1479 with value: 0.13978216740910654.
[I 2024-12-04 00:35:22,996] Trial 2225 finished with value: 0.2611742453304443 and parameters: {'kernel': 'rbf', 'C': 3.9652659611773085, 'gamma': 0.012375173248487206, 'epsilon': 0.0010166831168140896}. Best is trial 1479 with value: 0.13978216740910654.
[I 2024-12-04 00:35:23,487] Trial 2226 finished with value: 0.5630434751565018 and parameters: {'kernel': 'linear', 'C': 0.013273083476195015, 'gamma': 0.01880067572598998, 'epsilon': 0.980199379150034}. Best is trial 1479 with value: 0.13978216740910654.
[I 2024-12-04 00:35:25,547] Trial 2228 finished with value: 0.2009148725249805 and parameters: {'kernel': 'rbf', 'C': 29.552076030165733, 'gamma': 0.005999395289473332, 'epsilon': 0.0010321500660570168}. Best is trial 1479 with value: 0.13978216740910654.
[I 2024-12-04 00:35:25,955] Trial 2227 finished with value: 0.18909004023840678 and parameters: {'kernel': 'rbf', 'C': 67.47064206416124, 'gamma': 0.003652061847152518, 'epsilon': 0.0010081972255538106}. Best is trial 1479 with value: 0.13978216740910654.
[I 2024-12-04 00:35:26,163] Trial 2170 finished with value: 0.3520928151810175 and parameters: {'kernel': 'linear', 'C': 13.797787886762139, 'gamma': 0.024218428930467373, 'epsilon': 0.0011285171137557655}. Best is trial 1479 with value: 0.13978216740910654.
[I 2024-12-04 00:35:27,052] Trial 2232 finished with value: 0.33620749799278604 and parameters: {'kernel': 'linear', 'C': 0.28192276426518553, 'gamma': 0.004720823657746459, 'epsilon': 0.36280248520688646}. Best is trial 1479 with value: 0.13978216740910654.
[I 2024-12-04 00:35:28,195] Trial 2231 finished with value: 0.3286845582886212 and parameters: {'kernel': 'linear', 'C': 0.5857760164109332, 'gamma': 0.4976674124132472, 'epsilon': 0.06401643948100698}. Best is trial 1479 with value: 0.13978216740910654.
