[I 2024-12-04 20:16:52,684] Trial 1396 finished with value: 0.3230509500930674 and parameters: {'n_estimators': 405, 'max_depth': 50, 'min_samples_split': 2, 'min_samples_leaf': 1, 'max_features': 'sqrt', 'bootstrap': False, 'criterion': 'squared_error'}. Best is trial 874 with value: 0.32176430753353746.
[I 2024-12-04 20:16:55,533] Trial 1398 finished with value: 1.243129639553555 and parameters: {'n_estimators': 497, 'max_depth': 9, 'min_samples_split': 19, 'min_samples_leaf': 1, 'max_features': 'log2', 'bootstrap': True, 'criterion': 'absolute_error'}. Best is trial 874 with value: 0.32176430753353746.
[I 2024-12-04 20:16:56,878] Trial 1400 finished with value: 0.6853709862444268 and parameters: {'n_estimators': 420, 'max_depth': 50, 'min_samples_split': 3, 'min_samples_leaf': 2, 'max_features': 'sqrt', 'bootstrap': False, 'criterion': 'squared_error'}. Best is trial 874 with value: 0.32176430753353746.
[I 2024-12-04 20:16:57,861] Trial 1399 finished with value: 0.5319497799395824 and parameters: {'n_estimators': 785, 'max_depth': 31, 'min_samples_split': 14, 'min_samples_leaf': 1, 'max_features': None, 'bootstrap': False, 'criterion': 'squared_error'}. Best is trial 874 with value: 0.32176430753353746.
[I 2024-12-04 20:16:58,153] Trial 1393 finished with value: 0.5002492869046589 and parameters: {'n_estimators': 322, 'max_depth': 30, 'min_samples_split': 2, 'min_samples_leaf': 3, 'max_features': None, 'bootstrap': True, 'criterion': 'absolute_error'}. Best is trial 874 with value: 0.32176430753353746.
[I 2024-12-04 20:16:59,064] Trial 1401 finished with value: 0.3465000334054298 and parameters: {'n_estimators': 316, 'max_depth': 42, 'min_samples_split': 2, 'min_samples_leaf': 1, 'max_features': 'sqrt', 'bootstrap': False, 'criterion': 'squared_error'}. Best is trial 874 with value: 0.32176430753353746.
[I 2024-12-04 20:16:59,636] Trial 1402 finished with value: 1.1877925441754837 and parameters: {'n_estimators': 121, 'max_depth': 42, 'min_samples_split': 4, 'min_samples_leaf': 2, 'max_features': 'log2', 'bootstrap': False, 'criterion': 'absolute_error'}. Best is trial 874 with value: 0.32176430753353746.
[I 2024-12-04 20:17:01,776] Trial 1404 finished with value: 0.355882217513201 and parameters: {'n_estimators': 516, 'max_depth': 42, 'min_samples_split': 2, 'min_samples_leaf': 1, 'max_features': 'sqrt', 'bootstrap': False, 'criterion': 'squared_error'}. Best is trial 874 with value: 0.32176430753353746.
[I 2024-12-04 20:17:03,476] Trial 1403 finished with value: 1.087670788458211 and parameters: {'n_estimators': 811, 'max_depth': 31, 'min_samples_split': 11, 'min_samples_leaf': 3, 'max_features': 'sqrt', 'bootstrap': True, 'criterion': 'absolute_error'}. Best is trial 874 with value: 0.32176430753353746.
[I 2024-12-04 20:17:03,767] Trial 1406 finished with value: 0.323547281469707 and parameters: {'n_estimators': 328, 'max_depth': 50, 'min_samples_split': 2, 'min_samples_leaf': 1, 'max_features': 'sqrt', 'bootstrap': False, 'criterion': 'squared_error'}. Best is trial 874 with value: 0.32176430753353746.
[I 2024-12-04 20:17:04,340] Trial 1405 finished with value: 0.553125332671838 and parameters: {'n_estimators': 747, 'max_depth': 43, 'min_samples_split': 2, 'min_samples_leaf': 4, 'max_features': None, 'bootstrap': False, 'criterion': 'squared_error'}. Best is trial 874 with value: 0.32176430753353746.
[I 2024-12-04 20:17:05,272] Trial 1407 finished with value: 1.3200024528892862 and parameters: {'n_estimators': 149, 'max_depth': 21, 'min_samples_split': 15, 'min_samples_leaf': 15, 'max_features': 'sqrt', 'bootstrap': True, 'criterion': 'absolute_error'}. Best is trial 874 with value: 0.32176430753353746.
[I 2024-12-04 20:17:06,855] Trial 1409 finished with value: 1.2564254774950667 and parameters: {'n_estimators': 571, 'max_depth': 13, 'min_samples_split': 48, 'min_samples_leaf': 5, 'max_features': 'log2', 'bootstrap': True, 'criterion': 'squared_error'}. Best is trial 874 with value: 0.32176430753353746.
[I 2024-12-04 20:17:07,286] Trial 1410 finished with value: 0.38762161482718493 and parameters: {'n_estimators': 211, 'max_depth': 50, 'min_samples_split': 4, 'min_samples_leaf': 1, 'max_features': 'sqrt', 'bootstrap': False, 'criterion': 'squared_error'}. Best is trial 874 with value: 0.32176430753353746.
[I 2024-12-04 20:17:08,642] Trial 1411 finished with value: 0.5248192412618568 and parameters: {'n_estimators': 287, 'max_depth': 44, 'min_samples_split': 10, 'min_samples_leaf': 1, 'max_features': 'sqrt', 'bootstrap': False, 'criterion': 'squared_error'}. Best is trial 874 with value: 0.32176430753353746.
[I 2024-12-04 20:17:09,755] Trial 1408 finished with value: 0.8669635744769331 and parameters: {'n_estimators': 301, 'max_depth': 50, 'min_samples_split': 5, 'min_samples_leaf': 2, 'max_features': 'sqrt', 'bootstrap': False, 'criterion': 'absolute_error'}. Best is trial 874 with value: 0.32176430753353746.
[I 2024-12-04 20:17:10,104] Trial 1412 finished with value: 0.3221053321576918 and parameters: {'n_estimators': 371, 'max_depth': 50, 'min_samples_split': 2, 'min_samples_leaf': 1, 'max_features': 'sqrt', 'bootstrap': False, 'criterion': 'squared_error'}. Best is trial 874 with value: 0.32176430753353746.
[I 2024-12-04 20:17:11,324] Trial 1413 finished with value: 0.3234245020895279 and parameters: {'n_estimators': 387, 'max_depth': 50, 'min_samples_split': 2, 'min_samples_leaf': 1, 'max_features': 'sqrt', 'bootstrap': False, 'criterion': 'squared_error'}. Best is trial 874 with value: 0.32176430753353746.
[I 2024-12-04 20:17:12,603] Trial 1415 finished with value: 0.3868666521369068 and parameters: {'n_estimators': 486, 'max_depth': 44, 'min_samples_split': 3, 'min_samples_leaf': 1, 'max_features': 'sqrt', 'bootstrap': False, 'criterion': 'squared_error'}. Best is trial 874 with value: 0.32176430753353746.
[I 2024-12-04 20:17:13,795] Trial 1414 finished with value: 1.1587776084408978 and parameters: {'n_estimators': 508, 'max_depth': 12, 'min_samples_split': 11, 'min_samples_leaf': 5, 'max_features': 'sqrt', 'bootstrap': False, 'criterion': 'absolute_error'}. Best is trial 874 with value: 0.32176430753353746.
[I 2024-12-04 20:17:13,944] Trial 1416 finished with value: 0.3289516072405288 and parameters: {'n_estimators': 485, 'max_depth': 50, 'min_samples_split': 2, 'min_samples_leaf': 1, 'max_features': 'sqrt', 'bootstrap': False, 'criterion': 'squared_error'}. Best is trial 874 with value: 0.32176430753353746.
[I 2024-12-04 20:17:15,446] Trial 1417 finished with value: 0.35100449011492013 and parameters: {'n_estimators': 435, 'max_depth': 44, 'min_samples_split': 2, 'min_samples_leaf': 1, 'max_features': 'sqrt', 'bootstrap': False, 'criterion': 'squared_error'}. Best is trial 874 with value: 0.32176430753353746.
[I 2024-12-04 20:17:15,515] Trial 1418 finished with value: 0.7024969939417216 and parameters: {'n_estimators': 454, 'max_depth': 41, 'min_samples_split': 3, 'min_samples_leaf': 2, 'max_features': 'sqrt', 'bootstrap': False, 'criterion': 'squared_error'}. Best is trial 874 with value: 0.32176430753353746.
[I 2024-12-04 20:17:17,193] Trial 1419 finished with value: 0.3278854842388054 and parameters: {'n_estimators': 446, 'max_depth': 50, 'min_samples_split': 2, 'min_samples_leaf': 1, 'max_features': 'sqrt', 'bootstrap': False, 'criterion': 'squared_error'}. Best is trial 874 with value: 0.32176430753353746.
[I 2024-12-04 20:17:17,745] Trial 1421 finished with value: 0.6666564045233554 and parameters: {'n_estimators': 336, 'max_depth': 50, 'min_samples_split': 2, 'min_samples_leaf': 2, 'max_features': 'sqrt', 'bootstrap': False, 'criterion': 'squared_error'}. Best is trial 874 with value: 0.32176430753353746.
[I 2024-12-04 20:17:18,710] Trial 1420 finished with value: 0.36068282862741685 and parameters: {'n_estimators': 495, 'max_depth': 41, 'min_samples_split': 2, 'min_samples_leaf': 1, 'max_features': 'sqrt', 'bootstrap': False, 'criterion': 'squared_error'}. Best is trial 874 with value: 0.32176430753353746.
[I 2024-12-04 20:17:19,744] Trial 1422 finished with value: 0.3514106899857378 and parameters: {'n_estimators': 432, 'max_depth': 43, 'min_samples_split': 2, 'min_samples_leaf': 1, 'max_features': 'sqrt', 'bootstrap': False, 'criterion': 'squared_error'}. Best is trial 874 with value: 0.32176430753353746.
[I 2024-12-04 20:17:20,889] Trial 1424 finished with value: 0.3750119980747037 and parameters: {'n_estimators': 468, 'max_depth': 49, 'min_samples_split': 3, 'min_samples_leaf': 1, 'max_features': 'sqrt', 'bootstrap': False, 'criterion': 'squared_error'}. Best is trial 874 with value: 0.32176430753353746.
[I 2024-12-04 20:17:22,208] Trial 1425 finished with value: 1.2697213095476616 and parameters: {'n_estimators': 411, 'max_depth': 50, 'min_samples_split': 35, 'min_samples_leaf': 3, 'max_features': 'log2', 'bootstrap': False, 'criterion': 'absolute_error'}. Best is trial 874 with value: 0.32176430753353746.
[I 2024-12-04 20:17:23,287] Trial 1426 finished with value: 0.3228500191479252 and parameters: {'n_estimators': 409, 'max_depth': 50, 'min_samples_split': 2, 'min_samples_leaf': 1, 'max_features': 'sqrt', 'bootstrap': False, 'criterion': 'squared_error'}. Best is trial 874 with value: 0.32176430753353746.
[I 2024-12-04 20:17:24,223] Trial 1423 finished with value: 0.3670920056787812 and parameters: {'n_estimators': 233, 'max_depth': 50, 'min_samples_split': 3, 'min_samples_leaf': 1, 'max_features': 'sqrt', 'bootstrap': False, 'criterion': 'absolute_error'}. Best is trial 874 with value: 0.32176430753353746.
[I 2024-12-04 20:17:24,892] Trial 1427 finished with value: 0.36550621298242175 and parameters: {'n_estimators': 582, 'max_depth': 50, 'min_samples_split': 3, 'min_samples_leaf': 1, 'max_features': 'sqrt', 'bootstrap': False, 'criterion': 'squared_error'}. Best is trial 874 with value: 0.32176430753353746.
[I 2024-12-04 20:17:26,017] Trial 1428 finished with value: 0.32829015086963315 and parameters: {'n_estimators': 445, 'max_depth': 50, 'min_samples_split': 2, 'min_samples_leaf': 1, 'max_features': 'sqrt', 'bootstrap': False, 'criterion': 'squared_error'}. Best is trial 874 with value: 0.32176430753353746.
[I 2024-12-04 20:17:26,516] Trial 1429 finished with value: 0.32322494444398325 and parameters: {'n_estimators': 338, 'max_depth': 50, 'min_samples_split': 2, 'min_samples_leaf': 1, 'max_features': 'sqrt', 'bootstrap': False, 'criterion': 'squared_error'}. Best is trial 874 with value: 0.32176430753353746.
[I 2024-12-04 20:17:27,007] Trial 1430 finished with value: 0.3874661230082653 and parameters: {'n_estimators': 421, 'max_depth': 50, 'min_samples_split': 4, 'min_samples_leaf': 1, 'max_features': 'sqrt', 'bootstrap': False, 'criterion': 'squared_error'}. Best is trial 874 with value: 0.32176430753353746.
[I 2024-12-04 20:17:27,731] Trial 1431 finished with value: 0.6714453503869148 and parameters: {'n_estimators': 364, 'max_depth': 50, 'min_samples_split': 2, 'min_samples_leaf': 2, 'max_features': 'sqrt', 'bootstrap': False, 'criterion': 'squared_error'}. Best is trial 874 with value: 0.32176430753353746.
[I 2024-12-04 20:17:28,395] Trial 1432 finished with value: 0.6884755699123246 and parameters: {'n_estimators': 438, 'max_depth': 50, 'min_samples_split': 3, 'min_samples_leaf': 2, 'max_features': 'sqrt', 'bootstrap': False, 'criterion': 'squared_error'}. Best is trial 874 with value: 0.32176430753353746.
[I 2024-12-04 20:17:29,517] Trial 1433 finished with value: 0.32310904857962464 and parameters: {'n_estimators': 394, 'max_depth': 50, 'min_samples_split': 2, 'min_samples_leaf': 1, 'max_features': 'sqrt', 'bootstrap': False, 'criterion': 'squared_error'}. Best is trial 874 with value: 0.32176430753353746.
[I 2024-12-04 20:17:29,521] Trial 1434 finished with value: 0.5362409542092585 and parameters: {'n_estimators': 142, 'max_depth': 31, 'min_samples_split': 2, 'min_samples_leaf': 3, 'max_features': None, 'bootstrap': False, 'criterion': 'squared_error'}. Best is trial 874 with value: 0.32176430753353746.
[I 2024-12-04 20:17:31,501] Trial 1435 finished with value: 0.5373527154151058 and parameters: {'n_estimators': 351, 'max_depth': 50, 'min_samples_split': 2, 'min_samples_leaf': 2, 'max_features': None, 'bootstrap': False, 'criterion': 'squared_error'}. Best is trial 874 with value: 0.32176430753353746.
[I 2024-12-04 20:17:31,636] Trial 1436 finished with value: 0.323547281469707 and parameters: {'n_estimators': 328, 'max_depth': 50, 'min_samples_split': 2, 'min_samples_leaf': 1, 'max_features': 'sqrt', 'bootstrap': False, 'criterion': 'squared_error'}. Best is trial 874 with value: 0.32176430753353746.
[I 2024-12-04 20:17:32,348] Trial 1437 finished with value: 0.35142872072873427 and parameters: {'n_estimators': 431, 'max_depth': 43, 'min_samples_split': 2, 'min_samples_leaf': 1, 'max_features': 'sqrt', 'bootstrap': False, 'criterion': 'squared_error'}. Best is trial 874 with value: 0.32176430753353746.
[I 2024-12-04 20:17:33,896] Trial 1439 finished with value: 1.2191932380203496 and parameters: {'n_estimators': 778, 'max_depth': 50, 'min_samples_split': 2, 'min_samples_leaf': 11, 'max_features': 'sqrt', 'bootstrap': True, 'criterion': 'squared_error'}. Best is trial 874 with value: 0.32176430753353746.
[I 2024-12-04 20:17:34,063] Trial 1438 finished with value: 0.32176430753353746 and parameters: {'n_estimators': 375, 'max_depth': 50, 'min_samples_split': 2, 'min_samples_leaf': 1, 'max_features': 'sqrt', 'bootstrap': False, 'criterion': 'squared_error'}. Best is trial 874 with value: 0.32176430753353746.
[I 2024-12-04 20:17:34,595] Trial 1440 finished with value: 0.40909149530510097 and parameters: {'n_estimators': 367, 'max_depth': 42, 'min_samples_split': 4, 'min_samples_leaf': 1, 'max_features': 'sqrt', 'bootstrap': False, 'criterion': 'squared_error'}. Best is trial 874 with value: 0.32176430753353746.
[I 2024-12-04 20:17:36,157] Trial 1441 finished with value: 1.3407549397530192 and parameters: {'n_estimators': 889, 'max_depth': 49, 'min_samples_split': 2, 'min_samples_leaf': 14, 'max_features': 'log2', 'bootstrap': False, 'criterion': 'absolute_error'}. Best is trial 874 with value: 0.32176430753353746.
[I 2024-12-04 20:17:36,749] Trial 1442 finished with value: 0.3233071635671472 and parameters: {'n_estimators': 392, 'max_depth': 50, 'min_samples_split': 2, 'min_samples_leaf': 1, 'max_features': 'sqrt', 'bootstrap': False, 'criterion': 'squared_error'}. Best is trial 874 with value: 0.32176430753353746.
[I 2024-12-04 20:17:37,652] Trial 1443 finished with value: 0.35054986422488205 and parameters: {'n_estimators': 417, 'max_depth': 43, 'min_samples_split': 2, 'min_samples_leaf': 1, 'max_features': 'sqrt', 'bootstrap': False, 'criterion': 'squared_error'}. Best is trial 874 with value: 0.32176430753353746.
[I 2024-12-04 20:17:37,778] Trial 1444 finished with value: 1.3415859987306118 and parameters: {'n_estimators': 468, 'max_depth': 29, 'min_samples_split': 9, 'min_samples_leaf': 13, 'max_features': 'log2', 'bootstrap': False, 'criterion': 'absolute_error'}. Best is trial 874 with value: 0.32176430753353746.
[I 2024-12-04 20:17:39,253] Trial 1445 finished with value: 0.3925588500328196 and parameters: {'n_estimators': 493, 'max_depth': 49, 'min_samples_split': 4, 'min_samples_leaf': 1, 'max_features': 'sqrt', 'bootstrap': False, 'criterion': 'squared_error'}. Best is trial 874 with value: 0.32176430753353746.
[I 2024-12-04 20:17:40,046] Trial 1447 finished with value: 0.5519915547556397 and parameters: {'n_estimators': 375, 'max_depth': 45, 'min_samples_split': 2, 'min_samples_leaf': 1, 'max_features': 'log2', 'bootstrap': False, 'criterion': 'squared_error'}. Best is trial 874 with value: 0.32176430753353746.
[I 2024-12-04 20:17:41,209] Trial 1449 finished with value: 0.6778732912374746 and parameters: {'n_estimators': 321, 'max_depth': 41, 'min_samples_split': 2, 'min_samples_leaf': 2, 'max_features': 'sqrt', 'bootstrap': False, 'criterion': 'squared_error'}. Best is trial 874 with value: 0.32176430753353746.
[I 2024-12-04 20:17:42,265] Trial 1448 finished with value: 0.4273122844385168 and parameters: {'n_estimators': 300, 'max_depth': 48, 'min_samples_split': 4, 'min_samples_leaf': 1, 'max_features': None, 'bootstrap': False, 'criterion': 'squared_error'}. Best is trial 874 with value: 0.32176430753353746.
[I 2024-12-04 20:17:42,781] Trial 1450 finished with value: 0.6874225828869959 and parameters: {'n_estimators': 501, 'max_depth': 50, 'min_samples_split': 2, 'min_samples_leaf': 2, 'max_features': 'sqrt', 'bootstrap': False, 'criterion': 'squared_error'}. Best is trial 874 with value: 0.32176430753353746.
[I 2024-12-04 20:17:44,681] Trial 1451 finished with value: 0.41539525833205737 and parameters: {'n_estimators': 522, 'max_depth': 40, 'min_samples_split': 2, 'min_samples_leaf': 1, 'max_features': 'sqrt', 'bootstrap': True, 'criterion': 'squared_error'}. Best is trial 874 with value: 0.32176430753353746.
[I 2024-12-04 20:17:46,706] Trial 1453 finished with value: 0.32361613927664123 and parameters: {'n_estimators': 389, 'max_depth': 50, 'min_samples_split': 2, 'min_samples_leaf': 1, 'max_features': 'sqrt', 'bootstrap': False, 'criterion': 'squared_error'}. Best is trial 874 with value: 0.32176430753353746.
[I 2024-12-04 20:17:48,070] Trial 1454 finished with value: 0.47611336527854076 and parameters: {'n_estimators': 263, 'max_depth': 28, 'min_samples_split': 2, 'min_samples_leaf': 1, 'max_features': 'sqrt', 'bootstrap': False, 'criterion': 'squared_error'}. Best is trial 874 with value: 0.32176430753353746.
[I 2024-12-04 20:17:49,248] Trial 1455 finished with value: 0.6663909192947454 and parameters: {'n_estimators': 347, 'max_depth': 50, 'min_samples_split': 4, 'min_samples_leaf': 2, 'max_features': 'sqrt', 'bootstrap': False, 'criterion': 'squared_error'}. Best is trial 874 with value: 0.32176430753353746.
[I 2024-12-04 20:17:51,251] Trial 1456 finished with value: 0.3232232374354694 and parameters: {'n_estimators': 385, 'max_depth': 50, 'min_samples_split': 2, 'min_samples_leaf': 1, 'max_features': 'sqrt', 'bootstrap': False, 'criterion': 'squared_error'}. Best is trial 874 with value: 0.32176430753353746.
[I 2024-12-04 20:17:53,053] Trial 1457 finished with value: 0.34609327291607367 and parameters: {'n_estimators': 342, 'max_depth': 43, 'min_samples_split': 2, 'min_samples_leaf': 1, 'max_features': 'sqrt', 'bootstrap': False, 'criterion': 'squared_error'}. Best is trial 874 with value: 0.32176430753353746.
[I 2024-12-04 20:17:54,999] Trial 1458 finished with value: 1.3349033920694067 and parameters: {'n_estimators': 928, 'max_depth': 47, 'min_samples_split': 5, 'min_samples_leaf': 7, 'max_features': 'log2', 'bootstrap': True, 'criterion': 'absolute_error'}. Best is trial 874 with value: 0.32176430753353746.
[I 2024-12-04 20:17:56,864] Trial 1459 finished with value: 0.32269081148361717 and parameters: {'n_estimators': 339, 'max_depth': 50, 'min_samples_split': 2, 'min_samples_leaf': 1, 'max_features': 'sqrt', 'bootstrap': False, 'criterion': 'squared_error'}. Best is trial 874 with value: 0.32176430753353746.
[I 2024-12-04 20:17:58,256] Trial 1452 finished with value: 0.36945221478989776 and parameters: {'n_estimators': 627, 'max_depth': 50, 'min_samples_split': 3, 'min_samples_leaf': 1, 'max_features': 'sqrt', 'bootstrap': False, 'criterion': 'absolute_error'}. Best is trial 874 with value: 0.32176430753353746.
[I 2024-12-04 20:17:59,069] Trial 1460 finished with value: 0.3235042880148085 and parameters: {'n_estimators': 388, 'max_depth': 50, 'min_samples_split': 2, 'min_samples_leaf': 1, 'max_features': 'sqrt', 'bootstrap': False, 'criterion': 'squared_error'}. Best is trial 874 with value: 0.32176430753353746.
[I 2024-12-04 20:18:00,773] Trial 1462 finished with value: 0.5095452242866388 and parameters: {'n_estimators': 335, 'max_depth': 50, 'min_samples_split': 2, 'min_samples_leaf': 1, 'max_features': 'log2', 'bootstrap': False, 'criterion': 'squared_error'}. Best is trial 874 with value: 0.32176430753353746.
[I 2024-12-04 20:18:07,463] Trial 1461 finished with value: 0.36742046435869485 and parameters: {'n_estimators': 374, 'max_depth': 50, 'min_samples_split': 3, 'min_samples_leaf': 1, 'max_features': 'sqrt', 'bootstrap': False, 'criterion': 'absolute_error'}. Best is trial 874 with value: 0.32176430753353746.
[I 2024-12-04 20:18:10,669] Trial 1464 finished with value: 0.6466575547463412 and parameters: {'n_estimators': 921, 'max_depth': 27, 'min_samples_split': 35, 'min_samples_leaf': 4, 'max_features': None, 'bootstrap': True, 'criterion': 'squared_error'}. Best is trial 874 with value: 0.32176430753353746.
[I 2024-12-04 20:18:11,380] Trial 1446 finished with value: 0.5109623292996538 and parameters: {'n_estimators': 523, 'max_depth': 45, 'min_samples_split': 2, 'min_samples_leaf': 3, 'max_features': None, 'bootstrap': False, 'criterion': 'absolute_error'}. Best is trial 874 with value: 0.32176430753353746.
[I 2024-12-04 20:18:11,983] Trial 1465 finished with value: 0.6654216375889996 and parameters: {'n_estimators': 294, 'max_depth': 43, 'min_samples_split': 4, 'min_samples_leaf': 2, 'max_features': 'sqrt', 'bootstrap': False, 'criterion': 'squared_error'}. Best is trial 874 with value: 0.32176430753353746.
[I 2024-12-04 20:18:12,525] Trial 1463 finished with value: 0.34306351817134606 and parameters: {'n_estimators': 450, 'max_depth': 50, 'min_samples_split': 2, 'min_samples_leaf': 1, 'max_features': 'sqrt', 'bootstrap': False, 'criterion': 'absolute_error'}. Best is trial 874 with value: 0.32176430753353746.
[I 2024-12-04 20:18:13,969] Trial 1468 finished with value: 0.675347020744112 and parameters: {'n_estimators': 349, 'max_depth': 43, 'min_samples_split': 2, 'min_samples_leaf': 2, 'max_features': 'sqrt', 'bootstrap': False, 'criterion': 'squared_error'}. Best is trial 874 with value: 0.32176430753353746.
