[I 2024-12-03 18:57:42,455] Trial 1117 finished with value: 0.13756857250033122 and parameters: {'kernel': 'linear', 'C': 77.64869864609952, 'gamma': 0.02851186321493376, 'epsilon': 0.02207890736280316}. Best is trial 345 with value: 0.13438257115663557.
[I 2024-12-03 18:57:43,635] Trial 1192 finished with value: 0.13498552579187614 and parameters: {'kernel': 'linear', 'C': 13.590072795427407, 'gamma': 0.003955901465919184, 'epsilon': 0.06385251013884548}. Best is trial 345 with value: 0.13438257115663557.
[I 2024-12-03 18:57:43,635] Trial 1195 finished with value: 0.13593502354213038 and parameters: {'kernel': 'linear', 'C': 5.931772146903052, 'gamma': 0.018939907624958282, 'epsilon': 0.05548533029638649}. Best is trial 345 with value: 0.13438257115663557.
[I 2024-12-03 18:57:43,719] Trial 1181 finished with value: 0.13539430386408133 and parameters: {'kernel': 'linear', 'C': 19.14754081435742, 'gamma': 0.0029696103445283626, 'epsilon': 0.028703878060884033}. Best is trial 345 with value: 0.13438257115663557.
[I 2024-12-03 18:57:44,280] Trial 1113 finished with value: 0.13564826039717995 and parameters: {'kernel': 'linear', 'C': 83.50283979157427, 'gamma': 0.002220454895511303, 'epsilon': 0.02701371417795181}. Best is trial 345 with value: 0.13438257115663557.
[I 2024-12-03 18:57:44,758] Trial 1168 finished with value: 0.137877048628236 and parameters: {'kernel': 'linear', 'C': 20.41906114948923, 'gamma': 0.012785170110247891, 'epsilon': 0.014166714088108306}. Best is trial 345 with value: 0.13438257115663557.
[I 2024-12-03 18:57:46,453] Trial 1201 finished with value: 1.0778325905936355 and parameters: {'kernel': 'poly', 'C': 0.07314798686165437, 'gamma': 0.011181358160454858, 'epsilon': 0.006997152105364654}. Best is trial 345 with value: 0.13438257115663557.
[I 2024-12-03 18:57:47,882] Trial 1204 finished with value: 0.1893478441444476 and parameters: {'kernel': 'linear', 'C': 3.557946439670266, 'gamma': 0.1260007417799664, 'epsilon': 0.2228136257868166}. Best is trial 345 with value: 0.13438257115663557.
[I 2024-12-03 18:57:47,918] Trial 1199 finished with value: 0.1409466603526112 and parameters: {'kernel': 'linear', 'C': 8.784538819967507, 'gamma': 0.0016766987489795643, 'epsilon': 0.09802119524231685}. Best is trial 345 with value: 0.13438257115663557.
[I 2024-12-03 18:57:48,164] Trial 1202 finished with value: 0.14514765344714073 and parameters: {'kernel': 'linear', 'C': 2.9680506018822594, 'gamma': 0.0020305872087782316, 'epsilon': 0.08440852319589995}. Best is trial 345 with value: 0.13438257115663557.
[I 2024-12-03 18:57:51,644] Trial 1203 finished with value: 0.13986101756800637 and parameters: {'kernel': 'linear', 'C': 25.742749176310795, 'gamma': 0.02876737742546316, 'epsilon': 0.09961931361001283}. Best is trial 345 with value: 0.13438257115663557.
[I 2024-12-03 18:57:53,000] Trial 1132 finished with value: 0.1350233197314596 and parameters: {'kernel': 'linear', 'C': 90.64493618638315, 'gamma': 0.009516450859673226, 'epsilon': 0.02943948634804256}. Best is trial 345 with value: 0.13438257115663557.
[I 2024-12-03 18:57:53,045] Trial 1200 finished with value: 0.13762169389946444 and parameters: {'kernel': 'linear', 'C': 6.061027596804726, 'gamma': 0.005771955228452786, 'epsilon': 0.005237794559859789}. Best is trial 345 with value: 0.13438257115663557.
[I 2024-12-03 18:57:54,356] Trial 1210 finished with value: 0.764806740068354 and parameters: {'kernel': 'poly', 'C': 2.263958324141832, 'gamma': 0.0017895411480484814, 'epsilon': 0.1330060904774604}. Best is trial 345 with value: 0.13438257115663557.
[I 2024-12-03 18:57:54,532] Trial 1139 finished with value: 0.13543895134617198 and parameters: {'kernel': 'linear', 'C': 86.39215221553289, 'gamma': 0.003447517653875542, 'epsilon': 0.028226515314075377}. Best is trial 345 with value: 0.13438257115663557.
[I 2024-12-03 18:57:54,565] Trial 1209 finished with value: 0.16461015099350804 and parameters: {'kernel': 'linear', 'C': 0.3204218303470094, 'gamma': 0.008326540070844466, 'epsilon': 0.04837747675916189}. Best is trial 345 with value: 0.13438257115663557.
[I 2024-12-03 18:57:55,653] Trial 1147 finished with value: 0.13564526856531026 and parameters: {'kernel': 'linear', 'C': 89.57042659670188, 'gamma': 0.004612908117630486, 'epsilon': 0.03425922768960712}. Best is trial 345 with value: 0.13438257115663557.
[I 2024-12-03 18:57:56,222] Trial 1189 finished with value: 0.1363036226626972 and parameters: {'kernel': 'linear', 'C': 18.91254953744044, 'gamma': 0.021745800667433906, 'epsilon': 0.0245646631422465}. Best is trial 345 with value: 0.13438257115663557.
[I 2024-12-03 18:57:56,744] Trial 1212 finished with value: 0.44497731104792065 and parameters: {'kernel': 'linear', 'C': 0.0012203812934972207, 'gamma': 0.00010108969324575066, 'epsilon': 0.008584960078938652}. Best is trial 345 with value: 0.13438257115663557.
[I 2024-12-03 18:57:59,381] Trial 1214 finished with value: 0.1406797224680382 and parameters: {'kernel': 'linear', 'C': 5.754287287090251, 'gamma': 0.06309815273755255, 'epsilon': 0.0815872475257524}. Best is trial 345 with value: 0.13438257115663557.
[I 2024-12-03 18:58:02,070] Trial 1206 finished with value: 0.33674307189697433 and parameters: {'kernel': 'poly', 'C': 83.66688683343486, 'gamma': 0.03351479654488935, 'epsilon': 0.05511815027257804}. Best is trial 345 with value: 0.13438257115663557.
[I 2024-12-03 18:58:05,732] Trial 1184 finished with value: 0.13809741950446566 and parameters: {'kernel': 'linear', 'C': 91.70775581384262, 'gamma': 0.004780915692680101, 'epsilon': 0.07946286902898958}. Best is trial 345 with value: 0.13438257115663557.
[I 2024-12-03 18:58:05,764] Trial 1128 finished with value: 0.13587914694752518 and parameters: {'kernel': 'linear', 'C': 80.82196080457783, 'gamma': 0.00301220110844952, 'epsilon': 0.025390369984336494}. Best is trial 345 with value: 0.13438257115663557.
[I 2024-12-03 18:58:06,645] Trial 1158 finished with value: 0.13576765523174963 and parameters: {'kernel': 'linear', 'C': 99.83651977003953, 'gamma': 0.028392347702499692, 'epsilon': 0.06780726634893747}. Best is trial 345 with value: 0.13438257115663557.
[I 2024-12-03 18:58:07,893] Trial 1217 finished with value: 0.14260249174919806 and parameters: {'kernel': 'linear', 'C': 19.887608667533822, 'gamma': 0.0038963120457780154, 'epsilon': 0.11233217392783061}. Best is trial 345 with value: 0.13438257115663557.
[I 2024-12-03 18:58:08,375] Trial 1221 finished with value: 1.0365562484241186 and parameters: {'kernel': 'poly', 'C': 0.0031463828297524812, 'gamma': 0.010531815994634602, 'epsilon': 0.0010444980904967048}. Best is trial 345 with value: 0.13438257115663557.
[I 2024-12-03 18:58:09,192] Trial 1213 finished with value: 0.13574845539454528 and parameters: {'kernel': 'linear', 'C': 15.586962186532102, 'gamma': 0.006171395324305073, 'epsilon': 0.03485613505685784}. Best is trial 345 with value: 0.13438257115663557.
[I 2024-12-03 18:58:09,693] Trial 1207 finished with value: 0.13547597520826937 and parameters: {'kernel': 'linear', 'C': 19.0861933681227, 'gamma': 0.012124379789334628, 'epsilon': 0.0327155577118275}. Best is trial 345 with value: 0.13438257115663557.
[I 2024-12-03 18:58:11,119] Trial 1215 finished with value: 0.13705216451933935 and parameters: {'kernel': 'linear', 'C': 21.56197038632485, 'gamma': 0.01325501125752989, 'epsilon': 0.04574741160276455}. Best is trial 345 with value: 0.13438257115663557.
[I 2024-12-03 18:58:11,126] Trial 1225 finished with value: 0.41887001469263835 and parameters: {'kernel': 'sigmoid', 'C': 2.691364283029355, 'gamma': 0.0012530781546869296, 'epsilon': 0.04722567270491905}. Best is trial 345 with value: 0.13438257115663557.
[I 2024-12-03 18:58:12,695] Trial 1227 finished with value: 16.06446180000765 and parameters: {'kernel': 'sigmoid', 'C': 23.21352316704705, 'gamma': 0.0032827589680529817, 'epsilon': 0.04413730516669227}. Best is trial 345 with value: 0.13438257115663557.
[I 2024-12-03 18:58:13,060] Trial 1223 finished with value: 0.14083794885471432 and parameters: {'kernel': 'linear', 'C': 18.13598263861447, 'gamma': 0.03051802707760092, 'epsilon': 0.10706765474841509}. Best is trial 345 with value: 0.13438257115663557.
[I 2024-12-03 18:58:14,612] Trial 1229 finished with value: 1.2208528741984552 and parameters: {'kernel': 'poly', 'C': 8.567300365104717, 'gamma': 0.0005590584278458266, 'epsilon': 0.017984120076010884}. Best is trial 345 with value: 0.13438257115663557.
[I 2024-12-03 18:58:15,066] Trial 1205 finished with value: 0.1402529810098753 and parameters: {'kernel': 'linear', 'C': 87.29334971951249, 'gamma': 0.005123708380277802, 'epsilon': 0.10280049370925304}. Best is trial 345 with value: 0.13438257115663557.
[I 2024-12-03 18:58:15,495] Trial 1226 finished with value: 0.13632230269642723 and parameters: {'kernel': 'linear', 'C': 2.6104666599144135, 'gamma': 0.515023785905701, 'epsilon': 0.043124726824006164}. Best is trial 345 with value: 0.13438257115663557.
[I 2024-12-03 18:58:16,945] Trial 1228 finished with value: 0.14234918262399698 and parameters: {'kernel': 'linear', 'C': 21.44956699748989, 'gamma': 0.002091993937853542, 'epsilon': 0.09588980358874691}. Best is trial 345 with value: 0.13438257115663557.
[I 2024-12-03 18:58:20,532] Trial 1231 finished with value: 0.13609595090973425 and parameters: {'kernel': 'linear', 'C': 3.8664411372701313, 'gamma': 0.0009217640663177392, 'epsilon': 0.03542997531189254}. Best is trial 345 with value: 0.13438257115663557.
[I 2024-12-03 18:58:21,195] Trial 1144 finished with value: 0.13593355599374804 and parameters: {'kernel': 'linear', 'C': 98.8099029407727, 'gamma': 0.02887872809871169, 'epsilon': 0.025216994761912505}. Best is trial 345 with value: 0.13438257115663557.
[I 2024-12-03 18:58:21,512] Trial 1219 finished with value: 0.1380058549050309 and parameters: {'kernel': 'linear', 'C': 11.812424399014244, 'gamma': 0.03846539171745608, 'epsilon': 0.016964927168720282}. Best is trial 345 with value: 0.13438257115663557.
[I 2024-12-03 18:58:23,668] Trial 1234 finished with value: 0.13649206376017242 and parameters: {'kernel': 'linear', 'C': 4.266357639887355, 'gamma': 0.0193761118494356, 'epsilon': 0.06795303596084835}. Best is trial 345 with value: 0.13438257115663557.
[I 2024-12-03 18:58:24,536] Trial 1218 finished with value: 0.13799226021043842 and parameters: {'kernel': 'linear', 'C': 16.52331413080291, 'gamma': 0.0013559122964033898, 'epsilon': 0.016355954467511896}. Best is trial 345 with value: 0.13438257115663557.
[I 2024-12-03 18:58:24,885] Trial 1237 finished with value: 1.35552896924454 and parameters: {'kernel': 'rbf', 'C': 0.0013930133679110784, 'gamma': 0.00016461265528560666, 'epsilon': 0.27155953671353034}. Best is trial 345 with value: 0.13438257115663557.
[I 2024-12-03 18:58:25,693] Trial 1208 finished with value: 0.1372234686870403 and parameters: {'kernel': 'linear', 'C': 97.59969157017362, 'gamma': 0.009325098591908868, 'epsilon': 0.07558148206174102}. Best is trial 345 with value: 0.13438257115663557.
[I 2024-12-03 18:58:26,072] Trial 1108 finished with value: 0.13581902659431008 and parameters: {'kernel': 'linear', 'C': 93.11446874404001, 'gamma': 0.011010956715860996, 'epsilon': 0.02557549231084638}. Best is trial 345 with value: 0.13438257115663557.
[I 2024-12-03 18:58:26,629] Trial 1198 finished with value: 0.13726051816263332 and parameters: {'kernel': 'linear', 'C': 89.95738679075568, 'gamma': 0.01018643077955851, 'epsilon': 0.047895111942248145}. Best is trial 345 with value: 0.13438257115663557.
[I 2024-12-03 18:58:27,353] Trial 1240 finished with value: 1.338764185196755 and parameters: {'kernel': 'rbf', 'C': 0.02920134084844881, 'gamma': 0.9408617118985034, 'epsilon': 0.01499504875008184}. Best is trial 345 with value: 0.13438257115663557.
[I 2024-12-03 18:58:32,601] Trial 1238 finished with value: 0.13616464900272146 and parameters: {'kernel': 'linear', 'C': 4.033442576572593, 'gamma': 0.00887291676735928, 'epsilon': 0.03813673067106909}. Best is trial 345 with value: 0.13438257115663557.
[I 2024-12-03 18:58:33,054] Trial 1180 finished with value: 0.1386713140379902 and parameters: {'kernel': 'linear', 'C': 47.078637885641896, 'gamma': 0.026361156516699822, 'epsilon': 0.010959808676282538}. Best is trial 345 with value: 0.13438257115663557.
[I 2024-12-03 18:58:33,364] Trial 1222 finished with value: 0.13576455074316549 and parameters: {'kernel': 'linear', 'C': 24.51593196253614, 'gamma': 0.0013117383999391005, 'epsilon': 0.036577169384812515}. Best is trial 345 with value: 0.13438257115663557.
[I 2024-12-03 18:58:33,713] Trial 1157 finished with value: 0.13697862365636515 and parameters: {'kernel': 'linear', 'C': 85.07986045314198, 'gamma': 0.0055276779896349425, 'epsilon': 0.019364772275981438}. Best is trial 345 with value: 0.13438257115663557.
[I 2024-12-03 18:58:34,791] Trial 1246 finished with value: 0.20837740937899535 and parameters: {'kernel': 'linear', 'C': 0.4340854560742045, 'gamma': 0.02577138299950528, 'epsilon': 0.19164911970808496}. Best is trial 345 with value: 0.13438257115663557.
[I 2024-12-03 18:58:35,058] Trial 1247 finished with value: 1.3282805975600354 and parameters: {'kernel': 'sigmoid', 'C': 0.01555111654266084, 'gamma': 0.7613050557971334, 'epsilon': 0.7748413016769805}. Best is trial 345 with value: 0.13438257115663557.
[I 2024-12-03 18:58:36,180] Trial 1248 finished with value: 0.16148368382489162 and parameters: {'kernel': 'linear', 'C': 3.984842320214241, 'gamma': 0.012096355558052444, 'epsilon': 0.15223846532516924}. Best is trial 345 with value: 0.13438257115663557.
[I 2024-12-03 18:58:38,291] Trial 1245 finished with value: 0.13692154613914095 and parameters: {'kernel': 'linear', 'C': 7.094355413189419, 'gamma': 0.13926322414695472, 'epsilon': 0.0734660412743053}. Best is trial 345 with value: 0.13438257115663557.
[I 2024-12-03 18:58:40,483] Trial 1251 finished with value: 0.14179047593921382 and parameters: {'kernel': 'linear', 'C': 2.335191806869073, 'gamma': 0.0004701988549170989, 'epsilon': 0.0737877098109389}. Best is trial 345 with value: 0.13438257115663557.
[I 2024-12-03 18:58:40,485] Trial 1230 finished with value: 0.135390914052524 and parameters: {'kernel': 'linear', 'C': 30.60933272845728, 'gamma': 0.0070765229375222265, 'epsilon': 0.028811965966062877}. Best is trial 345 with value: 0.13438257115663557.
[I 2024-12-03 18:58:41,240] Trial 1239 finished with value: 0.13781004519805864 and parameters: {'kernel': 'linear', 'C': 12.9106759102364, 'gamma': 0.022962184887409136, 'epsilon': 0.018016017950527673}. Best is trial 345 with value: 0.13438257115663557.
[I 2024-12-03 18:58:41,385] Trial 1185 finished with value: 0.1354111093319033 and parameters: {'kernel': 'linear', 'C': 82.66159539299623, 'gamma': 0.0022151829736427593, 'epsilon': 0.028340679196780044}. Best is trial 345 with value: 0.13438257115663557.
[I 2024-12-03 18:58:42,929] Trial 1254 finished with value: 0.6792368318591391 and parameters: {'kernel': 'poly', 'C': 7.174534449349905, 'gamma': 0.0072094685327353724, 'epsilon': 0.017512571237321996}. Best is trial 345 with value: 0.13438257115663557.
[I 2024-12-03 18:58:44,749] Trial 1249 finished with value: 0.1357086754019746 and parameters: {'kernel': 'linear', 'C': 8.8861824834528, 'gamma': 0.0032543729329258934, 'epsilon': 0.03688636080637562}. Best is trial 345 with value: 0.13438257115663557.
[I 2024-12-03 18:58:44,961] Trial 1253 finished with value: 0.1758222874610592 and parameters: {'kernel': 'linear', 'C': 35.661647404824166, 'gamma': 0.012809173254270435, 'epsilon': 0.19706950210463706}. Best is trial 345 with value: 0.13438257115663557.
[I 2024-12-03 18:58:46,174] Trial 1257 finished with value: 1378.899858951107 and parameters: {'kernel': 'sigmoid', 'C': 67.26463966000219, 'gamma': 0.7087629897940854, 'epsilon': 0.04004059347836796}. Best is trial 345 with value: 0.13438257115663557.
[I 2024-12-03 18:58:46,566] Trial 1258 finished with value: 0.9638358683292182 and parameters: {'kernel': 'rbf', 'C': 0.08989537296653699, 'gamma': 0.0739322623213283, 'epsilon': 0.1710777296187819}. Best is trial 345 with value: 0.13438257115663557.
[I 2024-12-03 18:58:48,495] Trial 1260 finished with value: 0.16015446158542035 and parameters: {'kernel': 'linear', 'C': 9.316696980565718, 'gamma': 0.0025830205123445684, 'epsilon': 0.17626561539030172}. Best is trial 345 with value: 0.13438257115663557.
[I 2024-12-03 18:58:50,891] Trial 1250 finished with value: 0.13793602468313315 and parameters: {'kernel': 'linear', 'C': 16.25910382837807, 'gamma': 0.0023661613407953788, 'epsilon': 0.01746964291677775}. Best is trial 345 with value: 0.13438257115663557.
[I 2024-12-03 18:58:51,699] Trial 1256 finished with value: 0.1359766185835809 and parameters: {'kernel': 'linear', 'C': 10.975687900151394, 'gamma': 0.07523328243444088, 'epsilon': 0.05483675713144487}. Best is trial 345 with value: 0.13438257115663557.
[I 2024-12-03 18:58:52,766] Trial 1261 finished with value: 0.1381048309259146 and parameters: {'kernel': 'linear', 'C': 2.2887198236636497, 'gamma': 0.02854262779640259, 'epsilon': 0.021420185136123652}. Best is trial 345 with value: 0.13438257115663557.
[I 2024-12-03 18:58:54,336] Trial 1174 finished with value: 0.1383207982256408 and parameters: {'kernel': 'linear', 'C': 96.021463310322, 'gamma': 0.005902391667031772, 'epsilon': 0.017271092100961838}. Best is trial 345 with value: 0.13438257115663557.
[I 2024-12-03 18:58:55,270] Trial 1165 finished with value: 0.1379349596425115 and parameters: {'kernel': 'linear', 'C': 91.09667996910267, 'gamma': 0.0008640512677704656, 'epsilon': 0.005075493502367879}. Best is trial 345 with value: 0.13438257115663557.
[I 2024-12-03 18:58:57,195] Trial 1242 finished with value: 0.1354672480878458 and parameters: {'kernel': 'linear', 'C': 23.32767649709297, 'gamma': 0.000676358144585894, 'epsilon': 0.028096813790270864}. Best is trial 345 with value: 0.13438257115663557.
[I 2024-12-03 18:58:58,157] Trial 1241 finished with value: 0.13750574632185877 and parameters: {'kernel': 'linear', 'C': 20.70708769709045, 'gamma': 0.011947415970974986, 'epsilon': 0.01816229766110336}. Best is trial 345 with value: 0.13438257115663557.
[I 2024-12-03 18:58:59,228] Trial 1266 finished with value: 0.13611983907334094 and parameters: {'kernel': 'linear', 'C': 13.292189022322233, 'gamma': 0.022216105085489508, 'epsilon': 0.07137037717394791}. Best is trial 345 with value: 0.13438257115663557.
[I 2024-12-03 18:59:00,742] Trial 1122 finished with value: 0.13583166952247655 and parameters: {'kernel': 'linear', 'C': 99.73197911283599, 'gamma': 0.01627384013848858, 'epsilon': 0.03518975255513635}. Best is trial 345 with value: 0.13438257115663557.
[I 2024-12-03 18:59:01,508] Trial 1269 finished with value: 0.13689627515926078 and parameters: {'kernel': 'linear', 'C': 2.401178530148006, 'gamma': 0.008511173462460758, 'epsilon': 0.049981628861293724}. Best is trial 345 with value: 0.13438257115663557.
[I 2024-12-03 18:59:01,637] Trial 1236 finished with value: 0.13512260896862663 and parameters: {'kernel': 'linear', 'C': 87.3614327526333, 'gamma': 0.035584926785940225, 'epsilon': 0.05471262170470105}. Best is trial 345 with value: 0.13438257115663557.
[I 2024-12-03 18:59:03,096] Trial 1267 finished with value: 0.13971855408612044 and parameters: {'kernel': 'linear', 'C': 15.371975826908937, 'gamma': 0.002666735992499403, 'epsilon': 0.08785671451436489}. Best is trial 345 with value: 0.13438257115663557.
[I 2024-12-03 18:59:03,592] Trial 1193 finished with value: 0.13548363439247385 and parameters: {'kernel': 'linear', 'C': 86.29629076947649, 'gamma': 0.009957693938970615, 'epsilon': 0.03811237831707505}. Best is trial 345 with value: 0.13438257115663557.
[I 2024-12-03 18:59:05,548] Trial 1273 finished with value: 0.1372295587299262 and parameters: {'kernel': 'linear', 'C': 1.6924036298912812, 'gamma': 0.058837087903468546, 'epsilon': 0.04313523157774812}. Best is trial 345 with value: 0.13438257115663557.
[I 2024-12-03 18:59:06,747] Trial 1275 finished with value: 0.24251226659480926 and parameters: {'kernel': 'linear', 'C': 5.454504139330314, 'gamma': 0.0005979838789801701, 'epsilon': 0.3451157827345132}. Best is trial 345 with value: 0.13438257115663557.
[I 2024-12-03 18:59:07,996] Trial 1255 finished with value: 0.13574414896604786 and parameters: {'kernel': 'linear', 'C': 20.121295262232117, 'gamma': 0.011684900037478024, 'epsilon': 0.035935677795540945}. Best is trial 345 with value: 0.13438257115663557.
[I 2024-12-03 18:59:15,010] Trial 1272 finished with value: 0.13658991699170192 and parameters: {'kernel': 'linear', 'C': 12.652356424641093, 'gamma': 0.011714266144855856, 'epsilon': 0.043708989239149315}. Best is trial 345 with value: 0.13438257115663557.
[I 2024-12-03 18:59:17,195] Trial 1220 finished with value: 0.13479841308598117 and parameters: {'kernel': 'linear', 'C': 99.40400277908135, 'gamma': 0.0024595806392917617, 'epsilon': 0.030297784096608268}. Best is trial 345 with value: 0.13438257115663557.
[I 2024-12-03 18:59:18,124] Trial 1216 finished with value: 0.1347389067724643 and parameters: {'kernel': 'linear', 'C': 97.93069158703616, 'gamma': 0.022657314712315562, 'epsilon': 0.03047383347472353}. Best is trial 345 with value: 0.13438257115663557.
[I 2024-12-03 18:59:18,961] Trial 1263 finished with value: 0.13542557002269714 and parameters: {'kernel': 'linear', 'C': 22.90771198186934, 'gamma': 0.011369216630491273, 'epsilon': 0.03081652610964225}. Best is trial 345 with value: 0.13438257115663557.
[I 2024-12-03 18:59:19,688] Trial 1271 finished with value: 0.14058922277246605 and parameters: {'kernel': 'linear', 'C': 94.46595765334347, 'gamma': 0.006787556540115483, 'epsilon': 0.09688590411061002}. Best is trial 345 with value: 0.13438257115663557.
