[I 2024-12-04 12:56:50,009] Trial 2146 finished with value: 0.37197225585294075 and parameters: {'n_estimators': 833, 'learning_rate': 0.045211598680182964, 'max_depth': 12, 'min_samples_split': 3, 'min_samples_leaf': 1, 'subsample': 0.6138213037030804, 'max_features': None}. Best is trial 1454 with value: 0.30763307678022894.
[I 2024-12-04 12:56:50,220] Trial 2128 finished with value: 0.31387762185852164 and parameters: {'n_estimators': 1458, 'learning_rate': 0.06828570175461292, 'max_depth': 7, 'min_samples_split': 2, 'min_samples_leaf': 2, 'subsample': 0.7026690898805887, 'max_features': None}. Best is trial 1454 with value: 0.30763307678022894.
[I 2024-12-04 12:56:53,150] Trial 2150 finished with value: 0.32548289701251737 and parameters: {'n_estimators': 848, 'learning_rate': 0.09988581188167521, 'max_depth': 7, 'min_samples_split': 6, 'min_samples_leaf': 2, 'subsample': 0.6907098982067413, 'max_features': None}. Best is trial 1454 with value: 0.30763307678022894.
[I 2024-12-04 12:56:55,135] Trial 2147 finished with value: 0.5287956193028501 and parameters: {'n_estimators': 1066, 'learning_rate': 0.019784085276099185, 'max_depth': 12, 'min_samples_split': 5, 'min_samples_leaf': 7, 'subsample': 0.6637148336159336, 'max_features': 'sqrt'}. Best is trial 1454 with value: 0.30763307678022894.
[I 2024-12-04 12:56:57,359] Trial 2144 finished with value: 0.3333894159548931 and parameters: {'n_estimators': 1217, 'learning_rate': 0.07152219751252298, 'max_depth': 8, 'min_samples_split': 2, 'min_samples_leaf': 2, 'subsample': 0.7094274140987171, 'max_features': None}. Best is trial 1454 with value: 0.30763307678022894.
[I 2024-12-04 12:56:58,980] Trial 2169 finished with value: 0.44385339383351585 and parameters: {'n_estimators': 150, 'learning_rate': 0.028316076938588532, 'max_depth': 11, 'min_samples_split': 4, 'min_samples_leaf': 7, 'subsample': 0.9107977552004343, 'max_features': None}. Best is trial 1454 with value: 0.30763307678022894.
[I 2024-12-04 12:56:58,986] Trial 2153 finished with value: 0.38010664587946674 and parameters: {'n_estimators': 918, 'learning_rate': 0.09902033145209437, 'max_depth': 8, 'min_samples_split': 2, 'min_samples_leaf': 5, 'subsample': 0.7854358821846508, 'max_features': None}. Best is trial 1454 with value: 0.30763307678022894.
[I 2024-12-04 12:56:59,179] Trial 2154 finished with value: 0.37793565492541964 and parameters: {'n_estimators': 888, 'learning_rate': 0.06440598399643313, 'max_depth': 7, 'min_samples_split': 3, 'min_samples_leaf': 3, 'subsample': 0.7772922724034776, 'max_features': None}. Best is trial 1454 with value: 0.30763307678022894.
[I 2024-12-04 12:56:59,888] Trial 2148 finished with value: 0.4154091223216205 and parameters: {'n_estimators': 1295, 'learning_rate': 0.09435087195094816, 'max_depth': 6, 'min_samples_split': 2, 'min_samples_leaf': 2, 'subsample': 0.7279434362409828, 'max_features': 'log2'}. Best is trial 1454 with value: 0.30763307678022894.
[I 2024-12-04 12:57:01,322] Trial 2152 finished with value: 0.39118355165128316 and parameters: {'n_estimators': 1218, 'learning_rate': 0.08300246295387662, 'max_depth': 9, 'min_samples_split': 19, 'min_samples_leaf': 3, 'subsample': 0.7610651194188047, 'max_features': 'sqrt'}. Best is trial 1454 with value: 0.30763307678022894.
[I 2024-12-04 12:57:01,399] Trial 2157 finished with value: 0.4398095147031568 and parameters: {'n_estimators': 1036, 'learning_rate': 0.059768406978285234, 'max_depth': 3, 'min_samples_split': 15, 'min_samples_leaf': 2, 'subsample': 0.9594714566711299, 'max_features': 'log2'}. Best is trial 1454 with value: 0.30763307678022894.
[I 2024-12-04 12:57:03,576] Trial 2155 finished with value: 0.42857350229869823 and parameters: {'n_estimators': 1206, 'learning_rate': 0.04731753350388377, 'max_depth': 5, 'min_samples_split': 2, 'min_samples_leaf': 2, 'subsample': 0.6235032845618014, 'max_features': 'log2'}. Best is trial 1454 with value: 0.30763307678022894.
[I 2024-12-04 12:57:06,305] Trial 2161 finished with value: 0.6024274237203054 and parameters: {'n_estimators': 848, 'learning_rate': 0.023857768062430756, 'max_depth': 10, 'min_samples_split': 17, 'min_samples_leaf': 10, 'subsample': 0.9816907369846074, 'max_features': 'sqrt'}. Best is trial 1454 with value: 0.30763307678022894.
[I 2024-12-04 12:57:08,974] Trial 2149 finished with value: 0.3691375217252864 and parameters: {'n_estimators': 1388, 'learning_rate': 0.09876381357495523, 'max_depth': 5, 'min_samples_split': 2, 'min_samples_leaf': 1, 'subsample': 0.6405294053986972, 'max_features': None}. Best is trial 1454 with value: 0.30763307678022894.
[I 2024-12-04 12:57:10,247] Trial 2145 finished with value: 0.39903885990104754 and parameters: {'n_estimators': 1483, 'learning_rate': 0.06964120915104784, 'max_depth': 10, 'min_samples_split': 3, 'min_samples_leaf': 6, 'subsample': 0.774155760096852, 'max_features': None}. Best is trial 1454 with value: 0.30763307678022894.
[I 2024-12-04 12:57:10,269] Trial 2158 finished with value: 0.3262431180211261 and parameters: {'n_estimators': 1032, 'learning_rate': 0.0422943597264456, 'max_depth': 8, 'min_samples_split': 3, 'min_samples_leaf': 2, 'subsample': 0.7396904510480138, 'max_features': None}. Best is trial 1454 with value: 0.30763307678022894.
[I 2024-12-04 12:57:11,505] Trial 2160 finished with value: 0.6095530252737774 and parameters: {'n_estimators': 1119, 'learning_rate': 0.020535292021013434, 'max_depth': 10, 'min_samples_split': 7, 'min_samples_leaf': 5, 'subsample': 0.8142357358474855, 'max_features': 'log2'}. Best is trial 1454 with value: 0.30763307678022894.
[I 2024-12-04 12:57:12,153] Trial 2156 finished with value: 0.3281649001949841 and parameters: {'n_estimators': 1272, 'learning_rate': 0.045156899246034006, 'max_depth': 9, 'min_samples_split': 7, 'min_samples_leaf': 2, 'subsample': 0.6224041977396592, 'max_features': None}. Best is trial 1454 with value: 0.30763307678022894.
[I 2024-12-04 12:57:12,556] Trial 2166 finished with value: 0.4129480896553009 and parameters: {'n_estimators': 773, 'learning_rate': 0.061106603478853896, 'max_depth': 5, 'min_samples_split': 6, 'min_samples_leaf': 3, 'subsample': 0.7031284271576075, 'max_features': None}. Best is trial 1454 with value: 0.30763307678022894.
[I 2024-12-04 12:57:13,111] Trial 2159 finished with value: 0.39910737299843174 and parameters: {'n_estimators': 1046, 'learning_rate': 0.08384184402335361, 'max_depth': 6, 'min_samples_split': 6, 'min_samples_leaf': 1, 'subsample': 0.7683074205833007, 'max_features': None}. Best is trial 1454 with value: 0.30763307678022894.
[I 2024-12-04 12:57:14,329] Trial 2163 finished with value: 0.402713671915965 and parameters: {'n_estimators': 991, 'learning_rate': 0.030434968552409285, 'max_depth': 5, 'min_samples_split': 6, 'min_samples_leaf': 1, 'subsample': 0.6586663314213842, 'max_features': None}. Best is trial 1454 with value: 0.30763307678022894.
[I 2024-12-04 12:57:17,442] Trial 2187 finished with value: 0.3987546132249629 and parameters: {'n_estimators': 153, 'learning_rate': 0.055977903323783634, 'max_depth': 12, 'min_samples_split': 8, 'min_samples_leaf': 5, 'subsample': 0.9343273069800808, 'max_features': None}. Best is trial 1454 with value: 0.30763307678022894.
[I 2024-12-04 12:57:20,164] Trial 2162 finished with value: 0.38899586442997014 and parameters: {'n_estimators': 1074, 'learning_rate': 0.044130476493572934, 'max_depth': 9, 'min_samples_split': 7, 'min_samples_leaf': 1, 'subsample': 0.7782392732129565, 'max_features': None}. Best is trial 1454 with value: 0.30763307678022894.
[I 2024-12-04 12:57:20,211] Trial 2190 finished with value: 1.0284838021187834 and parameters: {'n_estimators': 127, 'learning_rate': 0.023836623168308257, 'max_depth': 8, 'min_samples_split': 16, 'min_samples_leaf': 8, 'subsample': 0.8999401512084266, 'max_features': 'log2'}. Best is trial 1454 with value: 0.30763307678022894.
[I 2024-12-04 12:57:22,712] Trial 2189 finished with value: 0.44011965429630223 and parameters: {'n_estimators': 256, 'learning_rate': 0.0162454147252185, 'max_depth': 8, 'min_samples_split': 9, 'min_samples_leaf': 3, 'subsample': 0.6133809786950187, 'max_features': None}. Best is trial 1454 with value: 0.30763307678022894.
[I 2024-12-04 12:57:27,550] Trial 2164 finished with value: 0.44473573257408017 and parameters: {'n_estimators': 1454, 'learning_rate': 0.012443688860205677, 'max_depth': 3, 'min_samples_split': 17, 'min_samples_leaf': 6, 'subsample': 0.7140721177270044, 'max_features': None}. Best is trial 1454 with value: 0.30763307678022894.
[I 2024-12-04 12:57:29,140] Trial 2173 finished with value: 0.41870807218455947 and parameters: {'n_estimators': 991, 'learning_rate': 0.03527760021367042, 'max_depth': 4, 'min_samples_split': 2, 'min_samples_leaf': 3, 'subsample': 0.7638849290515138, 'max_features': None}. Best is trial 1454 with value: 0.30763307678022894.
[I 2024-12-04 12:57:30,436] Trial 2165 finished with value: 0.3689333325167635 and parameters: {'n_estimators': 1349, 'learning_rate': 0.05443309291833568, 'max_depth': 8, 'min_samples_split': 7, 'min_samples_leaf': 1, 'subsample': 0.6007514324747721, 'max_features': None}. Best is trial 1454 with value: 0.30763307678022894.
[I 2024-12-04 12:57:31,396] Trial 2175 finished with value: 0.3966174226638058 and parameters: {'n_estimators': 909, 'learning_rate': 0.0960911653236957, 'max_depth': 6, 'min_samples_split': 5, 'min_samples_leaf': 3, 'subsample': 0.7518060720619427, 'max_features': None}. Best is trial 1454 with value: 0.30763307678022894.
[I 2024-12-04 12:57:33,649] Trial 2184 finished with value: 0.3908555909407703 and parameters: {'n_estimators': 888, 'learning_rate': 0.09858785189534743, 'max_depth': 8, 'min_samples_split': 3, 'min_samples_leaf': 4, 'subsample': 0.7507258270687234, 'max_features': 'sqrt'}. Best is trial 1454 with value: 0.30763307678022894.
[I 2024-12-04 12:57:34,316] Trial 2167 finished with value: 0.3354706532077505 and parameters: {'n_estimators': 1257, 'learning_rate': 0.09580964954354061, 'max_depth': 5, 'min_samples_split': 2, 'min_samples_leaf': 2, 'subsample': 0.692438648082068, 'max_features': None}. Best is trial 1454 with value: 0.30763307678022894.
[I 2024-12-04 12:57:35,433] Trial 2168 finished with value: 0.38703989497074387 and parameters: {'n_estimators': 1309, 'learning_rate': 0.07115746932077095, 'max_depth': 8, 'min_samples_split': 3, 'min_samples_leaf': 3, 'subsample': 0.7162972657585251, 'max_features': None}. Best is trial 1454 with value: 0.30763307678022894.
[I 2024-12-04 12:57:37,490] Trial 2170 finished with value: 0.3725016866421831 and parameters: {'n_estimators': 1343, 'learning_rate': 0.05301787834085452, 'max_depth': 6, 'min_samples_split': 2, 'min_samples_leaf': 4, 'subsample': 0.6833697568036181, 'max_features': None}. Best is trial 1454 with value: 0.30763307678022894.
[I 2024-12-04 12:57:38,682] Trial 2179 finished with value: 0.5759178420968292 and parameters: {'n_estimators': 1253, 'learning_rate': 0.03087650314328424, 'max_depth': 3, 'min_samples_split': 12, 'min_samples_leaf': 4, 'subsample': 0.809465428607239, 'max_features': 'log2'}. Best is trial 1454 with value: 0.30763307678022894.
[I 2024-12-04 12:57:39,300] Trial 2172 finished with value: 0.4120055148143346 and parameters: {'n_estimators': 1488, 'learning_rate': 0.08372007767935224, 'max_depth': 7, 'min_samples_split': 2, 'min_samples_leaf': 2, 'subsample': 0.9057594267333053, 'max_features': 'log2'}. Best is trial 1454 with value: 0.30763307678022894.
[I 2024-12-04 12:57:40,810] Trial 2197 finished with value: 0.4392057812415964 and parameters: {'n_estimators': 576, 'learning_rate': 0.020968068537376223, 'max_depth': 8, 'min_samples_split': 14, 'min_samples_leaf': 2, 'subsample': 0.6701423763253436, 'max_features': 'sqrt'}. Best is trial 1454 with value: 0.30763307678022894.
[I 2024-12-04 12:57:43,038] Trial 2177 finished with value: 0.3989795532653147 and parameters: {'n_estimators': 1232, 'learning_rate': 0.06120121587184839, 'max_depth': 5, 'min_samples_split': 2, 'min_samples_leaf': 3, 'subsample': 0.7812340988993874, 'max_features': None}. Best is trial 1454 with value: 0.30763307678022894.
[I 2024-12-04 12:57:43,112] Trial 2171 finished with value: 0.3640029136104168 and parameters: {'n_estimators': 1402, 'learning_rate': 0.04875495498716749, 'max_depth': 9, 'min_samples_split': 2, 'min_samples_leaf': 4, 'subsample': 0.7014294115587091, 'max_features': None}. Best is trial 1454 with value: 0.30763307678022894.
[I 2024-12-04 12:57:45,073] Trial 2176 finished with value: 0.3924571044046792 and parameters: {'n_estimators': 1327, 'learning_rate': 0.06444124079036863, 'max_depth': 7, 'min_samples_split': 5, 'min_samples_leaf': 1, 'subsample': 0.721217459831204, 'max_features': None}. Best is trial 1454 with value: 0.30763307678022894.
[I 2024-12-04 12:57:47,806] Trial 2174 finished with value: 0.33541865053503334 and parameters: {'n_estimators': 1445, 'learning_rate': 0.09313361270353313, 'max_depth': 8, 'min_samples_split': 5, 'min_samples_leaf': 2, 'subsample': 0.7942012307601831, 'max_features': None}. Best is trial 1454 with value: 0.30763307678022894.
[I 2024-12-04 12:57:48,314] Trial 2178 finished with value: 0.3377192896114214 and parameters: {'n_estimators': 1414, 'learning_rate': 0.07307775985543354, 'max_depth': 6, 'min_samples_split': 2, 'min_samples_leaf': 2, 'subsample': 0.6680796387430993, 'max_features': None}. Best is trial 1454 with value: 0.30763307678022894.
[I 2024-12-04 12:57:49,396] Trial 2192 finished with value: 0.3944090474421165 and parameters: {'n_estimators': 888, 'learning_rate': 0.05242698657100555, 'max_depth': 6, 'min_samples_split': 2, 'min_samples_leaf': 3, 'subsample': 0.7540130957644432, 'max_features': None}. Best is trial 1454 with value: 0.30763307678022894.
[I 2024-12-04 12:57:50,366] Trial 2185 finished with value: 0.3311938413616891 and parameters: {'n_estimators': 1110, 'learning_rate': 0.06051150728187112, 'max_depth': 8, 'min_samples_split': 6, 'min_samples_leaf': 2, 'subsample': 0.7162866309279742, 'max_features': None}. Best is trial 1454 with value: 0.30763307678022894.
[I 2024-12-04 12:57:51,599] Trial 2180 finished with value: 0.3962535397432355 and parameters: {'n_estimators': 1339, 'learning_rate': 0.06852497739733522, 'max_depth': 6, 'min_samples_split': 3, 'min_samples_leaf': 3, 'subsample': 0.7860721254308799, 'max_features': None}. Best is trial 1454 with value: 0.30763307678022894.
[I 2024-12-04 12:57:54,487] Trial 2182 finished with value: 0.3838674394880886 and parameters: {'n_estimators': 1429, 'learning_rate': 0.05853134520715264, 'max_depth': 6, 'min_samples_split': 6, 'min_samples_leaf': 3, 'subsample': 0.6069349782159305, 'max_features': None}. Best is trial 1454 with value: 0.30763307678022894.
[I 2024-12-04 12:57:56,152] Trial 2188 finished with value: 0.4588574890008719 and parameters: {'n_estimators': 1442, 'learning_rate': 0.03586464809717119, 'max_depth': 3, 'min_samples_split': 13, 'min_samples_leaf': 4, 'subsample': 0.6181793208190806, 'max_features': 'sqrt'}. Best is trial 1454 with value: 0.30763307678022894.
[I 2024-12-04 12:57:57,223] Trial 2205 finished with value: 0.44337684093298646 and parameters: {'n_estimators': 640, 'learning_rate': 0.04821848946521145, 'max_depth': 6, 'min_samples_split': 14, 'min_samples_leaf': 5, 'subsample': 0.7599177536066402, 'max_features': 'sqrt'}. Best is trial 1454 with value: 0.30763307678022894.
[I 2024-12-04 12:57:58,842] Trial 2183 finished with value: 0.3766195830923535 and parameters: {'n_estimators': 1497, 'learning_rate': 0.06221964086457451, 'max_depth': 7, 'min_samples_split': 2, 'min_samples_leaf': 1, 'subsample': 0.665339699632233, 'max_features': None}. Best is trial 1454 with value: 0.30763307678022894.
[I 2024-12-04 12:57:58,920] Trial 2210 finished with value: 0.5245492930889711 and parameters: {'n_estimators': 516, 'learning_rate': 0.02248753035213186, 'max_depth': 5, 'min_samples_split': 17, 'min_samples_leaf': 4, 'subsample': 0.7444527776636005, 'max_features': 'sqrt'}. Best is trial 1454 with value: 0.30763307678022894.
[I 2024-12-04 12:57:59,927] Trial 2186 finished with value: 0.32569586220225977 and parameters: {'n_estimators': 1387, 'learning_rate': 0.057662234389871725, 'max_depth': 8, 'min_samples_split': 6, 'min_samples_leaf': 2, 'subsample': 0.8087964731113388, 'max_features': None}. Best is trial 1454 with value: 0.30763307678022894.
[I 2024-12-04 12:58:02,228] Trial 2181 finished with value: 0.31603669182299726 and parameters: {'n_estimators': 1498, 'learning_rate': 0.07303271751467169, 'max_depth': 6, 'min_samples_split': 2, 'min_samples_leaf': 2, 'subsample': 0.7918455013273686, 'max_features': None}. Best is trial 1454 with value: 0.30763307678022894.
[I 2024-12-04 12:58:02,393] Trial 2200 finished with value: 0.532020393945456 and parameters: {'n_estimators': 1183, 'learning_rate': 0.023352528264650674, 'max_depth': 3, 'min_samples_split': 16, 'min_samples_leaf': 7, 'subsample': 0.7577761002817077, 'max_features': 'sqrt'}. Best is trial 1454 with value: 0.30763307678022894.
[I 2024-12-04 12:58:02,399] Trial 2199 finished with value: 0.3992724557546893 and parameters: {'n_estimators': 1050, 'learning_rate': 0.03301665547024253, 'max_depth': 6, 'min_samples_split': 6, 'min_samples_leaf': 3, 'subsample': 0.6811348697019837, 'max_features': None}. Best is trial 1454 with value: 0.30763307678022894.
[I 2024-12-04 12:58:04,304] Trial 2207 finished with value: 0.39603465190199 and parameters: {'n_estimators': 647, 'learning_rate': 0.08529579131718597, 'max_depth': 6, 'min_samples_split': 6, 'min_samples_leaf': 3, 'subsample': 0.7914161654316613, 'max_features': None}. Best is trial 1454 with value: 0.30763307678022894.
[I 2024-12-04 12:58:04,571] Trial 2216 finished with value: 0.7534883960603922 and parameters: {'n_estimators': 390, 'learning_rate': 0.021964392403666193, 'max_depth': 7, 'min_samples_split': 8, 'min_samples_leaf': 4, 'subsample': 0.8401117602083287, 'max_features': 'log2'}. Best is trial 1454 with value: 0.30763307678022894.
[I 2024-12-04 12:58:05,509] Trial 2191 finished with value: 0.3806186543533043 and parameters: {'n_estimators': 1284, 'learning_rate': 0.024213470348714437, 'max_depth': 7, 'min_samples_split': 4, 'min_samples_leaf': 1, 'subsample': 0.6958446337920416, 'max_features': None}. Best is trial 1454 with value: 0.30763307678022894.
[I 2024-12-04 12:58:09,126] Trial 2196 finished with value: 0.3328018225644243 and parameters: {'n_estimators': 1253, 'learning_rate': 0.05887411281672502, 'max_depth': 8, 'min_samples_split': 4, 'min_samples_leaf': 2, 'subsample': 0.7121849946462454, 'max_features': None}. Best is trial 1454 with value: 0.30763307678022894.
[I 2024-12-04 12:58:10,579] Trial 2193 finished with value: 0.32902708242295386 and parameters: {'n_estimators': 1411, 'learning_rate': 0.03754256156924807, 'max_depth': 6, 'min_samples_split': 5, 'min_samples_leaf': 2, 'subsample': 0.6956050931241118, 'max_features': None}. Best is trial 1454 with value: 0.30763307678022894.
[I 2024-12-04 12:58:12,448] Trial 2198 finished with value: 0.3555103719041897 and parameters: {'n_estimators': 1289, 'learning_rate': 0.05399975153926886, 'max_depth': 8, 'min_samples_split': 2, 'min_samples_leaf': 1, 'subsample': 0.6483793793695282, 'max_features': None}. Best is trial 1454 with value: 0.30763307678022894.
[I 2024-12-04 12:58:14,584] Trial 2194 finished with value: 0.3735965678563708 and parameters: {'n_estimators': 1489, 'learning_rate': 0.07433106287497769, 'max_depth': 6, 'min_samples_split': 4, 'min_samples_leaf': 1, 'subsample': 0.7398376430866078, 'max_features': None}. Best is trial 1454 with value: 0.30763307678022894.
[I 2024-12-04 12:58:15,698] Trial 2201 finished with value: 0.38858418294364416 and parameters: {'n_estimators': 1392, 'learning_rate': 0.012592442148181117, 'max_depth': 12, 'min_samples_split': 15, 'min_samples_leaf': 1, 'subsample': 0.755116625956751, 'max_features': 'sqrt'}. Best is trial 1454 with value: 0.30763307678022894.
[I 2024-12-04 12:58:16,421] Trial 2195 finished with value: 0.3330725469904149 and parameters: {'n_estimators': 1476, 'learning_rate': 0.054459435167834254, 'max_depth': 7, 'min_samples_split': 3, 'min_samples_leaf': 2, 'subsample': 0.7816036842231426, 'max_features': None}. Best is trial 1454 with value: 0.30763307678022894.
[I 2024-12-04 12:58:16,808] Trial 2203 finished with value: 0.3720442398612232 and parameters: {'n_estimators': 1178, 'learning_rate': 0.08649989898638641, 'max_depth': 6, 'min_samples_split': 4, 'min_samples_leaf': 4, 'subsample': 0.7741707740123092, 'max_features': None}. Best is trial 1454 with value: 0.30763307678022894.
[I 2024-12-04 12:58:21,807] Trial 2212 finished with value: 0.3956742003130997 and parameters: {'n_estimators': 993, 'learning_rate': 0.08710362904342815, 'max_depth': 5, 'min_samples_split': 2, 'min_samples_leaf': 3, 'subsample': 0.787340078265419, 'max_features': None}. Best is trial 1454 with value: 0.30763307678022894.
[I 2024-12-04 12:58:21,869] Trial 2204 finished with value: 0.372834694752668 and parameters: {'n_estimators': 1271, 'learning_rate': 0.05204197255026954, 'max_depth': 8, 'min_samples_split': 2, 'min_samples_leaf': 1, 'subsample': 0.6704442369991778, 'max_features': None}. Best is trial 1454 with value: 0.30763307678022894.
[I 2024-12-04 12:58:22,258] Trial 2202 finished with value: 0.3703777747730826 and parameters: {'n_estimators': 1322, 'learning_rate': 0.09439175941923958, 'max_depth': 9, 'min_samples_split': 2, 'min_samples_leaf': 4, 'subsample': 0.7728036533542733, 'max_features': None}. Best is trial 1454 with value: 0.30763307678022894.
[I 2024-12-04 12:58:25,146] Trial 2230 finished with value: 0.4346692695612389 and parameters: {'n_estimators': 420, 'learning_rate': 0.010812272860312036, 'max_depth': 11, 'min_samples_split': 19, 'min_samples_leaf': 1, 'subsample': 0.9365491758688136, 'max_features': None}. Best is trial 1454 with value: 0.30763307678022894.
