[I 2024-12-03 19:17:36,157] Trial 2079 finished with value: 0.13740883472507723 and parameters: {'kernel': 'linear', 'C': 99.59284746476787, 'gamma': 0.02981841977944035, 'epsilon': 0.020456969458757034}. Best is trial 345 with value: 0.13438257115663557.
[I 2024-12-03 19:17:36,652] Trial 2108 finished with value: 0.13779621273868903 and parameters: {'kernel': 'linear', 'C': 30.995841961586088, 'gamma': 0.10519523006821227, 'epsilon': 0.012980158324532141}. Best is trial 345 with value: 0.13438257115663557.
[I 2024-12-03 19:17:36,653] Trial 2130 finished with value: 0.22262363358351475 and parameters: {'kernel': 'linear', 'C': 91.50159165945911, 'gamma': 0.001014522243308363, 'epsilon': 0.30190244451968345}. Best is trial 345 with value: 0.13438257115663557.
[I 2024-12-03 19:17:39,844] Trial 2121 finished with value: 0.13850007861196922 and parameters: {'kernel': 'linear', 'C': 20.789271042536527, 'gamma': 0.25576557265338357, 'epsilon': 0.010770199232713013}. Best is trial 345 with value: 0.13438257115663557.
[I 2024-12-03 19:17:40,024] Trial 2106 finished with value: 0.13764890872726587 and parameters: {'kernel': 'linear', 'C': 67.7765564142315, 'gamma': 0.2814982665959537, 'epsilon': 0.02084569106234614}. Best is trial 345 with value: 0.13438257115663557.
[I 2024-12-03 19:17:40,909] Trial 2136 finished with value: 0.143693571138252 and parameters: {'kernel': 'linear', 'C': 0.848093580470418, 'gamma': 0.002861592938607145, 'epsilon': 0.053567077090624304}. Best is trial 345 with value: 0.13438257115663557.
[I 2024-12-03 19:17:41,283] Trial 2139 finished with value: 0.3743734296471168 and parameters: {'kernel': 'linear', 'C': 87.68352686703044, 'gamma': 0.04899678052897567, 'epsilon': 0.6643077486871244}. Best is trial 345 with value: 0.13438257115663557.
[I 2024-12-03 19:17:43,514] Trial 2077 finished with value: 0.13761522488612576 and parameters: {'kernel': 'linear', 'C': 82.75321486822453, 'gamma': 0.04952657530481548, 'epsilon': 0.0027526184232830836}. Best is trial 345 with value: 0.13438257115663557.
[I 2024-12-03 19:17:45,207] Trial 2104 finished with value: 0.1349400736914696 and parameters: {'kernel': 'linear', 'C': 77.43402018827416, 'gamma': 0.0003591905487971092, 'epsilon': 0.03906877507613457}. Best is trial 345 with value: 0.13438257115663557.
[I 2024-12-03 19:17:45,266] Trial 2138 finished with value: 0.13775978605797512 and parameters: {'kernel': 'linear', 'C': 21.79097413536592, 'gamma': 0.0013639184072225454, 'epsilon': 0.08091715801575419}. Best is trial 345 with value: 0.13438257115663557.
[I 2024-12-03 19:17:46,372] Trial 2118 finished with value: 0.135099931602885 and parameters: {'kernel': 'linear', 'C': 61.8840033993495, 'gamma': 0.2916979907542589, 'epsilon': 0.05452722670983849}. Best is trial 345 with value: 0.13438257115663557.
[I 2024-12-03 19:17:48,429] Trial 2111 finished with value: 0.13563746677716038 and parameters: {'kernel': 'linear', 'C': 63.496508597283096, 'gamma': 0.4961364056460081, 'epsilon': 0.04153011079738993}. Best is trial 345 with value: 0.13438257115663557.
[I 2024-12-03 19:17:48,996] Trial 2145 finished with value: 1.3569557590471542 and parameters: {'kernel': 'poly', 'C': 2.2015443392976803, 'gamma': 0.0003057522688667597, 'epsilon': 0.07221125304517907}. Best is trial 345 with value: 0.13438257115663557.
[I 2024-12-03 19:17:51,911] Trial 2090 finished with value: 0.138267241510543 and parameters: {'kernel': 'linear', 'C': 97.32860598380547, 'gamma': 0.017274051978523886, 'epsilon': 0.009468073119670366}. Best is trial 345 with value: 0.13438257115663557.
[I 2024-12-03 19:17:53,091] Trial 21 finished with value: 0.493499287791379 and parameters: {'kernel': 'poly', 'C': 1.055308324537013, 'gamma': 0.6191392235185375, 'epsilon': 0.01994069455115275}. Best is trial 345 with value: 0.13438257115663557.
/zhome/b1/0/88900/miniconda3/envs/critprops/lib/python3.9/site-packages/optuna/_experimental.py:31: ExperimentalWarning: Argument ``multivariate`` is an experimental feature. The interface can change in the future.
  warnings.warn(
/zhome/b1/0/88900/miniconda3/envs/critprops/lib/python3.9/site-packages/optuna/_experimental.py:31: ExperimentalWarning: Argument ``constant_liar`` is an experimental feature. The interface can change in the future.
  warnings.warn(
[I 2024-12-03 19:17:54,307] Trial 2133 finished with value: 0.13691528910748355 and parameters: {'kernel': 'linear', 'C': 11.535469791031167, 'gamma': 0.0003287120970683272, 'epsilon': 0.024784628791128038}. Best is trial 345 with value: 0.13438257115663557.
[I 2024-12-03 19:17:55,192] Trial 2113 finished with value: 0.13491162286091674 and parameters: {'kernel': 'linear', 'C': 92.19236735973872, 'gamma': 0.2144866225168179, 'epsilon': 0.06264933584658926}. Best is trial 345 with value: 0.13438257115663557.
[I 2024-12-03 19:17:56,328] Trial 2100 finished with value: 0.1376045311484492 and parameters: {'kernel': 'linear', 'C': 78.59398806304917, 'gamma': 0.000265856783871325, 'epsilon': 0.021719735072642007}. Best is trial 345 with value: 0.13438257115663557.
[I 2024-12-03 19:17:56,569] Trial 2142 finished with value: 0.13553546304119463 and parameters: {'kernel': 'linear', 'C': 30.46990723344843, 'gamma': 0.0020174071073038096, 'epsilon': 0.06652499022185808}. Best is trial 345 with value: 0.13438257115663557.
[I 2024-12-03 19:17:57,688] Trial 2137 finished with value: 0.1345516238108104 and parameters: {'kernel': 'linear', 'C': 20.26099524014808, 'gamma': 0.00032667141876278194, 'epsilon': 0.04011929747743814}. Best is trial 345 with value: 0.13438257115663557.
[I 2024-12-03 19:17:59,267] Trial 2135 finished with value: 0.14105550555209626 and parameters: {'kernel': 'linear', 'C': 83.46785546348194, 'gamma': 0.30657907165913967, 'epsilon': 0.08993906654689583}. Best is trial 345 with value: 0.13438257115663557.
[I 2024-12-03 19:18:01,349] Trial 2144 finished with value: 0.1370999466605146 and parameters: {'kernel': 'linear', 'C': 23.896929032514976, 'gamma': 0.00040097134347231794, 'epsilon': 0.04567040883307828}. Best is trial 345 with value: 0.13438257115663557.
[I 2024-12-03 19:18:02,795] Trial 2156 finished with value: 1.3599148174538886 and parameters: {'kernel': 'rbf', 'C': 0.00656078664778275, 'gamma': 0.00010674385773583585, 'epsilon': 0.07995588934086115}. Best is trial 345 with value: 0.13438257115663557.
[I 2024-12-03 19:18:03,663] Trial 2152 finished with value: 0.14846189326893913 and parameters: {'kernel': 'linear', 'C': 88.39228972290422, 'gamma': 0.00041662871046323457, 'epsilon': 0.13945854586169742}. Best is trial 345 with value: 0.13438257115663557.
[I 2024-12-03 19:18:04,235] Trial 2098 finished with value: 0.13595300763831292 and parameters: {'kernel': 'linear', 'C': 89.33412384087066, 'gamma': 0.00031387803375293596, 'epsilon': 0.025686878428049394}. Best is trial 345 with value: 0.13438257115663557.
[I 2024-12-03 19:18:04,705] Trial 2149 finished with value: 0.13745733875794178 and parameters: {'kernel': 'linear', 'C': 65.95690909298021, 'gamma': 0.0009024271358911794, 'epsilon': 0.07665026873563618}. Best is trial 345 with value: 0.13438257115663557.
[I 2024-12-03 19:18:06,448] Trial 2140 finished with value: 0.13785719263519045 and parameters: {'kernel': 'linear', 'C': 24.808078694143802, 'gamma': 0.09304570874952026, 'epsilon': 0.021452680672351718}. Best is trial 345 with value: 0.13438257115663557.
[I 2024-12-03 19:18:07,401] Trial 2155 finished with value: 0.13688298632936413 and parameters: {'kernel': 'linear', 'C': 7.062297462564547, 'gamma': 0.0002763289834786921, 'epsilon': 0.04738077449042241}. Best is trial 345 with value: 0.13438257115663557.
[I 2024-12-03 19:18:08,537] Trial 2154 finished with value: 0.1384884809320968 and parameters: {'kernel': 'linear', 'C': 5.565957927755366, 'gamma': 0.00040320967629219306, 'epsilon': 0.00990215038944911}. Best is trial 345 with value: 0.13438257115663557.
[I 2024-12-03 19:18:09,892] Trial 2163 finished with value: 0.36749639911137844 and parameters: {'kernel': 'sigmoid', 'C': 14.961946045681543, 'gamma': 0.0003738763131448584, 'epsilon': 0.0727806598096111}. Best is trial 345 with value: 0.13438257115663557.
[I 2024-12-03 19:18:10,531] Trial 2157 finished with value: 0.13720532521229006 and parameters: {'kernel': 'linear', 'C': 4.952334554291969, 'gamma': 0.00052639069349249, 'epsilon': 0.022481097258968522}. Best is trial 345 with value: 0.13438257115663557.
[I 2024-12-03 19:18:10,934] Trial 2162 finished with value: 0.1590266945118701 and parameters: {'kernel': 'linear', 'C': 29.798486482399202, 'gamma': 0.00029136776140852234, 'epsilon': 0.16513275271018185}. Best is trial 345 with value: 0.13438257115663557.
[I 2024-12-03 19:18:15,833] Trial 2148 finished with value: 0.13571188317487173 and parameters: {'kernel': 'linear', 'C': 28.84368015229968, 'gamma': 0.0011645004306150572, 'epsilon': 0.03370135714293024}. Best is trial 345 with value: 0.13438257115663557.
[I 2024-12-03 19:18:17,015] Trial 2167 finished with value: 0.35456407130610507 and parameters: {'kernel': 'sigmoid', 'C': 98.32606861820402, 'gamma': 0.00049418500324718, 'epsilon': 0.03694251110827091}. Best is trial 345 with value: 0.13438257115663557.
[I 2024-12-03 19:18:19,663] Trial 2105 finished with value: 0.13794304782942066 and parameters: {'kernel': 'linear', 'C': 94.83247536781582, 'gamma': 0.0016629409201644129, 'epsilon': 0.00963595711704313}. Best is trial 345 with value: 0.13438257115663557.
[I 2024-12-03 19:18:21,550] Trial 2161 finished with value: 0.1382189757757371 and parameters: {'kernel': 'linear', 'C': 11.005053001130157, 'gamma': 0.00015306555913230282, 'epsilon': 0.018276344487617287}. Best is trial 345 with value: 0.13438257115663557.
[I 2024-12-03 19:18:22,645] Trial 2160 finished with value: 0.1393588887021373 and parameters: {'kernel': 'linear', 'C': 52.39464109324213, 'gamma': 0.0007112618525637867, 'epsilon': 0.0860264275195028}. Best is trial 345 with value: 0.13438257115663557.
[I 2024-12-03 19:18:23,054] Trial 2169 finished with value: 0.14118739526710192 and parameters: {'kernel': 'linear', 'C': 11.264750017737345, 'gamma': 0.0004649663986599369, 'epsilon': 0.09192912655479014}. Best is trial 345 with value: 0.13438257115663557.
[I 2024-12-03 19:18:23,183] Trial 2159 finished with value: 0.13646510772450138 and parameters: {'kernel': 'linear', 'C': 33.326687603591495, 'gamma': 0.0002311029837221879, 'epsilon': 0.07095804687697588}. Best is trial 345 with value: 0.13438257115663557.
[I 2024-12-03 19:18:23,399] Trial 2109 finished with value: 0.13798356480427618 and parameters: {'kernel': 'linear', 'C': 64.52994249458621, 'gamma': 0.1516629533605021, 'epsilon': 0.014499135052081726}. Best is trial 345 with value: 0.13438257115663557.
[I 2024-12-03 19:18:23,399] Trial 2170 finished with value: 0.524683518033386 and parameters: {'kernel': 'poly', 'C': 64.79321968623096, 'gamma': 0.40760605621839874, 'epsilon': 0.8209770369328118}. Best is trial 345 with value: 0.13438257115663557.
[I 2024-12-03 19:18:25,122] Trial 2166 finished with value: 0.13541716290954275 and parameters: {'kernel': 'linear', 'C': 17.75388248490246, 'gamma': 0.0001634349084081449, 'epsilon': 0.03069234598604025}. Best is trial 345 with value: 0.13438257115663557.
[I 2024-12-03 19:18:25,391] Trial 2127 finished with value: 0.13712017804323365 and parameters: {'kernel': 'linear', 'C': 63.62913304688919, 'gamma': 0.0010704164661431976, 'epsilon': 0.022528935529291107}. Best is trial 345 with value: 0.13438257115663557.
[I 2024-12-03 19:18:25,758] Trial 2172 finished with value: 0.5119677569331686 and parameters: {'kernel': 'poly', 'C': 1.3669807726754977, 'gamma': 0.01578642685022875, 'epsilon': 0.11496557285591318}. Best is trial 345 with value: 0.13438257115663557.
[I 2024-12-03 19:18:26,715] Trial 2112 finished with value: 0.1358038395666847 and parameters: {'kernel': 'linear', 'C': 71.89683677570096, 'gamma': 0.15043325479971886, 'epsilon': 0.0259849381163789}. Best is trial 345 with value: 0.13438257115663557.
[I 2024-12-03 19:18:26,858] Trial 2174 finished with value: 0.13771973073362806 and parameters: {'kernel': 'linear', 'C': 3.168820673552052, 'gamma': 0.00028869596961831814, 'epsilon': 0.06340085090892413}. Best is trial 345 with value: 0.13438257115663557.
[I 2024-12-03 19:18:27,441] Trial 2176 finished with value: 0.16118766270927065 and parameters: {'kernel': 'linear', 'C': 3.9836604904143478, 'gamma': 0.001400437660606695, 'epsilon': 0.15039056136588014}. Best is trial 345 with value: 0.13438257115663557.
[I 2024-12-03 19:18:28,138] Trial 2132 finished with value: 0.1355527545043692 and parameters: {'kernel': 'linear', 'C': 67.69881858578037, 'gamma': 0.028423544238259543, 'epsilon': 0.03380300342659389}. Best is trial 345 with value: 0.13438257115663557.
[I 2024-12-03 19:18:28,651] Trial 2177 finished with value: 0.1449702903954442 and parameters: {'kernel': 'linear', 'C': 5.325214725842383, 'gamma': 0.9444744550792197, 'epsilon': 0.09647825878823889}. Best is trial 345 with value: 0.13438257115663557.
[I 2024-12-03 19:18:28,651] Trial 2171 finished with value: 0.13983807690133673 and parameters: {'kernel': 'linear', 'C': 21.362605371788568, 'gamma': 0.00041618914574429247, 'epsilon': 0.08870248874357238}. Best is trial 345 with value: 0.13438257115663557.
[I 2024-12-03 19:18:29,716] Trial 2179 finished with value: 0.14476662684308297 and parameters: {'kernel': 'linear', 'C': 2.7140489534926058, 'gamma': 0.0011434326992834534, 'epsilon': 0.08329158594528845}. Best is trial 345 with value: 0.13438257115663557.
[I 2024-12-03 19:18:32,862] Trial 2182 finished with value: 0.14337067124954184 and parameters: {'kernel': 'linear', 'C': 0.8071126108458438, 'gamma': 0.0006478556897885886, 'epsilon': 0.020331169417972354}. Best is trial 345 with value: 0.13438257115663557.
[I 2024-12-03 19:18:34,235] Trial 2141 finished with value: 0.13500961246296092 and parameters: {'kernel': 'linear', 'C': 85.00776280871187, 'gamma': 0.10474785807961416, 'epsilon': 0.0295978597620257}. Best is trial 345 with value: 0.13438257115663557.
[I 2024-12-03 19:18:35,092] Trial 2175 finished with value: 0.1358683435038009 and parameters: {'kernel': 'linear', 'C': 12.396985254919347, 'gamma': 0.0003855381391205217, 'epsilon': 0.05695730174301838}. Best is trial 345 with value: 0.13438257115663557.
[I 2024-12-03 19:18:38,304] Trial 2165 finished with value: 0.13538170927110832 and parameters: {'kernel': 'linear', 'C': 42.18154127822152, 'gamma': 0.0006554063346415866, 'epsilon': 0.0588973349434421}. Best is trial 345 with value: 0.13438257115663557.
[I 2024-12-03 19:18:40,842] Trial 2173 finished with value: 0.13601268499982438 and parameters: {'kernel': 'linear', 'C': 12.242839387913666, 'gamma': 0.00021841302238628535, 'epsilon': 0.026962282207988058}. Best is trial 345 with value: 0.13438257115663557.
[I 2024-12-03 19:18:42,704] Trial 2120 finished with value: 0.13511160960074245 and parameters: {'kernel': 'linear', 'C': 94.06514771681283, 'gamma': 0.4973861721053875, 'epsilon': 0.02935529200748314}. Best is trial 345 with value: 0.13438257115663557.
[I 2024-12-03 19:18:42,774] Trial 2187 finished with value: 0.13844910386437925 and parameters: {'kernel': 'linear', 'C': 5.864474825751547, 'gamma': 0.0012379488523207999, 'epsilon': 0.010533688711776705}. Best is trial 345 with value: 0.13438257115663557.
[I 2024-12-03 19:18:43,969] Trial 2191 finished with value: 0.4976756905466419 and parameters: {'kernel': 'rbf', 'C': 1.2220730424156623, 'gamma': 0.010758687510688583, 'epsilon': 0.8943611219499852}. Best is trial 345 with value: 0.13438257115663557.
[I 2024-12-03 19:18:45,240] Trial 2181 finished with value: 0.13528036613084232 and parameters: {'kernel': 'linear', 'C': 27.19484281632517, 'gamma': 0.00019404347011915595, 'epsilon': 0.059354201058828486}. Best is trial 345 with value: 0.13438257115663557.
[I 2024-12-03 19:18:46,691] Trial 2153 finished with value: 0.13645461977741974 and parameters: {'kernel': 'linear', 'C': 99.83950244563925, 'gamma': 0.0033629637839938755, 'epsilon': 0.050513381354127446}. Best is trial 345 with value: 0.13438257115663557.
[I 2024-12-03 19:18:48,930] Trial 2158 finished with value: 0.13847269483927044 and parameters: {'kernel': 'linear', 'C': 42.24807465182391, 'gamma': 0.00029775027382812077, 'epsilon': 0.015866322150676942}. Best is trial 345 with value: 0.13438257115663557.
[I 2024-12-03 19:18:49,639] Trial 2180 finished with value: 0.1353789384534558 and parameters: {'kernel': 'linear', 'C': 21.90828508019878, 'gamma': 0.0006029356901054472, 'epsilon': 0.032054399682037826}. Best is trial 345 with value: 0.13438257115663557.
[I 2024-12-03 19:18:50,574] Trial 2183 finished with value: 0.13544473779167746 and parameters: {'kernel': 'linear', 'C': 16.18698512591052, 'gamma': 0.000226105889616715, 'epsilon': 0.031633406348948366}. Best is trial 345 with value: 0.13438257115663557.
[I 2024-12-03 19:18:51,363] Trial 2195 finished with value: 0.13497178411557784 and parameters: {'kernel': 'linear', 'C': 10.583694157611891, 'gamma': 0.0009620613378178365, 'epsilon': 0.06738203511383624}. Best is trial 345 with value: 0.13438257115663557.
[I 2024-12-03 19:18:51,942] Trial 2196 finished with value: 0.1364698380875281 and parameters: {'kernel': 'linear', 'C': 2.159342515636386, 'gamma': 0.0006892134428914097, 'epsilon': 0.043538177165427835}. Best is trial 345 with value: 0.13438257115663557.
[I 2024-12-03 19:18:52,345] Trial 2197 finished with value: 0.15065906009340707 and parameters: {'kernel': 'linear', 'C': 7.634160384553821, 'gamma': 0.0005838633584707476, 'epsilon': 0.13870148555043524}. Best is trial 345 with value: 0.13438257115663557.
[I 2024-12-03 19:18:53,819] Trial 2200 finished with value: 6.759508214262381 and parameters: {'kernel': 'sigmoid', 'C': 0.2871577733160893, 'gamma': 0.6912118570261601, 'epsilon': 0.008990687026254558}. Best is trial 345 with value: 0.13438257115663557.
[I 2024-12-03 19:18:57,271] Trial 2164 finished with value: 0.13773442511004028 and parameters: {'kernel': 'linear', 'C': 41.02394967280636, 'gamma': 0.0005429737977091478, 'epsilon': 0.01999782024929226}. Best is trial 345 with value: 0.13438257115663557.
[I 2024-12-03 19:18:58,687] Trial 2115 finished with value: 0.1367847961244282 and parameters: {'kernel': 'linear', 'C': 95.1362178861303, 'gamma': 0.30868622454279443, 'epsilon': 0.02328089872307803}. Best is trial 345 with value: 0.13438257115663557.
[I 2024-12-03 19:18:59,471] Trial 2116 finished with value: 0.13795288008501283 and parameters: {'kernel': 'linear', 'C': 85.64165876773443, 'gamma': 0.0012882551214024093, 'epsilon': 0.017811588780276257}. Best is trial 345 with value: 0.13438257115663557.
[I 2024-12-03 19:19:00,078] Trial 2204 finished with value: 0.3881273676581849 and parameters: {'kernel': 'rbf', 'C': 2.1894056481284503, 'gamma': 0.0005401265199522266, 'epsilon': 0.011304244731132224}. Best is trial 345 with value: 0.13438257115663557.
[I 2024-12-03 19:19:00,917] Trial 2192 finished with value: 0.13811799489879711 and parameters: {'kernel': 'linear', 'C': 13.930187109891662, 'gamma': 0.000374538389661846, 'epsilon': 0.016018912281035108}. Best is trial 345 with value: 0.13438257115663557.
[I 2024-12-03 19:19:02,622] Trial 2199 finished with value: 0.1365244129530254 and parameters: {'kernel': 'linear', 'C': 5.607209574107369, 'gamma': 0.0007997356884257709, 'epsilon': 0.025486504397429343}. Best is trial 345 with value: 0.13438257115663557.
[I 2024-12-03 19:19:02,915] Trial 2205 finished with value: 0.15065618957543653 and parameters: {'kernel': 'linear', 'C': 16.984521062596738, 'gamma': 0.0015670534397325276, 'epsilon': 0.14535726023265352}. Best is trial 345 with value: 0.13438257115663557.
[I 2024-12-03 19:19:03,075] Trial 2193 finished with value: 0.13482099535639608 and parameters: {'kernel': 'linear', 'C': 21.55172742294298, 'gamma': 0.00029288727768194577, 'epsilon': 0.04025913543322403}. Best is trial 345 with value: 0.13438257115663557.
[I 2024-12-03 19:19:06,952] Trial 2208 finished with value: 0.13518685559372892 and parameters: {'kernel': 'linear', 'C': 4.043573944047067, 'gamma': 0.0018316018161718779, 'epsilon': 0.05078386028558669}. Best is trial 345 with value: 0.13438257115663557.
[I 2024-12-03 19:19:08,389] Trial 2211 finished with value: 0.3431200100889178 and parameters: {'kernel': 'rbf', 'C': 7.5789712783235, 'gamma': 0.000366050696560504, 'epsilon': 0.019179020656957188}. Best is trial 345 with value: 0.13438257115663557.
[I 2024-12-03 19:19:08,943] Trial 2184 finished with value: 0.13579961771690113 and parameters: {'kernel': 'linear', 'C': 72.5659018376397, 'gamma': 0.0004258323109042609, 'epsilon': 0.06784343775543013}. Best is trial 345 with value: 0.13438257115663557.
[I 2024-12-03 19:19:13,351] Trial 2143 finished with value: 0.13786977983102833 and parameters: {'kernel': 'linear', 'C': 72.8857393292576, 'gamma': 0.3223731533026263, 'epsilon': 0.00894576108959754}. Best is trial 345 with value: 0.13438257115663557.
[I 2024-12-03 19:19:14,265] Trial 2213 finished with value: 0.1361480956244761 and parameters: {'kernel': 'linear', 'C': 4.738555293992589, 'gamma': 0.0022839585967188714, 'epsilon': 0.033546254429560614}. Best is trial 345 with value: 0.13438257115663557.
[I 2024-12-03 19:19:15,885] Trial 2202 finished with value: 0.13846066062823426 and parameters: {'kernel': 'linear', 'C': 15.003659688660779, 'gamma': 0.031906540793466505, 'epsilon': 0.012234823172221673}. Best is trial 345 with value: 0.13438257115663557.
[I 2024-12-03 19:19:17,151] Trial 2216 finished with value: 0.5389838529297617 and parameters: {'kernel': 'sigmoid', 'C': 1.6843597739819232, 'gamma': 0.0003988907566482553, 'epsilon': 0.17093306752251405}. Best is trial 345 with value: 0.13438257115663557.
[I 2024-12-03 19:19:18,421] Trial 2212 finished with value: 0.13562038676883711 and parameters: {'kernel': 'linear', 'C': 10.513415187692537, 'gamma': 0.0031331357787040244, 'epsilon': 0.029655970383283235}. Best is trial 345 with value: 0.13438257115663557.
