[I 2024-12-04 11:52:25,060] Trial 149 finished with value: 0.8197632085734636 and parameters: {'max_depth': 35, 'min_samples_split': 16, 'min_samples_leaf': 2, 'max_features': 'sqrt', 'criterion': 'squared_error', 'splitter': 'best'}. Best is trial 115 with value: 0.6379386941389483.
[I 2024-12-04 11:52:25,373] Trial 160 finished with value: 0.8266069286848198 and parameters: {'max_depth': 29, 'min_samples_split': 9, 'min_samples_leaf': 2, 'max_features': 'sqrt', 'criterion': 'friedman_mse', 'splitter': 'best'}. Best is trial 115 with value: 0.6379386941389483.
[I 2024-12-04 11:52:25,747] Trial 154 finished with value: 0.7198974376771606 and parameters: {'max_depth': 27, 'min_samples_split': 8, 'min_samples_leaf': 1, 'max_features': 'sqrt', 'criterion': 'friedman_mse', 'splitter': 'best'}. Best is trial 115 with value: 0.6379386941389483.
[I 2024-12-04 11:52:25,812] Trial 139 finished with value: 1.0816149376799358 and parameters: {'max_depth': 20, 'min_samples_split': 7, 'min_samples_leaf': 8, 'max_features': 'sqrt', 'criterion': 'friedman_mse', 'splitter': 'random'}. Best is trial 115 with value: 0.6379386941389483.
[I 2024-12-04 11:52:26,315] Trial 163 finished with value: 0.716860153973057 and parameters: {'max_depth': 31, 'min_samples_split': 2, 'min_samples_leaf': 1, 'max_features': 'sqrt', 'criterion': 'friedman_mse', 'splitter': 'best'}. Best is trial 115 with value: 0.6379386941389483.
[I 2024-12-04 11:52:26,486] Trial 158 finished with value: 0.6861073677411083 and parameters: {'max_depth': 33, 'min_samples_split': 14, 'min_samples_leaf': 1, 'max_features': 'sqrt', 'criterion': 'friedman_mse', 'splitter': 'best'}. Best is trial 115 with value: 0.6379386941389483.
[I 2024-12-04 11:52:26,621] Trial 159 finished with value: 0.6657045440033218 and parameters: {'max_depth': 35, 'min_samples_split': 12, 'min_samples_leaf': 1, 'max_features': 'sqrt', 'criterion': 'friedman_mse', 'splitter': 'best'}. Best is trial 115 with value: 0.6379386941389483.
[I 2024-12-04 11:52:26,739] Trial 148 finished with value: 0.6743679418637896 and parameters: {'max_depth': 31, 'min_samples_split': 7, 'min_samples_leaf': 1, 'max_features': 'sqrt', 'criterion': 'friedman_mse', 'splitter': 'best'}. Best is trial 115 with value: 0.6379386941389483.
[I 2024-12-04 11:52:27,051] Trial 165 finished with value: 1.092723027538113 and parameters: {'max_depth': 19, 'min_samples_split': 14, 'min_samples_leaf': 10, 'max_features': 'log2', 'criterion': 'friedman_mse', 'splitter': 'random'}. Best is trial 115 with value: 0.6379386941389483.
[I 2024-12-04 11:52:27,623] Trial 162 finished with value: 1.069162995392052 and parameters: {'max_depth': 2, 'min_samples_split': 6, 'min_samples_leaf': 1, 'max_features': 'log2', 'criterion': 'absolute_error', 'splitter': 'random'}. Best is trial 115 with value: 0.6379386941389483.
[I 2024-12-04 11:52:28,116] Trial 173 finished with value: 0.8439213003517541 and parameters: {'max_depth': 35, 'min_samples_split': 8, 'min_samples_leaf': 2, 'max_features': 'log2', 'criterion': 'absolute_error', 'splitter': 'best'}. Best is trial 115 with value: 0.6379386941389483.
[I 2024-12-04 11:52:28,310] Trial 168 finished with value: 0.8101385948198155 and parameters: {'max_depth': 27, 'min_samples_split': 3, 'min_samples_leaf': 3, 'max_features': 'sqrt', 'criterion': 'friedman_mse', 'splitter': 'best'}. Best is trial 115 with value: 0.6379386941389483.
[I 2024-12-04 11:52:28,333] Trial 164 finished with value: 0.6574307891866741 and parameters: {'max_depth': 27, 'min_samples_split': 10, 'min_samples_leaf': 1, 'max_features': 'sqrt', 'criterion': 'friedman_mse', 'splitter': 'best'}. Best is trial 115 with value: 0.6379386941389483.
[I 2024-12-04 11:52:29,676] Trial 175 finished with value: 0.7094978800683202 and parameters: {'max_depth': 35, 'min_samples_split': 11, 'min_samples_leaf': 1, 'max_features': 'log2', 'criterion': 'squared_error', 'splitter': 'best'}. Best is trial 115 with value: 0.6379386941389483.
[I 2024-12-04 11:52:29,738] Trial 167 finished with value: 1.091656728529238 and parameters: {'max_depth': 5, 'min_samples_split': 4, 'min_samples_leaf': 10, 'max_features': 'log2', 'criterion': 'squared_error', 'splitter': 'best'}. Best is trial 115 with value: 0.6379386941389483.
[I 2024-12-04 11:52:30,492] Trial 174 finished with value: 0.8197632085734636 and parameters: {'max_depth': 23, 'min_samples_split': 13, 'min_samples_leaf': 2, 'max_features': 'sqrt', 'criterion': 'friedman_mse', 'splitter': 'best'}. Best is trial 115 with value: 0.6379386941389483.
[I 2024-12-04 11:52:30,602] Trial 178 finished with value: 0.7318251625114702 and parameters: {'max_depth': 28, 'min_samples_split': 11, 'min_samples_leaf': 1, 'max_features': 'sqrt', 'criterion': 'friedman_mse', 'splitter': 'best'}. Best is trial 115 with value: 0.6379386941389483.
[I 2024-12-04 11:52:30,757] Trial 172 finished with value: 0.8948705414188449 and parameters: {'max_depth': 16, 'min_samples_split': 3, 'min_samples_leaf': 3, 'max_features': 'sqrt', 'criterion': 'squared_error', 'splitter': 'random'}. Best is trial 115 with value: 0.6379386941389483.
[I 2024-12-04 11:52:30,758] Trial 156 finished with value: 0.8606038828695697 and parameters: {'max_depth': 31, 'min_samples_split': 3, 'min_samples_leaf': 2, 'max_features': 'log2', 'criterion': 'friedman_mse', 'splitter': 'best'}. Best is trial 115 with value: 0.6379386941389483.
[I 2024-12-04 11:52:30,890] Trial 166 finished with value: 0.6441559104014428 and parameters: {'max_depth': 25, 'min_samples_split': 11, 'min_samples_leaf': 1, 'max_features': 'sqrt', 'criterion': 'friedman_mse', 'splitter': 'best'}. Best is trial 115 with value: 0.6379386941389483.
[I 2024-12-04 11:52:31,592] Trial 170 finished with value: 0.6869124026100815 and parameters: {'max_depth': 32, 'min_samples_split': 5, 'min_samples_leaf': 1, 'max_features': 'sqrt', 'criterion': 'friedman_mse', 'splitter': 'best'}. Best is trial 115 with value: 0.6379386941389483.
[I 2024-12-04 11:52:31,904] Trial 176 finished with value: 0.8225022089543504 and parameters: {'max_depth': 32, 'min_samples_split': 6, 'min_samples_leaf': 2, 'max_features': 'sqrt', 'criterion': 'friedman_mse', 'splitter': 'best'}. Best is trial 115 with value: 0.6379386941389483.
[I 2024-12-04 11:52:31,921] Trial 182 finished with value: 0.6855391594720329 and parameters: {'max_depth': 22, 'min_samples_split': 6, 'min_samples_leaf': 1, 'max_features': 'log2', 'criterion': 'squared_error', 'splitter': 'best'}. Best is trial 115 with value: 0.6379386941389483.
[I 2024-12-04 11:52:32,785] Trial 183 finished with value: 0.689714141504323 and parameters: {'max_depth': 31, 'min_samples_split': 14, 'min_samples_leaf': 1, 'max_features': 'sqrt', 'criterion': 'squared_error', 'splitter': 'best'}. Best is trial 115 with value: 0.6379386941389483.
[I 2024-12-04 11:52:33,064] Trial 171 finished with value: 1.0837913044064313 and parameters: {'max_depth': 1, 'min_samples_split': 19, 'min_samples_leaf': 7, 'max_features': 'sqrt', 'criterion': 'absolute_error', 'splitter': 'random'}. Best is trial 115 with value: 0.6379386941389483.
[I 2024-12-04 11:52:33,306] Trial 180 finished with value: 0.6439029894887489 and parameters: {'max_depth': 29, 'min_samples_split': 13, 'min_samples_leaf': 1, 'max_features': 'sqrt', 'criterion': 'friedman_mse', 'splitter': 'best'}. Best is trial 181 with value: 0.6095141852505885.
[I 2024-12-04 11:52:33,571] Trial 181 finished with value: 0.6095141852505885 and parameters: {'max_depth': 31, 'min_samples_split': 9, 'min_samples_leaf': 1, 'max_features': 'sqrt', 'criterion': 'friedman_mse', 'splitter': 'best'}. Best is trial 181 with value: 0.6095141852505885.
[I 2024-12-04 11:52:33,715] Trial 169 finished with value: 0.9058853713955142 and parameters: {'max_depth': 26, 'min_samples_split': 2, 'min_samples_leaf': 4, 'max_features': 'sqrt', 'criterion': 'friedman_mse', 'splitter': 'random'}. Best is trial 181 with value: 0.6095141852505885.
[I 2024-12-04 11:52:34,101] Trial 184 finished with value: 1.0781009697974677 and parameters: {'max_depth': 5, 'min_samples_split': 16, 'min_samples_leaf': 4, 'max_features': 'log2', 'criterion': 'squared_error', 'splitter': 'best'}. Best is trial 181 with value: 0.6095141852505885.
[I 2024-12-04 11:52:34,609] Trial 177 finished with value: 0.75811152417054 and parameters: {'max_depth': 17, 'min_samples_split': 12, 'min_samples_leaf': 1, 'max_features': 'sqrt', 'criterion': 'friedman_mse', 'splitter': 'best'}. Best is trial 181 with value: 0.6095141852505885.
[I 2024-12-04 11:52:34,611] Trial 179 finished with value: 1.092257372628799 and parameters: {'max_depth': 7, 'min_samples_split': 12, 'min_samples_leaf': 4, 'max_features': 'log2', 'criterion': 'friedman_mse', 'splitter': 'random'}. Best is trial 181 with value: 0.6095141852505885.
[I 2024-12-04 11:52:35,078] Trial 187 finished with value: 0.7076688202951463 and parameters: {'max_depth': 24, 'min_samples_split': 14, 'min_samples_leaf': 1, 'max_features': 'sqrt', 'criterion': 'friedman_mse', 'splitter': 'best'}. Best is trial 181 with value: 0.6095141852505885.
[I 2024-12-04 11:52:35,098] Trial 186 finished with value: 1.091656728529238 and parameters: {'max_depth': 24, 'min_samples_split': 11, 'min_samples_leaf': 8, 'max_features': 'log2', 'criterion': 'friedman_mse', 'splitter': 'best'}. Best is trial 181 with value: 0.6095141852505885.
[I 2024-12-04 11:52:35,807] Trial 191 finished with value: 1.091656728529238 and parameters: {'max_depth': 4, 'min_samples_split': 16, 'min_samples_leaf': 9, 'max_features': 'log2', 'criterion': 'friedman_mse', 'splitter': 'best'}. Best is trial 181 with value: 0.6095141852505885.
[I 2024-12-04 11:52:35,989] Trial 196 finished with value: 0.6995519727819436 and parameters: {'max_depth': 28, 'min_samples_split': 9, 'min_samples_leaf': 1, 'max_features': 'sqrt', 'criterion': 'friedman_mse', 'splitter': 'best'}. Best is trial 181 with value: 0.6095141852505885.
[I 2024-12-04 11:52:36,004] Trial 197 finished with value: 0.6565798355856903 and parameters: {'max_depth': 32, 'min_samples_split': 11, 'min_samples_leaf': 1, 'max_features': 'sqrt', 'criterion': 'friedman_mse', 'splitter': 'best'}. Best is trial 181 with value: 0.6095141852505885.
[I 2024-12-04 11:52:36,160] Trial 195 finished with value: 0.6889323634393683 and parameters: {'max_depth': 30, 'min_samples_split': 11, 'min_samples_leaf': 1, 'max_features': 'sqrt', 'criterion': 'friedman_mse', 'splitter': 'best'}. Best is trial 181 with value: 0.6095141852505885.
[I 2024-12-04 11:52:36,507] Trial 193 finished with value: 0.7235062702460188 and parameters: {'max_depth': 34, 'min_samples_split': 11, 'min_samples_leaf': 1, 'max_features': 'sqrt', 'criterion': 'squared_error', 'splitter': 'best'}. Best is trial 181 with value: 0.6095141852505885.
[I 2024-12-04 11:52:37,256] Trial 188 finished with value: 1.092723027538113 and parameters: {'max_depth': 5, 'min_samples_split': 5, 'min_samples_leaf': 9, 'max_features': 'log2', 'criterion': 'friedman_mse', 'splitter': 'random'}. Best is trial 181 with value: 0.6095141852505885.
[I 2024-12-04 11:52:37,688] Trial 198 finished with value: 0.6369615919324941 and parameters: {'max_depth': 33, 'min_samples_split': 11, 'min_samples_leaf': 1, 'max_features': 'sqrt', 'criterion': 'friedman_mse', 'splitter': 'best'}. Best is trial 181 with value: 0.6095141852505885.
[I 2024-12-04 11:52:37,726] Trial 189 finished with value: 0.692210687036355 and parameters: {'max_depth': 33, 'min_samples_split': 12, 'min_samples_leaf': 1, 'max_features': 'sqrt', 'criterion': 'squared_error', 'splitter': 'best'}. Best is trial 181 with value: 0.6095141852505885.
[I 2024-12-04 11:52:39,038] Trial 194 finished with value: 0.807724441201823 and parameters: {'max_depth': 25, 'min_samples_split': 15, 'min_samples_leaf': 4, 'max_features': 'sqrt', 'criterion': 'friedman_mse', 'splitter': 'best'}. Best is trial 181 with value: 0.6095141852505885.
[I 2024-12-04 11:52:39,345] Trial 192 finished with value: 0.813939961094671 and parameters: {'max_depth': 29, 'min_samples_split': 2, 'min_samples_leaf': 1, 'max_features': 'sqrt', 'criterion': 'friedman_mse', 'splitter': 'random'}. Best is trial 181 with value: 0.6095141852505885.
[I 2024-12-04 11:52:39,355] Trial 204 finished with value: 0.6570109226401653 and parameters: {'max_depth': 35, 'min_samples_split': 11, 'min_samples_leaf': 1, 'max_features': 'sqrt', 'criterion': 'friedman_mse', 'splitter': 'best'}. Best is trial 181 with value: 0.6095141852505885.
[I 2024-12-04 11:52:39,366] Trial 205 finished with value: 0.8009210295489539 and parameters: {'max_depth': 32, 'min_samples_split': 3, 'min_samples_leaf': 1, 'max_features': 'sqrt', 'criterion': 'friedman_mse', 'splitter': 'random'}. Best is trial 181 with value: 0.6095141852505885.
[I 2024-12-04 11:52:39,537] Trial 200 finished with value: 0.8266069286848198 and parameters: {'max_depth': 34, 'min_samples_split': 10, 'min_samples_leaf': 2, 'max_features': 'sqrt', 'criterion': 'friedman_mse', 'splitter': 'best'}. Best is trial 181 with value: 0.6095141852505885.
[I 2024-12-04 11:52:39,921] Trial 202 finished with value: 0.8145306303175658 and parameters: {'max_depth': 33, 'min_samples_split': 18, 'min_samples_leaf': 3, 'max_features': 'sqrt', 'criterion': 'friedman_mse', 'splitter': 'best'}. Best is trial 181 with value: 0.6095141852505885.
[I 2024-12-04 11:52:40,410] Trial 201 finished with value: 0.7023216453774249 and parameters: {'max_depth': 32, 'min_samples_split': 13, 'min_samples_leaf': 1, 'max_features': 'sqrt', 'criterion': 'friedman_mse', 'splitter': 'best'}. Best is trial 181 with value: 0.6095141852505885.
[I 2024-12-04 11:52:40,435] Trial 199 finished with value: 0.8197632085734636 and parameters: {'max_depth': 32, 'min_samples_split': 16, 'min_samples_leaf': 2, 'max_features': 'sqrt', 'criterion': 'friedman_mse', 'splitter': 'best'}. Best is trial 181 with value: 0.6095141852505885.
[I 2024-12-04 11:52:42,181] Trial 211 finished with value: 0.6565798355856903 and parameters: {'max_depth': 32, 'min_samples_split': 11, 'min_samples_leaf': 1, 'max_features': 'sqrt', 'criterion': 'friedman_mse', 'splitter': 'best'}. Best is trial 181 with value: 0.6095141852505885.
[I 2024-12-04 11:52:42,454] Trial 203 finished with value: 0.8197632085734636 and parameters: {'max_depth': 34, 'min_samples_split': 13, 'min_samples_leaf': 2, 'max_features': 'sqrt', 'criterion': 'friedman_mse', 'splitter': 'best'}. Best is trial 181 with value: 0.6095141852505885.
[I 2024-12-04 11:52:42,831] Trial 213 finished with value: 0.8391355810268111 and parameters: {'max_depth': 34, 'min_samples_split': 8, 'min_samples_leaf': 2, 'max_features': 'sqrt', 'criterion': 'friedman_mse', 'splitter': 'best'}. Best is trial 181 with value: 0.6095141852505885.
[I 2024-12-04 11:52:43,180] Trial 212 finished with value: 0.615874208166451 and parameters: {'max_depth': 34, 'min_samples_split': 9, 'min_samples_leaf': 1, 'max_features': 'sqrt', 'criterion': 'friedman_mse', 'splitter': 'best'}. Best is trial 181 with value: 0.6095141852505885.
[I 2024-12-04 11:52:43,331] Trial 207 finished with value: 0.8814138348450391 and parameters: {'max_depth': 28, 'min_samples_split': 13, 'min_samples_leaf': 5, 'max_features': 'sqrt', 'criterion': 'absolute_error', 'splitter': 'best'}. Best is trial 181 with value: 0.6095141852505885.
[I 2024-12-04 11:52:43,453] Trial 208 finished with value: 0.7757296677391267 and parameters: {'max_depth': 17, 'min_samples_split': 5, 'min_samples_leaf': 1, 'max_features': 'sqrt', 'criterion': 'absolute_error', 'splitter': 'best'}. Best is trial 181 with value: 0.6095141852505885.
[I 2024-12-04 11:52:43,616] Trial 215 finished with value: 0.6789669071314235 and parameters: {'max_depth': 31, 'min_samples_split': 10, 'min_samples_leaf': 1, 'max_features': 'sqrt', 'criterion': 'friedman_mse', 'splitter': 'best'}. Best is trial 181 with value: 0.6095141852505885.
[I 2024-12-04 11:52:43,800] Trial 190 finished with value: 1.0670947577772893 and parameters: {'max_depth': 4, 'min_samples_split': 3, 'min_samples_leaf': 4, 'max_features': 'sqrt', 'criterion': 'absolute_error', 'splitter': 'random'}. Best is trial 181 with value: 0.6095141852505885.
[I 2024-12-04 11:52:44,158] Trial 221 finished with value: 1.0689310653398096 and parameters: {'max_depth': 22, 'min_samples_split': 5, 'min_samples_leaf': 3, 'max_features': 'log2', 'criterion': 'absolute_error', 'splitter': 'random'}. Best is trial 181 with value: 0.6095141852505885.
[I 2024-12-04 11:52:44,556] Trial 223 finished with value: 0.6657045440033218 and parameters: {'max_depth': 35, 'min_samples_split': 12, 'min_samples_leaf': 1, 'max_features': 'sqrt', 'criterion': 'friedman_mse', 'splitter': 'best'}. Best is trial 181 with value: 0.6095141852505885.
[I 2024-12-04 11:52:44,557] Trial 185 finished with value: 1.0846483819191597 and parameters: {'max_depth': 2, 'min_samples_split': 3, 'min_samples_leaf': 2, 'max_features': 'log2', 'criterion': 'friedman_mse', 'splitter': 'best'}. Best is trial 181 with value: 0.6095141852505885.
[I 2024-12-04 11:52:45,008] Trial 210 finished with value: 1.0745658542945478 and parameters: {'max_depth': 19, 'min_samples_split': 20, 'min_samples_leaf': 5, 'max_features': 'log2', 'criterion': 'absolute_error', 'splitter': 'random'}. Best is trial 181 with value: 0.6095141852505885.
[I 2024-12-04 11:52:45,197] Trial 218 finished with value: 0.6570109226401653 and parameters: {'max_depth': 35, 'min_samples_split': 11, 'min_samples_leaf': 1, 'max_features': 'sqrt', 'criterion': 'friedman_mse', 'splitter': 'best'}. Best is trial 181 with value: 0.6095141852505885.
[I 2024-12-04 11:52:45,316] Trial 206 finished with value: 0.6965652804653477 and parameters: {'max_depth': 34, 'min_samples_split': 14, 'min_samples_leaf': 1, 'max_features': 'sqrt', 'criterion': 'friedman_mse', 'splitter': 'best'}. Best is trial 181 with value: 0.6095141852505885.
[I 2024-12-04 11:52:45,402] Trial 219 finished with value: 0.6897370689523286 and parameters: {'max_depth': 34, 'min_samples_split': 10, 'min_samples_leaf': 1, 'max_features': 'sqrt', 'criterion': 'friedman_mse', 'splitter': 'best'}. Best is trial 181 with value: 0.6095141852505885.
[I 2024-12-04 11:52:46,468] Trial 222 finished with value: 0.8105579954451577 and parameters: {'max_depth': 28, 'min_samples_split': 12, 'min_samples_leaf': 3, 'max_features': 'sqrt', 'criterion': 'friedman_mse', 'splitter': 'best'}. Best is trial 181 with value: 0.6095141852505885.
[I 2024-12-04 11:52:46,742] Trial 216 finished with value: 0.8137608958686491 and parameters: {'max_depth': 35, 'min_samples_split': 12, 'min_samples_leaf': 2, 'max_features': 'sqrt', 'criterion': 'friedman_mse', 'splitter': 'best'}. Best is trial 181 with value: 0.6095141852505885.
[I 2024-12-04 11:52:46,780] Trial 220 finished with value: 0.8228668341371398 and parameters: {'max_depth': 32, 'min_samples_split': 8, 'min_samples_leaf': 5, 'max_features': 'sqrt', 'criterion': 'friedman_mse', 'splitter': 'best'}. Best is trial 181 with value: 0.6095141852505885.
[I 2024-12-04 11:52:46,915] Trial 217 finished with value: 0.6928930705527838 and parameters: {'max_depth': 34, 'min_samples_split': 17, 'min_samples_leaf': 1, 'max_features': 'sqrt', 'criterion': 'friedman_mse', 'splitter': 'best'}. Best is trial 181 with value: 0.6095141852505885.
[I 2024-12-04 11:52:47,054] Trial 227 finished with value: 0.7037914714631972 and parameters: {'max_depth': 34, 'min_samples_split': 16, 'min_samples_leaf': 1, 'max_features': 'sqrt', 'criterion': 'friedman_mse', 'splitter': 'best'}. Best is trial 181 with value: 0.6095141852505885.
[I 2024-12-04 11:52:47,180] Trial 214 finished with value: 0.6565798355856903 and parameters: {'max_depth': 32, 'min_samples_split': 11, 'min_samples_leaf': 1, 'max_features': 'sqrt', 'criterion': 'friedman_mse', 'splitter': 'best'}. Best is trial 181 with value: 0.6095141852505885.
[I 2024-12-04 11:52:47,196] Trial 229 finished with value: 0.7951215324537838 and parameters: {'max_depth': 35, 'min_samples_split': 11, 'min_samples_leaf': 2, 'max_features': 'sqrt', 'criterion': 'absolute_error', 'splitter': 'best'}. Best is trial 181 with value: 0.6095141852505885.
[I 2024-12-04 11:52:47,198] Trial 225 finished with value: 0.81532005575988 and parameters: {'max_depth': 33, 'min_samples_split': 11, 'min_samples_leaf': 1, 'max_features': 'sqrt', 'criterion': 'friedman_mse', 'splitter': 'random'}. Best is trial 181 with value: 0.6095141852505885.
[I 2024-12-04 11:52:47,842] Trial 231 finished with value: 0.6211247384218127 and parameters: {'max_depth': 31, 'min_samples_split': 12, 'min_samples_leaf': 1, 'max_features': 'sqrt', 'criterion': 'friedman_mse', 'splitter': 'best'}. Best is trial 181 with value: 0.6095141852505885.
[I 2024-12-04 11:52:48,277] Trial 226 finished with value: 0.6565798355856903 and parameters: {'max_depth': 32, 'min_samples_split': 11, 'min_samples_leaf': 1, 'max_features': 'sqrt', 'criterion': 'friedman_mse', 'splitter': 'best'}. Best is trial 181 with value: 0.6095141852505885.
[I 2024-12-04 11:52:48,649] Trial 224 finished with value: 0.7627295289416239 and parameters: {'max_depth': 35, 'min_samples_split': 12, 'min_samples_leaf': 2, 'max_features': 'sqrt', 'criterion': 'squared_error', 'splitter': 'random'}. Best is trial 181 with value: 0.6095141852505885.
[I 2024-12-04 11:52:49,763] Trial 232 finished with value: 0.6935908088501267 and parameters: {'max_depth': 35, 'min_samples_split': 10, 'min_samples_leaf': 1, 'max_features': 'sqrt', 'criterion': 'friedman_mse', 'splitter': 'best'}. Best is trial 181 with value: 0.6095141852505885.
[I 2024-12-04 11:52:51,098] Trial 209 finished with value: 1.092723027538113 and parameters: {'max_depth': 35, 'min_samples_split': 2, 'min_samples_leaf': 8, 'max_features': 'log2', 'criterion': 'friedman_mse', 'splitter': 'random'}. Best is trial 181 with value: 0.6095141852505885.
