[I 2024-12-04 14:56:05,021] Trial 10 finished with value: 0.9864686819226415 and parameters: {'kernel_type': 'Matern', 'length_scale': 0.00015431732837779374, 'noise_level': 4.2397514883341116e-05, 'constant_value': 4.328220481828989e-06, 'nu': 1.5}. Best is trial 11 with value: 0.1424950545886159.
Traceback (most recent call last):
  File "/zhome/b1/0/88900/miniconda3/envs/critprops/lib/python3.9/site-packages/sqlalchemy/engine/base.py", line 1967, in _exec_single_context
    self.dialect.do_execute(
  File "/zhome/b1/0/88900/miniconda3/envs/critprops/lib/python3.9/site-packages/sqlalchemy/engine/default.py", line 941, in do_execute
    cursor.execute(statement, parameters)
sqlite3.OperationalError: database is locked

The above exception was the direct cause of the following exception:

Traceback (most recent call last):
  File "/zhome/b1/0/88900/miniconda3/envs/critprops/lib/python3.9/site-packages/optuna/storages/_rdb/storage.py", line 81, in _create_scoped_session
    session.commit()
  File "/zhome/b1/0/88900/miniconda3/envs/critprops/lib/python3.9/site-packages/sqlalchemy/orm/session.py", line 2028, in commit
    trans.commit(_to_root=True)
  File "<string>", line 2, in commit
  File "/zhome/b1/0/88900/miniconda3/envs/critprops/lib/python3.9/site-packages/sqlalchemy/orm/state_changes.py", line 139, in _go
    ret_value = fn(self, *arg, **kw)
  File "/zhome/b1/0/88900/miniconda3/envs/critprops/lib/python3.9/site-packages/sqlalchemy/orm/session.py", line 1313, in commit
    self._prepare_impl()
  File "<string>", line 2, in _prepare_impl
  File "/zhome/b1/0/88900/miniconda3/envs/critprops/lib/python3.9/site-packages/sqlalchemy/orm/state_changes.py", line 139, in _go
    ret_value = fn(self, *arg, **kw)
  File "/zhome/b1/0/88900/miniconda3/envs/critprops/lib/python3.9/site-packages/sqlalchemy/orm/session.py", line 1288, in _prepare_impl
    self.session.flush()
  File "/zhome/b1/0/88900/miniconda3/envs/critprops/lib/python3.9/site-packages/sqlalchemy/orm/session.py", line 4352, in flush
    self._flush(objects)
  File "/zhome/b1/0/88900/miniconda3/envs/critprops/lib/python3.9/site-packages/sqlalchemy/orm/session.py", line 4488, in _flush
    transaction.rollback(_capture_exception=True)
  File "/zhome/b1/0/88900/miniconda3/envs/critprops/lib/python3.9/site-packages/sqlalchemy/util/langhelpers.py", line 146, in __exit__
    raise exc_value.with_traceback(exc_tb)
  File "/zhome/b1/0/88900/miniconda3/envs/critprops/lib/python3.9/site-packages/sqlalchemy/orm/session.py", line 4448, in _flush
    flush_context.execute()
  File "/zhome/b1/0/88900/miniconda3/envs/critprops/lib/python3.9/site-packages/sqlalchemy/orm/unitofwork.py", line 466, in execute
    rec.execute(self)
  File "/zhome/b1/0/88900/miniconda3/envs/critprops/lib/python3.9/site-packages/sqlalchemy/orm/unitofwork.py", line 642, in execute
    util.preloaded.orm_persistence.save_obj(
  File "/zhome/b1/0/88900/miniconda3/envs/critprops/lib/python3.9/site-packages/sqlalchemy/orm/persistence.py", line 85, in save_obj
    _emit_update_statements(
  File "/zhome/b1/0/88900/miniconda3/envs/critprops/lib/python3.9/site-packages/sqlalchemy/orm/persistence.py", line 912, in _emit_update_statements
    c = connection.execute(
  File "/zhome/b1/0/88900/miniconda3/envs/critprops/lib/python3.9/site-packages/sqlalchemy/engine/base.py", line 1418, in execute
    return meth(
  File "/zhome/b1/0/88900/miniconda3/envs/critprops/lib/python3.9/site-packages/sqlalchemy/sql/elements.py", line 515, in _execute_on_connection
    return connection._execute_clauseelement(
  File "/zhome/b1/0/88900/miniconda3/envs/critprops/lib/python3.9/site-packages/sqlalchemy/engine/base.py", line 1640, in _execute_clauseelement
    ret = self._execute_context(
  File "/zhome/b1/0/88900/miniconda3/envs/critprops/lib/python3.9/site-packages/sqlalchemy/engine/base.py", line 1846, in _execute_context
    return self._exec_single_context(
  File "/zhome/b1/0/88900/miniconda3/envs/critprops/lib/python3.9/site-packages/sqlalchemy/engine/base.py", line 1986, in _exec_single_context
    self._handle_dbapi_exception(
  File "/zhome/b1/0/88900/miniconda3/envs/critprops/lib/python3.9/site-packages/sqlalchemy/engine/base.py", line 2355, in _handle_dbapi_exception
    raise sqlalchemy_exception.with_traceback(exc_info[2]) from e
  File "/zhome/b1/0/88900/miniconda3/envs/critprops/lib/python3.9/site-packages/sqlalchemy/engine/base.py", line 1967, in _exec_single_context
    self.dialect.do_execute(
  File "/zhome/b1/0/88900/miniconda3/envs/critprops/lib/python3.9/site-packages/sqlalchemy/engine/default.py", line 941, in do_execute
    cursor.execute(statement, parameters)
sqlalchemy.exc.OperationalError: (sqlite3.OperationalError) database is locked
[SQL: UPDATE trials SET state=?, datetime_complete=? WHERE trials.trial_id = ?]
[parameters: ('COMPLETE', '2024-12-04 14:55:19.266872', 9)]
(Background on this error at: https://sqlalche.me/e/20/e3q8)

The above exception was the direct cause of the following exception:

Traceback (most recent call last):
  File "/zhome/b1/0/88900/miniconda3/envs/critprops/lib/python3.9/site-packages/optuna/study/_optimize.py", line 209, in _run_trial
    frozen_trial = _tell_with_warning(
  File "/zhome/b1/0/88900/miniconda3/envs/critprops/lib/python3.9/site-packages/optuna/study/_tell.py", line 183, in _tell_with_warning
    study._storage.set_trial_state_values(frozen_trial._trial_id, state, values)
  File "/zhome/b1/0/88900/miniconda3/envs/critprops/lib/python3.9/site-packages/optuna/storages/_cached_storage.py", line 187, in set_trial_state_values
    return self._backend.set_trial_state_values(trial_id, state=state, values=values)
  File "/zhome/b1/0/88900/miniconda3/envs/critprops/lib/python3.9/site-packages/optuna/storages/_rdb/storage.py", line 661, in set_trial_state_values
    trial.datetime_complete = datetime.now()
  File "/zhome/b1/0/88900/miniconda3/envs/critprops/lib/python3.9/contextlib.py", line 126, in __exit__
    next(self.gen)
  File "/zhome/b1/0/88900/miniconda3/envs/critprops/lib/python3.9/site-packages/optuna/storages/_rdb/storage.py", line 98, in _create_scoped_session
    raise optuna.exceptions.StorageInternalError(message) from e
optuna.exceptions.StorageInternalError: An exception is raised during the commit. This typically happens due to invalid data in the commit, e.g. exceeding max length. 

During handling of the above exception, another exception occurred:

Traceback (most recent call last):
  File "/zhome/b1/0/88900/Documents/fair_gc/gc_ml.py", line 79, in <module>
    study, best_model = create_hyperparameter_optimizer(
  File "/zhome/b1/0/88900/Documents/fair_gc/src/optims.py", line 275, in create_hyperparameter_optimizer
    study.optimize(objective, n_trials=n_trials, n_jobs=n_jobs)
  File "/zhome/b1/0/88900/miniconda3/envs/critprops/lib/python3.9/site-packages/optuna/study/study.py", line 475, in optimize
    _optimize(
  File "/zhome/b1/0/88900/miniconda3/envs/critprops/lib/python3.9/site-packages/optuna/study/_optimize.py", line 100, in _optimize
    f.result()
  File "/zhome/b1/0/88900/miniconda3/envs/critprops/lib/python3.9/concurrent/futures/_base.py", line 439, in result
    return self.__get_result()
  File "/zhome/b1/0/88900/miniconda3/envs/critprops/lib/python3.9/concurrent/futures/_base.py", line 391, in __get_result
    raise self._exception
  File "/zhome/b1/0/88900/miniconda3/envs/critprops/lib/python3.9/concurrent/futures/thread.py", line 58, in run
    result = self.fn(*self.args, **self.kwargs)
  File "/zhome/b1/0/88900/miniconda3/envs/critprops/lib/python3.9/site-packages/optuna/study/_optimize.py", line 160, in _optimize_sequential
    frozen_trial = _run_trial(study, func, catch)
  File "/zhome/b1/0/88900/miniconda3/envs/critprops/lib/python3.9/site-packages/optuna/study/_optimize.py", line 241, in _run_trial
    assert False, "Should not reach."
AssertionError: Should not reach.
