[I 2024-12-04 20:13:50,764] Trial 781 finished with value: 0.9864686819455903 and parameters: {'kernel_type': 'Matern', 'length_scale': 207.55005487789404, 'noise_level': 5.114311607218408e-05, 'constant_value': 2.0852296764474243, 'nu': 1.5}. Best is trial 616 with value: 0.1375127577189955.
[I 2024-12-04 20:13:56,771] Trial 782 finished with value: 0.14249505954662112 and parameters: {'kernel_type': 'Matern', 'length_scale': 4.256791868457254, 'noise_level': 0.014942851687987002, 'constant_value': 2926.4792138176676, 'nu': 1.5}. Best is trial 616 with value: 0.1375127577189955.
[I 2024-12-04 20:13:57,068] Trial 784 finished with value: 0.9864686819295344 and parameters: {'kernel_type': 'Matern', 'length_scale': 32.39366691895411, 'noise_level': 0.0021894225661731625, 'constant_value': 0.49652787852602265, 'nu': 1.5}. Best is trial 616 with value: 0.1375127577189955.
[I 2024-12-04 20:13:59,765] Trial 783 finished with value: 0.9864686819226354 and parameters: {'kernel_type': 'Matern', 'length_scale': 173.22964034437683, 'noise_level': 0.0038411312890278162, 'constant_value': 4.768089164221657, 'nu': 1.5}. Best is trial 616 with value: 0.1375127577189955.
[I 2024-12-04 20:14:01,370] Trial 785 finished with value: 0.9864686819225958 and parameters: {'kernel_type': 'RBF', 'length_scale': 0.01723978347990476, 'noise_level': 3.468725910310057e-10, 'constant_value': 0.03682300543738171, 'nu': 2.5}. Best is trial 616 with value: 0.1375127577189955.
[I 2024-12-04 20:14:04,829] Trial 786 finished with value: 0.14249489574317542 and parameters: {'kernel_type': 'Matern', 'length_scale': 1.0221641475595107, 'noise_level': 0.9284319543122548, 'constant_value': 360.84754389321756, 'nu': 1.5}. Best is trial 616 with value: 0.1375127577189955.
[I 2024-12-04 20:14:07,231] Trial 787 finished with value: 0.14249488283529155 and parameters: {'kernel_type': 'Matern', 'length_scale': 9375.742129295519, 'noise_level': 0.04777172857358142, 'constant_value': 1396.6200233323195, 'nu': 1.5}. Best is trial 616 with value: 0.1375127577189955.
[I 2024-12-04 20:14:11,403] Trial 789 finished with value: 0.14249506085074695 and parameters: {'kernel_type': 'Matern', 'length_scale': 1.9245899517442628, 'noise_level': 0.9971811449612816, 'constant_value': 60141.08481944721, 'nu': 1.5}. Best is trial 616 with value: 0.1375127577189955.
[I 2024-12-04 20:14:12,577] Trial 788 finished with value: 0.9864686819174103 and parameters: {'kernel_type': 'RBF', 'length_scale': 1.2436124057427572e-05, 'noise_level': 0.008380207082243355, 'constant_value': 0.0005027985469998668, 'nu': 2.5}. Best is trial 616 with value: 0.1375127577189955.
[I 2024-12-04 20:14:16,059] Trial 790 finished with value: 0.14249506389719246 and parameters: {'kernel_type': 'Matern', 'length_scale': 556.0835130228265, 'noise_level': 0.9753883503991363, 'constant_value': 8.8938505342098, 'nu': 1.5}. Best is trial 616 with value: 0.1375127577189955.
[I 2024-12-04 20:14:17,059] Trial 791 finished with value: 0.14249504965698684 and parameters: {'kernel_type': 'Matern', 'length_scale': 30.2268143889627, 'noise_level': 0.05137646052662563, 'constant_value': 446.4944857697768, 'nu': 1.5}. Best is trial 616 with value: 0.1375127577189955.
[I 2024-12-04 20:14:20,291] Trial 793 finished with value: 0.9864686819225821 and parameters: {'kernel_type': 'Matern', 'length_scale': 19.62044009469833, 'noise_level': 0.002892586690184344, 'constant_value': 0.5910598858443014, 'nu': 1.5}. Best is trial 616 with value: 0.1375127577189955.
[I 2024-12-04 20:14:24,050] Trial 792 finished with value: 0.14249503503864264 and parameters: {'kernel_type': 'Matern', 'length_scale': 15.708364216862106, 'noise_level': 0.5808196079372108, 'constant_value': 166.80449361693044, 'nu': 1.5}. Best is trial 616 with value: 0.1375127577189955.
[I 2024-12-04 20:14:24,086] Trial 794 finished with value: 0.1424948874803573 and parameters: {'kernel_type': 'Matern', 'length_scale': 39.5543690319229, 'noise_level': 0.0009817392407726938, 'constant_value': 423.86963062591593, 'nu': 1.5}. Best is trial 616 with value: 0.1375127577189955.
[I 2024-12-04 20:14:29,298] Trial 795 finished with value: 0.9864686819231465 and parameters: {'kernel_type': 'Matern', 'length_scale': 43.23390464281599, 'noise_level': 0.006736363633651408, 'constant_value': 3.0805555445944526, 'nu': 1.5}. Best is trial 616 with value: 0.1375127577189955.
[I 2024-12-04 20:14:30,990] Trial 797 finished with value: 0.14249507273759446 and parameters: {'kernel_type': 'Matern', 'length_scale': 284.97132621671375, 'noise_level': 0.032017120977875145, 'constant_value': 60947.250332891075, 'nu': 1.5}. Best is trial 616 with value: 0.1375127577189955.
[I 2024-12-04 20:14:31,011] Trial 796 finished with value: 0.1424950779155859 and parameters: {'kernel_type': 'Matern', 'length_scale': 134.2034152517421, 'noise_level': 0.021784498332395617, 'constant_value': 79325.48520955036, 'nu': 1.5}. Best is trial 616 with value: 0.1375127577189955.
[I 2024-12-04 20:14:36,359] Trial 800 finished with value: 0.14249354490255028 and parameters: {'kernel_type': 'Matern', 'length_scale': 30.409804973662073, 'noise_level': 0.05638831529189262, 'constant_value': 588.226670777321, 'nu': 1.5}. Best is trial 616 with value: 0.1375127577189955.
[I 2024-12-04 20:14:37,120] Trial 798 finished with value: 0.14249506778424623 and parameters: {'kernel_type': 'Matern', 'length_scale': 89.09778904354894, 'noise_level': 0.06402128859451878, 'constant_value': 3.0158632201702362, 'nu': 1.5}. Best is trial 616 with value: 0.1375127577189955.
[I 2024-12-04 20:14:41,106] Trial 799 finished with value: 0.1424950617622565 and parameters: {'kernel_type': 'Matern', 'length_scale': 2056.3708059214523, 'noise_level': 0.73739766128347, 'constant_value': 1.000963789296806, 'nu': 1.5}. Best is trial 616 with value: 0.1375127577189955.
[I 2024-12-04 20:14:42,585] Trial 801 finished with value: 0.1424950687973301 and parameters: {'kernel_type': 'Matern', 'length_scale': 12.177498045655472, 'noise_level': 0.000790641918503874, 'constant_value': 348.34332443625476, 'nu': 1.5}. Best is trial 616 with value: 0.1375127577189955.
[I 2024-12-04 20:14:49,446] Trial 803 finished with value: 0.1424949542341264 and parameters: {'kernel_type': 'Matern', 'length_scale': 1.3295935063935533, 'noise_level': 0.029492038729677487, 'constant_value': 49.81000399092516, 'nu': 1.5}. Best is trial 616 with value: 0.1375127577189955.
[I 2024-12-04 20:14:50,788] Trial 804 finished with value: 0.142494887738423 and parameters: {'kernel_type': 'Matern', 'length_scale': 96.93715297151208, 'noise_level': 0.8793848339474327, 'constant_value': 0.18149652315914028, 'nu': 1.5}. Best is trial 616 with value: 0.1375127577189955.
[I 2024-12-04 20:14:51,232] Trial 802 finished with value: 0.986468681939513 and parameters: {'kernel_type': 'Matern', 'length_scale': 48048.45651257968, 'noise_level': 6.20412725242959e-08, 'constant_value': 2.1683001623486443e-06, 'nu': 2.5}. Best is trial 616 with value: 0.1375127577189955.
[I 2024-12-04 20:14:56,783] Trial 805 finished with value: 0.19720014593391788 and parameters: {'kernel_type': 'Matern', 'length_scale': 2183.744528254378, 'noise_level': 0.0013659281376718966, 'constant_value': 21.806036907292043, 'nu': 0.5}. Best is trial 616 with value: 0.1375127577189955.
[I 2024-12-04 20:14:58,159] Trial 807 finished with value: 0.14249506314442828 and parameters: {'kernel_type': 'Matern', 'length_scale': 9.787871254273062, 'noise_level': 0.8050431067947158, 'constant_value': 28.090250506988088, 'nu': 1.5}. Best is trial 616 with value: 0.1375127577189955.
[I 2024-12-04 20:14:59,503] Trial 806 finished with value: 0.14249501568382184 and parameters: {'kernel_type': 'Matern', 'length_scale': 287.72731326147056, 'noise_level': 0.00662444597760588, 'constant_value': 160.34738055454045, 'nu': 1.5}. Best is trial 616 with value: 0.1375127577189955.
[I 2024-12-04 20:15:03,641] Trial 808 finished with value: 0.14249506227395933 and parameters: {'kernel_type': 'Matern', 'length_scale': 11.546615294770413, 'noise_level': 0.016916396704099834, 'constant_value': 3.1429593257289836, 'nu': 1.5}. Best is trial 616 with value: 0.1375127577189955.
[I 2024-12-04 20:15:04,580] Trial 809 finished with value: 0.14249506527049052 and parameters: {'kernel_type': 'Matern', 'length_scale': 0.5444516379928293, 'noise_level': 0.012144881123316029, 'constant_value': 930.4047736855522, 'nu': 1.5}. Best is trial 616 with value: 0.1375127577189955.
[I 2024-12-04 20:15:08,819] Trial 810 finished with value: 0.14249506040855675 and parameters: {'kernel_type': 'Matern', 'length_scale': 45.85566151353999, 'noise_level': 0.0002654820626114689, 'constant_value': 21.1156921747046, 'nu': 1.5}. Best is trial 616 with value: 0.1375127577189955.
[I 2024-12-04 20:15:11,876] Trial 811 finished with value: 0.1424948934637331 and parameters: {'kernel_type': 'Matern', 'length_scale': 136.62017137301777, 'noise_level': 0.5579861745791339, 'constant_value': 16.627553128811826, 'nu': 1.5}. Best is trial 616 with value: 0.1375127577189955.
[I 2024-12-04 20:15:12,003] Trial 812 finished with value: 0.14249504101107877 and parameters: {'kernel_type': 'Matern', 'length_scale': 27.185454871207188, 'noise_level': 0.8540826239979951, 'constant_value': 18.012708048625075, 'nu': 1.5}. Best is trial 616 with value: 0.1375127577189955.
[I 2024-12-04 20:15:15,416] Trial 813 finished with value: 0.1424950679538269 and parameters: {'kernel_type': 'Matern', 'length_scale': 20.92217796929816, 'noise_level': 0.028990533002199344, 'constant_value': 729.9641075442023, 'nu': 1.5}. Best is trial 616 with value: 0.1375127577189955.
[I 2024-12-04 20:15:19,737] Trial 815 finished with value: 0.19720003324099547 and parameters: {'kernel_type': 'Matern', 'length_scale': 63273.21388108802, 'noise_level': 0.0017535337903441476, 'constant_value': 50810.845055378275, 'nu': 0.5}. Best is trial 616 with value: 0.1375127577189955.
[I 2024-12-04 20:15:20,119] Trial 814 finished with value: 0.14249513985675935 and parameters: {'kernel_type': 'Matern', 'length_scale': 7.960624220527665, 'noise_level': 0.7063022179910113, 'constant_value': 221.96058738355867, 'nu': 1.5}. Best is trial 616 with value: 0.1375127577189955.
[I 2024-12-04 20:15:23,886] Trial 816 finished with value: 0.986468681945994 and parameters: {'kernel_type': 'Matern', 'length_scale': 364.48058834272547, 'noise_level': 0.010003677490327491, 'constant_value': 9.04123845403879, 'nu': 1.5}. Best is trial 616 with value: 0.1375127577189955.
[I 2024-12-04 20:15:26,133] Trial 817 finished with value: 0.9864686819974352 and parameters: {'kernel_type': 'Matern', 'length_scale': 0.0016419076251657358, 'noise_level': 4.2033630102659817e-10, 'constant_value': 0.00013068248569359336, 'nu': 0.5}. Best is trial 616 with value: 0.1375127577189955.
[I 2024-12-04 20:15:30,599] Trial 819 finished with value: 0.1424950946045585 and parameters: {'kernel_type': 'Matern', 'length_scale': 2313.913836548124, 'noise_level': 0.10125671082618205, 'constant_value': 22.536744352223458, 'nu': 1.5}. Best is trial 616 with value: 0.1375127577189955.
[I 2024-12-04 20:15:31,956] Trial 818 finished with value: 0.14249503356485635 and parameters: {'kernel_type': 'Matern', 'length_scale': 7.410710173641041, 'noise_level': 0.03775577699824046, 'constant_value': 19.134703867806966, 'nu': 1.5}. Best is trial 616 with value: 0.1375127577189955.
[I 2024-12-04 20:15:32,270] Trial 820 finished with value: 0.14249468302100304 and parameters: {'kernel_type': 'Matern', 'length_scale': 231.2207013072768, 'noise_level': 0.11161463162200201, 'constant_value': 123.82188187052908, 'nu': 1.5}. Best is trial 616 with value: 0.1375127577189955.
[I 2024-12-04 20:15:38,123] Trial 821 finished with value: 0.9864686819228325 and parameters: {'kernel_type': 'Matern', 'length_scale': 900.7609323240891, 'noise_level': 0.0004093496565679414, 'constant_value': 2414.9292052999713, 'nu': 1.5}. Best is trial 616 with value: 0.1375127577189955.
[I 2024-12-04 20:15:39,214] Trial 823 finished with value: 0.9864686819202334 and parameters: {'kernel_type': 'Matern', 'length_scale': 890.8205950342383, 'noise_level': 0.002334422289728644, 'constant_value': 423.1409214815315, 'nu': 1.5}. Best is trial 616 with value: 0.1375127577189955.
[I 2024-12-04 20:15:40,623] Trial 822 finished with value: 0.1424949520195347 and parameters: {'kernel_type': 'Matern', 'length_scale': 11.03694287363959, 'noise_level': 0.06947472826102072, 'constant_value': 149.7599932514698, 'nu': 1.5}. Best is trial 616 with value: 0.1375127577189955.
[I 2024-12-04 20:15:46,492] Trial 824 finished with value: 0.9864686819170296 and parameters: {'kernel_type': 'RBF', 'length_scale': 3978.1387618239146, 'noise_level': 0.012198763532978165, 'constant_value': 7303.633209696213, 'nu': 1.5}. Best is trial 616 with value: 0.1375127577189955.
[I 2024-12-04 20:15:47,045] Trial 825 finished with value: 0.14249542087443465 and parameters: {'kernel_type': 'Matern', 'length_scale': 4.328952218209991, 'noise_level': 0.0013115151203200283, 'constant_value': 123.777724466647, 'nu': 1.5}. Best is trial 616 with value: 0.1375127577189955.
[I 2024-12-04 20:15:49,992] Trial 826 finished with value: 0.14249520699230353 and parameters: {'kernel_type': 'Matern', 'length_scale': 2133.534715088975, 'noise_level': 0.06802727014322014, 'constant_value': 395.82046214067583, 'nu': 1.5}. Best is trial 616 with value: 0.1375127577189955.
[I 2024-12-04 20:15:51,079] Trial 827 finished with value: 0.9864679051953849 and parameters: {'kernel_type': 'Matern', 'length_scale': 0.08455805511281697, 'noise_level': 0.00229953883520846, 'constant_value': 0.008969653031042859, 'nu': 0.5}. Best is trial 616 with value: 0.1375127577189955.
[I 2024-12-04 20:15:55,537] Trial 829 finished with value: 0.14249499276278882 and parameters: {'kernel_type': 'Matern', 'length_scale': 2635.115433769106, 'noise_level': 0.04552553262297302, 'constant_value': 1767.3942838363162, 'nu': 1.5}. Best is trial 616 with value: 0.1375127577189955.
[I 2024-12-04 20:15:57,486] Trial 828 finished with value: 0.986468681922379 and parameters: {'kernel_type': 'Matern', 'length_scale': 51295.91830547646, 'noise_level': 0.010241904051752213, 'constant_value': 87662.073136759, 'nu': 1.5}. Best is trial 616 with value: 0.1375127577189955.
[I 2024-12-04 20:16:01,590] Trial 831 finished with value: 0.14249479378924423 and parameters: {'kernel_type': 'Matern', 'length_scale': 299.06837553671596, 'noise_level': 0.02858805428970496, 'constant_value': 49.77949086497274, 'nu': 1.5}. Best is trial 616 with value: 0.1375127577189955.
[I 2024-12-04 20:16:01,898] Trial 832 finished with value: 0.9982167338039996 and parameters: {'kernel_type': 'Matern', 'length_scale': 0.0005160246529725277, 'noise_level': 2.5369453131671147e-06, 'constant_value': 142.9484205467449, 'nu': 2.5}. Best is trial 616 with value: 0.1375127577189955.
[I 2024-12-04 20:16:11,537] Trial 830 finished with value: 0.14249505880160132 and parameters: {'kernel_type': 'Matern', 'length_scale': 0.13610286852413434, 'noise_level': 0.012714879589231471, 'constant_value': 1327.3197121184382, 'nu': 1.5}. Best is trial 616 with value: 0.1375127577189955.
[I 2024-12-04 20:16:15,440] Trial 834 finished with value: 0.1424951100271675 and parameters: {'kernel_type': 'Matern', 'length_scale': 11.591412053899008, 'noise_level': 0.011075592046962764, 'constant_value': 813.8323613479768, 'nu': 1.5}. Best is trial 616 with value: 0.1375127577189955.
[I 2024-12-04 20:16:17,715] Trial 833 finished with value: 0.9864686819219532 and parameters: {'kernel_type': 'RBF', 'length_scale': 0.11921500586809235, 'noise_level': 0.001296402484711756, 'constant_value': 6.361420826083593e-06, 'nu': 2.5}. Best is trial 616 with value: 0.1375127577189955.
[I 2024-12-04 20:16:22,748] Trial 835 finished with value: 0.14249506120840222 and parameters: {'kernel_type': 'Matern', 'length_scale': 1.3769590447956557, 'noise_level': 0.07142876980645653, 'constant_value': 8.62863965592984, 'nu': 1.5}. Best is trial 616 with value: 0.1375127577189955.
[I 2024-12-04 20:16:23,076] Trial 837 finished with value: 0.14249507443405693 and parameters: {'kernel_type': 'Matern', 'length_scale': 142.34961598001658, 'noise_level': 0.10675504552051562, 'constant_value': 257.1658133197133, 'nu': 1.5}. Best is trial 616 with value: 0.1375127577189955.
[I 2024-12-04 20:16:23,861] Trial 836 finished with value: 0.1424949611116865 and parameters: {'kernel_type': 'Matern', 'length_scale': 7.7776658345699765, 'noise_level': 0.051692186115743284, 'constant_value': 517.5146160422802, 'nu': 1.5}. Best is trial 616 with value: 0.1375127577189955.
[I 2024-12-04 20:16:28,141] Trial 839 finished with value: 0.9864686819191185 and parameters: {'kernel_type': 'Matern', 'length_scale': 0.003088214343925872, 'noise_level': 0.7326341334304737, 'constant_value': 69.03290045591648, 'nu': 1.5}. Best is trial 616 with value: 0.1375127577189955.
[I 2024-12-04 20:16:33,155] Trial 838 finished with value: 0.9864686818746945 and parameters: {'kernel_type': 'Matern', 'length_scale': 299.31205239409337, 'noise_level': 2.6797073214873918e-06, 'constant_value': 4.579370339949439e-05, 'nu': 1.5}. Best is trial 616 with value: 0.1375127577189955.
[I 2024-12-04 20:16:33,156] Trial 840 finished with value: 0.24172726637745828 and parameters: {'kernel_type': 'Matern', 'length_scale': 15448.870449206102, 'noise_level': 0.9577659089514963, 'constant_value': 0.11423950062774083, 'nu': 0.5}. Best is trial 616 with value: 0.1375127577189955.
[I 2024-12-04 20:16:34,328] Trial 841 finished with value: 0.1424950648815238 and parameters: {'kernel_type': 'Matern', 'length_scale': 442.74337617564333, 'noise_level': 0.08803526663431943, 'constant_value': 274.00496305073716, 'nu': 1.5}. Best is trial 616 with value: 0.1375127577189955.
[I 2024-12-04 20:16:46,811] Trial 844 finished with value: 0.998217106154935 and parameters: {'kernel_type': 'RBF', 'length_scale': 3742.4999617992853, 'noise_level': 0.20116432437466622, 'constant_value': 1.0293119260866968e-07, 'nu': 1.5}. Best is trial 616 with value: 0.1375127577189955.
[I 2024-12-04 20:16:47,433] Trial 843 finished with value: 0.9864686819219529 and parameters: {'kernel_type': 'Matern', 'length_scale': 0.01633431920570051, 'noise_level': 0.8491363594122376, 'constant_value': 8477.805351883699, 'nu': 1.5}. Best is trial 616 with value: 0.1375127577189955.
[I 2024-12-04 20:16:49,697] Trial 842 finished with value: 0.1424951357876802 and parameters: {'kernel_type': 'Matern', 'length_scale': 1.6566452906154137, 'noise_level': 0.0002934308960268749, 'constant_value': 3.983368221243795, 'nu': 1.5}. Best is trial 616 with value: 0.1375127577189955.
[I 2024-12-04 20:16:57,473] Trial 847 finished with value: 0.14249505623257105 and parameters: {'kernel_type': 'Matern', 'length_scale': 10.608847229279238, 'noise_level': 0.7784888599361345, 'constant_value': 362.68418194560854, 'nu': 1.5}. Best is trial 616 with value: 0.1375127577189955.
[I 2024-12-04 20:16:57,522] Trial 846 finished with value: 0.9864686819728902 and parameters: {'kernel_type': 'Matern', 'length_scale': 54.130841551587146, 'noise_level': 0.0037753232763013097, 'constant_value': 0.3835237749265873, 'nu': 2.5}. Best is trial 616 with value: 0.1375127577189955.
[I 2024-12-04 20:16:59,924] Trial 845 finished with value: 0.9864686819214503 and parameters: {'kernel_type': 'RBF', 'length_scale': 4.084444306152524e-05, 'noise_level': 3.368108471141998e-05, 'constant_value': 1.0626587781085426e-07, 'nu': 1.5}. Best is trial 616 with value: 0.1375127577189955.
[I 2024-12-04 20:17:03,917] Trial 848 finished with value: 0.1424936961629361 and parameters: {'kernel_type': 'Matern', 'length_scale': 13.076899929179243, 'noise_level': 0.004727325202529321, 'constant_value': 31.67674469202506, 'nu': 1.5}. Best is trial 616 with value: 0.1375127577189955.
[I 2024-12-04 20:17:05,208] Trial 849 finished with value: 0.14249506228865882 and parameters: {'kernel_type': 'Matern', 'length_scale': 0.4822001349851596, 'noise_level': 0.9954980683600293, 'constant_value': 7.329077235615368, 'nu': 1.5}. Best is trial 616 with value: 0.1375127577189955.
[I 2024-12-04 20:17:06,786] Trial 850 finished with value: 0.1424950068684996 and parameters: {'kernel_type': 'Matern', 'length_scale': 1405.0228029384782, 'noise_level': 0.7438963995296343, 'constant_value': 101.70475018792128, 'nu': 1.5}. Best is trial 616 with value: 0.1375127577189955.
[I 2024-12-04 20:17:07,630] Trial 851 finished with value: 0.9982167224205203 and parameters: {'kernel_type': 'Matern', 'length_scale': 0.2220787306462976, 'noise_level': 0.002449264785933102, 'constant_value': 4355.151616830535, 'nu': 2.5}. Best is trial 616 with value: 0.1375127577189955.
[I 2024-12-04 20:17:12,478] Trial 852 finished with value: 0.14249512192474867 and parameters: {'kernel_type': 'Matern', 'length_scale': 0.668535484589723, 'noise_level': 0.010780435231977671, 'constant_value': 595.7136239732816, 'nu': 1.5}. Best is trial 616 with value: 0.1375127577189955.
[I 2024-12-04 20:17:15,334] Trial 854 finished with value: 0.14249506048945942 and parameters: {'kernel_type': 'Matern', 'length_scale': 0.9001557772909294, 'noise_level': 0.060068921494311305, 'constant_value': 3761.941699700591, 'nu': 1.5}. Best is trial 616 with value: 0.1375127577189955.
[I 2024-12-04 20:17:16,330] Trial 853 finished with value: 0.1972000350004106 and parameters: {'kernel_type': 'Matern', 'length_scale': 22.665983263000104, 'noise_level': 0.0021258713328505766, 'constant_value': 0.24081545590905656, 'nu': 0.5}. Best is trial 616 with value: 0.1375127577189955.
[I 2024-12-04 20:17:18,280] Trial 855 finished with value: 0.9864686819043457 and parameters: {'kernel_type': 'RBF', 'length_scale': 158.28596661170909, 'noise_level': 1.0334417714474681e-07, 'constant_value': 61765.79374720447, 'nu': 1.5}. Best is trial 616 with value: 0.1375127577189955.
