[I 2024-12-04 20:28:16,638] Trial 2037 finished with value: 1.0857974014838092 and parameters: {'n_estimators': 217, 'max_depth': 41, 'min_samples_split': 10, 'min_samples_leaf': 2, 'max_features': 'log2', 'bootstrap': False, 'criterion': 'squared_error'}. Best is trial 1631 with value: 0.32128932742921457.
[I 2024-12-04 20:28:17,750] Trial 2005 finished with value: 0.5628603787165369 and parameters: {'n_estimators': 537, 'max_depth': 23, 'min_samples_split': 20, 'min_samples_leaf': 3, 'max_features': None, 'bootstrap': False, 'criterion': 'absolute_error'}. Best is trial 1631 with value: 0.32128932742921457.
[I 2024-12-04 20:28:18,292] Trial 2036 finished with value: 0.8686127321471471 and parameters: {'n_estimators': 148, 'max_depth': 46, 'min_samples_split': 2, 'min_samples_leaf': 2, 'max_features': 'sqrt', 'bootstrap': False, 'criterion': 'absolute_error'}. Best is trial 1631 with value: 0.32128932742921457.
[I 2024-12-04 20:28:18,732] Trial 2038 finished with value: 0.34641867766026413 and parameters: {'n_estimators': 314, 'max_depth': 42, 'min_samples_split': 2, 'min_samples_leaf': 1, 'max_features': 'sqrt', 'bootstrap': False, 'criterion': 'squared_error'}. Best is trial 1631 with value: 0.32128932742921457.
[I 2024-12-04 20:28:19,855] Trial 2040 finished with value: 0.41233261245957376 and parameters: {'n_estimators': 220, 'max_depth': 42, 'min_samples_split': 4, 'min_samples_leaf': 1, 'max_features': 'sqrt', 'bootstrap': False, 'criterion': 'squared_error'}. Best is trial 1631 with value: 0.32128932742921457.
[I 2024-12-04 20:28:20,027] Trial 2039 finished with value: 0.3580020581961849 and parameters: {'n_estimators': 353, 'max_depth': 50, 'min_samples_split': 3, 'min_samples_leaf': 1, 'max_features': 'sqrt', 'bootstrap': False, 'criterion': 'squared_error'}. Best is trial 1631 with value: 0.32128932742921457.
[I 2024-12-04 20:28:21,709] Trial 2041 finished with value: 0.4984195236877454 and parameters: {'n_estimators': 387, 'max_depth': 27, 'min_samples_split': 3, 'min_samples_leaf': 2, 'max_features': None, 'bootstrap': True, 'criterion': 'squared_error'}. Best is trial 1631 with value: 0.32128932742921457.
[I 2024-12-04 20:28:21,710] Trial 2043 finished with value: 0.6903714271582685 and parameters: {'n_estimators': 473, 'max_depth': 44, 'min_samples_split': 2, 'min_samples_leaf': 2, 'max_features': 'sqrt', 'bootstrap': False, 'criterion': 'squared_error'}. Best is trial 1631 with value: 0.32128932742921457.
[I 2024-12-04 20:28:23,136] Trial 2045 finished with value: 1.1275433061693925 and parameters: {'n_estimators': 136, 'max_depth': 43, 'min_samples_split': 2, 'min_samples_leaf': 2, 'max_features': 'log2', 'bootstrap': True, 'criterion': 'squared_error'}. Best is trial 1631 with value: 0.32128932742921457.
[I 2024-12-04 20:28:23,495] Trial 2044 finished with value: 0.6916946177748857 and parameters: {'n_estimators': 452, 'max_depth': 50, 'min_samples_split': 2, 'min_samples_leaf': 2, 'max_features': 'sqrt', 'bootstrap': False, 'criterion': 'squared_error'}. Best is trial 1631 with value: 0.32128932742921457.
[I 2024-12-04 20:28:24,005] Trial 2042 finished with value: 0.4344152439317405 and parameters: {'n_estimators': 311, 'max_depth': 48, 'min_samples_split': 2, 'min_samples_leaf': 1, 'max_features': None, 'bootstrap': False, 'criterion': 'squared_error'}. Best is trial 1631 with value: 0.32128932742921457.
[I 2024-12-04 20:28:25,527] Trial 2047 finished with value: 0.3840272610576967 and parameters: {'n_estimators': 293, 'max_depth': 50, 'min_samples_split': 4, 'min_samples_leaf': 1, 'max_features': 'sqrt', 'bootstrap': False, 'criterion': 'squared_error'}. Best is trial 1631 with value: 0.32128932742921457.
[I 2024-12-04 20:28:26,458] Trial 2046 finished with value: 0.3274145816318781 and parameters: {'n_estimators': 525, 'max_depth': 50, 'min_samples_split': 2, 'min_samples_leaf': 1, 'max_features': 'sqrt', 'bootstrap': False, 'criterion': 'squared_error'}. Best is trial 1631 with value: 0.32128932742921457.
[I 2024-12-04 20:28:26,524] Trial 2048 finished with value: 0.42232300784447246 and parameters: {'n_estimators': 605, 'max_depth': 40, 'min_samples_split': 4, 'min_samples_leaf': 1, 'max_features': 'sqrt', 'bootstrap': False, 'criterion': 'squared_error'}. Best is trial 1631 with value: 0.32128932742921457.
[I 2024-12-04 20:28:27,269] Trial 2049 finished with value: 0.34719205462447705 and parameters: {'n_estimators': 189, 'max_depth': 42, 'min_samples_split': 2, 'min_samples_leaf': 1, 'max_features': 'sqrt', 'bootstrap': False, 'criterion': 'squared_error'}. Best is trial 1631 with value: 0.32128932742921457.
[I 2024-12-04 20:28:27,969] Trial 2050 finished with value: 0.6932472999047198 and parameters: {'n_estimators': 115, 'max_depth': 30, 'min_samples_split': 2, 'min_samples_leaf': 2, 'max_features': 'sqrt', 'bootstrap': False, 'criterion': 'squared_error'}. Best is trial 1631 with value: 0.32128932742921457.
[I 2024-12-04 20:28:29,311] Trial 2051 finished with value: 0.37512147160092646 and parameters: {'n_estimators': 393, 'max_depth': 50, 'min_samples_split': 2, 'min_samples_leaf': 1, 'max_features': 'sqrt', 'bootstrap': True, 'criterion': 'squared_error'}. Best is trial 1631 with value: 0.32128932742921457.
[I 2024-12-04 20:28:29,859] Trial 2052 finished with value: 0.3454104218594828 and parameters: {'n_estimators': 349, 'max_depth': 42, 'min_samples_split': 2, 'min_samples_leaf': 1, 'max_features': 'sqrt', 'bootstrap': False, 'criterion': 'squared_error'}. Best is trial 1631 with value: 0.32128932742921457.
[I 2024-12-04 20:28:30,187] Trial 2053 finished with value: 0.32362107296092046 and parameters: {'n_estimators': 315, 'max_depth': 50, 'min_samples_split': 2, 'min_samples_leaf': 1, 'max_features': 'sqrt', 'bootstrap': False, 'criterion': 'squared_error'}. Best is trial 1631 with value: 0.32128932742921457.
[I 2024-12-04 20:28:30,550] Trial 2054 finished with value: 1.2050148264998402 and parameters: {'n_estimators': 186, 'max_depth': 6, 'min_samples_split': 2, 'min_samples_leaf': 14, 'max_features': 'sqrt', 'bootstrap': False, 'criterion': 'squared_error'}. Best is trial 1631 with value: 0.32128932742921457.
[I 2024-12-04 20:28:32,327] Trial 2055 finished with value: 0.32353349303693907 and parameters: {'n_estimators': 258, 'max_depth': 50, 'min_samples_split': 2, 'min_samples_leaf': 1, 'max_features': 'sqrt', 'bootstrap': False, 'criterion': 'squared_error'}. Best is trial 1631 with value: 0.32128932742921457.
[I 2024-12-04 20:28:32,917] Trial 2056 finished with value: 0.34859308285524765 and parameters: {'n_estimators': 390, 'max_depth': 41, 'min_samples_split': 2, 'min_samples_leaf': 1, 'max_features': 'sqrt', 'bootstrap': False, 'criterion': 'squared_error'}. Best is trial 1631 with value: 0.32128932742921457.
[I 2024-12-04 20:28:33,485] Trial 2057 finished with value: 0.3571311604078381 and parameters: {'n_estimators': 446, 'max_depth': 42, 'min_samples_split': 2, 'min_samples_leaf': 1, 'max_features': 'sqrt', 'bootstrap': False, 'criterion': 'squared_error'}. Best is trial 1631 with value: 0.32128932742921457.
[I 2024-12-04 20:28:34,753] Trial 2058 finished with value: 0.3251493599904596 and parameters: {'n_estimators': 283, 'max_depth': 50, 'min_samples_split': 2, 'min_samples_leaf': 1, 'max_features': 'sqrt', 'bootstrap': False, 'criterion': 'squared_error'}. Best is trial 1631 with value: 0.32128932742921457.
[I 2024-12-04 20:28:35,139] Trial 2059 finished with value: 0.40069374886432924 and parameters: {'n_estimators': 269, 'max_depth': 43, 'min_samples_split': 3, 'min_samples_leaf': 1, 'max_features': 'sqrt', 'bootstrap': False, 'criterion': 'squared_error'}. Best is trial 1631 with value: 0.32128932742921457.
[I 2024-12-04 20:28:36,798] Trial 2062 finished with value: 1.0638125895288206 and parameters: {'n_estimators': 369, 'max_depth': 15, 'min_samples_split': 35, 'min_samples_leaf': 1, 'max_features': 'log2', 'bootstrap': True, 'criterion': 'squared_error'}. Best is trial 1631 with value: 0.32128932742921457.
[I 2024-12-04 20:28:36,804] Trial 2060 finished with value: 1.2797748517910523 and parameters: {'n_estimators': 996, 'max_depth': 24, 'min_samples_split': 34, 'min_samples_leaf': 12, 'max_features': 'sqrt', 'bootstrap': False, 'criterion': 'absolute_error'}. Best is trial 1631 with value: 0.32128932742921457.
[I 2024-12-04 20:28:38,253] Trial 2064 finished with value: 1.0791221356405019 and parameters: {'n_estimators': 165, 'max_depth': 49, 'min_samples_split': 2, 'min_samples_leaf': 2, 'max_features': 'log2', 'bootstrap': False, 'criterion': 'squared_error'}. Best is trial 1631 with value: 0.32128932742921457.
[I 2024-12-04 20:28:38,345] Trial 2061 finished with value: 0.3274312800271848 and parameters: {'n_estimators': 517, 'max_depth': 50, 'min_samples_split': 2, 'min_samples_leaf': 1, 'max_features': 'sqrt', 'bootstrap': False, 'criterion': 'squared_error'}. Best is trial 1631 with value: 0.32128932742921457.
[I 2024-12-04 20:28:38,444] Trial 2063 finished with value: 1.0967042690216346 and parameters: {'n_estimators': 550, 'max_depth': 38, 'min_samples_split': 24, 'min_samples_leaf': 2, 'max_features': 'log2', 'bootstrap': False, 'criterion': 'squared_error'}. Best is trial 1631 with value: 0.32128932742921457.
[I 2024-12-04 20:28:40,139] Trial 2067 finished with value: 1.2227476419227705 and parameters: {'n_estimators': 260, 'max_depth': 36, 'min_samples_split': 2, 'min_samples_leaf': 12, 'max_features': 'sqrt', 'bootstrap': True, 'criterion': 'squared_error'}. Best is trial 1631 with value: 0.32128932742921457.
[I 2024-12-04 20:28:41,238] Trial 2065 finished with value: 0.3562353777673286 and parameters: {'n_estimators': 462, 'max_depth': 43, 'min_samples_split': 2, 'min_samples_leaf': 1, 'max_features': 'sqrt', 'bootstrap': False, 'criterion': 'squared_error'}. Best is trial 1631 with value: 0.32128932742921457.
[I 2024-12-04 20:28:42,809] Trial 2068 finished with value: 0.3289932939392038 and parameters: {'n_estimators': 478, 'max_depth': 50, 'min_samples_split': 2, 'min_samples_leaf': 1, 'max_features': 'sqrt', 'bootstrap': False, 'criterion': 'squared_error'}. Best is trial 1631 with value: 0.32128932742921457.
[I 2024-12-04 20:28:42,881] Trial 2069 finished with value: 0.4109677155701515 and parameters: {'n_estimators': 397, 'max_depth': 43, 'min_samples_split': 4, 'min_samples_leaf': 1, 'max_features': 'sqrt', 'bootstrap': False, 'criterion': 'squared_error'}. Best is trial 1631 with value: 0.32128932742921457.
[I 2024-12-04 20:28:46,278] Trial 2070 finished with value: 0.5373549708560572 and parameters: {'n_estimators': 427, 'max_depth': 50, 'min_samples_split': 3, 'min_samples_leaf': 2, 'max_features': None, 'bootstrap': False, 'criterion': 'squared_error'}. Best is trial 1631 with value: 0.32128932742921457.
[I 2024-12-04 20:28:46,280] Trial 2066 finished with value: 0.4639740398785507 and parameters: {'n_estimators': 409, 'max_depth': 48, 'min_samples_split': 2, 'min_samples_leaf': 1, 'max_features': 'sqrt', 'bootstrap': True, 'criterion': 'absolute_error'}. Best is trial 1631 with value: 0.32128932742921457.
[I 2024-12-04 20:28:46,982] Trial 2071 finished with value: 1.0932874939453021 and parameters: {'n_estimators': 439, 'max_depth': 11, 'min_samples_split': 11, 'min_samples_leaf': 2, 'max_features': 'sqrt', 'bootstrap': True, 'criterion': 'absolute_error'}. Best is trial 1631 with value: 0.32128932742921457.
[I 2024-12-04 20:28:48,150] Trial 2072 finished with value: 0.872890161163705 and parameters: {'n_estimators': 341, 'max_depth': 23, 'min_samples_split': 8, 'min_samples_leaf': 1, 'max_features': 'log2', 'bootstrap': False, 'criterion': 'squared_error'}. Best is trial 1631 with value: 0.32128932742921457.
[I 2024-12-04 20:28:48,341] Trial 2073 finished with value: 0.6775596097820695 and parameters: {'n_estimators': 387, 'max_depth': 50, 'min_samples_split': 2, 'min_samples_leaf': 2, 'max_features': 'sqrt', 'bootstrap': False, 'criterion': 'squared_error'}. Best is trial 1631 with value: 0.32128932742921457.
[I 2024-12-04 20:28:49,092] Trial 2074 finished with value: 0.32497643816954297 and parameters: {'n_estimators': 192, 'max_depth': 50, 'min_samples_split': 2, 'min_samples_leaf': 1, 'max_features': 'sqrt', 'bootstrap': False, 'criterion': 'squared_error'}. Best is trial 1631 with value: 0.32128932742921457.
[I 2024-12-04 20:28:50,167] Trial 2075 finished with value: 0.3853897484287797 and parameters: {'n_estimators': 346, 'max_depth': 50, 'min_samples_split': 4, 'min_samples_leaf': 1, 'max_features': 'sqrt', 'bootstrap': False, 'criterion': 'squared_error'}. Best is trial 1631 with value: 0.32128932742921457.
[I 2024-12-04 20:28:50,504] Trial 2076 finished with value: 0.35679358665076943 and parameters: {'n_estimators': 284, 'max_depth': 50, 'min_samples_split': 3, 'min_samples_leaf': 1, 'max_features': 'sqrt', 'bootstrap': False, 'criterion': 'squared_error'}. Best is trial 1631 with value: 0.32128932742921457.
[I 2024-12-04 20:28:51,594] Trial 2077 finished with value: 0.3236983380936183 and parameters: {'n_estimators': 355, 'max_depth': 50, 'min_samples_split': 2, 'min_samples_leaf': 1, 'max_features': 'sqrt', 'bootstrap': False, 'criterion': 'squared_error'}. Best is trial 1631 with value: 0.32128932742921457.
[I 2024-12-04 20:28:51,767] Trial 2078 finished with value: 0.3851630290482677 and parameters: {'n_estimators': 272, 'max_depth': 50, 'min_samples_split': 4, 'min_samples_leaf': 1, 'max_features': 'sqrt', 'bootstrap': False, 'criterion': 'squared_error'}. Best is trial 1631 with value: 0.32128932742921457.
[I 2024-12-04 20:28:55,200] Trial 2080 finished with value: 1.1428642797595483 and parameters: {'n_estimators': 511, 'max_depth': 22, 'min_samples_split': 46, 'min_samples_leaf': 5, 'max_features': 'sqrt', 'bootstrap': False, 'criterion': 'absolute_error'}. Best is trial 1631 with value: 0.32128932742921457.
[I 2024-12-04 20:28:55,207] Trial 2081 finished with value: 0.42669251156128757 and parameters: {'n_estimators': 357, 'max_depth': 49, 'min_samples_split': 4, 'min_samples_leaf': 1, 'max_features': None, 'bootstrap': False, 'criterion': 'squared_error'}. Best is trial 1631 with value: 0.32128932742921457.
[I 2024-12-04 20:28:56,544] Trial 2082 finished with value: 0.6628191449151924 and parameters: {'n_estimators': 205, 'max_depth': 43, 'min_samples_split': 2, 'min_samples_leaf': 2, 'max_features': 'sqrt', 'bootstrap': False, 'criterion': 'squared_error'}. Best is trial 1631 with value: 0.32128932742921457.
[I 2024-12-04 20:28:56,731] Trial 2083 finished with value: 0.37211391151735995 and parameters: {'n_estimators': 145, 'max_depth': 50, 'min_samples_split': 3, 'min_samples_leaf': 1, 'max_features': 'sqrt', 'bootstrap': False, 'criterion': 'squared_error'}. Best is trial 1631 with value: 0.32128932742921457.
[I 2024-12-04 20:28:58,651] Trial 2085 finished with value: 0.39187169150143614 and parameters: {'n_estimators': 447, 'max_depth': 50, 'min_samples_split': 4, 'min_samples_leaf': 1, 'max_features': 'sqrt', 'bootstrap': False, 'criterion': 'squared_error'}. Best is trial 1631 with value: 0.32128932742921457.
[I 2024-12-04 20:29:00,871] Trial 2086 finished with value: 0.3568725457670583 and parameters: {'n_estimators': 449, 'max_depth': 42, 'min_samples_split': 2, 'min_samples_leaf': 1, 'max_features': 'sqrt', 'bootstrap': False, 'criterion': 'squared_error'}. Best is trial 1631 with value: 0.32128932742921457.
[I 2024-12-04 20:29:02,489] Trial 2087 finished with value: 0.34548119656713966 and parameters: {'n_estimators': 265, 'max_depth': 43, 'min_samples_split': 2, 'min_samples_leaf': 1, 'max_features': 'sqrt', 'bootstrap': False, 'criterion': 'squared_error'}. Best is trial 1631 with value: 0.32128932742921457.
[I 2024-12-04 20:29:02,853] Trial 2084 finished with value: 0.5072966881062675 and parameters: {'n_estimators': 245, 'max_depth': 49, 'min_samples_split': 6, 'min_samples_leaf': 1, 'max_features': 'sqrt', 'bootstrap': False, 'criterion': 'absolute_error'}. Best is trial 1631 with value: 0.32128932742921457.
[I 2024-12-04 20:29:03,831] Trial 2088 finished with value: 0.6661041397473509 and parameters: {'n_estimators': 243, 'max_depth': 50, 'min_samples_split': 4, 'min_samples_leaf': 2, 'max_features': 'sqrt', 'bootstrap': False, 'criterion': 'squared_error'}. Best is trial 1631 with value: 0.32128932742921457.
[I 2024-12-04 20:29:04,202] Trial 2089 finished with value: 0.6670939160920799 and parameters: {'n_estimators': 285, 'max_depth': 43, 'min_samples_split': 2, 'min_samples_leaf': 2, 'max_features': 'sqrt', 'bootstrap': False, 'criterion': 'squared_error'}. Best is trial 1631 with value: 0.32128932742921457.
[I 2024-12-04 20:29:04,864] Trial 2079 finished with value: 0.5381642978122211 and parameters: {'n_estimators': 323, 'max_depth': 33, 'min_samples_split': 20, 'min_samples_leaf': 2, 'max_features': None, 'bootstrap': True, 'criterion': 'absolute_error'}. Best is trial 1631 with value: 0.32128932742921457.
[I 2024-12-04 20:29:06,257] Trial 2091 finished with value: 0.34530985420737287 and parameters: {'n_estimators': 253, 'max_depth': 43, 'min_samples_split': 2, 'min_samples_leaf': 1, 'max_features': 'sqrt', 'bootstrap': False, 'criterion': 'squared_error'}. Best is trial 1631 with value: 0.32128932742921457.
[I 2024-12-04 20:29:06,856] Trial 2090 finished with value: 0.3287109662804592 and parameters: {'n_estimators': 470, 'max_depth': 50, 'min_samples_split': 2, 'min_samples_leaf': 1, 'max_features': 'sqrt', 'bootstrap': False, 'criterion': 'squared_error'}. Best is trial 1631 with value: 0.32128932742921457.
[I 2024-12-04 20:29:07,094] Trial 2092 finished with value: 0.39429475241526685 and parameters: {'n_estimators': 396, 'max_depth': 42, 'min_samples_split': 3, 'min_samples_leaf': 1, 'max_features': 'sqrt', 'bootstrap': False, 'criterion': 'squared_error'}. Best is trial 1631 with value: 0.32128932742921457.
[I 2024-12-04 20:29:07,557] Trial 2093 finished with value: 0.6153595453140065 and parameters: {'n_estimators': 107, 'max_depth': 50, 'min_samples_split': 2, 'min_samples_leaf': 2, 'max_features': 'sqrt', 'bootstrap': False, 'criterion': 'squared_error'}. Best is trial 1631 with value: 0.32128932742921457.
[I 2024-12-04 20:29:09,106] Trial 2095 finished with value: 0.6599559257215646 and parameters: {'n_estimators': 282, 'max_depth': 50, 'min_samples_split': 2, 'min_samples_leaf': 2, 'max_features': 'sqrt', 'bootstrap': False, 'criterion': 'squared_error'}. Best is trial 1631 with value: 0.32128932742921457.
[I 2024-12-04 20:29:09,174] Trial 2094 finished with value: 1.1226817298331664 and parameters: {'n_estimators': 669, 'max_depth': 5, 'min_samples_split': 15, 'min_samples_leaf': 1, 'max_features': 'sqrt', 'bootstrap': True, 'criterion': 'squared_error'}. Best is trial 1631 with value: 0.32128932742921457.
[I 2024-12-04 20:29:10,746] Trial 2096 finished with value: 0.32373168005653113 and parameters: {'n_estimators': 335, 'max_depth': 50, 'min_samples_split': 2, 'min_samples_leaf': 1, 'max_features': 'sqrt', 'bootstrap': False, 'criterion': 'squared_error'}. Best is trial 1631 with value: 0.32128932742921457.
[I 2024-12-04 20:29:11,311] Trial 2097 finished with value: 0.35782283169873164 and parameters: {'n_estimators': 352, 'max_depth': 50, 'min_samples_split': 3, 'min_samples_leaf': 1, 'max_features': 'sqrt', 'bootstrap': False, 'criterion': 'squared_error'}. Best is trial 1631 with value: 0.32128932742921457.
[I 2024-12-04 20:29:12,102] Trial 2098 finished with value: 0.3235436005053898 and parameters: {'n_estimators': 420, 'max_depth': 50, 'min_samples_split': 2, 'min_samples_leaf': 1, 'max_features': 'sqrt', 'bootstrap': False, 'criterion': 'squared_error'}. Best is trial 1631 with value: 0.32128932742921457.
[I 2024-12-04 20:29:13,332] Trial 2101 finished with value: 0.666978373148942 and parameters: {'n_estimators': 349, 'max_depth': 50, 'min_samples_split': 2, 'min_samples_leaf': 2, 'max_features': 'sqrt', 'bootstrap': False, 'criterion': 'squared_error'}. Best is trial 1631 with value: 0.32128932742921457.
[I 2024-12-04 20:29:13,333] Trial 2100 finished with value: 0.32353349303693907 and parameters: {'n_estimators': 258, 'max_depth': 50, 'min_samples_split': 2, 'min_samples_leaf': 1, 'max_features': 'sqrt', 'bootstrap': False, 'criterion': 'squared_error'}. Best is trial 1631 with value: 0.32128932742921457.
[I 2024-12-04 20:29:15,600] Trial 2102 finished with value: 0.32269081148361717 and parameters: {'n_estimators': 339, 'max_depth': 50, 'min_samples_split': 2, 'min_samples_leaf': 1, 'max_features': 'sqrt', 'bootstrap': False, 'criterion': 'squared_error'}. Best is trial 1631 with value: 0.32128932742921457.
[I 2024-12-04 20:29:16,294] Trial 2103 finished with value: 1.2269610846653378 and parameters: {'n_estimators': 244, 'max_depth': 30, 'min_samples_split': 50, 'min_samples_leaf': 2, 'max_features': 'log2', 'bootstrap': False, 'criterion': 'absolute_error'}. Best is trial 1631 with value: 0.32128932742921457.
[I 2024-12-04 20:29:17,299] Trial 2104 finished with value: 0.6845257959343123 and parameters: {'n_estimators': 409, 'max_depth': 44, 'min_samples_split': 2, 'min_samples_leaf': 2, 'max_features': 'sqrt', 'bootstrap': False, 'criterion': 'squared_error'}. Best is trial 1631 with value: 0.32128932742921457.
[I 2024-12-04 20:29:18,265] Trial 2105 finished with value: 0.32366291304857087 and parameters: {'n_estimators': 245, 'max_depth': 50, 'min_samples_split': 2, 'min_samples_leaf': 1, 'max_features': 'sqrt', 'bootstrap': False, 'criterion': 'squared_error'}. Best is trial 1631 with value: 0.32128932742921457.
[I 2024-12-04 20:29:19,686] Trial 2107 finished with value: 1.2729395929779623 and parameters: {'n_estimators': 945, 'max_depth': 10, 'min_samples_split': 4, 'min_samples_leaf': 15, 'max_features': 'log2', 'bootstrap': False, 'criterion': 'squared_error'}. Best is trial 1631 with value: 0.32128932742921457.
