[I 2024-12-04 13:05:39,341] Trial 1401 finished with value: 0.24099729087730373 and parameters: {'n_estimators': 1331, 'learning_rate': 0.060858550500154575, 'max_depth': 9, 'min_samples_split': 2, 'min_samples_leaf': 1, 'subsample': 0.7980507897933534, 'max_features': 'sqrt'}. Best is trial 1389 with value: 0.22332552856343169.
[I 2024-12-04 13:05:41,606] Trial 1398 finished with value: 0.2581765919495655 and parameters: {'n_estimators': 1468, 'learning_rate': 0.0972548118072024, 'max_depth': 8, 'min_samples_split': 5, 'min_samples_leaf': 1, 'subsample': 0.727579101087709, 'max_features': 'sqrt'}. Best is trial 1389 with value: 0.22332552856343169.
[I 2024-12-04 13:05:47,181] Trial 1399 finished with value: 0.24839269279660248 and parameters: {'n_estimators': 1473, 'learning_rate': 0.044490671634939555, 'max_depth': 12, 'min_samples_split': 6, 'min_samples_leaf': 1, 'subsample': 0.6690769941393324, 'max_features': 'sqrt'}. Best is trial 1389 with value: 0.22332552856343169.
[I 2024-12-04 13:05:48,126] Trial 1413 finished with value: 0.4137817011132637 and parameters: {'n_estimators': 920, 'learning_rate': 0.08715438624121655, 'max_depth': 9, 'min_samples_split': 14, 'min_samples_leaf': 4, 'subsample': 0.9796361230004925, 'max_features': None}. Best is trial 1389 with value: 0.22332552856343169.
[I 2024-12-04 13:05:51,399] Trial 1418 finished with value: 0.41739789993178317 and parameters: {'n_estimators': 743, 'learning_rate': 0.041201979878551405, 'max_depth': 12, 'min_samples_split': 16, 'min_samples_leaf': 5, 'subsample': 0.6723143943522358, 'max_features': None}. Best is trial 1389 with value: 0.22332552856343169.
[I 2024-12-04 13:05:53,002] Trial 1403 finished with value: 0.25680060659689047 and parameters: {'n_estimators': 1476, 'learning_rate': 0.06183659831298575, 'max_depth': 8, 'min_samples_split': 2, 'min_samples_leaf': 1, 'subsample': 0.8343790982426895, 'max_features': 'sqrt'}. Best is trial 1389 with value: 0.22332552856343169.
[I 2024-12-04 13:05:54,536] Trial 1431 finished with value: 0.43818323249448166 and parameters: {'n_estimators': 347, 'learning_rate': 0.01813164371936098, 'max_depth': 7, 'min_samples_split': 3, 'min_samples_leaf': 6, 'subsample': 0.6749474431202342, 'max_features': None}. Best is trial 1389 with value: 0.22332552856343169.
[I 2024-12-04 13:05:56,929] Trial 1412 finished with value: 0.3540010173723799 and parameters: {'n_estimators': 1245, 'learning_rate': 0.05675542069905706, 'max_depth': 5, 'min_samples_split': 4, 'min_samples_leaf': 4, 'subsample': 0.8080422950729884, 'max_features': 'sqrt'}. Best is trial 1389 with value: 0.22332552856343169.
[I 2024-12-04 13:05:58,588] Trial 1409 finished with value: 0.3669852574579202 and parameters: {'n_estimators': 1303, 'learning_rate': 0.03868079961774667, 'max_depth': 12, 'min_samples_split': 5, 'min_samples_leaf': 4, 'subsample': 0.6523680179261564, 'max_features': 'sqrt'}. Best is trial 1389 with value: 0.22332552856343169.
[I 2024-12-04 13:06:04,327] Trial 1410 finished with value: 0.2565846016971355 and parameters: {'n_estimators': 1401, 'learning_rate': 0.0586124721282515, 'max_depth': 6, 'min_samples_split': 5, 'min_samples_leaf': 1, 'subsample': 0.9076611674103604, 'max_features': 'sqrt'}. Best is trial 1389 with value: 0.22332552856343169.
[I 2024-12-04 13:06:05,512] Trial 1408 finished with value: 0.27721463529779433 and parameters: {'n_estimators': 1487, 'learning_rate': 0.06591271643939434, 'max_depth': 8, 'min_samples_split': 2, 'min_samples_leaf': 2, 'subsample': 0.7981584542481331, 'max_features': 'sqrt'}. Best is trial 1389 with value: 0.22332552856343169.
[I 2024-12-04 13:06:10,635] Trial 1423 finished with value: 0.4926745734748055 and parameters: {'n_estimators': 892, 'learning_rate': 0.020456731288218958, 'max_depth': 3, 'min_samples_split': 7, 'min_samples_leaf': 4, 'subsample': 0.7127623786896374, 'max_features': 'sqrt'}. Best is trial 1389 with value: 0.22332552856343169.
[I 2024-12-04 13:06:12,178] Trial 1411 finished with value: 0.3452570273041389 and parameters: {'n_estimators': 1485, 'learning_rate': 0.056038881330736465, 'max_depth': 5, 'min_samples_split': 6, 'min_samples_leaf': 3, 'subsample': 0.8379082606583422, 'max_features': 'sqrt'}. Best is trial 1389 with value: 0.22332552856343169.
[I 2024-12-04 13:06:13,697] Trial 1427 finished with value: 0.46694947489057803 and parameters: {'n_estimators': 813, 'learning_rate': 0.08538516501400284, 'max_depth': 12, 'min_samples_split': 19, 'min_samples_leaf': 8, 'subsample': 0.6063284081986164, 'max_features': 'sqrt'}. Best is trial 1389 with value: 0.22332552856343169.
[I 2024-12-04 13:06:13,854] Trial 1424 finished with value: 0.33964728357816026 and parameters: {'n_estimators': 832, 'learning_rate': 0.08788605399411369, 'max_depth': 8, 'min_samples_split': 6, 'min_samples_leaf': 1, 'subsample': 0.8221378013885661, 'max_features': None}. Best is trial 1389 with value: 0.22332552856343169.
[I 2024-12-04 13:06:13,861] Trial 1420 finished with value: 0.24519918521526077 and parameters: {'n_estimators': 1079, 'learning_rate': 0.06700771679548491, 'max_depth': 12, 'min_samples_split': 3, 'min_samples_leaf': 1, 'subsample': 0.6633836100258987, 'max_features': 'sqrt'}. Best is trial 1389 with value: 0.22332552856343169.
[I 2024-12-04 13:06:24,198] Trial 1426 finished with value: 0.41484876642765944 and parameters: {'n_estimators': 916, 'learning_rate': 0.09280337472305825, 'max_depth': 8, 'min_samples_split': 2, 'min_samples_leaf': 4, 'subsample': 0.7727628541608635, 'max_features': None}. Best is trial 1389 with value: 0.22332552856343169.
[I 2024-12-04 13:06:26,603] Trial 1421 finished with value: 0.28947826753971573 and parameters: {'n_estimators': 1194, 'learning_rate': 0.06188358090263166, 'max_depth': 7, 'min_samples_split': 2, 'min_samples_leaf': 2, 'subsample': 0.7242439421335105, 'max_features': 'sqrt'}. Best is trial 1389 with value: 0.22332552856343169.
[I 2024-12-04 13:06:30,196] Trial 1417 finished with value: 0.3625973568048784 and parameters: {'n_estimators': 1477, 'learning_rate': 0.08833509215268685, 'max_depth': 12, 'min_samples_split': 7, 'min_samples_leaf': 3, 'subsample': 0.7277525389502346, 'max_features': 'sqrt'}. Best is trial 1389 with value: 0.22332552856343169.
[I 2024-12-04 13:06:33,181] Trial 1419 finished with value: 0.7089584257822045 and parameters: {'n_estimators': 1457, 'learning_rate': 0.01386822653937061, 'max_depth': 3, 'min_samples_split': 15, 'min_samples_leaf': 3, 'subsample': 0.8830520023339925, 'max_features': 'log2'}. Best is trial 1389 with value: 0.22332552856343169.
[I 2024-12-04 13:06:36,452] Trial 1432 finished with value: 0.26360576656056217 and parameters: {'n_estimators': 1027, 'learning_rate': 0.07550524551262518, 'max_depth': 7, 'min_samples_split': 4, 'min_samples_leaf': 1, 'subsample': 0.8923346096228661, 'max_features': 'sqrt'}. Best is trial 1389 with value: 0.22332552856343169.
[I 2024-12-04 13:06:38,358] Trial 1422 finished with value: 0.2384243894650262 and parameters: {'n_estimators': 1316, 'learning_rate': 0.05998591706902614, 'max_depth': 8, 'min_samples_split': 9, 'min_samples_leaf': 1, 'subsample': 0.9045052466395576, 'max_features': 'sqrt'}. Best is trial 1389 with value: 0.22332552856343169.
[I 2024-12-04 13:06:39,351] Trial 1428 finished with value: 0.2881724486967744 and parameters: {'n_estimators': 1210, 'learning_rate': 0.06278451383781364, 'max_depth': 7, 'min_samples_split': 7, 'min_samples_leaf': 2, 'subsample': 0.9974065870639783, 'max_features': 'sqrt'}. Best is trial 1389 with value: 0.22332552856343169.
[I 2024-12-04 13:06:45,504] Trial 1430 finished with value: 0.24019297254134042 and parameters: {'n_estimators': 1185, 'learning_rate': 0.09463341115306387, 'max_depth': 9, 'min_samples_split': 3, 'min_samples_leaf': 1, 'subsample': 0.7437767948533119, 'max_features': 'sqrt'}. Best is trial 1389 with value: 0.22332552856343169.
[I 2024-12-04 13:06:48,191] Trial 1442 finished with value: 1.0698574170178086 and parameters: {'n_estimators': 687, 'learning_rate': 0.01005617839898711, 'max_depth': 11, 'min_samples_split': 13, 'min_samples_leaf': 8, 'subsample': 0.7551437946246661, 'max_features': 'log2'}. Best is trial 1389 with value: 0.22332552856343169.
[I 2024-12-04 13:06:53,167] Trial 1435 finished with value: 0.38420012656116065 and parameters: {'n_estimators': 1096, 'learning_rate': 0.0702609689224434, 'max_depth': 5, 'min_samples_split': 9, 'min_samples_leaf': 3, 'subsample': 0.6577989913373232, 'max_features': 'log2'}. Best is trial 1389 with value: 0.22332552856343169.
[I 2024-12-04 13:06:55,861] Trial 1434 finished with value: 0.5716545149420769 and parameters: {'n_estimators': 1170, 'learning_rate': 0.01480759870449639, 'max_depth': 7, 'min_samples_split': 19, 'min_samples_leaf': 10, 'subsample': 0.800712922290716, 'max_features': 'sqrt'}. Best is trial 1389 with value: 0.22332552856343169.
[I 2024-12-04 13:06:58,861] Trial 1425 finished with value: 0.24759165459906615 and parameters: {'n_estimators': 1486, 'learning_rate': 0.05964121525654405, 'max_depth': 7, 'min_samples_split': 5, 'min_samples_leaf': 1, 'subsample': 0.8311419202618012, 'max_features': 'sqrt'}. Best is trial 1389 with value: 0.22332552856343169.
[I 2024-12-04 13:07:06,730] Trial 1429 finished with value: 0.30221069528297856 and parameters: {'n_estimators': 1416, 'learning_rate': 0.0847319643051634, 'max_depth': 7, 'min_samples_split': 10, 'min_samples_leaf': 1, 'subsample': 0.7629155708873961, 'max_features': None}. Best is trial 1389 with value: 0.22332552856343169.
[I 2024-12-04 13:07:07,825] Trial 1438 finished with value: 0.31315809970538544 and parameters: {'n_estimators': 1144, 'learning_rate': 0.05273151914630274, 'max_depth': 11, 'min_samples_split': 5, 'min_samples_leaf': 2, 'subsample': 0.6025853139465343, 'max_features': 'sqrt'}. Best is trial 1389 with value: 0.22332552856343169.
[I 2024-12-04 13:07:15,430] Trial 1433 finished with value: 0.3026743332157784 and parameters: {'n_estimators': 1495, 'learning_rate': 0.06326704913872568, 'max_depth': 3, 'min_samples_split': 3, 'min_samples_leaf': 2, 'subsample': 0.7928529444103714, 'max_features': 'sqrt'}. Best is trial 1389 with value: 0.22332552856343169.
[I 2024-12-04 13:07:16,524] Trial 1446 finished with value: 0.3585095117578687 and parameters: {'n_estimators': 987, 'learning_rate': 0.06974408255559886, 'max_depth': 7, 'min_samples_split': 2, 'min_samples_leaf': 4, 'subsample': 0.8311885017559746, 'max_features': 'sqrt'}. Best is trial 1389 with value: 0.22332552856343169.
[I 2024-12-04 13:07:22,509] Trial 1468 finished with value: 0.46479783339277525 and parameters: {'n_estimators': 131, 'learning_rate': 0.020385628632375138, 'max_depth': 9, 'min_samples_split': 20, 'min_samples_leaf': 6, 'subsample': 0.8013405168326955, 'max_features': None}. Best is trial 1389 with value: 0.22332552856343169.
[I 2024-12-04 13:07:23,844] Trial 1462 finished with value: 0.6634478815269519 and parameters: {'n_estimators': 499, 'learning_rate': 0.023312436872084275, 'max_depth': 10, 'min_samples_split': 16, 'min_samples_leaf': 3, 'subsample': 0.7952587615154657, 'max_features': 'log2'}. Best is trial 1389 with value: 0.22332552856343169.
[I 2024-12-04 13:07:27,517] Trial 1436 finished with value: 0.26957923293794955 and parameters: {'n_estimators': 1466, 'learning_rate': 0.04475837428190802, 'max_depth': 5, 'min_samples_split': 5, 'min_samples_leaf': 1, 'subsample': 0.7703650869580299, 'max_features': 'sqrt'}. Best is trial 1389 with value: 0.22332552856343169.
[I 2024-12-04 13:07:27,537] Trial 1437 finished with value: 0.494974700492878 and parameters: {'n_estimators': 1342, 'learning_rate': 0.011604586371047023, 'max_depth': 8, 'min_samples_split': 6, 'min_samples_leaf': 10, 'subsample': 0.9638765950550758, 'max_features': None}. Best is trial 1389 with value: 0.22332552856343169.
[I 2024-12-04 13:07:27,562] Trial 1445 finished with value: 0.3589383096819356 and parameters: {'n_estimators': 1173, 'learning_rate': 0.0872378483559463, 'max_depth': 7, 'min_samples_split': 2, 'min_samples_leaf': 3, 'subsample': 0.7050648293744378, 'max_features': 'sqrt'}. Best is trial 1389 with value: 0.22332552856343169.
[I 2024-12-04 13:07:31,702] Trial 1457 finished with value: 0.4156761244511632 and parameters: {'n_estimators': 759, 'learning_rate': 0.014224011907877712, 'max_depth': 3, 'min_samples_split': 7, 'min_samples_leaf': 4, 'subsample': 0.640747967482434, 'max_features': None}. Best is trial 1389 with value: 0.22332552856343169.
[I 2024-12-04 13:07:35,624] Trial 1439 finished with value: 0.29166306896741856 and parameters: {'n_estimators': 1500, 'learning_rate': 0.04706030158476351, 'max_depth': 5, 'min_samples_split': 3, 'min_samples_leaf': 2, 'subsample': 0.658073008605649, 'max_features': 'sqrt'}. Best is trial 1389 with value: 0.22332552856343169.
[I 2024-12-04 13:07:36,791] Trial 1440 finished with value: 0.27075282185940375 and parameters: {'n_estimators': 1490, 'learning_rate': 0.07973620890955915, 'max_depth': 5, 'min_samples_split': 5, 'min_samples_leaf': 2, 'subsample': 0.7732998309686702, 'max_features': 'sqrt'}. Best is trial 1389 with value: 0.22332552856343169.
[I 2024-12-04 13:07:39,442] Trial 1441 finished with value: 0.28365217579503854 and parameters: {'n_estimators': 1461, 'learning_rate': 0.08207654018113186, 'max_depth': 5, 'min_samples_split': 4, 'min_samples_leaf': 2, 'subsample': 0.7546111746304183, 'max_features': 'sqrt'}. Best is trial 1389 with value: 0.22332552856343169.
[I 2024-12-04 13:07:41,551] Trial 1448 finished with value: 0.2624899321214721 and parameters: {'n_estimators': 1249, 'learning_rate': 0.09946249141407273, 'max_depth': 7, 'min_samples_split': 7, 'min_samples_leaf': 1, 'subsample': 0.6750493704659155, 'max_features': 'sqrt'}. Best is trial 1389 with value: 0.22332552856343169.
[I 2024-12-04 13:07:44,601] Trial 1466 finished with value: 0.9789309075928349 and parameters: {'n_estimators': 593, 'learning_rate': 0.031099693392579893, 'max_depth': 6, 'min_samples_split': 12, 'min_samples_leaf': 10, 'subsample': 0.63196622807531, 'max_features': 'log2'}. Best is trial 1389 with value: 0.22332552856343169.
[I 2024-12-04 13:07:45,040] Trial 1454 finished with value: 0.23669964921162717 and parameters: {'n_estimators': 1100, 'learning_rate': 0.09418843325928186, 'max_depth': 7, 'min_samples_split': 4, 'min_samples_leaf': 1, 'subsample': 0.70137108226291, 'max_features': 'sqrt'}. Best is trial 1389 with value: 0.22332552856343169.
[I 2024-12-04 13:07:45,627] Trial 1444 finished with value: 0.3585960262671316 and parameters: {'n_estimators': 1427, 'learning_rate': 0.08072909546999302, 'max_depth': 6, 'min_samples_split': 2, 'min_samples_leaf': 3, 'subsample': 0.7190872668635272, 'max_features': 'sqrt'}. Best is trial 1389 with value: 0.22332552856343169.
[I 2024-12-04 13:07:46,766] Trial 1443 finished with value: 0.28616247120482224 and parameters: {'n_estimators': 1468, 'learning_rate': 0.06905021397949326, 'max_depth': 6, 'min_samples_split': 2, 'min_samples_leaf': 2, 'subsample': 0.7826633661101922, 'max_features': 'sqrt'}. Best is trial 1389 with value: 0.22332552856343169.
[I 2024-12-04 13:07:47,182] Trial 1452 finished with value: 0.2509482383735406 and parameters: {'n_estimators': 1186, 'learning_rate': 0.03944473089665343, 'max_depth': 6, 'min_samples_split': 2, 'min_samples_leaf': 1, 'subsample': 0.7941374743954588, 'max_features': 'sqrt'}. Best is trial 1389 with value: 0.22332552856343169.
[I 2024-12-04 13:07:47,193] Trial 1451 finished with value: 0.3651410200163482 and parameters: {'n_estimators': 1175, 'learning_rate': 0.06237072420558411, 'max_depth': 7, 'min_samples_split': 7, 'min_samples_leaf': 3, 'subsample': 0.758981326314524, 'max_features': 'sqrt'}. Best is trial 1389 with value: 0.22332552856343169.
[I 2024-12-04 13:07:51,303] Trial 1449 finished with value: 0.2485061047523887 and parameters: {'n_estimators': 1390, 'learning_rate': 0.06681117279671309, 'max_depth': 7, 'min_samples_split': 5, 'min_samples_leaf': 1, 'subsample': 0.7538694318013879, 'max_features': 'sqrt'}. Best is trial 1389 with value: 0.22332552856343169.
[I 2024-12-04 13:07:57,172] Trial 1447 finished with value: 0.27967009062844056 and parameters: {'n_estimators': 1489, 'learning_rate': 0.07297891964227902, 'max_depth': 6, 'min_samples_split': 3, 'min_samples_leaf': 2, 'subsample': 0.7874923865340947, 'max_features': 'sqrt'}. Best is trial 1389 with value: 0.22332552856343169.
[I 2024-12-04 13:08:01,577] Trial 1458 finished with value: 0.27851198411236494 and parameters: {'n_estimators': 1155, 'learning_rate': 0.06305532656633954, 'max_depth': 6, 'min_samples_split': 6, 'min_samples_leaf': 1, 'subsample': 0.7871237870093144, 'max_features': 'sqrt'}. Best is trial 1389 with value: 0.22332552856343169.
[I 2024-12-04 13:08:04,407] Trial 1480 finished with value: 1.2251185269600486 and parameters: {'n_estimators': 168, 'learning_rate': 0.012687008256606779, 'max_depth': 6, 'min_samples_split': 20, 'min_samples_leaf': 6, 'subsample': 0.8547774492188973, 'max_features': 'log2'}. Best is trial 1389 with value: 0.22332552856343169.
[I 2024-12-04 13:08:05,019] Trial 1464 finished with value: 0.4223625823827125 and parameters: {'n_estimators': 929, 'learning_rate': 0.020110001157950048, 'max_depth': 3, 'min_samples_split': 3, 'min_samples_leaf': 6, 'subsample': 0.9274112866237034, 'max_features': None}. Best is trial 1389 with value: 0.22332552856343169.
[I 2024-12-04 13:08:05,050] Trial 1453 finished with value: 0.2839849741828232 and parameters: {'n_estimators': 1408, 'learning_rate': 0.06345344439283124, 'max_depth': 12, 'min_samples_split': 7, 'min_samples_leaf': 2, 'subsample': 0.6180318956786154, 'max_features': 'sqrt'}. Best is trial 1389 with value: 0.22332552856343169.
[I 2024-12-04 13:08:05,242] Trial 1450 finished with value: 0.24930957606858356 and parameters: {'n_estimators': 1448, 'learning_rate': 0.06582804381201897, 'max_depth': 6, 'min_samples_split': 2, 'min_samples_leaf': 1, 'subsample': 0.7289471026916027, 'max_features': 'sqrt'}. Best is trial 1389 with value: 0.22332552856343169.
[I 2024-12-04 13:08:06,208] Trial 1476 finished with value: 0.48275168268127805 and parameters: {'n_estimators': 242, 'learning_rate': 0.07998099390817943, 'max_depth': 11, 'min_samples_split': 18, 'min_samples_leaf': 9, 'subsample': 0.6024670858730129, 'max_features': None}. Best is trial 1389 with value: 0.22332552856343169.
[I 2024-12-04 13:08:06,296] Trial 1473 finished with value: 0.3638956927577137 and parameters: {'n_estimators': 489, 'learning_rate': 0.03545996896082158, 'max_depth': 12, 'min_samples_split': 16, 'min_samples_leaf': 1, 'subsample': 0.6229081175354066, 'max_features': 'log2'}. Best is trial 1389 with value: 0.22332552856343169.
[I 2024-12-04 13:08:06,701] Trial 1463 finished with value: 0.7415917759293874 and parameters: {'n_estimators': 1102, 'learning_rate': 0.012336136315687822, 'max_depth': 4, 'min_samples_split': 3, 'min_samples_leaf': 2, 'subsample': 0.8202986602262902, 'max_features': 'log2'}. Best is trial 1389 with value: 0.22332552856343169.
[I 2024-12-04 13:08:06,718] Trial 1456 finished with value: 0.2766686075778689 and parameters: {'n_estimators': 1371, 'learning_rate': 0.09707328364174282, 'max_depth': 7, 'min_samples_split': 2, 'min_samples_leaf': 2, 'subsample': 0.7686195344425971, 'max_features': 'sqrt'}. Best is trial 1389 with value: 0.22332552856343169.
[I 2024-12-04 13:08:10,614] Trial 1455 finished with value: 0.23780893341342416 and parameters: {'n_estimators': 1481, 'learning_rate': 0.09491089355548982, 'max_depth': 7, 'min_samples_split': 2, 'min_samples_leaf': 1, 'subsample': 0.734093350540742, 'max_features': 'sqrt'}. Best is trial 1389 with value: 0.22332552856343169.
[I 2024-12-04 13:08:11,069] Trial 1459 finished with value: 0.240452700987543 and parameters: {'n_estimators': 1324, 'learning_rate': 0.06981163538908364, 'max_depth': 12, 'min_samples_split': 4, 'min_samples_leaf': 1, 'subsample': 0.6427105309352823, 'max_features': 'sqrt'}. Best is trial 1389 with value: 0.22332552856343169.
[I 2024-12-04 13:08:11,702] Trial 1460 finished with value: 0.24128167153747573 and parameters: {'n_estimators': 1276, 'learning_rate': 0.09225260881358446, 'max_depth': 6, 'min_samples_split': 2, 'min_samples_leaf': 1, 'subsample': 0.703687641435267, 'max_features': 'sqrt'}. Best is trial 1389 with value: 0.22332552856343169.
[I 2024-12-04 13:08:18,065] Trial 1461 finished with value: 0.5110801813928245 and parameters: {'n_estimators': 1457, 'learning_rate': 0.03360220611628377, 'max_depth': 8, 'min_samples_split': 18, 'min_samples_leaf': 5, 'subsample': 0.7452636804415267, 'max_features': 'log2'}. Best is trial 1389 with value: 0.22332552856343169.
[I 2024-12-04 13:08:24,432] Trial 1483 finished with value: 0.3310427664390174 and parameters: {'n_estimators': 329, 'learning_rate': 0.09834692194285916, 'max_depth': 9, 'min_samples_split': 2, 'min_samples_leaf': 1, 'subsample': 0.9144695680023854, 'max_features': 'log2'}. Best is trial 1389 with value: 0.22332552856343169.
[I 2024-12-04 13:08:30,084] Trial 1469 finished with value: 0.2509755228642912 and parameters: {'n_estimators': 1154, 'learning_rate': 0.06473361520205993, 'max_depth': 5, 'min_samples_split': 2, 'min_samples_leaf': 1, 'subsample': 0.8125525639702624, 'max_features': 'sqrt'}. Best is trial 1389 with value: 0.22332552856343169.
[I 2024-12-04 13:08:30,536] Trial 1472 finished with value: 0.24759570118612306 and parameters: {'n_estimators': 1003, 'learning_rate': 0.07877436095553156, 'max_depth': 8, 'min_samples_split': 6, 'min_samples_leaf': 1, 'subsample': 0.9645525135892076, 'max_features': 'sqrt'}. Best is trial 1389 with value: 0.22332552856343169.
