[I 2024-12-04 15:31:22,436] Trial 2151 finished with value: 0.1343543584675051 and parameters: {'kernel_type': 'Matern', 'length_scale': 6.855807055533962, 'noise_level': 0.11929412016290941, 'constant_value': 97102.66335088451, 'nu': 1.5}. Best is trial 1985 with value: 0.134351948015208.
[I 2024-12-04 15:31:23,072] Trial 2155 finished with value: 0.13435428949945288 and parameters: {'kernel_type': 'Matern', 'length_scale': 773.8147763431762, 'noise_level': 0.005017723020637526, 'constant_value': 93541.90524693871, 'nu': 1.5}. Best is trial 1985 with value: 0.134351948015208.
[I 2024-12-04 15:31:26,229] Trial 2161 finished with value: 0.1343544015792722 and parameters: {'kernel_type': 'Matern', 'length_scale': 1.5981731395894196, 'noise_level': 3.7975944605457955e-05, 'constant_value': 768.4234096090845, 'nu': 1.5}. Best is trial 1985 with value: 0.134351948015208.
[I 2024-12-04 15:31:28,240] Trial 2153 finished with value: 0.13435439853284487 and parameters: {'kernel_type': 'Matern', 'length_scale': 1.127220027628599, 'noise_level': 4.7947552497905784e-05, 'constant_value': 830.1720064913027, 'nu': 1.5}. Best is trial 1985 with value: 0.134351948015208.
[I 2024-12-04 15:31:30,029] Trial 2145 finished with value: 0.17251039965078607 and parameters: {'kernel_type': 'Matern', 'length_scale': 6120.4232751700765, 'noise_level': 0.25354493580850956, 'constant_value': 0.044280971392544, 'nu': 0.5}. Best is trial 1985 with value: 0.134351948015208.
[I 2024-12-04 15:31:32,677] Trial 2154 finished with value: 0.13435440530086754 and parameters: {'kernel_type': 'Matern', 'length_scale': 14.972557606096126, 'noise_level': 0.012238630398273826, 'constant_value': 3223.1895614686246, 'nu': 1.5}. Best is trial 1985 with value: 0.134351948015208.
[I 2024-12-04 15:31:33,204] Trial 2140 finished with value: 0.13435440254932995 and parameters: {'kernel_type': 'Matern', 'length_scale': 0.3329742483258659, 'noise_level': 0.001243384978384116, 'constant_value': 1309.9229779528996, 'nu': 1.5}. Best is trial 1985 with value: 0.134351948015208.
[I 2024-12-04 15:31:33,206] Trial 2158 finished with value: 1.2693635028560228 and parameters: {'kernel_type': 'Matern', 'length_scale': 153.22268841432657, 'noise_level': 2.7656906730675205e-08, 'constant_value': 3.123687127833889e-07, 'nu': 2.5}. Best is trial 1985 with value: 0.134351948015208.
[I 2024-12-04 15:31:33,226] Trial 2160 finished with value: 1.269363502857025 and parameters: {'kernel_type': 'RBF', 'length_scale': 1.0906056481035466e-05, 'noise_level': 2.517897956074303e-05, 'constant_value': 0.17226484085563684, 'nu': 0.5}. Best is trial 1985 with value: 0.134351948015208.
[I 2024-12-04 15:31:34,053] Trial 2168 finished with value: 0.13435437459692473 and parameters: {'kernel_type': 'Matern', 'length_scale': 37.465050318745895, 'noise_level': 0.014526869823182548, 'constant_value': 1194.571813385231, 'nu': 1.5}. Best is trial 1985 with value: 0.134351948015208.
[I 2024-12-04 15:31:34,108] Trial 2156 finished with value: 0.13435443726749155 and parameters: {'kernel_type': 'Matern', 'length_scale': 4.130934464157656, 'noise_level': 0.03860545181333672, 'constant_value': 90682.75095699218, 'nu': 1.5}. Best is trial 1985 with value: 0.134351948015208.
[I 2024-12-04 15:31:34,923] Trial 2165 finished with value: 0.13435411168624414 and parameters: {'kernel_type': 'Matern', 'length_scale': 1.3773968639550989, 'noise_level': 0.12029141690947863, 'constant_value': 568.9236373745601, 'nu': 1.5}. Best is trial 1985 with value: 0.134351948015208.
[I 2024-12-04 15:31:35,587] Trial 2164 finished with value: 1.2693635028550767 and parameters: {'kernel_type': 'Matern', 'length_scale': 80650.11762224654, 'noise_level': 0.0004961214394810275, 'constant_value': 65196.24514006299, 'nu': 2.5}. Best is trial 1985 with value: 0.134351948015208.
[I 2024-12-04 15:31:36,567] Trial 2163 finished with value: 0.13435440025651116 and parameters: {'kernel_type': 'Matern', 'length_scale': 2.9878600278630207, 'noise_level': 0.034663234137397095, 'constant_value': 97825.86641684159, 'nu': 1.5}. Best is trial 1985 with value: 0.134351948015208.
[I 2024-12-04 15:31:39,429] Trial 2171 finished with value: 0.134354604173001 and parameters: {'kernel_type': 'Matern', 'length_scale': 17.907710982315827, 'noise_level': 0.03927876896009407, 'constant_value': 873.3216721866444, 'nu': 1.5}. Best is trial 1985 with value: 0.134351948015208.
[I 2024-12-04 15:31:39,502] Trial 2170 finished with value: 0.13435448578103976 and parameters: {'kernel_type': 'Matern', 'length_scale': 194.6738197995018, 'noise_level': 5.08424881859109e-05, 'constant_value': 85464.0225663483, 'nu': 1.5}. Best is trial 1985 with value: 0.134351948015208.
[I 2024-12-04 15:31:40,694] Trial 2167 finished with value: 1.2693635028569803 and parameters: {'kernel_type': 'RBF', 'length_scale': 75848.06671887508, 'noise_level': 7.865521533476739e-08, 'constant_value': 1.5938195066007586e-07, 'nu': 2.5}. Best is trial 1985 with value: 0.134351948015208.
[I 2024-12-04 15:31:41,137] Trial 2177 finished with value: 0.13435433156810628 and parameters: {'kernel_type': 'Matern', 'length_scale': 554.3791393621867, 'noise_level': 0.0013308951045653853, 'constant_value': 3429.4182102300347, 'nu': 1.5}. Best is trial 1985 with value: 0.134351948015208.
[I 2024-12-04 15:31:42,423] Trial 2159 finished with value: 0.1343543983950416 and parameters: {'kernel_type': 'Matern', 'length_scale': 1.0631936095255476, 'noise_level': 0.9480765867017767, 'constant_value': 61155.201241245784, 'nu': 1.5}. Best is trial 1985 with value: 0.134351948015208.
[I 2024-12-04 15:31:42,749] Trial 2166 finished with value: 1.2693635028570391 and parameters: {'kernel_type': 'RBF', 'length_scale': 80781.18231172596, 'noise_level': 1.5961900343582576e-10, 'constant_value': 8.137730029749346e-06, 'nu': 1.5}. Best is trial 1985 with value: 0.134351948015208.
[I 2024-12-04 15:31:42,861] Trial 2172 finished with value: 0.13435439562570353 and parameters: {'kernel_type': 'Matern', 'length_scale': 0.6614435094912346, 'noise_level': 0.0015529397090930477, 'constant_value': 29.020618272146315, 'nu': 1.5}. Best is trial 1985 with value: 0.134351948015208.
[I 2024-12-04 15:31:43,141] Trial 2176 finished with value: 0.13435439880529285 and parameters: {'kernel_type': 'Matern', 'length_scale': 12.699909152825116, 'noise_level': 0.007864426785698313, 'constant_value': 2101.5688487492544, 'nu': 1.5}. Best is trial 1985 with value: 0.134351948015208.
[I 2024-12-04 15:31:43,350] Trial 2173 finished with value: 0.17251040132518178 and parameters: {'kernel_type': 'Matern', 'length_scale': 0.23352950869890246, 'noise_level': 3.760130955515484e-10, 'constant_value': 0.00013624197426659703, 'nu': 0.5}. Best is trial 1985 with value: 0.134351948015208.
[I 2024-12-04 15:31:43,422] Trial 2162 finished with value: 0.1343544063535186 and parameters: {'kernel_type': 'Matern', 'length_scale': 4.270384706381565, 'noise_level': 0.879991826944176, 'constant_value': 428.03646016375393, 'nu': 1.5}. Best is trial 1985 with value: 0.134351948015208.
[I 2024-12-04 15:31:45,849] Trial 2169 finished with value: 0.13435440002982976 and parameters: {'kernel_type': 'Matern', 'length_scale': 148.7723128252373, 'noise_level': 0.013963231900799867, 'constant_value': 1063.510623994428, 'nu': 1.5}. Best is trial 1985 with value: 0.134351948015208.
[I 2024-12-04 15:31:46,598] Trial 2183 finished with value: 1.2693635028570394 and parameters: {'kernel_type': 'Matern', 'length_scale': 0.033996565421133496, 'noise_level': 0.002550989186746766, 'constant_value': 986.4727807500475, 'nu': 1.5}. Best is trial 1985 with value: 0.134351948015208.
[I 2024-12-04 15:31:47,351] Trial 2175 finished with value: 0.13435439932437868 and parameters: {'kernel_type': 'Matern', 'length_scale': 9.297590349220462, 'noise_level': 0.0005669911685796805, 'constant_value': 494.81892725297604, 'nu': 1.5}. Best is trial 1985 with value: 0.134351948015208.
[I 2024-12-04 15:31:47,445] Trial 2182 finished with value: 0.13435440747194408 and parameters: {'kernel_type': 'Matern', 'length_scale': 76.75862292643832, 'noise_level': 0.0366071474554652, 'constant_value': 2583.9080885018957, 'nu': 1.5}. Best is trial 1985 with value: 0.134351948015208.
[I 2024-12-04 15:31:47,497] Trial 2179 finished with value: 0.17251041393540023 and parameters: {'kernel_type': 'Matern', 'length_scale': 6066.390092037476, 'noise_level': 0.0013572205893395111, 'constant_value': 520.4147926446936, 'nu': 0.5}. Best is trial 1985 with value: 0.134351948015208.
[I 2024-12-04 15:31:52,062] Trial 2174 finished with value: 0.1343544005877623 and parameters: {'kernel_type': 'Matern', 'length_scale': 122.0262611161232, 'noise_level': 0.036494446683250276, 'constant_value': 2127.978560842543, 'nu': 1.5}. Best is trial 1985 with value: 0.134351948015208.
[I 2024-12-04 15:31:52,069] Trial 2181 finished with value: 0.17251040265431453 and parameters: {'kernel_type': 'Matern', 'length_scale': 0.2913404955472657, 'noise_level': 0.0005928189102610789, 'constant_value': 47676.238203798486, 'nu': 0.5}. Best is trial 1985 with value: 0.134351948015208.
[I 2024-12-04 15:31:52,842] Trial 2185 finished with value: 0.1343544007717639 and parameters: {'kernel_type': 'Matern', 'length_scale': 0.6053246561579494, 'noise_level': 0.015960223297820972, 'constant_value': 23.500557385314224, 'nu': 1.5}. Best is trial 1985 with value: 0.134351948015208.
[I 2024-12-04 15:31:53,431] Trial 2178 finished with value: 0.13435435027978695 and parameters: {'kernel_type': 'Matern', 'length_scale': 0.12420582005227881, 'noise_level': 0.023528876039982268, 'constant_value': 1901.6541779885083, 'nu': 1.5}. Best is trial 1985 with value: 0.134351948015208.
[I 2024-12-04 15:31:53,914] Trial 2180 finished with value: 0.1343544042345255 and parameters: {'kernel_type': 'Matern', 'length_scale': 2.859063899242707, 'noise_level': 0.13550525979686429, 'constant_value': 944.9453326679708, 'nu': 1.5}. Best is trial 1985 with value: 0.134351948015208.
[I 2024-12-04 15:31:53,922] Trial 2186 finished with value: 1.300773923593882 and parameters: {'kernel_type': 'Matern', 'length_scale': 4.631566012522679e-05, 'noise_level': 2.3475968851110094e-09, 'constant_value': 251.9529041280154, 'nu': 2.5}. Best is trial 1985 with value: 0.134351948015208.
[I 2024-12-04 15:31:55,519] Trial 2184 finished with value: 1.269363502857856 and parameters: {'kernel_type': 'RBF', 'length_scale': 27.93384659011017, 'noise_level': 6.694894036399658e-10, 'constant_value': 6795.998489168835, 'nu': 0.5}. Best is trial 1985 with value: 0.134351948015208.
[I 2024-12-04 15:31:57,858] Trial 2187 finished with value: 0.13435441866085315 and parameters: {'kernel_type': 'Matern', 'length_scale': 1.491190506494654, 'noise_level': 0.007238962455912389, 'constant_value': 2080.2537021522166, 'nu': 1.5}. Best is trial 1985 with value: 0.134351948015208.
[I 2024-12-04 15:31:58,688] Trial 2188 finished with value: 0.13435440827311426 and parameters: {'kernel_type': 'Matern', 'length_scale': 0.3852328727355402, 'noise_level': 0.0014240016230948852, 'constant_value': 70104.82601941667, 'nu': 1.5}. Best is trial 1985 with value: 0.134351948015208.
[I 2024-12-04 15:31:59,642] Trial 2190 finished with value: 0.13435439908581434 and parameters: {'kernel_type': 'Matern', 'length_scale': 1308.029793870328, 'noise_level': 0.020300569427837357, 'constant_value': 6122.4823687289845, 'nu': 1.5}. Best is trial 1985 with value: 0.134351948015208.
[I 2024-12-04 15:32:02,958] Trial 2191 finished with value: 0.17251042818003712 and parameters: {'kernel_type': 'Matern', 'length_scale': 6.996354648945978, 'noise_level': 0.22006156777545233, 'constant_value': 54.65990004191925, 'nu': 0.5}. Best is trial 1985 with value: 0.134351948015208.
[I 2024-12-04 15:32:02,964] Trial 2195 finished with value: 0.15167297934287347 and parameters: {'kernel_type': 'RBF', 'length_scale': 8109.337974891484, 'noise_level': 0.06959718052669238, 'constant_value': 5631.801081207752, 'nu': 2.5}. Best is trial 1985 with value: 0.134351948015208.
[I 2024-12-04 15:32:07,588] Trial 2192 finished with value: 0.1343543401735583 and parameters: {'kernel_type': 'Matern', 'length_scale': 95.50466993229868, 'noise_level': 3.589456758345927e-05, 'constant_value': 632.4998699370019, 'nu': 1.5}. Best is trial 1985 with value: 0.134351948015208.
[I 2024-12-04 15:32:07,598] Trial 2201 finished with value: 0.15167290592070853 and parameters: {'kernel_type': 'RBF', 'length_scale': 82.54276750357629, 'noise_level': 0.01502266463477898, 'constant_value': 1218.1674802778177, 'nu': 1.5}. Best is trial 1985 with value: 0.134351948015208.
[I 2024-12-04 15:32:07,613] Trial 2197 finished with value: 0.13435419942031815 and parameters: {'kernel_type': 'Matern', 'length_scale': 86.22307184633775, 'noise_level': 0.00010684407524142249, 'constant_value': 92301.16300613339, 'nu': 1.5}. Best is trial 1985 with value: 0.134351948015208.
[I 2024-12-04 15:32:08,385] Trial 2194 finished with value: 0.15167297454540885 and parameters: {'kernel_type': 'RBF', 'length_scale': 14934.435816124835, 'noise_level': 0.7708121431238278, 'constant_value': 180.00625484297115, 'nu': 1.5}. Best is trial 1985 with value: 0.134351948015208.
[I 2024-12-04 15:32:08,487] Trial 2189 finished with value: 0.13435435413954677 and parameters: {'kernel_type': 'Matern', 'length_scale': 48.48871720976568, 'noise_level': 0.029922230234170382, 'constant_value': 66830.62078983929, 'nu': 1.5}. Best is trial 1985 with value: 0.134351948015208.
[I 2024-12-04 15:32:09,908] Trial 2202 finished with value: 0.13435440230198303 and parameters: {'kernel_type': 'Matern', 'length_scale': 5.0638973868651975, 'noise_level': 0.021547619332736447, 'constant_value': 96532.9525204631, 'nu': 1.5}. Best is trial 1985 with value: 0.134351948015208.
[I 2024-12-04 15:32:09,933] Trial 2198 finished with value: 1.3007745979657548 and parameters: {'kernel_type': 'Matern', 'length_scale': 2.954346054161058, 'noise_level': 2.528675750032753e-05, 'constant_value': 85303.85806274194, 'nu': 1.5}. Best is trial 1985 with value: 0.134351948015208.
[I 2024-12-04 15:32:10,820] Trial 2193 finished with value: 0.13435443224492555 and parameters: {'kernel_type': 'Matern', 'length_scale': 13.827451255300337, 'noise_level': 0.0036011421920560662, 'constant_value': 2928.691368364695, 'nu': 1.5}. Best is trial 1985 with value: 0.134351948015208.
[I 2024-12-04 15:32:16,964] Trial 2208 finished with value: 0.13435441254250707 and parameters: {'kernel_type': 'Matern', 'length_scale': 1.3651100094690178, 'noise_level': 0.00155353133591893, 'constant_value': 1678.2685520215, 'nu': 1.5}. Best is trial 1985 with value: 0.134351948015208.
[I 2024-12-04 15:32:17,310] Trial 2199 finished with value: 1.3007737375265922 and parameters: {'kernel_type': 'Matern', 'length_scale': 0.00012835610636749268, 'noise_level': 0.05470020619831042, 'constant_value': 2.4939359087000203e-07, 'nu': 0.5}. Best is trial 1985 with value: 0.134351948015208.
[I 2024-12-04 15:32:17,482] Trial 2207 finished with value: 0.13435440459303336 and parameters: {'kernel_type': 'Matern', 'length_scale': 1393.9324635390437, 'noise_level': 0.006023008206224021, 'constant_value': 87197.1407817859, 'nu': 1.5}. Best is trial 1985 with value: 0.134351948015208.
[I 2024-12-04 15:32:17,772] Trial 2200 finished with value: 0.17251039364478893 and parameters: {'kernel_type': 'Matern', 'length_scale': 0.4155591152257425, 'noise_level': 0.7992142612587702, 'constant_value': 30162.090109766483, 'nu': 0.5}. Best is trial 1985 with value: 0.134351948015208.
[I 2024-12-04 15:32:17,811] Trial 2206 finished with value: 0.1343544462307837 and parameters: {'kernel_type': 'Matern', 'length_scale': 8.036734985313643, 'noise_level': 0.0005689862909438757, 'constant_value': 53031.634804560286, 'nu': 1.5}. Best is trial 1985 with value: 0.134351948015208.
[I 2024-12-04 15:32:18,932] Trial 2196 finished with value: 1.2693635028569716 and parameters: {'kernel_type': 'Matern', 'length_scale': 2.913501813628776e-05, 'noise_level': 6.192278938102178e-05, 'constant_value': 6316.5650441527205, 'nu': 1.5}. Best is trial 1985 with value: 0.134351948015208.
[I 2024-12-04 15:32:20,016] Trial 2209 finished with value: 0.1516729759949513 and parameters: {'kernel_type': 'RBF', 'length_scale': 4.105894212039375, 'noise_level': 0.05308207858599361, 'constant_value': 61921.189366865634, 'nu': 1.5}. Best is trial 1985 with value: 0.134351948015208.
[I 2024-12-04 15:32:21,088] Trial 2205 finished with value: 0.13435439959816603 and parameters: {'kernel_type': 'Matern', 'length_scale': 0.8825965596015665, 'noise_level': 0.00806572453568591, 'constant_value': 85268.18456053162, 'nu': 1.5}. Best is trial 1985 with value: 0.134351948015208.
[I 2024-12-04 15:32:21,607] Trial 2215 finished with value: 0.1343543897656883 and parameters: {'kernel_type': 'Matern', 'length_scale': 1.5338453289315166, 'noise_level': 0.16669174492672859, 'constant_value': 3334.747786676174, 'nu': 1.5}. Best is trial 1985 with value: 0.134351948015208.
[I 2024-12-04 15:32:21,977] Trial 2211 finished with value: 1.2693635028574302 and parameters: {'kernel_type': 'Matern', 'length_scale': 0.022597831424002936, 'noise_level': 0.9938103096388561, 'constant_value': 106.26959403326681, 'nu': 1.5}. Best is trial 1985 with value: 0.134351948015208.
[I 2024-12-04 15:32:25,411] Trial 2219 finished with value: 0.13435444873017252 and parameters: {'kernel_type': 'Matern', 'length_scale': 352.80622934296827, 'noise_level': 0.007008690743343124, 'constant_value': 86382.5608086176, 'nu': 1.5}. Best is trial 1985 with value: 0.134351948015208.
[I 2024-12-04 15:32:26,035] Trial 2212 finished with value: 1.2693635028588295 and parameters: {'kernel_type': 'Matern', 'length_scale': 0.020152961953862417, 'noise_level': 0.992534230601824, 'constant_value': 21.622892095762158, 'nu': 1.5}. Best is trial 1985 with value: 0.134351948015208.
[I 2024-12-04 15:32:27,754] Trial 2210 finished with value: 0.13435443463737737 and parameters: {'kernel_type': 'Matern', 'length_scale': 0.5541413901076171, 'noise_level': 0.0006922120148275259, 'constant_value': 89492.422001474, 'nu': 1.5}. Best is trial 1985 with value: 0.134351948015208.
[I 2024-12-04 15:32:29,054] Trial 2218 finished with value: 0.13435437297781672 and parameters: {'kernel_type': 'Matern', 'length_scale': 25.944883602283944, 'noise_level': 0.045291727757284454, 'constant_value': 523.4178015008392, 'nu': 1.5}. Best is trial 1985 with value: 0.134351948015208.
[I 2024-12-04 15:32:29,703] Trial 2214 finished with value: 0.13435451821983654 and parameters: {'kernel_type': 'Matern', 'length_scale': 29.111117862726484, 'noise_level': 0.05399796004505112, 'constant_value': 2691.980699172362, 'nu': 1.5}. Best is trial 1985 with value: 0.134351948015208.
[I 2024-12-04 15:32:29,906] Trial 2216 finished with value: 0.1343544011632079 and parameters: {'kernel_type': 'Matern', 'length_scale': 0.261722356589615, 'noise_level': 0.03186091692438716, 'constant_value': 92071.3339117778, 'nu': 1.5}. Best is trial 1985 with value: 0.134351948015208.
[I 2024-12-04 15:32:30,445] Trial 2203 finished with value: 0.1343530665004437 and parameters: {'kernel_type': 'Matern', 'length_scale': 18.598441358000667, 'noise_level': 0.012756727895369576, 'constant_value': 90752.95316170898, 'nu': 1.5}. Best is trial 1985 with value: 0.134351948015208.
[I 2024-12-04 15:32:32,286] Trial 2220 finished with value: 0.13435435401444498 and parameters: {'kernel_type': 'Matern', 'length_scale': 2.464954095901113, 'noise_level': 0.005560492331343354, 'constant_value': 30.963075456785926, 'nu': 1.5}. Best is trial 1985 with value: 0.134351948015208.
[I 2024-12-04 15:32:32,507] Trial 2213 finished with value: 0.13435429738890034 and parameters: {'kernel_type': 'Matern', 'length_scale': 17.270614068979004, 'noise_level': 0.0007747024425855934, 'constant_value': 1062.8860534483922, 'nu': 1.5}. Best is trial 1985 with value: 0.134351948015208.
[I 2024-12-04 15:32:35,710] Trial 2223 finished with value: 1.3007739235931066 and parameters: {'kernel_type': 'RBF', 'length_scale': 0.0076996970136762434, 'noise_level': 9.030201111602811e-06, 'constant_value': 50962.95496486185, 'nu': 1.5}. Best is trial 1985 with value: 0.134351948015208.
[I 2024-12-04 15:32:35,784] Trial 2217 finished with value: 0.13435439867835594 and parameters: {'kernel_type': 'Matern', 'length_scale': 0.25574285440087213, 'noise_level': 0.9425880758203473, 'constant_value': 54432.11504982233, 'nu': 1.5}. Best is trial 1985 with value: 0.134351948015208.
[I 2024-12-04 15:32:37,327] Trial 2229 finished with value: 0.13435439920702982 and parameters: {'kernel_type': 'Matern', 'length_scale': 1.0862053723205587, 'noise_level': 0.14915277809287658, 'constant_value': 0.019371685440044296, 'nu': 1.5}. Best is trial 1985 with value: 0.134351948015208.
[I 2024-12-04 15:32:38,390] Trial 2204 finished with value: 0.13435439733799673 and parameters: {'kernel_type': 'Matern', 'length_scale': 1.5215792793999146, 'noise_level': 0.10739787659380173, 'constant_value': 43.010966594227234, 'nu': 1.5}. Best is trial 1985 with value: 0.134351948015208.
[I 2024-12-04 15:32:40,121] Trial 2221 finished with value: 0.1343543996830176 and parameters: {'kernel_type': 'Matern', 'length_scale': 2.448672136075795, 'noise_level': 0.05488982190311925, 'constant_value': 77.13492009225025, 'nu': 1.5}. Best is trial 1985 with value: 0.134351948015208.
[I 2024-12-04 15:32:40,616] Trial 2230 finished with value: 1.3007166469997635 and parameters: {'kernel_type': 'RBF', 'length_scale': 0.0013615503110147578, 'noise_level': 0.8486828098089368, 'constant_value': 0.0008589923562437647, 'nu': 0.5}. Best is trial 1985 with value: 0.134351948015208.
