[I 2024-12-04 00:31:26,852] Trial 1976 finished with value: 0.4483970929887553 and parameters: {'kernel': 'rbf', 'C': 11.72541756666057, 'gamma': 0.00046069740096876897, 'epsilon': 0.006116916212275528}. Best is trial 1479 with value: 0.13978216740910654.
[I 2024-12-04 00:31:28,955] Trial 1975 finished with value: 0.16602073751804017 and parameters: {'kernel': 'rbf', 'C': 23.986925001633434, 'gamma': 0.029500345684246504, 'epsilon': 0.0024612128631795287}. Best is trial 1479 with value: 0.13978216740910654.
[I 2024-12-04 00:31:29,020] Trial 1978 finished with value: 0.24211490858994147 and parameters: {'kernel': 'rbf', 'C': 98.4572885288553, 'gamma': 0.0010019956779664992, 'epsilon': 0.002508292566363528}. Best is trial 1479 with value: 0.13978216740910654.
[I 2024-12-04 00:31:29,078] Trial 1968 finished with value: 0.20472511151165115 and parameters: {'kernel': 'rbf', 'C': 94.67869593700257, 'gamma': 0.04710626069832457, 'epsilon': 0.00184718302927499}. Best is trial 1479 with value: 0.13978216740910654.
[I 2024-12-04 00:31:30,258] Trial 1979 finished with value: 0.3626516123226649 and parameters: {'kernel': 'rbf', 'C': 36.52445303893178, 'gamma': 0.0004409638543600887, 'epsilon': 0.0011218132823230475}. Best is trial 1479 with value: 0.13978216740910654.
[I 2024-12-04 00:31:31,448] Trial 1977 finished with value: 0.14074740210746298 and parameters: {'kernel': 'rbf', 'C': 97.07103150781326, 'gamma': 0.009619528959440382, 'epsilon': 0.00200851917548551}. Best is trial 1479 with value: 0.13978216740910654.
[I 2024-12-04 00:31:31,450] Trial 1980 finished with value: 0.15252728706090468 and parameters: {'kernel': 'rbf', 'C': 31.332638907343593, 'gamma': 0.011336198046301694, 'epsilon': 0.002404027681373011}. Best is trial 1479 with value: 0.13978216740910654.
[I 2024-12-04 00:31:32,734] Trial 1981 finished with value: 0.2968711733244735 and parameters: {'kernel': 'rbf', 'C': 20.445106805361664, 'gamma': 0.0014830533219152221, 'epsilon': 0.0010054412292006417}. Best is trial 1479 with value: 0.13978216740910654.
[I 2024-12-04 00:31:33,951] Trial 1982 finished with value: 0.21494447084013713 and parameters: {'kernel': 'rbf', 'C': 20.803066379070703, 'gamma': 0.006702556474534988, 'epsilon': 0.0010231565617703075}. Best is trial 1479 with value: 0.13978216740910654.
[I 2024-12-04 00:31:34,021] Trial 1983 finished with value: 0.2333981365974266 and parameters: {'kernel': 'rbf', 'C': 97.88541692695073, 'gamma': 0.001262349756647205, 'epsilon': 0.003005753562127916}. Best is trial 1479 with value: 0.13978216740910654.
[I 2024-12-04 00:31:34,130] Trial 1984 finished with value: 0.321633043766212 and parameters: {'kernel': 'rbf', 'C': 4.661967838726259, 'gamma': 0.0036179051671562717, 'epsilon': 0.0030338987337865464}. Best is trial 1479 with value: 0.13978216740910654.
[I 2024-12-04 00:31:38,187] Trial 1989 finished with value: 0.2387338025444805 and parameters: {'kernel': 'rbf', 'C': 4.153238688148923, 'gamma': 0.01748859952664849, 'epsilon': 0.002989214044756499}. Best is trial 1479 with value: 0.13978216740910654.
[I 2024-12-04 00:31:39,606] Trial 1609 finished with value: 0.3523686151319468 and parameters: {'kernel': 'linear', 'C': 93.75275250027967, 'gamma': 0.044775985962324114, 'epsilon': 0.0016235450855708997}. Best is trial 1479 with value: 0.13978216740910654.
[I 2024-12-04 00:31:40,798] Trial 1991 finished with value: 0.22751751687268731 and parameters: {'kernel': 'rbf', 'C': 11.57451633948829, 'gamma': 0.00913777190488865, 'epsilon': 0.001003957683949444}. Best is trial 1479 with value: 0.13978216740910654.
[I 2024-12-04 00:31:41,415] Trial 1986 finished with value: 0.16592122922030475 and parameters: {'kernel': 'rbf', 'C': 99.31916786508098, 'gamma': 0.015125257199295469, 'epsilon': 0.0024095555743125167}. Best is trial 1479 with value: 0.13978216740910654.
[I 2024-12-04 00:31:42,220] Trial 1992 finished with value: 0.21641413782360705 and parameters: {'kernel': 'rbf', 'C': 89.46453870885185, 'gamma': 0.001942190048785108, 'epsilon': 0.002470657781087975}. Best is trial 1479 with value: 0.13978216740910654.
[I 2024-12-04 00:31:43,018] Trial 558 finished with value: 0.6258951043557229 and parameters: {'kernel': 'poly', 'C': 0.6665461774877433, 'gamma': 0.11809437783795777, 'epsilon': 0.013321117043211986}. Best is trial 1479 with value: 0.13978216740910654.
[I 2024-12-04 00:31:43,019] Trial 1987 finished with value: 0.1710667588193973 and parameters: {'kernel': 'rbf', 'C': 99.21251678851276, 'gamma': 0.02009889173202846, 'epsilon': 0.0035747681398588744}. Best is trial 1479 with value: 0.13978216740910654.
[I 2024-12-04 00:31:43,564] Trial 1990 finished with value: 0.1524668201040075 and parameters: {'kernel': 'rbf', 'C': 99.22191560831338, 'gamma': 0.012040744518289986, 'epsilon': 0.0012201657599833352}. Best is trial 1479 with value: 0.13978216740910654.
[I 2024-12-04 00:31:44,592] Trial 1993 finished with value: 0.15551769281540437 and parameters: {'kernel': 'rbf', 'C': 82.50723753506611, 'gamma': 0.005277076678626705, 'epsilon': 0.0010401592973248055}. Best is trial 1479 with value: 0.13978216740910654.
[I 2024-12-04 00:31:45,314] Trial 1995 finished with value: 0.20403551966233519 and parameters: {'kernel': 'rbf', 'C': 26.36916557147301, 'gamma': 0.00635268065473613, 'epsilon': 0.0022665562284796183}. Best is trial 1479 with value: 0.13978216740910654.
[I 2024-12-04 00:31:46,430] Trial 1994 finished with value: 0.15078534429499593 and parameters: {'kernel': 'rbf', 'C': 78.44755016982955, 'gamma': 0.012839479933180319, 'epsilon': 0.0010150397604610528}. Best is trial 1479 with value: 0.13978216740910654.
[I 2024-12-04 00:31:46,488] Trial 1998 finished with value: 0.8229321055858783 and parameters: {'kernel': 'poly', 'C': 64.20940443646026, 'gamma': 0.0017192466338465384, 'epsilon': 0.0010253890975729688}. Best is trial 1479 with value: 0.13978216740910654.
[I 2024-12-04 00:31:47,406] Trial 1997 finished with value: 0.14766643995416653 and parameters: {'kernel': 'rbf', 'C': 23.135161007018834, 'gamma': 0.019742499843851985, 'epsilon': 0.0026272015081097336}. Best is trial 1479 with value: 0.13978216740910654.
[I 2024-12-04 00:31:48,320] Trial 1996 finished with value: 0.20146489569495646 and parameters: {'kernel': 'rbf', 'C': 25.70441723466074, 'gamma': 0.0555928090557304, 'epsilon': 0.004874841439648377}. Best is trial 1479 with value: 0.13978216740910654.
[I 2024-12-04 00:31:48,759] Trial 2000 finished with value: 0.1832940373405945 and parameters: {'kernel': 'rbf', 'C': 99.12323843740307, 'gamma': 0.0030280216262569817, 'epsilon': 0.0030768171132921802}. Best is trial 1479 with value: 0.13978216740910654.
[I 2024-12-04 00:31:48,967] Trial 2001 finished with value: 6.393931482261814 and parameters: {'kernel': 'sigmoid', 'C': 1.417620591279717, 'gamma': 0.004416259681279113, 'epsilon': 0.6205104049169633}. Best is trial 1479 with value: 0.13978216740910654.
[I 2024-12-04 00:31:51,162] Trial 2003 finished with value: 0.15212231619458916 and parameters: {'kernel': 'rbf', 'C': 16.746523221750554, 'gamma': 0.01980242966447846, 'epsilon': 0.002761162728135109}. Best is trial 1479 with value: 0.13978216740910654.
[I 2024-12-04 00:31:51,164] Trial 2002 finished with value: 0.1412186073872268 and parameters: {'kernel': 'rbf', 'C': 92.51514503539181, 'gamma': 0.009880313124702509, 'epsilon': 0.0011810769634007868}. Best is trial 1479 with value: 0.13978216740910654.
[I 2024-12-04 00:31:52,375] Trial 2005 finished with value: 0.218315746244739 and parameters: {'kernel': 'rbf', 'C': 23.79357790561712, 'gamma': 0.0057008341533339125, 'epsilon': 0.0010783354782572924}. Best is trial 1479 with value: 0.13978216740910654.
[I 2024-12-04 00:31:54,037] Trial 2006 finished with value: 0.1963986255532908 and parameters: {'kernel': 'rbf', 'C': 97.13897930923646, 'gamma': 0.0025855557387965047, 'epsilon': 0.0010959345160005088}. Best is trial 1479 with value: 0.13978216740910654.
[I 2024-12-04 00:31:54,390] Trial 2004 finished with value: 0.1457334908011181 and parameters: {'kernel': 'rbf', 'C': 99.90806807127683, 'gamma': 0.00596825644169808, 'epsilon': 0.0011355473170041339}. Best is trial 1479 with value: 0.13978216740910654.
[I 2024-12-04 00:31:54,553] Trial 2008 finished with value: 0.18990234127139458 and parameters: {'kernel': 'rbf', 'C': 27.339405650785277, 'gamma': 0.007293933420600914, 'epsilon': 0.0023868356296447937}. Best is trial 1479 with value: 0.13978216740910654.
[I 2024-12-04 00:31:56,961] Trial 2007 finished with value: 0.14099280202802464 and parameters: {'kernel': 'rbf', 'C': 85.61802731213227, 'gamma': 0.009459150570924916, 'epsilon': 0.0034600569921996887}. Best is trial 1479 with value: 0.13978216740910654.
[I 2024-12-04 00:31:57,783] Trial 2009 finished with value: 0.15973128872723258 and parameters: {'kernel': 'rbf', 'C': 97.21518190368896, 'gamma': 0.004250326117622221, 'epsilon': 0.005763920274031923}. Best is trial 1479 with value: 0.13978216740910654.
[I 2024-12-04 00:31:57,785] Trial 2010 finished with value: 0.2681052453800572 and parameters: {'kernel': 'rbf', 'C': 21.17977763561529, 'gamma': 0.00226757344758072, 'epsilon': 0.0022330796100784485}. Best is trial 1479 with value: 0.13978216740910654.
[I 2024-12-04 00:31:59,536] Trial 2012 finished with value: 0.1662553406540174 and parameters: {'kernel': 'rbf', 'C': 91.4901387701076, 'gamma': 0.003975303022955947, 'epsilon': 0.0022995004506227786}. Best is trial 1479 with value: 0.13978216740910654.
[I 2024-12-04 00:32:00,996] Trial 2011 finished with value: 0.1956956269212724 and parameters: {'kernel': 'rbf', 'C': 28.635925746696582, 'gamma': 0.04815721728696603, 'epsilon': 0.0022354464894390816}. Best is trial 1479 with value: 0.13978216740910654.
[I 2024-12-04 00:32:01,505] Trial 2015 finished with value: 0.22794379708005388 and parameters: {'kernel': 'rbf', 'C': 95.57381385313138, 'gamma': 0.0014351039915801204, 'epsilon': 0.0011330563707602746}. Best is trial 1479 with value: 0.13978216740910654.
[I 2024-12-04 00:32:03,197] Trial 2014 finished with value: 0.1742256064269282 and parameters: {'kernel': 'rbf', 'C': 18.580179838518234, 'gamma': 0.03530738990861504, 'epsilon': 0.0011027000043315521}. Best is trial 1479 with value: 0.13978216740910654.
[I 2024-12-04 00:32:04,342] Trial 2016 finished with value: 0.148431948169709 and parameters: {'kernel': 'rbf', 'C': 20.834752884688957, 'gamma': 0.021109950103655947, 'epsilon': 0.002987966566078508}. Best is trial 1479 with value: 0.13978216740910654.
[I 2024-12-04 00:32:04,971] Trial 2017 finished with value: 0.24970502701747835 and parameters: {'kernel': 'rbf', 'C': 15.913131792878518, 'gamma': 0.00486173991628771, 'epsilon': 0.0029259983693448537}. Best is trial 1479 with value: 0.13978216740910654.
[I 2024-12-04 00:32:06,740] Trial 2019 finished with value: 0.25971224217695954 and parameters: {'kernel': 'rbf', 'C': 3.5180351860363612, 'gamma': 0.01422453062431001, 'epsilon': 0.0010351544821924116}. Best is trial 1479 with value: 0.13978216740910654.
[I 2024-12-04 00:32:07,436] Trial 2020 finished with value: 647.7923704861831 and parameters: {'kernel': 'sigmoid', 'C': 17.690754055128828, 'gamma': 0.5898714746312209, 'epsilon': 0.8111153625226427}. Best is trial 1479 with value: 0.13978216740910654.
[I 2024-12-04 00:32:08,928] Trial 2022 finished with value: 0.6264811500012932 and parameters: {'kernel': 'linear', 'C': 0.0030555360889477474, 'gamma': 0.00047383374387388865, 'epsilon': 0.7903664737806521}. Best is trial 1479 with value: 0.13978216740910654.
[I 2024-12-04 00:32:10,416] Trial 2018 finished with value: 0.1631298402672796 and parameters: {'kernel': 'rbf', 'C': 88.83329489008197, 'gamma': 0.015292870903560383, 'epsilon': 0.0022029219931980907}. Best is trial 1479 with value: 0.13978216740910654.
[I 2024-12-04 00:32:12,459] Trial 2024 finished with value: 0.20427495917694327 and parameters: {'kernel': 'rbf', 'C': 23.658289036050224, 'gamma': 0.00700700567518309, 'epsilon': 0.006399981052779701}. Best is trial 1479 with value: 0.13978216740910654.
[I 2024-12-04 00:32:12,492] Trial 2023 finished with value: 0.15832313024137476 and parameters: {'kernel': 'rbf', 'C': 97.39231224206371, 'gamma': 0.004425001399720407, 'epsilon': 0.003518407845202988}. Best is trial 1479 with value: 0.13978216740910654.
[I 2024-12-04 00:32:12,902] Trial 2025 finished with value: 0.9634128939249146 and parameters: {'kernel': 'poly', 'C': 0.001314861731532003, 'gamma': 0.00652075836888836, 'epsilon': 0.21020184671857048}. Best is trial 1479 with value: 0.13978216740910654.
[I 2024-12-04 00:32:15,415] Trial 2027 finished with value: 0.8506544852512012 and parameters: {'kernel': 'sigmoid', 'C': 5.518462527908428, 'gamma': 0.000563814832901534, 'epsilon': 0.15904535641202888}. Best is trial 1479 with value: 0.13978216740910654.
[I 2024-12-04 00:32:15,513] Trial 2026 finished with value: 5.244099060571521 and parameters: {'kernel': 'sigmoid', 'C': 0.12402983656462557, 'gamma': 0.9527835459659171, 'epsilon': 0.11120543304082359}. Best is trial 1479 with value: 0.13978216740910654.
[I 2024-12-04 00:32:16,300] Trial 2021 finished with value: 0.18412032849520155 and parameters: {'kernel': 'rbf', 'C': 81.94437075447796, 'gamma': 0.031236620457777566, 'epsilon': 0.0010507465256012398}. Best is trial 1479 with value: 0.13978216740910654.
[I 2024-12-04 00:32:17,237] Trial 2028 finished with value: 0.17423330383877203 and parameters: {'kernel': 'rbf', 'C': 28.086242204235408, 'gamma': 0.008542071544442397, 'epsilon': 0.001054841628245043}. Best is trial 1479 with value: 0.13978216740910654.
[I 2024-12-04 00:32:18,406] Trial 2029 finished with value: 665.0534857309102 and parameters: {'kernel': 'sigmoid', 'C': 94.75622151546317, 'gamma': 0.00496923645999252, 'epsilon': 0.0020880603876941195}. Best is trial 1479 with value: 0.13978216740910654.
[I 2024-12-04 00:32:19,497] Trial 2030 finished with value: 0.31765769839361796 and parameters: {'kernel': 'rbf', 'C': 75.89122404810588, 'gamma': 0.0003779967083555655, 'epsilon': 0.0010815024564160111}. Best is trial 1479 with value: 0.13978216740910654.
[I 2024-12-04 00:32:21,586] Trial 2031 finished with value: 0.19531840310396786 and parameters: {'kernel': 'rbf', 'C': 17.67826707667445, 'gamma': 0.049957042615756765, 'epsilon': 0.0010145931831177615}. Best is trial 1479 with value: 0.13978216740910654.
[I 2024-12-04 00:32:22,975] Trial 2032 finished with value: 0.16042543410752522 and parameters: {'kernel': 'rbf', 'C': 97.12925261738268, 'gamma': 0.0042260775688251345, 'epsilon': 0.003996985307958978}. Best is trial 1479 with value: 0.13978216740910654.
[I 2024-12-04 00:32:24,560] Trial 2034 finished with value: 0.1572065789014787 and parameters: {'kernel': 'rbf', 'C': 95.20281365614908, 'gamma': 0.004595161717695257, 'epsilon': 0.0020151219045951114}. Best is trial 1479 with value: 0.13978216740910654.
[I 2024-12-04 00:32:25,438] Trial 2035 finished with value: 0.18204051054681092 and parameters: {'kernel': 'rbf', 'C': 27.65889166470161, 'gamma': 0.007993767380362636, 'epsilon': 0.004106461802261649}. Best is trial 1479 with value: 0.13978216740910654.
[I 2024-12-04 00:32:26,157] Trial 2036 finished with value: 0.23970487733049767 and parameters: {'kernel': 'rbf', 'C': 22.875129018300626, 'gamma': 0.004300386157353865, 'epsilon': 0.0012413681570008547}. Best is trial 1479 with value: 0.13978216740910654.
[I 2024-12-04 00:32:28,364] Trial 2033 finished with value: 0.16535653975604608 and parameters: {'kernel': 'rbf', 'C': 89.81356869818359, 'gamma': 0.015803658694030102, 'epsilon': 0.0010881130003418285}. Best is trial 1479 with value: 0.13978216740910654.
[I 2024-12-04 00:32:29,812] Trial 2039 finished with value: 0.23227316874287962 and parameters: {'kernel': 'rbf', 'C': 33.3371323581386, 'gamma': 0.0035273376991908443, 'epsilon': 0.0010797508692642962}. Best is trial 1479 with value: 0.13978216740910654.
[I 2024-12-04 00:32:31,915] Trial 2037 finished with value: 0.15640070281340032 and parameters: {'kernel': 'rbf', 'C': 94.52787943685965, 'gamma': 0.013022436320266968, 'epsilon': 0.002831309123301901}. Best is trial 1479 with value: 0.13978216740910654.
[I 2024-12-04 00:32:34,435] Trial 2040 finished with value: 0.14591747276505038 and parameters: {'kernel': 'rbf', 'C': 96.9202903658678, 'gamma': 0.0060856945772663215, 'epsilon': 0.0023251567361479695}. Best is trial 1479 with value: 0.13978216740910654.
[I 2024-12-04 00:32:34,631] Trial 2038 finished with value: 0.16830051924797831 and parameters: {'kernel': 'rbf', 'C': 99.26981705290291, 'gamma': 0.01726514354851223, 'epsilon': 0.0031055548702241813}. Best is trial 1479 with value: 0.13978216740910654.
[I 2024-12-04 00:32:34,966] Trial 2041 finished with value: 0.15612970321595324 and parameters: {'kernel': 'rbf', 'C': 95.50312360911678, 'gamma': 0.004682724735617505, 'epsilon': 0.0022639755813311916}. Best is trial 1479 with value: 0.13978216740910654.
[I 2024-12-04 00:32:35,053] Trial 2042 finished with value: 0.25271514423127966 and parameters: {'kernel': 'rbf', 'C': 23.786919565704416, 'gamma': 0.0031351859442488037, 'epsilon': 0.002389699730826134}. Best is trial 1479 with value: 0.13978216740910654.
[I 2024-12-04 00:32:38,238] Trial 2045 finished with value: 0.704827420113788 and parameters: {'kernel': 'sigmoid', 'C': 0.18738161122410002, 'gamma': 0.002034128114442953, 'epsilon': 0.16357689471767164}. Best is trial 1479 with value: 0.13978216740910654.
[I 2024-12-04 00:32:38,830] Trial 2044 finished with value: 0.2430653467918878 and parameters: {'kernel': 'rbf', 'C': 92.7905660545136, 'gamma': 0.0010399886357987482, 'epsilon': 0.0011455587027428213}. Best is trial 1479 with value: 0.13978216740910654.
[I 2024-12-04 00:32:41,181] Trial 2047 finished with value: 0.2519167521839053 and parameters: {'kernel': 'rbf', 'C': 21.432606756941876, 'gamma': 0.0035527569279955734, 'epsilon': 0.0010801711778019552}. Best is trial 1479 with value: 0.13978216740910654.
[I 2024-12-04 00:32:41,183] Trial 2046 finished with value: 0.17725989395707673 and parameters: {'kernel': 'rbf', 'C': 28.805081513172528, 'gamma': 0.033233690921703335, 'epsilon': 0.0010131653180497887}. Best is trial 1479 with value: 0.13978216740910654.
[I 2024-12-04 00:32:43,465] Trial 2050 finished with value: 0.9720210966688456 and parameters: {'kernel': 'rbf', 'C': 0.0012388101647310052, 'gamma': 0.010374980797410567, 'epsilon': 0.5297125459167562}. Best is trial 1479 with value: 0.13978216740910654.
[I 2024-12-04 00:32:45,334] Trial 2043 finished with value: 0.21294135569083178 and parameters: {'kernel': 'rbf', 'C': 84.95787220466822, 'gamma': 0.06003589923585599, 'epsilon': 0.0025188677739339744}. Best is trial 1479 with value: 0.13978216740910654.
[I 2024-12-04 00:32:46,572] Trial 2051 finished with value: 1755.2221844822654 and parameters: {'kernel': 'sigmoid', 'C': 82.73601095558469, 'gamma': 0.027732301957006444, 'epsilon': 0.003174815487407852}. Best is trial 1479 with value: 0.13978216740910654.
[I 2024-12-04 00:32:47,826] Trial 2052 finished with value: 0.9391603138143553 and parameters: {'kernel': 'poly', 'C': 2.6892139600485647, 'gamma': 0.0008692774941767435, 'epsilon': 0.06062669571372549}. Best is trial 1479 with value: 0.13978216740910654.
[I 2024-12-04 00:32:48,387] Trial 2049 finished with value: 0.1621777015835108 and parameters: {'kernel': 'rbf', 'C': 96.36754487624312, 'gamma': 0.014549107669264611, 'epsilon': 0.0054435219385878305}. Best is trial 1479 with value: 0.13978216740910654.
[I 2024-12-04 00:32:50,236] Trial 2048 finished with value: 0.17574062157048065 and parameters: {'kernel': 'rbf', 'C': 98.9572681191151, 'gamma': 0.02327996351522516, 'epsilon': 0.001055184435045466}. Best is trial 1479 with value: 0.13978216740910654.
[I 2024-12-04 00:32:52,360] Trial 2053 finished with value: 0.1411069892920751 and parameters: {'kernel': 'rbf', 'C': 88.09325506376271, 'gamma': 0.008362274421744484, 'epsilon': 0.0028159768623696913}. Best is trial 1479 with value: 0.13978216740910654.
[I 2024-12-04 00:32:54,670] Trial 2056 finished with value: 0.22165294502286226 and parameters: {'kernel': 'rbf', 'C': 23.88028482112648, 'gamma': 0.005412800091479264, 'epsilon': 0.001004688558309991}. Best is trial 1479 with value: 0.13978216740910654.
[I 2024-12-04 00:32:55,511] Trial 2054 finished with value: 0.14775177169372453 and parameters: {'kernel': 'rbf', 'C': 95.80251616251378, 'gamma': 0.011352064893012393, 'epsilon': 0.0020014528579572676}. Best is trial 1479 with value: 0.13978216740910654.
[I 2024-12-04 00:32:58,583] Trial 2055 finished with value: 0.16932120207753693 and parameters: {'kernel': 'rbf', 'C': 97.12470474452041, 'gamma': 0.01622077942011165, 'epsilon': 0.0010130424279231158}. Best is trial 1479 with value: 0.13978216740910654.
[I 2024-12-04 00:32:59,184] Trial 2058 finished with value: 0.1775488412292107 and parameters: {'kernel': 'rbf', 'C': 89.11804080664778, 'gamma': 0.00347607892225597, 'epsilon': 0.0010192247362548203}. Best is trial 1479 with value: 0.13978216740910654.
[I 2024-12-04 00:33:02,186] Trial 2061 finished with value: 0.9300286291046888 and parameters: {'kernel': 'rbf', 'C': 0.050605801652360435, 'gamma': 0.7266646270127914, 'epsilon': 0.002527596524844984}. Best is trial 1479 with value: 0.13978216740910654.
[I 2024-12-04 00:33:04,169] Trial 408 finished with value: 0.7549376035695796 and parameters: {'kernel': 'poly', 'C': 82.16375249503427, 'gamma': 0.03431928733390432, 'epsilon': 0.00657420816205278}. Best is trial 1479 with value: 0.13978216740910654.
[I 2024-12-04 00:33:04,202] Trial 466 finished with value: 1.2996095470088143 and parameters: {'kernel': 'poly', 'C': 96.37069001272212, 'gamma': 0.5149988469514493, 'epsilon': 0.5225011367540445}. Best is trial 1479 with value: 0.13978216740910654.
[I 2024-12-04 00:33:05,378] Trial 2060 finished with value: 0.1407037901174493 and parameters: {'kernel': 'rbf', 'C': 93.66471436574675, 'gamma': 0.009717740525775898, 'epsilon': 0.0030201621188825226}. Best is trial 1479 with value: 0.13978216740910654.
