[I 2024-12-04 00:28:29,556] Trial 1803 finished with value: 0.1592560190091017 and parameters: {'kernel': 'rbf', 'C': 89.4488397412319, 'gamma': 0.004634927478700042, 'epsilon': 0.0010606814932154387}. Best is trial 1479 with value: 0.13978216740910654.
[I 2024-12-04 00:28:31,432] Trial 1802 finished with value: 0.1430469083627071 and parameters: {'kernel': 'rbf', 'C': 91.82858572074221, 'gamma': 0.010762656271138003, 'epsilon': 0.00251558555754588}. Best is trial 1479 with value: 0.13978216740910654.
[I 2024-12-04 00:28:31,434] Trial 1801 finished with value: 0.14473998063021035 and parameters: {'kernel': 'rbf', 'C': 96.473812123322, 'gamma': 0.010856211130620292, 'epsilon': 0.002938901504505416}. Best is trial 1479 with value: 0.13978216740910654.
[I 2024-12-04 00:28:32,793] Trial 1806 finished with value: 0.2076007172135257 and parameters: {'kernel': 'rbf', 'C': 94.34739726466539, 'gamma': 0.0021743467281415433, 'epsilon': 0.0026395031141949648}. Best is trial 1479 with value: 0.13978216740910654.
[I 2024-12-04 00:28:34,078] Trial 1810 finished with value: 0.9780802831123993 and parameters: {'kernel': 'sigmoid', 'C': 0.008465611217121225, 'gamma': 0.0007221552744105552, 'epsilon': 0.0401265921487746}. Best is trial 1479 with value: 0.13978216740910654.
[I 2024-12-04 00:28:34,280] Trial 1809 finished with value: 0.28191469581647616 and parameters: {'kernel': 'rbf', 'C': 4.2004939232902325, 'gamma': 0.007499188106111092, 'epsilon': 0.0023753904635189465}. Best is trial 1479 with value: 0.13978216740910654.
[I 2024-12-04 00:28:35,499] Trial 1811 finished with value: 1876.1596850540109 and parameters: {'kernel': 'sigmoid', 'C': 90.34132654652215, 'gamma': 0.02561522148225421, 'epsilon': 0.001009616184552731}. Best is trial 1479 with value: 0.13978216740910654.
[I 2024-12-04 00:28:37,421] Trial 1812 finished with value: 0.24884538840937792 and parameters: {'kernel': 'rbf', 'C': 22.35435487947597, 'gamma': 0.003708343072728651, 'epsilon': 0.0010021080644172073}. Best is trial 1479 with value: 0.13978216740910654.
[I 2024-12-04 00:28:37,423] Trial 1807 finished with value: 0.1546379899860918 and parameters: {'kernel': 'rbf', 'C': 93.65503873012199, 'gamma': 0.01267929853668135, 'epsilon': 0.0017986644043785198}. Best is trial 1479 with value: 0.13978216740910654.
[I 2024-12-04 00:28:39,092] Trial 1813 finished with value: 0.6653102548631067 and parameters: {'kernel': 'poly', 'C': 91.59657493674355, 'gamma': 0.004797882177381193, 'epsilon': 0.0038681154747927725}. Best is trial 1479 with value: 0.13978216740910654.
[I 2024-12-04 00:28:39,642] Trial 1814 finished with value: 0.1479724964641501 and parameters: {'kernel': 'rbf', 'C': 23.247788199640585, 'gamma': 0.016676036395035156, 'epsilon': 0.005186883185699038}. Best is trial 1479 with value: 0.13978216740910654.
[I 2024-12-04 00:28:41,482] Trial 1815 finished with value: 0.18049217698464634 and parameters: {'kernel': 'rbf', 'C': 20.229482411184783, 'gamma': 0.010107872241210084, 'epsilon': 0.0010142590328249526}. Best is trial 1479 with value: 0.13978216740910654.
[I 2024-12-04 00:28:41,823] Trial 1817 finished with value: 0.2715082655440833 and parameters: {'kernel': 'rbf', 'C': 25.42360339757404, 'gamma': 0.0018072191194428483, 'epsilon': 0.002470165265813147}. Best is trial 1479 with value: 0.13978216740910654.
[I 2024-12-04 00:28:43,033] Trial 1818 finished with value: 0.25901124222206207 and parameters: {'kernel': 'rbf', 'C': 18.49178027108594, 'gamma': 0.0033842330461289092, 'epsilon': 0.001013254989663734}. Best is trial 1479 with value: 0.13978216740910654.
[I 2024-12-04 00:28:45,937] Trial 1816 finished with value: 0.16323521359926543 and parameters: {'kernel': 'rbf', 'C': 96.27994357063719, 'gamma': 0.014667034656072473, 'epsilon': 0.002751382432453864}. Best is trial 1479 with value: 0.13978216740910654.
[I 2024-12-04 00:28:46,489] Trial 1820 finished with value: 0.21793054741013043 and parameters: {'kernel': 'rbf', 'C': 12.075634369478903, 'gamma': 0.07705657866784031, 'epsilon': 0.0010494991570063593}. Best is trial 1479 with value: 0.13978216740910654.
[I 2024-12-04 00:28:51,240] Trial 1823 finished with value: 0.2089572120127523 and parameters: {'kernel': 'rbf', 'C': 99.54583111282065, 'gamma': 0.002060661795779901, 'epsilon': 0.001089611936045155}. Best is trial 1479 with value: 0.13978216740910654.
[I 2024-12-04 00:28:53,665] Trial 1822 finished with value: 0.15795482742227215 and parameters: {'kernel': 'rbf', 'C': 96.30860927074058, 'gamma': 0.013625852295564185, 'epsilon': 0.00859553524519064}. Best is trial 1479 with value: 0.13978216740910654.
[I 2024-12-04 00:28:55,024] Trial 1794 finished with value: 0.3525068542500405 and parameters: {'kernel': 'linear', 'C': 12.237527432322647, 'gamma': 0.03483105601091386, 'epsilon': 0.004455422483420833}. Best is trial 1479 with value: 0.13978216740910654.
[I 2024-12-04 00:28:55,903] Trial 1824 finished with value: 0.1560788044870335 and parameters: {'kernel': 'rbf', 'C': 87.34002806054617, 'gamma': 0.004888039299798747, 'epsilon': 0.008325784779575773}. Best is trial 1479 with value: 0.13978216740910654.
[I 2024-12-04 00:28:57,737] Trial 1825 finished with value: 0.17188707787959095 and parameters: {'kernel': 'rbf', 'C': 25.45976455675973, 'gamma': 0.03121145507429092, 'epsilon': 0.002735640334180622}. Best is trial 1479 with value: 0.13978216740910654.
[I 2024-12-04 00:28:58,734] Trial 1827 finished with value: 0.19740373012230267 and parameters: {'kernel': 'rbf', 'C': 22.673800333798738, 'gamma': 0.007718098407156877, 'epsilon': 0.0022191856947201436}. Best is trial 1479 with value: 0.13978216740910654.
[I 2024-12-04 00:29:00,962] Trial 231 finished with value: 0.6811216900015253 and parameters: {'kernel': 'poly', 'C': 0.033224482349677245, 'gamma': 0.3638305182605038, 'epsilon': 0.00788065633546677}. Best is trial 1479 with value: 0.13978216740910654.
[I 2024-12-04 00:29:00,993] Trial 1826 finished with value: 0.16313246357737882 and parameters: {'kernel': 'rbf', 'C': 96.08179270692314, 'gamma': 0.014642495115925561, 'epsilon': 0.0025366254083247224}. Best is trial 1479 with value: 0.13978216740910654.
[I 2024-12-04 00:29:02,167] Trial 1828 finished with value: 0.14063461479420258 and parameters: {'kernel': 'rbf', 'C': 90.42638074176935, 'gamma': 0.007893056784683786, 'epsilon': 0.002298430207877182}. Best is trial 1479 with value: 0.13978216740910654.
[I 2024-12-04 00:29:02,337] Trial 1829 finished with value: 0.1516869149272885 and parameters: {'kernel': 'rbf', 'C': 93.01920367951956, 'gamma': 0.005426803824569803, 'epsilon': 0.0061161694281345845}. Best is trial 1479 with value: 0.13978216740910654.
[I 2024-12-04 00:29:04,603] Trial 1831 finished with value: 0.18719378636567924 and parameters: {'kernel': 'rbf', 'C': 85.56870997616045, 'gamma': 0.003178131362615961, 'epsilon': 0.0026447615167300388}. Best is trial 1479 with value: 0.13978216740910654.
[I 2024-12-04 00:29:05,135] Trial 1833 finished with value: 0.2972250750489846 and parameters: {'kernel': 'rbf', 'C': 15.461870115139327, 'gamma': 0.0018464583293593731, 'epsilon': 0.0023702117358129163}. Best is trial 1479 with value: 0.13978216740910654.
[I 2024-12-04 00:29:07,130] Trial 1834 finished with value: 0.25220026305182336 and parameters: {'kernel': 'rbf', 'C': 20.897414345856873, 'gamma': 0.0035376538576370378, 'epsilon': 0.008305023809252248}. Best is trial 1479 with value: 0.13978216740910654.
[I 2024-12-04 00:29:08,294] Trial 1830 finished with value: 0.1610305820306199 and parameters: {'kernel': 'rbf', 'C': 95.7152734527786, 'gamma': 0.014140657008595637, 'epsilon': 0.0019689398148320927}. Best is trial 1479 with value: 0.13978216740910654.
[I 2024-12-04 00:29:08,461] Trial 1835 finished with value: 0.1814375892640973 and parameters: {'kernel': 'rbf', 'C': 14.401310904888428, 'gamma': 0.013151451258235485, 'epsilon': 0.0011527588448994653}. Best is trial 1479 with value: 0.13978216740910654.
[I 2024-12-04 00:29:09,821] Trial 1836 finished with value: 0.25100745880163655 and parameters: {'kernel': 'rbf', 'C': 18.9243773743271, 'gamma': 0.004060263111586076, 'epsilon': 0.0028096759120301}. Best is trial 1479 with value: 0.13978216740910654.
[I 2024-12-04 00:29:10,592] Trial 1837 finished with value: 0.8749166535863754 and parameters: {'kernel': 'sigmoid', 'C': 0.006430190366012277, 'gamma': 0.05834835645747455, 'epsilon': 0.21411118848551078}. Best is trial 1479 with value: 0.13978216740910654.
[I 2024-12-04 00:29:11,408] Trial 1832 finished with value: 0.1729565077849294 and parameters: {'kernel': 'rbf', 'C': 87.60369988400268, 'gamma': 0.02193027309176631, 'epsilon': 0.0010457327465080225}. Best is trial 1479 with value: 0.13978216740910654.
[I 2024-12-04 00:29:13,150] Trial 1840 finished with value: 390.3909544146883 and parameters: {'kernel': 'sigmoid', 'C': 80.82948432330107, 'gamma': 0.0036637058193786562, 'epsilon': 0.003406163540396161}. Best is trial 1479 with value: 0.13978216740910654.
[I 2024-12-04 00:29:14,354] Trial 1841 finished with value: 0.255492379433971 and parameters: {'kernel': 'rbf', 'C': 24.222396622960975, 'gamma': 0.002883668288694834, 'epsilon': 0.0010021490705236175}. Best is trial 1479 with value: 0.13978216740910654.
[I 2024-12-04 00:29:16,300] Trial 1839 finished with value: 0.23389079343412106 and parameters: {'kernel': 'rbf', 'C': 94.71037536377423, 'gamma': 0.09499994284307993, 'epsilon': 0.0010209730290558024}. Best is trial 1479 with value: 0.13978216740910654.
[I 2024-12-04 00:29:16,589] Trial 1843 finished with value: 0.6477430985171743 and parameters: {'kernel': 'rbf', 'C': 2.3352209317908437, 'gamma': 0.00012571499430003713, 'epsilon': 0.04172016982636639}. Best is trial 1479 with value: 0.13978216740910654.
[I 2024-12-04 00:29:18,673] Trial 1838 finished with value: 0.20714715029566658 and parameters: {'kernel': 'rbf', 'C': 99.6298594570344, 'gamma': 0.04815775501771086, 'epsilon': 0.002002156888408597}. Best is trial 1479 with value: 0.13978216740910654.
[I 2024-12-04 00:29:21,463] Trial 1844 finished with value: 0.15627572723467106 and parameters: {'kernel': 'rbf', 'C': 25.412037336919322, 'gamma': 0.024884186973143804, 'epsilon': 0.001018717109464473}. Best is trial 1479 with value: 0.13978216740910654.
[I 2024-12-04 00:29:21,507] Trial 1845 finished with value: 0.16483725190713097 and parameters: {'kernel': 'rbf', 'C': 27.505088354338724, 'gamma': 0.027701920557859902, 'epsilon': 0.003825856569495862}. Best is trial 1479 with value: 0.13978216740910654.
[I 2024-12-04 00:29:22,437] Trial 1842 finished with value: 0.17835654258003122 and parameters: {'kernel': 'rbf', 'C': 87.69192217583965, 'gamma': 0.02594147667353429, 'epsilon': 0.0010585209519393887}. Best is trial 1479 with value: 0.13978216740910654.
[I 2024-12-04 00:29:25,555] Trial 1847 finished with value: 0.18704361000936184 and parameters: {'kernel': 'rbf', 'C': 29.352516110111363, 'gamma': 0.0071820456258398805, 'epsilon': 0.002686482406151178}. Best is trial 1479 with value: 0.13978216740910654.
[I 2024-12-04 00:29:26,295] Trial 1849 finished with value: 0.16620280025056441 and parameters: {'kernel': 'rbf', 'C': 22.85791494323824, 'gamma': 0.011275265676315191, 'epsilon': 0.002317450808519987}. Best is trial 1479 with value: 0.13978216740910654.
[I 2024-12-04 00:29:26,878] Trial 1846 finished with value: 0.18695396791368085 and parameters: {'kernel': 'rbf', 'C': 98.75693217059049, 'gamma': 0.033641310733095384, 'epsilon': 0.004889623544083681}. Best is trial 1479 with value: 0.13978216740910654.
[I 2024-12-04 00:29:27,774] Trial 1850 finished with value: 0.5761905804783464 and parameters: {'kernel': 'rbf', 'C': 0.4439901800715044, 'gamma': 0.0018115176193663084, 'epsilon': 0.2558693705041936}. Best is trial 1479 with value: 0.13978216740910654.
[I 2024-12-04 00:29:27,853] Trial 1848 finished with value: 0.1406466765054809 and parameters: {'kernel': 'rbf', 'C': 90.64152085281808, 'gamma': 0.007980338700048332, 'epsilon': 0.0022714344518588695}. Best is trial 1479 with value: 0.13978216740910654.
[I 2024-12-04 00:29:29,372] Trial 1588 finished with value: 0.3532678046592469 and parameters: {'kernel': 'linear', 'C': 77.87041354133865, 'gamma': 0.00809538029441282, 'epsilon': 0.0028043441184059385}. Best is trial 1479 with value: 0.13978216740910654.
[I 2024-12-04 00:29:29,570] Trial 1852 finished with value: 0.25318104813931724 and parameters: {'kernel': 'rbf', 'C': 18.54986910365716, 'gamma': 0.003898060375057278, 'epsilon': 0.0021811364093591743}. Best is trial 1479 with value: 0.13978216740910654.
[I 2024-12-04 00:29:31,014] Trial 1853 finished with value: 0.24350711330910702 and parameters: {'kernel': 'rbf', 'C': 91.13637934156874, 'gamma': 0.0010468567039541696, 'epsilon': 0.001009699368467298}. Best is trial 1479 with value: 0.13978216740910654.
[I 2024-12-04 00:29:31,190] Trial 1854 finished with value: 0.17512352422075808 and parameters: {'kernel': 'rbf', 'C': 15.634284878357237, 'gamma': 0.013596415736604152, 'epsilon': 0.0010204042800345098}. Best is trial 1479 with value: 0.13978216740910654.
[I 2024-12-04 00:29:33,138] Trial 1403 finished with value: 0.6235906704344494 and parameters: {'kernel': 'poly', 'C': 0.015650378905894533, 'gamma': 0.41300547962556866, 'epsilon': 0.021918686471370873}. Best is trial 1479 with value: 0.13978216740910654.
[I 2024-12-04 00:29:34,587] Trial 1856 finished with value: 0.14195676719154598 and parameters: {'kernel': 'rbf', 'C': 97.64208609866876, 'gamma': 0.007292398109371417, 'epsilon': 0.008292374738730932}. Best is trial 1479 with value: 0.13978216740910654.
[I 2024-12-04 00:29:34,818] Trial 1859 finished with value: 0.22957032052484108 and parameters: {'kernel': 'rbf', 'C': 13.702812538359726, 'gamma': 0.007784929692529263, 'epsilon': 0.0010235303125501925}. Best is trial 1479 with value: 0.13978216740910654.
[I 2024-12-04 00:29:36,583] Trial 1858 finished with value: 0.30352524028006084 and parameters: {'kernel': 'linear', 'C': 1.1244175579810058, 'gamma': 0.002221011032402869, 'epsilon': 0.1516265236772919}. Best is trial 1479 with value: 0.13978216740910654.
[I 2024-12-04 00:29:36,619] Trial 1857 finished with value: 0.14051269486756787 and parameters: {'kernel': 'rbf', 'C': 93.3084337528739, 'gamma': 0.008010433526963599, 'epsilon': 0.002645440329346617}. Best is trial 1479 with value: 0.13978216740910654.
[I 2024-12-04 00:29:36,713] Trial 1855 finished with value: 0.34088594361656116 and parameters: {'kernel': 'linear', 'C': 1.4247728375484958, 'gamma': 0.0023205030954352897, 'epsilon': 0.01106912644578888}. Best is trial 1479 with value: 0.13978216740910654.
[I 2024-12-04 00:29:38,385] Trial 1861 finished with value: 0.1728979383420876 and parameters: {'kernel': 'rbf', 'C': 99.07718068853045, 'gamma': 0.0034348635126653137, 'epsilon': 0.0015110698364709102}. Best is trial 1479 with value: 0.13978216740910654.
[I 2024-12-04 00:29:38,621] Trial 1860 finished with value: 0.14098785051209736 and parameters: {'kernel': 'rbf', 'C': 94.05681861034671, 'gamma': 0.0072940347770392025, 'epsilon': 0.0027844528207097217}. Best is trial 1479 with value: 0.13978216740910654.
[I 2024-12-04 00:29:39,387] Trial 1863 finished with value: 0.906446072883103 and parameters: {'kernel': 'poly', 'C': 14.55088225839576, 'gamma': 0.001149097157293381, 'epsilon': 0.020005859430164197}. Best is trial 1479 with value: 0.13978216740910654.
[I 2024-12-04 00:29:40,303] Trial 1650 finished with value: 0.35245434911067175 and parameters: {'kernel': 'linear', 'C': 57.513569779351776, 'gamma': 0.0037459067488901476, 'epsilon': 0.001106600404709427}. Best is trial 1479 with value: 0.13978216740910654.
[I 2024-12-04 00:29:41,948] Trial 1864 finished with value: 0.15277426241379008 and parameters: {'kernel': 'rbf', 'C': 92.67040243358055, 'gamma': 0.0052267771375203685, 'epsilon': 0.001118053667783137}. Best is trial 1479 with value: 0.13978216740910654.
[I 2024-12-04 00:29:42,263] Trial 1866 finished with value: 0.22123879864531984 and parameters: {'kernel': 'rbf', 'C': 95.73491375034929, 'gamma': 0.0016509366460028283, 'epsilon': 0.0027800439387052384}. Best is trial 1479 with value: 0.13978216740910654.
[I 2024-12-04 00:29:44,426] Trial 1862 finished with value: 0.17199106375234727 and parameters: {'kernel': 'rbf', 'C': 97.80371629438295, 'gamma': 0.020359752516521314, 'epsilon': 0.001123986343651408}. Best is trial 1479 with value: 0.13978216740910654.
[I 2024-12-04 00:29:44,939] Trial 1867 finished with value: 0.14711914516882627 and parameters: {'kernel': 'rbf', 'C': 86.07752731166782, 'gamma': 0.006171949966199251, 'epsilon': 0.0010721242138526797}. Best is trial 1479 with value: 0.13978216740910654.
[I 2024-12-04 00:29:45,342] Trial 1868 finished with value: 0.15604621557502446 and parameters: {'kernel': 'rbf', 'C': 99.40973996957038, 'gamma': 0.0046098122291083005, 'epsilon': 0.0010640414777479525}. Best is trial 1479 with value: 0.13978216740910654.
[I 2024-12-04 00:29:45,775] Trial 1870 finished with value: 0.21535504511583728 and parameters: {'kernel': 'rbf', 'C': 4.168932015252781, 'gamma': 0.023692411561165014, 'epsilon': 0.002535748692611069}. Best is trial 1479 with value: 0.13978216740910654.
[I 2024-12-04 00:29:46,319] Trial 1869 finished with value: 0.1561343664283456 and parameters: {'kernel': 'rbf', 'C': 18.474721236217633, 'gamma': 0.016390981565953946, 'epsilon': 0.00237817921230282}. Best is trial 1479 with value: 0.13978216740910654.
[I 2024-12-04 00:29:46,801] Trial 1865 finished with value: 0.19072592165467672 and parameters: {'kernel': 'rbf', 'C': 94.15381445433111, 'gamma': 0.03660670053806456, 'epsilon': 0.003007322106108161}. Best is trial 1479 with value: 0.13978216740910654.
[I 2024-12-04 00:29:50,583] Trial 1876 finished with value: 0.22267972169542216 and parameters: {'kernel': 'rbf', 'C': 24.260807777190422, 'gamma': 0.005370735879149489, 'epsilon': 0.005588333134576466}. Best is trial 1479 with value: 0.13978216740910654.
[I 2024-12-04 00:29:50,893] Trial 1873 finished with value: 0.15443885406302843 and parameters: {'kernel': 'rbf', 'C': 97.7837184915871, 'gamma': 0.004749504744819676, 'epsilon': 0.003975816056697332}. Best is trial 1479 with value: 0.13978216740910654.
[I 2024-12-04 00:29:51,182] Trial 1875 finished with value: 0.16721419969725204 and parameters: {'kernel': 'rbf', 'C': 21.520478519419456, 'gamma': 0.01165210508288592, 'epsilon': 0.001040116880072758}. Best is trial 1479 with value: 0.13978216740910654.
[I 2024-12-04 00:29:52,571] Trial 1872 finished with value: 0.1452079324503526 and parameters: {'kernel': 'rbf', 'C': 99.93440799446672, 'gamma': 0.010851276620845892, 'epsilon': 0.0020707251483629194}. Best is trial 1479 with value: 0.13978216740910654.
[I 2024-12-04 00:29:53,668] Trial 1877 finished with value: 0.29982507474224224 and parameters: {'kernel': 'rbf', 'C': 3.765818249935943, 'gamma': 0.0060770806248777445, 'epsilon': 0.0018372719124983134}. Best is trial 1479 with value: 0.13978216740910654.
[I 2024-12-04 00:29:55,844] Trial 1880 finished with value: 0.23555141394410842 and parameters: {'kernel': 'rbf', 'C': 11.084816039148775, 'gamma': 0.008567366016315019, 'epsilon': 0.006635517208981458}. Best is trial 1479 with value: 0.13978216740910654.
[I 2024-12-04 00:29:56,715] Trial 1881 finished with value: 0.30482849063955464 and parameters: {'kernel': 'rbf', 'C': 16.254778487811297, 'gamma': 0.001617778753488914, 'epsilon': 0.0023147657394122748}. Best is trial 1479 with value: 0.13978216740910654.
[I 2024-12-04 00:29:57,432] Trial 1874 finished with value: 0.17073577414698718 and parameters: {'kernel': 'rbf', 'C': 99.07276635194198, 'gamma': 0.018524278338745623, 'epsilon': 0.0013205099297010988}. Best is trial 1479 with value: 0.13978216740910654.
[I 2024-12-04 00:29:58,343] Trial 1879 finished with value: 0.14004927453712654 and parameters: {'kernel': 'rbf', 'C': 91.59412493467883, 'gamma': 0.008359389083785937, 'epsilon': 0.0010270711602501925}. Best is trial 1479 with value: 0.13978216740910654.
[I 2024-12-04 00:29:58,432] Trial 1882 finished with value: 72.72641623783173 and parameters: {'kernel': 'sigmoid', 'C': 28.68420033206204, 'gamma': 0.002408250029878226, 'epsilon': 0.0010216150843415646}. Best is trial 1479 with value: 0.13978216740910654.
[I 2024-12-04 00:29:59,969] Trial 1878 finished with value: 0.1535953623677042 and parameters: {'kernel': 'rbf', 'C': 96.14683140549653, 'gamma': 0.01235355770093826, 'epsilon': 0.0011355572543292065}. Best is trial 1479 with value: 0.13978216740910654.
[I 2024-12-04 00:30:00,348] Trial 1884 finished with value: 0.30849643821550754 and parameters: {'kernel': 'rbf', 'C': 11.564928065413381, 'gamma': 0.0020198725058008906, 'epsilon': 0.001019301293138159}. Best is trial 1479 with value: 0.13978216740910654.
[I 2024-12-04 00:30:01,362] Trial 1883 finished with value: 0.1685349511751018 and parameters: {'kernel': 'rbf', 'C': 90.05375183994573, 'gamma': 0.003882760819481244, 'epsilon': 0.0010680290296683436}. Best is trial 1479 with value: 0.13978216740910654.
[I 2024-12-04 00:30:02,135] Trial 1885 finished with value: 0.23160675155757396 and parameters: {'kernel': 'rbf', 'C': 35.196422538548205, 'gamma': 0.0034081505671177434, 'epsilon': 0.0010322562940841915}. Best is trial 1479 with value: 0.13978216740910654.
[I 2024-12-04 00:30:03,523] Trial 1888 finished with value: 204.14092063577507 and parameters: {'kernel': 'sigmoid', 'C': 16.93331237161692, 'gamma': 0.009143569681576895, 'epsilon': 0.0010544763257134308}. Best is trial 1479 with value: 0.13978216740910654.
[I 2024-12-04 00:30:05,403] Trial 1887 finished with value: 0.1615753362565848 and parameters: {'kernel': 'rbf', 'C': 20.71861275707992, 'gamma': 0.028943019004933016, 'epsilon': 0.0010734166751679367}. Best is trial 1479 with value: 0.13978216740910654.
[I 2024-12-04 00:30:05,564] Trial 1890 finished with value: 0.18702031828227886 and parameters: {'kernel': 'rbf', 'C': 15.054100889570227, 'gamma': 0.01176330439009663, 'epsilon': 0.0027387900607197565}. Best is trial 1479 with value: 0.13978216740910654.
