[I 2024-12-04 00:17:42,595] Trial 1201 finished with value: 0.5862644425325936 and parameters: {'kernel': 'poly', 'C': 81.53366052491815, 'gamma': 0.007634722555850277, 'epsilon': 0.003537356657943982}. Best is trial 973 with value: 0.1397919550170376.
[I 2024-12-04 00:17:42,619] Trial 1198 finished with value: 0.16045074034479262 and parameters: {'kernel': 'rbf', 'C': 88.29014236645905, 'gamma': 0.014543296488859206, 'epsilon': 0.0012416232803139208}. Best is trial 973 with value: 0.1397919550170376.
[I 2024-12-04 00:17:43,906] Trial 1205 finished with value: 0.22840375494206894 and parameters: {'kernel': 'rbf', 'C': 22.87031588779865, 'gamma': 0.005105605127563669, 'epsilon': 0.0010099583224042947}. Best is trial 973 with value: 0.1397919550170376.
[I 2024-12-04 00:17:45,150] Trial 1204 finished with value: 0.14330362309336778 and parameters: {'kernel': 'rbf', 'C': 93.48512191597753, 'gamma': 0.006565223737326013, 'epsilon': 0.0014447455244501813}. Best is trial 973 with value: 0.1397919550170376.
[I 2024-12-04 00:17:45,403] Trial 1203 finished with value: 0.16070015815939845 and parameters: {'kernel': 'rbf', 'C': 97.03067548746854, 'gamma': 0.01386241740826834, 'epsilon': 0.0012686848267503092}. Best is trial 973 with value: 0.1397919550170376.
[I 2024-12-04 00:17:46,232] Trial 1207 finished with value: 0.3461770631689201 and parameters: {'kernel': 'linear', 'C': 0.21543155662503322, 'gamma': 0.0036091965723358314, 'epsilon': 0.023778480673726926}. Best is trial 973 with value: 0.1397919550170376.
[I 2024-12-04 00:17:47,799] Trial 1208 finished with value: 0.16085983315531624 and parameters: {'kernel': 'rbf', 'C': 25.86362994232943, 'gamma': 0.02685320063353161, 'epsilon': 0.0026380980930534722}. Best is trial 973 with value: 0.1397919550170376.
[I 2024-12-04 00:17:47,827] Trial 1210 finished with value: 0.28330947013450025 and parameters: {'kernel': 'rbf', 'C': 12.412715699359419, 'gamma': 0.002724075725354549, 'epsilon': 0.0010275489764547563}. Best is trial 973 with value: 0.1397919550170376.
[I 2024-12-04 00:17:49,377] Trial 1209 finished with value: 0.14579691653479263 and parameters: {'kernel': 'rbf', 'C': 75.97088369502923, 'gamma': 0.00675033404928386, 'epsilon': 0.001047079552546256}. Best is trial 973 with value: 0.1397919550170376.
[I 2024-12-04 00:17:50,216] Trial 1206 finished with value: 0.19869623459244098 and parameters: {'kernel': 'rbf', 'C': 90.54707200104671, 'gamma': 0.04399304042309475, 'epsilon': 0.008244116899203974}. Best is trial 973 with value: 0.1397919550170376.
[I 2024-12-04 00:17:50,331] Trial 1213 finished with value: 0.18995654149633287 and parameters: {'kernel': 'rbf', 'C': 13.655250320570838, 'gamma': 0.012245083327156967, 'epsilon': 0.0027598569660631372}. Best is trial 973 with value: 0.1397919550170376.
[I 2024-12-04 00:17:50,538] Trial 1212 finished with value: 0.2173071787339076 and parameters: {'kernel': 'rbf', 'C': 96.30690335303902, 'gamma': 0.0017901286938393811, 'epsilon': 0.0010731921446671955}. Best is trial 973 with value: 0.1397919550170376.
[I 2024-12-04 00:17:52,261] Trial 1211 finished with value: 0.14061607061271192 and parameters: {'kernel': 'rbf', 'C': 96.0477007508592, 'gamma': 0.009325952771032526, 'epsilon': 0.001110261225682848}. Best is trial 973 with value: 0.1397919550170376.
[I 2024-12-04 00:17:53,447] Trial 1217 finished with value: 0.3049826742177769 and parameters: {'kernel': 'rbf', 'C': 2.4064001321445043, 'gamma': 0.008834018360863047, 'epsilon': 0.001543345078574134}. Best is trial 973 with value: 0.1397919550170376.
[I 2024-12-04 00:17:53,947] Trial 1215 finished with value: 0.15798497668455827 and parameters: {'kernel': 'rbf', 'C': 19.01319246589015, 'gamma': 0.015285400646880136, 'epsilon': 0.0025391034868839472}. Best is trial 973 with value: 0.1397919550170376.
[I 2024-12-04 00:17:54,280] Trial 1214 finished with value: 0.1506257948005853 and parameters: {'kernel': 'rbf', 'C': 96.18017930220901, 'gamma': 0.0054511105677544245, 'epsilon': 0.002668439177303174}. Best is trial 973 with value: 0.1397919550170376.
[I 2024-12-04 00:17:54,282] Trial 877 finished with value: 0.3522863485235738 and parameters: {'kernel': 'linear', 'C': 83.69120117330395, 'gamma': 0.05460505982238587, 'epsilon': 0.0013312166858313003}. Best is trial 973 with value: 0.1397919550170376.
[I 2024-12-04 00:17:55,679] Trial 1216 finished with value: 0.14182506671147724 and parameters: {'kernel': 'rbf', 'C': 90.02774556429117, 'gamma': 0.007835251128405694, 'epsilon': 0.003951137636072398}. Best is trial 973 with value: 0.1397919550170376.
[I 2024-12-04 00:17:55,721] Trial 1219 finished with value: 0.21796055513760482 and parameters: {'kernel': 'rbf', 'C': 22.782886928042412, 'gamma': 0.005943607129256817, 'epsilon': 0.0010059054196721678}. Best is trial 973 with value: 0.1397919550170376.
[I 2024-12-04 00:17:56,201] Trial 1220 finished with value: 0.2641506393401246 and parameters: {'kernel': 'rbf', 'C': 20.750352930497115, 'gamma': 0.0026474491740991375, 'epsilon': 0.008289314882989188}. Best is trial 973 with value: 0.1397919550170376.
[I 2024-12-04 00:17:58,007] Trial 1222 finished with value: 0.19542708523500946 and parameters: {'kernel': 'rbf', 'C': 90.92025681205195, 'gamma': 0.0027319269653284543, 'epsilon': 0.005298991009822988}. Best is trial 973 with value: 0.1397919550170376.
[I 2024-12-04 00:17:58,480] Trial 1218 finished with value: 0.19657909119890704 and parameters: {'kernel': 'rbf', 'C': 84.09661739125075, 'gamma': 0.04253517630298423, 'epsilon': 0.002611053443001513}. Best is trial 973 with value: 0.1397919550170376.
[I 2024-12-04 00:17:58,869] Trial 1221 finished with value: 0.15768455465134715 and parameters: {'kernel': 'rbf', 'C': 89.32824003123217, 'gamma': 0.004778617410936089, 'epsilon': 0.0010308966965791426}. Best is trial 973 with value: 0.1397919550170376.
[I 2024-12-04 00:17:59,679] Trial 1224 finished with value: 0.17081963547889914 and parameters: {'kernel': 'rbf', 'C': 21.1342626182271, 'gamma': 0.011192832873579427, 'epsilon': 0.002820744702786529}. Best is trial 973 with value: 0.1397919550170376.
[I 2024-12-04 00:17:59,684] Trial 1225 finished with value: 0.16343082170984136 and parameters: {'kernel': 'rbf', 'C': 16.878504216935063, 'gamma': 0.015250912943335361, 'epsilon': 0.0027185925766857136}. Best is trial 973 with value: 0.1397919550170376.
[I 2024-12-04 00:17:59,992] Trial 1226 finished with value: 0.24421114358627047 and parameters: {'kernel': 'rbf', 'C': 97.99059046744523, 'gamma': 0.0009528283691855554, 'epsilon': 0.0023395074148838484}. Best is trial 973 with value: 0.1397919550170376.
[I 2024-12-04 00:18:00,312] Trial 1223 finished with value: 0.14427626572015093 and parameters: {'kernel': 'rbf', 'C': 67.41699657733048, 'gamma': 0.00761108660387622, 'epsilon': 0.0010010443926449276}. Best is trial 973 with value: 0.1397919550170376.
[I 2024-12-04 00:18:03,445] Trial 1230 finished with value: 0.22481058460897552 and parameters: {'kernel': 'rbf', 'C': 26.12936455983851, 'gamma': 0.004812105118242556, 'epsilon': 0.0029005323710533585}. Best is trial 973 with value: 0.1397919550170376.
[I 2024-12-04 00:18:03,476] Trial 1231 finished with value: 0.3618487133996416 and parameters: {'kernel': 'rbf', 'C': 45.87925121503719, 'gamma': 0.0003634169896256411, 'epsilon': 0.009576696982666435}. Best is trial 973 with value: 0.1397919550170376.
[I 2024-12-04 00:18:03,478] Trial 1227 finished with value: 0.14242705587791968 and parameters: {'kernel': 'rbf', 'C': 98.66539303095038, 'gamma': 0.007104135625318659, 'epsilon': 0.00866002616646399}. Best is trial 973 with value: 0.1397919550170376.
[I 2024-12-04 00:18:06,106] Trial 1232 finished with value: 0.17845752548264002 and parameters: {'kernel': 'rbf', 'C': 25.37681616395299, 'gamma': 0.035209623640012955, 'epsilon': 0.0026065854398343046}. Best is trial 973 with value: 0.1397919550170376.
[I 2024-12-04 00:18:07,919] Trial 1229 finished with value: 0.1530981626841409 and parameters: {'kernel': 'rbf', 'C': 88.03017532324341, 'gamma': 0.012697098220765547, 'epsilon': 0.0020412386969730924}. Best is trial 973 with value: 0.1397919550170376.
[I 2024-12-04 00:18:07,921] Trial 1234 finished with value: 0.16393273128679303 and parameters: {'kernel': 'rbf', 'C': 92.57004314937764, 'gamma': 0.004104376065273491, 'epsilon': 0.002495410145750323}. Best is trial 973 with value: 0.1397919550170376.
[I 2024-12-04 00:18:10,486] Trial 1237 finished with value: 0.30056035825032873 and parameters: {'kernel': 'rbf', 'C': 13.56844891743765, 'gamma': 0.001972673792008027, 'epsilon': 0.0010111333163753571}. Best is trial 973 with value: 0.1397919550170376.
[I 2024-12-04 00:18:10,512] Trial 1233 finished with value: 0.1411029731678616 and parameters: {'kernel': 'rbf', 'C': 91.18912373934012, 'gamma': 0.009444172157572801, 'epsilon': 0.0010364361255437214}. Best is trial 973 with value: 0.1397919550170376.
[I 2024-12-04 00:18:10,516] Trial 1235 finished with value: 0.1498223811491066 and parameters: {'kernel': 'rbf', 'C': 97.09700340139752, 'gamma': 0.011675923736714515, 'epsilon': 0.0036211107935554417}. Best is trial 973 with value: 0.1397919550170376.
[I 2024-12-04 00:18:11,888] Trial 1236 finished with value: 0.19099020730894276 and parameters: {'kernel': 'rbf', 'C': 25.735624706869555, 'gamma': 0.0431939813749508, 'epsilon': 0.0010985110173818533}. Best is trial 973 with value: 0.1397919550170376.
[I 2024-12-04 00:18:12,622] Trial 1238 finished with value: 0.6053531167838421 and parameters: {'kernel': 'poly', 'C': 22.19462360239479, 'gamma': 0.010674318573549354, 'epsilon': 0.0011139443927103226}. Best is trial 973 with value: 0.1397919550170376.
[I 2024-12-04 00:18:13,127] Trial 1239 finished with value: 204.6200483617451 and parameters: {'kernel': 'sigmoid', 'C': 30.275910118101685, 'gamma': 0.0048128601429078465, 'epsilon': 0.0020769330624720965}. Best is trial 973 with value: 0.1397919550170376.
[I 2024-12-04 00:18:13,724] Trial 1242 finished with value: 0.4116271673664878 and parameters: {'kernel': 'rbf', 'C': 0.5699146720113126, 'gamma': 0.07181928456814278, 'epsilon': 0.4415429483310659}. Best is trial 973 with value: 0.1397919550170376.
[I 2024-12-04 00:18:17,654] Trial 1245 finished with value: 0.15829358306659813 and parameters: {'kernel': 'rbf', 'C': 21.254603404138, 'gamma': 0.014018943611737528, 'epsilon': 0.0010351907636207678}. Best is trial 973 with value: 0.1397919550170376.
[I 2024-12-04 00:18:17,949] Trial 1244 finished with value: 0.5946850955526719 and parameters: {'kernel': 'poly', 'C': 0.001060237943893326, 'gamma': 0.3110254799848954, 'epsilon': 0.18572184481076756}. Best is trial 973 with value: 0.1397919550170376.
[I 2024-12-04 00:18:19,006] Trial 1241 finished with value: 0.2127940712713405 and parameters: {'kernel': 'rbf', 'C': 93.499816713193, 'gamma': 0.06024935256583358, 'epsilon': 0.004523987701886423}. Best is trial 973 with value: 0.1397919550170376.
[I 2024-12-04 00:18:20,154] Trial 1240 finished with value: 0.17209223505996712 and parameters: {'kernel': 'rbf', 'C': 93.26833752250354, 'gamma': 0.020826219141162963, 'epsilon': 0.002334258396931919}. Best is trial 973 with value: 0.1397919550170376.
[I 2024-12-04 00:18:20,329] Trial 1247 finished with value: 0.9769779081510405 and parameters: {'kernel': 'rbf', 'C': 0.0013090498849845861, 'gamma': 0.004960393583261029, 'epsilon': 0.007394490777306587}. Best is trial 973 with value: 0.1397919550170376.
[I 2024-12-04 00:18:21,501] Trial 1243 finished with value: 0.17486880790399603 and parameters: {'kernel': 'rbf', 'C': 95.47211282298576, 'gamma': 0.023948990697617814, 'epsilon': 0.007868475229991425}. Best is trial 973 with value: 0.1397919550170376.
[I 2024-12-04 00:18:22,427] Trial 1246 finished with value: 0.19921516173865741 and parameters: {'kernel': 'rbf', 'C': 96.53344935208577, 'gamma': 0.0024695103946106964, 'epsilon': 0.0027866515021144128}. Best is trial 973 with value: 0.1397919550170376.
[I 2024-12-04 00:18:23,670] Trial 1249 finished with value: 0.15952664817484746 and parameters: {'kernel': 'rbf', 'C': 17.066969704185986, 'gamma': 0.016260292662567025, 'epsilon': 0.0025389457256897005}. Best is trial 973 with value: 0.1397919550170376.
[I 2024-12-04 00:18:23,670] Trial 1250 finished with value: 0.9474460795841356 and parameters: {'kernel': 'sigmoid', 'C': 0.09455501171965867, 'gamma': 0.00016164395433956082, 'epsilon': 0.0014584558367114764}. Best is trial 973 with value: 0.1397919550170376.
[I 2024-12-04 00:18:25,442] Trial 1252 finished with value: 0.20963543459485068 and parameters: {'kernel': 'rbf', 'C': 18.29925358694093, 'gamma': 0.008083655848865848, 'epsilon': 0.008490920228559417}. Best is trial 973 with value: 0.1397919550170376.
[I 2024-12-04 00:18:27,103] Trial 1253 finished with value: 0.1786980539374888 and parameters: {'kernel': 'rbf', 'C': 13.655459063841363, 'gamma': 0.014351811145377159, 'epsilon': 0.0010327813750081237}. Best is trial 973 with value: 0.1397919550170376.
[I 2024-12-04 00:18:27,160] Trial 1254 finished with value: 0.21255249249213237 and parameters: {'kernel': 'rbf', 'C': 88.56404516250007, 'gamma': 0.0021299041451335442, 'epsilon': 0.0011157367697636643}. Best is trial 973 with value: 0.1397919550170376.
[I 2024-12-04 00:18:28,835] Trial 1248 finished with value: 0.19967551505808645 and parameters: {'kernel': 'rbf', 'C': 80.5459950116535, 'gamma': 0.04530146886777539, 'epsilon': 0.0010191986807356226}. Best is trial 973 with value: 0.1397919550170376.
[I 2024-12-04 00:18:30,077] Trial 1255 finished with value: 0.15822866004844663 and parameters: {'kernel': 'rbf', 'C': 89.22748418647502, 'gamma': 0.004738221740069469, 'epsilon': 0.0010027511861294659}. Best is trial 973 with value: 0.1397919550170376.
[I 2024-12-04 00:18:31,155] Trial 1251 finished with value: 0.18259438513237533 and parameters: {'kernel': 'rbf', 'C': 71.04456097717507, 'gamma': 0.030847800990836737, 'epsilon': 0.001004980439732818}. Best is trial 973 with value: 0.1397919550170376.
[I 2024-12-04 00:18:32,066] Trial 1258 finished with value: 0.21316399925197596 and parameters: {'kernel': 'rbf', 'C': 21.885286958839455, 'gamma': 0.006652960352828977, 'epsilon': 0.003167001381488087}. Best is trial 973 with value: 0.1397919550170376.
[I 2024-12-04 00:18:33,324] Trial 1259 finished with value: 0.21925109746609747 and parameters: {'kernel': 'rbf', 'C': 98.64243325975737, 'gamma': 0.001677310827174841, 'epsilon': 0.0011820691052492425}. Best is trial 973 with value: 0.1397919550170376.
[I 2024-12-04 00:18:33,984] Trial 953 finished with value: 0.3523909379670047 and parameters: {'kernel': 'linear', 'C': 91.57774553246206, 'gamma': 0.00963760154153413, 'epsilon': 0.0011377880012521046}. Best is trial 973 with value: 0.1397919550170376.
[I 2024-12-04 00:18:34,050] Trial 1260 finished with value: 0.24799388083545873 and parameters: {'kernel': 'rbf', 'C': 21.112477805683877, 'gamma': 0.003934885307356954, 'epsilon': 0.004854226531528966}. Best is trial 973 with value: 0.1397919550170376.
[I 2024-12-04 00:18:34,406] Trial 1256 finished with value: 0.15012166246992398 and parameters: {'kernel': 'rbf', 'C': 99.73436059029467, 'gamma': 0.011537942306236249, 'epsilon': 0.0017804875683069753}. Best is trial 973 with value: 0.1397919550170376.
[I 2024-12-04 00:18:35,564] Trial 1262 finished with value: 0.28706392758085003 and parameters: {'kernel': 'rbf', 'C': 3.023252816730032, 'gamma': 0.15513054106140958, 'epsilon': 0.009138309345148365}. Best is trial 973 with value: 0.1397919550170376.
[I 2024-12-04 00:18:35,600] Trial 1257 finished with value: 0.18056289604346595 and parameters: {'kernel': 'rbf', 'C': 88.34641732711984, 'gamma': 0.027744341238312528, 'epsilon': 0.0022468680095473277}. Best is trial 973 with value: 0.1397919550170376.
[I 2024-12-04 00:18:36,587] Trial 1264 finished with value: 0.22992364128297887 and parameters: {'kernel': 'rbf', 'C': 13.382155947564776, 'gamma': 0.007895601565199965, 'epsilon': 0.002654750033661672}. Best is trial 973 with value: 0.1397919550170376.
[I 2024-12-04 00:18:37,135] Trial 1265 finished with value: 0.2361982431672687 and parameters: {'kernel': 'rbf', 'C': 91.7340161971676, 'gamma': 0.0012519548501390902, 'epsilon': 0.0026851428589235414}. Best is trial 973 with value: 0.1397919550170376.
[I 2024-12-04 00:18:38,036] Trial 1266 finished with value: 0.2370887663560825 and parameters: {'kernel': 'rbf', 'C': 18.771078192271094, 'gamma': 0.005303960699284242, 'epsilon': 0.001012249933315231}. Best is trial 973 with value: 0.1397919550170376.
[I 2024-12-04 00:18:38,543] Trial 1268 finished with value: 0.360156941452542 and parameters: {'kernel': 'rbf', 'C': 1.7346037775288734, 'gamma': 0.005447441849788504, 'epsilon': 0.0010537462317070144}. Best is trial 973 with value: 0.1397919550170376.
[I 2024-12-04 00:18:38,750] Trial 1261 finished with value: 0.34144265762947357 and parameters: {'kernel': 'linear', 'C': 1.537614241147899, 'gamma': 0.5788765936754938, 'epsilon': 0.0014450586049970199}. Best is trial 973 with value: 0.1397919550170376.
[I 2024-12-04 00:18:39,972] Trial 1269 finished with value: 0.16879439838962904 and parameters: {'kernel': 'rbf', 'C': 96.54738258401974, 'gamma': 0.0036984407747740478, 'epsilon': 0.004013542700121494}. Best is trial 973 with value: 0.1397919550170376.
[I 2024-12-04 00:18:40,787] Trial 1271 finished with value: 0.25543296003529914 and parameters: {'kernel': 'rbf', 'C': 18.980374656021183, 'gamma': 0.0036034371740914454, 'epsilon': 0.0022892153219857703}. Best is trial 973 with value: 0.1397919550170376.
[I 2024-12-04 00:18:40,930] Trial 1263 finished with value: 0.16993909136591917 and parameters: {'kernel': 'rbf', 'C': 98.75508765769335, 'gamma': 0.017118040484420182, 'epsilon': 0.001038133899838284}. Best is trial 973 with value: 0.1397919550170376.
[I 2024-12-04 00:18:40,964] Trial 1267 finished with value: 0.15488175084484337 and parameters: {'kernel': 'rbf', 'C': 97.93524440094453, 'gamma': 0.012548112125530026, 'epsilon': 0.003279489566824597}. Best is trial 973 with value: 0.1397919550170376.
[I 2024-12-04 00:18:41,665] Trial 1272 finished with value: 0.26843870429701616 and parameters: {'kernel': 'rbf', 'C': 18.266154434695785, 'gamma': 0.002678211016835071, 'epsilon': 0.0018329088741405454}. Best is trial 973 with value: 0.1397919550170376.
[I 2024-12-04 00:18:43,932] Trial 1275 finished with value: 1724.9412753905797 and parameters: {'kernel': 'sigmoid', 'C': 81.2689428465756, 'gamma': 0.027810274935853505, 'epsilon': 0.003126480243962138}. Best is trial 973 with value: 0.1397919550170376.
[I 2024-12-04 00:18:45,722] Trial 1274 finished with value: 0.158490764765462 and parameters: {'kernel': 'rbf', 'C': 87.02382567072414, 'gamma': 0.00477548695170106, 'epsilon': 0.002611643411357654}. Best is trial 973 with value: 0.1397919550170376.
[I 2024-12-04 00:18:46,356] Trial 1277 finished with value: 0.15297921005972365 and parameters: {'kernel': 'rbf', 'C': 18.773284764061312, 'gamma': 0.025841346348266698, 'epsilon': 0.0010594021637887491}. Best is trial 973 with value: 0.1397919550170376.
[I 2024-12-04 00:18:47,467] Trial 1276 finished with value: 0.1405352728170336 and parameters: {'kernel': 'rbf', 'C': 90.46030322867844, 'gamma': 0.007915236761016723, 'epsilon': 0.0012788854216842958}. Best is trial 973 with value: 0.1397919550170376.
[I 2024-12-04 00:18:49,264] Trial 1280 finished with value: 0.17209036517653445 and parameters: {'kernel': 'rbf', 'C': 14.525485868351165, 'gamma': 0.015209873474496158, 'epsilon': 0.002491272499041109}. Best is trial 973 with value: 0.1397919550170376.
[I 2024-12-04 00:18:50,307] Trial 1279 finished with value: 0.15105533488129233 and parameters: {'kernel': 'rbf', 'C': 99.72021948371058, 'gamma': 0.0052601332261371465, 'epsilon': 0.0017570125811838815}. Best is trial 973 with value: 0.1397919550170376.
[I 2024-12-04 00:18:50,307] Trial 1278 finished with value: 0.38326668406865577 and parameters: {'kernel': 'linear', 'C': 27.72229318191697, 'gamma': 0.6330580292199618, 'epsilon': 0.5465759718755188}. Best is trial 973 with value: 0.1397919550170376.
[I 2024-12-04 00:18:51,043] Trial 1281 finished with value: 0.623686342188425 and parameters: {'kernel': 'poly', 'C': 72.74442257975778, 'gamma': 0.006458234742340141, 'epsilon': 0.0013202327622688257}. Best is trial 973 with value: 0.1397919550170376.
[I 2024-12-04 00:18:52,359] Trial 1282 finished with value: 0.2052102887324445 and parameters: {'kernel': 'rbf', 'C': 80.98660697177573, 'gamma': 0.0025662879237992064, 'epsilon': 0.0010728974211776168}. Best is trial 973 with value: 0.1397919550170376.
[I 2024-12-04 00:18:53,006] Trial 1284 finished with value: 0.2564450713509067 and parameters: {'kernel': 'rbf', 'C': 20.38893343725829, 'gamma': 0.0032809701175955503, 'epsilon': 0.0021177766073412095}. Best is trial 973 with value: 0.1397919550170376.
[I 2024-12-04 00:18:54,026] Trial 1286 finished with value: 0.45016069959189886 and parameters: {'kernel': 'linear', 'C': 0.02898465672124404, 'gamma': 0.6650615691334397, 'epsilon': 0.4127171979950959}. Best is trial 973 with value: 0.1397919550170376.
[I 2024-12-04 00:18:54,654] Trial 1285 finished with value: 0.15936390291062014 and parameters: {'kernel': 'rbf', 'C': 26.955653098090856, 'gamma': 0.0109780709583879, 'epsilon': 0.0010010779146600276}. Best is trial 973 with value: 0.1397919550170376.
[I 2024-12-04 00:18:56,113] Trial 1283 finished with value: 0.14034832629966817 and parameters: {'kernel': 'rbf', 'C': 92.25473810256548, 'gamma': 0.007540379825008698, 'epsilon': 0.0010065437531259131}. Best is trial 973 with value: 0.1397919550170376.
[I 2024-12-04 00:18:58,292] Trial 1290 finished with value: 698.1713606119996 and parameters: {'kernel': 'sigmoid', 'C': 85.32327203756911, 'gamma': 0.00576290050393578, 'epsilon': 0.0019122628237672288}. Best is trial 973 with value: 0.1397919550170376.
