[I 2024-12-04 14:58:36,394] Trial 800 finished with value: 0.701165583196277 and parameters: {'n_estimators': 1296, 'learning_rate': 0.09642943107358408, 'max_depth': 10, 'min_samples_split': 15, 'min_samples_leaf': 3, 'subsample': 0.9736650711092638, 'max_features': None}. Best is trial 603 with value: 0.45955205541891275.
[I 2024-12-04 14:58:37,782] Trial 814 finished with value: 0.7447034419285448 and parameters: {'n_estimators': 1135, 'learning_rate': 0.04839802533437873, 'max_depth': 4, 'min_samples_split': 9, 'min_samples_leaf': 7, 'subsample': 0.7697753958176375, 'max_features': 'sqrt'}. Best is trial 603 with value: 0.45955205541891275.
[I 2024-12-04 14:58:40,810] Trial 804 finished with value: 0.6646424606753009 and parameters: {'n_estimators': 1354, 'learning_rate': 0.09957357014178995, 'max_depth': 12, 'min_samples_split': 16, 'min_samples_leaf': 3, 'subsample': 0.8883970139438548, 'max_features': None}. Best is trial 603 with value: 0.45955205541891275.
[I 2024-12-04 14:58:44,071] Trial 818 finished with value: 0.8106628513298105 and parameters: {'n_estimators': 1173, 'learning_rate': 0.04162314778431249, 'max_depth': 11, 'min_samples_split': 10, 'min_samples_leaf': 9, 'subsample': 0.7593254201844596, 'max_features': 'log2'}. Best is trial 603 with value: 0.45955205541891275.
[I 2024-12-04 14:58:44,740] Trial 802 finished with value: 0.48299994432767723 and parameters: {'n_estimators': 1479, 'learning_rate': 0.05346764603089476, 'max_depth': 12, 'min_samples_split': 19, 'min_samples_leaf': 1, 'subsample': 0.9053772343749908, 'max_features': None}. Best is trial 603 with value: 0.45955205541891275.
[I 2024-12-04 14:58:45,511] Trial 803 finished with value: 0.467937388267566 and parameters: {'n_estimators': 1447, 'learning_rate': 0.058523188522747925, 'max_depth': 12, 'min_samples_split': 19, 'min_samples_leaf': 1, 'subsample': 0.9837336000807356, 'max_features': None}. Best is trial 603 with value: 0.45955205541891275.
[I 2024-12-04 14:58:45,518] Trial 806 finished with value: 0.6687122593763395 and parameters: {'n_estimators': 1445, 'learning_rate': 0.08330176365363452, 'max_depth': 9, 'min_samples_split': 16, 'min_samples_leaf': 2, 'subsample': 0.917153176062327, 'max_features': None}. Best is trial 603 with value: 0.45955205541891275.
[I 2024-12-04 14:58:46,678] Trial 830 finished with value: 0.8643463541027756 and parameters: {'n_estimators': 587, 'learning_rate': 0.029860009437969175, 'max_depth': 3, 'min_samples_split': 2, 'min_samples_leaf': 6, 'subsample': 0.8216317897427913, 'max_features': 'log2'}. Best is trial 603 with value: 0.45955205541891275.
[I 2024-12-04 14:58:49,720] Trial 808 finished with value: 0.46546029407779294 and parameters: {'n_estimators': 1466, 'learning_rate': 0.06060329564267115, 'max_depth': 12, 'min_samples_split': 20, 'min_samples_leaf': 1, 'subsample': 0.9443432199350626, 'max_features': None}. Best is trial 603 with value: 0.45955205541891275.
[I 2024-12-04 14:58:49,727] Trial 820 finished with value: 0.5431534296648807 and parameters: {'n_estimators': 1344, 'learning_rate': 0.09355789463373214, 'max_depth': 11, 'min_samples_split': 15, 'min_samples_leaf': 1, 'subsample': 0.9450398477716456, 'max_features': 'log2'}. Best is trial 603 with value: 0.45955205541891275.
[I 2024-12-04 14:58:51,231] Trial 811 finished with value: 0.6369058648953722 and parameters: {'n_estimators': 1415, 'learning_rate': 0.07846388668773308, 'max_depth': 9, 'min_samples_split': 20, 'min_samples_leaf': 3, 'subsample': 0.9839772701554856, 'max_features': None}. Best is trial 603 with value: 0.45955205541891275.
[I 2024-12-04 14:58:52,272] Trial 813 finished with value: 0.48712070056094153 and parameters: {'n_estimators': 1379, 'learning_rate': 0.09553302965890585, 'max_depth': 8, 'min_samples_split': 16, 'min_samples_leaf': 1, 'subsample': 0.9486355618012963, 'max_features': None}. Best is trial 603 with value: 0.45955205541891275.
[I 2024-12-04 14:58:52,432] Trial 817 finished with value: 0.5618393109791664 and parameters: {'n_estimators': 1462, 'learning_rate': 0.0617832919855924, 'max_depth': 12, 'min_samples_split': 18, 'min_samples_leaf': 1, 'subsample': 0.9474422297329199, 'max_features': 'log2'}. Best is trial 603 with value: 0.45955205541891275.
[I 2024-12-04 14:58:52,695] Trial 815 finished with value: 0.6327191449315551 and parameters: {'n_estimators': 1222, 'learning_rate': 0.08143978020982993, 'max_depth': 12, 'min_samples_split': 19, 'min_samples_leaf': 2, 'subsample': 0.9465845366849948, 'max_features': None}. Best is trial 603 with value: 0.45955205541891275.
[I 2024-12-04 14:58:52,842] Trial 840 finished with value: 0.5981424155194173 and parameters: {'n_estimators': 177, 'learning_rate': 0.0785125183042681, 'max_depth': 5, 'min_samples_split': 5, 'min_samples_leaf': 1, 'subsample': 0.8903616658867525, 'max_features': 'sqrt'}. Best is trial 603 with value: 0.45955205541891275.
[I 2024-12-04 14:58:56,059] Trial 812 finished with value: 0.640041716612497 and parameters: {'n_estimators': 1362, 'learning_rate': 0.0843166553556672, 'max_depth': 11, 'min_samples_split': 18, 'min_samples_leaf': 2, 'subsample': 0.9622317999786768, 'max_features': None}. Best is trial 603 with value: 0.45955205541891275.
[I 2024-12-04 14:58:56,126] Trial 816 finished with value: 0.6464278156867143 and parameters: {'n_estimators': 1186, 'learning_rate': 0.09955178411713418, 'max_depth': 11, 'min_samples_split': 17, 'min_samples_leaf': 2, 'subsample': 0.9851372405986708, 'max_features': None}. Best is trial 603 with value: 0.45955205541891275.
[I 2024-12-04 14:58:56,174] Trial 827 finished with value: 0.6531285759762033 and parameters: {'n_estimators': 1182, 'learning_rate': 0.08819045715393586, 'max_depth': 7, 'min_samples_split': 2, 'min_samples_leaf': 4, 'subsample': 0.8937406350465253, 'max_features': 'log2'}. Best is trial 603 with value: 0.45955205541891275.
[I 2024-12-04 14:58:56,222] Trial 828 finished with value: 0.826753596188086 and parameters: {'n_estimators': 1120, 'learning_rate': 0.03585779687258508, 'max_depth': 3, 'min_samples_split': 13, 'min_samples_leaf': 9, 'subsample': 0.9711672062165199, 'max_features': 'sqrt'}. Best is trial 603 with value: 0.45955205541891275.
[I 2024-12-04 14:58:59,601] Trial 823 finished with value: 0.4722045810355099 and parameters: {'n_estimators': 1237, 'learning_rate': 0.09965334564450383, 'max_depth': 12, 'min_samples_split': 20, 'min_samples_leaf': 1, 'subsample': 0.959782749946194, 'max_features': None}. Best is trial 603 with value: 0.45955205541891275.
[I 2024-12-04 14:58:59,654] Trial 824 finished with value: 0.6579860605883661 and parameters: {'n_estimators': 1254, 'learning_rate': 0.09540104934603766, 'max_depth': 10, 'min_samples_split': 19, 'min_samples_leaf': 2, 'subsample': 0.9743683081552867, 'max_features': None}. Best is trial 603 with value: 0.45955205541891275.
[I 2024-12-04 14:58:59,891] Trial 844 finished with value: 0.752647544988168 and parameters: {'n_estimators': 327, 'learning_rate': 0.060922605855405584, 'max_depth': 12, 'min_samples_split': 2, 'min_samples_leaf': 7, 'subsample': 0.6540928839211455, 'max_features': 'sqrt'}. Best is trial 603 with value: 0.45955205541891275.
[I 2024-12-04 14:58:59,959] Trial 819 finished with value: 0.48815285587079477 and parameters: {'n_estimators': 1290, 'learning_rate': 0.08425509097059052, 'max_depth': 10, 'min_samples_split': 20, 'min_samples_leaf': 1, 'subsample': 0.947712680101763, 'max_features': None}. Best is trial 603 with value: 0.45955205541891275.
[I 2024-12-04 14:58:59,987] Trial 850 finished with value: 0.7355891402706105 and parameters: {'n_estimators': 115, 'learning_rate': 0.025556816607142447, 'max_depth': 7, 'min_samples_split': 8, 'min_samples_leaf': 1, 'subsample': 0.6801948350615169, 'max_features': 'sqrt'}. Best is trial 603 with value: 0.45955205541891275.
[I 2024-12-04 14:59:00,745] Trial 826 finished with value: 0.5010016920814895 and parameters: {'n_estimators': 1266, 'learning_rate': 0.08345282602597756, 'max_depth': 11, 'min_samples_split': 17, 'min_samples_leaf': 1, 'subsample': 0.9910937599785109, 'max_features': None}. Best is trial 603 with value: 0.45955205541891275.
[I 2024-12-04 14:59:01,632] Trial 833 finished with value: 1.000454847642032 and parameters: {'n_estimators': 875, 'learning_rate': 0.021675724132181728, 'max_depth': 8, 'min_samples_split': 14, 'min_samples_leaf': 10, 'subsample': 0.7516779229498083, 'max_features': 'log2'}. Best is trial 603 with value: 0.45955205541891275.
[I 2024-12-04 14:59:02,744] Trial 822 finished with value: 0.4768547534587858 and parameters: {'n_estimators': 1370, 'learning_rate': 0.08226342776199297, 'max_depth': 12, 'min_samples_split': 20, 'min_samples_leaf': 1, 'subsample': 0.9376641735077803, 'max_features': None}. Best is trial 603 with value: 0.45955205541891275.
[I 2024-12-04 14:59:03,235] Trial 834 finished with value: 0.6925299034781289 and parameters: {'n_estimators': 873, 'learning_rate': 0.03204645227306857, 'max_depth': 4, 'min_samples_split': 12, 'min_samples_leaf': 2, 'subsample': 0.6210858138120922, 'max_features': 'log2'}. Best is trial 603 with value: 0.45955205541891275.
[I 2024-12-04 14:59:04,997] Trial 821 finished with value: 0.6606507725603231 and parameters: {'n_estimators': 1496, 'learning_rate': 0.08962993868267215, 'max_depth': 12, 'min_samples_split': 17, 'min_samples_leaf': 3, 'subsample': 0.9752160062575952, 'max_features': None}. Best is trial 603 with value: 0.45955205541891275.
[I 2024-12-04 14:59:05,273] Trial 825 finished with value: 0.6514138350296435 and parameters: {'n_estimators': 1328, 'learning_rate': 0.09095420132217102, 'max_depth': 11, 'min_samples_split': 18, 'min_samples_leaf': 2, 'subsample': 0.9992189871885131, 'max_features': None}. Best is trial 603 with value: 0.45955205541891275.
[I 2024-12-04 14:59:06,911] Trial 855 finished with value: 1.1447394953538232 and parameters: {'n_estimators': 216, 'learning_rate': 0.04864642702239138, 'max_depth': 6, 'min_samples_split': 6, 'min_samples_leaf': 10, 'subsample': 0.6498982080001965, 'max_features': 'log2'}. Best is trial 603 with value: 0.45955205541891275.
[I 2024-12-04 14:59:08,458] Trial 831 finished with value: 0.8015201596022863 and parameters: {'n_estimators': 1345, 'learning_rate': 0.025668341568256852, 'max_depth': 7, 'min_samples_split': 19, 'min_samples_leaf': 9, 'subsample': 0.6604599903557515, 'max_features': 'sqrt'}. Best is trial 603 with value: 0.45955205541891275.
[I 2024-12-04 14:59:10,887] Trial 832 finished with value: 0.5770348250164923 and parameters: {'n_estimators': 1282, 'learning_rate': 0.06564516490459166, 'max_depth': 6, 'min_samples_split': 18, 'min_samples_leaf': 1, 'subsample': 0.997228130455606, 'max_features': 'log2'}. Best is trial 603 with value: 0.45955205541891275.
[I 2024-12-04 14:59:10,903] Trial 857 finished with value: 0.7005628431128929 and parameters: {'n_estimators': 206, 'learning_rate': 0.032032403387086066, 'max_depth': 7, 'min_samples_split': 8, 'min_samples_leaf': 10, 'subsample': 0.9708736841647068, 'max_features': None}. Best is trial 603 with value: 0.45955205541891275.
[I 2024-12-04 14:59:13,336] Trial 864 finished with value: 0.6767736455343659 and parameters: {'n_estimators': 182, 'learning_rate': 0.03289466411166589, 'max_depth': 3, 'min_samples_split': 2, 'min_samples_leaf': 10, 'subsample': 0.8399872571854837, 'max_features': None}. Best is trial 603 with value: 0.45955205541891275.
[I 2024-12-04 14:59:14,139] Trial 837 finished with value: 0.4716794642178127 and parameters: {'n_estimators': 988, 'learning_rate': 0.09249721584109692, 'max_depth': 12, 'min_samples_split': 20, 'min_samples_leaf': 1, 'subsample': 0.9818105739510771, 'max_features': None}. Best is trial 603 with value: 0.45955205541891275.
[I 2024-12-04 14:59:15,524] Trial 836 finished with value: 0.4985187099543601 and parameters: {'n_estimators': 1051, 'learning_rate': 0.09514991935711771, 'max_depth': 12, 'min_samples_split': 17, 'min_samples_leaf': 1, 'subsample': 0.9841949364881948, 'max_features': None}. Best is trial 603 with value: 0.45955205541891275.
[I 2024-12-04 14:59:17,467] Trial 829 finished with value: 0.6530603808356618 and parameters: {'n_estimators': 1496, 'learning_rate': 0.09113749808211292, 'max_depth': 12, 'min_samples_split': 19, 'min_samples_leaf': 2, 'subsample': 0.9182573440981602, 'max_features': None}. Best is trial 603 with value: 0.45955205541891275.
[I 2024-12-04 14:59:18,511] Trial 835 finished with value: 0.4895586730193553 and parameters: {'n_estimators': 1222, 'learning_rate': 0.06884444517898755, 'max_depth': 9, 'min_samples_split': 20, 'min_samples_leaf': 1, 'subsample': 0.9936935645171929, 'max_features': None}. Best is trial 603 with value: 0.45955205541891275.
[I 2024-12-04 14:59:21,843] Trial 838 finished with value: 0.6903394312824076 and parameters: {'n_estimators': 1302, 'learning_rate': 0.05096393355554695, 'max_depth': 12, 'min_samples_split': 14, 'min_samples_leaf': 3, 'subsample': 0.9245186965262137, 'max_features': None}. Best is trial 603 with value: 0.45955205541891275.
[I 2024-12-04 14:59:23,527] Trial 851 finished with value: 0.5708196246359003 and parameters: {'n_estimators': 1001, 'learning_rate': 0.010830552852398638, 'max_depth': 3, 'min_samples_split': 7, 'min_samples_leaf': 1, 'subsample': 0.9142138422174781, 'max_features': None}. Best is trial 603 with value: 0.45955205541891275.
[I 2024-12-04 14:59:26,128] Trial 869 finished with value: 0.8051790076152789 and parameters: {'n_estimators': 587, 'learning_rate': 0.07208777662385034, 'max_depth': 5, 'min_samples_split': 5, 'min_samples_leaf': 10, 'subsample': 0.8929995588291226, 'max_features': 'log2'}. Best is trial 603 with value: 0.45955205541891275.
[I 2024-12-04 14:59:26,173] Trial 839 finished with value: 0.4875763196032357 and parameters: {'n_estimators': 1407, 'learning_rate': 0.09463027097496732, 'max_depth': 9, 'min_samples_split': 18, 'min_samples_leaf': 1, 'subsample': 0.9679848687251581, 'max_features': None}. Best is trial 603 with value: 0.45955205541891275.
[I 2024-12-04 14:59:28,359] Trial 871 finished with value: 0.692645692606434 and parameters: {'n_estimators': 497, 'learning_rate': 0.010428873630159584, 'max_depth': 7, 'min_samples_split': 17, 'min_samples_leaf': 9, 'subsample': 0.662604747734119, 'max_features': None}. Best is trial 603 with value: 0.45955205541891275.
[I 2024-12-04 14:59:29,453] Trial 842 finished with value: 0.49249242615605865 and parameters: {'n_estimators': 1246, 'learning_rate': 0.08742629853089477, 'max_depth': 11, 'min_samples_split': 19, 'min_samples_leaf': 1, 'subsample': 0.9597055675056867, 'max_features': None}. Best is trial 603 with value: 0.45955205541891275.
[I 2024-12-04 14:59:33,434] Trial 841 finished with value: 0.4770010573861721 and parameters: {'n_estimators': 1452, 'learning_rate': 0.07816563207828874, 'max_depth': 12, 'min_samples_split': 18, 'min_samples_leaf': 1, 'subsample': 0.9809608808389214, 'max_features': None}. Best is trial 603 with value: 0.45955205541891275.
[I 2024-12-04 14:59:33,466] Trial 843 finished with value: 0.5020525531993693 and parameters: {'n_estimators': 1425, 'learning_rate': 0.08807404704245894, 'max_depth': 10, 'min_samples_split': 18, 'min_samples_leaf': 1, 'subsample': 0.9525660895010908, 'max_features': None}. Best is trial 603 with value: 0.45955205541891275.
[I 2024-12-04 14:59:34,296] Trial 853 finished with value: 0.6815885093030737 and parameters: {'n_estimators': 1466, 'learning_rate': 0.08249417100995712, 'max_depth': 11, 'min_samples_split': 20, 'min_samples_leaf': 2, 'subsample': 0.9621628471652103, 'max_features': 'sqrt'}. Best is trial 603 with value: 0.45955205541891275.
[I 2024-12-04 14:59:36,841] Trial 847 finished with value: 0.6514803241841491 and parameters: {'n_estimators': 1389, 'learning_rate': 0.061944964159295096, 'max_depth': 11, 'min_samples_split': 20, 'min_samples_leaf': 2, 'subsample': 0.9717655989920033, 'max_features': None}. Best is trial 603 with value: 0.45955205541891275.
[I 2024-12-04 14:59:38,847] Trial 845 finished with value: 0.4797360639809586 and parameters: {'n_estimators': 1483, 'learning_rate': 0.0580846339041335, 'max_depth': 12, 'min_samples_split': 20, 'min_samples_leaf': 1, 'subsample': 0.9326164862521565, 'max_features': None}. Best is trial 603 with value: 0.45955205541891275.
[I 2024-12-04 14:59:38,850] Trial 849 finished with value: 0.6428192088029013 and parameters: {'n_estimators': 1376, 'learning_rate': 0.04398566993920924, 'max_depth': 11, 'min_samples_split': 17, 'min_samples_leaf': 3, 'subsample': 0.9837401729811637, 'max_features': None}. Best is trial 603 with value: 0.45955205541891275.
[I 2024-12-04 14:59:38,866] Trial 846 finished with value: 0.4931764212799946 and parameters: {'n_estimators': 1465, 'learning_rate': 0.05787322437151785, 'max_depth': 12, 'min_samples_split': 17, 'min_samples_leaf': 1, 'subsample': 0.9399661631335069, 'max_features': None}. Best is trial 603 with value: 0.45955205541891275.
[I 2024-12-04 14:59:40,244] Trial 848 finished with value: 0.46523731789980244 and parameters: {'n_estimators': 1349, 'learning_rate': 0.047770446734607785, 'max_depth': 12, 'min_samples_split': 20, 'min_samples_leaf': 1, 'subsample': 0.998284515532822, 'max_features': None}. Best is trial 603 with value: 0.45955205541891275.
[I 2024-12-04 14:59:41,205] Trial 854 finished with value: 0.4855702306641703 and parameters: {'n_estimators': 1331, 'learning_rate': 0.09297827777051697, 'max_depth': 11, 'min_samples_split': 20, 'min_samples_leaf': 1, 'subsample': 0.9836205483660257, 'max_features': None}. Best is trial 603 with value: 0.45955205541891275.
[I 2024-12-04 14:59:41,527] Trial 858 finished with value: 0.4840415000409146 and parameters: {'n_estimators': 1189, 'learning_rate': 0.07382498701778974, 'max_depth': 12, 'min_samples_split': 19, 'min_samples_leaf': 1, 'subsample': 0.9795612218250312, 'max_features': None}. Best is trial 603 with value: 0.45955205541891275.
[I 2024-12-04 14:59:44,071] Trial 852 finished with value: 0.47412456986001716 and parameters: {'n_estimators': 1364, 'learning_rate': 0.06551122478823013, 'max_depth': 11, 'min_samples_split': 20, 'min_samples_leaf': 1, 'subsample': 0.9788511888181964, 'max_features': None}. Best is trial 603 with value: 0.45955205541891275.
[I 2024-12-04 14:59:44,801] Trial 856 finished with value: 0.6360817587893082 and parameters: {'n_estimators': 1279, 'learning_rate': 0.05959659620060477, 'max_depth': 11, 'min_samples_split': 19, 'min_samples_leaf': 2, 'subsample': 0.9951420766874437, 'max_features': None}. Best is trial 603 with value: 0.45955205541891275.
[I 2024-12-04 14:59:46,036] Trial 863 finished with value: 0.6550917512155151 and parameters: {'n_estimators': 1200, 'learning_rate': 0.06773421269336848, 'max_depth': 12, 'min_samples_split': 14, 'min_samples_leaf': 2, 'subsample': 0.9897364595599879, 'max_features': None}. Best is trial 603 with value: 0.45955205541891275.
[I 2024-12-04 14:59:48,570] Trial 872 finished with value: 0.5366355342277208 and parameters: {'n_estimators': 1334, 'learning_rate': 0.0998015930017686, 'max_depth': 12, 'min_samples_split': 17, 'min_samples_leaf': 1, 'subsample': 0.9926792526951637, 'max_features': 'sqrt'}. Best is trial 603 with value: 0.45955205541891275.
[I 2024-12-04 14:59:48,578] Trial 873 finished with value: 0.6803005356451867 and parameters: {'n_estimators': 1369, 'learning_rate': 0.09431441673449788, 'max_depth': 12, 'min_samples_split': 17, 'min_samples_leaf': 5, 'subsample': 0.9929574902182969, 'max_features': 'log2'}. Best is trial 603 with value: 0.45955205541891275.
[I 2024-12-04 14:59:49,134] Trial 874 finished with value: 0.6774466586330576 and parameters: {'n_estimators': 1008, 'learning_rate': 0.07464675732405167, 'max_depth': 8, 'min_samples_split': 15, 'min_samples_leaf': 3, 'subsample': 0.9767080615334597, 'max_features': None}. Best is trial 603 with value: 0.45955205541891275.
[I 2024-12-04 14:59:50,333] Trial 870 finished with value: 0.4743569921967081 and parameters: {'n_estimators': 1182, 'learning_rate': 0.07399340985769283, 'max_depth': 12, 'min_samples_split': 20, 'min_samples_leaf': 1, 'subsample': 0.9642683037834255, 'max_features': None}. Best is trial 603 with value: 0.45955205541891275.
[I 2024-12-04 14:59:50,967] Trial 865 finished with value: 0.48033890690210407 and parameters: {'n_estimators': 1296, 'learning_rate': 0.09964778592993162, 'max_depth': 10, 'min_samples_split': 20, 'min_samples_leaf': 1, 'subsample': 0.9782289440744492, 'max_features': None}. Best is trial 603 with value: 0.45955205541891275.
[I 2024-12-04 14:59:51,201] Trial 868 finished with value: 0.4617705851481484 and parameters: {'n_estimators': 1249, 'learning_rate': 0.07995803096666482, 'max_depth': 12, 'min_samples_split': 19, 'min_samples_leaf': 1, 'subsample': 0.964751590371811, 'max_features': None}. Best is trial 603 with value: 0.45955205541891275.
[I 2024-12-04 14:59:51,528] Trial 859 finished with value: 0.6496254815958702 and parameters: {'n_estimators': 1423, 'learning_rate': 0.056231528751324276, 'max_depth': 12, 'min_samples_split': 17, 'min_samples_leaf': 3, 'subsample': 0.9537037379881768, 'max_features': None}. Best is trial 603 with value: 0.45955205541891275.
[I 2024-12-04 14:59:52,626] Trial 862 finished with value: 0.48537143986482817 and parameters: {'n_estimators': 1398, 'learning_rate': 0.053784935407303246, 'max_depth': 10, 'min_samples_split': 18, 'min_samples_leaf': 1, 'subsample': 0.9881642030759498, 'max_features': None}. Best is trial 603 with value: 0.45955205541891275.
[I 2024-12-04 14:59:53,215] Trial 866 finished with value: 0.47670596747353744 and parameters: {'n_estimators': 1344, 'learning_rate': 0.04388674574049504, 'max_depth': 12, 'min_samples_split': 17, 'min_samples_leaf': 1, 'subsample': 0.9383340186285367, 'max_features': None}. Best is trial 603 with value: 0.45955205541891275.
