[I 2024-12-04 12:31:17,099] Trial 533 finished with value: 0.3750279304011645 and parameters: {'n_estimators': 1343, 'learning_rate': 0.013254042917533767, 'max_depth': 12, 'min_samples_split': 19, 'min_samples_leaf': 4, 'subsample': 0.8122711821606331, 'max_features': 'sqrt'}. Best is trial 360 with value: 0.2288165351387474.
[I 2024-12-04 12:31:17,496] Trial 535 finished with value: 0.2518077561635404 and parameters: {'n_estimators': 1284, 'learning_rate': 0.043601678918818824, 'max_depth': 12, 'min_samples_split': 2, 'min_samples_leaf': 1, 'subsample': 0.7727252951117354, 'max_features': 'sqrt'}. Best is trial 360 with value: 0.2288165351387474.
[I 2024-12-04 12:31:19,683] Trial 532 finished with value: 0.31433046036413226 and parameters: {'n_estimators': 1412, 'learning_rate': 0.018101518014617325, 'max_depth': 11, 'min_samples_split': 5, 'min_samples_leaf': 1, 'subsample': 0.7699032171726323, 'max_features': 'log2'}. Best is trial 360 with value: 0.2288165351387474.
[I 2024-12-04 12:31:22,594] Trial 538 finished with value: 0.28425391644642933 and parameters: {'n_estimators': 1239, 'learning_rate': 0.060715071192927295, 'max_depth': 7, 'min_samples_split': 5, 'min_samples_leaf': 2, 'subsample': 0.7315449180998287, 'max_features': 'sqrt'}. Best is trial 360 with value: 0.2288165351387474.
[I 2024-12-04 12:31:22,606] Trial 534 finished with value: 0.2998138528790836 and parameters: {'n_estimators': 1382, 'learning_rate': 0.07040560774371904, 'max_depth': 9, 'min_samples_split': 2, 'min_samples_leaf': 2, 'subsample': 0.6524909496286937, 'max_features': 'sqrt'}. Best is trial 360 with value: 0.2288165351387474.
[I 2024-12-04 12:31:28,308] Trial 539 finished with value: 0.262413793534954 and parameters: {'n_estimators': 1276, 'learning_rate': 0.02995046129977536, 'max_depth': 8, 'min_samples_split': 2, 'min_samples_leaf': 1, 'subsample': 0.6017627878125699, 'max_features': 'sqrt'}. Best is trial 360 with value: 0.2288165351387474.
[I 2024-12-04 12:31:30,978] Trial 537 finished with value: 0.369491133185056 and parameters: {'n_estimators': 1455, 'learning_rate': 0.03619543424083168, 'max_depth': 11, 'min_samples_split': 4, 'min_samples_leaf': 3, 'subsample': 0.769195527557401, 'max_features': 'sqrt'}. Best is trial 360 with value: 0.2288165351387474.
[I 2024-12-04 12:31:31,918] Trial 550 finished with value: 0.2464716578214457 and parameters: {'n_estimators': 944, 'learning_rate': 0.07924734914764298, 'max_depth': 10, 'min_samples_split': 2, 'min_samples_leaf': 1, 'subsample': 0.8937232632830076, 'max_features': 'sqrt'}. Best is trial 360 with value: 0.2288165351387474.
[I 2024-12-04 12:31:31,920] Trial 536 finished with value: 0.27952527911291825 and parameters: {'n_estimators': 1474, 'learning_rate': 0.06516350716269247, 'max_depth': 10, 'min_samples_split': 2, 'min_samples_leaf': 1, 'subsample': 0.7810339018345773, 'max_features': 'sqrt'}. Best is trial 360 with value: 0.2288165351387474.
[I 2024-12-04 12:31:32,678] Trial 543 finished with value: 0.3568163860989234 and parameters: {'n_estimators': 1239, 'learning_rate': 0.04951526732698723, 'max_depth': 11, 'min_samples_split': 2, 'min_samples_leaf': 3, 'subsample': 0.6681232860992063, 'max_features': 'sqrt'}. Best is trial 360 with value: 0.2288165351387474.
[I 2024-12-04 12:31:40,182] Trial 540 finished with value: 0.2524121524546594 and parameters: {'n_estimators': 1470, 'learning_rate': 0.0340973798596526, 'max_depth': 11, 'min_samples_split': 4, 'min_samples_leaf': 1, 'subsample': 0.7163982217118734, 'max_features': 'sqrt'}. Best is trial 360 with value: 0.2288165351387474.
[I 2024-12-04 12:31:47,652] Trial 555 finished with value: 0.4031970757552469 and parameters: {'n_estimators': 985, 'learning_rate': 0.06364617112292256, 'max_depth': 12, 'min_samples_split': 7, 'min_samples_leaf': 6, 'subsample': 0.6069360809053845, 'max_features': None}. Best is trial 360 with value: 0.2288165351387474.
[I 2024-12-04 12:31:50,339] Trial 547 finished with value: 0.6466750896055905 and parameters: {'n_estimators': 1413, 'learning_rate': 0.05254825510912006, 'max_depth': 7, 'min_samples_split': 18, 'min_samples_leaf': 10, 'subsample': 0.6051212768978407, 'max_features': 'log2'}. Best is trial 360 with value: 0.2288165351387474.
[I 2024-12-04 12:31:51,285] Trial 545 finished with value: 0.24904001813079796 and parameters: {'n_estimators': 1413, 'learning_rate': 0.05832082451564712, 'max_depth': 8, 'min_samples_split': 2, 'min_samples_leaf': 1, 'subsample': 0.6705357507603694, 'max_features': 'sqrt'}. Best is trial 360 with value: 0.2288165351387474.
[I 2024-12-04 12:31:52,749] Trial 546 finished with value: 0.24607489244642022 and parameters: {'n_estimators': 1426, 'learning_rate': 0.07578385120478313, 'max_depth': 12, 'min_samples_split': 5, 'min_samples_leaf': 1, 'subsample': 0.7116116564713141, 'max_features': 'sqrt'}. Best is trial 360 with value: 0.2288165351387474.
[I 2024-12-04 12:31:58,636] Trial 548 finished with value: 0.30069589402120306 and parameters: {'n_estimators': 1499, 'learning_rate': 0.09237847933852182, 'max_depth': 9, 'min_samples_split': 4, 'min_samples_leaf': 2, 'subsample': 0.6317024599840936, 'max_features': 'sqrt'}. Best is trial 360 with value: 0.2288165351387474.
[I 2024-12-04 12:32:00,339] Trial 549 finished with value: 0.2978301167452482 and parameters: {'n_estimators': 1453, 'learning_rate': 0.049697470659732984, 'max_depth': 12, 'min_samples_split': 3, 'min_samples_leaf': 2, 'subsample': 0.6916171553068405, 'max_features': 'sqrt'}. Best is trial 360 with value: 0.2288165351387474.
[I 2024-12-04 12:32:02,047] Trial 553 finished with value: 0.2995762340830959 and parameters: {'n_estimators': 1347, 'learning_rate': 0.06983471491079431, 'max_depth': 6, 'min_samples_split': 3, 'min_samples_leaf': 2, 'subsample': 0.7897780577293545, 'max_features': 'sqrt'}. Best is trial 360 with value: 0.2288165351387474.
[I 2024-12-04 12:32:04,363] Trial 551 finished with value: 0.28327224746813623 and parameters: {'n_estimators': 1472, 'learning_rate': 0.05400501947207774, 'max_depth': 10, 'min_samples_split': 5, 'min_samples_leaf': 2, 'subsample': 0.6365607497911402, 'max_features': 'sqrt'}. Best is trial 360 with value: 0.2288165351387474.
[I 2024-12-04 12:32:07,648] Trial 557 finished with value: 0.3660915739020131 and parameters: {'n_estimators': 1318, 'learning_rate': 0.03680993245680147, 'max_depth': 9, 'min_samples_split': 2, 'min_samples_leaf': 4, 'subsample': 0.8582344426878257, 'max_features': 'sqrt'}. Best is trial 360 with value: 0.2288165351387474.
[I 2024-12-04 12:32:07,658] Trial 554 finished with value: 0.24517827722026375 and parameters: {'n_estimators': 1417, 'learning_rate': 0.07217927569663155, 'max_depth': 12, 'min_samples_split': 2, 'min_samples_leaf': 1, 'subsample': 0.621079362044816, 'max_features': 'sqrt'}. Best is trial 360 with value: 0.2288165351387474.
[I 2024-12-04 12:32:10,833] Trial 568 finished with value: 0.9562333535825972 and parameters: {'n_estimators': 766, 'learning_rate': 0.013082275311841201, 'max_depth': 3, 'min_samples_split': 2, 'min_samples_leaf': 7, 'subsample': 0.9957146167414153, 'max_features': 'log2'}. Best is trial 360 with value: 0.2288165351387474.
[I 2024-12-04 12:32:14,952] Trial 558 finished with value: 0.2329479744437774 and parameters: {'n_estimators': 1389, 'learning_rate': 0.09761692354257875, 'max_depth': 7, 'min_samples_split': 3, 'min_samples_leaf': 1, 'subsample': 0.6936439824866283, 'max_features': 'sqrt'}. Best is trial 360 with value: 0.2288165351387474.
[I 2024-12-04 12:32:15,037] Trial 561 finished with value: 0.30694039620324665 and parameters: {'n_estimators': 1189, 'learning_rate': 0.048149576722342234, 'max_depth': 10, 'min_samples_split': 8, 'min_samples_leaf': 2, 'subsample': 0.6548346416412067, 'max_features': 'sqrt'}. Best is trial 360 with value: 0.2288165351387474.
[I 2024-12-04 12:32:16,765] Trial 552 finished with value: 0.3189780840588074 and parameters: {'n_estimators': 1487, 'learning_rate': 0.03730579729817334, 'max_depth': 7, 'min_samples_split': 4, 'min_samples_leaf': 1, 'subsample': 0.696017519626312, 'max_features': None}. Best is trial 360 with value: 0.2288165351387474.
[I 2024-12-04 12:32:17,141] Trial 559 finished with value: 0.25296597826647405 and parameters: {'n_estimators': 1430, 'learning_rate': 0.0946780586211538, 'max_depth': 6, 'min_samples_split': 4, 'min_samples_leaf': 1, 'subsample': 0.6218183051520142, 'max_features': 'sqrt'}. Best is trial 360 with value: 0.2288165351387474.
[I 2024-12-04 12:32:22,336] Trial 562 finished with value: 0.3839292529865196 and parameters: {'n_estimators': 1246, 'learning_rate': 0.09006126126153241, 'max_depth': 12, 'min_samples_split': 10, 'min_samples_leaf': 5, 'subsample': 0.6319341781142933, 'max_features': 'sqrt'}. Best is trial 360 with value: 0.2288165351387474.
[I 2024-12-04 12:32:28,216] Trial 560 finished with value: 0.7448195535277309 and parameters: {'n_estimators': 1463, 'learning_rate': 0.021916468487244573, 'max_depth': 9, 'min_samples_split': 8, 'min_samples_leaf': 8, 'subsample': 0.6962961508765104, 'max_features': 'log2'}. Best is trial 360 with value: 0.2288165351387474.
[I 2024-12-04 12:32:31,073] Trial 564 finished with value: 0.24678927874640674 and parameters: {'n_estimators': 1263, 'learning_rate': 0.0496467489239222, 'max_depth': 12, 'min_samples_split': 3, 'min_samples_leaf': 1, 'subsample': 0.7499267618493588, 'max_features': 'log2'}. Best is trial 360 with value: 0.2288165351387474.
[I 2024-12-04 12:32:31,221] Trial 565 finished with value: 0.25485063980092576 and parameters: {'n_estimators': 1219, 'learning_rate': 0.06054514098065335, 'max_depth': 11, 'min_samples_split': 2, 'min_samples_leaf': 1, 'subsample': 0.62909844113958, 'max_features': 'sqrt'}. Best is trial 360 with value: 0.2288165351387474.
[I 2024-12-04 12:32:32,725] Trial 581 finished with value: 0.48707770961432684 and parameters: {'n_estimators': 541, 'learning_rate': 0.018164095975159878, 'max_depth': 8, 'min_samples_split': 2, 'min_samples_leaf': 9, 'subsample': 0.920887487481132, 'max_features': None}. Best is trial 360 with value: 0.2288165351387474.
[I 2024-12-04 12:32:37,457] Trial 573 finished with value: 0.3012566739996875 and parameters: {'n_estimators': 1057, 'learning_rate': 0.07466719974178201, 'max_depth': 9, 'min_samples_split': 2, 'min_samples_leaf': 2, 'subsample': 0.6637301594367061, 'max_features': 'sqrt'}. Best is trial 360 with value: 0.2288165351387474.
[I 2024-12-04 12:32:38,172] Trial 563 finished with value: 0.24798226399989398 and parameters: {'n_estimators': 1432, 'learning_rate': 0.03797182248978317, 'max_depth': 10, 'min_samples_split': 4, 'min_samples_leaf': 1, 'subsample': 0.6168379828333728, 'max_features': 'sqrt'}. Best is trial 360 with value: 0.2288165351387474.
[I 2024-12-04 12:32:40,240] Trial 566 finished with value: 0.26445883477291837 and parameters: {'n_estimators': 1319, 'learning_rate': 0.05418943857509709, 'max_depth': 9, 'min_samples_split': 5, 'min_samples_leaf': 1, 'subsample': 0.6237572351693422, 'max_features': 'sqrt'}. Best is trial 360 with value: 0.2288165351387474.
[I 2024-12-04 12:32:42,403] Trial 571 finished with value: 0.2568882283817701 and parameters: {'n_estimators': 1175, 'learning_rate': 0.05477867002082143, 'max_depth': 6, 'min_samples_split': 2, 'min_samples_leaf': 1, 'subsample': 0.832558889045437, 'max_features': 'sqrt'}. Best is trial 360 with value: 0.2288165351387474.
[I 2024-12-04 12:32:48,576] Trial 570 finished with value: 0.2563866020384595 and parameters: {'n_estimators': 1323, 'learning_rate': 0.07368131512830892, 'max_depth': 10, 'min_samples_split': 4, 'min_samples_leaf': 1, 'subsample': 0.6576818784948205, 'max_features': 'sqrt'}. Best is trial 360 with value: 0.2288165351387474.
[I 2024-12-04 12:32:49,501] Trial 572 finished with value: 0.23972207704269294 and parameters: {'n_estimators': 1263, 'learning_rate': 0.061352953413664736, 'max_depth': 10, 'min_samples_split': 2, 'min_samples_leaf': 1, 'subsample': 0.6536851900607938, 'max_features': 'sqrt'}. Best is trial 360 with value: 0.2288165351387474.
[I 2024-12-04 12:32:52,400] Trial 584 finished with value: 0.4223478395683478 and parameters: {'n_estimators': 762, 'learning_rate': 0.030986624021487087, 'max_depth': 9, 'min_samples_split': 2, 'min_samples_leaf': 2, 'subsample': 0.6231656679782346, 'max_features': 'log2'}. Best is trial 360 with value: 0.2288165351387474.
[I 2024-12-04 12:32:52,771] Trial 578 finished with value: 0.23713558957615608 and parameters: {'n_estimators': 1117, 'learning_rate': 0.09066958784353926, 'max_depth': 6, 'min_samples_split': 2, 'min_samples_leaf': 1, 'subsample': 0.6550913334696954, 'max_features': 'sqrt'}. Best is trial 360 with value: 0.2288165351387474.
[I 2024-12-04 12:32:54,602] Trial 569 finished with value: 0.2571290928084493 and parameters: {'n_estimators': 1477, 'learning_rate': 0.03079197020514401, 'max_depth': 12, 'min_samples_split': 9, 'min_samples_leaf': 1, 'subsample': 0.6510098687069823, 'max_features': 'sqrt'}. Best is trial 360 with value: 0.2288165351387474.
[I 2024-12-04 12:32:58,758] Trial 575 finished with value: 0.35673984318793756 and parameters: {'n_estimators': 1320, 'learning_rate': 0.03252723727225125, 'max_depth': 7, 'min_samples_split': 17, 'min_samples_leaf': 3, 'subsample': 0.9850003050227462, 'max_features': 'sqrt'}. Best is trial 360 with value: 0.2288165351387474.
[I 2024-12-04 12:32:59,237] Trial 567 finished with value: 0.2530202324651242 and parameters: {'n_estimators': 1492, 'learning_rate': 0.024278293861513478, 'max_depth': 10, 'min_samples_split': 2, 'min_samples_leaf': 1, 'subsample': 0.8498354795873694, 'max_features': 'sqrt'}. Best is trial 360 with value: 0.2288165351387474.
[I 2024-12-04 12:33:04,124] Trial 587 finished with value: 0.4565538371396737 and parameters: {'n_estimators': 749, 'learning_rate': 0.09888014210810928, 'max_depth': 6, 'min_samples_split': 4, 'min_samples_leaf': 2, 'subsample': 0.8869451118482615, 'max_features': None}. Best is trial 360 with value: 0.2288165351387474.
[I 2024-12-04 12:33:05,826] Trial 580 finished with value: 0.36797654814324254 and parameters: {'n_estimators': 1158, 'learning_rate': 0.07893983543761848, 'max_depth': 11, 'min_samples_split': 6, 'min_samples_leaf': 3, 'subsample': 0.7445786303308151, 'max_features': 'sqrt'}. Best is trial 360 with value: 0.2288165351387474.
[I 2024-12-04 12:33:07,578] Trial 576 finished with value: 0.26407691894987095 and parameters: {'n_estimators': 1385, 'learning_rate': 0.05597757517166945, 'max_depth': 12, 'min_samples_split': 2, 'min_samples_leaf': 1, 'subsample': 0.7435454035190832, 'max_features': 'sqrt'}. Best is trial 360 with value: 0.2288165351387474.
[I 2024-12-04 12:33:07,993] Trial 574 finished with value: 0.23858835544915988 and parameters: {'n_estimators': 1465, 'learning_rate': 0.0521171260615364, 'max_depth': 10, 'min_samples_split': 3, 'min_samples_leaf': 1, 'subsample': 0.6101519822083491, 'max_features': 'sqrt'}. Best is trial 360 with value: 0.2288165351387474.
[I 2024-12-04 12:33:11,375] Trial 577 finished with value: 0.2856010682892944 and parameters: {'n_estimators': 1485, 'learning_rate': 0.05210078297910926, 'max_depth': 9, 'min_samples_split': 2, 'min_samples_leaf': 2, 'subsample': 0.628683463511821, 'max_features': 'sqrt'}. Best is trial 360 with value: 0.2288165351387474.
[I 2024-12-04 12:33:15,398] Trial 579 finished with value: 0.2536674154294268 and parameters: {'n_estimators': 1373, 'learning_rate': 0.05532137474109261, 'max_depth': 7, 'min_samples_split': 2, 'min_samples_leaf': 1, 'subsample': 0.8680697160667579, 'max_features': 'sqrt'}. Best is trial 360 with value: 0.2288165351387474.
[I 2024-12-04 12:33:17,510] Trial 585 finished with value: 0.2591563754412925 and parameters: {'n_estimators': 1141, 'learning_rate': 0.0795886156922137, 'max_depth': 10, 'min_samples_split': 6, 'min_samples_leaf': 1, 'subsample': 0.7038760761408186, 'max_features': 'sqrt'}. Best is trial 360 with value: 0.2288165351387474.
[I 2024-12-04 12:33:20,070] Trial 583 finished with value: 0.35059446572919434 and parameters: {'n_estimators': 1210, 'learning_rate': 0.01155364007825155, 'max_depth': 5, 'min_samples_split': 17, 'min_samples_leaf': 1, 'subsample': 0.6117226440282618, 'max_features': None}. Best is trial 360 with value: 0.2288165351387474.
[I 2024-12-04 12:33:33,156] Trial 591 finished with value: 0.2535461910311198 and parameters: {'n_estimators': 1190, 'learning_rate': 0.09844052030321684, 'max_depth': 6, 'min_samples_split': 8, 'min_samples_leaf': 1, 'subsample': 0.6092024900418134, 'max_features': 'sqrt'}. Best is trial 360 with value: 0.2288165351387474.
[I 2024-12-04 12:33:33,260] Trial 595 finished with value: 0.3467935314074085 and parameters: {'n_estimators': 1043, 'learning_rate': 0.056983870092444475, 'max_depth': 5, 'min_samples_split': 2, 'min_samples_leaf': 3, 'subsample': 0.7562635154444017, 'max_features': 'sqrt'}. Best is trial 360 with value: 0.2288165351387474.
[I 2024-12-04 12:33:37,705] Trial 586 finished with value: 0.2679713531455975 and parameters: {'n_estimators': 1472, 'learning_rate': 0.05971057396918637, 'max_depth': 12, 'min_samples_split': 7, 'min_samples_leaf': 1, 'subsample': 0.6716161047569595, 'max_features': 'sqrt'}. Best is trial 360 with value: 0.2288165351387474.
[I 2024-12-04 12:33:37,750] Trial 582 finished with value: 0.4679371647242706 and parameters: {'n_estimators': 1498, 'learning_rate': 0.025144710355501015, 'max_depth': 10, 'min_samples_split': 3, 'min_samples_leaf': 2, 'subsample': 0.8602659099174733, 'max_features': None}. Best is trial 360 with value: 0.2288165351387474.
[I 2024-12-04 12:33:40,694] Trial 593 finished with value: 0.2396031220007756 and parameters: {'n_estimators': 1271, 'learning_rate': 0.06772048392418409, 'max_depth': 9, 'min_samples_split': 3, 'min_samples_leaf': 1, 'subsample': 0.6599124733898505, 'max_features': 'sqrt'}. Best is trial 360 with value: 0.2288165351387474.
[I 2024-12-04 12:33:44,049] Trial 588 finished with value: 0.2578142742093807 and parameters: {'n_estimators': 1475, 'learning_rate': 0.08794892555867405, 'max_depth': 11, 'min_samples_split': 4, 'min_samples_leaf': 1, 'subsample': 0.6979966746392468, 'max_features': 'log2'}. Best is trial 360 with value: 0.2288165351387474.
[I 2024-12-04 12:33:45,484] Trial 589 finished with value: 0.25972984796063897 and parameters: {'n_estimators': 1464, 'learning_rate': 0.04720074539883094, 'max_depth': 8, 'min_samples_split': 6, 'min_samples_leaf': 1, 'subsample': 0.7799863494464518, 'max_features': 'sqrt'}. Best is trial 360 with value: 0.2288165351387474.
[I 2024-12-04 12:33:46,616] Trial 590 finished with value: 0.24139134216610922 and parameters: {'n_estimators': 1445, 'learning_rate': 0.08829304722148024, 'max_depth': 8, 'min_samples_split': 6, 'min_samples_leaf': 1, 'subsample': 0.6914943558473353, 'max_features': 'sqrt'}. Best is trial 360 with value: 0.2288165351387474.
[I 2024-12-04 12:33:48,045] Trial 614 finished with value: 0.9232777866153495 and parameters: {'n_estimators': 563, 'learning_rate': 0.01846961324883472, 'max_depth': 12, 'min_samples_split': 12, 'min_samples_leaf': 6, 'subsample': 0.9314502912819214, 'max_features': 'log2'}. Best is trial 360 with value: 0.2288165351387474.
[I 2024-12-04 12:33:52,622] Trial 599 finished with value: 0.2817588460945504 and parameters: {'n_estimators': 1158, 'learning_rate': 0.09708427093425467, 'max_depth': 9, 'min_samples_split': 3, 'min_samples_leaf': 2, 'subsample': 0.6315386293384306, 'max_features': 'sqrt'}. Best is trial 360 with value: 0.2288165351387474.
[I 2024-12-04 12:33:52,654] Trial 592 finished with value: 0.2669180508422115 and parameters: {'n_estimators': 1442, 'learning_rate': 0.06007737578232019, 'max_depth': 10, 'min_samples_split': 3, 'min_samples_leaf': 1, 'subsample': 0.8547597195535407, 'max_features': 'sqrt'}. Best is trial 360 with value: 0.2288165351387474.
[I 2024-12-04 12:33:54,585] Trial 596 finished with value: 0.2462301784944676 and parameters: {'n_estimators': 1282, 'learning_rate': 0.06513775660082996, 'max_depth': 9, 'min_samples_split': 2, 'min_samples_leaf': 1, 'subsample': 0.6396764403729551, 'max_features': 'sqrt'}. Best is trial 360 with value: 0.2288165351387474.
[I 2024-12-04 12:33:56,843] Trial 594 finished with value: 0.267621042743607 and parameters: {'n_estimators': 1500, 'learning_rate': 0.07787148800636617, 'max_depth': 8, 'min_samples_split': 6, 'min_samples_leaf': 1, 'subsample': 0.6049244236386334, 'max_features': 'sqrt'}. Best is trial 360 with value: 0.2288165351387474.
[I 2024-12-04 12:33:58,702] Trial 597 finished with value: 0.2901131291020137 and parameters: {'n_estimators': 1321, 'learning_rate': 0.09791425585942852, 'max_depth': 6, 'min_samples_split': 6, 'min_samples_leaf': 2, 'subsample': 0.7079608159689627, 'max_features': 'sqrt'}. Best is trial 360 with value: 0.2288165351387474.
[I 2024-12-04 12:34:00,539] Trial 600 finished with value: 0.2296110082718205 and parameters: {'n_estimators': 1259, 'learning_rate': 0.08279371271633178, 'max_depth': 8, 'min_samples_split': 7, 'min_samples_leaf': 1, 'subsample': 0.8067453466107801, 'max_features': 'sqrt'}. Best is trial 360 with value: 0.2288165351387474.
[I 2024-12-04 12:34:00,892] Trial 598 finished with value: 0.24728870562347585 and parameters: {'n_estimators': 1365, 'learning_rate': 0.09312006910452501, 'max_depth': 7, 'min_samples_split': 3, 'min_samples_leaf': 1, 'subsample': 0.672005148646078, 'max_features': 'sqrt'}. Best is trial 360 with value: 0.2288165351387474.
[I 2024-12-04 12:34:02,843] Trial 605 finished with value: 0.42197002629662145 and parameters: {'n_estimators': 1014, 'learning_rate': 0.030505570704908374, 'max_depth': 5, 'min_samples_split': 9, 'min_samples_leaf': 5, 'subsample': 0.8229840675286757, 'max_features': None}. Best is trial 360 with value: 0.2288165351387474.
