[I 2024-12-04 15:24:08,005] Trial 2135 finished with value: 0.48052877347494805 and parameters: {'n_estimators': 923, 'learning_rate': 0.06012165590494731, 'max_depth': 12, 'min_samples_split': 18, 'min_samples_leaf': 1, 'subsample': 0.8982760068763106, 'max_features': None}. Best is trial 1435 with value: 0.45467030752684195.
[I 2024-12-04 15:24:08,837] Trial 2133 finished with value: 0.48664009795824187 and parameters: {'n_estimators': 951, 'learning_rate': 0.037937766110737035, 'max_depth': 12, 'min_samples_split': 20, 'min_samples_leaf': 1, 'subsample': 0.9989437555128664, 'max_features': None}. Best is trial 1435 with value: 0.45467030752684195.
[I 2024-12-04 15:24:10,423] Trial 2156 finished with value: 0.8618348189196526 and parameters: {'n_estimators': 415, 'learning_rate': 0.06475793495434233, 'max_depth': 8, 'min_samples_split': 3, 'min_samples_leaf': 10, 'subsample': 0.9736081101189987, 'max_features': 'log2'}. Best is trial 1435 with value: 0.45467030752684195.
[I 2024-12-04 15:24:10,693] Trial 2126 finished with value: 0.48099584692542835 and parameters: {'n_estimators': 1183, 'learning_rate': 0.09991949481202408, 'max_depth': 12, 'min_samples_split': 18, 'min_samples_leaf': 1, 'subsample': 0.9768015262697811, 'max_features': None}. Best is trial 1435 with value: 0.45467030752684195.
[I 2024-12-04 15:24:13,220] Trial 2138 finished with value: 0.49701790422724335 and parameters: {'n_estimators': 988, 'learning_rate': 0.09775360424451422, 'max_depth': 10, 'min_samples_split': 20, 'min_samples_leaf': 1, 'subsample': 0.9951433699234171, 'max_features': None}. Best is trial 1435 with value: 0.45467030752684195.
[I 2024-12-04 15:24:15,086] Trial 2137 finished with value: 0.500906834600087 and parameters: {'n_estimators': 1082, 'learning_rate': 0.06860704622072837, 'max_depth': 12, 'min_samples_split': 16, 'min_samples_leaf': 1, 'subsample': 0.9481121313367856, 'max_features': None}. Best is trial 1435 with value: 0.45467030752684195.
[I 2024-12-04 15:24:15,890] Trial 2144 finished with value: 0.4855595866025136 and parameters: {'n_estimators': 882, 'learning_rate': 0.09977377534286926, 'max_depth': 12, 'min_samples_split': 18, 'min_samples_leaf': 1, 'subsample': 0.9244707802517153, 'max_features': None}. Best is trial 1435 with value: 0.45467030752684195.
[I 2024-12-04 15:24:16,428] Trial 2147 finished with value: 0.6628956144854701 and parameters: {'n_estimators': 769, 'learning_rate': 0.08937596595297588, 'max_depth': 11, 'min_samples_split': 16, 'min_samples_leaf': 3, 'subsample': 0.9368208764288766, 'max_features': None}. Best is trial 1435 with value: 0.45467030752684195.
[I 2024-12-04 15:24:17,866] Trial 2150 finished with value: 0.6561750709433368 and parameters: {'n_estimators': 836, 'learning_rate': 0.04977960034752835, 'max_depth': 12, 'min_samples_split': 20, 'min_samples_leaf': 3, 'subsample': 0.9877614090552956, 'max_features': 'sqrt'}. Best is trial 1435 with value: 0.45467030752684195.
[I 2024-12-04 15:24:18,119] Trial 2140 finished with value: 0.5172548864757381 and parameters: {'n_estimators': 1288, 'learning_rate': 0.09215868144036587, 'max_depth': 12, 'min_samples_split': 19, 'min_samples_leaf': 1, 'subsample': 0.9959450511827564, 'max_features': 'sqrt'}. Best is trial 1435 with value: 0.45467030752684195.
[I 2024-12-04 15:24:19,534] Trial 2146 finished with value: 0.48470936663110664 and parameters: {'n_estimators': 942, 'learning_rate': 0.059776134688426845, 'max_depth': 10, 'min_samples_split': 20, 'min_samples_leaf': 1, 'subsample': 0.9476013615967079, 'max_features': None}. Best is trial 1435 with value: 0.45467030752684195.
[I 2024-12-04 15:24:19,540] Trial 2149 finished with value: 0.6129088330375182 and parameters: {'n_estimators': 736, 'learning_rate': 0.06219257342567491, 'max_depth': 12, 'min_samples_split': 20, 'min_samples_leaf': 2, 'subsample': 0.9880342370053989, 'max_features': None}. Best is trial 1435 with value: 0.45467030752684195.
[I 2024-12-04 15:24:19,697] Trial 2141 finished with value: 0.6410995613644402 and parameters: {'n_estimators': 1046, 'learning_rate': 0.0777807038540677, 'max_depth': 12, 'min_samples_split': 20, 'min_samples_leaf': 2, 'subsample': 0.9991910682191537, 'max_features': None}. Best is trial 1435 with value: 0.45467030752684195.
[I 2024-12-04 15:24:20,753] Trial 2155 finished with value: 0.6146822000140301 and parameters: {'n_estimators': 632, 'learning_rate': 0.08805157647521246, 'max_depth': 10, 'min_samples_split': 19, 'min_samples_leaf': 3, 'subsample': 0.991766862527849, 'max_features': None}. Best is trial 1435 with value: 0.45467030752684195.
[I 2024-12-04 15:24:21,592] Trial 2158 finished with value: 0.782171223363158 and parameters: {'n_estimators': 758, 'learning_rate': 0.028011666981628696, 'max_depth': 7, 'min_samples_split': 4, 'min_samples_leaf': 10, 'subsample': 0.8433060464943121, 'max_features': 'sqrt'}. Best is trial 1435 with value: 0.45467030752684195.
[I 2024-12-04 15:24:22,703] Trial 2142 finished with value: 0.49413471531304304 and parameters: {'n_estimators': 1065, 'learning_rate': 0.06552272081719752, 'max_depth': 12, 'min_samples_split': 17, 'min_samples_leaf': 1, 'subsample': 0.9883525596181232, 'max_features': None}. Best is trial 1435 with value: 0.45467030752684195.
[I 2024-12-04 15:24:23,060] Trial 2153 finished with value: 0.47321526287121557 and parameters: {'n_estimators': 741, 'learning_rate': 0.08483057070958377, 'max_depth': 11, 'min_samples_split': 18, 'min_samples_leaf': 1, 'subsample': 0.8885070727264704, 'max_features': None}. Best is trial 1435 with value: 0.45467030752684195.
[I 2024-12-04 15:24:23,066] Trial 2160 finished with value: 0.5959229290455811 and parameters: {'n_estimators': 550, 'learning_rate': 0.060573558094544594, 'max_depth': 12, 'min_samples_split': 20, 'min_samples_leaf': 2, 'subsample': 0.9031399647272349, 'max_features': None}. Best is trial 1435 with value: 0.45467030752684195.
[I 2024-12-04 15:24:27,139] Trial 2145 finished with value: 0.46649785522348547 and parameters: {'n_estimators': 1103, 'learning_rate': 0.05903322327801028, 'max_depth': 12, 'min_samples_split': 18, 'min_samples_leaf': 1, 'subsample': 0.9973792490117728, 'max_features': None}. Best is trial 1435 with value: 0.45467030752684195.
[I 2024-12-04 15:24:27,431] Trial 2143 finished with value: 0.4855117890550629 and parameters: {'n_estimators': 1208, 'learning_rate': 0.09908071001210526, 'max_depth': 12, 'min_samples_split': 19, 'min_samples_leaf': 1, 'subsample': 0.9111794885002334, 'max_features': None}. Best is trial 1435 with value: 0.45467030752684195.
[I 2024-12-04 15:24:28,151] Trial 2151 finished with value: 0.6460059767387354 and parameters: {'n_estimators': 875, 'learning_rate': 0.09415324195791436, 'max_depth': 12, 'min_samples_split': 20, 'min_samples_leaf': 3, 'subsample': 0.9634634540714726, 'max_features': None}. Best is trial 1435 with value: 0.45467030752684195.
[I 2024-12-04 15:24:28,632] Trial 2162 finished with value: 0.6266667858945926 and parameters: {'n_estimators': 646, 'learning_rate': 0.0666855878802042, 'max_depth': 10, 'min_samples_split': 18, 'min_samples_leaf': 2, 'subsample': 0.9430869353392488, 'max_features': None}. Best is trial 1435 with value: 0.45467030752684195.
[I 2024-12-04 15:24:28,985] Trial 2166 finished with value: 0.7377253670129729 and parameters: {'n_estimators': 658, 'learning_rate': 0.018027224626878464, 'max_depth': 3, 'min_samples_split': 7, 'min_samples_leaf': 8, 'subsample': 0.9141158648918362, 'max_features': 'sqrt'}. Best is trial 1435 with value: 0.45467030752684195.
[I 2024-12-04 15:24:30,957] Trial 2167 finished with value: 0.483907320579547 and parameters: {'n_estimators': 531, 'learning_rate': 0.05626532265239247, 'max_depth': 12, 'min_samples_split': 20, 'min_samples_leaf': 1, 'subsample': 0.9766930933526421, 'max_features': None}. Best is trial 1435 with value: 0.45467030752684195.
[I 2024-12-04 15:24:31,434] Trial 2152 finished with value: 0.4737902901714609 and parameters: {'n_estimators': 954, 'learning_rate': 0.06340104519781559, 'max_depth': 12, 'min_samples_split': 20, 'min_samples_leaf': 1, 'subsample': 0.9984499666538228, 'max_features': None}. Best is trial 1435 with value: 0.45467030752684195.
[I 2024-12-04 15:24:33,413] Trial 2157 finished with value: 0.4683583830699586 and parameters: {'n_estimators': 921, 'learning_rate': 0.09628561056572886, 'max_depth': 11, 'min_samples_split': 20, 'min_samples_leaf': 1, 'subsample': 0.9789027034982692, 'max_features': None}. Best is trial 1435 with value: 0.45467030752684195.
[I 2024-12-04 15:24:33,925] Trial 2148 finished with value: 0.47367164819934787 and parameters: {'n_estimators': 1185, 'learning_rate': 0.06145667762079857, 'max_depth': 10, 'min_samples_split': 20, 'min_samples_leaf': 1, 'subsample': 0.9390351742208816, 'max_features': None}. Best is trial 1435 with value: 0.45467030752684195.
[I 2024-12-04 15:24:33,955] Trial 2159 finished with value: 0.47312754916032407 and parameters: {'n_estimators': 855, 'learning_rate': 0.056968281886448896, 'max_depth': 11, 'min_samples_split': 20, 'min_samples_leaf': 1, 'subsample': 0.9949866615282089, 'max_features': None}. Best is trial 1435 with value: 0.45467030752684195.
[I 2024-12-04 15:24:35,374] Trial 2165 finished with value: 0.47781916627904797 and parameters: {'n_estimators': 649, 'learning_rate': 0.06806816725346478, 'max_depth': 12, 'min_samples_split': 20, 'min_samples_leaf': 1, 'subsample': 0.9664460307855013, 'max_features': None}. Best is trial 1435 with value: 0.45467030752684195.
[I 2024-12-04 15:24:35,376] Trial 2183 finished with value: 0.6588156076515931 and parameters: {'n_estimators': 183, 'learning_rate': 0.018860889635463923, 'max_depth': 6, 'min_samples_split': 16, 'min_samples_leaf': 9, 'subsample': 0.8080306050056476, 'max_features': None}. Best is trial 1435 with value: 0.45467030752684195.
[I 2024-12-04 15:24:36,638] Trial 2163 finished with value: 0.4955498611013172 and parameters: {'n_estimators': 740, 'learning_rate': 0.0686278657451517, 'max_depth': 11, 'min_samples_split': 17, 'min_samples_leaf': 1, 'subsample': 0.9158623968057419, 'max_features': None}. Best is trial 1435 with value: 0.45467030752684195.
[I 2024-12-04 15:24:37,164] Trial 2154 finished with value: 0.48836349164608456 and parameters: {'n_estimators': 1028, 'learning_rate': 0.057328354702917195, 'max_depth': 11, 'min_samples_split': 19, 'min_samples_leaf': 1, 'subsample': 0.9977932893373038, 'max_features': None}. Best is trial 1435 with value: 0.45467030752684195.
[I 2024-12-04 15:24:40,465] Trial 2164 finished with value: 0.4885791326051974 and parameters: {'n_estimators': 857, 'learning_rate': 0.06392974191945257, 'max_depth': 10, 'min_samples_split': 17, 'min_samples_leaf': 1, 'subsample': 0.9997085353764363, 'max_features': None}. Best is trial 1435 with value: 0.45467030752684195.
[I 2024-12-04 15:24:42,565] Trial 2172 finished with value: 0.7056790830116755 and parameters: {'n_estimators': 867, 'learning_rate': 0.06849204764886276, 'max_depth': 9, 'min_samples_split': 18, 'min_samples_leaf': 5, 'subsample': 0.9643498042936124, 'max_features': 'log2'}. Best is trial 1435 with value: 0.45467030752684195.
[I 2024-12-04 15:24:42,566] Trial 2169 finished with value: 0.6537751160285707 and parameters: {'n_estimators': 823, 'learning_rate': 0.09309948190539914, 'max_depth': 12, 'min_samples_split': 18, 'min_samples_leaf': 3, 'subsample': 0.9598364504098886, 'max_features': None}. Best is trial 1435 with value: 0.45467030752684195.
[I 2024-12-04 15:24:44,610] Trial 2161 finished with value: 0.47956793462113523 and parameters: {'n_estimators': 1070, 'learning_rate': 0.09743751451061715, 'max_depth': 12, 'min_samples_split': 17, 'min_samples_leaf': 1, 'subsample': 0.9938844798364449, 'max_features': None}. Best is trial 1435 with value: 0.45467030752684195.
[I 2024-12-04 15:24:48,099] Trial 2168 finished with value: 0.4799336133275406 and parameters: {'n_estimators': 1016, 'learning_rate': 0.07026594739864507, 'max_depth': 12, 'min_samples_split': 20, 'min_samples_leaf': 1, 'subsample': 0.9240133240374852, 'max_features': None}. Best is trial 1435 with value: 0.45467030752684195.
[I 2024-12-04 15:24:48,348] Trial 2173 finished with value: 0.4829390845878257 and parameters: {'n_estimators': 808, 'learning_rate': 0.07224959772951423, 'max_depth': 12, 'min_samples_split': 20, 'min_samples_leaf': 1, 'subsample': 0.9422934756503483, 'max_features': None}. Best is trial 1435 with value: 0.45467030752684195.
[I 2024-12-04 15:24:49,314] Trial 2175 finished with value: 0.6429663420567562 and parameters: {'n_estimators': 786, 'learning_rate': 0.09280486184052067, 'max_depth': 12, 'min_samples_split': 20, 'min_samples_leaf': 3, 'subsample': 0.9924022821160087, 'max_features': None}. Best is trial 1435 with value: 0.45467030752684195.
[I 2024-12-04 15:24:49,571] Trial 2176 finished with value: 0.6483310475372961 and parameters: {'n_estimators': 777, 'learning_rate': 0.06166954690853946, 'max_depth': 12, 'min_samples_split': 20, 'min_samples_leaf': 3, 'subsample': 0.9354267390840033, 'max_features': None}. Best is trial 1435 with value: 0.45467030752684195.
[I 2024-12-04 15:24:49,584] Trial 2187 finished with value: 0.7190568827102932 and parameters: {'n_estimators': 657, 'learning_rate': 0.05874396091002262, 'max_depth': 4, 'min_samples_split': 2, 'min_samples_leaf': 6, 'subsample': 0.8988644680699752, 'max_features': 'log2'}. Best is trial 1435 with value: 0.45467030752684195.
[I 2024-12-04 15:24:50,090] Trial 2182 finished with value: 0.4846088822181917 and parameters: {'n_estimators': 636, 'learning_rate': 0.09474757738055406, 'max_depth': 11, 'min_samples_split': 20, 'min_samples_leaf': 1, 'subsample': 0.9964489777883191, 'max_features': None}. Best is trial 1435 with value: 0.45467030752684195.
[I 2024-12-04 15:24:51,837] Trial 2198 finished with value: 0.7859150643720934 and parameters: {'n_estimators': 357, 'learning_rate': 0.019839671557351994, 'max_depth': 3, 'min_samples_split': 13, 'min_samples_leaf': 3, 'subsample': 0.636697683830341, 'max_features': 'sqrt'}. Best is trial 1435 with value: 0.45467030752684195.
[I 2024-12-04 15:24:52,106] Trial 2170 finished with value: 0.47118608698014613 and parameters: {'n_estimators': 1045, 'learning_rate': 0.0956057431127248, 'max_depth': 12, 'min_samples_split': 20, 'min_samples_leaf': 1, 'subsample': 0.9924954986542868, 'max_features': None}. Best is trial 1435 with value: 0.45467030752684195.
[I 2024-12-04 15:24:53,069] Trial 2180 finished with value: 0.5309382831519034 and parameters: {'n_estimators': 892, 'learning_rate': 0.07625794641507018, 'max_depth': 12, 'min_samples_split': 20, 'min_samples_leaf': 1, 'subsample': 0.9765785232754473, 'max_features': 'sqrt'}. Best is trial 1435 with value: 0.45467030752684195.
[I 2024-12-04 15:24:56,184] Trial 2179 finished with value: 0.4889778746604661 and parameters: {'n_estimators': 830, 'learning_rate': 0.0623505557838901, 'max_depth': 12, 'min_samples_split': 20, 'min_samples_leaf': 1, 'subsample': 0.9086477012553852, 'max_features': None}. Best is trial 1435 with value: 0.45467030752684195.
[I 2024-12-04 15:24:57,024] Trial 2178 finished with value: 0.6157208984670063 and parameters: {'n_estimators': 874, 'learning_rate': 0.05406289610363934, 'max_depth': 12, 'min_samples_split': 18, 'min_samples_leaf': 3, 'subsample': 0.9988648349836516, 'max_features': None}. Best is trial 1435 with value: 0.45467030752684195.
[I 2024-12-04 15:24:57,164] Trial 2171 finished with value: 0.46675903429198484 and parameters: {'n_estimators': 1139, 'learning_rate': 0.060202732880291786, 'max_depth': 12, 'min_samples_split': 20, 'min_samples_leaf': 1, 'subsample': 0.9930466987447633, 'max_features': None}. Best is trial 1435 with value: 0.45467030752684195.
[I 2024-12-04 15:24:57,895] Trial 2188 finished with value: 0.46736599015635927 and parameters: {'n_estimators': 685, 'learning_rate': 0.09825183948688856, 'max_depth': 12, 'min_samples_split': 19, 'min_samples_leaf': 1, 'subsample': 0.9313538281889537, 'max_features': None}. Best is trial 1435 with value: 0.45467030752684195.
[I 2024-12-04 15:24:58,588] Trial 2194 finished with value: 0.6055533282087889 and parameters: {'n_estimators': 556, 'learning_rate': 0.06443295098273852, 'max_depth': 12, 'min_samples_split': 17, 'min_samples_leaf': 2, 'subsample': 0.9959020562792422, 'max_features': None}. Best is trial 1435 with value: 0.45467030752684195.
[I 2024-12-04 15:25:00,132] Trial 2181 finished with value: 0.48105613934696717 and parameters: {'n_estimators': 890, 'learning_rate': 0.06801839151376951, 'max_depth': 12, 'min_samples_split': 17, 'min_samples_leaf': 1, 'subsample': 0.971103208086506, 'max_features': None}. Best is trial 1435 with value: 0.45467030752684195.
[I 2024-12-04 15:25:01,201] Trial 2177 finished with value: 0.6207772847658171 and parameters: {'n_estimators': 1148, 'learning_rate': 0.042800868365769386, 'max_depth': 10, 'min_samples_split': 11, 'min_samples_leaf': 6, 'subsample': 0.6135046460281133, 'max_features': None}. Best is trial 1435 with value: 0.45467030752684195.
[I 2024-12-04 15:25:01,817] Trial 2174 finished with value: 0.6482701029276737 and parameters: {'n_estimators': 1140, 'learning_rate': 0.06577358043105354, 'max_depth': 12, 'min_samples_split': 20, 'min_samples_leaf': 3, 'subsample': 0.9377465264809899, 'max_features': None}. Best is trial 1435 with value: 0.45467030752684195.
[I 2024-12-04 15:25:02,170] Trial 2184 finished with value: 0.6351866022486168 and parameters: {'n_estimators': 1018, 'learning_rate': 0.032939287432629485, 'max_depth': 6, 'min_samples_split': 7, 'min_samples_leaf': 4, 'subsample': 0.9688641884062338, 'max_features': None}. Best is trial 1435 with value: 0.45467030752684195.
[I 2024-12-04 15:25:03,467] Trial 2189 finished with value: 0.6404997587296197 and parameters: {'n_estimators': 853, 'learning_rate': 0.06196287985804555, 'max_depth': 10, 'min_samples_split': 15, 'min_samples_leaf': 3, 'subsample': 0.9995468159818419, 'max_features': None}. Best is trial 1435 with value: 0.45467030752684195.
[I 2024-12-04 15:25:03,967] Trial 2199 finished with value: 0.6324077624670504 and parameters: {'n_estimators': 596, 'learning_rate': 0.06116987402521242, 'max_depth': 11, 'min_samples_split': 20, 'min_samples_leaf': 2, 'subsample': 0.9985450345205874, 'max_features': None}. Best is trial 1435 with value: 0.45467030752684195.
[I 2024-12-04 15:25:04,975] Trial 2190 finished with value: 0.5050724007458673 and parameters: {'n_estimators': 769, 'learning_rate': 0.03212848675421594, 'max_depth': 12, 'min_samples_split': 15, 'min_samples_leaf': 1, 'subsample': 0.9983419108070878, 'max_features': None}. Best is trial 1435 with value: 0.45467030752684195.
[I 2024-12-04 15:25:07,661] Trial 2185 finished with value: 0.6364523510305478 and parameters: {'n_estimators': 1040, 'learning_rate': 0.07129956536981404, 'max_depth': 11, 'min_samples_split': 19, 'min_samples_leaf': 3, 'subsample': 0.9973649661897458, 'max_features': None}. Best is trial 1435 with value: 0.45467030752684195.
[I 2024-12-04 15:25:08,949] Trial 2208 finished with value: 0.9534583514912309 and parameters: {'n_estimators': 336, 'learning_rate': 0.013681086727028847, 'max_depth': 10, 'min_samples_split': 7, 'min_samples_leaf': 10, 'subsample': 0.9865863842509758, 'max_features': 'sqrt'}. Best is trial 1435 with value: 0.45467030752684195.
[I 2024-12-04 15:25:10,135] Trial 2191 finished with value: 0.47689652427605495 and parameters: {'n_estimators': 966, 'learning_rate': 0.09869105960722924, 'max_depth': 12, 'min_samples_split': 17, 'min_samples_leaf': 1, 'subsample': 0.9941274462425486, 'max_features': None}. Best is trial 1435 with value: 0.45467030752684195.
[I 2024-12-04 15:25:10,435] Trial 2186 finished with value: 0.6324416816526055 and parameters: {'n_estimators': 1094, 'learning_rate': 0.06648538934126355, 'max_depth': 12, 'min_samples_split': 19, 'min_samples_leaf': 3, 'subsample': 0.9985509575131614, 'max_features': None}. Best is trial 1435 with value: 0.45467030752684195.
[I 2024-12-04 15:25:10,969] Trial 2202 finished with value: 0.8069380515601603 and parameters: {'n_estimators': 814, 'learning_rate': 0.04351236648069885, 'max_depth': 11, 'min_samples_split': 2, 'min_samples_leaf': 8, 'subsample': 0.6613746245558996, 'max_features': 'log2'}. Best is trial 1435 with value: 0.45467030752684195.
[I 2024-12-04 15:25:13,017] Trial 2196 finished with value: 0.47430516832539166 and parameters: {'n_estimators': 911, 'learning_rate': 0.05530199383827324, 'max_depth': 12, 'min_samples_split': 20, 'min_samples_leaf': 1, 'subsample': 0.9224152801644201, 'max_features': None}. Best is trial 1435 with value: 0.45467030752684195.
[I 2024-12-04 15:25:14,343] Trial 2222 finished with value: 0.992229349733371 and parameters: {'n_estimators': 105, 'learning_rate': 0.022027792405970997, 'max_depth': 3, 'min_samples_split': 17, 'min_samples_leaf': 2, 'subsample': 0.7383464058620166, 'max_features': 'sqrt'}. Best is trial 1435 with value: 0.45467030752684195.
[I 2024-12-04 15:25:15,082] Trial 2201 finished with value: 0.5928940229046651 and parameters: {'n_estimators': 956, 'learning_rate': 0.07756812833519669, 'max_depth': 12, 'min_samples_split': 20, 'min_samples_leaf': 1, 'subsample': 0.9936937220933788, 'max_features': 'log2'}. Best is trial 1435 with value: 0.45467030752684195.
[I 2024-12-04 15:25:15,258] Trial 2195 finished with value: 0.6247432141791152 and parameters: {'n_estimators': 952, 'learning_rate': 0.05226797217041067, 'max_depth': 12, 'min_samples_split': 20, 'min_samples_leaf': 3, 'subsample': 0.9955527889297181, 'max_features': None}. Best is trial 1435 with value: 0.45467030752684195.
