[I 2024-12-04 11:51:22,569] A new study created in RDB with name: Pc_dt
[I 2024-12-04 11:51:26,732] Trial 5 finished with value: 0.8586975572910015 and parameters: {'max_depth': 29, 'min_samples_split': 18, 'min_samples_leaf': 8, 'max_features': 'sqrt', 'criterion': 'friedman_mse', 'splitter': 'best'}. Best is trial 5 with value: 0.8586975572910015.
[I 2024-12-04 11:51:26,863] Trial 2 finished with value: 1.0852584603456297 and parameters: {'max_depth': 1, 'min_samples_split': 20, 'min_samples_leaf': 5, 'max_features': 'sqrt', 'criterion': 'absolute_error', 'splitter': 'best'}. Best is trial 5 with value: 0.8586975572910015.
[I 2024-12-04 11:51:26,968] Trial 23 finished with value: 1.0753381761853185 and parameters: {'max_depth': 18, 'min_samples_split': 5, 'min_samples_leaf': 8, 'max_features': 'log2', 'criterion': 'absolute_error', 'splitter': 'random'}. Best is trial 5 with value: 0.8586975572910015.
[I 2024-12-04 11:51:27,007] Trial 11 finished with value: 0.8814138348450391 and parameters: {'max_depth': 14, 'min_samples_split': 19, 'min_samples_leaf': 6, 'max_features': 'sqrt', 'criterion': 'absolute_error', 'splitter': 'best'}. Best is trial 5 with value: 0.8586975572910015.
[I 2024-12-04 11:51:27,055] Trial 4 finished with value: 1.0909840109486761 and parameters: {'max_depth': 19, 'min_samples_split': 6, 'min_samples_leaf': 6, 'max_features': 'log2', 'criterion': 'friedman_mse', 'splitter': 'random'}. Best is trial 5 with value: 0.8586975572910015.
[I 2024-12-04 11:51:27,089] Trial 20 finished with value: 1.091656728529238 and parameters: {'max_depth': 12, 'min_samples_split': 6, 'min_samples_leaf': 10, 'max_features': 'log2', 'criterion': 'friedman_mse', 'splitter': 'best'}. Best is trial 5 with value: 0.8586975572910015.
[I 2024-12-04 11:51:27,216] Trial 0 finished with value: 0.8764642500355264 and parameters: {'max_depth': 25, 'min_samples_split': 12, 'min_samples_leaf': 10, 'max_features': 'sqrt', 'criterion': 'friedman_mse', 'splitter': 'best'}. Best is trial 5 with value: 0.8586975572910015.
[I 2024-12-04 11:51:27,498] Trial 13 finished with value: 1.091656728529238 and parameters: {'max_depth': 11, 'min_samples_split': 5, 'min_samples_leaf': 6, 'max_features': 'log2', 'criterion': 'squared_error', 'splitter': 'best'}. Best is trial 5 with value: 0.8586975572910015.
[I 2024-12-04 11:51:27,643] Trial 7 finished with value: 1.0014059266920898 and parameters: {'max_depth': 9, 'min_samples_split': 12, 'min_samples_leaf': 1, 'max_features': 'log2', 'criterion': 'squared_error', 'splitter': 'best'}. Best is trial 5 with value: 0.8586975572910015.
[I 2024-12-04 11:51:27,797] Trial 17 finished with value: 1.0740768482351102 and parameters: {'max_depth': 11, 'min_samples_split': 14, 'min_samples_leaf': 9, 'max_features': 'log2', 'criterion': 'absolute_error', 'splitter': 'best'}. Best is trial 5 with value: 0.8586975572910015.
[I 2024-12-04 11:51:28,140] Trial 1 finished with value: 1.0740768482351102 and parameters: {'max_depth': 8, 'min_samples_split': 19, 'min_samples_leaf': 10, 'max_features': 'log2', 'criterion': 'absolute_error', 'splitter': 'best'}. Best is trial 5 with value: 0.8586975572910015.
[I 2024-12-04 11:51:28,316] Trial 24 finished with value: 1.0816149376799358 and parameters: {'max_depth': 23, 'min_samples_split': 3, 'min_samples_leaf': 9, 'max_features': 'sqrt', 'criterion': 'squared_error', 'splitter': 'random'}. Best is trial 16 with value: 0.8197841509275395.
[I 2024-12-04 11:51:28,324] Trial 21 finished with value: 1.075383350593605 and parameters: {'max_depth': 19, 'min_samples_split': 18, 'min_samples_leaf': 5, 'max_features': 'sqrt', 'criterion': 'absolute_error', 'splitter': 'random'}. Best is trial 16 with value: 0.8197841509275395.
[I 2024-12-04 11:51:28,618] Trial 22 finished with value: 0.8764642500355264 and parameters: {'max_depth': 33, 'min_samples_split': 5, 'min_samples_leaf': 10, 'max_features': 'sqrt', 'criterion': 'friedman_mse', 'splitter': 'best'}. Best is trial 16 with value: 0.8197841509275395.
[I 2024-12-04 11:51:28,748] Trial 16 finished with value: 0.8197841509275395 and parameters: {'max_depth': 34, 'min_samples_split': 19, 'min_samples_leaf': 2, 'max_features': 'sqrt', 'criterion': 'squared_error', 'splitter': 'best'}. Best is trial 16 with value: 0.8197841509275395.
[I 2024-12-04 11:51:29,609] Trial 3 finished with value: 1.092723027538113 and parameters: {'max_depth': 1, 'min_samples_split': 19, 'min_samples_leaf': 7, 'max_features': 'log2', 'criterion': 'squared_error', 'splitter': 'random'}. Best is trial 16 with value: 0.8197841509275395.
[I 2024-12-04 11:51:30,214] Trial 9 finished with value: 1.0732740793523414 and parameters: {'max_depth': 9, 'min_samples_split': 6, 'min_samples_leaf': 3, 'max_features': 'log2', 'criterion': 'absolute_error', 'splitter': 'best'}. Best is trial 16 with value: 0.8197841509275395.
[I 2024-12-04 11:51:30,357] Trial 19 finished with value: 0.8364284469997783 and parameters: {'max_depth': 31, 'min_samples_split': 17, 'min_samples_leaf': 1, 'max_features': 'sqrt', 'criterion': 'squared_error', 'splitter': 'random'}. Best is trial 16 with value: 0.8197841509275395.
[I 2024-12-04 11:51:31,015] Trial 26 finished with value: 1.0816149376799358 and parameters: {'max_depth': 29, 'min_samples_split': 19, 'min_samples_leaf': 7, 'max_features': 'sqrt', 'criterion': 'friedman_mse', 'splitter': 'random'}. Best is trial 16 with value: 0.8197841509275395.
[I 2024-12-04 11:51:31,038] Trial 14 finished with value: 1.0732740793523414 and parameters: {'max_depth': 15, 'min_samples_split': 13, 'min_samples_leaf': 3, 'max_features': 'log2', 'criterion': 'absolute_error', 'splitter': 'best'}. Best is trial 16 with value: 0.8197841509275395.
[I 2024-12-04 11:51:31,140] Trial 15 finished with value: 1.0343909145284147 and parameters: {'max_depth': 19, 'min_samples_split': 20, 'min_samples_leaf': 4, 'max_features': 'sqrt', 'criterion': 'absolute_error', 'splitter': 'random'}. Best is trial 16 with value: 0.8197841509275395.
[I 2024-12-04 11:51:32,697] Trial 30 finished with value: 0.8882027686672493 and parameters: {'max_depth': 35, 'min_samples_split': 20, 'min_samples_leaf': 7, 'max_features': 'sqrt', 'criterion': 'absolute_error', 'splitter': 'best'}. Best is trial 6 with value: 0.7706807839903486.
[I 2024-12-04 11:51:32,935] Trial 25 finished with value: 0.7873660306382242 and parameters: {'max_depth': 27, 'min_samples_split': 18, 'min_samples_leaf': 1, 'max_features': 'sqrt', 'criterion': 'friedman_mse', 'splitter': 'random'}. Best is trial 6 with value: 0.7706807839903486.
[I 2024-12-04 11:51:33,566] Trial 6 finished with value: 0.7706807839903486 and parameters: {'max_depth': 32, 'min_samples_split': 12, 'min_samples_leaf': 2, 'max_features': 'sqrt', 'criterion': 'squared_error', 'splitter': 'random'}. Best is trial 6 with value: 0.7706807839903486.
[I 2024-12-04 11:51:33,570] Trial 8 finished with value: 0.8341454127345954 and parameters: {'max_depth': 19, 'min_samples_split': 20, 'min_samples_leaf': 1, 'max_features': 'sqrt', 'criterion': 'squared_error', 'splitter': 'random'}. Best is trial 6 with value: 0.7706807839903486.
[I 2024-12-04 11:51:33,829] Trial 10 finished with value: 0.8073829129738876 and parameters: {'max_depth': 33, 'min_samples_split': 15, 'min_samples_leaf': 1, 'max_features': 'sqrt', 'criterion': 'squared_error', 'splitter': 'random'}. Best is trial 6 with value: 0.7706807839903486.
[I 2024-12-04 11:51:34,291] Trial 40 finished with value: 0.8319578476126518 and parameters: {'max_depth': 23, 'min_samples_split': 12, 'min_samples_leaf': 2, 'max_features': 'sqrt', 'criterion': 'friedman_mse', 'splitter': 'random'}. Best is trial 6 with value: 0.7706807839903486.
[I 2024-12-04 11:51:34,450] Trial 29 finished with value: 1.075939261857104 and parameters: {'max_depth': 18, 'min_samples_split': 19, 'min_samples_leaf': 2, 'max_features': 'log2', 'criterion': 'squared_error', 'splitter': 'random'}. Best is trial 6 with value: 0.7706807839903486.
[I 2024-12-04 11:51:34,588] Trial 27 finished with value: 0.8764642500355264 and parameters: {'max_depth': 35, 'min_samples_split': 19, 'min_samples_leaf': 10, 'max_features': 'sqrt', 'criterion': 'friedman_mse', 'splitter': 'best'}. Best is trial 6 with value: 0.7706807839903486.
[I 2024-12-04 11:51:35,572] Trial 28 finished with value: 0.8202493159766523 and parameters: {'max_depth': 35, 'min_samples_split': 20, 'min_samples_leaf': 2, 'max_features': 'sqrt', 'criterion': 'squared_error', 'splitter': 'best'}. Best is trial 43 with value: 0.7474192915475596.
[I 2024-12-04 11:51:36,056] Trial 43 finished with value: 0.7474192915475596 and parameters: {'max_depth': 34, 'min_samples_split': 17, 'min_samples_leaf': 2, 'max_features': 'sqrt', 'criterion': 'friedman_mse', 'splitter': 'random'}. Best is trial 43 with value: 0.7474192915475596.
[I 2024-12-04 11:51:36,917] Trial 37 finished with value: 1.092257372628799 and parameters: {'max_depth': 35, 'min_samples_split': 16, 'min_samples_leaf': 4, 'max_features': 'log2', 'criterion': 'squared_error', 'splitter': 'random'}. Best is trial 43 with value: 0.7474192915475596.
[I 2024-12-04 11:51:37,538] Trial 36 finished with value: 0.825562298787238 and parameters: {'max_depth': 25, 'min_samples_split': 13, 'min_samples_leaf': 3, 'max_features': 'sqrt', 'criterion': 'squared_error', 'splitter': 'best'}. Best is trial 43 with value: 0.7474192915475596.
[I 2024-12-04 11:51:38,022] Trial 18 finished with value: 1.0859331338976363 and parameters: {'max_depth': 33, 'min_samples_split': 11, 'min_samples_leaf': 5, 'max_features': 'sqrt', 'criterion': 'squared_error', 'splitter': 'random'}. Best is trial 43 with value: 0.7474192915475596.
[I 2024-12-04 11:51:38,235] Trial 39 finished with value: 0.8225082561251309 and parameters: {'max_depth': 27, 'min_samples_split': 8, 'min_samples_leaf': 3, 'max_features': 'sqrt', 'criterion': 'absolute_error', 'splitter': 'best'}. Best is trial 43 with value: 0.7474192915475596.
[I 2024-12-04 11:51:38,396] Trial 46 finished with value: 1.0088746664531512 and parameters: {'max_depth': 32, 'min_samples_split': 11, 'min_samples_leaf': 1, 'max_features': 'log2', 'criterion': 'absolute_error', 'splitter': 'random'}. Best is trial 43 with value: 0.7474192915475596.
[I 2024-12-04 11:51:38,572] Trial 31 finished with value: 0.8148620426453123 and parameters: {'max_depth': 28, 'min_samples_split': 9, 'min_samples_leaf': 1, 'max_features': 'sqrt', 'criterion': 'squared_error', 'splitter': 'random'}. Best is trial 43 with value: 0.7474192915475596.
[I 2024-12-04 11:51:38,807] Trial 34 finished with value: 0.825562298787238 and parameters: {'max_depth': 35, 'min_samples_split': 14, 'min_samples_leaf': 3, 'max_features': 'sqrt', 'criterion': 'friedman_mse', 'splitter': 'best'}. Best is trial 43 with value: 0.7474192915475596.
[I 2024-12-04 11:51:39,326] Trial 49 finished with value: 0.8064829095957499 and parameters: {'max_depth': 18, 'min_samples_split': 19, 'min_samples_leaf': 1, 'max_features': 'sqrt', 'criterion': 'friedman_mse', 'splitter': 'random'}. Best is trial 42 with value: 0.7000225682732063.
[I 2024-12-04 11:51:39,388] Trial 50 finished with value: 0.8125059679778701 and parameters: {'max_depth': 25, 'min_samples_split': 20, 'min_samples_leaf': 1, 'max_features': 'sqrt', 'criterion': 'friedman_mse', 'splitter': 'random'}. Best is trial 42 with value: 0.7000225682732063.
[I 2024-12-04 11:51:39,434] Trial 35 finished with value: 0.8922728876838094 and parameters: {'max_depth': 33, 'min_samples_split': 18, 'min_samples_leaf': 3, 'max_features': 'sqrt', 'criterion': 'friedman_mse', 'splitter': 'random'}. Best is trial 42 with value: 0.7000225682732063.
[I 2024-12-04 11:51:39,442] Trial 38 finished with value: 1.0503727076602933 and parameters: {'max_depth': 27, 'min_samples_split': 19, 'min_samples_leaf': 1, 'max_features': 'log2', 'criterion': 'friedman_mse', 'splitter': 'random'}. Best is trial 42 with value: 0.7000225682732063.
[I 2024-12-04 11:51:39,443] Trial 47 finished with value: 0.7964243095987082 and parameters: {'max_depth': 30, 'min_samples_split': 14, 'min_samples_leaf': 1, 'max_features': 'sqrt', 'criterion': 'friedman_mse', 'splitter': 'random'}. Best is trial 42 with value: 0.7000225682732063.
[I 2024-12-04 11:51:39,854] Trial 42 finished with value: 0.7000225682732063 and parameters: {'max_depth': 25, 'min_samples_split': 19, 'min_samples_leaf': 1, 'max_features': 'sqrt', 'criterion': 'friedman_mse', 'splitter': 'best'}. Best is trial 42 with value: 0.7000225682732063.
[I 2024-12-04 11:51:40,347] Trial 51 finished with value: 1.0875514012277379 and parameters: {'max_depth': 2, 'min_samples_split': 20, 'min_samples_leaf': 10, 'max_features': 'sqrt', 'criterion': 'friedman_mse', 'splitter': 'random'}. Best is trial 42 with value: 0.7000225682732063.
[I 2024-12-04 11:51:40,524] Trial 48 finished with value: 0.842488709850384 and parameters: {'max_depth': 12, 'min_samples_split': 16, 'min_samples_leaf': 1, 'max_features': 'sqrt', 'criterion': 'friedman_mse', 'splitter': 'random'}. Best is trial 42 with value: 0.7000225682732063.
[I 2024-12-04 11:51:40,758] Trial 12 finished with value: 0.825529227572405 and parameters: {'max_depth': 30, 'min_samples_split': 15, 'min_samples_leaf': 2, 'max_features': 'sqrt', 'criterion': 'absolute_error', 'splitter': 'random'}. Best is trial 42 with value: 0.7000225682732063.
[I 2024-12-04 11:51:41,208] Trial 41 finished with value: 0.8946416640041711 and parameters: {'max_depth': 15, 'min_samples_split': 12, 'min_samples_leaf': 3, 'max_features': 'sqrt', 'criterion': 'friedman_mse', 'splitter': 'best'}. Best is trial 42 with value: 0.7000225682732063.
[I 2024-12-04 11:51:41,466] Trial 54 finished with value: 0.8202493159766523 and parameters: {'max_depth': 25, 'min_samples_split': 20, 'min_samples_leaf': 2, 'max_features': 'sqrt', 'criterion': 'friedman_mse', 'splitter': 'best'}. Best is trial 42 with value: 0.7000225682732063.
[I 2024-12-04 11:51:41,474] Trial 45 finished with value: 0.8912798859792268 and parameters: {'max_depth': 23, 'min_samples_split': 14, 'min_samples_leaf': 3, 'max_features': 'sqrt', 'criterion': 'squared_error', 'splitter': 'random'}. Best is trial 42 with value: 0.7000225682732063.
[I 2024-12-04 11:51:41,819] Trial 32 finished with value: 0.7907314242963065 and parameters: {'max_depth': 32, 'min_samples_split': 11, 'min_samples_leaf': 1, 'max_features': 'sqrt', 'criterion': 'friedman_mse', 'splitter': 'random'}. Best is trial 42 with value: 0.7000225682732063.
[I 2024-12-04 11:51:42,263] Trial 44 finished with value: 0.7524303376544808 and parameters: {'max_depth': 32, 'min_samples_split': 11, 'min_samples_leaf': 2, 'max_features': 'sqrt', 'criterion': 'friedman_mse', 'splitter': 'random'}. Best is trial 42 with value: 0.7000225682732063.
[I 2024-12-04 11:51:42,616] Trial 33 finished with value: 0.8922728876838094 and parameters: {'max_depth': 35, 'min_samples_split': 8, 'min_samples_leaf': 3, 'max_features': 'sqrt', 'criterion': 'friedman_mse', 'splitter': 'random'}. Best is trial 42 with value: 0.7000225682732063.
[I 2024-12-04 11:51:42,975] Trial 53 finished with value: 0.750697234976041 and parameters: {'max_depth': 29, 'min_samples_split': 19, 'min_samples_leaf': 1, 'max_features': 'log2', 'criterion': 'friedman_mse', 'splitter': 'best'}. Best is trial 42 with value: 0.7000225682732063.
[I 2024-12-04 11:51:43,157] Trial 59 finished with value: 1.0663773044141514 and parameters: {'max_depth': 32, 'min_samples_split': 11, 'min_samples_leaf': 2, 'max_features': 'log2', 'criterion': 'friedman_mse', 'splitter': 'random'}. Best is trial 42 with value: 0.7000225682732063.
[I 2024-12-04 11:51:45,172] Trial 52 finished with value: 0.7795037756716127 and parameters: {'max_depth': 22, 'min_samples_split': 18, 'min_samples_leaf': 1, 'max_features': 'sqrt', 'criterion': 'absolute_error', 'splitter': 'best'}. Best is trial 42 with value: 0.7000225682732063.
[I 2024-12-04 11:51:45,176] Trial 57 finished with value: 0.7659493980448111 and parameters: {'max_depth': 34, 'min_samples_split': 19, 'min_samples_leaf': 1, 'max_features': 'log2', 'criterion': 'friedman_mse', 'splitter': 'best'}. Best is trial 42 with value: 0.7000225682732063.
[I 2024-12-04 11:51:46,100] Trial 55 finished with value: 0.8037648258474691 and parameters: {'max_depth': 28, 'min_samples_split': 7, 'min_samples_leaf': 1, 'max_features': 'sqrt', 'criterion': 'friedman_mse', 'splitter': 'random'}. Best is trial 42 with value: 0.7000225682732063.
[I 2024-12-04 11:51:46,110] Trial 60 finished with value: 0.8364660618078805 and parameters: {'max_depth': 31, 'min_samples_split': 20, 'min_samples_leaf': 1, 'max_features': 'log2', 'criterion': 'absolute_error', 'splitter': 'best'}. Best is trial 42 with value: 0.7000225682732063.
[I 2024-12-04 11:51:46,480] Trial 61 finished with value: 0.7920739295218624 and parameters: {'max_depth': 34, 'min_samples_split': 16, 'min_samples_leaf': 2, 'max_features': 'log2', 'criterion': 'friedman_mse', 'splitter': 'best'}. Best is trial 42 with value: 0.7000225682732063.
[I 2024-12-04 11:51:46,562] Trial 74 finished with value: 0.7920739295218624 and parameters: {'max_depth': 30, 'min_samples_split': 18, 'min_samples_leaf': 2, 'max_features': 'log2', 'criterion': 'friedman_mse', 'splitter': 'best'}. Best is trial 42 with value: 0.7000225682732063.
[I 2024-12-04 11:51:47,022] Trial 64 finished with value: 0.8388698788510288 and parameters: {'max_depth': 20, 'min_samples_split': 20, 'min_samples_leaf': 2, 'max_features': 'log2', 'criterion': 'friedman_mse', 'splitter': 'best'}. Best is trial 42 with value: 0.7000225682732063.
[I 2024-12-04 11:51:47,167] Trial 67 finished with value: 0.7920739295218624 and parameters: {'max_depth': 35, 'min_samples_split': 18, 'min_samples_leaf': 2, 'max_features': 'log2', 'criterion': 'friedman_mse', 'splitter': 'best'}. Best is trial 42 with value: 0.7000225682732063.
[I 2024-12-04 11:51:48,008] Trial 66 finished with value: 0.7997898894704598 and parameters: {'max_depth': 22, 'min_samples_split': 20, 'min_samples_leaf': 1, 'max_features': 'sqrt', 'criterion': 'absolute_error', 'splitter': 'best'}. Best is trial 42 with value: 0.7000225682732063.
[I 2024-12-04 11:51:48,101] Trial 56 finished with value: 0.8343996286241125 and parameters: {'max_depth': 21, 'min_samples_split': 15, 'min_samples_leaf': 2, 'max_features': 'log2', 'criterion': 'friedman_mse', 'splitter': 'best'}. Best is trial 42 with value: 0.7000225682732063.
[I 2024-12-04 11:51:48,280] Trial 62 finished with value: 0.7082626926450787 and parameters: {'max_depth': 28, 'min_samples_split': 13, 'min_samples_leaf': 1, 'max_features': 'log2', 'criterion': 'squared_error', 'splitter': 'best'}. Best is trial 42 with value: 0.7000225682732063.
[I 2024-12-04 11:51:49,174] Trial 73 finished with value: 0.821362814521448 and parameters: {'max_depth': 20, 'min_samples_split': 15, 'min_samples_leaf': 1, 'max_features': 'sqrt', 'criterion': 'absolute_error', 'splitter': 'best'}. Best is trial 42 with value: 0.7000225682732063.
[I 2024-12-04 11:51:49,198] Trial 69 finished with value: 0.8681285146532864 and parameters: {'max_depth': 10, 'min_samples_split': 16, 'min_samples_leaf': 1, 'max_features': 'sqrt', 'criterion': 'absolute_error', 'splitter': 'best'}. Best is trial 65 with value: 0.6872254165149658.
[I 2024-12-04 11:51:49,597] Trial 63 finished with value: 1.0474997510797859 and parameters: {'max_depth': 30, 'min_samples_split': 9, 'min_samples_leaf': 4, 'max_features': 'sqrt', 'criterion': 'absolute_error', 'splitter': 'random'}. Best is trial 70 with value: 0.6689799910368681.
[I 2024-12-04 11:51:49,698] Trial 79 finished with value: 0.7432366997363034 and parameters: {'max_depth': 30, 'min_samples_split': 15, 'min_samples_leaf': 1, 'max_features': 'log2', 'criterion': 'squared_error', 'splitter': 'best'}. Best is trial 70 with value: 0.6689799910368681.
[I 2024-12-04 11:51:49,848] Trial 71 finished with value: 0.8281137437381925 and parameters: {'max_depth': 26, 'min_samples_split': 12, 'min_samples_leaf': 2, 'max_features': 'log2', 'criterion': 'squared_error', 'splitter': 'best'}. Best is trial 70 with value: 0.6689799910368681.
[I 2024-12-04 11:51:49,850] Trial 76 finished with value: 0.7526847126350095 and parameters: {'max_depth': 29, 'min_samples_split': 14, 'min_samples_leaf': 1, 'max_features': 'log2', 'criterion': 'squared_error', 'splitter': 'best'}. Best is trial 70 with value: 0.6689799910368681.
[I 2024-12-04 11:51:49,934] Trial 75 finished with value: 1.0549813758732849 and parameters: {'max_depth': 25, 'min_samples_split': 12, 'min_samples_leaf': 1, 'max_features': 'log2', 'criterion': 'squared_error', 'splitter': 'random'}. Best is trial 70 with value: 0.6689799910368681.
[I 2024-12-04 11:51:49,949] Trial 58 finished with value: 1.0844620460096857 and parameters: {'max_depth': 35, 'min_samples_split': 10, 'min_samples_leaf': 5, 'max_features': 'log2', 'criterion': 'squared_error', 'splitter': 'best'}. Best is trial 70 with value: 0.6689799910368681.
[I 2024-12-04 11:51:50,174] Trial 77 finished with value: 0.7426733757565239 and parameters: {'max_depth': 27, 'min_samples_split': 10, 'min_samples_leaf': 1, 'max_features': 'log2', 'criterion': 'squared_error', 'splitter': 'best'}. Best is trial 70 with value: 0.6689799910368681.
[I 2024-12-04 11:51:50,184] Trial 70 finished with value: 0.6689799910368681 and parameters: {'max_depth': 22, 'min_samples_split': 7, 'min_samples_leaf': 1, 'max_features': 'log2', 'criterion': 'squared_error', 'splitter': 'best'}. Best is trial 70 with value: 0.6689799910368681.
[I 2024-12-04 11:51:50,209] Trial 78 finished with value: 0.7805720561000737 and parameters: {'max_depth': 18, 'min_samples_split': 18, 'min_samples_leaf': 1, 'max_features': 'sqrt', 'criterion': 'friedman_mse', 'splitter': 'best'}. Best is trial 70 with value: 0.6689799910368681.
