[I 2024-12-04 15:13:11,420] Trial 1539 finished with value: 0.7152912897042751 and parameters: {'n_estimators': 1369, 'learning_rate': 0.03220126767220728, 'max_depth': 6, 'min_samples_split': 15, 'min_samples_leaf': 7, 'subsample': 0.7779948761192944, 'max_features': 'sqrt'}. Best is trial 1435 with value: 0.45467030752684195.
[I 2024-12-04 15:13:12,912] Trial 1528 finished with value: 0.47204551412512286 and parameters: {'n_estimators': 1398, 'learning_rate': 0.06708761582071078, 'max_depth': 12, 'min_samples_split': 20, 'min_samples_leaf': 1, 'subsample': 0.9954723873653653, 'max_features': None}. Best is trial 1435 with value: 0.45467030752684195.
[I 2024-12-04 15:13:13,154] Trial 1529 finished with value: 0.46895108879981473 and parameters: {'n_estimators': 1391, 'learning_rate': 0.050246665351092804, 'max_depth': 12, 'min_samples_split': 18, 'min_samples_leaf': 1, 'subsample': 0.9957587729677148, 'max_features': None}. Best is trial 1435 with value: 0.45467030752684195.
[I 2024-12-04 15:13:13,359] Trial 1543 finished with value: 0.6415934879320968 and parameters: {'n_estimators': 951, 'learning_rate': 0.06052594191282398, 'max_depth': 11, 'min_samples_split': 16, 'min_samples_leaf': 2, 'subsample': 0.9794234058903082, 'max_features': None}. Best is trial 1435 with value: 0.45467030752684195.
[I 2024-12-04 15:13:13,384] Trial 1542 finished with value: 0.6477587692044757 and parameters: {'n_estimators': 1026, 'learning_rate': 0.09586715264635512, 'max_depth': 12, 'min_samples_split': 20, 'min_samples_leaf': 2, 'subsample': 0.9096171095239322, 'max_features': None}. Best is trial 1435 with value: 0.45467030752684195.
[I 2024-12-04 15:13:13,681] Trial 1553 finished with value: 0.8913714608539083 and parameters: {'n_estimators': 566, 'learning_rate': 0.029968510623461727, 'max_depth': 11, 'min_samples_split': 3, 'min_samples_leaf': 5, 'subsample': 0.8172273536416607, 'max_features': 'log2'}. Best is trial 1435 with value: 0.45467030752684195.
[I 2024-12-04 15:13:14,484] Trial 1541 finished with value: 0.4951924065262254 and parameters: {'n_estimators': 1063, 'learning_rate': 0.09922642373410993, 'max_depth': 12, 'min_samples_split': 20, 'min_samples_leaf': 1, 'subsample': 0.9863769117101493, 'max_features': None}. Best is trial 1435 with value: 0.45467030752684195.
[I 2024-12-04 15:13:15,601] Trial 1547 finished with value: 0.670584506012109 and parameters: {'n_estimators': 943, 'learning_rate': 0.09817256035805874, 'max_depth': 10, 'min_samples_split': 16, 'min_samples_leaf': 2, 'subsample': 0.9979626388481714, 'max_features': None}. Best is trial 1435 with value: 0.45467030752684195.
[I 2024-12-04 15:13:15,912] Trial 1546 finished with value: 0.5101020678887905 and parameters: {'n_estimators': 943, 'learning_rate': 0.07026144167711355, 'max_depth': 12, 'min_samples_split': 14, 'min_samples_leaf': 1, 'subsample': 0.9789570165828967, 'max_features': None}. Best is trial 1435 with value: 0.45467030752684195.
[I 2024-12-04 15:13:16,455] Trial 1544 finished with value: 0.6651700886764166 and parameters: {'n_estimators': 1298, 'learning_rate': 0.031298089253385696, 'max_depth': 12, 'min_samples_split': 16, 'min_samples_leaf': 3, 'subsample': 0.9336153153697866, 'max_features': 'log2'}. Best is trial 1435 with value: 0.45467030752684195.
[I 2024-12-04 15:13:16,459] Trial 1548 finished with value: 0.4850433484998286 and parameters: {'n_estimators': 858, 'learning_rate': 0.05811106391577759, 'max_depth': 12, 'min_samples_split': 20, 'min_samples_leaf': 1, 'subsample': 0.9308309442464049, 'max_features': None}. Best is trial 1435 with value: 0.45467030752684195.
[I 2024-12-04 15:13:17,989] Trial 1551 finished with value: 0.6237353497607382 and parameters: {'n_estimators': 756, 'learning_rate': 0.05786906840367467, 'max_depth': 11, 'min_samples_split': 20, 'min_samples_leaf': 2, 'subsample': 0.9945539955920631, 'max_features': None}. Best is trial 1435 with value: 0.45467030752684195.
[I 2024-12-04 15:13:22,581] Trial 1552 finished with value: 0.5124677623944797 and parameters: {'n_estimators': 873, 'learning_rate': 0.06984128263869989, 'max_depth': 9, 'min_samples_split': 17, 'min_samples_leaf': 1, 'subsample': 0.9988997738594206, 'max_features': None}. Best is trial 1435 with value: 0.45467030752684195.
[I 2024-12-04 15:13:25,991] Trial 1557 finished with value: 0.6658142292231388 and parameters: {'n_estimators': 1044, 'learning_rate': 0.0792556883600815, 'max_depth': 12, 'min_samples_split': 18, 'min_samples_leaf': 3, 'subsample': 0.9920707590094253, 'max_features': 'log2'}. Best is trial 1435 with value: 0.45467030752684195.
[I 2024-12-04 15:13:26,193] Trial 1556 finished with value: 0.6700857965488481 and parameters: {'n_estimators': 1048, 'learning_rate': 0.08418140615439212, 'max_depth': 11, 'min_samples_split': 20, 'min_samples_leaf': 2, 'subsample': 0.9559039871832608, 'max_features': 'log2'}. Best is trial 1435 with value: 0.45467030752684195.
[I 2024-12-04 15:13:26,691] Trial 1555 finished with value: 0.6576560047207307 and parameters: {'n_estimators': 894, 'learning_rate': 0.08062287191648886, 'max_depth': 12, 'min_samples_split': 17, 'min_samples_leaf': 3, 'subsample': 0.9294918995692119, 'max_features': None}. Best is trial 1435 with value: 0.45467030752684195.
[I 2024-12-04 15:13:28,546] Trial 1550 finished with value: 0.5244409057533002 and parameters: {'n_estimators': 1421, 'learning_rate': 0.06612966336103351, 'max_depth': 12, 'min_samples_split': 13, 'min_samples_leaf': 1, 'subsample': 0.9988697975432227, 'max_features': 'log2'}. Best is trial 1435 with value: 0.45467030752684195.
[I 2024-12-04 15:13:30,993] Trial 1559 finished with value: 0.4912307087739508 and parameters: {'n_estimators': 914, 'learning_rate': 0.07007654836435631, 'max_depth': 12, 'min_samples_split': 17, 'min_samples_leaf': 1, 'subsample': 0.9982314918299292, 'max_features': None}. Best is trial 1435 with value: 0.45467030752684195.
[I 2024-12-04 15:13:31,657] Trial 1560 finished with value: 0.513536282035457 and parameters: {'n_estimators': 917, 'learning_rate': 0.0632921661127546, 'max_depth': 12, 'min_samples_split': 16, 'min_samples_leaf': 1, 'subsample': 0.9059771358768064, 'max_features': None}. Best is trial 1435 with value: 0.45467030752684195.
[I 2024-12-04 15:13:32,165] Trial 1554 finished with value: 0.5155177275143085 and parameters: {'n_estimators': 1077, 'learning_rate': 0.07251391627290685, 'max_depth': 11, 'min_samples_split': 16, 'min_samples_leaf': 1, 'subsample': 0.9879077537647021, 'max_features': None}. Best is trial 1435 with value: 0.45467030752684195.
[I 2024-12-04 15:13:33,373] Trial 1549 finished with value: 0.46941920732043907 and parameters: {'n_estimators': 1374, 'learning_rate': 0.08953781568304225, 'max_depth': 12, 'min_samples_split': 20, 'min_samples_leaf': 1, 'subsample': 0.9975537695573832, 'max_features': None}. Best is trial 1435 with value: 0.45467030752684195.
[I 2024-12-04 15:13:35,695] Trial 1561 finished with value: 0.5051043227800305 and parameters: {'n_estimators': 1220, 'learning_rate': 0.021722125769323676, 'max_depth': 11, 'min_samples_split': 2, 'min_samples_leaf': 1, 'subsample': 0.7683848412004787, 'max_features': 'sqrt'}. Best is trial 1435 with value: 0.45467030752684195.
[I 2024-12-04 15:13:36,878] Trial 1564 finished with value: 0.4868898677268893 and parameters: {'n_estimators': 902, 'learning_rate': 0.0636378055804, 'max_depth': 11, 'min_samples_split': 17, 'min_samples_leaf': 1, 'subsample': 0.9928218008625627, 'max_features': None}. Best is trial 1435 with value: 0.45467030752684195.
[I 2024-12-04 15:13:37,741] Trial 1571 finished with value: 0.6203039147732964 and parameters: {'n_estimators': 743, 'learning_rate': 0.07558728143328941, 'max_depth': 12, 'min_samples_split': 20, 'min_samples_leaf': 3, 'subsample': 0.9916797308984594, 'max_features': None}. Best is trial 1435 with value: 0.45467030752684195.
[I 2024-12-04 15:13:38,672] Trial 1562 finished with value: 0.5263415307928407 and parameters: {'n_estimators': 1299, 'learning_rate': 0.05769431475212948, 'max_depth': 12, 'min_samples_split': 17, 'min_samples_leaf': 1, 'subsample': 0.9912528360003456, 'max_features': 'sqrt'}. Best is trial 1435 with value: 0.45467030752684195.
[I 2024-12-04 15:13:39,157] Trial 1568 finished with value: 0.48894518898408706 and parameters: {'n_estimators': 864, 'learning_rate': 0.06803079316091616, 'max_depth': 12, 'min_samples_split': 20, 'min_samples_leaf': 1, 'subsample': 0.9236138937876226, 'max_features': None}. Best is trial 1435 with value: 0.45467030752684195.
[I 2024-12-04 15:13:39,785] Trial 1570 finished with value: 0.4999484306379046 and parameters: {'n_estimators': 816, 'learning_rate': 0.09931981740150789, 'max_depth': 12, 'min_samples_split': 19, 'min_samples_leaf': 1, 'subsample': 0.9125268575227629, 'max_features': None}. Best is trial 1435 with value: 0.45467030752684195.
[I 2024-12-04 15:13:41,578] Trial 1592 finished with value: 0.7249720630675894 and parameters: {'n_estimators': 186, 'learning_rate': 0.06749802989521501, 'max_depth': 12, 'min_samples_split': 17, 'min_samples_leaf': 10, 'subsample': 0.6016584664256965, 'max_features': None}. Best is trial 1435 with value: 0.45467030752684195.
[I 2024-12-04 15:13:42,236] Trial 1572 finished with value: 0.46132938403233137 and parameters: {'n_estimators': 831, 'learning_rate': 0.09894399723334556, 'max_depth': 12, 'min_samples_split': 19, 'min_samples_leaf': 1, 'subsample': 0.9872564644732159, 'max_features': None}. Best is trial 1435 with value: 0.45467030752684195.
[I 2024-12-04 15:13:44,521] Trial 1586 finished with value: 0.5415959336290772 and parameters: {'n_estimators': 497, 'learning_rate': 0.019187059053683377, 'max_depth': 9, 'min_samples_split': 2, 'min_samples_leaf': 1, 'subsample': 0.6179060307968682, 'max_features': None}. Best is trial 1435 with value: 0.45467030752684195.
[I 2024-12-04 15:13:44,610] Trial 1566 finished with value: 0.48938186450140186 and parameters: {'n_estimators': 1039, 'learning_rate': 0.06713603975587694, 'max_depth': 12, 'min_samples_split': 19, 'min_samples_leaf': 1, 'subsample': 0.9844224191858453, 'max_features': None}. Best is trial 1435 with value: 0.45467030752684195.
[I 2024-12-04 15:13:44,899] Trial 1565 finished with value: 0.48968999787354023 and parameters: {'n_estimators': 1074, 'learning_rate': 0.06408554079087268, 'max_depth': 12, 'min_samples_split': 17, 'min_samples_leaf': 1, 'subsample': 0.9580826906309022, 'max_features': None}. Best is trial 1435 with value: 0.45467030752684195.
[I 2024-12-04 15:13:45,214] Trial 1569 finished with value: 0.6694722517350472 and parameters: {'n_estimators': 960, 'learning_rate': 0.09437750870693962, 'max_depth': 12, 'min_samples_split': 14, 'min_samples_leaf': 3, 'subsample': 0.9924708243358251, 'max_features': None}. Best is trial 1435 with value: 0.45467030752684195.
[I 2024-12-04 15:13:46,054] Trial 1567 finished with value: 0.4632120631626166 and parameters: {'n_estimators': 1065, 'learning_rate': 0.09540201604495656, 'max_depth': 12, 'min_samples_split': 19, 'min_samples_leaf': 1, 'subsample': 0.980791301921925, 'max_features': None}. Best is trial 1435 with value: 0.45467030752684195.
[I 2024-12-04 15:13:46,723] Trial 1576 finished with value: 0.4728206669478353 and parameters: {'n_estimators': 826, 'learning_rate': 0.06742458455382293, 'max_depth': 12, 'min_samples_split': 19, 'min_samples_leaf': 1, 'subsample': 0.9771690934487244, 'max_features': None}. Best is trial 1435 with value: 0.45467030752684195.
[I 2024-12-04 15:13:47,100] Trial 1581 finished with value: 0.5186531550413792 and parameters: {'n_estimators': 918, 'learning_rate': 0.06003263530228701, 'max_depth': 11, 'min_samples_split': 18, 'min_samples_leaf': 1, 'subsample': 0.9742536483369402, 'max_features': 'sqrt'}. Best is trial 1435 with value: 0.45467030752684195.
[I 2024-12-04 15:13:47,263] Trial 1582 finished with value: 0.5151995917586545 and parameters: {'n_estimators': 945, 'learning_rate': 0.0841001771714261, 'max_depth': 9, 'min_samples_split': 9, 'min_samples_leaf': 1, 'subsample': 0.8844213924033824, 'max_features': 'sqrt'}. Best is trial 1435 with value: 0.45467030752684195.
[I 2024-12-04 15:13:49,714] Trial 1591 finished with value: 0.5324755388601452 and parameters: {'n_estimators': 443, 'learning_rate': 0.02327872403556874, 'max_depth': 8, 'min_samples_split': 5, 'min_samples_leaf': 1, 'subsample': 0.8812838287925654, 'max_features': None}. Best is trial 1435 with value: 0.45467030752684195.
[I 2024-12-04 15:13:52,310] Trial 1563 finished with value: 0.6623045121862128 and parameters: {'n_estimators': 1475, 'learning_rate': 0.05109039785193836, 'max_depth': 12, 'min_samples_split': 20, 'min_samples_leaf': 3, 'subsample': 0.8977618713415045, 'max_features': None}. Best is trial 1435 with value: 0.45467030752684195.
[I 2024-12-04 15:13:52,394] Trial 1573 finished with value: 0.6310241844690363 and parameters: {'n_estimators': 1062, 'learning_rate': 0.0745520094328131, 'max_depth': 11, 'min_samples_split': 20, 'min_samples_leaf': 2, 'subsample': 0.9736331054853519, 'max_features': None}. Best is trial 1435 with value: 0.45467030752684195.
[I 2024-12-04 15:13:53,723] Trial 1584 finished with value: 0.6444931665075957 and parameters: {'n_estimators': 842, 'learning_rate': 0.08454163927268947, 'max_depth': 12, 'min_samples_split': 20, 'min_samples_leaf': 3, 'subsample': 0.9882801694945291, 'max_features': None}. Best is trial 1435 with value: 0.45467030752684195.
[I 2024-12-04 15:13:55,305] Trial 1579 finished with value: 0.6280377577777109 and parameters: {'n_estimators': 1012, 'learning_rate': 0.06419475956199389, 'max_depth': 10, 'min_samples_split': 19, 'min_samples_leaf': 2, 'subsample': 0.9843618504840675, 'max_features': None}. Best is trial 1435 with value: 0.45467030752684195.
[I 2024-12-04 15:13:56,301] Trial 1580 finished with value: 0.7389908032294826 and parameters: {'n_estimators': 1100, 'learning_rate': 0.01906602745124701, 'max_depth': 6, 'min_samples_split': 10, 'min_samples_leaf': 10, 'subsample': 0.8298679797335407, 'max_features': None}. Best is trial 1435 with value: 0.45467030752684195.
[I 2024-12-04 15:13:56,724] Trial 1583 finished with value: 0.6838836203123142 and parameters: {'n_estimators': 985, 'learning_rate': 0.09906731223568473, 'max_depth': 10, 'min_samples_split': 17, 'min_samples_leaf': 3, 'subsample': 0.9185524064116833, 'max_features': None}. Best is trial 1435 with value: 0.45467030752684195.
[I 2024-12-04 15:13:57,728] Trial 1575 finished with value: 0.49669357647451684 and parameters: {'n_estimators': 1037, 'learning_rate': 0.08128753980468886, 'max_depth': 9, 'min_samples_split': 20, 'min_samples_leaf': 1, 'subsample': 0.9932005611901189, 'max_features': None}. Best is trial 1435 with value: 0.45467030752684195.
[I 2024-12-04 15:13:59,981] Trial 1577 finished with value: 0.47624015097973565 and parameters: {'n_estimators': 1164, 'learning_rate': 0.08295069395417208, 'max_depth': 11, 'min_samples_split': 20, 'min_samples_leaf': 1, 'subsample': 0.995174060594177, 'max_features': None}. Best is trial 1435 with value: 0.45467030752684195.
[I 2024-12-04 15:14:00,042] Trial 1574 finished with value: 0.6420116608235875 and parameters: {'n_estimators': 1242, 'learning_rate': 0.05494478433016171, 'max_depth': 10, 'min_samples_split': 20, 'min_samples_leaf': 3, 'subsample': 0.9766600070282686, 'max_features': None}. Best is trial 1435 with value: 0.45467030752684195.
[I 2024-12-04 15:14:01,462] Trial 1578 finished with value: 0.46647727160880903 and parameters: {'n_estimators': 1160, 'learning_rate': 0.05387481543486837, 'max_depth': 12, 'min_samples_split': 20, 'min_samples_leaf': 1, 'subsample': 0.9957310741574307, 'max_features': None}. Best is trial 1435 with value: 0.45467030752684195.
[I 2024-12-04 15:14:03,752] Trial 1585 finished with value: 0.47846917529148747 and parameters: {'n_estimators': 972, 'learning_rate': 0.06979394768256167, 'max_depth': 12, 'min_samples_split': 20, 'min_samples_leaf': 1, 'subsample': 0.9730762696937109, 'max_features': None}. Best is trial 1435 with value: 0.45467030752684195.
[I 2024-12-04 15:14:06,579] Trial 1587 finished with value: 0.4794523287648968 and parameters: {'n_estimators': 1060, 'learning_rate': 0.08029182796018668, 'max_depth': 12, 'min_samples_split': 20, 'min_samples_leaf': 1, 'subsample': 0.9185335141264812, 'max_features': None}. Best is trial 1435 with value: 0.45467030752684195.
[I 2024-12-04 15:14:07,215] Trial 1599 finished with value: 0.47124243729914644 and parameters: {'n_estimators': 680, 'learning_rate': 0.09721444206319467, 'max_depth': 12, 'min_samples_split': 19, 'min_samples_leaf': 1, 'subsample': 0.9296704711485626, 'max_features': None}. Best is trial 1435 with value: 0.45467030752684195.
[I 2024-12-04 15:14:09,927] Trial 1593 finished with value: 0.47495728809869353 and parameters: {'n_estimators': 926, 'learning_rate': 0.06468929997616976, 'max_depth': 12, 'min_samples_split': 20, 'min_samples_leaf': 1, 'subsample': 0.9979756458498247, 'max_features': None}. Best is trial 1435 with value: 0.45467030752684195.
[I 2024-12-04 15:14:11,145] Trial 1588 finished with value: 0.46953875085907804 and parameters: {'n_estimators': 1169, 'learning_rate': 0.08032651857935637, 'max_depth': 12, 'min_samples_split': 20, 'min_samples_leaf': 1, 'subsample': 0.9905742924264792, 'max_features': None}. Best is trial 1435 with value: 0.45467030752684195.
[I 2024-12-04 15:14:11,147] Trial 1611 finished with value: 0.8942795016409311 and parameters: {'n_estimators': 623, 'learning_rate': 0.011583218095424144, 'max_depth': 6, 'min_samples_split': 8, 'min_samples_leaf': 10, 'subsample': 0.7989414213399387, 'max_features': 'sqrt'}. Best is trial 1435 with value: 0.45467030752684195.
[I 2024-12-04 15:14:11,847] Trial 1603 finished with value: 0.6289343977828636 and parameters: {'n_estimators': 669, 'learning_rate': 0.09571526054636549, 'max_depth': 10, 'min_samples_split': 20, 'min_samples_leaf': 2, 'subsample': 0.9505234822639077, 'max_features': None}. Best is trial 1435 with value: 0.45467030752684195.
[I 2024-12-04 15:14:13,921] Trial 1600 finished with value: 0.4801345570380547 and parameters: {'n_estimators': 878, 'learning_rate': 0.08043350967377041, 'max_depth': 10, 'min_samples_split': 18, 'min_samples_leaf': 1, 'subsample': 0.931387104014964, 'max_features': None}. Best is trial 1435 with value: 0.45467030752684195.
[I 2024-12-04 15:14:15,363] Trial 1601 finished with value: 0.650101635424041 and parameters: {'n_estimators': 811, 'learning_rate': 0.089466370635754, 'max_depth': 10, 'min_samples_split': 18, 'min_samples_leaf': 2, 'subsample': 0.9522902421048869, 'max_features': None}. Best is trial 1435 with value: 0.45467030752684195.
[I 2024-12-04 15:14:16,049] Trial 1614 finished with value: 0.6844536034050864 and parameters: {'n_estimators': 657, 'learning_rate': 0.09876772705586392, 'max_depth': 6, 'min_samples_split': 13, 'min_samples_leaf': 2, 'subsample': 0.9205882506505169, 'max_features': 'sqrt'}. Best is trial 1435 with value: 0.45467030752684195.
[I 2024-12-04 15:14:17,689] Trial 1589 finished with value: 0.6279947322751139 and parameters: {'n_estimators': 1281, 'learning_rate': 0.06061215461865227, 'max_depth': 12, 'min_samples_split': 17, 'min_samples_leaf': 2, 'subsample': 0.9998181600118844, 'max_features': None}. Best is trial 1435 with value: 0.45467030752684195.
[I 2024-12-04 15:14:18,317] Trial 1605 finished with value: 0.4925360635878386 and parameters: {'n_estimators': 761, 'learning_rate': 0.06947015851184775, 'max_depth': 12, 'min_samples_split': 16, 'min_samples_leaf': 1, 'subsample': 0.9220217446811909, 'max_features': None}. Best is trial 1435 with value: 0.45467030752684195.
[I 2024-12-04 15:14:18,909] Trial 1606 finished with value: 0.5128338303955832 and parameters: {'n_estimators': 754, 'learning_rate': 0.08675011598039262, 'max_depth': 12, 'min_samples_split': 15, 'min_samples_leaf': 1, 'subsample': 0.9651006222548402, 'max_features': None}. Best is trial 1435 with value: 0.45467030752684195.
[I 2024-12-04 15:14:19,939] Trial 1607 finished with value: 0.7587290664243069 and parameters: {'n_estimators': 1088, 'learning_rate': 0.03166414582419202, 'max_depth': 6, 'min_samples_split': 12, 'min_samples_leaf': 6, 'subsample': 0.9417246506074999, 'max_features': 'log2'}. Best is trial 1435 with value: 0.45467030752684195.
[I 2024-12-04 15:14:21,478] Trial 1598 finished with value: 0.610596113744866 and parameters: {'n_estimators': 1131, 'learning_rate': 0.08884180727438969, 'max_depth': 12, 'min_samples_split': 17, 'min_samples_leaf': 2, 'subsample': 0.9968819584557894, 'max_features': None}. Best is trial 1435 with value: 0.45467030752684195.
[I 2024-12-04 15:14:21,481] Trial 1612 finished with value: 0.9997947383193527 and parameters: {'n_estimators': 952, 'learning_rate': 0.020490591086889064, 'max_depth': 4, 'min_samples_split': 19, 'min_samples_leaf': 9, 'subsample': 0.6259663552049419, 'max_features': 'log2'}. Best is trial 1435 with value: 0.45467030752684195.
[I 2024-12-04 15:14:22,943] Trial 1590 finished with value: 0.48342839679895394 and parameters: {'n_estimators': 1402, 'learning_rate': 0.033071706373715495, 'max_depth': 12, 'min_samples_split': 20, 'min_samples_leaf': 1, 'subsample': 0.8776508294266334, 'max_features': None}. Best is trial 1435 with value: 0.45467030752684195.
[I 2024-12-04 15:14:23,143] Trial 1594 finished with value: 0.48349530112680905 and parameters: {'n_estimators': 1284, 'learning_rate': 0.0352156199731744, 'max_depth': 10, 'min_samples_split': 18, 'min_samples_leaf': 1, 'subsample': 0.9146350956541366, 'max_features': None}. Best is trial 1435 with value: 0.45467030752684195.
