[I 2024-12-03 18:52:59,369] Trial 2392 finished with value: 0.5185801835850313 and parameters: {'kernel': 'rbf', 'C': 98.47363588415364, 'gamma': 0.019388151161478188, 'epsilon': 0.20876396279308887}. Best is trial 1119 with value: 0.4485361816812923.
[I 2024-12-03 18:52:59,826] Trial 2405 finished with value: 0.4706279313637363 and parameters: {'kernel': 'rbf', 'C': 18.118718975883525, 'gamma': 0.03162638101534697, 'epsilon': 0.053724741128534544}. Best is trial 1119 with value: 0.4485361816812923.
[I 2024-12-03 18:52:59,827] Trial 2407 finished with value: 0.5647891660844143 and parameters: {'kernel': 'rbf', 'C': 19.647531356895605, 'gamma': 0.07091551094510816, 'epsilon': 0.1306898152483009}. Best is trial 1119 with value: 0.4485361816812923.
[I 2024-12-03 18:52:59,947] Trial 2401 finished with value: 0.4727608754952948 and parameters: {'kernel': 'rbf', 'C': 95.61615704414181, 'gamma': 0.008223858715863173, 'epsilon': 0.04797091097924438}. Best is trial 1119 with value: 0.4485361816812923.
[I 2024-12-03 18:53:00,067] Trial 2408 finished with value: 0.8171540956080144 and parameters: {'kernel': 'poly', 'C': 95.44637064402215, 'gamma': 0.07345992623749537, 'epsilon': 0.06338566862035562}. Best is trial 1119 with value: 0.4485361816812923.
[I 2024-12-03 18:53:00,074] Trial 2403 finished with value: 0.45916012155936875 and parameters: {'kernel': 'rbf', 'C': 33.86469150573296, 'gamma': 0.02291147358727684, 'epsilon': 0.04831663101794172}. Best is trial 1119 with value: 0.4485361816812923.
[I 2024-12-03 18:53:00,074] Trial 2390 finished with value: 0.5490291910274623 and parameters: {'kernel': 'rbf', 'C': 4.019545865900182, 'gamma': 0.030134443733840974, 'epsilon': 0.03214417116261047}. Best is trial 1119 with value: 0.4485361816812923.
[I 2024-12-03 18:53:00,430] Trial 2397 finished with value: 0.528643768507426 and parameters: {'kernel': 'rbf', 'C': 96.8139292172689, 'gamma': 0.0036177689599258805, 'epsilon': 0.03596962094604514}. Best is trial 1119 with value: 0.4485361816812923.
[I 2024-12-03 18:53:00,610] Trial 2412 finished with value: 0.5272658949987159 and parameters: {'kernel': 'rbf', 'C': 28.4519099181711, 'gamma': 0.04480900923237156, 'epsilon': 0.1379833647200818}. Best is trial 1119 with value: 0.4485361816812923.
[I 2024-12-03 18:53:00,846] Trial 2410 finished with value: 0.4699563581772653 and parameters: {'kernel': 'rbf', 'C': 28.894516420556737, 'gamma': 0.023755518464576297, 'epsilon': 0.15045506086282517}. Best is trial 1119 with value: 0.4485361816812923.
[I 2024-12-03 18:53:00,856] Trial 2413 finished with value: 0.5065693630323272 and parameters: {'kernel': 'rbf', 'C': 23.43492787408544, 'gamma': 0.011927148535031388, 'epsilon': 0.049664236898883156}. Best is trial 1119 with value: 0.4485361816812923.
[I 2024-12-03 18:53:00,859] Trial 2406 finished with value: 0.5829231559713423 and parameters: {'kernel': 'rbf', 'C': 86.32321544780864, 'gamma': 0.042293394784859197, 'epsilon': 0.13869978289445004}. Best is trial 1119 with value: 0.4485361816812923.
[I 2024-12-03 18:53:01,194] Trial 2415 finished with value: 0.6312243428587485 and parameters: {'kernel': 'linear', 'C': 0.09668720891671208, 'gamma': 0.00021916848153716328, 'epsilon': 0.0012746869314826758}. Best is trial 1119 with value: 0.4485361816812923.
[I 2024-12-03 18:53:02,458] Trial 2394 finished with value: 0.5236766019931551 and parameters: {'kernel': 'rbf', 'C': 19.287286646122034, 'gamma': 0.010836099805950551, 'epsilon': 0.0806449871010348}. Best is trial 1119 with value: 0.4485361816812923.
[I 2024-12-03 18:53:02,688] Trial 2409 finished with value: 0.6010565603294051 and parameters: {'kernel': 'rbf', 'C': 22.445083585814093, 'gamma': 0.00272498149507421, 'epsilon': 0.06824859738731047}. Best is trial 1119 with value: 0.4485361816812923.
[I 2024-12-03 18:53:02,809] Trial 2393 finished with value: 0.4893658660697706 and parameters: {'kernel': 'rbf', 'C': 98.33322164672248, 'gamma': 0.02527189436144171, 'epsilon': 0.04228636498523993}. Best is trial 1119 with value: 0.4485361816812923.
[I 2024-12-03 18:53:03,292] Trial 2417 finished with value: 0.5653221981563128 and parameters: {'kernel': 'rbf', 'C': 97.43785795862037, 'gamma': 0.037150974667209055, 'epsilon': 0.09728078193452899}. Best is trial 1119 with value: 0.4485361816812923.
[I 2024-12-03 18:53:04,620] Trial 2418 finished with value: 0.45853183465986347 and parameters: {'kernel': 'rbf', 'C': 98.55401648959023, 'gamma': 0.010570003251631769, 'epsilon': 0.05473140349987854}. Best is trial 1119 with value: 0.4485361816812923.
[I 2024-12-03 18:53:06,025] Trial 2411 finished with value: 0.5428886158530556 and parameters: {'kernel': 'rbf', 'C': 93.10142642363459, 'gamma': 0.031177417105034272, 'epsilon': 0.07779929115230348}. Best is trial 1119 with value: 0.4485361816812923.
[I 2024-12-03 18:53:06,722] Trial 2416 finished with value: 0.4904056708769986 and parameters: {'kernel': 'rbf', 'C': 19.078991553274673, 'gamma': 0.016715772343546445, 'epsilon': 0.07161396758305387}. Best is trial 1119 with value: 0.4485361816812923.
[I 2024-12-03 18:53:06,723] Trial 2414 finished with value: 1.3790747889772554 and parameters: {'kernel': 'poly', 'C': 0.00846313509826049, 'gamma': 0.00021545840355267174, 'epsilon': 0.12078128953718814}. Best is trial 1119 with value: 0.4485361816812923.
[I 2024-12-03 18:53:07,165] Trial 2420 finished with value: 0.556401851572009 and parameters: {'kernel': 'rbf', 'C': 91.94698862058488, 'gamma': 0.0022906707996644326, 'epsilon': 0.05632534977434544}. Best is trial 1119 with value: 0.4485361816812923.
[I 2024-12-03 18:53:08,436] Trial 2423 finished with value: 0.5882160592213236 and parameters: {'kernel': 'linear', 'C': 0.7375530053763246, 'gamma': 0.7244581819026383, 'epsilon': 0.030864598098281234}. Best is trial 1119 with value: 0.4485361816812923.
[I 2024-12-03 18:53:08,609] Trial 2424 finished with value: 0.4616770125095333 and parameters: {'kernel': 'rbf', 'C': 98.33706764127601, 'gamma': 0.013809417146681964, 'epsilon': 0.10961482748999193}. Best is trial 1119 with value: 0.4485361816812923.
[I 2024-12-03 18:53:08,693] Trial 2421 finished with value: 0.608464954031585 and parameters: {'kernel': 'rbf', 'C': 23.6870479127444, 'gamma': 0.18351196609294568, 'epsilon': 0.09588032815944406}. Best is trial 1119 with value: 0.4485361816812923.
[I 2024-12-03 18:53:08,791] Trial 2428 finished with value: 0.6045323739529558 and parameters: {'kernel': 'rbf', 'C': 75.93161247499953, 'gamma': 0.16191117453547446, 'epsilon': 0.07780539828192376}. Best is trial 1119 with value: 0.4485361816812923.
[I 2024-12-03 18:53:09,195] Trial 2419 finished with value: 0.4742047015088025 and parameters: {'kernel': 'rbf', 'C': 22.053256148682905, 'gamma': 0.01799795896933392, 'epsilon': 0.057057230235624264}. Best is trial 1119 with value: 0.4485361816812923.
[I 2024-12-03 18:53:09,368] Trial 2431 finished with value: 0.5282902404195615 and parameters: {'kernel': 'rbf', 'C': 98.35011334574688, 'gamma': 0.0035559145575012815, 'epsilon': 0.040227189183286195}. Best is trial 1119 with value: 0.4485361816812923.
[I 2024-12-03 18:53:09,619] Trial 2433 finished with value: 39.296872227441696 and parameters: {'kernel': 'sigmoid', 'C': 10.286166792487796, 'gamma': 0.020439523634103344, 'epsilon': 0.029439022186211382}. Best is trial 1119 with value: 0.4485361816812923.
[I 2024-12-03 18:53:09,739] Trial 2249 finished with value: 1.0761361566107972 and parameters: {'kernel': 'poly', 'C': 41.92129367732284, 'gamma': 0.3800003258872718, 'epsilon': 0.00111886902478255}. Best is trial 1119 with value: 0.4485361816812923.
[I 2024-12-03 18:53:09,741] Trial 2432 finished with value: 0.6062357341301213 and parameters: {'kernel': 'rbf', 'C': 99.45983532100252, 'gamma': 0.04497553510722247, 'epsilon': 0.029193945141744976}. Best is trial 1119 with value: 0.4485361816812923.
[I 2024-12-03 18:53:09,744] Trial 2425 finished with value: 0.5471697064947497 and parameters: {'kernel': 'rbf', 'C': 23.425226122422753, 'gamma': 0.006621471154183771, 'epsilon': 0.027233418817137662}. Best is trial 1119 with value: 0.4485361816812923.
[I 2024-12-03 18:53:10,221] Trial 2430 finished with value: 0.4503557658213971 and parameters: {'kernel': 'rbf', 'C': 92.60269708435385, 'gamma': 0.011841726542321704, 'epsilon': 0.06597051084243766}. Best is trial 1119 with value: 0.4485361816812923.
[I 2024-12-03 18:53:10,600] Trial 2436 finished with value: 0.47250139794138757 and parameters: {'kernel': 'rbf', 'C': 98.88131508273035, 'gamma': 0.021171830921166104, 'epsilon': 0.04135793060798999}. Best is trial 1119 with value: 0.4485361816812923.
[I 2024-12-03 18:53:10,603] Trial 2422 finished with value: 0.5948971066426442 and parameters: {'kernel': 'rbf', 'C': 5.729817760496854, 'gamma': 0.009856374397559752, 'epsilon': 0.1577064610544072}. Best is trial 1119 with value: 0.4485361816812923.
[I 2024-12-03 18:53:10,711] Trial 2435 finished with value: 0.46266249237971285 and parameters: {'kernel': 'rbf', 'C': 94.21795854486642, 'gamma': 0.010443288975384518, 'epsilon': 0.04575181408593814}. Best is trial 1119 with value: 0.4485361816812923.
[I 2024-12-03 18:53:10,727] Trial 2426 finished with value: 0.5290535225753492 and parameters: {'kernel': 'rbf', 'C': 88.68555655215967, 'gamma': 0.007077080406765652, 'epsilon': 0.257202838286042}. Best is trial 1119 with value: 0.4485361816812923.
[I 2024-12-03 18:53:10,838] Trial 2427 finished with value: 0.5257018944731378 and parameters: {'kernel': 'rbf', 'C': 97.80545291174208, 'gamma': 0.003973118829353545, 'epsilon': 0.14370631688979643}. Best is trial 1119 with value: 0.4485361816812923.
[I 2024-12-03 18:53:11,090] Trial 2438 finished with value: 0.4701209316549894 and parameters: {'kernel': 'rbf', 'C': 25.928893424802716, 'gamma': 0.02633230003715873, 'epsilon': 0.08633392433306186}. Best is trial 1119 with value: 0.4485361816812923.
[I 2024-12-03 18:53:11,360] Trial 2437 finished with value: 0.5742897383920643 and parameters: {'kernel': 'rbf', 'C': 98.2685733532555, 'gamma': 0.0015042312696530488, 'epsilon': 0.05432001134018797}. Best is trial 1119 with value: 0.4485361816812923.
[I 2024-12-03 18:53:11,589] Trial 2429 finished with value: 0.5202064524855617 and parameters: {'kernel': 'rbf', 'C': 17.74877234876702, 'gamma': 0.016571557016911966, 'epsilon': 0.38576111038618366}. Best is trial 1119 with value: 0.4485361816812923.
[I 2024-12-03 18:53:11,735] Trial 2439 finished with value: 0.481334731888415 and parameters: {'kernel': 'rbf', 'C': 98.04876734202378, 'gamma': 0.023550257130253344, 'epsilon': 0.04230228270161484}. Best is trial 1119 with value: 0.4485361816812923.
[I 2024-12-03 18:53:11,916] Trial 2434 finished with value: 0.4746611145116249 and parameters: {'kernel': 'rbf', 'C': 97.01072722904368, 'gamma': 0.012522954186415433, 'epsilon': 0.1767035750903729}. Best is trial 1119 with value: 0.4485361816812923.
[I 2024-12-03 18:53:12,600] Trial 2443 finished with value: 0.4755652511518672 and parameters: {'kernel': 'rbf', 'C': 23.120878169143033, 'gamma': 0.01786167593245999, 'epsilon': 0.027763835401559144}. Best is trial 1119 with value: 0.4485361816812923.
[I 2024-12-03 18:53:13,277] Trial 2442 finished with value: 0.7763537846231071 and parameters: {'kernel': 'poly', 'C': 91.48525162807009, 'gamma': 0.0163501704580783, 'epsilon': 0.06972404181529097}. Best is trial 1119 with value: 0.4485361816812923.
[I 2024-12-03 18:53:13,984] Trial 2441 finished with value: 0.7188146343606284 and parameters: {'kernel': 'rbf', 'C': 4.484771136220825, 'gamma': 0.005044189197648521, 'epsilon': 0.05382943326590795}. Best is trial 1119 with value: 0.4485361816812923.
[I 2024-12-03 18:53:14,931] Trial 2445 finished with value: 0.5751476875355331 and parameters: {'kernel': 'rbf', 'C': 7.428918470085254, 'gamma': 0.11939831167021699, 'epsilon': 0.03991492688155699}. Best is trial 1119 with value: 0.4485361816812923.
[I 2024-12-03 18:53:15,520] Trial 2440 finished with value: 0.5222565632017409 and parameters: {'kernel': 'rbf', 'C': 27.159793579341898, 'gamma': 0.009755865797224034, 'epsilon': 0.12395540963422096}. Best is trial 1119 with value: 0.4485361816812923.
[I 2024-12-03 18:53:16,580] Trial 2451 finished with value: 0.4654469768170507 and parameters: {'kernel': 'rbf', 'C': 98.8450993505274, 'gamma': 0.009226789059408208, 'epsilon': 0.06289988076572282}. Best is trial 1119 with value: 0.4485361816812923.
[I 2024-12-03 18:53:17,169] Trial 2450 finished with value: 0.5475507288924634 and parameters: {'kernel': 'rbf', 'C': 98.18589830019702, 'gamma': 0.02081806430909512, 'epsilon': 0.3597426483599962}. Best is trial 1119 with value: 0.4485361816812923.
[I 2024-12-03 18:53:18,046] Trial 2456 finished with value: 0.470097792370446 and parameters: {'kernel': 'rbf', 'C': 92.7742608505712, 'gamma': 0.011523805155265786, 'epsilon': 0.1646976254471202}. Best is trial 1119 with value: 0.4485361816812923.
[I 2024-12-03 18:53:18,261] Trial 2460 finished with value: 0.8457126919150746 and parameters: {'kernel': 'poly', 'C': 85.18580365752882, 'gamma': 0.012543324480259037, 'epsilon': 0.23819779726243936}. Best is trial 1119 with value: 0.4485361816812923.
[I 2024-12-03 18:53:19,388] Trial 2453 finished with value: 0.5654068726306062 and parameters: {'kernel': 'rbf', 'C': 27.251942329330614, 'gamma': 0.004073809306947968, 'epsilon': 0.07837468233667769}. Best is trial 1119 with value: 0.4485361816812923.
[I 2024-12-03 18:53:19,432] Trial 2455 finished with value: 0.5789111433429123 and parameters: {'kernel': 'rbf', 'C': 19.623741511220032, 'gamma': 0.004067368739697646, 'epsilon': 0.18598227012389937}. Best is trial 1119 with value: 0.4485361816812923.
[I 2024-12-03 18:53:19,435] Trial 2452 finished with value: 1.292912266970601 and parameters: {'kernel': 'poly', 'C': 6.219128656806267, 'gamma': 0.0011779900043435035, 'epsilon': 0.03109620957392904}. Best is trial 1119 with value: 0.4485361816812923.
[I 2024-12-03 18:53:19,436] Trial 2444 finished with value: 0.45914643120276616 and parameters: {'kernel': 'rbf', 'C': 97.70845648595112, 'gamma': 0.009607524098703694, 'epsilon': 0.1221491470859147}. Best is trial 1119 with value: 0.4485361816812923.
[I 2024-12-03 18:53:19,527] Trial 2465 finished with value: 0.4812796633520235 and parameters: {'kernel': 'rbf', 'C': 22.785073368763193, 'gamma': 0.01683659304957541, 'epsilon': 0.024378225253387432}. Best is trial 1119 with value: 0.4485361816812923.
[I 2024-12-03 18:53:19,885] Trial 2449 finished with value: 0.545279207743287 and parameters: {'kernel': 'rbf', 'C': 21.82295164560383, 'gamma': 0.006886582656915347, 'epsilon': 0.04821029895794432}. Best is trial 1119 with value: 0.4485361816812923.
[I 2024-12-03 18:53:20,390] Trial 2454 finished with value: 0.8561847222562673 and parameters: {'kernel': 'linear', 'C': 0.002503023298508759, 'gamma': 0.000580114450011408, 'epsilon': 0.011335234493954792}. Best is trial 1119 with value: 0.4485361816812923.
[I 2024-12-03 18:53:20,803] Trial 2446 finished with value: 1.2626306855024023 and parameters: {'kernel': 'sigmoid', 'C': 0.035537577440668135, 'gamma': 0.28017175310879466, 'epsilon': 0.002296815018013326}. Best is trial 1119 with value: 0.4485361816812923.
[I 2024-12-03 18:53:21,041] Trial 2469 finished with value: 0.5514640720325844 and parameters: {'kernel': 'rbf', 'C': 4.461245551470385, 'gamma': 0.02427214472555938, 'epsilon': 0.08918846763553809}. Best is trial 1119 with value: 0.4485361816812923.
[I 2024-12-03 18:53:21,436] Trial 2448 finished with value: 0.6128250444786626 and parameters: {'kernel': 'rbf', 'C': 99.87539047881735, 'gamma': 0.06875564815747363, 'epsilon': 0.15924240178343688}. Best is trial 1119 with value: 0.4485361816812923.
[I 2024-12-03 18:53:21,946] Trial 2468 finished with value: 0.49732201327418646 and parameters: {'kernel': 'rbf', 'C': 94.65094192466678, 'gamma': 0.006021653722562168, 'epsilon': 0.01851603039027122}. Best is trial 1119 with value: 0.4485361816812923.
[I 2024-12-03 18:53:22,102] Trial 2466 finished with value: 0.5843894396324323 and parameters: {'kernel': 'linear', 'C': 0.5754256709415587, 'gamma': 0.0011960957701417836, 'epsilon': 0.028416895938750207}. Best is trial 1119 with value: 0.4485361816812923.
[I 2024-12-03 18:53:22,287] Trial 2463 finished with value: 0.4767012735006903 and parameters: {'kernel': 'rbf', 'C': 24.987792590436936, 'gamma': 0.015685054613201195, 'epsilon': 0.14614185129022952}. Best is trial 1119 with value: 0.4485361816812923.
[I 2024-12-03 18:53:22,689] Trial 2470 finished with value: 0.9579198378167801 and parameters: {'kernel': 'rbf', 'C': 0.353944995119877, 'gamma': 0.0016688355135397034, 'epsilon': 0.040122414506258926}. Best is trial 1119 with value: 0.4485361816812923.
[I 2024-12-03 18:53:22,913] Trial 2459 finished with value: 0.565987287928824 and parameters: {'kernel': 'rbf', 'C': 23.44876129784323, 'gamma': 0.004395688864009912, 'epsilon': 0.09827480319948353}. Best is trial 1119 with value: 0.4485361816812923.
[I 2024-12-03 18:53:23,220] Trial 2467 finished with value: 0.46847754282033055 and parameters: {'kernel': 'rbf', 'C': 32.82593396979971, 'gamma': 0.016718739202027384, 'epsilon': 0.016651009257863243}. Best is trial 1119 with value: 0.4485361816812923.
[I 2024-12-03 18:53:23,368] Trial 2457 finished with value: 0.5585909903260782 and parameters: {'kernel': 'linear', 'C': 11.573360565804355, 'gamma': 0.04332001888527314, 'epsilon': 0.02960743020601982}. Best is trial 1119 with value: 0.4485361816812923.
[I 2024-12-03 18:53:23,600] Trial 2464 finished with value: 0.6046007927755297 and parameters: {'kernel': 'rbf', 'C': 30.79885475614882, 'gamma': 0.11878245975724477, 'epsilon': 0.056884945216848434}. Best is trial 1119 with value: 0.4485361816812923.
[I 2024-12-03 18:53:24,235] Trial 2447 finished with value: 0.5432067434302289 and parameters: {'kernel': 'rbf', 'C': 98.96500641280504, 'gamma': 0.030806993499630453, 'epsilon': 0.05926501457373931}. Best is trial 1119 with value: 0.4485361816812923.
[I 2024-12-03 18:53:24,401] Trial 2462 finished with value: 0.45205642863542117 and parameters: {'kernel': 'rbf', 'C': 94.4092869562068, 'gamma': 0.011205469104071419, 'epsilon': 0.09677278033465742}. Best is trial 1119 with value: 0.4485361816812923.
[I 2024-12-03 18:53:24,711] Trial 2472 finished with value: 0.6015849290530171 and parameters: {'kernel': 'rbf', 'C': 26.413010572341964, 'gamma': 0.0023600767958903094, 'epsilon': 0.027964138803433798}. Best is trial 1119 with value: 0.4485361816812923.
[I 2024-12-03 18:53:25,921] Trial 2478 finished with value: 0.5213857748374756 and parameters: {'kernel': 'rbf', 'C': 92.41246405947057, 'gamma': 0.0040815559418639616, 'epsilon': 0.03083457977150525}. Best is trial 1119 with value: 0.4485361816812923.
[I 2024-12-03 18:53:25,932] Trial 2471 finished with value: 0.51112767777831 and parameters: {'kernel': 'rbf', 'C': 12.113195095826201, 'gamma': 0.04100669214136981, 'epsilon': 0.27032052755359726}. Best is trial 1119 with value: 0.4485361816812923.
[I 2024-12-03 18:53:26,440] Trial 2473 finished with value: 0.5003055418055873 and parameters: {'kernel': 'rbf', 'C': 23.738561239771045, 'gamma': 0.04745166047639827, 'epsilon': 0.04823509298729781}. Best is trial 1119 with value: 0.4485361816812923.
[I 2024-12-03 18:53:27,041] Trial 2477 finished with value: 0.47136863470858475 and parameters: {'kernel': 'rbf', 'C': 23.878501561705562, 'gamma': 0.019678325665427876, 'epsilon': 0.06878471699021693}. Best is trial 1119 with value: 0.4485361816812923.
[I 2024-12-03 18:53:27,209] Trial 2458 finished with value: 78.33342528649791 and parameters: {'kernel': 'sigmoid', 'C': 9.930444459671964, 'gamma': 0.08251959879837896, 'epsilon': 0.2998346494662363}. Best is trial 1119 with value: 0.4485361816812923.
[I 2024-12-03 18:53:27,472] Trial 2461 finished with value: 0.46733056533094114 and parameters: {'kernel': 'rbf', 'C': 22.725904106523437, 'gamma': 0.020973372879888007, 'epsilon': 0.05992806638819817}. Best is trial 1119 with value: 0.4485361816812923.
[I 2024-12-03 18:53:28,149] Trial 2475 finished with value: 0.5597052202859116 and parameters: {'kernel': 'rbf', 'C': 96.31306722596588, 'gamma': 0.0025850924276303476, 'epsilon': 0.23963479639453672}. Best is trial 1119 with value: 0.4485361816812923.
[I 2024-12-03 18:53:28,297] Trial 2474 finished with value: 0.46504181453956533 and parameters: {'kernel': 'rbf', 'C': 97.2012448887587, 'gamma': 0.013753244763314196, 'epsilon': 0.12288216826774304}. Best is trial 1119 with value: 0.4485361816812923.
[I 2024-12-03 18:53:28,705] Trial 2483 finished with value: 0.4945571744020103 and parameters: {'kernel': 'rbf', 'C': 24.78672163802362, 'gamma': 0.046074568934184906, 'epsilon': 0.0179074450472787}. Best is trial 1119 with value: 0.4485361816812923.
[I 2024-12-03 18:53:29,492] Trial 2480 finished with value: 0.5462907388740983 and parameters: {'kernel': 'rbf', 'C': 94.41120406221762, 'gamma': 0.0313277117943804, 'epsilon': 0.12643233717099894}. Best is trial 1119 with value: 0.4485361816812923.
[I 2024-12-03 18:53:29,655] Trial 2476 finished with value: 0.5099086614773563 and parameters: {'kernel': 'rbf', 'C': 30.153073999996735, 'gamma': 0.009863615703700932, 'epsilon': 0.030676115884607225}. Best is trial 1119 with value: 0.4485361816812923.
[I 2024-12-03 18:53:29,657] Trial 2484 finished with value: 0.5741741711511573 and parameters: {'kernel': 'rbf', 'C': 28.441292084997613, 'gamma': 0.003104320262423728, 'epsilon': 0.08753424807817382}. Best is trial 1119 with value: 0.4485361816812923.
[I 2024-12-03 18:53:29,674] Trial 2491 finished with value: 0.5631461638389497 and parameters: {'kernel': 'rbf', 'C': 17.13163222892324, 'gamma': 0.005697102219288554, 'epsilon': 0.054737611543829424}. Best is trial 1119 with value: 0.4485361816812923.
[I 2024-12-03 18:53:29,683] Trial 2486 finished with value: 0.651220091223766 and parameters: {'kernel': 'linear', 'C': 0.11868894156480493, 'gamma': 0.0004325456607051119, 'epsilon': 0.9769186301475073}. Best is trial 1119 with value: 0.4485361816812923.
