[I 2024-12-04 11:51:47,418] Trial 82 finished with value: 0.6038534103984753 and parameters: {'max_depth': 16, 'min_samples_split': 2, 'min_samples_leaf': 1, 'max_features': 'sqrt', 'criterion': 'friedman_mse', 'splitter': 'best'}. Best is trial 72 with value: 0.5750297489827128.
[I 2024-12-04 11:51:47,785] Trial 77 finished with value: 0.8999599516952949 and parameters: {'max_depth': 9, 'min_samples_split': 2, 'min_samples_leaf': 1, 'max_features': 'log2', 'criterion': 'friedman_mse', 'splitter': 'best'}. Best is trial 72 with value: 0.5750297489827128.
[I 2024-12-04 11:51:48,146] Trial 80 finished with value: 0.7177525863158705 and parameters: {'max_depth': 16, 'min_samples_split': 3, 'min_samples_leaf': 2, 'max_features': 'log2', 'criterion': 'friedman_mse', 'splitter': 'best'}. Best is trial 72 with value: 0.5750297489827128.
[I 2024-12-04 11:51:48,235] Trial 75 finished with value: 1.2821018421432997 and parameters: {'max_depth': 26, 'min_samples_split': 2, 'min_samples_leaf': 2, 'max_features': 'log2', 'criterion': 'squared_error', 'splitter': 'random'}. Best is trial 72 with value: 0.5750297489827128.
[I 2024-12-04 11:51:48,409] Trial 74 finished with value: 0.6552257141217156 and parameters: {'max_depth': 23, 'min_samples_split': 8, 'min_samples_leaf': 1, 'max_features': 'log2', 'criterion': 'friedman_mse', 'splitter': 'best'}. Best is trial 72 with value: 0.5750297489827128.
[I 2024-12-04 11:51:49,362] Trial 94 finished with value: 0.6831799031333035 and parameters: {'max_depth': 22, 'min_samples_split': 7, 'min_samples_leaf': 1, 'max_features': 'sqrt', 'criterion': 'friedman_mse', 'splitter': 'best'}. Best is trial 72 with value: 0.5750297489827128.
[I 2024-12-04 11:51:49,475] Trial 87 finished with value: 1.2566943586703483 and parameters: {'max_depth': 15, 'min_samples_split': 6, 'min_samples_leaf': 1, 'max_features': 'log2', 'criterion': 'friedman_mse', 'splitter': 'random'}. Best is trial 72 with value: 0.5750297489827128.
[I 2024-12-04 11:51:49,501] Trial 89 finished with value: 1.2254374381306945 and parameters: {'max_depth': 13, 'min_samples_split': 3, 'min_samples_leaf': 3, 'max_features': 'sqrt', 'criterion': 'friedman_mse', 'splitter': 'best'}. Best is trial 72 with value: 0.5750297489827128.
[I 2024-12-04 11:51:49,511] Trial 93 finished with value: 1.36280343027112 and parameters: {'max_depth': 23, 'min_samples_split': 2, 'min_samples_leaf': 4, 'max_features': 'log2', 'criterion': 'absolute_error', 'splitter': 'best'}. Best is trial 72 with value: 0.5750297489827128.
[I 2024-12-04 11:51:50,474] Trial 88 finished with value: 1.1261154552845143 and parameters: {'max_depth': 27, 'min_samples_split': 4, 'min_samples_leaf': 2, 'max_features': 'sqrt', 'criterion': 'friedman_mse', 'splitter': 'best'}. Best is trial 72 with value: 0.5750297489827128.
[I 2024-12-04 11:51:50,608] Trial 99 finished with value: 0.6857302019523 and parameters: {'max_depth': 19, 'min_samples_split': 2, 'min_samples_leaf': 2, 'max_features': 'sqrt', 'criterion': 'squared_error', 'splitter': 'best'}. Best is trial 72 with value: 0.5750297489827128.
[I 2024-12-04 11:51:50,622] Trial 79 finished with value: 0.5750297489827128 and parameters: {'max_depth': 26, 'min_samples_split': 2, 'min_samples_leaf': 1, 'max_features': 'log2', 'criterion': 'squared_error', 'splitter': 'best'}. Best is trial 72 with value: 0.5750297489827128.
[I 2024-12-04 11:51:50,909] Trial 92 finished with value: 1.292655019777175 and parameters: {'max_depth': 14, 'min_samples_split': 2, 'min_samples_leaf': 3, 'max_features': 'log2', 'criterion': 'friedman_mse', 'splitter': 'random'}. Best is trial 72 with value: 0.5750297489827128.
[I 2024-12-04 11:51:51,091] Trial 78 finished with value: 1.0201410606892172 and parameters: {'max_depth': 24, 'min_samples_split': 2, 'min_samples_leaf': 3, 'max_features': 'log2', 'criterion': 'absolute_error', 'splitter': 'best'}. Best is trial 72 with value: 0.5750297489827128.
[I 2024-12-04 11:51:51,314] Trial 90 finished with value: 0.5995818917979532 and parameters: {'max_depth': 28, 'min_samples_split': 2, 'min_samples_leaf': 1, 'max_features': 'log2', 'criterion': 'squared_error', 'splitter': 'best'}. Best is trial 72 with value: 0.5750297489827128.
[I 2024-12-04 11:51:51,815] Trial 85 finished with value: 0.8501416772964244 and parameters: {'max_depth': 15, 'min_samples_split': 3, 'min_samples_leaf': 1, 'max_features': 'sqrt', 'criterion': 'friedman_mse', 'splitter': 'best'}. Best is trial 72 with value: 0.5750297489827128.
[I 2024-12-04 11:51:51,824] Trial 91 finished with value: 0.924799806170231 and parameters: {'max_depth': 31, 'min_samples_split': 3, 'min_samples_leaf': 3, 'max_features': 'log2', 'criterion': 'squared_error', 'splitter': 'best'}. Best is trial 72 with value: 0.5750297489827128.
[I 2024-12-04 11:51:51,993] Trial 81 finished with value: 0.7208894692704672 and parameters: {'max_depth': 21, 'min_samples_split': 5, 'min_samples_leaf': 1, 'max_features': 'log2', 'criterion': 'friedman_mse', 'splitter': 'best'}. Best is trial 72 with value: 0.5750297489827128.
[I 2024-12-04 11:51:52,697] Trial 98 finished with value: 0.6130367077337987 and parameters: {'max_depth': 15, 'min_samples_split': 2, 'min_samples_leaf': 1, 'max_features': 'log2', 'criterion': 'friedman_mse', 'splitter': 'best'}. Best is trial 72 with value: 0.5750297489827128.
[I 2024-12-04 11:51:53,026] Trial 101 finished with value: 0.7177525863158705 and parameters: {'max_depth': 22, 'min_samples_split': 3, 'min_samples_leaf': 2, 'max_features': 'log2', 'criterion': 'squared_error', 'splitter': 'best'}. Best is trial 72 with value: 0.5750297489827128.
[I 2024-12-04 11:51:54,743] Trial 97 finished with value: 0.562347252770589 and parameters: {'max_depth': 25, 'min_samples_split': 2, 'min_samples_leaf': 1, 'max_features': 'log2', 'criterion': 'squared_error', 'splitter': 'best'}. Best is trial 97 with value: 0.562347252770589.
[I 2024-12-04 11:51:54,744] Trial 112 finished with value: 0.6444892365386241 and parameters: {'max_depth': 12, 'min_samples_split': 4, 'min_samples_leaf': 1, 'max_features': 'log2', 'criterion': 'absolute_error', 'splitter': 'best'}. Best is trial 97 with value: 0.562347252770589.
[I 2024-12-04 11:51:55,113] Trial 114 finished with value: 1.1062429159375098 and parameters: {'max_depth': 34, 'min_samples_split': 3, 'min_samples_leaf': 2, 'max_features': 'sqrt', 'criterion': 'squared_error', 'splitter': 'random'}. Best is trial 97 with value: 0.562347252770589.
[I 2024-12-04 11:51:55,116] Trial 95 finished with value: 0.7177525863158705 and parameters: {'max_depth': 20, 'min_samples_split': 3, 'min_samples_leaf': 2, 'max_features': 'log2', 'criterion': 'squared_error', 'splitter': 'best'}. Best is trial 97 with value: 0.562347252770589.
[I 2024-12-04 11:51:55,281] Trial 105 finished with value: 0.6259099459471761 and parameters: {'max_depth': 30, 'min_samples_split': 3, 'min_samples_leaf': 1, 'max_features': 'log2', 'criterion': 'squared_error', 'splitter': 'best'}. Best is trial 97 with value: 0.562347252770589.
[I 2024-12-04 11:51:55,471] Trial 100 finished with value: 0.6277580723999978 and parameters: {'max_depth': 17, 'min_samples_split': 2, 'min_samples_leaf': 1, 'max_features': 'log2', 'criterion': 'friedman_mse', 'splitter': 'best'}. Best is trial 97 with value: 0.562347252770589.
[I 2024-12-04 11:51:55,608] Trial 113 finished with value: 0.9277509946089134 and parameters: {'max_depth': 4, 'min_samples_split': 4, 'min_samples_leaf': 1, 'max_features': 'log2', 'criterion': 'squared_error', 'splitter': 'best'}. Best is trial 97 with value: 0.562347252770589.
[I 2024-12-04 11:51:55,681] Trial 86 finished with value: 0.5889436172244497 and parameters: {'max_depth': 27, 'min_samples_split': 2, 'min_samples_leaf': 1, 'max_features': 'log2', 'criterion': 'friedman_mse', 'splitter': 'best'}. Best is trial 97 with value: 0.562347252770589.
[I 2024-12-04 11:51:55,900] Trial 96 finished with value: 1.350610019592942 and parameters: {'max_depth': 27, 'min_samples_split': 5, 'min_samples_leaf': 2, 'max_features': 'log2', 'criterion': 'absolute_error', 'splitter': 'random'}. Best is trial 97 with value: 0.562347252770589.
[I 2024-12-04 11:51:57,147] Trial 106 finished with value: 0.6164018518375897 and parameters: {'max_depth': 29, 'min_samples_split': 3, 'min_samples_leaf': 1, 'max_features': 'log2', 'criterion': 'friedman_mse', 'splitter': 'best'}. Best is trial 97 with value: 0.562347252770589.
[I 2024-12-04 11:51:57,234] Trial 104 finished with value: 0.774830106759178 and parameters: {'max_depth': 16, 'min_samples_split': 3, 'min_samples_leaf': 1, 'max_features': 'sqrt', 'criterion': 'friedman_mse', 'splitter': 'random'}. Best is trial 97 with value: 0.562347252770589.
[I 2024-12-04 11:51:57,498] Trial 103 finished with value: 0.601574981694179 and parameters: {'max_depth': 30, 'min_samples_split': 3, 'min_samples_leaf': 1, 'max_features': 'sqrt', 'criterion': 'squared_error', 'splitter': 'best'}. Best is trial 97 with value: 0.562347252770589.
[I 2024-12-04 11:51:57,533] Trial 109 finished with value: 1.3007745979739842 and parameters: {'max_depth': 8, 'min_samples_split': 13, 'min_samples_leaf': 9, 'max_features': 'log2', 'criterion': 'squared_error', 'splitter': 'best'}. Best is trial 97 with value: 0.562347252770589.
[I 2024-12-04 11:51:57,948] Trial 125 finished with value: 0.5715332410516556 and parameters: {'max_depth': 23, 'min_samples_split': 2, 'min_samples_leaf': 1, 'max_features': 'log2', 'criterion': 'squared_error', 'splitter': 'best'}. Best is trial 97 with value: 0.562347252770589.
[I 2024-12-04 11:51:58,142] Trial 110 finished with value: 0.6164018518375897 and parameters: {'max_depth': 29, 'min_samples_split': 3, 'min_samples_leaf': 1, 'max_features': 'log2', 'criterion': 'friedman_mse', 'splitter': 'best'}. Best is trial 97 with value: 0.562347252770589.
[I 2024-12-04 11:51:58,385] Trial 116 finished with value: 1.3014693347727373 and parameters: {'max_depth': 20, 'min_samples_split': 5, 'min_samples_leaf': 9, 'max_features': 'log2', 'criterion': 'friedman_mse', 'splitter': 'random'}. Best is trial 97 with value: 0.562347252770589.
[I 2024-12-04 11:51:58,960] Trial 108 finished with value: 0.577392391382288 and parameters: {'max_depth': 33, 'min_samples_split': 3, 'min_samples_leaf': 1, 'max_features': 'log2', 'criterion': 'squared_error', 'splitter': 'best'}. Best is trial 97 with value: 0.562347252770589.
[I 2024-12-04 11:51:59,252] Trial 102 finished with value: 0.7177525863158705 and parameters: {'max_depth': 28, 'min_samples_split': 2, 'min_samples_leaf': 2, 'max_features': 'log2', 'criterion': 'squared_error', 'splitter': 'best'}. Best is trial 97 with value: 0.562347252770589.
[I 2024-12-04 11:51:59,591] Trial 128 finished with value: 0.5715332410516556 and parameters: {'max_depth': 23, 'min_samples_split': 2, 'min_samples_leaf': 1, 'max_features': 'log2', 'criterion': 'squared_error', 'splitter': 'best'}. Best is trial 97 with value: 0.562347252770589.
[I 2024-12-04 11:51:59,734] Trial 117 finished with value: 0.6460456872251362 and parameters: {'max_depth': 23, 'min_samples_split': 3, 'min_samples_leaf': 1, 'max_features': 'log2', 'criterion': 'squared_error', 'splitter': 'best'}. Best is trial 97 with value: 0.562347252770589.
[I 2024-12-04 11:51:59,970] Trial 107 finished with value: 1.1261154552845143 and parameters: {'max_depth': 29, 'min_samples_split': 3, 'min_samples_leaf': 2, 'max_features': 'sqrt', 'criterion': 'squared_error', 'splitter': 'best'}. Best is trial 97 with value: 0.562347252770589.
[I 2024-12-04 11:52:00,586] Trial 115 finished with value: 1.3518226058150795 and parameters: {'max_depth': 12, 'min_samples_split': 4, 'min_samples_leaf': 2, 'max_features': 'sqrt', 'criterion': 'absolute_error', 'splitter': 'best'}. Best is trial 97 with value: 0.562347252770589.
[I 2024-12-04 11:52:00,623] Trial 119 finished with value: 1.1104329532849138 and parameters: {'max_depth': 35, 'min_samples_split': 5, 'min_samples_leaf': 2, 'max_features': 'sqrt', 'criterion': 'absolute_error', 'splitter': 'best'}. Best is trial 97 with value: 0.562347252770589.
[I 2024-12-04 11:52:00,851] Trial 126 finished with value: 0.626326751694045 and parameters: {'max_depth': 28, 'min_samples_split': 3, 'min_samples_leaf': 1, 'max_features': 'log2', 'criterion': 'absolute_error', 'splitter': 'best'}. Best is trial 97 with value: 0.562347252770589.
[I 2024-12-04 11:52:00,879] Trial 122 finished with value: 0.5750297489827128 and parameters: {'max_depth': 26, 'min_samples_split': 2, 'min_samples_leaf': 1, 'max_features': 'log2', 'criterion': 'squared_error', 'splitter': 'best'}. Best is trial 97 with value: 0.562347252770589.
[I 2024-12-04 11:52:01,960] Trial 121 finished with value: 0.6868897487104708 and parameters: {'max_depth': 33, 'min_samples_split': 8, 'min_samples_leaf': 1, 'max_features': 'sqrt', 'criterion': 'squared_error', 'splitter': 'best'}. Best is trial 132 with value: 0.5172303731839445.
[I 2024-12-04 11:52:02,325] Trial 132 finished with value: 0.5172303731839445 and parameters: {'max_depth': 33, 'min_samples_split': 2, 'min_samples_leaf': 1, 'max_features': 'log2', 'criterion': 'squared_error', 'splitter': 'best'}. Best is trial 132 with value: 0.5172303731839445.
[I 2024-12-04 11:52:02,837] Trial 118 finished with value: 0.5302162188396224 and parameters: {'max_depth': 33, 'min_samples_split': 3, 'min_samples_leaf': 1, 'max_features': 'sqrt', 'criterion': 'squared_error', 'splitter': 'best'}. Best is trial 132 with value: 0.5172303731839445.
[I 2024-12-04 11:52:03,140] Trial 123 finished with value: 0.5750297489827128 and parameters: {'max_depth': 26, 'min_samples_split': 2, 'min_samples_leaf': 1, 'max_features': 'log2', 'criterion': 'squared_error', 'splitter': 'best'}. Best is trial 132 with value: 0.5172303731839445.
[I 2024-12-04 11:52:03,651] Trial 131 finished with value: 0.7177525863158705 and parameters: {'max_depth': 35, 'min_samples_split': 2, 'min_samples_leaf': 2, 'max_features': 'log2', 'criterion': 'squared_error', 'splitter': 'best'}. Best is trial 132 with value: 0.5172303731839445.
[I 2024-12-04 11:52:04,075] Trial 135 finished with value: 1.1261154552845143 and parameters: {'max_depth': 30, 'min_samples_split': 3, 'min_samples_leaf': 2, 'max_features': 'sqrt', 'criterion': 'squared_error', 'splitter': 'best'}. Best is trial 132 with value: 0.5172303731839445.
[I 2024-12-04 11:52:04,142] Trial 133 finished with value: 0.6092338867034208 and parameters: {'max_depth': 19, 'min_samples_split': 2, 'min_samples_leaf': 1, 'max_features': 'log2', 'criterion': 'squared_error', 'splitter': 'best'}. Best is trial 132 with value: 0.5172303731839445.
[I 2024-12-04 11:52:04,708] Trial 111 finished with value: 1.2707508278377346 and parameters: {'max_depth': 32, 'min_samples_split': 2, 'min_samples_leaf': 3, 'max_features': 'sqrt', 'criterion': 'squared_error', 'splitter': 'best'}. Best is trial 132 with value: 0.5172303731839445.
[I 2024-12-04 11:52:04,774] Trial 124 finished with value: 1.1261154552845143 and parameters: {'max_depth': 30, 'min_samples_split': 4, 'min_samples_leaf': 2, 'max_features': 'sqrt', 'criterion': 'squared_error', 'splitter': 'best'}. Best is trial 132 with value: 0.5172303731839445.
[I 2024-12-04 11:52:04,803] Trial 136 finished with value: 1.21279734437632 and parameters: {'max_depth': 35, 'min_samples_split': 3, 'min_samples_leaf': 1, 'max_features': 'log2', 'criterion': 'squared_error', 'splitter': 'random'}. Best is trial 132 with value: 0.5172303731839445.
[I 2024-12-04 11:52:05,543] Trial 127 finished with value: 0.6109088664736051 and parameters: {'max_depth': 22, 'min_samples_split': 3, 'min_samples_leaf': 1, 'max_features': 'log2', 'criterion': 'squared_error', 'splitter': 'best'}. Best is trial 132 with value: 0.5172303731839445.
[I 2024-12-04 11:52:05,854] Trial 130 finished with value: 0.562347252770589 and parameters: {'max_depth': 25, 'min_samples_split': 2, 'min_samples_leaf': 1, 'max_features': 'log2', 'criterion': 'squared_error', 'splitter': 'best'}. Best is trial 132 with value: 0.5172303731839445.
[I 2024-12-04 11:52:05,859] Trial 139 finished with value: 0.5855175778219047 and parameters: {'max_depth': 35, 'min_samples_split': 3, 'min_samples_leaf': 1, 'max_features': 'log2', 'criterion': 'squared_error', 'splitter': 'best'}. Best is trial 132 with value: 0.5172303731839445.
[I 2024-12-04 11:52:07,810] Trial 129 finished with value: 0.6228875839303879 and parameters: {'max_depth': 35, 'min_samples_split': 4, 'min_samples_leaf': 1, 'max_features': 'sqrt', 'criterion': 'squared_error', 'splitter': 'best'}. Best is trial 132 with value: 0.5172303731839445.
[I 2024-12-04 11:52:09,034] Trial 120 finished with value: 0.7177525863158705 and parameters: {'max_depth': 26, 'min_samples_split': 2, 'min_samples_leaf': 2, 'max_features': 'log2', 'criterion': 'squared_error', 'splitter': 'best'}. Best is trial 132 with value: 0.5172303731839445.
[I 2024-12-04 11:52:09,441] Trial 144 finished with value: 1.2574732191718125 and parameters: {'max_depth': 18, 'min_samples_split': 3, 'min_samples_leaf': 1, 'max_features': 'log2', 'criterion': 'squared_error', 'splitter': 'random'}. Best is trial 132 with value: 0.5172303731839445.
[I 2024-12-04 11:52:09,750] Trial 145 finished with value: 0.5583963367356682 and parameters: {'max_depth': 32, 'min_samples_split': 2, 'min_samples_leaf': 1, 'max_features': 'log2', 'criterion': 'squared_error', 'splitter': 'best'}. Best is trial 132 with value: 0.5172303731839445.
[I 2024-12-04 11:52:10,319] Trial 146 finished with value: 0.6450097320032714 and parameters: {'max_depth': 31, 'min_samples_split': 6, 'min_samples_leaf': 1, 'max_features': 'log2', 'criterion': 'squared_error', 'splitter': 'best'}. Best is trial 132 with value: 0.5172303731839445.
[I 2024-12-04 11:52:10,330] Trial 151 finished with value: 0.87491152180457 and parameters: {'max_depth': 33, 'min_samples_split': 20, 'min_samples_leaf': 7, 'max_features': 'sqrt', 'criterion': 'absolute_error', 'splitter': 'best'}. Best is trial 132 with value: 0.5172303731839445.
[I 2024-12-04 11:52:10,640] Trial 142 finished with value: 0.5995818917979532 and parameters: {'max_depth': 28, 'min_samples_split': 2, 'min_samples_leaf': 1, 'max_features': 'log2', 'criterion': 'squared_error', 'splitter': 'best'}. Best is trial 132 with value: 0.5172303731839445.
[I 2024-12-04 11:52:10,675] Trial 134 finished with value: 0.5750297489827128 and parameters: {'max_depth': 26, 'min_samples_split': 2, 'min_samples_leaf': 1, 'max_features': 'log2', 'criterion': 'squared_error', 'splitter': 'best'}. Best is trial 132 with value: 0.5172303731839445.
[I 2024-12-04 11:52:10,676] Trial 141 finished with value: 0.5966457171727975 and parameters: {'max_depth': 32, 'min_samples_split': 3, 'min_samples_leaf': 1, 'max_features': 'log2', 'criterion': 'squared_error', 'splitter': 'best'}. Best is trial 132 with value: 0.5172303731839445.
[I 2024-12-04 11:52:11,399] Trial 138 finished with value: 1.3400153874729748 and parameters: {'max_depth': 6, 'min_samples_split': 5, 'min_samples_leaf': 10, 'max_features': 'sqrt', 'criterion': 'absolute_error', 'splitter': 'best'}. Best is trial 132 with value: 0.5172303731839445.
[I 2024-12-04 11:52:11,865] Trial 140 finished with value: 1.2623676263036556 and parameters: {'max_depth': 25, 'min_samples_split': 2, 'min_samples_leaf': 1, 'max_features': 'log2', 'criterion': 'friedman_mse', 'splitter': 'random'}. Best is trial 132 with value: 0.5172303731839445.
[I 2024-12-04 11:52:13,608] Trial 137 finished with value: 0.5889436172244497 and parameters: {'max_depth': 27, 'min_samples_split': 2, 'min_samples_leaf': 1, 'max_features': 'log2', 'criterion': 'squared_error', 'splitter': 'best'}. Best is trial 132 with value: 0.5172303731839445.
[I 2024-12-04 11:52:16,833] Trial 147 finished with value: 0.6335404228721011 and parameters: {'max_depth': 25, 'min_samples_split': 3, 'min_samples_leaf': 1, 'max_features': 'log2', 'criterion': 'squared_error', 'splitter': 'best'}. Best is trial 132 with value: 0.5172303731839445.
[I 2024-12-04 11:52:17,028] Trial 157 finished with value: 0.5172303731839445 and parameters: {'max_depth': 33, 'min_samples_split': 2, 'min_samples_leaf': 1, 'max_features': 'log2', 'criterion': 'squared_error', 'splitter': 'best'}. Best is trial 132 with value: 0.5172303731839445.
[I 2024-12-04 11:52:17,103] Trial 155 finished with value: 1.3130149982826922 and parameters: {'max_depth': 17, 'min_samples_split': 16, 'min_samples_leaf': 8, 'max_features': 'sqrt', 'criterion': 'squared_error', 'splitter': 'random'}. Best is trial 132 with value: 0.5172303731839445.
[I 2024-12-04 11:52:17,711] Trial 143 finished with value: 0.5346482740235124 and parameters: {'max_depth': 34, 'min_samples_split': 2, 'min_samples_leaf': 1, 'max_features': 'log2', 'criterion': 'squared_error', 'splitter': 'best'}. Best is trial 132 with value: 0.5172303731839445.
[I 2024-12-04 11:52:17,891] Trial 156 finished with value: 0.7215694094881062 and parameters: {'max_depth': 33, 'min_samples_split': 4, 'min_samples_leaf': 1, 'max_features': 'log2', 'criterion': 'squared_error', 'splitter': 'best'}. Best is trial 132 with value: 0.5172303731839445.
[I 2024-12-04 11:52:18,855] Trial 152 finished with value: 0.5172303731839445 and parameters: {'max_depth': 33, 'min_samples_split': 2, 'min_samples_leaf': 1, 'max_features': 'log2', 'criterion': 'squared_error', 'splitter': 'best'}. Best is trial 132 with value: 0.5172303731839445.
[I 2024-12-04 11:52:19,358] Trial 158 finished with value: 1.3007745979739842 and parameters: {'max_depth': 24, 'min_samples_split': 3, 'min_samples_leaf': 4, 'max_features': 'log2', 'criterion': 'squared_error', 'splitter': 'best'}. Best is trial 132 with value: 0.5172303731839445.
