[I 2024-12-04 15:24:08,726] Trial 1504 finished with value: 0.48578542047214074 and parameters: {'n_estimators': 772, 'max_depth': 48, 'min_samples_split': 2, 'min_samples_leaf': 1, 'max_features': 'sqrt', 'bootstrap': True, 'criterion': 'squared_error'}. Best is trial 1025 with value: 0.41844370194907604.
[I 2024-12-04 15:24:09,434] Trial 1507 finished with value: 0.46528590336222225 and parameters: {'n_estimators': 835, 'max_depth': 43, 'min_samples_split': 4, 'min_samples_leaf': 2, 'max_features': None, 'bootstrap': True, 'criterion': 'squared_error'}. Best is trial 1025 with value: 0.41844370194907604.
[I 2024-12-04 15:24:15,903] Trial 1524 finished with value: 0.7063350746514377 and parameters: {'n_estimators': 111, 'max_depth': 5, 'min_samples_split': 42, 'min_samples_leaf': 13, 'max_features': None, 'bootstrap': True, 'criterion': 'absolute_error'}. Best is trial 1025 with value: 0.41844370194907604.
[I 2024-12-04 15:24:17,175] Trial 1506 finished with value: 0.6501986187926729 and parameters: {'n_estimators': 472, 'max_depth': 21, 'min_samples_split': 11, 'min_samples_leaf': 7, 'max_features': None, 'bootstrap': True, 'criterion': 'absolute_error'}. Best is trial 1025 with value: 0.41844370194907604.
[I 2024-12-04 15:24:17,192] Trial 1513 finished with value: 0.4653155188776285 and parameters: {'n_estimators': 838, 'max_depth': 39, 'min_samples_split': 2, 'min_samples_leaf': 2, 'max_features': None, 'bootstrap': True, 'criterion': 'squared_error'}. Best is trial 1025 with value: 0.41844370194907604.
[I 2024-12-04 15:24:17,353] Trial 1502 finished with value: 0.42052059968237215 and parameters: {'n_estimators': 863, 'max_depth': 37, 'min_samples_split': 2, 'min_samples_leaf': 1, 'max_features': None, 'bootstrap': True, 'criterion': 'squared_error'}. Best is trial 1025 with value: 0.41844370194907604.
[I 2024-12-04 15:24:22,117] Trial 1505 finished with value: 0.4650353805314219 and parameters: {'n_estimators': 906, 'max_depth': 38, 'min_samples_split': 2, 'min_samples_leaf': 2, 'max_features': None, 'bootstrap': True, 'criterion': 'squared_error'}. Best is trial 1025 with value: 0.41844370194907604.
[I 2024-12-04 15:24:26,463] Trial 1523 finished with value: 0.7497413245189998 and parameters: {'n_estimators': 441, 'max_depth': 16, 'min_samples_split': 8, 'min_samples_leaf': 1, 'max_features': 'sqrt', 'bootstrap': False, 'criterion': 'absolute_error'}. Best is trial 1025 with value: 0.41844370194907604.
[I 2024-12-04 15:24:28,254] Trial 1517 finished with value: 0.42532179469309045 and parameters: {'n_estimators': 783, 'max_depth': 33, 'min_samples_split': 3, 'min_samples_leaf': 1, 'max_features': None, 'bootstrap': True, 'criterion': 'squared_error'}. Best is trial 1025 with value: 0.41844370194907604.
[I 2024-12-04 15:24:30,779] Trial 1525 finished with value: 0.6396523685564275 and parameters: {'n_estimators': 644, 'max_depth': 41, 'min_samples_split': 4, 'min_samples_leaf': 1, 'max_features': 'log2', 'bootstrap': True, 'criterion': 'squared_error'}. Best is trial 1025 with value: 0.41844370194907604.
[I 2024-12-04 15:24:31,992] Trial 1514 finished with value: 0.42109167997986885 and parameters: {'n_estimators': 860, 'max_depth': 42, 'min_samples_split': 2, 'min_samples_leaf': 1, 'max_features': None, 'bootstrap': True, 'criterion': 'squared_error'}. Best is trial 1025 with value: 0.41844370194907604.
[I 2024-12-04 15:24:33,900] Trial 1521 finished with value: 0.42107333173798045 and parameters: {'n_estimators': 815, 'max_depth': 37, 'min_samples_split': 2, 'min_samples_leaf': 1, 'max_features': None, 'bootstrap': True, 'criterion': 'squared_error'}. Best is trial 1025 with value: 0.41844370194907604.
[I 2024-12-04 15:24:34,236] Trial 1520 finished with value: 0.42369783803455824 and parameters: {'n_estimators': 860, 'max_depth': 47, 'min_samples_split': 3, 'min_samples_leaf': 1, 'max_features': None, 'bootstrap': True, 'criterion': 'squared_error'}. Best is trial 1025 with value: 0.41844370194907604.
[I 2024-12-04 15:24:39,692] Trial 1516 finished with value: 0.421364460812139 and parameters: {'n_estimators': 817, 'max_depth': 34, 'min_samples_split': 2, 'min_samples_leaf': 1, 'max_features': None, 'bootstrap': True, 'criterion': 'squared_error'}. Best is trial 1025 with value: 0.41844370194907604.
[I 2024-12-04 15:24:39,707] Trial 1529 finished with value: 0.7279624847907457 and parameters: {'n_estimators': 989, 'max_depth': 17, 'min_samples_split': 10, 'min_samples_leaf': 2, 'max_features': 'sqrt', 'bootstrap': False, 'criterion': 'squared_error'}. Best is trial 1025 with value: 0.41844370194907604.
[I 2024-12-04 15:24:40,370] Trial 1519 finished with value: 0.42094667531245716 and parameters: {'n_estimators': 765, 'max_depth': 34, 'min_samples_split': 2, 'min_samples_leaf': 1, 'max_features': None, 'bootstrap': True, 'criterion': 'squared_error'}. Best is trial 1025 with value: 0.41844370194907604.
[I 2024-12-04 15:24:40,567] Trial 1510 finished with value: 0.6681941283136461 and parameters: {'n_estimators': 917, 'max_depth': 6, 'min_samples_split': 13, 'min_samples_leaf': 6, 'max_features': None, 'bootstrap': True, 'criterion': 'absolute_error'}. Best is trial 1025 with value: 0.41844370194907604.
[I 2024-12-04 15:24:41,081] Trial 1530 finished with value: 0.9587513876868297 and parameters: {'n_estimators': 806, 'max_depth': 36, 'min_samples_split': 2, 'min_samples_leaf': 2, 'max_features': 'log2', 'bootstrap': True, 'criterion': 'squared_error'}. Best is trial 1025 with value: 0.41844370194907604.
[I 2024-12-04 15:24:46,162] Trial 1522 finished with value: 0.4316730513536229 and parameters: {'n_estimators': 910, 'max_depth': 38, 'min_samples_split': 4, 'min_samples_leaf': 1, 'max_features': None, 'bootstrap': True, 'criterion': 'squared_error'}. Best is trial 1025 with value: 0.41844370194907604.
[I 2024-12-04 15:24:46,217] Trial 1527 finished with value: 0.419719138093698 and parameters: {'n_estimators': 798, 'max_depth': 41, 'min_samples_split': 2, 'min_samples_leaf': 1, 'max_features': None, 'bootstrap': True, 'criterion': 'squared_error'}. Best is trial 1025 with value: 0.41844370194907604.
[I 2024-12-04 15:24:46,524] Trial 1518 finished with value: 0.42248543239042174 and parameters: {'n_estimators': 865, 'max_depth': 30, 'min_samples_split': 2, 'min_samples_leaf': 1, 'max_features': None, 'bootstrap': True, 'criterion': 'squared_error'}. Best is trial 1025 with value: 0.41844370194907604.
[I 2024-12-04 15:24:49,425] Trial 1539 finished with value: 0.697276706855895 and parameters: {'n_estimators': 835, 'max_depth': 39, 'min_samples_split': 4, 'min_samples_leaf': 2, 'max_features': 'sqrt', 'bootstrap': True, 'criterion': 'squared_error'}. Best is trial 1025 with value: 0.41844370194907604.
[I 2024-12-04 15:24:49,641] Trial 1526 finished with value: 0.43126333280698903 and parameters: {'n_estimators': 860, 'max_depth': 44, 'min_samples_split': 4, 'min_samples_leaf': 1, 'max_features': None, 'bootstrap': True, 'criterion': 'squared_error'}. Best is trial 1025 with value: 0.41844370194907604.
[I 2024-12-04 15:24:51,163] Trial 1528 finished with value: 0.42109992126492685 and parameters: {'n_estimators': 866, 'max_depth': 42, 'min_samples_split': 2, 'min_samples_leaf': 1, 'max_features': None, 'bootstrap': True, 'criterion': 'squared_error'}. Best is trial 1025 with value: 0.41844370194907604.
[I 2024-12-04 15:24:52,399] Trial 1536 finished with value: 0.42011317028368156 and parameters: {'n_estimators': 872, 'max_depth': 38, 'min_samples_split': 2, 'min_samples_leaf': 1, 'max_features': None, 'bootstrap': True, 'criterion': 'squared_error'}. Best is trial 1025 with value: 0.41844370194907604.
[I 2024-12-04 15:24:52,416] Trial 1534 finished with value: 0.4204899916775931 and parameters: {'n_estimators': 878, 'max_depth': 43, 'min_samples_split': 2, 'min_samples_leaf': 1, 'max_features': None, 'bootstrap': True, 'criterion': 'squared_error'}. Best is trial 1025 with value: 0.41844370194907604.
[I 2024-12-04 15:24:53,075] Trial 1538 finished with value: 0.4654092244118074 and parameters: {'n_estimators': 771, 'max_depth': 36, 'min_samples_split': 4, 'min_samples_leaf': 2, 'max_features': None, 'bootstrap': True, 'criterion': 'squared_error'}. Best is trial 1025 with value: 0.41844370194907604.
[I 2024-12-04 15:24:54,603] Trial 1541 finished with value: 1.0367431785693753 and parameters: {'n_estimators': 632, 'max_depth': 16, 'min_samples_split': 16, 'min_samples_leaf': 15, 'max_features': 'sqrt', 'bootstrap': True, 'criterion': 'absolute_error'}. Best is trial 1025 with value: 0.41844370194907604.
[I 2024-12-04 15:24:54,960] Trial 1537 finished with value: 0.4645698897835349 and parameters: {'n_estimators': 657, 'max_depth': 42, 'min_samples_split': 2, 'min_samples_leaf': 2, 'max_features': None, 'bootstrap': True, 'criterion': 'squared_error'}. Best is trial 1025 with value: 0.41844370194907604.
[I 2024-12-04 15:24:58,254] Trial 1532 finished with value: 0.42487925264064785 and parameters: {'n_estimators': 722, 'max_depth': 34, 'min_samples_split': 3, 'min_samples_leaf': 1, 'max_features': None, 'bootstrap': True, 'criterion': 'squared_error'}. Best is trial 1025 with value: 0.41844370194907604.
[I 2024-12-04 15:25:00,154] Trial 1535 finished with value: 0.9358172376218596 and parameters: {'n_estimators': 700, 'max_depth': 12, 'min_samples_split': 35, 'min_samples_leaf': 1, 'max_features': 'log2', 'bootstrap': True, 'criterion': 'absolute_error'}. Best is trial 1025 with value: 0.41844370194907604.
[I 2024-12-04 15:25:01,559] Trial 1533 finished with value: 0.4207211861880714 and parameters: {'n_estimators': 711, 'max_depth': 37, 'min_samples_split': 2, 'min_samples_leaf': 1, 'max_features': None, 'bootstrap': True, 'criterion': 'squared_error'}. Best is trial 1025 with value: 0.41844370194907604.
[I 2024-12-04 15:25:03,379] Trial 1531 finished with value: 0.42532021083046206 and parameters: {'n_estimators': 994, 'max_depth': 31, 'min_samples_split': 3, 'min_samples_leaf': 1, 'max_features': None, 'bootstrap': True, 'criterion': 'squared_error'}. Best is trial 1025 with value: 0.41844370194907604.
[I 2024-12-04 15:25:07,671] Trial 1557 finished with value: 1.0601243328652465 and parameters: {'n_estimators': 113, 'max_depth': 6, 'min_samples_split': 2, 'min_samples_leaf': 8, 'max_features': 'log2', 'bootstrap': True, 'criterion': 'squared_error'}. Best is trial 1025 with value: 0.41844370194907604.
[I 2024-12-04 15:25:09,154] Trial 1553 finished with value: 1.0693347100883452 and parameters: {'n_estimators': 808, 'max_depth': 34, 'min_samples_split': 10, 'min_samples_leaf': 12, 'max_features': 'log2', 'bootstrap': False, 'criterion': 'squared_error'}. Best is trial 1025 with value: 0.41844370194907604.
[I 2024-12-04 15:25:10,340] Trial 1545 finished with value: 0.43133906452080806 and parameters: {'n_estimators': 707, 'max_depth': 40, 'min_samples_split': 4, 'min_samples_leaf': 1, 'max_features': None, 'bootstrap': True, 'criterion': 'squared_error'}. Best is trial 1025 with value: 0.41844370194907604.
[I 2024-12-04 15:25:11,752] Trial 1547 finished with value: 0.4255119922929007 and parameters: {'n_estimators': 697, 'max_depth': 46, 'min_samples_split': 3, 'min_samples_leaf': 1, 'max_features': None, 'bootstrap': True, 'criterion': 'squared_error'}. Best is trial 1025 with value: 0.41844370194907604.
[I 2024-12-04 15:25:14,316] Trial 1542 finished with value: 0.4658039902478763 and parameters: {'n_estimators': 789, 'max_depth': 41, 'min_samples_split': 2, 'min_samples_leaf': 2, 'max_features': None, 'bootstrap': True, 'criterion': 'squared_error'}. Best is trial 1025 with value: 0.41844370194907604.
[I 2024-12-04 15:25:15,176] Trial 1549 finished with value: 0.42162132976125244 and parameters: {'n_estimators': 663, 'max_depth': 37, 'min_samples_split': 2, 'min_samples_leaf': 1, 'max_features': None, 'bootstrap': True, 'criterion': 'squared_error'}. Best is trial 1025 with value: 0.41844370194907604.
[I 2024-12-04 15:25:15,478] Trial 1515 finished with value: 0.5135118343128503 and parameters: {'n_estimators': 854, 'max_depth': 49, 'min_samples_split': 28, 'min_samples_leaf': 2, 'max_features': None, 'bootstrap': True, 'criterion': 'absolute_error'}. Best is trial 1025 with value: 0.41844370194907604.
[I 2024-12-04 15:25:15,512] Trial 1548 finished with value: 0.465309731286761 and parameters: {'n_estimators': 816, 'max_depth': 48, 'min_samples_split': 2, 'min_samples_leaf': 2, 'max_features': None, 'bootstrap': True, 'criterion': 'squared_error'}. Best is trial 1025 with value: 0.41844370194907604.
[I 2024-12-04 15:25:15,591] Trial 1544 finished with value: 0.4204059541301231 and parameters: {'n_estimators': 875, 'max_depth': 43, 'min_samples_split': 2, 'min_samples_leaf': 1, 'max_features': None, 'bootstrap': True, 'criterion': 'squared_error'}. Best is trial 1025 with value: 0.41844370194907604.
[I 2024-12-04 15:25:16,493] Trial 1546 finished with value: 0.6423112230160753 and parameters: {'n_estimators': 790, 'max_depth': 33, 'min_samples_split': 5, 'min_samples_leaf': 7, 'max_features': None, 'bootstrap': True, 'criterion': 'squared_error'}. Best is trial 1025 with value: 0.41844370194907604.
[I 2024-12-04 15:25:19,327] Trial 1550 finished with value: 0.42057825506077434 and parameters: {'n_estimators': 747, 'max_depth': 43, 'min_samples_split': 2, 'min_samples_leaf': 1, 'max_features': None, 'bootstrap': True, 'criterion': 'squared_error'}. Best is trial 1025 with value: 0.41844370194907604.
[I 2024-12-04 15:25:20,004] Trial 1565 finished with value: 1.0506200973153892 and parameters: {'n_estimators': 605, 'max_depth': 26, 'min_samples_split': 17, 'min_samples_leaf': 6, 'max_features': 'log2', 'bootstrap': False, 'criterion': 'squared_error'}. Best is trial 1025 with value: 0.41844370194907604.
[I 2024-12-04 15:25:29,112] Trial 1543 finished with value: 0.43130188658647345 and parameters: {'n_estimators': 972, 'max_depth': 39, 'min_samples_split': 4, 'min_samples_leaf': 1, 'max_features': None, 'bootstrap': True, 'criterion': 'squared_error'}. Best is trial 1025 with value: 0.41844370194907604.
[I 2024-12-04 15:25:29,564] Trial 1560 finished with value: 0.7492533091958113 and parameters: {'n_estimators': 305, 'max_depth': 8, 'min_samples_split': 6, 'min_samples_leaf': 10, 'max_features': None, 'bootstrap': False, 'criterion': 'absolute_error'}. Best is trial 1025 with value: 0.41844370194907604.
[I 2024-12-04 15:25:29,883] Trial 1556 finished with value: 0.4327570835477274 and parameters: {'n_estimators': 732, 'max_depth': 32, 'min_samples_split': 4, 'min_samples_leaf': 1, 'max_features': None, 'bootstrap': True, 'criterion': 'squared_error'}. Best is trial 1025 with value: 0.41844370194907604.
[I 2024-12-04 15:25:30,891] Trial 1552 finished with value: 0.4317272072144128 and parameters: {'n_estimators': 960, 'max_depth': 50, 'min_samples_split': 4, 'min_samples_leaf': 1, 'max_features': None, 'bootstrap': True, 'criterion': 'squared_error'}. Best is trial 1025 with value: 0.41844370194907604.
[I 2024-12-04 15:25:32,126] Trial 1558 finished with value: 0.4646265652878491 and parameters: {'n_estimators': 657, 'max_depth': 31, 'min_samples_split': 2, 'min_samples_leaf': 2, 'max_features': None, 'bootstrap': True, 'criterion': 'squared_error'}. Best is trial 1025 with value: 0.41844370194907604.
[I 2024-12-04 15:25:34,109] Trial 1551 finished with value: 0.42071537537978915 and parameters: {'n_estimators': 891, 'max_depth': 37, 'min_samples_split': 2, 'min_samples_leaf': 1, 'max_features': None, 'bootstrap': True, 'criterion': 'squared_error'}. Best is trial 1025 with value: 0.41844370194907604.
[I 2024-12-04 15:25:35,083] Trial 1574 finished with value: 1.0652550736931858 and parameters: {'n_estimators': 328, 'max_depth': 10, 'min_samples_split': 15, 'min_samples_leaf': 11, 'max_features': 'log2', 'bootstrap': False, 'criterion': 'squared_error'}. Best is trial 1025 with value: 0.41844370194907604.
[I 2024-12-04 15:25:37,761] Trial 1561 finished with value: 0.42061690436968036 and parameters: {'n_estimators': 828, 'max_depth': 43, 'min_samples_split': 2, 'min_samples_leaf': 1, 'max_features': None, 'bootstrap': True, 'criterion': 'squared_error'}. Best is trial 1025 with value: 0.41844370194907604.
[I 2024-12-04 15:25:38,816] Trial 1564 finished with value: 0.56730811897458 and parameters: {'n_estimators': 723, 'max_depth': 29, 'min_samples_split': 3, 'min_samples_leaf': 1, 'max_features': 'sqrt', 'bootstrap': True, 'criterion': 'squared_error'}. Best is trial 1025 with value: 0.41844370194907604.
[I 2024-12-04 15:25:39,199] Trial 1559 finished with value: 0.4212220571803574 and parameters: {'n_estimators': 672, 'max_depth': 38, 'min_samples_split': 2, 'min_samples_leaf': 1, 'max_features': None, 'bootstrap': True, 'criterion': 'squared_error'}. Best is trial 1025 with value: 0.41844370194907604.
[I 2024-12-04 15:25:41,463] Trial 1555 finished with value: 0.42047978391227636 and parameters: {'n_estimators': 997, 'max_depth': 45, 'min_samples_split': 2, 'min_samples_leaf': 1, 'max_features': None, 'bootstrap': True, 'criterion': 'squared_error'}. Best is trial 1025 with value: 0.41844370194907604.
[I 2024-12-04 15:25:41,713] Trial 1554 finished with value: 0.41978943701411864 and parameters: {'n_estimators': 998, 'max_depth': 43, 'min_samples_split': 2, 'min_samples_leaf': 1, 'max_features': None, 'bootstrap': True, 'criterion': 'squared_error'}. Best is trial 1025 with value: 0.41844370194907604.
[I 2024-12-04 15:25:42,237] Trial 1562 finished with value: 0.46552809876139917 and parameters: {'n_estimators': 830, 'max_depth': 34, 'min_samples_split': 3, 'min_samples_leaf': 2, 'max_features': None, 'bootstrap': True, 'criterion': 'squared_error'}. Best is trial 1025 with value: 0.41844370194907604.
[I 2024-12-04 15:25:43,464] Trial 1566 finished with value: 0.46527048722545933 and parameters: {'n_estimators': 919, 'max_depth': 40, 'min_samples_split': 2, 'min_samples_leaf': 2, 'max_features': None, 'bootstrap': True, 'criterion': 'squared_error'}. Best is trial 1025 with value: 0.41844370194907604.
[I 2024-12-04 15:25:43,949] Trial 1567 finished with value: 0.4215647416234521 and parameters: {'n_estimators': 814, 'max_depth': 35, 'min_samples_split': 2, 'min_samples_leaf': 1, 'max_features': None, 'bootstrap': True, 'criterion': 'squared_error'}. Best is trial 1025 with value: 0.41844370194907604.
[I 2024-12-04 15:25:44,353] Trial 1568 finished with value: 0.5164055470415887 and parameters: {'n_estimators': 778, 'max_depth': 43, 'min_samples_split': 4, 'min_samples_leaf': 1, 'max_features': None, 'bootstrap': False, 'criterion': 'squared_error'}. Best is trial 1025 with value: 0.41844370194907604.
[I 2024-12-04 15:25:46,373] Trial 1563 finished with value: 0.5008361930942801 and parameters: {'n_estimators': 999, 'max_depth': 44, 'min_samples_split': 3, 'min_samples_leaf': 1, 'max_features': 'sqrt', 'bootstrap': True, 'criterion': 'squared_error'}. Best is trial 1025 with value: 0.41844370194907604.
[I 2024-12-04 15:25:46,701] Trial 1573 finished with value: 0.5251442470650929 and parameters: {'n_estimators': 788, 'max_depth': 37, 'min_samples_split': 2, 'min_samples_leaf': 1, 'max_features': 'sqrt', 'bootstrap': True, 'criterion': 'squared_error'}. Best is trial 1025 with value: 0.41844370194907604.
[I 2024-12-04 15:25:52,161] Trial 1569 finished with value: 0.5903067020283385 and parameters: {'n_estimators': 940, 'max_depth': 48, 'min_samples_split': 2, 'min_samples_leaf': 1, 'max_features': 'log2', 'bootstrap': True, 'criterion': 'squared_error'}. Best is trial 1025 with value: 0.41844370194907604.
[I 2024-12-04 15:25:53,465] Trial 1512 finished with value: 0.42686156424978755 and parameters: {'n_estimators': 971, 'max_depth': 44, 'min_samples_split': 2, 'min_samples_leaf': 1, 'max_features': None, 'bootstrap': True, 'criterion': 'absolute_error'}. Best is trial 1025 with value: 0.41844370194907604.
[I 2024-12-04 15:25:53,524] Trial 1572 finished with value: 0.4207771877187694 and parameters: {'n_estimators': 710, 'max_depth': 43, 'min_samples_split': 2, 'min_samples_leaf': 1, 'max_features': None, 'bootstrap': True, 'criterion': 'squared_error'}. Best is trial 1025 with value: 0.41844370194907604.
[I 2024-12-04 15:25:55,525] Trial 1578 finished with value: 0.5119175731058907 and parameters: {'n_estimators': 842, 'max_depth': 35, 'min_samples_split': 4, 'min_samples_leaf': 1, 'max_features': None, 'bootstrap': False, 'criterion': 'squared_error'}. Best is trial 1025 with value: 0.41844370194907604.
[I 2024-12-04 15:25:55,531] Trial 1571 finished with value: 0.42165412779377975 and parameters: {'n_estimators': 845, 'max_depth': 50, 'min_samples_split': 2, 'min_samples_leaf': 1, 'max_features': None, 'bootstrap': True, 'criterion': 'squared_error'}. Best is trial 1025 with value: 0.41844370194907604.
[I 2024-12-04 15:25:58,247] Trial 1589 finished with value: 0.6261167151613523 and parameters: {'n_estimators': 170, 'max_depth': 20, 'min_samples_split': 2, 'min_samples_leaf': 1, 'max_features': 'sqrt', 'bootstrap': False, 'criterion': 'squared_error'}. Best is trial 1025 with value: 0.41844370194907604.
[I 2024-12-04 15:25:58,948] Trial 1576 finished with value: 0.43219775722075787 and parameters: {'n_estimators': 649, 'max_depth': 43, 'min_samples_split': 4, 'min_samples_leaf': 1, 'max_features': None, 'bootstrap': True, 'criterion': 'squared_error'}. Best is trial 1025 with value: 0.41844370194907604.
[I 2024-12-04 15:26:03,414] Trial 1583 finished with value: 0.46636296352306394 and parameters: {'n_estimators': 483, 'max_depth': 42, 'min_samples_split': 4, 'min_samples_leaf': 2, 'max_features': None, 'bootstrap': True, 'criterion': 'squared_error'}. Best is trial 1025 with value: 0.41844370194907604.
