[I 2024-12-04 12:59:40,069] Trial 1216 finished with value: 0.36303307188802697 and parameters: {'n_estimators': 778, 'learning_rate': 0.02660389785146638, 'max_depth': 4, 'min_samples_split': 4, 'min_samples_leaf': 4, 'subsample': 0.983357720359746, 'max_features': 'sqrt'}. Best is trial 1137 with value: 0.19687116000636118.
[I 2024-12-04 12:59:43,369] Trial 1204 finished with value: 0.20469840218860902 and parameters: {'n_estimators': 1301, 'learning_rate': 0.07964430038547787, 'max_depth': 11, 'min_samples_split': 20, 'min_samples_leaf': 1, 'subsample': 0.6421714682697512, 'max_features': 'sqrt'}. Best is trial 1137 with value: 0.19687116000636118.
[I 2024-12-04 12:59:43,387] Trial 1200 finished with value: 0.23422167534137145 and parameters: {'n_estimators': 1477, 'learning_rate': 0.0908951163147359, 'max_depth': 10, 'min_samples_split': 17, 'min_samples_leaf': 1, 'subsample': 0.6328532276401291, 'max_features': 'sqrt'}. Best is trial 1137 with value: 0.19687116000636118.
[I 2024-12-04 12:59:43,405] Trial 1199 finished with value: 0.20507525663356765 and parameters: {'n_estimators': 1481, 'learning_rate': 0.07019347176046764, 'max_depth': 12, 'min_samples_split': 19, 'min_samples_leaf': 1, 'subsample': 0.7110535717018952, 'max_features': 'sqrt'}. Best is trial 1137 with value: 0.19687116000636118.
[I 2024-12-04 12:59:46,332] Trial 1210 finished with value: 0.22995692629321335 and parameters: {'n_estimators': 1151, 'learning_rate': 0.05737923384492007, 'max_depth': 10, 'min_samples_split': 20, 'min_samples_leaf': 1, 'subsample': 0.6004810668988284, 'max_features': 'sqrt'}. Best is trial 1137 with value: 0.19687116000636118.
[I 2024-12-04 12:59:46,985] Trial 1202 finished with value: 0.21044161231793412 and parameters: {'n_estimators': 1488, 'learning_rate': 0.07863563345817053, 'max_depth': 11, 'min_samples_split': 20, 'min_samples_leaf': 1, 'subsample': 0.6255196945420429, 'max_features': 'sqrt'}. Best is trial 1137 with value: 0.19687116000636118.
[I 2024-12-04 12:59:47,785] Trial 1203 finished with value: 0.2092035651499192 and parameters: {'n_estimators': 1430, 'learning_rate': 0.0828471074326408, 'max_depth': 12, 'min_samples_split': 20, 'min_samples_leaf': 1, 'subsample': 0.6707069833993856, 'max_features': 'sqrt'}. Best is trial 1137 with value: 0.19687116000636118.
[I 2024-12-04 12:59:48,424] Trial 1209 finished with value: 0.250023191868739 and parameters: {'n_estimators': 1242, 'learning_rate': 0.09074811777546707, 'max_depth': 11, 'min_samples_split': 20, 'min_samples_leaf': 3, 'subsample': 0.6904476711989987, 'max_features': 'sqrt'}. Best is trial 1137 with value: 0.19687116000636118.
[I 2024-12-04 12:59:50,910] Trial 1205 finished with value: 0.20893238982735163 and parameters: {'n_estimators': 1417, 'learning_rate': 0.09940070954400795, 'max_depth': 11, 'min_samples_split': 16, 'min_samples_leaf': 1, 'subsample': 0.6319712036282481, 'max_features': 'sqrt'}. Best is trial 1137 with value: 0.19687116000636118.
[I 2024-12-04 12:59:56,378] Trial 1232 finished with value: 0.37290746402273184 and parameters: {'n_estimators': 206, 'learning_rate': 0.09322794059957551, 'max_depth': 10, 'min_samples_split': 13, 'min_samples_leaf': 9, 'subsample': 0.9627831013972458, 'max_features': None}. Best is trial 1137 with value: 0.19687116000636118.
[I 2024-12-04 12:59:57,104] Trial 1208 finished with value: 0.22890948023248758 and parameters: {'n_estimators': 1477, 'learning_rate': 0.06604263961457159, 'max_depth': 12, 'min_samples_split': 16, 'min_samples_leaf': 1, 'subsample': 0.618749300322997, 'max_features': 'log2'}. Best is trial 1137 with value: 0.19687116000636118.
[I 2024-12-04 12:59:57,372] Trial 1211 finished with value: 0.36426759674921894 and parameters: {'n_estimators': 1326, 'learning_rate': 0.03807126565647114, 'max_depth': 7, 'min_samples_split': 17, 'min_samples_leaf': 5, 'subsample': 0.8060050904978212, 'max_features': 'log2'}. Best is trial 1137 with value: 0.19687116000636118.
[I 2024-12-04 12:59:57,733] Trial 1201 finished with value: 0.2535401079037216 and parameters: {'n_estimators': 1428, 'learning_rate': 0.09451459270728395, 'max_depth': 11, 'min_samples_split': 17, 'min_samples_leaf': 1, 'subsample': 0.6979374299052277, 'max_features': None}. Best is trial 1137 with value: 0.19687116000636118.
[I 2024-12-04 12:59:58,782] Trial 1213 finished with value: 0.5386207001125495 and parameters: {'n_estimators': 1170, 'learning_rate': 0.013093240128081822, 'max_depth': 7, 'min_samples_split': 5, 'min_samples_leaf': 6, 'subsample': 0.7999008751616392, 'max_features': 'log2'}. Best is trial 1137 with value: 0.19687116000636118.
[I 2024-12-04 13:00:01,991] Trial 1215 finished with value: 0.23984916587219599 and parameters: {'n_estimators': 1232, 'learning_rate': 0.07837374987285939, 'max_depth': 12, 'min_samples_split': 20, 'min_samples_leaf': 1, 'subsample': 0.6171897012417642, 'max_features': 'log2'}. Best is trial 1137 with value: 0.19687116000636118.
[I 2024-12-04 13:00:02,064] Trial 1212 finished with value: 0.22295359739369375 and parameters: {'n_estimators': 1374, 'learning_rate': 0.09921905508776659, 'max_depth': 12, 'min_samples_split': 17, 'min_samples_leaf': 1, 'subsample': 0.6477494584928802, 'max_features': 'sqrt'}. Best is trial 1137 with value: 0.19687116000636118.
[I 2024-12-04 13:00:04,089] Trial 1217 finished with value: 0.22416408119318357 and parameters: {'n_estimators': 1171, 'learning_rate': 0.0830371807119575, 'max_depth': 12, 'min_samples_split': 17, 'min_samples_leaf': 1, 'subsample': 0.6236299284670827, 'max_features': 'sqrt'}. Best is trial 1137 with value: 0.19687116000636118.
[I 2024-12-04 13:00:06,566] Trial 1221 finished with value: 0.21522870561647728 and parameters: {'n_estimators': 1051, 'learning_rate': 0.09857861900493738, 'max_depth': 12, 'min_samples_split': 20, 'min_samples_leaf': 1, 'subsample': 0.618283330519726, 'max_features': 'sqrt'}. Best is trial 1137 with value: 0.19687116000636118.
[I 2024-12-04 13:00:06,944] Trial 1224 finished with value: 0.26905836831931684 and parameters: {'n_estimators': 1013, 'learning_rate': 0.07138337520686172, 'max_depth': 6, 'min_samples_split': 20, 'min_samples_leaf': 3, 'subsample': 0.6316916617035377, 'max_features': 'sqrt'}. Best is trial 1137 with value: 0.19687116000636118.
[I 2024-12-04 13:00:07,429] Trial 1214 finished with value: 0.264883106200055 and parameters: {'n_estimators': 1207, 'learning_rate': 0.09430997526709291, 'max_depth': 9, 'min_samples_split': 19, 'min_samples_leaf': 1, 'subsample': 0.6664148950403238, 'max_features': None}. Best is trial 1137 with value: 0.19687116000636118.
[I 2024-12-04 13:00:11,577] Trial 1229 finished with value: 0.30871693804642386 and parameters: {'n_estimators': 805, 'learning_rate': 0.013384528524146603, 'max_depth': 8, 'min_samples_split': 20, 'min_samples_leaf': 3, 'subsample': 0.7392702693890497, 'max_features': None}. Best is trial 1137 with value: 0.19687116000636118.
[I 2024-12-04 13:00:14,210] Trial 1228 finished with value: 0.3832989595987107 and parameters: {'n_estimators': 946, 'learning_rate': 0.03261023932522802, 'max_depth': 4, 'min_samples_split': 15, 'min_samples_leaf': 8, 'subsample': 0.6902053734227743, 'max_features': None}. Best is trial 1137 with value: 0.19687116000636118.
[I 2024-12-04 13:00:16,528] Trial 1222 finished with value: 0.23205119610114383 and parameters: {'n_estimators': 1249, 'learning_rate': 0.09884146931780147, 'max_depth': 9, 'min_samples_split': 20, 'min_samples_leaf': 1, 'subsample': 0.6340370105616123, 'max_features': 'sqrt'}. Best is trial 1137 with value: 0.19687116000636118.
[I 2024-12-04 13:00:17,257] Trial 1219 finished with value: 0.21459422774142442 and parameters: {'n_estimators': 1337, 'learning_rate': 0.09031815662031306, 'max_depth': 11, 'min_samples_split': 20, 'min_samples_leaf': 1, 'subsample': 0.6694278546760215, 'max_features': 'sqrt'}. Best is trial 1137 with value: 0.19687116000636118.
[I 2024-12-04 13:00:20,167] Trial 1218 finished with value: 0.22314262056166576 and parameters: {'n_estimators': 1400, 'learning_rate': 0.09336497029950837, 'max_depth': 12, 'min_samples_split': 20, 'min_samples_leaf': 1, 'subsample': 0.8043261248865096, 'max_features': 'sqrt'}. Best is trial 1137 with value: 0.19687116000636118.
[I 2024-12-04 13:00:23,815] Trial 1226 finished with value: 0.21165199998598316 and parameters: {'n_estimators': 1267, 'learning_rate': 0.07638534896638059, 'max_depth': 12, 'min_samples_split': 18, 'min_samples_leaf': 1, 'subsample': 0.7340052475215669, 'max_features': 'sqrt'}. Best is trial 1137 with value: 0.19687116000636118.
[I 2024-12-04 13:00:26,825] Trial 1230 finished with value: 0.20636936603855296 and parameters: {'n_estimators': 1013, 'learning_rate': 0.09828814267323727, 'max_depth': 10, 'min_samples_split': 18, 'min_samples_leaf': 1, 'subsample': 0.6923600438145378, 'max_features': 'sqrt'}. Best is trial 1137 with value: 0.19687116000636118.
[I 2024-12-04 13:00:27,785] Trial 1223 finished with value: 0.20652204286504303 and parameters: {'n_estimators': 1488, 'learning_rate': 0.09227682441067665, 'max_depth': 12, 'min_samples_split': 16, 'min_samples_leaf': 1, 'subsample': 0.6068526532107494, 'max_features': 'sqrt'}. Best is trial 1137 with value: 0.19687116000636118.
[I 2024-12-04 13:00:27,812] Trial 1235 finished with value: 0.37642465415876886 and parameters: {'n_estimators': 620, 'learning_rate': 0.06433875004074946, 'max_depth': 7, 'min_samples_split': 19, 'min_samples_leaf': 10, 'subsample': 0.9381124572627443, 'max_features': None}. Best is trial 1137 with value: 0.19687116000636118.
[I 2024-12-04 13:00:29,222] Trial 1227 finished with value: 0.22519931210459845 and parameters: {'n_estimators': 1351, 'learning_rate': 0.06297344038559621, 'max_depth': 10, 'min_samples_split': 20, 'min_samples_leaf': 1, 'subsample': 0.7451690934597807, 'max_features': 'sqrt'}. Best is trial 1137 with value: 0.19687116000636118.
[I 2024-12-04 13:00:33,682] Trial 1220 finished with value: 0.22714781298911496 and parameters: {'n_estimators': 1484, 'learning_rate': 0.09316701895531909, 'max_depth': 8, 'min_samples_split': 16, 'min_samples_leaf': 1, 'subsample': 0.6350612047075507, 'max_features': 'sqrt'}. Best is trial 1137 with value: 0.19687116000636118.
[I 2024-12-04 13:00:51,964] Trial 1233 finished with value: 0.20966209078299364 and parameters: {'n_estimators': 1313, 'learning_rate': 0.09985989981247671, 'max_depth': 11, 'min_samples_split': 20, 'min_samples_leaf': 1, 'subsample': 0.6281311829659928, 'max_features': 'sqrt'}. Best is trial 1137 with value: 0.19687116000636118.
[I 2024-12-04 13:00:55,366] Trial 1236 finished with value: 0.21758736850789612 and parameters: {'n_estimators': 1230, 'learning_rate': 0.09215935669761774, 'max_depth': 11, 'min_samples_split': 20, 'min_samples_leaf': 1, 'subsample': 0.7285917255834778, 'max_features': 'sqrt'}. Best is trial 1137 with value: 0.19687116000636118.
[I 2024-12-04 13:00:57,107] Trial 1231 finished with value: 0.21025417202800453 and parameters: {'n_estimators': 1493, 'learning_rate': 0.08656184609798633, 'max_depth': 11, 'min_samples_split': 19, 'min_samples_leaf': 1, 'subsample': 0.654775095217581, 'max_features': 'sqrt'}. Best is trial 1137 with value: 0.19687116000636118.
[I 2024-12-04 13:01:03,670] Trial 1234 finished with value: 0.21719023791178937 and parameters: {'n_estimators': 1475, 'learning_rate': 0.09565725764021578, 'max_depth': 12, 'min_samples_split': 18, 'min_samples_leaf': 1, 'subsample': 0.6314489555734276, 'max_features': 'sqrt'}. Best is trial 1137 with value: 0.19687116000636118.
[I 2024-12-04 13:01:06,147] Trial 1237 finished with value: 0.20562905221292324 and parameters: {'n_estimators': 1349, 'learning_rate': 0.0861574210902892, 'max_depth': 12, 'min_samples_split': 20, 'min_samples_leaf': 1, 'subsample': 0.7159045014136135, 'max_features': 'sqrt'}. Best is trial 1137 with value: 0.19687116000636118.
[I 2024-12-04 13:01:12,667] Trial 1242 finished with value: 0.24683691010927117 and parameters: {'n_estimators': 1312, 'learning_rate': 0.07471194513600153, 'max_depth': 12, 'min_samples_split': 20, 'min_samples_leaf': 3, 'subsample': 0.6752111172735784, 'max_features': 'sqrt'}. Best is trial 1137 with value: 0.19687116000636118.
[I 2024-12-04 13:01:16,482] Trial 1261 finished with value: 0.3107874626380246 and parameters: {'n_estimators': 573, 'learning_rate': 0.060796478281152685, 'max_depth': 8, 'min_samples_split': 17, 'min_samples_leaf': 5, 'subsample': 0.7099620369919603, 'max_features': 'sqrt'}. Best is trial 1137 with value: 0.19687116000636118.
[I 2024-12-04 13:01:18,332] Trial 1238 finished with value: 0.23152299625797196 and parameters: {'n_estimators': 1459, 'learning_rate': 0.07186120316561657, 'max_depth': 11, 'min_samples_split': 19, 'min_samples_leaf': 1, 'subsample': 0.7079659414070656, 'max_features': 'sqrt'}. Best is trial 1137 with value: 0.19687116000636118.
[I 2024-12-04 13:01:18,347] Trial 1239 finished with value: 0.23847704375769227 and parameters: {'n_estimators': 1457, 'learning_rate': 0.049220352390518356, 'max_depth': 12, 'min_samples_split': 20, 'min_samples_leaf': 2, 'subsample': 0.7289077829039557, 'max_features': 'sqrt'}. Best is trial 1137 with value: 0.19687116000636118.
[I 2024-12-04 13:01:20,250] Trial 1240 finished with value: 0.21019527460250279 and parameters: {'n_estimators': 1490, 'learning_rate': 0.06910789033176633, 'max_depth': 11, 'min_samples_split': 20, 'min_samples_leaf': 1, 'subsample': 0.7052834160926413, 'max_features': 'sqrt'}. Best is trial 1137 with value: 0.19687116000636118.
[I 2024-12-04 13:01:20,553] Trial 1245 finished with value: 0.2491287916470035 and parameters: {'n_estimators': 1311, 'learning_rate': 0.07580553893225504, 'max_depth': 9, 'min_samples_split': 20, 'min_samples_leaf': 1, 'subsample': 0.6997374783257525, 'max_features': 'log2'}. Best is trial 1137 with value: 0.19687116000636118.
[I 2024-12-04 13:01:22,592] Trial 1241 finished with value: 0.2372309946255957 and parameters: {'n_estimators': 1427, 'learning_rate': 0.08903789924421311, 'max_depth': 12, 'min_samples_split': 19, 'min_samples_leaf': 2, 'subsample': 0.6512874838912036, 'max_features': 'sqrt'}. Best is trial 1137 with value: 0.19687116000636118.
[I 2024-12-04 13:01:28,874] Trial 1250 finished with value: 0.2619519343233133 and parameters: {'n_estimators': 1207, 'learning_rate': 0.05790891730333812, 'max_depth': 10, 'min_samples_split': 20, 'min_samples_leaf': 4, 'subsample': 0.7244473935868682, 'max_features': 'sqrt'}. Best is trial 1137 with value: 0.19687116000636118.
[I 2024-12-04 13:01:28,991] Trial 1258 finished with value: 0.2838950426652223 and parameters: {'n_estimators': 894, 'learning_rate': 0.09326876542747027, 'max_depth': 8, 'min_samples_split': 19, 'min_samples_leaf': 2, 'subsample': 0.7113174269643827, 'max_features': 'log2'}. Best is trial 1137 with value: 0.19687116000636118.
[I 2024-12-04 13:01:30,309] Trial 1243 finished with value: 0.2067264953057576 and parameters: {'n_estimators': 1458, 'learning_rate': 0.09460117105797108, 'max_depth': 12, 'min_samples_split': 20, 'min_samples_leaf': 1, 'subsample': 0.6340210254105326, 'max_features': 'sqrt'}. Best is trial 1137 with value: 0.19687116000636118.
[I 2024-12-04 13:01:32,197] Trial 1248 finished with value: 0.22669729688868562 and parameters: {'n_estimators': 1363, 'learning_rate': 0.052751033751911834, 'max_depth': 11, 'min_samples_split': 19, 'min_samples_leaf': 1, 'subsample': 0.7118011080526618, 'max_features': 'sqrt'}. Best is trial 1137 with value: 0.19687116000636118.
[I 2024-12-04 13:01:35,083] Trial 1244 finished with value: 0.2100187298938299 and parameters: {'n_estimators': 1400, 'learning_rate': 0.09792005998120538, 'max_depth': 12, 'min_samples_split': 19, 'min_samples_leaf': 1, 'subsample': 0.685194569333431, 'max_features': 'sqrt'}. Best is trial 1137 with value: 0.19687116000636118.
[I 2024-12-04 13:01:35,602] Trial 1247 finished with value: 0.20277396409768023 and parameters: {'n_estimators': 1428, 'learning_rate': 0.08645876230120272, 'max_depth': 12, 'min_samples_split': 20, 'min_samples_leaf': 1, 'subsample': 0.687574171994299, 'max_features': 'sqrt'}. Best is trial 1137 with value: 0.19687116000636118.
[I 2024-12-04 13:01:35,606] Trial 1249 finished with value: 0.24823452126701262 and parameters: {'n_estimators': 1350, 'learning_rate': 0.06939066581923768, 'max_depth': 11, 'min_samples_split': 20, 'min_samples_leaf': 4, 'subsample': 0.802444968056981, 'max_features': 'sqrt'}. Best is trial 1137 with value: 0.19687116000636118.
[I 2024-12-04 13:01:39,996] Trial 1251 finished with value: 0.23015896628911373 and parameters: {'n_estimators': 1283, 'learning_rate': 0.07527413777782055, 'max_depth': 11, 'min_samples_split': 20, 'min_samples_leaf': 1, 'subsample': 0.7499424718495393, 'max_features': 'sqrt'}. Best is trial 1137 with value: 0.19687116000636118.
[I 2024-12-04 13:01:41,201] Trial 1246 finished with value: 0.21102716829203275 and parameters: {'n_estimators': 1482, 'learning_rate': 0.07320323781492757, 'max_depth': 12, 'min_samples_split': 17, 'min_samples_leaf': 1, 'subsample': 0.6120348236382438, 'max_features': 'sqrt'}. Best is trial 1137 with value: 0.19687116000636118.
[I 2024-12-04 13:01:42,422] Trial 1273 finished with value: 0.8872721315928849 and parameters: {'n_estimators': 221, 'learning_rate': 0.011230979536877935, 'max_depth': 12, 'min_samples_split': 3, 'min_samples_leaf': 7, 'subsample': 0.8438062221851104, 'max_features': 'log2'}. Best is trial 1137 with value: 0.19687116000636118.
[I 2024-12-04 13:01:44,504] Trial 1254 finished with value: 0.23123824047907354 and parameters: {'n_estimators': 1312, 'learning_rate': 0.07101306337728365, 'max_depth': 11, 'min_samples_split': 19, 'min_samples_leaf': 2, 'subsample': 0.6007362037546446, 'max_features': 'sqrt'}. Best is trial 1137 with value: 0.19687116000636118.
[I 2024-12-04 13:01:46,612] Trial 1257 finished with value: 0.45345441184981616 and parameters: {'n_estimators': 1164, 'learning_rate': 0.010122371499501617, 'max_depth': 6, 'min_samples_split': 3, 'min_samples_leaf': 8, 'subsample': 0.7827315094263904, 'max_features': 'sqrt'}. Best is trial 1137 with value: 0.19687116000636118.
[I 2024-12-04 13:01:46,675] Trial 1253 finished with value: 0.2318025050025371 and parameters: {'n_estimators': 1356, 'learning_rate': 0.06869592109317432, 'max_depth': 12, 'min_samples_split': 20, 'min_samples_leaf': 2, 'subsample': 0.7362210972944963, 'max_features': 'sqrt'}. Best is trial 1137 with value: 0.19687116000636118.
[I 2024-12-04 13:01:46,999] Trial 1252 finished with value: 0.23209865566905144 and parameters: {'n_estimators': 1391, 'learning_rate': 0.0941992157544324, 'max_depth': 12, 'min_samples_split': 19, 'min_samples_leaf': 2, 'subsample': 0.7817115662485864, 'max_features': 'sqrt'}. Best is trial 1137 with value: 0.19687116000636118.
[I 2024-12-04 13:01:49,726] Trial 1259 finished with value: 0.22162554822616326 and parameters: {'n_estimators': 1250, 'learning_rate': 0.07403446931750787, 'max_depth': 12, 'min_samples_split': 20, 'min_samples_leaf': 1, 'subsample': 0.6119734131491922, 'max_features': 'sqrt'}. Best is trial 1137 with value: 0.19687116000636118.
[I 2024-12-04 13:01:50,017] Trial 1264 finished with value: 0.2436054274802707 and parameters: {'n_estimators': 996, 'learning_rate': 0.07188483424419173, 'max_depth': 12, 'min_samples_split': 20, 'min_samples_leaf': 1, 'subsample': 0.7117014604811922, 'max_features': None}. Best is trial 1137 with value: 0.19687116000636118.
[I 2024-12-04 13:01:53,753] Trial 1255 finished with value: 0.21313381930843822 and parameters: {'n_estimators': 1464, 'learning_rate': 0.05806818757177848, 'max_depth': 12, 'min_samples_split': 20, 'min_samples_leaf': 1, 'subsample': 0.7002627482007009, 'max_features': 'sqrt'}. Best is trial 1137 with value: 0.19687116000636118.
[I 2024-12-04 13:01:55,759] Trial 1262 finished with value: 0.31600616255438474 and parameters: {'n_estimators': 1181, 'learning_rate': 0.010016830710685326, 'max_depth': 6, 'min_samples_split': 5, 'min_samples_leaf': 3, 'subsample': 0.8334858548156339, 'max_features': None}. Best is trial 1137 with value: 0.19687116000636118.
[I 2024-12-04 13:01:58,591] Trial 1260 finished with value: 0.22755759597283085 and parameters: {'n_estimators': 1382, 'learning_rate': 0.08817960237679326, 'max_depth': 12, 'min_samples_split': 20, 'min_samples_leaf': 1, 'subsample': 0.7015699179834445, 'max_features': 'sqrt'}. Best is trial 1137 with value: 0.19687116000636118.
[I 2024-12-04 13:02:01,827] Trial 1256 finished with value: 0.23756372508892618 and parameters: {'n_estimators': 1493, 'learning_rate': 0.09579544097714936, 'max_depth': 12, 'min_samples_split': 18, 'min_samples_leaf': 2, 'subsample': 0.6809745159438101, 'max_features': 'sqrt'}. Best is trial 1137 with value: 0.19687116000636118.
[I 2024-12-04 13:02:03,854] Trial 1275 finished with value: 0.4109273898865091 and parameters: {'n_estimators': 600, 'learning_rate': 0.01087222216695672, 'max_depth': 7, 'min_samples_split': 6, 'min_samples_leaf': 1, 'subsample': 0.7181301934447343, 'max_features': 'sqrt'}. Best is trial 1137 with value: 0.19687116000636118.
[I 2024-12-04 13:02:07,255] Trial 1267 finished with value: 0.22834325013752033 and parameters: {'n_estimators': 1188, 'learning_rate': 0.09902651012585494, 'max_depth': 10, 'min_samples_split': 19, 'min_samples_leaf': 1, 'subsample': 0.645005142283078, 'max_features': 'sqrt'}. Best is trial 1137 with value: 0.19687116000636118.
[I 2024-12-04 13:02:07,672] Trial 1263 finished with value: 0.22132256537505846 and parameters: {'n_estimators': 1497, 'learning_rate': 0.0935940435183614, 'max_depth': 10, 'min_samples_split': 16, 'min_samples_leaf': 1, 'subsample': 0.6173103360371754, 'max_features': 'sqrt'}. Best is trial 1137 with value: 0.19687116000636118.
