[I 2024-12-03 18:44:47,656] Trial 596 finished with value: 0.3945903973070501 and parameters: {'kernel': 'rbf', 'C': 27.54569017959302, 'gamma': 0.038184202379449694, 'epsilon': 0.08535350848840831}. Best is trial 88 with value: 0.3542875001421725.
[I 2024-12-03 18:44:47,827] Trial 601 finished with value: 1815.6946164158496 and parameters: {'kernel': 'sigmoid', 'C': 84.82434641562429, 'gamma': 0.05776762954912168, 'epsilon': 0.5198392349390895}. Best is trial 88 with value: 0.3542875001421725.
[I 2024-12-03 18:44:47,832] Trial 597 finished with value: 0.3935643926895833 and parameters: {'kernel': 'rbf', 'C': 22.547746223996832, 'gamma': 0.05360558866538117, 'epsilon': 0.07141461558845247}. Best is trial 88 with value: 0.3542875001421725.
[I 2024-12-03 18:44:48,934] Trial 604 finished with value: 0.3632069010181033 and parameters: {'kernel': 'rbf', 'C': 88.55781282318573, 'gamma': 0.058737163401112596, 'epsilon': 0.11195305841756166}. Best is trial 88 with value: 0.3542875001421725.
[I 2024-12-03 18:44:48,935] Trial 599 finished with value: 0.44484335503260436 and parameters: {'kernel': 'rbf', 'C': 92.95405069126352, 'gamma': 0.0062484596074086985, 'epsilon': 0.12443167656053084}. Best is trial 88 with value: 0.3542875001421725.
[I 2024-12-03 18:44:49,859] Trial 605 finished with value: 0.36599837460627815 and parameters: {'kernel': 'rbf', 'C': 94.72844878564423, 'gamma': 0.02510814778523768, 'epsilon': 0.10354512110162296}. Best is trial 88 with value: 0.3542875001421725.
[I 2024-12-03 18:44:49,860] Trial 606 finished with value: 3.0547938324987673 and parameters: {'kernel': 'sigmoid', 'C': 0.9591878712585832, 'gamma': 0.0044928813256064435, 'epsilon': 0.6078667085173004}. Best is trial 88 with value: 0.3542875001421725.
[I 2024-12-03 18:44:50,079] Trial 603 finished with value: 1454.549345096364 and parameters: {'kernel': 'sigmoid', 'C': 70.72751920344686, 'gamma': 0.08044695871498503, 'epsilon': 0.06666803971210283}. Best is trial 88 with value: 0.3542875001421725.
[I 2024-12-03 18:44:50,302] Trial 609 finished with value: 0.4499697838894349 and parameters: {'kernel': 'rbf', 'C': 16.887268003616352, 'gamma': 0.08046807712359798, 'epsilon': 0.3454107262491997}. Best is trial 88 with value: 0.3542875001421725.
[I 2024-12-03 18:44:50,614] Trial 607 finished with value: 0.51208212927185 and parameters: {'kernel': 'rbf', 'C': 10.638552115651189, 'gamma': 0.17368623312994017, 'epsilon': 0.16818985122835395}. Best is trial 88 with value: 0.3542875001421725.
[I 2024-12-03 18:44:51,199] Trial 598 finished with value: 0.799863048075658 and parameters: {'kernel': 'linear', 'C': 9.260207094308731, 'gamma': 0.05616641814509038, 'epsilon': 0.06788802411914487}. Best is trial 88 with value: 0.3542875001421725.
[I 2024-12-03 18:44:51,365] Trial 602 finished with value: 0.7935578515038062 and parameters: {'kernel': 'linear', 'C': 5.01267693038323, 'gamma': 0.0001840781889803314, 'epsilon': 0.001115894549302031}. Best is trial 88 with value: 0.3542875001421725.
[I 2024-12-03 18:44:51,568] Trial 611 finished with value: 0.43616654662874066 and parameters: {'kernel': 'rbf', 'C': 11.099988969496597, 'gamma': 0.00571228143250366, 'epsilon': 0.15424601136813076}. Best is trial 88 with value: 0.3542875001421725.
[I 2024-12-03 18:44:51,577] Trial 608 finished with value: 0.438521724299261 and parameters: {'kernel': 'rbf', 'C': 19.259362182725763, 'gamma': 0.007121408641958342, 'epsilon': 0.2968629156263}. Best is trial 88 with value: 0.3542875001421725.
[I 2024-12-03 18:44:52,023] Trial 610 finished with value: 0.39964516519882765 and parameters: {'kernel': 'rbf', 'C': 19.86285122394165, 'gamma': 0.040712674625137134, 'epsilon': 0.153027468396068}. Best is trial 88 with value: 0.3542875001421725.
[I 2024-12-03 18:44:52,458] Trial 612 finished with value: 0.375307064299717 and parameters: {'kernel': 'rbf', 'C': 90.02855521216227, 'gamma': 0.05230096458634271, 'epsilon': 0.2817166777285316}. Best is trial 88 with value: 0.3542875001421725.
[I 2024-12-03 18:44:53,252] Trial 614 finished with value: 0.38147814339159897 and parameters: {'kernel': 'rbf', 'C': 86.91683476286013, 'gamma': 0.06523450317625344, 'epsilon': 0.2456888347765176}. Best is trial 88 with value: 0.3542875001421725.
[I 2024-12-03 18:44:53,764] Trial 613 finished with value: 0.3976906510916169 and parameters: {'kernel': 'rbf', 'C': 20.060960530020154, 'gamma': 0.058968876786662586, 'epsilon': 0.07719389307057739}. Best is trial 88 with value: 0.3542875001421725.
[I 2024-12-03 18:44:54,016] Trial 615 finished with value: 0.3632990441739956 and parameters: {'kernel': 'rbf', 'C': 96.80206394952646, 'gamma': 0.03393883932917305, 'epsilon': 0.1356468888889656}. Best is trial 88 with value: 0.3542875001421725.
[I 2024-12-03 18:44:54,289] Trial 616 finished with value: 0.42306138379050956 and parameters: {'kernel': 'rbf', 'C': 78.09715542290263, 'gamma': 0.12781335633204136, 'epsilon': 0.0533336752400555}. Best is trial 88 with value: 0.3542875001421725.
[I 2024-12-03 18:44:54,656] Trial 617 finished with value: 0.5120819029144804 and parameters: {'kernel': 'rbf', 'C': 22.827022823794348, 'gamma': 0.1901194698605882, 'epsilon': 0.15225201380170164}. Best is trial 88 with value: 0.3542875001421725.
[I 2024-12-03 18:44:54,881] Trial 620 finished with value: 1.0750716257858688 and parameters: {'kernel': 'poly', 'C': 0.0010326952598880587, 'gamma': 0.00016138473724356544, 'epsilon': 0.06170929503519036}. Best is trial 88 with value: 0.3542875001421725.
[I 2024-12-03 18:44:55,727] Trial 619 finished with value: 0.40890698689210203 and parameters: {'kernel': 'rbf', 'C': 23.103464257808977, 'gamma': 0.01066000059436111, 'epsilon': 0.12640236984765957}. Best is trial 88 with value: 0.3542875001421725.
[I 2024-12-03 18:44:55,729] Trial 621 finished with value: 1.06135421805318 and parameters: {'kernel': 'poly', 'C': 5.837151960747843, 'gamma': 0.0029181953077785064, 'epsilon': 0.11501775180538187}. Best is trial 88 with value: 0.3542875001421725.
[I 2024-12-03 18:44:55,767] Trial 618 finished with value: 0.393284362072048 and parameters: {'kernel': 'rbf', 'C': 95.7917968435849, 'gamma': 0.09494799423154517, 'epsilon': 0.08035459439191073}. Best is trial 88 with value: 0.3542875001421725.
[I 2024-12-03 18:44:56,550] Trial 585 finished with value: 0.7506873471525218 and parameters: {'kernel': 'linear', 'C': 93.74555171556626, 'gamma': 0.01838260050428484, 'epsilon': 0.49849589307271747}. Best is trial 88 with value: 0.3542875001421725.
[I 2024-12-03 18:44:56,947] Trial 624 finished with value: 0.4307609639241877 and parameters: {'kernel': 'rbf', 'C': 97.8605545529712, 'gamma': 0.09702579362569949, 'epsilon': 0.2599702474307793}. Best is trial 88 with value: 0.3542875001421725.
[I 2024-12-03 18:44:57,096] Trial 622 finished with value: 0.4214401707792399 and parameters: {'kernel': 'rbf', 'C': 99.63810664829637, 'gamma': 0.007582481592719226, 'epsilon': 0.045347835566476646}. Best is trial 88 with value: 0.3542875001421725.
[I 2024-12-03 18:44:57,561] Trial 625 finished with value: 0.5450875496088832 and parameters: {'kernel': 'rbf', 'C': 16.620595062812104, 'gamma': 0.014206821346151163, 'epsilon': 0.7095971569364002}. Best is trial 88 with value: 0.3542875001421725.
[I 2024-12-03 18:44:58,318] Trial 626 finished with value: 0.5601025407873137 and parameters: {'kernel': 'rbf', 'C': 93.56845297773769, 'gamma': 0.23982263099896473, 'epsilon': 0.176680477473995}. Best is trial 88 with value: 0.3542875001421725.
[I 2024-12-03 18:44:58,464] Trial 623 finished with value: 0.3683197319814241 and parameters: {'kernel': 'rbf', 'C': 96.5493211368111, 'gamma': 0.0289324863610451, 'epsilon': 0.07184782952290367}. Best is trial 88 with value: 0.3542875001421725.
[I 2024-12-03 18:45:00,034] Trial 630 finished with value: 1.01389168159854 and parameters: {'kernel': 'sigmoid', 'C': 0.02176474955586544, 'gamma': 0.0009712044555498496, 'epsilon': 0.14422904760199065}. Best is trial 88 with value: 0.3542875001421725.
[I 2024-12-03 18:45:00,035] Trial 629 finished with value: 0.3981769520802064 and parameters: {'kernel': 'rbf', 'C': 98.38339414794945, 'gamma': 0.013214385517550631, 'epsilon': 0.13632298946602056}. Best is trial 88 with value: 0.3542875001421725.
[I 2024-12-03 18:45:00,079] Trial 627 finished with value: 0.36612747320238614 and parameters: {'kernel': 'rbf', 'C': 99.06557499684051, 'gamma': 0.05229335735073501, 'epsilon': 0.06966133642362594}. Best is trial 88 with value: 0.3542875001421725.
[I 2024-12-03 18:45:01,015] Trial 633 finished with value: 0.4050459850980625 and parameters: {'kernel': 'rbf', 'C': 17.981267722927637, 'gamma': 0.05139497337084999, 'epsilon': 0.11272703508356183}. Best is trial 88 with value: 0.3542875001421725.
[I 2024-12-03 18:45:01,016] Trial 631 finished with value: 0.4085943026340238 and parameters: {'kernel': 'rbf', 'C': 98.47575211379245, 'gamma': 0.026665310734002776, 'epsilon': 0.5258616840690267}. Best is trial 88 with value: 0.3542875001421725.
[I 2024-12-03 18:45:01,042] Trial 634 finished with value: 0.41558616422967853 and parameters: {'kernel': 'rbf', 'C': 16.339236853035448, 'gamma': 0.02988584369713573, 'epsilon': 0.16956657957060112}. Best is trial 88 with value: 0.3542875001421725.
[I 2024-12-03 18:45:01,128] Trial 632 finished with value: 0.7336258190766791 and parameters: {'kernel': 'linear', 'C': 0.31661452115749955, 'gamma': 0.011308518804716021, 'epsilon': 0.30969834529973533}. Best is trial 88 with value: 0.3542875001421725.
[I 2024-12-03 18:45:01,908] Trial 635 finished with value: 0.35727530665381074 and parameters: {'kernel': 'rbf', 'C': 78.6323709103565, 'gamma': 0.05492935605320567, 'epsilon': 0.13293414246022758}. Best is trial 88 with value: 0.3542875001421725.
[I 2024-12-03 18:45:02,158] Trial 637 finished with value: 0.42602467828427076 and parameters: {'kernel': 'rbf', 'C': 9.671552732894288, 'gamma': 0.020779162123604963, 'epsilon': 0.08378450885501569}. Best is trial 88 with value: 0.3542875001421725.
[I 2024-12-03 18:45:02,289] Trial 636 finished with value: 0.3677530088396038 and parameters: {'kernel': 'rbf', 'C': 83.78401733887993, 'gamma': 0.02613515171836719, 'epsilon': 0.2620340166486749}. Best is trial 88 with value: 0.3542875001421725.
[I 2024-12-03 18:45:03,098] Trial 638 finished with value: 0.43026626517250205 and parameters: {'kernel': 'rbf', 'C': 14.541922344486325, 'gamma': 0.03545029308595817, 'epsilon': 0.06591101594604547}. Best is trial 88 with value: 0.3542875001421725.
[I 2024-12-03 18:45:04,007] Trial 640 finished with value: 1.1179307197684778 and parameters: {'kernel': 'poly', 'C': 26.78885525569406, 'gamma': 0.00022556702099482028, 'epsilon': 0.006904000618868124}. Best is trial 88 with value: 0.3542875001421725.
[I 2024-12-03 18:45:04,030] Trial 639 finished with value: 0.5268940566334398 and parameters: {'kernel': 'rbf', 'C': 13.423027023708997, 'gamma': 0.19010359081274192, 'epsilon': 0.18989305826942923}. Best is trial 88 with value: 0.3542875001421725.
[I 2024-12-03 18:45:05,055] Trial 643 finished with value: 0.40852936168816034 and parameters: {'kernel': 'rbf', 'C': 23.51603965653358, 'gamma': 0.08519203585297766, 'epsilon': 0.20662233407806987}. Best is trial 88 with value: 0.3542875001421725.
[I 2024-12-03 18:45:05,089] Trial 641 finished with value: 0.8651604925325335 and parameters: {'kernel': 'linear', 'C': 27.047363583984172, 'gamma': 0.1906243792361001, 'epsilon': 0.8926023934218537}. Best is trial 88 with value: 0.3542875001421725.
[I 2024-12-03 18:45:05,474] Trial 645 finished with value: 0.7744848191468141 and parameters: {'kernel': 'rbf', 'C': 0.23119022114962304, 'gamma': 0.3598989621244128, 'epsilon': 0.023596979109134702}. Best is trial 88 with value: 0.3542875001421725.
[I 2024-12-03 18:45:05,475] Trial 642 finished with value: 0.35652022815521955 and parameters: {'kernel': 'rbf', 'C': 90.94378993604892, 'gamma': 0.05056562865215779, 'epsilon': 0.12360099139869095}. Best is trial 88 with value: 0.3542875001421725.
[I 2024-12-03 18:45:05,477] Trial 510 finished with value: 0.7744395666681798 and parameters: {'kernel': 'linear', 'C': 65.30941441894944, 'gamma': 0.05366227516581825, 'epsilon': 0.14161007744094656}. Best is trial 88 with value: 0.3542875001421725.
[I 2024-12-03 18:45:05,806] Trial 644 finished with value: 2.0674237788712717 and parameters: {'kernel': 'poly', 'C': 42.82809937513876, 'gamma': 0.005084708161337791, 'epsilon': 0.5542786038709143}. Best is trial 88 with value: 0.3542875001421725.
[I 2024-12-03 18:45:07,013] Trial 647 finished with value: 0.435086577379743 and parameters: {'kernel': 'rbf', 'C': 92.3299793565852, 'gamma': 0.110824709400345, 'epsilon': 0.20999727916736527}. Best is trial 88 with value: 0.3542875001421725.
[I 2024-12-03 18:45:07,132] Trial 649 finished with value: 0.40922110003861056 and parameters: {'kernel': 'rbf', 'C': 19.18020602428248, 'gamma': 0.08756734117931117, 'epsilon': 0.03375345859152512}. Best is trial 88 with value: 0.3542875001421725.
[I 2024-12-03 18:45:07,248] Trial 648 finished with value: 0.482547024991057 and parameters: {'kernel': 'rbf', 'C': 9.244545328027359, 'gamma': 0.1637336794333216, 'epsilon': 0.020189042148171608}. Best is trial 88 with value: 0.3542875001421725.
[I 2024-12-03 18:45:07,573] Trial 650 finished with value: 0.5147811690790601 and parameters: {'kernel': 'rbf', 'C': 25.049463607069345, 'gamma': 0.20968465171854217, 'epsilon': 0.07249167975041668}. Best is trial 88 with value: 0.3542875001421725.
[I 2024-12-03 18:45:08,641] Trial 653 finished with value: 0.3583464404281981 and parameters: {'kernel': 'rbf', 'C': 96.4437987488328, 'gamma': 0.03558624152570463, 'epsilon': 0.20924953923090475}. Best is trial 88 with value: 0.3542875001421725.
[I 2024-12-03 18:45:08,655] Trial 656 finished with value: 0.620004523248293 and parameters: {'kernel': 'rbf', 'C': 66.71624867114275, 'gamma': 0.3640350039057901, 'epsilon': 0.09740078633032176}. Best is trial 88 with value: 0.3542875001421725.
[I 2024-12-03 18:45:08,905] Trial 654 finished with value: 0.4222513417728418 and parameters: {'kernel': 'rbf', 'C': 43.942539687654595, 'gamma': 0.010891141491374115, 'epsilon': 0.3661862956299801}. Best is trial 88 with value: 0.3542875001421725.
[I 2024-12-03 18:45:08,987] Trial 652 finished with value: 0.41401044282900457 and parameters: {'kernel': 'rbf', 'C': 22.701389933527715, 'gamma': 0.03787304385013008, 'epsilon': 0.038887078975147114}. Best is trial 88 with value: 0.3542875001421725.
[I 2024-12-03 18:45:09,381] Trial 651 finished with value: 0.3637532569715238 and parameters: {'kernel': 'rbf', 'C': 96.28640584580371, 'gamma': 0.04636651934947343, 'epsilon': 0.04934464272405952}. Best is trial 88 with value: 0.3542875001421725.
[I 2024-12-03 18:45:09,382] Trial 655 finished with value: 0.7474437777272247 and parameters: {'kernel': 'rbf', 'C': 11.8769658265117, 'gamma': 0.301611343570739, 'epsilon': 0.6805467672507144}. Best is trial 88 with value: 0.3542875001421725.
[I 2024-12-03 18:45:09,383] Trial 657 finished with value: 0.865130575954176 and parameters: {'kernel': 'rbf', 'C': 0.2047992848094607, 'gamma': 0.00033407004900802117, 'epsilon': 0.02751623035221355}. Best is trial 88 with value: 0.3542875001421725.
[I 2024-12-03 18:45:11,833] Trial 660 finished with value: 0.36701124068558283 and parameters: {'kernel': 'rbf', 'C': 98.60122904239087, 'gamma': 0.027623238696121665, 'epsilon': 0.09546799916921057}. Best is trial 88 with value: 0.3542875001421725.
[I 2024-12-03 18:45:11,834] Trial 659 finished with value: 0.4152865158594009 and parameters: {'kernel': 'rbf', 'C': 93.59560024530435, 'gamma': 0.012870740895372042, 'epsilon': 0.5127075762546786}. Best is trial 88 with value: 0.3542875001421725.
[I 2024-12-03 18:45:12,239] Trial 665 finished with value: 0.38808697624819755 and parameters: {'kernel': 'rbf', 'C': 26.8143600645995, 'gamma': 0.03611340334233477, 'epsilon': 0.2979661110434236}. Best is trial 88 with value: 0.3542875001421725.
[I 2024-12-03 18:45:12,338] Trial 658 finished with value: 0.41901595147548554 and parameters: {'kernel': 'rbf', 'C': 16.1608385504569, 'gamma': 0.04733863703740642, 'epsilon': 0.35922795338476665}. Best is trial 88 with value: 0.3542875001421725.
[I 2024-12-03 18:45:12,711] Trial 661 finished with value: 322.23788279996126 and parameters: {'kernel': 'sigmoid', 'C': 89.9276972090211, 'gamma': 0.0027490927297369903, 'epsilon': 0.003721233172858466}. Best is trial 88 with value: 0.3542875001421725.
[I 2024-12-03 18:45:12,850] Trial 663 finished with value: 0.36985114004261754 and parameters: {'kernel': 'rbf', 'C': 80.36016259394925, 'gamma': 0.02271411524253883, 'epsilon': 0.14496168875090049}. Best is trial 88 with value: 0.3542875001421725.
[I 2024-12-03 18:45:12,851] Trial 662 finished with value: 0.367947189845164 and parameters: {'kernel': 'rbf', 'C': 81.82418307086301, 'gamma': 0.029487721059275832, 'epsilon': 0.16689540725154361}. Best is trial 88 with value: 0.3542875001421725.
[I 2024-12-03 18:45:13,303] Trial 667 finished with value: 0.5083464751744311 and parameters: {'kernel': 'rbf', 'C': 1.796336393123207, 'gamma': 0.028806919076465737, 'epsilon': 0.27245605077210017}. Best is trial 88 with value: 0.3542875001421725.
[I 2024-12-03 18:45:14,733] Trial 668 finished with value: 0.4261641512136682 and parameters: {'kernel': 'rbf', 'C': 20.50994898283165, 'gamma': 0.019101744559413845, 'epsilon': 0.1022579847114974}. Best is trial 88 with value: 0.3542875001421725.
[I 2024-12-03 18:45:14,734] Trial 666 finished with value: 0.5878681216547322 and parameters: {'kernel': 'rbf', 'C': 15.78745993792257, 'gamma': 0.1113912056878828, 'epsilon': 0.5929226146452994}. Best is trial 88 with value: 0.3542875001421725.
[I 2024-12-03 18:45:14,753] Trial 669 finished with value: 0.524678205126934 and parameters: {'kernel': 'rbf', 'C': 12.697012385782008, 'gamma': 0.14181106191330548, 'epsilon': 0.3378947031265178}. Best is trial 88 with value: 0.3542875001421725.
[I 2024-12-03 18:45:14,875] Trial 664 finished with value: 0.3986593205254893 and parameters: {'kernel': 'rbf', 'C': 87.30720304887798, 'gamma': 0.05196115792626089, 'epsilon': 0.35927227911227155}. Best is trial 88 with value: 0.3542875001421725.
[I 2024-12-03 18:45:16,453] Trial 671 finished with value: 0.36879530756112405 and parameters: {'kernel': 'rbf', 'C': 99.31784575262921, 'gamma': 0.02506252651725302, 'epsilon': 0.23615458204919842}. Best is trial 88 with value: 0.3542875001421725.
[I 2024-12-03 18:45:16,453] Trial 670 finished with value: 0.5243614897862109 and parameters: {'kernel': 'rbf', 'C': 1.6070609734234313, 'gamma': 0.00908997835809793, 'epsilon': 0.015791547673842228}. Best is trial 88 with value: 0.3542875001421725.
[I 2024-12-03 18:45:16,680] Trial 674 finished with value: 0.40130822564046975 and parameters: {'kernel': 'rbf', 'C': 90.09329983247291, 'gamma': 0.10175357180727893, 'epsilon': 0.12754135076478038}. Best is trial 88 with value: 0.3542875001421725.
[I 2024-12-03 18:45:16,844] Trial 673 finished with value: 0.38463706318040397 and parameters: {'kernel': 'rbf', 'C': 93.8320945935533, 'gamma': 0.07067304051753084, 'epsilon': 0.2315500950574889}. Best is trial 88 with value: 0.3542875001421725.
[I 2024-12-03 18:45:17,461] Trial 672 finished with value: 0.4968970416972205 and parameters: {'kernel': 'rbf', 'C': 96.06598204179743, 'gamma': 0.1876519297225997, 'epsilon': 0.09430554417181378}. Best is trial 88 with value: 0.3542875001421725.
[I 2024-12-03 18:45:18,053] Trial 675 finished with value: 0.36580499306419817 and parameters: {'kernel': 'rbf', 'C': 97.73169150358791, 'gamma': 0.03154954382322042, 'epsilon': 0.1544836179715277}. Best is trial 88 with value: 0.3542875001421725.
[I 2024-12-03 18:45:18,304] Trial 679 finished with value: 0.39326674871410483 and parameters: {'kernel': 'rbf', 'C': 91.27267479601103, 'gamma': 0.08910195045681144, 'epsilon': 0.028371262481023223}. Best is trial 88 with value: 0.3542875001421725.
[I 2024-12-03 18:45:18,720] Trial 677 finished with value: 1454.6327365644017 and parameters: {'kernel': 'sigmoid', 'C': 70.95897106046502, 'gamma': 0.09236383825432343, 'epsilon': 0.13962278789218413}. Best is trial 88 with value: 0.3542875001421725.
[I 2024-12-03 18:45:18,971] Trial 678 finished with value: 0.4005897343045526 and parameters: {'kernel': 'rbf', 'C': 18.244660498491747, 'gamma': 0.06400217624286678, 'epsilon': 0.1704179823659725}. Best is trial 88 with value: 0.3542875001421725.
[I 2024-12-03 18:45:20,353] Trial 681 finished with value: 0.39953614539602456 and parameters: {'kernel': 'rbf', 'C': 98.90018731450043, 'gamma': 0.01355494992207277, 'epsilon': 0.10251700977158527}. Best is trial 88 with value: 0.3542875001421725.
[I 2024-12-03 18:45:21,522] Trial 682 finished with value: 0.41523668051165713 and parameters: {'kernel': 'rbf', 'C': 15.274466326995295, 'gamma': 0.0536725830805734, 'epsilon': 0.10311455266512531}. Best is trial 88 with value: 0.3542875001421725.
[I 2024-12-03 18:45:21,874] Trial 687 finished with value: 192.84303696498947 and parameters: {'kernel': 'sigmoid', 'C': 8.920418687171102, 'gamma': 0.042846152979360924, 'epsilon': 0.21119114655732324}. Best is trial 88 with value: 0.3542875001421725.
[I 2024-12-03 18:45:21,896] Trial 684 finished with value: 0.4056964352987828 and parameters: {'kernel': 'rbf', 'C': 16.077207104605204, 'gamma': 0.012829197059859986, 'epsilon': 0.10474446032317405}. Best is trial 88 with value: 0.3542875001421725.
[I 2024-12-03 18:45:21,918] Trial 688 finished with value: 0.40800850113608395 and parameters: {'kernel': 'rbf', 'C': 17.17339098081251, 'gamma': 0.07258391936088689, 'epsilon': 0.17907927923014302}. Best is trial 88 with value: 0.3542875001421725.
[I 2024-12-03 18:45:22,566] Trial 689 finished with value: 0.3562180377768216 and parameters: {'kernel': 'rbf', 'C': 91.5839943570169, 'gamma': 0.04343236396516066, 'epsilon': 0.19213459883644662}. Best is trial 88 with value: 0.3542875001421725.
