[I 2024-12-04 20:05:37,420] Trial 829 finished with value: 0.3230288283209677 and parameters: {'n_estimators': 380, 'max_depth': 50, 'min_samples_split': 2, 'min_samples_leaf': 1, 'max_features': 'sqrt', 'bootstrap': False, 'criterion': 'squared_error'}. Best is trial 793 with value: 0.32179807021578266.
[I 2024-12-04 20:05:38,808] Trial 821 finished with value: 0.35356813680378263 and parameters: {'n_estimators': 390, 'max_depth': 49, 'min_samples_split': 2, 'min_samples_leaf': 1, 'max_features': 'sqrt', 'bootstrap': False, 'criterion': 'absolute_error'}. Best is trial 793 with value: 0.32179807021578266.
[I 2024-12-04 20:05:39,361] Trial 830 finished with value: 0.3230739760881745 and parameters: {'n_estimators': 353, 'max_depth': 50, 'min_samples_split': 2, 'min_samples_leaf': 1, 'max_features': 'sqrt', 'bootstrap': False, 'criterion': 'squared_error'}. Best is trial 793 with value: 0.32179807021578266.
[I 2024-12-04 20:05:39,780] Trial 831 finished with value: 0.32284333741137333 and parameters: {'n_estimators': 379, 'max_depth': 50, 'min_samples_split': 2, 'min_samples_leaf': 1, 'max_features': 'sqrt', 'bootstrap': False, 'criterion': 'squared_error'}. Best is trial 793 with value: 0.32179807021578266.
[I 2024-12-04 20:05:41,039] Trial 832 finished with value: 0.39077277430267393 and parameters: {'n_estimators': 429, 'max_depth': 49, 'min_samples_split': 4, 'min_samples_leaf': 1, 'max_features': 'sqrt', 'bootstrap': False, 'criterion': 'squared_error'}. Best is trial 793 with value: 0.32179807021578266.
[I 2024-12-04 20:05:41,571] Trial 834 finished with value: 1.3338902489255224 and parameters: {'n_estimators': 521, 'max_depth': 26, 'min_samples_split': 16, 'min_samples_leaf': 7, 'max_features': 'log2', 'bootstrap': True, 'criterion': 'absolute_error'}. Best is trial 793 with value: 0.32179807021578266.
[I 2024-12-04 20:05:42,497] Trial 833 finished with value: 0.34167763816140795 and parameters: {'n_estimators': 492, 'max_depth': 48, 'min_samples_split': 2, 'min_samples_leaf': 1, 'max_features': 'sqrt', 'bootstrap': False, 'criterion': 'squared_error'}. Best is trial 793 with value: 0.32179807021578266.
[I 2024-12-04 20:05:42,504] Trial 835 finished with value: 0.6836490422149404 and parameters: {'n_estimators': 372, 'max_depth': 43, 'min_samples_split': 2, 'min_samples_leaf': 2, 'max_features': 'sqrt', 'bootstrap': False, 'criterion': 'squared_error'}. Best is trial 793 with value: 0.32179807021578266.
[I 2024-12-04 20:05:44,236] Trial 836 finished with value: 0.32472716326916434 and parameters: {'n_estimators': 428, 'max_depth': 50, 'min_samples_split': 2, 'min_samples_leaf': 1, 'max_features': 'sqrt', 'bootstrap': False, 'criterion': 'squared_error'}. Best is trial 793 with value: 0.32179807021578266.
[I 2024-12-04 20:05:44,458] Trial 837 finished with value: 0.3585971389700412 and parameters: {'n_estimators': 372, 'max_depth': 50, 'min_samples_split': 3, 'min_samples_leaf': 1, 'max_features': 'sqrt', 'bootstrap': False, 'criterion': 'squared_error'}. Best is trial 793 with value: 0.32179807021578266.
[I 2024-12-04 20:05:45,828] Trial 838 finished with value: 0.3272233540938837 and parameters: {'n_estimators': 546, 'max_depth': 50, 'min_samples_split': 2, 'min_samples_leaf': 1, 'max_features': 'sqrt', 'bootstrap': False, 'criterion': 'squared_error'}. Best is trial 793 with value: 0.32179807021578266.
[I 2024-12-04 20:05:46,664] Trial 839 finished with value: 0.3666565893422748 and parameters: {'n_estimators': 522, 'max_depth': 50, 'min_samples_split': 3, 'min_samples_leaf': 1, 'max_features': 'sqrt', 'bootstrap': False, 'criterion': 'squared_error'}. Best is trial 793 with value: 0.32179807021578266.
[I 2024-12-04 20:05:47,826] Trial 841 finished with value: 0.6326561811139175 and parameters: {'n_estimators': 639, 'max_depth': 26, 'min_samples_split': 5, 'min_samples_leaf': 1, 'max_features': 'sqrt', 'bootstrap': True, 'criterion': 'squared_error'}. Best is trial 793 with value: 0.32179807021578266.
[I 2024-12-04 20:05:48,387] Trial 842 finished with value: 0.323498830228993 and parameters: {'n_estimators': 248, 'max_depth': 50, 'min_samples_split': 2, 'min_samples_leaf': 1, 'max_features': 'sqrt', 'bootstrap': False, 'criterion': 'squared_error'}. Best is trial 793 with value: 0.32179807021578266.
[I 2024-12-04 20:05:50,770] Trial 840 finished with value: 0.881745066660297 and parameters: {'n_estimators': 377, 'max_depth': 42, 'min_samples_split': 2, 'min_samples_leaf': 2, 'max_features': 'sqrt', 'bootstrap': False, 'criterion': 'absolute_error'}. Best is trial 793 with value: 0.32179807021578266.
[I 2024-12-04 20:05:51,668] Trial 844 finished with value: 1.261963191034649 and parameters: {'n_estimators': 708, 'max_depth': 45, 'min_samples_split': 7, 'min_samples_leaf': 2, 'max_features': 'log2', 'bootstrap': True, 'criterion': 'absolute_error'}. Best is trial 793 with value: 0.32179807021578266.
[I 2024-12-04 20:05:53,772] Trial 845 finished with value: 0.7298460313762052 and parameters: {'n_estimators': 622, 'max_depth': 50, 'min_samples_split': 2, 'min_samples_leaf': 13, 'max_features': None, 'bootstrap': True, 'criterion': 'squared_error'}. Best is trial 793 with value: 0.32179807021578266.
[I 2024-12-04 20:05:55,216] Trial 847 finished with value: 0.4084295816163437 and parameters: {'n_estimators': 311, 'max_depth': 42, 'min_samples_split': 4, 'min_samples_leaf': 1, 'max_features': 'sqrt', 'bootstrap': False, 'criterion': 'squared_error'}. Best is trial 793 with value: 0.32179807021578266.
[I 2024-12-04 20:05:57,938] Trial 843 finished with value: 0.7283396873403061 and parameters: {'n_estimators': 673, 'max_depth': 37, 'min_samples_split': 13, 'min_samples_leaf': 1, 'max_features': 'sqrt', 'bootstrap': True, 'criterion': 'absolute_error'}. Best is trial 793 with value: 0.32179807021578266.
[I 2024-12-04 20:05:59,106] Trial 848 finished with value: 0.8030227630555656 and parameters: {'n_estimators': 426, 'max_depth': 48, 'min_samples_split': 5, 'min_samples_leaf': 15, 'max_features': None, 'bootstrap': True, 'criterion': 'absolute_error'}. Best is trial 793 with value: 0.32179807021578266.
[I 2024-12-04 20:06:00,268] Trial 849 finished with value: 1.2875901973141821 and parameters: {'n_estimators': 687, 'max_depth': 14, 'min_samples_split': 2, 'min_samples_leaf': 14, 'max_features': 'sqrt', 'bootstrap': False, 'criterion': 'absolute_error'}. Best is trial 793 with value: 0.32179807021578266.
[I 2024-12-04 20:06:01,433] Trial 850 finished with value: 0.3268241787549648 and parameters: {'n_estimators': 439, 'max_depth': 50, 'min_samples_split': 2, 'min_samples_leaf': 1, 'max_features': 'sqrt', 'bootstrap': False, 'criterion': 'squared_error'}. Best is trial 793 with value: 0.32179807021578266.
[I 2024-12-04 20:06:02,091] Trial 851 finished with value: 0.36095741078469856 and parameters: {'n_estimators': 315, 'max_depth': 40, 'min_samples_split': 2, 'min_samples_leaf': 1, 'max_features': 'sqrt', 'bootstrap': False, 'criterion': 'squared_error'}. Best is trial 793 with value: 0.32179807021578266.
[I 2024-12-04 20:06:05,848] Trial 852 finished with value: 0.5048261435031968 and parameters: {'n_estimators': 137, 'max_depth': 12, 'min_samples_split': 4, 'min_samples_leaf': 3, 'max_features': None, 'bootstrap': True, 'criterion': 'absolute_error'}. Best is trial 793 with value: 0.32179807021578266.
[I 2024-12-04 20:06:08,070] Trial 854 finished with value: 0.3277836498543059 and parameters: {'n_estimators': 453, 'max_depth': 50, 'min_samples_split': 2, 'min_samples_leaf': 1, 'max_features': 'sqrt', 'bootstrap': False, 'criterion': 'squared_error'}. Best is trial 793 with value: 0.32179807021578266.
[I 2024-12-04 20:06:11,890] Trial 853 finished with value: 0.5110550064093137 and parameters: {'n_estimators': 149, 'max_depth': 48, 'min_samples_split': 2, 'min_samples_leaf': 3, 'max_features': None, 'bootstrap': False, 'criterion': 'absolute_error'}. Best is trial 793 with value: 0.32179807021578266.
[I 2024-12-04 20:06:13,090] Trial 856 finished with value: 0.6756578897813393 and parameters: {'n_estimators': 366, 'max_depth': 44, 'min_samples_split': 3, 'min_samples_leaf': 2, 'max_features': 'sqrt', 'bootstrap': False, 'criterion': 'squared_error'}. Best is trial 793 with value: 0.32179807021578266.
[I 2024-12-04 20:06:13,578] Trial 855 finished with value: 1.1885916439444186 and parameters: {'n_estimators': 754, 'max_depth': 50, 'min_samples_split': 8, 'min_samples_leaf': 2, 'max_features': 'log2', 'bootstrap': False, 'criterion': 'absolute_error'}. Best is trial 793 with value: 0.32179807021578266.
[I 2024-12-04 20:06:14,790] Trial 858 finished with value: 0.3890371665509038 and parameters: {'n_estimators': 192, 'max_depth': 50, 'min_samples_split': 4, 'min_samples_leaf': 1, 'max_features': 'sqrt', 'bootstrap': False, 'criterion': 'squared_error'}. Best is trial 793 with value: 0.32179807021578266.
[I 2024-12-04 20:06:15,049] Trial 857 finished with value: 0.32257382998279355 and parameters: {'n_estimators': 346, 'max_depth': 50, 'min_samples_split': 2, 'min_samples_leaf': 1, 'max_features': 'sqrt', 'bootstrap': False, 'criterion': 'squared_error'}. Best is trial 793 with value: 0.32179807021578266.
[I 2024-12-04 20:06:16,228] Trial 859 finished with value: 0.6830136803398659 and parameters: {'n_estimators': 424, 'max_depth': 50, 'min_samples_split': 2, 'min_samples_leaf': 2, 'max_features': 'sqrt', 'bootstrap': False, 'criterion': 'squared_error'}. Best is trial 793 with value: 0.32179807021578266.
[I 2024-12-04 20:06:17,234] Trial 860 finished with value: 0.5607828354696711 and parameters: {'n_estimators': 320, 'max_depth': 27, 'min_samples_split': 2, 'min_samples_leaf': 9, 'max_features': None, 'bootstrap': False, 'criterion': 'squared_error'}. Best is trial 793 with value: 0.32179807021578266.
[I 2024-12-04 20:06:18,067] Trial 861 finished with value: 0.6864410549182921 and parameters: {'n_estimators': 579, 'max_depth': 38, 'min_samples_split': 4, 'min_samples_leaf': 2, 'max_features': 'sqrt', 'bootstrap': False, 'criterion': 'squared_error'}. Best is trial 793 with value: 0.32179807021578266.
[I 2024-12-04 20:06:19,190] Trial 863 finished with value: 0.6651564518236971 and parameters: {'n_estimators': 308, 'max_depth': 49, 'min_samples_split': 3, 'min_samples_leaf': 2, 'max_features': 'sqrt', 'bootstrap': False, 'criterion': 'squared_error'}. Best is trial 793 with value: 0.32179807021578266.
[I 2024-12-04 20:06:20,704] Trial 864 finished with value: 0.3561350135642988 and parameters: {'n_estimators': 307, 'max_depth': 50, 'min_samples_split': 3, 'min_samples_leaf': 1, 'max_features': 'sqrt', 'bootstrap': False, 'criterion': 'squared_error'}. Best is trial 793 with value: 0.32179807021578266.
[I 2024-12-04 20:06:21,861] Trial 865 finished with value: 0.3539549752303131 and parameters: {'n_estimators': 147, 'max_depth': 42, 'min_samples_split': 2, 'min_samples_leaf': 1, 'max_features': 'sqrt', 'bootstrap': False, 'criterion': 'squared_error'}. Best is trial 793 with value: 0.32179807021578266.
[I 2024-12-04 20:06:23,759] Trial 866 finished with value: 0.32437708925814235 and parameters: {'n_estimators': 357, 'max_depth': 50, 'min_samples_split': 2, 'min_samples_leaf': 1, 'max_features': 'sqrt', 'bootstrap': False, 'criterion': 'squared_error'}. Best is trial 793 with value: 0.32179807021578266.
[I 2024-12-04 20:06:23,813] Trial 846 finished with value: 0.43323249950817533 and parameters: {'n_estimators': 443, 'max_depth': 44, 'min_samples_split': 2, 'min_samples_leaf': 1, 'max_features': None, 'bootstrap': True, 'criterion': 'absolute_error'}. Best is trial 793 with value: 0.32179807021578266.
[I 2024-12-04 20:06:25,775] Trial 867 finished with value: 0.3244102029425288 and parameters: {'n_estimators': 309, 'max_depth': 50, 'min_samples_split': 2, 'min_samples_leaf': 1, 'max_features': 'sqrt', 'bootstrap': False, 'criterion': 'squared_error'}. Best is trial 793 with value: 0.32179807021578266.
[I 2024-12-04 20:06:26,007] Trial 868 finished with value: 0.7290171284421045 and parameters: {'n_estimators': 469, 'max_depth': 34, 'min_samples_split': 4, 'min_samples_leaf': 13, 'max_features': None, 'bootstrap': True, 'criterion': 'squared_error'}. Best is trial 793 with value: 0.32179807021578266.
[I 2024-12-04 20:06:26,979] Trial 869 finished with value: 0.6655836006331141 and parameters: {'n_estimators': 253, 'max_depth': 50, 'min_samples_split': 4, 'min_samples_leaf': 2, 'max_features': 'sqrt', 'bootstrap': False, 'criterion': 'squared_error'}. Best is trial 793 with value: 0.32179807021578266.
[I 2024-12-04 20:06:27,852] Trial 870 finished with value: 0.32328248162449913 and parameters: {'n_estimators': 261, 'max_depth': 50, 'min_samples_split': 2, 'min_samples_leaf': 1, 'max_features': 'sqrt', 'bootstrap': False, 'criterion': 'squared_error'}. Best is trial 793 with value: 0.32179807021578266.
[I 2024-12-04 20:06:28,975] Trial 871 finished with value: 0.3421441957044966 and parameters: {'n_estimators': 283, 'max_depth': 41, 'min_samples_split': 2, 'min_samples_leaf': 1, 'max_features': 'sqrt', 'bootstrap': False, 'criterion': 'squared_error'}. Best is trial 793 with value: 0.32179807021578266.
[I 2024-12-04 20:06:30,724] Trial 873 finished with value: 0.3868486016148938 and parameters: {'n_estimators': 403, 'max_depth': 50, 'min_samples_split': 4, 'min_samples_leaf': 1, 'max_features': 'sqrt', 'bootstrap': False, 'criterion': 'squared_error'}. Best is trial 793 with value: 0.32179807021578266.
[I 2024-12-04 20:06:31,300] Trial 862 finished with value: 0.5968683792033045 and parameters: {'n_estimators': 906, 'max_depth': 39, 'min_samples_split': 2, 'min_samples_leaf': 7, 'max_features': None, 'bootstrap': True, 'criterion': 'absolute_error'}. Best is trial 793 with value: 0.32179807021578266.
[I 2024-12-04 20:06:32,623] Trial 875 finished with value: 0.6830028417620772 and parameters: {'n_estimators': 366, 'max_depth': 42, 'min_samples_split': 2, 'min_samples_leaf': 2, 'max_features': 'sqrt', 'bootstrap': False, 'criterion': 'squared_error'}. Best is trial 793 with value: 0.32179807021578266.
[I 2024-12-04 20:06:32,634] Trial 872 finished with value: 1.2018257633816765 and parameters: {'n_estimators': 895, 'max_depth': 18, 'min_samples_split': 9, 'min_samples_leaf': 7, 'max_features': 'sqrt', 'bootstrap': False, 'criterion': 'absolute_error'}. Best is trial 793 with value: 0.32179807021578266.
[I 2024-12-04 20:06:33,238] Trial 874 finished with value: 0.32176430753353746 and parameters: {'n_estimators': 375, 'max_depth': 50, 'min_samples_split': 2, 'min_samples_leaf': 1, 'max_features': 'sqrt', 'bootstrap': False, 'criterion': 'squared_error'}. Best is trial 874 with value: 0.32176430753353746.
[I 2024-12-04 20:06:34,984] Trial 878 finished with value: 0.38479100921297293 and parameters: {'n_estimators': 334, 'max_depth': 50, 'min_samples_split': 4, 'min_samples_leaf': 1, 'max_features': 'sqrt', 'bootstrap': False, 'criterion': 'squared_error'}. Best is trial 874 with value: 0.32176430753353746.
[I 2024-12-04 20:06:35,505] Trial 876 finished with value: 0.3568726791902357 and parameters: {'n_estimators': 448, 'max_depth': 42, 'min_samples_split': 2, 'min_samples_leaf': 1, 'max_features': 'sqrt', 'bootstrap': False, 'criterion': 'squared_error'}. Best is trial 874 with value: 0.32176430753353746.
[I 2024-12-04 20:06:35,839] Trial 877 finished with value: 0.32814106858951464 and parameters: {'n_estimators': 502, 'max_depth': 50, 'min_samples_split': 2, 'min_samples_leaf': 1, 'max_features': 'sqrt', 'bootstrap': False, 'criterion': 'squared_error'}. Best is trial 874 with value: 0.32176430753353746.
[I 2024-12-04 20:06:36,481] Trial 879 finished with value: 0.6669531863203755 and parameters: {'n_estimators': 322, 'max_depth': 50, 'min_samples_split': 2, 'min_samples_leaf': 2, 'max_features': 'sqrt', 'bootstrap': False, 'criterion': 'squared_error'}. Best is trial 874 with value: 0.32176430753353746.
[I 2024-12-04 20:06:38,020] Trial 881 finished with value: 0.35971282810849625 and parameters: {'n_estimators': 399, 'max_depth': 50, 'min_samples_split': 3, 'min_samples_leaf': 1, 'max_features': 'sqrt', 'bootstrap': False, 'criterion': 'squared_error'}. Best is trial 874 with value: 0.32176430753353746.
[I 2024-12-04 20:06:38,024] Trial 880 finished with value: 0.32436680782391036 and parameters: {'n_estimators': 298, 'max_depth': 50, 'min_samples_split': 2, 'min_samples_leaf': 1, 'max_features': 'sqrt', 'bootstrap': False, 'criterion': 'squared_error'}. Best is trial 874 with value: 0.32176430753353746.
[I 2024-12-04 20:06:40,523] Trial 883 finished with value: 0.42949930820272963 and parameters: {'n_estimators': 216, 'max_depth': 50, 'min_samples_split': 3, 'min_samples_leaf': 1, 'max_features': None, 'bootstrap': False, 'criterion': 'squared_error'}. Best is trial 874 with value: 0.32176430753353746.
[I 2024-12-04 20:06:40,955] Trial 884 finished with value: 0.5231988306859772 and parameters: {'n_estimators': 582, 'max_depth': 23, 'min_samples_split': 20, 'min_samples_leaf': 2, 'max_features': None, 'bootstrap': True, 'criterion': 'squared_error'}. Best is trial 874 with value: 0.32176430753353746.
[I 2024-12-04 20:06:42,197] Trial 885 finished with value: 0.3445883028370882 and parameters: {'n_estimators': 275, 'max_depth': 43, 'min_samples_split': 2, 'min_samples_leaf': 1, 'max_features': 'sqrt', 'bootstrap': False, 'criterion': 'squared_error'}. Best is trial 874 with value: 0.32176430753353746.
[I 2024-12-04 20:06:42,468] Trial 886 finished with value: 0.3224299793878773 and parameters: {'n_estimators': 209, 'max_depth': 50, 'min_samples_split': 2, 'min_samples_leaf': 1, 'max_features': 'sqrt', 'bootstrap': False, 'criterion': 'squared_error'}. Best is trial 874 with value: 0.32176430753353746.
[I 2024-12-04 20:06:43,648] Trial 887 finished with value: 1.333728131954981 and parameters: {'n_estimators': 465, 'max_depth': 48, 'min_samples_split': 41, 'min_samples_leaf': 7, 'max_features': 'log2', 'bootstrap': True, 'criterion': 'absolute_error'}. Best is trial 874 with value: 0.32176430753353746.
[I 2024-12-04 20:06:44,046] Trial 888 finished with value: 0.341719473485201 and parameters: {'n_estimators': 175, 'max_depth': 47, 'min_samples_split': 2, 'min_samples_leaf': 1, 'max_features': 'sqrt', 'bootstrap': False, 'criterion': 'squared_error'}. Best is trial 874 with value: 0.32176430753353746.
[I 2024-12-04 20:06:45,401] Trial 889 finished with value: 0.3233955423288008 and parameters: {'n_estimators': 249, 'max_depth': 50, 'min_samples_split': 2, 'min_samples_leaf': 1, 'max_features': 'sqrt', 'bootstrap': False, 'criterion': 'squared_error'}. Best is trial 874 with value: 0.32176430753353746.
[I 2024-12-04 20:06:46,427] Trial 891 finished with value: 0.367347664248478 and parameters: {'n_estimators': 104, 'max_depth': 47, 'min_samples_split': 2, 'min_samples_leaf': 1, 'max_features': 'sqrt', 'bootstrap': False, 'criterion': 'squared_error'}. Best is trial 874 with value: 0.32176430753353746.
[I 2024-12-04 20:06:48,072] Trial 892 finished with value: 0.32547120703687404 and parameters: {'n_estimators': 280, 'max_depth': 50, 'min_samples_split': 2, 'min_samples_leaf': 1, 'max_features': 'sqrt', 'bootstrap': False, 'criterion': 'squared_error'}. Best is trial 874 with value: 0.32176430753353746.
[I 2024-12-04 20:06:49,033] Trial 890 finished with value: 0.43901047364021467 and parameters: {'n_estimators': 636, 'max_depth': 44, 'min_samples_split': 2, 'min_samples_leaf': 1, 'max_features': None, 'bootstrap': True, 'criterion': 'squared_error'}. Best is trial 874 with value: 0.32176430753353746.
[I 2024-12-04 20:06:49,219] Trial 893 finished with value: 0.3913653122132297 and parameters: {'n_estimators': 186, 'max_depth': 49, 'min_samples_split': 4, 'min_samples_leaf': 1, 'max_features': 'sqrt', 'bootstrap': False, 'criterion': 'squared_error'}. Best is trial 874 with value: 0.32176430753353746.
[I 2024-12-04 20:06:50,152] Trial 894 finished with value: 0.6529140274070194 and parameters: {'n_estimators': 149, 'max_depth': 44, 'min_samples_split': 2, 'min_samples_leaf': 2, 'max_features': 'sqrt', 'bootstrap': False, 'criterion': 'squared_error'}. Best is trial 874 with value: 0.32176430753353746.
[I 2024-12-04 20:06:51,211] Trial 895 finished with value: 0.3462323375285315 and parameters: {'n_estimators': 268, 'max_depth': 44, 'min_samples_split': 2, 'min_samples_leaf': 1, 'max_features': 'sqrt', 'bootstrap': False, 'criterion': 'squared_error'}. Best is trial 874 with value: 0.32176430753353746.
[I 2024-12-04 20:06:51,599] Trial 896 finished with value: 0.6669981552016148 and parameters: {'n_estimators': 321, 'max_depth': 50, 'min_samples_split': 2, 'min_samples_leaf': 2, 'max_features': 'sqrt', 'bootstrap': False, 'criterion': 'squared_error'}. Best is trial 874 with value: 0.32176430753353746.
[I 2024-12-04 20:06:53,345] Trial 897 finished with value: 0.34608472105443644 and parameters: {'n_estimators': 362, 'max_depth': 42, 'min_samples_split': 2, 'min_samples_leaf': 1, 'max_features': 'sqrt', 'bootstrap': False, 'criterion': 'squared_error'}. Best is trial 874 with value: 0.32176430753353746.
[I 2024-12-04 20:06:54,397] Trial 882 finished with value: 0.5794821520559174 and parameters: {'n_estimators': 713, 'max_depth': 34, 'min_samples_split': 15, 'min_samples_leaf': 10, 'max_features': None, 'bootstrap': False, 'criterion': 'absolute_error'}. Best is trial 874 with value: 0.32176430753353746.
[I 2024-12-04 20:06:54,903] Trial 898 finished with value: 1.2648131089002763 and parameters: {'n_estimators': 725, 'max_depth': 23, 'min_samples_split': 12, 'min_samples_leaf': 2, 'max_features': 'log2', 'bootstrap': True, 'criterion': 'absolute_error'}. Best is trial 874 with value: 0.32176430753353746.
