[I 2024-12-03 18:51:50,604] Trial 2223 finished with value: 1.0710248233120951 and parameters: {'kernel': 'poly', 'C': 0.20077000916084484, 'gamma': 0.02894042146132546, 'epsilon': 0.013094706721056504}. Best is trial 1119 with value: 0.4485361816812923.
[I 2024-12-03 18:51:51,431] Trial 2231 finished with value: 0.6335564707824862 and parameters: {'kernel': 'rbf', 'C': 98.32486873296575, 'gamma': 0.05133200309549106, 'epsilon': 0.05893503681048058}. Best is trial 1119 with value: 0.4485361816812923.
[I 2024-12-03 18:51:51,940] Trial 2229 finished with value: 0.560758160305254 and parameters: {'kernel': 'rbf', 'C': 19.780165418926618, 'gamma': 0.005905313926717448, 'epsilon': 0.04009541796266694}. Best is trial 1119 with value: 0.4485361816812923.
[I 2024-12-03 18:51:52,208] Trial 2230 finished with value: 0.6136018325040417 and parameters: {'kernel': 'rbf', 'C': 94.39321695077547, 'gamma': 0.04724583190674138, 'epsilon': 0.1163480846717627}. Best is trial 1119 with value: 0.4485361816812923.
[I 2024-12-03 18:51:52,488] Trial 2225 finished with value: 0.5846552674975554 and parameters: {'kernel': 'rbf', 'C': 27.021906976125265, 'gamma': 0.0741814185050397, 'epsilon': 0.062398280690687855}. Best is trial 1119 with value: 0.4485361816812923.
[I 2024-12-03 18:51:53,161] Trial 2237 finished with value: 0.5241711285844942 and parameters: {'kernel': 'rbf', 'C': 12.750289396535376, 'gamma': 0.016218414045564233, 'epsilon': 0.010872321183340796}. Best is trial 1119 with value: 0.4485361816812923.
[I 2024-12-03 18:51:53,167] Trial 2234 finished with value: 0.5549197532785631 and parameters: {'kernel': 'rbf', 'C': 5.8860106699213235, 'gamma': 0.01667303198128851, 'epsilon': 0.07551952137613363}. Best is trial 1119 with value: 0.4485361816812923.
[I 2024-12-03 18:51:53,169] Trial 2227 finished with value: 0.46527814702260606 and parameters: {'kernel': 'rbf', 'C': 96.46461012670822, 'gamma': 0.00974493970620454, 'epsilon': 0.05352994220814462}. Best is trial 1119 with value: 0.4485361816812923.
[I 2024-12-03 18:51:53,171] Trial 2238 finished with value: 0.45724330617048303 and parameters: {'kernel': 'rbf', 'C': 98.59136523218365, 'gamma': 0.012252469569145958, 'epsilon': 0.029882705189656522}. Best is trial 1119 with value: 0.4485361816812923.
[I 2024-12-03 18:51:54,193] Trial 2235 finished with value: 0.48025656347555257 and parameters: {'kernel': 'rbf', 'C': 86.45505535017148, 'gamma': 0.017372729170623526, 'epsilon': 0.14186368564071836}. Best is trial 1119 with value: 0.4485361816812923.
[I 2024-12-03 18:51:54,228] Trial 2226 finished with value: 1.0933682008193328 and parameters: {'kernel': 'poly', 'C': 0.046659512036666184, 'gamma': 0.04485927571573287, 'epsilon': 0.487265795353672}. Best is trial 1119 with value: 0.4485361816812923.
[I 2024-12-03 18:51:55,049] Trial 2242 finished with value: 0.4529862842366387 and parameters: {'kernel': 'rbf', 'C': 93.14557689739596, 'gamma': 0.01393251647661803, 'epsilon': 0.08824336901445516}. Best is trial 1119 with value: 0.4485361816812923.
[I 2024-12-03 18:51:55,054] Trial 2239 finished with value: 0.46046591254804226 and parameters: {'kernel': 'rbf', 'C': 96.89023124367735, 'gamma': 0.01829380123578057, 'epsilon': 0.05565750302628991}. Best is trial 1119 with value: 0.4485361816812923.
[I 2024-12-03 18:51:55,650] Trial 2245 finished with value: 0.5029369048393783 and parameters: {'kernel': 'rbf', 'C': 27.249449102399353, 'gamma': 0.046460992950871825, 'epsilon': 0.04031631446946152}. Best is trial 1119 with value: 0.4485361816812923.
[I 2024-12-03 18:51:55,797] Trial 2218 finished with value: 0.5498410805762101 and parameters: {'kernel': 'linear', 'C': 98.51629450416456, 'gamma': 0.1398268215580985, 'epsilon': 0.0019830273327766314}. Best is trial 1119 with value: 0.4485361816812923.
[I 2024-12-03 18:51:56,373] Trial 2241 finished with value: 0.5498476335412903 and parameters: {'kernel': 'rbf', 'C': 21.69896004658798, 'gamma': 0.006375463866714869, 'epsilon': 0.06068298566686789}. Best is trial 1119 with value: 0.4485361816812923.
[I 2024-12-03 18:51:56,484] Trial 2240 finished with value: 0.5564844494814923 and parameters: {'kernel': 'rbf', 'C': 92.27436542918339, 'gamma': 0.0019481505795800977, 'epsilon': 0.13239681587937954}. Best is trial 1119 with value: 0.4485361816812923.
[I 2024-12-03 18:51:56,654] Trial 2246 finished with value: 61.4268253509809 and parameters: {'kernel': 'sigmoid', 'C': 23.661858895165853, 'gamma': 0.014943880077712517, 'epsilon': 0.04661130531601541}. Best is trial 1119 with value: 0.4485361816812923.
[I 2024-12-03 18:51:56,733] Trial 2232 finished with value: 0.4657658387283427 and parameters: {'kernel': 'rbf', 'C': 98.45889388299359, 'gamma': 0.019518775376090203, 'epsilon': 0.02435171217630465}. Best is trial 1119 with value: 0.4485361816812923.
[I 2024-12-03 18:51:56,790] Trial 2233 finished with value: 0.5359755495668551 and parameters: {'kernel': 'rbf', 'C': 19.196415277265462, 'gamma': 0.010690865873802502, 'epsilon': 0.16168175917024985}. Best is trial 1119 with value: 0.4485361816812923.
[I 2024-12-03 18:51:57,016] Trial 2248 finished with value: 0.5922070082363138 and parameters: {'kernel': 'linear', 'C': 31.54823305328906, 'gamma': 0.06001299155726422, 'epsilon': 0.18240958372685157}. Best is trial 1119 with value: 0.4485361816812923.
[I 2024-12-03 18:51:57,742] Trial 2244 finished with value: 0.46173636032562976 and parameters: {'kernel': 'rbf', 'C': 99.58019330572681, 'gamma': 0.013746206265736456, 'epsilon': 0.10936076992590793}. Best is trial 1119 with value: 0.4485361816812923.
[I 2024-12-03 18:51:57,901] Trial 2236 finished with value: 0.9606046880343542 and parameters: {'kernel': 'poly', 'C': 38.921171129006474, 'gamma': 0.1386588697018819, 'epsilon': 0.030684260913040745}. Best is trial 1119 with value: 0.4485361816812923.
[I 2024-12-03 18:51:58,297] Trial 2253 finished with value: 0.5189626170460493 and parameters: {'kernel': 'rbf', 'C': 99.2629509818517, 'gamma': 0.003978211895380661, 'epsilon': 0.1091059072292484}. Best is trial 1119 with value: 0.4485361816812923.
[I 2024-12-03 18:51:58,414] Trial 2251 finished with value: 0.5836813319244806 and parameters: {'kernel': 'linear', 'C': 96.52355998210915, 'gamma': 0.013938706942667025, 'epsilon': 0.15194535350959854}. Best is trial 1119 with value: 0.4485361816812923.
[I 2024-12-03 18:51:58,883] Trial 2255 finished with value: 0.7821397937866553 and parameters: {'kernel': 'rbf', 'C': 34.232087932732846, 'gamma': 0.00014950321022244058, 'epsilon': 0.00647079077725938}. Best is trial 1119 with value: 0.4485361816812923.
[I 2024-12-03 18:51:59,063] Trial 2254 finished with value: 0.5865736384915389 and parameters: {'kernel': 'rbf', 'C': 99.9292665023969, 'gamma': 0.0012604943093331117, 'epsilon': 0.029455519662818182}. Best is trial 1119 with value: 0.4485361816812923.
[I 2024-12-03 18:51:59,307] Trial 2243 finished with value: 0.8538966476760648 and parameters: {'kernel': 'poly', 'C': 47.84802599241371, 'gamma': 0.09333280616436834, 'epsilon': 0.00164711844346235}. Best is trial 1119 with value: 0.4485361816812923.
[I 2024-12-03 18:51:59,308] Trial 2247 finished with value: 0.9306794200878417 and parameters: {'kernel': 'poly', 'C': 39.643150096338964, 'gamma': 0.010849371488555665, 'epsilon': 0.038509431747283177}. Best is trial 1119 with value: 0.4485361816812923.
[I 2024-12-03 18:52:00,165] Trial 2256 finished with value: 0.4790589108188909 and parameters: {'kernel': 'rbf', 'C': 80.66979570034715, 'gamma': 0.00926427282658642, 'epsilon': 0.005517074736697929}. Best is trial 1119 with value: 0.4485361816812923.
[I 2024-12-03 18:52:01,884] Trial 2262 finished with value: 0.5429224971203584 and parameters: {'kernel': 'rbf', 'C': 18.76822711241554, 'gamma': 0.008407784486453587, 'epsilon': 0.022987801413741057}. Best is trial 1119 with value: 0.4485361816812923.
[I 2024-12-03 18:52:02,783] Trial 2266 finished with value: 0.5200445329777373 and parameters: {'kernel': 'rbf', 'C': 25.40822955143368, 'gamma': 0.03777329433698982, 'epsilon': 0.25830004365886355}. Best is trial 1119 with value: 0.4485361816812923.
[I 2024-12-03 18:52:03,299] Trial 2250 finished with value: 0.5738979328960536 and parameters: {'kernel': 'rbf', 'C': 95.60515009983595, 'gamma': 0.0017681582044435065, 'epsilon': 0.03874545749679549}. Best is trial 1119 with value: 0.4485361816812923.
[I 2024-12-03 18:52:03,507] Trial 2257 finished with value: 0.5200084003347476 and parameters: {'kernel': 'rbf', 'C': 22.614343219516844, 'gamma': 0.01019471292261428, 'epsilon': 0.055471579584573646}. Best is trial 1119 with value: 0.4485361816812923.
[I 2024-12-03 18:52:04,057] Trial 2258 finished with value: 0.6700266745027154 and parameters: {'kernel': 'rbf', 'C': 99.69412528727104, 'gamma': 0.05702397784056583, 'epsilon': 0.039997493505899304}. Best is trial 1119 with value: 0.4485361816812923.
[I 2024-12-03 18:52:04,088] Trial 2252 finished with value: 0.47656238206506507 and parameters: {'kernel': 'rbf', 'C': 96.39136240878413, 'gamma': 0.022378564228366524, 'epsilon': 0.03725182157479052}. Best is trial 1119 with value: 0.4485361816812923.
[I 2024-12-03 18:52:04,612] Trial 2267 finished with value: 0.5258549586752557 and parameters: {'kernel': 'rbf', 'C': 19.44244736072721, 'gamma': 0.011586702271812232, 'epsilon': 0.11734888757554554}. Best is trial 1119 with value: 0.4485361816812923.
[I 2024-12-03 18:52:06,676] Trial 2263 finished with value: 0.9673070583546377 and parameters: {'kernel': 'poly', 'C': 19.81620287772878, 'gamma': 0.010852213844334085, 'epsilon': 0.08469695129228408}. Best is trial 1119 with value: 0.4485361816812923.
[I 2024-12-03 18:52:06,895] Trial 2273 finished with value: 0.48148309500609454 and parameters: {'kernel': 'rbf', 'C': 28.592207720491444, 'gamma': 0.0387051434252452, 'epsilon': 0.01852194658316063}. Best is trial 1119 with value: 0.4485361816812923.
[I 2024-12-03 18:52:06,988] Trial 2264 finished with value: 14.12405682093385 and parameters: {'kernel': 'sigmoid', 'C': 98.0783376893496, 'gamma': 0.0038257271125671823, 'epsilon': 0.04098269713480476}. Best is trial 1119 with value: 0.4485361816812923.
[I 2024-12-03 18:52:07,179] Trial 2274 finished with value: 0.5786376047429936 and parameters: {'kernel': 'rbf', 'C': 22.383060074581827, 'gamma': 0.07098696133126604, 'epsilon': 0.18260447797596469}. Best is trial 1119 with value: 0.4485361816812923.
[I 2024-12-03 18:52:09,507] Trial 2265 finished with value: 1.3726520672436688 and parameters: {'kernel': 'sigmoid', 'C': 0.0028749929902041243, 'gamma': 0.0004970057103581286, 'epsilon': 0.0012922626824136004}. Best is trial 1119 with value: 0.4485361816812923.
[I 2024-12-03 18:52:09,656] Trial 2269 finished with value: 0.5419012716456678 and parameters: {'kernel': 'rbf', 'C': 4.886177835590301, 'gamma': 0.026098172774427227, 'epsilon': 0.0645946316352712}. Best is trial 1119 with value: 0.4485361816812923.
[I 2024-12-03 18:52:09,658] Trial 2271 finished with value: 0.6472957928662177 and parameters: {'kernel': 'rbf', 'C': 91.75766715515309, 'gamma': 0.3156572299337337, 'epsilon': 0.04219426978924874}. Best is trial 1119 with value: 0.4485361816812923.
[I 2024-12-03 18:52:09,804] Trial 2261 finished with value: 0.48227663863818876 and parameters: {'kernel': 'rbf', 'C': 96.04741632942363, 'gamma': 0.0070524182883563635, 'epsilon': 0.049741565307073445}. Best is trial 1119 with value: 0.4485361816812923.
[I 2024-12-03 18:52:10,456] Trial 2280 finished with value: 0.5941905683859018 and parameters: {'kernel': 'rbf', 'C': 17.450826782218282, 'gamma': 0.003703752766728998, 'epsilon': 0.08138762696722107}. Best is trial 1119 with value: 0.4485361816812923.
[I 2024-12-03 18:52:10,580] Trial 2279 finished with value: 0.5068239165746572 and parameters: {'kernel': 'rbf', 'C': 98.63400857998919, 'gamma': 0.004320927309884549, 'epsilon': 0.07705380397797264}. Best is trial 1119 with value: 0.4485361816812923.
[I 2024-12-03 18:52:10,632] Trial 2270 finished with value: 0.4539628245520898 and parameters: {'kernel': 'rbf', 'C': 99.99336243652087, 'gamma': 0.010566747416023158, 'epsilon': 0.11020450156296902}. Best is trial 1119 with value: 0.4485361816812923.
[I 2024-12-03 18:52:11,348] Trial 2259 finished with value: 0.4560157800396183 and parameters: {'kernel': 'rbf', 'C': 97.3580547820425, 'gamma': 0.015000675209759583, 'epsilon': 0.0375531246030425}. Best is trial 1119 with value: 0.4485361816812923.
[I 2024-12-03 18:52:12,824] Trial 2281 finished with value: 0.46142813966157664 and parameters: {'kernel': 'rbf', 'C': 99.25198531584685, 'gamma': 0.01805744446823011, 'epsilon': 0.03816159748828545}. Best is trial 1119 with value: 0.4485361816812923.
[I 2024-12-03 18:52:13,376] Trial 2272 finished with value: 0.5803005390598601 and parameters: {'kernel': 'rbf', 'C': 87.36254907928908, 'gamma': 0.038151633620663095, 'epsilon': 0.19868027881082856}. Best is trial 1119 with value: 0.4485361816812923.
[I 2024-12-03 18:52:13,918] Trial 2260 finished with value: 1.241388325584465 and parameters: {'kernel': 'sigmoid', 'C': 0.024851717400413944, 'gamma': 0.14607110069217416, 'epsilon': 0.23150577921866117}. Best is trial 1119 with value: 0.4485361816812923.
[I 2024-12-03 18:52:14,497] Trial 2277 finished with value: 0.5367130502276881 and parameters: {'kernel': 'rbf', 'C': 27.832467089849434, 'gamma': 0.009645615006594296, 'epsilon': 0.31477011725720994}. Best is trial 1119 with value: 0.4485361816812923.
[I 2024-12-03 18:52:14,510] Trial 2278 finished with value: 0.48859594201819384 and parameters: {'kernel': 'rbf', 'C': 18.995389292916652, 'gamma': 0.016824845350463698, 'epsilon': 0.04835682252746103}. Best is trial 1119 with value: 0.4485361816812923.
[I 2024-12-03 18:52:15,005] Trial 2288 finished with value: 1.0022664154742975 and parameters: {'kernel': 'poly', 'C': 30.53177821771224, 'gamma': 0.007630105600909408, 'epsilon': 0.24412517027049055}. Best is trial 1119 with value: 0.4485361816812923.
[I 2024-12-03 18:52:15,146] Trial 2275 finished with value: 0.5590663617716218 and parameters: {'kernel': 'linear', 'C': 95.55773298965896, 'gamma': 0.025911444723606722, 'epsilon': 0.023576384035250232}. Best is trial 1119 with value: 0.4485361816812923.
[I 2024-12-03 18:52:15,480] Trial 2284 finished with value: 0.5325286178183208 and parameters: {'kernel': 'rbf', 'C': 21.801471415172497, 'gamma': 0.054015937628183255, 'epsilon': 0.11098219836069642}. Best is trial 1119 with value: 0.4485361816812923.
[I 2024-12-03 18:52:15,485] Trial 2287 finished with value: 0.49121794516319833 and parameters: {'kernel': 'rbf', 'C': 20.93114949309902, 'gamma': 0.045675971774040765, 'epsilon': 0.028744271779651887}. Best is trial 1119 with value: 0.4485361816812923.
[I 2024-12-03 18:52:15,491] Trial 2282 finished with value: 0.5679882832252918 and parameters: {'kernel': 'rbf', 'C': 20.14157721169543, 'gamma': 0.004754793885795219, 'epsilon': 0.050499079989614164}. Best is trial 1119 with value: 0.4485361816812923.
[I 2024-12-03 18:52:15,661] Trial 2268 finished with value: 0.5418534984216316 and parameters: {'kernel': 'rbf', 'C': 21.040381435042768, 'gamma': 0.06263211681990853, 'epsilon': 0.07162319052299064}. Best is trial 1119 with value: 0.4485361816812923.
[I 2024-12-03 18:52:15,848] Trial 2285 finished with value: 0.4664367670103049 and parameters: {'kernel': 'rbf', 'C': 25.749051067583345, 'gamma': 0.018640033832913232, 'epsilon': 0.10942206284404339}. Best is trial 1119 with value: 0.4485361816812923.
[I 2024-12-03 18:52:15,851] Trial 2276 finished with value: 0.4633023851609998 and parameters: {'kernel': 'rbf', 'C': 95.87028706720555, 'gamma': 0.019543890859496062, 'epsilon': 0.070398448170256}. Best is trial 1119 with value: 0.4485361816812923.
[I 2024-12-03 18:52:15,857] Trial 2283 finished with value: 0.5558006509547956 and parameters: {'kernel': 'rbf', 'C': 19.969737706421544, 'gamma': 0.006184044697463297, 'epsilon': 0.1438076596180252}. Best is trial 1119 with value: 0.4485361816812923.
[I 2024-12-03 18:52:16,354] Trial 2289 finished with value: 0.4697387491696702 and parameters: {'kernel': 'rbf', 'C': 93.10965864648698, 'gamma': 0.009468106575414989, 'epsilon': 0.023294414122934246}. Best is trial 1119 with value: 0.4485361816812923.
[I 2024-12-03 18:52:16,717] Trial 2292 finished with value: 0.5632837755589323 and parameters: {'kernel': 'rbf', 'C': 98.14465532660324, 'gamma': 0.004586557008178721, 'epsilon': 0.3350735214349529}. Best is trial 1119 with value: 0.4485361816812923.
[I 2024-12-03 18:52:17,554] Trial 2290 finished with value: 0.5737855782723754 and parameters: {'kernel': 'rbf', 'C': 99.30488341050709, 'gamma': 0.08031588349005662, 'epsilon': 0.27458345019173686}. Best is trial 1119 with value: 0.4485361816812923.
[I 2024-12-03 18:52:18,732] Trial 2286 finished with value: 0.4683737908689735 and parameters: {'kernel': 'rbf', 'C': 22.896093103998595, 'gamma': 0.024024534970670978, 'epsilon': 0.06542577296203536}. Best is trial 1119 with value: 0.4485361816812923.
[I 2024-12-03 18:52:19,543] Trial 2298 finished with value: 0.49001447641963325 and parameters: {'kernel': 'rbf', 'C': 92.91431225675305, 'gamma': 0.025843916944270896, 'epsilon': 0.047583736111206046}. Best is trial 1119 with value: 0.4485361816812923.
[I 2024-12-03 18:52:19,548] Trial 2293 finished with value: 0.4577629447648864 and parameters: {'kernel': 'rbf', 'C': 95.365384399568, 'gamma': 0.0099793233243494, 'epsilon': 0.11685792005485983}. Best is trial 1119 with value: 0.4485361816812923.
[I 2024-12-03 18:52:19,989] Trial 2291 finished with value: 0.9936532759793165 and parameters: {'kernel': 'poly', 'C': 0.0036841761582989126, 'gamma': 0.17043061141560792, 'epsilon': 0.6026720447352202}. Best is trial 1119 with value: 0.4485361816812923.
[I 2024-12-03 18:52:20,417] Trial 2294 finished with value: 0.46711081104647123 and parameters: {'kernel': 'rbf', 'C': 99.03760319585746, 'gamma': 0.01193446552912135, 'epsilon': 0.14847544520610198}. Best is trial 1119 with value: 0.4485361816812923.
[I 2024-12-03 18:52:20,483] Trial 2300 finished with value: 0.6556672973143925 and parameters: {'kernel': 'rbf', 'C': 96.45422221698816, 'gamma': 0.055466244528764856, 'epsilon': 0.05523416010956532}. Best is trial 1119 with value: 0.4485361816812923.
[I 2024-12-03 18:52:21,487] Trial 2305 finished with value: 0.4866850417991168 and parameters: {'kernel': 'rbf', 'C': 89.99167216473855, 'gamma': 0.006936607071356034, 'epsilon': 0.038107507684203075}. Best is trial 1119 with value: 0.4485361816812923.
[I 2024-12-03 18:52:21,810] Trial 2213 finished with value: 0.9587192539079765 and parameters: {'kernel': 'poly', 'C': 21.66819228564006, 'gamma': 0.3913096208676228, 'epsilon': 0.11648322869708433}. Best is trial 1119 with value: 0.4485361816812923.
[I 2024-12-03 18:52:22,265] Trial 2308 finished with value: 0.4579746452598655 and parameters: {'kernel': 'rbf', 'C': 93.5618952597814, 'gamma': 0.014743157504911182, 'epsilon': 0.09471696123662096}. Best is trial 1119 with value: 0.4485361816812923.
[I 2024-12-03 18:52:22,410] Trial 2299 finished with value: 0.6192161565457934 and parameters: {'kernel': 'rbf', 'C': 99.63017822835897, 'gamma': 0.04686395594979107, 'epsilon': 0.12038085349474403}. Best is trial 1119 with value: 0.4485361816812923.
[I 2024-12-03 18:52:23,036] Trial 2303 finished with value: 0.49148765327391947 and parameters: {'kernel': 'rbf', 'C': 93.56781052336738, 'gamma': 0.014898937183885656, 'epsilon': 0.21071283914455155}. Best is trial 1119 with value: 0.4485361816812923.
[I 2024-12-03 18:52:23,386] Trial 2297 finished with value: 0.5682554812909395 and parameters: {'kernel': 'rbf', 'C': 23.33819042669783, 'gamma': 0.005189445590307897, 'epsilon': 0.02538121038789918}. Best is trial 1119 with value: 0.4485361816812923.
[I 2024-12-03 18:52:24,452] Trial 2301 finished with value: 0.4892884723372592 and parameters: {'kernel': 'rbf', 'C': 23.841707522583427, 'gamma': 0.01435668476697254, 'epsilon': 0.040186872047098636}. Best is trial 1119 with value: 0.4485361816812923.
[I 2024-12-03 18:52:25,091] Trial 2295 finished with value: 0.5770091543712688 and parameters: {'kernel': 'rbf', 'C': 3.649764816351074, 'gamma': 0.01894681531206646, 'epsilon': 0.15818439162294967}. Best is trial 1119 with value: 0.4485361816812923.
[I 2024-12-03 18:52:25,363] Trial 2296 finished with value: 0.567267797009801 and parameters: {'kernel': 'rbf', 'C': 22.44536394536534, 'gamma': 0.004750674096483884, 'epsilon': 0.1593037063647733}. Best is trial 1119 with value: 0.4485361816812923.
[I 2024-12-03 18:52:25,687] Trial 2304 finished with value: 0.47315067062925453 and parameters: {'kernel': 'rbf', 'C': 19.882692522823756, 'gamma': 0.02463136398735468, 'epsilon': 0.07497656049397174}. Best is trial 1119 with value: 0.4485361816812923.
[I 2024-12-03 18:52:25,689] Trial 2314 finished with value: 0.5021680899072656 and parameters: {'kernel': 'rbf', 'C': 26.267838537830613, 'gamma': 0.011596840253098723, 'epsilon': 0.050672869454161114}. Best is trial 1119 with value: 0.4485361816812923.
[I 2024-12-03 18:52:25,694] Trial 2313 finished with value: 0.46785459885880126 and parameters: {'kernel': 'rbf', 'C': 24.11978193600804, 'gamma': 0.02223803911937632, 'epsilon': 0.15193650375308063}. Best is trial 1119 with value: 0.4485361816812923.
[I 2024-12-03 18:52:26,196] Trial 2309 finished with value: 0.6872955620570934 and parameters: {'kernel': 'rbf', 'C': 21.039198801431752, 'gamma': 0.0013663305976363404, 'epsilon': 0.02527887433377941}. Best is trial 1119 with value: 0.4485361816812923.
[I 2024-12-03 18:52:26,600] Trial 2306 finished with value: 0.5468681537498286 and parameters: {'kernel': 'rbf', 'C': 25.790212340436923, 'gamma': 0.005791046931480779, 'epsilon': 0.06854489051174287}. Best is trial 1119 with value: 0.4485361816812923.
[I 2024-12-03 18:52:27,530] Trial 2302 finished with value: 0.6766253737417017 and parameters: {'kernel': 'rbf', 'C': 6.948230677982725, 'gamma': 0.00458508863156249, 'epsilon': 0.06155665251789022}. Best is trial 1119 with value: 0.4485361816812923.
