[I 2024-12-04 12:41:19,758] Trial 801 finished with value: 0.24999108550935745 and parameters: {'n_estimators': 1221, 'learning_rate': 0.05679820235020213, 'max_depth': 7, 'min_samples_split': 6, 'min_samples_leaf': 1, 'subsample': 0.7793679578205526, 'max_features': 'sqrt'}. Best is trial 621 with value: 0.2256726988932517.
[I 2024-12-04 12:41:20,788] Trial 804 finished with value: 0.8550457132794123 and parameters: {'n_estimators': 1076, 'learning_rate': 0.013434112683285203, 'max_depth': 11, 'min_samples_split': 12, 'min_samples_leaf': 6, 'subsample': 0.7169092881537112, 'max_features': 'log2'}. Best is trial 621 with value: 0.2256726988932517.
[I 2024-12-04 12:41:22,624] Trial 829 finished with value: 0.43130962666196426 and parameters: {'n_estimators': 255, 'learning_rate': 0.02373768544004977, 'max_depth': 4, 'min_samples_split': 9, 'min_samples_leaf': 3, 'subsample': 0.6598690477592386, 'max_features': None}. Best is trial 621 with value: 0.2256726988932517.
[I 2024-12-04 12:41:30,205] Trial 807 finished with value: 0.2493399595595031 and parameters: {'n_estimators': 1129, 'learning_rate': 0.06918469119511242, 'max_depth': 7, 'min_samples_split': 2, 'min_samples_leaf': 1, 'subsample': 0.9243587887866087, 'max_features': 'sqrt'}. Best is trial 621 with value: 0.2256726988932517.
[I 2024-12-04 12:41:30,716] Trial 799 finished with value: 0.28408986439095024 and parameters: {'n_estimators': 1479, 'learning_rate': 0.09676388616599693, 'max_depth': 10, 'min_samples_split': 10, 'min_samples_leaf': 2, 'subsample': 0.8061176007337199, 'max_features': 'sqrt'}. Best is trial 621 with value: 0.2256726988932517.
[I 2024-12-04 12:41:31,441] Trial 805 finished with value: 0.33120313136371937 and parameters: {'n_estimators': 1163, 'learning_rate': 0.061289428653235466, 'max_depth': 12, 'min_samples_split': 7, 'min_samples_leaf': 1, 'subsample': 0.6441036940427807, 'max_features': None}. Best is trial 621 with value: 0.2256726988932517.
[I 2024-12-04 12:41:34,868] Trial 828 finished with value: 0.47703730768268526 and parameters: {'n_estimators': 459, 'learning_rate': 0.034023191440504995, 'max_depth': 4, 'min_samples_split': 16, 'min_samples_leaf': 5, 'subsample': 0.7274524706234675, 'max_features': 'sqrt'}. Best is trial 621 with value: 0.2256726988932517.
[I 2024-12-04 12:41:35,415] Trial 834 finished with value: 0.4635821267319672 and parameters: {'n_estimators': 249, 'learning_rate': 0.06512304360427124, 'max_depth': 7, 'min_samples_split': 13, 'min_samples_leaf': 7, 'subsample': 0.8467233083969161, 'max_features': 'sqrt'}. Best is trial 621 with value: 0.2256726988932517.
[I 2024-12-04 12:41:38,228] Trial 808 finished with value: 0.36779631280864455 and parameters: {'n_estimators': 1257, 'learning_rate': 0.05785301874494786, 'max_depth': 12, 'min_samples_split': 3, 'min_samples_leaf': 4, 'subsample': 0.7289470155179598, 'max_features': 'sqrt'}. Best is trial 621 with value: 0.2256726988932517.
[I 2024-12-04 12:41:39,039] Trial 811 finished with value: 0.32039492456615937 and parameters: {'n_estimators': 997, 'learning_rate': 0.041858029136606655, 'max_depth': 6, 'min_samples_split': 7, 'min_samples_leaf': 1, 'subsample': 0.6700568047125787, 'max_features': None}. Best is trial 621 with value: 0.2256726988932517.
[I 2024-12-04 12:41:44,203] Trial 821 finished with value: 0.3943914608206113 and parameters: {'n_estimators': 901, 'learning_rate': 0.0846400224991363, 'max_depth': 11, 'min_samples_split': 12, 'min_samples_leaf': 6, 'subsample': 0.9928691413325372, 'max_features': 'sqrt'}. Best is trial 621 with value: 0.2256726988932517.
[I 2024-12-04 12:41:44,725] Trial 809 finished with value: 0.30300564434293087 and parameters: {'n_estimators': 1260, 'learning_rate': 0.08342089300822987, 'max_depth': 9, 'min_samples_split': 6, 'min_samples_leaf': 2, 'subsample': 0.7242548563331292, 'max_features': 'sqrt'}. Best is trial 621 with value: 0.2256726988932517.
[I 2024-12-04 12:41:46,705] Trial 817 finished with value: 0.25149421784261 and parameters: {'n_estimators': 1098, 'learning_rate': 0.09933619905274825, 'max_depth': 8, 'min_samples_split': 2, 'min_samples_leaf': 1, 'subsample': 0.9542586225226635, 'max_features': 'sqrt'}. Best is trial 621 with value: 0.2256726988932517.
[I 2024-12-04 12:41:50,246] Trial 841 finished with value: 1.0956670980764462 and parameters: {'n_estimators': 166, 'learning_rate': 0.024136003558565912, 'max_depth': 4, 'min_samples_split': 6, 'min_samples_leaf': 4, 'subsample': 0.9608429900789184, 'max_features': 'log2'}. Best is trial 621 with value: 0.2256726988932517.
[I 2024-12-04 12:41:50,253] Trial 810 finished with value: 0.3558889892521284 and parameters: {'n_estimators': 1389, 'learning_rate': 0.033117925652929855, 'max_depth': 10, 'min_samples_split': 3, 'min_samples_leaf': 3, 'subsample': 0.6847745953803169, 'max_features': 'sqrt'}. Best is trial 621 with value: 0.2256726988932517.
[I 2024-12-04 12:41:51,531] Trial 813 finished with value: 0.2387744906582122 and parameters: {'n_estimators': 1262, 'learning_rate': 0.08568023740311637, 'max_depth': 6, 'min_samples_split': 4, 'min_samples_leaf': 1, 'subsample': 0.7135938062562328, 'max_features': 'sqrt'}. Best is trial 621 with value: 0.2256726988932517.
[I 2024-12-04 12:41:51,918] Trial 818 finished with value: 0.3755009228641499 and parameters: {'n_estimators': 1135, 'learning_rate': 0.09389453760156481, 'max_depth': 8, 'min_samples_split': 4, 'min_samples_leaf': 4, 'subsample': 0.7719708631341776, 'max_features': 'sqrt'}. Best is trial 621 with value: 0.2256726988932517.
[I 2024-12-04 12:41:58,146] Trial 812 finished with value: 0.2412423582452332 and parameters: {'n_estimators': 1431, 'learning_rate': 0.07492644825570564, 'max_depth': 12, 'min_samples_split': 3, 'min_samples_leaf': 1, 'subsample': 0.6375276080442757, 'max_features': 'sqrt'}. Best is trial 621 with value: 0.2256726988932517.
[I 2024-12-04 12:41:59,908] Trial 844 finished with value: 1.1865321445090187 and parameters: {'n_estimators': 244, 'learning_rate': 0.015332948098139652, 'max_depth': 11, 'min_samples_split': 19, 'min_samples_leaf': 7, 'subsample': 0.8119488481141366, 'max_features': 'log2'}. Best is trial 621 with value: 0.2256726988932517.
[I 2024-12-04 12:42:02,462] Trial 822 finished with value: 0.5947407349480422 and parameters: {'n_estimators': 1117, 'learning_rate': 0.03127968868900527, 'max_depth': 12, 'min_samples_split': 3, 'min_samples_leaf': 6, 'subsample': 0.8246391056628406, 'max_features': 'log2'}. Best is trial 621 with value: 0.2256726988932517.
[I 2024-12-04 12:42:04,082] Trial 820 finished with value: 0.29809397002063936 and parameters: {'n_estimators': 1226, 'learning_rate': 0.09535024130561394, 'max_depth': 12, 'min_samples_split': 6, 'min_samples_leaf': 2, 'subsample': 0.7367030789320468, 'max_features': 'sqrt'}. Best is trial 621 with value: 0.2256726988932517.
[I 2024-12-04 12:42:04,186] Trial 823 finished with value: 0.2582843703795365 and parameters: {'n_estimators': 1152, 'learning_rate': 0.0977096492799028, 'max_depth': 8, 'min_samples_split': 3, 'min_samples_leaf': 1, 'subsample': 0.7053173070303972, 'max_features': 'sqrt'}. Best is trial 621 with value: 0.2256726988932517.
[I 2024-12-04 12:42:09,538] Trial 819 finished with value: 0.37111890541544734 and parameters: {'n_estimators': 1334, 'learning_rate': 0.09947436421487633, 'max_depth': 10, 'min_samples_split': 8, 'min_samples_leaf': 3, 'subsample': 0.6804481979220779, 'max_features': 'sqrt'}. Best is trial 621 with value: 0.2256726988932517.
[I 2024-12-04 12:42:12,243] Trial 835 finished with value: 0.25442360752868554 and parameters: {'n_estimators': 864, 'learning_rate': 0.07059464905591897, 'max_depth': 11, 'min_samples_split': 8, 'min_samples_leaf': 1, 'subsample': 0.6582970825847457, 'max_features': 'sqrt'}. Best is trial 621 with value: 0.2256726988932517.
[I 2024-12-04 12:42:12,244] Trial 847 finished with value: 0.43152957861420244 and parameters: {'n_estimators': 303, 'learning_rate': 0.03538423683888574, 'max_depth': 10, 'min_samples_split': 15, 'min_samples_leaf': 6, 'subsample': 0.7726041460184264, 'max_features': None}. Best is trial 621 with value: 0.2256726988932517.
[I 2024-12-04 12:42:12,284] Trial 816 finished with value: 0.43360917998368276 and parameters: {'n_estimators': 1470, 'learning_rate': 0.0771854402031701, 'max_depth': 4, 'min_samples_split': 10, 'min_samples_leaf': 8, 'subsample': 0.9352804573501784, 'max_features': None}. Best is trial 621 with value: 0.2256726988932517.
[I 2024-12-04 12:42:18,185] Trial 831 finished with value: 0.3458742302024999 and parameters: {'n_estimators': 1118, 'learning_rate': 0.0586754629729374, 'max_depth': 11, 'min_samples_split': 2, 'min_samples_leaf': 3, 'subsample': 0.8801378025133794, 'max_features': 'sqrt'}. Best is trial 621 with value: 0.2256726988932517.
[I 2024-12-04 12:42:20,023] Trial 838 finished with value: 0.40981413579136006 and parameters: {'n_estimators': 910, 'learning_rate': 0.06498684152722106, 'max_depth': 4, 'min_samples_split': 16, 'min_samples_leaf': 7, 'subsample': 0.8333566724811398, 'max_features': 'sqrt'}. Best is trial 621 with value: 0.2256726988932517.
[I 2024-12-04 12:42:20,082] Trial 830 finished with value: 0.2547982750319081 and parameters: {'n_estimators': 1174, 'learning_rate': 0.08331026704163709, 'max_depth': 6, 'min_samples_split': 2, 'min_samples_leaf': 1, 'subsample': 0.6875226109938919, 'max_features': 'sqrt'}. Best is trial 621 with value: 0.2256726988932517.
[I 2024-12-04 12:42:23,479] Trial 815 finished with value: 0.31456122022459254 and parameters: {'n_estimators': 1496, 'learning_rate': 0.08301828538182375, 'max_depth': 7, 'min_samples_split': 3, 'min_samples_leaf': 1, 'subsample': 0.7747343388864848, 'max_features': None}. Best is trial 621 with value: 0.2256726988932517.
[I 2024-12-04 12:42:23,532] Trial 826 finished with value: 0.24445730353514233 and parameters: {'n_estimators': 1381, 'learning_rate': 0.06404873573120405, 'max_depth': 12, 'min_samples_split': 5, 'min_samples_leaf': 1, 'subsample': 0.616724946421473, 'max_features': 'sqrt'}. Best is trial 621 with value: 0.2256726988932517.
[I 2024-12-04 12:42:26,046] Trial 824 finished with value: 0.25319520515725175 and parameters: {'n_estimators': 1450, 'learning_rate': 0.04174487096235291, 'max_depth': 10, 'min_samples_split': 9, 'min_samples_leaf': 1, 'subsample': 0.6111154701567922, 'max_features': 'sqrt'}. Best is trial 621 with value: 0.2256726988932517.
[I 2024-12-04 12:42:26,053] Trial 825 finished with value: 0.25902694390092695 and parameters: {'n_estimators': 1391, 'learning_rate': 0.0488740838058903, 'max_depth': 10, 'min_samples_split': 6, 'min_samples_leaf': 1, 'subsample': 0.6901332433832855, 'max_features': 'sqrt'}. Best is trial 621 with value: 0.2256726988932517.
[I 2024-12-04 12:42:33,347] Trial 827 finished with value: 0.3534688689713723 and parameters: {'n_estimators': 1321, 'learning_rate': 0.061893794410272734, 'max_depth': 12, 'min_samples_split': 3, 'min_samples_leaf': 1, 'subsample': 0.742224680089631, 'max_features': None}. Best is trial 621 with value: 0.2256726988932517.
[I 2024-12-04 12:42:37,794] Trial 837 finished with value: 0.23814353371224098 and parameters: {'n_estimators': 1227, 'learning_rate': 0.07037648640142392, 'max_depth': 7, 'min_samples_split': 5, 'min_samples_leaf': 1, 'subsample': 0.8435485547060914, 'max_features': 'sqrt'}. Best is trial 621 with value: 0.2256726988932517.
[I 2024-12-04 12:42:37,814] Trial 832 finished with value: 0.2585375815567445 and parameters: {'n_estimators': 1438, 'learning_rate': 0.04745704350979681, 'max_depth': 12, 'min_samples_split': 2, 'min_samples_leaf': 1, 'subsample': 0.6062734733695146, 'max_features': 'sqrt'}. Best is trial 621 with value: 0.2256726988932517.
[I 2024-12-04 12:42:38,737] Trial 848 finished with value: 0.25837143031240706 and parameters: {'n_estimators': 741, 'learning_rate': 0.09752231264262866, 'max_depth': 7, 'min_samples_split': 3, 'min_samples_leaf': 1, 'subsample': 0.9009692333116083, 'max_features': 'sqrt'}. Best is trial 621 with value: 0.2256726988932517.
[I 2024-12-04 12:42:38,743] Trial 843 finished with value: 0.25498471952307966 and parameters: {'n_estimators': 943, 'learning_rate': 0.09456485071392605, 'max_depth': 8, 'min_samples_split': 5, 'min_samples_leaf': 1, 'subsample': 0.777259154035675, 'max_features': 'sqrt'}. Best is trial 621 with value: 0.2256726988932517.
[I 2024-12-04 12:42:45,860] Trial 833 finished with value: 0.25272783235852436 and parameters: {'n_estimators': 1396, 'learning_rate': 0.09837668918946221, 'max_depth': 8, 'min_samples_split': 8, 'min_samples_leaf': 1, 'subsample': 0.7272718173773005, 'max_features': 'sqrt'}. Best is trial 621 with value: 0.2256726988932517.
[I 2024-12-04 12:42:45,928] Trial 836 finished with value: 0.5348024824555647 and parameters: {'n_estimators': 1378, 'learning_rate': 0.08829810204690387, 'max_depth': 10, 'min_samples_split': 19, 'min_samples_leaf': 10, 'subsample': 0.84306012543449, 'max_features': 'log2'}. Best is trial 621 with value: 0.2256726988932517.
[I 2024-12-04 12:42:48,200] Trial 856 finished with value: 0.3336804310069878 and parameters: {'n_estimators': 611, 'learning_rate': 0.07618956857208233, 'max_depth': 11, 'min_samples_split': 18, 'min_samples_leaf': 2, 'subsample': 0.7098800718695311, 'max_features': 'log2'}. Best is trial 621 with value: 0.2256726988932517.
[I 2024-12-04 12:42:54,590] Trial 839 finished with value: 0.2541332172249074 and parameters: {'n_estimators': 1311, 'learning_rate': 0.093640615489019, 'max_depth': 12, 'min_samples_split': 2, 'min_samples_leaf': 1, 'subsample': 0.8784266845730441, 'max_features': 'sqrt'}. Best is trial 621 with value: 0.2256726988932517.
[I 2024-12-04 12:42:59,833] Trial 842 finished with value: 0.25469332450919674 and parameters: {'n_estimators': 1265, 'learning_rate': 0.09769754716044644, 'max_depth': 10, 'min_samples_split': 5, 'min_samples_leaf': 1, 'subsample': 0.7516206473248308, 'max_features': 'sqrt'}. Best is trial 621 with value: 0.2256726988932517.
[I 2024-12-04 12:43:01,346] Trial 849 finished with value: 0.3520503052347684 and parameters: {'n_estimators': 1044, 'learning_rate': 0.04750550097880003, 'max_depth': 7, 'min_samples_split': 5, 'min_samples_leaf': 3, 'subsample': 0.923969950729869, 'max_features': 'sqrt'}. Best is trial 621 with value: 0.2256726988932517.
[I 2024-12-04 12:43:02,165] Trial 850 finished with value: 0.25421420826922175 and parameters: {'n_estimators': 1081, 'learning_rate': 0.09996778221268332, 'max_depth': 4, 'min_samples_split': 5, 'min_samples_leaf': 1, 'subsample': 0.7373651276563103, 'max_features': 'sqrt'}. Best is trial 621 with value: 0.2256726988932517.
[I 2024-12-04 12:43:08,020] Trial 858 finished with value: 0.6964147787706859 and parameters: {'n_estimators': 896, 'learning_rate': 0.015662802104740452, 'max_depth': 3, 'min_samples_split': 10, 'min_samples_leaf': 8, 'subsample': 0.6844294504090558, 'max_features': 'sqrt'}. Best is trial 621 with value: 0.2256726988932517.
[I 2024-12-04 12:43:08,978] Trial 840 finished with value: 0.24107894739469368 and parameters: {'n_estimators': 1490, 'learning_rate': 0.048910761775764866, 'max_depth': 9, 'min_samples_split': 3, 'min_samples_leaf': 1, 'subsample': 0.6136446668984212, 'max_features': 'sqrt'}. Best is trial 621 with value: 0.2256726988932517.
[I 2024-12-04 12:43:12,198] Trial 853 finished with value: 0.2810907617536871 and parameters: {'n_estimators': 1078, 'learning_rate': 0.09843689694388782, 'max_depth': 8, 'min_samples_split': 6, 'min_samples_leaf': 2, 'subsample': 0.9149799787171455, 'max_features': 'sqrt'}. Best is trial 621 with value: 0.2256726988932517.
[I 2024-12-04 12:43:14,471] Trial 845 finished with value: 0.2999864627293749 and parameters: {'n_estimators': 1443, 'learning_rate': 0.037797806689179966, 'max_depth': 9, 'min_samples_split': 2, 'min_samples_leaf': 2, 'subsample': 0.8429070869545183, 'max_features': 'sqrt'}. Best is trial 621 with value: 0.2256726988932517.
[I 2024-12-04 12:43:15,922] Trial 851 finished with value: 0.4134746905466749 and parameters: {'n_estimators': 1257, 'learning_rate': 0.013682585461898008, 'max_depth': 10, 'min_samples_split': 10, 'min_samples_leaf': 7, 'subsample': 0.968950816850309, 'max_features': 'sqrt'}. Best is trial 621 with value: 0.2256726988932517.
[I 2024-12-04 12:43:19,217] Trial 861 finished with value: 0.4265740847839584 and parameters: {'n_estimators': 865, 'learning_rate': 0.06167691598120945, 'max_depth': 9, 'min_samples_split': 2, 'min_samples_leaf': 3, 'subsample': 0.8739097540518282, 'max_features': None}. Best is trial 621 with value: 0.2256726988932517.
[I 2024-12-04 12:43:19,227] Trial 846 finished with value: 0.36226431968691164 and parameters: {'n_estimators': 1475, 'learning_rate': 0.05309643136441076, 'max_depth': 12, 'min_samples_split': 12, 'min_samples_leaf': 3, 'subsample': 0.7056874338262652, 'max_features': 'sqrt'}. Best is trial 621 with value: 0.2256726988932517.
[I 2024-12-04 12:43:21,711] Trial 859 finished with value: 0.2788319691412766 and parameters: {'n_estimators': 1024, 'learning_rate': 0.09765744473641035, 'max_depth': 6, 'min_samples_split': 3, 'min_samples_leaf': 2, 'subsample': 0.9006701842020948, 'max_features': 'sqrt'}. Best is trial 621 with value: 0.2256726988932517.
[I 2024-12-04 12:43:21,723] Trial 852 finished with value: 0.2906418450470136 and parameters: {'n_estimators': 1264, 'learning_rate': 0.07246519979919895, 'max_depth': 12, 'min_samples_split': 4, 'min_samples_leaf': 2, 'subsample': 0.7094430938891411, 'max_features': 'sqrt'}. Best is trial 621 with value: 0.2256726988932517.
[I 2024-12-04 12:43:21,776] Trial 873 finished with value: 0.2704913209407932 and parameters: {'n_estimators': 534, 'learning_rate': 0.077317508814228, 'max_depth': 10, 'min_samples_split': 2, 'min_samples_leaf': 1, 'subsample': 0.6827182126361201, 'max_features': 'log2'}. Best is trial 621 with value: 0.2256726988932517.
[I 2024-12-04 12:43:23,882] Trial 876 finished with value: 0.919353813808423 and parameters: {'n_estimators': 468, 'learning_rate': 0.05123075181781912, 'max_depth': 3, 'min_samples_split': 9, 'min_samples_leaf': 8, 'subsample': 0.8841948280952994, 'max_features': 'log2'}. Best is trial 621 with value: 0.2256726988932517.
[I 2024-12-04 12:43:26,607] Trial 866 finished with value: 0.2917482963262464 and parameters: {'n_estimators': 880, 'learning_rate': 0.0966870478798637, 'max_depth': 9, 'min_samples_split': 4, 'min_samples_leaf': 2, 'subsample': 0.7127944804779238, 'max_features': 'sqrt'}. Best is trial 621 with value: 0.2256726988932517.
[I 2024-12-04 12:43:32,857] Trial 862 finished with value: 0.2516316460974764 and parameters: {'n_estimators': 1092, 'learning_rate': 0.09025921644913065, 'max_depth': 8, 'min_samples_split': 2, 'min_samples_leaf': 1, 'subsample': 0.7501139292367077, 'max_features': 'sqrt'}. Best is trial 621 with value: 0.2256726988932517.
[I 2024-12-04 12:43:33,877] Trial 855 finished with value: 0.2500538193298405 and parameters: {'n_estimators': 1363, 'learning_rate': 0.03992648356167652, 'max_depth': 10, 'min_samples_split': 7, 'min_samples_leaf': 1, 'subsample': 0.762648179821685, 'max_features': 'sqrt'}. Best is trial 621 with value: 0.2256726988932517.
[I 2024-12-04 12:43:37,157] Trial 854 finished with value: 0.24388936081048568 and parameters: {'n_estimators': 1463, 'learning_rate': 0.07924964832506866, 'max_depth': 12, 'min_samples_split': 5, 'min_samples_leaf': 1, 'subsample': 0.6887130815054529, 'max_features': 'sqrt'}. Best is trial 621 with value: 0.2256726988932517.
[I 2024-12-04 12:43:39,972] Trial 882 finished with value: 0.4842468494545174 and parameters: {'n_estimators': 398, 'learning_rate': 0.013612817349299927, 'max_depth': 12, 'min_samples_split': 10, 'min_samples_leaf': 3, 'subsample': 0.9903549852653428, 'max_features': 'sqrt'}. Best is trial 621 with value: 0.2256726988932517.
[I 2024-12-04 12:43:41,018] Trial 863 finished with value: 0.29116100587581206 and parameters: {'n_estimators': 1134, 'learning_rate': 0.05801448416983713, 'max_depth': 10, 'min_samples_split': 7, 'min_samples_leaf': 2, 'subsample': 0.7553262524064317, 'max_features': 'sqrt'}. Best is trial 621 with value: 0.2256726988932517.
[I 2024-12-04 12:43:41,471] Trial 857 finished with value: 0.3475903859189126 and parameters: {'n_estimators': 1438, 'learning_rate': 0.06168225119180088, 'max_depth': 11, 'min_samples_split': 5, 'min_samples_leaf': 3, 'subsample': 0.7108196645477638, 'max_features': 'sqrt'}. Best is trial 621 with value: 0.2256726988932517.
[I 2024-12-04 12:43:44,721] Trial 860 finished with value: 0.24502450069994636 and parameters: {'n_estimators': 1371, 'learning_rate': 0.04962735728575148, 'max_depth': 12, 'min_samples_split': 2, 'min_samples_leaf': 1, 'subsample': 0.7105074493993011, 'max_features': 'sqrt'}. Best is trial 621 with value: 0.2256726988932517.
[I 2024-12-04 12:43:47,711] Trial 878 finished with value: 0.2885450467011059 and parameters: {'n_estimators': 705, 'learning_rate': 0.07139306200730734, 'max_depth': 4, 'min_samples_split': 3, 'min_samples_leaf': 1, 'subsample': 0.9821550255821544, 'max_features': 'sqrt'}. Best is trial 621 with value: 0.2256726988932517.
[I 2024-12-04 12:43:48,192] Trial 875 finished with value: 0.43273027926854574 and parameters: {'n_estimators': 904, 'learning_rate': 0.024870537439824633, 'max_depth': 8, 'min_samples_split': 13, 'min_samples_leaf': 7, 'subsample': 0.7524874604780881, 'max_features': 'sqrt'}. Best is trial 621 with value: 0.2256726988932517.
[I 2024-12-04 12:43:48,746] Trial 868 finished with value: 0.24551139904298525 and parameters: {'n_estimators': 1160, 'learning_rate': 0.061999186579685346, 'max_depth': 10, 'min_samples_split': 6, 'min_samples_leaf': 1, 'subsample': 0.7107677610870976, 'max_features': 'sqrt'}. Best is trial 621 with value: 0.2256726988932517.
