[I 2024-12-04 13:00:04,722] Trial 2286 finished with value: 0.5053459598626376 and parameters: {'n_estimators': 1233, 'learning_rate': 0.0419659088263757, 'max_depth': 5, 'min_samples_split': 3, 'min_samples_leaf': 4, 'subsample': 0.878630483383643, 'max_features': 'log2'}. Best is trial 1454 with value: 0.30763307678022894.
[I 2024-12-04 13:00:04,729] Trial 2281 finished with value: 0.38578180129959583 and parameters: {'n_estimators': 1101, 'learning_rate': 0.08688940099286663, 'max_depth': 12, 'min_samples_split': 2, 'min_samples_leaf': 4, 'subsample': 0.9278228730774452, 'max_features': None}. Best is trial 1454 with value: 0.30763307678022894.
[I 2024-12-04 13:00:04,850] Trial 2273 finished with value: 0.42328624417225247 and parameters: {'n_estimators': 1430, 'learning_rate': 0.06301044104136459, 'max_depth': 5, 'min_samples_split': 3, 'min_samples_leaf': 1, 'subsample': 0.8459072918950984, 'max_features': None}. Best is trial 1454 with value: 0.30763307678022894.
[I 2024-12-04 13:00:04,853] Trial 2270 finished with value: 0.38781469388612644 and parameters: {'n_estimators': 1492, 'learning_rate': 0.0733418900779514, 'max_depth': 7, 'min_samples_split': 5, 'min_samples_leaf': 3, 'subsample': 0.7836650030930208, 'max_features': None}. Best is trial 1454 with value: 0.30763307678022894.
[I 2024-12-04 13:00:06,019] Trial 2283 finished with value: 0.42749614511924955 and parameters: {'n_estimators': 1162, 'learning_rate': 0.0964421576425024, 'max_depth': 5, 'min_samples_split': 3, 'min_samples_leaf': 1, 'subsample': 0.8977843008538696, 'max_features': None}. Best is trial 1454 with value: 0.30763307678022894.
[I 2024-12-04 13:00:08,274] Trial 2279 finished with value: 0.40971393884878654 and parameters: {'n_estimators': 1451, 'learning_rate': 0.057816057792104004, 'max_depth': 4, 'min_samples_split': 2, 'min_samples_leaf': 1, 'subsample': 0.8766079188066488, 'max_features': None}. Best is trial 1454 with value: 0.30763307678022894.
[I 2024-12-04 13:00:08,534] Trial 2278 finished with value: 0.4423889889227022 and parameters: {'n_estimators': 1415, 'learning_rate': 0.08398137640415376, 'max_depth': 5, 'min_samples_split': 4, 'min_samples_leaf': 1, 'subsample': 0.8803001946674909, 'max_features': None}. Best is trial 1454 with value: 0.30763307678022894.
[I 2024-12-04 13:00:09,376] Trial 2276 finished with value: 0.32408211606373916 and parameters: {'n_estimators': 1472, 'learning_rate': 0.0546218514329364, 'max_depth': 6, 'min_samples_split': 2, 'min_samples_leaf': 2, 'subsample': 0.6975418753179875, 'max_features': None}. Best is trial 1454 with value: 0.30763307678022894.
[I 2024-12-04 13:00:12,366] Trial 2282 finished with value: 0.37982498000194553 and parameters: {'n_estimators': 1492, 'learning_rate': 0.0986972154643685, 'max_depth': 4, 'min_samples_split': 2, 'min_samples_leaf': 1, 'subsample': 0.650585459620653, 'max_features': None}. Best is trial 1454 with value: 0.30763307678022894.
[I 2024-12-04 13:00:14,008] Trial 2292 finished with value: 0.3635952080135518 and parameters: {'n_estimators': 1013, 'learning_rate': 0.06028678992903609, 'max_depth': 10, 'min_samples_split': 10, 'min_samples_leaf': 3, 'subsample': 0.6026667045729082, 'max_features': None}. Best is trial 1454 with value: 0.30763307678022894.
[I 2024-12-04 13:00:15,177] Trial 2297 finished with value: 0.5059169933867783 and parameters: {'n_estimators': 930, 'learning_rate': 0.012903093857815186, 'max_depth': 11, 'min_samples_split': 19, 'min_samples_leaf': 6, 'subsample': 0.7616332897106758, 'max_features': 'sqrt'}. Best is trial 1454 with value: 0.30763307678022894.
[I 2024-12-04 13:00:18,240] Trial 2284 finished with value: 0.4179948892140269 and parameters: {'n_estimators': 1406, 'learning_rate': 0.06302334857899784, 'max_depth': 7, 'min_samples_split': 3, 'min_samples_leaf': 1, 'subsample': 0.9504045013195946, 'max_features': None}. Best is trial 1454 with value: 0.30763307678022894.
[I 2024-12-04 13:00:18,365] Trial 2289 finished with value: 0.37339738459626515 and parameters: {'n_estimators': 1369, 'learning_rate': 0.06287172500370551, 'max_depth': 5, 'min_samples_split': 2, 'min_samples_leaf': 4, 'subsample': 0.7534894505202119, 'max_features': None}. Best is trial 1454 with value: 0.30763307678022894.
[I 2024-12-04 13:00:19,851] Trial 2290 finished with value: 0.3933052254903286 and parameters: {'n_estimators': 1312, 'learning_rate': 0.06543639577223867, 'max_depth': 9, 'min_samples_split': 2, 'min_samples_leaf': 3, 'subsample': 0.6037677164788459, 'max_features': None}. Best is trial 1454 with value: 0.30763307678022894.
[I 2024-12-04 13:00:20,083] Trial 2287 finished with value: 0.4030143457125035 and parameters: {'n_estimators': 1473, 'learning_rate': 0.05895339930677942, 'max_depth': 4, 'min_samples_split': 3, 'min_samples_leaf': 3, 'subsample': 0.9182507853775203, 'max_features': None}. Best is trial 1454 with value: 0.30763307678022894.
[I 2024-12-04 13:00:23,157] Trial 2288 finished with value: 0.3989514624334751 and parameters: {'n_estimators': 1458, 'learning_rate': 0.04196779173329299, 'max_depth': 5, 'min_samples_split': 6, 'min_samples_leaf': 3, 'subsample': 0.9067163835171989, 'max_features': None}. Best is trial 1454 with value: 0.30763307678022894.
[I 2024-12-04 13:00:26,240] Trial 2294 finished with value: 0.42622291213449115 and parameters: {'n_estimators': 1442, 'learning_rate': 0.06261609419206163, 'max_depth': 3, 'min_samples_split': 4, 'min_samples_leaf': 3, 'subsample': 0.8498641208512715, 'max_features': None}. Best is trial 1454 with value: 0.30763307678022894.
[I 2024-12-04 13:00:26,553] Trial 2291 finished with value: 0.33536267830753236 and parameters: {'n_estimators': 1491, 'learning_rate': 0.05694554383643434, 'max_depth': 6, 'min_samples_split': 4, 'min_samples_leaf': 2, 'subsample': 0.6823255815285634, 'max_features': None}. Best is trial 1454 with value: 0.30763307678022894.
[I 2024-12-04 13:00:28,713] Trial 2325 finished with value: 1.0586814572873775 and parameters: {'n_estimators': 108, 'learning_rate': 0.010389178094169029, 'max_depth': 3, 'min_samples_split': 14, 'min_samples_leaf': 4, 'subsample': 0.8906978489574103, 'max_features': 'log2'}. Best is trial 1454 with value: 0.30763307678022894.
[I 2024-12-04 13:00:31,584] Trial 2295 finished with value: 0.3717283315387743 and parameters: {'n_estimators': 1431, 'learning_rate': 0.06068649919558614, 'max_depth': 5, 'min_samples_split': 6, 'min_samples_leaf': 4, 'subsample': 0.8666998832550549, 'max_features': None}. Best is trial 1454 with value: 0.30763307678022894.
[I 2024-12-04 13:00:33,935] Trial 2306 finished with value: 0.5428099334616916 and parameters: {'n_estimators': 1037, 'learning_rate': 0.022817776763338807, 'max_depth': 4, 'min_samples_split': 20, 'min_samples_leaf': 1, 'subsample': 0.637966280969687, 'max_features': 'log2'}. Best is trial 1454 with value: 0.30763307678022894.
[I 2024-12-04 13:00:37,096] Trial 2296 finished with value: 0.39149629350098136 and parameters: {'n_estimators': 1455, 'learning_rate': 0.04574150042852739, 'max_depth': 6, 'min_samples_split': 3, 'min_samples_leaf': 3, 'subsample': 0.8511982902476453, 'max_features': None}. Best is trial 1454 with value: 0.30763307678022894.
[I 2024-12-04 13:00:37,619] Trial 2324 finished with value: 0.45436634445449003 and parameters: {'n_estimators': 481, 'learning_rate': 0.08536863813331566, 'max_depth': 12, 'min_samples_split': 3, 'min_samples_leaf': 3, 'subsample': 0.9220299027054708, 'max_features': 'log2'}. Best is trial 1454 with value: 0.30763307678022894.
[I 2024-12-04 13:00:39,471] Trial 2314 finished with value: 0.4418511493308298 and parameters: {'n_estimators': 822, 'learning_rate': 0.02440094267989256, 'max_depth': 10, 'min_samples_split': 2, 'min_samples_leaf': 3, 'subsample': 0.9518185263281835, 'max_features': 'sqrt'}. Best is trial 1454 with value: 0.30763307678022894.
[I 2024-12-04 13:00:40,784] Trial 2298 finished with value: 0.3298009406153272 and parameters: {'n_estimators': 1491, 'learning_rate': 0.09367837483501475, 'max_depth': 6, 'min_samples_split': 2, 'min_samples_leaf': 2, 'subsample': 0.8279249145241911, 'max_features': None}. Best is trial 1454 with value: 0.30763307678022894.
[I 2024-12-04 13:00:41,765] Trial 2299 finished with value: 0.3867884661095213 and parameters: {'n_estimators': 1459, 'learning_rate': 0.05706297411945942, 'max_depth': 8, 'min_samples_split': 4, 'min_samples_leaf': 3, 'subsample': 0.7208192000438571, 'max_features': None}. Best is trial 1454 with value: 0.30763307678022894.
[I 2024-12-04 13:00:42,888] Trial 2308 finished with value: 0.6029584438393302 and parameters: {'n_estimators': 1254, 'learning_rate': 0.030913333480763694, 'max_depth': 11, 'min_samples_split': 13, 'min_samples_leaf': 7, 'subsample': 0.9777519342600578, 'max_features': 'log2'}. Best is trial 1454 with value: 0.30763307678022894.
[I 2024-12-04 13:00:44,131] Trial 2300 finished with value: 0.32903888314008123 and parameters: {'n_estimators': 1489, 'learning_rate': 0.06811412486364339, 'max_depth': 5, 'min_samples_split': 7, 'min_samples_leaf': 2, 'subsample': 0.7819642586434365, 'max_features': None}. Best is trial 1454 with value: 0.30763307678022894.
[I 2024-12-04 13:00:44,132] Trial 2302 finished with value: 0.39128614108146537 and parameters: {'n_estimators': 1379, 'learning_rate': 0.06973975479133136, 'max_depth': 7, 'min_samples_split': 3, 'min_samples_leaf': 3, 'subsample': 0.8170393379445929, 'max_features': None}. Best is trial 1454 with value: 0.30763307678022894.
[I 2024-12-04 13:00:45,005] Trial 2301 finished with value: 0.3298827730419556 and parameters: {'n_estimators': 1473, 'learning_rate': 0.07180828478352068, 'max_depth': 5, 'min_samples_split': 6, 'min_samples_leaf': 2, 'subsample': 0.8968366719272853, 'max_features': None}. Best is trial 1454 with value: 0.30763307678022894.
[I 2024-12-04 13:00:47,364] Trial 2304 finished with value: 0.3725323816569988 and parameters: {'n_estimators': 1395, 'learning_rate': 0.05281361785732044, 'max_depth': 7, 'min_samples_split': 6, 'min_samples_leaf': 4, 'subsample': 0.8017812905771119, 'max_features': None}. Best is trial 1454 with value: 0.30763307678022894.
[I 2024-12-04 13:00:49,026] Trial 2303 finished with value: 0.3955771745045162 and parameters: {'n_estimators': 1499, 'learning_rate': 0.0579350446172968, 'max_depth': 5, 'min_samples_split': 4, 'min_samples_leaf': 1, 'subsample': 0.8313091120789252, 'max_features': None}. Best is trial 1454 with value: 0.30763307678022894.
[I 2024-12-04 13:00:50,465] Trial 2313 finished with value: 0.41799896821906507 and parameters: {'n_estimators': 1218, 'learning_rate': 0.07904987231808144, 'max_depth': 7, 'min_samples_split': 16, 'min_samples_leaf': 5, 'subsample': 0.9010259704016941, 'max_features': 'sqrt'}. Best is trial 1454 with value: 0.30763307678022894.
[I 2024-12-04 13:00:54,714] Trial 2320 finished with value: 0.3806856721703051 and parameters: {'n_estimators': 1151, 'learning_rate': 0.09477212268610445, 'max_depth': 6, 'min_samples_split': 2, 'min_samples_leaf': 2, 'subsample': 0.6571666232487402, 'max_features': 'sqrt'}. Best is trial 1454 with value: 0.30763307678022894.
[I 2024-12-04 13:00:55,282] Trial 2305 finished with value: 0.40009837088548944 and parameters: {'n_estimators': 1436, 'learning_rate': 0.07600038191637863, 'max_depth': 7, 'min_samples_split': 2, 'min_samples_leaf': 1, 'subsample': 0.8704442778061784, 'max_features': None}. Best is trial 1454 with value: 0.30763307678022894.
[I 2024-12-04 13:00:55,900] Trial 2307 finished with value: 0.4000616745118899 and parameters: {'n_estimators': 1462, 'learning_rate': 0.03668678112884585, 'max_depth': 5, 'min_samples_split': 2, 'min_samples_leaf': 3, 'subsample': 0.9415758915459429, 'max_features': None}. Best is trial 1454 with value: 0.30763307678022894.
[I 2024-12-04 13:00:57,048] Trial 2327 finished with value: 0.39989880368767344 and parameters: {'n_estimators': 782, 'learning_rate': 0.047828306455522426, 'max_depth': 6, 'min_samples_split': 15, 'min_samples_leaf': 6, 'subsample': 0.8188550981642351, 'max_features': None}. Best is trial 1454 with value: 0.30763307678022894.
[I 2024-12-04 13:00:57,752] Trial 2316 finished with value: 0.4243738978282163 and parameters: {'n_estimators': 1336, 'learning_rate': 0.05529227001153941, 'max_depth': 6, 'min_samples_split': 2, 'min_samples_leaf': 3, 'subsample': 0.9538561762281479, 'max_features': 'sqrt'}. Best is trial 1454 with value: 0.30763307678022894.
[I 2024-12-04 13:00:59,271] Trial 2311 finished with value: 0.3468226530545245 and parameters: {'n_estimators': 1291, 'learning_rate': 0.05682843778327684, 'max_depth': 4, 'min_samples_split': 2, 'min_samples_leaf': 2, 'subsample': 0.8130307144397785, 'max_features': None}. Best is trial 1454 with value: 0.30763307678022894.
[I 2024-12-04 13:01:00,741] Trial 2309 finished with value: 0.32229786817374306 and parameters: {'n_estimators': 1478, 'learning_rate': 0.07878380291551329, 'max_depth': 5, 'min_samples_split': 2, 'min_samples_leaf': 2, 'subsample': 0.7910951132114887, 'max_features': None}. Best is trial 1454 with value: 0.30763307678022894.
[I 2024-12-04 13:01:02,807] Trial 2310 finished with value: 0.32988630733627317 and parameters: {'n_estimators': 1419, 'learning_rate': 0.05989233689698234, 'max_depth': 6, 'min_samples_split': 3, 'min_samples_leaf': 2, 'subsample': 0.8733417504952483, 'max_features': None}. Best is trial 1454 with value: 0.30763307678022894.
[I 2024-12-04 13:01:04,317] Trial 2317 finished with value: 0.41700116176525026 and parameters: {'n_estimators': 1336, 'learning_rate': 0.03594399349108792, 'max_depth': 5, 'min_samples_split': 2, 'min_samples_leaf': 7, 'subsample': 0.9898998371080167, 'max_features': None}. Best is trial 1454 with value: 0.30763307678022894.
[I 2024-12-04 13:01:04,394] Trial 2312 finished with value: 0.3918949382782823 and parameters: {'n_estimators': 1480, 'learning_rate': 0.0965403021395184, 'max_depth': 6, 'min_samples_split': 2, 'min_samples_leaf': 3, 'subsample': 0.827163279680601, 'max_features': None}. Best is trial 1454 with value: 0.30763307678022894.
[I 2024-12-04 13:01:05,536] Trial 2334 finished with value: 0.7235281460961885 and parameters: {'n_estimators': 691, 'learning_rate': 0.010883045337612257, 'max_depth': 5, 'min_samples_split': 9, 'min_samples_leaf': 10, 'subsample': 0.9884804734831468, 'max_features': 'sqrt'}. Best is trial 1454 with value: 0.30763307678022894.
[I 2024-12-04 13:01:07,454] Trial 2322 finished with value: 0.43345343375386375 and parameters: {'n_estimators': 1313, 'learning_rate': 0.05172228898189642, 'max_depth': 4, 'min_samples_split': 2, 'min_samples_leaf': 1, 'subsample': 0.9701947258310394, 'max_features': None}. Best is trial 1454 with value: 0.30763307678022894.
[I 2024-12-04 13:01:08,171] Trial 2326 finished with value: 0.4044850272180718 and parameters: {'n_estimators': 1125, 'learning_rate': 0.06814930618677201, 'max_depth': 4, 'min_samples_split': 3, 'min_samples_leaf': 1, 'subsample': 0.8729766881282258, 'max_features': None}. Best is trial 1454 with value: 0.30763307678022894.
[I 2024-12-04 13:01:08,835] Trial 2321 finished with value: 0.3882817647005812 and parameters: {'n_estimators': 1363, 'learning_rate': 0.06973035637085921, 'max_depth': 4, 'min_samples_split': 6, 'min_samples_leaf': 4, 'subsample': 0.7642065592429633, 'max_features': None}. Best is trial 1454 with value: 0.30763307678022894.
[I 2024-12-04 13:01:11,568] Trial 2323 finished with value: 0.3271678871659183 and parameters: {'n_estimators': 1325, 'learning_rate': 0.05521128133357626, 'max_depth': 5, 'min_samples_split': 3, 'min_samples_leaf': 2, 'subsample': 0.9133223387845741, 'max_features': None}. Best is trial 1454 with value: 0.30763307678022894.
[I 2024-12-04 13:01:11,571] Trial 2315 finished with value: 0.37273812797818884 and parameters: {'n_estimators': 1495, 'learning_rate': 0.0487611789953079, 'max_depth': 6, 'min_samples_split': 4, 'min_samples_leaf': 4, 'subsample': 0.7780956525930202, 'max_features': None}. Best is trial 1454 with value: 0.30763307678022894.
[I 2024-12-04 13:01:13,320] Trial 2318 finished with value: 0.38568700366458536 and parameters: {'n_estimators': 1467, 'learning_rate': 0.06930195245658242, 'max_depth': 6, 'min_samples_split': 2, 'min_samples_leaf': 1, 'subsample': 0.897246595795408, 'max_features': None}. Best is trial 1454 with value: 0.30763307678022894.
[I 2024-12-04 13:01:14,010] Trial 2319 finished with value: 0.3122037043616397 and parameters: {'n_estimators': 1500, 'learning_rate': 0.08202799707952256, 'max_depth': 5, 'min_samples_split': 2, 'min_samples_leaf': 2, 'subsample': 0.8767621598303132, 'max_features': None}. Best is trial 1454 with value: 0.30763307678022894.
[I 2024-12-04 13:01:18,621] Trial 2336 finished with value: 0.4488964922425094 and parameters: {'n_estimators': 1035, 'learning_rate': 0.027073646831488885, 'max_depth': 6, 'min_samples_split': 2, 'min_samples_leaf': 3, 'subsample': 0.7103880025082066, 'max_features': 'sqrt'}. Best is trial 1454 with value: 0.30763307678022894.
[I 2024-12-04 13:01:20,148] Trial 2329 finished with value: 0.40125477318488556 and parameters: {'n_estimators': 1334, 'learning_rate': 0.055206543411994845, 'max_depth': 5, 'min_samples_split': 2, 'min_samples_leaf': 3, 'subsample': 0.8361630312992895, 'max_features': None}. Best is trial 1454 with value: 0.30763307678022894.
[I 2024-12-04 13:01:21,728] Trial 2328 finished with value: 0.39576505090491554 and parameters: {'n_estimators': 1469, 'learning_rate': 0.042959913710602586, 'max_depth': 5, 'min_samples_split': 3, 'min_samples_leaf': 3, 'subsample': 0.8081376972420274, 'max_features': None}. Best is trial 1454 with value: 0.30763307678022894.
[I 2024-12-04 13:01:25,368] Trial 2333 finished with value: 0.4170910127794026 and parameters: {'n_estimators': 1404, 'learning_rate': 0.025968037877082198, 'max_depth': 10, 'min_samples_split': 20, 'min_samples_leaf': 4, 'subsample': 0.6550463439697899, 'max_features': 'sqrt'}. Best is trial 1454 with value: 0.30763307678022894.
[I 2024-12-04 13:01:25,943] Trial 2360 finished with value: 0.5178900385339721 and parameters: {'n_estimators': 236, 'learning_rate': 0.012725383765404516, 'max_depth': 6, 'min_samples_split': 5, 'min_samples_leaf': 2, 'subsample': 0.6915524952141977, 'max_features': None}. Best is trial 1454 with value: 0.30763307678022894.
[I 2024-12-04 13:01:26,385] Trial 2330 finished with value: 0.4182185565493815 and parameters: {'n_estimators': 1454, 'learning_rate': 0.057406984337129575, 'max_depth': 4, 'min_samples_split': 8, 'min_samples_leaf': 1, 'subsample': 0.9061742250972404, 'max_features': None}. Best is trial 1454 with value: 0.30763307678022894.
[I 2024-12-04 13:01:28,802] Trial 2331 finished with value: 0.4046219827791792 and parameters: {'n_estimators': 1434, 'learning_rate': 0.03715965071888436, 'max_depth': 4, 'min_samples_split': 3, 'min_samples_leaf': 1, 'subsample': 0.7593770905838179, 'max_features': None}. Best is trial 1454 with value: 0.30763307678022894.
[I 2024-12-04 13:01:31,026] Trial 2344 finished with value: 0.5306143919307816 and parameters: {'n_estimators': 971, 'learning_rate': 0.010609521569885705, 'max_depth': 3, 'min_samples_split': 7, 'min_samples_leaf': 8, 'subsample': 0.7108141443271744, 'max_features': None}. Best is trial 1454 with value: 0.30763307678022894.
[I 2024-12-04 13:01:33,648] Trial 2335 finished with value: 0.39979850959376073 and parameters: {'n_estimators': 1408, 'learning_rate': 0.06020173827176181, 'max_depth': 5, 'min_samples_split': 6, 'min_samples_leaf': 3, 'subsample': 0.7677945390964728, 'max_features': None}. Best is trial 1454 with value: 0.30763307678022894.
[I 2024-12-04 13:01:34,025] Trial 2332 finished with value: 0.32839762834116926 and parameters: {'n_estimators': 1497, 'learning_rate': 0.06963253927047304, 'max_depth': 6, 'min_samples_split': 2, 'min_samples_leaf': 2, 'subsample': 0.8003614415818178, 'max_features': None}. Best is trial 1454 with value: 0.30763307678022894.
[I 2024-12-04 13:01:35,307] Trial 2341 finished with value: 0.4498079917037175 and parameters: {'n_estimators': 1460, 'learning_rate': 0.08199646024955547, 'max_depth': 4, 'min_samples_split': 2, 'min_samples_leaf': 3, 'subsample': 0.8304623138160203, 'max_features': 'log2'}. Best is trial 1454 with value: 0.30763307678022894.
[I 2024-12-04 13:01:36,046] Trial 2337 finished with value: 0.34196776802652384 and parameters: {'n_estimators': 1370, 'learning_rate': 0.07089534079885942, 'max_depth': 4, 'min_samples_split': 2, 'min_samples_leaf': 2, 'subsample': 0.8117309063242457, 'max_features': None}. Best is trial 1454 with value: 0.30763307678022894.
[I 2024-12-04 13:01:36,986] Trial 2338 finished with value: 0.41111692151475715 and parameters: {'n_estimators': 1332, 'learning_rate': 0.08724208128685056, 'max_depth': 7, 'min_samples_split': 2, 'min_samples_leaf': 1, 'subsample': 0.7646322443722707, 'max_features': None}. Best is trial 1454 with value: 0.30763307678022894.
[I 2024-12-04 13:01:39,953] Trial 2342 finished with value: 0.423022581058386 and parameters: {'n_estimators': 1497, 'learning_rate': 0.027779043489728577, 'max_depth': 11, 'min_samples_split': 16, 'min_samples_leaf': 5, 'subsample': 0.7756140477715633, 'max_features': 'sqrt'}. Best is trial 1454 with value: 0.30763307678022894.
[I 2024-12-04 13:01:42,631] Trial 2340 finished with value: 0.3762342532173289 and parameters: {'n_estimators': 1470, 'learning_rate': 0.06179554940308577, 'max_depth': 5, 'min_samples_split': 2, 'min_samples_leaf': 1, 'subsample': 0.8361568937046814, 'max_features': None}. Best is trial 1454 with value: 0.30763307678022894.
[I 2024-12-04 13:01:43,016] Trial 2339 finished with value: 0.3898207804582681 and parameters: {'n_estimators': 1463, 'learning_rate': 0.06771462536584055, 'max_depth': 8, 'min_samples_split': 3, 'min_samples_leaf': 3, 'subsample': 0.9686438922252016, 'max_features': None}. Best is trial 1454 with value: 0.30763307678022894.
