[I 2024-12-04 12:25:55,149] Trial 332 finished with value: 0.2241291884813879 and parameters: {'n_estimators': 1203, 'learning_rate': 0.09250769889179361, 'max_depth': 12, 'min_samples_split': 13, 'min_samples_leaf': 1, 'subsample': 0.706096430182275, 'max_features': 'sqrt'}. Best is trial 259 with value: 0.21062976081411197.
[I 2024-12-04 12:26:02,345] Trial 330 finished with value: 0.22412943151242984 and parameters: {'n_estimators': 1412, 'learning_rate': 0.06534733659412933, 'max_depth': 12, 'min_samples_split': 12, 'min_samples_leaf': 1, 'subsample': 0.875109863089241, 'max_features': 'sqrt'}. Best is trial 259 with value: 0.21062976081411197.
[I 2024-12-04 12:26:03,522] Trial 331 finished with value: 0.3931846933832953 and parameters: {'n_estimators': 1299, 'learning_rate': 0.013270115348497263, 'max_depth': 7, 'min_samples_split': 20, 'min_samples_leaf': 9, 'subsample': 0.6227761567621588, 'max_features': None}. Best is trial 259 with value: 0.21062976081411197.
[I 2024-12-04 12:26:08,210] Trial 337 finished with value: 0.36635332491855543 and parameters: {'n_estimators': 1190, 'learning_rate': 0.07637989970965277, 'max_depth': 5, 'min_samples_split': 18, 'min_samples_leaf': 8, 'subsample': 0.8568122089628112, 'max_features': None}. Best is trial 259 with value: 0.21062976081411197.
[I 2024-12-04 12:26:08,314] Trial 359 finished with value: 0.3261574638795602 and parameters: {'n_estimators': 358, 'learning_rate': 0.027751871781718843, 'max_depth': 6, 'min_samples_split': 17, 'min_samples_leaf': 2, 'subsample': 0.9035431172136785, 'max_features': None}. Best is trial 259 with value: 0.21062976081411197.
[I 2024-12-04 12:26:13,664] Trial 334 finished with value: 0.23631841959350192 and parameters: {'n_estimators': 1466, 'learning_rate': 0.08044338788927623, 'max_depth': 9, 'min_samples_split': 17, 'min_samples_leaf': 1, 'subsample': 0.6625531178685317, 'max_features': 'log2'}. Best is trial 259 with value: 0.21062976081411197.
[I 2024-12-04 12:26:15,386] Trial 335 finished with value: 0.2176969169531081 and parameters: {'n_estimators': 1459, 'learning_rate': 0.08340741503971374, 'max_depth': 9, 'min_samples_split': 10, 'min_samples_leaf': 1, 'subsample': 0.7618377443541061, 'max_features': 'sqrt'}. Best is trial 259 with value: 0.21062976081411197.
[I 2024-12-04 12:26:17,350] Trial 340 finished with value: 0.24715643324240227 and parameters: {'n_estimators': 1257, 'learning_rate': 0.06263548922183025, 'max_depth': 8, 'min_samples_split': 11, 'min_samples_leaf': 1, 'subsample': 0.8453091540558049, 'max_features': 'sqrt'}. Best is trial 259 with value: 0.21062976081411197.
[I 2024-12-04 12:26:17,709] Trial 336 finished with value: 0.36670731045227517 and parameters: {'n_estimators': 1252, 'learning_rate': 0.022989844686744254, 'max_depth': 12, 'min_samples_split': 11, 'min_samples_leaf': 10, 'subsample': 0.9621234003770677, 'max_features': None}. Best is trial 259 with value: 0.21062976081411197.
[I 2024-12-04 12:26:18,506] Trial 362 finished with value: 0.7145233762858221 and parameters: {'n_estimators': 404, 'learning_rate': 0.03950693813034359, 'max_depth': 3, 'min_samples_split': 13, 'min_samples_leaf': 10, 'subsample': 0.6254811586162881, 'max_features': 'log2'}. Best is trial 259 with value: 0.21062976081411197.
[I 2024-12-04 12:26:19,608] Trial 364 finished with value: 0.5452291598453102 and parameters: {'n_estimators': 390, 'learning_rate': 0.016479567872146727, 'max_depth': 9, 'min_samples_split': 3, 'min_samples_leaf': 8, 'subsample': 0.6281806063918001, 'max_features': 'sqrt'}. Best is trial 259 with value: 0.21062976081411197.
[I 2024-12-04 12:26:22,724] Trial 353 finished with value: 0.36433097185766294 and parameters: {'n_estimators': 773, 'learning_rate': 0.01616909212898181, 'max_depth': 12, 'min_samples_split': 14, 'min_samples_leaf': 6, 'subsample': 0.7943339689915431, 'max_features': 'sqrt'}. Best is trial 259 with value: 0.21062976081411197.
[I 2024-12-04 12:26:24,374] Trial 365 finished with value: 0.5471751187806826 and parameters: {'n_estimators': 433, 'learning_rate': 0.011045063876730894, 'max_depth': 11, 'min_samples_split': 20, 'min_samples_leaf': 2, 'subsample': 0.7088483946368397, 'max_features': 'log2'}. Best is trial 259 with value: 0.21062976081411197.
[I 2024-12-04 12:26:28,179] Trial 339 finished with value: 0.23063334010281217 and parameters: {'n_estimators': 1426, 'learning_rate': 0.0757217269904521, 'max_depth': 10, 'min_samples_split': 9, 'min_samples_leaf': 1, 'subsample': 0.8089082117198808, 'max_features': 'sqrt'}. Best is trial 259 with value: 0.21062976081411197.
[I 2024-12-04 12:26:29,873] Trial 343 finished with value: 0.23425410874456493 and parameters: {'n_estimators': 1231, 'learning_rate': 0.05846408231291804, 'max_depth': 9, 'min_samples_split': 13, 'min_samples_leaf': 1, 'subsample': 0.8718506142400302, 'max_features': 'sqrt'}. Best is trial 259 with value: 0.21062976081411197.
[I 2024-12-04 12:26:33,361] Trial 341 finished with value: 0.21944929436293215 and parameters: {'n_estimators': 1432, 'learning_rate': 0.09886230459938172, 'max_depth': 11, 'min_samples_split': 19, 'min_samples_leaf': 1, 'subsample': 0.6504949162585882, 'max_features': 'sqrt'}. Best is trial 259 with value: 0.21062976081411197.
[I 2024-12-04 12:26:33,366] Trial 347 finished with value: 0.23660540030997287 and parameters: {'n_estimators': 1234, 'learning_rate': 0.06134833334201899, 'max_depth': 10, 'min_samples_split': 11, 'min_samples_leaf': 1, 'subsample': 0.8639610391178602, 'max_features': 'sqrt'}. Best is trial 259 with value: 0.21062976081411197.
[I 2024-12-04 12:26:37,193] Trial 355 finished with value: 0.22065318958021526 and parameters: {'n_estimators': 926, 'learning_rate': 0.09424601468132134, 'max_depth': 12, 'min_samples_split': 20, 'min_samples_leaf': 1, 'subsample': 0.8718764438954668, 'max_features': 'sqrt'}. Best is trial 259 with value: 0.21062976081411197.
[I 2024-12-04 12:26:39,370] Trial 356 finished with value: 0.24516115578700357 and parameters: {'n_estimators': 951, 'learning_rate': 0.0775268199879874, 'max_depth': 12, 'min_samples_split': 20, 'min_samples_leaf': 2, 'subsample': 0.9963588883364698, 'max_features': 'sqrt'}. Best is trial 259 with value: 0.21062976081411197.
[I 2024-12-04 12:26:39,537] Trial 363 finished with value: 0.2674792828117091 and parameters: {'n_estimators': 745, 'learning_rate': 0.08981751804334966, 'max_depth': 7, 'min_samples_split': 11, 'min_samples_leaf': 2, 'subsample': 0.9912972836814884, 'max_features': 'sqrt'}. Best is trial 259 with value: 0.21062976081411197.
[I 2024-12-04 12:26:45,108] Trial 342 finished with value: 0.22190721596855761 and parameters: {'n_estimators': 1488, 'learning_rate': 0.08428893355963381, 'max_depth': 9, 'min_samples_split': 15, 'min_samples_leaf': 1, 'subsample': 0.81925600651549, 'max_features': 'sqrt'}. Best is trial 259 with value: 0.21062976081411197.
[I 2024-12-04 12:26:45,633] Trial 357 finished with value: 0.24535245715667958 and parameters: {'n_estimators': 1041, 'learning_rate': 0.07799158545976553, 'max_depth': 12, 'min_samples_split': 6, 'min_samples_leaf': 3, 'subsample': 0.8172991124723542, 'max_features': 'sqrt'}. Best is trial 259 with value: 0.21062976081411197.
[I 2024-12-04 12:26:46,283] Trial 350 finished with value: 0.3375956487837728 and parameters: {'n_estimators': 1366, 'learning_rate': 0.013599125985510616, 'max_depth': 5, 'min_samples_split': 5, 'min_samples_leaf': 1, 'subsample': 0.9523896702322279, 'max_features': 'sqrt'}. Best is trial 259 with value: 0.21062976081411197.
[I 2024-12-04 12:26:46,303] Trial 348 finished with value: 0.28249145183045304 and parameters: {'n_estimators': 1394, 'learning_rate': 0.07159770532735434, 'max_depth': 5, 'min_samples_split': 7, 'min_samples_leaf': 2, 'subsample': 0.9221033749353311, 'max_features': 'log2'}. Best is trial 259 with value: 0.21062976081411197.
[I 2024-12-04 12:26:47,758] Trial 345 finished with value: 0.2366968463337656 and parameters: {'n_estimators': 1425, 'learning_rate': 0.060139984327214145, 'max_depth': 9, 'min_samples_split': 17, 'min_samples_leaf': 1, 'subsample': 0.6716073284746655, 'max_features': 'sqrt'}. Best is trial 259 with value: 0.21062976081411197.
[I 2024-12-04 12:26:52,764] Trial 351 finished with value: 0.2600368884845711 and parameters: {'n_estimators': 1274, 'learning_rate': 0.04038780000442298, 'max_depth': 9, 'min_samples_split': 16, 'min_samples_leaf': 2, 'subsample': 0.6276351135685408, 'max_features': 'sqrt'}. Best is trial 259 with value: 0.21062976081411197.
[I 2024-12-04 12:26:57,334] Trial 349 finished with value: 0.21689593081219663 and parameters: {'n_estimators': 1457, 'learning_rate': 0.080189272476921, 'max_depth': 11, 'min_samples_split': 12, 'min_samples_leaf': 1, 'subsample': 0.7546962022032246, 'max_features': 'sqrt'}. Best is trial 259 with value: 0.21062976081411197.
[I 2024-12-04 12:26:59,082] Trial 352 finished with value: 0.5128163485846745 and parameters: {'n_estimators': 1406, 'learning_rate': 0.016279242376816546, 'max_depth': 5, 'min_samples_split': 17, 'min_samples_leaf': 7, 'subsample': 0.8558429160514506, 'max_features': 'log2'}. Best is trial 259 with value: 0.21062976081411197.
[I 2024-12-04 12:27:00,965] Trial 361 finished with value: 0.2352353000433059 and parameters: {'n_estimators': 1176, 'learning_rate': 0.07890718685410632, 'max_depth': 9, 'min_samples_split': 10, 'min_samples_leaf': 1, 'subsample': 0.8592587900851113, 'max_features': 'sqrt'}. Best is trial 259 with value: 0.21062976081411197.
[I 2024-12-04 12:27:03,460] Trial 358 finished with value: 0.22367607218006114 and parameters: {'n_estimators': 1296, 'learning_rate': 0.08149729577868395, 'max_depth': 12, 'min_samples_split': 6, 'min_samples_leaf': 1, 'subsample': 0.7652229957805855, 'max_features': 'sqrt'}. Best is trial 259 with value: 0.21062976081411197.
[I 2024-12-04 12:27:05,342] Trial 354 finished with value: 0.2550038562516536 and parameters: {'n_estimators': 1469, 'learning_rate': 0.029557568396033677, 'max_depth': 9, 'min_samples_split': 10, 'min_samples_leaf': 1, 'subsample': 0.9656568462509578, 'max_features': 'sqrt'}. Best is trial 259 with value: 0.21062976081411197.
[I 2024-12-04 12:27:06,420] Trial 387 finished with value: 0.8808610770694147 and parameters: {'n_estimators': 208, 'learning_rate': 0.01068680115738138, 'max_depth': 3, 'min_samples_split': 10, 'min_samples_leaf': 4, 'subsample': 0.8403412307571028, 'max_features': 'log2'}. Best is trial 259 with value: 0.21062976081411197.
[I 2024-12-04 12:27:11,257] Trial 366 finished with value: 0.6180329973128785 and parameters: {'n_estimators': 1247, 'learning_rate': 0.017084220708996983, 'max_depth': 4, 'min_samples_split': 4, 'min_samples_leaf': 9, 'subsample': 0.6217198534693184, 'max_features': 'log2'}. Best is trial 259 with value: 0.21062976081411197.
[I 2024-12-04 12:27:11,457] Trial 360 finished with value: 0.26614071009198803 and parameters: {'n_estimators': 1348, 'learning_rate': 0.09435919921821374, 'max_depth': 7, 'min_samples_split': 19, 'min_samples_leaf': 2, 'subsample': 0.6073932609043045, 'max_features': 'sqrt'}. Best is trial 259 with value: 0.21062976081411197.
[I 2024-12-04 12:27:21,785] Trial 374 finished with value: 0.23589719657834826 and parameters: {'n_estimators': 930, 'learning_rate': 0.09134493540027364, 'max_depth': 10, 'min_samples_split': 6, 'min_samples_leaf': 2, 'subsample': 0.8183032486626178, 'max_features': 'sqrt'}. Best is trial 259 with value: 0.21062976081411197.
[I 2024-12-04 12:27:23,154] Trial 367 finished with value: 0.2369315315446304 and parameters: {'n_estimators': 1280, 'learning_rate': 0.09843718339027699, 'max_depth': 7, 'min_samples_split': 15, 'min_samples_leaf': 1, 'subsample': 0.6852202352161786, 'max_features': 'sqrt'}. Best is trial 259 with value: 0.21062976081411197.
[I 2024-12-04 12:27:24,217] Trial 368 finished with value: 0.23537826812869075 and parameters: {'n_estimators': 1259, 'learning_rate': 0.08085521364040173, 'max_depth': 12, 'min_samples_split': 11, 'min_samples_leaf': 2, 'subsample': 0.6686524239261239, 'max_features': 'sqrt'}. Best is trial 259 with value: 0.21062976081411197.
[I 2024-12-04 12:27:27,962] Trial 370 finished with value: 0.23850821213946133 and parameters: {'n_estimators': 1226, 'learning_rate': 0.039171966483734035, 'max_depth': 11, 'min_samples_split': 11, 'min_samples_leaf': 1, 'subsample': 0.8938694182957041, 'max_features': 'sqrt'}. Best is trial 259 with value: 0.21062976081411197.
[I 2024-12-04 12:27:29,705] Trial 381 finished with value: 0.22486461024759502 and parameters: {'n_estimators': 814, 'learning_rate': 0.08894014634269998, 'max_depth': 12, 'min_samples_split': 19, 'min_samples_leaf': 1, 'subsample': 0.8520774552851659, 'max_features': 'sqrt'}. Best is trial 259 with value: 0.21062976081411197.
[I 2024-12-04 12:27:30,664] Trial 386 finished with value: 0.24222467830916172 and parameters: {'n_estimators': 674, 'learning_rate': 0.09722369768762124, 'max_depth': 12, 'min_samples_split': 20, 'min_samples_leaf': 2, 'subsample': 0.9258269247507463, 'max_features': 'sqrt'}. Best is trial 259 with value: 0.21062976081411197.
[I 2024-12-04 12:27:31,801] Trial 375 finished with value: 0.2214739117148699 and parameters: {'n_estimators': 1054, 'learning_rate': 0.0848421071242556, 'max_depth': 10, 'min_samples_split': 14, 'min_samples_leaf': 1, 'subsample': 0.7217116937207609, 'max_features': 'sqrt'}. Best is trial 259 with value: 0.21062976081411197.
[I 2024-12-04 12:27:32,172] Trial 369 finished with value: 0.21849729387812997 and parameters: {'n_estimators': 1311, 'learning_rate': 0.09320054630747156, 'max_depth': 12, 'min_samples_split': 11, 'min_samples_leaf': 1, 'subsample': 0.7254688373739302, 'max_features': 'sqrt'}. Best is trial 259 with value: 0.21062976081411197.
[I 2024-12-04 12:27:36,440] Trial 371 finished with value: 0.21126669733818074 and parameters: {'n_estimators': 1319, 'learning_rate': 0.08954401915557302, 'max_depth': 10, 'min_samples_split': 11, 'min_samples_leaf': 1, 'subsample': 0.8177702013681117, 'max_features': 'sqrt'}. Best is trial 259 with value: 0.21062976081411197.
[I 2024-12-04 12:27:36,780] Trial 383 finished with value: 0.24409917348852336 and parameters: {'n_estimators': 876, 'learning_rate': 0.06691142105864863, 'max_depth': 12, 'min_samples_split': 20, 'min_samples_leaf': 2, 'subsample': 0.8858137367713697, 'max_features': 'sqrt'}. Best is trial 259 with value: 0.21062976081411197.
[I 2024-12-04 12:27:39,195] Trial 376 finished with value: 0.22238492020939066 and parameters: {'n_estimators': 1157, 'learning_rate': 0.05588129771000504, 'max_depth': 12, 'min_samples_split': 15, 'min_samples_leaf': 1, 'subsample': 0.6291317143580072, 'max_features': 'sqrt'}. Best is trial 259 with value: 0.21062976081411197.
[I 2024-12-04 12:27:39,962] Trial 373 finished with value: 0.2541776839662998 and parameters: {'n_estimators': 1296, 'learning_rate': 0.09874013536226153, 'max_depth': 8, 'min_samples_split': 13, 'min_samples_leaf': 1, 'subsample': 0.7875657238281977, 'max_features': 'sqrt'}. Best is trial 259 with value: 0.21062976081411197.
[I 2024-12-04 12:27:43,222] Trial 401 finished with value: 0.37140982611236595 and parameters: {'n_estimators': 266, 'learning_rate': 0.062455418604778726, 'max_depth': 8, 'min_samples_split': 19, 'min_samples_leaf': 1, 'subsample': 0.9320947559887618, 'max_features': 'log2'}. Best is trial 259 with value: 0.21062976081411197.
[I 2024-12-04 12:27:44,353] Trial 384 finished with value: 0.23225271144499976 and parameters: {'n_estimators': 1003, 'learning_rate': 0.09935028609270831, 'max_depth': 12, 'min_samples_split': 18, 'min_samples_leaf': 2, 'subsample': 0.6546638185552408, 'max_features': 'sqrt'}. Best is trial 259 with value: 0.21062976081411197.
[I 2024-12-04 12:27:45,389] Trial 379 finished with value: 0.2821298321441306 and parameters: {'n_estimators': 1074, 'learning_rate': 0.024454758649931893, 'max_depth': 11, 'min_samples_split': 11, 'min_samples_leaf': 4, 'subsample': 0.6083226386147695, 'max_features': None}. Best is trial 259 with value: 0.21062976081411197.
[I 2024-12-04 12:27:47,484] Trial 372 finished with value: 0.2422324489794079 and parameters: {'n_estimators': 1497, 'learning_rate': 0.0705450206692456, 'max_depth': 12, 'min_samples_split': 11, 'min_samples_leaf': 2, 'subsample': 0.8838061881817056, 'max_features': 'sqrt'}. Best is trial 259 with value: 0.21062976081411197.
[I 2024-12-04 12:27:50,808] Trial 385 finished with value: 0.2418040661771097 and parameters: {'n_estimators': 1131, 'learning_rate': 0.06430207000768687, 'max_depth': 12, 'min_samples_split': 20, 'min_samples_leaf': 2, 'subsample': 0.8828918571320779, 'max_features': 'sqrt'}. Best is trial 259 with value: 0.21062976081411197.
[I 2024-12-04 12:27:52,414] Trial 398 finished with value: 0.39526218160400295 and parameters: {'n_estimators': 622, 'learning_rate': 0.018599227369064057, 'max_depth': 10, 'min_samples_split': 11, 'min_samples_leaf': 9, 'subsample': 0.616823278127856, 'max_features': None}. Best is trial 259 with value: 0.21062976081411197.
[I 2024-12-04 12:27:53,424] Trial 378 finished with value: 0.25079984881101264 and parameters: {'n_estimators': 1387, 'learning_rate': 0.04954364594424778, 'max_depth': 9, 'min_samples_split': 11, 'min_samples_leaf': 2, 'subsample': 0.788668161394115, 'max_features': 'sqrt'}. Best is trial 259 with value: 0.21062976081411197.
[I 2024-12-04 12:27:58,256] Trial 382 finished with value: 0.47239450807992606 and parameters: {'n_estimators': 1428, 'learning_rate': 0.014615519989506932, 'max_depth': 4, 'min_samples_split': 13, 'min_samples_leaf': 3, 'subsample': 0.6704050505029171, 'max_features': 'log2'}. Best is trial 259 with value: 0.21062976081411197.
[I 2024-12-04 12:28:00,172] Trial 380 finished with value: 0.23990074819295246 and parameters: {'n_estimators': 1471, 'learning_rate': 0.09620193427473427, 'max_depth': 12, 'min_samples_split': 20, 'min_samples_leaf': 2, 'subsample': 0.670093935978996, 'max_features': 'sqrt'}. Best is trial 259 with value: 0.21062976081411197.
[I 2024-12-04 12:28:03,894] Trial 403 finished with value: 0.2647910933697457 and parameters: {'n_estimators': 634, 'learning_rate': 0.0679297199958437, 'max_depth': 11, 'min_samples_split': 20, 'min_samples_leaf': 1, 'subsample': 0.7473306371227658, 'max_features': 'sqrt'}. Best is trial 259 with value: 0.21062976081411197.
[I 2024-12-04 12:28:05,232] Trial 411 finished with value: 0.6404264644001415 and parameters: {'n_estimators': 375, 'learning_rate': 0.03001068970877268, 'max_depth': 5, 'min_samples_split': 9, 'min_samples_leaf': 7, 'subsample': 0.8259177063013858, 'max_features': 'log2'}. Best is trial 259 with value: 0.21062976081411197.
[I 2024-12-04 12:28:07,096] Trial 391 finished with value: 0.29372290965246317 and parameters: {'n_estimators': 1136, 'learning_rate': 0.01945730878817029, 'max_depth': 6, 'min_samples_split': 11, 'min_samples_leaf': 3, 'subsample': 0.9170472600835265, 'max_features': None}. Best is trial 259 with value: 0.21062976081411197.
[I 2024-12-04 12:28:07,922] Trial 377 finished with value: 0.2831240322589937 and parameters: {'n_estimators': 1489, 'learning_rate': 0.09829268313503031, 'max_depth': 8, 'min_samples_split': 7, 'min_samples_leaf': 1, 'subsample': 0.8446638552494797, 'max_features': None}. Best is trial 259 with value: 0.21062976081411197.
[I 2024-12-04 12:28:11,233] Trial 397 finished with value: 0.2254178812290729 and parameters: {'n_estimators': 1079, 'learning_rate': 0.09645340810818592, 'max_depth': 12, 'min_samples_split': 20, 'min_samples_leaf': 1, 'subsample': 0.8630814535585354, 'max_features': 'sqrt'}. Best is trial 259 with value: 0.21062976081411197.
[I 2024-12-04 12:28:11,379] Trial 409 finished with value: 0.5698437351686575 and parameters: {'n_estimators': 555, 'learning_rate': 0.01132732590919016, 'max_depth': 3, 'min_samples_split': 2, 'min_samples_leaf': 6, 'subsample': 0.9473199786883821, 'max_features': 'sqrt'}. Best is trial 259 with value: 0.21062976081411197.
[I 2024-12-04 12:28:12,074] Trial 389 finished with value: 0.26195550021710257 and parameters: {'n_estimators': 1411, 'learning_rate': 0.07616275333564075, 'max_depth': 8, 'min_samples_split': 7, 'min_samples_leaf': 4, 'subsample': 0.8492592957544657, 'max_features': 'sqrt'}. Best is trial 259 with value: 0.21062976081411197.
[I 2024-12-04 12:28:13,418] Trial 393 finished with value: 0.2210170489989714 and parameters: {'n_estimators': 1279, 'learning_rate': 0.09178169684024023, 'max_depth': 11, 'min_samples_split': 16, 'min_samples_leaf': 1, 'subsample': 0.6443115204578562, 'max_features': 'sqrt'}. Best is trial 259 with value: 0.21062976081411197.
[I 2024-12-04 12:28:15,024] Trial 396 finished with value: 0.22663094181701637 and parameters: {'n_estimators': 1177, 'learning_rate': 0.06402001479550821, 'max_depth': 12, 'min_samples_split': 13, 'min_samples_leaf': 1, 'subsample': 0.7423951751686184, 'max_features': 'sqrt'}. Best is trial 259 with value: 0.21062976081411197.
[I 2024-12-04 12:28:17,829] Trial 388 finished with value: 0.2172837002874739 and parameters: {'n_estimators': 1447, 'learning_rate': 0.0865052993977115, 'max_depth': 11, 'min_samples_split': 12, 'min_samples_leaf': 1, 'subsample': 0.8886830142200068, 'max_features': 'sqrt'}. Best is trial 259 with value: 0.21062976081411197.
[I 2024-12-04 12:28:20,023] Trial 390 finished with value: 0.22956095274652327 and parameters: {'n_estimators': 1495, 'learning_rate': 0.0983537017619602, 'max_depth': 9, 'min_samples_split': 13, 'min_samples_leaf': 1, 'subsample': 0.8697157197773867, 'max_features': 'sqrt'}. Best is trial 259 with value: 0.21062976081411197.
