[I 2024-12-04 13:03:19,074] Trial 2408 finished with value: 0.38140826937420874 and parameters: {'n_estimators': 1209, 'learning_rate': 0.07689395300502595, 'max_depth': 6, 'min_samples_split': 2, 'min_samples_leaf': 1, 'subsample': 0.9272006548632213, 'max_features': None}. Best is trial 1454 with value: 0.30763307678022894.
[I 2024-12-04 13:03:23,575] Trial 2404 finished with value: 0.4018456597012552 and parameters: {'n_estimators': 1466, 'learning_rate': 0.0524823732389054, 'max_depth': 6, 'min_samples_split': 5, 'min_samples_leaf': 1, 'subsample': 0.7958241554831648, 'max_features': None}. Best is trial 1454 with value: 0.30763307678022894.
[I 2024-12-04 13:03:24,357] Trial 2407 finished with value: 0.3907098879041259 and parameters: {'n_estimators': 1407, 'learning_rate': 0.05026734465817321, 'max_depth': 6, 'min_samples_split': 6, 'min_samples_leaf': 1, 'subsample': 0.8710907502374177, 'max_features': None}. Best is trial 1454 with value: 0.30763307678022894.
[I 2024-12-04 13:03:27,574] Trial 2410 finished with value: 0.3906713173045854 and parameters: {'n_estimators': 1465, 'learning_rate': 0.06077615970027982, 'max_depth': 5, 'min_samples_split': 3, 'min_samples_leaf': 3, 'subsample': 0.8586307773144829, 'max_features': None}. Best is trial 1454 with value: 0.30763307678022894.
[I 2024-12-04 13:03:29,619] Trial 2433 finished with value: 0.8828336814571138 and parameters: {'n_estimators': 726, 'learning_rate': 0.01095728793390295, 'max_depth': 10, 'min_samples_split': 14, 'min_samples_leaf': 7, 'subsample': 0.7510241812222012, 'max_features': 'log2'}. Best is trial 1454 with value: 0.30763307678022894.
[I 2024-12-04 13:03:30,130] Trial 2414 finished with value: 0.3765465140224789 and parameters: {'n_estimators': 1252, 'learning_rate': 0.03128217470705897, 'max_depth': 8, 'min_samples_split': 10, 'min_samples_leaf': 3, 'subsample': 0.8789066164481419, 'max_features': None}. Best is trial 1454 with value: 0.30763307678022894.
[I 2024-12-04 13:03:32,181] Trial 2421 finished with value: 0.4287725081878929 and parameters: {'n_estimators': 1339, 'learning_rate': 0.05958165944635251, 'max_depth': 5, 'min_samples_split': 3, 'min_samples_leaf': 3, 'subsample': 0.8436202915918498, 'max_features': 'sqrt'}. Best is trial 1454 with value: 0.30763307678022894.
[I 2024-12-04 13:03:32,251] Trial 2422 finished with value: 0.47221791919814904 and parameters: {'n_estimators': 1303, 'learning_rate': 0.051227954609823566, 'max_depth': 3, 'min_samples_split': 2, 'min_samples_leaf': 2, 'subsample': 0.9771948158747118, 'max_features': 'log2'}. Best is trial 1454 with value: 0.30763307678022894.
[I 2024-12-04 13:03:32,916] Trial 2416 finished with value: 0.39639541440956927 and parameters: {'n_estimators': 1491, 'learning_rate': 0.09816921061630597, 'max_depth': 8, 'min_samples_split': 6, 'min_samples_leaf': 5, 'subsample': 0.7975167125777924, 'max_features': 'sqrt'}. Best is trial 1454 with value: 0.30763307678022894.
[I 2024-12-04 13:03:33,839] Trial 2412 finished with value: 0.32871300604187614 and parameters: {'n_estimators': 1446, 'learning_rate': 0.06253616760284068, 'max_depth': 5, 'min_samples_split': 4, 'min_samples_leaf': 2, 'subsample': 0.762994045360745, 'max_features': None}. Best is trial 1454 with value: 0.30763307678022894.
[I 2024-12-04 13:03:35,585] Trial 2447 finished with value: 0.8619665279492108 and parameters: {'n_estimators': 173, 'learning_rate': 0.012005811810614173, 'max_depth': 6, 'min_samples_split': 19, 'min_samples_leaf': 5, 'subsample': 0.6979888099908591, 'max_features': 'sqrt'}. Best is trial 1454 with value: 0.30763307678022894.
[I 2024-12-04 13:03:37,281] Trial 2449 finished with value: 0.6456904145104702 and parameters: {'n_estimators': 103, 'learning_rate': 0.0596949858057773, 'max_depth': 5, 'min_samples_split': 7, 'min_samples_leaf': 3, 'subsample': 0.7383565741450357, 'max_features': 'sqrt'}. Best is trial 1454 with value: 0.30763307678022894.
[I 2024-12-04 13:03:37,968] Trial 2426 finished with value: 0.38987644056993964 and parameters: {'n_estimators': 1143, 'learning_rate': 0.062039574710718554, 'max_depth': 6, 'min_samples_split': 2, 'min_samples_leaf': 3, 'subsample': 0.8400237806115002, 'max_features': None}. Best is trial 1454 with value: 0.30763307678022894.
[I 2024-12-04 13:03:38,718] Trial 2445 finished with value: 0.570897175305628 and parameters: {'n_estimators': 390, 'learning_rate': 0.03917836889078959, 'max_depth': 6, 'min_samples_split': 14, 'min_samples_leaf': 1, 'subsample': 0.7972697008390899, 'max_features': 'log2'}. Best is trial 1454 with value: 0.30763307678022894.
[I 2024-12-04 13:03:39,735] Trial 2417 finished with value: 0.32516287871180344 and parameters: {'n_estimators': 1371, 'learning_rate': 0.045528573731867035, 'max_depth': 6, 'min_samples_split': 3, 'min_samples_leaf': 2, 'subsample': 0.8315350807854867, 'max_features': None}. Best is trial 1454 with value: 0.30763307678022894.
[I 2024-12-04 13:03:41,406] Trial 2424 finished with value: 0.37120842869065246 and parameters: {'n_estimators': 1202, 'learning_rate': 0.07418917431142906, 'max_depth': 8, 'min_samples_split': 8, 'min_samples_leaf': 4, 'subsample': 0.8604754007827701, 'max_features': None}. Best is trial 1454 with value: 0.30763307678022894.
[I 2024-12-04 13:03:41,683] Trial 2427 finished with value: 0.4025191092576998 and parameters: {'n_estimators': 1141, 'learning_rate': 0.04557780988751514, 'max_depth': 4, 'min_samples_split': 2, 'min_samples_leaf': 5, 'subsample': 0.9365415075195925, 'max_features': None}. Best is trial 1454 with value: 0.30763307678022894.
[I 2024-12-04 13:03:41,770] Trial 2415 finished with value: 0.3238378835901702 and parameters: {'n_estimators': 1493, 'learning_rate': 0.04627393555210418, 'max_depth': 8, 'min_samples_split': 3, 'min_samples_leaf': 2, 'subsample': 0.8780558641876303, 'max_features': None}. Best is trial 1454 with value: 0.30763307678022894.
[I 2024-12-04 13:03:42,267] Trial 2420 finished with value: 0.38893632599261324 and parameters: {'n_estimators': 1442, 'learning_rate': 0.08805449979316353, 'max_depth': 6, 'min_samples_split': 2, 'min_samples_leaf': 3, 'subsample': 0.8180390492484453, 'max_features': None}. Best is trial 1454 with value: 0.30763307678022894.
[I 2024-12-04 13:03:45,612] Trial 2423 finished with value: 0.3875863904729761 and parameters: {'n_estimators': 1408, 'learning_rate': 0.06212374582263943, 'max_depth': 7, 'min_samples_split': 2, 'min_samples_leaf': 3, 'subsample': 0.8001177569076128, 'max_features': None}. Best is trial 1454 with value: 0.30763307678022894.
[I 2024-12-04 13:03:46,271] Trial 2454 finished with value: 0.6385460456595988 and parameters: {'n_estimators': 202, 'learning_rate': 0.020490587005777623, 'max_depth': 3, 'min_samples_split': 13, 'min_samples_leaf': 10, 'subsample': 0.6225400814346973, 'max_features': None}. Best is trial 1454 with value: 0.30763307678022894.
[I 2024-12-04 13:03:46,533] Trial 2419 finished with value: 0.32365643153451495 and parameters: {'n_estimators': 1497, 'learning_rate': 0.08268387243058381, 'max_depth': 7, 'min_samples_split': 2, 'min_samples_leaf': 2, 'subsample': 0.9227716835657477, 'max_features': None}. Best is trial 1454 with value: 0.30763307678022894.
[I 2024-12-04 13:03:49,853] Trial 2428 finished with value: 0.3738665530762063 and parameters: {'n_estimators': 1351, 'learning_rate': 0.09166785612598052, 'max_depth': 4, 'min_samples_split': 7, 'min_samples_leaf': 4, 'subsample': 0.8756338736685433, 'max_features': None}. Best is trial 1454 with value: 0.30763307678022894.
[I 2024-12-04 13:03:52,185] Trial 2432 finished with value: 0.33714814621701084 and parameters: {'n_estimators': 1246, 'learning_rate': 0.044743712101645336, 'max_depth': 5, 'min_samples_split': 4, 'min_samples_leaf': 2, 'subsample': 0.7892443915888429, 'max_features': None}. Best is trial 1454 with value: 0.30763307678022894.
[I 2024-12-04 13:03:52,241] Trial 2434 finished with value: 0.4293657086407812 and parameters: {'n_estimators': 1398, 'learning_rate': 0.06012335616561364, 'max_depth': 6, 'min_samples_split': 2, 'min_samples_leaf': 2, 'subsample': 0.7931257370075382, 'max_features': 'log2'}. Best is trial 1454 with value: 0.30763307678022894.
[I 2024-12-04 13:03:57,319] Trial 2429 finished with value: 0.3199224842035331 and parameters: {'n_estimators': 1488, 'learning_rate': 0.08948250622911233, 'max_depth': 6, 'min_samples_split': 2, 'min_samples_leaf': 2, 'subsample': 0.8527182583925225, 'max_features': None}. Best is trial 1454 with value: 0.30763307678022894.
[I 2024-12-04 13:03:57,888] Trial 2431 finished with value: 0.38929241974674594 and parameters: {'n_estimators': 1467, 'learning_rate': 0.07285997149022173, 'max_depth': 5, 'min_samples_split': 3, 'min_samples_leaf': 3, 'subsample': 0.8515965089444693, 'max_features': None}. Best is trial 1454 with value: 0.30763307678022894.
[I 2024-12-04 13:03:59,996] Trial 2435 finished with value: 0.3317663248434762 and parameters: {'n_estimators': 1328, 'learning_rate': 0.059740040836500766, 'max_depth': 8, 'min_samples_split': 2, 'min_samples_leaf': 2, 'subsample': 0.8448256137131566, 'max_features': None}. Best is trial 1454 with value: 0.30763307678022894.
[I 2024-12-04 13:04:02,125] Trial 2438 finished with value: 0.46557063472611726 and parameters: {'n_estimators': 1299, 'learning_rate': 0.024841980546425894, 'max_depth': 7, 'min_samples_split': 14, 'min_samples_leaf': 8, 'subsample': 0.6576166265849563, 'max_features': None}. Best is trial 1454 with value: 0.30763307678022894.
[I 2024-12-04 13:04:02,888] Trial 2450 finished with value: 0.8253282912730802 and parameters: {'n_estimators': 916, 'learning_rate': 0.010690553412028899, 'max_depth': 12, 'min_samples_split': 15, 'min_samples_leaf': 5, 'subsample': 0.6386713142916429, 'max_features': 'log2'}. Best is trial 1454 with value: 0.30763307678022894.
[I 2024-12-04 13:04:04,856] Trial 2440 finished with value: 0.34868667533004893 and parameters: {'n_estimators': 1283, 'learning_rate': 0.045374362878835346, 'max_depth': 7, 'min_samples_split': 10, 'min_samples_leaf': 2, 'subsample': 0.8610047438858522, 'max_features': None}. Best is trial 1454 with value: 0.30763307678022894.
[I 2024-12-04 13:04:04,869] Trial 2439 finished with value: 0.38220887370923373 and parameters: {'n_estimators': 1309, 'learning_rate': 0.07554720050288725, 'max_depth': 7, 'min_samples_split': 3, 'min_samples_leaf': 3, 'subsample': 0.8170795404339103, 'max_features': None}. Best is trial 1454 with value: 0.30763307678022894.
[I 2024-12-04 13:04:04,871] Trial 2444 finished with value: 0.713824453789032 and parameters: {'n_estimators': 1428, 'learning_rate': 0.016266941584806502, 'max_depth': 11, 'min_samples_split': 12, 'min_samples_leaf': 8, 'subsample': 0.8747082414032198, 'max_features': 'log2'}. Best is trial 1454 with value: 0.30763307678022894.
[I 2024-12-04 13:04:04,935] Trial 2436 finished with value: 0.4104284844167436 and parameters: {'n_estimators': 1499, 'learning_rate': 0.058064621107839824, 'max_depth': 4, 'min_samples_split': 2, 'min_samples_leaf': 1, 'subsample': 0.8604244930256273, 'max_features': None}. Best is trial 1454 with value: 0.30763307678022894.
[I 2024-12-04 13:04:06,350] Trial 2443 finished with value: 0.38768565268643995 and parameters: {'n_estimators': 1247, 'learning_rate': 0.061162205281982227, 'max_depth': 6, 'min_samples_split': 4, 'min_samples_leaf': 3, 'subsample': 0.8125481980094538, 'max_features': None}. Best is trial 1454 with value: 0.30763307678022894.
[I 2024-12-04 13:04:09,257] Trial 2458 finished with value: 0.5201740081872385 and parameters: {'n_estimators': 758, 'learning_rate': 0.0744193055380066, 'max_depth': 3, 'min_samples_split': 12, 'min_samples_leaf': 5, 'subsample': 0.7777850832403028, 'max_features': 'log2'}. Best is trial 1454 with value: 0.30763307678022894.
[I 2024-12-04 13:04:10,791] Trial 2457 finished with value: 0.479488421042133 and parameters: {'n_estimators': 837, 'learning_rate': 0.07722406589717615, 'max_depth': 6, 'min_samples_split': 5, 'min_samples_leaf': 5, 'subsample': 0.8476302222689641, 'max_features': 'log2'}. Best is trial 1454 with value: 0.30763307678022894.
[I 2024-12-04 13:04:11,129] Trial 2441 finished with value: 0.36999592457284813 and parameters: {'n_estimators': 1452, 'learning_rate': 0.05479010952631201, 'max_depth': 6, 'min_samples_split': 2, 'min_samples_leaf': 4, 'subsample': 0.7459958055803955, 'max_features': None}. Best is trial 1454 with value: 0.30763307678022894.
[I 2024-12-04 13:04:11,886] Trial 2437 finished with value: 0.40147745910937543 and parameters: {'n_estimators': 1494, 'learning_rate': 0.05937788302734693, 'max_depth': 5, 'min_samples_split': 3, 'min_samples_leaf': 3, 'subsample': 0.8102744185424533, 'max_features': None}. Best is trial 1454 with value: 0.30763307678022894.
[I 2024-12-04 13:04:13,231] Trial 2442 finished with value: 0.3839878779904447 and parameters: {'n_estimators': 1415, 'learning_rate': 0.06341633845005118, 'max_depth': 8, 'min_samples_split': 2, 'min_samples_leaf': 1, 'subsample': 0.8072089723908291, 'max_features': None}. Best is trial 1454 with value: 0.30763307678022894.
[I 2024-12-04 13:04:15,506] Trial 2446 finished with value: 0.4062632593567015 and parameters: {'n_estimators': 1265, 'learning_rate': 0.045877445704175096, 'max_depth': 6, 'min_samples_split': 2, 'min_samples_leaf': 1, 'subsample': 0.9134359538152145, 'max_features': None}. Best is trial 1454 with value: 0.30763307678022894.
[I 2024-12-04 13:04:20,185] Trial 2467 finished with value: 0.4176422016717978 and parameters: {'n_estimators': 726, 'learning_rate': 0.06229248727887951, 'max_depth': 4, 'min_samples_split': 2, 'min_samples_leaf': 3, 'subsample': 0.7586623691129615, 'max_features': None}. Best is trial 1454 with value: 0.30763307678022894.
[I 2024-12-04 13:04:22,217] Trial 2451 finished with value: 0.3289420348482361 and parameters: {'n_estimators': 1319, 'learning_rate': 0.08832755768349274, 'max_depth': 5, 'min_samples_split': 2, 'min_samples_leaf': 2, 'subsample': 0.8020939472489523, 'max_features': None}. Best is trial 1454 with value: 0.30763307678022894.
[I 2024-12-04 13:04:24,671] Trial 2452 finished with value: 0.41318959455541343 and parameters: {'n_estimators': 1328, 'learning_rate': 0.032490169951175436, 'max_depth': 6, 'min_samples_split': 8, 'min_samples_leaf': 1, 'subsample': 0.8227187919520347, 'max_features': None}. Best is trial 1454 with value: 0.30763307678022894.
[I 2024-12-04 13:04:25,203] Trial 2448 finished with value: 0.38254178242376485 and parameters: {'n_estimators': 1500, 'learning_rate': 0.08194113153621392, 'max_depth': 6, 'min_samples_split': 2, 'min_samples_leaf': 3, 'subsample': 0.7787562281884377, 'max_features': None}. Best is trial 1454 with value: 0.30763307678022894.
[I 2024-12-04 13:04:26,305] Trial 2464 finished with value: 0.48157022286730883 and parameters: {'n_estimators': 1132, 'learning_rate': 0.012166294386512181, 'max_depth': 12, 'min_samples_split': 17, 'min_samples_leaf': 2, 'subsample': 0.9350805372629736, 'max_features': 'log2'}. Best is trial 1454 with value: 0.30763307678022894.
[I 2024-12-04 13:04:27,627] Trial 2472 finished with value: 0.7061709158180736 and parameters: {'n_estimators': 704, 'learning_rate': 0.011152858343949683, 'max_depth': 3, 'min_samples_split': 8, 'min_samples_leaf': 5, 'subsample': 0.8053440731601044, 'max_features': 'sqrt'}. Best is trial 1454 with value: 0.30763307678022894.
[I 2024-12-04 13:04:29,016] Trial 2456 finished with value: 0.3970666693836373 and parameters: {'n_estimators': 1228, 'learning_rate': 0.06174101864553737, 'max_depth': 6, 'min_samples_split': 5, 'min_samples_leaf': 1, 'subsample': 0.772646112761943, 'max_features': None}. Best is trial 1454 with value: 0.30763307678022894.
[I 2024-12-04 13:04:31,218] Trial 2453 finished with value: 0.38061865017407953 and parameters: {'n_estimators': 1491, 'learning_rate': 0.053683406212054294, 'max_depth': 5, 'min_samples_split': 3, 'min_samples_leaf': 4, 'subsample': 0.8776897388466035, 'max_features': None}. Best is trial 1454 with value: 0.30763307678022894.
[I 2024-12-04 13:04:32,132] Trial 2460 finished with value: 0.32557244542714553 and parameters: {'n_estimators': 1183, 'learning_rate': 0.09618096151381762, 'max_depth': 6, 'min_samples_split': 4, 'min_samples_leaf': 2, 'subsample': 0.8426124365533001, 'max_features': None}. Best is trial 1454 with value: 0.30763307678022894.
[I 2024-12-04 13:04:35,480] Trial 2455 finished with value: 0.3275890226865471 and parameters: {'n_estimators': 1476, 'learning_rate': 0.06006461964629636, 'max_depth': 8, 'min_samples_split': 7, 'min_samples_leaf': 2, 'subsample': 0.8285581829358916, 'max_features': None}. Best is trial 1454 with value: 0.30763307678022894.
[I 2024-12-04 13:04:35,968] Trial 2462 finished with value: 0.41318225705076805 and parameters: {'n_estimators': 1377, 'learning_rate': 0.059146269087768495, 'max_depth': 3, 'min_samples_split': 6, 'min_samples_leaf': 1, 'subsample': 0.8095891872181027, 'max_features': None}. Best is trial 1454 with value: 0.30763307678022894.
[I 2024-12-04 13:04:37,364] Trial 2463 finished with value: 0.41444424208884056 and parameters: {'n_estimators': 1458, 'learning_rate': 0.04304039043890677, 'max_depth': 3, 'min_samples_split': 3, 'min_samples_leaf': 1, 'subsample': 0.8674841149071562, 'max_features': 'sqrt'}. Best is trial 1454 with value: 0.30763307678022894.
[I 2024-12-04 13:04:38,522] Trial 2471 finished with value: 0.555904970279012 and parameters: {'n_estimators': 1182, 'learning_rate': 0.06144465322350047, 'max_depth': 6, 'min_samples_split': 12, 'min_samples_leaf': 7, 'subsample': 0.6913878344092987, 'max_features': 'log2'}. Best is trial 1454 with value: 0.30763307678022894.
[I 2024-12-04 13:04:39,639] Trial 2459 finished with value: 0.3884918398071475 and parameters: {'n_estimators': 1486, 'learning_rate': 0.07091358035199355, 'max_depth': 5, 'min_samples_split': 2, 'min_samples_leaf': 3, 'subsample': 0.8895883000470203, 'max_features': None}. Best is trial 1454 with value: 0.30763307678022894.
[I 2024-12-04 13:04:40,685] Trial 2461 finished with value: 0.40760765531524357 and parameters: {'n_estimators': 1495, 'learning_rate': 0.07084508237959797, 'max_depth': 4, 'min_samples_split': 2, 'min_samples_leaf': 3, 'subsample': 0.9532505104699596, 'max_features': None}. Best is trial 1454 with value: 0.30763307678022894.
[I 2024-12-04 13:04:43,357] Trial 2469 finished with value: 0.3853008948673575 and parameters: {'n_estimators': 1394, 'learning_rate': 0.0727839674049192, 'max_depth': 6, 'min_samples_split': 5, 'min_samples_leaf': 2, 'subsample': 0.8771608428836368, 'max_features': 'sqrt'}. Best is trial 1454 with value: 0.30763307678022894.
[I 2024-12-04 13:04:44,986] Trial 2466 finished with value: 0.3729768313329678 and parameters: {'n_estimators': 1439, 'learning_rate': 0.0713411074698529, 'max_depth': 6, 'min_samples_split': 7, 'min_samples_leaf': 4, 'subsample': 0.9012669464922468, 'max_features': None}. Best is trial 1454 with value: 0.30763307678022894.
[I 2024-12-04 13:04:45,611] Trial 2470 finished with value: 0.43016267385303075 and parameters: {'n_estimators': 1482, 'learning_rate': 0.05345949304595369, 'max_depth': 4, 'min_samples_split': 17, 'min_samples_leaf': 4, 'subsample': 0.8659645612756043, 'max_features': 'sqrt'}. Best is trial 1454 with value: 0.30763307678022894.
[I 2024-12-04 13:04:46,043] Trial 2465 finished with value: 0.423544147369007 and parameters: {'n_estimators': 1490, 'learning_rate': 0.06636779331898432, 'max_depth': 7, 'min_samples_split': 2, 'min_samples_leaf': 1, 'subsample': 0.8163341069581886, 'max_features': None}. Best is trial 1454 with value: 0.30763307678022894.
[I 2024-12-04 13:04:46,490] Trial 2483 finished with value: 0.3957407945844846 and parameters: {'n_estimators': 811, 'learning_rate': 0.042001867583930354, 'max_depth': 7, 'min_samples_split': 5, 'min_samples_leaf': 1, 'subsample': 0.7536526945359399, 'max_features': None}. Best is trial 1454 with value: 0.30763307678022894.
[I 2024-12-04 13:04:47,153] Trial 2468 finished with value: 0.3699293617971906 and parameters: {'n_estimators': 1436, 'learning_rate': 0.043275712620986465, 'max_depth': 8, 'min_samples_split': 7, 'min_samples_leaf': 4, 'subsample': 0.849532340681267, 'max_features': None}. Best is trial 1454 with value: 0.30763307678022894.
[I 2024-12-04 13:04:48,324] Trial 2482 finished with value: 0.44959481302957566 and parameters: {'n_estimators': 1117, 'learning_rate': 0.03823773986827898, 'max_depth': 4, 'min_samples_split': 2, 'min_samples_leaf': 1, 'subsample': 0.7511450980021954, 'max_features': 'log2'}. Best is trial 1454 with value: 0.30763307678022894.
[I 2024-12-04 13:04:49,242] Trial 2479 finished with value: 0.32984576554063544 and parameters: {'n_estimators': 1078, 'learning_rate': 0.0867461795253407, 'max_depth': 6, 'min_samples_split': 2, 'min_samples_leaf': 2, 'subsample': 0.8665055834729671, 'max_features': None}. Best is trial 1454 with value: 0.30763307678022894.
[I 2024-12-04 13:04:50,297] Trial 2481 finished with value: 0.40664185716544365 and parameters: {'n_estimators': 1066, 'learning_rate': 0.048959819608213086, 'max_depth': 4, 'min_samples_split': 6, 'min_samples_leaf': 1, 'subsample': 0.8011262596485715, 'max_features': None}. Best is trial 1454 with value: 0.30763307678022894.
[I 2024-12-04 13:04:51,098] Trial 2480 finished with value: 0.41173065846643153 and parameters: {'n_estimators': 1176, 'learning_rate': 0.08622552396635676, 'max_depth': 4, 'min_samples_split': 3, 'min_samples_leaf': 3, 'subsample': 0.8148463909317364, 'max_features': None}. Best is trial 1454 with value: 0.30763307678022894.
[I 2024-12-04 13:04:51,289] Trial 2476 finished with value: 0.396006465749546 and parameters: {'n_estimators': 1339, 'learning_rate': 0.017527001703695717, 'max_depth': 5, 'min_samples_split': 20, 'min_samples_leaf': 5, 'subsample': 0.6066004990988912, 'max_features': None}. Best is trial 1454 with value: 0.30763307678022894.
