[I 2024-12-04 20:07:23,920] Trial 855 finished with value: 1.0624161172683224 and parameters: {'kernel_type': 'Matern', 'length_scale': 265.1988970773296, 'noise_level': 0.01718747750132587, 'constant_value': 0.006639236605020638, 'nu': 1.5}. Best is trial 448 with value: 0.3592093758005386.
[I 2024-12-04 20:07:26,010] Trial 857 finished with value: 0.35921065794550533 and parameters: {'kernel_type': 'Matern', 'length_scale': 65.52400268213407, 'noise_level': 0.02773910976019648, 'constant_value': 0.10986299848250798, 'nu': 0.5}. Best is trial 448 with value: 0.3592093758005386.
[I 2024-12-04 20:07:26,022] Trial 858 finished with value: 0.35921122049552745 and parameters: {'kernel_type': 'Matern', 'length_scale': 90.87182090587204, 'noise_level': 0.0032872695512337117, 'constant_value': 276.5769512997307, 'nu': 0.5}. Best is trial 448 with value: 0.3592093758005386.
[I 2024-12-04 20:07:30,364] Trial 859 finished with value: 0.35921108712356536 and parameters: {'kernel_type': 'Matern', 'length_scale': 0.21867442657187244, 'noise_level': 0.004005394602384992, 'constant_value': 2224.296109892976, 'nu': 0.5}. Best is trial 448 with value: 0.3592093758005386.
[I 2024-12-04 20:07:31,007] Trial 860 finished with value: 0.359211258713008 and parameters: {'kernel_type': 'Matern', 'length_scale': 280.1299318504307, 'noise_level': 0.7772748443667423, 'constant_value': 0.7428553639601533, 'nu': 0.5}. Best is trial 448 with value: 0.3592093758005386.
[I 2024-12-04 20:07:31,558] Trial 861 finished with value: 0.35921123567742064 and parameters: {'kernel_type': 'Matern', 'length_scale': 884.2583417268931, 'noise_level': 0.01859739135702022, 'constant_value': 1.589046532011415, 'nu': 0.5}. Best is trial 448 with value: 0.3592093758005386.
[I 2024-12-04 20:07:36,647] Trial 862 finished with value: 0.3592112214867609 and parameters: {'kernel_type': 'Matern', 'length_scale': 742.5027507853011, 'noise_level': 0.9900988567674591, 'constant_value': 0.008914118315119063, 'nu': 0.5}. Best is trial 448 with value: 0.3592093758005386.
[I 2024-12-04 20:07:36,722] Trial 864 finished with value: 0.3592112199006183 and parameters: {'kernel_type': 'Matern', 'length_scale': 15.705747947128518, 'noise_level': 0.7816627421755176, 'constant_value': 0.061740108088880155, 'nu': 0.5}. Best is trial 448 with value: 0.3592093758005386.
[I 2024-12-04 20:07:37,740] Trial 863 finished with value: 0.3592112358365174 and parameters: {'kernel_type': 'Matern', 'length_scale': 63.247432513416776, 'noise_level': 0.01313073301026613, 'constant_value': 0.16695268258200374, 'nu': 0.5}. Best is trial 448 with value: 0.3592093758005386.
[I 2024-12-04 20:07:39,916] Trial 865 finished with value: 1.0624161173324826 and parameters: {'kernel_type': 'Matern', 'length_scale': 0.0022031969816086643, 'noise_level': 0.07910853016914976, 'constant_value': 97.74404531125137, 'nu': 0.5}. Best is trial 448 with value: 0.3592093758005386.
[I 2024-12-04 20:07:40,466] Trial 866 finished with value: 1.0624161180276406 and parameters: {'kernel_type': 'RBF', 'length_scale': 0.01139230627402569, 'noise_level': 0.5689399040326056, 'constant_value': 773.5468735535934, 'nu': 0.5}. Best is trial 448 with value: 0.3592093758005386.
[I 2024-12-04 20:07:43,337] Trial 867 finished with value: 0.42868351581954844 and parameters: {'kernel_type': 'RBF', 'length_scale': 3.823820002243112, 'noise_level': 0.02938773841912362, 'constant_value': 87.67602254339735, 'nu': 0.5}. Best is trial 448 with value: 0.3592093758005386.
[I 2024-12-04 20:07:45,837] Trial 869 finished with value: 0.35921134064243015 and parameters: {'kernel_type': 'Matern', 'length_scale': 0.49274078064150717, 'noise_level': 0.37432469222698744, 'constant_value': 37278.548230135995, 'nu': 0.5}. Best is trial 448 with value: 0.3592093758005386.
[I 2024-12-04 20:07:45,838] Trial 868 finished with value: 0.4286845468298298 and parameters: {'kernel_type': 'RBF', 'length_scale': 5.192617633288099, 'noise_level': 0.45659701682178677, 'constant_value': 0.0006444180458536764, 'nu': 0.5}. Best is trial 448 with value: 0.3592093758005386.
[I 2024-12-04 20:07:48,033] Trial 870 finished with value: 0.3592112544549019 and parameters: {'kernel_type': 'Matern', 'length_scale': 3.2889574052160873, 'noise_level': 0.00643284238320988, 'constant_value': 1.135382261047071, 'nu': 0.5}. Best is trial 448 with value: 0.3592093758005386.
[I 2024-12-04 20:07:51,151] Trial 871 finished with value: 0.35921115072058823 and parameters: {'kernel_type': 'Matern', 'length_scale': 732.3869869430868, 'noise_level': 0.028846738672926982, 'constant_value': 119.46515419389337, 'nu': 0.5}. Best is trial 448 with value: 0.3592093758005386.
[I 2024-12-04 20:07:52,812] Trial 873 finished with value: 0.3592112416098329 and parameters: {'kernel_type': 'Matern', 'length_scale': 0.9644416108528509, 'noise_level': 0.0024101147234694485, 'constant_value': 23.9409174094842, 'nu': 0.5}. Best is trial 448 with value: 0.3592093758005386.
[I 2024-12-04 20:07:55,592] Trial 872 finished with value: 0.42868336763770015 and parameters: {'kernel_type': 'RBF', 'length_scale': 0.3715497792458108, 'noise_level': 1.0424125568788134e-05, 'constant_value': 1.8682611085015067e-07, 'nu': 0.5}. Best is trial 448 with value: 0.3592093758005386.
[I 2024-12-04 20:07:55,915] Trial 874 finished with value: 0.35921127052569557 and parameters: {'kernel_type': 'Matern', 'length_scale': 3.358449984802694, 'noise_level': 0.003116019654245037, 'constant_value': 74508.63579921002, 'nu': 0.5}. Best is trial 448 with value: 0.3592093758005386.
[I 2024-12-04 20:08:02,119] Trial 875 finished with value: 0.4195658230554998 and parameters: {'kernel_type': 'Matern', 'length_scale': 23.405072700059797, 'noise_level': 0.47006615322557926, 'constant_value': 38667.136468259865, 'nu': 2.5}. Best is trial 448 with value: 0.3592093758005386.
[I 2024-12-04 20:08:04,092] Trial 877 finished with value: 1.062416117439718 and parameters: {'kernel_type': 'RBF', 'length_scale': 0.14729619418417905, 'noise_level': 3.049207083733402e-05, 'constant_value': 0.04410548612294514, 'nu': 1.5}. Best is trial 448 with value: 0.3592093758005386.
[I 2024-12-04 20:08:06,078] Trial 876 finished with value: 0.3592112397284128 and parameters: {'kernel_type': 'Matern', 'length_scale': 0.2892830877933059, 'noise_level': 0.7344141845102128, 'constant_value': 59295.404962062086, 'nu': 0.5}. Best is trial 448 with value: 0.3592093758005386.
[I 2024-12-04 20:08:07,755] Trial 878 finished with value: 0.35921148135187275 and parameters: {'kernel_type': 'Matern', 'length_scale': 3.17226907423849, 'noise_level': 0.04596172539405939, 'constant_value': 0.9000961686622522, 'nu': 0.5}. Best is trial 448 with value: 0.3592093758005386.
[I 2024-12-04 20:08:08,676] Trial 879 finished with value: 0.35921100731057204 and parameters: {'kernel_type': 'Matern', 'length_scale': 15.139109709753754, 'noise_level': 0.6106272981631151, 'constant_value': 68.2106588463951, 'nu': 0.5}. Best is trial 448 with value: 0.3592093758005386.
[I 2024-12-04 20:08:11,000] Trial 880 finished with value: 0.35921015821274005 and parameters: {'kernel_type': 'Matern', 'length_scale': 304.48631137158554, 'noise_level': 0.0017837849092349316, 'constant_value': 6.056721508090482, 'nu': 0.5}. Best is trial 448 with value: 0.3592093758005386.
[I 2024-12-04 20:08:11,853] Trial 881 finished with value: 0.35916990930150405 and parameters: {'kernel_type': 'Matern', 'length_scale': 1870.2520902592971, 'noise_level': 0.018585954219357506, 'constant_value': 6.831687966222872, 'nu': 0.5}. Best is trial 881 with value: 0.35916990930150405.
[I 2024-12-04 20:08:14,381] Trial 882 finished with value: 0.35921439853396137 and parameters: {'kernel_type': 'Matern', 'length_scale': 103.14922577000723, 'noise_level': 0.7473642473982077, 'constant_value': 0.018163490856470964, 'nu': 0.5}. Best is trial 881 with value: 0.35916990930150405.
[I 2024-12-04 20:08:17,444] Trial 884 finished with value: 0.3592112090826879 and parameters: {'kernel_type': 'Matern', 'length_scale': 7744.2582417803615, 'noise_level': 0.0004893613361354762, 'constant_value': 191.2436967166467, 'nu': 0.5}. Best is trial 881 with value: 0.35916990930150405.
[I 2024-12-04 20:08:20,181] Trial 883 finished with value: 1.0624161175212488 and parameters: {'kernel_type': 'Matern', 'length_scale': 48885.99574597559, 'noise_level': 0.0005101995101876615, 'constant_value': 0.013600196943129174, 'nu': 0.5}. Best is trial 881 with value: 0.35916990930150405.
[I 2024-12-04 20:08:20,898] Trial 885 finished with value: 0.3592112825831066 and parameters: {'kernel_type': 'Matern', 'length_scale': 2415.5240093575526, 'noise_level': 0.0007631876810409801, 'constant_value': 15.862459671664741, 'nu': 0.5}. Best is trial 881 with value: 0.35916990930150405.
[I 2024-12-04 20:08:21,826] Trial 886 finished with value: 1.0624161172399307 and parameters: {'kernel_type': 'Matern', 'length_scale': 2137.4876953402795, 'noise_level': 0.000632082081291228, 'constant_value': 0.5313916890931124, 'nu': 0.5}. Best is trial 881 with value: 0.35916990930150405.
[I 2024-12-04 20:08:24,572] Trial 887 finished with value: 1.0624161172397038 and parameters: {'kernel_type': 'Matern', 'length_scale': 14489.481147889759, 'noise_level': 0.0023882898116727317, 'constant_value': 48.05147143995027, 'nu': 0.5}. Best is trial 881 with value: 0.35916990930150405.
[I 2024-12-04 20:08:27,456] Trial 888 finished with value: 1.0624161172690878 and parameters: {'kernel_type': 'Matern', 'length_scale': 15092.726305979586, 'noise_level': 0.009502750980896332, 'constant_value': 2.4093861380206674, 'nu': 0.5}. Best is trial 881 with value: 0.35916990930150405.
[I 2024-12-04 20:08:28,294] Trial 889 finished with value: 1.0624161172475863 and parameters: {'kernel_type': 'Matern', 'length_scale': 361.5972357053346, 'noise_level': 1.4029681660899087e-05, 'constant_value': 4.070285322744749, 'nu': 0.5}. Best is trial 881 with value: 0.35916990930150405.
[I 2024-12-04 20:08:28,356] Trial 890 finished with value: 1.0916566518189854 and parameters: {'kernel_type': 'Matern', 'length_scale': 589.0212852669299, 'noise_level': 1.9814246930190295e-05, 'constant_value': 253.801505740252, 'nu': 0.5}. Best is trial 881 with value: 0.35916990930150405.
[I 2024-12-04 20:08:33,067] Trial 891 finished with value: 0.35921110954960106 and parameters: {'kernel_type': 'Matern', 'length_scale': 9656.897867844307, 'noise_level': 0.9232151865428009, 'constant_value': 8.067646801078055, 'nu': 0.5}. Best is trial 881 with value: 0.35916990930150405.
[I 2024-12-04 20:08:33,931] Trial 893 finished with value: 0.3592112326494103 and parameters: {'kernel_type': 'Matern', 'length_scale': 293.8885030202612, 'noise_level': 0.004805205793323815, 'constant_value': 6.108321849228623, 'nu': 0.5}. Best is trial 881 with value: 0.35916990930150405.
[I 2024-12-04 20:08:34,013] Trial 892 finished with value: 1.062416117307738 and parameters: {'kernel_type': 'Matern', 'length_scale': 11782.007024909146, 'noise_level': 0.002581050032255665, 'constant_value': 0.7426693879632692, 'nu': 0.5}. Best is trial 881 with value: 0.35916990930150405.
[I 2024-12-04 20:08:38,139] Trial 894 finished with value: 0.3592112389292713 and parameters: {'kernel_type': 'Matern', 'length_scale': 140.17220387143576, 'noise_level': 0.003972793902636687, 'constant_value': 96.00499674695024, 'nu': 0.5}. Best is trial 881 with value: 0.35916990930150405.
[I 2024-12-04 20:08:38,909] Trial 896 finished with value: 0.3592112572203397 and parameters: {'kernel_type': 'Matern', 'length_scale': 728.910294698187, 'noise_level': 0.0479579231073124, 'constant_value': 6.607389498559245, 'nu': 0.5}. Best is trial 881 with value: 0.35916990930150405.
[I 2024-12-04 20:08:39,165] Trial 895 finished with value: 0.35921129749870195 and parameters: {'kernel_type': 'Matern', 'length_scale': 316.3404277656914, 'noise_level': 0.00044387728391655505, 'constant_value': 2.085920266537359, 'nu': 0.5}. Best is trial 881 with value: 0.35916990930150405.
[I 2024-12-04 20:08:42,961] Trial 897 finished with value: 0.3592112599266758 and parameters: {'kernel_type': 'Matern', 'length_scale': 12037.329286695784, 'noise_level': 0.04103070038086027, 'constant_value': 774.7651308346402, 'nu': 0.5}. Best is trial 881 with value: 0.35916990930150405.
[I 2024-12-04 20:08:44,548] Trial 899 finished with value: 0.35921123865875065 and parameters: {'kernel_type': 'Matern', 'length_scale': 47.99152554022715, 'noise_level': 0.0026206578463935553, 'constant_value': 33.10136743296247, 'nu': 0.5}. Best is trial 881 with value: 0.35916990930150405.
[I 2024-12-04 20:08:45,825] Trial 898 finished with value: 1.0624161173245665 and parameters: {'kernel_type': 'RBF', 'length_scale': 1807.707612479913, 'noise_level': 0.000797818720581325, 'constant_value': 11.566744265260239, 'nu': 2.5}. Best is trial 881 with value: 0.35916990930150405.
[I 2024-12-04 20:08:48,345] Trial 901 finished with value: 1.0624161173735287 and parameters: {'kernel_type': 'Matern', 'length_scale': 205.8694838146814, 'noise_level': 0.00027417264168873014, 'constant_value': 0.2670997245788325, 'nu': 0.5}. Best is trial 881 with value: 0.35916990930150405.
[I 2024-12-04 20:08:48,714] Trial 900 finished with value: 0.35921115799820463 and parameters: {'kernel_type': 'Matern', 'length_scale': 37.340336599500525, 'noise_level': 0.0002917798691751203, 'constant_value': 193.7895269154305, 'nu': 0.5}. Best is trial 881 with value: 0.35916990930150405.
[I 2024-12-04 20:08:56,548] Trial 902 finished with value: 0.42268967669701607 and parameters: {'kernel_type': 'Matern', 'length_scale': 79.95391562218273, 'noise_level': 0.3715407183699248, 'constant_value': 89217.41313794687, 'nu': 1.5}. Best is trial 881 with value: 0.35916990930150405.
[I 2024-12-04 20:09:02,238] Trial 904 finished with value: 0.3592111564391849 and parameters: {'kernel_type': 'Matern', 'length_scale': 356.77853099452875, 'noise_level': 0.005961990622149201, 'constant_value': 4.47994405266178, 'nu': 0.5}. Best is trial 881 with value: 0.35916990930150405.
[I 2024-12-04 20:09:10,984] Trial 905 finished with value: 0.3592112533958585 and parameters: {'kernel_type': 'Matern', 'length_scale': 11230.811481946266, 'noise_level': 0.05782291950272466, 'constant_value': 2.2857359813777056, 'nu': 0.5}. Best is trial 881 with value: 0.35916990930150405.
[I 2024-12-04 20:09:11,039] Trial 903 finished with value: 1.0624161172781021 and parameters: {'kernel_type': 'Matern', 'length_scale': 0.018110112807652547, 'noise_level': 0.00297330194235686, 'constant_value': 2.5423807758974446e-07, 'nu': 2.5}. Best is trial 881 with value: 0.35916990930150405.
[I 2024-12-04 20:09:12,237] Trial 906 finished with value: 1.062416117192225 and parameters: {'kernel_type': 'Matern', 'length_scale': 122.11745664449502, 'noise_level': 0.0015623101710074863, 'constant_value': 0.10369268342693615, 'nu': 0.5}. Best is trial 881 with value: 0.35916990930150405.
[I 2024-12-04 20:09:15,688] Trial 907 finished with value: 0.35921094751464955 and parameters: {'kernel_type': 'Matern', 'length_scale': 100.17086491869081, 'noise_level': 0.0018318180786501962, 'constant_value': 29.10079419275892, 'nu': 0.5}. Best is trial 881 with value: 0.35916990930150405.
[I 2024-12-04 20:09:17,331] Trial 908 finished with value: 0.3592111886534582 and parameters: {'kernel_type': 'Matern', 'length_scale': 1673.530752465646, 'noise_level': 0.03467845111431585, 'constant_value': 4.174437581972814, 'nu': 0.5}. Best is trial 881 with value: 0.35916990930150405.
[I 2024-12-04 20:09:18,218] Trial 909 finished with value: 1.0624161173067155 and parameters: {'kernel_type': 'Matern', 'length_scale': 354.0555270166628, 'noise_level': 1.9108157764019964e-06, 'constant_value': 386.7884253155148, 'nu': 2.5}. Best is trial 881 with value: 0.35916990930150405.
[I 2024-12-04 20:09:20,220] Trial 910 finished with value: 0.35921122340252104 and parameters: {'kernel_type': 'Matern', 'length_scale': 0.8007797428207679, 'noise_level': 0.0013135402888323367, 'constant_value': 2.445107165982242, 'nu': 0.5}. Best is trial 881 with value: 0.35916990930150405.
[I 2024-12-04 20:09:23,414] Trial 912 finished with value: 0.4286834901496388 and parameters: {'kernel_type': 'RBF', 'length_scale': 102.18932438510318, 'noise_level': 0.7044355439639423, 'constant_value': 2.233023267552493, 'nu': 0.5}. Best is trial 881 with value: 0.35916990930150405.
[I 2024-12-04 20:09:25,664] Trial 913 finished with value: 0.35921126939419834 and parameters: {'kernel_type': 'Matern', 'length_scale': 0.8004727004052804, 'noise_level': 0.22453357114979353, 'constant_value': 8.452140175572227, 'nu': 0.5}. Best is trial 881 with value: 0.35916990930150405.
[I 2024-12-04 20:09:28,103] Trial 914 finished with value: 0.3592111099883002 and parameters: {'kernel_type': 'Matern', 'length_scale': 1.255230291620762, 'noise_level': 0.004002401055051579, 'constant_value': 52.095562731089785, 'nu': 0.5}. Best is trial 881 with value: 0.35916990930150405.
[I 2024-12-04 20:09:28,206] Trial 911 finished with value: 0.42868352247386776 and parameters: {'kernel_type': 'RBF', 'length_scale': 1.0675434302453388, 'noise_level': 5.1014910822862885e-09, 'constant_value': 5.726229231197863e-07, 'nu': 1.5}. Best is trial 881 with value: 0.35916990930150405.
[I 2024-12-04 20:09:32,381] Trial 915 finished with value: 1.0624161172521915 and parameters: {'kernel_type': 'Matern', 'length_scale': 21.79263240994861, 'noise_level': 0.004473887062925821, 'constant_value': 0.00278797943797366, 'nu': 0.5}. Best is trial 881 with value: 0.35916990930150405.
[I 2024-12-04 20:09:33,662] Trial 917 finished with value: 0.35921117871207175 and parameters: {'kernel_type': 'Matern', 'length_scale': 162.90273899565364, 'noise_level': 0.017118441914677995, 'constant_value': 238.16257729156996, 'nu': 0.5}. Best is trial 881 with value: 0.35916990930150405.
[I 2024-12-04 20:09:33,818] Trial 916 finished with value: 0.3592108389431097 and parameters: {'kernel_type': 'Matern', 'length_scale': 101.20053550613392, 'noise_level': 0.011706896403078667, 'constant_value': 0.26515214091771505, 'nu': 0.5}. Best is trial 881 with value: 0.35916990930150405.
[I 2024-12-04 20:09:38,715] Trial 920 finished with value: 0.3592108153384099 and parameters: {'kernel_type': 'Matern', 'length_scale': 26.169883933233535, 'noise_level': 0.0004227503234911344, 'constant_value': 22.57211925003244, 'nu': 0.5}. Best is trial 881 with value: 0.35916990930150405.
[I 2024-12-04 20:09:38,721] Trial 918 finished with value: 1.0624161172629076 and parameters: {'kernel_type': 'RBF', 'length_scale': 1.0725060838828651e-05, 'noise_level': 6.504885267928113e-10, 'constant_value': 4.4814951951368096e-07, 'nu': 2.5}. Best is trial 881 with value: 0.35916990930150405.
[I 2024-12-04 20:09:40,256] Trial 919 finished with value: 0.3592114940329328 and parameters: {'kernel_type': 'Matern', 'length_scale': 0.6796204092836524, 'noise_level': 3.708448501616284e-05, 'constant_value': 0.004273878930434354, 'nu': 0.5}. Best is trial 881 with value: 0.35916990930150405.
[I 2024-12-04 20:09:43,969] Trial 921 finished with value: 0.42868351181508685 and parameters: {'kernel_type': 'RBF', 'length_scale': 52.935502302339586, 'noise_level': 0.0045367863285860725, 'constant_value': 209.91690798193505, 'nu': 0.5}. Best is trial 881 with value: 0.35916990930150405.
[I 2024-12-04 20:09:44,456] Trial 922 finished with value: 0.35921124042093217 and parameters: {'kernel_type': 'Matern', 'length_scale': 429.74386849656145, 'noise_level': 0.6829476917882144, 'constant_value': 27.986654402304303, 'nu': 0.5}. Best is trial 881 with value: 0.35916990930150405.
[I 2024-12-04 20:09:45,153] Trial 923 finished with value: 0.35921132883660517 and parameters: {'kernel_type': 'Matern', 'length_scale': 48.69367516581176, 'noise_level': 0.0590285823064351, 'constant_value': 0.3561095383969438, 'nu': 0.5}. Best is trial 881 with value: 0.35916990930150405.
[I 2024-12-04 20:09:49,050] Trial 925 finished with value: 0.3592112413993029 and parameters: {'kernel_type': 'Matern', 'length_scale': 2.4311334330996397, 'noise_level': 0.2742180564693113, 'constant_value': 1.6088051283931843, 'nu': 0.5}. Best is trial 881 with value: 0.35916990930150405.
[I 2024-12-04 20:09:49,395] Trial 924 finished with value: 0.35921085381788537 and parameters: {'kernel_type': 'Matern', 'length_scale': 4.585289942926624, 'noise_level': 0.00976941229035283, 'constant_value': 14.853779817697829, 'nu': 0.5}. Best is trial 881 with value: 0.35916990930150405.
[I 2024-12-04 20:09:50,986] Trial 926 finished with value: 0.42268930842146785 and parameters: {'kernel_type': 'Matern', 'length_scale': 1.9448688388877549, 'noise_level': 0.14096928206628886, 'constant_value': 107.62842665165842, 'nu': 1.5}. Best is trial 881 with value: 0.35916990930150405.
[I 2024-12-04 20:09:53,041] Trial 928 finished with value: 1.0916566661835938 and parameters: {'kernel_type': 'Matern', 'length_scale': 571.4703614288188, 'noise_level': 7.963066815054391e-06, 'constant_value': 85803.5942812562, 'nu': 0.5}. Best is trial 881 with value: 0.35916990930150405.
[I 2024-12-04 20:09:54,980] Trial 927 finished with value: 0.3592112042822519 and parameters: {'kernel_type': 'Matern', 'length_scale': 103.64815494441467, 'noise_level': 0.027968467413877287, 'constant_value': 414.7582165097492, 'nu': 0.5}. Best is trial 881 with value: 0.35916990930150405.
[I 2024-12-04 20:09:57,513] Trial 931 finished with value: 1.0916566869344164 and parameters: {'kernel_type': 'Matern', 'length_scale': 0.5402435748224311, 'noise_level': 0.005754391492755035, 'constant_value': 46.7405812250084, 'nu': 0.5}. Best is trial 881 with value: 0.35916990930150405.
[I 2024-12-04 20:09:58,996] Trial 930 finished with value: 1.0624161172688305 and parameters: {'kernel_type': 'Matern', 'length_scale': 459.8190744514757, 'noise_level': 0.02049410856415139, 'constant_value': 0.1390632387907281, 'nu': 0.5}. Best is trial 881 with value: 0.35916990930150405.
