[I 2024-12-04 12:46:03,713] Trial 1607 finished with value: 0.42908777692947697 and parameters: {'n_estimators': 1460, 'learning_rate': 0.05548359292163184, 'max_depth': 7, 'min_samples_split': 2, 'min_samples_leaf': 2, 'subsample': 0.6729168549460716, 'max_features': 'log2'}. Best is trial 1454 with value: 0.30763307678022894.
[I 2024-12-04 12:46:03,763] Trial 1605 finished with value: 0.4089084956900975 and parameters: {'n_estimators': 1392, 'learning_rate': 0.06444687988883058, 'max_depth': 4, 'min_samples_split': 2, 'min_samples_leaf': 1, 'subsample': 0.7265962275765762, 'max_features': None}. Best is trial 1454 with value: 0.30763307678022894.
[I 2024-12-04 12:46:04,172] Trial 1618 finished with value: 0.576700553375534 and parameters: {'n_estimators': 915, 'learning_rate': 0.05135543360951616, 'max_depth': 4, 'min_samples_split': 10, 'min_samples_leaf': 5, 'subsample': 0.6428577170772088, 'max_features': 'log2'}. Best is trial 1454 with value: 0.30763307678022894.
[I 2024-12-04 12:46:06,721] Trial 1608 finished with value: 0.39062027428199625 and parameters: {'n_estimators': 1229, 'learning_rate': 0.09296659117674985, 'max_depth': 6, 'min_samples_split': 7, 'min_samples_leaf': 3, 'subsample': 0.9113740147228474, 'max_features': None}. Best is trial 1454 with value: 0.30763307678022894.
[I 2024-12-04 12:46:07,866] Trial 1614 finished with value: 0.38933822422103204 and parameters: {'n_estimators': 988, 'learning_rate': 0.09966126270196758, 'max_depth': 6, 'min_samples_split': 7, 'min_samples_leaf': 3, 'subsample': 0.7747944120340078, 'max_features': None}. Best is trial 1454 with value: 0.30763307678022894.
[I 2024-12-04 12:46:09,230] Trial 1617 finished with value: 0.4467479898618727 and parameters: {'n_estimators': 1075, 'learning_rate': 0.09785776164288915, 'max_depth': 10, 'min_samples_split': 2, 'min_samples_leaf': 3, 'subsample': 0.6903099063108545, 'max_features': 'log2'}. Best is trial 1454 with value: 0.30763307678022894.
[I 2024-12-04 12:46:09,633] Trial 1613 finished with value: 0.34175701030147376 and parameters: {'n_estimators': 1107, 'learning_rate': 0.07624122433668655, 'max_depth': 6, 'min_samples_split': 7, 'min_samples_leaf': 2, 'subsample': 0.6074014375120963, 'max_features': None}. Best is trial 1454 with value: 0.30763307678022894.
[I 2024-12-04 12:46:13,386] Trial 1611 finished with value: 0.3702316553069835 and parameters: {'n_estimators': 1277, 'learning_rate': 0.06019956474094144, 'max_depth': 7, 'min_samples_split': 2, 'min_samples_leaf': 4, 'subsample': 0.7442414363013754, 'max_features': None}. Best is trial 1454 with value: 0.30763307678022894.
[I 2024-12-04 12:46:13,390] Trial 1609 finished with value: 0.3507917794606396 and parameters: {'n_estimators': 1354, 'learning_rate': 0.09958561365315743, 'max_depth': 9, 'min_samples_split': 8, 'min_samples_leaf': 2, 'subsample': 0.8550915118875737, 'max_features': None}. Best is trial 1454 with value: 0.30763307678022894.
[I 2024-12-04 12:46:14,063] Trial 1626 finished with value: 0.38242716811992744 and parameters: {'n_estimators': 772, 'learning_rate': 0.06735325724108082, 'max_depth': 7, 'min_samples_split': 2, 'min_samples_leaf': 5, 'subsample': 0.6920673216073746, 'max_features': None}. Best is trial 1454 with value: 0.30763307678022894.
[I 2024-12-04 12:46:15,114] Trial 1629 finished with value: 0.5696146557452126 and parameters: {'n_estimators': 674, 'learning_rate': 0.011371411909008828, 'max_depth': 12, 'min_samples_split': 2, 'min_samples_leaf': 10, 'subsample': 0.7296047400411672, 'max_features': None}. Best is trial 1454 with value: 0.30763307678022894.
[I 2024-12-04 12:46:15,754] Trial 1610 finished with value: 0.39350762383302784 and parameters: {'n_estimators': 1373, 'learning_rate': 0.036386045469725764, 'max_depth': 5, 'min_samples_split': 3, 'min_samples_leaf': 5, 'subsample': 0.8681790641521842, 'max_features': None}. Best is trial 1454 with value: 0.30763307678022894.
[I 2024-12-04 12:46:19,706] Trial 1630 finished with value: 0.3934114516587546 and parameters: {'n_estimators': 801, 'learning_rate': 0.0630835500120962, 'max_depth': 7, 'min_samples_split': 6, 'min_samples_leaf': 3, 'subsample': 0.7884301849534143, 'max_features': None}. Best is trial 1454 with value: 0.30763307678022894.
[I 2024-12-04 12:46:20,675] Trial 1620 finished with value: 0.3830961851465599 and parameters: {'n_estimators': 1110, 'learning_rate': 0.04882704504888535, 'max_depth': 7, 'min_samples_split': 2, 'min_samples_leaf': 3, 'subsample': 0.7168828008563671, 'max_features': None}. Best is trial 1454 with value: 0.30763307678022894.
[I 2024-12-04 12:46:21,897] Trial 1627 finished with value: 0.3894065821613656 and parameters: {'n_estimators': 967, 'learning_rate': 0.05292063942653978, 'max_depth': 5, 'min_samples_split': 2, 'min_samples_leaf': 1, 'subsample': 0.7706797330071193, 'max_features': None}. Best is trial 1454 with value: 0.30763307678022894.
[I 2024-12-04 12:46:21,900] Trial 1621 finished with value: 0.3982761027201232 and parameters: {'n_estimators': 1192, 'learning_rate': 0.06423728048722356, 'max_depth': 6, 'min_samples_split': 2, 'min_samples_leaf': 1, 'subsample': 0.7600137318446429, 'max_features': None}. Best is trial 1454 with value: 0.30763307678022894.
[I 2024-12-04 12:46:22,740] Trial 1625 finished with value: 0.414460674501188 and parameters: {'n_estimators': 1064, 'learning_rate': 0.08395471958430671, 'max_depth': 3, 'min_samples_split': 14, 'min_samples_leaf': 3, 'subsample': 0.7977534064032391, 'max_features': None}. Best is trial 1454 with value: 0.30763307678022894.
[I 2024-12-04 12:46:25,642] Trial 1637 finished with value: 0.43415535951439016 and parameters: {'n_estimators': 845, 'learning_rate': 0.0899973998745079, 'max_depth': 5, 'min_samples_split': 4, 'min_samples_leaf': 3, 'subsample': 0.7524120367315348, 'max_features': 'sqrt'}. Best is trial 1454 with value: 0.30763307678022894.
[I 2024-12-04 12:46:25,766] Trial 1619 finished with value: 0.3929423265435213 and parameters: {'n_estimators': 1370, 'learning_rate': 0.09482957386396947, 'max_depth': 5, 'min_samples_split': 4, 'min_samples_leaf': 3, 'subsample': 0.6523738428663366, 'max_features': None}. Best is trial 1454 with value: 0.30763307678022894.
[I 2024-12-04 12:46:25,768] Trial 1633 finished with value: 0.3233078680744112 and parameters: {'n_estimators': 889, 'learning_rate': 0.05408133540747619, 'max_depth': 7, 'min_samples_split': 6, 'min_samples_leaf': 2, 'subsample': 0.8221020065671953, 'max_features': None}. Best is trial 1454 with value: 0.30763307678022894.
[I 2024-12-04 12:46:27,097] Trial 1616 finished with value: 0.3955500884910345 and parameters: {'n_estimators': 1498, 'learning_rate': 0.0916575901399144, 'max_depth': 6, 'min_samples_split': 2, 'min_samples_leaf': 3, 'subsample': 0.720541273312549, 'max_features': None}. Best is trial 1454 with value: 0.30763307678022894.
[I 2024-12-04 12:46:28,007] Trial 1615 finished with value: 0.39067103512426243 and parameters: {'n_estimators': 1486, 'learning_rate': 0.05928150212801684, 'max_depth': 6, 'min_samples_split': 7, 'min_samples_leaf': 3, 'subsample': 0.8365718896711214, 'max_features': None}. Best is trial 1454 with value: 0.30763307678022894.
[I 2024-12-04 12:46:29,436] Trial 1632 finished with value: 0.32845670697237217 and parameters: {'n_estimators': 1016, 'learning_rate': 0.06024082761063552, 'max_depth': 6, 'min_samples_split': 5, 'min_samples_leaf': 2, 'subsample': 0.7868578650700757, 'max_features': None}. Best is trial 1454 with value: 0.30763307678022894.
[I 2024-12-04 12:46:30,941] Trial 1638 finished with value: 0.4115543307521598 and parameters: {'n_estimators': 798, 'learning_rate': 0.08381462007517436, 'max_depth': 7, 'min_samples_split': 3, 'min_samples_leaf': 1, 'subsample': 0.7577279787268385, 'max_features': None}. Best is trial 1454 with value: 0.30763307678022894.
[I 2024-12-04 12:46:31,919] Trial 1622 finished with value: 0.3718469348436077 and parameters: {'n_estimators': 1350, 'learning_rate': 0.09138986896978095, 'max_depth': 8, 'min_samples_split': 2, 'min_samples_leaf': 4, 'subsample': 0.8610421254360033, 'max_features': None}. Best is trial 1454 with value: 0.30763307678022894.
[I 2024-12-04 12:46:31,979] Trial 1636 finished with value: 0.38060115299330316 and parameters: {'n_estimators': 909, 'learning_rate': 0.09393758331733477, 'max_depth': 7, 'min_samples_split': 7, 'min_samples_leaf': 1, 'subsample': 0.7632500200889671, 'max_features': None}. Best is trial 1454 with value: 0.30763307678022894.
[I 2024-12-04 12:46:33,409] Trial 1631 finished with value: 0.38649350124218596 and parameters: {'n_estimators': 1192, 'learning_rate': 0.09704828428181851, 'max_depth': 5, 'min_samples_split': 2, 'min_samples_leaf': 1, 'subsample': 0.715425156637, 'max_features': None}. Best is trial 1454 with value: 0.30763307678022894.
[I 2024-12-04 12:46:33,410] Trial 1642 finished with value: 0.5042904487663182 and parameters: {'n_estimators': 870, 'learning_rate': 0.08515678062544213, 'max_depth': 3, 'min_samples_split': 2, 'min_samples_leaf': 5, 'subsample': 0.6936713148552267, 'max_features': 'log2'}. Best is trial 1454 with value: 0.30763307678022894.
[I 2024-12-04 12:46:33,701] Trial 1641 finished with value: 0.47271086522906364 and parameters: {'n_estimators': 850, 'learning_rate': 0.08802346613759696, 'max_depth': 6, 'min_samples_split': 2, 'min_samples_leaf': 4, 'subsample': 0.6175437083814914, 'max_features': 'log2'}. Best is trial 1454 with value: 0.30763307678022894.
[I 2024-12-04 12:46:33,899] Trial 1634 finished with value: 0.3862550276704009 and parameters: {'n_estimators': 1006, 'learning_rate': 0.05969155370891129, 'max_depth': 9, 'min_samples_split': 5, 'min_samples_leaf': 3, 'subsample': 0.760017713882741, 'max_features': None}. Best is trial 1454 with value: 0.30763307678022894.
[I 2024-12-04 12:46:35,273] Trial 1628 finished with value: 0.3763453864735003 and parameters: {'n_estimators': 1324, 'learning_rate': 0.07895152792671511, 'max_depth': 6, 'min_samples_split': 9, 'min_samples_leaf': 4, 'subsample': 0.7484863347235046, 'max_features': None}. Best is trial 1454 with value: 0.30763307678022894.
[I 2024-12-04 12:46:36,022] Trial 1635 finished with value: 0.38699500547734356 and parameters: {'n_estimators': 1130, 'learning_rate': 0.05816872124362497, 'max_depth': 7, 'min_samples_split': 2, 'min_samples_leaf': 1, 'subsample': 0.7893019710167052, 'max_features': None}. Best is trial 1454 with value: 0.30763307678022894.
[I 2024-12-04 12:46:38,277] Trial 1623 finished with value: 0.41059988303802225 and parameters: {'n_estimators': 1468, 'learning_rate': 0.011383714185188432, 'max_depth': 10, 'min_samples_split': 3, 'min_samples_leaf': 7, 'subsample': 0.7506810512240829, 'max_features': None}. Best is trial 1454 with value: 0.30763307678022894.
[I 2024-12-04 12:46:41,848] Trial 1639 finished with value: 0.33190097289511333 and parameters: {'n_estimators': 1093, 'learning_rate': 0.061475826558895975, 'max_depth': 8, 'min_samples_split': 6, 'min_samples_leaf': 2, 'subsample': 0.8809827101119851, 'max_features': None}. Best is trial 1454 with value: 0.30763307678022894.
[I 2024-12-04 12:46:42,685] Trial 1650 finished with value: 0.39850269914223824 and parameters: {'n_estimators': 779, 'learning_rate': 0.07684110625095816, 'max_depth': 5, 'min_samples_split': 4, 'min_samples_leaf': 3, 'subsample': 0.7844423547357774, 'max_features': None}. Best is trial 1454 with value: 0.30763307678022894.
[I 2024-12-04 12:46:44,781] Trial 1648 finished with value: 0.34088840785020874 and parameters: {'n_estimators': 806, 'learning_rate': 0.09926471101663883, 'max_depth': 9, 'min_samples_split': 3, 'min_samples_leaf': 2, 'subsample': 0.7227361828718007, 'max_features': None}. Best is trial 1454 with value: 0.30763307678022894.
[I 2024-12-04 12:46:44,781] Trial 1645 finished with value: 0.4002998151168919 and parameters: {'n_estimators': 853, 'learning_rate': 0.05280065467547097, 'max_depth': 6, 'min_samples_split': 2, 'min_samples_leaf': 3, 'subsample': 0.7683702928743436, 'max_features': None}. Best is trial 1454 with value: 0.30763307678022894.
[I 2024-12-04 12:46:45,842] Trial 1643 finished with value: 0.33359910092557676 and parameters: {'n_estimators': 1144, 'learning_rate': 0.0942406270574137, 'max_depth': 6, 'min_samples_split': 9, 'min_samples_leaf': 2, 'subsample': 0.7167409942962314, 'max_features': None}. Best is trial 1454 with value: 0.30763307678022894.
[I 2024-12-04 12:46:47,130] Trial 1646 finished with value: 0.39237500930112124 and parameters: {'n_estimators': 1272, 'learning_rate': 0.09689596435136642, 'max_depth': 7, 'min_samples_split': 7, 'min_samples_leaf': 4, 'subsample': 0.6840966617626913, 'max_features': 'sqrt'}. Best is trial 1454 with value: 0.30763307678022894.
[I 2024-12-04 12:46:47,443] Trial 1655 finished with value: 0.7423881088938342 and parameters: {'n_estimators': 882, 'learning_rate': 0.03564101363589942, 'max_depth': 11, 'min_samples_split': 14, 'min_samples_leaf': 10, 'subsample': 0.7138970072925611, 'max_features': 'log2'}. Best is trial 1454 with value: 0.30763307678022894.
[I 2024-12-04 12:46:47,445] Trial 1649 finished with value: 0.395498978143303 and parameters: {'n_estimators': 854, 'learning_rate': 0.06346469126135693, 'max_depth': 7, 'min_samples_split': 3, 'min_samples_leaf': 1, 'subsample': 0.7554897300083662, 'max_features': None}. Best is trial 1454 with value: 0.30763307678022894.
[I 2024-12-04 12:46:49,223] Trial 1644 finished with value: 0.32624755415092344 and parameters: {'n_estimators': 1227, 'learning_rate': 0.06871177146747577, 'max_depth': 6, 'min_samples_split': 6, 'min_samples_leaf': 2, 'subsample': 0.7123780588754414, 'max_features': None}. Best is trial 1454 with value: 0.30763307678022894.
[I 2024-12-04 12:46:49,227] Trial 1658 finished with value: 0.4446013737038399 and parameters: {'n_estimators': 625, 'learning_rate': 0.060131082028276335, 'max_depth': 6, 'min_samples_split': 12, 'min_samples_leaf': 8, 'subsample': 0.6673284791018986, 'max_features': None}. Best is trial 1454 with value: 0.30763307678022894.
[I 2024-12-04 12:46:53,918] Trial 1656 finished with value: 0.3906560500489998 and parameters: {'n_estimators': 906, 'learning_rate': 0.09401418669937908, 'max_depth': 5, 'min_samples_split': 2, 'min_samples_leaf': 3, 'subsample': 0.6833883292557009, 'max_features': None}. Best is trial 1454 with value: 0.30763307678022894.
[I 2024-12-04 12:46:53,937] Trial 1669 finished with value: 0.7320369187604016 and parameters: {'n_estimators': 263, 'learning_rate': 0.0533744991674674, 'max_depth': 10, 'min_samples_split': 8, 'min_samples_leaf': 6, 'subsample': 0.8793938506743696, 'max_features': 'log2'}. Best is trial 1454 with value: 0.30763307678022894.
[I 2024-12-04 12:46:55,466] Trial 1671 finished with value: 0.5730522238773703 and parameters: {'n_estimators': 147, 'learning_rate': 0.038934233024670195, 'max_depth': 9, 'min_samples_split': 12, 'min_samples_leaf': 9, 'subsample': 0.6597550834032231, 'max_features': None}. Best is trial 1454 with value: 0.30763307678022894.
[I 2024-12-04 12:46:55,704] Trial 1662 finished with value: 0.4374950164176282 and parameters: {'n_estimators': 584, 'learning_rate': 0.0683371320329413, 'max_depth': 7, 'min_samples_split': 2, 'min_samples_leaf': 1, 'subsample': 0.6662078266075763, 'max_features': 'log2'}. Best is trial 1454 with value: 0.30763307678022894.
[I 2024-12-04 12:46:56,816] Trial 1647 finished with value: 0.3913652020416185 and parameters: {'n_estimators': 1340, 'learning_rate': 0.09775285704517152, 'max_depth': 4, 'min_samples_split': 6, 'min_samples_leaf': 1, 'subsample': 0.7501581756263727, 'max_features': None}. Best is trial 1454 with value: 0.30763307678022894.
[I 2024-12-04 12:46:56,820] Trial 1653 finished with value: 0.36804337736510745 and parameters: {'n_estimators': 1095, 'learning_rate': 0.08499996731179138, 'max_depth': 5, 'min_samples_split': 2, 'min_samples_leaf': 4, 'subsample': 0.8423697748054171, 'max_features': None}. Best is trial 1454 with value: 0.30763307678022894.
[I 2024-12-04 12:46:56,941] Trial 1640 finished with value: 0.38759812406523086 and parameters: {'n_estimators': 1481, 'learning_rate': 0.030905468464925395, 'max_depth': 8, 'min_samples_split': 13, 'min_samples_leaf': 6, 'subsample': 0.8846358189133868, 'max_features': None}. Best is trial 1454 with value: 0.30763307678022894.
[I 2024-12-04 12:46:57,861] Trial 1651 finished with value: 0.397941709639213 and parameters: {'n_estimators': 1438, 'learning_rate': 0.04943464716868767, 'max_depth': 4, 'min_samples_split': 6, 'min_samples_leaf': 1, 'subsample': 0.7011751346615979, 'max_features': 'sqrt'}. Best is trial 1454 with value: 0.30763307678022894.
[I 2024-12-04 12:47:00,357] Trial 1652 finished with value: 0.3331458663110447 and parameters: {'n_estimators': 1259, 'learning_rate': 0.07325699345956672, 'max_depth': 6, 'min_samples_split': 5, 'min_samples_leaf': 2, 'subsample': 0.6310160978943812, 'max_features': None}. Best is trial 1454 with value: 0.30763307678022894.
[I 2024-12-04 12:47:01,176] Trial 1664 finished with value: 0.38290386301763546 and parameters: {'n_estimators': 563, 'learning_rate': 0.09700836532948257, 'max_depth': 7, 'min_samples_split': 6, 'min_samples_leaf': 4, 'subsample': 0.7172797870507671, 'max_features': None}. Best is trial 1454 with value: 0.30763307678022894.
[I 2024-12-04 12:47:05,361] Trial 1663 finished with value: 0.3480017173637698 and parameters: {'n_estimators': 750, 'learning_rate': 0.06155699341526475, 'max_depth': 9, 'min_samples_split': 2, 'min_samples_leaf': 2, 'subsample': 0.9126448590498559, 'max_features': None}. Best is trial 1454 with value: 0.30763307678022894.
[I 2024-12-04 12:47:08,265] Trial 1654 finished with value: 0.3863746281440193 and parameters: {'n_estimators': 1404, 'learning_rate': 0.0936272618749667, 'max_depth': 7, 'min_samples_split': 7, 'min_samples_leaf': 3, 'subsample': 0.7842740916124739, 'max_features': None}. Best is trial 1454 with value: 0.30763307678022894.
[I 2024-12-04 12:47:08,801] Trial 1657 finished with value: 0.4557880234610022 and parameters: {'n_estimators': 1400, 'learning_rate': 0.013411540379006092, 'max_depth': 8, 'min_samples_split': 16, 'min_samples_leaf': 5, 'subsample': 0.8013293992108771, 'max_features': 'sqrt'}. Best is trial 1454 with value: 0.30763307678022894.
[I 2024-12-04 12:47:09,882] Trial 1687 finished with value: 0.6741900479858339 and parameters: {'n_estimators': 109, 'learning_rate': 0.01120901678709419, 'max_depth': 10, 'min_samples_split': 8, 'min_samples_leaf': 10, 'subsample': 0.7828613353911195, 'max_features': None}. Best is trial 1454 with value: 0.30763307678022894.
[I 2024-12-04 12:47:11,030] Trial 1659 finished with value: 0.36004064279932485 and parameters: {'n_estimators': 1349, 'learning_rate': 0.09621865045675276, 'max_depth': 5, 'min_samples_split': 2, 'min_samples_leaf': 1, 'subsample': 0.6668166080705412, 'max_features': None}. Best is trial 1454 with value: 0.30763307678022894.
[I 2024-12-04 12:47:12,129] Trial 1660 finished with value: 0.397546433220031 and parameters: {'n_estimators': 1218, 'learning_rate': 0.09340536306527895, 'max_depth': 6, 'min_samples_split': 6, 'min_samples_leaf': 3, 'subsample': 0.747079456618796, 'max_features': None}. Best is trial 1454 with value: 0.30763307678022894.
[I 2024-12-04 12:47:13,664] Trial 1670 finished with value: 0.40951264503944207 and parameters: {'n_estimators': 1021, 'learning_rate': 0.05170310136962967, 'max_depth': 8, 'min_samples_split': 7, 'min_samples_leaf': 2, 'subsample': 0.810085572598678, 'max_features': 'log2'}. Best is trial 1454 with value: 0.30763307678022894.
[I 2024-12-04 12:47:13,690] Trial 1661 finished with value: 0.33029335352138 and parameters: {'n_estimators': 1201, 'learning_rate': 0.09591963044100763, 'max_depth': 6, 'min_samples_split': 5, 'min_samples_leaf': 2, 'subsample': 0.6392810578595439, 'max_features': None}. Best is trial 1454 with value: 0.30763307678022894.
[I 2024-12-04 12:47:16,437] Trial 1686 finished with value: 0.8314703120526573 and parameters: {'n_estimators': 350, 'learning_rate': 0.011966142240909545, 'max_depth': 9, 'min_samples_split': 3, 'min_samples_leaf': 10, 'subsample': 0.6875571664092388, 'max_features': 'sqrt'}. Best is trial 1454 with value: 0.30763307678022894.
[I 2024-12-04 12:47:17,249] Trial 1666 finished with value: 0.3838699910114362 and parameters: {'n_estimators': 1088, 'learning_rate': 0.041415783972469616, 'max_depth': 6, 'min_samples_split': 4, 'min_samples_leaf': 1, 'subsample': 0.6791346640048261, 'max_features': None}. Best is trial 1454 with value: 0.30763307678022894.
[I 2024-12-04 12:47:17,982] Trial 1678 finished with value: 0.40402135613528756 and parameters: {'n_estimators': 573, 'learning_rate': 0.07376451710812185, 'max_depth': 4, 'min_samples_split': 8, 'min_samples_leaf': 3, 'subsample': 0.7440160521055625, 'max_features': None}. Best is trial 1454 with value: 0.30763307678022894.
[I 2024-12-04 12:47:18,387] Trial 1691 finished with value: 0.8551456779251198 and parameters: {'n_estimators': 347, 'learning_rate': 0.01030243317764659, 'max_depth': 6, 'min_samples_split': 18, 'min_samples_leaf': 2, 'subsample': 0.9638990951829036, 'max_features': 'log2'}. Best is trial 1454 with value: 0.30763307678022894.
[I 2024-12-04 12:47:18,393] Trial 1667 finished with value: 0.42341945163029315 and parameters: {'n_estimators': 1241, 'learning_rate': 0.06166633067268176, 'max_depth': 5, 'min_samples_split': 2, 'min_samples_leaf': 4, 'subsample': 0.6547915101793748, 'max_features': 'sqrt'}. Best is trial 1454 with value: 0.30763307678022894.
[I 2024-12-04 12:47:21,737] Trial 1676 finished with value: 0.3526042404920677 and parameters: {'n_estimators': 817, 'learning_rate': 0.0796092547547165, 'max_depth': 6, 'min_samples_split': 15, 'min_samples_leaf': 2, 'subsample': 0.7559661452718323, 'max_features': None}. Best is trial 1454 with value: 0.30763307678022894.
