[I 2024-12-03 18:45:22,751] Trial 686 finished with value: 0.35966401378526996 and parameters: {'kernel': 'rbf', 'C': 99.60427188214938, 'gamma': 0.03992268771258379, 'epsilon': 0.08813802243249108}. Best is trial 88 with value: 0.3542875001421725.
[I 2024-12-03 18:45:23,262] Trial 685 finished with value: 0.37309830441014435 and parameters: {'kernel': 'rbf', 'C': 92.41018464501387, 'gamma': 0.02110862000032329, 'epsilon': 0.02255052388887317}. Best is trial 88 with value: 0.3542875001421725.
[I 2024-12-03 18:45:23,560] Trial 690 finished with value: 0.42038652827748973 and parameters: {'kernel': 'rbf', 'C': 20.610142331375787, 'gamma': 0.029238865783284634, 'epsilon': 0.07544659594795886}. Best is trial 88 with value: 0.3542875001421725.
[I 2024-12-03 18:45:23,665] Trial 691 finished with value: 0.6678744326701254 and parameters: {'kernel': 'rbf', 'C': 97.70102117625463, 'gamma': 0.09595416917529603, 'epsilon': 0.7747992838139738}. Best is trial 88 with value: 0.3542875001421725.
[I 2024-12-03 18:45:25,479] Trial 694 finished with value: 0.43260914679008317 and parameters: {'kernel': 'rbf', 'C': 94.67842786186786, 'gamma': 0.0057455632266830755, 'epsilon': 0.2580184326048589}. Best is trial 88 with value: 0.3542875001421725.
[I 2024-12-03 18:45:25,707] Trial 696 finished with value: 0.43438666356175504 and parameters: {'kernel': 'rbf', 'C': 88.06273033157763, 'gamma': 0.13706100840749488, 'epsilon': 0.06060425591805266}. Best is trial 88 with value: 0.3542875001421725.
[I 2024-12-03 18:45:26,048] Trial 695 finished with value: 0.43255505684419643 and parameters: {'kernel': 'rbf', 'C': 12.815103111257972, 'gamma': 0.019929499859885527, 'epsilon': 0.27014255883090943}. Best is trial 88 with value: 0.3542875001421725.
[I 2024-12-03 18:45:26,431] Trial 692 finished with value: 0.3967075190332011 and parameters: {'kernel': 'rbf', 'C': 22.44809397547165, 'gamma': 0.04236350075201569, 'epsilon': 0.12549290456982848}. Best is trial 88 with value: 0.3542875001421725.
[I 2024-12-03 18:45:27,558] Trial 698 finished with value: 0.6410847817530553 and parameters: {'kernel': 'rbf', 'C': 89.9001132001157, 'gamma': 0.3569462084102778, 'epsilon': 0.2280119419488941}. Best is trial 88 with value: 0.3542875001421725.
[I 2024-12-03 18:45:28,138] Trial 699 finished with value: 0.3663838721803974 and parameters: {'kernel': 'rbf', 'C': 82.25572110814416, 'gamma': 0.031851887155738105, 'epsilon': 0.18878015833124023}. Best is trial 88 with value: 0.3542875001421725.
[I 2024-12-03 18:45:28,142] Trial 697 finished with value: 0.7263985641646822 and parameters: {'kernel': 'linear', 'C': 5.278134094773223, 'gamma': 0.020376823276546784, 'epsilon': 0.47229750629231765}. Best is trial 88 with value: 0.3542875001421725.
[I 2024-12-03 18:45:28,143] Trial 702 finished with value: 0.410311648222288 and parameters: {'kernel': 'rbf', 'C': 81.02825873189549, 'gamma': 0.0432568924465572, 'epsilon': 0.43590650346902293}. Best is trial 88 with value: 0.3542875001421725.
[I 2024-12-03 18:45:28,649] Trial 646 finished with value: 0.7546945950332755 and parameters: {'kernel': 'linear', 'C': 46.969918763233885, 'gamma': 0.12324906268371703, 'epsilon': 0.2031596420965091}. Best is trial 88 with value: 0.3542875001421725.
[I 2024-12-03 18:45:28,836] Trial 701 finished with value: 0.35547457132009924 and parameters: {'kernel': 'rbf', 'C': 81.97046011425181, 'gamma': 0.046611648314416214, 'epsilon': 0.16377983747330513}. Best is trial 88 with value: 0.3542875001421725.
[I 2024-12-03 18:45:30,008] Trial 703 finished with value: 0.38393982386846803 and parameters: {'kernel': 'rbf', 'C': 84.87175145220816, 'gamma': 0.08185912812073272, 'epsilon': 0.07406314807963271}. Best is trial 88 with value: 0.3542875001421725.
[I 2024-12-03 18:45:30,232] Trial 704 finished with value: 0.366828209301401 and parameters: {'kernel': 'rbf', 'C': 93.1612302967121, 'gamma': 0.026635931220358792, 'epsilon': 0.06744798192298206}. Best is trial 88 with value: 0.3542875001421725.
[I 2024-12-03 18:45:30,756] Trial 705 finished with value: 0.40093337580334626 and parameters: {'kernel': 'rbf', 'C': 89.07861859276552, 'gamma': 0.0934364725526706, 'epsilon': 0.17785113695583452}. Best is trial 88 with value: 0.3542875001421725.
[I 2024-12-03 18:45:31,049] Trial 706 finished with value: 0.44517752451895853 and parameters: {'kernel': 'rbf', 'C': 12.953841217947964, 'gamma': 0.11210205037436399, 'epsilon': 0.18045030452838515}. Best is trial 88 with value: 0.3542875001421725.
[I 2024-12-03 18:45:31,543] Trial 707 finished with value: 0.3923367297595327 and parameters: {'kernel': 'rbf', 'C': 98.31062029166289, 'gamma': 0.09039321403158682, 'epsilon': 0.06716574984617518}. Best is trial 88 with value: 0.3542875001421725.
[I 2024-12-03 18:45:32,192] Trial 709 finished with value: 0.36564062362058736 and parameters: {'kernel': 'rbf', 'C': 96.2150940030372, 'gamma': 0.030396654021995193, 'epsilon': 0.14295820003214338}. Best is trial 88 with value: 0.3542875001421725.
[I 2024-12-03 18:45:32,449] Trial 708 finished with value: 1.07262790253895 and parameters: {'kernel': 'poly', 'C': 0.013955049562272259, 'gamma': 0.0004699954146185159, 'epsilon': 0.0012008891391776968}. Best is trial 88 with value: 0.3542875001421725.
[I 2024-12-03 18:45:33,402] Trial 710 finished with value: 0.42684300069842596 and parameters: {'kernel': 'rbf', 'C': 95.23991558993082, 'gamma': 0.008071994170843732, 'epsilon': 0.15392043946354367}. Best is trial 88 with value: 0.3542875001421725.
[I 2024-12-03 18:45:33,827] Trial 714 finished with value: 0.4174925850277371 and parameters: {'kernel': 'rbf', 'C': 17.07150514497104, 'gamma': 0.09666346063355571, 'epsilon': 0.0959453418395981}. Best is trial 88 with value: 0.3542875001421725.
[I 2024-12-03 18:45:33,828] Trial 712 finished with value: 0.43231816850094446 and parameters: {'kernel': 'rbf', 'C': 91.80622758345716, 'gamma': 0.06257134902959686, 'epsilon': 0.4219352249719227}. Best is trial 88 with value: 0.3542875001421725.
[I 2024-12-03 18:45:33,886] Trial 713 finished with value: 0.4132488890991133 and parameters: {'kernel': 'rbf', 'C': 14.066538337622742, 'gamma': 0.054315410587655565, 'epsilon': 0.2006193557352623}. Best is trial 88 with value: 0.3542875001421725.
[I 2024-12-03 18:45:35,214] Trial 715 finished with value: 0.43905742377466905 and parameters: {'kernel': 'rbf', 'C': 12.39422458519973, 'gamma': 0.021155358957613, 'epsilon': 0.19314720554357195}. Best is trial 88 with value: 0.3542875001421725.
[I 2024-12-03 18:45:36,463] Trial 718 finished with value: 0.40635222435812834 and parameters: {'kernel': 'rbf', 'C': 18.15898516974682, 'gamma': 0.013511160972888889, 'epsilon': 0.056931070403550006}. Best is trial 88 with value: 0.3542875001421725.
[I 2024-12-03 18:45:36,525] Trial 720 finished with value: 157.4783051653648 and parameters: {'kernel': 'sigmoid', 'C': 11.276477215021526, 'gamma': 0.013636638560730477, 'epsilon': 0.05069637825082083}. Best is trial 88 with value: 0.3542875001421725.
[I 2024-12-03 18:45:36,711] Trial 717 finished with value: 0.36974722448925923 and parameters: {'kernel': 'rbf', 'C': 89.2498286609425, 'gamma': 0.060806947875247215, 'epsilon': 0.19486718943133238}. Best is trial 88 with value: 0.3542875001421725.
[I 2024-12-03 18:45:37,102] Trial 719 finished with value: 0.36301373032174955 and parameters: {'kernel': 'rbf', 'C': 97.86758700750217, 'gamma': 0.03475324939560838, 'epsilon': 0.11033888497721062}. Best is trial 88 with value: 0.3542875001421725.
[I 2024-12-03 18:45:37,557] Trial 721 finished with value: 1218.6360358156742 and parameters: {'kernel': 'sigmoid', 'C': 65.96408531795632, 'gamma': 0.024670322881571075, 'epsilon': 0.2896492478138809}. Best is trial 88 with value: 0.3542875001421725.
[I 2024-12-03 18:45:38,417] Trial 723 finished with value: 0.4032182516779785 and parameters: {'kernel': 'rbf', 'C': 16.628983588142585, 'gamma': 0.05736269250865108, 'epsilon': 0.15371869066325658}. Best is trial 88 with value: 0.3542875001421725.
[I 2024-12-03 18:45:38,748] Trial 725 finished with value: 0.44894744476224097 and parameters: {'kernel': 'rbf', 'C': 23.324181686109632, 'gamma': 0.013846714064172372, 'epsilon': 0.4495648582271204}. Best is trial 88 with value: 0.3542875001421725.
[I 2024-12-03 18:45:39,160] Trial 722 finished with value: 0.729974232733695 and parameters: {'kernel': 'linear', 'C': 2.3733887706951893, 'gamma': 0.39270471929981937, 'epsilon': 0.2716828909178289}. Best is trial 88 with value: 0.3542875001421725.
[I 2024-12-03 18:45:39,162] Trial 724 finished with value: 0.4732537176407097 and parameters: {'kernel': 'rbf', 'C': 17.41632098422802, 'gamma': 0.060913017911941814, 'epsilon': 0.4923801127985271}. Best is trial 88 with value: 0.3542875001421725.
[I 2024-12-03 18:45:39,518] Trial 473 finished with value: 0.802174232482279 and parameters: {'kernel': 'linear', 'C': 85.5945083964529, 'gamma': 0.012052882650507466, 'epsilon': 0.045620001587953284}. Best is trial 88 with value: 0.3542875001421725.
[I 2024-12-03 18:45:39,721] Trial 726 finished with value: 0.4228533003643852 and parameters: {'kernel': 'rbf', 'C': 17.834490804603146, 'gamma': 0.01680093599594296, 'epsilon': 0.07775127819887462}. Best is trial 88 with value: 0.3542875001421725.
[I 2024-12-03 18:45:40,083] Trial 716 finished with value: 0.7849516105320689 and parameters: {'kernel': 'linear', 'C': 8.329828911422847, 'gamma': 0.008317595817036394, 'epsilon': 0.1456537664947933}. Best is trial 88 with value: 0.3542875001421725.
[I 2024-12-03 18:45:40,435] Trial 727 finished with value: 21.883925330001038 and parameters: {'kernel': 'sigmoid', 'C': 0.7344408746015597, 'gamma': 0.5155506084344894, 'epsilon': 0.038011399576278554}. Best is trial 88 with value: 0.3542875001421725.
[I 2024-12-03 18:45:40,872] Trial 728 finished with value: 0.8770637695860357 and parameters: {'kernel': 'linear', 'C': 0.0041033090452022155, 'gamma': 0.00014634865757709903, 'epsilon': 0.08972747977942123}. Best is trial 88 with value: 0.3542875001421725.
[I 2024-12-03 18:45:41,462] Trial 729 finished with value: 0.47608582541866 and parameters: {'kernel': 'rbf', 'C': 13.030530500350073, 'gamma': 0.15838876755364822, 'epsilon': 0.05357365695192192}. Best is trial 88 with value: 0.3542875001421725.
[I 2024-12-03 18:45:41,707] Trial 730 finished with value: 0.4375779246890052 and parameters: {'kernel': 'rbf', 'C': 96.13693602351398, 'gamma': 0.10893461057712843, 'epsilon': 0.22584687268569595}. Best is trial 88 with value: 0.3542875001421725.
[I 2024-12-03 18:45:42,364] Trial 731 finished with value: 0.8131469672310028 and parameters: {'kernel': 'linear', 'C': 0.2351393280004476, 'gamma': 0.05541825031847652, 'epsilon': 0.06840356560541942}. Best is trial 88 with value: 0.3542875001421725.
[I 2024-12-03 18:45:43,139] Trial 732 finished with value: 0.4225771716675081 and parameters: {'kernel': 'rbf', 'C': 99.484316276547, 'gamma': 0.00687523148329181, 'epsilon': 0.052166074606879984}. Best is trial 88 with value: 0.3542875001421725.
[I 2024-12-03 18:45:43,139] Trial 733 finished with value: 0.41751054568841467 and parameters: {'kernel': 'rbf', 'C': 17.002970242913268, 'gamma': 0.03131194055240285, 'epsilon': 0.3903559455206861}. Best is trial 88 with value: 0.3542875001421725.
[I 2024-12-03 18:45:43,632] Trial 735 finished with value: 0.3697129991425327 and parameters: {'kernel': 'rbf', 'C': 89.7771294085562, 'gamma': 0.04856643183693151, 'epsilon': 0.2655074177690115}. Best is trial 88 with value: 0.3542875001421725.
[I 2024-12-03 18:45:44,169] Trial 736 finished with value: 1.047700840147214 and parameters: {'kernel': 'poly', 'C': 4.991936104911929, 'gamma': 0.00022113329015959108, 'epsilon': 0.06447296341980754}. Best is trial 88 with value: 0.3542875001421725.
[I 2024-12-03 18:45:44,282] Trial 734 finished with value: 0.36822651882687313 and parameters: {'kernel': 'rbf', 'C': 95.61624263694743, 'gamma': 0.02923316426049039, 'epsilon': 0.042031053768127775}. Best is trial 88 with value: 0.3542875001421725.
[I 2024-12-03 18:45:44,777] Trial 738 finished with value: 0.4055356756252321 and parameters: {'kernel': 'rbf', 'C': 16.59631258355034, 'gamma': 0.0640433632997138, 'epsilon': 0.18354115728371045}. Best is trial 88 with value: 0.3542875001421725.
[I 2024-12-03 18:45:45,450] Trial 740 finished with value: 0.41891469175337565 and parameters: {'kernel': 'rbf', 'C': 24.59989385450236, 'gamma': 0.013285909263811513, 'epsilon': 0.3035951742363041}. Best is trial 88 with value: 0.3542875001421725.
[I 2024-12-03 18:45:45,622] Trial 739 finished with value: 0.501925358693478 and parameters: {'kernel': 'rbf', 'C': 89.103622044674, 'gamma': 0.19213425582768978, 'epsilon': 0.09696180245976556}. Best is trial 88 with value: 0.3542875001421725.
[I 2024-12-03 18:45:46,051] Trial 737 finished with value: 3.2581450655236437 and parameters: {'kernel': 'poly', 'C': 5.272330971128729, 'gamma': 0.022077216090156296, 'epsilon': 0.2914422686604157}. Best is trial 88 with value: 0.3542875001421725.
[I 2024-12-03 18:45:46,838] Trial 741 finished with value: 0.687216501951462 and parameters: {'kernel': 'rbf', 'C': 94.04306443668393, 'gamma': 0.2608556928250941, 'epsilon': 0.55731717919376}. Best is trial 88 with value: 0.3542875001421725.
[I 2024-12-03 18:45:47,702] Trial 744 finished with value: 0.3599430789334425 and parameters: {'kernel': 'rbf', 'C': 88.17296388511978, 'gamma': 0.038883115298361796, 'epsilon': 0.1311708607901043}. Best is trial 88 with value: 0.3542875001421725.
[I 2024-12-03 18:45:47,703] Trial 743 finished with value: 0.3700162441781555 and parameters: {'kernel': 'rbf', 'C': 81.54763594814648, 'gamma': 0.023169084724504546, 'epsilon': 0.32079956791381503}. Best is trial 88 with value: 0.3542875001421725.
[I 2024-12-03 18:45:47,743] Trial 742 finished with value: 0.38241373632688397 and parameters: {'kernel': 'rbf', 'C': 96.90778743541534, 'gamma': 0.01715635683188132, 'epsilon': 0.07236352816970117}. Best is trial 88 with value: 0.3542875001421725.
[I 2024-12-03 18:45:48,482] Trial 745 finished with value: 0.41234757464144267 and parameters: {'kernel': 'rbf', 'C': 15.190874470471778, 'gamma': 0.07874647113581293, 'epsilon': 0.07446261558506087}. Best is trial 88 with value: 0.3542875001421725.
[I 2024-12-03 18:45:48,686] Trial 746 finished with value: 0.42268645591065224 and parameters: {'kernel': 'rbf', 'C': 90.80735531306871, 'gamma': 0.006995391212683999, 'epsilon': 0.19225263796390507}. Best is trial 88 with value: 0.3542875001421725.
[I 2024-12-03 18:45:48,869] Trial 748 finished with value: 0.37689128391833115 and parameters: {'kernel': 'rbf', 'C': 98.53184122650592, 'gamma': 0.015246574042376988, 'epsilon': 0.3700491606219225}. Best is trial 88 with value: 0.3542875001421725.
[I 2024-12-03 18:45:49,929] Trial 747 finished with value: 0.3583876782882037 and parameters: {'kernel': 'rbf', 'C': 88.53045226880397, 'gamma': 0.04106022346866965, 'epsilon': 0.12001816698273703}. Best is trial 88 with value: 0.3542875001421725.
[I 2024-12-03 18:45:50,169] Trial 750 finished with value: 0.4294113485995711 and parameters: {'kernel': 'rbf', 'C': 14.36151096852344, 'gamma': 0.0235582768616441, 'epsilon': 0.07267617066243456}. Best is trial 88 with value: 0.3542875001421725.
[I 2024-12-03 18:45:50,687] Trial 749 finished with value: 0.48153249707187434 and parameters: {'kernel': 'rbf', 'C': 26.180276484370225, 'gamma': 0.1592418819614133, 'epsilon': 0.1602393267622152}. Best is trial 88 with value: 0.3542875001421725.
[I 2024-12-03 18:45:50,979] Trial 751 finished with value: 2247.2328261346493 and parameters: {'kernel': 'sigmoid', 'C': 90.01494210285277, 'gamma': 0.2982340715316886, 'epsilon': 0.030574186140191563}. Best is trial 88 with value: 0.3542875001421725.
[I 2024-12-03 18:45:51,446] Trial 752 finished with value: 0.3896678828184867 and parameters: {'kernel': 'rbf', 'C': 99.95111188244557, 'gamma': 0.08867638298836006, 'epsilon': 0.15050524237811003}. Best is trial 88 with value: 0.3542875001421725.
[I 2024-12-03 18:45:52,103] Trial 754 finished with value: 0.3580322999930729 and parameters: {'kernel': 'rbf', 'C': 89.35403233254587, 'gamma': 0.03849905457682057, 'epsilon': 0.2355709228224811}. Best is trial 88 with value: 0.3542875001421725.
[I 2024-12-03 18:45:52,196] Trial 755 finished with value: 0.45144070704489797 and parameters: {'kernel': 'rbf', 'C': 21.843460839359444, 'gamma': 0.07969678506104681, 'epsilon': 0.3613003502751546}. Best is trial 88 with value: 0.3542875001421725.
[I 2024-12-03 18:45:53,021] Trial 756 finished with value: 0.374416684154719 and parameters: {'kernel': 'rbf', 'C': 95.49654746294291, 'gamma': 0.06408337523301275, 'epsilon': 0.20070994106765128}. Best is trial 88 with value: 0.3542875001421725.
[I 2024-12-03 18:45:53,474] Trial 757 finished with value: 0.4084406651926927 and parameters: {'kernel': 'rbf', 'C': 17.67556709385559, 'gamma': 0.022627456144413895, 'epsilon': 0.3148696884562177}. Best is trial 88 with value: 0.3542875001421725.
[I 2024-12-03 18:45:54,471] Trial 760 finished with value: 0.6121156985224153 and parameters: {'kernel': 'rbf', 'C': 1.14166732840989, 'gamma': 0.1865732273702074, 'epsilon': 0.2712834924537819}. Best is trial 88 with value: 0.3542875001421725.
[I 2024-12-03 18:45:54,636] Trial 761 finished with value: 0.4016005276270933 and parameters: {'kernel': 'rbf', 'C': 20.067308720961346, 'gamma': 0.058175297053211526, 'epsilon': 0.2316372989653679}. Best is trial 88 with value: 0.3542875001421725.
[I 2024-12-03 18:45:55,104] Trial 759 finished with value: 2.702435101773205 and parameters: {'kernel': 'poly', 'C': 5.729042928719778, 'gamma': 0.01736589999560662, 'epsilon': 0.027627989575830673}. Best is trial 88 with value: 0.3542875001421725.
[I 2024-12-03 18:45:55,105] Trial 762 finished with value: 1.0713671698389997 and parameters: {'kernel': 'sigmoid', 'C': 0.007420682859171714, 'gamma': 0.00010902486992185354, 'epsilon': 0.03885507945063645}. Best is trial 88 with value: 0.3542875001421725.
[I 2024-12-03 18:45:55,405] Trial 763 finished with value: 0.620690591193068 and parameters: {'kernel': 'rbf', 'C': 1.8043018439609615, 'gamma': 0.0017472399821709642, 'epsilon': 0.001695323382975979}. Best is trial 88 with value: 0.3542875001421725.
[I 2024-12-03 18:45:55,967] Trial 764 finished with value: 0.44793576349081426 and parameters: {'kernel': 'rbf', 'C': 93.12271963657871, 'gamma': 0.01649503052432707, 'epsilon': 0.6196698294668992}. Best is trial 88 with value: 0.3542875001421725.
[I 2024-12-03 18:45:56,463] Trial 765 finished with value: 0.3975014328552239 and parameters: {'kernel': 'rbf', 'C': 81.25896700765944, 'gamma': 0.057659026864374095, 'epsilon': 0.3383170098112913}. Best is trial 88 with value: 0.3542875001421725.
[I 2024-12-03 18:45:57,038] Trial 766 finished with value: 0.3697409552687943 and parameters: {'kernel': 'rbf', 'C': 99.2298558240794, 'gamma': 0.019337191794388645, 'epsilon': 0.30092116867928975}. Best is trial 88 with value: 0.3542875001421725.
[I 2024-12-03 18:45:57,097] Trial 767 finished with value: 0.8906963952629189 and parameters: {'kernel': 'linear', 'C': 0.003327079484957692, 'gamma': 0.005930266677143047, 'epsilon': 0.0019922733370179952}. Best is trial 88 with value: 0.3542875001421725.
[I 2024-12-03 18:45:57,924] Trial 768 finished with value: 0.40482491850393815 and parameters: {'kernel': 'rbf', 'C': 86.00873709257777, 'gamma': 0.09303007723077639, 'epsilon': 0.1940772243271601}. Best is trial 88 with value: 0.3542875001421725.
[I 2024-12-03 18:45:58,641] Trial 769 finished with value: 0.3974982811546385 and parameters: {'kernel': 'rbf', 'C': 98.69988198916893, 'gamma': 0.08932969449057192, 'epsilon': 0.18565360374013246}. Best is trial 88 with value: 0.3542875001421725.
[I 2024-12-03 18:45:59,123] Trial 770 finished with value: 0.4006445919915834 and parameters: {'kernel': 'rbf', 'C': 17.30613027766883, 'gamma': 0.0068458440334564314, 'epsilon': 0.12071857345621116}. Best is trial 88 with value: 0.3542875001421725.
[I 2024-12-03 18:45:59,553] Trial 772 finished with value: 0.8255096728838466 and parameters: {'kernel': 'linear', 'C': 0.012674135436714912, 'gamma': 0.975320992806283, 'epsilon': 0.826722464042189}. Best is trial 88 with value: 0.3542875001421725.
[I 2024-12-03 18:45:59,699] Trial 771 finished with value: 0.40583413455550654 and parameters: {'kernel': 'rbf', 'C': 16.075474136333334, 'gamma': 0.01036236530275948, 'epsilon': 0.13862371801281}. Best is trial 88 with value: 0.3542875001421725.
[I 2024-12-03 18:46:00,662] Trial 773 finished with value: 0.42214377244375734 and parameters: {'kernel': 'rbf', 'C': 15.267470353367443, 'gamma': 0.04765886757329589, 'epsilon': 0.07716329953051425}. Best is trial 88 with value: 0.3542875001421725.
[I 2024-12-03 18:46:00,740] Trial 774 finished with value: 0.40189515361307065 and parameters: {'kernel': 'rbf', 'C': 31.098223403252682, 'gamma': 0.03083248963403688, 'epsilon': 0.07075643213471086}. Best is trial 88 with value: 0.3542875001421725.
[I 2024-12-03 18:46:01,247] Trial 775 finished with value: 0.3986506535925388 and parameters: {'kernel': 'rbf', 'C': 93.65219581554925, 'gamma': 0.10045099109691027, 'epsilon': 0.11779967154734591}. Best is trial 88 with value: 0.3542875001421725.
[I 2024-12-03 18:46:01,773] Trial 777 finished with value: 1.7643403989191813 and parameters: {'kernel': 'poly', 'C': 0.15864019939691826, 'gamma': 0.01841945066410339, 'epsilon': 0.08663885953197767}. Best is trial 88 with value: 0.3542875001421725.
[I 2024-12-03 18:46:02,088] Trial 776 finished with value: 0.3674684129559306 and parameters: {'kernel': 'rbf', 'C': 97.66237242823047, 'gamma': 0.04370953793973556, 'epsilon': 0.2740135311845539}. Best is trial 88 with value: 0.3542875001421725.
[I 2024-12-03 18:46:02,464] Trial 778 finished with value: 0.5872090518889149 and parameters: {'kernel': 'rbf', 'C': 16.292980727969155, 'gamma': 0.2868196043766009, 'epsilon': 0.15419520394865976}. Best is trial 88 with value: 0.3542875001421725.
