[I 2024-12-04 12:02:39,257] Trial 577 finished with value: 0.41289910059386803 and parameters: {'n_estimators': 180, 'max_depth': 50, 'min_samples_split': 5, 'min_samples_leaf': 2, 'max_features': None, 'bootstrap': False, 'criterion': 'squared_error'}. Best is trial 341 with value: 0.2909369124469028.
[I 2024-12-04 12:02:39,426] Trial 582 finished with value: 0.29972601788124026 and parameters: {'n_estimators': 314, 'max_depth': 50, 'min_samples_split': 4, 'min_samples_leaf': 1, 'max_features': 'sqrt', 'bootstrap': False, 'criterion': 'squared_error'}. Best is trial 341 with value: 0.2909369124469028.
[I 2024-12-04 12:02:41,663] Trial 580 finished with value: 0.30509047160294783 and parameters: {'n_estimators': 203, 'max_depth': 43, 'min_samples_split': 2, 'min_samples_leaf': 1, 'max_features': 'sqrt', 'bootstrap': False, 'criterion': 'squared_error'}. Best is trial 341 with value: 0.2909369124469028.
[I 2024-12-04 12:02:42,657] Trial 575 finished with value: 0.29539177697349756 and parameters: {'n_estimators': 244, 'max_depth': 50, 'min_samples_split': 3, 'min_samples_leaf': 1, 'max_features': 'sqrt', 'bootstrap': False, 'criterion': 'squared_error'}. Best is trial 341 with value: 0.2909369124469028.
[I 2024-12-04 12:02:43,321] Trial 574 finished with value: 0.31119520781376825 and parameters: {'n_estimators': 235, 'max_depth': 41, 'min_samples_split': 2, 'min_samples_leaf': 1, 'max_features': 'sqrt', 'bootstrap': False, 'criterion': 'squared_error'}. Best is trial 341 with value: 0.2909369124469028.
[I 2024-12-04 12:02:44,381] Trial 573 finished with value: 0.40598585856615127 and parameters: {'n_estimators': 231, 'max_depth': 11, 'min_samples_split': 2, 'min_samples_leaf': 2, 'max_features': None, 'bootstrap': False, 'criterion': 'squared_error'}. Best is trial 341 with value: 0.2909369124469028.
[I 2024-12-04 12:02:45,821] Trial 591 finished with value: 0.4039208634732279 and parameters: {'n_estimators': 274, 'max_depth': 45, 'min_samples_split': 3, 'min_samples_leaf': 1, 'max_features': 'log2', 'bootstrap': False, 'criterion': 'squared_error'}. Best is trial 341 with value: 0.2909369124469028.
[I 2024-12-04 12:02:46,854] Trial 590 finished with value: 0.30048761535576074 and parameters: {'n_estimators': 268, 'max_depth': 50, 'min_samples_split': 4, 'min_samples_leaf': 1, 'max_features': 'sqrt', 'bootstrap': False, 'criterion': 'squared_error'}. Best is trial 341 with value: 0.2909369124469028.
[I 2024-12-04 12:02:46,923] Trial 586 finished with value: 0.3081003780834719 and parameters: {'n_estimators': 103, 'max_depth': 44, 'min_samples_split': 4, 'min_samples_leaf': 1, 'max_features': 'sqrt', 'bootstrap': False, 'criterion': 'squared_error'}. Best is trial 341 with value: 0.2909369124469028.
[I 2024-12-04 12:02:46,950] Trial 583 finished with value: 0.33808221851014536 and parameters: {'n_estimators': 582, 'max_depth': 38, 'min_samples_split': 13, 'min_samples_leaf': 1, 'max_features': None, 'bootstrap': True, 'criterion': 'squared_error'}. Best is trial 341 with value: 0.2909369124469028.
[I 2024-12-04 12:02:47,498] Trial 588 finished with value: 0.7084682115558514 and parameters: {'n_estimators': 977, 'max_depth': 8, 'min_samples_split': 28, 'min_samples_leaf': 1, 'max_features': 'sqrt', 'bootstrap': True, 'criterion': 'squared_error'}. Best is trial 341 with value: 0.2909369124469028.
[I 2024-12-04 12:02:47,647] Trial 598 finished with value: 0.4470585708643578 and parameters: {'n_estimators': 247, 'max_depth': 39, 'min_samples_split': 5, 'min_samples_leaf': 2, 'max_features': 'sqrt', 'bootstrap': False, 'criterion': 'squared_error'}. Best is trial 341 with value: 0.2909369124469028.
[I 2024-12-04 12:02:47,651] Trial 594 finished with value: 0.29734934020946374 and parameters: {'n_estimators': 183, 'max_depth': 50, 'min_samples_split': 2, 'min_samples_leaf': 1, 'max_features': 'sqrt', 'bootstrap': False, 'criterion': 'squared_error'}. Best is trial 341 with value: 0.2909369124469028.
[I 2024-12-04 12:02:49,624] Trial 599 finished with value: 0.331033869751393 and parameters: {'n_estimators': 138, 'max_depth': 41, 'min_samples_split': 2, 'min_samples_leaf': 1, 'max_features': 'sqrt', 'bootstrap': True, 'criterion': 'squared_error'}. Best is trial 341 with value: 0.2909369124469028.
[I 2024-12-04 12:02:50,302] Trial 585 finished with value: 0.2979026088278125 and parameters: {'n_estimators': 186, 'max_depth': 50, 'min_samples_split': 2, 'min_samples_leaf': 1, 'max_features': 'sqrt', 'bootstrap': False, 'criterion': 'squared_error'}. Best is trial 341 with value: 0.2909369124469028.
[I 2024-12-04 12:02:50,777] Trial 593 finished with value: 0.44108386039301684 and parameters: {'n_estimators': 367, 'max_depth': 50, 'min_samples_split': 2, 'min_samples_leaf': 2, 'max_features': 'sqrt', 'bootstrap': False, 'criterion': 'squared_error'}. Best is trial 341 with value: 0.2909369124469028.
[I 2024-12-04 12:02:50,808] Trial 584 finished with value: 0.2943415885593263 and parameters: {'n_estimators': 295, 'max_depth': 50, 'min_samples_split': 3, 'min_samples_leaf': 1, 'max_features': 'sqrt', 'bootstrap': False, 'criterion': 'squared_error'}. Best is trial 341 with value: 0.2909369124469028.
[I 2024-12-04 12:02:52,964] Trial 587 finished with value: 0.507043899503071 and parameters: {'n_estimators': 888, 'max_depth': 43, 'min_samples_split': 30, 'min_samples_leaf': 1, 'max_features': 'log2', 'bootstrap': True, 'criterion': 'squared_error'}. Best is trial 341 with value: 0.2909369124469028.
[I 2024-12-04 12:02:54,870] Trial 592 finished with value: 0.6969381598334641 and parameters: {'n_estimators': 288, 'max_depth': 42, 'min_samples_split': 3, 'min_samples_leaf': 2, 'max_features': 'log2', 'bootstrap': False, 'criterion': 'squared_error'}. Best is trial 341 with value: 0.2909369124469028.
[I 2024-12-04 12:02:54,931] Trial 600 finished with value: 0.31643208227961694 and parameters: {'n_estimators': 255, 'max_depth': 42, 'min_samples_split': 6, 'min_samples_leaf': 1, 'max_features': 'sqrt', 'bootstrap': False, 'criterion': 'squared_error'}. Best is trial 341 with value: 0.2909369124469028.
[I 2024-12-04 12:02:54,934] Trial 595 finished with value: 0.38665833289358537 and parameters: {'n_estimators': 258, 'max_depth': 37, 'min_samples_split': 2, 'min_samples_leaf': 1, 'max_features': None, 'bootstrap': False, 'criterion': 'squared_error'}. Best is trial 341 with value: 0.2909369124469028.
[I 2024-12-04 12:02:55,326] Trial 596 finished with value: 0.645013542217401 and parameters: {'n_estimators': 557, 'max_depth': 21, 'min_samples_split': 17, 'min_samples_leaf': 1, 'max_features': 'log2', 'bootstrap': True, 'criterion': 'squared_error'}. Best is trial 341 with value: 0.2909369124469028.
[I 2024-12-04 12:02:55,550] Trial 597 finished with value: 0.9414170469575388 and parameters: {'n_estimators': 991, 'max_depth': 17, 'min_samples_split': 2, 'min_samples_leaf': 8, 'max_features': 'log2', 'bootstrap': False, 'criterion': 'squared_error'}. Best is trial 341 with value: 0.2909369124469028.
[I 2024-12-04 12:02:56,610] Trial 608 finished with value: 0.4449307673108696 and parameters: {'n_estimators': 218, 'max_depth': 42, 'min_samples_split': 4, 'min_samples_leaf': 2, 'max_features': 'sqrt', 'bootstrap': False, 'criterion': 'squared_error'}. Best is trial 341 with value: 0.2909369124469028.
[I 2024-12-04 12:02:56,612] Trial 601 finished with value: 0.3035960352704147 and parameters: {'n_estimators': 149, 'max_depth': 43, 'min_samples_split': 2, 'min_samples_leaf': 1, 'max_features': 'sqrt', 'bootstrap': False, 'criterion': 'squared_error'}. Best is trial 341 with value: 0.2909369124469028.
[I 2024-12-04 12:02:57,007] Trial 589 finished with value: 0.8038247353508157 and parameters: {'n_estimators': 772, 'max_depth': 30, 'min_samples_split': 2, 'min_samples_leaf': 3, 'max_features': 'log2', 'bootstrap': False, 'criterion': 'absolute_error'}. Best is trial 341 with value: 0.2909369124469028.
[I 2024-12-04 12:02:57,674] Trial 609 finished with value: 0.3018954003624431 and parameters: {'n_estimators': 204, 'max_depth': 47, 'min_samples_split': 4, 'min_samples_leaf': 1, 'max_features': 'sqrt', 'bootstrap': False, 'criterion': 'squared_error'}. Best is trial 341 with value: 0.2909369124469028.
[I 2024-12-04 12:02:57,691] Trial 605 finished with value: 0.3056472452121613 and parameters: {'n_estimators': 416, 'max_depth': 41, 'min_samples_split': 3, 'min_samples_leaf': 1, 'max_features': 'sqrt', 'bootstrap': False, 'criterion': 'squared_error'}. Best is trial 341 with value: 0.2909369124469028.
[I 2024-12-04 12:02:57,750] Trial 607 finished with value: 0.5419123185489674 and parameters: {'n_estimators': 267, 'max_depth': 28, 'min_samples_split': 2, 'min_samples_leaf': 1, 'max_features': 'log2', 'bootstrap': True, 'criterion': 'squared_error'}. Best is trial 341 with value: 0.2909369124469028.
[I 2024-12-04 12:02:57,756] Trial 603 finished with value: 0.384274399348012 and parameters: {'n_estimators': 208, 'max_depth': 50, 'min_samples_split': 4, 'min_samples_leaf': 1, 'max_features': None, 'bootstrap': False, 'criterion': 'squared_error'}. Best is trial 341 with value: 0.2909369124469028.
[I 2024-12-04 12:02:58,557] Trial 602 finished with value: 0.39542960588511733 and parameters: {'n_estimators': 238, 'max_depth': 48, 'min_samples_split': 2, 'min_samples_leaf': 1, 'max_features': 'log2', 'bootstrap': False, 'criterion': 'squared_error'}. Best is trial 341 with value: 0.2909369124469028.
[I 2024-12-04 12:02:58,742] Trial 618 finished with value: 0.4771285303482486 and parameters: {'n_estimators': 302, 'max_depth': 49, 'min_samples_split': 2, 'min_samples_leaf': 2, 'max_features': 'sqrt', 'bootstrap': True, 'criterion': 'squared_error'}. Best is trial 341 with value: 0.2909369124469028.
[I 2024-12-04 12:02:59,374] Trial 606 finished with value: 0.9413448280275332 and parameters: {'n_estimators': 894, 'max_depth': 29, 'min_samples_split': 18, 'min_samples_leaf': 8, 'max_features': 'log2', 'bootstrap': False, 'criterion': 'squared_error'}. Best is trial 341 with value: 0.2909369124469028.
[I 2024-12-04 12:02:59,885] Trial 617 finished with value: 0.31224975099593366 and parameters: {'n_estimators': 107, 'max_depth': 49, 'min_samples_split': 7, 'min_samples_leaf': 1, 'max_features': 'sqrt', 'bootstrap': False, 'criterion': 'squared_error'}. Best is trial 341 with value: 0.2909369124469028.
[I 2024-12-04 12:03:00,590] Trial 613 finished with value: 0.2993771932613912 and parameters: {'n_estimators': 231, 'max_depth': 50, 'min_samples_split': 2, 'min_samples_leaf': 1, 'max_features': 'sqrt', 'bootstrap': False, 'criterion': 'squared_error'}. Best is trial 341 with value: 0.2909369124469028.
[I 2024-12-04 12:03:00,608] Trial 611 finished with value: 0.2997695266389548 and parameters: {'n_estimators': 183, 'max_depth': 50, 'min_samples_split': 4, 'min_samples_leaf': 1, 'max_features': 'sqrt', 'bootstrap': False, 'criterion': 'squared_error'}. Best is trial 341 with value: 0.2909369124469028.
[I 2024-12-04 12:03:01,132] Trial 612 finished with value: 0.3082360496552664 and parameters: {'n_estimators': 343, 'max_depth': 42, 'min_samples_split': 2, 'min_samples_leaf': 1, 'max_features': 'sqrt', 'bootstrap': False, 'criterion': 'squared_error'}. Best is trial 341 with value: 0.2909369124469028.
[I 2024-12-04 12:03:01,345] Trial 610 finished with value: 0.2952724034270525 and parameters: {'n_estimators': 231, 'max_depth': 50, 'min_samples_split': 3, 'min_samples_leaf': 1, 'max_features': 'sqrt', 'bootstrap': False, 'criterion': 'squared_error'}. Best is trial 341 with value: 0.2909369124469028.
[I 2024-12-04 12:03:01,915] Trial 616 finished with value: 0.2980987073689976 and parameters: {'n_estimators': 301, 'max_depth': 50, 'min_samples_split': 2, 'min_samples_leaf': 1, 'max_features': 'sqrt', 'bootstrap': False, 'criterion': 'squared_error'}. Best is trial 341 with value: 0.2909369124469028.
[I 2024-12-04 12:03:01,973] Trial 615 finished with value: 0.43889096397493915 and parameters: {'n_estimators': 434, 'max_depth': 50, 'min_samples_split': 5, 'min_samples_leaf': 2, 'max_features': 'sqrt', 'bootstrap': False, 'criterion': 'squared_error'}. Best is trial 341 with value: 0.2909369124469028.
[I 2024-12-04 12:03:02,196] Trial 619 finished with value: 0.9698938522314344 and parameters: {'n_estimators': 264, 'max_depth': 46, 'min_samples_split': 3, 'min_samples_leaf': 13, 'max_features': 'log2', 'bootstrap': True, 'criterion': 'squared_error'}. Best is trial 341 with value: 0.2909369124469028.
[I 2024-12-04 12:03:03,681] Trial 621 finished with value: 0.4432031350300258 and parameters: {'n_estimators': 230, 'max_depth': 48, 'min_samples_split': 4, 'min_samples_leaf': 2, 'max_features': 'sqrt', 'bootstrap': False, 'criterion': 'squared_error'}. Best is trial 341 with value: 0.2909369124469028.
[I 2024-12-04 12:03:04,433] Trial 614 finished with value: 0.4422326124581428 and parameters: {'n_estimators': 217, 'max_depth': 50, 'min_samples_split': 3, 'min_samples_leaf': 2, 'max_features': 'sqrt', 'bootstrap': False, 'criterion': 'squared_error'}. Best is trial 341 with value: 0.2909369124469028.
[I 2024-12-04 12:03:05,729] Trial 623 finished with value: 0.30554750517129703 and parameters: {'n_estimators': 122, 'max_depth': 43, 'min_samples_split': 2, 'min_samples_leaf': 1, 'max_features': 'sqrt', 'bootstrap': False, 'criterion': 'squared_error'}. Best is trial 341 with value: 0.2909369124469028.
[I 2024-12-04 12:03:05,988] Trial 567 finished with value: 0.3371567334023861 and parameters: {'n_estimators': 181, 'max_depth': 37, 'min_samples_split': 4, 'min_samples_leaf': 1, 'max_features': None, 'bootstrap': True, 'criterion': 'absolute_error'}. Best is trial 341 with value: 0.2909369124469028.
[I 2024-12-04 12:03:06,459] Trial 622 finished with value: 0.30005615218023446 and parameters: {'n_estimators': 274, 'max_depth': 50, 'min_samples_split': 4, 'min_samples_leaf': 1, 'max_features': 'sqrt', 'bootstrap': False, 'criterion': 'squared_error'}. Best is trial 341 with value: 0.2909369124469028.
[I 2024-12-04 12:03:06,461] Trial 627 finished with value: 0.3102027372262063 and parameters: {'n_estimators': 143, 'max_depth': 42, 'min_samples_split': 4, 'min_samples_leaf': 1, 'max_features': 'sqrt', 'bootstrap': False, 'criterion': 'squared_error'}. Best is trial 341 with value: 0.2909369124469028.
[I 2024-12-04 12:03:07,025] Trial 634 finished with value: 0.7035929841192695 and parameters: {'n_estimators': 156, 'max_depth': 50, 'min_samples_split': 2, 'min_samples_leaf': 2, 'max_features': 'log2', 'bootstrap': False, 'criterion': 'squared_error'}. Best is trial 341 with value: 0.2909369124469028.
[I 2024-12-04 12:03:07,313] Trial 477 finished with value: 0.43643166403278233 and parameters: {'n_estimators': 569, 'max_depth': 50, 'min_samples_split': 14, 'min_samples_leaf': 2, 'max_features': None, 'bootstrap': False, 'criterion': 'absolute_error'}. Best is trial 341 with value: 0.2909369124469028.
[I 2024-12-04 12:03:07,968] Trial 631 finished with value: 0.4461178885249688 and parameters: {'n_estimators': 127, 'max_depth': 50, 'min_samples_split': 4, 'min_samples_leaf': 2, 'max_features': 'sqrt', 'bootstrap': False, 'criterion': 'squared_error'}. Best is trial 341 with value: 0.2909369124469028.
[I 2024-12-04 12:03:10,211] Trial 626 finished with value: 0.29568367691084607 and parameters: {'n_estimators': 240, 'max_depth': 50, 'min_samples_split': 3, 'min_samples_leaf': 1, 'max_features': 'sqrt', 'bootstrap': False, 'criterion': 'squared_error'}. Best is trial 341 with value: 0.2909369124469028.
[I 2024-12-04 12:03:10,322] Trial 630 finished with value: 0.3022163184934139 and parameters: {'n_estimators': 108, 'max_depth': 50, 'min_samples_split': 5, 'min_samples_leaf': 1, 'max_features': 'sqrt', 'bootstrap': False, 'criterion': 'squared_error'}. Best is trial 341 with value: 0.2909369124469028.
[I 2024-12-04 12:03:10,374] Trial 638 finished with value: 0.3008036423711343 and parameters: {'n_estimators': 519, 'max_depth': 48, 'min_samples_split': 4, 'min_samples_leaf': 1, 'max_features': 'sqrt', 'bootstrap': False, 'criterion': 'squared_error'}. Best is trial 341 with value: 0.2909369124469028.
[I 2024-12-04 12:03:10,760] Trial 628 finished with value: 0.4445510592662771 and parameters: {'n_estimators': 350, 'max_depth': 41, 'min_samples_split': 3, 'min_samples_leaf': 2, 'max_features': 'sqrt', 'bootstrap': False, 'criterion': 'squared_error'}. Best is trial 341 with value: 0.2909369124469028.
[I 2024-12-04 12:03:12,629] Trial 604 finished with value: 0.3096311308388718 and parameters: {'n_estimators': 329, 'max_depth': 50, 'min_samples_split': 4, 'min_samples_leaf': 1, 'max_features': 'sqrt', 'bootstrap': False, 'criterion': 'absolute_error'}. Best is trial 341 with value: 0.2909369124469028.
[I 2024-12-04 12:03:13,214] Trial 633 finished with value: 0.3046153162664292 and parameters: {'n_estimators': 105, 'max_depth': 43, 'min_samples_split': 2, 'min_samples_leaf': 1, 'max_features': 'sqrt', 'bootstrap': False, 'criterion': 'squared_error'}. Best is trial 341 with value: 0.2909369124469028.
[I 2024-12-04 12:03:14,251] Trial 635 finished with value: 0.3005140625763955 and parameters: {'n_estimators': 248, 'max_depth': 50, 'min_samples_split': 4, 'min_samples_leaf': 1, 'max_features': 'sqrt', 'bootstrap': False, 'criterion': 'squared_error'}. Best is trial 341 with value: 0.2909369124469028.
[I 2024-12-04 12:03:14,298] Trial 629 finished with value: 0.516915756782945 and parameters: {'n_estimators': 351, 'max_depth': 18, 'min_samples_split': 26, 'min_samples_leaf': 1, 'max_features': 'sqrt', 'bootstrap': False, 'criterion': 'squared_error'}. Best is trial 341 with value: 0.2909369124469028.
[I 2024-12-04 12:03:14,402] Trial 637 finished with value: 0.6980540321220629 and parameters: {'n_estimators': 515, 'max_depth': 46, 'min_samples_split': 5, 'min_samples_leaf': 2, 'max_features': 'log2', 'bootstrap': False, 'criterion': 'squared_error'}. Best is trial 341 with value: 0.2909369124469028.
[I 2024-12-04 12:03:15,248] Trial 639 finished with value: 0.3080186288954906 and parameters: {'n_estimators': 351, 'max_depth': 42, 'min_samples_split': 2, 'min_samples_leaf': 1, 'max_features': 'sqrt', 'bootstrap': False, 'criterion': 'squared_error'}. Best is trial 341 with value: 0.2909369124469028.
[I 2024-12-04 12:03:15,377] Trial 632 finished with value: 0.3064560785807128 and parameters: {'n_estimators': 303, 'max_depth': 43, 'min_samples_split': 4, 'min_samples_leaf': 1, 'max_features': 'sqrt', 'bootstrap': False, 'criterion': 'squared_error'}. Best is trial 341 with value: 0.2909369124469028.
[I 2024-12-04 12:03:16,430] Trial 641 finished with value: 0.29629348892443985 and parameters: {'n_estimators': 115, 'max_depth': 50, 'min_samples_split': 3, 'min_samples_leaf': 1, 'max_features': 'sqrt', 'bootstrap': False, 'criterion': 'squared_error'}. Best is trial 341 with value: 0.2909369124469028.
[I 2024-12-04 12:03:16,474] Trial 640 finished with value: 0.29435168531089206 and parameters: {'n_estimators': 406, 'max_depth': 50, 'min_samples_split': 3, 'min_samples_leaf': 1, 'max_features': 'sqrt', 'bootstrap': False, 'criterion': 'squared_error'}. Best is trial 341 with value: 0.2909369124469028.
[I 2024-12-04 12:03:16,571] Trial 636 finished with value: 0.9559940585384079 and parameters: {'n_estimators': 238, 'max_depth': 42, 'min_samples_split': 3, 'min_samples_leaf': 14, 'max_features': 'log2', 'bootstrap': False, 'criterion': 'absolute_error'}. Best is trial 341 with value: 0.2909369124469028.
[I 2024-12-04 12:03:16,753] Trial 625 finished with value: 0.45905210817662867 and parameters: {'n_estimators': 200, 'max_depth': 50, 'min_samples_split': 2, 'min_samples_leaf': 2, 'max_features': 'sqrt', 'bootstrap': False, 'criterion': 'absolute_error'}. Best is trial 341 with value: 0.2909369124469028.
[I 2024-12-04 12:03:17,613] Trial 647 finished with value: 0.29775711047718845 and parameters: {'n_estimators': 374, 'max_depth': 50, 'min_samples_split': 2, 'min_samples_leaf': 1, 'max_features': 'sqrt', 'bootstrap': False, 'criterion': 'squared_error'}. Best is trial 341 with value: 0.2909369124469028.
[I 2024-12-04 12:03:18,430] Trial 646 finished with value: 0.9105939351073846 and parameters: {'n_estimators': 519, 'max_depth': 23, 'min_samples_split': 27, 'min_samples_leaf': 15, 'max_features': 'sqrt', 'bootstrap': True, 'criterion': 'absolute_error'}. Best is trial 341 with value: 0.2909369124469028.
[I 2024-12-04 12:03:19,856] Trial 651 finished with value: 0.3058768177928444 and parameters: {'n_estimators': 103, 'max_depth': 41, 'min_samples_split': 3, 'min_samples_leaf': 1, 'max_features': 'sqrt', 'bootstrap': False, 'criterion': 'squared_error'}. Best is trial 341 with value: 0.2909369124469028.
[I 2024-12-04 12:03:19,915] Trial 653 finished with value: 0.6029464492007964 and parameters: {'n_estimators': 140, 'max_depth': 19, 'min_samples_split': 32, 'min_samples_leaf': 4, 'max_features': 'sqrt', 'bootstrap': False, 'criterion': 'squared_error'}. Best is trial 341 with value: 0.2909369124469028.
[I 2024-12-04 12:03:19,925] Trial 644 finished with value: 0.30906664471041406 and parameters: {'n_estimators': 217, 'max_depth': 42, 'min_samples_split': 4, 'min_samples_leaf': 1, 'max_features': 'sqrt', 'bootstrap': False, 'criterion': 'squared_error'}. Best is trial 341 with value: 0.2909369124469028.
[I 2024-12-04 12:03:20,016] Trial 650 finished with value: 0.4508172723610775 and parameters: {'n_estimators': 188, 'max_depth': 39, 'min_samples_split': 2, 'min_samples_leaf': 2, 'max_features': 'sqrt', 'bootstrap': False, 'criterion': 'squared_error'}. Best is trial 341 with value: 0.2909369124469028.
[I 2024-12-04 12:03:20,087] Trial 652 finished with value: 0.2992076746757976 and parameters: {'n_estimators': 103, 'max_depth': 50, 'min_samples_split': 2, 'min_samples_leaf': 1, 'max_features': 'sqrt', 'bootstrap': False, 'criterion': 'squared_error'}. Best is trial 341 with value: 0.2909369124469028.
