[I 2024-12-04 13:02:14,909] Trial 1270 finished with value: 0.366183498046585 and parameters: {'n_estimators': 1058, 'learning_rate': 0.0723908058925191, 'max_depth': 3, 'min_samples_split': 11, 'min_samples_leaf': 5, 'subsample': 0.8020377567321376, 'max_features': 'log2'}. Best is trial 1137 with value: 0.19687116000636118.
[I 2024-12-04 13:02:16,259] Trial 1269 finished with value: 0.4846671709436813 and parameters: {'n_estimators': 1190, 'learning_rate': 0.012408041674032543, 'max_depth': 4, 'min_samples_split': 13, 'min_samples_leaf': 9, 'subsample': 0.7545211964616928, 'max_features': 'sqrt'}. Best is trial 1137 with value: 0.19687116000636118.
[I 2024-12-04 13:02:17,771] Trial 1265 finished with value: 0.21652136971476094 and parameters: {'n_estimators': 1443, 'learning_rate': 0.07493258343095742, 'max_depth': 11, 'min_samples_split': 19, 'min_samples_leaf': 1, 'subsample': 0.6080213136411945, 'max_features': 'sqrt'}. Best is trial 1137 with value: 0.19687116000636118.
[I 2024-12-04 13:02:18,916] Trial 1271 finished with value: 0.2296018729949367 and parameters: {'n_estimators': 1064, 'learning_rate': 0.057482903657588506, 'max_depth': 11, 'min_samples_split': 20, 'min_samples_leaf': 1, 'subsample': 0.7189943981968644, 'max_features': 'sqrt'}. Best is trial 1137 with value: 0.19687116000636118.
[I 2024-12-04 13:02:18,918] Trial 1268 finished with value: 0.21714134908841792 and parameters: {'n_estimators': 1304, 'learning_rate': 0.098477772663193, 'max_depth': 11, 'min_samples_split': 18, 'min_samples_leaf': 1, 'subsample': 0.6180453314012129, 'max_features': 'sqrt'}. Best is trial 1137 with value: 0.19687116000636118.
[I 2024-12-04 13:02:24,743] Trial 1266 finished with value: 0.20461817778972835 and parameters: {'n_estimators': 1499, 'learning_rate': 0.09168673672194726, 'max_depth': 11, 'min_samples_split': 16, 'min_samples_leaf': 1, 'subsample': 0.6099906565157479, 'max_features': 'sqrt'}. Best is trial 1137 with value: 0.19687116000636118.
[I 2024-12-04 13:02:31,247] Trial 1272 finished with value: 0.30130154526059016 and parameters: {'n_estimators': 1246, 'learning_rate': 0.09274322979203943, 'max_depth': 4, 'min_samples_split': 13, 'min_samples_leaf': 2, 'subsample': 0.9622229573968063, 'max_features': 'log2'}. Best is trial 1137 with value: 0.19687116000636118.
[I 2024-12-04 13:02:39,291] Trial 1277 finished with value: 0.24183216693495546 and parameters: {'n_estimators': 1172, 'learning_rate': 0.09942511945264908, 'max_depth': 12, 'min_samples_split': 20, 'min_samples_leaf': 2, 'subsample': 0.7074086334641236, 'max_features': 'sqrt'}. Best is trial 1137 with value: 0.19687116000636118.
[I 2024-12-04 13:02:41,574] Trial 1279 finished with value: 0.2503819139467072 and parameters: {'n_estimators': 1123, 'learning_rate': 0.09370418266123366, 'max_depth': 12, 'min_samples_split': 19, 'min_samples_leaf': 3, 'subsample': 0.6847916966376212, 'max_features': 'sqrt'}. Best is trial 1137 with value: 0.19687116000636118.
[I 2024-12-04 13:02:46,641] Trial 1276 finished with value: 0.22351430476100315 and parameters: {'n_estimators': 1326, 'learning_rate': 0.09877082518866127, 'max_depth': 12, 'min_samples_split': 20, 'min_samples_leaf': 1, 'subsample': 0.6122750077649994, 'max_features': 'sqrt'}. Best is trial 1137 with value: 0.19687116000636118.
[I 2024-12-04 13:02:48,793] Trial 1278 finished with value: 0.21084581806074398 and parameters: {'n_estimators': 1206, 'learning_rate': 0.07305240076198878, 'max_depth': 12, 'min_samples_split': 19, 'min_samples_leaf': 1, 'subsample': 0.7202646782164313, 'max_features': 'sqrt'}. Best is trial 1137 with value: 0.19687116000636118.
[I 2024-12-04 13:02:51,429] Trial 1284 finished with value: 0.3360610422899487 and parameters: {'n_estimators': 1041, 'learning_rate': 0.04118393470225273, 'max_depth': 3, 'min_samples_split': 17, 'min_samples_leaf': 3, 'subsample': 0.9405172267119091, 'max_features': 'sqrt'}. Best is trial 1137 with value: 0.19687116000636118.
[I 2024-12-04 13:02:56,805] Trial 1290 finished with value: 0.24357513866859773 and parameters: {'n_estimators': 941, 'learning_rate': 0.08018578132048476, 'max_depth': 8, 'min_samples_split': 18, 'min_samples_leaf': 1, 'subsample': 0.7353716663810809, 'max_features': 'sqrt'}. Best is trial 1137 with value: 0.19687116000636118.
[I 2024-12-04 13:02:58,329] Trial 1280 finished with value: 0.24040378694566808 and parameters: {'n_estimators': 1337, 'learning_rate': 0.07935367912728254, 'max_depth': 12, 'min_samples_split': 20, 'min_samples_leaf': 3, 'subsample': 0.6367442370467277, 'max_features': 'sqrt'}. Best is trial 1137 with value: 0.19687116000636118.
[I 2024-12-04 13:03:04,809] Trial 1274 finished with value: 0.294316948535806 and parameters: {'n_estimators': 1458, 'learning_rate': 0.08374081635356642, 'max_depth': 12, 'min_samples_split': 19, 'min_samples_leaf': 2, 'subsample': 0.7279443434741845, 'max_features': None}. Best is trial 1137 with value: 0.19687116000636118.
[I 2024-12-04 13:03:09,655] Trial 1281 finished with value: 0.25752491817755907 and parameters: {'n_estimators': 1446, 'learning_rate': 0.09965905692176169, 'max_depth': 12, 'min_samples_split': 20, 'min_samples_leaf': 2, 'subsample': 0.6977376343151267, 'max_features': 'log2'}. Best is trial 1137 with value: 0.19687116000636118.
[I 2024-12-04 13:03:09,751] Trial 1287 finished with value: 0.23770985422224006 and parameters: {'n_estimators': 1129, 'learning_rate': 0.04937939164814297, 'max_depth': 12, 'min_samples_split': 20, 'min_samples_leaf': 2, 'subsample': 0.7215174335384846, 'max_features': 'sqrt'}. Best is trial 1137 with value: 0.19687116000636118.
[I 2024-12-04 13:03:12,355] Trial 1283 finished with value: 0.24755943059610547 and parameters: {'n_estimators': 1451, 'learning_rate': 0.08797761981805029, 'max_depth': 12, 'min_samples_split': 20, 'min_samples_leaf': 1, 'subsample': 0.6640328439713978, 'max_features': 'log2'}. Best is trial 1137 with value: 0.19687116000636118.
[I 2024-12-04 13:03:15,418] Trial 1285 finished with value: 0.231065690952542 and parameters: {'n_estimators': 1371, 'learning_rate': 0.08915818356786866, 'max_depth': 12, 'min_samples_split': 20, 'min_samples_leaf': 2, 'subsample': 0.6982805261170169, 'max_features': 'sqrt'}. Best is trial 1137 with value: 0.19687116000636118.
[I 2024-12-04 13:03:18,105] Trial 1282 finished with value: 0.24175402982301003 and parameters: {'n_estimators': 1484, 'learning_rate': 0.06257626815361078, 'max_depth': 11, 'min_samples_split': 16, 'min_samples_leaf': 2, 'subsample': 0.6074704456887351, 'max_features': 'sqrt'}. Best is trial 1137 with value: 0.19687116000636118.
[I 2024-12-04 13:03:20,455] Trial 1305 finished with value: 0.243786722334283 and parameters: {'n_estimators': 776, 'learning_rate': 0.0637467145993451, 'max_depth': 9, 'min_samples_split': 16, 'min_samples_leaf': 1, 'subsample': 0.6905340003802912, 'max_features': 'sqrt'}. Best is trial 1137 with value: 0.19687116000636118.
[I 2024-12-04 13:03:24,212] Trial 1286 finished with value: 0.22298990119223258 and parameters: {'n_estimators': 1470, 'learning_rate': 0.0965749088792207, 'max_depth': 12, 'min_samples_split': 20, 'min_samples_leaf': 1, 'subsample': 0.7273687899679292, 'max_features': 'sqrt'}. Best is trial 1137 with value: 0.19687116000636118.
[I 2024-12-04 13:03:30,310] Trial 1288 finished with value: 0.2337193328621492 and parameters: {'n_estimators': 1492, 'learning_rate': 0.09938809687915885, 'max_depth': 12, 'min_samples_split': 20, 'min_samples_leaf': 1, 'subsample': 0.7241205222739752, 'max_features': 'sqrt'}. Best is trial 1137 with value: 0.19687116000636118.
[I 2024-12-04 13:03:31,211] Trial 1298 finished with value: 0.23992690682577877 and parameters: {'n_estimators': 1118, 'learning_rate': 0.05204441225472704, 'max_depth': 12, 'min_samples_split': 20, 'min_samples_leaf': 2, 'subsample': 0.676612448840172, 'max_features': 'sqrt'}. Best is trial 1137 with value: 0.19687116000636118.
[I 2024-12-04 13:03:32,398] Trial 1289 finished with value: 0.24007964689040234 and parameters: {'n_estimators': 1459, 'learning_rate': 0.09075343364944304, 'max_depth': 12, 'min_samples_split': 18, 'min_samples_leaf': 3, 'subsample': 0.6112766535218369, 'max_features': 'sqrt'}. Best is trial 1137 with value: 0.19687116000636118.
[I 2024-12-04 13:03:34,953] Trial 1293 finished with value: 0.21394060033015022 and parameters: {'n_estimators': 1319, 'learning_rate': 0.06240891687829688, 'max_depth': 12, 'min_samples_split': 19, 'min_samples_leaf': 1, 'subsample': 0.7128945777065291, 'max_features': 'sqrt'}. Best is trial 1137 with value: 0.19687116000636118.
[I 2024-12-04 13:03:37,077] Trial 1292 finished with value: 0.22316979836845877 and parameters: {'n_estimators': 1492, 'learning_rate': 0.07662084861414596, 'max_depth': 12, 'min_samples_split': 19, 'min_samples_leaf': 2, 'subsample': 0.6113172426732777, 'max_features': 'sqrt'}. Best is trial 1137 with value: 0.19687116000636118.
[I 2024-12-04 13:03:37,922] Trial 1297 finished with value: 0.21705210369729303 and parameters: {'n_estimators': 1279, 'learning_rate': 0.05726216548805423, 'max_depth': 11, 'min_samples_split': 20, 'min_samples_leaf': 1, 'subsample': 0.6587653855520561, 'max_features': 'sqrt'}. Best is trial 1137 with value: 0.19687116000636118.
[I 2024-12-04 13:03:39,110] Trial 1291 finished with value: 0.2350435848378342 and parameters: {'n_estimators': 1499, 'learning_rate': 0.08038340469752657, 'max_depth': 11, 'min_samples_split': 18, 'min_samples_leaf': 2, 'subsample': 0.6187772203007977, 'max_features': 'sqrt'}. Best is trial 1137 with value: 0.19687116000636118.
[I 2024-12-04 13:03:40,810] Trial 1302 finished with value: 0.21324054408832094 and parameters: {'n_estimators': 1150, 'learning_rate': 0.06558910349230601, 'max_depth': 12, 'min_samples_split': 20, 'min_samples_leaf': 1, 'subsample': 0.7071547624512396, 'max_features': 'sqrt'}. Best is trial 1137 with value: 0.19687116000636118.
[I 2024-12-04 13:03:43,757] Trial 1299 finished with value: 0.3613197728215221 and parameters: {'n_estimators': 1336, 'learning_rate': 0.06137126756818816, 'max_depth': 10, 'min_samples_split': 6, 'min_samples_leaf': 5, 'subsample': 0.6540735351575636, 'max_features': 'log2'}. Best is trial 1137 with value: 0.19687116000636118.
[I 2024-12-04 13:03:44,486] Trial 1294 finished with value: 0.23455013489428306 and parameters: {'n_estimators': 1496, 'learning_rate': 0.09792484331341879, 'max_depth': 11, 'min_samples_split': 17, 'min_samples_leaf': 1, 'subsample': 0.6397084657894216, 'max_features': 'sqrt'}. Best is trial 1137 with value: 0.19687116000636118.
[I 2024-12-04 13:03:45,735] Trial 1296 finished with value: 0.25196247938001554 and parameters: {'n_estimators': 1475, 'learning_rate': 0.09410794887501757, 'max_depth': 10, 'min_samples_split': 20, 'min_samples_leaf': 3, 'subsample': 0.6128422915044822, 'max_features': 'sqrt'}. Best is trial 1137 with value: 0.19687116000636118.
[I 2024-12-04 13:03:46,626] Trial 1300 finished with value: 0.21574172462272417 and parameters: {'n_estimators': 1177, 'learning_rate': 0.062307578775098994, 'max_depth': 12, 'min_samples_split': 19, 'min_samples_leaf': 1, 'subsample': 0.6416521441284491, 'max_features': 'sqrt'}. Best is trial 1137 with value: 0.19687116000636118.
[I 2024-12-04 13:03:46,994] Trial 1307 finished with value: 0.24361812855723022 and parameters: {'n_estimators': 1003, 'learning_rate': 0.09754517732662196, 'max_depth': 8, 'min_samples_split': 18, 'min_samples_leaf': 1, 'subsample': 0.7104614311813006, 'max_features': 'sqrt'}. Best is trial 1137 with value: 0.19687116000636118.
[I 2024-12-04 13:03:47,906] Trial 1295 finished with value: 0.20420230782961002 and parameters: {'n_estimators': 1452, 'learning_rate': 0.08787678671176569, 'max_depth': 12, 'min_samples_split': 16, 'min_samples_leaf': 1, 'subsample': 0.6038782025984195, 'max_features': 'sqrt'}. Best is trial 1137 with value: 0.19687116000636118.
[I 2024-12-04 13:03:48,241] Trial 1303 finished with value: 0.23936394647286158 and parameters: {'n_estimators': 1163, 'learning_rate': 0.07389180235160436, 'max_depth': 12, 'min_samples_split': 20, 'min_samples_leaf': 1, 'subsample': 0.6685354033303802, 'max_features': 'sqrt'}. Best is trial 1137 with value: 0.19687116000636118.
[I 2024-12-04 13:03:48,377] Trial 1304 finished with value: 0.21829348040148472 and parameters: {'n_estimators': 1221, 'learning_rate': 0.0982075399476699, 'max_depth': 11, 'min_samples_split': 20, 'min_samples_leaf': 1, 'subsample': 0.6493081766452052, 'max_features': 'sqrt'}. Best is trial 1137 with value: 0.19687116000636118.
[I 2024-12-04 13:03:48,980] Trial 1301 finished with value: 0.24103402017309086 and parameters: {'n_estimators': 1298, 'learning_rate': 0.07926938833045899, 'max_depth': 12, 'min_samples_split': 20, 'min_samples_leaf': 2, 'subsample': 0.6091167239539546, 'max_features': 'sqrt'}. Best is trial 1137 with value: 0.19687116000636118.
[I 2024-12-04 13:03:53,008] Trial 1323 finished with value: 0.46326439734066593 and parameters: {'n_estimators': 249, 'learning_rate': 0.08612487980703681, 'max_depth': 5, 'min_samples_split': 3, 'min_samples_leaf': 10, 'subsample': 0.7348794299919595, 'max_features': 'sqrt'}. Best is trial 1137 with value: 0.19687116000636118.
[I 2024-12-04 13:03:59,842] Trial 1306 finished with value: 0.23000798393489924 and parameters: {'n_estimators': 1418, 'learning_rate': 0.058137023400439025, 'max_depth': 12, 'min_samples_split': 17, 'min_samples_leaf': 2, 'subsample': 0.7668161802922165, 'max_features': 'sqrt'}. Best is trial 1137 with value: 0.19687116000636118.
[I 2024-12-04 13:04:06,584] Trial 1308 finished with value: 0.20976408986436415 and parameters: {'n_estimators': 1433, 'learning_rate': 0.07370771783160494, 'max_depth': 12, 'min_samples_split': 16, 'min_samples_leaf': 1, 'subsample': 0.6185194918485497, 'max_features': 'sqrt'}. Best is trial 1137 with value: 0.19687116000636118.
[I 2024-12-04 13:04:09,128] Trial 1310 finished with value: 0.22070177240684732 and parameters: {'n_estimators': 1342, 'learning_rate': 0.09734105178270772, 'max_depth': 12, 'min_samples_split': 19, 'min_samples_leaf': 1, 'subsample': 0.6553992425216747, 'max_features': 'sqrt'}. Best is trial 1137 with value: 0.19687116000636118.
[I 2024-12-04 13:04:14,823] Trial 1309 finished with value: 0.1989780376999832 and parameters: {'n_estimators': 1493, 'learning_rate': 0.07796810464529981, 'max_depth': 12, 'min_samples_split': 16, 'min_samples_leaf': 1, 'subsample': 0.6709556286293417, 'max_features': 'sqrt'}. Best is trial 1137 with value: 0.19687116000636118.
[I 2024-12-04 13:04:17,375] Trial 1319 finished with value: 0.25396288001980943 and parameters: {'n_estimators': 1044, 'learning_rate': 0.0938827485975314, 'max_depth': 10, 'min_samples_split': 16, 'min_samples_leaf': 4, 'subsample': 0.6698123880737805, 'max_features': 'sqrt'}. Best is trial 1137 with value: 0.19687116000636118.
[I 2024-12-04 13:04:18,207] Trial 1311 finished with value: 0.23150069751156094 and parameters: {'n_estimators': 1485, 'learning_rate': 0.0826098296693236, 'max_depth': 10, 'min_samples_split': 20, 'min_samples_leaf': 1, 'subsample': 0.6235366094283332, 'max_features': 'sqrt'}. Best is trial 1137 with value: 0.19687116000636118.
[I 2024-12-04 13:04:23,789] Trial 1324 finished with value: 0.23362744340104227 and parameters: {'n_estimators': 874, 'learning_rate': 0.07743771251749, 'max_depth': 10, 'min_samples_split': 16, 'min_samples_leaf': 1, 'subsample': 0.6884677726278483, 'max_features': 'sqrt'}. Best is trial 1137 with value: 0.19687116000636118.
[I 2024-12-04 13:04:26,521] Trial 1318 finished with value: 0.35166128623042464 and parameters: {'n_estimators': 1176, 'learning_rate': 0.05464380755143359, 'max_depth': 4, 'min_samples_split': 2, 'min_samples_leaf': 7, 'subsample': 0.6583725865764836, 'max_features': None}. Best is trial 1137 with value: 0.19687116000636118.
[I 2024-12-04 13:04:27,276] Trial 1320 finished with value: 0.2333230837704519 and parameters: {'n_estimators': 1178, 'learning_rate': 0.058433699818739006, 'max_depth': 10, 'min_samples_split': 17, 'min_samples_leaf': 1, 'subsample': 0.7517225660163334, 'max_features': 'sqrt'}. Best is trial 1137 with value: 0.19687116000636118.
[I 2024-12-04 13:04:29,996] Trial 1314 finished with value: 0.24638389553174497 and parameters: {'n_estimators': 1487, 'learning_rate': 0.09950507125438668, 'max_depth': 12, 'min_samples_split': 17, 'min_samples_leaf': 2, 'subsample': 0.6176184177654739, 'max_features': 'sqrt'}. Best is trial 1137 with value: 0.19687116000636118.
[I 2024-12-04 13:04:30,757] Trial 1313 finished with value: 0.3003029964987369 and parameters: {'n_estimators': 1394, 'learning_rate': 0.013256857478006466, 'max_depth': 12, 'min_samples_split': 14, 'min_samples_leaf': 5, 'subsample': 0.6954994815792911, 'max_features': None}. Best is trial 1137 with value: 0.19687116000636118.
[I 2024-12-04 13:04:30,771] Trial 1312 finished with value: 0.2862448694275937 and parameters: {'n_estimators': 1428, 'learning_rate': 0.07160553168534747, 'max_depth': 12, 'min_samples_split': 19, 'min_samples_leaf': 2, 'subsample': 0.6015816101113781, 'max_features': None}. Best is trial 1137 with value: 0.19687116000636118.
[I 2024-12-04 13:04:34,974] Trial 1335 finished with value: 0.2830779536974432 and parameters: {'n_estimators': 501, 'learning_rate': 0.08800669087291181, 'max_depth': 5, 'min_samples_split': 16, 'min_samples_leaf': 2, 'subsample': 0.8662309071040492, 'max_features': None}. Best is trial 1137 with value: 0.19687116000636118.
[I 2024-12-04 13:04:36,541] Trial 1315 finished with value: 0.2373750727923834 and parameters: {'n_estimators': 1474, 'learning_rate': 0.09227139437730011, 'max_depth': 12, 'min_samples_split': 16, 'min_samples_leaf': 2, 'subsample': 0.6196857287733128, 'max_features': 'sqrt'}. Best is trial 1137 with value: 0.19687116000636118.
[I 2024-12-04 13:04:37,101] Trial 1316 finished with value: 0.22318826463192099 and parameters: {'n_estimators': 1451, 'learning_rate': 0.09917210139278247, 'max_depth': 12, 'min_samples_split': 19, 'min_samples_leaf': 1, 'subsample': 0.6820943743891503, 'max_features': 'sqrt'}. Best is trial 1137 with value: 0.19687116000636118.
[I 2024-12-04 13:04:38,231] Trial 1317 finished with value: 0.24660950298261292 and parameters: {'n_estimators': 1473, 'learning_rate': 0.09486678817248731, 'max_depth': 12, 'min_samples_split': 20, 'min_samples_leaf': 3, 'subsample': 0.642447566825865, 'max_features': 'sqrt'}. Best is trial 1137 with value: 0.19687116000636118.
[I 2024-12-04 13:04:40,559] Trial 1325 finished with value: 0.2478287038100722 and parameters: {'n_estimators': 1106, 'learning_rate': 0.08719532930523302, 'max_depth': 12, 'min_samples_split': 18, 'min_samples_leaf': 3, 'subsample': 0.6208038724774444, 'max_features': 'sqrt'}. Best is trial 1137 with value: 0.19687116000636118.
[I 2024-12-04 13:04:42,074] Trial 1321 finished with value: 0.345118558377771 and parameters: {'n_estimators': 1432, 'learning_rate': 0.021453063849310037, 'max_depth': 5, 'min_samples_split': 16, 'min_samples_leaf': 6, 'subsample': 0.9908988406158, 'max_features': 'sqrt'}. Best is trial 1137 with value: 0.19687116000636118.
[I 2024-12-04 13:04:45,577] Trial 1347 finished with value: 0.4340824233434229 and parameters: {'n_estimators': 224, 'learning_rate': 0.019628260358092335, 'max_depth': 4, 'min_samples_split': 5, 'min_samples_leaf': 9, 'subsample': 0.8883247412635753, 'max_features': None}. Best is trial 1137 with value: 0.19687116000636118.
[I 2024-12-04 13:04:47,528] Trial 1332 finished with value: 0.38803088858300366 and parameters: {'n_estimators': 797, 'learning_rate': 0.03540784553560451, 'max_depth': 8, 'min_samples_split': 13, 'min_samples_leaf': 8, 'subsample': 0.8805993644410905, 'max_features': 'sqrt'}. Best is trial 1137 with value: 0.19687116000636118.
[I 2024-12-04 13:04:49,491] Trial 1328 finished with value: 0.21678254504699296 and parameters: {'n_estimators': 1111, 'learning_rate': 0.09912116473365494, 'max_depth': 12, 'min_samples_split': 18, 'min_samples_leaf': 1, 'subsample': 0.6571220997209545, 'max_features': 'sqrt'}. Best is trial 1137 with value: 0.19687116000636118.
[I 2024-12-04 13:04:51,916] Trial 1334 finished with value: 0.39024835120543677 and parameters: {'n_estimators': 926, 'learning_rate': 0.0676497282463596, 'max_depth': 4, 'min_samples_split': 7, 'min_samples_leaf': 10, 'subsample': 0.7613143736830407, 'max_features': None}. Best is trial 1137 with value: 0.19687116000636118.
[I 2024-12-04 13:04:53,267] Trial 1322 finished with value: 0.2202603888070072 and parameters: {'n_estimators': 1444, 'learning_rate': 0.08654532798188191, 'max_depth': 12, 'min_samples_split': 20, 'min_samples_leaf': 1, 'subsample': 0.656321938325797, 'max_features': 'sqrt'}. Best is trial 1137 with value: 0.19687116000636118.
[I 2024-12-04 13:04:54,902] Trial 1342 finished with value: 0.35435272812178537 and parameters: {'n_estimators': 782, 'learning_rate': 0.07614542868743238, 'max_depth': 3, 'min_samples_split': 2, 'min_samples_leaf': 2, 'subsample': 0.6959481351811578, 'max_features': 'log2'}. Best is trial 1137 with value: 0.19687116000636118.
[I 2024-12-04 13:05:03,966] Trial 1326 finished with value: 0.21496258027049392 and parameters: {'n_estimators': 1434, 'learning_rate': 0.06631053464619543, 'max_depth': 12, 'min_samples_split': 17, 'min_samples_leaf': 1, 'subsample': 0.7366659414369997, 'max_features': 'sqrt'}. Best is trial 1137 with value: 0.19687116000636118.
[I 2024-12-04 13:05:05,195] Trial 1327 finished with value: 0.20984173932466907 and parameters: {'n_estimators': 1429, 'learning_rate': 0.0942377583148139, 'max_depth': 12, 'min_samples_split': 20, 'min_samples_leaf': 1, 'subsample': 0.6383455423594553, 'max_features': 'sqrt'}. Best is trial 1137 with value: 0.19687116000636118.
