[I 2024-12-04 20:20:32,904] Trial 1610 finished with value: 0.5076262117423834 and parameters: {'n_estimators': 345, 'max_depth': 50, 'min_samples_split': 2, 'min_samples_leaf': 1, 'max_features': 'log2', 'bootstrap': False, 'criterion': 'squared_error'}. Best is trial 874 with value: 0.32176430753353746.
[I 2024-12-04 20:20:34,469] Trial 1612 finished with value: 0.34747037186645313 and parameters: {'n_estimators': 245, 'max_depth': 44, 'min_samples_split': 2, 'min_samples_leaf': 1, 'max_features': 'sqrt', 'bootstrap': False, 'criterion': 'squared_error'}. Best is trial 874 with value: 0.32176430753353746.
[I 2024-12-04 20:20:34,820] Trial 1611 finished with value: 0.5565233732057572 and parameters: {'n_estimators': 607, 'max_depth': 19, 'min_samples_split': 4, 'min_samples_leaf': 4, 'max_features': None, 'bootstrap': False, 'criterion': 'squared_error'}. Best is trial 874 with value: 0.32176430753353746.
[I 2024-12-04 20:20:36,130] Trial 1613 finished with value: 0.4294183069622161 and parameters: {'n_estimators': 100, 'max_depth': 50, 'min_samples_split': 3, 'min_samples_leaf': 1, 'max_features': None, 'bootstrap': False, 'criterion': 'squared_error'}. Best is trial 874 with value: 0.32176430753353746.
[I 2024-12-04 20:20:37,231] Trial 1615 finished with value: 1.056065869914326 and parameters: {'n_estimators': 385, 'max_depth': 38, 'min_samples_split': 2, 'min_samples_leaf': 2, 'max_features': 'log2', 'bootstrap': False, 'criterion': 'squared_error'}. Best is trial 874 with value: 0.32176430753353746.
[I 2024-12-04 20:20:44,471] Trial 1614 finished with value: 0.34138164209097904 and parameters: {'n_estimators': 366, 'max_depth': 50, 'min_samples_split': 2, 'min_samples_leaf': 1, 'max_features': 'sqrt', 'bootstrap': False, 'criterion': 'absolute_error'}. Best is trial 874 with value: 0.32176430753353746.
[I 2024-12-04 20:20:44,612] Trial 1545 finished with value: 0.6050593985535219 and parameters: {'n_estimators': 653, 'max_depth': 27, 'min_samples_split': 44, 'min_samples_leaf': 1, 'max_features': None, 'bootstrap': False, 'criterion': 'absolute_error'}. Best is trial 874 with value: 0.32176430753353746.
[I 2024-12-04 20:20:46,439] Trial 1618 finished with value: 0.7365310651755557 and parameters: {'n_estimators': 638, 'max_depth': 29, 'min_samples_split': 36, 'min_samples_leaf': 1, 'max_features': 'sqrt', 'bootstrap': False, 'criterion': 'squared_error'}. Best is trial 874 with value: 0.32176430753353746.
[I 2024-12-04 20:20:46,510] Trial 1617 finished with value: 0.32351132331643373 and parameters: {'n_estimators': 321, 'max_depth': 50, 'min_samples_split': 2, 'min_samples_leaf': 1, 'max_features': 'sqrt', 'bootstrap': False, 'criterion': 'squared_error'}. Best is trial 874 with value: 0.32176430753353746.
[I 2024-12-04 20:20:47,928] Trial 1620 finished with value: 0.3373601420627775 and parameters: {'n_estimators': 122, 'max_depth': 50, 'min_samples_split': 2, 'min_samples_leaf': 1, 'max_features': 'sqrt', 'bootstrap': False, 'criterion': 'squared_error'}. Best is trial 874 with value: 0.32176430753353746.
[I 2024-12-04 20:20:47,997] Trial 1619 finished with value: 0.3274198592766715 and parameters: {'n_estimators': 174, 'max_depth': 50, 'min_samples_split': 2, 'min_samples_leaf': 1, 'max_features': 'sqrt', 'bootstrap': False, 'criterion': 'squared_error'}. Best is trial 874 with value: 0.32176430753353746.
[I 2024-12-04 20:20:49,921] Trial 1622 finished with value: 0.38684403115669547 and parameters: {'n_estimators': 375, 'max_depth': 41, 'min_samples_split': 3, 'min_samples_leaf': 1, 'max_features': 'sqrt', 'bootstrap': False, 'criterion': 'squared_error'}. Best is trial 874 with value: 0.32176430753353746.
[I 2024-12-04 20:20:49,986] Trial 1621 finished with value: 0.32431641896818875 and parameters: {'n_estimators': 291, 'max_depth': 50, 'min_samples_split': 2, 'min_samples_leaf': 1, 'max_features': 'sqrt', 'bootstrap': False, 'criterion': 'squared_error'}. Best is trial 874 with value: 0.32176430753353746.
[I 2024-12-04 20:20:52,129] Trial 1623 finished with value: 0.3460098636924682 and parameters: {'n_estimators': 326, 'max_depth': 42, 'min_samples_split': 2, 'min_samples_leaf': 1, 'max_features': 'sqrt', 'bootstrap': False, 'criterion': 'squared_error'}. Best is trial 874 with value: 0.32176430753353746.
[I 2024-12-04 20:20:52,655] Trial 1624 finished with value: 0.3502427206160003 and parameters: {'n_estimators': 410, 'max_depth': 43, 'min_samples_split': 2, 'min_samples_leaf': 1, 'max_features': 'sqrt', 'bootstrap': False, 'criterion': 'squared_error'}. Best is trial 874 with value: 0.32176430753353746.
[I 2024-12-04 20:20:53,867] Trial 1625 finished with value: 0.4109603247035568 and parameters: {'n_estimators': 325, 'max_depth': 43, 'min_samples_split': 4, 'min_samples_leaf': 1, 'max_features': 'sqrt', 'bootstrap': False, 'criterion': 'squared_error'}. Best is trial 874 with value: 0.32176430753353746.
[I 2024-12-04 20:20:54,398] Trial 1626 finished with value: 0.3848641216261875 and parameters: {'n_estimators': 337, 'max_depth': 50, 'min_samples_split': 4, 'min_samples_leaf': 1, 'max_features': 'sqrt', 'bootstrap': False, 'criterion': 'squared_error'}. Best is trial 874 with value: 0.32176430753353746.
[I 2024-12-04 20:20:55,239] Trial 1627 finished with value: 0.6739350270188393 and parameters: {'n_estimators': 247, 'max_depth': 43, 'min_samples_split': 2, 'min_samples_leaf': 2, 'max_features': 'sqrt', 'bootstrap': False, 'criterion': 'squared_error'}. Best is trial 874 with value: 0.32176430753353746.
[I 2024-12-04 20:20:56,045] Trial 1628 finished with value: 0.6884991545513454 and parameters: {'n_estimators': 395, 'max_depth': 43, 'min_samples_split': 2, 'min_samples_leaf': 2, 'max_features': 'sqrt', 'bootstrap': False, 'criterion': 'squared_error'}. Best is trial 874 with value: 0.32176430753353746.
[I 2024-12-04 20:20:57,453] Trial 1629 finished with value: 0.32339780767094983 and parameters: {'n_estimators': 365, 'max_depth': 50, 'min_samples_split': 2, 'min_samples_leaf': 1, 'max_features': 'sqrt', 'bootstrap': False, 'criterion': 'squared_error'}. Best is trial 874 with value: 0.32176430753353746.
[I 2024-12-04 20:20:57,454] Trial 1630 finished with value: 0.6910672340045704 and parameters: {'n_estimators': 467, 'max_depth': 50, 'min_samples_split': 3, 'min_samples_leaf': 2, 'max_features': 'sqrt', 'bootstrap': False, 'criterion': 'squared_error'}. Best is trial 874 with value: 0.32176430753353746.
[I 2024-12-04 20:20:58,847] Trial 1632 finished with value: 0.41203571612127743 and parameters: {'n_estimators': 112, 'max_depth': 44, 'min_samples_split': 2, 'min_samples_leaf': 1, 'max_features': 'sqrt', 'bootstrap': True, 'criterion': 'squared_error'}. Best is trial 874 with value: 0.32176430753353746.
[I 2024-12-04 20:20:59,195] Trial 1631 finished with value: 0.32128932742921457 and parameters: {'n_estimators': 214, 'max_depth': 50, 'min_samples_split': 2, 'min_samples_leaf': 1, 'max_features': 'sqrt', 'bootstrap': False, 'criterion': 'squared_error'}. Best is trial 1631 with value: 0.32128932742921457.
[I 2024-12-04 20:21:00,270] Trial 1634 finished with value: 0.44201608152972816 and parameters: {'n_estimators': 118, 'max_depth': 43, 'min_samples_split': 4, 'min_samples_leaf': 1, 'max_features': 'sqrt', 'bootstrap': False, 'criterion': 'squared_error'}. Best is trial 1631 with value: 0.32128932742921457.
[I 2024-12-04 20:21:00,532] Trial 1633 finished with value: 0.33492465591321324 and parameters: {'n_estimators': 258, 'max_depth': 45, 'min_samples_split': 2, 'min_samples_leaf': 1, 'max_features': 'sqrt', 'bootstrap': False, 'criterion': 'squared_error'}. Best is trial 1631 with value: 0.32128932742921457.
[I 2024-12-04 20:21:01,296] Trial 1635 finished with value: 0.6126413070133261 and parameters: {'n_estimators': 106, 'max_depth': 46, 'min_samples_split': 4, 'min_samples_leaf': 2, 'max_features': 'sqrt', 'bootstrap': False, 'criterion': 'squared_error'}. Best is trial 1631 with value: 0.32128932742921457.
[I 2024-12-04 20:21:01,867] Trial 1636 finished with value: 0.6554062222838515 and parameters: {'n_estimators': 200, 'max_depth': 50, 'min_samples_split': 2, 'min_samples_leaf': 2, 'max_features': 'sqrt', 'bootstrap': False, 'criterion': 'squared_error'}. Best is trial 1631 with value: 0.32128932742921457.
[I 2024-12-04 20:21:03,144] Trial 1637 finished with value: 0.34631467328337723 and parameters: {'n_estimators': 277, 'max_depth': 44, 'min_samples_split': 2, 'min_samples_leaf': 1, 'max_features': 'sqrt', 'bootstrap': False, 'criterion': 'squared_error'}. Best is trial 1631 with value: 0.32128932742921457.
[I 2024-12-04 20:21:03,467] Trial 1638 finished with value: 0.33160442697863585 and parameters: {'n_estimators': 194, 'max_depth': 46, 'min_samples_split': 2, 'min_samples_leaf': 1, 'max_features': 'sqrt', 'bootstrap': False, 'criterion': 'squared_error'}. Best is trial 1631 with value: 0.32128932742921457.
[I 2024-12-04 20:21:04,441] Trial 1639 finished with value: 0.4018625243828182 and parameters: {'n_estimators': 141, 'max_depth': 42, 'min_samples_split': 3, 'min_samples_leaf': 1, 'max_features': 'sqrt', 'bootstrap': False, 'criterion': 'squared_error'}. Best is trial 1631 with value: 0.32128932742921457.
[I 2024-12-04 20:21:04,987] Trial 1640 finished with value: 0.351013364948842 and parameters: {'n_estimators': 157, 'max_depth': 42, 'min_samples_split': 2, 'min_samples_leaf': 1, 'max_features': 'sqrt', 'bootstrap': False, 'criterion': 'squared_error'}. Best is trial 1631 with value: 0.32128932742921457.
[I 2024-12-04 20:21:05,740] Trial 1641 finished with value: 0.8818573013471315 and parameters: {'n_estimators': 312, 'max_depth': 32, 'min_samples_split': 34, 'min_samples_leaf': 1, 'max_features': 'log2', 'bootstrap': False, 'criterion': 'squared_error'}. Best is trial 1631 with value: 0.32128932742921457.
[I 2024-12-04 20:21:06,157] Trial 1642 finished with value: 0.6372791692537049 and parameters: {'n_estimators': 120, 'max_depth': 49, 'min_samples_split': 2, 'min_samples_leaf': 2, 'max_features': 'sqrt', 'bootstrap': False, 'criterion': 'squared_error'}. Best is trial 1631 with value: 0.32128932742921457.
[I 2024-12-04 20:21:07,637] Trial 1644 finished with value: 0.5373610009787849 and parameters: {'n_estimators': 100, 'max_depth': 45, 'min_samples_split': 2, 'min_samples_leaf': 2, 'max_features': None, 'bootstrap': False, 'criterion': 'squared_error'}. Best is trial 1631 with value: 0.32128932742921457.
[I 2024-12-04 20:21:08,892] Trial 1645 finished with value: 0.33638168634443355 and parameters: {'n_estimators': 149, 'max_depth': 50, 'min_samples_split': 2, 'min_samples_leaf': 1, 'max_features': 'sqrt', 'bootstrap': False, 'criterion': 'squared_error'}. Best is trial 1631 with value: 0.32128932742921457.
[I 2024-12-04 20:21:10,040] Trial 1646 finished with value: 0.3419125750000444 and parameters: {'n_estimators': 115, 'max_depth': 49, 'min_samples_split': 2, 'min_samples_leaf': 1, 'max_features': 'sqrt', 'bootstrap': False, 'criterion': 'squared_error'}. Best is trial 1631 with value: 0.32128932742921457.
[I 2024-12-04 20:21:10,773] Trial 1616 finished with value: 0.444137383535644 and parameters: {'n_estimators': 583, 'max_depth': 9, 'min_samples_split': 2, 'min_samples_leaf': 1, 'max_features': None, 'bootstrap': True, 'criterion': 'absolute_error'}. Best is trial 1631 with value: 0.32128932742921457.
[I 2024-12-04 20:21:11,449] Trial 1643 finished with value: 0.982611028489529 and parameters: {'n_estimators': 570, 'max_depth': 27, 'min_samples_split': 7, 'min_samples_leaf': 1, 'max_features': 'log2', 'bootstrap': True, 'criterion': 'absolute_error'}. Best is trial 1631 with value: 0.32128932742921457.
[I 2024-12-04 20:21:12,237] Trial 1647 finished with value: 0.3235529079870083 and parameters: {'n_estimators': 337, 'max_depth': 50, 'min_samples_split': 2, 'min_samples_leaf': 1, 'max_features': 'sqrt', 'bootstrap': False, 'criterion': 'squared_error'}. Best is trial 1631 with value: 0.32128932742921457.
[I 2024-12-04 20:21:12,247] Trial 1648 finished with value: 0.360164490900515 and parameters: {'n_estimators': 208, 'max_depth': 50, 'min_samples_split': 3, 'min_samples_leaf': 1, 'max_features': 'sqrt', 'bootstrap': False, 'criterion': 'squared_error'}. Best is trial 1631 with value: 0.32128932742921457.
[I 2024-12-04 20:21:12,563] Trial 1649 finished with value: 0.5110109137063955 and parameters: {'n_estimators': 141, 'max_depth': 30, 'min_samples_split': 4, 'min_samples_leaf': 1, 'max_features': 'sqrt', 'bootstrap': False, 'criterion': 'squared_error'}. Best is trial 1631 with value: 0.32128932742921457.
[I 2024-12-04 20:21:13,830] Trial 1652 finished with value: 1.0236281807285559 and parameters: {'n_estimators': 215, 'max_depth': 34, 'min_samples_split': 40, 'min_samples_leaf': 5, 'max_features': 'sqrt', 'bootstrap': False, 'criterion': 'squared_error'}. Best is trial 1631 with value: 0.32128932742921457.
[I 2024-12-04 20:21:13,836] Trial 1650 finished with value: 0.3616001269057184 and parameters: {'n_estimators': 204, 'max_depth': 50, 'min_samples_split': 3, 'min_samples_leaf': 1, 'max_features': 'sqrt', 'bootstrap': False, 'criterion': 'squared_error'}. Best is trial 1631 with value: 0.32128932742921457.
[I 2024-12-04 20:21:14,016] Trial 1651 finished with value: 0.499649927901372 and parameters: {'n_estimators': 168, 'max_depth': 50, 'min_samples_split': 2, 'min_samples_leaf': 1, 'max_features': 'log2', 'bootstrap': False, 'criterion': 'squared_error'}. Best is trial 1631 with value: 0.32128932742921457.
[I 2024-12-04 20:21:16,083] Trial 1655 finished with value: 0.38637095736546523 and parameters: {'n_estimators': 245, 'max_depth': 50, 'min_samples_split': 4, 'min_samples_leaf': 1, 'max_features': 'sqrt', 'bootstrap': False, 'criterion': 'squared_error'}. Best is trial 1631 with value: 0.32128932742921457.
[I 2024-12-04 20:21:16,382] Trial 1653 finished with value: 0.3458823139095606 and parameters: {'n_estimators': 333, 'max_depth': 43, 'min_samples_split': 2, 'min_samples_leaf': 1, 'max_features': 'sqrt', 'bootstrap': False, 'criterion': 'squared_error'}. Best is trial 1631 with value: 0.32128932742921457.
[I 2024-12-04 20:21:17,002] Trial 1654 finished with value: 0.930073359201572 and parameters: {'n_estimators': 911, 'max_depth': 10, 'min_samples_split': 4, 'min_samples_leaf': 1, 'max_features': 'sqrt', 'bootstrap': True, 'criterion': 'squared_error'}. Best is trial 1631 with value: 0.32128932742921457.
[I 2024-12-04 20:21:17,890] Trial 1656 finished with value: 0.32559681221154163 and parameters: {'n_estimators': 180, 'max_depth': 50, 'min_samples_split': 2, 'min_samples_leaf': 1, 'max_features': 'sqrt', 'bootstrap': False, 'criterion': 'squared_error'}. Best is trial 1631 with value: 0.32128932742921457.
[I 2024-12-04 20:21:18,630] Trial 1657 finished with value: 0.32502848393502454 and parameters: {'n_estimators': 267, 'max_depth': 50, 'min_samples_split': 2, 'min_samples_leaf': 1, 'max_features': 'sqrt', 'bootstrap': False, 'criterion': 'squared_error'}. Best is trial 1631 with value: 0.32128932742921457.
[I 2024-12-04 20:21:19,377] Trial 1659 finished with value: 0.33505190624540715 and parameters: {'n_estimators': 144, 'max_depth': 50, 'min_samples_split': 2, 'min_samples_leaf': 1, 'max_features': 'sqrt', 'bootstrap': False, 'criterion': 'squared_error'}. Best is trial 1631 with value: 0.32128932742921457.
[I 2024-12-04 20:21:19,803] Trial 1658 finished with value: 1.2496882266955567 and parameters: {'n_estimators': 642, 'max_depth': 38, 'min_samples_split': 2, 'min_samples_leaf': 6, 'max_features': 'sqrt', 'bootstrap': True, 'criterion': 'absolute_error'}. Best is trial 1631 with value: 0.32128932742921457.
[I 2024-12-04 20:21:23,536] Trial 1662 finished with value: 0.4353998573894718 and parameters: {'n_estimators': 352, 'max_depth': 44, 'min_samples_split': 2, 'min_samples_leaf': 1, 'max_features': None, 'bootstrap': False, 'criterion': 'squared_error'}. Best is trial 1631 with value: 0.32128932742921457.
[I 2024-12-04 20:21:24,553] Trial 1660 finished with value: 0.38085739882949377 and parameters: {'n_estimators': 174, 'max_depth': 41, 'min_samples_split': 2, 'min_samples_leaf': 1, 'max_features': 'sqrt', 'bootstrap': False, 'criterion': 'absolute_error'}. Best is trial 1631 with value: 0.32128932742921457.
[I 2024-12-04 20:21:24,862] Trial 1663 finished with value: 0.6670085698600065 and parameters: {'n_estimators': 355, 'max_depth': 50, 'min_samples_split': 3, 'min_samples_leaf': 2, 'max_features': 'sqrt', 'bootstrap': False, 'criterion': 'squared_error'}. Best is trial 1631 with value: 0.32128932742921457.
[I 2024-12-04 20:21:25,953] Trial 1665 finished with value: 0.654007436501342 and parameters: {'n_estimators': 181, 'max_depth': 50, 'min_samples_split': 2, 'min_samples_leaf': 2, 'max_features': 'sqrt', 'bootstrap': False, 'criterion': 'squared_error'}. Best is trial 1631 with value: 0.32128932742921457.
[I 2024-12-04 20:21:26,020] Trial 1664 finished with value: 0.3569739390254153 and parameters: {'n_estimators': 252, 'max_depth': 50, 'min_samples_split': 3, 'min_samples_leaf': 1, 'max_features': 'sqrt', 'bootstrap': False, 'criterion': 'squared_error'}. Best is trial 1631 with value: 0.32128932742921457.
[I 2024-12-04 20:21:28,082] Trial 1666 finished with value: 0.32432958404010126 and parameters: {'n_estimators': 308, 'max_depth': 50, 'min_samples_split': 2, 'min_samples_leaf': 1, 'max_features': 'sqrt', 'bootstrap': False, 'criterion': 'squared_error'}. Best is trial 1631 with value: 0.32128932742921457.
[I 2024-12-04 20:21:28,085] Trial 1667 finished with value: 0.34612038372507914 and parameters: {'n_estimators': 301, 'max_depth': 44, 'min_samples_split': 2, 'min_samples_leaf': 1, 'max_features': 'sqrt', 'bootstrap': False, 'criterion': 'squared_error'}. Best is trial 1631 with value: 0.32128932742921457.
[I 2024-12-04 20:21:29,731] Trial 1661 finished with value: 0.8803501716262526 and parameters: {'n_estimators': 598, 'max_depth': 39, 'min_samples_split': 4, 'min_samples_leaf': 2, 'max_features': 'sqrt', 'bootstrap': False, 'criterion': 'absolute_error'}. Best is trial 1631 with value: 0.32128932742921457.
[I 2024-12-04 20:21:30,967] Trial 1669 finished with value: 0.630919291813314 and parameters: {'n_estimators': 352, 'max_depth': 38, 'min_samples_split': 2, 'min_samples_leaf': 1, 'max_features': 'log2', 'bootstrap': False, 'criterion': 'squared_error'}. Best is trial 1631 with value: 0.32128932742921457.
[I 2024-12-04 20:21:31,035] Trial 1668 finished with value: 0.32309794764926164 and parameters: {'n_estimators': 384, 'max_depth': 50, 'min_samples_split': 2, 'min_samples_leaf': 1, 'max_features': 'sqrt', 'bootstrap': False, 'criterion': 'squared_error'}. Best is trial 1631 with value: 0.32128932742921457.
[I 2024-12-04 20:21:32,498] Trial 1671 finished with value: 0.6655162203368837 and parameters: {'n_estimators': 335, 'max_depth': 50, 'min_samples_split': 2, 'min_samples_leaf': 2, 'max_features': 'sqrt', 'bootstrap': False, 'criterion': 'squared_error'}. Best is trial 1631 with value: 0.32128932742921457.
[I 2024-12-04 20:21:34,050] Trial 1673 finished with value: 0.44317954124168435 and parameters: {'n_estimators': 329, 'max_depth': 40, 'min_samples_split': 3, 'min_samples_leaf': 1, 'max_features': 'sqrt', 'bootstrap': True, 'criterion': 'squared_error'}. Best is trial 1631 with value: 0.32128932742921457.
[I 2024-12-04 20:21:34,656] Trial 1670 finished with value: 1.1974602128376874 and parameters: {'n_estimators': 555, 'max_depth': 23, 'min_samples_split': 5, 'min_samples_leaf': 2, 'max_features': 'log2', 'bootstrap': False, 'criterion': 'absolute_error'}. Best is trial 1631 with value: 0.32128932742921457.
[I 2024-12-04 20:21:35,810] Trial 1674 finished with value: 0.4088254106213644 and parameters: {'n_estimators': 353, 'max_depth': 42, 'min_samples_split': 4, 'min_samples_leaf': 1, 'max_features': 'sqrt', 'bootstrap': False, 'criterion': 'squared_error'}. Best is trial 1631 with value: 0.32128932742921457.
[I 2024-12-04 20:21:36,581] Trial 1675 finished with value: 0.32328248162449913 and parameters: {'n_estimators': 261, 'max_depth': 50, 'min_samples_split': 2, 'min_samples_leaf': 1, 'max_features': 'sqrt', 'bootstrap': False, 'criterion': 'squared_error'}. Best is trial 1631 with value: 0.32128932742921457.
[I 2024-12-04 20:21:37,126] Trial 1676 finished with value: 0.6553640704008897 and parameters: {'n_estimators': 291, 'max_depth': 50, 'min_samples_split': 3, 'min_samples_leaf': 2, 'max_features': 'sqrt', 'bootstrap': False, 'criterion': 'squared_error'}. Best is trial 1631 with value: 0.32128932742921457.
[I 2024-12-04 20:21:38,778] Trial 1678 finished with value: 0.38680274933731423 and parameters: {'n_estimators': 375, 'max_depth': 50, 'min_samples_split': 4, 'min_samples_leaf': 1, 'max_features': 'sqrt', 'bootstrap': False, 'criterion': 'squared_error'}. Best is trial 1631 with value: 0.32128932742921457.
[I 2024-12-04 20:21:38,787] Trial 1677 finished with value: 0.34633538329398 and parameters: {'n_estimators': 350, 'max_depth': 43, 'min_samples_split': 2, 'min_samples_leaf': 1, 'max_features': 'sqrt', 'bootstrap': False, 'criterion': 'squared_error'}. Best is trial 1631 with value: 0.32128932742921457.
[I 2024-12-04 20:21:38,830] Trial 1672 finished with value: 0.8836079906983818 and parameters: {'n_estimators': 471, 'max_depth': 48, 'min_samples_split': 3, 'min_samples_leaf': 2, 'max_features': 'sqrt', 'bootstrap': False, 'criterion': 'absolute_error'}. Best is trial 1631 with value: 0.32128932742921457.
[I 2024-12-04 20:21:40,538] Trial 1680 finished with value: 0.6805851789690163 and parameters: {'n_estimators': 273, 'max_depth': 40, 'min_samples_split': 2, 'min_samples_leaf': 2, 'max_features': 'sqrt', 'bootstrap': False, 'criterion': 'squared_error'}. Best is trial 1631 with value: 0.32128932742921457.
