[I 2024-12-04 14:55:04,472] Trial 607 finished with value: 0.6731854973574265 and parameters: {'n_estimators': 807, 'learning_rate': 0.06299239325789602, 'max_depth': 10, 'min_samples_split': 20, 'min_samples_leaf': 2, 'subsample': 0.931623473944344, 'max_features': 'log2'}. Best is trial 603 with value: 0.45955205541891275.
[I 2024-12-04 14:55:04,473] Trial 606 finished with value: 0.48808253796494055 and parameters: {'n_estimators': 766, 'learning_rate': 0.038553319170581295, 'max_depth': 12, 'min_samples_split': 20, 'min_samples_leaf': 1, 'subsample': 0.9339803513321274, 'max_features': None}. Best is trial 603 with value: 0.45955205541891275.
[I 2024-12-04 14:55:07,332] Trial 600 finished with value: 0.6184942417698669 and parameters: {'n_estimators': 1117, 'learning_rate': 0.027223294495518323, 'max_depth': 11, 'min_samples_split': 18, 'min_samples_leaf': 4, 'subsample': 0.8853711377809419, 'max_features': None}. Best is trial 603 with value: 0.45955205541891275.
[I 2024-12-04 14:55:07,335] Trial 613 finished with value: 0.5880598739098906 and parameters: {'n_estimators': 597, 'learning_rate': 0.05491404502390555, 'max_depth': 3, 'min_samples_split': 13, 'min_samples_leaf': 1, 'subsample': 0.7205449596995891, 'max_features': 'sqrt'}. Best is trial 603 with value: 0.45955205541891275.
[I 2024-12-04 14:55:08,249] Trial 604 finished with value: 0.6438730794253946 and parameters: {'n_estimators': 1268, 'learning_rate': 0.02007000214244946, 'max_depth': 11, 'min_samples_split': 8, 'min_samples_leaf': 3, 'subsample': 0.996199978120154, 'max_features': 'sqrt'}. Best is trial 603 with value: 0.45955205541891275.
[I 2024-12-04 14:55:08,449] Trial 610 finished with value: 0.4787001073510926 and parameters: {'n_estimators': 711, 'learning_rate': 0.06649981307281548, 'max_depth': 12, 'min_samples_split': 19, 'min_samples_leaf': 1, 'subsample': 0.9817494657318155, 'max_features': None}. Best is trial 603 with value: 0.45955205541891275.
[I 2024-12-04 14:55:10,391] Trial 608 finished with value: 0.47229875516279957 and parameters: {'n_estimators': 825, 'learning_rate': 0.06440045839322588, 'max_depth': 12, 'min_samples_split': 20, 'min_samples_leaf': 1, 'subsample': 0.9981644760399349, 'max_features': None}. Best is trial 603 with value: 0.45955205541891275.
[I 2024-12-04 14:55:14,856] Trial 611 finished with value: 0.4807519269903102 and parameters: {'n_estimators': 806, 'learning_rate': 0.04541354716730705, 'max_depth': 12, 'min_samples_split': 20, 'min_samples_leaf': 1, 'subsample': 0.9052064115935252, 'max_features': None}. Best is trial 603 with value: 0.45955205541891275.
[I 2024-12-04 14:55:15,911] Trial 609 finished with value: 0.6603108722268051 and parameters: {'n_estimators': 1342, 'learning_rate': 0.012469514422529452, 'max_depth': 10, 'min_samples_split': 2, 'min_samples_leaf': 6, 'subsample': 0.7887367203898208, 'max_features': 'sqrt'}. Best is trial 603 with value: 0.45955205541891275.
[I 2024-12-04 14:55:16,860] Trial 618 finished with value: 0.7168466014783703 and parameters: {'n_estimators': 626, 'learning_rate': 0.03792679540411503, 'max_depth': 3, 'min_samples_split': 8, 'min_samples_leaf': 10, 'subsample': 0.8736990563098329, 'max_features': None}. Best is trial 603 with value: 0.45955205541891275.
[I 2024-12-04 14:55:17,238] Trial 627 finished with value: 0.5872183478009491 and parameters: {'n_estimators': 391, 'learning_rate': 0.01851839816025422, 'max_depth': 10, 'min_samples_split': 3, 'min_samples_leaf': 4, 'subsample': 0.8074804837817838, 'max_features': None}. Best is trial 603 with value: 0.45955205541891275.
[I 2024-12-04 14:55:20,101] Trial 612 finished with value: 0.4760607090767968 and parameters: {'n_estimators': 1122, 'learning_rate': 0.036247442649004584, 'max_depth': 12, 'min_samples_split': 20, 'min_samples_leaf': 1, 'subsample': 0.961113279564348, 'max_features': None}. Best is trial 603 with value: 0.45955205541891275.
[I 2024-12-04 14:55:21,099] Trial 628 finished with value: 0.6258298702892876 and parameters: {'n_estimators': 622, 'learning_rate': 0.010874686492601754, 'max_depth': 12, 'min_samples_split': 3, 'min_samples_leaf': 3, 'subsample': 0.9022192531483666, 'max_features': 'sqrt'}. Best is trial 603 with value: 0.45955205541891275.
[I 2024-12-04 14:55:22,094] Trial 614 finished with value: 0.6210875183723631 and parameters: {'n_estimators': 961, 'learning_rate': 0.03166938898123527, 'max_depth': 11, 'min_samples_split': 20, 'min_samples_leaf': 2, 'subsample': 0.9056015616848089, 'max_features': None}. Best is trial 603 with value: 0.45955205541891275.
[I 2024-12-04 14:55:22,106] Trial 620 finished with value: 0.4828870213918048 and parameters: {'n_estimators': 759, 'learning_rate': 0.0656610075665174, 'max_depth': 12, 'min_samples_split': 20, 'min_samples_leaf': 1, 'subsample': 0.9565616138965316, 'max_features': None}. Best is trial 603 with value: 0.45955205541891275.
[I 2024-12-04 14:55:24,458] Trial 626 finished with value: 0.5644309021005387 and parameters: {'n_estimators': 693, 'learning_rate': 0.03596244495739912, 'max_depth': 5, 'min_samples_split': 13, 'min_samples_leaf': 1, 'subsample': 0.9310244081432976, 'max_features': 'sqrt'}. Best is trial 603 with value: 0.45955205541891275.
[I 2024-12-04 14:55:26,147] Trial 617 finished with value: 0.5795493989999804 and parameters: {'n_estimators': 1235, 'learning_rate': 0.037834970407898155, 'max_depth': 11, 'min_samples_split': 20, 'min_samples_leaf': 1, 'subsample': 0.972743988371636, 'max_features': 'log2'}. Best is trial 603 with value: 0.45955205541891275.
[I 2024-12-04 14:55:27,344] Trial 625 finished with value: 0.4720373870405022 and parameters: {'n_estimators': 750, 'learning_rate': 0.07110226472666463, 'max_depth': 12, 'min_samples_split': 20, 'min_samples_leaf': 1, 'subsample': 0.9787336680796295, 'max_features': None}. Best is trial 603 with value: 0.45955205541891275.
[I 2024-12-04 14:55:28,705] Trial 629 finished with value: 0.4774735397921633 and parameters: {'n_estimators': 766, 'learning_rate': 0.07880150136243688, 'max_depth': 11, 'min_samples_split': 20, 'min_samples_leaf': 1, 'subsample': 0.977608200885498, 'max_features': None}. Best is trial 603 with value: 0.45955205541891275.
[I 2024-12-04 14:55:30,655] Trial 643 finished with value: 0.7528820051263102 and parameters: {'n_estimators': 459, 'learning_rate': 0.08070053216118128, 'max_depth': 5, 'min_samples_split': 20, 'min_samples_leaf': 9, 'subsample': 0.9009498516282642, 'max_features': None}. Best is trial 603 with value: 0.45955205541891275.
[I 2024-12-04 14:55:31,682] Trial 638 finished with value: 0.47312405393681334 and parameters: {'n_estimators': 543, 'learning_rate': 0.08764691162709248, 'max_depth': 12, 'min_samples_split': 20, 'min_samples_leaf': 1, 'subsample': 0.9830514167344926, 'max_features': None}. Best is trial 603 with value: 0.45955205541891275.
[I 2024-12-04 14:55:32,104] Trial 632 finished with value: 0.6139172252453652 and parameters: {'n_estimators': 866, 'learning_rate': 0.02963038778759843, 'max_depth': 11, 'min_samples_split': 7, 'min_samples_leaf': 4, 'subsample': 0.6076652728465437, 'max_features': 'sqrt'}. Best is trial 603 with value: 0.45955205541891275.
[I 2024-12-04 14:55:32,751] Trial 615 finished with value: 0.4857254908704433 and parameters: {'n_estimators': 1213, 'learning_rate': 0.048794821430975695, 'max_depth': 12, 'min_samples_split': 20, 'min_samples_leaf': 1, 'subsample': 0.8543054755218771, 'max_features': None}. Best is trial 603 with value: 0.45955205541891275.
[I 2024-12-04 14:55:33,445] Trial 616 finished with value: 0.5628054777285194 and parameters: {'n_estimators': 1328, 'learning_rate': 0.05346643009795374, 'max_depth': 11, 'min_samples_split': 2, 'min_samples_leaf': 5, 'subsample': 0.9025205330223286, 'max_features': None}. Best is trial 603 with value: 0.45955205541891275.
[I 2024-12-04 14:55:33,659] Trial 621 finished with value: 0.4763609430817045 and parameters: {'n_estimators': 1022, 'learning_rate': 0.06859927747508346, 'max_depth': 12, 'min_samples_split': 17, 'min_samples_leaf': 1, 'subsample': 0.9669719191057715, 'max_features': None}. Best is trial 603 with value: 0.45955205541891275.
[I 2024-12-04 14:55:34,816] Trial 634 finished with value: 0.6394112805144312 and parameters: {'n_estimators': 806, 'learning_rate': 0.04858323586329753, 'max_depth': 10, 'min_samples_split': 15, 'min_samples_leaf': 3, 'subsample': 0.9971548668335145, 'max_features': None}. Best is trial 603 with value: 0.45955205541891275.
[I 2024-12-04 14:55:34,951] Trial 619 finished with value: 0.46645320962919107 and parameters: {'n_estimators': 1124, 'learning_rate': 0.059628869348013376, 'max_depth': 12, 'min_samples_split': 20, 'min_samples_leaf': 1, 'subsample': 0.9597658944083963, 'max_features': None}. Best is trial 603 with value: 0.45955205541891275.
[I 2024-12-04 14:55:35,903] Trial 651 finished with value: 0.9570365022862543 and parameters: {'n_estimators': 340, 'learning_rate': 0.025177647005102822, 'max_depth': 4, 'min_samples_split': 12, 'min_samples_leaf': 3, 'subsample': 0.8468944701765551, 'max_features': 'log2'}. Best is trial 603 with value: 0.45955205541891275.
[I 2024-12-04 14:55:36,827] Trial 622 finished with value: 0.6616907547603577 and parameters: {'n_estimators': 1472, 'learning_rate': 0.018136250577584168, 'max_depth': 11, 'min_samples_split': 20, 'min_samples_leaf': 2, 'subsample': 0.878766043197027, 'max_features': 'log2'}. Best is trial 603 with value: 0.45955205541891275.
[I 2024-12-04 14:55:38,602] Trial 645 finished with value: 0.8408311469460279 and parameters: {'n_estimators': 708, 'learning_rate': 0.08890429217792965, 'max_depth': 10, 'min_samples_split': 16, 'min_samples_leaf': 8, 'subsample': 0.6714622098535723, 'max_features': 'sqrt'}. Best is trial 603 with value: 0.45955205541891275.
[I 2024-12-04 14:55:40,720] Trial 635 finished with value: 0.4900292112550424 and parameters: {'n_estimators': 908, 'learning_rate': 0.07675736522150524, 'max_depth': 12, 'min_samples_split': 20, 'min_samples_leaf': 1, 'subsample': 0.9008965859885961, 'max_features': None}. Best is trial 603 with value: 0.45955205541891275.
[I 2024-12-04 14:55:41,024] Trial 633 finished with value: 0.6496546911852643 and parameters: {'n_estimators': 905, 'learning_rate': 0.06408254725516396, 'max_depth': 10, 'min_samples_split': 20, 'min_samples_leaf': 2, 'subsample': 0.904721745020373, 'max_features': None}. Best is trial 603 with value: 0.45955205541891275.
[I 2024-12-04 14:55:41,026] Trial 631 finished with value: 0.6417410983866221 and parameters: {'n_estimators': 968, 'learning_rate': 0.07252708588871434, 'max_depth': 12, 'min_samples_split': 17, 'min_samples_leaf': 3, 'subsample': 0.9528753158698742, 'max_features': None}. Best is trial 603 with value: 0.45955205541891275.
[I 2024-12-04 14:55:41,158] Trial 624 finished with value: 0.6672718906693617 and parameters: {'n_estimators': 1460, 'learning_rate': 0.013161496919706611, 'max_depth': 4, 'min_samples_split': 7, 'min_samples_leaf': 2, 'subsample': 0.7415057688654108, 'max_features': None}. Best is trial 603 with value: 0.45955205541891275.
[I 2024-12-04 14:55:41,322] Trial 623 finished with value: 0.6209253032604234 and parameters: {'n_estimators': 1277, 'learning_rate': 0.037917596932330114, 'max_depth': 12, 'min_samples_split': 2, 'min_samples_leaf': 3, 'subsample': 0.7385462435219569, 'max_features': 'log2'}. Best is trial 603 with value: 0.45955205541891275.
[I 2024-12-04 14:55:41,687] Trial 654 finished with value: 0.6689672928713197 and parameters: {'n_estimators': 362, 'learning_rate': 0.08681111052429408, 'max_depth': 11, 'min_samples_split': 20, 'min_samples_leaf': 2, 'subsample': 0.9872058419982417, 'max_features': 'log2'}. Best is trial 603 with value: 0.45955205541891275.
[I 2024-12-04 14:55:41,975] Trial 637 finished with value: 0.48471754693790225 and parameters: {'n_estimators': 917, 'learning_rate': 0.07482529444794649, 'max_depth': 10, 'min_samples_split': 19, 'min_samples_leaf': 1, 'subsample': 0.9653476788700678, 'max_features': None}. Best is trial 603 with value: 0.45955205541891275.
[I 2024-12-04 14:55:41,979] Trial 636 finished with value: 0.4836409199350587 and parameters: {'n_estimators': 825, 'learning_rate': 0.09700070174061169, 'max_depth': 12, 'min_samples_split': 20, 'min_samples_leaf': 1, 'subsample': 0.960102545109049, 'max_features': None}. Best is trial 603 with value: 0.45955205541891275.
[I 2024-12-04 14:55:42,651] Trial 660 finished with value: 0.8183140413168805 and parameters: {'n_estimators': 116, 'learning_rate': 0.03479867386174531, 'max_depth': 9, 'min_samples_split': 14, 'min_samples_leaf': 1, 'subsample': 0.935687260257303, 'max_features': 'log2'}. Best is trial 603 with value: 0.45955205541891275.
[I 2024-12-04 14:55:43,165] Trial 639 finished with value: 0.4730321337058299 and parameters: {'n_estimators': 891, 'learning_rate': 0.0776080265036575, 'max_depth': 12, 'min_samples_split': 20, 'min_samples_leaf': 1, 'subsample': 0.9433129904414363, 'max_features': None}. Best is trial 603 with value: 0.45955205541891275.
[I 2024-12-04 14:55:46,313] Trial 630 finished with value: 0.6252260306394473 and parameters: {'n_estimators': 1299, 'learning_rate': 0.021971300649930414, 'max_depth': 8, 'min_samples_split': 16, 'min_samples_leaf': 6, 'subsample': 0.6558046872301132, 'max_features': None}. Best is trial 603 with value: 0.45955205541891275.
[I 2024-12-04 14:55:46,930] Trial 641 finished with value: 0.6293953593903272 and parameters: {'n_estimators': 1176, 'learning_rate': 0.07620955981736884, 'max_depth': 12, 'min_samples_split': 12, 'min_samples_leaf': 2, 'subsample': 0.9611254182186827, 'max_features': 'sqrt'}. Best is trial 603 with value: 0.45955205541891275.
[I 2024-12-04 14:55:49,059] Trial 665 finished with value: 1.0354849292295618 and parameters: {'n_estimators': 184, 'learning_rate': 0.012587697507237313, 'max_depth': 6, 'min_samples_split': 16, 'min_samples_leaf': 2, 'subsample': 0.8820787971833556, 'max_features': 'log2'}. Best is trial 603 with value: 0.45955205541891275.
[I 2024-12-04 14:55:49,062] Trial 646 finished with value: 0.48914398570921613 and parameters: {'n_estimators': 842, 'learning_rate': 0.04347064276030859, 'max_depth': 11, 'min_samples_split': 19, 'min_samples_leaf': 1, 'subsample': 0.9899601356612786, 'max_features': None}. Best is trial 603 with value: 0.45955205541891275.
[I 2024-12-04 14:55:49,214] Trial 642 finished with value: 0.701046779443316 and parameters: {'n_estimators': 1260, 'learning_rate': 0.02733713648474991, 'max_depth': 7, 'min_samples_split': 12, 'min_samples_leaf': 5, 'subsample': 0.6150894657707041, 'max_features': 'sqrt'}. Best is trial 603 with value: 0.45955205541891275.
[I 2024-12-04 14:55:49,733] Trial 655 finished with value: 0.5505015642191154 and parameters: {'n_estimators': 538, 'learning_rate': 0.04979578812708421, 'max_depth': 10, 'min_samples_split': 20, 'min_samples_leaf': 1, 'subsample': 0.9807823860150181, 'max_features': 'sqrt'}. Best is trial 603 with value: 0.45955205541891275.
[I 2024-12-04 14:55:49,923] Trial 644 finished with value: 0.6280795228666345 and parameters: {'n_estimators': 990, 'learning_rate': 0.044324408868333325, 'max_depth': 11, 'min_samples_split': 16, 'min_samples_leaf': 2, 'subsample': 0.9761868682896265, 'max_features': None}. Best is trial 603 with value: 0.45955205541891275.
[I 2024-12-04 14:55:50,484] Trial 640 finished with value: 0.659546347370248 and parameters: {'n_estimators': 1122, 'learning_rate': 0.060544925983915074, 'max_depth': 10, 'min_samples_split': 20, 'min_samples_leaf': 2, 'subsample': 0.9978915325088488, 'max_features': None}. Best is trial 603 with value: 0.45955205541891275.
[I 2024-12-04 14:55:52,737] Trial 652 finished with value: 0.47965165541158145 and parameters: {'n_estimators': 783, 'learning_rate': 0.057852671272804905, 'max_depth': 12, 'min_samples_split': 19, 'min_samples_leaf': 1, 'subsample': 0.98805877827989, 'max_features': None}. Best is trial 603 with value: 0.45955205541891275.
[I 2024-12-04 14:55:55,185] Trial 649 finished with value: 0.47714642637891913 and parameters: {'n_estimators': 961, 'learning_rate': 0.050659196596974855, 'max_depth': 12, 'min_samples_split': 18, 'min_samples_leaf': 1, 'subsample': 0.9985467445338904, 'max_features': None}. Best is trial 603 with value: 0.45955205541891275.
[I 2024-12-04 14:55:55,212] Trial 653 finished with value: 0.5179758301735593 and parameters: {'n_estimators': 860, 'learning_rate': 0.0462682244946167, 'max_depth': 12, 'min_samples_split': 15, 'min_samples_leaf': 1, 'subsample': 0.8831543891113138, 'max_features': None}. Best is trial 603 with value: 0.45955205541891275.
[I 2024-12-04 14:55:55,241] Trial 648 finished with value: 0.4905504993768693 and parameters: {'n_estimators': 959, 'learning_rate': 0.05808530680807137, 'max_depth': 11, 'min_samples_split': 17, 'min_samples_leaf': 1, 'subsample': 0.991686022129089, 'max_features': None}. Best is trial 603 with value: 0.45955205541891275.
[I 2024-12-04 14:55:55,280] Trial 647 finished with value: 0.4802526202086801 and parameters: {'n_estimators': 975, 'learning_rate': 0.047090556651750756, 'max_depth': 12, 'min_samples_split': 18, 'min_samples_leaf': 1, 'subsample': 0.9841125085326035, 'max_features': None}. Best is trial 603 with value: 0.45955205541891275.
[I 2024-12-04 14:55:57,024] Trial 656 finished with value: 0.6248810764130415 and parameters: {'n_estimators': 755, 'learning_rate': 0.0555421551165546, 'max_depth': 12, 'min_samples_split': 19, 'min_samples_leaf': 2, 'subsample': 0.9888404231145135, 'max_features': None}. Best is trial 603 with value: 0.45955205541891275.
[I 2024-12-04 14:55:57,899] Trial 650 finished with value: 0.8100138513727801 and parameters: {'n_estimators': 1359, 'learning_rate': 0.05344253569950294, 'max_depth': 8, 'min_samples_split': 19, 'min_samples_leaf': 9, 'subsample': 0.8771666841957506, 'max_features': 'log2'}. Best is trial 603 with value: 0.45955205541891275.
[I 2024-12-04 14:56:00,195] Trial 659 finished with value: 0.47336120235780177 and parameters: {'n_estimators': 698, 'learning_rate': 0.07274430997086981, 'max_depth': 12, 'min_samples_split': 18, 'min_samples_leaf': 1, 'subsample': 0.9999858654326219, 'max_features': None}. Best is trial 603 with value: 0.45955205541891275.
[I 2024-12-04 14:56:01,579] Trial 664 finished with value: 0.6452473283240083 and parameters: {'n_estimators': 728, 'learning_rate': 0.08992272488752823, 'max_depth': 12, 'min_samples_split': 16, 'min_samples_leaf': 3, 'subsample': 0.985672008361281, 'max_features': None}. Best is trial 603 with value: 0.45955205541891275.
[I 2024-12-04 14:56:01,707] Trial 669 finished with value: 0.5855793936420296 and parameters: {'n_estimators': 423, 'learning_rate': 0.029552873705936705, 'max_depth': 5, 'min_samples_split': 2, 'min_samples_leaf': 4, 'subsample': 0.8397349436373982, 'max_features': None}. Best is trial 603 with value: 0.45955205541891275.
[I 2024-12-04 14:56:03,393] Trial 661 finished with value: 0.7549440913446892 and parameters: {'n_estimators': 964, 'learning_rate': 0.021226506450036948, 'max_depth': 5, 'min_samples_split': 6, 'min_samples_leaf': 10, 'subsample': 0.6059996158606928, 'max_features': None}. Best is trial 603 with value: 0.45955205541891275.
[I 2024-12-04 14:56:05,917] Trial 676 finished with value: 0.5674204194329262 and parameters: {'n_estimators': 428, 'learning_rate': 0.07377795974264101, 'max_depth': 8, 'min_samples_split': 2, 'min_samples_leaf': 1, 'subsample': 0.9744847528515044, 'max_features': 'log2'}. Best is trial 603 with value: 0.45955205541891275.
[I 2024-12-04 14:56:06,553] Trial 663 finished with value: 0.47715753154477036 and parameters: {'n_estimators': 861, 'learning_rate': 0.05911157916060183, 'max_depth': 12, 'min_samples_split': 19, 'min_samples_leaf': 1, 'subsample': 0.9468983838321593, 'max_features': None}. Best is trial 603 with value: 0.45955205541891275.
[I 2024-12-04 14:56:06,674] Trial 666 finished with value: 0.5243678918022597 and parameters: {'n_estimators': 854, 'learning_rate': 0.08390358947703538, 'max_depth': 12, 'min_samples_split': 16, 'min_samples_leaf': 1, 'subsample': 0.9969939089766978, 'max_features': 'sqrt'}. Best is trial 603 with value: 0.45955205541891275.
[I 2024-12-04 14:56:07,001] Trial 657 finished with value: 0.6351161628478751 and parameters: {'n_estimators': 1331, 'learning_rate': 0.06568617995472553, 'max_depth': 8, 'min_samples_split': 6, 'min_samples_leaf': 3, 'subsample': 0.6691555890794529, 'max_features': 'log2'}. Best is trial 603 with value: 0.45955205541891275.
[I 2024-12-04 14:56:07,090] Trial 670 finished with value: 0.6751455537466187 and parameters: {'n_estimators': 760, 'learning_rate': 0.08000808559058042, 'max_depth': 12, 'min_samples_split': 19, 'min_samples_leaf': 2, 'subsample': 0.9491227891672537, 'max_features': 'log2'}. Best is trial 603 with value: 0.45955205541891275.
[I 2024-12-04 14:56:08,589] Trial 658 finished with value: 0.6630092579757656 and parameters: {'n_estimators': 1111, 'learning_rate': 0.09259970841053736, 'max_depth': 12, 'min_samples_split': 14, 'min_samples_leaf': 2, 'subsample': 0.898823674635041, 'max_features': None}. Best is trial 603 with value: 0.45955205541891275.
[I 2024-12-04 14:56:11,627] Trial 675 finished with value: 0.6251128950740896 and parameters: {'n_estimators': 781, 'learning_rate': 0.09375819116323403, 'max_depth': 10, 'min_samples_split': 15, 'min_samples_leaf': 4, 'subsample': 0.8549332055410512, 'max_features': 'sqrt'}. Best is trial 603 with value: 0.45955205541891275.
[I 2024-12-04 14:56:13,240] Trial 662 finished with value: 0.4720310401468886 and parameters: {'n_estimators': 1111, 'learning_rate': 0.06253534783154817, 'max_depth': 11, 'min_samples_split': 18, 'min_samples_leaf': 1, 'subsample': 0.9770815434006338, 'max_features': None}. Best is trial 603 with value: 0.45955205541891275.
