[I 2024-12-04 12:16:16,985] Trial 1446 finished with value: 0.5519215063963798 and parameters: {'n_estimators': 102, 'max_depth': 16, 'min_samples_split': 5, 'min_samples_leaf': 2, 'max_features': None, 'bootstrap': True, 'criterion': 'absolute_error'}. Best is trial 744 with value: 0.5032383725751689.
[I 2024-12-04 12:16:17,251] Trial 1430 finished with value: 0.5248225598767271 and parameters: {'n_estimators': 265, 'max_depth': 17, 'min_samples_split': 8, 'min_samples_leaf': 1, 'max_features': None, 'bootstrap': True, 'criterion': 'absolute_error'}. Best is trial 744 with value: 0.5032383725751689.
[I 2024-12-04 12:16:17,614] Trial 1431 finished with value: 0.5220618852233084 and parameters: {'n_estimators': 261, 'max_depth': 28, 'min_samples_split': 4, 'min_samples_leaf': 1, 'max_features': None, 'bootstrap': True, 'criterion': 'absolute_error'}. Best is trial 744 with value: 0.5032383725751689.
[I 2024-12-04 12:16:18,448] Trial 1438 finished with value: 0.5186003595548386 and parameters: {'n_estimators': 119, 'max_depth': 31, 'min_samples_split': 6, 'min_samples_leaf': 1, 'max_features': None, 'bootstrap': True, 'criterion': 'absolute_error'}. Best is trial 744 with value: 0.5032383725751689.
[I 2024-12-04 12:16:19,289] Trial 1450 finished with value: 0.5082671632087482 and parameters: {'n_estimators': 102, 'max_depth': 18, 'min_samples_split': 5, 'min_samples_leaf': 1, 'max_features': None, 'bootstrap': True, 'criterion': 'absolute_error'}. Best is trial 744 with value: 0.5032383725751689.
[I 2024-12-04 12:16:20,407] Trial 1447 finished with value: 0.5105845586214058 and parameters: {'n_estimators': 133, 'max_depth': 18, 'min_samples_split': 5, 'min_samples_leaf': 1, 'max_features': None, 'bootstrap': True, 'criterion': 'absolute_error'}. Best is trial 744 with value: 0.5032383725751689.
[I 2024-12-04 12:16:20,422] Trial 1449 finished with value: 0.7494404721284987 and parameters: {'n_estimators': 103, 'max_depth': 23, 'min_samples_split': 5, 'min_samples_leaf': 1, 'max_features': 'sqrt', 'bootstrap': True, 'criterion': 'absolute_error'}. Best is trial 744 with value: 0.5032383725751689.
[I 2024-12-04 12:16:20,836] Trial 1456 finished with value: 1.1152467670519572 and parameters: {'n_estimators': 852, 'max_depth': 9, 'min_samples_split': 37, 'min_samples_leaf': 1, 'max_features': 'log2', 'bootstrap': True, 'criterion': 'squared_error'}. Best is trial 744 with value: 0.5032383725751689.
[I 2024-12-04 12:16:21,138] Trial 1448 finished with value: 0.5177626704386762 and parameters: {'n_estimators': 104, 'max_depth': 12, 'min_samples_split': 3, 'min_samples_leaf': 1, 'max_features': None, 'bootstrap': True, 'criterion': 'absolute_error'}. Best is trial 744 with value: 0.5032383725751689.
[I 2024-12-04 12:16:21,223] Trial 1451 finished with value: 0.519785243790595 and parameters: {'n_estimators': 100, 'max_depth': 11, 'min_samples_split': 7, 'min_samples_leaf': 1, 'max_features': None, 'bootstrap': True, 'criterion': 'absolute_error'}. Best is trial 744 with value: 0.5032383725751689.
[I 2024-12-04 12:16:26,517] Trial 1455 finished with value: 0.9681983207356255 and parameters: {'n_estimators': 929, 'max_depth': 10, 'min_samples_split': 42, 'min_samples_leaf': 1, 'max_features': 'sqrt', 'bootstrap': True, 'criterion': 'squared_error'}. Best is trial 744 with value: 0.5032383725751689.
[I 2024-12-04 12:16:27,455] Trial 1452 finished with value: 0.5499301587707467 and parameters: {'n_estimators': 219, 'max_depth': 18, 'min_samples_split': 12, 'min_samples_leaf': 2, 'max_features': None, 'bootstrap': True, 'criterion': 'absolute_error'}. Best is trial 744 with value: 0.5032383725751689.
[I 2024-12-04 12:16:27,542] Trial 1445 finished with value: 0.5238358946336631 and parameters: {'n_estimators': 225, 'max_depth': 15, 'min_samples_split': 7, 'min_samples_leaf': 1, 'max_features': None, 'bootstrap': True, 'criterion': 'absolute_error'}. Best is trial 744 with value: 0.5032383725751689.
[I 2024-12-04 12:16:31,337] Trial 1463 finished with value: 0.6949294179844149 and parameters: {'n_estimators': 637, 'max_depth': 25, 'min_samples_split': 10, 'min_samples_leaf': 1, 'max_features': 'sqrt', 'bootstrap': False, 'criterion': 'squared_error'}. Best is trial 744 with value: 0.5032383725751689.
[I 2024-12-04 12:16:31,407] Trial 1454 finished with value: 0.5239204051231724 and parameters: {'n_estimators': 115, 'max_depth': 24, 'min_samples_split': 7, 'min_samples_leaf': 1, 'max_features': None, 'bootstrap': True, 'criterion': 'absolute_error'}. Best is trial 744 with value: 0.5032383725751689.
[I 2024-12-04 12:16:32,608] Trial 1458 finished with value: 1.0844780704908692 and parameters: {'n_estimators': 117, 'max_depth': 16, 'min_samples_split': 6, 'min_samples_leaf': 1, 'max_features': 'log2', 'bootstrap': True, 'criterion': 'absolute_error'}. Best is trial 744 with value: 0.5032383725751689.
[I 2024-12-04 12:16:32,925] Trial 1462 finished with value: 0.5181143934486194 and parameters: {'n_estimators': 101, 'max_depth': 19, 'min_samples_split': 3, 'min_samples_leaf': 1, 'max_features': None, 'bootstrap': True, 'criterion': 'absolute_error'}. Best is trial 744 with value: 0.5032383725751689.
[I 2024-12-04 12:16:33,241] Trial 1464 finished with value: 0.5179599428057763 and parameters: {'n_estimators': 103, 'max_depth': 18, 'min_samples_split': 3, 'min_samples_leaf': 1, 'max_features': None, 'bootstrap': True, 'criterion': 'absolute_error'}. Best is trial 744 with value: 0.5032383725751689.
[I 2024-12-04 12:16:34,145] Trial 1453 finished with value: 0.5214652095455953 and parameters: {'n_estimators': 235, 'max_depth': 22, 'min_samples_split': 7, 'min_samples_leaf': 1, 'max_features': None, 'bootstrap': True, 'criterion': 'absolute_error'}. Best is trial 744 with value: 0.5032383725751689.
[I 2024-12-04 12:16:34,288] Trial 1457 finished with value: 0.5109117996358834 and parameters: {'n_estimators': 244, 'max_depth': 19, 'min_samples_split': 4, 'min_samples_leaf': 1, 'max_features': None, 'bootstrap': True, 'criterion': 'absolute_error'}. Best is trial 744 with value: 0.5032383725751689.
[I 2024-12-04 12:16:34,385] Trial 1466 finished with value: 0.5057747081209119 and parameters: {'n_estimators': 107, 'max_depth': 19, 'min_samples_split': 5, 'min_samples_leaf': 1, 'max_features': None, 'bootstrap': True, 'criterion': 'absolute_error'}. Best is trial 744 with value: 0.5032383725751689.
[I 2024-12-04 12:16:34,536] Trial 1465 finished with value: 0.5209428857958621 and parameters: {'n_estimators': 102, 'max_depth': 15, 'min_samples_split': 8, 'min_samples_leaf': 1, 'max_features': None, 'bootstrap': True, 'criterion': 'absolute_error'}. Best is trial 744 with value: 0.5032383725751689.
[I 2024-12-04 12:16:34,759] Trial 1468 finished with value: 0.5563953112953813 and parameters: {'n_estimators': 114, 'max_depth': 20, 'min_samples_split': 6, 'min_samples_leaf': 2, 'max_features': None, 'bootstrap': True, 'criterion': 'absolute_error'}. Best is trial 744 with value: 0.5032383725751689.
[I 2024-12-04 12:16:35,150] Trial 1459 finished with value: 0.5582698342712299 and parameters: {'n_estimators': 257, 'max_depth': 16, 'min_samples_split': 5, 'min_samples_leaf': 2, 'max_features': None, 'bootstrap': True, 'criterion': 'absolute_error'}. Best is trial 744 with value: 0.5032383725751689.
[I 2024-12-04 12:16:36,589] Trial 1474 finished with value: 0.5181545017029713 and parameters: {'n_estimators': 252, 'max_depth': 21, 'min_samples_split': 5, 'min_samples_leaf': 1, 'max_features': None, 'bootstrap': True, 'criterion': 'squared_error'}. Best is trial 744 with value: 0.5032383725751689.
[I 2024-12-04 12:16:36,591] Trial 1439 finished with value: 0.5146926064175149 and parameters: {'n_estimators': 521, 'max_depth': 20, 'min_samples_split': 4, 'min_samples_leaf': 1, 'max_features': None, 'bootstrap': True, 'criterion': 'absolute_error'}. Best is trial 744 with value: 0.5032383725751689.
[I 2024-12-04 12:16:36,593] Trial 1467 finished with value: 0.5607658266135273 and parameters: {'n_estimators': 220, 'max_depth': 23, 'min_samples_split': 6, 'min_samples_leaf': 2, 'max_features': None, 'bootstrap': True, 'criterion': 'absolute_error'}. Best is trial 744 with value: 0.5032383725751689.
[I 2024-12-04 12:16:37,314] Trial 1460 finished with value: 0.9674708107904894 and parameters: {'n_estimators': 976, 'max_depth': 22, 'min_samples_split': 12, 'min_samples_leaf': 2, 'max_features': 'sqrt', 'bootstrap': True, 'criterion': 'absolute_error'}. Best is trial 744 with value: 0.5032383725751689.
[I 2024-12-04 12:16:37,358] Trial 1472 finished with value: 0.5501897479235386 and parameters: {'n_estimators': 124, 'max_depth': 23, 'min_samples_split': 6, 'min_samples_leaf': 2, 'max_features': None, 'bootstrap': True, 'criterion': 'squared_error'}. Best is trial 744 with value: 0.5032383725751689.
[I 2024-12-04 12:16:40,195] Trial 1461 finished with value: 0.5147538307580557 and parameters: {'n_estimators': 273, 'max_depth': 15, 'min_samples_split': 5, 'min_samples_leaf': 1, 'max_features': None, 'bootstrap': True, 'criterion': 'absolute_error'}. Best is trial 744 with value: 0.5032383725751689.
[I 2024-12-04 12:16:40,613] Trial 1470 finished with value: 0.6160715744209884 and parameters: {'n_estimators': 875, 'max_depth': 19, 'min_samples_split': 36, 'min_samples_leaf': 2, 'max_features': None, 'bootstrap': False, 'criterion': 'squared_error'}. Best is trial 744 with value: 0.5032383725751689.
[I 2024-12-04 12:16:41,350] Trial 1479 finished with value: 0.6270804540463398 and parameters: {'n_estimators': 352, 'max_depth': 12, 'min_samples_split': 2, 'min_samples_leaf': 1, 'max_features': None, 'bootstrap': False, 'criterion': 'squared_error'}. Best is trial 744 with value: 0.5032383725751689.
[I 2024-12-04 12:16:42,438] Trial 1471 finished with value: 0.5611735370537516 and parameters: {'n_estimators': 123, 'max_depth': 25, 'min_samples_split': 5, 'min_samples_leaf': 2, 'max_features': None, 'bootstrap': True, 'criterion': 'absolute_error'}. Best is trial 744 with value: 0.5032383725751689.
[I 2024-12-04 12:16:42,820] Trial 1481 finished with value: 0.5528411849629566 and parameters: {'n_estimators': 100, 'max_depth': 18, 'min_samples_split': 3, 'min_samples_leaf': 2, 'max_features': None, 'bootstrap': True, 'criterion': 'absolute_error'}. Best is trial 744 with value: 0.5032383725751689.
[I 2024-12-04 12:16:44,083] Trial 1478 finished with value: 0.6122689802338348 and parameters: {'n_estimators': 253, 'max_depth': 18, 'min_samples_split': 3, 'min_samples_leaf': 1, 'max_features': None, 'bootstrap': False, 'criterion': 'squared_error'}. Best is trial 744 with value: 0.5032383725751689.
[I 2024-12-04 12:16:45,616] Trial 1484 finished with value: 1.1967351628855494 and parameters: {'n_estimators': 893, 'max_depth': 26, 'min_samples_split': 41, 'min_samples_leaf': 13, 'max_features': 'sqrt', 'bootstrap': False, 'criterion': 'squared_error'}. Best is trial 744 with value: 0.5032383725751689.
[I 2024-12-04 12:16:48,321] Trial 1490 finished with value: 1.2214228282449366 and parameters: {'n_estimators': 259, 'max_depth': 49, 'min_samples_split': 2, 'min_samples_leaf': 8, 'max_features': 'log2', 'bootstrap': False, 'criterion': 'squared_error'}. Best is trial 744 with value: 0.5032383725751689.
[I 2024-12-04 12:16:48,962] Trial 1483 finished with value: 0.5261193027192042 and parameters: {'n_estimators': 101, 'max_depth': 21, 'min_samples_split': 10, 'min_samples_leaf': 1, 'max_features': None, 'bootstrap': True, 'criterion': 'absolute_error'}. Best is trial 744 with value: 0.5032383725751689.
[I 2024-12-04 12:16:51,424] Trial 1477 finished with value: 0.5407186315582321 and parameters: {'n_estimators': 177, 'max_depth': 15, 'min_samples_split': 6, 'min_samples_leaf': 1, 'max_features': None, 'bootstrap': False, 'criterion': 'absolute_error'}. Best is trial 744 with value: 0.5032383725751689.
[I 2024-12-04 12:16:51,439] Trial 1469 finished with value: 0.5109427564445972 and parameters: {'n_estimators': 124, 'max_depth': 20, 'min_samples_split': 4, 'min_samples_leaf': 1, 'max_features': None, 'bootstrap': True, 'criterion': 'absolute_error'}. Best is trial 744 with value: 0.5032383725751689.
[I 2024-12-04 12:16:53,859] Trial 1493 finished with value: 0.5330868810844449 and parameters: {'n_estimators': 102, 'max_depth': 26, 'min_samples_split': 11, 'min_samples_leaf': 1, 'max_features': None, 'bootstrap': True, 'criterion': 'squared_error'}. Best is trial 744 with value: 0.5032383725751689.
[I 2024-12-04 12:16:54,059] Trial 1486 finished with value: 0.9634516346202653 and parameters: {'n_estimators': 288, 'max_depth': 22, 'min_samples_split': 3, 'min_samples_leaf': 2, 'max_features': 'sqrt', 'bootstrap': True, 'criterion': 'absolute_error'}. Best is trial 744 with value: 0.5032383725751689.
[I 2024-12-04 12:16:56,046] Trial 1494 finished with value: 0.5051882006729784 and parameters: {'n_estimators': 102, 'max_depth': 19, 'min_samples_split': 5, 'min_samples_leaf': 1, 'max_features': None, 'bootstrap': True, 'criterion': 'absolute_error'}. Best is trial 744 with value: 0.5032383725751689.
[I 2024-12-04 12:16:56,520] Trial 1476 finished with value: 0.521397073780783 and parameters: {'n_estimators': 255, 'max_depth': 22, 'min_samples_split': 3, 'min_samples_leaf': 1, 'max_features': None, 'bootstrap': True, 'criterion': 'absolute_error'}. Best is trial 744 with value: 0.5032383725751689.
[I 2024-12-04 12:16:56,726] Trial 1475 finished with value: 0.5191653906777747 and parameters: {'n_estimators': 247, 'max_depth': 20, 'min_samples_split': 6, 'min_samples_leaf': 1, 'max_features': None, 'bootstrap': True, 'criterion': 'absolute_error'}. Best is trial 744 with value: 0.5032383725751689.
[I 2024-12-04 12:16:58,385] Trial 1473 finished with value: 0.5203647439501156 and parameters: {'n_estimators': 217, 'max_depth': 28, 'min_samples_split': 6, 'min_samples_leaf': 1, 'max_features': None, 'bootstrap': True, 'criterion': 'absolute_error'}. Best is trial 744 with value: 0.5032383725751689.
[I 2024-12-04 12:16:58,630] Trial 1485 finished with value: 0.5214508488334577 and parameters: {'n_estimators': 107, 'max_depth': 29, 'min_samples_split': 7, 'min_samples_leaf': 1, 'max_features': None, 'bootstrap': True, 'criterion': 'absolute_error'}. Best is trial 744 with value: 0.5032383725751689.
[I 2024-12-04 12:16:58,641] Trial 1496 finished with value: 0.5612082402871083 and parameters: {'n_estimators': 107, 'max_depth': 17, 'min_samples_split': 8, 'min_samples_leaf': 2, 'max_features': None, 'bootstrap': True, 'criterion': 'absolute_error'}. Best is trial 744 with value: 0.5032383725751689.
[I 2024-12-04 12:16:58,794] Trial 1491 finished with value: 0.5131873689921991 and parameters: {'n_estimators': 101, 'max_depth': 11, 'min_samples_split': 2, 'min_samples_leaf': 1, 'max_features': None, 'bootstrap': True, 'criterion': 'absolute_error'}. Best is trial 744 with value: 0.5032383725751689.
[I 2024-12-04 12:16:59,049] Trial 1480 finished with value: 0.5267107025959706 and parameters: {'n_estimators': 234, 'max_depth': 21, 'min_samples_split': 8, 'min_samples_leaf': 1, 'max_features': None, 'bootstrap': True, 'criterion': 'absolute_error'}. Best is trial 744 with value: 0.5032383725751689.
[I 2024-12-04 12:16:59,479] Trial 1499 finished with value: 0.5096455107320439 and parameters: {'n_estimators': 102, 'max_depth': 12, 'min_samples_split': 5, 'min_samples_leaf': 1, 'max_features': None, 'bootstrap': True, 'criterion': 'absolute_error'}. Best is trial 744 with value: 0.5032383725751689.
[I 2024-12-04 12:17:01,697] Trial 1504 finished with value: 1.2136324941172836 and parameters: {'n_estimators': 1000, 'max_depth': 28, 'min_samples_split': 7, 'min_samples_leaf': 6, 'max_features': 'log2', 'bootstrap': False, 'criterion': 'squared_error'}. Best is trial 744 with value: 0.5032383725751689.
[I 2024-12-04 12:17:02,483] Trial 1495 finished with value: 0.5185348758063046 and parameters: {'n_estimators': 103, 'max_depth': 20, 'min_samples_split': 3, 'min_samples_leaf': 1, 'max_features': None, 'bootstrap': True, 'criterion': 'absolute_error'}. Best is trial 744 with value: 0.5032383725751689.
[I 2024-12-04 12:17:03,519] Trial 1487 finished with value: 0.6118446072839718 and parameters: {'n_estimators': 630, 'max_depth': 30, 'min_samples_split': 8, 'min_samples_leaf': 3, 'max_features': None, 'bootstrap': False, 'criterion': 'squared_error'}. Best is trial 744 with value: 0.5032383725751689.
[I 2024-12-04 12:17:05,696] Trial 1489 finished with value: 0.5181987358114222 and parameters: {'n_estimators': 111, 'max_depth': 26, 'min_samples_split': 6, 'min_samples_leaf': 1, 'max_features': None, 'bootstrap': True, 'criterion': 'absolute_error'}. Best is trial 744 with value: 0.5032383725751689.
[I 2024-12-04 12:17:06,093] Trial 1498 finished with value: 0.5134290081667896 and parameters: {'n_estimators': 106, 'max_depth': 20, 'min_samples_split': 6, 'min_samples_leaf': 1, 'max_features': None, 'bootstrap': True, 'criterion': 'absolute_error'}. Best is trial 744 with value: 0.5032383725751689.
[I 2024-12-04 12:17:06,097] Trial 1510 finished with value: 0.8543379775565947 and parameters: {'n_estimators': 118, 'max_depth': 18, 'min_samples_split': 10, 'min_samples_leaf': 1, 'max_features': 'sqrt', 'bootstrap': True, 'criterion': 'absolute_error'}. Best is trial 744 with value: 0.5032383725751689.
[I 2024-12-04 12:17:06,503] Trial 1482 finished with value: 0.5182560644905339 and parameters: {'n_estimators': 232, 'max_depth': 27, 'min_samples_split': 4, 'min_samples_leaf': 1, 'max_features': None, 'bootstrap': True, 'criterion': 'absolute_error'}. Best is trial 744 with value: 0.5032383725751689.
[I 2024-12-04 12:17:06,881] Trial 1492 finished with value: 0.5110390963537649 and parameters: {'n_estimators': 100, 'max_depth': 29, 'min_samples_split': 5, 'min_samples_leaf': 1, 'max_features': None, 'bootstrap': True, 'criterion': 'absolute_error'}. Best is trial 744 with value: 0.5032383725751689.
[I 2024-12-04 12:17:07,170] Trial 1502 finished with value: 0.5302349001602402 and parameters: {'n_estimators': 108, 'max_depth': 14, 'min_samples_split': 12, 'min_samples_leaf': 1, 'max_features': None, 'bootstrap': True, 'criterion': 'absolute_error'}. Best is trial 744 with value: 0.5032383725751689.
[I 2024-12-04 12:17:09,865] Trial 1497 finished with value: 0.856476231839952 and parameters: {'n_estimators': 404, 'max_depth': 17, 'min_samples_split': 4, 'min_samples_leaf': 13, 'max_features': None, 'bootstrap': False, 'criterion': 'absolute_error'}. Best is trial 744 with value: 0.5032383725751689.
[I 2024-12-04 12:17:10,562] Trial 1507 finished with value: 0.534356515850396 and parameters: {'n_estimators': 112, 'max_depth': 10, 'min_samples_split': 3, 'min_samples_leaf': 1, 'max_features': None, 'bootstrap': True, 'criterion': 'squared_error'}. Best is trial 744 with value: 0.5032383725751689.
[I 2024-12-04 12:17:11,881] Trial 1512 finished with value: 1.1771836553038324 and parameters: {'n_estimators': 540, 'max_depth': 5, 'min_samples_split': 27, 'min_samples_leaf': 6, 'max_features': 'sqrt', 'bootstrap': True, 'criterion': 'squared_error'}. Best is trial 744 with value: 0.5032383725751689.
[I 2024-12-04 12:17:11,882] Trial 1508 finished with value: 0.5213342949319699 and parameters: {'n_estimators': 101, 'max_depth': 16, 'min_samples_split': 9, 'min_samples_leaf': 1, 'max_features': None, 'bootstrap': True, 'criterion': 'absolute_error'}. Best is trial 744 with value: 0.5032383725751689.
[I 2024-12-04 12:17:13,372] Trial 1501 finished with value: 0.5108981252140606 and parameters: {'n_estimators': 118, 'max_depth': 23, 'min_samples_split': 4, 'min_samples_leaf': 1, 'max_features': None, 'bootstrap': True, 'criterion': 'absolute_error'}. Best is trial 744 with value: 0.5032383725751689.
[I 2024-12-04 12:17:13,673] Trial 1511 finished with value: 0.5128634509474495 and parameters: {'n_estimators': 117, 'max_depth': 18, 'min_samples_split': 6, 'min_samples_leaf': 1, 'max_features': None, 'bootstrap': True, 'criterion': 'absolute_error'}. Best is trial 744 with value: 0.5032383725751689.
[I 2024-12-04 12:17:14,955] Trial 1505 finished with value: 0.5132030302932757 and parameters: {'n_estimators': 103, 'max_depth': 21, 'min_samples_split': 6, 'min_samples_leaf': 1, 'max_features': None, 'bootstrap': True, 'criterion': 'absolute_error'}. Best is trial 744 with value: 0.5032383725751689.
[I 2024-12-04 12:17:15,687] Trial 1506 finished with value: 0.5190549008437945 and parameters: {'n_estimators': 203, 'max_depth': 12, 'min_samples_split': 7, 'min_samples_leaf': 1, 'max_features': None, 'bootstrap': True, 'criterion': 'absolute_error'}. Best is trial 744 with value: 0.5032383725751689.
[I 2024-12-04 12:17:15,950] Trial 1513 finished with value: 0.5544925194404238 and parameters: {'n_estimators': 103, 'max_depth': 19, 'min_samples_split': 4, 'min_samples_leaf': 2, 'max_features': None, 'bootstrap': True, 'criterion': 'absolute_error'}. Best is trial 744 with value: 0.5032383725751689.
[I 2024-12-04 12:17:16,338] Trial 1516 finished with value: 0.6784441777419093 and parameters: {'n_estimators': 694, 'max_depth': 22, 'min_samples_split': 2, 'min_samples_leaf': 1, 'max_features': 'sqrt', 'bootstrap': False, 'criterion': 'squared_error'}. Best is trial 744 with value: 0.5032383725751689.
[I 2024-12-04 12:17:16,574] Trial 1517 finished with value: 0.5580374718404502 and parameters: {'n_estimators': 122, 'max_depth': 18, 'min_samples_split': 5, 'min_samples_leaf': 2, 'max_features': None, 'bootstrap': True, 'criterion': 'absolute_error'}. Best is trial 744 with value: 0.5032383725751689.
[I 2024-12-04 12:17:17,079] Trial 1519 finished with value: 0.9010184429189356 and parameters: {'n_estimators': 639, 'max_depth': 49, 'min_samples_split': 39, 'min_samples_leaf': 2, 'max_features': 'sqrt', 'bootstrap': True, 'criterion': 'squared_error'}. Best is trial 744 with value: 0.5032383725751689.
