[I 2024-12-04 20:38:51,214] Trial 1819 finished with value: 1.0624161172217124 and parameters: {'kernel_type': 'Matern', 'length_scale': 0.004997270105198517, 'noise_level': 0.011273947633231186, 'constant_value': 1236.9501638947015, 'nu': 0.5}. Best is trial 881 with value: 0.35916990930150405.
[I 2024-12-04 20:38:53,116] Trial 1820 finished with value: 0.3592112489288904 and parameters: {'kernel_type': 'Matern', 'length_scale': 36.60014283754509, 'noise_level': 0.003784927264041283, 'constant_value': 80553.83713569585, 'nu': 0.5}. Best is trial 881 with value: 0.35916990930150405.
[I 2024-12-04 20:38:54,055] Trial 1821 finished with value: 0.3592102245579774 and parameters: {'kernel_type': 'Matern', 'length_scale': 1.088578099933753, 'noise_level': 0.017090858833923344, 'constant_value': 14141.700968934772, 'nu': 0.5}. Best is trial 881 with value: 0.35916990930150405.
[I 2024-12-04 20:38:57,816] Trial 1822 finished with value: 0.3592112935598103 and parameters: {'kernel_type': 'Matern', 'length_scale': 9.971063036407877, 'noise_level': 0.008804533397067112, 'constant_value': 1789.2187338841773, 'nu': 0.5}. Best is trial 881 with value: 0.35916990930150405.
[I 2024-12-04 20:39:00,229] Trial 1824 finished with value: 0.35921124136428406 and parameters: {'kernel_type': 'Matern', 'length_scale': 3303.7112642456223, 'noise_level': 0.10724108927972294, 'constant_value': 7679.869006438367, 'nu': 0.5}. Best is trial 881 with value: 0.35916990930150405.
[I 2024-12-04 20:39:00,592] Trial 1823 finished with value: 1.062416117325448 and parameters: {'kernel_type': 'Matern', 'length_scale': 62399.15402666107, 'noise_level': 4.649230420845367e-07, 'constant_value': 0.0018951142967887943, 'nu': 0.5}. Best is trial 881 with value: 0.35916990930150405.
[I 2024-12-04 20:39:03,463] Trial 1825 finished with value: 0.3592112386915047 and parameters: {'kernel_type': 'Matern', 'length_scale': 0.27878148756280063, 'noise_level': 0.9823164796124847, 'constant_value': 737.523629172224, 'nu': 0.5}. Best is trial 881 with value: 0.35916990930150405.
[I 2024-12-04 20:39:05,056] Trial 1826 finished with value: 0.3592105977783254 and parameters: {'kernel_type': 'Matern', 'length_scale': 1.599938165109489, 'noise_level': 0.10751845357484073, 'constant_value': 1376.950944928326, 'nu': 0.5}. Best is trial 881 with value: 0.35916990930150405.
[I 2024-12-04 20:39:06,099] Trial 1827 finished with value: 0.3591979172767504 and parameters: {'kernel_type': 'Matern', 'length_scale': 849.8429174605728, 'noise_level': 0.02805477585478537, 'constant_value': 5213.010248091419, 'nu': 0.5}. Best is trial 881 with value: 0.35916990930150405.
[I 2024-12-04 20:39:08,592] Trial 1828 finished with value: 0.35921084767460876 and parameters: {'kernel_type': 'Matern', 'length_scale': 113.13683838323561, 'noise_level': 0.9123223739636561, 'constant_value': 23.262815131628887, 'nu': 0.5}. Best is trial 881 with value: 0.35916990930150405.
[I 2024-12-04 20:39:09,632] Trial 1829 finished with value: 0.3592112544668997 and parameters: {'kernel_type': 'Matern', 'length_scale': 16.87704623689894, 'noise_level': 0.9927400953307919, 'constant_value': 7425.18325537731, 'nu': 0.5}. Best is trial 881 with value: 0.35916990930150405.
[I 2024-12-04 20:39:12,070] Trial 1831 finished with value: 1.0916543589135168 and parameters: {'kernel_type': 'Matern', 'length_scale': 2.1324619038591486e-05, 'noise_level': 0.041174917293209545, 'constant_value': 1.4095717306189022e-05, 'nu': 2.5}. Best is trial 881 with value: 0.35916990930150405.
[I 2024-12-04 20:39:13,462] Trial 1830 finished with value: 0.35921123456875176 and parameters: {'kernel_type': 'Matern', 'length_scale': 190.11741951669302, 'noise_level': 0.009560218779123433, 'constant_value': 12326.648737061878, 'nu': 0.5}. Best is trial 881 with value: 0.35916990930150405.
[I 2024-12-04 20:39:16,017] Trial 1832 finished with value: 0.35921121417783547 and parameters: {'kernel_type': 'Matern', 'length_scale': 2144.063952084794, 'noise_level': 0.1525870636614124, 'constant_value': 93980.87554086474, 'nu': 0.5}. Best is trial 881 with value: 0.35916990930150405.
[I 2024-12-04 20:39:17,618] Trial 1833 finished with value: 0.3592112383532483 and parameters: {'kernel_type': 'Matern', 'length_scale': 2567.2041354511557, 'noise_level': 0.39818859884560454, 'constant_value': 1638.8067368940167, 'nu': 0.5}. Best is trial 881 with value: 0.35916990930150405.
[I 2024-12-04 20:39:19,173] Trial 1834 finished with value: 0.3592112408133913 and parameters: {'kernel_type': 'Matern', 'length_scale': 20102.454805500325, 'noise_level': 0.004151195891918449, 'constant_value': 2437.1141105959314, 'nu': 0.5}. Best is trial 881 with value: 0.35916990930150405.
[I 2024-12-04 20:39:22,742] Trial 1835 finished with value: 0.35921117679182435 and parameters: {'kernel_type': 'Matern', 'length_scale': 20274.12222260961, 'noise_level': 0.0022997213055334542, 'constant_value': 36645.844873676164, 'nu': 0.5}. Best is trial 881 with value: 0.35916990930150405.
[I 2024-12-04 20:39:23,689] Trial 1836 finished with value: 0.35921124143139394 and parameters: {'kernel_type': 'Matern', 'length_scale': 549.8067675185064, 'noise_level': 0.21269604921418597, 'constant_value': 4258.540539093766, 'nu': 0.5}. Best is trial 881 with value: 0.35916990930150405.
[I 2024-12-04 20:39:25,412] Trial 1837 finished with value: 0.35921085784472384 and parameters: {'kernel_type': 'Matern', 'length_scale': 8330.818153744884, 'noise_level': 0.07151644149592819, 'constant_value': 23187.191214329145, 'nu': 0.5}. Best is trial 881 with value: 0.35916990930150405.
[I 2024-12-04 20:39:28,394] Trial 1838 finished with value: 0.3592111946096101 and parameters: {'kernel_type': 'Matern', 'length_scale': 5066.418898768404, 'noise_level': 0.0804682571378372, 'constant_value': 1862.6847919231984, 'nu': 0.5}. Best is trial 881 with value: 0.35916990930150405.
[I 2024-12-04 20:39:30,788] Trial 1840 finished with value: 0.3592111954139592 and parameters: {'kernel_type': 'Matern', 'length_scale': 792.7638485390353, 'noise_level': 0.007280181201835394, 'constant_value': 1112.828732304865, 'nu': 0.5}. Best is trial 881 with value: 0.35916990930150405.
[I 2024-12-04 20:39:30,885] Trial 1839 finished with value: 1.062416117408442 and parameters: {'kernel_type': 'Matern', 'length_scale': 2.9390141286080784e-05, 'noise_level': 0.13283922640511547, 'constant_value': 0.006326584714996049, 'nu': 1.5}. Best is trial 881 with value: 0.35916990930150405.
[I 2024-12-04 20:39:33,699] Trial 1841 finished with value: 0.35921133585096315 and parameters: {'kernel_type': 'Matern', 'length_scale': 102.78456474698423, 'noise_level': 0.0008151009667733176, 'constant_value': 52601.56059993331, 'nu': 0.5}. Best is trial 881 with value: 0.35916990930150405.
[I 2024-12-04 20:39:35,849] Trial 1842 finished with value: 0.3592112271885195 and parameters: {'kernel_type': 'Matern', 'length_scale': 0.418605391865153, 'noise_level': 0.7285008955242143, 'constant_value': 13.00670010789589, 'nu': 0.5}. Best is trial 881 with value: 0.35916990930150405.
[I 2024-12-04 20:39:36,915] Trial 1843 finished with value: 0.35921124038713126 and parameters: {'kernel_type': 'Matern', 'length_scale': 384.87099398941916, 'noise_level': 0.30490207499724453, 'constant_value': 11647.929095952473, 'nu': 0.5}. Best is trial 881 with value: 0.35916990930150405.
[I 2024-12-04 20:39:41,338] Trial 1844 finished with value: 0.35921124225555734 and parameters: {'kernel_type': 'Matern', 'length_scale': 600.4387344379628, 'noise_level': 0.009211129646996052, 'constant_value': 48307.75224960588, 'nu': 0.5}. Best is trial 881 with value: 0.35916990930150405.
[I 2024-12-04 20:39:42,486] Trial 1845 finished with value: 1.0624161172629067 and parameters: {'kernel_type': 'Matern', 'length_scale': 0.04600092826441244, 'noise_level': 1.6924072542997085e-07, 'constant_value': 1.8897605034393022e-07, 'nu': 1.5}. Best is trial 881 with value: 0.35916990930150405.
[I 2024-12-04 20:39:43,993] Trial 1846 finished with value: 0.3592112623397353 and parameters: {'kernel_type': 'Matern', 'length_scale': 11.294936010598443, 'noise_level': 0.012080095460814698, 'constant_value': 7629.947674597269, 'nu': 0.5}. Best is trial 881 with value: 0.35916990930150405.
[I 2024-12-04 20:39:46,077] Trial 1847 finished with value: 0.35921275467394637 and parameters: {'kernel_type': 'Matern', 'length_scale': 10.628037761238211, 'noise_level': 0.019658463906135536, 'constant_value': 10389.0248926957, 'nu': 0.5}. Best is trial 881 with value: 0.35916990930150405.
[I 2024-12-04 20:39:47,033] Trial 1848 finished with value: 0.3592112912248268 and parameters: {'kernel_type': 'Matern', 'length_scale': 14.032875993139658, 'noise_level': 0.0449288753143275, 'constant_value': 5639.914549887241, 'nu': 0.5}. Best is trial 881 with value: 0.35916990930150405.
[I 2024-12-04 20:39:48,857] Trial 1849 finished with value: 0.3592098343848691 and parameters: {'kernel_type': 'Matern', 'length_scale': 10.02709882196839, 'noise_level': 0.13418147027523172, 'constant_value': 1790.645191967, 'nu': 0.5}. Best is trial 881 with value: 0.35916990930150405.
[I 2024-12-04 20:39:51,178] Trial 1850 finished with value: 0.35921140935902635 and parameters: {'kernel_type': 'Matern', 'length_scale': 1308.7026414079776, 'noise_level': 0.036879142985556244, 'constant_value': 13067.303939162015, 'nu': 0.5}. Best is trial 881 with value: 0.35916990930150405.
[I 2024-12-04 20:39:52,513] Trial 1851 finished with value: 0.35921126004914455 and parameters: {'kernel_type': 'Matern', 'length_scale': 1344.3787738879898, 'noise_level': 0.037519178853501145, 'constant_value': 1033.949609109257, 'nu': 0.5}. Best is trial 881 with value: 0.35916990930150405.
[I 2024-12-04 20:39:53,323] Trial 1852 finished with value: 0.3592112148203105 and parameters: {'kernel_type': 'Matern', 'length_scale': 4.6379201187980525, 'noise_level': 0.5749819895426997, 'constant_value': 572.5227700255347, 'nu': 0.5}. Best is trial 881 with value: 0.35916990930150405.
[I 2024-12-04 20:39:55,240] Trial 1853 finished with value: 0.35919535034039646 and parameters: {'kernel_type': 'Matern', 'length_scale': 7.680120661944082, 'noise_level': 0.07447924204480956, 'constant_value': 6024.586812681004, 'nu': 0.5}. Best is trial 881 with value: 0.35916990930150405.
[I 2024-12-04 20:39:55,571] Trial 1854 finished with value: 0.3593109336484284 and parameters: {'kernel_type': 'Matern', 'length_scale': 11.715045645996698, 'noise_level': 0.0898174893852398, 'constant_value': 2999.262707205066, 'nu': 0.5}. Best is trial 881 with value: 0.35916990930150405.
[I 2024-12-04 20:39:57,213] Trial 1855 finished with value: 0.35921889063965134 and parameters: {'kernel_type': 'Matern', 'length_scale': 4.298861048146802, 'noise_level': 0.04937943235063438, 'constant_value': 1363.1238451774511, 'nu': 0.5}. Best is trial 881 with value: 0.35916990930150405.
[I 2024-12-04 20:40:00,827] Trial 1857 finished with value: 0.3592112410069579 and parameters: {'kernel_type': 'Matern', 'length_scale': 7.083297135063678, 'noise_level': 0.07044860346772834, 'constant_value': 71608.71795553113, 'nu': 0.5}. Best is trial 881 with value: 0.35916990930150405.
[I 2024-12-04 20:40:01,421] Trial 1856 finished with value: 0.4226899044374716 and parameters: {'kernel_type': 'Matern', 'length_scale': 4.647751638106679, 'noise_level': 0.11780847046484706, 'constant_value': 35001.663979435885, 'nu': 1.5}. Best is trial 881 with value: 0.35916990930150405.
[I 2024-12-04 20:40:03,018] Trial 1858 finished with value: 0.35921137503020917 and parameters: {'kernel_type': 'Matern', 'length_scale': 15.813210072737458, 'noise_level': 0.09362766679411882, 'constant_value': 2856.237334784715, 'nu': 0.5}. Best is trial 881 with value: 0.35916990930150405.
[I 2024-12-04 20:40:06,393] Trial 1860 finished with value: 1.062416117402808 and parameters: {'kernel_type': 'Matern', 'length_scale': 0.030464938799963887, 'noise_level': 0.06980500352221168, 'constant_value': 13.28696684720524, 'nu': 1.5}. Best is trial 881 with value: 0.35916990930150405.
[I 2024-12-04 20:40:07,941] Trial 1859 finished with value: 0.3592112419076037 and parameters: {'kernel_type': 'Matern', 'length_scale': 7.200564936336398, 'noise_level': 0.02208866619928697, 'constant_value': 96717.64433813727, 'nu': 0.5}. Best is trial 881 with value: 0.35916990930150405.
[I 2024-12-04 20:40:09,993] Trial 1861 finished with value: 0.3592110988747781 and parameters: {'kernel_type': 'Matern', 'length_scale': 1.4193932499002033, 'noise_level': 0.05250775643236966, 'constant_value': 9365.987361920917, 'nu': 0.5}. Best is trial 881 with value: 0.35916990930150405.
[I 2024-12-04 20:40:11,855] Trial 1862 finished with value: 0.3592112490872319 and parameters: {'kernel_type': 'Matern', 'length_scale': 138.50313956648918, 'noise_level': 0.08168429100284094, 'constant_value': 31195.094233724285, 'nu': 0.5}. Best is trial 881 with value: 0.35916990930150405.
[I 2024-12-04 20:40:13,511] Trial 1863 finished with value: 0.35921125168698526 and parameters: {'kernel_type': 'Matern', 'length_scale': 53.38317142722323, 'noise_level': 0.14085481825892424, 'constant_value': 4467.310726053755, 'nu': 0.5}. Best is trial 881 with value: 0.35916990930150405.
[I 2024-12-04 20:40:17,090] Trial 1865 finished with value: 0.35921126023863864 and parameters: {'kernel_type': 'Matern', 'length_scale': 50.448259120231036, 'noise_level': 0.05851428086728569, 'constant_value': 1765.2093848116801, 'nu': 0.5}. Best is trial 881 with value: 0.35916990930150405.
[I 2024-12-04 20:40:17,832] Trial 1866 finished with value: 0.3592111778701864 and parameters: {'kernel_type': 'Matern', 'length_scale': 3.607661502355695, 'noise_level': 0.4474482879996791, 'constant_value': 1601.0057112801333, 'nu': 0.5}. Best is trial 881 with value: 0.35916990930150405.
[I 2024-12-04 20:40:18,116] Trial 1864 finished with value: 0.3592106876812281 and parameters: {'kernel_type': 'Matern', 'length_scale': 0.0887861976876966, 'noise_level': 0.7351706729047979, 'constant_value': 49732.072460141375, 'nu': 0.5}. Best is trial 881 with value: 0.35916990930150405.
[I 2024-12-04 20:40:22,409] Trial 1868 finished with value: 0.3592112613337991 and parameters: {'kernel_type': 'Matern', 'length_scale': 2.7602092743524302, 'noise_level': 0.0003039660791962813, 'constant_value': 54005.22612944917, 'nu': 0.5}. Best is trial 881 with value: 0.35916990930150405.
[I 2024-12-04 20:40:22,688] Trial 1867 finished with value: 0.35921118820232345 and parameters: {'kernel_type': 'Matern', 'length_scale': 134.21426092640272, 'noise_level': 0.09035393523647606, 'constant_value': 59996.49607214785, 'nu': 0.5}. Best is trial 881 with value: 0.35916990930150405.
[I 2024-12-04 20:40:23,453] Trial 1869 finished with value: 0.3592114398673503 and parameters: {'kernel_type': 'Matern', 'length_scale': 16.295047805840568, 'noise_level': 0.02031380906003311, 'constant_value': 2655.631158917896, 'nu': 0.5}. Best is trial 881 with value: 0.35916990930150405.
[I 2024-12-04 20:40:27,400] Trial 1870 finished with value: 0.35921126299242895 and parameters: {'kernel_type': 'Matern', 'length_scale': 72.6432000921568, 'noise_level': 0.46359659457933355, 'constant_value': 1600.3448259450277, 'nu': 0.5}. Best is trial 881 with value: 0.35916990930150405.
[I 2024-12-04 20:40:27,610] Trial 1871 finished with value: 0.3592112337937774 and parameters: {'kernel_type': 'Matern', 'length_scale': 12.790112013468638, 'noise_level': 0.8560444196683971, 'constant_value': 1611.5710424024417, 'nu': 0.5}. Best is trial 881 with value: 0.35916990930150405.
[I 2024-12-04 20:40:28,112] Trial 1872 finished with value: 0.4195662577458489 and parameters: {'kernel_type': 'Matern', 'length_scale': 2.2630762090926897, 'noise_level': 0.021475636648164376, 'constant_value': 239.55874063362464, 'nu': 2.5}. Best is trial 881 with value: 0.35916990930150405.
[I 2024-12-04 20:40:32,695] Trial 1873 finished with value: 0.359211100716198 and parameters: {'kernel_type': 'Matern', 'length_scale': 3.441919335762891, 'noise_level': 0.04282538611715496, 'constant_value': 5676.031985500446, 'nu': 0.5}. Best is trial 881 with value: 0.35916990930150405.
[I 2024-12-04 20:40:33,377] Trial 1874 finished with value: 0.35921085308432793 and parameters: {'kernel_type': 'Matern', 'length_scale': 1.1403986525454963, 'noise_level': 0.010111932129578163, 'constant_value': 3989.016143874359, 'nu': 0.5}. Best is trial 881 with value: 0.35916990930150405.
[I 2024-12-04 20:40:33,556] Trial 1875 finished with value: 0.35921126185688323 and parameters: {'kernel_type': 'Matern', 'length_scale': 1339.4438040370342, 'noise_level': 0.0034910046697107185, 'constant_value': 5536.222222078064, 'nu': 0.5}. Best is trial 881 with value: 0.35916990930150405.
[I 2024-12-04 20:40:35,755] Trial 1876 finished with value: 1.0624148238441489 and parameters: {'kernel_type': 'Matern', 'length_scale': 0.07679226069506082, 'noise_level': 0.04278723585196571, 'constant_value': 4517.829995835076, 'nu': 0.5}. Best is trial 881 with value: 0.35916990930150405.
[I 2024-12-04 20:40:38,368] Trial 1878 finished with value: 0.3592112580574755 and parameters: {'kernel_type': 'Matern', 'length_scale': 12.194181356233479, 'noise_level': 0.829718141330522, 'constant_value': 10095.180606417209, 'nu': 0.5}. Best is trial 881 with value: 0.35916990930150405.
[I 2024-12-04 20:40:40,958] Trial 1877 finished with value: 0.4286834988350886 and parameters: {'kernel_type': 'RBF', 'length_scale': 0.27816397438519025, 'noise_level': 0.46904138776814425, 'constant_value': 34268.2607336312, 'nu': 0.5}. Best is trial 881 with value: 0.35916990930150405.
[I 2024-12-04 20:40:41,489] Trial 1879 finished with value: 0.3592112288632308 and parameters: {'kernel_type': 'Matern', 'length_scale': 2.7275708685715605, 'noise_level': 0.02222569814830969, 'constant_value': 69779.9537912481, 'nu': 0.5}. Best is trial 881 with value: 0.35916990930150405.
[I 2024-12-04 20:40:43,289] Trial 1880 finished with value: 0.35921114637752427 and parameters: {'kernel_type': 'Matern', 'length_scale': 1.975317194849328, 'noise_level': 0.017906539728971237, 'constant_value': 1431.6484722196735, 'nu': 0.5}. Best is trial 881 with value: 0.35916990930150405.
[I 2024-12-04 20:40:44,426] Trial 1882 finished with value: 1.0916567048549888 and parameters: {'kernel_type': 'Matern', 'length_scale': 15.51740095660866, 'noise_level': 0.007873675201257138, 'constant_value': 95109.34132984097, 'nu': 0.5}. Best is trial 881 with value: 0.35916990930150405.
[I 2024-12-04 20:40:45,576] Trial 1881 finished with value: 0.3592115493118637 and parameters: {'kernel_type': 'Matern', 'length_scale': 0.5537981751151817, 'noise_level': 0.05886743346804368, 'constant_value': 109.18493568625482, 'nu': 0.5}. Best is trial 881 with value: 0.35916990930150405.
[I 2024-12-04 20:40:48,516] Trial 1883 finished with value: 0.3592111206188272 and parameters: {'kernel_type': 'Matern', 'length_scale': 1.5545598464152097, 'noise_level': 0.7416967021540523, 'constant_value': 3475.0041704038845, 'nu': 0.5}. Best is trial 881 with value: 0.35916990930150405.
[I 2024-12-04 20:40:50,297] Trial 1884 finished with value: 0.3592109317884994 and parameters: {'kernel_type': 'Matern', 'length_scale': 140.87067636533607, 'noise_level': 0.04234366922705508, 'constant_value': 7250.602303899647, 'nu': 0.5}. Best is trial 881 with value: 0.35916990930150405.
[I 2024-12-04 20:40:50,895] Trial 1885 finished with value: 0.35921123771889424 and parameters: {'kernel_type': 'Matern', 'length_scale': 50.095718682993144, 'noise_level': 0.07746561819951404, 'constant_value': 2119.9575032734742, 'nu': 0.5}. Best is trial 881 with value: 0.35916990930150405.
[I 2024-12-04 20:40:51,960] Trial 1886 finished with value: 0.3592997692119688 and parameters: {'kernel_type': 'Matern', 'length_scale': 65.71562497485797, 'noise_level': 0.7787483578920549, 'constant_value': 295.81776444913913, 'nu': 0.5}. Best is trial 881 with value: 0.35916990930150405.
[I 2024-12-04 20:40:54,575] Trial 1887 finished with value: 0.3592153957285838 and parameters: {'kernel_type': 'Matern', 'length_scale': 2.508054334815159, 'noise_level': 0.8805591757711863, 'constant_value': 2315.9332498712133, 'nu': 0.5}. Best is trial 881 with value: 0.35916990930150405.
[I 2024-12-04 20:40:56,101] Trial 1888 finished with value: 0.35921117618776 and parameters: {'kernel_type': 'Matern', 'length_scale': 3.4771229920615325, 'noise_level': 0.03089839405765691, 'constant_value': 3038.4592183659233, 'nu': 0.5}. Best is trial 881 with value: 0.35916990930150405.
[I 2024-12-04 20:40:57,401] Trial 1889 finished with value: 0.35921132213378404 and parameters: {'kernel_type': 'Matern', 'length_scale': 976.6589348266465, 'noise_level': 0.002458502443355185, 'constant_value': 3648.1873308003296, 'nu': 0.5}. Best is trial 881 with value: 0.35916990930150405.
[I 2024-12-04 20:41:00,052] Trial 1891 finished with value: 1.0624134024483758 and parameters: {'kernel_type': 'Matern', 'length_scale': 0.08120731193186867, 'noise_level': 0.9409239149627514, 'constant_value': 2.7613185494418877, 'nu': 0.5}. Best is trial 881 with value: 0.35916990930150405.
[I 2024-12-04 20:41:00,137] Trial 1890 finished with value: 0.41956572415504434 and parameters: {'kernel_type': 'Matern', 'length_scale': 397.3402675865394, 'noise_level': 0.02625668066620433, 'constant_value': 5265.189697317572, 'nu': 2.5}. Best is trial 881 with value: 0.35916990930150405.
[I 2024-12-04 20:41:03,085] Trial 1892 finished with value: 0.3592112390369093 and parameters: {'kernel_type': 'Matern', 'length_scale': 69.7496983129024, 'noise_level': 0.9420408884823964, 'constant_value': 65210.63490796571, 'nu': 0.5}. Best is trial 881 with value: 0.35916990930150405.
