[I 2024-12-04 15:27:39,563] Trial 1921 finished with value: 1.2693635028558092 and parameters: {'kernel_type': 'Matern', 'length_scale': 91891.77348277028, 'noise_level': 6.892459490452645e-10, 'constant_value': 4.4427240139515146e-05, 'nu': 0.5}. Best is trial 1456 with value: 0.13435337537029549.
[I 2024-12-04 15:27:39,697] Trial 1937 finished with value: 0.1725103795883213 and parameters: {'kernel_type': 'Matern', 'length_scale': 67.19219895339846, 'noise_level': 0.002410470440151335, 'constant_value': 4.9877713642196095, 'nu': 0.5}. Best is trial 1456 with value: 0.13435337537029549.
[I 2024-12-04 15:27:39,775] Trial 1928 finished with value: 0.15167297485672343 and parameters: {'kernel_type': 'RBF', 'length_scale': 753.9283109838865, 'noise_level': 0.03779309631982823, 'constant_value': 3602.0073979048707, 'nu': 0.5}. Best is trial 1456 with value: 0.13435337537029549.
[I 2024-12-04 15:27:40,646] Trial 1939 finished with value: 0.13435439980611155 and parameters: {'kernel_type': 'Matern', 'length_scale': 5.505613212784249, 'noise_level': 0.014776923690942695, 'constant_value': 242.55674097025118, 'nu': 1.5}. Best is trial 1456 with value: 0.13435337537029549.
[I 2024-12-04 15:27:41,421] Trial 1938 finished with value: 0.13435439084494827 and parameters: {'kernel_type': 'Matern', 'length_scale': 1.715692834584631, 'noise_level': 0.00878077160486305, 'constant_value': 76027.16742273216, 'nu': 1.5}. Best is trial 1456 with value: 0.13435337537029549.
[I 2024-12-04 15:27:41,578] Trial 1945 finished with value: 1.2693635028570247 and parameters: {'kernel_type': 'Matern', 'length_scale': 0.056224459768293183, 'noise_level': 0.009418103454353515, 'constant_value': 1213.6464528632694, 'nu': 1.5}. Best is trial 1456 with value: 0.13435337537029549.
[I 2024-12-04 15:27:42,371] Trial 1930 finished with value: 0.13435440872808943 and parameters: {'kernel_type': 'Matern', 'length_scale': 7.059937868020968, 'noise_level': 0.018540762524622785, 'constant_value': 800.7643519579842, 'nu': 1.5}. Best is trial 1456 with value: 0.13435337537029549.
[I 2024-12-04 15:27:43,999] Trial 1932 finished with value: 0.1343543455228476 and parameters: {'kernel_type': 'Matern', 'length_scale': 0.22876181206982735, 'noise_level': 0.017143611091560863, 'constant_value': 274.1219679339365, 'nu': 1.5}. Best is trial 1456 with value: 0.13435337537029549.
[I 2024-12-04 15:27:44,448] Trial 1936 finished with value: 0.13435431449534366 and parameters: {'kernel_type': 'Matern', 'length_scale': 56.48785542039999, 'noise_level': 0.0010905764054067975, 'constant_value': 1685.7602581165972, 'nu': 1.5}. Best is trial 1456 with value: 0.13435337537029549.
[I 2024-12-04 15:27:46,281] Trial 1935 finished with value: 0.13435426899434177 and parameters: {'kernel_type': 'Matern', 'length_scale': 780.0391263494854, 'noise_level': 0.0008053420896057101, 'constant_value': 90013.7181070171, 'nu': 1.5}. Best is trial 1456 with value: 0.13435337537029549.
[I 2024-12-04 15:27:46,650] Trial 1924 finished with value: 0.13435438936469687 and parameters: {'kernel_type': 'Matern', 'length_scale': 21657.1446747555, 'noise_level': 0.001999560338339865, 'constant_value': 0.0041631233668639476, 'nu': 1.5}. Best is trial 1456 with value: 0.13435337537029549.
[I 2024-12-04 15:27:46,753] Trial 1941 finished with value: 1.2693635028569739 and parameters: {'kernel_type': 'Matern', 'length_scale': 679.486528460098, 'noise_level': 0.0009643668509356941, 'constant_value': 69.81929004385513, 'nu': 1.5}. Best is trial 1456 with value: 0.13435337537029549.
[I 2024-12-04 15:27:46,822] Trial 1934 finished with value: 0.13435440819024191 and parameters: {'kernel_type': 'Matern', 'length_scale': 27.610902518627917, 'noise_level': 0.0492310729126538, 'constant_value': 62.37885253231268, 'nu': 1.5}. Best is trial 1456 with value: 0.13435337537029549.
[I 2024-12-04 15:27:47,340] Trial 1933 finished with value: 1.269363502856829 and parameters: {'kernel_type': 'Matern', 'length_scale': 74556.15433054119, 'noise_level': 0.006208295647406502, 'constant_value': 306.7623364774158, 'nu': 1.5}. Best is trial 1456 with value: 0.13435337537029549.
[I 2024-12-04 15:27:47,409] Trial 1942 finished with value: 0.13435442179507 and parameters: {'kernel_type': 'Matern', 'length_scale': 56.914737247780174, 'noise_level': 0.0056260787138420355, 'constant_value': 24.277830142215937, 'nu': 1.5}. Best is trial 1456 with value: 0.13435337537029549.
[I 2024-12-04 15:27:48,966] Trial 1947 finished with value: 1.3007745978313752 and parameters: {'kernel_type': 'RBF', 'length_scale': 13870.777076954275, 'noise_level': 0.2679181712357909, 'constant_value': 2.9265852089237786e-07, 'nu': 1.5}. Best is trial 1456 with value: 0.13435337537029549.
[I 2024-12-04 15:27:51,139] Trial 1944 finished with value: 0.13435439962620763 and parameters: {'kernel_type': 'Matern', 'length_scale': 12.319416822993572, 'noise_level': 0.0022017500460792825, 'constant_value': 1622.608408810671, 'nu': 1.5}. Best is trial 1456 with value: 0.13435337537029549.
[I 2024-12-04 15:27:51,485] Trial 1949 finished with value: 0.15167297795157564 and parameters: {'kernel_type': 'RBF', 'length_scale': 5.161037551169191, 'noise_level': 0.0002384618475227038, 'constant_value': 51836.62471025984, 'nu': 0.5}. Best is trial 1456 with value: 0.13435337537029549.
[I 2024-12-04 15:27:51,841] Trial 1948 finished with value: 0.13435439480010017 and parameters: {'kernel_type': 'Matern', 'length_scale': 3.6812125153877915, 'noise_level': 0.014426143842616935, 'constant_value': 2211.893521645783, 'nu': 1.5}. Best is trial 1456 with value: 0.13435337537029549.
[I 2024-12-04 15:27:52,005] Trial 1943 finished with value: 0.13435440468690088 and parameters: {'kernel_type': 'Matern', 'length_scale': 18.986998316956555, 'noise_level': 0.025608071488809052, 'constant_value': 1462.3119725645734, 'nu': 1.5}. Best is trial 1456 with value: 0.13435337537029549.
[I 2024-12-04 15:27:56,846] Trial 1955 finished with value: 1.3007745979657548 and parameters: {'kernel_type': 'Matern', 'length_scale': 4.56880619113761, 'noise_level': 0.0009534427063588791, 'constant_value': 87792.69071005833, 'nu': 1.5}. Best is trial 1456 with value: 0.13435337537029549.
[I 2024-12-04 15:28:00,289] Trial 1946 finished with value: 0.13435430894981304 and parameters: {'kernel_type': 'Matern', 'length_scale': 250.44115143396147, 'noise_level': 0.006054432339292952, 'constant_value': 13.434303965040119, 'nu': 1.5}. Best is trial 1456 with value: 0.13435337537029549.
[I 2024-12-04 15:28:00,291] Trial 1951 finished with value: 0.15167297388607373 and parameters: {'kernel_type': 'RBF', 'length_scale': 2135.91406539564, 'noise_level': 0.0006106999597349102, 'constant_value': 72606.43854648783, 'nu': 1.5}. Best is trial 1456 with value: 0.13435337537029549.
[I 2024-12-04 15:28:00,292] Trial 1958 finished with value: 0.13435438671418534 and parameters: {'kernel_type': 'Matern', 'length_scale': 20.027084276134875, 'noise_level': 0.05019883887311275, 'constant_value': 60.83933599123137, 'nu': 1.5}. Best is trial 1456 with value: 0.13435337537029549.
[I 2024-12-04 15:28:00,499] Trial 1950 finished with value: 0.13435445348980235 and parameters: {'kernel_type': 'Matern', 'length_scale': 0.5227030601364073, 'noise_level': 0.004317795611002193, 'constant_value': 2710.475657104642, 'nu': 1.5}. Best is trial 1456 with value: 0.13435337537029549.
[I 2024-12-04 15:28:00,605] Trial 1957 finished with value: 0.13435366150806516 and parameters: {'kernel_type': 'Matern', 'length_scale': 11.366892057784085, 'noise_level': 0.0024803442322768655, 'constant_value': 86965.5435312741, 'nu': 1.5}. Best is trial 1456 with value: 0.13435337537029549.
[I 2024-12-04 15:28:01,392] Trial 1953 finished with value: 0.17251040490765177 and parameters: {'kernel_type': 'Matern', 'length_scale': 0.21598300952318436, 'noise_level': 4.602795604564147e-05, 'constant_value': 1201.0564555164733, 'nu': 0.5}. Best is trial 1456 with value: 0.13435337537029549.
[I 2024-12-04 15:28:04,224] Trial 1952 finished with value: 1.269363502856999 and parameters: {'kernel_type': 'RBF', 'length_scale': 22688.545426709334, 'noise_level': 6.1252739174002e-09, 'constant_value': 6.745654890306234, 'nu': 2.5}. Best is trial 1456 with value: 0.13435337537029549.
[I 2024-12-04 15:28:04,588] Trial 1963 finished with value: 1.2693631282745022 and parameters: {'kernel_type': 'Matern', 'length_scale': 0.09939965163812232, 'noise_level': 0.003991301207896846, 'constant_value': 99398.0004985511, 'nu': 1.5}. Best is trial 1456 with value: 0.13435337537029549.
[I 2024-12-04 15:28:05,510] Trial 1960 finished with value: 0.1343544560043345 and parameters: {'kernel_type': 'Matern', 'length_scale': 795.5221101287539, 'noise_level': 0.010696139592375488, 'constant_value': 1225.988614129217, 'nu': 1.5}. Best is trial 1456 with value: 0.13435337537029549.
[I 2024-12-04 15:28:07,216] Trial 1959 finished with value: 0.1725104025377197 and parameters: {'kernel_type': 'Matern', 'length_scale': 1192.7602165410328, 'noise_level': 0.04879982810332239, 'constant_value': 16.072446348333557, 'nu': 0.5}. Best is trial 1456 with value: 0.13435337537029549.
[I 2024-12-04 15:28:07,987] Trial 1965 finished with value: 0.17251040074630333 and parameters: {'kernel_type': 'Matern', 'length_scale': 1.2662173158193166, 'noise_level': 0.003636809835581461, 'constant_value': 5206.611777319867, 'nu': 0.5}. Best is trial 1456 with value: 0.13435337537029549.
[I 2024-12-04 15:28:11,005] Trial 1954 finished with value: 0.13435424734174664 and parameters: {'kernel_type': 'Matern', 'length_scale': 47.65118576988588, 'noise_level': 0.0005864786765281558, 'constant_value': 1362.6176131053662, 'nu': 1.5}. Best is trial 1456 with value: 0.13435337537029549.
[I 2024-12-04 15:28:11,774] Trial 1966 finished with value: 0.134354418632942 and parameters: {'kernel_type': 'Matern', 'length_scale': 5.963225749489986, 'noise_level': 6.797049618182333e-05, 'constant_value': 86150.42405408414, 'nu': 1.5}. Best is trial 1456 with value: 0.13435337537029549.
[I 2024-12-04 15:28:12,336] Trial 1956 finished with value: 0.15167297639684246 and parameters: {'kernel_type': 'RBF', 'length_scale': 0.4300705215289182, 'noise_level': 0.0005693084490470781, 'constant_value': 13940.774583245346, 'nu': 1.5}. Best is trial 1456 with value: 0.13435337537029549.
[I 2024-12-04 15:28:12,666] Trial 1962 finished with value: 0.13435407110445557 and parameters: {'kernel_type': 'Matern', 'length_scale': 5.444772721928735, 'noise_level': 0.01601506383644068, 'constant_value': 1997.3918525782676, 'nu': 1.5}. Best is trial 1456 with value: 0.13435337537029549.
[I 2024-12-04 15:28:12,763] Trial 1961 finished with value: 0.13435439908828117 and parameters: {'kernel_type': 'Matern', 'length_scale': 0.1540625822768672, 'noise_level': 0.0485241046040195, 'constant_value': 3480.2450437197117, 'nu': 1.5}. Best is trial 1456 with value: 0.13435337537029549.
[I 2024-12-04 15:28:14,473] Trial 1964 finished with value: 0.15167304076574117 and parameters: {'kernel_type': 'RBF', 'length_scale': 4.8494689742638855, 'noise_level': 4.7415427210130105e-05, 'constant_value': 1.4450320284253146e-06, 'nu': 1.5}. Best is trial 1456 with value: 0.13435337537029549.
[I 2024-12-04 15:28:14,501] Trial 1977 finished with value: 1.3007722343451888 and parameters: {'kernel_type': 'Matern', 'length_scale': 0.43531075114282847, 'noise_level': 0.0010809923559046298, 'constant_value': 77495.55134147794, 'nu': 1.5}. Best is trial 1456 with value: 0.13435337537029549.
[I 2024-12-04 15:28:14,630] Trial 1967 finished with value: 0.17251040258739517 and parameters: {'kernel_type': 'Matern', 'length_scale': 23.749124088307727, 'noise_level': 1.1217472455524023e-05, 'constant_value': 85.00932861139964, 'nu': 0.5}. Best is trial 1456 with value: 0.13435337537029549.
[I 2024-12-04 15:28:14,670] Trial 1970 finished with value: 0.13435441015127148 and parameters: {'kernel_type': 'Matern', 'length_scale': 3.74598012659431, 'noise_level': 0.016678253646798726, 'constant_value': 1442.9820570873521, 'nu': 1.5}. Best is trial 1456 with value: 0.13435337537029549.
[I 2024-12-04 15:28:15,337] Trial 1969 finished with value: 0.13435446971032056 and parameters: {'kernel_type': 'Matern', 'length_scale': 98.5347283264921, 'noise_level': 0.0023235218265944993, 'constant_value': 44226.96874478231, 'nu': 1.5}. Best is trial 1456 with value: 0.13435337537029549.
[I 2024-12-04 15:28:15,448] Trial 1971 finished with value: 0.13435443571589242 and parameters: {'kernel_type': 'Matern', 'length_scale': 93.65612410808697, 'noise_level': 0.00015418681807607761, 'constant_value': 32053.690895069747, 'nu': 1.5}. Best is trial 1456 with value: 0.13435337537029549.
[I 2024-12-04 15:28:18,835] Trial 1978 finished with value: 0.1343543997528107 and parameters: {'kernel_type': 'Matern', 'length_scale': 7.489067264310884, 'noise_level': 0.0003050078110871442, 'constant_value': 1327.388258205117, 'nu': 1.5}. Best is trial 1456 with value: 0.13435337537029549.
[I 2024-12-04 15:28:19,373] Trial 1974 finished with value: 0.13435424238864724 and parameters: {'kernel_type': 'Matern', 'length_scale': 32.58900844047067, 'noise_level': 0.0023106877307379615, 'constant_value': 70870.28903992946, 'nu': 1.5}. Best is trial 1456 with value: 0.13435337537029549.
[I 2024-12-04 15:28:19,797] Trial 1981 finished with value: 0.13435439524293427 and parameters: {'kernel_type': 'Matern', 'length_scale': 23.203670948125822, 'noise_level': 0.001785478210949384, 'constant_value': 9886.255888903415, 'nu': 1.5}. Best is trial 1456 with value: 0.13435337537029549.
[I 2024-12-04 15:28:20,848] Trial 1976 finished with value: 0.13435437325862398 and parameters: {'kernel_type': 'Matern', 'length_scale': 0.7259869237460236, 'noise_level': 0.008140327116737817, 'constant_value': 94115.56577432284, 'nu': 1.5}. Best is trial 1456 with value: 0.13435337537029549.
[I 2024-12-04 15:28:20,848] Trial 1988 finished with value: 1.3007745979657548 and parameters: {'kernel_type': 'Matern', 'length_scale': 10.623440217173142, 'noise_level': 0.0011082313067763616, 'constant_value': 23526.731676224077, 'nu': 1.5}. Best is trial 1456 with value: 0.13435337537029549.
[I 2024-12-04 15:28:22,245] Trial 1973 finished with value: 1.269363502841189 and parameters: {'kernel_type': 'RBF', 'length_scale': 0.009863381711520037, 'noise_level': 1.5454519378821758e-05, 'constant_value': 0.0009768860776427006, 'nu': 0.5}. Best is trial 1456 with value: 0.13435337537029549.
[I 2024-12-04 15:28:23,341] Trial 1972 finished with value: 0.13435435217834626 and parameters: {'kernel_type': 'Matern', 'length_scale': 4.690584039265483, 'noise_level': 9.156153263052657e-06, 'constant_value': 274.0667744143468, 'nu': 1.5}. Best is trial 1456 with value: 0.13435337537029549.
[I 2024-12-04 15:28:23,727] Trial 1980 finished with value: 0.13435439318395134 and parameters: {'kernel_type': 'Matern', 'length_scale': 1.3739510801672052, 'noise_level': 0.14508819750161248, 'constant_value': 92253.37274099245, 'nu': 1.5}. Best is trial 1456 with value: 0.13435337537029549.
[I 2024-12-04 15:28:25,534] Trial 1975 finished with value: 0.1343544616668767 and parameters: {'kernel_type': 'Matern', 'length_scale': 216.41406821566528, 'noise_level': 0.0005790091683507254, 'constant_value': 8888.34700050899, 'nu': 1.5}. Best is trial 1456 with value: 0.13435337537029549.
[I 2024-12-04 15:28:25,825] Trial 1968 finished with value: 0.13435448299570532 and parameters: {'kernel_type': 'Matern', 'length_scale': 0.4304048145088181, 'noise_level': 0.0022199337928325217, 'constant_value': 3629.297378870908, 'nu': 1.5}. Best is trial 1456 with value: 0.13435337537029549.
[I 2024-12-04 15:28:27,596] Trial 1984 finished with value: 0.13435398806006604 and parameters: {'kernel_type': 'Matern', 'length_scale': 39.810448995562325, 'noise_level': 0.012204448175603268, 'constant_value': 81985.27058021033, 'nu': 1.5}. Best is trial 1456 with value: 0.13435337537029549.
[I 2024-12-04 15:28:29,184] Trial 1983 finished with value: 1.2693635008027984 and parameters: {'kernel_type': 'Matern', 'length_scale': 0.07567140482022962, 'noise_level': 0.0003157057539350584, 'constant_value': 2515.49109456941, 'nu': 1.5}. Best is trial 1456 with value: 0.13435337537029549.
[I 2024-12-04 15:28:29,416] Trial 1989 finished with value: 0.1343543430354208 and parameters: {'kernel_type': 'Matern', 'length_scale': 15.16534366039055, 'noise_level': 0.041986067011180676, 'constant_value': 91314.68009696742, 'nu': 1.5}. Best is trial 1985 with value: 0.134351948015208.
[I 2024-12-04 15:28:29,731] Trial 1990 finished with value: 1.269363180932241 and parameters: {'kernel_type': 'Matern', 'length_scale': 0.09849662290120556, 'noise_level': 0.0006680970541735383, 'constant_value': 436.1207160091519, 'nu': 1.5}. Best is trial 1985 with value: 0.134351948015208.
[I 2024-12-04 15:28:31,940] Trial 1985 finished with value: 0.134351948015208 and parameters: {'kernel_type': 'Matern', 'length_scale': 6.144651318963106, 'noise_level': 0.0014134135315656954, 'constant_value': 26588.349418547143, 'nu': 1.5}. Best is trial 1985 with value: 0.134351948015208.
[I 2024-12-04 15:28:31,954] Trial 1979 finished with value: 0.13435433028364113 and parameters: {'kernel_type': 'Matern', 'length_scale': 4.955422231078887, 'noise_level': 1.0220908921160308e-05, 'constant_value': 305.2388916079607, 'nu': 1.5}. Best is trial 1985 with value: 0.134351948015208.
[I 2024-12-04 15:28:33,714] Trial 1982 finished with value: 0.1343542116078773 and parameters: {'kernel_type': 'Matern', 'length_scale': 0.46671635649329696, 'noise_level': 0.0001204072126762837, 'constant_value': 928.6239460422662, 'nu': 1.5}. Best is trial 1985 with value: 0.134351948015208.
[I 2024-12-04 15:28:33,948] Trial 1987 finished with value: 0.13435430891752803 and parameters: {'kernel_type': 'Matern', 'length_scale': 2747.4051211320466, 'noise_level': 0.0015805213199122736, 'constant_value': 85908.05008782436, 'nu': 1.5}. Best is trial 1985 with value: 0.134351948015208.
[I 2024-12-04 15:28:34,776] Trial 1986 finished with value: 0.1343543730127464 and parameters: {'kernel_type': 'Matern', 'length_scale': 0.37487822720096803, 'noise_level': 2.4151156726427673e-05, 'constant_value': 18680.832558492366, 'nu': 1.5}. Best is trial 1985 with value: 0.134351948015208.
[I 2024-12-04 15:28:34,796] Trial 1998 finished with value: 1.300773923593875 and parameters: {'kernel_type': 'Matern', 'length_scale': 2.062921596594301e-05, 'noise_level': 7.524237622347614e-07, 'constant_value': 325.004383136036, 'nu': 2.5}. Best is trial 1985 with value: 0.134351948015208.
[I 2024-12-04 15:28:36,751] Trial 1992 finished with value: 0.13435439957222212 and parameters: {'kernel_type': 'Matern', 'length_scale': 2.414125266805588, 'noise_level': 0.020553362884442216, 'constant_value': 5555.022477422591, 'nu': 1.5}. Best is trial 1985 with value: 0.134351948015208.
[I 2024-12-04 15:28:36,755] Trial 1995 finished with value: 0.1343543904527639 and parameters: {'kernel_type': 'Matern', 'length_scale': 640.5525571433333, 'noise_level': 0.0018642078443366322, 'constant_value': 26567.273093046755, 'nu': 1.5}. Best is trial 1985 with value: 0.134351948015208.
[I 2024-12-04 15:28:38,331] Trial 2000 finished with value: 0.1343543589338161 and parameters: {'kernel_type': 'Matern', 'length_scale': 10.24475960877145, 'noise_level': 8.140514930569743e-05, 'constant_value': 22331.757508178216, 'nu': 1.5}. Best is trial 1985 with value: 0.134351948015208.
[I 2024-12-04 15:28:38,739] Trial 1994 finished with value: 0.13435437267410294 and parameters: {'kernel_type': 'Matern', 'length_scale': 16.16438924348274, 'noise_level': 0.004760558651904861, 'constant_value': 63133.043180732915, 'nu': 1.5}. Best is trial 1985 with value: 0.134351948015208.
[I 2024-12-04 15:28:40,040] Trial 1996 finished with value: 0.13435439171079647 and parameters: {'kernel_type': 'Matern', 'length_scale': 12.078523089184378, 'noise_level': 0.03168575678514924, 'constant_value': 66477.64118003074, 'nu': 1.5}. Best is trial 1985 with value: 0.134351948015208.
[I 2024-12-04 15:28:40,043] Trial 1997 finished with value: 1.3007745979657548 and parameters: {'kernel_type': 'Matern', 'length_scale': 7.998519763538979, 'noise_level': 5.244021225154925e-06, 'constant_value': 39370.049165708355, 'nu': 1.5}. Best is trial 1985 with value: 0.134351948015208.
[I 2024-12-04 15:28:40,957] Trial 1993 finished with value: 0.13435439299712304 and parameters: {'kernel_type': 'Matern', 'length_scale': 25.327391285800637, 'noise_level': 0.0019361400819438103, 'constant_value': 34503.90912388808, 'nu': 1.5}. Best is trial 1985 with value: 0.134351948015208.
[I 2024-12-04 15:28:41,645] Trial 1999 finished with value: 0.15167297325505916 and parameters: {'kernel_type': 'RBF', 'length_scale': 6.7867772326422235, 'noise_level': 0.027591698230366404, 'constant_value': 5121.281644336582, 'nu': 2.5}. Best is trial 1985 with value: 0.134351948015208.
[I 2024-12-04 15:28:43,056] Trial 2002 finished with value: 0.13435440031170795 and parameters: {'kernel_type': 'Matern', 'length_scale': 0.3756103489769033, 'noise_level': 0.00035288479181856154, 'constant_value': 99092.2827621304, 'nu': 1.5}. Best is trial 1985 with value: 0.134351948015208.
[I 2024-12-04 15:28:44,023] Trial 2003 finished with value: 1.2693635028571566 and parameters: {'kernel_type': 'RBF', 'length_scale': 55930.722972731695, 'noise_level': 9.78705123485036e-10, 'constant_value': 24.92654388903281, 'nu': 1.5}. Best is trial 1985 with value: 0.134351948015208.
[I 2024-12-04 15:28:44,284] Trial 2001 finished with value: 0.1343541547191278 and parameters: {'kernel_type': 'Matern', 'length_scale': 120.1508141058237, 'noise_level': 0.0010349888034735077, 'constant_value': 82931.8541252484, 'nu': 1.5}. Best is trial 1985 with value: 0.134351948015208.
