[I 2024-12-04 21:09:26,298] Trial 1975 finished with value: 0.14249514303759145 and parameters: {'kernel_type': 'Matern', 'length_scale': 16.26030664666403, 'noise_level': 0.03199944467271377, 'constant_value': 3.7108932673314974, 'nu': 1.5}. Best is trial 959 with value: 0.1375110730946576.
[I 2024-12-04 21:09:32,154] Trial 1976 finished with value: 0.1424950666372605 and parameters: {'kernel_type': 'Matern', 'length_scale': 759.6521022297273, 'noise_level': 0.0420914453304792, 'constant_value': 19.091725169689806, 'nu': 1.5}. Best is trial 959 with value: 0.1375110730946576.
[I 2024-12-04 21:09:32,664] Trial 1977 finished with value: 0.9864686818126867 and parameters: {'kernel_type': 'Matern', 'length_scale': 85.25581245408046, 'noise_level': 0.016230073191222456, 'constant_value': 0.4617421053210279, 'nu': 1.5}. Best is trial 959 with value: 0.1375110730946576.
[I 2024-12-04 21:09:33,872] Trial 1978 finished with value: 0.142495063816197 and parameters: {'kernel_type': 'Matern', 'length_scale': 24.88351341683686, 'noise_level': 0.8527276859273903, 'constant_value': 8.908810538263028, 'nu': 1.5}. Best is trial 959 with value: 0.1375110730946576.
[I 2024-12-04 21:09:39,836] Trial 1979 finished with value: 0.14249504867005605 and parameters: {'kernel_type': 'Matern', 'length_scale': 64.55677863279323, 'noise_level': 0.9726481091449428, 'constant_value': 170.6229774317447, 'nu': 1.5}. Best is trial 959 with value: 0.1375110730946576.
[I 2024-12-04 21:09:41,442] Trial 1980 finished with value: 0.14249505633515575 and parameters: {'kernel_type': 'Matern', 'length_scale': 0.9242538098249456, 'noise_level': 0.5598150847620277, 'constant_value': 8.822760112368055, 'nu': 1.5}. Best is trial 959 with value: 0.1375110730946576.
[I 2024-12-04 21:09:47,310] Trial 1982 finished with value: 0.1424950267896633 and parameters: {'kernel_type': 'Matern', 'length_scale': 109.4647655336785, 'noise_level': 0.6170456252499018, 'constant_value': 0.4849120972802437, 'nu': 1.5}. Best is trial 959 with value: 0.1375110730946576.
[I 2024-12-04 21:09:47,924] Trial 1981 finished with value: 0.14249511404037546 and parameters: {'kernel_type': 'Matern', 'length_scale': 0.5791810325482688, 'noise_level': 0.7232676000687334, 'constant_value': 568.156191924043, 'nu': 1.5}. Best is trial 959 with value: 0.1375110730946576.
[I 2024-12-04 21:09:48,430] Trial 1983 finished with value: 0.14249515418972528 and parameters: {'kernel_type': 'Matern', 'length_scale': 108.7319917639557, 'noise_level': 0.9331307954371001, 'constant_value': 32.931422723617274, 'nu': 1.5}. Best is trial 959 with value: 0.1375110730946576.
[I 2024-12-04 21:09:55,012] Trial 1986 finished with value: 0.9982170955249674 and parameters: {'kernel_type': 'Matern', 'length_scale': 35032.49078040765, 'noise_level': 0.5758383670453866, 'constant_value': 11.58733075915282, 'nu': 1.5}. Best is trial 959 with value: 0.1375110730946576.
[I 2024-12-04 21:09:55,786] Trial 1985 finished with value: 0.14249506538113188 and parameters: {'kernel_type': 'Matern', 'length_scale': 1.5492943113480424, 'noise_level': 0.6395949609590241, 'constant_value': 0.2784237344563713, 'nu': 1.5}. Best is trial 959 with value: 0.1375110730946576.
[I 2024-12-04 21:09:57,228] Trial 1984 finished with value: 0.986468681920308 and parameters: {'kernel_type': 'Matern', 'length_scale': 169.3416224609682, 'noise_level': 0.017061225795379106, 'constant_value': 0.02500531633025034, 'nu': 1.5}. Best is trial 959 with value: 0.1375110730946576.
[I 2024-12-04 21:10:05,987] Trial 1988 finished with value: 0.1477105523842472 and parameters: {'kernel_type': 'RBF', 'length_scale': 17647.60897342504, 'noise_level': 0.5883925550910026, 'constant_value': 239.49564068429174, 'nu': 1.5}. Best is trial 959 with value: 0.1375110730946576.
[I 2024-12-04 21:10:06,059] Trial 1989 finished with value: 0.1424950799284087 and parameters: {'kernel_type': 'Matern', 'length_scale': 404.5286510193535, 'noise_level': 0.8721625694055781, 'constant_value': 0.5612008304776639, 'nu': 1.5}. Best is trial 959 with value: 0.1375110730946576.
[I 2024-12-04 21:10:08,701] Trial 1987 finished with value: 0.14249521946938123 and parameters: {'kernel_type': 'Matern', 'length_scale': 47.84726149920297, 'noise_level': 0.756193273017682, 'constant_value': 269.9567372219025, 'nu': 1.5}. Best is trial 959 with value: 0.1375110730946576.
[I 2024-12-04 21:10:13,715] Trial 1991 finished with value: 0.14249518567450703 and parameters: {'kernel_type': 'Matern', 'length_scale': 67.79367549369415, 'noise_level': 0.02879437286736035, 'constant_value': 1.0872921168218916, 'nu': 1.5}. Best is trial 959 with value: 0.1375110730946576.
[I 2024-12-04 21:10:15,247] Trial 1990 finished with value: 0.14249517199445827 and parameters: {'kernel_type': 'Matern', 'length_scale': 18.75678749877088, 'noise_level': 0.8824940138708357, 'constant_value': 0.14882920276143763, 'nu': 1.5}. Best is trial 959 with value: 0.1375110730946576.
[I 2024-12-04 21:10:15,257] Trial 1992 finished with value: 0.19720003127011396 and parameters: {'kernel_type': 'Matern', 'length_scale': 0.4856619345277588, 'noise_level': 0.27392489168440914, 'constant_value': 24.16567923508474, 'nu': 0.5}. Best is trial 959 with value: 0.1375110730946576.
[I 2024-12-04 21:10:19,932] Trial 1993 finished with value: 0.14771062957217038 and parameters: {'kernel_type': 'RBF', 'length_scale': 42.5295450841271, 'noise_level': 0.7365572222156624, 'constant_value': 7.667973748619443, 'nu': 1.5}. Best is trial 959 with value: 0.1375110730946576.
[I 2024-12-04 21:10:21,740] Trial 1994 finished with value: 0.14771041189751213 and parameters: {'kernel_type': 'RBF', 'length_scale': 0.3293841944821428, 'noise_level': 0.9212950846969279, 'constant_value': 1276.7303037185388, 'nu': 1.5}. Best is trial 959 with value: 0.1375110730946576.
[I 2024-12-04 21:10:24,503] Trial 1995 finished with value: 0.1424950045957819 and parameters: {'kernel_type': 'Matern', 'length_scale': 6.171933554018314, 'noise_level': 0.6441020534091206, 'constant_value': 115.84691846994566, 'nu': 1.5}. Best is trial 959 with value: 0.1375110730946576.
[I 2024-12-04 21:10:27,472] Trial 1996 finished with value: 0.9982170819756109 and parameters: {'kernel_type': 'RBF', 'length_scale': 15170.272672816287, 'noise_level': 0.004660349621493988, 'constant_value': 0.013222480802199484, 'nu': 0.5}. Best is trial 959 with value: 0.1375110730946576.
[I 2024-12-04 21:10:28,338] Trial 1998 finished with value: 0.9864686446269961 and parameters: {'kernel_type': 'Matern', 'length_scale': 0.0895614826103198, 'noise_level': 0.914028840666337, 'constant_value': 152.6340925615511, 'nu': 1.5}. Best is trial 959 with value: 0.1375110730946576.
[I 2024-12-04 21:10:28,880] Trial 1997 finished with value: 0.142495073948581 and parameters: {'kernel_type': 'Matern', 'length_scale': 1.9913143799197204, 'noise_level': 0.9291441441924707, 'constant_value': 19.69890652380113, 'nu': 1.5}. Best is trial 959 with value: 0.1375110730946576.
[I 2024-12-04 21:10:34,168] Trial 2001 finished with value: 0.9982171094711454 and parameters: {'kernel_type': 'Matern', 'length_scale': 61720.913402534105, 'noise_level': 0.924899000902832, 'constant_value': 0.004765932142677647, 'nu': 1.5}. Best is trial 959 with value: 0.1375110730946576.
[I 2024-12-04 21:10:34,169] Trial 2000 finished with value: 0.14249506617162155 and parameters: {'kernel_type': 'Matern', 'length_scale': 5093.274160352456, 'noise_level': 0.7468571492740225, 'constant_value': 628.7745412247515, 'nu': 1.5}. Best is trial 959 with value: 0.1375110730946576.
[I 2024-12-04 21:10:36,337] Trial 1999 finished with value: 0.9864686818794245 and parameters: {'kernel_type': 'RBF', 'length_scale': 6.94682600824387, 'noise_level': 5.3275743527715477e-08, 'constant_value': 1.0488844473182208e-07, 'nu': 2.5}. Best is trial 959 with value: 0.1375110730946576.
[I 2024-12-04 21:10:42,330] Trial 2003 finished with value: 0.1424950630228461 and parameters: {'kernel_type': 'Matern', 'length_scale': 0.5496961330470551, 'noise_level': 0.8618114950665249, 'constant_value': 327.1840468066038, 'nu': 1.5}. Best is trial 959 with value: 0.1375110730946576.
[I 2024-12-04 21:10:43,516] Trial 2004 finished with value: 0.14249506340044701 and parameters: {'kernel_type': 'Matern', 'length_scale': 17.818719781640382, 'noise_level': 0.5682450781366125, 'constant_value': 0.18652185614467232, 'nu': 1.5}. Best is trial 959 with value: 0.1375110730946576.
[I 2024-12-04 21:10:43,589] Trial 2002 finished with value: 0.13981157695758373 and parameters: {'kernel_type': 'Matern', 'length_scale': 591.5083307043279, 'noise_level': 0.9852285108954834, 'constant_value': 14.69653275809148, 'nu': 1.5}. Best is trial 959 with value: 0.1375110730946576.
[I 2024-12-04 21:10:50,319] Trial 2007 finished with value: 0.14249517655083221 and parameters: {'kernel_type': 'Matern', 'length_scale': 3.2161994065320565, 'noise_level': 0.07220669498251138, 'constant_value': 4.798962337921752, 'nu': 1.5}. Best is trial 959 with value: 0.1375110730946576.
[I 2024-12-04 21:10:52,735] Trial 2006 finished with value: 0.14249503533346466 and parameters: {'kernel_type': 'Matern', 'length_scale': 2.8153424442359394, 'noise_level': 0.5100206147273598, 'constant_value': 118.4182259239398, 'nu': 1.5}. Best is trial 959 with value: 0.1375110730946576.
[I 2024-12-04 21:10:54,220] Trial 2005 finished with value: 0.9864686819219156 and parameters: {'kernel_type': 'Matern', 'length_scale': 846.160802605404, 'noise_level': 0.026217173750739883, 'constant_value': 6.508632382485715, 'nu': 1.5}. Best is trial 959 with value: 0.1375110730946576.
[I 2024-12-04 21:11:01,778] Trial 2009 finished with value: 0.14249512913984455 and parameters: {'kernel_type': 'Matern', 'length_scale': 95.15670186005768, 'noise_level': 0.8958483953781916, 'constant_value': 72.4195998915433, 'nu': 1.5}. Best is trial 959 with value: 0.1375110730946576.
[I 2024-12-04 21:11:01,884] Trial 2008 finished with value: 0.14249482461795773 and parameters: {'kernel_type': 'Matern', 'length_scale': 96.51317582247121, 'noise_level': 0.022322019512125178, 'constant_value': 5.2615726126469955, 'nu': 1.5}. Best is trial 959 with value: 0.1375110730946576.
[I 2024-12-04 21:11:02,588] Trial 2010 finished with value: 0.142495154534237 and parameters: {'kernel_type': 'Matern', 'length_scale': 7.783087481100247, 'noise_level': 0.0900791881205248, 'constant_value': 50.20556347255566, 'nu': 1.5}. Best is trial 959 with value: 0.1375110730946576.
[I 2024-12-04 21:11:14,819] Trial 2012 finished with value: 0.9864686819228311 and parameters: {'kernel_type': 'RBF', 'length_scale': 0.10144396137929, 'noise_level': 1.0700415599428145e-05, 'constant_value': 0.05619665720467493, 'nu': 0.5}. Best is trial 959 with value: 0.1375110730946576.
[I 2024-12-04 21:11:15,530] Trial 2011 finished with value: 0.14249484499017406 and parameters: {'kernel_type': 'Matern', 'length_scale': 32.24912077891008, 'noise_level': 0.9687650934683769, 'constant_value': 654.6734301027889, 'nu': 1.5}. Best is trial 959 with value: 0.1375110730946576.
[I 2024-12-04 21:11:17,964] Trial 2013 finished with value: 0.1424950566121171 and parameters: {'kernel_type': 'Matern', 'length_scale': 145.1081654049455, 'noise_level': 0.9780809971693416, 'constant_value': 0.26131188904320735, 'nu': 1.5}. Best is trial 959 with value: 0.1375110730946576.
[I 2024-12-04 21:11:21,536] Trial 2015 finished with value: 0.9864686819227901 and parameters: {'kernel_type': 'RBF', 'length_scale': 59.31871514537666, 'noise_level': 1.5250169030572157e-08, 'constant_value': 79284.56071685752, 'nu': 2.5}. Best is trial 959 with value: 0.1375110730946576.
[I 2024-12-04 21:11:26,103] Trial 2016 finished with value: 0.1424954023784411 and parameters: {'kernel_type': 'Matern', 'length_scale': 18.280212586890926, 'noise_level': 0.9646972794965917, 'constant_value': 4.080084313960825, 'nu': 1.5}. Best is trial 959 with value: 0.1375110730946576.
[I 2024-12-04 21:11:29,985] Trial 2014 finished with value: 0.14249485777326304 and parameters: {'kernel_type': 'Matern', 'length_scale': 76.87439408783648, 'noise_level': 0.02336570272669974, 'constant_value': 8.375950530002882, 'nu': 1.5}. Best is trial 959 with value: 0.1375110730946576.
[I 2024-12-04 21:11:32,528] Trial 2017 finished with value: 0.9864686821418953 and parameters: {'kernel_type': 'Matern', 'length_scale': 0.004202796477808952, 'noise_level': 0.026577275751446413, 'constant_value': 0.0011174002499568726, 'nu': 2.5}. Best is trial 959 with value: 0.1375110730946576.
[I 2024-12-04 21:11:33,606] Trial 2018 finished with value: 0.14469888977282094 and parameters: {'kernel_type': 'Matern', 'length_scale': 108.9299809626198, 'noise_level': 0.9773983614232428, 'constant_value': 20.72420659019325, 'nu': 2.5}. Best is trial 959 with value: 0.1375110730946576.
[I 2024-12-04 21:11:36,677] Trial 2019 finished with value: 0.14249507563641967 and parameters: {'kernel_type': 'Matern', 'length_scale': 9.321791262392878, 'noise_level': 0.05363861774264424, 'constant_value': 6.589605951788571, 'nu': 1.5}. Best is trial 959 with value: 0.1375110730946576.
[I 2024-12-04 21:11:39,988] Trial 2020 finished with value: 0.14249506379508872 and parameters: {'kernel_type': 'Matern', 'length_scale': 19.093865641309012, 'noise_level': 0.9364724490049435, 'constant_value': 23.737067564496623, 'nu': 1.5}. Best is trial 959 with value: 0.1375110730946576.
[I 2024-12-04 21:11:44,262] Trial 2021 finished with value: 0.14249511865502132 and parameters: {'kernel_type': 'Matern', 'length_scale': 6762.763777298465, 'noise_level': 0.843949298632739, 'constant_value': 48.989260012479924, 'nu': 1.5}. Best is trial 959 with value: 0.1375110730946576.
[I 2024-12-04 21:11:45,415] Trial 2022 finished with value: 0.14249507046496213 and parameters: {'kernel_type': 'Matern', 'length_scale': 8.40562026162095, 'noise_level': 0.9417958548425621, 'constant_value': 56.13710195215804, 'nu': 1.5}. Best is trial 959 with value: 0.1375110730946576.
[I 2024-12-04 21:11:46,758] Trial 2023 finished with value: 0.19720003358088153 and parameters: {'kernel_type': 'Matern', 'length_scale': 24.996611487358027, 'noise_level': 0.18537709075885422, 'constant_value': 101.38677300449767, 'nu': 0.5}. Best is trial 959 with value: 0.1375110730946576.
[I 2024-12-04 21:11:51,481] Trial 2026 finished with value: 0.9982160743066604 and parameters: {'kernel_type': 'Matern', 'length_scale': 0.2668450175178354, 'noise_level': 0.06360826368085859, 'constant_value': 1.2690729474113487e-07, 'nu': 0.5}. Best is trial 959 with value: 0.1375110730946576.
[I 2024-12-04 21:11:52,020] Trial 2025 finished with value: 0.14249502425184032 and parameters: {'kernel_type': 'Matern', 'length_scale': 2.9869095060869912, 'noise_level': 0.711687185709229, 'constant_value': 0.2668229733830084, 'nu': 1.5}. Best is trial 959 with value: 0.1375110730946576.
[I 2024-12-04 21:11:59,221] Trial 2027 finished with value: 0.1424950662821952 and parameters: {'kernel_type': 'Matern', 'length_scale': 4.176089416286027, 'noise_level': 0.4342661982818977, 'constant_value': 0.8450903968101151, 'nu': 1.5}. Best is trial 959 with value: 0.1375110730946576.
[I 2024-12-04 21:12:00,636] Trial 2024 finished with value: 0.15216374972588984 and parameters: {'kernel_type': 'Matern', 'length_scale': 735.4254689032308, 'noise_level': 0.7969947072729039, 'constant_value': 0.004481985682619528, 'nu': 1.5}. Best is trial 959 with value: 0.1375110730946576.
[I 2024-12-04 21:12:08,491] Trial 2030 finished with value: 0.9864686821344524 and parameters: {'kernel_type': 'Matern', 'length_scale': 978.2530790347913, 'noise_level': 0.013764347208574253, 'constant_value': 9.361919558776185, 'nu': 1.5}. Best is trial 959 with value: 0.1375110730946576.
[I 2024-12-04 21:12:08,615] Trial 2028 finished with value: 0.1424950507646502 and parameters: {'kernel_type': 'Matern', 'length_scale': 384.44941701281175, 'noise_level': 0.812911229651051, 'constant_value': 0.36990848392164116, 'nu': 1.5}. Best is trial 959 with value: 0.1375110730946576.
[I 2024-12-04 21:12:09,569] Trial 2029 finished with value: 0.14249502205356926 and parameters: {'kernel_type': 'Matern', 'length_scale': 76.85323021024048, 'noise_level': 0.013574092599477627, 'constant_value': 11.044150677931935, 'nu': 1.5}. Best is trial 959 with value: 0.1375110730946576.
[I 2024-12-04 21:12:14,369] Trial 2031 finished with value: 0.9982171089573186 and parameters: {'kernel_type': 'Matern', 'length_scale': 12094.13505104084, 'noise_level': 0.8554111157085141, 'constant_value': 0.028471685652474016, 'nu': 2.5}. Best is trial 959 with value: 0.1375110730946576.
[I 2024-12-04 21:12:17,126] Trial 2033 finished with value: 0.14249508587359155 and parameters: {'kernel_type': 'Matern', 'length_scale': 22.342768807496228, 'noise_level': 0.6657104282593659, 'constant_value': 0.04894099022800988, 'nu': 1.5}. Best is trial 959 with value: 0.1375110730946576.
[I 2024-12-04 21:12:18,908] Trial 2034 finished with value: 0.9864686815743132 and parameters: {'kernel_type': 'Matern', 'length_scale': 0.0714248466547148, 'noise_level': 0.9621304843369556, 'constant_value': 122.3583940063316, 'nu': 1.5}. Best is trial 959 with value: 0.1375110730946576.
[I 2024-12-04 21:12:19,092] Trial 2032 finished with value: 0.1424953697016563 and parameters: {'kernel_type': 'Matern', 'length_scale': 12.065305927761141, 'noise_level': 0.037939674571152056, 'constant_value': 64.1486784904653, 'nu': 1.5}. Best is trial 959 with value: 0.1375110730946576.
[I 2024-12-04 21:12:22,526] Trial 2035 finished with value: 0.14249471311340284 and parameters: {'kernel_type': 'Matern', 'length_scale': 1080.746594208269, 'noise_level': 0.9729638832116012, 'constant_value': 260.29164819123196, 'nu': 1.5}. Best is trial 959 with value: 0.1375110730946576.
[I 2024-12-04 21:12:25,947] Trial 2036 finished with value: 0.9864686818932499 and parameters: {'kernel_type': 'Matern', 'length_scale': 37.79993971828367, 'noise_level': 0.014729102645268185, 'constant_value': 0.74523737253312, 'nu': 1.5}. Best is trial 959 with value: 0.1375110730946576.
[I 2024-12-04 21:12:28,998] Trial 2037 finished with value: 0.9864686818901534 and parameters: {'kernel_type': 'Matern', 'length_scale': 3627.053712223034, 'noise_level': 0.0184600187388998, 'constant_value': 0.20638576275228399, 'nu': 1.5}. Best is trial 959 with value: 0.1375110730946576.
[I 2024-12-04 21:12:29,698] Trial 2038 finished with value: 0.14249485940871115 and parameters: {'kernel_type': 'Matern', 'length_scale': 13.556418953555902, 'noise_level': 0.8291329678838015, 'constant_value': 0.446064125413088, 'nu': 1.5}. Best is trial 959 with value: 0.1375110730946576.
[I 2024-12-04 21:12:32,557] Trial 2039 finished with value: 0.1424950607275603 and parameters: {'kernel_type': 'Matern', 'length_scale': 4.570686392437734, 'noise_level': 0.03453729984645671, 'constant_value': 8.894408748564738, 'nu': 1.5}. Best is trial 959 with value: 0.1375110730946576.
[I 2024-12-04 21:12:35,640] Trial 2041 finished with value: 0.14249506693986777 and parameters: {'kernel_type': 'Matern', 'length_scale': 12.572038004970496, 'noise_level': 0.029993054749467202, 'constant_value': 26.813606187056813, 'nu': 1.5}. Best is trial 959 with value: 0.1375110730946576.
[I 2024-12-04 21:12:36,213] Trial 2040 finished with value: 0.14249506707208903 and parameters: {'kernel_type': 'Matern', 'length_scale': 110.83372316185586, 'noise_level': 0.8893722222400999, 'constant_value': 7.339213641566479, 'nu': 1.5}. Best is trial 959 with value: 0.1375110730946576.
[I 2024-12-04 21:12:38,198] Trial 2042 finished with value: 0.14249504063257054 and parameters: {'kernel_type': 'Matern', 'length_scale': 8.247457271131996, 'noise_level': 0.9250899197444352, 'constant_value': 6361.952547084405, 'nu': 1.5}. Best is trial 959 with value: 0.1375110730946576.
[I 2024-12-04 21:12:42,070] Trial 2043 finished with value: 0.14249506185402974 and parameters: {'kernel_type': 'Matern', 'length_scale': 3.912637228894647, 'noise_level': 0.10492926761674125, 'constant_value': 63.42329986875294, 'nu': 1.5}. Best is trial 959 with value: 0.1375110730946576.
[I 2024-12-04 21:12:43,150] Trial 2044 finished with value: 0.14249513853596094 and parameters: {'kernel_type': 'Matern', 'length_scale': 0.6113581426337773, 'noise_level': 0.07162536217844195, 'constant_value': 2482.704587569011, 'nu': 1.5}. Best is trial 959 with value: 0.1375110730946576.
[I 2024-12-04 21:12:45,146] Trial 2046 finished with value: 0.9982167336089616 and parameters: {'kernel_type': 'RBF', 'length_scale': 0.00011021810869617186, 'noise_level': 0.48098490413159356, 'constant_value': 1.7309408929631048e-06, 'nu': 1.5}. Best is trial 959 with value: 0.1375110730946576.
[I 2024-12-04 21:12:46,193] Trial 2045 finished with value: 0.14249505500566526 and parameters: {'kernel_type': 'Matern', 'length_scale': 0.2909284864862708, 'noise_level': 0.05215377470830376, 'constant_value': 874.4999135285252, 'nu': 1.5}. Best is trial 959 with value: 0.1375110730946576.
[I 2024-12-04 21:12:49,460] Trial 2047 finished with value: 0.14249506315178523 and parameters: {'kernel_type': 'Matern', 'length_scale': 292.0929139461689, 'noise_level': 0.04476906031989983, 'constant_value': 58.27079055466917, 'nu': 1.5}. Best is trial 959 with value: 0.1375110730946576.
[I 2024-12-04 21:12:52,834] Trial 2048 finished with value: 0.1424950049242727 and parameters: {'kernel_type': 'Matern', 'length_scale': 9.531563367343505, 'noise_level': 0.969278887241725, 'constant_value': 0.27924639459260975, 'nu': 1.5}. Best is trial 959 with value: 0.1375110730946576.
[I 2024-12-04 21:12:53,287] Trial 2049 finished with value: 0.14249506880375626 and parameters: {'kernel_type': 'Matern', 'length_scale': 1.227325506960984, 'noise_level': 0.890852912695916, 'constant_value': 152.15518358511926, 'nu': 1.5}. Best is trial 959 with value: 0.1375110730946576.
