[I 2024-12-04 12:00:35,118] Trial 1457 finished with value: 0.6671320020529113 and parameters: {'max_depth': 30, 'min_samples_split': 6, 'min_samples_leaf': 1, 'max_features': 'sqrt', 'criterion': 'squared_error', 'splitter': 'best'}. Best is trial 838 with value: 0.5900375110830633.
[I 2024-12-04 12:00:36,381] Trial 1469 finished with value: 1.0717670523024738 and parameters: {'max_depth': 34, 'min_samples_split': 6, 'min_samples_leaf': 2, 'max_features': 'log2', 'criterion': 'squared_error', 'splitter': 'random'}. Best is trial 838 with value: 0.5900375110830633.
[I 2024-12-04 12:00:36,636] Trial 1468 finished with value: 1.0888006489966686 and parameters: {'max_depth': 19, 'min_samples_split': 14, 'min_samples_leaf': 3, 'max_features': 'log2', 'criterion': 'squared_error', 'splitter': 'random'}. Best is trial 838 with value: 0.5900375110830633.
[I 2024-12-04 12:00:36,789] Trial 1478 finished with value: 0.8300015320785108 and parameters: {'max_depth': 30, 'min_samples_split': 5, 'min_samples_leaf': 2, 'max_features': 'sqrt', 'criterion': 'squared_error', 'splitter': 'best'}. Best is trial 838 with value: 0.5900375110830633.
[I 2024-12-04 12:00:36,790] Trial 1472 finished with value: 0.8101385948198155 and parameters: {'max_depth': 34, 'min_samples_split': 2, 'min_samples_leaf': 3, 'max_features': 'sqrt', 'criterion': 'friedman_mse', 'splitter': 'best'}. Best is trial 838 with value: 0.5900375110830633.
[I 2024-12-04 12:00:36,970] Trial 1463 finished with value: 0.8101385948198155 and parameters: {'max_depth': 29, 'min_samples_split': 4, 'min_samples_leaf': 3, 'max_features': 'sqrt', 'criterion': 'squared_error', 'splitter': 'best'}. Best is trial 838 with value: 0.5900375110830633.
[I 2024-12-04 12:00:37,150] Trial 1476 finished with value: 0.7030091902207406 and parameters: {'max_depth': 35, 'min_samples_split': 7, 'min_samples_leaf': 1, 'max_features': 'sqrt', 'criterion': 'squared_error', 'splitter': 'best'}. Best is trial 838 with value: 0.5900375110830633.
[I 2024-12-04 12:00:37,151] Trial 1465 finished with value: 0.676636829282285 and parameters: {'max_depth': 35, 'min_samples_split': 6, 'min_samples_leaf': 1, 'max_features': 'sqrt', 'criterion': 'squared_error', 'splitter': 'best'}. Best is trial 838 with value: 0.5900375110830633.
[I 2024-12-04 12:00:37,288] Trial 1466 finished with value: 0.8241861685151659 and parameters: {'max_depth': 35, 'min_samples_split': 2, 'min_samples_leaf': 2, 'max_features': 'sqrt', 'criterion': 'squared_error', 'splitter': 'best'}. Best is trial 838 with value: 0.5900375110830633.
[I 2024-12-04 12:00:37,951] Trial 1470 finished with value: 0.7044023234155515 and parameters: {'max_depth': 35, 'min_samples_split': 2, 'min_samples_leaf': 1, 'max_features': 'sqrt', 'criterion': 'squared_error', 'splitter': 'best'}. Best is trial 838 with value: 0.5900375110830633.
[I 2024-12-04 12:00:38,532] Trial 1459 finished with value: 0.7044023234155515 and parameters: {'max_depth': 35, 'min_samples_split': 2, 'min_samples_leaf': 1, 'max_features': 'sqrt', 'criterion': 'squared_error', 'splitter': 'best'}. Best is trial 838 with value: 0.5900375110830633.
[I 2024-12-04 12:00:38,605] Trial 1473 finished with value: 0.7242053946898249 and parameters: {'max_depth': 30, 'min_samples_split': 7, 'min_samples_leaf': 1, 'max_features': 'sqrt', 'criterion': 'squared_error', 'splitter': 'best'}. Best is trial 838 with value: 0.5900375110830633.
[I 2024-12-04 12:00:38,969] Trial 1471 finished with value: 0.7201117731780649 and parameters: {'max_depth': 34, 'min_samples_split': 5, 'min_samples_leaf': 1, 'max_features': 'log2', 'criterion': 'squared_error', 'splitter': 'best'}. Best is trial 838 with value: 0.5900375110830633.
[I 2024-12-04 12:00:39,343] Trial 1481 finished with value: 0.6548912683909761 and parameters: {'max_depth': 29, 'min_samples_split': 5, 'min_samples_leaf': 1, 'max_features': 'sqrt', 'criterion': 'squared_error', 'splitter': 'best'}. Best is trial 838 with value: 0.5900375110830633.
[I 2024-12-04 12:00:39,638] Trial 1482 finished with value: 0.6548912683909761 and parameters: {'max_depth': 29, 'min_samples_split': 5, 'min_samples_leaf': 1, 'max_features': 'sqrt', 'criterion': 'squared_error', 'splitter': 'best'}. Best is trial 838 with value: 0.5900375110830633.
[I 2024-12-04 12:00:40,240] Trial 1479 finished with value: 0.8045518492044365 and parameters: {'max_depth': 27, 'min_samples_split': 4, 'min_samples_leaf': 3, 'max_features': 'sqrt', 'criterion': 'absolute_error', 'splitter': 'best'}. Best is trial 838 with value: 0.5900375110830633.
[I 2024-12-04 12:00:41,562] Trial 1477 finished with value: 0.8101385948198155 and parameters: {'max_depth': 35, 'min_samples_split': 6, 'min_samples_leaf': 3, 'max_features': 'sqrt', 'criterion': 'squared_error', 'splitter': 'best'}. Best is trial 838 with value: 0.5900375110830633.
[I 2024-12-04 12:00:41,570] Trial 1475 finished with value: 0.59023342761678 and parameters: {'max_depth': 35, 'min_samples_split': 4, 'min_samples_leaf': 1, 'max_features': 'sqrt', 'criterion': 'squared_error', 'splitter': 'best'}. Best is trial 838 with value: 0.5900375110830633.
[I 2024-12-04 12:00:42,066] Trial 1485 finished with value: 0.7987748637010382 and parameters: {'max_depth': 30, 'min_samples_split': 7, 'min_samples_leaf': 3, 'max_features': 'sqrt', 'criterion': 'squared_error', 'splitter': 'best'}. Best is trial 838 with value: 0.5900375110830633.
[I 2024-12-04 12:00:42,163] Trial 1480 finished with value: 0.7044023234155515 and parameters: {'max_depth': 35, 'min_samples_split': 2, 'min_samples_leaf': 1, 'max_features': 'sqrt', 'criterion': 'squared_error', 'splitter': 'best'}. Best is trial 838 with value: 0.5900375110830633.
[I 2024-12-04 12:00:42,577] Trial 1486 finished with value: 0.7030091902207406 and parameters: {'max_depth': 35, 'min_samples_split': 7, 'min_samples_leaf': 1, 'max_features': 'sqrt', 'criterion': 'squared_error', 'splitter': 'best'}. Best is trial 838 with value: 0.5900375110830633.
[I 2024-12-04 12:00:43,310] Trial 1489 finished with value: 0.59023342761678 and parameters: {'max_depth': 35, 'min_samples_split': 4, 'min_samples_leaf': 1, 'max_features': 'sqrt', 'criterion': 'squared_error', 'splitter': 'best'}. Best is trial 838 with value: 0.5900375110830633.
[I 2024-12-04 12:00:43,601] Trial 1474 finished with value: 0.8056989539390975 and parameters: {'max_depth': 35, 'min_samples_split': 8, 'min_samples_leaf': 3, 'max_features': 'sqrt', 'criterion': 'squared_error', 'splitter': 'best'}. Best is trial 838 with value: 0.5900375110830633.
[I 2024-12-04 12:00:45,024] Trial 1494 finished with value: 0.8300015320785108 and parameters: {'max_depth': 35, 'min_samples_split': 5, 'min_samples_leaf': 2, 'max_features': 'sqrt', 'criterion': 'friedman_mse', 'splitter': 'best'}. Best is trial 838 with value: 0.5900375110830633.
[I 2024-12-04 12:00:45,349] Trial 1484 finished with value: 0.6221866837832734 and parameters: {'max_depth': 31, 'min_samples_split': 5, 'min_samples_leaf': 1, 'max_features': 'sqrt', 'criterion': 'squared_error', 'splitter': 'best'}. Best is trial 838 with value: 0.5900375110830633.
[I 2024-12-04 12:00:45,350] Trial 1500 finished with value: 0.7044023234155515 and parameters: {'max_depth': 35, 'min_samples_split': 2, 'min_samples_leaf': 1, 'max_features': 'sqrt', 'criterion': 'squared_error', 'splitter': 'best'}. Best is trial 838 with value: 0.5900375110830633.
[I 2024-12-04 12:00:45,668] Trial 1483 finished with value: 1.091656728529238 and parameters: {'max_depth': 11, 'min_samples_split': 16, 'min_samples_leaf': 9, 'max_features': 'log2', 'criterion': 'friedman_mse', 'splitter': 'best'}. Best is trial 838 with value: 0.5900375110830633.
[I 2024-12-04 12:00:45,885] Trial 1492 finished with value: 0.7044023234155515 and parameters: {'max_depth': 35, 'min_samples_split': 2, 'min_samples_leaf': 1, 'max_features': 'sqrt', 'criterion': 'squared_error', 'splitter': 'best'}. Best is trial 838 with value: 0.5900375110830633.
[I 2024-12-04 12:00:45,903] Trial 1502 finished with value: 0.6777561409658496 and parameters: {'max_depth': 30, 'min_samples_split': 5, 'min_samples_leaf': 1, 'max_features': 'sqrt', 'criterion': 'squared_error', 'splitter': 'best'}. Best is trial 838 with value: 0.5900375110830633.
[I 2024-12-04 12:00:46,193] Trial 1495 finished with value: 1.0790698705765598 and parameters: {'max_depth': 5, 'min_samples_split': 19, 'min_samples_leaf': 4, 'max_features': 'sqrt', 'criterion': 'absolute_error', 'splitter': 'random'}. Best is trial 838 with value: 0.5900375110830633.
[I 2024-12-04 12:00:46,628] Trial 1491 finished with value: 0.8241861685151659 and parameters: {'max_depth': 29, 'min_samples_split': 4, 'min_samples_leaf': 2, 'max_features': 'sqrt', 'criterion': 'squared_error', 'splitter': 'best'}. Best is trial 838 with value: 0.5900375110830633.
[I 2024-12-04 12:00:46,919] Trial 1496 finished with value: 0.8101385948198155 and parameters: {'max_depth': 35, 'min_samples_split': 4, 'min_samples_leaf': 3, 'max_features': 'sqrt', 'criterion': 'squared_error', 'splitter': 'best'}. Best is trial 838 with value: 0.5900375110830633.
[I 2024-12-04 12:00:47,394] Trial 1488 finished with value: 0.8378489055613652 and parameters: {'max_depth': 28, 'min_samples_split': 2, 'min_samples_leaf': 6, 'max_features': 'sqrt', 'criterion': 'squared_error', 'splitter': 'best'}. Best is trial 838 with value: 0.5900375110830633.
[I 2024-12-04 12:00:47,992] Trial 1497 finished with value: 0.6481536807148809 and parameters: {'max_depth': 29, 'min_samples_split': 4, 'min_samples_leaf': 1, 'max_features': 'sqrt', 'criterion': 'squared_error', 'splitter': 'best'}. Best is trial 838 with value: 0.5900375110830633.
[I 2024-12-04 12:00:48,260] Trial 1493 finished with value: 0.6595568366176189 and parameters: {'max_depth': 35, 'min_samples_split': 8, 'min_samples_leaf': 1, 'max_features': 'sqrt', 'criterion': 'squared_error', 'splitter': 'best'}. Best is trial 838 with value: 0.5900375110830633.
[I 2024-12-04 12:00:48,403] Trial 1507 finished with value: 0.815738446043782 and parameters: {'max_depth': 35, 'min_samples_split': 5, 'min_samples_leaf': 2, 'max_features': 'sqrt', 'criterion': 'absolute_error', 'splitter': 'best'}. Best is trial 838 with value: 0.5900375110830633.
[I 2024-12-04 12:00:48,654] Trial 1490 finished with value: 0.676636829282285 and parameters: {'max_depth': 35, 'min_samples_split': 6, 'min_samples_leaf': 1, 'max_features': 'sqrt', 'criterion': 'squared_error', 'splitter': 'best'}. Best is trial 838 with value: 0.5900375110830633.
[I 2024-12-04 12:00:48,989] Trial 1504 finished with value: 0.7291342883560936 and parameters: {'max_depth': 35, 'min_samples_split': 5, 'min_samples_leaf': 1, 'max_features': 'sqrt', 'criterion': 'squared_error', 'splitter': 'best'}. Best is trial 838 with value: 0.5900375110830633.
[I 2024-12-04 12:00:49,523] Trial 1505 finished with value: 0.8300015320785108 and parameters: {'max_depth': 35, 'min_samples_split': 5, 'min_samples_leaf': 2, 'max_features': 'sqrt', 'criterion': 'squared_error', 'splitter': 'best'}. Best is trial 838 with value: 0.5900375110830633.
[I 2024-12-04 12:00:49,900] Trial 1498 finished with value: 0.8391355810268111 and parameters: {'max_depth': 29, 'min_samples_split': 8, 'min_samples_leaf': 2, 'max_features': 'sqrt', 'criterion': 'squared_error', 'splitter': 'best'}. Best is trial 838 with value: 0.5900375110830633.
[I 2024-12-04 12:00:49,901] Trial 1499 finished with value: 0.8101385948198155 and parameters: {'max_depth': 35, 'min_samples_split': 2, 'min_samples_leaf': 3, 'max_features': 'sqrt', 'criterion': 'squared_error', 'splitter': 'best'}. Best is trial 838 with value: 0.5900375110830633.
[I 2024-12-04 12:00:50,118] Trial 1509 finished with value: 0.653185483159977 and parameters: {'max_depth': 28, 'min_samples_split': 4, 'min_samples_leaf': 1, 'max_features': 'sqrt', 'criterion': 'squared_error', 'splitter': 'best'}. Best is trial 838 with value: 0.5900375110830633.
[I 2024-12-04 12:00:50,799] Trial 1508 finished with value: 0.8300015320785108 and parameters: {'max_depth': 35, 'min_samples_split': 5, 'min_samples_leaf': 2, 'max_features': 'sqrt', 'criterion': 'squared_error', 'splitter': 'best'}. Best is trial 838 with value: 0.5900375110830633.
[I 2024-12-04 12:00:50,940] Trial 1503 finished with value: 0.7291342883560936 and parameters: {'max_depth': 35, 'min_samples_split': 5, 'min_samples_leaf': 1, 'max_features': 'sqrt', 'criterion': 'squared_error', 'splitter': 'best'}. Best is trial 838 with value: 0.5900375110830633.
[I 2024-12-04 12:00:51,188] Trial 1501 finished with value: 0.8101385948198155 and parameters: {'max_depth': 30, 'min_samples_split': 5, 'min_samples_leaf': 3, 'max_features': 'sqrt', 'criterion': 'squared_error', 'splitter': 'best'}. Best is trial 838 with value: 0.5900375110830633.
[I 2024-12-04 12:00:52,138] Trial 1487 finished with value: 0.6288333537578643 and parameters: {'max_depth': 34, 'min_samples_split': 4, 'min_samples_leaf': 1, 'max_features': 'sqrt', 'criterion': 'friedman_mse', 'splitter': 'best'}. Best is trial 838 with value: 0.5900375110830633.
[I 2024-12-04 12:00:52,778] Trial 1506 finished with value: 0.6595568366176189 and parameters: {'max_depth': 35, 'min_samples_split': 8, 'min_samples_leaf': 1, 'max_features': 'sqrt', 'criterion': 'squared_error', 'splitter': 'best'}. Best is trial 838 with value: 0.5900375110830633.
[I 2024-12-04 12:00:54,356] Trial 1512 finished with value: 0.713722108439527 and parameters: {'max_depth': 35, 'min_samples_split': 3, 'min_samples_leaf': 1, 'max_features': 'sqrt', 'criterion': 'friedman_mse', 'splitter': 'best'}. Best is trial 838 with value: 0.5900375110830633.
[I 2024-12-04 12:00:55,147] Trial 1510 finished with value: 1.091656728529238 and parameters: {'max_depth': 34, 'min_samples_split': 20, 'min_samples_leaf': 9, 'max_features': 'log2', 'criterion': 'friedman_mse', 'splitter': 'best'}. Best is trial 838 with value: 0.5900375110830633.
[I 2024-12-04 12:00:56,147] Trial 1513 finished with value: 0.6416220728212735 and parameters: {'max_depth': 29, 'min_samples_split': 2, 'min_samples_leaf': 1, 'max_features': 'sqrt', 'criterion': 'squared_error', 'splitter': 'best'}. Best is trial 838 with value: 0.5900375110830633.
[I 2024-12-04 12:00:56,215] Trial 1511 finished with value: 0.59023342761678 and parameters: {'max_depth': 35, 'min_samples_split': 4, 'min_samples_leaf': 1, 'max_features': 'sqrt', 'criterion': 'squared_error', 'splitter': 'best'}. Best is trial 838 with value: 0.5900375110830633.
[I 2024-12-04 12:00:56,403] Trial 1514 finished with value: 0.7044023234155515 and parameters: {'max_depth': 35, 'min_samples_split': 2, 'min_samples_leaf': 1, 'max_features': 'sqrt', 'criterion': 'squared_error', 'splitter': 'best'}. Best is trial 838 with value: 0.5900375110830633.
[I 2024-12-04 12:00:56,647] Trial 1520 finished with value: 0.8101385948198155 and parameters: {'max_depth': 35, 'min_samples_split': 2, 'min_samples_leaf': 3, 'max_features': 'sqrt', 'criterion': 'squared_error', 'splitter': 'best'}. Best is trial 838 with value: 0.5900375110830633.
[I 2024-12-04 12:00:57,462] Trial 1529 finished with value: 0.7489750825976164 and parameters: {'max_depth': 35, 'min_samples_split': 8, 'min_samples_leaf': 2, 'max_features': 'sqrt', 'criterion': 'squared_error', 'splitter': 'random'}. Best is trial 838 with value: 0.5900375110830633.
[I 2024-12-04 12:00:57,800] Trial 1517 finished with value: 0.59023342761678 and parameters: {'max_depth': 35, 'min_samples_split': 4, 'min_samples_leaf': 1, 'max_features': 'sqrt', 'criterion': 'squared_error', 'splitter': 'best'}. Best is trial 838 with value: 0.5900375110830633.
[I 2024-12-04 12:00:58,072] Trial 1527 finished with value: 0.7987748637010382 and parameters: {'max_depth': 35, 'min_samples_split': 7, 'min_samples_leaf': 3, 'max_features': 'sqrt', 'criterion': 'squared_error', 'splitter': 'best'}. Best is trial 838 with value: 0.5900375110830633.
[I 2024-12-04 12:00:58,335] Trial 1519 finished with value: 0.8101385948198155 and parameters: {'max_depth': 29, 'min_samples_split': 5, 'min_samples_leaf': 3, 'max_features': 'sqrt', 'criterion': 'squared_error', 'splitter': 'best'}. Best is trial 838 with value: 0.5900375110830633.
[I 2024-12-04 12:00:58,370] Trial 1516 finished with value: 0.676636829282285 and parameters: {'max_depth': 35, 'min_samples_split': 6, 'min_samples_leaf': 1, 'max_features': 'sqrt', 'criterion': 'squared_error', 'splitter': 'best'}. Best is trial 838 with value: 0.5900375110830633.
[I 2024-12-04 12:00:58,378] Trial 1515 finished with value: 0.7859194750445839 and parameters: {'max_depth': 27, 'min_samples_split': 6, 'min_samples_leaf': 1, 'max_features': 'sqrt', 'criterion': 'absolute_error', 'splitter': 'best'}. Best is trial 838 with value: 0.5900375110830633.
[I 2024-12-04 12:00:58,397] Trial 1522 finished with value: 0.6481536807148809 and parameters: {'max_depth': 29, 'min_samples_split': 4, 'min_samples_leaf': 1, 'max_features': 'sqrt', 'criterion': 'squared_error', 'splitter': 'best'}. Best is trial 838 with value: 0.5900375110830633.
[I 2024-12-04 12:00:59,095] Trial 1518 finished with value: 0.8101385948198155 and parameters: {'max_depth': 35, 'min_samples_split': 5, 'min_samples_leaf': 3, 'max_features': 'sqrt', 'criterion': 'squared_error', 'splitter': 'best'}. Best is trial 838 with value: 0.5900375110830633.
[I 2024-12-04 12:00:59,329] Trial 1525 finished with value: 1.0583554946581581 and parameters: {'max_depth': 16, 'min_samples_split': 11, 'min_samples_leaf': 1, 'max_features': 'log2', 'criterion': 'friedman_mse', 'splitter': 'random'}. Best is trial 838 with value: 0.5900375110830633.
[I 2024-12-04 12:00:59,592] Trial 1526 finished with value: 1.0745658542945478 and parameters: {'max_depth': 19, 'min_samples_split': 15, 'min_samples_leaf': 6, 'max_features': 'log2', 'criterion': 'absolute_error', 'splitter': 'random'}. Best is trial 838 with value: 0.5900375110830633.
[I 2024-12-04 12:01:00,126] Trial 1524 finished with value: 0.59023342761678 and parameters: {'max_depth': 35, 'min_samples_split': 4, 'min_samples_leaf': 1, 'max_features': 'sqrt', 'criterion': 'squared_error', 'splitter': 'best'}. Best is trial 838 with value: 0.5900375110830633.
[I 2024-12-04 12:01:00,354] Trial 1528 finished with value: 0.6416220728212735 and parameters: {'max_depth': 29, 'min_samples_split': 2, 'min_samples_leaf': 1, 'max_features': 'sqrt', 'criterion': 'squared_error', 'splitter': 'best'}. Best is trial 838 with value: 0.5900375110830633.
[I 2024-12-04 12:01:00,451] Trial 1532 finished with value: 0.7291342883560936 and parameters: {'max_depth': 35, 'min_samples_split': 5, 'min_samples_leaf': 1, 'max_features': 'sqrt', 'criterion': 'squared_error', 'splitter': 'best'}. Best is trial 838 with value: 0.5900375110830633.
[I 2024-12-04 12:01:00,590] Trial 1523 finished with value: 0.6777561409658496 and parameters: {'max_depth': 30, 'min_samples_split': 5, 'min_samples_leaf': 1, 'max_features': 'sqrt', 'criterion': 'squared_error', 'splitter': 'best'}. Best is trial 838 with value: 0.5900375110830633.
[I 2024-12-04 12:01:01,008] Trial 1530 finished with value: 0.7291342883560936 and parameters: {'max_depth': 35, 'min_samples_split': 5, 'min_samples_leaf': 1, 'max_features': 'sqrt', 'criterion': 'squared_error', 'splitter': 'best'}. Best is trial 838 with value: 0.5900375110830633.
[I 2024-12-04 12:01:01,465] Trial 1539 finished with value: 0.6777561409658496 and parameters: {'max_depth': 30, 'min_samples_split': 5, 'min_samples_leaf': 1, 'max_features': 'sqrt', 'criterion': 'squared_error', 'splitter': 'best'}. Best is trial 838 with value: 0.5900375110830633.
[I 2024-12-04 12:01:01,564] Trial 1531 finished with value: 1.0888006489966686 and parameters: {'max_depth': 18, 'min_samples_split': 2, 'min_samples_leaf': 3, 'max_features': 'log2', 'criterion': 'squared_error', 'splitter': 'random'}. Best is trial 838 with value: 0.5900375110830633.
[I 2024-12-04 12:01:01,833] Trial 1521 finished with value: 0.6548912683909761 and parameters: {'max_depth': 29, 'min_samples_split': 5, 'min_samples_leaf': 1, 'max_features': 'sqrt', 'criterion': 'squared_error', 'splitter': 'best'}. Best is trial 838 with value: 0.5900375110830633.
[I 2024-12-04 12:01:02,274] Trial 1537 finished with value: 0.8241861685151659 and parameters: {'max_depth': 35, 'min_samples_split': 4, 'min_samples_leaf': 2, 'max_features': 'sqrt', 'criterion': 'squared_error', 'splitter': 'best'}. Best is trial 838 with value: 0.5900375110830633.
[I 2024-12-04 12:01:03,012] Trial 1533 finished with value: 0.7291342883560936 and parameters: {'max_depth': 35, 'min_samples_split': 5, 'min_samples_leaf': 1, 'max_features': 'sqrt', 'criterion': 'squared_error', 'splitter': 'best'}. Best is trial 838 with value: 0.5900375110830633.
[I 2024-12-04 12:01:03,385] Trial 1538 finished with value: 1.0816149376799358 and parameters: {'max_depth': 22, 'min_samples_split': 12, 'min_samples_leaf': 10, 'max_features': 'sqrt', 'criterion': 'friedman_mse', 'splitter': 'random'}. Best is trial 838 with value: 0.5900375110830633.
[I 2024-12-04 12:01:03,975] Trial 1541 finished with value: 0.7044023234155515 and parameters: {'max_depth': 35, 'min_samples_split': 2, 'min_samples_leaf': 1, 'max_features': 'sqrt', 'criterion': 'squared_error', 'splitter': 'best'}. Best is trial 838 with value: 0.5900375110830633.
[I 2024-12-04 12:01:06,268] Trial 1535 finished with value: 0.6599142051111299 and parameters: {'max_depth': 28, 'min_samples_split': 2, 'min_samples_leaf': 1, 'max_features': 'sqrt', 'criterion': 'friedman_mse', 'splitter': 'best'}. Best is trial 838 with value: 0.5900375110830633.
[I 2024-12-04 12:01:06,890] Trial 1540 finished with value: 0.7044023234155515 and parameters: {'max_depth': 35, 'min_samples_split': 2, 'min_samples_leaf': 1, 'max_features': 'sqrt', 'criterion': 'squared_error', 'splitter': 'best'}. Best is trial 838 with value: 0.5900375110830633.
