[I 2024-12-04 13:42:44,158] Trial 2255 finished with value: 0.2611992333093236 and parameters: {'n_estimators': 1326, 'learning_rate': 0.07860016383253259, 'max_depth': 12, 'min_samples_split': 17, 'min_samples_leaf': 3, 'subsample': 0.6651207057400013, 'max_features': 'sqrt'}. Best is trial 1137 with value: 0.19687116000636118.
[I 2024-12-04 13:42:44,166] Trial 2250 finished with value: 0.2234729737189101 and parameters: {'n_estimators': 1482, 'learning_rate': 0.07415233477833669, 'max_depth': 12, 'min_samples_split': 17, 'min_samples_leaf': 1, 'subsample': 0.7563562779359952, 'max_features': 'sqrt'}. Best is trial 1137 with value: 0.19687116000636118.
[I 2024-12-04 13:42:46,813] Trial 2258 finished with value: 0.23270118635483675 and parameters: {'n_estimators': 1277, 'learning_rate': 0.06985038689854639, 'max_depth': 10, 'min_samples_split': 17, 'min_samples_leaf': 1, 'subsample': 0.7614488562136867, 'max_features': 'sqrt'}. Best is trial 1137 with value: 0.19687116000636118.
[I 2024-12-04 13:42:46,819] Trial 2260 finished with value: 0.22806962160135863 and parameters: {'n_estimators': 1156, 'learning_rate': 0.057718043106708354, 'max_depth': 12, 'min_samples_split': 16, 'min_samples_leaf': 1, 'subsample': 0.7670961163846609, 'max_features': 'sqrt'}. Best is trial 1137 with value: 0.19687116000636118.
[I 2024-12-04 13:42:54,187] Trial 2284 finished with value: 0.3742157195515969 and parameters: {'n_estimators': 251, 'learning_rate': 0.05033533034527361, 'max_depth': 3, 'min_samples_split': 13, 'min_samples_leaf': 3, 'subsample': 0.9058296058475372, 'max_features': None}. Best is trial 1137 with value: 0.19687116000636118.
[I 2024-12-04 13:42:55,841] Trial 2256 finished with value: 0.20967562063606365 and parameters: {'n_estimators': 1475, 'learning_rate': 0.06555611638234565, 'max_depth': 12, 'min_samples_split': 16, 'min_samples_leaf': 1, 'subsample': 0.6079262278398719, 'max_features': 'sqrt'}. Best is trial 1137 with value: 0.19687116000636118.
[I 2024-12-04 13:42:55,946] Trial 2261 finished with value: 0.2554540694514148 and parameters: {'n_estimators': 1291, 'learning_rate': 0.09963907864050787, 'max_depth': 11, 'min_samples_split': 17, 'min_samples_leaf': 3, 'subsample': 0.6734395616194881, 'max_features': 'sqrt'}. Best is trial 1137 with value: 0.19687116000636118.
[I 2024-12-04 13:42:59,393] Trial 2257 finished with value: 0.22169477067329116 and parameters: {'n_estimators': 1497, 'learning_rate': 0.09167913860847046, 'max_depth': 12, 'min_samples_split': 17, 'min_samples_leaf': 1, 'subsample': 0.6814890287854027, 'max_features': 'sqrt'}. Best is trial 1137 with value: 0.19687116000636118.
[I 2024-12-04 13:43:01,513] Trial 2269 finished with value: 0.22867635022846866 and parameters: {'n_estimators': 1053, 'learning_rate': 0.05877885492098392, 'max_depth': 12, 'min_samples_split': 16, 'min_samples_leaf': 1, 'subsample': 0.6758727049514903, 'max_features': 'sqrt'}. Best is trial 1137 with value: 0.19687116000636118.
[I 2024-12-04 13:43:04,546] Trial 2267 finished with value: 0.32989567056626395 and parameters: {'n_estimators': 1171, 'learning_rate': 0.06572339392952276, 'max_depth': 3, 'min_samples_split': 16, 'min_samples_leaf': 5, 'subsample': 0.6808037889147331, 'max_features': 'sqrt'}. Best is trial 1137 with value: 0.19687116000636118.
[I 2024-12-04 13:43:06,617] Trial 2259 finished with value: 0.23125292123085459 and parameters: {'n_estimators': 1493, 'learning_rate': 0.06682518579729724, 'max_depth': 10, 'min_samples_split': 17, 'min_samples_leaf': 1, 'subsample': 0.6645067565400538, 'max_features': 'sqrt'}. Best is trial 1137 with value: 0.19687116000636118.
[I 2024-12-04 13:43:11,204] Trial 2264 finished with value: 0.23417693325201935 and parameters: {'n_estimators': 1424, 'learning_rate': 0.09386106945155519, 'max_depth': 12, 'min_samples_split': 16, 'min_samples_leaf': 2, 'subsample': 0.6659912400546522, 'max_features': 'sqrt'}. Best is trial 1137 with value: 0.19687116000636118.
[I 2024-12-04 13:43:11,215] Trial 2290 finished with value: 0.5339390465400562 and parameters: {'n_estimators': 289, 'learning_rate': 0.015429530847360118, 'max_depth': 11, 'min_samples_split': 2, 'min_samples_leaf': 8, 'subsample': 0.9067586575655073, 'max_features': 'sqrt'}. Best is trial 1137 with value: 0.19687116000636118.
[I 2024-12-04 13:43:13,799] Trial 2270 finished with value: 0.211971046661481 and parameters: {'n_estimators': 1284, 'learning_rate': 0.09671428082288076, 'max_depth': 11, 'min_samples_split': 17, 'min_samples_leaf': 1, 'subsample': 0.6793815150806239, 'max_features': 'sqrt'}. Best is trial 1137 with value: 0.19687116000636118.
[I 2024-12-04 13:43:17,877] Trial 2265 finished with value: 0.21967447256428196 and parameters: {'n_estimators': 1371, 'learning_rate': 0.09814371375582782, 'max_depth': 12, 'min_samples_split': 17, 'min_samples_leaf': 1, 'subsample': 0.6877846817141601, 'max_features': 'sqrt'}. Best is trial 1137 with value: 0.19687116000636118.
[I 2024-12-04 13:43:19,354] Trial 2266 finished with value: 0.21049991396376294 and parameters: {'n_estimators': 1495, 'learning_rate': 0.09500603118283872, 'max_depth': 11, 'min_samples_split': 17, 'min_samples_leaf': 1, 'subsample': 0.7121884473901214, 'max_features': 'sqrt'}. Best is trial 1137 with value: 0.19687116000636118.
[I 2024-12-04 13:43:23,827] Trial 2298 finished with value: 0.32564615417478665 and parameters: {'n_estimators': 213, 'learning_rate': 0.021667535762254636, 'max_depth': 11, 'min_samples_split': 6, 'min_samples_leaf': 3, 'subsample': 0.816874028897631, 'max_features': None}. Best is trial 1137 with value: 0.19687116000636118.
[I 2024-12-04 13:43:23,831] Trial 2268 finished with value: 0.24062924827914683 and parameters: {'n_estimators': 1479, 'learning_rate': 0.09973049141068253, 'max_depth': 12, 'min_samples_split': 14, 'min_samples_leaf': 2, 'subsample': 0.6734242061166605, 'max_features': 'sqrt'}. Best is trial 1137 with value: 0.19687116000636118.
[I 2024-12-04 13:43:25,425] Trial 2275 finished with value: 0.25615958842878284 and parameters: {'n_estimators': 1277, 'learning_rate': 0.057176641396668344, 'max_depth': 8, 'min_samples_split': 17, 'min_samples_leaf': 2, 'subsample': 0.6660155160772373, 'max_features': 'sqrt'}. Best is trial 1137 with value: 0.19687116000636118.
[I 2024-12-04 13:43:30,359] Trial 2271 finished with value: 0.2524258250851741 and parameters: {'n_estimators': 1286, 'learning_rate': 0.09465277141143856, 'max_depth': 12, 'min_samples_split': 18, 'min_samples_leaf': 1, 'subsample': 0.6891440532201488, 'max_features': None}. Best is trial 1137 with value: 0.19687116000636118.
[I 2024-12-04 13:43:32,197] Trial 2272 finished with value: 0.31379170432952486 and parameters: {'n_estimators': 1472, 'learning_rate': 0.024469834102269904, 'max_depth': 4, 'min_samples_split': 3, 'min_samples_leaf': 3, 'subsample': 0.9736171639401805, 'max_features': 'sqrt'}. Best is trial 1137 with value: 0.19687116000636118.
[I 2024-12-04 13:43:33,008] Trial 2280 finished with value: 0.2284145406971141 and parameters: {'n_estimators': 1108, 'learning_rate': 0.09918852105309078, 'max_depth': 12, 'min_samples_split': 20, 'min_samples_leaf': 1, 'subsample': 0.6327783501667115, 'max_features': 'sqrt'}. Best is trial 1137 with value: 0.19687116000636118.
[I 2024-12-04 13:43:36,735] Trial 2276 finished with value: 0.21852241800375208 and parameters: {'n_estimators': 1392, 'learning_rate': 0.09897944252083365, 'max_depth': 12, 'min_samples_split': 20, 'min_samples_leaf': 1, 'subsample': 0.6906431123552929, 'max_features': 'sqrt'}. Best is trial 1137 with value: 0.19687116000636118.
[I 2024-12-04 13:43:38,846] Trial 2283 finished with value: 0.24809275120117966 and parameters: {'n_estimators': 1061, 'learning_rate': 0.06500607415338779, 'max_depth': 12, 'min_samples_split': 18, 'min_samples_leaf': 3, 'subsample': 0.6377781282204559, 'max_features': 'sqrt'}. Best is trial 1137 with value: 0.19687116000636118.
[I 2024-12-04 13:43:40,206] Trial 2281 finished with value: 0.2415528165144882 and parameters: {'n_estimators': 1125, 'learning_rate': 0.09853685044923126, 'max_depth': 12, 'min_samples_split': 16, 'min_samples_leaf': 3, 'subsample': 0.7277575033494701, 'max_features': 'sqrt'}. Best is trial 1137 with value: 0.19687116000636118.
[I 2024-12-04 13:43:40,432] Trial 2286 finished with value: 0.2442729140704266 and parameters: {'n_estimators': 943, 'learning_rate': 0.09968025362948016, 'max_depth': 11, 'min_samples_split': 20, 'min_samples_leaf': 1, 'subsample': 0.6832138545270079, 'max_features': 'sqrt'}. Best is trial 1137 with value: 0.19687116000636118.
[I 2024-12-04 13:43:46,266] Trial 2277 finished with value: 0.24199750454008945 and parameters: {'n_estimators': 1474, 'learning_rate': 0.06578087405585513, 'max_depth': 12, 'min_samples_split': 17, 'min_samples_leaf': 2, 'subsample': 0.60075478611487, 'max_features': 'sqrt'}. Best is trial 1137 with value: 0.19687116000636118.
[I 2024-12-04 13:43:48,377] Trial 2282 finished with value: 0.21530852512795576 and parameters: {'n_estimators': 1232, 'learning_rate': 0.09853054755738554, 'max_depth': 12, 'min_samples_split': 15, 'min_samples_leaf': 1, 'subsample': 0.7008378588583032, 'max_features': 'sqrt'}. Best is trial 1137 with value: 0.19687116000636118.
[I 2024-12-04 13:43:49,710] Trial 2278 finished with value: 0.2851443573586097 and parameters: {'n_estimators': 1500, 'learning_rate': 0.04905599820406312, 'max_depth': 11, 'min_samples_split': 15, 'min_samples_leaf': 3, 'subsample': 0.6559362318515818, 'max_features': 'log2'}. Best is trial 1137 with value: 0.19687116000636118.
[I 2024-12-04 13:43:50,268] Trial 2287 finished with value: 0.22012227136724724 and parameters: {'n_estimators': 1050, 'learning_rate': 0.06798675504973958, 'max_depth': 12, 'min_samples_split': 17, 'min_samples_leaf': 1, 'subsample': 0.7134644106583254, 'max_features': 'sqrt'}. Best is trial 1137 with value: 0.19687116000636118.
[I 2024-12-04 13:43:56,035] Trial 2306 finished with value: 0.5109979568500005 and parameters: {'n_estimators': 378, 'learning_rate': 0.09301994412437055, 'max_depth': 3, 'min_samples_split': 11, 'min_samples_leaf': 8, 'subsample': 0.7815901738930779, 'max_features': 'log2'}. Best is trial 1137 with value: 0.19687116000636118.
[I 2024-12-04 13:43:56,425] Trial 2279 finished with value: 0.23459835825123335 and parameters: {'n_estimators': 1493, 'learning_rate': 0.08526100019577544, 'max_depth': 10, 'min_samples_split': 18, 'min_samples_leaf': 2, 'subsample': 0.702979473027399, 'max_features': 'sqrt'}. Best is trial 1137 with value: 0.19687116000636118.
[I 2024-12-04 13:44:03,190] Trial 2288 finished with value: 0.21036085069877203 and parameters: {'n_estimators': 1242, 'learning_rate': 0.06376272074263133, 'max_depth': 12, 'min_samples_split': 18, 'min_samples_leaf': 1, 'subsample': 0.6411801836615132, 'max_features': 'sqrt'}. Best is trial 1137 with value: 0.19687116000636118.
[I 2024-12-04 13:44:06,700] Trial 2297 finished with value: 0.45234360387547173 and parameters: {'n_estimators': 918, 'learning_rate': 0.010142290033732921, 'max_depth': 11, 'min_samples_split': 7, 'min_samples_leaf': 8, 'subsample': 0.7520109669817483, 'max_features': 'sqrt'}. Best is trial 1137 with value: 0.19687116000636118.
[I 2024-12-04 13:44:12,959] Trial 2289 finished with value: 0.23708517028485068 and parameters: {'n_estimators': 1298, 'learning_rate': 0.09990225181357454, 'max_depth': 11, 'min_samples_split': 20, 'min_samples_leaf': 1, 'subsample': 0.6776903977852867, 'max_features': 'sqrt'}. Best is trial 1137 with value: 0.19687116000636118.
[I 2024-12-04 13:44:13,915] Trial 2285 finished with value: 0.22239060690457907 and parameters: {'n_estimators': 1497, 'learning_rate': 0.09406319139702056, 'max_depth': 11, 'min_samples_split': 17, 'min_samples_leaf': 1, 'subsample': 0.6444951137536457, 'max_features': 'sqrt'}. Best is trial 1137 with value: 0.19687116000636118.
[I 2024-12-04 13:44:15,999] Trial 2296 finished with value: 0.47903475793679223 and parameters: {'n_estimators': 1108, 'learning_rate': 0.04423523192906488, 'max_depth': 3, 'min_samples_split': 17, 'min_samples_leaf': 8, 'subsample': 0.7439827903994132, 'max_features': 'log2'}. Best is trial 1137 with value: 0.19687116000636118.
[I 2024-12-04 13:44:18,021] Trial 2292 finished with value: 0.22813128217899856 and parameters: {'n_estimators': 1254, 'learning_rate': 0.07054516133533587, 'max_depth': 12, 'min_samples_split': 20, 'min_samples_leaf': 2, 'subsample': 0.669360580817038, 'max_features': 'sqrt'}. Best is trial 1137 with value: 0.19687116000636118.
[I 2024-12-04 13:44:24,518] Trial 2303 finished with value: 0.23007277288425862 and parameters: {'n_estimators': 981, 'learning_rate': 0.05977571287250827, 'max_depth': 12, 'min_samples_split': 19, 'min_samples_leaf': 1, 'subsample': 0.6109207740828101, 'max_features': 'sqrt'}. Best is trial 1137 with value: 0.19687116000636118.
[I 2024-12-04 13:44:27,562] Trial 2294 finished with value: 0.2450943979007661 and parameters: {'n_estimators': 1356, 'learning_rate': 0.06668071466501656, 'max_depth': 12, 'min_samples_split': 10, 'min_samples_leaf': 3, 'subsample': 0.6788838177490457, 'max_features': 'sqrt'}. Best is trial 1137 with value: 0.19687116000636118.
[I 2024-12-04 13:44:31,416] Trial 2293 finished with value: 0.2268580724671699 and parameters: {'n_estimators': 1473, 'learning_rate': 0.0963633505279049, 'max_depth': 9, 'min_samples_split': 20, 'min_samples_leaf': 1, 'subsample': 0.7085951042630437, 'max_features': 'sqrt'}. Best is trial 1137 with value: 0.19687116000636118.
[I 2024-12-04 13:44:33,817] Trial 2291 finished with value: 0.30343589441920277 and parameters: {'n_estimators': 1489, 'learning_rate': 0.026814737612775086, 'max_depth': 3, 'min_samples_split': 14, 'min_samples_leaf': 2, 'subsample': 0.6646455673143951, 'max_features': None}. Best is trial 1137 with value: 0.19687116000636118.
[I 2024-12-04 13:44:38,101] Trial 2295 finished with value: 0.2226104327290537 and parameters: {'n_estimators': 1465, 'learning_rate': 0.0578508072945614, 'max_depth': 12, 'min_samples_split': 15, 'min_samples_leaf': 1, 'subsample': 0.6731387740857132, 'max_features': 'sqrt'}. Best is trial 1137 with value: 0.19687116000636118.
[I 2024-12-04 13:44:40,602] Trial 2314 finished with value: 0.435115798815207 and parameters: {'n_estimators': 832, 'learning_rate': 0.07869570611026128, 'max_depth': 5, 'min_samples_split': 18, 'min_samples_leaf': 8, 'subsample': 0.8556864046323944, 'max_features': 'log2'}. Best is trial 1137 with value: 0.19687116000636118.
[I 2024-12-04 13:44:43,168] Trial 2307 finished with value: 0.23578068874668617 and parameters: {'n_estimators': 1098, 'learning_rate': 0.06439362897529859, 'max_depth': 10, 'min_samples_split': 20, 'min_samples_leaf': 1, 'subsample': 0.7492310045290664, 'max_features': 'sqrt'}. Best is trial 1137 with value: 0.19687116000636118.
[I 2024-12-04 13:44:45,274] Trial 2300 finished with value: 0.23441336235700358 and parameters: {'n_estimators': 1417, 'learning_rate': 0.09699951811758675, 'max_depth': 12, 'min_samples_split': 18, 'min_samples_leaf': 2, 'subsample': 0.6530153877414917, 'max_features': 'sqrt'}. Best is trial 1137 with value: 0.19687116000636118.
[I 2024-12-04 13:44:45,281] Trial 2305 finished with value: 0.23812766524632403 and parameters: {'n_estimators': 1252, 'learning_rate': 0.0560029856028157, 'max_depth': 12, 'min_samples_split': 12, 'min_samples_leaf': 2, 'subsample': 0.6016265093458797, 'max_features': 'sqrt'}. Best is trial 1137 with value: 0.19687116000636118.
[I 2024-12-04 13:44:48,066] Trial 2301 finished with value: 0.24420162819196728 and parameters: {'n_estimators': 1384, 'learning_rate': 0.09586504592805363, 'max_depth': 12, 'min_samples_split': 19, 'min_samples_leaf': 3, 'subsample': 0.685301408758309, 'max_features': 'sqrt'}. Best is trial 1137 with value: 0.19687116000636118.
[I 2024-12-04 13:44:48,269] Trial 2304 finished with value: 0.2626157369965557 and parameters: {'n_estimators': 1305, 'learning_rate': 0.0990691515217196, 'max_depth': 11, 'min_samples_split': 16, 'min_samples_leaf': 3, 'subsample': 0.6371058115724018, 'max_features': 'sqrt'}. Best is trial 1137 with value: 0.19687116000636118.
[I 2024-12-04 13:44:48,312] Trial 2299 finished with value: 0.22087713194554556 and parameters: {'n_estimators': 1497, 'learning_rate': 0.08862859670796404, 'max_depth': 12, 'min_samples_split': 16, 'min_samples_leaf': 1, 'subsample': 0.6805132421096585, 'max_features': 'sqrt'}. Best is trial 1137 with value: 0.19687116000636118.
[I 2024-12-04 13:44:48,319] Trial 2308 finished with value: 0.25671283109009807 and parameters: {'n_estimators': 1173, 'learning_rate': 0.06573379697899674, 'max_depth': 7, 'min_samples_split': 20, 'min_samples_leaf': 1, 'subsample': 0.6656994090660266, 'max_features': 'sqrt'}. Best is trial 1137 with value: 0.19687116000636118.
[I 2024-12-04 13:44:51,454] Trial 2302 finished with value: 0.23806415310081244 and parameters: {'n_estimators': 1438, 'learning_rate': 0.06297848891793104, 'max_depth': 12, 'min_samples_split': 11, 'min_samples_leaf': 1, 'subsample': 0.6331518645529177, 'max_features': 'log2'}. Best is trial 1137 with value: 0.19687116000636118.
[I 2024-12-04 13:44:51,464] Trial 2327 finished with value: 0.45137853746516843 and parameters: {'n_estimators': 445, 'learning_rate': 0.01872635920111499, 'max_depth': 11, 'min_samples_split': 16, 'min_samples_leaf': 9, 'subsample': 0.9927999987730545, 'max_features': 'sqrt'}. Best is trial 1137 with value: 0.19687116000636118.
[I 2024-12-04 13:44:56,440] Trial 2315 finished with value: 0.3877760845429714 and parameters: {'n_estimators': 868, 'learning_rate': 0.010849639833127103, 'max_depth': 10, 'min_samples_split': 13, 'min_samples_leaf': 10, 'subsample': 0.9131913807768723, 'max_features': None}. Best is trial 1137 with value: 0.19687116000636118.
[I 2024-12-04 13:44:57,728] Trial 2316 finished with value: 0.23208253682227237 and parameters: {'n_estimators': 993, 'learning_rate': 0.0917176935426429, 'max_depth': 11, 'min_samples_split': 13, 'min_samples_leaf': 1, 'subsample': 0.7375616877091397, 'max_features': 'sqrt'}. Best is trial 1137 with value: 0.19687116000636118.
[I 2024-12-04 13:44:58,486] Trial 2309 finished with value: 0.21911829963193846 and parameters: {'n_estimators': 1256, 'learning_rate': 0.09972278414611392, 'max_depth': 12, 'min_samples_split': 16, 'min_samples_leaf': 1, 'subsample': 0.6056101620364379, 'max_features': 'sqrt'}. Best is trial 1137 with value: 0.19687116000636118.
[I 2024-12-04 13:45:04,024] Trial 2310 finished with value: 0.24640537963264042 and parameters: {'n_estimators': 1303, 'learning_rate': 0.06559673807065317, 'max_depth': 10, 'min_samples_split': 14, 'min_samples_leaf': 2, 'subsample': 0.6934765148906468, 'max_features': 'sqrt'}. Best is trial 1137 with value: 0.19687116000636118.
[I 2024-12-04 13:45:06,779] Trial 2312 finished with value: 0.25335837571497094 and parameters: {'n_estimators': 1349, 'learning_rate': 0.09568029733631948, 'max_depth': 12, 'min_samples_split': 18, 'min_samples_leaf': 2, 'subsample': 0.7248286397758427, 'max_features': 'log2'}. Best is trial 1137 with value: 0.19687116000636118.
[I 2024-12-04 13:45:06,984] Trial 2313 finished with value: 0.2025311882478451 and parameters: {'n_estimators': 1283, 'learning_rate': 0.09653901138589821, 'max_depth': 12, 'min_samples_split': 18, 'min_samples_leaf': 1, 'subsample': 0.6083806597151401, 'max_features': 'sqrt'}. Best is trial 1137 with value: 0.19687116000636118.
[I 2024-12-04 13:45:13,353] Trial 2311 finished with value: 0.22142966979712422 and parameters: {'n_estimators': 1483, 'learning_rate': 0.063737057132176, 'max_depth': 11, 'min_samples_split': 15, 'min_samples_leaf': 1, 'subsample': 0.6004259835729238, 'max_features': 'sqrt'}. Best is trial 1137 with value: 0.19687116000636118.
[I 2024-12-04 13:45:16,887] Trial 2318 finished with value: 0.23253888714747664 and parameters: {'n_estimators': 1294, 'learning_rate': 0.04100668373171384, 'max_depth': 12, 'min_samples_split': 16, 'min_samples_leaf': 1, 'subsample': 0.6672187226637079, 'max_features': 'sqrt'}. Best is trial 1137 with value: 0.19687116000636118.
[I 2024-12-04 13:45:17,225] Trial 2317 finished with value: 0.24325824336685703 and parameters: {'n_estimators': 1269, 'learning_rate': 0.05615358814342799, 'max_depth': 10, 'min_samples_split': 20, 'min_samples_leaf': 1, 'subsample': 0.6571255364484624, 'max_features': 'sqrt'}. Best is trial 1137 with value: 0.19687116000636118.
[I 2024-12-04 13:45:18,913] Trial 2320 finished with value: 0.2512671216903296 and parameters: {'n_estimators': 1265, 'learning_rate': 0.09111121902980099, 'max_depth': 12, 'min_samples_split': 14, 'min_samples_leaf': 3, 'subsample': 0.6820716754405074, 'max_features': 'sqrt'}. Best is trial 1137 with value: 0.19687116000636118.
[I 2024-12-04 13:45:23,624] Trial 2322 finished with value: 0.22087620260878185 and parameters: {'n_estimators': 1270, 'learning_rate': 0.07364593019031596, 'max_depth': 10, 'min_samples_split': 17, 'min_samples_leaf': 1, 'subsample': 0.610809284975706, 'max_features': 'sqrt'}. Best is trial 1137 with value: 0.19687116000636118.
[I 2024-12-04 13:45:26,059] Trial 2323 finished with value: 0.22689468429491896 and parameters: {'n_estimators': 1261, 'learning_rate': 0.08215852280238704, 'max_depth': 12, 'min_samples_split': 18, 'min_samples_leaf': 1, 'subsample': 0.6148029621345444, 'max_features': 'sqrt'}. Best is trial 1137 with value: 0.19687116000636118.
[I 2024-12-04 13:45:27,966] Trial 2329 finished with value: 0.287690041114833 and parameters: {'n_estimators': 823, 'learning_rate': 0.01956259677426148, 'max_depth': 10, 'min_samples_split': 11, 'min_samples_leaf': 2, 'subsample': 0.9242588524342757, 'max_features': None}. Best is trial 1137 with value: 0.19687116000636118.
