[I 2024-12-04 15:03:09,727] Trial 517 finished with value: 0.13435440802371984 and parameters: {'kernel_type': 'Matern', 'length_scale': 124.92566613058136, 'noise_level': 0.00021698112262583306, 'constant_value': 77.12008224505828, 'nu': 1.5}. Best is trial 276 with value: 0.13435392997433446.
[I 2024-12-04 15:03:10,047] Trial 527 finished with value: 0.13435440178586197 and parameters: {'kernel_type': 'Matern', 'length_scale': 8.494252467877015, 'noise_level': 0.0033652545141839825, 'constant_value': 70920.14636798023, 'nu': 1.5}. Best is trial 276 with value: 0.13435392997433446.
[I 2024-12-04 15:03:10,057] Trial 509 finished with value: 0.1343544001865294 and parameters: {'kernel_type': 'Matern', 'length_scale': 1360.1595238217524, 'noise_level': 0.035559137960913284, 'constant_value': 637.4853652133647, 'nu': 1.5}. Best is trial 276 with value: 0.13435392997433446.
[I 2024-12-04 15:03:12,028] Trial 529 finished with value: 0.13435439890322326 and parameters: {'kernel_type': 'Matern', 'length_scale': 129.3436932082814, 'noise_level': 0.025545557038559364, 'constant_value': 958.7420750834008, 'nu': 1.5}. Best is trial 276 with value: 0.13435392997433446.
[I 2024-12-04 15:03:14,732] Trial 532 finished with value: 0.13435440816923927 and parameters: {'kernel_type': 'Matern', 'length_scale': 36.577393685764385, 'noise_level': 0.09521625533844492, 'constant_value': 10.533393653885739, 'nu': 1.5}. Best is trial 276 with value: 0.13435392997433446.
[I 2024-12-04 15:03:15,233] Trial 518 finished with value: 0.13435425312068955 and parameters: {'kernel_type': 'Matern', 'length_scale': 24.242799217811477, 'noise_level': 0.010164377631008874, 'constant_value': 92211.75439178616, 'nu': 1.5}. Best is trial 276 with value: 0.13435392997433446.
[I 2024-12-04 15:03:15,491] Trial 528 finished with value: 0.13435435527868114 and parameters: {'kernel_type': 'Matern', 'length_scale': 100.51811525478747, 'noise_level': 0.024855547148722915, 'constant_value': 9.424098413667723, 'nu': 1.5}. Best is trial 276 with value: 0.13435392997433446.
[I 2024-12-04 15:03:15,586] Trial 525 finished with value: 0.1725103894119924 and parameters: {'kernel_type': 'Matern', 'length_scale': 1018.8936516206373, 'noise_level': 0.04494784590420749, 'constant_value': 1544.6382288725442, 'nu': 0.5}. Best is trial 276 with value: 0.13435392997433446.
[I 2024-12-04 15:03:15,900] Trial 523 finished with value: 1.2693635028572312 and parameters: {'kernel_type': 'Matern', 'length_scale': 9.614927271361545e-05, 'noise_level': 0.0010373662170885562, 'constant_value': 0.005573555476763635, 'nu': 0.5}. Best is trial 276 with value: 0.13435392997433446.
[I 2024-12-04 15:03:16,127] Trial 521 finished with value: 0.1343543062730381 and parameters: {'kernel_type': 'Matern', 'length_scale': 1825.0779783572832, 'noise_level': 0.025908626731940276, 'constant_value': 26.560446472845975, 'nu': 1.5}. Best is trial 276 with value: 0.13435392997433446.
[I 2024-12-04 15:03:18,265] Trial 530 finished with value: 0.13435437720960278 and parameters: {'kernel_type': 'Matern', 'length_scale': 232.81622355770742, 'noise_level': 0.0016016884519664694, 'constant_value': 121.81589586862486, 'nu': 1.5}. Best is trial 276 with value: 0.13435392997433446.
[I 2024-12-04 15:03:19,639] Trial 534 finished with value: 0.13435439478409325 and parameters: {'kernel_type': 'Matern', 'length_scale': 815.5246260635824, 'noise_level': 0.007696768447719655, 'constant_value': 428.169946137511, 'nu': 1.5}. Best is trial 276 with value: 0.13435392997433446.
[I 2024-12-04 15:03:19,821] Trial 526 finished with value: 0.13435439973018962 and parameters: {'kernel_type': 'Matern', 'length_scale': 46.62461886176796, 'noise_level': 0.03664770560920997, 'constant_value': 727.6684327199483, 'nu': 1.5}. Best is trial 276 with value: 0.13435392997433446.
[I 2024-12-04 15:03:21,531] Trial 531 finished with value: 0.13435439911670316 and parameters: {'kernel_type': 'Matern', 'length_scale': 9.713061757243427, 'noise_level': 0.0082699974700098, 'constant_value': 3318.1038628978804, 'nu': 1.5}. Best is trial 276 with value: 0.13435392997433446.
[I 2024-12-04 15:03:22,766] Trial 538 finished with value: 1.3007737268866322 and parameters: {'kernel_type': 'Matern', 'length_scale': 3365.5685968077705, 'noise_level': 0.9465869887707484, 'constant_value': 0.24841632824274196, 'nu': 1.5}. Best is trial 276 with value: 0.13435392997433446.
[I 2024-12-04 15:03:23,444] Trial 536 finished with value: 1.3007745979332233 and parameters: {'kernel_type': 'Matern', 'length_scale': 45041.76014605625, 'noise_level': 0.16578294214598946, 'constant_value': 0.04531781511915205, 'nu': 1.5}. Best is trial 276 with value: 0.13435392997433446.
[I 2024-12-04 15:03:24,155] Trial 541 finished with value: 0.1343542341936479 and parameters: {'kernel_type': 'Matern', 'length_scale': 33.15328826671222, 'noise_level': 0.002011181205989698, 'constant_value': 10034.573335214089, 'nu': 1.5}. Best is trial 276 with value: 0.13435392997433446.
[I 2024-12-04 15:03:24,402] Trial 542 finished with value: 0.13435438339773492 and parameters: {'kernel_type': 'Matern', 'length_scale': 862.1045660526851, 'noise_level': 0.009227753871194525, 'constant_value': 45946.055139849115, 'nu': 1.5}. Best is trial 276 with value: 0.13435392997433446.
[I 2024-12-04 15:03:24,428] Trial 537 finished with value: 0.13435481871820112 and parameters: {'kernel_type': 'Matern', 'length_scale': 292.65300890801035, 'noise_level': 0.024342902087943107, 'constant_value': 73043.51007900575, 'nu': 1.5}. Best is trial 276 with value: 0.13435392997433446.
[I 2024-12-04 15:03:24,948] Trial 535 finished with value: 0.15167282262997014 and parameters: {'kernel_type': 'RBF', 'length_scale': 261.24523665355866, 'noise_level': 0.18580399758503288, 'constant_value': 0.011646917822014076, 'nu': 2.5}. Best is trial 276 with value: 0.13435392997433446.
[I 2024-12-04 15:03:25,193] Trial 533 finished with value: 0.1343543387139064 and parameters: {'kernel_type': 'Matern', 'length_scale': 18.22250595960746, 'noise_level': 0.021503893180442917, 'constant_value': 92633.4317970729, 'nu': 1.5}. Best is trial 276 with value: 0.13435392997433446.
[I 2024-12-04 15:03:25,268] Trial 546 finished with value: 0.14859901862474956 and parameters: {'kernel_type': 'Matern', 'length_scale': 18.986545252946907, 'noise_level': 0.003155314757604134, 'constant_value': 10.315667144326618, 'nu': 2.5}. Best is trial 276 with value: 0.13435392997433446.
[I 2024-12-04 15:03:25,465] Trial 539 finished with value: 0.13435454922348963 and parameters: {'kernel_type': 'Matern', 'length_scale': 1.5868604352600437, 'noise_level': 0.020506688874235027, 'constant_value': 31331.98717944688, 'nu': 1.5}. Best is trial 276 with value: 0.13435392997433446.
[I 2024-12-04 15:03:26,959] Trial 544 finished with value: 0.13435441225319988 and parameters: {'kernel_type': 'Matern', 'length_scale': 1.3597471054448633, 'noise_level': 0.008637263790261019, 'constant_value': 66678.34191767384, 'nu': 1.5}. Best is trial 276 with value: 0.13435392997433446.
[I 2024-12-04 15:03:27,582] Trial 543 finished with value: 0.1343542090973171 and parameters: {'kernel_type': 'Matern', 'length_scale': 14.215372132901216, 'noise_level': 0.016593394397091666, 'constant_value': 74486.64931532735, 'nu': 1.5}. Best is trial 276 with value: 0.13435392997433446.
[I 2024-12-04 15:03:31,663] Trial 552 finished with value: 1.2693553830160251 and parameters: {'kernel_type': 'Matern', 'length_scale': 0.12225796673299301, 'noise_level': 0.03182799460005546, 'constant_value': 69014.13693946392, 'nu': 1.5}. Best is trial 276 with value: 0.13435392997433446.
[I 2024-12-04 15:03:32,914] Trial 545 finished with value: 0.13435461319363481 and parameters: {'kernel_type': 'Matern', 'length_scale': 318.1311413762547, 'noise_level': 0.0018380087620322914, 'constant_value': 1853.3324162594627, 'nu': 1.5}. Best is trial 276 with value: 0.13435392997433446.
[I 2024-12-04 15:03:35,583] Trial 551 finished with value: 1.2693635028569121 and parameters: {'kernel_type': 'RBF', 'length_scale': 6.248451718266254, 'noise_level': 2.949734197257956e-07, 'constant_value': 1540.3279287443956, 'nu': 1.5}. Best is trial 276 with value: 0.13435392997433446.
[I 2024-12-04 15:03:37,125] Trial 554 finished with value: 0.13435440188521983 and parameters: {'kernel_type': 'Matern', 'length_scale': 448.5016329444421, 'noise_level': 0.0001223060823462847, 'constant_value': 11527.928863875552, 'nu': 1.5}. Best is trial 276 with value: 0.13435392997433446.
[I 2024-12-04 15:03:37,125] Trial 547 finished with value: 0.15167300019013774 and parameters: {'kernel_type': 'RBF', 'length_scale': 0.371086199638278, 'noise_level': 0.003204946559036906, 'constant_value': 41.94541246870378, 'nu': 1.5}. Best is trial 276 with value: 0.13435392997433446.
[I 2024-12-04 15:03:38,758] Trial 550 finished with value: 0.1343546175409764 and parameters: {'kernel_type': 'Matern', 'length_scale': 161.29190978674976, 'noise_level': 0.00021211299136829294, 'constant_value': 31246.939892256007, 'nu': 1.5}. Best is trial 276 with value: 0.13435392997433446.
[I 2024-12-04 15:03:38,850] Trial 553 finished with value: 0.13435437035980097 and parameters: {'kernel_type': 'Matern', 'length_scale': 66.98443325338725, 'noise_level': 0.001903622306800791, 'constant_value': 69835.36628602925, 'nu': 1.5}. Best is trial 276 with value: 0.13435392997433446.
[I 2024-12-04 15:03:39,408] Trial 556 finished with value: 0.1343543911589937 and parameters: {'kernel_type': 'Matern', 'length_scale': 27.874395812263387, 'noise_level': 0.00351612359612974, 'constant_value': 12399.405570756478, 'nu': 1.5}. Best is trial 276 with value: 0.13435392997433446.
[I 2024-12-04 15:03:42,868] Trial 558 finished with value: 0.13435439331093105 and parameters: {'kernel_type': 'Matern', 'length_scale': 1.1957248974794028, 'noise_level': 0.03650253146311167, 'constant_value': 83631.99774156454, 'nu': 1.5}. Best is trial 276 with value: 0.13435392997433446.
[I 2024-12-04 15:03:43,971] Trial 540 finished with value: 0.13435436331296285 and parameters: {'kernel_type': 'Matern', 'length_scale': 57.752970084707805, 'noise_level': 0.022928400719907524, 'constant_value': 37282.880771848315, 'nu': 1.5}. Best is trial 276 with value: 0.13435392997433446.
[I 2024-12-04 15:03:45,503] Trial 563 finished with value: 1.2693635028569563 and parameters: {'kernel_type': 'Matern', 'length_scale': 0.015530509446368527, 'noise_level': 0.0014400831227006448, 'constant_value': 78688.7138287366, 'nu': 1.5}. Best is trial 276 with value: 0.13435392997433446.
[I 2024-12-04 15:03:47,003] Trial 555 finished with value: 1.269363502857109 and parameters: {'kernel_type': 'Matern', 'length_scale': 5.318871615088203, 'noise_level': 4.9978324404237836e-05, 'constant_value': 0.00027162052645162993, 'nu': 2.5}. Best is trial 276 with value: 0.13435392997433446.
[I 2024-12-04 15:03:47,305] Trial 548 finished with value: 0.13435433429545154 and parameters: {'kernel_type': 'Matern', 'length_scale': 19.777856716963228, 'noise_level': 0.04505496882698716, 'constant_value': 403.3753823580755, 'nu': 1.5}. Best is trial 276 with value: 0.13435392997433446.
[I 2024-12-04 15:03:47,499] Trial 561 finished with value: 0.13435440625986256 and parameters: {'kernel_type': 'Matern', 'length_scale': 10.80075855107732, 'noise_level': 0.008796761735302798, 'constant_value': 837.6224013084917, 'nu': 1.5}. Best is trial 276 with value: 0.13435392997433446.
[I 2024-12-04 15:03:48,786] Trial 564 finished with value: 0.13435440098984477 and parameters: {'kernel_type': 'Matern', 'length_scale': 4.745847558027866, 'noise_level': 0.0345909124659852, 'constant_value': 2541.97399083093, 'nu': 1.5}. Best is trial 276 with value: 0.13435392997433446.
[I 2024-12-04 15:03:50,339] Trial 565 finished with value: 0.13435440371707047 and parameters: {'kernel_type': 'Matern', 'length_scale': 1.312648094655494, 'noise_level': 0.0068417655888466135, 'constant_value': 59828.20899125713, 'nu': 1.5}. Best is trial 276 with value: 0.13435392997433446.
[I 2024-12-04 15:03:52,412] Trial 559 finished with value: 0.13435440270962476 and parameters: {'kernel_type': 'Matern', 'length_scale': 2.5565515546897983, 'noise_level': 1.2520812004736095e-07, 'constant_value': 0.0006003161124486116, 'nu': 1.5}. Best is trial 276 with value: 0.13435392997433446.
[I 2024-12-04 15:03:52,455] Trial 549 finished with value: 0.13435428133148683 and parameters: {'kernel_type': 'Matern', 'length_scale': 293.10138978811636, 'noise_level': 2.205276187056656e-05, 'constant_value': 26215.667780134427, 'nu': 1.5}. Best is trial 276 with value: 0.13435392997433446.
[I 2024-12-04 15:03:54,783] Trial 568 finished with value: 1.2693635028569779 and parameters: {'kernel_type': 'RBF', 'length_scale': 0.00013552957838151253, 'noise_level': 8.659483970368284e-07, 'constant_value': 0.3893186051390827, 'nu': 2.5}. Best is trial 276 with value: 0.13435392997433446.
[I 2024-12-04 15:03:57,413] Trial 567 finished with value: 1.269363502857072 and parameters: {'kernel_type': 'RBF', 'length_scale': 3.7070710909038715, 'noise_level': 4.734297775580619e-10, 'constant_value': 0.007511698168871308, 'nu': 2.5}. Best is trial 276 with value: 0.13435392997433446.
[I 2024-12-04 15:03:58,702] Trial 560 finished with value: 0.1343541662486242 and parameters: {'kernel_type': 'Matern', 'length_scale': 32.97319907896964, 'noise_level': 0.004316985175607906, 'constant_value': 44310.73588022738, 'nu': 1.5}. Best is trial 276 with value: 0.13435392997433446.
[I 2024-12-04 15:03:59,482] Trial 573 finished with value: 0.13435448189928564 and parameters: {'kernel_type': 'Matern', 'length_scale': 1177.8727092699967, 'noise_level': 0.12752872715518723, 'constant_value': 1834.06487879659, 'nu': 1.5}. Best is trial 276 with value: 0.13435392997433446.
[I 2024-12-04 15:04:01,366] Trial 574 finished with value: 0.14859827006294316 and parameters: {'kernel_type': 'Matern', 'length_scale': 94.80577292613408, 'noise_level': 0.015457367927302207, 'constant_value': 4353.703191629108, 'nu': 2.5}. Best is trial 276 with value: 0.13435392997433446.
[I 2024-12-04 15:04:01,673] Trial 557 finished with value: 0.13435440497167306 and parameters: {'kernel_type': 'Matern', 'length_scale': 103.74824007974125, 'noise_level': 0.06759679245314375, 'constant_value': 61442.38471989328, 'nu': 1.5}. Best is trial 276 with value: 0.13435392997433446.
[I 2024-12-04 15:04:02,476] Trial 575 finished with value: 0.1343541079240797 and parameters: {'kernel_type': 'Matern', 'length_scale': 534.4115564535017, 'noise_level': 0.7936048022949037, 'constant_value': 66048.76363711235, 'nu': 1.5}. Best is trial 276 with value: 0.13435392997433446.
[I 2024-12-04 15:04:02,716] Trial 577 finished with value: 0.1343543679598389 and parameters: {'kernel_type': 'Matern', 'length_scale': 5.840859282569359, 'noise_level': 0.005823710583422655, 'constant_value': 1828.2112673600457, 'nu': 1.5}. Best is trial 276 with value: 0.13435392997433446.
[I 2024-12-04 15:04:03,025] Trial 562 finished with value: 1.2693635028566934 and parameters: {'kernel_type': 'RBF', 'length_scale': 9.047817624423901e-05, 'noise_level': 0.021488718635810335, 'constant_value': 0.0008401134517560581, 'nu': 0.5}. Best is trial 276 with value: 0.13435392997433446.
[I 2024-12-04 15:04:03,957] Trial 566 finished with value: 1.2693635028402308 and parameters: {'kernel_type': 'Matern', 'length_scale': 4113.409169892036, 'noise_level': 0.0017395341272720575, 'constant_value': 115.47926806940619, 'nu': 1.5}. Best is trial 276 with value: 0.13435392997433446.
[I 2024-12-04 15:04:05,169] Trial 571 finished with value: 0.13435439907978078 and parameters: {'kernel_type': 'Matern', 'length_scale': 57.347130811200024, 'noise_level': 0.013937137591241619, 'constant_value': 75649.91815609738, 'nu': 1.5}. Best is trial 276 with value: 0.13435392997433446.
[I 2024-12-04 15:04:05,173] Trial 570 finished with value: 1.2693635028569696 and parameters: {'kernel_type': 'Matern', 'length_scale': 87383.11813146668, 'noise_level': 0.011823756775414907, 'constant_value': 211.8200864825481, 'nu': 1.5}. Best is trial 276 with value: 0.13435392997433446.
[I 2024-12-04 15:04:06,677] Trial 580 finished with value: 1.269363502856958 and parameters: {'kernel_type': 'RBF', 'length_scale': 0.00020662254925970868, 'noise_level': 0.0027127442269522474, 'constant_value': 1.5459258004928365, 'nu': 1.5}. Best is trial 276 with value: 0.13435392997433446.
[I 2024-12-04 15:04:08,646] Trial 572 finished with value: 0.13435440012991665 and parameters: {'kernel_type': 'Matern', 'length_scale': 16.906331782890994, 'noise_level': 0.2428137908530541, 'constant_value': 54974.19123861898, 'nu': 1.5}. Best is trial 276 with value: 0.13435392997433446.
[I 2024-12-04 15:04:09,862] Trial 582 finished with value: 0.1343542777379022 and parameters: {'kernel_type': 'Matern', 'length_scale': 2.9689229830166646, 'noise_level': 0.0002371834747716565, 'constant_value': 57579.967267862376, 'nu': 1.5}. Best is trial 276 with value: 0.13435392997433446.
[I 2024-12-04 15:04:10,244] Trial 581 finished with value: 0.13435438529941704 and parameters: {'kernel_type': 'Matern', 'length_scale': 20.64012949658915, 'noise_level': 0.0008298881893419645, 'constant_value': 66965.90293701891, 'nu': 1.5}. Best is trial 276 with value: 0.13435392997433446.
[I 2024-12-04 15:04:11,549] Trial 578 finished with value: 0.13435438025765434 and parameters: {'kernel_type': 'Matern', 'length_scale': 16.66203002441305, 'noise_level': 0.0013402189017280345, 'constant_value': 88667.88846808994, 'nu': 1.5}. Best is trial 276 with value: 0.13435392997433446.
[I 2024-12-04 15:04:11,804] Trial 579 finished with value: 0.13435419547914665 and parameters: {'kernel_type': 'Matern', 'length_scale': 198.76640198335264, 'noise_level': 0.00025963288313239895, 'constant_value': 463.4385265152894, 'nu': 1.5}. Best is trial 276 with value: 0.13435392997433446.
[I 2024-12-04 15:04:13,757] Trial 586 finished with value: 0.13435435493839373 and parameters: {'kernel_type': 'Matern', 'length_scale': 5.162491810684882, 'noise_level': 0.005655105545413149, 'constant_value': 873.4775935266084, 'nu': 1.5}. Best is trial 276 with value: 0.13435392997433446.
[I 2024-12-04 15:04:14,556] Trial 585 finished with value: 0.1725104030086407 and parameters: {'kernel_type': 'Matern', 'length_scale': 756.9344427105555, 'noise_level': 0.003930239867434513, 'constant_value': 39603.59485934861, 'nu': 0.5}. Best is trial 276 with value: 0.13435392997433446.
[I 2024-12-04 15:04:15,784] Trial 569 finished with value: 0.20265946186998962 and parameters: {'kernel_type': 'Matern', 'length_scale': 0.14966311370582752, 'noise_level': 0.05639513136788772, 'constant_value': 475.3868901811947, 'nu': 2.5}. Best is trial 276 with value: 0.13435392997433446.
[I 2024-12-04 15:04:16,245] Trial 576 finished with value: 1.2693635028567194 and parameters: {'kernel_type': 'Matern', 'length_scale': 59878.75773362979, 'noise_level': 4.316938744827702e-10, 'constant_value': 1.0048265457679383e-05, 'nu': 1.5}. Best is trial 276 with value: 0.13435392997433446.
[I 2024-12-04 15:04:17,119] Trial 583 finished with value: 0.13435440208332877 and parameters: {'kernel_type': 'Matern', 'length_scale': 1441.8799393436582, 'noise_level': 0.3441261993541167, 'constant_value': 35611.88898179469, 'nu': 1.5}. Best is trial 276 with value: 0.13435392997433446.
[I 2024-12-04 15:04:19,633] Trial 587 finished with value: 0.13435430057806452 and parameters: {'kernel_type': 'Matern', 'length_scale': 1.1978696875982524, 'noise_level': 0.013505445161751676, 'constant_value': 5749.711560715635, 'nu': 1.5}. Best is trial 276 with value: 0.13435392997433446.
[I 2024-12-04 15:04:20,991] Trial 592 finished with value: 0.1343544336041477 and parameters: {'kernel_type': 'Matern', 'length_scale': 406.8996225337882, 'noise_level': 0.15708984606372106, 'constant_value': 76754.611965129, 'nu': 1.5}. Best is trial 276 with value: 0.13435392997433446.
[I 2024-12-04 15:04:21,400] Trial 591 finished with value: 0.13435440202280777 and parameters: {'kernel_type': 'Matern', 'length_scale': 677.6628900706754, 'noise_level': 0.7814184786925326, 'constant_value': 92852.83274874413, 'nu': 1.5}. Best is trial 276 with value: 0.13435392997433446.
[I 2024-12-04 15:04:21,555] Trial 589 finished with value: 0.13435414404800547 and parameters: {'kernel_type': 'Matern', 'length_scale': 12.041580386347105, 'noise_level': 0.004835394829638238, 'constant_value': 1821.687349852508, 'nu': 1.5}. Best is trial 276 with value: 0.13435392997433446.
[I 2024-12-04 15:04:22,834] Trial 594 finished with value: 0.13435435650760008 and parameters: {'kernel_type': 'Matern', 'length_scale': 217.56499319955986, 'noise_level': 0.0025971220038889724, 'constant_value': 338.35398674249745, 'nu': 1.5}. Best is trial 276 with value: 0.13435392997433446.
[I 2024-12-04 15:04:23,715] Trial 593 finished with value: 0.13435439758556408 and parameters: {'kernel_type': 'Matern', 'length_scale': 17.6125870546768, 'noise_level': 0.012727803100379192, 'constant_value': 244.66514244165523, 'nu': 1.5}. Best is trial 276 with value: 0.13435392997433446.
[I 2024-12-04 15:04:28,031] Trial 590 finished with value: 1.2693635028570251 and parameters: {'kernel_type': 'Matern', 'length_scale': 9.971169148711995e-05, 'noise_level': 0.00921876489772153, 'constant_value': 4.454080146848211e-07, 'nu': 1.5}. Best is trial 276 with value: 0.13435392997433446.
[I 2024-12-04 15:04:28,401] Trial 588 finished with value: 0.13435440510849694 and parameters: {'kernel_type': 'Matern', 'length_scale': 844.1991044351732, 'noise_level': 0.7502023259515441, 'constant_value': 3042.523877222902, 'nu': 1.5}. Best is trial 276 with value: 0.13435392997433446.
