[I 2024-12-04 12:06:43,765] Trial 799 finished with value: 0.5142763458818598 and parameters: {'n_estimators': 110, 'max_depth': 21, 'min_samples_split': 4, 'min_samples_leaf': 1, 'max_features': None, 'bootstrap': True, 'criterion': 'absolute_error'}. Best is trial 744 with value: 0.5032383725751689.
[I 2024-12-04 12:06:44,696] Trial 726 finished with value: 0.8236537662538747 and parameters: {'n_estimators': 568, 'max_depth': 39, 'min_samples_split': 46, 'min_samples_leaf': 1, 'max_features': None, 'bootstrap': False, 'criterion': 'absolute_error'}. Best is trial 744 with value: 0.5032383725751689.
[I 2024-12-04 12:06:45,574] Trial 807 finished with value: 0.8275602877086299 and parameters: {'n_estimators': 190, 'max_depth': 18, 'min_samples_split': 3, 'min_samples_leaf': 1, 'max_features': 'sqrt', 'bootstrap': True, 'criterion': 'absolute_error'}. Best is trial 744 with value: 0.5032383725751689.
[I 2024-12-04 12:06:45,920] Trial 802 finished with value: 0.5158389961928853 and parameters: {'n_estimators': 109, 'max_depth': 17, 'min_samples_split': 3, 'min_samples_leaf': 1, 'max_features': None, 'bootstrap': True, 'criterion': 'absolute_error'}. Best is trial 744 with value: 0.5032383725751689.
[I 2024-12-04 12:06:45,950] Trial 801 finished with value: 0.5161876427494867 and parameters: {'n_estimators': 125, 'max_depth': 22, 'min_samples_split': 4, 'min_samples_leaf': 1, 'max_features': None, 'bootstrap': True, 'criterion': 'absolute_error'}. Best is trial 744 with value: 0.5032383725751689.
[I 2024-12-04 12:06:48,960] Trial 780 finished with value: 0.5687992159733715 and parameters: {'n_estimators': 236, 'max_depth': 15, 'min_samples_split': 4, 'min_samples_leaf': 1, 'max_features': None, 'bootstrap': False, 'criterion': 'absolute_error'}. Best is trial 744 with value: 0.5032383725751689.
[I 2024-12-04 12:06:49,388] Trial 785 finished with value: 0.5114787599454159 and parameters: {'n_estimators': 274, 'max_depth': 18, 'min_samples_split': 4, 'min_samples_leaf': 1, 'max_features': None, 'bootstrap': True, 'criterion': 'absolute_error'}. Best is trial 744 with value: 0.5032383725751689.
[I 2024-12-04 12:06:50,879] Trial 791 finished with value: 0.5183311319428261 and parameters: {'n_estimators': 256, 'max_depth': 11, 'min_samples_split': 4, 'min_samples_leaf': 1, 'max_features': None, 'bootstrap': True, 'criterion': 'absolute_error'}. Best is trial 744 with value: 0.5032383725751689.
[I 2024-12-04 12:06:50,906] Trial 778 finished with value: 0.5145077880550887 and parameters: {'n_estimators': 299, 'max_depth': 14, 'min_samples_split': 3, 'min_samples_leaf': 1, 'max_features': None, 'bootstrap': True, 'criterion': 'absolute_error'}. Best is trial 744 with value: 0.5032383725751689.
[I 2024-12-04 12:06:51,231] Trial 787 finished with value: 0.5174326874109181 and parameters: {'n_estimators': 280, 'max_depth': 24, 'min_samples_split': 6, 'min_samples_leaf': 1, 'max_features': None, 'bootstrap': True, 'criterion': 'absolute_error'}. Best is trial 744 with value: 0.5032383725751689.
[I 2024-12-04 12:06:51,315] Trial 811 finished with value: 0.5536755964924878 and parameters: {'n_estimators': 107, 'max_depth': 22, 'min_samples_split': 4, 'min_samples_leaf': 2, 'max_features': None, 'bootstrap': True, 'criterion': 'absolute_error'}. Best is trial 744 with value: 0.5032383725751689.
[I 2024-12-04 12:06:51,742] Trial 808 finished with value: 1.348983923423566 and parameters: {'n_estimators': 720, 'max_depth': 46, 'min_samples_split': 10, 'min_samples_leaf': 10, 'max_features': 'log2', 'bootstrap': False, 'criterion': 'absolute_error'}. Best is trial 744 with value: 0.5032383725751689.
[I 2024-12-04 12:06:53,423] Trial 803 finished with value: 0.5167889018612442 and parameters: {'n_estimators': 119, 'max_depth': 22, 'min_samples_split': 6, 'min_samples_leaf': 1, 'max_features': None, 'bootstrap': True, 'criterion': 'absolute_error'}. Best is trial 744 with value: 0.5032383725751689.
[I 2024-12-04 12:06:55,163] Trial 813 finished with value: 0.505118236717327 and parameters: {'n_estimators': 107, 'max_depth': 18, 'min_samples_split': 4, 'min_samples_leaf': 1, 'max_features': None, 'bootstrap': True, 'criterion': 'absolute_error'}. Best is trial 744 with value: 0.5032383725751689.
[I 2024-12-04 12:06:55,462] Trial 796 finished with value: 0.5152832024057152 and parameters: {'n_estimators': 267, 'max_depth': 20, 'min_samples_split': 4, 'min_samples_leaf': 1, 'max_features': None, 'bootstrap': True, 'criterion': 'absolute_error'}. Best is trial 744 with value: 0.5032383725751689.
[I 2024-12-04 12:06:58,004] Trial 804 finished with value: 0.5596440330307696 and parameters: {'n_estimators': 315, 'max_depth': 17, 'min_samples_split': 2, 'min_samples_leaf': 2, 'max_features': None, 'bootstrap': True, 'criterion': 'absolute_error'}. Best is trial 744 with value: 0.5032383725751689.
[I 2024-12-04 12:06:58,487] Trial 810 finished with value: 0.5232657574189424 and parameters: {'n_estimators': 107, 'max_depth': 17, 'min_samples_split': 9, 'min_samples_leaf': 1, 'max_features': None, 'bootstrap': True, 'criterion': 'absolute_error'}. Best is trial 744 with value: 0.5032383725751689.
[I 2024-12-04 12:06:58,558] Trial 816 finished with value: 0.5659052758754329 and parameters: {'n_estimators': 110, 'max_depth': 6, 'min_samples_split': 4, 'min_samples_leaf': 2, 'max_features': None, 'bootstrap': True, 'criterion': 'absolute_error'}. Best is trial 744 with value: 0.5032383725751689.
[I 2024-12-04 12:06:59,067] Trial 805 finished with value: 0.5552976743838599 and parameters: {'n_estimators': 255, 'max_depth': 15, 'min_samples_split': 4, 'min_samples_leaf': 2, 'max_features': None, 'bootstrap': True, 'criterion': 'absolute_error'}. Best is trial 744 with value: 0.5032383725751689.
[I 2024-12-04 12:06:59,417] Trial 817 finished with value: 0.5128344143474234 and parameters: {'n_estimators': 100, 'max_depth': 15, 'min_samples_split': 2, 'min_samples_leaf': 1, 'max_features': None, 'bootstrap': True, 'criterion': 'absolute_error'}. Best is trial 744 with value: 0.5032383725751689.
[I 2024-12-04 12:06:59,575] Trial 826 finished with value: 1.3102662432820271 and parameters: {'n_estimators': 100, 'max_depth': 9, 'min_samples_split': 9, 'min_samples_leaf': 2, 'max_features': 'log2', 'bootstrap': True, 'criterion': 'absolute_error'}. Best is trial 744 with value: 0.5032383725751689.
[I 2024-12-04 12:07:00,260] Trial 812 finished with value: 0.5161205176834343 and parameters: {'n_estimators': 101, 'max_depth': 18, 'min_samples_split': 3, 'min_samples_leaf': 1, 'max_features': None, 'bootstrap': True, 'criterion': 'absolute_error'}. Best is trial 744 with value: 0.5032383725751689.
[I 2024-12-04 12:07:00,504] Trial 822 finished with value: 0.987666446285762 and parameters: {'n_estimators': 177, 'max_depth': 46, 'min_samples_split': 38, 'min_samples_leaf': 2, 'max_features': 'sqrt', 'bootstrap': True, 'criterion': 'absolute_error'}. Best is trial 744 with value: 0.5032383725751689.
[I 2024-12-04 12:07:00,584] Trial 818 finished with value: 0.5555278621934276 and parameters: {'n_estimators': 140, 'max_depth': 15, 'min_samples_split': 5, 'min_samples_leaf': 2, 'max_features': None, 'bootstrap': True, 'criterion': 'absolute_error'}. Best is trial 744 with value: 0.5032383725751689.
[I 2024-12-04 12:07:00,657] Trial 814 finished with value: 0.5116706674320327 and parameters: {'n_estimators': 108, 'max_depth': 13, 'min_samples_split': 3, 'min_samples_leaf': 1, 'max_features': None, 'bootstrap': True, 'criterion': 'absolute_error'}. Best is trial 744 with value: 0.5032383725751689.
[I 2024-12-04 12:07:00,730] Trial 820 finished with value: 0.5579015938834345 and parameters: {'n_estimators': 101, 'max_depth': 21, 'min_samples_split': 9, 'min_samples_leaf': 2, 'max_features': None, 'bootstrap': True, 'criterion': 'absolute_error'}. Best is trial 744 with value: 0.5032383725751689.
[I 2024-12-04 12:07:01,952] Trial 825 finished with value: 1.0117236967009693 and parameters: {'n_estimators': 104, 'max_depth': 31, 'min_samples_split': 4, 'min_samples_leaf': 2, 'max_features': 'sqrt', 'bootstrap': True, 'criterion': 'absolute_error'}. Best is trial 744 with value: 0.5032383725751689.
[I 2024-12-04 12:07:03,064] Trial 795 finished with value: 0.5184588497503784 and parameters: {'n_estimators': 293, 'max_depth': 26, 'min_samples_split': 4, 'min_samples_leaf': 1, 'max_features': None, 'bootstrap': True, 'criterion': 'absolute_error'}. Best is trial 744 with value: 0.5032383725751689.
[I 2024-12-04 12:07:03,067] Trial 815 finished with value: 0.5238336117761263 and parameters: {'n_estimators': 251, 'max_depth': 10, 'min_samples_split': 6, 'min_samples_leaf': 1, 'max_features': None, 'bootstrap': True, 'criterion': 'absolute_error'}. Best is trial 744 with value: 0.5032383725751689.
[I 2024-12-04 12:07:03,379] Trial 827 finished with value: 0.940487538008548 and parameters: {'n_estimators': 110, 'max_depth': 26, 'min_samples_split': 5, 'min_samples_leaf': 1, 'max_features': 'log2', 'bootstrap': True, 'criterion': 'absolute_error'}. Best is trial 744 with value: 0.5032383725751689.
[I 2024-12-04 12:07:03,831] Trial 809 finished with value: 0.50953540673968 and parameters: {'n_estimators': 276, 'max_depth': 19, 'min_samples_split': 4, 'min_samples_leaf': 1, 'max_features': None, 'bootstrap': True, 'criterion': 'absolute_error'}. Best is trial 744 with value: 0.5032383725751689.
[I 2024-12-04 12:07:03,924] Trial 824 finished with value: 0.5535301136932794 and parameters: {'n_estimators': 100, 'max_depth': 15, 'min_samples_split': 3, 'min_samples_leaf': 2, 'max_features': None, 'bootstrap': True, 'criterion': 'absolute_error'}. Best is trial 744 with value: 0.5032383725751689.
[I 2024-12-04 12:07:04,097] Trial 833 finished with value: 0.6546567801727442 and parameters: {'n_estimators': 144, 'max_depth': 49, 'min_samples_split': 3, 'min_samples_leaf': 1, 'max_features': 'log2', 'bootstrap': False, 'criterion': 'squared_error'}. Best is trial 744 with value: 0.5032383725751689.
[I 2024-12-04 12:07:04,250] Trial 829 finished with value: 0.9064369211650343 and parameters: {'n_estimators': 929, 'max_depth': 13, 'min_samples_split': 2, 'min_samples_leaf': 3, 'max_features': 'sqrt', 'bootstrap': False, 'criterion': 'squared_error'}. Best is trial 744 with value: 0.5032383725751689.
[I 2024-12-04 12:07:06,378] Trial 819 finished with value: 0.9515475414137601 and parameters: {'n_estimators': 955, 'max_depth': 44, 'min_samples_split': 2, 'min_samples_leaf': 2, 'max_features': 'sqrt', 'bootstrap': True, 'criterion': 'absolute_error'}. Best is trial 744 with value: 0.5032383725751689.
[I 2024-12-04 12:07:06,440] Trial 823 finished with value: 0.5078043616431733 and parameters: {'n_estimators': 107, 'max_depth': 17, 'min_samples_split': 5, 'min_samples_leaf': 1, 'max_features': None, 'bootstrap': True, 'criterion': 'absolute_error'}. Best is trial 744 with value: 0.5032383725751689.
[I 2024-12-04 12:07:07,612] Trial 806 finished with value: 0.5172182764351154 and parameters: {'n_estimators': 264, 'max_depth': 15, 'min_samples_split': 5, 'min_samples_leaf': 1, 'max_features': None, 'bootstrap': True, 'criterion': 'absolute_error'}. Best is trial 744 with value: 0.5032383725751689.
[I 2024-12-04 12:07:08,812] Trial 831 finished with value: 0.5124984421516191 and parameters: {'n_estimators': 104, 'max_depth': 20, 'min_samples_split': 6, 'min_samples_leaf': 1, 'max_features': None, 'bootstrap': True, 'criterion': 'absolute_error'}. Best is trial 744 with value: 0.5032383725751689.
[I 2024-12-04 12:07:10,261] Trial 838 finished with value: 0.8725660226497847 and parameters: {'n_estimators': 102, 'max_depth': 16, 'min_samples_split': 2, 'min_samples_leaf': 1, 'max_features': 'sqrt', 'bootstrap': True, 'criterion': 'absolute_error'}. Best is trial 744 with value: 0.5032383725751689.
[I 2024-12-04 12:07:11,077] Trial 832 finished with value: 0.5293140866119358 and parameters: {'n_estimators': 122, 'max_depth': 23, 'min_samples_split': 3, 'min_samples_leaf': 1, 'max_features': None, 'bootstrap': True, 'criterion': 'absolute_error'}. Best is trial 744 with value: 0.5032383725751689.
[I 2024-12-04 12:07:15,724] Trial 828 finished with value: 0.50576533228621 and parameters: {'n_estimators': 100, 'max_depth': 17, 'min_samples_split': 5, 'min_samples_leaf': 1, 'max_features': None, 'bootstrap': True, 'criterion': 'absolute_error'}. Best is trial 744 with value: 0.5032383725751689.
[I 2024-12-04 12:07:18,875] Trial 848 finished with value: 0.5197587281220871 and parameters: {'n_estimators': 102, 'max_depth': 16, 'min_samples_split': 7, 'min_samples_leaf': 1, 'max_features': None, 'bootstrap': True, 'criterion': 'absolute_error'}. Best is trial 744 with value: 0.5032383725751689.
[I 2024-12-04 12:07:19,064] Trial 821 finished with value: 0.5201358193527719 and parameters: {'n_estimators': 243, 'max_depth': 21, 'min_samples_split': 3, 'min_samples_leaf': 1, 'max_features': None, 'bootstrap': True, 'criterion': 'absolute_error'}. Best is trial 744 with value: 0.5032383725751689.
[I 2024-12-04 12:07:19,145] Trial 847 finished with value: 0.8585444973047236 and parameters: {'n_estimators': 116, 'max_depth': 17, 'min_samples_split': 7, 'min_samples_leaf': 1, 'max_features': 'sqrt', 'bootstrap': True, 'criterion': 'absolute_error'}. Best is trial 744 with value: 0.5032383725751689.
[I 2024-12-04 12:07:20,722] Trial 836 finished with value: 1.058288150720487 and parameters: {'n_estimators': 151, 'max_depth': 10, 'min_samples_split': 9, 'min_samples_leaf': 1, 'max_features': 'sqrt', 'bootstrap': True, 'criterion': 'absolute_error'}. Best is trial 744 with value: 0.5032383725751689.
[I 2024-12-04 12:07:21,106] Trial 837 finished with value: 0.5141386091872376 and parameters: {'n_estimators': 111, 'max_depth': 15, 'min_samples_split': 3, 'min_samples_leaf': 1, 'max_features': None, 'bootstrap': True, 'criterion': 'absolute_error'}. Best is trial 744 with value: 0.5032383725751689.
[I 2024-12-04 12:07:21,885] Trial 849 finished with value: 1.2337207955431266 and parameters: {'n_estimators': 760, 'max_depth': 19, 'min_samples_split': 3, 'min_samples_leaf': 12, 'max_features': 'sqrt', 'bootstrap': True, 'criterion': 'squared_error'}. Best is trial 744 with value: 0.5032383725751689.
[I 2024-12-04 12:07:24,450] Trial 835 finished with value: 0.5184328701392997 and parameters: {'n_estimators': 245, 'max_depth': 14, 'min_samples_split': 3, 'min_samples_leaf': 1, 'max_features': None, 'bootstrap': True, 'criterion': 'absolute_error'}. Best is trial 744 with value: 0.5032383725751689.
[I 2024-12-04 12:07:24,791] Trial 841 finished with value: 0.5192726400409885 and parameters: {'n_estimators': 112, 'max_depth': 19, 'min_samples_split': 3, 'min_samples_leaf': 1, 'max_features': None, 'bootstrap': True, 'criterion': 'absolute_error'}. Best is trial 744 with value: 0.5032383725751689.
[I 2024-12-04 12:07:26,642] Trial 845 finished with value: 0.5187071308300529 and parameters: {'n_estimators': 229, 'max_depth': 15, 'min_samples_split': 6, 'min_samples_leaf': 1, 'max_features': None, 'bootstrap': True, 'criterion': 'absolute_error'}. Best is trial 744 with value: 0.5032383725751689.
[I 2024-12-04 12:07:27,038] Trial 857 finished with value: 1.341212793748265 and parameters: {'n_estimators': 835, 'max_depth': 6, 'min_samples_split': 18, 'min_samples_leaf': 11, 'max_features': 'sqrt', 'bootstrap': True, 'criterion': 'absolute_error'}. Best is trial 744 with value: 0.5032383725751689.
[I 2024-12-04 12:07:27,052] Trial 842 finished with value: 0.5162115478315562 and parameters: {'n_estimators': 222, 'max_depth': 25, 'min_samples_split': 5, 'min_samples_leaf': 1, 'max_features': None, 'bootstrap': True, 'criterion': 'absolute_error'}. Best is trial 744 with value: 0.5032383725751689.
[I 2024-12-04 12:07:27,227] Trial 830 finished with value: 0.5119189960114081 and parameters: {'n_estimators': 261, 'max_depth': 19, 'min_samples_split': 4, 'min_samples_leaf': 1, 'max_features': None, 'bootstrap': True, 'criterion': 'absolute_error'}. Best is trial 744 with value: 0.5032383725751689.
[I 2024-12-04 12:07:27,329] Trial 844 finished with value: 0.5585295334771296 and parameters: {'n_estimators': 124, 'max_depth': 22, 'min_samples_split': 4, 'min_samples_leaf': 1, 'max_features': None, 'bootstrap': False, 'criterion': 'absolute_error'}. Best is trial 744 with value: 0.5032383725751689.
[I 2024-12-04 12:07:27,825] Trial 853 finished with value: 1.3547846914229826 and parameters: {'n_estimators': 460, 'max_depth': 5, 'min_samples_split': 5, 'min_samples_leaf': 9, 'max_features': 'log2', 'bootstrap': True, 'criterion': 'absolute_error'}. Best is trial 744 with value: 0.5032383725751689.
[I 2024-12-04 12:07:27,826] Trial 850 finished with value: 0.5135747658589696 and parameters: {'n_estimators': 130, 'max_depth': 17, 'min_samples_split': 4, 'min_samples_leaf': 1, 'max_features': None, 'bootstrap': True, 'criterion': 'absolute_error'}. Best is trial 744 with value: 0.5032383725751689.
[I 2024-12-04 12:07:27,910] Trial 834 finished with value: 0.5202578007736663 and parameters: {'n_estimators': 236, 'max_depth': 14, 'min_samples_split': 7, 'min_samples_leaf': 1, 'max_features': None, 'bootstrap': True, 'criterion': 'absolute_error'}. Best is trial 744 with value: 0.5032383725751689.
[I 2024-12-04 12:07:30,437] Trial 858 finished with value: 1.180009501314997 and parameters: {'n_estimators': 130, 'max_depth': 14, 'min_samples_split': 9, 'min_samples_leaf': 2, 'max_features': 'log2', 'bootstrap': True, 'criterion': 'squared_error'}. Best is trial 744 with value: 0.5032383725751689.
[I 2024-12-04 12:07:30,649] Trial 840 finished with value: 0.5177025151739829 and parameters: {'n_estimators': 296, 'max_depth': 24, 'min_samples_split': 6, 'min_samples_leaf': 1, 'max_features': None, 'bootstrap': True, 'criterion': 'absolute_error'}. Best is trial 744 with value: 0.5032383725751689.
[I 2024-12-04 12:07:31,020] Trial 846 finished with value: 0.516241395609397 and parameters: {'n_estimators': 283, 'max_depth': 11, 'min_samples_split': 3, 'min_samples_leaf': 1, 'max_features': None, 'bootstrap': True, 'criterion': 'absolute_error'}. Best is trial 744 with value: 0.5032383725751689.
[I 2024-12-04 12:07:31,088] Trial 862 finished with value: 1.177515161325081 and parameters: {'n_estimators': 119, 'max_depth': 24, 'min_samples_split': 3, 'min_samples_leaf': 2, 'max_features': 'log2', 'bootstrap': True, 'criterion': 'squared_error'}. Best is trial 744 with value: 0.5032383725751689.
[I 2024-12-04 12:07:31,383] Trial 843 finished with value: 0.5659043345756529 and parameters: {'n_estimators': 195, 'max_depth': 16, 'min_samples_split': 3, 'min_samples_leaf': 1, 'max_features': None, 'bootstrap': False, 'criterion': 'absolute_error'}. Best is trial 744 with value: 0.5032383725751689.
[I 2024-12-04 12:07:31,592] Trial 839 finished with value: 0.5190036404811993 and parameters: {'n_estimators': 246, 'max_depth': 14, 'min_samples_split': 4, 'min_samples_leaf': 1, 'max_features': None, 'bootstrap': True, 'criterion': 'absolute_error'}. Best is trial 744 with value: 0.5032383725751689.
[I 2024-12-04 12:07:32,173] Trial 864 finished with value: 1.2456212312824644 and parameters: {'n_estimators': 181, 'max_depth': 14, 'min_samples_split': 13, 'min_samples_leaf': 13, 'max_features': 'sqrt', 'bootstrap': True, 'criterion': 'squared_error'}. Best is trial 744 with value: 0.5032383725751689.
[I 2024-12-04 12:07:32,339] Trial 852 finished with value: 0.5137127339633514 and parameters: {'n_estimators': 102, 'max_depth': 17, 'min_samples_split': 4, 'min_samples_leaf': 1, 'max_features': None, 'bootstrap': True, 'criterion': 'absolute_error'}. Best is trial 744 with value: 0.5032383725751689.
[I 2024-12-04 12:07:32,467] Trial 851 finished with value: 0.5119196592507043 and parameters: {'n_estimators': 146, 'max_depth': 20, 'min_samples_split': 5, 'min_samples_leaf': 1, 'max_features': None, 'bootstrap': True, 'criterion': 'absolute_error'}. Best is trial 744 with value: 0.5032383725751689.
[I 2024-12-04 12:07:32,480] Trial 859 finished with value: 0.5155685660922245 and parameters: {'n_estimators': 290, 'max_depth': 15, 'min_samples_split': 5, 'min_samples_leaf': 1, 'max_features': None, 'bootstrap': True, 'criterion': 'squared_error'}. Best is trial 744 with value: 0.5032383725751689.
[I 2024-12-04 12:07:33,000] Trial 855 finished with value: 0.5558890612217046 and parameters: {'n_estimators': 110, 'max_depth': 14, 'min_samples_split': 6, 'min_samples_leaf': 2, 'max_features': None, 'bootstrap': True, 'criterion': 'absolute_error'}. Best is trial 744 with value: 0.5032383725751689.
[I 2024-12-04 12:07:33,744] Trial 860 finished with value: 0.5134633373024351 and parameters: {'n_estimators': 109, 'max_depth': 21, 'min_samples_split': 4, 'min_samples_leaf': 1, 'max_features': None, 'bootstrap': True, 'criterion': 'absolute_error'}. Best is trial 744 with value: 0.5032383725751689.
[I 2024-12-04 12:07:34,351] Trial 861 finished with value: 0.7505039243602025 and parameters: {'n_estimators': 676, 'max_depth': 46, 'min_samples_split': 34, 'min_samples_leaf': 2, 'max_features': 'sqrt', 'bootstrap': False, 'criterion': 'squared_error'}. Best is trial 744 with value: 0.5032383725751689.
[I 2024-12-04 12:07:34,487] Trial 865 finished with value: 0.6391872843726252 and parameters: {'n_estimators': 900, 'max_depth': 47, 'min_samples_split': 2, 'min_samples_leaf': 1, 'max_features': 'log2', 'bootstrap': False, 'criterion': 'squared_error'}. Best is trial 744 with value: 0.5032383725751689.
[I 2024-12-04 12:07:34,502] Trial 856 finished with value: 0.5107125261554163 and parameters: {'n_estimators': 127, 'max_depth': 20, 'min_samples_split': 5, 'min_samples_leaf': 1, 'max_features': None, 'bootstrap': True, 'criterion': 'absolute_error'}. Best is trial 744 with value: 0.5032383725751689.
