[I 2024-12-03 19:08:45,478] Trial 1744 finished with value: 0.3658516603921654 and parameters: {'kernel': 'rbf', 'C': 94.92265520748904, 'gamma': 0.049815613124281184, 'epsilon': 0.043160953586637116}. Best is trial 88 with value: 0.3542875001421725.
[I 2024-12-03 19:08:46,923] Trial 1745 finished with value: 0.6133123007073416 and parameters: {'kernel': 'rbf', 'C': 27.904714918008672, 'gamma': 0.353377307038458, 'epsilon': 0.0883357954676712}. Best is trial 88 with value: 0.3542875001421725.
[I 2024-12-03 19:08:56,173] Trial 700 finished with value: 3.7161485914035537 and parameters: {'kernel': 'poly', 'C': 17.044956401113517, 'gamma': 0.09642249802076933, 'epsilon': 0.11725645092400419}. Best is trial 88 with value: 0.3542875001421725.
[I 2024-12-03 19:08:57,485] Trial 1747 finished with value: 0.40019407245558625 and parameters: {'kernel': 'rbf', 'C': 22.094676116157604, 'gamma': 0.07691685646675875, 'epsilon': 0.15880744174012298}. Best is trial 88 with value: 0.3542875001421725.
[I 2024-12-03 19:08:59,201] Trial 1748 finished with value: 205.08922324847703 and parameters: {'kernel': 'sigmoid', 'C': 11.154113079752378, 'gamma': 0.02432994480331878, 'epsilon': 0.07950220764458164}. Best is trial 88 with value: 0.3542875001421725.
[I 2024-12-03 19:09:00,426] Trial 1749 finished with value: 0.3983007066770028 and parameters: {'kernel': 'rbf', 'C': 20.80192581128457, 'gamma': 0.030109570914308433, 'epsilon': 0.27474488660228263}. Best is trial 88 with value: 0.3542875001421725.
[I 2024-12-03 19:09:01,689] Trial 1750 finished with value: 0.41688949802676517 and parameters: {'kernel': 'rbf', 'C': 18.429282256554917, 'gamma': 0.08671764420270756, 'epsilon': 0.22136136077223703}. Best is trial 88 with value: 0.3542875001421725.
[I 2024-12-03 19:09:01,934] Trial 1730 finished with value: 0.7952259939856412 and parameters: {'kernel': 'linear', 'C': 34.35453150274654, 'gamma': 0.0012647538024167517, 'epsilon': 0.0012029558026776957}. Best is trial 88 with value: 0.3542875001421725.
[I 2024-12-03 19:09:03,465] Trial 1751 finished with value: 1.0813747610905307 and parameters: {'kernel': 'poly', 'C': 80.45385446590348, 'gamma': 0.00011245616209614426, 'epsilon': 0.14992962724794998}. Best is trial 88 with value: 0.3542875001421725.
[I 2024-12-03 19:09:04,767] Trial 1752 finished with value: 0.36305687447666446 and parameters: {'kernel': 'rbf', 'C': 95.65137058646164, 'gamma': 0.05781227835906254, 'epsilon': 0.14834834196909294}. Best is trial 88 with value: 0.3542875001421725.
[I 2024-12-03 19:09:06,016] Trial 1753 finished with value: 0.4331467977003572 and parameters: {'kernel': 'rbf', 'C': 24.052123826894952, 'gamma': 0.1261571559400952, 'epsilon': 0.041029979340511454}. Best is trial 88 with value: 0.3542875001421725.
[I 2024-12-03 19:09:06,251] Trial 1754 finished with value: 0.43769906398771985 and parameters: {'kernel': 'rbf', 'C': 29.94238967069801, 'gamma': 0.06401480096845126, 'epsilon': 0.3993170767466655}. Best is trial 88 with value: 0.3542875001421725.
[I 2024-12-03 19:09:07,720] Trial 1755 finished with value: 0.4561361145450191 and parameters: {'kernel': 'rbf', 'C': 98.10729449331846, 'gamma': 0.15581124529786727, 'epsilon': 0.05663090275273152}. Best is trial 88 with value: 0.3542875001421725.
[I 2024-12-03 19:09:09,137] Trial 1756 finished with value: 0.42144811352402023 and parameters: {'kernel': 'rbf', 'C': 97.71177049704083, 'gamma': 0.007377656462342934, 'epsilon': 0.04412291385496572}. Best is trial 88 with value: 0.3542875001421725.
[I 2024-12-03 19:09:09,690] Trial 1757 finished with value: 0.40209186627467247 and parameters: {'kernel': 'rbf', 'C': 86.42515468929192, 'gamma': 0.014434459085081739, 'epsilon': 0.06235960218542217}. Best is trial 88 with value: 0.3542875001421725.
[I 2024-12-03 19:09:10,950] Trial 1758 finished with value: 0.3998683934918652 and parameters: {'kernel': 'rbf', 'C': 21.78771607489277, 'gamma': 0.04962387495766881, 'epsilon': 0.0541313216744153}. Best is trial 88 with value: 0.3542875001421725.
[I 2024-12-03 19:09:12,352] Trial 1760 finished with value: 0.6200453329592933 and parameters: {'kernel': 'rbf', 'C': 94.38911400637784, 'gamma': 0.3520491225058671, 'epsilon': 0.13546560604050809}. Best is trial 88 with value: 0.3542875001421725.
[I 2024-12-03 19:09:12,354] Trial 1759 finished with value: 0.36804306167929973 and parameters: {'kernel': 'rbf', 'C': 97.69798476725036, 'gamma': 0.045140013528149045, 'epsilon': 0.032016014472796145}. Best is trial 88 with value: 0.3542875001421725.
[I 2024-12-03 19:09:14,018] Trial 1761 finished with value: 0.40076667712786823 and parameters: {'kernel': 'rbf', 'C': 26.16599849114755, 'gamma': 0.01700207559206886, 'epsilon': 0.2856044897337874}. Best is trial 88 with value: 0.3542875001421725.
[I 2024-12-03 19:09:14,610] Trial 1762 finished with value: 0.4091707251638759 and parameters: {'kernel': 'rbf', 'C': 20.25472510262385, 'gamma': 0.020232726183170634, 'epsilon': 0.218571159021764}. Best is trial 88 with value: 0.3542875001421725.
[I 2024-12-03 19:09:15,762] Trial 1763 finished with value: 0.45352352062736306 and parameters: {'kernel': 'rbf', 'C': 94.38116104578711, 'gamma': 0.13305710532125897, 'epsilon': 0.17338488744678102}. Best is trial 88 with value: 0.3542875001421725.
[I 2024-12-03 19:09:17,112] Trial 1764 finished with value: 0.39029029721264613 and parameters: {'kernel': 'rbf', 'C': 99.88743079789917, 'gamma': 0.015616380686102061, 'epsilon': 0.0582583021806613}. Best is trial 88 with value: 0.3542875001421725.
[I 2024-12-03 19:09:18,010] Trial 1765 finished with value: 0.41384902810420376 and parameters: {'kernel': 'rbf', 'C': 23.939814352563474, 'gamma': 0.10618935289981143, 'epsilon': 0.10252620346387231}. Best is trial 88 with value: 0.3542875001421725.
[I 2024-12-03 19:09:18,964] Trial 1766 finished with value: 1.037810346082073 and parameters: {'kernel': 'sigmoid', 'C': 0.011126427231251481, 'gamma': 0.0010648446756031961, 'epsilon': 0.030041460780038044}. Best is trial 88 with value: 0.3542875001421725.
[I 2024-12-03 19:09:19,971] Trial 1767 finished with value: 1906.8854580050556 and parameters: {'kernel': 'sigmoid', 'C': 96.10025705289635, 'gamma': 0.13255005472915626, 'epsilon': 0.1235973111124421}. Best is trial 88 with value: 0.3542875001421725.
[I 2024-12-03 19:09:20,434] Trial 1768 finished with value: 0.43740340308602793 and parameters: {'kernel': 'rbf', 'C': 96.03119215184952, 'gamma': 0.050669429773034486, 'epsilon': 0.5005243188440924}. Best is trial 88 with value: 0.3542875001421725.
[I 2024-12-03 19:09:22,429] Trial 1769 finished with value: 0.7977230034304874 and parameters: {'kernel': 'linear', 'C': 1.1571186462908167, 'gamma': 0.6750283143439706, 'epsilon': 0.03211084230277856}. Best is trial 88 with value: 0.3542875001421725.
[I 2024-12-03 19:09:22,805] Trial 1770 finished with value: 0.36389381688634587 and parameters: {'kernel': 'rbf', 'C': 95.56653511845686, 'gamma': 0.03690826750826337, 'epsilon': 0.07037366296990162}. Best is trial 88 with value: 0.3542875001421725.
[I 2024-12-03 19:09:24,000] Trial 1771 finished with value: 638.3410154961706 and parameters: {'kernel': 'sigmoid', 'C': 27.985624036643962, 'gamma': 0.21967593347757444, 'epsilon': 0.7048900740882579}. Best is trial 88 with value: 0.3542875001421725.
[I 2024-12-03 19:09:24,839] Trial 1772 finished with value: 0.36608231417629505 and parameters: {'kernel': 'rbf', 'C': 93.64574635655579, 'gamma': 0.03161480112685972, 'epsilon': 0.16020657510254244}. Best is trial 88 with value: 0.3542875001421725.
[I 2024-12-03 19:09:25,713] Trial 1773 finished with value: 0.37694152397889064 and parameters: {'kernel': 'rbf', 'C': 96.44163056116608, 'gamma': 0.017634792225557264, 'epsilon': 0.16321629250498265}. Best is trial 88 with value: 0.3542875001421725.
[I 2024-12-03 19:09:26,752] Trial 1774 finished with value: 0.4183154134045824 and parameters: {'kernel': 'rbf', 'C': 16.148267276637313, 'gamma': 0.03381646270762818, 'epsilon': 0.1368382588242239}. Best is trial 88 with value: 0.3542875001421725.
[I 2024-12-03 19:09:28,677] Trial 1776 finished with value: 0.485359567392248 and parameters: {'kernel': 'rbf', 'C': 3.912879490122917, 'gamma': 0.07803542552799923, 'epsilon': 0.09403424991172268}. Best is trial 88 with value: 0.3542875001421725.
[I 2024-12-03 19:09:30,041] Trial 1777 finished with value: 0.3929777984994334 and parameters: {'kernel': 'rbf', 'C': 93.14059847462893, 'gamma': 0.08803787769806895, 'epsilon': 0.17426594287041733}. Best is trial 88 with value: 0.3542875001421725.
[I 2024-12-03 19:09:31,741] Trial 1778 finished with value: 0.364313750907155 and parameters: {'kernel': 'rbf', 'C': 93.89233263885336, 'gamma': 0.03399510640011257, 'epsilon': 0.11462303683656885}. Best is trial 88 with value: 0.3542875001421725.
[I 2024-12-03 19:09:33,115] Trial 1779 finished with value: 0.387660787539554 and parameters: {'kernel': 'rbf', 'C': 95.4139262072346, 'gamma': 0.012664320185204051, 'epsilon': 0.21902200108734318}. Best is trial 88 with value: 0.3542875001421725.
[I 2024-12-03 19:09:34,608] Trial 1780 finished with value: 0.4188487870157267 and parameters: {'kernel': 'rbf', 'C': 6.878018848678334, 'gamma': 0.020939895639137084, 'epsilon': 0.051247556352769716}. Best is trial 88 with value: 0.3542875001421725.
[I 2024-12-03 19:09:35,756] Trial 1781 finished with value: 0.45710833830229375 and parameters: {'kernel': 'rbf', 'C': 95.14702646464309, 'gamma': 0.05676645843093411, 'epsilon': 0.517944670478581}. Best is trial 88 with value: 0.3542875001421725.
[I 2024-12-03 19:09:37,445] Trial 1782 finished with value: 0.40110375361887163 and parameters: {'kernel': 'rbf', 'C': 19.043015811018837, 'gamma': 0.061666898983196765, 'epsilon': 0.061142635292747695}. Best is trial 88 with value: 0.3542875001421725.
[I 2024-12-03 19:09:39,500] Trial 1783 finished with value: 0.3666067804297125 and parameters: {'kernel': 'rbf', 'C': 97.10118686031751, 'gamma': 0.03434165319652927, 'epsilon': 0.0709697407258796}. Best is trial 88 with value: 0.3542875001421725.
[I 2024-12-03 19:10:36,693] Trial 1775 finished with value: 0.7949833148007884 and parameters: {'kernel': 'linear', 'C': 47.50889990633726, 'gamma': 0.02937095418243098, 'epsilon': 0.001000332316940649}. Best is trial 88 with value: 0.3542875001421725.
[I 2024-12-03 19:11:01,160] Trial 1785 finished with value: 0.8028943627636704 and parameters: {'kernel': 'linear', 'C': 23.243117572736736, 'gamma': 0.09960624740411128, 'epsilon': 0.02919016450441867}. Best is trial 88 with value: 0.3542875001421725.
[I 2024-12-03 19:11:02,754] Trial 1786 finished with value: 0.42308331713595465 and parameters: {'kernel': 'rbf', 'C': 95.40514208179273, 'gamma': 0.12758010456813132, 'epsilon': 0.05764774011666927}. Best is trial 88 with value: 0.3542875001421725.
[I 2024-12-03 19:11:07,241] Trial 1746 finished with value: 0.8147668364422547 and parameters: {'kernel': 'poly', 'C': 1.039917540447133, 'gamma': 0.08394657294571445, 'epsilon': 0.01886522597044568}. Best is trial 88 with value: 0.3542875001421725.
[I 2024-12-03 19:11:09,161] Trial 474 finished with value: 2.0085874733502136 and parameters: {'kernel': 'poly', 'C': 0.007887670416470793, 'gamma': 0.7926174582296382, 'epsilon': 0.0603090809349426}. Best is trial 88 with value: 0.3542875001421725.
[I 2024-12-03 19:11:10,530] Trial 1789 finished with value: 0.6996545287283646 and parameters: {'kernel': 'rbf', 'C': 3.3164830223893857, 'gamma': 0.5157077754137993, 'epsilon': 0.17248828114246623}. Best is trial 88 with value: 0.3542875001421725.
[I 2024-12-03 19:11:11,824] Trial 1790 finished with value: 0.4576203582712703 and parameters: {'kernel': 'rbf', 'C': 5.128641129535728, 'gamma': 0.02498950719953357, 'epsilon': 0.14898010835571138}. Best is trial 88 with value: 0.3542875001421725.
[I 2024-12-03 19:11:13,206] Trial 1791 finished with value: 0.3908250638911078 and parameters: {'kernel': 'rbf', 'C': 22.327436678469958, 'gamma': 0.04697059535131845, 'epsilon': 0.1434312762739433}. Best is trial 88 with value: 0.3542875001421725.
[I 2024-12-03 19:11:14,470] Trial 1792 finished with value: 0.4622257096365758 and parameters: {'kernel': 'rbf', 'C': 19.811829630307027, 'gamma': 0.11148052910238099, 'epsilon': 0.2611893133206599}. Best is trial 88 with value: 0.3542875001421725.
[I 2024-12-03 19:11:16,569] Trial 1793 finished with value: 0.4221039996914739 and parameters: {'kernel': 'rbf', 'C': 24.922150873553928, 'gamma': 0.006722920785205817, 'epsilon': 0.1909009902374753}. Best is trial 88 with value: 0.3542875001421725.
[I 2024-12-03 19:11:18,118] Trial 1794 finished with value: 0.42125165752228816 and parameters: {'kernel': 'rbf', 'C': 20.525827422497734, 'gamma': 0.02762695897371149, 'epsilon': 0.07487501828956833}. Best is trial 88 with value: 0.3542875001421725.
[I 2024-12-03 19:11:22,930] Trial 1787 finished with value: 0.7824298084492457 and parameters: {'kernel': 'linear', 'C': 22.477689120416404, 'gamma': 0.006031208829946797, 'epsilon': 0.13982793196354384}. Best is trial 88 with value: 0.3542875001421725.
[I 2024-12-03 19:11:24,133] Trial 1796 finished with value: 0.5293702829609167 and parameters: {'kernel': 'rbf', 'C': 19.986914954192212, 'gamma': 0.13774671440527844, 'epsilon': 0.37342345128349214}. Best is trial 88 with value: 0.3542875001421725.
[I 2024-12-03 19:11:25,622] Trial 1797 finished with value: 0.6381238593900547 and parameters: {'kernel': 'rbf', 'C': 24.42739138663724, 'gamma': 0.4050105777358063, 'epsilon': 0.08565749473790851}. Best is trial 88 with value: 0.3542875001421725.
[I 2024-12-03 19:13:25,176] Trial 693 finished with value: 2.1875839188256654 and parameters: {'kernel': 'poly', 'C': 97.23922556898606, 'gamma': 0.03846577619885135, 'epsilon': 0.013064149384267544}. Best is trial 88 with value: 0.3542875001421725.
[I 2024-12-03 19:13:26,689] Trial 1799 finished with value: 0.37423412274310625 and parameters: {'kernel': 'rbf', 'C': 96.8656650220612, 'gamma': 0.06643052533992985, 'epsilon': 0.1371960003770481}. Best is trial 88 with value: 0.3542875001421725.
[I 2024-12-03 19:13:27,952] Trial 1800 finished with value: 0.3760203267541451 and parameters: {'kernel': 'rbf', 'C': 90.15131631432742, 'gamma': 0.01824516001930203, 'epsilon': 0.3473052821319397}. Best is trial 88 with value: 0.3542875001421725.
[I 2024-12-03 19:13:29,468] Trial 1801 finished with value: 0.4036619062521791 and parameters: {'kernel': 'rbf', 'C': 18.955765509914176, 'gamma': 0.05365503856792852, 'epsilon': 0.08064097038571097}. Best is trial 88 with value: 0.3542875001421725.
[I 2024-12-03 19:14:08,584] Trial 1795 finished with value: 0.8016368157209419 and parameters: {'kernel': 'linear', 'C': 89.99179555175108, 'gamma': 0.09631962543088414, 'epsilon': 0.05543606569476756}. Best is trial 88 with value: 0.3542875001421725.
[I 2024-12-03 19:14:10,166] Trial 1803 finished with value: 0.4306195152362366 and parameters: {'kernel': 'rbf', 'C': 25.88230795346712, 'gamma': 0.015614496435619313, 'epsilon': 0.14379417289427893}. Best is trial 88 with value: 0.3542875001421725.
[I 2024-12-03 19:14:11,930] Trial 1804 finished with value: 0.39077199343020197 and parameters: {'kernel': 'rbf', 'C': 97.50362357470843, 'gamma': 0.09233778034217346, 'epsilon': 0.10690450777631161}. Best is trial 88 with value: 0.3542875001421725.
[I 2024-12-03 19:14:13,537] Trial 1805 finished with value: 0.36056033554880756 and parameters: {'kernel': 'rbf', 'C': 97.86586527897323, 'gamma': 0.05312358465080966, 'epsilon': 0.17005023541830833}. Best is trial 88 with value: 0.3542875001421725.
[I 2024-12-03 19:14:14,821] Trial 1806 finished with value: 0.3730178675187985 and parameters: {'kernel': 'rbf', 'C': 95.11405822590287, 'gamma': 0.06511474607696306, 'epsilon': 0.13131759649038488}. Best is trial 88 with value: 0.3542875001421725.
[I 2024-12-03 19:14:30,509] Trial 1807 finished with value: 0.7894091597463808 and parameters: {'kernel': 'linear', 'C': 10.105269525228259, 'gamma': 0.00034904264827450215, 'epsilon': 0.09685041139822115}. Best is trial 88 with value: 0.3542875001421725.
[I 2024-12-03 19:14:35,028] Trial 1808 finished with value: 0.7587662317734961 and parameters: {'kernel': 'linear', 'C': 3.185429132417574, 'gamma': 0.00010673053231418262, 'epsilon': 0.22700635098585278}. Best is trial 88 with value: 0.3542875001421725.
[I 2024-12-03 19:14:36,805] Trial 1809 finished with value: 0.5344860436519157 and parameters: {'kernel': 'rbf', 'C': 97.74051327480952, 'gamma': 0.23431715695303124, 'epsilon': 0.058913185965078455}. Best is trial 88 with value: 0.3542875001421725.
[I 2024-12-03 19:14:38,192] Trial 1810 finished with value: 0.4166328894736909 and parameters: {'kernel': 'rbf', 'C': 15.9004746885234, 'gamma': 0.042581222477394716, 'epsilon': 0.35926779766752104}. Best is trial 88 with value: 0.3542875001421725.
[I 2024-12-03 19:14:38,551] Trial 1788 finished with value: 2.9328341441227845 and parameters: {'kernel': 'poly', 'C': 99.2131384296803, 'gamma': 0.04708474292254731, 'epsilon': 0.21694135015090787}. Best is trial 88 with value: 0.3542875001421725.
[I 2024-12-03 19:14:39,894] Trial 1811 finished with value: 0.3996776880887427 and parameters: {'kernel': 'rbf', 'C': 21.01785745276028, 'gamma': 0.03373547666589368, 'epsilon': 0.22864826123799645}. Best is trial 88 with value: 0.3542875001421725.
[I 2024-12-03 19:14:41,009] Trial 1812 finished with value: 0.41245531630850524 and parameters: {'kernel': 'rbf', 'C': 23.331919027564854, 'gamma': 0.03464592104327202, 'epsilon': 0.06428643613310751}. Best is trial 88 with value: 0.3542875001421725.
[I 2024-12-03 19:14:41,954] Trial 1813 finished with value: 0.4175233435612774 and parameters: {'kernel': 'rbf', 'C': 20.09501606442939, 'gamma': 0.00445935790280828, 'epsilon': 0.10888775660343876}. Best is trial 88 with value: 0.3542875001421725.
[I 2024-12-03 19:14:42,942] Trial 1814 finished with value: 885.288803801871 and parameters: {'kernel': 'sigmoid', 'C': 92.7601762747042, 'gamma': 0.0074057124267361395, 'epsilon': 0.16724872359045428}. Best is trial 88 with value: 0.3542875001421725.
[I 2024-12-03 19:14:43,428] Trial 1815 finished with value: 1.3264807607620637 and parameters: {'kernel': 'poly', 'C': 0.07016128650476224, 'gamma': 0.0026196808417829442, 'epsilon': 0.9640665499681983}. Best is trial 88 with value: 0.3542875001421725.
[I 2024-12-03 19:14:45,419] Trial 1816 finished with value: 0.43138194604722185 and parameters: {'kernel': 'rbf', 'C': 22.262268774221734, 'gamma': 0.11046784733849324, 'epsilon': 0.15746446978946965}. Best is trial 88 with value: 0.3542875001421725.
[I 2024-12-03 19:14:47,210] Trial 1818 finished with value: 0.39925367690183056 and parameters: {'kernel': 'rbf', 'C': 15.525803752302366, 'gamma': 0.009177111267297275, 'epsilon': 0.05837535505283395}. Best is trial 88 with value: 0.3542875001421725.
[I 2024-12-03 19:14:48,982] Trial 1819 finished with value: 0.405134208315859 and parameters: {'kernel': 'rbf', 'C': 18.121260966763476, 'gamma': 0.05491927783607546, 'epsilon': 0.08901139559416842}. Best is trial 88 with value: 0.3542875001421725.
[I 2024-12-03 19:14:50,662] Trial 1820 finished with value: 1.0560048296651714 and parameters: {'kernel': 'rbf', 'C': 0.0012695700640382671, 'gamma': 0.12786359093140184, 'epsilon': 0.010608307383690698}. Best is trial 88 with value: 0.3542875001421725.
[I 2024-12-03 19:14:53,193] Trial 1821 finished with value: 0.3842122814494342 and parameters: {'kernel': 'rbf', 'C': 94.9563601906852, 'gamma': 0.057415907692720626, 'epsilon': 0.019606549007482255}. Best is trial 88 with value: 0.3542875001421725.
[I 2024-12-03 19:15:34,464] Trial 1817 finished with value: 0.8108215963644922 and parameters: {'kernel': 'poly', 'C': 12.040179784015514, 'gamma': 0.04250279194474979, 'epsilon': 0.1635225827735789}. Best is trial 88 with value: 0.3542875001421725.
[I 2024-12-03 19:15:36,936] Trial 1823 finished with value: 0.3797211047173907 and parameters: {'kernel': 'rbf', 'C': 92.7351370485258, 'gamma': 0.0689463333979835, 'epsilon': 0.055509983411763636}. Best is trial 88 with value: 0.3542875001421725.
[I 2024-12-03 19:15:38,462] Trial 1824 finished with value: 0.804609133515584 and parameters: {'kernel': 'linear', 'C': 0.1129264975253466, 'gamma': 0.0091470781004273, 'epsilon': 0.8310113552889611}. Best is trial 88 with value: 0.3542875001421725.
[I 2024-12-03 19:15:40,595] Trial 1825 finished with value: 0.4115480448338706 and parameters: {'kernel': 'rbf', 'C': 92.36771511726502, 'gamma': 0.010045794302112351, 'epsilon': 0.1328314407856347}. Best is trial 88 with value: 0.3542875001421725.
[I 2024-12-03 19:15:42,626] Trial 1826 finished with value: 2.7331339259138483 and parameters: {'kernel': 'sigmoid', 'C': 0.06539105019967827, 'gamma': 0.7109348191032793, 'epsilon': 0.006992878835065684}. Best is trial 88 with value: 0.3542875001421725.
[I 2024-12-03 19:15:44,140] Trial 1827 finished with value: 0.36896373429771673 and parameters: {'kernel': 'rbf', 'C': 98.26631276895391, 'gamma': 0.027079560348464437, 'epsilon': 0.16434097092148794}. Best is trial 88 with value: 0.3542875001421725.
[I 2024-12-03 19:15:45,447] Trial 1828 finished with value: 0.39032982505961283 and parameters: {'kernel': 'rbf', 'C': 92.66698157177088, 'gamma': 0.07476513533736945, 'epsilon': 0.23559469110097506}. Best is trial 88 with value: 0.3542875001421725.
[I 2024-12-03 19:15:45,601] Trial 1822 finished with value: 0.7172878371350451 and parameters: {'kernel': 'linear', 'C': 75.72414698828257, 'gamma': 0.02233557093341576, 'epsilon': 0.3009067123489371}. Best is trial 88 with value: 0.3542875001421725.
[I 2024-12-03 19:15:46,696] Trial 1829 finished with value: 0.4204770549681937 and parameters: {'kernel': 'rbf', 'C': 94.06589243706685, 'gamma': 0.021718958358059537, 'epsilon': 0.5793880379161441}. Best is trial 88 with value: 0.3542875001421725.
