[I 2024-12-04 13:01:43,818] Trial 2357 finished with value: 0.5713556358186779 and parameters: {'n_estimators': 773, 'learning_rate': 0.014985534365324439, 'max_depth': 4, 'min_samples_split': 11, 'min_samples_leaf': 10, 'subsample': 0.7663873179085567, 'max_features': None}. Best is trial 1454 with value: 0.30763307678022894.
[I 2024-12-04 13:01:43,995] Trial 2347 finished with value: 0.46736092428863135 and parameters: {'n_estimators': 1372, 'learning_rate': 0.0636647895181567, 'max_depth': 6, 'min_samples_split': 3, 'min_samples_leaf': 3, 'subsample': 0.8309010007360106, 'max_features': 'log2'}. Best is trial 1454 with value: 0.30763307678022894.
[I 2024-12-04 13:01:48,996] Trial 2343 finished with value: 0.3453088356326701 and parameters: {'n_estimators': 1470, 'learning_rate': 0.032940842267267574, 'max_depth': 5, 'min_samples_split': 2, 'min_samples_leaf': 2, 'subsample': 0.8898900402138745, 'max_features': None}. Best is trial 1454 with value: 0.30763307678022894.
[I 2024-12-04 13:01:49,778] Trial 2350 finished with value: 0.3944921071967811 and parameters: {'n_estimators': 1201, 'learning_rate': 0.043481965188517956, 'max_depth': 6, 'min_samples_split': 4, 'min_samples_leaf': 1, 'subsample': 0.8222314210308619, 'max_features': None}. Best is trial 1454 with value: 0.30763307678022894.
[I 2024-12-04 13:01:50,318] Trial 2348 finished with value: 0.32863031902459044 and parameters: {'n_estimators': 1370, 'learning_rate': 0.07047193777080189, 'max_depth': 4, 'min_samples_split': 5, 'min_samples_leaf': 2, 'subsample': 0.7500285633642275, 'max_features': None}. Best is trial 1454 with value: 0.30763307678022894.
[I 2024-12-04 13:01:52,881] Trial 2345 finished with value: 0.3911278615037309 and parameters: {'n_estimators': 1489, 'learning_rate': 0.058976339735107935, 'max_depth': 6, 'min_samples_split': 2, 'min_samples_leaf': 3, 'subsample': 0.9711994349557158, 'max_features': None}. Best is trial 1454 with value: 0.30763307678022894.
[I 2024-12-04 13:01:55,141] Trial 2349 finished with value: 0.33417660167961244 and parameters: {'n_estimators': 1427, 'learning_rate': 0.0640674605524368, 'max_depth': 6, 'min_samples_split': 7, 'min_samples_leaf': 2, 'subsample': 0.8038651147879634, 'max_features': None}. Best is trial 1454 with value: 0.30763307678022894.
[I 2024-12-04 13:01:56,063] Trial 2346 finished with value: 0.3373125902553852 and parameters: {'n_estimators': 1483, 'learning_rate': 0.06207503908662977, 'max_depth': 8, 'min_samples_split': 4, 'min_samples_leaf': 2, 'subsample': 0.8414987995255528, 'max_features': None}. Best is trial 1454 with value: 0.30763307678022894.
[I 2024-12-04 13:01:56,758] Trial 2355 finished with value: 0.37174856240004 and parameters: {'n_estimators': 1223, 'learning_rate': 0.07870791394712136, 'max_depth': 6, 'min_samples_split': 2, 'min_samples_leaf': 1, 'subsample': 0.7589338903699293, 'max_features': None}. Best is trial 1454 with value: 0.30763307678022894.
[I 2024-12-04 13:02:00,034] Trial 2356 finished with value: 0.34792154841709855 and parameters: {'n_estimators': 1313, 'learning_rate': 0.047757086988861844, 'max_depth': 4, 'min_samples_split': 2, 'min_samples_leaf': 2, 'subsample': 0.9021834786098254, 'max_features': None}. Best is trial 1454 with value: 0.30763307678022894.
[I 2024-12-04 13:02:00,152] Trial 2351 finished with value: 0.3783347599193928 and parameters: {'n_estimators': 1480, 'learning_rate': 0.07676288484726669, 'max_depth': 5, 'min_samples_split': 6, 'min_samples_leaf': 4, 'subsample': 0.7644880150838806, 'max_features': None}. Best is trial 1454 with value: 0.30763307678022894.
[I 2024-12-04 13:02:00,202] Trial 2353 finished with value: 0.32064259005570445 and parameters: {'n_estimators': 1402, 'learning_rate': 0.09794907345906678, 'max_depth': 6, 'min_samples_split': 7, 'min_samples_leaf': 2, 'subsample': 0.8256102055666245, 'max_features': None}. Best is trial 1454 with value: 0.30763307678022894.
[I 2024-12-04 13:02:02,494] Trial 2352 finished with value: 0.33552100327739504 and parameters: {'n_estimators': 1388, 'learning_rate': 0.09035585728202136, 'max_depth': 7, 'min_samples_split': 6, 'min_samples_leaf': 2, 'subsample': 0.8389517116258066, 'max_features': None}. Best is trial 1454 with value: 0.30763307678022894.
[I 2024-12-04 13:02:04,104] Trial 2371 finished with value: 0.6527129407797612 and parameters: {'n_estimators': 794, 'learning_rate': 0.09782449238450858, 'max_depth': 9, 'min_samples_split': 11, 'min_samples_leaf': 9, 'subsample': 0.6453437015206687, 'max_features': 'log2'}. Best is trial 1454 with value: 0.30763307678022894.
[I 2024-12-04 13:02:04,107] Trial 2354 finished with value: 0.38068525180012425 and parameters: {'n_estimators': 1493, 'learning_rate': 0.07403620455442583, 'max_depth': 5, 'min_samples_split': 3, 'min_samples_leaf': 5, 'subsample': 0.8235558933653083, 'max_features': None}. Best is trial 1454 with value: 0.30763307678022894.
[I 2024-12-04 13:02:05,273] Trial 2358 finished with value: 0.32738463526550005 and parameters: {'n_estimators': 1395, 'learning_rate': 0.06557978367826016, 'max_depth': 5, 'min_samples_split': 6, 'min_samples_leaf': 2, 'subsample': 0.8391520307563055, 'max_features': None}. Best is trial 1454 with value: 0.30763307678022894.
[I 2024-12-04 13:02:05,321] Trial 2363 finished with value: 0.4340894004866969 and parameters: {'n_estimators': 1384, 'learning_rate': 0.020607154066391083, 'max_depth': 9, 'min_samples_split': 13, 'min_samples_leaf': 2, 'subsample': 0.9019594580138524, 'max_features': 'log2'}. Best is trial 1454 with value: 0.30763307678022894.
[I 2024-12-04 13:02:09,603] Trial 2359 finished with value: 0.3992358445652337 and parameters: {'n_estimators': 1432, 'learning_rate': 0.08838386990786287, 'max_depth': 7, 'min_samples_split': 3, 'min_samples_leaf': 1, 'subsample': 0.7859184035112107, 'max_features': None}. Best is trial 1454 with value: 0.30763307678022894.
[I 2024-12-04 13:02:09,650] Trial 2364 finished with value: 0.44606299826052137 and parameters: {'n_estimators': 1357, 'learning_rate': 0.04394578077537548, 'max_depth': 4, 'min_samples_split': 6, 'min_samples_leaf': 3, 'subsample': 0.8402225241090552, 'max_features': 'sqrt'}. Best is trial 1454 with value: 0.30763307678022894.
[I 2024-12-04 13:02:11,420] Trial 2373 finished with value: 0.514186559058223 and parameters: {'n_estimators': 1009, 'learning_rate': 0.016399259162958316, 'max_depth': 3, 'min_samples_split': 16, 'min_samples_leaf': 1, 'subsample': 0.8393527080101193, 'max_features': 'sqrt'}. Best is trial 1454 with value: 0.30763307678022894.
[I 2024-12-04 13:02:12,954] Trial 2362 finished with value: 0.3136450589101114 and parameters: {'n_estimators': 1370, 'learning_rate': 0.06079156967674603, 'max_depth': 7, 'min_samples_split': 5, 'min_samples_leaf': 2, 'subsample': 0.8467811177636125, 'max_features': None}. Best is trial 1454 with value: 0.30763307678022894.
[I 2024-12-04 13:02:15,587] Trial 2361 finished with value: 0.4034997276128952 and parameters: {'n_estimators': 1500, 'learning_rate': 0.076828187533593, 'max_depth': 6, 'min_samples_split': 6, 'min_samples_leaf': 1, 'subsample': 0.8660488404658591, 'max_features': None}. Best is trial 1454 with value: 0.30763307678022894.
[I 2024-12-04 13:02:16,393] Trial 2365 finished with value: 0.33087870609001735 and parameters: {'n_estimators': 1311, 'learning_rate': 0.0653349676320486, 'max_depth': 5, 'min_samples_split': 5, 'min_samples_leaf': 2, 'subsample': 0.8651604921719165, 'max_features': None}. Best is trial 1454 with value: 0.30763307678022894.
[I 2024-12-04 13:02:18,467] Trial 2366 finished with value: 0.3237903399017323 and parameters: {'n_estimators': 1370, 'learning_rate': 0.08043310920854252, 'max_depth': 5, 'min_samples_split': 5, 'min_samples_leaf': 2, 'subsample': 0.8268532766210542, 'max_features': None}. Best is trial 1454 with value: 0.30763307678022894.
[I 2024-12-04 13:02:20,876] Trial 2390 finished with value: 0.4435932077819794 and parameters: {'n_estimators': 368, 'learning_rate': 0.05184625850957826, 'max_depth': 10, 'min_samples_split': 4, 'min_samples_leaf': 5, 'subsample': 0.9911350851946521, 'max_features': 'sqrt'}. Best is trial 1454 with value: 0.30763307678022894.
[I 2024-12-04 13:02:21,739] Trial 2367 finished with value: 0.3736439169635773 and parameters: {'n_estimators': 1422, 'learning_rate': 0.09956335844860845, 'max_depth': 5, 'min_samples_split': 3, 'min_samples_leaf': 4, 'subsample': 0.8948751881627544, 'max_features': None}. Best is trial 1454 with value: 0.30763307678022894.
[I 2024-12-04 13:02:23,465] Trial 2370 finished with value: 0.32723073415340237 and parameters: {'n_estimators': 1250, 'learning_rate': 0.0967669847101286, 'max_depth': 7, 'min_samples_split': 2, 'min_samples_leaf': 2, 'subsample': 0.854082657127582, 'max_features': None}. Best is trial 1454 with value: 0.30763307678022894.
[I 2024-12-04 13:02:26,299] Trial 2369 finished with value: 0.399415984570171 and parameters: {'n_estimators': 1413, 'learning_rate': 0.06074072921678403, 'max_depth': 5, 'min_samples_split': 6, 'min_samples_leaf': 3, 'subsample': 0.8805085383027837, 'max_features': None}. Best is trial 1454 with value: 0.30763307678022894.
[I 2024-12-04 13:02:26,627] Trial 2374 finished with value: 0.380146573199392 and parameters: {'n_estimators': 1225, 'learning_rate': 0.0703519473101873, 'max_depth': 6, 'min_samples_split': 3, 'min_samples_leaf': 5, 'subsample': 0.8826612260964747, 'max_features': None}. Best is trial 1454 with value: 0.30763307678022894.
[I 2024-12-04 13:02:26,881] Trial 2368 finished with value: 0.3837263849059114 and parameters: {'n_estimators': 1471, 'learning_rate': 0.058500526116183074, 'max_depth': 6, 'min_samples_split': 5, 'min_samples_leaf': 3, 'subsample': 0.8311335698643896, 'max_features': None}. Best is trial 1454 with value: 0.30763307678022894.
[I 2024-12-04 13:02:28,745] Trial 2372 finished with value: 0.3480073234208286 and parameters: {'n_estimators': 1461, 'learning_rate': 0.06857578307185959, 'max_depth': 3, 'min_samples_split': 2, 'min_samples_leaf': 2, 'subsample': 0.8780417962517132, 'max_features': None}. Best is trial 1454 with value: 0.30763307678022894.
[I 2024-12-04 13:02:29,717] Trial 2376 finished with value: 0.40485114231637365 and parameters: {'n_estimators': 1383, 'learning_rate': 0.07849373979357382, 'max_depth': 6, 'min_samples_split': 2, 'min_samples_leaf': 4, 'subsample': 0.8087312090282714, 'max_features': 'sqrt'}. Best is trial 1454 with value: 0.30763307678022894.
[I 2024-12-04 13:02:31,588] Trial 2375 finished with value: 0.38302278170850884 and parameters: {'n_estimators': 1327, 'learning_rate': 0.07850332810350251, 'max_depth': 4, 'min_samples_split': 3, 'min_samples_leaf': 4, 'subsample': 0.8065167022740097, 'max_features': None}. Best is trial 1454 with value: 0.30763307678022894.
[I 2024-12-04 13:02:32,684] Trial 2395 finished with value: 0.4805178088890084 and parameters: {'n_estimators': 617, 'learning_rate': 0.049944274871944645, 'max_depth': 7, 'min_samples_split': 20, 'min_samples_leaf': 8, 'subsample': 0.9949254225912536, 'max_features': 'sqrt'}. Best is trial 1454 with value: 0.30763307678022894.
[I 2024-12-04 13:02:37,043] Trial 2379 finished with value: 0.32587669719646106 and parameters: {'n_estimators': 1268, 'learning_rate': 0.06894243964897852, 'max_depth': 5, 'min_samples_split': 2, 'min_samples_leaf': 2, 'subsample': 0.8620830396072724, 'max_features': None}. Best is trial 1454 with value: 0.30763307678022894.
[I 2024-12-04 13:02:37,124] Trial 2378 finished with value: 0.3940435221986139 and parameters: {'n_estimators': 1383, 'learning_rate': 0.09846728236275983, 'max_depth': 5, 'min_samples_split': 2, 'min_samples_leaf': 3, 'subsample': 0.9142532111518372, 'max_features': None}. Best is trial 1454 with value: 0.30763307678022894.
[I 2024-12-04 13:02:37,506] Trial 2409 finished with value: 1.0625107932898394 and parameters: {'n_estimators': 105, 'learning_rate': 0.01349285861882364, 'max_depth': 9, 'min_samples_split': 3, 'min_samples_leaf': 9, 'subsample': 0.983205652843644, 'max_features': 'log2'}. Best is trial 1454 with value: 0.30763307678022894.
[I 2024-12-04 13:02:39,809] Trial 2397 finished with value: 0.6454719340392215 and parameters: {'n_estimators': 817, 'learning_rate': 0.010133407839818894, 'max_depth': 7, 'min_samples_split': 20, 'min_samples_leaf': 1, 'subsample': 0.9538143121157806, 'max_features': 'log2'}. Best is trial 1454 with value: 0.30763307678022894.
[I 2024-12-04 13:02:40,879] Trial 2377 finished with value: 0.3920130084227678 and parameters: {'n_estimators': 1459, 'learning_rate': 0.03626899463380813, 'max_depth': 6, 'min_samples_split': 2, 'min_samples_leaf': 3, 'subsample': 0.8385372035127846, 'max_features': None}. Best is trial 1454 with value: 0.30763307678022894.
[I 2024-12-04 13:02:43,354] Trial 2380 finished with value: 0.370365858715902 and parameters: {'n_estimators': 1358, 'learning_rate': 0.08078651564556671, 'max_depth': 7, 'min_samples_split': 2, 'min_samples_leaf': 4, 'subsample': 0.8786916435182972, 'max_features': None}. Best is trial 1454 with value: 0.30763307678022894.
[I 2024-12-04 13:02:43,526] Trial 2382 finished with value: 0.40794397831962464 and parameters: {'n_estimators': 1410, 'learning_rate': 0.09187592476927314, 'max_depth': 4, 'min_samples_split': 2, 'min_samples_leaf': 3, 'subsample': 0.957044416269729, 'max_features': None}. Best is trial 1454 with value: 0.30763307678022894.
[I 2024-12-04 13:02:43,979] Trial 2403 finished with value: 0.5887437777480464 and parameters: {'n_estimators': 597, 'learning_rate': 0.08763020827648255, 'max_depth': 9, 'min_samples_split': 15, 'min_samples_leaf': 9, 'subsample': 0.7895296157625474, 'max_features': 'sqrt'}. Best is trial 1454 with value: 0.30763307678022894.
[I 2024-12-04 13:02:44,891] Trial 2381 finished with value: 0.33923839883885937 and parameters: {'n_estimators': 1418, 'learning_rate': 0.09899262433444816, 'max_depth': 5, 'min_samples_split': 2, 'min_samples_leaf': 2, 'subsample': 0.8682212222556622, 'max_features': None}. Best is trial 1454 with value: 0.30763307678022894.
[I 2024-12-04 13:02:45,014] Trial 2386 finished with value: 0.3756018490686264 and parameters: {'n_estimators': 1039, 'learning_rate': 0.0553559395425879, 'max_depth': 8, 'min_samples_split': 2, 'min_samples_leaf': 1, 'subsample': 0.8502408471303541, 'max_features': None}. Best is trial 1454 with value: 0.30763307678022894.
[I 2024-12-04 13:02:47,660] Trial 2384 finished with value: 0.34421972279004454 and parameters: {'n_estimators': 1432, 'learning_rate': 0.08789251622519643, 'max_depth': 3, 'min_samples_split': 4, 'min_samples_leaf': 2, 'subsample': 0.8174170875574344, 'max_features': None}. Best is trial 1454 with value: 0.30763307678022894.
[I 2024-12-04 13:02:49,355] Trial 2413 finished with value: 0.44058881921355586 and parameters: {'n_estimators': 223, 'learning_rate': 0.016885374360679644, 'max_depth': 9, 'min_samples_split': 17, 'min_samples_leaf': 4, 'subsample': 0.6413883752115571, 'max_features': None}. Best is trial 1454 with value: 0.30763307678022894.
[I 2024-12-04 13:02:49,460] Trial 2385 finished with value: 0.3178211107990505 and parameters: {'n_estimators': 1351, 'learning_rate': 0.07709001179722472, 'max_depth': 5, 'min_samples_split': 2, 'min_samples_leaf': 2, 'subsample': 0.8338949270971877, 'max_features': None}. Best is trial 1454 with value: 0.30763307678022894.
[I 2024-12-04 13:02:50,656] Trial 2396 finished with value: 0.4005083677756457 and parameters: {'n_estimators': 1147, 'learning_rate': 0.08214045727511, 'max_depth': 4, 'min_samples_split': 3, 'min_samples_leaf': 1, 'subsample': 0.7810169979555319, 'max_features': 'sqrt'}. Best is trial 1454 with value: 0.30763307678022894.
[I 2024-12-04 13:02:52,037] Trial 2387 finished with value: 0.4192132820813759 and parameters: {'n_estimators': 1362, 'learning_rate': 0.07259327346854977, 'max_depth': 4, 'min_samples_split': 2, 'min_samples_leaf': 1, 'subsample': 0.9261305184441673, 'max_features': None}. Best is trial 1454 with value: 0.30763307678022894.
[I 2024-12-04 13:02:53,187] Trial 2383 finished with value: 0.324661597063171 and parameters: {'n_estimators': 1494, 'learning_rate': 0.07104156885978344, 'max_depth': 6, 'min_samples_split': 4, 'min_samples_leaf': 2, 'subsample': 0.9162163662447202, 'max_features': None}. Best is trial 1454 with value: 0.30763307678022894.
[I 2024-12-04 13:02:58,198] Trial 2392 finished with value: 0.32722424251593524 and parameters: {'n_estimators': 1276, 'learning_rate': 0.09004048687114274, 'max_depth': 7, 'min_samples_split': 2, 'min_samples_leaf': 2, 'subsample': 0.8913861709934694, 'max_features': None}. Best is trial 1454 with value: 0.30763307678022894.
[I 2024-12-04 13:02:58,918] Trial 2389 finished with value: 0.41858082064134666 and parameters: {'n_estimators': 1449, 'learning_rate': 0.09151796531405038, 'max_depth': 5, 'min_samples_split': 3, 'min_samples_leaf': 1, 'subsample': 0.9289100152754252, 'max_features': None}. Best is trial 1454 with value: 0.30763307678022894.
[I 2024-12-04 13:03:00,332] Trial 2411 finished with value: 0.41443996686379514 and parameters: {'n_estimators': 636, 'learning_rate': 0.08016840954373909, 'max_depth': 7, 'min_samples_split': 7, 'min_samples_leaf': 4, 'subsample': 0.6970561892696392, 'max_features': 'sqrt'}. Best is trial 1454 with value: 0.30763307678022894.
[I 2024-12-04 13:03:00,464] Trial 2388 finished with value: 0.3330183015580703 and parameters: {'n_estimators': 1499, 'learning_rate': 0.07372469871025687, 'max_depth': 5, 'min_samples_split': 5, 'min_samples_leaf': 2, 'subsample': 0.9280785987464597, 'max_features': None}. Best is trial 1454 with value: 0.30763307678022894.
[I 2024-12-04 13:03:01,158] Trial 2391 finished with value: 0.3820018448033995 and parameters: {'n_estimators': 1411, 'learning_rate': 0.07258331171629301, 'max_depth': 6, 'min_samples_split': 5, 'min_samples_leaf': 3, 'subsample': 0.8449196637120172, 'max_features': None}. Best is trial 1454 with value: 0.30763307678022894.
[I 2024-12-04 13:03:03,409] Trial 2393 finished with value: 0.40501960064633763 and parameters: {'n_estimators': 1429, 'learning_rate': 0.08657598542695591, 'max_depth': 7, 'min_samples_split': 4, 'min_samples_leaf': 1, 'subsample': 0.8320879977497048, 'max_features': None}. Best is trial 1454 with value: 0.30763307678022894.
[I 2024-12-04 13:03:04,089] Trial 2394 finished with value: 0.3831685704096526 and parameters: {'n_estimators': 1484, 'learning_rate': 0.0666442693156965, 'max_depth': 4, 'min_samples_split': 2, 'min_samples_leaf': 1, 'subsample': 0.7848134944836069, 'max_features': None}. Best is trial 1454 with value: 0.30763307678022894.
[I 2024-12-04 13:03:07,142] Trial 2399 finished with value: 0.3236242178085351 and parameters: {'n_estimators': 1308, 'learning_rate': 0.05123817936761737, 'max_depth': 6, 'min_samples_split': 2, 'min_samples_leaf': 2, 'subsample': 0.8395350751649848, 'max_features': None}. Best is trial 1454 with value: 0.30763307678022894.
[I 2024-12-04 13:03:08,205] Trial 2398 finished with value: 0.3303981580609338 and parameters: {'n_estimators': 1421, 'learning_rate': 0.07785088604878092, 'max_depth': 4, 'min_samples_split': 2, 'min_samples_leaf': 2, 'subsample': 0.8991168768567943, 'max_features': None}. Best is trial 1454 with value: 0.30763307678022894.
[I 2024-12-04 13:03:10,322] Trial 2402 finished with value: 0.390765222195609 and parameters: {'n_estimators': 1202, 'learning_rate': 0.05157543277410244, 'max_depth': 8, 'min_samples_split': 6, 'min_samples_leaf': 1, 'subsample': 0.8137301453246127, 'max_features': None}. Best is trial 1454 with value: 0.30763307678022894.
[I 2024-12-04 13:03:10,960] Trial 2406 finished with value: 0.39924031982452435 and parameters: {'n_estimators': 1081, 'learning_rate': 0.05773346550483984, 'max_depth': 5, 'min_samples_split': 5, 'min_samples_leaf': 3, 'subsample': 0.8431834533208051, 'max_features': None}. Best is trial 1454 with value: 0.30763307678022894.
[I 2024-12-04 13:03:11,675] Trial 2401 finished with value: 0.3335695597899394 and parameters: {'n_estimators': 1255, 'learning_rate': 0.055936473959179174, 'max_depth': 8, 'min_samples_split': 4, 'min_samples_leaf': 2, 'subsample': 0.8747919817800776, 'max_features': None}. Best is trial 1454 with value: 0.30763307678022894.
[I 2024-12-04 13:03:11,840] Trial 2405 finished with value: 0.3211413004580854 and parameters: {'n_estimators': 1092, 'learning_rate': 0.06930770460493195, 'max_depth': 6, 'min_samples_split': 3, 'min_samples_leaf': 2, 'subsample': 0.8151679829850269, 'max_features': None}. Best is trial 1454 with value: 0.30763307678022894.
[I 2024-12-04 13:03:11,842] Trial 2425 finished with value: 0.618986346114133 and parameters: {'n_estimators': 505, 'learning_rate': 0.06811715501067653, 'max_depth': 3, 'min_samples_split': 3, 'min_samples_leaf': 10, 'subsample': 0.8735435409131058, 'max_features': 'sqrt'}. Best is trial 1454 with value: 0.30763307678022894.
[I 2024-12-04 13:03:12,954] Trial 2430 finished with value: 0.45522244802622736 and parameters: {'n_estimators': 197, 'learning_rate': 0.029715201061777878, 'max_depth': 6, 'min_samples_split': 5, 'min_samples_leaf': 6, 'subsample': 0.8481839145876362, 'max_features': None}. Best is trial 1454 with value: 0.30763307678022894.
[I 2024-12-04 13:03:14,192] Trial 2400 finished with value: 0.3869867542294464 and parameters: {'n_estimators': 1416, 'learning_rate': 0.09101616364566369, 'max_depth': 7, 'min_samples_split': 4, 'min_samples_leaf': 3, 'subsample': 0.8863533795293055, 'max_features': None}. Best is trial 1454 with value: 0.30763307678022894.
[I 2024-12-04 13:03:18,461] Trial 2418 finished with value: 0.4244790066725309 and parameters: {'n_estimators': 954, 'learning_rate': 0.08456670285694988, 'max_depth': 5, 'min_samples_split': 2, 'min_samples_leaf': 5, 'subsample': 0.8191803363580413, 'max_features': 'sqrt'}. Best is trial 1454 with value: 0.30763307678022894.
