[I 2024-12-04 12:17:09,898] Trial 128 finished with value: 0.3725637695138596 and parameters: {'n_estimators': 992, 'learning_rate': 0.08040500806070867, 'max_depth': 9, 'min_samples_split': 5, 'min_samples_leaf': 2, 'subsample': 0.9035967114807192, 'max_features': 'sqrt'}. Best is trial 75 with value: 0.3356123167576939.
[I 2024-12-04 12:17:10,317] Trial 127 finished with value: 0.3928079625711443 and parameters: {'n_estimators': 994, 'learning_rate': 0.08817504748493929, 'max_depth': 11, 'min_samples_split': 20, 'min_samples_leaf': 4, 'subsample': 0.8718976857642884, 'max_features': 'sqrt'}. Best is trial 75 with value: 0.3356123167576939.
[I 2024-12-04 12:17:11,139] Trial 143 finished with value: 0.37432752779878525 and parameters: {'n_estimators': 517, 'learning_rate': 0.041214596342806255, 'max_depth': 12, 'min_samples_split': 17, 'min_samples_leaf': 5, 'subsample': 0.6109722681131861, 'max_features': None}. Best is trial 75 with value: 0.3356123167576939.
[I 2024-12-04 12:17:11,211] Trial 122 finished with value: 0.3797540880187762 and parameters: {'n_estimators': 920, 'learning_rate': 0.06281594075422463, 'max_depth': 10, 'min_samples_split': 8, 'min_samples_leaf': 1, 'subsample': 0.7076152718021781, 'max_features': None}. Best is trial 75 with value: 0.3356123167576939.
[I 2024-12-04 12:17:11,216] Trial 147 finished with value: 0.37426456234279465 and parameters: {'n_estimators': 287, 'learning_rate': 0.09122354892180183, 'max_depth': 12, 'min_samples_split': 15, 'min_samples_leaf': 4, 'subsample': 0.6508033812560522, 'max_features': None}. Best is trial 75 with value: 0.3356123167576939.
[I 2024-12-04 12:17:11,325] Trial 112 finished with value: 0.37476818643280674 and parameters: {'n_estimators': 1204, 'learning_rate': 0.08789867126462692, 'max_depth': 11, 'min_samples_split': 17, 'min_samples_leaf': 4, 'subsample': 0.6766567846102507, 'max_features': None}. Best is trial 75 with value: 0.3356123167576939.
[I 2024-12-04 12:17:11,626] Trial 113 finished with value: 0.3830536544024049 and parameters: {'n_estimators': 1292, 'learning_rate': 0.05496360823463481, 'max_depth': 10, 'min_samples_split': 20, 'min_samples_leaf': 5, 'subsample': 0.6535729620995652, 'max_features': None}. Best is trial 75 with value: 0.3356123167576939.
[I 2024-12-04 12:17:12,414] Trial 136 finished with value: 0.4627148490687596 and parameters: {'n_estimators': 945, 'learning_rate': 0.09822684041763283, 'max_depth': 11, 'min_samples_split': 5, 'min_samples_leaf': 3, 'subsample': 0.8308234093238648, 'max_features': 'log2'}. Best is trial 75 with value: 0.3356123167576939.
[I 2024-12-04 12:17:12,416] Trial 139 finished with value: 0.3639065572588417 and parameters: {'n_estimators': 615, 'learning_rate': 0.05821762771137481, 'max_depth': 12, 'min_samples_split': 14, 'min_samples_leaf': 3, 'subsample': 0.6612911900909296, 'max_features': None}. Best is trial 75 with value: 0.3356123167576939.
[I 2024-12-04 12:17:13,544] Trial 133 finished with value: 0.37623508091134267 and parameters: {'n_estimators': 918, 'learning_rate': 0.047017359841947146, 'max_depth': 12, 'min_samples_split': 14, 'min_samples_leaf': 1, 'subsample': 0.7809624264960396, 'max_features': None}. Best is trial 75 with value: 0.3356123167576939.
[I 2024-12-04 12:17:13,544] Trial 125 finished with value: 0.39818295281181804 and parameters: {'n_estimators': 1282, 'learning_rate': 0.08425121825295905, 'max_depth': 8, 'min_samples_split': 20, 'min_samples_leaf': 5, 'subsample': 0.6073262822671371, 'max_features': 'sqrt'}. Best is trial 75 with value: 0.3356123167576939.
[I 2024-12-04 12:17:13,996] Trial 145 finished with value: 0.3819602504104278 and parameters: {'n_estimators': 790, 'learning_rate': 0.046740618373747475, 'max_depth': 11, 'min_samples_split': 4, 'min_samples_leaf': 2, 'subsample': 0.8512212945018274, 'max_features': 'sqrt'}. Best is trial 75 with value: 0.3356123167576939.
[I 2024-12-04 12:17:16,287] Trial 152 finished with value: 0.38195552768338453 and parameters: {'n_estimators': 408, 'learning_rate': 0.06441229438228191, 'max_depth': 12, 'min_samples_split': 18, 'min_samples_leaf': 1, 'subsample': 0.842606516988375, 'max_features': None}. Best is trial 75 with value: 0.3356123167576939.
[I 2024-12-04 12:17:16,352] Trial 150 finished with value: 0.4191548535777481 and parameters: {'n_estimators': 667, 'learning_rate': 0.08440235286638965, 'max_depth': 12, 'min_samples_split': 18, 'min_samples_leaf': 5, 'subsample': 0.6584786335124218, 'max_features': 'sqrt'}. Best is trial 75 with value: 0.3356123167576939.
[I 2024-12-04 12:17:17,280] Trial 149 finished with value: 0.3721470689777811 and parameters: {'n_estimators': 722, 'learning_rate': 0.0908582797621167, 'max_depth': 12, 'min_samples_split': 11, 'min_samples_leaf': 1, 'subsample': 0.629008515754352, 'max_features': None}. Best is trial 75 with value: 0.3356123167576939.
[I 2024-12-04 12:17:18,781] Trial 144 finished with value: 0.5044663693397899 and parameters: {'n_estimators': 973, 'learning_rate': 0.09517089603757496, 'max_depth': 11, 'min_samples_split': 19, 'min_samples_leaf': 6, 'subsample': 0.6028739708744763, 'max_features': 'log2'}. Best is trial 75 with value: 0.3356123167576939.
[I 2024-12-04 12:17:18,873] Trial 155 finished with value: 0.35984791665391275 and parameters: {'n_estimators': 467, 'learning_rate': 0.025353758187016046, 'max_depth': 11, 'min_samples_split': 4, 'min_samples_leaf': 2, 'subsample': 0.8507178184272144, 'max_features': None}. Best is trial 75 with value: 0.3356123167576939.
[I 2024-12-04 12:17:20,268] Trial 141 finished with value: 0.560126106820121 and parameters: {'n_estimators': 1405, 'learning_rate': 0.014994905418443203, 'max_depth': 10, 'min_samples_split': 12, 'min_samples_leaf': 9, 'subsample': 0.6394190685103089, 'max_features': None}. Best is trial 75 with value: 0.3356123167576939.
[I 2024-12-04 12:17:20,983] Trial 151 finished with value: 0.38563259381269066 and parameters: {'n_estimators': 1206, 'learning_rate': 0.013625028239971712, 'max_depth': 11, 'min_samples_split': 5, 'min_samples_leaf': 1, 'subsample': 0.6083499657388136, 'max_features': None}. Best is trial 75 with value: 0.3356123167576939.
[I 2024-12-04 12:17:21,124] Trial 158 finished with value: 0.37094055909837487 and parameters: {'n_estimators': 636, 'learning_rate': 0.07399159511587322, 'max_depth': 12, 'min_samples_split': 19, 'min_samples_leaf': 3, 'subsample': 0.6034276521238454, 'max_features': None}. Best is trial 75 with value: 0.3356123167576939.
[I 2024-12-04 12:17:21,377] Trial 154 finished with value: 0.3841818219581147 and parameters: {'n_estimators': 1091, 'learning_rate': 0.08851573442369604, 'max_depth': 11, 'min_samples_split': 11, 'min_samples_leaf': 1, 'subsample': 0.6646479215395845, 'max_features': None}. Best is trial 75 with value: 0.3356123167576939.
[I 2024-12-04 12:17:21,825] Trial 153 finished with value: 0.40061205901786673 and parameters: {'n_estimators': 1320, 'learning_rate': 0.010184112545286356, 'max_depth': 5, 'min_samples_split': 2, 'min_samples_leaf': 2, 'subsample': 0.6592371651534914, 'max_features': None}. Best is trial 75 with value: 0.3356123167576939.
[I 2024-12-04 12:17:22,558] Trial 148 finished with value: 0.36944598680063195 and parameters: {'n_estimators': 1048, 'learning_rate': 0.0890418778607492, 'max_depth': 12, 'min_samples_split': 20, 'min_samples_leaf': 4, 'subsample': 0.9208769699383681, 'max_features': None}. Best is trial 75 with value: 0.3356123167576939.
[I 2024-12-04 12:17:22,769] Trial 159 finished with value: 0.37833969707769954 and parameters: {'n_estimators': 390, 'learning_rate': 0.08332254248359114, 'max_depth': 12, 'min_samples_split': 7, 'min_samples_leaf': 4, 'subsample': 0.6995491545459048, 'max_features': None}. Best is trial 75 with value: 0.3356123167576939.
[I 2024-12-04 12:17:23,318] Trial 163 finished with value: 0.3927992403125457 and parameters: {'n_estimators': 480, 'learning_rate': 0.03883243732877945, 'max_depth': 12, 'min_samples_split': 2, 'min_samples_leaf': 3, 'subsample': 0.6518789209737584, 'max_features': None}. Best is trial 75 with value: 0.3356123167576939.
[I 2024-12-04 12:17:25,340] Trial 165 finished with value: 0.4330959019790042 and parameters: {'n_estimators': 221, 'learning_rate': 0.020932331400748683, 'max_depth': 8, 'min_samples_split': 8, 'min_samples_leaf': 2, 'subsample': 0.8642684622262022, 'max_features': None}. Best is trial 75 with value: 0.3356123167576939.
[I 2024-12-04 12:17:25,882] Trial 177 finished with value: 0.45649967341965375 and parameters: {'n_estimators': 272, 'learning_rate': 0.06203447310657528, 'max_depth': 12, 'min_samples_split': 2, 'min_samples_leaf': 5, 'subsample': 0.7292681270968931, 'max_features': 'sqrt'}. Best is trial 75 with value: 0.3356123167576939.
[I 2024-12-04 12:17:25,885] Trial 164 finished with value: 0.3897958761753793 and parameters: {'n_estimators': 543, 'learning_rate': 0.05773523514433725, 'max_depth': 12, 'min_samples_split': 3, 'min_samples_leaf': 3, 'subsample': 0.7787470239448623, 'max_features': None}. Best is trial 75 with value: 0.3356123167576939.
[I 2024-12-04 12:17:27,328] Trial 166 finished with value: 0.37814887832040794 and parameters: {'n_estimators': 391, 'learning_rate': 0.02241883850012587, 'max_depth': 12, 'min_samples_split': 6, 'min_samples_leaf': 2, 'subsample': 0.8230036685420014, 'max_features': None}. Best is trial 75 with value: 0.3356123167576939.
[I 2024-12-04 12:17:28,335] Trial 162 finished with value: 0.39803208274292146 and parameters: {'n_estimators': 311, 'learning_rate': 0.019824669627272987, 'max_depth': 9, 'min_samples_split': 3, 'min_samples_leaf': 2, 'subsample': 0.7911345647295017, 'max_features': None}. Best is trial 75 with value: 0.3356123167576939.
[I 2024-12-04 12:17:28,805] Trial 161 finished with value: 0.37168082960677357 and parameters: {'n_estimators': 694, 'learning_rate': 0.054197941642525956, 'max_depth': 11, 'min_samples_split': 14, 'min_samples_leaf': 3, 'subsample': 0.6846720074851682, 'max_features': None}. Best is trial 75 with value: 0.3356123167576939.
[I 2024-12-04 12:17:29,299] Trial 156 finished with value: 0.38688308160677704 and parameters: {'n_estimators': 431, 'learning_rate': 0.07142590914631781, 'max_depth': 11, 'min_samples_split': 20, 'min_samples_leaf': 5, 'subsample': 0.7072937402673427, 'max_features': None}. Best is trial 75 with value: 0.3356123167576939.
[I 2024-12-04 12:17:29,515] Trial 178 finished with value: 0.6759408964823928 and parameters: {'n_estimators': 214, 'learning_rate': 0.08628286995537672, 'max_depth': 7, 'min_samples_split': 18, 'min_samples_leaf': 5, 'subsample': 0.8905532024276581, 'max_features': 'log2'}. Best is trial 75 with value: 0.3356123167576939.
[I 2024-12-04 12:17:29,522] Trial 176 finished with value: 0.5282251926271536 and parameters: {'n_estimators': 262, 'learning_rate': 0.017730806618043896, 'max_depth': 4, 'min_samples_split': 9, 'min_samples_leaf': 5, 'subsample': 0.6647163419978609, 'max_features': None}. Best is trial 75 with value: 0.3356123167576939.
[I 2024-12-04 12:17:29,558] Trial 167 finished with value: 0.3876366022796896 and parameters: {'n_estimators': 513, 'learning_rate': 0.02281069359382266, 'max_depth': 10, 'min_samples_split': 3, 'min_samples_leaf': 4, 'subsample': 0.7868087603340861, 'max_features': None}. Best is trial 75 with value: 0.3356123167576939.
[I 2024-12-04 12:17:30,108] Trial 157 finished with value: 0.3901933108669086 and parameters: {'n_estimators': 529, 'learning_rate': 0.09003588513976321, 'max_depth': 11, 'min_samples_split': 20, 'min_samples_leaf': 1, 'subsample': 0.949468359134982, 'max_features': None}. Best is trial 75 with value: 0.3356123167576939.
[I 2024-12-04 12:17:30,427] Trial 172 finished with value: 0.3669430249189213 and parameters: {'n_estimators': 372, 'learning_rate': 0.099205272682768, 'max_depth': 11, 'min_samples_split': 6, 'min_samples_leaf': 1, 'subsample': 0.8128582134195941, 'max_features': 'sqrt'}. Best is trial 75 with value: 0.3356123167576939.
[I 2024-12-04 12:17:30,740] Trial 181 finished with value: 0.5088890688195475 and parameters: {'n_estimators': 194, 'learning_rate': 0.0564953422051485, 'max_depth': 10, 'min_samples_split': 15, 'min_samples_leaf': 1, 'subsample': 0.6229109826287207, 'max_features': 'log2'}. Best is trial 75 with value: 0.3356123167576939.
[I 2024-12-04 12:17:31,179] Trial 170 finished with value: 0.37579440982228324 and parameters: {'n_estimators': 504, 'learning_rate': 0.08786625696023447, 'max_depth': 12, 'min_samples_split': 18, 'min_samples_leaf': 4, 'subsample': 0.6511925875750121, 'max_features': None}. Best is trial 75 with value: 0.3356123167576939.
[I 2024-12-04 12:17:32,814] Trial 173 finished with value: 0.43819632135227854 and parameters: {'n_estimators': 394, 'learning_rate': 0.09101736631801216, 'max_depth': 12, 'min_samples_split': 4, 'min_samples_leaf': 2, 'subsample': 0.6582292792851199, 'max_features': 'log2'}. Best is trial 75 with value: 0.3356123167576939.
[I 2024-12-04 12:17:32,987] Trial 182 finished with value: 0.35530857937928817 and parameters: {'n_estimators': 257, 'learning_rate': 0.05130143123044755, 'max_depth': 10, 'min_samples_split': 2, 'min_samples_leaf': 2, 'subsample': 0.8321217874665855, 'max_features': None}. Best is trial 75 with value: 0.3356123167576939.
[I 2024-12-04 12:17:34,063] Trial 175 finished with value: 0.40233559947192243 and parameters: {'n_estimators': 395, 'learning_rate': 0.05425212283967507, 'max_depth': 8, 'min_samples_split': 20, 'min_samples_leaf': 2, 'subsample': 0.8982496526815811, 'max_features': 'sqrt'}. Best is trial 75 with value: 0.3356123167576939.
[I 2024-12-04 12:17:34,074] Trial 160 finished with value: 0.3721813328215507 and parameters: {'n_estimators': 925, 'learning_rate': 0.02387783927132055, 'max_depth': 11, 'min_samples_split': 9, 'min_samples_leaf': 4, 'subsample': 0.8194515902780712, 'max_features': None}. Best is trial 75 with value: 0.3356123167576939.
[I 2024-12-04 12:17:34,290] Trial 186 finished with value: 0.5618385473034181 and parameters: {'n_estimators': 147, 'learning_rate': 0.04767029899305611, 'max_depth': 12, 'min_samples_split': 7, 'min_samples_leaf': 1, 'subsample': 0.8297398328064322, 'max_features': 'log2'}. Best is trial 75 with value: 0.3356123167576939.
[I 2024-12-04 12:17:34,312] Trial 169 finished with value: 0.5762980261269031 and parameters: {'n_estimators': 571, 'learning_rate': 0.011804112740669347, 'max_depth': 5, 'min_samples_split': 15, 'min_samples_leaf': 10, 'subsample': 0.8717727296429574, 'max_features': None}. Best is trial 75 with value: 0.3356123167576939.
[I 2024-12-04 12:17:34,944] Trial 183 finished with value: 0.36076727271563 and parameters: {'n_estimators': 343, 'learning_rate': 0.09709698888392912, 'max_depth': 11, 'min_samples_split': 20, 'min_samples_leaf': 4, 'subsample': 0.8909612409570136, 'max_features': None}. Best is trial 75 with value: 0.3356123167576939.
[I 2024-12-04 12:17:35,710] Trial 168 finished with value: 0.4486873232484792 and parameters: {'n_estimators': 843, 'learning_rate': 0.02816355237574265, 'max_depth': 10, 'min_samples_split': 6, 'min_samples_leaf': 2, 'subsample': 0.7992126252861264, 'max_features': 'log2'}. Best is trial 75 with value: 0.3356123167576939.
[I 2024-12-04 12:17:35,934] Trial 171 finished with value: 0.37943411675512384 and parameters: {'n_estimators': 807, 'learning_rate': 0.09943330276219438, 'max_depth': 8, 'min_samples_split': 13, 'min_samples_leaf': 3, 'subsample': 0.6528475497984085, 'max_features': None}. Best is trial 75 with value: 0.3356123167576939.
[I 2024-12-04 12:17:36,391] Trial 174 finished with value: 0.35257806864975916 and parameters: {'n_estimators': 574, 'learning_rate': 0.037476302150087154, 'max_depth': 10, 'min_samples_split': 6, 'min_samples_leaf': 2, 'subsample': 0.895559572652023, 'max_features': None}. Best is trial 75 with value: 0.3356123167576939.
[I 2024-12-04 12:17:37,535] Trial 192 finished with value: 0.428072687560123 and parameters: {'n_estimators': 236, 'learning_rate': 0.059497186161960626, 'max_depth': 10, 'min_samples_split': 3, 'min_samples_leaf': 1, 'subsample': 0.8400861760368489, 'max_features': None}. Best is trial 75 with value: 0.3356123167576939.
[I 2024-12-04 12:17:37,732] Trial 188 finished with value: 0.37823877517638144 and parameters: {'n_estimators': 440, 'learning_rate': 0.06886229307987259, 'max_depth': 12, 'min_samples_split': 9, 'min_samples_leaf': 3, 'subsample': 0.6147272741358281, 'max_features': None}. Best is trial 75 with value: 0.3356123167576939.
[I 2024-12-04 12:17:37,755] Trial 184 finished with value: 0.4263856208246589 and parameters: {'n_estimators': 140, 'learning_rate': 0.031709416880963515, 'max_depth': 11, 'min_samples_split': 4, 'min_samples_leaf': 1, 'subsample': 0.7101508844944506, 'max_features': None}. Best is trial 75 with value: 0.3356123167576939.
[I 2024-12-04 12:17:38,120] Trial 189 finished with value: 0.4849453553748519 and parameters: {'n_estimators': 251, 'learning_rate': 0.05978738881761789, 'max_depth': 10, 'min_samples_split': 19, 'min_samples_leaf': 5, 'subsample': 0.619137904261346, 'max_features': 'sqrt'}. Best is trial 75 with value: 0.3356123167576939.
[I 2024-12-04 12:17:38,154] Trial 179 finished with value: 0.37447738439193407 and parameters: {'n_estimators': 540, 'learning_rate': 0.07965781002844145, 'max_depth': 10, 'min_samples_split': 14, 'min_samples_leaf': 3, 'subsample': 0.614938571310656, 'max_features': None}. Best is trial 75 with value: 0.3356123167576939.
[I 2024-12-04 12:17:38,350] Trial 180 finished with value: 0.3604060337417618 and parameters: {'n_estimators': 562, 'learning_rate': 0.052479708855222844, 'max_depth': 10, 'min_samples_split': 14, 'min_samples_leaf': 1, 'subsample': 0.6334405670226458, 'max_features': None}. Best is trial 75 with value: 0.3356123167576939.
[I 2024-12-04 12:17:39,517] Trial 191 finished with value: 0.38308192836321675 and parameters: {'n_estimators': 326, 'learning_rate': 0.045302605295011185, 'max_depth': 9, 'min_samples_split': 2, 'min_samples_leaf': 4, 'subsample': 0.8260709487779133, 'max_features': None}. Best is trial 75 with value: 0.3356123167576939.
[I 2024-12-04 12:17:39,632] Trial 185 finished with value: 0.41247360447017795 and parameters: {'n_estimators': 167, 'learning_rate': 0.043884304391720905, 'max_depth': 11, 'min_samples_split': 2, 'min_samples_leaf': 3, 'subsample': 0.9212627310432765, 'max_features': None}. Best is trial 75 with value: 0.3356123167576939.
[I 2024-12-04 12:17:41,244] Trial 187 finished with value: 0.4039683774535106 and parameters: {'n_estimators': 719, 'learning_rate': 0.031058188808036454, 'max_depth': 11, 'min_samples_split': 3, 'min_samples_leaf': 1, 'subsample': 0.7904600311748149, 'max_features': None}. Best is trial 75 with value: 0.3356123167576939.
[I 2024-12-04 12:17:42,742] Trial 194 finished with value: 0.37516831756885805 and parameters: {'n_estimators': 203, 'learning_rate': 0.07301473242549018, 'max_depth': 11, 'min_samples_split': 19, 'min_samples_leaf': 4, 'subsample': 0.629047164605541, 'max_features': None}. Best is trial 75 with value: 0.3356123167576939.
[I 2024-12-04 12:17:43,254] Trial 190 finished with value: 0.3948156780502631 and parameters: {'n_estimators': 929, 'learning_rate': 0.0232201223873603, 'max_depth': 9, 'min_samples_split': 2, 'min_samples_leaf': 3, 'subsample': 0.8892616733440272, 'max_features': None}. Best is trial 75 with value: 0.3356123167576939.
[I 2024-12-04 12:17:44,136] Trial 202 finished with value: 0.3767080163773484 and parameters: {'n_estimators': 496, 'learning_rate': 0.09589793903399993, 'max_depth': 10, 'min_samples_split': 18, 'min_samples_leaf': 5, 'subsample': 0.8914474602194437, 'max_features': None}. Best is trial 75 with value: 0.3356123167576939.
[I 2024-12-04 12:17:44,959] Trial 204 finished with value: 0.3712576506547069 and parameters: {'n_estimators': 443, 'learning_rate': 0.09464962829251596, 'max_depth': 12, 'min_samples_split': 19, 'min_samples_leaf': 3, 'subsample': 0.8410856681030919, 'max_features': None}. Best is trial 75 with value: 0.3356123167576939.
[I 2024-12-04 12:17:46,120] Trial 193 finished with value: 0.40427014813999346 and parameters: {'n_estimators': 457, 'learning_rate': 0.051255147590002784, 'max_depth': 11, 'min_samples_split': 8, 'min_samples_leaf': 1, 'subsample': 0.9574172561407505, 'max_features': None}. Best is trial 75 with value: 0.3356123167576939.
[I 2024-12-04 12:17:47,637] Trial 196 finished with value: 0.3488144458816563 and parameters: {'n_estimators': 522, 'learning_rate': 0.045197204850624395, 'max_depth': 8, 'min_samples_split': 6, 'min_samples_leaf': 2, 'subsample': 0.8889723441438588, 'max_features': None}. Best is trial 75 with value: 0.3356123167576939.
[I 2024-12-04 12:17:47,837] Trial 200 finished with value: 0.3681747969636043 and parameters: {'n_estimators': 212, 'learning_rate': 0.05496053646195605, 'max_depth': 12, 'min_samples_split': 15, 'min_samples_leaf': 4, 'subsample': 0.6360613748439305, 'max_features': None}. Best is trial 75 with value: 0.3356123167576939.
[I 2024-12-04 12:17:48,623] Trial 198 finished with value: 0.35222195649276444 and parameters: {'n_estimators': 453, 'learning_rate': 0.03546953788866089, 'max_depth': 10, 'min_samples_split': 3, 'min_samples_leaf': 2, 'subsample': 0.7689199184968671, 'max_features': None}. Best is trial 75 with value: 0.3356123167576939.
[I 2024-12-04 12:17:51,485] Trial 195 finished with value: 0.34791918638741026 and parameters: {'n_estimators': 670, 'learning_rate': 0.03601476889547604, 'max_depth': 10, 'min_samples_split': 4, 'min_samples_leaf': 2, 'subsample': 0.8772769511431542, 'max_features': None}. Best is trial 75 with value: 0.3356123167576939.
