[I 2024-12-04 11:55:48,237] Trial 681 finished with value: 0.5273419897492498 and parameters: {'max_depth': 35, 'min_samples_split': 15, 'min_samples_leaf': 1, 'max_features': 'sqrt', 'criterion': 'friedman_mse', 'splitter': 'best'}. Best is trial 458 with value: 0.430928156546456.
[I 2024-12-04 11:55:49,573] Trial 696 finished with value: 0.47344856982335537 and parameters: {'max_depth': 35, 'min_samples_split': 12, 'min_samples_leaf': 1, 'max_features': 'sqrt', 'criterion': 'friedman_mse', 'splitter': 'best'}. Best is trial 458 with value: 0.430928156546456.
[I 2024-12-04 11:55:50,015] Trial 692 finished with value: 0.430928156546456 and parameters: {'max_depth': 35, 'min_samples_split': 13, 'min_samples_leaf': 1, 'max_features': 'sqrt', 'criterion': 'friedman_mse', 'splitter': 'best'}. Best is trial 458 with value: 0.430928156546456.
[I 2024-12-04 11:55:50,624] Trial 697 finished with value: 0.5178360218831576 and parameters: {'max_depth': 29, 'min_samples_split': 11, 'min_samples_leaf': 1, 'max_features': 'sqrt', 'criterion': 'friedman_mse', 'splitter': 'best'}. Best is trial 458 with value: 0.430928156546456.
[I 2024-12-04 11:55:50,695] Trial 695 finished with value: 0.5202042891384949 and parameters: {'max_depth': 28, 'min_samples_split': 16, 'min_samples_leaf': 1, 'max_features': 'sqrt', 'criterion': 'friedman_mse', 'splitter': 'best'}. Best is trial 458 with value: 0.430928156546456.
[I 2024-12-04 11:55:51,437] Trial 704 finished with value: 0.47495142754566344 and parameters: {'max_depth': 35, 'min_samples_split': 11, 'min_samples_leaf': 1, 'max_features': 'sqrt', 'criterion': 'friedman_mse', 'splitter': 'best'}. Best is trial 458 with value: 0.430928156546456.
[I 2024-12-04 11:55:51,445] Trial 709 finished with value: 0.5273419897492498 and parameters: {'max_depth': 35, 'min_samples_split': 15, 'min_samples_leaf': 1, 'max_features': 'sqrt', 'criterion': 'friedman_mse', 'splitter': 'best'}. Best is trial 458 with value: 0.430928156546456.
[I 2024-12-04 11:55:52,005] Trial 707 finished with value: 0.5028348840852795 and parameters: {'max_depth': 34, 'min_samples_split': 12, 'min_samples_leaf': 1, 'max_features': 'sqrt', 'criterion': 'friedman_mse', 'splitter': 'best'}. Best is trial 458 with value: 0.430928156546456.
[I 2024-12-04 11:55:52,013] Trial 702 finished with value: 0.4615785299849214 and parameters: {'max_depth': 35, 'min_samples_split': 10, 'min_samples_leaf': 1, 'max_features': 'sqrt', 'criterion': 'friedman_mse', 'splitter': 'best'}. Best is trial 458 with value: 0.430928156546456.
[I 2024-12-04 11:55:52,495] Trial 706 finished with value: 0.4399442512678781 and parameters: {'max_depth': 35, 'min_samples_split': 14, 'min_samples_leaf': 1, 'max_features': 'sqrt', 'criterion': 'friedman_mse', 'splitter': 'best'}. Best is trial 458 with value: 0.430928156546456.
[I 2024-12-04 11:55:52,731] Trial 703 finished with value: 0.6288906140805384 and parameters: {'max_depth': 28, 'min_samples_split': 13, 'min_samples_leaf': 1, 'max_features': 'log2', 'criterion': 'squared_error', 'splitter': 'best'}. Best is trial 458 with value: 0.430928156546456.
[I 2024-12-04 11:55:53,173] Trial 700 finished with value: 0.6141601780727238 and parameters: {'max_depth': 32, 'min_samples_split': 13, 'min_samples_leaf': 1, 'max_features': 'sqrt', 'criterion': 'absolute_error', 'splitter': 'best'}. Best is trial 458 with value: 0.430928156546456.
[I 2024-12-04 11:55:53,215] Trial 705 finished with value: 0.584300197786044 and parameters: {'max_depth': 35, 'min_samples_split': 13, 'min_samples_leaf': 3, 'max_features': 'sqrt', 'criterion': 'friedman_mse', 'splitter': 'best'}. Best is trial 458 with value: 0.430928156546456.
[I 2024-12-04 11:55:54,267] Trial 698 finished with value: 0.47344856982335537 and parameters: {'max_depth': 35, 'min_samples_split': 12, 'min_samples_leaf': 1, 'max_features': 'sqrt', 'criterion': 'friedman_mse', 'splitter': 'best'}. Best is trial 458 with value: 0.430928156546456.
[I 2024-12-04 11:55:54,559] Trial 708 finished with value: 0.5273419897492498 and parameters: {'max_depth': 35, 'min_samples_split': 15, 'min_samples_leaf': 1, 'max_features': 'sqrt', 'criterion': 'friedman_mse', 'splitter': 'best'}. Best is trial 458 with value: 0.430928156546456.
[I 2024-12-04 11:55:54,879] Trial 718 finished with value: 0.430928156546456 and parameters: {'max_depth': 35, 'min_samples_split': 13, 'min_samples_leaf': 1, 'max_features': 'sqrt', 'criterion': 'friedman_mse', 'splitter': 'best'}. Best is trial 458 with value: 0.430928156546456.
[I 2024-12-04 11:55:55,762] Trial 712 finished with value: 0.510418322463182 and parameters: {'max_depth': 28, 'min_samples_split': 11, 'min_samples_leaf': 1, 'max_features': 'sqrt', 'criterion': 'friedman_mse', 'splitter': 'best'}. Best is trial 458 with value: 0.430928156546456.
[I 2024-12-04 11:55:55,861] Trial 713 finished with value: 0.5164042502908208 and parameters: {'max_depth': 26, 'min_samples_split': 11, 'min_samples_leaf': 1, 'max_features': 'sqrt', 'criterion': 'friedman_mse', 'splitter': 'best'}. Best is trial 458 with value: 0.430928156546456.
[I 2024-12-04 11:55:56,149] Trial 716 finished with value: 0.584300197786044 and parameters: {'max_depth': 29, 'min_samples_split': 15, 'min_samples_leaf': 3, 'max_features': 'sqrt', 'criterion': 'friedman_mse', 'splitter': 'best'}. Best is trial 458 with value: 0.430928156546456.
[I 2024-12-04 11:55:56,463] Trial 714 finished with value: 0.584022525745178 and parameters: {'max_depth': 33, 'min_samples_split': 11, 'min_samples_leaf': 3, 'max_features': 'sqrt', 'criterion': 'friedman_mse', 'splitter': 'best'}. Best is trial 458 with value: 0.430928156546456.
[I 2024-12-04 11:55:56,990] Trial 701 finished with value: 0.47495142754566344 and parameters: {'max_depth': 35, 'min_samples_split': 11, 'min_samples_leaf': 1, 'max_features': 'sqrt', 'criterion': 'friedman_mse', 'splitter': 'best'}. Best is trial 458 with value: 0.430928156546456.
[I 2024-12-04 11:55:57,526] Trial 715 finished with value: 0.8535375409234314 and parameters: {'max_depth': 33, 'min_samples_split': 17, 'min_samples_leaf': 2, 'max_features': 'log2', 'criterion': 'squared_error', 'splitter': 'best'}. Best is trial 458 with value: 0.430928156546456.
[I 2024-12-04 11:55:57,711] Trial 699 finished with value: 0.430928156546456 and parameters: {'max_depth': 35, 'min_samples_split': 13, 'min_samples_leaf': 1, 'max_features': 'sqrt', 'criterion': 'friedman_mse', 'splitter': 'best'}. Best is trial 458 with value: 0.430928156546456.
[I 2024-12-04 11:55:58,367] Trial 717 finished with value: 0.4399442512678781 and parameters: {'max_depth': 35, 'min_samples_split': 14, 'min_samples_leaf': 1, 'max_features': 'sqrt', 'criterion': 'friedman_mse', 'splitter': 'best'}. Best is trial 458 with value: 0.430928156546456.
[I 2024-12-04 11:55:58,371] Trial 722 finished with value: 0.7309615806277502 and parameters: {'max_depth': 31, 'min_samples_split': 12, 'min_samples_leaf': 3, 'max_features': 'sqrt', 'criterion': 'friedman_mse', 'splitter': 'random'}. Best is trial 458 with value: 0.430928156546456.
[I 2024-12-04 11:55:58,916] Trial 726 finished with value: 0.8624478982658306 and parameters: {'max_depth': 15, 'min_samples_split': 20, 'min_samples_leaf': 4, 'max_features': 'sqrt', 'criterion': 'friedman_mse', 'splitter': 'random'}. Best is trial 458 with value: 0.430928156546456.
[I 2024-12-04 11:55:59,506] Trial 711 finished with value: 0.5495814625685977 and parameters: {'max_depth': 27, 'min_samples_split': 16, 'min_samples_leaf': 1, 'max_features': 'sqrt', 'criterion': 'friedman_mse', 'splitter': 'best'}. Best is trial 458 with value: 0.430928156546456.
[I 2024-12-04 11:55:59,670] Trial 721 finished with value: 0.5502781696297351 and parameters: {'max_depth': 27, 'min_samples_split': 15, 'min_samples_leaf': 1, 'max_features': 'sqrt', 'criterion': 'friedman_mse', 'splitter': 'best'}. Best is trial 458 with value: 0.430928156546456.
[I 2024-12-04 11:55:59,690] Trial 719 finished with value: 0.4399442512678781 and parameters: {'max_depth': 35, 'min_samples_split': 14, 'min_samples_leaf': 1, 'max_features': 'sqrt', 'criterion': 'friedman_mse', 'splitter': 'best'}. Best is trial 458 with value: 0.430928156546456.
[I 2024-12-04 11:56:00,876] Trial 727 finished with value: 0.5498722708822491 and parameters: {'max_depth': 34, 'min_samples_split': 9, 'min_samples_leaf': 1, 'max_features': 'sqrt', 'criterion': 'absolute_error', 'splitter': 'best'}. Best is trial 458 with value: 0.430928156546456.
[I 2024-12-04 11:56:01,094] Trial 725 finished with value: 0.5858505599509766 and parameters: {'max_depth': 35, 'min_samples_split': 10, 'min_samples_leaf': 3, 'max_features': 'sqrt', 'criterion': 'friedman_mse', 'splitter': 'best'}. Best is trial 458 with value: 0.430928156546456.
[I 2024-12-04 11:56:01,601] Trial 732 finished with value: 0.4615785299849214 and parameters: {'max_depth': 35, 'min_samples_split': 10, 'min_samples_leaf': 1, 'max_features': 'sqrt', 'criterion': 'friedman_mse', 'splitter': 'best'}. Best is trial 458 with value: 0.430928156546456.
[I 2024-12-04 11:56:01,911] Trial 720 finished with value: 0.47344856982335537 and parameters: {'max_depth': 35, 'min_samples_split': 12, 'min_samples_leaf': 1, 'max_features': 'sqrt', 'criterion': 'friedman_mse', 'splitter': 'best'}. Best is trial 458 with value: 0.430928156546456.
[I 2024-12-04 11:56:02,210] Trial 724 finished with value: 0.5511593032042519 and parameters: {'max_depth': 28, 'min_samples_split': 12, 'min_samples_leaf': 1, 'max_features': 'sqrt', 'criterion': 'friedman_mse', 'splitter': 'best'}. Best is trial 458 with value: 0.430928156546456.
[I 2024-12-04 11:56:02,725] Trial 723 finished with value: 0.584300197786044 and parameters: {'max_depth': 35, 'min_samples_split': 14, 'min_samples_leaf': 3, 'max_features': 'sqrt', 'criterion': 'friedman_mse', 'splitter': 'best'}. Best is trial 458 with value: 0.430928156546456.
[I 2024-12-04 11:56:02,907] Trial 710 finished with value: 0.5344901296567837 and parameters: {'max_depth': 28, 'min_samples_split': 11, 'min_samples_leaf': 2, 'max_features': 'sqrt', 'criterion': 'friedman_mse', 'splitter': 'best'}. Best is trial 458 with value: 0.430928156546456.
[I 2024-12-04 11:56:03,034] Trial 730 finished with value: 0.47344856982335537 and parameters: {'max_depth': 35, 'min_samples_split': 12, 'min_samples_leaf': 1, 'max_features': 'sqrt', 'criterion': 'friedman_mse', 'splitter': 'best'}. Best is trial 458 with value: 0.430928156546456.
[I 2024-12-04 11:56:03,187] Trial 733 finished with value: 0.9618554461006263 and parameters: {'max_depth': 15, 'min_samples_split': 5, 'min_samples_leaf': 7, 'max_features': 'log2', 'criterion': 'friedman_mse', 'splitter': 'random'}. Best is trial 458 with value: 0.430928156546456.
[I 2024-12-04 11:56:03,478] Trial 740 finished with value: 0.584300197786044 and parameters: {'max_depth': 28, 'min_samples_split': 13, 'min_samples_leaf': 3, 'max_features': 'sqrt', 'criterion': 'friedman_mse', 'splitter': 'best'}. Best is trial 458 with value: 0.430928156546456.
[I 2024-12-04 11:56:03,862] Trial 738 finished with value: 0.591783858332651 and parameters: {'max_depth': 35, 'min_samples_split': 16, 'min_samples_leaf': 1, 'max_features': 'sqrt', 'criterion': 'friedman_mse', 'splitter': 'random'}. Best is trial 458 with value: 0.430928156546456.
[I 2024-12-04 11:56:03,872] Trial 739 finished with value: 0.4893880153830252 and parameters: {'max_depth': 34, 'min_samples_split': 16, 'min_samples_leaf': 1, 'max_features': 'sqrt', 'criterion': 'squared_error', 'splitter': 'best'}. Best is trial 458 with value: 0.430928156546456.
[I 2024-12-04 11:56:04,927] Trial 729 finished with value: 0.5034041382006532 and parameters: {'max_depth': 28, 'min_samples_split': 15, 'min_samples_leaf': 2, 'max_features': 'sqrt', 'criterion': 'squared_error', 'splitter': 'best'}. Best is trial 458 with value: 0.430928156546456.
[I 2024-12-04 11:56:04,928] Trial 736 finished with value: 0.8535375409234314 and parameters: {'max_depth': 32, 'min_samples_split': 17, 'min_samples_leaf': 2, 'max_features': 'log2', 'criterion': 'friedman_mse', 'splitter': 'best'}. Best is trial 458 with value: 0.430928156546456.
[I 2024-12-04 11:56:05,624] Trial 731 finished with value: 0.5220453594633404 and parameters: {'max_depth': 29, 'min_samples_split': 14, 'min_samples_leaf': 1, 'max_features': 'sqrt', 'criterion': 'friedman_mse', 'splitter': 'best'}. Best is trial 458 with value: 0.430928156546456.
[I 2024-12-04 11:56:05,918] Trial 741 finished with value: 0.430928156546456 and parameters: {'max_depth': 35, 'min_samples_split': 13, 'min_samples_leaf': 1, 'max_features': 'sqrt', 'criterion': 'friedman_mse', 'splitter': 'best'}. Best is trial 458 with value: 0.430928156546456.
[I 2024-12-04 11:56:06,266] Trial 734 finished with value: 0.48913122864637676 and parameters: {'max_depth': 35, 'min_samples_split': 16, 'min_samples_leaf': 1, 'max_features': 'sqrt', 'criterion': 'friedman_mse', 'splitter': 'best'}. Best is trial 458 with value: 0.430928156546456.
[I 2024-12-04 11:56:07,028] Trial 744 finished with value: 0.584300197786044 and parameters: {'max_depth': 35, 'min_samples_split': 13, 'min_samples_leaf': 3, 'max_features': 'sqrt', 'criterion': 'friedman_mse', 'splitter': 'best'}. Best is trial 458 with value: 0.430928156546456.
[I 2024-12-04 11:56:07,426] Trial 751 finished with value: 0.5260707068792781 and parameters: {'max_depth': 30, 'min_samples_split': 10, 'min_samples_leaf': 1, 'max_features': 'sqrt', 'criterion': 'friedman_mse', 'splitter': 'best'}. Best is trial 458 with value: 0.430928156546456.
[I 2024-12-04 11:56:07,470] Trial 742 finished with value: 0.5019923841314047 and parameters: {'max_depth': 29, 'min_samples_split': 13, 'min_samples_leaf': 1, 'max_features': 'sqrt', 'criterion': 'friedman_mse', 'splitter': 'best'}. Best is trial 458 with value: 0.430928156546456.
[I 2024-12-04 11:56:08,466] Trial 747 finished with value: 0.47344856982335537 and parameters: {'max_depth': 35, 'min_samples_split': 12, 'min_samples_leaf': 1, 'max_features': 'sqrt', 'criterion': 'friedman_mse', 'splitter': 'best'}. Best is trial 458 with value: 0.430928156546456.
[I 2024-12-04 11:56:08,993] Trial 743 finished with value: 0.8459501508715142 and parameters: {'max_depth': 35, 'min_samples_split': 9, 'min_samples_leaf': 2, 'max_features': 'log2', 'criterion': 'friedman_mse', 'splitter': 'best'}. Best is trial 458 with value: 0.430928156546456.
[I 2024-12-04 11:56:09,245] Trial 737 finished with value: 0.6245954298640599 and parameters: {'max_depth': 26, 'min_samples_split': 10, 'min_samples_leaf': 1, 'max_features': 'sqrt', 'criterion': 'friedman_mse', 'splitter': 'random'}. Best is trial 458 with value: 0.430928156546456.
[I 2024-12-04 11:56:10,365] Trial 735 finished with value: 0.658081076815616 and parameters: {'max_depth': 17, 'min_samples_split': 14, 'min_samples_leaf': 1, 'max_features': 'sqrt', 'criterion': 'absolute_error', 'splitter': 'best'}. Best is trial 458 with value: 0.430928156546456.
[I 2024-12-04 11:56:10,431] Trial 746 finished with value: 0.9725499273319154 and parameters: {'max_depth': 2, 'min_samples_split': 10, 'min_samples_leaf': 10, 'max_features': 'sqrt', 'criterion': 'squared_error', 'splitter': 'best'}. Best is trial 458 with value: 0.430928156546456.
[I 2024-12-04 11:56:10,441] Trial 750 finished with value: 0.5858505599509766 and parameters: {'max_depth': 35, 'min_samples_split': 10, 'min_samples_leaf': 3, 'max_features': 'sqrt', 'criterion': 'friedman_mse', 'splitter': 'best'}. Best is trial 458 with value: 0.430928156546456.
[I 2024-12-04 11:56:11,032] Trial 755 finished with value: 0.584300197786044 and parameters: {'max_depth': 35, 'min_samples_split': 15, 'min_samples_leaf': 3, 'max_features': 'sqrt', 'criterion': 'friedman_mse', 'splitter': 'best'}. Best is trial 458 with value: 0.430928156546456.
[I 2024-12-04 11:56:11,450] Trial 760 finished with value: 0.9625068790481612 and parameters: {'max_depth': 23, 'min_samples_split': 2, 'min_samples_leaf': 5, 'max_features': 'log2', 'criterion': 'squared_error', 'splitter': 'random'}. Best is trial 458 with value: 0.430928156546456.
[I 2024-12-04 11:56:11,503] Trial 749 finished with value: 0.5178360218831576 and parameters: {'max_depth': 29, 'min_samples_split': 11, 'min_samples_leaf': 1, 'max_features': 'sqrt', 'criterion': 'friedman_mse', 'splitter': 'best'}. Best is trial 458 with value: 0.430928156546456.
[I 2024-12-04 11:56:11,599] Trial 753 finished with value: 0.430928156546456 and parameters: {'max_depth': 35, 'min_samples_split': 13, 'min_samples_leaf': 1, 'max_features': 'sqrt', 'criterion': 'friedman_mse', 'splitter': 'best'}. Best is trial 458 with value: 0.430928156546456.
[I 2024-12-04 11:56:11,601] Trial 745 finished with value: 0.48913122864637676 and parameters: {'max_depth': 35, 'min_samples_split': 16, 'min_samples_leaf': 1, 'max_features': 'sqrt', 'criterion': 'friedman_mse', 'splitter': 'best'}. Best is trial 458 with value: 0.430928156546456.
[I 2024-12-04 11:56:11,834] Trial 748 finished with value: 0.5178360218831576 and parameters: {'max_depth': 29, 'min_samples_split': 11, 'min_samples_leaf': 1, 'max_features': 'sqrt', 'criterion': 'friedman_mse', 'splitter': 'best'}. Best is trial 458 with value: 0.430928156546456.
[I 2024-12-04 11:56:12,040] Trial 756 finished with value: 0.5748787313864393 and parameters: {'max_depth': 35, 'min_samples_split': 9, 'min_samples_leaf': 2, 'max_features': 'sqrt', 'criterion': 'friedman_mse', 'splitter': 'best'}. Best is trial 458 with value: 0.430928156546456.
[I 2024-12-04 11:56:12,724] Trial 752 finished with value: 0.584300197786044 and parameters: {'max_depth': 35, 'min_samples_split': 15, 'min_samples_leaf': 3, 'max_features': 'sqrt', 'criterion': 'friedman_mse', 'splitter': 'best'}. Best is trial 458 with value: 0.430928156546456.
[I 2024-12-04 11:56:13,010] Trial 728 finished with value: 0.430928156546456 and parameters: {'max_depth': 35, 'min_samples_split': 13, 'min_samples_leaf': 1, 'max_features': 'sqrt', 'criterion': 'friedman_mse', 'splitter': 'best'}. Best is trial 458 with value: 0.430928156546456.
[I 2024-12-04 11:56:13,270] Trial 763 finished with value: 0.5459840798044118 and parameters: {'max_depth': 35, 'min_samples_split': 12, 'min_samples_leaf': 2, 'max_features': 'sqrt', 'criterion': 'friedman_mse', 'splitter': 'best'}. Best is trial 458 with value: 0.430928156546456.
[I 2024-12-04 11:56:13,271] Trial 761 finished with value: 0.5220453594633404 and parameters: {'max_depth': 29, 'min_samples_split': 14, 'min_samples_leaf': 1, 'max_features': 'sqrt', 'criterion': 'friedman_mse', 'splitter': 'best'}. Best is trial 458 with value: 0.430928156546456.
[I 2024-12-04 11:56:13,997] Trial 754 finished with value: 0.5615465456057973 and parameters: {'max_depth': 29, 'min_samples_split': 11, 'min_samples_leaf': 2, 'max_features': 'sqrt', 'criterion': 'friedman_mse', 'splitter': 'best'}. Best is trial 458 with value: 0.430928156546456.
[I 2024-12-04 11:56:14,634] Trial 762 finished with value: 0.7038807163439966 and parameters: {'max_depth': 34, 'min_samples_split': 13, 'min_samples_leaf': 2, 'max_features': 'sqrt', 'criterion': 'absolute_error', 'splitter': 'best'}. Best is trial 458 with value: 0.430928156546456.
[I 2024-12-04 11:56:14,759] Trial 765 finished with value: 0.4615785299849214 and parameters: {'max_depth': 35, 'min_samples_split': 10, 'min_samples_leaf': 1, 'max_features': 'sqrt', 'criterion': 'friedman_mse', 'splitter': 'best'}. Best is trial 458 with value: 0.430928156546456.
[I 2024-12-04 11:56:15,137] Trial 767 finished with value: 0.47344856982335537 and parameters: {'max_depth': 35, 'min_samples_split': 12, 'min_samples_leaf': 1, 'max_features': 'sqrt', 'criterion': 'friedman_mse', 'splitter': 'best'}. Best is trial 458 with value: 0.430928156546456.
[I 2024-12-04 11:56:15,176] Trial 758 finished with value: 0.5034437178251039 and parameters: {'max_depth': 35, 'min_samples_split': 9, 'min_samples_leaf': 1, 'max_features': 'sqrt', 'criterion': 'friedman_mse', 'splitter': 'best'}. Best is trial 458 with value: 0.430928156546456.
[I 2024-12-04 11:56:15,333] Trial 768 finished with value: 0.47344856982335537 and parameters: {'max_depth': 35, 'min_samples_split': 12, 'min_samples_leaf': 1, 'max_features': 'sqrt', 'criterion': 'friedman_mse', 'splitter': 'best'}. Best is trial 458 with value: 0.430928156546456.
[I 2024-12-04 11:56:15,477] Trial 759 finished with value: 0.5802981225397039 and parameters: {'max_depth': 28, 'min_samples_split': 14, 'min_samples_leaf': 1, 'max_features': 'sqrt', 'criterion': 'friedman_mse', 'splitter': 'best'}. Best is trial 458 with value: 0.430928156546456.
[I 2024-12-04 11:56:16,274] Trial 769 finished with value: 0.584300197786044 and parameters: {'max_depth': 35, 'min_samples_split': 14, 'min_samples_leaf': 3, 'max_features': 'sqrt', 'criterion': 'friedman_mse', 'splitter': 'best'}. Best is trial 458 with value: 0.430928156546456.
[I 2024-12-04 11:56:16,471] Trial 770 finished with value: 0.5459840798044118 and parameters: {'max_depth': 35, 'min_samples_split': 13, 'min_samples_leaf': 2, 'max_features': 'sqrt', 'criterion': 'squared_error', 'splitter': 'best'}. Best is trial 458 with value: 0.430928156546456.
[I 2024-12-04 11:56:16,947] Trial 757 finished with value: 0.998127234894583 and parameters: {'max_depth': 7, 'min_samples_split': 10, 'min_samples_leaf': 9, 'max_features': 'log2', 'criterion': 'squared_error', 'splitter': 'random'}. Best is trial 458 with value: 0.430928156546456.
[I 2024-12-04 11:56:17,270] Trial 764 finished with value: 0.4399442512678781 and parameters: {'max_depth': 35, 'min_samples_split': 14, 'min_samples_leaf': 1, 'max_features': 'sqrt', 'criterion': 'friedman_mse', 'splitter': 'best'}. Best is trial 458 with value: 0.430928156546456.
