[I 2024-12-04 12:52:39,217] Trial 1932 finished with value: 0.3753564976945542 and parameters: {'n_estimators': 1385, 'learning_rate': 0.05472136711155704, 'max_depth': 6, 'min_samples_split': 2, 'min_samples_leaf': 1, 'subsample': 0.6835965246375413, 'max_features': None}. Best is trial 1454 with value: 0.30763307678022894.
[I 2024-12-04 12:52:40,194] Trial 1945 finished with value: 0.3852879211191491 and parameters: {'n_estimators': 1020, 'learning_rate': 0.05186310666791797, 'max_depth': 6, 'min_samples_split': 2, 'min_samples_leaf': 3, 'subsample': 0.6624205788316907, 'max_features': None}. Best is trial 1454 with value: 0.30763307678022894.
[I 2024-12-04 12:52:41,569] Trial 1937 finished with value: 0.4004668861361682 and parameters: {'n_estimators': 1249, 'learning_rate': 0.08578308589784783, 'max_depth': 8, 'min_samples_split': 17, 'min_samples_leaf': 7, 'subsample': 0.9770129737100826, 'max_features': None}. Best is trial 1454 with value: 0.30763307678022894.
[I 2024-12-04 12:52:43,653] Trial 1963 finished with value: 0.6198972561941367 and parameters: {'n_estimators': 428, 'learning_rate': 0.04691558447832425, 'max_depth': 3, 'min_samples_split': 9, 'min_samples_leaf': 1, 'subsample': 0.9845940071414951, 'max_features': 'log2'}. Best is trial 1454 with value: 0.30763307678022894.
[I 2024-12-04 12:52:44,276] Trial 1952 finished with value: 0.38603500636663046 and parameters: {'n_estimators': 946, 'learning_rate': 0.081831589090061, 'max_depth': 7, 'min_samples_split': 6, 'min_samples_leaf': 1, 'subsample': 0.6130159021651347, 'max_features': 'sqrt'}. Best is trial 1454 with value: 0.30763307678022894.
[I 2024-12-04 12:52:45,441] Trial 1942 finished with value: 0.39261542349881734 and parameters: {'n_estimators': 1229, 'learning_rate': 0.09921899185429732, 'max_depth': 5, 'min_samples_split': 2, 'min_samples_leaf': 3, 'subsample': 0.6725406535130881, 'max_features': None}. Best is trial 1454 with value: 0.30763307678022894.
[I 2024-12-04 12:52:46,092] Trial 1965 finished with value: 0.567210745821439 and parameters: {'n_estimators': 334, 'learning_rate': 0.07549811770966504, 'max_depth': 6, 'min_samples_split': 6, 'min_samples_leaf': 4, 'subsample': 0.9457725257093013, 'max_features': 'log2'}. Best is trial 1454 with value: 0.30763307678022894.
[I 2024-12-04 12:52:48,363] Trial 1962 finished with value: 0.406666019664748 and parameters: {'n_estimators': 574, 'learning_rate': 0.08260657957348272, 'max_depth': 6, 'min_samples_split': 5, 'min_samples_leaf': 7, 'subsample': 0.6850693478954117, 'max_features': None}. Best is trial 1454 with value: 0.30763307678022894.
[I 2024-12-04 12:52:48,573] Trial 1949 finished with value: 0.49567171847401026 and parameters: {'n_estimators': 1220, 'learning_rate': 0.018054283213125348, 'max_depth': 7, 'min_samples_split': 9, 'min_samples_leaf': 2, 'subsample': 0.6374133347028745, 'max_features': 'log2'}. Best is trial 1454 with value: 0.30763307678022894.
[I 2024-12-04 12:52:49,033] Trial 1944 finished with value: 0.3171187131467338 and parameters: {'n_estimators': 1229, 'learning_rate': 0.05606992951799966, 'max_depth': 8, 'min_samples_split': 6, 'min_samples_leaf': 2, 'subsample': 0.6021716757004426, 'max_features': None}. Best is trial 1454 with value: 0.30763307678022894.
[I 2024-12-04 12:52:50,401] Trial 1947 finished with value: 0.3814035302489039 and parameters: {'n_estimators': 1153, 'learning_rate': 0.034254809214176486, 'max_depth': 8, 'min_samples_split': 2, 'min_samples_leaf': 1, 'subsample': 0.6121004087067377, 'max_features': None}. Best is trial 1454 with value: 0.30763307678022894.
[I 2024-12-04 12:52:51,326] Trial 1957 finished with value: 0.3371737899503318 and parameters: {'n_estimators': 785, 'learning_rate': 0.0934831886112828, 'max_depth': 6, 'min_samples_split': 6, 'min_samples_leaf': 2, 'subsample': 0.6776324358132244, 'max_features': None}. Best is trial 1454 with value: 0.30763307678022894.
[I 2024-12-04 12:52:53,990] Trial 1956 finished with value: 0.39068606428747904 and parameters: {'n_estimators': 1059, 'learning_rate': 0.019744583760554598, 'max_depth': 10, 'min_samples_split': 18, 'min_samples_leaf': 1, 'subsample': 0.8201013253616628, 'max_features': 'sqrt'}. Best is trial 1454 with value: 0.30763307678022894.
[I 2024-12-04 12:52:53,996] Trial 1967 finished with value: 0.5209493216548278 and parameters: {'n_estimators': 626, 'learning_rate': 0.04962164256292971, 'max_depth': 8, 'min_samples_split': 6, 'min_samples_leaf': 3, 'subsample': 0.6376302344588242, 'max_features': 'log2'}. Best is trial 1454 with value: 0.30763307678022894.
[I 2024-12-04 12:52:54,001] Trial 1954 finished with value: 0.3826387128258006 and parameters: {'n_estimators': 983, 'learning_rate': 0.09437070094207532, 'max_depth': 7, 'min_samples_split': 2, 'min_samples_leaf': 3, 'subsample': 0.6527066054412425, 'max_features': None}. Best is trial 1454 with value: 0.30763307678022894.
[I 2024-12-04 12:52:56,274] Trial 1948 finished with value: 0.38689205967839707 and parameters: {'n_estimators': 1251, 'learning_rate': 0.04409649221671527, 'max_depth': 9, 'min_samples_split': 7, 'min_samples_leaf': 3, 'subsample': 0.7109655714770401, 'max_features': None}. Best is trial 1454 with value: 0.30763307678022894.
[I 2024-12-04 12:52:59,191] Trial 1953 finished with value: 0.40396293654215737 and parameters: {'n_estimators': 1157, 'learning_rate': 0.05494581291083635, 'max_depth': 6, 'min_samples_split': 3, 'min_samples_leaf': 3, 'subsample': 0.7612851413060483, 'max_features': None}. Best is trial 1454 with value: 0.30763307678022894.
[I 2024-12-04 12:52:59,280] Trial 1966 finished with value: 0.37190301357243083 and parameters: {'n_estimators': 663, 'learning_rate': 0.0948178664463796, 'max_depth': 8, 'min_samples_split': 6, 'min_samples_leaf': 4, 'subsample': 0.7862184996185206, 'max_features': None}. Best is trial 1454 with value: 0.30763307678022894.
[I 2024-12-04 12:52:59,968] Trial 1951 finished with value: 0.3798686616710048 and parameters: {'n_estimators': 1229, 'learning_rate': 0.04868775426080512, 'max_depth': 9, 'min_samples_split': 2, 'min_samples_leaf': 4, 'subsample': 0.7030053930801397, 'max_features': None}. Best is trial 1454 with value: 0.30763307678022894.
[I 2024-12-04 12:53:01,321] Trial 1961 finished with value: 0.3815386245266105 and parameters: {'n_estimators': 880, 'learning_rate': 0.06696884678702576, 'max_depth': 9, 'min_samples_split': 2, 'min_samples_leaf': 1, 'subsample': 0.6944900158294728, 'max_features': None}. Best is trial 1454 with value: 0.30763307678022894.
[I 2024-12-04 12:53:02,083] Trial 1955 finished with value: 0.4742597919912682 and parameters: {'n_estimators': 1203, 'learning_rate': 0.01432336958934467, 'max_depth': 3, 'min_samples_split': 17, 'min_samples_leaf': 8, 'subsample': 0.8358485733693736, 'max_features': None}. Best is trial 1454 with value: 0.30763307678022894.
[I 2024-12-04 12:53:02,334] Trial 1958 finished with value: 0.39297833047649267 and parameters: {'n_estimators': 1009, 'learning_rate': 0.047419319961001925, 'max_depth': 7, 'min_samples_split': 2, 'min_samples_leaf': 3, 'subsample': 0.7628930003995428, 'max_features': None}. Best is trial 1454 with value: 0.30763307678022894.
[I 2024-12-04 12:53:04,291] Trial 1959 finished with value: 0.39959050093265613 and parameters: {'n_estimators': 1061, 'learning_rate': 0.09935525194793639, 'max_depth': 9, 'min_samples_split': 3, 'min_samples_leaf': 3, 'subsample': 0.7048369223634136, 'max_features': None}. Best is trial 1454 with value: 0.30763307678022894.
[I 2024-12-04 12:53:05,232] Trial 1970 finished with value: 0.3793514469943185 and parameters: {'n_estimators': 667, 'learning_rate': 0.09249677996026985, 'max_depth': 8, 'min_samples_split': 4, 'min_samples_leaf': 1, 'subsample': 0.6651175600711439, 'max_features': None}. Best is trial 1454 with value: 0.30763307678022894.
[I 2024-12-04 12:53:07,774] Trial 1977 finished with value: 0.36564360955640773 and parameters: {'n_estimators': 583, 'learning_rate': 0.06310519594898578, 'max_depth': 9, 'min_samples_split': 7, 'min_samples_leaf': 4, 'subsample': 0.6442942984017479, 'max_features': None}. Best is trial 1454 with value: 0.30763307678022894.
[I 2024-12-04 12:53:07,850] Trial 1964 finished with value: 0.40616027871929383 and parameters: {'n_estimators': 864, 'learning_rate': 0.08478281148941645, 'max_depth': 8, 'min_samples_split': 2, 'min_samples_leaf': 1, 'subsample': 0.7274546888442459, 'max_features': None}. Best is trial 1454 with value: 0.30763307678022894.
[I 2024-12-04 12:53:09,159] Trial 1978 finished with value: 0.375922901223807 and parameters: {'n_estimators': 574, 'learning_rate': 0.08727159196351861, 'max_depth': 8, 'min_samples_split': 2, 'min_samples_leaf': 3, 'subsample': 0.6375169645179641, 'max_features': None}. Best is trial 1454 with value: 0.30763307678022894.
[I 2024-12-04 12:53:10,381] Trial 1960 finished with value: 0.3603861250185729 and parameters: {'n_estimators': 1126, 'learning_rate': 0.09375361947160392, 'max_depth': 7, 'min_samples_split': 5, 'min_samples_leaf': 1, 'subsample': 0.6536926119228071, 'max_features': None}. Best is trial 1454 with value: 0.30763307678022894.
[I 2024-12-04 12:53:12,260] Trial 1973 finished with value: 0.386354101497026 and parameters: {'n_estimators': 853, 'learning_rate': 0.09254171068985459, 'max_depth': 7, 'min_samples_split': 6, 'min_samples_leaf': 3, 'subsample': 0.6613899577400929, 'max_features': None}. Best is trial 1454 with value: 0.30763307678022894.
[I 2024-12-04 12:53:14,321] Trial 1976 finished with value: 0.3901295999724744 and parameters: {'n_estimators': 809, 'learning_rate': 0.06168355003123429, 'max_depth': 7, 'min_samples_split': 2, 'min_samples_leaf': 3, 'subsample': 0.689874905420682, 'max_features': None}. Best is trial 1454 with value: 0.30763307678022894.
[I 2024-12-04 12:53:15,766] Trial 1969 finished with value: 0.32436720944009473 and parameters: {'n_estimators': 978, 'learning_rate': 0.07271003890502067, 'max_depth': 6, 'min_samples_split': 4, 'min_samples_leaf': 2, 'subsample': 0.7701760368131727, 'max_features': None}. Best is trial 1454 with value: 0.30763307678022894.
[I 2024-12-04 12:53:18,505] Trial 1983 finished with value: 0.3886495385024151 and parameters: {'n_estimators': 704, 'learning_rate': 0.04799806208726377, 'max_depth': 7, 'min_samples_split': 6, 'min_samples_leaf': 1, 'subsample': 0.6488751668244068, 'max_features': None}. Best is trial 1454 with value: 0.30763307678022894.
[I 2024-12-04 12:53:19,188] Trial 1968 finished with value: 0.5922187646220123 and parameters: {'n_estimators': 1454, 'learning_rate': 0.02253259332418479, 'max_depth': 7, 'min_samples_split': 11, 'min_samples_leaf': 6, 'subsample': 0.7705354299314567, 'max_features': 'log2'}. Best is trial 1454 with value: 0.30763307678022894.
[I 2024-12-04 12:53:19,624] Trial 1971 finished with value: 0.32343169445777764 and parameters: {'n_estimators': 1120, 'learning_rate': 0.09299012959496183, 'max_depth': 5, 'min_samples_split': 2, 'min_samples_leaf': 2, 'subsample': 0.8664538279567575, 'max_features': None}. Best is trial 1454 with value: 0.30763307678022894.
[I 2024-12-04 12:53:21,478] Trial 1972 finished with value: 0.3749515012269372 and parameters: {'n_estimators': 1245, 'learning_rate': 0.08875413008159415, 'max_depth': 5, 'min_samples_split': 2, 'min_samples_leaf': 1, 'subsample': 0.6145440195620686, 'max_features': None}. Best is trial 1454 with value: 0.30763307678022894.
[I 2024-12-04 12:53:23,517] Trial 1981 finished with value: 0.43373194901561896 and parameters: {'n_estimators': 980, 'learning_rate': 0.022000051254424675, 'max_depth': 12, 'min_samples_split': 7, 'min_samples_leaf': 5, 'subsample': 0.8366483450313569, 'max_features': 'sqrt'}. Best is trial 1454 with value: 0.30763307678022894.
[I 2024-12-04 12:53:25,903] Trial 1994 finished with value: 0.40202138179754754 and parameters: {'n_estimators': 565, 'learning_rate': 0.056028383444286664, 'max_depth': 6, 'min_samples_split': 2, 'min_samples_leaf': 3, 'subsample': 0.7401651061347445, 'max_features': None}. Best is trial 1454 with value: 0.30763307678022894.
[I 2024-12-04 12:53:25,904] Trial 1974 finished with value: 0.3210034871857569 and parameters: {'n_estimators': 1204, 'learning_rate': 0.051173379830954616, 'max_depth': 7, 'min_samples_split': 2, 'min_samples_leaf': 2, 'subsample': 0.6127454582488464, 'max_features': None}. Best is trial 1454 with value: 0.30763307678022894.
[I 2024-12-04 12:53:26,275] Trial 1979 finished with value: 0.44271357402046263 and parameters: {'n_estimators': 1180, 'learning_rate': 0.07325865928695108, 'max_depth': 8, 'min_samples_split': 2, 'min_samples_leaf': 1, 'subsample': 0.8355713413143608, 'max_features': 'log2'}. Best is trial 1454 with value: 0.30763307678022894.
[I 2024-12-04 12:53:30,199] Trial 1985 finished with value: 0.37681638327772066 and parameters: {'n_estimators': 983, 'learning_rate': 0.05016821419198854, 'max_depth': 9, 'min_samples_split': 3, 'min_samples_leaf': 3, 'subsample': 0.6280970054735795, 'max_features': None}. Best is trial 1454 with value: 0.30763307678022894.
[I 2024-12-04 12:53:30,211] Trial 1984 finished with value: 0.3330676193898211 and parameters: {'n_estimators': 979, 'learning_rate': 0.034364926148033166, 'max_depth': 8, 'min_samples_split': 6, 'min_samples_leaf': 2, 'subsample': 0.6112070918345776, 'max_features': None}. Best is trial 1454 with value: 0.30763307678022894.
[I 2024-12-04 12:53:31,641] Trial 1975 finished with value: 0.3834290523079396 and parameters: {'n_estimators': 1326, 'learning_rate': 0.060180022520947646, 'max_depth': 7, 'min_samples_split': 2, 'min_samples_leaf': 3, 'subsample': 0.7132547049743886, 'max_features': None}. Best is trial 1454 with value: 0.30763307678022894.
[I 2024-12-04 12:53:33,252] Trial 1982 finished with value: 0.3783676853477653 and parameters: {'n_estimators': 1106, 'learning_rate': 0.0650152715789245, 'max_depth': 9, 'min_samples_split': 9, 'min_samples_leaf': 1, 'subsample': 0.671008321769586, 'max_features': None}. Best is trial 1454 with value: 0.30763307678022894.
[I 2024-12-04 12:53:35,442] Trial 2003 finished with value: 0.4446177747616818 and parameters: {'n_estimators': 699, 'learning_rate': 0.03250624491146442, 'max_depth': 7, 'min_samples_split': 15, 'min_samples_leaf': 3, 'subsample': 0.9990133150323941, 'max_features': 'sqrt'}. Best is trial 1454 with value: 0.30763307678022894.
[I 2024-12-04 12:53:37,417] Trial 1989 finished with value: 0.38325683685969547 and parameters: {'n_estimators': 1064, 'learning_rate': 0.052946134895851406, 'max_depth': 7, 'min_samples_split': 6, 'min_samples_leaf': 1, 'subsample': 0.6948027984424008, 'max_features': None}. Best is trial 1454 with value: 0.30763307678022894.
[I 2024-12-04 12:53:37,426] Trial 1998 finished with value: 0.3921999678314482 and parameters: {'n_estimators': 787, 'learning_rate': 0.0534497854657769, 'max_depth': 8, 'min_samples_split': 5, 'min_samples_leaf': 3, 'subsample': 0.7260303843177629, 'max_features': None}. Best is trial 1454 with value: 0.30763307678022894.
[I 2024-12-04 12:53:40,023] Trial 1991 finished with value: 0.3814326763749491 and parameters: {'n_estimators': 1039, 'learning_rate': 0.05197754247195416, 'max_depth': 9, 'min_samples_split': 2, 'min_samples_leaf': 3, 'subsample': 0.6925633483841441, 'max_features': None}. Best is trial 1454 with value: 0.30763307678022894.
[I 2024-12-04 12:53:41,060] Trial 1995 finished with value: 0.34298074506129145 and parameters: {'n_estimators': 992, 'learning_rate': 0.06482827227372712, 'max_depth': 7, 'min_samples_split': 8, 'min_samples_leaf': 2, 'subsample': 0.6246670745007203, 'max_features': None}. Best is trial 1454 with value: 0.30763307678022894.
[I 2024-12-04 12:53:41,608] Trial 1980 finished with value: 0.383341997492792 and parameters: {'n_estimators': 1492, 'learning_rate': 0.08087268389024713, 'max_depth': 6, 'min_samples_split': 2, 'min_samples_leaf': 1, 'subsample': 0.6582544634083405, 'max_features': None}. Best is trial 1454 with value: 0.30763307678022894.
[I 2024-12-04 12:53:42,791] Trial 1990 finished with value: 0.37455127689803575 and parameters: {'n_estimators': 1177, 'learning_rate': 0.07194706108906469, 'max_depth': 8, 'min_samples_split': 5, 'min_samples_leaf': 1, 'subsample': 0.6178491451201313, 'max_features': None}. Best is trial 1454 with value: 0.30763307678022894.
[I 2024-12-04 12:53:43,034] Trial 1987 finished with value: 0.38289827749791117 and parameters: {'n_estimators': 1294, 'learning_rate': 0.03941508274253663, 'max_depth': 7, 'min_samples_split': 6, 'min_samples_leaf': 3, 'subsample': 0.6042861266792463, 'max_features': None}. Best is trial 1454 with value: 0.30763307678022894.
[I 2024-12-04 12:53:44,135] Trial 1993 finished with value: 0.3341695650812291 and parameters: {'n_estimators': 1091, 'learning_rate': 0.0494089177740847, 'max_depth': 9, 'min_samples_split': 6, 'min_samples_leaf': 2, 'subsample': 0.6273481561545947, 'max_features': None}. Best is trial 1454 with value: 0.30763307678022894.
[I 2024-12-04 12:53:44,864] Trial 1988 finished with value: 0.3915342152171251 and parameters: {'n_estimators': 1250, 'learning_rate': 0.04106159811377943, 'max_depth': 7, 'min_samples_split': 4, 'min_samples_leaf': 3, 'subsample': 0.6975672052400355, 'max_features': None}. Best is trial 1454 with value: 0.30763307678022894.
[I 2024-12-04 12:53:45,819] Trial 2002 finished with value: 0.4781777284301367 and parameters: {'n_estimators': 1091, 'learning_rate': 0.019254219127037966, 'max_depth': 8, 'min_samples_split': 7, 'min_samples_leaf': 7, 'subsample': 0.8067978344047634, 'max_features': 'sqrt'}. Best is trial 1454 with value: 0.30763307678022894.
[I 2024-12-04 12:53:47,014] Trial 1986 finished with value: 0.3730689589285316 and parameters: {'n_estimators': 1350, 'learning_rate': 0.016776620987924703, 'max_depth': 7, 'min_samples_split': 10, 'min_samples_leaf': 2, 'subsample': 0.862589571646773, 'max_features': None}. Best is trial 1454 with value: 0.30763307678022894.
[I 2024-12-04 12:53:49,232] Trial 2004 finished with value: 0.41916640992389936 and parameters: {'n_estimators': 1083, 'learning_rate': 0.03718829837115129, 'max_depth': 6, 'min_samples_split': 5, 'min_samples_leaf': 1, 'subsample': 0.6654238861411804, 'max_features': 'log2'}. Best is trial 1454 with value: 0.30763307678022894.
[I 2024-12-04 12:53:50,175] Trial 2008 finished with value: 0.3708170681701992 and parameters: {'n_estimators': 741, 'learning_rate': 0.09286595745865636, 'max_depth': 7, 'min_samples_split': 5, 'min_samples_leaf': 4, 'subsample': 0.698340947831305, 'max_features': None}. Best is trial 1454 with value: 0.30763307678022894.
[I 2024-12-04 12:53:50,756] Trial 1997 finished with value: 0.3499927353413123 and parameters: {'n_estimators': 1146, 'learning_rate': 0.05250430298322042, 'max_depth': 8, 'min_samples_split': 11, 'min_samples_leaf': 2, 'subsample': 0.6998158476860894, 'max_features': None}. Best is trial 1454 with value: 0.30763307678022894.
[I 2024-12-04 12:53:52,374] Trial 1992 finished with value: 0.3239434222779422 and parameters: {'n_estimators': 1398, 'learning_rate': 0.0496825479968673, 'max_depth': 7, 'min_samples_split': 4, 'min_samples_leaf': 2, 'subsample': 0.603356349119935, 'max_features': None}. Best is trial 1454 with value: 0.30763307678022894.
[I 2024-12-04 12:53:53,683] Trial 2000 finished with value: 0.3925622563117197 and parameters: {'n_estimators': 1146, 'learning_rate': 0.0638603087198255, 'max_depth': 7, 'min_samples_split': 4, 'min_samples_leaf': 3, 'subsample': 0.7749784880558209, 'max_features': None}. Best is trial 1454 with value: 0.30763307678022894.
[I 2024-12-04 12:53:55,029] Trial 1999 finished with value: 0.32951422340937425 and parameters: {'n_estimators': 1185, 'learning_rate': 0.061443223950709766, 'max_depth': 6, 'min_samples_split': 2, 'min_samples_leaf': 2, 'subsample': 0.8625519787570494, 'max_features': None}. Best is trial 1454 with value: 0.30763307678022894.
[I 2024-12-04 12:53:57,226] Trial 1996 finished with value: 0.37706215535406906 and parameters: {'n_estimators': 1377, 'learning_rate': 0.08589908829594503, 'max_depth': 9, 'min_samples_split': 6, 'min_samples_leaf': 3, 'subsample': 0.6229772160033253, 'max_features': None}. Best is trial 1454 with value: 0.30763307678022894.
[I 2024-12-04 12:53:57,256] Trial 2023 finished with value: 0.4875337074387051 and parameters: {'n_estimators': 374, 'learning_rate': 0.05024594031586202, 'max_depth': 9, 'min_samples_split': 13, 'min_samples_leaf': 6, 'subsample': 0.6602568832242729, 'max_features': 'sqrt'}. Best is trial 1454 with value: 0.30763307678022894.
[I 2024-12-04 12:53:58,101] Trial 2028 finished with value: 0.77668062971914 and parameters: {'n_estimators': 231, 'learning_rate': 0.0826951269306472, 'max_depth': 5, 'min_samples_split': 5, 'min_samples_leaf': 8, 'subsample': 0.9334207926144221, 'max_features': 'log2'}. Best is trial 1454 with value: 0.30763307678022894.
[I 2024-12-04 12:53:59,533] Trial 2007 finished with value: 0.3702924932345494 and parameters: {'n_estimators': 1026, 'learning_rate': 0.05798314945134137, 'max_depth': 7, 'min_samples_split': 3, 'min_samples_leaf': 4, 'subsample': 0.6229996909240528, 'max_features': None}. Best is trial 1454 with value: 0.30763307678022894.
[I 2024-12-04 12:54:01,484] Trial 2026 finished with value: 0.39730270618152613 and parameters: {'n_estimators': 329, 'learning_rate': 0.08121295685070827, 'max_depth': 6, 'min_samples_split': 2, 'min_samples_leaf': 3, 'subsample': 0.615838830815302, 'max_features': None}. Best is trial 1454 with value: 0.30763307678022894.
[I 2024-12-04 12:54:02,254] Trial 2001 finished with value: 0.3771741706343914 and parameters: {'n_estimators': 1383, 'learning_rate': 0.04458964323078763, 'max_depth': 7, 'min_samples_split': 6, 'min_samples_leaf': 1, 'subsample': 0.6251872978955245, 'max_features': None}. Best is trial 1454 with value: 0.30763307678022894.
