[I 2024-12-04 15:16:53,284] Trial 1221 finished with value: 0.42473185785543416 and parameters: {'n_estimators': 832, 'max_depth': 32, 'min_samples_split': 3, 'min_samples_leaf': 1, 'max_features': None, 'bootstrap': True, 'criterion': 'squared_error'}. Best is trial 1025 with value: 0.41844370194907604.
[I 2024-12-04 15:16:57,001] Trial 1223 finished with value: 0.4316959116433597 and parameters: {'n_estimators': 871, 'max_depth': 40, 'min_samples_split': 4, 'min_samples_leaf': 1, 'max_features': None, 'bootstrap': True, 'criterion': 'squared_error'}. Best is trial 1025 with value: 0.41844370194907604.
[I 2024-12-04 15:16:57,983] Trial 1218 finished with value: 0.465334356747893 and parameters: {'n_estimators': 919, 'max_depth': 36, 'min_samples_split': 2, 'min_samples_leaf': 2, 'max_features': None, 'bootstrap': True, 'criterion': 'squared_error'}. Best is trial 1025 with value: 0.41844370194907604.
[I 2024-12-04 15:17:03,882] Trial 1226 finished with value: 0.4201885345544769 and parameters: {'n_estimators': 864, 'max_depth': 48, 'min_samples_split': 2, 'min_samples_leaf': 1, 'max_features': None, 'bootstrap': True, 'criterion': 'squared_error'}. Best is trial 1025 with value: 0.41844370194907604.
[I 2024-12-04 15:17:03,908] Trial 1230 finished with value: 0.42100673533696575 and parameters: {'n_estimators': 841, 'max_depth': 44, 'min_samples_split': 2, 'min_samples_leaf': 1, 'max_features': None, 'bootstrap': True, 'criterion': 'squared_error'}. Best is trial 1025 with value: 0.41844370194907604.
[I 2024-12-04 15:17:06,693] Trial 1229 finished with value: 0.41896268503302164 and parameters: {'n_estimators': 829, 'max_depth': 40, 'min_samples_split': 2, 'min_samples_leaf': 1, 'max_features': None, 'bootstrap': True, 'criterion': 'squared_error'}. Best is trial 1025 with value: 0.41844370194907604.
[I 2024-12-04 15:17:07,351] Trial 1237 finished with value: 0.5057769780047454 and parameters: {'n_estimators': 713, 'max_depth': 36, 'min_samples_split': 3, 'min_samples_leaf': 1, 'max_features': None, 'bootstrap': False, 'criterion': 'squared_error'}. Best is trial 1025 with value: 0.41844370194907604.
[I 2024-12-04 15:17:08,314] Trial 1231 finished with value: 0.4645767951073771 and parameters: {'n_estimators': 727, 'max_depth': 44, 'min_samples_split': 2, 'min_samples_leaf': 2, 'max_features': None, 'bootstrap': True, 'criterion': 'squared_error'}. Best is trial 1025 with value: 0.41844370194907604.
[I 2024-12-04 15:17:09,022] Trial 1228 finished with value: 0.4204096755016128 and parameters: {'n_estimators': 821, 'max_depth': 38, 'min_samples_split': 2, 'min_samples_leaf': 1, 'max_features': None, 'bootstrap': True, 'criterion': 'squared_error'}. Best is trial 1025 with value: 0.41844370194907604.
[I 2024-12-04 15:17:09,655] Trial 1234 finished with value: 0.4194559540623761 and parameters: {'n_estimators': 779, 'max_depth': 39, 'min_samples_split': 2, 'min_samples_leaf': 1, 'max_features': None, 'bootstrap': True, 'criterion': 'squared_error'}. Best is trial 1025 with value: 0.41844370194907604.
[I 2024-12-04 15:17:10,842] Trial 1235 finished with value: 0.42279822289265107 and parameters: {'n_estimators': 885, 'max_depth': 30, 'min_samples_split': 2, 'min_samples_leaf': 1, 'max_features': None, 'bootstrap': True, 'criterion': 'squared_error'}. Best is trial 1025 with value: 0.41844370194907604.
[I 2024-12-04 15:17:11,185] Trial 1225 finished with value: 0.4215594876243583 and parameters: {'n_estimators': 918, 'max_depth': 49, 'min_samples_split': 2, 'min_samples_leaf': 1, 'max_features': None, 'bootstrap': True, 'criterion': 'squared_error'}. Best is trial 1025 with value: 0.41844370194907604.
[I 2024-12-04 15:17:13,765] Trial 1233 finished with value: 0.4197088502917284 and parameters: {'n_estimators': 751, 'max_depth': 39, 'min_samples_split': 2, 'min_samples_leaf': 1, 'max_features': None, 'bootstrap': True, 'criterion': 'squared_error'}. Best is trial 1025 with value: 0.41844370194907604.
[I 2024-12-04 15:17:14,626] Trial 1227 finished with value: 0.4203550275165622 and parameters: {'n_estimators': 995, 'max_depth': 42, 'min_samples_split': 2, 'min_samples_leaf': 1, 'max_features': None, 'bootstrap': True, 'criterion': 'squared_error'}. Best is trial 1025 with value: 0.41844370194907604.
[I 2024-12-04 15:17:14,630] Trial 1239 finished with value: 0.9647641743253238 and parameters: {'n_estimators': 518, 'max_depth': 19, 'min_samples_split': 2, 'min_samples_leaf': 2, 'max_features': 'log2', 'bootstrap': True, 'criterion': 'absolute_error'}. Best is trial 1025 with value: 0.41844370194907604.
[I 2024-12-04 15:17:15,011] Trial 1238 finished with value: 0.4322080930570332 and parameters: {'n_estimators': 790, 'max_depth': 42, 'min_samples_split': 4, 'min_samples_leaf': 1, 'max_features': None, 'bootstrap': True, 'criterion': 'squared_error'}. Best is trial 1025 with value: 0.41844370194907604.
[I 2024-12-04 15:17:16,577] Trial 1240 finished with value: 0.4649292326180601 and parameters: {'n_estimators': 740, 'max_depth': 36, 'min_samples_split': 3, 'min_samples_leaf': 2, 'max_features': None, 'bootstrap': True, 'criterion': 'squared_error'}. Best is trial 1025 with value: 0.41844370194907604.
[I 2024-12-04 15:17:16,602] Trial 1244 finished with value: 0.935260146509872 and parameters: {'n_estimators': 307, 'max_depth': 7, 'min_samples_split': 2, 'min_samples_leaf': 5, 'max_features': 'sqrt', 'bootstrap': False, 'criterion': 'absolute_error'}. Best is trial 1025 with value: 0.41844370194907604.
[I 2024-12-04 15:17:18,464] Trial 1236 finished with value: 0.4312064467300415 and parameters: {'n_estimators': 854, 'max_depth': 37, 'min_samples_split': 4, 'min_samples_leaf': 1, 'max_features': None, 'bootstrap': True, 'criterion': 'squared_error'}. Best is trial 1025 with value: 0.41844370194907604.
[I 2024-12-04 15:17:19,140] Trial 1245 finished with value: 1.053767966776703 and parameters: {'n_estimators': 952, 'max_depth': 23, 'min_samples_split': 28, 'min_samples_leaf': 12, 'max_features': 'log2', 'bootstrap': False, 'criterion': 'absolute_error'}. Best is trial 1025 with value: 0.41844370194907604.
[I 2024-12-04 15:17:20,749] Trial 1250 finished with value: 0.584859367406723 and parameters: {'n_estimators': 118, 'max_depth': 48, 'min_samples_split': 30, 'min_samples_leaf': 3, 'max_features': None, 'bootstrap': False, 'criterion': 'squared_error'}. Best is trial 1025 with value: 0.41844370194907604.
[I 2024-12-04 15:17:20,891] Trial 1246 finished with value: 0.42282437886016194 and parameters: {'n_estimators': 696, 'max_depth': 35, 'min_samples_split': 2, 'min_samples_leaf': 1, 'max_features': None, 'bootstrap': True, 'criterion': 'squared_error'}. Best is trial 1025 with value: 0.41844370194907604.
[I 2024-12-04 15:17:20,920] Trial 1242 finished with value: 0.46541859620041465 and parameters: {'n_estimators': 983, 'max_depth': 31, 'min_samples_split': 2, 'min_samples_leaf': 2, 'max_features': None, 'bootstrap': True, 'criterion': 'squared_error'}. Best is trial 1025 with value: 0.41844370194907604.
[I 2024-12-04 15:17:21,022] Trial 1241 finished with value: 0.42057911569141604 and parameters: {'n_estimators': 709, 'max_depth': 48, 'min_samples_split': 2, 'min_samples_leaf': 1, 'max_features': None, 'bootstrap': True, 'criterion': 'squared_error'}. Best is trial 1025 with value: 0.41844370194907604.
[I 2024-12-04 15:17:23,521] Trial 1247 finished with value: 0.465497547977941 and parameters: {'n_estimators': 784, 'max_depth': 38, 'min_samples_split': 2, 'min_samples_leaf': 2, 'max_features': None, 'bootstrap': True, 'criterion': 'squared_error'}. Best is trial 1025 with value: 0.41844370194907604.
[I 2024-12-04 15:17:23,738] Trial 1253 finished with value: 1.0003390105980214 and parameters: {'n_estimators': 968, 'max_depth': 9, 'min_samples_split': 14, 'min_samples_leaf': 8, 'max_features': 'sqrt', 'bootstrap': True, 'criterion': 'squared_error'}. Best is trial 1025 with value: 0.41844370194907604.
[I 2024-12-04 15:17:28,794] Trial 1243 finished with value: 0.4653223257929724 and parameters: {'n_estimators': 827, 'max_depth': 45, 'min_samples_split': 2, 'min_samples_leaf': 2, 'max_features': None, 'bootstrap': True, 'criterion': 'squared_error'}. Best is trial 1025 with value: 0.41844370194907604.
[I 2024-12-04 15:17:29,263] Trial 1252 finished with value: 0.42073787470548246 and parameters: {'n_estimators': 999, 'max_depth': 34, 'min_samples_split': 2, 'min_samples_leaf': 1, 'max_features': None, 'bootstrap': True, 'criterion': 'squared_error'}. Best is trial 1025 with value: 0.41844370194907604.
[I 2024-12-04 15:17:30,836] Trial 1251 finished with value: 0.4210216119673248 and parameters: {'n_estimators': 867, 'max_depth': 34, 'min_samples_split': 2, 'min_samples_leaf': 1, 'max_features': None, 'bootstrap': True, 'criterion': 'squared_error'}. Best is trial 1025 with value: 0.41844370194907604.
[I 2024-12-04 15:17:34,062] Trial 1249 finished with value: 0.44146707887014974 and parameters: {'n_estimators': 997, 'max_depth': 30, 'min_samples_split': 9, 'min_samples_leaf': 1, 'max_features': None, 'bootstrap': True, 'criterion': 'squared_error'}. Best is trial 1025 with value: 0.41844370194907604.
[I 2024-12-04 15:17:36,275] Trial 1258 finished with value: 0.564520272471877 and parameters: {'n_estimators': 945, 'max_depth': 50, 'min_samples_split': 38, 'min_samples_leaf': 1, 'max_features': 'sqrt', 'bootstrap': False, 'criterion': 'squared_error'}. Best is trial 1025 with value: 0.41844370194907604.
[I 2024-12-04 15:17:37,947] Trial 1254 finished with value: 0.4194961153969946 and parameters: {'n_estimators': 870, 'max_depth': 41, 'min_samples_split': 2, 'min_samples_leaf': 1, 'max_features': None, 'bootstrap': True, 'criterion': 'squared_error'}. Best is trial 1025 with value: 0.41844370194907604.
[I 2024-12-04 15:17:39,854] Trial 1270 finished with value: 1.0023211793824691 and parameters: {'n_estimators': 723, 'max_depth': 9, 'min_samples_split': 10, 'min_samples_leaf': 3, 'max_features': 'log2', 'bootstrap': False, 'criterion': 'squared_error'}. Best is trial 1025 with value: 0.41844370194907604.
[I 2024-12-04 15:17:43,746] Trial 1271 finished with value: 1.001143346939435 and parameters: {'n_estimators': 492, 'max_depth': 6, 'min_samples_split': 15, 'min_samples_leaf': 11, 'max_features': 'sqrt', 'bootstrap': False, 'criterion': 'squared_error'}. Best is trial 1025 with value: 0.41844370194907604.
[I 2024-12-04 15:17:43,766] Trial 1255 finished with value: 0.4235499028492575 and parameters: {'n_estimators': 856, 'max_depth': 37, 'min_samples_split': 3, 'min_samples_leaf': 1, 'max_features': None, 'bootstrap': True, 'criterion': 'squared_error'}. Best is trial 1025 with value: 0.41844370194907604.
[I 2024-12-04 15:17:43,989] Trial 1259 finished with value: 0.4195401830625556 and parameters: {'n_estimators': 838, 'max_depth': 39, 'min_samples_split': 2, 'min_samples_leaf': 1, 'max_features': None, 'bootstrap': True, 'criterion': 'squared_error'}. Best is trial 1025 with value: 0.41844370194907604.
[I 2024-12-04 15:17:44,047] Trial 1264 finished with value: 0.6958354627011714 and parameters: {'n_estimators': 746, 'max_depth': 32, 'min_samples_split': 4, 'min_samples_leaf': 1, 'max_features': 'log2', 'bootstrap': True, 'criterion': 'squared_error'}. Best is trial 1025 with value: 0.41844370194907604.
[I 2024-12-04 15:17:53,607] Trial 1257 finished with value: 0.5907311188359133 and parameters: {'n_estimators': 462, 'max_depth': 45, 'min_samples_split': 24, 'min_samples_leaf': 4, 'max_features': None, 'bootstrap': True, 'criterion': 'absolute_error'}. Best is trial 1025 with value: 0.41844370194907604.
[I 2024-12-04 15:18:00,460] Trial 1260 finished with value: 0.4329265599029764 and parameters: {'n_estimators': 959, 'max_depth': 32, 'min_samples_split': 4, 'min_samples_leaf': 1, 'max_features': None, 'bootstrap': True, 'criterion': 'squared_error'}. Best is trial 1025 with value: 0.41844370194907604.
[I 2024-12-04 15:18:01,672] Trial 1256 finished with value: 0.42011317028368156 and parameters: {'n_estimators': 872, 'max_depth': 38, 'min_samples_split': 2, 'min_samples_leaf': 1, 'max_features': None, 'bootstrap': True, 'criterion': 'squared_error'}. Best is trial 1025 with value: 0.41844370194907604.
[I 2024-12-04 15:18:01,729] Trial 1269 finished with value: 1.0153914023999961 and parameters: {'n_estimators': 230, 'max_depth': 16, 'min_samples_split': 42, 'min_samples_leaf': 4, 'max_features': 'log2', 'bootstrap': False, 'criterion': 'squared_error'}. Best is trial 1025 with value: 0.41844370194907604.
[I 2024-12-04 15:18:03,662] Trial 1261 finished with value: 0.423973064437877 and parameters: {'n_estimators': 861, 'max_depth': 44, 'min_samples_split': 3, 'min_samples_leaf': 1, 'max_features': None, 'bootstrap': True, 'criterion': 'squared_error'}. Best is trial 1025 with value: 0.41844370194907604.
[I 2024-12-04 15:18:05,977] Trial 1265 finished with value: 0.4441800599342277 and parameters: {'n_estimators': 764, 'max_depth': 37, 'min_samples_split': 11, 'min_samples_leaf': 1, 'max_features': None, 'bootstrap': True, 'criterion': 'squared_error'}. Best is trial 1025 with value: 0.41844370194907604.
[I 2024-12-04 15:18:06,023] Trial 1267 finished with value: 0.41915042102199507 and parameters: {'n_estimators': 992, 'max_depth': 41, 'min_samples_split': 2, 'min_samples_leaf': 1, 'max_features': None, 'bootstrap': True, 'criterion': 'squared_error'}. Best is trial 1025 with value: 0.41844370194907604.
[I 2024-12-04 15:18:06,398] Trial 1272 finished with value: 0.4193886172300017 and parameters: {'n_estimators': 856, 'max_depth': 39, 'min_samples_split': 2, 'min_samples_leaf': 1, 'max_features': None, 'bootstrap': True, 'criterion': 'squared_error'}. Best is trial 1025 with value: 0.41844370194907604.
[I 2024-12-04 15:18:08,027] Trial 1266 finished with value: 0.43152305184633794 and parameters: {'n_estimators': 865, 'max_depth': 42, 'min_samples_split': 4, 'min_samples_leaf': 1, 'max_features': None, 'bootstrap': True, 'criterion': 'squared_error'}. Best is trial 1025 with value: 0.41844370194907604.
[I 2024-12-04 15:18:10,086] Trial 1276 finished with value: 0.46510393695896407 and parameters: {'n_estimators': 855, 'max_depth': 48, 'min_samples_split': 2, 'min_samples_leaf': 2, 'max_features': None, 'bootstrap': True, 'criterion': 'squared_error'}. Best is trial 1025 with value: 0.41844370194907604.
[I 2024-12-04 15:18:10,276] Trial 1263 finished with value: 0.4191517235060517 and parameters: {'n_estimators': 817, 'max_depth': 40, 'min_samples_split': 2, 'min_samples_leaf': 1, 'max_features': None, 'bootstrap': True, 'criterion': 'squared_error'}. Best is trial 1025 with value: 0.41844370194907604.
[I 2024-12-04 15:18:10,305] Trial 1279 finished with value: 0.9793121163195346 and parameters: {'n_estimators': 665, 'max_depth': 5, 'min_samples_split': 22, 'min_samples_leaf': 5, 'max_features': 'sqrt', 'bootstrap': True, 'criterion': 'squared_error'}. Best is trial 1025 with value: 0.41844370194907604.
[I 2024-12-04 15:18:10,323] Trial 1277 finished with value: 0.4247720342628649 and parameters: {'n_estimators': 753, 'max_depth': 42, 'min_samples_split': 3, 'min_samples_leaf': 1, 'max_features': None, 'bootstrap': True, 'criterion': 'squared_error'}. Best is trial 1025 with value: 0.41844370194907604.
[I 2024-12-04 15:18:10,398] Trial 1197 finished with value: 0.5550371823969662 and parameters: {'n_estimators': 835, 'max_depth': 33, 'min_samples_split': 2, 'min_samples_leaf': 1, 'max_features': None, 'bootstrap': False, 'criterion': 'absolute_error'}. Best is trial 1025 with value: 0.41844370194907604.
[I 2024-12-04 15:18:10,413] Trial 1268 finished with value: 0.4651830858840564 and parameters: {'n_estimators': 851, 'max_depth': 38, 'min_samples_split': 4, 'min_samples_leaf': 2, 'max_features': None, 'bootstrap': True, 'criterion': 'squared_error'}. Best is trial 1025 with value: 0.41844370194907604.
[I 2024-12-04 15:18:10,414] Trial 1273 finished with value: 0.42486071922944435 and parameters: {'n_estimators': 745, 'max_depth': 43, 'min_samples_split': 3, 'min_samples_leaf': 1, 'max_features': None, 'bootstrap': True, 'criterion': 'squared_error'}. Best is trial 1025 with value: 0.41844370194907604.
[I 2024-12-04 15:18:10,436] Trial 1274 finished with value: 0.46510413927482225 and parameters: {'n_estimators': 903, 'max_depth': 46, 'min_samples_split': 2, 'min_samples_leaf': 2, 'max_features': None, 'bootstrap': True, 'criterion': 'squared_error'}. Best is trial 1025 with value: 0.41844370194907604.
[I 2024-12-04 15:18:10,533] Trial 1262 finished with value: 0.4316907638341664 and parameters: {'n_estimators': 987, 'max_depth': 43, 'min_samples_split': 4, 'min_samples_leaf': 1, 'max_features': None, 'bootstrap': True, 'criterion': 'squared_error'}. Best is trial 1025 with value: 0.41844370194907604.
[I 2024-12-04 15:18:11,044] Trial 1280 finished with value: 0.623609432785355 and parameters: {'n_estimators': 747, 'max_depth': 41, 'min_samples_split': 2, 'min_samples_leaf': 1, 'max_features': 'log2', 'bootstrap': True, 'criterion': 'squared_error'}. Best is trial 1025 with value: 0.41844370194907604.
[I 2024-12-04 15:18:11,835] Trial 1278 finished with value: 0.5351646466139907 and parameters: {'n_estimators': 745, 'max_depth': 37, 'min_samples_split': 4, 'min_samples_leaf': 1, 'max_features': 'sqrt', 'bootstrap': True, 'criterion': 'squared_error'}. Best is trial 1025 with value: 0.41844370194907604.
[I 2024-12-04 15:18:13,469] Trial 1275 finished with value: 0.4213393175304438 and parameters: {'n_estimators': 779, 'max_depth': 32, 'min_samples_split': 2, 'min_samples_leaf': 1, 'max_features': None, 'bootstrap': True, 'criterion': 'squared_error'}. Best is trial 1025 with value: 0.41844370194907604.
[I 2024-12-04 15:18:17,754] Trial 1282 finished with value: 0.41972897265897785 and parameters: {'n_estimators': 792, 'max_depth': 41, 'min_samples_split': 2, 'min_samples_leaf': 1, 'max_features': None, 'bootstrap': True, 'criterion': 'squared_error'}. Best is trial 1025 with value: 0.41844370194907604.
[I 2024-12-04 15:18:20,401] Trial 1285 finished with value: 0.4656729204470457 and parameters: {'n_estimators': 793, 'max_depth': 33, 'min_samples_split': 2, 'min_samples_leaf': 2, 'max_features': None, 'bootstrap': True, 'criterion': 'squared_error'}. Best is trial 1025 with value: 0.41844370194907604.
[I 2024-12-04 15:18:26,943] Trial 1284 finished with value: 0.4202030191841788 and parameters: {'n_estimators': 978, 'max_depth': 43, 'min_samples_split': 2, 'min_samples_leaf': 1, 'max_features': None, 'bootstrap': True, 'criterion': 'squared_error'}. Best is trial 1025 with value: 0.41844370194907604.
[I 2024-12-04 15:18:28,815] Trial 1294 finished with value: 1.0361256939078574 and parameters: {'n_estimators': 592, 'max_depth': 44, 'min_samples_split': 7, 'min_samples_leaf': 4, 'max_features': 'log2', 'bootstrap': True, 'criterion': 'absolute_error'}. Best is trial 1025 with value: 0.41844370194907604.
[I 2024-12-04 15:18:32,048] Trial 1283 finished with value: 0.4191763968919008 and parameters: {'n_estimators': 996, 'max_depth': 40, 'min_samples_split': 2, 'min_samples_leaf': 1, 'max_features': None, 'bootstrap': True, 'criterion': 'squared_error'}. Best is trial 1025 with value: 0.41844370194907604.
[I 2024-12-04 15:18:33,321] Trial 1248 finished with value: 0.465116478151182 and parameters: {'n_estimators': 970, 'max_depth': 48, 'min_samples_split': 8, 'min_samples_leaf': 2, 'max_features': None, 'bootstrap': True, 'criterion': 'absolute_error'}. Best is trial 1025 with value: 0.41844370194907604.
[I 2024-12-04 15:18:34,120] Trial 1300 finished with value: 0.8209942718424901 and parameters: {'n_estimators': 178, 'max_depth': 13, 'min_samples_split': 37, 'min_samples_leaf': 4, 'max_features': 'sqrt', 'bootstrap': False, 'criterion': 'squared_error'}. Best is trial 1025 with value: 0.41844370194907604.
[I 2024-12-04 15:18:38,271] Trial 1286 finished with value: 0.42046207865271695 and parameters: {'n_estimators': 966, 'max_depth': 43, 'min_samples_split': 2, 'min_samples_leaf': 1, 'max_features': None, 'bootstrap': True, 'criterion': 'squared_error'}. Best is trial 1025 with value: 0.41844370194907604.
[I 2024-12-04 15:18:40,241] Trial 1288 finished with value: 0.4656237117785721 and parameters: {'n_estimators': 955, 'max_depth': 39, 'min_samples_split': 2, 'min_samples_leaf': 2, 'max_features': None, 'bootstrap': True, 'criterion': 'squared_error'}. Best is trial 1025 with value: 0.41844370194907604.
[I 2024-12-04 15:18:40,253] Trial 1281 finished with value: 0.42229966173559447 and parameters: {'n_estimators': 998, 'max_depth': 28, 'min_samples_split': 2, 'min_samples_leaf': 1, 'max_features': None, 'bootstrap': True, 'criterion': 'squared_error'}. Best is trial 1025 with value: 0.41844370194907604.
[I 2024-12-04 15:18:42,313] Trial 1290 finished with value: 0.4196920714503907 and parameters: {'n_estimators': 936, 'max_depth': 38, 'min_samples_split': 2, 'min_samples_leaf': 1, 'max_features': None, 'bootstrap': True, 'criterion': 'squared_error'}. Best is trial 1025 with value: 0.41844370194907604.
[I 2024-12-04 15:18:42,328] Trial 1287 finished with value: 0.4209416809521964 and parameters: {'n_estimators': 994, 'max_depth': 49, 'min_samples_split': 2, 'min_samples_leaf': 1, 'max_features': None, 'bootstrap': True, 'criterion': 'squared_error'}. Best is trial 1025 with value: 0.41844370194907604.
[I 2024-12-04 15:18:44,546] Trial 1291 finished with value: 0.43118105775449456 and parameters: {'n_estimators': 980, 'max_depth': 38, 'min_samples_split': 4, 'min_samples_leaf': 1, 'max_features': None, 'bootstrap': True, 'criterion': 'squared_error'}. Best is trial 1025 with value: 0.41844370194907604.
