[I 2024-12-03 18:46:28,553] Trial 188 finished with value: 0.43018278398273596 and parameters: {'kernel': 'poly', 'C': 1.1775194829024191, 'gamma': 0.5549673323866297, 'epsilon': 0.16915377207682075}. Best is trial 345 with value: 0.13438257115663557.
[I 2024-12-03 18:46:30,357] Trial 503 finished with value: 0.14091201283607377 and parameters: {'kernel': 'linear', 'C': 10.810988586786065, 'gamma': 0.0012277375244968054, 'epsilon': 0.09822942901797}. Best is trial 345 with value: 0.13438257115663557.
[I 2024-12-03 18:46:31,311] Trial 498 finished with value: 0.13493156786747834 and parameters: {'kernel': 'linear', 'C': 11.623996794748656, 'gamma': 0.00011195800112748816, 'epsilon': 0.06782672320740905}. Best is trial 345 with value: 0.13438257115663557.
[I 2024-12-03 18:46:32,379] Trial 509 finished with value: 1.3549772885826217 and parameters: {'kernel': 'poly', 'C': 13.035401357007881, 'gamma': 0.0001825120679876128, 'epsilon': 0.07604499587169464}. Best is trial 345 with value: 0.13438257115663557.
[I 2024-12-03 18:46:33,317] Trial 511 finished with value: 0.15039782097461507 and parameters: {'kernel': 'linear', 'C': 4.227880333658318, 'gamma': 0.00010931437754413035, 'epsilon': 0.11477286822180659}. Best is trial 345 with value: 0.13438257115663557.
[I 2024-12-03 18:46:33,543] Trial 512 finished with value: 0.15313722972806676 and parameters: {'kernel': 'linear', 'C': 3.3395372639721823, 'gamma': 0.00012701784807666886, 'epsilon': 0.11604844641768874}. Best is trial 345 with value: 0.13438257115663557.
[I 2024-12-03 18:46:34,304] Trial 504 finished with value: 0.13647995220596282 and parameters: {'kernel': 'linear', 'C': 8.22709135140518, 'gamma': 0.000614598739643385, 'epsilon': 0.05357978889288943}. Best is trial 345 with value: 0.13438257115663557.
[I 2024-12-03 18:46:35,199] Trial 514 finished with value: 0.16380144811122518 and parameters: {'kernel': 'linear', 'C': 2.2624598037543686, 'gamma': 0.03648574801150089, 'epsilon': 0.13596144850725117}. Best is trial 345 with value: 0.13438257115663557.
[I 2024-12-03 18:46:35,242] Trial 423 finished with value: 0.1354468399005239 and parameters: {'kernel': 'linear', 'C': 80.12070745065276, 'gamma': 0.025280857955397456, 'epsilon': 0.0539643293167262}. Best is trial 345 with value: 0.13438257115663557.
[I 2024-12-03 18:46:35,744] Trial 513 finished with value: 0.13937260730305384 and parameters: {'kernel': 'linear', 'C': 9.471727684674253, 'gamma': 0.0001394027107373813, 'epsilon': 0.079804540920076}. Best is trial 345 with value: 0.13438257115663557.
[I 2024-12-03 18:46:35,770] Trial 516 finished with value: 24.48544671700091 and parameters: {'kernel': 'sigmoid', 'C': 69.48500863242137, 'gamma': 0.002500190494635922, 'epsilon': 0.09015278086389325}. Best is trial 345 with value: 0.13438257115663557.
[I 2024-12-03 18:46:37,426] Trial 520 finished with value: 0.3070844272707922 and parameters: {'kernel': 'linear', 'C': 0.014869981552852785, 'gamma': 0.01711084467081071, 'epsilon': 0.02951361490289873}. Best is trial 345 with value: 0.13438257115663557.
[I 2024-12-03 18:46:38,505] Trial 470 finished with value: 0.13544301264172412 and parameters: {'kernel': 'linear', 'C': 37.692504531747666, 'gamma': 0.007775395202692519, 'epsilon': 0.028250885936453706}. Best is trial 345 with value: 0.13438257115663557.
[I 2024-12-03 18:46:39,254] Trial 510 finished with value: 0.13713107301407104 and parameters: {'kernel': 'linear', 'C': 4.559260204496359, 'gamma': 0.0032192147530889273, 'epsilon': 0.02199448270523912}. Best is trial 345 with value: 0.13438257115663557.
[I 2024-12-03 18:46:39,455] Trial 481 finished with value: 0.13810585719232918 and parameters: {'kernel': 'linear', 'C': 13.35838155959144, 'gamma': 0.0110861876336411, 'epsilon': 0.015173886605501528}. Best is trial 345 with value: 0.13438257115663557.
[I 2024-12-03 18:46:39,657] Trial 522 finished with value: 3.811000042185125 and parameters: {'kernel': 'sigmoid', 'C': 0.163817111877928, 'gamma': 0.2051382991719609, 'epsilon': 0.027193771055353477}. Best is trial 345 with value: 0.13438257115663557.
[I 2024-12-03 18:46:40,126] Trial 517 finished with value: 0.13648873030515576 and parameters: {'kernel': 'linear', 'C': 9.410142765940742, 'gamma': 0.00016399695472041025, 'epsilon': 0.07241954000424056}. Best is trial 345 with value: 0.13438257115663557.
[I 2024-12-03 18:46:41,079] Trial 524 finished with value: 0.4471899323413438 and parameters: {'kernel': 'sigmoid', 'C': 4.008953483541362, 'gamma': 0.00032536410684953315, 'epsilon': 0.09371850736439274}. Best is trial 345 with value: 0.13438257115663557.
[I 2024-12-03 18:46:41,902] Trial 526 finished with value: 1.038210082604925 and parameters: {'kernel': 'poly', 'C': 6.385368392076141, 'gamma': 0.0035247146531130653, 'epsilon': 0.011336885171010303}. Best is trial 345 with value: 0.13438257115663557.
[I 2024-12-03 18:46:42,322] Trial 497 finished with value: 0.13746710917797833 and parameters: {'kernel': 'linear', 'C': 16.320035826566325, 'gamma': 0.03091662738302175, 'epsilon': 0.018660025112985746}. Best is trial 345 with value: 0.13438257115663557.
[I 2024-12-03 18:46:42,982] Trial 505 finished with value: 0.135017440059206 and parameters: {'kernel': 'linear', 'C': 21.53747303238132, 'gamma': 0.0007773384715925248, 'epsilon': 0.05674144067514607}. Best is trial 345 with value: 0.13438257115663557.
[I 2024-12-03 18:46:43,655] Trial 525 finished with value: 0.1354047678387385 and parameters: {'kernel': 'linear', 'C': 4.659898070305064, 'gamma': 0.01219808760024684, 'epsilon': 0.058306983117475814}. Best is trial 345 with value: 0.13438257115663557.
[I 2024-12-03 18:46:45,162] Trial 521 finished with value: 0.1357960133691817 and parameters: {'kernel': 'linear', 'C': 5.205338325968271, 'gamma': 0.0001456071064777, 'epsilon': 0.03894617178145886}. Best is trial 345 with value: 0.13438257115663557.
[I 2024-12-03 18:46:45,169] Trial 515 finished with value: 0.13607438755465806 and parameters: {'kernel': 'linear', 'C': 9.698935007482563, 'gamma': 0.0003287295025562286, 'epsilon': 0.03449977139179902}. Best is trial 345 with value: 0.13438257115663557.
[I 2024-12-03 18:46:45,263] Trial 416 finished with value: 0.13724616669987375 and parameters: {'kernel': 'linear', 'C': 79.45180895896009, 'gamma': 0.00016680596877746974, 'epsilon': 0.022717736444068076}. Best is trial 345 with value: 0.13438257115663557.
[I 2024-12-03 18:46:46,008] Trial 531 finished with value: 0.2529017069090588 and parameters: {'kernel': 'rbf', 'C': 91.98106355742131, 'gamma': 0.00015044517570195738, 'epsilon': 0.10042578819178699}. Best is trial 345 with value: 0.13438257115663557.
[I 2024-12-03 18:46:46,551] Trial 404 finished with value: 0.13562723987149902 and parameters: {'kernel': 'linear', 'C': 75.19442970267973, 'gamma': 0.03126640398273567, 'epsilon': 0.027328802860606596}. Best is trial 345 with value: 0.13438257115663557.
[I 2024-12-03 18:46:47,623] Trial 530 finished with value: 0.1411032216601694 and parameters: {'kernel': 'linear', 'C': 19.44444282340161, 'gamma': 0.004702383298958598, 'epsilon': 0.0917370464535132}. Best is trial 345 with value: 0.13438257115663557.
[I 2024-12-03 18:46:48,363] Trial 529 finished with value: 0.13796507458271198 and parameters: {'kernel': 'linear', 'C': 2.7154285869500843, 'gamma': 0.28811911843097615, 'epsilon': 0.0010058993685538413}. Best is trial 345 with value: 0.13438257115663557.
[I 2024-12-03 18:46:49,274] Trial 483 finished with value: 0.13956885024804752 and parameters: {'kernel': 'linear', 'C': 97.91445034695619, 'gamma': 0.00013620247861986933, 'epsilon': 0.08604452169481194}. Best is trial 345 with value: 0.13438257115663557.
[I 2024-12-03 18:46:50,790] Trial 537 finished with value: 0.13612206078884118 and parameters: {'kernel': 'linear', 'C': 3.539151356857256, 'gamma': 0.0007663194332118015, 'epsilon': 0.05262455701873533}. Best is trial 345 with value: 0.13438257115663557.
[I 2024-12-03 18:46:51,574] Trial 527 finished with value: 0.13596953455989802 and parameters: {'kernel': 'linear', 'C': 5.9807185325931105, 'gamma': 0.031204288290808756, 'epsilon': 0.02758447771428607}. Best is trial 345 with value: 0.13438257115663557.
[I 2024-12-03 18:46:51,709] Trial 506 finished with value: 0.13505741992672596 and parameters: {'kernel': 'linear', 'C': 59.15075553345539, 'gamma': 0.0024639123413719333, 'epsilon': 0.06282973279846785}. Best is trial 345 with value: 0.13438257115663557.
[I 2024-12-03 18:46:51,890] Trial 469 finished with value: 0.13651792591985867 and parameters: {'kernel': 'linear', 'C': 91.38077975708467, 'gamma': 0.035859247367948044, 'epsilon': 0.0434275349781066}. Best is trial 345 with value: 0.13438257115663557.
[I 2024-12-03 18:46:51,901] Trial 540 finished with value: 1.3582723051721177 and parameters: {'kernel': 'poly', 'C': 0.04186534963123184, 'gamma': 0.0009312972055557058, 'epsilon': 0.013907963194098785}. Best is trial 345 with value: 0.13438257115663557.
[I 2024-12-03 18:46:52,359] Trial 535 finished with value: 0.14843782516520126 and parameters: {'kernel': 'linear', 'C': 36.620472215240824, 'gamma': 0.012026817562847038, 'epsilon': 0.13869253115312113}. Best is trial 345 with value: 0.13438257115663557.
[I 2024-12-03 18:46:52,866] Trial 532 finished with value: 0.13710020803693299 and parameters: {'kernel': 'linear', 'C': 6.48331487856324, 'gamma': 0.00011693301401562927, 'epsilon': 0.023151395660834406}. Best is trial 345 with value: 0.13438257115663557.
[I 2024-12-03 18:46:54,450] Trial 541 finished with value: 0.15995272968119228 and parameters: {'kernel': 'linear', 'C': 20.203116076712252, 'gamma': 0.0005343745289699773, 'epsilon': 0.16749561384126432}. Best is trial 345 with value: 0.13438257115663557.
[I 2024-12-03 18:46:54,452] Trial 545 finished with value: 1.3596137063466445 and parameters: {'kernel': 'rbf', 'C': 0.002725950569821861, 'gamma': 0.753465109419071, 'epsilon': 0.05921237393767878}. Best is trial 345 with value: 0.13438257115663557.
[I 2024-12-03 18:46:55,986] Trial 476 finished with value: 0.1359431802882597 and parameters: {'kernel': 'linear', 'C': 69.2590429390749, 'gamma': 0.013982231015138576, 'epsilon': 0.05251804293004303}. Best is trial 345 with value: 0.13438257115663557.
[I 2024-12-03 18:46:58,256] Trial 528 finished with value: 0.13840512563611418 and parameters: {'kernel': 'linear', 'C': 12.402407096566895, 'gamma': 0.0019581255235349678, 'epsilon': 0.01004339061295269}. Best is trial 345 with value: 0.13438257115663557.
[I 2024-12-03 18:46:58,293] Trial 384 finished with value: 0.13781456820424404 and parameters: {'kernel': 'linear', 'C': 82.01587452060156, 'gamma': 0.006172430744455262, 'epsilon': 0.013596630183597082}. Best is trial 345 with value: 0.13438257115663557.
[I 2024-12-03 18:46:59,697] Trial 550 finished with value: 0.38382785602486597 and parameters: {'kernel': 'rbf', 'C': 8.271786084592845, 'gamma': 0.00017848122011203065, 'epsilon': 0.019392473107729253}. Best is trial 345 with value: 0.13438257115663557.
[I 2024-12-03 18:47:00,021] Trial 444 finished with value: 0.1355966344811437 and parameters: {'kernel': 'linear', 'C': 82.8669993610575, 'gamma': 0.0032481226992904667, 'epsilon': 0.027816252529276532}. Best is trial 345 with value: 0.13438257115663557.
[I 2024-12-03 18:47:00,464] Trial 543 finished with value: 0.14939312646325037 and parameters: {'kernel': 'linear', 'C': 94.70601275785377, 'gamma': 0.0030232907806693647, 'epsilon': 0.14172981031436896}. Best is trial 345 with value: 0.13438257115663557.
[I 2024-12-03 18:47:02,189] Trial 534 finished with value: 0.13711292089299645 and parameters: {'kernel': 'linear', 'C': 21.45461683319784, 'gamma': 0.010902343333405796, 'epsilon': 0.047190517254545754}. Best is trial 345 with value: 0.13438257115663557.
[I 2024-12-03 18:47:03,302] Trial 538 finished with value: 0.13749802680256784 and parameters: {'kernel': 'linear', 'C': 14.579143829215917, 'gamma': 0.004492941309224161, 'epsilon': 0.018805520045328008}. Best is trial 345 with value: 0.13438257115663557.
[I 2024-12-03 18:47:04,380] Trial 472 finished with value: 0.3136245080889836 and parameters: {'kernel': 'poly', 'C': 30.359202669986914, 'gamma': 0.053502224483956355, 'epsilon': 0.012455711421065762}. Best is trial 345 with value: 0.13438257115663557.
[I 2024-12-03 18:47:05,673] Trial 539 finished with value: 0.13551136261027144 and parameters: {'kernel': 'linear', 'C': 16.579313599579343, 'gamma': 0.04281615018591817, 'epsilon': 0.0320837151349669}. Best is trial 345 with value: 0.13438257115663557.
[I 2024-12-03 18:47:06,553] Trial 518 finished with value: 0.13526467316747426 and parameters: {'kernel': 'linear', 'C': 31.58483630087423, 'gamma': 0.00027000854151509564, 'epsilon': 0.028826967514733178}. Best is trial 345 with value: 0.13438257115663557.
[I 2024-12-03 18:47:07,157] Trial 536 finished with value: 0.13563408839878732 and parameters: {'kernel': 'linear', 'C': 12.635165403732433, 'gamma': 0.018523830883183975, 'epsilon': 0.03692648978523352}. Best is trial 345 with value: 0.13438257115663557.
[I 2024-12-03 18:47:07,158] Trial 467 finished with value: 0.13667295428398657 and parameters: {'kernel': 'linear', 'C': 67.63066531380852, 'gamma': 0.04063249150310506, 'epsilon': 0.02327882958926393}. Best is trial 345 with value: 0.13438257115663557.
[I 2024-12-03 18:47:07,285] Trial 558 finished with value: 1.3356857820575547 and parameters: {'kernel': 'sigmoid', 'C': 0.002036901742862246, 'gamma': 0.005934303836816462, 'epsilon': 0.024060871429990804}. Best is trial 345 with value: 0.13438257115663557.
[I 2024-12-03 18:47:09,662] Trial 479 finished with value: 0.1361408250857656 and parameters: {'kernel': 'linear', 'C': 66.5972914148336, 'gamma': 0.0005226582459692712, 'epsilon': 0.05205094999772331}. Best is trial 345 with value: 0.13438257115663557.
[I 2024-12-03 18:47:12,221] Trial 560 finished with value: 0.1373058264870012 and parameters: {'kernel': 'linear', 'C': 2.256580271975088, 'gamma': 0.0005532915176662524, 'epsilon': 0.03543733569727311}. Best is trial 345 with value: 0.13438257115663557.
[I 2024-12-03 18:47:12,223] Trial 519 finished with value: 0.13507922416065385 and parameters: {'kernel': 'linear', 'C': 73.28479321899547, 'gamma': 0.00010220510082298996, 'epsilon': 0.05498453143097509}. Best is trial 345 with value: 0.13438257115663557.
[I 2024-12-03 18:47:12,224] Trial 552 finished with value: 0.1351477998270507 and parameters: {'kernel': 'linear', 'C': 16.88156344260537, 'gamma': 0.0001613716397205591, 'epsilon': 0.03899124362755588}. Best is trial 345 with value: 0.13438257115663557.
[I 2024-12-03 18:47:13,746] Trial 557 finished with value: 0.1394792026173504 and parameters: {'kernel': 'linear', 'C': 33.14348797013838, 'gamma': 0.00010078522904185206, 'epsilon': 0.08801736735725252}. Best is trial 345 with value: 0.13438257115663557.
[I 2024-12-03 18:47:13,921] Trial 487 finished with value: 0.13480144477256892 and parameters: {'kernel': 'linear', 'C': 83.77380066972725, 'gamma': 0.007476775340203697, 'epsilon': 0.03030305156327431}. Best is trial 345 with value: 0.13438257115663557.
[I 2024-12-03 18:47:14,078] Trial 566 finished with value: 0.44349283718829996 and parameters: {'kernel': 'sigmoid', 'C': 10.923262221752466, 'gamma': 0.00011330628548957462, 'epsilon': 0.05721367466760019}. Best is trial 345 with value: 0.13438257115663557.
[I 2024-12-03 18:47:14,680] Trial 565 finished with value: 1.3636786020354963 and parameters: {'kernel': 'poly', 'C': 0.0046256018475178936, 'gamma': 0.0001212139352712614, 'epsilon': 0.07947681188696672}. Best is trial 345 with value: 0.13438257115663557.
[I 2024-12-03 18:47:15,459] Trial 564 finished with value: 1.3538493024046223 and parameters: {'kernel': 'rbf', 'C': 0.0012935355901418097, 'gamma': 0.27789834984802186, 'epsilon': 0.005023050664145072}. Best is trial 345 with value: 0.13438257115663557.
[I 2024-12-03 18:47:15,491] Trial 561 finished with value: 0.13774027325684637 and parameters: {'kernel': 'linear', 'C': 15.70524456788879, 'gamma': 0.04328462283145002, 'epsilon': 0.07869674432581011}. Best is trial 345 with value: 0.13438257115663557.
[I 2024-12-03 18:47:16,655] Trial 569 finished with value: 1.3627963663478055 and parameters: {'kernel': 'poly', 'C': 0.013451823529498863, 'gamma': 0.0001761201126739867, 'epsilon': 0.001716044014654537}. Best is trial 345 with value: 0.13438257115663557.
[I 2024-12-03 18:47:16,976] Trial 553 finished with value: 0.13682552500215117 and parameters: {'kernel': 'linear', 'C': 17.14993610919016, 'gamma': 0.0006426642673112103, 'epsilon': 0.04440336470085984}. Best is trial 345 with value: 0.13438257115663557.
[I 2024-12-03 18:47:17,757] Trial 544 finished with value: 0.13522741595151394 and parameters: {'kernel': 'linear', 'C': 42.06864562470886, 'gamma': 0.0029284923057907525, 'epsilon': 0.05973307864826774}. Best is trial 345 with value: 0.13438257115663557.
[I 2024-12-03 18:47:17,757] Trial 570 finished with value: 0.5145612442808478 and parameters: {'kernel': 'rbf', 'C': 0.21657365144579369, 'gamma': 0.003403955948193775, 'epsilon': 0.005284205492196656}. Best is trial 345 with value: 0.13438257115663557.
[I 2024-12-03 18:47:18,313] Trial 542 finished with value: 0.37124513340415055 and parameters: {'kernel': 'poly', 'C': 0.07099037155736569, 'gamma': 0.44572480654446434, 'epsilon': 0.07655545528704816}. Best is trial 345 with value: 0.13438257115663557.
[I 2024-12-03 18:47:18,317] Trial 460 finished with value: 0.1390700965673089 and parameters: {'kernel': 'linear', 'C': 90.49496866688311, 'gamma': 0.024741687302764666, 'epsilon': 0.011217047241744766}. Best is trial 345 with value: 0.13438257115663557.
[I 2024-12-03 18:47:21,233] Trial 575 finished with value: 0.26616055659252913 and parameters: {'kernel': 'linear', 'C': 90.88122543960144, 'gamma': 0.00011149858870949036, 'epsilon': 0.38710391137947175}. Best is trial 345 with value: 0.13438257115663557.
[I 2024-12-03 18:47:22,148] Trial 482 finished with value: 0.13698104891291724 and parameters: {'kernel': 'linear', 'C': 85.23241434299486, 'gamma': 0.03668644351113362, 'epsilon': 0.044799207308627}. Best is trial 345 with value: 0.13438257115663557.
[I 2024-12-03 18:47:22,287] Trial 579 finished with value: 1.362516546232881 and parameters: {'kernel': 'poly', 'C': 0.3946095536387231, 'gamma': 0.0001482055884324167, 'epsilon': 0.07620157737469045}. Best is trial 345 with value: 0.13438257115663557.
[I 2024-12-03 18:47:25,830] Trial 580 finished with value: 0.1507577681159373 and parameters: {'kernel': 'linear', 'C': 15.886845314425651, 'gamma': 0.00034604430664395155, 'epsilon': 0.14577656326429142}. Best is trial 345 with value: 0.13438257115663557.
[I 2024-12-03 18:47:27,637] Trial 546 finished with value: 0.13521629403593666 and parameters: {'kernel': 'linear', 'C': 64.11935892494506, 'gamma': 0.0016324592871151868, 'epsilon': 0.057046714994306226}. Best is trial 345 with value: 0.13438257115663557.
[I 2024-12-03 18:47:27,818] Trial 572 finished with value: 0.13883227133946577 and parameters: {'kernel': 'linear', 'C': 61.352292371021676, 'gamma': 0.0008428516082939558, 'epsilon': 0.08382780927770556}. Best is trial 345 with value: 0.13438257115663557.
[I 2024-12-03 18:47:27,886] Trial 568 finished with value: 0.13650650172229922 and parameters: {'kernel': 'linear', 'C': 12.4258032120356, 'gamma': 0.00010578017560619032, 'epsilon': 0.05077675758996554}. Best is trial 345 with value: 0.13438257115663557.
[I 2024-12-03 18:47:29,594] Trial 573 finished with value: 0.14113391221988136 and parameters: {'kernel': 'linear', 'C': 49.57399676245265, 'gamma': 0.0001003334640398975, 'epsilon': 0.10920755206562209}. Best is trial 345 with value: 0.13438257115663557.
[I 2024-12-03 18:47:31,577] Trial 556 finished with value: 0.13510432999519026 and parameters: {'kernel': 'linear', 'C': 30.499635756205883, 'gamma': 0.0036806348453856086, 'epsilon': 0.03127265710663835}. Best is trial 345 with value: 0.13438257115663557.
[I 2024-12-03 18:47:32,331] Trial 567 finished with value: 0.13546337029849384 and parameters: {'kernel': 'linear', 'C': 20.974242703808383, 'gamma': 0.00011320184360095263, 'epsilon': 0.03273613671465693}. Best is trial 345 with value: 0.13438257115663557.
[I 2024-12-03 18:47:32,678] Trial 587 finished with value: 0.19176015372469293 and parameters: {'kernel': 'linear', 'C': 10.29373061223404, 'gamma': 0.020553556662310183, 'epsilon': 0.23764698736718445}. Best is trial 345 with value: 0.13438257115663557.
[I 2024-12-03 18:47:32,983] Trial 586 finished with value: 0.1363686042292308 and parameters: {'kernel': 'linear', 'C': 12.32522230119879, 'gamma': 0.002232073658543965, 'epsilon': 0.07491218216408925}. Best is trial 345 with value: 0.13438257115663557.
[I 2024-12-03 18:47:33,387] Trial 588 finished with value: 69.0971464605267 and parameters: {'kernel': 'sigmoid', 'C': 6.768738528288437, 'gamma': 0.016914384381317888, 'epsilon': 0.0679911170816293}. Best is trial 345 with value: 0.13438257115663557.
[I 2024-12-03 18:47:34,153] Trial 590 finished with value: 0.4116838136566324 and parameters: {'kernel': 'poly', 'C': 0.0013868561488470175, 'gamma': 0.20612153838528804, 'epsilon': 0.0401728448219564}. Best is trial 345 with value: 0.13438257115663557.
[I 2024-12-03 18:47:34,159] Trial 589 finished with value: 0.15737898378785342 and parameters: {'kernel': 'rbf', 'C': 77.23037249681634, 'gamma': 0.004414359577086922, 'epsilon': 0.021771282786417157}. Best is trial 345 with value: 0.13438257115663557.
[I 2024-12-03 18:47:35,851] Trial 549 finished with value: 0.1375781890233947 and parameters: {'kernel': 'linear', 'C': 38.0642492596238, 'gamma': 0.0015440462051950169, 'epsilon': 0.019863613210606448}. Best is trial 345 with value: 0.13438257115663557.
[I 2024-12-03 18:47:37,450] Trial 450 finished with value: 0.1376177277434604 and parameters: {'kernel': 'linear', 'C': 84.5778097132458, 'gamma': 0.0009787516024693148, 'epsilon': 0.018259894532468967}. Best is trial 345 with value: 0.13438257115663557.
