[I 2024-12-04 13:51:20,773] Trial 2454 finished with value: 0.2472644884545767 and parameters: {'n_estimators': 1446, 'learning_rate': 0.0669550531903649, 'max_depth': 12, 'min_samples_split': 14, 'min_samples_leaf': 3, 'subsample': 0.685880408383264, 'max_features': 'sqrt'}. Best is trial 1137 with value: 0.19687116000636118.
[I 2024-12-04 13:51:25,410] Trial 2461 finished with value: 0.21535074212116492 and parameters: {'n_estimators': 1113, 'learning_rate': 0.0992291984291506, 'max_depth': 12, 'min_samples_split': 17, 'min_samples_leaf': 1, 'subsample': 0.6497757172363253, 'max_features': 'sqrt'}. Best is trial 1137 with value: 0.19687116000636118.
[I 2024-12-04 13:51:26,886] Trial 2453 finished with value: 0.31467185085563104 and parameters: {'n_estimators': 1425, 'learning_rate': 0.09464253094404956, 'max_depth': 6, 'min_samples_split': 9, 'min_samples_leaf': 5, 'subsample': 0.8320369859714823, 'max_features': None}. Best is trial 1137 with value: 0.19687116000636118.
[I 2024-12-04 13:51:27,977] Trial 2458 finished with value: 0.2240753020757583 and parameters: {'n_estimators': 1212, 'learning_rate': 0.06834863799799004, 'max_depth': 11, 'min_samples_split': 20, 'min_samples_leaf': 1, 'subsample': 0.61074185405901, 'max_features': 'sqrt'}. Best is trial 1137 with value: 0.19687116000636118.
[I 2024-12-04 13:51:32,704] Trial 2462 finished with value: 0.21527386824598937 and parameters: {'n_estimators': 1180, 'learning_rate': 0.09786687932948901, 'max_depth': 12, 'min_samples_split': 17, 'min_samples_leaf': 1, 'subsample': 0.7507149955843093, 'max_features': 'sqrt'}. Best is trial 1137 with value: 0.19687116000636118.
[I 2024-12-04 13:51:32,912] Trial 2463 finished with value: 0.2072398298408757 and parameters: {'n_estimators': 1166, 'learning_rate': 0.07474981239322909, 'max_depth': 12, 'min_samples_split': 19, 'min_samples_leaf': 1, 'subsample': 0.6062252592423852, 'max_features': 'sqrt'}. Best is trial 1137 with value: 0.19687116000636118.
[I 2024-12-04 13:51:35,315] Trial 2456 finished with value: 0.2646040825660385 and parameters: {'n_estimators': 1468, 'learning_rate': 0.08504413636094789, 'max_depth': 12, 'min_samples_split': 17, 'min_samples_leaf': 2, 'subsample': 0.6095469088207407, 'max_features': 'log2'}. Best is trial 1137 with value: 0.19687116000636118.
[I 2024-12-04 13:51:35,436] Trial 2483 finished with value: 0.2799389391855355 and parameters: {'n_estimators': 358, 'learning_rate': 0.09986112268218818, 'max_depth': 8, 'min_samples_split': 2, 'min_samples_leaf': 3, 'subsample': 0.6981100691876216, 'max_features': 'sqrt'}. Best is trial 1137 with value: 0.19687116000636118.
[I 2024-12-04 13:51:35,494] Trial 2455 finished with value: 0.20784927096629804 and parameters: {'n_estimators': 1499, 'learning_rate': 0.09161156638082145, 'max_depth': 11, 'min_samples_split': 18, 'min_samples_leaf': 1, 'subsample': 0.6699580321866723, 'max_features': 'sqrt'}. Best is trial 1137 with value: 0.19687116000636118.
[I 2024-12-04 13:51:36,203] Trial 2457 finished with value: 0.21866395268208158 and parameters: {'n_estimators': 1418, 'learning_rate': 0.0956520518342799, 'max_depth': 12, 'min_samples_split': 20, 'min_samples_leaf': 1, 'subsample': 0.6011249271991063, 'max_features': 'sqrt'}. Best is trial 1137 with value: 0.19687116000636118.
[I 2024-12-04 13:51:38,906] Trial 2465 finished with value: 0.23575169987798392 and parameters: {'n_estimators': 1176, 'learning_rate': 0.06870526284802299, 'max_depth': 12, 'min_samples_split': 14, 'min_samples_leaf': 1, 'subsample': 0.6525510268165572, 'max_features': 'sqrt'}. Best is trial 1137 with value: 0.19687116000636118.
[I 2024-12-04 13:51:41,952] Trial 2480 finished with value: 0.31366370418541023 and parameters: {'n_estimators': 562, 'learning_rate': 0.03924793496309405, 'max_depth': 10, 'min_samples_split': 10, 'min_samples_leaf': 1, 'subsample': 0.7066943390094127, 'max_features': 'log2'}. Best is trial 1137 with value: 0.19687116000636118.
[I 2024-12-04 13:51:48,151] Trial 2464 finished with value: 0.2251053694235285 and parameters: {'n_estimators': 1347, 'learning_rate': 0.09592037126154797, 'max_depth': 12, 'min_samples_split': 20, 'min_samples_leaf': 1, 'subsample': 0.6072940662495625, 'max_features': 'sqrt'}. Best is trial 1137 with value: 0.19687116000636118.
[I 2024-12-04 13:51:48,896] Trial 2460 finished with value: 0.21150617725363952 and parameters: {'n_estimators': 1397, 'learning_rate': 0.09443113615743325, 'max_depth': 11, 'min_samples_split': 16, 'min_samples_leaf': 1, 'subsample': 0.6020848332522124, 'max_features': 'sqrt'}. Best is trial 1137 with value: 0.19687116000636118.
[I 2024-12-04 13:51:55,662] Trial 2470 finished with value: 0.20166423621337018 and parameters: {'n_estimators': 1309, 'learning_rate': 0.09734561133345078, 'max_depth': 12, 'min_samples_split': 16, 'min_samples_leaf': 1, 'subsample': 0.7416831061720655, 'max_features': 'sqrt'}. Best is trial 1137 with value: 0.19687116000636118.
[I 2024-12-04 13:51:56,094] Trial 2473 finished with value: 0.21548829880833129 and parameters: {'n_estimators': 1132, 'learning_rate': 0.09856161116408199, 'max_depth': 11, 'min_samples_split': 15, 'min_samples_leaf': 1, 'subsample': 0.6050656626916578, 'max_features': 'sqrt'}. Best is trial 1137 with value: 0.19687116000636118.
[I 2024-12-04 13:51:57,171] Trial 2467 finished with value: 0.2242631285753644 and parameters: {'n_estimators': 1494, 'learning_rate': 0.0963153296268028, 'max_depth': 8, 'min_samples_split': 20, 'min_samples_leaf': 1, 'subsample': 0.6489888502028374, 'max_features': 'sqrt'}. Best is trial 1137 with value: 0.19687116000636118.
[I 2024-12-04 13:51:57,715] Trial 2469 finished with value: 0.25289896187096184 and parameters: {'n_estimators': 1370, 'learning_rate': 0.09479136571190983, 'max_depth': 12, 'min_samples_split': 20, 'min_samples_leaf': 3, 'subsample': 0.6143839296984677, 'max_features': 'sqrt'}. Best is trial 1137 with value: 0.19687116000636118.
[I 2024-12-04 13:51:58,651] Trial 2471 finished with value: 0.2495157865575824 and parameters: {'n_estimators': 1238, 'learning_rate': 0.0989210389405436, 'max_depth': 12, 'min_samples_split': 13, 'min_samples_leaf': 3, 'subsample': 0.6431508456650983, 'max_features': 'sqrt'}. Best is trial 1137 with value: 0.19687116000636118.
[I 2024-12-04 13:51:59,744] Trial 2499 finished with value: 0.4066861099451709 and parameters: {'n_estimators': 178, 'learning_rate': 0.02760168050074195, 'max_depth': 4, 'min_samples_split': 2, 'min_samples_leaf': 2, 'subsample': 0.9913852739502983, 'max_features': None}. Best is trial 1137 with value: 0.19687116000636118.
[I 2024-12-04 13:52:00,254] Trial 2472 finished with value: 0.23932789975205254 and parameters: {'n_estimators': 1278, 'learning_rate': 0.09996389847508023, 'max_depth': 11, 'min_samples_split': 20, 'min_samples_leaf': 2, 'subsample': 0.6075068060858371, 'max_features': 'sqrt'}. Best is trial 1137 with value: 0.19687116000636118.
[I 2024-12-04 13:52:00,828] Trial 2478 finished with value: 0.28825773533044946 and parameters: {'n_estimators': 970, 'learning_rate': 0.09771811384799746, 'max_depth': 10, 'min_samples_split': 17, 'min_samples_leaf': 4, 'subsample': 0.6649850160797113, 'max_features': None}. Best is trial 1137 with value: 0.19687116000636118.
[I 2024-12-04 13:52:01,482] Trial 2493 finished with value: 0.5475485082697384 and parameters: {'n_estimators': 402, 'learning_rate': 0.035945093042391095, 'max_depth': 8, 'min_samples_split': 9, 'min_samples_leaf': 7, 'subsample': 0.8843767740442179, 'max_features': 'log2'}. Best is trial 1137 with value: 0.19687116000636118.
[I 2024-12-04 13:52:01,811] Trial 2475 finished with value: 0.3629699399574918 and parameters: {'n_estimators': 1232, 'learning_rate': 0.08374203663391538, 'max_depth': 3, 'min_samples_split': 4, 'min_samples_leaf': 5, 'subsample': 0.6220440781480077, 'max_features': 'log2'}. Best is trial 1137 with value: 0.19687116000636118.
[I 2024-12-04 13:52:05,183] Trial 2474 finished with value: 0.22071197120098288 and parameters: {'n_estimators': 1282, 'learning_rate': 0.07276527254376326, 'max_depth': 12, 'min_samples_split': 15, 'min_samples_leaf': 1, 'subsample': 0.6371155537639125, 'max_features': 'sqrt'}. Best is trial 1137 with value: 0.19687116000636118.
[I 2024-12-04 13:52:08,236] Trial 2479 finished with value: 0.25057948965042426 and parameters: {'n_estimators': 1241, 'learning_rate': 0.06488149965644946, 'max_depth': 10, 'min_samples_split': 19, 'min_samples_leaf': 1, 'subsample': 0.7209538187608577, 'max_features': 'log2'}. Best is trial 1137 with value: 0.19687116000636118.
[I 2024-12-04 13:52:09,975] Trial 2477 finished with value: 0.2405704555905596 and parameters: {'n_estimators': 1333, 'learning_rate': 0.0960405993316185, 'max_depth': 11, 'min_samples_split': 17, 'min_samples_leaf': 1, 'subsample': 0.6087299249761537, 'max_features': 'sqrt'}. Best is trial 1137 with value: 0.19687116000636118.
[I 2024-12-04 13:52:10,641] Trial 2481 finished with value: 0.24928190771467265 and parameters: {'n_estimators': 1262, 'learning_rate': 0.08246359757887613, 'max_depth': 12, 'min_samples_split': 17, 'min_samples_leaf': 3, 'subsample': 0.6223754191741638, 'max_features': 'sqrt'}. Best is trial 1137 with value: 0.19687116000636118.
[I 2024-12-04 13:52:10,906] Trial 2487 finished with value: 0.42077737093113876 and parameters: {'n_estimators': 1069, 'learning_rate': 0.03594209130369507, 'max_depth': 3, 'min_samples_split': 13, 'min_samples_leaf': 3, 'subsample': 0.6357786924671871, 'max_features': 'log2'}. Best is trial 1137 with value: 0.19687116000636118.
[I 2024-12-04 13:52:13,070] Trial 2476 finished with value: 0.24981667684375244 and parameters: {'n_estimators': 1498, 'learning_rate': 0.08321409612926739, 'max_depth': 12, 'min_samples_split': 18, 'min_samples_leaf': 3, 'subsample': 0.6575809974295591, 'max_features': 'sqrt'}. Best is trial 1137 with value: 0.19687116000636118.
[I 2024-12-04 13:52:17,057] Trial 2482 finished with value: 0.2131240498789111 and parameters: {'n_estimators': 1448, 'learning_rate': 0.09536174412901897, 'max_depth': 9, 'min_samples_split': 19, 'min_samples_leaf': 1, 'subsample': 0.600896997815495, 'max_features': 'sqrt'}. Best is trial 1137 with value: 0.19687116000636118.
[I 2024-12-04 13:52:18,028] Trial 2484 finished with value: 0.21959151306548153 and parameters: {'n_estimators': 1455, 'learning_rate': 0.07832234162338683, 'max_depth': 12, 'min_samples_split': 19, 'min_samples_leaf': 1, 'subsample': 0.6011625972705255, 'max_features': 'sqrt'}. Best is trial 1137 with value: 0.19687116000636118.
[I 2024-12-04 13:52:18,714] Trial 2485 finished with value: 0.21043800353685047 and parameters: {'n_estimators': 1469, 'learning_rate': 0.0884095156728319, 'max_depth': 12, 'min_samples_split': 17, 'min_samples_leaf': 1, 'subsample': 0.6068123537087761, 'max_features': 'sqrt'}. Best is trial 1137 with value: 0.19687116000636118.
[I 2024-12-04 13:52:19,819] Trial 2486 finished with value: 0.2213441144063312 and parameters: {'n_estimators': 1463, 'learning_rate': 0.060387630744410725, 'max_depth': 12, 'min_samples_split': 13, 'min_samples_leaf': 1, 'subsample': 0.7330449852612371, 'max_features': 'sqrt'}. Best is trial 1137 with value: 0.19687116000636118.
[I 2024-12-04 13:52:20,184] Trial 2490 finished with value: 0.2567250141457998 and parameters: {'n_estimators': 1236, 'learning_rate': 0.06206106570243395, 'max_depth': 11, 'min_samples_split': 19, 'min_samples_leaf': 3, 'subsample': 0.6004385649048645, 'max_features': 'sqrt'}. Best is trial 1137 with value: 0.19687116000636118.
[I 2024-12-04 13:52:21,656] Trial 2491 finished with value: 0.491809809640883 and parameters: {'n_estimators': 1380, 'learning_rate': 0.05075981254223276, 'max_depth': 4, 'min_samples_split': 3, 'min_samples_leaf': 10, 'subsample': 0.717915035072867, 'max_features': 'log2'}. Best is trial 1137 with value: 0.19687116000636118.
[I 2024-12-04 13:52:22,310] Trial 2489 finished with value: 0.29450173618980147 and parameters: {'n_estimators': 1194, 'learning_rate': 0.09175609933843856, 'max_depth': 12, 'min_samples_split': 20, 'min_samples_leaf': 2, 'subsample': 0.608102155356942, 'max_features': None}. Best is trial 1137 with value: 0.19687116000636118.
[I 2024-12-04 13:52:22,840] Trial 2496 finished with value: 0.2554627999175442 and parameters: {'n_estimators': 1190, 'learning_rate': 0.0980409256249765, 'max_depth': 10, 'min_samples_split': 19, 'min_samples_leaf': 3, 'subsample': 0.6819346478901296, 'max_features': 'sqrt'}. Best is trial 1137 with value: 0.19687116000636118.
[I 2024-12-04 13:52:22,992] Trial 2495 finished with value: 0.22373170798825665 and parameters: {'n_estimators': 1177, 'learning_rate': 0.09630905372232657, 'max_depth': 10, 'min_samples_split': 15, 'min_samples_leaf': 1, 'subsample': 0.6753043035810121, 'max_features': 'sqrt'}. Best is trial 1137 with value: 0.19687116000636118.
[I 2024-12-04 13:52:23,378] Trial 2497 finished with value: 0.2407361051001303 and parameters: {'n_estimators': 1324, 'learning_rate': 0.09691946806858913, 'max_depth': 12, 'min_samples_split': 18, 'min_samples_leaf': 3, 'subsample': 0.6181750149944242, 'max_features': 'sqrt'}. Best is trial 1137 with value: 0.19687116000636118.
[I 2024-12-04 13:52:23,527] Trial 2492 finished with value: 0.23374513246852713 and parameters: {'n_estimators': 1496, 'learning_rate': 0.09988224726633749, 'max_depth': 11, 'min_samples_split': 19, 'min_samples_leaf': 2, 'subsample': 0.6651281458906184, 'max_features': 'sqrt'}. Best is trial 1137 with value: 0.19687116000636118.
[I 2024-12-04 13:52:23,763] Trial 2494 finished with value: 0.2552018263799632 and parameters: {'n_estimators': 1490, 'learning_rate': 0.07313478840672105, 'max_depth': 12, 'min_samples_split': 15, 'min_samples_leaf': 3, 'subsample': 0.6022259069772875, 'max_features': 'sqrt'}. Best is trial 1137 with value: 0.19687116000636118.
[I 2024-12-04 13:52:23,764] Trial 2498 finished with value: 0.2458185064506581 and parameters: {'n_estimators': 1424, 'learning_rate': 0.09787664441053123, 'max_depth': 12, 'min_samples_split': 16, 'min_samples_leaf': 2, 'subsample': 0.6296884950445515, 'max_features': 'sqrt'}. Best is trial 1137 with value: 0.19687116000636118.
[I 2024-12-04 13:52:24,411] Trial 2488 finished with value: 0.2800121588983161 and parameters: {'n_estimators': 1486, 'learning_rate': 0.042265757150617915, 'max_depth': 12, 'min_samples_split': 20, 'min_samples_leaf': 2, 'subsample': 0.6715199117110896, 'max_features': None}. Best is trial 1137 with value: 0.19687116000636118.
