[I 2024-12-04 15:04:29,424] Trial 978 finished with value: 1.2401109055232469 and parameters: {'kernel_type': 'Matern', 'length_scale': 0.08146784945575407, 'noise_level': 0.0003894330587743307, 'constant_value': 1.122640193639623e-07, 'nu': 0.5}. Best is trial 386 with value: 0.4872991004520934.
[I 2024-12-04 15:04:30,005] Trial 975 finished with value: 0.6443854432778622 and parameters: {'kernel_type': 'RBF', 'length_scale': 18.482487333240684, 'noise_level': 0.07478670159438605, 'constant_value': 13.7234509844862, 'nu': 0.5}. Best is trial 386 with value: 0.4872991004520934.
[I 2024-12-04 15:04:32,029] Trial 985 finished with value: 0.48830323622454896 and parameters: {'kernel_type': 'Matern', 'length_scale': 20.45916136357978, 'noise_level': 0.049473682750745845, 'constant_value': 138.16148232568005, 'nu': 0.5}. Best is trial 386 with value: 0.4872991004520934.
[I 2024-12-04 15:04:32,357] Trial 982 finished with value: 0.4883034594981989 and parameters: {'kernel_type': 'Matern', 'length_scale': 104.9535898853542, 'noise_level': 0.9950862511327251, 'constant_value': 40.06268011020854, 'nu': 0.5}. Best is trial 386 with value: 0.4872991004520934.
[I 2024-12-04 15:04:32,360] Trial 981 finished with value: 0.4883035055239978 and parameters: {'kernel_type': 'Matern', 'length_scale': 18836.08220377369, 'noise_level': 0.019364846328433334, 'constant_value': 78411.60368549635, 'nu': 0.5}. Best is trial 386 with value: 0.4872991004520934.
[I 2024-12-04 15:04:32,686] Trial 968 finished with value: 0.5663942576567912 and parameters: {'kernel_type': 'Matern', 'length_scale': 219.6788545410824, 'noise_level': 0.4630302309449255, 'constant_value': 1034.580362415947, 'nu': 2.5}. Best is trial 386 with value: 0.4872991004520934.
[I 2024-12-04 15:04:33,094] Trial 965 finished with value: 0.4883029989848231 and parameters: {'kernel_type': 'Matern', 'length_scale': 1237.4556895656908, 'noise_level': 0.02205491378521653, 'constant_value': 541.9440397231571, 'nu': 0.5}. Best is trial 386 with value: 0.4872991004520934.
[I 2024-12-04 15:04:33,690] Trial 970 finished with value: 0.48830341939783767 and parameters: {'kernel_type': 'Matern', 'length_scale': 1610.9198539185595, 'noise_level': 0.9958684998251474, 'constant_value': 504.04363549597764, 'nu': 0.5}. Best is trial 386 with value: 0.4872991004520934.
[I 2024-12-04 15:04:34,204] Trial 977 finished with value: 0.48830341333456695 and parameters: {'kernel_type': 'Matern', 'length_scale': 7539.669875490533, 'noise_level': 0.07816983223253592, 'constant_value': 73190.13498796901, 'nu': 0.5}. Best is trial 386 with value: 0.4872991004520934.
[I 2024-12-04 15:04:34,742] Trial 984 finished with value: 0.4883034284738846 and parameters: {'kernel_type': 'Matern', 'length_scale': 5140.094205591458, 'noise_level': 0.035554368483439416, 'constant_value': 668.573445569794, 'nu': 0.5}. Best is trial 386 with value: 0.4872991004520934.
[I 2024-12-04 15:04:34,882] Trial 983 finished with value: 0.48830326944467145 and parameters: {'kernel_type': 'Matern', 'length_scale': 1265.3371181912476, 'noise_level': 0.012571299664048947, 'constant_value': 17.050469138511215, 'nu': 0.5}. Best is trial 386 with value: 0.4872991004520934.
[I 2024-12-04 15:04:37,015] Trial 987 finished with value: 0.48830338223281955 and parameters: {'kernel_type': 'Matern', 'length_scale': 9934.048966538734, 'noise_level': 0.902668357940736, 'constant_value': 60874.7628824197, 'nu': 0.5}. Best is trial 386 with value: 0.4872991004520934.
[I 2024-12-04 15:04:37,557] Trial 995 finished with value: 1.2614543701966445 and parameters: {'kernel_type': 'RBF', 'length_scale': 2.6978771101800825e-05, 'noise_level': 1.3873158949253418e-05, 'constant_value': 880.7585162208522, 'nu': 0.5}. Best is trial 386 with value: 0.4872991004520934.
[I 2024-12-04 15:04:37,871] Trial 988 finished with value: 1.240111232438767 and parameters: {'kernel_type': 'Matern', 'length_scale': 8.232035816217001, 'noise_level': 0.9745941661514851, 'constant_value': 5.037973063641455e-05, 'nu': 0.5}. Best is trial 386 with value: 0.4872991004520934.
[I 2024-12-04 15:04:37,951] Trial 991 finished with value: 1.2614543676104897 and parameters: {'kernel_type': 'RBF', 'length_scale': 0.25280859356237134, 'noise_level': 0.00010425634888878354, 'constant_value': 31.667027794330743, 'nu': 0.5}. Best is trial 386 with value: 0.4872991004520934.
[I 2024-12-04 15:04:39,019] Trial 992 finished with value: 1.2401112325343255 and parameters: {'kernel_type': 'Matern', 'length_scale': 7268.577402123108, 'noise_level': 0.0009617191286455314, 'constant_value': 45.596717457172815, 'nu': 0.5}. Best is trial 386 with value: 0.4872991004520934.
[I 2024-12-04 15:04:39,151] Trial 994 finished with value: 0.48830247131149696 and parameters: {'kernel_type': 'Matern', 'length_scale': 76932.282662336, 'noise_level': 0.7862165075025974, 'constant_value': 217.2129694933884, 'nu': 0.5}. Best is trial 386 with value: 0.4872991004520934.
[I 2024-12-04 15:04:39,377] Trial 997 finished with value: 0.48830339378120324 and parameters: {'kernel_type': 'Matern', 'length_scale': 2332.679901518382, 'noise_level': 0.033928181645281504, 'constant_value': 97.51443328700316, 'nu': 0.5}. Best is trial 386 with value: 0.4872991004520934.
[I 2024-12-04 15:04:40,327] Trial 1001 finished with value: 0.4883034175522278 and parameters: {'kernel_type': 'Matern', 'length_scale': 3840.2151001922543, 'noise_level': 0.03565954277892179, 'constant_value': 1075.3247292479348, 'nu': 0.5}. Best is trial 386 with value: 0.4872991004520934.
[I 2024-12-04 15:04:43,400] Trial 989 finished with value: 0.4883034087502864 and parameters: {'kernel_type': 'Matern', 'length_scale': 1220.6225119419832, 'noise_level': 0.007115197166292169, 'constant_value': 109.37103112287896, 'nu': 0.5}. Best is trial 386 with value: 0.4872991004520934.
[I 2024-12-04 15:04:43,470] Trial 999 finished with value: 0.4883034224864532 and parameters: {'kernel_type': 'Matern', 'length_scale': 1723.257270830388, 'noise_level': 0.03589510667814626, 'constant_value': 11989.855258561083, 'nu': 0.5}. Best is trial 386 with value: 0.4872991004520934.
[I 2024-12-04 15:04:43,840] Trial 990 finished with value: 0.4883034182842512 and parameters: {'kernel_type': 'Matern', 'length_scale': 1078.1211115329488, 'noise_level': 0.009844114670102684, 'constant_value': 8.611001341329122e-05, 'nu': 0.5}. Best is trial 386 with value: 0.4872991004520934.
[I 2024-12-04 15:04:44,311] Trial 993 finished with value: 0.48830347721513534 and parameters: {'kernel_type': 'Matern', 'length_scale': 805.0612696021373, 'noise_level': 0.4302992592432683, 'constant_value': 477.34216832528233, 'nu': 0.5}. Best is trial 386 with value: 0.4872991004520934.
[I 2024-12-04 15:04:44,440] Trial 1007 finished with value: 0.48830339109279514 and parameters: {'kernel_type': 'Matern', 'length_scale': 79481.48420507427, 'noise_level': 0.44992668402694275, 'constant_value': 60.12917316302184, 'nu': 0.5}. Best is trial 386 with value: 0.4872991004520934.
[I 2024-12-04 15:04:44,817] Trial 996 finished with value: 0.48830341941834066 and parameters: {'kernel_type': 'Matern', 'length_scale': 33.921857067927405, 'noise_level': 0.05195272029329138, 'constant_value': 962.843352215591, 'nu': 0.5}. Best is trial 386 with value: 0.4872991004520934.
[I 2024-12-04 15:04:45,276] Trial 998 finished with value: 1.2401112325777426 and parameters: {'kernel_type': 'Matern', 'length_scale': 0.0029803630005913457, 'noise_level': 0.16165549354581504, 'constant_value': 0.0005255467502122375, 'nu': 2.5}. Best is trial 386 with value: 0.4872991004520934.
[I 2024-12-04 15:04:45,847] Trial 1002 finished with value: 0.48830342432651275 and parameters: {'kernel_type': 'Matern', 'length_scale': 40212.41912250734, 'noise_level': 0.3563281915521544, 'constant_value': 13.854052879393583, 'nu': 0.5}. Best is trial 386 with value: 0.4872991004520934.
[I 2024-12-04 15:04:46,005] Trial 986 finished with value: 0.4883034454371281 and parameters: {'kernel_type': 'Matern', 'length_scale': 13076.710869564118, 'noise_level': 0.11695529428442619, 'constant_value': 18.132961857529136, 'nu': 0.5}. Best is trial 386 with value: 0.4872991004520934.
[I 2024-12-04 15:04:46,829] Trial 1000 finished with value: 0.48830388161058236 and parameters: {'kernel_type': 'Matern', 'length_scale': 22141.89734234185, 'noise_level': 0.8264636179620092, 'constant_value': 811.9578649423308, 'nu': 0.5}. Best is trial 386 with value: 0.4872991004520934.
[I 2024-12-04 15:04:47,318] Trial 1005 finished with value: 0.5273054444375942 and parameters: {'kernel_type': 'Matern', 'length_scale': 1046.6160930423005, 'noise_level': 0.3533943798423965, 'constant_value': 160.88080889098634, 'nu': 1.5}. Best is trial 386 with value: 0.4872991004520934.
[I 2024-12-04 15:04:47,335] Trial 1004 finished with value: 1.2614543454121476 and parameters: {'kernel_type': 'Matern', 'length_scale': 12299.490899279755, 'noise_level': 0.6836903270237195, 'constant_value': 74.55500781757291, 'nu': 2.5}. Best is trial 386 with value: 0.4872991004520934.
[I 2024-12-04 15:04:47,732] Trial 1008 finished with value: 0.48830341406755184 and parameters: {'kernel_type': 'Matern', 'length_scale': 9919.202789464503, 'noise_level': 0.8033157325303957, 'constant_value': 19.653497833117836, 'nu': 0.5}. Best is trial 386 with value: 0.4872991004520934.
[I 2024-12-04 15:04:50,197] Trial 1011 finished with value: 1.2614543702027814 and parameters: {'kernel_type': 'RBF', 'length_scale': 0.00014913082830803021, 'noise_level': 2.1220578800429233e-05, 'constant_value': 5.627468288847659, 'nu': 2.5}. Best is trial 386 with value: 0.4872991004520934.
[I 2024-12-04 15:04:50,978] Trial 1006 finished with value: 0.4883034169749352 and parameters: {'kernel_type': 'Matern', 'length_scale': 89719.26606087285, 'noise_level': 0.35776540924627986, 'constant_value': 86990.72936587835, 'nu': 0.5}. Best is trial 386 with value: 0.4872991004520934.
[I 2024-12-04 15:04:51,304] Trial 1013 finished with value: 0.4883035340462481 and parameters: {'kernel_type': 'Matern', 'length_scale': 1221.0450444809653, 'noise_level': 0.9080586097558517, 'constant_value': 4911.96751490841, 'nu': 0.5}. Best is trial 386 with value: 0.4872991004520934.
[I 2024-12-04 15:04:51,756] Trial 1017 finished with value: 0.48830341841556746 and parameters: {'kernel_type': 'Matern', 'length_scale': 80805.95140786769, 'noise_level': 0.8026011476900233, 'constant_value': 26.457747866294824, 'nu': 0.5}. Best is trial 386 with value: 0.4872991004520934.
[I 2024-12-04 15:04:52,306] Trial 1009 finished with value: 1.240111232591955 and parameters: {'kernel_type': 'Matern', 'length_scale': 81136.05952756351, 'noise_level': 0.008661082653458298, 'constant_value': 122.75727584102184, 'nu': 0.5}. Best is trial 386 with value: 0.4872991004520934.
[I 2024-12-04 15:04:52,381] Trial 1010 finished with value: 0.48830341935733823 and parameters: {'kernel_type': 'Matern', 'length_scale': 1210.215740839394, 'noise_level': 0.9957255419713379, 'constant_value': 60035.09605050288, 'nu': 0.5}. Best is trial 386 with value: 0.4872991004520934.
[I 2024-12-04 15:04:53,227] Trial 1015 finished with value: 0.48830342049518327 and parameters: {'kernel_type': 'Matern', 'length_scale': 371.8827581269319, 'noise_level': 0.8620534946158319, 'constant_value': 0.0049659188736212315, 'nu': 0.5}. Best is trial 386 with value: 0.4872991004520934.
[I 2024-12-04 15:04:53,769] Trial 1018 finished with value: 1.26145437020279 and parameters: {'kernel_type': 'RBF', 'length_scale': 0.010671342240226386, 'noise_level': 1.672495796362148e-06, 'constant_value': 87427.48419796237, 'nu': 2.5}. Best is trial 386 with value: 0.4872991004520934.
[I 2024-12-04 15:04:54,484] Trial 1003 finished with value: 1.2401112325423715 and parameters: {'kernel_type': 'Matern', 'length_scale': 4338.392125689251, 'noise_level': 0.006002413538467948, 'constant_value': 23522.693986556507, 'nu': 1.5}. Best is trial 386 with value: 0.4872991004520934.
[I 2024-12-04 15:04:56,494] Trial 1019 finished with value: 0.4883033162968784 and parameters: {'kernel_type': 'Matern', 'length_scale': 88965.36248305274, 'noise_level': 0.005660310162209685, 'constant_value': 12645.132758270021, 'nu': 0.5}. Best is trial 386 with value: 0.4872991004520934.
[I 2024-12-04 15:04:56,701] Trial 1016 finished with value: 0.4883034027083814 and parameters: {'kernel_type': 'Matern', 'length_scale': 65068.7469602882, 'noise_level': 0.3161736044909289, 'constant_value': 884.548297128047, 'nu': 0.5}. Best is trial 386 with value: 0.4872991004520934.
[I 2024-12-04 15:04:56,804] Trial 1014 finished with value: 1.2401112325995434 and parameters: {'kernel_type': 'Matern', 'length_scale': 48673.52339391869, 'noise_level': 0.0139665524619063, 'constant_value': 0.8856678556840379, 'nu': 0.5}. Best is trial 386 with value: 0.4872991004520934.
[I 2024-12-04 15:04:58,471] Trial 1030 finished with value: 1.261454797635248 and parameters: {'kernel_type': 'RBF', 'length_scale': 57661.753539465375, 'noise_level': 0.0017436531279704426, 'constant_value': 3.3600540581435464e-07, 'nu': 0.5}. Best is trial 386 with value: 0.4872991004520934.
[I 2024-12-04 15:04:58,715] Trial 1012 finished with value: 0.48830341934594945 and parameters: {'kernel_type': 'Matern', 'length_scale': 83124.05521589276, 'noise_level': 0.6436844916919368, 'constant_value': 32.766323377392574, 'nu': 0.5}. Best is trial 386 with value: 0.4872991004520934.
[I 2024-12-04 15:04:59,355] Trial 1025 finished with value: 0.4883034200358871 and parameters: {'kernel_type': 'Matern', 'length_scale': 96368.22159640906, 'noise_level': 0.13032434860578598, 'constant_value': 176.28037486182936, 'nu': 0.5}. Best is trial 386 with value: 0.4872991004520934.
[I 2024-12-04 15:04:59,833] Trial 1021 finished with value: 0.48830342179726177 and parameters: {'kernel_type': 'Matern', 'length_scale': 8178.158022414385, 'noise_level': 0.6867272760744721, 'constant_value': 283.8486612865539, 'nu': 0.5}. Best is trial 386 with value: 0.4872991004520934.
[I 2024-12-04 15:05:00,154] Trial 1024 finished with value: 1.2401112326109633 and parameters: {'kernel_type': 'Matern', 'length_scale': 507.545413393058, 'noise_level': 0.0027983377057526045, 'constant_value': 2.910631173885695, 'nu': 1.5}. Best is trial 386 with value: 0.4872991004520934.
[I 2024-12-04 15:05:00,207] Trial 1032 finished with value: 0.48830341403070293 and parameters: {'kernel_type': 'Matern', 'length_scale': 80134.59118964363, 'noise_level': 0.019515623539271516, 'constant_value': 2498.4739578081085, 'nu': 0.5}. Best is trial 386 with value: 0.4872991004520934.
[I 2024-12-04 15:05:01,948] Trial 1023 finished with value: 0.4883034182409609 and parameters: {'kernel_type': 'Matern', 'length_scale': 24408.40404107087, 'noise_level': 0.9044100683571747, 'constant_value': 181.10977913481562, 'nu': 0.5}. Best is trial 386 with value: 0.4872991004520934.
[I 2024-12-04 15:05:03,257] Trial 1027 finished with value: 1.2401112325831367 and parameters: {'kernel_type': 'Matern', 'length_scale': 2.3807154362502683e-05, 'noise_level': 0.5378252357410516, 'constant_value': 44.842142014127404, 'nu': 0.5}. Best is trial 386 with value: 0.4872991004520934.
[I 2024-12-04 15:05:04,000] Trial 1026 finished with value: 0.4883034200088483 and parameters: {'kernel_type': 'Matern', 'length_scale': 597.3582846810157, 'noise_level': 0.043164635632764944, 'constant_value': 54.39798755493472, 'nu': 0.5}. Best is trial 386 with value: 0.4872991004520934.
[I 2024-12-04 15:05:04,052] Trial 1029 finished with value: 0.4883034262260466 and parameters: {'kernel_type': 'Matern', 'length_scale': 4782.7455835895225, 'noise_level': 0.003700672977422661, 'constant_value': 1195.8231133290528, 'nu': 0.5}. Best is trial 386 with value: 0.4872991004520934.
[I 2024-12-04 15:05:04,547] Trial 1036 finished with value: 0.4883033970068409 and parameters: {'kernel_type': 'Matern', 'length_scale': 2.411062097002025, 'noise_level': 0.8636578229783054, 'constant_value': 0.25204747765467067, 'nu': 0.5}. Best is trial 386 with value: 0.4872991004520934.
[I 2024-12-04 15:05:04,785] Trial 1020 finished with value: 1.2401112325672967 and parameters: {'kernel_type': 'Matern', 'length_scale': 926.3150854722211, 'noise_level': 5.345469130358321e-06, 'constant_value': 3.387905649396261e-05, 'nu': 0.5}. Best is trial 386 with value: 0.4872991004520934.
[I 2024-12-04 15:05:05,343] Trial 1022 finished with value: 1.2614543702027723 and parameters: {'kernel_type': 'Matern', 'length_scale': 2.2250731679470005e-05, 'noise_level': 1.1570886784431592e-10, 'constant_value': 13.758780139210202, 'nu': 2.5}. Best is trial 386 with value: 0.4872991004520934.
[I 2024-12-04 15:05:05,352] Trial 1037 finished with value: 0.4883034050586835 and parameters: {'kernel_type': 'Matern', 'length_scale': 8497.44863420478, 'noise_level': 0.00889236006246559, 'constant_value': 2461.5953043278464, 'nu': 0.5}. Best is trial 386 with value: 0.4872991004520934.
[I 2024-12-04 15:05:05,385] Trial 1028 finished with value: 0.4883034190044673 and parameters: {'kernel_type': 'Matern', 'length_scale': 89572.28060609338, 'noise_level': 0.8090089107240814, 'constant_value': 6618.759366566385, 'nu': 0.5}. Best is trial 386 with value: 0.4872991004520934.
[I 2024-12-04 15:05:06,229] Trial 1034 finished with value: 1.240111235224952 and parameters: {'kernel_type': 'Matern', 'length_scale': 0.03882480898946043, 'noise_level': 0.0031247217779178556, 'constant_value': 0.005384670518296523, 'nu': 0.5}. Best is trial 386 with value: 0.4872991004520934.
[I 2024-12-04 15:05:07,170] Trial 1033 finished with value: 1.2401112325530037 and parameters: {'kernel_type': 'Matern', 'length_scale': 0.06201073435491433, 'noise_level': 0.2617789019985219, 'constant_value': 0.002436876113699779, 'nu': 1.5}. Best is trial 386 with value: 0.4872991004520934.
[I 2024-12-04 15:05:07,548] Trial 1031 finished with value: 1.2401112370840877 and parameters: {'kernel_type': 'RBF', 'length_scale': 55614.91408110237, 'noise_level': 3.661556606041089e-10, 'constant_value': 0.027867783104895523, 'nu': 0.5}. Best is trial 386 with value: 0.4872991004520934.
[I 2024-12-04 15:05:08,072] Trial 1035 finished with value: 1.2614547953941473 and parameters: {'kernel_type': 'Matern', 'length_scale': 5688.526784965348, 'noise_level': 0.0280882990879597, 'constant_value': 99102.65827887983, 'nu': 0.5}. Best is trial 386 with value: 0.4872991004520934.
[I 2024-12-04 15:05:08,286] Trial 1040 finished with value: 0.48830342231417634 and parameters: {'kernel_type': 'Matern', 'length_scale': 1122.9976820246368, 'noise_level': 0.030939645685614636, 'constant_value': 2663.0598770342885, 'nu': 0.5}. Best is trial 386 with value: 0.4872991004520934.
[I 2024-12-04 15:05:08,591] Trial 1043 finished with value: 0.48830341484165984 and parameters: {'kernel_type': 'Matern', 'length_scale': 259.11367649646013, 'noise_level': 0.47220711306523755, 'constant_value': 632.5071641463278, 'nu': 0.5}. Best is trial 386 with value: 0.4872991004520934.
[I 2024-12-04 15:05:09,267] Trial 1045 finished with value: 1.2401112320563301 and parameters: {'kernel_type': 'RBF', 'length_scale': 132.58077480685648, 'noise_level': 0.00016790336387229895, 'constant_value': 19.065734497890247, 'nu': 2.5}. Best is trial 386 with value: 0.4872991004520934.
[I 2024-12-04 15:05:09,747] Trial 1044 finished with value: 0.4883034184578128 and parameters: {'kernel_type': 'Matern', 'length_scale': 1429.6989598002976, 'noise_level': 0.4715890409927748, 'constant_value': 1021.5547292577975, 'nu': 0.5}. Best is trial 386 with value: 0.4872991004520934.
[I 2024-12-04 15:05:10,132] Trial 1039 finished with value: 0.48830336238817873 and parameters: {'kernel_type': 'Matern', 'length_scale': 32.136878780913584, 'noise_level': 0.5907273509572725, 'constant_value': 362.03095646285516, 'nu': 0.5}. Best is trial 386 with value: 0.4872991004520934.
[I 2024-12-04 15:05:11,136] Trial 1046 finished with value: 1.2614543702025547 and parameters: {'kernel_type': 'Matern', 'length_scale': 0.0009420225555093088, 'noise_level': 1.0722372982492797e-06, 'constant_value': 70520.2528623524, 'nu': 0.5}. Best is trial 386 with value: 0.4872991004520934.
[I 2024-12-04 15:05:11,283] Trial 1042 finished with value: 0.48830341930482074 and parameters: {'kernel_type': 'Matern', 'length_scale': 4313.706735472158, 'noise_level': 0.9294299688068226, 'constant_value': 373.9920247028305, 'nu': 0.5}. Best is trial 386 with value: 0.4872991004520934.
[I 2024-12-04 15:05:13,421] Trial 1041 finished with value: 0.48830341324310444 and parameters: {'kernel_type': 'Matern', 'length_scale': 6189.539257671607, 'noise_level': 0.03421439916014231, 'constant_value': 837.5389466692757, 'nu': 0.5}. Best is trial 386 with value: 0.4872991004520934.
[I 2024-12-04 15:05:16,298] Trial 1038 finished with value: 0.5273057888547805 and parameters: {'kernel_type': 'Matern', 'length_scale': 8.945072388647986, 'noise_level': 0.7606363031592135, 'constant_value': 15173.224924371665, 'nu': 1.5}. Best is trial 386 with value: 0.4872991004520934.
[I 2024-12-04 15:05:16,617] Trial 1049 finished with value: 0.48830342432571683 and parameters: {'kernel_type': 'Matern', 'length_scale': 318.2308170816548, 'noise_level': 0.028210173329411906, 'constant_value': 42.701695654353564, 'nu': 0.5}. Best is trial 386 with value: 0.4872991004520934.
[I 2024-12-04 15:05:16,703] Trial 1058 finished with value: 0.48830348090274006 and parameters: {'kernel_type': 'Matern', 'length_scale': 30104.48027771707, 'noise_level': 0.7369952243141097, 'constant_value': 808.1905903595795, 'nu': 0.5}. Best is trial 386 with value: 0.4872991004520934.
[I 2024-12-04 15:05:17,189] Trial 1047 finished with value: 1.2401112326518424 and parameters: {'kernel_type': 'RBF', 'length_scale': 5741.362636297227, 'noise_level': 2.601380812560104e-07, 'constant_value': 99.0314383454991, 'nu': 1.5}. Best is trial 386 with value: 0.4872991004520934.
