[I 2024-12-04 20:20:33,107] Trial 930 finished with value: 0.9864686821137915 and parameters: {'kernel_type': 'RBF', 'length_scale': 15.707009387912654, 'noise_level': 0.001500095368370672, 'constant_value': 2.9108732325242923, 'nu': 1.5}. Best is trial 616 with value: 0.1375127577189955.
[I 2024-12-04 20:20:36,737] Trial 932 finished with value: 0.14771026905070334 and parameters: {'kernel_type': 'RBF', 'length_scale': 565.658919149905, 'noise_level': 0.02759022361240883, 'constant_value': 81224.31941920047, 'nu': 2.5}. Best is trial 616 with value: 0.1375127577189955.
[I 2024-12-04 20:20:37,474] Trial 933 finished with value: 0.9982171091217505 and parameters: {'kernel_type': 'Matern', 'length_scale': 6.778786614470458, 'noise_level': 4.450133941504758e-09, 'constant_value': 236.95035614698082, 'nu': 1.5}. Best is trial 616 with value: 0.1375127577189955.
[I 2024-12-04 20:20:42,276] Trial 934 finished with value: 0.1424950564288025 and parameters: {'kernel_type': 'Matern', 'length_scale': 33.053074849133914, 'noise_level': 0.011715314571695085, 'constant_value': 15.212298362557853, 'nu': 1.5}. Best is trial 616 with value: 0.1375127577189955.
[I 2024-12-04 20:20:43,512] Trial 935 finished with value: 0.14249505796750378 and parameters: {'kernel_type': 'Matern', 'length_scale': 41.72490273290745, 'noise_level': 0.07094321119238674, 'constant_value': 3.4088249057306985, 'nu': 1.5}. Best is trial 616 with value: 0.1375127577189955.
[I 2024-12-04 20:20:47,354] Trial 936 finished with value: 0.9864686818652691 and parameters: {'kernel_type': 'Matern', 'length_scale': 347.0061380825572, 'noise_level': 1.2157647898037593e-07, 'constant_value': 4.540850529664308e-07, 'nu': 0.5}. Best is trial 616 with value: 0.1375127577189955.
[I 2024-12-04 20:20:50,144] Trial 938 finished with value: 0.9864686819195003 and parameters: {'kernel_type': 'Matern', 'length_scale': 524.8100473336825, 'noise_level': 0.001132489450839851, 'constant_value': 26.452441374094988, 'nu': 1.5}. Best is trial 616 with value: 0.1375127577189955.
[I 2024-12-04 20:20:50,556] Trial 937 finished with value: 0.14249506174131674 and parameters: {'kernel_type': 'Matern', 'length_scale': 4.243956737751383, 'noise_level': 0.012397225198570857, 'constant_value': 24456.96383303839, 'nu': 1.5}. Best is trial 616 with value: 0.1375127577189955.
[I 2024-12-04 20:20:54,960] Trial 939 finished with value: 0.14249506854503308 and parameters: {'kernel_type': 'Matern', 'length_scale': 0.9972120559598715, 'noise_level': 0.612826049561075, 'constant_value': 95.29415317129443, 'nu': 1.5}. Best is trial 616 with value: 0.1375127577189955.
[I 2024-12-04 20:20:56,803] Trial 940 finished with value: 0.19720002208001802 and parameters: {'kernel_type': 'Matern', 'length_scale': 411.4125817929699, 'noise_level': 0.4806464661563258, 'constant_value': 27.900818729695104, 'nu': 0.5}. Best is trial 616 with value: 0.1375127577189955.
[I 2024-12-04 20:20:58,372] Trial 941 finished with value: 0.14249507003518913 and parameters: {'kernel_type': 'Matern', 'length_scale': 3.0933525125751364, 'noise_level': 0.9345508517633456, 'constant_value': 354.1230706449925, 'nu': 1.5}. Best is trial 616 with value: 0.1375127577189955.
[I 2024-12-04 20:21:02,649] Trial 942 finished with value: 0.1424950617914252 and parameters: {'kernel_type': 'Matern', 'length_scale': 108.60693806556536, 'noise_level': 0.8523249827981502, 'constant_value': 17.589138947634734, 'nu': 1.5}. Best is trial 616 with value: 0.1375127577189955.
[I 2024-12-04 20:21:03,374] Trial 943 finished with value: 0.9982171095002977 and parameters: {'kernel_type': 'Matern', 'length_scale': 196.53201409512425, 'noise_level': 0.018400717610799058, 'constant_value': 44.99900905266281, 'nu': 2.5}. Best is trial 616 with value: 0.1375127577189955.
[I 2024-12-04 20:21:04,880] Trial 944 finished with value: 0.14249527783171645 and parameters: {'kernel_type': 'Matern', 'length_scale': 0.41885924827504095, 'noise_level': 0.024277631729952443, 'constant_value': 48.351107557828016, 'nu': 1.5}. Best is trial 616 with value: 0.1375127577189955.
[I 2024-12-04 20:21:12,035] Trial 945 finished with value: 0.1972000406240425 and parameters: {'kernel_type': 'Matern', 'length_scale': 1.7960577981407702, 'noise_level': 0.11829438565373454, 'constant_value': 451.5587582870541, 'nu': 0.5}. Best is trial 616 with value: 0.1375127577189955.
[I 2024-12-04 20:21:12,410] Trial 946 finished with value: 0.986468681915895 and parameters: {'kernel_type': 'Matern', 'length_scale': 19.159980057227973, 'noise_level': 0.01890739075683127, 'constant_value': 0.0930821922974601, 'nu': 1.5}. Best is trial 616 with value: 0.1375127577189955.
[I 2024-12-04 20:21:14,939] Trial 947 finished with value: 0.14249511669229736 and parameters: {'kernel_type': 'Matern', 'length_scale': 4.8519758825077774, 'noise_level': 0.06429074198434145, 'constant_value': 1045.6349152028117, 'nu': 1.5}. Best is trial 616 with value: 0.1375127577189955.
[I 2024-12-04 20:21:20,533] Trial 948 finished with value: 0.1424950649372277 and parameters: {'kernel_type': 'Matern', 'length_scale': 14.54139264498304, 'noise_level': 0.5630943092893024, 'constant_value': 9.804488228989953, 'nu': 1.5}. Best is trial 616 with value: 0.1375127577189955.
[I 2024-12-04 20:21:22,397] Trial 950 finished with value: 0.14249506323218805 and parameters: {'kernel_type': 'Matern', 'length_scale': 0.7109311629625318, 'noise_level': 0.8877571637069994, 'constant_value': 59195.727084069105, 'nu': 1.5}. Best is trial 616 with value: 0.1375127577189955.
[I 2024-12-04 20:21:23,091] Trial 949 finished with value: 0.1424950430935778 and parameters: {'kernel_type': 'Matern', 'length_scale': 0.4970449047637216, 'noise_level': 0.8397000557688553, 'constant_value': 2.6617605259126043, 'nu': 1.5}. Best is trial 616 with value: 0.1375127577189955.
[I 2024-12-04 20:21:28,625] Trial 953 finished with value: 0.14249517918882731 and parameters: {'kernel_type': 'Matern', 'length_scale': 60.87330320116382, 'noise_level': 0.041674680131086224, 'constant_value': 297.86195038917447, 'nu': 1.5}. Best is trial 616 with value: 0.1375127577189955.
[I 2024-12-04 20:21:28,702] Trial 952 finished with value: 0.14249493813561254 and parameters: {'kernel_type': 'Matern', 'length_scale': 4.679979186791573, 'noise_level': 0.003707037459187716, 'constant_value': 5.265036740194186, 'nu': 1.5}. Best is trial 616 with value: 0.1375127577189955.
[I 2024-12-04 20:21:31,776] Trial 951 finished with value: 0.9864686818974554 and parameters: {'kernel_type': 'Matern', 'length_scale': 2289.403479212355, 'noise_level': 0.010992559320444115, 'constant_value': 0.09563205330830357, 'nu': 1.5}. Best is trial 616 with value: 0.1375127577189955.
[I 2024-12-04 20:21:35,339] Trial 955 finished with value: 0.142494158264625 and parameters: {'kernel_type': 'Matern', 'length_scale': 17.010745358357877, 'noise_level': 0.06507664486279496, 'constant_value': 2211.7678687576768, 'nu': 1.5}. Best is trial 616 with value: 0.1375127577189955.
[I 2024-12-04 20:21:37,349] Trial 954 finished with value: 0.14249506312324986 and parameters: {'kernel_type': 'Matern', 'length_scale': 116.68361170293575, 'noise_level': 0.007590797316354126, 'constant_value': 37.77581528614121, 'nu': 1.5}. Best is trial 616 with value: 0.1375127577189955.
[I 2024-12-04 20:21:38,996] Trial 956 finished with value: 0.14469882974801826 and parameters: {'kernel_type': 'Matern', 'length_scale': 2.141382423425636, 'noise_level': 0.05122344815526805, 'constant_value': 86.30999703622952, 'nu': 2.5}. Best is trial 616 with value: 0.1375127577189955.
[I 2024-12-04 20:21:42,688] Trial 957 finished with value: 0.1424950611135406 and parameters: {'kernel_type': 'Matern', 'length_scale': 9.025956510706704, 'noise_level': 0.0016031463012365149, 'constant_value': 1109.8106313334608, 'nu': 1.5}. Best is trial 616 with value: 0.1375127577189955.
[I 2024-12-04 20:21:43,540] Trial 958 finished with value: 0.14249499746823172 and parameters: {'kernel_type': 'Matern', 'length_scale': 28.893246846667036, 'noise_level': 0.018413342955213272, 'constant_value': 164.68479584887817, 'nu': 1.5}. Best is trial 616 with value: 0.1375127577189955.
[I 2024-12-04 20:21:47,362] Trial 959 finished with value: 0.1375110730946576 and parameters: {'kernel_type': 'Matern', 'length_scale': 170.01978765316042, 'noise_level': 0.9411899704533266, 'constant_value': 11.122958123367265, 'nu': 1.5}. Best is trial 959 with value: 0.1375110730946576.
[I 2024-12-04 20:21:50,790] Trial 960 finished with value: 0.142495132417257 and parameters: {'kernel_type': 'Matern', 'length_scale': 0.4061477162829829, 'noise_level': 0.0003074470836951591, 'constant_value': 10.30009556667078, 'nu': 1.5}. Best is trial 959 with value: 0.1375110730946576.
[I 2024-12-04 20:21:53,978] Trial 962 finished with value: 0.14249524504635827 and parameters: {'kernel_type': 'Matern', 'length_scale': 82.80259288143824, 'noise_level': 0.05007582376867066, 'constant_value': 5.757067491413599, 'nu': 1.5}. Best is trial 959 with value: 0.1375110730946576.
[I 2024-12-04 20:21:55,774] Trial 961 finished with value: 0.14249522044051752 and parameters: {'kernel_type': 'Matern', 'length_scale': 4.133910417849386, 'noise_level': 0.024651809279354828, 'constant_value': 35.86903676645537, 'nu': 1.5}. Best is trial 959 with value: 0.1375110730946576.
[I 2024-12-04 20:21:57,370] Trial 963 finished with value: 0.14249506851376212 and parameters: {'kernel_type': 'Matern', 'length_scale': 68.58848060864804, 'noise_level': 0.247384952369591, 'constant_value': 64.91895083564506, 'nu': 1.5}. Best is trial 959 with value: 0.1375110730946576.
[I 2024-12-04 20:22:00,717] Trial 965 finished with value: 0.1424948330822442 and parameters: {'kernel_type': 'Matern', 'length_scale': 38.28289729860116, 'noise_level': 0.017397750391299635, 'constant_value': 321.9718508109344, 'nu': 1.5}. Best is trial 959 with value: 0.1375110730946576.
[I 2024-12-04 20:22:03,894] Trial 964 finished with value: 0.14249502452740542 and parameters: {'kernel_type': 'Matern', 'length_scale': 10.087350707202766, 'noise_level': 0.43524790956270776, 'constant_value': 6.802782231426084, 'nu': 1.5}. Best is trial 959 with value: 0.1375110730946576.
[I 2024-12-04 20:22:04,302] Trial 966 finished with value: 0.9864686821133085 and parameters: {'kernel_type': 'Matern', 'length_scale': 304.89973234537797, 'noise_level': 0.0020455249728752356, 'constant_value': 568.4218912501981, 'nu': 1.5}. Best is trial 959 with value: 0.1375110730946576.
[I 2024-12-04 20:22:08,691] Trial 969 finished with value: 0.9864686818455567 and parameters: {'kernel_type': 'Matern', 'length_scale': 0.06709233766223074, 'noise_level': 0.030383981109630066, 'constant_value': 6.399240197370685, 'nu': 1.5}. Best is trial 959 with value: 0.1375110730946576.
[I 2024-12-04 20:22:08,714] Trial 967 finished with value: 0.14249506458316605 and parameters: {'kernel_type': 'Matern', 'length_scale': 10.592705798404332, 'noise_level': 0.7996088647512051, 'constant_value': 92.2676347416338, 'nu': 1.5}. Best is trial 959 with value: 0.1375110730946576.
[I 2024-12-04 20:22:11,195] Trial 968 finished with value: 0.14249502318375315 and parameters: {'kernel_type': 'Matern', 'length_scale': 16.950243633615237, 'noise_level': 0.9797388761582801, 'constant_value': 778.2545801857107, 'nu': 1.5}. Best is trial 959 with value: 0.1375110730946576.
[I 2024-12-04 20:22:14,507] Trial 971 finished with value: 0.1424950664350296 and parameters: {'kernel_type': 'Matern', 'length_scale': 38.319050008044655, 'noise_level': 0.04675078354813632, 'constant_value': 1286.62191745674, 'nu': 1.5}. Best is trial 959 with value: 0.1375110730946576.
[I 2024-12-04 20:22:15,971] Trial 970 finished with value: 0.1424951406653327 and parameters: {'kernel_type': 'Matern', 'length_scale': 259.2274372080376, 'noise_level': 0.6830979155710177, 'constant_value': 123.46652142731811, 'nu': 1.5}. Best is trial 959 with value: 0.1375110730946576.
[I 2024-12-04 20:22:18,568] Trial 972 finished with value: 0.14249506719011507 and parameters: {'kernel_type': 'Matern', 'length_scale': 17.32608362061991, 'noise_level': 0.01578452910706218, 'constant_value': 9.341435893414342, 'nu': 1.5}. Best is trial 959 with value: 0.1375110730946576.
[I 2024-12-04 20:22:21,665] Trial 973 finished with value: 0.14249506976177503 and parameters: {'kernel_type': 'Matern', 'length_scale': 10.405520353240373, 'noise_level': 0.014030765911078234, 'constant_value': 2573.264141263403, 'nu': 1.5}. Best is trial 959 with value: 0.1375110730946576.
[I 2024-12-04 20:22:23,238] Trial 974 finished with value: 0.14249486317141896 and parameters: {'kernel_type': 'Matern', 'length_scale': 3.017884738820699, 'noise_level': 0.021408703868518963, 'constant_value': 1.7284511206057689, 'nu': 1.5}. Best is trial 959 with value: 0.1375110730946576.
[I 2024-12-04 20:22:25,226] Trial 975 finished with value: 0.1424950722042952 and parameters: {'kernel_type': 'Matern', 'length_scale': 36.73237883183289, 'noise_level': 0.0693318846748482, 'constant_value': 20.233894583699062, 'nu': 1.5}. Best is trial 959 with value: 0.1375110730946576.
[I 2024-12-04 20:22:27,805] Trial 977 finished with value: 0.9864686819048738 and parameters: {'kernel_type': 'RBF', 'length_scale': 0.007119326498975698, 'noise_level': 0.0004412982006292621, 'constant_value': 0.05384996844772049, 'nu': 0.5}. Best is trial 959 with value: 0.1375110730946576.
[I 2024-12-04 20:22:28,937] Trial 976 finished with value: 0.14249506997141118 and parameters: {'kernel_type': 'Matern', 'length_scale': 0.8483031155701575, 'noise_level': 0.0011223629668888275, 'constant_value': 639.5446571737056, 'nu': 1.5}. Best is trial 959 with value: 0.1375110730946576.
[I 2024-12-04 20:22:32,782] Trial 978 finished with value: 0.14249507391748556 and parameters: {'kernel_type': 'Matern', 'length_scale': 7.825215425178148, 'noise_level': 0.6568218481810808, 'constant_value': 9.495718787496155, 'nu': 1.5}. Best is trial 959 with value: 0.1375110730946576.
[I 2024-12-04 20:22:35,213] Trial 979 finished with value: 0.9864686819208212 and parameters: {'kernel_type': 'Matern', 'length_scale': 672.9787628400818, 'noise_level': 0.00046549988885131945, 'constant_value': 927.84324557387, 'nu': 1.5}. Best is trial 959 with value: 0.1375110730946576.
[I 2024-12-04 20:22:36,978] Trial 980 finished with value: 0.14249508479010534 and parameters: {'kernel_type': 'Matern', 'length_scale': 1.3212282540295663, 'noise_level': 0.01780969368949424, 'constant_value': 16.430217734435818, 'nu': 1.5}. Best is trial 959 with value: 0.1375110730946576.
[I 2024-12-04 20:22:39,885] Trial 981 finished with value: 0.1424950628353792 and parameters: {'kernel_type': 'Matern', 'length_scale': 31.884375328921692, 'noise_level': 0.9182236729850416, 'constant_value': 19.060765632412533, 'nu': 1.5}. Best is trial 959 with value: 0.1375110730946576.
[I 2024-12-04 20:22:42,894] Trial 982 finished with value: 0.14249482226154123 and parameters: {'kernel_type': 'Matern', 'length_scale': 97.0710039204813, 'noise_level': 0.026561203496156798, 'constant_value': 617.7554043702111, 'nu': 1.5}. Best is trial 959 with value: 0.1375110730946576.
[I 2024-12-04 20:22:44,721] Trial 983 finished with value: 0.14249509477672498 and parameters: {'kernel_type': 'Matern', 'length_scale': 11.651680939098886, 'noise_level': 0.9569806688213774, 'constant_value': 0.032806183814323646, 'nu': 1.5}. Best is trial 959 with value: 0.1375110730946576.
[I 2024-12-04 20:22:44,825] Trial 984 finished with value: 0.14771036857369366 and parameters: {'kernel_type': 'RBF', 'length_scale': 95.31625000096514, 'noise_level': 0.019978199239625252, 'constant_value': 452.12832740741953, 'nu': 1.5}. Best is trial 959 with value: 0.1375110730946576.
[I 2024-12-04 20:22:58,029] Trial 987 finished with value: 0.98646868190408 and parameters: {'kernel_type': 'Matern', 'length_scale': 0.01021592345396979, 'noise_level': 0.5941974762272397, 'constant_value': 11849.066511950428, 'nu': 0.5}. Best is trial 959 with value: 0.1375110730946576.
[I 2024-12-04 20:22:59,214] Trial 986 finished with value: 0.1446988244235472 and parameters: {'kernel_type': 'Matern', 'length_scale': 336.6985500683866, 'noise_level': 0.8044637983836598, 'constant_value': 248.96592778585085, 'nu': 2.5}. Best is trial 959 with value: 0.1375110730946576.
[I 2024-12-04 20:23:02,686] Trial 988 finished with value: 0.14249489081522515 and parameters: {'kernel_type': 'Matern', 'length_scale': 176.61536118457553, 'noise_level': 0.04402364556379858, 'constant_value': 1905.100289783253, 'nu': 1.5}. Best is trial 959 with value: 0.1375110730946576.
[I 2024-12-04 20:23:03,094] Trial 985 finished with value: 0.14249498864918353 and parameters: {'kernel_type': 'Matern', 'length_scale': 6.754951382082816, 'noise_level': 0.0004095732823266958, 'constant_value': 0.4503899695333679, 'nu': 1.5}. Best is trial 959 with value: 0.1375110730946576.
[I 2024-12-04 20:23:06,669] Trial 989 finished with value: 0.14249503340997569 and parameters: {'kernel_type': 'Matern', 'length_scale': 0.30315263792302743, 'noise_level': 0.02807265593185366, 'constant_value': 356.03056278140275, 'nu': 1.5}. Best is trial 959 with value: 0.1375110730946576.
[I 2024-12-04 20:23:10,888] Trial 991 finished with value: 0.1424950722042433 and parameters: {'kernel_type': 'Matern', 'length_scale': 50.254788244148465, 'noise_level': 0.9532003630431122, 'constant_value': 1205.5178328526395, 'nu': 1.5}. Best is trial 959 with value: 0.1375110730946576.
[I 2024-12-04 20:23:11,527] Trial 990 finished with value: 0.1424951171404623 and parameters: {'kernel_type': 'Matern', 'length_scale': 1.3216564345594604, 'noise_level': 0.8998022351825129, 'constant_value': 11.401920143950909, 'nu': 1.5}. Best is trial 959 with value: 0.1375110730946576.
[I 2024-12-04 20:23:14,504] Trial 992 finished with value: 0.14249520295432969 and parameters: {'kernel_type': 'Matern', 'length_scale': 1.9599300262147812, 'noise_level': 3.032716514748897e-05, 'constant_value': 330.3312585344979, 'nu': 1.5}. Best is trial 959 with value: 0.1375110730946576.
[I 2024-12-04 20:23:18,980] Trial 995 finished with value: 0.9864686811400064 and parameters: {'kernel_type': 'Matern', 'length_scale': 0.07406027303186458, 'noise_level': 0.8760652169445179, 'constant_value': 185.09557074321856, 'nu': 1.5}. Best is trial 959 with value: 0.1375110730946576.
[I 2024-12-04 20:23:19,351] Trial 994 finished with value: 0.9864686819279564 and parameters: {'kernel_type': 'Matern', 'length_scale': 83.06133805131688, 'noise_level': 0.002955342474975603, 'constant_value': 1.1235622285639038, 'nu': 1.5}. Best is trial 959 with value: 0.1375110730946576.
[I 2024-12-04 20:23:21,466] Trial 993 finished with value: 0.14249525347031308 and parameters: {'kernel_type': 'Matern', 'length_scale': 0.53865197345406, 'noise_level': 0.015425190983591946, 'constant_value': 243.05088720392155, 'nu': 1.5}. Best is trial 959 with value: 0.1375110730946576.
[I 2024-12-04 20:23:29,973] Trial 996 finished with value: 0.9864686680739526 and parameters: {'kernel_type': 'RBF', 'length_scale': 0.16990521413838042, 'noise_level': 0.0005579512499116688, 'constant_value': 1167.6848094753416, 'nu': 1.5}. Best is trial 959 with value: 0.1375110730946576.
[I 2024-12-04 20:23:31,255] Trial 997 finished with value: 0.1424952122778987 and parameters: {'kernel_type': 'Matern', 'length_scale': 190.04036244153474, 'noise_level': 0.010200302191380961, 'constant_value': 1348.9088996394007, 'nu': 1.5}. Best is trial 959 with value: 0.1375110730946576.
[I 2024-12-04 20:23:40,380] Trial 998 finished with value: 0.14249503130217675 and parameters: {'kernel_type': 'Matern', 'length_scale': 0.40327466263776995, 'noise_level': 0.02019362053218386, 'constant_value': 0.0022581852037897, 'nu': 1.5}. Best is trial 959 with value: 0.1375110730946576.
[I 2024-12-04 20:23:40,388] Trial 1000 finished with value: 0.9864686819213825 and parameters: {'kernel_type': 'RBF', 'length_scale': 21.092665943609525, 'noise_level': 0.03727316246762713, 'constant_value': 0.4488235448757969, 'nu': 2.5}. Best is trial 959 with value: 0.1375110730946576.
[I 2024-12-04 20:23:40,522] Trial 999 finished with value: 0.14249495866091755 and parameters: {'kernel_type': 'Matern', 'length_scale': 117.22774258292398, 'noise_level': 0.9482593918999833, 'constant_value': 30.599059451975393, 'nu': 1.5}. Best is trial 959 with value: 0.1375110730946576.
[I 2024-12-04 20:23:46,157] Trial 1001 finished with value: 0.14771010422844214 and parameters: {'kernel_type': 'RBF', 'length_scale': 1.3912327979420618, 'noise_level': 0.09376730588086629, 'constant_value': 51274.11032460802, 'nu': 2.5}. Best is trial 959 with value: 0.1375110730946576.
[I 2024-12-04 20:23:47,497] Trial 1003 finished with value: 0.14249499350534953 and parameters: {'kernel_type': 'Matern', 'length_scale': 6.936256579709097, 'noise_level': 0.0044311086435123576, 'constant_value': 16.746373555377996, 'nu': 1.5}. Best is trial 959 with value: 0.1375110730946576.
[I 2024-12-04 20:23:49,583] Trial 1002 finished with value: 0.14249506794281205 and parameters: {'kernel_type': 'Matern', 'length_scale': 50.664971366953594, 'noise_level': 0.0002738450609038681, 'constant_value': 26998.327051051798, 'nu': 1.5}. Best is trial 959 with value: 0.1375110730946576.
[I 2024-12-04 20:23:53,749] Trial 1004 finished with value: 0.1424950243177543 and parameters: {'kernel_type': 'Matern', 'length_scale': 29.87139433378304, 'noise_level': 0.0401033419714532, 'constant_value': 191.02944953427303, 'nu': 1.5}. Best is trial 959 with value: 0.1375110730946576.
[I 2024-12-04 20:23:54,523] Trial 1006 finished with value: 0.986468681922597 and parameters: {'kernel_type': 'Matern', 'length_scale': 0.022202626088194233, 'noise_level': 0.0006705220168373743, 'constant_value': 4.55560687854074, 'nu': 0.5}. Best is trial 959 with value: 0.1375110730946576.
