[I 2024-12-04 15:39:03,024] Trial 2073 finished with value: 0.42040985259106195 and parameters: {'n_estimators': 722, 'max_depth': 36, 'min_samples_split': 2, 'min_samples_leaf': 1, 'max_features': None, 'bootstrap': True, 'criterion': 'squared_error'}. Best is trial 1025 with value: 0.41844370194907604.
[I 2024-12-04 15:39:06,336] Trial 2083 finished with value: 1.0441601267201004 and parameters: {'n_estimators': 597, 'max_depth': 33, 'min_samples_split': 19, 'min_samples_leaf': 5, 'max_features': 'log2', 'bootstrap': True, 'criterion': 'absolute_error'}. Best is trial 1025 with value: 0.41844370194907604.
[I 2024-12-04 15:39:07,588] Trial 2071 finished with value: 0.4242106310898638 and parameters: {'n_estimators': 822, 'max_depth': 47, 'min_samples_split': 3, 'min_samples_leaf': 1, 'max_features': None, 'bootstrap': True, 'criterion': 'squared_error'}. Best is trial 1025 with value: 0.41844370194907604.
[I 2024-12-04 15:39:10,578] Trial 2075 finished with value: 0.4188817139378928 and parameters: {'n_estimators': 856, 'max_depth': 40, 'min_samples_split': 2, 'min_samples_leaf': 1, 'max_features': None, 'bootstrap': True, 'criterion': 'squared_error'}. Best is trial 1025 with value: 0.41844370194907604.
[I 2024-12-04 15:39:11,074] Trial 2086 finished with value: 0.6168909384360564 and parameters: {'n_estimators': 874, 'max_depth': 21, 'min_samples_split': 2, 'min_samples_leaf': 1, 'max_features': 'sqrt', 'bootstrap': False, 'criterion': 'squared_error'}. Best is trial 1025 with value: 0.41844370194907604.
[I 2024-12-04 15:39:12,480] Trial 2079 finished with value: 0.4649466159871968 and parameters: {'n_estimators': 678, 'max_depth': 40, 'min_samples_split': 2, 'min_samples_leaf': 2, 'max_features': None, 'bootstrap': True, 'criterion': 'squared_error'}. Best is trial 1025 with value: 0.41844370194907604.
[I 2024-12-04 15:39:14,328] Trial 2081 finished with value: 0.46492126011415036 and parameters: {'n_estimators': 857, 'max_depth': 41, 'min_samples_split': 4, 'min_samples_leaf': 2, 'max_features': None, 'bootstrap': True, 'criterion': 'squared_error'}. Best is trial 1025 with value: 0.41844370194907604.
[I 2024-12-04 15:39:14,734] Trial 2084 finished with value: 0.4310729099583553 and parameters: {'n_estimators': 762, 'max_depth': 38, 'min_samples_split': 4, 'min_samples_leaf': 1, 'max_features': None, 'bootstrap': True, 'criterion': 'squared_error'}. Best is trial 1025 with value: 0.41844370194907604.
[I 2024-12-04 15:39:14,743] Trial 2087 finished with value: 0.6728682157788516 and parameters: {'n_estimators': 469, 'max_depth': 6, 'min_samples_split': 12, 'min_samples_leaf': 9, 'max_features': None, 'bootstrap': True, 'criterion': 'squared_error'}. Best is trial 1025 with value: 0.41844370194907604.
[I 2024-12-04 15:39:14,764] Trial 2082 finished with value: 0.43121453565426493 and parameters: {'n_estimators': 862, 'max_depth': 44, 'min_samples_split': 4, 'min_samples_leaf': 1, 'max_features': None, 'bootstrap': True, 'criterion': 'squared_error'}. Best is trial 1025 with value: 0.41844370194907604.
[I 2024-12-04 15:39:15,765] Trial 2078 finished with value: 0.4188174106293712 and parameters: {'n_estimators': 839, 'max_depth': 40, 'min_samples_split': 2, 'min_samples_leaf': 1, 'max_features': None, 'bootstrap': True, 'criterion': 'squared_error'}. Best is trial 1025 with value: 0.41844370194907604.
[I 2024-12-04 15:39:17,535] Trial 2088 finished with value: 0.47055965997213794 and parameters: {'n_estimators': 728, 'max_depth': 36, 'min_samples_split': 9, 'min_samples_leaf': 2, 'max_features': None, 'bootstrap': True, 'criterion': 'squared_error'}. Best is trial 1025 with value: 0.41844370194907604.
[I 2024-12-04 15:39:19,516] Trial 2085 finished with value: 0.4222946913031304 and parameters: {'n_estimators': 700, 'max_depth': 44, 'min_samples_split': 2, 'min_samples_leaf': 1, 'max_features': None, 'bootstrap': True, 'criterion': 'squared_error'}. Best is trial 1025 with value: 0.41844370194907604.
[I 2024-12-04 15:39:24,453] Trial 2090 finished with value: 0.46519018692090974 and parameters: {'n_estimators': 776, 'max_depth': 42, 'min_samples_split': 2, 'min_samples_leaf': 2, 'max_features': None, 'bootstrap': True, 'criterion': 'squared_error'}. Best is trial 1025 with value: 0.41844370194907604.
[I 2024-12-04 15:39:28,145] Trial 2092 finished with value: 0.4264833116948263 and parameters: {'n_estimators': 594, 'max_depth': 48, 'min_samples_split': 3, 'min_samples_leaf': 1, 'max_features': None, 'bootstrap': True, 'criterion': 'squared_error'}. Best is trial 1025 with value: 0.41844370194907604.
[I 2024-12-04 15:39:28,196] Trial 2103 finished with value: 0.5828149051122158 and parameters: {'n_estimators': 147, 'max_depth': 23, 'min_samples_split': 9, 'min_samples_leaf': 2, 'max_features': None, 'bootstrap': False, 'criterion': 'squared_error'}. Best is trial 1025 with value: 0.41844370194907604.
[I 2024-12-04 15:39:32,505] Trial 2097 finished with value: 0.46480637943615427 and parameters: {'n_estimators': 690, 'max_depth': 34, 'min_samples_split': 2, 'min_samples_leaf': 2, 'max_features': None, 'bootstrap': True, 'criterion': 'squared_error'}. Best is trial 1025 with value: 0.41844370194907604.
[I 2024-12-04 15:39:36,425] Trial 2089 finished with value: 0.4250698959459327 and parameters: {'n_estimators': 869, 'max_depth': 33, 'min_samples_split': 3, 'min_samples_leaf': 1, 'max_features': None, 'bootstrap': True, 'criterion': 'squared_error'}. Best is trial 1025 with value: 0.41844370194907604.
[I 2024-12-04 15:39:38,705] Trial 2091 finished with value: 0.4647628750335975 and parameters: {'n_estimators': 862, 'max_depth': 35, 'min_samples_split': 2, 'min_samples_leaf': 2, 'max_features': None, 'bootstrap': True, 'criterion': 'squared_error'}. Best is trial 1025 with value: 0.41844370194907604.
[I 2024-12-04 15:39:39,764] Trial 2105 finished with value: 0.9996118646458027 and parameters: {'n_estimators': 940, 'max_depth': 33, 'min_samples_split': 7, 'min_samples_leaf': 8, 'max_features': 'sqrt', 'bootstrap': True, 'criterion': 'squared_error'}. Best is trial 1025 with value: 0.41844370194907604.
[I 2024-12-04 15:39:40,021] Trial 2099 finished with value: 0.5317068286674965 and parameters: {'n_estimators': 818, 'max_depth': 36, 'min_samples_split': 3, 'min_samples_leaf': 1, 'max_features': 'sqrt', 'bootstrap': True, 'criterion': 'squared_error'}. Best is trial 1025 with value: 0.41844370194907604.
[I 2024-12-04 15:39:41,839] Trial 2096 finished with value: 0.4201748680379534 and parameters: {'n_estimators': 850, 'max_depth': 31, 'min_samples_split': 2, 'min_samples_leaf': 1, 'max_features': None, 'bootstrap': True, 'criterion': 'squared_error'}. Best is trial 1025 with value: 0.41844370194907604.
[I 2024-12-04 15:39:43,555] Trial 2035 finished with value: 0.569330096676304 and parameters: {'n_estimators': 819, 'max_depth': 20, 'min_samples_split': 4, 'min_samples_leaf': 1, 'max_features': None, 'bootstrap': False, 'criterion': 'absolute_error'}. Best is trial 1025 with value: 0.41844370194907604.
[I 2024-12-04 15:39:43,882] Trial 2112 finished with value: 0.7283590378191321 and parameters: {'n_estimators': 111, 'max_depth': 49, 'min_samples_split': 50, 'min_samples_leaf': 1, 'max_features': 'log2', 'bootstrap': True, 'criterion': 'absolute_error'}. Best is trial 1025 with value: 0.41844370194907604.
[I 2024-12-04 15:39:46,834] Trial 2093 finished with value: 0.4189981327070092 and parameters: {'n_estimators': 850, 'max_depth': 40, 'min_samples_split': 2, 'min_samples_leaf': 1, 'max_features': None, 'bootstrap': True, 'criterion': 'squared_error'}. Best is trial 1025 with value: 0.41844370194907604.
[I 2024-12-04 15:39:46,847] Trial 2098 finished with value: 0.4239580153845837 and parameters: {'n_estimators': 859, 'max_depth': 42, 'min_samples_split': 3, 'min_samples_leaf': 1, 'max_features': None, 'bootstrap': True, 'criterion': 'squared_error'}. Best is trial 1025 with value: 0.41844370194907604.
[I 2024-12-04 15:39:47,543] Trial 2116 finished with value: 0.7928165506446555 and parameters: {'n_estimators': 206, 'max_depth': 17, 'min_samples_split': 43, 'min_samples_leaf': 2, 'max_features': 'sqrt', 'bootstrap': False, 'criterion': 'absolute_error'}. Best is trial 1025 with value: 0.41844370194907604.
[I 2024-12-04 15:39:48,983] Trial 2094 finished with value: 0.4211379857884051 and parameters: {'n_estimators': 901, 'max_depth': 42, 'min_samples_split': 2, 'min_samples_leaf': 1, 'max_features': None, 'bootstrap': True, 'criterion': 'squared_error'}. Best is trial 1025 with value: 0.41844370194907604.
[I 2024-12-04 15:39:51,450] Trial 2100 finished with value: 0.41894300065328416 and parameters: {'n_estimators': 869, 'max_depth': 40, 'min_samples_split': 2, 'min_samples_leaf': 1, 'max_features': None, 'bootstrap': True, 'criterion': 'squared_error'}. Best is trial 1025 with value: 0.41844370194907604.
[I 2024-12-04 15:39:52,594] Trial 2117 finished with value: 0.9292258576762155 and parameters: {'n_estimators': 858, 'max_depth': 38, 'min_samples_split': 8, 'min_samples_leaf': 8, 'max_features': 'sqrt', 'bootstrap': False, 'criterion': 'squared_error'}. Best is trial 1025 with value: 0.41844370194907604.
[I 2024-12-04 15:39:52,655] Trial 2102 finished with value: 0.4212848396756447 and parameters: {'n_estimators': 862, 'max_depth': 49, 'min_samples_split': 2, 'min_samples_leaf': 1, 'max_features': None, 'bootstrap': True, 'criterion': 'squared_error'}. Best is trial 1025 with value: 0.41844370194907604.
[I 2024-12-04 15:39:59,888] Trial 2107 finished with value: 0.42518472880590213 and parameters: {'n_estimators': 899, 'max_depth': 33, 'min_samples_split': 3, 'min_samples_leaf': 1, 'max_features': None, 'bootstrap': True, 'criterion': 'squared_error'}. Best is trial 1025 with value: 0.41844370194907604.
[I 2024-12-04 15:40:00,644] Trial 2115 finished with value: 0.5283882331060259 and parameters: {'n_estimators': 338, 'max_depth': 43, 'min_samples_split': 2, 'min_samples_leaf': 1, 'max_features': None, 'bootstrap': False, 'criterion': 'squared_error'}. Best is trial 1025 with value: 0.41844370194907604.
[I 2024-12-04 15:40:02,821] Trial 2104 finished with value: 0.4210501842134715 and parameters: {'n_estimators': 895, 'max_depth': 35, 'min_samples_split': 2, 'min_samples_leaf': 1, 'max_features': None, 'bootstrap': True, 'criterion': 'squared_error'}. Best is trial 1025 with value: 0.41844370194907604.
[I 2024-12-04 15:40:03,830] Trial 2120 finished with value: 0.8889159043627468 and parameters: {'n_estimators': 784, 'max_depth': 43, 'min_samples_split': 2, 'min_samples_leaf': 2, 'max_features': 'log2', 'bootstrap': False, 'criterion': 'squared_error'}. Best is trial 1025 with value: 0.41844370194907604.
[I 2024-12-04 15:40:05,490] Trial 2109 finished with value: 0.4239991916862081 and parameters: {'n_estimators': 914, 'max_depth': 37, 'min_samples_split': 3, 'min_samples_leaf': 1, 'max_features': None, 'bootstrap': True, 'criterion': 'squared_error'}. Best is trial 1025 with value: 0.41844370194907604.
[I 2024-12-04 15:40:05,835] Trial 2108 finished with value: 0.42259892458719994 and parameters: {'n_estimators': 864, 'max_depth': 28, 'min_samples_split': 2, 'min_samples_leaf': 1, 'max_features': None, 'bootstrap': True, 'criterion': 'squared_error'}. Best is trial 1025 with value: 0.41844370194907604.
[I 2024-12-04 15:40:07,840] Trial 2119 finished with value: 1.0079799127952123 and parameters: {'n_estimators': 683, 'max_depth': 35, 'min_samples_split': 4, 'min_samples_leaf': 9, 'max_features': 'sqrt', 'bootstrap': True, 'criterion': 'absolute_error'}. Best is trial 1025 with value: 0.41844370194907604.
[I 2024-12-04 15:40:08,722] Trial 2121 finished with value: 0.7394596495294525 and parameters: {'n_estimators': 959, 'max_depth': 35, 'min_samples_split': 44, 'min_samples_leaf': 1, 'max_features': 'log2', 'bootstrap': False, 'criterion': 'squared_error'}. Best is trial 1025 with value: 0.41844370194907604.
[I 2024-12-04 15:40:08,736] Trial 2124 finished with value: 0.5759222841812056 and parameters: {'n_estimators': 583, 'max_depth': 40, 'min_samples_split': 24, 'min_samples_leaf': 3, 'max_features': None, 'bootstrap': False, 'criterion': 'squared_error'}. Best is trial 1025 with value: 0.41844370194907604.
[I 2024-12-04 15:40:10,495] Trial 2106 finished with value: 0.4647168144283127 and parameters: {'n_estimators': 892, 'max_depth': 39, 'min_samples_split': 2, 'min_samples_leaf': 2, 'max_features': None, 'bootstrap': True, 'criterion': 'squared_error'}. Best is trial 1025 with value: 0.41844370194907604.
[I 2024-12-04 15:40:10,694] Trial 2110 finished with value: 0.41949697239266964 and parameters: {'n_estimators': 848, 'max_depth': 41, 'min_samples_split': 2, 'min_samples_leaf': 1, 'max_features': None, 'bootstrap': True, 'criterion': 'squared_error'}. Best is trial 1025 with value: 0.41844370194907604.
[I 2024-12-04 15:40:10,923] Trial 2114 finished with value: 0.4209768395397436 and parameters: {'n_estimators': 921, 'max_depth': 42, 'min_samples_split': 2, 'min_samples_leaf': 1, 'max_features': None, 'bootstrap': True, 'criterion': 'squared_error'}. Best is trial 1025 with value: 0.41844370194907604.
[I 2024-12-04 15:40:12,256] Trial 2113 finished with value: 0.42398053611856135 and parameters: {'n_estimators': 885, 'max_depth': 39, 'min_samples_split': 3, 'min_samples_leaf': 1, 'max_features': None, 'bootstrap': True, 'criterion': 'squared_error'}. Best is trial 1025 with value: 0.41844370194907604.
[I 2024-12-04 15:40:13,216] Trial 2111 finished with value: 0.46511079038566605 and parameters: {'n_estimators': 853, 'max_depth': 42, 'min_samples_split': 2, 'min_samples_leaf': 2, 'max_features': None, 'bootstrap': True, 'criterion': 'squared_error'}. Best is trial 1025 with value: 0.41844370194907604.
[I 2024-12-04 15:40:16,218] Trial 2095 finished with value: 0.4606392123594504 and parameters: {'n_estimators': 755, 'max_depth': 38, 'min_samples_split': 4, 'min_samples_leaf': 2, 'max_features': None, 'bootstrap': True, 'criterion': 'absolute_error'}. Best is trial 1025 with value: 0.41844370194907604.
[I 2024-12-04 15:40:26,390] Trial 2118 finished with value: 0.46475143713509887 and parameters: {'n_estimators': 865, 'max_depth': 48, 'min_samples_split': 2, 'min_samples_leaf': 2, 'max_features': None, 'bootstrap': True, 'criterion': 'squared_error'}. Best is trial 1025 with value: 0.41844370194907604.
[I 2024-12-04 15:40:32,202] Trial 2123 finished with value: 0.6608244445396836 and parameters: {'n_estimators': 497, 'max_depth': 45, 'min_samples_split': 5, 'min_samples_leaf': 1, 'max_features': 'log2', 'bootstrap': True, 'criterion': 'absolute_error'}. Best is trial 1025 with value: 0.41844370194907604.
[I 2024-12-04 15:40:33,016] Trial 2076 finished with value: 0.42733049864253836 and parameters: {'n_estimators': 855, 'max_depth': 41, 'min_samples_split': 2, 'min_samples_leaf': 1, 'max_features': None, 'bootstrap': True, 'criterion': 'absolute_error'}. Best is trial 1025 with value: 0.41844370194907604.
[I 2024-12-04 15:40:33,617] Trial 2129 finished with value: 0.4210299666945507 and parameters: {'n_estimators': 891, 'max_depth': 47, 'min_samples_split': 2, 'min_samples_leaf': 1, 'max_features': None, 'bootstrap': True, 'criterion': 'squared_error'}. Best is trial 1025 with value: 0.41844370194907604.
[I 2024-12-04 15:40:34,574] Trial 2122 finished with value: 0.4319237092835213 and parameters: {'n_estimators': 883, 'max_depth': 42, 'min_samples_split': 4, 'min_samples_leaf': 1, 'max_features': None, 'bootstrap': True, 'criterion': 'squared_error'}. Best is trial 1025 with value: 0.41844370194907604.
[I 2024-12-04 15:40:36,307] Trial 2128 finished with value: 0.42303714294248274 and parameters: {'n_estimators': 890, 'max_depth': 29, 'min_samples_split': 2, 'min_samples_leaf': 1, 'max_features': None, 'bootstrap': True, 'criterion': 'squared_error'}. Best is trial 1025 with value: 0.41844370194907604.
[I 2024-12-04 15:40:36,949] Trial 2125 finished with value: 0.42079379387480714 and parameters: {'n_estimators': 908, 'max_depth': 36, 'min_samples_split': 2, 'min_samples_leaf': 1, 'max_features': None, 'bootstrap': True, 'criterion': 'squared_error'}. Best is trial 1025 with value: 0.41844370194907604.
[I 2024-12-04 15:40:36,962] Trial 2101 finished with value: 0.6630463601752533 and parameters: {'n_estimators': 969, 'max_depth': 27, 'min_samples_split': 6, 'min_samples_leaf': 4, 'max_features': None, 'bootstrap': False, 'criterion': 'absolute_error'}. Best is trial 1025 with value: 0.41844370194907604.
[I 2024-12-04 15:40:38,679] Trial 2130 finished with value: 0.4245527156133785 and parameters: {'n_estimators': 899, 'max_depth': 35, 'min_samples_split': 3, 'min_samples_leaf': 1, 'max_features': None, 'bootstrap': True, 'criterion': 'squared_error'}. Best is trial 1025 with value: 0.41844370194907604.
[I 2024-12-04 15:40:39,340] Trial 2131 finished with value: 0.6699328873966797 and parameters: {'n_estimators': 814, 'max_depth': 34, 'min_samples_split': 2, 'min_samples_leaf': 1, 'max_features': 'log2', 'bootstrap': True, 'criterion': 'squared_error'}. Best is trial 1025 with value: 0.41844370194907604.
[I 2024-12-04 15:40:40,559] Trial 2126 finished with value: 0.4242126206418988 and parameters: {'n_estimators': 915, 'max_depth': 42, 'min_samples_split': 3, 'min_samples_leaf': 1, 'max_features': None, 'bootstrap': True, 'criterion': 'squared_error'}. Best is trial 1025 with value: 0.41844370194907604.
[I 2024-12-04 15:40:41,633] Trial 2127 finished with value: 0.421225170813867 and parameters: {'n_estimators': 899, 'max_depth': 34, 'min_samples_split': 2, 'min_samples_leaf': 1, 'max_features': None, 'bootstrap': True, 'criterion': 'squared_error'}. Best is trial 1025 with value: 0.41844370194907604.
[I 2024-12-04 15:40:43,676] Trial 2132 finished with value: 0.4243076473057339 and parameters: {'n_estimators': 920, 'max_depth': 44, 'min_samples_split': 3, 'min_samples_leaf': 1, 'max_features': None, 'bootstrap': True, 'criterion': 'squared_error'}. Best is trial 1025 with value: 0.41844370194907604.
[I 2024-12-04 15:40:43,705] Trial 2134 finished with value: 0.464689430819255 and parameters: {'n_estimators': 885, 'max_depth': 35, 'min_samples_split': 2, 'min_samples_leaf': 2, 'max_features': None, 'bootstrap': True, 'criterion': 'squared_error'}. Best is trial 1025 with value: 0.41844370194907604.
[I 2024-12-04 15:40:44,688] Trial 2133 finished with value: 0.41959098604468226 and parameters: {'n_estimators': 876, 'max_depth': 41, 'min_samples_split': 2, 'min_samples_leaf': 1, 'max_features': None, 'bootstrap': True, 'criterion': 'squared_error'}. Best is trial 1025 with value: 0.41844370194907604.
[I 2024-12-04 15:40:46,715] Trial 2136 finished with value: 0.42061396908004195 and parameters: {'n_estimators': 895, 'max_depth': 43, 'min_samples_split': 2, 'min_samples_leaf': 1, 'max_features': None, 'bootstrap': True, 'criterion': 'squared_error'}. Best is trial 1025 with value: 0.41844370194907604.
[I 2024-12-04 15:40:47,284] Trial 2150 finished with value: 0.865159007107895 and parameters: {'n_estimators': 251, 'max_depth': 30, 'min_samples_split': 2, 'min_samples_leaf': 5, 'max_features': 'sqrt', 'bootstrap': False, 'criterion': 'absolute_error'}. Best is trial 1025 with value: 0.41844370194907604.
[I 2024-12-04 15:40:47,969] Trial 2141 finished with value: 0.5278275933716732 and parameters: {'n_estimators': 894, 'max_depth': 42, 'min_samples_split': 2, 'min_samples_leaf': 1, 'max_features': None, 'bootstrap': False, 'criterion': 'squared_error'}. Best is trial 1025 with value: 0.41844370194907604.
[I 2024-12-04 15:40:47,979] Trial 2149 finished with value: 1.033706525246986 and parameters: {'n_estimators': 439, 'max_depth': 5, 'min_samples_split': 2, 'min_samples_leaf': 12, 'max_features': 'sqrt', 'bootstrap': True, 'criterion': 'squared_error'}. Best is trial 1025 with value: 0.41844370194907604.
[I 2024-12-04 15:40:48,776] Trial 2151 finished with value: 1.0677307741159041 and parameters: {'n_estimators': 605, 'max_depth': 38, 'min_samples_split': 44, 'min_samples_leaf': 10, 'max_features': 'log2', 'bootstrap': False, 'criterion': 'squared_error'}. Best is trial 1025 with value: 0.41844370194907604.
[I 2024-12-04 15:40:49,002] Trial 2138 finished with value: 0.4207958908603428 and parameters: {'n_estimators': 873, 'max_depth': 36, 'min_samples_split': 2, 'min_samples_leaf': 1, 'max_features': None, 'bootstrap': True, 'criterion': 'squared_error'}. Best is trial 1025 with value: 0.41844370194907604.
[I 2024-12-04 15:40:49,961] Trial 2137 finished with value: 0.4651297030685744 and parameters: {'n_estimators': 904, 'max_depth': 41, 'min_samples_split': 2, 'min_samples_leaf': 2, 'max_features': None, 'bootstrap': True, 'criterion': 'squared_error'}. Best is trial 1025 with value: 0.41844370194907604.
[I 2024-12-04 15:40:50,703] Trial 2143 finished with value: 0.4208909875874546 and parameters: {'n_estimators': 858, 'max_depth': 35, 'min_samples_split': 2, 'min_samples_leaf': 1, 'max_features': None, 'bootstrap': True, 'criterion': 'squared_error'}. Best is trial 1025 with value: 0.41844370194907604.
[I 2024-12-04 15:40:51,037] Trial 2140 finished with value: 0.724418066013917 and parameters: {'n_estimators': 600, 'max_depth': 48, 'min_samples_split': 5, 'min_samples_leaf': 2, 'max_features': 'sqrt', 'bootstrap': True, 'criterion': 'absolute_error'}. Best is trial 1025 with value: 0.41844370194907604.
[I 2024-12-04 15:40:51,799] Trial 2142 finished with value: 0.42431632183960033 and parameters: {'n_estimators': 911, 'max_depth': 38, 'min_samples_split': 3, 'min_samples_leaf': 1, 'max_features': None, 'bootstrap': True, 'criterion': 'squared_error'}. Best is trial 1025 with value: 0.41844370194907604.
