[I 2024-12-04 20:11:55,898] Trial 1184 finished with value: 1.3485771100874437 and parameters: {'n_estimators': 600, 'max_depth': 38, 'min_samples_split': 2, 'min_samples_leaf': 14, 'max_features': 'log2', 'bootstrap': True, 'criterion': 'absolute_error'}. Best is trial 874 with value: 0.32176430753353746.
[I 2024-12-04 20:11:56,742] Trial 1185 finished with value: 1.3333267732295355 and parameters: {'n_estimators': 192, 'max_depth': 27, 'min_samples_split': 2, 'min_samples_leaf': 8, 'max_features': 'log2', 'bootstrap': False, 'criterion': 'absolute_error'}. Best is trial 874 with value: 0.32176430753353746.
[I 2024-12-04 20:11:57,661] Trial 1187 finished with value: 1.101698315941297 and parameters: {'n_estimators': 204, 'max_depth': 50, 'min_samples_split': 3, 'min_samples_leaf': 7, 'max_features': 'sqrt', 'bootstrap': False, 'criterion': 'squared_error'}. Best is trial 874 with value: 0.32176430753353746.
[I 2024-12-04 20:11:58,557] Trial 1186 finished with value: 0.32472716326916434 and parameters: {'n_estimators': 428, 'max_depth': 50, 'min_samples_split': 2, 'min_samples_leaf': 1, 'max_features': 'sqrt', 'bootstrap': False, 'criterion': 'squared_error'}. Best is trial 874 with value: 0.32176430753353746.
[I 2024-12-04 20:11:59,988] Trial 1188 finished with value: 0.3610343920940505 and parameters: {'n_estimators': 463, 'max_depth': 41, 'min_samples_split': 2, 'min_samples_leaf': 1, 'max_features': 'sqrt', 'bootstrap': False, 'criterion': 'squared_error'}. Best is trial 874 with value: 0.32176430753353746.
[I 2024-12-04 20:12:00,256] Trial 1189 finished with value: 0.34769920260567966 and parameters: {'n_estimators': 272, 'max_depth': 42, 'min_samples_split': 2, 'min_samples_leaf': 1, 'max_features': 'sqrt', 'bootstrap': False, 'criterion': 'squared_error'}. Best is trial 874 with value: 0.32176430753353746.
[I 2024-12-04 20:12:01,318] Trial 1166 finished with value: 0.4228555694552796 and parameters: {'n_estimators': 209, 'max_depth': 50, 'min_samples_split': 2, 'min_samples_leaf': 1, 'max_features': None, 'bootstrap': False, 'criterion': 'absolute_error'}. Best is trial 874 with value: 0.32176430753353746.
[I 2024-12-04 20:12:01,378] Trial 1190 finished with value: 0.664340760751789 and parameters: {'n_estimators': 314, 'max_depth': 50, 'min_samples_split': 2, 'min_samples_leaf': 2, 'max_features': 'sqrt', 'bootstrap': False, 'criterion': 'squared_error'}. Best is trial 874 with value: 0.32176430753353746.
[I 2024-12-04 20:12:03,377] Trial 1192 finished with value: 1.0126838232244455 and parameters: {'n_estimators': 633, 'max_depth': 46, 'min_samples_split': 22, 'min_samples_leaf': 5, 'max_features': 'sqrt', 'bootstrap': False, 'criterion': 'squared_error'}. Best is trial 874 with value: 0.32176430753353746.
[I 2024-12-04 20:12:03,724] Trial 1191 finished with value: 0.5562317536052572 and parameters: {'n_estimators': 663, 'max_depth': 24, 'min_samples_split': 2, 'min_samples_leaf': 7, 'max_features': None, 'bootstrap': True, 'criterion': 'squared_error'}. Best is trial 874 with value: 0.32176430753353746.
[I 2024-12-04 20:12:04,527] Trial 1193 finished with value: 0.323108907688658 and parameters: {'n_estimators': 395, 'max_depth': 50, 'min_samples_split': 2, 'min_samples_leaf': 1, 'max_features': 'sqrt', 'bootstrap': False, 'criterion': 'squared_error'}. Best is trial 874 with value: 0.32176430753353746.
[I 2024-12-04 20:12:05,304] Trial 1194 finished with value: 1.2797064043187971 and parameters: {'n_estimators': 353, 'max_depth': 26, 'min_samples_split': 8, 'min_samples_leaf': 12, 'max_features': 'sqrt', 'bootstrap': False, 'criterion': 'absolute_error'}. Best is trial 874 with value: 0.32176430753353746.
[I 2024-12-04 20:12:06,055] Trial 1196 finished with value: 1.2766664106329917 and parameters: {'n_estimators': 174, 'max_depth': 30, 'min_samples_split': 20, 'min_samples_leaf': 7, 'max_features': 'log2', 'bootstrap': True, 'criterion': 'squared_error'}. Best is trial 874 with value: 0.32176430753353746.
[I 2024-12-04 20:12:06,834] Trial 1195 finished with value: 0.3572038259499227 and parameters: {'n_estimators': 442, 'max_depth': 42, 'min_samples_split': 2, 'min_samples_leaf': 1, 'max_features': 'sqrt', 'bootstrap': False, 'criterion': 'squared_error'}. Best is trial 874 with value: 0.32176430753353746.
[I 2024-12-04 20:12:07,023] Trial 1197 finished with value: 0.3877792073710451 and parameters: {'n_estimators': 181, 'max_depth': 50, 'min_samples_split': 4, 'min_samples_leaf': 1, 'max_features': 'sqrt', 'bootstrap': False, 'criterion': 'squared_error'}. Best is trial 874 with value: 0.32176430753353746.
[I 2024-12-04 20:12:08,287] Trial 1198 finished with value: 0.3491458310828223 and parameters: {'n_estimators': 238, 'max_depth': 44, 'min_samples_split': 2, 'min_samples_leaf': 1, 'max_features': 'sqrt', 'bootstrap': False, 'criterion': 'squared_error'}. Best is trial 874 with value: 0.32176430753353746.
[I 2024-12-04 20:12:08,830] Trial 1200 finished with value: 0.6678927839021346 and parameters: {'n_estimators': 231, 'max_depth': 50, 'min_samples_split': 2, 'min_samples_leaf': 2, 'max_features': 'sqrt', 'bootstrap': False, 'criterion': 'squared_error'}. Best is trial 874 with value: 0.32176430753353746.
[I 2024-12-04 20:12:09,375] Trial 1199 finished with value: 0.3251328347291972 and parameters: {'n_estimators': 270, 'max_depth': 50, 'min_samples_split': 2, 'min_samples_leaf': 1, 'max_features': 'sqrt', 'bootstrap': False, 'criterion': 'squared_error'}. Best is trial 874 with value: 0.32176430753353746.
[I 2024-12-04 20:12:10,778] Trial 1201 finished with value: 0.3228847481584375 and parameters: {'n_estimators': 367, 'max_depth': 50, 'min_samples_split': 2, 'min_samples_leaf': 1, 'max_features': 'sqrt', 'bootstrap': False, 'criterion': 'squared_error'}. Best is trial 874 with value: 0.32176430753353746.
[I 2024-12-04 20:12:10,869] Trial 1202 finished with value: 0.38636913646174187 and parameters: {'n_estimators': 363, 'max_depth': 50, 'min_samples_split': 4, 'min_samples_leaf': 1, 'max_features': 'sqrt', 'bootstrap': False, 'criterion': 'squared_error'}. Best is trial 874 with value: 0.32176430753353746.
[I 2024-12-04 20:12:11,980] Trial 1203 finished with value: 0.3468953388765213 and parameters: {'n_estimators': 354, 'max_depth': 43, 'min_samples_split': 2, 'min_samples_leaf': 1, 'max_features': 'sqrt', 'bootstrap': False, 'criterion': 'squared_error'}. Best is trial 874 with value: 0.32176430753353746.
[I 2024-12-04 20:12:13,700] Trial 1205 finished with value: 0.39842720580235896 and parameters: {'n_estimators': 528, 'max_depth': 42, 'min_samples_split': 3, 'min_samples_leaf': 1, 'max_features': 'sqrt', 'bootstrap': False, 'criterion': 'squared_error'}. Best is trial 874 with value: 0.32176430753353746.
[I 2024-12-04 20:12:14,822] Trial 1206 finished with value: 0.4467546203034189 and parameters: {'n_estimators': 340, 'max_depth': 38, 'min_samples_split': 4, 'min_samples_leaf': 1, 'max_features': None, 'bootstrap': True, 'criterion': 'squared_error'}. Best is trial 874 with value: 0.32176430753353746.
[I 2024-12-04 20:12:16,119] Trial 1208 finished with value: 0.38426335741638745 and parameters: {'n_estimators': 171, 'max_depth': 50, 'min_samples_split': 2, 'min_samples_leaf': 1, 'max_features': 'sqrt', 'bootstrap': True, 'criterion': 'squared_error'}. Best is trial 874 with value: 0.32176430753353746.
[I 2024-12-04 20:12:17,453] Trial 1209 finished with value: 0.32838088770852464 and parameters: {'n_estimators': 172, 'max_depth': 50, 'min_samples_split': 2, 'min_samples_leaf': 1, 'max_features': 'sqrt', 'bootstrap': False, 'criterion': 'squared_error'}. Best is trial 874 with value: 0.32176430753353746.
[I 2024-12-04 20:12:17,710] Trial 1207 finished with value: 0.4348807157481109 and parameters: {'n_estimators': 383, 'max_depth': 42, 'min_samples_split': 2, 'min_samples_leaf': 1, 'max_features': None, 'bootstrap': False, 'criterion': 'squared_error'}. Best is trial 874 with value: 0.32176430753353746.
[I 2024-12-04 20:12:19,230] Trial 1210 finished with value: 0.6937963894049807 and parameters: {'n_estimators': 395, 'max_depth': 40, 'min_samples_split': 4, 'min_samples_leaf': 2, 'max_features': 'sqrt', 'bootstrap': False, 'criterion': 'squared_error'}. Best is trial 874 with value: 0.32176430753353746.
[I 2024-12-04 20:12:19,892] Trial 1211 finished with value: 1.2403051190415173 and parameters: {'n_estimators': 953, 'max_depth': 24, 'min_samples_split': 16, 'min_samples_leaf': 15, 'max_features': 'sqrt', 'bootstrap': True, 'criterion': 'squared_error'}. Best is trial 874 with value: 0.32176430753353746.
[I 2024-12-04 20:12:20,971] Trial 1204 finished with value: 0.35253482232539934 and parameters: {'n_estimators': 367, 'max_depth': 49, 'min_samples_split': 2, 'min_samples_leaf': 1, 'max_features': 'sqrt', 'bootstrap': False, 'criterion': 'absolute_error'}. Best is trial 874 with value: 0.32176430753353746.
[I 2024-12-04 20:12:21,892] Trial 1213 finished with value: 0.38815865360809654 and parameters: {'n_estimators': 381, 'max_depth': 50, 'min_samples_split': 4, 'min_samples_leaf': 1, 'max_features': 'sqrt', 'bootstrap': False, 'criterion': 'squared_error'}. Best is trial 874 with value: 0.32176430753353746.
[I 2024-12-04 20:12:21,893] Trial 1212 finished with value: 0.3667532285211806 and parameters: {'n_estimators': 517, 'max_depth': 50, 'min_samples_split': 3, 'min_samples_leaf': 1, 'max_features': 'sqrt', 'bootstrap': False, 'criterion': 'squared_error'}. Best is trial 874 with value: 0.32176430753353746.
[I 2024-12-04 20:12:22,215] Trial 1214 finished with value: 1.0572176769069477 and parameters: {'n_estimators': 315, 'max_depth': 36, 'min_samples_split': 4, 'min_samples_leaf': 2, 'max_features': 'log2', 'bootstrap': False, 'criterion': 'squared_error'}. Best is trial 874 with value: 0.32176430753353746.
[I 2024-12-04 20:12:24,132] Trial 1215 finished with value: 0.5074686781322142 and parameters: {'n_estimators': 129, 'max_depth': 40, 'min_samples_split': 6, 'min_samples_leaf': 4, 'max_features': None, 'bootstrap': True, 'criterion': 'squared_error'}. Best is trial 874 with value: 0.32176430753353746.
[I 2024-12-04 20:12:24,406] Trial 1216 finished with value: 0.662496410488534 and parameters: {'n_estimators': 261, 'max_depth': 50, 'min_samples_split': 2, 'min_samples_leaf': 2, 'max_features': 'sqrt', 'bootstrap': False, 'criterion': 'squared_error'}. Best is trial 874 with value: 0.32176430753353746.
[I 2024-12-04 20:12:25,632] Trial 1217 finished with value: 0.5202183438875485 and parameters: {'n_estimators': 376, 'max_depth': 49, 'min_samples_split': 2, 'min_samples_leaf': 1, 'max_features': 'log2', 'bootstrap': False, 'criterion': 'squared_error'}. Best is trial 874 with value: 0.32176430753353746.
[I 2024-12-04 20:12:26,435] Trial 1219 finished with value: 0.3449815746941348 and parameters: {'n_estimators': 305, 'max_depth': 43, 'min_samples_split': 2, 'min_samples_leaf': 1, 'max_features': 'sqrt', 'bootstrap': False, 'criterion': 'squared_error'}. Best is trial 874 with value: 0.32176430753353746.
[I 2024-12-04 20:12:26,829] Trial 1218 finished with value: 0.3521486722572419 and parameters: {'n_estimators': 491, 'max_depth': 44, 'min_samples_split': 2, 'min_samples_leaf': 1, 'max_features': 'sqrt', 'bootstrap': False, 'criterion': 'squared_error'}. Best is trial 874 with value: 0.32176430753353746.
[I 2024-12-04 20:12:27,208] Trial 1220 finished with value: 0.34965634555781394 and parameters: {'n_estimators': 188, 'max_depth': 43, 'min_samples_split': 2, 'min_samples_leaf': 1, 'max_features': 'sqrt', 'bootstrap': False, 'criterion': 'squared_error'}. Best is trial 874 with value: 0.32176430753353746.
[I 2024-12-04 20:12:28,490] Trial 1221 finished with value: 0.6960126229648906 and parameters: {'n_estimators': 451, 'max_depth': 43, 'min_samples_split': 2, 'min_samples_leaf': 2, 'max_features': 'sqrt', 'bootstrap': False, 'criterion': 'squared_error'}. Best is trial 874 with value: 0.32176430753353746.
[I 2024-12-04 20:12:28,902] Trial 1222 finished with value: 0.6718849906409697 and parameters: {'n_estimators': 447, 'max_depth': 48, 'min_samples_split': 25, 'min_samples_leaf': 1, 'max_features': 'sqrt', 'bootstrap': True, 'criterion': 'squared_error'}. Best is trial 874 with value: 0.32176430753353746.
[I 2024-12-04 20:12:31,075] Trial 1224 finished with value: 1.2666710426323995 and parameters: {'n_estimators': 407, 'max_depth': 34, 'min_samples_split': 2, 'min_samples_leaf': 3, 'max_features': 'log2', 'bootstrap': False, 'criterion': 'absolute_error'}. Best is trial 874 with value: 0.32176430753353746.
[I 2024-12-04 20:12:32,006] Trial 1223 finished with value: 1.1932493693513062 and parameters: {'n_estimators': 768, 'max_depth': 14, 'min_samples_split': 45, 'min_samples_leaf': 6, 'max_features': 'sqrt', 'bootstrap': False, 'criterion': 'absolute_error'}. Best is trial 874 with value: 0.32176430753353746.
[I 2024-12-04 20:12:33,139] Trial 1226 finished with value: 0.3222177023511835 and parameters: {'n_estimators': 342, 'max_depth': 50, 'min_samples_split': 2, 'min_samples_leaf': 1, 'max_features': 'sqrt', 'bootstrap': False, 'criterion': 'squared_error'}. Best is trial 874 with value: 0.32176430753353746.
[I 2024-12-04 20:12:33,207] Trial 1227 finished with value: 0.36149302470905487 and parameters: {'n_estimators': 197, 'max_depth': 50, 'min_samples_split': 3, 'min_samples_leaf': 1, 'max_features': 'sqrt', 'bootstrap': False, 'criterion': 'squared_error'}. Best is trial 874 with value: 0.32176430753353746.
[I 2024-12-04 20:12:34,303] Trial 1229 finished with value: 1.1611585840694942 and parameters: {'n_estimators': 101, 'max_depth': 49, 'min_samples_split': 27, 'min_samples_leaf': 6, 'max_features': 'sqrt', 'bootstrap': True, 'criterion': 'squared_error'}. Best is trial 874 with value: 0.32176430753353746.
[I 2024-12-04 20:12:35,422] Trial 1228 finished with value: 0.3236983380936183 and parameters: {'n_estimators': 355, 'max_depth': 50, 'min_samples_split': 2, 'min_samples_leaf': 1, 'max_features': 'sqrt', 'bootstrap': False, 'criterion': 'squared_error'}. Best is trial 874 with value: 0.32176430753353746.
[I 2024-12-04 20:12:35,998] Trial 1230 finished with value: 0.4104040924145439 and parameters: {'n_estimators': 411, 'max_depth': 43, 'min_samples_split': 4, 'min_samples_leaf': 1, 'max_features': 'sqrt', 'bootstrap': False, 'criterion': 'squared_error'}. Best is trial 874 with value: 0.32176430753353746.
[I 2024-12-04 20:12:38,277] Trial 1232 finished with value: 0.3245307017075229 and parameters: {'n_estimators': 432, 'max_depth': 50, 'min_samples_split': 2, 'min_samples_leaf': 1, 'max_features': 'sqrt', 'bootstrap': False, 'criterion': 'squared_error'}. Best is trial 874 with value: 0.32176430753353746.
[I 2024-12-04 20:12:40,357] Trial 1233 finished with value: 0.3226231527741188 and parameters: {'n_estimators': 407, 'max_depth': 50, 'min_samples_split': 2, 'min_samples_leaf': 1, 'max_features': 'sqrt', 'bootstrap': False, 'criterion': 'squared_error'}. Best is trial 874 with value: 0.32176430753353746.
[I 2024-12-04 20:12:40,817] Trial 1231 finished with value: 0.8743717283090626 and parameters: {'n_estimators': 329, 'max_depth': 49, 'min_samples_split': 2, 'min_samples_leaf': 2, 'max_features': 'sqrt', 'bootstrap': False, 'criterion': 'absolute_error'}. Best is trial 874 with value: 0.32176430753353746.
[I 2024-12-04 20:12:43,121] Trial 1234 finished with value: 0.3274475360062198 and parameters: {'n_estimators': 574, 'max_depth': 50, 'min_samples_split': 2, 'min_samples_leaf': 1, 'max_features': 'sqrt', 'bootstrap': False, 'criterion': 'squared_error'}. Best is trial 874 with value: 0.32176430753353746.
[I 2024-12-04 20:12:43,122] Trial 1235 finished with value: 0.3561545711843616 and parameters: {'n_estimators': 459, 'max_depth': 43, 'min_samples_split': 2, 'min_samples_leaf': 1, 'max_features': 'sqrt', 'bootstrap': False, 'criterion': 'squared_error'}. Best is trial 874 with value: 0.32176430753353746.
[I 2024-12-04 20:12:45,031] Trial 1237 finished with value: 1.0551370219403473 and parameters: {'n_estimators': 362, 'max_depth': 7, 'min_samples_split': 14, 'min_samples_leaf': 2, 'max_features': 'sqrt', 'bootstrap': True, 'criterion': 'squared_error'}. Best is trial 874 with value: 0.32176430753353746.
[I 2024-12-04 20:12:45,095] Trial 1236 finished with value: 1.2068367451924684 and parameters: {'n_estimators': 567, 'max_depth': 17, 'min_samples_split': 14, 'min_samples_leaf': 9, 'max_features': 'sqrt', 'bootstrap': True, 'criterion': 'squared_error'}. Best is trial 874 with value: 0.32176430753353746.
[I 2024-12-04 20:12:47,413] Trial 1238 finished with value: 0.35155431311419916 and parameters: {'n_estimators': 426, 'max_depth': 44, 'min_samples_split': 2, 'min_samples_leaf': 1, 'max_features': 'sqrt', 'bootstrap': False, 'criterion': 'squared_error'}. Best is trial 874 with value: 0.32176430753353746.
[I 2024-12-04 20:12:47,922] Trial 1239 finished with value: 0.38311343843527695 and parameters: {'n_estimators': 626, 'max_depth': 47, 'min_samples_split': 2, 'min_samples_leaf': 1, 'max_features': 'sqrt', 'bootstrap': True, 'criterion': 'squared_error'}. Best is trial 874 with value: 0.32176430753353746.
[I 2024-12-04 20:12:49,581] Trial 1241 finished with value: 0.6907232708396268 and parameters: {'n_estimators': 468, 'max_depth': 46, 'min_samples_split': 2, 'min_samples_leaf': 2, 'max_features': 'sqrt', 'bootstrap': False, 'criterion': 'squared_error'}. Best is trial 874 with value: 0.32176430753353746.
[I 2024-12-04 20:12:51,334] Trial 1240 finished with value: 0.6836657620220037 and parameters: {'n_estimators': 980, 'max_depth': 32, 'min_samples_split': 2, 'min_samples_leaf': 11, 'max_features': None, 'bootstrap': True, 'criterion': 'squared_error'}. Best is trial 874 with value: 0.32176430753353746.
[I 2024-12-04 20:12:53,299] Trial 1243 finished with value: 1.1849768707555333 and parameters: {'n_estimators': 989, 'max_depth': 7, 'min_samples_split': 30, 'min_samples_leaf': 1, 'max_features': 'log2', 'bootstrap': True, 'criterion': 'squared_error'}. Best is trial 874 with value: 0.32176430753353746.
[I 2024-12-04 20:12:53,365] Trial 1242 finished with value: 0.6001398688006206 and parameters: {'n_estimators': 745, 'max_depth': 42, 'min_samples_split': 25, 'min_samples_leaf': 1, 'max_features': None, 'bootstrap': True, 'criterion': 'squared_error'}. Best is trial 874 with value: 0.32176430753353746.
[I 2024-12-04 20:12:55,851] Trial 1245 finished with value: 0.37492060504235736 and parameters: {'n_estimators': 567, 'max_depth': 49, 'min_samples_split': 3, 'min_samples_leaf': 1, 'max_features': 'sqrt', 'bootstrap': False, 'criterion': 'squared_error'}. Best is trial 874 with value: 0.32176430753353746.
[I 2024-12-04 20:12:56,300] Trial 1244 finished with value: 0.3495034092100856 and parameters: {'n_estimators': 599, 'max_depth': 43, 'min_samples_split': 2, 'min_samples_leaf': 1, 'max_features': 'sqrt', 'bootstrap': False, 'criterion': 'squared_error'}. Best is trial 874 with value: 0.32176430753353746.
[I 2024-12-04 20:12:57,317] Trial 1246 finished with value: 0.677427274473779 and parameters: {'n_estimators': 349, 'max_depth': 42, 'min_samples_split': 4, 'min_samples_leaf': 2, 'max_features': 'sqrt', 'bootstrap': False, 'criterion': 'squared_error'}. Best is trial 874 with value: 0.32176430753353746.
[I 2024-12-04 20:12:58,598] Trial 1248 finished with value: 1.2958376692537 and parameters: {'n_estimators': 268, 'max_depth': 22, 'min_samples_split': 32, 'min_samples_leaf': 3, 'max_features': 'log2', 'bootstrap': True, 'criterion': 'absolute_error'}. Best is trial 874 with value: 0.32176430753353746.
[I 2024-12-04 20:12:58,716] Trial 1247 finished with value: 0.3562367366038808 and parameters: {'n_estimators': 453, 'max_depth': 42, 'min_samples_split': 2, 'min_samples_leaf': 1, 'max_features': 'sqrt', 'bootstrap': False, 'criterion': 'squared_error'}. Best is trial 874 with value: 0.32176430753353746.
[I 2024-12-04 20:13:00,590] Trial 1249 finished with value: 0.32393180183718623 and parameters: {'n_estimators': 319, 'max_depth': 50, 'min_samples_split': 2, 'min_samples_leaf': 1, 'max_features': 'sqrt', 'bootstrap': False, 'criterion': 'squared_error'}. Best is trial 874 with value: 0.32176430753353746.
[I 2024-12-04 20:13:00,822] Trial 1250 finished with value: 0.36145595967687766 and parameters: {'n_estimators': 421, 'max_depth': 50, 'min_samples_split': 3, 'min_samples_leaf': 1, 'max_features': 'sqrt', 'bootstrap': False, 'criterion': 'squared_error'}. Best is trial 874 with value: 0.32176430753353746.
[I 2024-12-04 20:13:02,446] Trial 1251 finished with value: 0.3588745102671103 and parameters: {'n_estimators': 366, 'max_depth': 50, 'min_samples_split': 3, 'min_samples_leaf': 1, 'max_features': 'sqrt', 'bootstrap': False, 'criterion': 'squared_error'}. Best is trial 874 with value: 0.32176430753353746.
[I 2024-12-04 20:13:03,611] Trial 1252 finished with value: 0.540933074736113 and parameters: {'n_estimators': 320, 'max_depth': 49, 'min_samples_split': 5, 'min_samples_leaf': 2, 'max_features': None, 'bootstrap': False, 'criterion': 'squared_error'}. Best is trial 874 with value: 0.32176430753353746.
[I 2024-12-04 20:13:04,503] Trial 1253 finished with value: 0.3235194005806658 and parameters: {'n_estimators': 333, 'max_depth': 50, 'min_samples_split': 2, 'min_samples_leaf': 1, 'max_features': 'sqrt', 'bootstrap': False, 'criterion': 'squared_error'}. Best is trial 874 with value: 0.32176430753353746.
[I 2024-12-04 20:13:05,391] Trial 1254 finished with value: 0.39968182902832067 and parameters: {'n_estimators': 315, 'max_depth': 43, 'min_samples_split': 2, 'min_samples_leaf': 1, 'max_features': 'sqrt', 'bootstrap': True, 'criterion': 'squared_error'}. Best is trial 874 with value: 0.32176430753353746.
