[I 2024-12-04 11:52:09,123] Trial 75 finished with value: 1.0341519687647143 and parameters: {'max_depth': 18, 'min_samples_split': 17, 'min_samples_leaf': 1, 'max_features': 'sqrt', 'criterion': 'friedman_mse', 'splitter': 'random'}. Best is trial 45 with value: 0.5614145525970277.
[I 2024-12-04 11:52:09,273] Trial 81 finished with value: 0.5700768096345179 and parameters: {'max_depth': 21, 'min_samples_split': 20, 'min_samples_leaf': 2, 'max_features': 'sqrt', 'criterion': 'friedman_mse', 'splitter': 'best'}. Best is trial 45 with value: 0.5614145525970277.
[I 2024-12-04 11:52:10,274] Trial 93 finished with value: 1.261454797635251 and parameters: {'max_depth': 15, 'min_samples_split': 20, 'min_samples_leaf': 4, 'max_features': 'log2', 'criterion': 'squared_error', 'splitter': 'best'}. Best is trial 45 with value: 0.5614145525970277.
[I 2024-12-04 11:52:10,739] Trial 76 finished with value: 1.259809444253076 and parameters: {'max_depth': 21, 'min_samples_split': 20, 'min_samples_leaf': 4, 'max_features': 'sqrt', 'criterion': 'friedman_mse', 'splitter': 'random'}. Best is trial 45 with value: 0.5614145525970277.
[I 2024-12-04 11:52:11,267] Trial 82 finished with value: 1.261454797635251 and parameters: {'max_depth': 35, 'min_samples_split': 17, 'min_samples_leaf': 4, 'max_features': 'log2', 'criterion': 'friedman_mse', 'splitter': 'random'}. Best is trial 45 with value: 0.5614145525970277.
[I 2024-12-04 11:52:12,146] Trial 79 finished with value: 0.5988668283347949 and parameters: {'max_depth': 23, 'min_samples_split': 13, 'min_samples_leaf': 2, 'max_features': 'sqrt', 'criterion': 'squared_error', 'splitter': 'best'}. Best is trial 45 with value: 0.5614145525970277.
[I 2024-12-04 11:52:12,875] Trial 87 finished with value: 0.6788466474404086 and parameters: {'max_depth': 14, 'min_samples_split': 10, 'min_samples_leaf': 2, 'max_features': 'sqrt', 'criterion': 'squared_error', 'splitter': 'best'}. Best is trial 45 with value: 0.5614145525970277.
[I 2024-12-04 11:52:13,359] Trial 96 finished with value: 1.1782798013992881 and parameters: {'max_depth': 13, 'min_samples_split': 20, 'min_samples_leaf': 2, 'max_features': 'log2', 'criterion': 'friedman_mse', 'splitter': 'random'}. Best is trial 45 with value: 0.5614145525970277.
[I 2024-12-04 11:52:14,446] Trial 95 finished with value: 0.7977804870488896 and parameters: {'max_depth': 21, 'min_samples_split': 18, 'min_samples_leaf': 1, 'max_features': 'sqrt', 'criterion': 'absolute_error', 'splitter': 'best'}. Best is trial 45 with value: 0.5614145525970277.
[I 2024-12-04 11:52:14,456] Trial 86 finished with value: 0.6179470580713171 and parameters: {'max_depth': 23, 'min_samples_split': 14, 'min_samples_leaf': 1, 'max_features': 'sqrt', 'criterion': 'friedman_mse', 'splitter': 'best'}. Best is trial 45 with value: 0.5614145525970277.
[I 2024-12-04 11:52:14,710] Trial 84 finished with value: 1.259809444253076 and parameters: {'max_depth': 17, 'min_samples_split': 2, 'min_samples_leaf': 5, 'max_features': 'sqrt', 'criterion': 'squared_error', 'splitter': 'random'}. Best is trial 45 with value: 0.5614145525970277.
[I 2024-12-04 11:52:14,837] Trial 77 finished with value: 0.6381937252670509 and parameters: {'max_depth': 17, 'min_samples_split': 14, 'min_samples_leaf': 1, 'max_features': 'sqrt', 'criterion': 'squared_error', 'splitter': 'best'}. Best is trial 45 with value: 0.5614145525970277.
[I 2024-12-04 11:52:16,988] Trial 83 finished with value: 0.5867867610009655 and parameters: {'max_depth': 23, 'min_samples_split': 18, 'min_samples_leaf': 1, 'max_features': 'sqrt', 'criterion': 'friedman_mse', 'splitter': 'best'}. Best is trial 45 with value: 0.5614145525970277.
[I 2024-12-04 11:52:17,098] Trial 94 finished with value: 0.5656162715705985 and parameters: {'max_depth': 20, 'min_samples_split': 17, 'min_samples_leaf': 1, 'max_features': 'sqrt', 'criterion': 'friedman_mse', 'splitter': 'best'}. Best is trial 45 with value: 0.5614145525970277.
[I 2024-12-04 11:52:17,671] Trial 89 finished with value: 0.6062520417811941 and parameters: {'max_depth': 30, 'min_samples_split': 14, 'min_samples_leaf': 1, 'max_features': 'sqrt', 'criterion': 'friedman_mse', 'splitter': 'best'}. Best is trial 45 with value: 0.5614145525970277.
[I 2024-12-04 11:52:17,702] Trial 91 finished with value: 1.0651561940117558 and parameters: {'max_depth': 24, 'min_samples_split': 14, 'min_samples_leaf': 4, 'max_features': 'sqrt', 'criterion': 'friedman_mse', 'splitter': 'best'}. Best is trial 45 with value: 0.5614145525970277.
[I 2024-12-04 11:52:18,137] Trial 85 finished with value: 1.3696699836108748 and parameters: {'max_depth': 26, 'min_samples_split': 15, 'min_samples_leaf': 7, 'max_features': 'sqrt', 'criterion': 'absolute_error', 'splitter': 'random'}. Best is trial 45 with value: 0.5614145525970277.
[I 2024-12-04 11:52:18,367] Trial 92 finished with value: 0.5661380048327987 and parameters: {'max_depth': 24, 'min_samples_split': 16, 'min_samples_leaf': 1, 'max_features': 'sqrt', 'criterion': 'friedman_mse', 'splitter': 'best'}. Best is trial 45 with value: 0.5614145525970277.
[I 2024-12-04 11:52:18,464] Trial 99 finished with value: 1.4094873558287564 and parameters: {'max_depth': 16, 'min_samples_split': 2, 'min_samples_leaf': 10, 'max_features': 'sqrt', 'criterion': 'absolute_error', 'splitter': 'best'}. Best is trial 45 with value: 0.5614145525970277.
[I 2024-12-04 11:52:18,594] Trial 88 finished with value: 0.5709421836140235 and parameters: {'max_depth': 20, 'min_samples_split': 16, 'min_samples_leaf': 1, 'max_features': 'sqrt', 'criterion': 'friedman_mse', 'splitter': 'best'}. Best is trial 45 with value: 0.5614145525970277.
[I 2024-12-04 11:52:19,570] Trial 90 finished with value: 0.7850811700628628 and parameters: {'max_depth': 29, 'min_samples_split': 12, 'min_samples_leaf': 1, 'max_features': 'log2', 'criterion': 'friedman_mse', 'splitter': 'best'}. Best is trial 45 with value: 0.5614145525970277.
[I 2024-12-04 11:52:20,553] Trial 97 finished with value: 0.57617561543549 and parameters: {'max_depth': 20, 'min_samples_split': 19, 'min_samples_leaf': 1, 'max_features': 'sqrt', 'criterion': 'friedman_mse', 'splitter': 'best'}. Best is trial 45 with value: 0.5614145525970277.
[I 2024-12-04 11:52:20,683] Trial 108 finished with value: 0.887993870396294 and parameters: {'max_depth': 32, 'min_samples_split': 13, 'min_samples_leaf': 2, 'max_features': 'sqrt', 'criterion': 'absolute_error', 'splitter': 'random'}. Best is trial 45 with value: 0.5614145525970277.
[I 2024-12-04 11:52:20,792] Trial 105 finished with value: 1.0746652081803512 and parameters: {'max_depth': 22, 'min_samples_split': 17, 'min_samples_leaf': 3, 'max_features': 'sqrt', 'criterion': 'friedman_mse', 'splitter': 'best'}. Best is trial 45 with value: 0.5614145525970277.
[I 2024-12-04 11:52:20,795] Trial 100 finished with value: 1.261454797635251 and parameters: {'max_depth': 23, 'min_samples_split': 9, 'min_samples_leaf': 9, 'max_features': 'log2', 'criterion': 'squared_error', 'splitter': 'random'}. Best is trial 45 with value: 0.5614145525970277.
[I 2024-12-04 11:52:22,507] Trial 101 finished with value: 0.9424778759919019 and parameters: {'max_depth': 13, 'min_samples_split': 7, 'min_samples_leaf': 3, 'max_features': 'log2', 'criterion': 'squared_error', 'splitter': 'best'}. Best is trial 45 with value: 0.5614145525970277.
[I 2024-12-04 11:52:23,164] Trial 98 finished with value: 0.8267919599838686 and parameters: {'max_depth': 29, 'min_samples_split': 11, 'min_samples_leaf': 1, 'max_features': 'sqrt', 'criterion': 'absolute_error', 'splitter': 'best'}. Best is trial 45 with value: 0.5614145525970277.
[I 2024-12-04 11:52:23,170] Trial 107 finished with value: 1.0733356440450181 and parameters: {'max_depth': 35, 'min_samples_split': 8, 'min_samples_leaf': 3, 'max_features': 'sqrt', 'criterion': 'squared_error', 'splitter': 'best'}. Best is trial 45 with value: 0.5614145525970277.
[I 2024-12-04 11:52:23,332] Trial 114 finished with value: 0.5777368085290456 and parameters: {'max_depth': 18, 'min_samples_split': 15, 'min_samples_leaf': 1, 'max_features': 'sqrt', 'criterion': 'friedman_mse', 'splitter': 'best'}. Best is trial 45 with value: 0.5614145525970277.
[I 2024-12-04 11:52:24,407] Trial 111 finished with value: 1.261454797635251 and parameters: {'max_depth': 6, 'min_samples_split': 8, 'min_samples_leaf': 7, 'max_features': 'log2', 'criterion': 'squared_error', 'splitter': 'best'}. Best is trial 45 with value: 0.5614145525970277.
[I 2024-12-04 11:52:24,408] Trial 104 finished with value: 0.5951824649333685 and parameters: {'max_depth': 30, 'min_samples_split': 17, 'min_samples_leaf': 1, 'max_features': 'sqrt', 'criterion': 'friedman_mse', 'splitter': 'best'}. Best is trial 45 with value: 0.5614145525970277.
[I 2024-12-04 11:52:24,693] Trial 102 finished with value: 0.5869215461616306 and parameters: {'max_depth': 18, 'min_samples_split': 19, 'min_samples_leaf': 2, 'max_features': 'sqrt', 'criterion': 'friedman_mse', 'splitter': 'best'}. Best is trial 45 with value: 0.5614145525970277.
[I 2024-12-04 11:52:24,723] Trial 115 finished with value: 0.5963013888683532 and parameters: {'max_depth': 25, 'min_samples_split': 16, 'min_samples_leaf': 1, 'max_features': 'sqrt', 'criterion': 'friedman_mse', 'splitter': 'best'}. Best is trial 45 with value: 0.5614145525970277.
[I 2024-12-04 11:52:25,121] Trial 110 finished with value: 0.5860539268492149 and parameters: {'max_depth': 24, 'min_samples_split': 15, 'min_samples_leaf': 1, 'max_features': 'sqrt', 'criterion': 'squared_error', 'splitter': 'best'}. Best is trial 45 with value: 0.5614145525970277.
[I 2024-12-04 11:52:26,009] Trial 116 finished with value: 1.3696699836108748 and parameters: {'max_depth': 6, 'min_samples_split': 13, 'min_samples_leaf': 5, 'max_features': 'sqrt', 'criterion': 'absolute_error', 'splitter': 'random'}. Best is trial 45 with value: 0.5614145525970277.
[I 2024-12-04 11:52:26,120] Trial 117 finished with value: 0.563179779570873 and parameters: {'max_depth': 29, 'min_samples_split': 20, 'min_samples_leaf': 1, 'max_features': 'sqrt', 'criterion': 'friedman_mse', 'splitter': 'best'}. Best is trial 45 with value: 0.5614145525970277.
[I 2024-12-04 11:52:26,346] Trial 109 finished with value: 1.3696699836108748 and parameters: {'max_depth': 13, 'min_samples_split': 20, 'min_samples_leaf': 8, 'max_features': 'sqrt', 'criterion': 'absolute_error', 'splitter': 'random'}. Best is trial 45 with value: 0.5614145525970277.
[I 2024-12-04 11:52:26,526] Trial 112 finished with value: 1.0746652081803512 and parameters: {'max_depth': 33, 'min_samples_split': 14, 'min_samples_leaf': 3, 'max_features': 'sqrt', 'criterion': 'squared_error', 'splitter': 'best'}. Best is trial 45 with value: 0.5614145525970277.
[I 2024-12-04 11:52:26,937] Trial 120 finished with value: 1.178900128803194 and parameters: {'max_depth': 28, 'min_samples_split': 9, 'min_samples_leaf': 2, 'max_features': 'log2', 'criterion': 'squared_error', 'splitter': 'random'}. Best is trial 45 with value: 0.5614145525970277.
[I 2024-12-04 11:52:28,138] Trial 106 finished with value: 0.6240972367667716 and parameters: {'max_depth': 15, 'min_samples_split': 16, 'min_samples_leaf': 1, 'max_features': 'sqrt', 'criterion': 'friedman_mse', 'splitter': 'best'}. Best is trial 45 with value: 0.5614145525970277.
[I 2024-12-04 11:52:28,143] Trial 127 finished with value: 1.0746652081803512 and parameters: {'max_depth': 23, 'min_samples_split': 20, 'min_samples_leaf': 3, 'max_features': 'sqrt', 'criterion': 'friedman_mse', 'splitter': 'best'}. Best is trial 45 with value: 0.5614145525970277.
[I 2024-12-04 11:52:28,543] Trial 130 finished with value: 0.5945975836542683 and parameters: {'max_depth': 31, 'min_samples_split': 20, 'min_samples_leaf': 2, 'max_features': 'sqrt', 'criterion': 'friedman_mse', 'splitter': 'best'}. Best is trial 45 with value: 0.5614145525970277.
[I 2024-12-04 11:52:28,880] Trial 126 finished with value: 0.8335015340366766 and parameters: {'max_depth': 13, 'min_samples_split': 18, 'min_samples_leaf': 1, 'max_features': 'log2', 'criterion': 'friedman_mse', 'splitter': 'best'}. Best is trial 45 with value: 0.5614145525970277.
[I 2024-12-04 11:52:28,883] Trial 103 finished with value: 0.5728219443191909 and parameters: {'max_depth': 20, 'min_samples_split': 18, 'min_samples_leaf': 2, 'max_features': 'sqrt', 'criterion': 'friedman_mse', 'splitter': 'best'}. Best is trial 45 with value: 0.5614145525970277.
[I 2024-12-04 11:52:28,888] Trial 125 finished with value: 1.261454797635251 and parameters: {'max_depth': 29, 'min_samples_split': 15, 'min_samples_leaf': 6, 'max_features': 'log2', 'criterion': 'friedman_mse', 'splitter': 'best'}. Best is trial 45 with value: 0.5614145525970277.
[I 2024-12-04 11:52:28,990] Trial 131 finished with value: 0.6018378780540037 and parameters: {'max_depth': 23, 'min_samples_split': 17, 'min_samples_leaf': 1, 'max_features': 'sqrt', 'criterion': 'friedman_mse', 'splitter': 'best'}. Best is trial 45 with value: 0.5614145525970277.
[I 2024-12-04 11:52:29,129] Trial 118 finished with value: 0.7766300838520145 and parameters: {'max_depth': 15, 'min_samples_split': 18, 'min_samples_leaf': 1, 'max_features': 'log2', 'criterion': 'absolute_error', 'splitter': 'best'}. Best is trial 45 with value: 0.5614145525970277.
[I 2024-12-04 11:52:29,228] Trial 113 finished with value: 0.5700768096345179 and parameters: {'max_depth': 21, 'min_samples_split': 19, 'min_samples_leaf': 2, 'max_features': 'sqrt', 'criterion': 'friedman_mse', 'splitter': 'best'}. Best is trial 45 with value: 0.5614145525970277.
[I 2024-12-04 11:52:29,327] Trial 129 finished with value: 0.5872829663730713 and parameters: {'max_depth': 19, 'min_samples_split': 20, 'min_samples_leaf': 1, 'max_features': 'sqrt', 'criterion': 'friedman_mse', 'splitter': 'best'}. Best is trial 45 with value: 0.5614145525970277.
[I 2024-12-04 11:52:29,627] Trial 128 finished with value: 1.261454797635251 and parameters: {'max_depth': 22, 'min_samples_split': 19, 'min_samples_leaf': 6, 'max_features': 'log2', 'criterion': 'friedman_mse', 'splitter': 'best'}. Best is trial 45 with value: 0.5614145525970277.
[I 2024-12-04 11:52:29,834] Trial 132 finished with value: 1.0851830363303951 and parameters: {'max_depth': 10, 'min_samples_split': 17, 'min_samples_leaf': 9, 'max_features': 'sqrt', 'criterion': 'friedman_mse', 'splitter': 'best'}. Best is trial 45 with value: 0.5614145525970277.
[I 2024-12-04 11:52:29,867] Trial 119 finished with value: 0.5803899068012356 and parameters: {'max_depth': 27, 'min_samples_split': 19, 'min_samples_leaf': 1, 'max_features': 'sqrt', 'criterion': 'friedman_mse', 'splitter': 'best'}. Best is trial 45 with value: 0.5614145525970277.
[I 2024-12-04 11:52:30,786] Trial 124 finished with value: 1.0733356440450181 and parameters: {'max_depth': 21, 'min_samples_split': 8, 'min_samples_leaf': 3, 'max_features': 'sqrt', 'criterion': 'squared_error', 'splitter': 'best'}. Best is trial 45 with value: 0.5614145525970277.
[I 2024-12-04 11:52:31,813] Trial 123 finished with value: 0.580478465170906 and parameters: {'max_depth': 17, 'min_samples_split': 17, 'min_samples_leaf': 1, 'max_features': 'sqrt', 'criterion': 'friedman_mse', 'splitter': 'best'}. Best is trial 45 with value: 0.5614145525970277.
[I 2024-12-04 11:52:32,298] Trial 122 finished with value: 1.0855266432011492 and parameters: {'max_depth': 6, 'min_samples_split': 6, 'min_samples_leaf': 8, 'max_features': 'sqrt', 'criterion': 'friedman_mse', 'splitter': 'best'}. Best is trial 45 with value: 0.5614145525970277.
[I 2024-12-04 11:52:32,601] Trial 134 finished with value: 0.5715320714451931 and parameters: {'max_depth': 31, 'min_samples_split': 15, 'min_samples_leaf': 1, 'max_features': 'sqrt', 'criterion': 'squared_error', 'splitter': 'best'}. Best is trial 45 with value: 0.5614145525970277.
[I 2024-12-04 11:52:32,772] Trial 136 finished with value: 0.5795289611129476 and parameters: {'max_depth': 35, 'min_samples_split': 20, 'min_samples_leaf': 1, 'max_features': 'sqrt', 'criterion': 'friedman_mse', 'splitter': 'best'}. Best is trial 45 with value: 0.5614145525970277.
[I 2024-12-04 11:52:33,096] Trial 139 finished with value: 1.0651561940117558 and parameters: {'max_depth': 15, 'min_samples_split': 19, 'min_samples_leaf': 4, 'max_features': 'sqrt', 'criterion': 'squared_error', 'splitter': 'best'}. Best is trial 45 with value: 0.5614145525970277.
[I 2024-12-04 11:52:33,363] Trial 138 finished with value: 1.261454797635251 and parameters: {'max_depth': 32, 'min_samples_split': 7, 'min_samples_leaf': 10, 'max_features': 'log2', 'criterion': 'friedman_mse', 'splitter': 'best'}. Best is trial 45 with value: 0.5614145525970277.
[I 2024-12-04 11:52:34,727] Trial 135 finished with value: 0.5700768096345179 and parameters: {'max_depth': 21, 'min_samples_split': 18, 'min_samples_leaf': 2, 'max_features': 'sqrt', 'criterion': 'friedman_mse', 'splitter': 'best'}. Best is trial 45 with value: 0.5614145525970277.
[I 2024-12-04 11:52:35,046] Trial 143 finished with value: 1.259809444253076 and parameters: {'max_depth': 12, 'min_samples_split': 8, 'min_samples_leaf': 9, 'max_features': 'sqrt', 'criterion': 'friedman_mse', 'splitter': 'random'}. Best is trial 45 with value: 0.5614145525970277.
[I 2024-12-04 11:52:35,067] Trial 137 finished with value: 1.3737845361400185 and parameters: {'max_depth': 23, 'min_samples_split': 3, 'min_samples_leaf': 8, 'max_features': 'log2', 'criterion': 'absolute_error', 'splitter': 'best'}. Best is trial 45 with value: 0.5614145525970277.
[I 2024-12-04 11:52:35,527] Trial 145 finished with value: 0.5725742884500216 and parameters: {'max_depth': 34, 'min_samples_split': 13, 'min_samples_leaf': 1, 'max_features': 'sqrt', 'criterion': 'squared_error', 'splitter': 'best'}. Best is trial 45 with value: 0.5614145525970277.
[I 2024-12-04 11:52:37,224] Trial 156 finished with value: 0.590403219918811 and parameters: {'max_depth': 35, 'min_samples_split': 14, 'min_samples_leaf': 1, 'max_features': 'sqrt', 'criterion': 'squared_error', 'splitter': 'best'}. Best is trial 45 with value: 0.5614145525970277.
[I 2024-12-04 11:52:37,849] Trial 142 finished with value: 1.3737845361400185 and parameters: {'max_depth': 30, 'min_samples_split': 4, 'min_samples_leaf': 6, 'max_features': 'log2', 'criterion': 'absolute_error', 'splitter': 'random'}. Best is trial 45 with value: 0.5614145525970277.
[I 2024-12-04 11:52:37,983] Trial 121 finished with value: 0.5951824649333685 and parameters: {'max_depth': 30, 'min_samples_split': 17, 'min_samples_leaf': 1, 'max_features': 'sqrt', 'criterion': 'squared_error', 'splitter': 'best'}. Best is trial 45 with value: 0.5614145525970277.
[I 2024-12-04 11:52:38,048] Trial 149 finished with value: 0.8867397933295706 and parameters: {'max_depth': 28, 'min_samples_split': 10, 'min_samples_leaf': 1, 'max_features': 'sqrt', 'criterion': 'squared_error', 'splitter': 'best'}. Best is trial 45 with value: 0.5614145525970277.
[I 2024-12-04 11:52:38,196] Trial 140 finished with value: 0.598979975344431 and parameters: {'max_depth': 31, 'min_samples_split': 13, 'min_samples_leaf': 1, 'max_features': 'sqrt', 'criterion': 'squared_error', 'splitter': 'best'}. Best is trial 45 with value: 0.5614145525970277.
[I 2024-12-04 11:52:38,342] Trial 144 finished with value: 1.2559430945799082 and parameters: {'max_depth': 12, 'min_samples_split': 7, 'min_samples_leaf': 3, 'max_features': 'log2', 'criterion': 'friedman_mse', 'splitter': 'random'}. Best is trial 45 with value: 0.5614145525970277.
[I 2024-12-04 11:52:38,344] Trial 133 finished with value: 1.0651561940117558 and parameters: {'max_depth': 19, 'min_samples_split': 15, 'min_samples_leaf': 4, 'max_features': 'sqrt', 'criterion': 'friedman_mse', 'splitter': 'best'}. Best is trial 45 with value: 0.5614145525970277.
[I 2024-12-04 11:52:38,434] Trial 158 finished with value: 1.0746652081803512 and parameters: {'max_depth': 24, 'min_samples_split': 16, 'min_samples_leaf': 3, 'max_features': 'sqrt', 'criterion': 'friedman_mse', 'splitter': 'best'}. Best is trial 45 with value: 0.5614145525970277.
[I 2024-12-04 11:52:39,017] Trial 147 finished with value: 1.261454797635251 and parameters: {'max_depth': 20, 'min_samples_split': 20, 'min_samples_leaf': 9, 'max_features': 'log2', 'criterion': 'squared_error', 'splitter': 'best'}. Best is trial 45 with value: 0.5614145525970277.
[I 2024-12-04 11:52:39,018] Trial 150 finished with value: 0.9424778759919019 and parameters: {'max_depth': 34, 'min_samples_split': 17, 'min_samples_leaf': 2, 'max_features': 'log2', 'criterion': 'friedman_mse', 'splitter': 'best'}. Best is trial 45 with value: 0.5614145525970277.
[I 2024-12-04 11:52:39,632] Trial 148 finished with value: 1.0651561940117558 and parameters: {'max_depth': 21, 'min_samples_split': 14, 'min_samples_leaf': 4, 'max_features': 'sqrt', 'criterion': 'squared_error', 'splitter': 'best'}. Best is trial 45 with value: 0.5614145525970277.
[I 2024-12-04 11:52:39,657] Trial 160 finished with value: 0.8930825147909659 and parameters: {'max_depth': 30, 'min_samples_split': 20, 'min_samples_leaf': 1, 'max_features': 'sqrt', 'criterion': 'squared_error', 'splitter': 'random'}. Best is trial 45 with value: 0.5614145525970277.
[I 2024-12-04 11:52:40,135] Trial 157 finished with value: 1.0746652081803512 and parameters: {'max_depth': 26, 'min_samples_split': 19, 'min_samples_leaf': 3, 'max_features': 'sqrt', 'criterion': 'friedman_mse', 'splitter': 'best'}. Best is trial 45 with value: 0.5614145525970277.
[I 2024-12-04 11:52:40,606] Trial 162 finished with value: 0.5614145525970277 and parameters: {'max_depth': 32, 'min_samples_split': 16, 'min_samples_leaf': 1, 'max_features': 'sqrt', 'criterion': 'squared_error', 'splitter': 'best'}. Best is trial 45 with value: 0.5614145525970277.
