[I 2024-12-04 21:16:21,144] Trial 2125 finished with value: 0.14249505404857976 and parameters: {'kernel_type': 'Matern', 'length_scale': 14.480422187943416, 'noise_level': 0.568975770381781, 'constant_value': 1.6975640938436818, 'nu': 1.5}. Best is trial 959 with value: 0.1375110730946576.
[I 2024-12-04 21:16:24,809] Trial 2127 finished with value: 0.9864686819165996 and parameters: {'kernel_type': 'Matern', 'length_scale': 0.0016241230575721314, 'noise_level': 0.7576865614796705, 'constant_value': 361.3653067759817, 'nu': 1.5}. Best is trial 959 with value: 0.1375110730946576.
[I 2024-12-04 21:16:25,605] Trial 2126 finished with value: 0.14249496086016059 and parameters: {'kernel_type': 'Matern', 'length_scale': 1821.7208230199587, 'noise_level': 0.04962597730285985, 'constant_value': 15.556103923069223, 'nu': 1.5}. Best is trial 959 with value: 0.1375110730946576.
[I 2024-12-04 21:16:29,780] Trial 2130 finished with value: 0.9982171067029002 and parameters: {'kernel_type': 'RBF', 'length_scale': 0.9611933964161029, 'noise_level': 6.228738843310669e-07, 'constant_value': 96.05187855896926, 'nu': 2.5}. Best is trial 959 with value: 0.1375110730946576.
[I 2024-12-04 21:16:32,958] Trial 2129 finished with value: 0.14249492399876446 and parameters: {'kernel_type': 'Matern', 'length_scale': 3.905897715109819, 'noise_level': 0.03891335454660131, 'constant_value': 14.02160097538779, 'nu': 1.5}. Best is trial 959 with value: 0.1375110730946576.
[I 2024-12-04 21:16:34,778] Trial 2128 finished with value: 0.1424950479071981 and parameters: {'kernel_type': 'Matern', 'length_scale': 2088.626875191134, 'noise_level': 0.8881679688359392, 'constant_value': 0.10279211893708659, 'nu': 1.5}. Best is trial 959 with value: 0.1375110730946576.
[I 2024-12-04 21:16:39,695] Trial 2131 finished with value: 0.9864686819232303 and parameters: {'kernel_type': 'RBF', 'length_scale': 2974.0924327611247, 'noise_level': 1.0667010457159571e-07, 'constant_value': 0.009964240640261073, 'nu': 1.5}. Best is trial 959 with value: 0.1375110730946576.
[I 2024-12-04 21:16:40,240] Trial 2132 finished with value: 0.1424950694409658 and parameters: {'kernel_type': 'Matern', 'length_scale': 4.281667969763919, 'noise_level': 0.0445206287309749, 'constant_value': 583.6915635822775, 'nu': 1.5}. Best is trial 959 with value: 0.1375110730946576.
[I 2024-12-04 21:16:42,249] Trial 2133 finished with value: 0.14249517664652578 and parameters: {'kernel_type': 'Matern', 'length_scale': 0.9950479844947848, 'noise_level': 0.9852819986997946, 'constant_value': 1.8384857631963083, 'nu': 1.5}. Best is trial 959 with value: 0.1375110730946576.
[I 2024-12-04 21:16:44,940] Trial 2134 finished with value: 0.9864686819283277 and parameters: {'kernel_type': 'Matern', 'length_scale': 0.05337620641703116, 'noise_level': 0.06727639758323205, 'constant_value': 16236.674604754851, 'nu': 1.5}. Best is trial 959 with value: 0.1375110730946576.
[I 2024-12-04 21:16:49,118] Trial 2136 finished with value: 0.19720003536713032 and parameters: {'kernel_type': 'Matern', 'length_scale': 2.1246006648304725, 'noise_level': 0.04139731633721387, 'constant_value': 0.20886435488723024, 'nu': 0.5}. Best is trial 959 with value: 0.1375110730946576.
[I 2024-12-04 21:16:52,852] Trial 2137 finished with value: 0.9864686819090067 and parameters: {'kernel_type': 'Matern', 'length_scale': 633.6770852256016, 'noise_level': 0.020395713457971476, 'constant_value': 36.18070658306169, 'nu': 1.5}. Best is trial 959 with value: 0.1375110730946576.
[I 2024-12-04 21:16:54,149] Trial 2135 finished with value: 0.986468681922572 and parameters: {'kernel_type': 'Matern', 'length_scale': 447.6775967822978, 'noise_level': 0.04671531540914589, 'constant_value': 0.029812183361544904, 'nu': 1.5}. Best is trial 959 with value: 0.1375110730946576.
[I 2024-12-04 21:16:59,883] Trial 2140 finished with value: 0.14249506323808667 and parameters: {'kernel_type': 'Matern', 'length_scale': 195.00879008802258, 'noise_level': 0.05773484282374017, 'constant_value': 121.82517950609012, 'nu': 1.5}. Best is trial 959 with value: 0.1375110730946576.
[I 2024-12-04 21:16:59,990] Trial 2139 finished with value: 0.1424949893007192 and parameters: {'kernel_type': 'Matern', 'length_scale': 15.309209229722743, 'noise_level': 0.024232792555579453, 'constant_value': 26.199379338546684, 'nu': 1.5}. Best is trial 959 with value: 0.1375110730946576.
[I 2024-12-04 21:17:01,850] Trial 2138 finished with value: 0.1477103702232528 and parameters: {'kernel_type': 'RBF', 'length_scale': 0.259958942522523, 'noise_level': 1.7389113876290525e-08, 'constant_value': 9.774326940774378e-07, 'nu': 1.5}. Best is trial 959 with value: 0.1375110730946576.
[I 2024-12-04 21:17:06,689] Trial 2141 finished with value: 0.14249600626668785 and parameters: {'kernel_type': 'Matern', 'length_scale': 2.8342987729114704, 'noise_level': 0.051037782287123586, 'constant_value': 0.8607559110613603, 'nu': 1.5}. Best is trial 959 with value: 0.1375110730946576.
[I 2024-12-04 21:17:07,803] Trial 2142 finished with value: 0.1424950742527806 and parameters: {'kernel_type': 'Matern', 'length_scale': 2.7649283079542233, 'noise_level': 0.024326606762284986, 'constant_value': 0.004582339476835569, 'nu': 1.5}. Best is trial 959 with value: 0.1375110730946576.
[I 2024-12-04 21:17:13,595] Trial 2144 finished with value: 0.9982167338039781 and parameters: {'kernel_type': 'Matern', 'length_scale': 0.006048431452258768, 'noise_level': 9.64811729636473e-06, 'constant_value': 405.79033204744735, 'nu': 0.5}. Best is trial 959 with value: 0.1375110730946576.
[I 2024-12-04 21:17:16,709] Trial 2143 finished with value: 0.14249540282700118 and parameters: {'kernel_type': 'Matern', 'length_scale': 5.392081973948867, 'noise_level': 0.04939601117501069, 'constant_value': 43.70135966121766, 'nu': 1.5}. Best is trial 959 with value: 0.1375110730946576.
[I 2024-12-04 21:17:18,841] Trial 2145 finished with value: 0.1424950972740609 and parameters: {'kernel_type': 'Matern', 'length_scale': 163.70908349927734, 'noise_level': 0.8341598962632853, 'constant_value': 0.1724494047136982, 'nu': 1.5}. Best is trial 959 with value: 0.1375110730946576.
[I 2024-12-04 21:17:20,523] Trial 2146 finished with value: 0.14249509195103144 and parameters: {'kernel_type': 'Matern', 'length_scale': 4.897706023497109, 'noise_level': 0.9857167515872297, 'constant_value': 97.23074041483666, 'nu': 1.5}. Best is trial 959 with value: 0.1375110730946576.
[I 2024-12-04 21:17:25,590] Trial 2148 finished with value: 0.9864686819568658 and parameters: {'kernel_type': 'Matern', 'length_scale': 6.638461639480669, 'noise_level': 0.017052087903390564, 'constant_value': 0.126055380973349, 'nu': 1.5}. Best is trial 959 with value: 0.1375110730946576.
[I 2024-12-04 21:17:25,593] Trial 2147 finished with value: 0.14249487643825312 and parameters: {'kernel_type': 'Matern', 'length_scale': 218.35287560372169, 'noise_level': 0.020792835204714144, 'constant_value': 20.686293086831196, 'nu': 1.5}. Best is trial 959 with value: 0.1375110730946576.
[I 2024-12-04 21:17:28,409] Trial 2149 finished with value: 0.1424950042944955 and parameters: {'kernel_type': 'Matern', 'length_scale': 65.26327848692746, 'noise_level': 0.9209138088183226, 'constant_value': 10.887396581246952, 'nu': 1.5}. Best is trial 959 with value: 0.1375110730946576.
[I 2024-12-04 21:17:30,467] Trial 2151 finished with value: 0.9864683492997456 and parameters: {'kernel_type': 'Matern', 'length_scale': 0.10162620353394046, 'noise_level': 0.03663954791561502, 'constant_value': 5.157550328518232, 'nu': 1.5}. Best is trial 959 with value: 0.1375110730946576.
[I 2024-12-04 21:17:34,920] Trial 2150 finished with value: 0.14249506295073688 and parameters: {'kernel_type': 'Matern', 'length_scale': 19.313810130545207, 'noise_level': 0.03320797615533246, 'constant_value': 1.3382072925761357, 'nu': 1.5}. Best is trial 959 with value: 0.1375110730946576.
[I 2024-12-04 21:17:37,131] Trial 2152 finished with value: 0.9864686819428513 and parameters: {'kernel_type': 'Matern', 'length_scale': 0.03159789624509696, 'noise_level': 0.8565830983982713, 'constant_value': 25.343474969544598, 'nu': 1.5}. Best is trial 959 with value: 0.1375110730946576.
[I 2024-12-04 21:17:40,717] Trial 2153 finished with value: 0.9864686819229563 and parameters: {'kernel_type': 'RBF', 'length_scale': 1.1904685235680215e-05, 'noise_level': 7.370161730037934e-05, 'constant_value': 0.0001302578722710459, 'nu': 0.5}. Best is trial 959 with value: 0.1375110730946576.
[I 2024-12-04 21:17:44,911] Trial 2154 finished with value: 0.14249505993834513 and parameters: {'kernel_type': 'Matern', 'length_scale': 340.64909777056096, 'noise_level': 0.03452248105473394, 'constant_value': 6.336565486271943, 'nu': 1.5}. Best is trial 959 with value: 0.1375110730946576.
[I 2024-12-04 21:17:48,763] Trial 2155 finished with value: 0.14249506650473015 and parameters: {'kernel_type': 'Matern', 'length_scale': 0.22344707500973338, 'noise_level': 0.03881229319471483, 'constant_value': 354.62957841665394, 'nu': 1.5}. Best is trial 959 with value: 0.1375110730946576.
[I 2024-12-04 21:17:51,683] Trial 2156 finished with value: 0.14249496165310616 and parameters: {'kernel_type': 'Matern', 'length_scale': 0.1299732303144037, 'noise_level': 0.9191756952328889, 'constant_value': 19012.258758280812, 'nu': 1.5}. Best is trial 959 with value: 0.1375110730946576.
[I 2024-12-04 21:17:52,689] Trial 2157 finished with value: 0.14249513861052662 and parameters: {'kernel_type': 'Matern', 'length_scale': 326.6814197542825, 'noise_level': 0.6607269372992346, 'constant_value': 4.780690854533061, 'nu': 1.5}. Best is trial 959 with value: 0.1375110730946576.
[I 2024-12-04 21:17:59,487] Trial 2160 finished with value: 0.14249506560554365 and parameters: {'kernel_type': 'Matern', 'length_scale': 5.034163154434047, 'noise_level': 0.9254197144092577, 'constant_value': 0.15138895352850654, 'nu': 1.5}. Best is trial 959 with value: 0.1375110730946576.
[I 2024-12-04 21:17:59,555] Trial 2159 finished with value: 0.13835946365988008 and parameters: {'kernel_type': 'Matern', 'length_scale': 13.822508256349215, 'noise_level': 0.04198457512024339, 'constant_value': 13.531135663755283, 'nu': 1.5}. Best is trial 959 with value: 0.1375110730946576.
[I 2024-12-04 21:18:02,988] Trial 2158 finished with value: 0.1424953324362443 and parameters: {'kernel_type': 'Matern', 'length_scale': 27.9617615786681, 'noise_level': 0.8048028978755961, 'constant_value': 0.3497876217855055, 'nu': 1.5}. Best is trial 959 with value: 0.1375110730946576.
[I 2024-12-04 21:18:07,530] Trial 2161 finished with value: 0.14249506329555664 and parameters: {'kernel_type': 'Matern', 'length_scale': 3.7256858826698602, 'noise_level': 0.06516420209154632, 'constant_value': 717.0197460768436, 'nu': 1.5}. Best is trial 959 with value: 0.1375110730946576.
[I 2024-12-04 21:18:09,111] Trial 2162 finished with value: 0.9864686819210465 and parameters: {'kernel_type': 'Matern', 'length_scale': 13584.090762556927, 'noise_level': 1.6121313595004995e-10, 'constant_value': 33358.08472721002, 'nu': 1.5}. Best is trial 959 with value: 0.1375110730946576.
[I 2024-12-04 21:18:10,759] Trial 2163 finished with value: 0.14249506296629139 and parameters: {'kernel_type': 'Matern', 'length_scale': 121.59390464105113, 'noise_level': 0.9308130997980718, 'constant_value': 2.4646003974558806, 'nu': 1.5}. Best is trial 959 with value: 0.1375110730946576.
[I 2024-12-04 21:18:15,948] Trial 2164 finished with value: 0.1424950743414334 and parameters: {'kernel_type': 'Matern', 'length_scale': 1.3392773834383724, 'noise_level': 0.947129109196635, 'constant_value': 58.54190676297239, 'nu': 1.5}. Best is trial 959 with value: 0.1375110730946576.
[I 2024-12-04 21:18:16,507] Trial 2165 finished with value: 0.14249520839435154 and parameters: {'kernel_type': 'Matern', 'length_scale': 62.11963716484613, 'noise_level': 0.7704704893762083, 'constant_value': 2988.186861732535, 'nu': 1.5}. Best is trial 959 with value: 0.1375110730946576.
[I 2024-12-04 21:18:19,124] Trial 2166 finished with value: 0.9864686818924588 and parameters: {'kernel_type': 'Matern', 'length_scale': 361.52158592393084, 'noise_level': 0.002281632476994429, 'constant_value': 0.06977173487770835, 'nu': 1.5}. Best is trial 959 with value: 0.1375110730946576.
[I 2024-12-04 21:18:24,069] Trial 2167 finished with value: 0.1424950083802656 and parameters: {'kernel_type': 'Matern', 'length_scale': 4.2826330200387845, 'noise_level': 0.03755908034599845, 'constant_value': 4.052780399777086, 'nu': 1.5}. Best is trial 959 with value: 0.1375110730946576.
[I 2024-12-04 21:18:24,430] Trial 2168 finished with value: 0.1424950662616844 and parameters: {'kernel_type': 'Matern', 'length_scale': 0.9925109671027403, 'noise_level': 0.05955399616167685, 'constant_value': 279.652821095479, 'nu': 1.5}. Best is trial 959 with value: 0.1375110730946576.
[I 2024-12-04 21:18:26,140] Trial 2169 finished with value: 0.1424950363860024 and parameters: {'kernel_type': 'Matern', 'length_scale': 16.75459658496813, 'noise_level': 0.9857425268323486, 'constant_value': 1395.6103108904026, 'nu': 1.5}. Best is trial 959 with value: 0.1375110730946576.
[I 2024-12-04 21:18:31,061] Trial 2171 finished with value: 0.14249506253881097 and parameters: {'kernel_type': 'Matern', 'length_scale': 85.1299299613957, 'noise_level': 0.6988428759610138, 'constant_value': 473.71609214486267, 'nu': 1.5}. Best is trial 959 with value: 0.1375110730946576.
[I 2024-12-04 21:18:31,141] Trial 2170 finished with value: 0.14249506195555367 and parameters: {'kernel_type': 'Matern', 'length_scale': 72.39665382251638, 'noise_level': 0.03179531295990416, 'constant_value': 1.695109966025811, 'nu': 1.5}. Best is trial 959 with value: 0.1375110730946576.
[I 2024-12-04 21:18:34,039] Trial 2172 finished with value: 0.14249469807990947 and parameters: {'kernel_type': 'Matern', 'length_scale': 411.62874257329423, 'noise_level': 0.9545762373314509, 'constant_value': 12.293374122387668, 'nu': 1.5}. Best is trial 959 with value: 0.1375110730946576.
[I 2024-12-04 21:18:37,892] Trial 2173 finished with value: 0.14249498278845363 and parameters: {'kernel_type': 'Matern', 'length_scale': 20.276331304031356, 'noise_level': 0.04569138462608442, 'constant_value': 124.61885965226246, 'nu': 1.5}. Best is trial 959 with value: 0.1375110730946576.
[I 2024-12-04 21:18:40,259] Trial 2174 finished with value: 0.9864686818799405 and parameters: {'kernel_type': 'Matern', 'length_scale': 21737.57156951257, 'noise_level': 0.006767749918312422, 'constant_value': 2.272856128274784, 'nu': 1.5}. Best is trial 959 with value: 0.1375110730946576.
[I 2024-12-04 21:18:41,647] Trial 2175 finished with value: 0.1424950692646799 and parameters: {'kernel_type': 'Matern', 'length_scale': 5.372454250914414, 'noise_level': 0.8297347961486523, 'constant_value': 0.35882838031426734, 'nu': 1.5}. Best is trial 959 with value: 0.1375110730946576.
[I 2024-12-04 21:18:46,557] Trial 2176 finished with value: 0.9864686819246467 and parameters: {'kernel_type': 'RBF', 'length_scale': 6001.377132071093, 'noise_level': 2.161996132536249e-10, 'constant_value': 46.8904499476087, 'nu': 1.5}. Best is trial 959 with value: 0.1375110730946576.
[I 2024-12-04 21:18:48,102] Trial 2177 finished with value: 0.13902197331861155 and parameters: {'kernel_type': 'Matern', 'length_scale': 0.7996461385356992, 'noise_level': 0.020853081820366923, 'constant_value': 5.848873156914773, 'nu': 1.5}. Best is trial 959 with value: 0.1375110730946576.
[I 2024-12-04 21:18:48,959] Trial 2178 finished with value: 0.1424953267742012 and parameters: {'kernel_type': 'Matern', 'length_scale': 85.73163248967953, 'noise_level': 0.9401815385148263, 'constant_value': 723.536253692992, 'nu': 1.5}. Best is trial 959 with value: 0.1375110730946576.
[I 2024-12-04 21:18:54,450] Trial 2179 finished with value: 0.14249506342854515 and parameters: {'kernel_type': 'Matern', 'length_scale': 6.291196785745298, 'noise_level': 0.9363706725598373, 'constant_value': 7.120090826224653, 'nu': 1.5}. Best is trial 959 with value: 0.1375110730946576.
[I 2024-12-04 21:18:54,802] Trial 2181 finished with value: 0.9864686778607396 and parameters: {'kernel_type': 'Matern', 'length_scale': 5.012260899995183, 'noise_level': 0.022095936898310523, 'constant_value': 0.058594898912094184, 'nu': 1.5}. Best is trial 959 with value: 0.1375110730946576.
[I 2024-12-04 21:18:57,146] Trial 2180 finished with value: 0.14249507145865153 and parameters: {'kernel_type': 'Matern', 'length_scale': 0.6348128587300138, 'noise_level': 0.9661264272155767, 'constant_value': 2.168488573523921, 'nu': 1.5}. Best is trial 959 with value: 0.1375110730946576.
[I 2024-12-04 21:19:01,977] Trial 2182 finished with value: 0.9864686819224274 and parameters: {'kernel_type': 'Matern', 'length_scale': 1595.38028484898, 'noise_level': 0.001868844333350103, 'constant_value': 6.604863478397585, 'nu': 1.5}. Best is trial 959 with value: 0.1375110730946576.
[I 2024-12-04 21:19:03,523] Trial 2184 finished with value: 0.9982171015408391 and parameters: {'kernel_type': 'Matern', 'length_scale': 5383.641334421478, 'noise_level': 0.4994255732652199, 'constant_value': 0.049127736767389595, 'nu': 1.5}. Best is trial 959 with value: 0.1375110730946576.
[I 2024-12-04 21:19:03,609] Trial 2183 finished with value: 0.9864686819299942 and parameters: {'kernel_type': 'Matern', 'length_scale': 650.4712906467302, 'noise_level': 0.027776261951769916, 'constant_value': 0.4210093782324273, 'nu': 1.5}. Best is trial 959 with value: 0.1375110730946576.
[I 2024-12-04 21:19:10,356] Trial 2185 finished with value: 0.9864686819109176 and parameters: {'kernel_type': 'RBF', 'length_scale': 0.11659122964739597, 'noise_level': 0.003725134311429256, 'constant_value': 461.1508478545633, 'nu': 2.5}. Best is trial 959 with value: 0.1375110730946576.
[I 2024-12-04 21:19:14,304] Trial 2187 finished with value: 0.14249506283689506 and parameters: {'kernel_type': 'Matern', 'length_scale': 126.84448014695595, 'noise_level': 0.9592654948003252, 'constant_value': 0.5000384353804305, 'nu': 1.5}. Best is trial 959 with value: 0.1375110730946576.
[I 2024-12-04 21:19:15,147] Trial 2188 finished with value: 0.1477103681960627 and parameters: {'kernel_type': 'RBF', 'length_scale': 19.56548224291238, 'noise_level': 0.0740354315505152, 'constant_value': 185.97494258036235, 'nu': 1.5}. Best is trial 959 with value: 0.1375110730946576.
[I 2024-12-04 21:19:16,585] Trial 2186 finished with value: 0.9864686819320752 and parameters: {'kernel_type': 'RBF', 'length_scale': 59602.99260883464, 'noise_level': 1.1392036060361701e-07, 'constant_value': 0.0017759594457791422, 'nu': 2.5}. Best is trial 959 with value: 0.1375110730946576.
[I 2024-12-04 21:19:21,380] Trial 2190 finished with value: 0.1424950891735759 and parameters: {'kernel_type': 'Matern', 'length_scale': 1890.4242804866935, 'noise_level': 0.8713743240075419, 'constant_value': 364.6941239638559, 'nu': 1.5}. Best is trial 959 with value: 0.1375110730946576.
[I 2024-12-04 21:19:23,648] Trial 2191 finished with value: 0.1424951866433833 and parameters: {'kernel_type': 'Matern', 'length_scale': 0.5452979860226089, 'noise_level': 0.03243541701306636, 'constant_value': 672.1469091199647, 'nu': 1.5}. Best is trial 959 with value: 0.1375110730946576.
[I 2024-12-04 21:19:24,459] Trial 2189 finished with value: 0.14249504094485504 and parameters: {'kernel_type': 'Matern', 'length_scale': 0.2897836669789964, 'noise_level': 0.9547275814724449, 'constant_value': 0.01268676530321727, 'nu': 1.5}. Best is trial 959 with value: 0.1375110730946576.
[I 2024-12-04 21:19:30,116] Trial 2193 finished with value: 0.14249507262994277 and parameters: {'kernel_type': 'Matern', 'length_scale': 158.28109119185265, 'noise_level': 0.014944182517908688, 'constant_value': 49.633263992644466, 'nu': 1.5}. Best is trial 959 with value: 0.1375110730946576.
[I 2024-12-04 21:19:31,989] Trial 2192 finished with value: 0.14249509801361973 and parameters: {'kernel_type': 'Matern', 'length_scale': 14.774532338820718, 'noise_level': 0.0334677064231482, 'constant_value': 19.235743516057305, 'nu': 1.5}. Best is trial 959 with value: 0.1375110730946576.
[I 2024-12-04 21:19:32,698] Trial 2194 finished with value: 0.14249508410422473 and parameters: {'kernel_type': 'Matern', 'length_scale': 6.674854193824469, 'noise_level': 0.867098913581866, 'constant_value': 7.906771276748883, 'nu': 1.5}. Best is trial 959 with value: 0.1375110730946576.
[I 2024-12-04 21:19:35,746] Trial 2195 finished with value: 0.9864686820612778 and parameters: {'kernel_type': 'Matern', 'length_scale': 0.03267383848878862, 'noise_level': 0.07858969942054825, 'constant_value': 438.14857497674, 'nu': 1.5}. Best is trial 959 with value: 0.1375110730946576.
[I 2024-12-04 21:19:39,876] Trial 2196 finished with value: 0.14249508568230204 and parameters: {'kernel_type': 'Matern', 'length_scale': 7519.759362858354, 'noise_level': 0.05590047258455286, 'constant_value': 86.82023551922988, 'nu': 1.5}. Best is trial 959 with value: 0.1375110730946576.
[I 2024-12-04 21:19:39,881] Trial 2197 finished with value: 0.9864686820119821 and parameters: {'kernel_type': 'Matern', 'length_scale': 56.16869576181163, 'noise_level': 0.001139982750189968, 'constant_value': 0.6732124317978163, 'nu': 1.5}. Best is trial 959 with value: 0.1375110730946576.
[I 2024-12-04 21:19:45,539] Trial 2199 finished with value: 0.9864686819224319 and parameters: {'kernel_type': 'Matern', 'length_scale': 0.007107867872787864, 'noise_level': 2.574771587453596e-06, 'constant_value': 3.742004654660335e-05, 'nu': 1.5}. Best is trial 959 with value: 0.1375110730946576.
[I 2024-12-04 21:19:45,547] Trial 2200 finished with value: 0.986468680713098 and parameters: {'kernel_type': 'Matern', 'length_scale': 0.004007747664034063, 'noise_level': 0.343036678603771, 'constant_value': 4.364822547234613, 'nu': 0.5}. Best is trial 959 with value: 0.1375110730946576.
