[I 2024-12-04 14:59:56,929] Trial 522 finished with value: 0.5663936915957475 and parameters: {'kernel_type': 'Matern', 'length_scale': 0.7926425494262133, 'noise_level': 0.4404046480572371, 'constant_value': 4576.456422758784, 'nu': 2.5}. Best is trial 386 with value: 0.4872991004520934.
[I 2024-12-04 14:59:57,393] Trial 525 finished with value: 0.4883034267059583 and parameters: {'kernel_type': 'Matern', 'length_scale': 950.2438919978275, 'noise_level': 0.010712648213108805, 'constant_value': 1496.384424117108, 'nu': 0.5}. Best is trial 386 with value: 0.4872991004520934.
[I 2024-12-04 14:59:57,553] Trial 528 finished with value: 0.4883034206987919 and parameters: {'kernel_type': 'Matern', 'length_scale': 0.2806950290523725, 'noise_level': 0.00505687259472871, 'constant_value': 80880.716599853, 'nu': 0.5}. Best is trial 386 with value: 0.4872991004520934.
[I 2024-12-04 14:59:57,582] Trial 526 finished with value: 0.4883034065915015 and parameters: {'kernel_type': 'Matern', 'length_scale': 231.80623752720567, 'noise_level': 0.0003707135610097336, 'constant_value': 24478.919041993726, 'nu': 0.5}. Best is trial 386 with value: 0.4872991004520934.
[I 2024-12-04 14:59:58,108] Trial 519 finished with value: 1.2401112325797585 and parameters: {'kernel_type': 'Matern', 'length_scale': 7.458624380931161, 'noise_level': 0.004991630628040567, 'constant_value': 0.0038457700267500745, 'nu': 0.5}. Best is trial 386 with value: 0.4872991004520934.
[I 2024-12-04 14:59:58,745] Trial 529 finished with value: 0.48830341864336924 and parameters: {'kernel_type': 'Matern', 'length_scale': 793.3739966725901, 'noise_level': 0.16752749025742203, 'constant_value': 75741.86832462111, 'nu': 0.5}. Best is trial 386 with value: 0.4872991004520934.
[I 2024-12-04 14:59:58,920] Trial 532 finished with value: 0.4883033778553542 and parameters: {'kernel_type': 'Matern', 'length_scale': 0.5455105895051423, 'noise_level': 0.030318834349762798, 'constant_value': 0.10078291480965035, 'nu': 0.5}. Best is trial 386 with value: 0.4872991004520934.
[I 2024-12-04 15:00:01,487] Trial 534 finished with value: 1.240111229542743 and parameters: {'kernel_type': 'Matern', 'length_scale': 29.208724514685414, 'noise_level': 0.019074774776250157, 'constant_value': 0.0013421731824689873, 'nu': 0.5}. Best is trial 386 with value: 0.4872991004520934.
[I 2024-12-04 15:00:01,497] Trial 541 finished with value: 1.2614547813071746 and parameters: {'kernel_type': 'Matern', 'length_scale': 29.04766649811315, 'noise_level': 8.647915896102116e-06, 'constant_value': 78012.13289295603, 'nu': 0.5}. Best is trial 386 with value: 0.4872991004520934.
[I 2024-12-04 15:00:02,176] Trial 535 finished with value: 0.48830341517252956 and parameters: {'kernel_type': 'Matern', 'length_scale': 30.496151396973154, 'noise_level': 0.010867634854202805, 'constant_value': 16568.52764458859, 'nu': 0.5}. Best is trial 386 with value: 0.4872991004520934.
[I 2024-12-04 15:00:02,423] Trial 536 finished with value: 0.48830346714744666 and parameters: {'kernel_type': 'Matern', 'length_scale': 12.901617876477117, 'noise_level': 0.0006357879216898416, 'constant_value': 7167.797253111481, 'nu': 0.5}. Best is trial 386 with value: 0.4872991004520934.
[I 2024-12-04 15:00:02,671] Trial 538 finished with value: 0.6443854016904099 and parameters: {'kernel_type': 'RBF', 'length_scale': 1524.905734451325, 'noise_level': 0.2846642084157318, 'constant_value': 682.7718779513737, 'nu': 0.5}. Best is trial 386 with value: 0.4872991004520934.
[I 2024-12-04 15:00:04,410] Trial 533 finished with value: 0.5273053299720102 and parameters: {'kernel_type': 'Matern', 'length_scale': 54704.476463178624, 'noise_level': 0.9497078167057265, 'constant_value': 6191.643806983084, 'nu': 1.5}. Best is trial 386 with value: 0.4872991004520934.
[I 2024-12-04 15:00:05,370] Trial 544 finished with value: 1.2401112326659487 and parameters: {'kernel_type': 'Matern', 'length_scale': 6275.262378838064, 'noise_level': 0.039187969367994215, 'constant_value': 213.96589822331535, 'nu': 2.5}. Best is trial 386 with value: 0.4872991004520934.
[I 2024-12-04 15:00:05,514] Trial 542 finished with value: 1.2401112319567864 and parameters: {'kernel_type': 'RBF', 'length_scale': 297.23875297921666, 'noise_level': 0.004977918471075823, 'constant_value': 26560.95246995082, 'nu': 1.5}. Best is trial 386 with value: 0.4872991004520934.
[I 2024-12-04 15:00:06,071] Trial 531 finished with value: 0.4883034277451965 and parameters: {'kernel_type': 'Matern', 'length_scale': 6.104170767011371, 'noise_level': 0.0006929097903680244, 'constant_value': 31162.629457498195, 'nu': 0.5}. Best is trial 386 with value: 0.4872991004520934.
[I 2024-12-04 15:00:07,238] Trial 543 finished with value: 0.4883034389395928 and parameters: {'kernel_type': 'Matern', 'length_scale': 849.097594630408, 'noise_level': 0.12244084826711467, 'constant_value': 74552.54240896791, 'nu': 0.5}. Best is trial 386 with value: 0.4872991004520934.
[I 2024-12-04 15:00:07,239] Trial 550 finished with value: 0.48830341779890696 and parameters: {'kernel_type': 'Matern', 'length_scale': 95455.474651785, 'noise_level': 0.06582769066894886, 'constant_value': 6065.798232943022, 'nu': 0.5}. Best is trial 386 with value: 0.4872991004520934.
[I 2024-12-04 15:00:08,436] Trial 546 finished with value: 1.2614547951865611 and parameters: {'kernel_type': 'Matern', 'length_scale': 58796.35316551646, 'noise_level': 1.3720372500295775e-06, 'constant_value': 41341.87144904029, 'nu': 0.5}. Best is trial 386 with value: 0.4872991004520934.
[I 2024-12-04 15:00:09,309] Trial 552 finished with value: 1.2614544289376608 and parameters: {'kernel_type': 'Matern', 'length_scale': 903.1486238483251, 'noise_level': 0.74740998294859, 'constant_value': 0.0005751400103263049, 'nu': 0.5}. Best is trial 386 with value: 0.4872991004520934.
[I 2024-12-04 15:00:09,502] Trial 537 finished with value: 1.2401112325303894 and parameters: {'kernel_type': 'RBF', 'length_scale': 24969.518039189345, 'noise_level': 4.059630949143949e-10, 'constant_value': 0.5402118329505733, 'nu': 2.5}. Best is trial 386 with value: 0.4872991004520934.
[I 2024-12-04 15:00:09,562] Trial 540 finished with value: 1.240111232581073 and parameters: {'kernel_type': 'Matern', 'length_scale': 667.7811953675572, 'noise_level': 0.0014195352988148908, 'constant_value': 17951.591086031636, 'nu': 2.5}. Best is trial 386 with value: 0.4872991004520934.
[I 2024-12-04 15:00:10,015] Trial 539 finished with value: 1.2401112325992107 and parameters: {'kernel_type': 'RBF', 'length_scale': 4.159912989950728e-05, 'noise_level': 0.0005431401494791194, 'constant_value': 0.0002582111289564657, 'nu': 2.5}. Best is trial 386 with value: 0.4872991004520934.
[I 2024-12-04 15:00:10,576] Trial 548 finished with value: 0.48830342302586976 and parameters: {'kernel_type': 'Matern', 'length_scale': 11.161291362146635, 'noise_level': 0.005490618842353831, 'constant_value': 0.5568504341161449, 'nu': 0.5}. Best is trial 386 with value: 0.4872991004520934.
[I 2024-12-04 15:00:11,845] Trial 549 finished with value: 0.48830342283817135 and parameters: {'kernel_type': 'Matern', 'length_scale': 450.2211521632951, 'noise_level': 0.48640842564372344, 'constant_value': 0.002127830029855849, 'nu': 0.5}. Best is trial 386 with value: 0.4872991004520934.
[I 2024-12-04 15:00:12,450] Trial 545 finished with value: 0.48830506710042243 and parameters: {'kernel_type': 'Matern', 'length_scale': 26566.059747966512, 'noise_level': 0.9947248869270333, 'constant_value': 195.35546583306487, 'nu': 0.5}. Best is trial 386 with value: 0.4872991004520934.
[I 2024-12-04 15:00:13,333] Trial 554 finished with value: 0.48830788924729823 and parameters: {'kernel_type': 'Matern', 'length_scale': 2693.678568223939, 'noise_level': 0.032835938468248754, 'constant_value': 519.7729758881901, 'nu': 0.5}. Best is trial 386 with value: 0.4872991004520934.
[I 2024-12-04 15:00:15,261] Trial 557 finished with value: 1.261454797635004 and parameters: {'kernel_type': 'Matern', 'length_scale': 19.183633698223062, 'noise_level': 1.7161140923088499e-09, 'constant_value': 37524.66864823283, 'nu': 1.5}. Best is trial 386 with value: 0.4872991004520934.
[I 2024-12-04 15:00:15,270] Trial 553 finished with value: 0.4883034486524197 and parameters: {'kernel_type': 'Matern', 'length_scale': 11885.118861359866, 'noise_level': 0.11930233495045081, 'constant_value': 79479.03298262793, 'nu': 0.5}. Best is trial 386 with value: 0.4872991004520934.
[I 2024-12-04 15:00:15,286] Trial 556 finished with value: 0.6443853431540818 and parameters: {'kernel_type': 'RBF', 'length_scale': 0.38582388375603494, 'noise_level': 0.004538659251736767, 'constant_value': 0.15018743259405895, 'nu': 0.5}. Best is trial 386 with value: 0.4872991004520934.
[I 2024-12-04 15:00:15,617] Trial 559 finished with value: 1.2401112324217491 and parameters: {'kernel_type': 'RBF', 'length_scale': 0.028016957304721386, 'noise_level': 2.7172983722921915e-05, 'constant_value': 0.025857664854505902, 'nu': 1.5}. Best is trial 386 with value: 0.4872991004520934.
[I 2024-12-04 15:00:15,807] Trial 567 finished with value: 1.261424408330573 and parameters: {'kernel_type': 'Matern', 'length_scale': 22.56773455363798, 'noise_level': 0.03755128643848741, 'constant_value': 0.005483204315825507, 'nu': 1.5}. Best is trial 386 with value: 0.4872991004520934.
[I 2024-12-04 15:00:16,134] Trial 551 finished with value: 1.2401112362895939 and parameters: {'kernel_type': 'Matern', 'length_scale': 152.3326588739648, 'noise_level': 4.579617316414356e-10, 'constant_value': 6.687224841122161e-07, 'nu': 0.5}. Best is trial 386 with value: 0.4872991004520934.
[I 2024-12-04 15:00:16,503] Trial 547 finished with value: 0.4883034246117728 and parameters: {'kernel_type': 'Matern', 'length_scale': 894.8232181180881, 'noise_level': 0.0019456743441032382, 'constant_value': 4546.074668944103, 'nu': 0.5}. Best is trial 386 with value: 0.4872991004520934.
[I 2024-12-04 15:00:17,510] Trial 555 finished with value: 1.261454795394147 and parameters: {'kernel_type': 'Matern', 'length_scale': 348.9976260021888, 'noise_level': 0.026817074097578, 'constant_value': 2412.451984639022, 'nu': 0.5}. Best is trial 386 with value: 0.4872991004520934.
[I 2024-12-04 15:00:18,392] Trial 562 finished with value: 1.2401112325602033 and parameters: {'kernel_type': 'Matern', 'length_scale': 66.91031040282766, 'noise_level': 5.453533735808769e-07, 'constant_value': 1952.222545928122, 'nu': 2.5}. Best is trial 386 with value: 0.4872991004520934.
[I 2024-12-04 15:00:18,664] Trial 561 finished with value: 0.4883034232615526 and parameters: {'kernel_type': 'Matern', 'length_scale': 1.9807686869525118, 'noise_level': 0.07243947945201423, 'constant_value': 0.05770163759207036, 'nu': 0.5}. Best is trial 386 with value: 0.4872991004520934.
[I 2024-12-04 15:00:18,787] Trial 564 finished with value: 0.4883032065775011 and parameters: {'kernel_type': 'Matern', 'length_scale': 902.2940105877751, 'noise_level': 0.01301426714299081, 'constant_value': 70851.16771167032, 'nu': 0.5}. Best is trial 386 with value: 0.4872991004520934.
[I 2024-12-04 15:00:18,827] Trial 558 finished with value: 1.2401112305237942 and parameters: {'kernel_type': 'Matern', 'length_scale': 68493.23918120681, 'noise_level': 0.001547575862789594, 'constant_value': 323.5708955309416, 'nu': 0.5}. Best is trial 386 with value: 0.4872991004520934.
[I 2024-12-04 15:00:20,867] Trial 569 finished with value: 0.4883034175051664 and parameters: {'kernel_type': 'Matern', 'length_scale': 646.2494548599262, 'noise_level': 0.7473032252151898, 'constant_value': 45558.26999180682, 'nu': 0.5}. Best is trial 386 with value: 0.4872991004520934.
[I 2024-12-04 15:00:21,197] Trial 563 finished with value: 0.5273040892276148 and parameters: {'kernel_type': 'Matern', 'length_scale': 1199.0416898932792, 'noise_level': 0.047078259887222224, 'constant_value': 31961.470996611257, 'nu': 1.5}. Best is trial 386 with value: 0.4872991004520934.
[I 2024-12-04 15:00:21,198] Trial 566 finished with value: 0.4883034182134086 and parameters: {'kernel_type': 'Matern', 'length_scale': 16562.981629386293, 'noise_level': 0.9793423211390213, 'constant_value': 422.21055614348654, 'nu': 0.5}. Best is trial 386 with value: 0.4872991004520934.
[I 2024-12-04 15:00:21,770] Trial 565 finished with value: 0.4883034188453085 and parameters: {'kernel_type': 'Matern', 'length_scale': 5512.837217760588, 'noise_level': 0.05564910760665165, 'constant_value': 434.7661455415663, 'nu': 0.5}. Best is trial 386 with value: 0.4872991004520934.
[I 2024-12-04 15:00:23,667] Trial 577 finished with value: 1.2401112325856873 and parameters: {'kernel_type': 'Matern', 'length_scale': 5.184649517942188e-05, 'noise_level': 0.00037497257034399203, 'constant_value': 0.2552184154925239, 'nu': 2.5}. Best is trial 386 with value: 0.4872991004520934.
[I 2024-12-04 15:00:23,931] Trial 560 finished with value: 0.48830163562800816 and parameters: {'kernel_type': 'Matern', 'length_scale': 53208.49183834997, 'noise_level': 0.4486327375795587, 'constant_value': 1519.0857103579324, 'nu': 0.5}. Best is trial 386 with value: 0.4872991004520934.
[I 2024-12-04 15:00:24,018] Trial 572 finished with value: 0.488303423200736 and parameters: {'kernel_type': 'Matern', 'length_scale': 7.567838611208484, 'noise_level': 0.9092049355168882, 'constant_value': 77987.73199070193, 'nu': 0.5}. Best is trial 386 with value: 0.4872991004520934.
[I 2024-12-04 15:00:25,237] Trial 574 finished with value: 1.2614547953939919 and parameters: {'kernel_type': 'Matern', 'length_scale': 1769.6312363637946, 'noise_level': 0.030920111606472553, 'constant_value': 40783.83554697112, 'nu': 0.5}. Best is trial 386 with value: 0.4872991004520934.
[I 2024-12-04 15:00:25,375] Trial 568 finished with value: 0.4883051752689684 and parameters: {'kernel_type': 'Matern', 'length_scale': 158.04056222184158, 'noise_level': 0.001668540450900044, 'constant_value': 19350.69068688154, 'nu': 0.5}. Best is trial 386 with value: 0.4872991004520934.
[I 2024-12-04 15:00:25,769] Trial 573 finished with value: 0.48830369557567055 and parameters: {'kernel_type': 'Matern', 'length_scale': 2643.197004517739, 'noise_level': 0.0011935527670029033, 'constant_value': 81702.602129651, 'nu': 0.5}. Best is trial 386 with value: 0.4872991004520934.
[I 2024-12-04 15:00:26,797] Trial 571 finished with value: 0.5273054448086941 and parameters: {'kernel_type': 'Matern', 'length_scale': 0.2430593525556228, 'noise_level': 1.532548017887396e-06, 'constant_value': 0.0013265654338268731, 'nu': 1.5}. Best is trial 386 with value: 0.4872991004520934.
[I 2024-12-04 15:00:27,415] Trial 576 finished with value: 1.2401112325811088 and parameters: {'kernel_type': 'RBF', 'length_scale': 1.776658788823743e-05, 'noise_level': 1.164038506110839e-09, 'constant_value': 1.2598864582437131e-05, 'nu': 2.5}. Best is trial 386 with value: 0.4872991004520934.
[I 2024-12-04 15:00:27,728] Trial 579 finished with value: 1.2401112781617007 and parameters: {'kernel_type': 'RBF', 'length_scale': 358.6358389180891, 'noise_level': 2.283709387326105e-08, 'constant_value': 0.01784892629085566, 'nu': 1.5}. Best is trial 386 with value: 0.4872991004520934.
[I 2024-12-04 15:00:27,738] Trial 578 finished with value: 0.48830342280264966 and parameters: {'kernel_type': 'Matern', 'length_scale': 3014.404554468286, 'noise_level': 0.010140785684545708, 'constant_value': 460.90591853602143, 'nu': 0.5}. Best is trial 386 with value: 0.4872991004520934.
[I 2024-12-04 15:00:28,308] Trial 581 finished with value: 0.48830343563049605 and parameters: {'kernel_type': 'Matern', 'length_scale': 20772.24212046788, 'noise_level': 0.501822309644573, 'constant_value': 1554.6096457394653, 'nu': 0.5}. Best is trial 386 with value: 0.4872991004520934.
[I 2024-12-04 15:00:28,925] Trial 575 finished with value: 1.2401112330942339 and parameters: {'kernel_type': 'RBF', 'length_scale': 36.27529102226515, 'noise_level': 3.682706293392218e-09, 'constant_value': 2.372264535035493, 'nu': 0.5}. Best is trial 386 with value: 0.4872991004520934.
[I 2024-12-04 15:00:30,721] Trial 580 finished with value: 0.48830341888276413 and parameters: {'kernel_type': 'Matern', 'length_scale': 56.15766117538211, 'noise_level': 0.0072514849519624645, 'constant_value': 93239.85526762986, 'nu': 0.5}. Best is trial 386 with value: 0.4872991004520934.
[I 2024-12-04 15:00:31,868] Trial 570 finished with value: 0.5663935702375914 and parameters: {'kernel_type': 'Matern', 'length_scale': 1.5046907329963137, 'noise_level': 1.9749202252334257e-06, 'constant_value': 2.6070022991638566e-07, 'nu': 2.5}. Best is trial 386 with value: 0.4872991004520934.
[I 2024-12-04 15:00:32,709] Trial 583 finished with value: 0.48830341403423183 and parameters: {'kernel_type': 'Matern', 'length_scale': 81443.85014713812, 'noise_level': 0.16683035099119872, 'constant_value': 15941.465988213078, 'nu': 0.5}. Best is trial 386 with value: 0.4872991004520934.
[I 2024-12-04 15:00:33,781] Trial 593 finished with value: 0.4883034246400817 and parameters: {'kernel_type': 'Matern', 'length_scale': 37131.20042556649, 'noise_level': 0.37875075444582523, 'constant_value': 274.23287247113666, 'nu': 0.5}. Best is trial 386 with value: 0.4872991004520934.
[I 2024-12-04 15:00:33,782] Trial 594 finished with value: 0.48830342813493494 and parameters: {'kernel_type': 'Matern', 'length_scale': 25413.7285510665, 'noise_level': 0.7820841039060656, 'constant_value': 147.97902699828603, 'nu': 0.5}. Best is trial 386 with value: 0.4872991004520934.
[I 2024-12-04 15:00:34,059] Trial 586 finished with value: 0.6443853739588744 and parameters: {'kernel_type': 'RBF', 'length_scale': 593.6016987342421, 'noise_level': 0.46469758770089414, 'constant_value': 97065.65622851031, 'nu': 0.5}. Best is trial 386 with value: 0.4872991004520934.
[I 2024-12-04 15:00:34,422] Trial 582 finished with value: 1.2401112346987149 and parameters: {'kernel_type': 'Matern', 'length_scale': 3.43914014705861e-05, 'noise_level': 1.7086189826722438e-10, 'constant_value': 0.031720558078424915, 'nu': 1.5}. Best is trial 386 with value: 0.4872991004520934.
[I 2024-12-04 15:00:34,430] Trial 592 finished with value: 0.4883034202898543 and parameters: {'kernel_type': 'Matern', 'length_scale': 16127.608982097514, 'noise_level': 0.6436963959561078, 'constant_value': 53579.22412826807, 'nu': 0.5}. Best is trial 386 with value: 0.4872991004520934.
[I 2024-12-04 15:00:35,169] Trial 584 finished with value: 0.48830340082400825 and parameters: {'kernel_type': 'Matern', 'length_scale': 805.0413450848522, 'noise_level': 0.10702727548900197, 'constant_value': 1249.8286837367277, 'nu': 0.5}. Best is trial 386 with value: 0.4872991004520934.
[I 2024-12-04 15:00:36,073] Trial 588 finished with value: 0.4883033428144182 and parameters: {'kernel_type': 'Matern', 'length_scale': 65503.521948842616, 'noise_level': 0.37290964958800027, 'constant_value': 69424.43826538342, 'nu': 0.5}. Best is trial 386 with value: 0.4872991004520934.
[I 2024-12-04 15:00:36,545] Trial 585 finished with value: 0.48830341844740455 and parameters: {'kernel_type': 'Matern', 'length_scale': 93476.88012220537, 'noise_level': 0.32652433225002686, 'constant_value': 29560.455187335832, 'nu': 0.5}. Best is trial 386 with value: 0.4872991004520934.
[I 2024-12-04 15:00:37,570] Trial 600 finished with value: 1.2614547934773668 and parameters: {'kernel_type': 'Matern', 'length_scale': 96.63739933351212, 'noise_level': 0.00020949080539842244, 'constant_value': 7401.669725097508, 'nu': 0.5}. Best is trial 386 with value: 0.4872991004520934.
[I 2024-12-04 15:00:38,185] Trial 597 finished with value: 1.2614547976265433 and parameters: {'kernel_type': 'Matern', 'length_scale': 2858.3154351679805, 'noise_level': 0.35673808191202094, 'constant_value': 8.01132513173341e-07, 'nu': 1.5}. Best is trial 386 with value: 0.4872991004520934.
[I 2024-12-04 15:00:38,755] Trial 595 finished with value: 1.2614547953941473 and parameters: {'kernel_type': 'Matern', 'length_scale': 85.3166363335221, 'noise_level': 0.04143656725835506, 'constant_value': 4910.484680457762, 'nu': 0.5}. Best is trial 386 with value: 0.4872991004520934.
[I 2024-12-04 15:00:39,551] Trial 591 finished with value: 0.48830342280368827 and parameters: {'kernel_type': 'Matern', 'length_scale': 80755.88143823783, 'noise_level': 0.06517672763592601, 'constant_value': 753.421771135732, 'nu': 0.5}. Best is trial 386 with value: 0.4872991004520934.
[I 2024-12-04 15:00:39,552] Trial 596 finished with value: 0.4883033574805453 and parameters: {'kernel_type': 'Matern', 'length_scale': 0.6263066550015576, 'noise_level': 1.7871859005459855e-10, 'constant_value': 0.004336269719792081, 'nu': 0.5}. Best is trial 386 with value: 0.4872991004520934.
[I 2024-12-04 15:00:39,704] Trial 589 finished with value: 1.2614547827488654 and parameters: {'kernel_type': 'RBF', 'length_scale': 91.1772931735609, 'noise_level': 0.013680100293976299, 'constant_value': 1.060471976540526e-05, 'nu': 1.5}. Best is trial 386 with value: 0.4872991004520934.
[I 2024-12-04 15:00:39,815] Trial 598 finished with value: 0.4883032107625763 and parameters: {'kernel_type': 'Matern', 'length_scale': 13.561220880354007, 'noise_level': 0.0043668749194562565, 'constant_value': 428.96936027755197, 'nu': 0.5}. Best is trial 386 with value: 0.4872991004520934.
[I 2024-12-04 15:00:39,916] Trial 604 finished with value: 0.48830337719138067 and parameters: {'kernel_type': 'Matern', 'length_scale': 133.55508748806554, 'noise_level': 0.6841152435853076, 'constant_value': 41990.98715146961, 'nu': 0.5}. Best is trial 386 with value: 0.4872991004520934.
[I 2024-12-04 15:00:39,917] Trial 590 finished with value: 1.2614547953941473 and parameters: {'kernel_type': 'Matern', 'length_scale': 1379.2408609182864, 'noise_level': 0.024516653235867103, 'constant_value': 87493.88922325273, 'nu': 0.5}. Best is trial 386 with value: 0.4872991004520934.
