[I 2024-12-04 12:38:41,477] Trial 1269 finished with value: 0.3890837955844755 and parameters: {'n_estimators': 1228, 'learning_rate': 0.07237321441672163, 'max_depth': 5, 'min_samples_split': 2, 'min_samples_leaf': 1, 'subsample': 0.7523037041610694, 'max_features': None}. Best is trial 989 with value: 0.3092662874814911.
[I 2024-12-04 12:38:42,639] Trial 1265 finished with value: 0.406571335412014 and parameters: {'n_estimators': 1417, 'learning_rate': 0.09554340794563833, 'max_depth': 5, 'min_samples_split': 4, 'min_samples_leaf': 1, 'subsample': 0.6812496878249996, 'max_features': None}. Best is trial 989 with value: 0.3092662874814911.
[I 2024-12-04 12:38:43,754] Trial 1264 finished with value: 0.38853065876685705 and parameters: {'n_estimators': 1402, 'learning_rate': 0.05639411608411233, 'max_depth': 6, 'min_samples_split': 2, 'min_samples_leaf': 3, 'subsample': 0.6571285558210138, 'max_features': None}. Best is trial 989 with value: 0.3092662874814911.
[I 2024-12-04 12:38:43,904] Trial 1263 finished with value: 0.4020121011960079 and parameters: {'n_estimators': 1490, 'learning_rate': 0.06524619619535128, 'max_depth': 5, 'min_samples_split': 4, 'min_samples_leaf': 3, 'subsample': 0.6184370825319367, 'max_features': None}. Best is trial 989 with value: 0.3092662874814911.
[I 2024-12-04 12:38:44,276] Trial 1277 finished with value: 0.3375851837061482 and parameters: {'n_estimators': 1069, 'learning_rate': 0.09162078217021233, 'max_depth': 5, 'min_samples_split': 6, 'min_samples_leaf': 2, 'subsample': 0.7400746660379416, 'max_features': None}. Best is trial 989 with value: 0.3092662874814911.
[I 2024-12-04 12:38:48,577] Trial 1281 finished with value: 0.3543241448825291 and parameters: {'n_estimators': 984, 'learning_rate': 0.07864407917670496, 'max_depth': 9, 'min_samples_split': 2, 'min_samples_leaf': 1, 'subsample': 0.6854910767204151, 'max_features': None}. Best is trial 989 with value: 0.3092662874814911.
[I 2024-12-04 12:38:49,523] Trial 1282 finished with value: 0.3791072126226184 and parameters: {'n_estimators': 1061, 'learning_rate': 0.042803278699235114, 'max_depth': 7, 'min_samples_split': 5, 'min_samples_leaf': 1, 'subsample': 0.6085682609775741, 'max_features': None}. Best is trial 989 with value: 0.3092662874814911.
[I 2024-12-04 12:38:50,453] Trial 1283 finished with value: 0.36721155148215745 and parameters: {'n_estimators': 1003, 'learning_rate': 0.039683108841867924, 'max_depth': 8, 'min_samples_split': 2, 'min_samples_leaf': 1, 'subsample': 0.6403190496589944, 'max_features': None}. Best is trial 989 with value: 0.3092662874814911.
[I 2024-12-04 12:38:52,104] Trial 1274 finished with value: 0.3185881032316253 and parameters: {'n_estimators': 1414, 'learning_rate': 0.09922525577326965, 'max_depth': 5, 'min_samples_split': 2, 'min_samples_leaf': 2, 'subsample': 0.6627588259842849, 'max_features': None}. Best is trial 989 with value: 0.3092662874814911.
[I 2024-12-04 12:38:54,569] Trial 1278 finished with value: 0.37571471022556235 and parameters: {'n_estimators': 1266, 'learning_rate': 0.09405769119644758, 'max_depth': 7, 'min_samples_split': 6, 'min_samples_leaf': 4, 'subsample': 0.6003507054712919, 'max_features': None}. Best is trial 989 with value: 0.3092662874814911.
[I 2024-12-04 12:38:57,513] Trial 1284 finished with value: 0.39826036889434574 and parameters: {'n_estimators': 1471, 'learning_rate': 0.09280739683042441, 'max_depth': 7, 'min_samples_split': 3, 'min_samples_leaf': 1, 'subsample': 0.6633295415013072, 'max_features': 'log2'}. Best is trial 989 with value: 0.3092662874814911.
[I 2024-12-04 12:38:59,851] Trial 1279 finished with value: 0.369941838608497 and parameters: {'n_estimators': 1432, 'learning_rate': 0.09859970067184418, 'max_depth': 7, 'min_samples_split': 7, 'min_samples_leaf': 4, 'subsample': 0.602418195441224, 'max_features': None}. Best is trial 989 with value: 0.3092662874814911.
[I 2024-12-04 12:39:01,900] Trial 1288 finished with value: 0.862494510777259 and parameters: {'n_estimators': 1255, 'learning_rate': 0.010938819223741118, 'max_depth': 3, 'min_samples_split': 4, 'min_samples_leaf': 8, 'subsample': 0.8601499597382661, 'max_features': 'log2'}. Best is trial 989 with value: 0.3092662874814911.
[I 2024-12-04 12:39:02,207] Trial 1297 finished with value: 0.3607702563323005 and parameters: {'n_estimators': 751, 'learning_rate': 0.08273526220520568, 'max_depth': 9, 'min_samples_split': 2, 'min_samples_leaf': 1, 'subsample': 0.6287088457412315, 'max_features': None}. Best is trial 989 with value: 0.3092662874814911.
[I 2024-12-04 12:39:02,946] Trial 1286 finished with value: 0.3796920614988739 and parameters: {'n_estimators': 1272, 'learning_rate': 0.0604593091547219, 'max_depth': 7, 'min_samples_split': 5, 'min_samples_leaf': 1, 'subsample': 0.684962490155521, 'max_features': None}. Best is trial 989 with value: 0.3092662874814911.
[I 2024-12-04 12:39:05,432] Trial 1293 finished with value: 0.385485433066984 and parameters: {'n_estimators': 937, 'learning_rate': 0.011630247490477879, 'max_depth': 11, 'min_samples_split': 15, 'min_samples_leaf': 5, 'subsample': 0.8790035455609858, 'max_features': None}. Best is trial 989 with value: 0.3092662874814911.
[I 2024-12-04 12:39:06,858] Trial 1287 finished with value: 0.3625807427646761 and parameters: {'n_estimators': 1231, 'learning_rate': 0.09350757690232721, 'max_depth': 7, 'min_samples_split': 10, 'min_samples_leaf': 3, 'subsample': 0.6946646640068206, 'max_features': None}. Best is trial 989 with value: 0.3092662874814911.
[I 2024-12-04 12:39:06,920] Trial 1289 finished with value: 0.3924959382857816 and parameters: {'n_estimators': 1172, 'learning_rate': 0.06675777340315073, 'max_depth': 8, 'min_samples_split': 6, 'min_samples_leaf': 3, 'subsample': 0.6981349156154747, 'max_features': None}. Best is trial 989 with value: 0.3092662874814911.
[I 2024-12-04 12:39:09,512] Trial 1285 finished with value: 0.3333369272824577 and parameters: {'n_estimators': 1466, 'learning_rate': 0.09491176634740042, 'max_depth': 7, 'min_samples_split': 2, 'min_samples_leaf': 2, 'subsample': 0.6660665018639441, 'max_features': None}. Best is trial 989 with value: 0.3092662874814911.
[I 2024-12-04 12:39:10,081] Trial 1291 finished with value: 0.37714387888962775 and parameters: {'n_estimators': 1112, 'learning_rate': 0.09718624621982484, 'max_depth': 7, 'min_samples_split': 4, 'min_samples_leaf': 4, 'subsample': 0.7000248727486947, 'max_features': None}. Best is trial 989 with value: 0.3092662874814911.
[I 2024-12-04 12:39:10,146] Trial 1295 finished with value: 0.3874108039993105 and parameters: {'n_estimators': 1110, 'learning_rate': 0.04108012923805752, 'max_depth': 6, 'min_samples_split': 2, 'min_samples_leaf': 3, 'subsample': 0.6063054964518716, 'max_features': None}. Best is trial 989 with value: 0.3092662874814911.
[I 2024-12-04 12:39:11,740] Trial 1301 finished with value: 0.45606893999222703 and parameters: {'n_estimators': 1091, 'learning_rate': 0.03159403174511369, 'max_depth': 10, 'min_samples_split': 11, 'min_samples_leaf': 6, 'subsample': 0.6022961431366319, 'max_features': 'sqrt'}. Best is trial 989 with value: 0.3092662874814911.
[I 2024-12-04 12:39:12,434] Trial 1290 finished with value: 0.3414856496224639 and parameters: {'n_estimators': 1252, 'learning_rate': 0.09638572994642372, 'max_depth': 9, 'min_samples_split': 9, 'min_samples_leaf': 2, 'subsample': 0.672320831404252, 'max_features': None}. Best is trial 989 with value: 0.3092662874814911.
[I 2024-12-04 12:39:15,302] Trial 1296 finished with value: 0.3667261578044982 and parameters: {'n_estimators': 1102, 'learning_rate': 0.09246291507106288, 'max_depth': 7, 'min_samples_split': 2, 'min_samples_leaf': 1, 'subsample': 0.7507216401330261, 'max_features': None}. Best is trial 989 with value: 0.3092662874814911.
[I 2024-12-04 12:39:17,174] Trial 1304 finished with value: 0.40500896129044744 and parameters: {'n_estimators': 962, 'learning_rate': 0.09633674320471537, 'max_depth': 8, 'min_samples_split': 2, 'min_samples_leaf': 3, 'subsample': 0.693453609008436, 'max_features': None}. Best is trial 989 with value: 0.3092662874814911.
[I 2024-12-04 12:39:19,183] Trial 1294 finished with value: 0.362177720810646 and parameters: {'n_estimators': 1330, 'learning_rate': 0.09415240615666604, 'max_depth': 8, 'min_samples_split': 6, 'min_samples_leaf': 1, 'subsample': 0.709944948336029, 'max_features': None}. Best is trial 989 with value: 0.3092662874814911.
[I 2024-12-04 12:39:21,032] Trial 1303 finished with value: 0.32710403764910506 and parameters: {'n_estimators': 1138, 'learning_rate': 0.07159287991852892, 'max_depth': 7, 'min_samples_split': 2, 'min_samples_leaf': 2, 'subsample': 0.6154528122576797, 'max_features': None}. Best is trial 989 with value: 0.3092662874814911.
[I 2024-12-04 12:39:22,380] Trial 1309 finished with value: 0.34368034592903635 and parameters: {'n_estimators': 999, 'learning_rate': 0.09986500628234742, 'max_depth': 6, 'min_samples_split': 9, 'min_samples_leaf': 2, 'subsample': 0.7163927633657908, 'max_features': None}. Best is trial 989 with value: 0.3092662874814911.
[I 2024-12-04 12:39:23,018] Trial 1314 finished with value: 0.38646737260649267 and parameters: {'n_estimators': 873, 'learning_rate': 0.09923892166738985, 'max_depth': 11, 'min_samples_split': 20, 'min_samples_leaf': 2, 'subsample': 0.8971304205960425, 'max_features': 'log2'}. Best is trial 989 with value: 0.3092662874814911.
[I 2024-12-04 12:39:23,242] Trial 1292 finished with value: 0.3831758435043502 and parameters: {'n_estimators': 1497, 'learning_rate': 0.099588824120196, 'max_depth': 7, 'min_samples_split': 13, 'min_samples_leaf': 6, 'subsample': 0.7717688855367572, 'max_features': None}. Best is trial 989 with value: 0.3092662874814911.
[I 2024-12-04 12:39:23,243] Trial 1302 finished with value: 0.3897428219801257 and parameters: {'n_estimators': 1244, 'learning_rate': 0.08734504020292012, 'max_depth': 6, 'min_samples_split': 2, 'min_samples_leaf': 3, 'subsample': 0.6996189941991785, 'max_features': None}. Best is trial 989 with value: 0.3092662874814911.
[I 2024-12-04 12:39:23,929] Trial 1298 finished with value: 0.3862074435412124 and parameters: {'n_estimators': 1333, 'learning_rate': 0.06906090738885344, 'max_depth': 6, 'min_samples_split': 4, 'min_samples_leaf': 3, 'subsample': 0.7414025697070767, 'max_features': None}. Best is trial 989 with value: 0.3092662874814911.
[I 2024-12-04 12:39:24,132] Trial 1299 finished with value: 0.3329410815248419 and parameters: {'n_estimators': 1304, 'learning_rate': 0.06473659425474342, 'max_depth': 6, 'min_samples_split': 5, 'min_samples_leaf': 2, 'subsample': 0.7476480011083558, 'max_features': None}. Best is trial 989 with value: 0.3092662874814911.
[I 2024-12-04 12:39:24,401] Trial 1310 finished with value: 0.33261078545322875 and parameters: {'n_estimators': 974, 'learning_rate': 0.048814077773630116, 'max_depth': 6, 'min_samples_split': 4, 'min_samples_leaf': 2, 'subsample': 0.6389865970639483, 'max_features': None}. Best is trial 989 with value: 0.3092662874814911.
[I 2024-12-04 12:39:25,867] Trial 1300 finished with value: 0.38775811523617687 and parameters: {'n_estimators': 1342, 'learning_rate': 0.09438425747608163, 'max_depth': 7, 'min_samples_split': 3, 'min_samples_leaf': 3, 'subsample': 0.7458153874133886, 'max_features': None}. Best is trial 989 with value: 0.3092662874814911.
[I 2024-12-04 12:39:26,207] Trial 1328 finished with value: 0.6197012305398402 and parameters: {'n_estimators': 233, 'learning_rate': 0.013983268579441528, 'max_depth': 3, 'min_samples_split': 12, 'min_samples_leaf': 5, 'subsample': 0.9866761669401432, 'max_features': None}. Best is trial 989 with value: 0.3092662874814911.
[I 2024-12-04 12:39:30,582] Trial 1305 finished with value: 0.4019327257312889 and parameters: {'n_estimators': 1281, 'learning_rate': 0.09954046575967887, 'max_depth': 7, 'min_samples_split': 5, 'min_samples_leaf': 3, 'subsample': 0.7195773929688172, 'max_features': None}. Best is trial 989 with value: 0.3092662874814911.
[I 2024-12-04 12:39:31,459] Trial 1306 finished with value: 0.370615491218288 and parameters: {'n_estimators': 1195, 'learning_rate': 0.09477157568768085, 'max_depth': 7, 'min_samples_split': 7, 'min_samples_leaf': 1, 'subsample': 0.6294388606491874, 'max_features': None}. Best is trial 989 with value: 0.3092662874814911.
[I 2024-12-04 12:39:32,942] Trial 1307 finished with value: 0.3335139892660392 and parameters: {'n_estimators': 1238, 'learning_rate': 0.04958772470438071, 'max_depth': 8, 'min_samples_split': 3, 'min_samples_leaf': 2, 'subsample': 0.6061800644097513, 'max_features': None}. Best is trial 989 with value: 0.3092662874814911.
[I 2024-12-04 12:39:33,817] Trial 1319 finished with value: 0.38428876222170305 and parameters: {'n_estimators': 703, 'learning_rate': 0.09849665631198076, 'max_depth': 7, 'min_samples_split': 3, 'min_samples_leaf': 1, 'subsample': 0.6971697202454464, 'max_features': None}. Best is trial 989 with value: 0.3092662874814911.
[I 2024-12-04 12:39:33,821] Trial 1317 finished with value: 0.5769807196679656 and parameters: {'n_estimators': 883, 'learning_rate': 0.07370762826611266, 'max_depth': 6, 'min_samples_split': 13, 'min_samples_leaf': 9, 'subsample': 0.9881747697025528, 'max_features': 'sqrt'}. Best is trial 989 with value: 0.3092662874814911.
[I 2024-12-04 12:39:34,005] Trial 1311 finished with value: 0.39330925210260087 and parameters: {'n_estimators': 1152, 'learning_rate': 0.0977974766009768, 'max_depth': 6, 'min_samples_split': 4, 'min_samples_leaf': 3, 'subsample': 0.6761103619702508, 'max_features': None}. Best is trial 989 with value: 0.3092662874814911.
[I 2024-12-04 12:39:34,576] Trial 1330 finished with value: 0.5401653796562293 and parameters: {'n_estimators': 422, 'learning_rate': 0.01095606141055876, 'max_depth': 4, 'min_samples_split': 18, 'min_samples_leaf': 7, 'subsample': 0.9093325948837396, 'max_features': None}. Best is trial 989 with value: 0.3092662874814911.
[I 2024-12-04 12:39:34,577] Trial 1312 finished with value: 0.33026655402049476 and parameters: {'n_estimators': 1176, 'learning_rate': 0.04606231167959008, 'max_depth': 6, 'min_samples_split': 3, 'min_samples_leaf': 2, 'subsample': 0.6971717071809693, 'max_features': None}. Best is trial 989 with value: 0.3092662874814911.
[I 2024-12-04 12:39:34,582] Trial 1329 finished with value: 0.7641242033288136 and parameters: {'n_estimators': 495, 'learning_rate': 0.019021466394221004, 'max_depth': 7, 'min_samples_split': 19, 'min_samples_leaf': 5, 'subsample': 0.964653419746165, 'max_features': 'log2'}. Best is trial 989 with value: 0.3092662874814911.
[I 2024-12-04 12:39:34,613] Trial 1308 finished with value: 0.3287973665486185 and parameters: {'n_estimators': 1440, 'learning_rate': 0.09618238894510889, 'max_depth': 5, 'min_samples_split': 7, 'min_samples_leaf': 2, 'subsample': 0.7330151152740372, 'max_features': None}. Best is trial 989 with value: 0.3092662874814911.
[I 2024-12-04 12:39:35,400] Trial 1326 finished with value: 0.37595471790111457 and parameters: {'n_estimators': 671, 'learning_rate': 0.05045894248624958, 'max_depth': 4, 'min_samples_split': 4, 'min_samples_leaf': 2, 'subsample': 0.674234432569902, 'max_features': None}. Best is trial 989 with value: 0.3092662874814911.
[I 2024-12-04 12:39:36,948] Trial 1313 finished with value: 0.4012226336649268 and parameters: {'n_estimators': 1413, 'learning_rate': 0.07766720945764867, 'max_depth': 5, 'min_samples_split': 18, 'min_samples_leaf': 1, 'subsample': 0.9635116520842306, 'max_features': 'log2'}. Best is trial 989 with value: 0.3092662874814911.
[I 2024-12-04 12:39:37,230] Trial 1332 finished with value: 0.621059414350943 and parameters: {'n_estimators': 425, 'learning_rate': 0.024941696868547053, 'max_depth': 7, 'min_samples_split': 19, 'min_samples_leaf': 2, 'subsample': 0.7182001158735705, 'max_features': 'log2'}. Best is trial 989 with value: 0.3092662874814911.
[I 2024-12-04 12:39:40,782] Trial 1315 finished with value: 0.3883718753114513 and parameters: {'n_estimators': 1324, 'learning_rate': 0.057312642499599144, 'max_depth': 7, 'min_samples_split': 2, 'min_samples_leaf': 3, 'subsample': 0.6216626055479892, 'max_features': None}. Best is trial 989 with value: 0.3092662874814911.
[I 2024-12-04 12:39:42,872] Trial 1316 finished with value: 0.36878686452165343 and parameters: {'n_estimators': 1253, 'learning_rate': 0.09032157826676811, 'max_depth': 6, 'min_samples_split': 2, 'min_samples_leaf': 1, 'subsample': 0.655713482751878, 'max_features': None}. Best is trial 989 with value: 0.3092662874814911.
[I 2024-12-04 12:39:44,276] Trial 1318 finished with value: 0.3920838857055161 and parameters: {'n_estimators': 1206, 'learning_rate': 0.09688791575380432, 'max_depth': 8, 'min_samples_split': 5, 'min_samples_leaf': 3, 'subsample': 0.6615070466658537, 'max_features': None}. Best is trial 989 with value: 0.3092662874814911.
[I 2024-12-04 12:39:44,381] Trial 1322 finished with value: 0.34863612583674414 and parameters: {'n_estimators': 1081, 'learning_rate': 0.06040353629763513, 'max_depth': 8, 'min_samples_split': 2, 'min_samples_leaf': 1, 'subsample': 0.6258128989577186, 'max_features': None}. Best is trial 989 with value: 0.3092662874814911.
[I 2024-12-04 12:39:46,982] Trial 1339 finished with value: 0.787503616631491 and parameters: {'n_estimators': 388, 'learning_rate': 0.04166719089199398, 'max_depth': 3, 'min_samples_split': 19, 'min_samples_leaf': 7, 'subsample': 0.8358601951567293, 'max_features': 'log2'}. Best is trial 989 with value: 0.3092662874814911.
[I 2024-12-04 12:39:46,983] Trial 1325 finished with value: 0.6019884188956541 and parameters: {'n_estimators': 1376, 'learning_rate': 0.020521953512755806, 'max_depth': 8, 'min_samples_split': 18, 'min_samples_leaf': 10, 'subsample': 0.7632003409041757, 'max_features': 'sqrt'}. Best is trial 989 with value: 0.3092662874814911.
[I 2024-12-04 12:39:46,986] Trial 1320 finished with value: 0.37600832272629575 and parameters: {'n_estimators': 1268, 'learning_rate': 0.09669371707388011, 'max_depth': 5, 'min_samples_split': 2, 'min_samples_leaf': 4, 'subsample': 0.674820658819946, 'max_features': None}. Best is trial 989 with value: 0.3092662874814911.
[I 2024-12-04 12:39:46,993] Trial 1323 finished with value: 0.38924455132486735 and parameters: {'n_estimators': 1243, 'learning_rate': 0.09470412879697424, 'max_depth': 8, 'min_samples_split': 6, 'min_samples_leaf': 3, 'subsample': 0.7210918512024329, 'max_features': None}. Best is trial 989 with value: 0.3092662874814911.
[I 2024-12-04 12:39:47,067] Trial 1335 finished with value: 0.6069531749663847 and parameters: {'n_estimators': 622, 'learning_rate': 0.03794931225580888, 'max_depth': 12, 'min_samples_split': 17, 'min_samples_leaf': 9, 'subsample': 0.7504559033407411, 'max_features': 'sqrt'}. Best is trial 989 with value: 0.3092662874814911.
[I 2024-12-04 12:39:47,371] Trial 1331 finished with value: 0.41213600018752994 and parameters: {'n_estimators': 1075, 'learning_rate': 0.07681527255051172, 'max_depth': 8, 'min_samples_split': 2, 'min_samples_leaf': 1, 'subsample': 0.6741230340179232, 'max_features': 'sqrt'}. Best is trial 989 with value: 0.3092662874814911.
[I 2024-12-04 12:39:47,545] Trial 1324 finished with value: 0.32845497473635227 and parameters: {'n_estimators': 1258, 'learning_rate': 0.09842456306018349, 'max_depth': 7, 'min_samples_split': 4, 'min_samples_leaf': 2, 'subsample': 0.7220797730888692, 'max_features': None}. Best is trial 989 with value: 0.3092662874814911.
[I 2024-12-04 12:39:50,201] Trial 1321 finished with value: 0.3836707177786485 and parameters: {'n_estimators': 1486, 'learning_rate': 0.09788356109431648, 'max_depth': 7, 'min_samples_split': 8, 'min_samples_leaf': 1, 'subsample': 0.6191653701826921, 'max_features': None}. Best is trial 989 with value: 0.3092662874814911.
[I 2024-12-04 12:39:51,299] Trial 1327 finished with value: 0.3975910071132842 and parameters: {'n_estimators': 1493, 'learning_rate': 0.0644930418346523, 'max_depth': 3, 'min_samples_split': 2, 'min_samples_leaf': 5, 'subsample': 0.7031812935042144, 'max_features': None}. Best is trial 989 with value: 0.3092662874814911.
[I 2024-12-04 12:39:55,326] Trial 1336 finished with value: 0.3301398193802574 and parameters: {'n_estimators': 964, 'learning_rate': 0.09546923821750537, 'max_depth': 7, 'min_samples_split': 2, 'min_samples_leaf': 2, 'subsample': 0.6790328415943014, 'max_features': None}. Best is trial 989 with value: 0.3092662874814911.
[I 2024-12-04 12:39:56,542] Trial 1344 finished with value: 0.49706319079175365 and parameters: {'n_estimators': 245, 'learning_rate': 0.08258460113600492, 'max_depth': 4, 'min_samples_split': 20, 'min_samples_leaf': 3, 'subsample': 0.8378039839830411, 'max_features': 'sqrt'}. Best is trial 989 with value: 0.3092662874814911.
[I 2024-12-04 12:39:56,815] Trial 1338 finished with value: 0.7983624584931649 and parameters: {'n_estimators': 1168, 'learning_rate': 0.025216372858046295, 'max_depth': 3, 'min_samples_split': 6, 'min_samples_leaf': 10, 'subsample': 0.9619597332556207, 'max_features': 'log2'}. Best is trial 989 with value: 0.3092662874814911.
[I 2024-12-04 12:39:58,369] Trial 1333 finished with value: 0.37722214552342337 and parameters: {'n_estimators': 1195, 'learning_rate': 0.07725144830551475, 'max_depth': 5, 'min_samples_split': 2, 'min_samples_leaf': 1, 'subsample': 0.6413317456190056, 'max_features': None}. Best is trial 989 with value: 0.3092662874814911.
[I 2024-12-04 12:39:58,669] Trial 1348 finished with value: 0.5961519280495076 and parameters: {'n_estimators': 223, 'learning_rate': 0.025039551413780663, 'max_depth': 4, 'min_samples_split': 7, 'min_samples_leaf': 9, 'subsample': 0.7798615482833673, 'max_features': None}. Best is trial 989 with value: 0.3092662874814911.
