[I 2024-12-04 12:49:59,374] Trial 1807 finished with value: 0.3360937452044064 and parameters: {'n_estimators': 856, 'learning_rate': 0.05904166983079023, 'max_depth': 6, 'min_samples_split': 4, 'min_samples_leaf': 2, 'subsample': 0.6692922294752887, 'max_features': None}. Best is trial 1454 with value: 0.30763307678022894.
[I 2024-12-04 12:50:00,179] Trial 1808 finished with value: 0.4055963933821566 and parameters: {'n_estimators': 892, 'learning_rate': 0.01179463629649329, 'max_depth': 7, 'min_samples_split': 20, 'min_samples_leaf': 5, 'subsample': 0.6318107283396467, 'max_features': None}. Best is trial 1454 with value: 0.30763307678022894.
[I 2024-12-04 12:50:00,192] Trial 1814 finished with value: 0.3941768903816 and parameters: {'n_estimators': 639, 'learning_rate': 0.06046927040858052, 'max_depth': 7, 'min_samples_split': 2, 'min_samples_leaf': 3, 'subsample': 0.641710181434419, 'max_features': None}. Best is trial 1454 with value: 0.30763307678022894.
[I 2024-12-04 12:50:03,820] Trial 1820 finished with value: 0.39062366906502516 and parameters: {'n_estimators': 587, 'learning_rate': 0.09656146138360765, 'max_depth': 8, 'min_samples_split': 5, 'min_samples_leaf': 1, 'subsample': 0.7105901424380106, 'max_features': None}. Best is trial 1454 with value: 0.30763307678022894.
[I 2024-12-04 12:50:06,714] Trial 1812 finished with value: 0.3779654466759937 and parameters: {'n_estimators': 848, 'learning_rate': 0.09505422426357549, 'max_depth': 6, 'min_samples_split': 2, 'min_samples_leaf': 1, 'subsample': 0.684474305147911, 'max_features': None}. Best is trial 1454 with value: 0.30763307678022894.
[I 2024-12-04 12:50:09,467] Trial 1805 finished with value: 0.381610279537107 and parameters: {'n_estimators': 1367, 'learning_rate': 0.03247201250776021, 'max_depth': 6, 'min_samples_split': 2, 'min_samples_leaf': 1, 'subsample': 0.6064786226254792, 'max_features': None}. Best is trial 1454 with value: 0.30763307678022894.
[I 2024-12-04 12:50:10,007] Trial 1822 finished with value: 0.3898471559161816 and parameters: {'n_estimators': 707, 'learning_rate': 0.09543671687212416, 'max_depth': 7, 'min_samples_split': 2, 'min_samples_leaf': 3, 'subsample': 0.7455480900336021, 'max_features': None}. Best is trial 1454 with value: 0.30763307678022894.
[I 2024-12-04 12:50:10,009] Trial 1818 finished with value: 0.6672631283442223 and parameters: {'n_estimators': 1067, 'learning_rate': 0.01460440954767331, 'max_depth': 4, 'min_samples_split': 16, 'min_samples_leaf': 3, 'subsample': 0.9536805894405422, 'max_features': 'log2'}. Best is trial 1454 with value: 0.30763307678022894.
[I 2024-12-04 12:50:11,420] Trial 1819 finished with value: 0.325794775379852 and parameters: {'n_estimators': 854, 'learning_rate': 0.05838114313559207, 'max_depth': 8, 'min_samples_split': 2, 'min_samples_leaf': 2, 'subsample': 0.6912716053328216, 'max_features': None}. Best is trial 1454 with value: 0.30763307678022894.
[I 2024-12-04 12:50:12,815] Trial 1825 finished with value: 0.3853136476891859 and parameters: {'n_estimators': 735, 'learning_rate': 0.06937947471435414, 'max_depth': 7, 'min_samples_split': 7, 'min_samples_leaf': 3, 'subsample': 0.7092865523987434, 'max_features': None}. Best is trial 1454 with value: 0.30763307678022894.
[I 2024-12-04 12:50:13,889] Trial 1821 finished with value: 0.3266428073058821 and parameters: {'n_estimators': 852, 'learning_rate': 0.08101647738850834, 'max_depth': 8, 'min_samples_split': 2, 'min_samples_leaf': 2, 'subsample': 0.6802700726619542, 'max_features': None}. Best is trial 1454 with value: 0.30763307678022894.
[I 2024-12-04 12:50:13,903] Trial 1823 finished with value: 0.3401018797687021 and parameters: {'n_estimators': 768, 'learning_rate': 0.07862978082986961, 'max_depth': 7, 'min_samples_split': 3, 'min_samples_leaf': 2, 'subsample': 0.7280729092016741, 'max_features': None}. Best is trial 1454 with value: 0.30763307678022894.
[I 2024-12-04 12:50:13,920] Trial 1824 finished with value: 0.3763493509742201 and parameters: {'n_estimators': 769, 'learning_rate': 0.09022483386569226, 'max_depth': 10, 'min_samples_split': 3, 'min_samples_leaf': 5, 'subsample': 0.6703979327059221, 'max_features': None}. Best is trial 1454 with value: 0.30763307678022894.
[I 2024-12-04 12:50:15,433] Trial 1809 finished with value: 0.3652809505437772 and parameters: {'n_estimators': 1240, 'learning_rate': 0.0965162445608507, 'max_depth': 8, 'min_samples_split': 9, 'min_samples_leaf': 3, 'subsample': 0.713207410960569, 'max_features': None}. Best is trial 1454 with value: 0.30763307678022894.
[I 2024-12-04 12:50:15,824] Trial 1828 finished with value: 0.656460159223845 and parameters: {'n_estimators': 893, 'learning_rate': 0.017772731333179286, 'max_depth': 4, 'min_samples_split': 5, 'min_samples_leaf': 10, 'subsample': 0.8800272496151752, 'max_features': 'sqrt'}. Best is trial 1454 with value: 0.30763307678022894.
[I 2024-12-04 12:50:17,280] Trial 1815 finished with value: 0.40517204638162974 and parameters: {'n_estimators': 1153, 'learning_rate': 0.0394241755480195, 'max_depth': 12, 'min_samples_split': 13, 'min_samples_leaf': 7, 'subsample': 0.6279746981913293, 'max_features': None}. Best is trial 1454 with value: 0.30763307678022894.
[I 2024-12-04 12:50:18,705] Trial 1831 finished with value: 0.5012232292135204 and parameters: {'n_estimators': 726, 'learning_rate': 0.048098844014280606, 'max_depth': 6, 'min_samples_split': 10, 'min_samples_leaf': 3, 'subsample': 0.7363083624985414, 'max_features': 'log2'}. Best is trial 1454 with value: 0.30763307678022894.
[I 2024-12-04 12:50:18,718] Trial 1827 finished with value: 0.40024053001659715 and parameters: {'n_estimators': 771, 'learning_rate': 0.07105610979470756, 'max_depth': 7, 'min_samples_split': 6, 'min_samples_leaf': 3, 'subsample': 0.6304466291059758, 'max_features': None}. Best is trial 1454 with value: 0.30763307678022894.
[I 2024-12-04 12:50:19,649] Trial 1804 finished with value: 0.3812875033511119 and parameters: {'n_estimators': 1486, 'learning_rate': 0.0957587841790571, 'max_depth': 7, 'min_samples_split': 4, 'min_samples_leaf': 3, 'subsample': 0.801154328875281, 'max_features': None}. Best is trial 1454 with value: 0.30763307678022894.
[I 2024-12-04 12:50:21,254] Trial 1829 finished with value: 0.3327687445919516 and parameters: {'n_estimators': 878, 'learning_rate': 0.05782933868929559, 'max_depth': 6, 'min_samples_split': 5, 'min_samples_leaf': 2, 'subsample': 0.7171780610799369, 'max_features': None}. Best is trial 1454 with value: 0.30763307678022894.
[I 2024-12-04 12:50:22,469] Trial 1832 finished with value: 0.3911324122444993 and parameters: {'n_estimators': 685, 'learning_rate': 0.08863700073573427, 'max_depth': 8, 'min_samples_split': 2, 'min_samples_leaf': 3, 'subsample': 0.705433329702183, 'max_features': None}. Best is trial 1454 with value: 0.30763307678022894.
[I 2024-12-04 12:50:22,872] Trial 1842 finished with value: 0.39443288615838645 and parameters: {'n_estimators': 433, 'learning_rate': 0.06221402784222927, 'max_depth': 8, 'min_samples_split': 4, 'min_samples_leaf': 6, 'subsample': 0.7991277422370598, 'max_features': None}. Best is trial 1454 with value: 0.30763307678022894.
[I 2024-12-04 12:50:23,278] Trial 1811 finished with value: 0.41982392348393516 and parameters: {'n_estimators': 1403, 'learning_rate': 0.0334799429441276, 'max_depth': 12, 'min_samples_split': 2, 'min_samples_leaf': 8, 'subsample': 0.8489177895099029, 'max_features': None}. Best is trial 1454 with value: 0.30763307678022894.
[I 2024-12-04 12:50:24,647] Trial 1826 finished with value: 0.3312887256243175 and parameters: {'n_estimators': 1006, 'learning_rate': 0.09534168734362458, 'max_depth': 8, 'min_samples_split': 6, 'min_samples_leaf': 2, 'subsample': 0.7286817502575568, 'max_features': None}. Best is trial 1454 with value: 0.30763307678022894.
[I 2024-12-04 12:50:24,750] Trial 1837 finished with value: 0.4246574659197598 and parameters: {'n_estimators': 726, 'learning_rate': 0.04768974739968268, 'max_depth': 8, 'min_samples_split': 5, 'min_samples_leaf': 5, 'subsample': 0.8523235444830776, 'max_features': 'sqrt'}. Best is trial 1454 with value: 0.30763307678022894.
[I 2024-12-04 12:50:26,096] Trial 1830 finished with value: 0.3249343035964452 and parameters: {'n_estimators': 882, 'learning_rate': 0.07971407202930075, 'max_depth': 7, 'min_samples_split': 3, 'min_samples_leaf': 2, 'subsample': 0.6890381082052316, 'max_features': None}. Best is trial 1454 with value: 0.30763307678022894.
[I 2024-12-04 12:50:27,973] Trial 1833 finished with value: 0.3937411050524039 and parameters: {'n_estimators': 852, 'learning_rate': 0.09817358618765408, 'max_depth': 5, 'min_samples_split': 5, 'min_samples_leaf': 3, 'subsample': 0.7410662657886108, 'max_features': None}. Best is trial 1454 with value: 0.30763307678022894.
[I 2024-12-04 12:50:28,088] Trial 1835 finished with value: 0.3317474889921185 and parameters: {'n_estimators': 867, 'learning_rate': 0.07418799524583726, 'max_depth': 7, 'min_samples_split': 3, 'min_samples_leaf': 2, 'subsample': 0.6535201518761049, 'max_features': None}. Best is trial 1454 with value: 0.30763307678022894.
[I 2024-12-04 12:50:29,432] Trial 1838 finished with value: 0.40202157303647734 and parameters: {'n_estimators': 775, 'learning_rate': 0.0508893048976039, 'max_depth': 6, 'min_samples_split': 4, 'min_samples_leaf': 1, 'subsample': 0.7045426605131244, 'max_features': None}. Best is trial 1454 with value: 0.30763307678022894.
[I 2024-12-04 12:50:30,579] Trial 1839 finished with value: 0.33928772035355803 and parameters: {'n_estimators': 821, 'learning_rate': 0.07933487967221194, 'max_depth': 5, 'min_samples_split': 3, 'min_samples_leaf': 2, 'subsample': 0.7171384613585913, 'max_features': None}. Best is trial 1454 with value: 0.30763307678022894.
[I 2024-12-04 12:50:32,169] Trial 1850 finished with value: 0.8553066720672481 and parameters: {'n_estimators': 507, 'learning_rate': 0.017999878720075826, 'max_depth': 12, 'min_samples_split': 10, 'min_samples_leaf': 6, 'subsample': 0.749099809527295, 'max_features': 'log2'}. Best is trial 1454 with value: 0.30763307678022894.
[I 2024-12-04 12:50:32,727] Trial 1840 finished with value: 0.4550544321873101 and parameters: {'n_estimators': 981, 'learning_rate': 0.04561216664301153, 'max_depth': 4, 'min_samples_split': 19, 'min_samples_leaf': 6, 'subsample': 0.8987203630268308, 'max_features': 'sqrt'}. Best is trial 1454 with value: 0.30763307678022894.
[I 2024-12-04 12:50:32,819] Trial 1834 finished with value: 0.38071699381240515 and parameters: {'n_estimators': 1000, 'learning_rate': 0.09673067726846218, 'max_depth': 8, 'min_samples_split': 3, 'min_samples_leaf': 3, 'subsample': 0.8031730774094982, 'max_features': None}. Best is trial 1454 with value: 0.30763307678022894.
[I 2024-12-04 12:50:34,697] Trial 1841 finished with value: 0.3915371271831263 and parameters: {'n_estimators': 861, 'learning_rate': 0.06901824484966636, 'max_depth': 7, 'min_samples_split': 2, 'min_samples_leaf': 1, 'subsample': 0.7443139383554195, 'max_features': None}. Best is trial 1454 with value: 0.30763307678022894.
[I 2024-12-04 12:50:38,396] Trial 1843 finished with value: 0.39768513328573485 and parameters: {'n_estimators': 927, 'learning_rate': 0.09532848103782747, 'max_depth': 7, 'min_samples_split': 4, 'min_samples_leaf': 1, 'subsample': 0.724659769027694, 'max_features': None}. Best is trial 1454 with value: 0.30763307678022894.
[I 2024-12-04 12:50:38,791] Trial 1836 finished with value: 0.439481287091792 and parameters: {'n_estimators': 1350, 'learning_rate': 0.07538096995699917, 'max_depth': 7, 'min_samples_split': 2, 'min_samples_leaf': 4, 'subsample': 0.7598383878483503, 'max_features': 'log2'}. Best is trial 1454 with value: 0.30763307678022894.
[I 2024-12-04 12:50:38,792] Trial 1848 finished with value: 0.3335438042296489 and parameters: {'n_estimators': 724, 'learning_rate': 0.08274433674176022, 'max_depth': 8, 'min_samples_split': 6, 'min_samples_leaf': 2, 'subsample': 0.6554631560200569, 'max_features': None}. Best is trial 1454 with value: 0.30763307678022894.
[I 2024-12-04 12:50:39,594] Trial 1844 finished with value: 0.38031580887041405 and parameters: {'n_estimators': 985, 'learning_rate': 0.03683840543567321, 'max_depth': 7, 'min_samples_split': 2, 'min_samples_leaf': 3, 'subsample': 0.602480331726753, 'max_features': None}. Best is trial 1454 with value: 0.30763307678022894.
[I 2024-12-04 12:50:39,785] Trial 1846 finished with value: 0.4287506642387749 and parameters: {'n_estimators': 977, 'learning_rate': 0.05992747214935889, 'max_depth': 7, 'min_samples_split': 3, 'min_samples_leaf': 2, 'subsample': 0.7808489863263869, 'max_features': 'log2'}. Best is trial 1454 with value: 0.30763307678022894.
[I 2024-12-04 12:50:40,834] Trial 1856 finished with value: 0.3979195885435406 and parameters: {'n_estimators': 450, 'learning_rate': 0.09864886985361501, 'max_depth': 7, 'min_samples_split': 3, 'min_samples_leaf': 7, 'subsample': 0.9499977753229577, 'max_features': None}. Best is trial 1454 with value: 0.30763307678022894.
[I 2024-12-04 12:50:41,716] Trial 1862 finished with value: 0.69868140831511 and parameters: {'n_estimators': 287, 'learning_rate': 0.08506078308465005, 'max_depth': 6, 'min_samples_split': 13, 'min_samples_leaf': 7, 'subsample': 0.7583632697764844, 'max_features': 'log2'}. Best is trial 1454 with value: 0.30763307678022894.
[I 2024-12-04 12:50:42,854] Trial 1845 finished with value: 0.3890033423120911 and parameters: {'n_estimators': 1052, 'learning_rate': 0.06272420672261443, 'max_depth': 8, 'min_samples_split': 6, 'min_samples_leaf': 3, 'subsample': 0.6438004392501983, 'max_features': None}. Best is trial 1454 with value: 0.30763307678022894.
[I 2024-12-04 12:50:43,078] Trial 1849 finished with value: 0.3784833917702647 and parameters: {'n_estimators': 854, 'learning_rate': 0.09344777716646943, 'max_depth': 9, 'min_samples_split': 7, 'min_samples_leaf': 3, 'subsample': 0.6300950242844892, 'max_features': None}. Best is trial 1454 with value: 0.30763307678022894.
[I 2024-12-04 12:50:45,640] Trial 1870 finished with value: 0.42802519681665513 and parameters: {'n_estimators': 185, 'learning_rate': 0.08608639092283325, 'max_depth': 7, 'min_samples_split': 2, 'min_samples_leaf': 1, 'subsample': 0.6080767642984586, 'max_features': 'sqrt'}. Best is trial 1454 with value: 0.30763307678022894.
[I 2024-12-04 12:50:48,366] Trial 1857 finished with value: 0.3325034624547245 and parameters: {'n_estimators': 694, 'learning_rate': 0.06722674976283159, 'max_depth': 6, 'min_samples_split': 2, 'min_samples_leaf': 2, 'subsample': 0.6849975212209876, 'max_features': None}. Best is trial 1454 with value: 0.30763307678022894.
[I 2024-12-04 12:50:49,065] Trial 1847 finished with value: 0.44533549799695005 and parameters: {'n_estimators': 1342, 'learning_rate': 0.04790155074471542, 'max_depth': 11, 'min_samples_split': 3, 'min_samples_leaf': 4, 'subsample': 0.8615017124446672, 'max_features': 'log2'}. Best is trial 1454 with value: 0.30763307678022894.
[I 2024-12-04 12:50:49,216] Trial 1854 finished with value: 0.35186500917740565 and parameters: {'n_estimators': 868, 'learning_rate': 0.044139977347627674, 'max_depth': 5, 'min_samples_split': 2, 'min_samples_leaf': 2, 'subsample': 0.6697569693650732, 'max_features': None}. Best is trial 1454 with value: 0.30763307678022894.
[I 2024-12-04 12:50:49,369] Trial 1873 finished with value: 0.8786065668476725 and parameters: {'n_estimators': 191, 'learning_rate': 0.028944314611088783, 'max_depth': 6, 'min_samples_split': 14, 'min_samples_leaf': 5, 'subsample': 0.9820128041181946, 'max_features': 'log2'}. Best is trial 1454 with value: 0.30763307678022894.
[I 2024-12-04 12:50:52,689] Trial 1852 finished with value: 0.3880977614180431 and parameters: {'n_estimators': 999, 'learning_rate': 0.09999435671950685, 'max_depth': 7, 'min_samples_split': 3, 'min_samples_leaf': 3, 'subsample': 0.7262202190023469, 'max_features': None}. Best is trial 1454 with value: 0.30763307678022894.
[I 2024-12-04 12:50:52,898] Trial 1853 finished with value: 0.3186224068621023 and parameters: {'n_estimators': 1089, 'learning_rate': 0.05124303980876305, 'max_depth': 8, 'min_samples_split': 2, 'min_samples_leaf': 2, 'subsample': 0.6296233807136351, 'max_features': None}. Best is trial 1454 with value: 0.30763307678022894.
[I 2024-12-04 12:50:57,228] Trial 1855 finished with value: 0.3905511902591101 and parameters: {'n_estimators': 1063, 'learning_rate': 0.04224490405107952, 'max_depth': 7, 'min_samples_split': 5, 'min_samples_leaf': 1, 'subsample': 0.697220483294321, 'max_features': None}. Best is trial 1454 with value: 0.30763307678022894.
[I 2024-12-04 12:50:57,975] Trial 1866 finished with value: 0.39445033652473566 and parameters: {'n_estimators': 781, 'learning_rate': 0.07511625028955808, 'max_depth': 6, 'min_samples_split': 2, 'min_samples_leaf': 2, 'subsample': 0.6951056726776984, 'max_features': 'sqrt'}. Best is trial 1454 with value: 0.30763307678022894.
[I 2024-12-04 12:50:58,525] Trial 1863 finished with value: 0.38652732852164057 and parameters: {'n_estimators': 747, 'learning_rate': 0.06459030158775367, 'max_depth': 6, 'min_samples_split': 2, 'min_samples_leaf': 1, 'subsample': 0.7139130979762218, 'max_features': None}. Best is trial 1454 with value: 0.30763307678022894.
[I 2024-12-04 12:50:58,777] Trial 1861 finished with value: 0.3714390794605521 and parameters: {'n_estimators': 854, 'learning_rate': 0.0451312162543316, 'max_depth': 7, 'min_samples_split': 2, 'min_samples_leaf': 1, 'subsample': 0.7382954706556126, 'max_features': None}. Best is trial 1454 with value: 0.30763307678022894.
[I 2024-12-04 12:50:59,057] Trial 1874 finished with value: 0.32929458813237766 and parameters: {'n_estimators': 488, 'learning_rate': 0.07542163288062669, 'max_depth': 7, 'min_samples_split': 2, 'min_samples_leaf': 2, 'subsample': 0.689058541530795, 'max_features': None}. Best is trial 1454 with value: 0.30763307678022894.
[I 2024-12-04 12:51:00,802] Trial 1860 finished with value: 0.37372997898674126 and parameters: {'n_estimators': 988, 'learning_rate': 0.09504572189630281, 'max_depth': 5, 'min_samples_split': 10, 'min_samples_leaf': 4, 'subsample': 0.6691816242997295, 'max_features': None}. Best is trial 1454 with value: 0.30763307678022894.
[I 2024-12-04 12:51:01,515] Trial 1864 finished with value: 0.37235042914697175 and parameters: {'n_estimators': 870, 'learning_rate': 0.057392928100745554, 'max_depth': 9, 'min_samples_split': 2, 'min_samples_leaf': 4, 'subsample': 0.6172895139520279, 'max_features': None}. Best is trial 1454 with value: 0.30763307678022894.
[I 2024-12-04 12:51:02,795] Trial 1851 finished with value: 0.3924682899481772 and parameters: {'n_estimators': 1282, 'learning_rate': 0.07220584463327422, 'max_depth': 8, 'min_samples_split': 7, 'min_samples_leaf': 3, 'subsample': 0.6505365448402902, 'max_features': None}. Best is trial 1454 with value: 0.30763307678022894.
[I 2024-12-04 12:51:02,797] Trial 1858 finished with value: 0.3788446563084306 and parameters: {'n_estimators': 1060, 'learning_rate': 0.07542066933029798, 'max_depth': 6, 'min_samples_split': 2, 'min_samples_leaf': 3, 'subsample': 0.6303493858636087, 'max_features': None}. Best is trial 1454 with value: 0.30763307678022894.
[I 2024-12-04 12:51:05,604] Trial 1865 finished with value: 0.38618483894269806 and parameters: {'n_estimators': 923, 'learning_rate': 0.06431556234295312, 'max_depth': 8, 'min_samples_split': 4, 'min_samples_leaf': 3, 'subsample': 0.7260933424242433, 'max_features': None}. Best is trial 1454 with value: 0.30763307678022894.
[I 2024-12-04 12:51:06,820] Trial 1872 finished with value: 0.33780814798457004 and parameters: {'n_estimators': 739, 'learning_rate': 0.09862771540530905, 'max_depth': 6, 'min_samples_split': 2, 'min_samples_leaf': 2, 'subsample': 0.7147556016550418, 'max_features': None}. Best is trial 1454 with value: 0.30763307678022894.
[I 2024-12-04 12:51:07,019] Trial 1875 finished with value: 0.9083656925446708 and parameters: {'n_estimators': 727, 'learning_rate': 0.010445683927427, 'max_depth': 8, 'min_samples_split': 4, 'min_samples_leaf': 8, 'subsample': 0.8265592673993818, 'max_features': 'log2'}. Best is trial 1454 with value: 0.30763307678022894.
[I 2024-12-04 12:51:07,585] Trial 1859 finished with value: 0.32021456302418716 and parameters: {'n_estimators': 1189, 'learning_rate': 0.09366045960846894, 'max_depth': 7, 'min_samples_split': 2, 'min_samples_leaf': 2, 'subsample': 0.6805600928026295, 'max_features': None}. Best is trial 1454 with value: 0.30763307678022894.
[I 2024-12-04 12:51:09,280] Trial 1869 finished with value: 0.401471501839916 and parameters: {'n_estimators': 1129, 'learning_rate': 0.058763605773384464, 'max_depth': 6, 'min_samples_split': 3, 'min_samples_leaf': 2, 'subsample': 0.6101423383620577, 'max_features': 'sqrt'}. Best is trial 1454 with value: 0.30763307678022894.
[I 2024-12-04 12:51:09,587] Trial 1868 finished with value: 0.39710868264745824 and parameters: {'n_estimators': 914, 'learning_rate': 0.0910198278799475, 'max_depth': 8, 'min_samples_split': 4, 'min_samples_leaf': 1, 'subsample': 0.7026290136364203, 'max_features': None}. Best is trial 1454 with value: 0.30763307678022894.
[I 2024-12-04 12:51:11,353] Trial 1895 finished with value: 0.8517186006070211 and parameters: {'n_estimators': 180, 'learning_rate': 0.030606615405879566, 'max_depth': 3, 'min_samples_split': 19, 'min_samples_leaf': 10, 'subsample': 0.815786166518794, 'max_features': 'sqrt'}. Best is trial 1454 with value: 0.30763307678022894.
[I 2024-12-04 12:51:15,260] Trial 1879 finished with value: 0.3862283438841417 and parameters: {'n_estimators': 777, 'learning_rate': 0.07545030964829737, 'max_depth': 6, 'min_samples_split': 4, 'min_samples_leaf': 3, 'subsample': 0.7323208622685428, 'max_features': None}. Best is trial 1454 with value: 0.30763307678022894.
