[I 2024-12-03 18:44:14,606] Trial 287 finished with value: 0.13506642852473316 and parameters: {'kernel': 'linear', 'C': 76.01128756935553, 'gamma': 0.0003192731723805291, 'epsilon': 0.055571448139037596}. Best is trial 126 with value: 0.13459441547810197.
[I 2024-12-03 18:44:17,186] Trial 317 finished with value: 0.13570048081240965 and parameters: {'kernel': 'linear', 'C': 22.687319196648772, 'gamma': 0.08087634495488746, 'epsilon': 0.03400825311931496}. Best is trial 126 with value: 0.13459441547810197.
[I 2024-12-03 18:44:17,188] Trial 335 finished with value: 0.14819536750720072 and parameters: {'kernel': 'linear', 'C': 45.195428888080585, 'gamma': 0.023135362233805842, 'epsilon': 0.13738272543633553}. Best is trial 126 with value: 0.13459441547810197.
[I 2024-12-03 18:44:18,082] Trial 307 finished with value: 0.13504299851346266 and parameters: {'kernel': 'linear', 'C': 26.223170238219254, 'gamma': 0.019982210173950434, 'epsilon': 0.02971989021219916}. Best is trial 126 with value: 0.13459441547810197.
[I 2024-12-03 18:44:19,112] Trial 331 finished with value: 0.13799661793849385 and parameters: {'kernel': 'linear', 'C': 4.414454245494967, 'gamma': 0.07168596831624345, 'epsilon': 0.007153709547567411}. Best is trial 126 with value: 0.13459441547810197.
[I 2024-12-03 18:44:19,466] Trial 330 finished with value: 0.14193872922061193 and parameters: {'kernel': 'linear', 'C': 61.23065404807756, 'gamma': 0.016553441900779012, 'epsilon': 0.11543133219413307}. Best is trial 126 with value: 0.13459441547810197.
[I 2024-12-03 18:44:21,017] Trial 323 finished with value: 0.13838709244860178 and parameters: {'kernel': 'linear', 'C': 91.5107017609792, 'gamma': 0.04099269810419706, 'epsilon': 0.0824064683401662}. Best is trial 126 with value: 0.13459441547810197.
[I 2024-12-03 18:44:22,191] Trial 344 finished with value: 0.1592320238217187 and parameters: {'kernel': 'linear', 'C': 8.775351285076407, 'gamma': 0.012499912168867292, 'epsilon': 0.17472294260963775}. Best is trial 126 with value: 0.13459441547810197.
[I 2024-12-03 18:44:24,219] Trial 297 finished with value: 0.13642763253237314 and parameters: {'kernel': 'linear', 'C': 46.4751353214878, 'gamma': 0.5630423507178756, 'epsilon': 0.024125514912373504}. Best is trial 126 with value: 0.13459441547810197.
[I 2024-12-03 18:44:25,223] Trial 324 finished with value: 0.13684530120779437 and parameters: {'kernel': 'linear', 'C': 46.43646638923664, 'gamma': 0.09218232329739937, 'epsilon': 0.04952758052250139}. Best is trial 126 with value: 0.13459441547810197.
[I 2024-12-03 18:44:25,296] Trial 304 finished with value: 0.13623684639153516 and parameters: {'kernel': 'linear', 'C': 23.899060001180548, 'gamma': 0.033482326452143045, 'epsilon': 0.026015870383784834}. Best is trial 126 with value: 0.13459441547810197.
[I 2024-12-03 18:44:26,157] Trial 336 finished with value: 0.14261588738740802 and parameters: {'kernel': 'linear', 'C': 68.0085911096149, 'gamma': 0.011833953225488103, 'epsilon': 0.1166697245531318}. Best is trial 126 with value: 0.13459441547810197.
[I 2024-12-03 18:44:27,204] Trial 349 finished with value: 0.2843868812160377 and parameters: {'kernel': 'sigmoid', 'C': 91.71318162274778, 'gamma': 0.00034429123823013943, 'epsilon': 0.10179733945078155}. Best is trial 126 with value: 0.13459441547810197.
[I 2024-12-03 18:44:27,513] Trial 333 finished with value: 0.13515465302068802 and parameters: {'kernel': 'linear', 'C': 17.583954226040593, 'gamma': 0.13462797117418504, 'epsilon': 0.05781932755060168}. Best is trial 126 with value: 0.13459441547810197.
[I 2024-12-03 18:44:27,514] Trial 343 finished with value: 0.13548107032801981 and parameters: {'kernel': 'linear', 'C': 8.328223802702409, 'gamma': 0.035319814803504275, 'epsilon': 0.039627763458240435}. Best is trial 126 with value: 0.13459441547810197.
[I 2024-12-03 18:44:28,748] Trial 350 finished with value: 345.59024554748703 and parameters: {'kernel': 'sigmoid', 'C': 15.413602248825846, 'gamma': 0.4232007236976301, 'epsilon': 0.2475334702610305}. Best is trial 126 with value: 0.13459441547810197.
[I 2024-12-03 18:44:28,880] Trial 321 finished with value: 0.1354135757992528 and parameters: {'kernel': 'linear', 'C': 26.489227393185956, 'gamma': 0.5279013701505781, 'epsilon': 0.029043314182796435}. Best is trial 126 with value: 0.13459441547810197.
[I 2024-12-03 18:44:28,909] Trial 351 finished with value: 1.340978977682812 and parameters: {'kernel': 'sigmoid', 'C': 0.001281276707892496, 'gamma': 0.08305216963922668, 'epsilon': 0.07783426440127758}. Best is trial 126 with value: 0.13459441547810197.
[I 2024-12-03 18:44:30,281] Trial 337 finished with value: 0.13667650458868136 and parameters: {'kernel': 'linear', 'C': 39.19880195966723, 'gamma': 0.005213132379303666, 'epsilon': 0.0732148546820137}. Best is trial 126 with value: 0.13459441547810197.
[I 2024-12-03 18:44:30,482] Trial 341 finished with value: 0.1371651411560157 and parameters: {'kernel': 'linear', 'C': 25.206026238476056, 'gamma': 0.007098685703264286, 'epsilon': 0.047919199317821556}. Best is trial 126 with value: 0.13459441547810197.
[I 2024-12-03 18:44:30,943] Trial 353 finished with value: 0.189271876279175 and parameters: {'kernel': 'linear', 'C': 16.473272685812837, 'gamma': 0.8693297117962149, 'epsilon': 0.23437910841956003}. Best is trial 126 with value: 0.13459441547810197.
[I 2024-12-03 18:44:31,033] Trial 314 finished with value: 0.13508614149992554 and parameters: {'kernel': 'linear', 'C': 79.14617440840087, 'gamma': 0.02781064561186693, 'epsilon': 0.06287694160978925}. Best is trial 126 with value: 0.13459441547810197.
[I 2024-12-03 18:44:31,107] Trial 355 finished with value: 0.15605664709951378 and parameters: {'kernel': 'linear', 'C': 6.84734581335014, 'gamma': 0.07806084795283018, 'epsilon': 0.16157152378183645}. Best is trial 126 with value: 0.13459441547810197.
[I 2024-12-03 18:44:32,180] Trial 357 finished with value: 147.80180193488843 and parameters: {'kernel': 'sigmoid', 'C': 10.753196415317147, 'gamma': 0.02682691523246048, 'epsilon': 0.17298753681781845}. Best is trial 126 with value: 0.13459441547810197.
[I 2024-12-03 18:44:32,181] Trial 334 finished with value: 0.14205777494868566 and parameters: {'kernel': 'linear', 'C': 86.49979986004453, 'gamma': 0.46394725908850853, 'epsilon': 0.11538810827709446}. Best is trial 126 with value: 0.13459441547810197.
[I 2024-12-03 18:44:36,098] Trial 319 finished with value: 0.13868151931177064 and parameters: {'kernel': 'linear', 'C': 28.82435055970952, 'gamma': 0.2948556819670919, 'epsilon': 0.011859140906368316}. Best is trial 126 with value: 0.13459441547810197.
[I 2024-12-03 18:44:36,110] Trial 359 finished with value: 0.14665509598324625 and parameters: {'kernel': 'linear', 'C': 37.3615650941489, 'gamma': 0.028649989023070265, 'epsilon': 0.13300188246635838}. Best is trial 126 with value: 0.13459441547810197.
[I 2024-12-03 18:44:38,122] Trial 338 finished with value: 0.13546969206605564 and parameters: {'kernel': 'linear', 'C': 49.993251924322024, 'gamma': 0.016478972819367395, 'epsilon': 0.06612392236745623}. Best is trial 126 with value: 0.13459441547810197.
[I 2024-12-03 18:44:39,186] Trial 365 finished with value: 0.3959025999224471 and parameters: {'kernel': 'poly', 'C': 99.07090192630633, 'gamma': 0.005631641917365323, 'epsilon': 0.04039823248867318}. Best is trial 126 with value: 0.13459441547810197.
[I 2024-12-03 18:44:40,076] Trial 366 finished with value: 1.3605554393022612 and parameters: {'kernel': 'poly', 'C': 0.0025394564364117377, 'gamma': 0.00021547585589142682, 'epsilon': 0.008798642697454536}. Best is trial 126 with value: 0.13459441547810197.
[I 2024-12-03 18:44:40,962] Trial 367 finished with value: 7.19343690943531 and parameters: {'kernel': 'sigmoid', 'C': 0.2919116437808678, 'gamma': 0.801146112361245, 'epsilon': 0.6857248130099225}. Best is trial 126 with value: 0.13459441547810197.
[I 2024-12-03 18:44:42,791] Trial 364 finished with value: 0.14102993670404462 and parameters: {'kernel': 'linear', 'C': 34.68750871110308, 'gamma': 0.0004534748721597188, 'epsilon': 0.09154902017132209}. Best is trial 126 with value: 0.13459441547810197.
[I 2024-12-03 18:44:42,904] Trial 262 finished with value: 0.13508663456391626 and parameters: {'kernel': 'linear', 'C': 88.1879721289524, 'gamma': 0.03444843104716902, 'epsilon': 0.029377110120868896}. Best is trial 126 with value: 0.13459441547810197.
[I 2024-12-03 18:44:43,157] Trial 315 finished with value: 0.13769701374682572 and parameters: {'kernel': 'linear', 'C': 50.88838218069402, 'gamma': 0.014898510178213961, 'epsilon': 0.020618434793701273}. Best is trial 126 with value: 0.13459441547810197.
[I 2024-12-03 18:44:44,022] Trial 370 finished with value: 0.9417415049952436 and parameters: {'kernel': 'poly', 'C': 6.241068332585167, 'gamma': 0.0042437794284187836, 'epsilon': 0.1644697498014489}. Best is trial 126 with value: 0.13459441547810197.
[I 2024-12-03 18:44:44,249] Trial 356 finished with value: 0.1362063466384788 and parameters: {'kernel': 'linear', 'C': 24.709129705369765, 'gamma': 0.02654480668156574, 'epsilon': 0.04340642236858959}. Best is trial 126 with value: 0.13459441547810197.
[I 2024-12-03 18:44:44,947] Trial 296 finished with value: 0.13559110267473512 and parameters: {'kernel': 'linear', 'C': 77.0130679925886, 'gamma': 0.31502965810096506, 'epsilon': 0.03784262865499275}. Best is trial 126 with value: 0.13459441547810197.
[I 2024-12-03 18:44:45,653] Trial 354 finished with value: 0.13601540103682624 and parameters: {'kernel': 'linear', 'C': 14.850286015960954, 'gamma': 0.021115895350849696, 'epsilon': 0.06929452620342272}. Best is trial 126 with value: 0.13459441547810197.
[I 2024-12-03 18:44:46,276] Trial 346 finished with value: 0.14016387546154993 and parameters: {'kernel': 'linear', 'C': 56.48474662765456, 'gamma': 0.08075073936573247, 'epsilon': 0.10463681568610475}. Best is trial 126 with value: 0.13459441547810197.
[I 2024-12-03 18:44:46,675] Trial 363 finished with value: 0.14603297367152054 and parameters: {'kernel': 'linear', 'C': 65.69925266335636, 'gamma': 0.00043276731475846904, 'epsilon': 0.12996891874371425}. Best is trial 126 with value: 0.13459441547810197.
[I 2024-12-03 18:44:51,259] Trial 377 finished with value: 0.13624020254735789 and parameters: {'kernel': 'linear', 'C': 12.536091308688722, 'gamma': 0.010441336565318506, 'epsilon': 0.07301131143629884}. Best is trial 126 with value: 0.13459441547810197.
[I 2024-12-03 18:44:52,754] Trial 345 finished with value: 0.13438257115663557 and parameters: {'kernel': 'linear', 'C': 39.104417862296216, 'gamma': 0.009938462934760778, 'epsilon': 0.039822444534546364}. Best is trial 345 with value: 0.13438257115663557.
[I 2024-12-03 18:44:53,533] Trial 376 finished with value: 0.13622013749624692 and parameters: {'kernel': 'linear', 'C': 10.388300918159075, 'gamma': 0.034401225834288465, 'epsilon': 0.07080157320201153}. Best is trial 345 with value: 0.13438257115663557.
[I 2024-12-03 18:44:53,643] Trial 379 finished with value: 1.1482799100930312 and parameters: {'kernel': 'poly', 'C': 1.0021910988574192, 'gamma': 0.0013217021287160945, 'epsilon': 0.03041518885793077}. Best is trial 345 with value: 0.13438257115663557.
[I 2024-12-03 18:44:54,856] Trial 380 finished with value: 0.2762070135282969 and parameters: {'kernel': 'rbf', 'C': 3.4552280686031165, 'gamma': 0.016380692410544715, 'epsilon': 0.001367813951531773}. Best is trial 345 with value: 0.13438257115663557.
[I 2024-12-03 18:44:59,366] Trial 347 finished with value: 0.13752002960678447 and parameters: {'kernel': 'linear', 'C': 28.946185512985593, 'gamma': 0.01827844487282998, 'epsilon': 0.02223777116312493}. Best is trial 345 with value: 0.13438257115663557.
[I 2024-12-03 18:45:02,455] Trial 358 finished with value: 0.14117916047509732 and parameters: {'kernel': 'linear', 'C': 91.30348147330466, 'gamma': 0.045222078757276817, 'epsilon': 0.10933356271962515}. Best is trial 345 with value: 0.13438257115663557.
[I 2024-12-03 18:45:04,442] Trial 360 finished with value: 0.1350483043628802 and parameters: {'kernel': 'linear', 'C': 33.38051259952744, 'gamma': 0.009477365427580502, 'epsilon': 0.06333665419319093}. Best is trial 345 with value: 0.13438257115663557.
[I 2024-12-03 18:45:07,003] Trial 361 finished with value: 0.1398698736668931 and parameters: {'kernel': 'linear', 'C': 90.41476732329527, 'gamma': 0.007645821371135852, 'epsilon': 0.09849074289367295}. Best is trial 345 with value: 0.13438257115663557.
[I 2024-12-03 18:45:10,507] Trial 266 finished with value: 0.1358711838882239 and parameters: {'kernel': 'linear', 'C': 95.33969790844401, 'gamma': 0.005045979066712787, 'epsilon': 0.03612457387516195}. Best is trial 345 with value: 0.13438257115663557.
[I 2024-12-03 18:45:10,750] Trial 378 finished with value: 0.13637348467148988 and parameters: {'kernel': 'linear', 'C': 19.718524079261503, 'gamma': 0.020218019861681872, 'epsilon': 0.02541350688005535}. Best is trial 345 with value: 0.13438257115663557.
[I 2024-12-03 18:45:11,595] Trial 387 finished with value: 0.4962179576645321 and parameters: {'kernel': 'poly', 'C': 11.192906157308553, 'gamma': 0.007515430780495387, 'epsilon': 0.039674347203457715}. Best is trial 345 with value: 0.13438257115663557.
[I 2024-12-03 18:45:11,812] Trial 388 finished with value: 0.3117254345017523 and parameters: {'kernel': 'rbf', 'C': 1.8953029928294098, 'gamma': 0.012224052179354036, 'epsilon': 0.23759166319016564}. Best is trial 345 with value: 0.13438257115663557.
[I 2024-12-03 18:45:12,558] Trial 385 finished with value: 0.13521530140032864 and parameters: {'kernel': 'linear', 'C': 14.34007041250946, 'gamma': 0.006667297712757485, 'epsilon': 0.05944007028211045}. Best is trial 345 with value: 0.13438257115663557.
[I 2024-12-03 18:45:13,189] Trial 390 finished with value: 0.23467113531072048 and parameters: {'kernel': 'rbf', 'C': 48.151673564998404, 'gamma': 0.00038200397715731183, 'epsilon': 0.032691069438580925}. Best is trial 345 with value: 0.13438257115663557.
[I 2024-12-03 18:45:13,609] Trial 383 finished with value: 0.13577630427711238 and parameters: {'kernel': 'linear', 'C': 11.943401393241537, 'gamma': 0.012054891704494286, 'epsilon': 0.03218420866222198}. Best is trial 345 with value: 0.13438257115663557.
[I 2024-12-03 18:45:15,697] Trial 309 finished with value: 0.13566403218868658 and parameters: {'kernel': 'linear', 'C': 93.55423725584694, 'gamma': 0.1308132137845817, 'epsilon': 0.036925729586661835}. Best is trial 345 with value: 0.13438257115663557.
[I 2024-12-03 18:45:15,810] Trial 392 finished with value: 0.33890737646737595 and parameters: {'kernel': 'poly', 'C': 19.708788023208385, 'gamma': 0.027271639253384484, 'epsilon': 0.15192413264426122}. Best is trial 345 with value: 0.13438257115663557.
[I 2024-12-03 18:45:16,555] Trial 340 finished with value: 0.13669516072915325 and parameters: {'kernel': 'linear', 'C': 91.66364613379365, 'gamma': 0.014745404924984573, 'epsilon': 0.04414822559505399}. Best is trial 345 with value: 0.13438257115663557.
[I 2024-12-03 18:45:16,619] Trial 394 finished with value: 1.2903152739812058 and parameters: {'kernel': 'sigmoid', 'C': 0.005128892055027176, 'gamma': 0.001059249536520865, 'epsilon': 0.9769053254031789}. Best is trial 345 with value: 0.13438257115663557.
[I 2024-12-03 18:45:17,394] Trial 395 finished with value: 0.2935117669847265 and parameters: {'kernel': 'rbf', 'C': 11.498922928060882, 'gamma': 0.038886374689698675, 'epsilon': 0.03389874634626788}. Best is trial 345 with value: 0.13438257115663557.
[I 2024-12-03 18:45:17,405] Trial 301 finished with value: 0.3395178707016678 and parameters: {'kernel': 'poly', 'C': 66.84378965098315, 'gamma': 0.09177185048645434, 'epsilon': 0.049239339931019616}. Best is trial 345 with value: 0.13438257115663557.
[I 2024-12-03 18:45:17,752] Trial 393 finished with value: 0.1406596949332397 and parameters: {'kernel': 'linear', 'C': 5.877259848981399, 'gamma': 0.002335836756201235, 'epsilon': 0.08140050639434583}. Best is trial 345 with value: 0.13438257115663557.
[I 2024-12-03 18:45:18,634] Trial 396 finished with value: 0.1547473158911639 and parameters: {'kernel': 'linear', 'C': 3.827513933965032, 'gamma': 0.0069321259825044935, 'epsilon': 0.12944470932654972}. Best is trial 345 with value: 0.13438257115663557.
[I 2024-12-03 18:45:20,027] Trial 397 finished with value: 0.14030698850384646 and parameters: {'kernel': 'linear', 'C': 5.6599266251538065, 'gamma': 0.0068547592150910545, 'epsilon': 0.07972999606505773}. Best is trial 345 with value: 0.13438257115663557.
[I 2024-12-03 18:45:20,140] Trial 401 finished with value: 6.906965176669247 and parameters: {'kernel': 'sigmoid', 'C': 19.950440950203205, 'gamma': 0.0025182309898270226, 'epsilon': 0.05514370758359766}. Best is trial 345 with value: 0.13438257115663557.
[I 2024-12-03 18:45:21,748] Trial 348 finished with value: 0.13642899029398795 and parameters: {'kernel': 'linear', 'C': 48.255801851715226, 'gamma': 0.023469750231623475, 'epsilon': 0.02432537758191359}. Best is trial 345 with value: 0.13438257115663557.
[I 2024-12-03 18:45:22,580] Trial 403 finished with value: 230.91204534924105 and parameters: {'kernel': 'sigmoid', 'C': 10.229456369396395, 'gamma': 0.45105464800645284, 'epsilon': 0.006963778792395317}. Best is trial 345 with value: 0.13438257115663557.
[I 2024-12-03 18:45:22,628] Trial 382 finished with value: 0.1354640771396966 and parameters: {'kernel': 'linear', 'C': 26.43617433597595, 'gamma': 0.007309440691647961, 'epsilon': 0.031797953716136494}. Best is trial 345 with value: 0.13438257115663557.
[I 2024-12-03 18:45:23,849] Trial 402 finished with value: 0.14024907614324156 and parameters: {'kernel': 'linear', 'C': 1.132043918308353, 'gamma': 0.0007582609023840718, 'epsilon': 0.05183265211006782}. Best is trial 345 with value: 0.13438257115663557.
[I 2024-12-03 18:45:24,194] Trial 405 finished with value: 1.3303223842241871 and parameters: {'kernel': 'rbf', 'C': 0.010309197067687898, 'gamma': 0.0006101865528154995, 'epsilon': 0.0106063187262103}. Best is trial 345 with value: 0.13438257115663557.
[I 2024-12-03 18:45:25,044] Trial 407 finished with value: 1.3243986357022621 and parameters: {'kernel': 'poly', 'C': 0.07744633224445484, 'gamma': 0.00021308864547284269, 'epsilon': 0.6736803500152916}. Best is trial 345 with value: 0.13438257115663557.
[I 2024-12-03 18:45:26,093] Trial 374 finished with value: 0.13711672122905713 and parameters: {'kernel': 'linear', 'C': 63.965222215690346, 'gamma': 0.031723750170233, 'epsilon': 0.04617542965465534}. Best is trial 345 with value: 0.13438257115663557.
[I 2024-12-03 18:45:27,268] Trial 410 finished with value: 1.1300712107047286 and parameters: {'kernel': 'sigmoid', 'C': 0.21972761288631776, 'gamma': 0.0004086590663973896, 'epsilon': 0.008043203857856868}. Best is trial 345 with value: 0.13438257115663557.
[I 2024-12-03 18:45:27,476] Trial 386 finished with value: 0.13530003770987237 and parameters: {'kernel': 'linear', 'C': 33.49689757516506, 'gamma': 0.0071104456337176755, 'epsilon': 0.06524189285567243}. Best is trial 345 with value: 0.13438257115663557.
[I 2024-12-03 18:45:28,414] Trial 411 finished with value: 0.22250309429500253 and parameters: {'kernel': 'linear', 'C': 0.13737991842099234, 'gamma': 0.002244462663449367, 'epsilon': 0.1142834964393624}. Best is trial 345 with value: 0.13438257115663557.
[I 2024-12-03 18:45:28,762] Trial 325 finished with value: 0.13800867899878475 and parameters: {'kernel': 'linear', 'C': 85.52323685777975, 'gamma': 0.08016620789712627, 'epsilon': 0.015289917671925536}. Best is trial 345 with value: 0.13438257115663557.
[I 2024-12-03 18:45:28,928] Trial 408 finished with value: 0.1376477965047982 and parameters: {'kernel': 'linear', 'C': 2.01633695097852, 'gamma': 0.008970000469629261, 'epsilon': 0.018275520537904114}. Best is trial 345 with value: 0.13438257115663557.
[I 2024-12-03 18:45:29,765] Trial 391 finished with value: 0.1413170288969277 and parameters: {'kernel': 'linear', 'C': 79.95576909739462, 'gamma': 0.003868217473532897, 'epsilon': 0.11358417112362523}. Best is trial 345 with value: 0.13438257115663557.
[I 2024-12-03 18:45:30,808] Trial 409 finished with value: 0.13589444504044582 and parameters: {'kernel': 'linear', 'C': 11.764229250995411, 'gamma': 0.014508844469378534, 'epsilon': 0.07173848080230903}. Best is trial 345 with value: 0.13438257115663557.
[I 2024-12-03 18:45:31,460] Trial 399 finished with value: 0.13523228765739456 and parameters: {'kernel': 'linear', 'C': 22.07714233611747, 'gamma': 0.0037559893890722635, 'epsilon': 0.06008333128101629}. Best is trial 345 with value: 0.13438257115663557.
[I 2024-12-03 18:45:32,336] Trial 418 finished with value: 0.39703603733254916 and parameters: {'kernel': 'rbf', 'C': 13.811723253186202, 'gamma': 0.00015452813911168964, 'epsilon': 0.4064655550369873}. Best is trial 345 with value: 0.13438257115663557.
[I 2024-12-03 18:45:33,464] Trial 412 finished with value: 0.1362443389046374 and parameters: {'kernel': 'linear', 'C': 19.33432956526763, 'gamma': 0.006879590736924315, 'epsilon': 0.07297698650074835}. Best is trial 345 with value: 0.13438257115663557.
[I 2024-12-03 18:45:33,543] Trial 419 finished with value: 0.17613002478330908 and parameters: {'kernel': 'rbf', 'C': 57.278210820083935, 'gamma': 0.010175079169309601, 'epsilon': 0.07504422086747316}. Best is trial 345 with value: 0.13438257115663557.
[I 2024-12-03 18:45:33,574] Trial 322 finished with value: 0.13573908896396863 and parameters: {'kernel': 'linear', 'C': 84.49528507070198, 'gamma': 0.3000049492539978, 'epsilon': 0.03625835520257381}. Best is trial 345 with value: 0.13438257115663557.
[I 2024-12-03 18:45:33,610] Trial 406 finished with value: 0.14592948697247712 and parameters: {'kernel': 'linear', 'C': 53.49185617885111, 'gamma': 0.00010672579204587126, 'epsilon': 0.12405933901998945}. Best is trial 345 with value: 0.13438257115663557.
