[I 2024-12-04 12:51:37,568] Trial 998 finished with value: 0.40874795650111223 and parameters: {'n_estimators': 1405, 'learning_rate': 0.013973579094920589, 'max_depth': 6, 'min_samples_split': 10, 'min_samples_leaf': 2, 'subsample': 0.8535897354701708, 'max_features': 'log2'}. Best is trial 784 with value: 0.199214954455861.
[I 2024-12-04 12:51:37,575] Trial 996 finished with value: 0.24864239641528457 and parameters: {'n_estimators': 1462, 'learning_rate': 0.09078616798115124, 'max_depth': 12, 'min_samples_split': 20, 'min_samples_leaf': 3, 'subsample': 0.6479497703345247, 'max_features': 'sqrt'}. Best is trial 784 with value: 0.199214954455861.
[I 2024-12-04 12:51:39,546] Trial 1000 finished with value: 0.21979010281125963 and parameters: {'n_estimators': 1282, 'learning_rate': 0.06924776387636518, 'max_depth': 12, 'min_samples_split': 12, 'min_samples_leaf': 1, 'subsample': 0.6002013770469113, 'max_features': 'sqrt'}. Best is trial 784 with value: 0.199214954455861.
[I 2024-12-04 12:51:44,126] Trial 1012 finished with value: 0.41477773461616824 and parameters: {'n_estimators': 870, 'learning_rate': 0.08115345330703883, 'max_depth': 10, 'min_samples_split': 20, 'min_samples_leaf': 8, 'subsample': 0.8819800217428506, 'max_features': 'log2'}. Best is trial 784 with value: 0.199214954455861.
[I 2024-12-04 12:51:48,226] Trial 1006 finished with value: 0.24134388082966396 and parameters: {'n_estimators': 1139, 'learning_rate': 0.0978512312045883, 'max_depth': 11, 'min_samples_split': 11, 'min_samples_leaf': 2, 'subsample': 0.7805997260911186, 'max_features': 'sqrt'}. Best is trial 784 with value: 0.199214954455861.
[I 2024-12-04 12:51:48,308] Trial 999 finished with value: 0.2161056660485108 and parameters: {'n_estimators': 1498, 'learning_rate': 0.057654159183011186, 'max_depth': 12, 'min_samples_split': 18, 'min_samples_leaf': 1, 'subsample': 0.6454367503766457, 'max_features': 'sqrt'}. Best is trial 784 with value: 0.199214954455861.
[I 2024-12-04 12:51:50,215] Trial 1008 finished with value: 0.21163920728844005 and parameters: {'n_estimators': 1214, 'learning_rate': 0.09560957546216023, 'max_depth': 12, 'min_samples_split': 16, 'min_samples_leaf': 1, 'subsample': 0.6728213979107663, 'max_features': 'sqrt'}. Best is trial 784 with value: 0.199214954455861.
[I 2024-12-04 12:51:53,620] Trial 1007 finished with value: 0.2307790227992941 and parameters: {'n_estimators': 1268, 'learning_rate': 0.07227016487872574, 'max_depth': 9, 'min_samples_split': 15, 'min_samples_leaf': 1, 'subsample': 0.6313441977352275, 'max_features': 'sqrt'}. Best is trial 784 with value: 0.199214954455861.
[I 2024-12-04 12:51:55,292] Trial 1001 finished with value: 0.24922742086080907 and parameters: {'n_estimators': 1469, 'learning_rate': 0.09859177641022884, 'max_depth': 10, 'min_samples_split': 15, 'min_samples_leaf': 2, 'subsample': 0.6873263006743643, 'max_features': 'sqrt'}. Best is trial 784 with value: 0.199214954455861.
[I 2024-12-04 12:51:55,295] Trial 1002 finished with value: 0.2500180574479854 and parameters: {'n_estimators': 1483, 'learning_rate': 0.05563498986564905, 'max_depth': 10, 'min_samples_split': 17, 'min_samples_leaf': 3, 'subsample': 0.6662000581480853, 'max_features': 'sqrt'}. Best is trial 784 with value: 0.199214954455861.
[I 2024-12-04 12:52:02,889] Trial 1018 finished with value: 0.21302383603098998 and parameters: {'n_estimators': 1087, 'learning_rate': 0.08923655174000593, 'max_depth': 10, 'min_samples_split': 18, 'min_samples_leaf': 1, 'subsample': 0.7491432199816439, 'max_features': 'sqrt'}. Best is trial 784 with value: 0.199214954455861.
[I 2024-12-04 12:52:05,297] Trial 1020 finished with value: 0.24201440549056913 and parameters: {'n_estimators': 1061, 'learning_rate': 0.08745595179984876, 'max_depth': 12, 'min_samples_split': 20, 'min_samples_leaf': 3, 'subsample': 0.7769264530536574, 'max_features': 'sqrt'}. Best is trial 784 with value: 0.199214954455861.
[I 2024-12-04 12:52:07,670] Trial 1011 finished with value: 0.2438396554082571 and parameters: {'n_estimators': 1478, 'learning_rate': 0.05036168611539026, 'max_depth': 12, 'min_samples_split': 19, 'min_samples_leaf': 2, 'subsample': 0.6253491921111101, 'max_features': 'sqrt'}. Best is trial 784 with value: 0.199214954455861.
[I 2024-12-04 12:52:09,709] Trial 1039 finished with value: 0.46719664917936937 and parameters: {'n_estimators': 225, 'learning_rate': 0.031723600439328994, 'max_depth': 5, 'min_samples_split': 6, 'min_samples_leaf': 2, 'subsample': 0.9827744439162909, 'max_features': 'sqrt'}. Best is trial 784 with value: 0.199214954455861.
[I 2024-12-04 12:52:10,576] Trial 1010 finished with value: 0.263585391970871 and parameters: {'n_estimators': 1473, 'learning_rate': 0.06999938505713671, 'max_depth': 8, 'min_samples_split': 11, 'min_samples_leaf': 3, 'subsample': 0.7324138703542562, 'max_features': 'sqrt'}. Best is trial 784 with value: 0.199214954455861.
[I 2024-12-04 12:52:12,315] Trial 1013 finished with value: 0.21691898703020748 and parameters: {'n_estimators': 1351, 'learning_rate': 0.09709544204324777, 'max_depth': 10, 'min_samples_split': 17, 'min_samples_leaf': 1, 'subsample': 0.6032207422176994, 'max_features': 'sqrt'}. Best is trial 784 with value: 0.199214954455861.
[I 2024-12-04 12:52:12,321] Trial 1009 finished with value: 0.22216546917155142 and parameters: {'n_estimators': 1456, 'learning_rate': 0.05831268212216019, 'max_depth': 12, 'min_samples_split': 14, 'min_samples_leaf': 1, 'subsample': 0.7360991297472042, 'max_features': 'sqrt'}. Best is trial 784 with value: 0.199214954455861.
[I 2024-12-04 12:52:15,663] Trial 1024 finished with value: 0.2235658980343342 and parameters: {'n_estimators': 988, 'learning_rate': 0.07427294612901336, 'max_depth': 12, 'min_samples_split': 15, 'min_samples_leaf': 1, 'subsample': 0.7820052570193163, 'max_features': 'sqrt'}. Best is trial 784 with value: 0.199214954455861.
[I 2024-12-04 12:52:21,013] Trial 1014 finished with value: 0.22440431998879437 and parameters: {'n_estimators': 1452, 'learning_rate': 0.07980667858526863, 'max_depth': 10, 'min_samples_split': 20, 'min_samples_leaf': 1, 'subsample': 0.6302136716157262, 'max_features': 'sqrt'}. Best is trial 784 with value: 0.199214954455861.
[I 2024-12-04 12:52:22,557] Trial 1017 finished with value: 0.3233084971224744 and parameters: {'n_estimators': 1315, 'learning_rate': 0.010503535465521505, 'max_depth': 6, 'min_samples_split': 18, 'min_samples_leaf': 4, 'subsample': 0.6278710280639135, 'max_features': None}. Best is trial 784 with value: 0.199214954455861.
[I 2024-12-04 12:52:22,559] Trial 1016 finished with value: 0.22560736329129635 and parameters: {'n_estimators': 1431, 'learning_rate': 0.07113760303653925, 'max_depth': 10, 'min_samples_split': 17, 'min_samples_leaf': 1, 'subsample': 0.7242996179658742, 'max_features': 'sqrt'}. Best is trial 784 with value: 0.199214954455861.
[I 2024-12-04 12:52:23,231] Trial 1015 finished with value: 0.23941941883038217 and parameters: {'n_estimators': 1481, 'learning_rate': 0.09320651147439243, 'max_depth': 11, 'min_samples_split': 20, 'min_samples_leaf': 2, 'subsample': 0.6307266569562457, 'max_features': 'sqrt'}. Best is trial 784 with value: 0.199214954455861.
[I 2024-12-04 12:52:26,451] Trial 1025 finished with value: 0.22272099845518722 and parameters: {'n_estimators': 1153, 'learning_rate': 0.06094105620909749, 'max_depth': 12, 'min_samples_split': 20, 'min_samples_leaf': 1, 'subsample': 0.6335354887778291, 'max_features': 'sqrt'}. Best is trial 784 with value: 0.199214954455861.
[I 2024-12-04 12:52:28,977] Trial 1019 finished with value: 0.2613102740892677 and parameters: {'n_estimators': 1489, 'learning_rate': 0.04963970115221639, 'max_depth': 9, 'min_samples_split': 18, 'min_samples_leaf': 1, 'subsample': 0.6233375971702894, 'max_features': 'log2'}. Best is trial 784 with value: 0.199214954455861.
[I 2024-12-04 12:52:29,921] Trial 1029 finished with value: 0.2370025066762778 and parameters: {'n_estimators': 1059, 'learning_rate': 0.08368624781682484, 'max_depth': 9, 'min_samples_split': 6, 'min_samples_leaf': 2, 'subsample': 0.6053714579955092, 'max_features': 'sqrt'}. Best is trial 784 with value: 0.199214954455861.
[I 2024-12-04 12:52:29,957] Trial 1047 finished with value: 0.9002702559413618 and parameters: {'n_estimators': 237, 'learning_rate': 0.010130819692986926, 'max_depth': 3, 'min_samples_split': 4, 'min_samples_leaf': 8, 'subsample': 0.8333822327781594, 'max_features': 'log2'}. Best is trial 784 with value: 0.199214954455861.
[I 2024-12-04 12:52:32,405] Trial 1028 finished with value: 0.35347641202182817 and parameters: {'n_estimators': 1193, 'learning_rate': 0.02747052307369488, 'max_depth': 5, 'min_samples_split': 13, 'min_samples_leaf': 2, 'subsample': 0.9843953747770406, 'max_features': 'log2'}. Best is trial 784 with value: 0.199214954455861.
[I 2024-12-04 12:52:33,766] Trial 1023 finished with value: 0.2393340665954193 and parameters: {'n_estimators': 1344, 'learning_rate': 0.06107327861012531, 'max_depth': 12, 'min_samples_split': 20, 'min_samples_leaf': 2, 'subsample': 0.70226262313535, 'max_features': 'sqrt'}. Best is trial 784 with value: 0.199214954455861.
[I 2024-12-04 12:52:34,978] Trial 1022 finished with value: 0.23637321870925762 and parameters: {'n_estimators': 1436, 'learning_rate': 0.0898230589319094, 'max_depth': 12, 'min_samples_split': 17, 'min_samples_leaf': 2, 'subsample': 0.611899036869478, 'max_features': 'sqrt'}. Best is trial 784 with value: 0.199214954455861.
[I 2024-12-04 12:52:41,143] Trial 1035 finished with value: 0.24188556325782537 and parameters: {'n_estimators': 916, 'learning_rate': 0.09657778642145318, 'max_depth': 11, 'min_samples_split': 18, 'min_samples_leaf': 1, 'subsample': 0.7893970602856473, 'max_features': 'sqrt'}. Best is trial 784 with value: 0.199214954455861.
[I 2024-12-04 12:52:41,191] Trial 1026 finished with value: 0.22841123185211495 and parameters: {'n_estimators': 1405, 'learning_rate': 0.06984801807926631, 'max_depth': 10, 'min_samples_split': 12, 'min_samples_leaf': 1, 'subsample': 0.694511886208985, 'max_features': 'sqrt'}. Best is trial 784 with value: 0.199214954455861.
[I 2024-12-04 12:52:43,140] Trial 1030 finished with value: 0.24559072117613995 and parameters: {'n_estimators': 1307, 'learning_rate': 0.09679295427913256, 'max_depth': 10, 'min_samples_split': 20, 'min_samples_leaf': 3, 'subsample': 0.6391125152332445, 'max_features': 'sqrt'}. Best is trial 784 with value: 0.199214954455861.
[I 2024-12-04 12:52:43,273] Trial 1027 finished with value: 0.2665744707913391 and parameters: {'n_estimators': 1310, 'learning_rate': 0.08529808190720121, 'max_depth': 8, 'min_samples_split': 15, 'min_samples_leaf': 1, 'subsample': 0.6347138110547632, 'max_features': None}. Best is trial 784 with value: 0.199214954455861.
[I 2024-12-04 12:52:44,922] Trial 1032 finished with value: 0.22365100422972517 and parameters: {'n_estimators': 1144, 'learning_rate': 0.09269454038463708, 'max_depth': 11, 'min_samples_split': 20, 'min_samples_leaf': 1, 'subsample': 0.6363862381666487, 'max_features': 'sqrt'}. Best is trial 784 with value: 0.199214954455861.
[I 2024-12-04 12:52:52,468] Trial 1040 finished with value: 0.2196921278110857 and parameters: {'n_estimators': 1009, 'learning_rate': 0.09013298499351291, 'max_depth': 12, 'min_samples_split': 17, 'min_samples_leaf': 1, 'subsample': 0.6696077698200945, 'max_features': 'sqrt'}. Best is trial 784 with value: 0.199214954455861.
[I 2024-12-04 12:52:56,097] Trial 1043 finished with value: 0.23051035165286518 and parameters: {'n_estimators': 1001, 'learning_rate': 0.05730274728803727, 'max_depth': 12, 'min_samples_split': 15, 'min_samples_leaf': 1, 'subsample': 0.7024364309957439, 'max_features': 'sqrt'}. Best is trial 784 with value: 0.199214954455861.
[I 2024-12-04 12:53:00,902] Trial 1037 finished with value: 0.219900671684132 and parameters: {'n_estimators': 1330, 'learning_rate': 0.09413621485019838, 'max_depth': 11, 'min_samples_split': 18, 'min_samples_leaf': 1, 'subsample': 0.6188056213580454, 'max_features': 'sqrt'}. Best is trial 784 with value: 0.199214954455861.
[I 2024-12-04 12:53:01,673] Trial 1049 finished with value: 0.3175710960373302 and parameters: {'n_estimators': 717, 'learning_rate': 0.017827438958726582, 'max_depth': 6, 'min_samples_split': 15, 'min_samples_leaf': 2, 'subsample': 0.9849550018269774, 'max_features': None}. Best is trial 784 with value: 0.199214954455861.
[I 2024-12-04 12:53:03,346] Trial 1042 finished with value: 0.21368413880257822 and parameters: {'n_estimators': 1144, 'learning_rate': 0.09984997986903824, 'max_depth': 11, 'min_samples_split': 20, 'min_samples_leaf': 1, 'subsample': 0.6612982807648338, 'max_features': 'sqrt'}. Best is trial 784 with value: 0.199214954455861.
[I 2024-12-04 12:53:04,473] Trial 1034 finished with value: 0.21680677877665905 and parameters: {'n_estimators': 1429, 'learning_rate': 0.06822929241353773, 'max_depth': 12, 'min_samples_split': 20, 'min_samples_leaf': 1, 'subsample': 0.6549318196757777, 'max_features': 'sqrt'}. Best is trial 784 with value: 0.199214954455861.
[I 2024-12-04 12:53:04,738] Trial 1041 finished with value: 0.24613445726942676 and parameters: {'n_estimators': 1191, 'learning_rate': 0.09733300686395976, 'max_depth': 9, 'min_samples_split': 15, 'min_samples_leaf': 2, 'subsample': 0.6027747017679808, 'max_features': 'sqrt'}. Best is trial 784 with value: 0.199214954455861.
[I 2024-12-04 12:53:09,676] Trial 1033 finished with value: 0.31594470976332456 and parameters: {'n_estimators': 1466, 'learning_rate': 0.0180142053023663, 'max_depth': 4, 'min_samples_split': 12, 'min_samples_leaf': 1, 'subsample': 0.942325023112246, 'max_features': None}. Best is trial 784 with value: 0.199214954455861.
[I 2024-12-04 12:53:10,598] Trial 1036 finished with value: 0.21306033763768828 and parameters: {'n_estimators': 1492, 'learning_rate': 0.06874458208484786, 'max_depth': 12, 'min_samples_split': 19, 'min_samples_leaf': 1, 'subsample': 0.6175229193755645, 'max_features': 'sqrt'}. Best is trial 784 with value: 0.199214954455861.
[I 2024-12-04 12:53:14,055] Trial 1046 finished with value: 0.22208548002348258 and parameters: {'n_estimators': 1167, 'learning_rate': 0.07887138663254971, 'max_depth': 12, 'min_samples_split': 20, 'min_samples_leaf': 1, 'subsample': 0.6313992717880625, 'max_features': 'sqrt'}. Best is trial 784 with value: 0.199214954455861.
[I 2024-12-04 12:53:15,712] Trial 1038 finished with value: 0.21048544889319293 and parameters: {'n_estimators': 1488, 'learning_rate': 0.08592053413744904, 'max_depth': 11, 'min_samples_split': 19, 'min_samples_leaf': 1, 'subsample': 0.6956420973202759, 'max_features': 'sqrt'}. Best is trial 784 with value: 0.199214954455861.
[I 2024-12-04 12:53:16,414] Trial 1045 finished with value: 0.2205476772124477 and parameters: {'n_estimators': 1266, 'learning_rate': 0.09957935009409341, 'max_depth': 10, 'min_samples_split': 19, 'min_samples_leaf': 1, 'subsample': 0.634196446479986, 'max_features': 'sqrt'}. Best is trial 784 with value: 0.199214954455861.
[I 2024-12-04 12:53:17,840] Trial 1048 finished with value: 0.24709948704971454 and parameters: {'n_estimators': 1119, 'learning_rate': 0.09063931164012992, 'max_depth': 10, 'min_samples_split': 18, 'min_samples_leaf': 3, 'subsample': 0.6728354033538095, 'max_features': 'sqrt'}. Best is trial 784 with value: 0.199214954455861.
[I 2024-12-04 12:53:22,614] Trial 1044 finished with value: 0.3689049203806002 and parameters: {'n_estimators': 1240, 'learning_rate': 0.08765107112873204, 'max_depth': 12, 'min_samples_split': 4, 'min_samples_leaf': 7, 'subsample': 0.9873796343644349, 'max_features': None}. Best is trial 784 with value: 0.199214954455861.
[I 2024-12-04 12:53:26,251] Trial 1053 finished with value: 0.23849000419384925 and parameters: {'n_estimators': 1115, 'learning_rate': 0.05881049132692993, 'max_depth': 10, 'min_samples_split': 16, 'min_samples_leaf': 1, 'subsample': 0.6813281006761727, 'max_features': 'sqrt'}. Best is trial 784 with value: 0.199214954455861.
[I 2024-12-04 12:53:28,432] Trial 1054 finished with value: 0.23767473131601435 and parameters: {'n_estimators': 1091, 'learning_rate': 0.06917212134462114, 'max_depth': 9, 'min_samples_split': 12, 'min_samples_leaf': 1, 'subsample': 0.735802030198136, 'max_features': 'sqrt'}. Best is trial 784 with value: 0.199214954455861.
[I 2024-12-04 12:53:30,860] Trial 1080 finished with value: 0.6506837040650102 and parameters: {'n_estimators': 141, 'learning_rate': 0.031822720672150015, 'max_depth': 10, 'min_samples_split': 19, 'min_samples_leaf': 3, 'subsample': 0.6950034683587227, 'max_features': 'log2'}. Best is trial 784 with value: 0.199214954455861.
[I 2024-12-04 12:53:32,668] Trial 1051 finished with value: 0.28392987096466143 and parameters: {'n_estimators': 1211, 'learning_rate': 0.093085270130802, 'max_depth': 8, 'min_samples_split': 20, 'min_samples_leaf': 3, 'subsample': 0.6374944199200094, 'max_features': None}. Best is trial 784 with value: 0.199214954455861.
[I 2024-12-04 12:53:36,913] Trial 1050 finished with value: 0.24638595703913202 and parameters: {'n_estimators': 1447, 'learning_rate': 0.09920091627055397, 'max_depth': 8, 'min_samples_split': 14, 'min_samples_leaf': 2, 'subsample': 0.6910813690455935, 'max_features': 'sqrt'}. Best is trial 784 with value: 0.199214954455861.
[I 2024-12-04 12:53:39,042] Trial 1052 finished with value: 0.2076178617612352 and parameters: {'n_estimators': 1386, 'learning_rate': 0.0945013410929348, 'max_depth': 10, 'min_samples_split': 20, 'min_samples_leaf': 1, 'subsample': 0.6410155807362418, 'max_features': 'sqrt'}. Best is trial 784 with value: 0.199214954455861.
[I 2024-12-04 12:53:43,245] Trial 1055 finished with value: 0.2176667057946028 and parameters: {'n_estimators': 1385, 'learning_rate': 0.0888484006533893, 'max_depth': 10, 'min_samples_split': 20, 'min_samples_leaf': 1, 'subsample': 0.6217481891436407, 'max_features': 'sqrt'}. Best is trial 784 with value: 0.199214954455861.
[I 2024-12-04 12:53:45,397] Trial 1060 finished with value: 0.3200669384260907 and parameters: {'n_estimators': 1173, 'learning_rate': 0.08145204728362897, 'max_depth': 12, 'min_samples_split': 20, 'min_samples_leaf': 6, 'subsample': 0.6379664249515049, 'max_features': 'sqrt'}. Best is trial 784 with value: 0.199214954455861.
[I 2024-12-04 12:53:48,018] Trial 1067 finished with value: 0.3527799982461049 and parameters: {'n_estimators': 999, 'learning_rate': 0.029266278810090363, 'max_depth': 8, 'min_samples_split': 6, 'min_samples_leaf': 6, 'subsample': 0.6594339042011158, 'max_features': 'sqrt'}. Best is trial 784 with value: 0.199214954455861.
[I 2024-12-04 12:53:48,688] Trial 1056 finished with value: 0.2453570798014722 and parameters: {'n_estimators': 1357, 'learning_rate': 0.0996961721956276, 'max_depth': 10, 'min_samples_split': 16, 'min_samples_leaf': 2, 'subsample': 0.6679296328108209, 'max_features': 'sqrt'}. Best is trial 784 with value: 0.199214954455861.
[I 2024-12-04 12:53:49,729] Trial 1058 finished with value: 0.597900714913345 and parameters: {'n_estimators': 1345, 'learning_rate': 0.013948094117730358, 'max_depth': 9, 'min_samples_split': 12, 'min_samples_leaf': 9, 'subsample': 0.8804789044370046, 'max_features': 'log2'}. Best is trial 784 with value: 0.199214954455861.
[I 2024-12-04 12:53:54,140] Trial 1061 finished with value: 0.22298120162433832 and parameters: {'n_estimators': 1254, 'learning_rate': 0.06653353933344425, 'max_depth': 11, 'min_samples_split': 16, 'min_samples_leaf': 1, 'subsample': 0.7099118250267333, 'max_features': 'sqrt'}. Best is trial 784 with value: 0.199214954455861.
[I 2024-12-04 12:53:58,444] Trial 1064 finished with value: 0.22951664536591138 and parameters: {'n_estimators': 1233, 'learning_rate': 0.09782220163375191, 'max_depth': 8, 'min_samples_split': 8, 'min_samples_leaf': 1, 'subsample': 0.6943351009277513, 'max_features': 'sqrt'}. Best is trial 784 with value: 0.199214954455861.
[I 2024-12-04 12:53:59,522] Trial 1057 finished with value: 0.22587070270938198 and parameters: {'n_estimators': 1459, 'learning_rate': 0.0733067345756555, 'max_depth': 10, 'min_samples_split': 16, 'min_samples_leaf': 1, 'subsample': 0.6656146552345203, 'max_features': 'sqrt'}. Best is trial 784 with value: 0.199214954455861.
[I 2024-12-04 12:54:00,499] Trial 1065 finished with value: 0.23913598064135674 and parameters: {'n_estimators': 1203, 'learning_rate': 0.09638423128200399, 'max_depth': 10, 'min_samples_split': 20, 'min_samples_leaf': 2, 'subsample': 0.713966091854556, 'max_features': 'sqrt'}. Best is trial 784 with value: 0.199214954455861.
[I 2024-12-04 12:54:04,598] Trial 1059 finished with value: 0.25004258498804866 and parameters: {'n_estimators': 1349, 'learning_rate': 0.06531687010799568, 'max_depth': 10, 'min_samples_split': 20, 'min_samples_leaf': 1, 'subsample': 0.642457622691995, 'max_features': None}. Best is trial 784 with value: 0.199214954455861.
[I 2024-12-04 12:54:06,595] Trial 1068 finished with value: 0.2601238447500497 and parameters: {'n_estimators': 1248, 'learning_rate': 0.049853251545539795, 'max_depth': 10, 'min_samples_split': 15, 'min_samples_leaf': 3, 'subsample': 0.6050732726288146, 'max_features': 'sqrt'}. Best is trial 784 with value: 0.199214954455861.
[I 2024-12-04 12:54:09,115] Trial 1071 finished with value: 0.22208430269581272 and parameters: {'n_estimators': 1060, 'learning_rate': 0.07275899763015782, 'max_depth': 12, 'min_samples_split': 16, 'min_samples_leaf': 1, 'subsample': 0.7091737020036024, 'max_features': 'sqrt'}. Best is trial 784 with value: 0.199214954455861.
[I 2024-12-04 12:54:10,537] Trial 1062 finished with value: 0.2512562829635039 and parameters: {'n_estimators': 1497, 'learning_rate': 0.09292780248211968, 'max_depth': 10, 'min_samples_split': 12, 'min_samples_leaf': 3, 'subsample': 0.7762851196546237, 'max_features': 'sqrt'}. Best is trial 784 with value: 0.199214954455861.
