[I 2024-12-04 12:11:49,633] Trial 1285 finished with value: 0.575378964299127 and parameters: {'n_estimators': 495, 'max_depth': 35, 'min_samples_split': 2, 'min_samples_leaf': 3, 'max_features': 'sqrt', 'bootstrap': True, 'criterion': 'absolute_error'}. Best is trial 341 with value: 0.2909369124469028.
[I 2024-12-04 12:11:51,479] Trial 1299 finished with value: 0.29545966943218566 and parameters: {'n_estimators': 341, 'max_depth': 50, 'min_samples_split': 3, 'min_samples_leaf': 1, 'max_features': 'sqrt', 'bootstrap': False, 'criterion': 'squared_error'}. Best is trial 341 with value: 0.2909369124469028.
[I 2024-12-04 12:11:52,114] Trial 1294 finished with value: 0.3048834375150432 and parameters: {'n_estimators': 414, 'max_depth': 44, 'min_samples_split': 2, 'min_samples_leaf': 1, 'max_features': 'sqrt', 'bootstrap': False, 'criterion': 'squared_error'}. Best is trial 341 with value: 0.2909369124469028.
[I 2024-12-04 12:11:52,722] Trial 1304 finished with value: 0.4415367141281404 and parameters: {'n_estimators': 705, 'max_depth': 50, 'min_samples_split': 6, 'min_samples_leaf': 2, 'max_features': 'sqrt', 'bootstrap': False, 'criterion': 'squared_error'}. Best is trial 341 with value: 0.2909369124469028.
[I 2024-12-04 12:11:52,754] Trial 1289 finished with value: 0.3039058212718795 and parameters: {'n_estimators': 201, 'max_depth': 50, 'min_samples_split': 5, 'min_samples_leaf': 1, 'max_features': 'sqrt', 'bootstrap': False, 'criterion': 'squared_error'}. Best is trial 341 with value: 0.2909369124469028.
[I 2024-12-04 12:11:52,912] Trial 1301 finished with value: 0.4156476876638921 and parameters: {'n_estimators': 208, 'max_depth': 23, 'min_samples_split': 10, 'min_samples_leaf': 4, 'max_features': None, 'bootstrap': False, 'criterion': 'squared_error'}. Best is trial 341 with value: 0.2909369124469028.
[I 2024-12-04 12:11:52,932] Trial 1303 finished with value: 0.443860222694146 and parameters: {'n_estimators': 107, 'max_depth': 44, 'min_samples_split': 2, 'min_samples_leaf': 2, 'max_features': 'sqrt', 'bootstrap': False, 'criterion': 'squared_error'}. Best is trial 341 with value: 0.2909369124469028.
[I 2024-12-04 12:11:53,670] Trial 1298 finished with value: 0.442405972480215 and parameters: {'n_estimators': 382, 'max_depth': 43, 'min_samples_split': 4, 'min_samples_leaf': 2, 'max_features': 'sqrt', 'bootstrap': False, 'criterion': 'squared_error'}. Best is trial 341 with value: 0.2909369124469028.
[I 2024-12-04 12:11:53,726] Trial 1302 finished with value: 0.2981110802601833 and parameters: {'n_estimators': 353, 'max_depth': 50, 'min_samples_split': 2, 'min_samples_leaf': 1, 'max_features': 'sqrt', 'bootstrap': False, 'criterion': 'squared_error'}. Best is trial 341 with value: 0.2909369124469028.
[I 2024-12-04 12:11:54,739] Trial 1311 finished with value: 0.3067828278416825 and parameters: {'n_estimators': 274, 'max_depth': 43, 'min_samples_split': 4, 'min_samples_leaf': 1, 'max_features': 'sqrt', 'bootstrap': False, 'criterion': 'squared_error'}. Best is trial 341 with value: 0.2909369124469028.
[I 2024-12-04 12:11:54,973] Trial 1295 finished with value: 0.2990061032575708 and parameters: {'n_estimators': 412, 'max_depth': 50, 'min_samples_split': 2, 'min_samples_leaf': 1, 'max_features': 'sqrt', 'bootstrap': False, 'criterion': 'squared_error'}. Best is trial 341 with value: 0.2909369124469028.
[I 2024-12-04 12:11:54,985] Trial 1306 finished with value: 0.41465543236037455 and parameters: {'n_estimators': 247, 'max_depth': 31, 'min_samples_split': 13, 'min_samples_leaf': 4, 'max_features': None, 'bootstrap': False, 'criterion': 'squared_error'}. Best is trial 341 with value: 0.2909369124469028.
[I 2024-12-04 12:11:55,377] Trial 1275 finished with value: 0.46018160538045355 and parameters: {'n_estimators': 691, 'max_depth': 47, 'min_samples_split': 5, 'min_samples_leaf': 2, 'max_features': 'sqrt', 'bootstrap': False, 'criterion': 'absolute_error'}. Best is trial 341 with value: 0.2909369124469028.
[I 2024-12-04 12:11:56,191] Trial 1293 finished with value: 0.30149854668025167 and parameters: {'n_estimators': 288, 'max_depth': 46, 'min_samples_split': 2, 'min_samples_leaf': 1, 'max_features': 'sqrt', 'bootstrap': False, 'criterion': 'squared_error'}. Best is trial 341 with value: 0.2909369124469028.
[I 2024-12-04 12:11:56,744] Trial 1307 finished with value: 0.6557862740436647 and parameters: {'n_estimators': 766, 'max_depth': 49, 'min_samples_split': 2, 'min_samples_leaf': 4, 'max_features': 'sqrt', 'bootstrap': True, 'criterion': 'squared_error'}. Best is trial 341 with value: 0.2909369124469028.
[I 2024-12-04 12:11:57,025] Trial 1300 finished with value: 0.32023055760363933 and parameters: {'n_estimators': 586, 'max_depth': 40, 'min_samples_split': 5, 'min_samples_leaf': 1, 'max_features': 'sqrt', 'bootstrap': False, 'criterion': 'squared_error'}. Best is trial 341 with value: 0.2909369124469028.
[I 2024-12-04 12:11:57,275] Trial 1310 finished with value: 0.6817389012237102 and parameters: {'n_estimators': 856, 'max_depth': 13, 'min_samples_split': 6, 'min_samples_leaf': 4, 'max_features': 'sqrt', 'bootstrap': True, 'criterion': 'squared_error'}. Best is trial 341 with value: 0.2909369124469028.
[I 2024-12-04 12:11:57,947] Trial 1312 finished with value: 0.3031506660968053 and parameters: {'n_estimators': 151, 'max_depth': 43, 'min_samples_split': 4, 'min_samples_leaf': 1, 'max_features': 'sqrt', 'bootstrap': False, 'criterion': 'squared_error'}. Best is trial 341 with value: 0.2909369124469028.
[I 2024-12-04 12:12:00,174] Trial 1309 finished with value: 0.9656264267476322 and parameters: {'n_estimators': 945, 'max_depth': 49, 'min_samples_split': 3, 'min_samples_leaf': 11, 'max_features': 'log2', 'bootstrap': True, 'criterion': 'absolute_error'}. Best is trial 341 with value: 0.2909369124469028.
[I 2024-12-04 12:12:00,187] Trial 1317 finished with value: 0.3002270602759114 and parameters: {'n_estimators': 103, 'max_depth': 44, 'min_samples_split': 2, 'min_samples_leaf': 1, 'max_features': 'sqrt', 'bootstrap': False, 'criterion': 'squared_error'}. Best is trial 341 with value: 0.2909369124469028.
[I 2024-12-04 12:12:00,420] Trial 1315 finished with value: 0.30553538265721164 and parameters: {'n_estimators': 174, 'max_depth': 42, 'min_samples_split': 2, 'min_samples_leaf': 1, 'max_features': 'sqrt', 'bootstrap': False, 'criterion': 'squared_error'}. Best is trial 341 with value: 0.2909369124469028.
[I 2024-12-04 12:12:00,960] Trial 1313 finished with value: 0.3047682650345752 and parameters: {'n_estimators': 264, 'max_depth': 46, 'min_samples_split': 4, 'min_samples_leaf': 1, 'max_features': 'sqrt', 'bootstrap': False, 'criterion': 'squared_error'}. Best is trial 341 with value: 0.2909369124469028.
[I 2024-12-04 12:12:01,578] Trial 1319 finished with value: 0.292801940723135 and parameters: {'n_estimators': 161, 'max_depth': 50, 'min_samples_split': 3, 'min_samples_leaf': 1, 'max_features': 'sqrt', 'bootstrap': False, 'criterion': 'squared_error'}. Best is trial 341 with value: 0.2909369124469028.
[I 2024-12-04 12:12:05,698] Trial 1282 finished with value: 0.3413393952086017 and parameters: {'n_estimators': 666, 'max_depth': 35, 'min_samples_split': 3, 'min_samples_leaf': 1, 'max_features': 'sqrt', 'bootstrap': False, 'criterion': 'absolute_error'}. Best is trial 341 with value: 0.2909369124469028.
[I 2024-12-04 12:12:05,700] Trial 1314 finished with value: 0.3014854232362544 and parameters: {'n_estimators': 723, 'max_depth': 50, 'min_samples_split': 4, 'min_samples_leaf': 1, 'max_features': 'sqrt', 'bootstrap': False, 'criterion': 'squared_error'}. Best is trial 341 with value: 0.2909369124469028.
[I 2024-12-04 12:12:05,918] Trial 1308 finished with value: 0.3872500101208962 and parameters: {'n_estimators': 606, 'max_depth': 41, 'min_samples_split': 5, 'min_samples_leaf': 1, 'max_features': None, 'bootstrap': False, 'criterion': 'squared_error'}. Best is trial 341 with value: 0.2909369124469028.
[I 2024-12-04 12:12:07,401] Trial 1316 finished with value: 0.2945693169100144 and parameters: {'n_estimators': 283, 'max_depth': 50, 'min_samples_split': 3, 'min_samples_leaf': 1, 'max_features': 'sqrt', 'bootstrap': False, 'criterion': 'squared_error'}. Best is trial 341 with value: 0.2909369124469028.
[I 2024-12-04 12:12:07,580] Trial 1325 finished with value: 0.4445852233841786 and parameters: {'n_estimators': 259, 'max_depth': 45, 'min_samples_split': 3, 'min_samples_leaf': 2, 'max_features': 'sqrt', 'bootstrap': False, 'criterion': 'squared_error'}. Best is trial 341 with value: 0.2909369124469028.
[I 2024-12-04 12:12:07,885] Trial 1328 finished with value: 0.4430615202095374 and parameters: {'n_estimators': 241, 'max_depth': 50, 'min_samples_split': 5, 'min_samples_leaf': 2, 'max_features': 'sqrt', 'bootstrap': False, 'criterion': 'squared_error'}. Best is trial 341 with value: 0.2909369124469028.
[I 2024-12-04 12:12:07,893] Trial 1321 finished with value: 0.3101409768313834 and parameters: {'n_estimators': 676, 'max_depth': 42, 'min_samples_split': 2, 'min_samples_leaf': 1, 'max_features': 'sqrt', 'bootstrap': False, 'criterion': 'squared_error'}. Best is trial 341 with value: 0.2909369124469028.
[I 2024-12-04 12:12:10,100] Trial 1320 finished with value: 0.3165216195432802 and parameters: {'n_estimators': 451, 'max_depth': 49, 'min_samples_split': 3, 'min_samples_leaf': 1, 'max_features': 'sqrt', 'bootstrap': True, 'criterion': 'squared_error'}. Best is trial 341 with value: 0.2909369124469028.
[I 2024-12-04 12:12:10,426] Trial 1324 finished with value: 0.7863903056726773 and parameters: {'n_estimators': 694, 'max_depth': 49, 'min_samples_split': 4, 'min_samples_leaf': 2, 'max_features': 'log2', 'bootstrap': True, 'criterion': 'squared_error'}. Best is trial 341 with value: 0.2909369124469028.
[I 2024-12-04 12:12:11,494] Trial 1318 finished with value: 0.306388499029718 and parameters: {'n_estimators': 364, 'max_depth': 44, 'min_samples_split': 4, 'min_samples_leaf': 1, 'max_features': 'sqrt', 'bootstrap': False, 'criterion': 'squared_error'}. Best is trial 341 with value: 0.2909369124469028.
[I 2024-12-04 12:12:13,283] Trial 1329 finished with value: 0.4414646401438528 and parameters: {'n_estimators': 667, 'max_depth': 50, 'min_samples_split': 2, 'min_samples_leaf': 2, 'max_features': 'sqrt', 'bootstrap': False, 'criterion': 'squared_error'}. Best is trial 341 with value: 0.2909369124469028.
[I 2024-12-04 12:12:13,799] Trial 1327 finished with value: 0.3005580454974927 and parameters: {'n_estimators': 400, 'max_depth': 44, 'min_samples_split': 3, 'min_samples_leaf': 1, 'max_features': 'sqrt', 'bootstrap': False, 'criterion': 'squared_error'}. Best is trial 341 with value: 0.2909369124469028.
[I 2024-12-04 12:12:13,847] Trial 1331 finished with value: 0.29941194104638025 and parameters: {'n_estimators': 236, 'max_depth': 50, 'min_samples_split': 2, 'min_samples_leaf': 1, 'max_features': 'sqrt', 'bootstrap': False, 'criterion': 'squared_error'}. Best is trial 341 with value: 0.2909369124469028.
[I 2024-12-04 12:12:14,147] Trial 1334 finished with value: 0.6794743467828334 and parameters: {'n_estimators': 146, 'max_depth': 49, 'min_samples_split': 5, 'min_samples_leaf': 6, 'max_features': 'sqrt', 'bootstrap': False, 'criterion': 'absolute_error'}. Best is trial 341 with value: 0.2909369124469028.
[I 2024-12-04 12:12:14,149] Trial 1337 finished with value: 0.2935604999960715 and parameters: {'n_estimators': 521, 'max_depth': 50, 'min_samples_split': 3, 'min_samples_leaf': 1, 'max_features': 'sqrt', 'bootstrap': False, 'criterion': 'squared_error'}. Best is trial 341 with value: 0.2909369124469028.
[I 2024-12-04 12:12:14,732] Trial 1330 finished with value: 0.3023287174383825 and parameters: {'n_estimators': 246, 'max_depth': 42, 'min_samples_split': 3, 'min_samples_leaf': 1, 'max_features': 'sqrt', 'bootstrap': False, 'criterion': 'squared_error'}. Best is trial 341 with value: 0.2909369124469028.
[I 2024-12-04 12:12:14,766] Trial 1333 finished with value: 0.44353964471854174 and parameters: {'n_estimators': 209, 'max_depth': 50, 'min_samples_split': 3, 'min_samples_leaf': 2, 'max_features': 'sqrt', 'bootstrap': False, 'criterion': 'squared_error'}. Best is trial 341 with value: 0.2909369124469028.
[I 2024-12-04 12:12:15,959] Trial 1323 finished with value: 0.3158505844130875 and parameters: {'n_estimators': 138, 'max_depth': 43, 'min_samples_split': 5, 'min_samples_leaf': 1, 'max_features': 'sqrt', 'bootstrap': False, 'criterion': 'squared_error'}. Best is trial 341 with value: 0.2909369124469028.
[I 2024-12-04 12:12:16,017] Trial 1322 finished with value: 0.44004852313000287 and parameters: {'n_estimators': 498, 'max_depth': 49, 'min_samples_split': 2, 'min_samples_leaf': 2, 'max_features': 'sqrt', 'bootstrap': False, 'criterion': 'squared_error'}. Best is trial 341 with value: 0.2909369124469028.
[I 2024-12-04 12:12:16,412] Trial 1335 finished with value: 0.3124382427064511 and parameters: {'n_estimators': 104, 'max_depth': 50, 'min_samples_split': 7, 'min_samples_leaf': 1, 'max_features': 'sqrt', 'bootstrap': False, 'criterion': 'squared_error'}. Best is trial 341 with value: 0.2909369124469028.
[I 2024-12-04 12:12:17,825] Trial 1340 finished with value: 0.3060113199870219 and parameters: {'n_estimators': 608, 'max_depth': 50, 'min_samples_split': 6, 'min_samples_leaf': 1, 'max_features': 'sqrt', 'bootstrap': False, 'criterion': 'squared_error'}. Best is trial 341 with value: 0.2909369124469028.
[I 2024-12-04 12:12:17,832] Trial 1338 finished with value: 0.3048786926138688 and parameters: {'n_estimators': 557, 'max_depth': 41, 'min_samples_split': 3, 'min_samples_leaf': 1, 'max_features': 'sqrt', 'bootstrap': False, 'criterion': 'squared_error'}. Best is trial 341 with value: 0.2909369124469028.
[I 2024-12-04 12:12:19,146] Trial 1336 finished with value: 0.7042683707445626 and parameters: {'n_estimators': 646, 'max_depth': 11, 'min_samples_split': 26, 'min_samples_leaf': 4, 'max_features': 'sqrt', 'bootstrap': True, 'criterion': 'squared_error'}. Best is trial 341 with value: 0.2909369124469028.
[I 2024-12-04 12:12:20,787] Trial 1326 finished with value: 0.5065259550778815 and parameters: {'n_estimators': 830, 'max_depth': 10, 'min_samples_split': 15, 'min_samples_leaf': 13, 'max_features': None, 'bootstrap': False, 'criterion': 'squared_error'}. Best is trial 341 with value: 0.2909369124469028.
[I 2024-12-04 12:12:22,692] Trial 1341 finished with value: 0.8415924148610189 and parameters: {'n_estimators': 231, 'max_depth': 14, 'min_samples_split': 16, 'min_samples_leaf': 8, 'max_features': 'sqrt', 'bootstrap': True, 'criterion': 'squared_error'}. Best is trial 341 with value: 0.2909369124469028.
[I 2024-12-04 12:12:23,729] Trial 1342 finished with value: 0.3000302198566988 and parameters: {'n_estimators': 513, 'max_depth': 50, 'min_samples_split': 4, 'min_samples_leaf': 1, 'max_features': 'sqrt', 'bootstrap': False, 'criterion': 'squared_error'}. Best is trial 341 with value: 0.2909369124469028.
[I 2024-12-04 12:12:24,126] Trial 1343 finished with value: 0.2984004528357839 and parameters: {'n_estimators': 158, 'max_depth': 50, 'min_samples_split': 4, 'min_samples_leaf': 1, 'max_features': 'sqrt', 'bootstrap': False, 'criterion': 'squared_error'}. Best is trial 341 with value: 0.2909369124469028.
[I 2024-12-04 12:12:24,372] Trial 1347 finished with value: 0.38319534352697937 and parameters: {'n_estimators': 161, 'max_depth': 32, 'min_samples_split': 3, 'min_samples_leaf': 1, 'max_features': None, 'bootstrap': False, 'criterion': 'squared_error'}. Best is trial 341 with value: 0.2909369124469028.
[I 2024-12-04 12:12:24,625] Trial 1352 finished with value: 0.9598701769145284 and parameters: {'n_estimators': 616, 'max_depth': 28, 'min_samples_split': 14, 'min_samples_leaf': 15, 'max_features': 'log2', 'bootstrap': False, 'criterion': 'squared_error'}. Best is trial 341 with value: 0.2909369124469028.
[I 2024-12-04 12:12:27,994] Trial 1353 finished with value: 0.30147280271360927 and parameters: {'n_estimators': 374, 'max_depth': 43, 'min_samples_split': 3, 'min_samples_leaf': 1, 'max_features': 'sqrt', 'bootstrap': False, 'criterion': 'squared_error'}. Best is trial 341 with value: 0.2909369124469028.
[I 2024-12-04 12:12:28,175] Trial 1332 finished with value: 0.40544333096483054 and parameters: {'n_estimators': 305, 'max_depth': 47, 'min_samples_split': 5, 'min_samples_leaf': 1, 'max_features': 'log2', 'bootstrap': False, 'criterion': 'squared_error'}. Best is trial 341 with value: 0.2909369124469028.
[I 2024-12-04 12:12:29,451] Trial 1344 finished with value: 0.794688534587463 and parameters: {'n_estimators': 785, 'max_depth': 6, 'min_samples_split': 2, 'min_samples_leaf': 7, 'max_features': 'sqrt', 'bootstrap': False, 'criterion': 'squared_error'}. Best is trial 341 with value: 0.2909369124469028.
[I 2024-12-04 12:12:29,590] Trial 1346 finished with value: 0.2983297528055089 and parameters: {'n_estimators': 528, 'max_depth': 50, 'min_samples_split': 2, 'min_samples_leaf': 1, 'max_features': 'sqrt', 'bootstrap': False, 'criterion': 'squared_error'}. Best is trial 341 with value: 0.2909369124469028.
[I 2024-12-04 12:12:31,016] Trial 1345 finished with value: 0.5306717741131347 and parameters: {'n_estimators': 884, 'max_depth': 8, 'min_samples_split': 32, 'min_samples_leaf': 12, 'max_features': None, 'bootstrap': True, 'criterion': 'squared_error'}. Best is trial 341 with value: 0.2909369124469028.
[I 2024-12-04 12:12:31,795] Trial 1339 finished with value: 0.30121536958725725 and parameters: {'n_estimators': 201, 'max_depth': 44, 'min_samples_split': 3, 'min_samples_leaf': 1, 'max_features': 'sqrt', 'bootstrap': False, 'criterion': 'squared_error'}. Best is trial 341 with value: 0.2909369124469028.
[I 2024-12-04 12:12:31,865] Trial 1364 finished with value: 0.908521944426388 and parameters: {'n_estimators': 306, 'max_depth': 45, 'min_samples_split': 18, 'min_samples_leaf': 4, 'max_features': 'log2', 'bootstrap': True, 'criterion': 'squared_error'}. Best is trial 341 with value: 0.2909369124469028.
[I 2024-12-04 12:12:33,377] Trial 1348 finished with value: 0.44116944869195224 and parameters: {'n_estimators': 455, 'max_depth': 50, 'min_samples_split': 3, 'min_samples_leaf': 2, 'max_features': 'sqrt', 'bootstrap': False, 'criterion': 'squared_error'}. Best is trial 341 with value: 0.2909369124469028.
[I 2024-12-04 12:12:33,663] Trial 1351 finished with value: 0.30013199129952456 and parameters: {'n_estimators': 401, 'max_depth': 50, 'min_samples_split': 4, 'min_samples_leaf': 1, 'max_features': 'sqrt', 'bootstrap': False, 'criterion': 'squared_error'}. Best is trial 341 with value: 0.2909369124469028.
[I 2024-12-04 12:12:33,665] Trial 1359 finished with value: 0.3807493728377169 and parameters: {'n_estimators': 362, 'max_depth': 50, 'min_samples_split': 3, 'min_samples_leaf': 1, 'max_features': None, 'bootstrap': False, 'criterion': 'squared_error'}. Best is trial 341 with value: 0.2909369124469028.
[I 2024-12-04 12:12:33,694] Trial 1360 finished with value: 0.4874757939506903 and parameters: {'n_estimators': 107, 'max_depth': 46, 'min_samples_split': 3, 'min_samples_leaf': 2, 'max_features': 'sqrt', 'bootstrap': True, 'criterion': 'squared_error'}. Best is trial 341 with value: 0.2909369124469028.
[I 2024-12-04 12:12:34,994] Trial 1361 finished with value: 0.8842546226679866 and parameters: {'n_estimators': 181, 'max_depth': 5, 'min_samples_split': 11, 'min_samples_leaf': 1, 'max_features': 'log2', 'bootstrap': False, 'criterion': 'squared_error'}. Best is trial 341 with value: 0.2909369124469028.
[I 2024-12-04 12:12:35,964] Trial 1365 finished with value: 0.2940406418713221 and parameters: {'n_estimators': 140, 'max_depth': 50, 'min_samples_split': 3, 'min_samples_leaf': 1, 'max_features': 'sqrt', 'bootstrap': False, 'criterion': 'squared_error'}. Best is trial 341 with value: 0.2909369124469028.
[I 2024-12-04 12:12:36,414] Trial 1357 finished with value: 0.378630492982545 and parameters: {'n_estimators': 562, 'max_depth': 50, 'min_samples_split': 2, 'min_samples_leaf': 1, 'max_features': 'log2', 'bootstrap': False, 'criterion': 'squared_error'}. Best is trial 341 with value: 0.2909369124469028.
[I 2024-12-04 12:12:36,426] Trial 1349 finished with value: 0.29384316307336267 and parameters: {'n_estimators': 492, 'max_depth': 50, 'min_samples_split': 3, 'min_samples_leaf': 1, 'max_features': 'sqrt', 'bootstrap': False, 'criterion': 'squared_error'}. Best is trial 341 with value: 0.2909369124469028.
[I 2024-12-04 12:12:36,671] Trial 1355 finished with value: 0.434349658331941 and parameters: {'n_estimators': 168, 'max_depth': 41, 'min_samples_split': 3, 'min_samples_leaf': 1, 'max_features': 'log2', 'bootstrap': False, 'criterion': 'squared_error'}. Best is trial 341 with value: 0.2909369124469028.
[I 2024-12-04 12:12:38,544] Trial 1368 finished with value: 0.2986760237904055 and parameters: {'n_estimators': 134, 'max_depth': 43, 'min_samples_split': 3, 'min_samples_leaf': 1, 'max_features': 'sqrt', 'bootstrap': False, 'criterion': 'squared_error'}. Best is trial 341 with value: 0.2909369124469028.
[I 2024-12-04 12:12:39,220] Trial 1350 finished with value: 0.3041365439192342 and parameters: {'n_estimators': 120, 'max_depth': 43, 'min_samples_split': 4, 'min_samples_leaf': 1, 'max_features': 'sqrt', 'bootstrap': False, 'criterion': 'squared_error'}. Best is trial 341 with value: 0.2909369124469028.
[I 2024-12-04 12:12:39,892] Trial 1366 finished with value: 0.8734783122874329 and parameters: {'n_estimators': 564, 'max_depth': 32, 'min_samples_split': 2, 'min_samples_leaf': 3, 'max_features': 'log2', 'bootstrap': True, 'criterion': 'absolute_error'}. Best is trial 341 with value: 0.2909369124469028.
