[I 2024-12-04 15:20:58,966] Trial 1363 finished with value: 0.4653875448128779 and parameters: {'n_estimators': 996, 'max_depth': 42, 'min_samples_split': 4, 'min_samples_leaf': 2, 'max_features': None, 'bootstrap': True, 'criterion': 'squared_error'}. Best is trial 1025 with value: 0.41844370194907604.
[I 2024-12-04 15:21:01,309] Trial 1372 finished with value: 0.5064618515551026 and parameters: {'n_estimators': 840, 'max_depth': 29, 'min_samples_split': 33, 'min_samples_leaf': 1, 'max_features': None, 'bootstrap': True, 'criterion': 'squared_error'}. Best is trial 1025 with value: 0.41844370194907604.
[I 2024-12-04 15:21:01,845] Trial 1384 finished with value: 0.9586161859608744 and parameters: {'n_estimators': 575, 'max_depth': 38, 'min_samples_split': 4, 'min_samples_leaf': 2, 'max_features': 'log2', 'bootstrap': True, 'criterion': 'squared_error'}. Best is trial 1025 with value: 0.41844370194907604.
[I 2024-12-04 15:21:01,904] Trial 1368 finished with value: 0.42022398662291993 and parameters: {'n_estimators': 837, 'max_depth': 31, 'min_samples_split': 2, 'min_samples_leaf': 1, 'max_features': None, 'bootstrap': True, 'criterion': 'squared_error'}. Best is trial 1025 with value: 0.41844370194907604.
[I 2024-12-04 15:21:01,956] Trial 1371 finished with value: 0.4305726667167343 and parameters: {'n_estimators': 719, 'max_depth': 39, 'min_samples_split': 4, 'min_samples_leaf': 1, 'max_features': None, 'bootstrap': True, 'criterion': 'squared_error'}. Best is trial 1025 with value: 0.41844370194907604.
[I 2024-12-04 15:21:01,997] Trial 1370 finished with value: 0.4211468090026752 and parameters: {'n_estimators': 780, 'max_depth': 34, 'min_samples_split': 2, 'min_samples_leaf': 1, 'max_features': None, 'bootstrap': True, 'criterion': 'squared_error'}. Best is trial 1025 with value: 0.41844370194907604.
[I 2024-12-04 15:21:02,022] Trial 1340 finished with value: 0.4625656387227817 and parameters: {'n_estimators': 923, 'max_depth': 31, 'min_samples_split': 6, 'min_samples_leaf': 2, 'max_features': None, 'bootstrap': True, 'criterion': 'absolute_error'}. Best is trial 1025 with value: 0.41844370194907604.
[I 2024-12-04 15:21:02,986] Trial 1383 finished with value: 0.7024751733294294 and parameters: {'n_estimators': 589, 'max_depth': 26, 'min_samples_split': 2, 'min_samples_leaf': 15, 'max_features': None, 'bootstrap': True, 'criterion': 'squared_error'}. Best is trial 1025 with value: 0.41844370194907604.
[I 2024-12-04 15:21:06,759] Trial 1373 finished with value: 0.42117034655597196 and parameters: {'n_estimators': 836, 'max_depth': 33, 'min_samples_split': 2, 'min_samples_leaf': 1, 'max_features': None, 'bootstrap': True, 'criterion': 'squared_error'}. Best is trial 1025 with value: 0.41844370194907604.
[I 2024-12-04 15:21:07,586] Trial 1375 finished with value: 0.4653594870729386 and parameters: {'n_estimators': 756, 'max_depth': 38, 'min_samples_split': 2, 'min_samples_leaf': 2, 'max_features': None, 'bootstrap': True, 'criterion': 'squared_error'}. Best is trial 1025 with value: 0.41844370194907604.
[I 2024-12-04 15:21:09,908] Trial 1378 finished with value: 0.46668835603927744 and parameters: {'n_estimators': 837, 'max_depth': 22, 'min_samples_split': 3, 'min_samples_leaf': 2, 'max_features': None, 'bootstrap': True, 'criterion': 'squared_error'}. Best is trial 1025 with value: 0.41844370194907604.
[I 2024-12-04 15:21:13,659] Trial 1380 finished with value: 0.43105567016857177 and parameters: {'n_estimators': 971, 'max_depth': 45, 'min_samples_split': 4, 'min_samples_leaf': 1, 'max_features': None, 'bootstrap': True, 'criterion': 'squared_error'}. Best is trial 1025 with value: 0.41844370194907604.
[I 2024-12-04 15:21:14,393] Trial 1377 finished with value: 0.41926365661435694 and parameters: {'n_estimators': 855, 'max_depth': 41, 'min_samples_split': 2, 'min_samples_leaf': 1, 'max_features': None, 'bootstrap': True, 'criterion': 'squared_error'}. Best is trial 1025 with value: 0.41844370194907604.
[I 2024-12-04 15:21:18,844] Trial 1381 finished with value: 0.419329814197996 and parameters: {'n_estimators': 735, 'max_depth': 41, 'min_samples_split': 2, 'min_samples_leaf': 1, 'max_features': None, 'bootstrap': True, 'criterion': 'squared_error'}. Best is trial 1025 with value: 0.41844370194907604.
[I 2024-12-04 15:21:19,047] Trial 1376 finished with value: 0.6164999186414878 and parameters: {'n_estimators': 836, 'max_depth': 28, 'min_samples_split': 7, 'min_samples_leaf': 1, 'max_features': 'sqrt', 'bootstrap': False, 'criterion': 'absolute_error'}. Best is trial 1025 with value: 0.41844370194907604.
[I 2024-12-04 15:21:19,209] Trial 1388 finished with value: 1.0569252908019606 and parameters: {'n_estimators': 722, 'max_depth': 17, 'min_samples_split': 5, 'min_samples_leaf': 10, 'max_features': 'log2', 'bootstrap': True, 'criterion': 'absolute_error'}. Best is trial 1025 with value: 0.41844370194907604.
[I 2024-12-04 15:21:19,389] Trial 1369 finished with value: 0.4205832908416506 and parameters: {'n_estimators': 986, 'max_depth': 47, 'min_samples_split': 2, 'min_samples_leaf': 1, 'max_features': None, 'bootstrap': True, 'criterion': 'squared_error'}. Best is trial 1025 with value: 0.41844370194907604.
[I 2024-12-04 15:21:20,071] Trial 1374 finished with value: 0.42046203989732733 and parameters: {'n_estimators': 984, 'max_depth': 36, 'min_samples_split': 2, 'min_samples_leaf': 1, 'max_features': None, 'bootstrap': True, 'criterion': 'squared_error'}. Best is trial 1025 with value: 0.41844370194907604.
[I 2024-12-04 15:21:20,994] Trial 1390 finished with value: 0.4217838553522891 and parameters: {'n_estimators': 712, 'max_depth': 45, 'min_samples_split': 2, 'min_samples_leaf': 1, 'max_features': None, 'bootstrap': True, 'criterion': 'squared_error'}. Best is trial 1025 with value: 0.41844370194907604.
[I 2024-12-04 15:21:21,589] Trial 1379 finished with value: 0.4209025095273621 and parameters: {'n_estimators': 991, 'max_depth': 37, 'min_samples_split': 2, 'min_samples_leaf': 1, 'max_features': None, 'bootstrap': True, 'criterion': 'squared_error'}. Best is trial 1025 with value: 0.41844370194907604.
[I 2024-12-04 15:21:22,595] Trial 1395 finished with value: 0.7319028121546377 and parameters: {'n_estimators': 134, 'max_depth': 30, 'min_samples_split': 9, 'min_samples_leaf': 1, 'max_features': 'log2', 'bootstrap': True, 'criterion': 'squared_error'}. Best is trial 1025 with value: 0.41844370194907604.
[I 2024-12-04 15:21:22,674] Trial 1392 finished with value: 0.5276658923516934 and parameters: {'n_estimators': 677, 'max_depth': 37, 'min_samples_split': 2, 'min_samples_leaf': 1, 'max_features': None, 'bootstrap': False, 'criterion': 'squared_error'}. Best is trial 1025 with value: 0.41844370194907604.
[I 2024-12-04 15:21:22,680] Trial 1386 finished with value: 0.43135658604822924 and parameters: {'n_estimators': 866, 'max_depth': 38, 'min_samples_split': 4, 'min_samples_leaf': 1, 'max_features': None, 'bootstrap': True, 'criterion': 'squared_error'}. Best is trial 1025 with value: 0.41844370194907604.
[I 2024-12-04 15:21:23,077] Trial 1382 finished with value: 0.43197950016536285 and parameters: {'n_estimators': 629, 'max_depth': 37, 'min_samples_split': 4, 'min_samples_leaf': 1, 'max_features': None, 'bootstrap': True, 'criterion': 'squared_error'}. Best is trial 1025 with value: 0.41844370194907604.
[I 2024-12-04 15:21:23,443] Trial 1393 finished with value: 0.6565410293814169 and parameters: {'n_estimators': 527, 'max_depth': 35, 'min_samples_split': 2, 'min_samples_leaf': 1, 'max_features': 'log2', 'bootstrap': True, 'criterion': 'squared_error'}. Best is trial 1025 with value: 0.41844370194907604.
[I 2024-12-04 15:21:23,747] Trial 1385 finished with value: 0.8126693920786686 and parameters: {'n_estimators': 564, 'max_depth': 28, 'min_samples_split': 2, 'min_samples_leaf': 3, 'max_features': 'sqrt', 'bootstrap': True, 'criterion': 'absolute_error'}. Best is trial 1025 with value: 0.41844370194907604.
[I 2024-12-04 15:21:24,860] Trial 1387 finished with value: 0.4317539605832019 and parameters: {'n_estimators': 641, 'max_depth': 37, 'min_samples_split': 4, 'min_samples_leaf': 1, 'max_features': None, 'bootstrap': True, 'criterion': 'squared_error'}. Best is trial 1025 with value: 0.41844370194907604.
[I 2024-12-04 15:21:30,485] Trial 1337 finished with value: 0.4299883581854666 and parameters: {'n_estimators': 910, 'max_depth': 36, 'min_samples_split': 3, 'min_samples_leaf': 1, 'max_features': None, 'bootstrap': True, 'criterion': 'absolute_error'}. Best is trial 1025 with value: 0.41844370194907604.
[I 2024-12-04 15:21:31,121] Trial 1397 finished with value: 0.9785023477185144 and parameters: {'n_estimators': 555, 'max_depth': 21, 'min_samples_split': 2, 'min_samples_leaf': 3, 'max_features': 'log2', 'bootstrap': False, 'criterion': 'absolute_error'}. Best is trial 1025 with value: 0.41844370194907604.
[I 2024-12-04 15:21:31,776] Trial 1389 finished with value: 0.4191616694699774 and parameters: {'n_estimators': 744, 'max_depth': 41, 'min_samples_split': 2, 'min_samples_leaf': 1, 'max_features': None, 'bootstrap': True, 'criterion': 'squared_error'}. Best is trial 1025 with value: 0.41844370194907604.
[I 2024-12-04 15:21:31,829] Trial 1391 finished with value: 0.4653725157904041 and parameters: {'n_estimators': 975, 'max_depth': 43, 'min_samples_split': 2, 'min_samples_leaf': 2, 'max_features': None, 'bootstrap': True, 'criterion': 'squared_error'}. Best is trial 1025 with value: 0.41844370194907604.
[I 2024-12-04 15:21:33,890] Trial 1402 finished with value: 1.0589364441913538 and parameters: {'n_estimators': 861, 'max_depth': 38, 'min_samples_split': 25, 'min_samples_leaf': 13, 'max_features': 'log2', 'bootstrap': True, 'criterion': 'absolute_error'}. Best is trial 1025 with value: 0.41844370194907604.
[I 2024-12-04 15:21:35,156] Trial 1396 finished with value: 0.46489394930953004 and parameters: {'n_estimators': 738, 'max_depth': 35, 'min_samples_split': 2, 'min_samples_leaf': 2, 'max_features': None, 'bootstrap': True, 'criterion': 'squared_error'}. Best is trial 1025 with value: 0.41844370194907604.
[I 2024-12-04 15:21:36,097] Trial 1398 finished with value: 0.42134608097075027 and parameters: {'n_estimators': 773, 'max_depth': 35, 'min_samples_split': 2, 'min_samples_leaf': 1, 'max_features': None, 'bootstrap': True, 'criterion': 'squared_error'}. Best is trial 1025 with value: 0.41844370194907604.
[I 2024-12-04 15:21:36,117] Trial 1394 finished with value: 0.4197323264740324 and parameters: {'n_estimators': 819, 'max_depth': 41, 'min_samples_split': 2, 'min_samples_leaf': 1, 'max_features': None, 'bootstrap': True, 'criterion': 'squared_error'}. Best is trial 1025 with value: 0.41844370194907604.
[I 2024-12-04 15:21:40,280] Trial 1399 finished with value: 0.6946463828280289 and parameters: {'n_estimators': 605, 'max_depth': 38, 'min_samples_split': 3, 'min_samples_leaf': 2, 'max_features': 'sqrt', 'bootstrap': True, 'criterion': 'squared_error'}. Best is trial 1025 with value: 0.41844370194907604.
[I 2024-12-04 15:21:41,750] Trial 1400 finished with value: 0.4312525651034047 and parameters: {'n_estimators': 774, 'max_depth': 50, 'min_samples_split': 4, 'min_samples_leaf': 1, 'max_features': None, 'bootstrap': True, 'criterion': 'squared_error'}. Best is trial 1025 with value: 0.41844370194907604.
[I 2024-12-04 15:21:48,486] Trial 1420 finished with value: 1.0515811060975133 and parameters: {'n_estimators': 145, 'max_depth': 32, 'min_samples_split': 4, 'min_samples_leaf': 5, 'max_features': 'log2', 'bootstrap': False, 'criterion': 'squared_error'}. Best is trial 1025 with value: 0.41844370194907604.
[I 2024-12-04 15:21:49,831] Trial 1401 finished with value: 0.4207760476018807 and parameters: {'n_estimators': 894, 'max_depth': 44, 'min_samples_split': 2, 'min_samples_leaf': 1, 'max_features': None, 'bootstrap': True, 'criterion': 'squared_error'}. Best is trial 1025 with value: 0.41844370194907604.
[I 2024-12-04 15:21:52,551] Trial 1404 finished with value: 0.4243410277689883 and parameters: {'n_estimators': 838, 'max_depth': 36, 'min_samples_split': 3, 'min_samples_leaf': 1, 'max_features': None, 'bootstrap': True, 'criterion': 'squared_error'}. Best is trial 1025 with value: 0.41844370194907604.
[I 2024-12-04 15:21:53,082] Trial 1417 finished with value: 0.5951125276435617 and parameters: {'n_estimators': 562, 'max_depth': 42, 'min_samples_split': 9, 'min_samples_leaf': 2, 'max_features': None, 'bootstrap': False, 'criterion': 'squared_error'}. Best is trial 1025 with value: 0.41844370194907604.
[I 2024-12-04 15:21:53,082] Trial 1408 finished with value: 0.41947684804612667 and parameters: {'n_estimators': 684, 'max_depth': 40, 'min_samples_split': 2, 'min_samples_leaf': 1, 'max_features': None, 'bootstrap': True, 'criterion': 'squared_error'}. Best is trial 1025 with value: 0.41844370194907604.
[I 2024-12-04 15:21:55,318] Trial 1410 finished with value: 0.4211065582624759 and parameters: {'n_estimators': 665, 'max_depth': 38, 'min_samples_split': 2, 'min_samples_leaf': 1, 'max_features': None, 'bootstrap': True, 'criterion': 'squared_error'}. Best is trial 1025 with value: 0.41844370194907604.
[I 2024-12-04 15:21:55,434] Trial 1411 finished with value: 0.42110714637961233 and parameters: {'n_estimators': 647, 'max_depth': 48, 'min_samples_split': 2, 'min_samples_leaf': 1, 'max_features': None, 'bootstrap': True, 'criterion': 'squared_error'}. Best is trial 1025 with value: 0.41844370194907604.
[I 2024-12-04 15:21:55,616] Trial 1407 finished with value: 0.4218098858089831 and parameters: {'n_estimators': 669, 'max_depth': 37, 'min_samples_split': 2, 'min_samples_leaf': 1, 'max_features': None, 'bootstrap': True, 'criterion': 'squared_error'}. Best is trial 1025 with value: 0.41844370194907604.
[I 2024-12-04 15:21:56,920] Trial 1409 finished with value: 1.059616730725699 and parameters: {'n_estimators': 960, 'max_depth': 36, 'min_samples_split': 4, 'min_samples_leaf': 6, 'max_features': 'log2', 'bootstrap': True, 'criterion': 'squared_error'}. Best is trial 1025 with value: 0.41844370194907604.
[I 2024-12-04 15:21:57,709] Trial 1403 finished with value: 0.4195510358107185 and parameters: {'n_estimators': 880, 'max_depth': 41, 'min_samples_split': 2, 'min_samples_leaf': 1, 'max_features': None, 'bootstrap': True, 'criterion': 'squared_error'}. Best is trial 1025 with value: 0.41844370194907604.
[I 2024-12-04 15:21:57,717] Trial 1413 finished with value: 0.6222120909189768 and parameters: {'n_estimators': 599, 'max_depth': 47, 'min_samples_split': 3, 'min_samples_leaf': 6, 'max_features': None, 'bootstrap': True, 'criterion': 'squared_error'}. Best is trial 1025 with value: 0.41844370194907604.
[I 2024-12-04 15:21:59,126] Trial 1414 finished with value: 0.4206714360221116 and parameters: {'n_estimators': 622, 'max_depth': 48, 'min_samples_split': 2, 'min_samples_leaf': 1, 'max_features': None, 'bootstrap': True, 'criterion': 'squared_error'}. Best is trial 1025 with value: 0.41844370194907604.
[I 2024-12-04 15:21:59,645] Trial 1406 finished with value: 0.7440076076323551 and parameters: {'n_estimators': 986, 'max_depth': 28, 'min_samples_split': 14, 'min_samples_leaf': 2, 'max_features': 'sqrt', 'bootstrap': True, 'criterion': 'absolute_error'}. Best is trial 1025 with value: 0.41844370194907604.
[I 2024-12-04 15:21:59,646] Trial 1423 finished with value: 0.7041161592281235 and parameters: {'n_estimators': 259, 'max_depth': 36, 'min_samples_split': 12, 'min_samples_leaf': 12, 'max_features': None, 'bootstrap': False, 'criterion': 'squared_error'}. Best is trial 1025 with value: 0.41844370194907604.
[I 2024-12-04 15:21:59,812] Trial 1412 finished with value: 0.4197389768065087 and parameters: {'n_estimators': 705, 'max_depth': 39, 'min_samples_split': 2, 'min_samples_leaf': 1, 'max_features': None, 'bootstrap': True, 'criterion': 'squared_error'}. Best is trial 1025 with value: 0.41844370194907604.
[I 2024-12-04 15:21:59,899] Trial 1421 finished with value: 0.5125085000158203 and parameters: {'n_estimators': 694, 'max_depth': 40, 'min_samples_split': 2, 'min_samples_leaf': 1, 'max_features': 'sqrt', 'bootstrap': True, 'criterion': 'squared_error'}. Best is trial 1025 with value: 0.41844370194907604.
[I 2024-12-04 15:22:01,112] Trial 1418 finished with value: 0.43180362475821077 and parameters: {'n_estimators': 697, 'max_depth': 47, 'min_samples_split': 4, 'min_samples_leaf': 1, 'max_features': None, 'bootstrap': True, 'criterion': 'squared_error'}. Best is trial 1025 with value: 0.41844370194907604.
[I 2024-12-04 15:22:01,158] Trial 1405 finished with value: 0.4192368313705019 and parameters: {'n_estimators': 990, 'max_depth': 41, 'min_samples_split': 2, 'min_samples_leaf': 1, 'max_features': None, 'bootstrap': True, 'criterion': 'squared_error'}. Best is trial 1025 with value: 0.41844370194907604.
[I 2024-12-04 15:22:02,095] Trial 1416 finished with value: 0.46483340833176406 and parameters: {'n_estimators': 731, 'max_depth': 44, 'min_samples_split': 3, 'min_samples_leaf': 2, 'max_features': None, 'bootstrap': True, 'criterion': 'squared_error'}. Best is trial 1025 with value: 0.41844370194907604.
[I 2024-12-04 15:22:03,601] Trial 1422 finished with value: 0.46485160698190353 and parameters: {'n_estimators': 612, 'max_depth': 33, 'min_samples_split': 2, 'min_samples_leaf': 2, 'max_features': None, 'bootstrap': True, 'criterion': 'squared_error'}. Best is trial 1025 with value: 0.41844370194907604.
[I 2024-12-04 15:22:03,977] Trial 1415 finished with value: 0.4312302787924365 and parameters: {'n_estimators': 746, 'max_depth': 44, 'min_samples_split': 4, 'min_samples_leaf': 1, 'max_features': None, 'bootstrap': True, 'criterion': 'squared_error'}. Best is trial 1025 with value: 0.41844370194907604.
[I 2024-12-04 15:22:05,496] Trial 1424 finished with value: 0.46468628673416734 and parameters: {'n_estimators': 688, 'max_depth': 46, 'min_samples_split': 2, 'min_samples_leaf': 2, 'max_features': None, 'bootstrap': True, 'criterion': 'squared_error'}. Best is trial 1025 with value: 0.41844370194907604.
[I 2024-12-04 15:22:05,500] Trial 1430 finished with value: 0.7798240162705591 and parameters: {'n_estimators': 214, 'max_depth': 36, 'min_samples_split': 8, 'min_samples_leaf': 4, 'max_features': 'sqrt', 'bootstrap': False, 'criterion': 'squared_error'}. Best is trial 1025 with value: 0.41844370194907604.
[I 2024-12-04 15:22:06,771] Trial 1366 finished with value: 0.4313017261179986 and parameters: {'n_estimators': 875, 'max_depth': 44, 'min_samples_split': 4, 'min_samples_leaf': 1, 'max_features': None, 'bootstrap': True, 'criterion': 'absolute_error'}. Best is trial 1025 with value: 0.41844370194907604.
[I 2024-12-04 15:22:10,305] Trial 1419 finished with value: 0.4646007788044014 and parameters: {'n_estimators': 655, 'max_depth': 42, 'min_samples_split': 3, 'min_samples_leaf': 2, 'max_features': None, 'bootstrap': True, 'criterion': 'squared_error'}. Best is trial 1025 with value: 0.41844370194907604.
[I 2024-12-04 15:22:10,363] Trial 1426 finished with value: 1.051884767245788 and parameters: {'n_estimators': 545, 'max_depth': 5, 'min_samples_split': 2, 'min_samples_leaf': 7, 'max_features': 'log2', 'bootstrap': True, 'criterion': 'absolute_error'}. Best is trial 1025 with value: 0.41844370194907604.
[I 2024-12-04 15:22:13,291] Trial 1425 finished with value: 0.4188823246570607 and parameters: {'n_estimators': 710, 'max_depth': 40, 'min_samples_split': 2, 'min_samples_leaf': 1, 'max_features': None, 'bootstrap': True, 'criterion': 'squared_error'}. Best is trial 1025 with value: 0.41844370194907604.
[I 2024-12-04 15:22:14,116] Trial 1429 finished with value: 0.4274658083675684 and parameters: {'n_estimators': 633, 'max_depth': 29, 'min_samples_split': 3, 'min_samples_leaf': 1, 'max_features': None, 'bootstrap': True, 'criterion': 'squared_error'}. Best is trial 1025 with value: 0.41844370194907604.
[I 2024-12-04 15:22:14,985] Trial 1433 finished with value: 0.7253498900949572 and parameters: {'n_estimators': 229, 'max_depth': 38, 'min_samples_split': 11, 'min_samples_leaf': 1, 'max_features': 'log2', 'bootstrap': True, 'criterion': 'absolute_error'}. Best is trial 1025 with value: 0.41844370194907604.
[I 2024-12-04 15:22:15,000] Trial 1427 finished with value: 0.46514384473930576 and parameters: {'n_estimators': 748, 'max_depth': 40, 'min_samples_split': 2, 'min_samples_leaf': 2, 'max_features': None, 'bootstrap': True, 'criterion': 'squared_error'}. Best is trial 1025 with value: 0.41844370194907604.
[I 2024-12-04 15:22:16,974] Trial 1434 finished with value: 0.42396668587881947 and parameters: {'n_estimators': 747, 'max_depth': 39, 'min_samples_split': 3, 'min_samples_leaf': 1, 'max_features': None, 'bootstrap': True, 'criterion': 'squared_error'}. Best is trial 1025 with value: 0.41844370194907604.
[I 2024-12-04 15:22:16,983] Trial 1431 finished with value: 0.4204006186067842 and parameters: {'n_estimators': 734, 'max_depth': 38, 'min_samples_split': 2, 'min_samples_leaf': 1, 'max_features': None, 'bootstrap': True, 'criterion': 'squared_error'}. Best is trial 1025 with value: 0.41844370194907604.
[I 2024-12-04 15:22:20,766] Trial 1438 finished with value: 0.4213143965838493 and parameters: {'n_estimators': 774, 'max_depth': 45, 'min_samples_split': 2, 'min_samples_leaf': 1, 'max_features': None, 'bootstrap': True, 'criterion': 'squared_error'}. Best is trial 1025 with value: 0.41844370194907604.
[I 2024-12-04 15:22:20,897] Trial 1432 finished with value: 0.4202377986351776 and parameters: {'n_estimators': 715, 'max_depth': 38, 'min_samples_split': 2, 'min_samples_leaf': 1, 'max_features': None, 'bootstrap': True, 'criterion': 'squared_error'}. Best is trial 1025 with value: 0.41844370194907604.
