[I 2024-12-04 12:08:43,853] Trial 924 finished with value: 0.5112063801725922 and parameters: {'n_estimators': 300, 'max_depth': 16, 'min_samples_split': 4, 'min_samples_leaf': 1, 'max_features': None, 'bootstrap': True, 'criterion': 'absolute_error'}. Best is trial 744 with value: 0.5032383725751689.
[I 2024-12-04 12:08:45,021] Trial 946 finished with value: 0.5172369596782671 and parameters: {'n_estimators': 101, 'max_depth': 11, 'min_samples_split': 3, 'min_samples_leaf': 1, 'max_features': None, 'bootstrap': True, 'criterion': 'absolute_error'}. Best is trial 744 with value: 0.5032383725751689.
[I 2024-12-04 12:08:46,750] Trial 934 finished with value: 0.5545484200480415 and parameters: {'n_estimators': 289, 'max_depth': 13, 'min_samples_split': 5, 'min_samples_leaf': 2, 'max_features': None, 'bootstrap': True, 'criterion': 'absolute_error'}. Best is trial 744 with value: 0.5032383725751689.
[I 2024-12-04 12:08:47,331] Trial 956 finished with value: 1.2553385897226286 and parameters: {'n_estimators': 499, 'max_depth': 11, 'min_samples_split': 13, 'min_samples_leaf': 13, 'max_features': 'log2', 'bootstrap': True, 'criterion': 'squared_error'}. Best is trial 744 with value: 0.5032383725751689.
[I 2024-12-04 12:08:47,810] Trial 950 finished with value: 0.8283905152038912 and parameters: {'n_estimators': 636, 'max_depth': 30, 'min_samples_split': 35, 'min_samples_leaf': 1, 'max_features': 'log2', 'bootstrap': False, 'criterion': 'squared_error'}. Best is trial 744 with value: 0.5032383725751689.
[I 2024-12-04 12:08:48,852] Trial 949 finished with value: 0.5142890775738292 and parameters: {'n_estimators': 100, 'max_depth': 21, 'min_samples_split': 3, 'min_samples_leaf': 1, 'max_features': None, 'bootstrap': True, 'criterion': 'absolute_error'}. Best is trial 744 with value: 0.5032383725751689.
[I 2024-12-04 12:08:48,862] Trial 939 finished with value: 0.6379046979458377 and parameters: {'n_estimators': 501, 'max_depth': 8, 'min_samples_split': 27, 'min_samples_leaf': 6, 'max_features': None, 'bootstrap': False, 'criterion': 'absolute_error'}. Best is trial 744 with value: 0.5032383725751689.
[I 2024-12-04 12:08:49,304] Trial 955 finished with value: 1.0687122366703472 and parameters: {'n_estimators': 113, 'max_depth': 16, 'min_samples_split': 2, 'min_samples_leaf': 1, 'max_features': 'log2', 'bootstrap': True, 'criterion': 'absolute_error'}. Best is trial 744 with value: 0.5032383725751689.
[I 2024-12-04 12:08:49,849] Trial 951 finished with value: 0.5573300538442036 and parameters: {'n_estimators': 105, 'max_depth': 17, 'min_samples_split': 2, 'min_samples_leaf': 2, 'max_features': None, 'bootstrap': True, 'criterion': 'absolute_error'}. Best is trial 744 with value: 0.5032383725751689.
[I 2024-12-04 12:08:50,510] Trial 952 finished with value: 0.5403397810068813 and parameters: {'n_estimators': 100, 'max_depth': 6, 'min_samples_split': 2, 'min_samples_leaf': 1, 'max_features': None, 'bootstrap': True, 'criterion': 'absolute_error'}. Best is trial 744 with value: 0.5032383725751689.
[I 2024-12-04 12:08:50,513] Trial 945 finished with value: 0.5196566199685433 and parameters: {'n_estimators': 223, 'max_depth': 17, 'min_samples_split': 2, 'min_samples_leaf': 1, 'max_features': None, 'bootstrap': True, 'criterion': 'absolute_error'}. Best is trial 744 with value: 0.5032383725751689.
[I 2024-12-04 12:08:52,774] Trial 940 finished with value: 0.5570572366284873 and parameters: {'n_estimators': 266, 'max_depth': 16, 'min_samples_split': 2, 'min_samples_leaf': 2, 'max_features': None, 'bootstrap': True, 'criterion': 'absolute_error'}. Best is trial 744 with value: 0.5032383725751689.
[I 2024-12-04 12:08:53,450] Trial 941 finished with value: 0.5137305759404308 and parameters: {'n_estimators': 233, 'max_depth': 13, 'min_samples_split': 3, 'min_samples_leaf': 1, 'max_features': None, 'bootstrap': True, 'criterion': 'absolute_error'}. Best is trial 744 with value: 0.5032383725751689.
[I 2024-12-04 12:08:53,865] Trial 944 finished with value: 0.5200686022454718 and parameters: {'n_estimators': 228, 'max_depth': 17, 'min_samples_split': 2, 'min_samples_leaf': 1, 'max_features': None, 'bootstrap': True, 'criterion': 'absolute_error'}. Best is trial 744 with value: 0.5032383725751689.
[I 2024-12-04 12:08:54,801] Trial 942 finished with value: 0.5272868917715072 and parameters: {'n_estimators': 317, 'max_depth': 17, 'min_samples_split': 12, 'min_samples_leaf': 1, 'max_features': None, 'bootstrap': True, 'criterion': 'absolute_error'}. Best is trial 744 with value: 0.5032383725751689.
[I 2024-12-04 12:08:55,309] Trial 948 finished with value: 0.5917826562359054 and parameters: {'n_estimators': 550, 'max_depth': 50, 'min_samples_split': 23, 'min_samples_leaf': 1, 'max_features': None, 'bootstrap': False, 'criterion': 'squared_error'}. Best is trial 744 with value: 0.5032383725751689.
[I 2024-12-04 12:08:55,570] Trial 953 finished with value: 0.5158986442449118 and parameters: {'n_estimators': 105, 'max_depth': 17, 'min_samples_split': 3, 'min_samples_leaf': 1, 'max_features': None, 'bootstrap': True, 'criterion': 'absolute_error'}. Best is trial 744 with value: 0.5032383725751689.
[I 2024-12-04 12:08:55,642] Trial 937 finished with value: 0.5194134186675264 and parameters: {'n_estimators': 265, 'max_depth': 20, 'min_samples_split': 6, 'min_samples_leaf': 1, 'max_features': None, 'bootstrap': True, 'criterion': 'absolute_error'}. Best is trial 744 with value: 0.5032383725751689.
[I 2024-12-04 12:08:57,390] Trial 958 finished with value: 0.511197311481193 and parameters: {'n_estimators': 117, 'max_depth': 12, 'min_samples_split': 2, 'min_samples_leaf': 1, 'max_features': None, 'bootstrap': True, 'criterion': 'absolute_error'}. Best is trial 744 with value: 0.5032383725751689.
[I 2024-12-04 12:08:58,293] Trial 957 finished with value: 0.5577232502223962 and parameters: {'n_estimators': 173, 'max_depth': 12, 'min_samples_split': 3, 'min_samples_leaf': 2, 'max_features': None, 'bootstrap': True, 'criterion': 'absolute_error'}. Best is trial 744 with value: 0.5032383725751689.
[I 2024-12-04 12:08:58,435] Trial 959 finished with value: 0.6786897406257084 and parameters: {'n_estimators': 338, 'max_depth': 12, 'min_samples_split': 15, 'min_samples_leaf': 7, 'max_features': None, 'bootstrap': True, 'criterion': 'absolute_error'}. Best is trial 744 with value: 0.5032383725751689.
[I 2024-12-04 12:08:58,439] Trial 954 finished with value: 0.5181418658118518 and parameters: {'n_estimators': 103, 'max_depth': 14, 'min_samples_split': 2, 'min_samples_leaf': 1, 'max_features': None, 'bootstrap': True, 'criterion': 'absolute_error'}. Best is trial 744 with value: 0.5032383725751689.
[I 2024-12-04 12:09:00,418] Trial 964 finished with value: 0.5883414892923733 and parameters: {'n_estimators': 238, 'max_depth': 49, 'min_samples_split': 6, 'min_samples_leaf': 1, 'max_features': 'sqrt', 'bootstrap': False, 'criterion': 'squared_error'}. Best is trial 744 with value: 0.5032383725751689.
[I 2024-12-04 12:09:00,451] Trial 963 finished with value: 0.5148077292375983 and parameters: {'n_estimators': 113, 'max_depth': 15, 'min_samples_split': 2, 'min_samples_leaf': 1, 'max_features': None, 'bootstrap': True, 'criterion': 'absolute_error'}. Best is trial 744 with value: 0.5032383725751689.
[I 2024-12-04 12:09:00,925] Trial 962 finished with value: 1.175161023407255 and parameters: {'n_estimators': 552, 'max_depth': 5, 'min_samples_split': 21, 'min_samples_leaf': 1, 'max_features': 'log2', 'bootstrap': True, 'criterion': 'squared_error'}. Best is trial 744 with value: 0.5032383725751689.
[I 2024-12-04 12:09:01,566] Trial 961 finished with value: 0.5392612657721852 and parameters: {'n_estimators': 107, 'max_depth': 17, 'min_samples_split': 7, 'min_samples_leaf': 1, 'max_features': None, 'bootstrap': False, 'criterion': 'absolute_error'}. Best is trial 744 with value: 0.5032383725751689.
[I 2024-12-04 12:09:02,476] Trial 965 finished with value: 1.3259428203312513 and parameters: {'n_estimators': 929, 'max_depth': 41, 'min_samples_split': 22, 'min_samples_leaf': 4, 'max_features': 'log2', 'bootstrap': False, 'criterion': 'absolute_error'}. Best is trial 744 with value: 0.5032383725751689.
[I 2024-12-04 12:09:02,895] Trial 973 finished with value: 1.1234573339073555 and parameters: {'n_estimators': 953, 'max_depth': 6, 'min_samples_split': 25, 'min_samples_leaf': 7, 'max_features': 'sqrt', 'bootstrap': False, 'criterion': 'squared_error'}. Best is trial 744 with value: 0.5032383725751689.
[I 2024-12-04 12:09:03,722] Trial 969 finished with value: 1.0887056429739073 and parameters: {'n_estimators': 261, 'max_depth': 16, 'min_samples_split': 5, 'min_samples_leaf': 1, 'max_features': 'log2', 'bootstrap': True, 'criterion': 'absolute_error'}. Best is trial 744 with value: 0.5032383725751689.
[I 2024-12-04 12:09:04,166] Trial 967 finished with value: 0.5102952589545787 and parameters: {'n_estimators': 107, 'max_depth': 20, 'min_samples_split': 4, 'min_samples_leaf': 1, 'max_features': None, 'bootstrap': True, 'criterion': 'absolute_error'}. Best is trial 744 with value: 0.5032383725751689.
[I 2024-12-04 12:09:05,158] Trial 977 finished with value: 1.355648890570351 and parameters: {'n_estimators': 171, 'max_depth': 13, 'min_samples_split': 7, 'min_samples_leaf': 10, 'max_features': 'log2', 'bootstrap': False, 'criterion': 'absolute_error'}. Best is trial 744 with value: 0.5032383725751689.
[I 2024-12-04 12:09:05,371] Trial 970 finished with value: 0.5503513267416199 and parameters: {'n_estimators': 258, 'max_depth': 19, 'min_samples_split': 6, 'min_samples_leaf': 2, 'max_features': None, 'bootstrap': True, 'criterion': 'squared_error'}. Best is trial 744 with value: 0.5032383725751689.
[I 2024-12-04 12:09:05,776] Trial 971 finished with value: 0.5128814917564869 and parameters: {'n_estimators': 107, 'max_depth': 17, 'min_samples_split': 4, 'min_samples_leaf': 1, 'max_features': None, 'bootstrap': True, 'criterion': 'absolute_error'}. Best is trial 744 with value: 0.5032383725751689.
[I 2024-12-04 12:09:06,978] Trial 935 finished with value: 0.5529028117599222 and parameters: {'n_estimators': 814, 'max_depth': 8, 'min_samples_split': 15, 'min_samples_leaf': 2, 'max_features': None, 'bootstrap': True, 'criterion': 'absolute_error'}. Best is trial 744 with value: 0.5032383725751689.
[I 2024-12-04 12:09:10,156] Trial 982 finished with value: 0.7279281089405839 and parameters: {'n_estimators': 137, 'max_depth': 45, 'min_samples_split': 38, 'min_samples_leaf': 1, 'max_features': 'sqrt', 'bootstrap': False, 'criterion': 'absolute_error'}. Best is trial 744 with value: 0.5032383725751689.
[I 2024-12-04 12:09:10,307] Trial 960 finished with value: 0.5189381601655615 and parameters: {'n_estimators': 256, 'max_depth': 14, 'min_samples_split': 3, 'min_samples_leaf': 1, 'max_features': None, 'bootstrap': True, 'criterion': 'absolute_error'}. Best is trial 744 with value: 0.5032383725751689.
[I 2024-12-04 12:09:10,422] Trial 981 finished with value: 0.6596543181263681 and parameters: {'n_estimators': 614, 'max_depth': 48, 'min_samples_split': 2, 'min_samples_leaf': 1, 'max_features': 'log2', 'bootstrap': True, 'criterion': 'squared_error'}. Best is trial 744 with value: 0.5032383725751689.
[I 2024-12-04 12:09:12,221] Trial 978 finished with value: 0.55635256048215 and parameters: {'n_estimators': 106, 'max_depth': 15, 'min_samples_split': 6, 'min_samples_leaf': 2, 'max_features': None, 'bootstrap': True, 'criterion': 'absolute_error'}. Best is trial 744 with value: 0.5032383725751689.
[I 2024-12-04 12:09:12,259] Trial 974 finished with value: 0.5226408119213265 and parameters: {'n_estimators': 120, 'max_depth': 26, 'min_samples_split': 2, 'min_samples_leaf': 1, 'max_features': None, 'bootstrap': True, 'criterion': 'absolute_error'}. Best is trial 744 with value: 0.5032383725751689.
[I 2024-12-04 12:09:12,595] Trial 975 finished with value: 0.5590114369576666 and parameters: {'n_estimators': 110, 'max_depth': 7, 'min_samples_split': 5, 'min_samples_leaf': 2, 'max_features': None, 'bootstrap': True, 'criterion': 'absolute_error'}. Best is trial 744 with value: 0.5032383725751689.
[I 2024-12-04 12:09:12,960] Trial 986 finished with value: 1.3448072077388296 and parameters: {'n_estimators': 105, 'max_depth': 9, 'min_samples_split': 25, 'min_samples_leaf': 10, 'max_features': 'sqrt', 'bootstrap': True, 'criterion': 'absolute_error'}. Best is trial 744 with value: 0.5032383725751689.
[I 2024-12-04 12:09:13,330] Trial 984 finished with value: 0.5536138452423022 and parameters: {'n_estimators': 110, 'max_depth': 19, 'min_samples_split': 3, 'min_samples_leaf': 2, 'max_features': None, 'bootstrap': True, 'criterion': 'absolute_error'}. Best is trial 744 with value: 0.5032383725751689.
[I 2024-12-04 12:09:13,489] Trial 968 finished with value: 0.5151261195093144 and parameters: {'n_estimators': 291, 'max_depth': 12, 'min_samples_split': 6, 'min_samples_leaf': 1, 'max_features': None, 'bootstrap': True, 'criterion': 'absolute_error'}. Best is trial 744 with value: 0.5032383725751689.
[I 2024-12-04 12:09:13,585] Trial 972 finished with value: 0.5583874605777208 and parameters: {'n_estimators': 223, 'max_depth': 17, 'min_samples_split': 4, 'min_samples_leaf': 2, 'max_features': None, 'bootstrap': True, 'criterion': 'absolute_error'}. Best is trial 744 with value: 0.5032383725751689.
[I 2024-12-04 12:09:14,150] Trial 966 finished with value: 0.5135690554385504 and parameters: {'n_estimators': 296, 'max_depth': 15, 'min_samples_split': 3, 'min_samples_leaf': 1, 'max_features': None, 'bootstrap': True, 'criterion': 'absolute_error'}. Best is trial 744 with value: 0.5032383725751689.
[I 2024-12-04 12:09:14,176] Trial 976 finished with value: 0.5086865966221453 and parameters: {'n_estimators': 111, 'max_depth': 12, 'min_samples_split': 2, 'min_samples_leaf': 1, 'max_features': None, 'bootstrap': True, 'criterion': 'absolute_error'}. Best is trial 744 with value: 0.5032383725751689.
[I 2024-12-04 12:09:16,505] Trial 988 finished with value: 1.0370552462991682 and parameters: {'n_estimators': 980, 'max_depth': 25, 'min_samples_split': 11, 'min_samples_leaf': 3, 'max_features': 'sqrt', 'bootstrap': True, 'criterion': 'squared_error'}. Best is trial 744 with value: 0.5032383725751689.
[I 2024-12-04 12:09:17,418] Trial 979 finished with value: 0.5153895220250094 and parameters: {'n_estimators': 103, 'max_depth': 16, 'min_samples_split': 3, 'min_samples_leaf': 1, 'max_features': None, 'bootstrap': True, 'criterion': 'absolute_error'}. Best is trial 744 with value: 0.5032383725751689.
[I 2024-12-04 12:09:20,066] Trial 1002 finished with value: 1.220064745821959 and parameters: {'n_estimators': 123, 'max_depth': 26, 'min_samples_split': 3, 'min_samples_leaf': 11, 'max_features': 'sqrt', 'bootstrap': False, 'criterion': 'squared_error'}. Best is trial 744 with value: 0.5032383725751689.
[I 2024-12-04 12:09:20,122] Trial 989 finished with value: 0.5141834990677235 and parameters: {'n_estimators': 111, 'max_depth': 21, 'min_samples_split': 4, 'min_samples_leaf': 1, 'max_features': None, 'bootstrap': True, 'criterion': 'absolute_error'}. Best is trial 744 with value: 0.5032383725751689.
[I 2024-12-04 12:09:20,571] Trial 985 finished with value: 0.5836712229123989 and parameters: {'n_estimators': 162, 'max_depth': 5, 'min_samples_split': 2, 'min_samples_leaf': 2, 'max_features': None, 'bootstrap': True, 'criterion': 'absolute_error'}. Best is trial 744 with value: 0.5032383725751689.
[I 2024-12-04 12:09:21,826] Trial 992 finished with value: 0.5120992675083822 and parameters: {'n_estimators': 103, 'max_depth': 20, 'min_samples_split': 6, 'min_samples_leaf': 1, 'max_features': None, 'bootstrap': True, 'criterion': 'absolute_error'}. Best is trial 744 with value: 0.5032383725751689.
[I 2024-12-04 12:09:23,002] Trial 996 finished with value: 0.7770536367412235 and parameters: {'n_estimators': 103, 'max_depth': 21, 'min_samples_split': 3, 'min_samples_leaf': 1, 'max_features': 'sqrt', 'bootstrap': True, 'criterion': 'absolute_error'}. Best is trial 744 with value: 0.5032383725751689.
[I 2024-12-04 12:09:24,231] Trial 983 finished with value: 0.7744562318000334 and parameters: {'n_estimators': 958, 'max_depth': 46, 'min_samples_split': 7, 'min_samples_leaf': 1, 'max_features': 'log2', 'bootstrap': True, 'criterion': 'absolute_error'}. Best is trial 744 with value: 0.5032383725751689.
[I 2024-12-04 12:09:24,301] Trial 1001 finished with value: 1.0544209667761755 and parameters: {'n_estimators': 160, 'max_depth': 13, 'min_samples_split': 4, 'min_samples_leaf': 2, 'max_features': 'sqrt', 'bootstrap': True, 'criterion': 'absolute_error'}. Best is trial 744 with value: 0.5032383725751689.
[I 2024-12-04 12:09:24,937] Trial 987 finished with value: 1.3244885593754623 and parameters: {'n_estimators': 725, 'max_depth': 23, 'min_samples_split': 2, 'min_samples_leaf': 3, 'max_features': 'log2', 'bootstrap': True, 'criterion': 'absolute_error'}. Best is trial 744 with value: 0.5032383725751689.
[I 2024-12-04 12:09:26,783] Trial 990 finished with value: 0.5180138253811624 and parameters: {'n_estimators': 102, 'max_depth': 10, 'min_samples_split': 5, 'min_samples_leaf': 1, 'max_features': None, 'bootstrap': True, 'criterion': 'absolute_error'}. Best is trial 744 with value: 0.5032383725751689.
[I 2024-12-04 12:09:27,445] Trial 1005 finished with value: 0.842235760357466 and parameters: {'n_estimators': 233, 'max_depth': 22, 'min_samples_split': 40, 'min_samples_leaf': 12, 'max_features': None, 'bootstrap': True, 'criterion': 'squared_error'}. Best is trial 744 with value: 0.5032383725751689.
[I 2024-12-04 12:09:28,382] Trial 1000 finished with value: 1.286802365731599 and parameters: {'n_estimators': 280, 'max_depth': 17, 'min_samples_split': 5, 'min_samples_leaf': 2, 'max_features': 'log2', 'bootstrap': True, 'criterion': 'absolute_error'}. Best is trial 744 with value: 0.5032383725751689.
[I 2024-12-04 12:09:28,628] Trial 980 finished with value: 0.5218247814424651 and parameters: {'n_estimators': 239, 'max_depth': 24, 'min_samples_split': 3, 'min_samples_leaf': 1, 'max_features': None, 'bootstrap': True, 'criterion': 'absolute_error'}. Best is trial 744 with value: 0.5032383725751689.
[I 2024-12-04 12:09:29,036] Trial 1010 finished with value: 0.5578944289361044 and parameters: {'n_estimators': 104, 'max_depth': 14, 'min_samples_split': 3, 'min_samples_leaf': 2, 'max_features': None, 'bootstrap': True, 'criterion': 'absolute_error'}. Best is trial 744 with value: 0.5032383725751689.
[I 2024-12-04 12:09:29,298] Trial 923 finished with value: 0.5624414312559147 and parameters: {'n_estimators': 953, 'max_depth': 38, 'min_samples_split': 24, 'min_samples_leaf': 2, 'max_features': None, 'bootstrap': False, 'criterion': 'absolute_error'}. Best is trial 744 with value: 0.5032383725751689.
[I 2024-12-04 12:09:30,104] Trial 1003 finished with value: 0.5146120536120635 and parameters: {'n_estimators': 116, 'max_depth': 12, 'min_samples_split': 6, 'min_samples_leaf': 1, 'max_features': None, 'bootstrap': True, 'criterion': 'absolute_error'}. Best is trial 744 with value: 0.5032383725751689.
[I 2024-12-04 12:09:30,311] Trial 998 finished with value: 0.5137040036217178 and parameters: {'n_estimators': 107, 'max_depth': 22, 'min_samples_split': 3, 'min_samples_leaf': 1, 'max_features': None, 'bootstrap': True, 'criterion': 'absolute_error'}. Best is trial 744 with value: 0.5032383725751689.
[I 2024-12-04 12:09:30,452] Trial 1009 finished with value: 0.6753419107399391 and parameters: {'n_estimators': 155, 'max_depth': 31, 'min_samples_split': 3, 'min_samples_leaf': 7, 'max_features': None, 'bootstrap': True, 'criterion': 'absolute_error'}. Best is trial 744 with value: 0.5032383725751689.
[I 2024-12-04 12:09:31,357] Trial 999 finished with value: 0.5090584936752696 and parameters: {'n_estimators': 132, 'max_depth': 11, 'min_samples_split': 4, 'min_samples_leaf': 1, 'max_features': None, 'bootstrap': True, 'criterion': 'absolute_error'}. Best is trial 744 with value: 0.5032383725751689.
[I 2024-12-04 12:09:32,411] Trial 994 finished with value: 0.5630331826300428 and parameters: {'n_estimators': 109, 'max_depth': 16, 'min_samples_split': 3, 'min_samples_leaf': 1, 'max_features': None, 'bootstrap': False, 'criterion': 'absolute_error'}. Best is trial 744 with value: 0.5032383725751689.
[I 2024-12-04 12:09:34,460] Trial 1016 finished with value: 0.5603315979603399 and parameters: {'n_estimators': 108, 'max_depth': 26, 'min_samples_split': 3, 'min_samples_leaf': 2, 'max_features': None, 'bootstrap': True, 'criterion': 'squared_error'}. Best is trial 744 with value: 0.5032383725751689.
[I 2024-12-04 12:09:34,636] Trial 991 finished with value: 0.521919706610776 and parameters: {'n_estimators': 253, 'max_depth': 18, 'min_samples_split': 7, 'min_samples_leaf': 1, 'max_features': None, 'bootstrap': True, 'criterion': 'absolute_error'}. Best is trial 744 with value: 0.5032383725751689.
[I 2024-12-04 12:09:34,861] Trial 993 finished with value: 0.516662265655262 and parameters: {'n_estimators': 266, 'max_depth': 17, 'min_samples_split': 5, 'min_samples_leaf': 1, 'max_features': None, 'bootstrap': True, 'criterion': 'absolute_error'}. Best is trial 744 with value: 0.5032383725751689.
[I 2024-12-04 12:09:34,891] Trial 1008 finished with value: 0.5083378737444654 and parameters: {'n_estimators': 101, 'max_depth': 15, 'min_samples_split': 5, 'min_samples_leaf': 1, 'max_features': None, 'bootstrap': True, 'criterion': 'absolute_error'}. Best is trial 744 with value: 0.5032383725751689.
[I 2024-12-04 12:09:35,060] Trial 1004 finished with value: 1.2582071201574796 and parameters: {'n_estimators': 154, 'max_depth': 11, 'min_samples_split': 6, 'min_samples_leaf': 12, 'max_features': 'log2', 'bootstrap': True, 'criterion': 'squared_error'}. Best is trial 744 with value: 0.5032383725751689.
