[I 2024-12-04 20:23:55,269] Trial 1005 finished with value: 0.9864686819225589 and parameters: {'kernel_type': 'Matern', 'length_scale': 173.2173670723622, 'noise_level': 0.0005023271215005545, 'constant_value': 17.540283185964704, 'nu': 1.5}. Best is trial 959 with value: 0.1375110730946576.
[I 2024-12-04 20:24:01,482] Trial 1008 finished with value: 0.19720017022003714 and parameters: {'kernel_type': 'Matern', 'length_scale': 828.06979525325, 'noise_level': 0.0019200134100039758, 'constant_value': 10116.271189654908, 'nu': 0.5}. Best is trial 959 with value: 0.1375110730946576.
[I 2024-12-04 20:24:02,559] Trial 1007 finished with value: 0.1424950684296056 and parameters: {'kernel_type': 'Matern', 'length_scale': 160.25107282417525, 'noise_level': 0.8940437485991097, 'constant_value': 9.6729366711764, 'nu': 1.5}. Best is trial 959 with value: 0.1375110730946576.
[I 2024-12-04 20:24:02,619] Trial 1009 finished with value: 0.14249489822191866 and parameters: {'kernel_type': 'Matern', 'length_scale': 2.8388174556805588, 'noise_level': 0.008830797281243558, 'constant_value': 275.0091142160243, 'nu': 1.5}. Best is trial 959 with value: 0.1375110730946576.
[I 2024-12-04 20:24:06,460] Trial 1011 finished with value: 0.9864686819229229 and parameters: {'kernel_type': 'RBF', 'length_scale': 0.05432660151548007, 'noise_level': 0.01160333166291915, 'constant_value': 302.6797241968364, 'nu': 0.5}. Best is trial 959 with value: 0.1375110730946576.
[I 2024-12-04 20:24:08,889] Trial 1012 finished with value: 0.1477103572453511 and parameters: {'kernel_type': 'RBF', 'length_scale': 39.78630302174776, 'noise_level': 0.010807491400118585, 'constant_value': 59714.88275191873, 'nu': 0.5}. Best is trial 959 with value: 0.1375110730946576.
[I 2024-12-04 20:24:12,428] Trial 1010 finished with value: 0.1424950620976649 and parameters: {'kernel_type': 'Matern', 'length_scale': 0.13706834389073216, 'noise_level': 0.028054911729558367, 'constant_value': 0.27327406802566534, 'nu': 1.5}. Best is trial 959 with value: 0.1375110730946576.
[I 2024-12-04 20:24:14,013] Trial 1013 finished with value: 0.14249527128924888 and parameters: {'kernel_type': 'Matern', 'length_scale': 32.23440803018845, 'noise_level': 0.05424194143035399, 'constant_value': 0.26080390218963967, 'nu': 1.5}. Best is trial 959 with value: 0.1375110730946576.
[I 2024-12-04 20:24:16,579] Trial 1014 finished with value: 0.1424949408476695 and parameters: {'kernel_type': 'Matern', 'length_scale': 3.2172952181751753, 'noise_level': 0.9327575803195501, 'constant_value': 340.5626411394592, 'nu': 1.5}. Best is trial 959 with value: 0.1375110730946576.
[I 2024-12-04 20:24:16,979] Trial 1015 finished with value: 0.9982167338042436 and parameters: {'kernel_type': 'Matern', 'length_scale': 2.1227960146034184e-05, 'noise_level': 1.1415296346421827e-10, 'constant_value': 4.8519161690929415, 'nu': 1.5}. Best is trial 959 with value: 0.1375110730946576.
[I 2024-12-04 20:24:21,017] Trial 1016 finished with value: 0.14249506999547512 and parameters: {'kernel_type': 'Matern', 'length_scale': 16.71556882621253, 'noise_level': 0.019432791630543827, 'constant_value': 4709.845464259422, 'nu': 1.5}. Best is trial 959 with value: 0.1375110730946576.
[I 2024-12-04 20:24:22,189] Trial 1018 finished with value: 0.14249507313207446 and parameters: {'kernel_type': 'Matern', 'length_scale': 122.59672059070643, 'noise_level': 0.037009997517971405, 'constant_value': 1434.9797233835977, 'nu': 1.5}. Best is trial 959 with value: 0.1375110730946576.
[I 2024-12-04 20:24:27,811] Trial 1017 finished with value: 0.14249506225486902 and parameters: {'kernel_type': 'Matern', 'length_scale': 6.302723919204248, 'noise_level': 0.034910916805609815, 'constant_value': 3956.061371515859, 'nu': 1.5}. Best is trial 959 with value: 0.1375110730946576.
[I 2024-12-04 20:24:27,984] Trial 1019 finished with value: 0.1424950928918116 and parameters: {'kernel_type': 'Matern', 'length_scale': 14.507846293555051, 'noise_level': 0.10048266468417022, 'constant_value': 4.901490494743797, 'nu': 1.5}. Best is trial 959 with value: 0.1375110730946576.
[I 2024-12-04 20:24:29,880] Trial 1020 finished with value: 0.1424952494682452 and parameters: {'kernel_type': 'Matern', 'length_scale': 0.491517980377564, 'noise_level': 0.7876738794642949, 'constant_value': 144.502400172058, 'nu': 1.5}. Best is trial 959 with value: 0.1375110730946576.
[I 2024-12-04 20:24:35,725] Trial 1023 finished with value: 0.14249508881891232 and parameters: {'kernel_type': 'Matern', 'length_scale': 84.37843814261846, 'noise_level': 0.04810800419514803, 'constant_value': 3197.3528032562504, 'nu': 1.5}. Best is trial 959 with value: 0.1375110730946576.
[I 2024-12-04 20:24:37,189] Trial 1022 finished with value: 0.14249505965927842 and parameters: {'kernel_type': 'Matern', 'length_scale': 36.216866216067885, 'noise_level': 0.032126891171596055, 'constant_value': 8.66831040311969, 'nu': 1.5}. Best is trial 959 with value: 0.1375110730946576.
[I 2024-12-04 20:24:38,660] Trial 1021 finished with value: 0.9864686819335626 and parameters: {'kernel_type': 'Matern', 'length_scale': 4248.833053216067, 'noise_level': 0.0016723735984915244, 'constant_value': 140.4736372136868, 'nu': 1.5}. Best is trial 959 with value: 0.1375110730946576.
[I 2024-12-04 20:24:44,880] Trial 1026 finished with value: 0.1424949514978606 and parameters: {'kernel_type': 'Matern', 'length_scale': 0.7698711099723926, 'noise_level': 0.026579483157674846, 'constant_value': 290.0693916077382, 'nu': 1.5}. Best is trial 959 with value: 0.1375110730946576.
[I 2024-12-04 20:24:47,088] Trial 1025 finished with value: 0.1424948723471913 and parameters: {'kernel_type': 'Matern', 'length_scale': 6.090398052736632, 'noise_level': 0.9078167471538541, 'constant_value': 1.3682497966805818, 'nu': 1.5}. Best is trial 959 with value: 0.1375110730946576.
[I 2024-12-04 20:24:50,079] Trial 1024 finished with value: 0.1424954536354949 and parameters: {'kernel_type': 'Matern', 'length_scale': 6.936962934742219, 'noise_level': 0.808224512612198, 'constant_value': 1505.6906586145044, 'nu': 1.5}. Best is trial 959 with value: 0.1375110730946576.
[I 2024-12-04 20:24:51,178] Trial 1027 finished with value: 0.14249503865466748 and parameters: {'kernel_type': 'Matern', 'length_scale': 7.104886083030032, 'noise_level': 0.0007474131093020642, 'constant_value': 24.58296582063021, 'nu': 1.5}. Best is trial 959 with value: 0.1375110730946576.
[I 2024-12-04 20:24:53,568] Trial 1028 finished with value: 0.147710360560923 and parameters: {'kernel_type': 'RBF', 'length_scale': 18.299767660589566, 'noise_level': 0.781216440068038, 'constant_value': 89.14873653896939, 'nu': 1.5}. Best is trial 959 with value: 0.1375110730946576.
[I 2024-12-04 20:24:57,146] Trial 1030 finished with value: 0.14249505920140748 and parameters: {'kernel_type': 'Matern', 'length_scale': 90.52190428079965, 'noise_level': 0.051696689037772935, 'constant_value': 2314.2420317378446, 'nu': 1.5}. Best is trial 959 with value: 0.1375110730946576.
[I 2024-12-04 20:25:02,606] Trial 1031 finished with value: 0.1424950992536823 and parameters: {'kernel_type': 'Matern', 'length_scale': 726.5927451113674, 'noise_level': 0.9212829649969516, 'constant_value': 15.448553619234174, 'nu': 1.5}. Best is trial 959 with value: 0.1375110730946576.
[I 2024-12-04 20:25:03,350] Trial 1029 finished with value: 0.9864686819782746 and parameters: {'kernel_type': 'Matern', 'length_scale': 1.8031673956573682e-05, 'noise_level': 3.092217558257657e-05, 'constant_value': 9.96059737826235e-07, 'nu': 0.5}. Best is trial 959 with value: 0.1375110730946576.
[I 2024-12-04 20:25:03,650] Trial 1032 finished with value: 0.19720003576037562 and parameters: {'kernel_type': 'Matern', 'length_scale': 3.538072632162653, 'noise_level': 0.8644614637040555, 'constant_value': 151.85273452422865, 'nu': 0.5}. Best is trial 959 with value: 0.1375110730946576.
[I 2024-12-04 20:25:08,462] Trial 1034 finished with value: 0.9864686819227824 and parameters: {'kernel_type': 'Matern', 'length_scale': 0.033377004034785704, 'noise_level': 0.01908548089142891, 'constant_value': 112.41128753129705, 'nu': 1.5}. Best is trial 959 with value: 0.1375110730946576.
[I 2024-12-04 20:25:10,954] Trial 1033 finished with value: 0.19720003330070449 and parameters: {'kernel_type': 'Matern', 'length_scale': 3.675757178799657, 'noise_level': 0.4561142859506276, 'constant_value': 0.26593865571444103, 'nu': 0.5}. Best is trial 959 with value: 0.1375110730946576.
[I 2024-12-04 20:25:13,953] Trial 1035 finished with value: 0.9864686819230671 and parameters: {'kernel_type': 'Matern', 'length_scale': 12.798469958003183, 'noise_level': 0.007130226632969294, 'constant_value': 0.061721386702496515, 'nu': 1.5}. Best is trial 959 with value: 0.1375110730946576.
[I 2024-12-04 20:25:18,220] Trial 1037 finished with value: 0.14249506526331274 and parameters: {'kernel_type': 'Matern', 'length_scale': 7.015506197678453, 'noise_level': 0.03850838147961066, 'constant_value': 2566.04998376317, 'nu': 1.5}. Best is trial 959 with value: 0.1375110730946576.
[I 2024-12-04 20:25:20,647] Trial 1038 finished with value: 0.14249506090622657 and parameters: {'kernel_type': 'Matern', 'length_scale': 239.39351364280893, 'noise_level': 0.012427416199014864, 'constant_value': 140.25556255836958, 'nu': 1.5}. Best is trial 959 with value: 0.1375110730946576.
[I 2024-12-04 20:25:20,710] Trial 1036 finished with value: 0.1424950399359025 and parameters: {'kernel_type': 'Matern', 'length_scale': 0.18532275663388556, 'noise_level': 0.016674037845818182, 'constant_value': 2.7958479531589857, 'nu': 1.5}. Best is trial 959 with value: 0.1375110730946576.
[I 2024-12-04 20:25:27,844] Trial 1040 finished with value: 0.14249500927844125 and parameters: {'kernel_type': 'Matern', 'length_scale': 3.9911659801130517, 'noise_level': 0.6546468713187216, 'constant_value': 136.93757569837425, 'nu': 1.5}. Best is trial 959 with value: 0.1375110730946576.
[I 2024-12-04 20:25:28,170] Trial 1041 finished with value: 0.14469880482954564 and parameters: {'kernel_type': 'Matern', 'length_scale': 3.657299792265453, 'noise_level': 0.006550525115956152, 'constant_value': 617.4127768486301, 'nu': 2.5}. Best is trial 959 with value: 0.1375110730946576.
[I 2024-12-04 20:25:28,759] Trial 1039 finished with value: 0.9864686820651208 and parameters: {'kernel_type': 'Matern', 'length_scale': 444.5001051729328, 'noise_level': 0.0023426390326570625, 'constant_value': 3.818020042842539, 'nu': 1.5}. Best is trial 959 with value: 0.1375110730946576.
[I 2024-12-04 20:25:34,286] Trial 1044 finished with value: 0.14249521215510616 and parameters: {'kernel_type': 'Matern', 'length_scale': 484.6173169437358, 'noise_level': 0.5996383622185365, 'constant_value': 635.2105323221034, 'nu': 1.5}. Best is trial 959 with value: 0.1375110730946576.
[I 2024-12-04 20:25:35,088] Trial 1042 finished with value: 0.14249507555779423 and parameters: {'kernel_type': 'Matern', 'length_scale': 11.337370984634642, 'noise_level': 0.8830045496278608, 'constant_value': 675.3880707054677, 'nu': 1.5}. Best is trial 959 with value: 0.1375110730946576.
[I 2024-12-04 20:25:35,473] Trial 1043 finished with value: 0.14249506145956142 and parameters: {'kernel_type': 'Matern', 'length_scale': 233.6864550277009, 'noise_level': 0.06759830771774568, 'constant_value': 16.755875023188622, 'nu': 1.5}. Best is trial 959 with value: 0.1375110730946576.
[I 2024-12-04 20:25:44,521] Trial 1046 finished with value: 0.986468681939597 and parameters: {'kernel_type': 'Matern', 'length_scale': 0.02169356167061289, 'noise_level': 0.0486851284447389, 'constant_value': 1083.1482190460936, 'nu': 1.5}. Best is trial 959 with value: 0.1375110730946576.
[I 2024-12-04 20:25:48,694] Trial 1045 finished with value: 0.14249520716511976 and parameters: {'kernel_type': 'Matern', 'length_scale': 0.5822120291235809, 'noise_level': 0.022216145378643328, 'constant_value': 2.5323847700050703, 'nu': 1.5}. Best is trial 959 with value: 0.1375110730946576.
[I 2024-12-04 20:25:49,708] Trial 1047 finished with value: 0.9864686819067358 and parameters: {'kernel_type': 'RBF', 'length_scale': 0.0010128154715105815, 'noise_level': 2.0011036670052346e-05, 'constant_value': 3.444067520761594e-06, 'nu': 0.5}. Best is trial 959 with value: 0.1375110730946576.
[I 2024-12-04 20:25:51,326] Trial 1048 finished with value: 0.14249506328814657 and parameters: {'kernel_type': 'Matern', 'length_scale': 1.779336730487177, 'noise_level': 2.070817421164937e-05, 'constant_value': 1.001554646105123, 'nu': 1.5}. Best is trial 959 with value: 0.1375110730946576.
[I 2024-12-04 20:25:55,146] Trial 1050 finished with value: 0.9864686816439092 and parameters: {'kernel_type': 'Matern', 'length_scale': 5.244857972689738e-05, 'noise_level': 0.0034279930172816005, 'constant_value': 0.007342805422328717, 'nu': 1.5}. Best is trial 959 with value: 0.1375110730946576.
[I 2024-12-04 20:25:56,523] Trial 1049 finished with value: 0.14249506923293398 and parameters: {'kernel_type': 'Matern', 'length_scale': 1.3020315208598747, 'noise_level': 0.00917438548195523, 'constant_value': 37.20138195669495, 'nu': 1.5}. Best is trial 959 with value: 0.1375110730946576.
[I 2024-12-04 20:25:57,225] Trial 1051 finished with value: 0.14249507611814619 and parameters: {'kernel_type': 'Matern', 'length_scale': 1.6289778531775791, 'noise_level': 0.011934265176076066, 'constant_value': 60676.52269744969, 'nu': 1.5}. Best is trial 959 with value: 0.1375110730946576.
[I 2024-12-04 20:26:02,485] Trial 1052 finished with value: 0.14249507143105322 and parameters: {'kernel_type': 'Matern', 'length_scale': 17.758124061126228, 'noise_level': 0.045835625859764584, 'constant_value': 0.6455937530178585, 'nu': 1.5}. Best is trial 959 with value: 0.1375110730946576.
[I 2024-12-04 20:26:04,027] Trial 1053 finished with value: 0.14249526470088644 and parameters: {'kernel_type': 'Matern', 'length_scale': 5.074831250840316, 'noise_level': 0.8509894529488845, 'constant_value': 2136.6077607024463, 'nu': 1.5}. Best is trial 959 with value: 0.1375110730946576.
[I 2024-12-04 20:26:05,498] Trial 1054 finished with value: 0.14249508796612323 and parameters: {'kernel_type': 'Matern', 'length_scale': 2.9884907874736193, 'noise_level': 0.9855155482849957, 'constant_value': 3.0622963544720685, 'nu': 1.5}. Best is trial 959 with value: 0.1375110730946576.
[I 2024-12-04 20:26:14,245] Trial 1057 finished with value: 0.14249496292546887 and parameters: {'kernel_type': 'Matern', 'length_scale': 229.87446019268344, 'noise_level': 0.8612300470527696, 'constant_value': 142.4791330965022, 'nu': 1.5}. Best is trial 959 with value: 0.1375110730946576.
[I 2024-12-04 20:26:15,686] Trial 1056 finished with value: 0.14249511570300488 and parameters: {'kernel_type': 'Matern', 'length_scale': 602.1247219210927, 'noise_level': 0.044545163456842805, 'constant_value': 45.46661188708616, 'nu': 1.5}. Best is trial 959 with value: 0.1375110730946576.
[I 2024-12-04 20:26:16,642] Trial 1055 finished with value: 0.9864686819219841 and parameters: {'kernel_type': 'Matern', 'length_scale': 0.047828539000970595, 'noise_level': 0.3983062579228641, 'constant_value': 0.0039595318492313515, 'nu': 1.5}. Best is trial 959 with value: 0.1375110730946576.
[I 2024-12-04 20:26:21,182] Trial 1059 finished with value: 0.9864686819221085 and parameters: {'kernel_type': 'Matern', 'length_scale': 0.04427327732960132, 'noise_level': 0.9804250482985815, 'constant_value': 88.81367651774472, 'nu': 1.5}. Best is trial 959 with value: 0.1375110730946576.
[I 2024-12-04 20:26:22,654] Trial 1058 finished with value: 0.1424951207552777 and parameters: {'kernel_type': 'Matern', 'length_scale': 8.861370992128304, 'noise_level': 0.022073993318202863, 'constant_value': 6250.754135275848, 'nu': 1.5}. Best is trial 959 with value: 0.1375110730946576.
[I 2024-12-04 20:26:22,928] Trial 1060 finished with value: 0.14249506047793406 and parameters: {'kernel_type': 'Matern', 'length_scale': 552.6672105209127, 'noise_level': 0.009581752791778394, 'constant_value': 6114.177454631651, 'nu': 1.5}. Best is trial 959 with value: 0.1375110730946576.
[I 2024-12-04 20:26:28,972] Trial 1061 finished with value: 0.9864686820613352 and parameters: {'kernel_type': 'Matern', 'length_scale': 93.58121650444048, 'noise_level': 0.0005621157537410149, 'constant_value': 23.155389552715256, 'nu': 1.5}. Best is trial 959 with value: 0.1375110730946576.
[I 2024-12-04 20:26:29,530] Trial 1062 finished with value: 0.14249504670763483 and parameters: {'kernel_type': 'Matern', 'length_scale': 41.907934792214895, 'noise_level': 0.8859260693511111, 'constant_value': 2549.627765277473, 'nu': 1.5}. Best is trial 959 with value: 0.1375110730946576.
[I 2024-12-04 20:26:29,955] Trial 1063 finished with value: 0.14249505675627555 and parameters: {'kernel_type': 'Matern', 'length_scale': 13.580988269930254, 'noise_level': 0.005971749138013279, 'constant_value': 68.54454455004657, 'nu': 1.5}. Best is trial 959 with value: 0.1375110730946576.
[I 2024-12-04 20:26:37,083] Trial 1064 finished with value: 0.14249501234459847 and parameters: {'kernel_type': 'Matern', 'length_scale': 5.797345991887154, 'noise_level': 0.008761348158209418, 'constant_value': 89.26622626422451, 'nu': 1.5}. Best is trial 959 with value: 0.1375110730946576.
[I 2024-12-04 20:26:37,714] Trial 1066 finished with value: 0.14249506043938148 and parameters: {'kernel_type': 'Matern', 'length_scale': 33.943156407745036, 'noise_level': 0.08887825233786643, 'constant_value': 7.990101605930718, 'nu': 1.5}. Best is trial 959 with value: 0.1375110730946576.
[I 2024-12-04 20:26:38,261] Trial 1065 finished with value: 0.14249506256898975 and parameters: {'kernel_type': 'Matern', 'length_scale': 1.1814035782931962, 'noise_level': 0.02348365647600273, 'constant_value': 56.68114973172938, 'nu': 1.5}. Best is trial 959 with value: 0.1375110730946576.
[I 2024-12-04 20:26:42,073] Trial 1067 finished with value: 0.9864686819227616 and parameters: {'kernel_type': 'RBF', 'length_scale': 0.030650190287561458, 'noise_level': 0.008354104417106892, 'constant_value': 86608.13696690765, 'nu': 1.5}. Best is trial 959 with value: 0.1375110730946576.
[I 2024-12-04 20:26:42,728] Trial 1069 finished with value: 0.9864685700034163 and parameters: {'kernel_type': 'Matern', 'length_scale': 0.09522505262994688, 'noise_level': 0.32305678553592976, 'constant_value': 1959.6349714786215, 'nu': 1.5}. Best is trial 959 with value: 0.1375110730946576.
[I 2024-12-04 20:26:43,788] Trial 1068 finished with value: 0.14249507251819762 and parameters: {'kernel_type': 'Matern', 'length_scale': 67.19522358159954, 'noise_level': 0.003412300251156547, 'constant_value': 24230.949527674384, 'nu': 1.5}. Best is trial 959 with value: 0.1375110730946576.
[I 2024-12-04 20:26:48,585] Trial 1070 finished with value: 0.14249502086340776 and parameters: {'kernel_type': 'Matern', 'length_scale': 0.420671649373324, 'noise_level': 0.033053249231420265, 'constant_value': 381.1049309044795, 'nu': 1.5}. Best is trial 959 with value: 0.1375110730946576.
[I 2024-12-04 20:26:48,719] Trial 1071 finished with value: 0.9864686819055227 and parameters: {'kernel_type': 'Matern', 'length_scale': 198.3382240174773, 'noise_level': 0.0009220753221761362, 'constant_value': 7843.646951200169, 'nu': 2.5}. Best is trial 959 with value: 0.1375110730946576.
[I 2024-12-04 20:26:51,898] Trial 1072 finished with value: 0.14249505433194776 and parameters: {'kernel_type': 'Matern', 'length_scale': 140.45693497961443, 'noise_level': 0.14411323309134677, 'constant_value': 0.5069916236727656, 'nu': 1.5}. Best is trial 959 with value: 0.1375110730946576.
[I 2024-12-04 20:26:56,852] Trial 1073 finished with value: 0.14249506315666052 and parameters: {'kernel_type': 'Matern', 'length_scale': 0.9923981336395803, 'noise_level': 0.002343663048079859, 'constant_value': 0.14084522271005506, 'nu': 1.5}. Best is trial 959 with value: 0.1375110730946576.
[I 2024-12-04 20:27:00,586] Trial 1075 finished with value: 0.14249504604149307 and parameters: {'kernel_type': 'Matern', 'length_scale': 11.014182604719387, 'noise_level': 0.8952926090439246, 'constant_value': 127.91692954677934, 'nu': 1.5}. Best is trial 959 with value: 0.1375110730946576.
[I 2024-12-04 20:27:03,050] Trial 1074 finished with value: 0.14249497315633528 and parameters: {'kernel_type': 'Matern', 'length_scale': 6.717218025368002, 'noise_level': 0.029559989527563914, 'constant_value': 0.27273403835855475, 'nu': 1.5}. Best is trial 959 with value: 0.1375110730946576.
[I 2024-12-04 20:27:07,290] Trial 1077 finished with value: 0.9864686816988428 and parameters: {'kernel_type': 'RBF', 'length_scale': 343.3376650971565, 'noise_level': 6.476837098715625e-06, 'constant_value': 1.614101521540391, 'nu': 0.5}. Best is trial 959 with value: 0.1375110730946576.
[I 2024-12-04 20:27:09,841] Trial 1076 finished with value: 0.14249506412697244 and parameters: {'kernel_type': 'Matern', 'length_scale': 274.11514119081824, 'noise_level': 0.010727956919001448, 'constant_value': 152.7949370176951, 'nu': 1.5}. Best is trial 959 with value: 0.1375110730946576.
[I 2024-12-04 20:27:10,228] Trial 1078 finished with value: 0.14249516560409445 and parameters: {'kernel_type': 'Matern', 'length_scale': 2.0462029361425853, 'noise_level': 0.9831889881629197, 'constant_value': 3965.1266896151396, 'nu': 1.5}. Best is trial 959 with value: 0.1375110730946576.
[I 2024-12-04 20:27:14,688] Trial 1081 finished with value: 0.9982167337994617 and parameters: {'kernel_type': 'Matern', 'length_scale': 0.09442502960700487, 'noise_level': 0.002158994769470496, 'constant_value': 5606.955799711023, 'nu': 1.5}. Best is trial 959 with value: 0.1375110730946576.
[I 2024-12-04 20:27:15,356] Trial 1079 finished with value: 0.14249502681633686 and parameters: {'kernel_type': 'Matern', 'length_scale': 6.444456929715412, 'noise_level': 0.01850401816776143, 'constant_value': 18.541864242493876, 'nu': 1.5}. Best is trial 959 with value: 0.1375110730946576.
