[I 2024-12-04 15:11:11,780] Trial 1011 finished with value: 0.42119445876187755 and parameters: {'n_estimators': 838, 'max_depth': 33, 'min_samples_split': 2, 'min_samples_leaf': 1, 'max_features': None, 'bootstrap': True, 'criterion': 'squared_error'}. Best is trial 590 with value: 0.4185444504443197.
[I 2024-12-04 15:11:13,144] Trial 1008 finished with value: 0.4652246037307954 and parameters: {'n_estimators': 761, 'max_depth': 37, 'min_samples_split': 2, 'min_samples_leaf': 2, 'max_features': None, 'bootstrap': True, 'criterion': 'squared_error'}. Best is trial 590 with value: 0.4185444504443197.
[I 2024-12-04 15:11:13,176] Trial 1009 finished with value: 0.41938650980874287 and parameters: {'n_estimators': 777, 'max_depth': 39, 'min_samples_split': 2, 'min_samples_leaf': 1, 'max_features': None, 'bootstrap': True, 'criterion': 'squared_error'}. Best is trial 590 with value: 0.4185444504443197.
[I 2024-12-04 15:11:15,621] Trial 1003 finished with value: 0.42341775479749166 and parameters: {'n_estimators': 714, 'max_depth': 40, 'min_samples_split': 3, 'min_samples_leaf': 1, 'max_features': None, 'bootstrap': True, 'criterion': 'squared_error'}. Best is trial 590 with value: 0.4185444504443197.
[I 2024-12-04 15:11:18,282] Trial 1005 finished with value: 0.42137611863809493 and parameters: {'n_estimators': 829, 'max_depth': 42, 'min_samples_split': 2, 'min_samples_leaf': 1, 'max_features': None, 'bootstrap': True, 'criterion': 'squared_error'}. Best is trial 590 with value: 0.4185444504443197.
[I 2024-12-04 15:11:19,014] Trial 1029 finished with value: 1.0126344211864713 and parameters: {'n_estimators': 327, 'max_depth': 41, 'min_samples_split': 41, 'min_samples_leaf': 9, 'max_features': 'sqrt', 'bootstrap': True, 'criterion': 'squared_error'}. Best is trial 590 with value: 0.4185444504443197.
[I 2024-12-04 15:11:20,990] Trial 1016 finished with value: 0.421406416442138 and parameters: {'n_estimators': 783, 'max_depth': 45, 'min_samples_split': 2, 'min_samples_leaf': 1, 'max_features': None, 'bootstrap': True, 'criterion': 'squared_error'}. Best is trial 590 with value: 0.4185444504443197.
[I 2024-12-04 15:11:22,816] Trial 1019 finished with value: 0.4304201535279176 and parameters: {'n_estimators': 856, 'max_depth': 45, 'min_samples_split': 4, 'min_samples_leaf': 1, 'max_features': None, 'bootstrap': True, 'criterion': 'squared_error'}. Best is trial 590 with value: 0.4185444504443197.
[I 2024-12-04 15:11:22,819] Trial 1022 finished with value: 0.42340933229157085 and parameters: {'n_estimators': 596, 'max_depth': 46, 'min_samples_split': 2, 'min_samples_leaf': 1, 'max_features': None, 'bootstrap': True, 'criterion': 'squared_error'}. Best is trial 590 with value: 0.4185444504443197.
[I 2024-12-04 15:11:23,288] Trial 1013 finished with value: 0.4646529515116279 and parameters: {'n_estimators': 873, 'max_depth': 38, 'min_samples_split': 2, 'min_samples_leaf': 2, 'max_features': None, 'bootstrap': True, 'criterion': 'squared_error'}. Best is trial 590 with value: 0.4185444504443197.
[I 2024-12-04 15:11:23,636] Trial 1021 finished with value: 0.5275420054866742 and parameters: {'n_estimators': 847, 'max_depth': 37, 'min_samples_split': 2, 'min_samples_leaf': 1, 'max_features': None, 'bootstrap': False, 'criterion': 'squared_error'}. Best is trial 590 with value: 0.4185444504443197.
[I 2024-12-04 15:11:24,827] Trial 1015 finished with value: 0.4309285584911046 and parameters: {'n_estimators': 939, 'max_depth': 39, 'min_samples_split': 4, 'min_samples_leaf': 1, 'max_features': None, 'bootstrap': True, 'criterion': 'squared_error'}. Best is trial 590 with value: 0.4185444504443197.
[I 2024-12-04 15:11:25,243] Trial 1026 finished with value: 0.6109091312922545 and parameters: {'n_estimators': 174, 'max_depth': 50, 'min_samples_split': 23, 'min_samples_leaf': 3, 'max_features': None, 'bootstrap': False, 'criterion': 'absolute_error'}. Best is trial 590 with value: 0.4185444504443197.
[I 2024-12-04 15:11:30,314] Trial 1017 finished with value: 0.421242841742373 and parameters: {'n_estimators': 851, 'max_depth': 42, 'min_samples_split': 2, 'min_samples_leaf': 1, 'max_features': None, 'bootstrap': True, 'criterion': 'squared_error'}. Best is trial 590 with value: 0.4185444504443197.
[I 2024-12-04 15:11:30,760] Trial 1014 finished with value: 0.4198335436942063 and parameters: {'n_estimators': 1000, 'max_depth': 43, 'min_samples_split': 2, 'min_samples_leaf': 1, 'max_features': None, 'bootstrap': True, 'criterion': 'squared_error'}. Best is trial 590 with value: 0.4185444504443197.
[I 2024-12-04 15:11:31,909] Trial 1023 finished with value: 0.42069075631930636 and parameters: {'n_estimators': 847, 'max_depth': 36, 'min_samples_split': 2, 'min_samples_leaf': 1, 'max_features': None, 'bootstrap': True, 'criterion': 'squared_error'}. Best is trial 590 with value: 0.4185444504443197.
[I 2024-12-04 15:11:33,478] Trial 1020 finished with value: 0.43136724717339425 and parameters: {'n_estimators': 984, 'max_depth': 41, 'min_samples_split': 4, 'min_samples_leaf': 1, 'max_features': None, 'bootstrap': True, 'criterion': 'squared_error'}. Best is trial 590 with value: 0.4185444504443197.
[I 2024-12-04 15:11:37,725] Trial 1027 finished with value: 0.4197321450604232 and parameters: {'n_estimators': 755, 'max_depth': 39, 'min_samples_split': 2, 'min_samples_leaf': 1, 'max_features': None, 'bootstrap': True, 'criterion': 'squared_error'}. Best is trial 1025 with value: 0.41844370194907604.
[I 2024-12-04 15:11:39,626] Trial 1025 finished with value: 0.41844370194907604 and parameters: {'n_estimators': 762, 'max_depth': 40, 'min_samples_split': 2, 'min_samples_leaf': 1, 'max_features': None, 'bootstrap': True, 'criterion': 'squared_error'}. Best is trial 1025 with value: 0.41844370194907604.
[I 2024-12-04 15:11:44,872] Trial 1031 finished with value: 0.4231892184822876 and parameters: {'n_estimators': 498, 'max_depth': 34, 'min_samples_split': 2, 'min_samples_leaf': 1, 'max_features': None, 'bootstrap': True, 'criterion': 'squared_error'}. Best is trial 1025 with value: 0.41844370194907604.
[I 2024-12-04 15:11:45,635] Trial 1018 finished with value: 0.42154400963231564 and parameters: {'n_estimators': 770, 'max_depth': 42, 'min_samples_split': 2, 'min_samples_leaf': 1, 'max_features': None, 'bootstrap': True, 'criterion': 'squared_error'}. Best is trial 1025 with value: 0.41844370194907604.
[I 2024-12-04 15:11:47,705] Trial 1024 finished with value: 0.4211668864333359 and parameters: {'n_estimators': 685, 'max_depth': 36, 'min_samples_split': 2, 'min_samples_leaf': 1, 'max_features': None, 'bootstrap': True, 'criterion': 'squared_error'}. Best is trial 1025 with value: 0.41844370194907604.
[I 2024-12-04 15:11:47,963] Trial 1028 finished with value: 0.46568481480521995 and parameters: {'n_estimators': 963, 'max_depth': 46, 'min_samples_split': 2, 'min_samples_leaf': 2, 'max_features': None, 'bootstrap': True, 'criterion': 'squared_error'}. Best is trial 1025 with value: 0.41844370194907604.
[I 2024-12-04 15:11:47,985] Trial 1035 finished with value: 0.46450387680937694 and parameters: {'n_estimators': 629, 'max_depth': 41, 'min_samples_split': 3, 'min_samples_leaf': 2, 'max_features': None, 'bootstrap': True, 'criterion': 'squared_error'}. Best is trial 1025 with value: 0.41844370194907604.
[I 2024-12-04 15:11:48,509] Trial 1033 finished with value: 0.4324108788233414 and parameters: {'n_estimators': 859, 'max_depth': 34, 'min_samples_split': 4, 'min_samples_leaf': 1, 'max_features': None, 'bootstrap': True, 'criterion': 'squared_error'}. Best is trial 1025 with value: 0.41844370194907604.
[I 2024-12-04 15:11:48,634] Trial 1039 finished with value: 0.46456857692490444 and parameters: {'n_estimators': 654, 'max_depth': 39, 'min_samples_split': 2, 'min_samples_leaf': 2, 'max_features': None, 'bootstrap': True, 'criterion': 'squared_error'}. Best is trial 1025 with value: 0.41844370194907604.
[I 2024-12-04 15:11:50,205] Trial 1038 finished with value: 0.4238113005862134 and parameters: {'n_estimators': 765, 'max_depth': 47, 'min_samples_split': 3, 'min_samples_leaf': 1, 'max_features': None, 'bootstrap': True, 'criterion': 'squared_error'}. Best is trial 1025 with value: 0.41844370194907604.
[I 2024-12-04 15:11:50,552] Trial 1041 finished with value: 0.7021669882278776 and parameters: {'n_estimators': 717, 'max_depth': 33, 'min_samples_split': 2, 'min_samples_leaf': 2, 'max_features': 'sqrt', 'bootstrap': True, 'criterion': 'squared_error'}. Best is trial 1025 with value: 0.41844370194907604.
[I 2024-12-04 15:11:51,132] Trial 1044 finished with value: 0.5784966124077475 and parameters: {'n_estimators': 667, 'max_depth': 30, 'min_samples_split': 5, 'min_samples_leaf': 1, 'max_features': 'sqrt', 'bootstrap': True, 'criterion': 'squared_error'}. Best is trial 1025 with value: 0.41844370194907604.
[I 2024-12-04 15:11:51,727] Trial 1036 finished with value: 0.4210314986670535 and parameters: {'n_estimators': 786, 'max_depth': 37, 'min_samples_split': 2, 'min_samples_leaf': 1, 'max_features': None, 'bootstrap': True, 'criterion': 'squared_error'}. Best is trial 1025 with value: 0.41844370194907604.
[I 2024-12-04 15:11:52,115] Trial 1037 finished with value: 0.4316213458987839 and parameters: {'n_estimators': 808, 'max_depth': 40, 'min_samples_split': 4, 'min_samples_leaf': 1, 'max_features': None, 'bootstrap': True, 'criterion': 'squared_error'}. Best is trial 1025 with value: 0.41844370194907604.
[I 2024-12-04 15:11:52,242] Trial 1034 finished with value: 0.4195646304284735 and parameters: {'n_estimators': 836, 'max_depth': 39, 'min_samples_split': 2, 'min_samples_leaf': 1, 'max_features': None, 'bootstrap': True, 'criterion': 'squared_error'}. Best is trial 1025 with value: 0.41844370194907604.
[I 2024-12-04 15:11:57,931] Trial 1042 finished with value: 0.4326370418099299 and parameters: {'n_estimators': 672, 'max_depth': 36, 'min_samples_split': 4, 'min_samples_leaf': 1, 'max_features': None, 'bootstrap': True, 'criterion': 'squared_error'}. Best is trial 1025 with value: 0.41844370194907604.
[I 2024-12-04 15:12:00,544] Trial 1043 finished with value: 0.4227680420695844 and parameters: {'n_estimators': 641, 'max_depth': 45, 'min_samples_split': 2, 'min_samples_leaf': 1, 'max_features': None, 'bootstrap': True, 'criterion': 'squared_error'}. Best is trial 1025 with value: 0.41844370194907604.
[I 2024-12-04 15:12:03,030] Trial 1049 finished with value: 0.49732293010006207 and parameters: {'n_estimators': 573, 'max_depth': 47, 'min_samples_split': 2, 'min_samples_leaf': 1, 'max_features': 'sqrt', 'bootstrap': True, 'criterion': 'squared_error'}. Best is trial 1025 with value: 0.41844370194907604.
[I 2024-12-04 15:12:03,086] Trial 1045 finished with value: 0.42284358946065886 and parameters: {'n_estimators': 627, 'max_depth': 44, 'min_samples_split': 2, 'min_samples_leaf': 1, 'max_features': None, 'bootstrap': True, 'criterion': 'squared_error'}. Best is trial 1025 with value: 0.41844370194907604.
[I 2024-12-04 15:12:05,885] Trial 1046 finished with value: 0.41965614516025707 and parameters: {'n_estimators': 662, 'max_depth': 41, 'min_samples_split': 2, 'min_samples_leaf': 1, 'max_features': None, 'bootstrap': True, 'criterion': 'squared_error'}. Best is trial 1025 with value: 0.41844370194907604.
[I 2024-12-04 15:12:08,262] Trial 1060 finished with value: 1.0282216763334033 and parameters: {'n_estimators': 249, 'max_depth': 14, 'min_samples_split': 19, 'min_samples_leaf': 3, 'max_features': 'log2', 'bootstrap': True, 'criterion': 'squared_error'}. Best is trial 1025 with value: 0.41844370194907604.
[I 2024-12-04 15:12:11,942] Trial 1051 finished with value: 0.4205678852530151 and parameters: {'n_estimators': 705, 'max_depth': 31, 'min_samples_split': 2, 'min_samples_leaf': 1, 'max_features': None, 'bootstrap': True, 'criterion': 'squared_error'}. Best is trial 1025 with value: 0.41844370194907604.
[I 2024-12-04 15:12:11,950] Trial 1050 finished with value: 1.014237966483397 and parameters: {'n_estimators': 813, 'max_depth': 48, 'min_samples_split': 21, 'min_samples_leaf': 3, 'max_features': 'log2', 'bootstrap': True, 'criterion': 'absolute_error'}. Best is trial 1025 with value: 0.41844370194907604.
[I 2024-12-04 15:12:17,716] Trial 1048 finished with value: 0.5006788406025685 and parameters: {'n_estimators': 781, 'max_depth': 43, 'min_samples_split': 2, 'min_samples_leaf': 1, 'max_features': 'sqrt', 'bootstrap': True, 'criterion': 'squared_error'}. Best is trial 1025 with value: 0.41844370194907604.
[I 2024-12-04 15:12:20,127] Trial 1054 finished with value: 0.4313593822545251 and parameters: {'n_estimators': 626, 'max_depth': 45, 'min_samples_split': 4, 'min_samples_leaf': 1, 'max_features': None, 'bootstrap': True, 'criterion': 'squared_error'}. Best is trial 1025 with value: 0.41844370194907604.
[I 2024-12-04 15:12:21,814] Trial 1066 finished with value: 0.7119155051862615 and parameters: {'n_estimators': 472, 'max_depth': 48, 'min_samples_split': 8, 'min_samples_leaf': 13, 'max_features': None, 'bootstrap': False, 'criterion': 'squared_error'}. Best is trial 1025 with value: 0.41844370194907604.
[I 2024-12-04 15:12:23,693] Trial 1047 finished with value: 0.4653271072614121 and parameters: {'n_estimators': 753, 'max_depth': 32, 'min_samples_split': 2, 'min_samples_leaf': 2, 'max_features': None, 'bootstrap': True, 'criterion': 'squared_error'}. Best is trial 1025 with value: 0.41844370194907604.
[I 2024-12-04 15:12:23,778] Trial 1068 finished with value: 1.0533070181459359 and parameters: {'n_estimators': 653, 'max_depth': 49, 'min_samples_split': 3, 'min_samples_leaf': 9, 'max_features': 'log2', 'bootstrap': False, 'criterion': 'absolute_error'}. Best is trial 1025 with value: 0.41844370194907604.
[I 2024-12-04 15:12:28,827] Trial 1040 finished with value: 0.6286596800330762 and parameters: {'n_estimators': 560, 'max_depth': 12, 'min_samples_split': 7, 'min_samples_leaf': 3, 'max_features': None, 'bootstrap': False, 'criterion': 'absolute_error'}. Best is trial 1025 with value: 0.41844370194907604.
[I 2024-12-04 15:12:30,030] Trial 1058 finished with value: 0.4653099270179914 and parameters: {'n_estimators': 757, 'max_depth': 44, 'min_samples_split': 2, 'min_samples_leaf': 2, 'max_features': None, 'bootstrap': True, 'criterion': 'squared_error'}. Best is trial 1025 with value: 0.41844370194907604.
[I 2024-12-04 15:12:30,243] Trial 1030 finished with value: 0.4606967429822799 and parameters: {'n_estimators': 790, 'max_depth': 42, 'min_samples_split': 4, 'min_samples_leaf': 2, 'max_features': None, 'bootstrap': True, 'criterion': 'absolute_error'}. Best is trial 1025 with value: 0.41844370194907604.
[I 2024-12-04 15:12:30,538] Trial 1056 finished with value: 0.4222324002981341 and parameters: {'n_estimators': 674, 'max_depth': 33, 'min_samples_split': 2, 'min_samples_leaf': 1, 'max_features': None, 'bootstrap': True, 'criterion': 'squared_error'}. Best is trial 1025 with value: 0.41844370194907604.
[I 2024-12-04 15:12:31,181] Trial 1053 finished with value: 0.4208297544004021 and parameters: {'n_estimators': 725, 'max_depth': 43, 'min_samples_split': 2, 'min_samples_leaf': 1, 'max_features': None, 'bootstrap': True, 'criterion': 'squared_error'}. Best is trial 1025 with value: 0.41844370194907604.
[I 2024-12-04 15:12:32,158] Trial 1062 finished with value: 0.4340482388760996 and parameters: {'n_estimators': 588, 'max_depth': 36, 'min_samples_split': 4, 'min_samples_leaf': 1, 'max_features': None, 'bootstrap': True, 'criterion': 'squared_error'}. Best is trial 1025 with value: 0.41844370194907604.
[I 2024-12-04 15:12:37,357] Trial 1055 finished with value: 0.4656453801824023 and parameters: {'n_estimators': 792, 'max_depth': 38, 'min_samples_split': 4, 'min_samples_leaf': 2, 'max_features': None, 'bootstrap': True, 'criterion': 'squared_error'}. Best is trial 1025 with value: 0.41844370194907604.
[I 2024-12-04 15:12:40,273] Trial 1063 finished with value: 0.42152152523340636 and parameters: {'n_estimators': 716, 'max_depth': 42, 'min_samples_split': 2, 'min_samples_leaf': 1, 'max_features': None, 'bootstrap': True, 'criterion': 'squared_error'}. Best is trial 1025 with value: 0.41844370194907604.
[I 2024-12-04 15:12:43,785] Trial 1061 finished with value: 0.42368099637221057 and parameters: {'n_estimators': 801, 'max_depth': 40, 'min_samples_split': 3, 'min_samples_leaf': 1, 'max_features': None, 'bootstrap': True, 'criterion': 'squared_error'}. Best is trial 1025 with value: 0.41844370194907604.
[I 2024-12-04 15:12:44,569] Trial 1057 finished with value: 0.5920968641424006 and parameters: {'n_estimators': 405, 'max_depth': 41, 'min_samples_split': 5, 'min_samples_leaf': 3, 'max_features': None, 'bootstrap': False, 'criterion': 'absolute_error'}. Best is trial 1025 with value: 0.41844370194907604.
[I 2024-12-04 15:12:45,781] Trial 1071 finished with value: 0.46543453478143976 and parameters: {'n_estimators': 783, 'max_depth': 40, 'min_samples_split': 2, 'min_samples_leaf': 2, 'max_features': None, 'bootstrap': True, 'criterion': 'squared_error'}. Best is trial 1025 with value: 0.41844370194907604.
[I 2024-12-04 15:12:49,458] Trial 1059 finished with value: 0.7056684517462233 and parameters: {'n_estimators': 884, 'max_depth': 36, 'min_samples_split': 5, 'min_samples_leaf': 15, 'max_features': None, 'bootstrap': True, 'criterion': 'absolute_error'}. Best is trial 1025 with value: 0.41844370194907604.
[I 2024-12-04 15:12:49,466] Trial 1073 finished with value: 0.4216480881574449 and parameters: {'n_estimators': 750, 'max_depth': 42, 'min_samples_split': 2, 'min_samples_leaf': 1, 'max_features': None, 'bootstrap': True, 'criterion': 'squared_error'}. Best is trial 1025 with value: 0.41844370194907604.
[I 2024-12-04 15:12:49,515] Trial 1065 finished with value: 0.42097607309221036 and parameters: {'n_estimators': 753, 'max_depth': 37, 'min_samples_split': 2, 'min_samples_leaf': 1, 'max_features': None, 'bootstrap': True, 'criterion': 'squared_error'}. Best is trial 1025 with value: 0.41844370194907604.
[I 2024-12-04 15:12:50,661] Trial 1075 finished with value: 0.42311905865410404 and parameters: {'n_estimators': 539, 'max_depth': 38, 'min_samples_split': 2, 'min_samples_leaf': 1, 'max_features': None, 'bootstrap': True, 'criterion': 'squared_error'}. Best is trial 1025 with value: 0.41844370194907604.
[I 2024-12-04 15:12:51,004] Trial 1069 finished with value: 0.42133025853493017 and parameters: {'n_estimators': 779, 'max_depth': 45, 'min_samples_split': 2, 'min_samples_leaf': 1, 'max_features': None, 'bootstrap': True, 'criterion': 'squared_error'}. Best is trial 1025 with value: 0.41844370194907604.
[I 2024-12-04 15:12:51,618] Trial 1077 finished with value: 0.6165829442924036 and parameters: {'n_estimators': 795, 'max_depth': 45, 'min_samples_split': 4, 'min_samples_leaf': 1, 'max_features': 'log2', 'bootstrap': True, 'criterion': 'squared_error'}. Best is trial 1025 with value: 0.41844370194907604.
[I 2024-12-04 15:12:52,945] Trial 1070 finished with value: 0.4651080118708435 and parameters: {'n_estimators': 762, 'max_depth': 40, 'min_samples_split': 4, 'min_samples_leaf': 2, 'max_features': None, 'bootstrap': True, 'criterion': 'squared_error'}. Best is trial 1025 with value: 0.41844370194907604.
[I 2024-12-04 15:12:53,025] Trial 1067 finished with value: 0.4245218061384004 and parameters: {'n_estimators': 766, 'max_depth': 36, 'min_samples_split': 3, 'min_samples_leaf': 1, 'max_features': None, 'bootstrap': True, 'criterion': 'squared_error'}. Best is trial 1025 with value: 0.41844370194907604.
[I 2024-12-04 15:12:53,236] Trial 1076 finished with value: 0.8119158393661129 and parameters: {'n_estimators': 560, 'max_depth': 40, 'min_samples_split': 12, 'min_samples_leaf': 3, 'max_features': 'sqrt', 'bootstrap': True, 'criterion': 'absolute_error'}. Best is trial 1025 with value: 0.41844370194907604.
[I 2024-12-04 15:12:55,867] Trial 1064 finished with value: 0.4207061329900715 and parameters: {'n_estimators': 776, 'max_depth': 37, 'min_samples_split': 2, 'min_samples_leaf': 1, 'max_features': None, 'bootstrap': True, 'criterion': 'squared_error'}. Best is trial 1025 with value: 0.41844370194907604.
[I 2024-12-04 15:12:55,950] Trial 1072 finished with value: 0.42210258235690556 and parameters: {'n_estimators': 797, 'max_depth': 46, 'min_samples_split': 2, 'min_samples_leaf': 1, 'max_features': None, 'bootstrap': True, 'criterion': 'squared_error'}. Best is trial 1025 with value: 0.41844370194907604.
[I 2024-12-04 15:12:59,362] Trial 1032 finished with value: 0.43092808567716134 and parameters: {'n_estimators': 771, 'max_depth': 36, 'min_samples_split': 2, 'min_samples_leaf': 1, 'max_features': None, 'bootstrap': True, 'criterion': 'absolute_error'}. Best is trial 1025 with value: 0.41844370194907604.
[I 2024-12-04 15:12:59,475] Trial 1074 finished with value: 0.4219245979369182 and parameters: {'n_estimators': 788, 'max_depth': 35, 'min_samples_split': 2, 'min_samples_leaf': 1, 'max_features': None, 'bootstrap': True, 'criterion': 'squared_error'}. Best is trial 1025 with value: 0.41844370194907604.
[I 2024-12-04 15:13:01,180] Trial 1078 finished with value: 0.42114199210671605 and parameters: {'n_estimators': 787, 'max_depth': 37, 'min_samples_split': 2, 'min_samples_leaf': 1, 'max_features': None, 'bootstrap': True, 'criterion': 'squared_error'}. Best is trial 1025 with value: 0.41844370194907604.
[I 2024-12-04 15:13:01,421] Trial 1084 finished with value: 1.033917051459962 and parameters: {'n_estimators': 874, 'max_depth': 28, 'min_samples_split': 19, 'min_samples_leaf': 13, 'max_features': 'sqrt', 'bootstrap': True, 'criterion': 'squared_error'}. Best is trial 1025 with value: 0.41844370194907604.
[I 2024-12-04 15:13:07,323] Trial 1082 finished with value: 0.46543093565648513 and parameters: {'n_estimators': 828, 'max_depth': 38, 'min_samples_split': 2, 'min_samples_leaf': 2, 'max_features': None, 'bootstrap': True, 'criterion': 'squared_error'}. Best is trial 1025 with value: 0.41844370194907604.
