[I 2024-12-03 18:45:27,523] Trial 1083 finished with value: 0.6153271357035237 and parameters: {'kernel': 'rbf', 'C': 93.64326020884681, 'gamma': 0.049457208301478414, 'epsilon': 0.06779790932736869}. Best is trial 1054 with value: 0.4488898878253922.
[I 2024-12-03 18:45:27,864] Trial 1098 finished with value: 0.540219252308165 and parameters: {'kernel': 'rbf', 'C': 95.56874759650566, 'gamma': 0.029382082222617775, 'epsilon': 0.1089248267919326}. Best is trial 1054 with value: 0.4488898878253922.
[I 2024-12-03 18:45:27,873] Trial 1103 finished with value: 0.46117853126702696 and parameters: {'kernel': 'rbf', 'C': 87.08335161974809, 'gamma': 0.010072279845361631, 'epsilon': 0.07865109915277632}. Best is trial 1054 with value: 0.4488898878253922.
[I 2024-12-03 18:45:28,822] Trial 1106 finished with value: 0.4895882988683986 and parameters: {'kernel': 'rbf', 'C': 19.96314509873584, 'gamma': 0.04450787082744093, 'epsilon': 0.04710834354316588}. Best is trial 1054 with value: 0.4488898878253922.
[I 2024-12-03 18:45:29,548] Trial 1096 finished with value: 0.46535992656586317 and parameters: {'kernel': 'rbf', 'C': 99.51491012494267, 'gamma': 0.01979747379110373, 'epsilon': 0.051428651444457504}. Best is trial 1054 with value: 0.4488898878253922.
[I 2024-12-03 18:45:29,582] Trial 1100 finished with value: 0.45881722586754625 and parameters: {'kernel': 'rbf', 'C': 99.35384416533095, 'gamma': 0.010290130609832368, 'epsilon': 0.05997077785114635}. Best is trial 1054 with value: 0.4488898878253922.
[I 2024-12-03 18:45:29,583] Trial 1108 finished with value: 0.5088232273564237 and parameters: {'kernel': 'rbf', 'C': 98.0773598560741, 'gamma': 0.004291592342974721, 'epsilon': 0.053436349122714534}. Best is trial 1054 with value: 0.4488898878253922.
[I 2024-12-03 18:45:29,758] Trial 1110 finished with value: 0.5798268482018547 and parameters: {'kernel': 'rbf', 'C': 3.0911591443257374, 'gamma': 0.022697570481438185, 'epsilon': 0.17019728016738161}. Best is trial 1054 with value: 0.4488898878253922.
[I 2024-12-03 18:45:31,326] Trial 1099 finished with value: 0.5561691524550899 and parameters: {'kernel': 'rbf', 'C': 84.4215373112842, 'gamma': 0.0027477613926919294, 'epsilon': 0.10724400392944733}. Best is trial 1054 with value: 0.4488898878253922.
[I 2024-12-03 18:45:31,427] Trial 1109 finished with value: 0.5652527368785057 and parameters: {'kernel': 'rbf', 'C': 86.10257551905062, 'gamma': 0.008945626830419204, 'epsilon': 0.4374635643686157}. Best is trial 1054 with value: 0.4488898878253922.
[I 2024-12-03 18:45:31,550] Trial 1093 finished with value: 0.5075105054649102 and parameters: {'kernel': 'rbf', 'C': 15.226202670739488, 'gamma': 0.017459385703144266, 'epsilon': 0.010407619335160854}. Best is trial 1054 with value: 0.4488898878253922.
[I 2024-12-03 18:45:32,302] Trial 1104 finished with value: 0.5055807498516708 and parameters: {'kernel': 'rbf', 'C': 15.822110064589928, 'gamma': 0.016671107760929494, 'epsilon': 0.08598847753223735}. Best is trial 1054 with value: 0.4488898878253922.
[I 2024-12-03 18:45:32,501] Trial 1101 finished with value: 0.48751177846093285 and parameters: {'kernel': 'rbf', 'C': 99.90122835927025, 'gamma': 0.006177436819783205, 'epsilon': 0.057273251708982134}. Best is trial 1054 with value: 0.4488898878253922.
[I 2024-12-03 18:45:32,830] Trial 1105 finished with value: 0.4826776432501342 and parameters: {'kernel': 'rbf', 'C': 25.356570049224395, 'gamma': 0.014617947518479538, 'epsilon': 0.09613930841388629}. Best is trial 1054 with value: 0.4488898878253922.
[I 2024-12-03 18:45:33,464] Trial 1107 finished with value: 0.7668456600347722 and parameters: {'kernel': 'rbf', 'C': 23.591658643065674, 'gamma': 0.00019422293054414445, 'epsilon': 0.8047869005994946}. Best is trial 1054 with value: 0.4488898878253922.
[I 2024-12-03 18:45:33,469] Trial 1113 finished with value: 0.5837708065835087 and parameters: {'kernel': 'rbf', 'C': 17.905019568830816, 'gamma': 0.0038388426714587483, 'epsilon': 0.12874434754779446}. Best is trial 1054 with value: 0.4488898878253922.
[I 2024-12-03 18:45:33,506] Trial 1095 finished with value: 0.5161023031440624 and parameters: {'kernel': 'rbf', 'C': 93.08655677551674, 'gamma': 0.008587393804815135, 'epsilon': 0.2670908417799635}. Best is trial 1054 with value: 0.4488898878253922.
[I 2024-12-03 18:45:33,819] Trial 1114 finished with value: 0.5735457096917104 and parameters: {'kernel': 'linear', 'C': 1.2947394221483581, 'gamma': 0.08891128267970644, 'epsilon': 0.004999164041874033}. Best is trial 1054 with value: 0.4488898878253922.
[I 2024-12-03 18:45:34,279] Trial 1124 finished with value: 0.4785405271350475 and parameters: {'kernel': 'rbf', 'C': 99.6758162666536, 'gamma': 0.022473144983725886, 'epsilon': 0.02083516653614713}. Best is trial 1054 with value: 0.4488898878253922.
[I 2024-12-03 18:45:35,216] Trial 1094 finished with value: 0.5673887175053254 and parameters: {'kernel': 'linear', 'C': 16.701304421551363, 'gamma': 0.03495980692332638, 'epsilon': 0.05071858738291437}. Best is trial 1119 with value: 0.4485361816812923.
[I 2024-12-03 18:45:35,278] Trial 1116 finished with value: 0.47666581063915175 and parameters: {'kernel': 'rbf', 'C': 17.39113609008283, 'gamma': 0.024596662989205435, 'epsilon': 0.08470223305826186}. Best is trial 1119 with value: 0.4485361816812923.
[I 2024-12-03 18:45:35,283] Trial 1122 finished with value: 0.5728591249445022 and parameters: {'kernel': 'rbf', 'C': 24.683727146738896, 'gamma': 0.004478032738016962, 'epsilon': 0.026579701028841735}. Best is trial 1119 with value: 0.4485361816812923.
[I 2024-12-03 18:45:35,344] Trial 1119 finished with value: 0.4485361816812923 and parameters: {'kernel': 'rbf', 'C': 95.29387574721623, 'gamma': 0.013917386718918743, 'epsilon': 0.06506471693422208}. Best is trial 1119 with value: 0.4485361816812923.
[I 2024-12-03 18:45:35,394] Trial 1112 finished with value: 0.5222200288442477 and parameters: {'kernel': 'rbf', 'C': 13.507646065543993, 'gamma': 0.014574075398339284, 'epsilon': 0.05058145920249506}. Best is trial 1119 with value: 0.4485361816812923.
[I 2024-12-03 18:45:35,513] Trial 1118 finished with value: 0.4666662426790238 and parameters: {'kernel': 'rbf', 'C': 99.52832739436504, 'gamma': 0.008589328929474315, 'epsilon': 0.08112118205081965}. Best is trial 1119 with value: 0.4485361816812923.
[I 2024-12-03 18:45:35,662] Trial 1125 finished with value: 0.48184398710164134 and parameters: {'kernel': 'rbf', 'C': 94.60586868964549, 'gamma': 0.023986414132682998, 'epsilon': 0.03116655197170323}. Best is trial 1119 with value: 0.4485361816812923.
[I 2024-12-03 18:45:35,801] Trial 1117 finished with value: 0.5677929385564626 and parameters: {'kernel': 'linear', 'C': 58.83942173217995, 'gamma': 0.004036265206411705, 'epsilon': 0.1079526047661501}. Best is trial 1119 with value: 0.4485361816812923.
[I 2024-12-03 18:45:36,110] Trial 1120 finished with value: 0.5797540138649767 and parameters: {'kernel': 'rbf', 'C': 12.457329828708177, 'gamma': 0.09220083876691414, 'epsilon': 0.30188439638959214}. Best is trial 1119 with value: 0.4485361816812923.
[I 2024-12-03 18:45:36,370] Trial 1111 finished with value: 0.6100205658877226 and parameters: {'kernel': 'rbf', 'C': 26.617387337486743, 'gamma': 0.17769428676179785, 'epsilon': 0.03595780899807209}. Best is trial 1119 with value: 0.4485361816812923.
[I 2024-12-03 18:45:37,652] Trial 1121 finished with value: 0.5183077584278707 and parameters: {'kernel': 'rbf', 'C': 99.89065704998028, 'gamma': 0.023997605658194195, 'epsilon': 0.10739160569346905}. Best is trial 1119 with value: 0.4485361816812923.
[I 2024-12-03 18:45:38,044] Trial 1128 finished with value: 0.5077502884694435 and parameters: {'kernel': 'rbf', 'C': 97.27115299837844, 'gamma': 0.004717401025654366, 'epsilon': 0.10271721861081894}. Best is trial 1119 with value: 0.4485361816812923.
[I 2024-12-03 18:45:39,223] Trial 1134 finished with value: 1.294065263307267 and parameters: {'kernel': 'poly', 'C': 8.646945724989685, 'gamma': 0.0010410574162649094, 'epsilon': 0.00961803177703705}. Best is trial 1119 with value: 0.4485361816812923.
[I 2024-12-03 18:45:39,614] Trial 1123 finished with value: 0.6922178392075243 and parameters: {'kernel': 'linear', 'C': 0.05418193919704861, 'gamma': 0.6362736055950657, 'epsilon': 0.0013450660837386775}. Best is trial 1119 with value: 0.4485361816812923.
[I 2024-12-03 18:45:40,063] Trial 1130 finished with value: 0.5390893414683429 and parameters: {'kernel': 'rbf', 'C': 16.686659973005074, 'gamma': 0.009097597420528819, 'epsilon': 0.06603158261142737}. Best is trial 1119 with value: 0.4485361816812923.
[I 2024-12-03 18:45:41,138] Trial 1138 finished with value: 0.790312633130377 and parameters: {'kernel': 'rbf', 'C': 3.016649617668786, 'gamma': 0.0015760763245080596, 'epsilon': 0.03262706914618628}. Best is trial 1119 with value: 0.4485361816812923.
[I 2024-12-03 18:45:41,265] Trial 1129 finished with value: 0.6552276952974135 and parameters: {'kernel': 'rbf', 'C': 96.91778685476591, 'gamma': 0.05757332219159244, 'epsilon': 0.09352778680725163}. Best is trial 1119 with value: 0.4485361816812923.
[I 2024-12-03 18:45:41,332] Trial 1133 finished with value: 0.4508642639747765 and parameters: {'kernel': 'rbf', 'C': 96.71540075880732, 'gamma': 0.013469557481223138, 'epsilon': 0.05365374521243029}. Best is trial 1119 with value: 0.4485361816812923.
[I 2024-12-03 18:45:42,074] Trial 1127 finished with value: 0.48886495803838176 and parameters: {'kernel': 'rbf', 'C': 96.72766527583666, 'gamma': 0.02049415739581406, 'epsilon': 0.1066623097604908}. Best is trial 1119 with value: 0.4485361816812923.
[I 2024-12-03 18:45:42,446] Trial 1136 finished with value: 1.3654874814545634 and parameters: {'kernel': 'rbf', 'C': 0.009510647239632767, 'gamma': 0.0001139253906341905, 'epsilon': 0.054822433400871146}. Best is trial 1119 with value: 0.4485361816812923.
[I 2024-12-03 18:45:42,886] Trial 1131 finished with value: 0.530556273213582 and parameters: {'kernel': 'rbf', 'C': 22.392230579376722, 'gamma': 0.00909011160170711, 'epsilon': 0.03143505664574961}. Best is trial 1119 with value: 0.4485361816812923.
[I 2024-12-03 18:45:43,076] Trial 1137 finished with value: 1.5449519599720858 and parameters: {'kernel': 'sigmoid', 'C': 0.10596767212331785, 'gamma': 0.7316724065418696, 'epsilon': 0.005684506668514335}. Best is trial 1119 with value: 0.4485361816812923.
[I 2024-12-03 18:45:43,077] Trial 1135 finished with value: 0.4710044884589321 and parameters: {'kernel': 'rbf', 'C': 17.906359406599968, 'gamma': 0.0336638786236407, 'epsilon': 0.02127725322365515}. Best is trial 1119 with value: 0.4485361816812923.
[I 2024-12-03 18:45:43,259] Trial 1146 finished with value: 0.4931414188455188 and parameters: {'kernel': 'rbf', 'C': 96.18798480588757, 'gamma': 0.0260764128636341, 'epsilon': 0.04485180118667972}. Best is trial 1119 with value: 0.4485361816812923.
[I 2024-12-03 18:45:43,275] Trial 1143 finished with value: 0.540454217015166 and parameters: {'kernel': 'rbf', 'C': 19.34688353409496, 'gamma': 0.06010851666611771, 'epsilon': 0.12716442089318394}. Best is trial 1119 with value: 0.4485361816812923.
[I 2024-12-03 18:45:43,276] Trial 1132 finished with value: 0.45451634783707084 and parameters: {'kernel': 'rbf', 'C': 89.40288813139097, 'gamma': 0.017356045535567514, 'epsilon': 0.05678929979123583}. Best is trial 1119 with value: 0.4485361816812923.
[I 2024-12-03 18:45:43,384] Trial 1140 finished with value: 0.7297180861904586 and parameters: {'kernel': 'rbf', 'C': 3.8196145205365073, 'gamma': 0.0047760849672591164, 'epsilon': 0.09919435284161428}. Best is trial 1119 with value: 0.4485361816812923.
[I 2024-12-03 18:45:43,535] Trial 1145 finished with value: 1.3571992324684334 and parameters: {'kernel': 'sigmoid', 'C': 0.012731014595217246, 'gamma': 0.001662322699846593, 'epsilon': 0.006610789870399194}. Best is trial 1119 with value: 0.4485361816812923.
[I 2024-12-03 18:45:43,637] Trial 1150 finished with value: 0.5415161508196923 and parameters: {'kernel': 'rbf', 'C': 19.326965263324333, 'gamma': 0.007797400241808631, 'epsilon': 0.08940267253744379}. Best is trial 1119 with value: 0.4485361816812923.
[I 2024-12-03 18:45:43,640] Trial 1126 finished with value: 0.45321195074447024 and parameters: {'kernel': 'rbf', 'C': 99.81580927467346, 'gamma': 0.010570590213668008, 'epsilon': 0.08442647312561116}. Best is trial 1119 with value: 0.4485361816812923.
[I 2024-12-03 18:45:43,917] Trial 1151 finished with value: 0.5894373079031416 and parameters: {'kernel': 'rbf', 'C': 23.619802122913654, 'gamma': 0.00273865532478869, 'epsilon': 0.1531140569725062}. Best is trial 1119 with value: 0.4485361816812923.
[I 2024-12-03 18:45:44,057] Trial 1141 finished with value: 0.5073189286933626 and parameters: {'kernel': 'rbf', 'C': 96.00711426171269, 'gamma': 0.005220427308324589, 'epsilon': 0.018641309366010324}. Best is trial 1119 with value: 0.4485361816812923.
[I 2024-12-03 18:45:44,168] Trial 1147 finished with value: 0.48609628276974587 and parameters: {'kernel': 'rbf', 'C': 97.25778451579889, 'gamma': 0.024601815116984362, 'epsilon': 0.01669318409409086}. Best is trial 1119 with value: 0.4485361816812923.
[I 2024-12-03 18:45:44,325] Trial 1153 finished with value: 0.49087237104104803 and parameters: {'kernel': 'rbf', 'C': 17.31798387147471, 'gamma': 0.01754148796770867, 'epsilon': 0.17353494215670764}. Best is trial 1119 with value: 0.4485361816812923.
[I 2024-12-03 18:45:44,723] Trial 1144 finished with value: 0.4702554442438034 and parameters: {'kernel': 'rbf', 'C': 20.915527136227855, 'gamma': 0.020568160388484313, 'epsilon': 0.061439312222964115}. Best is trial 1119 with value: 0.4485361816812923.
[I 2024-12-03 18:45:45,175] Trial 1115 finished with value: 0.5748171820391778 and parameters: {'kernel': 'rbf', 'C': 78.32050604926404, 'gamma': 0.0016913222457266607, 'epsilon': 0.07243137204159754}. Best is trial 1119 with value: 0.4485361816812923.
[I 2024-12-03 18:45:45,661] Trial 1142 finished with value: 0.47360245994673056 and parameters: {'kernel': 'rbf', 'C': 93.32194577829196, 'gamma': 0.013396510742016646, 'epsilon': 0.16917928783380468}. Best is trial 1119 with value: 0.4485361816812923.
[I 2024-12-03 18:45:46,427] Trial 1149 finished with value: 0.4778144081562679 and parameters: {'kernel': 'rbf', 'C': 95.6280309367065, 'gamma': 0.007692500609913866, 'epsilon': 0.04300369418047422}. Best is trial 1119 with value: 0.4485361816812923.
[I 2024-12-03 18:45:46,782] Trial 1148 finished with value: 0.4654717599642107 and parameters: {'kernel': 'rbf', 'C': 21.95636035837893, 'gamma': 0.022324626008140912, 'epsilon': 0.041329819461352064}. Best is trial 1119 with value: 0.4485361816812923.
[I 2024-12-03 18:45:47,171] Trial 1152 finished with value: 0.4496159593719431 and parameters: {'kernel': 'rbf', 'C': 89.46825930852378, 'gamma': 0.01230596548321593, 'epsilon': 0.07638823336809406}. Best is trial 1119 with value: 0.4485361816812923.
[I 2024-12-03 18:45:47,895] Trial 1154 finished with value: 0.5450228742052534 and parameters: {'kernel': 'rbf', 'C': 15.425999671260973, 'gamma': 0.009694435289302394, 'epsilon': 0.2162481731058925}. Best is trial 1119 with value: 0.4485361816812923.
[I 2024-12-03 18:45:47,899] Trial 1156 finished with value: 0.5312580706216694 and parameters: {'kernel': 'rbf', 'C': 97.70143084282746, 'gamma': 0.0233067432945216, 'epsilon': 0.202740356003891}. Best is trial 1119 with value: 0.4485361816812923.
[I 2024-12-03 18:45:48,028] Trial 1159 finished with value: 0.5576191800041297 and parameters: {'kernel': 'rbf', 'C': 98.10890310327403, 'gamma': 0.002196531897400582, 'epsilon': 0.04940002307800851}. Best is trial 1119 with value: 0.4485361816812923.
[I 2024-12-03 18:45:48,214] Trial 1155 finished with value: 0.5307561234344634 and parameters: {'kernel': 'rbf', 'C': 22.360820659454387, 'gamma': 0.009103648045913532, 'epsilon': 0.029958814999269355}. Best is trial 1119 with value: 0.4485361816812923.
[I 2024-12-03 18:45:48,299] Trial 1162 finished with value: 1.3664344759275175 and parameters: {'kernel': 'sigmoid', 'C': 0.0096971840774455, 'gamma': 0.0002569980907096067, 'epsilon': 0.04380114744737827}. Best is trial 1119 with value: 0.4485361816812923.
[I 2024-12-03 18:45:49,237] Trial 1163 finished with value: 0.4949318205258836 and parameters: {'kernel': 'rbf', 'C': 19.052571086984823, 'gamma': 0.015721749101487686, 'epsilon': 0.10121394041460455}. Best is trial 1119 with value: 0.4485361816812923.
[I 2024-12-03 18:45:49,545] Trial 1139 finished with value: 0.49343548182336694 and parameters: {'kernel': 'rbf', 'C': 20.691656700282746, 'gamma': 0.04480282408972104, 'epsilon': 0.07108872901263867}. Best is trial 1119 with value: 0.4485361816812923.
[I 2024-12-03 18:45:49,556] Trial 1158 finished with value: 0.4783378627089974 and parameters: {'kernel': 'rbf', 'C': 97.58617997837612, 'gamma': 0.009250756588544592, 'epsilon': 0.1750843127690071}. Best is trial 1119 with value: 0.4485361816812923.
[I 2024-12-03 18:45:49,910] Trial 1170 finished with value: 0.5487722435831195 and parameters: {'kernel': 'rbf', 'C': 90.22478882626801, 'gamma': 0.0033102154089686073, 'epsilon': 0.18021444750093507}. Best is trial 1119 with value: 0.4485361816812923.
[I 2024-12-03 18:45:50,217] Trial 1160 finished with value: 0.9798500690038137 and parameters: {'kernel': 'poly', 'C': 86.07016135428917, 'gamma': 0.0062756892541589344, 'epsilon': 0.0991920217458962}. Best is trial 1119 with value: 0.4485361816812923.
[I 2024-12-03 18:45:50,272] Trial 1157 finished with value: 0.7617552080491655 and parameters: {'kernel': 'linear', 'C': 0.01694696278503783, 'gamma': 0.0010945019280994978, 'epsilon': 0.11837367011028334}. Best is trial 1119 with value: 0.4485361816812923.
[I 2024-12-03 18:45:50,659] Trial 1171 finished with value: 0.608554208568834 and parameters: {'kernel': 'rbf', 'C': 14.166726734563712, 'gamma': 0.003964753770016147, 'epsilon': 0.06375309145298633}. Best is trial 1119 with value: 0.4485361816812923.
[I 2024-12-03 18:45:50,929] Trial 1165 finished with value: 0.4799622421824086 and parameters: {'kernel': 'rbf', 'C': 21.47118882125586, 'gamma': 0.017303662050185197, 'epsilon': 0.08922756476554057}. Best is trial 1119 with value: 0.4485361816812923.
[I 2024-12-03 18:45:52,082] Trial 1161 finished with value: 0.49336594427675357 and parameters: {'kernel': 'rbf', 'C': 98.88446855208932, 'gamma': 0.025002489913702713, 'epsilon': 0.05673644462119809}. Best is trial 1119 with value: 0.4485361816812923.
[I 2024-12-03 18:45:52,716] Trial 1177 finished with value: 0.4485979141732157 and parameters: {'kernel': 'rbf', 'C': 96.01588343169114, 'gamma': 0.012194641629806456, 'epsilon': 0.08262145560202389}. Best is trial 1119 with value: 0.4485361816812923.
[I 2024-12-03 18:45:53,022] Trial 1167 finished with value: 0.6077329281436428 and parameters: {'kernel': 'rbf', 'C': 94.95429319752151, 'gamma': 0.16187155851067792, 'epsilon': 0.03538686811123267}. Best is trial 1119 with value: 0.4485361816812923.
[I 2024-12-03 18:45:53,049] Trial 1168 finished with value: 0.5839302998413994 and parameters: {'kernel': 'rbf', 'C': 95.43361931192518, 'gamma': 0.04290039023730845, 'epsilon': 0.07595086894215641}. Best is trial 1119 with value: 0.4485361816812923.
[I 2024-12-03 18:45:53,077] Trial 1169 finished with value: 0.4985796992206472 and parameters: {'kernel': 'rbf', 'C': 92.42330408364279, 'gamma': 0.005716378449410193, 'epsilon': 0.028153425558766695}. Best is trial 1119 with value: 0.4485361816812923.
[I 2024-12-03 18:45:53,078] Trial 1173 finished with value: 0.6131766903411955 and parameters: {'kernel': 'rbf', 'C': 19.583064135320413, 'gamma': 0.0028090381597408614, 'epsilon': 0.05330993683266091}. Best is trial 1119 with value: 0.4485361816812923.
[I 2024-12-03 18:45:53,147] Trial 1164 finished with value: 0.7542539784027306 and parameters: {'kernel': 'poly', 'C': 63.91615016042342, 'gamma': 0.06654360634479806, 'epsilon': 0.015040996043452978}. Best is trial 1119 with value: 0.4485361816812923.
[I 2024-12-03 18:45:53,628] Trial 1180 finished with value: 0.6192624772923129 and parameters: {'kernel': 'rbf', 'C': 17.760007555302266, 'gamma': 0.002857240530445375, 'epsilon': 0.14806447610027348}. Best is trial 1119 with value: 0.4485361816812923.
[I 2024-12-03 18:45:53,937] Trial 1176 finished with value: 0.49193543524337724 and parameters: {'kernel': 'rbf', 'C': 20.3239260555906, 'gamma': 0.03855917588748784, 'epsilon': 0.12758043583272435}. Best is trial 1119 with value: 0.4485361816812923.
[I 2024-12-03 18:45:54,172] Trial 1183 finished with value: 0.526808214511685 and parameters: {'kernel': 'rbf', 'C': 29.572405359933967, 'gamma': 0.01485055792497425, 'epsilon': 0.41514865274480517}. Best is trial 1119 with value: 0.4485361816812923.
[I 2024-12-03 18:45:54,488] Trial 1184 finished with value: 0.4603542148878289 and parameters: {'kernel': 'rbf', 'C': 93.6350234553965, 'gamma': 0.011464790160769874, 'epsilon': 0.029104327570652}. Best is trial 1119 with value: 0.4485361816812923.
[I 2024-12-03 18:45:54,584] Trial 1178 finished with value: 0.5599452649981522 and parameters: {'kernel': 'rbf', 'C': 97.68944104179705, 'gamma': 0.034573882802511294, 'epsilon': 0.13151636890717}. Best is trial 1119 with value: 0.4485361816812923.
[I 2024-12-03 18:45:54,881] Trial 1186 finished with value: 0.9558195803156951 and parameters: {'kernel': 'poly', 'C': 99.9244686544428, 'gamma': 0.006996140054540804, 'epsilon': 0.04342880691748798}. Best is trial 1119 with value: 0.4485361816812923.
[I 2024-12-03 18:45:55,858] Trial 1175 finished with value: 0.47543546817552174 and parameters: {'kernel': 'rbf', 'C': 26.764412724914944, 'gamma': 0.021331515500232667, 'epsilon': 0.1868614768315606}. Best is trial 1119 with value: 0.4485361816812923.
[I 2024-12-03 18:45:56,798] Trial 1166 finished with value: 0.45727231315247835 and parameters: {'kernel': 'rbf', 'C': 86.46858095474833, 'gamma': 0.018095804380147948, 'epsilon': 0.07447666291610013}. Best is trial 1119 with value: 0.4485361816812923.
