[I 2024-12-04 15:19:55,727] Trial 1484 finished with value: 1.2693635028569812 and parameters: {'kernel_type': 'Matern', 'length_scale': 0.01184752853358212, 'noise_level': 1.0347823830328013e-10, 'constant_value': 5.119759262991798, 'nu': 1.5}. Best is trial 1456 with value: 0.13435337537029549.
[I 2024-12-04 15:19:57,914] Trial 1494 finished with value: 0.13435441457404818 and parameters: {'kernel_type': 'Matern', 'length_scale': 28.290339874910007, 'noise_level': 0.0025449686082668877, 'constant_value': 2134.291750541149, 'nu': 1.5}. Best is trial 1456 with value: 0.13435337537029549.
[I 2024-12-04 15:20:00,364] Trial 1481 finished with value: 0.13435430598680326 and parameters: {'kernel_type': 'Matern', 'length_scale': 426.2746579233672, 'noise_level': 0.6590872818230318, 'constant_value': 69755.0941263315, 'nu': 1.5}. Best is trial 1456 with value: 0.13435337537029549.
[I 2024-12-04 15:20:00,407] Trial 1491 finished with value: 0.13435453204584752 and parameters: {'kernel_type': 'Matern', 'length_scale': 6.13330683861175, 'noise_level': 0.01779465160179561, 'constant_value': 813.8133570064061, 'nu': 1.5}. Best is trial 1456 with value: 0.13435337537029549.
[I 2024-12-04 15:20:00,541] Trial 1487 finished with value: 1.2693635028462218 and parameters: {'kernel_type': 'RBF', 'length_scale': 62475.632328694184, 'noise_level': 6.866854461161455e-05, 'constant_value': 0.0894987482414904, 'nu': 2.5}. Best is trial 1456 with value: 0.13435337537029549.
[I 2024-12-04 15:20:01,142] Trial 1496 finished with value: 0.13435441760273448 and parameters: {'kernel_type': 'Matern', 'length_scale': 2.5424213411139087, 'noise_level': 0.002833554847764134, 'constant_value': 68071.69369776682, 'nu': 1.5}. Best is trial 1456 with value: 0.13435337537029549.
[I 2024-12-04 15:20:01,817] Trial 1489 finished with value: 0.17251040539774157 and parameters: {'kernel_type': 'Matern', 'length_scale': 7.1790105720336275, 'noise_level': 0.003924244482854208, 'constant_value': 82995.52032741265, 'nu': 0.5}. Best is trial 1456 with value: 0.13435337537029549.
[I 2024-12-04 15:20:01,882] Trial 1485 finished with value: 0.13435435240723595 and parameters: {'kernel_type': 'Matern', 'length_scale': 0.3036076666401172, 'noise_level': 0.01008397837740918, 'constant_value': 3678.793886737826, 'nu': 1.5}. Best is trial 1456 with value: 0.13435337537029549.
[I 2024-12-04 15:20:02,738] Trial 1499 finished with value: 0.13435439967032484 and parameters: {'kernel_type': 'Matern', 'length_scale': 7.804553959815586, 'noise_level': 0.00440289564517878, 'constant_value': 32.30044139314577, 'nu': 1.5}. Best is trial 1456 with value: 0.13435337537029549.
[I 2024-12-04 15:20:03,511] Trial 1498 finished with value: 1.2693635028570331 and parameters: {'kernel_type': 'Matern', 'length_scale': 4952.321369604872, 'noise_level': 0.007273538523018247, 'constant_value': 1344.00021919077, 'nu': 1.5}. Best is trial 1456 with value: 0.13435337537029549.
[I 2024-12-04 15:20:05,202] Trial 1486 finished with value: 0.13435439414640168 and parameters: {'kernel_type': 'Matern', 'length_scale': 57.13733281684001, 'noise_level': 0.018336259426509415, 'constant_value': 4196.341166267939, 'nu': 1.5}. Best is trial 1456 with value: 0.13435337537029549.
[I 2024-12-04 15:20:05,375] Trial 1497 finished with value: 0.13435438173215414 and parameters: {'kernel_type': 'Matern', 'length_scale': 80.26284287865614, 'noise_level': 0.0003465743086708305, 'constant_value': 1179.483125093555, 'nu': 1.5}. Best is trial 1456 with value: 0.13435337537029549.
[I 2024-12-04 15:20:05,669] Trial 1492 finished with value: 0.1343543958926482 and parameters: {'kernel_type': 'Matern', 'length_scale': 3.8339348413131726, 'noise_level': 0.8671303261566611, 'constant_value': 0.19910447905994494, 'nu': 1.5}. Best is trial 1456 with value: 0.13435337537029549.
[I 2024-12-04 15:20:05,901] Trial 1495 finished with value: 1.3007739235813465 and parameters: {'kernel_type': 'Matern', 'length_scale': 0.025602115062117306, 'noise_level': 8.522928074799096e-05, 'constant_value': 82128.50761888226, 'nu': 2.5}. Best is trial 1456 with value: 0.13435337537029549.
[I 2024-12-04 15:20:08,226] Trial 1503 finished with value: 0.13435441129071915 and parameters: {'kernel_type': 'Matern', 'length_scale': 4.323339859734261, 'noise_level': 0.0007651221766217563, 'constant_value': 185.58680089010087, 'nu': 1.5}. Best is trial 1456 with value: 0.13435337537029549.
[I 2024-12-04 15:20:09,149] Trial 1501 finished with value: 0.13435439797045218 and parameters: {'kernel_type': 'Matern', 'length_scale': 117.11869692547474, 'noise_level': 0.013077291780760924, 'constant_value': 7169.786011594302, 'nu': 1.5}. Best is trial 1456 with value: 0.13435337537029549.
[I 2024-12-04 15:20:09,306] Trial 1500 finished with value: 0.13435407014686393 and parameters: {'kernel_type': 'Matern', 'length_scale': 10.50665375883605, 'noise_level': 0.005767286572330825, 'constant_value': 91988.51910767988, 'nu': 1.5}. Best is trial 1456 with value: 0.13435337537029549.
[I 2024-12-04 15:20:09,436] Trial 1507 finished with value: 0.13435436811659132 and parameters: {'kernel_type': 'Matern', 'length_scale': 17.08366720906774, 'noise_level': 0.0030699309557976596, 'constant_value': 90064.90674264893, 'nu': 1.5}. Best is trial 1456 with value: 0.13435337537029549.
[I 2024-12-04 15:20:10,790] Trial 1506 finished with value: 0.1343542026300148 and parameters: {'kernel_type': 'Matern', 'length_scale': 357.8332303564267, 'noise_level': 0.014406322832517018, 'constant_value': 1625.0882108778824, 'nu': 1.5}. Best is trial 1456 with value: 0.13435337537029549.
[I 2024-12-04 15:20:11,098] Trial 1504 finished with value: 1.2693635028570056 and parameters: {'kernel_type': 'Matern', 'length_scale': 0.0035419489465068643, 'noise_level': 8.045587320090662e-06, 'constant_value': 0.21109763978797783, 'nu': 1.5}. Best is trial 1456 with value: 0.13435337537029549.
[I 2024-12-04 15:20:13,187] Trial 1505 finished with value: 0.15167304218833252 and parameters: {'kernel_type': 'RBF', 'length_scale': 0.9286948334300722, 'noise_level': 0.00607289452172137, 'constant_value': 5669.436260100527, 'nu': 1.5}. Best is trial 1456 with value: 0.13435337537029549.
[I 2024-12-04 15:20:16,406] Trial 1509 finished with value: 0.13435439453164202 and parameters: {'kernel_type': 'Matern', 'length_scale': 1.3921727641010027, 'noise_level': 0.010099834969070883, 'constant_value': 1784.9279092883685, 'nu': 1.5}. Best is trial 1456 with value: 0.13435337537029549.
[I 2024-12-04 15:20:16,454] Trial 1502 finished with value: 0.1343543964661158 and parameters: {'kernel_type': 'Matern', 'length_scale': 2215.4023041795117, 'noise_level': 0.001480331504780679, 'constant_value': 91607.26867009605, 'nu': 1.5}. Best is trial 1456 with value: 0.13435337537029549.
[I 2024-12-04 15:20:17,725] Trial 1517 finished with value: 1.300773918250355 and parameters: {'kernel_type': 'RBF', 'length_scale': 1.6293332361616034e-05, 'noise_level': 0.20916762455105173, 'constant_value': 6.004044822604733e-06, 'nu': 0.5}. Best is trial 1456 with value: 0.13435337537029549.
[I 2024-12-04 15:20:17,786] Trial 1493 finished with value: 0.17251040909916412 and parameters: {'kernel_type': 'Matern', 'length_scale': 8.39646488723469, 'noise_level': 0.00195890451729144, 'constant_value': 23.909660498722833, 'nu': 0.5}. Best is trial 1456 with value: 0.13435337537029549.
[I 2024-12-04 15:20:19,270] Trial 1512 finished with value: 0.13435436684495583 and parameters: {'kernel_type': 'Matern', 'length_scale': 7.9934524328278185, 'noise_level': 0.0025359957368617965, 'constant_value': 22.916243593383907, 'nu': 1.5}. Best is trial 1456 with value: 0.13435337537029549.
[I 2024-12-04 15:20:21,098] Trial 1515 finished with value: 1.2693635028569077 and parameters: {'kernel_type': 'Matern', 'length_scale': 0.0256550675930491, 'noise_level': 0.006314514079745417, 'constant_value': 8220.581148343834, 'nu': 1.5}. Best is trial 1456 with value: 0.13435337537029549.
[I 2024-12-04 15:20:23,470] Trial 1508 finished with value: 0.13435443407066297 and parameters: {'kernel_type': 'Matern', 'length_scale': 0.5136928923933364, 'noise_level': 0.00021067423857140948, 'constant_value': 545.1144145918404, 'nu': 1.5}. Best is trial 1456 with value: 0.13435337537029549.
[I 2024-12-04 15:20:25,452] Trial 1520 finished with value: 0.13435435528001344 and parameters: {'kernel_type': 'Matern', 'length_scale': 12.07799470553389, 'noise_level': 0.00041406235729535555, 'constant_value': 78546.64507743323, 'nu': 1.5}. Best is trial 1456 with value: 0.13435337537029549.
[I 2024-12-04 15:20:26,084] Trial 1514 finished with value: 1.3007745979657548 and parameters: {'kernel_type': 'Matern', 'length_scale': 1.955747722546872, 'noise_level': 0.0008553015324123264, 'constant_value': 10193.94562524503, 'nu': 1.5}. Best is trial 1456 with value: 0.13435337537029549.
[I 2024-12-04 15:20:28,402] Trial 1521 finished with value: 0.13435439258220178 and parameters: {'kernel_type': 'Matern', 'length_scale': 1.3275427657379437, 'noise_level': 0.0353971949758, 'constant_value': 2511.070647610515, 'nu': 1.5}. Best is trial 1456 with value: 0.13435337537029549.
[I 2024-12-04 15:20:29,580] Trial 1510 finished with value: 0.13435437167479555 and parameters: {'kernel_type': 'Matern', 'length_scale': 0.8007410367821, 'noise_level': 0.0002636150647130969, 'constant_value': 32958.533137139195, 'nu': 1.5}. Best is trial 1456 with value: 0.13435337537029549.
[I 2024-12-04 15:20:30,124] Trial 1522 finished with value: 0.13435448725002064 and parameters: {'kernel_type': 'Matern', 'length_scale': 0.5825407856489336, 'noise_level': 6.284138466797178e-07, 'constant_value': 1.1445033993502727, 'nu': 1.5}. Best is trial 1456 with value: 0.13435337537029549.
[I 2024-12-04 15:20:30,555] Trial 1519 finished with value: 1.2693635028568808 and parameters: {'kernel_type': 'RBF', 'length_scale': 0.022775024037353705, 'noise_level': 0.008112767429185822, 'constant_value': 17.653586713527826, 'nu': 1.5}. Best is trial 1456 with value: 0.13435337537029549.
[I 2024-12-04 15:20:31,281] Trial 1516 finished with value: 0.13435439703107907 and parameters: {'kernel_type': 'Matern', 'length_scale': 1194.2287039441032, 'noise_level': 0.971335437288915, 'constant_value': 95013.20403407689, 'nu': 1.5}. Best is trial 1456 with value: 0.13435337537029549.
[I 2024-12-04 15:20:31,950] Trial 1513 finished with value: 0.13435439921621783 and parameters: {'kernel_type': 'Matern', 'length_scale': 36.28312806652527, 'noise_level': 0.00317709799344615, 'constant_value': 2432.8475924963022, 'nu': 1.5}. Best is trial 1456 with value: 0.13435337537029549.
[I 2024-12-04 15:20:33,474] Trial 1511 finished with value: 0.1343544063553254 and parameters: {'kernel_type': 'Matern', 'length_scale': 2.8464370589496797, 'noise_level': 0.007152088778978292, 'constant_value': 47576.38787944564, 'nu': 1.5}. Best is trial 1456 with value: 0.13435337537029549.
[I 2024-12-04 15:20:36,097] Trial 1525 finished with value: 0.13435440272585814 and parameters: {'kernel_type': 'Matern', 'length_scale': 0.5698531396925282, 'noise_level': 0.016953293998248083, 'constant_value': 68.52006993553762, 'nu': 1.5}. Best is trial 1456 with value: 0.13435337537029549.
[I 2024-12-04 15:20:37,417] Trial 1528 finished with value: 1.2693635028581614 and parameters: {'kernel_type': 'Matern', 'length_scale': 0.0178556716621368, 'noise_level': 0.005388776599298687, 'constant_value': 29.742955992606017, 'nu': 1.5}. Best is trial 1456 with value: 0.13435337537029549.
[I 2024-12-04 15:20:38,468] Trial 1526 finished with value: 0.13435442887647378 and parameters: {'kernel_type': 'Matern', 'length_scale': 0.9036859072272769, 'noise_level': 0.004372789571008683, 'constant_value': 2172.637609060724, 'nu': 1.5}. Best is trial 1456 with value: 0.13435337537029549.
[I 2024-12-04 15:20:40,340] Trial 1523 finished with value: 1.3007739235927323 and parameters: {'kernel_type': 'RBF', 'length_scale': 2.5697842435001693e-05, 'noise_level': 1.172585844311481e-05, 'constant_value': 31643.350214852566, 'nu': 0.5}. Best is trial 1456 with value: 0.13435337537029549.
[I 2024-12-04 15:20:41,102] Trial 1531 finished with value: 0.14859822032443723 and parameters: {'kernel_type': 'Matern', 'length_scale': 20.963926628527744, 'noise_level': 0.0029555862625330097, 'constant_value': 3630.1178744525973, 'nu': 2.5}. Best is trial 1456 with value: 0.13435337537029549.
[I 2024-12-04 15:20:42,649] Trial 1518 finished with value: 0.1343543307815908 and parameters: {'kernel_type': 'Matern', 'length_scale': 0.15036324728122966, 'noise_level': 0.01432233339556676, 'constant_value': 70999.14620108226, 'nu': 1.5}. Best is trial 1456 with value: 0.13435337537029549.
[I 2024-12-04 15:20:43,662] Trial 1527 finished with value: 1.2693635028560124 and parameters: {'kernel_type': 'Matern', 'length_scale': 6.256361532761154e-05, 'noise_level': 0.13605669837013876, 'constant_value': 17.365085802117452, 'nu': 2.5}. Best is trial 1456 with value: 0.13435337537029549.
[I 2024-12-04 15:20:44,738] Trial 1529 finished with value: 0.13435450577789868 and parameters: {'kernel_type': 'Matern', 'length_scale': 0.14860995456361598, 'noise_level': 0.003830658834755915, 'constant_value': 97003.21491324897, 'nu': 1.5}. Best is trial 1456 with value: 0.13435337537029549.
[I 2024-12-04 15:20:45,127] Trial 1539 finished with value: 0.13435414590982547 and parameters: {'kernel_type': 'Matern', 'length_scale': 27.007442217537015, 'noise_level': 0.058752129500693286, 'constant_value': 2.2377781582064364, 'nu': 1.5}. Best is trial 1456 with value: 0.13435337537029549.
[I 2024-12-04 15:20:46,951] Trial 1534 finished with value: 0.17251040114822164 and parameters: {'kernel_type': 'Matern', 'length_scale': 0.5661081758962185, 'noise_level': 1.438332196869049e-07, 'constant_value': 0.29274057878322984, 'nu': 0.5}. Best is trial 1456 with value: 0.13435337537029549.
[I 2024-12-04 15:20:46,953] Trial 1524 finished with value: 1.2693635028565686 and parameters: {'kernel_type': 'Matern', 'length_scale': 0.004931885239053176, 'noise_level': 0.00011388082307644722, 'constant_value': 5.401557120437861e-06, 'nu': 1.5}. Best is trial 1456 with value: 0.13435337537029549.
[I 2024-12-04 15:20:47,229] Trial 1533 finished with value: 0.1485983558648001 and parameters: {'kernel_type': 'Matern', 'length_scale': 0.21652594346158208, 'noise_level': 0.8021351482721419, 'constant_value': 685.0453540829411, 'nu': 2.5}. Best is trial 1456 with value: 0.13435337537029549.
[I 2024-12-04 15:20:49,674] Trial 1540 finished with value: 0.13435439275481834 and parameters: {'kernel_type': 'Matern', 'length_scale': 6.179054171107047, 'noise_level': 0.002933491844283832, 'constant_value': 88504.37218020488, 'nu': 1.5}. Best is trial 1456 with value: 0.13435337537029549.
[I 2024-12-04 15:20:50,425] Trial 1541 finished with value: 0.13435440006866622 and parameters: {'kernel_type': 'Matern', 'length_scale': 7.9924973830282715, 'noise_level': 0.00014682172304056237, 'constant_value': 1181.9943539504297, 'nu': 1.5}. Best is trial 1456 with value: 0.13435337537029549.
[I 2024-12-04 15:20:50,432] Trial 1538 finished with value: 0.13435440310238622 and parameters: {'kernel_type': 'Matern', 'length_scale': 236.23142007892218, 'noise_level': 0.02589468132226364, 'constant_value': 9.861566706416408, 'nu': 1.5}. Best is trial 1456 with value: 0.13435337537029549.
[I 2024-12-04 15:20:50,442] Trial 1535 finished with value: 0.13435439643071745 and parameters: {'kernel_type': 'Matern', 'length_scale': 253.26486498090992, 'noise_level': 0.00013329955272634847, 'constant_value': 1000.3748798851553, 'nu': 1.5}. Best is trial 1456 with value: 0.13435337537029549.
[I 2024-12-04 15:20:51,049] Trial 1530 finished with value: 1.2693635028569672 and parameters: {'kernel_type': 'Matern', 'length_scale': 71.66957452827675, 'noise_level': 8.954405313339945e-05, 'constant_value': 2.6870055889581668, 'nu': 1.5}. Best is trial 1456 with value: 0.13435337537029549.
[I 2024-12-04 15:20:53,668] Trial 1542 finished with value: 0.1343543988904382 and parameters: {'kernel_type': 'Matern', 'length_scale': 2.126534934496765, 'noise_level': 0.004404353011114584, 'constant_value': 0.05154194853799627, 'nu': 1.5}. Best is trial 1456 with value: 0.13435337537029549.
[I 2024-12-04 15:20:54,226] Trial 1543 finished with value: 0.13435436673889173 and parameters: {'kernel_type': 'Matern', 'length_scale': 9.235464863639546, 'noise_level': 0.03597624677484702, 'constant_value': 73156.99769982274, 'nu': 1.5}. Best is trial 1456 with value: 0.13435337537029549.
[I 2024-12-04 15:20:55,118] Trial 1544 finished with value: 0.13435439964507223 and parameters: {'kernel_type': 'Matern', 'length_scale': 2.1591862587834507, 'noise_level': 0.03723336521794416, 'constant_value': 4154.819800416885, 'nu': 1.5}. Best is trial 1456 with value: 0.13435337537029549.
[I 2024-12-04 15:20:55,360] Trial 1532 finished with value: 0.13435434054125783 and parameters: {'kernel_type': 'Matern', 'length_scale': 2688.91164505231, 'noise_level': 0.8267955284420012, 'constant_value': 4.681591608053853, 'nu': 1.5}. Best is trial 1456 with value: 0.13435337537029549.
[I 2024-12-04 15:20:55,363] Trial 1547 finished with value: 0.13435439354613982 and parameters: {'kernel_type': 'Matern', 'length_scale': 13.413148735730996, 'noise_level': 0.008403189214877309, 'constant_value': 5706.916822189979, 'nu': 1.5}. Best is trial 1456 with value: 0.13435337537029549.
[I 2024-12-04 15:20:55,809] Trial 1550 finished with value: 0.13435440011772165 and parameters: {'kernel_type': 'Matern', 'length_scale': 395.48807851030836, 'noise_level': 0.001209743831386799, 'constant_value': 84018.27955969349, 'nu': 1.5}. Best is trial 1456 with value: 0.13435337537029549.
[I 2024-12-04 15:20:56,139] Trial 1553 finished with value: 0.13435438842265812 and parameters: {'kernel_type': 'Matern', 'length_scale': 5.666068844631718, 'noise_level': 0.023351267248586476, 'constant_value': 93806.54986399066, 'nu': 1.5}. Best is trial 1456 with value: 0.13435337537029549.
[I 2024-12-04 15:20:59,545] Trial 1537 finished with value: 0.13435439787966466 and parameters: {'kernel_type': 'Matern', 'length_scale': 1.6894224915417486, 'noise_level': 0.7540335329483678, 'constant_value': 117.71463261232375, 'nu': 1.5}. Best is trial 1456 with value: 0.13435337537029549.
[I 2024-12-04 15:20:59,597] Trial 1549 finished with value: 0.13435440467261983 and parameters: {'kernel_type': 'Matern', 'length_scale': 2.133796785361648, 'noise_level': 0.008708179967277843, 'constant_value': 7.888216702613838, 'nu': 1.5}. Best is trial 1456 with value: 0.13435337537029549.
[I 2024-12-04 15:21:01,215] Trial 1536 finished with value: 0.13435439154183185 and parameters: {'kernel_type': 'Matern', 'length_scale': 25.40644187296496, 'noise_level': 0.0003250427897556939, 'constant_value': 95774.34091790477, 'nu': 1.5}. Best is trial 1456 with value: 0.13435337537029549.
[I 2024-12-04 15:21:01,216] Trial 1551 finished with value: 0.13435439733196972 and parameters: {'kernel_type': 'Matern', 'length_scale': 41.001083250593034, 'noise_level': 0.009279203718563719, 'constant_value': 1617.703670247443, 'nu': 1.5}. Best is trial 1456 with value: 0.13435337537029549.
[I 2024-12-04 15:21:01,267] Trial 1548 finished with value: 0.13435438651777076 and parameters: {'kernel_type': 'Matern', 'length_scale': 20.85325200731739, 'noise_level': 0.0010380205717894575, 'constant_value': 1398.0061656430755, 'nu': 1.5}. Best is trial 1456 with value: 0.13435337537029549.
[I 2024-12-04 15:21:03,082] Trial 1546 finished with value: 0.15167302038818425 and parameters: {'kernel_type': 'RBF', 'length_scale': 216.746519615066, 'noise_level': 0.9159525198284537, 'constant_value': 1651.03058856828, 'nu': 1.5}. Best is trial 1456 with value: 0.13435337537029549.
[I 2024-12-04 15:21:09,561] Trial 1555 finished with value: 0.1343545217331204 and parameters: {'kernel_type': 'Matern', 'length_scale': 0.8316032823795776, 'noise_level': 0.08110005506556116, 'constant_value': 794.7306934494148, 'nu': 1.5}. Best is trial 1456 with value: 0.13435337537029549.
[I 2024-12-04 15:21:10,764] Trial 1557 finished with value: 0.13435439838914043 and parameters: {'kernel_type': 'Matern', 'length_scale': 3.7301887195720695, 'noise_level': 0.03100021806329568, 'constant_value': 837.6773916832628, 'nu': 1.5}. Best is trial 1456 with value: 0.13435337537029549.
[I 2024-12-04 15:21:10,980] Trial 1564 finished with value: 0.13435439768015703 and parameters: {'kernel_type': 'Matern', 'length_scale': 13.836179591228941, 'noise_level': 0.006721728524186102, 'constant_value': 77740.33261793939, 'nu': 1.5}. Best is trial 1456 with value: 0.13435337537029549.
[I 2024-12-04 15:21:12,015] Trial 1563 finished with value: 1.2693635028569608 and parameters: {'kernel_type': 'Matern', 'length_scale': 0.018384249662723527, 'noise_level': 0.04577665224294475, 'constant_value': 48119.10915448715, 'nu': 1.5}. Best is trial 1456 with value: 0.13435337537029549.
[I 2024-12-04 15:21:12,911] Trial 1562 finished with value: 1.2693635028564436 and parameters: {'kernel_type': 'RBF', 'length_scale': 423.1822275579259, 'noise_level': 9.368916308625355e-07, 'constant_value': 2.150141558150127, 'nu': 0.5}. Best is trial 1456 with value: 0.13435337537029549.
[I 2024-12-04 15:21:13,413] Trial 1558 finished with value: 0.13435439441148642 and parameters: {'kernel_type': 'Matern', 'length_scale': 16.925414572002556, 'noise_level': 0.006355746854111965, 'constant_value': 2151.012724985492, 'nu': 1.5}. Best is trial 1456 with value: 0.13435337537029549.
[I 2024-12-04 15:21:13,431] Trial 1559 finished with value: 0.13435440468343554 and parameters: {'kernel_type': 'Matern', 'length_scale': 7.483465178133588, 'noise_level': 0.02058865487205803, 'constant_value': 38.82383131441351, 'nu': 1.5}. Best is trial 1456 with value: 0.13435337537029549.
