[I 2024-12-04 15:17:47,822] Trial 2167 finished with value: 0.48830342035848867 and parameters: {'kernel_type': 'Matern', 'length_scale': 0.28620313549601034, 'noise_level': 0.7017020478864642, 'constant_value': 133.1747441472547, 'nu': 0.5}. Best is trial 386 with value: 0.4872991004520934.
[I 2024-12-04 15:17:47,825] Trial 2170 finished with value: 0.4883034357529594 and parameters: {'kernel_type': 'Matern', 'length_scale': 2029.994582968241, 'noise_level': 0.017660409167739977, 'constant_value': 74685.25680527111, 'nu': 0.5}. Best is trial 386 with value: 0.4872991004520934.
[I 2024-12-04 15:17:50,032] Trial 2173 finished with value: 0.4883034188477919 and parameters: {'kernel_type': 'Matern', 'length_scale': 13.264329000421297, 'noise_level': 0.8043366327633535, 'constant_value': 0.0005991870293638919, 'nu': 0.5}. Best is trial 386 with value: 0.4872991004520934.
[I 2024-12-04 15:17:50,283] Trial 2179 finished with value: 0.4883034177049048 and parameters: {'kernel_type': 'Matern', 'length_scale': 315.51058396208526, 'noise_level': 0.05240055189006567, 'constant_value': 81972.09081186877, 'nu': 0.5}. Best is trial 386 with value: 0.4872991004520934.
[I 2024-12-04 15:17:50,925] Trial 2180 finished with value: 0.4883032914402219 and parameters: {'kernel_type': 'Matern', 'length_scale': 286.8919158683903, 'noise_level': 0.030561976277806175, 'constant_value': 6.453276568161386, 'nu': 0.5}. Best is trial 386 with value: 0.4872991004520934.
[I 2024-12-04 15:17:51,651] Trial 2177 finished with value: 0.4883034185166876 and parameters: {'kernel_type': 'Matern', 'length_scale': 85398.09128221434, 'noise_level': 0.044670349346119034, 'constant_value': 25875.994663724206, 'nu': 0.5}. Best is trial 386 with value: 0.4872991004520934.
[I 2024-12-04 15:17:53,395] Trial 2181 finished with value: 1.2401112366422788 and parameters: {'kernel_type': 'Matern', 'length_scale': 0.0002551336695068573, 'noise_level': 1.3957854250203495e-05, 'constant_value': 0.000325666972043095, 'nu': 1.5}. Best is trial 386 with value: 0.4872991004520934.
[I 2024-12-04 15:17:53,457] Trial 2190 finished with value: 0.48830342739428056 and parameters: {'kernel_type': 'Matern', 'length_scale': 245.80050321018072, 'noise_level': 0.08062232828328725, 'constant_value': 122.60912885323158, 'nu': 0.5}. Best is trial 386 with value: 0.4872991004520934.
[I 2024-12-04 15:17:53,653] Trial 2188 finished with value: 0.4883033146725498 and parameters: {'kernel_type': 'Matern', 'length_scale': 1346.1581539287852, 'noise_level': 0.7243240048704226, 'constant_value': 5222.404378603626, 'nu': 0.5}. Best is trial 386 with value: 0.4872991004520934.
[I 2024-12-04 15:17:54,409] Trial 2182 finished with value: 0.48830377284552234 and parameters: {'kernel_type': 'Matern', 'length_scale': 34.167214192143334, 'noise_level': 0.00257296109688639, 'constant_value': 74392.69294885607, 'nu': 0.5}. Best is trial 386 with value: 0.4872991004520934.
[I 2024-12-04 15:17:55,383] Trial 2186 finished with value: 0.48830341844525216 and parameters: {'kernel_type': 'Matern', 'length_scale': 2655.6637586788074, 'noise_level': 0.022520238449614986, 'constant_value': 2957.7071268848877, 'nu': 0.5}. Best is trial 386 with value: 0.4872991004520934.
[I 2024-12-04 15:17:58,573] Trial 2192 finished with value: 0.48830363051343906 and parameters: {'kernel_type': 'Matern', 'length_scale': 4084.145208367085, 'noise_level': 0.9759988129878208, 'constant_value': 2303.197857310241, 'nu': 0.5}. Best is trial 386 with value: 0.4872991004520934.
[I 2024-12-04 15:17:58,862] Trial 2185 finished with value: 0.4883034184261664 and parameters: {'kernel_type': 'Matern', 'length_scale': 4593.616191212106, 'noise_level': 0.03388380493418177, 'constant_value': 717.0282139035081, 'nu': 0.5}. Best is trial 386 with value: 0.4872991004520934.
[I 2024-12-04 15:17:59,611] Trial 2187 finished with value: 0.6443863896105958 and parameters: {'kernel_type': 'RBF', 'length_scale': 10.423870404070966, 'noise_level': 0.028433171571446942, 'constant_value': 559.4182130480739, 'nu': 0.5}. Best is trial 386 with value: 0.4872991004520934.
[I 2024-12-04 15:18:00,009] Trial 2184 finished with value: 0.48830211690303404 and parameters: {'kernel_type': 'Matern', 'length_scale': 52951.30995893012, 'noise_level': 0.008575736632009504, 'constant_value': 641.3800052055406, 'nu': 0.5}. Best is trial 386 with value: 0.4872991004520934.
[I 2024-12-04 15:18:00,350] Trial 2189 finished with value: 0.48830351905977704 and parameters: {'kernel_type': 'Matern', 'length_scale': 341.22572249703836, 'noise_level': 0.8492476892033503, 'constant_value': 128.0975134466517, 'nu': 0.5}. Best is trial 386 with value: 0.4872991004520934.
[I 2024-12-04 15:18:02,033] Trial 2195 finished with value: 0.48830341419938006 and parameters: {'kernel_type': 'Matern', 'length_scale': 78114.31932069214, 'noise_level': 0.2650786440647201, 'constant_value': 94486.93010003072, 'nu': 0.5}. Best is trial 386 with value: 0.4872991004520934.
[I 2024-12-04 15:18:02,569] Trial 2199 finished with value: 0.4883034729536048 and parameters: {'kernel_type': 'Matern', 'length_scale': 11793.329003029123, 'noise_level': 0.6903899034401824, 'constant_value': 77247.8974646663, 'nu': 0.5}. Best is trial 386 with value: 0.4872991004520934.
[I 2024-12-04 15:18:02,722] Trial 2196 finished with value: 1.2614547953941473 and parameters: {'kernel_type': 'Matern', 'length_scale': 59.16787085781757, 'noise_level': 0.03171732496318995, 'constant_value': 1014.228796165656, 'nu': 0.5}. Best is trial 386 with value: 0.4872991004520934.
[I 2024-12-04 15:18:02,728] Trial 2194 finished with value: 0.4883040147328355 and parameters: {'kernel_type': 'Matern', 'length_scale': 5150.458856487786, 'noise_level': 0.022183078655534302, 'constant_value': 248.35046057124475, 'nu': 0.5}. Best is trial 386 with value: 0.4872991004520934.
[I 2024-12-04 15:18:02,743] Trial 2193 finished with value: 1.2401112324320007 and parameters: {'kernel_type': 'RBF', 'length_scale': 127.32178028148594, 'noise_level': 1.5157929356855133e-10, 'constant_value': 0.00047713153191889326, 'nu': 1.5}. Best is trial 386 with value: 0.4872991004520934.
[I 2024-12-04 15:18:03,107] Trial 2198 finished with value: 1.261454791417251 and parameters: {'kernel_type': 'Matern', 'length_scale': 2333.298944479046, 'noise_level': 1.4557331188441303e-06, 'constant_value': 3796.595560642333, 'nu': 0.5}. Best is trial 386 with value: 0.4872991004520934.
[I 2024-12-04 15:18:03,134] Trial 2200 finished with value: 0.48830341559972035 and parameters: {'kernel_type': 'Matern', 'length_scale': 93138.20643776664, 'noise_level': 0.7393486841148827, 'constant_value': 2276.938385568926, 'nu': 0.5}. Best is trial 386 with value: 0.4872991004520934.
[I 2024-12-04 15:18:04,342] Trial 2191 finished with value: 1.2401112325811112 and parameters: {'kernel_type': 'RBF', 'length_scale': 308.70706381830473, 'noise_level': 0.036076239056734835, 'constant_value': 0.3054595865649373, 'nu': 0.5}. Best is trial 386 with value: 0.4872991004520934.
[I 2024-12-04 15:18:04,501] Trial 2203 finished with value: 1.261454779505074 and parameters: {'kernel_type': 'Matern', 'length_scale': 46.16109959644733, 'noise_level': 4.781333760628684e-10, 'constant_value': 6374.523857587557, 'nu': 0.5}. Best is trial 386 with value: 0.4872991004520934.
[I 2024-12-04 15:18:05,909] Trial 2197 finished with value: 0.48830340177461373 and parameters: {'kernel_type': 'Matern', 'length_scale': 61057.35930600612, 'noise_level': 0.0012004294045176451, 'constant_value': 1050.3157561253443, 'nu': 0.5}. Best is trial 386 with value: 0.4872991004520934.
[I 2024-12-04 15:18:06,645] Trial 2183 finished with value: 0.4883034276481293 and parameters: {'kernel_type': 'Matern', 'length_scale': 12275.805753570163, 'noise_level': 0.01289774253427856, 'constant_value': 93585.8937119511, 'nu': 0.5}. Best is trial 386 with value: 0.4872991004520934.
[I 2024-12-04 15:18:07,027] Trial 2204 finished with value: 0.48830346036478023 and parameters: {'kernel_type': 'Matern', 'length_scale': 6.809520838405467, 'noise_level': 0.4230408173392781, 'constant_value': 79406.56928794921, 'nu': 0.5}. Best is trial 386 with value: 0.4872991004520934.
[I 2024-12-04 15:18:07,335] Trial 2201 finished with value: 1.2401112392050744 and parameters: {'kernel_type': 'RBF', 'length_scale': 0.0011806428849899615, 'noise_level': 1.5263215648045514e-08, 'constant_value': 0.00012234195676747223, 'nu': 2.5}. Best is trial 386 with value: 0.4872991004520934.
[I 2024-12-04 15:18:08,313] Trial 2209 finished with value: 0.4883034072563623 and parameters: {'kernel_type': 'Matern', 'length_scale': 140.5585896291152, 'noise_level': 0.0005519807188129178, 'constant_value': 4.414620809323288, 'nu': 0.5}. Best is trial 386 with value: 0.4872991004520934.
[I 2024-12-04 15:18:08,362] Trial 2205 finished with value: 0.48830339310454407 and parameters: {'kernel_type': 'Matern', 'length_scale': 292.44185737070705, 'noise_level': 0.03476243773733229, 'constant_value': 983.9507557369761, 'nu': 0.5}. Best is trial 386 with value: 0.4872991004520934.
[I 2024-12-04 15:18:08,633] Trial 2207 finished with value: 0.48830342553650874 and parameters: {'kernel_type': 'Matern', 'length_scale': 698.0972151582432, 'noise_level': 0.011657844703345134, 'constant_value': 25.328098697025002, 'nu': 0.5}. Best is trial 386 with value: 0.4872991004520934.
[I 2024-12-04 15:18:08,816] Trial 2206 finished with value: 0.48830349930401 and parameters: {'kernel_type': 'Matern', 'length_scale': 74257.93329463643, 'noise_level': 0.04578453487360945, 'constant_value': 1304.167848972728, 'nu': 0.5}. Best is trial 386 with value: 0.4872991004520934.
[I 2024-12-04 15:18:08,862] Trial 2202 finished with value: 1.2614547953941473 and parameters: {'kernel_type': 'Matern', 'length_scale': 1360.6289388950968, 'noise_level': 0.029481397400034883, 'constant_value': 6538.846501087606, 'nu': 0.5}. Best is trial 386 with value: 0.4872991004520934.
[I 2024-12-04 15:18:10,431] Trial 2211 finished with value: 0.4883034168335666 and parameters: {'kernel_type': 'Matern', 'length_scale': 663.3784639307772, 'noise_level': 0.0069098580771587165, 'constant_value': 8.090787769783747, 'nu': 0.5}. Best is trial 386 with value: 0.4872991004520934.
[I 2024-12-04 15:18:10,933] Trial 2208 finished with value: 0.4883034522540523 and parameters: {'kernel_type': 'Matern', 'length_scale': 457.64936474602155, 'noise_level': 0.044713916600046824, 'constant_value': 0.5305458527546945, 'nu': 0.5}. Best is trial 386 with value: 0.4872991004520934.
[I 2024-12-04 15:18:12,978] Trial 2215 finished with value: 0.4883034191339106 and parameters: {'kernel_type': 'Matern', 'length_scale': 595.4842876394304, 'noise_level': 0.08394837466102624, 'constant_value': 109.09491238010746, 'nu': 0.5}. Best is trial 386 with value: 0.4872991004520934.
[I 2024-12-04 15:18:13,112] Trial 2212 finished with value: 0.48830342830379664 and parameters: {'kernel_type': 'Matern', 'length_scale': 232.67780701615783, 'noise_level': 0.035257270979342996, 'constant_value': 48.06299755559905, 'nu': 0.5}. Best is trial 386 with value: 0.4872991004520934.
[I 2024-12-04 15:18:13,600] Trial 2214 finished with value: 1.2614547976349166 and parameters: {'kernel_type': 'Matern', 'length_scale': 9742.258680182846, 'noise_level': 0.012284725278872914, 'constant_value': 0.07318381270388188, 'nu': 2.5}. Best is trial 386 with value: 0.4872991004520934.
[I 2024-12-04 15:18:14,494] Trial 2213 finished with value: 0.48830336791780676 and parameters: {'kernel_type': 'Matern', 'length_scale': 56.394694053835806, 'noise_level': 0.8915332057592076, 'constant_value': 2983.3731841304357, 'nu': 0.5}. Best is trial 386 with value: 0.4872991004520934.
[I 2024-12-04 15:18:14,498] Trial 2210 finished with value: 0.4883036762241831 and parameters: {'kernel_type': 'Matern', 'length_scale': 4501.83980095269, 'noise_level': 0.044083546671910966, 'constant_value': 87967.6269234913, 'nu': 0.5}. Best is trial 386 with value: 0.4872991004520934.
[I 2024-12-04 15:18:15,277] Trial 2216 finished with value: 0.48830342581057523 and parameters: {'kernel_type': 'Matern', 'length_scale': 1872.4673159163165, 'noise_level': 0.016390644636363267, 'constant_value': 40.71568073876532, 'nu': 0.5}. Best is trial 386 with value: 0.4872991004520934.
[I 2024-12-04 15:18:15,306] Trial 2218 finished with value: 0.4883034174273182 and parameters: {'kernel_type': 'Matern', 'length_scale': 20894.745360624238, 'noise_level': 0.9757062876524147, 'constant_value': 81485.99485085058, 'nu': 0.5}. Best is trial 386 with value: 0.4872991004520934.
[I 2024-12-04 15:18:18,035] Trial 2219 finished with value: 0.4883034178464981 and parameters: {'kernel_type': 'Matern', 'length_scale': 3289.8844185322855, 'noise_level': 0.889168855351327, 'constant_value': 470.05996139624176, 'nu': 0.5}. Best is trial 386 with value: 0.4872991004520934.
[I 2024-12-04 15:18:20,583] Trial 2228 finished with value: 1.2614547973197472 and parameters: {'kernel_type': 'Matern', 'length_scale': 0.6479917950391679, 'noise_level': 1.7529116585727902e-10, 'constant_value': 0.06480476324485349, 'nu': 2.5}. Best is trial 386 with value: 0.4872991004520934.
[I 2024-12-04 15:18:22,771] Trial 2217 finished with value: 0.4883034194241585 and parameters: {'kernel_type': 'Matern', 'length_scale': 922.687686916363, 'noise_level': 0.9749422037856708, 'constant_value': 29371.018933235056, 'nu': 0.5}. Best is trial 386 with value: 0.4872991004520934.
[I 2024-12-04 15:18:23,133] Trial 2224 finished with value: 0.4883034661947168 and parameters: {'kernel_type': 'Matern', 'length_scale': 1345.7180337063319, 'noise_level': 0.9954215985131397, 'constant_value': 97220.6420946233, 'nu': 0.5}. Best is trial 386 with value: 0.4872991004520934.
[I 2024-12-04 15:18:23,141] Trial 2220 finished with value: 0.48830341073661737 and parameters: {'kernel_type': 'Matern', 'length_scale': 1881.7333040294563, 'noise_level': 0.05327905951618504, 'constant_value': 7.810914074068977, 'nu': 0.5}. Best is trial 386 with value: 0.4872991004520934.
[I 2024-12-04 15:18:23,160] Trial 2234 finished with value: 0.48830341893392315 and parameters: {'kernel_type': 'Matern', 'length_scale': 99587.56596944144, 'noise_level': 0.05636185600383816, 'constant_value': 98380.65242446549, 'nu': 0.5}. Best is trial 386 with value: 0.4872991004520934.
[I 2024-12-04 15:18:23,226] Trial 2232 finished with value: 0.4883034263264596 and parameters: {'kernel_type': 'Matern', 'length_scale': 207.32435208416456, 'noise_level': 0.07343798508121949, 'constant_value': 96192.35634624242, 'nu': 0.5}. Best is trial 386 with value: 0.4872991004520934.
[I 2024-12-04 15:18:26,279] Trial 2230 finished with value: 0.4883040312921773 and parameters: {'kernel_type': 'Matern', 'length_scale': 1365.9309148086243, 'noise_level': 0.8908180146965416, 'constant_value': 982.2514983209162, 'nu': 0.5}. Best is trial 386 with value: 0.4872991004520934.
[I 2024-12-04 15:18:26,282] Trial 2226 finished with value: 0.4883034200195791 and parameters: {'kernel_type': 'Matern', 'length_scale': 8828.214467877578, 'noise_level': 0.02547149225988457, 'constant_value': 628.1897055410549, 'nu': 0.5}. Best is trial 386 with value: 0.4872991004520934.
[I 2024-12-04 15:18:26,556] Trial 2236 finished with value: 0.48830340817086404 and parameters: {'kernel_type': 'Matern', 'length_scale': 72332.5080915719, 'noise_level': 0.8593165890196668, 'constant_value': 9327.157521494335, 'nu': 0.5}. Best is trial 386 with value: 0.4872991004520934.
[I 2024-12-04 15:18:26,563] Trial 2227 finished with value: 0.4883034182646256 and parameters: {'kernel_type': 'Matern', 'length_scale': 3040.9788108549155, 'noise_level': 0.016583806092029266, 'constant_value': 85.96400246616054, 'nu': 0.5}. Best is trial 386 with value: 0.4872991004520934.
[I 2024-12-04 15:18:27,098] Trial 2239 finished with value: 0.48830341846491904 and parameters: {'kernel_type': 'Matern', 'length_scale': 1692.141778722118, 'noise_level': 0.7624126681324314, 'constant_value': 374.3657563614123, 'nu': 0.5}. Best is trial 386 with value: 0.4872991004520934.
[I 2024-12-04 15:18:27,969] Trial 2221 finished with value: 1.2614547976226096 and parameters: {'kernel_type': 'RBF', 'length_scale': 4719.756239724683, 'noise_level': 0.24903523671566136, 'constant_value': 3.395929472723085e-05, 'nu': 0.5}. Best is trial 386 with value: 0.4872991004520934.
[I 2024-12-04 15:18:27,985] Trial 2229 finished with value: 0.4883034446943308 and parameters: {'kernel_type': 'Matern', 'length_scale': 103.50715637903023, 'noise_level': 0.8375562224848999, 'constant_value': 11369.307797869706, 'nu': 0.5}. Best is trial 386 with value: 0.4872991004520934.
[I 2024-12-04 15:18:28,550] Trial 2231 finished with value: 0.4883034161739311 and parameters: {'kernel_type': 'Matern', 'length_scale': 8745.721145090025, 'noise_level': 0.02302553641366436, 'constant_value': 3173.016115236706, 'nu': 0.5}. Best is trial 386 with value: 0.4872991004520934.
[I 2024-12-04 15:18:28,567] Trial 2222 finished with value: 0.4883034193546546 and parameters: {'kernel_type': 'Matern', 'length_scale': 3062.263231424495, 'noise_level': 0.8133745494001142, 'constant_value': 819.9264160938463, 'nu': 0.5}. Best is trial 386 with value: 0.4872991004520934.
[I 2024-12-04 15:18:30,296] Trial 2240 finished with value: 0.4883035756062139 and parameters: {'kernel_type': 'Matern', 'length_scale': 98296.03971871278, 'noise_level': 0.09189998055339528, 'constant_value': 76753.44092680278, 'nu': 0.5}. Best is trial 386 with value: 0.4872991004520934.
[I 2024-12-04 15:18:30,575] Trial 2225 finished with value: 0.5273053676426827 and parameters: {'kernel_type': 'Matern', 'length_scale': 38600.961439142455, 'noise_level': 0.5370830326723942, 'constant_value': 53991.38316216744, 'nu': 1.5}. Best is trial 386 with value: 0.4872991004520934.
[I 2024-12-04 15:18:30,849] Trial 2241 finished with value: 0.48830346406848213 and parameters: {'kernel_type': 'Matern', 'length_scale': 66603.68578256144, 'noise_level': 0.6006688991639189, 'constant_value': 86456.73952350781, 'nu': 0.5}. Best is trial 386 with value: 0.4872991004520934.
[I 2024-12-04 15:18:30,928] Trial 2233 finished with value: 0.48830341815596856 and parameters: {'kernel_type': 'Matern', 'length_scale': 81332.53122226479, 'noise_level': 0.03066189506426738, 'constant_value': 1035.9786279093025, 'nu': 0.5}. Best is trial 386 with value: 0.4872991004520934.
[I 2024-12-04 15:18:32,204] Trial 2235 finished with value: 0.4883034779629181 and parameters: {'kernel_type': 'Matern', 'length_scale': 81.15352741429632, 'noise_level': 0.0014035507545004542, 'constant_value': 1385.8178243070745, 'nu': 0.5}. Best is trial 386 with value: 0.4872991004520934.
[I 2024-12-04 15:18:33,247] Trial 2237 finished with value: 0.5663938514455414 and parameters: {'kernel_type': 'Matern', 'length_scale': 10.807821568470903, 'noise_level': 0.9168531744586275, 'constant_value': 3517.8806564972756, 'nu': 2.5}. Best is trial 386 with value: 0.4872991004520934.
[I 2024-12-04 15:18:34,270] Trial 2223 finished with value: 0.48830341939652194 and parameters: {'kernel_type': 'Matern', 'length_scale': 88885.18406684393, 'noise_level': 0.707759204343241, 'constant_value': 5199.615611630206, 'nu': 0.5}. Best is trial 386 with value: 0.4872991004520934.
[I 2024-12-04 15:18:34,673] Trial 2238 finished with value: 0.48830342008300487 and parameters: {'kernel_type': 'Matern', 'length_scale': 99835.82617186329, 'noise_level': 0.022998105890141788, 'constant_value': 507.8002675481229, 'nu': 0.5}. Best is trial 386 with value: 0.4872991004520934.
[I 2024-12-04 15:18:35,404] Trial 2250 finished with value: 0.48830341747469225 and parameters: {'kernel_type': 'Matern', 'length_scale': 62.05361117772003, 'noise_level': 0.0783464713377864, 'constant_value': 602.9820303345808, 'nu': 0.5}. Best is trial 386 with value: 0.4872991004520934.
[I 2024-12-04 15:18:38,021] Trial 2242 finished with value: 0.4883033533414832 and parameters: {'kernel_type': 'Matern', 'length_scale': 169.32996332191317, 'noise_level': 0.7667901327154955, 'constant_value': 1.139600673655813, 'nu': 0.5}. Best is trial 386 with value: 0.4872991004520934.
[I 2024-12-04 15:18:38,348] Trial 2243 finished with value: 1.261454797632961 and parameters: {'kernel_type': 'Matern', 'length_scale': 67315.35553595508, 'noise_level': 0.924341812860798, 'constant_value': 684.4237055547985, 'nu': 1.5}. Best is trial 386 with value: 0.4872991004520934.
[I 2024-12-04 15:18:38,899] Trial 2246 finished with value: 1.2401112333155508 and parameters: {'kernel_type': 'Matern', 'length_scale': 5082.909250197963, 'noise_level': 1.6591236618920237e-07, 'constant_value': 0.019319041476973744, 'nu': 0.5}. Best is trial 386 with value: 0.4872991004520934.
[I 2024-12-04 15:18:39,261] Trial 2253 finished with value: 1.2614547953941473 and parameters: {'kernel_type': 'Matern', 'length_scale': 68.04387874174417, 'noise_level': 0.032284023437935745, 'constant_value': 2599.3695725343036, 'nu': 0.5}. Best is trial 386 with value: 0.4872991004520934.
[I 2024-12-04 15:18:39,564] Trial 2252 finished with value: 0.48830340765411573 and parameters: {'kernel_type': 'Matern', 'length_scale': 1743.8900560723532, 'noise_level': 0.04301825899921547, 'constant_value': 1063.4743747104064, 'nu': 0.5}. Best is trial 386 with value: 0.4872991004520934.
[I 2024-12-04 15:18:39,889] Trial 2251 finished with value: 1.2401112324893395 and parameters: {'kernel_type': 'RBF', 'length_scale': 2924.831875066922, 'noise_level': 0.0025359782406441773, 'constant_value': 69759.85264351926, 'nu': 2.5}. Best is trial 386 with value: 0.4872991004520934.
[I 2024-12-04 15:18:40,334] Trial 2248 finished with value: 1.2401112321425924 and parameters: {'kernel_type': 'Matern', 'length_scale': 695.435370501893, 'noise_level': 0.004113135862489058, 'constant_value': 78112.40610052767, 'nu': 2.5}. Best is trial 386 with value: 0.4872991004520934.
