[I 2024-12-04 00:39:47,685] Trial 2486 finished with value: 0.1564325371619857 and parameters: {'kernel': 'rbf', 'C': 85.15854416529271, 'gamma': 0.005014586288751962, 'epsilon': 0.003595811740199063}. Best is trial 2284 with value: 0.13948515847988838.
[I 2024-12-04 00:39:47,687] Trial 2487 finished with value: 0.2247113866939948 and parameters: {'kernel': 'rbf', 'C': 97.8234801434544, 'gamma': 0.0014710281591879496, 'epsilon': 0.0055074154486729155}. Best is trial 2284 with value: 0.13948515847988838.
[I 2024-12-04 00:39:49,532] Trial 2491 finished with value: 0.25154610425607377 and parameters: {'kernel': 'rbf', 'C': 20.21432545936089, 'gamma': 0.0037981585665457624, 'epsilon': 0.005500795922821593}. Best is trial 2284 with value: 0.13948515847988838.
[I 2024-12-04 00:39:49,532] Trial 2490 finished with value: 0.1528963989064373 and parameters: {'kernel': 'rbf', 'C': 26.85491038981438, 'gamma': 0.012832255452740554, 'epsilon': 0.006569168348912194}. Best is trial 2284 with value: 0.13948515847988838.
[I 2024-12-04 00:39:49,848] Trial 2484 finished with value: 0.2299474837440498 and parameters: {'kernel': 'rbf', 'C': 73.35431957015514, 'gamma': 0.08957781052745435, 'epsilon': 0.0010895619116129175}. Best is trial 2284 with value: 0.13948515847988838.
[I 2024-12-04 00:39:51,111] Trial 2492 finished with value: 0.26679715876498 and parameters: {'kernel': 'rbf', 'C': 21.132400405341528, 'gamma': 0.002357235944750884, 'epsilon': 0.0010261796568959644}. Best is trial 2284 with value: 0.13948515847988838.
[I 2024-12-04 00:39:51,138] Trial 2489 finished with value: 0.14117584833885985 and parameters: {'kernel': 'rbf', 'C': 99.06904676264107, 'gamma': 0.009909815249829144, 'epsilon': 0.0013974252012773883}. Best is trial 2284 with value: 0.13948515847988838.
[I 2024-12-04 00:39:54,082] Trial 2494 finished with value: 0.14808862495738798 and parameters: {'kernel': 'rbf', 'C': 95.06174879129479, 'gamma': 0.005885960258162278, 'epsilon': 0.002816516311421341}. Best is trial 2284 with value: 0.13948515847988838.
[I 2024-12-04 00:39:54,355] Trial 2493 finished with value: 0.15289114893347713 and parameters: {'kernel': 'rbf', 'C': 99.33874876373771, 'gamma': 0.012061567994210846, 'epsilon': 0.002981015787929913}. Best is trial 2284 with value: 0.13948515847988838.
[I 2024-12-04 00:39:55,259] Trial 2498 finished with value: 0.16735245523457096 and parameters: {'kernel': 'rbf', 'C': 20.13334901658564, 'gamma': 0.012399100602181277, 'epsilon': 0.0025303455771609317}. Best is trial 2284 with value: 0.13948515847988838.
[I 2024-12-04 00:39:55,336] Trial 2497 finished with value: 0.1590356541549395 and parameters: {'kernel': 'rbf', 'C': 20.80408977126351, 'gamma': 0.013927030655892625, 'epsilon': 0.002897356497083608}. Best is trial 2284 with value: 0.13948515847988838.
[I 2024-12-04 00:39:55,338] Trial 2496 finished with value: 0.14783835782297988 and parameters: {'kernel': 'rbf', 'C': 30.623514933433594, 'gamma': 0.013932593364690781, 'epsilon': 0.001041142197181447}. Best is trial 2284 with value: 0.13948515847988838.
[I 2024-12-04 00:39:55,856] Trial 2495 finished with value: 0.33741458934709156 and parameters: {'kernel': 'linear', 'C': 1.0959618580444035, 'gamma': 0.014421800540414262, 'epsilon': 0.038323174105944935}. Best is trial 2284 with value: 0.13948515847988838.
[I 2024-12-04 00:39:55,928] Trial 2499 finished with value: 0.15253456154078104 and parameters: {'kernel': 'rbf', 'C': 90.79242440504014, 'gamma': 0.005285413538747249, 'epsilon': 0.0022013697074980258}. Best is trial 2284 with value: 0.13948515847988838.
[I 2024-12-04 00:39:56,166] Trial 2455 finished with value: 0.5278980490184138 and parameters: {'kernel': 'poly', 'C': 79.02472923183647, 'gamma': 0.013979541794931135, 'epsilon': 0.0011002249574377132}. Best is trial 2284 with value: 0.13948515847988838.
[I 2024-12-04 00:40:17,238] Trial 2287 finished with value: 1.548631493346609 and parameters: {'kernel': 'poly', 'C': 3.750624565075647, 'gamma': 0.6942250071971928, 'epsilon': 0.40016962328470773}. Best is trial 2284 with value: 0.13948515847988838.
[I 2024-12-04 00:40:42,497] Trial 2444 finished with value: 0.3383847175702544 and parameters: {'kernel': 'linear', 'C': 44.61548000400249, 'gamma': 0.0014086169539288115, 'epsilon': 0.07183056026958717}. Best is trial 2284 with value: 0.13948515847988838.
[I 2024-12-04 00:41:11,592] Trial 2369 finished with value: 0.3524087570075466 and parameters: {'kernel': 'linear', 'C': 94.02294452657847, 'gamma': 0.03940981501821862, 'epsilon': 0.0016931833024311494}. Best is trial 2284 with value: 0.13948515847988838.
[I 2024-12-04 00:41:39,625] Trial 2059 finished with value: 0.352532561136007 and parameters: {'kernel': 'linear', 'C': 85.79538240677472, 'gamma': 0.005153633745521546, 'epsilon': 0.0010572908510840407}. Best is trial 2284 with value: 0.13948515847988838.
[I 2024-12-04 00:43:47,517] Trial 2387 finished with value: 0.35269746110671724 and parameters: {'kernel': 'linear', 'C': 98.02148125546279, 'gamma': 0.004187068772709951, 'epsilon': 0.00208441383546308}. Best is trial 2284 with value: 0.13948515847988838.
[I 2024-12-04 00:45:05,078] Trial 1502 finished with value: 0.7596895443524828 and parameters: {'kernel': 'poly', 'C': 70.04954790120534, 'gamma': 0.03616666208186241, 'epsilon': 0.0015759932510908347}. Best is trial 2284 with value: 0.13948515847988838.
[I 2024-12-04 00:57:47,058] Trial 1819 finished with value: 0.7623839217204286 and parameters: {'kernel': 'poly', 'C': 17.471083144047693, 'gamma': 0.058981012276180016, 'epsilon': 0.004422019351303512}. Best is trial 2284 with value: 0.13948515847988838.
[I 2024-12-04 01:08:46,643] Trial 2346 finished with value: 0.7896474474058123 and parameters: {'kernel': 'poly', 'C': 48.733065879315824, 'gamma': 0.05108726622761535, 'epsilon': 0.002707423915247913}. Best is trial 2284 with value: 0.13948515847988838.
[I 2024-12-04 01:21:59,743] Trial 13 finished with value: 0.9781898955173337 and parameters: {'kernel': 'poly', 'C': 0.5823059086651121, 'gamma': 0.5159873522536534, 'epsilon': 0.0013777340759510447}. Best is trial 2284 with value: 0.13948515847988838.
[I 2024-12-04 01:28:21,633] Trial 2115 finished with value: 0.6968302929628167 and parameters: {'kernel': 'poly', 'C': 6.9136987829312195, 'gamma': 0.1294653361257077, 'epsilon': 0.11079619878050435}. Best is trial 2284 with value: 0.13948515847988838.
[I 2024-12-04 01:28:34,662] Trial 1135 finished with value: 0.7994057987420528 and parameters: {'kernel': 'poly', 'C': 50.549390698690765, 'gamma': 0.053410241618788185, 'epsilon': 0.0011391741318702191}. Best is trial 2284 with value: 0.13948515847988838.
[I 2024-12-04 01:31:08,986] Trial 2381 finished with value: 0.7979295216637909 and parameters: {'kernel': 'poly', 'C': 0.015634304583049752, 'gamma': 0.8777535264834299, 'epsilon': 0.0017996802239939069}. Best is trial 2284 with value: 0.13948515847988838.
[I 2024-12-04 01:37:27,918] Trial 1443 finished with value: 0.9959807845578996 and parameters: {'kernel': 'poly', 'C': 68.2864947028801, 'gamma': 0.0938123622035764, 'epsilon': 0.0073573297823974326}. Best is trial 2284 with value: 0.13948515847988838.
[I 2024-12-04 01:57:52,553] Trial 17 finished with value: 0.7673524707049768 and parameters: {'kernel': 'poly', 'C': 7.380663125782858, 'gamma': 0.1710709685620458, 'epsilon': 0.02256304603472683}. Best is trial 2284 with value: 0.13948515847988838.
[I 2024-12-04 02:00:07,596] Trial 7 finished with value: 5.06895834816013 and parameters: {'kernel': 'poly', 'C': 1.0753188451656424, 'gamma': 0.6793441850018411, 'epsilon': 0.005410090959654359}. Best is trial 2284 with value: 0.13948515847988838.
[I 2024-12-04 02:02:11,241] Trial 61 finished with value: 0.8779245324844345 and parameters: {'kernel': 'poly', 'C': 45.87484179688319, 'gamma': 0.0980827152058524, 'epsilon': 0.0041116941361144365}. Best is trial 2284 with value: 0.13948515847988838.
[I 2024-12-04 02:11:58,336] Trial 1988 finished with value: 1.0107424029556864 and parameters: {'kernel': 'poly', 'C': 77.01635003094407, 'gamma': 0.09759292541156417, 'epsilon': 0.0010423001311101313}. Best is trial 2284 with value: 0.13948515847988838.
[I 2024-12-04 02:22:28,396] Trial 1062 finished with value: 14.722403970193108 and parameters: {'kernel': 'poly', 'C': 2.052211224280515, 'gamma': 0.673643941617491, 'epsilon': 0.019237811373473523}. Best is trial 2284 with value: 0.13948515847988838.
[I 2024-12-04 02:23:11,865] Trial 1783 finished with value: 2.8058793153017247 and parameters: {'kernel': 'poly', 'C': 3.918345088420428, 'gamma': 0.553333551052034, 'epsilon': 0.001953178197515669}. Best is trial 2284 with value: 0.13948515847988838.
[I 2024-12-04 02:27:34,063] Trial 217 finished with value: 7.413944462109454 and parameters: {'kernel': 'poly', 'C': 6.958312431113837, 'gamma': 0.5974990780237501, 'epsilon': 0.11764788022402281}. Best is trial 2284 with value: 0.13948515847988838.
[I 2024-12-04 02:34:11,257] Trial 1380 finished with value: 0.995880295786938 and parameters: {'kernel': 'poly', 'C': 0.18502704669498451, 'gamma': 0.6750716031821145, 'epsilon': 0.005170166026534086}. Best is trial 2284 with value: 0.13948515847988838.
[I 2024-12-04 02:57:33,038] Trial 1273 finished with value: 21.82076830349435 and parameters: {'kernel': 'poly', 'C': 94.53866137297403, 'gamma': 0.4564705213828354, 'epsilon': 0.022533040210006433}. Best is trial 2284 with value: 0.13948515847988838.
[I 2024-12-04 03:12:02,350] Trial 660 finished with value: 14.9526166756199 and parameters: {'kernel': 'poly', 'C': 66.02498277025903, 'gamma': 0.2800103259967359, 'epsilon': 0.0022181086203447767}. Best is trial 2284 with value: 0.13948515847988838.
