[I 2024-12-04 20:00:31,630] Trial 540 finished with value: 0.32362107296092046 and parameters: {'n_estimators': 315, 'max_depth': 50, 'min_samples_split': 2, 'min_samples_leaf': 1, 'max_features': 'sqrt', 'bootstrap': False, 'criterion': 'squared_error'}. Best is trial 457 with value: 0.3223992246327795.
[I 2024-12-04 20:00:32,485] Trial 542 finished with value: 1.2269261256198911 and parameters: {'n_estimators': 214, 'max_depth': 17, 'min_samples_split': 41, 'min_samples_leaf': 3, 'max_features': 'log2', 'bootstrap': True, 'criterion': 'squared_error'}. Best is trial 457 with value: 0.3223992246327795.
[I 2024-12-04 20:00:33,375] Trial 543 finished with value: 1.2089390146557228 and parameters: {'n_estimators': 156, 'max_depth': 11, 'min_samples_split': 13, 'min_samples_leaf': 1, 'max_features': 'log2', 'bootstrap': True, 'criterion': 'absolute_error'}. Best is trial 457 with value: 0.3223992246327795.
[I 2024-12-04 20:00:33,393] Trial 525 finished with value: 0.7439023164229205 and parameters: {'n_estimators': 936, 'max_depth': 22, 'min_samples_split': 5, 'min_samples_leaf': 1, 'max_features': 'sqrt', 'bootstrap': False, 'criterion': 'absolute_error'}. Best is trial 457 with value: 0.3223992246327795.
[I 2024-12-04 20:00:34,127] Trial 544 finished with value: 0.40784632593523934 and parameters: {'n_estimators': 326, 'max_depth': 42, 'min_samples_split': 4, 'min_samples_leaf': 1, 'max_features': 'sqrt', 'bootstrap': False, 'criterion': 'squared_error'}. Best is trial 457 with value: 0.3223992246327795.
[I 2024-12-04 20:00:35,101] Trial 545 finished with value: 1.168618153541132 and parameters: {'n_estimators': 231, 'max_depth': 40, 'min_samples_split': 23, 'min_samples_leaf': 4, 'max_features': 'sqrt', 'bootstrap': True, 'criterion': 'absolute_error'}. Best is trial 457 with value: 0.3223992246327795.
[I 2024-12-04 20:00:35,109] Trial 546 finished with value: 0.385477738870908 and parameters: {'n_estimators': 267, 'max_depth': 50, 'min_samples_split': 4, 'min_samples_leaf': 1, 'max_features': 'sqrt', 'bootstrap': False, 'criterion': 'squared_error'}. Best is trial 457 with value: 0.3223992246327795.
[I 2024-12-04 20:00:35,378] Trial 547 finished with value: 0.6849697561808634 and parameters: {'n_estimators': 230, 'max_depth': 50, 'min_samples_split': 13, 'min_samples_leaf': 1, 'max_features': 'log2', 'bootstrap': False, 'criterion': 'squared_error'}. Best is trial 457 with value: 0.3223992246327795.
[I 2024-12-04 20:00:36,908] Trial 548 finished with value: 0.3435338091501839 and parameters: {'n_estimators': 222, 'max_depth': 43, 'min_samples_split': 2, 'min_samples_leaf': 1, 'max_features': 'sqrt', 'bootstrap': False, 'criterion': 'squared_error'}. Best is trial 457 with value: 0.3223992246327795.
[I 2024-12-04 20:00:37,303] Trial 549 finished with value: 0.35616621481754 and parameters: {'n_estimators': 326, 'max_depth': 50, 'min_samples_split': 3, 'min_samples_leaf': 1, 'max_features': 'sqrt', 'bootstrap': False, 'criterion': 'squared_error'}. Best is trial 457 with value: 0.3223992246327795.
[I 2024-12-04 20:00:37,554] Trial 550 finished with value: 0.6839368036622396 and parameters: {'n_estimators': 528, 'max_depth': 50, 'min_samples_split': 2, 'min_samples_leaf': 2, 'max_features': 'sqrt', 'bootstrap': False, 'criterion': 'squared_error'}. Best is trial 457 with value: 0.3223992246327795.
[I 2024-12-04 20:00:38,825] Trial 551 finished with value: 0.3570779631031157 and parameters: {'n_estimators': 336, 'max_depth': 50, 'min_samples_split': 3, 'min_samples_leaf': 1, 'max_features': 'sqrt', 'bootstrap': False, 'criterion': 'squared_error'}. Best is trial 457 with value: 0.3223992246327795.
[I 2024-12-04 20:00:39,847] Trial 552 finished with value: 0.325419661846049 and parameters: {'n_estimators': 426, 'max_depth': 49, 'min_samples_split': 2, 'min_samples_leaf': 1, 'max_features': 'sqrt', 'bootstrap': False, 'criterion': 'squared_error'}. Best is trial 457 with value: 0.3223992246327795.
[I 2024-12-04 20:00:40,007] Trial 553 finished with value: 0.3526770831438325 and parameters: {'n_estimators': 429, 'max_depth': 42, 'min_samples_split': 2, 'min_samples_leaf': 1, 'max_features': 'sqrt', 'bootstrap': False, 'criterion': 'squared_error'}. Best is trial 457 with value: 0.3223992246327795.
[I 2024-12-04 20:00:40,934] Trial 554 finished with value: 0.32364337564373286 and parameters: {'n_estimators': 327, 'max_depth': 50, 'min_samples_split': 2, 'min_samples_leaf': 1, 'max_features': 'sqrt', 'bootstrap': False, 'criterion': 'squared_error'}. Best is trial 457 with value: 0.3223992246327795.
[I 2024-12-04 20:00:41,750] Trial 555 finished with value: 0.3887213571793819 and parameters: {'n_estimators': 436, 'max_depth': 50, 'min_samples_split': 4, 'min_samples_leaf': 1, 'max_features': 'sqrt', 'bootstrap': False, 'criterion': 'squared_error'}. Best is trial 457 with value: 0.3223992246327795.
[I 2024-12-04 20:00:41,802] Trial 557 finished with value: 0.5342011269736201 and parameters: {'n_estimators': 126, 'max_depth': 50, 'min_samples_split': 4, 'min_samples_leaf': 1, 'max_features': 'log2', 'bootstrap': False, 'criterion': 'squared_error'}. Best is trial 457 with value: 0.3223992246327795.
[I 2024-12-04 20:00:42,550] Trial 556 finished with value: 0.32369937626844103 and parameters: {'n_estimators': 391, 'max_depth': 50, 'min_samples_split': 2, 'min_samples_leaf': 1, 'max_features': 'sqrt', 'bootstrap': False, 'criterion': 'squared_error'}. Best is trial 457 with value: 0.3223992246327795.
[I 2024-12-04 20:00:43,115] Trial 558 finished with value: 0.6678927839021346 and parameters: {'n_estimators': 231, 'max_depth': 50, 'min_samples_split': 2, 'min_samples_leaf': 2, 'max_features': 'sqrt', 'bootstrap': False, 'criterion': 'squared_error'}. Best is trial 457 with value: 0.3223992246327795.
[I 2024-12-04 20:00:43,394] Trial 559 finished with value: 1.053434722065318 and parameters: {'n_estimators': 450, 'max_depth': 50, 'min_samples_split': 2, 'min_samples_leaf': 2, 'max_features': 'log2', 'bootstrap': False, 'criterion': 'squared_error'}. Best is trial 457 with value: 0.3223992246327795.
[I 2024-12-04 20:00:43,929] Trial 560 finished with value: 0.8574310538186951 and parameters: {'n_estimators': 149, 'max_depth': 39, 'min_samples_split': 38, 'min_samples_leaf': 1, 'max_features': 'log2', 'bootstrap': True, 'criterion': 'squared_error'}. Best is trial 457 with value: 0.3223992246327795.
[I 2024-12-04 20:00:45,245] Trial 561 finished with value: 0.3235194005806658 and parameters: {'n_estimators': 333, 'max_depth': 50, 'min_samples_split': 2, 'min_samples_leaf': 1, 'max_features': 'sqrt', 'bootstrap': False, 'criterion': 'squared_error'}. Best is trial 457 with value: 0.3223992246327795.
[I 2024-12-04 20:00:45,493] Trial 563 finished with value: 0.4810830688834104 and parameters: {'n_estimators': 110, 'max_depth': 50, 'min_samples_split': 6, 'min_samples_leaf': 1, 'max_features': None, 'bootstrap': False, 'criterion': 'squared_error'}. Best is trial 457 with value: 0.3223992246327795.
[I 2024-12-04 20:00:46,012] Trial 562 finished with value: 0.32814906184384507 and parameters: {'n_estimators': 441, 'max_depth': 50, 'min_samples_split': 2, 'min_samples_leaf': 1, 'max_features': 'sqrt', 'bootstrap': False, 'criterion': 'squared_error'}. Best is trial 457 with value: 0.3223992246327795.
[I 2024-12-04 20:00:46,474] Trial 564 finished with value: 0.3382208753636305 and parameters: {'n_estimators': 124, 'max_depth': 50, 'min_samples_split': 2, 'min_samples_leaf': 1, 'max_features': 'sqrt', 'bootstrap': False, 'criterion': 'squared_error'}. Best is trial 457 with value: 0.3223992246327795.
[I 2024-12-04 20:00:47,540] Trial 565 finished with value: 0.32547120703687404 and parameters: {'n_estimators': 280, 'max_depth': 50, 'min_samples_split': 2, 'min_samples_leaf': 1, 'max_features': 'sqrt', 'bootstrap': False, 'criterion': 'squared_error'}. Best is trial 457 with value: 0.3223992246327795.
[I 2024-12-04 20:00:47,844] Trial 566 finished with value: 0.3435338091501839 and parameters: {'n_estimators': 222, 'max_depth': 43, 'min_samples_split': 2, 'min_samples_leaf': 1, 'max_features': 'sqrt', 'bootstrap': False, 'criterion': 'squared_error'}. Best is trial 457 with value: 0.3223992246327795.
[I 2024-12-04 20:00:48,016] Trial 567 finished with value: 0.674638813556867 and parameters: {'n_estimators': 330, 'max_depth': 43, 'min_samples_split': 3, 'min_samples_leaf': 2, 'max_features': 'sqrt', 'bootstrap': False, 'criterion': 'squared_error'}. Best is trial 457 with value: 0.3223992246327795.
[I 2024-12-04 20:00:50,444] Trial 569 finished with value: 0.9998808415806943 and parameters: {'n_estimators': 999, 'max_depth': 10, 'min_samples_split': 3, 'min_samples_leaf': 3, 'max_features': 'sqrt', 'bootstrap': True, 'criterion': 'squared_error'}. Best is trial 457 with value: 0.3223992246327795.
[I 2024-12-04 20:00:50,454] Trial 570 finished with value: 0.545323698895294 and parameters: {'n_estimators': 380, 'max_depth': 46, 'min_samples_split': 2, 'min_samples_leaf': 1, 'max_features': 'log2', 'bootstrap': False, 'criterion': 'squared_error'}. Best is trial 457 with value: 0.3223992246327795.
[I 2024-12-04 20:00:51,923] Trial 571 finished with value: 0.6829563287667277 and parameters: {'n_estimators': 409, 'max_depth': 50, 'min_samples_split': 2, 'min_samples_leaf': 2, 'max_features': 'sqrt', 'bootstrap': False, 'criterion': 'squared_error'}. Best is trial 457 with value: 0.3223992246327795.
[I 2024-12-04 20:00:52,677] Trial 568 finished with value: 0.4309244050646588 and parameters: {'n_estimators': 462, 'max_depth': 37, 'min_samples_split': 3, 'min_samples_leaf': 1, 'max_features': None, 'bootstrap': False, 'criterion': 'squared_error'}. Best is trial 457 with value: 0.3223992246327795.
[I 2024-12-04 20:00:54,059] Trial 574 finished with value: 0.6815174816613498 and parameters: {'n_estimators': 402, 'max_depth': 50, 'min_samples_split': 3, 'min_samples_leaf': 2, 'max_features': 'sqrt', 'bootstrap': False, 'criterion': 'squared_error'}. Best is trial 457 with value: 0.3223992246327795.
[I 2024-12-04 20:00:54,593] Trial 573 finished with value: 0.3538262786965847 and parameters: {'n_estimators': 479, 'max_depth': 44, 'min_samples_split': 2, 'min_samples_leaf': 1, 'max_features': 'sqrt', 'bootstrap': False, 'criterion': 'squared_error'}. Best is trial 457 with value: 0.3223992246327795.
[I 2024-12-04 20:00:56,843] Trial 576 finished with value: 0.32371249996276735 and parameters: {'n_estimators': 399, 'max_depth': 50, 'min_samples_split': 2, 'min_samples_leaf': 1, 'max_features': 'sqrt', 'bootstrap': False, 'criterion': 'squared_error'}. Best is trial 457 with value: 0.3223992246327795.
[I 2024-12-04 20:00:59,187] Trial 577 finished with value: 0.32814106858951464 and parameters: {'n_estimators': 502, 'max_depth': 50, 'min_samples_split': 2, 'min_samples_leaf': 1, 'max_features': 'sqrt', 'bootstrap': False, 'criterion': 'squared_error'}. Best is trial 457 with value: 0.3223992246327795.
[I 2024-12-04 20:01:00,513] Trial 578 finished with value: 0.4108174017019076 and parameters: {'n_estimators': 324, 'max_depth': 43, 'min_samples_split': 4, 'min_samples_leaf': 1, 'max_features': 'sqrt', 'bootstrap': False, 'criterion': 'squared_error'}. Best is trial 457 with value: 0.3223992246327795.
[I 2024-12-04 20:01:03,523] Trial 579 finished with value: 0.6428523081281411 and parameters: {'n_estimators': 127, 'max_depth': 9, 'min_samples_split': 6, 'min_samples_leaf': 12, 'max_features': None, 'bootstrap': False, 'criterion': 'absolute_error'}. Best is trial 457 with value: 0.3223992246327795.
[I 2024-12-04 20:01:05,019] Trial 580 finished with value: 0.3233579316635364 and parameters: {'n_estimators': 253, 'max_depth': 50, 'min_samples_split': 2, 'min_samples_leaf': 1, 'max_features': 'sqrt', 'bootstrap': False, 'criterion': 'squared_error'}. Best is trial 457 with value: 0.3223992246327795.
[I 2024-12-04 20:01:05,413] Trial 572 finished with value: 0.5667364573498849 and parameters: {'n_estimators': 453, 'max_depth': 12, 'min_samples_split': 18, 'min_samples_leaf': 7, 'max_features': None, 'bootstrap': False, 'criterion': 'absolute_error'}. Best is trial 457 with value: 0.3223992246327795.
[I 2024-12-04 20:01:06,335] Trial 581 finished with value: 0.37620735889328966 and parameters: {'n_estimators': 182, 'max_depth': 40, 'min_samples_split': 2, 'min_samples_leaf': 1, 'max_features': 'sqrt', 'bootstrap': False, 'criterion': 'squared_error'}. Best is trial 457 with value: 0.3223992246327795.
[I 2024-12-04 20:01:07,087] Trial 582 finished with value: 0.3452995871676726 and parameters: {'n_estimators': 259, 'max_depth': 43, 'min_samples_split': 2, 'min_samples_leaf': 1, 'max_features': 'sqrt', 'bootstrap': False, 'criterion': 'squared_error'}. Best is trial 457 with value: 0.3223992246327795.
[I 2024-12-04 20:01:07,891] Trial 583 finished with value: 0.33306752276987067 and parameters: {'n_estimators': 223, 'max_depth': 48, 'min_samples_split': 2, 'min_samples_leaf': 1, 'max_features': 'sqrt', 'bootstrap': False, 'criterion': 'squared_error'}. Best is trial 457 with value: 0.3223992246327795.
[I 2024-12-04 20:01:08,953] Trial 584 finished with value: 0.34625030343982655 and parameters: {'n_estimators': 356, 'max_depth': 42, 'min_samples_split': 2, 'min_samples_leaf': 1, 'max_features': 'sqrt', 'bootstrap': False, 'criterion': 'squared_error'}. Best is trial 457 with value: 0.3223992246327795.
[I 2024-12-04 20:01:08,973] Trial 585 finished with value: 1.2831861649532053 and parameters: {'n_estimators': 178, 'max_depth': 46, 'min_samples_split': 48, 'min_samples_leaf': 10, 'max_features': 'sqrt', 'bootstrap': False, 'criterion': 'absolute_error'}. Best is trial 457 with value: 0.3223992246327795.
[I 2024-12-04 20:01:10,093] Trial 587 finished with value: 0.6614246587339748 and parameters: {'n_estimators': 143, 'max_depth': 42, 'min_samples_split': 2, 'min_samples_leaf': 2, 'max_features': 'sqrt', 'bootstrap': False, 'criterion': 'squared_error'}. Best is trial 457 with value: 0.3223992246327795.
[I 2024-12-04 20:01:11,829] Trial 586 finished with value: 0.43599171769679 and parameters: {'n_estimators': 231, 'max_depth': 40, 'min_samples_split': 2, 'min_samples_leaf': 1, 'max_features': None, 'bootstrap': False, 'criterion': 'squared_error'}. Best is trial 457 with value: 0.3223992246327795.
[I 2024-12-04 20:01:13,376] Trial 589 finished with value: 0.3867216739802706 and parameters: {'n_estimators': 402, 'max_depth': 50, 'min_samples_split': 4, 'min_samples_leaf': 1, 'max_features': 'sqrt', 'bootstrap': False, 'criterion': 'squared_error'}. Best is trial 457 with value: 0.3223992246327795.
[I 2024-12-04 20:01:16,352] Trial 590 finished with value: 0.7341995009327565 and parameters: {'n_estimators': 974, 'max_depth': 33, 'min_samples_split': 38, 'min_samples_leaf': 13, 'max_features': None, 'bootstrap': True, 'criterion': 'squared_error'}. Best is trial 457 with value: 0.3223992246327795.
[I 2024-12-04 20:01:18,081] Trial 591 finished with value: 0.9671205467168826 and parameters: {'n_estimators': 929, 'max_depth': 9, 'min_samples_split': 2, 'min_samples_leaf': 1, 'max_features': 'sqrt', 'bootstrap': False, 'criterion': 'squared_error'}. Best is trial 457 with value: 0.3223992246327795.
[I 2024-12-04 20:01:19,417] Trial 592 finished with value: 0.3303777895062043 and parameters: {'n_estimators': 197, 'max_depth': 49, 'min_samples_split': 2, 'min_samples_leaf': 1, 'max_features': 'sqrt', 'bootstrap': False, 'criterion': 'squared_error'}. Best is trial 457 with value: 0.3223992246327795.
[I 2024-12-04 20:01:21,207] Trial 593 finished with value: 0.32602689246347316 and parameters: {'n_estimators': 234, 'max_depth': 50, 'min_samples_split': 2, 'min_samples_leaf': 1, 'max_features': 'sqrt', 'bootstrap': False, 'criterion': 'squared_error'}. Best is trial 457 with value: 0.3223992246327795.
[I 2024-12-04 20:01:22,303] Trial 594 finished with value: 1.1064520271317835 and parameters: {'n_estimators': 473, 'max_depth': 18, 'min_samples_split': 5, 'min_samples_leaf': 2, 'max_features': 'log2', 'bootstrap': False, 'criterion': 'squared_error'}. Best is trial 457 with value: 0.3223992246327795.
[I 2024-12-04 20:01:23,703] Trial 595 finished with value: 0.35728699671632375 and parameters: {'n_estimators': 273, 'max_depth': 50, 'min_samples_split': 3, 'min_samples_leaf': 1, 'max_features': 'sqrt', 'bootstrap': False, 'criterion': 'squared_error'}. Best is trial 457 with value: 0.3223992246327795.
[I 2024-12-04 20:01:25,144] Trial 596 finished with value: 0.3251020744548628 and parameters: {'n_estimators': 225, 'max_depth': 50, 'min_samples_split': 2, 'min_samples_leaf': 1, 'max_features': 'sqrt', 'bootstrap': False, 'criterion': 'squared_error'}. Best is trial 457 with value: 0.3223992246327795.
[I 2024-12-04 20:01:26,904] Trial 597 finished with value: 0.5373643557276412 and parameters: {'n_estimators': 187, 'max_depth': 46, 'min_samples_split': 3, 'min_samples_leaf': 2, 'max_features': None, 'bootstrap': False, 'criterion': 'squared_error'}. Best is trial 457 with value: 0.3223992246327795.
[I 2024-12-04 20:01:27,407] Trial 575 finished with value: 0.5057532209005878 and parameters: {'n_estimators': 879, 'max_depth': 8, 'min_samples_split': 3, 'min_samples_leaf': 2, 'max_features': None, 'bootstrap': True, 'criterion': 'absolute_error'}. Best is trial 457 with value: 0.3223992246327795.
[I 2024-12-04 20:01:27,880] Trial 588 finished with value: 0.7959124238286954 and parameters: {'n_estimators': 771, 'max_depth': 39, 'min_samples_split': 38, 'min_samples_leaf': 1, 'max_features': 'sqrt', 'bootstrap': False, 'criterion': 'absolute_error'}. Best is trial 457 with value: 0.3223992246327795.
[I 2024-12-04 20:01:28,942] Trial 598 finished with value: 0.3252594167164361 and parameters: {'n_estimators': 303, 'max_depth': 50, 'min_samples_split': 2, 'min_samples_leaf': 1, 'max_features': 'sqrt', 'bootstrap': False, 'criterion': 'squared_error'}. Best is trial 457 with value: 0.3223992246327795.
[I 2024-12-04 20:01:29,471] Trial 600 finished with value: 0.6684289581828659 and parameters: {'n_estimators': 336, 'max_depth': 49, 'min_samples_split': 2, 'min_samples_leaf': 2, 'max_features': 'sqrt', 'bootstrap': False, 'criterion': 'squared_error'}. Best is trial 457 with value: 0.3223992246327795.
[I 2024-12-04 20:01:30,124] Trial 599 finished with value: 0.3461061736030197 and parameters: {'n_estimators': 339, 'max_depth': 42, 'min_samples_split': 2, 'min_samples_leaf': 1, 'max_features': 'sqrt', 'bootstrap': False, 'criterion': 'squared_error'}. Best is trial 457 with value: 0.3223992246327795.
[I 2024-12-04 20:01:30,833] Trial 602 finished with value: 0.5035822567724908 and parameters: {'n_estimators': 102, 'max_depth': 46, 'min_samples_split': 6, 'min_samples_leaf': 1, 'max_features': 'sqrt', 'bootstrap': False, 'criterion': 'squared_error'}. Best is trial 457 with value: 0.3223992246327795.
[I 2024-12-04 20:01:30,913] Trial 601 finished with value: 0.3897455481223115 and parameters: {'n_estimators': 401, 'max_depth': 41, 'min_samples_split': 3, 'min_samples_leaf': 1, 'max_features': 'sqrt', 'bootstrap': False, 'criterion': 'squared_error'}. Best is trial 457 with value: 0.3223992246327795.
[I 2024-12-04 20:01:32,445] Trial 604 finished with value: 0.6687609133366313 and parameters: {'n_estimators': 319, 'max_depth': 50, 'min_samples_split': 2, 'min_samples_leaf': 2, 'max_features': 'sqrt', 'bootstrap': False, 'criterion': 'squared_error'}. Best is trial 457 with value: 0.3223992246327795.
[I 2024-12-04 20:01:32,663] Trial 603 finished with value: 0.36799547259753823 and parameters: {'n_estimators': 479, 'max_depth': 50, 'min_samples_split': 3, 'min_samples_leaf': 1, 'max_features': 'sqrt', 'bootstrap': False, 'criterion': 'squared_error'}. Best is trial 457 with value: 0.3223992246327795.
[I 2024-12-04 20:01:32,830] Trial 605 finished with value: 0.35590852299464354 and parameters: {'n_estimators': 286, 'max_depth': 50, 'min_samples_split': 3, 'min_samples_leaf': 1, 'max_features': 'sqrt', 'bootstrap': False, 'criterion': 'squared_error'}. Best is trial 457 with value: 0.3223992246327795.
[I 2024-12-04 20:01:33,909] Trial 606 finished with value: 1.1619390822032138 and parameters: {'n_estimators': 497, 'max_depth': 20, 'min_samples_split': 50, 'min_samples_leaf': 9, 'max_features': 'sqrt', 'bootstrap': False, 'criterion': 'squared_error'}. Best is trial 457 with value: 0.3223992246327795.
[I 2024-12-04 20:01:35,116] Trial 608 finished with value: 0.32447397201574063 and parameters: {'n_estimators': 290, 'max_depth': 50, 'min_samples_split': 2, 'min_samples_leaf': 1, 'max_features': 'sqrt', 'bootstrap': False, 'criterion': 'squared_error'}. Best is trial 457 with value: 0.3223992246327795.
[I 2024-12-04 20:01:35,484] Trial 607 finished with value: 0.3245816351681366 and parameters: {'n_estimators': 433, 'max_depth': 50, 'min_samples_split': 2, 'min_samples_leaf': 1, 'max_features': 'sqrt', 'bootstrap': False, 'criterion': 'squared_error'}. Best is trial 457 with value: 0.3223992246327795.
[I 2024-12-04 20:01:35,564] Trial 609 finished with value: 0.3408011459324626 and parameters: {'n_estimators': 291, 'max_depth': 41, 'min_samples_split': 2, 'min_samples_leaf': 1, 'max_features': 'sqrt', 'bootstrap': False, 'criterion': 'squared_error'}. Best is trial 457 with value: 0.3223992246327795.
[I 2024-12-04 20:01:36,164] Trial 610 finished with value: 0.6476018991826376 and parameters: {'n_estimators': 143, 'max_depth': 50, 'min_samples_split': 2, 'min_samples_leaf': 2, 'max_features': 'sqrt', 'bootstrap': False, 'criterion': 'squared_error'}. Best is trial 457 with value: 0.3223992246327795.
[I 2024-12-04 20:01:38,093] Trial 612 finished with value: 1.2856053734866488 and parameters: {'n_estimators': 664, 'max_depth': 37, 'min_samples_split': 26, 'min_samples_leaf': 13, 'max_features': 'sqrt', 'bootstrap': False, 'criterion': 'absolute_error'}. Best is trial 457 with value: 0.3223992246327795.
