[I 2024-12-04 13:04:53,545] Trial 2473 finished with value: 0.3992294113536031 and parameters: {'n_estimators': 1496, 'learning_rate': 0.07383447636391101, 'max_depth': 6, 'min_samples_split': 2, 'min_samples_leaf': 1, 'subsample': 0.8624067607409588, 'max_features': None}. Best is trial 1454 with value: 0.30763307678022894.
[I 2024-12-04 13:04:54,055] Trial 2474 finished with value: 0.38750374037863367 and parameters: {'n_estimators': 1369, 'learning_rate': 0.03765090618144557, 'max_depth': 7, 'min_samples_split': 2, 'min_samples_leaf': 3, 'subsample': 0.7440460122161139, 'max_features': None}. Best is trial 1454 with value: 0.30763307678022894.
[I 2024-12-04 13:04:54,483] Trial 2498 finished with value: 0.40469051509785314 and parameters: {'n_estimators': 567, 'learning_rate': 0.09180708204724444, 'max_depth': 6, 'min_samples_split': 5, 'min_samples_leaf': 3, 'subsample': 0.6065085433537555, 'max_features': None}. Best is trial 1454 with value: 0.30763307678022894.
[I 2024-12-04 13:04:55,072] Trial 2485 finished with value: 0.37896743432723295 and parameters: {'n_estimators': 1208, 'learning_rate': 0.06919810917632827, 'max_depth': 4, 'min_samples_split': 2, 'min_samples_leaf': 4, 'subsample': 0.8938853573431953, 'max_features': None}. Best is trial 1454 with value: 0.30763307678022894.
[I 2024-12-04 13:04:55,184] Trial 2491 finished with value: 0.5748767088578324 and parameters: {'n_estimators': 1164, 'learning_rate': 0.06144085492455818, 'max_depth': 3, 'min_samples_split': 20, 'min_samples_leaf': 9, 'subsample': 0.9677865416778246, 'max_features': 'sqrt'}. Best is trial 1454 with value: 0.30763307678022894.
[I 2024-12-04 13:04:55,629] Trial 2478 finished with value: 0.42035842774801135 and parameters: {'n_estimators': 1453, 'learning_rate': 0.05316394777047095, 'max_depth': 4, 'min_samples_split': 5, 'min_samples_leaf': 1, 'subsample': 0.8962801168565288, 'max_features': None}. Best is trial 1454 with value: 0.30763307678022894.
[I 2024-12-04 13:04:55,639] Trial 2475 finished with value: 0.40952440639487303 and parameters: {'n_estimators': 1483, 'learning_rate': 0.04075614488190319, 'max_depth': 7, 'min_samples_split': 5, 'min_samples_leaf': 1, 'subsample': 0.7814028702434594, 'max_features': None}. Best is trial 1454 with value: 0.30763307678022894.
[I 2024-12-04 13:04:55,724] Trial 2477 finished with value: 0.38746970673251513 and parameters: {'n_estimators': 1488, 'learning_rate': 0.07725112893030685, 'max_depth': 8, 'min_samples_split': 3, 'min_samples_leaf': 3, 'subsample': 0.7766439536063848, 'max_features': None}. Best is trial 1454 with value: 0.30763307678022894.
[I 2024-12-04 13:04:57,317] Trial 2484 finished with value: 0.3935450919442879 and parameters: {'n_estimators': 1439, 'learning_rate': 0.09690249271730537, 'max_depth': 6, 'min_samples_split': 2, 'min_samples_leaf': 3, 'subsample': 0.9465777930579713, 'max_features': None}. Best is trial 1454 with value: 0.30763307678022894.
[I 2024-12-04 13:04:57,939] Trial 2487 finished with value: 0.3836741045226746 and parameters: {'n_estimators': 1237, 'learning_rate': 0.07940922470217507, 'max_depth': 7, 'min_samples_split': 2, 'min_samples_leaf': 3, 'subsample': 0.7710589001757512, 'max_features': None}. Best is trial 1454 with value: 0.30763307678022894.
[I 2024-12-04 13:04:58,041] Trial 2492 finished with value: 0.39823027597791566 and parameters: {'n_estimators': 1126, 'learning_rate': 0.04781374345061661, 'max_depth': 5, 'min_samples_split': 5, 'min_samples_leaf': 3, 'subsample': 0.9540778919479108, 'max_features': None}. Best is trial 1454 with value: 0.30763307678022894.
[I 2024-12-04 13:04:58,303] Trial 2486 finished with value: 0.3935803058307218 and parameters: {'n_estimators': 1374, 'learning_rate': 0.061098761060689386, 'max_depth': 6, 'min_samples_split': 2, 'min_samples_leaf': 3, 'subsample': 0.9005202449500594, 'max_features': None}. Best is trial 1454 with value: 0.30763307678022894.
[I 2024-12-04 13:04:59,093] Trial 2499 finished with value: 0.3632618209907554 and parameters: {'n_estimators': 919, 'learning_rate': 0.08308296974380427, 'max_depth': 7, 'min_samples_split': 3, 'min_samples_leaf': 4, 'subsample': 0.9010556259640654, 'max_features': None}. Best is trial 1454 with value: 0.30763307678022894.
[I 2024-12-04 13:04:59,398] Trial 2488 finished with value: 0.4106051428273552 and parameters: {'n_estimators': 1493, 'learning_rate': 0.0581578987805334, 'max_depth': 4, 'min_samples_split': 3, 'min_samples_leaf': 1, 'subsample': 0.9322818677473641, 'max_features': None}. Best is trial 1454 with value: 0.30763307678022894.
[I 2024-12-04 13:04:59,970] Trial 2493 finished with value: 0.32107415505756237 and parameters: {'n_estimators': 1445, 'learning_rate': 0.09736828736159894, 'max_depth': 5, 'min_samples_split': 5, 'min_samples_leaf': 2, 'subsample': 0.7630883113129977, 'max_features': None}. Best is trial 1454 with value: 0.30763307678022894.
[I 2024-12-04 13:04:59,972] Trial 2489 finished with value: 0.34875757261290075 and parameters: {'n_estimators': 1334, 'learning_rate': 0.05955454082316735, 'max_depth': 10, 'min_samples_split': 5, 'min_samples_leaf': 2, 'subsample': 0.8654076636756612, 'max_features': None}. Best is trial 1454 with value: 0.30763307678022894.
[I 2024-12-04 13:04:59,986] Trial 2490 finished with value: 0.40289958574753604 and parameters: {'n_estimators': 1409, 'learning_rate': 0.058078282572624214, 'max_depth': 7, 'min_samples_split': 5, 'min_samples_leaf': 1, 'subsample': 0.8403303644198692, 'max_features': None}. Best is trial 1454 with value: 0.30763307678022894.
[I 2024-12-04 13:05:00,703] Trial 2495 finished with value: 0.42654230686671857 and parameters: {'n_estimators': 1463, 'learning_rate': 0.04934358036550271, 'max_depth': 5, 'min_samples_split': 14, 'min_samples_leaf': 1, 'subsample': 0.8748901347136204, 'max_features': None}. Best is trial 1454 with value: 0.30763307678022894.
[I 2024-12-04 13:05:01,254] Trial 2497 finished with value: 0.35750561952673837 and parameters: {'n_estimators': 1498, 'learning_rate': 0.09051436058011382, 'max_depth': 6, 'min_samples_split': 2, 'min_samples_leaf': 2, 'subsample': 0.9979666520895035, 'max_features': None}. Best is trial 1454 with value: 0.30763307678022894.
[I 2024-12-04 13:05:01,354] Trial 2496 finished with value: 0.32276200023512813 and parameters: {'n_estimators': 1499, 'learning_rate': 0.0779107032172763, 'max_depth': 7, 'min_samples_split': 5, 'min_samples_leaf': 2, 'subsample': 0.879863337266377, 'max_features': None}. Best is trial 1454 with value: 0.30763307678022894.
[I 2024-12-04 13:05:01,559] Trial 2494 finished with value: 0.379962857273127 and parameters: {'n_estimators': 1490, 'learning_rate': 0.021393183053762387, 'max_depth': 11, 'min_samples_split': 11, 'min_samples_leaf': 5, 'subsample': 0.8082403246840344, 'max_features': None}. Best is trial 1454 with value: 0.30763307678022894.
