[I 2024-12-04 00:15:02,840] Trial 1028 finished with value: 0.19613727298624725 and parameters: {'kernel': 'rbf', 'C': 27.15613521905277, 'gamma': 0.006861233713650396, 'epsilon': 0.0030132402736305127}. Best is trial 973 with value: 0.1397919550170376.
[I 2024-12-04 00:15:03,614] Trial 1030 finished with value: 0.25368171223082003 and parameters: {'kernel': 'rbf', 'C': 12.13582319214581, 'gamma': 0.005621814801966236, 'epsilon': 0.001037004703305397}. Best is trial 973 with value: 0.1397919550170376.
[I 2024-12-04 00:15:05,192] Trial 1033 finished with value: 0.2430569029827012 and parameters: {'kernel': 'rbf', 'C': 20.81887949474066, 'gamma': 0.0043962047633640455, 'epsilon': 0.0010427476829544733}. Best is trial 973 with value: 0.1397919550170376.
[I 2024-12-04 00:15:05,564] Trial 1032 finished with value: 0.2058701064675018 and parameters: {'kernel': 'rbf', 'C': 94.51430569293618, 'gamma': 0.002241765216617118, 'epsilon': 0.0012233431585740786}. Best is trial 973 with value: 0.1397919550170376.
[I 2024-12-04 00:15:06,101] Trial 1023 finished with value: 0.17065801205180578 and parameters: {'kernel': 'rbf', 'C': 91.51683674901196, 'gamma': 0.019230257455912496, 'epsilon': 0.0010161524466069315}. Best is trial 973 with value: 0.1397919550170376.
[I 2024-12-04 00:15:06,380] Trial 1035 finished with value: 99.84796895675854 and parameters: {'kernel': 'sigmoid', 'C': 10.74886554320151, 'gamma': 0.006652004666799296, 'epsilon': 0.001012092842858796}. Best is trial 973 with value: 0.1397919550170376.
[I 2024-12-04 00:15:07,961] Trial 1036 finished with value: 1153.1487885679503 and parameters: {'kernel': 'sigmoid', 'C': 90.42754645488327, 'gamma': 0.009909976536233402, 'epsilon': 0.0039620428242931015}. Best is trial 973 with value: 0.1397919550170376.
[I 2024-12-04 00:15:07,962] Trial 1034 finished with value: 0.1586331372146911 and parameters: {'kernel': 'rbf', 'C': 97.42614571142026, 'gamma': 0.004385624307680268, 'epsilon': 0.0027439662430455663}. Best is trial 973 with value: 0.1397919550170376.
[I 2024-12-04 00:15:08,189] Trial 1031 finished with value: 0.14076665117018164 and parameters: {'kernel': 'rbf', 'C': 98.30953137552287, 'gamma': 0.00950470871921511, 'epsilon': 0.001470368403504997}. Best is trial 973 with value: 0.1397919550170376.
[I 2024-12-04 00:15:09,564] Trial 1037 finished with value: 0.2830291416996482 and parameters: {'kernel': 'rbf', 'C': 13.174207526330825, 'gamma': 0.15636596644750755, 'epsilon': 0.0010528502929846994}. Best is trial 973 with value: 0.1397919550170376.
[I 2024-12-04 00:15:11,652] Trial 940 finished with value: 0.3526415740666716 and parameters: {'kernel': 'linear', 'C': 26.319939215552928, 'gamma': 0.003295941979947425, 'epsilon': 0.001879547241045075}. Best is trial 973 with value: 0.1397919550170376.
[I 2024-12-04 00:15:12,597] Trial 1039 finished with value: 0.14488200233726184 and parameters: {'kernel': 'rbf', 'C': 98.01349171737242, 'gamma': 0.006148436382818509, 'epsilon': 0.001728559315171624}. Best is trial 973 with value: 0.1397919550170376.
[I 2024-12-04 00:15:12,672] Trial 1040 finished with value: 0.21779516091966056 and parameters: {'kernel': 'rbf', 'C': 98.85252865727314, 'gamma': 0.0017153140674755732, 'epsilon': 0.00250063450540011}. Best is trial 973 with value: 0.1397919550170376.
[I 2024-12-04 00:15:12,865] Trial 1038 finished with value: 0.14089758366120123 and parameters: {'kernel': 'rbf', 'C': 98.90713013983832, 'gamma': 0.007022610789073079, 'epsilon': 0.002729044674133871}. Best is trial 973 with value: 0.1397919550170376.
[I 2024-12-04 00:15:13,079] Trial 1042 finished with value: 0.6403359491697462 and parameters: {'kernel': 'poly', 'C': 3.4679338884356814, 'gamma': 0.07476606447248967, 'epsilon': 0.7963636483083042}. Best is trial 973 with value: 0.1397919550170376.
[I 2024-12-04 00:15:13,835] Trial 1043 finished with value: 0.16515786084794357 and parameters: {'kernel': 'rbf', 'C': 17.173030356964126, 'gamma': 0.014773181704382419, 'epsilon': 0.001037573141359584}. Best is trial 973 with value: 0.1397919550170376.
[I 2024-12-04 00:15:13,890] Trial 1044 finished with value: 768.0887941270469 and parameters: {'kernel': 'sigmoid', 'C': 76.79535035535564, 'gamma': 0.007219353476141972, 'epsilon': 0.0010238907985380206}. Best is trial 973 with value: 0.1397919550170376.
[I 2024-12-04 00:15:15,951] Trial 1047 finished with value: 0.8013136514497619 and parameters: {'kernel': 'rbf', 'C': 0.01813940390256137, 'gamma': 0.00420233579539268, 'epsilon': 0.06603757086784218}. Best is trial 973 with value: 0.1397919550170376.
[I 2024-12-04 00:15:17,300] Trial 1048 finished with value: 0.3654973042515557 and parameters: {'kernel': 'linear', 'C': 0.1020670114504498, 'gamma': 0.6712694348742795, 'epsilon': 0.0012829400404470446}. Best is trial 973 with value: 0.1397919550170376.
[I 2024-12-04 00:15:18,125] Trial 1045 finished with value: 0.15329841196330907 and parameters: {'kernel': 'rbf', 'C': 86.61707456848134, 'gamma': 0.005400511359119034, 'epsilon': 0.001104081688122318}. Best is trial 973 with value: 0.1397919550170376.
[I 2024-12-04 00:15:18,718] Trial 1051 finished with value: 0.9513998990563043 and parameters: {'kernel': 'sigmoid', 'C': 0.001616292802258197, 'gamma': 0.711466097116004, 'epsilon': 0.0075823338305460045}. Best is trial 973 with value: 0.1397919550170376.
[I 2024-12-04 00:15:19,701] Trial 1046 finished with value: 0.14133944350933927 and parameters: {'kernel': 'rbf', 'C': 90.10272448884102, 'gamma': 0.009935409183593962, 'epsilon': 0.001212771455475842}. Best is trial 973 with value: 0.1397919550170376.
[I 2024-12-04 00:15:19,769] Trial 1052 finished with value: 0.5441733342585104 and parameters: {'kernel': 'linear', 'C': 0.006511797184315397, 'gamma': 0.002459843119678832, 'epsilon': 0.0010507978845848889}. Best is trial 973 with value: 0.1397919550170376.
[I 2024-12-04 00:15:20,648] Trial 1049 finished with value: 0.21725446172047233 and parameters: {'kernel': 'rbf', 'C': 28.83581405501159, 'gamma': 0.07485294450295714, 'epsilon': 0.0028420806917289743}. Best is trial 973 with value: 0.1397919550170376.
[I 2024-12-04 00:15:21,934] Trial 1055 finished with value: 0.41279976514821176 and parameters: {'kernel': 'linear', 'C': 0.04228735925785679, 'gamma': 0.00011733632749380797, 'epsilon': 0.2924047809201999}. Best is trial 973 with value: 0.1397919550170376.
[I 2024-12-04 00:15:22,100] Trial 1054 finished with value: 0.23393996811945872 and parameters: {'kernel': 'rbf', 'C': 17.08600397378465, 'gamma': 0.006101105393895951, 'epsilon': 0.002777314901394442}. Best is trial 973 with value: 0.1397919550170376.
[I 2024-12-04 00:15:25,203] Trial 1058 finished with value: 0.21380104243693945 and parameters: {'kernel': 'rbf', 'C': 21.528523303758174, 'gamma': 0.00668255840331924, 'epsilon': 0.0028369208745685948}. Best is trial 973 with value: 0.1397919550170376.
[I 2024-12-04 00:15:25,543] Trial 1059 finished with value: 0.22893031605434158 and parameters: {'kernel': 'rbf', 'C': 98.55187303331833, 'gamma': 0.0013572729069481675, 'epsilon': 0.0029239394964627225}. Best is trial 973 with value: 0.1397919550170376.
[I 2024-12-04 00:15:27,746] Trial 582 finished with value: 0.3532610334148864 and parameters: {'kernel': 'linear', 'C': 93.37050906192358, 'gamma': 0.002027867853318635, 'epsilon': 0.005143360435624773}. Best is trial 973 with value: 0.1397919550170376.
[I 2024-12-04 00:15:27,768] Trial 1060 finished with value: 259.0349519779753 and parameters: {'kernel': 'sigmoid', 'C': 9.502812143689425, 'gamma': 0.2883577624459477, 'epsilon': 0.007817997330292528}. Best is trial 973 with value: 0.1397919550170376.
[I 2024-12-04 00:15:27,771] Trial 941 finished with value: 0.3529655552044238 and parameters: {'kernel': 'linear', 'C': 27.255155885033794, 'gamma': 0.002001419335192466, 'epsilon': 0.0019658899540668288}. Best is trial 973 with value: 0.1397919550170376.
[I 2024-12-04 00:15:28,865] Trial 1053 finished with value: 0.1749637798368628 and parameters: {'kernel': 'rbf', 'C': 98.92529067616347, 'gamma': 0.022987562537849615, 'epsilon': 0.0023005480488518257}. Best is trial 973 with value: 0.1397919550170376.
[I 2024-12-04 00:15:29,319] Trial 1061 finished with value: 0.15423961945493075 and parameters: {'kernel': 'rbf', 'C': 19.150362322108347, 'gamma': 0.01647640373714538, 'epsilon': 0.0037580993148188437}. Best is trial 973 with value: 0.1397919550170376.
[I 2024-12-04 00:15:29,957] Trial 1057 finished with value: 0.18223215459977238 and parameters: {'kernel': 'rbf', 'C': 93.22130758918165, 'gamma': 0.028781671808906104, 'epsilon': 0.0022606098501650714}. Best is trial 973 with value: 0.1397919550170376.
[I 2024-12-04 00:15:30,142] Trial 1056 finished with value: 0.1705433479930818 and parameters: {'kernel': 'rbf', 'C': 99.78512414667667, 'gamma': 0.018095912395390542, 'epsilon': 0.0010943207307069806}. Best is trial 973 with value: 0.1397919550170376.
[I 2024-12-04 00:15:30,543] Trial 1063 finished with value: 0.272217264510553 and parameters: {'kernel': 'rbf', 'C': 19.33640265504858, 'gamma': 0.002259151663992105, 'epsilon': 0.0034814872788674635}. Best is trial 973 with value: 0.1397919550170376.
[I 2024-12-04 00:15:31,913] Trial 1066 finished with value: 0.2690045838277362 and parameters: {'kernel': 'rbf', 'C': 13.291783611773896, 'gamma': 0.0036311829059917683, 'epsilon': 0.0010219101999944292}. Best is trial 973 with value: 0.1397919550170376.
[I 2024-12-04 00:15:32,914] Trial 1064 finished with value: 0.14126280184116474 and parameters: {'kernel': 'rbf', 'C': 79.42818721653617, 'gamma': 0.009325384187029691, 'epsilon': 0.0010640685201858415}. Best is trial 973 with value: 0.1397919550170376.
[I 2024-12-04 00:15:34,241] Trial 1069 finished with value: 0.25100712943082515 and parameters: {'kernel': 'rbf', 'C': 19.04517939136229, 'gamma': 0.004051540481596973, 'epsilon': 0.0038586305419843286}. Best is trial 973 with value: 0.1397919550170376.
[I 2024-12-04 00:15:35,643] Trial 1071 finished with value: 0.22799765439570355 and parameters: {'kernel': 'rbf', 'C': 13.824752995531812, 'gamma': 0.007894857045882286, 'epsilon': 0.0011193286180782294}. Best is trial 973 with value: 0.1397919550170376.
[I 2024-12-04 00:15:35,789] Trial 1070 finished with value: 0.18449339754678026 and parameters: {'kernel': 'rbf', 'C': 90.79144525771169, 'gamma': 0.0031702116185775156, 'epsilon': 0.0033392905029546744}. Best is trial 973 with value: 0.1397919550170376.
[I 2024-12-04 00:15:36,272] Trial 1065 finished with value: 0.1919178384510454 and parameters: {'kernel': 'rbf', 'C': 99.24462266627158, 'gamma': 0.03706077447699039, 'epsilon': 0.0038195795027351747}. Best is trial 973 with value: 0.1397919550170376.
[I 2024-12-04 00:15:36,812] Trial 1068 finished with value: 0.14011223260052463 and parameters: {'kernel': 'rbf', 'C': 99.17792187680713, 'gamma': 0.007927375047337655, 'epsilon': 0.0022958018956983533}. Best is trial 973 with value: 0.1397919550170376.
[I 2024-12-04 00:15:36,814] Trial 1067 finished with value: 0.1541598452115212 and parameters: {'kernel': 'rbf', 'C': 96.07758414481512, 'gamma': 0.012443274267710662, 'epsilon': 0.0042640301101474045}. Best is trial 973 with value: 0.1397919550170376.
[I 2024-12-04 00:15:38,036] Trial 1072 finished with value: 0.17624698438478437 and parameters: {'kernel': 'rbf', 'C': 23.59360954478324, 'gamma': 0.03450753092350554, 'epsilon': 0.0034334129238569}. Best is trial 973 with value: 0.1397919550170376.
[I 2024-12-04 00:15:40,118] Trial 1075 finished with value: 0.16784171144286913 and parameters: {'kernel': 'rbf', 'C': 98.79843439906325, 'gamma': 0.0036768067548205796, 'epsilon': 0.0013075424398194299}. Best is trial 973 with value: 0.1397919550170376.
[I 2024-12-04 00:15:40,294] Trial 1078 finished with value: 0.8429366938536712 and parameters: {'kernel': 'poly', 'C': 95.44563913774222, 'gamma': 0.0012231061205507053, 'epsilon': 0.0015237584602977514}. Best is trial 973 with value: 0.1397919550170376.
[I 2024-12-04 00:15:40,317] Trial 1077 finished with value: 0.17474428153715843 and parameters: {'kernel': 'rbf', 'C': 20.281787377652584, 'gamma': 0.010978274025805246, 'epsilon': 0.0027320868397734052}. Best is trial 973 with value: 0.1397919550170376.
[I 2024-12-04 00:15:40,979] Trial 1050 finished with value: 0.3331959842882172 and parameters: {'kernel': 'linear', 'C': 6.644362775077132, 'gamma': 0.00017157817612391924, 'epsilon': 0.07695333510237788}. Best is trial 973 with value: 0.1397919550170376.
[I 2024-12-04 00:15:43,241] Trial 1079 finished with value: 0.21891694541345283 and parameters: {'kernel': 'rbf', 'C': 16.283611620478595, 'gamma': 0.007816085614621418, 'epsilon': 0.00105488540989567}. Best is trial 973 with value: 0.1397919550170376.
[I 2024-12-04 00:15:43,704] Trial 1074 finished with value: 0.1641707045871182 and parameters: {'kernel': 'rbf', 'C': 98.62367756109506, 'gamma': 0.0146977486388319, 'epsilon': 0.001362972564884472}. Best is trial 973 with value: 0.1397919550170376.
[I 2024-12-04 00:15:43,704] Trial 1082 finished with value: 0.4991146427779023 and parameters: {'kernel': 'linear', 'C': 4.671970067207992, 'gamma': 0.003854800525240402, 'epsilon': 0.881863197550616}. Best is trial 973 with value: 0.1397919550170376.
[I 2024-12-04 00:15:43,783] Trial 1081 finished with value: 0.20965002865976828 and parameters: {'kernel': 'rbf', 'C': 2.9729258144925104, 'gamma': 0.04820836279175306, 'epsilon': 0.001007446253516672}. Best is trial 973 with value: 0.1397919550170376.
[I 2024-12-04 00:15:43,854] Trial 1076 finished with value: 0.1710491463215472 and parameters: {'kernel': 'rbf', 'C': 95.14909551628553, 'gamma': 0.020035804291564076, 'epsilon': 0.0032326137000163574}. Best is trial 973 with value: 0.1397919550170376.
[I 2024-12-04 00:15:44,447] Trial 1080 finished with value: 0.18559337685308258 and parameters: {'kernel': 'rbf', 'C': 86.7092939562016, 'gamma': 0.0032093729053371874, 'epsilon': 0.0010108370320771499}. Best is trial 973 with value: 0.1397919550170376.
[I 2024-12-04 00:15:46,440] Trial 1084 finished with value: 0.6024603512876718 and parameters: {'kernel': 'linear', 'C': 0.0018826500458210865, 'gamma': 0.0001231222623283404, 'epsilon': 0.004337806133047751}. Best is trial 973 with value: 0.1397919550170376.
[I 2024-12-04 00:15:46,677] Trial 1087 finished with value: 0.9163115934765107 and parameters: {'kernel': 'sigmoid', 'C': 0.25418368193624985, 'gamma': 0.00012816039627402184, 'epsilon': 0.6348425884883311}. Best is trial 973 with value: 0.1397919550170376.
[I 2024-12-04 00:15:47,148] Trial 1085 finished with value: 0.2752263067807231 and parameters: {'kernel': 'rbf', 'C': 19.91410706877967, 'gamma': 0.002086359774129881, 'epsilon': 0.006457450781968153}. Best is trial 973 with value: 0.1397919550170376.
[I 2024-12-04 00:15:48,840] Trial 1088 finished with value: 0.20898807665611233 and parameters: {'kernel': 'rbf', 'C': 27.9364303375553, 'gamma': 0.005707570441963107, 'epsilon': 0.005854805839687629}. Best is trial 973 with value: 0.1397919550170376.
[I 2024-12-04 00:15:48,979] Trial 1086 finished with value: 0.16896378763859832 and parameters: {'kernel': 'rbf', 'C': 95.59021807965685, 'gamma': 0.0036989923872122526, 'epsilon': 0.007064951024820326}. Best is trial 973 with value: 0.1397919550170376.
[I 2024-12-04 00:15:49,841] Trial 1090 finished with value: 0.9100899380719231 and parameters: {'kernel': 'rbf', 'C': 0.003887402730713563, 'gamma': 0.06586355839398123, 'epsilon': 0.5376000356428444}. Best is trial 973 with value: 0.1397919550170376.
[I 2024-12-04 00:15:50,595] Trial 1089 finished with value: 0.23959905188010627 and parameters: {'kernel': 'rbf', 'C': 12.969961109479724, 'gamma': 0.0070085905532741395, 'epsilon': 0.0010195526894379399}. Best is trial 973 with value: 0.1397919550170376.
[I 2024-12-04 00:15:53,256] Trial 1093 finished with value: 0.158415221003533 and parameters: {'kernel': 'rbf', 'C': 19.109065512279784, 'gamma': 0.015014756752168752, 'epsilon': 0.002921856255998601}. Best is trial 973 with value: 0.1397919550170376.
[I 2024-12-04 00:15:54,021] Trial 1094 finished with value: 0.21008533577663654 and parameters: {'kernel': 'rbf', 'C': 97.24178777136801, 'gamma': 0.0020567257161798387, 'epsilon': 0.001315238988672977}. Best is trial 973 with value: 0.1397919550170376.
[I 2024-12-04 00:15:54,097] Trial 1092 finished with value: 0.1571507232077552 and parameters: {'kernel': 'rbf', 'C': 16.959751735751617, 'gamma': 0.028936014888641413, 'epsilon': 0.0010566069039390886}. Best is trial 973 with value: 0.1397919550170376.
[I 2024-12-04 00:15:55,534] Trial 1091 finished with value: 0.2339918743073793 and parameters: {'kernel': 'rbf', 'C': 85.06866113682206, 'gamma': 0.0953870842831672, 'epsilon': 0.001612178836277739}. Best is trial 973 with value: 0.1397919550170376.
[I 2024-12-04 00:15:56,687] Trial 1095 finished with value: 0.1448925778730152 and parameters: {'kernel': 'rbf', 'C': 83.88995190600832, 'gamma': 0.006964313110429079, 'epsilon': 0.004209915270157292}. Best is trial 973 with value: 0.1397919550170376.
[I 2024-12-04 00:15:57,300] Trial 1073 finished with value: 0.5186804715752769 and parameters: {'kernel': 'poly', 'C': 54.44304756414404, 'gamma': 0.014069222665047443, 'epsilon': 0.0027572423553077026}. Best is trial 973 with value: 0.1397919550170376.
[I 2024-12-04 00:15:59,656] Trial 1096 finished with value: 0.1446018658743005 and parameters: {'kernel': 'rbf', 'C': 93.90236445362596, 'gamma': 0.006334273410831773, 'epsilon': 0.0019605865523124513}. Best is trial 973 with value: 0.1397919550170376.
[I 2024-12-04 00:16:01,343] Trial 1098 finished with value: 0.14092251469199002 and parameters: {'kernel': 'rbf', 'C': 96.1795405674492, 'gamma': 0.009887881111193396, 'epsilon': 0.002939799658138855}. Best is trial 973 with value: 0.1397919550170376.
[I 2024-12-04 00:16:03,994] Trial 1102 finished with value: 0.20009876192777337 and parameters: {'kernel': 'rbf', 'C': 98.1935527843127, 'gamma': 0.0024081737903041173, 'epsilon': 0.0011182489026850412}. Best is trial 973 with value: 0.1397919550170376.
[I 2024-12-04 00:16:05,832] Trial 1101 finished with value: 0.14724500674408011 and parameters: {'kernel': 'rbf', 'C': 93.7810569838338, 'gamma': 0.011378736884281492, 'epsilon': 0.0012978029081259957}. Best is trial 973 with value: 0.1397919550170376.
[I 2024-12-04 00:16:05,834] Trial 1100 finished with value: 0.5627350692736331 and parameters: {'kernel': 'poly', 'C': 61.72425565880661, 'gamma': 0.009536047017669315, 'epsilon': 0.001445076529709487}. Best is trial 973 with value: 0.1397919550170376.
[I 2024-12-04 00:16:06,406] Trial 1099 finished with value: 0.19036676600739255 and parameters: {'kernel': 'rbf', 'C': 92.91358542177586, 'gamma': 0.036410286794556435, 'epsilon': 0.002619415594778274}. Best is trial 973 with value: 0.1397919550170376.
[I 2024-12-04 00:16:08,791] Trial 1106 finished with value: 0.25446456388728583 and parameters: {'kernel': 'rbf', 'C': 12.913131399285897, 'gamma': 0.005223359773092923, 'epsilon': 0.008468847915996613}. Best is trial 973 with value: 0.1397919550170376.
[I 2024-12-04 00:16:09,506] Trial 1107 finished with value: 28.29533038434007 and parameters: {'kernel': 'sigmoid', 'C': 0.669525290089112, 'gamma': 0.9172865595077053, 'epsilon': 0.008524443158483988}. Best is trial 973 with value: 0.1397919550170376.
[I 2024-12-04 00:16:09,507] Trial 1105 finished with value: 0.17563045553982334 and parameters: {'kernel': 'rbf', 'C': 20.191162765956133, 'gamma': 0.010892121856008933, 'epsilon': 0.007363476132697906}. Best is trial 973 with value: 0.1397919550170376.
[I 2024-12-04 00:16:10,216] Trial 652 finished with value: 0.352466983285159 and parameters: {'kernel': 'linear', 'C': 97.13999626045128, 'gamma': 0.016817705331574853, 'epsilon': 0.001065096725101881}. Best is trial 973 with value: 0.1397919550170376.
[I 2024-12-04 00:16:11,552] Trial 1108 finished with value: 0.1978931517912339 and parameters: {'kernel': 'rbf', 'C': 17.699580927517346, 'gamma': 0.009190475982571954, 'epsilon': 0.002206271369908955}. Best is trial 973 with value: 0.1397919550170376.
[I 2024-12-04 00:16:13,079] Trial 1111 finished with value: 0.22616000873214948 and parameters: {'kernel': 'rbf', 'C': 20.503049542775315, 'gamma': 0.005832381150912691, 'epsilon': 0.0026902354526893964}. Best is trial 973 with value: 0.1397919550170376.
[I 2024-12-04 00:16:14,426] Trial 1097 finished with value: 0.3304232566358376 and parameters: {'kernel': 'linear', 'C': 3.0513858443607025, 'gamma': 0.0664035857733989, 'epsilon': 0.06837421966331143}. Best is trial 973 with value: 0.1397919550170376.
[I 2024-12-04 00:16:14,427] Trial 1112 finished with value: 0.7901195275084729 and parameters: {'kernel': 'poly', 'C': 84.80393883721682, 'gamma': 0.0021568159971729274, 'epsilon': 0.005508437377146963}. Best is trial 973 with value: 0.1397919550170376.
[I 2024-12-04 00:16:14,957] Trial 1110 finished with value: 0.14088137430044181 and parameters: {'kernel': 'rbf', 'C': 92.61354335811528, 'gamma': 0.00827516715249838, 'epsilon': 0.003037484835722372}. Best is trial 973 with value: 0.1397919550170376.
[I 2024-12-04 00:16:14,958] Trial 1109 finished with value: 0.14004790696942304 and parameters: {'kernel': 'rbf', 'C': 97.52210303165874, 'gamma': 0.007902474873426008, 'epsilon': 0.0018572654253379292}. Best is trial 973 with value: 0.1397919550170376.
[I 2024-12-04 00:16:14,961] Trial 1104 finished with value: 0.19802109596000983 and parameters: {'kernel': 'rbf', 'C': 84.11813881941339, 'gamma': 0.043348062281491045, 'epsilon': 0.001024890977779492}. Best is trial 973 with value: 0.1397919550170376.
[I 2024-12-04 00:16:18,000] Trial 1115 finished with value: 0.3168038302934327 and parameters: {'kernel': 'rbf', 'C': 15.379581724015312, 'gamma': 0.0014641094539352038, 'epsilon': 0.002611280407938337}. Best is trial 973 with value: 0.1397919550170376.
