[I 2024-12-04 19:50:41,949] Trial 330 finished with value: 0.3592112323874226 and parameters: {'kernel_type': 'Matern', 'length_scale': 0.715559686621609, 'noise_level': 0.8746938281887203, 'constant_value': 7.963811732359711e-05, 'nu': 0.5}. Best is trial 199 with value: 0.3592098145876718.
[I 2024-12-04 19:50:44,596] Trial 332 finished with value: 0.35921127007581827 and parameters: {'kernel_type': 'Matern', 'length_scale': 14.525132818577566, 'noise_level': 0.039790837591889276, 'constant_value': 3.9801230041830826, 'nu': 0.5}. Best is trial 199 with value: 0.3592098145876718.
[I 2024-12-04 19:50:46,490] Trial 333 finished with value: 0.3592112688572533 and parameters: {'kernel_type': 'Matern', 'length_scale': 4.1442973239837055, 'noise_level': 0.04320974427037462, 'constant_value': 0.0030372503394480027, 'nu': 0.5}. Best is trial 199 with value: 0.3592098145876718.
[I 2024-12-04 19:50:46,765] Trial 334 finished with value: 0.359211247033709 and parameters: {'kernel_type': 'Matern', 'length_scale': 142.08148876670683, 'noise_level': 0.07804660773016522, 'constant_value': 136.79104910829466, 'nu': 0.5}. Best is trial 199 with value: 0.3592098145876718.
[I 2024-12-04 19:50:49,277] Trial 335 finished with value: 0.3592112591204186 and parameters: {'kernel_type': 'Matern', 'length_scale': 606.4803420606876, 'noise_level': 0.9099507245406112, 'constant_value': 15.432077797442082, 'nu': 0.5}. Best is trial 199 with value: 0.3592098145876718.
[I 2024-12-04 19:50:51,744] Trial 337 finished with value: 0.3592104939255107 and parameters: {'kernel_type': 'Matern', 'length_scale': 19.011473335936298, 'noise_level': 0.733924078213782, 'constant_value': 0.015296383504432232, 'nu': 0.5}. Best is trial 199 with value: 0.3592098145876718.
[I 2024-12-04 19:50:53,167] Trial 336 finished with value: 1.0624161172580275 and parameters: {'kernel_type': 'Matern', 'length_scale': 63.10262771974953, 'noise_level': 0.021822897182908387, 'constant_value': 0.020129318949218395, 'nu': 0.5}. Best is trial 199 with value: 0.3592098145876718.
[I 2024-12-04 19:50:54,302] Trial 338 finished with value: 0.3592111298171026 and parameters: {'kernel_type': 'Matern', 'length_scale': 7.858745093538694, 'noise_level': 0.7638838082379449, 'constant_value': 89.61072452171449, 'nu': 0.5}. Best is trial 199 with value: 0.3592098145876718.
[I 2024-12-04 19:50:59,163] Trial 339 finished with value: 0.35921166516006614 and parameters: {'kernel_type': 'Matern', 'length_scale': 83.67988417116021, 'noise_level': 0.45834088122353145, 'constant_value': 0.0021110346983754056, 'nu': 0.5}. Best is trial 199 with value: 0.3592098145876718.
[I 2024-12-04 19:51:00,975] Trial 341 finished with value: 0.4286832866943079 and parameters: {'kernel_type': 'RBF', 'length_scale': 1209.8990205247949, 'noise_level': 0.7760502505554794, 'constant_value': 2.8280528743909312, 'nu': 0.5}. Best is trial 199 with value: 0.3592098145876718.
[I 2024-12-04 19:51:03,498] Trial 340 finished with value: 1.0624161174190099 and parameters: {'kernel_type': 'Matern', 'length_scale': 394.44083255631875, 'noise_level': 0.04301135398793906, 'constant_value': 0.0014462233005363776, 'nu': 0.5}. Best is trial 199 with value: 0.3592098145876718.
[I 2024-12-04 19:51:04,932] Trial 342 finished with value: 0.35921083160969525 and parameters: {'kernel_type': 'Matern', 'length_scale': 59.589812174100146, 'noise_level': 0.8038553738056327, 'constant_value': 0.025464180912109342, 'nu': 0.5}. Best is trial 199 with value: 0.3592098145876718.
[I 2024-12-04 19:51:06,683] Trial 343 finished with value: 0.35921118443929595 and parameters: {'kernel_type': 'Matern', 'length_scale': 3.7927435892551973, 'noise_level': 0.6963120407887067, 'constant_value': 0.001085460280097004, 'nu': 0.5}. Best is trial 199 with value: 0.3592098145876718.
[I 2024-12-04 19:51:10,035] Trial 344 finished with value: 1.0624161172527857 and parameters: {'kernel_type': 'RBF', 'length_scale': 309.05646240714464, 'noise_level': 0.02281084312476769, 'constant_value': 53.63786282103455, 'nu': 1.5}. Best is trial 199 with value: 0.3592098145876718.
[I 2024-12-04 19:51:10,274] Trial 345 finished with value: 0.35921143008711814 and parameters: {'kernel_type': 'Matern', 'length_scale': 111.99609601771175, 'noise_level': 0.5250288698313477, 'constant_value': 0.03828206493462629, 'nu': 0.5}. Best is trial 199 with value: 0.3592098145876718.
[I 2024-12-04 19:51:13,450] Trial 347 finished with value: 1.091655849379549 and parameters: {'kernel_type': 'Matern', 'length_scale': 0.052367095406000236, 'noise_level': 3.364413381950839e-05, 'constant_value': 1133.7471780453247, 'nu': 1.5}. Best is trial 199 with value: 0.3592098145876718.
[I 2024-12-04 19:51:15,790] Trial 348 finished with value: 1.062416117268439 and parameters: {'kernel_type': 'Matern', 'length_scale': 207.3705219992702, 'noise_level': 4.341300772137581e-05, 'constant_value': 1.748373396527364, 'nu': 0.5}. Best is trial 199 with value: 0.3592098145876718.
[I 2024-12-04 19:51:15,885] Trial 346 finished with value: 1.062416117258577 and parameters: {'kernel_type': 'RBF', 'length_scale': 712.101351020287, 'noise_level': 9.155992980527478e-06, 'constant_value': 0.00011427137808356637, 'nu': 0.5}. Best is trial 199 with value: 0.3592098145876718.
[I 2024-12-04 19:51:18,618] Trial 349 finished with value: 1.062416117211937 and parameters: {'kernel_type': 'Matern', 'length_scale': 0.04298024396992654, 'noise_level': 0.004682979758095474, 'constant_value': 200.37337557121316, 'nu': 0.5}. Best is trial 199 with value: 0.3592098145876718.
[I 2024-12-04 19:51:19,201] Trial 350 finished with value: 1.0624161178381253 and parameters: {'kernel_type': 'RBF', 'length_scale': 0.012749133060258839, 'noise_level': 0.1597586125871985, 'constant_value': 63.964487715724566, 'nu': 2.5}. Best is trial 199 with value: 0.3592098145876718.
[I 2024-12-04 19:51:21,365] Trial 351 finished with value: 0.3592112341349185 and parameters: {'kernel_type': 'Matern', 'length_scale': 138.0217361957975, 'noise_level': 0.6702880398510174, 'constant_value': 0.19238052239782624, 'nu': 0.5}. Best is trial 199 with value: 0.3592098145876718.
[I 2024-12-04 19:51:22,436] Trial 352 finished with value: 0.3592112803746979 and parameters: {'kernel_type': 'Matern', 'length_scale': 5.2645897242053135, 'noise_level': 0.611569120297038, 'constant_value': 0.13339905655445788, 'nu': 0.5}. Best is trial 199 with value: 0.3592098145876718.
[I 2024-12-04 19:51:24,949] Trial 353 finished with value: 1.062416116618968 and parameters: {'kernel_type': 'Matern', 'length_scale': 963.4544902731902, 'noise_level': 0.0035694799365942353, 'constant_value': 0.4081554312094144, 'nu': 0.5}. Best is trial 199 with value: 0.3592098145876718.
[I 2024-12-04 19:51:25,808] Trial 355 finished with value: 1.091656492273119 and parameters: {'kernel_type': 'Matern', 'length_scale': 13.71415505403969, 'noise_level': 2.3953534552165556e-08, 'constant_value': 1941.3062767113033, 'nu': 0.5}. Best is trial 199 with value: 0.3592098145876718.
[I 2024-12-04 19:51:31,138] Trial 357 finished with value: 0.35921127241515155 and parameters: {'kernel_type': 'Matern', 'length_scale': 2.3716137627624128, 'noise_level': 8.930212726525799e-05, 'constant_value': 0.5232060371348183, 'nu': 0.5}. Best is trial 199 with value: 0.3592098145876718.
[I 2024-12-04 19:51:31,730] Trial 354 finished with value: 0.3592112919055329 and parameters: {'kernel_type': 'Matern', 'length_scale': 3546.0608817123793, 'noise_level': 0.7549817293465388, 'constant_value': 0.009755424949284369, 'nu': 0.5}. Best is trial 199 with value: 0.3592098145876718.
[I 2024-12-04 19:51:35,146] Trial 356 finished with value: 1.0624161178425988 and parameters: {'kernel_type': 'RBF', 'length_scale': 36.380388391663885, 'noise_level': 5.2611476452426186e-05, 'constant_value': 9.530362082175208e-07, 'nu': 2.5}. Best is trial 199 with value: 0.3592098145876718.
[I 2024-12-04 19:51:38,370] Trial 358 finished with value: 1.0624161170370048 and parameters: {'kernel_type': 'RBF', 'length_scale': 640.835857409181, 'noise_level': 3.31468826045256e-05, 'constant_value': 0.035391685698483805, 'nu': 1.5}. Best is trial 199 with value: 0.3592098145876718.
[I 2024-12-04 19:51:39,435] Trial 359 finished with value: 0.4226865906306372 and parameters: {'kernel_type': 'Matern', 'length_scale': 149.42863681000165, 'noise_level': 0.8563914251303766, 'constant_value': 0.029988618249061478, 'nu': 1.5}. Best is trial 199 with value: 0.3592098145876718.
[I 2024-12-04 19:51:40,288] Trial 360 finished with value: 0.3592112125860004 and parameters: {'kernel_type': 'Matern', 'length_scale': 35.20929757427184, 'noise_level': 0.03345888480573766, 'constant_value': 1094.0067603725468, 'nu': 0.5}. Best is trial 199 with value: 0.3592098145876718.
[I 2024-12-04 19:51:43,536] Trial 361 finished with value: 0.3592111108669201 and parameters: {'kernel_type': 'Matern', 'length_scale': 524.9390662999394, 'noise_level': 0.8558462964692224, 'constant_value': 0.4438518869062683, 'nu': 0.5}. Best is trial 199 with value: 0.3592098145876718.
[I 2024-12-04 19:51:45,672] Trial 363 finished with value: 0.35921074426551436 and parameters: {'kernel_type': 'Matern', 'length_scale': 118.39728498737666, 'noise_level': 0.010989157733963625, 'constant_value': 0.987251587155889, 'nu': 0.5}. Best is trial 199 with value: 0.3592098145876718.
[I 2024-12-04 19:51:49,570] Trial 362 finished with value: 1.0624161168363708 and parameters: {'kernel_type': 'RBF', 'length_scale': 440.50857532798403, 'noise_level': 0.008371761684509907, 'constant_value': 0.003161125706158234, 'nu': 0.5}. Best is trial 199 with value: 0.3592098145876718.
[I 2024-12-04 19:51:49,996] Trial 364 finished with value: 0.35921112816835243 and parameters: {'kernel_type': 'Matern', 'length_scale': 3.8620986328635527, 'noise_level': 0.013603756057719778, 'constant_value': 5713.503927413458, 'nu': 0.5}. Best is trial 199 with value: 0.3592098145876718.
[I 2024-12-04 19:51:50,583] Trial 365 finished with value: 1.0624161172757687 and parameters: {'kernel_type': 'RBF', 'length_scale': 0.009246350839730983, 'noise_level': 2.0644148407872444e-06, 'constant_value': 0.029749401846061584, 'nu': 2.5}. Best is trial 199 with value: 0.3592098145876718.
[I 2024-12-04 19:51:54,572] Trial 366 finished with value: 0.35921104493247114 and parameters: {'kernel_type': 'Matern', 'length_scale': 42.263484169404116, 'noise_level': 0.15571197277329435, 'constant_value': 0.4203702800051854, 'nu': 0.5}. Best is trial 199 with value: 0.3592098145876718.
[I 2024-12-04 19:51:56,848] Trial 367 finished with value: 1.0624161170926143 and parameters: {'kernel_type': 'Matern', 'length_scale': 10.999279110196976, 'noise_level': 1.7398546872145218e-09, 'constant_value': 1.3392041785888267e-07, 'nu': 1.5}. Best is trial 199 with value: 0.3592098145876718.
[I 2024-12-04 19:51:59,506] Trial 368 finished with value: 1.0624161172857836 and parameters: {'kernel_type': 'Matern', 'length_scale': 881.5523906389219, 'noise_level': 0.004956170947289533, 'constant_value': 0.00750614641331616, 'nu': 0.5}. Best is trial 199 with value: 0.3592098145876718.
[I 2024-12-04 19:51:59,842] Trial 369 finished with value: 1.0916567247915157 and parameters: {'kernel_type': 'Matern', 'length_scale': 3737.6326305085126, 'noise_level': 0.13623932501501532, 'constant_value': 0.011472202598179273, 'nu': 2.5}. Best is trial 199 with value: 0.3592098145876718.
[I 2024-12-04 19:52:00,703] Trial 370 finished with value: 1.0624161172657378 and parameters: {'kernel_type': 'Matern', 'length_scale': 3409.2804487687577, 'noise_level': 0.0065604731761958095, 'constant_value': 5.5744454443344384, 'nu': 0.5}. Best is trial 199 with value: 0.3592098145876718.
[I 2024-12-04 19:52:04,288] Trial 372 finished with value: 0.35921121456618726 and parameters: {'kernel_type': 'Matern', 'length_scale': 6.230697322284513, 'noise_level': 0.8340064372619336, 'constant_value': 0.018265353066071133, 'nu': 0.5}. Best is trial 199 with value: 0.3592098145876718.
[I 2024-12-04 19:52:05,790] Trial 373 finished with value: 0.3592112400175561 and parameters: {'kernel_type': 'Matern', 'length_scale': 99.82482630810878, 'noise_level': 0.017601968406245252, 'constant_value': 7.961797690667901, 'nu': 0.5}. Best is trial 199 with value: 0.3592098145876718.
[I 2024-12-04 19:52:08,463] Trial 374 finished with value: 0.3592112419387945 and parameters: {'kernel_type': 'Matern', 'length_scale': 745.0114034014206, 'noise_level': 0.9426566685180507, 'constant_value': 19.275385170877, 'nu': 0.5}. Best is trial 199 with value: 0.3592098145876718.
[I 2024-12-04 19:52:08,751] Trial 371 finished with value: 1.0624161173088362 and parameters: {'kernel_type': 'RBF', 'length_scale': 0.0002042044846987646, 'noise_level': 3.0536745722474386e-05, 'constant_value': 4.2316433682706525e-06, 'nu': 1.5}. Best is trial 199 with value: 0.3592098145876718.
[I 2024-12-04 19:52:10,953] Trial 375 finished with value: 0.35921117098789446 and parameters: {'kernel_type': 'Matern', 'length_scale': 9.568228323276266, 'noise_level': 0.005516933433871284, 'constant_value': 0.2375008261720554, 'nu': 0.5}. Best is trial 199 with value: 0.3592098145876718.
[I 2024-12-04 19:52:13,853] Trial 377 finished with value: 0.359211253330604 and parameters: {'kernel_type': 'Matern', 'length_scale': 28.668112807125237, 'noise_level': 0.7883785344798083, 'constant_value': 69.53160145258457, 'nu': 0.5}. Best is trial 199 with value: 0.3592098145876718.
[I 2024-12-04 19:52:14,889] Trial 376 finished with value: 0.3592109449340947 and parameters: {'kernel_type': 'Matern', 'length_scale': 589.2935658674448, 'noise_level': 0.6251902343114711, 'constant_value': 0.022208707984196475, 'nu': 0.5}. Best is trial 199 with value: 0.3592098145876718.
[I 2024-12-04 19:52:20,429] Trial 380 finished with value: 0.3592110482401242 and parameters: {'kernel_type': 'Matern', 'length_scale': 179.96763671577983, 'noise_level': 0.013751992279504785, 'constant_value': 1.0416994022261554, 'nu': 0.5}. Best is trial 199 with value: 0.3592098145876718.
[I 2024-12-04 19:52:20,435] Trial 379 finished with value: 1.0624161172324504 and parameters: {'kernel_type': 'RBF', 'length_scale': 1912.445308331678, 'noise_level': 0.002414640254471077, 'constant_value': 8.04495935990831, 'nu': 0.5}. Best is trial 199 with value: 0.3592098145876718.
[I 2024-12-04 19:52:21,637] Trial 378 finished with value: 1.062416117251905 and parameters: {'kernel_type': 'RBF', 'length_scale': 255.94716031939163, 'noise_level': 2.103768792207721e-08, 'constant_value': 3.906407553486023e-07, 'nu': 0.5}. Best is trial 199 with value: 0.3592098145876718.
[I 2024-12-04 19:52:26,478] Trial 383 finished with value: 0.3592111557445741 and parameters: {'kernel_type': 'Matern', 'length_scale': 862.038824311913, 'noise_level': 0.9673218709442639, 'constant_value': 582.4460050002562, 'nu': 0.5}. Best is trial 199 with value: 0.3592098145876718.
[I 2024-12-04 19:52:26,767] Trial 381 finished with value: 0.35921119108229205 and parameters: {'kernel_type': 'Matern', 'length_scale': 340.7046809406583, 'noise_level': 0.04365358233125423, 'constant_value': 0.14803173328609365, 'nu': 0.5}. Best is trial 199 with value: 0.3592098145876718.
[I 2024-12-04 19:52:30,389] Trial 382 finished with value: 1.0624161172750588 and parameters: {'kernel_type': 'RBF', 'length_scale': 1.7507870857391798e-05, 'noise_level': 0.019119391673115108, 'constant_value': 1.3365847917546594e-05, 'nu': 0.5}. Best is trial 199 with value: 0.3592098145876718.
[I 2024-12-04 19:52:30,414] Trial 384 finished with value: 0.35921114105277807 and parameters: {'kernel_type': 'Matern', 'length_scale': 3.7808138302754566, 'noise_level': 0.14211087713638937, 'constant_value': 0.31749108190531655, 'nu': 0.5}. Best is trial 199 with value: 0.3592098145876718.
[I 2024-12-04 19:52:32,037] Trial 385 finished with value: 0.3592111297921341 and parameters: {'kernel_type': 'Matern', 'length_scale': 29.00796442267951, 'noise_level': 0.08285748944316637, 'constant_value': 0.026076842106122225, 'nu': 0.5}. Best is trial 199 with value: 0.3592098145876718.
[I 2024-12-04 19:52:36,645] Trial 387 finished with value: 1.0624161172629076 and parameters: {'kernel_type': 'RBF', 'length_scale': 0.00012138779694087075, 'noise_level': 1.0315045542143043e-09, 'constant_value': 1.2680630213643503e-07, 'nu': 0.5}. Best is trial 199 with value: 0.3592098145876718.
[I 2024-12-04 19:52:36,716] Trial 388 finished with value: 0.35921086336258606 and parameters: {'kernel_type': 'Matern', 'length_scale': 1.6222301319086532, 'noise_level': 0.663335245354156, 'constant_value': 1.5697054891104254, 'nu': 0.5}. Best is trial 199 with value: 0.3592098145876718.
[I 2024-12-04 19:52:39,493] Trial 386 finished with value: 1.062416117264385 and parameters: {'kernel_type': 'Matern', 'length_scale': 67.63329999180289, 'noise_level': 0.03177927989139274, 'constant_value': 0.0015455970597130215, 'nu': 0.5}. Best is trial 199 with value: 0.3592098145876718.
[I 2024-12-04 19:52:41,027] Trial 390 finished with value: 1.062416116718999 and parameters: {'kernel_type': 'Matern', 'length_scale': 0.026739324756409277, 'noise_level': 0.4425365601394498, 'constant_value': 42.50670440525427, 'nu': 0.5}. Best is trial 199 with value: 0.3592098145876718.
[I 2024-12-04 19:52:42,154] Trial 389 finished with value: 0.35921126917135293 and parameters: {'kernel_type': 'Matern', 'length_scale': 0.26230560033920836, 'noise_level': 0.037512568352081936, 'constant_value': 0.28527731899335274, 'nu': 0.5}. Best is trial 199 with value: 0.3592098145876718.
[I 2024-12-04 19:52:44,675] Trial 391 finished with value: 0.3592112879851045 and parameters: {'kernel_type': 'Matern', 'length_scale': 1.2762602072342148, 'noise_level': 0.7630030174782261, 'constant_value': 14.493286560496047, 'nu': 0.5}. Best is trial 199 with value: 0.3592098145876718.
[I 2024-12-04 19:52:45,747] Trial 392 finished with value: 0.3592138522449098 and parameters: {'kernel_type': 'Matern', 'length_scale': 28.063870564238858, 'noise_level': 0.6190217832829016, 'constant_value': 0.5418670233601821, 'nu': 0.5}. Best is trial 199 with value: 0.3592098145876718.
[I 2024-12-04 19:52:46,698] Trial 393 finished with value: 0.3592109482270063 and parameters: {'kernel_type': 'Matern', 'length_scale': 6.74125536469913, 'noise_level': 0.8725478853897062, 'constant_value': 0.13857061735151552, 'nu': 0.5}. Best is trial 199 with value: 0.3592098145876718.
[I 2024-12-04 19:52:49,679] Trial 394 finished with value: 0.35921123612268774 and parameters: {'kernel_type': 'Matern', 'length_scale': 0.9144773786840921, 'noise_level': 0.0010278171807486412, 'constant_value': 51.22351721802402, 'nu': 0.5}. Best is trial 199 with value: 0.3592098145876718.
[I 2024-12-04 19:52:50,426] Trial 395 finished with value: 0.35921110069027706 and parameters: {'kernel_type': 'Matern', 'length_scale': 79.67438659525229, 'noise_level': 0.027197611826669726, 'constant_value': 33.78695682745525, 'nu': 0.5}. Best is trial 199 with value: 0.3592098145876718.
[I 2024-12-04 19:52:51,661] Trial 396 finished with value: 0.3592112945240291 and parameters: {'kernel_type': 'Matern', 'length_scale': 981.0928016615699, 'noise_level': 0.053238514820541316, 'constant_value': 6.058074348915589, 'nu': 0.5}. Best is trial 199 with value: 0.3592098145876718.
[I 2024-12-04 19:52:54,929] Trial 397 finished with value: 0.3592112191482445 and parameters: {'kernel_type': 'Matern', 'length_scale': 16.849395889048452, 'noise_level': 0.9763757484355292, 'constant_value': 31.59538992118173, 'nu': 0.5}. Best is trial 199 with value: 0.3592098145876718.
[I 2024-12-04 19:52:56,533] Trial 398 finished with value: 1.0624161172708797 and parameters: {'kernel_type': 'RBF', 'length_scale': 1.067437797948928e-05, 'noise_level': 4.2993880756363215e-08, 'constant_value': 0.07287346490278553, 'nu': 2.5}. Best is trial 199 with value: 0.3592098145876718.
[I 2024-12-04 19:52:57,073] Trial 399 finished with value: 0.3592113487123013 and parameters: {'kernel_type': 'Matern', 'length_scale': 1418.0498002514069, 'noise_level': 0.9472930237876861, 'constant_value': 0.8735526243753262, 'nu': 0.5}. Best is trial 199 with value: 0.3592098145876718.
[I 2024-12-04 19:53:00,078] Trial 400 finished with value: 0.35921123586507897 and parameters: {'kernel_type': 'Matern', 'length_scale': 284.1551469474129, 'noise_level': 0.02245313566552408, 'constant_value': 4.003332890394856, 'nu': 0.5}. Best is trial 199 with value: 0.3592098145876718.
[I 2024-12-04 19:53:00,725] Trial 401 finished with value: 1.0624161172616433 and parameters: {'kernel_type': 'Matern', 'length_scale': 1.2129872405561278e-05, 'noise_level': 0.44074134548962596, 'constant_value': 2.06181628100056, 'nu': 0.5}. Best is trial 199 with value: 0.3592098145876718.
[I 2024-12-04 19:53:01,800] Trial 402 finished with value: 0.3592113557154828 and parameters: {'kernel_type': 'Matern', 'length_scale': 40.04610626555639, 'noise_level': 0.9205796041016986, 'constant_value': 4.224629395553247, 'nu': 0.5}. Best is trial 199 with value: 0.3592098145876718.
[I 2024-12-04 19:53:05,105] Trial 403 finished with value: 0.35921100415332824 and parameters: {'kernel_type': 'Matern', 'length_scale': 1.141442287207461, 'noise_level': 0.08910620691962018, 'constant_value': 4.145556030911006, 'nu': 0.5}. Best is trial 199 with value: 0.3592098145876718.
[I 2024-12-04 19:53:05,426] Trial 404 finished with value: 0.35921116031335354 and parameters: {'kernel_type': 'Matern', 'length_scale': 2.534641145249384, 'noise_level': 0.013372478961921114, 'constant_value': 1.5730165788972608, 'nu': 0.5}. Best is trial 199 with value: 0.3592098145876718.
[I 2024-12-04 19:53:07,192] Trial 405 finished with value: 0.41956631365195984 and parameters: {'kernel_type': 'Matern', 'length_scale': 26.729247915562777, 'noise_level': 0.4807745312744823, 'constant_value': 2355.1565449715795, 'nu': 2.5}. Best is trial 199 with value: 0.3592098145876718.
