[I 2024-12-03 18:41:38,719] A new study created in RDB with name: Vc_svr
[I 2024-12-03 18:41:42,248] Trial 19 finished with value: 0.48524455667403926 and parameters: {'kernel': 'sigmoid', 'C': 2.931305760774639, 'gamma': 0.001648753071827204, 'epsilon': 0.6938136473277846}. Best is trial 6 with value: 0.19590088082077828.
[I 2024-12-03 18:41:42,330] Trial 20 finished with value: 0.46038670215737265 and parameters: {'kernel': 'linear', 'C': 0.0012918093973981505, 'gamma': 0.0010637758929611149, 'epsilon': 0.24353470360881221}. Best is trial 6 with value: 0.19590088082077828.
/zhome/b1/0/88900/miniconda3/envs/critprops/lib/python3.9/site-packages/optuna/_experimental.py:31: ExperimentalWarning: Argument ``multivariate`` is an experimental feature. The interface can change in the future.
  warnings.warn(
/zhome/b1/0/88900/miniconda3/envs/critprops/lib/python3.9/site-packages/optuna/_experimental.py:31: ExperimentalWarning: Argument ``constant_liar`` is an experimental feature. The interface can change in the future.
  warnings.warn(
[I 2024-12-03 18:41:42,540] Trial 6 finished with value: 0.19590088082077828 and parameters: {'kernel': 'linear', 'C': 1.8287804154919733, 'gamma': 0.037164069867295375, 'epsilon': 0.19815448981679962}. Best is trial 6 with value: 0.19590088082077828.
/zhome/b1/0/88900/miniconda3/envs/critprops/lib/python3.9/site-packages/optuna/_experimental.py:31: ExperimentalWarning: Argument ``multivariate`` is an experimental feature. The interface can change in the future.
  warnings.warn(
/zhome/b1/0/88900/miniconda3/envs/critprops/lib/python3.9/site-packages/optuna/_experimental.py:31: ExperimentalWarning: Argument ``constant_liar`` is an experimental feature. The interface can change in the future.
  warnings.warn(
[I 2024-12-03 18:41:42,684] Trial 4 finished with value: 0.914866357697968 and parameters: {'kernel': 'sigmoid', 'C': 0.06905351895903408, 'gamma': 0.0032153282908014024, 'epsilon': 0.04748711201441436}. Best is trial 6 with value: 0.19590088082077828.
[I 2024-12-03 18:41:42,956] Trial 9 finished with value: 0.34401131042821465 and parameters: {'kernel': 'linear', 'C': 0.0076361057817921334, 'gamma': 0.009894200637909665, 'epsilon': 0.043433110296347}. Best is trial 6 with value: 0.19590088082077828.
[I 2024-12-03 18:41:43,038] Trial 27 finished with value: 0.4085040236666768 and parameters: {'kernel': 'poly', 'C': 27.564219765341086, 'gamma': 0.018880931631990693, 'epsilon': 0.3794836453148384}. Best is trial 6 with value: 0.19590088082077828.
/zhome/b1/0/88900/miniconda3/envs/critprops/lib/python3.9/site-packages/optuna/_experimental.py:31: ExperimentalWarning: Argument ``multivariate`` is an experimental feature. The interface can change in the future.
  warnings.warn(
/zhome/b1/0/88900/miniconda3/envs/critprops/lib/python3.9/site-packages/optuna/_experimental.py:31: ExperimentalWarning: Argument ``constant_liar`` is an experimental feature. The interface can change in the future.
  warnings.warn(
/zhome/b1/0/88900/miniconda3/envs/critprops/lib/python3.9/site-packages/optuna/_experimental.py:31: ExperimentalWarning: Argument ``multivariate`` is an experimental feature. The interface can change in the future.
  warnings.warn(
/zhome/b1/0/88900/miniconda3/envs/critprops/lib/python3.9/site-packages/optuna/_experimental.py:31: ExperimentalWarning: Argument ``constant_liar`` is an experimental feature. The interface can change in the future.
  warnings.warn(
[I 2024-12-03 18:41:43,583] Trial 11 finished with value: 97.8662954876377 and parameters: {'kernel': 'sigmoid', 'C': 3.6604778710862096, 'gamma': 0.8982989437852776, 'epsilon': 0.001439105619962646}. Best is trial 6 with value: 0.19590088082077828.
[I 2024-12-03 18:41:43,588] Trial 29 finished with value: 1.3463448074407052 and parameters: {'kernel': 'sigmoid', 'C': 0.011896609282569037, 'gamma': 0.000432327445175733, 'epsilon': 0.009385091330018821}. Best is trial 6 with value: 0.19590088082077828.
[I 2024-12-03 18:41:43,606] Trial 2 finished with value: 1.3570793031240436 and parameters: {'kernel': 'rbf', 'C': 0.002303281854506383, 'gamma': 0.00030229523823436513, 'epsilon': 0.02898123623611658}. Best is trial 6 with value: 0.19590088082077828.
[I 2024-12-03 18:41:43,624] Trial 23 finished with value: 1.1605838230179322 and parameters: {'kernel': 'sigmoid', 'C': 0.013757817290618557, 'gamma': 0.008784201419812378, 'epsilon': 0.020593330881566282}. Best is trial 6 with value: 0.19590088082077828.
[I 2024-12-03 18:41:43,880] Trial 3 finished with value: 0.3246854796207324 and parameters: {'kernel': 'rbf', 'C': 6.1852566226753, 'gamma': 0.0005952872235654695, 'epsilon': 0.003983424017303796}. Best is trial 12 with value: 0.17350993573275889.
[I 2024-12-03 18:41:44,424] Trial 12 finished with value: 0.17350993573275889 and parameters: {'kernel': 'linear', 'C': 1.289267518207517, 'gamma': 0.010456955110294519, 'epsilon': 0.15628027781360518}. Best is trial 12 with value: 0.17350993573275889.
/zhome/b1/0/88900/miniconda3/envs/critprops/lib/python3.9/site-packages/optuna/_experimental.py:31: ExperimentalWarning: Argument ``multivariate`` is an experimental feature. The interface can change in the future.
  warnings.warn(
/zhome/b1/0/88900/miniconda3/envs/critprops/lib/python3.9/site-packages/optuna/_experimental.py:31: ExperimentalWarning: Argument ``constant_liar`` is an experimental feature. The interface can change in the future.
  warnings.warn(
[I 2024-12-03 18:41:45,326] Trial 24 finished with value: 4.3773147699045305 and parameters: {'kernel': 'sigmoid', 'C': 0.23102546216489386, 'gamma': 0.0933407620890379, 'epsilon': 0.13156483301182603}. Best is trial 12 with value: 0.17350993573275889.
/zhome/b1/0/88900/miniconda3/envs/critprops/lib/python3.9/site-packages/optuna/_experimental.py:31: ExperimentalWarning: Argument ``multivariate`` is an experimental feature. The interface can change in the future.
  warnings.warn(
/zhome/b1/0/88900/miniconda3/envs/critprops/lib/python3.9/site-packages/optuna/_experimental.py:31: ExperimentalWarning: Argument ``constant_liar`` is an experimental feature. The interface can change in the future.
  warnings.warn(
[I 2024-12-03 18:41:45,557] Trial 18 finished with value: 2.8107599679530426 and parameters: {'kernel': 'sigmoid', 'C': 0.10170235132144091, 'gamma': 0.4644350772051876, 'epsilon': 0.0019858846136026832}. Best is trial 12 with value: 0.17350993573275889.
[I 2024-12-03 18:41:45,597] Trial 7 finished with value: 1.3555505879147964 and parameters: {'kernel': 'sigmoid', 'C': 0.0012943619795352556, 'gamma': 0.5795349629867856, 'epsilon': 0.01372536356294014}. Best is trial 12 with value: 0.17350993573275889.
[I 2024-12-03 18:41:45,603] Trial 26 finished with value: 455.9639624940725 and parameters: {'kernel': 'sigmoid', 'C': 28.867953903687816, 'gamma': 0.03833335215586797, 'epsilon': 0.007596447833549948}. Best is trial 12 with value: 0.17350993573275889.
/zhome/b1/0/88900/miniconda3/envs/critprops/lib/python3.9/site-packages/optuna/_experimental.py:31: ExperimentalWarning: Argument ``multivariate`` is an experimental feature. The interface can change in the future.
  warnings.warn(
/zhome/b1/0/88900/miniconda3/envs/critprops/lib/python3.9/site-packages/optuna/_experimental.py:31: ExperimentalWarning: Argument ``constant_liar`` is an experimental feature. The interface can change in the future.
  warnings.warn(
/zhome/b1/0/88900/miniconda3/envs/critprops/lib/python3.9/site-packages/optuna/_experimental.py:31: ExperimentalWarning: Argument ``multivariate`` is an experimental feature. The interface can change in the future.
  warnings.warn(
/zhome/b1/0/88900/miniconda3/envs/critprops/lib/python3.9/site-packages/optuna/_experimental.py:31: ExperimentalWarning: Argument ``constant_liar`` is an experimental feature. The interface can change in the future.
  warnings.warn(
[I 2024-12-03 18:41:45,927] Trial 30 finished with value: 0.5539501322042282 and parameters: {'kernel': 'poly', 'C': 14.921531573508956, 'gamma': 0.20163309267615717, 'epsilon': 0.4745898315305805}. Best is trial 12 with value: 0.17350993573275889.
[I 2024-12-03 18:41:45,939] Trial 8 finished with value: 259.4166510681955 and parameters: {'kernel': 'sigmoid', 'C': 17.244404382371854, 'gamma': 0.07143134749023039, 'epsilon': 0.5503699365970984}. Best is trial 12 with value: 0.17350993573275889.
[I 2024-12-03 18:41:45,976] Trial 15 finished with value: 0.533908407154129 and parameters: {'kernel': 'linear', 'C': 0.426411094035166, 'gamma': 0.6489089887505185, 'epsilon': 0.9893428992171805}. Best is trial 12 with value: 0.17350993573275889.
/zhome/b1/0/88900/miniconda3/envs/critprops/lib/python3.9/site-packages/optuna/_experimental.py:31: ExperimentalWarning: Argument ``multivariate`` is an experimental feature. The interface can change in the future.
  warnings.warn(
/zhome/b1/0/88900/miniconda3/envs/critprops/lib/python3.9/site-packages/optuna/_experimental.py:31: ExperimentalWarning: Argument ``constant_liar`` is an experimental feature. The interface can change in the future.
  warnings.warn(
[I 2024-12-03 18:41:46,163] Trial 0 finished with value: 0.8382837285052533 and parameters: {'kernel': 'rbf', 'C': 0.44484455763010916, 'gamma': 0.14176632876578182, 'epsilon': 0.0016397258245060158}. Best is trial 12 with value: 0.17350993573275889.
/zhome/b1/0/88900/miniconda3/envs/critprops/lib/python3.9/site-packages/optuna/_experimental.py:31: ExperimentalWarning: Argument ``multivariate`` is an experimental feature. The interface can change in the future.
  warnings.warn(
/zhome/b1/0/88900/miniconda3/envs/critprops/lib/python3.9/site-packages/optuna/_experimental.py:31: ExperimentalWarning: Argument ``constant_liar`` is an experimental feature. The interface can change in the future.
  warnings.warn(
[I 2024-12-03 18:41:46,441] Trial 1 finished with value: 0.3616708543950399 and parameters: {'kernel': 'poly', 'C': 0.016296866464742727, 'gamma': 0.6235805679431532, 'epsilon': 0.1089361885296285}. Best is trial 12 with value: 0.17350993573275889.
/zhome/b1/0/88900/miniconda3/envs/critprops/lib/python3.9/site-packages/optuna/_experimental.py:31: ExperimentalWarning: Argument ``multivariate`` is an experimental feature. The interface can change in the future.
  warnings.warn(
/zhome/b1/0/88900/miniconda3/envs/critprops/lib/python3.9/site-packages/optuna/_experimental.py:31: ExperimentalWarning: Argument ``constant_liar`` is an experimental feature. The interface can change in the future.
  warnings.warn(
[I 2024-12-03 18:41:46,846] Trial 5 finished with value: 0.2845076656505296 and parameters: {'kernel': 'linear', 'C': 0.022851632839942137, 'gamma': 0.033013420364304144, 'epsilon': 0.05127689825627177}. Best is trial 12 with value: 0.17350993573275889.
[I 2024-12-03 18:41:46,882] Trial 31 finished with value: 1.360281996183787 and parameters: {'kernel': 'poly', 'C': 0.24862015000902887, 'gamma': 0.00017758790646130187, 'epsilon': 0.032511369325785064}. Best is trial 12 with value: 0.17350993573275889.
[I 2024-12-03 18:41:47,027] Trial 25 finished with value: 0.18984957770116873 and parameters: {'kernel': 'linear', 'C': 25.931707569609394, 'gamma': 0.002185808292761309, 'epsilon': 0.2358676499911436}. Best is trial 12 with value: 0.17350993573275889.
/zhome/b1/0/88900/miniconda3/envs/critprops/lib/python3.9/site-packages/optuna/_experimental.py:31: ExperimentalWarning: Argument ``multivariate`` is an experimental feature. The interface can change in the future.
  warnings.warn(
/zhome/b1/0/88900/miniconda3/envs/critprops/lib/python3.9/site-packages/optuna/_experimental.py:31: ExperimentalWarning: Argument ``constant_liar`` is an experimental feature. The interface can change in the future.
  warnings.warn(
/zhome/b1/0/88900/miniconda3/envs/critprops/lib/python3.9/site-packages/optuna/_experimental.py:31: ExperimentalWarning: Argument ``multivariate`` is an experimental feature. The interface can change in the future.
  warnings.warn(
/zhome/b1/0/88900/miniconda3/envs/critprops/lib/python3.9/site-packages/optuna/_experimental.py:31: ExperimentalWarning: Argument ``constant_liar`` is an experimental feature. The interface can change in the future.
  warnings.warn(
[I 2024-12-03 18:41:47,293] Trial 28 finished with value: 0.26865737600797307 and parameters: {'kernel': 'linear', 'C': 0.7113239927085941, 'gamma': 0.014717789603025692, 'epsilon': 0.3691051217616994}. Best is trial 12 with value: 0.17350993573275889.
/zhome/b1/0/88900/miniconda3/envs/critprops/lib/python3.9/site-packages/optuna/_experimental.py:31: ExperimentalWarning: Argument ``multivariate`` is an experimental feature. The interface can change in the future.
  warnings.warn(
/zhome/b1/0/88900/miniconda3/envs/critprops/lib/python3.9/site-packages/optuna/_experimental.py:31: ExperimentalWarning: Argument ``constant_liar`` is an experimental feature. The interface can change in the future.
  warnings.warn(
[I 2024-12-03 18:41:47,586] Trial 17 finished with value: 1.3492778185994596 and parameters: {'kernel': 'poly', 'C': 7.957602073949482, 'gamma': 0.00020557197593532256, 'epsilon': 0.2265096015798775}. Best is trial 12 with value: 0.17350993573275889.
[I 2024-12-03 18:41:47,726] Trial 14 finished with value: 0.3138921337447172 and parameters: {'kernel': 'linear', 'C': 0.013354389084438048, 'gamma': 0.7303713906248537, 'epsilon': 0.019145766496151795}. Best is trial 12 with value: 0.17350993573275889.
[I 2024-12-03 18:41:48,800] Trial 16 finished with value: 0.26807563839391063 and parameters: {'kernel': 'linear', 'C': 88.79784330894329, 'gamma': 0.001192658549239523, 'epsilon': 0.393766358249041}. Best is trial 13 with value: 0.1360230006006195.
[I 2024-12-03 18:41:48,803] Trial 13 finished with value: 0.1360230006006195 and parameters: {'kernel': 'linear', 'C': 8.138627534206304, 'gamma': 0.10539371105597443, 'epsilon': 0.03536822356531949}. Best is trial 13 with value: 0.1360230006006195.
/zhome/b1/0/88900/miniconda3/envs/critprops/lib/python3.9/site-packages/optuna/_experimental.py:31: ExperimentalWarning: Argument ``multivariate`` is an experimental feature. The interface can change in the future.
  warnings.warn(
/zhome/b1/0/88900/miniconda3/envs/critprops/lib/python3.9/site-packages/optuna/_experimental.py:31: ExperimentalWarning: Argument ``constant_liar`` is an experimental feature. The interface can change in the future.
  warnings.warn(
/zhome/b1/0/88900/miniconda3/envs/critprops/lib/python3.9/site-packages/optuna/_experimental.py:31: ExperimentalWarning: Argument ``multivariate`` is an experimental feature. The interface can change in the future.
  warnings.warn(
/zhome/b1/0/88900/miniconda3/envs/critprops/lib/python3.9/site-packages/optuna/_experimental.py:31: ExperimentalWarning: Argument ``constant_liar`` is an experimental feature. The interface can change in the future.
  warnings.warn(
[I 2024-12-03 18:41:49,309] Trial 34 finished with value: 0.21729366210520434 and parameters: {'kernel': 'linear', 'C': 0.8173674875443453, 'gamma': 0.010129944541742195, 'epsilon': 0.23132437814530682}. Best is trial 13 with value: 0.1360230006006195.
/zhome/b1/0/88900/miniconda3/envs/critprops/lib/python3.9/site-packages/optuna/_experimental.py:31: ExperimentalWarning: Argument ``multivariate`` is an experimental feature. The interface can change in the future.
  warnings.warn(
/zhome/b1/0/88900/miniconda3/envs/critprops/lib/python3.9/site-packages/optuna/_experimental.py:31: ExperimentalWarning: Argument ``constant_liar`` is an experimental feature. The interface can change in the future.
  warnings.warn(
[I 2024-12-03 18:41:49,877] Trial 22 finished with value: 0.138153765737901 and parameters: {'kernel': 'linear', 'C': 5.538304745308678, 'gamma': 0.0038935082363254483, 'epsilon': 0.01694753908262581}. Best is trial 13 with value: 0.1360230006006195.
/zhome/b1/0/88900/miniconda3/envs/critprops/lib/python3.9/site-packages/optuna/_experimental.py:31: ExperimentalWarning: Argument ``multivariate`` is an experimental feature. The interface can change in the future.
  warnings.warn(
/zhome/b1/0/88900/miniconda3/envs/critprops/lib/python3.9/site-packages/optuna/_experimental.py:31: ExperimentalWarning: Argument ``constant_liar`` is an experimental feature. The interface can change in the future.
  warnings.warn(
[I 2024-12-03 18:41:50,028] Trial 32 finished with value: 0.9002823476078721 and parameters: {'kernel': 'poly', 'C': 0.4519281247206002, 'gamma': 0.012894554365649048, 'epsilon': 0.03149923302512194}. Best is trial 13 with value: 0.1360230006006195.
[I 2024-12-03 18:41:50,807] Trial 10 finished with value: 0.13794622870642667 and parameters: {'kernel': 'linear', 'C': 4.868941256408885, 'gamma': 0.5511217796490906, 'epsilon': 0.013318980123495906}. Best is trial 13 with value: 0.1360230006006195.
[I 2024-12-03 18:41:51,063] Trial 37 finished with value: 0.19551937019644233 and parameters: {'kernel': 'rbf', 'C': 8.979318548679956, 'gamma': 0.004307659268704665, 'epsilon': 0.0516665213342445}. Best is trial 13 with value: 0.1360230006006195.
/zhome/b1/0/88900/miniconda3/envs/critprops/lib/python3.9/site-packages/optuna/_experimental.py:31: ExperimentalWarning: Argument ``multivariate`` is an experimental feature. The interface can change in the future.
  warnings.warn(
/zhome/b1/0/88900/miniconda3/envs/critprops/lib/python3.9/site-packages/optuna/_experimental.py:31: ExperimentalWarning: Argument ``constant_liar`` is an experimental feature. The interface can change in the future.
  warnings.warn(
[I 2024-12-03 18:41:51,665] Trial 42 finished with value: 0.1682760535481372 and parameters: {'kernel': 'linear', 'C': 12.547783958732296, 'gamma': 0.008836721652840392, 'epsilon': 0.1882044981884581}. Best is trial 13 with value: 0.1360230006006195.
/zhome/b1/0/88900/miniconda3/envs/critprops/lib/python3.9/site-packages/optuna/_experimental.py:31: ExperimentalWarning: Argument ``multivariate`` is an experimental feature. The interface can change in the future.
  warnings.warn(
/zhome/b1/0/88900/miniconda3/envs/critprops/lib/python3.9/site-packages/optuna/_experimental.py:31: ExperimentalWarning: Argument ``constant_liar`` is an experimental feature. The interface can change in the future.
  warnings.warn(
[I 2024-12-03 18:41:51,986] Trial 36 finished with value: 0.1376600020428195 and parameters: {'kernel': 'linear', 'C': 5.299178939630037, 'gamma': 0.01368860194012169, 'epsilon': 0.018343773554408374}. Best is trial 13 with value: 0.1360230006006195.
[I 2024-12-03 18:41:52,268] Trial 39 finished with value: 0.13762431498899227 and parameters: {'kernel': 'linear', 'C': 3.7218819443755145, 'gamma': 0.001339618776990411, 'epsilon': 0.0191134538591658}. Best is trial 13 with value: 0.1360230006006195.
[I 2024-12-03 18:41:52,567] Trial 40 finished with value: 0.13748340058507302 and parameters: {'kernel': 'linear', 'C': 3.103404594525157, 'gamma': 0.3117964027220805, 'epsilon': 0.019870467421190315}. Best is trial 13 with value: 0.1360230006006195.
[I 2024-12-03 18:41:52,569] Trial 48 finished with value: 0.8535116429424 and parameters: {'kernel': 'rbf', 'C': 12.12855841113988, 'gamma': 0.7992815588907577, 'epsilon': 0.008492133691430965}. Best is trial 13 with value: 0.1360230006006195.
[I 2024-12-03 18:41:52,574] Trial 33 finished with value: 0.3343730977444075 and parameters: {'kernel': 'sigmoid', 'C': 84.56843306061928, 'gamma': 0.00010751919071094157, 'epsilon': 0.0014748058405067222}. Best is trial 13 with value: 0.1360230006006195.
[I 2024-12-03 18:41:52,579] Trial 47 finished with value: 0.1937262424877475 and parameters: {'kernel': 'linear', 'C': 0.1555083130100726, 'gamma': 0.003878057531152025, 'epsilon': 0.0014524750263459826}. Best is trial 13 with value: 0.1360230006006195.
/zhome/b1/0/88900/miniconda3/envs/critprops/lib/python3.9/site-packages/optuna/_experimental.py:31: ExperimentalWarning: Argument ``multivariate`` is an experimental feature. The interface can change in the future.
  warnings.warn(
/zhome/b1/0/88900/miniconda3/envs/critprops/lib/python3.9/site-packages/optuna/_experimental.py:31: ExperimentalWarning: Argument ``constant_liar`` is an experimental feature. The interface can change in the future.
  warnings.warn(
[I 2024-12-03 18:41:53,592] Trial 52 finished with value: 0.6766407589013763 and parameters: {'kernel': 'rbf', 'C': 1.7058104097543623, 'gamma': 0.17413276208798675, 'epsilon': 0.004550243251725008}. Best is trial 13 with value: 0.1360230006006195.
[I 2024-12-03 18:41:54,659] Trial 51 finished with value: 0.14842207128463863 and parameters: {'kernel': 'linear', 'C': 0.6694209847811267, 'gamma': 0.07197434148814008, 'epsilon': 0.004820309191182209}. Best is trial 13 with value: 0.1360230006006195.
[I 2024-12-03 18:41:54,993] Trial 38 finished with value: 0.13754771915642533 and parameters: {'kernel': 'linear', 'C': 18.03621393654089, 'gamma': 0.002121958164689047, 'epsilon': 0.01869969297764572}. Best is trial 13 with value: 0.1360230006006195.
[I 2024-12-03 18:41:55,194] Trial 45 finished with value: 0.14168246149425395 and parameters: {'kernel': 'linear', 'C': 1.3902399895162862, 'gamma': 0.5731227040399021, 'epsilon': 0.06039643963575195}. Best is trial 13 with value: 0.1360230006006195.
[I 2024-12-03 18:41:55,290] Trial 58 finished with value: 0.9700441479186008 and parameters: {'kernel': 'rbf', 'C': 2.1546187323262114, 'gamma': 0.8228032902716438, 'epsilon': 0.10607810314443386}. Best is trial 13 with value: 0.1360230006006195.
[I 2024-12-03 18:41:55,736] Trial 50 finished with value: 0.15984541577540162 and parameters: {'kernel': 'linear', 'C': 0.3705540525819465, 'gamma': 0.003838502359171448, 'epsilon': 0.017447991192116024}. Best is trial 13 with value: 0.1360230006006195.
[I 2024-12-03 18:41:55,918] Trial 56 finished with value: 0.1615005953452627 and parameters: {'kernel': 'linear', 'C': 0.347828833447048, 'gamma': 0.0004930001722673723, 'epsilon': 0.04655359140086853}. Best is trial 13 with value: 0.1360230006006195.
