[I 2024-12-04 12:17:18,652] Trial 1500 finished with value: 0.5159457526094403 and parameters: {'n_estimators': 176, 'max_depth': 14, 'min_samples_split': 5, 'min_samples_leaf': 1, 'max_features': None, 'bootstrap': True, 'criterion': 'absolute_error'}. Best is trial 744 with value: 0.5032383725751689.
[I 2024-12-04 12:17:19,343] Trial 1429 finished with value: 0.5227336584110022 and parameters: {'n_estimators': 896, 'max_depth': 33, 'min_samples_split': 2, 'min_samples_leaf': 1, 'max_features': None, 'bootstrap': True, 'criterion': 'absolute_error'}. Best is trial 744 with value: 0.5032383725751689.
[I 2024-12-04 12:17:19,993] Trial 1503 finished with value: 0.5129018301137213 and parameters: {'n_estimators': 288, 'max_depth': 13, 'min_samples_split': 4, 'min_samples_leaf': 1, 'max_features': None, 'bootstrap': True, 'criterion': 'absolute_error'}. Best is trial 744 with value: 0.5032383725751689.
[I 2024-12-04 12:17:20,065] Trial 1522 finished with value: 0.514641080745442 and parameters: {'n_estimators': 110, 'max_depth': 8, 'min_samples_split': 5, 'min_samples_leaf': 1, 'max_features': None, 'bootstrap': True, 'criterion': 'absolute_error'}. Best is trial 744 with value: 0.5032383725751689.
[I 2024-12-04 12:17:20,137] Trial 1521 finished with value: 0.7473288011345393 and parameters: {'n_estimators': 995, 'max_depth': 37, 'min_samples_split': 5, 'min_samples_leaf': 1, 'max_features': 'log2', 'bootstrap': False, 'criterion': 'squared_error'}. Best is trial 744 with value: 0.5032383725751689.
[I 2024-12-04 12:17:20,232] Trial 1518 finished with value: 0.5559041651988069 and parameters: {'n_estimators': 216, 'max_depth': 12, 'min_samples_split': 4, 'min_samples_leaf': 2, 'max_features': None, 'bootstrap': True, 'criterion': 'absolute_error'}. Best is trial 744 with value: 0.5032383725751689.
[I 2024-12-04 12:17:20,233] Trial 1514 finished with value: 0.5163278042057801 and parameters: {'n_estimators': 269, 'max_depth': 15, 'min_samples_split': 6, 'min_samples_leaf': 1, 'max_features': None, 'bootstrap': True, 'criterion': 'absolute_error'}. Best is trial 744 with value: 0.5032383725751689.
[I 2024-12-04 12:17:20,319] Trial 1525 finished with value: 1.2117321727646786 and parameters: {'n_estimators': 844, 'max_depth': 22, 'min_samples_split': 2, 'min_samples_leaf': 5, 'max_features': 'log2', 'bootstrap': False, 'criterion': 'squared_error'}. Best is trial 744 with value: 0.5032383725751689.
[I 2024-12-04 12:17:20,464] Trial 1526 finished with value: 0.9878815587301473 and parameters: {'n_estimators': 121, 'max_depth': 22, 'min_samples_split': 4, 'min_samples_leaf': 1, 'max_features': 'log2', 'bootstrap': True, 'criterion': 'absolute_error'}. Best is trial 744 with value: 0.5032383725751689.
[I 2024-12-04 12:17:20,467] Trial 1509 finished with value: 0.5145465082407136 and parameters: {'n_estimators': 272, 'max_depth': 15, 'min_samples_split': 4, 'min_samples_leaf': 1, 'max_features': None, 'bootstrap': True, 'criterion': 'absolute_error'}. Best is trial 744 with value: 0.5032383725751689.
[I 2024-12-04 12:17:26,288] Trial 1488 finished with value: 0.7041162700598385 and parameters: {'n_estimators': 407, 'max_depth': 16, 'min_samples_split': 37, 'min_samples_leaf': 1, 'max_features': None, 'bootstrap': False, 'criterion': 'absolute_error'}. Best is trial 744 with value: 0.5032383725751689.
[I 2024-12-04 12:17:28,259] Trial 1536 finished with value: 1.303617215856483 and parameters: {'n_estimators': 327, 'max_depth': 37, 'min_samples_split': 3, 'min_samples_leaf': 7, 'max_features': 'sqrt', 'bootstrap': True, 'criterion': 'absolute_error'}. Best is trial 744 with value: 0.5032383725751689.
[I 2024-12-04 12:17:28,261] Trial 1524 finished with value: 0.5108187449878576 and parameters: {'n_estimators': 103, 'max_depth': 20, 'min_samples_split': 4, 'min_samples_leaf': 1, 'max_features': None, 'bootstrap': True, 'criterion': 'absolute_error'}. Best is trial 744 with value: 0.5032383725751689.
[I 2024-12-04 12:17:28,301] Trial 1531 finished with value: 0.5101722944451027 and parameters: {'n_estimators': 111, 'max_depth': 15, 'min_samples_split': 5, 'min_samples_leaf': 1, 'max_features': None, 'bootstrap': True, 'criterion': 'absolute_error'}. Best is trial 744 with value: 0.5032383725751689.
[I 2024-12-04 12:17:28,428] Trial 1515 finished with value: 0.5123029272407041 and parameters: {'n_estimators': 127, 'max_depth': 17, 'min_samples_split': 4, 'min_samples_leaf': 1, 'max_features': None, 'bootstrap': True, 'criterion': 'absolute_error'}. Best is trial 744 with value: 0.5032383725751689.
[I 2024-12-04 12:17:28,446] Trial 1529 finished with value: 0.509063264786846 and parameters: {'n_estimators': 104, 'max_depth': 15, 'min_samples_split': 5, 'min_samples_leaf': 1, 'max_features': None, 'bootstrap': True, 'criterion': 'absolute_error'}. Best is trial 744 with value: 0.5032383725751689.
[I 2024-12-04 12:17:30,902] Trial 1534 finished with value: 0.5588928366419657 and parameters: {'n_estimators': 123, 'max_depth': 13, 'min_samples_split': 8, 'min_samples_leaf': 2, 'max_features': None, 'bootstrap': True, 'criterion': 'absolute_error'}. Best is trial 744 with value: 0.5032383725751689.
[I 2024-12-04 12:17:31,530] Trial 1530 finished with value: 0.5051314382050389 and parameters: {'n_estimators': 112, 'max_depth': 16, 'min_samples_split': 4, 'min_samples_leaf': 1, 'max_features': None, 'bootstrap': True, 'criterion': 'absolute_error'}. Best is trial 744 with value: 0.5032383725751689.
[I 2024-12-04 12:17:31,762] Trial 1527 finished with value: 0.6187931639894596 and parameters: {'n_estimators': 111, 'max_depth': 16, 'min_samples_split': 4, 'min_samples_leaf': 2, 'max_features': None, 'bootstrap': False, 'criterion': 'absolute_error'}. Best is trial 744 with value: 0.5032383725751689.
[I 2024-12-04 12:17:33,548] Trial 1537 finished with value: 0.5561184521821333 and parameters: {'n_estimators': 107, 'max_depth': 14, 'min_samples_split': 2, 'min_samples_leaf': 2, 'max_features': None, 'bootstrap': True, 'criterion': 'absolute_error'}. Best is trial 744 with value: 0.5032383725751689.
[I 2024-12-04 12:17:33,553] Trial 1540 finished with value: 1.3018676714289836 and parameters: {'n_estimators': 184, 'max_depth': 13, 'min_samples_split': 11, 'min_samples_leaf': 3, 'max_features': 'log2', 'bootstrap': False, 'criterion': 'absolute_error'}. Best is trial 744 with value: 0.5032383725751689.
[I 2024-12-04 12:17:34,698] Trial 1520 finished with value: 0.6588508925029657 and parameters: {'n_estimators': 993, 'max_depth': 8, 'min_samples_split': 21, 'min_samples_leaf': 6, 'max_features': None, 'bootstrap': True, 'criterion': 'absolute_error'}. Best is trial 744 with value: 0.5032383725751689.
[I 2024-12-04 12:17:35,571] Trial 1549 finished with value: 1.2427427482125295 and parameters: {'n_estimators': 419, 'max_depth': 14, 'min_samples_split': 2, 'min_samples_leaf': 15, 'max_features': 'sqrt', 'bootstrap': True, 'criterion': 'squared_error'}. Best is trial 744 with value: 0.5032383725751689.
[I 2024-12-04 12:17:35,884] Trial 1538 finished with value: 0.5179706228709204 and parameters: {'n_estimators': 101, 'max_depth': 13, 'min_samples_split': 7, 'min_samples_leaf': 1, 'max_features': None, 'bootstrap': True, 'criterion': 'absolute_error'}. Best is trial 744 with value: 0.5032383725751689.
[I 2024-12-04 12:17:37,177] Trial 1533 finished with value: 0.5193421979380768 and parameters: {'n_estimators': 102, 'max_depth': 13, 'min_samples_split': 7, 'min_samples_leaf': 1, 'max_features': None, 'bootstrap': True, 'criterion': 'absolute_error'}. Best is trial 744 with value: 0.5032383725751689.
[I 2024-12-04 12:17:38,263] Trial 1543 finished with value: 0.9906433786493674 and parameters: {'n_estimators': 198, 'max_depth': 17, 'min_samples_split': 4, 'min_samples_leaf': 2, 'max_features': 'sqrt', 'bootstrap': True, 'criterion': 'absolute_error'}. Best is trial 744 with value: 0.5032383725751689.
[I 2024-12-04 12:17:38,352] Trial 1523 finished with value: 0.5169719587731445 and parameters: {'n_estimators': 240, 'max_depth': 15, 'min_samples_split': 5, 'min_samples_leaf': 1, 'max_features': None, 'bootstrap': True, 'criterion': 'absolute_error'}. Best is trial 744 with value: 0.5032383725751689.
[I 2024-12-04 12:17:41,135] Trial 1545 finished with value: 0.5151066226572545 and parameters: {'n_estimators': 103, 'max_depth': 17, 'min_samples_split': 2, 'min_samples_leaf': 1, 'max_features': None, 'bootstrap': True, 'criterion': 'absolute_error'}. Best is trial 744 with value: 0.5032383725751689.
[I 2024-12-04 12:17:42,630] Trial 1547 finished with value: 1.017385884655549 and parameters: {'n_estimators': 103, 'max_depth': 18, 'min_samples_split': 4, 'min_samples_leaf': 2, 'max_features': 'sqrt', 'bootstrap': True, 'criterion': 'absolute_error'}. Best is trial 744 with value: 0.5032383725751689.
[I 2024-12-04 12:17:43,229] Trial 1532 finished with value: 0.5151921006139825 and parameters: {'n_estimators': 268, 'max_depth': 22, 'min_samples_split': 2, 'min_samples_leaf': 1, 'max_features': None, 'bootstrap': True, 'criterion': 'absolute_error'}. Best is trial 744 with value: 0.5032383725751689.
[I 2024-12-04 12:17:43,318] Trial 1528 finished with value: 0.5597970230546054 and parameters: {'n_estimators': 240, 'max_depth': 18, 'min_samples_split': 3, 'min_samples_leaf': 2, 'max_features': None, 'bootstrap': True, 'criterion': 'absolute_error'}. Best is trial 744 with value: 0.5032383725751689.
[I 2024-12-04 12:17:43,363] Trial 1550 finished with value: 0.5646978487023134 and parameters: {'n_estimators': 114, 'max_depth': 6, 'min_samples_split': 2, 'min_samples_leaf': 2, 'max_features': None, 'bootstrap': True, 'criterion': 'absolute_error'}. Best is trial 744 with value: 0.5032383725751689.
[I 2024-12-04 12:17:44,332] Trial 1535 finished with value: 0.5604801728293783 and parameters: {'n_estimators': 297, 'max_depth': 17, 'min_samples_split': 2, 'min_samples_leaf': 2, 'max_features': None, 'bootstrap': True, 'criterion': 'absolute_error'}. Best is trial 744 with value: 0.5032383725751689.
[I 2024-12-04 12:17:44,342] Trial 1539 finished with value: 0.555487438119249 and parameters: {'n_estimators': 333, 'max_depth': 22, 'min_samples_split': 4, 'min_samples_leaf': 2, 'max_features': None, 'bootstrap': True, 'criterion': 'absolute_error'}. Best is trial 744 with value: 0.5032383725751689.
[I 2024-12-04 12:17:44,391] Trial 1546 finished with value: 0.516166727431851 and parameters: {'n_estimators': 113, 'max_depth': 12, 'min_samples_split': 3, 'min_samples_leaf': 1, 'max_features': None, 'bootstrap': True, 'criterion': 'absolute_error'}. Best is trial 744 with value: 0.5032383725751689.
[I 2024-12-04 12:17:45,201] Trial 1548 finished with value: 1.0333678670823983 and parameters: {'n_estimators': 238, 'max_depth': 30, 'min_samples_split': 2, 'min_samples_leaf': 3, 'max_features': 'sqrt', 'bootstrap': False, 'criterion': 'absolute_error'}. Best is trial 744 with value: 0.5032383725751689.
[I 2024-12-04 12:17:46,414] Trial 1551 finished with value: 0.5138863191747944 and parameters: {'n_estimators': 116, 'max_depth': 14, 'min_samples_split': 3, 'min_samples_leaf': 1, 'max_features': None, 'bootstrap': True, 'criterion': 'absolute_error'}. Best is trial 744 with value: 0.5032383725751689.
[I 2024-12-04 12:17:46,414] Trial 1557 finished with value: 1.2610920780450525 and parameters: {'n_estimators': 469, 'max_depth': 24, 'min_samples_split': 2, 'min_samples_leaf': 5, 'max_features': 'sqrt', 'bootstrap': True, 'criterion': 'absolute_error'}. Best is trial 744 with value: 0.5032383725751689.
[I 2024-12-04 12:17:47,873] Trial 1553 finished with value: 0.5209526101270945 and parameters: {'n_estimators': 181, 'max_depth': 11, 'min_samples_split': 3, 'min_samples_leaf': 1, 'max_features': None, 'bootstrap': True, 'criterion': 'absolute_error'}. Best is trial 744 with value: 0.5032383725751689.
[I 2024-12-04 12:17:49,010] Trial 1556 finished with value: 0.5559491680928009 and parameters: {'n_estimators': 110, 'max_depth': 23, 'min_samples_split': 5, 'min_samples_leaf': 2, 'max_features': None, 'bootstrap': True, 'criterion': 'absolute_error'}. Best is trial 744 with value: 0.5032383725751689.
[I 2024-12-04 12:17:50,413] Trial 1558 finished with value: 0.5080572474135568 and parameters: {'n_estimators': 111, 'max_depth': 14, 'min_samples_split': 5, 'min_samples_leaf': 1, 'max_features': None, 'bootstrap': True, 'criterion': 'absolute_error'}. Best is trial 744 with value: 0.5032383725751689.
[I 2024-12-04 12:17:50,781] Trial 1563 finished with value: 1.2231568391832628 and parameters: {'n_estimators': 753, 'max_depth': 42, 'min_samples_split': 10, 'min_samples_leaf': 4, 'max_features': 'log2', 'bootstrap': True, 'criterion': 'squared_error'}. Best is trial 744 with value: 0.5032383725751689.
[I 2024-12-04 12:17:50,867] Trial 1542 finished with value: 0.5250583321873865 and parameters: {'n_estimators': 208, 'max_depth': 10, 'min_samples_split': 3, 'min_samples_leaf': 1, 'max_features': None, 'bootstrap': True, 'criterion': 'absolute_error'}. Best is trial 744 with value: 0.5032383725751689.
[I 2024-12-04 12:17:50,933] Trial 1560 finished with value: 1.3338084928104563 and parameters: {'n_estimators': 473, 'max_depth': 38, 'min_samples_split': 40, 'min_samples_leaf': 4, 'max_features': 'log2', 'bootstrap': True, 'criterion': 'absolute_error'}. Best is trial 744 with value: 0.5032383725751689.
[I 2024-12-04 12:17:50,937] Trial 1541 finished with value: 0.5208695939091353 and parameters: {'n_estimators': 270, 'max_depth': 22, 'min_samples_split': 7, 'min_samples_leaf': 1, 'max_features': None, 'bootstrap': True, 'criterion': 'absolute_error'}. Best is trial 744 with value: 0.5032383725751689.
[I 2024-12-04 12:17:51,226] Trial 1554 finished with value: 0.5144221062928164 and parameters: {'n_estimators': 102, 'max_depth': 19, 'min_samples_split': 7, 'min_samples_leaf': 1, 'max_features': None, 'bootstrap': True, 'criterion': 'absolute_error'}. Best is trial 744 with value: 0.5032383725751689.
[I 2024-12-04 12:17:51,321] Trial 1544 finished with value: 0.5149947371065284 and parameters: {'n_estimators': 270, 'max_depth': 15, 'min_samples_split': 3, 'min_samples_leaf': 1, 'max_features': None, 'bootstrap': True, 'criterion': 'absolute_error'}. Best is trial 744 with value: 0.5032383725751689.
[I 2024-12-04 12:17:51,550] Trial 1555 finished with value: 0.5123317216415711 and parameters: {'n_estimators': 125, 'max_depth': 17, 'min_samples_split': 4, 'min_samples_leaf': 1, 'max_features': None, 'bootstrap': True, 'criterion': 'absolute_error'}. Best is trial 744 with value: 0.5032383725751689.
[I 2024-12-04 12:17:52,304] Trial 1552 finished with value: 0.5148989052035744 and parameters: {'n_estimators': 250, 'max_depth': 16, 'min_samples_split': 4, 'min_samples_leaf': 1, 'max_features': None, 'bootstrap': True, 'criterion': 'absolute_error'}. Best is trial 744 with value: 0.5032383725751689.
[I 2024-12-04 12:17:53,421] Trial 1562 finished with value: 1.182992552346457 and parameters: {'n_estimators': 527, 'max_depth': 47, 'min_samples_split': 21, 'min_samples_leaf': 2, 'max_features': 'log2', 'bootstrap': True, 'criterion': 'squared_error'}. Best is trial 744 with value: 0.5032383725751689.
[I 2024-12-04 12:17:54,426] Trial 1572 finished with value: 0.545275392499911 and parameters: {'n_estimators': 162, 'max_depth': 10, 'min_samples_split': 5, 'min_samples_leaf': 2, 'max_features': None, 'bootstrap': True, 'criterion': 'squared_error'}. Best is trial 744 with value: 0.5032383725751689.
[I 2024-12-04 12:17:55,103] Trial 1564 finished with value: 0.8260082425452889 and parameters: {'n_estimators': 311, 'max_depth': 18, 'min_samples_split': 6, 'min_samples_leaf': 1, 'max_features': 'sqrt', 'bootstrap': True, 'criterion': 'absolute_error'}. Best is trial 744 with value: 0.5032383725751689.
[I 2024-12-04 12:17:56,405] Trial 1565 finished with value: 0.5521293265344448 and parameters: {'n_estimators': 110, 'max_depth': 13, 'min_samples_split': 3, 'min_samples_leaf': 2, 'max_features': None, 'bootstrap': True, 'criterion': 'absolute_error'}. Best is trial 744 with value: 0.5032383725751689.
[I 2024-12-04 12:17:56,793] Trial 1578 finished with value: 0.609228071919481 and parameters: {'n_estimators': 126, 'max_depth': 38, 'min_samples_split': 5, 'min_samples_leaf': 5, 'max_features': None, 'bootstrap': True, 'criterion': 'squared_error'}. Best is trial 744 with value: 0.5032383725751689.
[I 2024-12-04 12:17:58,072] Trial 1567 finished with value: 0.5124130658880451 and parameters: {'n_estimators': 100, 'max_depth': 17, 'min_samples_split': 4, 'min_samples_leaf': 1, 'max_features': None, 'bootstrap': True, 'criterion': 'absolute_error'}. Best is trial 744 with value: 0.5032383725751689.
[I 2024-12-04 12:17:58,285] Trial 1569 finished with value: 1.3502347267615677 and parameters: {'n_estimators': 449, 'max_depth': 43, 'min_samples_split': 3, 'min_samples_leaf': 12, 'max_features': 'log2', 'bootstrap': False, 'criterion': 'absolute_error'}. Best is trial 744 with value: 0.5032383725751689.
[I 2024-12-04 12:18:00,444] Trial 1571 finished with value: 0.5153190221938907 and parameters: {'n_estimators': 112, 'max_depth': 22, 'min_samples_split': 3, 'min_samples_leaf': 1, 'max_features': None, 'bootstrap': True, 'criterion': 'absolute_error'}. Best is trial 744 with value: 0.5032383725751689.
[I 2024-12-04 12:18:00,879] Trial 1573 finished with value: 0.51924070272346 and parameters: {'n_estimators': 100, 'max_depth': 16, 'min_samples_split': 7, 'min_samples_leaf': 1, 'max_features': None, 'bootstrap': True, 'criterion': 'absolute_error'}. Best is trial 744 with value: 0.5032383725751689.
[I 2024-12-04 12:18:01,563] Trial 1568 finished with value: 0.5709668606736247 and parameters: {'n_estimators': 121, 'max_depth': 13, 'min_samples_split': 5, 'min_samples_leaf': 1, 'max_features': None, 'bootstrap': False, 'criterion': 'absolute_error'}. Best is trial 744 with value: 0.5032383725751689.
[I 2024-12-04 12:18:01,577] Trial 1566 finished with value: 0.5545884736838508 and parameters: {'n_estimators': 104, 'max_depth': 21, 'min_samples_split': 2, 'min_samples_leaf': 2, 'max_features': None, 'bootstrap': True, 'criterion': 'absolute_error'}. Best is trial 744 with value: 0.5032383725751689.
[I 2024-12-04 12:18:01,668] Trial 1574 finished with value: 0.9632394908796101 and parameters: {'n_estimators': 176, 'max_depth': 8, 'min_samples_split': 6, 'min_samples_leaf': 2, 'max_features': 'sqrt', 'bootstrap': False, 'criterion': 'squared_error'}. Best is trial 744 with value: 0.5032383725751689.
[I 2024-12-04 12:18:01,747] Trial 1561 finished with value: 0.5153777760094704 and parameters: {'n_estimators': 124, 'max_depth': 22, 'min_samples_split': 2, 'min_samples_leaf': 1, 'max_features': None, 'bootstrap': True, 'criterion': 'absolute_error'}. Best is trial 744 with value: 0.5032383725751689.
[I 2024-12-04 12:18:03,065] Trial 1575 finished with value: 0.5174684531109599 and parameters: {'n_estimators': 117, 'max_depth': 12, 'min_samples_split': 3, 'min_samples_leaf': 1, 'max_features': None, 'bootstrap': True, 'criterion': 'absolute_error'}. Best is trial 744 with value: 0.5032383725751689.
[I 2024-12-04 12:18:04,971] Trial 1582 finished with value: 1.3497443331417598 and parameters: {'n_estimators': 288, 'max_depth': 44, 'min_samples_split': 3, 'min_samples_leaf': 6, 'max_features': 'log2', 'bootstrap': True, 'criterion': 'absolute_error'}. Best is trial 744 with value: 0.5032383725751689.
[I 2024-12-04 12:18:04,995] Trial 1580 finished with value: 0.5097318422031798 and parameters: {'n_estimators': 101, 'max_depth': 16, 'min_samples_split': 6, 'min_samples_leaf': 1, 'max_features': None, 'bootstrap': True, 'criterion': 'absolute_error'}. Best is trial 744 with value: 0.5032383725751689.
[I 2024-12-04 12:18:05,801] Trial 1579 finished with value: 0.5142477535338787 and parameters: {'n_estimators': 106, 'max_depth': 15, 'min_samples_split': 4, 'min_samples_leaf': 1, 'max_features': None, 'bootstrap': True, 'criterion': 'absolute_error'}. Best is trial 744 with value: 0.5032383725751689.
[I 2024-12-04 12:18:06,640] Trial 1559 finished with value: 0.5146048690605454 and parameters: {'n_estimators': 281, 'max_depth': 21, 'min_samples_split': 5, 'min_samples_leaf': 1, 'max_features': None, 'bootstrap': True, 'criterion': 'absolute_error'}. Best is trial 744 with value: 0.5032383725751689.
[I 2024-12-04 12:18:07,134] Trial 1584 finished with value: 1.2429736402228124 and parameters: {'n_estimators': 189, 'max_depth': 29, 'min_samples_split': 9, 'min_samples_leaf': 15, 'max_features': 'log2', 'bootstrap': False, 'criterion': 'squared_error'}. Best is trial 744 with value: 0.5032383725751689.
[I 2024-12-04 12:18:07,620] Trial 1589 finished with value: 1.2906644281927355 and parameters: {'n_estimators': 263, 'max_depth': 29, 'min_samples_split': 6, 'min_samples_leaf': 2, 'max_features': 'log2', 'bootstrap': True, 'criterion': 'absolute_error'}. Best is trial 744 with value: 0.5032383725751689.
[I 2024-12-04 12:18:07,635] Trial 1570 finished with value: 0.5199107166764555 and parameters: {'n_estimators': 213, 'max_depth': 19, 'min_samples_split': 3, 'min_samples_leaf': 1, 'max_features': None, 'bootstrap': True, 'criterion': 'absolute_error'}. Best is trial 744 with value: 0.5032383725751689.
[I 2024-12-04 12:18:08,421] Trial 1581 finished with value: 0.7130883846595902 and parameters: {'n_estimators': 697, 'max_depth': 10, 'min_samples_split': 42, 'min_samples_leaf': 9, 'max_features': None, 'bootstrap': True, 'criterion': 'squared_error'}. Best is trial 744 with value: 0.5032383725751689.
[I 2024-12-04 12:18:08,560] Trial 1585 finished with value: 0.5136601739557172 and parameters: {'n_estimators': 107, 'max_depth': 15, 'min_samples_split': 4, 'min_samples_leaf': 1, 'max_features': None, 'bootstrap': True, 'criterion': 'absolute_error'}. Best is trial 744 with value: 0.5032383725751689.
