[I 2024-12-04 12:30:56,663] Trial 2446 finished with value: 0.5520213863830635 and parameters: {'n_estimators': 225, 'max_depth': 14, 'min_samples_split': 4, 'min_samples_leaf': 2, 'max_features': None, 'bootstrap': True, 'criterion': 'absolute_error'}. Best is trial 1749 with value: 0.502720715661024.
[I 2024-12-04 12:30:58,863] Trial 2449 finished with value: 0.5567294091087753 and parameters: {'n_estimators': 288, 'max_depth': 13, 'min_samples_split': 6, 'min_samples_leaf': 2, 'max_features': None, 'bootstrap': True, 'criterion': 'absolute_error'}. Best is trial 1749 with value: 0.502720715661024.
[I 2024-12-04 12:30:58,886] Trial 2455 finished with value: 0.5600892481508476 and parameters: {'n_estimators': 119, 'max_depth': 17, 'min_samples_split': 7, 'min_samples_leaf': 2, 'max_features': None, 'bootstrap': True, 'criterion': 'absolute_error'}. Best is trial 1749 with value: 0.502720715661024.
[I 2024-12-04 12:30:59,113] Trial 2456 finished with value: 0.8724442442824819 and parameters: {'n_estimators': 220, 'max_depth': 16, 'min_samples_split': 3, 'min_samples_leaf': 1, 'max_features': 'sqrt', 'bootstrap': True, 'criterion': 'absolute_error'}. Best is trial 1749 with value: 0.502720715661024.
[I 2024-12-04 12:30:59,130] Trial 2453 finished with value: 0.5051314382050389 and parameters: {'n_estimators': 112, 'max_depth': 16, 'min_samples_split': 4, 'min_samples_leaf': 1, 'max_features': None, 'bootstrap': True, 'criterion': 'absolute_error'}. Best is trial 1749 with value: 0.502720715661024.
[I 2024-12-04 12:31:00,983] Trial 2463 finished with value: 1.3177903549544145 and parameters: {'n_estimators': 818, 'max_depth': 6, 'min_samples_split': 6, 'min_samples_leaf': 11, 'max_features': 'sqrt', 'bootstrap': False, 'criterion': 'absolute_error'}. Best is trial 1749 with value: 0.502720715661024.
[I 2024-12-04 12:31:01,150] Trial 2450 finished with value: 0.5549933422299842 and parameters: {'n_estimators': 281, 'max_depth': 16, 'min_samples_split': 3, 'min_samples_leaf': 2, 'max_features': None, 'bootstrap': True, 'criterion': 'absolute_error'}. Best is trial 1749 with value: 0.502720715661024.
[I 2024-12-04 12:31:01,455] Trial 2459 finished with value: 0.5134484997385901 and parameters: {'n_estimators': 100, 'max_depth': 26, 'min_samples_split': 3, 'min_samples_leaf': 1, 'max_features': None, 'bootstrap': True, 'criterion': 'absolute_error'}. Best is trial 1749 with value: 0.502720715661024.
[I 2024-12-04 12:31:01,765] Trial 2448 finished with value: 0.525066841988926 and parameters: {'n_estimators': 108, 'max_depth': 25, 'min_samples_split': 7, 'min_samples_leaf': 1, 'max_features': None, 'bootstrap': True, 'criterion': 'absolute_error'}. Best is trial 1749 with value: 0.502720715661024.
[I 2024-12-04 12:31:02,448] Trial 2462 finished with value: 0.5080405242222996 and parameters: {'n_estimators': 111, 'max_depth': 18, 'min_samples_split': 5, 'min_samples_leaf': 1, 'max_features': None, 'bootstrap': True, 'criterion': 'absolute_error'}. Best is trial 1749 with value: 0.502720715661024.
[I 2024-12-04 12:31:03,079] Trial 2452 finished with value: 0.5554689762627371 and parameters: {'n_estimators': 152, 'max_depth': 45, 'min_samples_split': 2, 'min_samples_leaf': 1, 'max_features': None, 'bootstrap': False, 'criterion': 'absolute_error'}. Best is trial 1749 with value: 0.502720715661024.
[I 2024-12-04 12:31:04,436] Trial 2469 finished with value: 0.5293699798865832 and parameters: {'n_estimators': 131, 'max_depth': 13, 'min_samples_split': 12, 'min_samples_leaf': 1, 'max_features': None, 'bootstrap': True, 'criterion': 'squared_error'}. Best is trial 1749 with value: 0.502720715661024.
[I 2024-12-04 12:31:04,542] Trial 2467 finished with value: 0.5138935815652554 and parameters: {'n_estimators': 108, 'max_depth': 16, 'min_samples_split': 3, 'min_samples_leaf': 1, 'max_features': None, 'bootstrap': True, 'criterion': 'absolute_error'}. Best is trial 1749 with value: 0.502720715661024.
[I 2024-12-04 12:31:05,716] Trial 2470 finished with value: 0.547526229354334 and parameters: {'n_estimators': 107, 'max_depth': 11, 'min_samples_split': 4, 'min_samples_leaf': 2, 'max_features': None, 'bootstrap': True, 'criterion': 'absolute_error'}. Best is trial 1749 with value: 0.502720715661024.
[I 2024-12-04 12:31:06,774] Trial 2460 finished with value: 0.5121987486846051 and parameters: {'n_estimators': 109, 'max_depth': 14, 'min_samples_split': 3, 'min_samples_leaf': 1, 'max_features': None, 'bootstrap': True, 'criterion': 'absolute_error'}. Best is trial 1749 with value: 0.502720715661024.
[I 2024-12-04 12:31:06,946] Trial 2464 finished with value: 0.5176133910993415 and parameters: {'n_estimators': 112, 'max_depth': 18, 'min_samples_split': 3, 'min_samples_leaf': 1, 'max_features': None, 'bootstrap': True, 'criterion': 'absolute_error'}. Best is trial 1749 with value: 0.502720715661024.
[I 2024-12-04 12:31:07,073] Trial 2445 finished with value: 0.5170876063982381 and parameters: {'n_estimators': 249, 'max_depth': 11, 'min_samples_split': 4, 'min_samples_leaf': 1, 'max_features': None, 'bootstrap': True, 'criterion': 'absolute_error'}. Best is trial 1749 with value: 0.502720715661024.
[I 2024-12-04 12:31:07,233] Trial 2466 finished with value: 0.5502182015533448 and parameters: {'n_estimators': 114, 'max_depth': 12, 'min_samples_split': 6, 'min_samples_leaf': 2, 'max_features': None, 'bootstrap': True, 'criterion': 'absolute_error'}. Best is trial 1749 with value: 0.502720715661024.
[I 2024-12-04 12:31:08,222] Trial 2465 finished with value: 0.5085760024752282 and parameters: {'n_estimators': 108, 'max_depth': 20, 'min_samples_split': 5, 'min_samples_leaf': 1, 'max_features': None, 'bootstrap': True, 'criterion': 'absolute_error'}. Best is trial 1749 with value: 0.502720715661024.
[I 2024-12-04 12:31:09,383] Trial 2471 finished with value: 0.5064520085701876 and parameters: {'n_estimators': 101, 'max_depth': 18, 'min_samples_split': 5, 'min_samples_leaf': 1, 'max_features': None, 'bootstrap': True, 'criterion': 'absolute_error'}. Best is trial 1749 with value: 0.502720715661024.
[I 2024-12-04 12:31:09,747] Trial 2476 finished with value: 0.549990039590293 and parameters: {'n_estimators': 100, 'max_depth': 12, 'min_samples_split': 3, 'min_samples_leaf': 2, 'max_features': None, 'bootstrap': True, 'criterion': 'absolute_error'}. Best is trial 1749 with value: 0.502720715661024.
[I 2024-12-04 12:31:10,292] Trial 2457 finished with value: 0.5195084352991762 and parameters: {'n_estimators': 249, 'max_depth': 17, 'min_samples_split': 3, 'min_samples_leaf': 1, 'max_features': None, 'bootstrap': True, 'criterion': 'absolute_error'}. Best is trial 1749 with value: 0.502720715661024.
[I 2024-12-04 12:31:10,849] Trial 2468 finished with value: 1.008247967462363 and parameters: {'n_estimators': 250, 'max_depth': 21, 'min_samples_split': 3, 'min_samples_leaf': 1, 'max_features': 'log2', 'bootstrap': True, 'criterion': 'absolute_error'}. Best is trial 1749 with value: 0.502720715661024.
[I 2024-12-04 12:31:12,207] Trial 2477 finished with value: 0.5507838427855976 and parameters: {'n_estimators': 104, 'max_depth': 13, 'min_samples_split': 3, 'min_samples_leaf': 2, 'max_features': None, 'bootstrap': True, 'criterion': 'absolute_error'}. Best is trial 1749 with value: 0.502720715661024.
[I 2024-12-04 12:31:12,328] Trial 2458 finished with value: 0.5193280998437637 and parameters: {'n_estimators': 246, 'max_depth': 11, 'min_samples_split': 5, 'min_samples_leaf': 1, 'max_features': None, 'bootstrap': True, 'criterion': 'absolute_error'}. Best is trial 1749 with value: 0.502720715661024.
[I 2024-12-04 12:31:12,342] Trial 2473 finished with value: 0.5131185928743716 and parameters: {'n_estimators': 128, 'max_depth': 15, 'min_samples_split': 4, 'min_samples_leaf': 1, 'max_features': None, 'bootstrap': True, 'criterion': 'absolute_error'}. Best is trial 1749 with value: 0.502720715661024.
[I 2024-12-04 12:31:13,227] Trial 2479 finished with value: 1.027849400781373 and parameters: {'n_estimators': 108, 'max_depth': 20, 'min_samples_split': 4, 'min_samples_leaf': 1, 'max_features': 'log2', 'bootstrap': True, 'criterion': 'absolute_error'}. Best is trial 1749 with value: 0.502720715661024.
[I 2024-12-04 12:31:13,989] Trial 2488 finished with value: 0.6513738771476756 and parameters: {'n_estimators': 121, 'max_depth': 40, 'min_samples_split': 5, 'min_samples_leaf': 1, 'max_features': 'sqrt', 'bootstrap': True, 'criterion': 'squared_error'}. Best is trial 1749 with value: 0.502720715661024.
[I 2024-12-04 12:31:15,746] Trial 2475 finished with value: 0.5227811724069136 and parameters: {'n_estimators': 241, 'max_depth': 9, 'min_samples_split': 2, 'min_samples_leaf': 1, 'max_features': None, 'bootstrap': True, 'criterion': 'absolute_error'}. Best is trial 1749 with value: 0.502720715661024.
[I 2024-12-04 12:31:18,068] Trial 2482 finished with value: 1.2527767433563186 and parameters: {'n_estimators': 638, 'max_depth': 11, 'min_samples_split': 19, 'min_samples_leaf': 2, 'max_features': 'log2', 'bootstrap': False, 'criterion': 'absolute_error'}. Best is trial 1749 with value: 0.502720715661024.
[I 2024-12-04 12:31:18,594] Trial 2472 finished with value: 0.5179731908674642 and parameters: {'n_estimators': 259, 'max_depth': 11, 'min_samples_split': 4, 'min_samples_leaf': 1, 'max_features': None, 'bootstrap': True, 'criterion': 'absolute_error'}. Best is trial 1749 with value: 0.502720715661024.
[I 2024-12-04 12:31:18,601] Trial 2486 finished with value: 0.5565600051249707 and parameters: {'n_estimators': 103, 'max_depth': 15, 'min_samples_split': 3, 'min_samples_leaf': 2, 'max_features': None, 'bootstrap': True, 'criterion': 'absolute_error'}. Best is trial 1749 with value: 0.502720715661024.
[I 2024-12-04 12:31:18,609] Trial 2487 finished with value: 0.510558314064281 and parameters: {'n_estimators': 100, 'max_depth': 13, 'min_samples_split': 3, 'min_samples_leaf': 1, 'max_features': None, 'bootstrap': True, 'criterion': 'absolute_error'}. Best is trial 1749 with value: 0.502720715661024.
[I 2024-12-04 12:31:18,663] Trial 2433 finished with value: 0.6870543301154198 and parameters: {'n_estimators': 863, 'max_depth': 25, 'min_samples_split': 38, 'min_samples_leaf': 2, 'max_features': None, 'bootstrap': True, 'criterion': 'absolute_error'}. Best is trial 1749 with value: 0.502720715661024.
[I 2024-12-04 12:31:18,857] Trial 2484 finished with value: 0.5292426039765717 and parameters: {'n_estimators': 107, 'max_depth': 7, 'min_samples_split': 6, 'min_samples_leaf': 1, 'max_features': None, 'bootstrap': True, 'criterion': 'absolute_error'}. Best is trial 1749 with value: 0.502720715661024.
[I 2024-12-04 12:31:19,012] Trial 2483 finished with value: 0.5589455794885956 and parameters: {'n_estimators': 109, 'max_depth': 19, 'min_samples_split': 5, 'min_samples_leaf': 2, 'max_features': None, 'bootstrap': True, 'criterion': 'absolute_error'}. Best is trial 1749 with value: 0.502720715661024.
[I 2024-12-04 12:31:20,208] Trial 2492 finished with value: 0.5539060077225684 and parameters: {'n_estimators': 109, 'max_depth': 22, 'min_samples_split': 3, 'min_samples_leaf': 2, 'max_features': None, 'bootstrap': True, 'criterion': 'absolute_error'}. Best is trial 1749 with value: 0.502720715661024.
[I 2024-12-04 12:31:20,751] Trial 2478 finished with value: 1.1431456110531806 and parameters: {'n_estimators': 1000, 'max_depth': 6, 'min_samples_split': 25, 'min_samples_leaf': 1, 'max_features': 'sqrt', 'bootstrap': True, 'criterion': 'absolute_error'}. Best is trial 1749 with value: 0.502720715661024.
[I 2024-12-04 12:31:20,785] Trial 2480 finished with value: 0.524432935380568 and parameters: {'n_estimators': 220, 'max_depth': 9, 'min_samples_split': 3, 'min_samples_leaf': 1, 'max_features': None, 'bootstrap': True, 'criterion': 'absolute_error'}. Best is trial 1749 with value: 0.502720715661024.
[I 2024-12-04 12:31:22,508] Trial 2474 finished with value: 0.5168338907415337 and parameters: {'n_estimators': 253, 'max_depth': 16, 'min_samples_split': 2, 'min_samples_leaf': 1, 'max_features': None, 'bootstrap': True, 'criterion': 'absolute_error'}. Best is trial 1749 with value: 0.502720715661024.
[I 2024-12-04 12:31:22,678] Trial 2497 finished with value: 0.5130489994976095 and parameters: {'n_estimators': 100, 'max_depth': 18, 'min_samples_split': 2, 'min_samples_leaf': 1, 'max_features': None, 'bootstrap': True, 'criterion': 'absolute_error'}. Best is trial 1749 with value: 0.502720715661024.
[I 2024-12-04 12:31:23,466] Trial 2490 finished with value: 0.5315208771116475 and parameters: {'n_estimators': 105, 'max_depth': 7, 'min_samples_split': 2, 'min_samples_leaf': 1, 'max_features': None, 'bootstrap': True, 'criterion': 'absolute_error'}. Best is trial 1749 with value: 0.502720715661024.
[I 2024-12-04 12:31:23,584] Trial 2491 finished with value: 0.5136064304141476 and parameters: {'n_estimators': 104, 'max_depth': 21, 'min_samples_split': 4, 'min_samples_leaf': 1, 'max_features': None, 'bootstrap': True, 'criterion': 'absolute_error'}. Best is trial 1749 with value: 0.502720715661024.
[I 2024-12-04 12:31:23,585] Trial 2493 finished with value: 1.1351039653898225 and parameters: {'n_estimators': 383, 'max_depth': 44, 'min_samples_split': 7, 'min_samples_leaf': 3, 'max_features': 'sqrt', 'bootstrap': True, 'criterion': 'absolute_error'}. Best is trial 1749 with value: 0.502720715661024.
[I 2024-12-04 12:31:24,424] Trial 2496 finished with value: 0.5119651367060459 and parameters: {'n_estimators': 101, 'max_depth': 14, 'min_samples_split': 4, 'min_samples_leaf': 1, 'max_features': None, 'bootstrap': True, 'criterion': 'absolute_error'}. Best is trial 1749 with value: 0.502720715661024.
[I 2024-12-04 12:31:24,718] Trial 2499 finished with value: 0.5485460262672988 and parameters: {'n_estimators': 752, 'max_depth': 36, 'min_samples_split': 3, 'min_samples_leaf': 3, 'max_features': None, 'bootstrap': True, 'criterion': 'squared_error'}. Best is trial 1749 with value: 0.502720715661024.
[I 2024-12-04 12:31:25,231] Trial 2485 finished with value: 0.5642949073318709 and parameters: {'n_estimators': 276, 'max_depth': 6, 'min_samples_split': 2, 'min_samples_leaf': 2, 'max_features': None, 'bootstrap': True, 'criterion': 'absolute_error'}. Best is trial 1749 with value: 0.502720715661024.
[I 2024-12-04 12:31:25,355] Trial 2494 finished with value: 0.5126681329043457 and parameters: {'n_estimators': 108, 'max_depth': 17, 'min_samples_split': 4, 'min_samples_leaf': 1, 'max_features': None, 'bootstrap': True, 'criterion': 'absolute_error'}. Best is trial 1749 with value: 0.502720715661024.
[I 2024-12-04 12:31:25,657] Trial 2489 finished with value: 0.5100766374386503 and parameters: {'n_estimators': 112, 'max_depth': 15, 'min_samples_split': 5, 'min_samples_leaf': 1, 'max_features': None, 'bootstrap': True, 'criterion': 'absolute_error'}. Best is trial 1749 with value: 0.502720715661024.
[I 2024-12-04 12:31:27,329] Trial 2495 finished with value: 0.8887662163039045 and parameters: {'n_estimators': 743, 'max_depth': 33, 'min_samples_split': 22, 'min_samples_leaf': 1, 'max_features': 'log2', 'bootstrap': False, 'criterion': 'absolute_error'}. Best is trial 1749 with value: 0.502720715661024.
[I 2024-12-04 12:31:30,220] Trial 2498 finished with value: 0.516760021323338 and parameters: {'n_estimators': 255, 'max_depth': 18, 'min_samples_split': 5, 'min_samples_leaf': 1, 'max_features': None, 'bootstrap': True, 'criterion': 'absolute_error'}. Best is trial 1749 with value: 0.502720715661024.
[I 2024-12-04 12:31:41,486] Trial 2481 finished with value: 0.5785427852829902 and parameters: {'n_estimators': 402, 'max_depth': 11, 'min_samples_split': 4, 'min_samples_leaf': 1, 'max_features': None, 'bootstrap': False, 'criterion': 'absolute_error'}. Best is trial 1749 with value: 0.502720715661024.
