[I 2024-12-04 15:29:06,371] Trial 2396 finished with value: 0.64283359190536 and parameters: {'n_estimators': 1141, 'learning_rate': 0.07496659367786093, 'max_depth': 12, 'min_samples_split': 17, 'min_samples_leaf': 3, 'subsample': 0.9347126979101715, 'max_features': None}. Best is trial 2282 with value: 0.45359136528270205.
[I 2024-12-04 15:29:07,107] Trial 2408 finished with value: 0.493802053380115 and parameters: {'n_estimators': 778, 'learning_rate': 0.06469009340505409, 'max_depth': 10, 'min_samples_split': 20, 'min_samples_leaf': 1, 'subsample': 0.9926638033082229, 'max_features': None}. Best is trial 2282 with value: 0.45359136528270205.
[I 2024-12-04 15:29:07,782] Trial 2395 finished with value: 0.7414044017410051 and parameters: {'n_estimators': 1401, 'learning_rate': 0.014127726450457715, 'max_depth': 12, 'min_samples_split': 10, 'min_samples_leaf': 9, 'subsample': 0.6439122303068684, 'max_features': None}. Best is trial 2282 with value: 0.45359136528270205.
[I 2024-12-04 15:29:08,992] Trial 2405 finished with value: 0.46437879705054835 and parameters: {'n_estimators': 876, 'learning_rate': 0.09868171255959629, 'max_depth': 12, 'min_samples_split': 19, 'min_samples_leaf': 1, 'subsample': 0.9970642190903982, 'max_features': None}. Best is trial 2282 with value: 0.45359136528270205.
[I 2024-12-04 15:29:09,449] Trial 2411 finished with value: 0.9543503385274076 and parameters: {'n_estimators': 950, 'learning_rate': 0.01898895987566686, 'max_depth': 3, 'min_samples_split': 6, 'min_samples_leaf': 7, 'subsample': 0.9061527385456757, 'max_features': 'log2'}. Best is trial 2282 with value: 0.45359136528270205.
[I 2024-12-04 15:29:10,805] Trial 2401 finished with value: 0.5102943962464289 and parameters: {'n_estimators': 1036, 'learning_rate': 0.05930287492709136, 'max_depth': 12, 'min_samples_split': 16, 'min_samples_leaf': 1, 'subsample': 0.9971238322031046, 'max_features': None}. Best is trial 2282 with value: 0.45359136528270205.
[I 2024-12-04 15:29:11,852] Trial 2399 finished with value: 0.4964668398572007 and parameters: {'n_estimators': 1421, 'learning_rate': 0.02102270351184279, 'max_depth': 8, 'min_samples_split': 5, 'min_samples_leaf': 1, 'subsample': 0.991891980327931, 'max_features': 'sqrt'}. Best is trial 2282 with value: 0.45359136528270205.
[I 2024-12-04 15:29:12,055] Trial 2410 finished with value: 0.6154151976296003 and parameters: {'n_estimators': 859, 'learning_rate': 0.05888354028872673, 'max_depth': 11, 'min_samples_split': 19, 'min_samples_leaf': 3, 'subsample': 0.9969767490489924, 'max_features': None}. Best is trial 2282 with value: 0.45359136528270205.
[I 2024-12-04 15:29:12,518] Trial 2412 finished with value: 0.5764799980445529 and parameters: {'n_estimators': 984, 'learning_rate': 0.061172072560266466, 'max_depth': 12, 'min_samples_split': 20, 'min_samples_leaf': 1, 'subsample': 0.9213210912824645, 'max_features': 'log2'}. Best is trial 2282 with value: 0.45359136528270205.
[I 2024-12-04 15:29:13,266] Trial 2406 finished with value: 0.4792141470929228 and parameters: {'n_estimators': 963, 'learning_rate': 0.08395265746084686, 'max_depth': 12, 'min_samples_split': 20, 'min_samples_leaf': 1, 'subsample': 0.9856037149991856, 'max_features': None}. Best is trial 2282 with value: 0.45359136528270205.
[I 2024-12-04 15:29:15,808] Trial 2414 finished with value: 0.6429203859729113 and parameters: {'n_estimators': 841, 'learning_rate': 0.08060376490316166, 'max_depth': 10, 'min_samples_split': 20, 'min_samples_leaf': 3, 'subsample': 0.9969962823224231, 'max_features': None}. Best is trial 2282 with value: 0.45359136528270205.
[I 2024-12-04 15:29:18,587] Trial 2404 finished with value: 0.6377333615337314 and parameters: {'n_estimators': 1197, 'learning_rate': 0.04657809439612703, 'max_depth': 12, 'min_samples_split': 20, 'min_samples_leaf': 3, 'subsample': 0.9250024655481511, 'max_features': None}. Best is trial 2282 with value: 0.45359136528270205.
[I 2024-12-04 15:29:20,338] Trial 2409 finished with value: 0.47476623787343397 and parameters: {'n_estimators': 1084, 'learning_rate': 0.09751184167516812, 'max_depth': 12, 'min_samples_split': 20, 'min_samples_leaf': 1, 'subsample': 0.9766980883432532, 'max_features': None}. Best is trial 2282 with value: 0.45359136528270205.
[I 2024-12-04 15:29:21,055] Trial 2407 finished with value: 0.5898877062843816 and parameters: {'n_estimators': 1208, 'learning_rate': 0.07113532166998313, 'max_depth': 9, 'min_samples_split': 7, 'min_samples_leaf': 6, 'subsample': 0.9200420913188175, 'max_features': None}. Best is trial 2282 with value: 0.45359136528270205.
[I 2024-12-04 15:29:23,271] Trial 2415 finished with value: 0.6210628017567504 and parameters: {'n_estimators': 1061, 'learning_rate': 0.05596432498201099, 'max_depth': 12, 'min_samples_split': 20, 'min_samples_leaf': 2, 'subsample': 0.973502550340794, 'max_features': 'sqrt'}. Best is trial 2282 with value: 0.45359136528270205.
[I 2024-12-04 15:29:24,984] Trial 2418 finished with value: 0.6347838763797297 and parameters: {'n_estimators': 888, 'learning_rate': 0.054447345661636885, 'max_depth': 12, 'min_samples_split': 20, 'min_samples_leaf': 3, 'subsample': 0.968439600574876, 'max_features': None}. Best is trial 2282 with value: 0.45359136528270205.
[I 2024-12-04 15:29:25,038] Trial 2440 finished with value: 0.6548622597410642 and parameters: {'n_estimators': 256, 'learning_rate': 0.0790034853086546, 'max_depth': 7, 'min_samples_split': 3, 'min_samples_leaf': 2, 'subsample': 0.746111548440403, 'max_features': None}. Best is trial 2282 with value: 0.45359136528270205.
[I 2024-12-04 15:29:26,031] Trial 2438 finished with value: 1.1349632014131594 and parameters: {'n_estimators': 290, 'learning_rate': 0.022005827599565677, 'max_depth': 11, 'min_samples_split': 3, 'min_samples_leaf': 10, 'subsample': 0.7294318965113521, 'max_features': 'log2'}. Best is trial 2282 with value: 0.45359136528270205.
[I 2024-12-04 15:29:26,157] Trial 2420 finished with value: 0.5054736718954123 and parameters: {'n_estimators': 856, 'learning_rate': 0.08559080988939376, 'max_depth': 10, 'min_samples_split': 17, 'min_samples_leaf': 1, 'subsample': 0.9993979044939488, 'max_features': None}. Best is trial 2282 with value: 0.45359136528270205.
[I 2024-12-04 15:29:26,321] Trial 2417 finished with value: 0.6792142474749611 and parameters: {'n_estimators': 1157, 'learning_rate': 0.09746821460636662, 'max_depth': 12, 'min_samples_split': 14, 'min_samples_leaf': 2, 'subsample': 0.9622741801180157, 'max_features': 'log2'}. Best is trial 2282 with value: 0.45359136528270205.
[I 2024-12-04 15:29:27,544] Trial 2421 finished with value: 0.681627807653219 and parameters: {'n_estimators': 937, 'learning_rate': 0.0718351037287218, 'max_depth': 12, 'min_samples_split': 17, 'min_samples_leaf': 3, 'subsample': 0.9820735296841018, 'max_features': 'sqrt'}. Best is trial 2282 with value: 0.45359136528270205.
[I 2024-12-04 15:29:27,597] Trial 2432 finished with value: 0.8216578710823801 and parameters: {'n_estimators': 591, 'learning_rate': 0.017676141327362078, 'max_depth': 11, 'min_samples_split': 15, 'min_samples_leaf': 9, 'subsample': 0.9726106249769118, 'max_features': 'sqrt'}. Best is trial 2282 with value: 0.45359136528270205.
[I 2024-12-04 15:29:29,587] Trial 2429 finished with value: 0.6279828287286537 and parameters: {'n_estimators': 629, 'learning_rate': 0.09629401449208355, 'max_depth': 11, 'min_samples_split': 20, 'min_samples_leaf': 3, 'subsample': 0.9888148740869922, 'max_features': None}. Best is trial 2282 with value: 0.45359136528270205.
[I 2024-12-04 15:29:29,885] Trial 2446 finished with value: 0.5743651459181547 and parameters: {'n_estimators': 115, 'learning_rate': 0.021634538209729444, 'max_depth': 6, 'min_samples_split': 4, 'min_samples_leaf': 3, 'subsample': 0.9207674752630783, 'max_features': None}. Best is trial 2282 with value: 0.45359136528270205.
[I 2024-12-04 15:29:30,121] Trial 2424 finished with value: 0.6399898280254416 and parameters: {'n_estimators': 784, 'learning_rate': 0.06714534514323688, 'max_depth': 12, 'min_samples_split': 16, 'min_samples_leaf': 2, 'subsample': 0.9172608289175026, 'max_features': None}. Best is trial 2282 with value: 0.45359136528270205.
[I 2024-12-04 15:29:31,475] Trial 2425 finished with value: 0.4959425304664916 and parameters: {'n_estimators': 786, 'learning_rate': 0.06937033021154133, 'max_depth': 12, 'min_samples_split': 17, 'min_samples_leaf': 1, 'subsample': 0.8953826843473558, 'max_features': None}. Best is trial 2282 with value: 0.45359136528270205.
[I 2024-12-04 15:29:31,477] Trial 2422 finished with value: 0.6567131606129791 and parameters: {'n_estimators': 1050, 'learning_rate': 0.02103696823172102, 'max_depth': 6, 'min_samples_split': 7, 'min_samples_leaf': 5, 'subsample': 0.8917752103811726, 'max_features': 'sqrt'}. Best is trial 2282 with value: 0.45359136528270205.
[I 2024-12-04 15:29:32,577] Trial 2413 finished with value: 0.762206333049463 and parameters: {'n_estimators': 1434, 'learning_rate': 0.021766295848863915, 'max_depth': 9, 'min_samples_split': 4, 'min_samples_leaf': 9, 'subsample': 0.8197925593415437, 'max_features': None}. Best is trial 2282 with value: 0.45359136528270205.
[I 2024-12-04 15:29:32,671] Trial 2416 finished with value: 0.45866264736147067 and parameters: {'n_estimators': 1078, 'learning_rate': 0.06424726580237526, 'max_depth': 12, 'min_samples_split': 18, 'min_samples_leaf': 1, 'subsample': 0.9954615583914622, 'max_features': None}. Best is trial 2282 with value: 0.45359136528270205.
[I 2024-12-04 15:29:35,088] Trial 2419 finished with value: 0.4914885083647244 and parameters: {'n_estimators': 1074, 'learning_rate': 0.05932014959191974, 'max_depth': 11, 'min_samples_split': 17, 'min_samples_leaf': 1, 'subsample': 0.9987145476135785, 'max_features': None}. Best is trial 2282 with value: 0.45359136528270205.
[I 2024-12-04 15:29:40,786] Trial 2441 finished with value: 0.49536590412868176 and parameters: {'n_estimators': 624, 'learning_rate': 0.09060299717068354, 'max_depth': 11, 'min_samples_split': 20, 'min_samples_leaf': 1, 'subsample': 0.9191459302255085, 'max_features': None}. Best is trial 2282 with value: 0.45359136528270205.
[I 2024-12-04 15:29:40,854] Trial 2443 finished with value: 0.6449159833750521 and parameters: {'n_estimators': 707, 'learning_rate': 0.0475121079215909, 'max_depth': 4, 'min_samples_split': 19, 'min_samples_leaf': 3, 'subsample': 0.8470198545782303, 'max_features': 'sqrt'}. Best is trial 2282 with value: 0.45359136528270205.
[I 2024-12-04 15:29:43,005] Trial 2427 finished with value: 0.49801842869149765 and parameters: {'n_estimators': 1083, 'learning_rate': 0.05461697607916892, 'max_depth': 12, 'min_samples_split': 16, 'min_samples_leaf': 1, 'subsample': 0.8672372879075408, 'max_features': None}. Best is trial 2282 with value: 0.45359136528270205.
[I 2024-12-04 15:29:43,882] Trial 2423 finished with value: 0.47898866815842756 and parameters: {'n_estimators': 1174, 'learning_rate': 0.09952164111807088, 'max_depth': 12, 'min_samples_split': 19, 'min_samples_leaf': 1, 'subsample': 0.9968874431109798, 'max_features': None}. Best is trial 2282 with value: 0.45359136528270205.
[I 2024-12-04 15:29:43,949] Trial 2434 finished with value: 0.4853410664522338 and parameters: {'n_estimators': 871, 'learning_rate': 0.06658765856776636, 'max_depth': 12, 'min_samples_split': 17, 'min_samples_leaf': 1, 'subsample': 0.9298882224083767, 'max_features': None}. Best is trial 2282 with value: 0.45359136528270205.
[I 2024-12-04 15:29:44,263] Trial 2451 finished with value: 0.657109605915425 and parameters: {'n_estimators': 431, 'learning_rate': 0.06179007035798468, 'max_depth': 4, 'min_samples_split': 2, 'min_samples_leaf': 7, 'subsample': 0.6350390025625412, 'max_features': None}. Best is trial 2282 with value: 0.45359136528270205.
[I 2024-12-04 15:29:46,449] Trial 2428 finished with value: 0.6322711466783784 and parameters: {'n_estimators': 1140, 'learning_rate': 0.059542119983086894, 'max_depth': 11, 'min_samples_split': 20, 'min_samples_leaf': 3, 'subsample': 0.9973471848361054, 'max_features': None}. Best is trial 2282 with value: 0.45359136528270205.
[I 2024-12-04 15:29:46,450] Trial 2431 finished with value: 0.47072469605868933 and parameters: {'n_estimators': 1002, 'learning_rate': 0.07083529184216555, 'max_depth': 12, 'min_samples_split': 19, 'min_samples_leaf': 1, 'subsample': 0.9982877800342189, 'max_features': None}. Best is trial 2282 with value: 0.45359136528270205.
[I 2024-12-04 15:29:46,808] Trial 2437 finished with value: 0.47539828031123277 and parameters: {'n_estimators': 799, 'learning_rate': 0.0988758608788677, 'max_depth': 12, 'min_samples_split': 20, 'min_samples_leaf': 1, 'subsample': 0.9780892058265678, 'max_features': None}. Best is trial 2282 with value: 0.45359136528270205.
[I 2024-12-04 15:29:47,508] Trial 2435 finished with value: 0.9616725458965808 and parameters: {'n_estimators': 1170, 'learning_rate': 0.010196135870686159, 'max_depth': 10, 'min_samples_split': 18, 'min_samples_leaf': 5, 'subsample': 0.7116296695873342, 'max_features': 'log2'}. Best is trial 2282 with value: 0.45359136528270205.
[I 2024-12-04 15:29:50,820] Trial 2430 finished with value: 0.4807188318791486 and parameters: {'n_estimators': 1146, 'learning_rate': 0.08469643117102633, 'max_depth': 11, 'min_samples_split': 20, 'min_samples_leaf': 1, 'subsample': 0.9991713869993771, 'max_features': None}. Best is trial 2282 with value: 0.45359136528270205.
[I 2024-12-04 15:29:52,210] Trial 2426 finished with value: 0.5134519118608302 and parameters: {'n_estimators': 1323, 'learning_rate': 0.09300665955231108, 'max_depth': 12, 'min_samples_split': 17, 'min_samples_leaf': 1, 'subsample': 0.8989602766704533, 'max_features': None}. Best is trial 2282 with value: 0.45359136528270205.
[I 2024-12-04 15:29:52,549] Trial 2433 finished with value: 0.48160019933334697 and parameters: {'n_estimators': 1108, 'learning_rate': 0.04261724317906627, 'max_depth': 12, 'min_samples_split': 20, 'min_samples_leaf': 1, 'subsample': 0.9868649791185974, 'max_features': None}. Best is trial 2282 with value: 0.45359136528270205.
[I 2024-12-04 15:29:53,195] Trial 2448 finished with value: 0.6096855487496342 and parameters: {'n_estimators': 646, 'learning_rate': 0.09769730440511007, 'max_depth': 12, 'min_samples_split': 17, 'min_samples_leaf': 2, 'subsample': 0.9923980517377232, 'max_features': None}. Best is trial 2282 with value: 0.45359136528270205.
[I 2024-12-04 15:29:56,287] Trial 2436 finished with value: 0.5227996376972065 and parameters: {'n_estimators': 1131, 'learning_rate': 0.032514993039942076, 'max_depth': 11, 'min_samples_split': 15, 'min_samples_leaf': 1, 'subsample': 0.9923466010869316, 'max_features': None}. Best is trial 2282 with value: 0.45359136528270205.
[I 2024-12-04 15:29:57,406] Trial 2439 finished with value: 0.6368399065847387 and parameters: {'n_estimators': 1071, 'learning_rate': 0.09680933204633857, 'max_depth': 12, 'min_samples_split': 20, 'min_samples_leaf': 2, 'subsample': 0.9938910609561842, 'max_features': None}. Best is trial 2282 with value: 0.45359136528270205.
[I 2024-12-04 15:29:59,331] Trial 2445 finished with value: 0.6514803046616199 and parameters: {'n_estimators': 1004, 'learning_rate': 0.06534982296798748, 'max_depth': 12, 'min_samples_split': 17, 'min_samples_leaf': 3, 'subsample': 0.9233902461561501, 'max_features': None}. Best is trial 2282 with value: 0.45359136528270205.
[I 2024-12-04 15:30:00,467] Trial 2444 finished with value: 0.6258159183193175 and parameters: {'n_estimators': 1039, 'learning_rate': 0.060259712061296336, 'max_depth': 12, 'min_samples_split': 20, 'min_samples_leaf': 3, 'subsample': 0.99544924886653, 'max_features': None}. Best is trial 2282 with value: 0.45359136528270205.
[I 2024-12-04 15:30:03,276] Trial 2452 finished with value: 0.4805019366033164 and parameters: {'n_estimators': 824, 'learning_rate': 0.05963765827940499, 'max_depth': 12, 'min_samples_split': 20, 'min_samples_leaf': 1, 'subsample': 0.9593120961765236, 'max_features': None}. Best is trial 2282 with value: 0.45359136528270205.
[I 2024-12-04 15:30:05,668] Trial 2442 finished with value: 0.6674512777699063 and parameters: {'n_estimators': 1351, 'learning_rate': 0.08675351674702729, 'max_depth': 12, 'min_samples_split': 18, 'min_samples_leaf': 3, 'subsample': 0.9238005414365331, 'max_features': None}. Best is trial 2282 with value: 0.45359136528270205.
[I 2024-12-04 15:30:07,581] Trial 2449 finished with value: 0.6837149697072218 and parameters: {'n_estimators': 1072, 'learning_rate': 0.09842118226765458, 'max_depth': 11, 'min_samples_split': 16, 'min_samples_leaf': 3, 'subsample': 0.9368844744767313, 'max_features': None}. Best is trial 2282 with value: 0.45359136528270205.
[I 2024-12-04 15:30:09,536] Trial 2455 finished with value: 0.5125269388359387 and parameters: {'n_estimators': 1102, 'learning_rate': 0.08474855477485037, 'max_depth': 7, 'min_samples_split': 14, 'min_samples_leaf': 1, 'subsample': 0.7180618902195831, 'max_features': None}. Best is trial 2282 with value: 0.45359136528270205.
[I 2024-12-04 15:30:09,968] Trial 2456 finished with value: 0.7651842176760046 and parameters: {'n_estimators': 1269, 'learning_rate': 0.09257763631863002, 'max_depth': 3, 'min_samples_split': 11, 'min_samples_leaf': 7, 'subsample': 0.8491327520434608, 'max_features': 'log2'}. Best is trial 2282 with value: 0.45359136528270205.
[I 2024-12-04 15:30:10,793] Trial 2458 finished with value: 0.6178106704636507 and parameters: {'n_estimators': 979, 'learning_rate': 0.046146482084818, 'max_depth': 12, 'min_samples_split': 17, 'min_samples_leaf': 2, 'subsample': 0.9394507431981202, 'max_features': None}. Best is trial 2282 with value: 0.45359136528270205.
[I 2024-12-04 15:30:12,198] Trial 2459 finished with value: 0.6514066928254971 and parameters: {'n_estimators': 1057, 'learning_rate': 0.06349137623901865, 'max_depth': 10, 'min_samples_split': 18, 'min_samples_leaf': 2, 'subsample': 0.909225925597034, 'max_features': None}. Best is trial 2282 with value: 0.45359136528270205.
[I 2024-12-04 15:30:13,217] Trial 2460 finished with value: 0.63424413064828 and parameters: {'n_estimators': 1018, 'learning_rate': 0.04789030927458592, 'max_depth': 10, 'min_samples_split': 16, 'min_samples_leaf': 2, 'subsample': 0.9722336861136879, 'max_features': None}. Best is trial 2282 with value: 0.45359136528270205.
[I 2024-12-04 15:30:13,541] Trial 2447 finished with value: 0.664352224762105 and parameters: {'n_estimators': 1243, 'learning_rate': 0.061723033167998584, 'max_depth': 12, 'min_samples_split': 16, 'min_samples_leaf': 3, 'subsample': 0.9997335707506659, 'max_features': None}. Best is trial 2282 with value: 0.45359136528270205.
[I 2024-12-04 15:30:15,128] Trial 2453 finished with value: 0.5091084841111214 and parameters: {'n_estimators': 1190, 'learning_rate': 0.06801010765136488, 'max_depth': 12, 'min_samples_split': 14, 'min_samples_leaf': 1, 'subsample': 0.9937894378757861, 'max_features': None}. Best is trial 2282 with value: 0.45359136528270205.
[I 2024-12-04 15:30:16,707] Trial 2462 finished with value: 0.7366199836892158 and parameters: {'n_estimators': 1221, 'learning_rate': 0.040581441488168765, 'max_depth': 9, 'min_samples_split': 2, 'min_samples_leaf': 6, 'subsample': 0.6041390294018482, 'max_features': 'log2'}. Best is trial 2282 with value: 0.45359136528270205.
[I 2024-12-04 15:30:18,717] Trial 2450 finished with value: 0.46073628406482403 and parameters: {'n_estimators': 1343, 'learning_rate': 0.07107662427960351, 'max_depth': 12, 'min_samples_split': 20, 'min_samples_leaf': 1, 'subsample': 0.9506089865264189, 'max_features': None}. Best is trial 2282 with value: 0.45359136528270205.
[I 2024-12-04 15:30:19,621] Trial 2464 finished with value: 0.6615369374370067 and parameters: {'n_estimators': 985, 'learning_rate': 0.06010334426259463, 'max_depth': 10, 'min_samples_split': 14, 'min_samples_leaf': 2, 'subsample': 0.9926138833780762, 'max_features': None}. Best is trial 2282 with value: 0.45359136528270205.
[I 2024-12-04 15:30:20,870] Trial 2457 finished with value: 0.5184732269207372 and parameters: {'n_estimators': 1198, 'learning_rate': 0.04637374333059709, 'max_depth': 10, 'min_samples_split': 15, 'min_samples_leaf': 1, 'subsample': 0.9104441590620462, 'max_features': None}. Best is trial 2282 with value: 0.45359136528270205.
[I 2024-12-04 15:30:23,067] Trial 2454 finished with value: 0.5181447427011928 and parameters: {'n_estimators': 1322, 'learning_rate': 0.07682271704238258, 'max_depth': 12, 'min_samples_split': 14, 'min_samples_leaf': 1, 'subsample': 0.993438003382624, 'max_features': None}. Best is trial 2282 with value: 0.45359136528270205.
[I 2024-12-04 15:30:23,909] Trial 2463 finished with value: 0.6487329674450193 and parameters: {'n_estimators': 1141, 'learning_rate': 0.060251845364044876, 'max_depth': 12, 'min_samples_split': 17, 'min_samples_leaf': 3, 'subsample': 0.9346816008676289, 'max_features': None}. Best is trial 2282 with value: 0.45359136528270205.
[I 2024-12-04 15:30:25,291] Trial 2461 finished with value: 0.4965489355189146 and parameters: {'n_estimators': 1310, 'learning_rate': 0.07091988801265794, 'max_depth': 12, 'min_samples_split': 16, 'min_samples_leaf': 1, 'subsample': 0.9447257714850058, 'max_features': None}. Best is trial 2282 with value: 0.45359136528270205.
[I 2024-12-04 15:30:27,361] Trial 2468 finished with value: 0.4625370827219243 and parameters: {'n_estimators': 1055, 'learning_rate': 0.060344410719011025, 'max_depth': 12, 'min_samples_split': 18, 'min_samples_leaf': 1, 'subsample': 0.9867649522417149, 'max_features': None}. Best is trial 2282 with value: 0.45359136528270205.
