[I 2024-12-04 15:30:27,436] Trial 2465 finished with value: 0.6225615093620877 and parameters: {'n_estimators': 1149, 'learning_rate': 0.045636400817078066, 'max_depth': 12, 'min_samples_split': 19, 'min_samples_leaf': 2, 'subsample': 0.9233919643738567, 'max_features': None}. Best is trial 2282 with value: 0.45359136528270205.
[I 2024-12-04 15:30:27,879] Trial 2469 finished with value: 0.49332747813676553 and parameters: {'n_estimators': 1028, 'learning_rate': 0.05478239809330961, 'max_depth': 12, 'min_samples_split': 17, 'min_samples_leaf': 1, 'subsample': 0.9855580325611121, 'max_features': None}. Best is trial 2282 with value: 0.45359136528270205.
[I 2024-12-04 15:30:28,096] Trial 2467 finished with value: 0.4809617467473382 and parameters: {'n_estimators': 1146, 'learning_rate': 0.03549640260692929, 'max_depth': 11, 'min_samples_split': 20, 'min_samples_leaf': 1, 'subsample': 0.9230661464560868, 'max_features': None}. Best is trial 2282 with value: 0.45359136528270205.
[I 2024-12-04 15:30:29,914] Trial 2471 finished with value: 0.6772469173627838 and parameters: {'n_estimators': 1364, 'learning_rate': 0.07408037701681101, 'max_depth': 12, 'min_samples_split': 19, 'min_samples_leaf': 3, 'subsample': 0.9522573021844116, 'max_features': 'log2'}. Best is trial 2282 with value: 0.45359136528270205.
[I 2024-12-04 15:30:31,908] Trial 2472 finished with value: 0.4784876670510015 and parameters: {'n_estimators': 1146, 'learning_rate': 0.04792848457932815, 'max_depth': 11, 'min_samples_split': 17, 'min_samples_leaf': 1, 'subsample': 0.9299559118615158, 'max_features': None}. Best is trial 2282 with value: 0.45359136528270205.
[I 2024-12-04 15:30:32,017] Trial 2478 finished with value: 0.8059675411495701 and parameters: {'n_estimators': 1132, 'learning_rate': 0.02515412201633123, 'max_depth': 9, 'min_samples_split': 7, 'min_samples_leaf': 10, 'subsample': 0.8899781510044663, 'max_features': 'sqrt'}. Best is trial 2282 with value: 0.45359136528270205.
[I 2024-12-04 15:30:33,557] Trial 2474 finished with value: 0.6638928195763021 and parameters: {'n_estimators': 1118, 'learning_rate': 0.08301850142568891, 'max_depth': 12, 'min_samples_split': 12, 'min_samples_leaf': 3, 'subsample': 0.9997691295519466, 'max_features': None}. Best is trial 2282 with value: 0.45359136528270205.
[I 2024-12-04 15:30:33,659] Trial 2470 finished with value: 0.6306328667397499 and parameters: {'n_estimators': 1243, 'learning_rate': 0.0978435381914827, 'max_depth': 12, 'min_samples_split': 19, 'min_samples_leaf': 2, 'subsample': 0.9994003531210518, 'max_features': None}. Best is trial 2282 with value: 0.45359136528270205.
[I 2024-12-04 15:30:33,665] Trial 2473 finished with value: 0.47719608232152566 and parameters: {'n_estimators': 1165, 'learning_rate': 0.07192786187671174, 'max_depth': 11, 'min_samples_split': 18, 'min_samples_leaf': 1, 'subsample': 0.9307517181274507, 'max_features': None}. Best is trial 2282 with value: 0.45359136528270205.
[I 2024-12-04 15:30:33,718] Trial 2466 finished with value: 0.47385785434805267 and parameters: {'n_estimators': 1318, 'learning_rate': 0.06720639801159856, 'max_depth': 12, 'min_samples_split': 19, 'min_samples_leaf': 1, 'subsample': 0.9907379341157447, 'max_features': None}. Best is trial 2282 with value: 0.45359136528270205.
[I 2024-12-04 15:30:33,732] Trial 2483 finished with value: 0.6545512943019224 and parameters: {'n_estimators': 670, 'learning_rate': 0.04326284387642652, 'max_depth': 12, 'min_samples_split': 9, 'min_samples_leaf': 8, 'subsample': 0.9448352308075646, 'max_features': None}. Best is trial 2282 with value: 0.45359136528270205.
[I 2024-12-04 15:30:34,661] Trial 2479 finished with value: 0.5095234208865974 and parameters: {'n_estimators': 1247, 'learning_rate': 0.09244092367343364, 'max_depth': 11, 'min_samples_split': 16, 'min_samples_leaf': 1, 'subsample': 0.9318973831502434, 'max_features': 'sqrt'}. Best is trial 2282 with value: 0.45359136528270205.
[I 2024-12-04 15:30:35,911] Trial 2477 finished with value: 0.6351638798963872 and parameters: {'n_estimators': 1155, 'learning_rate': 0.05561568489975123, 'max_depth': 12, 'min_samples_split': 17, 'min_samples_leaf': 2, 'subsample': 0.9995326276819556, 'max_features': None}. Best is trial 2282 with value: 0.45359136528270205.
[I 2024-12-04 15:30:36,823] Trial 2476 finished with value: 0.6677143370936022 and parameters: {'n_estimators': 1265, 'learning_rate': 0.09956480649273142, 'max_depth': 10, 'min_samples_split': 17, 'min_samples_leaf': 3, 'subsample': 0.989107526107267, 'max_features': None}. Best is trial 2282 with value: 0.45359136528270205.
[I 2024-12-04 15:30:36,915] Trial 2480 finished with value: 0.6287799685471884 and parameters: {'n_estimators': 1023, 'learning_rate': 0.05073109939734238, 'max_depth': 12, 'min_samples_split': 16, 'min_samples_leaf': 2, 'subsample': 0.9967924827477743, 'max_features': None}. Best is trial 2282 with value: 0.45359136528270205.
[I 2024-12-04 15:30:37,960] Trial 2475 finished with value: 0.5288812248116808 and parameters: {'n_estimators': 1360, 'learning_rate': 0.09867117580613402, 'max_depth': 12, 'min_samples_split': 16, 'min_samples_leaf': 1, 'subsample': 0.9994022359896171, 'max_features': None}. Best is trial 2282 with value: 0.45359136528270205.
[I 2024-12-04 15:30:38,372] Trial 2496 finished with value: 0.5512430175259275 and parameters: {'n_estimators': 640, 'learning_rate': 0.027965816532548534, 'max_depth': 7, 'min_samples_split': 9, 'min_samples_leaf': 1, 'subsample': 0.6668135880241808, 'max_features': 'sqrt'}. Best is trial 2282 with value: 0.45359136528270205.
[I 2024-12-04 15:30:38,589] Trial 2484 finished with value: 0.7449911495204659 and parameters: {'n_estimators': 971, 'learning_rate': 0.03721201918419534, 'max_depth': 12, 'min_samples_split': 5, 'min_samples_leaf': 9, 'subsample': 0.80158275612262, 'max_features': None}. Best is trial 2282 with value: 0.45359136528270205.
[I 2024-12-04 15:30:39,747] Trial 2490 finished with value: 0.6486622478996329 and parameters: {'n_estimators': 1078, 'learning_rate': 0.05948258919815258, 'max_depth': 11, 'min_samples_split': 20, 'min_samples_leaf': 3, 'subsample': 0.9983179239064078, 'max_features': 'log2'}. Best is trial 2282 with value: 0.45359136528270205.
[I 2024-12-04 15:30:40,372] Trial 2486 finished with value: 0.8237896269041358 and parameters: {'n_estimators': 1309, 'learning_rate': 0.05971781320359929, 'max_depth': 9, 'min_samples_split': 12, 'min_samples_leaf': 10, 'subsample': 0.8416675836585574, 'max_features': 'sqrt'}. Best is trial 2282 with value: 0.45359136528270205.
[I 2024-12-04 15:30:40,524] Trial 2481 finished with value: 0.47930871024213373 and parameters: {'n_estimators': 1196, 'learning_rate': 0.06972146504764375, 'max_depth': 12, 'min_samples_split': 19, 'min_samples_leaf': 1, 'subsample': 0.938116940236203, 'max_features': None}. Best is trial 2282 with value: 0.45359136528270205.
[I 2024-12-04 15:30:40,898] Trial 2485 finished with value: 0.7475176886777325 and parameters: {'n_estimators': 1425, 'learning_rate': 0.022571053038433295, 'max_depth': 5, 'min_samples_split': 19, 'min_samples_leaf': 6, 'subsample': 0.691188847717249, 'max_features': 'log2'}. Best is trial 2282 with value: 0.45359136528270205.
[I 2024-12-04 15:30:41,419] Trial 2482 finished with value: 0.6439909765248191 and parameters: {'n_estimators': 1266, 'learning_rate': 0.06268299374432013, 'max_depth': 10, 'min_samples_split': 16, 'min_samples_leaf': 2, 'subsample': 0.9868721719346834, 'max_features': None}. Best is trial 2282 with value: 0.45359136528270205.
[I 2024-12-04 15:30:41,945] Trial 2489 finished with value: 0.6298538316424327 and parameters: {'n_estimators': 1112, 'learning_rate': 0.03639182221495242, 'max_depth': 12, 'min_samples_split': 20, 'min_samples_leaf': 3, 'subsample': 0.9503091913526278, 'max_features': None}. Best is trial 2282 with value: 0.45359136528270205.
[I 2024-12-04 15:30:42,735] Trial 2493 finished with value: 0.5645718662971938 and parameters: {'n_estimators': 1291, 'learning_rate': 0.07742385271705977, 'max_depth': 3, 'min_samples_split': 6, 'min_samples_leaf': 1, 'subsample': 0.7987226100391845, 'max_features': None}. Best is trial 2282 with value: 0.45359136528270205.
[I 2024-12-04 15:30:43,283] Trial 2487 finished with value: 0.48476177399827697 and parameters: {'n_estimators': 1290, 'learning_rate': 0.06213422147411584, 'max_depth': 12, 'min_samples_split': 20, 'min_samples_leaf': 1, 'subsample': 0.9638247794075456, 'max_features': None}. Best is trial 2282 with value: 0.45359136528270205.
[I 2024-12-04 15:30:43,645] Trial 2488 finished with value: 0.6361895807099102 and parameters: {'n_estimators': 1347, 'learning_rate': 0.05276770413296075, 'max_depth': 12, 'min_samples_split': 20, 'min_samples_leaf': 3, 'subsample': 0.9950421960113315, 'max_features': None}. Best is trial 2282 with value: 0.45359136528270205.
[I 2024-12-04 15:30:43,894] Trial 2498 finished with value: 0.6624075417200057 and parameters: {'n_estimators': 1060, 'learning_rate': 0.08129360135465466, 'max_depth': 12, 'min_samples_split': 20, 'min_samples_leaf': 3, 'subsample': 0.9115567223868778, 'max_features': None}. Best is trial 2282 with value: 0.45359136528270205.
[I 2024-12-04 15:30:43,993] Trial 2491 finished with value: 0.6541048131009511 and parameters: {'n_estimators': 1321, 'learning_rate': 0.07218744551715528, 'max_depth': 12, 'min_samples_split': 17, 'min_samples_leaf': 2, 'subsample': 0.9103232815734134, 'max_features': None}. Best is trial 2282 with value: 0.45359136528270205.
[I 2024-12-04 15:30:44,117] Trial 2492 finished with value: 0.669291197473359 and parameters: {'n_estimators': 1347, 'learning_rate': 0.0566089715434288, 'max_depth': 12, 'min_samples_split': 16, 'min_samples_leaf': 3, 'subsample': 0.922410822877642, 'max_features': None}. Best is trial 2282 with value: 0.45359136528270205.
[I 2024-12-04 15:30:44,121] Trial 2495 finished with value: 0.6578862540682242 and parameters: {'n_estimators': 1234, 'learning_rate': 0.07943633852387703, 'max_depth': 12, 'min_samples_split': 20, 'min_samples_leaf': 2, 'subsample': 0.8471861337618056, 'max_features': None}. Best is trial 2282 with value: 0.45359136528270205.
[I 2024-12-04 15:30:44,644] Trial 2499 finished with value: 0.5881590574304182 and parameters: {'n_estimators': 1330, 'learning_rate': 0.042774314745977995, 'max_depth': 7, 'min_samples_split': 13, 'min_samples_leaf': 5, 'subsample': 0.9941254264242909, 'max_features': None}. Best is trial 2282 with value: 0.45359136528270205.
[I 2024-12-04 15:30:44,728] Trial 2494 finished with value: 0.5103667237483888 and parameters: {'n_estimators': 1438, 'learning_rate': 0.06762292027701385, 'max_depth': 11, 'min_samples_split': 15, 'min_samples_leaf': 1, 'subsample': 0.9014050604255547, 'max_features': None}. Best is trial 2282 with value: 0.45359136528270205.
[I 2024-12-04 15:30:45,246] Trial 2497 finished with value: 0.48418637736305253 and parameters: {'n_estimators': 1467, 'learning_rate': 0.07031011270042474, 'max_depth': 10, 'min_samples_split': 20, 'min_samples_leaf': 1, 'subsample': 0.979406359860644, 'max_features': None}. Best is trial 2282 with value: 0.45359136528270205.
