[I 2024-12-04 11:57:28,801] Trial 928 finished with value: 0.6173991381853421 and parameters: {'max_depth': 28, 'min_samples_split': 12, 'min_samples_leaf': 1, 'max_features': 'sqrt', 'criterion': 'friedman_mse', 'splitter': 'random'}. Best is trial 458 with value: 0.430928156546456.
[I 2024-12-04 11:57:29,306] Trial 917 finished with value: 0.9900601369499413 and parameters: {'max_depth': 2, 'min_samples_split': 5, 'min_samples_leaf': 4, 'max_features': 'log2', 'criterion': 'absolute_error', 'splitter': 'best'}. Best is trial 458 with value: 0.430928156546456.
[I 2024-12-04 11:57:29,653] Trial 938 finished with value: 0.5220453594633404 and parameters: {'max_depth': 29, 'min_samples_split': 14, 'min_samples_leaf': 1, 'max_features': 'sqrt', 'criterion': 'friedman_mse', 'splitter': 'best'}. Best is trial 458 with value: 0.430928156546456.
[I 2024-12-04 11:57:30,020] Trial 921 finished with value: 0.48913122864637676 and parameters: {'max_depth': 35, 'min_samples_split': 16, 'min_samples_leaf': 1, 'max_features': 'sqrt', 'criterion': 'friedman_mse', 'splitter': 'best'}. Best is trial 458 with value: 0.430928156546456.
[I 2024-12-04 11:57:30,036] Trial 914 finished with value: 0.5978049537805264 and parameters: {'max_depth': 34, 'min_samples_split': 12, 'min_samples_leaf': 1, 'max_features': 'log2', 'criterion': 'friedman_mse', 'splitter': 'best'}. Best is trial 458 with value: 0.430928156546456.
[I 2024-12-04 11:57:30,046] Trial 931 finished with value: 0.9672233286520945 and parameters: {'max_depth': 2, 'min_samples_split': 3, 'min_samples_leaf': 10, 'max_features': 'sqrt', 'criterion': 'squared_error', 'splitter': 'random'}. Best is trial 458 with value: 0.430928156546456.
[I 2024-12-04 11:57:30,050] Trial 932 finished with value: 0.584300197786044 and parameters: {'max_depth': 35, 'min_samples_split': 14, 'min_samples_leaf': 3, 'max_features': 'sqrt', 'criterion': 'friedman_mse', 'splitter': 'best'}. Best is trial 458 with value: 0.430928156546456.
[I 2024-12-04 11:57:30,142] Trial 916 finished with value: 0.9597516113963797 and parameters: {'max_depth': 27, 'min_samples_split': 19, 'min_samples_leaf': 6, 'max_features': 'sqrt', 'criterion': 'friedman_mse', 'splitter': 'random'}. Best is trial 458 with value: 0.430928156546456.
[I 2024-12-04 11:57:30,300] Trial 926 finished with value: 0.48720407820762895 and parameters: {'max_depth': 29, 'min_samples_split': 12, 'min_samples_leaf': 1, 'max_features': 'sqrt', 'criterion': 'friedman_mse', 'splitter': 'best'}. Best is trial 458 with value: 0.430928156546456.
[I 2024-12-04 11:57:30,339] Trial 937 finished with value: 0.5459840798044118 and parameters: {'max_depth': 35, 'min_samples_split': 12, 'min_samples_leaf': 2, 'max_features': 'sqrt', 'criterion': 'squared_error', 'splitter': 'best'}. Best is trial 458 with value: 0.430928156546456.
[I 2024-12-04 11:57:30,350] Trial 925 finished with value: 0.584300197786044 and parameters: {'max_depth': 29, 'min_samples_split': 13, 'min_samples_leaf': 3, 'max_features': 'sqrt', 'criterion': 'friedman_mse', 'splitter': 'best'}. Best is trial 458 with value: 0.430928156546456.
[I 2024-12-04 11:57:31,206] Trial 935 finished with value: 0.47495142754566344 and parameters: {'max_depth': 35, 'min_samples_split': 11, 'min_samples_leaf': 1, 'max_features': 'sqrt', 'criterion': 'friedman_mse', 'splitter': 'best'}. Best is trial 458 with value: 0.430928156546456.
[I 2024-12-04 11:57:32,387] Trial 933 finished with value: 0.5012455514307295 and parameters: {'max_depth': 30, 'min_samples_split': 11, 'min_samples_leaf': 1, 'max_features': 'sqrt', 'criterion': 'friedman_mse', 'splitter': 'best'}. Best is trial 458 with value: 0.430928156546456.
[I 2024-12-04 11:57:32,505] Trial 942 finished with value: 0.47344856982335537 and parameters: {'max_depth': 35, 'min_samples_split': 12, 'min_samples_leaf': 1, 'max_features': 'sqrt', 'criterion': 'squared_error', 'splitter': 'best'}. Best is trial 458 with value: 0.430928156546456.
[I 2024-12-04 11:57:33,403] Trial 947 finished with value: 0.9984670529576771 and parameters: {'max_depth': 24, 'min_samples_split': 2, 'min_samples_leaf': 10, 'max_features': 'log2', 'criterion': 'absolute_error', 'splitter': 'random'}. Best is trial 458 with value: 0.430928156546456.
[I 2024-12-04 11:57:33,690] Trial 941 finished with value: 0.5558626758359966 and parameters: {'max_depth': 35, 'min_samples_split': 15, 'min_samples_leaf': 1, 'max_features': 'sqrt', 'criterion': 'absolute_error', 'splitter': 'best'}. Best is trial 458 with value: 0.430928156546456.
[I 2024-12-04 11:57:33,749] Trial 944 finished with value: 0.546917052743445 and parameters: {'max_depth': 35, 'min_samples_split': 19, 'min_samples_leaf': 2, 'max_features': 'sqrt', 'criterion': 'friedman_mse', 'splitter': 'best'}. Best is trial 458 with value: 0.430928156546456.
[I 2024-12-04 11:57:34,384] Trial 940 finished with value: 0.4615785299849214 and parameters: {'max_depth': 35, 'min_samples_split': 10, 'min_samples_leaf': 1, 'max_features': 'sqrt', 'criterion': 'friedman_mse', 'splitter': 'best'}. Best is trial 458 with value: 0.430928156546456.
[I 2024-12-04 11:57:34,500] Trial 948 finished with value: 0.5641364352696134 and parameters: {'max_depth': 35, 'min_samples_split': 16, 'min_samples_leaf': 2, 'max_features': 'sqrt', 'criterion': 'friedman_mse', 'splitter': 'best'}. Best is trial 458 with value: 0.430928156546456.
[I 2024-12-04 11:57:34,736] Trial 945 finished with value: 0.5220453594633404 and parameters: {'max_depth': 29, 'min_samples_split': 14, 'min_samples_leaf': 1, 'max_features': 'sqrt', 'criterion': 'friedman_mse', 'splitter': 'best'}. Best is trial 458 with value: 0.430928156546456.
[I 2024-12-04 11:57:34,888] Trial 930 finished with value: 0.4856187310523648 and parameters: {'max_depth': 34, 'min_samples_split': 13, 'min_samples_leaf': 1, 'max_features': 'sqrt', 'criterion': 'friedman_mse', 'splitter': 'best'}. Best is trial 458 with value: 0.430928156546456.
[I 2024-12-04 11:57:35,079] Trial 946 finished with value: 0.4399442512678781 and parameters: {'max_depth': 35, 'min_samples_split': 14, 'min_samples_leaf': 1, 'max_features': 'sqrt', 'criterion': 'friedman_mse', 'splitter': 'best'}. Best is trial 458 with value: 0.430928156546456.
[I 2024-12-04 11:57:35,646] Trial 951 finished with value: 0.48913122864637676 and parameters: {'max_depth': 35, 'min_samples_split': 16, 'min_samples_leaf': 1, 'max_features': 'sqrt', 'criterion': 'friedman_mse', 'splitter': 'best'}. Best is trial 458 with value: 0.430928156546456.
[I 2024-12-04 11:57:36,213] Trial 943 finished with value: 0.47344856982335537 and parameters: {'max_depth': 35, 'min_samples_split': 12, 'min_samples_leaf': 1, 'max_features': 'sqrt', 'criterion': 'friedman_mse', 'splitter': 'best'}. Best is trial 458 with value: 0.430928156546456.
[I 2024-12-04 11:57:36,216] Trial 936 finished with value: 0.47344856982335537 and parameters: {'max_depth': 35, 'min_samples_split': 12, 'min_samples_leaf': 1, 'max_features': 'sqrt', 'criterion': 'friedman_mse', 'splitter': 'best'}. Best is trial 458 with value: 0.430928156546456.
[I 2024-12-04 11:57:38,250] Trial 954 finished with value: 0.430928156546456 and parameters: {'max_depth': 35, 'min_samples_split': 13, 'min_samples_leaf': 1, 'max_features': 'sqrt', 'criterion': 'friedman_mse', 'splitter': 'best'}. Best is trial 458 with value: 0.430928156546456.
[I 2024-12-04 11:57:38,994] Trial 956 finished with value: 0.5319670614340929 and parameters: {'max_depth': 29, 'min_samples_split': 15, 'min_samples_leaf': 1, 'max_features': 'sqrt', 'criterion': 'friedman_mse', 'splitter': 'best'}. Best is trial 458 with value: 0.430928156546456.
[I 2024-12-04 11:57:39,698] Trial 949 finished with value: 0.584300197786044 and parameters: {'max_depth': 31, 'min_samples_split': 14, 'min_samples_leaf': 3, 'max_features': 'sqrt', 'criterion': 'friedman_mse', 'splitter': 'best'}. Best is trial 458 with value: 0.430928156546456.
[I 2024-12-04 11:57:39,889] Trial 957 finished with value: 0.5897306832652978 and parameters: {'max_depth': 33, 'min_samples_split': 11, 'min_samples_leaf': 4, 'max_features': 'sqrt', 'criterion': 'absolute_error', 'splitter': 'best'}. Best is trial 458 with value: 0.430928156546456.
[I 2024-12-04 11:57:39,968] Trial 939 finished with value: 0.584300197786044 and parameters: {'max_depth': 31, 'min_samples_split': 12, 'min_samples_leaf': 3, 'max_features': 'sqrt', 'criterion': 'friedman_mse', 'splitter': 'best'}. Best is trial 458 with value: 0.430928156546456.
[I 2024-12-04 11:57:40,123] Trial 952 finished with value: 0.584300197786044 and parameters: {'max_depth': 35, 'min_samples_split': 13, 'min_samples_leaf': 3, 'max_features': 'sqrt', 'criterion': 'friedman_mse', 'splitter': 'best'}. Best is trial 458 with value: 0.430928156546456.
[I 2024-12-04 11:57:40,459] Trial 953 finished with value: 0.584022525745178 and parameters: {'max_depth': 29, 'min_samples_split': 11, 'min_samples_leaf': 3, 'max_features': 'sqrt', 'criterion': 'friedman_mse', 'splitter': 'best'}. Best is trial 458 with value: 0.430928156546456.
[I 2024-12-04 11:57:40,599] Trial 959 finished with value: 0.4399442512678781 and parameters: {'max_depth': 35, 'min_samples_split': 14, 'min_samples_leaf': 1, 'max_features': 'sqrt', 'criterion': 'friedman_mse', 'splitter': 'best'}. Best is trial 458 with value: 0.430928156546456.
[I 2024-12-04 11:57:40,864] Trial 965 finished with value: 0.47495142754566344 and parameters: {'max_depth': 35, 'min_samples_split': 11, 'min_samples_leaf': 1, 'max_features': 'sqrt', 'criterion': 'friedman_mse', 'splitter': 'best'}. Best is trial 458 with value: 0.430928156546456.
[I 2024-12-04 11:57:41,122] Trial 966 finished with value: 0.47495142754566344 and parameters: {'max_depth': 35, 'min_samples_split': 11, 'min_samples_leaf': 1, 'max_features': 'sqrt', 'criterion': 'friedman_mse', 'splitter': 'best'}. Best is trial 458 with value: 0.430928156546456.
[I 2024-12-04 11:57:41,664] Trial 964 finished with value: 0.4399442512678781 and parameters: {'max_depth': 35, 'min_samples_split': 14, 'min_samples_leaf': 1, 'max_features': 'sqrt', 'criterion': 'friedman_mse', 'splitter': 'best'}. Best is trial 458 with value: 0.430928156546456.
[I 2024-12-04 11:57:41,816] Trial 960 finished with value: 0.5526281900399846 and parameters: {'max_depth': 30, 'min_samples_split': 15, 'min_samples_leaf': 1, 'max_features': 'sqrt', 'criterion': 'friedman_mse', 'splitter': 'best'}. Best is trial 458 with value: 0.430928156546456.
[I 2024-12-04 11:57:42,056] Trial 961 finished with value: 0.606184641299422 and parameters: {'max_depth': 29, 'min_samples_split': 13, 'min_samples_leaf': 2, 'max_features': 'sqrt', 'criterion': 'friedman_mse', 'splitter': 'best'}. Best is trial 458 with value: 0.430928156546456.
[I 2024-12-04 11:57:42,061] Trial 962 finished with value: 0.8308936882246339 and parameters: {'max_depth': 35, 'min_samples_split': 15, 'min_samples_leaf': 2, 'max_features': 'sqrt', 'criterion': 'absolute_error', 'splitter': 'random'}. Best is trial 458 with value: 0.430928156546456.
[I 2024-12-04 11:57:42,686] Trial 967 finished with value: 0.5028340388552847 and parameters: {'max_depth': 35, 'min_samples_split': 14, 'min_samples_leaf': 2, 'max_features': 'sqrt', 'criterion': 'friedman_mse', 'splitter': 'best'}. Best is trial 458 with value: 0.430928156546456.
[I 2024-12-04 11:57:43,089] Trial 950 finished with value: 0.5178360218831576 and parameters: {'max_depth': 29, 'min_samples_split': 11, 'min_samples_leaf': 1, 'max_features': 'sqrt', 'criterion': 'friedman_mse', 'splitter': 'best'}. Best is trial 458 with value: 0.430928156546456.
[I 2024-12-04 11:57:43,369] Trial 955 finished with value: 0.5459840798044118 and parameters: {'max_depth': 35, 'min_samples_split': 12, 'min_samples_leaf': 2, 'max_features': 'sqrt', 'criterion': 'friedman_mse', 'splitter': 'best'}. Best is trial 458 with value: 0.430928156546456.
[I 2024-12-04 11:57:43,702] Trial 971 finished with value: 0.6908981485189626 and parameters: {'max_depth': 24, 'min_samples_split': 20, 'min_samples_leaf': 2, 'max_features': 'sqrt', 'criterion': 'absolute_error', 'splitter': 'best'}. Best is trial 458 with value: 0.430928156546456.
[I 2024-12-04 11:57:43,709] Trial 963 finished with value: 0.47344856982335537 and parameters: {'max_depth': 35, 'min_samples_split': 12, 'min_samples_leaf': 1, 'max_features': 'sqrt', 'criterion': 'friedman_mse', 'splitter': 'best'}. Best is trial 458 with value: 0.430928156546456.
[I 2024-12-04 11:57:43,939] Trial 958 finished with value: 0.6998674134299121 and parameters: {'max_depth': 35, 'min_samples_split': 10, 'min_samples_leaf': 2, 'max_features': 'sqrt', 'criterion': 'friedman_mse', 'splitter': 'random'}. Best is trial 458 with value: 0.430928156546456.
[I 2024-12-04 11:57:44,160] Trial 978 finished with value: 0.48363356796891666 and parameters: {'max_depth': 30, 'min_samples_split': 14, 'min_samples_leaf': 1, 'max_features': 'sqrt', 'criterion': 'friedman_mse', 'splitter': 'best'}. Best is trial 458 with value: 0.430928156546456.
[I 2024-12-04 11:57:44,713] Trial 968 finished with value: 0.5012455514307295 and parameters: {'max_depth': 30, 'min_samples_split': 11, 'min_samples_leaf': 1, 'max_features': 'sqrt', 'criterion': 'friedman_mse', 'splitter': 'best'}. Best is trial 458 with value: 0.430928156546456.
[I 2024-12-04 11:57:45,342] Trial 970 finished with value: 0.4399442512678781 and parameters: {'max_depth': 35, 'min_samples_split': 14, 'min_samples_leaf': 1, 'max_features': 'sqrt', 'criterion': 'friedman_mse', 'splitter': 'best'}. Best is trial 458 with value: 0.430928156546456.
[I 2024-12-04 11:57:45,535] Trial 975 finished with value: 0.4399442512678781 and parameters: {'max_depth': 35, 'min_samples_split': 14, 'min_samples_leaf': 1, 'max_features': 'sqrt', 'criterion': 'friedman_mse', 'splitter': 'best'}. Best is trial 458 with value: 0.430928156546456.
[I 2024-12-04 11:57:45,536] Trial 969 finished with value: 0.584300197786044 and parameters: {'max_depth': 35, 'min_samples_split': 12, 'min_samples_leaf': 3, 'max_features': 'sqrt', 'criterion': 'friedman_mse', 'splitter': 'best'}. Best is trial 458 with value: 0.430928156546456.
[I 2024-12-04 11:57:46,066] Trial 980 finished with value: 0.5319670614340929 and parameters: {'max_depth': 29, 'min_samples_split': 15, 'min_samples_leaf': 1, 'max_features': 'sqrt', 'criterion': 'friedman_mse', 'splitter': 'best'}. Best is trial 458 with value: 0.430928156546456.
[I 2024-12-04 11:57:46,232] Trial 977 finished with value: 0.584300197786044 and parameters: {'max_depth': 35, 'min_samples_split': 16, 'min_samples_leaf': 3, 'max_features': 'sqrt', 'criterion': 'friedman_mse', 'splitter': 'best'}. Best is trial 458 with value: 0.430928156546456.
[I 2024-12-04 11:57:46,699] Trial 981 finished with value: 0.48913122864637676 and parameters: {'max_depth': 35, 'min_samples_split': 16, 'min_samples_leaf': 1, 'max_features': 'sqrt', 'criterion': 'friedman_mse', 'splitter': 'best'}. Best is trial 458 with value: 0.430928156546456.
[I 2024-12-04 11:57:47,096] Trial 972 finished with value: 0.47344856982335537 and parameters: {'max_depth': 35, 'min_samples_split': 12, 'min_samples_leaf': 1, 'max_features': 'sqrt', 'criterion': 'friedman_mse', 'splitter': 'best'}. Best is trial 458 with value: 0.430928156546456.
[I 2024-12-04 11:57:47,351] Trial 974 finished with value: 0.584022525745178 and parameters: {'max_depth': 35, 'min_samples_split': 11, 'min_samples_leaf': 3, 'max_features': 'sqrt', 'criterion': 'friedman_mse', 'splitter': 'best'}. Best is trial 458 with value: 0.430928156546456.
[I 2024-12-04 11:57:47,484] Trial 979 finished with value: 0.5220174125349513 and parameters: {'max_depth': 35, 'min_samples_split': 10, 'min_samples_leaf': 2, 'max_features': 'sqrt', 'criterion': 'friedman_mse', 'splitter': 'best'}. Best is trial 458 with value: 0.430928156546456.
[I 2024-12-04 11:57:48,688] Trial 973 finished with value: 0.4615785299849214 and parameters: {'max_depth': 35, 'min_samples_split': 10, 'min_samples_leaf': 1, 'max_features': 'sqrt', 'criterion': 'friedman_mse', 'splitter': 'best'}. Best is trial 458 with value: 0.430928156546456.
[I 2024-12-04 11:57:49,890] Trial 986 finished with value: 0.5891275847995837 and parameters: {'max_depth': 35, 'min_samples_split': 14, 'min_samples_leaf': 1, 'max_features': 'sqrt', 'criterion': 'friedman_mse', 'splitter': 'random'}. Best is trial 458 with value: 0.430928156546456.
[I 2024-12-04 11:57:50,841] Trial 988 finished with value: 0.8459484779449206 and parameters: {'max_depth': 35, 'min_samples_split': 13, 'min_samples_leaf': 2, 'max_features': 'log2', 'criterion': 'friedman_mse', 'splitter': 'best'}. Best is trial 458 with value: 0.430928156546456.
[I 2024-12-04 11:57:51,557] Trial 990 finished with value: 0.9725499273319154 and parameters: {'max_depth': 2, 'min_samples_split': 9, 'min_samples_leaf': 8, 'max_features': 'sqrt', 'criterion': 'friedman_mse', 'splitter': 'best'}. Best is trial 458 with value: 0.430928156546456.
[I 2024-12-04 11:57:52,221] Trial 987 finished with value: 0.584300197786044 and parameters: {'max_depth': 35, 'min_samples_split': 14, 'min_samples_leaf': 3, 'max_features': 'sqrt', 'criterion': 'friedman_mse', 'splitter': 'best'}. Best is trial 458 with value: 0.430928156546456.
[I 2024-12-04 11:57:52,229] Trial 989 finished with value: 0.48913122864637676 and parameters: {'max_depth': 35, 'min_samples_split': 16, 'min_samples_leaf': 1, 'max_features': 'sqrt', 'criterion': 'friedman_mse', 'splitter': 'best'}. Best is trial 458 with value: 0.430928156546456.
[I 2024-12-04 11:57:53,027] Trial 984 finished with value: 0.430928156546456 and parameters: {'max_depth': 35, 'min_samples_split': 13, 'min_samples_leaf': 1, 'max_features': 'sqrt', 'criterion': 'friedman_mse', 'splitter': 'best'}. Best is trial 458 with value: 0.430928156546456.
[I 2024-12-04 11:57:53,071] Trial 995 finished with value: 0.47344856982335537 and parameters: {'max_depth': 35, 'min_samples_split': 12, 'min_samples_leaf': 1, 'max_features': 'sqrt', 'criterion': 'friedman_mse', 'splitter': 'best'}. Best is trial 458 with value: 0.430928156546456.
[I 2024-12-04 11:57:53,073] Trial 982 finished with value: 0.7151810623565261 and parameters: {'max_depth': 26, 'min_samples_split': 16, 'min_samples_leaf': 2, 'max_features': 'sqrt', 'criterion': 'friedman_mse', 'splitter': 'random'}. Best is trial 458 with value: 0.430928156546456.
[I 2024-12-04 11:57:53,655] Trial 976 finished with value: 0.4399442512678781 and parameters: {'max_depth': 35, 'min_samples_split': 14, 'min_samples_leaf': 1, 'max_features': 'sqrt', 'criterion': 'friedman_mse', 'splitter': 'best'}. Best is trial 458 with value: 0.430928156546456.
[I 2024-12-04 11:57:54,296] Trial 991 finished with value: 0.5178071867440288 and parameters: {'max_depth': 30, 'min_samples_split': 12, 'min_samples_leaf': 1, 'max_features': 'sqrt', 'criterion': 'friedman_mse', 'splitter': 'best'}. Best is trial 458 with value: 0.430928156546456.
[I 2024-12-04 11:57:54,297] Trial 993 finished with value: 0.8749513985121661 and parameters: {'max_depth': 13, 'min_samples_split': 7, 'min_samples_leaf': 3, 'max_features': 'sqrt', 'criterion': 'absolute_error', 'splitter': 'random'}. Best is trial 458 with value: 0.430928156546456.
[I 2024-12-04 11:57:54,396] Trial 983 finished with value: 0.4713924065212343 and parameters: {'max_depth': 30, 'min_samples_split': 13, 'min_samples_leaf': 1, 'max_features': 'sqrt', 'criterion': 'friedman_mse', 'splitter': 'best'}. Best is trial 458 with value: 0.430928156546456.
[I 2024-12-04 11:57:54,484] Trial 997 finished with value: 0.584300197786044 and parameters: {'max_depth': 29, 'min_samples_split': 16, 'min_samples_leaf': 3, 'max_features': 'sqrt', 'criterion': 'friedman_mse', 'splitter': 'best'}. Best is trial 458 with value: 0.430928156546456.
[I 2024-12-04 11:57:55,066] Trial 999 finished with value: 0.5717896984073306 and parameters: {'max_depth': 35, 'min_samples_split': 12, 'min_samples_leaf': 1, 'max_features': 'sqrt', 'criterion': 'absolute_error', 'splitter': 'best'}. Best is trial 458 with value: 0.430928156546456.
[I 2024-12-04 11:57:55,645] Trial 992 finished with value: 0.5019923841314047 and parameters: {'max_depth': 29, 'min_samples_split': 13, 'min_samples_leaf': 1, 'max_features': 'sqrt', 'criterion': 'friedman_mse', 'splitter': 'best'}. Best is trial 458 with value: 0.430928156546456.
[I 2024-12-04 11:57:55,651] Trial 1005 finished with value: 0.4615785299849214 and parameters: {'max_depth': 35, 'min_samples_split': 10, 'min_samples_leaf': 1, 'max_features': 'sqrt', 'criterion': 'friedman_mse', 'splitter': 'best'}. Best is trial 458 with value: 0.430928156546456.
[I 2024-12-04 11:57:55,883] Trial 998 finished with value: 0.5319670614340929 and parameters: {'max_depth': 29, 'min_samples_split': 15, 'min_samples_leaf': 1, 'max_features': 'sqrt', 'criterion': 'friedman_mse', 'splitter': 'best'}. Best is trial 458 with value: 0.430928156546456.
[I 2024-12-04 11:57:56,168] Trial 985 finished with value: 0.998127234894583 and parameters: {'max_depth': 11, 'min_samples_split': 18, 'min_samples_leaf': 8, 'max_features': 'log2', 'criterion': 'squared_error', 'splitter': 'random'}. Best is trial 458 with value: 0.430928156546456.
[I 2024-12-04 11:57:56,196] Trial 1009 finished with value: 0.4399442512678781 and parameters: {'max_depth': 35, 'min_samples_split': 14, 'min_samples_leaf': 1, 'max_features': 'sqrt', 'criterion': 'friedman_mse', 'splitter': 'best'}. Best is trial 458 with value: 0.430928156546456.
[I 2024-12-04 11:57:56,297] Trial 1003 finished with value: 0.584300197786044 and parameters: {'max_depth': 30, 'min_samples_split': 14, 'min_samples_leaf': 3, 'max_features': 'sqrt', 'criterion': 'friedman_mse', 'splitter': 'best'}. Best is trial 458 with value: 0.430928156546456.
