[I 2024-12-03 18:47:58,070] Trial 1509 finished with value: 0.4985884147281529 and parameters: {'kernel': 'rbf', 'C': 99.59148724934516, 'gamma': 0.004882699627598357, 'epsilon': 0.07777414692635348}. Best is trial 1119 with value: 0.4485361816812923.
[I 2024-12-03 18:47:58,332] Trial 1522 finished with value: 0.47360927772817357 and parameters: {'kernel': 'rbf', 'C': 17.67561723622193, 'gamma': 0.028532206371908515, 'epsilon': 0.06385707021297668}. Best is trial 1119 with value: 0.4485361816812923.
[I 2024-12-03 18:47:58,453] Trial 1531 finished with value: 0.6511543505812698 and parameters: {'kernel': 'rbf', 'C': 89.16541427143696, 'gamma': 0.0005241235680104409, 'epsilon': 0.072978783748355}. Best is trial 1119 with value: 0.4485361816812923.
[I 2024-12-03 18:47:58,606] Trial 1525 finished with value: 0.5220520158461242 and parameters: {'kernel': 'rbf', 'C': 16.569485258414993, 'gamma': 0.05858453560749235, 'epsilon': 0.09288297586782697}. Best is trial 1119 with value: 0.4485361816812923.
[I 2024-12-03 18:47:58,954] Trial 1539 finished with value: 0.5511132586066358 and parameters: {'kernel': 'rbf', 'C': 99.043136077542, 'gamma': 0.0027546212215732806, 'epsilon': 0.1060728183097041}. Best is trial 1119 with value: 0.4485361816812923.
[I 2024-12-03 18:47:59,126] Trial 1540 finished with value: 0.6183253968595831 and parameters: {'kernel': 'rbf', 'C': 90.3691462266161, 'gamma': 0.07907639637855195, 'epsilon': 0.10303961765618713}. Best is trial 1119 with value: 0.4485361816812923.
[I 2024-12-03 18:47:59,152] Trial 1538 finished with value: 0.9127396738652442 and parameters: {'kernel': 'poly', 'C': 86.25551333253642, 'gamma': 0.00922875182693975, 'epsilon': 0.034543077270816444}. Best is trial 1119 with value: 0.4485361816812923.
[I 2024-12-03 18:47:59,241] Trial 1534 finished with value: 0.4927714792517031 and parameters: {'kernel': 'rbf', 'C': 17.845164736991133, 'gamma': 0.01828386784205745, 'epsilon': 0.20376901289620686}. Best is trial 1119 with value: 0.4485361816812923.
[I 2024-12-03 18:47:59,288] Trial 1536 finished with value: 0.4699721315385157 and parameters: {'kernel': 'rbf', 'C': 91.30467724034976, 'gamma': 0.009182637376532727, 'epsilon': 0.05120027014634861}. Best is trial 1119 with value: 0.4485361816812923.
[I 2024-12-03 18:47:59,969] Trial 1527 finished with value: 0.554037312666651 and parameters: {'kernel': 'linear', 'C': 80.80397058376167, 'gamma': 0.003222137356370989, 'epsilon': 0.013615593262519349}. Best is trial 1119 with value: 0.4485361816812923.
[I 2024-12-03 18:48:00,949] Trial 1544 finished with value: 0.48296958123529815 and parameters: {'kernel': 'rbf', 'C': 25.924869853501146, 'gamma': 0.03060682872900203, 'epsilon': 0.15805530443149166}. Best is trial 1119 with value: 0.4485361816812923.
[I 2024-12-03 18:48:01,194] Trial 1545 finished with value: 0.5158317406288091 and parameters: {'kernel': 'rbf', 'C': 22.159962141060863, 'gamma': 0.05466193815754536, 'epsilon': 0.03493598854665742}. Best is trial 1119 with value: 0.4485361816812923.
[I 2024-12-03 18:48:01,304] Trial 1547 finished with value: 0.6112109003496969 and parameters: {'kernel': 'rbf', 'C': 98.04941960967115, 'gamma': 0.10864745458597917, 'epsilon': 0.033595757830777985}. Best is trial 1119 with value: 0.4485361816812923.
[I 2024-12-03 18:48:01,305] Trial 1542 finished with value: 1.1065460601357564 and parameters: {'kernel': 'poly', 'C': 1.1701288378601584, 'gamma': 0.007466046912697873, 'epsilon': 0.01429503533285323}. Best is trial 1119 with value: 0.4485361816812923.
[I 2024-12-03 18:48:01,534] Trial 1546 finished with value: 0.46483449520924924 and parameters: {'kernel': 'rbf', 'C': 91.16449566393976, 'gamma': 0.012707069149578346, 'epsilon': 0.012206259823012862}. Best is trial 1119 with value: 0.4485361816812923.
[I 2024-12-03 18:48:02,115] Trial 1537 finished with value: 0.6985351207467391 and parameters: {'kernel': 'rbf', 'C': 13.320034023581485, 'gamma': 0.0019531250371657744, 'epsilon': 0.059697899595960516}. Best is trial 1119 with value: 0.4485361816812923.
[I 2024-12-03 18:48:02,153] Trial 1529 finished with value: 1.2944976164157767 and parameters: {'kernel': 'sigmoid', 'C': 0.6293710753915109, 'gamma': 0.00019621121898279756, 'epsilon': 0.023229715950759462}. Best is trial 1119 with value: 0.4485361816812923.
[I 2024-12-03 18:48:02,843] Trial 1543 finished with value: 0.5401229771734714 and parameters: {'kernel': 'rbf', 'C': 15.929784653737647, 'gamma': 0.009414473310672423, 'epsilon': 0.044478444774641274}. Best is trial 1119 with value: 0.4485361816812923.
[I 2024-12-03 18:48:02,952] Trial 1552 finished with value: 0.476650441445785 and parameters: {'kernel': 'rbf', 'C': 29.064732766530675, 'gamma': 0.014052929915862319, 'epsilon': 0.12092940699673743}. Best is trial 1119 with value: 0.4485361816812923.
[I 2024-12-03 18:48:03,065] Trial 1549 finished with value: 0.5367101043075079 and parameters: {'kernel': 'rbf', 'C': 88.81207424622292, 'gamma': 0.025254857361978963, 'epsilon': 0.16297913270182915}. Best is trial 1119 with value: 0.4485361816812923.
[I 2024-12-03 18:48:03,209] Trial 1550 finished with value: 0.49651480759291017 and parameters: {'kernel': 'rbf', 'C': 96.59417928403975, 'gamma': 0.026118213749984426, 'epsilon': 0.0515711267536815}. Best is trial 1119 with value: 0.4485361816812923.
[I 2024-12-03 18:48:05,039] Trial 1551 finished with value: 1.2666538768531401 and parameters: {'kernel': 'poly', 'C': 0.04246133037337937, 'gamma': 0.006865630150632455, 'epsilon': 0.006714814890475563}. Best is trial 1119 with value: 0.4485361816812923.
[I 2024-12-03 18:48:05,197] Trial 1535 finished with value: 0.4620674609798664 and parameters: {'kernel': 'rbf', 'C': 24.898262083224974, 'gamma': 0.023403588440723454, 'epsilon': 0.04296063430800335}. Best is trial 1119 with value: 0.4485361816812923.
[I 2024-12-03 18:48:05,323] Trial 1541 finished with value: 0.48811917900661234 and parameters: {'kernel': 'rbf', 'C': 91.05963889685592, 'gamma': 0.006891500930413785, 'epsilon': 0.09573287627608759}. Best is trial 1119 with value: 0.4485361816812923.
[I 2024-12-03 18:48:05,376] Trial 1558 finished with value: 0.4599919002723874 and parameters: {'kernel': 'rbf', 'C': 91.46850490800941, 'gamma': 0.013379026227337531, 'epsilon': 0.1151282659277767}. Best is trial 1119 with value: 0.4485361816812923.
[I 2024-12-03 18:48:05,610] Trial 1554 finished with value: 0.5879125689613298 and parameters: {'kernel': 'rbf', 'C': 99.80032212859432, 'gamma': 0.003036589587062222, 'epsilon': 0.2611293500382711}. Best is trial 1119 with value: 0.4485361816812923.
[I 2024-12-03 18:48:05,707] Trial 1560 finished with value: 0.5151608639526314 and parameters: {'kernel': 'rbf', 'C': 25.127563531057007, 'gamma': 0.010070081157080133, 'epsilon': 0.044324143441491735}. Best is trial 1119 with value: 0.4485361816812923.
[I 2024-12-03 18:48:06,031] Trial 1566 finished with value: 0.6301378015887055 and parameters: {'kernel': 'rbf', 'C': 18.938182235462598, 'gamma': 0.002434374469249569, 'epsilon': 0.03978089928849453}. Best is trial 1119 with value: 0.4485361816812923.
[I 2024-12-03 18:48:06,476] Trial 1555 finished with value: 0.5123449075043387 and parameters: {'kernel': 'rbf', 'C': 93.6710879247818, 'gamma': 0.02930018772910324, 'epsilon': 0.019959507258174473}. Best is trial 1119 with value: 0.4485361816812923.
[I 2024-12-03 18:48:07,138] Trial 1563 finished with value: 0.565729215226357 and parameters: {'kernel': 'linear', 'C': 51.60834064575384, 'gamma': 0.010518974984437721, 'epsilon': 0.045370384531481685}. Best is trial 1119 with value: 0.4485361816812923.
[I 2024-12-03 18:48:07,245] Trial 1557 finished with value: 0.5150304501180154 and parameters: {'kernel': 'rbf', 'C': 18.684491120234775, 'gamma': 0.012687413757241788, 'epsilon': 0.03909373710798665}. Best is trial 1119 with value: 0.4485361816812923.
[I 2024-12-03 18:48:07,296] Trial 1561 finished with value: 0.7903038092266894 and parameters: {'kernel': 'linear', 'C': 0.005878717855707739, 'gamma': 0.8568476652601505, 'epsilon': 0.8476502731131685}. Best is trial 1119 with value: 0.4485361816812923.
[I 2024-12-03 18:48:07,431] Trial 1559 finished with value: 0.5644821819559106 and parameters: {'kernel': 'rbf', 'C': 99.87644864639879, 'gamma': 0.03685006504159342, 'epsilon': 0.08206783245154922}. Best is trial 1119 with value: 0.4485361816812923.
[I 2024-12-03 18:48:08,089] Trial 1565 finished with value: 1.113972129988009 and parameters: {'kernel': 'poly', 'C': 10.811392919381067, 'gamma': 0.006030650897440622, 'epsilon': 0.4486678378320723}. Best is trial 1119 with value: 0.4485361816812923.
[I 2024-12-03 18:48:08,091] Trial 1562 finished with value: 0.543331650331743 and parameters: {'kernel': 'rbf', 'C': 91.5380529771439, 'gamma': 0.028351791750256154, 'epsilon': 0.14784566816052544}. Best is trial 1119 with value: 0.4485361816812923.
[I 2024-12-03 18:48:08,397] Trial 1571 finished with value: 0.5013274583565175 and parameters: {'kernel': 'rbf', 'C': 98.50884745084872, 'gamma': 0.004620611194671143, 'epsilon': 0.06403475166689422}. Best is trial 1119 with value: 0.4485361816812923.
[I 2024-12-03 18:48:09,203] Trial 1553 finished with value: 96.28366364410095 and parameters: {'kernel': 'sigmoid', 'C': 21.698469569734222, 'gamma': 0.023419568491528493, 'epsilon': 0.07411956881315075}. Best is trial 1119 with value: 0.4485361816812923.
[I 2024-12-03 18:48:09,215] Trial 1573 finished with value: 1.128659541392589 and parameters: {'kernel': 'sigmoid', 'C': 1.9635076058890728, 'gamma': 0.0001561607430149272, 'epsilon': 0.9991107660926414}. Best is trial 1119 with value: 0.4485361816812923.
[I 2024-12-03 18:48:09,281] Trial 1564 finished with value: 0.493306380439922 and parameters: {'kernel': 'rbf', 'C': 24.667619806531636, 'gamma': 0.013410552753975877, 'epsilon': 0.09102471572491819}. Best is trial 1119 with value: 0.4485361816812923.
[I 2024-12-03 18:48:09,592] Trial 1556 finished with value: 0.6217125575958672 and parameters: {'kernel': 'rbf', 'C': 4.864594481957599, 'gamma': 0.009802577944401177, 'epsilon': 0.014293959589212757}. Best is trial 1119 with value: 0.4485361816812923.
[I 2024-12-03 18:48:09,648] Trial 1572 finished with value: 0.470024955589187 and parameters: {'kernel': 'rbf', 'C': 94.67777341849175, 'gamma': 0.008624103115925716, 'epsilon': 0.07104442081846546}. Best is trial 1119 with value: 0.4485361816812923.
[I 2024-12-03 18:48:10,030] Trial 1570 finished with value: 0.45663033623054705 and parameters: {'kernel': 'rbf', 'C': 93.84034569334123, 'gamma': 0.014731014112316046, 'epsilon': 0.03595575033734251}. Best is trial 1119 with value: 0.4485361816812923.
[I 2024-12-03 18:48:10,035] Trial 1576 finished with value: 0.4653763196681147 and parameters: {'kernel': 'rbf', 'C': 98.36007894655809, 'gamma': 0.019377466892600333, 'epsilon': 0.04418060503668682}. Best is trial 1119 with value: 0.4485361816812923.
[I 2024-12-03 18:48:10,355] Trial 1567 finished with value: 0.5701372396138589 and parameters: {'kernel': 'linear', 'C': 98.9194282307407, 'gamma': 0.0015404662884926403, 'epsilon': 0.09981706117576845}. Best is trial 1119 with value: 0.4485361816812923.
[I 2024-12-03 18:48:10,552] Trial 1577 finished with value: 0.4574772317240572 and parameters: {'kernel': 'rbf', 'C': 97.31855625163062, 'gamma': 0.012442469087476251, 'epsilon': 0.02863938869723929}. Best is trial 1119 with value: 0.4485361816812923.
[I 2024-12-03 18:48:11,408] Trial 1548 finished with value: 0.5668517219881141 and parameters: {'kernel': 'linear', 'C': 92.48571950213045, 'gamma': 0.007485717994744158, 'epsilon': 0.05364833274482599}. Best is trial 1119 with value: 0.4485361816812923.
[I 2024-12-03 18:48:11,899] Trial 1575 finished with value: 0.8845207564222081 and parameters: {'kernel': 'rbf', 'C': 0.8466864202318526, 'gamma': 0.45833372090218494, 'epsilon': 0.2283802726034363}. Best is trial 1119 with value: 0.4485361816812923.
[I 2024-12-03 18:48:12,377] Trial 1568 finished with value: 0.49849036390115087 and parameters: {'kernel': 'rbf', 'C': 95.57791290813903, 'gamma': 0.010085387132474123, 'epsilon': 0.23336829255764624}. Best is trial 1119 with value: 0.4485361816812923.
[I 2024-12-03 18:48:12,749] Trial 1569 finished with value: 0.5845605571083744 and parameters: {'kernel': 'rbf', 'C': 22.353504495897774, 'gamma': 0.08173111147339907, 'epsilon': 0.03679083514006924}. Best is trial 1119 with value: 0.4485361816812923.
[I 2024-12-03 18:48:13,853] Trial 1579 finished with value: 0.6438630220703778 and parameters: {'kernel': 'rbf', 'C': 5.461201013310855, 'gamma': 0.007006594185764002, 'epsilon': 0.1281627939197885}. Best is trial 1119 with value: 0.4485361816812923.
[I 2024-12-03 18:48:13,965] Trial 1586 finished with value: 0.5240289144870874 and parameters: {'kernel': 'rbf', 'C': 97.2825493468888, 'gamma': 0.011648220132795503, 'epsilon': 0.2965076770493286}. Best is trial 1119 with value: 0.4485361816812923.
[I 2024-12-03 18:48:14,183] Trial 1574 finished with value: 0.5631233881311382 and parameters: {'kernel': 'rbf', 'C': 19.16186541665236, 'gamma': 0.006492479021508128, 'epsilon': 0.3342213807559346}. Best is trial 1119 with value: 0.4485361816812923.
[I 2024-12-03 18:48:14,246] Trial 1585 finished with value: 0.5684027186147587 and parameters: {'kernel': 'rbf', 'C': 95.48578742624157, 'gamma': 0.03504720522187624, 'epsilon': 0.15066383773746728}. Best is trial 1119 with value: 0.4485361816812923.
[I 2024-12-03 18:48:14,908] Trial 1582 finished with value: 0.5285048122010233 and parameters: {'kernel': 'rbf', 'C': 15.289632800662103, 'gamma': 0.06082536316441913, 'epsilon': 0.11562481060867705}. Best is trial 1119 with value: 0.4485361816812923.
[I 2024-12-03 18:48:15,006] Trial 1580 finished with value: 434.9229112455716 and parameters: {'kernel': 'sigmoid', 'C': 66.87036471399833, 'gamma': 0.05172386990731988, 'epsilon': 0.11373026516001675}. Best is trial 1119 with value: 0.4485361816812923.
[I 2024-12-03 18:48:15,042] Trial 1587 finished with value: 0.534775373047124 and parameters: {'kernel': 'rbf', 'C': 90.71407452785843, 'gamma': 0.003428936321039921, 'epsilon': 0.037570087524842144}. Best is trial 1119 with value: 0.4485361816812923.
[I 2024-12-03 18:48:15,051] Trial 1581 finished with value: 0.563953004713203 and parameters: {'kernel': 'rbf', 'C': 20.63042305812834, 'gamma': 0.004820134436955489, 'epsilon': 0.08425293432971806}. Best is trial 1119 with value: 0.4485361816812923.
[I 2024-12-03 18:48:15,393] Trial 1590 finished with value: 0.6047928974763463 and parameters: {'kernel': 'rbf', 'C': 94.77445492194698, 'gamma': 0.1610850521993976, 'epsilon': 0.23976010628484243}. Best is trial 1119 with value: 0.4485361816812923.
[I 2024-12-03 18:48:15,770] Trial 1584 finished with value: 0.566742155639822 and parameters: {'kernel': 'rbf', 'C': 27.29005634314214, 'gamma': 0.004131058131431058, 'epsilon': 0.13510312690229118}. Best is trial 1119 with value: 0.4485361816812923.
[I 2024-12-03 18:48:16,132] Trial 1593 finished with value: 0.632048032817217 and parameters: {'kernel': 'rbf', 'C': 95.7743075044924, 'gamma': 0.051876890114903984, 'epsilon': 0.042690387816670054}. Best is trial 1119 with value: 0.4485361816812923.
[I 2024-12-03 18:48:16,631] Trial 1592 finished with value: 1.14191979206546 and parameters: {'kernel': 'sigmoid', 'C': 4.481103080722633, 'gamma': 0.00010887347073072992, 'epsilon': 0.006302049887938058}. Best is trial 1119 with value: 0.4485361816812923.
[I 2024-12-03 18:48:16,954] Trial 1583 finished with value: 0.5591122931985003 and parameters: {'kernel': 'rbf', 'C': 22.809872402317954, 'gamma': 0.005524649650674829, 'epsilon': 0.042419419887188343}. Best is trial 1119 with value: 0.4485361816812923.
[I 2024-12-03 18:48:17,185] Trial 1578 finished with value: 0.5154685859843852 and parameters: {'kernel': 'rbf', 'C': 5.67438637174748, 'gamma': 0.058160347137762844, 'epsilon': 0.03827493873112393}. Best is trial 1119 with value: 0.4485361816812923.
[I 2024-12-03 18:48:17,695] Trial 1594 finished with value: 0.48920166041899776 and parameters: {'kernel': 'rbf', 'C': 89.90341504728356, 'gamma': 0.006856790546455014, 'epsilon': 0.11026666262492192}. Best is trial 1119 with value: 0.4485361816812923.
[I 2024-12-03 18:48:17,930] Trial 1589 finished with value: 0.476270268066696 and parameters: {'kernel': 'rbf', 'C': 29.77175896034642, 'gamma': 0.014862979204189587, 'epsilon': 0.08524571724833598}. Best is trial 1119 with value: 0.4485361816812923.
[I 2024-12-03 18:48:18,406] Trial 1599 finished with value: 0.4983067089718554 and parameters: {'kernel': 'rbf', 'C': 19.31950251352497, 'gamma': 0.04263568972139359, 'epsilon': 0.113928807097006}. Best is trial 1119 with value: 0.4485361816812923.
[I 2024-12-03 18:48:18,804] Trial 1588 finished with value: 0.45780852597645644 and parameters: {'kernel': 'rbf', 'C': 97.76133098834913, 'gamma': 0.011771330953806138, 'epsilon': 0.03130668414337401}. Best is trial 1119 with value: 0.4485361816812923.
[I 2024-12-03 18:48:19,289] Trial 1596 finished with value: 0.4669733960152173 and parameters: {'kernel': 'rbf', 'C': 22.67872558038903, 'gamma': 0.023977827664804382, 'epsilon': 0.06048120065454081}. Best is trial 1119 with value: 0.4485361816812923.
[I 2024-12-03 18:48:20,170] Trial 1597 finished with value: 0.4868512603812675 and parameters: {'kernel': 'rbf', 'C': 93.61272040892464, 'gamma': 0.006543053772915857, 'epsilon': 0.06682500287327454}. Best is trial 1119 with value: 0.4485361816812923.
[I 2024-12-03 18:48:21,173] Trial 1606 finished with value: 0.5449442352487119 and parameters: {'kernel': 'rbf', 'C': 21.809786093520923, 'gamma': 0.006772699439496353, 'epsilon': 0.07279934628706494}. Best is trial 1119 with value: 0.4485361816812923.
[I 2024-12-03 18:48:21,326] Trial 1610 finished with value: 0.5840382861733897 and parameters: {'kernel': 'rbf', 'C': 26.371279558732, 'gamma': 0.0028924687877182127, 'epsilon': 0.027964600348319876}. Best is trial 1119 with value: 0.4485361816812923.
[I 2024-12-03 18:48:21,577] Trial 1595 finished with value: 0.506300980173498 and parameters: {'kernel': 'rbf', 'C': 14.929683450756892, 'gamma': 0.01759324198584958, 'epsilon': 0.018794279871941495}. Best is trial 1119 with value: 0.4485361816812923.
[I 2024-12-03 18:48:21,711] Trial 1591 finished with value: 0.637174538184112 and parameters: {'kernel': 'rbf', 'C': 91.04554194532237, 'gamma': 0.07559874886299305, 'epsilon': 0.048689478297318296}. Best is trial 1119 with value: 0.4485361816812923.
[I 2024-12-03 18:48:21,720] Trial 1605 finished with value: 0.5333577133766688 and parameters: {'kernel': 'rbf', 'C': 19.277684116816072, 'gamma': 0.009260337821703137, 'epsilon': 0.07131093330448511}. Best is trial 1119 with value: 0.4485361816812923.
[I 2024-12-03 18:48:22,247] Trial 1598 finished with value: 0.4823380930155946 and parameters: {'kernel': 'rbf', 'C': 95.43754456970098, 'gamma': 0.016910831824360407, 'epsilon': 0.13848022995478787}. Best is trial 1119 with value: 0.4485361816812923.
[I 2024-12-03 18:48:22,610] Trial 1611 finished with value: 0.6822878377311657 and parameters: {'kernel': 'rbf', 'C': 16.527851816139528, 'gamma': 0.001876456938916125, 'epsilon': 0.08597563279608109}. Best is trial 1119 with value: 0.4485361816812923.
[I 2024-12-03 18:48:22,705] Trial 1600 finished with value: 0.4956189742263088 and parameters: {'kernel': 'rbf', 'C': 95.81539333558914, 'gamma': 0.013440606173289453, 'epsilon': 0.2330143274975069}. Best is trial 1119 with value: 0.4485361816812923.
[I 2024-12-03 18:48:22,846] Trial 1613 finished with value: 0.48887567414792826 and parameters: {'kernel': 'rbf', 'C': 99.72120989885173, 'gamma': 0.006381147436918185, 'epsilon': 0.032598444199783215}. Best is trial 1119 with value: 0.4485361816812923.
[I 2024-12-03 18:48:23,154] Trial 1608 finished with value: 0.5421575810413644 and parameters: {'kernel': 'rbf', 'C': 5.485958470019252, 'gamma': 0.02225435794494455, 'epsilon': 0.07424536413339937}. Best is trial 1119 with value: 0.4485361816812923.
[I 2024-12-03 18:48:23,483] Trial 1609 finished with value: 1.0976188297267275 and parameters: {'kernel': 'poly', 'C': 2.261657262541187, 'gamma': 0.009206569494898845, 'epsilon': 0.0607870665176088}. Best is trial 1119 with value: 0.4485361816812923.
[I 2024-12-03 18:48:23,671] Trial 1602 finished with value: 0.5048967951280962 and parameters: {'kernel': 'rbf', 'C': 21.990071250159836, 'gamma': 0.01473309779334235, 'epsilon': 0.22107078644835093}. Best is trial 1119 with value: 0.4485361816812923.
[I 2024-12-03 18:48:24,147] Trial 1616 finished with value: 0.6080486479288206 and parameters: {'kernel': 'rbf', 'C': 97.66866332695359, 'gamma': 0.0470223798992325, 'epsilon': 0.04869757800356657}. Best is trial 1119 with value: 0.4485361816812923.
[I 2024-12-03 18:48:24,477] Trial 1604 finished with value: 0.6107405068467902 and parameters: {'kernel': 'rbf', 'C': 98.89390360859737, 'gamma': 0.09478037103290174, 'epsilon': 0.08155838945092132}. Best is trial 1119 with value: 0.4485361816812923.
[I 2024-12-03 18:48:24,486] Trial 1614 finished with value: 0.46610818225084927 and parameters: {'kernel': 'rbf', 'C': 93.28677164460127, 'gamma': 0.009262797113975626, 'epsilon': 0.06909667635693865}. Best is trial 1119 with value: 0.4485361816812923.
[I 2024-12-03 18:48:24,839] Trial 1603 finished with value: 0.8348597986359783 and parameters: {'kernel': 'poly', 'C': 26.080405517937297, 'gamma': 0.01910828304411699, 'epsilon': 0.006928977011649592}. Best is trial 1119 with value: 0.4485361816812923.
[I 2024-12-03 18:48:24,840] Trial 1622 finished with value: 0.4917640176175155 and parameters: {'kernel': 'rbf', 'C': 24.5883528407032, 'gamma': 0.013449204557491379, 'epsilon': 0.11097762268851141}. Best is trial 1119 with value: 0.4485361816812923.
[I 2024-12-03 18:48:25,251] Trial 1607 finished with value: 0.46544711242412495 and parameters: {'kernel': 'rbf', 'C': 27.266058736384753, 'gamma': 0.01770260975682396, 'epsilon': 0.04882872120219114}. Best is trial 1119 with value: 0.4485361816812923.
