[I 2024-12-04 19:59:06,190] Trial 468 finished with value: 0.575197082761296 and parameters: {'n_estimators': 201, 'max_depth': 18, 'min_samples_split': 27, 'min_samples_leaf': 3, 'max_features': None, 'bootstrap': False, 'criterion': 'absolute_error'}. Best is trial 457 with value: 0.3223992246327795.
[I 2024-12-04 19:59:07,709] Trial 470 finished with value: 0.3277270602792664 and parameters: {'n_estimators': 450, 'max_depth': 50, 'min_samples_split': 2, 'min_samples_leaf': 1, 'max_features': 'sqrt', 'bootstrap': False, 'criterion': 'squared_error'}. Best is trial 457 with value: 0.3223992246327795.
[I 2024-12-04 19:59:08,119] Trial 471 finished with value: 0.3237337339444885 and parameters: {'n_estimators': 361, 'max_depth': 50, 'min_samples_split': 2, 'min_samples_leaf': 1, 'max_features': 'sqrt', 'bootstrap': False, 'criterion': 'squared_error'}. Best is trial 457 with value: 0.3223992246327795.
[I 2024-12-04 19:59:08,847] Trial 472 finished with value: 0.4179016878679337 and parameters: {'n_estimators': 144, 'max_depth': 40, 'min_samples_split': 3, 'min_samples_leaf': 1, 'max_features': 'sqrt', 'bootstrap': False, 'criterion': 'squared_error'}. Best is trial 457 with value: 0.3223992246327795.
[I 2024-12-04 19:59:09,766] Trial 473 finished with value: 0.4095804233405621 and parameters: {'n_estimators': 371, 'max_depth': 42, 'min_samples_split': 4, 'min_samples_leaf': 1, 'max_features': 'sqrt', 'bootstrap': False, 'criterion': 'squared_error'}. Best is trial 457 with value: 0.3223992246327795.
[I 2024-12-04 19:59:09,947] Trial 474 finished with value: 0.6645226130560462 and parameters: {'n_estimators': 303, 'max_depth': 49, 'min_samples_split': 2, 'min_samples_leaf': 2, 'max_features': 'sqrt', 'bootstrap': False, 'criterion': 'squared_error'}. Best is trial 457 with value: 0.3223992246327795.
[I 2024-12-04 19:59:11,337] Trial 475 finished with value: 0.8694831397715286 and parameters: {'n_estimators': 563, 'max_depth': 12, 'min_samples_split': 5, 'min_samples_leaf': 1, 'max_features': 'sqrt', 'bootstrap': False, 'criterion': 'squared_error'}. Best is trial 457 with value: 0.3223992246327795.
[I 2024-12-04 19:59:15,521] Trial 477 finished with value: 1.0843933292717158 and parameters: {'n_estimators': 500, 'max_depth': 42, 'min_samples_split': 13, 'min_samples_leaf': 4, 'max_features': 'sqrt', 'bootstrap': False, 'criterion': 'absolute_error'}. Best is trial 457 with value: 0.3223992246327795.
[I 2024-12-04 19:59:16,752] Trial 478 finished with value: 0.328537147343293 and parameters: {'n_estimators': 171, 'max_depth': 50, 'min_samples_split': 2, 'min_samples_leaf': 1, 'max_features': 'sqrt', 'bootstrap': False, 'criterion': 'squared_error'}. Best is trial 457 with value: 0.3223992246327795.
[I 2024-12-04 19:59:17,560] Trial 479 finished with value: 0.8248824874093541 and parameters: {'n_estimators': 117, 'max_depth': 14, 'min_samples_split': 3, 'min_samples_leaf': 1, 'max_features': 'sqrt', 'bootstrap': False, 'criterion': 'squared_error'}. Best is trial 457 with value: 0.3223992246327795.
[I 2024-12-04 19:59:19,427] Trial 480 finished with value: 0.3485306766650063 and parameters: {'n_estimators': 389, 'max_depth': 41, 'min_samples_split': 2, 'min_samples_leaf': 1, 'max_features': 'sqrt', 'bootstrap': False, 'criterion': 'squared_error'}. Best is trial 457 with value: 0.3223992246327795.
[I 2024-12-04 19:59:20,494] Trial 481 finished with value: 1.278605232587264 and parameters: {'n_estimators': 430, 'max_depth': 28, 'min_samples_split': 22, 'min_samples_leaf': 12, 'max_features': 'log2', 'bootstrap': True, 'criterion': 'squared_error'}. Best is trial 457 with value: 0.3223992246327795.
[I 2024-12-04 19:59:22,331] Trial 482 finished with value: 0.3230739760881745 and parameters: {'n_estimators': 353, 'max_depth': 50, 'min_samples_split': 2, 'min_samples_leaf': 1, 'max_features': 'sqrt', 'bootstrap': False, 'criterion': 'squared_error'}. Best is trial 457 with value: 0.3223992246327795.
[I 2024-12-04 19:59:23,692] Trial 483 finished with value: 0.3845889553676907 and parameters: {'n_estimators': 312, 'max_depth': 50, 'min_samples_split': 4, 'min_samples_leaf': 1, 'max_features': 'sqrt', 'bootstrap': False, 'criterion': 'squared_error'}. Best is trial 457 with value: 0.3223992246327795.
[I 2024-12-04 19:59:25,345] Trial 484 finished with value: 0.6046547969535458 and parameters: {'n_estimators': 391, 'max_depth': 40, 'min_samples_split': 2, 'min_samples_leaf': 1, 'max_features': 'log2', 'bootstrap': False, 'criterion': 'squared_error'}. Best is trial 457 with value: 0.3223992246327795.
[I 2024-12-04 19:59:27,676] Trial 485 finished with value: 0.3289152627848989 and parameters: {'n_estimators': 487, 'max_depth': 50, 'min_samples_split': 2, 'min_samples_leaf': 1, 'max_features': 'sqrt', 'bootstrap': False, 'criterion': 'squared_error'}. Best is trial 457 with value: 0.3223992246327795.
[I 2024-12-04 19:59:29,339] Trial 486 finished with value: 0.3467765408745016 and parameters: {'n_estimators': 321, 'max_depth': 42, 'min_samples_split': 2, 'min_samples_leaf': 1, 'max_features': 'sqrt', 'bootstrap': False, 'criterion': 'squared_error'}. Best is trial 457 with value: 0.3223992246327795.
[I 2024-12-04 19:59:30,626] Trial 487 finished with value: 0.6922713415789021 and parameters: {'n_estimators': 449, 'max_depth': 50, 'min_samples_split': 2, 'min_samples_leaf': 2, 'max_features': 'sqrt', 'bootstrap': False, 'criterion': 'squared_error'}. Best is trial 457 with value: 0.3223992246327795.
[I 2024-12-04 19:59:31,274] Trial 466 finished with value: 0.5843256643647643 and parameters: {'n_estimators': 958, 'max_depth': 25, 'min_samples_split': 4, 'min_samples_leaf': 5, 'max_features': None, 'bootstrap': False, 'criterion': 'absolute_error'}. Best is trial 457 with value: 0.3223992246327795.
[I 2024-12-04 19:59:32,499] Trial 488 finished with value: 0.3924113321483927 and parameters: {'n_estimators': 456, 'max_depth': 50, 'min_samples_split': 4, 'min_samples_leaf': 1, 'max_features': 'sqrt', 'bootstrap': False, 'criterion': 'squared_error'}. Best is trial 457 with value: 0.3223992246327795.
[I 2024-12-04 19:59:33,304] Trial 489 finished with value: 0.3670837351195108 and parameters: {'n_estimators': 464, 'max_depth': 50, 'min_samples_split': 3, 'min_samples_leaf': 1, 'max_features': 'sqrt', 'bootstrap': False, 'criterion': 'squared_error'}. Best is trial 457 with value: 0.3223992246327795.
[I 2024-12-04 19:59:34,337] Trial 490 finished with value: 0.32576298548563337 and parameters: {'n_estimators': 273, 'max_depth': 50, 'min_samples_split': 2, 'min_samples_leaf': 1, 'max_features': 'sqrt', 'bootstrap': False, 'criterion': 'squared_error'}. Best is trial 457 with value: 0.3223992246327795.
[I 2024-12-04 19:59:35,422] Trial 491 finished with value: 0.32369937626844103 and parameters: {'n_estimators': 391, 'max_depth': 50, 'min_samples_split': 2, 'min_samples_leaf': 1, 'max_features': 'sqrt', 'bootstrap': False, 'criterion': 'squared_error'}. Best is trial 457 with value: 0.3223992246327795.
[I 2024-12-04 19:59:36,635] Trial 493 finished with value: 1.2106076583557186 and parameters: {'n_estimators': 762, 'max_depth': 35, 'min_samples_split': 2, 'min_samples_leaf': 15, 'max_features': 'sqrt', 'bootstrap': False, 'criterion': 'squared_error'}. Best is trial 457 with value: 0.3223992246327795.
[I 2024-12-04 19:59:37,646] Trial 494 finished with value: 1.243822208453504 and parameters: {'n_estimators': 344, 'max_depth': 10, 'min_samples_split': 2, 'min_samples_leaf': 4, 'max_features': 'log2', 'bootstrap': True, 'criterion': 'squared_error'}. Best is trial 457 with value: 0.3223992246327795.
[I 2024-12-04 19:59:38,742] Trial 492 finished with value: 1.0192098662770606 and parameters: {'n_estimators': 373, 'max_depth': 15, 'min_samples_split': 43, 'min_samples_leaf': 1, 'max_features': 'sqrt', 'bootstrap': True, 'criterion': 'absolute_error'}. Best is trial 457 with value: 0.3223992246327795.
[I 2024-12-04 19:59:39,897] Trial 496 finished with value: 0.683260291122889 and parameters: {'n_estimators': 370, 'max_depth': 42, 'min_samples_split': 2, 'min_samples_leaf': 2, 'max_features': 'sqrt', 'bootstrap': False, 'criterion': 'squared_error'}. Best is trial 457 with value: 0.3223992246327795.
[I 2024-12-04 19:59:41,147] Trial 497 finished with value: 0.3856650343497493 and parameters: {'n_estimators': 273, 'max_depth': 50, 'min_samples_split': 4, 'min_samples_leaf': 1, 'max_features': 'sqrt', 'bootstrap': False, 'criterion': 'squared_error'}. Best is trial 457 with value: 0.3223992246327795.
[I 2024-12-04 19:59:42,316] Trial 495 finished with value: 0.43403554268644967 and parameters: {'n_estimators': 465, 'max_depth': 50, 'min_samples_split': 2, 'min_samples_leaf': 1, 'max_features': None, 'bootstrap': False, 'criterion': 'squared_error'}. Best is trial 457 with value: 0.3223992246327795.
[I 2024-12-04 19:59:43,077] Trial 498 finished with value: 0.3598681844536213 and parameters: {'n_estimators': 363, 'max_depth': 40, 'min_samples_split': 2, 'min_samples_leaf': 1, 'max_features': 'sqrt', 'bootstrap': False, 'criterion': 'squared_error'}. Best is trial 457 with value: 0.3223992246327795.
[I 2024-12-04 19:59:44,380] Trial 500 finished with value: 1.267964362338792 and parameters: {'n_estimators': 655, 'max_depth': 33, 'min_samples_split': 8, 'min_samples_leaf': 6, 'max_features': 'log2', 'bootstrap': True, 'criterion': 'squared_error'}. Best is trial 457 with value: 0.3223992246327795.
[I 2024-12-04 19:59:44,390] Trial 499 finished with value: 0.32323293764710587 and parameters: {'n_estimators': 354, 'max_depth': 50, 'min_samples_split': 2, 'min_samples_leaf': 1, 'max_features': 'sqrt', 'bootstrap': False, 'criterion': 'squared_error'}. Best is trial 457 with value: 0.3223992246327795.
[I 2024-12-04 19:59:46,044] Trial 501 finished with value: 1.3417228952246176 and parameters: {'n_estimators': 545, 'max_depth': 15, 'min_samples_split': 2, 'min_samples_leaf': 11, 'max_features': 'log2', 'bootstrap': False, 'criterion': 'absolute_error'}. Best is trial 457 with value: 0.3223992246327795.
[I 2024-12-04 19:59:46,836] Trial 502 finished with value: 0.352044176401188 and parameters: {'n_estimators': 418, 'max_depth': 42, 'min_samples_split': 2, 'min_samples_leaf': 1, 'max_features': 'sqrt', 'bootstrap': False, 'criterion': 'squared_error'}. Best is trial 457 with value: 0.3223992246327795.
[I 2024-12-04 19:59:48,049] Trial 504 finished with value: 0.6831336413924483 and parameters: {'n_estimators': 402, 'max_depth': 49, 'min_samples_split': 2, 'min_samples_leaf': 2, 'max_features': 'sqrt', 'bootstrap': False, 'criterion': 'squared_error'}. Best is trial 457 with value: 0.3223992246327795.
[I 2024-12-04 19:59:49,555] Trial 505 finished with value: 0.3688143678692282 and parameters: {'n_estimators': 314, 'max_depth': 50, 'min_samples_split': 2, 'min_samples_leaf': 1, 'max_features': 'sqrt', 'bootstrap': True, 'criterion': 'squared_error'}. Best is trial 457 with value: 0.3223992246327795.
[I 2024-12-04 19:59:51,182] Trial 506 finished with value: 0.32432548267087563 and parameters: {'n_estimators': 287, 'max_depth': 50, 'min_samples_split': 2, 'min_samples_leaf': 1, 'max_features': 'sqrt', 'bootstrap': False, 'criterion': 'squared_error'}. Best is trial 457 with value: 0.3223992246327795.
[I 2024-12-04 19:59:51,968] Trial 503 finished with value: 0.7503482204297739 and parameters: {'n_estimators': 112, 'max_depth': 6, 'min_samples_split': 49, 'min_samples_leaf': 1, 'max_features': None, 'bootstrap': True, 'criterion': 'absolute_error'}. Best is trial 457 with value: 0.3223992246327795.
[I 2024-12-04 19:59:53,027] Trial 508 finished with value: 1.2282988810300317 and parameters: {'n_estimators': 302, 'max_depth': 22, 'min_samples_split': 5, 'min_samples_leaf': 14, 'max_features': 'sqrt', 'bootstrap': True, 'criterion': 'squared_error'}. Best is trial 457 with value: 0.3223992246327795.
[I 2024-12-04 19:59:53,566] Trial 507 finished with value: 0.330276810682294 and parameters: {'n_estimators': 445, 'max_depth': 49, 'min_samples_split': 2, 'min_samples_leaf': 1, 'max_features': 'sqrt', 'bootstrap': False, 'criterion': 'squared_error'}. Best is trial 457 with value: 0.3223992246327795.
[I 2024-12-04 19:59:54,850] Trial 509 finished with value: 1.1813834858418166 and parameters: {'n_estimators': 979, 'max_depth': 9, 'min_samples_split': 3, 'min_samples_leaf': 11, 'max_features': 'sqrt', 'bootstrap': False, 'criterion': 'squared_error'}. Best is trial 457 with value: 0.3223992246327795.
[I 2024-12-04 19:59:55,675] Trial 510 finished with value: 0.9040788596283994 and parameters: {'n_estimators': 867, 'max_depth': 25, 'min_samples_split': 50, 'min_samples_leaf': 3, 'max_features': 'sqrt', 'bootstrap': False, 'criterion': 'squared_error'}. Best is trial 457 with value: 0.3223992246327795.
[I 2024-12-04 19:59:56,666] Trial 511 finished with value: 0.34545700878726787 and parameters: {'n_estimators': 309, 'max_depth': 41, 'min_samples_split': 2, 'min_samples_leaf': 1, 'max_features': 'sqrt', 'bootstrap': False, 'criterion': 'squared_error'}. Best is trial 457 with value: 0.3223992246327795.
[I 2024-12-04 19:59:57,530] Trial 512 finished with value: 0.3235096817473656 and parameters: {'n_estimators': 324, 'max_depth': 50, 'min_samples_split': 2, 'min_samples_leaf': 1, 'max_features': 'sqrt', 'bootstrap': False, 'criterion': 'squared_error'}. Best is trial 457 with value: 0.3223992246327795.
[I 2024-12-04 19:59:57,998] Trial 513 finished with value: 0.3546682321099236 and parameters: {'n_estimators': 185, 'max_depth': 41, 'min_samples_split': 2, 'min_samples_leaf': 1, 'max_features': 'sqrt', 'bootstrap': False, 'criterion': 'squared_error'}. Best is trial 457 with value: 0.3223992246327795.
[I 2024-12-04 19:59:59,216] Trial 515 finished with value: 0.38956040555049243 and parameters: {'n_estimators': 195, 'max_depth': 50, 'min_samples_split': 4, 'min_samples_leaf': 1, 'max_features': 'sqrt', 'bootstrap': False, 'criterion': 'squared_error'}. Best is trial 457 with value: 0.3223992246327795.
[I 2024-12-04 20:00:01,346] Trial 516 finished with value: 0.3246218385007584 and parameters: {'n_estimators': 430, 'max_depth': 50, 'min_samples_split': 2, 'min_samples_leaf': 1, 'max_features': 'sqrt', 'bootstrap': False, 'criterion': 'squared_error'}. Best is trial 457 with value: 0.3223992246327795.
[I 2024-12-04 20:00:03,436] Trial 517 finished with value: 0.3233672926697511 and parameters: {'n_estimators': 419, 'max_depth': 50, 'min_samples_split': 2, 'min_samples_leaf': 1, 'max_features': 'sqrt', 'bootstrap': False, 'criterion': 'squared_error'}. Best is trial 457 with value: 0.3223992246327795.
[I 2024-12-04 20:00:05,499] Trial 518 finished with value: 0.37691106281766634 and parameters: {'n_estimators': 460, 'max_depth': 39, 'min_samples_split': 2, 'min_samples_leaf': 1, 'max_features': 'sqrt', 'bootstrap': False, 'criterion': 'squared_error'}. Best is trial 457 with value: 0.3223992246327795.
[I 2024-12-04 20:00:06,634] Trial 519 finished with value: 1.2974606014824959 and parameters: {'n_estimators': 305, 'max_depth': 32, 'min_samples_split': 2, 'min_samples_leaf': 11, 'max_features': 'sqrt', 'bootstrap': True, 'criterion': 'absolute_error'}. Best is trial 457 with value: 0.3223992246327795.
[I 2024-12-04 20:00:10,037] Trial 520 finished with value: 0.6078222324406068 and parameters: {'n_estimators': 845, 'max_depth': 43, 'min_samples_split': 4, 'min_samples_leaf': 12, 'max_features': None, 'bootstrap': False, 'criterion': 'squared_error'}. Best is trial 457 with value: 0.3223992246327795.
[I 2024-12-04 20:00:11,192] Trial 476 finished with value: 0.4347402897825285 and parameters: {'n_estimators': 870, 'max_depth': 50, 'min_samples_split': 3, 'min_samples_leaf': 1, 'max_features': None, 'bootstrap': True, 'criterion': 'absolute_error'}. Best is trial 457 with value: 0.3223992246327795.
[I 2024-12-04 20:00:12,135] Trial 521 finished with value: 0.3238915190966349 and parameters: {'n_estimators': 359, 'max_depth': 50, 'min_samples_split': 2, 'min_samples_leaf': 1, 'max_features': 'sqrt', 'bootstrap': False, 'criterion': 'squared_error'}. Best is trial 457 with value: 0.3223992246327795.
[I 2024-12-04 20:00:13,388] Trial 522 finished with value: 0.3941060843614823 and parameters: {'n_estimators': 537, 'max_depth': 41, 'min_samples_split': 3, 'min_samples_leaf': 1, 'max_features': 'sqrt', 'bootstrap': False, 'criterion': 'squared_error'}. Best is trial 457 with value: 0.3223992246327795.
[I 2024-12-04 20:00:14,544] Trial 514 finished with value: 0.5159967129366414 and parameters: {'n_estimators': 512, 'max_depth': 5, 'min_samples_split': 7, 'min_samples_leaf': 2, 'max_features': None, 'bootstrap': True, 'criterion': 'absolute_error'}. Best is trial 457 with value: 0.3223992246327795.
[I 2024-12-04 20:00:15,316] Trial 523 finished with value: 0.3301581019827117 and parameters: {'n_estimators': 509, 'max_depth': 49, 'min_samples_split': 2, 'min_samples_leaf': 1, 'max_features': 'sqrt', 'bootstrap': False, 'criterion': 'squared_error'}. Best is trial 457 with value: 0.3223992246327795.
[I 2024-12-04 20:00:15,636] Trial 524 finished with value: 1.2561111427679559 and parameters: {'n_estimators': 959, 'max_depth': 44, 'min_samples_split': 6, 'min_samples_leaf': 5, 'max_features': 'log2', 'bootstrap': True, 'criterion': 'squared_error'}. Best is trial 457 with value: 0.3223992246327795.
[I 2024-12-04 20:00:16,858] Trial 527 finished with value: 0.6704314081386579 and parameters: {'n_estimators': 244, 'max_depth': 46, 'min_samples_split': 2, 'min_samples_leaf': 2, 'max_features': 'sqrt', 'bootstrap': False, 'criterion': 'squared_error'}. Best is trial 457 with value: 0.3223992246327795.
[I 2024-12-04 20:00:17,776] Trial 526 finished with value: 0.3232205805071886 and parameters: {'n_estimators': 403, 'max_depth': 50, 'min_samples_split': 2, 'min_samples_leaf': 1, 'max_features': 'sqrt', 'bootstrap': False, 'criterion': 'squared_error'}. Best is trial 457 with value: 0.3223992246327795.
[I 2024-12-04 20:00:18,363] Trial 528 finished with value: 0.3227296072813751 and parameters: {'n_estimators': 223, 'max_depth': 50, 'min_samples_split': 2, 'min_samples_leaf': 1, 'max_features': 'sqrt', 'bootstrap': False, 'criterion': 'squared_error'}. Best is trial 457 with value: 0.3223992246327795.
[I 2024-12-04 20:00:19,364] Trial 530 finished with value: 0.6515227566630162 and parameters: {'n_estimators': 169, 'max_depth': 50, 'min_samples_split': 3, 'min_samples_leaf': 2, 'max_features': 'sqrt', 'bootstrap': False, 'criterion': 'squared_error'}. Best is trial 457 with value: 0.3223992246327795.
[I 2024-12-04 20:00:20,459] Trial 531 finished with value: 0.33813968127447414 and parameters: {'n_estimators': 125, 'max_depth': 50, 'min_samples_split': 2, 'min_samples_leaf': 1, 'max_features': 'sqrt', 'bootstrap': False, 'criterion': 'squared_error'}. Best is trial 457 with value: 0.3223992246327795.
[I 2024-12-04 20:00:22,273] Trial 532 finished with value: 0.3920944826804324 and parameters: {'n_estimators': 518, 'max_depth': 50, 'min_samples_split': 4, 'min_samples_leaf': 1, 'max_features': 'sqrt', 'bootstrap': False, 'criterion': 'squared_error'}. Best is trial 457 with value: 0.3223992246327795.
[I 2024-12-04 20:00:23,518] Trial 533 finished with value: 0.6840539153249855 and parameters: {'n_estimators': 396, 'max_depth': 44, 'min_samples_split': 4, 'min_samples_leaf': 2, 'max_features': 'sqrt', 'bootstrap': False, 'criterion': 'squared_error'}. Best is trial 457 with value: 0.3223992246327795.
[I 2024-12-04 20:00:24,746] Trial 529 finished with value: 0.8909504785511794 and parameters: {'n_estimators': 450, 'max_depth': 50, 'min_samples_split': 5, 'min_samples_leaf': 2, 'max_features': 'sqrt', 'bootstrap': False, 'criterion': 'absolute_error'}. Best is trial 457 with value: 0.3223992246327795.
[I 2024-12-04 20:00:24,861] Trial 534 finished with value: 0.6882005639752693 and parameters: {'n_estimators': 495, 'max_depth': 50, 'min_samples_split': 3, 'min_samples_leaf': 2, 'max_features': 'sqrt', 'bootstrap': False, 'criterion': 'squared_error'}. Best is trial 457 with value: 0.3223992246327795.
[I 2024-12-04 20:00:26,315] Trial 536 finished with value: 0.6671375164255109 and parameters: {'n_estimators': 345, 'max_depth': 50, 'min_samples_split': 2, 'min_samples_leaf': 2, 'max_features': 'sqrt', 'bootstrap': False, 'criterion': 'squared_error'}. Best is trial 457 with value: 0.3223992246327795.
[I 2024-12-04 20:00:27,323] Trial 535 finished with value: 0.35612615483652227 and parameters: {'n_estimators': 507, 'max_depth': 42, 'min_samples_split': 2, 'min_samples_leaf': 1, 'max_features': 'sqrt', 'bootstrap': False, 'criterion': 'squared_error'}. Best is trial 457 with value: 0.3223992246327795.
[I 2024-12-04 20:00:28,346] Trial 537 finished with value: 0.3466093577628225 and parameters: {'n_estimators': 365, 'max_depth': 41, 'min_samples_split': 2, 'min_samples_leaf': 1, 'max_features': 'sqrt', 'bootstrap': False, 'criterion': 'squared_error'}. Best is trial 457 with value: 0.3223992246327795.
[I 2024-12-04 20:00:29,603] Trial 539 finished with value: 0.44587262790539955 and parameters: {'n_estimators': 274, 'max_depth': 39, 'min_samples_split': 3, 'min_samples_leaf': 1, 'max_features': 'sqrt', 'bootstrap': True, 'criterion': 'squared_error'}. Best is trial 457 with value: 0.3223992246327795.
[I 2024-12-04 20:00:29,986] Trial 538 finished with value: 0.3274764912548686 and parameters: {'n_estimators': 509, 'max_depth': 50, 'min_samples_split': 2, 'min_samples_leaf': 1, 'max_features': 'sqrt', 'bootstrap': False, 'criterion': 'squared_error'}. Best is trial 457 with value: 0.3223992246327795.
[I 2024-12-04 20:00:31,509] Trial 541 finished with value: 1.312247224438562 and parameters: {'n_estimators': 433, 'max_depth': 38, 'min_samples_split': 31, 'min_samples_leaf': 14, 'max_features': 'sqrt', 'bootstrap': True, 'criterion': 'absolute_error'}. Best is trial 457 with value: 0.3223992246327795.
