[I 2024-12-04 00:06:13,307] Trial 145 finished with value: 0.15607443900078155 and parameters: {'kernel': 'rbf', 'C': 90.10254064214158, 'gamma': 0.014317569300531645, 'epsilon': 0.02926367065401793}. Best is trial 108 with value: 0.1445053319110521.
[I 2024-12-04 00:06:14,132] Trial 153 finished with value: 0.160860783944293 and parameters: {'kernel': 'rbf', 'C': 45.554840444685276, 'gamma': 0.007349044009361544, 'epsilon': 0.012966966869453655}. Best is trial 108 with value: 0.1445053319110521.
[I 2024-12-04 00:06:14,380] Trial 160 finished with value: 1976.0368009947974 and parameters: {'kernel': 'sigmoid', 'C': 86.70937732315363, 'gamma': 0.04045282681132347, 'epsilon': 0.017391854692105243}. Best is trial 108 with value: 0.1445053319110521.
[I 2024-12-04 00:06:14,640] Trial 157 finished with value: 0.18005106475153906 and parameters: {'kernel': 'rbf', 'C': 93.39769211348593, 'gamma': 0.02592879871126126, 'epsilon': 0.08217483717441965}. Best is trial 108 with value: 0.1445053319110521.
[I 2024-12-04 00:06:14,643] Trial 156 finished with value: 0.3380803101563633 and parameters: {'kernel': 'linear', 'C': 0.8869799734128986, 'gamma': 0.0005339020347889648, 'epsilon': 0.0036115593298274027}. Best is trial 108 with value: 0.1445053319110521.
[I 2024-12-04 00:06:14,915] Trial 158 finished with value: 0.14885740249811008 and parameters: {'kernel': 'rbf', 'C': 81.09057251754834, 'gamma': 0.012797267394130321, 'epsilon': 0.025270992179423156}. Best is trial 108 with value: 0.1445053319110521.
[I 2024-12-04 00:06:15,181] Trial 159 finished with value: 0.18578420949483943 and parameters: {'kernel': 'rbf', 'C': 12.469610358483441, 'gamma': 0.013757257088809706, 'epsilon': 0.020339093776536005}. Best is trial 108 with value: 0.1445053319110521.
[I 2024-12-04 00:06:15,187] Trial 149 finished with value: 0.14544645359996766 and parameters: {'kernel': 'rbf', 'C': 67.47244348716534, 'gamma': 0.011278506310968613, 'epsilon': 0.00619353738693839}. Best is trial 108 with value: 0.1445053319110521.
[I 2024-12-04 00:06:15,391] Trial 162 finished with value: 0.16027526554905103 and parameters: {'kernel': 'rbf', 'C': 45.410203555264665, 'gamma': 0.00865380198823725, 'epsilon': 0.049844274636337484}. Best is trial 108 with value: 0.1445053319110521.
[I 2024-12-04 00:06:15,423] Trial 165 finished with value: 0.14671667403014071 and parameters: {'kernel': 'rbf', 'C': 76.42514011587909, 'gamma': 0.007145626457713172, 'epsilon': 0.006081245850528922}. Best is trial 108 with value: 0.1445053319110521.
[I 2024-12-04 00:06:16,090] Trial 167 finished with value: 0.7200354783114596 and parameters: {'kernel': 'sigmoid', 'C': 0.1500450041787758, 'gamma': 0.0017390794858961713, 'epsilon': 0.04526539627587057}. Best is trial 108 with value: 0.1445053319110521.
[I 2024-12-04 00:06:17,131] Trial 170 finished with value: 0.1453442363616672 and parameters: {'kernel': 'rbf', 'C': 58.4400393984804, 'gamma': 0.010936089952217159, 'epsilon': 0.019468927441786233}. Best is trial 108 with value: 0.1445053319110521.
[I 2024-12-04 00:06:17,501] Trial 169 finished with value: 0.1593564601912934 and parameters: {'kernel': 'rbf', 'C': 32.39287765664494, 'gamma': 0.009567418324831052, 'epsilon': 0.0044897006097451035}. Best is trial 108 with value: 0.1445053319110521.
[I 2024-12-04 00:06:17,681] Trial 168 finished with value: 0.3698839770652426 and parameters: {'kernel': 'rbf', 'C': 5.552992731711372, 'gamma': 0.0018355608790583105, 'epsilon': 0.00744542402630369}. Best is trial 108 with value: 0.1445053319110521.
[I 2024-12-04 00:06:17,772] Trial 164 finished with value: 0.15424316605432023 and parameters: {'kernel': 'rbf', 'C': 48.76359163361452, 'gamma': 0.018738354154205914, 'epsilon': 0.015655993312277815}. Best is trial 108 with value: 0.1445053319110521.
[I 2024-12-04 00:06:17,878] Trial 166 finished with value: 0.9955220790744025 and parameters: {'kernel': 'rbf', 'C': 0.004025263233172988, 'gamma': 0.00012172726353053005, 'epsilon': 0.6651901534034743}. Best is trial 108 with value: 0.1445053319110521.
[I 2024-12-04 00:06:18,352] Trial 163 finished with value: 0.17453504843511036 and parameters: {'kernel': 'rbf', 'C': 80.53572081734143, 'gamma': 0.024918019733336023, 'epsilon': 0.007899634466444238}. Best is trial 108 with value: 0.1445053319110521.
[I 2024-12-04 00:06:18,451] Trial 171 finished with value: 0.21993704412005194 and parameters: {'kernel': 'rbf', 'C': 84.18124721195407, 'gamma': 0.0019077720895426423, 'epsilon': 0.004111263663510992}. Best is trial 108 with value: 0.1445053319110521.
[I 2024-12-04 00:06:18,676] Trial 175 finished with value: 0.15119323361603607 and parameters: {'kernel': 'rbf', 'C': 91.2407920350716, 'gamma': 0.005530072734041509, 'epsilon': 0.006270017007672873}. Best is trial 108 with value: 0.1445053319110521.
[I 2024-12-04 00:06:18,870] Trial 172 finished with value: 0.20961226605896413 and parameters: {'kernel': 'rbf', 'C': 17.303741626629417, 'gamma': 0.008309323642191554, 'epsilon': 0.0032535628366960967}. Best is trial 108 with value: 0.1445053319110521.
[I 2024-12-04 00:06:18,872] Trial 173 finished with value: 0.9920084398708242 and parameters: {'kernel': 'poly', 'C': 5.105791199764086, 'gamma': 0.00011132761801709967, 'epsilon': 0.01519439352075742}. Best is trial 108 with value: 0.1445053319110521.
[I 2024-12-04 00:06:19,407] Trial 176 finished with value: 0.47734838223012355 and parameters: {'kernel': 'rbf', 'C': 69.89769112778134, 'gamma': 0.4288142301310105, 'epsilon': 0.014725493816275565}. Best is trial 108 with value: 0.1445053319110521.
[I 2024-12-04 00:06:19,752] Trial 174 finished with value: 0.14949623926554995 and parameters: {'kernel': 'rbf', 'C': 92.5953774274541, 'gamma': 0.005737765373630193, 'epsilon': 0.004285978987119411}. Best is trial 108 with value: 0.1445053319110521.
[I 2024-12-04 00:06:19,855] Trial 177 finished with value: 0.2157567745209016 and parameters: {'kernel': 'rbf', 'C': 16.495265340997488, 'gamma': 0.00820762990485657, 'epsilon': 0.009156108754230499}. Best is trial 108 with value: 0.1445053319110521.
[I 2024-12-04 00:06:20,724] Trial 178 finished with value: 0.22687067646481104 and parameters: {'kernel': 'rbf', 'C': 44.610502046631126, 'gamma': 0.0029862737685046894, 'epsilon': 0.005724044438241954}. Best is trial 108 with value: 0.1445053319110521.
[I 2024-12-04 00:06:21,157] Trial 180 finished with value: 0.20660538765562997 and parameters: {'kernel': 'rbf', 'C': 32.75107934661468, 'gamma': 0.062189649740336396, 'epsilon': 0.005918439942768834}. Best is trial 108 with value: 0.1445053319110521.
[I 2024-12-04 00:06:21,307] Trial 179 finished with value: 0.14937715832365134 and parameters: {'kernel': 'rbf', 'C': 86.60406471133155, 'gamma': 0.011769935466571074, 'epsilon': 0.009977770923163085}. Best is trial 108 with value: 0.1445053319110521.
[I 2024-12-04 00:06:21,308] Trial 181 finished with value: 0.1791711664770051 and parameters: {'kernel': 'rbf', 'C': 31.773286150206722, 'gamma': 0.007600714270067441, 'epsilon': 0.005734041770908357}. Best is trial 108 with value: 0.1445053319110521.
[I 2024-12-04 00:06:22,640] Trial 183 finished with value: 0.33538389726853135 and parameters: {'kernel': 'linear', 'C': 0.6077656291926762, 'gamma': 0.010827430156625071, 'epsilon': 0.001038542904443122}. Best is trial 108 with value: 0.1445053319110521.
[I 2024-12-04 00:06:23,018] Trial 26 finished with value: 0.3308451158457105 and parameters: {'kernel': 'linear', 'C': 54.84643215126255, 'gamma': 0.003737753374544468, 'epsilon': 0.08782349599608166}. Best is trial 108 with value: 0.1445053319110521.
[I 2024-12-04 00:06:23,055] Trial 186 finished with value: 0.9761901130485784 and parameters: {'kernel': 'poly', 'C': 0.09343142241415593, 'gamma': 0.0006465995815734069, 'epsilon': 0.015341532755496436}. Best is trial 108 with value: 0.1445053319110521.
[I 2024-12-04 00:06:23,136] Trial 185 finished with value: 0.21061790576693135 and parameters: {'kernel': 'rbf', 'C': 90.54120265980794, 'gamma': 0.002076939964134186, 'epsilon': 0.008670743982800952}. Best is trial 108 with value: 0.1445053319110521.
[I 2024-12-04 00:06:23,582] Trial 184 finished with value: 0.15252773299656064 and parameters: {'kernel': 'rbf', 'C': 91.85906890915696, 'gamma': 0.005193083666278906, 'epsilon': 0.005421406389198875}. Best is trial 108 with value: 0.1445053319110521.
[I 2024-12-04 00:06:24,004] Trial 188 finished with value: 0.149375118893218 and parameters: {'kernel': 'rbf', 'C': 35.87571812284633, 'gamma': 0.017845944810289675, 'epsilon': 0.0010822366708667403}. Best is trial 108 with value: 0.1445053319110521.
[I 2024-12-04 00:06:24,247] Trial 194 finished with value: 253.194842270779 and parameters: {'kernel': 'sigmoid', 'C': 10.90579082871209, 'gamma': 0.052207763343143684, 'epsilon': 0.005220538945246515}. Best is trial 108 with value: 0.1445053319110521.
[I 2024-12-04 00:06:24,330] Trial 182 finished with value: 0.5558300799955898 and parameters: {'kernel': 'poly', 'C': 12.480465460188949, 'gamma': 0.016883876830838102, 'epsilon': 0.014399005780061034}. Best is trial 108 with value: 0.1445053319110521.
[I 2024-12-04 00:06:24,441] Trial 189 finished with value: 0.1496110246373637 and parameters: {'kernel': 'rbf', 'C': 84.02039930260149, 'gamma': 0.006038545632543091, 'epsilon': 0.004614139164032662}. Best is trial 108 with value: 0.1445053319110521.
[I 2024-12-04 00:06:24,707] Trial 187 finished with value: 0.1532493094736067 and parameters: {'kernel': 'rbf', 'C': 87.49707020890882, 'gamma': 0.0128308586587186, 'epsilon': 0.0032524674907293254}. Best is trial 108 with value: 0.1445053319110521.
[I 2024-12-04 00:06:24,895] Trial 191 finished with value: 0.20086279789175016 and parameters: {'kernel': 'rbf', 'C': 18.35935424270595, 'gamma': 0.00888457424728315, 'epsilon': 0.012419265896699897}. Best is trial 108 with value: 0.1445053319110521.
[I 2024-12-04 00:06:24,938] Trial 195 finished with value: 0.3462824541533028 and parameters: {'kernel': 'rbf', 'C': 77.7439299999012, 'gamma': 0.0002697499928192287, 'epsilon': 0.017543028500311093}. Best is trial 108 with value: 0.1445053319110521.
[I 2024-12-04 00:06:25,107] Trial 199 finished with value: 0.9762858835110678 and parameters: {'kernel': 'sigmoid', 'C': 0.0019574752167676266, 'gamma': 0.004664229860731595, 'epsilon': 0.0012419368259556475}. Best is trial 108 with value: 0.1445053319110521.
[I 2024-12-04 00:06:26,472] Trial 193 finished with value: 0.17467860326796233 and parameters: {'kernel': 'rbf', 'C': 75.33171167495881, 'gamma': 0.02578072770112398, 'epsilon': 0.009432790722558865}. Best is trial 108 with value: 0.1445053319110521.
[I 2024-12-04 00:06:27,111] Trial 196 finished with value: 0.16010890725345472 and parameters: {'kernel': 'rbf', 'C': 96.67293538636247, 'gamma': 0.004215198961278071, 'epsilon': 0.007609200033858838}. Best is trial 108 with value: 0.1445053319110521.
[I 2024-12-04 00:06:27,164] Trial 200 finished with value: 0.15628724407666475 and parameters: {'kernel': 'rbf', 'C': 20.763799881152625, 'gamma': 0.014685822697890856, 'epsilon': 0.002520051973829669}. Best is trial 108 with value: 0.1445053319110521.
[I 2024-12-04 00:06:27,282] Trial 197 finished with value: 0.15025089131202266 and parameters: {'kernel': 'rbf', 'C': 23.431643975723116, 'gamma': 0.022491982529539316, 'epsilon': 0.0012199111419074994}. Best is trial 108 with value: 0.1445053319110521.
[I 2024-12-04 00:06:27,370] Trial 190 finished with value: 0.16746394414226348 and parameters: {'kernel': 'rbf', 'C': 78.57921577719027, 'gamma': 0.018700803351873872, 'epsilon': 0.0030133233595828796}. Best is trial 108 with value: 0.1445053319110521.
[I 2024-12-04 00:06:27,399] Trial 198 finished with value: 0.24647321459637367 and parameters: {'kernel': 'rbf', 'C': 50.08850630510003, 'gamma': 0.11235824724513016, 'epsilon': 0.001113205483312483}. Best is trial 108 with value: 0.1445053319110521.
[I 2024-12-04 00:06:27,445] Trial 192 finished with value: 0.1711605762077935 and parameters: {'kernel': 'rbf', 'C': 80.52376862008859, 'gamma': 0.022164303767156005, 'epsilon': 0.0063416615681768035}. Best is trial 108 with value: 0.1445053319110521.
[I 2024-12-04 00:06:27,966] Trial 201 finished with value: 0.15533032066964886 and parameters: {'kernel': 'rbf', 'C': 58.22339809531626, 'gamma': 0.006522646039044109, 'epsilon': 0.0014318276809370135}. Best is trial 108 with value: 0.1445053319110521.
[I 2024-12-04 00:06:27,968] Trial 203 finished with value: 0.2236715197014351 and parameters: {'kernel': 'rbf', 'C': 11.777985040348325, 'gamma': 0.009498094455381374, 'epsilon': 0.0025447114509598596}. Best is trial 108 with value: 0.1445053319110521.
[I 2024-12-04 00:06:28,675] Trial 210 finished with value: 0.2292587150163193 and parameters: {'kernel': 'rbf', 'C': 5.337671721439769, 'gamma': 0.0161093877239189, 'epsilon': 0.0014282632164487117}. Best is trial 108 with value: 0.1445053319110521.
[I 2024-12-04 00:06:29,131] Trial 208 finished with value: 969.7361881896071 and parameters: {'kernel': 'sigmoid', 'C': 67.6958723921924, 'gamma': 0.01182329139695099, 'epsilon': 0.0023189685987097157}. Best is trial 108 with value: 0.1445053319110521.
[I 2024-12-04 00:06:29,333] Trial 202 finished with value: 0.18649200871992444 and parameters: {'kernel': 'rbf', 'C': 99.54978843067052, 'gamma': 0.002906379252696447, 'epsilon': 0.0013841337956793172}. Best is trial 108 with value: 0.1445053319110521.
[I 2024-12-04 00:06:29,833] Trial 205 finished with value: 0.25314181963899135 and parameters: {'kernel': 'rbf', 'C': 2.438665824208249, 'gamma': 0.02261700670428692, 'epsilon': 0.0010909130571070355}. Best is trial 108 with value: 0.1445053319110521.
[I 2024-12-04 00:06:29,833] Trial 206 finished with value: 0.9823703941908499 and parameters: {'kernel': 'sigmoid', 'C': 0.0011279959786885054, 'gamma': 0.006856746922057702, 'epsilon': 0.01983851707282761}. Best is trial 108 with value: 0.1445053319110521.
[I 2024-12-04 00:06:30,570] Trial 44 finished with value: 0.3536035284059193 and parameters: {'kernel': 'linear', 'C': 30.367192489595002, 'gamma': 0.002993844139883744, 'epsilon': 0.0037289476494592622}. Best is trial 108 with value: 0.1445053319110521.
[I 2024-12-04 00:06:31,037] Trial 216 finished with value: 0.286469381349902 and parameters: {'kernel': 'rbf', 'C': 7.723345250005643, 'gamma': 0.004066506055486305, 'epsilon': 0.022585740771460725}. Best is trial 207 with value: 0.14186137438299729.
[I 2024-12-04 00:06:31,055] Trial 213 finished with value: 0.20123072309964424 and parameters: {'kernel': 'rbf', 'C': 21.72561141548726, 'gamma': 0.05527706329562796, 'epsilon': 0.0010627592548693322}. Best is trial 207 with value: 0.14186137438299729.
[I 2024-12-04 00:06:31,056] Trial 209 finished with value: 0.15351188107256492 and parameters: {'kernel': 'rbf', 'C': 15.432192269086551, 'gamma': 0.02672587304740605, 'epsilon': 0.004636192219218082}. Best is trial 207 with value: 0.14186137438299729.
[I 2024-12-04 00:06:31,132] Trial 215 finished with value: 0.50655564424239 and parameters: {'kernel': 'linear', 'C': 2.313688197552868, 'gamma': 0.3197998058034291, 'epsilon': 0.8827986881610699}. Best is trial 207 with value: 0.14186137438299729.
[I 2024-12-04 00:06:31,871] Trial 214 finished with value: 0.15289216962098603 and parameters: {'kernel': 'rbf', 'C': 15.279478506038343, 'gamma': 0.025804676655632495, 'epsilon': 0.0103596846803718}. Best is trial 207 with value: 0.14186137438299729.
[I 2024-12-04 00:06:32,011] Trial 212 finished with value: 0.14311214385162452 and parameters: {'kernel': 'rbf', 'C': 99.96043981597298, 'gamma': 0.008803947609254957, 'epsilon': 0.016437633745747058}. Best is trial 207 with value: 0.14186137438299729.
[I 2024-12-04 00:06:32,014] Trial 207 finished with value: 0.14186137438299729 and parameters: {'kernel': 'rbf', 'C': 92.7508996572615, 'gamma': 0.007631391401176848, 'epsilon': 0.008430445827853303}. Best is trial 207 with value: 0.14186137438299729.
[I 2024-12-04 00:06:32,555] Trial 218 finished with value: 0.17755645781292767 and parameters: {'kernel': 'rbf', 'C': 27.297272306920405, 'gamma': 0.00840127260580726, 'epsilon': 0.0013167084286841804}. Best is trial 207 with value: 0.14186137438299729.
[I 2024-12-04 00:06:32,678] Trial 219 finished with value: 0.9890945982380818 and parameters: {'kernel': 'poly', 'C': 0.3686759619620003, 'gamma': 0.0002998498009275728, 'epsilon': 0.396013945688341}. Best is trial 207 with value: 0.14186137438299729.
[I 2024-12-04 00:06:33,251] Trial 211 finished with value: 0.18465060783257975 and parameters: {'kernel': 'rbf', 'C': 83.60155111543723, 'gamma': 0.031716807127362835, 'epsilon': 0.001173110579486101}. Best is trial 207 with value: 0.14186137438299729.
[I 2024-12-04 00:06:33,338] Trial 221 finished with value: 0.8459571064826804 and parameters: {'kernel': 'sigmoid', 'C': 0.007240091839118576, 'gamma': 0.564555205041523, 'epsilon': 0.03870976485809764}. Best is trial 207 with value: 0.14186137438299729.
[I 2024-12-04 00:06:33,590] Trial 222 finished with value: 0.19837215149021986 and parameters: {'kernel': 'rbf', 'C': 84.13124003927297, 'gamma': 0.0027186363799656574, 'epsilon': 0.012657125449641449}. Best is trial 207 with value: 0.14186137438299729.
[I 2024-12-04 00:06:34,160] Trial 220 finished with value: 0.147817690961796 and parameters: {'kernel': 'rbf', 'C': 63.2096865673728, 'gamma': 0.013039869290792575, 'epsilon': 0.004952277708338807}. Best is trial 207 with value: 0.14186137438299729.
[I 2024-12-04 00:06:34,555] Trial 224 finished with value: 0.14507686487287105 and parameters: {'kernel': 'rbf', 'C': 90.40563296374474, 'gamma': 0.009836129192680182, 'epsilon': 0.010000040584998704}. Best is trial 207 with value: 0.14186137438299729.
[I 2024-12-04 00:06:34,936] Trial 223 finished with value: 0.14935002168483597 and parameters: {'kernel': 'rbf', 'C': 57.02521120112854, 'gamma': 0.012408491381343196, 'epsilon': 0.010617481469658815}. Best is trial 207 with value: 0.14186137438299729.
[I 2024-12-04 00:06:35,296] Trial 97 finished with value: 0.33665740267628014 and parameters: {'kernel': 'linear', 'C': 40.43213446334834, 'gamma': 0.0943029903186243, 'epsilon': 0.07337011070081739}. Best is trial 207 with value: 0.14186137438299729.
[I 2024-12-04 00:06:35,399] Trial 225 finished with value: 0.18313448793983278 and parameters: {'kernel': 'rbf', 'C': 26.41455878910044, 'gamma': 0.008281224848146336, 'epsilon': 0.010409423997033493}. Best is trial 207 with value: 0.14186137438299729.
[I 2024-12-04 00:06:35,829] Trial 227 finished with value: 0.6703732438472902 and parameters: {'kernel': 'poly', 'C': 51.54814110853827, 'gamma': 0.005642759062707645, 'epsilon': 0.0025787607774925107}. Best is trial 207 with value: 0.14186137438299729.
[I 2024-12-04 00:06:36,009] Trial 232 finished with value: 0.14831045691409903 and parameters: {'kernel': 'rbf', 'C': 56.788101106997395, 'gamma': 0.013736621211367811, 'epsilon': 0.007984439362513892}. Best is trial 207 with value: 0.14186137438299729.
[I 2024-12-04 00:06:36,225] Trial 229 finished with value: 0.14770713462280652 and parameters: {'kernel': 'rbf', 'C': 86.82392898335023, 'gamma': 0.0064648542246316, 'epsilon': 0.010577104897302143}. Best is trial 207 with value: 0.14186137438299729.
[I 2024-12-04 00:06:36,862] Trial 228 finished with value: 9.239980831550206 and parameters: {'kernel': 'sigmoid', 'C': 0.39949038691119193, 'gamma': 0.12460522825439747, 'epsilon': 0.14604661542793063}. Best is trial 207 with value: 0.14186137438299729.
[I 2024-12-04 00:06:36,916] Trial 226 finished with value: 0.15885347563881067 and parameters: {'kernel': 'rbf', 'C': 97.50911189554647, 'gamma': 0.013637596956475108, 'epsilon': 0.01042147634395406}. Best is trial 207 with value: 0.14186137438299729.
[I 2024-12-04 00:06:37,170] Trial 238 finished with value: 632.9254898069587 and parameters: {'kernel': 'sigmoid', 'C': 74.92416451609974, 'gamma': 0.005960628575261617, 'epsilon': 0.01156588919661184}. Best is trial 207 with value: 0.14186137438299729.
[I 2024-12-04 00:06:37,265] Trial 234 finished with value: 0.18353492807316968 and parameters: {'kernel': 'rbf', 'C': 90.09282542566547, 'gamma': 0.03231644988480638, 'epsilon': 0.015755925807077693}. Best is trial 207 with value: 0.14186137438299729.
[I 2024-12-04 00:06:37,275] Trial 233 finished with value: 0.14515099492025293 and parameters: {'kernel': 'rbf', 'C': 54.64164162806589, 'gamma': 0.009470531971048643, 'epsilon': 0.009591553960759345}. Best is trial 207 with value: 0.14186137438299729.
[I 2024-12-04 00:06:37,604] Trial 237 finished with value: 0.22435506906517252 and parameters: {'kernel': 'rbf', 'C': 13.385079714581401, 'gamma': 0.008698050234446449, 'epsilon': 0.011667215332909988}. Best is trial 207 with value: 0.14186137438299729.
[I 2024-12-04 00:06:38,412] Trial 240 finished with value: 0.2523773104490375 and parameters: {'kernel': 'rbf', 'C': 25.338925563825974, 'gamma': 0.002822718928144562, 'epsilon': 0.020073923399877767}. Best is trial 207 with value: 0.14186137438299729.
[I 2024-12-04 00:06:38,426] Trial 236 finished with value: 0.14419085588989203 and parameters: {'kernel': 'rbf', 'C': 81.1667167922545, 'gamma': 0.007477811118917476, 'epsilon': 0.018550938149029274}. Best is trial 207 with value: 0.14186137438299729.
[I 2024-12-04 00:06:38,909] Trial 243 finished with value: 0.20224970620738375 and parameters: {'kernel': 'rbf', 'C': 15.482947358025452, 'gamma': 0.009853044358996007, 'epsilon': 0.0089143227454668}. Best is trial 207 with value: 0.14186137438299729.
[I 2024-12-04 00:06:39,289] Trial 235 finished with value: 0.17897080020291864 and parameters: {'kernel': 'rbf', 'C': 58.21337830666357, 'gamma': 0.004585497312632028, 'epsilon': 0.0245051349777334}. Best is trial 207 with value: 0.14186137438299729.
[I 2024-12-04 00:06:39,400] Trial 230 finished with value: 0.15332405112873976 and parameters: {'kernel': 'rbf', 'C': 90.69731480343103, 'gamma': 0.012937627584055911, 'epsilon': 0.009099061566819805}. Best is trial 207 with value: 0.14186137438299729.
