[I 2024-12-03 19:04:17,848] Trial 1657 finished with value: 0.7715701150461235 and parameters: {'kernel': 'linear', 'C': 32.248794416059305, 'gamma': 0.026506556998671257, 'epsilon': 0.14508731061168617}. Best is trial 88 with value: 0.3542875001421725.
[I 2024-12-03 19:04:19,205] Trial 1658 finished with value: 0.362662854355173 and parameters: {'kernel': 'rbf', 'C': 95.9833696675921, 'gamma': 0.05711076533904154, 'epsilon': 0.1591630240522549}. Best is trial 88 with value: 0.3542875001421725.
[I 2024-12-03 19:04:20,823] Trial 1659 finished with value: 0.538456459488891 and parameters: {'kernel': 'rbf', 'C': 98.44653404619811, 'gamma': 0.23905324412175918, 'epsilon': 0.059880365700066475}. Best is trial 88 with value: 0.3542875001421725.
[I 2024-12-03 19:04:22,011] Trial 1660 finished with value: 0.6508274229038467 and parameters: {'kernel': 'rbf', 'C': 99.09786552973918, 'gamma': 0.3171083622108625, 'epsilon': 0.3563695429494566}. Best is trial 88 with value: 0.3542875001421725.
[I 2024-12-03 19:04:23,734] Trial 1661 finished with value: 0.37196089205198996 and parameters: {'kernel': 'rbf', 'C': 92.5396226396415, 'gamma': 0.05937369028478213, 'epsilon': 0.06340534948882508}. Best is trial 88 with value: 0.3542875001421725.
[I 2024-12-03 19:04:25,134] Trial 1662 finished with value: 0.36521985863809703 and parameters: {'kernel': 'rbf', 'C': 97.43347544067758, 'gamma': 0.03174495997706589, 'epsilon': 0.16613295518989957}. Best is trial 88 with value: 0.3542875001421725.
[I 2024-12-03 19:04:26,621] Trial 1663 finished with value: 604.1163131011714 and parameters: {'kernel': 'sigmoid', 'C': 28.443664882840707, 'gamma': 0.06347836856327091, 'epsilon': 0.10661866256493892}. Best is trial 88 with value: 0.3542875001421725.
[I 2024-12-03 19:04:28,086] Trial 1664 finished with value: 0.8972740155584512 and parameters: {'kernel': 'sigmoid', 'C': 0.7713414521277431, 'gamma': 0.00016817852722657357, 'epsilon': 0.001142032422480925}. Best is trial 88 with value: 0.3542875001421725.
[I 2024-12-03 19:04:30,239] Trial 1665 finished with value: 0.45360089773113665 and parameters: {'kernel': 'rbf', 'C': 4.09707531220352, 'gamma': 0.016204025431157783, 'epsilon': 0.10852101512609487}. Best is trial 88 with value: 0.3542875001421725.
[I 2024-12-03 19:04:31,643] Trial 1666 finished with value: 0.3604348999511148 and parameters: {'kernel': 'rbf', 'C': 91.72348618722172, 'gamma': 0.03638363152182791, 'epsilon': 0.17548488091847736}. Best is trial 88 with value: 0.3542875001421725.
[I 2024-12-03 19:04:33,072] Trial 1667 finished with value: 0.41422800184127906 and parameters: {'kernel': 'rbf', 'C': 19.80064732951952, 'gamma': 0.004700776337555621, 'epsilon': 0.08409309021384566}. Best is trial 88 with value: 0.3542875001421725.
[I 2024-12-03 19:04:34,273] Trial 1668 finished with value: 1.0844197788544256 and parameters: {'kernel': 'sigmoid', 'C': 0.0028342095731189276, 'gamma': 0.38012127865503537, 'epsilon': 0.9331412623868903}. Best is trial 88 with value: 0.3542875001421725.
[I 2024-12-03 19:05:28,048] Trial 1543 finished with value: 1.560116905572385 and parameters: {'kernel': 'poly', 'C': 87.7204773418968, 'gamma': 0.0259601153175589, 'epsilon': 0.06866764861533974}. Best is trial 88 with value: 0.3542875001421725.
[I 2024-12-03 19:05:29,746] Trial 1670 finished with value: 0.4959465617640578 and parameters: {'kernel': 'rbf', 'C': 21.266692938135012, 'gamma': 0.18870782827874893, 'epsilon': 0.076870440442118}. Best is trial 88 with value: 0.3542875001421725.
[I 2024-12-03 19:05:32,724] Trial 1671 finished with value: 0.36963485107869487 and parameters: {'kernel': 'rbf', 'C': 90.96421359994177, 'gamma': 0.03778866281163775, 'epsilon': 0.03795712104519523}. Best is trial 88 with value: 0.3542875001421725.
[I 2024-12-03 19:05:34,111] Trial 1672 finished with value: 0.3557956031042741 and parameters: {'kernel': 'rbf', 'C': 96.79644871243002, 'gamma': 0.041930984688095106, 'epsilon': 0.1324205670795866}. Best is trial 88 with value: 0.3542875001421725.
[I 2024-12-03 19:05:35,438] Trial 1673 finished with value: 0.41969711660956 and parameters: {'kernel': 'rbf', 'C': 22.14662778217326, 'gamma': 0.019282217604322544, 'epsilon': 0.1276759971200853}. Best is trial 88 with value: 0.3542875001421725.
[I 2024-12-03 19:05:36,805] Trial 1674 finished with value: 0.41110141979936304 and parameters: {'kernel': 'rbf', 'C': 98.29553768559892, 'gamma': 0.009226374013393232, 'epsilon': 0.20206970128115176}. Best is trial 88 with value: 0.3542875001421725.
[I 2024-12-03 19:05:38,127] Trial 1675 finished with value: 0.4371906059820552 and parameters: {'kernel': 'rbf', 'C': 98.04432895597775, 'gamma': 0.07887312927491011, 'epsilon': 0.3633275775804929}. Best is trial 88 with value: 0.3542875001421725.
[I 2024-12-03 19:05:40,050] Trial 1676 finished with value: 0.40103521767337785 and parameters: {'kernel': 'rbf', 'C': 81.20096163608987, 'gamma': 0.005585185695844399, 'epsilon': 0.07831196087707534}. Best is trial 88 with value: 0.3542875001421725.
[I 2024-12-03 19:05:41,971] Trial 1677 finished with value: 0.36679120720391106 and parameters: {'kernel': 'rbf', 'C': 93.98703963598673, 'gamma': 0.05979647278852017, 'epsilon': 0.13667562210450507}. Best is trial 88 with value: 0.3542875001421725.
[I 2024-12-03 19:05:43,536] Trial 1678 finished with value: 0.3890853690012099 and parameters: {'kernel': 'rbf', 'C': 23.154308281179862, 'gamma': 0.047500936598065355, 'epsilon': 0.14048968856124477}. Best is trial 88 with value: 0.3542875001421725.
[I 2024-12-03 19:05:45,705] Trial 1679 finished with value: 0.3774643979459922 and parameters: {'kernel': 'rbf', 'C': 91.7092715226527, 'gamma': 0.019031367035005062, 'epsilon': 0.06688185621278812}. Best is trial 88 with value: 0.3542875001421725.
[I 2024-12-03 19:05:47,389] Trial 1680 finished with value: 2111.054224500338 and parameters: {'kernel': 'sigmoid', 'C': 98.1035470280518, 'gamma': 0.04142888515652113, 'epsilon': 0.45725282450474714}. Best is trial 88 with value: 0.3542875001421725.
[I 2024-12-03 19:05:48,892] Trial 1681 finished with value: 0.5920839895883112 and parameters: {'kernel': 'rbf', 'C': 97.90537227037952, 'gamma': 0.28441266904190216, 'epsilon': 0.18350563215564245}. Best is trial 88 with value: 0.3542875001421725.
[I 2024-12-03 19:05:50,591] Trial 1682 finished with value: 0.4369457033243634 and parameters: {'kernel': 'rbf', 'C': 18.23810532807477, 'gamma': 0.013134174000393373, 'epsilon': 0.18888747617960674}. Best is trial 88 with value: 0.3542875001421725.
[I 2024-12-03 19:05:52,466] Trial 1683 finished with value: 0.41424238967690435 and parameters: {'kernel': 'rbf', 'C': 26.127860287683315, 'gamma': 0.013826047350114648, 'epsilon': 0.05559959441228488}. Best is trial 88 with value: 0.3542875001421725.
[I 2024-12-03 19:05:53,705] Trial 1684 finished with value: 0.372435698779393 and parameters: {'kernel': 'rbf', 'C': 99.0851298184954, 'gamma': 0.017990011745914174, 'epsilon': 0.19824427671358258}. Best is trial 88 with value: 0.3542875001421725.
[I 2024-12-03 19:05:55,220] Trial 1685 finished with value: 0.7395864119226038 and parameters: {'kernel': 'rbf', 'C': 0.05325091146139475, 'gamma': 0.03802499927229947, 'epsilon': 0.0099188951475069}. Best is trial 88 with value: 0.3542875001421725.
[I 2024-12-03 19:05:56,825] Trial 1686 finished with value: 0.36942406327281435 and parameters: {'kernel': 'rbf', 'C': 95.21811110695208, 'gamma': 0.061902074579935185, 'epsilon': 0.0855547371908641}. Best is trial 88 with value: 0.3542875001421725.
[I 2024-12-03 19:07:14,372] Trial 1402 finished with value: 2.99702114209537 and parameters: {'kernel': 'poly', 'C': 11.389316452388274, 'gamma': 0.08961449883916507, 'epsilon': 0.10932239393515115}. Best is trial 88 with value: 0.3542875001421725.
[I 2024-12-03 19:07:15,917] Trial 1688 finished with value: 0.40982513358715306 and parameters: {'kernel': 'rbf', 'C': 19.84660475890178, 'gamma': 0.06246952406525472, 'epsilon': 0.28758561437150576}. Best is trial 88 with value: 0.3542875001421725.
[I 2024-12-03 19:07:17,973] Trial 1689 finished with value: 0.42377531804018065 and parameters: {'kernel': 'rbf', 'C': 92.60404797818167, 'gamma': 0.13026346031911518, 'epsilon': 0.020389446110668657}. Best is trial 88 with value: 0.3542875001421725.
[I 2024-12-03 19:07:19,285] Trial 1690 finished with value: 0.470795359244649 and parameters: {'kernel': 'rbf', 'C': 4.57529515330019, 'gamma': 0.0656168299855533, 'epsilon': 0.13750717989644853}. Best is trial 88 with value: 0.3542875001421725.
[I 2024-12-03 19:07:21,335] Trial 1691 finished with value: 0.43278717328499655 and parameters: {'kernel': 'rbf', 'C': 25.63969043296783, 'gamma': 0.0781140125890202, 'epsilon': 0.31794555134213004}. Best is trial 88 with value: 0.3542875001421725.
[I 2024-12-03 19:07:22,845] Trial 1692 finished with value: 0.381708990760321 and parameters: {'kernel': 'rbf', 'C': 98.5462030287938, 'gamma': 0.07320582013724691, 'epsilon': 0.10454464446205076}. Best is trial 88 with value: 0.3542875001421725.
[I 2024-12-03 19:07:24,738] Trial 1693 finished with value: 0.43188515281734113 and parameters: {'kernel': 'rbf', 'C': 22.850631046612637, 'gamma': 0.02151789286254096, 'epsilon': 0.021111432857115305}. Best is trial 88 with value: 0.3542875001421725.
[I 2024-12-03 19:07:26,297] Trial 1687 finished with value: 0.7663347473569689 and parameters: {'kernel': 'linear', 'C': 88.48795389975565, 'gamma': 0.0685752104449963, 'epsilon': 0.14656991771580435}. Best is trial 88 with value: 0.3542875001421725.
[I 2024-12-03 19:07:26,575] Trial 1694 finished with value: 0.4089472943192969 and parameters: {'kernel': 'rbf', 'C': 17.13068576195231, 'gamma': 0.06580733142179605, 'epsilon': 0.034430692675565935}. Best is trial 88 with value: 0.3542875001421725.
[I 2024-12-03 19:07:28,616] Trial 1695 finished with value: 0.37416731001237735 and parameters: {'kernel': 'rbf', 'C': 98.68008280321513, 'gamma': 0.019362498570396586, 'epsilon': 0.07140006640405852}. Best is trial 88 with value: 0.3542875001421725.
[I 2024-12-03 19:07:28,852] Trial 1696 finished with value: 0.41888093131708853 and parameters: {'kernel': 'rbf', 'C': 17.146737014559267, 'gamma': 0.039122590048262317, 'epsilon': 0.09721502912863648}. Best is trial 88 with value: 0.3542875001421725.
[I 2024-12-03 19:07:30,470] Trial 1697 finished with value: 0.4409124921033394 and parameters: {'kernel': 'rbf', 'C': 11.419492834947826, 'gamma': 0.11031035619360308, 'epsilon': 0.09489168906285567}. Best is trial 88 with value: 0.3542875001421725.
[I 2024-12-03 19:07:30,721] Trial 1698 finished with value: 0.4276667494799075 and parameters: {'kernel': 'rbf', 'C': 17.430568772505808, 'gamma': 0.11210170122773712, 'epsilon': 0.11221353078456865}. Best is trial 88 with value: 0.3542875001421725.
[I 2024-12-03 19:07:32,575] Trial 1699 finished with value: 1.0708685523709713 and parameters: {'kernel': 'poly', 'C': 0.25055306258808996, 'gamma': 0.00023525496331255273, 'epsilon': 0.0023313331686457806}. Best is trial 88 with value: 0.3542875001421725.
[I 2024-12-03 19:07:33,569] Trial 1700 finished with value: 0.35961799573618297 and parameters: {'kernel': 'rbf', 'C': 97.62315858430163, 'gamma': 0.043052441003888955, 'epsilon': 0.07019854572556085}. Best is trial 88 with value: 0.3542875001421725.
[I 2024-12-03 19:07:34,889] Trial 1701 finished with value: 0.3653430022175982 and parameters: {'kernel': 'rbf', 'C': 98.05369089765821, 'gamma': 0.03404171718136352, 'epsilon': 0.09647287086728613}. Best is trial 88 with value: 0.3542875001421725.
[I 2024-12-03 19:07:35,900] Trial 1702 finished with value: 0.43282550564135697 and parameters: {'kernel': 'rbf', 'C': 82.52101168643584, 'gamma': 0.006938679908747652, 'epsilon': 0.09998875935162967}. Best is trial 88 with value: 0.3542875001421725.
[I 2024-12-03 19:07:37,454] Trial 1704 finished with value: 0.3961551641861421 and parameters: {'kernel': 'rbf', 'C': 24.648836538436697, 'gamma': 0.07177382861669816, 'epsilon': 0.19021075410736465}. Best is trial 88 with value: 0.3542875001421725.
[I 2024-12-03 19:07:38,909] Trial 1705 finished with value: 0.39001040540881704 and parameters: {'kernel': 'rbf', 'C': 98.66522262460241, 'gamma': 0.06682645100886768, 'epsilon': 0.2797782118249742}. Best is trial 88 with value: 0.3542875001421725.
[I 2024-12-03 19:07:40,445] Trial 1706 finished with value: 0.4203588778171934 and parameters: {'kernel': 'rbf', 'C': 11.593228517679293, 'gamma': 0.012508101758163734, 'epsilon': 0.16327766788044001}. Best is trial 88 with value: 0.3542875001421725.
[I 2024-12-03 19:07:42,796] Trial 1707 finished with value: 0.36915231678384497 and parameters: {'kernel': 'rbf', 'C': 98.4538783411433, 'gamma': 0.03100715682065954, 'epsilon': 0.06667879225332991}. Best is trial 88 with value: 0.3542875001421725.
[I 2024-12-03 19:07:43,412] Trial 1321 finished with value: 3.2053295737413947 and parameters: {'kernel': 'poly', 'C': 98.8522320823103, 'gamma': 0.055345719031940216, 'epsilon': 0.025368245407554196}. Best is trial 88 with value: 0.3542875001421725.
[I 2024-12-03 19:07:44,162] Trial 1708 finished with value: 0.49398576928748267 and parameters: {'kernel': 'rbf', 'C': 3.5349147418779143, 'gamma': 0.011645114344923001, 'epsilon': 0.4171835454642644}. Best is trial 88 with value: 0.3542875001421725.
[I 2024-12-03 19:07:46,388] Trial 1709 finished with value: 0.38348054804750165 and parameters: {'kernel': 'rbf', 'C': 97.42719852072244, 'gamma': 0.0739713653203946, 'epsilon': 0.06158612773428988}. Best is trial 88 with value: 0.3542875001421725.
[I 2024-12-03 19:07:47,387] Trial 1710 finished with value: 0.3544731801450451 and parameters: {'kernel': 'rbf', 'C': 98.7410183473656, 'gamma': 0.04540870002094789, 'epsilon': 0.11980537628900167}. Best is trial 88 with value: 0.3542875001421725.
[I 2024-12-03 19:07:48,352] Trial 1711 finished with value: 1.0622589764464778 and parameters: {'kernel': 'rbf', 'C': 0.002653866680136948, 'gamma': 0.37493103623704876, 'epsilon': 0.04849851948710852}. Best is trial 88 with value: 0.3542875001421725.
[I 2024-12-03 19:07:49,469] Trial 1712 finished with value: 0.42490286716547765 and parameters: {'kernel': 'rbf', 'C': 23.221614271500478, 'gamma': 0.020733390786574594, 'epsilon': 0.0477533780313206}. Best is trial 88 with value: 0.3542875001421725.
[I 2024-12-03 19:07:50,514] Trial 1713 finished with value: 0.5819294773743477 and parameters: {'kernel': 'rbf', 'C': 3.142000798251555, 'gamma': 0.2830579915328424, 'epsilon': 0.011639252168621708}. Best is trial 88 with value: 0.3542875001421725.
[I 2024-12-03 19:07:51,477] Trial 1714 finished with value: 0.4627541862742387 and parameters: {'kernel': 'rbf', 'C': 3.225734118036992, 'gamma': 0.012828823353336632, 'epsilon': 0.04740366566124499}. Best is trial 88 with value: 0.3542875001421725.
[I 2024-12-03 19:07:52,402] Trial 1715 finished with value: 0.4492443258276339 and parameters: {'kernel': 'rbf', 'C': 26.210818054263502, 'gamma': 0.13286179994417513, 'epsilon': 0.13099611501195724}. Best is trial 88 with value: 0.3542875001421725.
[I 2024-12-03 19:07:53,561] Trial 1716 finished with value: 0.40348922584095864 and parameters: {'kernel': 'rbf', 'C': 15.227650129563548, 'gamma': 0.009021881669430252, 'epsilon': 0.006519029843996339}. Best is trial 88 with value: 0.3542875001421725.
[I 2024-12-03 19:07:54,691] Trial 1717 finished with value: 0.4162601732930745 and parameters: {'kernel': 'rbf', 'C': 22.0713019663733, 'gamma': 0.026000454717079662, 'epsilon': 0.10604797809265591}. Best is trial 88 with value: 0.3542875001421725.
[I 2024-12-03 19:07:55,625] Trial 1718 finished with value: 0.43054801685749594 and parameters: {'kernel': 'rbf', 'C': 28.663214970858075, 'gamma': 0.01469939321940478, 'epsilon': 0.1467319759516872}. Best is trial 88 with value: 0.3542875001421725.
[I 2024-12-03 19:07:56,669] Trial 1719 finished with value: 0.3890460971111276 and parameters: {'kernel': 'rbf', 'C': 24.295900160653645, 'gamma': 0.05948256665230741, 'epsilon': 0.06805088387732337}. Best is trial 88 with value: 0.3542875001421725.
[I 2024-12-03 19:07:57,934] Trial 1720 finished with value: 0.3670876906169985 and parameters: {'kernel': 'rbf', 'C': 98.76814689509786, 'gamma': 0.025115327843341324, 'epsilon': 0.07405572768394098}. Best is trial 88 with value: 0.3542875001421725.
[I 2024-12-03 19:07:58,870] Trial 1721 finished with value: 0.4245123667688123 and parameters: {'kernel': 'rbf', 'C': 90.13977787526971, 'gamma': 0.008391549365810012, 'epsilon': 0.11055119314012878}. Best is trial 88 with value: 0.3542875001421725.
[I 2024-12-03 19:08:00,417] Trial 1723 finished with value: 0.36118460712099704 and parameters: {'kernel': 'rbf', 'C': 98.19713187366789, 'gamma': 0.05543102292625853, 'epsilon': 0.15722158047341275}. Best is trial 88 with value: 0.3542875001421725.
[I 2024-12-03 19:08:01,305] Trial 1722 finished with value: 0.3671828644383994 and parameters: {'kernel': 'rbf', 'C': 87.02003709637069, 'gamma': 0.029446310284935325, 'epsilon': 0.038195078727275865}. Best is trial 88 with value: 0.3542875001421725.
[I 2024-12-03 19:08:02,236] Trial 1724 finished with value: 0.3756338412672346 and parameters: {'kernel': 'rbf', 'C': 95.9565845268069, 'gamma': 0.01635777903269797, 'epsilon': 0.17002774706287116}. Best is trial 88 with value: 0.3542875001421725.
[I 2024-12-03 19:08:03,272] Trial 1725 finished with value: 0.48824280684036264 and parameters: {'kernel': 'rbf', 'C': 5.538856204066569, 'gamma': 0.12221216512227012, 'epsilon': 0.041963982080444474}. Best is trial 88 with value: 0.3542875001421725.
[I 2024-12-03 19:08:03,880] Trial 1726 finished with value: 0.569114796335343 and parameters: {'kernel': 'rbf', 'C': 97.90924259227296, 'gamma': 0.20935590628669248, 'epsilon': 0.29530052765592063}. Best is trial 88 with value: 0.3542875001421725.
[I 2024-12-03 19:08:05,054] Trial 1727 finished with value: 0.520159599010945 and parameters: {'kernel': 'rbf', 'C': 94.56966625351953, 'gamma': 0.19865881085786477, 'epsilon': 0.15209967482027048}. Best is trial 88 with value: 0.3542875001421725.
[I 2024-12-03 19:08:05,999] Trial 1728 finished with value: 0.3699537422826144 and parameters: {'kernel': 'rbf', 'C': 95.08933057994993, 'gamma': 0.025793236992046907, 'epsilon': 0.19043663909729883}. Best is trial 88 with value: 0.3542875001421725.
[I 2024-12-03 19:08:08,554] Trial 1729 finished with value: 0.39963748263237237 and parameters: {'kernel': 'rbf', 'C': 96.16838987288507, 'gamma': 0.015050263546891578, 'epsilon': 0.01865327555143126}. Best is trial 88 with value: 0.3542875001421725.
[I 2024-12-03 19:08:10,224] Trial 1731 finished with value: 0.3724351112404029 and parameters: {'kernel': 'rbf', 'C': 98.00159467361857, 'gamma': 0.019689778119442343, 'epsilon': 0.179656711506545}. Best is trial 88 with value: 0.3542875001421725.
[I 2024-12-03 19:08:12,745] Trial 1732 finished with value: 0.43796842195732283 and parameters: {'kernel': 'rbf', 'C': 14.02179163128831, 'gamma': 0.11861611011961927, 'epsilon': 0.03860109949828466}. Best is trial 88 with value: 0.3542875001421725.
[I 2024-12-03 19:08:14,111] Trial 1733 finished with value: 0.4023839939509221 and parameters: {'kernel': 'rbf', 'C': 23.80227558634387, 'gamma': 0.09424793996222686, 'epsilon': 0.05766042079305903}. Best is trial 88 with value: 0.3542875001421725.
[I 2024-12-03 19:08:15,470] Trial 1734 finished with value: 0.43604329564220434 and parameters: {'kernel': 'rbf', 'C': 94.9574687101687, 'gamma': 0.12769959951423884, 'epsilon': 0.13577462347583574}. Best is trial 88 with value: 0.3542875001421725.
[I 2024-12-03 19:08:30,813] Trial 1735 finished with value: 1.5879065112793955 and parameters: {'kernel': 'poly', 'C': 19.78072565331567, 'gamma': 0.03186820394957269, 'epsilon': 0.32914790777802533}. Best is trial 88 with value: 0.3542875001421725.
[I 2024-12-03 19:08:32,471] Trial 1736 finished with value: 0.44898454855701353 and parameters: {'kernel': 'rbf', 'C': 10.87549619099691, 'gamma': 0.003307481800569403, 'epsilon': 0.024831560504535596}. Best is trial 88 with value: 0.3542875001421725.
[I 2024-12-03 19:08:33,726] Trial 1737 finished with value: 0.39786426761683236 and parameters: {'kernel': 'rbf', 'C': 26.06629291210426, 'gamma': 0.022532985604470975, 'epsilon': 0.24575404213412913}. Best is trial 88 with value: 0.3542875001421725.
[I 2024-12-03 19:08:35,116] Trial 1738 finished with value: 0.3910686595178014 and parameters: {'kernel': 'rbf', 'C': 22.497393823968, 'gamma': 0.047522478195456026, 'epsilon': 0.13801516121601745}. Best is trial 88 with value: 0.3542875001421725.
[I 2024-12-03 19:08:36,605] Trial 1739 finished with value: 2104.77186920955 and parameters: {'kernel': 'sigmoid', 'C': 98.83328345852104, 'gamma': 0.039041746938267424, 'epsilon': 0.1680030993685906}. Best is trial 88 with value: 0.3542875001421725.
[I 2024-12-03 19:08:38,299] Trial 1740 finished with value: 0.42461077112100243 and parameters: {'kernel': 'rbf', 'C': 22.80035208314158, 'gamma': 0.020272299584554124, 'epsilon': 0.05186203814261203}. Best is trial 88 with value: 0.3542875001421725.
[I 2024-12-03 19:08:39,763] Trial 1741 finished with value: 8.012192661930644 and parameters: {'kernel': 'sigmoid', 'C': 0.37261309959340433, 'gamma': 0.08671492488491704, 'epsilon': 0.001018358963265247}. Best is trial 88 with value: 0.3542875001421725.
[I 2024-12-03 19:08:41,826] Trial 1742 finished with value: 0.8502037427504401 and parameters: {'kernel': 'linear', 'C': 26.711947868043165, 'gamma': 0.00021222125816223086, 'epsilon': 0.8098665568209383}. Best is trial 88 with value: 0.3542875001421725.
[I 2024-12-03 19:08:43,369] Trial 1743 finished with value: 0.8110012925045216 and parameters: {'kernel': 'rbf', 'C': 63.14278853340207, 'gamma': 0.9421905655053496, 'epsilon': 0.017541438761314778}. Best is trial 88 with value: 0.3542875001421725.
