[I 2024-12-04 15:11:50,066] Trial 1464 finished with value: 0.6330917306708265 and parameters: {'n_estimators': 1403, 'learning_rate': 0.04182385956426073, 'max_depth': 10, 'min_samples_split': 20, 'min_samples_leaf': 3, 'subsample': 0.9643179693324719, 'max_features': None}. Best is trial 1435 with value: 0.45467030752684195.
[I 2024-12-04 15:11:50,103] Trial 1491 finished with value: 0.8493709489784156 and parameters: {'n_estimators': 235, 'learning_rate': 0.013539237853340163, 'max_depth': 8, 'min_samples_split': 5, 'min_samples_leaf': 5, 'subsample': 0.9052596538733134, 'max_features': 'sqrt'}. Best is trial 1435 with value: 0.45467030752684195.
[I 2024-12-04 15:11:52,881] Trial 1476 finished with value: 0.475763383223787 and parameters: {'n_estimators': 901, 'learning_rate': 0.061087382895038254, 'max_depth': 11, 'min_samples_split': 19, 'min_samples_leaf': 1, 'subsample': 0.9663281844566298, 'max_features': None}. Best is trial 1435 with value: 0.45467030752684195.
[I 2024-12-04 15:11:53,133] Trial 1465 finished with value: 0.6127092475427632 and parameters: {'n_estimators': 1333, 'learning_rate': 0.036669822103322515, 'max_depth': 12, 'min_samples_split': 20, 'min_samples_leaf': 2, 'subsample': 0.9990856177791422, 'max_features': None}. Best is trial 1435 with value: 0.45467030752684195.
[I 2024-12-04 15:11:56,534] Trial 1494 finished with value: 1.103142023662178 and parameters: {'n_estimators': 358, 'learning_rate': 0.019213378123860616, 'max_depth': 6, 'min_samples_split': 3, 'min_samples_leaf': 9, 'subsample': 0.7580891223924888, 'max_features': 'log2'}. Best is trial 1435 with value: 0.45467030752684195.
[I 2024-12-04 15:11:56,566] Trial 1469 finished with value: 0.6598346798546444 and parameters: {'n_estimators': 1420, 'learning_rate': 0.08218348746525363, 'max_depth': 12, 'min_samples_split': 20, 'min_samples_leaf': 2, 'subsample': 0.9892577558479181, 'max_features': 'sqrt'}. Best is trial 1435 with value: 0.45467030752684195.
[I 2024-12-04 15:11:56,573] Trial 1484 finished with value: 0.6482344622512102 and parameters: {'n_estimators': 865, 'learning_rate': 0.04471801634400606, 'max_depth': 12, 'min_samples_split': 19, 'min_samples_leaf': 3, 'subsample': 0.9791655211162791, 'max_features': 'log2'}. Best is trial 1435 with value: 0.45467030752684195.
[I 2024-12-04 15:11:57,428] Trial 1475 finished with value: 0.49574855162161413 and parameters: {'n_estimators': 1136, 'learning_rate': 0.06556530797184154, 'max_depth': 10, 'min_samples_split': 20, 'min_samples_leaf': 1, 'subsample': 0.9967267088533139, 'max_features': None}. Best is trial 1435 with value: 0.45467030752684195.
[I 2024-12-04 15:11:58,468] Trial 1478 finished with value: 0.5020778520868457 and parameters: {'n_estimators': 933, 'learning_rate': 0.07569524814156195, 'max_depth': 12, 'min_samples_split': 16, 'min_samples_leaf': 1, 'subsample': 0.9971172318073539, 'max_features': None}. Best is trial 1435 with value: 0.45467030752684195.
[I 2024-12-04 15:12:01,063] Trial 1482 finished with value: 0.6488526752711722 and parameters: {'n_estimators': 899, 'learning_rate': 0.06402664534076055, 'max_depth': 11, 'min_samples_split': 20, 'min_samples_leaf': 3, 'subsample': 0.9262106928417461, 'max_features': None}. Best is trial 1435 with value: 0.45467030752684195.
[I 2024-12-04 15:12:01,516] Trial 1485 finished with value: 0.6349490374704121 and parameters: {'n_estimators': 792, 'learning_rate': 0.05788577624400474, 'max_depth': 11, 'min_samples_split': 16, 'min_samples_leaf': 3, 'subsample': 0.9985930135488438, 'max_features': None}. Best is trial 1435 with value: 0.45467030752684195.
[I 2024-12-04 15:12:02,206] Trial 1477 finished with value: 0.6234112014600256 and parameters: {'n_estimators': 1016, 'learning_rate': 0.07511360807794844, 'max_depth': 12, 'min_samples_split': 17, 'min_samples_leaf': 2, 'subsample': 0.9974463615506073, 'max_features': None}. Best is trial 1435 with value: 0.45467030752684195.
[I 2024-12-04 15:12:02,252] Trial 1472 finished with value: 0.665583618046883 and parameters: {'n_estimators': 1342, 'learning_rate': 0.08182379415358283, 'max_depth': 12, 'min_samples_split': 20, 'min_samples_leaf': 3, 'subsample': 0.9963335059084213, 'max_features': None}. Best is trial 1435 with value: 0.45467030752684195.
[I 2024-12-04 15:12:02,520] Trial 1508 finished with value: 0.9068499403367464 and parameters: {'n_estimators': 132, 'learning_rate': 0.051215054055158464, 'max_depth': 7, 'min_samples_split': 11, 'min_samples_leaf': 3, 'subsample': 0.6959521168870637, 'max_features': 'log2'}. Best is trial 1435 with value: 0.45467030752684195.
[I 2024-12-04 15:12:06,178] Trial 1492 finished with value: 0.691151321571055 and parameters: {'n_estimators': 780, 'learning_rate': 0.05313670839946445, 'max_depth': 6, 'min_samples_split': 3, 'min_samples_leaf': 2, 'subsample': 0.8255326325919304, 'max_features': 'sqrt'}. Best is trial 1435 with value: 0.45467030752684195.
[I 2024-12-04 15:12:08,078] Trial 1479 finished with value: 0.593132463581672 and parameters: {'n_estimators': 1189, 'learning_rate': 0.09755546619078623, 'max_depth': 12, 'min_samples_split': 20, 'min_samples_leaf': 2, 'subsample': 0.9766969934482105, 'max_features': None}. Best is trial 1435 with value: 0.45467030752684195.
[I 2024-12-04 15:12:09,987] Trial 1481 finished with value: 0.4711920702444835 and parameters: {'n_estimators': 1182, 'learning_rate': 0.07683399205531195, 'max_depth': 12, 'min_samples_split': 20, 'min_samples_leaf': 1, 'subsample': 0.9865748222208477, 'max_features': None}. Best is trial 1435 with value: 0.45467030752684195.
[I 2024-12-04 15:12:10,743] Trial 1490 finished with value: 0.4991848974492291 and parameters: {'n_estimators': 871, 'learning_rate': 0.056862482597572706, 'max_depth': 10, 'min_samples_split': 19, 'min_samples_leaf': 1, 'subsample': 0.9964977796721655, 'max_features': None}. Best is trial 1435 with value: 0.45467030752684195.
[I 2024-12-04 15:12:14,891] Trial 1513 finished with value: 0.9357378402896268 and parameters: {'n_estimators': 529, 'learning_rate': 0.017753222458212748, 'max_depth': 11, 'min_samples_split': 5, 'min_samples_leaf': 3, 'subsample': 0.6787121145548606, 'max_features': 'log2'}. Best is trial 1435 with value: 0.45467030752684195.
[I 2024-12-04 15:12:17,467] Trial 1486 finished with value: 0.48448809424308126 and parameters: {'n_estimators': 1425, 'learning_rate': 0.09407244205830108, 'max_depth': 6, 'min_samples_split': 20, 'min_samples_leaf': 1, 'subsample': 0.9613592570678121, 'max_features': None}. Best is trial 1435 with value: 0.45467030752684195.
[I 2024-12-04 15:12:17,976] Trial 1505 finished with value: 0.626578898117378 and parameters: {'n_estimators': 784, 'learning_rate': 0.07523479745847594, 'max_depth': 12, 'min_samples_split': 19, 'min_samples_leaf': 3, 'subsample': 0.9811553803144218, 'max_features': None}. Best is trial 1435 with value: 0.45467030752684195.
[I 2024-12-04 15:12:18,911] Trial 1493 finished with value: 0.7028313007930755 and parameters: {'n_estimators': 1300, 'learning_rate': 0.01980120595006879, 'max_depth': 5, 'min_samples_split': 15, 'min_samples_leaf': 4, 'subsample': 0.8651845885416414, 'max_features': 'log2'}. Best is trial 1435 with value: 0.45467030752684195.
[I 2024-12-04 15:12:19,801] Trial 1499 finished with value: 0.4711239286058105 and parameters: {'n_estimators': 955, 'learning_rate': 0.06551501377571266, 'max_depth': 12, 'min_samples_split': 18, 'min_samples_leaf': 1, 'subsample': 0.9260046943867886, 'max_features': None}. Best is trial 1435 with value: 0.45467030752684195.
[I 2024-12-04 15:12:20,381] Trial 1489 finished with value: 0.681055734783365 and parameters: {'n_estimators': 1228, 'learning_rate': 0.08249783354220909, 'max_depth': 12, 'min_samples_split': 10, 'min_samples_leaf': 2, 'subsample': 0.9228835463835682, 'max_features': None}. Best is trial 1435 with value: 0.45467030752684195.
[I 2024-12-04 15:12:22,801] Trial 1523 finished with value: 0.6023235529852813 and parameters: {'n_estimators': 344, 'learning_rate': 0.08040073950591835, 'max_depth': 5, 'min_samples_split': 20, 'min_samples_leaf': 6, 'subsample': 0.7915376038530011, 'max_features': None}. Best is trial 1435 with value: 0.45467030752684195.
[I 2024-12-04 15:12:23,928] Trial 1497 finished with value: 0.487350120143727 and parameters: {'n_estimators': 1024, 'learning_rate': 0.07279922040613332, 'max_depth': 12, 'min_samples_split': 18, 'min_samples_leaf': 1, 'subsample': 0.9849650777226604, 'max_features': None}. Best is trial 1435 with value: 0.45467030752684195.
[I 2024-12-04 15:12:23,962] Trial 1488 finished with value: 0.47677201271216135 and parameters: {'n_estimators': 1417, 'learning_rate': 0.058208513678829864, 'max_depth': 12, 'min_samples_split': 19, 'min_samples_leaf': 1, 'subsample': 0.9979843426335105, 'max_features': None}. Best is trial 1435 with value: 0.45467030752684195.
[I 2024-12-04 15:12:24,780] Trial 1504 finished with value: 0.4795617107975972 and parameters: {'n_estimators': 855, 'learning_rate': 0.07491356422957718, 'max_depth': 12, 'min_samples_split': 17, 'min_samples_leaf': 1, 'subsample': 0.9999741244318009, 'max_features': None}. Best is trial 1435 with value: 0.45467030752684195.
[I 2024-12-04 15:12:25,857] Trial 1496 finished with value: 0.7178078539568252 and parameters: {'n_estimators': 1450, 'learning_rate': 0.06916168882265489, 'max_depth': 12, 'min_samples_split': 20, 'min_samples_leaf': 2, 'subsample': 0.8493316569390527, 'max_features': 'log2'}. Best is trial 1435 with value: 0.45467030752684195.
[I 2024-12-04 15:12:26,536] Trial 1495 finished with value: 0.474684488033497 and parameters: {'n_estimators': 1193, 'learning_rate': 0.06295114911514856, 'max_depth': 12, 'min_samples_split': 17, 'min_samples_leaf': 1, 'subsample': 0.9886685673924878, 'max_features': None}. Best is trial 1435 with value: 0.45467030752684195.
[I 2024-12-04 15:12:29,424] Trial 1514 finished with value: 0.9364001848430298 and parameters: {'n_estimators': 1069, 'learning_rate': 0.015672469382933363, 'max_depth': 6, 'min_samples_split': 8, 'min_samples_leaf': 8, 'subsample': 0.9978140419795709, 'max_features': 'log2'}. Best is trial 1435 with value: 0.45467030752684195.
[I 2024-12-04 15:12:30,379] Trial 1506 finished with value: 0.4564755205020794 and parameters: {'n_estimators': 1024, 'learning_rate': 0.07268171382322205, 'max_depth': 12, 'min_samples_split': 18, 'min_samples_leaf': 1, 'subsample': 0.9910995165144947, 'max_features': None}. Best is trial 1435 with value: 0.45467030752684195.
[I 2024-12-04 15:12:31,163] Trial 1503 finished with value: 0.6621705939253397 and parameters: {'n_estimators': 1421, 'learning_rate': 0.04166196054736215, 'max_depth': 4, 'min_samples_split': 3, 'min_samples_leaf': 5, 'subsample': 0.8282742770379135, 'max_features': 'sqrt'}. Best is trial 1435 with value: 0.45467030752684195.
[I 2024-12-04 15:12:31,345] Trial 1502 finished with value: 0.6136562899386615 and parameters: {'n_estimators': 1087, 'learning_rate': 0.04420830064828192, 'max_depth': 12, 'min_samples_split': 20, 'min_samples_leaf': 3, 'subsample': 0.9978542037356555, 'max_features': None}. Best is trial 1435 with value: 0.45467030752684195.
[I 2024-12-04 15:12:31,372] Trial 1509 finished with value: 0.6665020157285683 and parameters: {'n_estimators': 1043, 'learning_rate': 0.08462978278879185, 'max_depth': 10, 'min_samples_split': 16, 'min_samples_leaf': 2, 'subsample': 0.9303177180755168, 'max_features': None}. Best is trial 1435 with value: 0.45467030752684195.
[I 2024-12-04 15:12:34,036] Trial 1498 finished with value: 0.6795579068508203 and parameters: {'n_estimators': 1444, 'learning_rate': 0.05478753173659107, 'max_depth': 6, 'min_samples_split': 15, 'min_samples_leaf': 3, 'subsample': 0.7293139901397563, 'max_features': None}. Best is trial 1435 with value: 0.45467030752684195.
[I 2024-12-04 15:12:35,672] Trial 1522 finished with value: 0.7503137242027592 and parameters: {'n_estimators': 742, 'learning_rate': 0.08530837369924746, 'max_depth': 10, 'min_samples_split': 12, 'min_samples_leaf': 9, 'subsample': 0.9036023323023257, 'max_features': None}. Best is trial 1435 with value: 0.45467030752684195.
[I 2024-12-04 15:12:36,465] Trial 1511 finished with value: 0.5061893548000663 and parameters: {'n_estimators': 1064, 'learning_rate': 0.08659499433971161, 'max_depth': 12, 'min_samples_split': 16, 'min_samples_leaf': 1, 'subsample': 0.9911130701326903, 'max_features': None}. Best is trial 1435 with value: 0.45467030752684195.
[I 2024-12-04 15:12:36,471] Trial 1500 finished with value: 0.6313281407921228 and parameters: {'n_estimators': 1390, 'learning_rate': 0.05965424950287204, 'max_depth': 10, 'min_samples_split': 20, 'min_samples_leaf': 3, 'subsample': 0.994436095909837, 'max_features': None}. Best is trial 1435 with value: 0.45467030752684195.
[I 2024-12-04 15:12:38,351] Trial 1510 finished with value: 0.5079859060603159 and parameters: {'n_estimators': 1413, 'learning_rate': 0.044941656235392737, 'max_depth': 12, 'min_samples_split': 10, 'min_samples_leaf': 1, 'subsample': 0.8091541174220795, 'max_features': 'sqrt'}. Best is trial 1435 with value: 0.45467030752684195.
[I 2024-12-04 15:12:39,732] Trial 1501 finished with value: 0.48127023682969516 and parameters: {'n_estimators': 1466, 'learning_rate': 0.09804531060074788, 'max_depth': 12, 'min_samples_split': 20, 'min_samples_leaf': 1, 'subsample': 0.9545536877698961, 'max_features': None}. Best is trial 1435 with value: 0.45467030752684195.
[I 2024-12-04 15:12:40,074] Trial 1518 finished with value: 0.738183316572624 and parameters: {'n_estimators': 1060, 'learning_rate': 0.013753333117007972, 'max_depth': 9, 'min_samples_split': 7, 'min_samples_leaf': 9, 'subsample': 0.6655973637963531, 'max_features': None}. Best is trial 1435 with value: 0.45467030752684195.
[I 2024-12-04 15:12:43,266] Trial 1512 finished with value: 0.48993377620993545 and parameters: {'n_estimators': 1256, 'learning_rate': 0.08401895340128761, 'max_depth': 12, 'min_samples_split': 16, 'min_samples_leaf': 1, 'subsample': 0.9404060147614112, 'max_features': None}. Best is trial 1435 with value: 0.45467030752684195.
[I 2024-12-04 15:12:44,283] Trial 1507 finished with value: 0.4747260841806018 and parameters: {'n_estimators': 1487, 'learning_rate': 0.051464416335109474, 'max_depth': 10, 'min_samples_split': 20, 'min_samples_leaf': 1, 'subsample': 0.8945137533247987, 'max_features': None}. Best is trial 1435 with value: 0.45467030752684195.
[I 2024-12-04 15:12:46,090] Trial 1515 finished with value: 0.5400049627353458 and parameters: {'n_estimators': 1479, 'learning_rate': 0.03729894396800221, 'max_depth': 10, 'min_samples_split': 18, 'min_samples_leaf': 1, 'subsample': 0.9974505424799305, 'max_features': 'sqrt'}. Best is trial 1435 with value: 0.45467030752684195.
[I 2024-12-04 15:12:47,968] Trial 1517 finished with value: 0.4702585056838894 and parameters: {'n_estimators': 1203, 'learning_rate': 0.09790270904198921, 'max_depth': 11, 'min_samples_split': 20, 'min_samples_leaf': 1, 'subsample': 0.9895982769101488, 'max_features': None}. Best is trial 1435 with value: 0.45467030752684195.
[I 2024-12-04 15:12:49,037] Trial 1516 finished with value: 0.4756818028351198 and parameters: {'n_estimators': 1334, 'learning_rate': 0.06874788961784879, 'max_depth': 10, 'min_samples_split': 18, 'min_samples_leaf': 1, 'subsample': 0.9890333603954093, 'max_features': None}. Best is trial 1435 with value: 0.45467030752684195.
[I 2024-12-04 15:12:51,808] Trial 1532 finished with value: 0.49686379303009587 and parameters: {'n_estimators': 723, 'learning_rate': 0.054624400476261166, 'max_depth': 12, 'min_samples_split': 20, 'min_samples_leaf': 1, 'subsample': 0.9991355623334233, 'max_features': None}. Best is trial 1435 with value: 0.45467030752684195.
[I 2024-12-04 15:12:51,809] Trial 1519 finished with value: 0.46200063544166714 and parameters: {'n_estimators': 1302, 'learning_rate': 0.07288827801841956, 'max_depth': 12, 'min_samples_split': 20, 'min_samples_leaf': 1, 'subsample': 0.9904983836932155, 'max_features': None}. Best is trial 1435 with value: 0.45467030752684195.
[I 2024-12-04 15:12:52,294] Trial 1521 finished with value: 0.6383005930696188 and parameters: {'n_estimators': 1316, 'learning_rate': 0.0283384826127395, 'max_depth': 10, 'min_samples_split': 18, 'min_samples_leaf': 2, 'subsample': 0.8427525689874517, 'max_features': None}. Best is trial 1435 with value: 0.45467030752684195.
[I 2024-12-04 15:12:52,507] Trial 1520 finished with value: 0.4747751638549952 and parameters: {'n_estimators': 1290, 'learning_rate': 0.03724177049267004, 'max_depth': 12, 'min_samples_split': 17, 'min_samples_leaf': 1, 'subsample': 0.9696707234866537, 'max_features': None}. Best is trial 1435 with value: 0.45467030752684195.
[I 2024-12-04 15:12:53,298] Trial 1525 finished with value: 0.48310357337926224 and parameters: {'n_estimators': 962, 'learning_rate': 0.049968926597724166, 'max_depth': 12, 'min_samples_split': 19, 'min_samples_leaf': 1, 'subsample': 0.9947544889087332, 'max_features': None}. Best is trial 1435 with value: 0.45467030752684195.
[I 2024-12-04 15:12:56,255] Trial 1524 finished with value: 0.4904852949059939 and parameters: {'n_estimators': 1133, 'learning_rate': 0.09928937523956011, 'max_depth': 12, 'min_samples_split': 17, 'min_samples_leaf': 1, 'subsample': 0.9218367038156423, 'max_features': None}. Best is trial 1435 with value: 0.45467030752684195.
[I 2024-12-04 15:12:56,736] Trial 1545 finished with value: 0.6906380657507077 and parameters: {'n_estimators': 618, 'learning_rate': 0.03583296164700005, 'max_depth': 7, 'min_samples_split': 13, 'min_samples_leaf': 5, 'subsample': 0.7341193699859364, 'max_features': 'sqrt'}. Best is trial 1435 with value: 0.45467030752684195.
[I 2024-12-04 15:12:58,431] Trial 1533 finished with value: 0.4747524807212881 and parameters: {'n_estimators': 866, 'learning_rate': 0.04610186902000648, 'max_depth': 12, 'min_samples_split': 19, 'min_samples_leaf': 1, 'subsample': 0.9902492181664044, 'max_features': None}. Best is trial 1435 with value: 0.45467030752684195.
[I 2024-12-04 15:12:58,432] Trial 1526 finished with value: 0.48982325327082643 and parameters: {'n_estimators': 1116, 'learning_rate': 0.09017589773799113, 'max_depth': 10, 'min_samples_split': 17, 'min_samples_leaf': 1, 'subsample': 0.9963411991061654, 'max_features': None}. Best is trial 1435 with value: 0.45467030752684195.
[I 2024-12-04 15:12:59,484] Trial 1527 finished with value: 0.623839203885597 and parameters: {'n_estimators': 1106, 'learning_rate': 0.06339793811993172, 'max_depth': 12, 'min_samples_split': 17, 'min_samples_leaf': 3, 'subsample': 0.9949828788009251, 'max_features': None}. Best is trial 1435 with value: 0.45467030752684195.
[I 2024-12-04 15:13:01,127] Trial 1534 finished with value: 0.558841180692162 and parameters: {'n_estimators': 1177, 'learning_rate': 0.03951482741003339, 'max_depth': 10, 'min_samples_split': 20, 'min_samples_leaf': 1, 'subsample': 0.9426160178761801, 'max_features': 'sqrt'}. Best is trial 1435 with value: 0.45467030752684195.
[I 2024-12-04 15:13:03,585] Trial 1531 finished with value: 0.4866908000659401 and parameters: {'n_estimators': 1074, 'learning_rate': 0.05785035312732994, 'max_depth': 10, 'min_samples_split': 20, 'min_samples_leaf': 1, 'subsample': 0.9632090412022906, 'max_features': None}. Best is trial 1435 with value: 0.45467030752684195.
[I 2024-12-04 15:13:04,870] Trial 1535 finished with value: 0.4628567067363785 and parameters: {'n_estimators': 1030, 'learning_rate': 0.07776784309267296, 'max_depth': 12, 'min_samples_split': 19, 'min_samples_leaf': 1, 'subsample': 0.9957948839071568, 'max_features': None}. Best is trial 1435 with value: 0.45467030752684195.
[I 2024-12-04 15:13:04,895] Trial 1536 finished with value: 0.6411981202364984 and parameters: {'n_estimators': 979, 'learning_rate': 0.05549199967615752, 'max_depth': 12, 'min_samples_split': 16, 'min_samples_leaf': 3, 'subsample': 0.9969813857473432, 'max_features': None}. Best is trial 1435 with value: 0.45467030752684195.
[I 2024-12-04 15:13:06,635] Trial 1537 finished with value: 0.6435682910120922 and parameters: {'n_estimators': 986, 'learning_rate': 0.0680952326933645, 'max_depth': 12, 'min_samples_split': 20, 'min_samples_leaf': 2, 'subsample': 0.9662915673926796, 'max_features': None}. Best is trial 1435 with value: 0.45467030752684195.
[I 2024-12-04 15:13:07,526] Trial 1530 finished with value: 0.629077633231932 and parameters: {'n_estimators': 1254, 'learning_rate': 0.05211026224250053, 'max_depth': 12, 'min_samples_split': 17, 'min_samples_leaf': 2, 'subsample': 0.9196740115674621, 'max_features': None}. Best is trial 1435 with value: 0.45467030752684195.
[I 2024-12-04 15:13:08,535] Trial 1538 finished with value: 0.5648372202896078 and parameters: {'n_estimators': 1228, 'learning_rate': 0.078518622068887, 'max_depth': 10, 'min_samples_split': 20, 'min_samples_leaf': 1, 'subsample': 0.9925723151889149, 'max_features': 'sqrt'}. Best is trial 1435 with value: 0.45467030752684195.
[I 2024-12-04 15:13:08,587] Trial 1540 finished with value: 0.47936971296624886 and parameters: {'n_estimators': 991, 'learning_rate': 0.07168705759514711, 'max_depth': 10, 'min_samples_split': 18, 'min_samples_leaf': 1, 'subsample': 0.9369747763667108, 'max_features': None}. Best is trial 1435 with value: 0.45467030752684195.
[I 2024-12-04 15:13:09,423] Trial 1558 finished with value: 1.1868572943903535 and parameters: {'n_estimators': 364, 'learning_rate': 0.01062497761578536, 'max_depth': 5, 'min_samples_split': 18, 'min_samples_leaf': 9, 'subsample': 0.6717101072410634, 'max_features': 'log2'}. Best is trial 1435 with value: 0.45467030752684195.
