[I 2024-12-04 14:59:53,216] Trial 860 finished with value: 0.665975419363206 and parameters: {'n_estimators': 1492, 'learning_rate': 0.06566137324534983, 'max_depth': 11, 'min_samples_split': 19, 'min_samples_leaf': 3, 'subsample': 0.9506641870082544, 'max_features': None}. Best is trial 603 with value: 0.45955205541891275.
[I 2024-12-04 14:59:53,362] Trial 861 finished with value: 0.5097702566715177 and parameters: {'n_estimators': 1483, 'learning_rate': 0.08321637152036437, 'max_depth': 12, 'min_samples_split': 14, 'min_samples_leaf': 1, 'subsample': 0.9822171928939539, 'max_features': None}. Best is trial 603 with value: 0.45955205541891275.
[I 2024-12-04 14:59:55,164] Trial 867 finished with value: 0.5115482853578102 and parameters: {'n_estimators': 1394, 'learning_rate': 0.05972482930529054, 'max_depth': 11, 'min_samples_split': 16, 'min_samples_leaf': 1, 'subsample': 0.9928003610012535, 'max_features': None}. Best is trial 603 with value: 0.45955205541891275.
[I 2024-12-04 14:59:58,157] Trial 876 finished with value: 0.5777180789584929 and parameters: {'n_estimators': 1096, 'learning_rate': 0.09273602901149068, 'max_depth': 9, 'min_samples_split': 20, 'min_samples_leaf': 5, 'subsample': 0.9733282299122471, 'max_features': None}. Best is trial 603 with value: 0.45955205541891275.
[I 2024-12-04 15:00:01,229] Trial 880 finished with value: 0.5240613365717983 and parameters: {'n_estimators': 1139, 'learning_rate': 0.08116396823032554, 'max_depth': 5, 'min_samples_split': 4, 'min_samples_leaf': 1, 'subsample': 0.6804273853363849, 'max_features': None}. Best is trial 603 with value: 0.45955205541891275.
[I 2024-12-04 15:00:02,863] Trial 881 finished with value: 0.5626917050900487 and parameters: {'n_estimators': 1263, 'learning_rate': 0.07290400058904202, 'max_depth': 12, 'min_samples_split': 20, 'min_samples_leaf': 1, 'subsample': 0.912020469024906, 'max_features': 'log2'}. Best is trial 603 with value: 0.45955205541891275.
[I 2024-12-04 15:00:04,809] Trial 875 finished with value: 0.6371418448570201 and parameters: {'n_estimators': 1399, 'learning_rate': 0.08258770825191838, 'max_depth': 12, 'min_samples_split': 20, 'min_samples_leaf': 2, 'subsample': 0.9941180882795839, 'max_features': None}. Best is trial 603 with value: 0.45955205541891275.
[I 2024-12-04 15:00:05,952] Trial 884 finished with value: 0.5107619011537659 and parameters: {'n_estimators': 868, 'learning_rate': 0.08680941971282695, 'max_depth': 12, 'min_samples_split': 16, 'min_samples_leaf': 1, 'subsample': 0.9991065465432211, 'max_features': None}. Best is trial 603 with value: 0.45955205541891275.
[I 2024-12-04 15:00:07,546] Trial 887 finished with value: 0.6760644093923552 and parameters: {'n_estimators': 895, 'learning_rate': 0.025048059770345923, 'max_depth': 6, 'min_samples_split': 16, 'min_samples_leaf': 7, 'subsample': 0.7807481011392119, 'max_features': None}. Best is trial 603 with value: 0.45955205541891275.
[I 2024-12-04 15:00:11,650] Trial 877 finished with value: 0.46361521589286575 and parameters: {'n_estimators': 1439, 'learning_rate': 0.06462825283500953, 'max_depth': 12, 'min_samples_split': 20, 'min_samples_leaf': 1, 'subsample': 0.9771739438398596, 'max_features': None}. Best is trial 603 with value: 0.45955205541891275.
[I 2024-12-04 15:00:12,853] Trial 882 finished with value: 0.4656255871242971 and parameters: {'n_estimators': 1135, 'learning_rate': 0.05711254507152005, 'max_depth': 12, 'min_samples_split': 19, 'min_samples_leaf': 1, 'subsample': 0.9905293788682198, 'max_features': None}. Best is trial 603 with value: 0.45955205541891275.
[I 2024-12-04 15:00:13,505] Trial 894 finished with value: 0.6499700827559285 and parameters: {'n_estimators': 879, 'learning_rate': 0.012573174512758, 'max_depth': 8, 'min_samples_split': 9, 'min_samples_leaf': 7, 'subsample': 0.983125605462589, 'max_features': None}. Best is trial 603 with value: 0.45955205541891275.
[I 2024-12-04 15:00:14,768] Trial 892 finished with value: 0.7778184745736767 and parameters: {'n_estimators': 1223, 'learning_rate': 0.07655443903732327, 'max_depth': 8, 'min_samples_split': 14, 'min_samples_leaf': 8, 'subsample': 0.7618880841535761, 'max_features': 'sqrt'}. Best is trial 603 with value: 0.45955205541891275.
[I 2024-12-04 15:00:15,273] Trial 886 finished with value: 0.6668289858173821 and parameters: {'n_estimators': 1380, 'learning_rate': 0.060432537339456464, 'max_depth': 12, 'min_samples_split': 19, 'min_samples_leaf': 5, 'subsample': 0.9747712018221663, 'max_features': 'sqrt'}. Best is trial 603 with value: 0.45955205541891275.
[I 2024-12-04 15:00:15,464] Trial 878 finished with value: 0.48259711818064477 and parameters: {'n_estimators': 1448, 'learning_rate': 0.09845976193783752, 'max_depth': 12, 'min_samples_split': 17, 'min_samples_leaf': 1, 'subsample': 0.9624487253407786, 'max_features': None}. Best is trial 603 with value: 0.45955205541891275.
[I 2024-12-04 15:00:16,007] Trial 879 finished with value: 0.49101219391848244 and parameters: {'n_estimators': 1448, 'learning_rate': 0.07737738063594626, 'max_depth': 12, 'min_samples_split': 20, 'min_samples_leaf': 1, 'subsample': 0.8893470518453037, 'max_features': None}. Best is trial 603 with value: 0.45955205541891275.
[I 2024-12-04 15:00:17,353] Trial 885 finished with value: 0.5065659096759815 and parameters: {'n_estimators': 1143, 'learning_rate': 0.09837911227816552, 'max_depth': 12, 'min_samples_split': 19, 'min_samples_leaf': 1, 'subsample': 0.958565705878831, 'max_features': None}. Best is trial 603 with value: 0.45955205541891275.
[I 2024-12-04 15:00:19,183] Trial 895 finished with value: 0.6345823069589196 and parameters: {'n_estimators': 872, 'learning_rate': 0.09042439573832395, 'max_depth': 11, 'min_samples_split': 19, 'min_samples_leaf': 4, 'subsample': 0.998087034737659, 'max_features': None}. Best is trial 603 with value: 0.45955205541891275.
[I 2024-12-04 15:00:19,490] Trial 913 finished with value: 1.1803807228913035 and parameters: {'n_estimators': 194, 'learning_rate': 0.012499166319174788, 'max_depth': 11, 'min_samples_split': 9, 'min_samples_leaf': 8, 'subsample': 0.723237427672621, 'max_features': 'log2'}. Best is trial 603 with value: 0.45955205541891275.
[I 2024-12-04 15:00:20,172] Trial 889 finished with value: 0.47811996442907445 and parameters: {'n_estimators': 1078, 'learning_rate': 0.0946240694434513, 'max_depth': 12, 'min_samples_split': 20, 'min_samples_leaf': 1, 'subsample': 0.9957452186463774, 'max_features': None}. Best is trial 603 with value: 0.45955205541891275.
[I 2024-12-04 15:00:22,567] Trial 883 finished with value: 0.5080609569738306 and parameters: {'n_estimators': 1445, 'learning_rate': 0.09067731078802388, 'max_depth': 10, 'min_samples_split': 20, 'min_samples_leaf': 1, 'subsample': 0.8367948749007101, 'max_features': None}. Best is trial 603 with value: 0.45955205541891275.
[I 2024-12-04 15:00:25,567] Trial 890 finished with value: 0.6194660469884687 and parameters: {'n_estimators': 1297, 'learning_rate': 0.04723411830590761, 'max_depth': 11, 'min_samples_split': 20, 'min_samples_leaf': 2, 'subsample': 0.9880616060109233, 'max_features': None}. Best is trial 603 with value: 0.45955205541891275.
[I 2024-12-04 15:00:27,613] Trial 909 finished with value: 0.6605883681373831 and parameters: {'n_estimators': 945, 'learning_rate': 0.09713292924434318, 'max_depth': 12, 'min_samples_split': 14, 'min_samples_leaf': 2, 'subsample': 0.9154254627119461, 'max_features': 'log2'}. Best is trial 603 with value: 0.45955205541891275.
[I 2024-12-04 15:00:28,020] Trial 918 finished with value: 0.9718932255841928 and parameters: {'n_estimators': 369, 'learning_rate': 0.015609902105140423, 'max_depth': 6, 'min_samples_split': 3, 'min_samples_leaf': 3, 'subsample': 0.8752981669559853, 'max_features': 'log2'}. Best is trial 603 with value: 0.45955205541891275.
[I 2024-12-04 15:00:30,197] Trial 888 finished with value: 0.48989272691175545 and parameters: {'n_estimators': 1479, 'learning_rate': 0.05187013223265882, 'max_depth': 11, 'min_samples_split': 20, 'min_samples_leaf': 1, 'subsample': 0.9762010360856155, 'max_features': None}. Best is trial 603 with value: 0.45955205541891275.
[I 2024-12-04 15:00:32,484] Trial 891 finished with value: 0.6110218920383027 and parameters: {'n_estimators': 1486, 'learning_rate': 0.04545806868523233, 'max_depth': 12, 'min_samples_split': 19, 'min_samples_leaf': 2, 'subsample': 0.9868927395753937, 'max_features': None}. Best is trial 603 with value: 0.45955205541891275.
[I 2024-12-04 15:00:32,488] Trial 899 finished with value: 0.7239780347116257 and parameters: {'n_estimators': 1356, 'learning_rate': 0.018318579610357707, 'max_depth': 4, 'min_samples_split': 7, 'min_samples_leaf': 10, 'subsample': 0.966899182277883, 'max_features': None}. Best is trial 603 with value: 0.45955205541891275.
[I 2024-12-04 15:00:32,549] Trial 898 finished with value: 0.4704337086318877 and parameters: {'n_estimators': 1208, 'learning_rate': 0.05981693204979902, 'max_depth': 12, 'min_samples_split': 20, 'min_samples_leaf': 1, 'subsample': 0.9897309703523746, 'max_features': None}. Best is trial 603 with value: 0.45955205541891275.
[I 2024-12-04 15:00:35,080] Trial 903 finished with value: 0.47714794210968287 and parameters: {'n_estimators': 1104, 'learning_rate': 0.09954640830907074, 'max_depth': 12, 'min_samples_split': 17, 'min_samples_leaf': 1, 'subsample': 0.9953754597908205, 'max_features': None}. Best is trial 603 with value: 0.45955205541891275.
[I 2024-12-04 15:00:36,222] Trial 908 finished with value: 0.6470826799585527 and parameters: {'n_estimators': 1070, 'learning_rate': 0.07496507680353584, 'max_depth': 10, 'min_samples_split': 20, 'min_samples_leaf': 3, 'subsample': 0.9358291095098434, 'max_features': None}. Best is trial 603 with value: 0.45955205541891275.
[I 2024-12-04 15:00:36,306] Trial 893 finished with value: 0.4775856668807804 and parameters: {'n_estimators': 1499, 'learning_rate': 0.07652935007373823, 'max_depth': 12, 'min_samples_split': 19, 'min_samples_leaf': 1, 'subsample': 0.9986914266098466, 'max_features': None}. Best is trial 603 with value: 0.45955205541891275.
[I 2024-12-04 15:00:37,316] Trial 897 finished with value: 0.48713697005815876 and parameters: {'n_estimators': 1353, 'learning_rate': 0.06610811603385763, 'max_depth': 12, 'min_samples_split': 17, 'min_samples_leaf': 1, 'subsample': 0.9811512188487866, 'max_features': None}. Best is trial 603 with value: 0.45955205541891275.
[I 2024-12-04 15:00:39,697] Trial 904 finished with value: 0.47900291986235216 and parameters: {'n_estimators': 1223, 'learning_rate': 0.05924245009533414, 'max_depth': 12, 'min_samples_split': 17, 'min_samples_leaf': 1, 'subsample': 0.9356149171100429, 'max_features': None}. Best is trial 603 with value: 0.45955205541891275.
[I 2024-12-04 15:00:40,563] Trial 896 finished with value: 0.5259332696874247 and parameters: {'n_estimators': 1495, 'learning_rate': 0.04626369190037088, 'max_depth': 11, 'min_samples_split': 15, 'min_samples_leaf': 1, 'subsample': 0.9275164462515599, 'max_features': None}. Best is trial 603 with value: 0.45955205541891275.
[I 2024-12-04 15:00:40,740] Trial 902 finished with value: 0.5165566675900318 and parameters: {'n_estimators': 1258, 'learning_rate': 0.07929344355775293, 'max_depth': 12, 'min_samples_split': 16, 'min_samples_leaf': 1, 'subsample': 0.9711996230978753, 'max_features': None}. Best is trial 603 with value: 0.45955205541891275.
[I 2024-12-04 15:00:41,334] Trial 901 finished with value: 0.49026493787232717 and parameters: {'n_estimators': 1374, 'learning_rate': 0.0671651509884264, 'max_depth': 12, 'min_samples_split': 17, 'min_samples_leaf': 1, 'subsample': 0.9181913006680344, 'max_features': None}. Best is trial 603 with value: 0.45955205541891275.
[I 2024-12-04 15:00:41,596] Trial 900 finished with value: 0.46632923523200775 and parameters: {'n_estimators': 1342, 'learning_rate': 0.052726648975479906, 'max_depth': 12, 'min_samples_split': 19, 'min_samples_leaf': 1, 'subsample': 0.9959742895127909, 'max_features': None}. Best is trial 603 with value: 0.45955205541891275.
[I 2024-12-04 15:00:44,523] Trial 907 finished with value: 0.6426122549002252 and parameters: {'n_estimators': 1394, 'learning_rate': 0.03340978390981807, 'max_depth': 12, 'min_samples_split': 15, 'min_samples_leaf': 3, 'subsample': 0.8124725422834156, 'max_features': None}. Best is trial 603 with value: 0.45955205541891275.
[I 2024-12-04 15:00:45,049] Trial 929 finished with value: 1.0281420925459275 and parameters: {'n_estimators': 256, 'learning_rate': 0.014834018303790485, 'max_depth': 12, 'min_samples_split': 2, 'min_samples_leaf': 10, 'subsample': 0.893770586791757, 'max_features': 'sqrt'}. Best is trial 603 with value: 0.45955205541891275.
[I 2024-12-04 15:00:46,317] Trial 914 finished with value: 0.5590237526849263 and parameters: {'n_estimators': 1099, 'learning_rate': 0.0566821137839788, 'max_depth': 12, 'min_samples_split': 18, 'min_samples_leaf': 1, 'subsample': 0.9716078422670718, 'max_features': 'sqrt'}. Best is trial 603 with value: 0.45955205541891275.
[I 2024-12-04 15:00:46,445] Trial 906 finished with value: 0.5188193344585473 and parameters: {'n_estimators': 1422, 'learning_rate': 0.09559118820010676, 'max_depth': 12, 'min_samples_split': 16, 'min_samples_leaf': 1, 'subsample': 0.8539584388005037, 'max_features': None}. Best is trial 603 with value: 0.45955205541891275.
[I 2024-12-04 15:00:46,985] Trial 921 finished with value: 0.6505290960685101 and parameters: {'n_estimators': 904, 'learning_rate': 0.046063811292589116, 'max_depth': 11, 'min_samples_split': 16, 'min_samples_leaf': 4, 'subsample': 0.9851979994729113, 'max_features': 'log2'}. Best is trial 603 with value: 0.45955205541891275.
[I 2024-12-04 15:00:48,595] Trial 905 finished with value: 0.6409636271083703 and parameters: {'n_estimators': 1458, 'learning_rate': 0.09814601239074722, 'max_depth': 12, 'min_samples_split': 19, 'min_samples_leaf': 2, 'subsample': 0.9925836795938848, 'max_features': None}. Best is trial 603 with value: 0.45955205541891275.
[I 2024-12-04 15:00:49,449] Trial 928 finished with value: 0.6686770512828282 and parameters: {'n_estimators': 559, 'learning_rate': 0.01880210517356628, 'max_depth': 10, 'min_samples_split': 14, 'min_samples_leaf': 5, 'subsample': 0.8457143081273023, 'max_features': 'sqrt'}. Best is trial 603 with value: 0.45955205541891275.
[I 2024-12-04 15:00:51,203] Trial 931 finished with value: 1.1325758110611728 and parameters: {'n_estimators': 484, 'learning_rate': 0.014413921242104282, 'max_depth': 10, 'min_samples_split': 17, 'min_samples_leaf': 8, 'subsample': 0.9995365002171124, 'max_features': 'log2'}. Best is trial 603 with value: 0.45955205541891275.
[I 2024-12-04 15:00:52,020] Trial 910 finished with value: 0.4989054747321731 and parameters: {'n_estimators': 1327, 'learning_rate': 0.06566633755625856, 'max_depth': 11, 'min_samples_split': 20, 'min_samples_leaf': 1, 'subsample': 0.9110060251373874, 'max_features': None}. Best is trial 603 with value: 0.45955205541891275.
[I 2024-12-04 15:00:52,753] Trial 911 finished with value: 0.46196555018006646 and parameters: {'n_estimators': 1324, 'learning_rate': 0.09466627518883168, 'max_depth': 12, 'min_samples_split': 18, 'min_samples_leaf': 1, 'subsample': 0.9912295080536767, 'max_features': None}. Best is trial 603 with value: 0.45955205541891275.
[I 2024-12-04 15:00:57,103] Trial 912 finished with value: 0.6376644929322854 and parameters: {'n_estimators': 1443, 'learning_rate': 0.047294006850909585, 'max_depth': 12, 'min_samples_split': 20, 'min_samples_leaf': 3, 'subsample': 0.980671421336964, 'max_features': None}. Best is trial 603 with value: 0.45955205541891275.
[I 2024-12-04 15:00:57,598] Trial 920 finished with value: 0.8229563565328962 and parameters: {'n_estimators': 1354, 'learning_rate': 0.033139193795935835, 'max_depth': 4, 'min_samples_split': 4, 'min_samples_leaf': 9, 'subsample': 0.9706759867971352, 'max_features': 'log2'}. Best is trial 603 with value: 0.45955205541891275.
[I 2024-12-04 15:00:58,411] Trial 930 finished with value: 0.611837541946988 and parameters: {'n_estimators': 732, 'learning_rate': 0.03511056573814313, 'max_depth': 11, 'min_samples_split': 2, 'min_samples_leaf': 4, 'subsample': 0.9278750149496814, 'max_features': 'sqrt'}. Best is trial 603 with value: 0.45955205541891275.
[I 2024-12-04 15:00:59,294] Trial 916 finished with value: 0.8329726259908953 and parameters: {'n_estimators': 1499, 'learning_rate': 0.069041921642682, 'max_depth': 5, 'min_samples_split': 4, 'min_samples_leaf': 10, 'subsample': 0.664212991865905, 'max_features': 'log2'}. Best is trial 603 with value: 0.45955205541891275.
[I 2024-12-04 15:01:00,008] Trial 919 finished with value: 0.500130726770321 and parameters: {'n_estimators': 1172, 'learning_rate': 0.057047724858919194, 'max_depth': 12, 'min_samples_split': 17, 'min_samples_leaf': 1, 'subsample': 0.9890625319055967, 'max_features': None}. Best is trial 603 with value: 0.45955205541891275.
[I 2024-12-04 15:01:03,351] Trial 945 finished with value: 0.9946179330500227 and parameters: {'n_estimators': 441, 'learning_rate': 0.022849894337672146, 'max_depth': 9, 'min_samples_split': 12, 'min_samples_leaf': 5, 'subsample': 0.6659486161021414, 'max_features': 'log2'}. Best is trial 603 with value: 0.45955205541891275.
[I 2024-12-04 15:01:04,352] Trial 924 finished with value: 0.6421332832996174 and parameters: {'n_estimators': 1428, 'learning_rate': 0.05747142513635679, 'max_depth': 9, 'min_samples_split': 12, 'min_samples_leaf': 4, 'subsample': 0.993716816924596, 'max_features': 'log2'}. Best is trial 603 with value: 0.45955205541891275.
[I 2024-12-04 15:01:04,753] Trial 922 finished with value: 0.6389800043444163 and parameters: {'n_estimators': 1265, 'learning_rate': 0.06743300453710437, 'max_depth': 12, 'min_samples_split': 20, 'min_samples_leaf': 4, 'subsample': 0.977980813433573, 'max_features': None}. Best is trial 603 with value: 0.45955205541891275.
[I 2024-12-04 15:01:05,570] Trial 927 finished with value: 0.47851271882230517 and parameters: {'n_estimators': 1012, 'learning_rate': 0.06723904553880798, 'max_depth': 12, 'min_samples_split': 20, 'min_samples_leaf': 1, 'subsample': 0.9919961397192337, 'max_features': None}. Best is trial 603 with value: 0.45955205541891275.
[I 2024-12-04 15:01:06,283] Trial 915 finished with value: 0.4828179586023227 and parameters: {'n_estimators': 1482, 'learning_rate': 0.06777709360278016, 'max_depth': 10, 'min_samples_split': 20, 'min_samples_leaf': 1, 'subsample': 0.987233596126724, 'max_features': None}. Best is trial 603 with value: 0.45955205541891275.
[I 2024-12-04 15:01:08,604] Trial 923 finished with value: 0.6248130881441031 and parameters: {'n_estimators': 1358, 'learning_rate': 0.04666524356906657, 'max_depth': 12, 'min_samples_split': 17, 'min_samples_leaf': 3, 'subsample': 0.9994456435951463, 'max_features': None}. Best is trial 603 with value: 0.45955205541891275.
[I 2024-12-04 15:01:09,583] Trial 926 finished with value: 0.6275732480334046 and parameters: {'n_estimators': 1385, 'learning_rate': 0.0758060248200544, 'max_depth': 10, 'min_samples_split': 20, 'min_samples_leaf': 4, 'subsample': 0.9137244189068526, 'max_features': 'log2'}. Best is trial 603 with value: 0.45955205541891275.
[I 2024-12-04 15:01:09,647] Trial 917 finished with value: 0.4751585317383021 and parameters: {'n_estimators': 1495, 'learning_rate': 0.04977616720897074, 'max_depth': 12, 'min_samples_split': 17, 'min_samples_leaf': 1, 'subsample': 0.9650000110410663, 'max_features': None}. Best is trial 603 with value: 0.45955205541891275.
[I 2024-12-04 15:01:12,159] Trial 934 finished with value: 0.6327003259280143 and parameters: {'n_estimators': 1105, 'learning_rate': 0.018036921616786293, 'max_depth': 3, 'min_samples_split': 8, 'min_samples_leaf': 4, 'subsample': 0.6555084283131174, 'max_features': 'sqrt'}. Best is trial 603 with value: 0.45955205541891275.
[I 2024-12-04 15:01:13,339] Trial 932 finished with value: 0.5673771595890632 and parameters: {'n_estimators': 1225, 'learning_rate': 0.07086920821823603, 'max_depth': 10, 'min_samples_split': 19, 'min_samples_leaf': 1, 'subsample': 0.9868151208333976, 'max_features': 'log2'}. Best is trial 603 with value: 0.45955205541891275.
[I 2024-12-04 15:01:15,041] Trial 942 finished with value: 0.8203470780954915 and parameters: {'n_estimators': 951, 'learning_rate': 0.03294161830010546, 'max_depth': 3, 'min_samples_split': 3, 'min_samples_leaf': 9, 'subsample': 0.7190257204713828, 'max_features': 'sqrt'}. Best is trial 603 with value: 0.45955205541891275.
[I 2024-12-04 15:01:16,944] Trial 925 finished with value: 0.6549281867704139 and parameters: {'n_estimators': 1473, 'learning_rate': 0.08912591126437304, 'max_depth': 10, 'min_samples_split': 17, 'min_samples_leaf': 2, 'subsample': 0.9789984907181734, 'max_features': None}. Best is trial 603 with value: 0.45955205541891275.
[I 2024-12-04 15:01:19,641] Trial 933 finished with value: 0.4716467662687729 and parameters: {'n_estimators': 1149, 'learning_rate': 0.06129255265649674, 'max_depth': 12, 'min_samples_split': 19, 'min_samples_leaf': 1, 'subsample': 0.9946088208395628, 'max_features': None}. Best is trial 603 with value: 0.45955205541891275.
[I 2024-12-04 15:01:20,322] Trial 935 finished with value: 0.6420680879708982 and parameters: {'n_estimators': 1183, 'learning_rate': 0.053835274811351225, 'max_depth': 12, 'min_samples_split': 19, 'min_samples_leaf': 3, 'subsample': 0.9351804096365778, 'max_features': None}. Best is trial 603 with value: 0.45955205541891275.
[I 2024-12-04 15:01:21,174] Trial 940 finished with value: 0.48091145878016456 and parameters: {'n_estimators': 1043, 'learning_rate': 0.053973072705593365, 'max_depth': 11, 'min_samples_split': 19, 'min_samples_leaf': 1, 'subsample': 0.985797699034233, 'max_features': None}. Best is trial 603 with value: 0.45955205541891275.
